[32m[I 2023-04-23 18:43:13,382][39m A new study created in memory with name: no-name-2efbc8e3-cab8-4973-a03b-b390329d1dbe
[32m[I 2023-04-23 18:43:14,024][39m Trial 0 finished with value: 0.8131868131868132 and parameters: {'objective': 'Logloss', 'colsample_bylevel': 0.09252878349311557, 'depth': 7, 'boosting_type': 'Plain', 'bootstrap_type': 'Bernoulli', 'subsample': 0.22900299744004346}. Best is trial 0 with value: 0.8131868131868132.
[32m[I 2023-04-23 18:43:17,219][39m Trial 1 finished with value: 0.7676767676767676 and parameters: {'objective': 'Logloss', 'colsample_bylevel': 0.0692916169781656, 'depth': 2, 'boosting_type': 'Ordered', 'bootstrap_type': 'MVS'}. Best is trial 0 with value: 0.8131868131868132.
[32m[I 2023-04-23 18:43:18,613][39m Trial 2 finished with value: 0.8139534883720929 and parameters: {'objective': 'CrossEntropy', 'colsample_bylevel': 0.09444490232543302, 'depth': 6, 'boosting_type': 'Plain', 'bootstrap_type': 'MVS'}. Best is trial 2 with value: 0.8139534883720929.
[32m[I 2023-04-23 18:43:23,058][39m Trial 3 finished with value: 0.7676767676767676 and parameters: {'objective': 'Logloss', 'colsample_bylevel': 0.041421725209199595, 'depth': 4, 'boosting_type': 'Ordered', 'bootstrap_type': 'MVS'}. Best is trial 2 with value: 0.8139534883720929.
[32m[I 2023-04-23 18:43:24,334][39m Trial 4 finished with value: 0.7676767676767676 and parameters: {'objective': 'Logloss', 'colsample_bylevel': 0.04772527270431197, 'depth': 7, 'boosting_type': 'Plain', 'bootstrap_type': 'Bernoulli', 'subsample': 0.923415121904771}. Best is trial 2 with value: 0.8139534883720929.
[32m[I 2023-04-23 18:43:25,418][39m Trial 5 finished with value: 0.7835051546391752 and parameters: {'objective': 'CrossEntropy', 'colsample_bylevel': 0.029794006738130575, 'depth': 2, 'boosting_type': 'Plain', 'bootstrap_type': 'Bayesian', 'bagging_temperature': 4.555013893061785}. Best is trial 2 with value: 0.8139534883720929.
[32m[I 2023-04-23 18:43:31,601][39m Trial 6 finished with value: 0.7676767676767676 and parameters: {'objective': 'Logloss', 'colsample_bylevel': 0.06250965776195938, 'depth': 11, 'boosting_type': 'Ordered', 'bootstrap_type': 'Bernoulli', 'subsample': 0.1488450951898101}. Best is trial 2 with value: 0.8139534883720929.
[32m[I 2023-04-23 18:43:38,534][39m Trial 7 finished with value: 0.7916666666666667 and parameters: {'objective': 'Logloss', 'colsample_bylevel': 0.030285013673326443, 'depth': 5, 'boosting_type': 'Ordered', 'bootstrap_type': 'Bernoulli', 'subsample': 0.36754109746409525}. Best is trial 2 with value: 0.8139534883720929.
[32m[I 2023-04-23 18:43:39,283][39m Trial 8 finished with value: 0.717391304347826 and parameters: {'objective': 'CrossEntropy', 'colsample_bylevel': 0.013500777734247661, 'depth': 10, 'boosting_type': 'Plain', 'bootstrap_type': 'Bernoulli', 'subsample': 0.9909993426191687}. Best is trial 2 with value: 0.8139534883720929.
[32m[I 2023-04-23 18:43:40,178][39m Trial 9 finished with value: 0.7333333333333334 and parameters: {'objective': 'Logloss', 'colsample_bylevel': 0.019304160304439655, 'depth': 4, 'boosting_type': 'Plain', 'bootstrap_type': 'MVS'}. Best is trial 2 with value: 0.8139534883720929.
[32m[I 2023-04-23 18:43:41,257][39m Trial 10 finished with value: 0.8045977011494252 and parameters: {'objective': 'CrossEntropy', 'colsample_bylevel': 0.08560030636493064, 'depth': 9, 'boosting_type': 'Plain', 'bootstrap_type': 'Bayesian', 'bagging_temperature': 9.108489482240193}. Best is trial 2 with value: 0.8139534883720929.
[32m[I 2023-04-23 18:43:42,395][39m Trial 11 finished with value: 0.8045977011494252 and parameters: {'objective': 'CrossEntropy', 'colsample_bylevel': 0.09826849626657176, 'depth': 7, 'boosting_type': 'Plain', 'bootstrap_type': 'MVS'}. Best is trial 2 with value: 0.8139534883720929.
[32m[I 2023-04-23 18:43:43,631][39m Trial 12 finished with value: 0.8222222222222222 and parameters: {'objective': 'CrossEntropy', 'colsample_bylevel': 0.08197646234560965, 'depth': 8, 'boosting_type': 'Plain', 'bootstrap_type': 'MVS'}. Best is trial 12 with value: 0.8222222222222222.
[32m[I 2023-04-23 18:43:44,966][39m Trial 13 finished with value: 0.8222222222222222 and parameters: {'objective': 'CrossEntropy', 'colsample_bylevel': 0.07796057067962602, 'depth': 9, 'boosting_type': 'Plain', 'bootstrap_type': 'MVS'}. Best is trial 12 with value: 0.8222222222222222.
[32m[I 2023-04-23 18:43:46,172][39m Trial 14 finished with value: 0.8314606741573034 and parameters: {'objective': 'CrossEntropy', 'colsample_bylevel': 0.07691199797077701, 'depth': 12, 'boosting_type': 'Plain', 'bootstrap_type': 'MVS'}. Best is trial 14 with value: 0.8314606741573034.
[32m[I 2023-04-23 18:43:47,184][39m Trial 15 finished with value: 0.8131868131868132 and parameters: {'objective': 'CrossEntropy', 'colsample_bylevel': 0.07657680502337941, 'depth': 12, 'boosting_type': 'Plain', 'bootstrap_type': 'MVS'}. Best is trial 14 with value: 0.8314606741573034.
[32m[I 2023-04-23 18:43:48,117][39m Trial 16 finished with value: 0.8222222222222222 and parameters: {'objective': 'CrossEntropy', 'colsample_bylevel': 0.06089086758460457, 'depth': 12, 'boosting_type': 'Plain', 'bootstrap_type': 'MVS'}. Best is trial 14 with value: 0.8314606741573034.
[32m[I 2023-04-23 18:43:49,060][39m Trial 17 finished with value: 0.7755102040816327 and parameters: {'objective': 'CrossEntropy', 'colsample_bylevel': 0.05709425958631818, 'depth': 12, 'boosting_type': 'Plain', 'bootstrap_type': 'Bayesian', 'bagging_temperature': 1.4989804841955228}. Best is trial 14 with value: 0.8314606741573034.
[32m[I 2023-04-23 18:43:55,629][39m Trial 18 finished with value: 0.8222222222222222 and parameters: {'objective': 'CrossEntropy', 'colsample_bylevel': 0.07216307771367803, 'depth': 10, 'boosting_type': 'Ordered', 'bootstrap_type': 'MVS'}. Best is trial 14 with value: 0.8314606741573034.
[32m[I 2023-04-23 18:44:04,330][39m Trial 19 finished with value: 0.8222222222222222 and parameters: {'objective': 'CrossEntropy', 'colsample_bylevel': 0.0705519154909836, 'depth': 10, 'boosting_type': 'Ordered', 'bootstrap_type': 'MVS'}. Best is trial 14 with value: 0.8314606741573034.
[32m[I 2023-04-23 18:44:11,796][39m Trial 20 finished with value: 0.7676767676767676 and parameters: {'objective': 'CrossEntropy', 'colsample_bylevel': 0.04706991882304913, 'depth': 10, 'boosting_type': 'Ordered', 'bootstrap_type': 'Bayesian', 'bagging_temperature': 9.46455316538215}. Best is trial 14 with value: 0.8314606741573034.
[32m[I 2023-04-23 18:44:18,342][39m Trial 21 finished with value: 0.8222222222222222 and parameters: {'objective': 'CrossEntropy', 'colsample_bylevel': 0.06417214802791904, 'depth': 12, 'boosting_type': 'Ordered', 'bootstrap_type': 'MVS'}. Best is trial 14 with value: 0.8314606741573034.
[32m[I 2023-04-23 18:44:26,124][39m Trial 22 finished with value: 0.8222222222222222 and parameters: {'objective': 'CrossEntropy', 'colsample_bylevel': 0.06631330313130797, 'depth': 11, 'boosting_type': 'Ordered', 'bootstrap_type': 'MVS'}. Best is trial 14 with value: 0.8314606741573034.
[32m[I 2023-04-23 18:44:35,702][39m Trial 23 finished with value: 0.8043478260869564 and parameters: {'objective': 'CrossEntropy', 'colsample_bylevel': 0.0691167829908721, 'depth': 11, 'boosting_type': 'Ordered', 'bootstrap_type': 'MVS'}. Best is trial 14 with value: 0.8314606741573034.
[32m[I 2023-04-23 18:44:42,963][39m Trial 24 finished with value: 0.8131868131868132 and parameters: {'objective': 'CrossEntropy', 'colsample_bylevel': 0.08747428927881198, 'depth': 12, 'boosting_type': 'Ordered', 'bootstrap_type': 'MVS'}. Best is trial 14 with value: 0.8314606741573034.
[32m[I 2023-04-23 18:44:44,366][39m Trial 25 finished with value: 0.8131868131868132 and parameters: {'objective': 'CrossEntropy', 'colsample_bylevel': 0.08206216099276635, 'depth': 8, 'boosting_type': 'Plain', 'bootstrap_type': 'MVS'}. Best is trial 14 with value: 0.8314606741573034.
[32m[I 2023-04-23 18:44:45,536][39m Trial 26 finished with value: 0.8222222222222222 and parameters: {'objective': 'CrossEntropy', 'colsample_bylevel': 0.07905888468871866, 'depth': 9, 'boosting_type': 'Plain', 'bootstrap_type': 'MVS'}. Best is trial 14 with value: 0.8314606741573034.
[32m[I 2023-04-23 18:44:46,861][39m Trial 27 finished with value: 0.7835051546391752 and parameters: {'objective': 'CrossEntropy', 'colsample_bylevel': 0.05152072313079727, 'depth': 11, 'boosting_type': 'Plain', 'bootstrap_type': 'MVS'}. Best is trial 14 with value: 0.8314606741573034.
[32m[I 2023-04-23 18:44:52,964][39m Trial 28 finished with value: 0.8222222222222222 and parameters: {'objective': 'CrossEntropy', 'colsample_bylevel': 0.08835072108313927, 'depth': 9, 'boosting_type': 'Ordered', 'bootstrap_type': 'Bayesian', 'bagging_temperature': 0.13194970288934726}. Best is trial 14 with value: 0.8314606741573034.
[32m[I 2023-04-23 18:44:54,757][39m Trial 29 finished with value: 0.8222222222222222 and parameters: {'objective': 'CrossEntropy', 'colsample_bylevel': 0.07565116817862141, 'depth': 11, 'boosting_type': 'Plain', 'bootstrap_type': 'MVS'}. Best is trial 14 with value: 0.8314606741573034.
[32m[I 2023-04-23 18:44:56,816][39m Trial 30 finished with value: 0.8045977011494252 and parameters: {'objective': 'CrossEntropy', 'colsample_bylevel': 0.09953017023970827, 'depth': 8, 'boosting_type': 'Plain', 'bootstrap_type': 'Bernoulli', 'subsample': 0.6409319374979785}. Best is trial 14 with value: 0.8314606741573034.
[32m[I 2023-04-23 18:45:03,173][39m Trial 31 finished with value: 0.8222222222222222 and parameters: {'objective': 'CrossEntropy', 'colsample_bylevel': 0.09077176549755246, 'depth': 9, 'boosting_type': 'Ordered', 'bootstrap_type': 'Bayesian', 'bagging_temperature': 0.05400421209995733}. Best is trial 14 with value: 0.8314606741573034.
[32m[I 2023-04-23 18:45:09,551][39m Trial 32 finished with value: 0.8222222222222222 and parameters: {'objective': 'CrossEntropy', 'colsample_bylevel': 0.09007510325044482, 'depth': 9, 'boosting_type': 'Ordered', 'bootstrap_type': 'Bayesian', 'bagging_temperature': 0.08038811501711692}. Best is trial 14 with value: 0.8314606741573034.
[32m[I 2023-04-23 18:45:11,019][39m Trial 33 finished with value: 0.8172043010752689 and parameters: {'objective': 'CrossEntropy', 'colsample_bylevel': 0.05633851079202746, 'depth': 11, 'boosting_type': 'Plain', 'bootstrap_type': 'Bayesian', 'bagging_temperature': 4.032430513884814}. Best is trial 14 with value: 0.8314606741573034.
[32m[I 2023-04-23 18:45:13,030][39m Trial 34 finished with value: 0.8222222222222222 and parameters: {'objective': 'Logloss', 'colsample_bylevel': 0.07370098686103146, 'depth': 12, 'boosting_type': 'Plain', 'bootstrap_type': 'Bayesian', 'bagging_temperature': 7.156903627973257}. Best is trial 14 with value: 0.8314606741573034.
[32m[I 2023-04-23 18:45:19,148][39m Trial 35 finished with value: 0.7916666666666667 and parameters: {'objective': 'Logloss', 'colsample_bylevel': 0.07158369147771149, 'depth': 10, 'boosting_type': 'Ordered', 'bootstrap_type': 'Bayesian', 'bagging_temperature': 7.1397336329790635}. Best is trial 14 with value: 0.8314606741573034.
[32m[I 2023-04-23 18:45:25,453][39m Trial 36 finished with value: 0.8131868131868132 and parameters: {'objective': 'CrossEntropy', 'colsample_bylevel': 0.09462442689389576, 'depth': 6, 'boosting_type': 'Ordered', 'bootstrap_type': 'Bayesian', 'bagging_temperature': 2.190376789810097}. Best is trial 14 with value: 0.8314606741573034.
[32m[I 2023-04-23 18:45:33,054][39m Trial 37 finished with value: 0.8043478260869564 and parameters: {'objective': 'CrossEntropy', 'colsample_bylevel': 0.06584710357794284, 'depth': 10, 'boosting_type': 'Ordered', 'bootstrap_type': 'MVS'}. Best is trial 14 with value: 0.8314606741573034.
[32m[I 2023-04-23 18:45:39,083][39m Trial 38 finished with value: 0.7333333333333334 and parameters: {'objective': 'CrossEntropy', 'colsample_bylevel': 0.06188393160227002, 'depth': 1, 'boosting_type': 'Ordered', 'bootstrap_type': 'MVS'}. Best is trial 14 with value: 0.8314606741573034.
[32m[I 2023-04-23 18:45:46,962][39m Trial 39 finished with value: 0.8000000000000002 and parameters: {'objective': 'Logloss', 'colsample_bylevel': 0.06736494899736833, 'depth': 11, 'boosting_type': 'Ordered', 'bootstrap_type': 'MVS'}. Best is trial 14 with value: 0.8314606741573034.
[32m[I 2023-04-23 18:45:53,733][39m Trial 40 finished with value: 0.7835051546391752 and parameters: {'objective': 'CrossEntropy', 'colsample_bylevel': 0.041496018257280054, 'depth': 12, 'boosting_type': 'Ordered', 'bootstrap_type': 'MVS'}. Best is trial 14 with value: 0.8314606741573034.
[32m[I 2023-04-23 18:46:00,406][39m Trial 41 finished with value: 0.8222222222222222 and parameters: {'objective': 'CrossEntropy', 'colsample_bylevel': 0.08273255458116817, 'depth': 11, 'boosting_type': 'Ordered', 'bootstrap_type': 'MVS'}. Best is trial 14 with value: 0.8314606741573034.
[32m[I 2023-04-23 18:46:06,611][39m Trial 42 finished with value: 0.8043478260869564 and parameters: {'objective': 'CrossEntropy', 'colsample_bylevel': 0.05944495695285265, 'depth': 12, 'boosting_type': 'Ordered', 'bootstrap_type': 'MVS'}. Best is trial 14 with value: 0.8314606741573034.
[32m[I 2023-04-23 18:46:14,488][39m Trial 43 finished with value: 0.8043478260869564 and parameters: {'objective': 'CrossEntropy', 'colsample_bylevel': 0.06362744801982952, 'depth': 11, 'boosting_type': 'Ordered', 'bootstrap_type': 'MVS'}. Best is trial 14 with value: 0.8314606741573034.
[32m[I 2023-04-23 18:46:15,885][39m Trial 44 finished with value: 0.7872340425531914 and parameters: {'objective': 'CrossEntropy', 'colsample_bylevel': 0.05178937400357907, 'depth': 12, 'boosting_type': 'Plain', 'bootstrap_type': 'Bernoulli', 'subsample': 0.6301589426206924}. Best is trial 14 with value: 0.8314606741573034.
[32m[I 2023-04-23 18:46:17,286][39m Trial 45 finished with value: 0.8131868131868132 and parameters: {'objective': 'Logloss', 'colsample_bylevel': 0.07778782331758177, 'depth': 12, 'boosting_type': 'Plain', 'bootstrap_type': 'MVS'}. Best is trial 14 with value: 0.8314606741573034.
[32m[I 2023-04-23 18:46:18,536][39m Trial 46 finished with value: 0.8222222222222222 and parameters: {'objective': 'CrossEntropy', 'colsample_bylevel': 0.06121676040415967, 'depth': 5, 'boosting_type': 'Plain', 'bootstrap_type': 'MVS'}. Best is trial 14 with value: 0.8314606741573034.
[32m[I 2023-04-23 18:46:19,891][39m Trial 47 finished with value: 0.8222222222222222 and parameters: {'objective': 'CrossEntropy', 'colsample_bylevel': 0.07135240961323011, 'depth': 6, 'boosting_type': 'Plain', 'bootstrap_type': 'MVS'}. Best is trial 14 with value: 0.8314606741573034.
[32m[I 2023-04-23 18:46:21,357][39m Trial 48 finished with value: 0.8314606741573034 and parameters: {'objective': 'CrossEntropy', 'colsample_bylevel': 0.07416274375427873, 'depth': 5, 'boosting_type': 'Plain', 'bootstrap_type': 'MVS'}. Best is trial 14 with value: 0.8314606741573034.
[32m[I 2023-04-23 18:46:22,932][39m Trial 49 finished with value: 0.8043478260869564 and parameters: {'objective': 'CrossEntropy', 'colsample_bylevel': 0.07148270920623986, 'depth': 3, 'boosting_type': 'Plain', 'bootstrap_type': 'Bernoulli', 'subsample': 0.7798244171945307}. Best is trial 14 with value: 0.8314606741573034.
[32m[I 2023-04-23 18:46:31,446][39m Trial 50 finished with value: 0.8043478260869564 and parameters: {'objective': 'Logloss', 'colsample_bylevel': 0.08316272870269387, 'depth': 4, 'boosting_type': 'Ordered', 'bootstrap_type': 'MVS'}. Best is trial 14 with value: 0.8314606741573034.
[32m[I 2023-04-23 18:46:32,792][39m Trial 51 finished with value: 0.8139534883720929 and parameters: {'objective': 'CrossEntropy', 'colsample_bylevel': 0.09410858417061288, 'depth': 7, 'boosting_type': 'Plain', 'bootstrap_type': 'Bayesian', 'bagging_temperature': 0.3106833750904135}. Best is trial 14 with value: 0.8314606741573034.
[32m[I 2023-04-23 18:46:33,890][39m Trial 52 finished with value: 0.8222222222222222 and parameters: {'objective': 'CrossEntropy', 'colsample_bylevel': 0.07592010420877683, 'depth': 5, 'boosting_type': 'Plain', 'bootstrap_type': 'MVS'}. Best is trial 14 with value: 0.8314606741573034.
[32m[I 2023-04-23 18:46:35,292][39m Trial 53 finished with value: 0.8222222222222222 and parameters: {'objective': 'CrossEntropy', 'colsample_bylevel': 0.0816147957188675, 'depth': 5, 'boosting_type': 'Plain', 'bootstrap_type': 'MVS'}. Best is trial 14 with value: 0.8314606741573034.
[32m[I 2023-04-23 18:46:36,939][39m Trial 54 finished with value: 0.8314606741573034 and parameters: {'objective': 'CrossEntropy', 'colsample_bylevel': 0.07963226764089615, 'depth': 5, 'boosting_type': 'Plain', 'bootstrap_type': 'MVS'}. Best is trial 14 with value: 0.8314606741573034.
[32m[I 2023-04-23 18:46:43,543][39m Trial 55 finished with value: 0.8131868131868132 and parameters: {'objective': 'CrossEntropy', 'colsample_bylevel': 0.08571831555196027, 'depth': 4, 'boosting_type': 'Ordered', 'bootstrap_type': 'MVS'}. Best is trial 14 with value: 0.8314606741573034.
[32m[I 2023-04-23 18:46:45,006][39m Trial 56 finished with value: 0.8131868131868132 and parameters: {'objective': 'CrossEntropy', 'colsample_bylevel': 0.07536169355340025, 'depth': 7, 'boosting_type': 'Plain', 'bootstrap_type': 'Bernoulli', 'subsample': 0.42678530964607364}. Best is trial 14 with value: 0.8314606741573034.
[32m[I 2023-04-23 18:46:46,565][39m Trial 57 finished with value: 0.8131868131868132 and parameters: {'objective': 'CrossEntropy', 'colsample_bylevel': 0.08857188060009019, 'depth': 3, 'boosting_type': 'Plain', 'bootstrap_type': 'Bayesian', 'bagging_temperature': 2.5616577488732477}. Best is trial 14 with value: 0.8314606741573034.
[32m[I 2023-04-23 18:46:48,254][39m Trial 58 finished with value: 0.8222222222222222 and parameters: {'objective': 'CrossEntropy', 'colsample_bylevel': 0.09112264456163124, 'depth': 6, 'boosting_type': 'Plain', 'bootstrap_type': 'Bayesian', 'bagging_temperature': 3.24083661771157}. Best is trial 14 with value: 0.8314606741573034.
[32m[I 2023-04-23 18:46:49,670][39m Trial 59 finished with value: 0.8043478260869564 and parameters: {'objective': 'CrossEntropy', 'colsample_bylevel': 0.06552770656208651, 'depth': 5, 'boosting_type': 'Plain', 'bootstrap_type': 'MVS'}. Best is trial 14 with value: 0.8314606741573034.
[32m[I 2023-04-23 18:46:51,168][39m Trial 60 finished with value: 0.8131868131868132 and parameters: {'objective': 'CrossEntropy', 'colsample_bylevel': 0.07946139477724856, 'depth': 9, 'boosting_type': 'Plain', 'bootstrap_type': 'Bayesian', 'bagging_temperature': 1.2257629056441335}. Best is trial 14 with value: 0.8314606741573034.
[32m[I 2023-04-23 18:46:52,431][39m Trial 61 finished with value: 0.7954545454545454 and parameters: {'objective': 'CrossEntropy', 'colsample_bylevel': 0.087172554117676, 'depth': 8, 'boosting_type': 'Plain', 'bootstrap_type': 'Bayesian', 'bagging_temperature': 5.527402403316812}. Best is trial 14 with value: 0.8314606741573034.
[32m[I 2023-04-23 18:46:53,672][39m Trial 62 finished with value: 0.8314606741573034 and parameters: {'objective': 'CrossEntropy', 'colsample_bylevel': 0.09186144071635516, 'depth': 5, 'boosting_type': 'Plain', 'bootstrap_type': 'Bayesian', 'bagging_temperature': 0.10205854321392284}. Best is trial 14 with value: 0.8314606741573034.
[32m[I 2023-04-23 18:46:54,990][39m Trial 63 finished with value: 0.8222222222222222 and parameters: {'objective': 'CrossEntropy', 'colsample_bylevel': 0.07844504154373882, 'depth': 4, 'boosting_type': 'Plain', 'bootstrap_type': 'MVS'}. Best is trial 14 with value: 0.8314606741573034.
[32m[I 2023-04-23 18:46:56,156][39m Trial 64 finished with value: 0.8222222222222222 and parameters: {'objective': 'CrossEntropy', 'colsample_bylevel': 0.09473859758661472, 'depth': 3, 'boosting_type': 'Plain', 'bootstrap_type': 'MVS'}. Best is trial 14 with value: 0.8314606741573034.
[32m[I 2023-04-23 18:46:56,850][39m Trial 65 finished with value: 0.8139534883720929 and parameters: {'objective': 'CrossEntropy', 'colsample_bylevel': 0.0974578485702211, 'depth': 6, 'boosting_type': 'Plain', 'bootstrap_type': 'Bayesian', 'bagging_temperature': 0.01898948607249007}. Best is trial 14 with value: 0.8314606741573034.
[32m[I 2023-04-23 18:46:57,415][39m Trial 66 finished with value: 0.8045977011494252 and parameters: {'objective': 'CrossEntropy', 'colsample_bylevel': 0.09201443082410399, 'depth': 5, 'boosting_type': 'Plain', 'bootstrap_type': 'Bayesian', 'bagging_temperature': 1.4175214815365704}. Best is trial 14 with value: 0.8314606741573034.
[32m[I 2023-04-23 18:46:57,958][39m Trial 67 finished with value: 0.8043478260869564 and parameters: {'objective': 'Logloss', 'colsample_bylevel': 0.06852115107541361, 'depth': 12, 'boosting_type': 'Plain', 'bootstrap_type': 'MVS'}. Best is trial 14 with value: 0.8314606741573034.
[32m[I 2023-04-23 18:46:58,519][39m Trial 68 finished with value: 0.7291666666666666 and parameters: {'objective': 'CrossEntropy', 'colsample_bylevel': 0.022816962624435833, 'depth': 5, 'boosting_type': 'Plain', 'bootstrap_type': 'MVS'}. Best is trial 14 with value: 0.8314606741573034.
