[32m[I 2023-04-26 15:43:47,419][39m A new study created in memory with name: no-name-3d1571b9-d496-48e1-b069-8f1535f15990
[32m[I 2023-04-26 15:43:47,439][39m Trial 0 finished with value: 0.5892857142857143 and parameters: {'algorithm': 'kd_tree', 'n_neighbors': 19, 'weights': 'uniform', 'metric': 'manhattan'}. Best is trial 0 with value: 0.5892857142857143.
[32m[I 2023-04-26 15:43:47,452][39m Trial 1 finished with value: 0.6736842105263158 and parameters: {'algorithm': 'kd_tree', 'n_neighbors': 9, 'weights': 'distance', 'metric': 'manhattan'}. Best is trial 1 with value: 0.6736842105263158.
[32m[I 2023-04-26 15:43:47,462][39m Trial 2 finished with value: 0.6019417475728155 and parameters: {'algorithm': 'ball_tree', 'n_neighbors': 27, 'weights': 'distance', 'metric': 'manhattan'}. Best is trial 1 with value: 0.6736842105263158.
[32m[I 2023-04-26 15:43:47,522][39m Trial 3 finished with value: 0.5225225225225225 and parameters: {'algorithm': 'brute', 'n_neighbors': 26, 'weights': 'uniform', 'metric': 'euclidean'}. Best is trial 1 with value: 0.6736842105263158.
[32m[I 2023-04-26 15:43:47,532][39m Trial 4 finished with value: 0.627450980392157 and parameters: {'algorithm': 'auto', 'n_neighbors': 25, 'weights': 'distance', 'metric': 'manhattan'}. Best is trial 1 with value: 0.6736842105263158.
[32m[I 2023-04-26 15:43:47,548][39m Trial 5 finished with value: 0.42500000000000004 and parameters: {'algorithm': 'ball_tree', 'n_neighbors': 4, 'weights': 'uniform', 'metric': 'minkowski'}. Best is trial 1 with value: 0.6736842105263158.
[32m[I 2023-04-26 15:43:47,555][39m Trial 6 finished with value: 0.5961538461538461 and parameters: {'algorithm': 'auto', 'n_neighbors': 30, 'weights': 'distance', 'metric': 'minkowski'}. Best is trial 1 with value: 0.6736842105263158.
[32m[I 2023-04-26 15:43:47,605][39m Trial 7 finished with value: 0.6213592233009708 and parameters: {'algorithm': 'brute', 'n_neighbors': 23, 'weights': 'distance', 'metric': 'manhattan'}. Best is trial 1 with value: 0.6736842105263158.
[32m[I 2023-04-26 15:43:47,626][39m Trial 8 finished with value: 0.5961538461538461 and parameters: {'algorithm': 'kd_tree', 'n_neighbors': 30, 'weights': 'distance', 'metric': 'minkowski'}. Best is trial 1 with value: 0.6736842105263158.
[32m[I 2023-04-26 15:43:47,645][39m Trial 9 finished with value: 0.5660377358490567 and parameters: {'algorithm': 'kd_tree', 'n_neighbors': 7, 'weights': 'uniform', 'metric': 'manhattan'}. Best is trial 1 with value: 0.6736842105263158.
[32m[I 2023-04-26 15:43:47,661][39m Trial 10 finished with value: 0.6122448979591836 and parameters: {'algorithm': 'kd_tree', 'n_neighbors': 12, 'weights': 'distance', 'metric': 'euclidean'}. Best is trial 1 with value: 0.6736842105263158.
[32m[I 2023-04-26 15:43:47,676][39m Trial 11 finished with value: 0.6122448979591836 and parameters: {'algorithm': 'auto', 'n_neighbors': 14, 'weights': 'distance', 'metric': 'manhattan'}. Best is trial 1 with value: 0.6736842105263158.
[32m[I 2023-04-26 15:43:47,691][39m Trial 12 finished with value: 0.6666666666666666 and parameters: {'algorithm': 'auto', 'n_neighbors': 10, 'weights': 'distance', 'metric': 'manhattan'}. Best is trial 1 with value: 0.6736842105263158.
[32m[I 2023-04-26 15:43:47,704][39m Trial 13 finished with value: 0.6666666666666666 and parameters: {'algorithm': 'auto', 'n_neighbors': 10, 'weights': 'distance', 'metric': 'manhattan'}. Best is trial 1 with value: 0.6736842105263158.
[32m[I 2023-04-26 15:43:47,720][39m Trial 14 finished with value: 0.6222222222222223 and parameters: {'algorithm': 'auto', 'n_neighbors': 3, 'weights': 'distance', 'metric': 'manhattan'}. Best is trial 1 with value: 0.6736842105263158.
[32m[I 2023-04-26 15:43:47,737][39m Trial 15 finished with value: 0.5858585858585859 and parameters: {'algorithm': 'kd_tree', 'n_neighbors': 18, 'weights': 'distance', 'metric': 'euclidean'}. Best is trial 1 with value: 0.6736842105263158.
[32m[I 2023-04-26 15:43:47,753][39m Trial 16 finished with value: 0.6736842105263158 and parameters: {'algorithm': 'ball_tree', 'n_neighbors': 9, 'weights': 'distance', 'metric': 'manhattan'}. Best is trial 1 with value: 0.6736842105263158.
[32m[I 2023-04-26 15:43:47,772][39m Trial 17 finished with value: 0.6363636363636364 and parameters: {'algorithm': 'ball_tree', 'n_neighbors': 6, 'weights': 'distance', 'metric': 'manhattan'}. Best is trial 1 with value: 0.6736842105263158.
[32m[I 2023-04-26 15:43:47,803][39m Trial 18 finished with value: 0.5360824742268041 and parameters: {'algorithm': 'ball_tree', 'n_neighbors': 8, 'weights': 'uniform', 'metric': 'euclidean'}. Best is trial 1 with value: 0.6736842105263158.
[32m[I 2023-04-26 15:43:47,822][39m Trial 19 finished with value: 0.5977011494252873 and parameters: {'algorithm': 'ball_tree', 'n_neighbors': 1, 'weights': 'distance', 'metric': 'minkowski'}. Best is trial 1 with value: 0.6736842105263158.
[32m[I 2023-04-26 15:43:47,873][39m Trial 20 finished with value: 0.6262626262626262 and parameters: {'algorithm': 'brute', 'n_neighbors': 16, 'weights': 'distance', 'metric': 'manhattan'}. Best is trial 1 with value: 0.6736842105263158.
[32m[I 2023-04-26 15:43:47,900][39m Trial 21 finished with value: 0.6938775510204082 and parameters: {'algorithm': 'kd_tree', 'n_neighbors': 11, 'weights': 'distance', 'metric': 'manhattan'}. Best is trial 21 with value: 0.6938775510204082.
[32m[I 2023-04-26 15:43:47,917][39m Trial 22 finished with value: 0.6391752577319588 and parameters: {'algorithm': 'kd_tree', 'n_neighbors': 13, 'weights': 'distance', 'metric': 'manhattan'}. Best is trial 21 with value: 0.6938775510204082.
[32m[I 2023-04-26 15:43:47,932][39m Trial 23 finished with value: 0.6666666666666666 and parameters: {'algorithm': 'kd_tree', 'n_neighbors': 10, 'weights': 'distance', 'metric': 'manhattan'}. Best is trial 21 with value: 0.6938775510204082.
[32m[I 2023-04-26 15:43:47,948][39m Trial 24 finished with value: 0.6373626373626374 and parameters: {'algorithm': 'kd_tree', 'n_neighbors': 5, 'weights': 'distance', 'metric': 'manhattan'}. Best is trial 21 with value: 0.6938775510204082.
[32m[I 2023-04-26 15:43:47,962][39m Trial 25 finished with value: 0.6736842105263158 and parameters: {'algorithm': 'ball_tree', 'n_neighbors': 9, 'weights': 'distance', 'metric': 'manhattan'}. Best is trial 21 with value: 0.6938775510204082.
[32m[I 2023-04-26 15:43:47,983][39m Trial 26 finished with value: 0.6 and parameters: {'algorithm': 'kd_tree', 'n_neighbors': 15, 'weights': 'uniform', 'metric': 'manhattan'}. Best is trial 21 with value: 0.6938775510204082.
[32m[I 2023-04-26 15:43:47,999][39m Trial 27 finished with value: 0.6464646464646465 and parameters: {'algorithm': 'ball_tree', 'n_neighbors': 12, 'weights': 'distance', 'metric': 'manhattan'}. Best is trial 21 with value: 0.6938775510204082.
[32m[I 2023-04-26 15:43:48,018][39m Trial 28 finished with value: 0.5858585858585859 and parameters: {'algorithm': 'kd_tree', 'n_neighbors': 18, 'weights': 'distance', 'metric': 'euclidean'}. Best is trial 21 with value: 0.6938775510204082.
[32m[I 2023-04-26 15:43:48,048][39m Trial 29 finished with value: 0.5636363636363636 and parameters: {'algorithm': 'kd_tree', 'n_neighbors': 20, 'weights': 'uniform', 'metric': 'minkowski'}. Best is trial 21 with value: 0.6938775510204082.
[32m[I 2023-04-26 15:43:48,130][39m Trial 30 finished with value: 0.6190476190476191 and parameters: {'algorithm': 'brute', 'n_neighbors': 1, 'weights': 'distance', 'metric': 'manhattan'}. Best is trial 21 with value: 0.6938775510204082.
[32m[I 2023-04-26 15:43:48,162][39m Trial 31 finished with value: 0.6391752577319588 and parameters: {'algorithm': 'ball_tree', 'n_neighbors': 8, 'weights': 'distance', 'metric': 'manhattan'}. Best is trial 21 with value: 0.6938775510204082.
[32m[I 2023-04-26 15:43:48,181][39m Trial 32 finished with value: 0.6736842105263158 and parameters: {'algorithm': 'ball_tree', 'n_neighbors': 9, 'weights': 'distance', 'metric': 'manhattan'}. Best is trial 21 with value: 0.6938775510204082.
[32m[I 2023-04-26 15:43:48,197][39m Trial 33 finished with value: 0.6938775510204082 and parameters: {'algorithm': 'ball_tree', 'n_neighbors': 11, 'weights': 'distance', 'metric': 'manhattan'}. Best is trial 21 with value: 0.6938775510204082.
[32m[I 2023-04-26 15:43:48,214][39m Trial 34 finished with value: 0.6938775510204082 and parameters: {'algorithm': 'ball_tree', 'n_neighbors': 11, 'weights': 'distance', 'metric': 'manhattan'}. Best is trial 21 with value: 0.6938775510204082.
[32m[I 2023-04-26 15:43:48,227][39m Trial 35 finished with value: 0.6464646464646465 and parameters: {'algorithm': 'ball_tree', 'n_neighbors': 12, 'weights': 'distance', 'metric': 'manhattan'}. Best is trial 21 with value: 0.6938775510204082.
[32m[I 2023-04-26 15:43:48,251][39m Trial 36 finished with value: 0.6 and parameters: {'algorithm': 'ball_tree', 'n_neighbors': 15, 'weights': 'uniform', 'metric': 'manhattan'}. Best is trial 21 with value: 0.6938775510204082.
[32m[I 2023-04-26 15:43:48,277][39m Trial 37 finished with value: 0.6938775510204082 and parameters: {'algorithm': 'ball_tree', 'n_neighbors': 11, 'weights': 'distance', 'metric': 'manhattan'}. Best is trial 21 with value: 0.6938775510204082.
[32m[I 2023-04-26 15:43:48,305][39m Trial 38 finished with value: 0.6938775510204082 and parameters: {'algorithm': 'ball_tree', 'n_neighbors': 11, 'weights': 'distance', 'metric': 'manhattan'}. Best is trial 21 with value: 0.6938775510204082.
[32m[I 2023-04-26 15:43:48,333][39m Trial 39 finished with value: 0.631578947368421 and parameters: {'algorithm': 'ball_tree', 'n_neighbors': 16, 'weights': 'distance', 'metric': 'minkowski'}. Best is trial 21 with value: 0.6938775510204082.
[32m[I 2023-04-26 15:43:48,367][39m Trial 40 finished with value: 0.5486725663716815 and parameters: {'algorithm': 'ball_tree', 'n_neighbors': 21, 'weights': 'uniform', 'metric': 'euclidean'}. Best is trial 21 with value: 0.6938775510204082.
[32m[I 2023-04-26 15:43:48,392][39m Trial 41 finished with value: 0.6464646464646465 and parameters: {'algorithm': 'ball_tree', 'n_neighbors': 12, 'weights': 'distance', 'metric': 'manhattan'}. Best is trial 21 with value: 0.6938775510204082.
[32m[I 2023-04-26 15:43:48,420][39m Trial 42 finished with value: 0.6938775510204082 and parameters: {'algorithm': 'ball_tree', 'n_neighbors': 11, 'weights': 'distance', 'metric': 'manhattan'}. Best is trial 21 with value: 0.6938775510204082.
[32m[I 2023-04-26 15:43:48,446][39m Trial 43 finished with value: 0.6122448979591836 and parameters: {'algorithm': 'ball_tree', 'n_neighbors': 14, 'weights': 'distance', 'metric': 'manhattan'}. Best is trial 21 with value: 0.6938775510204082.
[32m[I 2023-04-26 15:43:48,523][39m Trial 44 finished with value: 0.6086956521739131 and parameters: {'algorithm': 'brute', 'n_neighbors': 7, 'weights': 'distance', 'metric': 'manhattan'}. Best is trial 21 with value: 0.6938775510204082.
[32m[I 2023-04-26 15:43:48,559][39m Trial 45 finished with value: 0.6391752577319588 and parameters: {'algorithm': 'ball_tree', 'n_neighbors': 13, 'weights': 'distance', 'metric': 'manhattan'}. Best is trial 21 with value: 0.6938775510204082.
[32m[I 2023-04-26 15:43:48,581][39m Trial 46 finished with value: 0.6938775510204082 and parameters: {'algorithm': 'ball_tree', 'n_neighbors': 11, 'weights': 'distance', 'metric': 'manhattan'}. Best is trial 21 with value: 0.6938775510204082.
[32m[I 2023-04-26 15:43:48,599][39m Trial 47 finished with value: 0.6262626262626262 and parameters: {'algorithm': 'ball_tree', 'n_neighbors': 17, 'weights': 'distance', 'metric': 'minkowski'}. Best is trial 21 with value: 0.6938775510204082.
[32m[I 2023-04-26 15:43:48,616][39m Trial 48 finished with value: 0.6122448979591836 and parameters: {'algorithm': 'ball_tree', 'n_neighbors': 14, 'weights': 'distance', 'metric': 'manhattan'}. Best is trial 21 with value: 0.6938775510204082.
[32m[I 2023-04-26 15:43:48,627][39m Trial 49 finished with value: 0.6363636363636364 and parameters: {'algorithm': 'auto', 'n_neighbors': 6, 'weights': 'distance', 'metric': 'manhattan'}. Best is trial 21 with value: 0.6938775510204082.
[32m[I 2023-04-26 15:43:48,682][39m Trial 50 finished with value: 0.6185567010309277 and parameters: {'algorithm': 'brute', 'n_neighbors': 11, 'weights': 'distance', 'metric': 'euclidean'}. Best is trial 21 with value: 0.6938775510204082.
[32m[I 2023-04-26 15:43:48,709][39m Trial 51 finished with value: 0.6938775510204082 and parameters: {'algorithm': 'ball_tree', 'n_neighbors': 11, 'weights': 'distance', 'metric': 'manhattan'}. Best is trial 21 with value: 0.6938775510204082.
[32m[I 2023-04-26 15:43:48,730][39m Trial 52 finished with value: 0.6391752577319588 and parameters: {'algorithm': 'ball_tree', 'n_neighbors': 8, 'weights': 'distance', 'metric': 'manhattan'}. Best is trial 21 with value: 0.6938775510204082.
[32m[I 2023-04-26 15:43:48,747][39m Trial 53 finished with value: 0.6391752577319588 and parameters: {'algorithm': 'ball_tree', 'n_neighbors': 13, 'weights': 'distance', 'metric': 'manhattan'}. Best is trial 21 with value: 0.6938775510204082.
[32m[I 2023-04-26 15:43:48,761][39m Trial 54 finished with value: 0.6666666666666666 and parameters: {'algorithm': 'ball_tree', 'n_neighbors': 10, 'weights': 'distance', 'metric': 'manhattan'}. Best is trial 21 with value: 0.6938775510204082.
[32m[I 2023-04-26 15:43:48,778][39m Trial 55 finished with value: 0.6938775510204082 and parameters: {'algorithm': 'ball_tree', 'n_neighbors': 11, 'weights': 'distance', 'metric': 'manhattan'}. Best is trial 21 with value: 0.6938775510204082.
[32m[I 2023-04-26 15:43:48,792][39m Trial 56 finished with value: 0.6363636363636364 and parameters: {'algorithm': 'ball_tree', 'n_neighbors': 6, 'weights': 'distance', 'metric': 'manhattan'}. Best is trial 21 with value: 0.6938775510204082.
[32m[I 2023-04-26 15:43:48,812][39m Trial 57 finished with value: 0.5263157894736843 and parameters: {'algorithm': 'auto', 'n_neighbors': 8, 'weights': 'uniform', 'metric': 'manhattan'}. Best is trial 21 with value: 0.6938775510204082.
[32m[I 2023-04-26 15:43:48,827][39m Trial 58 finished with value: 0.6666666666666666 and parameters: {'algorithm': 'kd_tree', 'n_neighbors': 10, 'weights': 'distance', 'metric': 'manhattan'}. Best is trial 21 with value: 0.6938775510204082.
[32m[I 2023-04-26 15:43:48,842][39m Trial 59 finished with value: 0.5454545454545454 and parameters: {'algorithm': 'ball_tree', 'n_neighbors': 4, 'weights': 'distance', 'metric': 'minkowski'}. Best is trial 21 with value: 0.6938775510204082.
[32m[I 2023-04-26 15:43:48,863][39m Trial 60 finished with value: 0.6019417475728155 and parameters: {'algorithm': 'kd_tree', 'n_neighbors': 27, 'weights': 'distance', 'metric': 'manhattan'}. Best is trial 21 with value: 0.6938775510204082.
[32m[I 2023-04-26 15:43:48,879][39m Trial 61 finished with value: 0.6938775510204082 and parameters: {'algorithm': 'ball_tree', 'n_neighbors': 11, 'weights': 'distance', 'metric': 'manhattan'}. Best is trial 21 with value: 0.6938775510204082.
[32m[I 2023-04-26 15:43:48,896][39m Trial 62 finished with value: 0.6391752577319588 and parameters: {'algorithm': 'ball_tree', 'n_neighbors': 13, 'weights': 'distance', 'metric': 'manhattan'}. Best is trial 21 with value: 0.6938775510204082.
[32m[I 2023-04-26 15:43:48,912][39m Trial 63 finished with value: 0.6122448979591836 and parameters: {'algorithm': 'ball_tree', 'n_neighbors': 14, 'weights': 'distance', 'metric': 'manhattan'}. Best is trial 21 with value: 0.6938775510204082.
[32m[I 2023-04-26 15:43:48,927][39m Trial 64 finished with value: 0.6464646464646465 and parameters: {'algorithm': 'ball_tree', 'n_neighbors': 12, 'weights': 'distance', 'metric': 'manhattan'}. Best is trial 21 with value: 0.6938775510204082.
[32m[I 2023-04-26 15:43:48,947][39m Trial 65 finished with value: 0.6736842105263158 and parameters: {'algorithm': 'ball_tree', 'n_neighbors': 9, 'weights': 'distance', 'metric': 'manhattan'}. Best is trial 21 with value: 0.6938775510204082.
[32m[I 2023-04-26 15:43:48,973][39m Trial 66 finished with value: 0.6262626262626262 and parameters: {'algorithm': 'ball_tree', 'n_neighbors': 10, 'weights': 'distance', 'metric': 'euclidean'}. Best is trial 21 with value: 0.6938775510204082.
[32m[I 2023-04-26 15:43:49,022][39m Trial 67 finished with value: 0.6938775510204082 and parameters: {'algorithm': 'brute', 'n_neighbors': 11, 'weights': 'distance', 'metric': 'manhattan'}. Best is trial 21 with value: 0.6938775510204082.
[32m[I 2023-04-26 15:43:49,058][39m Trial 68 finished with value: 0.5660377358490567 and parameters: {'algorithm': 'ball_tree', 'n_neighbors': 7, 'weights': 'uniform', 'metric': 'manhattan'}. Best is trial 21 with value: 0.6938775510204082.
[32m[I 2023-04-26 15:43:49,104][39m Trial 69 finished with value: 0.6464646464646465 and parameters: {'algorithm': 'brute', 'n_neighbors': 12, 'weights': 'distance', 'metric': 'manhattan'}. Best is trial 21 with value: 0.6938775510204082.
[32m[I 2023-04-26 15:43:49,153][39m Trial 70 finished with value: 0.6736842105263158 and parameters: {'algorithm': 'brute', 'n_neighbors': 9, 'weights': 'distance', 'metric': 'manhattan'}. Best is trial 21 with value: 0.6938775510204082.
[32m[I 2023-04-26 15:43:49,198][39m Trial 71 finished with value: 0.6938775510204082 and parameters: {'algorithm': 'brute', 'n_neighbors': 11, 'weights': 'distance', 'metric': 'manhattan'}. Best is trial 21 with value: 0.6938775510204082.
[32m[I 2023-04-26 15:43:49,247][39m Trial 72 finished with value: 0.64 and parameters: {'algorithm': 'brute', 'n_neighbors': 15, 'weights': 'distance', 'metric': 'manhattan'}. Best is trial 21 with value: 0.6938775510204082.
[32m[I 2023-04-26 15:43:49,264][39m Trial 73 finished with value: 0.6391752577319588 and parameters: {'algorithm': 'kd_tree', 'n_neighbors': 13, 'weights': 'distance', 'metric': 'manhattan'}. Best is trial 21 with value: 0.6938775510204082.
[32m[I 2023-04-26 15:43:49,304][39m Trial 74 finished with value: 0.6666666666666666 and parameters: {'algorithm': 'brute', 'n_neighbors': 10, 'weights': 'distance', 'metric': 'manhattan'}. Best is trial 21 with value: 0.6938775510204082.
[32m[I 2023-04-26 15:43:49,318][39m Trial 75 finished with value: 0.6938775510204082 and parameters: {'algorithm': 'ball_tree', 'n_neighbors': 11, 'weights': 'distance', 'metric': 'manhattan'}. Best is trial 21 with value: 0.6938775510204082.
[32m[I 2023-04-26 15:43:49,412][39m Trial 76 finished with value: 0.6736842105263158 and parameters: {'algorithm': 'brute', 'n_neighbors': 9, 'weights': 'distance', 'metric': 'manhattan'}. Best is trial 21 with value: 0.6938775510204082.
[32m[I 2023-04-26 15:43:49,429][39m Trial 77 finished with value: 0.6105263157894738 and parameters: {'algorithm': 'ball_tree', 'n_neighbors': 14, 'weights': 'distance', 'metric': 'minkowski'}. Best is trial 21 with value: 0.6938775510204082.
[32m[I 2023-04-26 15:43:49,451][39m Trial 78 finished with value: 0.5360824742268041 and parameters: {'algorithm': 'auto', 'n_neighbors': 8, 'weights': 'uniform', 'metric': 'euclidean'}. Best is trial 21 with value: 0.6938775510204082.
[32m[I 2023-04-26 15:43:49,468][39m Trial 79 finished with value: 0.6464646464646465 and parameters: {'algorithm': 'ball_tree', 'n_neighbors': 12, 'weights': 'distance', 'metric': 'manhattan'}. Best is trial 21 with value: 0.6938775510204082.
[32m[I 2023-04-26 15:43:49,485][39m Trial 80 finished with value: 0.6262626262626262 and parameters: {'algorithm': 'ball_tree', 'n_neighbors': 16, 'weights': 'distance', 'metric': 'manhattan'}. Best is trial 21 with value: 0.6938775510204082.
[32m[I 2023-04-26 15:43:49,500][39m Trial 81 finished with value: 0.6938775510204082 and parameters: {'algorithm': 'ball_tree', 'n_neighbors': 11, 'weights': 'distance', 'metric': 'manhattan'}. Best is trial 21 with value: 0.6938775510204082.
[32m[I 2023-04-26 15:43:49,512][39m Trial 82 finished with value: 0.6938775510204082 and parameters: {'algorithm': 'ball_tree', 'n_neighbors': 11, 'weights': 'distance', 'metric': 'manhattan'}. Best is trial 21 with value: 0.6938775510204082.
[32m[I 2023-04-26 15:43:49,562][39m Trial 83 finished with value: 0.6464646464646465 and parameters: {'algorithm': 'brute', 'n_neighbors': 12, 'weights': 'distance', 'metric': 'manhattan'}. Best is trial 21 with value: 0.6938775510204082.
[32m[I 2023-04-26 15:43:49,590][39m Trial 84 finished with value: 0.6391752577319588 and parameters: {'algorithm': 'ball_tree', 'n_neighbors': 13, 'weights': 'distance', 'metric': 'manhattan'}. Best is trial 21 with value: 0.6938775510204082.
[32m[I 2023-04-26 15:43:49,606][39m Trial 85 finished with value: 0.6736842105263158 and parameters: {'algorithm': 'ball_tree', 'n_neighbors': 9, 'weights': 'distance', 'metric': 'manhattan'}. Best is trial 21 with value: 0.6938775510204082.
[32m[I 2023-04-26 15:43:49,623][39m Trial 86 finished with value: 0.6666666666666666 and parameters: {'algorithm': 'ball_tree', 'n_neighbors': 10, 'weights': 'distance', 'metric': 'manhattan'}. Best is trial 21 with value: 0.6938775510204082.
[32m[I 2023-04-26 15:43:49,638][39m Trial 87 finished with value: 0.6938775510204082 and parameters: {'algorithm': 'ball_tree', 'n_neighbors': 11, 'weights': 'distance', 'metric': 'manhattan'}. Best is trial 21 with value: 0.6938775510204082.
[32m[I 2023-04-26 15:43:49,653][39m Trial 88 finished with value: 0.6086956521739131 and parameters: {'algorithm': 'ball_tree', 'n_neighbors': 7, 'weights': 'distance', 'metric': 'manhattan'}. Best is trial 21 with value: 0.6938775510204082.
[32m[I 2023-04-26 15:43:49,670][39m Trial 89 finished with value: 0.6391752577319588 and parameters: {'algorithm': 'ball_tree', 'n_neighbors': 13, 'weights': 'distance', 'metric': 'manhattan'}. Best is trial 21 with value: 0.6938775510204082.
