[32m[I 2023-04-26 15:43:49,687][39m Trial 90 finished with value: 0.6041666666666666 and parameters: {'algorithm': 'ball_tree', 'n_neighbors': 8, 'weights': 'distance', 'metric': 'minkowski'}. Best is trial 21 with value: 0.6938775510204082.
[32m[I 2023-04-26 15:43:49,703][39m Trial 91 finished with value: 0.6938775510204082 and parameters: {'algorithm': 'ball_tree', 'n_neighbors': 11, 'weights': 'distance', 'metric': 'manhattan'}. Best is trial 21 with value: 0.6938775510204082.
[32m[I 2023-04-26 15:43:49,727][39m Trial 92 finished with value: 0.6666666666666666 and parameters: {'algorithm': 'ball_tree', 'n_neighbors': 10, 'weights': 'distance', 'metric': 'manhattan'}. Best is trial 21 with value: 0.6938775510204082.
[32m[I 2023-04-26 15:43:49,752][39m Trial 93 finished with value: 0.6122448979591836 and parameters: {'algorithm': 'kd_tree', 'n_neighbors': 14, 'weights': 'distance', 'metric': 'manhattan'}. Best is trial 21 with value: 0.6938775510204082.
[32m[I 2023-04-26 15:43:49,777][39m Trial 94 finished with value: 0.6464646464646465 and parameters: {'algorithm': 'kd_tree', 'n_neighbors': 12, 'weights': 'distance', 'metric': 'manhattan'}. Best is trial 21 with value: 0.6938775510204082.
[32m[I 2023-04-26 15:43:49,802][39m Trial 95 finished with value: 0.6938775510204082 and parameters: {'algorithm': 'auto', 'n_neighbors': 11, 'weights': 'distance', 'metric': 'manhattan'}. Best is trial 21 with value: 0.6938775510204082.
[32m[I 2023-04-26 15:43:49,822][39m Trial 96 finished with value: 0.6 and parameters: {'algorithm': 'auto', 'n_neighbors': 15, 'weights': 'uniform', 'metric': 'manhattan'}. Best is trial 21 with value: 0.6938775510204082.
[32m[I 2023-04-26 15:43:49,843][39m Trial 97 finished with value: 0.606060606060606 and parameters: {'algorithm': 'auto', 'n_neighbors': 9, 'weights': 'distance', 'metric': 'euclidean'}. Best is trial 21 with value: 0.6938775510204082.
[32m[I 2023-04-26 15:43:49,862][39m Trial 98 finished with value: 0.6666666666666666 and parameters: {'algorithm': 'ball_tree', 'n_neighbors': 10, 'weights': 'distance', 'metric': 'manhattan'}. Best is trial 21 with value: 0.6938775510204082.
[32m[I 2023-04-26 15:43:49,882][39m Trial 99 finished with value: 0.6391752577319588 and parameters: {'algorithm': 'ball_tree', 'n_neighbors': 13, 'weights': 'distance', 'metric': 'manhattan'}. Best is trial 21 with value: 0.6938775510204082.
[32m[I 2023-04-26 15:43:49,934][39m Trial 100 finished with value: 0.6464646464646465 and parameters: {'algorithm': 'brute', 'n_neighbors': 12, 'weights': 'distance', 'metric': 'manhattan'}. Best is trial 21 with value: 0.6938775510204082.
[32m[I 2023-04-26 15:43:49,960][39m Trial 101 finished with value: 0.6213592233009708 and parameters: {'algorithm': 'ball_tree', 'n_neighbors': 24, 'weights': 'distance', 'metric': 'manhattan'}. Best is trial 21 with value: 0.6938775510204082.
[32m[I 2023-04-26 15:43:49,979][39m Trial 102 finished with value: 0.6938775510204082 and parameters: {'algorithm': 'ball_tree', 'n_neighbors': 11, 'weights': 'distance', 'metric': 'manhattan'}. Best is trial 21 with value: 0.6938775510204082.
[32m[I 2023-04-26 15:43:50,027][39m Trial 103 finished with value: 0.6938775510204082 and parameters: {'algorithm': 'brute', 'n_neighbors': 11, 'weights': 'distance', 'metric': 'manhattan'}. Best is trial 21 with value: 0.6938775510204082.
[32m[I 2023-04-26 15:43:50,047][39m Trial 104 finished with value: 0.6666666666666666 and parameters: {'algorithm': 'ball_tree', 'n_neighbors': 10, 'weights': 'distance', 'metric': 'manhattan'}. Best is trial 21 with value: 0.6938775510204082.
[32m[I 2023-04-26 15:43:50,087][39m Trial 105 finished with value: 0.6666666666666666 and parameters: {'algorithm': 'brute', 'n_neighbors': 10, 'weights': 'distance', 'metric': 'manhattan'}. Best is trial 21 with value: 0.6938775510204082.
[32m[I 2023-04-26 15:43:50,126][39m Trial 106 finished with value: 0.6391752577319588 and parameters: {'algorithm': 'brute', 'n_neighbors': 8, 'weights': 'distance', 'metric': 'manhattan'}. Best is trial 21 with value: 0.6938775510204082.
[32m[I 2023-04-26 15:43:50,142][39m Trial 107 finished with value: 0.6938775510204082 and parameters: {'algorithm': 'auto', 'n_neighbors': 11, 'weights': 'distance', 'metric': 'manhattan'}. Best is trial 21 with value: 0.6938775510204082.
[32m[I 2023-04-26 15:43:50,158][39m Trial 108 finished with value: 0.6464646464646465 and parameters: {'algorithm': 'auto', 'n_neighbors': 12, 'weights': 'distance', 'metric': 'manhattan'}. Best is trial 21 with value: 0.6938775510204082.
[32m[I 2023-04-26 15:43:50,175][39m Trial 109 finished with value: 0.6105263157894738 and parameters: {'algorithm': 'kd_tree', 'n_neighbors': 13, 'weights': 'distance', 'metric': 'minkowski'}. Best is trial 21 with value: 0.6938775510204082.
[32m[I 2023-04-26 15:43:50,198][39m Trial 110 finished with value: 0.6355140186915889 and parameters: {'algorithm': 'ball_tree', 'n_neighbors': 11, 'weights': 'uniform', 'metric': 'manhattan'}. Best is trial 21 with value: 0.6938775510204082.
[32m[I 2023-04-26 15:43:50,217][39m Trial 111 finished with value: 0.6736842105263158 and parameters: {'algorithm': 'ball_tree', 'n_neighbors': 9, 'weights': 'distance', 'metric': 'manhattan'}. Best is trial 21 with value: 0.6938775510204082.
[32m[I 2023-04-26 15:43:50,233][39m Trial 112 finished with value: 0.6464646464646465 and parameters: {'algorithm': 'ball_tree', 'n_neighbors': 12, 'weights': 'distance', 'metric': 'manhattan'}. Best is trial 21 with value: 0.6938775510204082.
[32m[I 2023-04-26 15:43:50,251][39m Trial 113 finished with value: 0.6938775510204082 and parameters: {'algorithm': 'ball_tree', 'n_neighbors': 11, 'weights': 'distance', 'metric': 'manhattan'}. Best is trial 21 with value: 0.6938775510204082.
[32m[I 2023-04-26 15:43:50,269][39m Trial 114 finished with value: 0.6666666666666666 and parameters: {'algorithm': 'ball_tree', 'n_neighbors': 10, 'weights': 'distance', 'metric': 'manhattan'}. Best is trial 21 with value: 0.6938775510204082.
[32m[I 2023-04-26 15:43:50,288][39m Trial 115 finished with value: 0.6122448979591836 and parameters: {'algorithm': 'ball_tree', 'n_neighbors': 14, 'weights': 'distance', 'metric': 'manhattan'}. Best is trial 21 with value: 0.6938775510204082.
[32m[I 2023-04-26 15:43:50,308][39m Trial 116 finished with value: 0.606060606060606 and parameters: {'algorithm': 'ball_tree', 'n_neighbors': 9, 'weights': 'distance', 'metric': 'euclidean'}. Best is trial 21 with value: 0.6938775510204082.
[32m[I 2023-04-26 15:43:50,326][39m Trial 117 finished with value: 0.6391752577319588 and parameters: {'algorithm': 'auto', 'n_neighbors': 13, 'weights': 'distance', 'metric': 'manhattan'}. Best is trial 21 with value: 0.6938775510204082.
[32m[I 2023-04-26 15:43:50,345][39m Trial 118 finished with value: 0.6938775510204082 and parameters: {'algorithm': 'ball_tree', 'n_neighbors': 11, 'weights': 'distance', 'metric': 'manhattan'}. Best is trial 21 with value: 0.6938775510204082.
[32m[I 2023-04-26 15:43:50,374][39m Trial 119 finished with value: 0.6464646464646465 and parameters: {'algorithm': 'kd_tree', 'n_neighbors': 12, 'weights': 'distance', 'metric': 'manhattan'}. Best is trial 21 with value: 0.6938775510204082.
[32m[I 2023-04-26 15:43:50,400][39m Trial 120 finished with value: 0.6666666666666666 and parameters: {'algorithm': 'auto', 'n_neighbors': 10, 'weights': 'distance', 'metric': 'manhattan'}. Best is trial 21 with value: 0.6938775510204082.
[32m[I 2023-04-26 15:43:50,423][39m Trial 121 finished with value: 0.6938775510204082 and parameters: {'algorithm': 'ball_tree', 'n_neighbors': 11, 'weights': 'distance', 'metric': 'manhattan'}. Best is trial 21 with value: 0.6938775510204082.
[32m[I 2023-04-26 15:43:50,502][39m Trial 122 finished with value: 0.6464646464646465 and parameters: {'algorithm': 'brute', 'n_neighbors': 12, 'weights': 'distance', 'metric': 'manhattan'}. Best is trial 21 with value: 0.6938775510204082.
[32m[I 2023-04-26 15:43:50,546][39m Trial 123 finished with value: 0.6736842105263158 and parameters: {'algorithm': 'ball_tree', 'n_neighbors': 9, 'weights': 'distance', 'metric': 'manhattan'}. Best is trial 21 with value: 0.6938775510204082.
[32m[I 2023-04-26 15:43:50,582][39m Trial 124 finished with value: 0.6938775510204082 and parameters: {'algorithm': 'ball_tree', 'n_neighbors': 11, 'weights': 'distance', 'metric': 'manhattan'}. Best is trial 21 with value: 0.6938775510204082.
[32m[I 2023-04-26 15:43:50,602][39m Trial 125 finished with value: 0.6938775510204082 and parameters: {'algorithm': 'ball_tree', 'n_neighbors': 11, 'weights': 'distance', 'metric': 'manhattan'}. Best is trial 21 with value: 0.6938775510204082.
[32m[I 2023-04-26 15:43:50,621][39m Trial 126 finished with value: 0.6666666666666666 and parameters: {'algorithm': 'ball_tree', 'n_neighbors': 10, 'weights': 'distance', 'metric': 'manhattan'}. Best is trial 21 with value: 0.6938775510204082.
[32m[I 2023-04-26 15:43:50,640][39m Trial 127 finished with value: 0.6391752577319588 and parameters: {'algorithm': 'ball_tree', 'n_neighbors': 13, 'weights': 'distance', 'metric': 'manhattan'}. Best is trial 21 with value: 0.6938775510204082.
[32m[I 2023-04-26 15:43:50,706][39m Trial 128 finished with value: 0.6464646464646465 and parameters: {'algorithm': 'brute', 'n_neighbors': 12, 'weights': 'distance', 'metric': 'manhattan'}. Best is trial 21 with value: 0.6938775510204082.
[32m[I 2023-04-26 15:43:50,747][39m Trial 129 finished with value: 0.6938775510204082 and parameters: {'algorithm': 'ball_tree', 'n_neighbors': 11, 'weights': 'distance', 'metric': 'manhattan'}. Best is trial 21 with value: 0.6938775510204082.
[32m[I 2023-04-26 15:43:50,777][39m Trial 130 finished with value: 0.6391752577319588 and parameters: {'algorithm': 'ball_tree', 'n_neighbors': 8, 'weights': 'distance', 'metric': 'manhattan'}. Best is trial 21 with value: 0.6938775510204082.
[32m[I 2023-04-26 15:43:50,797][39m Trial 131 finished with value: 0.6938775510204082 and parameters: {'algorithm': 'ball_tree', 'n_neighbors': 11, 'weights': 'distance', 'metric': 'manhattan'}. Best is trial 21 with value: 0.6938775510204082.
[32m[I 2023-04-26 15:43:50,817][39m Trial 132 finished with value: 0.6666666666666666 and parameters: {'algorithm': 'ball_tree', 'n_neighbors': 10, 'weights': 'distance', 'metric': 'manhattan'}. Best is trial 21 with value: 0.6938775510204082.
[32m[I 2023-04-26 15:43:50,836][39m Trial 133 finished with value: 0.6938775510204082 and parameters: {'algorithm': 'ball_tree', 'n_neighbors': 11, 'weights': 'distance', 'metric': 'manhattan'}. Best is trial 21 with value: 0.6938775510204082.
[32m[I 2023-04-26 15:43:50,898][39m Trial 134 finished with value: 0.6464646464646465 and parameters: {'algorithm': 'brute', 'n_neighbors': 12, 'weights': 'distance', 'metric': 'manhattan'}. Best is trial 21 with value: 0.6938775510204082.
[32m[I 2023-04-26 15:43:50,957][39m Trial 135 finished with value: 0.5918367346938775 and parameters: {'algorithm': 'auto', 'n_neighbors': 10, 'weights': 'uniform', 'metric': 'manhattan'}. Best is trial 21 with value: 0.6938775510204082.
[32m[I 2023-04-26 15:43:50,987][39m Trial 136 finished with value: 0.6736842105263158 and parameters: {'algorithm': 'ball_tree', 'n_neighbors': 9, 'weights': 'distance', 'metric': 'manhattan'}. Best is trial 21 with value: 0.6938775510204082.
[32m[I 2023-04-26 15:43:51,006][39m Trial 137 finished with value: 0.6105263157894738 and parameters: {'algorithm': 'kd_tree', 'n_neighbors': 14, 'weights': 'distance', 'metric': 'minkowski'}. Best is trial 21 with value: 0.6938775510204082.
[32m[I 2023-04-26 15:43:51,024][39m Trial 138 finished with value: 0.6464646464646465 and parameters: {'algorithm': 'ball_tree', 'n_neighbors': 12, 'weights': 'distance', 'metric': 'manhattan'}. Best is trial 21 with value: 0.6938775510204082.
[32m[I 2023-04-26 15:43:51,041][39m Trial 139 finished with value: 0.6190476190476191 and parameters: {'algorithm': 'auto', 'n_neighbors': 2, 'weights': 'distance', 'metric': 'manhattan'}. Best is trial 21 with value: 0.6938775510204082.
[32m[I 2023-04-26 15:43:51,065][39m Trial 140 finished with value: 0.6185567010309277 and parameters: {'algorithm': 'ball_tree', 'n_neighbors': 11, 'weights': 'distance', 'metric': 'euclidean'}. Best is trial 21 with value: 0.6938775510204082.
[32m[I 2023-04-26 15:43:51,090][39m Trial 141 finished with value: 0.6938775510204082 and parameters: {'algorithm': 'ball_tree', 'n_neighbors': 11, 'weights': 'distance', 'metric': 'manhattan'}. Best is trial 21 with value: 0.6938775510204082.
[32m[I 2023-04-26 15:43:51,117][39m Trial 142 finished with value: 0.6391752577319588 and parameters: {'algorithm': 'ball_tree', 'n_neighbors': 13, 'weights': 'distance', 'metric': 'manhattan'}. Best is trial 21 with value: 0.6938775510204082.
[32m[I 2023-04-26 15:43:51,184][39m Trial 143 finished with value: 0.6938775510204082 and parameters: {'algorithm': 'brute', 'n_neighbors': 11, 'weights': 'distance', 'metric': 'manhattan'}. Best is trial 21 with value: 0.6938775510204082.
[32m[I 2023-04-26 15:43:51,209][39m Trial 144 finished with value: 0.6666666666666666 and parameters: {'algorithm': 'ball_tree', 'n_neighbors': 10, 'weights': 'distance', 'metric': 'manhattan'}. Best is trial 21 with value: 0.6938775510204082.
[32m[I 2023-04-26 15:43:51,239][39m Trial 145 finished with value: 0.6019417475728155 and parameters: {'algorithm': 'auto', 'n_neighbors': 30, 'weights': 'distance', 'metric': 'manhattan'}. Best is trial 21 with value: 0.6938775510204082.
[32m[I 2023-04-26 15:43:51,262][39m Trial 146 finished with value: 0.6464646464646465 and parameters: {'algorithm': 'ball_tree', 'n_neighbors': 12, 'weights': 'distance', 'metric': 'manhattan'}. Best is trial 21 with value: 0.6938775510204082.
[32m[I 2023-04-26 15:43:51,283][39m Trial 147 finished with value: 0.6938775510204082 and parameters: {'algorithm': 'auto', 'n_neighbors': 11, 'weights': 'distance', 'metric': 'manhattan'}. Best is trial 21 with value: 0.6938775510204082.
[32m[I 2023-04-26 15:43:51,301][39m Trial 148 finished with value: 0.6736842105263158 and parameters: {'algorithm': 'auto', 'n_neighbors': 9, 'weights': 'distance', 'metric': 'manhattan'}. Best is trial 21 with value: 0.6938775510204082.
[32m[I 2023-04-26 15:43:51,322][39m Trial 149 finished with value: 0.6666666666666666 and parameters: {'algorithm': 'auto', 'n_neighbors': 10, 'weights': 'distance', 'metric': 'manhattan'}. Best is trial 21 with value: 0.6938775510204082.
[32m[I 2023-04-26 15:43:51,340][39m Trial 150 finished with value: 0.6464646464646465 and parameters: {'algorithm': 'ball_tree', 'n_neighbors': 12, 'weights': 'distance', 'metric': 'manhattan'}. Best is trial 21 with value: 0.6938775510204082.
[32m[I 2023-04-26 15:43:51,361][39m Trial 151 finished with value: 0.6938775510204082 and parameters: {'algorithm': 'ball_tree', 'n_neighbors': 11, 'weights': 'distance', 'metric': 'manhattan'}. Best is trial 21 with value: 0.6938775510204082.
[32m[I 2023-04-26 15:43:51,380][39m Trial 152 finished with value: 0.6391752577319588 and parameters: {'algorithm': 'ball_tree', 'n_neighbors': 13, 'weights': 'distance', 'metric': 'manhattan'}. Best is trial 21 with value: 0.6938775510204082.
[32m[I 2023-04-26 15:43:51,398][39m Trial 153 finished with value: 0.6938775510204082 and parameters: {'algorithm': 'ball_tree', 'n_neighbors': 11, 'weights': 'distance', 'metric': 'manhattan'}. Best is trial 21 with value: 0.6938775510204082.
[32m[I 2023-04-26 15:43:51,412][39m Trial 154 finished with value: 0.6464646464646465 and parameters: {'algorithm': 'ball_tree', 'n_neighbors': 12, 'weights': 'distance', 'metric': 'manhattan'}. Best is trial 21 with value: 0.6938775510204082.
[32m[I 2023-04-26 15:43:51,438][39m Trial 155 finished with value: 0.6666666666666666 and parameters: {'algorithm': 'ball_tree', 'n_neighbors': 10, 'weights': 'distance', 'metric': 'manhattan'}. Best is trial 21 with value: 0.6938775510204082.
[32m[I 2023-04-26 15:43:51,462][39m Trial 156 finished with value: 0.6938775510204082 and parameters: {'algorithm': 'ball_tree', 'n_neighbors': 11, 'weights': 'distance', 'metric': 'manhattan'}. Best is trial 21 with value: 0.6938775510204082.
[32m[I 2023-04-26 15:43:51,490][39m Trial 157 finished with value: 0.5918367346938775 and parameters: {'algorithm': 'ball_tree', 'n_neighbors': 10, 'weights': 'uniform', 'metric': 'manhattan'}. Best is trial 21 with value: 0.6938775510204082.
[32m[I 2023-04-26 15:43:51,554][39m Trial 158 finished with value: 0.6938775510204082 and parameters: {'algorithm': 'brute', 'n_neighbors': 11, 'weights': 'distance', 'metric': 'manhattan'}. Best is trial 21 with value: 0.6938775510204082.
[32m[I 2023-04-26 15:43:51,591][39m Trial 159 finished with value: 0.6464646464646465 and parameters: {'algorithm': 'ball_tree', 'n_neighbors': 12, 'weights': 'distance', 'metric': 'manhattan'}. Best is trial 21 with value: 0.6938775510204082.
[32m[I 2023-04-26 15:43:51,615][39m Trial 160 finished with value: 0.606060606060606 and parameters: {'algorithm': 'ball_tree', 'n_neighbors': 9, 'weights': 'distance', 'metric': 'minkowski'}. Best is trial 21 with value: 0.6938775510204082.
[32m[I 2023-04-26 15:43:51,634][39m Trial 161 finished with value: 0.6938775510204082 and parameters: {'algorithm': 'ball_tree', 'n_neighbors': 11, 'weights': 'distance', 'metric': 'manhattan'}. Best is trial 21 with value: 0.6938775510204082.
[32m[I 2023-04-26 15:43:51,652][39m Trial 162 finished with value: 0.6938775510204082 and parameters: {'algorithm': 'ball_tree', 'n_neighbors': 11, 'weights': 'distance', 'metric': 'manhattan'}. Best is trial 21 with value: 0.6938775510204082.
[32m[I 2023-04-26 15:43:51,706][39m Trial 163 finished with value: 0.6666666666666666 and parameters: {'algorithm': 'brute', 'n_neighbors': 10, 'weights': 'distance', 'metric': 'manhattan'}. Best is trial 21 with value: 0.6938775510204082.
[32m[I 2023-04-26 15:43:51,741][39m Trial 164 finished with value: 0.6464646464646465 and parameters: {'algorithm': 'kd_tree', 'n_neighbors': 12, 'weights': 'distance', 'metric': 'manhattan'}. Best is trial 21 with value: 0.6938775510204082.
[32m[I 2023-04-26 15:43:51,761][39m Trial 165 finished with value: 0.6938775510204082 and parameters: {'algorithm': 'ball_tree', 'n_neighbors': 11, 'weights': 'distance', 'metric': 'manhattan'}. Best is trial 21 with value: 0.6938775510204082.
[32m[I 2023-04-26 15:43:51,805][39m Trial 166 finished with value: 0.6666666666666666 and parameters: {'algorithm': 'brute', 'n_neighbors': 10, 'weights': 'distance', 'metric': 'manhattan'}. Best is trial 21 with value: 0.6938775510204082.
[32m[I 2023-04-26 15:43:51,827][39m Trial 167 finished with value: 0.6464646464646465 and parameters: {'algorithm': 'ball_tree', 'n_neighbors': 12, 'weights': 'distance', 'metric': 'manhattan'}. Best is trial 21 with value: 0.6938775510204082.
[32m[I 2023-04-26 15:43:51,847][39m Trial 168 finished with value: 0.6391752577319588 and parameters: {'algorithm': 'ball_tree', 'n_neighbors': 13, 'weights': 'distance', 'metric': 'manhattan'}. Best is trial 21 with value: 0.6938775510204082.
[32m[I 2023-04-26 15:43:51,888][39m Trial 169 finished with value: 0.6185567010309277 and parameters: {'algorithm': 'brute', 'n_neighbors': 11, 'weights': 'distance', 'metric': 'euclidean'}. Best is trial 21 with value: 0.6938775510204082.
[32m[I 2023-04-26 15:43:51,927][39m Trial 170 finished with value: 0.6666666666666666 and parameters: {'algorithm': 'brute', 'n_neighbors': 10, 'weights': 'distance', 'metric': 'manhattan'}. Best is trial 21 with value: 0.6938775510204082.
[32m[I 2023-04-26 15:43:51,952][39m Trial 171 finished with value: 0.6938775510204082 and parameters: {'algorithm': 'ball_tree', 'n_neighbors': 11, 'weights': 'distance', 'metric': 'manhattan'}. Best is trial 21 with value: 0.6938775510204082.
[32m[I 2023-04-26 15:43:51,992][39m Trial 172 finished with value: 0.6464646464646465 and parameters: {'algorithm': 'brute', 'n_neighbors': 12, 'weights': 'distance', 'metric': 'manhattan'}. Best is trial 21 with value: 0.6938775510204082.
[32m[I 2023-04-26 15:43:52,013][39m Trial 173 finished with value: 0.6938775510204082 and parameters: {'algorithm': 'ball_tree', 'n_neighbors': 11, 'weights': 'distance', 'metric': 'manhattan'}. Best is trial 21 with value: 0.6938775510204082.
[32m[I 2023-04-26 15:43:52,033][39m Trial 174 finished with value: 0.6736842105263158 and parameters: {'algorithm': 'ball_tree', 'n_neighbors': 9, 'weights': 'distance', 'metric': 'manhattan'}. Best is trial 21 with value: 0.6938775510204082.
[32m[I 2023-04-26 15:43:52,053][39m Trial 175 finished with value: 0.6666666666666666 and parameters: {'algorithm': 'auto', 'n_neighbors': 10, 'weights': 'distance', 'metric': 'manhattan'}. Best is trial 21 with value: 0.6938775510204082.
[32m[I 2023-04-26 15:43:52,073][39m Trial 176 finished with value: 0.6391752577319588 and parameters: {'algorithm': 'ball_tree', 'n_neighbors': 13, 'weights': 'distance', 'metric': 'manhattan'}. Best is trial 21 with value: 0.6938775510204082.
[32m[I 2023-04-26 15:43:52,093][39m Trial 177 finished with value: 0.6938775510204082 and parameters: {'algorithm': 'ball_tree', 'n_neighbors': 11, 'weights': 'distance', 'metric': 'manhattan'}. Best is trial 21 with value: 0.6938775510204082.
[32m[I 2023-04-26 15:43:52,112][39m Trial 178 finished with value: 0.6464646464646465 and parameters: {'algorithm': 'ball_tree', 'n_neighbors': 12, 'weights': 'distance', 'metric': 'manhattan'}. Best is trial 21 with value: 0.6938775510204082.
[32m[I 2023-04-26 15:43:52,132][39m Trial 179 finished with value: 0.6666666666666666 and parameters: {'algorithm': 'ball_tree', 'n_neighbors': 10, 'weights': 'distance', 'metric': 'manhattan'}. Best is trial 21 with value: 0.6938775510204082.
