[32m[I 2023-04-26 15:43:52,153][39m Trial 180 finished with value: 0.6938775510204082 and parameters: {'algorithm': 'ball_tree', 'n_neighbors': 11, 'weights': 'distance', 'metric': 'manhattan'}. Best is trial 21 with value: 0.6938775510204082.
[32m[I 2023-04-26 15:43:52,172][39m Trial 181 finished with value: 0.6938775510204082 and parameters: {'algorithm': 'ball_tree', 'n_neighbors': 11, 'weights': 'distance', 'metric': 'manhattan'}. Best is trial 21 with value: 0.6938775510204082.
[32m[I 2023-04-26 15:43:52,193][39m Trial 182 finished with value: 0.6213592233009708 and parameters: {'algorithm': 'ball_tree', 'n_neighbors': 22, 'weights': 'distance', 'metric': 'manhattan'}. Best is trial 21 with value: 0.6938775510204082.
[32m[I 2023-04-26 15:43:52,212][39m Trial 183 finished with value: 0.6938775510204082 and parameters: {'algorithm': 'ball_tree', 'n_neighbors': 11, 'weights': 'distance', 'metric': 'manhattan'}. Best is trial 21 with value: 0.6938775510204082.
[32m[I 2023-04-26 15:43:52,242][39m Trial 184 finished with value: 0.6464646464646465 and parameters: {'algorithm': 'auto', 'n_neighbors': 12, 'weights': 'distance', 'metric': 'manhattan'}. Best is trial 21 with value: 0.6938775510204082.
[32m[I 2023-04-26 15:43:52,264][39m Trial 185 finished with value: 0.6938775510204082 and parameters: {'algorithm': 'ball_tree', 'n_neighbors': 11, 'weights': 'distance', 'metric': 'manhattan'}. Best is trial 21 with value: 0.6938775510204082.
[32m[I 2023-04-26 15:43:52,293][39m Trial 186 finished with value: 0.6666666666666666 and parameters: {'algorithm': 'ball_tree', 'n_neighbors': 10, 'weights': 'distance', 'metric': 'manhattan'}. Best is trial 21 with value: 0.6938775510204082.
[32m[I 2023-04-26 15:43:52,357][39m Trial 187 finished with value: 0.5555555555555556 and parameters: {'algorithm': 'brute', 'n_neighbors': 9, 'weights': 'uniform', 'metric': 'manhattan'}. Best is trial 21 with value: 0.6938775510204082.
[32m[I 2023-04-26 15:43:52,375][39m Trial 188 finished with value: 0.6464646464646465 and parameters: {'algorithm': 'ball_tree', 'n_neighbors': 12, 'weights': 'distance', 'metric': 'manhattan'}. Best is trial 21 with value: 0.6938775510204082.
[32m[I 2023-04-26 15:43:52,396][39m Trial 189 finished with value: 0.6938775510204082 and parameters: {'algorithm': 'ball_tree', 'n_neighbors': 11, 'weights': 'distance', 'metric': 'manhattan'}. Best is trial 21 with value: 0.6938775510204082.
[32m[I 2023-04-26 15:43:52,417][39m Trial 190 finished with value: 0.6938775510204082 and parameters: {'algorithm': 'ball_tree', 'n_neighbors': 11, 'weights': 'distance', 'metric': 'manhattan'}. Best is trial 21 with value: 0.6938775510204082.
[32m[I 2023-04-26 15:43:52,436][39m Trial 191 finished with value: 0.6138613861386139 and parameters: {'algorithm': 'ball_tree', 'n_neighbors': 19, 'weights': 'distance', 'metric': 'manhattan'}. Best is trial 21 with value: 0.6938775510204082.
[32m[I 2023-04-26 15:43:52,457][39m Trial 192 finished with value: 0.6666666666666666 and parameters: {'algorithm': 'ball_tree', 'n_neighbors': 10, 'weights': 'distance', 'metric': 'manhattan'}. Best is trial 21 with value: 0.6938775510204082.
[32m[I 2023-04-26 15:43:52,477][39m Trial 193 finished with value: 0.6464646464646465 and parameters: {'algorithm': 'ball_tree', 'n_neighbors': 12, 'weights': 'distance', 'metric': 'manhattan'}. Best is trial 21 with value: 0.6938775510204082.
[32m[I 2023-04-26 15:43:52,492][39m Trial 194 finished with value: 0.6938775510204082 and parameters: {'algorithm': 'ball_tree', 'n_neighbors': 11, 'weights': 'distance', 'metric': 'manhattan'}. Best is trial 21 with value: 0.6938775510204082.
[32m[I 2023-04-26 15:43:52,542][39m Trial 195 finished with value: 0.6938775510204082 and parameters: {'algorithm': 'brute', 'n_neighbors': 11, 'weights': 'distance', 'metric': 'manhattan'}. Best is trial 21 with value: 0.6938775510204082.
[32m[I 2023-04-26 15:43:52,565][39m Trial 196 finished with value: 0.6105263157894738 and parameters: {'algorithm': 'ball_tree', 'n_neighbors': 13, 'weights': 'distance', 'metric': 'minkowski'}. Best is trial 21 with value: 0.6938775510204082.
[32m[I 2023-04-26 15:43:52,586][39m Trial 197 finished with value: 0.6464646464646465 and parameters: {'algorithm': 'ball_tree', 'n_neighbors': 12, 'weights': 'distance', 'metric': 'manhattan'}. Best is trial 21 with value: 0.6938775510204082.
[32m[I 2023-04-26 15:43:52,607][39m Trial 198 finished with value: 0.6666666666666666 and parameters: {'algorithm': 'ball_tree', 'n_neighbors': 10, 'weights': 'distance', 'metric': 'manhattan'}. Best is trial 21 with value: 0.6938775510204082.
[32m[I 2023-04-26 15:43:52,653][39m Trial 199 finished with value: 0.6938775510204082 and parameters: {'algorithm': 'brute', 'n_neighbors': 11, 'weights': 'distance', 'metric': 'manhattan'}. Best is trial 21 with value: 0.6938775510204082.
[32m[I 2023-04-26 15:43:52,697][39m Trial 200 finished with value: 0.6666666666666666 and parameters: {'algorithm': 'brute', 'n_neighbors': 10, 'weights': 'distance', 'metric': 'manhattan'}. Best is trial 21 with value: 0.6938775510204082.
[32m[I 2023-04-26 15:43:52,724][39m Trial 201 finished with value: 0.6938775510204082 and parameters: {'algorithm': 'ball_tree', 'n_neighbors': 11, 'weights': 'distance', 'metric': 'manhattan'}. Best is trial 21 with value: 0.6938775510204082.
[32m[I 2023-04-26 15:43:52,770][39m Trial 202 finished with value: 0.6464646464646465 and parameters: {'algorithm': 'brute', 'n_neighbors': 12, 'weights': 'distance', 'metric': 'manhattan'}. Best is trial 21 with value: 0.6938775510204082.
[32m[I 2023-04-26 15:43:52,792][39m Trial 203 finished with value: 0.6938775510204082 and parameters: {'algorithm': 'ball_tree', 'n_neighbors': 11, 'weights': 'distance', 'metric': 'manhattan'}. Best is trial 21 with value: 0.6938775510204082.
[32m[I 2023-04-26 15:43:52,811][39m Trial 204 finished with value: 0.6666666666666666 and parameters: {'algorithm': 'ball_tree', 'n_neighbors': 10, 'weights': 'distance', 'metric': 'manhattan'}. Best is trial 21 with value: 0.6938775510204082.
[32m[I 2023-04-26 15:43:52,831][39m Trial 205 finished with value: 0.6938775510204082 and parameters: {'algorithm': 'ball_tree', 'n_neighbors': 11, 'weights': 'distance', 'metric': 'manhattan'}. Best is trial 21 with value: 0.6938775510204082.
[32m[I 2023-04-26 15:43:52,850][39m Trial 206 finished with value: 0.6938775510204082 and parameters: {'algorithm': 'auto', 'n_neighbors': 11, 'weights': 'distance', 'metric': 'manhattan'}. Best is trial 21 with value: 0.6938775510204082.
[32m[I 2023-04-26 15:43:52,875][39m Trial 207 finished with value: 0.6122448979591836 and parameters: {'algorithm': 'auto', 'n_neighbors': 12, 'weights': 'distance', 'metric': 'euclidean'}. Best is trial 21 with value: 0.6938775510204082.
[32m[I 2023-04-26 15:43:52,897][39m Trial 208 finished with value: 0.6938775510204082 and parameters: {'algorithm': 'auto', 'n_neighbors': 11, 'weights': 'distance', 'metric': 'manhattan'}. Best is trial 21 with value: 0.6938775510204082.
[32m[I 2023-04-26 15:43:52,922][39m Trial 209 finished with value: 0.6666666666666666 and parameters: {'algorithm': 'auto', 'n_neighbors': 10, 'weights': 'distance', 'metric': 'manhattan'}. Best is trial 21 with value: 0.6938775510204082.
[32m[I 2023-04-26 15:43:52,942][39m Trial 210 finished with value: 0.6464646464646465 and parameters: {'algorithm': 'ball_tree', 'n_neighbors': 12, 'weights': 'distance', 'metric': 'manhattan'}. Best is trial 21 with value: 0.6938775510204082.
[32m[I 2023-04-26 15:43:52,962][39m Trial 211 finished with value: 0.6938775510204082 and parameters: {'algorithm': 'ball_tree', 'n_neighbors': 11, 'weights': 'distance', 'metric': 'manhattan'}. Best is trial 21 with value: 0.6938775510204082.
[32m[I 2023-04-26 15:43:52,985][39m Trial 212 finished with value: 0.6938775510204082 and parameters: {'algorithm': 'ball_tree', 'n_neighbors': 11, 'weights': 'distance', 'metric': 'manhattan'}. Best is trial 21 with value: 0.6938775510204082.
[32m[I 2023-04-26 15:43:53,004][39m Trial 213 finished with value: 0.6938775510204082 and parameters: {'algorithm': 'ball_tree', 'n_neighbors': 11, 'weights': 'distance', 'metric': 'manhattan'}. Best is trial 21 with value: 0.6938775510204082.
[32m[I 2023-04-26 15:43:53,038][39m Trial 214 finished with value: 0.6938775510204082 and parameters: {'algorithm': 'ball_tree', 'n_neighbors': 11, 'weights': 'distance', 'metric': 'manhattan'}. Best is trial 21 with value: 0.6938775510204082.
[32m[I 2023-04-26 15:43:53,071][39m Trial 215 finished with value: 0.6666666666666666 and parameters: {'algorithm': 'auto', 'n_neighbors': 10, 'weights': 'distance', 'metric': 'manhattan'}. Best is trial 21 with value: 0.6938775510204082.
[32m[I 2023-04-26 15:43:53,090][39m Trial 216 finished with value: 0.6464646464646465 and parameters: {'algorithm': 'ball_tree', 'n_neighbors': 12, 'weights': 'distance', 'metric': 'manhattan'}. Best is trial 21 with value: 0.6938775510204082.
[32m[I 2023-04-26 15:43:53,121][39m Trial 217 finished with value: 0.6938775510204082 and parameters: {'algorithm': 'ball_tree', 'n_neighbors': 11, 'weights': 'distance', 'metric': 'manhattan'}. Best is trial 21 with value: 0.6938775510204082.
[32m[I 2023-04-26 15:43:53,155][39m Trial 218 finished with value: 0.6938775510204082 and parameters: {'algorithm': 'ball_tree', 'n_neighbors': 11, 'weights': 'distance', 'metric': 'manhattan'}. Best is trial 21 with value: 0.6938775510204082.
[32m[I 2023-04-26 15:43:53,192][39m Trial 219 finished with value: 0.6666666666666666 and parameters: {'algorithm': 'ball_tree', 'n_neighbors': 10, 'weights': 'distance', 'metric': 'manhattan'}. Best is trial 21 with value: 0.6938775510204082.
[32m[I 2023-04-26 15:43:53,242][39m Trial 220 finished with value: 0.58 and parameters: {'algorithm': 'ball_tree', 'n_neighbors': 12, 'weights': 'uniform', 'metric': 'manhattan'}. Best is trial 21 with value: 0.6938775510204082.
[32m[I 2023-04-26 15:43:53,322][39m Trial 221 finished with value: 0.6666666666666666 and parameters: {'algorithm': 'brute', 'n_neighbors': 10, 'weights': 'distance', 'metric': 'manhattan'}. Best is trial 21 with value: 0.6938775510204082.
[32m[I 2023-04-26 15:43:53,365][39m Trial 222 finished with value: 0.6938775510204082 and parameters: {'algorithm': 'ball_tree', 'n_neighbors': 11, 'weights': 'distance', 'metric': 'manhattan'}. Best is trial 21 with value: 0.6938775510204082.
[32m[I 2023-04-26 15:43:53,389][39m Trial 223 finished with value: 0.6464646464646465 and parameters: {'algorithm': 'auto', 'n_neighbors': 12, 'weights': 'distance', 'metric': 'manhattan'}. Best is trial 21 with value: 0.6938775510204082.
[32m[I 2023-04-26 15:43:53,410][39m Trial 224 finished with value: 0.6938775510204082 and parameters: {'algorithm': 'ball_tree', 'n_neighbors': 11, 'weights': 'distance', 'metric': 'manhattan'}. Best is trial 21 with value: 0.6938775510204082.
[32m[I 2023-04-26 15:43:53,423][39m Trial 225 finished with value: 0.6938775510204082 and parameters: {'algorithm': 'ball_tree', 'n_neighbors': 11, 'weights': 'distance', 'metric': 'manhattan'}. Best is trial 21 with value: 0.6938775510204082.
[32m[I 2023-04-26 15:43:53,456][39m Trial 226 finished with value: 0.6736842105263158 and parameters: {'algorithm': 'ball_tree', 'n_neighbors': 9, 'weights': 'distance', 'metric': 'manhattan'}. Best is trial 21 with value: 0.6938775510204082.
[32m[I 2023-04-26 15:43:53,473][39m Trial 227 finished with value: 0.6464646464646465 and parameters: {'algorithm': 'ball_tree', 'n_neighbors': 12, 'weights': 'distance', 'metric': 'manhattan'}. Best is trial 21 with value: 0.6938775510204082.
[32m[I 2023-04-26 15:43:53,507][39m Trial 228 finished with value: 0.6666666666666666 and parameters: {'algorithm': 'ball_tree', 'n_neighbors': 10, 'weights': 'distance', 'metric': 'manhattan'}. Best is trial 21 with value: 0.6938775510204082.
[32m[I 2023-04-26 15:43:53,554][39m Trial 229 finished with value: 0.6938775510204082 and parameters: {'algorithm': 'brute', 'n_neighbors': 11, 'weights': 'distance', 'metric': 'manhattan'}. Best is trial 21 with value: 0.6938775510204082.
[32m[I 2023-04-26 15:43:53,627][39m Trial 230 finished with value: 0.6938775510204082 and parameters: {'algorithm': 'brute', 'n_neighbors': 11, 'weights': 'distance', 'metric': 'manhattan'}. Best is trial 21 with value: 0.6938775510204082.
[32m[I 2023-04-26 15:43:53,675][39m Trial 231 finished with value: 0.6938775510204082 and parameters: {'algorithm': 'brute', 'n_neighbors': 11, 'weights': 'distance', 'metric': 'manhattan'}. Best is trial 21 with value: 0.6938775510204082.
[32m[I 2023-04-26 15:43:53,717][39m Trial 232 finished with value: 0.6938775510204082 and parameters: {'algorithm': 'brute', 'n_neighbors': 11, 'weights': 'distance', 'metric': 'manhattan'}. Best is trial 21 with value: 0.6938775510204082.
[32m[I 2023-04-26 15:43:53,738][39m Trial 233 finished with value: 0.6666666666666666 and parameters: {'algorithm': 'ball_tree', 'n_neighbors': 10, 'weights': 'distance', 'metric': 'manhattan'}. Best is trial 21 with value: 0.6938775510204082.
[32m[I 2023-04-26 15:43:53,761][39m Trial 234 finished with value: 0.6938775510204082 and parameters: {'algorithm': 'auto', 'n_neighbors': 11, 'weights': 'distance', 'metric': 'manhattan'}. Best is trial 21 with value: 0.6938775510204082.
[32m[I 2023-04-26 15:43:53,780][39m Trial 235 finished with value: 0.6464646464646465 and parameters: {'algorithm': 'ball_tree', 'n_neighbors': 12, 'weights': 'distance', 'metric': 'manhattan'}. Best is trial 21 with value: 0.6938775510204082.
[32m[I 2023-04-26 15:43:53,824][39m Trial 236 finished with value: 0.6938775510204082 and parameters: {'algorithm': 'brute', 'n_neighbors': 11, 'weights': 'distance', 'metric': 'manhattan'}. Best is trial 21 with value: 0.6938775510204082.
[32m[I 2023-04-26 15:43:53,846][39m Trial 237 finished with value: 0.6666666666666666 and parameters: {'algorithm': 'ball_tree', 'n_neighbors': 10, 'weights': 'distance', 'metric': 'manhattan'}. Best is trial 21 with value: 0.6938775510204082.
[32m[I 2023-04-26 15:43:53,869][39m Trial 238 finished with value: 0.6105263157894738 and parameters: {'algorithm': 'ball_tree', 'n_neighbors': 13, 'weights': 'distance', 'metric': 'minkowski'}. Best is trial 21 with value: 0.6938775510204082.
[32m[I 2023-04-26 15:43:53,892][39m Trial 239 finished with value: 0.6938775510204082 and parameters: {'algorithm': 'ball_tree', 'n_neighbors': 11, 'weights': 'distance', 'metric': 'manhattan'}. Best is trial 21 with value: 0.6938775510204082.
[32m[I 2023-04-26 15:43:53,939][39m Trial 240 finished with value: 0.6464646464646465 and parameters: {'algorithm': 'brute', 'n_neighbors': 12, 'weights': 'distance', 'metric': 'manhattan'}. Best is trial 21 with value: 0.6938775510204082.
[32m[I 2023-04-26 15:43:53,987][39m Trial 241 finished with value: 0.6938775510204082 and parameters: {'algorithm': 'brute', 'n_neighbors': 11, 'weights': 'distance', 'metric': 'manhattan'}. Best is trial 21 with value: 0.6938775510204082.
[32m[I 2023-04-26 15:43:54,010][39m Trial 242 finished with value: 0.6666666666666666 and parameters: {'algorithm': 'ball_tree', 'n_neighbors': 10, 'weights': 'distance', 'metric': 'manhattan'}. Best is trial 21 with value: 0.6938775510204082.
[32m[I 2023-04-26 15:43:54,031][39m Trial 243 finished with value: 0.6938775510204082 and parameters: {'algorithm': 'ball_tree', 'n_neighbors': 11, 'weights': 'distance', 'metric': 'manhattan'}. Best is trial 21 with value: 0.6938775510204082.
[32m[I 2023-04-26 15:43:54,053][39m Trial 244 finished with value: 0.6938775510204082 and parameters: {'algorithm': 'ball_tree', 'n_neighbors': 11, 'weights': 'distance', 'metric': 'manhattan'}. Best is trial 21 with value: 0.6938775510204082.
[32m[I 2023-04-26 15:43:54,078][39m Trial 245 finished with value: 0.6464646464646465 and parameters: {'algorithm': 'ball_tree', 'n_neighbors': 12, 'weights': 'distance', 'metric': 'manhattan'}. Best is trial 21 with value: 0.6938775510204082.
[32m[I 2023-04-26 15:43:54,147][39m Trial 246 finished with value: 0.6666666666666666 and parameters: {'algorithm': 'brute', 'n_neighbors': 10, 'weights': 'distance', 'metric': 'manhattan'}. Best is trial 21 with value: 0.6938775510204082.
[32m[I 2023-04-26 15:43:54,169][39m Trial 247 finished with value: 0.6938775510204082 and parameters: {'algorithm': 'ball_tree', 'n_neighbors': 11, 'weights': 'distance', 'metric': 'manhattan'}. Best is trial 21 with value: 0.6938775510204082.
[32m[I 2023-04-26 15:43:54,189][39m Trial 248 finished with value: 0.6464646464646465 and parameters: {'algorithm': 'ball_tree', 'n_neighbors': 12, 'weights': 'distance', 'metric': 'manhattan'}. Best is trial 21 with value: 0.6938775510204082.
[32m[I 2023-04-26 15:43:54,209][39m Trial 249 finished with value: 0.6185567010309277 and parameters: {'algorithm': 'ball_tree', 'n_neighbors': 11, 'weights': 'distance', 'metric': 'euclidean'}. Best is trial 21 with value: 0.6938775510204082.
[32m[I 2023-04-26 15:43:54,232][39m Trial 250 finished with value: 0.6666666666666666 and parameters: {'algorithm': 'ball_tree', 'n_neighbors': 10, 'weights': 'distance', 'metric': 'manhattan'}. Best is trial 21 with value: 0.6938775510204082.
[32m[I 2023-04-26 15:43:54,253][39m Trial 251 finished with value: 0.6464646464646465 and parameters: {'algorithm': 'ball_tree', 'n_neighbors': 12, 'weights': 'distance', 'metric': 'manhattan'}. Best is trial 21 with value: 0.6938775510204082.
[32m[I 2023-04-26 15:43:54,271][39m Trial 252 finished with value: 0.5882352941176471 and parameters: {'algorithm': 'auto', 'n_neighbors': 4, 'weights': 'distance', 'metric': 'manhattan'}. Best is trial 21 with value: 0.6938775510204082.
[32m[I 2023-04-26 15:43:54,309][39m Trial 253 finished with value: 0.6938775510204082 and parameters: {'algorithm': 'auto', 'n_neighbors': 11, 'weights': 'distance', 'metric': 'manhattan'}. Best is trial 21 with value: 0.6938775510204082.
[32m[I 2023-04-26 15:43:54,354][39m Trial 254 finished with value: 0.6666666666666666 and parameters: {'algorithm': 'ball_tree', 'n_neighbors': 10, 'weights': 'distance', 'metric': 'manhattan'}. Best is trial 21 with value: 0.6938775510204082.
[32m[I 2023-04-26 15:43:54,393][39m Trial 255 finished with value: 0.6355140186915889 and parameters: {'algorithm': 'auto', 'n_neighbors': 11, 'weights': 'uniform', 'metric': 'manhattan'}. Best is trial 21 with value: 0.6938775510204082.
[32m[I 2023-04-26 15:43:54,417][39m Trial 256 finished with value: 0.6464646464646465 and parameters: {'algorithm': 'auto', 'n_neighbors': 12, 'weights': 'distance', 'metric': 'manhattan'}. Best is trial 21 with value: 0.6938775510204082.
[32m[I 2023-04-26 15:43:54,436][39m Trial 257 finished with value: 0.6938775510204082 and parameters: {'algorithm': 'ball_tree', 'n_neighbors': 11, 'weights': 'distance', 'metric': 'manhattan'}. Best is trial 21 with value: 0.6938775510204082.
[32m[I 2023-04-26 15:43:54,467][39m Trial 258 finished with value: 0.6938775510204082 and parameters: {'algorithm': 'ball_tree', 'n_neighbors': 11, 'weights': 'distance', 'metric': 'manhattan'}. Best is trial 21 with value: 0.6938775510204082.
[32m[I 2023-04-26 15:43:54,501][39m Trial 259 finished with value: 0.6 and parameters: {'algorithm': 'ball_tree', 'n_neighbors': 17, 'weights': 'distance', 'metric': 'manhattan'}. Best is trial 21 with value: 0.6938775510204082.
[32m[I 2023-04-26 15:43:54,517][39m Trial 260 finished with value: 0.6736842105263158 and parameters: {'algorithm': 'ball_tree', 'n_neighbors': 9, 'weights': 'distance', 'metric': 'manhattan'}. Best is trial 21 with value: 0.6938775510204082.
[32m[I 2023-04-26 15:43:54,548][39m Trial 261 finished with value: 0.6666666666666666 and parameters: {'algorithm': 'ball_tree', 'n_neighbors': 10, 'weights': 'distance', 'metric': 'manhattan'}. Best is trial 21 with value: 0.6938775510204082.
[32m[I 2023-04-26 15:43:54,591][39m Trial 262 finished with value: 0.6464646464646465 and parameters: {'algorithm': 'ball_tree', 'n_neighbors': 12, 'weights': 'distance', 'metric': 'manhattan'}. Best is trial 21 with value: 0.6938775510204082.
[32m[I 2023-04-26 15:43:54,617][39m Trial 263 finished with value: 0.6391752577319588 and parameters: {'algorithm': 'auto', 'n_neighbors': 13, 'weights': 'distance', 'metric': 'manhattan'}. Best is trial 21 with value: 0.6938775510204082.
[32m[I 2023-04-26 15:43:54,653][39m Trial 264 finished with value: 0.6938775510204082 and parameters: {'algorithm': 'auto', 'n_neighbors': 11, 'weights': 'distance', 'metric': 'manhattan'}. Best is trial 21 with value: 0.6938775510204082.
[32m[I 2023-04-26 15:43:54,686][39m Trial 265 finished with value: 0.6938775510204082 and parameters: {'algorithm': 'ball_tree', 'n_neighbors': 11, 'weights': 'distance', 'metric': 'manhattan'}. Best is trial 21 with value: 0.6938775510204082.
[32m[I 2023-04-26 15:43:54,720][39m Trial 266 finished with value: 0.6262626262626262 and parameters: {'algorithm': 'ball_tree', 'n_neighbors': 10, 'weights': 'distance', 'metric': 'minkowski'}. Best is trial 21 with value: 0.6938775510204082.
[32m[I 2023-04-26 15:43:54,738][39m Trial 267 finished with value: 0.6019417475728155 and parameters: {'algorithm': 'ball_tree', 'n_neighbors': 29, 'weights': 'distance', 'metric': 'manhattan'}. Best is trial 21 with value: 0.6938775510204082.
[32m[I 2023-04-26 15:43:54,767][39m Trial 268 finished with value: 0.6464646464646465 and parameters: {'algorithm': 'ball_tree', 'n_neighbors': 12, 'weights': 'distance', 'metric': 'manhattan'}. Best is trial 21 with value: 0.6938775510204082.
[32m[I 2023-04-26 15:43:54,862][39m Trial 269 finished with value: 0.6938775510204082 and parameters: {'algorithm': 'brute', 'n_neighbors': 11, 'weights': 'distance', 'metric': 'manhattan'}. Best is trial 21 with value: 0.6938775510204082.
