[32m[I 2023-04-26 15:43:58,204][39m Trial 360 finished with value: 0.6138613861386139 and parameters: {'algorithm': 'brute', 'n_neighbors': 20, 'weights': 'distance', 'metric': 'manhattan'}. Best is trial 21 with value: 0.6938775510204082.
[32m[I 2023-04-26 15:43:58,227][39m Trial 361 finished with value: 0.6666666666666666 and parameters: {'algorithm': 'kd_tree', 'n_neighbors': 10, 'weights': 'distance', 'metric': 'manhattan'}. Best is trial 21 with value: 0.6938775510204082.
[32m[I 2023-04-26 15:43:58,258][39m Trial 362 finished with value: 0.6938775510204082 and parameters: {'algorithm': 'auto', 'n_neighbors': 11, 'weights': 'distance', 'metric': 'manhattan'}. Best is trial 21 with value: 0.6938775510204082.
[32m[I 2023-04-26 15:43:58,290][39m Trial 363 finished with value: 0.6464646464646465 and parameters: {'algorithm': 'ball_tree', 'n_neighbors': 12, 'weights': 'distance', 'metric': 'manhattan'}. Best is trial 21 with value: 0.6938775510204082.
[32m[I 2023-04-26 15:43:58,306][39m Trial 364 finished with value: 0.6185567010309277 and parameters: {'algorithm': 'auto', 'n_neighbors': 11, 'weights': 'distance', 'metric': 'euclidean'}. Best is trial 21 with value: 0.6938775510204082.
[32m[I 2023-04-26 15:43:58,337][39m Trial 365 finished with value: 0.6666666666666666 and parameters: {'algorithm': 'ball_tree', 'n_neighbors': 10, 'weights': 'distance', 'metric': 'manhattan'}. Best is trial 21 with value: 0.6938775510204082.
[32m[I 2023-04-26 15:43:58,363][39m Trial 366 finished with value: 0.6190476190476191 and parameters: {'algorithm': 'kd_tree', 'n_neighbors': 2, 'weights': 'distance', 'metric': 'manhattan'}. Best is trial 21 with value: 0.6938775510204082.
[32m[I 2023-04-26 15:43:58,384][39m Trial 367 finished with value: 0.6464646464646465 and parameters: {'algorithm': 'ball_tree', 'n_neighbors': 12, 'weights': 'distance', 'metric': 'manhattan'}. Best is trial 21 with value: 0.6938775510204082.
[32m[I 2023-04-26 15:43:58,426][39m Trial 368 finished with value: 0.6736842105263158 and parameters: {'algorithm': 'auto', 'n_neighbors': 9, 'weights': 'distance', 'metric': 'manhattan'}. Best is trial 21 with value: 0.6938775510204082.
[32m[I 2023-04-26 15:43:58,541][39m Trial 369 finished with value: 0.6938775510204082 and parameters: {'algorithm': 'brute', 'n_neighbors': 11, 'weights': 'distance', 'metric': 'manhattan'}. Best is trial 21 with value: 0.6938775510204082.
[32m[I 2023-04-26 15:43:58,557][39m Trial 370 finished with value: 0.6666666666666666 and parameters: {'algorithm': 'auto', 'n_neighbors': 10, 'weights': 'distance', 'metric': 'manhattan'}. Best is trial 21 with value: 0.6938775510204082.
[32m[I 2023-04-26 15:43:58,604][39m Trial 371 finished with value: 0.6464646464646465 and parameters: {'algorithm': 'brute', 'n_neighbors': 12, 'weights': 'distance', 'metric': 'manhattan'}. Best is trial 21 with value: 0.6938775510204082.
[32m[I 2023-04-26 15:43:58,635][39m Trial 372 finished with value: 0.6086956521739131 and parameters: {'algorithm': 'ball_tree', 'n_neighbors': 7, 'weights': 'distance', 'metric': 'manhattan'}. Best is trial 21 with value: 0.6938775510204082.
[32m[I 2023-04-26 15:43:58,666][39m Trial 373 finished with value: 0.6938775510204082 and parameters: {'algorithm': 'ball_tree', 'n_neighbors': 11, 'weights': 'distance', 'metric': 'manhattan'}. Best is trial 21 with value: 0.6938775510204082.
[32m[I 2023-04-26 15:43:58,713][39m Trial 374 finished with value: 0.6938775510204082 and parameters: {'algorithm': 'brute', 'n_neighbors': 11, 'weights': 'distance', 'metric': 'manhattan'}. Best is trial 21 with value: 0.6938775510204082.
[32m[I 2023-04-26 15:43:58,744][39m Trial 375 finished with value: 0.6938775510204082 and parameters: {'algorithm': 'ball_tree', 'n_neighbors': 11, 'weights': 'distance', 'metric': 'manhattan'}. Best is trial 21 with value: 0.6938775510204082.
[32m[I 2023-04-26 15:43:58,760][39m Trial 376 finished with value: 0.6464646464646465 and parameters: {'algorithm': 'ball_tree', 'n_neighbors': 12, 'weights': 'distance', 'metric': 'manhattan'}. Best is trial 21 with value: 0.6938775510204082.
[32m[I 2023-04-26 15:43:58,822][39m Trial 377 finished with value: 0.6666666666666666 and parameters: {'algorithm': 'brute', 'n_neighbors': 10, 'weights': 'distance', 'metric': 'manhattan'}. Best is trial 21 with value: 0.6938775510204082.
[32m[I 2023-04-26 15:43:58,869][39m Trial 378 finished with value: 0.6355140186915889 and parameters: {'algorithm': 'brute', 'n_neighbors': 11, 'weights': 'uniform', 'metric': 'manhattan'}. Best is trial 21 with value: 0.6938775510204082.
[32m[I 2023-04-26 15:43:58,885][39m Trial 379 finished with value: 0.6262626262626262 and parameters: {'algorithm': 'ball_tree', 'n_neighbors': 10, 'weights': 'distance', 'metric': 'minkowski'}. Best is trial 21 with value: 0.6938775510204082.
[32m[I 2023-04-26 15:43:58,916][39m Trial 380 finished with value: 0.6391752577319588 and parameters: {'algorithm': 'auto', 'n_neighbors': 13, 'weights': 'distance', 'metric': 'manhattan'}. Best is trial 21 with value: 0.6938775510204082.
[32m[I 2023-04-26 15:43:58,979][39m Trial 381 finished with value: 0.6391752577319588 and parameters: {'algorithm': 'brute', 'n_neighbors': 13, 'weights': 'distance', 'metric': 'manhattan'}. Best is trial 21 with value: 0.6938775510204082.
[32m[I 2023-04-26 15:43:59,041][39m Trial 382 finished with value: 0.6464646464646465 and parameters: {'algorithm': 'brute', 'n_neighbors': 12, 'weights': 'distance', 'metric': 'manhattan'}. Best is trial 21 with value: 0.6938775510204082.
[32m[I 2023-04-26 15:43:59,085][39m Trial 383 finished with value: 0.6736842105263158 and parameters: {'algorithm': 'auto', 'n_neighbors': 9, 'weights': 'distance', 'metric': 'manhattan'}. Best is trial 21 with value: 0.6938775510204082.
[32m[I 2023-04-26 15:43:59,111][39m Trial 384 finished with value: 0.6938775510204082 and parameters: {'algorithm': 'kd_tree', 'n_neighbors': 11, 'weights': 'distance', 'metric': 'manhattan'}. Best is trial 21 with value: 0.6938775510204082.
[32m[I 2023-04-26 15:43:59,150][39m Trial 385 finished with value: 0.6666666666666666 and parameters: {'algorithm': 'brute', 'n_neighbors': 10, 'weights': 'distance', 'metric': 'manhattan'}. Best is trial 21 with value: 0.6938775510204082.
[32m[I 2023-04-26 15:43:59,210][39m Trial 386 finished with value: 0.6122448979591836 and parameters: {'algorithm': 'brute', 'n_neighbors': 12, 'weights': 'distance', 'metric': 'euclidean'}. Best is trial 21 with value: 0.6938775510204082.
[32m[I 2023-04-26 15:43:59,239][39m Trial 387 finished with value: 0.6666666666666666 and parameters: {'algorithm': 'ball_tree', 'n_neighbors': 10, 'weights': 'distance', 'metric': 'manhattan'}. Best is trial 21 with value: 0.6938775510204082.
[32m[I 2023-04-26 15:43:59,307][39m Trial 388 finished with value: 0.6938775510204082 and parameters: {'algorithm': 'brute', 'n_neighbors': 11, 'weights': 'distance', 'metric': 'manhattan'}. Best is trial 21 with value: 0.6938775510204082.
[32m[I 2023-04-26 15:43:59,338][39m Trial 389 finished with value: 0.6938775510204082 and parameters: {'algorithm': 'ball_tree', 'n_neighbors': 11, 'weights': 'distance', 'metric': 'manhattan'}. Best is trial 21 with value: 0.6938775510204082.
[32m[I 2023-04-26 15:43:59,354][39m Trial 390 finished with value: 0.6938775510204082 and parameters: {'algorithm': 'ball_tree', 'n_neighbors': 11, 'weights': 'distance', 'metric': 'manhattan'}. Best is trial 21 with value: 0.6938775510204082.
[32m[I 2023-04-26 15:43:59,385][39m Trial 391 finished with value: 0.6 and parameters: {'algorithm': 'ball_tree', 'n_neighbors': 17, 'weights': 'distance', 'metric': 'manhattan'}. Best is trial 21 with value: 0.6938775510204082.
[32m[I 2023-04-26 15:43:59,417][39m Trial 392 finished with value: 0.6938775510204082 and parameters: {'algorithm': 'ball_tree', 'n_neighbors': 11, 'weights': 'distance', 'metric': 'manhattan'}. Best is trial 21 with value: 0.6938775510204082.
[32m[I 2023-04-26 15:43:59,443][39m Trial 393 finished with value: 0.6464646464646465 and parameters: {'algorithm': 'ball_tree', 'n_neighbors': 12, 'weights': 'distance', 'metric': 'manhattan'}. Best is trial 21 with value: 0.6938775510204082.
[32m[I 2023-04-26 15:43:59,506][39m Trial 394 finished with value: 0.6666666666666666 and parameters: {'algorithm': 'brute', 'n_neighbors': 10, 'weights': 'distance', 'metric': 'manhattan'}. Best is trial 21 with value: 0.6938775510204082.
[32m[I 2023-04-26 15:43:59,558][39m Trial 395 finished with value: 0.6213592233009708 and parameters: {'algorithm': 'kd_tree', 'n_neighbors': 23, 'weights': 'distance', 'metric': 'manhattan'}. Best is trial 21 with value: 0.6938775510204082.
[32m[I 2023-04-26 15:43:59,620][39m Trial 396 finished with value: 0.6464646464646465 and parameters: {'algorithm': 'brute', 'n_neighbors': 12, 'weights': 'distance', 'metric': 'manhattan'}. Best is trial 21 with value: 0.6938775510204082.
[32m[I 2023-04-26 15:43:59,652][39m Trial 397 finished with value: 0.6355140186915889 and parameters: {'algorithm': 'auto', 'n_neighbors': 11, 'weights': 'uniform', 'metric': 'manhattan'}. Best is trial 21 with value: 0.6938775510204082.
[32m[I 2023-04-26 15:43:59,683][39m Trial 398 finished with value: 0.6736842105263158 and parameters: {'algorithm': 'ball_tree', 'n_neighbors': 9, 'weights': 'distance', 'metric': 'manhattan'}. Best is trial 21 with value: 0.6938775510204082.
[32m[I 2023-04-26 15:43:59,714][39m Trial 399 finished with value: 0.6464646464646465 and parameters: {'algorithm': 'auto', 'n_neighbors': 12, 'weights': 'distance', 'metric': 'manhattan'}. Best is trial 21 with value: 0.6938775510204082.
[32m[I 2023-04-26 15:43:59,761][39m Trial 400 finished with value: 0.6666666666666666 and parameters: {'algorithm': 'brute', 'n_neighbors': 10, 'weights': 'distance', 'metric': 'manhattan'}. Best is trial 21 with value: 0.6938775510204082.
[32m[I 2023-04-26 15:43:59,808][39m Trial 401 finished with value: 0.6938775510204082 and parameters: {'algorithm': 'auto', 'n_neighbors': 11, 'weights': 'distance', 'metric': 'manhattan'}. Best is trial 21 with value: 0.6938775510204082.
[32m[I 2023-04-26 15:43:59,824][39m Trial 402 finished with value: 0.6185567010309277 and parameters: {'algorithm': 'auto', 'n_neighbors': 11, 'weights': 'distance', 'metric': 'minkowski'}. Best is trial 21 with value: 0.6938775510204082.
[32m[I 2023-04-26 15:43:59,855][39m Trial 403 finished with value: 0.6464646464646465 and parameters: {'algorithm': 'ball_tree', 'n_neighbors': 12, 'weights': 'distance', 'metric': 'manhattan'}. Best is trial 21 with value: 0.6938775510204082.
[32m[I 2023-04-26 15:43:59,886][39m Trial 404 finished with value: 0.6391752577319588 and parameters: {'algorithm': 'kd_tree', 'n_neighbors': 8, 'weights': 'distance', 'metric': 'manhattan'}. Best is trial 21 with value: 0.6938775510204082.
[32m[I 2023-04-26 15:43:59,919][39m Trial 405 finished with value: 0.6666666666666666 and parameters: {'algorithm': 'ball_tree', 'n_neighbors': 10, 'weights': 'distance', 'metric': 'manhattan'}. Best is trial 21 with value: 0.6938775510204082.
[32m[I 2023-04-26 15:43:59,984][39m Trial 406 finished with value: 0.6938775510204082 and parameters: {'algorithm': 'brute', 'n_neighbors': 11, 'weights': 'distance', 'metric': 'manhattan'}. Best is trial 21 with value: 0.6938775510204082.
[32m[I 2023-04-26 15:44:00,057][39m Trial 407 finished with value: 0.6391752577319588 and parameters: {'algorithm': 'ball_tree', 'n_neighbors': 13, 'weights': 'distance', 'metric': 'manhattan'}. Best is trial 21 with value: 0.6938775510204082.
[32m[I 2023-04-26 15:44:00,085][39m Trial 408 finished with value: 0.6666666666666666 and parameters: {'algorithm': 'ball_tree', 'n_neighbors': 10, 'weights': 'distance', 'metric': 'manhattan'}. Best is trial 21 with value: 0.6938775510204082.
[32m[I 2023-04-26 15:44:00,141][39m Trial 409 finished with value: 0.6185567010309277 and parameters: {'algorithm': 'brute', 'n_neighbors': 11, 'weights': 'distance', 'metric': 'euclidean'}. Best is trial 21 with value: 0.6938775510204082.
[32m[I 2023-04-26 15:44:00,203][39m Trial 410 finished with value: 0.6938775510204082 and parameters: {'algorithm': 'brute', 'n_neighbors': 11, 'weights': 'distance', 'metric': 'manhattan'}. Best is trial 21 with value: 0.6938775510204082.
[32m[I 2023-04-26 15:44:00,244][39m Trial 411 finished with value: 0.6464646464646465 and parameters: {'algorithm': 'ball_tree', 'n_neighbors': 12, 'weights': 'distance', 'metric': 'manhattan'}. Best is trial 21 with value: 0.6938775510204082.
[32m[I 2023-04-26 15:44:00,291][39m Trial 412 finished with value: 0.5918367346938775 and parameters: {'algorithm': 'brute', 'n_neighbors': 10, 'weights': 'uniform', 'metric': 'manhattan'}. Best is trial 21 with value: 0.6938775510204082.
[32m[I 2023-04-26 15:44:00,313][39m Trial 413 finished with value: 0.6938775510204082 and parameters: {'algorithm': 'ball_tree', 'n_neighbors': 11, 'weights': 'distance', 'metric': 'manhattan'}. Best is trial 21 with value: 0.6938775510204082.
[32m[I 2023-04-26 15:44:00,344][39m Trial 414 finished with value: 0.6464646464646465 and parameters: {'algorithm': 'ball_tree', 'n_neighbors': 12, 'weights': 'distance', 'metric': 'manhattan'}. Best is trial 21 with value: 0.6938775510204082.
[32m[I 2023-04-26 15:44:00,391][39m Trial 415 finished with value: 0.6736842105263158 and parameters: {'algorithm': 'brute', 'n_neighbors': 9, 'weights': 'distance', 'metric': 'manhattan'}. Best is trial 21 with value: 0.6938775510204082.
[32m[I 2023-04-26 15:44:00,423][39m Trial 416 finished with value: 0.6391752577319588 and parameters: {'algorithm': 'ball_tree', 'n_neighbors': 13, 'weights': 'distance', 'metric': 'manhattan'}. Best is trial 21 with value: 0.6938775510204082.
[32m[I 2023-04-26 15:44:00,454][39m Trial 417 finished with value: 0.6666666666666666 and parameters: {'algorithm': 'ball_tree', 'n_neighbors': 10, 'weights': 'distance', 'metric': 'manhattan'}. Best is trial 21 with value: 0.6938775510204082.
[32m[I 2023-04-26 15:44:00,470][39m Trial 418 finished with value: 0.6464646464646465 and parameters: {'algorithm': 'ball_tree', 'n_neighbors': 12, 'weights': 'distance', 'metric': 'manhattan'}. Best is trial 21 with value: 0.6938775510204082.
[32m[I 2023-04-26 15:44:00,501][39m Trial 419 finished with value: 0.6938775510204082 and parameters: {'algorithm': 'kd_tree', 'n_neighbors': 11, 'weights': 'distance', 'metric': 'manhattan'}. Best is trial 21 with value: 0.6938775510204082.
[32m[I 2023-04-26 15:44:00,533][39m Trial 420 finished with value: 0.6938775510204082 and parameters: {'algorithm': 'ball_tree', 'n_neighbors': 11, 'weights': 'distance', 'metric': 'manhattan'}. Best is trial 21 with value: 0.6938775510204082.
[32m[I 2023-04-26 15:44:00,595][39m Trial 421 finished with value: 0.6666666666666666 and parameters: {'algorithm': 'brute', 'n_neighbors': 10, 'weights': 'distance', 'metric': 'manhattan'}. Best is trial 21 with value: 0.6938775510204082.
[32m[I 2023-04-26 15:44:00,643][39m Trial 422 finished with value: 0.6938775510204082 and parameters: {'algorithm': 'kd_tree', 'n_neighbors': 11, 'weights': 'distance', 'metric': 'manhattan'}. Best is trial 21 with value: 0.6938775510204082.
[32m[I 2023-04-26 15:44:00,722][39m Trial 423 finished with value: 0.6464646464646465 and parameters: {'algorithm': 'brute', 'n_neighbors': 12, 'weights': 'distance', 'metric': 'manhattan'}. Best is trial 21 with value: 0.6938775510204082.
[32m[I 2023-04-26 15:44:00,753][39m Trial 424 finished with value: 0.6391752577319588 and parameters: {'algorithm': 'kd_tree', 'n_neighbors': 13, 'weights': 'distance', 'metric': 'manhattan'}. Best is trial 21 with value: 0.6938775510204082.
[32m[I 2023-04-26 15:44:00,769][39m Trial 425 finished with value: 0.631578947368421 and parameters: {'algorithm': 'ball_tree', 'n_neighbors': 15, 'weights': 'distance', 'metric': 'minkowski'}. Best is trial 21 with value: 0.6938775510204082.
[32m[I 2023-04-26 15:44:00,800][39m Trial 426 finished with value: 0.6938775510204082 and parameters: {'algorithm': 'ball_tree', 'n_neighbors': 11, 'weights': 'distance', 'metric': 'manhattan'}. Best is trial 21 with value: 0.6938775510204082.
[32m[I 2023-04-26 15:44:00,831][39m Trial 427 finished with value: 0.6373626373626374 and parameters: {'algorithm': 'ball_tree', 'n_neighbors': 5, 'weights': 'distance', 'metric': 'manhattan'}. Best is trial 21 with value: 0.6938775510204082.
[32m[I 2023-04-26 15:44:00,847][39m Trial 428 finished with value: 0.6464646464646465 and parameters: {'algorithm': 'ball_tree', 'n_neighbors': 12, 'weights': 'distance', 'metric': 'manhattan'}. Best is trial 21 with value: 0.6938775510204082.
[32m[I 2023-04-26 15:44:00,929][39m Trial 429 finished with value: 0.6666666666666666 and parameters: {'algorithm': 'brute', 'n_neighbors': 10, 'weights': 'distance', 'metric': 'manhattan'}. Best is trial 21 with value: 0.6938775510204082.
[32m[I 2023-04-26 15:44:00,988][39m Trial 430 finished with value: 0.6736842105263158 and parameters: {'algorithm': 'ball_tree', 'n_neighbors': 9, 'weights': 'distance', 'metric': 'manhattan'}. Best is trial 21 with value: 0.6938775510204082.
[32m[I 2023-04-26 15:44:01,051][39m Trial 431 finished with value: 0.6938775510204082 and parameters: {'algorithm': 'brute', 'n_neighbors': 11, 'weights': 'distance', 'metric': 'manhattan'}. Best is trial 21 with value: 0.6938775510204082.
[32m[I 2023-04-26 15:44:01,082][39m Trial 432 finished with value: 0.5918367346938775 and parameters: {'algorithm': 'ball_tree', 'n_neighbors': 10, 'weights': 'uniform', 'metric': 'manhattan'}. Best is trial 21 with value: 0.6938775510204082.
[32m[I 2023-04-26 15:44:01,129][39m Trial 433 finished with value: 0.6185567010309277 and parameters: {'algorithm': 'brute', 'n_neighbors': 11, 'weights': 'distance', 'metric': 'euclidean'}. Best is trial 21 with value: 0.6938775510204082.
[32m[I 2023-04-26 15:44:01,161][39m Trial 434 finished with value: 0.6464646464646465 and parameters: {'algorithm': 'ball_tree', 'n_neighbors': 12, 'weights': 'distance', 'metric': 'manhattan'}. Best is trial 21 with value: 0.6938775510204082.
[32m[I 2023-04-26 15:44:01,176][39m Trial 435 finished with value: 0.6938775510204082 and parameters: {'algorithm': 'ball_tree', 'n_neighbors': 11, 'weights': 'distance', 'metric': 'manhattan'}. Best is trial 21 with value: 0.6938775510204082.
[32m[I 2023-04-26 15:44:01,208][39m Trial 436 finished with value: 0.6464646464646465 and parameters: {'algorithm': 'ball_tree', 'n_neighbors': 12, 'weights': 'distance', 'metric': 'manhattan'}. Best is trial 21 with value: 0.6938775510204082.
[32m[I 2023-04-26 15:44:01,239][39m Trial 437 finished with value: 0.6122448979591836 and parameters: {'algorithm': 'auto', 'n_neighbors': 14, 'weights': 'distance', 'metric': 'manhattan'}. Best is trial 21 with value: 0.6938775510204082.
[32m[I 2023-04-26 15:44:01,270][39m Trial 438 finished with value: 0.6938775510204082 and parameters: {'algorithm': 'ball_tree', 'n_neighbors': 11, 'weights': 'distance', 'metric': 'manhattan'}. Best is trial 21 with value: 0.6938775510204082.
[32m[I 2023-04-26 15:44:01,292][39m Trial 439 finished with value: 0.6666666666666666 and parameters: {'algorithm': 'ball_tree', 'n_neighbors': 10, 'weights': 'distance', 'metric': 'manhattan'}. Best is trial 21 with value: 0.6938775510204082.
[32m[I 2023-04-26 15:44:01,318][39m Trial 440 finished with value: 0.6666666666666666 and parameters: {'algorithm': 'kd_tree', 'n_neighbors': 10, 'weights': 'distance', 'metric': 'manhattan'}. Best is trial 21 with value: 0.6938775510204082.
[32m[I 2023-04-26 15:44:01,350][39m Trial 441 finished with value: 0.6363636363636364 and parameters: {'algorithm': 'kd_tree', 'n_neighbors': 6, 'weights': 'distance', 'metric': 'manhattan'}. Best is trial 21 with value: 0.6938775510204082.
[32m[I 2023-04-26 15:44:01,381][39m Trial 442 finished with value: 0.6938775510204082 and parameters: {'algorithm': 'ball_tree', 'n_neighbors': 11, 'weights': 'distance', 'metric': 'manhattan'}. Best is trial 21 with value: 0.6938775510204082.
[32m[I 2023-04-26 15:44:01,413][39m Trial 443 finished with value: 0.6464646464646465 and parameters: {'algorithm': 'ball_tree', 'n_neighbors': 12, 'weights': 'distance', 'metric': 'manhattan'}. Best is trial 21 with value: 0.6938775510204082.
[32m[I 2023-04-26 15:44:01,444][39m Trial 444 finished with value: 0.6938775510204082 and parameters: {'algorithm': 'auto', 'n_neighbors': 11, 'weights': 'distance', 'metric': 'manhattan'}. Best is trial 21 with value: 0.6938775510204082.
[32m[I 2023-04-26 15:44:01,476][39m Trial 445 finished with value: 0.6736842105263158 and parameters: {'algorithm': 'auto', 'n_neighbors': 9, 'weights': 'distance', 'metric': 'manhattan'}. Best is trial 21 with value: 0.6938775510204082.
[32m[I 2023-04-26 15:44:01,507][39m Trial 446 finished with value: 0.6105263157894738 and parameters: {'algorithm': 'auto', 'n_neighbors': 13, 'weights': 'distance', 'metric': 'minkowski'}. Best is trial 21 with value: 0.6938775510204082.
[32m[I 2023-04-26 15:44:01,539][39m Trial 447 finished with value: 0.6938775510204082 and parameters: {'algorithm': 'kd_tree', 'n_neighbors': 11, 'weights': 'distance', 'metric': 'manhattan'}. Best is trial 21 with value: 0.6938775510204082.
[32m[I 2023-04-26 15:44:01,570][39m Trial 448 finished with value: 0.6666666666666666 and parameters: {'algorithm': 'kd_tree', 'n_neighbors': 10, 'weights': 'distance', 'metric': 'manhattan'}. Best is trial 21 with value: 0.6938775510204082.
[32m[I 2023-04-26 15:44:01,586][39m Trial 449 finished with value: 0.6019417475728155 and parameters: {'algorithm': 'kd_tree', 'n_neighbors': 28, 'weights': 'distance', 'metric': 'manhattan'}. Best is trial 21 with value: 0.6938775510204082.
