[32m[I 2023-04-26 02:13:04,562][39m Trial 468 finished with value: 0.8470588235294119 and parameters: {'objective': 'CrossEntropy', 'colsample_bylevel': 0.09002967025874312, 'depth': 6, 'boosting_type': 'Plain', 'bootstrap_type': 'Bayesian', 'bagging_temperature': 3.823576011143256}. Best is trial 164 with value: 0.8965517241379309.
[32m[I 2023-04-26 02:13:09,303][39m Trial 469 finished with value: 0.8571428571428572 and parameters: {'objective': 'CrossEntropy', 'colsample_bylevel': 0.09361299073267591, 'depth': 6, 'boosting_type': 'Plain', 'bootstrap_type': 'Bayesian', 'bagging_temperature': 5.370793029377414}. Best is trial 164 with value: 0.8965517241379309.
[32m[I 2023-04-26 02:13:13,804][39m Trial 470 finished with value: 0.8433734939759037 and parameters: {'objective': 'CrossEntropy', 'colsample_bylevel': 0.09175631473244751, 'depth': 6, 'boosting_type': 'Plain', 'bootstrap_type': 'Bayesian', 'bagging_temperature': 5.160865210611299}. Best is trial 164 with value: 0.8965517241379309.
[32m[I 2023-04-26 02:13:18,345][39m Trial 471 finished with value: 0.8571428571428572 and parameters: {'objective': 'CrossEntropy', 'colsample_bylevel': 0.09449393458894464, 'depth': 6, 'boosting_type': 'Plain', 'bootstrap_type': 'Bayesian', 'bagging_temperature': 4.836718134659271}. Best is trial 164 with value: 0.8965517241379309.
[32m[I 2023-04-26 02:13:22,682][39m Trial 472 finished with value: 0.8735632183908046 and parameters: {'objective': 'CrossEntropy', 'colsample_bylevel': 0.09794686990262301, 'depth': 6, 'boosting_type': 'Plain', 'bootstrap_type': 'Bayesian', 'bagging_temperature': 4.692419814422103}. Best is trial 164 with value: 0.8965517241379309.
[32m[I 2023-04-26 02:13:27,166][39m Trial 473 finished with value: 0.8705882352941177 and parameters: {'objective': 'CrossEntropy', 'colsample_bylevel': 0.09679716498125847, 'depth': 6, 'boosting_type': 'Plain', 'bootstrap_type': 'Bayesian', 'bagging_temperature': 5.766391763764507}. Best is trial 164 with value: 0.8965517241379309.
[32m[I 2023-04-26 02:13:31,920][39m Trial 474 finished with value: 0.8705882352941177 and parameters: {'objective': 'CrossEntropy', 'colsample_bylevel': 0.09640288817824759, 'depth': 6, 'boosting_type': 'Plain', 'bootstrap_type': 'Bayesian', 'bagging_temperature': 5.809421125167369}. Best is trial 164 with value: 0.8965517241379309.
[32m[I 2023-04-26 02:13:36,937][39m Trial 475 finished with value: 0.8571428571428572 and parameters: {'objective': 'CrossEntropy', 'colsample_bylevel': 0.09337395686501805, 'depth': 7, 'boosting_type': 'Plain', 'bootstrap_type': 'Bayesian', 'bagging_temperature': 4.241544764011198}. Best is trial 164 with value: 0.8965517241379309.
[32m[I 2023-04-26 02:13:41,557][39m Trial 476 finished with value: 0.8433734939759037 and parameters: {'objective': 'CrossEntropy', 'colsample_bylevel': 0.09506448191372206, 'depth': 6, 'boosting_type': 'Plain', 'bootstrap_type': 'Bayesian', 'bagging_temperature': 3.186794046468143}. Best is trial 164 with value: 0.8965517241379309.
[32m[I 2023-04-26 02:13:46,348][39m Trial 477 finished with value: 0.8433734939759037 and parameters: {'objective': 'CrossEntropy', 'colsample_bylevel': 0.0998715993606001, 'depth': 6, 'boosting_type': 'Plain', 'bootstrap_type': 'Bayesian', 'bagging_temperature': 4.506385707782858}. Best is trial 164 with value: 0.8965517241379309.
[32m[I 2023-04-26 02:13:50,921][39m Trial 478 finished with value: 0.8705882352941177 and parameters: {'objective': 'CrossEntropy', 'colsample_bylevel': 0.09805379186141472, 'depth': 6, 'boosting_type': 'Plain', 'bootstrap_type': 'Bayesian', 'bagging_temperature': 9.239338878688828}. Best is trial 164 with value: 0.8965517241379309.
[32m[I 2023-04-26 02:13:55,267][39m Trial 479 finished with value: 0.8433734939759037 and parameters: {'objective': 'CrossEntropy', 'colsample_bylevel': 0.09026539234193713, 'depth': 6, 'boosting_type': 'Plain', 'bootstrap_type': 'Bayesian', 'bagging_temperature': 3.5877442297742665}. Best is trial 164 with value: 0.8965517241379309.
[32m[I 2023-04-26 02:14:00,096][39m Trial 480 finished with value: 0.8705882352941177 and parameters: {'objective': 'CrossEntropy', 'colsample_bylevel': 0.0997869330528667, 'depth': 6, 'boosting_type': 'Plain', 'bootstrap_type': 'Bayesian', 'bagging_temperature': 9.256734023538804}. Best is trial 164 with value: 0.8965517241379309.
[32m[I 2023-04-26 02:14:06,827][39m Trial 481 finished with value: 0.8181818181818182 and parameters: {'objective': 'CrossEntropy', 'colsample_bylevel': 0.09797298611736752, 'depth': 7, 'boosting_type': 'Ordered', 'bootstrap_type': 'Bayesian', 'bagging_temperature': 5.007589194411668}. Best is trial 164 with value: 0.8965517241379309.
[32m[I 2023-04-26 02:14:09,169][39m Trial 482 finished with value: 0.8604651162790697 and parameters: {'objective': 'Logloss', 'colsample_bylevel': 0.08769420991251359, 'depth': 5, 'boosting_type': 'Plain', 'bootstrap_type': 'Bernoulli', 'subsample': 0.7983080543789144}. Best is trial 164 with value: 0.8965517241379309.
[32m[I 2023-04-26 02:14:14,998][39m Trial 483 finished with value: 0.8433734939759037 and parameters: {'objective': 'CrossEntropy', 'colsample_bylevel': 0.09675871922709453, 'depth': 8, 'boosting_type': 'Plain', 'bootstrap_type': 'Bayesian', 'bagging_temperature': 5.2896584341490005}. Best is trial 164 with value: 0.8965517241379309.
[32m[I 2023-04-26 02:14:20,631][39m Trial 484 finished with value: 0.8433734939759037 and parameters: {'objective': 'CrossEntropy', 'colsample_bylevel': 0.09992829104187383, 'depth': 7, 'boosting_type': 'Plain', 'bootstrap_type': 'Bayesian', 'bagging_temperature': 6.494272743261798}. Best is trial 164 with value: 0.8965517241379309.
[32m[I 2023-04-26 02:14:23,684][39m Trial 485 finished with value: 0.8433734939759037 and parameters: {'objective': 'CrossEntropy', 'colsample_bylevel': 0.09255763999886542, 'depth': 5, 'boosting_type': 'Plain', 'bootstrap_type': 'Bayesian', 'bagging_temperature': 9.459620326453452}. Best is trial 164 with value: 0.8965517241379309.
[32m[I 2023-04-26 02:14:28,777][39m Trial 486 finished with value: 0.8735632183908046 and parameters: {'objective': 'CrossEntropy', 'colsample_bylevel': 0.09406731998028692, 'depth': 7, 'boosting_type': 'Plain', 'bootstrap_type': 'Bayesian', 'bagging_temperature': 7.2913370923120535}. Best is trial 164 with value: 0.8965517241379309.
[32m[I 2023-04-26 02:14:32,701][39m Trial 487 finished with value: 0.8837209302325582 and parameters: {'objective': 'CrossEntropy', 'colsample_bylevel': 0.0960888012502554, 'depth': 5, 'boosting_type': 'Plain', 'bootstrap_type': 'Bayesian', 'bagging_temperature': 8.995589081398013}. Best is trial 164 with value: 0.8965517241379309.
[32m[I 2023-04-26 02:14:37,780][39m Trial 488 finished with value: 0.8705882352941177 and parameters: {'objective': 'CrossEntropy', 'colsample_bylevel': 0.09836266854157864, 'depth': 6, 'boosting_type': 'Plain', 'bootstrap_type': 'Bayesian', 'bagging_temperature': 9.576624611986235}. Best is trial 164 with value: 0.8965517241379309.
[32m[I 2023-04-26 02:14:42,551][39m Trial 489 finished with value: 0.8735632183908046 and parameters: {'objective': 'CrossEntropy', 'colsample_bylevel': 0.09541291903638459, 'depth': 6, 'boosting_type': 'Plain', 'bootstrap_type': 'Bayesian', 'bagging_temperature': 9.24938844188851}. Best is trial 164 with value: 0.8965517241379309.
[32m[I 2023-04-26 02:14:47,513][39m Trial 490 finished with value: 0.8863636363636364 and parameters: {'objective': 'CrossEntropy', 'colsample_bylevel': 0.09420281861289431, 'depth': 6, 'boosting_type': 'Plain', 'bootstrap_type': 'Bayesian', 'bagging_temperature': 4.019900748606122}. Best is trial 164 with value: 0.8965517241379309.
[32m[I 2023-04-26 02:14:52,281][39m Trial 491 finished with value: 0.8604651162790697 and parameters: {'objective': 'CrossEntropy', 'colsample_bylevel': 0.09298445681853212, 'depth': 6, 'boosting_type': 'Plain', 'bootstrap_type': 'Bayesian', 'bagging_temperature': 3.8543277717818487}. Best is trial 164 with value: 0.8965517241379309.
[32m[I 2023-04-26 02:14:57,510][39m Trial 492 finished with value: 0.8837209302325582 and parameters: {'objective': 'CrossEntropy', 'colsample_bylevel': 0.09145680805911646, 'depth': 7, 'boosting_type': 'Plain', 'bootstrap_type': 'Bayesian', 'bagging_temperature': 4.358345537248367}. Best is trial 164 with value: 0.8965517241379309.
[32m[I 2023-04-26 02:15:02,445][39m Trial 493 finished with value: 0.8571428571428572 and parameters: {'objective': 'CrossEntropy', 'colsample_bylevel': 0.09783884889080009, 'depth': 6, 'boosting_type': 'Plain', 'bootstrap_type': 'Bayesian', 'bagging_temperature': 4.6734547214647355}. Best is trial 164 with value: 0.8965517241379309.
[32m[I 2023-04-26 02:15:05,197][39m Trial 494 finished with value: 0.8604651162790697 and parameters: {'objective': 'CrossEntropy', 'colsample_bylevel': 0.09998815641859668, 'depth': 5, 'boosting_type': 'Plain', 'bootstrap_type': 'Bayesian', 'bagging_temperature': 4.535232447439649}. Best is trial 164 with value: 0.8965517241379309.
[32m[I 2023-04-26 02:15:08,963][39m Trial 495 finished with value: 0.8571428571428572 and parameters: {'objective': 'CrossEntropy', 'colsample_bylevel': 0.09465395500429395, 'depth': 6, 'boosting_type': 'Plain', 'bootstrap_type': 'Bayesian', 'bagging_temperature': 3.5167144102772583}. Best is trial 164 with value: 0.8965517241379309.
[32m[I 2023-04-26 02:15:12,382][39m Trial 496 finished with value: 0.8636363636363636 and parameters: {'objective': 'CrossEntropy', 'colsample_bylevel': 0.08815782543858239, 'depth': 6, 'boosting_type': 'Plain', 'bootstrap_type': 'Bayesian', 'bagging_temperature': 4.090795398406133}. Best is trial 164 with value: 0.8965517241379309.
[32m[I 2023-04-26 02:15:16,058][39m Trial 497 finished with value: 0.8571428571428572 and parameters: {'objective': 'CrossEntropy', 'colsample_bylevel': 0.09261811943625958, 'depth': 6, 'boosting_type': 'Plain', 'bootstrap_type': 'Bayesian', 'bagging_temperature': 4.179686778214904}. Best is trial 164 with value: 0.8965517241379309.
[32m[I 2023-04-26 02:15:19,779][39m Trial 498 finished with value: 0.8571428571428572 and parameters: {'objective': 'CrossEntropy', 'colsample_bylevel': 0.09666566164534861, 'depth': 6, 'boosting_type': 'Plain', 'bootstrap_type': 'Bayesian', 'bagging_temperature': 3.9369886701554506}. Best is trial 164 with value: 0.8965517241379309.
[32m[I 2023-04-26 02:15:22,414][39m Trial 499 finished with value: 0.8505747126436782 and parameters: {'objective': 'CrossEntropy', 'colsample_bylevel': 0.09559962247403274, 'depth': 5, 'boosting_type': 'Plain', 'bootstrap_type': 'Bayesian', 'bagging_temperature': 5.50145549433364}. Best is trial 164 with value: 0.8965517241379309.
Number of finished trials: 500