[32m[I 2023-04-26 01:54:14,158][39m Trial 208 finished with value: 0.8181818181818182 and parameters: {'objective': 'CrossEntropy', 'colsample_bylevel': 0.0632203647630977, 'depth': 6, 'boosting_type': 'Plain', 'bootstrap_type': 'Bayesian', 'bagging_temperature': 9.478723918781101}. Best is trial 164 with value: 0.8965517241379309.
[32m[I 2023-04-26 01:54:19,274][39m Trial 209 finished with value: 0.8837209302325582 and parameters: {'objective': 'CrossEntropy', 'colsample_bylevel': 0.09418533066496364, 'depth': 6, 'boosting_type': 'Plain', 'bootstrap_type': 'Bayesian', 'bagging_temperature': 3.8518916456687293}. Best is trial 164 with value: 0.8965517241379309.
[32m[I 2023-04-26 01:54:24,079][39m Trial 210 finished with value: 0.8705882352941177 and parameters: {'objective': 'CrossEntropy', 'colsample_bylevel': 0.09502841327465698, 'depth': 6, 'boosting_type': 'Plain', 'bootstrap_type': 'Bayesian', 'bagging_temperature': 3.5140165836433743}. Best is trial 164 with value: 0.8965517241379309.
[32m[I 2023-04-26 01:54:29,161][39m Trial 211 finished with value: 0.8604651162790697 and parameters: {'objective': 'CrossEntropy', 'colsample_bylevel': 0.09636274855859209, 'depth': 6, 'boosting_type': 'Plain', 'bootstrap_type': 'Bayesian', 'bagging_temperature': 3.969590291716107}. Best is trial 164 with value: 0.8965517241379309.
[32m[I 2023-04-26 01:54:34,280][39m Trial 212 finished with value: 0.8604651162790697 and parameters: {'objective': 'CrossEntropy', 'colsample_bylevel': 0.09985792767771536, 'depth': 6, 'boosting_type': 'Plain', 'bootstrap_type': 'Bayesian', 'bagging_temperature': 9.698115337829794}. Best is trial 164 with value: 0.8965517241379309.
[32m[I 2023-04-26 01:54:40,164][39m Trial 213 finished with value: 0.8837209302325582 and parameters: {'objective': 'CrossEntropy', 'colsample_bylevel': 0.09768384099746726, 'depth': 7, 'boosting_type': 'Plain', 'bootstrap_type': 'Bayesian', 'bagging_temperature': 7.71686620919309}. Best is trial 164 with value: 0.8965517241379309.
[32m[I 2023-04-26 01:54:43,960][39m Trial 214 finished with value: 0.8372093023255814 and parameters: {'objective': 'CrossEntropy', 'colsample_bylevel': 0.09748490705370882, 'depth': 5, 'boosting_type': 'Plain', 'bootstrap_type': 'Bayesian', 'bagging_temperature': 7.60075499804183}. Best is trial 164 with value: 0.8965517241379309.
[32m[I 2023-04-26 01:54:48,932][39m Trial 215 finished with value: 0.8470588235294119 and parameters: {'objective': 'CrossEntropy', 'colsample_bylevel': 0.09835969611074034, 'depth': 6, 'boosting_type': 'Plain', 'bootstrap_type': 'Bayesian', 'bagging_temperature': 6.80570058050008}. Best is trial 164 with value: 0.8965517241379309.
[32m[I 2023-04-26 01:54:51,629][39m Trial 216 finished with value: 0.8333333333333333 and parameters: {'objective': 'CrossEntropy', 'colsample_bylevel': 0.09314225420700667, 'depth': 5, 'boosting_type': 'Plain', 'bootstrap_type': 'Bayesian', 'bagging_temperature': 1.0362975647119124}. Best is trial 164 with value: 0.8965517241379309.
[32m[I 2023-04-26 01:54:55,297][39m Trial 217 finished with value: 0.8292682926829268 and parameters: {'objective': 'CrossEntropy', 'colsample_bylevel': 0.09441920683212908, 'depth': 6, 'boosting_type': 'Plain', 'bootstrap_type': 'Bayesian', 'bagging_temperature': 3.6066480782358883}. Best is trial 164 with value: 0.8965517241379309.
[32m[I 2023-04-26 01:54:58,954][39m Trial 218 finished with value: 0.8571428571428572 and parameters: {'objective': 'CrossEntropy', 'colsample_bylevel': 0.09265668437500801, 'depth': 6, 'boosting_type': 'Plain', 'bootstrap_type': 'Bayesian', 'bagging_temperature': 7.9214017068710145}. Best is trial 164 with value: 0.8965517241379309.
[32m[I 2023-04-26 01:55:02,802][39m Trial 219 finished with value: 0.8837209302325582 and parameters: {'objective': 'CrossEntropy', 'colsample_bylevel': 0.09687976367453481, 'depth': 6, 'boosting_type': 'Plain', 'bootstrap_type': 'Bayesian', 'bagging_temperature': 4.899961545587535}. Best is trial 164 with value: 0.8965517241379309.
[32m[I 2023-04-26 01:55:06,682][39m Trial 220 finished with value: 0.8505747126436782 and parameters: {'objective': 'CrossEntropy', 'colsample_bylevel': 0.0978236386463254, 'depth': 6, 'boosting_type': 'Plain', 'bootstrap_type': 'Bayesian', 'bagging_temperature': 4.56490656102071}. Best is trial 164 with value: 0.8965517241379309.
[32m[I 2023-04-26 01:55:11,226][39m Trial 221 finished with value: 0.8571428571428572 and parameters: {'objective': 'CrossEntropy', 'colsample_bylevel': 0.09585224236244812, 'depth': 7, 'boosting_type': 'Plain', 'bootstrap_type': 'Bayesian', 'bagging_temperature': 4.9472639136966885}. Best is trial 164 with value: 0.8965517241379309.
[32m[I 2023-04-26 01:55:15,677][39m Trial 222 finished with value: 0.8433734939759037 and parameters: {'objective': 'CrossEntropy', 'colsample_bylevel': 0.09710368981951319, 'depth': 7, 'boosting_type': 'Plain', 'bootstrap_type': 'Bayesian', 'bagging_temperature': 4.40644046752757}. Best is trial 164 with value: 0.8965517241379309.
[32m[I 2023-04-26 01:55:19,171][39m Trial 223 finished with value: 0.8705882352941177 and parameters: {'objective': 'CrossEntropy', 'colsample_bylevel': 0.0901901359520717, 'depth': 6, 'boosting_type': 'Plain', 'bootstrap_type': 'Bayesian', 'bagging_temperature': 9.065103558676274}. Best is trial 164 with value: 0.8965517241379309.
[32m[I 2023-04-26 01:55:23,664][39m Trial 224 finished with value: 0.8148148148148149 and parameters: {'objective': 'CrossEntropy', 'colsample_bylevel': 0.09426101326516842, 'depth': 7, 'boosting_type': 'Plain', 'bootstrap_type': 'Bayesian', 'bagging_temperature': 4.096906948588724}. Best is trial 164 with value: 0.8965517241379309.
[32m[I 2023-04-26 01:55:27,979][39m Trial 225 finished with value: 0.8863636363636364 and parameters: {'objective': 'CrossEntropy', 'colsample_bylevel': 0.09496886595540206, 'depth': 6, 'boosting_type': 'Plain', 'bootstrap_type': 'Bayesian', 'bagging_temperature': 3.3579848512467647}. Best is trial 164 with value: 0.8965517241379309.
[32m[I 2023-04-26 01:55:32,528][39m Trial 226 finished with value: 0.8571428571428572 and parameters: {'objective': 'CrossEntropy', 'colsample_bylevel': 0.09998610532815552, 'depth': 6, 'boosting_type': 'Plain', 'bootstrap_type': 'Bayesian', 'bagging_temperature': 3.1777227037787736}. Best is trial 164 with value: 0.8965517241379309.
[32m[I 2023-04-26 01:55:34,903][39m Trial 227 finished with value: 0.8735632183908046 and parameters: {'objective': 'CrossEntropy', 'colsample_bylevel': 0.09218739617693601, 'depth': 4, 'boosting_type': 'Plain', 'bootstrap_type': 'Bayesian', 'bagging_temperature': 3.3785344288718515}. Best is trial 164 with value: 0.8965517241379309.
[32m[I 2023-04-26 01:55:37,038][39m Trial 228 finished with value: 0.8275862068965518 and parameters: {'objective': 'CrossEntropy', 'colsample_bylevel': 0.092177129232613, 'depth': 3, 'boosting_type': 'Plain', 'bootstrap_type': 'Bayesian', 'bagging_temperature': 2.859208324717815}. Best is trial 164 with value: 0.8965517241379309.
[32m[I 2023-04-26 01:55:39,197][39m Trial 229 finished with value: 0.8275862068965518 and parameters: {'objective': 'CrossEntropy', 'colsample_bylevel': 0.09419417560413948, 'depth': 3, 'boosting_type': 'Plain', 'bootstrap_type': 'Bayesian', 'bagging_temperature': 3.410419618949904}. Best is trial 164 with value: 0.8965517241379309.
[32m[I 2023-04-26 01:55:41,867][39m Trial 230 finished with value: 0.8571428571428572 and parameters: {'objective': 'CrossEntropy', 'colsample_bylevel': 0.09644449176787877, 'depth': 5, 'boosting_type': 'Plain', 'bootstrap_type': 'Bayesian', 'bagging_temperature': 1.9563996806207016}. Best is trial 164 with value: 0.8965517241379309.
[32m[I 2023-04-26 01:55:44,154][39m Trial 231 finished with value: 0.8539325842696629 and parameters: {'objective': 'CrossEntropy', 'colsample_bylevel': 0.0913171057703581, 'depth': 4, 'boosting_type': 'Plain', 'bootstrap_type': 'Bayesian', 'bagging_temperature': 3.6094448004088138}. Best is trial 164 with value: 0.8965517241379309.
[32m[I 2023-04-26 01:55:46,553][39m Trial 232 finished with value: 0.8505747126436782 and parameters: {'objective': 'CrossEntropy', 'colsample_bylevel': 0.0972453572748466, 'depth': 4, 'boosting_type': 'Plain', 'bootstrap_type': 'Bayesian', 'bagging_temperature': 3.8274378610755693}. Best is trial 164 with value: 0.8965517241379309.
[32m[I 2023-04-26 01:55:50,474][39m Trial 233 finished with value: 0.8705882352941177 and parameters: {'objective': 'CrossEntropy', 'colsample_bylevel': 0.09777002396800431, 'depth': 6, 'boosting_type': 'Plain', 'bootstrap_type': 'Bayesian', 'bagging_temperature': 5.376375302494724}. Best is trial 164 with value: 0.8965517241379309.
[32m[I 2023-04-26 01:55:54,470][39m Trial 234 finished with value: 0.8705882352941177 and parameters: {'objective': 'CrossEntropy', 'colsample_bylevel': 0.09538942122003881, 'depth': 6, 'boosting_type': 'Plain', 'bootstrap_type': 'Bayesian', 'bagging_temperature': 3.309559289282858}. Best is trial 164 with value: 0.8965517241379309.
[32m[I 2023-04-26 01:55:57,997][39m Trial 235 finished with value: 0.8604651162790697 and parameters: {'objective': 'CrossEntropy', 'colsample_bylevel': 0.09330860265660168, 'depth': 6, 'boosting_type': 'Plain', 'bootstrap_type': 'Bayesian', 'bagging_temperature': 2.418054439717273}. Best is trial 164 with value: 0.8965517241379309.
[32m[I 2023-04-26 01:56:01,849][39m Trial 236 finished with value: 0.8705882352941177 and parameters: {'objective': 'CrossEntropy', 'colsample_bylevel': 0.09803280950780217, 'depth': 6, 'boosting_type': 'Plain', 'bootstrap_type': 'Bayesian', 'bagging_temperature': 5.294563040136215}. Best is trial 164 with value: 0.8965517241379309.
[32m[I 2023-04-26 01:56:06,058][39m Trial 237 finished with value: 0.8965517241379309 and parameters: {'objective': 'CrossEntropy', 'colsample_bylevel': 0.09919545489998344, 'depth': 6, 'boosting_type': 'Plain', 'bootstrap_type': 'Bayesian', 'bagging_temperature': 4.8557823016570225}. Best is trial 164 with value: 0.8965517241379309.
[32m[I 2023-04-26 01:56:08,839][39m Trial 238 finished with value: 0.8505747126436782 and parameters: {'objective': 'CrossEntropy', 'colsample_bylevel': 0.09561407105191215, 'depth': 5, 'boosting_type': 'Plain', 'bootstrap_type': 'Bayesian', 'bagging_temperature': 5.880455390942814}. Best is trial 164 with value: 0.8965517241379309.
[32m[I 2023-04-26 01:56:13,025][39m Trial 239 finished with value: 0.8705882352941177 and parameters: {'objective': 'CrossEntropy', 'colsample_bylevel': 0.09984322605682218, 'depth': 6, 'boosting_type': 'Plain', 'bootstrap_type': 'Bayesian', 'bagging_temperature': 4.908955737945357}. Best is trial 164 with value: 0.8965517241379309.
[32m[I 2023-04-26 01:56:22,160][39m Trial 240 finished with value: 0.8089887640449439 and parameters: {'objective': 'CrossEntropy', 'colsample_bylevel': 0.09479308410922409, 'depth': 6, 'boosting_type': 'Ordered', 'bootstrap_type': 'Bayesian', 'bagging_temperature': 3.946753426109191}. Best is trial 164 with value: 0.8965517241379309.
[32m[I 2023-04-26 01:56:24,942][39m Trial 241 finished with value: 0.8372093023255814 and parameters: {'objective': 'CrossEntropy', 'colsample_bylevel': 0.09819851172784519, 'depth': 5, 'boosting_type': 'Plain', 'bootstrap_type': 'Bayesian', 'bagging_temperature': 6.519416392701535}. Best is trial 164 with value: 0.8965517241379309.
[32m[I 2023-04-26 01:56:28,837][39m Trial 242 finished with value: 0.8837209302325582 and parameters: {'objective': 'CrossEntropy', 'colsample_bylevel': 0.09279350320579281, 'depth': 6, 'boosting_type': 'Plain', 'bootstrap_type': 'Bayesian', 'bagging_temperature': 3.0748007653180363}. Best is trial 164 with value: 0.8965517241379309.
[32m[I 2023-04-26 01:56:32,468][39m Trial 243 finished with value: 0.8705882352941177 and parameters: {'objective': 'CrossEntropy', 'colsample_bylevel': 0.09297041412636486, 'depth': 6, 'boosting_type': 'Plain', 'bootstrap_type': 'Bayesian', 'bagging_temperature': 3.2136799476392928}. Best is trial 164 with value: 0.8965517241379309.
[32m[I 2023-04-26 01:56:36,300][39m Trial 244 finished with value: 0.8604651162790697 and parameters: {'objective': 'CrossEntropy', 'colsample_bylevel': 0.09564148179530887, 'depth': 6, 'boosting_type': 'Plain', 'bootstrap_type': 'Bayesian', 'bagging_temperature': 3.0631341531221525}. Best is trial 164 with value: 0.8965517241379309.
[32m[I 2023-04-26 01:56:40,126][39m Trial 245 finished with value: 0.8705882352941177 and parameters: {'objective': 'CrossEntropy', 'colsample_bylevel': 0.09784054229920831, 'depth': 6, 'boosting_type': 'Plain', 'bootstrap_type': 'Bayesian', 'bagging_temperature': 2.8008851170533005}. Best is trial 164 with value: 0.8965517241379309.
[32m[I 2023-04-26 01:56:43,855][39m Trial 246 finished with value: 0.8705882352941177 and parameters: {'objective': 'CrossEntropy', 'colsample_bylevel': 0.09172408741606855, 'depth': 6, 'boosting_type': 'Plain', 'bootstrap_type': 'Bayesian', 'bagging_temperature': 7.149381389197675}. Best is trial 164 with value: 0.8965517241379309.
[32m[I 2023-04-26 01:56:48,434][39m Trial 247 finished with value: 0.8571428571428572 and parameters: {'objective': 'CrossEntropy', 'colsample_bylevel': 0.09620898705636999, 'depth': 7, 'boosting_type': 'Plain', 'bootstrap_type': 'Bayesian', 'bagging_temperature': 4.244607616756991}. Best is trial 164 with value: 0.8965517241379309.
[32m[I 2023-04-26 01:56:52,370][39m Trial 248 finished with value: 0.8735632183908046 and parameters: {'objective': 'CrossEntropy', 'colsample_bylevel': 0.09338500674309383, 'depth': 6, 'boosting_type': 'Plain', 'bootstrap_type': 'Bayesian', 'bagging_temperature': 3.7405256895506143}. Best is trial 164 with value: 0.8965517241379309.
[32m[I 2023-04-26 01:56:56,218][39m Trial 249 finished with value: 0.8470588235294119 and parameters: {'objective': 'CrossEntropy', 'colsample_bylevel': 0.09417675513264016, 'depth': 6, 'boosting_type': 'Plain', 'bootstrap_type': 'Bayesian', 'bagging_temperature': 3.7199282556301316}. Best is trial 164 with value: 0.8965517241379309.
[32m[I 2023-04-26 01:56:58,871][39m Trial 250 finished with value: 0.8470588235294119 and parameters: {'objective': 'CrossEntropy', 'colsample_bylevel': 0.09247689304006376, 'depth': 5, 'boosting_type': 'Plain', 'bootstrap_type': 'Bayesian', 'bagging_temperature': 3.4504152764652742}. Best is trial 164 with value: 0.8965517241379309.
[32m[I 2023-04-26 01:57:02,781][39m Trial 251 finished with value: 0.8674698795180722 and parameters: {'objective': 'CrossEntropy', 'colsample_bylevel': 0.09847679257599733, 'depth': 6, 'boosting_type': 'Plain', 'bootstrap_type': 'Bayesian', 'bagging_temperature': 3.6633292142292944}. Best is trial 164 with value: 0.8965517241379309.
[32m[I 2023-04-26 01:57:06,659][39m Trial 252 finished with value: 0.8837209302325582 and parameters: {'objective': 'CrossEntropy', 'colsample_bylevel': 0.09667711786510966, 'depth': 6, 'boosting_type': 'Plain', 'bootstrap_type': 'Bayesian', 'bagging_temperature': 3.9915545551166676}. Best is trial 164 with value: 0.8965517241379309.
[32m[I 2023-04-26 01:57:10,601][39m Trial 253 finished with value: 0.8735632183908046 and parameters: {'objective': 'CrossEntropy', 'colsample_bylevel': 0.09407623904834513, 'depth': 6, 'boosting_type': 'Plain', 'bootstrap_type': 'Bayesian', 'bagging_temperature': 8.00887672643151}. Best is trial 164 with value: 0.8965517241379309.
[32m[I 2023-04-26 01:57:14,126][39m Trial 254 finished with value: 0.8636363636363636 and parameters: {'objective': 'CrossEntropy', 'colsample_bylevel': 0.09038994776576303, 'depth': 6, 'boosting_type': 'Plain', 'bootstrap_type': 'Bayesian', 'bagging_temperature': 7.887115187169242}. Best is trial 164 with value: 0.8965517241379309.
[32m[I 2023-04-26 01:57:18,326][39m Trial 255 finished with value: 0.8571428571428572 and parameters: {'objective': 'CrossEntropy', 'colsample_bylevel': 0.09998195825475745, 'depth': 6, 'boosting_type': 'Plain', 'bootstrap_type': 'Bayesian', 'bagging_temperature': 3.9807178503551364}. Best is trial 164 with value: 0.8965517241379309.
[32m[I 2023-04-26 01:57:22,980][39m Trial 256 finished with value: 0.8571428571428572 and parameters: {'objective': 'CrossEntropy', 'colsample_bylevel': 0.09688949022303746, 'depth': 7, 'boosting_type': 'Plain', 'bootstrap_type': 'Bayesian', 'bagging_temperature': 5.187316637045567}. Best is trial 164 with value: 0.8965517241379309.
[32m[I 2023-04-26 01:57:25,686][39m Trial 257 finished with value: 0.8470588235294119 and parameters: {'objective': 'CrossEntropy', 'colsample_bylevel': 0.09677281338788782, 'depth': 5, 'boosting_type': 'Plain', 'bootstrap_type': 'Bayesian', 'bagging_temperature': 4.321301240599778}. Best is trial 164 with value: 0.8965517241379309.
[32m[I 2023-04-26 01:57:29,302][39m Trial 258 finished with value: 0.8571428571428572 and parameters: {'objective': 'CrossEntropy', 'colsample_bylevel': 0.09456335031318695, 'depth': 6, 'boosting_type': 'Plain', 'bootstrap_type': 'Bayesian', 'bagging_temperature': 9.51420890159141}. Best is trial 164 with value: 0.8965517241379309.
[32m[I 2023-04-26 01:57:31,702][39m Trial 259 finished with value: 0.8505747126436782 and parameters: {'objective': 'CrossEntropy', 'colsample_bylevel': 0.0956494349352006, 'depth': 4, 'boosting_type': 'Plain', 'bootstrap_type': 'Bayesian', 'bagging_temperature': 4.833724379735244}. Best is trial 164 with value: 0.8965517241379309.
[32m[I 2023-04-26 01:57:32,880][39m Trial 260 finished with value: 0.7391304347826086 and parameters: {'objective': 'CrossEntropy', 'colsample_bylevel': 0.017254140090353316, 'depth': 6, 'boosting_type': 'Plain', 'bootstrap_type': 'Bayesian', 'bagging_temperature': 8.321617791342582}. Best is trial 164 with value: 0.8965517241379309.
[32m[I 2023-04-26 01:57:35,631][39m Trial 261 finished with value: 0.8604651162790697 and parameters: {'objective': 'CrossEntropy', 'colsample_bylevel': 0.0983810121486263, 'depth': 5, 'boosting_type': 'Plain', 'bootstrap_type': 'Bayesian', 'bagging_temperature': 7.525557434507388}. Best is trial 164 with value: 0.8965517241379309.
[32m[I 2023-04-26 01:57:39,455][39m Trial 262 finished with value: 0.8470588235294119 and parameters: {'objective': 'CrossEntropy', 'colsample_bylevel': 0.09227759503186539, 'depth': 6, 'boosting_type': 'Plain', 'bootstrap_type': 'Bayesian', 'bagging_temperature': 3.5770792138595264}. Best is trial 164 with value: 0.8965517241379309.
[32m[I 2023-04-26 01:57:43,423][39m Trial 263 finished with value: 0.7912087912087912 and parameters: {'objective': 'CrossEntropy', 'colsample_bylevel': 0.05598005206089788, 'depth': 7, 'boosting_type': 'Ordered', 'bootstrap_type': 'Bayesian', 'bagging_temperature': 8.68312030479272}. Best is trial 164 with value: 0.8965517241379309.
[32m[I 2023-04-26 01:57:46,956][39m Trial 264 finished with value: 0.8292682926829268 and parameters: {'objective': 'CrossEntropy', 'colsample_bylevel': 0.09415208518317007, 'depth': 6, 'boosting_type': 'Plain', 'bootstrap_type': 'Bayesian', 'bagging_temperature': 4.456970951044629}. Best is trial 164 with value: 0.8965517241379309.
[32m[I 2023-04-26 01:57:51,505][39m Trial 265 finished with value: 0.8470588235294119 and parameters: {'objective': 'CrossEntropy', 'colsample_bylevel': 0.09055544876074745, 'depth': 6, 'boosting_type': 'Plain', 'bootstrap_type': 'Bayesian', 'bagging_temperature': 8.037953541786834}. Best is trial 164 with value: 0.8965517241379309.
[32m[I 2023-04-26 01:57:57,455][39m Trial 266 finished with value: 0.8571428571428572 and parameters: {'objective': 'CrossEntropy', 'colsample_bylevel': 0.09819360274395296, 'depth': 7, 'boosting_type': 'Plain', 'bootstrap_type': 'Bayesian', 'bagging_temperature': 6.093443091132037}. Best is trial 164 with value: 0.8965517241379309.
[32m[I 2023-04-26 01:58:02,716][39m Trial 267 finished with value: 0.8705882352941177 and parameters: {'objective': 'CrossEntropy', 'colsample_bylevel': 0.09654679538154683, 'depth': 6, 'boosting_type': 'Plain', 'bootstrap_type': 'Bayesian', 'bagging_temperature': 4.102928508524595}. Best is trial 164 with value: 0.8965517241379309.
[32m[I 2023-04-26 01:58:06,516][39m Trial 268 finished with value: 0.8433734939759037 and parameters: {'objective': 'CrossEntropy', 'colsample_bylevel': 0.099592757669073, 'depth': 5, 'boosting_type': 'Plain', 'bootstrap_type': 'Bernoulli', 'subsample': 0.16748844374483557}. Best is trial 164 with value: 0.8965517241379309.
[32m[I 2023-04-26 01:58:09,481][39m Trial 269 finished with value: 0.8636363636363636 and parameters: {'objective': 'CrossEntropy', 'colsample_bylevel': 0.09528108763079117, 'depth': 5, 'boosting_type': 'Plain', 'bootstrap_type': 'Bayesian', 'bagging_temperature': 0.5021137589059204}. Best is trial 164 with value: 0.8965517241379309.
[32m[I 2023-04-26 01:58:14,053][39m Trial 270 finished with value: 0.8292682926829268 and parameters: {'objective': 'CrossEntropy', 'colsample_bylevel': 0.09416465266737999, 'depth': 6, 'boosting_type': 'Plain', 'bootstrap_type': 'Bayesian', 'bagging_temperature': 9.214961045500074}. Best is trial 164 with value: 0.8965517241379309.
[32m[I 2023-04-26 01:58:17,296][39m Trial 271 finished with value: 0.8505747126436782 and parameters: {'objective': 'CrossEntropy', 'colsample_bylevel': 0.06913772935129515, 'depth': 6, 'boosting_type': 'Plain', 'bootstrap_type': 'Bayesian', 'bagging_temperature': 4.709941002739912}. Best is trial 164 with value: 0.8965517241379309.
[32m[I 2023-04-26 01:58:21,973][39m Trial 272 finished with value: 0.8705882352941177 and parameters: {'objective': 'CrossEntropy', 'colsample_bylevel': 0.09255662396663428, 'depth': 6, 'boosting_type': 'Plain', 'bootstrap_type': 'Bayesian', 'bagging_temperature': 2.614269487862832}. Best is trial 164 with value: 0.8965517241379309.
