[32m[I 2023-04-26 01:44:32,008][39m Trial 73 finished with value: 0.8292682926829268 and parameters: {'objective': 'CrossEntropy', 'colsample_bylevel': 0.08063041063264552, 'depth': 8, 'boosting_type': 'Plain', 'bootstrap_type': 'Bernoulli', 'subsample': 0.7265864290287624}. Best is trial 23 with value: 0.8705882352941177.
[32m[I 2023-04-26 01:44:38,001][39m Trial 74 finished with value: 0.8395061728395061 and parameters: {'objective': 'CrossEntropy', 'colsample_bylevel': 0.08842414890995254, 'depth': 9, 'boosting_type': 'Plain', 'bootstrap_type': 'MVS'}. Best is trial 23 with value: 0.8705882352941177.
[32m[I 2023-04-26 01:44:39,116][39m Trial 75 finished with value: 0.6947368421052632 and parameters: {'objective': 'Logloss', 'colsample_bylevel': 0.010735018294747392, 'depth': 2, 'boosting_type': 'Plain', 'bootstrap_type': 'MVS'}. Best is trial 23 with value: 0.8705882352941177.
[32m[I 2023-04-26 01:44:45,607][39m Trial 76 finished with value: 0.8536585365853658 and parameters: {'objective': 'CrossEntropy', 'colsample_bylevel': 0.09321883436848794, 'depth': 12, 'boosting_type': 'Plain', 'bootstrap_type': 'MVS'}. Best is trial 23 with value: 0.8705882352941177.
[32m[I 2023-04-26 01:44:49,630][39m Trial 77 finished with value: 0.8674698795180722 and parameters: {'objective': 'CrossEntropy', 'colsample_bylevel': 0.082130404386634, 'depth': 11, 'boosting_type': 'Plain', 'bootstrap_type': 'MVS'}. Best is trial 23 with value: 0.8705882352941177.
[32m[I 2023-04-26 01:44:53,665][39m Trial 78 finished with value: 0.8571428571428572 and parameters: {'objective': 'CrossEntropy', 'colsample_bylevel': 0.08186876228846862, 'depth': 11, 'boosting_type': 'Plain', 'bootstrap_type': 'Bayesian', 'bagging_temperature': 2.979997288360309}. Best is trial 23 with value: 0.8705882352941177.
[32m[I 2023-04-26 01:44:56,728][39m Trial 79 finished with value: 0.8372093023255814 and parameters: {'objective': 'Logloss', 'colsample_bylevel': 0.07420401629237748, 'depth': 5, 'boosting_type': 'Plain', 'bootstrap_type': 'MVS'}. Best is trial 23 with value: 0.8705882352941177.
[32m[I 2023-04-26 01:45:03,319][39m Trial 80 finished with value: 0.8045977011494252 and parameters: {'objective': 'CrossEntropy', 'colsample_bylevel': 0.08588424485918304, 'depth': 7, 'boosting_type': 'Ordered', 'bootstrap_type': 'MVS'}. Best is trial 23 with value: 0.8705882352941177.
[32m[I 2023-04-26 01:45:09,098][39m Trial 81 finished with value: 0.8433734939759037 and parameters: {'objective': 'CrossEntropy', 'colsample_bylevel': 0.09780652102711511, 'depth': 8, 'boosting_type': 'Plain', 'bootstrap_type': 'MVS'}. Best is trial 23 with value: 0.8705882352941177.
[32m[I 2023-04-26 01:45:15,561][39m Trial 82 finished with value: 0.8500000000000001 and parameters: {'objective': 'CrossEntropy', 'colsample_bylevel': 0.09644300004043298, 'depth': 8, 'boosting_type': 'Plain', 'bootstrap_type': 'MVS'}. Best is trial 23 with value: 0.8705882352941177.
[32m[I 2023-04-26 01:45:22,213][39m Trial 83 finished with value: 0.8674698795180722 and parameters: {'objective': 'CrossEntropy', 'colsample_bylevel': 0.09092364808217601, 'depth': 9, 'boosting_type': 'Plain', 'bootstrap_type': 'MVS'}. Best is trial 23 with value: 0.8705882352941177.
[32m[I 2023-04-26 01:45:28,941][39m Trial 84 finished with value: 0.8674698795180722 and parameters: {'objective': 'CrossEntropy', 'colsample_bylevel': 0.09107199431394015, 'depth': 9, 'boosting_type': 'Plain', 'bootstrap_type': 'MVS'}. Best is trial 23 with value: 0.8705882352941177.
[32m[I 2023-04-26 01:45:32,247][39m Trial 85 finished with value: 0.8705882352941177 and parameters: {'objective': 'CrossEntropy', 'colsample_bylevel': 0.07831181862218255, 'depth': 7, 'boosting_type': 'Plain', 'bootstrap_type': 'MVS'}. Best is trial 23 with value: 0.8705882352941177.
[32m[I 2023-04-26 01:45:35,780][39m Trial 86 finished with value: 0.8433734939759037 and parameters: {'objective': 'CrossEntropy', 'colsample_bylevel': 0.07726256998674558, 'depth': 7, 'boosting_type': 'Plain', 'bootstrap_type': 'MVS'}. Best is trial 23 with value: 0.8705882352941177.
[32m[I 2023-04-26 01:45:40,730][39m Trial 87 finished with value: 0.8674698795180722 and parameters: {'objective': 'CrossEntropy', 'colsample_bylevel': 0.09982191682585417, 'depth': 7, 'boosting_type': 'Plain', 'bootstrap_type': 'Bernoulli', 'subsample': 0.9946979743252194}. Best is trial 23 with value: 0.8705882352941177.
[32m[I 2023-04-26 01:45:44,523][39m Trial 88 finished with value: 0.8571428571428572 and parameters: {'objective': 'CrossEntropy', 'colsample_bylevel': 0.0999436531042097, 'depth': 6, 'boosting_type': 'Plain', 'bootstrap_type': 'Bernoulli', 'subsample': 0.9880850680398721}. Best is trial 23 with value: 0.8705882352941177.
[32m[I 2023-04-26 01:45:48,469][39m Trial 89 finished with value: 0.8571428571428572 and parameters: {'objective': 'CrossEntropy', 'colsample_bylevel': 0.07896119793970989, 'depth': 8, 'boosting_type': 'Plain', 'bootstrap_type': 'MVS'}. Best is trial 23 with value: 0.8705882352941177.
[32m[I 2023-04-26 01:45:52,426][39m Trial 90 finished with value: 0.8705882352941177 and parameters: {'objective': 'CrossEntropy', 'colsample_bylevel': 0.08468480242389131, 'depth': 7, 'boosting_type': 'Plain', 'bootstrap_type': 'MVS'}. Best is trial 23 with value: 0.8705882352941177.
[32m[I 2023-04-26 01:45:56,420][39m Trial 91 finished with value: 0.8674698795180722 and parameters: {'objective': 'CrossEntropy', 'colsample_bylevel': 0.08522942695874065, 'depth': 7, 'boosting_type': 'Plain', 'bootstrap_type': 'MVS'}. Best is trial 23 with value: 0.8705882352941177.
[32m[I 2023-04-26 01:45:59,767][39m Trial 92 finished with value: 0.8433734939759037 and parameters: {'objective': 'CrossEntropy', 'colsample_bylevel': 0.08744872910600938, 'depth': 6, 'boosting_type': 'Plain', 'bootstrap_type': 'MVS'}. Best is trial 23 with value: 0.8705882352941177.
[32m[I 2023-04-26 01:46:03,925][39m Trial 93 finished with value: 0.8433734939759037 and parameters: {'objective': 'CrossEntropy', 'colsample_bylevel': 0.09479112229700387, 'depth': 7, 'boosting_type': 'Plain', 'bootstrap_type': 'Bernoulli', 'subsample': 0.40003096347044664}. Best is trial 23 with value: 0.8705882352941177.
[32m[I 2023-04-26 01:46:08,326][39m Trial 94 finished with value: 0.8571428571428572 and parameters: {'objective': 'CrossEntropy', 'colsample_bylevel': 0.09724238589722776, 'depth': 7, 'boosting_type': 'Plain', 'bootstrap_type': 'Bernoulli', 'subsample': 0.7512217373938397}. Best is trial 23 with value: 0.8705882352941177.
[32m[I 2023-04-26 01:46:11,876][39m Trial 95 finished with value: 0.8674698795180722 and parameters: {'objective': 'Logloss', 'colsample_bylevel': 0.09278387949114127, 'depth': 10, 'boosting_type': 'Plain', 'bootstrap_type': 'MVS'}. Best is trial 23 with value: 0.8705882352941177.
[32m[I 2023-04-26 01:46:15,409][39m Trial 96 finished with value: 0.8705882352941177 and parameters: {'objective': 'Logloss', 'colsample_bylevel': 0.08947536084924702, 'depth': 10, 'boosting_type': 'Plain', 'bootstrap_type': 'MVS'}. Best is trial 23 with value: 0.8705882352941177.
[32m[I 2023-04-26 01:46:25,807][39m Trial 97 finished with value: 0.8372093023255814 and parameters: {'objective': 'Logloss', 'colsample_bylevel': 0.09338275317396595, 'depth': 10, 'boosting_type': 'Ordered', 'bootstrap_type': 'MVS'}. Best is trial 23 with value: 0.8705882352941177.
[32m[I 2023-04-26 01:46:31,325][39m Trial 98 finished with value: 0.8674698795180722 and parameters: {'objective': 'CrossEntropy', 'colsample_bylevel': 0.09080153044641939, 'depth': 9, 'boosting_type': 'Plain', 'bootstrap_type': 'MVS'}. Best is trial 23 with value: 0.8705882352941177.
[32m[I 2023-04-26 01:46:35,021][39m Trial 99 finished with value: 0.8571428571428572 and parameters: {'objective': 'Logloss', 'colsample_bylevel': 0.0836165240805765, 'depth': 11, 'boosting_type': 'Plain', 'bootstrap_type': 'MVS'}. Best is trial 23 with value: 0.8705882352941177.
[32m[I 2023-04-26 01:46:40,887][39m Trial 100 finished with value: 0.8674698795180722 and parameters: {'objective': 'CrossEntropy', 'colsample_bylevel': 0.08921854318064318, 'depth': 9, 'boosting_type': 'Plain', 'bootstrap_type': 'MVS'}. Best is trial 23 with value: 0.8705882352941177.
[32m[I 2023-04-26 01:46:45,367][39m Trial 101 finished with value: 0.8470588235294119 and parameters: {'objective': 'Logloss', 'colsample_bylevel': 0.0866116292965127, 'depth': 8, 'boosting_type': 'Plain', 'bootstrap_type': 'MVS'}. Best is trial 23 with value: 0.8705882352941177.
[32m[I 2023-04-26 01:46:49,776][39m Trial 102 finished with value: 0.8571428571428572 and parameters: {'objective': 'CrossEntropy', 'colsample_bylevel': 0.08907568830475815, 'depth': 8, 'boosting_type': 'Plain', 'bootstrap_type': 'MVS'}. Best is trial 23 with value: 0.8705882352941177.
[32m[I 2023-04-26 01:46:55,424][39m Trial 103 finished with value: 0.8571428571428572 and parameters: {'objective': 'Logloss', 'colsample_bylevel': 0.09184653777600327, 'depth': 9, 'boosting_type': 'Plain', 'bootstrap_type': 'MVS'}. Best is trial 23 with value: 0.8705882352941177.
[32m[I 2023-04-26 01:46:59,216][39m Trial 104 finished with value: 0.8571428571428572 and parameters: {'objective': 'Logloss', 'colsample_bylevel': 0.094823362736422, 'depth': 10, 'boosting_type': 'Plain', 'bootstrap_type': 'Bernoulli', 'subsample': 0.8681981825168407}. Best is trial 23 with value: 0.8705882352941177.
[32m[I 2023-04-26 01:47:04,255][39m Trial 105 finished with value: 0.8292682926829268 and parameters: {'objective': 'CrossEntropy', 'colsample_bylevel': 0.08297357675695997, 'depth': 9, 'boosting_type': 'Plain', 'bootstrap_type': 'MVS'}. Best is trial 23 with value: 0.8705882352941177.
[32m[I 2023-04-26 01:47:09,065][39m Trial 106 finished with value: 0.8433734939759037 and parameters: {'objective': 'CrossEntropy', 'colsample_bylevel': 0.09052878257829612, 'depth': 8, 'boosting_type': 'Plain', 'bootstrap_type': 'Bayesian', 'bagging_temperature': 0.32503975009263186}. Best is trial 23 with value: 0.8705882352941177.
[32m[I 2023-04-26 01:47:10,802][39m Trial 107 finished with value: 0.7912087912087912 and parameters: {'objective': 'Logloss', 'colsample_bylevel': 0.04230977189597167, 'depth': 7, 'boosting_type': 'Plain', 'bootstrap_type': 'MVS'}. Best is trial 23 with value: 0.8705882352941177.
[32m[I 2023-04-26 01:47:14,545][39m Trial 108 finished with value: 0.8571428571428572 and parameters: {'objective': 'Logloss', 'colsample_bylevel': 0.09398959350893951, 'depth': 10, 'boosting_type': 'Plain', 'bootstrap_type': 'MVS'}. Best is trial 23 with value: 0.8705882352941177.
[32m[I 2023-04-26 01:47:17,452][39m Trial 109 finished with value: 0.8571428571428572 and parameters: {'objective': 'CrossEntropy', 'colsample_bylevel': 0.07885959862886426, 'depth': 6, 'boosting_type': 'Plain', 'bootstrap_type': 'Bernoulli', 'subsample': 0.5905596895330496}. Best is trial 23 with value: 0.8705882352941177.
[32m[I 2023-04-26 01:47:22,208][39m Trial 110 finished with value: 0.8571428571428572 and parameters: {'objective': 'CrossEntropy', 'colsample_bylevel': 0.08160701228464927, 'depth': 9, 'boosting_type': 'Plain', 'bootstrap_type': 'Bernoulli', 'subsample': 0.42598206962748864}. Best is trial 23 with value: 0.8705882352941177.
[32m[I 2023-04-26 01:47:26,006][39m Trial 111 finished with value: 0.8571428571428572 and parameters: {'objective': 'CrossEntropy', 'colsample_bylevel': 0.08371765444273091, 'depth': 7, 'boosting_type': 'Plain', 'bootstrap_type': 'MVS'}. Best is trial 23 with value: 0.8705882352941177.
[32m[I 2023-04-26 01:47:29,368][39m Trial 112 finished with value: 0.8636363636363636 and parameters: {'objective': 'CrossEntropy', 'colsample_bylevel': 0.07582081459523297, 'depth': 7, 'boosting_type': 'Plain', 'bootstrap_type': 'MVS'}. Best is trial 23 with value: 0.8705882352941177.
[32m[I 2023-04-26 01:47:33,228][39m Trial 113 finished with value: 0.8470588235294119 and parameters: {'objective': 'Logloss', 'colsample_bylevel': 0.08903540584717752, 'depth': 7, 'boosting_type': 'Plain', 'bootstrap_type': 'MVS'}. Best is trial 23 with value: 0.8705882352941177.
[32m[I 2023-04-26 01:47:35,255][39m Trial 114 finished with value: 0.8409090909090909 and parameters: {'objective': 'CrossEntropy', 'colsample_bylevel': 0.051678363274584506, 'depth': 7, 'boosting_type': 'Plain', 'bootstrap_type': 'Bayesian', 'bagging_temperature': 8.888492817338818}. Best is trial 23 with value: 0.8705882352941177.
[32m[I 2023-04-26 01:47:36,817][39m Trial 115 finished with value: 0.7912087912087912 and parameters: {'objective': 'CrossEntropy', 'colsample_bylevel': 0.030179825472109952, 'depth': 8, 'boosting_type': 'Plain', 'bootstrap_type': 'MVS'}. Best is trial 23 with value: 0.8705882352941177.
[32m[I 2023-04-26 01:47:43,371][39m Trial 116 finished with value: 0.8 and parameters: {'objective': 'CrossEntropy', 'colsample_bylevel': 0.06874294474467824, 'depth': 12, 'boosting_type': 'Ordered', 'bootstrap_type': 'MVS'}. Best is trial 23 with value: 0.8705882352941177.
[32m[I 2023-04-26 01:47:47,525][39m Trial 117 finished with value: 0.8433734939759037 and parameters: {'objective': 'CrossEntropy', 'colsample_bylevel': 0.09225188150822299, 'depth': 11, 'boosting_type': 'Plain', 'bootstrap_type': 'MVS'}. Best is trial 23 with value: 0.8705882352941177.
[32m[I 2023-04-26 01:47:51,154][39m Trial 118 finished with value: 0.8705882352941177 and parameters: {'objective': 'Logloss', 'colsample_bylevel': 0.08839133392031168, 'depth': 6, 'boosting_type': 'Plain', 'bootstrap_type': 'MVS'}. Best is trial 23 with value: 0.8705882352941177.
[32m[I 2023-04-26 01:47:55,090][39m Trial 119 finished with value: 0.8837209302325582 and parameters: {'objective': 'CrossEntropy', 'colsample_bylevel': 0.09765003681892993, 'depth': 6, 'boosting_type': 'Plain', 'bootstrap_type': 'Bayesian', 'bagging_temperature': 5.63050022619786}. Best is trial 119 with value: 0.8837209302325582.
[32m[I 2023-04-26 01:47:58,159][39m Trial 120 finished with value: 0.8705882352941177 and parameters: {'objective': 'CrossEntropy', 'colsample_bylevel': 0.0809643111670644, 'depth': 6, 'boosting_type': 'Plain', 'bootstrap_type': 'Bayesian', 'bagging_temperature': 5.337757737683118}. Best is trial 119 with value: 0.8837209302325582.
[32m[I 2023-04-26 01:48:00,485][39m Trial 121 finished with value: 0.8409090909090909 and parameters: {'objective': 'CrossEntropy', 'colsample_bylevel': 0.07948460532440545, 'depth': 5, 'boosting_type': 'Plain', 'bootstrap_type': 'Bayesian', 'bagging_temperature': 5.298613023884461}. Best is trial 119 with value: 0.8837209302325582.
[32m[I 2023-04-26 01:48:03,707][39m Trial 122 finished with value: 0.8139534883720929 and parameters: {'objective': 'Logloss', 'colsample_bylevel': 0.0849590427616256, 'depth': 6, 'boosting_type': 'Plain', 'bootstrap_type': 'Bayesian', 'bagging_temperature': 6.885823466265773}. Best is trial 119 with value: 0.8837209302325582.
[32m[I 2023-04-26 01:48:07,249][39m Trial 123 finished with value: 0.8470588235294119 and parameters: {'objective': 'Logloss', 'colsample_bylevel': 0.08705701899143821, 'depth': 6, 'boosting_type': 'Plain', 'bootstrap_type': 'Bayesian', 'bagging_temperature': 4.060796795903043}. Best is trial 119 with value: 0.8837209302325582.
[32m[I 2023-04-26 01:48:09,974][39m Trial 124 finished with value: 0.8539325842696629 and parameters: {'objective': 'Logloss', 'colsample_bylevel': 0.0977890340616076, 'depth': 5, 'boosting_type': 'Plain', 'bootstrap_type': 'Bayesian', 'bagging_temperature': 5.220339805816678}. Best is trial 119 with value: 0.8837209302325582.
[32m[I 2023-04-26 01:48:12,515][39m Trial 125 finished with value: 0.8351648351648352 and parameters: {'objective': 'Logloss', 'colsample_bylevel': 0.07385302196975974, 'depth': 6, 'boosting_type': 'Plain', 'bootstrap_type': 'Bayesian', 'bagging_temperature': 7.210802272812671}. Best is trial 119 with value: 0.8837209302325582.
[32m[I 2023-04-26 01:48:16,168][39m Trial 126 finished with value: 0.8705882352941177 and parameters: {'objective': 'CrossEntropy', 'colsample_bylevel': 0.08973169310805669, 'depth': 6, 'boosting_type': 'Plain', 'bootstrap_type': 'Bayesian', 'bagging_temperature': 1.4359663364597184}. Best is trial 119 with value: 0.8837209302325582.
[32m[I 2023-04-26 01:48:19,737][39m Trial 127 finished with value: 0.8571428571428572 and parameters: {'objective': 'CrossEntropy', 'colsample_bylevel': 0.09105432789788782, 'depth': 6, 'boosting_type': 'Plain', 'bootstrap_type': 'Bayesian', 'bagging_temperature': 3.306124109715075}. Best is trial 119 with value: 0.8837209302325582.
[32m[I 2023-04-26 01:48:22,109][39m Trial 128 finished with value: 0.8735632183908046 and parameters: {'objective': 'CrossEntropy', 'colsample_bylevel': 0.08067921810530515, 'depth': 5, 'boosting_type': 'Plain', 'bootstrap_type': 'Bayesian', 'bagging_temperature': 1.2871548873801013}. Best is trial 119 with value: 0.8837209302325582.
[32m[I 2023-04-26 01:48:24,199][39m Trial 129 finished with value: 0.8409090909090909 and parameters: {'objective': 'Logloss', 'colsample_bylevel': 0.07706404780806488, 'depth': 4, 'boosting_type': 'Plain', 'bootstrap_type': 'Bayesian', 'bagging_temperature': 1.3888128009973622}. Best is trial 119 with value: 0.8837209302325582.
[32m[I 2023-04-26 01:48:26,643][39m Trial 130 finished with value: 0.8235294117647058 and parameters: {'objective': 'Logloss', 'colsample_bylevel': 0.08825079829427965, 'depth': 4, 'boosting_type': 'Plain', 'bootstrap_type': 'Bayesian', 'bagging_temperature': 1.7777481329969524}. Best is trial 119 with value: 0.8837209302325582.
[32m[I 2023-04-26 01:48:29,528][39m Trial 131 finished with value: 0.8705882352941177 and parameters: {'objective': 'CrossEntropy', 'colsample_bylevel': 0.0963702358301092, 'depth': 5, 'boosting_type': 'Plain', 'bootstrap_type': 'Bayesian', 'bagging_temperature': 0.8655890750935565}. Best is trial 119 with value: 0.8837209302325582.
[32m[I 2023-04-26 01:48:31,992][39m Trial 132 finished with value: 0.8604651162790697 and parameters: {'objective': 'CrossEntropy', 'colsample_bylevel': 0.08046603991573278, 'depth': 5, 'boosting_type': 'Plain', 'bootstrap_type': 'Bayesian', 'bagging_temperature': 0.7542264217647532}. Best is trial 119 with value: 0.8837209302325582.
[32m[I 2023-04-26 01:48:34,800][39m Trial 133 finished with value: 0.8604651162790697 and parameters: {'objective': 'CrossEntropy', 'colsample_bylevel': 0.09582148927463693, 'depth': 5, 'boosting_type': 'Plain', 'bootstrap_type': 'Bayesian', 'bagging_temperature': 1.21495773658156}. Best is trial 119 with value: 0.8837209302325582.
[32m[I 2023-04-26 01:48:37,759][39m Trial 134 finished with value: 0.8837209302325582 and parameters: {'objective': 'CrossEntropy', 'colsample_bylevel': 0.0970463939532499, 'depth': 5, 'boosting_type': 'Plain', 'bootstrap_type': 'Bayesian', 'bagging_temperature': 2.360347685223891}. Best is trial 119 with value: 0.8837209302325582.
[32m[I 2023-04-26 01:48:41,495][39m Trial 135 finished with value: 0.8604651162790697 and parameters: {'objective': 'CrossEntropy', 'colsample_bylevel': 0.0964519593588754, 'depth': 4, 'boosting_type': 'Plain', 'bootstrap_type': 'Bayesian', 'bagging_temperature': 2.2804467653489517}. Best is trial 119 with value: 0.8837209302325582.
[32m[I 2023-04-26 01:48:44,420][39m Trial 136 finished with value: 0.8604651162790697 and parameters: {'objective': 'CrossEntropy', 'colsample_bylevel': 0.07212648457664775, 'depth': 5, 'boosting_type': 'Plain', 'bootstrap_type': 'Bayesian', 'bagging_temperature': 0.9902042127927304}. Best is trial 119 with value: 0.8837209302325582.
[32m[I 2023-04-26 01:48:48,128][39m Trial 137 finished with value: 0.8470588235294119 and parameters: {'objective': 'CrossEntropy', 'colsample_bylevel': 0.09287517922859304, 'depth': 5, 'boosting_type': 'Plain', 'bootstrap_type': 'Bayesian', 'bagging_temperature': 1.5756326912110405}. Best is trial 119 with value: 0.8837209302325582.
[32m[I 2023-04-26 01:49:01,510][39m Trial 138 finished with value: 0.8409090909090909 and parameters: {'objective': 'CrossEntropy', 'colsample_bylevel': 0.0949242301227125, 'depth': 6, 'boosting_type': 'Ordered', 'bootstrap_type': 'Bayesian', 'bagging_temperature': 2.790352535491053}. Best is trial 119 with value: 0.8837209302325582.
[32m[I 2023-04-26 01:49:06,648][39m Trial 139 finished with value: 0.8395061728395061 and parameters: {'objective': 'CrossEntropy', 'colsample_bylevel': 0.09834287543469178, 'depth': 6, 'boosting_type': 'Plain', 'bootstrap_type': 'Bayesian', 'bagging_temperature': 0.8233338166910956}. Best is trial 119 with value: 0.8837209302325582.
[32m[I 2023-04-26 01:49:10,017][39m Trial 140 finished with value: 0.8470588235294119 and parameters: {'objective': 'CrossEntropy', 'colsample_bylevel': 0.08490548568124173, 'depth': 5, 'boosting_type': 'Plain', 'bootstrap_type': 'Bayesian', 'bagging_temperature': 1.9882858851039131}. Best is trial 119 with value: 0.8837209302325582.
[32m[I 2023-04-26 01:49:15,170][39m Trial 141 finished with value: 0.8809523809523809 and parameters: {'objective': 'CrossEntropy', 'colsample_bylevel': 0.0999417945967983, 'depth': 6, 'boosting_type': 'Plain', 'bootstrap_type': 'Bayesian', 'bagging_temperature': 3.5253124579773893}. Best is trial 119 with value: 0.8837209302325582.
[32m[I 2023-04-26 01:49:18,293][39m Trial 142 finished with value: 0.8181818181818182 and parameters: {'objective': 'CrossEntropy', 'colsample_bylevel': 0.0999485589183659, 'depth': 3, 'boosting_type': 'Plain', 'bootstrap_type': 'Bayesian', 'bagging_temperature': 3.4262501520768045}. Best is trial 119 with value: 0.8837209302325582.
