[32m[I 2023-04-26 02:08:18,107][39m Trial 403 finished with value: 0.8636363636363636 and parameters: {'objective': 'CrossEntropy', 'colsample_bylevel': 0.09083837780090694, 'depth': 6, 'boosting_type': 'Plain', 'bootstrap_type': 'Bayesian', 'bagging_temperature': 9.101048091452249}. Best is trial 164 with value: 0.8965517241379309.
[32m[I 2023-04-26 02:08:26,599][39m Trial 404 finished with value: 0.8 and parameters: {'objective': 'CrossEntropy', 'colsample_bylevel': 0.08949975135861969, 'depth': 6, 'boosting_type': 'Ordered', 'bootstrap_type': 'Bayesian', 'bagging_temperature': 5.780799224284963}. Best is trial 164 with value: 0.8965517241379309.
[32m[I 2023-04-26 02:08:28,166][39m Trial 405 finished with value: 0.7608695652173912 and parameters: {'objective': 'Logloss', 'colsample_bylevel': 0.09639361402651851, 'depth': 1, 'boosting_type': 'Plain', 'bootstrap_type': 'Bayesian', 'bagging_temperature': 9.606302783084105}. Best is trial 164 with value: 0.8965517241379309.
[32m[I 2023-04-26 02:08:30,880][39m Trial 406 finished with value: 0.8604651162790697 and parameters: {'objective': 'CrossEntropy', 'colsample_bylevel': 0.09550688066899898, 'depth': 5, 'boosting_type': 'Plain', 'bootstrap_type': 'Bayesian', 'bagging_temperature': 6.702202534670127}. Best is trial 164 with value: 0.8965517241379309.
[32m[I 2023-04-26 02:08:34,921][39m Trial 407 finished with value: 0.8571428571428572 and parameters: {'objective': 'CrossEntropy', 'colsample_bylevel': 0.09681404784918614, 'depth': 6, 'boosting_type': 'Plain', 'bootstrap_type': 'Bayesian', 'bagging_temperature': 5.215470572143009}. Best is trial 164 with value: 0.8965517241379309.
[32m[I 2023-04-26 02:08:38,828][39m Trial 408 finished with value: 0.8705882352941177 and parameters: {'objective': 'CrossEntropy', 'colsample_bylevel': 0.09667621130524864, 'depth': 6, 'boosting_type': 'Plain', 'bootstrap_type': 'Bayesian', 'bagging_temperature': 4.717237408810649}. Best is trial 164 with value: 0.8965517241379309.
[32m[I 2023-04-26 02:08:42,726][39m Trial 409 finished with value: 0.8604651162790697 and parameters: {'objective': 'CrossEntropy', 'colsample_bylevel': 0.09396932037451375, 'depth': 6, 'boosting_type': 'Plain', 'bootstrap_type': 'Bayesian', 'bagging_temperature': 3.5165271363910966}. Best is trial 164 with value: 0.8965517241379309.
[32m[I 2023-04-26 02:08:45,364][39m Trial 410 finished with value: 0.8636363636363636 and parameters: {'objective': 'CrossEntropy', 'colsample_bylevel': 0.09502585151276842, 'depth': 5, 'boosting_type': 'Plain', 'bootstrap_type': 'Bayesian', 'bagging_temperature': 9.5989209968627}. Best is trial 164 with value: 0.8965517241379309.
[32m[I 2023-04-26 02:08:49,307][39m Trial 411 finished with value: 0.8571428571428572 and parameters: {'objective': 'CrossEntropy', 'colsample_bylevel': 0.09858126551842336, 'depth': 6, 'boosting_type': 'Plain', 'bootstrap_type': 'Bayesian', 'bagging_temperature': 5.29630582053992}. Best is trial 164 with value: 0.8965517241379309.
[32m[I 2023-04-26 02:08:53,161][39m Trial 412 finished with value: 0.8705882352941177 and parameters: {'objective': 'CrossEntropy', 'colsample_bylevel': 0.09536285375378101, 'depth': 6, 'boosting_type': 'Plain', 'bootstrap_type': 'Bayesian', 'bagging_temperature': 3.3909078816348552}. Best is trial 164 with value: 0.8965517241379309.
[32m[I 2023-04-26 02:08:57,565][39m Trial 413 finished with value: 0.8571428571428572 and parameters: {'objective': 'CrossEntropy', 'colsample_bylevel': 0.09224748704898952, 'depth': 7, 'boosting_type': 'Plain', 'bootstrap_type': 'Bayesian', 'bagging_temperature': 4.9701310391547775}. Best is trial 164 with value: 0.8965517241379309.
[32m[I 2023-04-26 02:09:01,215][39m Trial 414 finished with value: 0.8863636363636364 and parameters: {'objective': 'CrossEntropy', 'colsample_bylevel': 0.09229762178106635, 'depth': 6, 'boosting_type': 'Plain', 'bootstrap_type': 'Bayesian', 'bagging_temperature': 6.004084765248813}. Best is trial 164 with value: 0.8965517241379309.
[32m[I 2023-04-26 02:09:04,560][39m Trial 415 finished with value: 0.8735632183908046 and parameters: {'objective': 'CrossEntropy', 'colsample_bylevel': 0.088859852988419, 'depth': 6, 'boosting_type': 'Plain', 'bootstrap_type': 'Bayesian', 'bagging_temperature': 5.997541106238101}. Best is trial 164 with value: 0.8965517241379309.
[32m[I 2023-04-26 02:09:09,054][39m Trial 416 finished with value: 0.8433734939759037 and parameters: {'objective': 'CrossEntropy', 'colsample_bylevel': 0.09659721812957762, 'depth': 7, 'boosting_type': 'Plain', 'bootstrap_type': 'Bayesian', 'bagging_temperature': 5.418887631604212}. Best is trial 164 with value: 0.8965517241379309.
[32m[I 2023-04-26 02:09:12,502][39m Trial 417 finished with value: 0.8705882352941177 and parameters: {'objective': 'CrossEntropy', 'colsample_bylevel': 0.09227060930668533, 'depth': 6, 'boosting_type': 'Plain', 'bootstrap_type': 'Bayesian', 'bagging_temperature': 9.29446269405352}. Best is trial 164 with value: 0.8965517241379309.
[32m[I 2023-04-26 02:09:15,449][39m Trial 418 finished with value: 0.8571428571428572 and parameters: {'objective': 'CrossEntropy', 'colsample_bylevel': 0.0935372847116117, 'depth': 6, 'boosting_type': 'Plain', 'bootstrap_type': 'Bernoulli', 'subsample': 0.4861332063723231}. Best is trial 164 with value: 0.8965517241379309.
[32m[I 2023-04-26 02:09:19,149][39m Trial 419 finished with value: 0.8705882352941177 and parameters: {'objective': 'CrossEntropy', 'colsample_bylevel': 0.09393139408856278, 'depth': 6, 'boosting_type': 'Plain', 'bootstrap_type': 'Bayesian', 'bagging_temperature': 4.317835969035513}. Best is trial 164 with value: 0.8965517241379309.
[32m[I 2023-04-26 02:09:22,794][39m Trial 420 finished with value: 0.8604651162790697 and parameters: {'objective': 'CrossEntropy', 'colsample_bylevel': 0.09392427217061257, 'depth': 6, 'boosting_type': 'Plain', 'bootstrap_type': 'Bayesian', 'bagging_temperature': 4.5076252570504085}. Best is trial 164 with value: 0.8965517241379309.
[32m[I 2023-04-26 02:09:25,428][39m Trial 421 finished with value: 0.8333333333333333 and parameters: {'objective': 'CrossEntropy', 'colsample_bylevel': 0.09137836419023872, 'depth': 5, 'boosting_type': 'Plain', 'bootstrap_type': 'Bayesian', 'bagging_temperature': 6.299721027416018}. Best is trial 164 with value: 0.8965517241379309.
[32m[I 2023-04-26 02:09:28,809][39m Trial 422 finished with value: 0.8604651162790697 and parameters: {'objective': 'CrossEntropy', 'colsample_bylevel': 0.09194893377092668, 'depth': 6, 'boosting_type': 'Plain', 'bootstrap_type': 'Bayesian', 'bagging_temperature': 5.108406610011156}. Best is trial 164 with value: 0.8965517241379309.
[32m[I 2023-04-26 02:09:38,079][39m Trial 423 finished with value: 0.7954545454545454 and parameters: {'objective': 'CrossEntropy', 'colsample_bylevel': 0.09845708363869056, 'depth': 6, 'boosting_type': 'Ordered', 'bootstrap_type': 'Bayesian', 'bagging_temperature': 8.505037774856927}. Best is trial 164 with value: 0.8965517241379309.
[32m[I 2023-04-26 02:09:40,924][39m Trial 424 finished with value: 0.8235294117647058 and parameters: {'objective': 'Logloss', 'colsample_bylevel': 0.0997246264298272, 'depth': 5, 'boosting_type': 'Plain', 'bootstrap_type': 'Bayesian', 'bagging_temperature': 5.422246490934065}. Best is trial 164 with value: 0.8965517241379309.
[32m[I 2023-04-26 02:09:44,748][39m Trial 425 finished with value: 0.8604651162790697 and parameters: {'objective': 'CrossEntropy', 'colsample_bylevel': 0.09544850341383407, 'depth': 6, 'boosting_type': 'Plain', 'bootstrap_type': 'Bayesian', 'bagging_temperature': 3.2432581983278594}. Best is trial 164 with value: 0.8965517241379309.
[32m[I 2023-04-26 02:09:48,909][39m Trial 426 finished with value: 0.8837209302325582 and parameters: {'objective': 'CrossEntropy', 'colsample_bylevel': 0.09991966176512931, 'depth': 6, 'boosting_type': 'Plain', 'bootstrap_type': 'Bayesian', 'bagging_temperature': 9.431634495519116}. Best is trial 164 with value: 0.8965517241379309.
[32m[I 2023-04-26 02:09:52,262][39m Trial 427 finished with value: 0.8571428571428572 and parameters: {'objective': 'CrossEntropy', 'colsample_bylevel': 0.08903156967532622, 'depth': 6, 'boosting_type': 'Plain', 'bootstrap_type': 'Bayesian', 'bagging_temperature': 5.885860498183955}. Best is trial 164 with value: 0.8965517241379309.
[32m[I 2023-04-26 02:09:56,197][39m Trial 428 finished with value: 0.8333333333333333 and parameters: {'objective': 'CrossEntropy', 'colsample_bylevel': 0.09757152519769541, 'depth': 6, 'boosting_type': 'Plain', 'bootstrap_type': 'Bayesian', 'bagging_temperature': 8.918801822833355}. Best is trial 164 with value: 0.8965517241379309.
[32m[I 2023-04-26 02:10:00,011][39m Trial 429 finished with value: 0.8571428571428572 and parameters: {'objective': 'CrossEntropy', 'colsample_bylevel': 0.094005582135591, 'depth': 6, 'boosting_type': 'Plain', 'bootstrap_type': 'Bayesian', 'bagging_temperature': 3.9562124825211473}. Best is trial 164 with value: 0.8965517241379309.
[32m[I 2023-04-26 02:10:03,659][39m Trial 430 finished with value: 0.8764044943820225 and parameters: {'objective': 'CrossEntropy', 'colsample_bylevel': 0.09121853295185597, 'depth': 6, 'boosting_type': 'Plain', 'bootstrap_type': 'Bayesian', 'bagging_temperature': 9.9597765539535}. Best is trial 164 with value: 0.8965517241379309.
[32m[I 2023-04-26 02:10:07,246][39m Trial 431 finished with value: 0.8705882352941177 and parameters: {'objective': 'CrossEntropy', 'colsample_bylevel': 0.09315068923029825, 'depth': 6, 'boosting_type': 'Plain', 'bootstrap_type': 'Bayesian', 'bagging_temperature': 4.7244353138747455}. Best is trial 164 with value: 0.8965517241379309.
[32m[I 2023-04-26 02:10:11,331][39m Trial 432 finished with value: 0.8705882352941177 and parameters: {'objective': 'CrossEntropy', 'colsample_bylevel': 0.0879940243267816, 'depth': 7, 'boosting_type': 'Plain', 'bootstrap_type': 'Bayesian', 'bagging_temperature': 5.63335227959171}. Best is trial 164 with value: 0.8965517241379309.
[32m[I 2023-04-26 02:10:15,014][39m Trial 433 finished with value: 0.8292682926829268 and parameters: {'objective': 'CrossEntropy', 'colsample_bylevel': 0.09514530459291799, 'depth': 6, 'boosting_type': 'Plain', 'bootstrap_type': 'Bayesian', 'bagging_temperature': 2.727187175016824}. Best is trial 164 with value: 0.8965517241379309.
[32m[I 2023-04-26 02:10:16,440][39m Trial 434 finished with value: 0.7912087912087912 and parameters: {'objective': 'CrossEntropy', 'colsample_bylevel': 0.033921498237664084, 'depth': 6, 'boosting_type': 'Plain', 'bootstrap_type': 'Bayesian', 'bagging_temperature': 5.161175529300359}. Best is trial 164 with value: 0.8965517241379309.
[32m[I 2023-04-26 02:10:20,209][39m Trial 435 finished with value: 0.8571428571428572 and parameters: {'objective': 'CrossEntropy', 'colsample_bylevel': 0.09548848895507593, 'depth': 6, 'boosting_type': 'Plain', 'bootstrap_type': 'Bayesian', 'bagging_temperature': 8.179740365204538}. Best is trial 164 with value: 0.8965517241379309.
[32m[I 2023-04-26 02:10:24,029][39m Trial 436 finished with value: 0.8764044943820225 and parameters: {'objective': 'CrossEntropy', 'colsample_bylevel': 0.09727251510027443, 'depth': 6, 'boosting_type': 'Plain', 'bootstrap_type': 'Bayesian', 'bagging_temperature': 9.782678691092194}. Best is trial 164 with value: 0.8965517241379309.
[32m[I 2023-04-26 02:10:25,867][39m Trial 437 finished with value: 0.8 and parameters: {'objective': 'CrossEntropy', 'colsample_bylevel': 0.04755666343444458, 'depth': 6, 'boosting_type': 'Plain', 'bootstrap_type': 'Bayesian', 'bagging_temperature': 8.68925525707238}. Best is trial 164 with value: 0.8965517241379309.
[32m[I 2023-04-26 02:10:31,006][39m Trial 438 finished with value: 0.8705882352941177 and parameters: {'objective': 'CrossEntropy', 'colsample_bylevel': 0.09870907118032118, 'depth': 6, 'boosting_type': 'Plain', 'bootstrap_type': 'Bayesian', 'bagging_temperature': 9.441214984852028}. Best is trial 164 with value: 0.8965517241379309.
[32m[I 2023-04-26 02:10:35,842][39m Trial 439 finished with value: 0.8536585365853658 and parameters: {'objective': 'CrossEntropy', 'colsample_bylevel': 0.09645580746025387, 'depth': 6, 'boosting_type': 'Plain', 'bootstrap_type': 'Bernoulli', 'subsample': 0.9163602021092313}. Best is trial 164 with value: 0.8965517241379309.
[32m[I 2023-04-26 02:10:40,938][39m Trial 440 finished with value: 0.8604651162790697 and parameters: {'objective': 'CrossEntropy', 'colsample_bylevel': 0.09762290530966661, 'depth': 6, 'boosting_type': 'Plain', 'bootstrap_type': 'Bayesian', 'bagging_temperature': 5.190119176782139}. Best is trial 164 with value: 0.8965517241379309.
[32m[I 2023-04-26 02:10:45,937][39m Trial 441 finished with value: 0.8433734939759037 and parameters: {'objective': 'CrossEntropy', 'colsample_bylevel': 0.09641119794036745, 'depth': 6, 'boosting_type': 'Plain', 'bootstrap_type': 'Bayesian', 'bagging_temperature': 4.945114468005581}. Best is trial 164 with value: 0.8965517241379309.
[32m[I 2023-04-26 02:10:58,237][39m Trial 442 finished with value: 0.8222222222222222 and parameters: {'objective': 'CrossEntropy', 'colsample_bylevel': 0.09094228257123634, 'depth': 6, 'boosting_type': 'Ordered', 'bootstrap_type': 'Bayesian', 'bagging_temperature': 5.65311426737179}. Best is trial 164 with value: 0.8965517241379309.
[32m[I 2023-04-26 02:11:01,756][39m Trial 443 finished with value: 0.8235294117647058 and parameters: {'objective': 'Logloss', 'colsample_bylevel': 0.09460244984280661, 'depth': 5, 'boosting_type': 'Plain', 'bootstrap_type': 'Bayesian', 'bagging_temperature': 2.125250817151835}. Best is trial 164 with value: 0.8965517241379309.
[32m[I 2023-04-26 02:11:06,419][39m Trial 444 finished with value: 0.8571428571428572 and parameters: {'objective': 'CrossEntropy', 'colsample_bylevel': 0.0927612979390996, 'depth': 6, 'boosting_type': 'Plain', 'bootstrap_type': 'Bayesian', 'bagging_temperature': 3.086369845987196}. Best is trial 164 with value: 0.8965517241379309.
[32m[I 2023-04-26 02:11:11,220][39m Trial 445 finished with value: 0.8433734939759037 and parameters: {'objective': 'CrossEntropy', 'colsample_bylevel': 0.09317817625918837, 'depth': 6, 'boosting_type': 'Plain', 'bootstrap_type': 'Bayesian', 'bagging_temperature': 4.764252163679}. Best is trial 164 with value: 0.8965517241379309.
[32m[I 2023-04-26 02:11:16,480][39m Trial 446 finished with value: 0.8433734939759037 and parameters: {'objective': 'CrossEntropy', 'colsample_bylevel': 0.09337880880026055, 'depth': 7, 'boosting_type': 'Plain', 'bootstrap_type': 'Bayesian', 'bagging_temperature': 3.6989696944008337}. Best is trial 164 with value: 0.8965517241379309.
[32m[I 2023-04-26 02:11:21,017][39m Trial 447 finished with value: 0.8837209302325582 and parameters: {'objective': 'CrossEntropy', 'colsample_bylevel': 0.0916772876063229, 'depth': 6, 'boosting_type': 'Plain', 'bootstrap_type': 'Bayesian', 'bagging_temperature': 4.083331516156872}. Best is trial 164 with value: 0.8965517241379309.
[32m[I 2023-04-26 02:11:26,381][39m Trial 448 finished with value: 0.8571428571428572 and parameters: {'objective': 'CrossEntropy', 'colsample_bylevel': 0.09869883782266893, 'depth': 6, 'boosting_type': 'Plain', 'bootstrap_type': 'Bayesian', 'bagging_temperature': 4.1025752116873635}. Best is trial 164 with value: 0.8965517241379309.
[32m[I 2023-04-26 02:11:30,191][39m Trial 449 finished with value: 0.8837209302325582 and parameters: {'objective': 'CrossEntropy', 'colsample_bylevel': 0.09834491564966046, 'depth': 5, 'boosting_type': 'Plain', 'bootstrap_type': 'Bayesian', 'bagging_temperature': 4.369490736127501}. Best is trial 164 with value: 0.8965517241379309.
[32m[I 2023-04-26 02:11:33,919][39m Trial 450 finished with value: 0.8837209302325582 and parameters: {'objective': 'CrossEntropy', 'colsample_bylevel': 0.09951204127898214, 'depth': 5, 'boosting_type': 'Plain', 'bootstrap_type': 'Bayesian', 'bagging_temperature': 5.466528166334526}. Best is trial 164 with value: 0.8965517241379309.
[32m[I 2023-04-26 02:11:38,679][39m Trial 451 finished with value: 0.8837209302325582 and parameters: {'objective': 'CrossEntropy', 'colsample_bylevel': 0.08705776386665523, 'depth': 7, 'boosting_type': 'Plain', 'bootstrap_type': 'Bayesian', 'bagging_temperature': 5.064571502593857}. Best is trial 164 with value: 0.8965517241379309.
[32m[I 2023-04-26 02:11:42,352][39m Trial 452 finished with value: 0.8571428571428572 and parameters: {'objective': 'CrossEntropy', 'colsample_bylevel': 0.09599536302225463, 'depth': 5, 'boosting_type': 'Plain', 'bootstrap_type': 'Bayesian', 'bagging_temperature': 5.517027627814582}. Best is trial 164 with value: 0.8965517241379309.
[32m[I 2023-04-26 02:11:46,058][39m Trial 453 finished with value: 0.8604651162790697 and parameters: {'objective': 'CrossEntropy', 'colsample_bylevel': 0.09843286696077153, 'depth': 5, 'boosting_type': 'Plain', 'bootstrap_type': 'Bayesian', 'bagging_temperature': 4.458456354057386}. Best is trial 164 with value: 0.8965517241379309.
[32m[I 2023-04-26 02:11:51,032][39m Trial 454 finished with value: 0.8433734939759037 and parameters: {'objective': 'CrossEntropy', 'colsample_bylevel': 0.0951582140791778, 'depth': 6, 'boosting_type': 'Plain', 'bootstrap_type': 'Bayesian', 'bagging_temperature': 2.9999437105969005}. Best is trial 164 with value: 0.8965517241379309.
[32m[I 2023-04-26 02:11:56,071][39m Trial 455 finished with value: 0.8433734939759037 and parameters: {'objective': 'CrossEntropy', 'colsample_bylevel': 0.09533484544736091, 'depth': 6, 'boosting_type': 'Plain', 'bootstrap_type': 'Bayesian', 'bagging_temperature': 3.5274937290127593}. Best is trial 164 with value: 0.8965517241379309.
[32m[I 2023-04-26 02:12:01,056][39m Trial 456 finished with value: 0.8735632183908046 and parameters: {'objective': 'CrossEntropy', 'colsample_bylevel': 0.09534265649331086, 'depth': 6, 'boosting_type': 'Plain', 'bootstrap_type': 'Bayesian', 'bagging_temperature': 1.6036961582980367}. Best is trial 164 with value: 0.8965517241379309.
[32m[I 2023-04-26 02:12:06,880][39m Trial 457 finished with value: 0.8837209302325582 and parameters: {'objective': 'CrossEntropy', 'colsample_bylevel': 0.09796279637838301, 'depth': 7, 'boosting_type': 'Plain', 'bootstrap_type': 'Bayesian', 'bagging_temperature': 4.907860846172088}. Best is trial 164 with value: 0.8965517241379309.
[32m[I 2023-04-26 02:12:12,449][39m Trial 458 finished with value: 0.8837209302325582 and parameters: {'objective': 'CrossEntropy', 'colsample_bylevel': 0.09619972709442236, 'depth': 7, 'boosting_type': 'Plain', 'bootstrap_type': 'Bayesian', 'bagging_temperature': 5.2411691575711705}. Best is trial 164 with value: 0.8965517241379309.
[32m[I 2023-04-26 02:12:18,349][39m Trial 459 finished with value: 0.8604651162790697 and parameters: {'objective': 'CrossEntropy', 'colsample_bylevel': 0.09725299409705128, 'depth': 7, 'boosting_type': 'Plain', 'bootstrap_type': 'Bayesian', 'bagging_temperature': 4.960870301134308}. Best is trial 164 with value: 0.8965517241379309.
[32m[I 2023-04-26 02:12:23,264][39m Trial 460 finished with value: 0.8372093023255814 and parameters: {'objective': 'CrossEntropy', 'colsample_bylevel': 0.0900949938285898, 'depth': 7, 'boosting_type': 'Plain', 'bootstrap_type': 'Bayesian', 'bagging_temperature': 5.3449640549517}. Best is trial 164 with value: 0.8965517241379309.
[32m[I 2023-04-26 02:12:35,075][39m Trial 461 finished with value: 0.8333333333333333 and parameters: {'objective': 'CrossEntropy', 'colsample_bylevel': 0.08941060092666471, 'depth': 6, 'boosting_type': 'Ordered', 'bootstrap_type': 'Bernoulli', 'subsample': 0.6546467523530496}. Best is trial 164 with value: 0.8965517241379309.
[32m[I 2023-04-26 02:12:37,580][39m Trial 462 finished with value: 0.8314606741573034 and parameters: {'objective': 'Logloss', 'colsample_bylevel': 0.057350881041893495, 'depth': 6, 'boosting_type': 'Plain', 'bootstrap_type': 'Bayesian', 'bagging_temperature': 6.051162716487119}. Best is trial 164 with value: 0.8965517241379309.
[32m[I 2023-04-26 02:12:42,410][39m Trial 463 finished with value: 0.8735632183908046 and parameters: {'objective': 'CrossEntropy', 'colsample_bylevel': 0.0997488763915564, 'depth': 6, 'boosting_type': 'Plain', 'bootstrap_type': 'Bayesian', 'bagging_temperature': 9.691938288794349}. Best is trial 164 with value: 0.8965517241379309.
[32m[I 2023-04-26 02:12:47,506][39m Trial 464 finished with value: 0.8433734939759037 and parameters: {'objective': 'CrossEntropy', 'colsample_bylevel': 0.09993462831301492, 'depth': 6, 'boosting_type': 'Plain', 'bootstrap_type': 'Bayesian', 'bagging_temperature': 4.666182852357075}. Best is trial 164 with value: 0.8965517241379309.
[32m[I 2023-04-26 02:12:51,912][39m Trial 465 finished with value: 0.8372093023255814 and parameters: {'objective': 'CrossEntropy', 'colsample_bylevel': 0.09209692321993704, 'depth': 6, 'boosting_type': 'Plain', 'bootstrap_type': 'Bayesian', 'bagging_temperature': 9.984390539792669}. Best is trial 164 with value: 0.8965517241379309.
[32m[I 2023-04-26 02:12:56,584][39m Trial 466 finished with value: 0.8433734939759037 and parameters: {'objective': 'CrossEntropy', 'colsample_bylevel': 0.09720091444423888, 'depth': 6, 'boosting_type': 'Plain', 'bootstrap_type': 'Bayesian', 'bagging_temperature': 7.680053648355008}. Best is trial 164 with value: 0.8965517241379309.
[32m[I 2023-04-26 02:13:00,009][39m Trial 467 finished with value: 0.8372093023255814 and parameters: {'objective': 'CrossEntropy', 'colsample_bylevel': 0.09415855350472487, 'depth': 5, 'boosting_type': 'Plain', 'bootstrap_type': 'Bayesian', 'bagging_temperature': 5.714396816474803}. Best is trial 164 with value: 0.8965517241379309.
