
[32m[I 2023-04-26 01:38:33,432][39m A new study created in memory with name: no-name-9cc741a9-f55f-414e-8b91-20e507602fdc
[32m[I 2023-04-26 01:38:35,188][39m Trial 0 finished with value: 0.7499999999999999 and parameters: {'objective': 'CrossEntropy', 'colsample_bylevel': 0.02430378084081391, 'depth': 10, 'boosting_type': 'Plain', 'bootstrap_type': 'MVS'}. Best is trial 0 with value: 0.7499999999999999.
[32m[I 2023-04-26 01:38:42,288][39m Trial 1 finished with value: 0.8043478260869564 and parameters: {'objective': 'Logloss', 'colsample_bylevel': 0.046071770173187636, 'depth': 4, 'boosting_type': 'Ordered', 'bootstrap_type': 'MVS'}. Best is trial 1 with value: 0.8043478260869564.
[32m[I 2023-04-26 01:38:43,652][39m Trial 2 finished with value: 0.782608695652174 and parameters: {'objective': 'Logloss', 'colsample_bylevel': 0.019803240209129172, 'depth': 10, 'boosting_type': 'Plain', 'bootstrap_type': 'Bayesian', 'bagging_temperature': 2.598648655804656}. Best is trial 1 with value: 0.8043478260869564.
[32m[I 2023-04-26 01:38:46,699][39m Trial 3 finished with value: 0.7872340425531914 and parameters: {'objective': 'Logloss', 'colsample_bylevel': 0.02817953463857955, 'depth': 10, 'boosting_type': 'Ordered', 'bootstrap_type': 'Bernoulli', 'subsample': 0.8409172360344296}. Best is trial 1 with value: 0.8043478260869564.
[32m[I 2023-04-26 01:38:51,507][39m Trial 4 finished with value: 0.8043478260869564 and parameters: {'objective': 'Logloss', 'colsample_bylevel': 0.047921048120221924, 'depth': 9, 'boosting_type': 'Ordered', 'bootstrap_type': 'MVS'}. Best is trial 1 with value: 0.8043478260869564.
[32m[I 2023-04-26 01:38:52,739][39m Trial 5 finished with value: 0.712871287128713 and parameters: {'objective': 'CrossEntropy', 'colsample_bylevel': 0.031239577546914775, 'depth': 1, 'boosting_type': 'Plain', 'bootstrap_type': 'Bayesian', 'bagging_temperature': 7.960316554810866}. Best is trial 1 with value: 0.8043478260869564.
[32m[I 2023-04-26 01:39:00,668][39m Trial 6 finished with value: 0.8433734939759037 and parameters: {'objective': 'Logloss', 'colsample_bylevel': 0.0988076238782923, 'depth': 12, 'boosting_type': 'Plain', 'bootstrap_type': 'Bayesian', 'bagging_temperature': 6.636232002704104}. Best is trial 6 with value: 0.8433734939759037.
[32m[I 2023-04-26 01:39:05,569][39m Trial 7 finished with value: 0.8604651162790697 and parameters: {'objective': 'Logloss', 'colsample_bylevel': 0.07258299969462889, 'depth': 9, 'boosting_type': 'Plain', 'bootstrap_type': 'MVS'}. Best is trial 7 with value: 0.8604651162790697.
[32m[I 2023-04-26 01:39:16,993][39m Trial 8 finished with value: 0.8139534883720929 and parameters: {'objective': 'CrossEntropy', 'colsample_bylevel': 0.0827275372942806, 'depth': 12, 'boosting_type': 'Ordered', 'bootstrap_type': 'Bayesian', 'bagging_temperature': 2.0842229417137945}. Best is trial 7 with value: 0.8604651162790697.
[32m[I 2023-04-26 01:39:18,387][39m Trial 9 finished with value: 0.7551020408163265 and parameters: {'objective': 'Logloss', 'colsample_bylevel': 0.015771089995579985, 'depth': 6, 'boosting_type': 'Plain', 'bootstrap_type': 'MVS'}. Best is trial 7 with value: 0.8604651162790697.
[32m[I 2023-04-26 01:39:21,929][39m Trial 10 finished with value: 0.8505747126436782 and parameters: {'objective': 'Logloss', 'colsample_bylevel': 0.07021340567491355, 'depth': 7, 'boosting_type': 'Plain', 'bootstrap_type': 'Bernoulli', 'subsample': 0.3096730150644394}. Best is trial 7 with value: 0.8604651162790697.
[32m[I 2023-04-26 01:39:25,723][39m Trial 11 finished with value: 0.8275862068965518 and parameters: {'objective': 'Logloss', 'colsample_bylevel': 0.07161426806335039, 'depth': 7, 'boosting_type': 'Plain', 'bootstrap_type': 'Bernoulli', 'subsample': 0.1608174226238979}. Best is trial 7 with value: 0.8604651162790697.
[32m[I 2023-04-26 01:39:29,040][39m Trial 12 finished with value: 0.8314606741573034 and parameters: {'objective': 'Logloss', 'colsample_bylevel': 0.06664925132652162, 'depth': 7, 'boosting_type': 'Plain', 'bootstrap_type': 'Bernoulli', 'subsample': 0.28212478393012597}. Best is trial 7 with value: 0.8604651162790697.
[32m[I 2023-04-26 01:39:31,209][39m Trial 13 finished with value: 0.8181818181818182 and parameters: {'objective': 'Logloss', 'colsample_bylevel': 0.06443363451947132, 'depth': 4, 'boosting_type': 'Plain', 'bootstrap_type': 'Bernoulli', 'subsample': 0.5356488429053046}. Best is trial 7 with value: 0.8604651162790697.
[32m[I 2023-04-26 01:39:37,007][39m Trial 14 finished with value: 0.8571428571428572 and parameters: {'objective': 'Logloss', 'colsample_bylevel': 0.08717449729003818, 'depth': 8, 'boosting_type': 'Plain', 'bootstrap_type': 'MVS'}. Best is trial 7 with value: 0.8604651162790697.
[32m[I 2023-04-26 01:39:43,761][39m Trial 15 finished with value: 0.8571428571428572 and parameters: {'objective': 'CrossEntropy', 'colsample_bylevel': 0.08914465145164335, 'depth': 9, 'boosting_type': 'Plain', 'bootstrap_type': 'MVS'}. Best is trial 7 with value: 0.8604651162790697.
[32m[I 2023-04-26 01:39:46,843][39m Trial 16 finished with value: 0.8235294117647058 and parameters: {'objective': 'Logloss', 'colsample_bylevel': 0.08097163573357348, 'depth': 5, 'boosting_type': 'Plain', 'bootstrap_type': 'MVS'}. Best is trial 7 with value: 0.8604651162790697.
[32m[I 2023-04-26 01:39:53,561][39m Trial 17 finished with value: 0.8571428571428572 and parameters: {'objective': 'Logloss', 'colsample_bylevel': 0.09917854023364094, 'depth': 8, 'boosting_type': 'Plain', 'bootstrap_type': 'MVS'}. Best is trial 7 with value: 0.8604651162790697.
[32m[I 2023-04-26 01:39:57,726][39m Trial 18 finished with value: 0.782608695652174 and parameters: {'objective': 'CrossEntropy', 'colsample_bylevel': 0.09848890365821641, 'depth': 2, 'boosting_type': 'Ordered', 'bootstrap_type': 'MVS'}. Best is trial 7 with value: 0.8604651162790697.
[32m[I 2023-04-26 01:39:59,847][39m Trial 19 finished with value: 0.8409090909090909 and parameters: {'objective': 'Logloss', 'colsample_bylevel': 0.05348477468653039, 'depth': 11, 'boosting_type': 'Plain', 'bootstrap_type': 'MVS'}. Best is trial 7 with value: 0.8604651162790697.
[32m[I 2023-04-26 01:40:04,889][39m Trial 20 finished with value: 0.8433734939759037 and parameters: {'objective': 'Logloss', 'colsample_bylevel': 0.08097863297155991, 'depth': 8, 'boosting_type': 'Plain', 'bootstrap_type': 'MVS'}. Best is trial 7 with value: 0.8604651162790697.
[32m[I 2023-04-26 01:40:11,786][39m Trial 21 finished with value: 0.8571428571428572 and parameters: {'objective': 'CrossEntropy', 'colsample_bylevel': 0.09130530204639918, 'depth': 9, 'boosting_type': 'Plain', 'bootstrap_type': 'MVS'}. Best is trial 7 with value: 0.8604651162790697.
[32m[I 2023-04-26 01:40:19,391][39m Trial 22 finished with value: 0.8674698795180722 and parameters: {'objective': 'CrossEntropy', 'colsample_bylevel': 0.09348666496012593, 'depth': 9, 'boosting_type': 'Plain', 'bootstrap_type': 'MVS'}. Best is trial 22 with value: 0.8674698795180722.
[32m[I 2023-04-26 01:40:24,182][39m Trial 23 finished with value: 0.8705882352941177 and parameters: {'objective': 'CrossEntropy', 'colsample_bylevel': 0.076150661293775, 'depth': 8, 'boosting_type': 'Plain', 'bootstrap_type': 'MVS'}. Best is trial 23 with value: 0.8705882352941177.
[32m[I 2023-04-26 01:40:27,956][39m Trial 24 finished with value: 0.8333333333333333 and parameters: {'objective': 'CrossEntropy', 'colsample_bylevel': 0.0752330162187757, 'depth': 6, 'boosting_type': 'Plain', 'bootstrap_type': 'MVS'}. Best is trial 23 with value: 0.8705882352941177.
[32m[I 2023-04-26 01:40:30,483][39m Trial 25 finished with value: 0.8636363636363636 and parameters: {'objective': 'CrossEntropy', 'colsample_bylevel': 0.059503666431479224, 'depth': 11, 'boosting_type': 'Plain', 'bootstrap_type': 'MVS'}. Best is trial 23 with value: 0.8705882352941177.
[32m[I 2023-04-26 01:40:34,978][39m Trial 26 finished with value: 0.782608695652174 and parameters: {'objective': 'CrossEntropy', 'colsample_bylevel': 0.054286106157879835, 'depth': 11, 'boosting_type': 'Ordered', 'bootstrap_type': 'MVS'}. Best is trial 23 with value: 0.8705882352941177.
[32m[I 2023-04-26 01:40:37,623][39m Trial 27 finished with value: 0.8192771084337348 and parameters: {'objective': 'CrossEntropy', 'colsample_bylevel': 0.06239444183776044, 'depth': 11, 'boosting_type': 'Plain', 'bootstrap_type': 'MVS'}. Best is trial 23 with value: 0.8705882352941177.
[32m[I 2023-04-26 01:40:39,270][39m Trial 28 finished with value: 0.8 and parameters: {'objective': 'CrossEntropy', 'colsample_bylevel': 0.03738712416061234, 'depth': 12, 'boosting_type': 'Plain', 'bootstrap_type': 'Bayesian', 'bagging_temperature': 9.991727665402266}. Best is trial 23 with value: 0.8705882352941177.
[32m[I 2023-04-26 01:40:42,083][39m Trial 29 finished with value: 0.8470588235294119 and parameters: {'objective': 'CrossEntropy', 'colsample_bylevel': 0.06164689667228288, 'depth': 10, 'boosting_type': 'Plain', 'bootstrap_type': 'MVS'}. Best is trial 23 with value: 0.8705882352941177.
[32m[I 2023-04-26 01:40:45,827][39m Trial 30 finished with value: 0.8536585365853658 and parameters: {'objective': 'CrossEntropy', 'colsample_bylevel': 0.07842421374056378, 'depth': 10, 'boosting_type': 'Plain', 'bootstrap_type': 'MVS'}. Best is trial 23 with value: 0.8705882352941177.
[32m[I 2023-04-26 01:40:50,761][39m Trial 31 finished with value: 0.8433734939759037 and parameters: {'objective': 'CrossEntropy', 'colsample_bylevel': 0.07310614392713269, 'depth': 9, 'boosting_type': 'Plain', 'bootstrap_type': 'MVS'}. Best is trial 23 with value: 0.8705882352941177.
[32m[I 2023-04-26 01:40:54,059][39m Trial 32 finished with value: 0.8539325842696629 and parameters: {'objective': 'CrossEntropy', 'colsample_bylevel': 0.05797101454227683, 'depth': 8, 'boosting_type': 'Plain', 'bootstrap_type': 'MVS'}. Best is trial 23 with value: 0.8705882352941177.
[32m[I 2023-04-26 01:40:56,249][39m Trial 33 finished with value: 0.8222222222222222 and parameters: {'objective': 'CrossEntropy', 'colsample_bylevel': 0.04877975688230747, 'depth': 11, 'boosting_type': 'Plain', 'bootstrap_type': 'MVS'}. Best is trial 23 with value: 0.8705882352941177.
[32m[I 2023-04-26 01:41:07,681][39m Trial 34 finished with value: 0.8372093023255814 and parameters: {'objective': 'CrossEntropy', 'colsample_bylevel': 0.09222826391991529, 'depth': 10, 'boosting_type': 'Ordered', 'bootstrap_type': 'MVS'}. Best is trial 23 with value: 0.8705882352941177.
[32m[I 2023-04-26 01:41:10,329][39m Trial 35 finished with value: 0.8043478260869564 and parameters: {'objective': 'CrossEntropy', 'colsample_bylevel': 0.039071971078028594, 'depth': 9, 'boosting_type': 'Plain', 'bootstrap_type': 'MVS'}. Best is trial 23 with value: 0.8705882352941177.
[32m[I 2023-04-26 01:41:15,939][39m Trial 36 finished with value: 0.8674698795180722 and parameters: {'objective': 'CrossEntropy', 'colsample_bylevel': 0.08554278529406907, 'depth': 8, 'boosting_type': 'Plain', 'bootstrap_type': 'MVS'}. Best is trial 23 with value: 0.8705882352941177.
[32m[I 2023-04-26 01:41:28,505][39m Trial 37 finished with value: 0.7954545454545454 and parameters: {'objective': 'CrossEntropy', 'colsample_bylevel': 0.08715492257978324, 'depth': 6, 'boosting_type': 'Ordered', 'bootstrap_type': 'Bayesian', 'bagging_temperature': 0.22782462353043353}. Best is trial 23 with value: 0.8705882352941177.
[32m[I 2023-04-26 01:41:34,121][39m Trial 38 finished with value: 0.8433734939759037 and parameters: {'objective': 'CrossEntropy', 'colsample_bylevel': 0.08378685856071404, 'depth': 8, 'boosting_type': 'Plain', 'bootstrap_type': 'MVS'}. Best is trial 23 with value: 0.8705882352941177.
[32m[I 2023-04-26 01:41:38,961][39m Trial 39 finished with value: 0.8536585365853658 and parameters: {'objective': 'CrossEntropy', 'colsample_bylevel': 0.09275606581092079, 'depth': 7, 'boosting_type': 'Plain', 'bootstrap_type': 'Bernoulli', 'subsample': 0.9437943516447108}. Best is trial 23 with value: 0.8705882352941177.
[32m[I 2023-04-26 01:41:50,048][39m Trial 40 finished with value: 0.8089887640449439 and parameters: {'objective': 'CrossEntropy', 'colsample_bylevel': 0.09447742523186016, 'depth': 5, 'boosting_type': 'Ordered', 'bootstrap_type': 'Bayesian', 'bagging_temperature': 4.317801755835918}. Best is trial 23 with value: 0.8705882352941177.
[32m[I 2023-04-26 01:41:53,455][39m Trial 41 finished with value: 0.8571428571428572 and parameters: {'objective': 'CrossEntropy', 'colsample_bylevel': 0.07622971236996746, 'depth': 10, 'boosting_type': 'Plain', 'bootstrap_type': 'MVS'}. Best is trial 23 with value: 0.8705882352941177.
[32m[I 2023-04-26 01:41:58,279][39m Trial 42 finished with value: 0.8372093023255814 and parameters: {'objective': 'CrossEntropy', 'colsample_bylevel': 0.07106104037575994, 'depth': 9, 'boosting_type': 'Plain', 'bootstrap_type': 'MVS'}. Best is trial 23 with value: 0.8705882352941177.
[32m[I 2023-04-26 01:42:01,942][39m Trial 43 finished with value: 0.8505747126436782 and parameters: {'objective': 'CrossEntropy', 'colsample_bylevel': 0.06626803812436574, 'depth': 8, 'boosting_type': 'Plain', 'bootstrap_type': 'MVS'}. Best is trial 23 with value: 0.8705882352941177.
[32m[I 2023-04-26 01:42:06,337][39m Trial 44 finished with value: 0.8433734939759037 and parameters: {'objective': 'CrossEntropy', 'colsample_bylevel': 0.08325399137718342, 'depth': 7, 'boosting_type': 'Plain', 'bootstrap_type': 'MVS'}. Best is trial 23 with value: 0.8705882352941177.
[32m[I 2023-04-26 01:42:09,093][39m Trial 45 finished with value: 0.8470588235294119 and parameters: {'objective': 'CrossEntropy', 'colsample_bylevel': 0.0690157915991752, 'depth': 11, 'boosting_type': 'Plain', 'bootstrap_type': 'MVS'}. Best is trial 23 with value: 0.8705882352941177.
[32m[I 2023-04-26 01:42:11,361][39m Trial 46 finished with value: 0.8181818181818182 and parameters: {'objective': 'Logloss', 'colsample_bylevel': 0.05775159944009865, 'depth': 12, 'boosting_type': 'Plain', 'bootstrap_type': 'Bernoulli', 'subsample': 0.686492822382051}. Best is trial 23 with value: 0.8705882352941177.
[32m[I 2023-04-26 01:42:17,198][39m Trial 47 finished with value: 0.8571428571428572 and parameters: {'objective': 'Logloss', 'colsample_bylevel': 0.08601360578405899, 'depth': 9, 'boosting_type': 'Plain', 'bootstrap_type': 'MVS'}. Best is trial 23 with value: 0.8705882352941177.
[32m[I 2023-04-26 01:42:21,968][39m Trial 48 finished with value: 0.8571428571428572 and parameters: {'objective': 'CrossEntropy', 'colsample_bylevel': 0.07708079142271584, 'depth': 9, 'boosting_type': 'Plain', 'bootstrap_type': 'Bayesian', 'bagging_temperature': 5.912838733663222}. Best is trial 23 with value: 0.8705882352941177.
[32m[I 2023-04-26 01:42:26,702][39m Trial 49 finished with value: 0.8674698795180722 and parameters: {'objective': 'Logloss', 'colsample_bylevel': 0.09515014801241344, 'depth': 10, 'boosting_type': 'Plain', 'bootstrap_type': 'MVS'}. Best is trial 23 with value: 0.8705882352941177.
[32m[I 2023-04-26 01:42:31,587][39m Trial 50 finished with value: 0.8674698795180722 and parameters: {'objective': 'CrossEntropy', 'colsample_bylevel': 0.09434014394694874, 'depth': 11, 'boosting_type': 'Plain', 'bootstrap_type': 'MVS'}. Best is trial 23 with value: 0.8705882352941177.
[32m[I 2023-04-26 01:42:37,028][39m Trial 51 finished with value: 0.8395061728395061 and parameters: {'objective': 'CrossEntropy', 'colsample_bylevel': 0.0955179775172842, 'depth': 11, 'boosting_type': 'Plain', 'bootstrap_type': 'MVS'}. Best is trial 23 with value: 0.8705882352941177.
[32m[I 2023-04-26 01:42:40,757][39m Trial 52 finished with value: 0.8674698795180722 and parameters: {'objective': 'CrossEntropy', 'colsample_bylevel': 0.0967844013614993, 'depth': 10, 'boosting_type': 'Plain', 'bootstrap_type': 'MVS'}. Best is trial 23 with value: 0.8705882352941177.
[32m[I 2023-04-26 01:42:45,595][39m Trial 53 finished with value: 0.8571428571428572 and parameters: {'objective': 'CrossEntropy', 'colsample_bylevel': 0.09680634680664833, 'depth': 10, 'boosting_type': 'Plain', 'bootstrap_type': 'MVS'}. Best is trial 23 with value: 0.8705882352941177.
[32m[I 2023-04-26 01:42:49,959][39m Trial 54 finished with value: 0.8571428571428572 and parameters: {'objective': 'Logloss', 'colsample_bylevel': 0.08871601163124185, 'depth': 10, 'boosting_type': 'Plain', 'bootstrap_type': 'MVS'}. Best is trial 23 with value: 0.8705882352941177.
[32m[I 2023-04-26 01:42:56,075][39m Trial 55 finished with value: 0.8433734939759037 and parameters: {'objective': 'CrossEntropy', 'colsample_bylevel': 0.09081477829868558, 'depth': 12, 'boosting_type': 'Plain', 'bootstrap_type': 'Bernoulli', 'subsample': 0.5446250545699338}. Best is trial 23 with value: 0.8705882352941177.
[32m[I 2023-04-26 01:43:02,822][39m Trial 56 finished with value: 0.8536585365853658 and parameters: {'objective': 'CrossEntropy', 'colsample_bylevel': 0.09901166284105606, 'depth': 8, 'boosting_type': 'Plain', 'bootstrap_type': 'MVS'}. Best is trial 23 with value: 0.8705882352941177.
[32m[I 2023-04-26 01:43:10,563][39m Trial 57 finished with value: 0.8043478260869564 and parameters: {'objective': 'Logloss', 'colsample_bylevel': 0.09526178504403152, 'depth': 10, 'boosting_type': 'Ordered', 'bootstrap_type': 'MVS'}. Best is trial 23 with value: 0.8705882352941177.
[32m[I 2023-04-26 01:43:12,240][39m Trial 58 finished with value: 0.7741935483870966 and parameters: {'objective': 'CrossEntropy', 'colsample_bylevel': 0.08416701684960327, 'depth': 1, 'boosting_type': 'Plain', 'bootstrap_type': 'MVS'}. Best is trial 23 with value: 0.8705882352941177.
[32m[I 2023-04-26 01:43:17,938][39m Trial 59 finished with value: 0.8571428571428572 and parameters: {'objective': 'Logloss', 'colsample_bylevel': 0.09980782295188839, 'depth': 7, 'boosting_type': 'Plain', 'bootstrap_type': 'MVS'}. Best is trial 23 with value: 0.8705882352941177.
[32m[I 2023-04-26 01:43:24,639][39m Trial 60 finished with value: 0.8571428571428572 and parameters: {'objective': 'CrossEntropy', 'colsample_bylevel': 0.08965460031082306, 'depth': 9, 'boosting_type': 'Plain', 'bootstrap_type': 'MVS'}. Best is trial 23 with value: 0.8705882352941177.
[32m[I 2023-04-26 01:43:27,976][39m Trial 61 finished with value: 0.8604651162790697 and parameters: {'objective': 'CrossEntropy', 'colsample_bylevel': 0.07975237888626957, 'depth': 11, 'boosting_type': 'Plain', 'bootstrap_type': 'MVS'}. Best is trial 23 with value: 0.8705882352941177.
[32m[I 2023-04-26 01:43:32,609][39m Trial 62 finished with value: 0.8433734939759037 and parameters: {'objective': 'CrossEntropy', 'colsample_bylevel': 0.09357126040044067, 'depth': 10, 'boosting_type': 'Plain', 'bootstrap_type': 'MVS'}. Best is trial 23 with value: 0.8705882352941177.
[32m[I 2023-04-26 01:43:33,886][39m Trial 63 finished with value: 0.782608695652174 and parameters: {'objective': 'CrossEntropy', 'colsample_bylevel': 0.022697333898729265, 'depth': 11, 'boosting_type': 'Plain', 'bootstrap_type': 'MVS'}. Best is trial 23 with value: 0.8705882352941177.
[32m[I 2023-04-26 01:43:39,110][39m Trial 64 finished with value: 0.8674698795180722 and parameters: {'objective': 'CrossEntropy', 'colsample_bylevel': 0.08586020971218901, 'depth': 12, 'boosting_type': 'Plain', 'bootstrap_type': 'MVS'}. Best is trial 23 with value: 0.8705882352941177.
[32m[I 2023-04-26 01:43:44,770][39m Trial 65 finished with value: 0.8433734939759037 and parameters: {'objective': 'CrossEntropy', 'colsample_bylevel': 0.08762446583799752, 'depth': 12, 'boosting_type': 'Plain', 'bootstrap_type': 'MVS'}. Best is trial 23 with value: 0.8705882352941177.
[32m[I 2023-04-26 01:43:51,343][39m Trial 66 finished with value: 0.8674698795180722 and parameters: {'objective': 'CrossEntropy', 'colsample_bylevel': 0.09709649851010563, 'depth': 8, 'boosting_type': 'Plain', 'bootstrap_type': 'MVS'}. Best is trial 23 with value: 0.8705882352941177.
[32m[I 2023-04-26 01:43:57,502][39m Trial 67 finished with value: 0.8705882352941177 and parameters: {'objective': 'Logloss', 'colsample_bylevel': 0.09618730158000047, 'depth': 8, 'boosting_type': 'Plain', 'bootstrap_type': 'Bayesian', 'bagging_temperature': 9.992289599311691}. Best is trial 23 with value: 0.8705882352941177.
[32m[I 2023-04-26 01:44:01,468][39m Trial 68 finished with value: 0.8470588235294119 and parameters: {'objective': 'Logloss', 'colsample_bylevel': 0.0907333352294105, 'depth': 6, 'boosting_type': 'Plain', 'bootstrap_type': 'Bayesian', 'bagging_temperature': 9.827586359373143}. Best is trial 23 with value: 0.8705882352941177.
[32m[I 2023-04-26 01:44:08,143][39m Trial 69 finished with value: 0.8131868131868132 and parameters: {'objective': 'Logloss', 'colsample_bylevel': 0.08538723873931094, 'depth': 8, 'boosting_type': 'Ordered', 'bootstrap_type': 'Bayesian', 'bagging_temperature': 8.180123638629054}. Best is trial 23 with value: 0.8705882352941177.
[32m[I 2023-04-26 01:44:15,686][39m Trial 70 finished with value: 0.8433734939759037 and parameters: {'objective': 'Logloss', 'colsample_bylevel': 0.09847367248042184, 'depth': 12, 'boosting_type': 'Plain', 'bootstrap_type': 'Bayesian', 'bagging_temperature': 4.198695558741894}. Best is trial 23 with value: 0.8705882352941177.
[32m[I 2023-04-26 01:44:23,368][39m Trial 71 finished with value: 0.8571428571428572 and parameters: {'objective': 'Logloss', 'colsample_bylevel': 0.09598850127719583, 'depth': 9, 'boosting_type': 'Plain', 'bootstrap_type': 'Bayesian', 'bagging_temperature': 8.024983491429591}. Best is trial 23 with value: 0.8705882352941177.
[32m[I 2023-04-26 01:44:27,614][39m Trial 72 finished with value: 0.8571428571428572 and parameters: {'objective': 'Logloss', 'colsample_bylevel': 0.09280694000712449, 'depth': 10, 'boosting_type': 'Plain', 'bootstrap_type': 'Bayesian', 'bagging_temperature': 6.354964269730083}. Best is trial 23 with value: 0.8705882352941177.
