[32m[I 2023-04-26 01:58:24,238][39m Trial 273 finished with value: 0.8 and parameters: {'objective': 'CrossEntropy', 'colsample_bylevel': 0.0447084301735764, 'depth': 7, 'boosting_type': 'Plain', 'bootstrap_type': 'Bayesian', 'bagging_temperature': 5.476827546593258}. Best is trial 164 with value: 0.8965517241379309.
[32m[I 2023-04-26 01:58:26,746][39m Trial 274 finished with value: 0.8181818181818182 and parameters: {'objective': 'CrossEntropy', 'colsample_bylevel': 0.06607898871230768, 'depth': 5, 'boosting_type': 'Plain', 'bootstrap_type': 'Bayesian', 'bagging_temperature': 5.09386661851612}. Best is trial 164 with value: 0.8965517241379309.
[32m[I 2023-04-26 01:58:31,585][39m Trial 275 finished with value: 0.8571428571428572 and parameters: {'objective': 'CrossEntropy', 'colsample_bylevel': 0.08893065953619446, 'depth': 6, 'boosting_type': 'Plain', 'bootstrap_type': 'Bayesian', 'bagging_temperature': 2.179580921320743}. Best is trial 164 with value: 0.8965517241379309.
[32m[I 2023-04-26 01:58:36,753][39m Trial 276 finished with value: 0.8571428571428572 and parameters: {'objective': 'CrossEntropy', 'colsample_bylevel': 0.09825134449489914, 'depth': 6, 'boosting_type': 'Plain', 'bootstrap_type': 'Bayesian', 'bagging_temperature': 4.9877009224884805}. Best is trial 164 with value: 0.8965517241379309.
[32m[I 2023-04-26 01:58:38,597][39m Trial 277 finished with value: 0.782608695652174 and parameters: {'objective': 'CrossEntropy', 'colsample_bylevel': 0.0341576098532889, 'depth': 7, 'boosting_type': 'Plain', 'bootstrap_type': 'Bayesian', 'bagging_temperature': 7.327340636788794}. Best is trial 164 with value: 0.8965517241379309.
[32m[I 2023-04-26 01:58:41,750][39m Trial 278 finished with value: 0.8505747126436782 and parameters: {'objective': 'CrossEntropy', 'colsample_bylevel': 0.09635706609765812, 'depth': 4, 'boosting_type': 'Plain', 'bootstrap_type': 'Bayesian', 'bagging_temperature': 3.043171279358572}. Best is trial 164 with value: 0.8965517241379309.
[32m[I 2023-04-26 01:58:46,393][39m Trial 279 finished with value: 0.8863636363636364 and parameters: {'objective': 'CrossEntropy', 'colsample_bylevel': 0.09159886218288826, 'depth': 6, 'boosting_type': 'Plain', 'bootstrap_type': 'Bayesian', 'bagging_temperature': 3.772347261878845}. Best is trial 164 with value: 0.8965517241379309.
[32m[I 2023-04-26 01:58:49,004][39m Trial 280 finished with value: 0.8181818181818182 and parameters: {'objective': 'CrossEntropy', 'colsample_bylevel': 0.06030588869426573, 'depth': 6, 'boosting_type': 'Plain', 'bootstrap_type': 'Bayesian', 'bagging_temperature': 3.79126019093514}. Best is trial 164 with value: 0.8965517241379309.
[32m[I 2023-04-26 01:58:53,862][39m Trial 281 finished with value: 0.8837209302325582 and parameters: {'objective': 'CrossEntropy', 'colsample_bylevel': 0.09488115826483076, 'depth': 6, 'boosting_type': 'Plain', 'bootstrap_type': 'Bayesian', 'bagging_temperature': 3.3569020849696685}. Best is trial 164 with value: 0.8965517241379309.
[32m[I 2023-04-26 01:59:06,646][39m Trial 282 finished with value: 0.8131868131868132 and parameters: {'objective': 'CrossEntropy', 'colsample_bylevel': 0.09840067453879657, 'depth': 6, 'boosting_type': 'Ordered', 'bootstrap_type': 'Bayesian', 'bagging_temperature': 3.287027100740717}. Best is trial 164 with value: 0.8965517241379309.
[32m[I 2023-04-26 01:59:11,781][39m Trial 283 finished with value: 0.8571428571428572 and parameters: {'objective': 'CrossEntropy', 'colsample_bylevel': 0.099864725267409, 'depth': 6, 'boosting_type': 'Plain', 'bootstrap_type': 'Bayesian', 'bagging_temperature': 3.4377038586394226}. Best is trial 164 with value: 0.8965517241379309.
[32m[I 2023-04-26 01:59:14,627][39m Trial 284 finished with value: 0.8222222222222222 and parameters: {'objective': 'CrossEntropy', 'colsample_bylevel': 0.09070974206998156, 'depth': 3, 'boosting_type': 'Plain', 'bootstrap_type': 'Bayesian', 'bagging_temperature': 5.3535738092196645}. Best is trial 164 with value: 0.8965517241379309.
[32m[I 2023-04-26 01:59:19,724][39m Trial 285 finished with value: 0.8965517241379309 and parameters: {'objective': 'CrossEntropy', 'colsample_bylevel': 0.09430462022813534, 'depth': 6, 'boosting_type': 'Plain', 'bootstrap_type': 'Bayesian', 'bagging_temperature': 4.516120486966465}. Best is trial 164 with value: 0.8965517241379309.
[32m[I 2023-04-26 01:59:25,169][39m Trial 286 finished with value: 0.8604651162790697 and parameters: {'objective': 'CrossEntropy', 'colsample_bylevel': 0.09579985005021573, 'depth': 7, 'boosting_type': 'Plain', 'bootstrap_type': 'Bayesian', 'bagging_temperature': 4.237597514279818}. Best is trial 164 with value: 0.8965517241379309.
[32m[I 2023-04-26 01:59:29,843][39m Trial 287 finished with value: 0.8433734939759037 and parameters: {'objective': 'CrossEntropy', 'colsample_bylevel': 0.09345193354698882, 'depth': 6, 'boosting_type': 'Plain', 'bootstrap_type': 'Bernoulli', 'subsample': 0.6345407919537047}. Best is trial 164 with value: 0.8965517241379309.
[32m[I 2023-04-26 01:59:31,364][39m Trial 288 finished with value: 0.7692307692307692 and parameters: {'objective': 'CrossEntropy', 'colsample_bylevel': 0.025326597963433645, 'depth': 6, 'boosting_type': 'Plain', 'bootstrap_type': 'Bayesian', 'bagging_temperature': 3.8167833374335594}. Best is trial 164 with value: 0.8965517241379309.
[32m[I 2023-04-26 01:59:36,081][39m Trial 289 finished with value: 0.8636363636363636 and parameters: {'objective': 'CrossEntropy', 'colsample_bylevel': 0.09517054097921303, 'depth': 6, 'boosting_type': 'Plain', 'bootstrap_type': 'Bayesian', 'bagging_temperature': 4.629495921716134}. Best is trial 164 with value: 0.8965517241379309.
[32m[I 2023-04-26 01:59:41,179][39m Trial 290 finished with value: 0.8837209302325582 and parameters: {'objective': 'CrossEntropy', 'colsample_bylevel': 0.09780799755579721, 'depth': 6, 'boosting_type': 'Plain', 'bootstrap_type': 'Bayesian', 'bagging_temperature': 9.91228611753177}. Best is trial 164 with value: 0.8965517241379309.
[32m[I 2023-04-26 01:59:46,002][39m Trial 291 finished with value: 0.8735632183908046 and parameters: {'objective': 'CrossEntropy', 'colsample_bylevel': 0.09397593197742676, 'depth': 6, 'boosting_type': 'Plain', 'bootstrap_type': 'Bayesian', 'bagging_temperature': 9.752906598361932}. Best is trial 164 with value: 0.8965517241379309.
[32m[I 2023-04-26 01:59:50,667][39m Trial 292 finished with value: 0.8333333333333333 and parameters: {'objective': 'CrossEntropy', 'colsample_bylevel': 0.09368080602159765, 'depth': 6, 'boosting_type': 'Plain', 'bootstrap_type': 'Bayesian', 'bagging_temperature': 3.998936125943543}. Best is trial 164 with value: 0.8965517241379309.
[32m[I 2023-04-26 01:59:55,888][39m Trial 293 finished with value: 0.8571428571428572 and parameters: {'objective': 'CrossEntropy', 'colsample_bylevel': 0.09998807488167749, 'depth': 6, 'boosting_type': 'Plain', 'bootstrap_type': 'Bayesian', 'bagging_temperature': 5.742163183727232}. Best is trial 164 with value: 0.8965517241379309.
[32m[I 2023-04-26 02:00:00,905][39m Trial 294 finished with value: 0.8863636363636364 and parameters: {'objective': 'CrossEntropy', 'colsample_bylevel': 0.0972641548343474, 'depth': 6, 'boosting_type': 'Plain', 'bootstrap_type': 'Bayesian', 'bagging_temperature': 4.860676149701146}. Best is trial 164 with value: 0.8965517241379309.
[32m[I 2023-04-26 02:00:06,042][39m Trial 295 finished with value: 0.8735632183908046 and parameters: {'objective': 'CrossEntropy', 'colsample_bylevel': 0.09659008789336754, 'depth': 6, 'boosting_type': 'Plain', 'bootstrap_type': 'Bayesian', 'bagging_temperature': 4.816216264363443}. Best is trial 164 with value: 0.8965517241379309.
[32m[I 2023-04-26 02:00:11,082][39m Trial 296 finished with value: 0.8705882352941177 and parameters: {'objective': 'CrossEntropy', 'colsample_bylevel': 0.08995100962118893, 'depth': 7, 'boosting_type': 'Plain', 'bootstrap_type': 'Bayesian', 'bagging_temperature': 6.979068182521829}. Best is trial 164 with value: 0.8965517241379309.
[32m[I 2023-04-26 02:00:16,436][39m Trial 297 finished with value: 0.8470588235294119 and parameters: {'objective': 'CrossEntropy', 'colsample_bylevel': 0.09500284047478266, 'depth': 6, 'boosting_type': 'Plain', 'bootstrap_type': 'Bayesian', 'bagging_temperature': 9.787039209286158}. Best is trial 164 with value: 0.8965517241379309.
[32m[I 2023-04-26 02:00:18,915][39m Trial 298 finished with value: 0.8222222222222222 and parameters: {'objective': 'CrossEntropy', 'colsample_bylevel': 0.09697836983302378, 'depth': 2, 'boosting_type': 'Plain', 'bootstrap_type': 'Bayesian', 'bagging_temperature': 5.1690409593682585}. Best is trial 164 with value: 0.8965517241379309.
[32m[I 2023-04-26 02:00:23,844][39m Trial 299 finished with value: 0.8735632183908046 and parameters: {'objective': 'CrossEntropy', 'colsample_bylevel': 0.08870946737866689, 'depth': 7, 'boosting_type': 'Plain', 'bootstrap_type': 'Bayesian', 'bagging_temperature': 5.596451703527223}. Best is trial 164 with value: 0.8965517241379309.
[32m[I 2023-04-26 02:00:28,588][39m Trial 300 finished with value: 0.8735632183908046 and parameters: {'objective': 'CrossEntropy', 'colsample_bylevel': 0.09712248803657884, 'depth': 6, 'boosting_type': 'Plain', 'bootstrap_type': 'Bayesian', 'bagging_temperature': 9.985067758681483}. Best is trial 164 with value: 0.8965517241379309.
[32m[I 2023-04-26 02:00:33,738][39m Trial 301 finished with value: 0.8571428571428572 and parameters: {'objective': 'CrossEntropy', 'colsample_bylevel': 0.09798357985028476, 'depth': 6, 'boosting_type': 'Plain', 'bootstrap_type': 'Bayesian', 'bagging_temperature': 2.894755441549347}. Best is trial 164 with value: 0.8965517241379309.
[32m[I 2023-04-26 02:00:38,538][39m Trial 302 finished with value: 0.8571428571428572 and parameters: {'objective': 'CrossEntropy', 'colsample_bylevel': 0.09834845416904553, 'depth': 6, 'boosting_type': 'Plain', 'bootstrap_type': 'Bayesian', 'bagging_temperature': 5.506842438368186}. Best is trial 164 with value: 0.8965517241379309.
[32m[I 2023-04-26 02:00:43,648][39m Trial 303 finished with value: 0.8837209302325582 and parameters: {'objective': 'CrossEntropy', 'colsample_bylevel': 0.09827959588200028, 'depth': 6, 'boosting_type': 'Plain', 'bootstrap_type': 'Bayesian', 'bagging_temperature': 9.364927889948373}. Best is trial 164 with value: 0.8965517241379309.
[32m[I 2023-04-26 02:00:49,880][39m Trial 304 finished with value: 0.8089887640449439 and parameters: {'objective': 'CrossEntropy', 'colsample_bylevel': 0.09087107761964024, 'depth': 7, 'boosting_type': 'Ordered', 'bootstrap_type': 'Bayesian', 'bagging_temperature': 4.977278122780562}. Best is trial 164 with value: 0.8965517241379309.
[32m[I 2023-04-26 02:00:53,501][39m Trial 305 finished with value: 0.8571428571428572 and parameters: {'objective': 'CrossEntropy', 'colsample_bylevel': 0.09385687898472019, 'depth': 6, 'boosting_type': 'Plain', 'bootstrap_type': 'Bayesian', 'bagging_temperature': 9.403986834318067}. Best is trial 164 with value: 0.8965517241379309.
[32m[I 2023-04-26 02:00:57,782][39m Trial 306 finished with value: 0.8837209302325582 and parameters: {'objective': 'CrossEntropy', 'colsample_bylevel': 0.09989112699492847, 'depth': 6, 'boosting_type': 'Plain', 'bootstrap_type': 'Bayesian', 'bagging_temperature': 4.535286054279167}. Best is trial 164 with value: 0.8965517241379309.
[32m[I 2023-04-26 02:01:02,702][39m Trial 307 finished with value: 0.8735632183908046 and parameters: {'objective': 'CrossEntropy', 'colsample_bylevel': 0.09837819643796153, 'depth': 6, 'boosting_type': 'Plain', 'bootstrap_type': 'Bayesian', 'bagging_temperature': 4.61234352243582}. Best is trial 164 with value: 0.8965517241379309.
[32m[I 2023-04-26 02:01:07,237][39m Trial 308 finished with value: 0.8571428571428572 and parameters: {'objective': 'CrossEntropy', 'colsample_bylevel': 0.09902081032293014, 'depth': 6, 'boosting_type': 'Plain', 'bootstrap_type': 'Bayesian', 'bagging_temperature': 4.535494252652319}. Best is trial 164 with value: 0.8965517241379309.
[32m[I 2023-04-26 02:01:09,860][39m Trial 309 finished with value: 0.8235294117647058 and parameters: {'objective': 'CrossEntropy', 'colsample_bylevel': 0.09985599046106389, 'depth': 6, 'boosting_type': 'Plain', 'bootstrap_type': 'Bernoulli', 'subsample': 0.44253025866203277}. Best is trial 164 with value: 0.8965517241379309.
[32m[I 2023-04-26 02:01:13,816][39m Trial 310 finished with value: 0.8705882352941177 and parameters: {'objective': 'CrossEntropy', 'colsample_bylevel': 0.08731299355711455, 'depth': 6, 'boosting_type': 'Plain', 'bootstrap_type': 'Bayesian', 'bagging_temperature': 5.815315752096959}. Best is trial 164 with value: 0.8965517241379309.
[32m[I 2023-04-26 02:01:18,583][39m Trial 311 finished with value: 0.8433734939759037 and parameters: {'objective': 'CrossEntropy', 'colsample_bylevel': 0.09655973204162459, 'depth': 6, 'boosting_type': 'Plain', 'bootstrap_type': 'Bayesian', 'bagging_temperature': 4.774488707269559}. Best is trial 164 with value: 0.8965517241379309.
[32m[I 2023-04-26 02:01:23,201][39m Trial 312 finished with value: 0.8863636363636364 and parameters: {'objective': 'CrossEntropy', 'colsample_bylevel': 0.09541943831669986, 'depth': 6, 'boosting_type': 'Plain', 'bootstrap_type': 'Bayesian', 'bagging_temperature': 9.170415452972366}. Best is trial 164 with value: 0.8965517241379309.
[32m[I 2023-04-26 02:01:28,166][39m Trial 313 finished with value: 0.8863636363636364 and parameters: {'objective': 'CrossEntropy', 'colsample_bylevel': 0.09572813912987498, 'depth': 6, 'boosting_type': 'Plain', 'bootstrap_type': 'Bayesian', 'bagging_temperature': 9.358128722666615}. Best is trial 164 with value: 0.8965517241379309.
[32m[I 2023-04-26 02:01:33,222][39m Trial 314 finished with value: 0.8705882352941177 and parameters: {'objective': 'CrossEntropy', 'colsample_bylevel': 0.09549464544206616, 'depth': 6, 'boosting_type': 'Plain', 'bootstrap_type': 'Bayesian', 'bagging_temperature': 8.907848030299137}. Best is trial 164 with value: 0.8965517241379309.
[32m[I 2023-04-26 02:01:38,007][39m Trial 315 finished with value: 0.8433734939759037 and parameters: {'objective': 'CrossEntropy', 'colsample_bylevel': 0.09708814023397186, 'depth': 6, 'boosting_type': 'Plain', 'bootstrap_type': 'Bayesian', 'bagging_temperature': 9.163928309277315}. Best is trial 164 with value: 0.8965517241379309.
[32m[I 2023-04-26 02:01:42,966][39m Trial 316 finished with value: 0.8505747126436782 and parameters: {'objective': 'CrossEntropy', 'colsample_bylevel': 0.09559314782481265, 'depth': 6, 'boosting_type': 'Plain', 'bootstrap_type': 'Bayesian', 'bagging_temperature': 8.736422417421352}. Best is trial 164 with value: 0.8965517241379309.
[32m[I 2023-04-26 02:01:48,168][39m Trial 317 finished with value: 0.8705882352941177 and parameters: {'objective': 'CrossEntropy', 'colsample_bylevel': 0.09814122589897986, 'depth': 6, 'boosting_type': 'Plain', 'bootstrap_type': 'Bayesian', 'bagging_temperature': 9.637673969809494}. Best is trial 164 with value: 0.8965517241379309.
[32m[I 2023-04-26 02:01:53,497][39m Trial 318 finished with value: 0.8837209302325582 and parameters: {'objective': 'CrossEntropy', 'colsample_bylevel': 0.09969624916130754, 'depth': 6, 'boosting_type': 'Plain', 'bootstrap_type': 'Bayesian', 'bagging_temperature': 5.183937146018678}. Best is trial 164 with value: 0.8965517241379309.
[32m[I 2023-04-26 02:01:58,420][39m Trial 319 finished with value: 0.8965517241379309 and parameters: {'objective': 'CrossEntropy', 'colsample_bylevel': 0.09994432742053579, 'depth': 6, 'boosting_type': 'Plain', 'bootstrap_type': 'Bayesian', 'bagging_temperature': 9.351972403110803}. Best is trial 164 with value: 0.8965517241379309.
[32m[I 2023-04-26 02:02:03,331][39m Trial 320 finished with value: 0.8705882352941177 and parameters: {'objective': 'CrossEntropy', 'colsample_bylevel': 0.09999411281063257, 'depth': 6, 'boosting_type': 'Plain', 'bootstrap_type': 'Bayesian', 'bagging_temperature': 9.427107545973907}. Best is trial 164 with value: 0.8965517241379309.
[32m[I 2023-04-26 02:02:07,915][39m Trial 321 finished with value: 0.8571428571428572 and parameters: {'objective': 'CrossEntropy', 'colsample_bylevel': 0.0999713327369394, 'depth': 6, 'boosting_type': 'Plain', 'bootstrap_type': 'Bayesian', 'bagging_temperature': 9.289955701163823}. Best is trial 164 with value: 0.8965517241379309.
[32m[I 2023-04-26 02:02:12,449][39m Trial 322 finished with value: 0.8863636363636364 and parameters: {'objective': 'CrossEntropy', 'colsample_bylevel': 0.09691512935987982, 'depth': 6, 'boosting_type': 'Plain', 'bootstrap_type': 'Bayesian', 'bagging_temperature': 5.116266486253924}. Best is trial 164 with value: 0.8965517241379309.
[32m[I 2023-04-26 02:02:16,938][39m Trial 323 finished with value: 0.8863636363636364 and parameters: {'objective': 'CrossEntropy', 'colsample_bylevel': 0.09530039752745327, 'depth': 6, 'boosting_type': 'Plain', 'bootstrap_type': 'Bayesian', 'bagging_temperature': 5.2985923266684996}. Best is trial 164 with value: 0.8965517241379309.
[32m[I 2023-04-26 02:02:28,659][39m Trial 324 finished with value: 0.8131868131868132 and parameters: {'objective': 'CrossEntropy', 'colsample_bylevel': 0.09498061242399254, 'depth': 6, 'boosting_type': 'Ordered', 'bootstrap_type': 'Bayesian', 'bagging_temperature': 8.979748903771467}. Best is trial 164 with value: 0.8965517241379309.
[32m[I 2023-04-26 02:02:33,264][39m Trial 325 finished with value: 0.8571428571428572 and parameters: {'objective': 'CrossEntropy', 'colsample_bylevel': 0.09725012176571936, 'depth': 6, 'boosting_type': 'Plain', 'bootstrap_type': 'Bayesian', 'bagging_temperature': 9.334645120552938}. Best is trial 164 with value: 0.8965517241379309.
[32m[I 2023-04-26 02:02:37,829][39m Trial 326 finished with value: 0.8735632183908046 and parameters: {'objective': 'CrossEntropy', 'colsample_bylevel': 0.09518180157506279, 'depth': 6, 'boosting_type': 'Plain', 'bootstrap_type': 'Bayesian', 'bagging_temperature': 5.31160254587821}. Best is trial 164 with value: 0.8965517241379309.
[32m[I 2023-04-26 02:02:42,549][39m Trial 327 finished with value: 0.8433734939759037 and parameters: {'objective': 'CrossEntropy', 'colsample_bylevel': 0.09824561453102217, 'depth': 6, 'boosting_type': 'Plain', 'bootstrap_type': 'Bayesian', 'bagging_temperature': 5.190129771003108}. Best is trial 164 with value: 0.8965517241379309.
[32m[I 2023-04-26 02:02:47,131][39m Trial 328 finished with value: 0.8604651162790697 and parameters: {'objective': 'CrossEntropy', 'colsample_bylevel': 0.09639165216733121, 'depth': 6, 'boosting_type': 'Plain', 'bootstrap_type': 'Bayesian', 'bagging_temperature': 5.077249624502717}. Best is trial 164 with value: 0.8965517241379309.
[32m[I 2023-04-26 02:02:51,249][39m Trial 329 finished with value: 0.8735632183908046 and parameters: {'objective': 'CrossEntropy', 'colsample_bylevel': 0.09218041006291786, 'depth': 6, 'boosting_type': 'Plain', 'bootstrap_type': 'Bayesian', 'bagging_temperature': 5.432847496886572}. Best is trial 164 with value: 0.8965517241379309.
[32m[I 2023-04-26 02:02:55,674][39m Trial 330 finished with value: 0.8604651162790697 and parameters: {'objective': 'CrossEntropy', 'colsample_bylevel': 0.09351781002980136, 'depth': 6, 'boosting_type': 'Plain', 'bootstrap_type': 'Bayesian', 'bagging_temperature': 2.6247600820290318}. Best is trial 164 with value: 0.8965517241379309.
[32m[I 2023-04-26 02:02:59,987][39m Trial 331 finished with value: 0.8433734939759037 and parameters: {'objective': 'CrossEntropy', 'colsample_bylevel': 0.0958695578613535, 'depth': 6, 'boosting_type': 'Plain', 'bootstrap_type': 'Bernoulli', 'subsample': 0.23407655583012965}. Best is trial 164 with value: 0.8965517241379309.
[32m[I 2023-04-26 02:03:04,488][39m Trial 332 finished with value: 0.8571428571428572 and parameters: {'objective': 'CrossEntropy', 'colsample_bylevel': 0.09441400828326024, 'depth': 6, 'boosting_type': 'Plain', 'bootstrap_type': 'Bayesian', 'bagging_temperature': 9.53832472359265}. Best is trial 164 with value: 0.8965517241379309.
[32m[I 2023-04-26 02:03:08,885][39m Trial 333 finished with value: 0.8837209302325582 and parameters: {'objective': 'CrossEntropy', 'colsample_bylevel': 0.09697279583706657, 'depth': 6, 'boosting_type': 'Plain', 'bootstrap_type': 'Bayesian', 'bagging_temperature': 4.900689887527613}. Best is trial 164 with value: 0.8965517241379309.
[32m[I 2023-04-26 02:03:13,396][39m Trial 334 finished with value: 0.8965517241379309 and parameters: {'objective': 'CrossEntropy', 'colsample_bylevel': 0.09730162176121433, 'depth': 6, 'boosting_type': 'Plain', 'bootstrap_type': 'Bayesian', 'bagging_temperature': 4.782503402892223}. Best is trial 164 with value: 0.8965517241379309.
[32m[I 2023-04-26 02:03:17,903][39m Trial 335 finished with value: 0.8705882352941177 and parameters: {'objective': 'CrossEntropy', 'colsample_bylevel': 0.09766059759620328, 'depth': 6, 'boosting_type': 'Plain', 'bootstrap_type': 'Bayesian', 'bagging_temperature': 4.88658972586913}. Best is trial 164 with value: 0.8965517241379309.
[32m[I 2023-04-26 02:03:22,447][39m Trial 336 finished with value: 0.8705882352941177 and parameters: {'objective': 'CrossEntropy', 'colsample_bylevel': 0.0929097079942609, 'depth': 6, 'boosting_type': 'Plain', 'bootstrap_type': 'Bayesian', 'bagging_temperature': 5.010654750314741}. Best is trial 164 with value: 0.8965517241379309.
[32m[I 2023-04-26 02:03:27,020][39m Trial 337 finished with value: 0.8604651162790697 and parameters: {'objective': 'CrossEntropy', 'colsample_bylevel': 0.09870777590154108, 'depth': 6, 'boosting_type': 'Plain', 'bootstrap_type': 'Bayesian', 'bagging_temperature': 5.17660037631723}. Best is trial 164 with value: 0.8965517241379309.
