[32m[I 2023-04-26 02:03:31,914][39m Trial 338 finished with value: 0.8965517241379309 and parameters: {'objective': 'CrossEntropy', 'colsample_bylevel': 0.09680723235020319, 'depth': 6, 'boosting_type': 'Plain', 'bootstrap_type': 'Bayesian', 'bagging_temperature': 4.838237425003046}. Best is trial 164 with value: 0.8965517241379309.
[32m[I 2023-04-26 02:03:36,659][39m Trial 339 finished with value: 0.8735632183908046 and parameters: {'objective': 'CrossEntropy', 'colsample_bylevel': 0.09611905429277756, 'depth': 6, 'boosting_type': 'Plain', 'bootstrap_type': 'Bayesian', 'bagging_temperature': 5.230382789253947}. Best is trial 164 with value: 0.8965517241379309.
[32m[I 2023-04-26 02:03:41,276][39m Trial 340 finished with value: 0.8604651162790697 and parameters: {'objective': 'CrossEntropy', 'colsample_bylevel': 0.0945936216921185, 'depth': 6, 'boosting_type': 'Plain', 'bootstrap_type': 'Bayesian', 'bagging_temperature': 4.734381118248171}. Best is trial 164 with value: 0.8965517241379309.
[32m[I 2023-04-26 02:03:45,578][39m Trial 341 finished with value: 0.8705882352941177 and parameters: {'objective': 'CrossEntropy', 'colsample_bylevel': 0.09282655844121965, 'depth': 6, 'boosting_type': 'Plain', 'bootstrap_type': 'Bayesian', 'bagging_temperature': 9.144209934026259}. Best is trial 164 with value: 0.8965517241379309.
[32m[I 2023-04-26 02:03:50,200][39m Trial 342 finished with value: 0.8604651162790697 and parameters: {'objective': 'CrossEntropy', 'colsample_bylevel': 0.09502494324653746, 'depth': 6, 'boosting_type': 'Plain', 'bootstrap_type': 'Bayesian', 'bagging_temperature': 5.385237111375895}. Best is trial 164 with value: 0.8965517241379309.
[32m[I 2023-04-26 02:03:54,880][39m Trial 343 finished with value: 0.8571428571428572 and parameters: {'objective': 'CrossEntropy', 'colsample_bylevel': 0.09552448883880729, 'depth': 6, 'boosting_type': 'Plain', 'bootstrap_type': 'Bayesian', 'bagging_temperature': 4.834869797144155}. Best is trial 164 with value: 0.8965517241379309.
[32m[I 2023-04-26 02:04:06,931][39m Trial 344 finished with value: 0.8139534883720929 and parameters: {'objective': 'CrossEntropy', 'colsample_bylevel': 0.09948633029428368, 'depth': 6, 'boosting_type': 'Ordered', 'bootstrap_type': 'Bayesian', 'bagging_temperature': 1.7983938734746339}. Best is trial 164 with value: 0.8965517241379309.
[32m[I 2023-04-26 02:04:11,604][39m Trial 345 finished with value: 0.8965517241379309 and parameters: {'objective': 'CrossEntropy', 'colsample_bylevel': 0.09706618381222248, 'depth': 6, 'boosting_type': 'Plain', 'bootstrap_type': 'Bayesian', 'bagging_temperature': 5.045665396064213}. Best is trial 164 with value: 0.8965517241379309.
[32m[I 2023-04-26 02:04:16,182][39m Trial 346 finished with value: 0.8433734939759037 and parameters: {'objective': 'CrossEntropy', 'colsample_bylevel': 0.09983050278821749, 'depth': 6, 'boosting_type': 'Plain', 'bootstrap_type': 'Bayesian', 'bagging_temperature': 4.549501771052672}. Best is trial 164 with value: 0.8965517241379309.
[32m[I 2023-04-26 02:04:21,764][39m Trial 347 finished with value: 0.8433734939759037 and parameters: {'objective': 'CrossEntropy', 'colsample_bylevel': 0.09684483934392658, 'depth': 7, 'boosting_type': 'Plain', 'bootstrap_type': 'Bayesian', 'bagging_temperature': 4.319026563621169}. Best is trial 164 with value: 0.8965517241379309.
[32m[I 2023-04-26 02:04:26,192][39m Trial 348 finished with value: 0.8604651162790697 and parameters: {'objective': 'CrossEntropy', 'colsample_bylevel': 0.09683622455146204, 'depth': 6, 'boosting_type': 'Plain', 'bootstrap_type': 'Bayesian', 'bagging_temperature': 5.033404504363858}. Best is trial 164 with value: 0.8965517241379309.
[32m[I 2023-04-26 02:04:31,252][39m Trial 349 finished with value: 0.8705882352941177 and parameters: {'objective': 'CrossEntropy', 'colsample_bylevel': 0.09400999227055767, 'depth': 7, 'boosting_type': 'Plain', 'bootstrap_type': 'Bayesian', 'bagging_temperature': 4.448901869078428}. Best is trial 164 with value: 0.8965517241379309.
[32m[I 2023-04-26 02:04:35,726][39m Trial 350 finished with value: 0.8705882352941177 and parameters: {'objective': 'CrossEntropy', 'colsample_bylevel': 0.09588361365808634, 'depth': 6, 'boosting_type': 'Plain', 'bootstrap_type': 'Bayesian', 'bagging_temperature': 4.927496536937531}. Best is trial 164 with value: 0.8965517241379309.
[32m[I 2023-04-26 02:04:37,906][39m Trial 351 finished with value: 0.8 and parameters: {'objective': 'CrossEntropy', 'colsample_bylevel': 0.050725020873893245, 'depth': 6, 'boosting_type': 'Plain', 'bootstrap_type': 'Bayesian', 'bagging_temperature': 5.614976776286245}. Best is trial 164 with value: 0.8965517241379309.
[32m[I 2023-04-26 02:04:42,427][39m Trial 352 finished with value: 0.8705882352941177 and parameters: {'objective': 'CrossEntropy', 'colsample_bylevel': 0.0972735564130545, 'depth': 6, 'boosting_type': 'Plain', 'bootstrap_type': 'Bayesian', 'bagging_temperature': 5.4463964871415165}. Best is trial 164 with value: 0.8965517241379309.
[32m[I 2023-04-26 02:04:46,966][39m Trial 353 finished with value: 0.8604651162790697 and parameters: {'objective': 'CrossEntropy', 'colsample_bylevel': 0.09839785426606092, 'depth': 6, 'boosting_type': 'Plain', 'bootstrap_type': 'Bayesian', 'bagging_temperature': 5.118536922518942}. Best is trial 164 with value: 0.8965517241379309.
[32m[I 2023-04-26 02:04:51,348][39m Trial 354 finished with value: 0.8433734939759037 and parameters: {'objective': 'CrossEntropy', 'colsample_bylevel': 0.0944353693004654, 'depth': 6, 'boosting_type': 'Plain', 'bootstrap_type': 'Bernoulli', 'subsample': 0.798146848193154}. Best is trial 164 with value: 0.8965517241379309.
[32m[I 2023-04-26 02:04:55,453][39m Trial 355 finished with value: 0.8837209302325582 and parameters: {'objective': 'CrossEntropy', 'colsample_bylevel': 0.09232381828730685, 'depth': 6, 'boosting_type': 'Plain', 'bootstrap_type': 'Bayesian', 'bagging_temperature': 4.784729893505366}. Best is trial 164 with value: 0.8965517241379309.
[32m[I 2023-04-26 02:04:56,497][39m Trial 356 finished with value: 0.7216494845360826 and parameters: {'objective': 'CrossEntropy', 'colsample_bylevel': 0.010844320593545433, 'depth': 6, 'boosting_type': 'Plain', 'bootstrap_type': 'Bayesian', 'bagging_temperature': 5.246866399008272}. Best is trial 164 with value: 0.8965517241379309.
[32m[I 2023-04-26 02:05:01,622][39m Trial 357 finished with value: 0.8433734939759037 and parameters: {'objective': 'CrossEntropy', 'colsample_bylevel': 0.09179183542915687, 'depth': 7, 'boosting_type': 'Plain', 'bootstrap_type': 'Bayesian', 'bagging_temperature': 4.130292468199022}. Best is trial 164 with value: 0.8965517241379309.
[32m[I 2023-04-26 02:05:06,283][39m Trial 358 finished with value: 0.8735632183908046 and parameters: {'objective': 'CrossEntropy', 'colsample_bylevel': 0.09793314591359793, 'depth': 6, 'boosting_type': 'Plain', 'bootstrap_type': 'Bayesian', 'bagging_temperature': 4.91722967217335}. Best is trial 164 with value: 0.8965517241379309.
[32m[I 2023-04-26 02:05:11,602][39m Trial 359 finished with value: 0.8705882352941177 and parameters: {'objective': 'CrossEntropy', 'colsample_bylevel': 0.09580455375321557, 'depth': 7, 'boosting_type': 'Plain', 'bootstrap_type': 'Bayesian', 'bagging_temperature': 4.743426030424777}. Best is trial 164 with value: 0.8965517241379309.
[32m[I 2023-04-26 02:05:16,323][39m Trial 360 finished with value: 0.8433734939759037 and parameters: {'objective': 'CrossEntropy', 'colsample_bylevel': 0.09862279618906615, 'depth': 6, 'boosting_type': 'Plain', 'bootstrap_type': 'Bayesian', 'bagging_temperature': 5.076168985584809}. Best is trial 164 with value: 0.8965517241379309.
[32m[I 2023-04-26 02:05:20,791][39m Trial 361 finished with value: 0.8705882352941177 and parameters: {'objective': 'CrossEntropy', 'colsample_bylevel': 0.09759076191996227, 'depth': 6, 'boosting_type': 'Plain', 'bootstrap_type': 'Bayesian', 'bagging_temperature': 5.258686131572246}. Best is trial 164 with value: 0.8965517241379309.
[32m[I 2023-04-26 02:05:25,202][39m Trial 362 finished with value: 0.8735632183908046 and parameters: {'objective': 'CrossEntropy', 'colsample_bylevel': 0.0940345299253944, 'depth': 6, 'boosting_type': 'Plain', 'bootstrap_type': 'Bayesian', 'bagging_temperature': 4.5192119569781335}. Best is trial 164 with value: 0.8965517241379309.
[32m[I 2023-04-26 02:05:36,195][39m Trial 363 finished with value: 0.8314606741573034 and parameters: {'objective': 'CrossEntropy', 'colsample_bylevel': 0.09613411335445604, 'depth': 6, 'boosting_type': 'Ordered', 'bootstrap_type': 'Bayesian', 'bagging_temperature': 5.931065202193897}. Best is trial 164 with value: 0.8965517241379309.
[32m[I 2023-04-26 02:05:40,813][39m Trial 364 finished with value: 0.8705882352941177 and parameters: {'objective': 'CrossEntropy', 'colsample_bylevel': 0.09980259112422471, 'depth': 6, 'boosting_type': 'Plain', 'bootstrap_type': 'Bayesian', 'bagging_temperature': 5.012169327199703}. Best is trial 164 with value: 0.8965517241379309.
[32m[I 2023-04-26 02:05:45,481][39m Trial 365 finished with value: 0.8433734939759037 and parameters: {'objective': 'CrossEntropy', 'colsample_bylevel': 0.09979962649379673, 'depth': 6, 'boosting_type': 'Plain', 'bootstrap_type': 'Bayesian', 'bagging_temperature': 4.635545539575348}. Best is trial 164 with value: 0.8965517241379309.
[32m[I 2023-04-26 02:05:50,046][39m Trial 366 finished with value: 0.8333333333333333 and parameters: {'objective': 'CrossEntropy', 'colsample_bylevel': 0.09531045908197501, 'depth': 6, 'boosting_type': 'Plain', 'bootstrap_type': 'Bayesian', 'bagging_temperature': 4.914015002197941}. Best is trial 164 with value: 0.8965517241379309.
[32m[I 2023-04-26 02:05:55,042][39m Trial 367 finished with value: 0.8735632183908046 and parameters: {'objective': 'CrossEntropy', 'colsample_bylevel': 0.09291562414951127, 'depth': 7, 'boosting_type': 'Plain', 'bootstrap_type': 'Bayesian', 'bagging_temperature': 9.578167260727971}. Best is trial 164 with value: 0.8965517241379309.
[32m[I 2023-04-26 02:05:59,603][39m Trial 368 finished with value: 0.8705882352941177 and parameters: {'objective': 'CrossEntropy', 'colsample_bylevel': 0.09752285271001847, 'depth': 6, 'boosting_type': 'Plain', 'bootstrap_type': 'Bayesian', 'bagging_temperature': 3.20311765479088}. Best is trial 164 with value: 0.8965517241379309.
[32m[I 2023-04-26 02:06:04,208][39m Trial 369 finished with value: 0.8433734939759037 and parameters: {'objective': 'CrossEntropy', 'colsample_bylevel': 0.09703141420716542, 'depth': 6, 'boosting_type': 'Plain', 'bootstrap_type': 'Bayesian', 'bagging_temperature': 4.3149608107920665}. Best is trial 164 with value: 0.8965517241379309.
[32m[I 2023-04-26 02:06:07,182][39m Trial 370 finished with value: 0.8604651162790697 and parameters: {'objective': 'CrossEntropy', 'colsample_bylevel': 0.09211177083309495, 'depth': 5, 'boosting_type': 'Plain', 'bootstrap_type': 'Bayesian', 'bagging_temperature': 6.201039514960095}. Best is trial 164 with value: 0.8965517241379309.
[32m[I 2023-04-26 02:06:11,639][39m Trial 371 finished with value: 0.8837209302325582 and parameters: {'objective': 'CrossEntropy', 'colsample_bylevel': 0.09824625339618326, 'depth': 6, 'boosting_type': 'Plain', 'bootstrap_type': 'Bayesian', 'bagging_temperature': 9.171468323482042}. Best is trial 164 with value: 0.8965517241379309.
[32m[I 2023-04-26 02:06:16,645][39m Trial 372 finished with value: 0.8705882352941177 and parameters: {'objective': 'CrossEntropy', 'colsample_bylevel': 0.09452483728399327, 'depth': 7, 'boosting_type': 'Plain', 'bootstrap_type': 'Bayesian', 'bagging_temperature': 5.502486329437606}. Best is trial 164 with value: 0.8965517241379309.
[32m[I 2023-04-26 02:06:21,407][39m Trial 373 finished with value: 0.8705882352941177 and parameters: {'objective': 'CrossEntropy', 'colsample_bylevel': 0.09996042363346047, 'depth': 6, 'boosting_type': 'Plain', 'bootstrap_type': 'Bayesian', 'bagging_temperature': 2.946238695086833}. Best is trial 164 with value: 0.8965517241379309.
[32m[I 2023-04-26 02:06:25,915][39m Trial 374 finished with value: 0.8470588235294119 and parameters: {'objective': 'CrossEntropy', 'colsample_bylevel': 0.09829134950824335, 'depth': 6, 'boosting_type': 'Plain', 'bootstrap_type': 'Bayesian', 'bagging_temperature': 4.662183968047498}. Best is trial 164 with value: 0.8965517241379309.
[32m[I 2023-04-26 02:06:29,197][39m Trial 375 finished with value: 0.8571428571428572 and parameters: {'objective': 'CrossEntropy', 'colsample_bylevel': 0.09609029268327626, 'depth': 5, 'boosting_type': 'Plain', 'bootstrap_type': 'Bernoulli', 'subsample': 0.343001476184154}. Best is trial 164 with value: 0.8965517241379309.
[32m[I 2023-04-26 02:06:30,909][39m Trial 376 finished with value: 0.7912087912087912 and parameters: {'objective': 'CrossEntropy', 'colsample_bylevel': 0.03997631618695394, 'depth': 6, 'boosting_type': 'Plain', 'bootstrap_type': 'Bayesian', 'bagging_temperature': 8.80149031173084}. Best is trial 164 with value: 0.8965517241379309.
[32m[I 2023-04-26 02:06:35,050][39m Trial 377 finished with value: 0.8705882352941177 and parameters: {'objective': 'CrossEntropy', 'colsample_bylevel': 0.0998932945549225, 'depth': 6, 'boosting_type': 'Plain', 'bootstrap_type': 'Bayesian', 'bagging_temperature': 5.321531290822468}. Best is trial 164 with value: 0.8965517241379309.
[32m[I 2023-04-26 02:06:38,815][39m Trial 378 finished with value: 0.8571428571428572 and parameters: {'objective': 'CrossEntropy', 'colsample_bylevel': 0.09698377343188105, 'depth': 6, 'boosting_type': 'Plain', 'bootstrap_type': 'Bayesian', 'bagging_temperature': 9.277677107626637}. Best is trial 164 with value: 0.8965517241379309.
[32m[I 2023-04-26 02:06:42,776][39m Trial 379 finished with value: 0.8705882352941177 and parameters: {'objective': 'CrossEntropy', 'colsample_bylevel': 0.0985035261761353, 'depth': 6, 'boosting_type': 'Plain', 'bootstrap_type': 'Bayesian', 'bagging_temperature': 4.85698466318253}. Best is trial 164 with value: 0.8965517241379309.
[32m[I 2023-04-26 02:06:46,685][39m Trial 380 finished with value: 0.8837209302325582 and parameters: {'objective': 'CrossEntropy', 'colsample_bylevel': 0.09564159004487888, 'depth': 6, 'boosting_type': 'Plain', 'bootstrap_type': 'Bayesian', 'bagging_temperature': 3.3617377351267606}. Best is trial 164 with value: 0.8965517241379309.
[32m[I 2023-04-26 02:06:50,375][39m Trial 381 finished with value: 0.8705882352941177 and parameters: {'objective': 'CrossEntropy', 'colsample_bylevel': 0.09071220284756773, 'depth': 6, 'boosting_type': 'Plain', 'bootstrap_type': 'Bayesian', 'bagging_temperature': 5.064721316911327}. Best is trial 164 with value: 0.8965517241379309.
[32m[I 2023-04-26 02:06:54,078][39m Trial 382 finished with value: 0.8965517241379309 and parameters: {'objective': 'CrossEntropy', 'colsample_bylevel': 0.09550841429739546, 'depth': 6, 'boosting_type': 'Plain', 'bootstrap_type': 'Bayesian', 'bagging_temperature': 9.739662616258348}. Best is trial 164 with value: 0.8965517241379309.
[32m[I 2023-04-26 02:07:02,318][39m Trial 383 finished with value: 0.8131868131868132 and parameters: {'objective': 'CrossEntropy', 'colsample_bylevel': 0.0980465424688762, 'depth': 5, 'boosting_type': 'Ordered', 'bootstrap_type': 'Bayesian', 'bagging_temperature': 9.696998777834676}. Best is trial 164 with value: 0.8965517241379309.
[32m[I 2023-04-26 02:07:06,428][39m Trial 384 finished with value: 0.8433734939759037 and parameters: {'objective': 'CrossEntropy', 'colsample_bylevel': 0.09307974813590068, 'depth': 7, 'boosting_type': 'Plain', 'bootstrap_type': 'Bayesian', 'bagging_temperature': 9.752983569223005}. Best is trial 164 with value: 0.8965517241379309.
[32m[I 2023-04-26 02:07:10,617][39m Trial 385 finished with value: 0.8433734939759037 and parameters: {'objective': 'CrossEntropy', 'colsample_bylevel': 0.09328097467941772, 'depth': 7, 'boosting_type': 'Plain', 'bootstrap_type': 'Bayesian', 'bagging_temperature': 9.420304984421225}. Best is trial 164 with value: 0.8965517241379309.
[32m[I 2023-04-26 02:07:14,170][39m Trial 386 finished with value: 0.8505747126436782 and parameters: {'objective': 'Logloss', 'colsample_bylevel': 0.09054778283367326, 'depth': 6, 'boosting_type': 'Plain', 'bootstrap_type': 'Bayesian', 'bagging_temperature': 8.996082467269138}. Best is trial 164 with value: 0.8965517241379309.
[32m[I 2023-04-26 02:07:18,212][39m Trial 387 finished with value: 0.8965517241379309 and parameters: {'objective': 'CrossEntropy', 'colsample_bylevel': 0.09482429977509671, 'depth': 6, 'boosting_type': 'Plain', 'bootstrap_type': 'Bayesian', 'bagging_temperature': 5.663488809503167}. Best is trial 164 with value: 0.8965517241379309.
[32m[I 2023-04-26 02:07:22,207][39m Trial 388 finished with value: 0.8705882352941177 and parameters: {'objective': 'CrossEntropy', 'colsample_bylevel': 0.09494819552780463, 'depth': 6, 'boosting_type': 'Plain', 'bootstrap_type': 'Bayesian', 'bagging_temperature': 5.601567642442021}. Best is trial 164 with value: 0.8965517241379309.
[32m[I 2023-04-26 02:07:25,998][39m Trial 389 finished with value: 0.8333333333333333 and parameters: {'objective': 'CrossEntropy', 'colsample_bylevel': 0.09451113047822725, 'depth': 6, 'boosting_type': 'Plain', 'bootstrap_type': 'Bayesian', 'bagging_temperature': 5.296232751732527}. Best is trial 164 with value: 0.8965517241379309.
[32m[I 2023-04-26 02:07:29,628][39m Trial 390 finished with value: 0.8705882352941177 and parameters: {'objective': 'CrossEntropy', 'colsample_bylevel': 0.09175630088485434, 'depth': 6, 'boosting_type': 'Plain', 'bootstrap_type': 'Bayesian', 'bagging_temperature': 5.56575623278579}. Best is trial 164 with value: 0.8965517241379309.
[32m[I 2023-04-26 02:07:32,128][39m Trial 391 finished with value: 0.8604651162790697 and parameters: {'objective': 'CrossEntropy', 'colsample_bylevel': 0.0915376336843976, 'depth': 5, 'boosting_type': 'Plain', 'bootstrap_type': 'Bayesian', 'bagging_temperature': 5.760410589902303}. Best is trial 164 with value: 0.8965517241379309.
[32m[I 2023-04-26 02:07:36,239][39m Trial 392 finished with value: 0.8250000000000001 and parameters: {'objective': 'CrossEntropy', 'colsample_bylevel': 0.09340429568033372, 'depth': 6, 'boosting_type': 'Plain', 'bootstrap_type': 'Bayesian', 'bagging_temperature': 0.05464842110311885}. Best is trial 164 with value: 0.8965517241379309.
[32m[I 2023-04-26 02:07:40,526][39m Trial 393 finished with value: 0.8433734939759037 and parameters: {'objective': 'CrossEntropy', 'colsample_bylevel': 0.09593607583194426, 'depth': 7, 'boosting_type': 'Plain', 'bootstrap_type': 'Bayesian', 'bagging_temperature': 9.836388462746605}. Best is trial 164 with value: 0.8965517241379309.
[32m[I 2023-04-26 02:07:44,464][39m Trial 394 finished with value: 0.8735632183908046 and parameters: {'objective': 'CrossEntropy', 'colsample_bylevel': 0.09653898963580325, 'depth': 6, 'boosting_type': 'Plain', 'bootstrap_type': 'Bayesian', 'bagging_temperature': 4.740916938535686}. Best is trial 164 with value: 0.8965517241379309.
[32m[I 2023-04-26 02:07:48,078][39m Trial 395 finished with value: 0.8837209302325582 and parameters: {'objective': 'CrossEntropy', 'colsample_bylevel': 0.09285912443297435, 'depth': 6, 'boosting_type': 'Plain', 'bootstrap_type': 'Bayesian', 'bagging_temperature': 4.8233054385601895}. Best is trial 164 with value: 0.8965517241379309.
[32m[I 2023-04-26 02:07:50,823][39m Trial 396 finished with value: 0.8705882352941177 and parameters: {'objective': 'CrossEntropy', 'colsample_bylevel': 0.09662070666716156, 'depth': 5, 'boosting_type': 'Plain', 'bootstrap_type': 'Bayesian', 'bagging_temperature': 2.3902093249990695}. Best is trial 164 with value: 0.8965517241379309.
[32m[I 2023-04-26 02:07:55,442][39m Trial 397 finished with value: 0.8571428571428572 and parameters: {'objective': 'CrossEntropy', 'colsample_bylevel': 0.09989082385762425, 'depth': 7, 'boosting_type': 'Plain', 'bootstrap_type': 'Bayesian', 'bagging_temperature': 4.545354068632232}. Best is trial 164 with value: 0.8965517241379309.
[32m[I 2023-04-26 02:07:59,164][39m Trial 398 finished with value: 0.8333333333333333 and parameters: {'objective': 'CrossEntropy', 'colsample_bylevel': 0.09795780199803616, 'depth': 6, 'boosting_type': 'Plain', 'bootstrap_type': 'Bernoulli', 'subsample': 0.12162318118332116}. Best is trial 164 with value: 0.8965517241379309.
[32m[I 2023-04-26 02:08:02,709][39m Trial 399 finished with value: 0.8735632183908046 and parameters: {'objective': 'CrossEntropy', 'colsample_bylevel': 0.09471563993367407, 'depth': 6, 'boosting_type': 'Plain', 'bootstrap_type': 'Bayesian', 'bagging_temperature': 9.871583597077784}. Best is trial 164 with value: 0.8965517241379309.
[32m[I 2023-04-26 02:08:06,504][39m Trial 400 finished with value: 0.8571428571428572 and parameters: {'objective': 'CrossEntropy', 'colsample_bylevel': 0.0984723542517311, 'depth': 6, 'boosting_type': 'Plain', 'bootstrap_type': 'Bayesian', 'bagging_temperature': 9.164133454756048}. Best is trial 164 with value: 0.8965517241379309.
[32m[I 2023-04-26 02:08:10,066][39m Trial 401 finished with value: 0.8571428571428572 and parameters: {'objective': 'CrossEntropy', 'colsample_bylevel': 0.09306791882170137, 'depth': 6, 'boosting_type': 'Plain', 'bootstrap_type': 'Bayesian', 'bagging_temperature': 4.829961875503935}. Best is trial 164 with value: 0.8965517241379309.
[32m[I 2023-04-26 02:08:14,505][39m Trial 402 finished with value: 0.8705882352941177 and parameters: {'objective': 'CrossEntropy', 'colsample_bylevel': 0.094655378467591, 'depth': 7, 'boosting_type': 'Plain', 'bootstrap_type': 'Bayesian', 'bagging_temperature': 5.037158104134337}. Best is trial 164 with value: 0.8965517241379309.
