[32m[I 2023-04-26 01:49:22,812][39m Trial 143 finished with value: 0.8470588235294119 and parameters: {'objective': 'CrossEntropy', 'colsample_bylevel': 0.08639998902336907, 'depth': 6, 'boosting_type': 'Plain', 'bootstrap_type': 'Bayesian', 'bagging_temperature': 2.4945921950845173}. Best is trial 119 with value: 0.8837209302325582.
[32m[I 2023-04-26 01:49:27,259][39m Trial 144 finished with value: 0.8604651162790697 and parameters: {'objective': 'CrossEntropy', 'colsample_bylevel': 0.08327841625733785, 'depth': 6, 'boosting_type': 'Plain', 'bootstrap_type': 'Bayesian', 'bagging_temperature': 5.67913713821948}. Best is trial 119 with value: 0.8837209302325582.
[32m[I 2023-04-26 01:49:31,061][39m Trial 145 finished with value: 0.8433734939759037 and parameters: {'objective': 'CrossEntropy', 'colsample_bylevel': 0.09749524077123073, 'depth': 5, 'boosting_type': 'Plain', 'bootstrap_type': 'Bayesian', 'bagging_temperature': 0.16794322382318994}. Best is trial 119 with value: 0.8837209302325582.
[32m[I 2023-04-26 01:49:34,227][39m Trial 146 finished with value: 0.8735632183908046 and parameters: {'objective': 'CrossEntropy', 'colsample_bylevel': 0.0810929548780801, 'depth': 5, 'boosting_type': 'Plain', 'bootstrap_type': 'Bayesian', 'bagging_temperature': 3.683409119798948}. Best is trial 119 with value: 0.8837209302325582.
[32m[I 2023-04-26 01:49:37,233][39m Trial 147 finished with value: 0.8604651162790697 and parameters: {'objective': 'CrossEntropy', 'colsample_bylevel': 0.08230458614386513, 'depth': 5, 'boosting_type': 'Plain', 'bootstrap_type': 'Bayesian', 'bagging_temperature': 3.6749924989434204}. Best is trial 119 with value: 0.8837209302325582.
[32m[I 2023-04-26 01:49:40,860][39m Trial 148 finished with value: 0.8764044943820225 and parameters: {'objective': 'CrossEntropy', 'colsample_bylevel': 0.0895030775717347, 'depth': 5, 'boosting_type': 'Plain', 'bootstrap_type': 'Bayesian', 'bagging_temperature': 4.6079796410420055}. Best is trial 119 with value: 0.8837209302325582.
[32m[I 2023-04-26 01:49:43,664][39m Trial 149 finished with value: 0.8089887640449439 and parameters: {'objective': 'CrossEntropy', 'colsample_bylevel': 0.07712328387224239, 'depth': 4, 'boosting_type': 'Plain', 'bootstrap_type': 'Bayesian', 'bagging_temperature': 4.222978858319113}. Best is trial 119 with value: 0.8837209302325582.
[32m[I 2023-04-26 01:49:47,126][39m Trial 150 finished with value: 0.8604651162790697 and parameters: {'objective': 'CrossEntropy', 'colsample_bylevel': 0.08163602306952211, 'depth': 5, 'boosting_type': 'Plain', 'bootstrap_type': 'Bayesian', 'bagging_temperature': 4.735848686457468}. Best is trial 119 with value: 0.8837209302325582.
[32m[I 2023-04-26 01:49:52,169][39m Trial 151 finished with value: 0.8705882352941177 and parameters: {'objective': 'CrossEntropy', 'colsample_bylevel': 0.09789082014740264, 'depth': 6, 'boosting_type': 'Plain', 'bootstrap_type': 'Bayesian', 'bagging_temperature': 4.825207732365428}. Best is trial 119 with value: 0.8837209302325582.
[32m[I 2023-04-26 01:49:57,450][39m Trial 152 finished with value: 0.8837209302325582 and parameters: {'objective': 'CrossEntropy', 'colsample_bylevel': 0.09867527654405088, 'depth': 6, 'boosting_type': 'Plain', 'bootstrap_type': 'Bayesian', 'bagging_temperature': 5.637991905994724}. Best is trial 119 with value: 0.8837209302325582.
[32m[I 2023-04-26 01:50:02,315][39m Trial 153 finished with value: 0.8571428571428572 and parameters: {'objective': 'CrossEntropy', 'colsample_bylevel': 0.09568151683010977, 'depth': 6, 'boosting_type': 'Plain', 'bootstrap_type': 'Bayesian', 'bagging_temperature': 5.960104923656077}. Best is trial 119 with value: 0.8837209302325582.
[32m[I 2023-04-26 01:50:05,106][39m Trial 154 finished with value: 0.8275862068965518 and parameters: {'objective': 'CrossEntropy', 'colsample_bylevel': 0.07519379645960743, 'depth': 4, 'boosting_type': 'Plain', 'bootstrap_type': 'Bayesian', 'bagging_temperature': 4.609814633038746}. Best is trial 119 with value: 0.8837209302325582.
[32m[I 2023-04-26 01:50:10,371][39m Trial 155 finished with value: 0.8571428571428572 and parameters: {'objective': 'CrossEntropy', 'colsample_bylevel': 0.09859837629355586, 'depth': 6, 'boosting_type': 'Plain', 'bootstrap_type': 'Bayesian', 'bagging_temperature': 4.960316909220962}. Best is trial 119 with value: 0.8837209302325582.
[32m[I 2023-04-26 01:50:13,322][39m Trial 156 finished with value: 0.8372093023255814 and parameters: {'objective': 'CrossEntropy', 'colsample_bylevel': 0.08044479867622964, 'depth': 5, 'boosting_type': 'Plain', 'bootstrap_type': 'Bayesian', 'bagging_temperature': 5.428315687472576}. Best is trial 119 with value: 0.8837209302325582.
[32m[I 2023-04-26 01:50:16,868][39m Trial 157 finished with value: 0.8571428571428572 and parameters: {'objective': 'CrossEntropy', 'colsample_bylevel': 0.08960665993102981, 'depth': 5, 'boosting_type': 'Plain', 'bootstrap_type': 'Bayesian', 'bagging_temperature': 3.861617731064524}. Best is trial 119 with value: 0.8837209302325582.
[32m[I 2023-04-26 01:50:22,177][39m Trial 158 finished with value: 0.8705882352941177 and parameters: {'objective': 'CrossEntropy', 'colsample_bylevel': 0.09988893370982291, 'depth': 6, 'boosting_type': 'Plain', 'bootstrap_type': 'Bayesian', 'bagging_temperature': 4.725911041303236}. Best is trial 119 with value: 0.8837209302325582.
[32m[I 2023-04-26 01:50:26,306][39m Trial 159 finished with value: 0.8470588235294119 and parameters: {'objective': 'CrossEntropy', 'colsample_bylevel': 0.07864698718395371, 'depth': 6, 'boosting_type': 'Plain', 'bootstrap_type': 'Bayesian', 'bagging_temperature': 6.3540664336249}. Best is trial 119 with value: 0.8837209302325582.
[32m[I 2023-04-26 01:50:31,187][39m Trial 160 finished with value: 0.8571428571428572 and parameters: {'objective': 'CrossEntropy', 'colsample_bylevel': 0.09424323314559156, 'depth': 6, 'boosting_type': 'Plain', 'bootstrap_type': 'Bayesian', 'bagging_temperature': 4.3749054664341696}. Best is trial 119 with value: 0.8837209302325582.
[32m[I 2023-04-26 01:50:36,099][39m Trial 161 finished with value: 0.8705882352941177 and parameters: {'objective': 'CrossEntropy', 'colsample_bylevel': 0.09853153264652892, 'depth': 6, 'boosting_type': 'Plain', 'bootstrap_type': 'Bayesian', 'bagging_temperature': 4.719381856874139}. Best is trial 119 with value: 0.8837209302325582.
[32m[I 2023-04-26 01:50:39,769][39m Trial 162 finished with value: 0.8539325842696629 and parameters: {'objective': 'CrossEntropy', 'colsample_bylevel': 0.09658712213561807, 'depth': 5, 'boosting_type': 'Plain', 'bootstrap_type': 'Bayesian', 'bagging_temperature': 9.284952061753811}. Best is trial 119 with value: 0.8837209302325582.
[32m[I 2023-04-26 01:50:44,654][39m Trial 163 finished with value: 0.8433734939759037 and parameters: {'objective': 'CrossEntropy', 'colsample_bylevel': 0.09740574636219208, 'depth': 6, 'boosting_type': 'Plain', 'bootstrap_type': 'Bayesian', 'bagging_temperature': 4.894342542879336}. Best is trial 119 with value: 0.8837209302325582.
[32m[I 2023-04-26 01:50:49,795][39m Trial 164 finished with value: 0.8965517241379309 and parameters: {'objective': 'CrossEntropy', 'colsample_bylevel': 0.09888069782656156, 'depth': 6, 'boosting_type': 'Plain', 'bootstrap_type': 'Bayesian', 'bagging_temperature': 5.234823168799618}. Best is trial 164 with value: 0.8965517241379309.
[32m[I 2023-04-26 01:50:52,955][39m Trial 165 finished with value: 0.8705882352941177 and parameters: {'objective': 'CrossEntropy', 'colsample_bylevel': 0.08797858399088934, 'depth': 5, 'boosting_type': 'Plain', 'bootstrap_type': 'Bayesian', 'bagging_temperature': 5.693371180706999}. Best is trial 164 with value: 0.8965517241379309.
[32m[I 2023-04-26 01:50:56,584][39m Trial 166 finished with value: 0.8470588235294119 and parameters: {'objective': 'CrossEntropy', 'colsample_bylevel': 0.08786343022588738, 'depth': 5, 'boosting_type': 'Plain', 'bootstrap_type': 'Bayesian', 'bagging_temperature': 5.772237573088024}. Best is trial 164 with value: 0.8965517241379309.
[32m[I 2023-04-26 01:51:00,519][39m Trial 167 finished with value: 0.8705882352941177 and parameters: {'objective': 'CrossEntropy', 'colsample_bylevel': 0.09947019737628393, 'depth': 5, 'boosting_type': 'Plain', 'bootstrap_type': 'Bayesian', 'bagging_temperature': 5.290147106071052}. Best is trial 164 with value: 0.8965517241379309.
[32m[I 2023-04-26 01:51:11,431][39m Trial 168 finished with value: 0.8089887640449439 and parameters: {'objective': 'CrossEntropy', 'colsample_bylevel': 0.09397322544037649, 'depth': 5, 'boosting_type': 'Ordered', 'bootstrap_type': 'Bayesian', 'bagging_temperature': 0.6212130247224597}. Best is trial 164 with value: 0.8965517241379309.
[32m[I 2023-04-26 01:51:14,849][39m Trial 169 finished with value: 0.8372093023255814 and parameters: {'objective': 'CrossEntropy', 'colsample_bylevel': 0.09990586656604943, 'depth': 4, 'boosting_type': 'Plain', 'bootstrap_type': 'Bayesian', 'bagging_temperature': 6.177220907874938}. Best is trial 164 with value: 0.8965517241379309.
[32m[I 2023-04-26 01:51:19,701][39m Trial 170 finished with value: 0.8705882352941177 and parameters: {'objective': 'CrossEntropy', 'colsample_bylevel': 0.09615833262206978, 'depth': 6, 'boosting_type': 'Plain', 'bootstrap_type': 'Bayesian', 'bagging_temperature': 5.545495422544429}. Best is trial 164 with value: 0.8965517241379309.
[32m[I 2023-04-26 01:51:24,892][39m Trial 171 finished with value: 0.8604651162790697 and parameters: {'objective': 'CrossEntropy', 'colsample_bylevel': 0.09880896732311435, 'depth': 6, 'boosting_type': 'Plain', 'bootstrap_type': 'Bayesian', 'bagging_temperature': 4.688525794624174}. Best is trial 164 with value: 0.8965517241379309.
[32m[I 2023-04-26 01:51:30,501][39m Trial 172 finished with value: 0.8433734939759037 and parameters: {'objective': 'CrossEntropy', 'colsample_bylevel': 0.0924998722719022, 'depth': 7, 'boosting_type': 'Plain', 'bootstrap_type': 'Bayesian', 'bagging_temperature': 3.1302106139515256}. Best is trial 164 with value: 0.8965517241379309.
[32m[I 2023-04-26 01:51:35,321][39m Trial 173 finished with value: 0.8292682926829268 and parameters: {'objective': 'CrossEntropy', 'colsample_bylevel': 0.09525003395814637, 'depth': 6, 'boosting_type': 'Plain', 'bootstrap_type': 'Bayesian', 'bagging_temperature': 1.5327478658104334}. Best is trial 164 with value: 0.8965517241379309.
[32m[I 2023-04-26 01:51:40,536][39m Trial 174 finished with value: 0.8837209302325582 and parameters: {'objective': 'CrossEntropy', 'colsample_bylevel': 0.09760236241975327, 'depth': 6, 'boosting_type': 'Plain', 'bootstrap_type': 'Bayesian', 'bagging_temperature': 5.154017656614672}. Best is trial 164 with value: 0.8965517241379309.
[32m[I 2023-04-26 01:51:45,010][39m Trial 175 finished with value: 0.8863636363636364 and parameters: {'objective': 'CrossEntropy', 'colsample_bylevel': 0.09028409956827041, 'depth': 6, 'boosting_type': 'Plain', 'bootstrap_type': 'Bayesian', 'bagging_temperature': 5.193810410682757}. Best is trial 164 with value: 0.8965517241379309.
[32m[I 2023-04-26 01:51:49,882][39m Trial 176 finished with value: 0.8735632183908046 and parameters: {'objective': 'CrossEntropy', 'colsample_bylevel': 0.09153212885779684, 'depth': 7, 'boosting_type': 'Plain', 'bootstrap_type': 'Bayesian', 'bagging_temperature': 7.6823890676537605}. Best is trial 164 with value: 0.8965517241379309.
[32m[I 2023-04-26 01:51:54,822][39m Trial 177 finished with value: 0.8571428571428572 and parameters: {'objective': 'CrossEntropy', 'colsample_bylevel': 0.09647448110039099, 'depth': 6, 'boosting_type': 'Plain', 'bootstrap_type': 'Bayesian', 'bagging_temperature': 5.347352101344386}. Best is trial 164 with value: 0.8965517241379309.
[32m[I 2023-04-26 01:51:59,967][39m Trial 178 finished with value: 0.8735632183908046 and parameters: {'objective': 'CrossEntropy', 'colsample_bylevel': 0.09181761709294103, 'depth': 7, 'boosting_type': 'Plain', 'bootstrap_type': 'Bayesian', 'bagging_temperature': 7.120061416489224}. Best is trial 164 with value: 0.8965517241379309.
[32m[I 2023-04-26 01:52:05,237][39m Trial 179 finished with value: 0.8470588235294119 and parameters: {'objective': 'CrossEntropy', 'colsample_bylevel': 0.09228330501758213, 'depth': 7, 'boosting_type': 'Plain', 'bootstrap_type': 'Bayesian', 'bagging_temperature': 8.410717471326675}. Best is trial 164 with value: 0.8965517241379309.
[32m[I 2023-04-26 01:52:10,697][39m Trial 180 finished with value: 0.8571428571428572 and parameters: {'objective': 'CrossEntropy', 'colsample_bylevel': 0.09392514270335378, 'depth': 7, 'boosting_type': 'Plain', 'bootstrap_type': 'Bayesian', 'bagging_temperature': 7.22115364615124}. Best is trial 164 with value: 0.8965517241379309.
[32m[I 2023-04-26 01:52:14,814][39m Trial 181 finished with value: 0.8433734939759037 and parameters: {'objective': 'CrossEntropy', 'colsample_bylevel': 0.09115121096585292, 'depth': 6, 'boosting_type': 'Plain', 'bootstrap_type': 'Bayesian', 'bagging_temperature': 7.509592554422533}. Best is trial 164 with value: 0.8965517241379309.
[32m[I 2023-04-26 01:52:20,227][39m Trial 182 finished with value: 0.8705882352941177 and parameters: {'objective': 'CrossEntropy', 'colsample_bylevel': 0.09939994672423427, 'depth': 7, 'boosting_type': 'Plain', 'bootstrap_type': 'Bayesian', 'bagging_temperature': 5.028638645906476}. Best is trial 164 with value: 0.8965517241379309.
[32m[I 2023-04-26 01:52:25,229][39m Trial 183 finished with value: 0.8604651162790697 and parameters: {'objective': 'Logloss', 'colsample_bylevel': 0.09187424377337294, 'depth': 7, 'boosting_type': 'Plain', 'bootstrap_type': 'Bayesian', 'bagging_temperature': 5.218895642011764}. Best is trial 164 with value: 0.8965517241379309.
[32m[I 2023-04-26 01:52:28,667][39m Trial 184 finished with value: 0.8148148148148149 and parameters: {'objective': 'CrossEntropy', 'colsample_bylevel': 0.09384538318970181, 'depth': 5, 'boosting_type': 'Plain', 'bootstrap_type': 'Bayesian', 'bagging_temperature': 1.1826875738129372}. Best is trial 164 with value: 0.8965517241379309.
[32m[I 2023-04-26 01:52:33,120][39m Trial 185 finished with value: 0.8837209302325582 and parameters: {'objective': 'CrossEntropy', 'colsample_bylevel': 0.08974035161006873, 'depth': 6, 'boosting_type': 'Plain', 'bootstrap_type': 'Bayesian', 'bagging_temperature': 5.603841975450313}. Best is trial 164 with value: 0.8965517241379309.
[32m[I 2023-04-26 01:52:37,651][39m Trial 186 finished with value: 0.8837209302325582 and parameters: {'objective': 'CrossEntropy', 'colsample_bylevel': 0.09730085679533199, 'depth': 6, 'boosting_type': 'Plain', 'bootstrap_type': 'Bayesian', 'bagging_temperature': 9.489898285955856}. Best is trial 164 with value: 0.8965517241379309.
[32m[I 2023-04-26 01:52:42,406][39m Trial 187 finished with value: 0.8735632183908046 and parameters: {'objective': 'CrossEntropy', 'colsample_bylevel': 0.09760900174543177, 'depth': 6, 'boosting_type': 'Plain', 'bootstrap_type': 'Bayesian', 'bagging_temperature': 9.899791537109195}. Best is trial 164 with value: 0.8965517241379309.
[32m[I 2023-04-26 01:52:47,101][39m Trial 188 finished with value: 0.8705882352941177 and parameters: {'objective': 'CrossEntropy', 'colsample_bylevel': 0.0978587139077097, 'depth': 6, 'boosting_type': 'Plain', 'bootstrap_type': 'Bayesian', 'bagging_temperature': 9.789777109449561}. Best is trial 164 with value: 0.8965517241379309.
[32m[I 2023-04-26 01:52:51,758][39m Trial 189 finished with value: 0.8735632183908046 and parameters: {'objective': 'CrossEntropy', 'colsample_bylevel': 0.09699492608318142, 'depth': 6, 'boosting_type': 'Plain', 'bootstrap_type': 'Bayesian', 'bagging_temperature': 9.540596990824428}. Best is trial 164 with value: 0.8965517241379309.
[32m[I 2023-04-26 01:52:55,856][39m Trial 190 finished with value: 0.8636363636363636 and parameters: {'objective': 'CrossEntropy', 'colsample_bylevel': 0.09539411875209906, 'depth': 6, 'boosting_type': 'Plain', 'bootstrap_type': 'Bayesian', 'bagging_temperature': 9.454066529904276}. Best is trial 164 with value: 0.8965517241379309.
[32m[I 2023-04-26 01:53:00,126][39m Trial 191 finished with value: 0.8705882352941177 and parameters: {'objective': 'CrossEntropy', 'colsample_bylevel': 0.0900004866338149, 'depth': 6, 'boosting_type': 'Plain', 'bootstrap_type': 'Bayesian', 'bagging_temperature': 9.630056076603532}. Best is trial 164 with value: 0.8965517241379309.
[32m[I 2023-04-26 01:53:04,119][39m Trial 192 finished with value: 0.8705882352941177 and parameters: {'objective': 'CrossEntropy', 'colsample_bylevel': 0.08927914442843883, 'depth': 6, 'boosting_type': 'Plain', 'bootstrap_type': 'Bayesian', 'bagging_temperature': 9.042254373305335}. Best is trial 164 with value: 0.8965517241379309.
[32m[I 2023-04-26 01:53:08,730][39m Trial 193 finished with value: 0.8636363636363636 and parameters: {'objective': 'CrossEntropy', 'colsample_bylevel': 0.09736068250603262, 'depth': 6, 'boosting_type': 'Plain', 'bootstrap_type': 'Bayesian', 'bagging_temperature': 9.864776778403035}. Best is trial 164 with value: 0.8965517241379309.
[32m[I 2023-04-26 01:53:13,298][39m Trial 194 finished with value: 0.8571428571428572 and parameters: {'objective': 'CrossEntropy', 'colsample_bylevel': 0.08650944671674034, 'depth': 7, 'boosting_type': 'Plain', 'bootstrap_type': 'Bayesian', 'bagging_temperature': 5.977710150604152}. Best is trial 164 with value: 0.8965517241379309.
[32m[I 2023-04-26 01:53:16,674][39m Trial 195 finished with value: 0.8470588235294119 and parameters: {'objective': 'CrossEntropy', 'colsample_bylevel': 0.09535399687733728, 'depth': 5, 'boosting_type': 'Plain', 'bootstrap_type': 'Bayesian', 'bagging_temperature': 5.5220776272934415}. Best is trial 164 with value: 0.8965517241379309.
[32m[I 2023-04-26 01:53:21,057][39m Trial 196 finished with value: 0.8705882352941177 and parameters: {'objective': 'CrossEntropy', 'colsample_bylevel': 0.09350137616830338, 'depth': 6, 'boosting_type': 'Plain', 'bootstrap_type': 'Bayesian', 'bagging_temperature': 5.648343415727395}. Best is trial 164 with value: 0.8965517241379309.
[32m[I 2023-04-26 01:53:25,242][39m Trial 197 finished with value: 0.8571428571428572 and parameters: {'objective': 'CrossEntropy', 'colsample_bylevel': 0.08434349100189605, 'depth': 7, 'boosting_type': 'Plain', 'bootstrap_type': 'Bayesian', 'bagging_temperature': 8.562309741097494}. Best is trial 164 with value: 0.8965517241379309.
[32m[I 2023-04-26 01:53:29,890][39m Trial 198 finished with value: 0.8604651162790697 and parameters: {'objective': 'CrossEntropy', 'colsample_bylevel': 0.09754982034159607, 'depth': 6, 'boosting_type': 'Plain', 'bootstrap_type': 'Bayesian', 'bagging_temperature': 5.094552660427401}. Best is trial 164 with value: 0.8965517241379309.
[32m[I 2023-04-26 01:53:41,408][39m Trial 199 finished with value: 0.8444444444444446 and parameters: {'objective': 'CrossEntropy', 'colsample_bylevel': 0.09833858711399143, 'depth': 6, 'boosting_type': 'Ordered', 'bootstrap_type': 'Bayesian', 'bagging_temperature': 9.949825938879856}. Best is trial 164 with value: 0.8965517241379309.
[32m[I 2023-04-26 01:53:44,775][39m Trial 200 finished with value: 0.8735632183908046 and parameters: {'objective': 'CrossEntropy', 'colsample_bylevel': 0.0986060641246891, 'depth': 5, 'boosting_type': 'Plain', 'bootstrap_type': 'Bayesian', 'bagging_temperature': 4.388813516775112}. Best is trial 164 with value: 0.8965517241379309.
[32m[I 2023-04-26 01:53:50,138][39m Trial 201 finished with value: 0.8433734939759037 and parameters: {'objective': 'CrossEntropy', 'colsample_bylevel': 0.09499519776019591, 'depth': 7, 'boosting_type': 'Plain', 'bootstrap_type': 'Bayesian', 'bagging_temperature': 4.4242774543614845}. Best is trial 164 with value: 0.8965517241379309.
[32m[I 2023-04-26 01:53:54,808][39m Trial 202 finished with value: 0.8571428571428572 and parameters: {'objective': 'CrossEntropy', 'colsample_bylevel': 0.09912088737971284, 'depth': 6, 'boosting_type': 'Plain', 'bootstrap_type': 'Bayesian', 'bagging_temperature': 5.117705313739363}. Best is trial 164 with value: 0.8965517241379309.
[32m[I 2023-04-26 01:53:58,026][39m Trial 203 finished with value: 0.8705882352941177 and parameters: {'objective': 'CrossEntropy', 'colsample_bylevel': 0.09675244012075816, 'depth': 5, 'boosting_type': 'Plain', 'bootstrap_type': 'Bayesian', 'bagging_temperature': 5.603734029632465}. Best is trial 164 with value: 0.8965517241379309.
[32m[I 2023-04-26 01:54:01,340][39m Trial 204 finished with value: 0.8333333333333333 and parameters: {'objective': 'CrossEntropy', 'colsample_bylevel': 0.09953246098102883, 'depth': 5, 'boosting_type': 'Plain', 'bootstrap_type': 'Bayesian', 'bagging_temperature': 4.60968312933738}. Best is trial 164 with value: 0.8965517241379309.
[32m[I 2023-04-26 01:54:04,444][39m Trial 205 finished with value: 0.8735632183908046 and parameters: {'objective': 'CrossEntropy', 'colsample_bylevel': 0.09620139921615872, 'depth': 5, 'boosting_type': 'Plain', 'bootstrap_type': 'Bayesian', 'bagging_temperature': 3.97499582887699}. Best is trial 164 with value: 0.8965517241379309.
[32m[I 2023-04-26 01:54:07,420][39m Trial 206 finished with value: 0.8604651162790697 and parameters: {'objective': 'CrossEntropy', 'colsample_bylevel': 0.0963813823297176, 'depth': 5, 'boosting_type': 'Plain', 'bootstrap_type': 'Bayesian', 'bagging_temperature': 3.797762695576366}. Best is trial 164 with value: 0.8965517241379309.
[32m[I 2023-04-26 01:54:11,268][39m Trial 207 finished with value: 0.8604651162790697 and parameters: {'objective': 'CrossEntropy', 'colsample_bylevel': 0.0912912816963014, 'depth': 5, 'boosting_type': 'Plain', 'bootstrap_type': 'Bayesian', 'bagging_temperature': 4.146681821602907}. Best is trial 164 with value: 0.8965517241379309.
