[32m[I 2023-04-23 19:37:41,199][39m Trial 67 finished with value: 0.8288288288288289 and parameters: {'objective': 'CrossEntropy', 'colsample_bylevel': 0.07994976377245447, 'depth': 12, 'boosting_type': 'Plain', 'bootstrap_type': 'Bayesian', 'bagging_temperature': 9.944679646982474}. Best is trial 62 with value: 0.8623853211009174.
[32m[I 2023-04-23 19:37:44,609][39m Trial 68 finished with value: 0.8103448275862069 and parameters: {'objective': 'CrossEntropy', 'colsample_bylevel': 0.07292918976219198, 'depth': 11, 'boosting_type': 'Ordered', 'bootstrap_type': 'MVS'}. Best is trial 62 with value: 0.8623853211009174.
[32m[I 2023-04-23 19:37:46,471][39m Trial 69 finished with value: 0.8318584070796461 and parameters: {'objective': 'Logloss', 'colsample_bylevel': 0.09634815360477259, 'depth': 9, 'boosting_type': 'Plain', 'bootstrap_type': 'Bernoulli', 'subsample': 0.11899029767954894}. Best is trial 62 with value: 0.8623853211009174.
Number of finished trials: 70
############################################################################################
############       F A S T   F E A T U R E  E N G G    A N D    S E L E C T I O N ! ########
# Be judicious with featurewiz. Don't use it to create too many un-interpretable features! #
############################################################################################
featurewiz has selected 0.7 as the correlation limit. Change this limit to fit your needs...
Skipping feature engineering since no feature_engg input...
Skipping category encoding since no category encoders specified in input...
#### Single_Label Binary_Classification problem ####
    Loaded train data. Shape = (372, 20)
#### Single_Label Binary_Classification problem ####
No test data filename given...
#######################################################################################
######################## C L A S S I F Y I N G  V A R I A B L E S  ####################
#######################################################################################
        No variables were removed since no ID or low-information variables found in data set
#######################################################################################
#####  Searching for Uncorrelated List Of Variables (SULOV) in 17 features ############
#######################################################################################
    there are no null values in dataset...
    Removing (7) highly correlated variables:
    ['Re', 'height', 'liquid_density', 'particle_droplet_diameter_ratio', 'roughness_binary', 'velocity', 'volume_fraction']
    Following (10) vars selected: ['droplet_diameter', 'inclination', 'particle_liquid_density_ratio', 'surface_tension', 'roughness', 'We_Re', 'viscosity', 'We', 'particle_mean_diameter', 'volume_fraction_binary']
Completed SULOV. 10 features selected
Time taken for SULOV method = 0 seconds
Finally 12 vars selected after SULOV
Converting all features to numeric before sending to XGBoost...
    there were no mixed data types or object columns that errored. Data is all numeric...
Shape of train data after adding missing values flags = (372, 13)
#######################################################################################
#####    R E C U R S I V E   X G B O O S T : F E A T U R E   S E L E C T I O N  #######
#######################################################################################
Current number of predictors before recursive XGBoost = 12
Number of booster rounds = 100
            selecting 5 features in this iteration
            selecting 4 features in this iteration
            selecting 3 features in this iteration
            selecting 2 features in this iteration
            selecting 1 features in this iteration
            selecting 1 features in this iteration
    Completed XGBoost feature selection in 0 seconds
#######################################################################################
#####          F E A T U R E   S E L E C T I O N   C O M P L E T E D            #######
#######################################################################################
Selected 6 important features:
['surface_tension', 'roughness', 'particle_mean_diameter', 'inclination', 'viscosity', 'wettability']
Total Time taken for featurewiz selection = 1 seconds
Output contains a list of 6 important features and a train dataframe
Shape train:	 (52, 6)
Shape test:	 (47, 6)
############################################################################################
############       F A S T   F E A T U R E  E N G G    A N D    S E L E C T I O N ! ########
# Be judicious with featurewiz. Don't use it to create too many un-interpretable features! #
############################################################################################
featurewiz has selected 0.7 as the correlation limit. Change this limit to fit your needs...
Skipping feature engineering since no feature_engg input...
Skipping category encoding since no category encoders specified in input...
#### Single_Label Binary_Classification problem ####
    Loaded train data. Shape = (372, 20)
#### Single_Label Binary_Classification problem ####
No test data filename given...
#######################################################################################
######################## C L A S S I F Y I N G  V A R I A B L E S  ####################
#######################################################################################
        No variables were removed since no ID or low-information variables found in data set
#######################################################################################
#####  Searching for Uncorrelated List Of Variables (SULOV) in 17 features ############
#######################################################################################
    there are no null values in dataset...
    Removing (7) highly correlated variables:
    ['Re', 'height', 'liquid_density', 'particle_droplet_diameter_ratio', 'roughness_binary', 'velocity', 'volume_fraction']
    Following (10) vars selected: ['droplet_diameter', 'inclination', 'particle_liquid_density_ratio', 'surface_tension', 'roughness', 'We_Re', 'viscosity', 'We', 'particle_mean_diameter', 'volume_fraction_binary']
Completed SULOV. 10 features selected
Time taken for SULOV method = 0 seconds
Finally 12 vars selected after SULOV
Converting all features to numeric before sending to XGBoost...
    there were no mixed data types or object columns that errored. Data is all numeric...
Shape of train data after adding missing values flags = (372, 13)
#######################################################################################
#####    R E C U R S I V E   X G B O O S T : F E A T U R E   S E L E C T I O N  #######
#######################################################################################
Current number of predictors before recursive XGBoost = 12
Number of booster rounds = 100
            selecting 5 features in this iteration
            selecting 4 features in this iteration
            selecting 3 features in this iteration
            selecting 2 features in this iteration
            selecting 1 features in this iteration
            selecting 1 features in this iteration
    Completed XGBoost feature selection in 0 seconds
#######################################################################################
#####          F E A T U R E   S E L E C T I O N   C O M P L E T E D            #######
#######################################################################################
Selected 6 important features:
['surface_tension', 'roughness', 'particle_mean_diameter', 'inclination', 'viscosity', 'wettability']
Total Time taken for featurewiz selection = 0 seconds
Output contains a list of 6 important features and a train dataframe
Shape train:	 (52, 6)
Shape test:	 (47, 6)