[32m[I 2023-04-23 19:36:15,811][39m A new study created in memory with name: no-name-26eca8fe-13df-4fc3-905d-8f4af5e5c0ca
[32m[I 2023-04-23 19:36:16,408][39m Trial 0 finished with value: 0.8205128205128205 and parameters: {'objective': 'Logloss', 'colsample_bylevel': 0.027811382657900688, 'depth': 10, 'boosting_type': 'Plain', 'bootstrap_type': 'MVS'}. Best is trial 0 with value: 0.8205128205128205.
[32m[I 2023-04-23 19:36:16,997][39m Trial 1 finished with value: 0.8347826086956522 and parameters: {'objective': 'CrossEntropy', 'colsample_bylevel': 0.04142184909424817, 'depth': 8, 'boosting_type': 'Plain', 'bootstrap_type': 'Bernoulli', 'subsample': 0.4743479096224382}. Best is trial 1 with value: 0.8347826086956522.
[32m[I 2023-04-23 19:36:19,739][39m Trial 2 finished with value: 0.8245614035087718 and parameters: {'objective': 'Logloss', 'colsample_bylevel': 0.08643135589601547, 'depth': 3, 'boosting_type': 'Ordered', 'bootstrap_type': 'Bernoulli', 'subsample': 0.4508358423504194}. Best is trial 1 with value: 0.8347826086956522.
[32m[I 2023-04-23 19:36:22,295][39m Trial 3 finished with value: 0.8103448275862069 and parameters: {'objective': 'Logloss', 'colsample_bylevel': 0.026254318368681077, 'depth': 5, 'boosting_type': 'Ordered', 'bootstrap_type': 'Bayesian', 'bagging_temperature': 1.400331451051151}. Best is trial 1 with value: 0.8347826086956522.
[32m[I 2023-04-23 19:36:25,572][39m Trial 4 finished with value: 0.8103448275862069 and parameters: {'objective': 'CrossEntropy', 'colsample_bylevel': 0.048675193947716265, 'depth': 4, 'boosting_type': 'Ordered', 'bootstrap_type': 'Bernoulli', 'subsample': 0.5019348598178697}. Best is trial 1 with value: 0.8347826086956522.
[32m[I 2023-04-23 19:36:26,967][39m Trial 5 finished with value: 0.7868852459016394 and parameters: {'objective': 'Logloss', 'colsample_bylevel': 0.010954677225170897, 'depth': 8, 'boosting_type': 'Plain', 'bootstrap_type': 'MVS'}. Best is trial 1 with value: 0.8347826086956522.
[32m[I 2023-04-23 19:36:28,030][39m Trial 6 finished with value: 0.8034188034188035 and parameters: {'objective': 'CrossEntropy', 'colsample_bylevel': 0.0839451844711684, 'depth': 2, 'boosting_type': 'Plain', 'bootstrap_type': 'MVS'}. Best is trial 1 with value: 0.8347826086956522.
[32m[I 2023-04-23 19:36:31,914][39m Trial 7 finished with value: 0.7642276422764228 and parameters: {'objective': 'Logloss', 'colsample_bylevel': 0.015738459026295146, 'depth': 3, 'boosting_type': 'Ordered', 'bootstrap_type': 'MVS'}. Best is trial 1 with value: 0.8347826086956522.
[32m[I 2023-04-23 19:36:33,239][39m Trial 8 finished with value: 0.8205128205128205 and parameters: {'objective': 'Logloss', 'colsample_bylevel': 0.07355189110668653, 'depth': 9, 'boosting_type': 'Plain', 'bootstrap_type': 'Bernoulli', 'subsample': 0.8962215347820125}. Best is trial 1 with value: 0.8347826086956522.
[32m[I 2023-04-23 19:36:33,845][39m Trial 9 finished with value: 0.8333333333333334 and parameters: {'objective': 'CrossEntropy', 'colsample_bylevel': 0.09730651045740067, 'depth': 10, 'boosting_type': 'Plain', 'bootstrap_type': 'Bernoulli', 'subsample': 0.9723261835598219}. Best is trial 1 with value: 0.8347826086956522.
[32m[I 2023-04-23 19:36:34,549][39m Trial 10 finished with value: 0.8173913043478261 and parameters: {'objective': 'CrossEntropy', 'colsample_bylevel': 0.05091801130683733, 'depth': 12, 'boosting_type': 'Plain', 'bootstrap_type': 'Bayesian', 'bagging_temperature': 9.707760591827842}. Best is trial 1 with value: 0.8347826086956522.
[32m[I 2023-04-23 19:36:35,348][39m Trial 11 finished with value: 0.8135593220338982 and parameters: {'objective': 'CrossEntropy', 'colsample_bylevel': 0.06432168438569935, 'depth': 7, 'boosting_type': 'Plain', 'bootstrap_type': 'Bernoulli', 'subsample': 0.8596557967542175}. Best is trial 1 with value: 0.8347826086956522.
[32m[I 2023-04-23 19:36:36,031][39m Trial 12 finished with value: 0.8214285714285714 and parameters: {'objective': 'CrossEntropy', 'colsample_bylevel': 0.0988991923455334, 'depth': 11, 'boosting_type': 'Plain', 'bootstrap_type': 'Bernoulli', 'subsample': 0.20201970822125576}. Best is trial 1 with value: 0.8347826086956522.
[32m[I 2023-04-23 19:36:36,855][39m Trial 13 finished with value: 0.8103448275862069 and parameters: {'objective': 'CrossEntropy', 'colsample_bylevel': 0.03820599138733472, 'depth': 7, 'boosting_type': 'Plain', 'bootstrap_type': 'Bernoulli', 'subsample': 0.6740994570919678}. Best is trial 1 with value: 0.8347826086956522.
[32m[I 2023-04-23 19:36:37,940][39m Trial 14 finished with value: 0.8245614035087718 and parameters: {'objective': 'CrossEntropy', 'colsample_bylevel': 0.0628487682931553, 'depth': 9, 'boosting_type': 'Plain', 'bootstrap_type': 'Bernoulli', 'subsample': 0.3002360722154366}. Best is trial 1 with value: 0.8347826086956522.
[32m[I 2023-04-23 19:36:38,967][39m Trial 15 finished with value: 0.8135593220338982 and parameters: {'objective': 'CrossEntropy', 'colsample_bylevel': 0.042667934152358956, 'depth': 6, 'boosting_type': 'Plain', 'bootstrap_type': 'Bernoulli', 'subsample': 0.6960484134978233}. Best is trial 1 with value: 0.8347826086956522.
[32m[I 2023-04-23 19:36:39,570][39m Trial 16 finished with value: 0.8411214953271029 and parameters: {'objective': 'CrossEntropy', 'colsample_bylevel': 0.09991566377152782, 'depth': 12, 'boosting_type': 'Plain', 'bootstrap_type': 'Bayesian', 'bagging_temperature': 7.455903240621659}. Best is trial 16 with value: 0.8411214953271029.
[32m[I 2023-04-23 19:36:40,135][39m Trial 17 finished with value: 0.8318584070796461 and parameters: {'objective': 'CrossEntropy', 'colsample_bylevel': 0.061736140117828055, 'depth': 12, 'boosting_type': 'Plain', 'bootstrap_type': 'Bayesian', 'bagging_temperature': 7.697699066021141}. Best is trial 16 with value: 0.8411214953271029.
[32m[I 2023-04-23 19:36:43,242][39m Trial 18 finished with value: 0.8318584070796461 and parameters: {'objective': 'CrossEntropy', 'colsample_bylevel': 0.07521491269285072, 'depth': 11, 'boosting_type': 'Ordered', 'bootstrap_type': 'Bayesian', 'bagging_temperature': 5.15539020634715}. Best is trial 16 with value: 0.8411214953271029.
[32m[I 2023-04-23 19:36:44,478][39m Trial 19 finished with value: 0.7966101694915255 and parameters: {'objective': 'CrossEntropy', 'colsample_bylevel': 0.03340134044874872, 'depth': 1, 'boosting_type': 'Plain', 'bootstrap_type': 'Bayesian', 'bagging_temperature': 5.774560321857519}. Best is trial 16 with value: 0.8411214953271029.
[32m[I 2023-04-23 19:36:45,574][39m Trial 20 finished with value: 0.8205128205128205 and parameters: {'objective': 'CrossEntropy', 'colsample_bylevel': 0.056445916897723526, 'depth': 8, 'boosting_type': 'Plain', 'bootstrap_type': 'Bayesian', 'bagging_temperature': 0.3703667303968592}. Best is trial 16 with value: 0.8411214953271029.
[32m[I 2023-04-23 19:36:46,289][39m Trial 21 finished with value: 0.8256880733944955 and parameters: {'objective': 'CrossEntropy', 'colsample_bylevel': 0.096644378190242, 'depth': 10, 'boosting_type': 'Plain', 'bootstrap_type': 'Bernoulli', 'subsample': 0.9887033515774948}. Best is trial 16 with value: 0.8411214953271029.
[32m[I 2023-04-23 19:36:47,165][39m Trial 22 finished with value: 0.8214285714285714 and parameters: {'objective': 'CrossEntropy', 'colsample_bylevel': 0.08946087912350353, 'depth': 10, 'boosting_type': 'Plain', 'bootstrap_type': 'Bernoulli', 'subsample': 0.3756434033855547}. Best is trial 16 with value: 0.8411214953271029.
[32m[I 2023-04-23 19:36:47,751][39m Trial 23 finished with value: 0.8288288288288289 and parameters: {'objective': 'CrossEntropy', 'colsample_bylevel': 0.0783194734666376, 'depth': 11, 'boosting_type': 'Plain', 'bootstrap_type': 'Bayesian', 'bagging_temperature': 9.739581674746708}. Best is trial 16 with value: 0.8411214953271029.
[32m[I 2023-04-23 19:36:48,566][39m Trial 24 finished with value: 0.8214285714285714 and parameters: {'objective': 'CrossEntropy', 'colsample_bylevel': 0.09327476125954844, 'depth': 9, 'boosting_type': 'Plain', 'bootstrap_type': 'Bernoulli', 'subsample': 0.6603528185104804}. Best is trial 16 with value: 0.8411214953271029.
[32m[I 2023-04-23 19:36:49,119][39m Trial 25 finished with value: 0.8545454545454546 and parameters: {'objective': 'CrossEntropy', 'colsample_bylevel': 0.07022674005229704, 'depth': 12, 'boosting_type': 'Plain', 'bootstrap_type': 'Bayesian', 'bagging_temperature': 3.060487601348391}. Best is trial 25 with value: 0.8545454545454546.
[32m[I 2023-04-23 19:36:52,890][39m Trial 26 finished with value: 0.8141592920353982 and parameters: {'objective': 'CrossEntropy', 'colsample_bylevel': 0.06994866513160845, 'depth': 12, 'boosting_type': 'Ordered', 'bootstrap_type': 'Bayesian', 'bagging_temperature': 2.903437478803413}. Best is trial 25 with value: 0.8545454545454546.
[32m[I 2023-04-23 19:36:53,662][39m Trial 27 finished with value: 0.8245614035087718 and parameters: {'objective': 'CrossEntropy', 'colsample_bylevel': 0.04688001636466177, 'depth': 6, 'boosting_type': 'Plain', 'bootstrap_type': 'Bayesian', 'bagging_temperature': 3.325622182138299}. Best is trial 25 with value: 0.8545454545454546.
[32m[I 2023-04-23 19:36:54,251][39m Trial 28 finished with value: 0.8518518518518519 and parameters: {'objective': 'CrossEntropy', 'colsample_bylevel': 0.0812956415648983, 'depth': 12, 'boosting_type': 'Plain', 'bootstrap_type': 'Bayesian', 'bagging_temperature': 7.311005037727459}. Best is trial 25 with value: 0.8545454545454546.
[32m[I 2023-04-23 19:36:54,826][39m Trial 29 finished with value: 0.8363636363636364 and parameters: {'objective': 'Logloss', 'colsample_bylevel': 0.08300788844691112, 'depth': 12, 'boosting_type': 'Plain', 'bootstrap_type': 'Bayesian', 'bagging_temperature': 7.228033938216791}. Best is trial 25 with value: 0.8545454545454546.
[32m[I 2023-04-23 19:36:55,386][39m Trial 30 finished with value: 0.8288288288288289 and parameters: {'objective': 'CrossEntropy', 'colsample_bylevel': 0.06903177831547354, 'depth': 11, 'boosting_type': 'Plain', 'bootstrap_type': 'Bayesian', 'bagging_temperature': 7.360996482496413}. Best is trial 25 with value: 0.8545454545454546.
[32m[I 2023-04-23 19:36:55,979][39m Trial 31 finished with value: 0.8518518518518519 and parameters: {'objective': 'Logloss', 'colsample_bylevel': 0.08136172221595668, 'depth': 12, 'boosting_type': 'Plain', 'bootstrap_type': 'Bayesian', 'bagging_temperature': 7.487744783288633}. Best is trial 25 with value: 0.8545454545454546.
[32m[I 2023-04-23 19:36:57,083][39m Trial 32 finished with value: 0.8363636363636364 and parameters: {'objective': 'Logloss', 'colsample_bylevel': 0.07971828228664161, 'depth': 12, 'boosting_type': 'Plain', 'bootstrap_type': 'Bayesian', 'bagging_temperature': 7.885107709960603}. Best is trial 25 with value: 0.8545454545454546.
[32m[I 2023-04-23 19:36:58,293][39m Trial 33 finished with value: 0.8518518518518519 and parameters: {'objective': 'Logloss', 'colsample_bylevel': 0.0903907147857491, 'depth': 11, 'boosting_type': 'Plain', 'bootstrap_type': 'Bayesian', 'bagging_temperature': 6.2916370925128176}. Best is trial 25 with value: 0.8545454545454546.
[32m[I 2023-04-23 19:36:59,353][39m Trial 34 finished with value: 0.8288288288288289 and parameters: {'objective': 'Logloss', 'colsample_bylevel': 0.08920620559980948, 'depth': 11, 'boosting_type': 'Plain', 'bootstrap_type': 'Bayesian', 'bagging_temperature': 6.277977287698498}. Best is trial 25 with value: 0.8545454545454546.
[32m[I 2023-04-23 19:37:02,180][39m Trial 35 finished with value: 0.8245614035087718 and parameters: {'objective': 'Logloss', 'colsample_bylevel': 0.08143701856277197, 'depth': 11, 'boosting_type': 'Ordered', 'bootstrap_type': 'Bayesian', 'bagging_temperature': 3.992057269613925}. Best is trial 25 with value: 0.8545454545454546.
[32m[I 2023-04-23 19:37:03,129][39m Trial 36 finished with value: 0.8518518518518519 and parameters: {'objective': 'Logloss', 'colsample_bylevel': 0.08906022645454803, 'depth': 10, 'boosting_type': 'Plain', 'bootstrap_type': 'Bayesian', 'bagging_temperature': 8.784473593477951}. Best is trial 25 with value: 0.8545454545454546.
[32m[I 2023-04-23 19:37:06,730][39m Trial 37 finished with value: 0.8173913043478261 and parameters: {'objective': 'Logloss', 'colsample_bylevel': 0.08979669664449452, 'depth': 10, 'boosting_type': 'Ordered', 'bootstrap_type': 'MVS'}. Best is trial 25 with value: 0.8545454545454546.
[32m[I 2023-04-23 19:37:07,394][39m Trial 38 finished with value: 0.8518518518518519 and parameters: {'objective': 'Logloss', 'colsample_bylevel': 0.08722475533947134, 'depth': 10, 'boosting_type': 'Plain', 'bootstrap_type': 'Bayesian', 'bagging_temperature': 8.780404005942446}. Best is trial 25 with value: 0.8545454545454546.
[32m[I 2023-04-23 19:37:08,556][39m Trial 39 finished with value: 0.8245614035087718 and parameters: {'objective': 'Logloss', 'colsample_bylevel': 0.07525087752242081, 'depth': 8, 'boosting_type': 'Plain', 'bootstrap_type': 'MVS'}. Best is trial 25 with value: 0.8545454545454546.
[32m[I 2023-04-23 19:37:12,616][39m Trial 40 finished with value: 0.8288288288288289 and parameters: {'objective': 'Logloss', 'colsample_bylevel': 0.09177742372945877, 'depth': 9, 'boosting_type': 'Ordered', 'bootstrap_type': 'Bayesian', 'bagging_temperature': 8.737464519429144}. Best is trial 25 with value: 0.8545454545454546.
[32m[I 2023-04-23 19:37:13,677][39m Trial 41 finished with value: 0.8288288288288289 and parameters: {'objective': 'Logloss', 'colsample_bylevel': 0.08688859935607428, 'depth': 10, 'boosting_type': 'Plain', 'bootstrap_type': 'Bayesian', 'bagging_temperature': 8.869802333993876}. Best is trial 25 with value: 0.8545454545454546.
[32m[I 2023-04-23 19:37:14,670][39m Trial 42 finished with value: 0.8363636363636364 and parameters: {'objective': 'Logloss', 'colsample_bylevel': 0.08582664808096505, 'depth': 11, 'boosting_type': 'Plain', 'bootstrap_type': 'Bayesian', 'bagging_temperature': 8.81265796626133}. Best is trial 25 with value: 0.8545454545454546.
[32m[I 2023-04-23 19:37:15,419][39m Trial 43 finished with value: 0.8518518518518519 and parameters: {'objective': 'Logloss', 'colsample_bylevel': 0.0947306385807235, 'depth': 10, 'boosting_type': 'Plain', 'bootstrap_type': 'Bayesian', 'bagging_temperature': 6.242718331527262}. Best is trial 25 with value: 0.8545454545454546.
[32m[I 2023-04-23 19:37:16,152][39m Trial 44 finished with value: 0.8363636363636364 and parameters: {'objective': 'Logloss', 'colsample_bylevel': 0.0708088819089084, 'depth': 10, 'boosting_type': 'Plain', 'bootstrap_type': 'Bayesian', 'bagging_temperature': 8.329368775185712}. Best is trial 25 with value: 0.8545454545454546.
[32m[I 2023-04-23 19:37:16,972][39m Trial 45 finished with value: 0.8363636363636364 and parameters: {'objective': 'Logloss', 'colsample_bylevel': 0.0781472796414279, 'depth': 12, 'boosting_type': 'Plain', 'bootstrap_type': 'Bayesian', 'bagging_temperature': 5.9846473930190065}. Best is trial 25 with value: 0.8545454545454546.
[32m[I 2023-04-23 19:37:18,894][39m Trial 46 finished with value: 0.8363636363636364 and parameters: {'objective': 'Logloss', 'colsample_bylevel': 0.0967306454119392, 'depth': 9, 'boosting_type': 'Plain', 'bootstrap_type': 'MVS'}. Best is trial 25 with value: 0.8545454545454546.
[32m[I 2023-04-23 19:37:19,886][39m Trial 47 finished with value: 0.8288288288288289 and parameters: {'objective': 'Logloss', 'colsample_bylevel': 0.06622816762438656, 'depth': 12, 'boosting_type': 'Plain', 'bootstrap_type': 'Bayesian', 'bagging_temperature': 6.774256536781529}. Best is trial 25 with value: 0.8545454545454546.
[32m[I 2023-04-23 19:37:20,498][39m Trial 48 finished with value: 0.8288288288288289 and parameters: {'objective': 'Logloss', 'colsample_bylevel': 0.05769993288020593, 'depth': 5, 'boosting_type': 'Plain', 'bootstrap_type': 'Bayesian', 'bagging_temperature': 4.726878716620483}. Best is trial 25 with value: 0.8545454545454546.
[32m[I 2023-04-23 19:37:21,417][39m Trial 49 finished with value: 0.8256880733944955 and parameters: {'objective': 'Logloss', 'colsample_bylevel': 0.09454521169163267, 'depth': 9, 'boosting_type': 'Plain', 'bootstrap_type': 'Bayesian', 'bagging_temperature': 1.9402507903791775}. Best is trial 25 with value: 0.8545454545454546.
[32m[I 2023-04-23 19:37:22,090][39m Trial 50 finished with value: 0.8518518518518519 and parameters: {'objective': 'Logloss', 'colsample_bylevel': 0.08593121462155305, 'depth': 11, 'boosting_type': 'Plain', 'bootstrap_type': 'Bayesian', 'bagging_temperature': 9.283785694384427}. Best is trial 25 with value: 0.8545454545454546.
[32m[I 2023-04-23 19:37:23,053][39m Trial 51 finished with value: 0.8518518518518519 and parameters: {'objective': 'Logloss', 'colsample_bylevel': 0.09318369085741357, 'depth': 10, 'boosting_type': 'Plain', 'bootstrap_type': 'Bayesian', 'bagging_temperature': 5.414358416694943}. Best is trial 25 with value: 0.8545454545454546.
[32m[I 2023-04-23 19:37:24,622][39m Trial 52 finished with value: 0.8518518518518519 and parameters: {'objective': 'Logloss', 'colsample_bylevel': 0.08344138246863263, 'depth': 8, 'boosting_type': 'Plain', 'bootstrap_type': 'Bayesian', 'bagging_temperature': 6.326316835444652}. Best is trial 25 with value: 0.8545454545454546.
[32m[I 2023-04-23 19:37:25,725][39m Trial 53 finished with value: 0.8518518518518519 and parameters: {'objective': 'Logloss', 'colsample_bylevel': 0.08260937624758315, 'depth': 12, 'boosting_type': 'Plain', 'bootstrap_type': 'Bayesian', 'bagging_temperature': 5.000808755946101}. Best is trial 25 with value: 0.8545454545454546.
[32m[I 2023-04-23 19:37:26,310][39m Trial 54 finished with value: 0.8288288288288289 and parameters: {'objective': 'Logloss', 'colsample_bylevel': 0.07369025910111701, 'depth': 12, 'boosting_type': 'Plain', 'bootstrap_type': 'Bayesian', 'bagging_temperature': 4.115673457118726}. Best is trial 25 with value: 0.8545454545454546.
[32m[I 2023-04-23 19:37:26,903][39m Trial 55 finished with value: 0.8318584070796461 and parameters: {'objective': 'Logloss', 'colsample_bylevel': 0.08521837656713097, 'depth': 7, 'boosting_type': 'Plain', 'bootstrap_type': 'MVS'}. Best is trial 25 with value: 0.8545454545454546.
[32m[I 2023-04-23 19:37:27,464][39m Trial 56 finished with value: 0.8545454545454546 and parameters: {'objective': 'Logloss', 'colsample_bylevel': 0.07698452242642187, 'depth': 11, 'boosting_type': 'Plain', 'bootstrap_type': 'Bayesian', 'bagging_temperature': 5.213282918832847}. Best is trial 25 with value: 0.8545454545454546.
[32m[I 2023-04-23 19:37:31,620][39m Trial 57 finished with value: 0.8245614035087718 and parameters: {'objective': 'Logloss', 'colsample_bylevel': 0.07734884734366454, 'depth': 8, 'boosting_type': 'Ordered', 'bootstrap_type': 'Bayesian', 'bagging_temperature': 5.358439062623913}. Best is trial 25 with value: 0.8545454545454546.
[32m[I 2023-04-23 19:37:33,136][39m Trial 58 finished with value: 0.8518518518518519 and parameters: {'objective': 'Logloss', 'colsample_bylevel': 0.09969803180464057, 'depth': 11, 'boosting_type': 'Plain', 'bootstrap_type': 'Bayesian', 'bagging_temperature': 4.423121637002713}. Best is trial 25 with value: 0.8545454545454546.
[32m[I 2023-04-23 19:37:34,125][39m Trial 59 finished with value: 0.8318584070796461 and parameters: {'objective': 'Logloss', 'colsample_bylevel': 0.06082448766991723, 'depth': 11, 'boosting_type': 'Plain', 'bootstrap_type': 'Bayesian', 'bagging_temperature': 7.992933018728566}. Best is trial 25 with value: 0.8545454545454546.
[32m[I 2023-04-23 19:37:35,271][39m Trial 60 finished with value: 0.8214285714285714 and parameters: {'objective': 'Logloss', 'colsample_bylevel': 0.06544300238297976, 'depth': 4, 'boosting_type': 'Plain', 'bootstrap_type': 'Bayesian', 'bagging_temperature': 4.563793820066795}. Best is trial 25 with value: 0.8545454545454546.
[32m[I 2023-04-23 19:37:36,056][39m Trial 61 finished with value: 0.8518518518518519 and parameters: {'objective': 'Logloss', 'colsample_bylevel': 0.0942842101658041, 'depth': 11, 'boosting_type': 'Plain', 'bootstrap_type': 'Bayesian', 'bagging_temperature': 5.795927091712974}. Best is trial 25 with value: 0.8545454545454546.
[32m[I 2023-04-23 19:37:36,612][39m Trial 62 finished with value: 0.8623853211009174 and parameters: {'objective': 'CrossEntropy', 'colsample_bylevel': 0.09765789778804573, 'depth': 11, 'boosting_type': 'Plain', 'bootstrap_type': 'Bayesian', 'bagging_temperature': 6.750583454171544}. Best is trial 62 with value: 0.8623853211009174.
[32m[I 2023-04-23 19:37:37,389][39m Trial 63 finished with value: 0.8518518518518519 and parameters: {'objective': 'CrossEntropy', 'colsample_bylevel': 0.09979281928453615, 'depth': 11, 'boosting_type': 'Plain', 'bootstrap_type': 'Bayesian', 'bagging_temperature': 5.163684138734364}. Best is trial 62 with value: 0.8623853211009174.
[32m[I 2023-04-23 19:37:38,699][39m Trial 64 finished with value: 0.7833333333333332 and parameters: {'objective': 'CrossEntropy', 'colsample_bylevel': 0.019108082869293136, 'depth': 12, 'boosting_type': 'Plain', 'bootstrap_type': 'Bayesian', 'bagging_temperature': 3.1613403824823996}. Best is trial 62 with value: 0.8623853211009174.
[32m[I 2023-04-23 19:37:40,085][39m Trial 65 finished with value: 0.8518518518518519 and parameters: {'objective': 'CrossEntropy', 'colsample_bylevel': 0.08177382310263158, 'depth': 12, 'boosting_type': 'Plain', 'bootstrap_type': 'Bayesian', 'bagging_temperature': 6.823182465976264}. Best is trial 62 with value: 0.8623853211009174.
[32m[I 2023-04-23 19:37:40,663][39m Trial 66 finished with value: 0.8518518518518519 and parameters: {'objective': 'Logloss', 'colsample_bylevel': 0.08757555166376278, 'depth': 10, 'boosting_type': 'Plain', 'bootstrap_type': 'Bayesian', 'bagging_temperature': 6.952392104561675}. Best is trial 62 with value: 0.8623853211009174.
