[32m[I 2023-04-26 13:01:06,031][39m A new study created in memory with name: no-name-ef779f35-aa5f-4ca8-8cd5-80751089e0e7
[32m[I 2023-04-26 13:01:07,270][39m Trial 0 finished with value: 0.7446808510638298 and parameters: {'objective': 'Logloss', 'colsample_bylevel': 0.05537170284445229, 'depth': 4, 'boosting_type': 'Plain', 'bootstrap_type': 'Bayesian', 'bagging_temperature': 0.9470033847076509}. Best is trial 0 with value: 0.7446808510638298.
[32m[I 2023-04-26 13:01:08,449][39m Trial 1 finished with value: 0.7070707070707071 and parameters: {'objective': 'Logloss', 'colsample_bylevel': 0.08287785904964994, 'depth': 1, 'boosting_type': 'Plain', 'bootstrap_type': 'Bayesian', 'bagging_temperature': 0.1648923281483139}. Best is trial 0 with value: 0.7446808510638298.
[32m[I 2023-04-26 13:01:11,273][39m Trial 2 finished with value: 0.7254901960784315 and parameters: {'objective': 'CrossEntropy', 'colsample_bylevel': 0.08269466197636927, 'depth': 1, 'boosting_type': 'Ordered', 'bootstrap_type': 'Bernoulli', 'subsample': 0.17169620191127966}. Best is trial 0 with value: 0.7446808510638298.
[32m[I 2023-04-26 13:01:12,326][39m Trial 3 finished with value: 0.7017543859649124 and parameters: {'objective': 'Logloss', 'colsample_bylevel': 0.0184178714326609, 'depth': 4, 'boosting_type': 'Plain', 'bootstrap_type': 'Bernoulli', 'subsample': 0.8553434557802794}. Best is trial 0 with value: 0.7446808510638298.
[32m[I 2023-04-26 13:01:14,890][39m Trial 4 finished with value: 0.7027027027027027 and parameters: {'objective': 'CrossEntropy', 'colsample_bylevel': 0.012552160303947929, 'depth': 12, 'boosting_type': 'Ordered', 'bootstrap_type': 'Bernoulli', 'subsample': 0.14346681349647328}. Best is trial 0 with value: 0.7446808510638298.
[32m[I 2023-04-26 13:01:18,167][39m Trial 5 finished with value: 0.7446808510638298 and parameters: {'objective': 'CrossEntropy', 'colsample_bylevel': 0.08167775584768014, 'depth': 9, 'boosting_type': 'Ordered', 'bootstrap_type': 'MVS'}. Best is trial 0 with value: 0.7446808510638298.
[32m[I 2023-04-26 13:01:19,249][39m Trial 6 finished with value: 0.6956521739130435 and parameters: {'objective': 'CrossEntropy', 'colsample_bylevel': 0.01403437403797832, 'depth': 8, 'boosting_type': 'Plain', 'bootstrap_type': 'Bernoulli', 'subsample': 0.23709221333455796}. Best is trial 0 with value: 0.7446808510638298.
[32m[I 2023-04-26 13:01:22,119][39m Trial 7 finished with value: 0.7446808510638298 and parameters: {'objective': 'CrossEntropy', 'colsample_bylevel': 0.048247567859259745, 'depth': 10, 'boosting_type': 'Ordered', 'bootstrap_type': 'MVS'}. Best is trial 0 with value: 0.7446808510638298.
[32m[I 2023-04-26 13:01:25,420][39m Trial 8 finished with value: 0.7216494845360826 and parameters: {'objective': 'Logloss', 'colsample_bylevel': 0.07235987564698221, 'depth': 9, 'boosting_type': 'Ordered', 'bootstrap_type': 'Bayesian', 'bagging_temperature': 1.792380208947859}. Best is trial 0 with value: 0.7446808510638298.
[32m[I 2023-04-26 13:01:30,042][39m Trial 9 finished with value: 0.7346938775510203 and parameters: {'objective': 'CrossEntropy', 'colsample_bylevel': 0.08953378642037818, 'depth': 5, 'boosting_type': 'Ordered', 'bootstrap_type': 'MVS'}. Best is trial 0 with value: 0.7446808510638298.
[32m[I 2023-04-26 13:01:31,292][39m Trial 10 finished with value: 0.7200000000000001 and parameters: {'objective': 'Logloss', 'colsample_bylevel': 0.04721172373837981, 'depth': 4, 'boosting_type': 'Plain', 'bootstrap_type': 'Bayesian', 'bagging_temperature': 8.026082956020272}. Best is trial 0 with value: 0.7446808510638298.
[32m[I 2023-04-26 13:01:32,848][39m Trial 11 finished with value: 0.7291666666666666 and parameters: {'objective': 'Logloss', 'colsample_bylevel': 0.06454821880713188, 'depth': 7, 'boosting_type': 'Plain', 'bootstrap_type': 'MVS'}. Best is trial 0 with value: 0.7446808510638298.
[32m[I 2023-04-26 13:01:36,179][39m Trial 12 finished with value: 0.7115384615384616 and parameters: {'objective': 'Logloss', 'colsample_bylevel': 0.03557291463337681, 'depth': 6, 'boosting_type': 'Ordered', 'bootstrap_type': 'Bayesian', 'bagging_temperature': 3.9992530961183608}. Best is trial 0 with value: 0.7446808510638298.
[32m[I 2023-04-26 13:01:37,587][39m Trial 13 finished with value: 0.717391304347826 and parameters: {'objective': 'CrossEntropy', 'colsample_bylevel': 0.06409663508117502, 'depth': 11, 'boosting_type': 'Plain', 'bootstrap_type': 'MVS'}. Best is trial 0 with value: 0.7446808510638298.
[32m[I 2023-04-26 13:01:39,215][39m Trial 14 finished with value: 0.7096774193548387 and parameters: {'objective': 'Logloss', 'colsample_bylevel': 0.09726396709394726, 'depth': 3, 'boosting_type': 'Plain', 'bootstrap_type': 'MVS'}. Best is trial 0 with value: 0.7446808510638298.
[32m[I 2023-04-26 13:01:42,413][39m Trial 15 finished with value: 0.6909090909090908 and parameters: {'objective': 'CrossEntropy', 'colsample_bylevel': 0.030998179574957433, 'depth': 8, 'boosting_type': 'Ordered', 'bootstrap_type': 'Bayesian', 'bagging_temperature': 5.8345089162221635}. Best is trial 0 with value: 0.7446808510638298.
[32m[I 2023-04-26 13:01:46,533][39m Trial 16 finished with value: 0.6999999999999998 and parameters: {'objective': 'CrossEntropy', 'colsample_bylevel': 0.0591088740884021, 'depth': 6, 'boosting_type': 'Ordered', 'bootstrap_type': 'Bayesian', 'bagging_temperature': 3.190677791856799}. Best is trial 0 with value: 0.7446808510638298.
[32m[I 2023-04-26 13:01:47,957][39m Trial 17 finished with value: 0.7096774193548387 and parameters: {'objective': 'Logloss', 'colsample_bylevel': 0.048776506949003186, 'depth': 10, 'boosting_type': 'Plain', 'bootstrap_type': 'MVS'}. Best is trial 0 with value: 0.7446808510638298.
[32m[I 2023-04-26 13:01:51,200][39m Trial 18 finished with value: 0.7070707070707071 and parameters: {'objective': 'Logloss', 'colsample_bylevel': 0.038090964396190176, 'depth': 3, 'boosting_type': 'Ordered', 'bootstrap_type': 'MVS'}. Best is trial 0 with value: 0.7446808510638298.
[32m[I 2023-04-26 13:01:52,641][39m Trial 19 finished with value: 0.7659574468085106 and parameters: {'objective': 'CrossEntropy', 'colsample_bylevel': 0.049098085116100594, 'depth': 12, 'boosting_type': 'Plain', 'bootstrap_type': 'Bayesian', 'bagging_temperature': 9.067883009750677}. Best is trial 19 with value: 0.7659574468085106.
[32m[I 2023-04-26 13:01:56,134][39m Trial 20 finished with value: 0.7216494845360826 and parameters: {'objective': 'CrossEntropy', 'colsample_bylevel': 0.04475511266961641, 'depth': 12, 'boosting_type': 'Ordered', 'bootstrap_type': 'MVS'}. Best is trial 19 with value: 0.7659574468085106.
[32m[I 2023-04-26 13:01:57,712][39m Trial 21 finished with value: 0.7311827956989247 and parameters: {'objective': 'CrossEntropy', 'colsample_bylevel': 0.0715788160175216, 'depth': 10, 'boosting_type': 'Plain', 'bootstrap_type': 'Bayesian', 'bagging_temperature': 9.035989050888363}. Best is trial 19 with value: 0.7659574468085106.
[32m[I 2023-04-26 13:01:59,097][39m Trial 22 finished with value: 0.7499999999999999 and parameters: {'objective': 'CrossEntropy', 'colsample_bylevel': 0.05448660402445102, 'depth': 11, 'boosting_type': 'Plain', 'bootstrap_type': 'Bayesian', 'bagging_temperature': 6.65541365317757}. Best is trial 19 with value: 0.7659574468085106.
[32m[I 2023-04-26 13:02:00,389][39m Trial 23 finished with value: 0.7422680412371134 and parameters: {'objective': 'CrossEntropy', 'colsample_bylevel': 0.028611356100467337, 'depth': 11, 'boosting_type': 'Plain', 'bootstrap_type': 'Bayesian', 'bagging_temperature': 6.802582928667594}. Best is trial 19 with value: 0.7659574468085106.
[32m[I 2023-04-26 13:02:01,842][39m Trial 24 finished with value: 0.7422680412371134 and parameters: {'objective': 'CrossEntropy', 'colsample_bylevel': 0.05648959311680021, 'depth': 12, 'boosting_type': 'Plain', 'bootstrap_type': 'Bayesian', 'bagging_temperature': 9.91792288750364}. Best is trial 19 with value: 0.7659574468085106.
[32m[I 2023-04-26 13:02:03,208][39m Trial 25 finished with value: 0.7526881720430108 and parameters: {'objective': 'CrossEntropy', 'colsample_bylevel': 0.05472566175758101, 'depth': 11, 'boosting_type': 'Plain', 'bootstrap_type': 'Bayesian', 'bagging_temperature': 7.520858150652814}. Best is trial 19 with value: 0.7659574468085106.
[32m[I 2023-04-26 13:02:04,461][39m Trial 26 finished with value: 0.7252747252747254 and parameters: {'objective': 'CrossEntropy', 'colsample_bylevel': 0.03926771514783822, 'depth': 11, 'boosting_type': 'Plain', 'bootstrap_type': 'Bayesian', 'bagging_temperature': 7.344101031529519}. Best is trial 19 with value: 0.7659574468085106.
[32m[I 2023-04-26 13:02:06,102][39m Trial 27 finished with value: 0.7526881720430108 and parameters: {'objective': 'CrossEntropy', 'colsample_bylevel': 0.06773819767167419, 'depth': 9, 'boosting_type': 'Plain', 'bootstrap_type': 'Bayesian', 'bagging_temperature': 6.045849575731239}. Best is trial 19 with value: 0.7659574468085106.
[32m[I 2023-04-26 13:02:07,695][39m Trial 28 finished with value: 0.7789473684210526 and parameters: {'objective': 'CrossEntropy', 'colsample_bylevel': 0.07024865792267324, 'depth': 9, 'boosting_type': 'Plain', 'bootstrap_type': 'Bayesian', 'bagging_temperature': 8.446455057283016}. Best is trial 28 with value: 0.7789473684210526.
[32m[I 2023-04-26 13:02:09,375][39m Trial 29 finished with value: 0.7368421052631579 and parameters: {'objective': 'CrossEntropy', 'colsample_bylevel': 0.07624292942047689, 'depth': 8, 'boosting_type': 'Plain', 'bootstrap_type': 'Bayesian', 'bagging_temperature': 8.50441277434352}. Best is trial 28 with value: 0.7789473684210526.
[32m[I 2023-04-26 13:02:11,059][39m Trial 30 finished with value: 0.7526881720430108 and parameters: {'objective': 'CrossEntropy', 'colsample_bylevel': 0.06536250886933559, 'depth': 9, 'boosting_type': 'Plain', 'bootstrap_type': 'Bayesian', 'bagging_temperature': 5.179168425565148}. Best is trial 28 with value: 0.7789473684210526.
[32m[I 2023-04-26 13:02:12,679][39m Trial 31 finished with value: 0.7252747252747254 and parameters: {'objective': 'CrossEntropy', 'colsample_bylevel': 0.06510092042465083, 'depth': 9, 'boosting_type': 'Plain', 'bootstrap_type': 'Bayesian', 'bagging_temperature': 5.008702961323948}. Best is trial 28 with value: 0.7789473684210526.
[32m[I 2023-04-26 13:02:14,121][39m Trial 32 finished with value: 0.7526881720430108 and parameters: {'objective': 'CrossEntropy', 'colsample_bylevel': 0.06631212215880422, 'depth': 7, 'boosting_type': 'Plain', 'bootstrap_type': 'Bayesian', 'bagging_temperature': 5.214322823154328}. Best is trial 28 with value: 0.7789473684210526.
[32m[I 2023-04-26 13:02:15,650][39m Trial 33 finished with value: 0.7311827956989247 and parameters: {'objective': 'CrossEntropy', 'colsample_bylevel': 0.0779727290164814, 'depth': 7, 'boosting_type': 'Plain', 'bootstrap_type': 'Bayesian', 'bagging_temperature': 4.333492240280865}. Best is trial 28 with value: 0.7789473684210526.
[32m[I 2023-04-26 13:02:17,600][39m Trial 34 finished with value: 0.7391304347826086 and parameters: {'objective': 'CrossEntropy', 'colsample_bylevel': 0.089865478624326, 'depth': 9, 'boosting_type': 'Plain', 'bootstrap_type': 'Bayesian', 'bagging_temperature': 9.502748978689851}. Best is trial 28 with value: 0.7789473684210526.
[32m[I 2023-04-26 13:02:19,111][39m Trial 35 finished with value: 0.7096774193548387 and parameters: {'objective': 'CrossEntropy', 'colsample_bylevel': 0.07094262430084688, 'depth': 7, 'boosting_type': 'Plain', 'bootstrap_type': 'Bernoulli', 'subsample': 0.953586513336782}. Best is trial 28 with value: 0.7789473684210526.
[32m[I 2023-04-26 13:02:20,431][39m Trial 36 finished with value: 0.7659574468085106 and parameters: {'objective': 'CrossEntropy', 'colsample_bylevel': 0.05317606998261283, 'depth': 12, 'boosting_type': 'Plain', 'bootstrap_type': 'Bayesian', 'bagging_temperature': 8.045678433237837}. Best is trial 28 with value: 0.7789473684210526.
[32m[I 2023-04-26 13:02:21,810][39m Trial 37 finished with value: 0.7096774193548387 and parameters: {'objective': 'CrossEntropy', 'colsample_bylevel': 0.0598516231011359, 'depth': 12, 'boosting_type': 'Plain', 'bootstrap_type': 'Bernoulli', 'subsample': 0.5692328044028105}. Best is trial 28 with value: 0.7789473684210526.
[32m[I 2023-04-26 13:02:23,171][39m Trial 38 finished with value: 0.7499999999999999 and parameters: {'objective': 'CrossEntropy', 'colsample_bylevel': 0.05201843312996135, 'depth': 10, 'boosting_type': 'Plain', 'bootstrap_type': 'Bayesian', 'bagging_temperature': 8.620851602035902}. Best is trial 28 with value: 0.7789473684210526.
[32m[I 2023-04-26 13:02:24,451][39m Trial 39 finished with value: 0.7526881720430108 and parameters: {'objective': 'CrossEntropy', 'colsample_bylevel': 0.041983509448690004, 'depth': 5, 'boosting_type': 'Plain', 'bootstrap_type': 'Bayesian', 'bagging_temperature': 8.26410223632036}. Best is trial 28 with value: 0.7789473684210526.
[32m[I 2023-04-26 13:02:25,990][39m Trial 40 finished with value: 0.7446808510638298 and parameters: {'objective': 'CrossEntropy', 'colsample_bylevel': 0.06031659198190372, 'depth': 8, 'boosting_type': 'Plain', 'bootstrap_type': 'Bernoulli', 'subsample': 0.5299495369611572}. Best is trial 28 with value: 0.7789473684210526.
[32m[I 2023-04-26 13:02:27,501][39m Trial 41 finished with value: 0.7252747252747254 and parameters: {'objective': 'CrossEntropy', 'colsample_bylevel': 0.07663639313966096, 'depth': 10, 'boosting_type': 'Plain', 'bootstrap_type': 'Bayesian', 'bagging_temperature': 5.386738855197643}. Best is trial 28 with value: 0.7789473684210526.
[32m[I 2023-04-26 13:02:28,790][39m Trial 42 finished with value: 0.7499999999999999 and parameters: {'objective': 'CrossEntropy', 'colsample_bylevel': 0.04254017184252698, 'depth': 11, 'boosting_type': 'Plain', 'bootstrap_type': 'Bayesian', 'bagging_temperature': 7.711408848766065}. Best is trial 28 with value: 0.7789473684210526.
[32m[I 2023-04-26 13:02:30,026][39m Trial 43 finished with value: 0.7090909090909091 and parameters: {'objective': 'CrossEntropy', 'colsample_bylevel': 0.023968609998854605, 'depth': 5, 'boosting_type': 'Plain', 'bootstrap_type': 'Bayesian', 'bagging_temperature': 9.078397626725318}. Best is trial 28 with value: 0.7789473684210526.
[32m[I 2023-04-26 13:02:31,441][39m Trial 44 finished with value: 0.7499999999999999 and parameters: {'objective': 'CrossEntropy', 'colsample_bylevel': 0.049361034233120334, 'depth': 5, 'boosting_type': 'Plain', 'bootstrap_type': 'Bayesian', 'bagging_temperature': 8.465590977834495}. Best is trial 28 with value: 0.7789473684210526.
[32m[I 2023-04-26 13:02:32,747][39m Trial 45 finished with value: 0.7346938775510203 and parameters: {'objective': 'CrossEntropy', 'colsample_bylevel': 0.04203304358852137, 'depth': 6, 'boosting_type': 'Plain', 'bootstrap_type': 'Bayesian', 'bagging_temperature': 6.876491390319481}. Best is trial 28 with value: 0.7789473684210526.
[32m[I 2023-04-26 13:02:34,138][39m Trial 46 finished with value: 0.7446808510638298 and parameters: {'objective': 'CrossEntropy', 'colsample_bylevel': 0.06146402830885449, 'depth': 4, 'boosting_type': 'Plain', 'bootstrap_type': 'Bayesian', 'bagging_temperature': 9.231532599061504}. Best is trial 28 with value: 0.7789473684210526.
[32m[I 2023-04-26 13:02:35,371][39m Trial 47 finished with value: 0.6990291262135923 and parameters: {'objective': 'CrossEntropy', 'colsample_bylevel': 0.03502504579383065, 'depth': 2, 'boosting_type': 'Plain', 'bootstrap_type': 'Bayesian', 'bagging_temperature': 8.172282694079028}. Best is trial 28 with value: 0.7789473684210526.
[32m[I 2023-04-26 13:02:37,056][39m Trial 48 finished with value: 0.717391304347826 and parameters: {'objective': 'Logloss', 'colsample_bylevel': 0.08558006923074082, 'depth': 12, 'boosting_type': 'Plain', 'bootstrap_type': 'Bernoulli', 'subsample': 0.671265705217633}. Best is trial 28 with value: 0.7789473684210526.
[32m[I 2023-04-26 13:02:38,407][39m Trial 49 finished with value: 0.7578947368421053 and parameters: {'objective': 'CrossEntropy', 'colsample_bylevel': 0.05392871253851845, 'depth': 11, 'boosting_type': 'Plain', 'bootstrap_type': 'Bayesian', 'bagging_temperature': 6.234264938827932}. Best is trial 28 with value: 0.7789473684210526.
[32m[I 2023-04-26 13:02:39,776][39m Trial 50 finished with value: 0.7422680412371134 and parameters: {'objective': 'CrossEntropy', 'colsample_bylevel': 0.051349687731390585, 'depth': 12, 'boosting_type': 'Plain', 'bootstrap_type': 'Bayesian', 'bagging_temperature': 9.913679046365832}. Best is trial 28 with value: 0.7789473684210526.
[32m[I 2023-04-26 13:02:41,108][39m Trial 51 finished with value: 0.7499999999999999 and parameters: {'objective': 'CrossEntropy', 'colsample_bylevel': 0.0549548376213742, 'depth': 11, 'boosting_type': 'Plain', 'bootstrap_type': 'Bayesian', 'bagging_temperature': 7.389821467205225}. Best is trial 28 with value: 0.7789473684210526.
[32m[I 2023-04-26 13:02:42,425][39m Trial 52 finished with value: 0.7499999999999999 and parameters: {'objective': 'CrossEntropy', 'colsample_bylevel': 0.045748611563669564, 'depth': 12, 'boosting_type': 'Plain', 'bootstrap_type': 'Bayesian', 'bagging_temperature': 7.732557678839187}. Best is trial 28 with value: 0.7789473684210526.
[32m[I 2023-04-26 13:02:43,835][39m Trial 53 finished with value: 0.7578947368421053 and parameters: {'objective': 'CrossEntropy', 'colsample_bylevel': 0.05748481618051858, 'depth': 6, 'boosting_type': 'Plain', 'bootstrap_type': 'Bayesian', 'bagging_temperature': 6.377480134083778}. Best is trial 28 with value: 0.7789473684210526.
[32m[I 2023-04-26 13:02:45,284][39m Trial 54 finished with value: 0.7291666666666666 and parameters: {'objective': 'CrossEntropy', 'colsample_bylevel': 0.057549562066114154, 'depth': 5, 'boosting_type': 'Plain', 'bootstrap_type': 'Bayesian', 'bagging_temperature': 6.19175556173458}. Best is trial 28 with value: 0.7789473684210526.
[32m[I 2023-04-26 13:02:48,800][39m Trial 55 finished with value: 0.6981132075471698 and parameters: {'objective': 'Logloss', 'colsample_bylevel': 0.051823521618695606, 'depth': 11, 'boosting_type': 'Ordered', 'bootstrap_type': 'Bayesian', 'bagging_temperature': 7.081004847305606}. Best is trial 28 with value: 0.7789473684210526.
[32m[I 2023-04-26 13:02:50,254][39m Trial 56 finished with value: 0.7446808510638298 and parameters: {'objective': 'CrossEntropy', 'colsample_bylevel': 0.055863258132595156, 'depth': 10, 'boosting_type': 'Plain', 'bootstrap_type': 'Bayesian', 'bagging_temperature': 6.382907799671577}. Best is trial 28 with value: 0.7789473684210526.
[32m[I 2023-04-26 13:02:51,597][39m Trial 57 finished with value: 0.7200000000000001 and parameters: {'objective': 'CrossEntropy', 'colsample_bylevel': 0.04355241882282484, 'depth': 6, 'boosting_type': 'Plain', 'bootstrap_type': 'Bayesian', 'bagging_temperature': 8.078010768262363}. Best is trial 28 with value: 0.7789473684210526.
[32m[I 2023-04-26 13:02:55,358][39m Trial 58 finished with value: 0.7499999999999999 and parameters: {'objective': 'CrossEntropy', 'colsample_bylevel': 0.0707732373914423, 'depth': 8, 'boosting_type': 'Ordered', 'bootstrap_type': 'MVS'}. Best is trial 28 with value: 0.7789473684210526.
[32m[I 2023-04-26 13:02:56,795][39m Trial 59 finished with value: 0.7368421052631579 and parameters: {'objective': 'Logloss', 'colsample_bylevel': 0.04795387262779897, 'depth': 12, 'boosting_type': 'Plain', 'bootstrap_type': 'Bayesian', 'bagging_temperature': 0.9816222299803989}. Best is trial 28 with value: 0.7789473684210526.
[32m[I 2023-04-26 13:02:58,111][39m Trial 60 finished with value: 0.7526881720430108 and parameters: {'objective': 'CrossEntropy', 'colsample_bylevel': 0.03912815727561744, 'depth': 5, 'boosting_type': 'Plain', 'bootstrap_type': 'Bayesian', 'bagging_temperature': 8.783307662959626}. Best is trial 28 with value: 0.7789473684210526.
[32m[I 2023-04-26 13:02:59,612][39m Trial 61 finished with value: 0.7526881720430108 and parameters: {'objective': 'CrossEntropy', 'colsample_bylevel': 0.06305134339494875, 'depth': 6, 'boosting_type': 'Plain', 'bootstrap_type': 'Bayesian', 'bagging_temperature': 5.622934571496343}. Best is trial 28 with value: 0.7789473684210526.
[32m[I 2023-04-26 13:03:01,162][39m Trial 62 finished with value: 0.7311827956989247 and parameters: {'objective': 'CrossEntropy', 'colsample_bylevel': 0.06959876755409529, 'depth': 10, 'boosting_type': 'Plain', 'bootstrap_type': 'Bayesian', 'bagging_temperature': 4.028810935241182}. Best is trial 28 with value: 0.7789473684210526.
[32m[I 2023-04-26 13:03:02,642][39m Trial 63 finished with value: 0.7526881720430108 and parameters: {'objective': 'CrossEntropy', 'colsample_bylevel': 0.07350192643850578, 'depth': 3, 'boosting_type': 'Plain', 'bootstrap_type': 'Bayesian', 'bagging_temperature': 4.733878904138605}. Best is trial 28 with value: 0.7789473684210526.
[32m[I 2023-04-26 13:03:03,965][39m Trial 64 finished with value: 0.6915887850467289 and parameters: {'objective': 'CrossEntropy', 'colsample_bylevel': 0.06255522280485426, 'depth': 1, 'boosting_type': 'Plain', 'bootstrap_type': 'Bayesian', 'bagging_temperature': 4.590895529912618}. Best is trial 28 with value: 0.7789473684210526.
[32m[I 2023-04-26 13:03:05,453][39m Trial 65 finished with value: 0.7526881720430108 and parameters: {'objective': 'CrossEntropy', 'colsample_bylevel': 0.06708307750683698, 'depth': 7, 'boosting_type': 'Plain', 'bootstrap_type': 'Bayesian', 'bagging_temperature': 5.890252851067993}. Best is trial 28 with value: 0.7789473684210526.
[32m[I 2023-04-26 13:03:07,069][39m Trial 66 finished with value: 0.7526881720430108 and parameters: {'objective': 'CrossEntropy', 'colsample_bylevel': 0.0796826414153207, 'depth': 3, 'boosting_type': 'Plain', 'bootstrap_type': 'Bayesian', 'bagging_temperature': 3.1064714768700714}. Best is trial 28 with value: 0.7789473684210526.
