[32m[I 2023-04-26 13:04:54,290][39m Trial 133 finished with value: 0.7578947368421053 and parameters: {'objective': 'CrossEntropy', 'colsample_bylevel': 0.05635875784538629, 'depth': 11, 'boosting_type': 'Plain', 'bootstrap_type': 'Bayesian', 'bagging_temperature': 6.008292580527643}. Best is trial 28 with value: 0.7789473684210526.
[32m[I 2023-04-26 13:04:55,701][39m Trial 134 finished with value: 0.7272727272727273 and parameters: {'objective': 'CrossEntropy', 'colsample_bylevel': 0.05648060562998057, 'depth': 11, 'boosting_type': 'Plain', 'bootstrap_type': 'Bayesian', 'bagging_temperature': 8.057670175631428}. Best is trial 28 with value: 0.7789473684210526.
[32m[I 2023-04-26 13:04:57,117][39m Trial 135 finished with value: 0.7659574468085106 and parameters: {'objective': 'CrossEntropy', 'colsample_bylevel': 0.05976142322929685, 'depth': 12, 'boosting_type': 'Plain', 'bootstrap_type': 'Bayesian', 'bagging_temperature': 8.31947518533173}. Best is trial 28 with value: 0.7789473684210526.
[32m[I 2023-04-26 13:04:58,573][39m Trial 136 finished with value: 0.7499999999999999 and parameters: {'objective': 'CrossEntropy', 'colsample_bylevel': 0.06377463605169004, 'depth': 12, 'boosting_type': 'Plain', 'bootstrap_type': 'Bayesian', 'bagging_temperature': 8.653328461048343}. Best is trial 28 with value: 0.7789473684210526.
[32m[I 2023-04-26 13:05:00,027][39m Trial 137 finished with value: 0.7499999999999999 and parameters: {'objective': 'CrossEntropy', 'colsample_bylevel': 0.06047197282079919, 'depth': 12, 'boosting_type': 'Plain', 'bootstrap_type': 'Bayesian', 'bagging_temperature': 8.273508543476082}. Best is trial 28 with value: 0.7789473684210526.
[32m[I 2023-04-26 13:05:01,937][39m Trial 138 finished with value: 0.6796116504854369 and parameters: {'objective': 'CrossEntropy', 'colsample_bylevel': 0.01012356458195255, 'depth': 12, 'boosting_type': 'Ordered', 'bootstrap_type': 'Bayesian', 'bagging_temperature': 8.947358789965545}. Best is trial 28 with value: 0.7789473684210526.
[32m[I 2023-04-26 13:05:03,466][39m Trial 139 finished with value: 0.7578947368421053 and parameters: {'objective': 'Logloss', 'colsample_bylevel': 0.05912960200589472, 'depth': 10, 'boosting_type': 'Plain', 'bootstrap_type': 'Bayesian', 'bagging_temperature': 8.35121442312686}. Best is trial 28 with value: 0.7789473684210526.
[32m[I 2023-04-26 13:05:04,928][39m Trial 140 finished with value: 0.7311827956989247 and parameters: {'objective': 'Logloss', 'colsample_bylevel': 0.05958654923131608, 'depth': 10, 'boosting_type': 'Plain', 'bootstrap_type': 'Bayesian', 'bagging_temperature': 8.595627928458097}. Best is trial 28 with value: 0.7789473684210526.
[32m[I 2023-04-26 13:05:06,389][39m Trial 141 finished with value: 0.7422680412371134 and parameters: {'objective': 'Logloss', 'colsample_bylevel': 0.055685242008732226, 'depth': 10, 'boosting_type': 'Plain', 'bootstrap_type': 'Bayesian', 'bagging_temperature': 8.284570806224437}. Best is trial 28 with value: 0.7789473684210526.
[32m[I 2023-04-26 13:05:07,787][39m Trial 142 finished with value: 0.7578947368421053 and parameters: {'objective': 'CrossEntropy', 'colsample_bylevel': 0.05018658655190207, 'depth': 12, 'boosting_type': 'Plain', 'bootstrap_type': 'Bayesian', 'bagging_temperature': 6.46835138082421}. Best is trial 28 with value: 0.7789473684210526.
[32m[I 2023-04-26 13:05:09,226][39m Trial 143 finished with value: 0.7216494845360826 and parameters: {'objective': 'Logloss', 'colsample_bylevel': 0.05361650665614554, 'depth': 11, 'boosting_type': 'Plain', 'bootstrap_type': 'Bayesian', 'bagging_temperature': 7.74193514593331}. Best is trial 28 with value: 0.7789473684210526.
[32m[I 2023-04-26 13:05:10,724][39m Trial 144 finished with value: 0.7526881720430108 and parameters: {'objective': 'Logloss', 'colsample_bylevel': 0.061692311601512846, 'depth': 11, 'boosting_type': 'Plain', 'bootstrap_type': 'Bayesian', 'bagging_temperature': 6.9270495682014985}. Best is trial 28 with value: 0.7789473684210526.
[32m[I 2023-04-26 13:05:12,203][39m Trial 145 finished with value: 0.7422680412371134 and parameters: {'objective': 'Logloss', 'colsample_bylevel': 0.0578692160169272, 'depth': 10, 'boosting_type': 'Plain', 'bootstrap_type': 'Bayesian', 'bagging_temperature': 9.18346294902152}. Best is trial 28 with value: 0.7789473684210526.
[32m[I 2023-04-26 13:05:13,896][39m Trial 146 finished with value: 0.7391304347826086 and parameters: {'objective': 'CrossEntropy', 'colsample_bylevel': 0.08063916483708898, 'depth': 12, 'boosting_type': 'Plain', 'bootstrap_type': 'Bayesian', 'bagging_temperature': 5.966555857389999}. Best is trial 28 with value: 0.7789473684210526.
[32m[I 2023-04-26 13:05:15,569][39m Trial 147 finished with value: 0.7499999999999999 and parameters: {'objective': 'CrossEntropy', 'colsample_bylevel': 0.08935714015249936, 'depth': 11, 'boosting_type': 'Plain', 'bootstrap_type': 'Bernoulli', 'subsample': 0.33577759485277436}. Best is trial 28 with value: 0.7789473684210526.
[32m[I 2023-04-26 13:05:17,003][39m Trial 148 finished with value: 0.7311827956989247 and parameters: {'objective': 'Logloss', 'colsample_bylevel': 0.06031426168089773, 'depth': 10, 'boosting_type': 'Plain', 'bootstrap_type': 'Bayesian', 'bagging_temperature': 8.366434793799243}. Best is trial 28 with value: 0.7789473684210526.
[32m[I 2023-04-26 13:05:18,629][39m Trial 149 finished with value: 0.7096774193548387 and parameters: {'objective': 'CrossEntropy', 'colsample_bylevel': 0.05654461317358265, 'depth': 8, 'boosting_type': 'Plain', 'bootstrap_type': 'MVS'}. Best is trial 28 with value: 0.7789473684210526.
[32m[I 2023-04-26 13:05:19,943][39m Trial 150 finished with value: 0.717391304347826 and parameters: {'objective': 'CrossEntropy', 'colsample_bylevel': 0.04314448032856287, 'depth': 12, 'boosting_type': 'Plain', 'bootstrap_type': 'Bayesian', 'bagging_temperature': 7.232384299128736}. Best is trial 28 with value: 0.7789473684210526.
[32m[I 2023-04-26 13:05:21,341][39m Trial 151 finished with value: 0.7142857142857142 and parameters: {'objective': 'CrossEntropy', 'colsample_bylevel': 0.05440115406313773, 'depth': 11, 'boosting_type': 'Plain', 'bootstrap_type': 'Bayesian', 'bagging_temperature': 6.1438813885366095}. Best is trial 28 with value: 0.7789473684210526.
[32m[I 2023-04-26 13:05:22,680][39m Trial 152 finished with value: 0.7499999999999999 and parameters: {'objective': 'CrossEntropy', 'colsample_bylevel': 0.05202050467849403, 'depth': 11, 'boosting_type': 'Plain', 'bootstrap_type': 'Bayesian', 'bagging_temperature': 7.908200557585158}. Best is trial 28 with value: 0.7789473684210526.
[32m[I 2023-04-26 13:05:24,103][39m Trial 153 finished with value: 0.7333333333333334 and parameters: {'objective': 'CrossEntropy', 'colsample_bylevel': 0.05847293508314386, 'depth': 12, 'boosting_type': 'Plain', 'bootstrap_type': 'Bayesian', 'bagging_temperature': 7.537778052871593}. Best is trial 28 with value: 0.7789473684210526.
[32m[I 2023-04-26 13:05:25,435][39m Trial 154 finished with value: 0.7272727272727273 and parameters: {'objective': 'CrossEntropy', 'colsample_bylevel': 0.04889816490654441, 'depth': 12, 'boosting_type': 'Plain', 'bootstrap_type': 'Bayesian', 'bagging_temperature': 6.401854461218896}. Best is trial 28 with value: 0.7789473684210526.
[32m[I 2023-04-26 13:05:27,292][39m Trial 155 finished with value: 0.723404255319149 and parameters: {'objective': 'CrossEntropy', 'colsample_bylevel': 0.09959676871623913, 'depth': 12, 'boosting_type': 'Plain', 'bootstrap_type': 'Bayesian', 'bagging_temperature': 6.580063891086105}. Best is trial 28 with value: 0.7789473684210526.
[32m[I 2023-04-26 13:05:28,649][39m Trial 156 finished with value: 0.7422680412371134 and parameters: {'objective': 'CrossEntropy', 'colsample_bylevel': 0.05043215706621742, 'depth': 12, 'boosting_type': 'Plain', 'bootstrap_type': 'Bayesian', 'bagging_temperature': 8.089942752064543}. Best is trial 28 with value: 0.7789473684210526.
[32m[I 2023-04-26 13:05:30,056][39m Trial 157 finished with value: 0.723404255319149 and parameters: {'objective': 'CrossEntropy', 'colsample_bylevel': 0.05383992408728482, 'depth': 11, 'boosting_type': 'Plain', 'bootstrap_type': 'Bayesian', 'bagging_temperature': 6.720267612596195}. Best is trial 28 with value: 0.7789473684210526.
[32m[I 2023-04-26 13:05:31,577][39m Trial 158 finished with value: 0.7628865979381443 and parameters: {'objective': 'CrossEntropy', 'colsample_bylevel': 0.06279230598757315, 'depth': 11, 'boosting_type': 'Plain', 'bootstrap_type': 'Bayesian', 'bagging_temperature': 7.069603847124122}. Best is trial 28 with value: 0.7789473684210526.
[32m[I 2023-04-26 13:05:33,310][39m Trial 159 finished with value: 0.7526881720430108 and parameters: {'objective': 'CrossEntropy', 'colsample_bylevel': 0.06414854210371956, 'depth': 9, 'boosting_type': 'Plain', 'bootstrap_type': 'Bayesian', 'bagging_temperature': 7.079398381220126}. Best is trial 28 with value: 0.7789473684210526.
[32m[I 2023-04-26 13:05:36,995][39m Trial 160 finished with value: 0.7272727272727273 and parameters: {'objective': 'CrossEntropy', 'colsample_bylevel': 0.06263255211631895, 'depth': 11, 'boosting_type': 'Ordered', 'bootstrap_type': 'Bayesian', 'bagging_temperature': 5.314923714677934}. Best is trial 28 with value: 0.7789473684210526.
[32m[I 2023-04-26 13:05:38,413][39m Trial 161 finished with value: 0.7252747252747254 and parameters: {'objective': 'CrossEntropy', 'colsample_bylevel': 0.05709763808916461, 'depth': 10, 'boosting_type': 'Plain', 'bootstrap_type': 'Bayesian', 'bagging_temperature': 5.547472118401258}. Best is trial 28 with value: 0.7789473684210526.
[32m[I 2023-04-26 13:05:39,767][39m Trial 162 finished with value: 0.7422680412371134 and parameters: {'objective': 'CrossEntropy', 'colsample_bylevel': 0.045973032668262505, 'depth': 11, 'boosting_type': 'Plain', 'bootstrap_type': 'Bayesian', 'bagging_temperature': 6.447008831344382}. Best is trial 28 with value: 0.7789473684210526.
[32m[I 2023-04-26 13:05:41,363][39m Trial 163 finished with value: 0.7391304347826086 and parameters: {'objective': 'CrossEntropy', 'colsample_bylevel': 0.0761127675245453, 'depth': 11, 'boosting_type': 'Plain', 'bootstrap_type': 'Bayesian', 'bagging_temperature': 6.252058267117996}. Best is trial 28 with value: 0.7789473684210526.
[32m[I 2023-04-26 13:05:42,777][39m Trial 164 finished with value: 0.7578947368421053 and parameters: {'objective': 'CrossEntropy', 'colsample_bylevel': 0.05572630283911293, 'depth': 12, 'boosting_type': 'Plain', 'bootstrap_type': 'Bayesian', 'bagging_temperature': 5.790860041851344}. Best is trial 28 with value: 0.7789473684210526.
[32m[I 2023-04-26 13:05:44,143][39m Trial 165 finished with value: 0.7578947368421053 and parameters: {'objective': 'CrossEntropy', 'colsample_bylevel': 0.05238107029000265, 'depth': 12, 'boosting_type': 'Plain', 'bootstrap_type': 'Bayesian', 'bagging_temperature': 5.837071694845231}. Best is trial 28 with value: 0.7789473684210526.
[32m[I 2023-04-26 13:05:45,525][39m Trial 166 finished with value: 0.7526881720430108 and parameters: {'objective': 'CrossEntropy', 'colsample_bylevel': 0.04807577716417638, 'depth': 12, 'boosting_type': 'Plain', 'bootstrap_type': 'Bayesian', 'bagging_temperature': 6.9097775746717165}. Best is trial 28 with value: 0.7789473684210526.
[32m[I 2023-04-26 13:05:46,922][39m Trial 167 finished with value: 0.7578947368421053 and parameters: {'objective': 'Logloss', 'colsample_bylevel': 0.059434597955447824, 'depth': 12, 'boosting_type': 'Plain', 'bootstrap_type': 'Bayesian', 'bagging_temperature': 8.78612815254143}. Best is trial 28 with value: 0.7789473684210526.
[32m[I 2023-04-26 13:05:48,487][39m Trial 168 finished with value: 0.723404255319149 and parameters: {'objective': 'CrossEntropy', 'colsample_bylevel': 0.06882746909630523, 'depth': 12, 'boosting_type': 'Plain', 'bootstrap_type': 'Bayesian', 'bagging_temperature': 8.750868266315976}. Best is trial 28 with value: 0.7789473684210526.
[32m[I 2023-04-26 13:05:49,839][39m Trial 169 finished with value: 0.7272727272727273 and parameters: {'objective': 'CrossEntropy', 'colsample_bylevel': 0.05258526751390923, 'depth': 12, 'boosting_type': 'Plain', 'bootstrap_type': 'Bayesian', 'bagging_temperature': 8.883186232108368}. Best is trial 28 with value: 0.7789473684210526.
[32m[I 2023-04-26 13:05:51,275][39m Trial 170 finished with value: 0.7346938775510203 and parameters: {'objective': 'CrossEntropy', 'colsample_bylevel': 0.04969715412533669, 'depth': 5, 'boosting_type': 'Plain', 'bootstrap_type': 'Bayesian', 'bagging_temperature': 6.677639311497649}. Best is trial 28 with value: 0.7789473684210526.
[32m[I 2023-04-26 13:05:52,717][39m Trial 171 finished with value: 0.7499999999999999 and parameters: {'objective': 'CrossEntropy', 'colsample_bylevel': 0.05515671035596963, 'depth': 12, 'boosting_type': 'Plain', 'bootstrap_type': 'Bayesian', 'bagging_temperature': 5.935114520919435}. Best is trial 28 with value: 0.7789473684210526.
[32m[I 2023-04-26 13:05:54,109][39m Trial 172 finished with value: 0.7659574468085106 and parameters: {'objective': 'CrossEntropy', 'colsample_bylevel': 0.05092765583170586, 'depth': 12, 'boosting_type': 'Plain', 'bootstrap_type': 'Bayesian', 'bagging_temperature': 7.394546244115464}. Best is trial 28 with value: 0.7789473684210526.
[32m[I 2023-04-26 13:05:55,979][39m Trial 173 finished with value: 0.723404255319149 and parameters: {'objective': 'CrossEntropy', 'colsample_bylevel': 0.06000456173260381, 'depth': 9, 'boosting_type': 'Plain', 'bootstrap_type': 'Bayesian', 'bagging_temperature': 7.472611662716895}. Best is trial 28 with value: 0.7789473684210526.
[32m[I 2023-04-26 13:05:57,277][39m Trial 174 finished with value: 0.7346938775510203 and parameters: {'objective': 'CrossEntropy', 'colsample_bylevel': 0.05224959996704256, 'depth': 12, 'boosting_type': 'Plain', 'bootstrap_type': 'Bayesian', 'bagging_temperature': 5.8575227114348225}. Best is trial 28 with value: 0.7789473684210526.
[32m[I 2023-04-26 13:05:58,652][39m Trial 175 finished with value: 0.7526881720430108 and parameters: {'objective': 'CrossEntropy', 'colsample_bylevel': 0.055589032513205225, 'depth': 6, 'boosting_type': 'Plain', 'bootstrap_type': 'Bayesian', 'bagging_temperature': 7.2932421088179265}. Best is trial 28 with value: 0.7789473684210526.
[32m[I 2023-04-26 13:06:00,092][39m Trial 176 finished with value: 0.7422680412371134 and parameters: {'objective': 'Logloss', 'colsample_bylevel': 0.061382271224413094, 'depth': 12, 'boosting_type': 'Plain', 'bootstrap_type': 'Bayesian', 'bagging_temperature': 8.48436613839211}. Best is trial 28 with value: 0.7789473684210526.
[32m[I 2023-04-26 13:06:01,447][39m Trial 177 finished with value: 0.7368421052631579 and parameters: {'objective': 'CrossEntropy', 'colsample_bylevel': 0.046709844019716854, 'depth': 11, 'boosting_type': 'Plain', 'bootstrap_type': 'Bernoulli', 'subsample': 0.5026247414803785}. Best is trial 28 with value: 0.7789473684210526.
[32m[I 2023-04-26 13:06:02,904][39m Trial 178 finished with value: 0.7368421052631579 and parameters: {'objective': 'CrossEntropy', 'colsample_bylevel': 0.05767734791911559, 'depth': 11, 'boosting_type': 'Plain', 'bootstrap_type': 'MVS'}. Best is trial 28 with value: 0.7789473684210526.
[32m[I 2023-04-26 13:06:04,318][39m Trial 179 finished with value: 0.7526881720430108 and parameters: {'objective': 'CrossEntropy', 'colsample_bylevel': 0.05685830152083558, 'depth': 11, 'boosting_type': 'Plain', 'bootstrap_type': 'Bayesian', 'bagging_temperature': 7.674302608642473}. Best is trial 28 with value: 0.7789473684210526.
[32m[I 2023-04-26 13:06:05,787][39m Trial 180 finished with value: 0.7499999999999999 and parameters: {'objective': 'CrossEntropy', 'colsample_bylevel': 0.054237735959268646, 'depth': 7, 'boosting_type': 'Plain', 'bootstrap_type': 'Bayesian', 'bagging_temperature': 6.082844254406383}. Best is trial 28 with value: 0.7789473684210526.
[32m[I 2023-04-26 13:06:07,209][39m Trial 181 finished with value: 0.7391304347826086 and parameters: {'objective': 'Logloss', 'colsample_bylevel': 0.059797214649980696, 'depth': 12, 'boosting_type': 'Plain', 'bootstrap_type': 'Bayesian', 'bagging_temperature': 9.072130108075138}. Best is trial 28 with value: 0.7789473684210526.
[32m[I 2023-04-26 13:06:08,523][39m Trial 182 finished with value: 0.7578947368421053 and parameters: {'objective': 'CrossEntropy', 'colsample_bylevel': 0.044815047564978075, 'depth': 12, 'boosting_type': 'Plain', 'bootstrap_type': 'Bayesian', 'bagging_temperature': 6.486622794413191}. Best is trial 28 with value: 0.7789473684210526.
[32m[I 2023-04-26 13:06:09,867][39m Trial 183 finished with value: 0.7291666666666666 and parameters: {'objective': 'CrossEntropy', 'colsample_bylevel': 0.044974134028171915, 'depth': 12, 'boosting_type': 'Plain', 'bootstrap_type': 'Bayesian', 'bagging_temperature': 6.978836200569598}. Best is trial 28 with value: 0.7789473684210526.
[32m[I 2023-04-26 13:06:11,296][39m Trial 184 finished with value: 0.7659574468085106 and parameters: {'objective': 'Logloss', 'colsample_bylevel': 0.05856005667957381, 'depth': 11, 'boosting_type': 'Plain', 'bootstrap_type': 'Bayesian', 'bagging_temperature': 9.657581200421838}. Best is trial 28 with value: 0.7789473684210526.
[32m[I 2023-04-26 13:06:12,665][39m Trial 185 finished with value: 0.7551020408163265 and parameters: {'objective': 'Logloss', 'colsample_bylevel': 0.050149055032706204, 'depth': 12, 'boosting_type': 'Plain', 'bootstrap_type': 'Bayesian', 'bagging_temperature': 9.4891906033521}. Best is trial 28 with value: 0.7789473684210526.
[32m[I 2023-04-26 13:06:14,040][39m Trial 186 finished with value: 0.7422680412371134 and parameters: {'objective': 'Logloss', 'colsample_bylevel': 0.05153927679379751, 'depth': 11, 'boosting_type': 'Plain', 'bootstrap_type': 'Bayesian', 'bagging_temperature': 9.937642289899385}. Best is trial 28 with value: 0.7789473684210526.
[32m[I 2023-04-26 13:06:15,304][39m Trial 187 finished with value: 0.6972477064220183 and parameters: {'objective': 'CrossEntropy', 'colsample_bylevel': 0.04252987321071115, 'depth': 1, 'boosting_type': 'Plain', 'bootstrap_type': 'Bayesian', 'bagging_temperature': 6.770953713307417}. Best is trial 28 with value: 0.7789473684210526.
[32m[I 2023-04-26 13:06:16,763][39m Trial 188 finished with value: 0.7499999999999999 and parameters: {'objective': 'CrossEntropy', 'colsample_bylevel': 0.0535627483845627, 'depth': 11, 'boosting_type': 'Plain', 'bootstrap_type': 'Bayesian', 'bagging_temperature': 9.66031864875576}. Best is trial 28 with value: 0.7789473684210526.
[32m[I 2023-04-26 13:06:18,217][39m Trial 189 finished with value: 0.7526881720430108 and parameters: {'objective': 'Logloss', 'colsample_bylevel': 0.06443401595785296, 'depth': 10, 'boosting_type': 'Plain', 'bootstrap_type': 'Bayesian', 'bagging_temperature': 8.466458379596062}. Best is trial 28 with value: 0.7789473684210526.
[32m[I 2023-04-26 13:06:21,855][39m Trial 190 finished with value: 0.7115384615384616 and parameters: {'objective': 'Logloss', 'colsample_bylevel': 0.06228975102311276, 'depth': 11, 'boosting_type': 'Ordered', 'bootstrap_type': 'Bayesian', 'bagging_temperature': 7.966437827272171}. Best is trial 28 with value: 0.7789473684210526.
[32m[I 2023-04-26 13:06:23,359][39m Trial 191 finished with value: 0.7659574468085106 and parameters: {'objective': 'CrossEntropy', 'colsample_bylevel': 0.05879251680922191, 'depth': 11, 'boosting_type': 'Plain', 'bootstrap_type': 'Bayesian', 'bagging_temperature': 9.331454497092283}. Best is trial 28 with value: 0.7789473684210526.
[32m[I 2023-04-26 13:06:24,787][39m Trial 192 finished with value: 0.7526881720430108 and parameters: {'objective': 'CrossEntropy', 'colsample_bylevel': 0.05786129404608166, 'depth': 11, 'boosting_type': 'Plain', 'bootstrap_type': 'Bayesian', 'bagging_temperature': 9.771863482632057}. Best is trial 28 with value: 0.7789473684210526.
[32m[I 2023-04-26 13:06:26,212][39m Trial 193 finished with value: 0.7252747252747254 and parameters: {'objective': 'CrossEntropy', 'colsample_bylevel': 0.05860797886673002, 'depth': 10, 'boosting_type': 'Plain', 'bootstrap_type': 'Bayesian', 'bagging_temperature': 9.250121167870288}. Best is trial 28 with value: 0.7789473684210526.
[32m[I 2023-04-26 13:06:27,906][39m Trial 194 finished with value: 0.7346938775510203 and parameters: {'objective': 'CrossEntropy', 'colsample_bylevel': 0.048140766423229224, 'depth': 8, 'boosting_type': 'Plain', 'bootstrap_type': 'Bayesian', 'bagging_temperature': 9.359853833529657}. Best is trial 28 with value: 0.7789473684210526.
[32m[I 2023-04-26 13:06:29,173][39m Trial 195 finished with value: 0.7422680412371134 and parameters: {'objective': 'CrossEntropy', 'colsample_bylevel': 0.04504093718390609, 'depth': 12, 'boosting_type': 'Plain', 'bootstrap_type': 'Bayesian', 'bagging_temperature': 6.583023852904136}. Best is trial 28 with value: 0.7789473684210526.
[32m[I 2023-04-26 13:06:30,457][39m Trial 196 finished with value: 0.7446808510638298 and parameters: {'objective': 'CrossEntropy', 'colsample_bylevel': 0.04104332267731013, 'depth': 12, 'boosting_type': 'Plain', 'bootstrap_type': 'Bayesian', 'bagging_temperature': 7.118486742774285}. Best is trial 28 with value: 0.7789473684210526.
[32m[I 2023-04-26 13:06:31,848][39m Trial 197 finished with value: 0.7446808510638298 and parameters: {'objective': 'Logloss', 'colsample_bylevel': 0.06154865371411952, 'depth': 11, 'boosting_type': 'Plain', 'bootstrap_type': 'Bayesian', 'bagging_temperature': 6.2478738455765646}. Best is trial 28 with value: 0.7789473684210526.
