[32m[I 2023-04-26 13:11:45,007][39m Trial 395 finished with value: 0.7526881720430108 and parameters: {'objective': 'CrossEntropy', 'colsample_bylevel': 0.04994679259951527, 'depth': 12, 'boosting_type': 'Plain', 'bootstrap_type': 'Bayesian', 'bagging_temperature': 8.685082661113276}. Best is trial 28 with value: 0.7789473684210526.
[32m[I 2023-04-26 13:11:48,373][39m Trial 396 finished with value: 0.7115384615384616 and parameters: {'objective': 'CrossEntropy', 'colsample_bylevel': 0.05488976625353263, 'depth': 12, 'boosting_type': 'Ordered', 'bootstrap_type': 'Bayesian', 'bagging_temperature': 8.682194399306107}. Best is trial 28 with value: 0.7789473684210526.
[32m[I 2023-04-26 13:11:49,921][39m Trial 397 finished with value: 0.7578947368421053 and parameters: {'objective': 'CrossEntropy', 'colsample_bylevel': 0.053778169218411394, 'depth': 11, 'boosting_type': 'Plain', 'bootstrap_type': 'Bayesian', 'bagging_temperature': 8.184574441680079}. Best is trial 28 with value: 0.7789473684210526.
[32m[I 2023-04-26 13:11:52,124][39m Trial 398 finished with value: 0.7526881720430108 and parameters: {'objective': 'Logloss', 'colsample_bylevel': 0.059037489948687266, 'depth': 9, 'boosting_type': 'Plain', 'bootstrap_type': 'Bayesian', 'bagging_temperature': 8.934235860182104}. Best is trial 28 with value: 0.7789473684210526.
[32m[I 2023-04-26 13:11:53,744][39m Trial 399 finished with value: 0.7446808510638298 and parameters: {'objective': 'CrossEntropy', 'colsample_bylevel': 0.06075456485622183, 'depth': 9, 'boosting_type': 'Plain', 'bootstrap_type': 'Bayesian', 'bagging_temperature': 9.39315494147128}. Best is trial 28 with value: 0.7789473684210526.
[32m[I 2023-04-26 13:11:55,118][39m Trial 400 finished with value: 0.7578947368421053 and parameters: {'objective': 'CrossEntropy', 'colsample_bylevel': 0.054468250437609715, 'depth': 12, 'boosting_type': 'Plain', 'bootstrap_type': 'Bayesian', 'bagging_temperature': 8.44340034261409}. Best is trial 28 with value: 0.7789473684210526.
[32m[I 2023-04-26 13:11:56,614][39m Trial 401 finished with value: 0.7422680412371134 and parameters: {'objective': 'Logloss', 'colsample_bylevel': 0.051468813548033183, 'depth': 8, 'boosting_type': 'Plain', 'bootstrap_type': 'Bayesian', 'bagging_temperature': 9.959875481561651}. Best is trial 28 with value: 0.7789473684210526.
[32m[I 2023-04-26 13:11:58,021][39m Trial 402 finished with value: 0.7422680412371134 and parameters: {'objective': 'Logloss', 'colsample_bylevel': 0.057089266951873406, 'depth': 12, 'boosting_type': 'Plain', 'bootstrap_type': 'Bayesian', 'bagging_temperature': 7.898651540379915}. Best is trial 28 with value: 0.7789473684210526.
[32m[I 2023-04-26 13:11:59,412][39m Trial 403 finished with value: 0.7526881720430108 and parameters: {'objective': 'Logloss', 'colsample_bylevel': 0.05245098272692763, 'depth': 7, 'boosting_type': 'Plain', 'bootstrap_type': 'Bayesian', 'bagging_temperature': 9.161606023893736}. Best is trial 28 with value: 0.7789473684210526.
[32m[I 2023-04-26 13:12:01,059][39m Trial 404 finished with value: 0.7346938775510203 and parameters: {'objective': 'CrossEntropy', 'colsample_bylevel': 0.05637221118040321, 'depth': 8, 'boosting_type': 'Plain', 'bootstrap_type': 'Bayesian', 'bagging_temperature': 9.257347264948079}. Best is trial 28 with value: 0.7789473684210526.
[32m[I 2023-04-26 13:12:02,496][39m Trial 405 finished with value: 0.7499999999999999 and parameters: {'objective': 'CrossEntropy', 'colsample_bylevel': 0.05988502875954251, 'depth': 10, 'boosting_type': 'Plain', 'bootstrap_type': 'Bayesian', 'bagging_temperature': 6.326158576296915}. Best is trial 28 with value: 0.7789473684210526.
[32m[I 2023-04-26 13:12:03,841][39m Trial 406 finished with value: 0.7499999999999999 and parameters: {'objective': 'CrossEntropy', 'colsample_bylevel': 0.049709618876588535, 'depth': 11, 'boosting_type': 'Plain', 'bootstrap_type': 'Bayesian', 'bagging_temperature': 9.10548867107586}. Best is trial 28 with value: 0.7789473684210526.
[32m[I 2023-04-26 13:12:05,238][39m Trial 407 finished with value: 0.7499999999999999 and parameters: {'objective': 'Logloss', 'colsample_bylevel': 0.04735852717238748, 'depth': 12, 'boosting_type': 'Plain', 'bootstrap_type': 'Bayesian', 'bagging_temperature': 8.813810790183046}. Best is trial 28 with value: 0.7789473684210526.
[32m[I 2023-04-26 13:12:07,010][39m Trial 408 finished with value: 0.712871287128713 and parameters: {'objective': 'CrossEntropy', 'colsample_bylevel': 0.05271299582618661, 'depth': 9, 'boosting_type': 'Plain', 'bootstrap_type': 'Bayesian', 'bagging_temperature': 9.534194597856823}. Best is trial 28 with value: 0.7789473684210526.
[32m[I 2023-04-26 13:12:08,415][39m Trial 409 finished with value: 0.7200000000000001 and parameters: {'objective': 'Logloss', 'colsample_bylevel': 0.04789311714351089, 'depth': 12, 'boosting_type': 'Plain', 'bootstrap_type': 'Bayesian', 'bagging_temperature': 6.668923397409962}. Best is trial 28 with value: 0.7789473684210526.
[32m[I 2023-04-26 13:12:09,855][39m Trial 410 finished with value: 0.7311827956989247 and parameters: {'objective': 'CrossEntropy', 'colsample_bylevel': 0.05894471552203565, 'depth': 11, 'boosting_type': 'Plain', 'bootstrap_type': 'Bernoulli', 'subsample': 0.46334445211746944}. Best is trial 28 with value: 0.7789473684210526.
[32m[I 2023-04-26 13:12:11,243][39m Trial 411 finished with value: 0.7422680412371134 and parameters: {'objective': 'CrossEntropy', 'colsample_bylevel': 0.05460919882170106, 'depth': 12, 'boosting_type': 'Plain', 'bootstrap_type': 'Bayesian', 'bagging_temperature': 8.161984632496827}. Best is trial 28 with value: 0.7789473684210526.
[32m[I 2023-04-26 13:12:12,609][39m Trial 412 finished with value: 0.7526881720430108 and parameters: {'objective': 'CrossEntropy', 'colsample_bylevel': 0.05817129593512136, 'depth': 10, 'boosting_type': 'Plain', 'bootstrap_type': 'Bayesian', 'bagging_temperature': 8.472725545725114}. Best is trial 28 with value: 0.7789473684210526.
[32m[I 2023-04-26 13:12:14,063][39m Trial 413 finished with value: 0.7446808510638298 and parameters: {'objective': 'Logloss', 'colsample_bylevel': 0.06113965232757638, 'depth': 12, 'boosting_type': 'Plain', 'bootstrap_type': 'MVS'}. Best is trial 28 with value: 0.7789473684210526.
[32m[I 2023-04-26 13:12:15,452][39m Trial 414 finished with value: 0.7659574468085106 and parameters: {'objective': 'CrossEntropy', 'colsample_bylevel': 0.05054230993925519, 'depth': 11, 'boosting_type': 'Plain', 'bootstrap_type': 'Bayesian', 'bagging_temperature': 7.4952204248427785}. Best is trial 28 with value: 0.7789473684210526.
[32m[I 2023-04-26 13:12:17,176][39m Trial 415 finished with value: 0.7368421052631579 and parameters: {'objective': 'CrossEntropy', 'colsample_bylevel': 0.04551974618912875, 'depth': 9, 'boosting_type': 'Plain', 'bootstrap_type': 'Bayesian', 'bagging_temperature': 6.469427229414098}. Best is trial 28 with value: 0.7789473684210526.
[32m[I 2023-04-26 13:12:20,483][39m Trial 416 finished with value: 0.7058823529411764 and parameters: {'objective': 'CrossEntropy', 'colsample_bylevel': 0.05371282798868948, 'depth': 12, 'boosting_type': 'Ordered', 'bootstrap_type': 'Bayesian', 'bagging_temperature': 7.912940976591882}. Best is trial 28 with value: 0.7789473684210526.
[32m[I 2023-04-26 13:12:21,887][39m Trial 417 finished with value: 0.7446808510638298 and parameters: {'objective': 'CrossEntropy', 'colsample_bylevel': 0.05537627301605833, 'depth': 11, 'boosting_type': 'Plain', 'bootstrap_type': 'Bayesian', 'bagging_temperature': 8.37597404559836}. Best is trial 28 with value: 0.7789473684210526.
[32m[I 2023-04-26 13:12:23,313][39m Trial 418 finished with value: 0.7272727272727273 and parameters: {'objective': 'CrossEntropy', 'colsample_bylevel': 0.05134219042938282, 'depth': 11, 'boosting_type': 'Plain', 'bootstrap_type': 'Bayesian', 'bagging_temperature': 7.5690856384843235}. Best is trial 28 with value: 0.7789473684210526.
[32m[I 2023-04-26 13:12:24,765][39m Trial 419 finished with value: 0.74 and parameters: {'objective': 'CrossEntropy', 'colsample_bylevel': 0.05581136544122385, 'depth': 12, 'boosting_type': 'Plain', 'bootstrap_type': 'Bayesian', 'bagging_temperature': 8.558964356823294}. Best is trial 28 with value: 0.7789473684210526.
[32m[I 2023-04-26 13:12:26,091][39m Trial 420 finished with value: 0.7157894736842105 and parameters: {'objective': 'CrossEntropy', 'colsample_bylevel': 0.043370423802404856, 'depth': 12, 'boosting_type': 'Plain', 'bootstrap_type': 'Bayesian', 'bagging_temperature': 8.810385787076898}. Best is trial 28 with value: 0.7789473684210526.
[32m[I 2023-04-26 13:12:27,460][39m Trial 421 finished with value: 0.7499999999999999 and parameters: {'objective': 'Logloss', 'colsample_bylevel': 0.0485934181323615, 'depth': 12, 'boosting_type': 'Plain', 'bootstrap_type': 'Bayesian', 'bagging_temperature': 7.867320727109511}. Best is trial 28 with value: 0.7789473684210526.
[32m[I 2023-04-26 13:12:28,894][39m Trial 422 finished with value: 0.7326732673267328 and parameters: {'objective': 'Logloss', 'colsample_bylevel': 0.05175483521613241, 'depth': 12, 'boosting_type': 'Plain', 'bootstrap_type': 'Bayesian', 'bagging_temperature': 7.719640503132808}. Best is trial 28 with value: 0.7789473684210526.
[32m[I 2023-04-26 13:12:30,339][39m Trial 423 finished with value: 0.7526881720430108 and parameters: {'objective': 'CrossEntropy', 'colsample_bylevel': 0.05363054313356211, 'depth': 7, 'boosting_type': 'Plain', 'bootstrap_type': 'Bayesian', 'bagging_temperature': 8.135501655474929}. Best is trial 28 with value: 0.7789473684210526.
[32m[I 2023-04-26 13:12:31,952][39m Trial 424 finished with value: 0.7115384615384616 and parameters: {'objective': 'Logloss', 'colsample_bylevel': 0.035339517741113116, 'depth': 9, 'boosting_type': 'Plain', 'bootstrap_type': 'Bayesian', 'bagging_temperature': 3.5982925879633}. Best is trial 28 with value: 0.7789473684210526.
[32m[I 2023-04-26 13:12:33,326][39m Trial 425 finished with value: 0.7499999999999999 and parameters: {'objective': 'CrossEntropy', 'colsample_bylevel': 0.05012096092227961, 'depth': 12, 'boosting_type': 'Plain', 'bootstrap_type': 'Bayesian', 'bagging_temperature': 8.322813114554503}. Best is trial 28 with value: 0.7789473684210526.
[32m[I 2023-04-26 13:12:34,892][39m Trial 426 finished with value: 0.7368421052631579 and parameters: {'objective': 'CrossEntropy', 'colsample_bylevel': 0.05009460261772347, 'depth': 8, 'boosting_type': 'Plain', 'bootstrap_type': 'Bayesian', 'bagging_temperature': 9.667661243164657}. Best is trial 28 with value: 0.7789473684210526.
[32m[I 2023-04-26 13:12:37,012][39m Trial 427 finished with value: 0.7391304347826086 and parameters: {'objective': 'CrossEntropy', 'colsample_bylevel': 0.07310604360818561, 'depth': 9, 'boosting_type': 'Plain', 'bootstrap_type': 'Bayesian', 'bagging_temperature': 7.482570315020796}. Best is trial 28 with value: 0.7789473684210526.
[32m[I 2023-04-26 13:12:38,447][39m Trial 428 finished with value: 0.7499999999999999 and parameters: {'objective': 'CrossEntropy', 'colsample_bylevel': 0.056400633433592036, 'depth': 10, 'boosting_type': 'Plain', 'bootstrap_type': 'Bayesian', 'bagging_temperature': 7.67814717132226}. Best is trial 28 with value: 0.7789473684210526.
[32m[I 2023-04-26 13:12:39,862][39m Trial 429 finished with value: 0.7368421052631579 and parameters: {'objective': 'CrossEntropy', 'colsample_bylevel': 0.05685671729669435, 'depth': 11, 'boosting_type': 'Plain', 'bootstrap_type': 'Bayesian', 'bagging_temperature': 7.408981265500801}. Best is trial 28 with value: 0.7789473684210526.
[32m[I 2023-04-26 13:12:41,298][39m Trial 430 finished with value: 0.7291666666666666 and parameters: {'objective': 'CrossEntropy', 'colsample_bylevel': 0.05736783077067476, 'depth': 10, 'boosting_type': 'Plain', 'bootstrap_type': 'Bayesian', 'bagging_temperature': 6.0360531855498465}. Best is trial 28 with value: 0.7789473684210526.
[32m[I 2023-04-26 13:12:42,692][39m Trial 431 finished with value: 0.7499999999999999 and parameters: {'objective': 'Logloss', 'colsample_bylevel': 0.048658356212790084, 'depth': 12, 'boosting_type': 'Plain', 'bootstrap_type': 'Bayesian', 'bagging_temperature': 7.279397933126787}. Best is trial 28 with value: 0.7789473684210526.
[32m[I 2023-04-26 13:12:44,077][39m Trial 432 finished with value: 0.7422680412371134 and parameters: {'objective': 'CrossEntropy', 'colsample_bylevel': 0.05267673622139028, 'depth': 12, 'boosting_type': 'Plain', 'bootstrap_type': 'Bayesian', 'bagging_temperature': 6.840987005124232}. Best is trial 28 with value: 0.7789473684210526.
[32m[I 2023-04-26 13:12:45,581][39m Trial 433 finished with value: 0.7368421052631579 and parameters: {'objective': 'Logloss', 'colsample_bylevel': 0.06000652737224113, 'depth': 7, 'boosting_type': 'Plain', 'bootstrap_type': 'Bernoulli', 'subsample': 0.2793719959068806}. Best is trial 28 with value: 0.7789473684210526.
[32m[I 2023-04-26 13:12:48,864][39m Trial 434 finished with value: 0.7272727272727273 and parameters: {'objective': 'CrossEntropy', 'colsample_bylevel': 0.046210693901685015, 'depth': 11, 'boosting_type': 'Ordered', 'bootstrap_type': 'Bayesian', 'bagging_temperature': 9.075453897152135}. Best is trial 28 with value: 0.7789473684210526.
[32m[I 2023-04-26 13:12:50,448][39m Trial 435 finished with value: 0.7578947368421053 and parameters: {'objective': 'CrossEntropy', 'colsample_bylevel': 0.0588804188894843, 'depth': 10, 'boosting_type': 'Plain', 'bootstrap_type': 'Bayesian', 'bagging_temperature': 5.347972317761779}. Best is trial 28 with value: 0.7789473684210526.
[32m[I 2023-04-26 13:12:51,926][39m Trial 436 finished with value: 0.7446808510638298 and parameters: {'objective': 'CrossEntropy', 'colsample_bylevel': 0.055148771012893984, 'depth': 12, 'boosting_type': 'Plain', 'bootstrap_type': 'Bayesian', 'bagging_temperature': 8.0917766412614}. Best is trial 28 with value: 0.7789473684210526.
[32m[I 2023-04-26 13:12:53,910][39m Trial 437 finished with value: 0.7446808510638298 and parameters: {'objective': 'Logloss', 'colsample_bylevel': 0.0612892764585096, 'depth': 9, 'boosting_type': 'Plain', 'bootstrap_type': 'MVS'}. Best is trial 28 with value: 0.7789473684210526.
[32m[I 2023-04-26 13:12:55,333][39m Trial 438 finished with value: 0.7578947368421053 and parameters: {'objective': 'CrossEntropy', 'colsample_bylevel': 0.054172813090267224, 'depth': 12, 'boosting_type': 'Plain', 'bootstrap_type': 'Bayesian', 'bagging_temperature': 6.376565941022097}. Best is trial 28 with value: 0.7789473684210526.
[32m[I 2023-04-26 13:12:56,741][39m Trial 439 finished with value: 0.7578947368421053 and parameters: {'objective': 'CrossEntropy', 'colsample_bylevel': 0.05623125548176799, 'depth': 11, 'boosting_type': 'Plain', 'bootstrap_type': 'Bayesian', 'bagging_temperature': 8.282965719769752}. Best is trial 28 with value: 0.7789473684210526.
[32m[I 2023-04-26 13:12:58,325][39m Trial 440 finished with value: 0.7368421052631579 and parameters: {'objective': 'CrossEntropy', 'colsample_bylevel': 0.05531348820189004, 'depth': 9, 'boosting_type': 'Plain', 'bootstrap_type': 'Bayesian', 'bagging_temperature': 7.936960605771906}. Best is trial 28 with value: 0.7789473684210526.
[32m[I 2023-04-26 13:12:59,961][39m Trial 441 finished with value: 0.7578947368421053 and parameters: {'objective': 'CrossEntropy', 'colsample_bylevel': 0.05350316904583626, 'depth': 9, 'boosting_type': 'Plain', 'bootstrap_type': 'Bayesian', 'bagging_temperature': 8.228826472680534}. Best is trial 28 with value: 0.7789473684210526.
[32m[I 2023-04-26 13:13:01,382][39m Trial 442 finished with value: 0.7422680412371134 and parameters: {'objective': 'CrossEntropy', 'colsample_bylevel': 0.056771462104620495, 'depth': 11, 'boosting_type': 'Plain', 'bootstrap_type': 'Bayesian', 'bagging_temperature': 8.653116135922183}. Best is trial 28 with value: 0.7789473684210526.
[32m[I 2023-04-26 13:13:02,719][39m Trial 443 finished with value: 0.7578947368421053 and parameters: {'objective': 'CrossEntropy', 'colsample_bylevel': 0.05225621943501511, 'depth': 12, 'boosting_type': 'Plain', 'bootstrap_type': 'Bayesian', 'bagging_temperature': 7.6502645292459}. Best is trial 28 with value: 0.7789473684210526.
[32m[I 2023-04-26 13:13:04,156][39m Trial 444 finished with value: 0.7422680412371134 and parameters: {'objective': 'Logloss', 'colsample_bylevel': 0.058544960442118786, 'depth': 11, 'boosting_type': 'Plain', 'bootstrap_type': 'Bayesian', 'bagging_temperature': 6.889751441432524}. Best is trial 28 with value: 0.7789473684210526.
[32m[I 2023-04-26 13:13:05,578][39m Trial 445 finished with value: 0.7346938775510203 and parameters: {'objective': 'Logloss', 'colsample_bylevel': 0.06277204656226082, 'depth': 11, 'boosting_type': 'Plain', 'bootstrap_type': 'Bayesian', 'bagging_temperature': 7.094347625391123}. Best is trial 28 with value: 0.7789473684210526.
[32m[I 2023-04-26 13:13:07,006][39m Trial 446 finished with value: 0.7659574468085106 and parameters: {'objective': 'CrossEntropy', 'colsample_bylevel': 0.058423556438151766, 'depth': 11, 'boosting_type': 'Plain', 'bootstrap_type': 'Bayesian', 'bagging_temperature': 3.8446262663659807}. Best is trial 28 with value: 0.7789473684210526.
[32m[I 2023-04-26 13:13:08,440][39m Trial 447 finished with value: 0.7526881720430108 and parameters: {'objective': 'CrossEntropy', 'colsample_bylevel': 0.05789284334809306, 'depth': 12, 'boosting_type': 'Plain', 'bootstrap_type': 'Bayesian', 'bagging_temperature': 6.7251788726737205}. Best is trial 28 with value: 0.7789473684210526.
[32m[I 2023-04-26 13:13:09,870][39m Trial 448 finished with value: 0.7499999999999999 and parameters: {'objective': 'CrossEntropy', 'colsample_bylevel': 0.05151341798829859, 'depth': 12, 'boosting_type': 'Plain', 'bootstrap_type': 'Bayesian', 'bagging_temperature': 8.825908002342636}. Best is trial 28 with value: 0.7789473684210526.
[32m[I 2023-04-26 13:13:11,309][39m Trial 449 finished with value: 0.7446808510638298 and parameters: {'objective': 'CrossEntropy', 'colsample_bylevel': 0.06054652929248121, 'depth': 10, 'boosting_type': 'Plain', 'bootstrap_type': 'Bayesian', 'bagging_temperature': 2.279892706342777}. Best is trial 28 with value: 0.7789473684210526.
[32m[I 2023-04-26 13:13:12,595][39m Trial 450 finished with value: 0.7499999999999999 and parameters: {'objective': 'CrossEntropy', 'colsample_bylevel': 0.05513905815888357, 'depth': 11, 'boosting_type': 'Plain', 'bootstrap_type': 'Bayesian', 'bagging_temperature': 6.186702601625834}. Best is trial 28 with value: 0.7789473684210526.
[32m[I 2023-04-26 13:13:14,277][39m Trial 451 finished with value: 0.7578947368421053 and parameters: {'objective': 'CrossEntropy', 'colsample_bylevel': 0.054780703443217414, 'depth': 9, 'boosting_type': 'Plain', 'bootstrap_type': 'Bayesian', 'bagging_temperature': 8.504057703424264}. Best is trial 28 with value: 0.7789473684210526.
[32m[I 2023-04-26 13:13:15,817][39m Trial 452 finished with value: 0.7526881720430108 and parameters: {'objective': 'CrossEntropy', 'colsample_bylevel': 0.056790897494152455, 'depth': 8, 'boosting_type': 'Plain', 'bootstrap_type': 'Bayesian', 'bagging_temperature': 6.540185185299261}. Best is trial 28 with value: 0.7789473684210526.
[32m[I 2023-04-26 13:13:17,268][39m Trial 453 finished with value: 0.7291666666666666 and parameters: {'objective': 'CrossEntropy', 'colsample_bylevel': 0.06243254303980924, 'depth': 10, 'boosting_type': 'Plain', 'bootstrap_type': 'Bayesian', 'bagging_temperature': 3.571547696210437}. Best is trial 28 with value: 0.7789473684210526.
[32m[I 2023-04-26 13:13:18,626][39m Trial 454 finished with value: 0.7499999999999999 and parameters: {'objective': 'CrossEntropy', 'colsample_bylevel': 0.05077983373816374, 'depth': 12, 'boosting_type': 'Plain', 'bootstrap_type': 'Bayesian', 'bagging_temperature': 8.046471792177002}. Best is trial 28 with value: 0.7789473684210526.
[32m[I 2023-04-26 13:13:22,012][39m Trial 455 finished with value: 0.6981132075471698 and parameters: {'objective': 'CrossEntropy', 'colsample_bylevel': 0.05469950143561196, 'depth': 11, 'boosting_type': 'Ordered', 'bootstrap_type': 'Bayesian', 'bagging_temperature': 5.920654054089437}. Best is trial 28 with value: 0.7789473684210526.
[32m[I 2023-04-26 13:13:23,515][39m Trial 456 finished with value: 0.7446808510638298 and parameters: {'objective': 'CrossEntropy', 'colsample_bylevel': 0.05312069851055718, 'depth': 5, 'boosting_type': 'Plain', 'bootstrap_type': 'Bernoulli', 'subsample': 0.7332212957089286}. Best is trial 28 with value: 0.7789473684210526.
[32m[I 2023-04-26 13:13:24,777][39m Trial 457 finished with value: 0.6972477064220183 and parameters: {'objective': 'CrossEntropy', 'colsample_bylevel': 0.0173546273513299, 'depth': 8, 'boosting_type': 'Plain', 'bootstrap_type': 'Bayesian', 'bagging_temperature': 7.79353310290263}. Best is trial 28 with value: 0.7789473684210526.
[32m[I 2023-04-26 13:13:26,217][39m Trial 458 finished with value: 0.7659574468085106 and parameters: {'objective': 'CrossEntropy', 'colsample_bylevel': 0.05129253138660021, 'depth': 12, 'boosting_type': 'Plain', 'bootstrap_type': 'Bayesian', 'bagging_temperature': 7.444479610738721}. Best is trial 28 with value: 0.7789473684210526.
[32m[I 2023-04-26 13:13:27,711][39m Trial 459 finished with value: 0.7096774193548387 and parameters: {'objective': 'CrossEntropy', 'colsample_bylevel': 0.05863261235196591, 'depth': 11, 'boosting_type': 'Plain', 'bootstrap_type': 'MVS'}. Best is trial 28 with value: 0.7789473684210526.
[32m[I 2023-04-26 13:13:29,224][39m Trial 460 finished with value: 0.7526881720430108 and parameters: {'objective': 'CrossEntropy', 'colsample_bylevel': 0.05725312649340952, 'depth': 11, 'boosting_type': 'Plain', 'bootstrap_type': 'Bayesian', 'bagging_temperature': 9.83991041358352}. Best is trial 28 with value: 0.7789473684210526.
