[32m[I 2023-04-26 00:20:19,469][39m Trial 443 finished with value: 0.8363636363636363 and parameters: {'criterion': 'gini', 'n_estimators': 140, 'max_features': 0.8906561184893862, 'max_depth': 16, 'min_samples_split': 3, 'min_samples_leaf': 3}. Best is trial 70 with value: 0.8695652173913043.
[32m[I 2023-04-26 00:20:19,603][39m Trial 444 finished with value: 0.8571428571428572 and parameters: {'criterion': 'gini', 'n_estimators': 130, 'max_features': 0.7843727383180379, 'max_depth': 100, 'min_samples_split': 3, 'min_samples_leaf': 3}. Best is trial 70 with value: 0.8695652173913043.
[32m[I 2023-04-26 00:20:19,763][39m Trial 445 finished with value: 0.8571428571428572 and parameters: {'criterion': 'gini', 'n_estimators': 170, 'max_features': 0.7658341337236455, 'max_depth': 18, 'min_samples_split': 7, 'min_samples_leaf': 3}. Best is trial 70 with value: 0.8695652173913043.
[32m[I 2023-04-26 00:20:19,857][39m Trial 446 finished with value: 0.8521739130434783 and parameters: {'criterion': 'gini', 'n_estimators': 83, 'max_features': 0.7204616275856115, 'max_depth': 28, 'min_samples_split': 7, 'min_samples_leaf': 3}. Best is trial 70 with value: 0.8695652173913043.
[32m[I 2023-04-26 00:20:20,012][39m Trial 447 finished with value: 0.8521739130434783 and parameters: {'criterion': 'gini', 'n_estimators': 181, 'max_features': 0.49117291188532686, 'max_depth': 22, 'min_samples_split': 7, 'min_samples_leaf': 3}. Best is trial 70 with value: 0.8695652173913043.
[32m[I 2023-04-26 00:20:20,192][39m Trial 448 finished with value: 0.8421052631578947 and parameters: {'criterion': 'gini', 'n_estimators': 190, 'max_features': 0.671544353036312, 'max_depth': 98, 'min_samples_split': 3, 'min_samples_leaf': 3}. Best is trial 70 with value: 0.8695652173913043.
[32m[I 2023-04-26 00:20:20,385][39m Trial 449 finished with value: 0.823529411764706 and parameters: {'criterion': 'gini', 'n_estimators': 198, 'max_features': 0.9776838549308036, 'max_depth': 89, 'min_samples_split': 8, 'min_samples_leaf': 6}. Best is trial 70 with value: 0.8695652173913043.
[32m[I 2023-04-26 00:20:20,538][39m Trial 450 finished with value: 0.8392857142857144 and parameters: {'criterion': 'entropy', 'n_estimators': 126, 'max_features': 0.9575480384414055, 'max_depth': 15, 'min_samples_split': 3, 'min_samples_leaf': 3}. Best is trial 70 with value: 0.8695652173913043.
[32m[I 2023-04-26 00:20:20,667][39m Trial 451 finished with value: 0.8547008547008546 and parameters: {'criterion': 'gini', 'n_estimators': 144, 'max_features': 0.5419630522665255, 'max_depth': 98, 'min_samples_split': 3, 'min_samples_leaf': 4}. Best is trial 70 with value: 0.8695652173913043.
[32m[I 2023-04-26 00:20:20,829][39m Trial 452 finished with value: 0.8305084745762712 and parameters: {'criterion': 'gini', 'n_estimators': 187, 'max_features': 0.6541306652757404, 'max_depth': 95, 'min_samples_split': 2, 'min_samples_leaf': 4}. Best is trial 70 with value: 0.8695652173913043.
[32m[I 2023-04-26 00:20:20,952][39m Trial 453 finished with value: 0.8264462809917354 and parameters: {'criterion': 'gini', 'n_estimators': 120, 'max_features': 0.8388517185002878, 'max_depth': 6, 'min_samples_split': 2, 'min_samples_leaf': 9}. Best is trial 70 with value: 0.8695652173913043.
[32m[I 2023-04-26 00:20:21,096][39m Trial 454 finished with value: 0.8695652173913043 and parameters: {'criterion': 'gini', 'n_estimators': 134, 'max_features': 0.8094046781158594, 'max_depth': 10, 'min_samples_split': 4, 'min_samples_leaf': 3}. Best is trial 70 with value: 0.8695652173913043.
[32m[I 2023-04-26 00:20:21,225][39m Trial 455 finished with value: 0.8571428571428572 and parameters: {'criterion': 'gini', 'n_estimators': 129, 'max_features': 0.8050510993662998, 'max_depth': 9, 'min_samples_split': 7, 'min_samples_leaf': 3}. Best is trial 70 with value: 0.8695652173913043.
[32m[I 2023-04-26 00:20:21,300][39m Trial 456 finished with value: 0.8547008547008546 and parameters: {'criterion': 'gini', 'n_estimators': 65, 'max_features': 0.7878840140496464, 'max_depth': 5, 'min_samples_split': 4, 'min_samples_leaf': 3}. Best is trial 70 with value: 0.8695652173913043.
[32m[I 2023-04-26 00:20:21,417][39m Trial 457 finished with value: 0.8468468468468469 and parameters: {'criterion': 'gini', 'n_estimators': 115, 'max_features': 0.8222342236691699, 'max_depth': 10, 'min_samples_split': 4, 'min_samples_leaf': 3}. Best is trial 70 with value: 0.8695652173913043.
[32m[I 2023-04-26 00:20:21,575][39m Trial 458 finished with value: 0.8596491228070176 and parameters: {'criterion': 'entropy', 'n_estimators': 135, 'max_features': 0.936657989479911, 'max_depth': 83, 'min_samples_split': 7, 'min_samples_leaf': 3}. Best is trial 70 with value: 0.8695652173913043.
[32m[I 2023-04-26 00:20:21,699][39m Trial 459 finished with value: 0.8196721311475409 and parameters: {'criterion': 'gini', 'n_estimators': 140, 'max_features': 0.7602140481283752, 'max_depth': 3, 'min_samples_split': 7, 'min_samples_leaf': 3}. Best is trial 70 with value: 0.8695652173913043.
[32m[I 2023-04-26 00:20:21,767][39m Trial 460 finished with value: 0.8264462809917354 and parameters: {'criterion': 'gini', 'n_estimators': 68, 'max_features': 0.6989204976130033, 'max_depth': 101, 'min_samples_split': 3, 'min_samples_leaf': 9}. Best is trial 70 with value: 0.8695652173913043.
[32m[I 2023-04-26 00:20:21,896][39m Trial 461 finished with value: 0.8392857142857144 and parameters: {'criterion': 'gini', 'n_estimators': 131, 'max_features': 0.6354501700068891, 'max_depth': 98, 'min_samples_split': 4, 'min_samples_leaf': 3}. Best is trial 70 with value: 0.8695652173913043.
[32m[I 2023-04-26 00:20:22,034][39m Trial 462 finished with value: 0.8571428571428572 and parameters: {'criterion': 'gini', 'n_estimators': 134, 'max_features': 0.8684858996014494, 'max_depth': 101, 'min_samples_split': 3, 'min_samples_leaf': 3}. Best is trial 70 with value: 0.8695652173913043.
[32m[I 2023-04-26 00:20:22,158][39m Trial 463 finished with value: 0.8421052631578947 and parameters: {'criterion': 'gini', 'n_estimators': 123, 'max_features': 0.7818212187317461, 'max_depth': 43, 'min_samples_split': 7, 'min_samples_leaf': 3}. Best is trial 70 with value: 0.8695652173913043.
[32m[I 2023-04-26 00:20:22,267][39m Trial 464 finished with value: 0.8672566371681416 and parameters: {'criterion': 'gini', 'n_estimators': 111, 'max_features': 0.6864377301365929, 'max_depth': 7, 'min_samples_split': 3, 'min_samples_leaf': 3}. Best is trial 70 with value: 0.8695652173913043.
[32m[I 2023-04-26 00:20:22,383][39m Trial 465 finished with value: 0.8347826086956522 and parameters: {'criterion': 'gini', 'n_estimators': 111, 'max_features': 0.7298791878485269, 'max_depth': 7, 'min_samples_split': 8, 'min_samples_leaf': 3}. Best is trial 70 with value: 0.8695652173913043.
[32m[I 2023-04-26 00:20:22,510][39m Trial 466 finished with value: 0.8495575221238938 and parameters: {'criterion': 'entropy', 'n_estimators': 138, 'max_features': 0.41927268907514104, 'max_depth': 9, 'min_samples_split': 8, 'min_samples_leaf': 3}. Best is trial 70 with value: 0.8695652173913043.
[32m[I 2023-04-26 00:20:22,626][39m Trial 467 finished with value: 0.8333333333333334 and parameters: {'criterion': 'gini', 'n_estimators': 114, 'max_features': 0.6784378122695903, 'max_depth': 11, 'min_samples_split': 4, 'min_samples_leaf': 6}. Best is trial 70 with value: 0.8695652173913043.
[32m[I 2023-04-26 00:20:22,758][39m Trial 468 finished with value: 0.8571428571428572 and parameters: {'criterion': 'gini', 'n_estimators': 147, 'max_features': 0.5586244975808956, 'max_depth': 6, 'min_samples_split': 5, 'min_samples_leaf': 3}. Best is trial 70 with value: 0.8695652173913043.
[32m[I 2023-04-26 00:20:22,848][39m Trial 469 finished with value: 0.7534246575342466 and parameters: {'criterion': 'gini', 'n_estimators': 108, 'max_features': 0.947668875506626, 'max_depth': 1, 'min_samples_split': 2, 'min_samples_leaf': 3}. Best is trial 70 with value: 0.8695652173913043.
[32m[I 2023-04-26 00:20:22,956][39m Trial 470 finished with value: 0.8571428571428572 and parameters: {'criterion': 'gini', 'n_estimators': 118, 'max_features': 0.44817794380928155, 'max_depth': 8, 'min_samples_split': 4, 'min_samples_leaf': 3}. Best is trial 70 with value: 0.8695652173913043.
[32m[I 2023-04-26 00:20:23,056][39m Trial 471 finished with value: 0.8196721311475409 and parameters: {'criterion': 'gini', 'n_estimators': 110, 'max_features': 0.6857139577488494, 'max_depth': 3, 'min_samples_split': 3, 'min_samples_leaf': 3}. Best is trial 70 with value: 0.8695652173913043.
[32m[I 2023-04-26 00:20:23,168][39m Trial 472 finished with value: 0.8421052631578947 and parameters: {'criterion': 'gini', 'n_estimators': 112, 'max_features': 0.7020879592021383, 'max_depth': 8, 'min_samples_split': 7, 'min_samples_leaf': 3}. Best is trial 70 with value: 0.8695652173913043.
[32m[I 2023-04-26 00:20:23,282][39m Trial 473 finished with value: 0.8596491228070176 and parameters: {'criterion': 'gini', 'n_estimators': 115, 'max_features': 0.6671735206308127, 'max_depth': 12, 'min_samples_split': 5, 'min_samples_leaf': 3}. Best is trial 70 with value: 0.8695652173913043.
[32m[I 2023-04-26 00:20:23,397][39m Trial 474 finished with value: 0.8363636363636363 and parameters: {'criterion': 'gini', 'n_estimators': 120, 'max_features': 0.6888565009167502, 'max_depth': 5, 'min_samples_split': 3, 'min_samples_leaf': 3}. Best is trial 70 with value: 0.8695652173913043.
[32m[I 2023-04-26 00:20:23,537][39m Trial 475 finished with value: 0.8672566371681416 and parameters: {'criterion': 'entropy', 'n_estimators': 125, 'max_features': 0.7103849999438582, 'max_depth': 10, 'min_samples_split': 3, 'min_samples_leaf': 3}. Best is trial 70 with value: 0.8695652173913043.
[32m[I 2023-04-26 00:20:23,679][39m Trial 476 finished with value: 0.8363636363636363 and parameters: {'criterion': 'entropy', 'n_estimators': 125, 'max_features': 0.828783549061246, 'max_depth': 14, 'min_samples_split': 4, 'min_samples_leaf': 3}. Best is trial 70 with value: 0.8695652173913043.
[32m[I 2023-04-26 00:20:23,809][39m Trial 477 finished with value: 0.8288288288288289 and parameters: {'criterion': 'entropy', 'n_estimators': 127, 'max_features': 0.7119991022495769, 'max_depth': 10, 'min_samples_split': 3, 'min_samples_leaf': 3}. Best is trial 70 with value: 0.8695652173913043.
[32m[I 2023-04-26 00:20:23,947][39m Trial 478 finished with value: 0.8495575221238938 and parameters: {'criterion': 'entropy', 'n_estimators': 122, 'max_features': 0.7141956514385103, 'max_depth': 7, 'min_samples_split': 3, 'min_samples_leaf': 3}. Best is trial 70 with value: 0.8695652173913043.
[32m[I 2023-04-26 00:20:24,079][39m Trial 479 finished with value: 0.8448275862068967 and parameters: {'criterion': 'gini', 'n_estimators': 133, 'max_features': 0.7511448394138783, 'max_depth': 11, 'min_samples_split': 3, 'min_samples_leaf': 3}. Best is trial 70 with value: 0.8695652173913043.
[32m[I 2023-04-26 00:20:24,205][39m Trial 480 finished with value: 0.8596491228070176 and parameters: {'criterion': 'entropy', 'n_estimators': 117, 'max_features': 0.73885309107505, 'max_depth': 9, 'min_samples_split': 6, 'min_samples_leaf': 3}. Best is trial 70 with value: 0.8695652173913043.
[32m[I 2023-04-26 00:20:24,353][39m Trial 481 finished with value: 0.8245614035087718 and parameters: {'criterion': 'entropy', 'n_estimators': 124, 'max_features': 0.8011553622172211, 'max_depth': 14, 'min_samples_split': 4, 'min_samples_leaf': 2}. Best is trial 70 with value: 0.8695652173913043.
[32m[I 2023-04-26 00:20:24,511][39m Trial 482 finished with value: 0.8347826086956522 and parameters: {'criterion': 'entropy', 'n_estimators': 152, 'max_features': 0.7695019582257624, 'max_depth': 5, 'min_samples_split': 7, 'min_samples_leaf': 3}. Best is trial 70 with value: 0.8695652173913043.
[32m[I 2023-04-26 00:20:24,646][39m Trial 483 finished with value: 0.8495575221238938 and parameters: {'criterion': 'entropy', 'n_estimators': 121, 'max_features': 0.724613696835659, 'max_depth': 15, 'min_samples_split': 3, 'min_samples_leaf': 3}. Best is trial 70 with value: 0.8695652173913043.
[32m[I 2023-04-26 00:20:24,784][39m Trial 484 finished with value: 0.8495575221238938 and parameters: {'criterion': 'entropy', 'n_estimators': 127, 'max_features': 0.7392847620772671, 'max_depth': 12, 'min_samples_split': 7, 'min_samples_leaf': 3}. Best is trial 70 with value: 0.8695652173913043.
[32m[I 2023-04-26 00:20:24,872][39m Trial 485 finished with value: 0.8363636363636363 and parameters: {'criterion': 'entropy', 'n_estimators': 73, 'max_features': 0.7102037988403634, 'max_depth': 17, 'min_samples_split': 3, 'min_samples_leaf': 3}. Best is trial 70 with value: 0.8695652173913043.
[32m[I 2023-04-26 00:20:24,976][39m Trial 486 finished with value: 0.8672566371681416 and parameters: {'criterion': 'entropy', 'n_estimators': 87, 'max_features': 0.6953408867721307, 'max_depth': 21, 'min_samples_split': 6, 'min_samples_leaf': 3}. Best is trial 70 with value: 0.8695652173913043.
[32m[I 2023-04-26 00:20:25,082][39m Trial 487 finished with value: 0.8495575221238938 and parameters: {'criterion': 'entropy', 'n_estimators': 92, 'max_features': 0.6896106340876734, 'max_depth': 23, 'min_samples_split': 6, 'min_samples_leaf': 3}. Best is trial 70 with value: 0.8695652173913043.
[32m[I 2023-04-26 00:20:25,186][39m Trial 488 finished with value: 0.8245614035087718 and parameters: {'criterion': 'entropy', 'n_estimators': 86, 'max_features': 0.7043932955909503, 'max_depth': 19, 'min_samples_split': 6, 'min_samples_leaf': 2}. Best is trial 70 with value: 0.8695652173913043.
[32m[I 2023-04-26 00:20:25,283][39m Trial 489 finished with value: 0.8495575221238938 and parameters: {'criterion': 'entropy', 'n_estimators': 81, 'max_features': 0.7144132112624306, 'max_depth': 30, 'min_samples_split': 6, 'min_samples_leaf': 3}. Best is trial 70 with value: 0.8695652173913043.
[32m[I 2023-04-26 00:20:25,388][39m Trial 490 finished with value: 0.8141592920353982 and parameters: {'criterion': 'entropy', 'n_estimators': 89, 'max_features': 0.7679403003188665, 'max_depth': 19, 'min_samples_split': 6, 'min_samples_leaf': 3}. Best is trial 70 with value: 0.8695652173913043.
[32m[I 2023-04-26 00:20:25,512][39m Trial 491 finished with value: 0.8571428571428572 and parameters: {'criterion': 'entropy', 'n_estimators': 111, 'max_features': 0.7500615454913948, 'max_depth': 9, 'min_samples_split': 6, 'min_samples_leaf': 3}. Best is trial 70 with value: 0.8695652173913043.
[32m[I 2023-04-26 00:20:25,625][39m Trial 492 finished with value: 0.8448275862068967 and parameters: {'criterion': 'entropy', 'n_estimators': 94, 'max_features': 0.6871491124935225, 'max_depth': 25, 'min_samples_split': 6, 'min_samples_leaf': 3}. Best is trial 70 with value: 0.8695652173913043.
[32m[I 2023-04-26 00:20:25,766][39m Trial 493 finished with value: 0.8495575221238938 and parameters: {'criterion': 'entropy', 'n_estimators': 127, 'max_features': 0.7659308347139724, 'max_depth': 21, 'min_samples_split': 5, 'min_samples_leaf': 3}. Best is trial 70 with value: 0.8695652173913043.
[32m[I 2023-04-26 00:20:25,900][39m Trial 494 finished with value: 0.8495575221238938 and parameters: {'criterion': 'entropy', 'n_estimators': 117, 'max_features': 0.7287950619539207, 'max_depth': 12, 'min_samples_split': 4, 'min_samples_leaf': 2}. Best is trial 70 with value: 0.8695652173913043.
[32m[I 2023-04-26 00:20:26,033][39m Trial 495 finished with value: 0.8333333333333334 and parameters: {'criterion': 'entropy', 'n_estimators': 132, 'max_features': 0.7548117771154429, 'max_depth': 55, 'min_samples_split': 6, 'min_samples_leaf': 11}. Best is trial 70 with value: 0.8695652173913043.
[32m[I 2023-04-26 00:20:26,123][39m Trial 496 finished with value: 0.823529411764706 and parameters: {'criterion': 'entropy', 'n_estimators': 76, 'max_features': 0.7781993838914183, 'max_depth': 22, 'min_samples_split': 5, 'min_samples_leaf': 7}. Best is trial 70 with value: 0.8695652173913043.
[32m[I 2023-04-26 00:20:26,256][39m Trial 497 finished with value: 0.8181818181818181 and parameters: {'criterion': 'entropy', 'n_estimators': 114, 'max_features': 0.7888808351143611, 'max_depth': 24, 'min_samples_split': 2, 'min_samples_leaf': 3}. Best is trial 70 with value: 0.8695652173913043.
[32m[I 2023-04-26 00:20:26,384][39m Trial 498 finished with value: 0.8181818181818181 and parameters: {'criterion': 'entropy', 'n_estimators': 105, 'max_features': 0.8919874699814498, 'max_depth': 8, 'min_samples_split': 2, 'min_samples_leaf': 3}. Best is trial 70 with value: 0.8695652173913043.
[32m[I 2023-04-26 00:20:26,504][39m Trial 499 finished with value: 0.8421052631578947 and parameters: {'criterion': 'gini', 'n_estimators': 121, 'max_features': 0.6939293556435859, 'max_depth': 16, 'min_samples_split': 6, 'min_samples_leaf': 3}. Best is trial 70 with value: 0.8695652173913043.
Number of finished trials: 500