[32m[I 2023-04-26 00:19:23,676][39m A new study created in memory with name: no-name-4c377032-194c-424c-b47f-714e5df00f03
[32m[I 2023-04-26 00:19:23,739][39m Trial 0 finished with value: 0.8571428571428572 and parameters: {'criterion': 'entropy', 'n_estimators': 61, 'max_features': 0.7529273332429413, 'max_depth': 31, 'min_samples_split': 10, 'min_samples_leaf': 9}. Best is trial 0 with value: 0.8571428571428572.
[32m[I 2023-04-26 00:19:23,823][39m Trial 1 finished with value: 0.8333333333333334 and parameters: {'criterion': 'entropy', 'n_estimators': 86, 'max_features': 0.7491002404248417, 'max_depth': 91, 'min_samples_split': 2, 'min_samples_leaf': 8}. Best is trial 0 with value: 0.8571428571428572.
[32m[I 2023-04-26 00:19:23,898][39m Trial 2 finished with value: 0.8347826086956522 and parameters: {'criterion': 'entropy', 'n_estimators': 81, 'max_features': 0.592710846008499, 'max_depth': 77, 'min_samples_split': 3, 'min_samples_leaf': 4}. Best is trial 0 with value: 0.8571428571428572.
[32m[I 2023-04-26 00:19:23,972][39m Trial 3 finished with value: 0.8521739130434783 and parameters: {'criterion': 'gini', 'n_estimators': 93, 'max_features': 0.5389984718608141, 'max_depth': 51, 'min_samples_split': 5, 'min_samples_leaf': 8}. Best is trial 0 with value: 0.8571428571428572.
[32m[I 2023-04-26 00:19:24,045][39m Trial 4 finished with value: 0.8547008547008546 and parameters: {'criterion': 'entropy', 'n_estimators': 86, 'max_features': 0.5152104641399047, 'max_depth': 18, 'min_samples_split': 10, 'min_samples_leaf': 9}. Best is trial 0 with value: 0.8571428571428572.
[32m[I 2023-04-26 00:19:24,172][39m Trial 5 finished with value: 0.8214285714285715 and parameters: {'criterion': 'gini', 'n_estimators': 172, 'max_features': 0.31288289194043173, 'max_depth': 39, 'min_samples_split': 2, 'min_samples_leaf': 3}. Best is trial 0 with value: 0.8571428571428572.
[32m[I 2023-04-26 00:19:24,254][39m Trial 6 finished with value: 0.8596491228070176 and parameters: {'criterion': 'gini', 'n_estimators': 98, 'max_features': 0.5935909454236035, 'max_depth': 26, 'min_samples_split': 6, 'min_samples_leaf': 2}. Best is trial 6 with value: 0.8596491228070176.
[32m[I 2023-04-26 00:19:24,334][39m Trial 7 finished with value: 0.8468468468468469 and parameters: {'criterion': 'entropy', 'n_estimators': 89, 'max_features': 0.39594957326989677, 'max_depth': 25, 'min_samples_split': 2, 'min_samples_leaf': 1}. Best is trial 6 with value: 0.8596491228070176.
[32m[I 2023-04-26 00:19:24,387][39m Trial 8 finished with value: 0.8376068376068375 and parameters: {'criterion': 'entropy', 'n_estimators': 55, 'max_features': 0.7560848998736209, 'max_depth': 73, 'min_samples_split': 6, 'min_samples_leaf': 9}. Best is trial 6 with value: 0.8596491228070176.
[32m[I 2023-04-26 00:19:24,494][39m Trial 9 finished with value: 0.7943262411347517 and parameters: {'criterion': 'entropy', 'n_estimators': 182, 'max_features': 0.053549934491406104, 'max_depth': 1, 'min_samples_split': 8, 'min_samples_leaf': 9}. Best is trial 6 with value: 0.8596491228070176.
[32m[I 2023-04-26 00:19:24,619][39m Trial 10 finished with value: 0.823529411764706 and parameters: {'criterion': 'gini', 'n_estimators': 132, 'max_features': 0.9826057904743506, 'max_depth': 5, 'min_samples_split': 8, 'min_samples_leaf': 5}. Best is trial 6 with value: 0.8596491228070176.
[32m[I 2023-04-26 00:19:24,670][39m Trial 11 finished with value: 0.8264462809917354 and parameters: {'criterion': 'gini', 'n_estimators': 51, 'max_features': 0.8108441389772099, 'max_depth': 34, 'min_samples_split': 11, 'min_samples_leaf': 11}. Best is trial 6 with value: 0.8596491228070176.
[32m[I 2023-04-26 00:19:24,798][39m Trial 12 finished with value: 0.8421052631578947 and parameters: {'criterion': 'gini', 'n_estimators': 127, 'max_features': 0.9500212949169504, 'max_depth': 51, 'min_samples_split': 8, 'min_samples_leaf': 1}. Best is trial 6 with value: 0.8596491228070176.
[32m[I 2023-04-26 00:19:24,897][39m Trial 13 finished with value: 0.864406779661017 and parameters: {'criterion': 'gini', 'n_estimators': 113, 'max_features': 0.6593439186351816, 'max_depth': 21, 'min_samples_split': 5, 'min_samples_leaf': 6}. Best is trial 13 with value: 0.864406779661017.
[32m[I 2023-04-26 00:19:25,009][39m Trial 14 finished with value: 0.8421052631578947 and parameters: {'criterion': 'gini', 'n_estimators': 146, 'max_features': 0.2379652875157539, 'max_depth': 17, 'min_samples_split': 5, 'min_samples_leaf': 6}. Best is trial 13 with value: 0.864406779661017.
[32m[I 2023-04-26 00:19:25,110][39m Trial 15 finished with value: 0.8571428571428572 and parameters: {'criterion': 'gini', 'n_estimators': 111, 'max_features': 0.6213704447234414, 'max_depth': 13, 'min_samples_split': 4, 'min_samples_leaf': 3}. Best is trial 13 with value: 0.864406779661017.
[32m[I 2023-04-26 00:19:25,204][39m Trial 16 finished with value: 0.8440366972477066 and parameters: {'criterion': 'gini', 'n_estimators': 111, 'max_features': 0.4150000120755245, 'max_depth': 43, 'min_samples_split': 7, 'min_samples_leaf': 2}. Best is trial 13 with value: 0.864406779661017.
[32m[I 2023-04-26 00:19:25,332][39m Trial 17 finished with value: 0.8305084745762712 and parameters: {'criterion': 'gini', 'n_estimators': 146, 'max_features': 0.6753239891364564, 'max_depth': 22, 'min_samples_split': 6, 'min_samples_leaf': 6}. Best is trial 13 with value: 0.864406779661017.
[32m[I 2023-04-26 00:19:25,443][39m Trial 18 finished with value: 0.8421052631578947 and parameters: {'criterion': 'gini', 'n_estimators': 115, 'max_features': 0.8844881059489881, 'max_depth': 63, 'min_samples_split': 4, 'min_samples_leaf': 4}. Best is trial 13 with value: 0.864406779661017.
[32m[I 2023-04-26 00:19:25,552][39m Trial 19 finished with value: 0.8214285714285715 and parameters: {'criterion': 'gini', 'n_estimators': 158, 'max_features': 0.15592152807874093, 'max_depth': 10, 'min_samples_split': 7, 'min_samples_leaf': 7}. Best is trial 13 with value: 0.864406779661017.
[32m[I 2023-04-26 00:19:25,612][39m Trial 20 finished with value: 0.847457627118644 and parameters: {'criterion': 'gini', 'n_estimators': 69, 'max_features': 0.42773849420748267, 'max_depth': 101, 'min_samples_split': 5, 'min_samples_leaf': 11}. Best is trial 13 with value: 0.864406779661017.
[32m[I 2023-04-26 00:19:25,711][39m Trial 21 finished with value: 0.8264462809917354 and parameters: {'criterion': 'entropy', 'n_estimators': 103, 'max_features': 0.6947231706509667, 'max_depth': 30, 'min_samples_split': 10, 'min_samples_leaf': 10}. Best is trial 13 with value: 0.864406779661017.
[32m[I 2023-04-26 00:19:25,786][39m Trial 22 finished with value: 0.8500000000000001 and parameters: {'criterion': 'entropy', 'n_estimators': 68, 'max_features': 0.8301329513954657, 'max_depth': 41, 'min_samples_split': 9, 'min_samples_leaf': 7}. Best is trial 13 with value: 0.864406779661017.
[32m[I 2023-04-26 00:19:25,860][39m Trial 23 finished with value: 0.8103448275862069 and parameters: {'criterion': 'entropy', 'n_estimators': 70, 'max_features': 0.6318146462263148, 'max_depth': 29, 'min_samples_split': 6, 'min_samples_leaf': 5}. Best is trial 13 with value: 0.864406779661017.
[32m[I 2023-04-26 00:19:25,947][39m Trial 24 finished with value: 0.8333333333333334 and parameters: {'criterion': 'gini', 'n_estimators': 102, 'max_features': 0.5487481573323031, 'max_depth': 52, 'min_samples_split': 4, 'min_samples_leaf': 7}. Best is trial 13 with value: 0.864406779661017.
[32m[I 2023-04-26 00:19:26,070][39m Trial 25 finished with value: 0.8547008547008546 and parameters: {'criterion': 'gini', 'n_estimators': 137, 'max_features': 0.7389467225728993, 'max_depth': 35, 'min_samples_split': 7, 'min_samples_leaf': 5}. Best is trial 13 with value: 0.864406779661017.
[32m[I 2023-04-26 00:19:26,199][39m Trial 26 finished with value: 0.8495575221238938 and parameters: {'criterion': 'entropy', 'n_estimators': 117, 'max_features': 0.880155664408054, 'max_depth': 24, 'min_samples_split': 11, 'min_samples_leaf': 2}. Best is trial 13 with value: 0.864406779661017.
[32m[I 2023-04-26 00:19:26,293][39m Trial 27 finished with value: 0.8547008547008546 and parameters: {'criterion': 'gini', 'n_estimators': 102, 'max_features': 0.6194826340621127, 'max_depth': 12, 'min_samples_split': 4, 'min_samples_leaf': 3}. Best is trial 13 with value: 0.864406779661017.
[32m[I 2023-04-26 00:19:26,396][39m Trial 28 finished with value: 0.8288288288288289 and parameters: {'criterion': 'gini', 'n_estimators': 122, 'max_features': 0.44684814006900975, 'max_depth': 10, 'min_samples_split': 3, 'min_samples_leaf': 2}. Best is trial 13 with value: 0.864406779661017.
[32m[I 2023-04-26 00:19:26,465][39m Trial 29 finished with value: 0.8333333333333334 and parameters: {'criterion': 'entropy', 'n_estimators': 62, 'max_features': 0.7785945391992133, 'max_depth': 58, 'min_samples_split': 9, 'min_samples_leaf': 8}. Best is trial 13 with value: 0.864406779661017.
[32m[I 2023-04-26 00:19:26,640][39m Trial 30 finished with value: 0.8166666666666667 and parameters: {'criterion': 'entropy', 'n_estimators': 195, 'max_features': 0.7038082524252085, 'max_depth': 45, 'min_samples_split': 5, 'min_samples_leaf': 10}. Best is trial 13 with value: 0.864406779661017.
[32m[I 2023-04-26 00:19:26,716][39m Trial 31 finished with value: 0.8596491228070176 and parameters: {'criterion': 'gini', 'n_estimators': 81, 'max_features': 0.6316141973505772, 'max_depth': 15, 'min_samples_split': 4, 'min_samples_leaf': 3}. Best is trial 13 with value: 0.864406779661017.
[32m[I 2023-04-26 00:19:26,788][39m Trial 32 finished with value: 0.8421052631578947 and parameters: {'criterion': 'gini', 'n_estimators': 77, 'max_features': 0.5660196518618832, 'max_depth': 18, 'min_samples_split': 3, 'min_samples_leaf': 1}. Best is trial 13 with value: 0.864406779661017.
[32m[I 2023-04-26 00:19:26,862][39m Trial 33 finished with value: 0.8547008547008546 and parameters: {'criterion': 'gini', 'n_estimators': 79, 'max_features': 0.6757437046382402, 'max_depth': 27, 'min_samples_split': 6, 'min_samples_leaf': 4}. Best is trial 13 with value: 0.864406779661017.
[32m[I 2023-04-26 00:19:26,945][39m Trial 34 finished with value: 0.8521739130434783 and parameters: {'criterion': 'gini', 'n_estimators': 93, 'max_features': 0.4819743998355245, 'max_depth': 32, 'min_samples_split': 5, 'min_samples_leaf': 4}. Best is trial 13 with value: 0.864406779661017.
[32m[I 2023-04-26 00:19:27,023][39m Trial 35 finished with value: 0.8468468468468469 and parameters: {'criterion': 'gini', 'n_estimators': 82, 'max_features': 0.5151212699625669, 'max_depth': 20, 'min_samples_split': 3, 'min_samples_leaf': 2}. Best is trial 13 with value: 0.864406779661017.
[32m[I 2023-04-26 00:19:27,103][39m Trial 36 finished with value: 0.7812500000000001 and parameters: {'criterion': 'entropy', 'n_estimators': 96, 'max_features': 0.5806401250997889, 'max_depth': 2, 'min_samples_split': 5, 'min_samples_leaf': 3}. Best is trial 13 with value: 0.864406779661017.
[32m[I 2023-04-26 00:19:27,195][39m Trial 37 finished with value: 0.8495575221238938 and parameters: {'criterion': 'gini', 'n_estimators': 110, 'max_features': 0.36457078801402076, 'max_depth': 13, 'min_samples_split': 4, 'min_samples_leaf': 3}. Best is trial 13 with value: 0.864406779661017.
[32m[I 2023-04-26 00:19:27,259][39m Trial 38 finished with value: 0.8547008547008546 and parameters: {'criterion': 'entropy', 'n_estimators': 56, 'max_features': 0.8356859762719915, 'max_depth': 35, 'min_samples_split': 2, 'min_samples_leaf': 8}. Best is trial 13 with value: 0.864406779661017.
[32m[I 2023-04-26 00:19:27,349][39m Trial 39 finished with value: 0.8376068376068375 and parameters: {'criterion': 'gini', 'n_estimators': 89, 'max_features': 0.7359828411567244, 'max_depth': 6, 'min_samples_split': 6, 'min_samples_leaf': 5}. Best is trial 13 with value: 0.864406779661017.
[32m[I 2023-04-26 00:19:27,422][39m Trial 40 finished with value: 0.8333333333333334 and parameters: {'criterion': 'entropy', 'n_estimators': 76, 'max_features': 0.6246077878248636, 'max_depth': 25, 'min_samples_split': 9, 'min_samples_leaf': 10}. Best is trial 13 with value: 0.864406779661017.
[32m[I 2023-04-26 00:19:27,514][39m Trial 41 finished with value: 0.8521739130434783 and parameters: {'criterion': 'gini', 'n_estimators': 98, 'max_features': 0.663937312717811, 'max_depth': 15, 'min_samples_split': 4, 'min_samples_leaf': 3}. Best is trial 13 with value: 0.864406779661017.
[32m[I 2023-04-26 00:19:27,608][39m Trial 42 finished with value: 0.8392857142857144 and parameters: {'criterion': 'gini', 'n_estimators': 108, 'max_features': 0.48466150386010165, 'max_depth': 8, 'min_samples_split': 5, 'min_samples_leaf': 2}. Best is trial 13 with value: 0.864406779661017.
[32m[I 2023-04-26 00:19:27,712][39m Trial 43 finished with value: 0.8448275862068967 and parameters: {'criterion': 'gini', 'n_estimators': 120, 'max_features': 0.5998075362965918, 'max_depth': 19, 'min_samples_split': 4, 'min_samples_leaf': 4}. Best is trial 13 with value: 0.864406779661017.
[32m[I 2023-04-26 00:19:27,797][39m Trial 44 finished with value: 0.8245614035087718 and parameters: {'criterion': 'gini', 'n_estimators': 84, 'max_features': 0.7804413005705446, 'max_depth': 15, 'min_samples_split': 3, 'min_samples_leaf': 1}. Best is trial 13 with value: 0.864406779661017.
[32m[I 2023-04-26 00:19:27,856][39m Trial 45 finished with value: 0.831858407079646 and parameters: {'criterion': 'gini', 'n_estimators': 60, 'max_features': 0.5341596751314048, 'max_depth': 37, 'min_samples_split': 7, 'min_samples_leaf': 3}. Best is trial 13 with value: 0.864406779661017.
[32m[I 2023-04-26 00:19:27,972][39m Trial 46 finished with value: 0.8448275862068967 and parameters: {'criterion': 'gini', 'n_estimators': 132, 'max_features': 0.650439217909276, 'max_depth': 22, 'min_samples_split': 2, 'min_samples_leaf': 6}. Best is trial 13 with value: 0.864406779661017.
[32m[I 2023-04-26 00:19:28,054][39m Trial 47 finished with value: 0.8521739130434783 and parameters: {'criterion': 'gini', 'n_estimators': 93, 'max_features': 0.7199892618947328, 'max_depth': 4, 'min_samples_split': 8, 'min_samples_leaf': 9}. Best is trial 13 with value: 0.864406779661017.
[32m[I 2023-04-26 00:19:28,130][39m Trial 48 finished with value: 0.8214285714285715 and parameters: {'criterion': 'gini', 'n_estimators': 87, 'max_features': 0.3391725529247745, 'max_depth': 73, 'min_samples_split': 5, 'min_samples_leaf': 1}. Best is trial 13 with value: 0.864406779661017.
[32m[I 2023-04-26 00:19:28,210][39m Trial 49 finished with value: 0.8333333333333334 and parameters: {'criterion': 'entropy', 'n_estimators': 73, 'max_features': 0.9078025939156692, 'max_depth': 26, 'min_samples_split': 6, 'min_samples_leaf': 8}. Best is trial 13 with value: 0.864406779661017.
[32m[I 2023-04-26 00:19:28,331][39m Trial 50 finished with value: 0.847457627118644 and parameters: {'criterion': 'gini', 'n_estimators': 127, 'max_features': 0.7862778063594172, 'max_depth': 45, 'min_samples_split': 10, 'min_samples_leaf': 6}. Best is trial 13 with value: 0.864406779661017.
[32m[I 2023-04-26 00:19:28,395][39m Trial 51 finished with value: 0.847457627118644 and parameters: {'criterion': 'entropy', 'n_estimators': 56, 'max_features': 0.8587532632281097, 'max_depth': 32, 'min_samples_split': 2, 'min_samples_leaf': 9}. Best is trial 13 with value: 0.864406779661017.
[32m[I 2023-04-26 00:19:28,469][39m Trial 52 finished with value: 0.8376068376068375 and parameters: {'criterion': 'entropy', 'n_estimators': 64, 'max_features': 0.930544858552122, 'max_depth': 37, 'min_samples_split': 2, 'min_samples_leaf': 7}. Best is trial 13 with value: 0.864406779661017.
[32m[I 2023-04-26 00:19:28,568][39m Trial 53 finished with value: 0.8547008547008546 and parameters: {'criterion': 'entropy', 'n_estimators': 106, 'max_features': 0.5636103539874273, 'max_depth': 17, 'min_samples_split': 10, 'min_samples_leaf': 9}. Best is trial 13 with value: 0.864406779661017.
[32m[I 2023-04-26 00:19:28,624][39m Trial 54 finished with value: 0.8448275862068967 and parameters: {'criterion': 'entropy', 'n_estimators': 50, 'max_features': 0.8271473476891956, 'max_depth': 30, 'min_samples_split': 4, 'min_samples_leaf': 8}. Best is trial 13 with value: 0.864406779661017.
[32m[I 2023-04-26 00:19:28,687][39m Trial 55 finished with value: 0.8264462809917354 and parameters: {'criterion': 'entropy', 'n_estimators': 58, 'max_features': 0.6887684237917222, 'max_depth': 21, 'min_samples_split': 3, 'min_samples_leaf': 8}. Best is trial 13 with value: 0.864406779661017.
[32m[I 2023-04-26 00:19:28,787][39m Trial 56 finished with value: 0.8264462809917354 and parameters: {'criterion': 'entropy', 'n_estimators': 107, 'max_features': 0.5949768824897227, 'max_depth': 85, 'min_samples_split': 11, 'min_samples_leaf': 10}. Best is trial 13 with value: 0.864406779661017.
[32m[I 2023-04-26 00:19:28,883][39m Trial 57 finished with value: 0.8448275862068967 and parameters: {'criterion': 'gini', 'n_estimators': 100, 'max_features': 0.6307389788971389, 'max_depth': 13, 'min_samples_split': 4, 'min_samples_leaf': 4}. Best is trial 13 with value: 0.864406779661017.
[32m[I 2023-04-26 00:19:28,981][39m Trial 58 finished with value: 0.8672566371681416 and parameters: {'criterion': 'gini', 'n_estimators': 115, 'max_features': 0.4524000417365669, 'max_depth': 11, 'min_samples_split': 4, 'min_samples_leaf': 3}. Best is trial 58 with value: 0.8672566371681416.
[32m[I 2023-04-26 00:19:29,070][39m Trial 59 finished with value: 0.8363636363636363 and parameters: {'criterion': 'gini', 'n_estimators': 113, 'max_features': 0.25414794105854976, 'max_depth': 8, 'min_samples_split': 6, 'min_samples_leaf': 2}. Best is trial 58 with value: 0.8672566371681416.
[32m[I 2023-04-26 00:19:29,172][39m Trial 60 finished with value: 0.7402597402597402 and parameters: {'criterion': 'gini', 'n_estimators': 145, 'max_features': 0.4665978377981786, 'max_depth': 1, 'min_samples_split': 5, 'min_samples_leaf': 3}. Best is trial 58 with value: 0.8672566371681416.
[32m[I 2023-04-26 00:19:29,272][39m Trial 61 finished with value: 0.8264462809917354 and parameters: {'criterion': 'gini', 'n_estimators': 116, 'max_features': 0.5618543683088328, 'max_depth': 16, 'min_samples_split': 10, 'min_samples_leaf': 11}. Best is trial 58 with value: 0.8672566371681416.
[32m[I 2023-04-26 00:19:29,348][39m Trial 62 finished with value: 0.8495575221238938 and parameters: {'criterion': 'gini', 'n_estimators': 87, 'max_features': 0.3922616813471115, 'max_depth': 11, 'min_samples_split': 9, 'min_samples_leaf': 2}. Best is trial 58 with value: 0.8672566371681416.
[32m[I 2023-04-26 00:19:29,461][39m Trial 63 finished with value: 0.8547008547008546 and parameters: {'criterion': 'gini', 'n_estimators': 131, 'max_features': 0.5189320275883672, 'max_depth': 23, 'min_samples_split': 4, 'min_samples_leaf': 5}. Best is trial 58 with value: 0.8672566371681416.
[32m[I 2023-04-26 00:19:29,528][39m Trial 64 finished with value: 0.8421052631578947 and parameters: {'criterion': 'gini', 'n_estimators': 92, 'max_features': 0.04957540786930792, 'max_depth': 28, 'min_samples_split': 8, 'min_samples_leaf': 4}. Best is trial 58 with value: 0.8672566371681416.
[32m[I 2023-04-26 00:19:29,607][39m Trial 65 finished with value: 0.8292682926829268 and parameters: {'criterion': 'entropy', 'n_estimators': 69, 'max_features': 0.9747527723231632, 'max_depth': 42, 'min_samples_split': 3, 'min_samples_leaf': 7}. Best is trial 58 with value: 0.8672566371681416.
[32m[I 2023-04-26 00:19:29,683][39m Trial 66 finished with value: 0.847457627118644 and parameters: {'criterion': 'gini', 'n_estimators': 78, 'max_features': 0.668634877923858, 'max_depth': 25, 'min_samples_split': 6, 'min_samples_leaf': 4}. Best is trial 58 with value: 0.8672566371681416.
[32m[I 2023-04-26 00:19:29,800][39m Trial 67 finished with value: 0.8448275862068967 and parameters: {'criterion': 'gini', 'n_estimators': 139, 'max_features': 0.5179717997771197, 'max_depth': 19, 'min_samples_split': 4, 'min_samples_leaf': 5}. Best is trial 58 with value: 0.8672566371681416.
[32m[I 2023-04-26 00:19:29,903][39m Trial 68 finished with value: 0.8547008547008546 and parameters: {'criterion': 'gini', 'n_estimators': 123, 'max_features': 0.4317290770419631, 'max_depth': 23, 'min_samples_split': 5, 'min_samples_leaf': 6}. Best is trial 58 with value: 0.8672566371681416.
[32m[I 2023-04-26 00:19:30,013][39m Trial 69 finished with value: 0.8448275862068967 and parameters: {'criterion': 'gini', 'n_estimators': 131, 'max_features': 0.5059906257679259, 'max_depth': 7, 'min_samples_split': 4, 'min_samples_leaf': 5}. Best is trial 58 with value: 0.8672566371681416.
[32m[I 2023-04-26 00:19:30,126][39m Trial 70 finished with value: 0.8695652173913043 and parameters: {'criterion': 'gini', 'n_estimators': 121, 'max_features': 0.7575966553900563, 'max_depth': 10, 'min_samples_split': 7, 'min_samples_leaf': 3}. Best is trial 70 with value: 0.8695652173913043.
[32m[I 2023-04-26 00:19:30,195][39m Trial 71 finished with value: 0.8495575221238938 and parameters: {'criterion': 'gini', 'n_estimators': 64, 'max_features': 0.7536957808258146, 'max_depth': 10, 'min_samples_split': 7, 'min_samples_leaf': 3}. Best is trial 70 with value: 0.8695652173913043.
[32m[I 2023-04-26 00:19:30,304][39m Trial 72 finished with value: 0.8596491228070176 and parameters: {'criterion': 'gini', 'n_estimators': 118, 'max_features': 0.6251212733994823, 'max_depth': 13, 'min_samples_split': 5, 'min_samples_leaf': 3}. Best is trial 70 with value: 0.8695652173913043.
[32m[I 2023-04-26 00:19:30,425][39m Trial 73 finished with value: 0.8392857142857144 and parameters: {'criterion': 'gini', 'n_estimators': 126, 'max_features': 0.72685340478766, 'max_depth': 14, 'min_samples_split': 5, 'min_samples_leaf': 2}. Best is trial 70 with value: 0.8695652173913043.
