[32m[I 2023-04-26 00:19:39,021][39m Trial 148 finished with value: 0.8620689655172413 and parameters: {'criterion': 'gini', 'n_estimators': 126, 'max_features': 0.8153466147263504, 'max_depth': 13, 'min_samples_split': 3, 'min_samples_leaf': 4}. Best is trial 70 with value: 0.8695652173913043.
[32m[I 2023-04-26 00:19:39,139][39m Trial 149 finished with value: 0.8166666666666667 and parameters: {'criterion': 'gini', 'n_estimators': 127, 'max_features': 0.8710671613697387, 'max_depth': 4, 'min_samples_split': 3, 'min_samples_leaf': 5}. Best is trial 70 with value: 0.8695652173913043.
[32m[I 2023-04-26 00:19:39,323][39m Trial 150 finished with value: 0.8448275862068967 and parameters: {'criterion': 'gini', 'n_estimators': 196, 'max_features': 0.7936753496201424, 'max_depth': 48, 'min_samples_split': 3, 'min_samples_leaf': 4}. Best is trial 70 with value: 0.8695652173913043.
[32m[I 2023-04-26 00:19:39,436][39m Trial 151 finished with value: 0.8448275862068967 and parameters: {'criterion': 'gini', 'n_estimators': 121, 'max_features': 0.7652101564369749, 'max_depth': 10, 'min_samples_split': 3, 'min_samples_leaf': 6}. Best is trial 70 with value: 0.8695652173913043.
[32m[I 2023-04-26 00:19:39,544][39m Trial 152 finished with value: 0.8468468468468469 and parameters: {'criterion': 'gini', 'n_estimators': 111, 'max_features': 0.8373871014849931, 'max_depth': 12, 'min_samples_split': 4, 'min_samples_leaf': 3}. Best is trial 70 with value: 0.8695652173913043.
[32m[I 2023-04-26 00:19:39,679][39m Trial 153 finished with value: 0.8392857142857144 and parameters: {'criterion': 'gini', 'n_estimators': 152, 'max_features': 0.6217415488327888, 'max_depth': 12, 'min_samples_split': 4, 'min_samples_leaf': 3}. Best is trial 70 with value: 0.8695652173913043.
[32m[I 2023-04-26 00:19:39,843][39m Trial 154 finished with value: 0.8392857142857144 and parameters: {'criterion': 'gini', 'n_estimators': 182, 'max_features': 0.6273043410754966, 'max_depth': 54, 'min_samples_split': 2, 'min_samples_leaf': 2}. Best is trial 70 with value: 0.8695652173913043.
[32m[I 2023-04-26 00:19:39,917][39m Trial 155 finished with value: 0.864406779661017 and parameters: {'criterion': 'gini', 'n_estimators': 73, 'max_features': 0.8141905493991514, 'max_depth': 89, 'min_samples_split': 3, 'min_samples_leaf': 4}. Best is trial 70 with value: 0.8695652173913043.
[32m[I 2023-04-26 00:19:40,030][39m Trial 156 finished with value: 0.8448275862068967 and parameters: {'criterion': 'gini', 'n_estimators': 118, 'max_features': 0.812121334280439, 'max_depth': 14, 'min_samples_split': 3, 'min_samples_leaf': 4}. Best is trial 70 with value: 0.8695652173913043.
[32m[I 2023-04-26 00:19:40,106][39m Trial 157 finished with value: 0.8448275862068967 and parameters: {'criterion': 'gini', 'n_estimators': 74, 'max_features': 0.8956408602611611, 'max_depth': 99, 'min_samples_split': 3, 'min_samples_leaf': 4}. Best is trial 70 with value: 0.8695652173913043.
[32m[I 2023-04-26 00:19:40,277][39m Trial 158 finished with value: 0.8333333333333334 and parameters: {'criterion': 'gini', 'n_estimators': 184, 'max_features': 0.8056076242035805, 'max_depth': 91, 'min_samples_split': 7, 'min_samples_leaf': 5}. Best is trial 70 with value: 0.8695652173913043.
[32m[I 2023-04-26 00:19:40,439][39m Trial 159 finished with value: 0.8521739130434783 and parameters: {'criterion': 'gini', 'n_estimators': 176, 'max_features': 0.8257420343607972, 'max_depth': 97, 'min_samples_split': 4, 'min_samples_leaf': 4}. Best is trial 70 with value: 0.8695652173913043.
[32m[I 2023-04-26 00:19:40,519][39m Trial 160 finished with value: 0.8392857142857144 and parameters: {'criterion': 'gini', 'n_estimators': 79, 'max_features': 0.7240720898210992, 'max_depth': 87, 'min_samples_split': 3, 'min_samples_leaf': 3}. Best is trial 70 with value: 0.8695652173913043.
[32m[I 2023-04-26 00:19:40,637][39m Trial 161 finished with value: 0.847457627118644 and parameters: {'criterion': 'gini', 'n_estimators': 125, 'max_features': 0.6914905956601488, 'max_depth': 16, 'min_samples_split': 4, 'min_samples_leaf': 4}. Best is trial 70 with value: 0.8695652173913043.
[32m[I 2023-04-26 00:19:40,707][39m Trial 162 finished with value: 0.8392857142857144 and parameters: {'criterion': 'gini', 'n_estimators': 66, 'max_features': 0.7832119741654323, 'max_depth': 93, 'min_samples_split': 4, 'min_samples_leaf': 3}. Best is trial 70 with value: 0.8695652173913043.
[32m[I 2023-04-26 00:19:40,870][39m Trial 163 finished with value: 0.8421052631578947 and parameters: {'criterion': 'gini', 'n_estimators': 194, 'max_features': 0.6607467426199272, 'max_depth': 79, 'min_samples_split': 7, 'min_samples_leaf': 3}. Best is trial 70 with value: 0.8695652173913043.
[32m[I 2023-04-26 00:19:40,952][39m Trial 164 finished with value: 0.8429752066115702 and parameters: {'criterion': 'gini', 'n_estimators': 72, 'max_features': 0.9191631792931316, 'max_depth': 95, 'min_samples_split': 3, 'min_samples_leaf': 4}. Best is trial 70 with value: 0.8695652173913043.
[32m[I 2023-04-26 00:19:41,061][39m Trial 165 finished with value: 0.8495575221238938 and parameters: {'criterion': 'gini', 'n_estimators': 114, 'max_features': 0.766539247308757, 'max_depth': 11, 'min_samples_split': 6, 'min_samples_leaf': 3}. Best is trial 70 with value: 0.8695652173913043.
[32m[I 2023-04-26 00:19:41,165][39m Trial 166 finished with value: 0.8571428571428572 and parameters: {'criterion': 'gini', 'n_estimators': 109, 'max_features': 0.7118898335314039, 'max_depth': 8, 'min_samples_split': 5, 'min_samples_leaf': 3}. Best is trial 70 with value: 0.8695652173913043.
[32m[I 2023-04-26 00:19:41,329][39m Trial 167 finished with value: 0.8596491228070176 and parameters: {'criterion': 'gini', 'n_estimators': 186, 'max_features': 0.751692630854949, 'max_depth': 87, 'min_samples_split': 6, 'min_samples_leaf': 3}. Best is trial 70 with value: 0.8695652173913043.
[32m[I 2023-04-26 00:19:41,452][39m Trial 168 finished with value: 0.8571428571428572 and parameters: {'criterion': 'gini', 'n_estimators': 122, 'max_features': 0.8410897903810132, 'max_depth': 17, 'min_samples_split': 2, 'min_samples_leaf': 3}. Best is trial 70 with value: 0.8695652173913043.
[32m[I 2023-04-26 00:19:41,564][39m Trial 169 finished with value: 0.8596491228070176 and parameters: {'criterion': 'gini', 'n_estimators': 104, 'max_features': 0.7575336547637002, 'max_depth': 6, 'min_samples_split': 5, 'min_samples_leaf': 3}. Best is trial 70 with value: 0.8695652173913043.
[32m[I 2023-04-26 00:19:41,688][39m Trial 170 finished with value: 0.823529411764706 and parameters: {'criterion': 'entropy', 'n_estimators': 114, 'max_features': 0.8671912215141743, 'max_depth': 73, 'min_samples_split': 5, 'min_samples_leaf': 6}. Best is trial 70 with value: 0.8695652173913043.
[32m[I 2023-04-26 00:19:41,854][39m Trial 171 finished with value: 0.8521739130434783 and parameters: {'criterion': 'gini', 'n_estimators': 191, 'max_features': 0.6008900113614717, 'max_depth': 78, 'min_samples_split': 4, 'min_samples_leaf': 4}. Best is trial 70 with value: 0.8695652173913043.
[32m[I 2023-04-26 00:19:41,963][39m Trial 172 finished with value: 0.8376068376068375 and parameters: {'criterion': 'gini', 'n_estimators': 108, 'max_features': 0.7302702117927107, 'max_depth': 90, 'min_samples_split': 7, 'min_samples_leaf': 4}. Best is trial 70 with value: 0.8695652173913043.
[32m[I 2023-04-26 00:19:42,078][39m Trial 173 finished with value: 0.8448275862068967 and parameters: {'criterion': 'gini', 'n_estimators': 120, 'max_features': 0.8197670790063805, 'max_depth': 15, 'min_samples_split': 4, 'min_samples_leaf': 4}. Best is trial 70 with value: 0.8695652173913043.
[32m[I 2023-04-26 00:19:42,264][39m Trial 174 finished with value: 0.8571428571428572 and parameters: {'criterion': 'gini', 'n_estimators': 201, 'max_features': 0.6973006903106397, 'max_depth': 95, 'min_samples_split': 7, 'min_samples_leaf': 3}. Best is trial 70 with value: 0.8695652173913043.
[32m[I 2023-04-26 00:19:42,324][39m Trial 175 finished with value: 0.8275862068965517 and parameters: {'criterion': 'gini', 'n_estimators': 53, 'max_features': 0.7879072667181194, 'max_depth': 13, 'min_samples_split': 6, 'min_samples_leaf': 3}. Best is trial 70 with value: 0.8695652173913043.
[32m[I 2023-04-26 00:19:42,432][39m Trial 176 finished with value: 0.8448275862068967 and parameters: {'criterion': 'gini', 'n_estimators': 117, 'max_features': 0.6401184098517049, 'max_depth': 5, 'min_samples_split': 5, 'min_samples_leaf': 4}. Best is trial 70 with value: 0.8695652173913043.
[32m[I 2023-04-26 00:19:42,510][39m Trial 177 finished with value: 0.8448275862068967 and parameters: {'criterion': 'gini', 'n_estimators': 88, 'max_features': 0.43215870149505814, 'max_depth': 10, 'min_samples_split': 6, 'min_samples_leaf': 5}. Best is trial 70 with value: 0.8695652173913043.
[32m[I 2023-04-26 00:19:42,670][39m Trial 178 finished with value: 0.8495575221238938 and parameters: {'criterion': 'gini', 'n_estimators': 175, 'max_features': 0.8055048075420381, 'max_depth': 82, 'min_samples_split': 3, 'min_samples_leaf': 3}. Best is trial 70 with value: 0.8695652173913043.
[32m[I 2023-04-26 00:19:42,758][39m Trial 179 finished with value: 0.8288288288288289 and parameters: {'criterion': 'gini', 'n_estimators': 85, 'max_features': 0.7278500615282765, 'max_depth': 64, 'min_samples_split': 7, 'min_samples_leaf': 3}. Best is trial 70 with value: 0.8695652173913043.
[32m[I 2023-04-26 00:19:42,857][39m Trial 180 finished with value: 0.823529411764706 and parameters: {'criterion': 'gini', 'n_estimators': 104, 'max_features': 0.7696930625491284, 'max_depth': 7, 'min_samples_split': 5, 'min_samples_leaf': 5}. Best is trial 70 with value: 0.8695652173913043.
[32m[I 2023-04-26 00:19:42,965][39m Trial 181 finished with value: 0.8521739130434783 and parameters: {'criterion': 'gini', 'n_estimators': 112, 'max_features': 0.7934154096279156, 'max_depth': 13, 'min_samples_split': 5, 'min_samples_leaf': 3}. Best is trial 70 with value: 0.8695652173913043.
[32m[I 2023-04-26 00:19:43,128][39m Trial 182 finished with value: 0.8448275862068967 and parameters: {'criterion': 'gini', 'n_estimators': 186, 'max_features': 0.697575028171421, 'max_depth': 87, 'min_samples_split': 7, 'min_samples_leaf': 3}. Best is trial 70 with value: 0.8695652173913043.
[32m[I 2023-04-26 00:19:43,244][39m Trial 183 finished with value: 0.8596491228070176 and parameters: {'criterion': 'gini', 'n_estimators': 120, 'max_features': 0.6674973059657995, 'max_depth': 11, 'min_samples_split': 6, 'min_samples_leaf': 3}. Best is trial 70 with value: 0.8695652173913043.
[32m[I 2023-04-26 00:19:43,363][39m Trial 184 finished with value: 0.8392857142857144 and parameters: {'criterion': 'gini', 'n_estimators': 125, 'max_features': 0.7420816720493533, 'max_depth': 15, 'min_samples_split': 7, 'min_samples_leaf': 3}. Best is trial 70 with value: 0.8695652173913043.
[32m[I 2023-04-26 00:19:43,489][39m Trial 185 finished with value: 0.7518796992481203 and parameters: {'criterion': 'gini', 'n_estimators': 179, 'max_features': 0.6643531939919899, 'max_depth': 1, 'min_samples_split': 4, 'min_samples_leaf': 3}. Best is trial 70 with value: 0.8695652173913043.
[32m[I 2023-04-26 00:19:43,584][39m Trial 186 finished with value: 0.8392857142857144 and parameters: {'criterion': 'gini', 'n_estimators': 96, 'max_features': 0.7623742365716404, 'max_depth': 38, 'min_samples_split': 5, 'min_samples_leaf': 2}. Best is trial 70 with value: 0.8695652173913043.
[32m[I 2023-04-26 00:19:43,682][39m Trial 187 finished with value: 0.8596491228070176 and parameters: {'criterion': 'gini', 'n_estimators': 99, 'max_features': 0.7541127655936678, 'max_depth': 88, 'min_samples_split': 6, 'min_samples_leaf': 2}. Best is trial 70 with value: 0.8695652173913043.
[32m[I 2023-04-26 00:19:43,775][39m Trial 188 finished with value: 0.8596491228070176 and parameters: {'criterion': 'gini', 'n_estimators': 91, 'max_features': 0.7798883950745141, 'max_depth': 18, 'min_samples_split': 6, 'min_samples_leaf': 2}. Best is trial 70 with value: 0.8695652173913043.
[32m[I 2023-04-26 00:19:43,871][39m Trial 189 finished with value: 0.8495575221238938 and parameters: {'criterion': 'gini', 'n_estimators': 100, 'max_features': 0.7852131700466053, 'max_depth': 18, 'min_samples_split': 6, 'min_samples_leaf': 2}. Best is trial 70 with value: 0.8695652173913043.
[32m[I 2023-04-26 00:19:43,964][39m Trial 190 finished with value: 0.831858407079646 and parameters: {'criterion': 'gini', 'n_estimators': 90, 'max_features': 0.7201161580757715, 'max_depth': 90, 'min_samples_split': 6, 'min_samples_leaf': 2}. Best is trial 70 with value: 0.8695652173913043.
[32m[I 2023-04-26 00:19:44,135][39m Trial 191 finished with value: 0.8672566371681416 and parameters: {'criterion': 'gini', 'n_estimators': 189, 'max_features': 0.752204589884426, 'max_depth': 88, 'min_samples_split': 6, 'min_samples_leaf': 3}. Best is trial 70 with value: 0.8695652173913043.
[32m[I 2023-04-26 00:19:44,209][39m Trial 192 finished with value: 0.8596491228070176 and parameters: {'criterion': 'gini', 'n_estimators': 75, 'max_features': 0.47084719684463316, 'max_depth': 13, 'min_samples_split': 6, 'min_samples_leaf': 2}. Best is trial 70 with value: 0.8695652173913043.
[32m[I 2023-04-26 00:19:44,278][39m Trial 193 finished with value: 0.8468468468468469 and parameters: {'criterion': 'gini', 'n_estimators': 72, 'max_features': 0.46906142375627785, 'max_depth': 12, 'min_samples_split': 6, 'min_samples_leaf': 3}. Best is trial 70 with value: 0.8695652173913043.
[32m[I 2023-04-26 00:19:44,453][39m Trial 194 finished with value: 0.8421052631578947 and parameters: {'criterion': 'gini', 'n_estimators': 188, 'max_features': 0.8183396768509044, 'max_depth': 92, 'min_samples_split': 7, 'min_samples_leaf': 3}. Best is trial 70 with value: 0.8695652173913043.
[32m[I 2023-04-26 00:19:44,623][39m Trial 195 finished with value: 0.8403361344537814 and parameters: {'criterion': 'gini', 'n_estimators': 192, 'max_features': 0.6861572773037303, 'max_depth': 82, 'min_samples_split': 4, 'min_samples_leaf': 4}. Best is trial 70 with value: 0.8695652173913043.
[32m[I 2023-04-26 00:19:44,788][39m Trial 196 finished with value: 0.8672566371681416 and parameters: {'criterion': 'gini', 'n_estimators': 185, 'max_features': 0.7494510388710431, 'max_depth': 16, 'min_samples_split': 5, 'min_samples_leaf': 3}. Best is trial 70 with value: 0.8695652173913043.
[32m[I 2023-04-26 00:19:44,868][39m Trial 197 finished with value: 0.8173913043478261 and parameters: {'criterion': 'gini', 'n_estimators': 81, 'max_features': 0.45504461729158874, 'max_depth': 16, 'min_samples_split': 5, 'min_samples_leaf': 1}. Best is trial 70 with value: 0.8695652173913043.
[32m[I 2023-04-26 00:19:45,038][39m Trial 198 finished with value: 0.8596491228070176 and parameters: {'criterion': 'gini', 'n_estimators': 187, 'max_features': 0.7408631596707497, 'max_depth': 85, 'min_samples_split': 6, 'min_samples_leaf': 3}. Best is trial 70 with value: 0.8695652173913043.
[32m[I 2023-04-26 00:19:45,152][39m Trial 199 finished with value: 0.8288288288288289 and parameters: {'criterion': 'entropy', 'n_estimators': 115, 'max_features': 0.5778660586439401, 'max_depth': 9, 'min_samples_split': 5, 'min_samples_leaf': 3}. Best is trial 70 with value: 0.8695652173913043.
[32m[I 2023-04-26 00:19:45,317][39m Trial 200 finished with value: 0.8672566371681416 and parameters: {'criterion': 'gini', 'n_estimators': 182, 'max_features': 0.7470646071332409, 'max_depth': 89, 'min_samples_split': 6, 'min_samples_leaf': 3}. Best is trial 70 with value: 0.8695652173913043.
[32m[I 2023-04-26 00:19:45,427][39m Trial 201 finished with value: 0.8468468468468469 and parameters: {'criterion': 'gini', 'n_estimators': 117, 'max_features': 0.7684774426905313, 'max_depth': 20, 'min_samples_split': 5, 'min_samples_leaf': 3}. Best is trial 70 with value: 0.8695652173913043.
[32m[I 2023-04-26 00:19:45,593][39m Trial 202 finished with value: 0.8571428571428572 and parameters: {'criterion': 'gini', 'n_estimators': 180, 'max_features': 0.7425280853353784, 'max_depth': 86, 'min_samples_split': 6, 'min_samples_leaf': 3}. Best is trial 70 with value: 0.8695652173913043.
[32m[I 2023-04-26 00:19:45,761][39m Trial 203 finished with value: 0.8468468468468469 and parameters: {'criterion': 'gini', 'n_estimators': 188, 'max_features': 0.7093902458751857, 'max_depth': 89, 'min_samples_split': 6, 'min_samples_leaf': 3}. Best is trial 70 with value: 0.8695652173913043.
[32m[I 2023-04-26 00:19:45,927][39m Trial 204 finished with value: 0.8571428571428572 and parameters: {'criterion': 'gini', 'n_estimators': 194, 'max_features': 0.6683227504682704, 'max_depth': 98, 'min_samples_split': 7, 'min_samples_leaf': 3}. Best is trial 70 with value: 0.8695652173913043.
[32m[I 2023-04-26 00:19:46,035][39m Trial 205 finished with value: 0.8421052631578947 and parameters: {'criterion': 'gini', 'n_estimators': 120, 'max_features': 0.38224796075213774, 'max_depth': 11, 'min_samples_split': 5, 'min_samples_leaf': 3}. Best is trial 70 with value: 0.8695652173913043.
[32m[I 2023-04-26 00:19:46,150][39m Trial 206 finished with value: 0.8333333333333334 and parameters: {'criterion': 'gini', 'n_estimators': 120, 'max_features': 0.7575202673856836, 'max_depth': 88, 'min_samples_split': 6, 'min_samples_leaf': 4}. Best is trial 70 with value: 0.8695652173913043.
[32m[I 2023-04-26 00:19:46,325][39m Trial 207 finished with value: 0.8421052631578947 and parameters: {'criterion': 'gini', 'n_estimators': 190, 'max_features': 0.7352198728258809, 'max_depth': 94, 'min_samples_split': 7, 'min_samples_leaf': 2}. Best is trial 70 with value: 0.8695652173913043.
[32m[I 2023-04-26 00:19:46,498][39m Trial 208 finished with value: 0.8421052631578947 and parameters: {'criterion': 'gini', 'n_estimators': 184, 'max_features': 0.7801266247869056, 'max_depth': 81, 'min_samples_split': 6, 'min_samples_leaf': 2}. Best is trial 70 with value: 0.8695652173913043.
[32m[I 2023-04-26 00:19:46,664][39m Trial 209 finished with value: 0.8468468468468469 and parameters: {'criterion': 'gini', 'n_estimators': 184, 'max_features': 0.7142140100660141, 'max_depth': 84, 'min_samples_split': 6, 'min_samples_leaf': 3}. Best is trial 70 with value: 0.8695652173913043.
[32m[I 2023-04-26 00:19:46,827][39m Trial 210 finished with value: 0.8495575221238938 and parameters: {'criterion': 'gini', 'n_estimators': 180, 'max_features': 0.7470021949486519, 'max_depth': 92, 'min_samples_split': 6, 'min_samples_leaf': 3}. Best is trial 70 with value: 0.8695652173913043.
[32m[I 2023-04-26 00:19:46,969][39m Trial 211 finished with value: 0.847457627118644 and parameters: {'criterion': 'gini', 'n_estimators': 168, 'max_features': 0.6417589269770311, 'max_depth': 14, 'min_samples_split': 5, 'min_samples_leaf': 7}. Best is trial 70 with value: 0.8695652173913043.
[32m[I 2023-04-26 00:19:47,146][39m Trial 212 finished with value: 0.8596491228070176 and parameters: {'criterion': 'gini', 'n_estimators': 197, 'max_features': 0.7209423551226831, 'max_depth': 101, 'min_samples_split': 5, 'min_samples_leaf': 3}. Best is trial 70 with value: 0.8695652173913043.
[32m[I 2023-04-26 00:19:47,317][39m Trial 213 finished with value: 0.8421052631578947 and parameters: {'criterion': 'gini', 'n_estimators': 193, 'max_features': 0.703628676269883, 'max_depth': 15, 'min_samples_split': 7, 'min_samples_leaf': 3}. Best is trial 70 with value: 0.8695652173913043.
[32m[I 2023-04-26 00:19:47,390][39m Trial 214 finished with value: 0.831858407079646 and parameters: {'criterion': 'gini', 'n_estimators': 77, 'max_features': 0.5006683664626792, 'max_depth': 89, 'min_samples_split': 6, 'min_samples_leaf': 2}. Best is trial 70 with value: 0.8695652173913043.
[32m[I 2023-04-26 00:19:47,511][39m Trial 215 finished with value: 0.8547008547008546 and parameters: {'criterion': 'gini', 'n_estimators': 123, 'max_features': 0.8443432339559916, 'max_depth': 97, 'min_samples_split': 3, 'min_samples_leaf': 4}. Best is trial 70 with value: 0.8695652173913043.
[32m[I 2023-04-26 00:19:47,615][39m Trial 216 finished with value: 0.8596491228070176 and parameters: {'criterion': 'gini', 'n_estimators': 102, 'max_features': 0.7972327349315615, 'max_depth': 76, 'min_samples_split': 4, 'min_samples_leaf': 3}. Best is trial 70 with value: 0.8695652173913043.
[32m[I 2023-04-26 00:19:47,724][39m Trial 217 finished with value: 0.8672566371681416 and parameters: {'criterion': 'gini', 'n_estimators': 113, 'max_features': 0.621276520044334, 'max_depth': 9, 'min_samples_split': 7, 'min_samples_leaf': 3}. Best is trial 70 with value: 0.8695652173913043.
[32m[I 2023-04-26 00:19:47,886][39m Trial 218 finished with value: 0.8672566371681416 and parameters: {'criterion': 'gini', 'n_estimators': 196, 'max_features': 0.607664959560801, 'max_depth': 101, 'min_samples_split': 7, 'min_samples_leaf': 3}. Best is trial 70 with value: 0.8695652173913043.
[32m[I 2023-04-26 00:19:48,061][39m Trial 219 finished with value: 0.8245614035087718 and parameters: {'criterion': 'gini', 'n_estimators': 196, 'max_features': 0.5950941473251297, 'max_depth': 98, 'min_samples_split': 7, 'min_samples_leaf': 3}. Best is trial 70 with value: 0.8695652173913043.
[32m[I 2023-04-26 00:19:48,225][39m Trial 220 finished with value: 0.8596491228070176 and parameters: {'criterion': 'gini', 'n_estimators': 190, 'max_features': 0.6198843780746514, 'max_depth': 7, 'min_samples_split': 8, 'min_samples_leaf': 3}. Best is trial 70 with value: 0.8695652173913043.
[32m[I 2023-04-26 00:19:48,330][39m Trial 221 finished with value: 0.8495575221238938 and parameters: {'criterion': 'gini', 'n_estimators': 110, 'max_features': 0.796391544139424, 'max_depth': 75, 'min_samples_split': 5, 'min_samples_leaf': 3}. Best is trial 70 with value: 0.8695652173913043.
