[32m[I 2023-04-26 00:19:30,525][39m Trial 74 finished with value: 0.8421052631578947 and parameters: {'criterion': 'gini', 'n_estimators': 112, 'max_features': 0.6014759616147293, 'max_depth': 5, 'min_samples_split': 5, 'min_samples_leaf': 3}. Best is trial 70 with value: 0.8695652173913043.
[32m[I 2023-04-26 00:19:30,637][39m Trial 75 finished with value: 0.8571428571428572 and parameters: {'criterion': 'gini', 'n_estimators': 119, 'max_features': 0.7016277839217706, 'max_depth': 11, 'min_samples_split': 6, 'min_samples_leaf': 3}. Best is trial 70 with value: 0.8695652173913043.
[32m[I 2023-04-26 00:19:30,784][39m Trial 76 finished with value: 0.8392857142857144 and parameters: {'criterion': 'gini', 'n_estimators': 161, 'max_features': 0.6479191349420679, 'max_depth': 17, 'min_samples_split': 5, 'min_samples_leaf': 2}. Best is trial 70 with value: 0.8695652173913043.
[32m[I 2023-04-26 00:19:30,895][39m Trial 77 finished with value: 0.8421052631578947 and parameters: {'criterion': 'gini', 'n_estimators': 119, 'max_features': 0.7047446667094147, 'max_depth': 9, 'min_samples_split': 6, 'min_samples_leaf': 3}. Best is trial 70 with value: 0.8695652173913043.
[32m[I 2023-04-26 00:19:31,012][39m Trial 78 finished with value: 0.8196721311475409 and parameters: {'criterion': 'gini', 'n_estimators': 137, 'max_features': 0.78160472742334, 'max_depth': 3, 'min_samples_split': 7, 'min_samples_leaf': 4}. Best is trial 70 with value: 0.8695652173913043.
[32m[I 2023-04-26 00:19:31,125][39m Trial 79 finished with value: 0.8288288288288289 and parameters: {'criterion': 'gini', 'n_estimators': 115, 'max_features': 0.8030780654938519, 'max_depth': 12, 'min_samples_split': 7, 'min_samples_leaf': 2}. Best is trial 70 with value: 0.8695652173913043.
[32m[I 2023-04-26 00:19:31,215][39m Trial 80 finished with value: 0.8214285714285715 and parameters: {'criterion': 'gini', 'n_estimators': 97, 'max_features': 0.6095015617237621, 'max_depth': 20, 'min_samples_split': 4, 'min_samples_leaf': 1}. Best is trial 70 with value: 0.8695652173913043.
[32m[I 2023-04-26 00:19:31,313][39m Trial 81 finished with value: 0.8468468468468469 and parameters: {'criterion': 'gini', 'n_estimators': 104, 'max_features': 0.7005562077129738, 'max_depth': 12, 'min_samples_split': 6, 'min_samples_leaf': 3}. Best is trial 70 with value: 0.8695652173913043.
[32m[I 2023-04-26 00:19:31,429][39m Trial 82 finished with value: 0.8596491228070176 and parameters: {'criterion': 'gini', 'n_estimators': 123, 'max_features': 0.756298042202542, 'max_depth': 15, 'min_samples_split': 5, 'min_samples_leaf': 3}. Best is trial 70 with value: 0.8695652173913043.
[32m[I 2023-04-26 00:19:31,542][39m Trial 83 finished with value: 0.8495575221238938 and parameters: {'criterion': 'gini', 'n_estimators': 123, 'max_features': 0.7592240489361067, 'max_depth': 6, 'min_samples_split': 6, 'min_samples_leaf': 3}. Best is trial 70 with value: 0.8695652173913043.
[32m[I 2023-04-26 00:19:31,652][39m Trial 84 finished with value: 0.8596491228070176 and parameters: {'criterion': 'gini', 'n_estimators': 117, 'max_features': 0.7216542069371756, 'max_depth': 16, 'min_samples_split': 5, 'min_samples_leaf': 3}. Best is trial 70 with value: 0.8695652173913043.
[32m[I 2023-04-26 00:19:31,758][39m Trial 85 finished with value: 0.8448275862068967 and parameters: {'criterion': 'gini', 'n_estimators': 119, 'max_features': 0.650294357562741, 'max_depth': 15, 'min_samples_split': 5, 'min_samples_leaf': 4}. Best is trial 70 with value: 0.8695652173913043.
[32m[I 2023-04-26 00:19:31,878][39m Trial 86 finished with value: 0.8495575221238938 and parameters: {'criterion': 'gini', 'n_estimators': 129, 'max_features': 0.735132548103787, 'max_depth': 9, 'min_samples_split': 6, 'min_samples_leaf': 3}. Best is trial 70 with value: 0.8695652173913043.
[32m[I 2023-04-26 00:19:31,978][39m Trial 87 finished with value: 0.8468468468468469 and parameters: {'criterion': 'gini', 'n_estimators': 111, 'max_features': 0.5837597328330365, 'max_depth': 17, 'min_samples_split': 5, 'min_samples_leaf': 2}. Best is trial 70 with value: 0.8695652173913043.
[32m[I 2023-04-26 00:19:32,102][39m Trial 88 finished with value: 0.8495575221238938 and parameters: {'criterion': 'gini', 'n_estimators': 124, 'max_features': 0.8547881024854408, 'max_depth': 32, 'min_samples_split': 5, 'min_samples_leaf': 2}. Best is trial 70 with value: 0.8695652173913043.
[32m[I 2023-04-26 00:19:32,225][39m Trial 89 finished with value: 0.8305084745762712 and parameters: {'criterion': 'gini', 'n_estimators': 136, 'max_features': 0.6755548358929508, 'max_depth': 58, 'min_samples_split': 3, 'min_samples_leaf': 4}. Best is trial 70 with value: 0.8695652173913043.
[32m[I 2023-04-26 00:19:32,346][39m Trial 90 finished with value: 0.831858407079646 and parameters: {'criterion': 'gini', 'n_estimators': 142, 'max_features': 0.5433986153976322, 'max_depth': 21, 'min_samples_split': 6, 'min_samples_leaf': 3}. Best is trial 70 with value: 0.8695652173913043.
[32m[I 2023-04-26 00:19:32,458][39m Trial 91 finished with value: 0.8596491228070176 and parameters: {'criterion': 'gini', 'n_estimators': 119, 'max_features': 0.7612292285497115, 'max_depth': 18, 'min_samples_split': 5, 'min_samples_leaf': 3}. Best is trial 70 with value: 0.8695652173913043.
[32m[I 2023-04-26 00:19:32,569][39m Trial 92 finished with value: 0.8347826086956522 and parameters: {'criterion': 'gini', 'n_estimators': 119, 'max_features': 0.7598440090508053, 'max_depth': 15, 'min_samples_split': 7, 'min_samples_leaf': 3}. Best is trial 70 with value: 0.8695652173913043.
[32m[I 2023-04-26 00:19:32,667][39m Trial 93 finished with value: 0.8421052631578947 and parameters: {'criterion': 'gini', 'n_estimators': 108, 'max_features': 0.6290553136967021, 'max_depth': 19, 'min_samples_split': 4, 'min_samples_leaf': 3}. Best is trial 70 with value: 0.8695652173913043.
[32m[I 2023-04-26 00:19:32,798][39m Trial 94 finished with value: 0.8547008547008546 and parameters: {'criterion': 'gini', 'n_estimators': 117, 'max_features': 0.805843283498606, 'max_depth': 11, 'min_samples_split': 5, 'min_samples_leaf': 4}. Best is trial 70 with value: 0.8695652173913043.
[32m[I 2023-04-26 00:19:32,904][39m Trial 95 finished with value: 0.8392857142857144 and parameters: {'criterion': 'gini', 'n_estimators': 113, 'max_features': 0.7180898962706981, 'max_depth': 27, 'min_samples_split': 5, 'min_samples_leaf': 2}. Best is trial 70 with value: 0.8695652173913043.
[32m[I 2023-04-26 00:19:32,994][39m Trial 96 finished with value: 0.8264462809917354 and parameters: {'criterion': 'gini', 'n_estimators': 105, 'max_features': 0.6577109010492661, 'max_depth': 4, 'min_samples_split': 4, 'min_samples_leaf': 3}. Best is trial 70 with value: 0.8695652173913043.
[32m[I 2023-04-26 00:19:33,069][39m Trial 97 finished with value: 0.8440366972477066 and parameters: {'criterion': 'gini', 'n_estimators': 99, 'max_features': 0.016235212817367728, 'max_depth': 14, 'min_samples_split': 4, 'min_samples_leaf': 1}. Best is trial 70 with value: 0.8695652173913043.
[32m[I 2023-04-26 00:19:33,186][39m Trial 98 finished with value: 0.8495575221238938 and parameters: {'criterion': 'gini', 'n_estimators': 127, 'max_features': 0.7048428906815333, 'max_depth': 7, 'min_samples_split': 6, 'min_samples_leaf': 3}. Best is trial 70 with value: 0.8695652173913043.
[32m[I 2023-04-26 00:19:33,300][39m Trial 99 finished with value: 0.8495575221238938 and parameters: {'criterion': 'gini', 'n_estimators': 121, 'max_features': 0.6838345838429376, 'max_depth': 18, 'min_samples_split': 5, 'min_samples_leaf': 2}. Best is trial 70 with value: 0.8695652173913043.
[32m[I 2023-04-26 00:19:33,397][39m Trial 100 finished with value: 0.8521739130434783 and parameters: {'criterion': 'gini', 'n_estimators': 110, 'max_features': 0.482781116891279, 'max_depth': 23, 'min_samples_split': 4, 'min_samples_leaf': 4}. Best is trial 70 with value: 0.8695652173913043.
[32m[I 2023-04-26 00:19:33,496][39m Trial 101 finished with value: 0.8571428571428572 and parameters: {'criterion': 'gini', 'n_estimators': 102, 'max_features': 0.7445250854071246, 'max_depth': 13, 'min_samples_split': 6, 'min_samples_leaf': 3}. Best is trial 70 with value: 0.8695652173913043.
[32m[I 2023-04-26 00:19:33,606][39m Trial 102 finished with value: 0.8403361344537814 and parameters: {'criterion': 'gini', 'n_estimators': 115, 'max_features': 0.8263718883656396, 'max_depth': 21, 'min_samples_split': 5, 'min_samples_leaf': 4}. Best is trial 70 with value: 0.8695652173913043.
[32m[I 2023-04-26 00:19:33,701][39m Trial 103 finished with value: 0.8672566371681416 and parameters: {'criterion': 'gini', 'n_estimators': 101, 'max_features': 0.7645330151621054, 'max_depth': 13, 'min_samples_split': 6, 'min_samples_leaf': 3}. Best is trial 70 with value: 0.8695652173913043.
[32m[I 2023-04-26 00:19:33,794][39m Trial 104 finished with value: 0.8495575221238938 and parameters: {'criterion': 'gini', 'n_estimators': 94, 'max_features': 0.7552540389715746, 'max_depth': 13, 'min_samples_split': 6, 'min_samples_leaf': 3}. Best is trial 70 with value: 0.8695652173913043.
[32m[I 2023-04-26 00:19:33,911][39m Trial 105 finished with value: 0.8596491228070176 and parameters: {'criterion': 'gini', 'n_estimators': 123, 'max_features': 0.7982705149351016, 'max_depth': 10, 'min_samples_split': 7, 'min_samples_leaf': 3}. Best is trial 70 with value: 0.8695652173913043.
[32m[I 2023-04-26 00:19:34,045][39m Trial 106 finished with value: 0.8376068376068375 and parameters: {'criterion': 'gini', 'n_estimators': 134, 'max_features': 0.856674397591445, 'max_depth': 8, 'min_samples_split': 8, 'min_samples_leaf': 3}. Best is trial 70 with value: 0.8695652173913043.
[32m[I 2023-04-26 00:19:34,165][39m Trial 107 finished with value: 0.8468468468468469 and parameters: {'criterion': 'gini', 'n_estimators': 125, 'max_features': 0.791792101478218, 'max_depth': 101, 'min_samples_split': 7, 'min_samples_leaf': 2}. Best is trial 70 with value: 0.8695652173913043.
[32m[I 2023-04-26 00:19:34,272][39m Trial 108 finished with value: 0.8421052631578947 and parameters: {'criterion': 'gini', 'n_estimators': 109, 'max_features': 0.8820948607266561, 'max_depth': 16, 'min_samples_split': 7, 'min_samples_leaf': 4}. Best is trial 70 with value: 0.8695652173913043.
[32m[I 2023-04-26 00:19:34,390][39m Trial 109 finished with value: 0.8495575221238938 and parameters: {'criterion': 'gini', 'n_estimators': 128, 'max_features': 0.7767892868984164, 'max_depth': 10, 'min_samples_split': 5, 'min_samples_leaf': 2}. Best is trial 70 with value: 0.8695652173913043.
[32m[I 2023-04-26 00:19:34,505][39m Trial 110 finished with value: 0.8421052631578947 and parameters: {'criterion': 'gini', 'n_estimators': 122, 'max_features': 0.640639708975922, 'max_depth': 25, 'min_samples_split': 8, 'min_samples_leaf': 2}. Best is trial 70 with value: 0.8695652173913043.
[32m[I 2023-04-26 00:19:34,617][39m Trial 111 finished with value: 0.8421052631578947 and parameters: {'criterion': 'gini', 'n_estimators': 117, 'max_features': 0.7258429895372079, 'max_depth': 18, 'min_samples_split': 7, 'min_samples_leaf': 3}. Best is trial 70 with value: 0.8695652173913043.
[32m[I 2023-04-26 00:19:34,730][39m Trial 112 finished with value: 0.8521739130434783 and parameters: {'criterion': 'gini', 'n_estimators': 119, 'max_features': 0.8159234271539775, 'max_depth': 10, 'min_samples_split': 6, 'min_samples_leaf': 3}. Best is trial 70 with value: 0.8695652173913043.
[32m[I 2023-04-26 00:19:34,819][39m Trial 113 finished with value: 0.7999999999999999 and parameters: {'criterion': 'gini', 'n_estimators': 114, 'max_features': 0.6148034708078721, 'max_depth': 2, 'min_samples_split': 4, 'min_samples_leaf': 3}. Best is trial 70 with value: 0.8695652173913043.
[32m[I 2023-04-26 00:19:34,921][39m Trial 114 finished with value: 0.8596491228070176 and parameters: {'criterion': 'gini', 'n_estimators': 101, 'max_features': 0.7446204762851398, 'max_depth': 14, 'min_samples_split': 6, 'min_samples_leaf': 3}. Best is trial 70 with value: 0.8695652173913043.
[32m[I 2023-04-26 00:19:35,008][39m Trial 115 finished with value: 0.8421052631578947 and parameters: {'criterion': 'gini', 'n_estimators': 91, 'max_features': 0.7669580543988708, 'max_depth': 16, 'min_samples_split': 7, 'min_samples_leaf': 4}. Best is trial 70 with value: 0.8695652173913043.
[32m[I 2023-04-26 00:19:35,091][39m Trial 116 finished with value: 0.8256880733944953 and parameters: {'criterion': 'gini', 'n_estimators': 101, 'max_features': 0.12924411506092787, 'max_depth': 14, 'min_samples_split': 5, 'min_samples_leaf': 3}. Best is trial 70 with value: 0.8695652173913043.
[32m[I 2023-04-26 00:19:35,165][39m Trial 117 finished with value: 0.8495575221238938 and parameters: {'criterion': 'gini', 'n_estimators': 82, 'max_features': 0.4541881487708774, 'max_depth': 5, 'min_samples_split': 6, 'min_samples_leaf': 2}. Best is trial 70 with value: 0.8695652173913043.
[32m[I 2023-04-26 00:19:35,265][39m Trial 118 finished with value: 0.847457627118644 and parameters: {'criterion': 'gini', 'n_estimators': 105, 'max_features': 0.792103324365754, 'max_depth': 7, 'min_samples_split': 7, 'min_samples_leaf': 4}. Best is trial 70 with value: 0.8695652173913043.
[32m[I 2023-04-26 00:19:35,351][39m Trial 119 finished with value: 0.8421052631578947 and parameters: {'criterion': 'gini', 'n_estimators': 95, 'max_features': 0.4040568742739399, 'max_depth': 20, 'min_samples_split': 5, 'min_samples_leaf': 3}. Best is trial 70 with value: 0.8695652173913043.
[32m[I 2023-04-26 00:19:35,457][39m Trial 120 finished with value: 0.8596491228070176 and parameters: {'criterion': 'gini', 'n_estimators': 107, 'max_features': 0.8453406426408155, 'max_depth': 12, 'min_samples_split': 6, 'min_samples_leaf': 2}. Best is trial 70 with value: 0.8695652173913043.
[32m[I 2023-04-26 00:19:35,562][39m Trial 121 finished with value: 0.8421052631578947 and parameters: {'criterion': 'gini', 'n_estimators': 107, 'max_features': 0.8499668733020684, 'max_depth': 13, 'min_samples_split': 6, 'min_samples_leaf': 2}. Best is trial 70 with value: 0.8695652173913043.
[32m[I 2023-04-26 00:19:35,676][39m Trial 122 finished with value: 0.8392857142857144 and parameters: {'criterion': 'gini', 'n_estimators': 113, 'max_features': 0.9010242663936338, 'max_depth': 17, 'min_samples_split': 6, 'min_samples_leaf': 1}. Best is trial 70 with value: 0.8695652173913043.
[32m[I 2023-04-26 00:19:35,783][39m Trial 123 finished with value: 0.8596491228070176 and parameters: {'criterion': 'gini', 'n_estimators': 110, 'max_features': 0.7398876974541959, 'max_depth': 11, 'min_samples_split': 5, 'min_samples_leaf': 3}. Best is trial 70 with value: 0.8695652173913043.
[32m[I 2023-04-26 00:19:35,889][39m Trial 124 finished with value: 0.8571428571428572 and parameters: {'criterion': 'gini', 'n_estimators': 110, 'max_features': 0.7326433292834028, 'max_depth': 9, 'min_samples_split': 5, 'min_samples_leaf': 3}. Best is trial 70 with value: 0.8695652173913043.
[32m[I 2023-04-26 00:19:35,983][39m Trial 125 finished with value: 0.8245614035087718 and parameters: {'criterion': 'gini', 'n_estimators': 98, 'max_features': 0.6842225282658112, 'max_depth': 6, 'min_samples_split': 6, 'min_samples_leaf': 2}. Best is trial 70 with value: 0.8695652173913043.
[32m[I 2023-04-26 00:19:36,081][39m Trial 126 finished with value: 0.8596491228070176 and parameters: {'criterion': 'gini', 'n_estimators': 103, 'max_features': 0.7181316859657818, 'max_depth': 49, 'min_samples_split': 7, 'min_samples_leaf': 2}. Best is trial 70 with value: 0.8695652173913043.
[32m[I 2023-04-26 00:19:36,197][39m Trial 127 finished with value: 0.8521739130434783 and parameters: {'criterion': 'gini', 'n_estimators': 122, 'max_features': 0.8044606038142713, 'max_depth': 66, 'min_samples_split': 7, 'min_samples_leaf': 3}. Best is trial 70 with value: 0.8695652173913043.
[32m[I 2023-04-26 00:19:36,295][39m Trial 128 finished with value: 0.8214285714285715 and parameters: {'criterion': 'gini', 'n_estimators': 104, 'max_features': 0.7161951473372523, 'max_depth': 11, 'min_samples_split': 8, 'min_samples_leaf': 1}. Best is trial 70 with value: 0.8695652173913043.
[32m[I 2023-04-26 00:19:36,460][39m Trial 129 finished with value: 0.8596491228070176 and parameters: {'criterion': 'gini', 'n_estimators': 193, 'max_features': 0.570593879827207, 'max_depth': 12, 'min_samples_split': 6, 'min_samples_leaf': 3}. Best is trial 70 with value: 0.8695652173913043.
[32m[I 2023-04-26 00:19:36,565][39m Trial 130 finished with value: 0.8347826086956522 and parameters: {'criterion': 'gini', 'n_estimators': 116, 'max_features': 0.5719334526645091, 'max_depth': 19, 'min_samples_split': 6, 'min_samples_leaf': 4}. Best is trial 70 with value: 0.8695652173913043.
[32m[I 2023-04-26 00:19:36,738][39m Trial 131 finished with value: 0.8596491228070176 and parameters: {'criterion': 'gini', 'n_estimators': 191, 'max_features': 0.7447005408487134, 'max_depth': 80, 'min_samples_split': 7, 'min_samples_leaf': 3}. Best is trial 70 with value: 0.8695652173913043.
[32m[I 2023-04-26 00:19:36,888][39m Trial 132 finished with value: 0.8495575221238938 and parameters: {'criterion': 'gini', 'n_estimators': 164, 'max_features': 0.7452897166827428, 'max_depth': 70, 'min_samples_split': 5, 'min_samples_leaf': 2}. Best is trial 70 with value: 0.8695652173913043.
[32m[I 2023-04-26 00:19:37,000][39m Trial 133 finished with value: 0.8392857142857144 and parameters: {'criterion': 'gini', 'n_estimators': 112, 'max_features': 0.8356680905837817, 'max_depth': 15, 'min_samples_split': 5, 'min_samples_leaf': 3}. Best is trial 70 with value: 0.8695652173913043.
[32m[I 2023-04-26 00:19:37,163][39m Trial 134 finished with value: 0.8392857142857144 and parameters: {'criterion': 'gini', 'n_estimators': 188, 'max_features': 0.5913080104834658, 'max_depth': 56, 'min_samples_split': 7, 'min_samples_leaf': 2}. Best is trial 70 with value: 0.8695652173913043.
[32m[I 2023-04-26 00:19:37,307][39m Trial 135 finished with value: 0.8392857142857144 and parameters: {'criterion': 'gini', 'n_estimators': 171, 'max_features': 0.5346949587238515, 'max_depth': 12, 'min_samples_split': 5, 'min_samples_leaf': 2}. Best is trial 70 with value: 0.8695652173913043.
[32m[I 2023-04-26 00:19:37,412][39m Trial 136 finished with value: 0.8468468468468469 and parameters: {'criterion': 'gini', 'n_estimators': 107, 'max_features': 0.667660375161623, 'max_depth': 22, 'min_samples_split': 5, 'min_samples_leaf': 2}. Best is trial 70 with value: 0.8695652173913043.
[32m[I 2023-04-26 00:19:37,589][39m Trial 137 finished with value: 0.8521739130434783 and parameters: {'criterion': 'gini', 'n_estimators': 191, 'max_features': 0.7787438968594047, 'max_depth': 83, 'min_samples_split': 7, 'min_samples_leaf': 3}. Best is trial 70 with value: 0.8695652173913043.
[32m[I 2023-04-26 00:19:37,749][39m Trial 138 finished with value: 0.8596491228070176 and parameters: {'criterion': 'gini', 'n_estimators': 182, 'max_features': 0.6947106931911041, 'max_depth': 97, 'min_samples_split': 7, 'min_samples_leaf': 3}. Best is trial 70 with value: 0.8695652173913043.
[32m[I 2023-04-26 00:19:37,869][39m Trial 139 finished with value: 0.8288288288288289 and parameters: {'criterion': 'gini', 'n_estimators': 130, 'max_features': 0.7102771763584829, 'max_depth': 9, 'min_samples_split': 8, 'min_samples_leaf': 2}. Best is trial 70 with value: 0.8695652173913043.
[32m[I 2023-04-26 00:19:37,987][39m Trial 140 finished with value: 0.8495575221238938 and parameters: {'criterion': 'gini', 'n_estimators': 124, 'max_features': 0.7697885298237638, 'max_depth': 15, 'min_samples_split': 6, 'min_samples_leaf': 3}. Best is trial 70 with value: 0.8695652173913043.
[32m[I 2023-04-26 00:19:38,164][39m Trial 141 finished with value: 0.8571428571428572 and parameters: {'criterion': 'gini', 'n_estimators': 198, 'max_features': 0.7412871483274093, 'max_depth': 85, 'min_samples_split': 7, 'min_samples_leaf': 3}. Best is trial 70 with value: 0.8695652173913043.
[32m[I 2023-04-26 00:19:38,344][39m Trial 142 finished with value: 0.8571428571428572 and parameters: {'criterion': 'gini', 'n_estimators': 200, 'max_features': 0.7481581258137382, 'max_depth': 17, 'min_samples_split': 7, 'min_samples_leaf': 3}. Best is trial 70 with value: 0.8695652173913043.
[32m[I 2023-04-26 00:19:38,456][39m Trial 143 finished with value: 0.8620689655172413 and parameters: {'criterion': 'gini', 'n_estimators': 117, 'max_features': 0.6344216635642029, 'max_depth': 12, 'min_samples_split': 4, 'min_samples_leaf': 4}. Best is trial 70 with value: 0.8695652173913043.
[32m[I 2023-04-26 00:19:38,550][39m Trial 144 finished with value: 0.8376068376068375 and parameters: {'criterion': 'gini', 'n_estimators': 101, 'max_features': 0.6504272355597408, 'max_depth': 45, 'min_samples_split': 4, 'min_samples_leaf': 4}. Best is trial 70 with value: 0.8695652173913043.
[32m[I 2023-04-26 00:19:38,659][39m Trial 145 finished with value: 0.8571428571428572 and parameters: {'criterion': 'gini', 'n_estimators': 116, 'max_features': 0.6794019685206871, 'max_depth': 8, 'min_samples_split': 5, 'min_samples_leaf': 3}. Best is trial 70 with value: 0.8695652173913043.
[32m[I 2023-04-26 00:19:38,787][39m Trial 146 finished with value: 0.847457627118644 and parameters: {'criterion': 'gini', 'n_estimators': 150, 'max_features': 0.5534769555686455, 'max_depth': 19, 'min_samples_split': 6, 'min_samples_leaf': 5}. Best is trial 70 with value: 0.8695652173913043.
[32m[I 2023-04-26 00:19:38,900][39m Trial 147 finished with value: 0.8596491228070176 and parameters: {'criterion': 'gini', 'n_estimators': 119, 'max_features': 0.8182524648366596, 'max_depth': 14, 'min_samples_split': 4, 'min_samples_leaf': 4}. Best is trial 70 with value: 0.8695652173913043.
