[32m[I 2023-04-21 00:24:16,155][39m Trial 4019 finished with value: 0.8703703703703703 and parameters: {'objective': 'Logloss', 'colsample_bylevel': 0.09831144708767772, 'depth': 10, 'boosting_type': 'Plain', 'bootstrap_type': 'Bayesian', 'bagging_temperature': 6.283185353068021}. Best is trial 1464 with value: 0.8990825688073395.
[32m[I 2023-04-21 00:24:17,572][39m Trial 4020 finished with value: 0.8545454545454546 and parameters: {'objective': 'Logloss', 'colsample_bylevel': 0.09036893036668611, 'depth': 7, 'boosting_type': 'Plain', 'bootstrap_type': 'Bayesian', 'bagging_temperature': 5.569685329128496}. Best is trial 1464 with value: 0.8990825688073395.
[32m[I 2023-04-21 00:24:18,295][39m Trial 4021 finished with value: 0.8727272727272727 and parameters: {'objective': 'CrossEntropy', 'colsample_bylevel': 0.09444309095716497, 'depth': 8, 'boosting_type': 'Plain', 'bootstrap_type': 'Bayesian', 'bagging_temperature': 6.047215964757798}. Best is trial 1464 with value: 0.8990825688073395.
[32m[I 2023-04-21 00:24:19,174][39m Trial 4022 finished with value: 0.8807339449541284 and parameters: {'objective': 'CrossEntropy', 'colsample_bylevel': 0.0874348739143574, 'depth': 6, 'boosting_type': 'Plain', 'bootstrap_type': 'Bayesian', 'bagging_temperature': 6.4699529788626595}. Best is trial 1464 with value: 0.8990825688073395.
[32m[I 2023-04-21 00:24:19,957][39m Trial 4023 finished with value: 0.8727272727272727 and parameters: {'objective': 'CrossEntropy', 'colsample_bylevel': 0.08962045967101832, 'depth': 10, 'boosting_type': 'Plain', 'bootstrap_type': 'Bayesian', 'bagging_temperature': 6.702906449630712}. Best is trial 1464 with value: 0.8990825688073395.
[32m[I 2023-04-21 00:24:21,081][39m Trial 4024 finished with value: 0.8679245283018867 and parameters: {'objective': 'Logloss', 'colsample_bylevel': 0.0966536221222351, 'depth': 7, 'boosting_type': 'Plain', 'bootstrap_type': 'Bayesian', 'bagging_temperature': 7.609627366182794}. Best is trial 1464 with value: 0.8990825688073395.
[32m[I 2023-04-21 00:24:22,911][39m Trial 4025 finished with value: 0.8785046728971961 and parameters: {'objective': 'CrossEntropy', 'colsample_bylevel': 0.09108320743423652, 'depth': 8, 'boosting_type': 'Plain', 'bootstrap_type': 'Bayesian', 'bagging_temperature': 5.825459558116555}. Best is trial 1464 with value: 0.8990825688073395.
[32m[I 2023-04-21 00:24:23,975][39m Trial 4026 finished with value: 0.888888888888889 and parameters: {'objective': 'CrossEntropy', 'colsample_bylevel': 0.09220032235732831, 'depth': 10, 'boosting_type': 'Plain', 'bootstrap_type': 'Bayesian', 'bagging_temperature': 5.684598306928869}. Best is trial 1464 with value: 0.8990825688073395.
[32m[I 2023-04-21 00:24:24,736][39m Trial 4027 finished with value: 0.8785046728971961 and parameters: {'objective': 'Logloss', 'colsample_bylevel': 0.09841868346708527, 'depth': 7, 'boosting_type': 'Plain', 'bootstrap_type': 'Bayesian', 'bagging_temperature': 5.221103897609348}. Best is trial 1464 with value: 0.8990825688073395.
[32m[I 2023-04-21 00:24:26,125][39m Trial 4028 finished with value: 0.8495575221238938 and parameters: {'objective': 'Logloss', 'colsample_bylevel': 0.09432908820732709, 'depth': 8, 'boosting_type': 'Plain', 'bootstrap_type': 'Bayesian', 'bagging_temperature': 3.9046156649648047}. Best is trial 1464 with value: 0.8990825688073395.
[32m[I 2023-04-21 00:24:27,032][39m Trial 4029 finished with value: 0.8376068376068375 and parameters: {'objective': 'Logloss', 'colsample_bylevel': 0.0405118244736839, 'depth': 9, 'boosting_type': 'Plain', 'bootstrap_type': 'Bayesian', 'bagging_temperature': 5.227756714011428}. Best is trial 1464 with value: 0.8990825688073395.
[32m[I 2023-04-21 00:24:28,354][39m Trial 4030 finished with value: 0.8448275862068967 and parameters: {'objective': 'Logloss', 'colsample_bylevel': 0.05237371565877487, 'depth': 9, 'boosting_type': 'Plain', 'bootstrap_type': 'Bayesian', 'bagging_temperature': 5.396683578769877}. Best is trial 1464 with value: 0.8990825688073395.
[32m[I 2023-04-21 00:24:29,573][39m Trial 4031 finished with value: 0.8495575221238938 and parameters: {'objective': 'Logloss', 'colsample_bylevel': 0.09758372088221078, 'depth': 5, 'boosting_type': 'Plain', 'bootstrap_type': 'Bayesian', 'bagging_temperature': 4.818868127360672}. Best is trial 1464 with value: 0.8990825688073395.
[32m[I 2023-04-21 00:24:34,601][39m Trial 4032 finished with value: 0.8421052631578947 and parameters: {'objective': 'Logloss', 'colsample_bylevel': 0.09815415300692017, 'depth': 9, 'boosting_type': 'Ordered', 'bootstrap_type': 'Bayesian', 'bagging_temperature': 5.06417441922872}. Best is trial 1464 with value: 0.8990825688073395.
[32m[I 2023-04-21 00:24:35,710][39m Trial 4033 finished with value: 0.8727272727272727 and parameters: {'objective': 'Logloss', 'colsample_bylevel': 0.09609552812901376, 'depth': 7, 'boosting_type': 'Plain', 'bootstrap_type': 'Bayesian', 'bagging_temperature': 7.5795582221229605}. Best is trial 1464 with value: 0.8990825688073395.
[32m[I 2023-04-21 00:24:37,940][39m Trial 4034 finished with value: 0.8571428571428572 and parameters: {'objective': 'Logloss', 'colsample_bylevel': 0.09586549798622503, 'depth': 8, 'boosting_type': 'Plain', 'bootstrap_type': 'Bayesian', 'bagging_temperature': 5.488739104788085}. Best is trial 1464 with value: 0.8990825688073395.
[32m[I 2023-04-21 00:24:39,387][39m Trial 4035 finished with value: 0.8727272727272727 and parameters: {'objective': 'Logloss', 'colsample_bylevel': 0.09176496552363612, 'depth': 9, 'boosting_type': 'Plain', 'bootstrap_type': 'Bayesian', 'bagging_temperature': 5.152072259985091}. Best is trial 1464 with value: 0.8990825688073395.
[32m[I 2023-04-21 00:24:40,115][39m Trial 4036 finished with value: 0.8421052631578947 and parameters: {'objective': 'Logloss', 'colsample_bylevel': 0.09800997074493017, 'depth': 7, 'boosting_type': 'Plain', 'bootstrap_type': 'Bernoulli', 'subsample': 0.47880153560882033}. Best is trial 1464 with value: 0.8990825688073395.
[32m[I 2023-04-21 00:24:40,854][39m Trial 4037 finished with value: 0.8648648648648648 and parameters: {'objective': 'Logloss', 'colsample_bylevel': 0.09714914584363066, 'depth': 10, 'boosting_type': 'Plain', 'bootstrap_type': 'Bayesian', 'bagging_temperature': 6.468364165906727}. Best is trial 1464 with value: 0.8990825688073395.
[32m[I 2023-04-21 00:24:42,373][39m Trial 4038 finished with value: 0.8807339449541284 and parameters: {'objective': 'CrossEntropy', 'colsample_bylevel': 0.08706176229637376, 'depth': 11, 'boosting_type': 'Plain', 'bootstrap_type': 'Bayesian', 'bagging_temperature': 5.1927724624189535}. Best is trial 1464 with value: 0.8990825688073395.
[32m[I 2023-04-21 00:24:43,831][39m Trial 4039 finished with value: 0.8648648648648648 and parameters: {'objective': 'CrossEntropy', 'colsample_bylevel': 0.08919133124713118, 'depth': 8, 'boosting_type': 'Plain', 'bootstrap_type': 'Bayesian', 'bagging_temperature': 5.376514656818075}. Best is trial 1464 with value: 0.8990825688073395.
[32m[I 2023-04-21 00:24:45,177][39m Trial 4040 finished with value: 0.8521739130434783 and parameters: {'objective': 'Logloss', 'colsample_bylevel': 0.09068928599087378, 'depth': 10, 'boosting_type': 'Plain', 'bootstrap_type': 'MVS'}. Best is trial 1464 with value: 0.8990825688073395.
[32m[I 2023-04-21 00:24:45,981][39m Trial 4041 finished with value: 0.888888888888889 and parameters: {'objective': 'CrossEntropy', 'colsample_bylevel': 0.09757586921706873, 'depth': 8, 'boosting_type': 'Plain', 'bootstrap_type': 'Bayesian', 'bagging_temperature': 5.098410501961366}. Best is trial 1464 with value: 0.8990825688073395.
[32m[I 2023-04-21 00:24:46,754][39m Trial 4042 finished with value: 0.888888888888889 and parameters: {'objective': 'Logloss', 'colsample_bylevel': 0.09555236899987052, 'depth': 11, 'boosting_type': 'Plain', 'bootstrap_type': 'Bayesian', 'bagging_temperature': 3.957916313993183}. Best is trial 1464 with value: 0.8990825688073395.
[32m[I 2023-04-21 00:24:47,629][39m Trial 4043 finished with value: 0.8807339449541284 and parameters: {'objective': 'Logloss', 'colsample_bylevel': 0.09630086759026775, 'depth': 6, 'boosting_type': 'Plain', 'bootstrap_type': 'Bayesian', 'bagging_temperature': 5.795195352285982}. Best is trial 1464 with value: 0.8990825688073395.
[32m[I 2023-04-21 00:24:48,685][39m Trial 4044 finished with value: 0.8807339449541284 and parameters: {'objective': 'CrossEntropy', 'colsample_bylevel': 0.09462348459441368, 'depth': 9, 'boosting_type': 'Plain', 'bootstrap_type': 'Bayesian', 'bagging_temperature': 5.47562882103701}. Best is trial 1464 with value: 0.8990825688073395.
[32m[I 2023-04-21 00:24:49,996][39m Trial 4045 finished with value: 0.8785046728971961 and parameters: {'objective': 'Logloss', 'colsample_bylevel': 0.0959261075769106, 'depth': 7, 'boosting_type': 'Plain', 'bootstrap_type': 'Bayesian', 'bagging_temperature': 3.630111365971201}. Best is trial 1464 with value: 0.8990825688073395.
[32m[I 2023-04-21 00:24:51,153][39m Trial 4046 finished with value: 0.888888888888889 and parameters: {'objective': 'Logloss', 'colsample_bylevel': 0.09285454817014208, 'depth': 10, 'boosting_type': 'Plain', 'bootstrap_type': 'Bayesian', 'bagging_temperature': 3.3161689366500005}. Best is trial 1464 with value: 0.8990825688073395.
[32m[I 2023-04-21 00:24:53,039][39m Trial 4047 finished with value: 0.8495575221238938 and parameters: {'objective': 'Logloss', 'colsample_bylevel': 0.07725434461317936, 'depth': 9, 'boosting_type': 'Plain', 'bootstrap_type': 'Bayesian', 'bagging_temperature': 5.327669686255966}. Best is trial 1464 with value: 0.8990825688073395.
[32m[I 2023-04-21 00:24:53,841][39m Trial 4048 finished with value: 0.890909090909091 and parameters: {'objective': 'Logloss', 'colsample_bylevel': 0.09068101145842782, 'depth': 11, 'boosting_type': 'Plain', 'bootstrap_type': 'Bayesian', 'bagging_temperature': 5.587661090333518}. Best is trial 1464 with value: 0.8990825688073395.
[32m[I 2023-04-21 00:24:54,568][39m Trial 4049 finished with value: 0.8828828828828829 and parameters: {'objective': 'Logloss', 'colsample_bylevel': 0.08889739711192736, 'depth': 12, 'boosting_type': 'Plain', 'bootstrap_type': 'Bayesian', 'bagging_temperature': 4.940995235686023}. Best is trial 1464 with value: 0.8990825688073395.
[32m[I 2023-04-21 00:24:55,289][39m Trial 4050 finished with value: 0.8807339449541284 and parameters: {'objective': 'Logloss', 'colsample_bylevel': 0.09612839783621001, 'depth': 7, 'boosting_type': 'Plain', 'bootstrap_type': 'Bayesian', 'bagging_temperature': 4.6710715561969565}. Best is trial 1464 with value: 0.8990825688073395.
[32m[I 2023-04-21 00:25:00,763][39m Trial 4051 finished with value: 0.8421052631578947 and parameters: {'objective': 'CrossEntropy', 'colsample_bylevel': 0.09257881478574935, 'depth': 10, 'boosting_type': 'Ordered', 'bootstrap_type': 'Bayesian', 'bagging_temperature': 6.877427558114249}. Best is trial 1464 with value: 0.8990825688073395.
[32m[I 2023-04-21 00:25:02,716][39m Trial 4052 finished with value: 0.8648648648648648 and parameters: {'objective': 'Logloss', 'colsample_bylevel': 0.09383670712622993, 'depth': 9, 'boosting_type': 'Plain', 'bootstrap_type': 'Bayesian', 'bagging_temperature': 6.634051099379531}. Best is trial 1464 with value: 0.8990825688073395.
[32m[I 2023-04-21 00:25:03,822][39m Trial 4053 finished with value: 0.8807339449541284 and parameters: {'objective': 'Logloss', 'colsample_bylevel': 0.09123995445120511, 'depth': 10, 'boosting_type': 'Plain', 'bootstrap_type': 'Bayesian', 'bagging_temperature': 3.9307624846413773}. Best is trial 1464 with value: 0.8990825688073395.
[32m[I 2023-04-21 00:25:04,646][39m Trial 4054 finished with value: 0.8807339449541284 and parameters: {'objective': 'CrossEntropy', 'colsample_bylevel': 0.08881531633976775, 'depth': 8, 'boosting_type': 'Plain', 'bootstrap_type': 'Bayesian', 'bagging_temperature': 4.978620708618906}. Best is trial 1464 with value: 0.8990825688073395.
[32m[I 2023-04-21 00:25:05,890][39m Trial 4055 finished with value: 0.8703703703703703 and parameters: {'objective': 'Logloss', 'colsample_bylevel': 0.09445576724293922, 'depth': 7, 'boosting_type': 'Plain', 'bootstrap_type': 'Bayesian', 'bagging_temperature': 7.5598817561050495}. Best is trial 1464 with value: 0.8990825688073395.
[32m[I 2023-04-21 00:25:07,507][39m Trial 4056 finished with value: 0.8648648648648648 and parameters: {'objective': 'CrossEntropy', 'colsample_bylevel': 0.08148300895249526, 'depth': 9, 'boosting_type': 'Plain', 'bootstrap_type': 'Bayesian', 'bagging_temperature': 4.620047570875295}. Best is trial 1464 with value: 0.8990825688073395.
[32m[I 2023-04-21 00:25:08,306][39m Trial 4057 finished with value: 0.8727272727272727 and parameters: {'objective': 'CrossEntropy', 'colsample_bylevel': 0.09997590566737063, 'depth': 7, 'boosting_type': 'Plain', 'bootstrap_type': 'Bernoulli', 'subsample': 0.18978681927056867}. Best is trial 1464 with value: 0.8990825688073395.
[32m[I 2023-04-21 00:25:09,003][39m Trial 4058 finished with value: 0.875 and parameters: {'objective': 'Logloss', 'colsample_bylevel': 0.08731331343123255, 'depth': 6, 'boosting_type': 'Plain', 'bootstrap_type': 'Bayesian', 'bagging_temperature': 5.506004580114402}. Best is trial 1464 with value: 0.8990825688073395.
[32m[I 2023-04-21 00:25:10,321][39m Trial 4059 finished with value: 0.8807339449541284 and parameters: {'objective': 'Logloss', 'colsample_bylevel': 0.09237645597580414, 'depth': 8, 'boosting_type': 'Plain', 'bootstrap_type': 'Bayesian', 'bagging_temperature': 6.744394018837417}. Best is trial 1464 with value: 0.8990825688073395.
[32m[I 2023-04-21 00:25:11,481][39m Trial 4060 finished with value: 0.8703703703703703 and parameters: {'objective': 'CrossEntropy', 'colsample_bylevel': 0.09814348289772304, 'depth': 10, 'boosting_type': 'Plain', 'bootstrap_type': 'Bayesian', 'bagging_temperature': 4.557816070596799}. Best is trial 1464 with value: 0.8990825688073395.
[32m[I 2023-04-21 00:25:12,541][39m Trial 4061 finished with value: 0.8807339449541284 and parameters: {'objective': 'CrossEntropy', 'colsample_bylevel': 0.08896500746640729, 'depth': 10, 'boosting_type': 'Plain', 'bootstrap_type': 'Bayesian', 'bagging_temperature': 5.32220416020585}. Best is trial 1464 with value: 0.8990825688073395.
[32m[I 2023-04-21 00:25:13,988][39m Trial 4062 finished with value: 0.8727272727272727 and parameters: {'objective': 'Logloss', 'colsample_bylevel': 0.09806968857037676, 'depth': 8, 'boosting_type': 'Plain', 'bootstrap_type': 'Bayesian', 'bagging_temperature': 5.569656615548988}. Best is trial 1464 with value: 0.8990825688073395.
[32m[I 2023-04-21 00:25:14,649][39m Trial 4063 finished with value: 0.8421052631578947 and parameters: {'objective': 'CrossEntropy', 'colsample_bylevel': 0.09052075372824876, 'depth': 10, 'boosting_type': 'Plain', 'bootstrap_type': 'MVS'}. Best is trial 1464 with value: 0.8990825688073395.
[32m[I 2023-04-21 00:25:16,036][39m Trial 4064 finished with value: 0.875 and parameters: {'objective': 'Logloss', 'colsample_bylevel': 0.09680283931373541, 'depth': 10, 'boosting_type': 'Plain', 'bootstrap_type': 'Bayesian', 'bagging_temperature': 7.062255406124227}. Best is trial 1464 with value: 0.8990825688073395.
[32m[I 2023-04-21 00:25:17,543][39m Trial 4065 finished with value: 0.8495575221238938 and parameters: {'objective': 'CrossEntropy', 'colsample_bylevel': 0.07023653687865553, 'depth': 7, 'boosting_type': 'Plain', 'bootstrap_type': 'Bayesian', 'bagging_temperature': 6.16211449582636}. Best is trial 1464 with value: 0.8990825688073395.
[32m[I 2023-04-21 00:25:18,301][39m Trial 4066 finished with value: 0.888888888888889 and parameters: {'objective': 'CrossEntropy', 'colsample_bylevel': 0.0906788490888902, 'depth': 7, 'boosting_type': 'Plain', 'bootstrap_type': 'Bayesian', 'bagging_temperature': 5.513842069432652}. Best is trial 1464 with value: 0.8990825688073395.
[32m[I 2023-04-21 00:25:19,505][39m Trial 4067 finished with value: 0.8545454545454546 and parameters: {'objective': 'Logloss', 'colsample_bylevel': 0.09201296175157321, 'depth': 9, 'boosting_type': 'Plain', 'bootstrap_type': 'Bayesian', 'bagging_temperature': 7.3441298332703635}. Best is trial 1464 with value: 0.8990825688073395.
[32m[I 2023-04-21 00:25:21,220][39m Trial 4068 finished with value: 0.8672566371681416 and parameters: {'objective': 'CrossEntropy', 'colsample_bylevel': 0.09568296687077946, 'depth': 9, 'boosting_type': 'Plain', 'bootstrap_type': 'Bayesian', 'bagging_temperature': 6.254924231414921}. Best is trial 1464 with value: 0.8990825688073395.
[32m[I 2023-04-21 00:25:22,492][39m Trial 4069 finished with value: 0.8703703703703703 and parameters: {'objective': 'Logloss', 'colsample_bylevel': 0.09458928194895654, 'depth': 10, 'boosting_type': 'Plain', 'bootstrap_type': 'Bayesian', 'bagging_temperature': 6.529297570368787}. Best is trial 1464 with value: 0.8990825688073395.
[32m[I 2023-04-21 00:25:23,193][39m Trial 4070 finished with value: 0.8807339449541284 and parameters: {'objective': 'Logloss', 'colsample_bylevel': 0.0928537231091821, 'depth': 6, 'boosting_type': 'Plain', 'bootstrap_type': 'Bayesian', 'bagging_temperature': 5.63334304535464}. Best is trial 1464 with value: 0.8990825688073395.
[32m[I 2023-04-21 00:25:23,886][39m Trial 4071 finished with value: 0.8807339449541284 and parameters: {'objective': 'CrossEntropy', 'colsample_bylevel': 0.09282515122211712, 'depth': 8, 'boosting_type': 'Plain', 'bootstrap_type': 'Bayesian', 'bagging_temperature': 5.6403234672273745}. Best is trial 1464 with value: 0.8990825688073395.
[32m[I 2023-04-21 00:25:29,186][39m Trial 4072 finished with value: 0.8448275862068967 and parameters: {'objective': 'CrossEntropy', 'colsample_bylevel': 0.08737349693433535, 'depth': 3, 'boosting_type': 'Ordered', 'bootstrap_type': 'Bayesian', 'bagging_temperature': 5.323566326783563}. Best is trial 1464 with value: 0.8990825688073395.
[32m[I 2023-04-21 00:25:30,875][39m Trial 4073 finished with value: 0.8807339449541284 and parameters: {'objective': 'Logloss', 'colsample_bylevel': 0.09338900051414899, 'depth': 9, 'boosting_type': 'Plain', 'bootstrap_type': 'Bayesian', 'bagging_temperature': 5.449714640723459}. Best is trial 1464 with value: 0.8990825688073395.
[32m[I 2023-04-21 00:25:32,314][39m Trial 4074 finished with value: 0.8727272727272727 and parameters: {'objective': 'Logloss', 'colsample_bylevel': 0.09701606783896875, 'depth': 10, 'boosting_type': 'Plain', 'bootstrap_type': 'Bayesian', 'bagging_temperature': 6.312414136209401}. Best is trial 1464 with value: 0.8990825688073395.
[32m[I 2023-04-21 00:25:33,046][39m Trial 4075 finished with value: 0.888888888888889 and parameters: {'objective': 'Logloss', 'colsample_bylevel': 0.0940386275857515, 'depth': 10, 'boosting_type': 'Plain', 'bootstrap_type': 'Bayesian', 'bagging_temperature': 6.2545481991118095}. Best is trial 1464 with value: 0.8990825688073395.
[32m[I 2023-04-21 00:25:34,286][39m Trial 4076 finished with value: 0.8571428571428572 and parameters: {'objective': 'Logloss', 'colsample_bylevel': 0.0907320883400051, 'depth': 7, 'boosting_type': 'Plain', 'bootstrap_type': 'Bayesian', 'bagging_temperature': 5.016565625400876}. Best is trial 1464 with value: 0.8990825688073395.
[32m[I 2023-04-21 00:25:35,723][39m Trial 4077 finished with value: 0.875 and parameters: {'objective': 'CrossEntropy', 'colsample_bylevel': 0.0899319656607311, 'depth': 11, 'boosting_type': 'Plain', 'bootstrap_type': 'Bayesian', 'bagging_temperature': 6.450720836639547}. Best is trial 1464 with value: 0.8990825688073395.
[32m[I 2023-04-21 00:25:36,778][39m Trial 4078 finished with value: 0.8703703703703703 and parameters: {'objective': 'Logloss', 'colsample_bylevel': 0.09213414932097634, 'depth': 12, 'boosting_type': 'Plain', 'bootstrap_type': 'Bayesian', 'bagging_temperature': 5.7885998359042565}. Best is trial 1464 with value: 0.8990825688073395.
[32m[I 2023-04-21 00:25:37,683][39m Trial 4079 finished with value: 0.8623853211009175 and parameters: {'objective': 'CrossEntropy', 'colsample_bylevel': 0.09280627885074527, 'depth': 11, 'boosting_type': 'Plain', 'bootstrap_type': 'Bernoulli', 'subsample': 0.7993479651153929}. Best is trial 1464 with value: 0.8990825688073395.
[32m[I 2023-04-21 00:25:38,346][39m Trial 4080 finished with value: 0.8807339449541284 and parameters: {'objective': 'Logloss', 'colsample_bylevel': 0.09482142911545738, 'depth': 11, 'boosting_type': 'Plain', 'bootstrap_type': 'Bayesian', 'bagging_temperature': 6.643021469115269}. Best is trial 1464 with value: 0.8990825688073395.
[32m[I 2023-04-21 00:25:39,460][39m Trial 4081 finished with value: 0.875 and parameters: {'objective': 'Logloss', 'colsample_bylevel': 0.09565694665973272, 'depth': 9, 'boosting_type': 'Plain', 'bootstrap_type': 'Bayesian', 'bagging_temperature': 4.891161674589241}. Best is trial 1464 with value: 0.8990825688073395.
[32m[I 2023-04-21 00:25:40,838][39m Trial 4082 finished with value: 0.8807339449541284 and parameters: {'objective': 'CrossEntropy', 'colsample_bylevel': 0.09307910065535123, 'depth': 9, 'boosting_type': 'Plain', 'bootstrap_type': 'Bayesian', 'bagging_temperature': 5.0105234784753465}. Best is trial 1464 with value: 0.8990825688073395.
[32m[I 2023-04-21 00:25:42,552][39m Trial 4083 finished with value: 0.8727272727272727 and parameters: {'objective': 'Logloss', 'colsample_bylevel': 0.0968299843766284, 'depth': 9, 'boosting_type': 'Plain', 'bootstrap_type': 'Bayesian', 'bagging_temperature': 6.378965198999516}. Best is trial 1464 with value: 0.8990825688073395.
[32m[I 2023-04-21 00:25:43,360][39m Trial 4084 finished with value: 0.8571428571428572 and parameters: {'objective': 'CrossEntropy', 'colsample_bylevel': 0.09861205934410054, 'depth': 10, 'boosting_type': 'Plain', 'bootstrap_type': 'MVS'}. Best is trial 1464 with value: 0.8990825688073395.
