[32m[I 2023-04-21 00:16:45,507][39m Trial 3689 finished with value: 0.8727272727272727 and parameters: {'objective': 'Logloss', 'colsample_bylevel': 0.09134304493103129, 'depth': 10, 'boosting_type': 'Plain', 'bootstrap_type': 'Bayesian', 'bagging_temperature': 6.185512380392927}. Best is trial 1464 with value: 0.8990825688073395.
[32m[I 2023-04-21 00:16:46,930][39m Trial 3690 finished with value: 0.8672566371681416 and parameters: {'objective': 'Logloss', 'colsample_bylevel': 0.0965483428771342, 'depth': 9, 'boosting_type': 'Plain', 'bootstrap_type': 'MVS'}. Best is trial 1464 with value: 0.8990825688073395.
[32m[I 2023-04-21 00:16:48,653][39m Trial 3691 finished with value: 0.8648648648648648 and parameters: {'objective': 'CrossEntropy', 'colsample_bylevel': 0.09539826080982623, 'depth': 9, 'boosting_type': 'Plain', 'bootstrap_type': 'Bayesian', 'bagging_temperature': 6.941833021160065}. Best is trial 1464 with value: 0.8990825688073395.
[32m[I 2023-04-21 00:16:50,290][39m Trial 3692 finished with value: 0.8727272727272727 and parameters: {'objective': 'Logloss', 'colsample_bylevel': 0.09868392355256447, 'depth': 8, 'boosting_type': 'Plain', 'bootstrap_type': 'Bayesian', 'bagging_temperature': 5.123566136692541}. Best is trial 1464 with value: 0.8990825688073395.
[32m[I 2023-04-21 00:16:51,085][39m Trial 3693 finished with value: 0.8623853211009175 and parameters: {'objective': 'CrossEntropy', 'colsample_bylevel': 0.09978061096531067, 'depth': 8, 'boosting_type': 'Plain', 'bootstrap_type': 'Bayesian', 'bagging_temperature': 5.281935960734965}. Best is trial 1464 with value: 0.8990825688073395.
[32m[I 2023-04-21 00:16:51,985][39m Trial 3694 finished with value: 0.8545454545454546 and parameters: {'objective': 'Logloss', 'colsample_bylevel': 0.09384253637108657, 'depth': 6, 'boosting_type': 'Plain', 'bootstrap_type': 'Bayesian', 'bagging_temperature': 5.1073281334428495}. Best is trial 1464 with value: 0.8990825688073395.
[32m[I 2023-04-21 00:16:53,302][39m Trial 3695 finished with value: 0.8727272727272727 and parameters: {'objective': 'CrossEntropy', 'colsample_bylevel': 0.08679677058754835, 'depth': 9, 'boosting_type': 'Plain', 'bootstrap_type': 'Bayesian', 'bagging_temperature': 4.771194337122584}. Best is trial 1464 with value: 0.8990825688073395.
[32m[I 2023-04-21 00:16:57,931][39m Trial 3696 finished with value: 0.8571428571428572 and parameters: {'objective': 'Logloss', 'colsample_bylevel': 0.09221238709933, 'depth': 9, 'boosting_type': 'Ordered', 'bootstrap_type': 'Bayesian', 'bagging_temperature': 6.100197837235735}. Best is trial 1464 with value: 0.8990825688073395.
[32m[I 2023-04-21 00:16:59,185][39m Trial 3697 finished with value: 0.888888888888889 and parameters: {'objective': 'Logloss', 'colsample_bylevel': 0.09680364154580778, 'depth': 7, 'boosting_type': 'Plain', 'bootstrap_type': 'Bayesian', 'bagging_temperature': 3.9501949852887934}. Best is trial 1464 with value: 0.8990825688073395.
[32m[I 2023-04-21 00:17:00,484][39m Trial 3698 finished with value: 0.8672566371681416 and parameters: {'objective': 'Logloss', 'colsample_bylevel': 0.09308666748013747, 'depth': 8, 'boosting_type': 'Plain', 'bootstrap_type': 'Bayesian', 'bagging_temperature': 5.321892245629725}. Best is trial 1464 with value: 0.8990825688073395.
[32m[I 2023-04-21 00:17:02,529][39m Trial 3699 finished with value: 0.8727272727272727 and parameters: {'objective': 'Logloss', 'colsample_bylevel': 0.09734407604901946, 'depth': 9, 'boosting_type': 'Plain', 'bootstrap_type': 'Bayesian', 'bagging_temperature': 6.97347345915327}. Best is trial 1464 with value: 0.8990825688073395.
[32m[I 2023-04-21 00:17:04,082][39m Trial 3700 finished with value: 0.8807339449541284 and parameters: {'objective': 'Logloss', 'colsample_bylevel': 0.09456944502503586, 'depth': 8, 'boosting_type': 'Plain', 'bootstrap_type': 'Bayesian', 'bagging_temperature': 7.168992096026498}. Best is trial 1464 with value: 0.8990825688073395.
[32m[I 2023-04-21 00:17:04,731][39m Trial 3701 finished with value: 0.8727272727272727 and parameters: {'objective': 'CrossEntropy', 'colsample_bylevel': 0.09707053925314332, 'depth': 10, 'boosting_type': 'Plain', 'bootstrap_type': 'Bayesian', 'bagging_temperature': 6.660690951985127}. Best is trial 1464 with value: 0.8990825688073395.
[32m[I 2023-04-21 00:17:05,874][39m Trial 3702 finished with value: 0.8807339449541284 and parameters: {'objective': 'Logloss', 'colsample_bylevel': 0.0983746882597992, 'depth': 9, 'boosting_type': 'Plain', 'bootstrap_type': 'Bayesian', 'bagging_temperature': 4.4639248433830305}. Best is trial 1464 with value: 0.8990825688073395.
[32m[I 2023-04-21 00:17:06,884][39m Trial 3703 finished with value: 0.8727272727272727 and parameters: {'objective': 'Logloss', 'colsample_bylevel': 0.09715317599939902, 'depth': 8, 'boosting_type': 'Plain', 'bootstrap_type': 'Bayesian', 'bagging_temperature': 5.916565314163969}. Best is trial 1464 with value: 0.8990825688073395.
[32m[I 2023-04-21 00:17:08,350][39m Trial 3704 finished with value: 0.888888888888889 and parameters: {'objective': 'Logloss', 'colsample_bylevel': 0.09953394330911013, 'depth': 9, 'boosting_type': 'Plain', 'bootstrap_type': 'Bayesian', 'bagging_temperature': 5.4585965260685665}. Best is trial 1464 with value: 0.8990825688073395.
[32m[I 2023-04-21 00:17:09,805][39m Trial 3705 finished with value: 0.8807339449541284 and parameters: {'objective': 'Logloss', 'colsample_bylevel': 0.09448259119129798, 'depth': 9, 'boosting_type': 'Plain', 'bootstrap_type': 'Bayesian', 'bagging_temperature': 5.808481286338033}. Best is trial 1464 with value: 0.8990825688073395.
[32m[I 2023-04-21 00:17:10,842][39m Trial 3706 finished with value: 0.8807339449541284 and parameters: {'objective': 'CrossEntropy', 'colsample_bylevel': 0.09704252980035387, 'depth': 9, 'boosting_type': 'Plain', 'bootstrap_type': 'Bayesian', 'bagging_temperature': 4.637318535416931}. Best is trial 1464 with value: 0.8990825688073395.
[32m[I 2023-04-21 00:17:11,766][39m Trial 3707 finished with value: 0.8672566371681416 and parameters: {'objective': 'Logloss', 'colsample_bylevel': 0.09465296133938284, 'depth': 11, 'boosting_type': 'Plain', 'bootstrap_type': 'Bernoulli', 'subsample': 0.7201327789595955}. Best is trial 1464 with value: 0.8990825688073395.
[32m[I 2023-04-21 00:17:12,795][39m Trial 3708 finished with value: 0.8727272727272727 and parameters: {'objective': 'Logloss', 'colsample_bylevel': 0.09661266728846046, 'depth': 9, 'boosting_type': 'Plain', 'bootstrap_type': 'Bayesian', 'bagging_temperature': 6.4917975298917465}. Best is trial 1464 with value: 0.8990825688073395.
[32m[I 2023-04-21 00:17:13,614][39m Trial 3709 finished with value: 0.8495575221238938 and parameters: {'objective': 'Logloss', 'colsample_bylevel': 0.09522620633046854, 'depth': 5, 'boosting_type': 'Plain', 'bootstrap_type': 'Bayesian', 'bagging_temperature': 6.747838107757475}. Best is trial 1464 with value: 0.8990825688073395.
[32m[I 2023-04-21 00:17:14,844][39m Trial 3710 finished with value: 0.8347826086956522 and parameters: {'objective': 'Logloss', 'colsample_bylevel': 0.07984521846672488, 'depth': 7, 'boosting_type': 'Plain', 'bootstrap_type': 'Bayesian', 'bagging_temperature': 4.189677176363033}. Best is trial 1464 with value: 0.8990825688073395.
[32m[I 2023-04-21 00:17:16,152][39m Trial 3711 finished with value: 0.8347826086956522 and parameters: {'objective': 'Logloss', 'colsample_bylevel': 0.07124530944278733, 'depth': 9, 'boosting_type': 'Plain', 'bootstrap_type': 'Bayesian', 'bagging_temperature': 3.776330287239304}. Best is trial 1464 with value: 0.8990825688073395.
[32m[I 2023-04-21 00:17:17,559][39m Trial 3712 finished with value: 0.8672566371681416 and parameters: {'objective': 'CrossEntropy', 'colsample_bylevel': 0.09998087174714261, 'depth': 9, 'boosting_type': 'Plain', 'bootstrap_type': 'MVS'}. Best is trial 1464 with value: 0.8990825688073395.
[32m[I 2023-04-21 00:17:18,833][39m Trial 3713 finished with value: 0.8623853211009175 and parameters: {'objective': 'CrossEntropy', 'colsample_bylevel': 0.08830456640940652, 'depth': 8, 'boosting_type': 'Plain', 'bootstrap_type': 'Bayesian', 'bagging_temperature': 4.94871577109175}. Best is trial 1464 with value: 0.8990825688073395.
[32m[I 2023-04-21 00:17:23,675][39m Trial 3714 finished with value: 0.8347826086956522 and parameters: {'objective': 'Logloss', 'colsample_bylevel': 0.09535840746062517, 'depth': 9, 'boosting_type': 'Ordered', 'bootstrap_type': 'Bayesian', 'bagging_temperature': 3.294463947836097}. Best is trial 1464 with value: 0.8990825688073395.
[32m[I 2023-04-21 00:17:25,647][39m Trial 3715 finished with value: 0.8727272727272727 and parameters: {'objective': 'Logloss', 'colsample_bylevel': 0.09490078849735654, 'depth': 9, 'boosting_type': 'Plain', 'bootstrap_type': 'Bayesian', 'bagging_temperature': 3.8962120193644987}. Best is trial 1464 with value: 0.8990825688073395.
[32m[I 2023-04-21 00:17:26,419][39m Trial 3716 finished with value: 0.8727272727272727 and parameters: {'objective': 'Logloss', 'colsample_bylevel': 0.09831536695697872, 'depth': 10, 'boosting_type': 'Plain', 'bootstrap_type': 'Bayesian', 'bagging_temperature': 4.169440146110022}. Best is trial 1464 with value: 0.8990825688073395.
[32m[I 2023-04-21 00:17:27,219][39m Trial 3717 finished with value: 0.8727272727272727 and parameters: {'objective': 'Logloss', 'colsample_bylevel': 0.09827736762499352, 'depth': 10, 'boosting_type': 'Plain', 'bootstrap_type': 'Bayesian', 'bagging_temperature': 4.065315573949989}. Best is trial 1464 with value: 0.8990825688073395.
[32m[I 2023-04-21 00:17:28,518][39m Trial 3718 finished with value: 0.8807339449541284 and parameters: {'objective': 'Logloss', 'colsample_bylevel': 0.08887484951647208, 'depth': 9, 'boosting_type': 'Plain', 'bootstrap_type': 'Bayesian', 'bagging_temperature': 5.147131983816687}. Best is trial 1464 with value: 0.8990825688073395.
[32m[I 2023-04-21 00:17:30,791][39m Trial 3719 finished with value: 0.8807339449541284 and parameters: {'objective': 'Logloss', 'colsample_bylevel': 0.09832106144232938, 'depth': 9, 'boosting_type': 'Plain', 'bootstrap_type': 'Bayesian', 'bagging_temperature': 4.972982130882904}. Best is trial 1464 with value: 0.8990825688073395.
[32m[I 2023-04-21 00:17:31,557][39m Trial 3720 finished with value: 0.8807339449541284 and parameters: {'objective': 'Logloss', 'colsample_bylevel': 0.09708093072371343, 'depth': 10, 'boosting_type': 'Plain', 'bootstrap_type': 'Bayesian', 'bagging_temperature': 4.152817694131794}. Best is trial 1464 with value: 0.8990825688073395.
[32m[I 2023-04-21 00:17:32,553][39m Trial 3721 finished with value: 0.8623853211009175 and parameters: {'objective': 'Logloss', 'colsample_bylevel': 0.09306271070420213, 'depth': 7, 'boosting_type': 'Plain', 'bootstrap_type': 'Bayesian', 'bagging_temperature': 3.662436977228286}. Best is trial 1464 with value: 0.8990825688073395.
[32m[I 2023-04-21 00:17:33,644][39m Trial 3722 finished with value: 0.8672566371681416 and parameters: {'objective': 'Logloss', 'colsample_bylevel': 0.09693741724368242, 'depth': 8, 'boosting_type': 'Plain', 'bootstrap_type': 'Bayesian', 'bagging_temperature': 5.239097468660258}. Best is trial 1464 with value: 0.8990825688073395.
[32m[I 2023-04-21 00:17:34,806][39m Trial 3723 finished with value: 0.8785046728971961 and parameters: {'objective': 'Logloss', 'colsample_bylevel': 0.09294285597531148, 'depth': 9, 'boosting_type': 'Plain', 'bootstrap_type': 'Bayesian', 'bagging_temperature': 6.187640989942661}. Best is trial 1464 with value: 0.8990825688073395.
[32m[I 2023-04-21 00:17:36,622][39m Trial 3724 finished with value: 0.8727272727272727 and parameters: {'objective': 'Logloss', 'colsample_bylevel': 0.09381185942737096, 'depth': 9, 'boosting_type': 'Plain', 'bootstrap_type': 'Bayesian', 'bagging_temperature': 4.6166405817499}. Best is trial 1464 with value: 0.8990825688073395.
[32m[I 2023-04-21 00:17:37,514][39m Trial 3725 finished with value: 0.8703703703703703 and parameters: {'objective': 'CrossEntropy', 'colsample_bylevel': 0.0883726667460098, 'depth': 10, 'boosting_type': 'Plain', 'bootstrap_type': 'Bayesian', 'bagging_temperature': 4.988267385513571}. Best is trial 1464 with value: 0.8990825688073395.
[32m[I 2023-04-21 00:17:38,653][39m Trial 3726 finished with value: 0.888888888888889 and parameters: {'objective': 'Logloss', 'colsample_bylevel': 0.09992210869540107, 'depth': 9, 'boosting_type': 'Plain', 'bootstrap_type': 'Bayesian', 'bagging_temperature': 4.427974066768875}. Best is trial 1464 with value: 0.8990825688073395.
[32m[I 2023-04-21 00:17:40,438][39m Trial 3727 finished with value: 0.8828828828828829 and parameters: {'objective': 'CrossEntropy', 'colsample_bylevel': 0.0873379328678774, 'depth': 8, 'boosting_type': 'Plain', 'bootstrap_type': 'Bayesian', 'bagging_temperature': 5.385540090938793}. Best is trial 1464 with value: 0.8990825688073395.
[32m[I 2023-04-21 00:17:41,157][39m Trial 3728 finished with value: 0.875 and parameters: {'objective': 'Logloss', 'colsample_bylevel': 0.09824952306267563, 'depth': 10, 'boosting_type': 'Plain', 'bootstrap_type': 'Bayesian', 'bagging_temperature': 3.9775740636742274}. Best is trial 1464 with value: 0.8990825688073395.
[32m[I 2023-04-21 00:17:42,005][39m Trial 3729 finished with value: 0.8807339449541284 and parameters: {'objective': 'CrossEntropy', 'colsample_bylevel': 0.0918599413185322, 'depth': 8, 'boosting_type': 'Plain', 'bootstrap_type': 'Bayesian', 'bagging_temperature': 4.933537010624352}. Best is trial 1464 with value: 0.8990825688073395.
[32m[I 2023-04-21 00:17:43,787][39m Trial 3730 finished with value: 0.8727272727272727 and parameters: {'objective': 'Logloss', 'colsample_bylevel': 0.09170853731995089, 'depth': 9, 'boosting_type': 'Plain', 'bootstrap_type': 'Bayesian', 'bagging_temperature': 7.0439655042882725}. Best is trial 1464 with value: 0.8990825688073395.
[32m[I 2023-04-21 00:17:45,351][39m Trial 3731 finished with value: 0.875 and parameters: {'objective': 'Logloss', 'colsample_bylevel': 0.09634966047500355, 'depth': 9, 'boosting_type': 'Plain', 'bootstrap_type': 'Bernoulli', 'subsample': 0.45701781328179536}. Best is trial 1464 with value: 0.8990825688073395.
[32m[I 2023-04-21 00:17:46,303][39m Trial 3732 finished with value: 0.8648648648648648 and parameters: {'objective': 'Logloss', 'colsample_bylevel': 0.09105647601401395, 'depth': 10, 'boosting_type': 'Plain', 'bootstrap_type': 'Bayesian', 'bagging_temperature': 5.66563745103311}. Best is trial 1464 with value: 0.8990825688073395.
[32m[I 2023-04-21 00:17:50,739][39m Trial 3733 finished with value: 0.8495575221238938 and parameters: {'objective': 'CrossEntropy', 'colsample_bylevel': 0.09571466239697972, 'depth': 9, 'boosting_type': 'Ordered', 'bootstrap_type': 'MVS'}. Best is trial 1464 with value: 0.8990825688073395.
[32m[I 2023-04-21 00:17:52,449][39m Trial 3734 finished with value: 0.8828828828828829 and parameters: {'objective': 'Logloss', 'colsample_bylevel': 0.09086419670028291, 'depth': 9, 'boosting_type': 'Plain', 'bootstrap_type': 'Bayesian', 'bagging_temperature': 5.621294395020529}. Best is trial 1464 with value: 0.8990825688073395.
[32m[I 2023-04-21 00:17:53,510][39m Trial 3735 finished with value: 0.8648648648648648 and parameters: {'objective': 'Logloss', 'colsample_bylevel': 0.0983123966865391, 'depth': 8, 'boosting_type': 'Plain', 'bootstrap_type': 'Bayesian', 'bagging_temperature': 4.7924072482922675}. Best is trial 1464 with value: 0.8990825688073395.
[32m[I 2023-04-21 00:17:54,518][39m Trial 3736 finished with value: 0.8727272727272727 and parameters: {'objective': 'Logloss', 'colsample_bylevel': 0.0984176075744981, 'depth': 10, 'boosting_type': 'Plain', 'bootstrap_type': 'Bayesian', 'bagging_temperature': 4.270098602057492}. Best is trial 1464 with value: 0.8990825688073395.
[32m[I 2023-04-21 00:17:55,516][39m Trial 3737 finished with value: 0.8807339449541284 and parameters: {'objective': 'Logloss', 'colsample_bylevel': 0.0914258959023942, 'depth': 11, 'boosting_type': 'Plain', 'bootstrap_type': 'Bayesian', 'bagging_temperature': 5.321581775596583}. Best is trial 1464 with value: 0.8990825688073395.
[32m[I 2023-04-21 00:17:56,618][39m Trial 3738 finished with value: 0.8828828828828829 and parameters: {'objective': 'Logloss', 'colsample_bylevel': 0.09515045701899334, 'depth': 11, 'boosting_type': 'Plain', 'bootstrap_type': 'Bayesian', 'bagging_temperature': 6.420058053709137}. Best is trial 1464 with value: 0.8990825688073395.
[32m[I 2023-04-21 00:17:58,040][39m Trial 3739 finished with value: 0.8545454545454546 and parameters: {'objective': 'Logloss', 'colsample_bylevel': 0.09105809165881587, 'depth': 6, 'boosting_type': 'Plain', 'bootstrap_type': 'Bayesian', 'bagging_temperature': 4.118266273532064}. Best is trial 1464 with value: 0.8990825688073395.
[32m[I 2023-04-21 00:17:59,076][39m Trial 3740 finished with value: 0.8828828828828829 and parameters: {'objective': 'CrossEntropy', 'colsample_bylevel': 0.09758612772423847, 'depth': 7, 'boosting_type': 'Plain', 'bootstrap_type': 'Bayesian', 'bagging_temperature': 4.427046823139244}. Best is trial 1464 with value: 0.8990825688073395.
[32m[I 2023-04-21 00:18:00,584][39m Trial 3741 finished with value: 0.8807339449541284 and parameters: {'objective': 'Logloss', 'colsample_bylevel': 0.09993023903514824, 'depth': 8, 'boosting_type': 'Plain', 'bootstrap_type': 'Bayesian', 'bagging_temperature': 7.305549918027307}. Best is trial 1464 with value: 0.8990825688073395.
[32m[I 2023-04-21 00:18:01,321][39m Trial 3742 finished with value: 0.888888888888889 and parameters: {'objective': 'Logloss', 'colsample_bylevel': 0.09674309903971876, 'depth': 10, 'boosting_type': 'Plain', 'bootstrap_type': 'Bayesian', 'bagging_temperature': 6.753587837447964}. Best is trial 1464 with value: 0.8990825688073395.
[32m[I 2023-04-21 00:18:02,271][39m Trial 3743 finished with value: 0.890909090909091 and parameters: {'objective': 'Logloss', 'colsample_bylevel': 0.09507496278130594, 'depth': 9, 'boosting_type': 'Plain', 'bootstrap_type': 'Bayesian', 'bagging_temperature': 5.794312676039919}. Best is trial 1464 with value: 0.8990825688073395.
[32m[I 2023-04-21 00:18:03,067][39m Trial 3744 finished with value: 0.8807339449541284 and parameters: {'objective': 'Logloss', 'colsample_bylevel': 0.0972914265824391, 'depth': 7, 'boosting_type': 'Plain', 'bootstrap_type': 'Bayesian', 'bagging_temperature': 6.206541916021869}. Best is trial 1464 with value: 0.8990825688073395.
[32m[I 2023-04-21 00:18:04,316][39m Trial 3745 finished with value: 0.8807339449541284 and parameters: {'objective': 'Logloss', 'colsample_bylevel': 0.09658631152481616, 'depth': 10, 'boosting_type': 'Plain', 'bootstrap_type': 'Bayesian', 'bagging_temperature': 7.087246894058913}. Best is trial 1464 with value: 0.8990825688073395.
[32m[I 2023-04-21 00:18:06,326][39m Trial 3746 finished with value: 0.8648648648648648 and parameters: {'objective': 'Logloss', 'colsample_bylevel': 0.09424648677015601, 'depth': 9, 'boosting_type': 'Plain', 'bootstrap_type': 'Bayesian', 'bagging_temperature': 4.827560940899321}. Best is trial 1464 with value: 0.8990825688073395.
[32m[I 2023-04-21 00:18:07,469][39m Trial 3747 finished with value: 0.8807339449541284 and parameters: {'objective': 'Logloss', 'colsample_bylevel': 0.09972820982991601, 'depth': 8, 'boosting_type': 'Plain', 'bootstrap_type': 'Bayesian', 'bagging_temperature': 4.096791478319072}. Best is trial 1464 with value: 0.8990825688073395.
[32m[I 2023-04-21 00:18:08,709][39m Trial 3748 finished with value: 0.8807339449541284 and parameters: {'objective': 'Logloss', 'colsample_bylevel': 0.09990202680983747, 'depth': 7, 'boosting_type': 'Plain', 'bootstrap_type': 'Bayesian', 'bagging_temperature': 4.573167018623727}. Best is trial 1464 with value: 0.8990825688073395.
[32m[I 2023-04-21 00:18:09,352][39m Trial 3749 finished with value: 0.8347826086956522 and parameters: {'objective': 'CrossEntropy', 'colsample_bylevel': 0.026570155160492673, 'depth': 9, 'boosting_type': 'Plain', 'bootstrap_type': 'Bayesian', 'bagging_temperature': 4.63943788496604}. Best is trial 1464 with value: 0.8990825688073395.
[32m[I 2023-04-21 00:18:14,543][39m Trial 3750 finished with value: 0.8495575221238938 and parameters: {'objective': 'CrossEntropy', 'colsample_bylevel': 0.09709053907611594, 'depth': 10, 'boosting_type': 'Ordered', 'bootstrap_type': 'Bayesian', 'bagging_temperature': 6.516137220653619}. Best is trial 1464 with value: 0.8990825688073395.
[32m[I 2023-04-21 00:18:16,180][39m Trial 3751 finished with value: 0.8648648648648648 and parameters: {'objective': 'Logloss', 'colsample_bylevel': 0.09640993708332551, 'depth': 8, 'boosting_type': 'Plain', 'bootstrap_type': 'Bernoulli', 'subsample': 0.5467335292837969}. Best is trial 1464 with value: 0.8990825688073395.
[32m[I 2023-04-21 00:18:17,055][39m Trial 3752 finished with value: 0.888888888888889 and parameters: {'objective': 'CrossEntropy', 'colsample_bylevel': 0.08963539072216997, 'depth': 10, 'boosting_type': 'Plain', 'bootstrap_type': 'Bayesian', 'bagging_temperature': 5.2992686864814935}. Best is trial 1464 with value: 0.8990825688073395.
[32m[I 2023-04-21 00:18:18,140][39m Trial 3753 finished with value: 0.8807339449541284 and parameters: {'objective': 'Logloss', 'colsample_bylevel': 0.09267527691365772, 'depth': 9, 'boosting_type': 'Plain', 'bootstrap_type': 'Bayesian', 'bagging_temperature': 6.810628869416566}. Best is trial 1464 with value: 0.8990825688073395.
[32m[I 2023-04-21 00:18:19,215][39m Trial 3754 finished with value: 0.8727272727272727 and parameters: {'objective': 'CrossEntropy', 'colsample_bylevel': 0.09024320888092266, 'depth': 10, 'boosting_type': 'Plain', 'bootstrap_type': 'Bayesian', 'bagging_temperature': 5.670788224764479}. Best is trial 1464 with value: 0.8990825688073395.
