[32m[I 2023-04-20 23:29:12,465][39m Trial 1524 finished with value: 0.8807339449541284 and parameters: {'objective': 'Logloss', 'colsample_bylevel': 0.09697016219589781, 'depth': 7, 'boosting_type': 'Plain', 'bootstrap_type': 'Bayesian', 'bagging_temperature': 4.5183560462653585}. Best is trial 1464 with value: 0.8990825688073395.
[32m[I 2023-04-20 23:29:13,397][39m Trial 1525 finished with value: 0.8623853211009175 and parameters: {'objective': 'Logloss', 'colsample_bylevel': 0.09998219347829353, 'depth': 8, 'boosting_type': 'Plain', 'bootstrap_type': 'Bayesian', 'bagging_temperature': 3.695944292311245}. Best is trial 1464 with value: 0.8990825688073395.
[32m[I 2023-04-20 23:29:14,089][39m Trial 1526 finished with value: 0.8727272727272727 and parameters: {'objective': 'Logloss', 'colsample_bylevel': 0.09566971212383503, 'depth': 6, 'boosting_type': 'Plain', 'bootstrap_type': 'Bayesian', 'bagging_temperature': 5.008315071458619}. Best is trial 1464 with value: 0.8990825688073395.
[32m[I 2023-04-20 23:29:14,916][39m Trial 1527 finished with value: 0.8571428571428572 and parameters: {'objective': 'CrossEntropy', 'colsample_bylevel': 0.09881210614794259, 'depth': 8, 'boosting_type': 'Plain', 'bootstrap_type': 'MVS'}. Best is trial 1464 with value: 0.8990825688073395.
[32m[I 2023-04-20 23:29:15,960][39m Trial 1528 finished with value: 0.8727272727272727 and parameters: {'objective': 'Logloss', 'colsample_bylevel': 0.09983037115113119, 'depth': 10, 'boosting_type': 'Plain', 'bootstrap_type': 'Bayesian', 'bagging_temperature': 5.114027479834077}. Best is trial 1464 with value: 0.8990825688073395.
[32m[I 2023-04-20 23:29:21,365][39m Trial 1529 finished with value: 0.8571428571428572 and parameters: {'objective': 'CrossEntropy', 'colsample_bylevel': 0.09467997560416115, 'depth': 11, 'boosting_type': 'Ordered', 'bootstrap_type': 'Bayesian', 'bagging_temperature': 4.296416340545855}. Best is trial 1464 with value: 0.8990825688073395.
[32m[I 2023-04-20 23:29:22,919][39m Trial 1530 finished with value: 0.8571428571428572 and parameters: {'objective': 'CrossEntropy', 'colsample_bylevel': 0.09086568062683366, 'depth': 9, 'boosting_type': 'Plain', 'bootstrap_type': 'Bayesian', 'bagging_temperature': 3.158992568216666}. Best is trial 1464 with value: 0.8990825688073395.
[32m[I 2023-04-20 23:29:23,957][39m Trial 1531 finished with value: 0.8828828828828829 and parameters: {'objective': 'Logloss', 'colsample_bylevel': 0.09278192284497523, 'depth': 10, 'boosting_type': 'Plain', 'bootstrap_type': 'Bayesian', 'bagging_temperature': 5.51501249736551}. Best is trial 1464 with value: 0.8990825688073395.
[32m[I 2023-04-20 23:29:25,194][39m Trial 1532 finished with value: 0.8648648648648648 and parameters: {'objective': 'CrossEntropy', 'colsample_bylevel': 0.08855082410741971, 'depth': 9, 'boosting_type': 'Plain', 'bootstrap_type': 'Bayesian', 'bagging_temperature': 2.4524629253192263}. Best is trial 1464 with value: 0.8990825688073395.
[32m[I 2023-04-20 23:29:25,717][39m Trial 1533 finished with value: 0.8468468468468469 and parameters: {'objective': 'CrossEntropy', 'colsample_bylevel': 0.09436793781119704, 'depth': 6, 'boosting_type': 'Plain', 'bootstrap_type': 'Bayesian', 'bagging_temperature': 3.7530215864086416}. Best is trial 1464 with value: 0.8990825688073395.
[32m[I 2023-04-20 23:29:26,461][39m Trial 1534 finished with value: 0.8807339449541284 and parameters: {'objective': 'CrossEntropy', 'colsample_bylevel': 0.09814363374108463, 'depth': 10, 'boosting_type': 'Plain', 'bootstrap_type': 'Bayesian', 'bagging_temperature': 6.081611559187711}. Best is trial 1464 with value: 0.8990825688073395.
[32m[I 2023-04-20 23:29:27,620][39m Trial 1535 finished with value: 0.888888888888889 and parameters: {'objective': 'CrossEntropy', 'colsample_bylevel': 0.09995091810803218, 'depth': 9, 'boosting_type': 'Plain', 'bootstrap_type': 'Bayesian', 'bagging_temperature': 4.848105512173927}. Best is trial 1464 with value: 0.8990825688073395.
[32m[I 2023-04-20 23:29:28,424][39m Trial 1536 finished with value: 0.8703703703703703 and parameters: {'objective': 'CrossEntropy', 'colsample_bylevel': 0.09280984386102045, 'depth': 10, 'boosting_type': 'Plain', 'bootstrap_type': 'Bayesian', 'bagging_temperature': 4.247745205522824}. Best is trial 1464 with value: 0.8990825688073395.
[32m[I 2023-04-20 23:29:30,333][39m Trial 1537 finished with value: 0.8807339449541284 and parameters: {'objective': 'CrossEntropy', 'colsample_bylevel': 0.09591749089333909, 'depth': 9, 'boosting_type': 'Plain', 'bootstrap_type': 'Bayesian', 'bagging_temperature': 4.904041595909995}. Best is trial 1464 with value: 0.8990825688073395.
[32m[I 2023-04-20 23:29:31,033][39m Trial 1538 finished with value: 0.8648648648648648 and parameters: {'objective': 'CrossEntropy', 'colsample_bylevel': 0.09669499573579722, 'depth': 11, 'boosting_type': 'Plain', 'bootstrap_type': 'Bernoulli', 'subsample': 0.34265486703443315}. Best is trial 1464 with value: 0.8990825688073395.
[32m[I 2023-04-20 23:29:32,161][39m Trial 1539 finished with value: 0.8727272727272727 and parameters: {'objective': 'CrossEntropy', 'colsample_bylevel': 0.08977383050148195, 'depth': 10, 'boosting_type': 'Plain', 'bootstrap_type': 'Bayesian', 'bagging_temperature': 7.621607552216318}. Best is trial 1464 with value: 0.8990825688073395.
[32m[I 2023-04-20 23:29:32,767][39m Trial 1540 finished with value: 0.8648648648648648 and parameters: {'objective': 'CrossEntropy', 'colsample_bylevel': 0.09627687355636569, 'depth': 5, 'boosting_type': 'Plain', 'bootstrap_type': 'Bayesian', 'bagging_temperature': 4.940473770022879}. Best is trial 1464 with value: 0.8990825688073395.
[32m[I 2023-04-20 23:29:34,183][39m Trial 1541 finished with value: 0.8648648648648648 and parameters: {'objective': 'Logloss', 'colsample_bylevel': 0.09850208866586725, 'depth': 8, 'boosting_type': 'Plain', 'bootstrap_type': 'Bernoulli', 'subsample': 0.13064647331459855}. Best is trial 1464 with value: 0.8990825688073395.
[32m[I 2023-04-20 23:29:35,308][39m Trial 1542 finished with value: 0.8545454545454546 and parameters: {'objective': 'Logloss', 'colsample_bylevel': 0.0985890537024915, 'depth': 8, 'boosting_type': 'Plain', 'bootstrap_type': 'Bernoulli', 'subsample': 0.7765169495523565}. Best is trial 1464 with value: 0.8990825688073395.
[32m[I 2023-04-20 23:29:36,465][39m Trial 1543 finished with value: 0.875 and parameters: {'objective': 'CrossEntropy', 'colsample_bylevel': 0.09312880427097411, 'depth': 12, 'boosting_type': 'Plain', 'bootstrap_type': 'Bayesian', 'bagging_temperature': 1.7511819134650801}. Best is trial 1464 with value: 0.8990825688073395.
[32m[I 2023-04-20 23:29:37,601][39m Trial 1544 finished with value: 0.8376068376068375 and parameters: {'objective': 'CrossEntropy', 'colsample_bylevel': 0.022036282264434402, 'depth': 9, 'boosting_type': 'Plain', 'bootstrap_type': 'Bernoulli', 'subsample': 0.24871225012218956}. Best is trial 1464 with value: 0.8990825688073395.
[32m[I 2023-04-20 23:29:38,623][39m Trial 1545 finished with value: 0.8828828828828829 and parameters: {'objective': 'CrossEntropy', 'colsample_bylevel': 0.09186140918437778, 'depth': 10, 'boosting_type': 'Plain', 'bootstrap_type': 'Bayesian', 'bagging_temperature': 4.999078899549277}. Best is trial 1464 with value: 0.8990825688073395.
[32m[I 2023-04-20 23:29:39,856][39m Trial 1546 finished with value: 0.8727272727272727 and parameters: {'objective': 'Logloss', 'colsample_bylevel': 0.09598505204260038, 'depth': 9, 'boosting_type': 'Plain', 'bootstrap_type': 'Bayesian', 'bagging_temperature': 4.686952629950623}. Best is trial 1464 with value: 0.8990825688073395.
[32m[I 2023-04-20 23:29:40,817][39m Trial 1547 finished with value: 0.8828828828828829 and parameters: {'objective': 'Logloss', 'colsample_bylevel': 0.09553473239384543, 'depth': 9, 'boosting_type': 'Plain', 'bootstrap_type': 'Bayesian', 'bagging_temperature': 2.9697812331000084}. Best is trial 1464 with value: 0.8990825688073395.
[32m[I 2023-04-20 23:29:41,385][39m Trial 1548 finished with value: 0.8347826086956522 and parameters: {'objective': 'CrossEntropy', 'colsample_bylevel': 0.036570429872312266, 'depth': 11, 'boosting_type': 'Plain', 'bootstrap_type': 'Bernoulli', 'subsample': 0.8363909614433698}. Best is trial 1464 with value: 0.8990825688073395.
[32m[I 2023-04-20 23:29:46,421][39m Trial 1549 finished with value: 0.8421052631578947 and parameters: {'objective': 'CrossEntropy', 'colsample_bylevel': 0.09157336259924428, 'depth': 10, 'boosting_type': 'Ordered', 'bootstrap_type': 'Bayesian', 'bagging_temperature': 4.193840768019533}. Best is trial 1464 with value: 0.8990825688073395.
[32m[I 2023-04-20 23:29:47,376][39m Trial 1550 finished with value: 0.8623853211009175 and parameters: {'objective': 'Logloss', 'colsample_bylevel': 0.09821710025344084, 'depth': 7, 'boosting_type': 'Plain', 'bootstrap_type': 'Bayesian', 'bagging_temperature': 3.789628666169496}. Best is trial 1464 with value: 0.8990825688073395.
[32m[I 2023-04-20 23:29:48,537][39m Trial 1551 finished with value: 0.8672566371681416 and parameters: {'objective': 'Logloss', 'colsample_bylevel': 0.09332908479309547, 'depth': 12, 'boosting_type': 'Plain', 'bootstrap_type': 'Bernoulli', 'subsample': 0.26189286515535604}. Best is trial 1464 with value: 0.8990825688073395.
[32m[I 2023-04-20 23:29:49,252][39m Trial 1552 finished with value: 0.8807339449541284 and parameters: {'objective': 'Logloss', 'colsample_bylevel': 0.097050995452559, 'depth': 11, 'boosting_type': 'Plain', 'bootstrap_type': 'Bayesian', 'bagging_temperature': 5.895351065955506}. Best is trial 1464 with value: 0.8990825688073395.
[32m[I 2023-04-20 23:29:50,526][39m Trial 1553 finished with value: 0.8727272727272727 and parameters: {'objective': 'Logloss', 'colsample_bylevel': 0.09836483784182953, 'depth': 11, 'boosting_type': 'Plain', 'bootstrap_type': 'Bayesian', 'bagging_temperature': 5.681618447566909}. Best is trial 1464 with value: 0.8990825688073395.
[32m[I 2023-04-20 23:29:52,078][39m Trial 1554 finished with value: 0.8623853211009175 and parameters: {'objective': 'CrossEntropy', 'colsample_bylevel': 0.09097217425352604, 'depth': 9, 'boosting_type': 'Plain', 'bootstrap_type': 'Bayesian', 'bagging_temperature': 5.66789789883335}. Best is trial 1464 with value: 0.8990825688073395.
[32m[I 2023-04-20 23:29:53,069][39m Trial 1555 finished with value: 0.8807339449541284 and parameters: {'objective': 'Logloss', 'colsample_bylevel': 0.09706107934643508, 'depth': 10, 'boosting_type': 'Plain', 'bootstrap_type': 'Bayesian', 'bagging_temperature': 4.762694136841149}. Best is trial 1464 with value: 0.8990825688073395.
[32m[I 2023-04-20 23:29:53,754][39m Trial 1556 finished with value: 0.8703703703703703 and parameters: {'objective': 'CrossEntropy', 'colsample_bylevel': 0.09084784944229726, 'depth': 6, 'boosting_type': 'Plain', 'bootstrap_type': 'Bayesian', 'bagging_temperature': 6.88317680159631}. Best is trial 1464 with value: 0.8990825688073395.
[32m[I 2023-04-20 23:29:54,680][39m Trial 1557 finished with value: 0.8545454545454546 and parameters: {'objective': 'Logloss', 'colsample_bylevel': 0.0983191546262219, 'depth': 8, 'boosting_type': 'Plain', 'bootstrap_type': 'Bernoulli', 'subsample': 0.3022702466261381}. Best is trial 1464 with value: 0.8990825688073395.
[32m[I 2023-04-20 23:29:55,334][39m Trial 1558 finished with value: 0.8672566371681416 and parameters: {'objective': 'Logloss', 'colsample_bylevel': 0.09999757475570716, 'depth': 8, 'boosting_type': 'Plain', 'bootstrap_type': 'MVS'}. Best is trial 1464 with value: 0.8990825688073395.
[32m[I 2023-04-20 23:29:56,189][39m Trial 1559 finished with value: 0.8495575221238938 and parameters: {'objective': 'Logloss', 'colsample_bylevel': 0.08947212275600663, 'depth': 12, 'boosting_type': 'Plain', 'bootstrap_type': 'Bernoulli', 'subsample': 0.73546349263229}. Best is trial 1464 with value: 0.8990825688073395.
[32m[I 2023-04-20 23:29:57,396][39m Trial 1560 finished with value: 0.8468468468468469 and parameters: {'objective': 'Logloss', 'colsample_bylevel': 0.09336527912348372, 'depth': 10, 'boosting_type': 'Plain', 'bootstrap_type': 'Bayesian', 'bagging_temperature': 2.5129188651028533}. Best is trial 1464 with value: 0.8990825688073395.
[32m[I 2023-04-20 23:29:58,879][39m Trial 1561 finished with value: 0.8648648648648648 and parameters: {'objective': 'Logloss', 'colsample_bylevel': 0.0957315241992684, 'depth': 10, 'boosting_type': 'Plain', 'bootstrap_type': 'Bayesian', 'bagging_temperature': 3.9616178626461465}. Best is trial 1464 with value: 0.8990825688073395.
[32m[I 2023-04-20 23:29:59,816][39m Trial 1562 finished with value: 0.8727272727272727 and parameters: {'objective': 'CrossEntropy', 'colsample_bylevel': 0.09845285508787723, 'depth': 12, 'boosting_type': 'Plain', 'bootstrap_type': 'Bernoulli', 'subsample': 0.4404188042780227}. Best is trial 1464 with value: 0.8990825688073395.
[32m[I 2023-04-20 23:30:00,379][39m Trial 1563 finished with value: 0.8545454545454546 and parameters: {'objective': 'CrossEntropy', 'colsample_bylevel': 0.08967005380102272, 'depth': 6, 'boosting_type': 'Plain', 'bootstrap_type': 'Bayesian', 'bagging_temperature': 5.857684766055198}. Best is trial 1464 with value: 0.8990825688073395.
[32m[I 2023-04-20 23:30:01,691][39m Trial 1564 finished with value: 0.8545454545454546 and parameters: {'objective': 'Logloss', 'colsample_bylevel': 0.09975697993171345, 'depth': 8, 'boosting_type': 'Plain', 'bootstrap_type': 'Bayesian', 'bagging_temperature': 3.8057868150209035}. Best is trial 1464 with value: 0.8990825688073395.
[32m[I 2023-04-20 23:30:02,723][39m Trial 1565 finished with value: 0.8807339449541284 and parameters: {'objective': 'Logloss', 'colsample_bylevel': 0.09538979772014564, 'depth': 12, 'boosting_type': 'Plain', 'bootstrap_type': 'Bernoulli', 'subsample': 0.22059853924118064}. Best is trial 1464 with value: 0.8990825688073395.
[32m[I 2023-04-20 23:30:03,313][39m Trial 1566 finished with value: 0.8648648648648648 and parameters: {'objective': 'CrossEntropy', 'colsample_bylevel': 0.09440116391416278, 'depth': 10, 'boosting_type': 'Plain', 'bootstrap_type': 'Bayesian', 'bagging_temperature': 4.737215915535649}. Best is trial 1464 with value: 0.8990825688073395.
[32m[I 2023-04-20 23:30:04,263][39m Trial 1567 finished with value: 0.8807339449541284 and parameters: {'objective': 'Logloss', 'colsample_bylevel': 0.09685237543829969, 'depth': 10, 'boosting_type': 'Plain', 'bootstrap_type': 'Bayesian', 'bagging_temperature': 5.0512839583741345}. Best is trial 1464 with value: 0.8990825688073395.
[32m[I 2023-04-20 23:30:09,746][39m Trial 1568 finished with value: 0.8347826086956522 and parameters: {'objective': 'Logloss', 'colsample_bylevel': 0.09791653874957773, 'depth': 7, 'boosting_type': 'Ordered', 'bootstrap_type': 'Bayesian', 'bagging_temperature': 6.672869397003485}. Best is trial 1464 with value: 0.8990825688073395.
[32m[I 2023-04-20 23:30:11,300][39m Trial 1569 finished with value: 0.8828828828828829 and parameters: {'objective': 'Logloss', 'colsample_bylevel': 0.09999830042483339, 'depth': 10, 'boosting_type': 'Plain', 'bootstrap_type': 'Bayesian', 'bagging_temperature': 2.7994269897551107}. Best is trial 1464 with value: 0.8990825688073395.
[32m[I 2023-04-20 23:30:12,641][39m Trial 1570 finished with value: 0.8623853211009175 and parameters: {'objective': 'Logloss', 'colsample_bylevel': 0.09752936097400533, 'depth': 10, 'boosting_type': 'Plain', 'bootstrap_type': 'Bayesian', 'bagging_temperature': 5.832422833312248}. Best is trial 1464 with value: 0.8990825688073395.
[32m[I 2023-04-20 23:30:13,392][39m Trial 1571 finished with value: 0.8727272727272727 and parameters: {'objective': 'CrossEntropy', 'colsample_bylevel': 0.09421352052829482, 'depth': 6, 'boosting_type': 'Plain', 'bootstrap_type': 'Bayesian', 'bagging_temperature': 4.884608556023473}. Best is trial 1464 with value: 0.8990825688073395.
[32m[I 2023-04-20 23:30:14,076][39m Trial 1572 finished with value: 0.8703703703703703 and parameters: {'objective': 'Logloss', 'colsample_bylevel': 0.09535319849872047, 'depth': 7, 'boosting_type': 'Plain', 'bootstrap_type': 'Bayesian', 'bagging_temperature': 5.406687354642675}. Best is trial 1464 with value: 0.8990825688073395.
[32m[I 2023-04-20 23:30:14,920][39m Trial 1573 finished with value: 0.8828828828828829 and parameters: {'objective': 'Logloss', 'colsample_bylevel': 0.09349155979176205, 'depth': 10, 'boosting_type': 'Plain', 'bootstrap_type': 'Bayesian', 'bagging_temperature': 4.191681927666312}. Best is trial 1464 with value: 0.8990825688073395.
[32m[I 2023-04-20 23:30:15,693][39m Trial 1574 finished with value: 0.888888888888889 and parameters: {'objective': 'CrossEntropy', 'colsample_bylevel': 0.09329051950955808, 'depth': 10, 'boosting_type': 'Plain', 'bootstrap_type': 'Bayesian', 'bagging_temperature': 5.55984243170572}. Best is trial 1464 with value: 0.8990825688073395.
[32m[I 2023-04-20 23:30:17,149][39m Trial 1575 finished with value: 0.8807339449541284 and parameters: {'objective': 'Logloss', 'colsample_bylevel': 0.09276435704958012, 'depth': 9, 'boosting_type': 'Plain', 'bootstrap_type': 'Bayesian', 'bagging_temperature': 8.083283573086472}. Best is trial 1464 with value: 0.8990825688073395.
[32m[I 2023-04-20 23:30:17,781][39m Trial 1576 finished with value: 0.8376068376068375 and parameters: {'objective': 'Logloss', 'colsample_bylevel': 0.07125391203491002, 'depth': 4, 'boosting_type': 'Plain', 'bootstrap_type': 'Bayesian', 'bagging_temperature': 5.360595286888384}. Best is trial 1464 with value: 0.8990825688073395.
[32m[I 2023-04-20 23:30:19,003][39m Trial 1577 finished with value: 0.8648648648648648 and parameters: {'objective': 'CrossEntropy', 'colsample_bylevel': 0.09408181602289281, 'depth': 6, 'boosting_type': 'Plain', 'bootstrap_type': 'Bayesian', 'bagging_temperature': 4.602876704941865}. Best is trial 1464 with value: 0.8990825688073395.
[32m[I 2023-04-20 23:30:19,895][39m Trial 1578 finished with value: 0.8807339449541284 and parameters: {'objective': 'Logloss', 'colsample_bylevel': 0.09605300877939617, 'depth': 9, 'boosting_type': 'Plain', 'bootstrap_type': 'Bayesian', 'bagging_temperature': 4.376001692745792}. Best is trial 1464 with value: 0.8990825688073395.
[32m[I 2023-04-20 23:30:21,189][39m Trial 1579 finished with value: 0.8495575221238938 and parameters: {'objective': 'Logloss', 'colsample_bylevel': 0.09730059111324213, 'depth': 8, 'boosting_type': 'Plain', 'bootstrap_type': 'MVS'}. Best is trial 1464 with value: 0.8990825688073395.
[32m[I 2023-04-20 23:30:22,355][39m Trial 1580 finished with value: 0.8807339449541284 and parameters: {'objective': 'Logloss', 'colsample_bylevel': 0.09996962033577154, 'depth': 9, 'boosting_type': 'Plain', 'bootstrap_type': 'Bayesian', 'bagging_temperature': 4.684939037470471}. Best is trial 1464 with value: 0.8990825688073395.
[32m[I 2023-04-20 23:30:23,355][39m Trial 1581 finished with value: 0.8648648648648648 and parameters: {'objective': 'Logloss', 'colsample_bylevel': 0.09711653171228939, 'depth': 7, 'boosting_type': 'Plain', 'bootstrap_type': 'Bernoulli', 'subsample': 0.6882296746969034}. Best is trial 1464 with value: 0.8990825688073395.
[32m[I 2023-04-20 23:30:24,537][39m Trial 1582 finished with value: 0.8727272727272727 and parameters: {'objective': 'Logloss', 'colsample_bylevel': 0.09799772827628651, 'depth': 9, 'boosting_type': 'Plain', 'bootstrap_type': 'Bernoulli', 'subsample': 0.28707130830144245}. Best is trial 1464 with value: 0.8990825688073395.
[32m[I 2023-04-20 23:30:25,477][39m Trial 1583 finished with value: 0.8727272727272727 and parameters: {'objective': 'Logloss', 'colsample_bylevel': 0.08871740287322671, 'depth': 10, 'boosting_type': 'Plain', 'bootstrap_type': 'Bayesian', 'bagging_temperature': 4.175153033517445}. Best is trial 1464 with value: 0.8990825688073395.
[32m[I 2023-04-20 23:30:30,909][39m Trial 1584 finished with value: 0.8596491228070176 and parameters: {'objective': 'Logloss', 'colsample_bylevel': 0.09542110827554469, 'depth': 7, 'boosting_type': 'Ordered', 'bootstrap_type': 'Bayesian', 'bagging_temperature': 7.446183298076817}. Best is trial 1464 with value: 0.8990825688073395.
[32m[I 2023-04-20 23:30:32,643][39m Trial 1585 finished with value: 0.888888888888889 and parameters: {'objective': 'Logloss', 'colsample_bylevel': 0.09856645245465122, 'depth': 9, 'boosting_type': 'Plain', 'bootstrap_type': 'Bayesian', 'bagging_temperature': 5.173163291550549}. Best is trial 1464 with value: 0.8990825688073395.
[32m[I 2023-04-20 23:30:33,806][39m Trial 1586 finished with value: 0.8727272727272727 and parameters: {'objective': 'CrossEntropy', 'colsample_bylevel': 0.09643111001037169, 'depth': 9, 'boosting_type': 'Plain', 'bootstrap_type': 'Bayesian', 'bagging_temperature': 4.539803324733161}. Best is trial 1464 with value: 0.8990825688073395.
[32m[I 2023-04-20 23:30:34,970][39m Trial 1587 finished with value: 0.875 and parameters: {'objective': 'CrossEntropy', 'colsample_bylevel': 0.09991023868552944, 'depth': 8, 'boosting_type': 'Plain', 'bootstrap_type': 'Bernoulli', 'subsample': 0.8069678138586451}. Best is trial 1464 with value: 0.8990825688073395.
[32m[I 2023-04-20 23:30:35,977][39m Trial 1588 finished with value: 0.8571428571428572 and parameters: {'objective': 'Logloss', 'colsample_bylevel': 0.09842583696234006, 'depth': 8, 'boosting_type': 'Plain', 'bootstrap_type': 'Bayesian', 'bagging_temperature': 4.931646679841183}. Best is trial 1464 with value: 0.8990825688073395.
[32m[I 2023-04-20 23:30:36,878][39m Trial 1589 finished with value: 0.8727272727272727 and parameters: {'objective': 'CrossEntropy', 'colsample_bylevel': 0.09246221016220835, 'depth': 11, 'boosting_type': 'Plain', 'bootstrap_type': 'Bayesian', 'bagging_temperature': 5.368663448314253}. Best is trial 1464 with value: 0.8990825688073395.
