[32m[I 2023-04-21 00:33:05,946][39m Trial 4413 finished with value: 0.8672566371681416 and parameters: {'objective': 'Logloss', 'colsample_bylevel': 0.09209571257772727, 'depth': 10, 'boosting_type': 'Plain', 'bootstrap_type': 'Bayesian', 'bagging_temperature': 4.277230464100698}. Best is trial 1464 with value: 0.8990825688073395.
[32m[I 2023-04-21 00:33:07,045][39m Trial 4414 finished with value: 0.8648648648648648 and parameters: {'objective': 'Logloss', 'colsample_bylevel': 0.08959204026757986, 'depth': 10, 'boosting_type': 'Plain', 'bootstrap_type': 'Bayesian', 'bagging_temperature': 6.38698649555323}. Best is trial 1464 with value: 0.8990825688073395.
[32m[I 2023-04-21 00:33:08,135][39m Trial 4415 finished with value: 0.8703703703703703 and parameters: {'objective': 'CrossEntropy', 'colsample_bylevel': 0.09723904428875355, 'depth': 12, 'boosting_type': 'Plain', 'bootstrap_type': 'Bayesian', 'bagging_temperature': 6.501988822760384}. Best is trial 1464 with value: 0.8990825688073395.
[32m[I 2023-04-21 00:33:09,151][39m Trial 4416 finished with value: 0.8828828828828829 and parameters: {'objective': 'CrossEntropy', 'colsample_bylevel': 0.0860772128093483, 'depth': 12, 'boosting_type': 'Plain', 'bootstrap_type': 'Bayesian', 'bagging_temperature': 5.117469401302888}. Best is trial 1464 with value: 0.8990825688073395.
[32m[I 2023-04-21 00:33:10,665][39m Trial 4417 finished with value: 0.8828828828828829 and parameters: {'objective': 'Logloss', 'colsample_bylevel': 0.09258587103350138, 'depth': 8, 'boosting_type': 'Plain', 'bootstrap_type': 'Bayesian', 'bagging_temperature': 5.465821742239108}. Best is trial 1464 with value: 0.8990825688073395.
[32m[I 2023-04-21 00:33:12,086][39m Trial 4418 finished with value: 0.888888888888889 and parameters: {'objective': 'Logloss', 'colsample_bylevel': 0.09150676209883106, 'depth': 12, 'boosting_type': 'Plain', 'bootstrap_type': 'Bayesian', 'bagging_temperature': 5.545724722326135}. Best is trial 1464 with value: 0.8990825688073395.
[32m[I 2023-04-21 00:33:12,917][39m Trial 4419 finished with value: 0.8727272727272727 and parameters: {'objective': 'CrossEntropy', 'colsample_bylevel': 0.08887885624008626, 'depth': 12, 'boosting_type': 'Plain', 'bootstrap_type': 'Bayesian', 'bagging_temperature': 3.9085244060455837}. Best is trial 1464 with value: 0.8990825688073395.
[32m[I 2023-04-21 00:33:13,635][39m Trial 4420 finished with value: 0.8727272727272727 and parameters: {'objective': 'CrossEntropy', 'colsample_bylevel': 0.09018789545405634, 'depth': 12, 'boosting_type': 'Plain', 'bootstrap_type': 'Bayesian', 'bagging_temperature': 6.11725244166409}. Best is trial 1464 with value: 0.8990825688073395.
[32m[I 2023-04-21 00:33:14,974][39m Trial 4421 finished with value: 0.8807339449541284 and parameters: {'objective': 'Logloss', 'colsample_bylevel': 0.09706816158588286, 'depth': 8, 'boosting_type': 'Plain', 'bootstrap_type': 'Bayesian', 'bagging_temperature': 5.657777662209043}. Best is trial 1464 with value: 0.8990825688073395.
[32m[I 2023-04-21 00:33:15,869][39m Trial 4422 finished with value: 0.8807339449541284 and parameters: {'objective': 'Logloss', 'colsample_bylevel': 0.09019837412801483, 'depth': 7, 'boosting_type': 'Plain', 'bootstrap_type': 'Bayesian', 'bagging_temperature': 5.333044155263652}. Best is trial 1464 with value: 0.8990825688073395.
[32m[I 2023-04-21 00:33:16,584][39m Trial 4423 finished with value: 0.8807339449541284 and parameters: {'objective': 'CrossEntropy', 'colsample_bylevel': 0.09986002824307395, 'depth': 10, 'boosting_type': 'Plain', 'bootstrap_type': 'Bayesian', 'bagging_temperature': 4.444773916549037}. Best is trial 1464 with value: 0.8990825688073395.
[32m[I 2023-04-21 00:33:17,745][39m Trial 4424 finished with value: 0.8347826086956522 and parameters: {'objective': 'CrossEntropy', 'colsample_bylevel': 0.06701803112163207, 'depth': 10, 'boosting_type': 'Plain', 'bootstrap_type': 'Bayesian', 'bagging_temperature': 5.948103863951877}. Best is trial 1464 with value: 0.8990825688073395.
[32m[I 2023-04-21 00:33:19,051][39m Trial 4425 finished with value: 0.8807339449541284 and parameters: {'objective': 'CrossEntropy', 'colsample_bylevel': 0.09578279773548433, 'depth': 10, 'boosting_type': 'Plain', 'bootstrap_type': 'Bayesian', 'bagging_temperature': 6.383903411180141}. Best is trial 1464 with value: 0.8990825688073395.
[32m[I 2023-04-21 00:33:20,532][39m Trial 4426 finished with value: 0.875 and parameters: {'objective': 'Logloss', 'colsample_bylevel': 0.09181322417174773, 'depth': 12, 'boosting_type': 'Plain', 'bootstrap_type': 'Bayesian', 'bagging_temperature': 5.505900047756625}. Best is trial 1464 with value: 0.8990825688073395.
[32m[I 2023-04-21 00:33:21,702][39m Trial 4427 finished with value: 0.8727272727272727 and parameters: {'objective': 'Logloss', 'colsample_bylevel': 0.08916987876244349, 'depth': 12, 'boosting_type': 'Plain', 'bootstrap_type': 'Bayesian', 'bagging_temperature': 5.243892661887227}. Best is trial 1464 with value: 0.8990825688073395.
[32m[I 2023-04-21 00:33:26,913][39m Trial 4428 finished with value: 0.8623853211009175 and parameters: {'objective': 'CrossEntropy', 'colsample_bylevel': 0.09861794768846355, 'depth': 12, 'boosting_type': 'Ordered', 'bootstrap_type': 'Bayesian', 'bagging_temperature': 4.8583915918181315}. Best is trial 1464 with value: 0.8990825688073395.
[32m[I 2023-04-21 00:33:28,194][39m Trial 4429 finished with value: 0.8571428571428572 and parameters: {'objective': 'Logloss', 'colsample_bylevel': 0.09036351023692639, 'depth': 12, 'boosting_type': 'Plain', 'bootstrap_type': 'Bernoulli', 'subsample': 0.936276218984672}. Best is trial 1464 with value: 0.8990825688073395.
[32m[I 2023-04-21 00:33:29,727][39m Trial 4430 finished with value: 0.875 and parameters: {'objective': 'Logloss', 'colsample_bylevel': 0.08774284966601364, 'depth': 12, 'boosting_type': 'Plain', 'bootstrap_type': 'Bayesian', 'bagging_temperature': 6.120830643095393}. Best is trial 1464 with value: 0.8990825688073395.
[32m[I 2023-04-21 00:33:30,525][39m Trial 4431 finished with value: 0.8727272727272727 and parameters: {'objective': 'CrossEntropy', 'colsample_bylevel': 0.08634804251232328, 'depth': 12, 'boosting_type': 'Plain', 'bootstrap_type': 'Bayesian', 'bagging_temperature': 5.688954193817499}. Best is trial 1464 with value: 0.8990825688073395.
[32m[I 2023-04-21 00:33:31,363][39m Trial 4432 finished with value: 0.831858407079646 and parameters: {'objective': 'CrossEntropy', 'colsample_bylevel': 0.08870513235994658, 'depth': 12, 'boosting_type': 'Plain', 'bootstrap_type': 'Bayesian', 'bagging_temperature': 0.7596298179504632}. Best is trial 1464 with value: 0.8990825688073395.
[32m[I 2023-04-21 00:33:32,940][39m Trial 4433 finished with value: 0.8727272727272727 and parameters: {'objective': 'Logloss', 'colsample_bylevel': 0.09479667116254531, 'depth': 12, 'boosting_type': 'Plain', 'bootstrap_type': 'Bayesian', 'bagging_temperature': 7.272881836102607}. Best is trial 1464 with value: 0.8990825688073395.
[32m[I 2023-04-21 00:33:34,132][39m Trial 4434 finished with value: 0.8495575221238938 and parameters: {'objective': 'Logloss', 'colsample_bylevel': 0.0894229515788512, 'depth': 11, 'boosting_type': 'Plain', 'bootstrap_type': 'MVS'}. Best is trial 1464 with value: 0.8990825688073395.
[32m[I 2023-04-21 00:33:35,264][39m Trial 4435 finished with value: 0.888888888888889 and parameters: {'objective': 'CrossEntropy', 'colsample_bylevel': 0.08715078874399732, 'depth': 12, 'boosting_type': 'Plain', 'bootstrap_type': 'Bayesian', 'bagging_temperature': 5.791481165717665}. Best is trial 1464 with value: 0.8990825688073395.
[32m[I 2023-04-21 00:33:36,315][39m Trial 4436 finished with value: 0.8727272727272727 and parameters: {'objective': 'CrossEntropy', 'colsample_bylevel': 0.0870823043872747, 'depth': 12, 'boosting_type': 'Plain', 'bootstrap_type': 'Bayesian', 'bagging_temperature': 5.200637322958793}. Best is trial 1464 with value: 0.8990825688073395.
[32m[I 2023-04-21 00:33:37,250][39m Trial 4437 finished with value: 0.8807339449541284 and parameters: {'objective': 'Logloss', 'colsample_bylevel': 0.09524591952240659, 'depth': 12, 'boosting_type': 'Plain', 'bootstrap_type': 'Bayesian', 'bagging_temperature': 5.993409920981753}. Best is trial 1464 with value: 0.8990825688073395.
[32m[I 2023-04-21 00:33:37,900][39m Trial 4438 finished with value: 0.8545454545454546 and parameters: {'objective': 'CrossEntropy', 'colsample_bylevel': 0.08966001331883774, 'depth': 12, 'boosting_type': 'Plain', 'bootstrap_type': 'Bayesian', 'bagging_temperature': 4.1396682180555615}. Best is trial 1464 with value: 0.8990825688073395.
[32m[I 2023-04-21 00:33:38,969][39m Trial 4439 finished with value: 0.8807339449541284 and parameters: {'objective': 'CrossEntropy', 'colsample_bylevel': 0.09670601304559778, 'depth': 12, 'boosting_type': 'Plain', 'bootstrap_type': 'Bayesian', 'bagging_temperature': 6.289246043219287}. Best is trial 1464 with value: 0.8990825688073395.
[32m[I 2023-04-21 00:33:40,070][39m Trial 4440 finished with value: 0.8623853211009175 and parameters: {'objective': 'CrossEntropy', 'colsample_bylevel': 0.09981594960734384, 'depth': 7, 'boosting_type': 'Plain', 'bootstrap_type': 'Bayesian', 'bagging_temperature': 4.387971493559146}. Best is trial 1464 with value: 0.8990825688073395.
[32m[I 2023-04-21 00:33:41,537][39m Trial 4441 finished with value: 0.888888888888889 and parameters: {'objective': 'CrossEntropy', 'colsample_bylevel': 0.08447984872860394, 'depth': 12, 'boosting_type': 'Plain', 'bootstrap_type': 'Bayesian', 'bagging_temperature': 5.146129664532466}. Best is trial 1464 with value: 0.8990825688073395.
[32m[I 2023-04-21 00:33:43,443][39m Trial 4442 finished with value: 0.8648648648648648 and parameters: {'objective': 'Logloss', 'colsample_bylevel': 0.09181277154462318, 'depth': 9, 'boosting_type': 'Plain', 'bootstrap_type': 'Bayesian', 'bagging_temperature': 4.752819800896756}. Best is trial 1464 with value: 0.8990825688073395.
[32m[I 2023-04-21 00:33:44,511][39m Trial 4443 finished with value: 0.890909090909091 and parameters: {'objective': 'Logloss', 'colsample_bylevel': 0.08803836516755292, 'depth': 12, 'boosting_type': 'Plain', 'bootstrap_type': 'Bayesian', 'bagging_temperature': 5.0004915432331085}. Best is trial 1464 with value: 0.8990825688073395.
[32m[I 2023-04-21 00:33:45,368][39m Trial 4444 finished with value: 0.8305084745762712 and parameters: {'objective': 'CrossEntropy', 'colsample_bylevel': 0.08659973208425857, 'depth': 2, 'boosting_type': 'Plain', 'bootstrap_type': 'Bayesian', 'bagging_temperature': 5.336081821618101}. Best is trial 1464 with value: 0.8990825688073395.
[32m[I 2023-04-21 00:33:46,132][39m Trial 4445 finished with value: 0.8807339449541284 and parameters: {'objective': 'Logloss', 'colsample_bylevel': 0.09133145695675492, 'depth': 12, 'boosting_type': 'Plain', 'bootstrap_type': 'Bayesian', 'bagging_temperature': 5.589118021148861}. Best is trial 1464 with value: 0.8990825688073395.
[32m[I 2023-04-21 00:33:47,036][39m Trial 4446 finished with value: 0.8727272727272727 and parameters: {'objective': 'CrossEntropy', 'colsample_bylevel': 0.09009452304814469, 'depth': 12, 'boosting_type': 'Plain', 'bootstrap_type': 'Bayesian', 'bagging_temperature': 5.520067328446819}. Best is trial 1464 with value: 0.8990825688073395.
[32m[I 2023-04-21 00:33:52,024][39m Trial 4447 finished with value: 0.8495575221238938 and parameters: {'objective': 'Logloss', 'colsample_bylevel': 0.09277198560432053, 'depth': 9, 'boosting_type': 'Ordered', 'bootstrap_type': 'Bayesian', 'bagging_temperature': 5.6347629884340265}. Best is trial 1464 with value: 0.8990825688073395.
[32m[I 2023-04-21 00:33:53,497][39m Trial 4448 finished with value: 0.8807339449541284 and parameters: {'objective': 'Logloss', 'colsample_bylevel': 0.09651316422945032, 'depth': 12, 'boosting_type': 'Plain', 'bootstrap_type': 'Bayesian', 'bagging_temperature': 5.858915751056208}. Best is trial 1464 with value: 0.8990825688073395.
[32m[I 2023-04-21 00:33:54,604][39m Trial 4449 finished with value: 0.8828828828828829 and parameters: {'objective': 'Logloss', 'colsample_bylevel': 0.09301197258569827, 'depth': 12, 'boosting_type': 'Plain', 'bootstrap_type': 'Bayesian', 'bagging_temperature': 6.0628336146488095}. Best is trial 1464 with value: 0.8990825688073395.
[32m[I 2023-04-21 00:33:55,402][39m Trial 4450 finished with value: 0.8828828828828829 and parameters: {'objective': 'CrossEntropy', 'colsample_bylevel': 0.085359155266745, 'depth': 12, 'boosting_type': 'Plain', 'bootstrap_type': 'Bayesian', 'bagging_temperature': 5.884602004096511}. Best is trial 1464 with value: 0.8990825688073395.
[32m[I 2023-04-21 00:33:56,784][39m Trial 4451 finished with value: 0.8828828828828829 and parameters: {'objective': 'Logloss', 'colsample_bylevel': 0.09255229475606618, 'depth': 12, 'boosting_type': 'Plain', 'bootstrap_type': 'Bayesian', 'bagging_temperature': 6.590503775752603}. Best is trial 1464 with value: 0.8990825688073395.
[32m[I 2023-04-21 00:33:57,781][39m Trial 4452 finished with value: 0.8275862068965517 and parameters: {'objective': 'CrossEntropy', 'colsample_bylevel': 0.06159289896400001, 'depth': 12, 'boosting_type': 'Plain', 'bootstrap_type': 'Bernoulli', 'subsample': 0.7225870052681551}. Best is trial 1464 with value: 0.8990825688073395.
[32m[I 2023-04-21 00:33:59,184][39m Trial 4453 finished with value: 0.8828828828828829 and parameters: {'objective': 'Logloss', 'colsample_bylevel': 0.09591003873533356, 'depth': 9, 'boosting_type': 'Plain', 'bootstrap_type': 'Bayesian', 'bagging_temperature': 4.61410885891461}. Best is trial 1464 with value: 0.8990825688073395.
[32m[I 2023-04-21 00:33:59,969][39m Trial 4454 finished with value: 0.8571428571428572 and parameters: {'objective': 'CrossEntropy', 'colsample_bylevel': 0.07464182909590643, 'depth': 12, 'boosting_type': 'Plain', 'bootstrap_type': 'Bayesian', 'bagging_temperature': 3.5783827008907214}. Best is trial 1464 with value: 0.8990825688073395.
[32m[I 2023-04-21 00:34:01,183][39m Trial 4455 finished with value: 0.8828828828828829 and parameters: {'objective': 'Logloss', 'colsample_bylevel': 0.09365417886428602, 'depth': 12, 'boosting_type': 'Plain', 'bootstrap_type': 'Bayesian', 'bagging_temperature': 6.058603390427339}. Best is trial 1464 with value: 0.8990825688073395.
[32m[I 2023-04-21 00:34:02,247][39m Trial 4456 finished with value: 0.8727272727272727 and parameters: {'objective': 'Logloss', 'colsample_bylevel': 0.09501026299841112, 'depth': 7, 'boosting_type': 'Plain', 'bootstrap_type': 'Bayesian', 'bagging_temperature': 5.795362680277764}. Best is trial 1464 with value: 0.8990825688073395.
[32m[I 2023-04-21 00:34:03,051][39m Trial 4457 finished with value: 0.8495575221238938 and parameters: {'objective': 'CrossEntropy', 'colsample_bylevel': 0.08447209957734814, 'depth': 11, 'boosting_type': 'Plain', 'bootstrap_type': 'MVS'}. Best is trial 1464 with value: 0.8990825688073395.
[32m[I 2023-04-21 00:34:03,845][39m Trial 4458 finished with value: 0.875 and parameters: {'objective': 'Logloss', 'colsample_bylevel': 0.0906232513410505, 'depth': 12, 'boosting_type': 'Plain', 'bootstrap_type': 'Bayesian', 'bagging_temperature': 5.191231469955441}. Best is trial 1464 with value: 0.8990825688073395.
[32m[I 2023-04-21 00:34:04,977][39m Trial 4459 finished with value: 0.875 and parameters: {'objective': 'Logloss', 'colsample_bylevel': 0.08950809853301925, 'depth': 12, 'boosting_type': 'Plain', 'bootstrap_type': 'Bayesian', 'bagging_temperature': 6.175011097757202}. Best is trial 1464 with value: 0.8990825688073395.
[32m[I 2023-04-21 00:34:06,189][39m Trial 4460 finished with value: 0.8672566371681416 and parameters: {'objective': 'Logloss', 'colsample_bylevel': 0.08812437445733064, 'depth': 12, 'boosting_type': 'Plain', 'bootstrap_type': 'Bayesian', 'bagging_temperature': 5.397783488161174}. Best is trial 1464 with value: 0.8990825688073395.
[32m[I 2023-04-21 00:34:07,517][39m Trial 4461 finished with value: 0.8807339449541284 and parameters: {'objective': 'CrossEntropy', 'colsample_bylevel': 0.08664305619588014, 'depth': 12, 'boosting_type': 'Plain', 'bootstrap_type': 'Bayesian', 'bagging_temperature': 6.5666709939012655}. Best is trial 1464 with value: 0.8990825688073395.
[32m[I 2023-04-21 00:34:08,616][39m Trial 4462 finished with value: 0.8571428571428572 and parameters: {'objective': 'CrossEntropy', 'colsample_bylevel': 0.09492900232081804, 'depth': 12, 'boosting_type': 'Plain', 'bootstrap_type': 'Bayesian', 'bagging_temperature': 6.614231572808916}. Best is trial 1464 with value: 0.8990825688073395.
[32m[I 2023-04-21 00:34:09,338][39m Trial 4463 finished with value: 0.8807339449541284 and parameters: {'objective': 'CrossEntropy', 'colsample_bylevel': 0.09492779324390774, 'depth': 12, 'boosting_type': 'Plain', 'bootstrap_type': 'Bayesian', 'bagging_temperature': 6.019758147671229}. Best is trial 1464 with value: 0.8990825688073395.
[32m[I 2023-04-21 00:34:10,538][39m Trial 4464 finished with value: 0.875 and parameters: {'objective': 'Logloss', 'colsample_bylevel': 0.08437703698908375, 'depth': 12, 'boosting_type': 'Plain', 'bootstrap_type': 'Bayesian', 'bagging_temperature': 5.716010586793173}. Best is trial 1464 with value: 0.8990825688073395.
[32m[I 2023-04-21 00:34:11,920][39m Trial 4465 finished with value: 0.8703703703703703 and parameters: {'objective': 'CrossEntropy', 'colsample_bylevel': 0.08579541953677125, 'depth': 12, 'boosting_type': 'Plain', 'bootstrap_type': 'Bayesian', 'bagging_temperature': 5.568750878098955}. Best is trial 1464 with value: 0.8990825688073395.
[32m[I 2023-04-21 00:34:12,979][39m Trial 4466 finished with value: 0.8571428571428572 and parameters: {'objective': 'CrossEntropy', 'colsample_bylevel': 0.08252428844510495, 'depth': 12, 'boosting_type': 'Plain', 'bootstrap_type': 'Bayesian', 'bagging_temperature': 5.480332615268306}. Best is trial 1464 with value: 0.8990825688073395.
[32m[I 2023-04-21 00:34:17,814][39m Trial 4467 finished with value: 0.8571428571428572 and parameters: {'objective': 'Logloss', 'colsample_bylevel': 0.09081625158491678, 'depth': 12, 'boosting_type': 'Ordered', 'bootstrap_type': 'Bayesian', 'bagging_temperature': 5.857023582767528}. Best is trial 1464 with value: 0.8990825688073395.
[32m[I 2023-04-21 00:34:18,915][39m Trial 4468 finished with value: 0.8807339449541284 and parameters: {'objective': 'Logloss', 'colsample_bylevel': 0.0905827914139627, 'depth': 12, 'boosting_type': 'Plain', 'bootstrap_type': 'Bayesian', 'bagging_temperature': 4.976146560227642}. Best is trial 1464 with value: 0.8990825688073395.
[32m[I 2023-04-21 00:34:20,417][39m Trial 4469 finished with value: 0.8727272727272727 and parameters: {'objective': 'Logloss', 'colsample_bylevel': 0.08937849977924484, 'depth': 12, 'boosting_type': 'Plain', 'bootstrap_type': 'Bayesian', 'bagging_temperature': 5.326009266477674}. Best is trial 1464 with value: 0.8990825688073395.
[32m[I 2023-04-21 00:34:21,483][39m Trial 4470 finished with value: 0.8807339449541284 and parameters: {'objective': 'Logloss', 'colsample_bylevel': 0.09678382665540075, 'depth': 12, 'boosting_type': 'Plain', 'bootstrap_type': 'Bayesian', 'bagging_temperature': 5.7304363148440265}. Best is trial 1464 with value: 0.8990825688073395.
[32m[I 2023-04-21 00:34:23,029][39m Trial 4471 finished with value: 0.890909090909091 and parameters: {'objective': 'Logloss', 'colsample_bylevel': 0.08949330647566123, 'depth': 12, 'boosting_type': 'Plain', 'bootstrap_type': 'Bayesian', 'bagging_temperature': 5.33607917683476}. Best is trial 1464 with value: 0.8990825688073395.
[32m[I 2023-04-21 00:34:23,941][39m Trial 4472 finished with value: 0.8727272727272727 and parameters: {'objective': 'Logloss', 'colsample_bylevel': 0.09618166032500274, 'depth': 11, 'boosting_type': 'Plain', 'bootstrap_type': 'Bayesian', 'bagging_temperature': 6.87987113973493}. Best is trial 1464 with value: 0.8990825688073395.
[32m[I 2023-04-21 00:34:25,225][39m Trial 4473 finished with value: 0.8648648648648648 and parameters: {'objective': 'CrossEntropy', 'colsample_bylevel': 0.09729128270352827, 'depth': 12, 'boosting_type': 'Plain', 'bootstrap_type': 'Bayesian', 'bagging_temperature': 3.56821279013998}. Best is trial 1464 with value: 0.8990825688073395.
[32m[I 2023-04-21 00:34:26,178][39m Trial 4474 finished with value: 0.8305084745762712 and parameters: {'objective': 'CrossEntropy', 'colsample_bylevel': 0.0389086492663489, 'depth': 10, 'boosting_type': 'Plain', 'bootstrap_type': 'Bernoulli', 'subsample': 0.8599742552659908}. Best is trial 1464 with value: 0.8990825688073395.
[32m[I 2023-04-21 00:34:27,397][39m Trial 4475 finished with value: 0.8495575221238938 and parameters: {'objective': 'Logloss', 'colsample_bylevel': 0.09096748061462716, 'depth': 11, 'boosting_type': 'Plain', 'bootstrap_type': 'Bayesian', 'bagging_temperature': 5.731434580096557}. Best is trial 1464 with value: 0.8990825688073395.
[32m[I 2023-04-21 00:34:28,523][39m Trial 4476 finished with value: 0.8807339449541284 and parameters: {'objective': 'Logloss', 'colsample_bylevel': 0.08741469860209752, 'depth': 12, 'boosting_type': 'Plain', 'bootstrap_type': 'Bayesian', 'bagging_temperature': 5.052945883990252}. Best is trial 1464 with value: 0.8990825688073395.
[32m[I 2023-04-21 00:34:29,275][39m Trial 4477 finished with value: 0.8727272727272727 and parameters: {'objective': 'CrossEntropy', 'colsample_bylevel': 0.08843204589730867, 'depth': 12, 'boosting_type': 'Plain', 'bootstrap_type': 'Bayesian', 'bagging_temperature': 5.541222951156875}. Best is trial 1464 with value: 0.8990825688073395.
