[32m[I 2023-04-21 00:13:46,913][39m Trial 3557 finished with value: 0.888888888888889 and parameters: {'objective': 'CrossEntropy', 'colsample_bylevel': 0.09593168369638867, 'depth': 10, 'boosting_type': 'Plain', 'bootstrap_type': 'Bayesian', 'bagging_temperature': 3.9806537230070913}. Best is trial 1464 with value: 0.8990825688073395.
[32m[I 2023-04-21 00:13:47,614][39m Trial 3558 finished with value: 0.8672566371681416 and parameters: {'objective': 'Logloss', 'colsample_bylevel': 0.08877331626273645, 'depth': 7, 'boosting_type': 'Plain', 'bootstrap_type': 'Bayesian', 'bagging_temperature': 4.215101160005818}. Best is trial 1464 with value: 0.8990825688073395.
[32m[I 2023-04-21 00:13:48,506][39m Trial 3559 finished with value: 0.8421052631578947 and parameters: {'objective': 'CrossEntropy', 'colsample_bylevel': 0.0952603594955569, 'depth': 9, 'boosting_type': 'Plain', 'bootstrap_type': 'MVS'}. Best is trial 1464 with value: 0.8990825688073395.
[32m[I 2023-04-21 00:13:49,493][39m Trial 3560 finished with value: 0.8807339449541284 and parameters: {'objective': 'Logloss', 'colsample_bylevel': 0.09756899022287356, 'depth': 7, 'boosting_type': 'Plain', 'bootstrap_type': 'Bayesian', 'bagging_temperature': 6.2491080170368996}. Best is trial 1464 with value: 0.8990825688073395.
[32m[I 2023-04-21 00:13:51,261][39m Trial 3561 finished with value: 0.875 and parameters: {'objective': 'Logloss', 'colsample_bylevel': 0.09484556082136099, 'depth': 9, 'boosting_type': 'Plain', 'bootstrap_type': 'Bayesian', 'bagging_temperature': 5.127459237058486}. Best is trial 1464 with value: 0.8990825688073395.
[32m[I 2023-04-21 00:13:52,494][39m Trial 3562 finished with value: 0.8521739130434783 and parameters: {'objective': 'Logloss', 'colsample_bylevel': 0.044403307740406774, 'depth': 9, 'boosting_type': 'Plain', 'bootstrap_type': 'Bayesian', 'bagging_temperature': 5.97588342904931}. Best is trial 1464 with value: 0.8990825688073395.
[32m[I 2023-04-21 00:13:54,007][39m Trial 3563 finished with value: 0.8727272727272727 and parameters: {'objective': 'CrossEntropy', 'colsample_bylevel': 0.09115102323147792, 'depth': 9, 'boosting_type': 'Plain', 'bootstrap_type': 'Bayesian', 'bagging_temperature': 5.954531587447005}. Best is trial 1464 with value: 0.8990825688073395.
[32m[I 2023-04-21 00:13:54,942][39m Trial 3564 finished with value: 0.8305084745762712 and parameters: {'objective': 'Logloss', 'colsample_bylevel': 0.09545654796232877, 'depth': 2, 'boosting_type': 'Plain', 'bootstrap_type': 'Bayesian', 'bagging_temperature': 3.7773797242426945}. Best is trial 1464 with value: 0.8990825688073395.
[32m[I 2023-04-21 00:13:59,611][39m Trial 3565 finished with value: 0.8623853211009175 and parameters: {'objective': 'CrossEntropy', 'colsample_bylevel': 0.09863892116854764, 'depth': 8, 'boosting_type': 'Ordered', 'bootstrap_type': 'Bayesian', 'bagging_temperature': 4.921656519964238}. Best is trial 1464 with value: 0.8990825688073395.
[32m[I 2023-04-21 00:14:00,762][39m Trial 3566 finished with value: 0.8807339449541284 and parameters: {'objective': 'Logloss', 'colsample_bylevel': 0.09554830753807751, 'depth': 7, 'boosting_type': 'Plain', 'bootstrap_type': 'Bayesian', 'bagging_temperature': 5.608337248349925}. Best is trial 1464 with value: 0.8990825688073395.
[32m[I 2023-04-21 00:14:02,691][39m Trial 3567 finished with value: 0.8807339449541284 and parameters: {'objective': 'Logloss', 'colsample_bylevel': 0.0963175966181476, 'depth': 9, 'boosting_type': 'Plain', 'bootstrap_type': 'Bayesian', 'bagging_temperature': 4.7678753705123045}. Best is trial 1464 with value: 0.8990825688073395.
[32m[I 2023-04-21 00:14:03,467][39m Trial 3568 finished with value: 0.8347826086956522 and parameters: {'objective': 'CrossEntropy', 'colsample_bylevel': 0.0635093138767593, 'depth': 9, 'boosting_type': 'Plain', 'bootstrap_type': 'Bayesian', 'bagging_temperature': 6.231725544009079}. Best is trial 1464 with value: 0.8990825688073395.
[32m[I 2023-04-21 00:14:04,926][39m Trial 3569 finished with value: 0.8828828828828829 and parameters: {'objective': 'Logloss', 'colsample_bylevel': 0.0942858001239266, 'depth': 8, 'boosting_type': 'Plain', 'bootstrap_type': 'Bayesian', 'bagging_temperature': 5.606137923350627}. Best is trial 1464 with value: 0.8990825688073395.
[32m[I 2023-04-21 00:14:06,877][39m Trial 3570 finished with value: 0.8828828828828829 and parameters: {'objective': 'Logloss', 'colsample_bylevel': 0.0936761070524043, 'depth': 9, 'boosting_type': 'Plain', 'bootstrap_type': 'Bayesian', 'bagging_temperature': 5.58286365152451}. Best is trial 1464 with value: 0.8990825688073395.
[32m[I 2023-04-21 00:14:07,572][39m Trial 3571 finished with value: 0.8727272727272727 and parameters: {'objective': 'Logloss', 'colsample_bylevel': 0.08991219073568807, 'depth': 7, 'boosting_type': 'Plain', 'bootstrap_type': 'Bayesian', 'bagging_temperature': 5.172260374142611}. Best is trial 1464 with value: 0.8990825688073395.
[32m[I 2023-04-21 00:14:08,575][39m Trial 3572 finished with value: 0.8727272727272727 and parameters: {'objective': 'CrossEntropy', 'colsample_bylevel': 0.09731128937141706, 'depth': 9, 'boosting_type': 'Plain', 'bootstrap_type': 'Bayesian', 'bagging_temperature': 5.05018826183757}. Best is trial 1464 with value: 0.8990825688073395.
[32m[I 2023-04-21 00:14:09,572][39m Trial 3573 finished with value: 0.8828828828828829 and parameters: {'objective': 'Logloss', 'colsample_bylevel': 0.09403796524034726, 'depth': 8, 'boosting_type': 'Plain', 'bootstrap_type': 'Bayesian', 'bagging_temperature': 5.796641457986126}. Best is trial 1464 with value: 0.8990825688073395.
[32m[I 2023-04-21 00:14:10,709][39m Trial 3574 finished with value: 0.888888888888889 and parameters: {'objective': 'Logloss', 'colsample_bylevel': 0.09427167010503473, 'depth': 9, 'boosting_type': 'Plain', 'bootstrap_type': 'Bayesian', 'bagging_temperature': 6.716418613415972}. Best is trial 1464 with value: 0.8990825688073395.
[32m[I 2023-04-21 00:14:11,753][39m Trial 3575 finished with value: 0.8807339449541284 and parameters: {'objective': 'Logloss', 'colsample_bylevel': 0.09638321445878285, 'depth': 9, 'boosting_type': 'Plain', 'bootstrap_type': 'Bayesian', 'bagging_temperature': 5.905624051590602}. Best is trial 1464 with value: 0.8990825688073395.
[32m[I 2023-04-21 00:14:13,265][39m Trial 3576 finished with value: 0.888888888888889 and parameters: {'objective': 'Logloss', 'colsample_bylevel': 0.09466189454641391, 'depth': 9, 'boosting_type': 'Plain', 'bootstrap_type': 'Bayesian', 'bagging_temperature': 5.689136708115807}. Best is trial 1464 with value: 0.8990825688073395.
[32m[I 2023-04-21 00:14:14,544][39m Trial 3577 finished with value: 0.8807339449541284 and parameters: {'objective': 'CrossEntropy', 'colsample_bylevel': 0.08961993042340229, 'depth': 10, 'boosting_type': 'Plain', 'bootstrap_type': 'Bayesian', 'bagging_temperature': 5.229707969120972}. Best is trial 1464 with value: 0.8990825688073395.
[32m[I 2023-04-21 00:14:15,517][39m Trial 3578 finished with value: 0.8571428571428572 and parameters: {'objective': 'Logloss', 'colsample_bylevel': 0.09133047433661828, 'depth': 6, 'boosting_type': 'Plain', 'bootstrap_type': 'Bernoulli', 'subsample': 0.890565862338087}. Best is trial 1464 with value: 0.8990825688073395.
[32m[I 2023-04-21 00:14:16,250][39m Trial 3579 finished with value: 0.8727272727272727 and parameters: {'objective': 'CrossEntropy', 'colsample_bylevel': 0.09007665432182957, 'depth': 10, 'boosting_type': 'Plain', 'bootstrap_type': 'Bayesian', 'bagging_temperature': 5.525003650598503}. Best is trial 1464 with value: 0.8990825688073395.
[32m[I 2023-04-21 00:14:17,321][39m Trial 3580 finished with value: 0.8828828828828829 and parameters: {'objective': 'Logloss', 'colsample_bylevel': 0.09235686923502535, 'depth': 7, 'boosting_type': 'Plain', 'bootstrap_type': 'Bayesian', 'bagging_temperature': 5.358742587777511}. Best is trial 1464 with value: 0.8990825688073395.
[32m[I 2023-04-21 00:14:18,237][39m Trial 3581 finished with value: 0.8623853211009175 and parameters: {'objective': 'Logloss', 'colsample_bylevel': 0.09202789202773823, 'depth': 9, 'boosting_type': 'Plain', 'bootstrap_type': 'Bayesian', 'bagging_temperature': 5.515175625826169}. Best is trial 1464 with value: 0.8990825688073395.
[32m[I 2023-04-21 00:14:20,000][39m Trial 3582 finished with value: 0.8727272727272727 and parameters: {'objective': 'Logloss', 'colsample_bylevel': 0.09575109740703679, 'depth': 9, 'boosting_type': 'Plain', 'bootstrap_type': 'Bayesian', 'bagging_temperature': 6.765014596206804}. Best is trial 1464 with value: 0.8990825688073395.
[32m[I 2023-04-21 00:14:24,341][39m Trial 3583 finished with value: 0.8495575221238938 and parameters: {'objective': 'CrossEntropy', 'colsample_bylevel': 0.09343908187184159, 'depth': 8, 'boosting_type': 'Ordered', 'bootstrap_type': 'MVS'}. Best is trial 1464 with value: 0.8990825688073395.
[32m[I 2023-04-21 00:14:25,242][39m Trial 3584 finished with value: 0.823529411764706 and parameters: {'objective': 'Logloss', 'colsample_bylevel': 0.035619398286975, 'depth': 7, 'boosting_type': 'Plain', 'bootstrap_type': 'Bayesian', 'bagging_temperature': 4.059888943320197}. Best is trial 1464 with value: 0.8990825688073395.
[32m[I 2023-04-21 00:14:26,673][39m Trial 3585 finished with value: 0.8727272727272727 and parameters: {'objective': 'CrossEntropy', 'colsample_bylevel': 0.09845647606299401, 'depth': 9, 'boosting_type': 'Plain', 'bootstrap_type': 'Bayesian', 'bagging_temperature': 5.7101843774043735}. Best is trial 1464 with value: 0.8990825688073395.
[32m[I 2023-04-21 00:14:28,087][39m Trial 3586 finished with value: 0.8828828828828829 and parameters: {'objective': 'CrossEntropy', 'colsample_bylevel': 0.09354096514700519, 'depth': 9, 'boosting_type': 'Plain', 'bootstrap_type': 'Bayesian', 'bagging_temperature': 4.747671616863039}. Best is trial 1464 with value: 0.8990825688073395.
[32m[I 2023-04-21 00:14:29,468][39m Trial 3587 finished with value: 0.8807339449541284 and parameters: {'objective': 'Logloss', 'colsample_bylevel': 0.09770251157757014, 'depth': 9, 'boosting_type': 'Plain', 'bootstrap_type': 'Bayesian', 'bagging_temperature': 3.7664195298195953}. Best is trial 1464 with value: 0.8990825688073395.
[32m[I 2023-04-21 00:14:30,132][39m Trial 3588 finished with value: 0.8571428571428572 and parameters: {'objective': 'Logloss', 'colsample_bylevel': 0.09249224596866792, 'depth': 4, 'boosting_type': 'Plain', 'bootstrap_type': 'Bayesian', 'bagging_temperature': 5.792494025365369}. Best is trial 1464 with value: 0.8990825688073395.
[32m[I 2023-04-21 00:14:31,491][39m Trial 3589 finished with value: 0.8623853211009175 and parameters: {'objective': 'Logloss', 'colsample_bylevel': 0.09834724759309539, 'depth': 9, 'boosting_type': 'Plain', 'bootstrap_type': 'Bayesian', 'bagging_temperature': 5.941327404417555}. Best is trial 1464 with value: 0.8990825688073395.
[32m[I 2023-04-21 00:14:32,483][39m Trial 3590 finished with value: 0.8807339449541284 and parameters: {'objective': 'CrossEntropy', 'colsample_bylevel': 0.09381650280718343, 'depth': 9, 'boosting_type': 'Plain', 'bootstrap_type': 'Bayesian', 'bagging_temperature': 6.218291052090967}. Best is trial 1464 with value: 0.8990825688073395.
[32m[I 2023-04-21 00:14:34,007][39m Trial 3591 finished with value: 0.8807339449541284 and parameters: {'objective': 'Logloss', 'colsample_bylevel': 0.0942017361766889, 'depth': 9, 'boosting_type': 'Plain', 'bootstrap_type': 'Bayesian', 'bagging_temperature': 4.9383038912626045}. Best is trial 1464 with value: 0.8990825688073395.
[32m[I 2023-04-21 00:14:35,153][39m Trial 3592 finished with value: 0.8648648648648648 and parameters: {'objective': 'Logloss', 'colsample_bylevel': 0.09098469763471814, 'depth': 9, 'boosting_type': 'Plain', 'bootstrap_type': 'Bayesian', 'bagging_temperature': 5.54254061988371}. Best is trial 1464 with value: 0.8990825688073395.
[32m[I 2023-04-21 00:14:36,007][39m Trial 3593 finished with value: 0.8807339449541284 and parameters: {'objective': 'CrossEntropy', 'colsample_bylevel': 0.09732390755416558, 'depth': 11, 'boosting_type': 'Plain', 'bootstrap_type': 'Bayesian', 'bagging_temperature': 5.602433824016668}. Best is trial 1464 with value: 0.8990825688073395.
[32m[I 2023-04-21 00:14:37,596][39m Trial 3594 finished with value: 0.8727272727272727 and parameters: {'objective': 'Logloss', 'colsample_bylevel': 0.08825304718206155, 'depth': 9, 'boosting_type': 'Plain', 'bootstrap_type': 'Bayesian', 'bagging_temperature': 3.254480452888133}. Best is trial 1464 with value: 0.8990825688073395.
[32m[I 2023-04-21 00:14:38,318][39m Trial 3595 finished with value: 0.8703703703703703 and parameters: {'objective': 'CrossEntropy', 'colsample_bylevel': 0.09242076229466341, 'depth': 10, 'boosting_type': 'Plain', 'bootstrap_type': 'Bayesian', 'bagging_temperature': 6.392268512483253}. Best is trial 1464 with value: 0.8990825688073395.
[32m[I 2023-04-21 00:14:39,942][39m Trial 3596 finished with value: 0.8648648648648648 and parameters: {'objective': 'Logloss', 'colsample_bylevel': 0.09565342796145508, 'depth': 9, 'boosting_type': 'Plain', 'bootstrap_type': 'Bayesian', 'bagging_temperature': 3.4079873759621706}. Best is trial 1464 with value: 0.8990825688073395.
[32m[I 2023-04-21 00:14:41,203][39m Trial 3597 finished with value: 0.8275862068965517 and parameters: {'objective': 'Logloss', 'colsample_bylevel': 0.0206898542288904, 'depth': 9, 'boosting_type': 'Plain', 'bootstrap_type': 'Bayesian', 'bagging_temperature': 4.457875995864727}. Best is trial 1464 with value: 0.8990825688073395.
[32m[I 2023-04-21 00:14:42,422][39m Trial 3598 finished with value: 0.8807339449541284 and parameters: {'objective': 'Logloss', 'colsample_bylevel': 0.09193793375090933, 'depth': 9, 'boosting_type': 'Plain', 'bootstrap_type': 'Bayesian', 'bagging_temperature': 4.905730743674632}. Best is trial 1464 with value: 0.8990825688073395.
[32m[I 2023-04-21 00:14:43,190][39m Trial 3599 finished with value: 0.8648648648648648 and parameters: {'objective': 'CrossEntropy', 'colsample_bylevel': 0.09981384527511585, 'depth': 10, 'boosting_type': 'Plain', 'bootstrap_type': 'Bernoulli', 'subsample': 0.5294471611378737}. Best is trial 1464 with value: 0.8990825688073395.
[32m[I 2023-04-21 00:14:43,998][39m Trial 3600 finished with value: 0.8807339449541284 and parameters: {'objective': 'Logloss', 'colsample_bylevel': 0.0966423372726831, 'depth': 7, 'boosting_type': 'Plain', 'bootstrap_type': 'Bayesian', 'bagging_temperature': 6.253703387929477}. Best is trial 1464 with value: 0.8990825688073395.
[32m[I 2023-04-21 00:14:45,642][39m Trial 3601 finished with value: 0.875 and parameters: {'objective': 'Logloss', 'colsample_bylevel': 0.09064571731920221, 'depth': 9, 'boosting_type': 'Plain', 'bootstrap_type': 'Bayesian', 'bagging_temperature': 5.380680137480519}. Best is trial 1464 with value: 0.8990825688073395.
[32m[I 2023-04-21 00:14:50,642][39m Trial 3602 finished with value: 0.8392857142857144 and parameters: {'objective': 'Logloss', 'colsample_bylevel': 0.0891889972672765, 'depth': 9, 'boosting_type': 'Ordered', 'bootstrap_type': 'Bayesian', 'bagging_temperature': 6.099694189976819}. Best is trial 1464 with value: 0.8990825688073395.
[32m[I 2023-04-21 00:14:51,957][39m Trial 3603 finished with value: 0.8421052631578947 and parameters: {'objective': 'Logloss', 'colsample_bylevel': 0.07444750552199686, 'depth': 7, 'boosting_type': 'Plain', 'bootstrap_type': 'MVS'}. Best is trial 1464 with value: 0.8990825688073395.
[32m[I 2023-04-21 00:14:52,954][39m Trial 3604 finished with value: 0.8672566371681416 and parameters: {'objective': 'CrossEntropy', 'colsample_bylevel': 0.0819077554493991, 'depth': 10, 'boosting_type': 'Plain', 'bootstrap_type': 'Bayesian', 'bagging_temperature': 5.809249948753343}. Best is trial 1464 with value: 0.8990825688073395.
[32m[I 2023-04-21 00:14:54,449][39m Trial 3605 finished with value: 0.8807339449541284 and parameters: {'objective': 'CrossEntropy', 'colsample_bylevel': 0.09696554460185156, 'depth': 8, 'boosting_type': 'Plain', 'bootstrap_type': 'Bayesian', 'bagging_temperature': 4.369781760483312}. Best is trial 1464 with value: 0.8990825688073395.
[32m[I 2023-04-21 00:14:56,070][39m Trial 3606 finished with value: 0.8807339449541284 and parameters: {'objective': 'Logloss', 'colsample_bylevel': 0.09606708247206326, 'depth': 9, 'boosting_type': 'Plain', 'bootstrap_type': 'Bayesian', 'bagging_temperature': 5.524380558800428}. Best is trial 1464 with value: 0.8990825688073395.
[32m[I 2023-04-21 00:14:57,371][39m Trial 3607 finished with value: 0.8703703703703703 and parameters: {'objective': 'CrossEntropy', 'colsample_bylevel': 0.09998073327022346, 'depth': 8, 'boosting_type': 'Plain', 'bootstrap_type': 'Bayesian', 'bagging_temperature': 5.170229728524638}. Best is trial 1464 with value: 0.8990825688073395.
[32m[I 2023-04-21 00:14:58,078][39m Trial 3608 finished with value: 0.8545454545454546 and parameters: {'objective': 'Logloss', 'colsample_bylevel': 0.08596331302777291, 'depth': 11, 'boosting_type': 'Plain', 'bootstrap_type': 'Bayesian', 'bagging_temperature': 7.103460385715572}. Best is trial 1464 with value: 0.8990825688073395.
[32m[I 2023-04-21 00:14:58,812][39m Trial 3609 finished with value: 0.8807339449541284 and parameters: {'objective': 'Logloss', 'colsample_bylevel': 0.09470352791085095, 'depth': 10, 'boosting_type': 'Plain', 'bootstrap_type': 'Bayesian', 'bagging_temperature': 6.064268232420668}. Best is trial 1464 with value: 0.8990825688073395.
[32m[I 2023-04-21 00:15:00,083][39m Trial 3610 finished with value: 0.8807339449541284 and parameters: {'objective': 'Logloss', 'colsample_bylevel': 0.09589977864837641, 'depth': 7, 'boosting_type': 'Plain', 'bootstrap_type': 'Bayesian', 'bagging_temperature': 5.164605937284039}. Best is trial 1464 with value: 0.8990825688073395.
[32m[I 2023-04-21 00:15:02,022][39m Trial 3611 finished with value: 0.8727272727272727 and parameters: {'objective': 'CrossEntropy', 'colsample_bylevel': 0.08986992529576246, 'depth': 9, 'boosting_type': 'Plain', 'bootstrap_type': 'Bayesian', 'bagging_temperature': 5.919438188502406}. Best is trial 1464 with value: 0.8990825688073395.
[32m[I 2023-04-21 00:15:02,779][39m Trial 3612 finished with value: 0.875 and parameters: {'objective': 'Logloss', 'colsample_bylevel': 0.09261720985188503, 'depth': 5, 'boosting_type': 'Plain', 'bootstrap_type': 'Bayesian', 'bagging_temperature': 6.956911197639546}. Best is trial 1464 with value: 0.8990825688073395.
[32m[I 2023-04-21 00:15:03,536][39m Trial 3613 finished with value: 0.8648648648648648 and parameters: {'objective': 'Logloss', 'colsample_bylevel': 0.09413610171942505, 'depth': 8, 'boosting_type': 'Plain', 'bootstrap_type': 'Bayesian', 'bagging_temperature': 6.069874247984785}. Best is trial 1464 with value: 0.8990825688073395.
[32m[I 2023-04-21 00:15:04,616][39m Trial 3614 finished with value: 0.8571428571428572 and parameters: {'objective': 'Logloss', 'colsample_bylevel': 0.0939529121405215, 'depth': 9, 'boosting_type': 'Plain', 'bootstrap_type': 'Bayesian', 'bagging_temperature': 4.646209129324983}. Best is trial 1464 with value: 0.8990825688073395.
[32m[I 2023-04-21 00:15:05,642][39m Trial 3615 finished with value: 0.8727272727272727 and parameters: {'objective': 'Logloss', 'colsample_bylevel': 0.09616140219605628, 'depth': 7, 'boosting_type': 'Plain', 'bootstrap_type': 'Bayesian', 'bagging_temperature': 6.724769925870199}. Best is trial 1464 with value: 0.8990825688073395.
[32m[I 2023-04-21 00:15:06,489][39m Trial 3616 finished with value: 0.8376068376068375 and parameters: {'objective': 'CrossEntropy', 'colsample_bylevel': 0.05651905853672085, 'depth': 9, 'boosting_type': 'Plain', 'bootstrap_type': 'Bayesian', 'bagging_temperature': 5.01552466942022}. Best is trial 1464 with value: 0.8990825688073395.
[32m[I 2023-04-21 00:15:08,162][39m Trial 3617 finished with value: 0.8648648648648648 and parameters: {'objective': 'Logloss', 'colsample_bylevel': 0.09525056195445407, 'depth': 9, 'boosting_type': 'Plain', 'bootstrap_type': 'Bayesian', 'bagging_temperature': 4.9768244929269825}. Best is trial 1464 with value: 0.8990825688073395.
[32m[I 2023-04-21 00:15:09,375][39m Trial 3618 finished with value: 0.8521739130434783 and parameters: {'objective': 'Logloss', 'colsample_bylevel': 0.039068899209388316, 'depth': 9, 'boosting_type': 'Plain', 'bootstrap_type': 'Bayesian', 'bagging_temperature': 4.776884010236484}. Best is trial 1464 with value: 0.8990825688073395.
[32m[I 2023-04-21 00:15:11,351][39m Trial 3619 finished with value: 0.8807339449541284 and parameters: {'objective': 'CrossEntropy', 'colsample_bylevel': 0.08746502230039825, 'depth': 8, 'boosting_type': 'Plain', 'bootstrap_type': 'Bayesian', 'bagging_temperature': 5.420188652796878}. Best is trial 1464 with value: 0.8990825688073395.
[32m[I 2023-04-21 00:15:12,269][39m Trial 3620 finished with value: 0.8807339449541284 and parameters: {'objective': 'Logloss', 'colsample_bylevel': 0.09508632559666257, 'depth': 8, 'boosting_type': 'Plain', 'bootstrap_type': 'Bayesian', 'bagging_temperature': 5.595411398871584}. Best is trial 1464 with value: 0.8990825688073395.
[32m[I 2023-04-21 00:15:17,144][39m Trial 3621 finished with value: 0.8495575221238938 and parameters: {'objective': 'Logloss', 'colsample_bylevel': 0.09453013340059943, 'depth': 8, 'boosting_type': 'Ordered', 'bootstrap_type': 'Bayesian', 'bagging_temperature': 5.580634584829304}. Best is trial 1464 with value: 0.8990825688073395.
[32m[I 2023-04-21 00:15:18,722][39m Trial 3622 finished with value: 0.8495575221238938 and parameters: {'objective': 'Logloss', 'colsample_bylevel': 0.09054086303817928, 'depth': 9, 'boosting_type': 'Plain', 'bootstrap_type': 'Bernoulli', 'subsample': 0.9232928178185673}. Best is trial 1464 with value: 0.8990825688073395.
