[32m[I 2023-04-20 23:02:58,271][39m Trial 267 finished with value: 0.8807339449541284 and parameters: {'objective': 'Logloss', 'colsample_bylevel': 0.09488045040360706, 'depth': 7, 'boosting_type': 'Plain', 'bootstrap_type': 'Bayesian', 'bagging_temperature': 4.567291563606031}. Best is trial 205 with value: 0.890909090909091.
[32m[I 2023-04-20 23:02:59,371][39m Trial 268 finished with value: 0.8727272727272727 and parameters: {'objective': 'Logloss', 'colsample_bylevel': 0.09526152337492504, 'depth': 7, 'boosting_type': 'Plain', 'bootstrap_type': 'Bayesian', 'bagging_temperature': 5.424591340043909}. Best is trial 205 with value: 0.890909090909091.
[32m[I 2023-04-20 23:03:00,058][39m Trial 269 finished with value: 0.8495575221238938 and parameters: {'objective': 'Logloss', 'colsample_bylevel': 0.09444676961765443, 'depth': 11, 'boosting_type': 'Plain', 'bootstrap_type': 'MVS'}. Best is trial 205 with value: 0.890909090909091.
[32m[I 2023-04-20 23:03:01,491][39m Trial 270 finished with value: 0.8703703703703703 and parameters: {'objective': 'Logloss', 'colsample_bylevel': 0.09109411088667647, 'depth': 8, 'boosting_type': 'Plain', 'bootstrap_type': 'Bayesian', 'bagging_temperature': 4.969718509782509}. Best is trial 205 with value: 0.890909090909091.
[32m[I 2023-04-20 23:03:02,176][39m Trial 271 finished with value: 0.8703703703703703 and parameters: {'objective': 'Logloss', 'colsample_bylevel': 0.09219479111748884, 'depth': 6, 'boosting_type': 'Plain', 'bootstrap_type': 'Bayesian', 'bagging_temperature': 4.186225621529982}. Best is trial 205 with value: 0.890909090909091.
[32m[I 2023-04-20 23:03:03,518][39m Trial 272 finished with value: 0.8727272727272727 and parameters: {'objective': 'Logloss', 'colsample_bylevel': 0.09364036284574813, 'depth': 9, 'boosting_type': 'Plain', 'bootstrap_type': 'Bayesian', 'bagging_temperature': 4.692470930735964}. Best is trial 205 with value: 0.890909090909091.
[32m[I 2023-04-20 23:03:04,366][39m Trial 273 finished with value: 0.8807339449541284 and parameters: {'objective': 'Logloss', 'colsample_bylevel': 0.09781779022977218, 'depth': 7, 'boosting_type': 'Plain', 'bootstrap_type': 'Bayesian', 'bagging_temperature': 4.084349377055214}. Best is trial 205 with value: 0.890909090909091.
[32m[I 2023-04-20 23:03:05,502][39m Trial 274 finished with value: 0.888888888888889 and parameters: {'objective': 'Logloss', 'colsample_bylevel': 0.09757371254312669, 'depth': 7, 'boosting_type': 'Plain', 'bootstrap_type': 'Bayesian', 'bagging_temperature': 4.15615379063724}. Best is trial 205 with value: 0.890909090909091.
[32m[I 2023-04-20 23:03:06,507][39m Trial 275 finished with value: 0.888888888888889 and parameters: {'objective': 'Logloss', 'colsample_bylevel': 0.09586364697165904, 'depth': 10, 'boosting_type': 'Plain', 'bootstrap_type': 'Bayesian', 'bagging_temperature': 4.035669494133888}. Best is trial 205 with value: 0.890909090909091.
[32m[I 2023-04-20 23:03:07,603][39m Trial 276 finished with value: 0.888888888888889 and parameters: {'objective': 'Logloss', 'colsample_bylevel': 0.09616175995596542, 'depth': 10, 'boosting_type': 'Plain', 'bootstrap_type': 'Bayesian', 'bagging_temperature': 4.381415867771946}. Best is trial 205 with value: 0.890909090909091.
[32m[I 2023-04-20 23:03:08,444][39m Trial 277 finished with value: 0.8672566371681416 and parameters: {'objective': 'Logloss', 'colsample_bylevel': 0.09867113337791339, 'depth': 7, 'boosting_type': 'Plain', 'bootstrap_type': 'Bayesian', 'bagging_temperature': 0.12406731713130625}. Best is trial 205 with value: 0.890909090909091.
[32m[I 2023-04-20 23:03:09,148][39m Trial 278 finished with value: 0.8807339449541284 and parameters: {'objective': 'Logloss', 'colsample_bylevel': 0.09759540489204743, 'depth': 10, 'boosting_type': 'Plain', 'bootstrap_type': 'Bayesian', 'bagging_temperature': 4.259130819207502}. Best is trial 205 with value: 0.890909090909091.
[32m[I 2023-04-20 23:03:13,987][39m Trial 279 finished with value: 0.8571428571428572 and parameters: {'objective': 'Logloss', 'colsample_bylevel': 0.09682588504822606, 'depth': 10, 'boosting_type': 'Ordered', 'bootstrap_type': 'Bernoulli', 'subsample': 0.4736176174632964}. Best is trial 205 with value: 0.890909090909091.
[32m[I 2023-04-20 23:03:15,094][39m Trial 280 finished with value: 0.8545454545454546 and parameters: {'objective': 'Logloss', 'colsample_bylevel': 0.09602461417115579, 'depth': 10, 'boosting_type': 'Plain', 'bootstrap_type': 'Bayesian', 'bagging_temperature': 4.62321188799443}. Best is trial 205 with value: 0.890909090909091.
[32m[I 2023-04-20 23:03:15,912][39m Trial 281 finished with value: 0.8623853211009175 and parameters: {'objective': 'Logloss', 'colsample_bylevel': 0.09531017868175731, 'depth': 7, 'boosting_type': 'Plain', 'bootstrap_type': 'Bayesian', 'bagging_temperature': 4.474308909194571}. Best is trial 205 with value: 0.890909090909091.
[32m[I 2023-04-20 23:03:16,820][39m Trial 282 finished with value: 0.8807339449541284 and parameters: {'objective': 'Logloss', 'colsample_bylevel': 0.09457741752257201, 'depth': 7, 'boosting_type': 'Plain', 'bootstrap_type': 'Bayesian', 'bagging_temperature': 4.861858159348629}. Best is trial 205 with value: 0.890909090909091.
[32m[I 2023-04-20 23:03:18,202][39m Trial 283 finished with value: 0.8727272727272727 and parameters: {'objective': 'Logloss', 'colsample_bylevel': 0.09656082542958738, 'depth': 9, 'boosting_type': 'Plain', 'bootstrap_type': 'Bayesian', 'bagging_temperature': 1.8195536460535484}. Best is trial 205 with value: 0.890909090909091.
[32m[I 2023-04-20 23:03:19,415][39m Trial 284 finished with value: 0.8648648648648648 and parameters: {'objective': 'Logloss', 'colsample_bylevel': 0.08870715947433488, 'depth': 10, 'boosting_type': 'Plain', 'bootstrap_type': 'Bayesian', 'bagging_temperature': 4.344807659566272}. Best is trial 205 with value: 0.890909090909091.
[32m[I 2023-04-20 23:03:20,374][39m Trial 285 finished with value: 0.8807339449541284 and parameters: {'objective': 'Logloss', 'colsample_bylevel': 0.0964282833345881, 'depth': 9, 'boosting_type': 'Plain', 'bootstrap_type': 'Bayesian', 'bagging_temperature': 4.709243047040711}. Best is trial 205 with value: 0.890909090909091.
[32m[I 2023-04-20 23:03:21,976][39m Trial 286 finished with value: 0.8807339449541284 and parameters: {'objective': 'Logloss', 'colsample_bylevel': 0.09980437518339583, 'depth': 9, 'boosting_type': 'Plain', 'bootstrap_type': 'Bayesian', 'bagging_temperature': 4.143472082777732}. Best is trial 205 with value: 0.890909090909091.
[32m[I 2023-04-20 23:03:22,976][39m Trial 287 finished with value: 0.8828828828828829 and parameters: {'objective': 'Logloss', 'colsample_bylevel': 0.09845784571829176, 'depth': 9, 'boosting_type': 'Plain', 'bootstrap_type': 'Bayesian', 'bagging_temperature': 3.981961068001906}. Best is trial 205 with value: 0.890909090909091.
[32m[I 2023-04-20 23:03:24,237][39m Trial 288 finished with value: 0.8596491228070176 and parameters: {'objective': 'Logloss', 'colsample_bylevel': 0.09900532579644462, 'depth': 9, 'boosting_type': 'Plain', 'bootstrap_type': 'Bayesian', 'bagging_temperature': 0.521284617226419}. Best is trial 205 with value: 0.890909090909091.
[32m[I 2023-04-20 23:03:25,615][39m Trial 289 finished with value: 0.8807339449541284 and parameters: {'objective': 'Logloss', 'colsample_bylevel': 0.09146554410985001, 'depth': 9, 'boosting_type': 'Plain', 'bootstrap_type': 'Bayesian', 'bagging_temperature': 4.052080426675767}. Best is trial 205 with value: 0.890909090909091.
[32m[I 2023-04-20 23:03:26,645][39m Trial 290 finished with value: 0.8727272727272727 and parameters: {'objective': 'Logloss', 'colsample_bylevel': 0.09993047956219576, 'depth': 9, 'boosting_type': 'Plain', 'bootstrap_type': 'Bayesian', 'bagging_temperature': 3.833079022422405}. Best is trial 205 with value: 0.890909090909091.
[32m[I 2023-04-20 23:03:28,025][39m Trial 291 finished with value: 0.8727272727272727 and parameters: {'objective': 'Logloss', 'colsample_bylevel': 0.09710611769776387, 'depth': 9, 'boosting_type': 'Plain', 'bootstrap_type': 'Bayesian', 'bagging_temperature': 4.8178162932253334}. Best is trial 205 with value: 0.890909090909091.
[32m[I 2023-04-20 23:03:28,616][39m Trial 292 finished with value: 0.8623853211009175 and parameters: {'objective': 'Logloss', 'colsample_bylevel': 0.08038394994439808, 'depth': 10, 'boosting_type': 'Plain', 'bootstrap_type': 'Bayesian', 'bagging_temperature': 4.420078529223883}. Best is trial 205 with value: 0.890909090909091.
[32m[I 2023-04-20 23:03:29,759][39m Trial 293 finished with value: 0.8727272727272727 and parameters: {'objective': 'Logloss', 'colsample_bylevel': 0.09571755100837372, 'depth': 11, 'boosting_type': 'Plain', 'bootstrap_type': 'Bayesian', 'bagging_temperature': 3.7781874640113386}. Best is trial 205 with value: 0.890909090909091.
[32m[I 2023-04-20 23:03:30,388][39m Trial 294 finished with value: 0.8727272727272727 and parameters: {'objective': 'Logloss', 'colsample_bylevel': 0.09330428862506085, 'depth': 10, 'boosting_type': 'Plain', 'bootstrap_type': 'Bayesian', 'bagging_temperature': 4.521493877262203}. Best is trial 205 with value: 0.890909090909091.
[32m[I 2023-04-20 23:03:31,749][39m Trial 295 finished with value: 0.8571428571428572 and parameters: {'objective': 'Logloss', 'colsample_bylevel': 0.0963376269657642, 'depth': 9, 'boosting_type': 'Plain', 'bootstrap_type': 'MVS'}. Best is trial 205 with value: 0.890909090909091.
[32m[I 2023-04-20 23:03:32,514][39m Trial 296 finished with value: 0.8421052631578947 and parameters: {'objective': 'Logloss', 'colsample_bylevel': 0.07368399767335869, 'depth': 9, 'boosting_type': 'Plain', 'bootstrap_type': 'Bayesian', 'bagging_temperature': 4.151321463418088}. Best is trial 205 with value: 0.890909090909091.
[32m[I 2023-04-20 23:03:33,460][39m Trial 297 finished with value: 0.8727272727272727 and parameters: {'objective': 'Logloss', 'colsample_bylevel': 0.09854777065606611, 'depth': 6, 'boosting_type': 'Plain', 'bootstrap_type': 'Bayesian', 'bagging_temperature': 5.1352895574975665}. Best is trial 205 with value: 0.890909090909091.
[32m[I 2023-04-20 23:03:34,696][39m Trial 298 finished with value: 0.8421052631578947 and parameters: {'objective': 'Logloss', 'colsample_bylevel': 0.06795378192860464, 'depth': 7, 'boosting_type': 'Plain', 'bootstrap_type': 'Bayesian', 'bagging_temperature': 3.9173162635145804}. Best is trial 205 with value: 0.890909090909091.
[32m[I 2023-04-20 23:03:35,672][39m Trial 299 finished with value: 0.8807339449541284 and parameters: {'objective': 'Logloss', 'colsample_bylevel': 0.09843431590022649, 'depth': 7, 'boosting_type': 'Plain', 'bootstrap_type': 'Bayesian', 'bagging_temperature': 2.6310442200048105}. Best is trial 205 with value: 0.890909090909091.
[32m[I 2023-04-20 23:03:36,470][39m Trial 300 finished with value: 0.8727272727272727 and parameters: {'objective': 'Logloss', 'colsample_bylevel': 0.0976118571417552, 'depth': 9, 'boosting_type': 'Plain', 'bootstrap_type': 'Bayesian', 'bagging_temperature': 4.022405952484531}. Best is trial 205 with value: 0.890909090909091.
[32m[I 2023-04-20 23:03:37,647][39m Trial 301 finished with value: 0.8807339449541284 and parameters: {'objective': 'Logloss', 'colsample_bylevel': 0.09449732051124378, 'depth': 11, 'boosting_type': 'Plain', 'bootstrap_type': 'Bayesian', 'bagging_temperature': 4.380314658682167}. Best is trial 205 with value: 0.890909090909091.
[32m[I 2023-04-20 23:03:42,578][39m Trial 302 finished with value: 0.8421052631578947 and parameters: {'objective': 'Logloss', 'colsample_bylevel': 0.09291750066515146, 'depth': 12, 'boosting_type': 'Ordered', 'bootstrap_type': 'Bernoulli', 'subsample': 0.681711136961754}. Best is trial 205 with value: 0.890909090909091.
[32m[I 2023-04-20 23:03:43,779][39m Trial 303 finished with value: 0.8421052631578947 and parameters: {'objective': 'Logloss', 'colsample_bylevel': 0.08216871235484696, 'depth': 7, 'boosting_type': 'Plain', 'bootstrap_type': 'Bayesian', 'bagging_temperature': 3.2079933125854545}. Best is trial 205 with value: 0.890909090909091.
[32m[I 2023-04-20 23:03:44,482][39m Trial 304 finished with value: 0.8275862068965517 and parameters: {'objective': 'Logloss', 'colsample_bylevel': 0.07831551494769658, 'depth': 7, 'boosting_type': 'Plain', 'bootstrap_type': 'Bayesian', 'bagging_temperature': 4.150326797133824}. Best is trial 205 with value: 0.890909090909091.
[32m[I 2023-04-20 23:03:45,514][39m Trial 305 finished with value: 0.8596491228070176 and parameters: {'objective': 'Logloss', 'colsample_bylevel': 0.09562381449875496, 'depth': 10, 'boosting_type': 'Plain', 'bootstrap_type': 'Bayesian', 'bagging_temperature': 4.8528000257359505}. Best is trial 205 with value: 0.890909090909091.
[32m[I 2023-04-20 23:03:46,648][39m Trial 306 finished with value: 0.8807339449541284 and parameters: {'objective': 'Logloss', 'colsample_bylevel': 0.09806094313469893, 'depth': 9, 'boosting_type': 'Plain', 'bootstrap_type': 'Bayesian', 'bagging_temperature': 4.346344839403435}. Best is trial 205 with value: 0.890909090909091.
[32m[I 2023-04-20 23:03:47,744][39m Trial 307 finished with value: 0.8727272727272727 and parameters: {'objective': 'Logloss', 'colsample_bylevel': 0.09983240249599869, 'depth': 7, 'boosting_type': 'Plain', 'bootstrap_type': 'Bayesian', 'bagging_temperature': 2.937572437202944}. Best is trial 205 with value: 0.890909090909091.
[32m[I 2023-04-20 23:03:49,194][39m Trial 308 finished with value: 0.8421052631578947 and parameters: {'objective': 'Logloss', 'colsample_bylevel': 0.09104074825691438, 'depth': 9, 'boosting_type': 'Plain', 'bootstrap_type': 'Bayesian', 'bagging_temperature': 2.142420888854517}. Best is trial 205 with value: 0.890909090909091.
[32m[I 2023-04-20 23:03:49,810][39m Trial 309 finished with value: 0.8421052631578947 and parameters: {'objective': 'Logloss', 'colsample_bylevel': 0.08689220973397918, 'depth': 10, 'boosting_type': 'Plain', 'bootstrap_type': 'Bayesian', 'bagging_temperature': 3.9680092696372893}. Best is trial 205 with value: 0.890909090909091.
[32m[I 2023-04-20 23:03:50,780][39m Trial 310 finished with value: 0.875 and parameters: {'objective': 'Logloss', 'colsample_bylevel': 0.08945742407880235, 'depth': 10, 'boosting_type': 'Plain', 'bootstrap_type': 'Bayesian', 'bagging_temperature': 3.6479844878000844}. Best is trial 205 with value: 0.890909090909091.
[32m[I 2023-04-20 23:03:51,737][39m Trial 311 finished with value: 0.8807339449541284 and parameters: {'objective': 'Logloss', 'colsample_bylevel': 0.09813984260896469, 'depth': 7, 'boosting_type': 'Plain', 'bootstrap_type': 'Bayesian', 'bagging_temperature': 2.482739038296375}. Best is trial 205 with value: 0.890909090909091.
[32m[I 2023-04-20 23:03:52,459][39m Trial 312 finished with value: 0.8828828828828829 and parameters: {'objective': 'Logloss', 'colsample_bylevel': 0.09830981035156407, 'depth': 7, 'boosting_type': 'Plain', 'bootstrap_type': 'Bayesian', 'bagging_temperature': 2.7701189314412296}. Best is trial 205 with value: 0.890909090909091.
[32m[I 2023-04-20 23:03:53,329][39m Trial 313 finished with value: 0.8727272727272727 and parameters: {'objective': 'Logloss', 'colsample_bylevel': 0.09198844305204978, 'depth': 10, 'boosting_type': 'Plain', 'bootstrap_type': 'Bayesian', 'bagging_temperature': 3.5637744573641985}. Best is trial 205 with value: 0.890909090909091.
[32m[I 2023-04-20 23:03:54,351][39m Trial 314 finished with value: 0.8571428571428572 and parameters: {'objective': 'Logloss', 'colsample_bylevel': 0.09445884420879548, 'depth': 6, 'boosting_type': 'Plain', 'bootstrap_type': 'Bayesian', 'bagging_temperature': 5.003552270389992}. Best is trial 205 with value: 0.890909090909091.
[32m[I 2023-04-20 23:03:55,497][39m Trial 315 finished with value: 0.8807339449541284 and parameters: {'objective': 'Logloss', 'colsample_bylevel': 0.09608797778846358, 'depth': 8, 'boosting_type': 'Plain', 'bootstrap_type': 'Bayesian', 'bagging_temperature': 3.842453092394364}. Best is trial 205 with value: 0.890909090909091.
[32m[I 2023-04-20 23:03:56,178][39m Trial 316 finished with value: 0.8571428571428572 and parameters: {'objective': 'Logloss', 'colsample_bylevel': 0.09408118971546063, 'depth': 10, 'boosting_type': 'Plain', 'bootstrap_type': 'MVS'}. Best is trial 205 with value: 0.890909090909091.
[32m[I 2023-04-20 23:03:57,670][39m Trial 317 finished with value: 0.8828828828828829 and parameters: {'objective': 'Logloss', 'colsample_bylevel': 0.09608905264530117, 'depth': 8, 'boosting_type': 'Plain', 'bootstrap_type': 'Bayesian', 'bagging_temperature': 5.368955191548829}. Best is trial 205 with value: 0.890909090909091.
[32m[I 2023-04-20 23:03:58,543][39m Trial 318 finished with value: 0.8648648648648648 and parameters: {'objective': 'Logloss', 'colsample_bylevel': 0.0908807750106324, 'depth': 11, 'boosting_type': 'Plain', 'bootstrap_type': 'Bayesian', 'bagging_temperature': 5.795361582911551}. Best is trial 205 with value: 0.890909090909091.
[32m[I 2023-04-20 23:04:03,458][39m Trial 319 finished with value: 0.8421052631578947 and parameters: {'objective': 'Logloss', 'colsample_bylevel': 0.09409788289829926, 'depth': 9, 'boosting_type': 'Ordered', 'bootstrap_type': 'Bayesian', 'bagging_temperature': 5.344734155951675}. Best is trial 205 with value: 0.890909090909091.
[32m[I 2023-04-20 23:04:04,668][39m Trial 320 finished with value: 0.8623853211009175 and parameters: {'objective': 'Logloss', 'colsample_bylevel': 0.09774143849802097, 'depth': 7, 'boosting_type': 'Plain', 'bootstrap_type': 'Bayesian', 'bagging_temperature': 2.766895919238932}. Best is trial 205 with value: 0.890909090909091.
[32m[I 2023-04-20 23:04:05,651][39m Trial 321 finished with value: 0.8807339449541284 and parameters: {'objective': 'Logloss', 'colsample_bylevel': 0.09655275648458592, 'depth': 10, 'boosting_type': 'Plain', 'bootstrap_type': 'Bayesian', 'bagging_temperature': 5.509908143030128}. Best is trial 205 with value: 0.890909090909091.
[32m[I 2023-04-20 23:04:06,591][39m Trial 322 finished with value: 0.8807339449541284 and parameters: {'objective': 'Logloss', 'colsample_bylevel': 0.09468765394508842, 'depth': 10, 'boosting_type': 'Plain', 'bootstrap_type': 'Bayesian', 'bagging_temperature': 5.247615272027518}. Best is trial 205 with value: 0.890909090909091.
[32m[I 2023-04-20 23:04:07,766][39m Trial 323 finished with value: 0.8727272727272727 and parameters: {'objective': 'Logloss', 'colsample_bylevel': 0.09641726618616576, 'depth': 9, 'boosting_type': 'Plain', 'bootstrap_type': 'Bayesian', 'bagging_temperature': 3.475239321710502}. Best is trial 205 with value: 0.890909090909091.
[32m[I 2023-04-20 23:04:08,528][39m Trial 324 finished with value: 0.8495575221238938 and parameters: {'objective': 'Logloss', 'colsample_bylevel': 0.09329727426825331, 'depth': 6, 'boosting_type': 'Plain', 'bootstrap_type': 'Bayesian', 'bagging_temperature': 3.8296663704169243}. Best is trial 205 with value: 0.890909090909091.
[32m[I 2023-04-20 23:04:09,559][39m Trial 325 finished with value: 0.8468468468468469 and parameters: {'objective': 'Logloss', 'colsample_bylevel': 0.09793896088642873, 'depth': 7, 'boosting_type': 'Plain', 'bootstrap_type': 'Bayesian', 'bagging_temperature': 4.572433185921353}. Best is trial 205 with value: 0.890909090909091.
[32m[I 2023-04-20 23:04:10,465][39m Trial 326 finished with value: 0.8672566371681416 and parameters: {'objective': 'Logloss', 'colsample_bylevel': 0.09999990461983282, 'depth': 7, 'boosting_type': 'Plain', 'bootstrap_type': 'Bernoulli', 'subsample': 0.8260911505620318}. Best is trial 205 with value: 0.890909090909091.
[32m[I 2023-04-20 23:04:11,380][39m Trial 327 finished with value: 0.888888888888889 and parameters: {'objective': 'Logloss', 'colsample_bylevel': 0.09826267304166324, 'depth': 7, 'boosting_type': 'Plain', 'bootstrap_type': 'Bayesian', 'bagging_temperature': 5.7767163927188045}. Best is trial 205 with value: 0.890909090909091.
[32m[I 2023-04-20 23:04:12,674][39m Trial 328 finished with value: 0.8571428571428572 and parameters: {'objective': 'Logloss', 'colsample_bylevel': 0.0838084772318081, 'depth': 7, 'boosting_type': 'Plain', 'bootstrap_type': 'Bayesian', 'bagging_temperature': 5.868988463957043}. Best is trial 205 with value: 0.890909090909091.
[32m[I 2023-04-20 23:04:13,658][39m Trial 329 finished with value: 0.8828828828828829 and parameters: {'objective': 'Logloss', 'colsample_bylevel': 0.09555492570400356, 'depth': 8, 'boosting_type': 'Plain', 'bootstrap_type': 'Bayesian', 'bagging_temperature': 5.665225772161369}. Best is trial 205 with value: 0.890909090909091.
[32m[I 2023-04-20 23:04:14,813][39m Trial 330 finished with value: 0.890909090909091 and parameters: {'objective': 'Logloss', 'colsample_bylevel': 0.09863017617770753, 'depth': 8, 'boosting_type': 'Plain', 'bootstrap_type': 'Bayesian', 'bagging_temperature': 5.653654392452092}. Best is trial 205 with value: 0.890909090909091.
[32m[I 2023-04-20 23:04:16,233][39m Trial 331 finished with value: 0.8727272727272727 and parameters: {'objective': 'Logloss', 'colsample_bylevel': 0.09605436893852509, 'depth': 7, 'boosting_type': 'Plain', 'bootstrap_type': 'Bayesian', 'bagging_temperature': 5.671522854413017}. Best is trial 205 with value: 0.890909090909091.
[32m[I 2023-04-20 23:04:17,013][39m Trial 332 finished with value: 0.8623853211009175 and parameters: {'objective': 'Logloss', 'colsample_bylevel': 0.09540351144355466, 'depth': 7, 'boosting_type': 'Plain', 'bootstrap_type': 'Bayesian', 'bagging_temperature': 5.916456418790739}. Best is trial 205 with value: 0.890909090909091.
