[32m[I 2023-04-20 23:01:41,809][39m Trial 201 finished with value: 0.8807339449541284 and parameters: {'objective': 'Logloss', 'colsample_bylevel': 0.09165610400501849, 'depth': 10, 'boosting_type': 'Plain', 'bootstrap_type': 'Bayesian', 'bagging_temperature': 3.600642651707928}. Best is trial 121 with value: 0.888888888888889.
[32m[I 2023-04-20 23:01:42,515][39m Trial 202 finished with value: 0.8727272727272727 and parameters: {'objective': 'Logloss', 'colsample_bylevel': 0.0956661632186777, 'depth': 8, 'boosting_type': 'Plain', 'bootstrap_type': 'Bayesian', 'bagging_temperature': 3.3018059029021294}. Best is trial 121 with value: 0.888888888888889.
[32m[I 2023-04-20 23:01:43,741][39m Trial 203 finished with value: 0.8545454545454546 and parameters: {'objective': 'Logloss', 'colsample_bylevel': 0.09663304732284206, 'depth': 8, 'boosting_type': 'Plain', 'bootstrap_type': 'Bayesian', 'bagging_temperature': 3.1558124790004385}. Best is trial 121 with value: 0.888888888888889.
[32m[I 2023-04-20 23:01:45,349][39m Trial 204 finished with value: 0.8648648648648648 and parameters: {'objective': 'Logloss', 'colsample_bylevel': 0.09876924141951124, 'depth': 9, 'boosting_type': 'Plain', 'bootstrap_type': 'Bayesian', 'bagging_temperature': 3.499174022523936}. Best is trial 121 with value: 0.888888888888889.
[32m[I 2023-04-20 23:01:46,766][39m Trial 205 finished with value: 0.890909090909091 and parameters: {'objective': 'Logloss', 'colsample_bylevel': 0.09817968314866464, 'depth': 8, 'boosting_type': 'Plain', 'bootstrap_type': 'Bayesian', 'bagging_temperature': 4.307233677139509}. Best is trial 205 with value: 0.890909090909091.
[32m[I 2023-04-20 23:01:47,682][39m Trial 206 finished with value: 0.8571428571428572 and parameters: {'objective': 'Logloss', 'colsample_bylevel': 0.08955138622588962, 'depth': 9, 'boosting_type': 'Plain', 'bootstrap_type': 'MVS'}. Best is trial 205 with value: 0.890909090909091.
[32m[I 2023-04-20 23:01:48,321][39m Trial 207 finished with value: 0.8623853211009175 and parameters: {'objective': 'Logloss', 'colsample_bylevel': 0.08667036114838059, 'depth': 8, 'boosting_type': 'Plain', 'bootstrap_type': 'Bayesian', 'bagging_temperature': 5.028670406570463}. Best is trial 205 with value: 0.890909090909091.
[32m[I 2023-04-20 23:01:48,967][39m Trial 208 finished with value: 0.8807339449541284 and parameters: {'objective': 'Logloss', 'colsample_bylevel': 0.09374423857366475, 'depth': 7, 'boosting_type': 'Plain', 'bootstrap_type': 'Bayesian', 'bagging_temperature': 3.74011995300681}. Best is trial 205 with value: 0.890909090909091.
[32m[I 2023-04-20 23:01:49,714][39m Trial 209 finished with value: 0.8807339449541284 and parameters: {'objective': 'Logloss', 'colsample_bylevel': 0.09520500456207867, 'depth': 8, 'boosting_type': 'Plain', 'bootstrap_type': 'Bayesian', 'bagging_temperature': 4.449554074121294}. Best is trial 205 with value: 0.890909090909091.
[32m[I 2023-04-20 23:01:51,161][39m Trial 210 finished with value: 0.8807339449541284 and parameters: {'objective': 'Logloss', 'colsample_bylevel': 0.09746334641352102, 'depth': 11, 'boosting_type': 'Plain', 'bootstrap_type': 'Bayesian', 'bagging_temperature': 3.8822320889222026}. Best is trial 205 with value: 0.890909090909091.
[32m[I 2023-04-20 23:01:52,407][39m Trial 211 finished with value: 0.8727272727272727 and parameters: {'objective': 'Logloss', 'colsample_bylevel': 0.09484104969845558, 'depth': 8, 'boosting_type': 'Plain', 'bootstrap_type': 'Bayesian', 'bagging_temperature': 4.487224407365507}. Best is trial 205 with value: 0.890909090909091.
[32m[I 2023-04-20 23:01:53,289][39m Trial 212 finished with value: 0.8727272727272727 and parameters: {'objective': 'Logloss', 'colsample_bylevel': 0.09800045286720778, 'depth': 8, 'boosting_type': 'Plain', 'bootstrap_type': 'Bayesian', 'bagging_temperature': 2.704360944473224}. Best is trial 205 with value: 0.890909090909091.
[32m[I 2023-04-20 23:01:53,886][39m Trial 213 finished with value: 0.8545454545454546 and parameters: {'objective': 'Logloss', 'colsample_bylevel': 0.0976355716976709, 'depth': 8, 'boosting_type': 'Plain', 'bootstrap_type': 'Bayesian', 'bagging_temperature': 3.075811248717777}. Best is trial 205 with value: 0.890909090909091.
[32m[I 2023-04-20 23:01:55,247][39m Trial 214 finished with value: 0.8807339449541284 and parameters: {'objective': 'Logloss', 'colsample_bylevel': 0.09422093735462717, 'depth': 9, 'boosting_type': 'Plain', 'bootstrap_type': 'Bayesian', 'bagging_temperature': 3.389884766703302}. Best is trial 205 with value: 0.890909090909091.
[32m[I 2023-04-20 23:01:56,018][39m Trial 215 finished with value: 0.8807339449541284 and parameters: {'objective': 'Logloss', 'colsample_bylevel': 0.09300201821869214, 'depth': 9, 'boosting_type': 'Plain', 'bootstrap_type': 'Bayesian', 'bagging_temperature': 4.302732731260791}. Best is trial 205 with value: 0.890909090909091.
[32m[I 2023-04-20 23:01:56,988][39m Trial 216 finished with value: 0.8807339449541284 and parameters: {'objective': 'Logloss', 'colsample_bylevel': 0.09200351597264486, 'depth': 9, 'boosting_type': 'Plain', 'bootstrap_type': 'Bayesian', 'bagging_temperature': 4.065779624773252}. Best is trial 205 with value: 0.890909090909091.
[32m[I 2023-04-20 23:01:58,597][39m Trial 217 finished with value: 0.8623853211009175 and parameters: {'objective': 'Logloss', 'colsample_bylevel': 0.09123075381559555, 'depth': 8, 'boosting_type': 'Plain', 'bootstrap_type': 'Bayesian', 'bagging_temperature': 4.062528848689831}. Best is trial 205 with value: 0.890909090909091.
[32m[I 2023-04-20 23:01:59,760][39m Trial 218 finished with value: 0.8807339449541284 and parameters: {'objective': 'Logloss', 'colsample_bylevel': 0.09816091797776062, 'depth': 10, 'boosting_type': 'Plain', 'bootstrap_type': 'Bayesian', 'bagging_temperature': 4.621854731862817}. Best is trial 205 with value: 0.890909090909091.
[32m[I 2023-04-20 23:02:01,590][39m Trial 219 finished with value: 0.8648648648648648 and parameters: {'objective': 'Logloss', 'colsample_bylevel': 0.09793799431313364, 'depth': 8, 'boosting_type': 'Plain', 'bootstrap_type': 'Bernoulli', 'subsample': 0.4888515450512944}. Best is trial 205 with value: 0.890909090909091.
[32m[I 2023-04-20 23:02:02,536][39m Trial 220 finished with value: 0.8807339449541284 and parameters: {'objective': 'Logloss', 'colsample_bylevel': 0.09668364341228224, 'depth': 8, 'boosting_type': 'Plain', 'bootstrap_type': 'Bayesian', 'bagging_temperature': 3.3037062955144663}. Best is trial 205 with value: 0.890909090909091.
[32m[I 2023-04-20 23:02:03,241][39m Trial 221 finished with value: 0.8807339449541284 and parameters: {'objective': 'Logloss', 'colsample_bylevel': 0.09514028720899385, 'depth': 8, 'boosting_type': 'Plain', 'bootstrap_type': 'Bayesian', 'bagging_temperature': 3.666354701249172}. Best is trial 205 with value: 0.890909090909091.
[32m[I 2023-04-20 23:02:03,869][39m Trial 222 finished with value: 0.8828828828828829 and parameters: {'objective': 'Logloss', 'colsample_bylevel': 0.09216607169971841, 'depth': 10, 'boosting_type': 'Plain', 'bootstrap_type': 'Bayesian', 'bagging_temperature': 4.7359236864231935}. Best is trial 205 with value: 0.890909090909091.
[32m[I 2023-04-20 23:02:04,701][39m Trial 223 finished with value: 0.8807339449541284 and parameters: {'objective': 'Logloss', 'colsample_bylevel': 0.08801136031972737, 'depth': 10, 'boosting_type': 'Plain', 'bootstrap_type': 'Bayesian', 'bagging_temperature': 3.6453676864980245}. Best is trial 205 with value: 0.890909090909091.
[32m[I 2023-04-20 23:02:05,569][39m Trial 224 finished with value: 0.8648648648648648 and parameters: {'objective': 'Logloss', 'colsample_bylevel': 0.08848883111680764, 'depth': 10, 'boosting_type': 'Plain', 'bootstrap_type': 'Bayesian', 'bagging_temperature': 3.85281551644943}. Best is trial 205 with value: 0.890909090909091.
[32m[I 2023-04-20 23:02:06,581][39m Trial 225 finished with value: 0.8807339449541284 and parameters: {'objective': 'Logloss', 'colsample_bylevel': 0.09940928235356958, 'depth': 8, 'boosting_type': 'Plain', 'bootstrap_type': 'Bayesian', 'bagging_temperature': 4.36931340958086}. Best is trial 205 with value: 0.890909090909091.
[32m[I 2023-04-20 23:02:07,573][39m Trial 226 finished with value: 0.8648648648648648 and parameters: {'objective': 'Logloss', 'colsample_bylevel': 0.09524077990410523, 'depth': 10, 'boosting_type': 'Plain', 'bootstrap_type': 'Bayesian', 'bagging_temperature': 5.552123337088988}. Best is trial 205 with value: 0.890909090909091.
[32m[I 2023-04-20 23:02:08,813][39m Trial 227 finished with value: 0.8727272727272727 and parameters: {'objective': 'Logloss', 'colsample_bylevel': 0.09820157335382067, 'depth': 8, 'boosting_type': 'Plain', 'bootstrap_type': 'Bayesian', 'bagging_temperature': 4.692334091451017}. Best is trial 205 with value: 0.890909090909091.
[32m[I 2023-04-20 23:02:09,656][39m Trial 228 finished with value: 0.8727272727272727 and parameters: {'objective': 'Logloss', 'colsample_bylevel': 0.0936295412386589, 'depth': 9, 'boosting_type': 'Plain', 'bootstrap_type': 'Bayesian', 'bagging_temperature': 3.435376705466504}. Best is trial 205 with value: 0.890909090909091.
[32m[I 2023-04-20 23:02:14,659][39m Trial 229 finished with value: 0.8468468468468469 and parameters: {'objective': 'Logloss', 'colsample_bylevel': 0.09981635825275939, 'depth': 9, 'boosting_type': 'Ordered', 'bootstrap_type': 'Bayesian', 'bagging_temperature': 4.184612144741394}. Best is trial 205 with value: 0.890909090909091.
[32m[I 2023-04-20 23:02:15,726][39m Trial 230 finished with value: 0.8727272727272727 and parameters: {'objective': 'Logloss', 'colsample_bylevel': 0.09685283417040079, 'depth': 10, 'boosting_type': 'Plain', 'bootstrap_type': 'Bayesian', 'bagging_temperature': 4.219312734315323}. Best is trial 205 with value: 0.890909090909091.
[32m[I 2023-04-20 23:02:17,075][39m Trial 231 finished with value: 0.8571428571428572 and parameters: {'objective': 'Logloss', 'colsample_bylevel': 0.09862608797405016, 'depth': 8, 'boosting_type': 'Plain', 'bootstrap_type': 'Bayesian', 'bagging_temperature': 4.120720621344883}. Best is trial 205 with value: 0.890909090909091.
[32m[I 2023-04-20 23:02:17,925][39m Trial 232 finished with value: 0.8807339449541284 and parameters: {'objective': 'Logloss', 'colsample_bylevel': 0.09634075264377605, 'depth': 9, 'boosting_type': 'Plain', 'bootstrap_type': 'Bayesian', 'bagging_temperature': 4.340542587974481}. Best is trial 205 with value: 0.890909090909091.
[32m[I 2023-04-20 23:02:18,920][39m Trial 233 finished with value: 0.8727272727272727 and parameters: {'objective': 'Logloss', 'colsample_bylevel': 0.09027411530664105, 'depth': 8, 'boosting_type': 'Plain', 'bootstrap_type': 'Bayesian', 'bagging_temperature': 2.9368813300085757}. Best is trial 205 with value: 0.890909090909091.
[32m[I 2023-04-20 23:02:20,504][39m Trial 234 finished with value: 0.8648648648648648 and parameters: {'objective': 'Logloss', 'colsample_bylevel': 0.09298871612207682, 'depth': 9, 'boosting_type': 'Plain', 'bootstrap_type': 'Bayesian', 'bagging_temperature': 3.234520523991983}. Best is trial 205 with value: 0.890909090909091.
[32m[I 2023-04-20 23:02:21,305][39m Trial 235 finished with value: 0.8807339449541284 and parameters: {'objective': 'Logloss', 'colsample_bylevel': 0.09662067006436956, 'depth': 8, 'boosting_type': 'Plain', 'bootstrap_type': 'Bayesian', 'bagging_temperature': 3.977742088206522}. Best is trial 205 with value: 0.890909090909091.
[32m[I 2023-04-20 23:02:22,651][39m Trial 236 finished with value: 0.8495575221238938 and parameters: {'objective': 'Logloss', 'colsample_bylevel': 0.0896510622606264, 'depth': 9, 'boosting_type': 'Plain', 'bootstrap_type': 'Bayesian', 'bagging_temperature': 3.7571351686671863}. Best is trial 205 with value: 0.890909090909091.
[32m[I 2023-04-20 23:02:23,484][39m Trial 237 finished with value: 0.875 and parameters: {'objective': 'Logloss', 'colsample_bylevel': 0.09390129614785192, 'depth': 9, 'boosting_type': 'Plain', 'bootstrap_type': 'Bayesian', 'bagging_temperature': 3.9431848716145734}. Best is trial 205 with value: 0.890909090909091.
[32m[I 2023-04-20 23:02:24,052][39m Trial 238 finished with value: 0.8672566371681416 and parameters: {'objective': 'Logloss', 'colsample_bylevel': 0.09682231616044328, 'depth': 10, 'boosting_type': 'Plain', 'bootstrap_type': 'Bayesian', 'bagging_temperature': 3.5064193515847317}. Best is trial 205 with value: 0.890909090909091.
[32m[I 2023-04-20 23:02:25,113][39m Trial 239 finished with value: 0.8623853211009175 and parameters: {'objective': 'Logloss', 'colsample_bylevel': 0.09966907477815516, 'depth': 8, 'boosting_type': 'Plain', 'bootstrap_type': 'Bayesian', 'bagging_temperature': 4.009421864388656}. Best is trial 205 with value: 0.890909090909091.
[32m[I 2023-04-20 23:02:26,685][39m Trial 240 finished with value: 0.8807339449541284 and parameters: {'objective': 'Logloss', 'colsample_bylevel': 0.09711137792243424, 'depth': 9, 'boosting_type': 'Plain', 'bootstrap_type': 'Bayesian', 'bagging_temperature': 4.2445241801627525}. Best is trial 205 with value: 0.890909090909091.
[32m[I 2023-04-20 23:02:27,327][39m Trial 241 finished with value: 0.8571428571428572 and parameters: {'objective': 'Logloss', 'colsample_bylevel': 0.0982031407349267, 'depth': 11, 'boosting_type': 'Plain', 'bootstrap_type': 'Bayesian', 'bagging_temperature': 4.517255435040344}. Best is trial 205 with value: 0.890909090909091.
[32m[I 2023-04-20 23:02:28,514][39m Trial 242 finished with value: 0.8807339449541284 and parameters: {'objective': 'Logloss', 'colsample_bylevel': 0.09183560883224914, 'depth': 8, 'boosting_type': 'Plain', 'bootstrap_type': 'Bayesian', 'bagging_temperature': 3.7476544500265767}. Best is trial 205 with value: 0.890909090909091.
[32m[I 2023-04-20 23:02:29,229][39m Trial 243 finished with value: 0.8623853211009175 and parameters: {'objective': 'Logloss', 'colsample_bylevel': 0.09588219706915455, 'depth': 8, 'boosting_type': 'Plain', 'bootstrap_type': 'Bayesian', 'bagging_temperature': 3.6607492022216004}. Best is trial 205 with value: 0.890909090909091.
[32m[I 2023-04-20 23:02:30,909][39m Trial 244 finished with value: 0.875 and parameters: {'objective': 'Logloss', 'colsample_bylevel': 0.09386087011534798, 'depth': 9, 'boosting_type': 'Plain', 'bootstrap_type': 'Bayesian', 'bagging_temperature': 3.4911464607426845}. Best is trial 205 with value: 0.890909090909091.
[32m[I 2023-04-20 23:02:31,942][39m Trial 245 finished with value: 0.8468468468468469 and parameters: {'objective': 'Logloss', 'colsample_bylevel': 0.07084840943761611, 'depth': 7, 'boosting_type': 'Plain', 'bootstrap_type': 'Bayesian', 'bagging_temperature': 4.316141509592676}. Best is trial 205 with value: 0.890909090909091.
[32m[I 2023-04-20 23:02:32,581][39m Trial 246 finished with value: 0.8623853211009175 and parameters: {'objective': 'Logloss', 'colsample_bylevel': 0.09471434126128438, 'depth': 11, 'boosting_type': 'Plain', 'bootstrap_type': 'Bayesian', 'bagging_temperature': 5.081780083072203}. Best is trial 205 with value: 0.890909090909091.
[32m[I 2023-04-20 23:02:34,013][39m Trial 247 finished with value: 0.8596491228070176 and parameters: {'objective': 'Logloss', 'colsample_bylevel': 0.09144570963465991, 'depth': 9, 'boosting_type': 'Plain', 'bootstrap_type': 'MVS'}. Best is trial 205 with value: 0.890909090909091.
[32m[I 2023-04-20 23:02:35,186][39m Trial 248 finished with value: 0.8807339449541284 and parameters: {'objective': 'Logloss', 'colsample_bylevel': 0.09213550530825979, 'depth': 9, 'boosting_type': 'Plain', 'bootstrap_type': 'Bayesian', 'bagging_temperature': 3.624034979645524}. Best is trial 205 with value: 0.890909090909091.
[32m[I 2023-04-20 23:02:36,157][39m Trial 249 finished with value: 0.8727272727272727 and parameters: {'objective': 'Logloss', 'colsample_bylevel': 0.09972466620823132, 'depth': 8, 'boosting_type': 'Plain', 'bootstrap_type': 'Bayesian', 'bagging_temperature': 3.8627481924856952}. Best is trial 205 with value: 0.890909090909091.
[32m[I 2023-04-20 23:02:37,544][39m Trial 250 finished with value: 0.8727272727272727 and parameters: {'objective': 'Logloss', 'colsample_bylevel': 0.09983577676664562, 'depth': 8, 'boosting_type': 'Plain', 'bootstrap_type': 'Bayesian', 'bagging_temperature': 4.009627491648205}. Best is trial 205 with value: 0.890909090909091.
[32m[I 2023-04-20 23:02:38,422][39m Trial 251 finished with value: 0.8807339449541284 and parameters: {'objective': 'Logloss', 'colsample_bylevel': 0.09716492471907122, 'depth': 8, 'boosting_type': 'Plain', 'bootstrap_type': 'Bayesian', 'bagging_temperature': 4.764057602239317}. Best is trial 205 with value: 0.890909090909091.
[32m[I 2023-04-20 23:02:39,689][39m Trial 252 finished with value: 0.8623853211009175 and parameters: {'objective': 'Logloss', 'colsample_bylevel': 0.09220143495952043, 'depth': 8, 'boosting_type': 'Plain', 'bootstrap_type': 'Bayesian', 'bagging_temperature': 3.7374036646159725}. Best is trial 205 with value: 0.890909090909091.
[32m[I 2023-04-20 23:02:40,407][39m Trial 253 finished with value: 0.8623853211009175 and parameters: {'objective': 'Logloss', 'colsample_bylevel': 0.09605002940287646, 'depth': 7, 'boosting_type': 'Plain', 'bootstrap_type': 'Bayesian', 'bagging_temperature': 4.239122797737047}. Best is trial 205 with value: 0.890909090909091.
[32m[I 2023-04-20 23:02:41,147][39m Trial 254 finished with value: 0.8648648648648648 and parameters: {'objective': 'Logloss', 'colsample_bylevel': 0.09727268049643834, 'depth': 11, 'boosting_type': 'Plain', 'bootstrap_type': 'Bayesian', 'bagging_temperature': 4.626971498211563}. Best is trial 205 with value: 0.890909090909091.
[32m[I 2023-04-20 23:02:42,194][39m Trial 255 finished with value: 0.8623853211009175 and parameters: {'objective': 'Logloss', 'colsample_bylevel': 0.0951795718019679, 'depth': 10, 'boosting_type': 'Plain', 'bootstrap_type': 'Bayesian', 'bagging_temperature': 3.1698904072649934}. Best is trial 205 with value: 0.890909090909091.
[32m[I 2023-04-20 23:02:43,382][39m Trial 256 finished with value: 0.8545454545454546 and parameters: {'objective': 'Logloss', 'colsample_bylevel': 0.09602726136136555, 'depth': 10, 'boosting_type': 'Plain', 'bootstrap_type': 'Bernoulli', 'subsample': 0.22214622903759385}. Best is trial 205 with value: 0.890909090909091.
[32m[I 2023-04-20 23:02:44,548][39m Trial 257 finished with value: 0.8807339449541284 and parameters: {'objective': 'Logloss', 'colsample_bylevel': 0.09393690145341255, 'depth': 9, 'boosting_type': 'Plain', 'bootstrap_type': 'Bayesian', 'bagging_temperature': 4.34127456629244}. Best is trial 205 with value: 0.890909090909091.
[32m[I 2023-04-20 23:02:49,313][39m Trial 258 finished with value: 0.8347826086956522 and parameters: {'objective': 'Logloss', 'colsample_bylevel': 0.08594208510300688, 'depth': 8, 'boosting_type': 'Ordered', 'bootstrap_type': 'Bayesian', 'bagging_temperature': 2.5845038379503618}. Best is trial 205 with value: 0.890909090909091.
[32m[I 2023-04-20 23:02:50,484][39m Trial 259 finished with value: 0.8727272727272727 and parameters: {'objective': 'Logloss', 'colsample_bylevel': 0.09344748732856717, 'depth': 10, 'boosting_type': 'Plain', 'bootstrap_type': 'Bayesian', 'bagging_temperature': 4.439508391397089}. Best is trial 205 with value: 0.890909090909091.
[32m[I 2023-04-20 23:02:51,659][39m Trial 260 finished with value: 0.8099173553719008 and parameters: {'objective': 'Logloss', 'colsample_bylevel': 0.024123103596790346, 'depth': 8, 'boosting_type': 'Plain', 'bootstrap_type': 'Bayesian', 'bagging_temperature': 3.380985940433038}. Best is trial 205 with value: 0.890909090909091.
[32m[I 2023-04-20 23:02:52,522][39m Trial 261 finished with value: 0.8807339449541284 and parameters: {'objective': 'Logloss', 'colsample_bylevel': 0.09801679307793881, 'depth': 8, 'boosting_type': 'Plain', 'bootstrap_type': 'Bayesian', 'bagging_temperature': 3.8865600273011043}. Best is trial 205 with value: 0.890909090909091.
[32m[I 2023-04-20 23:02:53,718][39m Trial 262 finished with value: 0.875 and parameters: {'objective': 'Logloss', 'colsample_bylevel': 0.08996937026434505, 'depth': 8, 'boosting_type': 'Plain', 'bootstrap_type': 'Bayesian', 'bagging_temperature': 3.3852697837037824}. Best is trial 205 with value: 0.890909090909091.
[32m[I 2023-04-20 23:02:54,736][39m Trial 263 finished with value: 0.8807339449541284 and parameters: {'objective': 'Logloss', 'colsample_bylevel': 0.09859563919346395, 'depth': 8, 'boosting_type': 'Plain', 'bootstrap_type': 'Bayesian', 'bagging_temperature': 3.159598198511774}. Best is trial 205 with value: 0.890909090909091.
[32m[I 2023-04-20 23:02:55,388][39m Trial 264 finished with value: 0.8807339449541284 and parameters: {'objective': 'Logloss', 'colsample_bylevel': 0.09811227560344064, 'depth': 7, 'boosting_type': 'Plain', 'bootstrap_type': 'Bayesian', 'bagging_temperature': 2.80576468886862}. Best is trial 205 with value: 0.890909090909091.
[32m[I 2023-04-20 23:02:56,314][39m Trial 265 finished with value: 0.888888888888889 and parameters: {'objective': 'Logloss', 'colsample_bylevel': 0.09861071820434573, 'depth': 7, 'boosting_type': 'Plain', 'bootstrap_type': 'Bayesian', 'bagging_temperature': 2.744403770480024}. Best is trial 205 with value: 0.890909090909091.
[32m[I 2023-04-20 23:02:57,147][39m Trial 266 finished with value: 0.8727272727272727 and parameters: {'objective': 'Logloss', 'colsample_bylevel': 0.09985840622761186, 'depth': 7, 'boosting_type': 'Plain', 'bootstrap_type': 'Bayesian', 'bagging_temperature': 2.374193460074357}. Best is trial 205 with value: 0.890909090909091.
