[32m[I 2023-04-21 00:44:47,132][39m Trial 4936 finished with value: 0.8672566371681416 and parameters: {'objective': 'CrossEntropy', 'colsample_bylevel': 0.08456980695885984, 'depth': 12, 'boosting_type': 'Plain', 'bootstrap_type': 'MVS'}. Best is trial 1464 with value: 0.8990825688073395.
[32m[I 2023-04-21 00:44:48,572][39m Trial 4937 finished with value: 0.8727272727272727 and parameters: {'objective': 'Logloss', 'colsample_bylevel': 0.09721742898763396, 'depth': 12, 'boosting_type': 'Plain', 'bootstrap_type': 'Bayesian', 'bagging_temperature': 5.935199790487598}. Best is trial 1464 with value: 0.8990825688073395.
[32m[I 2023-04-21 00:44:49,863][39m Trial 4938 finished with value: 0.8828828828828829 and parameters: {'objective': 'Logloss', 'colsample_bylevel': 0.09533344848350075, 'depth': 7, 'boosting_type': 'Plain', 'bootstrap_type': 'Bayesian', 'bagging_temperature': 5.689166875287556}. Best is trial 1464 with value: 0.8990825688073395.
[32m[I 2023-04-21 00:44:50,653][39m Trial 4939 finished with value: 0.8623853211009175 and parameters: {'objective': 'CrossEntropy', 'colsample_bylevel': 0.09648217265083564, 'depth': 12, 'boosting_type': 'Plain', 'bootstrap_type': 'Bayesian', 'bagging_temperature': 7.105688516623653}. Best is trial 1464 with value: 0.8990825688073395.
[32m[I 2023-04-21 00:44:52,149][39m Trial 4940 finished with value: 0.8807339449541284 and parameters: {'objective': 'Logloss', 'colsample_bylevel': 0.09508700566911919, 'depth': 9, 'boosting_type': 'Plain', 'bootstrap_type': 'Bayesian', 'bagging_temperature': 6.718264964754983}. Best is trial 1464 with value: 0.8990825688073395.
[32m[I 2023-04-21 00:44:53,273][39m Trial 4941 finished with value: 0.8648648648648648 and parameters: {'objective': 'Logloss', 'colsample_bylevel': 0.08590068591744415, 'depth': 12, 'boosting_type': 'Plain', 'bootstrap_type': 'Bayesian', 'bagging_temperature': 5.443848885929012}. Best is trial 1464 with value: 0.8990825688073395.
[32m[I 2023-04-21 00:44:54,050][39m Trial 4942 finished with value: 0.8807339449541284 and parameters: {'objective': 'Logloss', 'colsample_bylevel': 0.09315089059248963, 'depth': 10, 'boosting_type': 'Plain', 'bootstrap_type': 'Bayesian', 'bagging_temperature': 6.163878672365641}. Best is trial 1464 with value: 0.8990825688073395.
[32m[I 2023-04-21 00:44:54,822][39m Trial 4943 finished with value: 0.8807339449541284 and parameters: {'objective': 'CrossEntropy', 'colsample_bylevel': 0.08937837295597544, 'depth': 12, 'boosting_type': 'Plain', 'bootstrap_type': 'Bayesian', 'bagging_temperature': 5.086818372994356}. Best is trial 1464 with value: 0.8990825688073395.
[32m[I 2023-04-21 00:44:56,012][39m Trial 4944 finished with value: 0.8807339449541284 and parameters: {'objective': 'CrossEntropy', 'colsample_bylevel': 0.0880674669229677, 'depth': 12, 'boosting_type': 'Plain', 'bootstrap_type': 'Bayesian', 'bagging_temperature': 5.1796623121480865}. Best is trial 1464 with value: 0.8990825688073395.
[32m[I 2023-04-21 00:44:57,151][39m Trial 4945 finished with value: 0.8596491228070176 and parameters: {'objective': 'Logloss', 'colsample_bylevel': 0.08818482824498497, 'depth': 12, 'boosting_type': 'Plain', 'bootstrap_type': 'Bayesian', 'bagging_temperature': 5.423182765076295}. Best is trial 1464 with value: 0.8990825688073395.
[32m[I 2023-04-21 00:44:58,206][39m Trial 4946 finished with value: 0.8305084745762712 and parameters: {'objective': 'Logloss', 'colsample_bylevel': 0.03108509117645112, 'depth': 8, 'boosting_type': 'Plain', 'bootstrap_type': 'Bayesian', 'bagging_temperature': 5.252981301176598}. Best is trial 1464 with value: 0.8990825688073395.
[32m[I 2023-04-21 00:44:59,494][39m Trial 4947 finished with value: 0.8727272727272727 and parameters: {'objective': 'CrossEntropy', 'colsample_bylevel': 0.09202010688814569, 'depth': 9, 'boosting_type': 'Plain', 'bootstrap_type': 'Bayesian', 'bagging_temperature': 5.532641043311169}. Best is trial 1464 with value: 0.8990825688073395.
[32m[I 2023-04-21 00:45:00,044][39m Trial 4948 finished with value: 0.8495575221238938 and parameters: {'objective': 'CrossEntropy', 'colsample_bylevel': 0.08886244464129944, 'depth': 12, 'boosting_type': 'Plain', 'bootstrap_type': 'Bayesian', 'bagging_temperature': 1.2924336490203103}. Best is trial 1464 with value: 0.8990825688073395.
[32m[I 2023-04-21 00:45:01,222][39m Trial 4949 finished with value: 0.8727272727272727 and parameters: {'objective': 'CrossEntropy', 'colsample_bylevel': 0.08896114101504393, 'depth': 12, 'boosting_type': 'Plain', 'bootstrap_type': 'Bayesian', 'bagging_temperature': 4.441516152164885}. Best is trial 1464 with value: 0.8990825688073395.
[32m[I 2023-04-21 00:45:03,196][39m Trial 4950 finished with value: 0.8727272727272727 and parameters: {'objective': 'Logloss', 'colsample_bylevel': 0.09264979727942875, 'depth': 8, 'boosting_type': 'Plain', 'bootstrap_type': 'Bayesian', 'bagging_temperature': 5.189191825980206}. Best is trial 1464 with value: 0.8990825688073395.
[32m[I 2023-04-21 00:45:04,158][39m Trial 4951 finished with value: 0.8571428571428572 and parameters: {'objective': 'CrossEntropy', 'colsample_bylevel': 0.09982321211145646, 'depth': 6, 'boosting_type': 'Plain', 'bootstrap_type': 'Bayesian', 'bagging_temperature': 6.325303373423989}. Best is trial 1464 with value: 0.8990825688073395.
[32m[I 2023-04-21 00:45:05,690][39m Trial 4952 finished with value: 0.875 and parameters: {'objective': 'Logloss', 'colsample_bylevel': 0.09098829283269884, 'depth': 9, 'boosting_type': 'Plain', 'bootstrap_type': 'Bayesian', 'bagging_temperature': 5.447360547359599}. Best is trial 1464 with value: 0.8990825688073395.
[32m[I 2023-04-21 00:45:10,130][39m Trial 4953 finished with value: 0.8468468468468469 and parameters: {'objective': 'Logloss', 'colsample_bylevel': 0.09192157197456509, 'depth': 11, 'boosting_type': 'Ordered', 'bootstrap_type': 'Bayesian', 'bagging_temperature': 5.580790289584107}. Best is trial 1464 with value: 0.8990825688073395.
[32m[I 2023-04-21 00:45:11,189][39m Trial 4954 finished with value: 0.8785046728971961 and parameters: {'objective': 'Logloss', 'colsample_bylevel': 0.08981733672691344, 'depth': 6, 'boosting_type': 'Plain', 'bootstrap_type': 'Bayesian', 'bagging_temperature': 5.373668629056976}. Best is trial 1464 with value: 0.8990825688073395.
[32m[I 2023-04-21 00:45:12,299][39m Trial 4955 finished with value: 0.875 and parameters: {'objective': 'Logloss', 'colsample_bylevel': 0.09713577361634472, 'depth': 12, 'boosting_type': 'Plain', 'bootstrap_type': 'Bayesian', 'bagging_temperature': 4.641694099302873}. Best is trial 1464 with value: 0.8990825688073395.
[32m[I 2023-04-21 00:45:13,856][39m Trial 4956 finished with value: 0.8571428571428572 and parameters: {'objective': 'Logloss', 'colsample_bylevel': 0.09194407047704109, 'depth': 8, 'boosting_type': 'Plain', 'bootstrap_type': 'Bernoulli', 'subsample': 0.5914782395954581}. Best is trial 1464 with value: 0.8990825688073395.
[32m[I 2023-04-21 00:45:15,042][39m Trial 4957 finished with value: 0.875 and parameters: {'objective': 'Logloss', 'colsample_bylevel': 0.0861850678216141, 'depth': 12, 'boosting_type': 'Plain', 'bootstrap_type': 'Bayesian', 'bagging_temperature': 6.795175301575952}. Best is trial 1464 with value: 0.8990825688073395.
[32m[I 2023-04-21 00:45:16,440][39m Trial 4958 finished with value: 0.8275862068965517 and parameters: {'objective': 'Logloss', 'colsample_bylevel': 0.06588950497881245, 'depth': 9, 'boosting_type': 'Plain', 'bootstrap_type': 'MVS'}. Best is trial 1464 with value: 0.8990825688073395.
[32m[I 2023-04-21 00:45:17,675][39m Trial 4959 finished with value: 0.8807339449541284 and parameters: {'objective': 'CrossEntropy', 'colsample_bylevel': 0.08988187650011098, 'depth': 12, 'boosting_type': 'Plain', 'bootstrap_type': 'Bayesian', 'bagging_temperature': 4.721571161950844}. Best is trial 1464 with value: 0.8990825688073395.
[32m[I 2023-04-21 00:45:18,769][39m Trial 4960 finished with value: 0.8727272727272727 and parameters: {'objective': 'Logloss', 'colsample_bylevel': 0.09000408612449559, 'depth': 8, 'boosting_type': 'Plain', 'bootstrap_type': 'Bayesian', 'bagging_temperature': 5.370179513200961}. Best is trial 1464 with value: 0.8990825688073395.
[32m[I 2023-04-21 00:45:19,898][39m Trial 4961 finished with value: 0.888888888888889 and parameters: {'objective': 'Logloss', 'colsample_bylevel': 0.09676916674878268, 'depth': 7, 'boosting_type': 'Plain', 'bootstrap_type': 'Bayesian', 'bagging_temperature': 6.160330905544991}. Best is trial 1464 with value: 0.8990825688073395.
[32m[I 2023-04-21 00:45:21,501][39m Trial 4962 finished with value: 0.8807339449541284 and parameters: {'objective': 'CrossEntropy', 'colsample_bylevel': 0.09188320270909636, 'depth': 9, 'boosting_type': 'Plain', 'bootstrap_type': 'Bayesian', 'bagging_temperature': 5.3397425252428}. Best is trial 1464 with value: 0.8990825688073395.
[32m[I 2023-04-21 00:45:22,258][39m Trial 4963 finished with value: 0.8727272727272727 and parameters: {'objective': 'Logloss', 'colsample_bylevel': 0.0901801493696012, 'depth': 11, 'boosting_type': 'Plain', 'bootstrap_type': 'Bayesian', 'bagging_temperature': 3.8421412118102984}. Best is trial 1464 with value: 0.8990825688073395.
[32m[I 2023-04-21 00:45:23,018][39m Trial 4964 finished with value: 0.8648648648648648 and parameters: {'objective': 'Logloss', 'colsample_bylevel': 0.09803064406148813, 'depth': 11, 'boosting_type': 'Plain', 'bootstrap_type': 'Bayesian', 'bagging_temperature': 5.800612807813983}. Best is trial 1464 with value: 0.8990825688073395.
[32m[I 2023-04-21 00:45:24,198][39m Trial 4965 finished with value: 0.8828828828828829 and parameters: {'objective': 'Logloss', 'colsample_bylevel': 0.09986174529390268, 'depth': 9, 'boosting_type': 'Plain', 'bootstrap_type': 'Bayesian', 'bagging_temperature': 5.7831958037991456}. Best is trial 1464 with value: 0.8990825688073395.
[32m[I 2023-04-21 00:45:25,800][39m Trial 4966 finished with value: 0.8727272727272727 and parameters: {'objective': 'Logloss', 'colsample_bylevel': 0.09765486353045351, 'depth': 9, 'boosting_type': 'Plain', 'bootstrap_type': 'Bayesian', 'bagging_temperature': 4.949621346700358}. Best is trial 1464 with value: 0.8990825688073395.
[32m[I 2023-04-21 00:45:27,062][39m Trial 4967 finished with value: 0.8727272727272727 and parameters: {'objective': 'CrossEntropy', 'colsample_bylevel': 0.08926454476660456, 'depth': 12, 'boosting_type': 'Plain', 'bootstrap_type': 'Bayesian', 'bagging_temperature': 4.262011956792737}. Best is trial 1464 with value: 0.8990825688073395.
[32m[I 2023-04-21 00:45:28,286][39m Trial 4968 finished with value: 0.8703703703703703 and parameters: {'objective': 'Logloss', 'colsample_bylevel': 0.09885472541868645, 'depth': 9, 'boosting_type': 'Plain', 'bootstrap_type': 'Bayesian', 'bagging_temperature': 5.05420380668666}. Best is trial 1464 with value: 0.8990825688073395.
[32m[I 2023-04-21 00:45:29,323][39m Trial 4969 finished with value: 0.8305084745762712 and parameters: {'objective': 'CrossEntropy', 'colsample_bylevel': 0.09096745913622603, 'depth': 1, 'boosting_type': 'Plain', 'bootstrap_type': 'Bayesian', 'bagging_temperature': 5.458547044365916}. Best is trial 1464 with value: 0.8990825688073395.
[32m[I 2023-04-21 00:45:30,474][39m Trial 4970 finished with value: 0.8807339449541284 and parameters: {'objective': 'CrossEntropy', 'colsample_bylevel': 0.08748118652083765, 'depth': 12, 'boosting_type': 'Plain', 'bootstrap_type': 'Bayesian', 'bagging_temperature': 4.596857297592018}. Best is trial 1464 with value: 0.8990825688073395.
[32m[I 2023-04-21 00:45:35,633][39m Trial 4971 finished with value: 0.8495575221238938 and parameters: {'objective': 'CrossEntropy', 'colsample_bylevel': 0.0893119424735837, 'depth': 9, 'boosting_type': 'Ordered', 'bootstrap_type': 'Bayesian', 'bagging_temperature': 5.182851421868147}. Best is trial 1464 with value: 0.8990825688073395.
[32m[I 2023-04-21 00:45:36,808][39m Trial 4972 finished with value: 0.8807339449541284 and parameters: {'objective': 'Logloss', 'colsample_bylevel': 0.09998781160003256, 'depth': 12, 'boosting_type': 'Plain', 'bootstrap_type': 'Bayesian', 'bagging_temperature': 3.9130056403399247}. Best is trial 1464 with value: 0.8990825688073395.
[32m[I 2023-04-21 00:45:37,948][39m Trial 4973 finished with value: 0.8727272727272727 and parameters: {'objective': 'CrossEntropy', 'colsample_bylevel': 0.0901847621197203, 'depth': 12, 'boosting_type': 'Plain', 'bootstrap_type': 'Bayesian', 'bagging_temperature': 5.520171746479123}. Best is trial 1464 with value: 0.8990825688073395.
[32m[I 2023-04-21 00:45:39,355][39m Trial 4974 finished with value: 0.8807339449541284 and parameters: {'objective': 'CrossEntropy', 'colsample_bylevel': 0.09230475653736374, 'depth': 10, 'boosting_type': 'Plain', 'bootstrap_type': 'Bayesian', 'bagging_temperature': 5.7375287021229955}. Best is trial 1464 with value: 0.8990825688073395.
[32m[I 2023-04-21 00:45:40,332][39m Trial 4975 finished with value: 0.8623853211009175 and parameters: {'objective': 'CrossEntropy', 'colsample_bylevel': 0.09395589664101905, 'depth': 6, 'boosting_type': 'Plain', 'bootstrap_type': 'Bayesian', 'bagging_temperature': 3.6919872089047816}. Best is trial 1464 with value: 0.8990825688073395.
[32m[I 2023-04-21 00:45:41,437][39m Trial 4976 finished with value: 0.875 and parameters: {'objective': 'CrossEntropy', 'colsample_bylevel': 0.08836846409001968, 'depth': 12, 'boosting_type': 'Plain', 'bootstrap_type': 'Bayesian', 'bagging_temperature': 4.566768171945151}. Best is trial 1464 with value: 0.8990825688073395.
[32m[I 2023-04-21 00:45:42,365][39m Trial 4977 finished with value: 0.8648648648648648 and parameters: {'objective': 'CrossEntropy', 'colsample_bylevel': 0.09309896759000286, 'depth': 10, 'boosting_type': 'Plain', 'bootstrap_type': 'Bernoulli', 'subsample': 0.7409319719248681}. Best is trial 1464 with value: 0.8990825688073395.
[32m[I 2023-04-21 00:45:43,231][39m Trial 4978 finished with value: 0.8807339449541284 and parameters: {'objective': 'Logloss', 'colsample_bylevel': 0.08962889474076194, 'depth': 10, 'boosting_type': 'Plain', 'bootstrap_type': 'Bayesian', 'bagging_temperature': 6.2076502135112985}. Best is trial 1464 with value: 0.8990825688073395.
[32m[I 2023-04-21 00:45:44,303][39m Trial 4979 finished with value: 0.8421052631578947 and parameters: {'objective': 'CrossEntropy', 'colsample_bylevel': 0.08444658108580987, 'depth': 3, 'boosting_type': 'Plain', 'bootstrap_type': 'Bayesian', 'bagging_temperature': 3.449296502029856}. Best is trial 1464 with value: 0.8990825688073395.
[32m[I 2023-04-21 00:45:45,746][39m Trial 4980 finished with value: 0.8807339449541284 and parameters: {'objective': 'Logloss', 'colsample_bylevel': 0.09346424185977699, 'depth': 7, 'boosting_type': 'Plain', 'bootstrap_type': 'Bayesian', 'bagging_temperature': 5.732280441971557}. Best is trial 1464 with value: 0.8990825688073395.
[32m[I 2023-04-21 00:45:46,879][39m Trial 4981 finished with value: 0.8468468468468469 and parameters: {'objective': 'CrossEntropy', 'colsample_bylevel': 0.09429506800471323, 'depth': 10, 'boosting_type': 'Plain', 'bootstrap_type': 'MVS'}. Best is trial 1464 with value: 0.8990825688073395.
[32m[I 2023-04-21 00:45:48,277][39m Trial 4982 finished with value: 0.8807339449541284 and parameters: {'objective': 'Logloss', 'colsample_bylevel': 0.09564505722316942, 'depth': 12, 'boosting_type': 'Plain', 'bootstrap_type': 'Bayesian', 'bagging_temperature': 3.9675883779417256}. Best is trial 1464 with value: 0.8990825688073395.
[32m[I 2023-04-21 00:45:49,214][39m Trial 4983 finished with value: 0.8648648648648648 and parameters: {'objective': 'CrossEntropy', 'colsample_bylevel': 0.08826063987264571, 'depth': 7, 'boosting_type': 'Plain', 'bootstrap_type': 'Bayesian', 'bagging_temperature': 4.670266622918801}. Best is trial 1464 with value: 0.8990825688073395.
[32m[I 2023-04-21 00:45:50,225][39m Trial 4984 finished with value: 0.8828828828828829 and parameters: {'objective': 'CrossEntropy', 'colsample_bylevel': 0.09530806238744931, 'depth': 9, 'boosting_type': 'Plain', 'bootstrap_type': 'Bayesian', 'bagging_temperature': 5.871153212170141}. Best is trial 1464 with value: 0.8990825688073395.
[32m[I 2023-04-21 00:45:50,969][39m Trial 4985 finished with value: 0.8672566371681416 and parameters: {'objective': 'CrossEntropy', 'colsample_bylevel': 0.09043556323335637, 'depth': 12, 'boosting_type': 'Plain', 'bootstrap_type': 'Bayesian', 'bagging_temperature': 5.547909891933704}. Best is trial 1464 with value: 0.8990825688073395.
[32m[I 2023-04-21 00:45:52,310][39m Trial 4986 finished with value: 0.8727272727272727 and parameters: {'objective': 'CrossEntropy', 'colsample_bylevel': 0.08705889301151916, 'depth': 12, 'boosting_type': 'Plain', 'bootstrap_type': 'Bayesian', 'bagging_temperature': 5.189990178902186}. Best is trial 1464 with value: 0.8990825688073395.
[32m[I 2023-04-21 00:45:53,563][39m Trial 4987 finished with value: 0.8727272727272727 and parameters: {'objective': 'CrossEntropy', 'colsample_bylevel': 0.09099037546738103, 'depth': 11, 'boosting_type': 'Plain', 'bootstrap_type': 'Bayesian', 'bagging_temperature': 4.271159030306397}. Best is trial 1464 with value: 0.8990825688073395.
[32m[I 2023-04-21 00:45:55,248][39m Trial 4988 finished with value: 0.8727272727272727 and parameters: {'objective': 'Logloss', 'colsample_bylevel': 0.0972538929808167, 'depth': 9, 'boosting_type': 'Plain', 'bootstrap_type': 'Bayesian', 'bagging_temperature': 6.519316682286197}. Best is trial 1464 with value: 0.8990825688073395.
[32m[I 2023-04-21 00:46:00,082][39m Trial 4989 finished with value: 0.8421052631578947 and parameters: {'objective': 'Logloss', 'colsample_bylevel': 0.09384721852042513, 'depth': 8, 'boosting_type': 'Ordered', 'bootstrap_type': 'Bayesian', 'bagging_temperature': 5.472848548886886}. Best is trial 1464 with value: 0.8990825688073395.
[32m[I 2023-04-21 00:46:01,317][39m Trial 4990 finished with value: 0.8468468468468469 and parameters: {'objective': 'CrossEntropy', 'colsample_bylevel': 0.0956711196018689, 'depth': 10, 'boosting_type': 'Plain', 'bootstrap_type': 'Bayesian', 'bagging_temperature': 6.629819976342282}. Best is trial 1464 with value: 0.8990825688073395.
[32m[I 2023-04-21 00:46:02,602][39m Trial 4991 finished with value: 0.8727272727272727 and parameters: {'objective': 'Logloss', 'colsample_bylevel': 0.09233368952626685, 'depth': 11, 'boosting_type': 'Plain', 'bootstrap_type': 'Bayesian', 'bagging_temperature': 5.580527951503711}. Best is trial 1464 with value: 0.8990825688073395.
[32m[I 2023-04-21 00:46:03,975][39m Trial 4992 finished with value: 0.8828828828828829 and parameters: {'objective': 'Logloss', 'colsample_bylevel': 0.09119604979622961, 'depth': 9, 'boosting_type': 'Plain', 'bootstrap_type': 'Bayesian', 'bagging_temperature': 5.236448896935939}. Best is trial 1464 with value: 0.8990825688073395.
[32m[I 2023-04-21 00:46:05,117][39m Trial 4993 finished with value: 0.8828828828828829 and parameters: {'objective': 'Logloss', 'colsample_bylevel': 0.0925614395149382, 'depth': 9, 'boosting_type': 'Plain', 'bootstrap_type': 'Bayesian', 'bagging_temperature': 6.691820745555349}. Best is trial 1464 with value: 0.8990825688073395.
[32m[I 2023-04-21 00:46:06,455][39m Trial 4994 finished with value: 0.831858407079646 and parameters: {'objective': 'Logloss', 'colsample_bylevel': 0.06855533061902223, 'depth': 12, 'boosting_type': 'Plain', 'bootstrap_type': 'Bayesian', 'bagging_temperature': 5.370055737872364}. Best is trial 1464 with value: 0.8990825688073395.
[32m[I 2023-04-21 00:46:07,359][39m Trial 4995 finished with value: 0.8828828828828829 and parameters: {'objective': 'Logloss', 'colsample_bylevel': 0.09129338987431988, 'depth': 10, 'boosting_type': 'Plain', 'bootstrap_type': 'Bayesian', 'bagging_temperature': 5.357135831822814}. Best is trial 1464 with value: 0.8990825688073395.
[32m[I 2023-04-21 00:46:08,628][39m Trial 4996 finished with value: 0.875 and parameters: {'objective': 'Logloss', 'colsample_bylevel': 0.09091395085795467, 'depth': 11, 'boosting_type': 'Plain', 'bootstrap_type': 'Bayesian', 'bagging_temperature': 3.8162327786345007}. Best is trial 1464 with value: 0.8990825688073395.
[32m[I 2023-04-21 00:46:09,770][39m Trial 4997 finished with value: 0.8828828828828829 and parameters: {'objective': 'Logloss', 'colsample_bylevel': 0.08953423881171667, 'depth': 12, 'boosting_type': 'Plain', 'bootstrap_type': 'Bayesian', 'bagging_temperature': 5.247802330112897}. Best is trial 1464 with value: 0.8990825688073395.
[32m[I 2023-04-21 00:46:11,229][39m Trial 4998 finished with value: 0.8727272727272727 and parameters: {'objective': 'Logloss', 'colsample_bylevel': 0.0952758573638353, 'depth': 9, 'boosting_type': 'Plain', 'bootstrap_type': 'Bayesian', 'bagging_temperature': 7.84890365519617}. Best is trial 1464 with value: 0.8990825688073395.
[32m[I 2023-04-21 00:46:12,018][39m Trial 4999 finished with value: 0.8571428571428572 and parameters: {'objective': 'Logloss', 'colsample_bylevel': 0.09688825210088164, 'depth': 7, 'boosting_type': 'Plain', 'bootstrap_type': 'Bernoulli', 'subsample': 0.7105582321575222}. Best is trial 1464 with value: 0.8990825688073395.
[32m[I 2023-04-21 00:46:13,281][39m Trial 5000 finished with value: 0.8571428571428572 and parameters: {'objective': 'CrossEntropy', 'colsample_bylevel': 0.09610238818200312, 'depth': 9, 'boosting_type': 'Plain', 'bootstrap_type': 'MVS'}. Best is trial 1464 with value: 0.8990825688073395.
[32m[I 2023-04-21 00:46:14,733][39m Trial 5001 finished with value: 0.8347826086956522 and parameters: {'objective': 'CrossEntropy', 'colsample_bylevel': 0.08638811611492521, 'depth': 12, 'boosting_type': 'Plain', 'bootstrap_type': 'Bayesian', 'bagging_temperature': 4.8793179387422185}. Best is trial 1464 with value: 0.8990825688073395.
