[32m[I 2023-04-20 23:04:17,755][39m Trial 333 finished with value: 0.8571428571428572 and parameters: {'objective': 'Logloss', 'colsample_bylevel': 0.08586094088935768, 'depth': 10, 'boosting_type': 'Plain', 'bootstrap_type': 'Bayesian', 'bagging_temperature': 5.460836895913205}. Best is trial 205 with value: 0.890909090909091.
[32m[I 2023-04-20 23:04:18,622][39m Trial 334 finished with value: 0.8305084745762712 and parameters: {'objective': 'Logloss', 'colsample_bylevel': 0.09671844541361556, 'depth': 2, 'boosting_type': 'Plain', 'bootstrap_type': 'Bayesian', 'bagging_temperature': 5.687390793035764}. Best is trial 205 with value: 0.890909090909091.
[32m[I 2023-04-20 23:04:19,641][39m Trial 335 finished with value: 0.888888888888889 and parameters: {'objective': 'Logloss', 'colsample_bylevel': 0.09766696784901965, 'depth': 8, 'boosting_type': 'Plain', 'bootstrap_type': 'Bayesian', 'bagging_temperature': 5.567426208535593}. Best is trial 205 with value: 0.890909090909091.
[32m[I 2023-04-20 23:04:20,963][39m Trial 336 finished with value: 0.8807339449541284 and parameters: {'objective': 'Logloss', 'colsample_bylevel': 0.09763495947490573, 'depth': 8, 'boosting_type': 'Plain', 'bootstrap_type': 'Bayesian', 'bagging_temperature': 6.206376607883502}. Best is trial 205 with value: 0.890909090909091.
[32m[I 2023-04-20 23:04:21,778][39m Trial 337 finished with value: 0.8807339449541284 and parameters: {'objective': 'Logloss', 'colsample_bylevel': 0.09830119213412317, 'depth': 8, 'boosting_type': 'Plain', 'bootstrap_type': 'Bayesian', 'bagging_temperature': 5.575970212299894}. Best is trial 205 with value: 0.890909090909091.
[32m[I 2023-04-20 23:04:22,982][39m Trial 338 finished with value: 0.8807339449541284 and parameters: {'objective': 'Logloss', 'colsample_bylevel': 0.09554555946967282, 'depth': 8, 'boosting_type': 'Plain', 'bootstrap_type': 'Bayesian', 'bagging_temperature': 5.982946907057126}. Best is trial 205 with value: 0.890909090909091.
[32m[I 2023-04-20 23:04:23,729][39m Trial 339 finished with value: 0.8807339449541284 and parameters: {'objective': 'Logloss', 'colsample_bylevel': 0.09853153518652721, 'depth': 8, 'boosting_type': 'Plain', 'bootstrap_type': 'Bayesian', 'bagging_temperature': 5.510186367827795}. Best is trial 205 with value: 0.890909090909091.
[32m[I 2023-04-20 23:04:29,159][39m Trial 340 finished with value: 0.8421052631578947 and parameters: {'objective': 'Logloss', 'colsample_bylevel': 0.09964795913323891, 'depth': 8, 'boosting_type': 'Ordered', 'bootstrap_type': 'MVS'}. Best is trial 205 with value: 0.890909090909091.
[32m[I 2023-04-20 23:04:30,817][39m Trial 341 finished with value: 0.8727272727272727 and parameters: {'objective': 'Logloss', 'colsample_bylevel': 0.0999920310082156, 'depth': 8, 'boosting_type': 'Plain', 'bootstrap_type': 'Bayesian', 'bagging_temperature': 5.774585504812643}. Best is trial 205 with value: 0.890909090909091.
[32m[I 2023-04-20 23:04:31,664][39m Trial 342 finished with value: 0.8807339449541284 and parameters: {'objective': 'Logloss', 'colsample_bylevel': 0.09649736616801842, 'depth': 7, 'boosting_type': 'Plain', 'bootstrap_type': 'Bayesian', 'bagging_temperature': 6.383272086396898}. Best is trial 205 with value: 0.890909090909091.
[32m[I 2023-04-20 23:04:32,287][39m Trial 343 finished with value: 0.8807339449541284 and parameters: {'objective': 'Logloss', 'colsample_bylevel': 0.09999871778819, 'depth': 8, 'boosting_type': 'Plain', 'bootstrap_type': 'Bayesian', 'bagging_temperature': 5.2825536638330375}. Best is trial 205 with value: 0.890909090909091.
[32m[I 2023-04-20 23:04:33,793][39m Trial 344 finished with value: 0.8623853211009175 and parameters: {'objective': 'Logloss', 'colsample_bylevel': 0.09780661752876486, 'depth': 9, 'boosting_type': 'Plain', 'bootstrap_type': 'Bayesian', 'bagging_temperature': 5.36246386443691}. Best is trial 205 with value: 0.890909090909091.
[32m[I 2023-04-20 23:04:34,799][39m Trial 345 finished with value: 0.8807339449541284 and parameters: {'objective': 'Logloss', 'colsample_bylevel': 0.09826356043943472, 'depth': 8, 'boosting_type': 'Plain', 'bootstrap_type': 'Bayesian', 'bagging_temperature': 5.969110053186756}. Best is trial 205 with value: 0.890909090909091.
[32m[I 2023-04-20 23:04:35,559][39m Trial 346 finished with value: 0.8727272727272727 and parameters: {'objective': 'Logloss', 'colsample_bylevel': 0.0967161765661992, 'depth': 9, 'boosting_type': 'Plain', 'bootstrap_type': 'Bayesian', 'bagging_temperature': 5.155137882841138}. Best is trial 205 with value: 0.890909090909091.
[32m[I 2023-04-20 23:04:36,646][39m Trial 347 finished with value: 0.8807339449541284 and parameters: {'objective': 'Logloss', 'colsample_bylevel': 0.09333061183231002, 'depth': 8, 'boosting_type': 'Plain', 'bootstrap_type': 'Bayesian', 'bagging_temperature': 5.738360191931662}. Best is trial 205 with value: 0.890909090909091.
[32m[I 2023-04-20 23:04:37,583][39m Trial 348 finished with value: 0.8672566371681416 and parameters: {'objective': 'Logloss', 'colsample_bylevel': 0.09549767024555482, 'depth': 10, 'boosting_type': 'Plain', 'bootstrap_type': 'Bernoulli', 'subsample': 0.271190813776459}. Best is trial 205 with value: 0.890909090909091.
[32m[I 2023-04-20 23:04:38,453][39m Trial 349 finished with value: 0.8807339449541284 and parameters: {'objective': 'Logloss', 'colsample_bylevel': 0.09448801468989088, 'depth': 6, 'boosting_type': 'Plain', 'bootstrap_type': 'Bayesian', 'bagging_temperature': 5.485229699145229}. Best is trial 205 with value: 0.890909090909091.
[32m[I 2023-04-20 23:04:39,531][39m Trial 350 finished with value: 0.8727272727272727 and parameters: {'objective': 'Logloss', 'colsample_bylevel': 0.09823702870081362, 'depth': 8, 'boosting_type': 'Plain', 'bootstrap_type': 'Bayesian', 'bagging_temperature': 2.7147725724884864}. Best is trial 205 with value: 0.890909090909091.
[32m[I 2023-04-20 23:04:40,369][39m Trial 351 finished with value: 0.8596491228070176 and parameters: {'objective': 'Logloss', 'colsample_bylevel': 0.09721225324410275, 'depth': 8, 'boosting_type': 'Plain', 'bootstrap_type': 'Bayesian', 'bagging_temperature': 5.6862406504652}. Best is trial 205 with value: 0.890909090909091.
[32m[I 2023-04-20 23:04:41,305][39m Trial 352 finished with value: 0.8807339449541284 and parameters: {'objective': 'Logloss', 'colsample_bylevel': 0.09845647801947503, 'depth': 8, 'boosting_type': 'Plain', 'bootstrap_type': 'Bayesian', 'bagging_temperature': 5.9985277239054495}. Best is trial 205 with value: 0.890909090909091.
[32m[I 2023-04-20 23:04:42,139][39m Trial 353 finished with value: 0.7758620689655173 and parameters: {'objective': 'Logloss', 'colsample_bylevel': 0.01675968645484438, 'depth': 8, 'boosting_type': 'Plain', 'bootstrap_type': 'Bayesian', 'bagging_temperature': 5.3586693701096175}. Best is trial 205 with value: 0.890909090909091.
[32m[I 2023-04-20 23:04:43,124][39m Trial 354 finished with value: 0.8648648648648648 and parameters: {'objective': 'Logloss', 'colsample_bylevel': 0.09311750974249886, 'depth': 9, 'boosting_type': 'Plain', 'bootstrap_type': 'Bayesian', 'bagging_temperature': 5.036278971398709}. Best is trial 205 with value: 0.890909090909091.
[32m[I 2023-04-20 23:04:44,536][39m Trial 355 finished with value: 0.888888888888889 and parameters: {'objective': 'Logloss', 'colsample_bylevel': 0.09591208635808247, 'depth': 8, 'boosting_type': 'Plain', 'bootstrap_type': 'Bayesian', 'bagging_temperature': 4.829469014162724}. Best is trial 205 with value: 0.890909090909091.
[32m[I 2023-04-20 23:04:45,957][39m Trial 356 finished with value: 0.888888888888889 and parameters: {'objective': 'Logloss', 'colsample_bylevel': 0.09996147736165321, 'depth': 8, 'boosting_type': 'Plain', 'bootstrap_type': 'Bayesian', 'bagging_temperature': 6.423694927633843}. Best is trial 205 with value: 0.890909090909091.
[32m[I 2023-04-20 23:04:46,728][39m Trial 357 finished with value: 0.8727272727272727 and parameters: {'objective': 'Logloss', 'colsample_bylevel': 0.09958446466532171, 'depth': 8, 'boosting_type': 'Plain', 'bootstrap_type': 'Bayesian', 'bagging_temperature': 6.5208397723209295}. Best is trial 205 with value: 0.890909090909091.
[32m[I 2023-04-20 23:04:47,616][39m Trial 358 finished with value: 0.8807339449541284 and parameters: {'objective': 'Logloss', 'colsample_bylevel': 0.09636698335595614, 'depth': 8, 'boosting_type': 'Plain', 'bootstrap_type': 'Bayesian', 'bagging_temperature': 5.079695445886023}. Best is trial 205 with value: 0.890909090909091.
[32m[I 2023-04-20 23:04:52,281][39m Trial 359 finished with value: 0.8495575221238938 and parameters: {'objective': 'Logloss', 'colsample_bylevel': 0.09688137714684435, 'depth': 8, 'boosting_type': 'Ordered', 'bootstrap_type': 'Bayesian', 'bagging_temperature': 6.687341250064353}. Best is trial 205 with value: 0.890909090909091.
[32m[I 2023-04-20 23:04:53,407][39m Trial 360 finished with value: 0.8807339449541284 and parameters: {'objective': 'Logloss', 'colsample_bylevel': 0.0951048366458555, 'depth': 7, 'boosting_type': 'Plain', 'bootstrap_type': 'Bayesian', 'bagging_temperature': 6.906070959109886}. Best is trial 205 with value: 0.890909090909091.
[32m[I 2023-04-20 23:04:54,328][39m Trial 361 finished with value: 0.888888888888889 and parameters: {'objective': 'Logloss', 'colsample_bylevel': 0.0966852700469218, 'depth': 7, 'boosting_type': 'Plain', 'bootstrap_type': 'Bayesian', 'bagging_temperature': 6.362053793220987}. Best is trial 205 with value: 0.890909090909091.
[32m[I 2023-04-20 23:04:55,198][39m Trial 362 finished with value: 0.8807339449541284 and parameters: {'objective': 'Logloss', 'colsample_bylevel': 0.09550979021138883, 'depth': 8, 'boosting_type': 'Plain', 'bootstrap_type': 'Bayesian', 'bagging_temperature': 5.782091786254291}. Best is trial 205 with value: 0.890909090909091.
[32m[I 2023-04-20 23:04:56,332][39m Trial 363 finished with value: 0.8421052631578947 and parameters: {'objective': 'Logloss', 'colsample_bylevel': 0.0948692549334927, 'depth': 5, 'boosting_type': 'Plain', 'bootstrap_type': 'Bayesian', 'bagging_temperature': 5.261054200853904}. Best is trial 205 with value: 0.890909090909091.
[32m[I 2023-04-20 23:04:57,104][39m Trial 364 finished with value: 0.8571428571428572 and parameters: {'objective': 'Logloss', 'colsample_bylevel': 0.09833819301279646, 'depth': 7, 'boosting_type': 'Plain', 'bootstrap_type': 'Bayesian', 'bagging_temperature': 1.7256810897228174}. Best is trial 205 with value: 0.890909090909091.
[32m[I 2023-04-20 23:04:58,163][39m Trial 365 finished with value: 0.8596491228070176 and parameters: {'objective': 'Logloss', 'colsample_bylevel': 0.099972362652136, 'depth': 7, 'boosting_type': 'Plain', 'bootstrap_type': 'MVS'}. Best is trial 205 with value: 0.890909090909091.
[32m[I 2023-04-20 23:04:59,072][39m Trial 366 finished with value: 0.8785046728971961 and parameters: {'objective': 'Logloss', 'colsample_bylevel': 0.09631928699817713, 'depth': 7, 'boosting_type': 'Plain', 'bootstrap_type': 'Bayesian', 'bagging_temperature': 6.225471128658564}. Best is trial 205 with value: 0.890909090909091.
[32m[I 2023-04-20 23:05:00,308][39m Trial 367 finished with value: 0.8807339449541284 and parameters: {'objective': 'Logloss', 'colsample_bylevel': 0.09716641834568093, 'depth': 7, 'boosting_type': 'Plain', 'bootstrap_type': 'Bayesian', 'bagging_temperature': 6.387455926456858}. Best is trial 205 with value: 0.890909090909091.
[32m[I 2023-04-20 23:05:01,145][39m Trial 368 finished with value: 0.888888888888889 and parameters: {'objective': 'Logloss', 'colsample_bylevel': 0.09674153016100143, 'depth': 8, 'boosting_type': 'Plain', 'bootstrap_type': 'Bayesian', 'bagging_temperature': 6.313229978579516}. Best is trial 205 with value: 0.890909090909091.
[32m[I 2023-04-20 23:05:02,511][39m Trial 369 finished with value: 0.8727272727272727 and parameters: {'objective': 'Logloss', 'colsample_bylevel': 0.09991167545148509, 'depth': 8, 'boosting_type': 'Plain', 'bootstrap_type': 'Bayesian', 'bagging_temperature': 6.194026834583071}. Best is trial 205 with value: 0.890909090909091.
[32m[I 2023-04-20 23:05:03,275][39m Trial 370 finished with value: 0.8727272727272727 and parameters: {'objective': 'Logloss', 'colsample_bylevel': 0.09675756358737106, 'depth': 8, 'boosting_type': 'Plain', 'bootstrap_type': 'Bayesian', 'bagging_temperature': 6.549841546918124}. Best is trial 205 with value: 0.890909090909091.
[32m[I 2023-04-20 23:05:04,403][39m Trial 371 finished with value: 0.8807339449541284 and parameters: {'objective': 'Logloss', 'colsample_bylevel': 0.09806479137355961, 'depth': 7, 'boosting_type': 'Plain', 'bootstrap_type': 'Bayesian', 'bagging_temperature': 6.750829176122381}. Best is trial 205 with value: 0.890909090909091.
[32m[I 2023-04-20 23:05:05,808][39m Trial 372 finished with value: 0.8571428571428572 and parameters: {'objective': 'Logloss', 'colsample_bylevel': 0.09473064751224415, 'depth': 8, 'boosting_type': 'Plain', 'bootstrap_type': 'Bernoulli', 'subsample': 0.8708237443321368}. Best is trial 205 with value: 0.890909090909091.
[32m[I 2023-04-20 23:05:06,419][39m Trial 373 finished with value: 0.8828828828828829 and parameters: {'objective': 'Logloss', 'colsample_bylevel': 0.09796561420750796, 'depth': 8, 'boosting_type': 'Plain', 'bootstrap_type': 'Bayesian', 'bagging_temperature': 6.21737281682575}. Best is trial 205 with value: 0.890909090909091.
[32m[I 2023-04-20 23:05:07,940][39m Trial 374 finished with value: 0.8807339449541284 and parameters: {'objective': 'Logloss', 'colsample_bylevel': 0.0999455087365991, 'depth': 8, 'boosting_type': 'Plain', 'bootstrap_type': 'Bayesian', 'bagging_temperature': 6.419331826556318}. Best is trial 205 with value: 0.890909090909091.
[32m[I 2023-04-20 23:05:08,870][39m Trial 375 finished with value: 0.8648648648648648 and parameters: {'objective': 'Logloss', 'colsample_bylevel': 0.09593360939536233, 'depth': 8, 'boosting_type': 'Plain', 'bootstrap_type': 'Bayesian', 'bagging_temperature': 6.083663525068498}. Best is trial 205 with value: 0.890909090909091.
[32m[I 2023-04-20 23:05:09,722][39m Trial 376 finished with value: 0.8727272727272727 and parameters: {'objective': 'Logloss', 'colsample_bylevel': 0.09824388550555262, 'depth': 8, 'boosting_type': 'Plain', 'bootstrap_type': 'Bayesian', 'bagging_temperature': 6.192184376925003}. Best is trial 205 with value: 0.890909090909091.
[32m[I 2023-04-20 23:05:10,831][39m Trial 377 finished with value: 0.8727272727272727 and parameters: {'objective': 'Logloss', 'colsample_bylevel': 0.09678375725522576, 'depth': 7, 'boosting_type': 'Plain', 'bootstrap_type': 'Bayesian', 'bagging_temperature': 6.886624129550381}. Best is trial 205 with value: 0.890909090909091.
[32m[I 2023-04-20 23:05:11,532][39m Trial 378 finished with value: 0.8648648648648648 and parameters: {'objective': 'Logloss', 'colsample_bylevel': 0.09505930979713745, 'depth': 8, 'boosting_type': 'Plain', 'bootstrap_type': 'Bayesian', 'bagging_temperature': 6.289259168722964}. Best is trial 205 with value: 0.890909090909091.
[32m[I 2023-04-20 23:05:12,777][39m Trial 379 finished with value: 0.8727272727272727 and parameters: {'objective': 'Logloss', 'colsample_bylevel': 0.09768402425438441, 'depth': 11, 'boosting_type': 'Plain', 'bootstrap_type': 'Bayesian', 'bagging_temperature': 6.119263745240877}. Best is trial 205 with value: 0.890909090909091.
[32m[I 2023-04-20 23:05:17,612][39m Trial 380 finished with value: 0.8596491228070176 and parameters: {'objective': 'Logloss', 'colsample_bylevel': 0.07546883476190819, 'depth': 8, 'boosting_type': 'Ordered', 'bootstrap_type': 'Bayesian', 'bagging_temperature': 5.941096779408257}. Best is trial 205 with value: 0.890909090909091.
[32m[I 2023-04-20 23:05:18,717][39m Trial 381 finished with value: 0.8807339449541284 and parameters: {'objective': 'Logloss', 'colsample_bylevel': 0.0982114628766637, 'depth': 7, 'boosting_type': 'Plain', 'bootstrap_type': 'Bayesian', 'bagging_temperature': 6.392317231267039}. Best is trial 205 with value: 0.890909090909091.
[32m[I 2023-04-20 23:05:20,048][39m Trial 382 finished with value: 0.8521739130434783 and parameters: {'objective': 'Logloss', 'colsample_bylevel': 0.06435456727885361, 'depth': 8, 'boosting_type': 'Plain', 'bootstrap_type': 'Bayesian', 'bagging_temperature': 6.5582274358567245}. Best is trial 205 with value: 0.890909090909091.
[32m[I 2023-04-20 23:05:21,022][39m Trial 383 finished with value: 0.8807339449541284 and parameters: {'objective': 'Logloss', 'colsample_bylevel': 0.09997389807344832, 'depth': 8, 'boosting_type': 'Plain', 'bootstrap_type': 'Bayesian', 'bagging_temperature': 5.721190446159757}. Best is trial 205 with value: 0.890909090909091.
[32m[I 2023-04-20 23:05:22,069][39m Trial 384 finished with value: 0.8727272727272727 and parameters: {'objective': 'Logloss', 'colsample_bylevel': 0.09662933582444698, 'depth': 7, 'boosting_type': 'Plain', 'bootstrap_type': 'Bayesian', 'bagging_temperature': 5.539796823968142}. Best is trial 205 with value: 0.890909090909091.
[32m[I 2023-04-20 23:05:23,142][39m Trial 385 finished with value: 0.8448275862068967 and parameters: {'objective': 'Logloss', 'colsample_bylevel': 0.03481468895879809, 'depth': 8, 'boosting_type': 'Plain', 'bootstrap_type': 'Bayesian', 'bagging_temperature': 5.950840933676595}. Best is trial 205 with value: 0.890909090909091.
[32m[I 2023-04-20 23:05:23,792][39m Trial 386 finished with value: 0.8828828828828829 and parameters: {'objective': 'Logloss', 'colsample_bylevel': 0.09829134794252661, 'depth': 7, 'boosting_type': 'Plain', 'bootstrap_type': 'Bayesian', 'bagging_temperature': 4.802208793561863}. Best is trial 205 with value: 0.890909090909091.
[32m[I 2023-04-20 23:05:24,628][39m Trial 387 finished with value: 0.8347826086956522 and parameters: {'objective': 'Logloss', 'colsample_bylevel': 0.09787600762468658, 'depth': 6, 'boosting_type': 'Plain', 'bootstrap_type': 'MVS'}. Best is trial 205 with value: 0.890909090909091.
[32m[I 2023-04-20 23:05:25,530][39m Trial 388 finished with value: 0.8703703703703703 and parameters: {'objective': 'Logloss', 'colsample_bylevel': 0.09539802796462336, 'depth': 7, 'boosting_type': 'Plain', 'bootstrap_type': 'Bayesian', 'bagging_temperature': 5.1268228885806835}. Best is trial 205 with value: 0.890909090909091.
[32m[I 2023-04-20 23:05:26,583][39m Trial 389 finished with value: 0.8727272727272727 and parameters: {'objective': 'Logloss', 'colsample_bylevel': 0.09401139595125403, 'depth': 7, 'boosting_type': 'Plain', 'bootstrap_type': 'Bayesian', 'bagging_temperature': 4.746595756247262}. Best is trial 205 with value: 0.890909090909091.
[32m[I 2023-04-20 23:05:27,341][39m Trial 390 finished with value: 0.8807339449541284 and parameters: {'objective': 'Logloss', 'colsample_bylevel': 0.09825982589077409, 'depth': 7, 'boosting_type': 'Plain', 'bootstrap_type': 'Bayesian', 'bagging_temperature': 4.954786191357996}. Best is trial 205 with value: 0.890909090909091.
[32m[I 2023-04-20 23:05:28,396][39m Trial 391 finished with value: 0.8807339449541284 and parameters: {'objective': 'Logloss', 'colsample_bylevel': 0.09625726055887618, 'depth': 7, 'boosting_type': 'Plain', 'bootstrap_type': 'Bayesian', 'bagging_temperature': 4.888775816105287}. Best is trial 205 with value: 0.890909090909091.
[32m[I 2023-04-20 23:05:29,277][39m Trial 392 finished with value: 0.8727272727272727 and parameters: {'objective': 'Logloss', 'colsample_bylevel': 0.09691999394322659, 'depth': 6, 'boosting_type': 'Plain', 'bootstrap_type': 'Bayesian', 'bagging_temperature': 7.25531432314179}. Best is trial 205 with value: 0.890909090909091.
[32m[I 2023-04-20 23:05:30,026][39m Trial 393 finished with value: 0.8448275862068967 and parameters: {'objective': 'Logloss', 'colsample_bylevel': 0.029777888115218386, 'depth': 8, 'boosting_type': 'Plain', 'bootstrap_type': 'Bayesian', 'bagging_temperature': 5.614855073877519}. Best is trial 205 with value: 0.890909090909091.
[32m[I 2023-04-20 23:05:30,940][39m Trial 394 finished with value: 0.888888888888889 and parameters: {'objective': 'Logloss', 'colsample_bylevel': 0.09417657215452772, 'depth': 7, 'boosting_type': 'Plain', 'bootstrap_type': 'Bayesian', 'bagging_temperature': 5.316545604136817}. Best is trial 205 with value: 0.890909090909091.
[32m[I 2023-04-20 23:05:32,018][39m Trial 395 finished with value: 0.8807339449541284 and parameters: {'objective': 'Logloss', 'colsample_bylevel': 0.09391366386350943, 'depth': 7, 'boosting_type': 'Plain', 'bootstrap_type': 'Bayesian', 'bagging_temperature': 6.272538733338377}. Best is trial 205 with value: 0.890909090909091.
[32m[I 2023-04-20 23:05:33,041][39m Trial 396 finished with value: 0.823529411764706 and parameters: {'objective': 'Logloss', 'colsample_bylevel': 0.09284973275971585, 'depth': 1, 'boosting_type': 'Plain', 'bootstrap_type': 'Bernoulli', 'subsample': 0.5183911281783651}. Best is trial 205 with value: 0.890909090909091.
[32m[I 2023-04-20 23:05:33,865][39m Trial 397 finished with value: 0.888888888888889 and parameters: {'objective': 'Logloss', 'colsample_bylevel': 0.09488932129952994, 'depth': 8, 'boosting_type': 'Plain', 'bootstrap_type': 'Bayesian', 'bagging_temperature': 5.353227424904427}. Best is trial 205 with value: 0.890909090909091.
[32m[I 2023-04-20 23:05:35,151][39m Trial 398 finished with value: 0.8807339449541284 and parameters: {'objective': 'Logloss', 'colsample_bylevel': 0.09455477922669019, 'depth': 7, 'boosting_type': 'Plain', 'bootstrap_type': 'Bayesian', 'bagging_temperature': 5.445393402017209}. Best is trial 205 with value: 0.890909090909091.
