[32m[I 2023-04-21 00:56:45,770][39m Trial 5460 finished with value: 0.8727272727272727 and parameters: {'objective': 'Logloss', 'colsample_bylevel': 0.09817187118673155, 'depth': 12, 'boosting_type': 'Plain', 'bootstrap_type': 'Bayesian', 'bagging_temperature': 4.321626343910965}. Best is trial 1464 with value: 0.8990825688073395.
[32m[I 2023-04-21 00:56:46,726][39m Trial 5461 finished with value: 0.8571428571428572 and parameters: {'objective': 'CrossEntropy', 'colsample_bylevel': 0.09422498341310226, 'depth': 11, 'boosting_type': 'Plain', 'bootstrap_type': 'MVS'}. Best is trial 1464 with value: 0.8990825688073395.
[32m[I 2023-04-21 00:56:47,802][39m Trial 5462 finished with value: 0.8571428571428572 and parameters: {'objective': 'Logloss', 'colsample_bylevel': 0.08492311211555921, 'depth': 12, 'boosting_type': 'Plain', 'bootstrap_type': 'Bayesian', 'bagging_temperature': 4.377570864834269}. Best is trial 1464 with value: 0.8990825688073395.
[32m[I 2023-04-21 00:56:49,895][39m Trial 5463 finished with value: 0.8807339449541284 and parameters: {'objective': 'Logloss', 'colsample_bylevel': 0.09806140687448991, 'depth': 9, 'boosting_type': 'Plain', 'bootstrap_type': 'Bayesian', 'bagging_temperature': 4.3917962316581}. Best is trial 1464 with value: 0.8990825688073395.
[32m[I 2023-04-21 00:56:50,958][39m Trial 5464 finished with value: 0.8807339449541284 and parameters: {'objective': 'CrossEntropy', 'colsample_bylevel': 0.09998588033368778, 'depth': 9, 'boosting_type': 'Plain', 'bootstrap_type': 'Bayesian', 'bagging_temperature': 7.3802370315383605}. Best is trial 1464 with value: 0.8990825688073395.
[32m[I 2023-04-21 00:56:52,082][39m Trial 5465 finished with value: 0.8807339449541284 and parameters: {'objective': 'Logloss', 'colsample_bylevel': 0.08847079912779078, 'depth': 11, 'boosting_type': 'Plain', 'bootstrap_type': 'Bayesian', 'bagging_temperature': 4.938727825457152}. Best is trial 1464 with value: 0.8990825688073395.
[32m[I 2023-04-21 00:56:53,899][39m Trial 5466 finished with value: 0.8807339449541284 and parameters: {'objective': 'Logloss', 'colsample_bylevel': 0.093512850088383, 'depth': 9, 'boosting_type': 'Plain', 'bootstrap_type': 'Bayesian', 'bagging_temperature': 5.511426869651788}. Best is trial 1464 with value: 0.8990825688073395.
[32m[I 2023-04-21 00:56:54,878][39m Trial 5467 finished with value: 0.8648648648648648 and parameters: {'objective': 'Logloss', 'colsample_bylevel': 0.0923497873907549, 'depth': 8, 'boosting_type': 'Plain', 'bootstrap_type': 'Bayesian', 'bagging_temperature': 7.682414134005825}. Best is trial 1464 with value: 0.8990825688073395.
[32m[I 2023-04-21 00:56:55,678][39m Trial 5468 finished with value: 0.8703703703703703 and parameters: {'objective': 'Logloss', 'colsample_bylevel': 0.0927990796557245, 'depth': 10, 'boosting_type': 'Plain', 'bootstrap_type': 'Bayesian', 'bagging_temperature': 3.359907698380134}. Best is trial 1464 with value: 0.8990825688073395.
[32m[I 2023-04-21 00:56:56,560][39m Trial 5469 finished with value: 0.8648648648648648 and parameters: {'objective': 'CrossEntropy', 'colsample_bylevel': 0.083089299501206, 'depth': 12, 'boosting_type': 'Plain', 'bootstrap_type': 'Bayesian', 'bagging_temperature': 7.288761964099464}. Best is trial 1464 with value: 0.8990825688073395.
[32m[I 2023-04-21 00:56:57,301][39m Trial 5470 finished with value: 0.8727272727272727 and parameters: {'objective': 'CrossEntropy', 'colsample_bylevel': 0.09049055888306035, 'depth': 11, 'boosting_type': 'Plain', 'bootstrap_type': 'Bayesian', 'bagging_temperature': 7.165266343982397}. Best is trial 1464 with value: 0.8990825688073395.
[32m[I 2023-04-21 00:56:58,773][39m Trial 5471 finished with value: 0.8828828828828829 and parameters: {'objective': 'Logloss', 'colsample_bylevel': 0.09060970328356692, 'depth': 9, 'boosting_type': 'Plain', 'bootstrap_type': 'Bayesian', 'bagging_temperature': 5.219484554892907}. Best is trial 1464 with value: 0.8990825688073395.
[32m[I 2023-04-21 00:57:00,151][39m Trial 5472 finished with value: 0.8828828828828829 and parameters: {'objective': 'CrossEntropy', 'colsample_bylevel': 0.08434361767300373, 'depth': 11, 'boosting_type': 'Plain', 'bootstrap_type': 'Bayesian', 'bagging_temperature': 3.314924401118136}. Best is trial 1464 with value: 0.8990825688073395.
[32m[I 2023-04-21 00:57:01,758][39m Trial 5473 finished with value: 0.888888888888889 and parameters: {'objective': 'CrossEntropy', 'colsample_bylevel': 0.09961819804662939, 'depth': 8, 'boosting_type': 'Plain', 'bootstrap_type': 'Bayesian', 'bagging_temperature': 4.7269290994685536}. Best is trial 1464 with value: 0.8990825688073395.
[32m[I 2023-04-21 00:57:02,428][39m Trial 5474 finished with value: 0.8623853211009175 and parameters: {'objective': 'CrossEntropy', 'colsample_bylevel': 0.08547060769920853, 'depth': 12, 'boosting_type': 'Plain', 'bootstrap_type': 'Bayesian', 'bagging_temperature': 5.096585422574703}. Best is trial 1464 with value: 0.8990825688073395.
[32m[I 2023-04-21 00:57:03,919][39m Trial 5475 finished with value: 0.888888888888889 and parameters: {'objective': 'Logloss', 'colsample_bylevel': 0.08883392678611175, 'depth': 10, 'boosting_type': 'Plain', 'bootstrap_type': 'Bayesian', 'bagging_temperature': 5.0298225859336005}. Best is trial 1464 with value: 0.8990825688073395.
[32m[I 2023-04-21 00:57:05,442][39m Trial 5476 finished with value: 0.8807339449541284 and parameters: {'objective': 'Logloss', 'colsample_bylevel': 0.09681669656886965, 'depth': 9, 'boosting_type': 'Plain', 'bootstrap_type': 'Bayesian', 'bagging_temperature': 4.281391146044991}. Best is trial 1464 with value: 0.8990825688073395.
[32m[I 2023-04-21 00:57:06,463][39m Trial 5477 finished with value: 0.875 and parameters: {'objective': 'Logloss', 'colsample_bylevel': 0.0965960817128769, 'depth': 9, 'boosting_type': 'Plain', 'bootstrap_type': 'Bernoulli', 'subsample': 0.10039843622363265}. Best is trial 1464 with value: 0.8990825688073395.
[32m[I 2023-04-21 00:57:07,841][39m Trial 5478 finished with value: 0.8727272727272727 and parameters: {'objective': 'CrossEntropy', 'colsample_bylevel': 0.08933664305063162, 'depth': 12, 'boosting_type': 'Plain', 'bootstrap_type': 'Bayesian', 'bagging_temperature': 4.609317294695618}. Best is trial 1464 with value: 0.8990825688073395.
[32m[I 2023-04-21 00:57:12,646][39m Trial 5479 finished with value: 0.8347826086956522 and parameters: {'objective': 'Logloss', 'colsample_bylevel': 0.08964124675631834, 'depth': 11, 'boosting_type': 'Ordered', 'bootstrap_type': 'Bayesian', 'bagging_temperature': 5.307074545448493}. Best is trial 1464 with value: 0.8990825688073395.
[32m[I 2023-04-21 00:57:13,755][39m Trial 5480 finished with value: 0.888888888888889 and parameters: {'objective': 'Logloss', 'colsample_bylevel': 0.09493035495907871, 'depth': 11, 'boosting_type': 'Plain', 'bootstrap_type': 'Bayesian', 'bagging_temperature': 5.584773432469403}. Best is trial 1464 with value: 0.8990825688073395.
[32m[I 2023-04-21 00:57:15,237][39m Trial 5481 finished with value: 0.8807339449541284 and parameters: {'objective': 'Logloss', 'colsample_bylevel': 0.09515955412424107, 'depth': 12, 'boosting_type': 'Plain', 'bootstrap_type': 'Bayesian', 'bagging_temperature': 6.944448009426076}. Best is trial 1464 with value: 0.8990825688073395.
[32m[I 2023-04-21 00:57:16,653][39m Trial 5482 finished with value: 0.8648648648648648 and parameters: {'objective': 'Logloss', 'colsample_bylevel': 0.0896097082332567, 'depth': 12, 'boosting_type': 'Plain', 'bootstrap_type': 'Bayesian', 'bagging_temperature': 5.029840857801084}. Best is trial 1464 with value: 0.8990825688073395.
[32m[I 2023-04-21 00:57:17,771][39m Trial 5483 finished with value: 0.888888888888889 and parameters: {'objective': 'CrossEntropy', 'colsample_bylevel': 0.09981170752619568, 'depth': 11, 'boosting_type': 'Plain', 'bootstrap_type': 'Bayesian', 'bagging_temperature': 2.7565951738104184}. Best is trial 1464 with value: 0.8990825688073395.
[32m[I 2023-04-21 00:57:19,380][39m Trial 5484 finished with value: 0.875 and parameters: {'objective': 'CrossEntropy', 'colsample_bylevel': 0.08502888538622044, 'depth': 9, 'boosting_type': 'Plain', 'bootstrap_type': 'Bayesian', 'bagging_temperature': 5.183451756178746}. Best is trial 1464 with value: 0.8990825688073395.
[32m[I 2023-04-21 00:57:20,327][39m Trial 5485 finished with value: 0.8571428571428572 and parameters: {'objective': 'Logloss', 'colsample_bylevel': 0.09738599282284442, 'depth': 11, 'boosting_type': 'Plain', 'bootstrap_type': 'MVS'}. Best is trial 1464 with value: 0.8990825688073395.
[32m[I 2023-04-21 00:57:21,092][39m Trial 5486 finished with value: 0.8807339449541284 and parameters: {'objective': 'Logloss', 'colsample_bylevel': 0.0904363540471189, 'depth': 12, 'boosting_type': 'Plain', 'bootstrap_type': 'Bayesian', 'bagging_temperature': 5.778901129998304}. Best is trial 1464 with value: 0.8990825688073395.
[32m[I 2023-04-21 00:57:22,332][39m Trial 5487 finished with value: 0.8807339449541284 and parameters: {'objective': 'CrossEntropy', 'colsample_bylevel': 0.09132194252151299, 'depth': 12, 'boosting_type': 'Plain', 'bootstrap_type': 'Bayesian', 'bagging_temperature': 6.111944587742358}. Best is trial 1464 with value: 0.8990825688073395.
[32m[I 2023-04-21 00:57:23,898][39m Trial 5488 finished with value: 0.8448275862068967 and parameters: {'objective': 'CrossEntropy', 'colsample_bylevel': 0.03989775067605823, 'depth': 12, 'boosting_type': 'Plain', 'bootstrap_type': 'Bayesian', 'bagging_temperature': 6.070260152217038}. Best is trial 1464 with value: 0.8990825688073395.
[32m[I 2023-04-21 00:57:24,843][39m Trial 5489 finished with value: 0.8648648648648648 and parameters: {'objective': 'Logloss', 'colsample_bylevel': 0.08652649051523, 'depth': 11, 'boosting_type': 'Plain', 'bootstrap_type': 'Bayesian', 'bagging_temperature': 4.832427041136053}. Best is trial 1464 with value: 0.8990825688073395.
[32m[I 2023-04-21 00:57:25,872][39m Trial 5490 finished with value: 0.8807339449541284 and parameters: {'objective': 'CrossEntropy', 'colsample_bylevel': 0.09785014344459665, 'depth': 8, 'boosting_type': 'Plain', 'bootstrap_type': 'Bayesian', 'bagging_temperature': 4.3054563873978235}. Best is trial 1464 with value: 0.8990825688073395.
[32m[I 2023-04-21 00:57:26,818][39m Trial 5491 finished with value: 0.8785046728971961 and parameters: {'objective': 'CrossEntropy', 'colsample_bylevel': 0.094318047619033, 'depth': 9, 'boosting_type': 'Plain', 'bootstrap_type': 'Bayesian', 'bagging_temperature': 7.132328463406663}. Best is trial 1464 with value: 0.8990825688073395.
[32m[I 2023-04-21 00:57:27,588][39m Trial 5492 finished with value: 0.888888888888889 and parameters: {'objective': 'Logloss', 'colsample_bylevel': 0.08564434161368083, 'depth': 11, 'boosting_type': 'Plain', 'bootstrap_type': 'Bayesian', 'bagging_temperature': 4.841567688498396}. Best is trial 1464 with value: 0.8990825688073395.
[32m[I 2023-04-21 00:57:29,403][39m Trial 5493 finished with value: 0.8727272727272727 and parameters: {'objective': 'Logloss', 'colsample_bylevel': 0.09990506406023877, 'depth': 8, 'boosting_type': 'Plain', 'bootstrap_type': 'Bayesian', 'bagging_temperature': 6.717611898201476}. Best is trial 1464 with value: 0.8990825688073395.
[32m[I 2023-04-21 00:57:30,812][39m Trial 5494 finished with value: 0.8807339449541284 and parameters: {'objective': 'CrossEntropy', 'colsample_bylevel': 0.09505540064050486, 'depth': 12, 'boosting_type': 'Plain', 'bootstrap_type': 'Bayesian', 'bagging_temperature': 7.357915700567492}. Best is trial 1464 with value: 0.8990825688073395.
[32m[I 2023-04-21 00:57:32,146][39m Trial 5495 finished with value: 0.8727272727272727 and parameters: {'objective': 'Logloss', 'colsample_bylevel': 0.09620636674138185, 'depth': 9, 'boosting_type': 'Plain', 'bootstrap_type': 'Bayesian', 'bagging_temperature': 5.017894899101009}. Best is trial 1464 with value: 0.8990825688073395.
[32m[I 2023-04-21 00:57:33,493][39m Trial 5496 finished with value: 0.8727272727272727 and parameters: {'objective': 'Logloss', 'colsample_bylevel': 0.09184309702010249, 'depth': 11, 'boosting_type': 'Plain', 'bootstrap_type': 'Bayesian', 'bagging_temperature': 6.04524553816538}. Best is trial 1464 with value: 0.8990825688073395.
[32m[I 2023-04-21 00:57:38,136][39m Trial 5497 finished with value: 0.8347826086956522 and parameters: {'objective': 'CrossEntropy', 'colsample_bylevel': 0.09997579507255397, 'depth': 9, 'boosting_type': 'Ordered', 'bootstrap_type': 'Bayesian', 'bagging_temperature': 6.908732475918739}. Best is trial 1464 with value: 0.8990825688073395.
[32m[I 2023-04-21 00:57:39,113][39m Trial 5498 finished with value: 0.875 and parameters: {'objective': 'Logloss', 'colsample_bylevel': 0.0955855078939917, 'depth': 10, 'boosting_type': 'Plain', 'bootstrap_type': 'Bernoulli', 'subsample': 0.2413421659802742}. Best is trial 1464 with value: 0.8990825688073395.
[32m[I 2023-04-21 00:57:40,357][39m Trial 5499 finished with value: 0.8785046728971961 and parameters: {'objective': 'Logloss', 'colsample_bylevel': 0.09554622167139097, 'depth': 10, 'boosting_type': 'Plain', 'bootstrap_type': 'Bayesian', 'bagging_temperature': 6.829833213794535}. Best is trial 1464 with value: 0.8990825688073395.
[32m[I 2023-04-21 00:57:41,974][39m Trial 5500 finished with value: 0.8727272727272727 and parameters: {'objective': 'Logloss', 'colsample_bylevel': 0.08742313395794007, 'depth': 9, 'boosting_type': 'Plain', 'bootstrap_type': 'Bayesian', 'bagging_temperature': 4.4861033042319}. Best is trial 1464 with value: 0.8990825688073395.
[32m[I 2023-04-21 00:57:43,497][39m Trial 5501 finished with value: 0.8672566371681416 and parameters: {'objective': 'Logloss', 'colsample_bylevel': 0.09851041266385185, 'depth': 9, 'boosting_type': 'Plain', 'bootstrap_type': 'MVS'}. Best is trial 1464 with value: 0.8990825688073395.
[32m[I 2023-04-21 00:57:44,801][39m Trial 5502 finished with value: 0.8703703703703703 and parameters: {'objective': 'Logloss', 'colsample_bylevel': 0.09828642953262082, 'depth': 6, 'boosting_type': 'Plain', 'bootstrap_type': 'Bayesian', 'bagging_temperature': 4.130349043023054}. Best is trial 1464 with value: 0.8990825688073395.
[32m[I 2023-04-21 00:57:45,850][39m Trial 5503 finished with value: 0.8727272727272727 and parameters: {'objective': 'Logloss', 'colsample_bylevel': 0.09610135644875699, 'depth': 10, 'boosting_type': 'Plain', 'bootstrap_type': 'Bayesian', 'bagging_temperature': 4.584594982740563}. Best is trial 1464 with value: 0.8990825688073395.
[32m[I 2023-04-21 00:57:47,468][39m Trial 5504 finished with value: 0.888888888888889 and parameters: {'objective': 'Logloss', 'colsample_bylevel': 0.09774593878497981, 'depth': 8, 'boosting_type': 'Plain', 'bootstrap_type': 'Bayesian', 'bagging_temperature': 2.9360811040893458}. Best is trial 1464 with value: 0.8990825688073395.
[32m[I 2023-04-21 00:57:48,529][39m Trial 5505 finished with value: 0.8807339449541284 and parameters: {'objective': 'CrossEntropy', 'colsample_bylevel': 0.08218413495862589, 'depth': 10, 'boosting_type': 'Plain', 'bootstrap_type': 'Bayesian', 'bagging_temperature': 6.7853650514504285}. Best is trial 1464 with value: 0.8990825688073395.
[32m[I 2023-04-21 00:57:49,341][39m Trial 5506 finished with value: 0.8571428571428572 and parameters: {'objective': 'Logloss', 'colsample_bylevel': 0.09431424513393001, 'depth': 10, 'boosting_type': 'Plain', 'bootstrap_type': 'Bayesian', 'bagging_temperature': 6.087183825895683}. Best is trial 1464 with value: 0.8990825688073395.
[32m[I 2023-04-21 00:57:50,258][39m Trial 5507 finished with value: 0.8828828828828829 and parameters: {'objective': 'CrossEntropy', 'colsample_bylevel': 0.08366499324284514, 'depth': 12, 'boosting_type': 'Plain', 'bootstrap_type': 'Bayesian', 'bagging_temperature': 4.700949642697111}. Best is trial 1464 with value: 0.8990825688073395.
[32m[I 2023-04-21 00:57:51,565][39m Trial 5508 finished with value: 0.875 and parameters: {'objective': 'CrossEntropy', 'colsample_bylevel': 0.08491170183671821, 'depth': 12, 'boosting_type': 'Plain', 'bootstrap_type': 'Bayesian', 'bagging_temperature': 4.9728472213770285}. Best is trial 1464 with value: 0.8990825688073395.
[32m[I 2023-04-21 00:57:52,298][39m Trial 5509 finished with value: 0.8807339449541284 and parameters: {'objective': 'CrossEntropy', 'colsample_bylevel': 0.09217721096962528, 'depth': 11, 'boosting_type': 'Plain', 'bootstrap_type': 'Bayesian', 'bagging_temperature': 5.515161410733344}. Best is trial 1464 with value: 0.8990825688073395.
[32m[I 2023-04-21 00:57:53,161][39m Trial 5510 finished with value: 0.8571428571428572 and parameters: {'objective': 'CrossEntropy', 'colsample_bylevel': 0.08430513076985108, 'depth': 12, 'boosting_type': 'Plain', 'bootstrap_type': 'Bayesian', 'bagging_temperature': 4.7329737127767455}. Best is trial 1464 with value: 0.8990825688073395.
[32m[I 2023-04-21 00:57:54,586][39m Trial 5511 finished with value: 0.875 and parameters: {'objective': 'Logloss', 'colsample_bylevel': 0.09619166004900595, 'depth': 9, 'boosting_type': 'Plain', 'bootstrap_type': 'Bayesian', 'bagging_temperature': 7.4231136880373745}. Best is trial 1464 with value: 0.8990825688073395.
[32m[I 2023-04-21 00:57:55,864][39m Trial 5512 finished with value: 0.8623853211009175 and parameters: {'objective': 'CrossEntropy', 'colsample_bylevel': 0.09739700375016998, 'depth': 8, 'boosting_type': 'Plain', 'bootstrap_type': 'Bayesian', 'bagging_temperature': 6.186345200729707}. Best is trial 1464 with value: 0.8990825688073395.
[32m[I 2023-04-21 00:57:57,852][39m Trial 5513 finished with value: 0.8623853211009175 and parameters: {'objective': 'Logloss', 'colsample_bylevel': 0.09338725867814783, 'depth': 9, 'boosting_type': 'Plain', 'bootstrap_type': 'Bayesian', 'bagging_temperature': 5.744720350216341}. Best is trial 1464 with value: 0.8990825688073395.
[32m[I 2023-04-21 00:57:59,032][39m Trial 5514 finished with value: 0.888888888888889 and parameters: {'objective': 'CrossEntropy', 'colsample_bylevel': 0.08540049306790176, 'depth': 11, 'boosting_type': 'Plain', 'bootstrap_type': 'Bayesian', 'bagging_temperature': 4.610333367194641}. Best is trial 1464 with value: 0.8990825688073395.
[32m[I 2023-04-21 00:58:03,691][39m Trial 5515 finished with value: 0.8421052631578947 and parameters: {'objective': 'Logloss', 'colsample_bylevel': 0.09780468654694419, 'depth': 7, 'boosting_type': 'Ordered', 'bootstrap_type': 'Bayesian', 'bagging_temperature': 3.479035476829584}. Best is trial 1464 with value: 0.8990825688073395.
[32m[I 2023-04-21 00:58:04,732][39m Trial 5516 finished with value: 0.8305084745762712 and parameters: {'objective': 'CrossEntropy', 'colsample_bylevel': 0.029662871810729838, 'depth': 8, 'boosting_type': 'Plain', 'bootstrap_type': 'Bayesian', 'bagging_temperature': 5.097114760243705}. Best is trial 1464 with value: 0.8990825688073395.
[32m[I 2023-04-21 00:58:06,543][39m Trial 5517 finished with value: 0.8571428571428572 and parameters: {'objective': 'Logloss', 'colsample_bylevel': 0.09478894346172186, 'depth': 8, 'boosting_type': 'Plain', 'bootstrap_type': 'Bayesian', 'bagging_temperature': 5.150956319137453}. Best is trial 1464 with value: 0.8990825688073395.
[32m[I 2023-04-21 00:58:07,441][39m Trial 5518 finished with value: 0.8727272727272727 and parameters: {'objective': 'Logloss', 'colsample_bylevel': 0.0981951417915736, 'depth': 6, 'boosting_type': 'Plain', 'bootstrap_type': 'Bayesian', 'bagging_temperature': 5.4833380387872905}. Best is trial 1464 with value: 0.8990825688073395.
[32m[I 2023-04-21 00:58:08,628][39m Trial 5519 finished with value: 0.8807339449541284 and parameters: {'objective': 'Logloss', 'colsample_bylevel': 0.09370599027190865, 'depth': 7, 'boosting_type': 'Plain', 'bootstrap_type': 'Bayesian', 'bagging_temperature': 5.346802457672639}. Best is trial 1464 with value: 0.8990825688073395.
[32m[I 2023-04-21 00:58:09,724][39m Trial 5520 finished with value: 0.8727272727272727 and parameters: {'objective': 'Logloss', 'colsample_bylevel': 0.09360363798833286, 'depth': 7, 'boosting_type': 'Plain', 'bootstrap_type': 'Bayesian', 'bagging_temperature': 5.362544713389097}. Best is trial 1464 with value: 0.8990825688073395.
[32m[I 2023-04-21 00:58:11,312][39m Trial 5521 finished with value: 0.8807339449541284 and parameters: {'objective': 'Logloss', 'colsample_bylevel': 0.08675802423732484, 'depth': 9, 'boosting_type': 'Plain', 'bootstrap_type': 'Bayesian', 'bagging_temperature': 5.058615174986103}. Best is trial 1464 with value: 0.8990825688073395.
[32m[I 2023-04-21 00:58:12,709][39m Trial 5522 finished with value: 0.8672566371681416 and parameters: {'objective': 'Logloss', 'colsample_bylevel': 0.09644138895743887, 'depth': 11, 'boosting_type': 'Plain', 'bootstrap_type': 'Bernoulli', 'subsample': 0.3297105354500907}. Best is trial 1464 with value: 0.8990825688073395.
[32m[I 2023-04-21 00:58:13,910][39m Trial 5523 finished with value: 0.8727272727272727 and parameters: {'objective': 'Logloss', 'colsample_bylevel': 0.09559463044716378, 'depth': 8, 'boosting_type': 'Plain', 'bootstrap_type': 'Bayesian', 'bagging_temperature': 6.467621809787652}. Best is trial 1464 with value: 0.8990825688073395.
[32m[I 2023-04-21 00:58:15,094][39m Trial 5524 finished with value: 0.890909090909091 and parameters: {'objective': 'Logloss', 'colsample_bylevel': 0.0946530919305882, 'depth': 9, 'boosting_type': 'Plain', 'bootstrap_type': 'Bayesian', 'bagging_temperature': 5.965579650886571}. Best is trial 1464 with value: 0.8990825688073395.
[32m[I 2023-04-21 00:58:16,026][39m Trial 5525 finished with value: 0.8648648648648648 and parameters: {'objective': 'Logloss', 'colsample_bylevel': 0.08742784906452587, 'depth': 12, 'boosting_type': 'Plain', 'bootstrap_type': 'Bayesian', 'bagging_temperature': 5.264141746328542}. Best is trial 1464 with value: 0.8990825688073395.
