[32m[I 2023-04-21 00:34:29,910][39m Trial 4478 finished with value: 0.8495575221238938 and parameters: {'objective': 'CrossEntropy', 'colsample_bylevel': 0.09579347239369819, 'depth': 9, 'boosting_type': 'Plain', 'bootstrap_type': 'MVS'}. Best is trial 1464 with value: 0.8990825688073395.
[32m[I 2023-04-21 00:34:30,678][39m Trial 4479 finished with value: 0.8672566371681416 and parameters: {'objective': 'Logloss', 'colsample_bylevel': 0.0981818209093348, 'depth': 7, 'boosting_type': 'Plain', 'bootstrap_type': 'Bayesian', 'bagging_temperature': 4.930336218703516}. Best is trial 1464 with value: 0.8990825688073395.
[32m[I 2023-04-21 00:34:32,243][39m Trial 4480 finished with value: 0.8828828828828829 and parameters: {'objective': 'CrossEntropy', 'colsample_bylevel': 0.08366167141312021, 'depth': 12, 'boosting_type': 'Plain', 'bootstrap_type': 'Bayesian', 'bagging_temperature': 6.101678302815913}. Best is trial 1464 with value: 0.8990825688073395.
[32m[I 2023-04-21 00:34:33,351][39m Trial 4481 finished with value: 0.8807339449541284 and parameters: {'objective': 'Logloss', 'colsample_bylevel': 0.09226869963244183, 'depth': 12, 'boosting_type': 'Plain', 'bootstrap_type': 'Bayesian', 'bagging_temperature': 5.399228849097305}. Best is trial 1464 with value: 0.8990825688073395.
[32m[I 2023-04-21 00:34:34,568][39m Trial 4482 finished with value: 0.8807339449541284 and parameters: {'objective': 'Logloss', 'colsample_bylevel': 0.09375832293547838, 'depth': 12, 'boosting_type': 'Plain', 'bootstrap_type': 'Bayesian', 'bagging_temperature': 5.985396720457854}. Best is trial 1464 with value: 0.8990825688073395.
[32m[I 2023-04-21 00:34:39,952][39m Trial 4483 finished with value: 0.8571428571428572 and parameters: {'objective': 'Logloss', 'colsample_bylevel': 0.09996512182090228, 'depth': 12, 'boosting_type': 'Ordered', 'bootstrap_type': 'Bayesian', 'bagging_temperature': 4.751261458761215}. Best is trial 1464 with value: 0.8990825688073395.
[32m[I 2023-04-21 00:34:41,094][39m Trial 4484 finished with value: 0.8727272727272727 and parameters: {'objective': 'Logloss', 'colsample_bylevel': 0.0954302074804171, 'depth': 12, 'boosting_type': 'Plain', 'bootstrap_type': 'Bayesian', 'bagging_temperature': 6.259928336529119}. Best is trial 1464 with value: 0.8990825688073395.
[32m[I 2023-04-21 00:34:42,125][39m Trial 4485 finished with value: 0.8648648648648648 and parameters: {'objective': 'Logloss', 'colsample_bylevel': 0.08768455750152615, 'depth': 12, 'boosting_type': 'Plain', 'bootstrap_type': 'Bayesian', 'bagging_temperature': 5.57038502353975}. Best is trial 1464 with value: 0.8990825688073395.
[32m[I 2023-04-21 00:34:43,386][39m Trial 4486 finished with value: 0.888888888888889 and parameters: {'objective': 'Logloss', 'colsample_bylevel': 0.09473709644594346, 'depth': 12, 'boosting_type': 'Plain', 'bootstrap_type': 'Bayesian', 'bagging_temperature': 7.446020592099023}. Best is trial 1464 with value: 0.8990825688073395.
[32m[I 2023-04-21 00:34:44,912][39m Trial 4487 finished with value: 0.888888888888889 and parameters: {'objective': 'CrossEntropy', 'colsample_bylevel': 0.09352851461480874, 'depth': 10, 'boosting_type': 'Plain', 'bootstrap_type': 'Bayesian', 'bagging_temperature': 6.282213338433499}. Best is trial 1464 with value: 0.8990825688073395.
[32m[I 2023-04-21 00:34:45,874][39m Trial 4488 finished with value: 0.875 and parameters: {'objective': 'CrossEntropy', 'colsample_bylevel': 0.08535582891952462, 'depth': 9, 'boosting_type': 'Plain', 'bootstrap_type': 'Bayesian', 'bagging_temperature': 5.290821226437127}. Best is trial 1464 with value: 0.8990825688073395.
[32m[I 2023-04-21 00:34:46,725][39m Trial 4489 finished with value: 0.875 and parameters: {'objective': 'Logloss', 'colsample_bylevel': 0.08971816064521793, 'depth': 11, 'boosting_type': 'Plain', 'bootstrap_type': 'Bayesian', 'bagging_temperature': 5.475050520898792}. Best is trial 1464 with value: 0.8990825688073395.
[32m[I 2023-04-21 00:34:47,876][39m Trial 4490 finished with value: 0.8727272727272727 and parameters: {'objective': 'CrossEntropy', 'colsample_bylevel': 0.08614283137440079, 'depth': 12, 'boosting_type': 'Plain', 'bootstrap_type': 'Bayesian', 'bagging_temperature': 6.274029458095506}. Best is trial 1464 with value: 0.8990825688073395.
[32m[I 2023-04-21 00:34:49,234][39m Trial 4491 finished with value: 0.8807339449541284 and parameters: {'objective': 'Logloss', 'colsample_bylevel': 0.08802984752343158, 'depth': 12, 'boosting_type': 'Plain', 'bootstrap_type': 'Bayesian', 'bagging_temperature': 4.997763680970945}. Best is trial 1464 with value: 0.8990825688073395.
[32m[I 2023-04-21 00:34:50,476][39m Trial 4492 finished with value: 0.888888888888889 and parameters: {'objective': 'Logloss', 'colsample_bylevel': 0.088175785410964, 'depth': 12, 'boosting_type': 'Plain', 'bootstrap_type': 'Bayesian', 'bagging_temperature': 6.899638401837926}. Best is trial 1464 with value: 0.8990825688073395.
[32m[I 2023-04-21 00:34:51,192][39m Trial 4493 finished with value: 0.888888888888889 and parameters: {'objective': 'CrossEntropy', 'colsample_bylevel': 0.08617024492580772, 'depth': 12, 'boosting_type': 'Plain', 'bootstrap_type': 'Bayesian', 'bagging_temperature': 5.260125720090419}. Best is trial 1464 with value: 0.8990825688073395.
[32m[I 2023-04-21 00:34:52,235][39m Trial 4494 finished with value: 0.8571428571428572 and parameters: {'objective': 'Logloss', 'colsample_bylevel': 0.08242667968185437, 'depth': 8, 'boosting_type': 'Plain', 'bootstrap_type': 'Bayesian', 'bagging_temperature': 5.623473277692966}. Best is trial 1464 with value: 0.8990825688073395.
[32m[I 2023-04-21 00:34:53,506][39m Trial 4495 finished with value: 0.8347826086956522 and parameters: {'objective': 'Logloss', 'colsample_bylevel': 0.08324522986054286, 'depth': 6, 'boosting_type': 'Plain', 'bootstrap_type': 'Bayesian', 'bagging_temperature': 4.930774216562384}. Best is trial 1464 with value: 0.8990825688073395.
[32m[I 2023-04-21 00:34:54,573][39m Trial 4496 finished with value: 0.8807339449541284 and parameters: {'objective': 'CrossEntropy', 'colsample_bylevel': 0.09457398932296404, 'depth': 12, 'boosting_type': 'Plain', 'bootstrap_type': 'Bernoulli', 'subsample': 0.36574026158137696}. Best is trial 1464 with value: 0.8990825688073395.
[32m[I 2023-04-21 00:34:55,950][39m Trial 4497 finished with value: 0.8807339449541284 and parameters: {'objective': 'CrossEntropy', 'colsample_bylevel': 0.08606300195106006, 'depth': 12, 'boosting_type': 'Plain', 'bootstrap_type': 'Bayesian', 'bagging_temperature': 4.731736784265879}. Best is trial 1464 with value: 0.8990825688073395.
[32m[I 2023-04-21 00:34:57,097][39m Trial 4498 finished with value: 0.8727272727272727 and parameters: {'objective': 'Logloss', 'colsample_bylevel': 0.09078683474041764, 'depth': 12, 'boosting_type': 'Plain', 'bootstrap_type': 'Bayesian', 'bagging_temperature': 5.1140744117203445}. Best is trial 1464 with value: 0.8990825688073395.
[32m[I 2023-04-21 00:34:57,835][39m Trial 4499 finished with value: 0.8807339449541284 and parameters: {'objective': 'CrossEntropy', 'colsample_bylevel': 0.0982620926088551, 'depth': 12, 'boosting_type': 'Plain', 'bootstrap_type': 'Bayesian', 'bagging_temperature': 4.594753751921314}. Best is trial 1464 with value: 0.8990825688073395.
[32m[I 2023-04-21 00:34:58,932][39m Trial 4500 finished with value: 0.8571428571428572 and parameters: {'objective': 'Logloss', 'colsample_bylevel': 0.0848707648148454, 'depth': 12, 'boosting_type': 'Plain', 'bootstrap_type': 'Bayesian', 'bagging_temperature': 5.128863999770967}. Best is trial 1464 with value: 0.8990825688073395.
[32m[I 2023-04-21 00:34:59,816][39m Trial 4501 finished with value: 0.8596491228070176 and parameters: {'objective': 'CrossEntropy', 'colsample_bylevel': 0.09986627837333761, 'depth': 12, 'boosting_type': 'Plain', 'bootstrap_type': 'MVS'}. Best is trial 1464 with value: 0.8990825688073395.
[32m[I 2023-04-21 00:35:00,831][39m Trial 4502 finished with value: 0.8672566371681416 and parameters: {'objective': 'Logloss', 'colsample_bylevel': 0.08924322488873154, 'depth': 12, 'boosting_type': 'Plain', 'bootstrap_type': 'Bayesian', 'bagging_temperature': 2.698283512287327}. Best is trial 1464 with value: 0.8990825688073395.
[32m[I 2023-04-21 00:35:06,132][39m Trial 4503 finished with value: 0.8421052631578947 and parameters: {'objective': 'Logloss', 'colsample_bylevel': 0.09357423515772746, 'depth': 12, 'boosting_type': 'Ordered', 'bootstrap_type': 'Bayesian', 'bagging_temperature': 5.395153200795187}. Best is trial 1464 with value: 0.8990825688073395.
[32m[I 2023-04-21 00:35:07,588][39m Trial 4504 finished with value: 0.8727272727272727 and parameters: {'objective': 'Logloss', 'colsample_bylevel': 0.08921394949614554, 'depth': 12, 'boosting_type': 'Plain', 'bootstrap_type': 'Bayesian', 'bagging_temperature': 5.298108737039439}. Best is trial 1464 with value: 0.8990825688073395.
[32m[I 2023-04-21 00:35:08,913][39m Trial 4505 finished with value: 0.8807339449541284 and parameters: {'objective': 'Logloss', 'colsample_bylevel': 0.09829626358835664, 'depth': 12, 'boosting_type': 'Plain', 'bootstrap_type': 'Bayesian', 'bagging_temperature': 5.584572148933951}. Best is trial 1464 with value: 0.8990825688073395.
[32m[I 2023-04-21 00:35:10,441][39m Trial 4506 finished with value: 0.888888888888889 and parameters: {'objective': 'Logloss', 'colsample_bylevel': 0.0877490718608871, 'depth': 12, 'boosting_type': 'Plain', 'bootstrap_type': 'Bayesian', 'bagging_temperature': 4.897819219182552}. Best is trial 1464 with value: 0.8990825688073395.
[32m[I 2023-04-21 00:35:11,404][39m Trial 4507 finished with value: 0.8596491228070176 and parameters: {'objective': 'Logloss', 'colsample_bylevel': 0.08640145026129868, 'depth': 12, 'boosting_type': 'Plain', 'bootstrap_type': 'Bayesian', 'bagging_temperature': 3.4584638019915457}. Best is trial 1464 with value: 0.8990825688073395.
[32m[I 2023-04-21 00:35:12,412][39m Trial 4508 finished with value: 0.8807339449541284 and parameters: {'objective': 'Logloss', 'colsample_bylevel': 0.09741030961848746, 'depth': 12, 'boosting_type': 'Plain', 'bootstrap_type': 'Bayesian', 'bagging_temperature': 4.687797032545128}. Best is trial 1464 with value: 0.8990825688073395.
[32m[I 2023-04-21 00:35:13,875][39m Trial 4509 finished with value: 0.8623853211009175 and parameters: {'objective': 'CrossEntropy', 'colsample_bylevel': 0.0971577118002965, 'depth': 12, 'boosting_type': 'Plain', 'bootstrap_type': 'Bayesian', 'bagging_temperature': 6.84259614628904}. Best is trial 1464 with value: 0.8990825688073395.
[32m[I 2023-04-21 00:35:14,594][39m Trial 4510 finished with value: 0.8828828828828829 and parameters: {'objective': 'Logloss', 'colsample_bylevel': 0.08693949653295008, 'depth': 12, 'boosting_type': 'Plain', 'bootstrap_type': 'Bayesian', 'bagging_temperature': 5.327710309450031}. Best is trial 1464 with value: 0.8990825688073395.
[32m[I 2023-04-21 00:35:15,395][39m Trial 4511 finished with value: 0.8305084745762712 and parameters: {'objective': 'Logloss', 'colsample_bylevel': 0.060063986051575605, 'depth': 12, 'boosting_type': 'Plain', 'bootstrap_type': 'Bayesian', 'bagging_temperature': 3.389431788455751}. Best is trial 1464 with value: 0.8990825688073395.
[32m[I 2023-04-21 00:35:16,606][39m Trial 4512 finished with value: 0.8807339449541284 and parameters: {'objective': 'Logloss', 'colsample_bylevel': 0.09752201009671854, 'depth': 12, 'boosting_type': 'Plain', 'bootstrap_type': 'Bayesian', 'bagging_temperature': 5.084313090600314}. Best is trial 1464 with value: 0.8990825688073395.
[32m[I 2023-04-21 00:35:17,587][39m Trial 4513 finished with value: 0.888888888888889 and parameters: {'objective': 'Logloss', 'colsample_bylevel': 0.0865085344955258, 'depth': 12, 'boosting_type': 'Plain', 'bootstrap_type': 'Bayesian', 'bagging_temperature': 4.8156295197293835}. Best is trial 1464 with value: 0.8990825688073395.
[32m[I 2023-04-21 00:35:18,245][39m Trial 4514 finished with value: 0.8571428571428572 and parameters: {'objective': 'CrossEntropy', 'colsample_bylevel': 0.0828430491007768, 'depth': 12, 'boosting_type': 'Plain', 'bootstrap_type': 'Bayesian', 'bagging_temperature': 5.489671853678202}. Best is trial 1464 with value: 0.8990825688073395.
[32m[I 2023-04-21 00:35:19,132][39m Trial 4515 finished with value: 0.8703703703703703 and parameters: {'objective': 'CrossEntropy', 'colsample_bylevel': 0.09249021755079638, 'depth': 12, 'boosting_type': 'Plain', 'bootstrap_type': 'Bayesian', 'bagging_temperature': 6.102449990607651}. Best is trial 1464 with value: 0.8990825688073395.
[32m[I 2023-04-21 00:35:20,623][39m Trial 4516 finished with value: 0.8727272727272727 and parameters: {'objective': 'Logloss', 'colsample_bylevel': 0.09053155835933181, 'depth': 11, 'boosting_type': 'Plain', 'bootstrap_type': 'Bayesian', 'bagging_temperature': 5.144879842342012}. Best is trial 1464 with value: 0.8990825688073395.
[32m[I 2023-04-21 00:35:21,814][39m Trial 4517 finished with value: 0.8727272727272727 and parameters: {'objective': 'Logloss', 'colsample_bylevel': 0.09142867065592107, 'depth': 12, 'boosting_type': 'Plain', 'bootstrap_type': 'Bayesian', 'bagging_temperature': 5.700714929792552}. Best is trial 1464 with value: 0.8990825688073395.
[32m[I 2023-04-21 00:35:22,883][39m Trial 4518 finished with value: 0.8807339449541284 and parameters: {'objective': 'Logloss', 'colsample_bylevel': 0.09155295896446974, 'depth': 12, 'boosting_type': 'Plain', 'bootstrap_type': 'Bayesian', 'bagging_temperature': 4.862230266680046}. Best is trial 1464 with value: 0.8990825688073395.
[32m[I 2023-04-21 00:35:24,137][39m Trial 4519 finished with value: 0.8672566371681416 and parameters: {'objective': 'Logloss', 'colsample_bylevel': 0.09000711256643258, 'depth': 12, 'boosting_type': 'Plain', 'bootstrap_type': 'Bernoulli', 'subsample': 0.3425099336729397}. Best is trial 1464 with value: 0.8990825688073395.
[32m[I 2023-04-21 00:35:25,420][39m Trial 4520 finished with value: 0.8648648648648648 and parameters: {'objective': 'Logloss', 'colsample_bylevel': 0.09812484943715373, 'depth': 12, 'boosting_type': 'Plain', 'bootstrap_type': 'Bayesian', 'bagging_temperature': 0.9913630407608682}. Best is trial 1464 with value: 0.8990825688073395.
[32m[I 2023-04-21 00:35:26,212][39m Trial 4521 finished with value: 0.8727272727272727 and parameters: {'objective': 'Logloss', 'colsample_bylevel': 0.08944820920582208, 'depth': 12, 'boosting_type': 'Plain', 'bootstrap_type': 'Bayesian', 'bagging_temperature': 7.07973461508328}. Best is trial 1464 with value: 0.8990825688073395.
[32m[I 2023-04-21 00:35:31,389][39m Trial 4522 finished with value: 0.8495575221238938 and parameters: {'objective': 'Logloss', 'colsample_bylevel': 0.09497832380778172, 'depth': 12, 'boosting_type': 'Ordered', 'bootstrap_type': 'MVS'}. Best is trial 1464 with value: 0.8990825688073395.
[32m[I 2023-04-21 00:35:32,624][39m Trial 4523 finished with value: 0.8545454545454546 and parameters: {'objective': 'Logloss', 'colsample_bylevel': 0.0888848039651436, 'depth': 12, 'boosting_type': 'Plain', 'bootstrap_type': 'Bayesian', 'bagging_temperature': 4.19787199861197}. Best is trial 1464 with value: 0.8990825688073395.
[32m[I 2023-04-21 00:35:33,806][39m Trial 4524 finished with value: 0.8727272727272727 and parameters: {'objective': 'Logloss', 'colsample_bylevel': 0.0956241780742817, 'depth': 12, 'boosting_type': 'Plain', 'bootstrap_type': 'Bayesian', 'bagging_temperature': 5.836035792029906}. Best is trial 1464 with value: 0.8990825688073395.
[32m[I 2023-04-21 00:35:35,047][39m Trial 4525 finished with value: 0.8807339449541284 and parameters: {'objective': 'CrossEntropy', 'colsample_bylevel': 0.09353112191443172, 'depth': 11, 'boosting_type': 'Plain', 'bootstrap_type': 'Bayesian', 'bagging_temperature': 6.823656803716075}. Best is trial 1464 with value: 0.8990825688073395.
[32m[I 2023-04-21 00:35:36,285][39m Trial 4526 finished with value: 0.8623853211009175 and parameters: {'objective': 'CrossEntropy', 'colsample_bylevel': 0.08996539936661307, 'depth': 12, 'boosting_type': 'Plain', 'bootstrap_type': 'Bayesian', 'bagging_temperature': 5.444627294041416}. Best is trial 1464 with value: 0.8990825688073395.
[32m[I 2023-04-21 00:35:37,627][39m Trial 4527 finished with value: 0.8727272727272727 and parameters: {'objective': 'CrossEntropy', 'colsample_bylevel': 0.08912106507533493, 'depth': 12, 'boosting_type': 'Plain', 'bootstrap_type': 'Bayesian', 'bagging_temperature': 5.358214358958588}. Best is trial 1464 with value: 0.8990825688073395.
[32m[I 2023-04-21 00:35:38,585][39m Trial 4528 finished with value: 0.8596491228070176 and parameters: {'objective': 'CrossEntropy', 'colsample_bylevel': 0.08752122867928344, 'depth': 12, 'boosting_type': 'Plain', 'bootstrap_type': 'Bayesian', 'bagging_temperature': 5.006755606015862}. Best is trial 1464 with value: 0.8990825688073395.
[32m[I 2023-04-21 00:35:39,582][39m Trial 4529 finished with value: 0.8672566371681416 and parameters: {'objective': 'Logloss', 'colsample_bylevel': 0.08872160449420426, 'depth': 12, 'boosting_type': 'Plain', 'bootstrap_type': 'Bayesian', 'bagging_temperature': 5.051586817193042}. Best is trial 1464 with value: 0.8990825688073395.
[32m[I 2023-04-21 00:35:40,315][39m Trial 4530 finished with value: 0.8828828828828829 and parameters: {'objective': 'Logloss', 'colsample_bylevel': 0.08853421918438141, 'depth': 12, 'boosting_type': 'Plain', 'bootstrap_type': 'Bayesian', 'bagging_temperature': 4.222729256423736}. Best is trial 1464 with value: 0.8990825688073395.
[32m[I 2023-04-21 00:35:41,654][39m Trial 4531 finished with value: 0.8807339449541284 and parameters: {'objective': 'CrossEntropy', 'colsample_bylevel': 0.09234895394434472, 'depth': 12, 'boosting_type': 'Plain', 'bootstrap_type': 'Bayesian', 'bagging_temperature': 7.268613663150584}. Best is trial 1464 with value: 0.8990825688073395.
[32m[I 2023-04-21 00:35:42,358][39m Trial 4532 finished with value: 0.8727272727272727 and parameters: {'objective': 'CrossEntropy', 'colsample_bylevel': 0.09566789026880514, 'depth': 12, 'boosting_type': 'Plain', 'bootstrap_type': 'Bayesian', 'bagging_temperature': 4.679688986314572}. Best is trial 1464 with value: 0.8990825688073395.
[32m[I 2023-04-21 00:35:43,356][39m Trial 4533 finished with value: 0.8648648648648648 and parameters: {'objective': 'Logloss', 'colsample_bylevel': 0.08461016554519102, 'depth': 11, 'boosting_type': 'Plain', 'bootstrap_type': 'Bayesian', 'bagging_temperature': 6.858422940131667}. Best is trial 1464 with value: 0.8990825688073395.
[32m[I 2023-04-21 00:35:44,456][39m Trial 4534 finished with value: 0.8727272727272727 and parameters: {'objective': 'Logloss', 'colsample_bylevel': 0.08747444764126809, 'depth': 12, 'boosting_type': 'Plain', 'bootstrap_type': 'Bayesian', 'bagging_temperature': 5.231064090252037}. Best is trial 1464 with value: 0.8990825688073395.
[32m[I 2023-04-21 00:35:45,790][39m Trial 4535 finished with value: 0.8807339449541284 and parameters: {'objective': 'CrossEntropy', 'colsample_bylevel': 0.09338505310150604, 'depth': 10, 'boosting_type': 'Plain', 'bootstrap_type': 'Bayesian', 'bagging_temperature': 6.538870644482535}. Best is trial 1464 with value: 0.8990825688073395.
[32m[I 2023-04-21 00:35:46,538][39m Trial 4536 finished with value: 0.8727272727272727 and parameters: {'objective': 'Logloss', 'colsample_bylevel': 0.08772934224010497, 'depth': 12, 'boosting_type': 'Plain', 'bootstrap_type': 'Bayesian', 'bagging_temperature': 5.540694828201715}. Best is trial 1464 with value: 0.8990825688073395.
[32m[I 2023-04-21 00:35:47,769][39m Trial 4537 finished with value: 0.8807339449541284 and parameters: {'objective': 'CrossEntropy', 'colsample_bylevel': 0.09335838852917121, 'depth': 10, 'boosting_type': 'Plain', 'bootstrap_type': 'Bayesian', 'bagging_temperature': 6.41914060444868}. Best is trial 1464 with value: 0.8990825688073395.
[32m[I 2023-04-21 00:35:49,324][39m Trial 4538 finished with value: 0.8421052631578947 and parameters: {'objective': 'Logloss', 'colsample_bylevel': 0.09213923635395926, 'depth': 8, 'boosting_type': 'Plain', 'bootstrap_type': 'Bernoulli', 'subsample': 0.8857906772622116}. Best is trial 1464 with value: 0.8990825688073395.
[32m[I 2023-04-21 00:35:50,335][39m Trial 4539 finished with value: 0.8727272727272727 and parameters: {'objective': 'Logloss', 'colsample_bylevel': 0.09812257962051077, 'depth': 12, 'boosting_type': 'Plain', 'bootstrap_type': 'Bayesian', 'bagging_temperature': 5.789212826289245}. Best is trial 1464 with value: 0.8990825688073395.
[32m[I 2023-04-21 00:35:55,716][39m Trial 4540 finished with value: 0.8495575221238938 and parameters: {'objective': 'Logloss', 'colsample_bylevel': 0.08925151591977995, 'depth': 12, 'boosting_type': 'Ordered', 'bootstrap_type': 'Bayesian', 'bagging_temperature': 6.023914033545552}. Best is trial 1464 with value: 0.8990825688073395.
[32m[I 2023-04-21 00:35:57,188][39m Trial 4541 finished with value: 0.8727272727272727 and parameters: {'objective': 'CrossEntropy', 'colsample_bylevel': 0.08949398461350763, 'depth': 12, 'boosting_type': 'Plain', 'bootstrap_type': 'Bayesian', 'bagging_temperature': 6.990659652060364}. Best is trial 1464 with value: 0.8990825688073395.
[32m[I 2023-04-21 00:35:58,233][39m Trial 4542 finished with value: 0.8807339449541284 and parameters: {'objective': 'Logloss', 'colsample_bylevel': 0.09021816505815579, 'depth': 12, 'boosting_type': 'Plain', 'bootstrap_type': 'Bayesian', 'bagging_temperature': 5.602993838010017}. Best is trial 1464 with value: 0.8990825688073395.
