[32m[I 2023-04-20 23:27:50,428][39m Trial 1458 finished with value: 0.8807339449541284 and parameters: {'objective': 'Logloss', 'colsample_bylevel': 0.09973491612042333, 'depth': 8, 'boosting_type': 'Plain', 'bootstrap_type': 'Bayesian', 'bagging_temperature': 5.612372504937861}. Best is trial 205 with value: 0.890909090909091.
[32m[I 2023-04-20 23:27:50,986][39m Trial 1459 finished with value: 0.8648648648648648 and parameters: {'objective': 'CrossEntropy', 'colsample_bylevel': 0.09519814026678287, 'depth': 11, 'boosting_type': 'Plain', 'bootstrap_type': 'Bayesian', 'bagging_temperature': 3.9702077072405437}. Best is trial 205 with value: 0.890909090909091.
[32m[I 2023-04-20 23:27:52,303][39m Trial 1460 finished with value: 0.8623853211009175 and parameters: {'objective': 'Logloss', 'colsample_bylevel': 0.09474493380960183, 'depth': 9, 'boosting_type': 'Plain', 'bootstrap_type': 'Bayesian', 'bagging_temperature': 4.4957440295912265}. Best is trial 205 with value: 0.890909090909091.
[32m[I 2023-04-20 23:27:53,201][39m Trial 1461 finished with value: 0.8275862068965517 and parameters: {'objective': 'Logloss', 'colsample_bylevel': 0.0986345223717076, 'depth': 2, 'boosting_type': 'Plain', 'bootstrap_type': 'MVS'}. Best is trial 205 with value: 0.890909090909091.
[32m[I 2023-04-20 23:27:54,367][39m Trial 1462 finished with value: 0.8376068376068375 and parameters: {'objective': 'Logloss', 'colsample_bylevel': 0.03139496392523054, 'depth': 8, 'boosting_type': 'Plain', 'bootstrap_type': 'Bayesian', 'bagging_temperature': 3.5411965733421042}. Best is trial 205 with value: 0.890909090909091.
[32m[I 2023-04-20 23:27:55,513][39m Trial 1463 finished with value: 0.888888888888889 and parameters: {'objective': 'Logloss', 'colsample_bylevel': 0.09218732671418288, 'depth': 10, 'boosting_type': 'Plain', 'bootstrap_type': 'Bayesian', 'bagging_temperature': 3.410320792982961}. Best is trial 205 with value: 0.890909090909091.
[32m[I 2023-04-20 23:27:56,215][39m Trial 1464 finished with value: 0.8990825688073395 and parameters: {'objective': 'CrossEntropy', 'colsample_bylevel': 0.0970740090707332, 'depth': 9, 'boosting_type': 'Plain', 'bootstrap_type': 'Bayesian', 'bagging_temperature': 4.806406416688799}. Best is trial 1464 with value: 0.8990825688073395.
[32m[I 2023-04-20 23:27:57,053][39m Trial 1465 finished with value: 0.8807339449541284 and parameters: {'objective': 'Logloss', 'colsample_bylevel': 0.09529903162203289, 'depth': 9, 'boosting_type': 'Plain', 'bootstrap_type': 'Bayesian', 'bagging_temperature': 3.0594043827949076}. Best is trial 1464 with value: 0.8990825688073395.
[32m[I 2023-04-20 23:27:57,997][39m Trial 1466 finished with value: 0.8807339449541284 and parameters: {'objective': 'Logloss', 'colsample_bylevel': 0.09843795809825613, 'depth': 9, 'boosting_type': 'Plain', 'bootstrap_type': 'Bayesian', 'bagging_temperature': 5.151142217370495}. Best is trial 1464 with value: 0.8990825688073395.
[32m[I 2023-04-20 23:27:58,930][39m Trial 1467 finished with value: 0.8785046728971961 and parameters: {'objective': 'Logloss', 'colsample_bylevel': 0.099806280289881, 'depth': 7, 'boosting_type': 'Plain', 'bootstrap_type': 'Bayesian', 'bagging_temperature': 3.8849739863322585}. Best is trial 1464 with value: 0.8990825688073395.
[32m[I 2023-04-20 23:28:00,193][39m Trial 1468 finished with value: 0.8727272727272727 and parameters: {'objective': 'CrossEntropy', 'colsample_bylevel': 0.09157937639590691, 'depth': 12, 'boosting_type': 'Plain', 'bootstrap_type': 'Bayesian', 'bagging_temperature': 9.927985875235311}. Best is trial 1464 with value: 0.8990825688073395.
[32m[I 2023-04-20 23:28:01,102][39m Trial 1469 finished with value: 0.8672566371681416 and parameters: {'objective': 'Logloss', 'colsample_bylevel': 0.09983342962244836, 'depth': 7, 'boosting_type': 'Plain', 'bootstrap_type': 'Bernoulli', 'subsample': 0.20937338505736214}. Best is trial 1464 with value: 0.8990825688073395.
[32m[I 2023-04-20 23:28:02,532][39m Trial 1470 finished with value: 0.8727272727272727 and parameters: {'objective': 'CrossEntropy', 'colsample_bylevel': 0.09691042523940796, 'depth': 9, 'boosting_type': 'Plain', 'bootstrap_type': 'Bernoulli', 'subsample': 0.4538213574311174}. Best is trial 1464 with value: 0.8990825688073395.
[32m[I 2023-04-20 23:28:03,375][39m Trial 1471 finished with value: 0.8703703703703703 and parameters: {'objective': 'CrossEntropy', 'colsample_bylevel': 0.0981173066103623, 'depth': 11, 'boosting_type': 'Plain', 'bootstrap_type': 'Bayesian', 'bagging_temperature': 9.248635877571807}. Best is trial 1464 with value: 0.8990825688073395.
[32m[I 2023-04-20 23:28:04,130][39m Trial 1472 finished with value: 0.8648648648648648 and parameters: {'objective': 'CrossEntropy', 'colsample_bylevel': 0.09400434221832298, 'depth': 12, 'boosting_type': 'Plain', 'bootstrap_type': 'Bernoulli', 'subsample': 0.17179260124994394}. Best is trial 1464 with value: 0.8990825688073395.
[32m[I 2023-04-20 23:28:09,189][39m Trial 1473 finished with value: 0.8571428571428572 and parameters: {'objective': 'Logloss', 'colsample_bylevel': 0.09358085049201197, 'depth': 7, 'boosting_type': 'Ordered', 'bootstrap_type': 'Bernoulli', 'subsample': 0.10291168472254845}. Best is trial 1464 with value: 0.8990825688073395.
[32m[I 2023-04-20 23:28:10,824][39m Trial 1474 finished with value: 0.8672566371681416 and parameters: {'objective': 'CrossEntropy', 'colsample_bylevel': 0.09764100631074929, 'depth': 8, 'boosting_type': 'Plain', 'bootstrap_type': 'Bernoulli', 'subsample': 0.4056299447100774}. Best is trial 1464 with value: 0.8990825688073395.
[32m[I 2023-04-20 23:28:11,817][39m Trial 1475 finished with value: 0.8727272727272727 and parameters: {'objective': 'CrossEntropy', 'colsample_bylevel': 0.09520343180466015, 'depth': 11, 'boosting_type': 'Plain', 'bootstrap_type': 'Bayesian', 'bagging_temperature': 4.483414634780518}. Best is trial 1464 with value: 0.8990825688073395.
[32m[I 2023-04-20 23:28:12,453][39m Trial 1476 finished with value: 0.8727272727272727 and parameters: {'objective': 'Logloss', 'colsample_bylevel': 0.08889687681310282, 'depth': 10, 'boosting_type': 'Plain', 'bootstrap_type': 'Bayesian', 'bagging_temperature': 3.4097853892694148}. Best is trial 1464 with value: 0.8990825688073395.
[32m[I 2023-04-20 23:28:13,312][39m Trial 1477 finished with value: 0.8571428571428572 and parameters: {'objective': 'Logloss', 'colsample_bylevel': 0.09579117769425316, 'depth': 10, 'boosting_type': 'Plain', 'bootstrap_type': 'Bayesian', 'bagging_temperature': 3.2501261525466525}. Best is trial 1464 with value: 0.8990825688073395.
[32m[I 2023-04-20 23:28:14,316][39m Trial 1478 finished with value: 0.8807339449541284 and parameters: {'objective': 'Logloss', 'colsample_bylevel': 0.09349130521504424, 'depth': 10, 'boosting_type': 'Plain', 'bootstrap_type': 'Bayesian', 'bagging_temperature': 3.0799586551526255}. Best is trial 1464 with value: 0.8990825688073395.
[32m[I 2023-04-20 23:28:15,432][39m Trial 1479 finished with value: 0.8468468468468469 and parameters: {'objective': 'Logloss', 'colsample_bylevel': 0.0915961233881608, 'depth': 6, 'boosting_type': 'Plain', 'bootstrap_type': 'Bayesian', 'bagging_temperature': 5.753322582718802}. Best is trial 1464 with value: 0.8990825688073395.
[32m[I 2023-04-20 23:28:16,505][39m Trial 1480 finished with value: 0.8727272727272727 and parameters: {'objective': 'Logloss', 'colsample_bylevel': 0.0954412708668885, 'depth': 10, 'boosting_type': 'Plain', 'bootstrap_type': 'Bayesian', 'bagging_temperature': 4.441800102219259}. Best is trial 1464 with value: 0.8990825688073395.
[32m[I 2023-04-20 23:28:18,119][39m Trial 1481 finished with value: 0.8495575221238938 and parameters: {'objective': 'Logloss', 'colsample_bylevel': 0.09328984701987234, 'depth': 8, 'boosting_type': 'Plain', 'bootstrap_type': 'Bayesian', 'bagging_temperature': 3.8512246471235505}. Best is trial 1464 with value: 0.8990825688073395.
[32m[I 2023-04-20 23:28:18,816][39m Trial 1482 finished with value: 0.8166666666666667 and parameters: {'objective': 'CrossEntropy', 'colsample_bylevel': 0.023812137452199837, 'depth': 9, 'boosting_type': 'Plain', 'bootstrap_type': 'Bayesian', 'bagging_temperature': 5.165256549808797}. Best is trial 1464 with value: 0.8990825688073395.
[32m[I 2023-04-20 23:28:19,439][39m Trial 1483 finished with value: 0.8648648648648648 and parameters: {'objective': 'Logloss', 'colsample_bylevel': 0.09086117207048372, 'depth': 6, 'boosting_type': 'Plain', 'bootstrap_type': 'Bayesian', 'bagging_temperature': 4.744508957837893}. Best is trial 1464 with value: 0.8990825688073395.
[32m[I 2023-04-20 23:28:20,681][39m Trial 1484 finished with value: 0.8727272727272727 and parameters: {'objective': 'Logloss', 'colsample_bylevel': 0.09746037983848509, 'depth': 8, 'boosting_type': 'Plain', 'bootstrap_type': 'Bayesian', 'bagging_temperature': 5.483245639464479}. Best is trial 1464 with value: 0.8990825688073395.
[32m[I 2023-04-20 23:28:21,888][39m Trial 1485 finished with value: 0.8807339449541284 and parameters: {'objective': 'Logloss', 'colsample_bylevel': 0.09621348206419308, 'depth': 9, 'boosting_type': 'Plain', 'bootstrap_type': 'Bayesian', 'bagging_temperature': 4.720289784006207}. Best is trial 1464 with value: 0.8990825688073395.
[32m[I 2023-04-20 23:28:23,123][39m Trial 1486 finished with value: 0.8571428571428572 and parameters: {'objective': 'CrossEntropy', 'colsample_bylevel': 0.0843697385498708, 'depth': 10, 'boosting_type': 'Plain', 'bootstrap_type': 'Bayesian', 'bagging_temperature': 0.5636945811594971}. Best is trial 1464 with value: 0.8990825688073395.
[32m[I 2023-04-20 23:28:24,501][39m Trial 1487 finished with value: 0.8648648648648648 and parameters: {'objective': 'Logloss', 'colsample_bylevel': 0.09473467248789036, 'depth': 12, 'boosting_type': 'Plain', 'bootstrap_type': 'Bayesian', 'bagging_temperature': 4.592857523403779}. Best is trial 1464 with value: 0.8990825688073395.
[32m[I 2023-04-20 23:28:25,386][39m Trial 1488 finished with value: 0.8727272727272727 and parameters: {'objective': 'CrossEntropy', 'colsample_bylevel': 0.09680473291931393, 'depth': 12, 'boosting_type': 'Plain', 'bootstrap_type': 'Bernoulli', 'subsample': 0.6494732911731227}. Best is trial 1464 with value: 0.8990825688073395.
[32m[I 2023-04-20 23:28:26,046][39m Trial 1489 finished with value: 0.8807339449541284 and parameters: {'objective': 'Logloss', 'colsample_bylevel': 0.09656806595453306, 'depth': 7, 'boosting_type': 'Plain', 'bootstrap_type': 'Bayesian', 'bagging_temperature': 5.3066027137628105}. Best is trial 1464 with value: 0.8990825688073395.
[32m[I 2023-04-20 23:28:31,514][39m Trial 1490 finished with value: 0.8571428571428572 and parameters: {'objective': 'Logloss', 'colsample_bylevel': 0.09694066308755804, 'depth': 7, 'boosting_type': 'Ordered', 'bootstrap_type': 'Bayesian', 'bagging_temperature': 3.9920327799917867}. Best is trial 1464 with value: 0.8990825688073395.
[32m[I 2023-04-20 23:28:33,294][39m Trial 1491 finished with value: 0.8807339449541284 and parameters: {'objective': 'Logloss', 'colsample_bylevel': 0.09999588736689206, 'depth': 9, 'boosting_type': 'Plain', 'bootstrap_type': 'Bayesian', 'bagging_temperature': 4.796685718277844}. Best is trial 1464 with value: 0.8990825688073395.
[32m[I 2023-04-20 23:28:34,608][39m Trial 1492 finished with value: 0.8623853211009175 and parameters: {'objective': 'Logloss', 'colsample_bylevel': 0.09831974609579205, 'depth': 8, 'boosting_type': 'Plain', 'bootstrap_type': 'Bayesian', 'bagging_temperature': 5.344465314455317}. Best is trial 1464 with value: 0.8990825688073395.
[32m[I 2023-04-20 23:28:35,285][39m Trial 1493 finished with value: 0.8807339449541284 and parameters: {'objective': 'CrossEntropy', 'colsample_bylevel': 0.09283242809850491, 'depth': 10, 'boosting_type': 'Plain', 'bootstrap_type': 'Bayesian', 'bagging_temperature': 4.356485587502048}. Best is trial 1464 with value: 0.8990825688073395.
[32m[I 2023-04-20 23:28:35,854][39m Trial 1494 finished with value: 0.8521739130434783 and parameters: {'objective': 'Logloss', 'colsample_bylevel': 0.041980450838429315, 'depth': 10, 'boosting_type': 'Plain', 'bootstrap_type': 'Bayesian', 'bagging_temperature': 5.973314453120134}. Best is trial 1464 with value: 0.8990825688073395.
[32m[I 2023-04-20 23:28:37,519][39m Trial 1495 finished with value: 0.8571428571428572 and parameters: {'objective': 'Logloss', 'colsample_bylevel': 0.09821503376776838, 'depth': 9, 'boosting_type': 'Plain', 'bootstrap_type': 'Bernoulli', 'subsample': 0.5556094227114169}. Best is trial 1464 with value: 0.8990825688073395.
[32m[I 2023-04-20 23:28:39,204][39m Trial 1496 finished with value: 0.8807339449541284 and parameters: {'objective': 'Logloss', 'colsample_bylevel': 0.09839198152799941, 'depth': 9, 'boosting_type': 'Plain', 'bootstrap_type': 'Bayesian', 'bagging_temperature': 4.109381410312719}. Best is trial 1464 with value: 0.8990825688073395.
[32m[I 2023-04-20 23:28:40,553][39m Trial 1497 finished with value: 0.8571428571428572 and parameters: {'objective': 'Logloss', 'colsample_bylevel': 0.09981150171666137, 'depth': 8, 'boosting_type': 'Plain', 'bootstrap_type': 'Bayesian', 'bagging_temperature': 1.859723437002398}. Best is trial 1464 with value: 0.8990825688073395.
[32m[I 2023-04-20 23:28:41,589][39m Trial 1498 finished with value: 0.8807339449541284 and parameters: {'objective': 'Logloss', 'colsample_bylevel': 0.09571496048439423, 'depth': 9, 'boosting_type': 'Plain', 'bootstrap_type': 'Bayesian', 'bagging_temperature': 5.192737380817829}. Best is trial 1464 with value: 0.8990825688073395.
[32m[I 2023-04-20 23:28:42,375][39m Trial 1499 finished with value: 0.8785046728971961 and parameters: {'objective': 'CrossEntropy', 'colsample_bylevel': 0.09592829943432918, 'depth': 9, 'boosting_type': 'Plain', 'bootstrap_type': 'Bayesian', 'bagging_temperature': 7.231340147040489}. Best is trial 1464 with value: 0.8990825688073395.
[32m[I 2023-04-20 23:28:43,078][39m Trial 1500 finished with value: 0.8727272727272727 and parameters: {'objective': 'CrossEntropy', 'colsample_bylevel': 0.09423205160191105, 'depth': 9, 'boosting_type': 'Plain', 'bootstrap_type': 'Bayesian', 'bagging_temperature': 8.84436513512266}. Best is trial 1464 with value: 0.8990825688073395.
[32m[I 2023-04-20 23:28:43,747][39m Trial 1501 finished with value: 0.8347826086956522 and parameters: {'objective': 'CrossEntropy', 'colsample_bylevel': 0.09687098580779704, 'depth': 10, 'boosting_type': 'Plain', 'bootstrap_type': 'Bernoulli', 'subsample': 0.5048045167727195}. Best is trial 1464 with value: 0.8990825688073395.
[32m[I 2023-04-20 23:28:45,037][39m Trial 1502 finished with value: 0.831858407079646 and parameters: {'objective': 'Logloss', 'colsample_bylevel': 0.09191097551663235, 'depth': 5, 'boosting_type': 'Plain', 'bootstrap_type': 'Bayesian', 'bagging_temperature': 3.253017450685375}. Best is trial 1464 with value: 0.8990825688073395.
[32m[I 2023-04-20 23:28:47,002][39m Trial 1503 finished with value: 0.8807339449541284 and parameters: {'objective': 'Logloss', 'colsample_bylevel': 0.0959934701827893, 'depth': 9, 'boosting_type': 'Plain', 'bootstrap_type': 'Bayesian', 'bagging_temperature': 3.329718218485463}. Best is trial 1464 with value: 0.8990825688073395.
[32m[I 2023-04-20 23:28:47,963][39m Trial 1504 finished with value: 0.875 and parameters: {'objective': 'Logloss', 'colsample_bylevel': 0.09451632351289764, 'depth': 7, 'boosting_type': 'Plain', 'bootstrap_type': 'Bayesian', 'bagging_temperature': 3.8501289291797347}. Best is trial 1464 with value: 0.8990825688073395.
[32m[I 2023-04-20 23:28:48,808][39m Trial 1505 finished with value: 0.8727272727272727 and parameters: {'objective': 'Logloss', 'colsample_bylevel': 0.0950319063580395, 'depth': 11, 'boosting_type': 'Plain', 'bootstrap_type': 'Bayesian', 'bagging_temperature': 4.288608210470533}. Best is trial 1464 with value: 0.8990825688073395.
[32m[I 2023-04-20 23:28:49,448][39m Trial 1506 finished with value: 0.8807339449541284 and parameters: {'objective': 'Logloss', 'colsample_bylevel': 0.09401812384464538, 'depth': 10, 'boosting_type': 'Plain', 'bootstrap_type': 'Bayesian', 'bagging_temperature': 4.573567255769761}. Best is trial 1464 with value: 0.8990825688073395.
[32m[I 2023-04-20 23:28:50,229][39m Trial 1507 finished with value: 0.8648648648648648 and parameters: {'objective': 'Logloss', 'colsample_bylevel': 0.09682060922949967, 'depth': 7, 'boosting_type': 'Plain', 'bootstrap_type': 'Bayesian', 'bagging_temperature': 4.730940502218637}. Best is trial 1464 with value: 0.8990825688073395.
[32m[I 2023-04-20 23:28:51,464][39m Trial 1508 finished with value: 0.8376068376068375 and parameters: {'objective': 'CrossEntropy', 'colsample_bylevel': 0.05111715719443038, 'depth': 8, 'boosting_type': 'Plain', 'bootstrap_type': 'MVS'}. Best is trial 1464 with value: 0.8990825688073395.
[32m[I 2023-04-20 23:28:56,474][39m Trial 1509 finished with value: 0.8421052631578947 and parameters: {'objective': 'Logloss', 'colsample_bylevel': 0.09510239403509729, 'depth': 7, 'boosting_type': 'Ordered', 'bootstrap_type': 'Bayesian', 'bagging_temperature': 4.387001802507212}. Best is trial 1464 with value: 0.8990825688073395.
[32m[I 2023-04-20 23:28:57,766][39m Trial 1510 finished with value: 0.8545454545454546 and parameters: {'objective': 'CrossEntropy', 'colsample_bylevel': 0.09284691477454132, 'depth': 9, 'boosting_type': 'Plain', 'bootstrap_type': 'Bayesian', 'bagging_temperature': 6.872695854534839}. Best is trial 1464 with value: 0.8990825688073395.
[32m[I 2023-04-20 23:28:58,843][39m Trial 1511 finished with value: 0.8807339449541284 and parameters: {'objective': 'Logloss', 'colsample_bylevel': 0.09669908118090689, 'depth': 10, 'boosting_type': 'Plain', 'bootstrap_type': 'Bayesian', 'bagging_temperature': 5.790981921664243}. Best is trial 1464 with value: 0.8990825688073395.
[32m[I 2023-04-20 23:28:59,575][39m Trial 1512 finished with value: 0.8727272727272727 and parameters: {'objective': 'Logloss', 'colsample_bylevel': 0.09868375130445158, 'depth': 8, 'boosting_type': 'Plain', 'bootstrap_type': 'Bayesian', 'bagging_temperature': 5.774400956625105}. Best is trial 1464 with value: 0.8990825688073395.
[32m[I 2023-04-20 23:29:00,628][39m Trial 1513 finished with value: 0.8727272727272727 and parameters: {'objective': 'Logloss', 'colsample_bylevel': 0.09453146506430943, 'depth': 7, 'boosting_type': 'Plain', 'bootstrap_type': 'Bayesian', 'bagging_temperature': 4.187551108632726}. Best is trial 1464 with value: 0.8990825688073395.
[32m[I 2023-04-20 23:29:01,601][39m Trial 1514 finished with value: 0.888888888888889 and parameters: {'objective': 'Logloss', 'colsample_bylevel': 0.0905269381746121, 'depth': 10, 'boosting_type': 'Plain', 'bootstrap_type': 'Bayesian', 'bagging_temperature': 5.394761552204726}. Best is trial 1464 with value: 0.8990825688073395.
[32m[I 2023-04-20 23:29:02,885][39m Trial 1515 finished with value: 0.888888888888889 and parameters: {'objective': 'CrossEntropy', 'colsample_bylevel': 0.09899067722697973, 'depth': 8, 'boosting_type': 'Plain', 'bootstrap_type': 'Bayesian', 'bagging_temperature': 4.793858077550144}. Best is trial 1464 with value: 0.8990825688073395.
[32m[I 2023-04-20 23:29:04,167][39m Trial 1516 finished with value: 0.8727272727272727 and parameters: {'objective': 'Logloss', 'colsample_bylevel': 0.09977624629335594, 'depth': 9, 'boosting_type': 'Plain', 'bootstrap_type': 'Bayesian', 'bagging_temperature': 4.906639056530706}. Best is trial 1464 with value: 0.8990825688073395.
[32m[I 2023-04-20 23:29:05,038][39m Trial 1517 finished with value: 0.8807339449541284 and parameters: {'objective': 'CrossEntropy', 'colsample_bylevel': 0.09464398140132868, 'depth': 9, 'boosting_type': 'Plain', 'bootstrap_type': 'Bayesian', 'bagging_temperature': 5.332072488184996}. Best is trial 1464 with value: 0.8990825688073395.
[32m[I 2023-04-20 23:29:05,507][39m Trial 1518 finished with value: 0.8623853211009175 and parameters: {'objective': 'CrossEntropy', 'colsample_bylevel': 0.09716557870766158, 'depth': 6, 'boosting_type': 'Plain', 'bootstrap_type': 'Bayesian', 'bagging_temperature': 5.554538984889209}. Best is trial 1464 with value: 0.8990825688073395.
[32m[I 2023-04-20 23:29:06,251][39m Trial 1519 finished with value: 0.8807339449541284 and parameters: {'objective': 'Logloss', 'colsample_bylevel': 0.09239504686949127, 'depth': 9, 'boosting_type': 'Plain', 'bootstrap_type': 'Bayesian', 'bagging_temperature': 5.0702041423282855}. Best is trial 1464 with value: 0.8990825688073395.
[32m[I 2023-04-20 23:29:07,573][39m Trial 1520 finished with value: 0.8727272727272727 and parameters: {'objective': 'CrossEntropy', 'colsample_bylevel': 0.09180700585706934, 'depth': 9, 'boosting_type': 'Plain', 'bootstrap_type': 'Bayesian', 'bagging_temperature': 1.9921724139441017}. Best is trial 1464 with value: 0.8990825688073395.
[32m[I 2023-04-20 23:29:08,666][39m Trial 1521 finished with value: 0.8807339449541284 and parameters: {'objective': 'Logloss', 'colsample_bylevel': 0.09511109053750871, 'depth': 7, 'boosting_type': 'Plain', 'bootstrap_type': 'Bayesian', 'bagging_temperature': 4.4462653416922775}. Best is trial 1464 with value: 0.8990825688073395.
[32m[I 2023-04-20 23:29:10,010][39m Trial 1522 finished with value: 0.8807339449541284 and parameters: {'objective': 'Logloss', 'colsample_bylevel': 0.09728163511791588, 'depth': 8, 'boosting_type': 'Plain', 'bootstrap_type': 'Bayesian', 'bagging_temperature': 6.293374984281774}. Best is trial 1464 with value: 0.8990825688073395.
[32m[I 2023-04-20 23:29:11,359][39m Trial 1523 finished with value: 0.8727272727272727 and parameters: {'objective': 'Logloss', 'colsample_bylevel': 0.09793330647363493, 'depth': 9, 'boosting_type': 'Plain', 'bootstrap_type': 'Bayesian', 'bagging_temperature': 6.122060479497832}. Best is trial 1464 with value: 0.8990825688073395.
