[32m[I 2023-04-21 00:07:31,823][39m Trial 3294 finished with value: 0.8571428571428572 and parameters: {'objective': 'Logloss', 'colsample_bylevel': 0.09361153594410776, 'depth': 9, 'boosting_type': 'Plain', 'bootstrap_type': 'Bayesian', 'bagging_temperature': 5.369162843540974}. Best is trial 1464 with value: 0.8990825688073395.
[32m[I 2023-04-21 00:07:33,458][39m Trial 3295 finished with value: 0.888888888888889 and parameters: {'objective': 'Logloss', 'colsample_bylevel': 0.09991463926349912, 'depth': 9, 'boosting_type': 'Plain', 'bootstrap_type': 'Bayesian', 'bagging_temperature': 7.258956863384865}. Best is trial 1464 with value: 0.8990825688073395.
[32m[I 2023-04-21 00:07:34,679][39m Trial 3296 finished with value: 0.8727272727272727 and parameters: {'objective': 'Logloss', 'colsample_bylevel': 0.09647726755241273, 'depth': 7, 'boosting_type': 'Plain', 'bootstrap_type': 'Bayesian', 'bagging_temperature': 4.35624035412356}. Best is trial 1464 with value: 0.8990825688073395.
[32m[I 2023-04-21 00:07:35,466][39m Trial 3297 finished with value: 0.8421052631578947 and parameters: {'objective': 'Logloss', 'colsample_bylevel': 0.09236580307184317, 'depth': 8, 'boosting_type': 'Plain', 'bootstrap_type': 'MVS'}. Best is trial 1464 with value: 0.8990825688073395.
[32m[I 2023-04-21 00:07:36,404][39m Trial 3298 finished with value: 0.8807339449541284 and parameters: {'objective': 'Logloss', 'colsample_bylevel': 0.09375188588779383, 'depth': 9, 'boosting_type': 'Plain', 'bootstrap_type': 'Bayesian', 'bagging_temperature': 3.9258869858890746}. Best is trial 1464 with value: 0.8990825688073395.
[32m[I 2023-04-21 00:07:37,218][39m Trial 3299 finished with value: 0.8392857142857144 and parameters: {'objective': 'Logloss', 'colsample_bylevel': 0.09105848088570889, 'depth': 6, 'boosting_type': 'Plain', 'bootstrap_type': 'Bayesian', 'bagging_temperature': 5.527831285167928}. Best is trial 1464 with value: 0.8990825688073395.
[32m[I 2023-04-21 00:07:42,730][39m Trial 3300 finished with value: 0.8495575221238938 and parameters: {'objective': 'Logloss', 'colsample_bylevel': 0.09427792302297061, 'depth': 9, 'boosting_type': 'Ordered', 'bootstrap_type': 'Bayesian', 'bagging_temperature': 4.982777540278791}. Best is trial 1464 with value: 0.8990825688073395.
[32m[I 2023-04-21 00:07:44,290][39m Trial 3301 finished with value: 0.890909090909091 and parameters: {'objective': 'Logloss', 'colsample_bylevel': 0.09451822362051862, 'depth': 9, 'boosting_type': 'Plain', 'bootstrap_type': 'Bayesian', 'bagging_temperature': 5.41739014009163}. Best is trial 1464 with value: 0.8990825688073395.
[32m[I 2023-04-21 00:07:45,543][39m Trial 3302 finished with value: 0.875 and parameters: {'objective': 'Logloss', 'colsample_bylevel': 0.09099022384335984, 'depth': 9, 'boosting_type': 'Plain', 'bootstrap_type': 'Bayesian', 'bagging_temperature': 5.389269037245743}. Best is trial 1464 with value: 0.8990825688073395.
[32m[I 2023-04-21 00:07:46,806][39m Trial 3303 finished with value: 0.8448275862068967 and parameters: {'objective': 'Logloss', 'colsample_bylevel': 0.06097329447465647, 'depth': 9, 'boosting_type': 'Plain', 'bootstrap_type': 'Bayesian', 'bagging_temperature': 5.752947017856093}. Best is trial 1464 with value: 0.8990825688073395.
[32m[I 2023-04-21 00:07:48,050][39m Trial 3304 finished with value: 0.8807339449541284 and parameters: {'objective': 'Logloss', 'colsample_bylevel': 0.09167823774451173, 'depth': 10, 'boosting_type': 'Plain', 'bootstrap_type': 'Bayesian', 'bagging_temperature': 5.779362950970764}. Best is trial 1464 with value: 0.8990825688073395.
[32m[I 2023-04-21 00:07:49,582][39m Trial 3305 finished with value: 0.8623853211009175 and parameters: {'objective': 'Logloss', 'colsample_bylevel': 0.08712557741873247, 'depth': 9, 'boosting_type': 'Plain', 'bootstrap_type': 'Bayesian', 'bagging_temperature': 5.046697815060336}. Best is trial 1464 with value: 0.8990825688073395.
[32m[I 2023-04-21 00:07:50,938][39m Trial 3306 finished with value: 0.8828828828828829 and parameters: {'objective': 'Logloss', 'colsample_bylevel': 0.09834918313643765, 'depth': 8, 'boosting_type': 'Plain', 'bootstrap_type': 'Bayesian', 'bagging_temperature': 5.235440817930202}. Best is trial 1464 with value: 0.8990825688073395.
[32m[I 2023-04-21 00:07:52,074][39m Trial 3307 finished with value: 0.8785046728971961 and parameters: {'objective': 'Logloss', 'colsample_bylevel': 0.09456854062074997, 'depth': 9, 'boosting_type': 'Plain', 'bootstrap_type': 'Bayesian', 'bagging_temperature': 4.0590299556372615}. Best is trial 1464 with value: 0.8990825688073395.
[32m[I 2023-04-21 00:07:53,324][39m Trial 3308 finished with value: 0.8571428571428572 and parameters: {'objective': 'Logloss', 'colsample_bylevel': 0.09151104402190058, 'depth': 9, 'boosting_type': 'Plain', 'bootstrap_type': 'Bayesian', 'bagging_temperature': 5.558185239950906}. Best is trial 1464 with value: 0.8990825688073395.
[32m[I 2023-04-21 00:07:54,555][39m Trial 3309 finished with value: 0.8571428571428572 and parameters: {'objective': 'Logloss', 'colsample_bylevel': 0.09417596799377648, 'depth': 9, 'boosting_type': 'Plain', 'bootstrap_type': 'Bayesian', 'bagging_temperature': 5.296891092038185}. Best is trial 1464 with value: 0.8990825688073395.
[32m[I 2023-04-21 00:07:55,747][39m Trial 3310 finished with value: 0.8623853211009175 and parameters: {'objective': 'CrossEntropy', 'colsample_bylevel': 0.09680813871560927, 'depth': 10, 'boosting_type': 'Plain', 'bootstrap_type': 'Bayesian', 'bagging_temperature': 5.945454318417375}. Best is trial 1464 with value: 0.8990825688073395.
[32m[I 2023-04-21 00:07:57,274][39m Trial 3311 finished with value: 0.8807339449541284 and parameters: {'objective': 'Logloss', 'colsample_bylevel': 0.09577280667485027, 'depth': 9, 'boosting_type': 'Plain', 'bootstrap_type': 'Bayesian', 'bagging_temperature': 5.511917808421566}. Best is trial 1464 with value: 0.8990825688073395.
[32m[I 2023-04-21 00:07:58,169][39m Trial 3312 finished with value: 0.8392857142857144 and parameters: {'objective': 'Logloss', 'colsample_bylevel': 0.08722399433093009, 'depth': 9, 'boosting_type': 'Plain', 'bootstrap_type': 'Bayesian', 'bagging_temperature': 5.019624726159502}. Best is trial 1464 with value: 0.8990825688073395.
[32m[I 2023-04-21 00:07:59,467][39m Trial 3313 finished with value: 0.888888888888889 and parameters: {'objective': 'Logloss', 'colsample_bylevel': 0.09690825676338001, 'depth': 9, 'boosting_type': 'Plain', 'bootstrap_type': 'Bayesian', 'bagging_temperature': 4.59189489806254}. Best is trial 1464 with value: 0.8990825688073395.
[32m[I 2023-04-21 00:08:00,565][39m Trial 3314 finished with value: 0.8807339449541284 and parameters: {'objective': 'Logloss', 'colsample_bylevel': 0.09216425414240434, 'depth': 9, 'boosting_type': 'Plain', 'bootstrap_type': 'Bayesian', 'bagging_temperature': 5.054798388938402}. Best is trial 1464 with value: 0.8990825688073395.
[32m[I 2023-04-21 00:08:02,386][39m Trial 3315 finished with value: 0.8421052631578947 and parameters: {'objective': 'Logloss', 'colsample_bylevel': 0.09256819774336908, 'depth': 9, 'boosting_type': 'Plain', 'bootstrap_type': 'Bernoulli', 'subsample': 0.9393279259016694}. Best is trial 1464 with value: 0.8990825688073395.
[32m[I 2023-04-21 00:08:03,533][39m Trial 3316 finished with value: 0.8807339449541284 and parameters: {'objective': 'Logloss', 'colsample_bylevel': 0.09596552833023725, 'depth': 9, 'boosting_type': 'Plain', 'bootstrap_type': 'Bayesian', 'bagging_temperature': 4.857401120806388}. Best is trial 1464 with value: 0.8990825688073395.
[32m[I 2023-04-21 00:08:04,573][39m Trial 3317 finished with value: 0.875 and parameters: {'objective': 'Logloss', 'colsample_bylevel': 0.09286681228456008, 'depth': 8, 'boosting_type': 'Plain', 'bootstrap_type': 'Bayesian', 'bagging_temperature': 5.486057200008276}. Best is trial 1464 with value: 0.8990825688073395.
[32m[I 2023-04-21 00:08:05,776][39m Trial 3318 finished with value: 0.8672566371681416 and parameters: {'objective': 'Logloss', 'colsample_bylevel': 0.09849837918721494, 'depth': 9, 'boosting_type': 'Plain', 'bootstrap_type': 'MVS'}. Best is trial 1464 with value: 0.8990825688073395.
[32m[I 2023-04-21 00:08:06,483][39m Trial 3319 finished with value: 0.8648648648648648 and parameters: {'objective': 'Logloss', 'colsample_bylevel': 0.09049459269281616, 'depth': 6, 'boosting_type': 'Plain', 'bootstrap_type': 'Bayesian', 'bagging_temperature': 4.077578303515258}. Best is trial 1464 with value: 0.8990825688073395.
[32m[I 2023-04-21 00:08:07,724][39m Trial 3320 finished with value: 0.8807339449541284 and parameters: {'objective': 'Logloss', 'colsample_bylevel': 0.0957059372535448, 'depth': 8, 'boosting_type': 'Plain', 'bootstrap_type': 'Bayesian', 'bagging_temperature': 5.25949691164237}. Best is trial 1464 with value: 0.8990825688073395.
[32m[I 2023-04-21 00:08:09,456][39m Trial 3321 finished with value: 0.8807339449541284 and parameters: {'objective': 'Logloss', 'colsample_bylevel': 0.09445487335543996, 'depth': 9, 'boosting_type': 'Plain', 'bootstrap_type': 'Bayesian', 'bagging_temperature': 5.28880977531277}. Best is trial 1464 with value: 0.8990825688073395.
[32m[I 2023-04-21 00:08:10,636][39m Trial 3322 finished with value: 0.8392857142857144 and parameters: {'objective': 'Logloss', 'colsample_bylevel': 0.08853721102874935, 'depth': 7, 'boosting_type': 'Plain', 'bootstrap_type': 'Bayesian', 'bagging_temperature': 5.436612612598706}. Best is trial 1464 with value: 0.8990825688073395.
[32m[I 2023-04-21 00:08:15,471][39m Trial 3323 finished with value: 0.8347826086956522 and parameters: {'objective': 'Logloss', 'colsample_bylevel': 0.09505568783943719, 'depth': 9, 'boosting_type': 'Ordered', 'bootstrap_type': 'Bayesian', 'bagging_temperature': 6.822750580716867}. Best is trial 1464 with value: 0.8990825688073395.
[32m[I 2023-04-21 00:08:17,072][39m Trial 3324 finished with value: 0.8785046728971961 and parameters: {'objective': 'Logloss', 'colsample_bylevel': 0.09636698996013283, 'depth': 7, 'boosting_type': 'Plain', 'bootstrap_type': 'Bayesian', 'bagging_temperature': 3.7382183379940965}. Best is trial 1464 with value: 0.8990825688073395.
[32m[I 2023-04-21 00:08:18,929][39m Trial 3325 finished with value: 0.8807339449541284 and parameters: {'objective': 'Logloss', 'colsample_bylevel': 0.09145097817654815, 'depth': 9, 'boosting_type': 'Plain', 'bootstrap_type': 'Bayesian', 'bagging_temperature': 5.74281338235873}. Best is trial 1464 with value: 0.8990825688073395.
[32m[I 2023-04-21 00:08:19,817][39m Trial 3326 finished with value: 0.8807339449541284 and parameters: {'objective': 'Logloss', 'colsample_bylevel': 0.09076170489210403, 'depth': 8, 'boosting_type': 'Plain', 'bootstrap_type': 'Bayesian', 'bagging_temperature': 5.8132786443050035}. Best is trial 1464 with value: 0.8990825688073395.
[32m[I 2023-04-21 00:08:20,640][39m Trial 3327 finished with value: 0.8703703703703703 and parameters: {'objective': 'Logloss', 'colsample_bylevel': 0.0892877664029472, 'depth': 8, 'boosting_type': 'Plain', 'bootstrap_type': 'Bayesian', 'bagging_temperature': 5.755992773122117}. Best is trial 1464 with value: 0.8990825688073395.
[32m[I 2023-04-21 00:08:21,735][39m Trial 3328 finished with value: 0.8648648648648648 and parameters: {'objective': 'Logloss', 'colsample_bylevel': 0.08100487552701548, 'depth': 10, 'boosting_type': 'Plain', 'bootstrap_type': 'Bayesian', 'bagging_temperature': 5.831756302775925}. Best is trial 1464 with value: 0.8990825688073395.
[32m[I 2023-04-21 00:08:23,306][39m Trial 3329 finished with value: 0.8648648648648648 and parameters: {'objective': 'Logloss', 'colsample_bylevel': 0.07909765924457367, 'depth': 9, 'boosting_type': 'Plain', 'bootstrap_type': 'Bayesian', 'bagging_temperature': 6.485133690708222}. Best is trial 1464 with value: 0.8990825688073395.
[32m[I 2023-04-21 00:08:24,437][39m Trial 3330 finished with value: 0.8807339449541284 and parameters: {'objective': 'Logloss', 'colsample_bylevel': 0.09223737860411267, 'depth': 7, 'boosting_type': 'Plain', 'bootstrap_type': 'Bayesian', 'bagging_temperature': 5.716947119600511}. Best is trial 1464 with value: 0.8990825688073395.
[32m[I 2023-04-21 00:08:25,551][39m Trial 3331 finished with value: 0.8727272727272727 and parameters: {'objective': 'Logloss', 'colsample_bylevel': 0.09409982343002564, 'depth': 10, 'boosting_type': 'Plain', 'bootstrap_type': 'Bayesian', 'bagging_temperature': 5.470035565286578}. Best is trial 1464 with value: 0.8990825688073395.
[32m[I 2023-04-21 00:08:26,535][39m Trial 3332 finished with value: 0.8648648648648648 and parameters: {'objective': 'CrossEntropy', 'colsample_bylevel': 0.0898153279310096, 'depth': 9, 'boosting_type': 'Plain', 'bootstrap_type': 'Bayesian', 'bagging_temperature': 5.184194060477047}. Best is trial 1464 with value: 0.8990825688073395.
[32m[I 2023-04-21 00:08:27,387][39m Trial 3333 finished with value: 0.888888888888889 and parameters: {'objective': 'Logloss', 'colsample_bylevel': 0.09852432311000946, 'depth': 8, 'boosting_type': 'Plain', 'bootstrap_type': 'Bayesian', 'bagging_temperature': 4.87121376568664}. Best is trial 1464 with value: 0.8990825688073395.
[32m[I 2023-04-21 00:08:28,071][39m Trial 3334 finished with value: 0.8807339449541284 and parameters: {'objective': 'Logloss', 'colsample_bylevel': 0.09543033954423086, 'depth': 7, 'boosting_type': 'Plain', 'bootstrap_type': 'Bayesian', 'bagging_temperature': 6.050779120093363}. Best is trial 1464 with value: 0.8990825688073395.
[32m[I 2023-04-21 00:08:29,507][39m Trial 3335 finished with value: 0.8807339449541284 and parameters: {'objective': 'Logloss', 'colsample_bylevel': 0.08803181066626624, 'depth': 9, 'boosting_type': 'Plain', 'bootstrap_type': 'Bayesian', 'bagging_temperature': 5.345927846375513}. Best is trial 1464 with value: 0.8990825688073395.
[32m[I 2023-04-21 00:08:31,111][39m Trial 3336 finished with value: 0.8495575221238938 and parameters: {'objective': 'Logloss', 'colsample_bylevel': 0.0658193789350867, 'depth': 8, 'boosting_type': 'Plain', 'bootstrap_type': 'Bayesian', 'bagging_temperature': 5.445873530612553}. Best is trial 1464 with value: 0.8990825688073395.
[32m[I 2023-04-21 00:08:32,675][39m Trial 3337 finished with value: 0.8727272727272727 and parameters: {'objective': 'Logloss', 'colsample_bylevel': 0.09385009251331897, 'depth': 9, 'boosting_type': 'Plain', 'bootstrap_type': 'Bayesian', 'bagging_temperature': 5.94357094749339}. Best is trial 1464 with value: 0.8990825688073395.
[32m[I 2023-04-21 00:08:33,323][39m Trial 3338 finished with value: 0.8205128205128206 and parameters: {'objective': 'Logloss', 'colsample_bylevel': 0.0719714178159522, 'depth': 10, 'boosting_type': 'Plain', 'bootstrap_type': 'Bernoulli', 'subsample': 0.9075495657171417}. Best is trial 1464 with value: 0.8990825688073395.
[32m[I 2023-04-21 00:08:34,006][39m Trial 3339 finished with value: 0.8727272727272727 and parameters: {'objective': 'Logloss', 'colsample_bylevel': 0.09358674498817153, 'depth': 6, 'boosting_type': 'Plain', 'bootstrap_type': 'Bayesian', 'bagging_temperature': 5.34012187304122}. Best is trial 1464 with value: 0.8990825688073395.
[32m[I 2023-04-21 00:08:35,066][39m Trial 3340 finished with value: 0.8703703703703703 and parameters: {'objective': 'Logloss', 'colsample_bylevel': 0.09179190915303323, 'depth': 8, 'boosting_type': 'Plain', 'bootstrap_type': 'Bayesian', 'bagging_temperature': 5.389847349044954}. Best is trial 1464 with value: 0.8990825688073395.
[32m[I 2023-04-21 00:08:40,524][39m Trial 3341 finished with value: 0.8347826086956522 and parameters: {'objective': 'Logloss', 'colsample_bylevel': 0.09471720074362924, 'depth': 9, 'boosting_type': 'Ordered', 'bootstrap_type': 'MVS'}. Best is trial 1464 with value: 0.8990825688073395.
[32m[I 2023-04-21 00:08:41,875][39m Trial 3342 finished with value: 0.8623853211009175 and parameters: {'objective': 'CrossEntropy', 'colsample_bylevel': 0.08899765798884426, 'depth': 8, 'boosting_type': 'Plain', 'bootstrap_type': 'Bayesian', 'bagging_temperature': 4.96927155517048}. Best is trial 1464 with value: 0.8990825688073395.
[32m[I 2023-04-21 00:08:42,796][39m Trial 3343 finished with value: 0.8448275862068967 and parameters: {'objective': 'Logloss', 'colsample_bylevel': 0.057586091158718294, 'depth': 8, 'boosting_type': 'Plain', 'bootstrap_type': 'Bayesian', 'bagging_temperature': 5.041466445932232}. Best is trial 1464 with value: 0.8990825688073395.
[32m[I 2023-04-21 00:08:44,161][39m Trial 3344 finished with value: 0.875 and parameters: {'objective': 'Logloss', 'colsample_bylevel': 0.09517695889294306, 'depth': 8, 'boosting_type': 'Plain', 'bootstrap_type': 'Bayesian', 'bagging_temperature': 5.892249320658941}. Best is trial 1464 with value: 0.8990825688073395.
[32m[I 2023-04-21 00:08:45,301][39m Trial 3345 finished with value: 0.888888888888889 and parameters: {'objective': 'Logloss', 'colsample_bylevel': 0.09425165857047436, 'depth': 7, 'boosting_type': 'Plain', 'bootstrap_type': 'Bayesian', 'bagging_temperature': 5.571593486004189}. Best is trial 1464 with value: 0.8990825688073395.
[32m[I 2023-04-21 00:08:46,879][39m Trial 3346 finished with value: 0.8727272727272727 and parameters: {'objective': 'Logloss', 'colsample_bylevel': 0.08815334014246831, 'depth': 9, 'boosting_type': 'Plain', 'bootstrap_type': 'Bayesian', 'bagging_temperature': 5.209914148358995}. Best is trial 1464 with value: 0.8990825688073395.
[32m[I 2023-04-21 00:08:47,698][39m Trial 3347 finished with value: 0.8648648648648648 and parameters: {'objective': 'Logloss', 'colsample_bylevel': 0.09098405252853839, 'depth': 7, 'boosting_type': 'Plain', 'bootstrap_type': 'Bayesian', 'bagging_temperature': 5.416323677044457}. Best is trial 1464 with value: 0.8990825688073395.
[32m[I 2023-04-21 00:08:48,922][39m Trial 3348 finished with value: 0.8807339449541284 and parameters: {'objective': 'Logloss', 'colsample_bylevel': 0.0943706627005722, 'depth': 9, 'boosting_type': 'Plain', 'bootstrap_type': 'Bayesian', 'bagging_temperature': 7.061646462312341}. Best is trial 1464 with value: 0.8990825688073395.
[32m[I 2023-04-21 00:08:49,664][39m Trial 3349 finished with value: 0.8807339449541284 and parameters: {'objective': 'Logloss', 'colsample_bylevel': 0.0973498313591175, 'depth': 8, 'boosting_type': 'Plain', 'bootstrap_type': 'Bayesian', 'bagging_temperature': 5.086135641198273}. Best is trial 1464 with value: 0.8990825688073395.
[32m[I 2023-04-21 00:08:51,112][39m Trial 3350 finished with value: 0.8807339449541284 and parameters: {'objective': 'Logloss', 'colsample_bylevel': 0.0918697299373844, 'depth': 8, 'boosting_type': 'Plain', 'bootstrap_type': 'Bayesian', 'bagging_temperature': 5.3619433015428735}. Best is trial 1464 with value: 0.8990825688073395.
[32m[I 2023-04-21 00:08:52,070][39m Trial 3351 finished with value: 0.8623853211009175 and parameters: {'objective': 'Logloss', 'colsample_bylevel': 0.09656634677432673, 'depth': 7, 'boosting_type': 'Plain', 'bootstrap_type': 'Bayesian', 'bagging_temperature': 6.282310392479497}. Best is trial 1464 with value: 0.8990825688073395.
[32m[I 2023-04-21 00:08:53,804][39m Trial 3352 finished with value: 0.8727272727272727 and parameters: {'objective': 'Logloss', 'colsample_bylevel': 0.09500754593282096, 'depth': 9, 'boosting_type': 'Plain', 'bootstrap_type': 'Bayesian', 'bagging_temperature': 6.702227835621012}. Best is trial 1464 with value: 0.8990825688073395.
[32m[I 2023-04-21 00:08:54,694][39m Trial 3353 finished with value: 0.875 and parameters: {'objective': 'CrossEntropy', 'colsample_bylevel': 0.0906771334629302, 'depth': 9, 'boosting_type': 'Plain', 'bootstrap_type': 'Bayesian', 'bagging_temperature': 4.798446544889751}. Best is trial 1464 with value: 0.8990825688073395.
[32m[I 2023-04-21 00:08:55,832][39m Trial 3354 finished with value: 0.8807339449541284 and parameters: {'objective': 'CrossEntropy', 'colsample_bylevel': 0.08968740768852923, 'depth': 9, 'boosting_type': 'Plain', 'bootstrap_type': 'Bayesian', 'bagging_temperature': 6.5364339268435305}. Best is trial 1464 with value: 0.8990825688073395.
[32m[I 2023-04-21 00:08:56,811][39m Trial 3355 finished with value: 0.8703703703703703 and parameters: {'objective': 'Logloss', 'colsample_bylevel': 0.09523650113501633, 'depth': 8, 'boosting_type': 'Plain', 'bootstrap_type': 'Bayesian', 'bagging_temperature': 5.832219600932725}. Best is trial 1464 with value: 0.8990825688073395.
[32m[I 2023-04-21 00:08:58,305][39m Trial 3356 finished with value: 0.8807339449541284 and parameters: {'objective': 'Logloss', 'colsample_bylevel': 0.09212824469782113, 'depth': 9, 'boosting_type': 'Plain', 'bootstrap_type': 'Bayesian', 'bagging_temperature': 5.733660776764509}. Best is trial 1464 with value: 0.8990825688073395.
[32m[I 2023-04-21 00:08:59,456][39m Trial 3357 finished with value: 0.8648648648648648 and parameters: {'objective': 'CrossEntropy', 'colsample_bylevel': 0.08193285206897115, 'depth': 10, 'boosting_type': 'Plain', 'bootstrap_type': 'Bayesian', 'bagging_temperature': 5.6514718498791705}. Best is trial 1464 with value: 0.8990825688073395.
[32m[I 2023-04-21 00:09:01,122][39m Trial 3358 finished with value: 0.875 and parameters: {'objective': 'Logloss', 'colsample_bylevel': 0.0933831357315854, 'depth': 9, 'boosting_type': 'Plain', 'bootstrap_type': 'Bayesian', 'bagging_temperature': 5.153365842255011}. Best is trial 1464 with value: 0.8990825688073395.
[32m[I 2023-04-21 00:09:05,620][39m Trial 3359 finished with value: 0.8347826086956522 and parameters: {'objective': 'Logloss', 'colsample_bylevel': 0.0932201498112574, 'depth': 9, 'boosting_type': 'Ordered', 'bootstrap_type': 'Bernoulli', 'subsample': 0.8477573119516069}. Best is trial 1464 with value: 0.8990825688073395.
