[32m[I 2023-04-20 23:41:29,764][39m Trial 2112 finished with value: 0.875 and parameters: {'objective': 'Logloss', 'colsample_bylevel': 0.09573659108683473, 'depth': 8, 'boosting_type': 'Plain', 'bootstrap_type': 'Bayesian', 'bagging_temperature': 7.014213363800163}. Best is trial 1464 with value: 0.8990825688073395.
[32m[I 2023-04-20 23:41:34,979][39m Trial 2113 finished with value: 0.8571428571428572 and parameters: {'objective': 'Logloss', 'colsample_bylevel': 0.09845850318610429, 'depth': 8, 'boosting_type': 'Ordered', 'bootstrap_type': 'MVS'}. Best is trial 1464 with value: 0.8990825688073395.
[32m[I 2023-04-20 23:41:35,903][39m Trial 2114 finished with value: 0.8571428571428572 and parameters: {'objective': 'CrossEntropy', 'colsample_bylevel': 0.09383856881578587, 'depth': 8, 'boosting_type': 'Plain', 'bootstrap_type': 'Bernoulli', 'subsample': 0.7129695287599327}. Best is trial 1464 with value: 0.8990825688073395.
[32m[I 2023-04-20 23:41:37,131][39m Trial 2115 finished with value: 0.8703703703703703 and parameters: {'objective': 'Logloss', 'colsample_bylevel': 0.09679319571071697, 'depth': 6, 'boosting_type': 'Plain', 'bootstrap_type': 'Bayesian', 'bagging_temperature': 5.813404602181228}. Best is trial 1464 with value: 0.8990825688073395.
[32m[I 2023-04-20 23:41:38,658][39m Trial 2116 finished with value: 0.8727272727272727 and parameters: {'objective': 'Logloss', 'colsample_bylevel': 0.08372463646929697, 'depth': 9, 'boosting_type': 'Plain', 'bootstrap_type': 'Bayesian', 'bagging_temperature': 6.445163747549889}. Best is trial 1464 with value: 0.8990825688073395.
[32m[I 2023-04-20 23:41:39,516][39m Trial 2117 finished with value: 0.8785046728971961 and parameters: {'objective': 'CrossEntropy', 'colsample_bylevel': 0.09183459220946115, 'depth': 9, 'boosting_type': 'Plain', 'bootstrap_type': 'Bayesian', 'bagging_temperature': 8.129612107779591}. Best is trial 1464 with value: 0.8990825688073395.
[32m[I 2023-04-20 23:41:40,412][39m Trial 2118 finished with value: 0.8703703703703703 and parameters: {'objective': 'Logloss', 'colsample_bylevel': 0.09580053119458899, 'depth': 7, 'boosting_type': 'Plain', 'bootstrap_type': 'Bayesian', 'bagging_temperature': 2.119511412216273}. Best is trial 1464 with value: 0.8990825688073395.
[32m[I 2023-04-20 23:41:41,053][39m Trial 2119 finished with value: 0.888888888888889 and parameters: {'objective': 'Logloss', 'colsample_bylevel': 0.09813721015067749, 'depth': 8, 'boosting_type': 'Plain', 'bootstrap_type': 'Bayesian', 'bagging_temperature': 3.898577926231649}. Best is trial 1464 with value: 0.8990825688073395.
[32m[I 2023-04-20 23:41:42,119][39m Trial 2120 finished with value: 0.8623853211009175 and parameters: {'objective': 'Logloss', 'colsample_bylevel': 0.09708795501116137, 'depth': 8, 'boosting_type': 'Plain', 'bootstrap_type': 'Bayesian', 'bagging_temperature': 6.435647410311519}. Best is trial 1464 with value: 0.8990825688073395.
[32m[I 2023-04-20 23:41:43,739][39m Trial 2121 finished with value: 0.888888888888889 and parameters: {'objective': 'Logloss', 'colsample_bylevel': 0.0958617217231511, 'depth': 9, 'boosting_type': 'Plain', 'bootstrap_type': 'Bayesian', 'bagging_temperature': 4.599730096832396}. Best is trial 1464 with value: 0.8990825688073395.
[32m[I 2023-04-20 23:41:44,930][39m Trial 2122 finished with value: 0.8648648648648648 and parameters: {'objective': 'Logloss', 'colsample_bylevel': 0.09426559903628527, 'depth': 9, 'boosting_type': 'Plain', 'bootstrap_type': 'Bayesian', 'bagging_temperature': 6.120934937490704}. Best is trial 1464 with value: 0.8990825688073395.
[32m[I 2023-04-20 23:41:45,656][39m Trial 2123 finished with value: 0.8807339449541284 and parameters: {'objective': 'Logloss', 'colsample_bylevel': 0.09994586371910814, 'depth': 10, 'boosting_type': 'Plain', 'bootstrap_type': 'Bayesian', 'bagging_temperature': 4.3358963230419105}. Best is trial 1464 with value: 0.8990825688073395.
[32m[I 2023-04-20 23:41:46,830][39m Trial 2124 finished with value: 0.8727272727272727 and parameters: {'objective': 'Logloss', 'colsample_bylevel': 0.09305013615835969, 'depth': 12, 'boosting_type': 'Plain', 'bootstrap_type': 'Bayesian', 'bagging_temperature': 4.35091812079143}. Best is trial 1464 with value: 0.8990825688073395.
[32m[I 2023-04-20 23:41:47,688][39m Trial 2125 finished with value: 0.8571428571428572 and parameters: {'objective': 'CrossEntropy', 'colsample_bylevel': 0.08797570881926826, 'depth': 10, 'boosting_type': 'Plain', 'bootstrap_type': 'Bayesian', 'bagging_temperature': 3.098119584267672}. Best is trial 1464 with value: 0.8990825688073395.
[32m[I 2023-04-20 23:41:48,942][39m Trial 2126 finished with value: 0.8727272727272727 and parameters: {'objective': 'CrossEntropy', 'colsample_bylevel': 0.0896125458445411, 'depth': 10, 'boosting_type': 'Plain', 'bootstrap_type': 'Bayesian', 'bagging_temperature': 5.250885227199279}. Best is trial 1464 with value: 0.8990825688073395.
[32m[I 2023-04-20 23:41:50,233][39m Trial 2127 finished with value: 0.8703703703703703 and parameters: {'objective': 'Logloss', 'colsample_bylevel': 0.09363070774522009, 'depth': 9, 'boosting_type': 'Plain', 'bootstrap_type': 'Bayesian', 'bagging_temperature': 5.336465802731856}. Best is trial 1464 with value: 0.8990825688073395.
[32m[I 2023-04-20 23:41:51,320][39m Trial 2128 finished with value: 0.8807339449541284 and parameters: {'objective': 'CrossEntropy', 'colsample_bylevel': 0.09597920744629013, 'depth': 8, 'boosting_type': 'Plain', 'bootstrap_type': 'Bayesian', 'bagging_temperature': 3.8927602182542347}. Best is trial 1464 with value: 0.8990825688073395.
[32m[I 2023-04-20 23:41:52,172][39m Trial 2129 finished with value: 0.8571428571428572 and parameters: {'objective': 'CrossEntropy', 'colsample_bylevel': 0.08668118600832192, 'depth': 12, 'boosting_type': 'Plain', 'bootstrap_type': 'Bernoulli', 'subsample': 0.6373579497577953}. Best is trial 1464 with value: 0.8990825688073395.
[32m[I 2023-04-20 23:41:53,400][39m Trial 2130 finished with value: 0.8807339449541284 and parameters: {'objective': 'Logloss', 'colsample_bylevel': 0.09508765697786058, 'depth': 9, 'boosting_type': 'Plain', 'bootstrap_type': 'Bayesian', 'bagging_temperature': 4.74461947497171}. Best is trial 1464 with value: 0.8990825688073395.
[32m[I 2023-04-20 23:41:54,451][39m Trial 2131 finished with value: 0.8648648648648648 and parameters: {'objective': 'CrossEntropy', 'colsample_bylevel': 0.09729346389512149, 'depth': 11, 'boosting_type': 'Plain', 'bootstrap_type': 'Bayesian', 'bagging_temperature': 4.067432002340755}. Best is trial 1464 with value: 0.8990825688073395.
[32m[I 2023-04-20 23:41:55,474][39m Trial 2132 finished with value: 0.8495575221238938 and parameters: {'objective': 'Logloss', 'colsample_bylevel': 0.0760432456619263, 'depth': 10, 'boosting_type': 'Plain', 'bootstrap_type': 'Bayesian', 'bagging_temperature': 6.395265482215845}. Best is trial 1464 with value: 0.8990825688073395.
[32m[I 2023-04-20 23:41:56,490][39m Trial 2133 finished with value: 0.890909090909091 and parameters: {'objective': 'Logloss', 'colsample_bylevel': 0.09104858149302726, 'depth': 8, 'boosting_type': 'Plain', 'bootstrap_type': 'Bayesian', 'bagging_temperature': 5.227538664228548}. Best is trial 1464 with value: 0.8990825688073395.
[32m[I 2023-04-20 23:42:01,900][39m Trial 2134 finished with value: 0.8648648648648648 and parameters: {'objective': 'Logloss', 'colsample_bylevel': 0.09996712946179119, 'depth': 8, 'boosting_type': 'Ordered', 'bootstrap_type': 'Bayesian', 'bagging_temperature': 5.364662098334891}. Best is trial 1464 with value: 0.8990825688073395.
[32m[I 2023-04-20 23:42:03,553][39m Trial 2135 finished with value: 0.8807339449541284 and parameters: {'objective': 'CrossEntropy', 'colsample_bylevel': 0.0918123901583928, 'depth': 9, 'boosting_type': 'Plain', 'bootstrap_type': 'Bayesian', 'bagging_temperature': 9.517278232812192}. Best is trial 1464 with value: 0.8990825688073395.
[32m[I 2023-04-20 23:42:04,373][39m Trial 2136 finished with value: 0.8807339449541284 and parameters: {'objective': 'Logloss', 'colsample_bylevel': 0.09090583183544307, 'depth': 10, 'boosting_type': 'Plain', 'bootstrap_type': 'Bayesian', 'bagging_temperature': 8.629863235107843}. Best is trial 1464 with value: 0.8990825688073395.
[32m[I 2023-04-20 23:42:05,142][39m Trial 2137 finished with value: 0.8571428571428572 and parameters: {'objective': 'Logloss', 'colsample_bylevel': 0.09402901852163788, 'depth': 8, 'boosting_type': 'Plain', 'bootstrap_type': 'MVS'}. Best is trial 1464 with value: 0.8990825688073395.
[32m[I 2023-04-20 23:42:06,348][39m Trial 2138 finished with value: 0.8727272727272727 and parameters: {'objective': 'Logloss', 'colsample_bylevel': 0.0910614370982872, 'depth': 11, 'boosting_type': 'Plain', 'bootstrap_type': 'Bayesian', 'bagging_temperature': 5.300488292296226}. Best is trial 1464 with value: 0.8990825688073395.
[32m[I 2023-04-20 23:42:07,351][39m Trial 2139 finished with value: 0.8545454545454546 and parameters: {'objective': 'CrossEntropy', 'colsample_bylevel': 0.08895310648953904, 'depth': 10, 'boosting_type': 'Plain', 'bootstrap_type': 'Bayesian', 'bagging_temperature': 5.935289759560311}. Best is trial 1464 with value: 0.8990825688073395.
[32m[I 2023-04-20 23:42:08,366][39m Trial 2140 finished with value: 0.8727272727272727 and parameters: {'objective': 'Logloss', 'colsample_bylevel': 0.09711987506602617, 'depth': 9, 'boosting_type': 'Plain', 'bootstrap_type': 'Bayesian', 'bagging_temperature': 5.021506425292314}. Best is trial 1464 with value: 0.8990825688073395.
[32m[I 2023-04-20 23:42:09,694][39m Trial 2141 finished with value: 0.888888888888889 and parameters: {'objective': 'CrossEntropy', 'colsample_bylevel': 0.09604035845165004, 'depth': 9, 'boosting_type': 'Plain', 'bootstrap_type': 'Bayesian', 'bagging_temperature': 6.272468175176202}. Best is trial 1464 with value: 0.8990825688073395.
[32m[I 2023-04-20 23:42:10,450][39m Trial 2142 finished with value: 0.8727272727272727 and parameters: {'objective': 'Logloss', 'colsample_bylevel': 0.08942235259338374, 'depth': 10, 'boosting_type': 'Plain', 'bootstrap_type': 'Bayesian', 'bagging_temperature': 5.009770913379886}. Best is trial 1464 with value: 0.8990825688073395.
[32m[I 2023-04-20 23:42:11,524][39m Trial 2143 finished with value: 0.8727272727272727 and parameters: {'objective': 'Logloss', 'colsample_bylevel': 0.09369870609763573, 'depth': 9, 'boosting_type': 'Plain', 'bootstrap_type': 'Bayesian', 'bagging_temperature': 4.822418710748102}. Best is trial 1464 with value: 0.8990825688073395.
[32m[I 2023-04-20 23:42:12,580][39m Trial 2144 finished with value: 0.8727272727272727 and parameters: {'objective': 'CrossEntropy', 'colsample_bylevel': 0.09044410403013894, 'depth': 10, 'boosting_type': 'Plain', 'bootstrap_type': 'Bayesian', 'bagging_temperature': 6.735253532394823}. Best is trial 1464 with value: 0.8990825688073395.
[32m[I 2023-04-20 23:42:13,475][39m Trial 2145 finished with value: 0.8807339449541284 and parameters: {'objective': 'Logloss', 'colsample_bylevel': 0.09207153204288923, 'depth': 10, 'boosting_type': 'Plain', 'bootstrap_type': 'Bayesian', 'bagging_temperature': 2.5903659331133806}. Best is trial 1464 with value: 0.8990825688073395.
[32m[I 2023-04-20 23:42:14,484][39m Trial 2146 finished with value: 0.8727272727272727 and parameters: {'objective': 'CrossEntropy', 'colsample_bylevel': 0.09411659130306288, 'depth': 10, 'boosting_type': 'Plain', 'bootstrap_type': 'Bayesian', 'bagging_temperature': 5.6100826499021865}. Best is trial 1464 with value: 0.8990825688073395.
[32m[I 2023-04-20 23:42:16,073][39m Trial 2147 finished with value: 0.8727272727272727 and parameters: {'objective': 'Logloss', 'colsample_bylevel': 0.0918484815389237, 'depth': 8, 'boosting_type': 'Plain', 'bootstrap_type': 'Bayesian', 'bagging_temperature': 5.197848561994057}. Best is trial 1464 with value: 0.8990825688073395.
[32m[I 2023-04-20 23:42:16,805][39m Trial 2148 finished with value: 0.8648648648648648 and parameters: {'objective': 'Logloss', 'colsample_bylevel': 0.09157283487602505, 'depth': 7, 'boosting_type': 'Plain', 'bootstrap_type': 'Bayesian', 'bagging_temperature': 5.493268400105483}. Best is trial 1464 with value: 0.8990825688073395.
[32m[I 2023-04-20 23:42:17,871][39m Trial 2149 finished with value: 0.8807339449541284 and parameters: {'objective': 'Logloss', 'colsample_bylevel': 0.08906901993015094, 'depth': 8, 'boosting_type': 'Plain', 'bootstrap_type': 'Bayesian', 'bagging_temperature': 5.19700824281038}. Best is trial 1464 with value: 0.8990825688073395.
[32m[I 2023-04-20 23:42:19,238][39m Trial 2150 finished with value: 0.875 and parameters: {'objective': 'Logloss', 'colsample_bylevel': 0.09688937038955923, 'depth': 8, 'boosting_type': 'Plain', 'bootstrap_type': 'Bayesian', 'bagging_temperature': 5.019919461494309}. Best is trial 1464 with value: 0.8990825688073395.
[32m[I 2023-04-20 23:42:20,046][39m Trial 2151 finished with value: 0.8807339449541284 and parameters: {'objective': 'Logloss', 'colsample_bylevel': 0.09974225320014313, 'depth': 8, 'boosting_type': 'Plain', 'bootstrap_type': 'Bayesian', 'bagging_temperature': 5.804676585592322}. Best is trial 1464 with value: 0.8990825688073395.
[32m[I 2023-04-20 23:42:25,627][39m Trial 2152 finished with value: 0.8571428571428572 and parameters: {'objective': 'Logloss', 'colsample_bylevel': 0.0956131588807516, 'depth': 8, 'boosting_type': 'Ordered', 'bootstrap_type': 'Bayesian', 'bagging_temperature': 5.373449001903537}. Best is trial 1464 with value: 0.8990825688073395.
[32m[I 2023-04-20 23:42:27,295][39m Trial 2153 finished with value: 0.8648648648648648 and parameters: {'objective': 'CrossEntropy', 'colsample_bylevel': 0.0883257863489509, 'depth': 9, 'boosting_type': 'Plain', 'bootstrap_type': 'Bayesian', 'bagging_temperature': 5.251592380806063}. Best is trial 1464 with value: 0.8990825688073395.
[32m[I 2023-04-20 23:42:28,019][39m Trial 2154 finished with value: 0.875 and parameters: {'objective': 'CrossEntropy', 'colsample_bylevel': 0.09048923775514942, 'depth': 10, 'boosting_type': 'Plain', 'bootstrap_type': 'Bayesian', 'bagging_temperature': 4.226995825579857}. Best is trial 1464 with value: 0.8990825688073395.
[32m[I 2023-04-20 23:42:28,639][39m Trial 2155 finished with value: 0.8571428571428572 and parameters: {'objective': 'CrossEntropy', 'colsample_bylevel': 0.09060088499135668, 'depth': 10, 'boosting_type': 'Plain', 'bootstrap_type': 'Bernoulli', 'subsample': 0.430896541478916}. Best is trial 1464 with value: 0.8990825688073395.
[32m[I 2023-04-20 23:42:29,545][39m Trial 2156 finished with value: 0.890909090909091 and parameters: {'objective': 'CrossEntropy', 'colsample_bylevel': 0.08766197657039243, 'depth': 10, 'boosting_type': 'Plain', 'bootstrap_type': 'Bayesian', 'bagging_temperature': 5.182813152577927}. Best is trial 1464 with value: 0.8990825688073395.
[32m[I 2023-04-20 23:42:30,762][39m Trial 2157 finished with value: 0.8807339449541284 and parameters: {'objective': 'Logloss', 'colsample_bylevel': 0.08882304907225543, 'depth': 10, 'boosting_type': 'Plain', 'bootstrap_type': 'Bayesian', 'bagging_temperature': 6.935901068024433}. Best is trial 1464 with value: 0.8990825688073395.
[32m[I 2023-04-20 23:42:31,939][39m Trial 2158 finished with value: 0.8807339449541284 and parameters: {'objective': 'CrossEntropy', 'colsample_bylevel': 0.0841235329068378, 'depth': 7, 'boosting_type': 'Plain', 'bootstrap_type': 'Bayesian', 'bagging_temperature': 4.9102837634328775}. Best is trial 1464 with value: 0.8990825688073395.
[32m[I 2023-04-20 23:42:32,972][39m Trial 2159 finished with value: 0.8571428571428572 and parameters: {'objective': 'Logloss', 'colsample_bylevel': 0.08992118589231969, 'depth': 11, 'boosting_type': 'Plain', 'bootstrap_type': 'MVS'}. Best is trial 1464 with value: 0.8990825688073395.
[32m[I 2023-04-20 23:42:34,059][39m Trial 2160 finished with value: 0.8727272727272727 and parameters: {'objective': 'CrossEntropy', 'colsample_bylevel': 0.08647830654814521, 'depth': 9, 'boosting_type': 'Plain', 'bootstrap_type': 'Bayesian', 'bagging_temperature': 6.837128766664578}. Best is trial 1464 with value: 0.8990825688073395.
[32m[I 2023-04-20 23:42:35,082][39m Trial 2161 finished with value: 0.8807339449541284 and parameters: {'objective': 'Logloss', 'colsample_bylevel': 0.09994631902303104, 'depth': 9, 'boosting_type': 'Plain', 'bootstrap_type': 'Bayesian', 'bagging_temperature': 4.632455967087568}. Best is trial 1464 with value: 0.8990825688073395.
[32m[I 2023-04-20 23:42:36,027][39m Trial 2162 finished with value: 0.8727272727272727 and parameters: {'objective': 'Logloss', 'colsample_bylevel': 0.08843277473469524, 'depth': 9, 'boosting_type': 'Plain', 'bootstrap_type': 'Bayesian', 'bagging_temperature': 5.011128912262146}. Best is trial 1464 with value: 0.8990825688073395.
[32m[I 2023-04-20 23:42:36,681][39m Trial 2163 finished with value: 0.8421052631578947 and parameters: {'objective': 'CrossEntropy', 'colsample_bylevel': 0.08598913335095655, 'depth': 10, 'boosting_type': 'Plain', 'bootstrap_type': 'Bayesian', 'bagging_temperature': 2.226024553891667}. Best is trial 1464 with value: 0.8990825688073395.
[32m[I 2023-04-20 23:42:38,260][39m Trial 2164 finished with value: 0.8727272727272727 and parameters: {'objective': 'Logloss', 'colsample_bylevel': 0.09310486034332814, 'depth': 8, 'boosting_type': 'Plain', 'bootstrap_type': 'Bayesian', 'bagging_temperature': 5.164588052613892}. Best is trial 1464 with value: 0.8990825688073395.
[32m[I 2023-04-20 23:42:39,464][39m Trial 2165 finished with value: 0.875 and parameters: {'objective': 'Logloss', 'colsample_bylevel': 0.09409609602795627, 'depth': 6, 'boosting_type': 'Plain', 'bootstrap_type': 'Bayesian', 'bagging_temperature': 5.266814631405577}. Best is trial 1464 with value: 0.8990825688073395.
[32m[I 2023-04-20 23:42:40,887][39m Trial 2166 finished with value: 0.8648648648648648 and parameters: {'objective': 'Logloss', 'colsample_bylevel': 0.0985583928630846, 'depth': 9, 'boosting_type': 'Plain', 'bootstrap_type': 'Bayesian', 'bagging_temperature': 5.47513022020182}. Best is trial 1464 with value: 0.8990825688073395.
[32m[I 2023-04-20 23:42:41,524][39m Trial 2167 finished with value: 0.8807339449541284 and parameters: {'objective': 'CrossEntropy', 'colsample_bylevel': 0.08896896779317039, 'depth': 10, 'boosting_type': 'Plain', 'bootstrap_type': 'Bayesian', 'bagging_temperature': 7.125992196193029}. Best is trial 1464 with value: 0.8990825688073395.
[32m[I 2023-04-20 23:42:42,311][39m Trial 2168 finished with value: 0.8807339449541284 and parameters: {'objective': 'Logloss', 'colsample_bylevel': 0.08924055881363657, 'depth': 8, 'boosting_type': 'Plain', 'bootstrap_type': 'Bayesian', 'bagging_temperature': 5.162648572632349}. Best is trial 1464 with value: 0.8990825688073395.
[32m[I 2023-04-20 23:42:43,803][39m Trial 2169 finished with value: 0.8807339449541284 and parameters: {'objective': 'Logloss', 'colsample_bylevel': 0.08779894973103042, 'depth': 8, 'boosting_type': 'Plain', 'bootstrap_type': 'Bayesian', 'bagging_temperature': 3.4582766980449207}. Best is trial 1464 with value: 0.8990825688073395.
[32m[I 2023-04-20 23:42:45,184][39m Trial 2170 finished with value: 0.8807339449541284 and parameters: {'objective': 'Logloss', 'colsample_bylevel': 0.09839205736516571, 'depth': 8, 'boosting_type': 'Plain', 'bootstrap_type': 'Bayesian', 'bagging_temperature': 3.7076636426703597}. Best is trial 1464 with value: 0.8990825688073395.
[32m[I 2023-04-20 23:42:49,637][39m Trial 2171 finished with value: 0.8173913043478261 and parameters: {'objective': 'Logloss', 'colsample_bylevel': 0.01914547586001237, 'depth': 10, 'boosting_type': 'Ordered', 'bootstrap_type': 'Bayesian', 'bagging_temperature': 4.278241568360734}. Best is trial 1464 with value: 0.8990825688073395.
[32m[I 2023-04-20 23:42:50,809][39m Trial 2172 finished with value: 0.8376068376068375 and parameters: {'objective': 'Logloss', 'colsample_bylevel': 0.04860730559930898, 'depth': 8, 'boosting_type': 'Plain', 'bootstrap_type': 'Bayesian', 'bagging_temperature': 5.433658893190976}. Best is trial 1464 with value: 0.8990825688073395.
[32m[I 2023-04-20 23:42:51,611][39m Trial 2173 finished with value: 0.8468468468468469 and parameters: {'objective': 'Logloss', 'colsample_bylevel': 0.0925439602312445, 'depth': 6, 'boosting_type': 'Plain', 'bootstrap_type': 'Bayesian', 'bagging_temperature': 6.519965715529652}. Best is trial 1464 with value: 0.8990825688073395.
[32m[I 2023-04-20 23:42:52,765][39m Trial 2174 finished with value: 0.8727272727272727 and parameters: {'objective': 'CrossEntropy', 'colsample_bylevel': 0.08726096591890754, 'depth': 10, 'boosting_type': 'Plain', 'bootstrap_type': 'Bernoulli', 'subsample': 0.17599172611385366}. Best is trial 1464 with value: 0.8990825688073395.
[32m[I 2023-04-20 23:42:53,777][39m Trial 2175 finished with value: 0.8495575221238938 and parameters: {'objective': 'CrossEntropy', 'colsample_bylevel': 0.08925649241011732, 'depth': 11, 'boosting_type': 'Plain', 'bootstrap_type': 'Bernoulli', 'subsample': 0.46680505588172466}. Best is trial 1464 with value: 0.8990825688073395.
[32m[I 2023-04-20 23:42:54,758][39m Trial 2176 finished with value: 0.8727272727272727 and parameters: {'objective': 'Logloss', 'colsample_bylevel': 0.09052331086276522, 'depth': 10, 'boosting_type': 'Plain', 'bootstrap_type': 'Bayesian', 'bagging_temperature': 3.720394488722888}. Best is trial 1464 with value: 0.8990825688073395.
[32m[I 2023-04-20 23:42:55,541][39m Trial 2177 finished with value: 0.8571428571428572 and parameters: {'objective': 'Logloss', 'colsample_bylevel': 0.0850394319734702, 'depth': 11, 'boosting_type': 'Plain', 'bootstrap_type': 'Bayesian', 'bagging_temperature': 8.18066497236506}. Best is trial 1464 with value: 0.8990825688073395.
