[32m[I 2023-04-21 00:03:05,052][39m Trial 3096 finished with value: 0.8623853211009175 and parameters: {'objective': 'CrossEntropy', 'colsample_bylevel': 0.09702423545596132, 'depth': 9, 'boosting_type': 'Plain', 'bootstrap_type': 'Bayesian', 'bagging_temperature': 4.434523289565499}. Best is trial 1464 with value: 0.8990825688073395.
[32m[I 2023-04-21 00:03:05,908][39m Trial 3097 finished with value: 0.8648648648648648 and parameters: {'objective': 'Logloss', 'colsample_bylevel': 0.09716637200519943, 'depth': 7, 'boosting_type': 'Plain', 'bootstrap_type': 'Bayesian', 'bagging_temperature': 3.6911425283077057}. Best is trial 1464 with value: 0.8990825688073395.
[32m[I 2023-04-21 00:03:06,905][39m Trial 3098 finished with value: 0.888888888888889 and parameters: {'objective': 'Logloss', 'colsample_bylevel': 0.09814808660067499, 'depth': 7, 'boosting_type': 'Plain', 'bootstrap_type': 'Bayesian', 'bagging_temperature': 4.15371973362976}. Best is trial 1464 with value: 0.8990825688073395.
[32m[I 2023-04-21 00:03:08,268][39m Trial 3099 finished with value: 0.8347826086956522 and parameters: {'objective': 'Logloss', 'colsample_bylevel': 0.06749682522975962, 'depth': 8, 'boosting_type': 'Plain', 'bootstrap_type': 'Bayesian', 'bagging_temperature': 5.191009414850924}. Best is trial 1464 with value: 0.8990825688073395.
[32m[I 2023-04-21 00:03:09,858][39m Trial 3100 finished with value: 0.8807339449541284 and parameters: {'objective': 'CrossEntropy', 'colsample_bylevel': 0.09381726798826033, 'depth': 8, 'boosting_type': 'Plain', 'bootstrap_type': 'Bayesian', 'bagging_temperature': 3.851640374027165}. Best is trial 1464 with value: 0.8990825688073395.
[32m[I 2023-04-21 00:03:10,540][39m Trial 3101 finished with value: 0.888888888888889 and parameters: {'objective': 'CrossEntropy', 'colsample_bylevel': 0.09019030094127782, 'depth': 7, 'boosting_type': 'Plain', 'bootstrap_type': 'Bayesian', 'bagging_temperature': 4.895892100301382}. Best is trial 1464 with value: 0.8990825688073395.
[32m[I 2023-04-21 00:03:11,223][39m Trial 3102 finished with value: 0.8807339449541284 and parameters: {'objective': 'Logloss', 'colsample_bylevel': 0.09995001179650802, 'depth': 6, 'boosting_type': 'Plain', 'bootstrap_type': 'Bayesian', 'bagging_temperature': 4.225340108114787}. Best is trial 1464 with value: 0.8990825688073395.
[32m[I 2023-04-21 00:03:12,400][39m Trial 3103 finished with value: 0.8648648648648648 and parameters: {'objective': 'CrossEntropy', 'colsample_bylevel': 0.09858213895638575, 'depth': 7, 'boosting_type': 'Plain', 'bootstrap_type': 'Bayesian', 'bagging_temperature': 5.402543141862405}. Best is trial 1464 with value: 0.8990825688073395.
[32m[I 2023-04-21 00:03:14,396][39m Trial 3104 finished with value: 0.8828828828828829 and parameters: {'objective': 'Logloss', 'colsample_bylevel': 0.0983437938829412, 'depth': 9, 'boosting_type': 'Plain', 'bootstrap_type': 'Bayesian', 'bagging_temperature': 4.621014104997604}. Best is trial 1464 with value: 0.8990825688073395.
[32m[I 2023-04-21 00:03:15,670][39m Trial 3105 finished with value: 0.8727272727272727 and parameters: {'objective': 'Logloss', 'colsample_bylevel': 0.09312742482080097, 'depth': 7, 'boosting_type': 'Plain', 'bootstrap_type': 'Bayesian', 'bagging_temperature': 5.831075892586454}. Best is trial 1464 with value: 0.8990825688073395.
[32m[I 2023-04-21 00:03:16,376][39m Trial 3106 finished with value: 0.8785046728971961 and parameters: {'objective': 'CrossEntropy', 'colsample_bylevel': 0.09571977702967666, 'depth': 9, 'boosting_type': 'Plain', 'bootstrap_type': 'Bayesian', 'bagging_temperature': 4.470242425902945}. Best is trial 1464 with value: 0.8990825688073395.
[32m[I 2023-04-21 00:03:17,158][39m Trial 3107 finished with value: 0.8703703703703703 and parameters: {'objective': 'Logloss', 'colsample_bylevel': 0.0956297059853511, 'depth': 8, 'boosting_type': 'Plain', 'bootstrap_type': 'Bayesian', 'bagging_temperature': 7.2557929867660125}. Best is trial 1464 with value: 0.8990825688073395.
[32m[I 2023-04-21 00:03:18,063][39m Trial 3108 finished with value: 0.8347826086956522 and parameters: {'objective': 'Logloss', 'colsample_bylevel': 0.04436373869757001, 'depth': 8, 'boosting_type': 'Plain', 'bootstrap_type': 'MVS'}. Best is trial 1464 with value: 0.8990825688073395.
[32m[I 2023-04-21 00:03:19,185][39m Trial 3109 finished with value: 0.8067226890756303 and parameters: {'objective': 'CrossEntropy', 'colsample_bylevel': 0.02750302756028383, 'depth': 7, 'boosting_type': 'Plain', 'bootstrap_type': 'Bayesian', 'bagging_temperature': 6.692524947212584}. Best is trial 1464 with value: 0.8990825688073395.
[32m[I 2023-04-21 00:03:20,744][39m Trial 3110 finished with value: 0.888888888888889 and parameters: {'objective': 'Logloss', 'colsample_bylevel': 0.09774936693912487, 'depth': 8, 'boosting_type': 'Plain', 'bootstrap_type': 'Bayesian', 'bagging_temperature': 4.7402964494482625}. Best is trial 1464 with value: 0.8990825688073395.
[32m[I 2023-04-21 00:03:21,471][39m Trial 3111 finished with value: 0.8545454545454546 and parameters: {'objective': 'Logloss', 'colsample_bylevel': 0.09988635987136978, 'depth': 7, 'boosting_type': 'Plain', 'bootstrap_type': 'Bayesian', 'bagging_temperature': 3.975661179438768}. Best is trial 1464 with value: 0.8990825688073395.
[32m[I 2023-04-21 00:03:22,495][39m Trial 3112 finished with value: 0.8727272727272727 and parameters: {'objective': 'CrossEntropy', 'colsample_bylevel': 0.09814298417941832, 'depth': 9, 'boosting_type': 'Plain', 'bootstrap_type': 'Bayesian', 'bagging_temperature': 4.137155542072197}. Best is trial 1464 with value: 0.8990825688073395.
[32m[I 2023-04-21 00:03:27,412][39m Trial 3113 finished with value: 0.8571428571428572 and parameters: {'objective': 'Logloss', 'colsample_bylevel': 0.0971574498575142, 'depth': 7, 'boosting_type': 'Ordered', 'bootstrap_type': 'Bayesian', 'bagging_temperature': 6.486040438764162}. Best is trial 1464 with value: 0.8990825688073395.
[32m[I 2023-04-21 00:03:28,504][39m Trial 3114 finished with value: 0.8807339449541284 and parameters: {'objective': 'Logloss', 'colsample_bylevel': 0.09841548806176575, 'depth': 7, 'boosting_type': 'Plain', 'bootstrap_type': 'Bayesian', 'bagging_temperature': 3.5171169845484975}. Best is trial 1464 with value: 0.8990825688073395.
[32m[I 2023-04-21 00:03:29,758][39m Trial 3115 finished with value: 0.8275862068965517 and parameters: {'objective': 'Logloss', 'colsample_bylevel': 0.07582466803371819, 'depth': 6, 'boosting_type': 'Plain', 'bootstrap_type': 'Bayesian', 'bagging_temperature': 7.446219285014523}. Best is trial 1464 with value: 0.8990825688073395.
[32m[I 2023-04-21 00:03:30,955][39m Trial 3116 finished with value: 0.8648648648648648 and parameters: {'objective': 'Logloss', 'colsample_bylevel': 0.09476613614700678, 'depth': 7, 'boosting_type': 'Plain', 'bootstrap_type': 'Bayesian', 'bagging_temperature': 6.173127469510283}. Best is trial 1464 with value: 0.8990825688073395.
[32m[I 2023-04-21 00:03:31,699][39m Trial 3117 finished with value: 0.8807339449541284 and parameters: {'objective': 'Logloss', 'colsample_bylevel': 0.09225731616632768, 'depth': 7, 'boosting_type': 'Plain', 'bootstrap_type': 'Bayesian', 'bagging_temperature': 3.8287243077162896}. Best is trial 1464 with value: 0.8990825688073395.
[32m[I 2023-04-21 00:03:32,918][39m Trial 3118 finished with value: 0.8545454545454546 and parameters: {'objective': 'Logloss', 'colsample_bylevel': 0.09538671994240251, 'depth': 7, 'boosting_type': 'Plain', 'bootstrap_type': 'Bayesian', 'bagging_temperature': 4.310076185842601}. Best is trial 1464 with value: 0.8990825688073395.
[32m[I 2023-04-21 00:03:34,619][39m Trial 3119 finished with value: 0.8703703703703703 and parameters: {'objective': 'CrossEntropy', 'colsample_bylevel': 0.09726460872928573, 'depth': 9, 'boosting_type': 'Plain', 'bootstrap_type': 'Bayesian', 'bagging_temperature': 4.315816255236202}. Best is trial 1464 with value: 0.8990825688073395.
[32m[I 2023-04-21 00:03:35,411][39m Trial 3120 finished with value: 0.8727272727272727 and parameters: {'objective': 'Logloss', 'colsample_bylevel': 0.09475213095818415, 'depth': 7, 'boosting_type': 'Plain', 'bootstrap_type': 'Bayesian', 'bagging_temperature': 6.07397854352604}. Best is trial 1464 with value: 0.8990825688073395.
[32m[I 2023-04-21 00:03:36,197][39m Trial 3121 finished with value: 0.888888888888889 and parameters: {'objective': 'Logloss', 'colsample_bylevel': 0.09825904259653048, 'depth': 7, 'boosting_type': 'Plain', 'bootstrap_type': 'Bayesian', 'bagging_temperature': 4.012051736956883}. Best is trial 1464 with value: 0.8990825688073395.
[32m[I 2023-04-21 00:03:37,182][39m Trial 3122 finished with value: 0.888888888888889 and parameters: {'objective': 'Logloss', 'colsample_bylevel': 0.09651240335971, 'depth': 7, 'boosting_type': 'Plain', 'bootstrap_type': 'Bayesian', 'bagging_temperature': 4.139919937920965}. Best is trial 1464 with value: 0.8990825688073395.
[32m[I 2023-04-21 00:03:38,046][39m Trial 3123 finished with value: 0.8785046728971961 and parameters: {'objective': 'CrossEntropy', 'colsample_bylevel': 0.09813026557708916, 'depth': 7, 'boosting_type': 'Plain', 'bootstrap_type': 'Bayesian', 'bagging_temperature': 5.070580545186393}. Best is trial 1464 with value: 0.8990825688073395.
[32m[I 2023-04-21 00:03:38,766][39m Trial 3124 finished with value: 0.8807339449541284 and parameters: {'objective': 'Logloss', 'colsample_bylevel': 0.09992250439374498, 'depth': 6, 'boosting_type': 'Plain', 'bootstrap_type': 'Bayesian', 'bagging_temperature': 3.7302218259223077}. Best is trial 1464 with value: 0.8990825688073395.
[32m[I 2023-04-21 00:03:39,663][39m Trial 3125 finished with value: 0.8807339449541284 and parameters: {'objective': 'Logloss', 'colsample_bylevel': 0.09173930335043537, 'depth': 7, 'boosting_type': 'Plain', 'bootstrap_type': 'Bayesian', 'bagging_temperature': 3.7665512171146807}. Best is trial 1464 with value: 0.8990825688073395.
[32m[I 2023-04-21 00:03:40,563][39m Trial 3126 finished with value: 0.8727272727272727 and parameters: {'objective': 'CrossEntropy', 'colsample_bylevel': 0.09670459041892306, 'depth': 6, 'boosting_type': 'Plain', 'bootstrap_type': 'Bayesian', 'bagging_temperature': 3.4239620433426357}. Best is trial 1464 with value: 0.8990825688073395.
[32m[I 2023-04-21 00:03:41,699][39m Trial 3127 finished with value: 0.8703703703703703 and parameters: {'objective': 'CrossEntropy', 'colsample_bylevel': 0.09850043309571756, 'depth': 7, 'boosting_type': 'Plain', 'bootstrap_type': 'Bayesian', 'bagging_temperature': 4.004489905317721}. Best is trial 1464 with value: 0.8990825688073395.
[32m[I 2023-04-21 00:03:42,505][39m Trial 3128 finished with value: 0.8672566371681416 and parameters: {'objective': 'CrossEntropy', 'colsample_bylevel': 0.0910947639253538, 'depth': 8, 'boosting_type': 'Plain', 'bootstrap_type': 'MVS'}. Best is trial 1464 with value: 0.8990825688073395.
[32m[I 2023-04-21 00:03:43,693][39m Trial 3129 finished with value: 0.8727272727272727 and parameters: {'objective': 'Logloss', 'colsample_bylevel': 0.09442342686510123, 'depth': 7, 'boosting_type': 'Plain', 'bootstrap_type': 'Bayesian', 'bagging_temperature': 3.393181066979672}. Best is trial 1464 with value: 0.8990825688073395.
[32m[I 2023-04-21 00:03:44,676][39m Trial 3130 finished with value: 0.8828828828828829 and parameters: {'objective': 'Logloss', 'colsample_bylevel': 0.09265424569857027, 'depth': 8, 'boosting_type': 'Plain', 'bootstrap_type': 'Bayesian', 'bagging_temperature': 5.431944303413135}. Best is trial 1464 with value: 0.8990825688073395.
[32m[I 2023-04-21 00:03:45,628][39m Trial 3131 finished with value: 0.8571428571428572 and parameters: {'objective': 'Logloss', 'colsample_bylevel': 0.08973770204883784, 'depth': 7, 'boosting_type': 'Plain', 'bootstrap_type': 'Bayesian', 'bagging_temperature': 5.729960337767829}. Best is trial 1464 with value: 0.8990825688073395.
[32m[I 2023-04-21 00:03:46,813][39m Trial 3132 finished with value: 0.8807339449541284 and parameters: {'objective': 'CrossEntropy', 'colsample_bylevel': 0.0926775072939386, 'depth': 8, 'boosting_type': 'Plain', 'bootstrap_type': 'Bayesian', 'bagging_temperature': 6.194126044259285}. Best is trial 1464 with value: 0.8990825688073395.
[32m[I 2023-04-21 00:03:52,125][39m Trial 3133 finished with value: 0.8468468468468469 and parameters: {'objective': 'CrossEntropy', 'colsample_bylevel': 0.09603985929513438, 'depth': 7, 'boosting_type': 'Ordered', 'bootstrap_type': 'Bayesian', 'bagging_temperature': 5.024432592478385}. Best is trial 1464 with value: 0.8990825688073395.
[32m[I 2023-04-21 00:03:53,882][39m Trial 3134 finished with value: 0.8807339449541284 and parameters: {'objective': 'CrossEntropy', 'colsample_bylevel': 0.09567472442281127, 'depth': 9, 'boosting_type': 'Plain', 'bootstrap_type': 'Bayesian', 'bagging_temperature': 7.022424454170969}. Best is trial 1464 with value: 0.8990825688073395.
[32m[I 2023-04-21 00:03:54,701][39m Trial 3135 finished with value: 0.8807339449541284 and parameters: {'objective': 'Logloss', 'colsample_bylevel': 0.09852142694772116, 'depth': 7, 'boosting_type': 'Plain', 'bootstrap_type': 'Bayesian', 'bagging_temperature': 4.925364062987702}. Best is trial 1464 with value: 0.8990825688073395.
[32m[I 2023-04-21 00:03:55,501][39m Trial 3136 finished with value: 0.8727272727272727 and parameters: {'objective': 'Logloss', 'colsample_bylevel': 0.09694190120372347, 'depth': 7, 'boosting_type': 'Plain', 'bootstrap_type': 'Bayesian', 'bagging_temperature': 6.86586124537153}. Best is trial 1464 with value: 0.8990825688073395.
[32m[I 2023-04-21 00:03:56,518][39m Trial 3137 finished with value: 0.8495575221238938 and parameters: {'objective': 'Logloss', 'colsample_bylevel': 0.09850720339440913, 'depth': 6, 'boosting_type': 'Plain', 'bootstrap_type': 'Bayesian', 'bagging_temperature': 4.45095057734576}. Best is trial 1464 with value: 0.8990825688073395.
[32m[I 2023-04-21 00:03:58,402][39m Trial 3138 finished with value: 0.8828828828828829 and parameters: {'objective': 'Logloss', 'colsample_bylevel': 0.09456883169789712, 'depth': 8, 'boosting_type': 'Plain', 'bootstrap_type': 'Bayesian', 'bagging_temperature': 4.089102938605477}. Best is trial 1464 with value: 0.8990825688073395.
[32m[I 2023-04-21 00:03:59,185][39m Trial 3139 finished with value: 0.8727272727272727 and parameters: {'objective': 'CrossEntropy', 'colsample_bylevel': 0.09072241155742654, 'depth': 9, 'boosting_type': 'Plain', 'bootstrap_type': 'Bayesian', 'bagging_temperature': 4.9153130709360795}. Best is trial 1464 with value: 0.8990825688073395.
[32m[I 2023-04-21 00:04:00,326][39m Trial 3140 finished with value: 0.8727272727272727 and parameters: {'objective': 'Logloss', 'colsample_bylevel': 0.09999183608391135, 'depth': 7, 'boosting_type': 'Plain', 'bootstrap_type': 'Bayesian', 'bagging_temperature': 4.475428422590329}. Best is trial 1464 with value: 0.8990825688073395.
[32m[I 2023-04-21 00:04:01,093][39m Trial 3141 finished with value: 0.8727272727272727 and parameters: {'objective': 'CrossEntropy', 'colsample_bylevel': 0.0893683398525694, 'depth': 8, 'boosting_type': 'Plain', 'bootstrap_type': 'Bayesian', 'bagging_temperature': 6.572962427240071}. Best is trial 1464 with value: 0.8990825688073395.
[32m[I 2023-04-21 00:04:01,813][39m Trial 3142 finished with value: 0.888888888888889 and parameters: {'objective': 'CrossEntropy', 'colsample_bylevel': 0.09382576150642648, 'depth': 7, 'boosting_type': 'Plain', 'bootstrap_type': 'Bayesian', 'bagging_temperature': 3.9138998641544025}. Best is trial 1464 with value: 0.8990825688073395.
[32m[I 2023-04-21 00:04:02,816][39m Trial 3143 finished with value: 0.8571428571428572 and parameters: {'objective': 'Logloss', 'colsample_bylevel': 0.0967754524464533, 'depth': 7, 'boosting_type': 'Plain', 'bootstrap_type': 'Bayesian', 'bagging_temperature': 3.639343572271222}. Best is trial 1464 with value: 0.8990825688073395.
[32m[I 2023-04-21 00:04:03,981][39m Trial 3144 finished with value: 0.8785046728971961 and parameters: {'objective': 'CrossEntropy', 'colsample_bylevel': 0.09357033110245594, 'depth': 7, 'boosting_type': 'Plain', 'bootstrap_type': 'Bayesian', 'bagging_temperature': 5.536235408025824}. Best is trial 1464 with value: 0.8990825688073395.
[32m[I 2023-04-21 00:04:05,665][39m Trial 3145 finished with value: 0.8347826086956522 and parameters: {'objective': 'Logloss', 'colsample_bylevel': 0.06993408472692075, 'depth': 9, 'boosting_type': 'Plain', 'bootstrap_type': 'Bayesian', 'bagging_temperature': 4.252156535159614}. Best is trial 1464 with value: 0.8990825688073395.
[32m[I 2023-04-21 00:04:06,660][39m Trial 3146 finished with value: 0.8785046728971961 and parameters: {'objective': 'CrossEntropy', 'colsample_bylevel': 0.09485115982172979, 'depth': 7, 'boosting_type': 'Plain', 'bootstrap_type': 'Bayesian', 'bagging_temperature': 5.830651415731698}. Best is trial 1464 with value: 0.8990825688073395.
[32m[I 2023-04-21 00:04:07,519][39m Trial 3147 finished with value: 0.8727272727272727 and parameters: {'objective': 'Logloss', 'colsample_bylevel': 0.09337916380374901, 'depth': 7, 'boosting_type': 'Plain', 'bootstrap_type': 'Bayesian', 'bagging_temperature': 5.543866332271945}. Best is trial 1464 with value: 0.8990825688073395.
[32m[I 2023-04-21 00:04:08,709][39m Trial 3148 finished with value: 0.8376068376068375 and parameters: {'objective': 'CrossEntropy', 'colsample_bylevel': 0.037229691945651296, 'depth': 9, 'boosting_type': 'Plain', 'bootstrap_type': 'Bayesian', 'bagging_temperature': 4.634442826604062}. Best is trial 1464 with value: 0.8990825688073395.
[32m[I 2023-04-21 00:04:13,890][39m Trial 3149 finished with value: 0.8347826086956522 and parameters: {'objective': 'Logloss', 'colsample_bylevel': 0.09469796172555581, 'depth': 9, 'boosting_type': 'Ordered', 'bootstrap_type': 'Bayesian', 'bagging_temperature': 5.132088619127691}. Best is trial 1464 with value: 0.8990825688073395.
[32m[I 2023-04-21 00:04:14,960][39m Trial 3150 finished with value: 0.8703703703703703 and parameters: {'objective': 'Logloss', 'colsample_bylevel': 0.09362398230495661, 'depth': 6, 'boosting_type': 'Plain', 'bootstrap_type': 'Bayesian', 'bagging_temperature': 4.47574102350637}. Best is trial 1464 with value: 0.8990825688073395.
[32m[I 2023-04-21 00:04:15,893][39m Trial 3151 finished with value: 0.8495575221238938 and parameters: {'objective': 'CrossEntropy', 'colsample_bylevel': 0.09277860614060575, 'depth': 7, 'boosting_type': 'Plain', 'bootstrap_type': 'MVS'}. Best is trial 1464 with value: 0.8990825688073395.
[32m[I 2023-04-21 00:04:17,139][39m Trial 3152 finished with value: 0.890909090909091 and parameters: {'objective': 'Logloss', 'colsample_bylevel': 0.09168143576615861, 'depth': 9, 'boosting_type': 'Plain', 'bootstrap_type': 'Bayesian', 'bagging_temperature': 5.347725644994306}. Best is trial 1464 with value: 0.8990825688073395.
[32m[I 2023-04-21 00:04:18,240][39m Trial 3153 finished with value: 0.8727272727272727 and parameters: {'objective': 'Logloss', 'colsample_bylevel': 0.08876361812341886, 'depth': 9, 'boosting_type': 'Plain', 'bootstrap_type': 'Bayesian', 'bagging_temperature': 5.251174263736767}. Best is trial 1464 with value: 0.8990825688073395.
[32m[I 2023-04-21 00:04:19,733][39m Trial 3154 finished with value: 0.8807339449541284 and parameters: {'objective': 'Logloss', 'colsample_bylevel': 0.09206019536124098, 'depth': 10, 'boosting_type': 'Plain', 'bootstrap_type': 'Bayesian', 'bagging_temperature': 3.609998654209982}. Best is trial 1464 with value: 0.8990825688073395.
[32m[I 2023-04-21 00:04:21,028][39m Trial 3155 finished with value: 0.8727272727272727 and parameters: {'objective': 'CrossEntropy', 'colsample_bylevel': 0.08831452552189611, 'depth': 9, 'boosting_type': 'Plain', 'bootstrap_type': 'Bayesian', 'bagging_temperature': 5.362594460869318}. Best is trial 1464 with value: 0.8990825688073395.
[32m[I 2023-04-21 00:04:22,258][39m Trial 3156 finished with value: 0.8727272727272727 and parameters: {'objective': 'Logloss', 'colsample_bylevel': 0.0953777147080745, 'depth': 9, 'boosting_type': 'Plain', 'bootstrap_type': 'Bayesian', 'bagging_temperature': 4.35046097982207}. Best is trial 1464 with value: 0.8990825688073395.
[32m[I 2023-04-21 00:04:23,114][39m Trial 3157 finished with value: 0.8495575221238938 and parameters: {'objective': 'Logloss', 'colsample_bylevel': 0.09135176414522556, 'depth': 7, 'boosting_type': 'Plain', 'bootstrap_type': 'Bayesian', 'bagging_temperature': 3.8455604831453263}. Best is trial 1464 with value: 0.8990825688073395.
[32m[I 2023-04-21 00:04:23,836][39m Trial 3158 finished with value: 0.8807339449541284 and parameters: {'objective': 'CrossEntropy', 'colsample_bylevel': 0.08905367878996663, 'depth': 7, 'boosting_type': 'Plain', 'bootstrap_type': 'Bayesian', 'bagging_temperature': 5.2310922293003195}. Best is trial 1464 with value: 0.8990825688073395.
[32m[I 2023-04-21 00:04:24,972][39m Trial 3159 finished with value: 0.888888888888889 and parameters: {'objective': 'Logloss', 'colsample_bylevel': 0.09997951563407, 'depth': 8, 'boosting_type': 'Plain', 'bootstrap_type': 'Bayesian', 'bagging_temperature': 4.7594184345976025}. Best is trial 1464 with value: 0.8990825688073395.
[32m[I 2023-04-21 00:04:26,871][39m Trial 3160 finished with value: 0.8648648648648648 and parameters: {'objective': 'Logloss', 'colsample_bylevel': 0.09685890736790188, 'depth': 9, 'boosting_type': 'Plain', 'bootstrap_type': 'Bayesian', 'bagging_temperature': 5.560940959909492}. Best is trial 1464 with value: 0.8990825688073395.
