[32m[I 2023-04-20 23:32:00,381][39m Trial 1656 finished with value: 0.8571428571428572 and parameters: {'objective': 'Logloss', 'colsample_bylevel': 0.0985594293745747, 'depth': 8, 'boosting_type': 'Plain', 'bootstrap_type': 'MVS'}. Best is trial 1464 with value: 0.8990825688073395.
[32m[I 2023-04-20 23:32:01,440][39m Trial 1657 finished with value: 0.8727272727272727 and parameters: {'objective': 'Logloss', 'colsample_bylevel': 0.09732355685484204, 'depth': 10, 'boosting_type': 'Plain', 'bootstrap_type': 'Bayesian', 'bagging_temperature': 5.880662544168177}. Best is trial 1464 with value: 0.8990825688073395.
[32m[I 2023-04-20 23:32:02,481][39m Trial 1658 finished with value: 0.8727272727272727 and parameters: {'objective': 'CrossEntropy', 'colsample_bylevel': 0.0931001636074751, 'depth': 10, 'boosting_type': 'Plain', 'bootstrap_type': 'Bayesian', 'bagging_temperature': 3.9488374956614374}. Best is trial 1464 with value: 0.8990825688073395.
[32m[I 2023-04-20 23:32:03,871][39m Trial 1659 finished with value: 0.8807339449541284 and parameters: {'objective': 'CrossEntropy', 'colsample_bylevel': 0.09434287834766202, 'depth': 10, 'boosting_type': 'Plain', 'bootstrap_type': 'Bayesian', 'bagging_temperature': 4.880129996589836}. Best is trial 1464 with value: 0.8990825688073395.
[32m[I 2023-04-20 23:32:05,269][39m Trial 1660 finished with value: 0.8828828828828829 and parameters: {'objective': 'Logloss', 'colsample_bylevel': 0.0964807955644475, 'depth': 9, 'boosting_type': 'Plain', 'bootstrap_type': 'Bayesian', 'bagging_temperature': 4.242381829709747}. Best is trial 1464 with value: 0.8990825688073395.
[32m[I 2023-04-20 23:32:12,606][39m Trial 1661 finished with value: 0.8571428571428572 and parameters: {'objective': 'Logloss', 'colsample_bylevel': 0.09638858701858823, 'depth': 6, 'boosting_type': 'Ordered', 'bootstrap_type': 'Bayesian', 'bagging_temperature': 6.060909983313311}. Best is trial 1464 with value: 0.8990825688073395.
[32m[I 2023-04-20 23:32:13,341][39m Trial 1662 finished with value: 0.8727272727272727 and parameters: {'objective': 'CrossEntropy', 'colsample_bylevel': 0.09077870230545602, 'depth': 8, 'boosting_type': 'Plain', 'bootstrap_type': 'Bayesian', 'bagging_temperature': 5.956215172909028}. Best is trial 1464 with value: 0.8990825688073395.
[32m[I 2023-04-20 23:32:14,014][39m Trial 1663 finished with value: 0.8623853211009175 and parameters: {'objective': 'Logloss', 'colsample_bylevel': 0.09160396343813623, 'depth': 7, 'boosting_type': 'Plain', 'bootstrap_type': 'Bayesian', 'bagging_temperature': 5.3731647039792145}. Best is trial 1464 with value: 0.8990825688073395.
[32m[I 2023-04-20 23:32:14,607][39m Trial 1664 finished with value: 0.8672566371681416 and parameters: {'objective': 'CrossEntropy', 'colsample_bylevel': 0.09841693570715554, 'depth': 8, 'boosting_type': 'Plain', 'bootstrap_type': 'MVS'}. Best is trial 1464 with value: 0.8990825688073395.
[32m[I 2023-04-20 23:32:15,306][39m Trial 1665 finished with value: 0.8623853211009175 and parameters: {'objective': 'Logloss', 'colsample_bylevel': 0.0938588595569746, 'depth': 11, 'boosting_type': 'Plain', 'bootstrap_type': 'Bayesian', 'bagging_temperature': 5.575080193110465}. Best is trial 1464 with value: 0.8990825688073395.
[32m[I 2023-04-20 23:32:15,897][39m Trial 1666 finished with value: 0.7610619469026548 and parameters: {'objective': 'Logloss', 'colsample_bylevel': 0.0193162113026936, 'depth': 8, 'boosting_type': 'Plain', 'bootstrap_type': 'Bayesian', 'bagging_temperature': 5.6927206566215185}. Best is trial 1464 with value: 0.8990825688073395.
[32m[I 2023-04-20 23:32:16,885][39m Trial 1667 finished with value: 0.8703703703703703 and parameters: {'objective': 'Logloss', 'colsample_bylevel': 0.09547207268470034, 'depth': 5, 'boosting_type': 'Plain', 'bootstrap_type': 'Bayesian', 'bagging_temperature': 5.692614012161749}. Best is trial 1464 with value: 0.8990825688073395.
[32m[I 2023-04-20 23:32:18,133][39m Trial 1668 finished with value: 0.8392857142857144 and parameters: {'objective': 'Logloss', 'colsample_bylevel': 0.06330131635364594, 'depth': 9, 'boosting_type': 'Plain', 'bootstrap_type': 'Bayesian', 'bagging_temperature': 4.782833183041342}. Best is trial 1464 with value: 0.8990825688073395.
[32m[I 2023-04-20 23:32:19,450][39m Trial 1669 finished with value: 0.888888888888889 and parameters: {'objective': 'CrossEntropy', 'colsample_bylevel': 0.09835977845798394, 'depth': 9, 'boosting_type': 'Plain', 'bootstrap_type': 'Bayesian', 'bagging_temperature': 4.469061874862161}. Best is trial 1464 with value: 0.8990825688073395.
[32m[I 2023-04-20 23:32:20,064][39m Trial 1670 finished with value: 0.8807339449541284 and parameters: {'objective': 'CrossEntropy', 'colsample_bylevel': 0.0944316243786448, 'depth': 10, 'boosting_type': 'Plain', 'bootstrap_type': 'Bayesian', 'bagging_temperature': 6.2209734675102295}. Best is trial 1464 with value: 0.8990825688073395.
[32m[I 2023-04-20 23:32:21,390][39m Trial 1671 finished with value: 0.888888888888889 and parameters: {'objective': 'CrossEntropy', 'colsample_bylevel': 0.09326459526676427, 'depth': 10, 'boosting_type': 'Plain', 'bootstrap_type': 'Bayesian', 'bagging_temperature': 4.179540782013866}. Best is trial 1464 with value: 0.8990825688073395.
[32m[I 2023-04-20 23:32:22,805][39m Trial 1672 finished with value: 0.8727272727272727 and parameters: {'objective': 'Logloss', 'colsample_bylevel': 0.09998392006966556, 'depth': 9, 'boosting_type': 'Plain', 'bootstrap_type': 'Bayesian', 'bagging_temperature': 4.655394207008026}. Best is trial 1464 with value: 0.8990825688073395.
[32m[I 2023-04-20 23:32:24,045][39m Trial 1673 finished with value: 0.8807339449541284 and parameters: {'objective': 'Logloss', 'colsample_bylevel': 0.09129213551889392, 'depth': 9, 'boosting_type': 'Plain', 'bootstrap_type': 'Bayesian', 'bagging_temperature': 5.184065037062041}. Best is trial 1464 with value: 0.8990825688073395.
[32m[I 2023-04-20 23:32:25,220][39m Trial 1674 finished with value: 0.8727272727272727 and parameters: {'objective': 'Logloss', 'colsample_bylevel': 0.09636080399079679, 'depth': 7, 'boosting_type': 'Plain', 'bootstrap_type': 'Bayesian', 'bagging_temperature': 3.6139181853781093}. Best is trial 1464 with value: 0.8990825688073395.
[32m[I 2023-04-20 23:32:26,364][39m Trial 1675 finished with value: 0.8596491228070176 and parameters: {'objective': 'Logloss', 'colsample_bylevel': 0.09511360989123314, 'depth': 12, 'boosting_type': 'Plain', 'bootstrap_type': 'MVS'}. Best is trial 1464 with value: 0.8990825688073395.
[32m[I 2023-04-20 23:32:27,909][39m Trial 1676 finished with value: 0.8727272727272727 and parameters: {'objective': 'Logloss', 'colsample_bylevel': 0.09707527924182383, 'depth': 9, 'boosting_type': 'Plain', 'bootstrap_type': 'Bayesian', 'bagging_temperature': 4.330881340859673}. Best is trial 1464 with value: 0.8990825688073395.
[32m[I 2023-04-20 23:32:28,545][39m Trial 1677 finished with value: 0.8421052631578947 and parameters: {'objective': 'CrossEntropy', 'colsample_bylevel': 0.09015204212976771, 'depth': 3, 'boosting_type': 'Plain', 'bootstrap_type': 'Bayesian', 'bagging_temperature': 4.747576100852418}. Best is trial 1464 with value: 0.8990825688073395.
[32m[I 2023-04-20 23:32:29,331][39m Trial 1678 finished with value: 0.8672566371681416 and parameters: {'objective': 'CrossEntropy', 'colsample_bylevel': 0.09624868664937615, 'depth': 9, 'boosting_type': 'Plain', 'bootstrap_type': 'Bernoulli', 'subsample': 0.6618157308548173}. Best is trial 1464 with value: 0.8990825688073395.
[32m[I 2023-04-20 23:32:29,895][39m Trial 1679 finished with value: 0.8828828828828829 and parameters: {'objective': 'CrossEntropy', 'colsample_bylevel': 0.09113940230584618, 'depth': 7, 'boosting_type': 'Plain', 'bootstrap_type': 'Bayesian', 'bagging_temperature': 5.564037149151119}. Best is trial 1464 with value: 0.8990825688073395.
[32m[I 2023-04-20 23:32:35,477][39m Trial 1680 finished with value: 0.8495575221238938 and parameters: {'objective': 'CrossEntropy', 'colsample_bylevel': 0.09218592564953729, 'depth': 10, 'boosting_type': 'Ordered', 'bootstrap_type': 'Bayesian', 'bagging_temperature': 7.79485182299226}. Best is trial 1464 with value: 0.8990825688073395.
[32m[I 2023-04-20 23:32:37,378][39m Trial 1681 finished with value: 0.8727272727272727 and parameters: {'objective': 'Logloss', 'colsample_bylevel': 0.09629556496780448, 'depth': 9, 'boosting_type': 'Plain', 'bootstrap_type': 'Bayesian', 'bagging_temperature': 6.255957278793669}. Best is trial 1464 with value: 0.8990825688073395.
[32m[I 2023-04-20 23:32:38,421][39m Trial 1682 finished with value: 0.875 and parameters: {'objective': 'Logloss', 'colsample_bylevel': 0.08564750040136351, 'depth': 10, 'boosting_type': 'Plain', 'bootstrap_type': 'Bayesian', 'bagging_temperature': 4.043112421042197}. Best is trial 1464 with value: 0.8990825688073395.
[32m[I 2023-04-20 23:32:39,151][39m Trial 1683 finished with value: 0.8785046728971961 and parameters: {'objective': 'CrossEntropy', 'colsample_bylevel': 0.09683725199300602, 'depth': 5, 'boosting_type': 'Plain', 'bootstrap_type': 'Bayesian', 'bagging_temperature': 6.316999627308172}. Best is trial 1464 with value: 0.8990825688073395.
[32m[I 2023-04-20 23:32:39,744][39m Trial 1684 finished with value: 0.8648648648648648 and parameters: {'objective': 'CrossEntropy', 'colsample_bylevel': 0.09688349914317851, 'depth': 6, 'boosting_type': 'Plain', 'bootstrap_type': 'Bayesian', 'bagging_temperature': 6.0255514959532555}. Best is trial 1464 with value: 0.8990825688073395.
[32m[I 2023-04-20 23:32:40,903][39m Trial 1685 finished with value: 0.890909090909091 and parameters: {'objective': 'CrossEntropy', 'colsample_bylevel': 0.09299575096209432, 'depth': 10, 'boosting_type': 'Plain', 'bootstrap_type': 'Bayesian', 'bagging_temperature': 5.845447458794178}. Best is trial 1464 with value: 0.8990825688073395.
[32m[I 2023-04-20 23:32:41,704][39m Trial 1686 finished with value: 0.8421052631578947 and parameters: {'objective': 'CrossEntropy', 'colsample_bylevel': 0.08821965477857036, 'depth': 10, 'boosting_type': 'Plain', 'bootstrap_type': 'Bayesian', 'bagging_temperature': 0.7448188826338147}. Best is trial 1464 with value: 0.8990825688073395.
[32m[I 2023-04-20 23:32:42,740][39m Trial 1687 finished with value: 0.8703703703703703 and parameters: {'objective': 'CrossEntropy', 'colsample_bylevel': 0.09368324617092907, 'depth': 10, 'boosting_type': 'Plain', 'bootstrap_type': 'Bayesian', 'bagging_temperature': 3.0706871552273984}. Best is trial 1464 with value: 0.8990825688073395.
[32m[I 2023-04-20 23:32:43,408][39m Trial 1688 finished with value: 0.8727272727272727 and parameters: {'objective': 'CrossEntropy', 'colsample_bylevel': 0.08927276521194237, 'depth': 10, 'boosting_type': 'Plain', 'bootstrap_type': 'Bayesian', 'bagging_temperature': 5.479734313786526}. Best is trial 1464 with value: 0.8990825688073395.
[32m[I 2023-04-20 23:32:44,721][39m Trial 1689 finished with value: 0.888888888888889 and parameters: {'objective': 'CrossEntropy', 'colsample_bylevel': 0.09997660405039567, 'depth': 9, 'boosting_type': 'Plain', 'bootstrap_type': 'Bayesian', 'bagging_temperature': 5.822585722822316}. Best is trial 1464 with value: 0.8990825688073395.
[32m[I 2023-04-20 23:32:45,494][39m Trial 1690 finished with value: 0.8807339449541284 and parameters: {'objective': 'CrossEntropy', 'colsample_bylevel': 0.09986200925916662, 'depth': 8, 'boosting_type': 'Plain', 'bootstrap_type': 'Bayesian', 'bagging_temperature': 5.8538811267874316}. Best is trial 1464 with value: 0.8990825688073395.
[32m[I 2023-04-20 23:32:46,366][39m Trial 1691 finished with value: 0.8727272727272727 and parameters: {'objective': 'CrossEntropy', 'colsample_bylevel': 0.09824329068937558, 'depth': 9, 'boosting_type': 'Plain', 'bootstrap_type': 'Bayesian', 'bagging_temperature': 5.7625385941839475}. Best is trial 1464 with value: 0.8990825688073395.
[32m[I 2023-04-20 23:32:47,454][39m Trial 1692 finished with value: 0.823529411764706 and parameters: {'objective': 'CrossEntropy', 'colsample_bylevel': 0.09836163731451858, 'depth': 1, 'boosting_type': 'Plain', 'bootstrap_type': 'Bernoulli', 'subsample': 0.15860288314732607}. Best is trial 1464 with value: 0.8990825688073395.
[32m[I 2023-04-20 23:32:48,566][39m Trial 1693 finished with value: 0.8727272727272727 and parameters: {'objective': 'CrossEntropy', 'colsample_bylevel': 0.0950377033263702, 'depth': 10, 'boosting_type': 'Plain', 'bootstrap_type': 'Bernoulli', 'subsample': 0.8492182318493489}. Best is trial 1464 with value: 0.8990825688073395.
[32m[I 2023-04-20 23:32:49,368][39m Trial 1694 finished with value: 0.8807339449541284 and parameters: {'objective': 'Logloss', 'colsample_bylevel': 0.0916104889561369, 'depth': 10, 'boosting_type': 'Plain', 'bootstrap_type': 'Bayesian', 'bagging_temperature': 5.220325349696024}. Best is trial 1464 with value: 0.8990825688073395.
[32m[I 2023-04-20 23:32:50,558][39m Trial 1695 finished with value: 0.8421052631578947 and parameters: {'objective': 'CrossEntropy', 'colsample_bylevel': 0.07863169857528118, 'depth': 10, 'boosting_type': 'Plain', 'bootstrap_type': 'Bayesian', 'bagging_temperature': 5.98451725035526}. Best is trial 1464 with value: 0.8990825688073395.
[32m[I 2023-04-20 23:32:52,005][39m Trial 1696 finished with value: 0.8807339449541284 and parameters: {'objective': 'CrossEntropy', 'colsample_bylevel': 0.09837018077293679, 'depth': 10, 'boosting_type': 'Plain', 'bootstrap_type': 'Bayesian', 'bagging_temperature': 5.951976360521346}. Best is trial 1464 with value: 0.8990825688073395.
[32m[I 2023-04-20 23:32:52,953][39m Trial 1697 finished with value: 0.8807339449541284 and parameters: {'objective': 'CrossEntropy', 'colsample_bylevel': 0.0961571137696395, 'depth': 7, 'boosting_type': 'Plain', 'bootstrap_type': 'Bayesian', 'bagging_temperature': 6.1056940600935885}. Best is trial 1464 with value: 0.8990825688073395.
[32m[I 2023-04-20 23:32:58,087][39m Trial 1698 finished with value: 0.8571428571428572 and parameters: {'objective': 'CrossEntropy', 'colsample_bylevel': 0.0968775150122529, 'depth': 7, 'boosting_type': 'Ordered', 'bootstrap_type': 'Bayesian', 'bagging_temperature': 6.333741605545297}. Best is trial 1464 with value: 0.8990825688073395.
[32m[I 2023-04-20 23:32:58,897][39m Trial 1699 finished with value: 0.8727272727272727 and parameters: {'objective': 'CrossEntropy', 'colsample_bylevel': 0.09557644014635215, 'depth': 10, 'boosting_type': 'Plain', 'bootstrap_type': 'Bernoulli', 'subsample': 0.899646337819213}. Best is trial 1464 with value: 0.8990825688073395.
[32m[I 2023-04-20 23:33:00,312][39m Trial 1700 finished with value: 0.8672566371681416 and parameters: {'objective': 'Logloss', 'colsample_bylevel': 0.09830415825397118, 'depth': 8, 'boosting_type': 'Plain', 'bootstrap_type': 'Bernoulli', 'subsample': 0.37249004564879556}. Best is trial 1464 with value: 0.8990825688073395.
[32m[I 2023-04-20 23:33:01,033][39m Trial 1701 finished with value: 0.8807339449541284 and parameters: {'objective': 'CrossEntropy', 'colsample_bylevel': 0.09296969063348585, 'depth': 10, 'boosting_type': 'Plain', 'bootstrap_type': 'Bayesian', 'bagging_temperature': 5.579230948511431}. Best is trial 1464 with value: 0.8990825688073395.
[32m[I 2023-04-20 23:33:02,460][39m Trial 1702 finished with value: 0.8828828828828829 and parameters: {'objective': 'CrossEntropy', 'colsample_bylevel': 0.08720320983723319, 'depth': 9, 'boosting_type': 'Plain', 'bootstrap_type': 'Bayesian', 'bagging_temperature': 5.608476852357849}. Best is trial 1464 with value: 0.8990825688073395.
[32m[I 2023-04-20 23:33:03,310][39m Trial 1703 finished with value: 0.8807339449541284 and parameters: {'objective': 'Logloss', 'colsample_bylevel': 0.09298755257801063, 'depth': 10, 'boosting_type': 'Plain', 'bootstrap_type': 'Bayesian', 'bagging_temperature': 3.998153587052339}. Best is trial 1464 with value: 0.8990825688073395.
[32m[I 2023-04-20 23:33:04,560][39m Trial 1704 finished with value: 0.888888888888889 and parameters: {'objective': 'CrossEntropy', 'colsample_bylevel': 0.09552921314207223, 'depth': 8, 'boosting_type': 'Plain', 'bootstrap_type': 'Bayesian', 'bagging_temperature': 6.479677583020545}. Best is trial 1464 with value: 0.8990825688073395.
[32m[I 2023-04-20 23:33:05,804][39m Trial 1705 finished with value: 0.8807339449541284 and parameters: {'objective': 'CrossEntropy', 'colsample_bylevel': 0.09317761123614239, 'depth': 10, 'boosting_type': 'Plain', 'bootstrap_type': 'Bayesian', 'bagging_temperature': 6.7065506585022785}. Best is trial 1464 with value: 0.8990825688073395.
[32m[I 2023-04-20 23:33:07,357][39m Trial 1706 finished with value: 0.8807339449541284 and parameters: {'objective': 'CrossEntropy', 'colsample_bylevel': 0.09460283327838598, 'depth': 9, 'boosting_type': 'Plain', 'bootstrap_type': 'Bayesian', 'bagging_temperature': 4.575611527994312}. Best is trial 1464 with value: 0.8990825688073395.
[32m[I 2023-04-20 23:33:08,017][39m Trial 1707 finished with value: 0.888888888888889 and parameters: {'objective': 'Logloss', 'colsample_bylevel': 0.09174056283055579, 'depth': 10, 'boosting_type': 'Plain', 'bootstrap_type': 'Bayesian', 'bagging_temperature': 7.881759791190232}. Best is trial 1464 with value: 0.8990825688073395.
[32m[I 2023-04-20 23:33:08,928][39m Trial 1708 finished with value: 0.8807339449541284 and parameters: {'objective': 'CrossEntropy', 'colsample_bylevel': 0.09731131284799249, 'depth': 9, 'boosting_type': 'Plain', 'bootstrap_type': 'Bayesian', 'bagging_temperature': 4.378996401125648}. Best is trial 1464 with value: 0.8990825688073395.
[32m[I 2023-04-20 23:33:10,396][39m Trial 1709 finished with value: 0.8648648648648648 and parameters: {'objective': 'Logloss', 'colsample_bylevel': 0.0914578775991991, 'depth': 8, 'boosting_type': 'Plain', 'bootstrap_type': 'Bayesian', 'bagging_temperature': 5.789112381060216}. Best is trial 1464 with value: 0.8990825688073395.
[32m[I 2023-04-20 23:33:11,106][39m Trial 1710 finished with value: 0.888888888888889 and parameters: {'objective': 'CrossEntropy', 'colsample_bylevel': 0.08991216259869783, 'depth': 10, 'boosting_type': 'Plain', 'bootstrap_type': 'Bayesian', 'bagging_temperature': 5.445603731018276}. Best is trial 1464 with value: 0.8990825688073395.
[32m[I 2023-04-20 23:33:12,128][39m Trial 1711 finished with value: 0.875 and parameters: {'objective': 'CrossEntropy', 'colsample_bylevel': 0.09432474136389896, 'depth': 6, 'boosting_type': 'Plain', 'bootstrap_type': 'Bayesian', 'bagging_temperature': 5.860679313129905}. Best is trial 1464 with value: 0.8990825688073395.
[32m[I 2023-04-20 23:33:13,500][39m Trial 1712 finished with value: 0.8807339449541284 and parameters: {'objective': 'CrossEntropy', 'colsample_bylevel': 0.09742944611256278, 'depth': 9, 'boosting_type': 'Plain', 'bootstrap_type': 'Bayesian', 'bagging_temperature': 4.86248405542281}. Best is trial 1464 with value: 0.8990825688073395.
[32m[I 2023-04-20 23:33:14,375][39m Trial 1713 finished with value: 0.8703703703703703 and parameters: {'objective': 'CrossEntropy', 'colsample_bylevel': 0.09578982979834971, 'depth': 11, 'boosting_type': 'Plain', 'bootstrap_type': 'Bayesian', 'bagging_temperature': 5.14802133128486}. Best is trial 1464 with value: 0.8990825688073395.
[32m[I 2023-04-20 23:33:15,054][39m Trial 1714 finished with value: 0.8807339449541284 and parameters: {'objective': 'CrossEntropy', 'colsample_bylevel': 0.09355895964003355, 'depth': 10, 'boosting_type': 'Plain', 'bootstrap_type': 'Bayesian', 'bagging_temperature': 6.051300284449032}. Best is trial 1464 with value: 0.8990825688073395.
[32m[I 2023-04-20 23:33:16,424][39m Trial 1715 finished with value: 0.875 and parameters: {'objective': 'CrossEntropy', 'colsample_bylevel': 0.09343889148024843, 'depth': 9, 'boosting_type': 'Plain', 'bootstrap_type': 'Bernoulli', 'subsample': 0.12054659607826274}. Best is trial 1464 with value: 0.8990825688073395.
[32m[I 2023-04-20 23:33:17,856][39m Trial 1716 finished with value: 0.888888888888889 and parameters: {'objective': 'Logloss', 'colsample_bylevel': 0.09857085954302176, 'depth': 9, 'boosting_type': 'Plain', 'bootstrap_type': 'Bayesian', 'bagging_temperature': 3.5168560744855997}. Best is trial 1464 with value: 0.8990825688073395.
[32m[I 2023-04-20 23:33:18,623][39m Trial 1717 finished with value: 0.8648648648648648 and parameters: {'objective': 'Logloss', 'colsample_bylevel': 0.09841566213302831, 'depth': 7, 'boosting_type': 'Plain', 'bootstrap_type': 'Bernoulli', 'subsample': 0.20698799309028182}. Best is trial 1464 with value: 0.8990825688073395.
[32m[I 2023-04-20 23:33:23,866][39m Trial 1718 finished with value: 0.8571428571428572 and parameters: {'objective': 'CrossEntropy', 'colsample_bylevel': 0.0953200789699814, 'depth': 12, 'boosting_type': 'Ordered', 'bootstrap_type': 'Bernoulli', 'subsample': 0.3496367224995929}. Best is trial 1464 with value: 0.8990825688073395.
[32m[I 2023-04-20 23:33:25,151][39m Trial 1719 finished with value: 0.888888888888889 and parameters: {'objective': 'CrossEntropy', 'colsample_bylevel': 0.09269678043634834, 'depth': 10, 'boosting_type': 'Plain', 'bootstrap_type': 'Bayesian', 'bagging_temperature': 5.6948297308013585}. Best is trial 1464 with value: 0.8990825688073395.
[32m[I 2023-04-20 23:33:25,943][39m Trial 1720 finished with value: 0.8648648648648648 and parameters: {'objective': 'Logloss', 'colsample_bylevel': 0.09149262349211656, 'depth': 10, 'boosting_type': 'Plain', 'bootstrap_type': 'Bayesian', 'bagging_temperature': 4.387241354982165}. Best is trial 1464 with value: 0.8990825688073395.
