[32m[I 2023-04-20 22:57:17,067][39m A new study created in memory with name: no-name-2ffd38bf-0df0-4242-ad96-205db215cb17
[32m[I 2023-04-20 22:57:17,602][39m Trial 0 finished with value: 0.8275862068965517 and parameters: {'objective': 'CrossEntropy', 'colsample_bylevel': 0.0524674812149287, 'depth': 12, 'boosting_type': 'Plain', 'bootstrap_type': 'MVS'}. Best is trial 0 with value: 0.8275862068965517.
[32m[I 2023-04-20 22:57:20,426][39m Trial 1 finished with value: 0.8448275862068967 and parameters: {'objective': 'Logloss', 'colsample_bylevel': 0.04043152516740958, 'depth': 3, 'boosting_type': 'Ordered', 'bootstrap_type': 'Bayesian', 'bagging_temperature': 0.1666420630030585}. Best is trial 1 with value: 0.8448275862068967.
[32m[I 2023-04-20 22:57:21,225][39m Trial 2 finished with value: 0.8275862068965517 and parameters: {'objective': 'CrossEntropy', 'colsample_bylevel': 0.03098999741047425, 'depth': 4, 'boosting_type': 'Plain', 'bootstrap_type': 'MVS'}. Best is trial 1 with value: 0.8448275862068967.
[32m[I 2023-04-20 22:57:24,359][39m Trial 3 finished with value: 0.823529411764706 and parameters: {'objective': 'Logloss', 'colsample_bylevel': 0.017705043658128652, 'depth': 12, 'boosting_type': 'Ordered', 'bootstrap_type': 'Bernoulli', 'subsample': 0.6294893190771699}. Best is trial 1 with value: 0.8448275862068967.
[32m[I 2023-04-20 22:57:25,514][39m Trial 4 finished with value: 0.8205128205128206 and parameters: {'objective': 'CrossEntropy', 'colsample_bylevel': 0.03805013115785144, 'depth': 12, 'boosting_type': 'Plain', 'bootstrap_type': 'MVS'}. Best is trial 1 with value: 0.8448275862068967.
[32m[I 2023-04-20 22:57:26,593][39m Trial 5 finished with value: 0.8347826086956522 and parameters: {'objective': 'CrossEntropy', 'colsample_bylevel': 0.05762605554602137, 'depth': 5, 'boosting_type': 'Plain', 'bootstrap_type': 'Bernoulli', 'subsample': 0.5746393331376375}. Best is trial 1 with value: 0.8448275862068967.
[32m[I 2023-04-20 22:57:27,413][39m Trial 6 finished with value: 0.823529411764706 and parameters: {'objective': 'Logloss', 'colsample_bylevel': 0.09636401656555332, 'depth': 1, 'boosting_type': 'Plain', 'bootstrap_type': 'MVS'}. Best is trial 1 with value: 0.8448275862068967.
[32m[I 2023-04-20 22:57:33,476][39m Trial 7 finished with value: 0.8347826086956522 and parameters: {'objective': 'Logloss', 'colsample_bylevel': 0.06605834192189713, 'depth': 6, 'boosting_type': 'Ordered', 'bootstrap_type': 'MVS'}. Best is trial 1 with value: 0.8448275862068967.
[32m[I 2023-04-20 22:57:34,486][39m Trial 8 finished with value: 0.8347826086956522 and parameters: {'objective': 'Logloss', 'colsample_bylevel': 0.05235149270328403, 'depth': 5, 'boosting_type': 'Plain', 'bootstrap_type': 'MVS'}. Best is trial 1 with value: 0.8448275862068967.
[32m[I 2023-04-20 22:57:35,620][39m Trial 9 finished with value: 0.8448275862068967 and parameters: {'objective': 'Logloss', 'colsample_bylevel': 0.07795683400270494, 'depth': 2, 'boosting_type': 'Plain', 'bootstrap_type': 'Bayesian', 'bagging_temperature': 7.85629372672699}. Best is trial 1 with value: 0.8448275862068967.
[32m[I 2023-04-20 22:57:38,709][39m Trial 10 finished with value: 0.7999999999999999 and parameters: {'objective': 'Logloss', 'colsample_bylevel': 0.010754126910613039, 'depth': 8, 'boosting_type': 'Ordered', 'bootstrap_type': 'Bayesian', 'bagging_temperature': 0.18402577866100214}. Best is trial 1 with value: 0.8448275862068967.
[32m[I 2023-04-20 22:57:42,888][39m Trial 11 finished with value: 0.8305084745762712 and parameters: {'objective': 'Logloss', 'colsample_bylevel': 0.08628324419563839, 'depth': 1, 'boosting_type': 'Ordered', 'bootstrap_type': 'Bayesian', 'bagging_temperature': 9.19716152234624}. Best is trial 1 with value: 0.8448275862068967.
[32m[I 2023-04-20 22:57:47,312][39m Trial 12 finished with value: 0.8448275862068967 and parameters: {'objective': 'Logloss', 'colsample_bylevel': 0.08372825447174898, 'depth': 3, 'boosting_type': 'Ordered', 'bootstrap_type': 'Bayesian', 'bagging_temperature': 6.787536596245636}. Best is trial 1 with value: 0.8448275862068967.
[32m[I 2023-04-20 22:57:51,912][39m Trial 13 finished with value: 0.8421052631578947 and parameters: {'objective': 'Logloss', 'colsample_bylevel': 0.07314586192677641, 'depth': 8, 'boosting_type': 'Ordered', 'bootstrap_type': 'Bayesian', 'bagging_temperature': 0.2613019487937327}. Best is trial 1 with value: 0.8448275862068967.
[32m[I 2023-04-20 22:57:55,817][39m Trial 14 finished with value: 0.8205128205128206 and parameters: {'objective': 'Logloss', 'colsample_bylevel': 0.03465698105981524, 'depth': 3, 'boosting_type': 'Ordered', 'bootstrap_type': 'Bayesian', 'bagging_temperature': 4.352531603755641}. Best is trial 1 with value: 0.8448275862068967.
[32m[I 2023-04-20 22:57:57,224][39m Trial 15 finished with value: 0.8305084745762712 and parameters: {'objective': 'Logloss', 'colsample_bylevel': 0.07056508103498955, 'depth': 2, 'boosting_type': 'Plain', 'bootstrap_type': 'Bayesian', 'bagging_temperature': 4.421860928515374}. Best is trial 1 with value: 0.8448275862068967.
[32m[I 2023-04-20 22:57:58,594][39m Trial 16 finished with value: 0.823529411764706 and parameters: {'objective': 'Logloss', 'colsample_bylevel': 0.04059896642524116, 'depth': 8, 'boosting_type': 'Plain', 'bootstrap_type': 'Bayesian', 'bagging_temperature': 7.577586518278715}. Best is trial 1 with value: 0.8448275862068967.
[32m[I 2023-04-20 22:58:03,084][39m Trial 17 finished with value: 0.8376068376068375 and parameters: {'objective': 'Logloss', 'colsample_bylevel': 0.09364177549336605, 'depth': 3, 'boosting_type': 'Ordered', 'bootstrap_type': 'Bernoulli', 'subsample': 0.11796549716794286}. Best is trial 1 with value: 0.8448275862068967.
[32m[I 2023-04-20 22:58:07,359][39m Trial 18 finished with value: 0.8305084745762712 and parameters: {'objective': 'CrossEntropy', 'colsample_bylevel': 0.022825105279699675, 'depth': 10, 'boosting_type': 'Ordered', 'bootstrap_type': 'Bayesian', 'bagging_temperature': 6.114281089768342}. Best is trial 1 with value: 0.8448275862068967.
[32m[I 2023-04-20 22:58:08,653][39m Trial 19 finished with value: 0.8305084745762712 and parameters: {'objective': 'Logloss', 'colsample_bylevel': 0.08060917272221657, 'depth': 2, 'boosting_type': 'Plain', 'bootstrap_type': 'Bayesian', 'bagging_temperature': 2.591729130125967}. Best is trial 1 with value: 0.8448275862068967.
[32m[I 2023-04-20 22:58:09,960][39m Trial 20 finished with value: 0.8521739130434783 and parameters: {'objective': 'Logloss', 'colsample_bylevel': 0.046036359715748515, 'depth': 6, 'boosting_type': 'Plain', 'bootstrap_type': 'Bayesian', 'bagging_temperature': 9.633924125777348}. Best is trial 20 with value: 0.8521739130434783.
[32m[I 2023-04-20 22:58:11,021][39m Trial 21 finished with value: 0.8571428571428572 and parameters: {'objective': 'Logloss', 'colsample_bylevel': 0.0446985425095306, 'depth': 6, 'boosting_type': 'Plain', 'bootstrap_type': 'Bayesian', 'bagging_temperature': 9.711524388974972}. Best is trial 21 with value: 0.8571428571428572.
[32m[I 2023-04-20 22:58:11,552][39m Trial 22 finished with value: 0.8521739130434783 and parameters: {'objective': 'Logloss', 'colsample_bylevel': 0.04532869058566, 'depth': 7, 'boosting_type': 'Plain', 'bootstrap_type': 'Bayesian', 'bagging_temperature': 9.687070536051342}. Best is trial 21 with value: 0.8571428571428572.
[32m[I 2023-04-20 22:58:12,190][39m Trial 23 finished with value: 0.8648648648648648 and parameters: {'objective': 'Logloss', 'colsample_bylevel': 0.04738142135583382, 'depth': 7, 'boosting_type': 'Plain', 'bootstrap_type': 'Bayesian', 'bagging_temperature': 9.951064473981178}. Best is trial 23 with value: 0.8648648648648648.
[32m[I 2023-04-20 22:58:13,431][39m Trial 24 finished with value: 0.8421052631578947 and parameters: {'objective': 'Logloss', 'colsample_bylevel': 0.02804187019586504, 'depth': 6, 'boosting_type': 'Plain', 'bootstrap_type': 'Bayesian', 'bagging_temperature': 9.887837552903683}. Best is trial 23 with value: 0.8648648648648648.
[32m[I 2023-04-20 22:58:14,122][39m Trial 25 finished with value: 0.8275862068965517 and parameters: {'objective': 'Logloss', 'colsample_bylevel': 0.06016379848421087, 'depth': 9, 'boosting_type': 'Plain', 'bootstrap_type': 'Bernoulli', 'subsample': 0.8670011354850711}. Best is trial 23 with value: 0.8648648648648648.
[32m[I 2023-04-20 22:58:15,490][39m Trial 26 finished with value: 0.8672566371681416 and parameters: {'objective': 'CrossEntropy', 'colsample_bylevel': 0.04538248413083021, 'depth': 7, 'boosting_type': 'Plain', 'bootstrap_type': 'Bayesian', 'bagging_temperature': 8.519293168384964}. Best is trial 26 with value: 0.8672566371681416.
[32m[I 2023-04-20 22:58:16,298][39m Trial 27 finished with value: 0.8305084745762712 and parameters: {'objective': 'CrossEntropy', 'colsample_bylevel': 0.047856614098858226, 'depth': 10, 'boosting_type': 'Plain', 'bootstrap_type': 'Bayesian', 'bagging_temperature': 8.236060684933676}. Best is trial 26 with value: 0.8672566371681416.
[32m[I 2023-04-20 22:58:16,886][39m Trial 28 finished with value: 0.8448275862068967 and parameters: {'objective': 'CrossEntropy', 'colsample_bylevel': 0.0643631974098461, 'depth': 7, 'boosting_type': 'Plain', 'bootstrap_type': 'Bayesian', 'bagging_temperature': 8.565738641013649}. Best is trial 26 with value: 0.8672566371681416.
[32m[I 2023-04-20 22:58:18,088][39m Trial 29 finished with value: 0.8376068376068375 and parameters: {'objective': 'CrossEntropy', 'colsample_bylevel': 0.05360947195835557, 'depth': 5, 'boosting_type': 'Plain', 'bootstrap_type': 'Bernoulli', 'subsample': 0.15641738044406883}. Best is trial 26 with value: 0.8672566371681416.
[32m[I 2023-04-20 22:58:18,908][39m Trial 30 finished with value: 0.8596491228070176 and parameters: {'objective': 'CrossEntropy', 'colsample_bylevel': 0.05286852708785025, 'depth': 9, 'boosting_type': 'Plain', 'bootstrap_type': 'Bayesian', 'bagging_temperature': 6.09755916004973}. Best is trial 26 with value: 0.8672566371681416.
[32m[I 2023-04-20 22:58:19,689][39m Trial 31 finished with value: 0.875 and parameters: {'objective': 'CrossEntropy', 'colsample_bylevel': 0.04908926379932909, 'depth': 9, 'boosting_type': 'Plain', 'bootstrap_type': 'Bayesian', 'bagging_temperature': 5.6207892138982025}. Best is trial 31 with value: 0.875.
[32m[I 2023-04-20 22:58:20,710][39m Trial 32 finished with value: 0.8495575221238938 and parameters: {'objective': 'CrossEntropy', 'colsample_bylevel': 0.05079609292713829, 'depth': 9, 'boosting_type': 'Plain', 'bootstrap_type': 'Bayesian', 'bagging_temperature': 5.59358043934248}. Best is trial 31 with value: 0.875.
[32m[I 2023-04-20 22:58:22,157][39m Trial 33 finished with value: 0.8596491228070176 and parameters: {'objective': 'CrossEntropy', 'colsample_bylevel': 0.05888055032053859, 'depth': 9, 'boosting_type': 'Plain', 'bootstrap_type': 'Bayesian', 'bagging_temperature': 6.752479825424802}. Best is trial 31 with value: 0.875.
[32m[I 2023-04-20 22:58:22,727][39m Trial 34 finished with value: 0.8596491228070176 and parameters: {'objective': 'CrossEntropy', 'colsample_bylevel': 0.061549617786481076, 'depth': 11, 'boosting_type': 'Plain', 'bootstrap_type': 'Bayesian', 'bagging_temperature': 7.131511399635491}. Best is trial 31 with value: 0.875.
[32m[I 2023-04-20 22:58:23,495][39m Trial 35 finished with value: 0.8571428571428572 and parameters: {'objective': 'CrossEntropy', 'colsample_bylevel': 0.03861290890207311, 'depth': 11, 'boosting_type': 'Plain', 'bootstrap_type': 'Bayesian', 'bagging_temperature': 7.219892502097889}. Best is trial 31 with value: 0.875.
[32m[I 2023-04-20 22:58:24,820][39m Trial 36 finished with value: 0.8205128205128206 and parameters: {'objective': 'CrossEntropy', 'colsample_bylevel': 0.03327075417425371, 'depth': 7, 'boosting_type': 'Plain', 'bootstrap_type': 'MVS'}. Best is trial 31 with value: 0.875.
[32m[I 2023-04-20 22:58:25,583][39m Trial 37 finished with value: 0.8275862068965517 and parameters: {'objective': 'CrossEntropy', 'colsample_bylevel': 0.06479754100310134, 'depth': 11, 'boosting_type': 'Plain', 'bootstrap_type': 'Bayesian', 'bagging_temperature': 8.67713810122918}. Best is trial 31 with value: 0.875.
[32m[I 2023-04-20 22:58:26,097][39m Trial 38 finished with value: 0.8275862068965517 and parameters: {'objective': 'CrossEntropy', 'colsample_bylevel': 0.0574291301048615, 'depth': 11, 'boosting_type': 'Plain', 'bootstrap_type': 'Bernoulli', 'subsample': 0.9898282747798149}. Best is trial 31 with value: 0.875.
[32m[I 2023-04-20 22:58:26,922][39m Trial 39 finished with value: 0.8205128205128206 and parameters: {'objective': 'CrossEntropy', 'colsample_bylevel': 0.028124344254665173, 'depth': 10, 'boosting_type': 'Plain', 'bootstrap_type': 'MVS'}. Best is trial 31 with value: 0.875.
[32m[I 2023-04-20 22:58:27,775][39m Trial 40 finished with value: 0.8347826086956522 and parameters: {'objective': 'CrossEntropy', 'colsample_bylevel': 0.05192526598220561, 'depth': 9, 'boosting_type': 'Plain', 'bootstrap_type': 'Bayesian', 'bagging_temperature': 3.219087899784705}. Best is trial 31 with value: 0.875.
[32m[I 2023-04-20 22:58:28,420][39m Trial 41 finished with value: 0.8421052631578947 and parameters: {'objective': 'CrossEntropy', 'colsample_bylevel': 0.05968486490382849, 'depth': 12, 'boosting_type': 'Plain', 'bootstrap_type': 'Bayesian', 'bagging_temperature': 6.743677659988022}. Best is trial 31 with value: 0.875.
[32m[I 2023-04-20 22:58:29,721][39m Trial 42 finished with value: 0.8376068376068375 and parameters: {'objective': 'CrossEntropy', 'colsample_bylevel': 0.04171714145222443, 'depth': 8, 'boosting_type': 'Plain', 'bootstrap_type': 'Bayesian', 'bagging_temperature': 5.593334129859869}. Best is trial 31 with value: 0.875.
[32m[I 2023-04-20 22:58:30,480][39m Trial 43 finished with value: 0.8495575221238938 and parameters: {'objective': 'CrossEntropy', 'colsample_bylevel': 0.06778675994867701, 'depth': 10, 'boosting_type': 'Plain', 'bootstrap_type': 'Bayesian', 'bagging_temperature': 8.86577018369556}. Best is trial 31 with value: 0.875.
[32m[I 2023-04-20 22:58:31,047][39m Trial 44 finished with value: 0.8376068376068375 and parameters: {'objective': 'CrossEntropy', 'colsample_bylevel': 0.0609750043749548, 'depth': 7, 'boosting_type': 'Plain', 'bootstrap_type': 'Bayesian', 'bagging_temperature': 7.077818316023244}. Best is trial 31 with value: 0.875.
[32m[I 2023-04-20 22:58:32,026][39m Trial 45 finished with value: 0.8275862068965517 and parameters: {'objective': 'CrossEntropy', 'colsample_bylevel': 0.050076686605728865, 'depth': 8, 'boosting_type': 'Plain', 'bootstrap_type': 'MVS'}. Best is trial 31 with value: 0.875.
[32m[I 2023-04-20 22:58:33,491][39m Trial 46 finished with value: 0.8521739130434783 and parameters: {'objective': 'CrossEntropy', 'colsample_bylevel': 0.05444924367464074, 'depth': 9, 'boosting_type': 'Plain', 'bootstrap_type': 'Bayesian', 'bagging_temperature': 6.082080361685819}. Best is trial 31 with value: 0.875.
[32m[I 2023-04-20 22:58:34,073][39m Trial 47 finished with value: 0.8521739130434783 and parameters: {'objective': 'CrossEntropy', 'colsample_bylevel': 0.0735942829786874, 'depth': 5, 'boosting_type': 'Plain', 'bootstrap_type': 'Bayesian', 'bagging_temperature': 7.935992872194234}. Best is trial 31 with value: 0.875.
[32m[I 2023-04-20 22:58:34,995][39m Trial 48 finished with value: 0.8376068376068375 and parameters: {'objective': 'CrossEntropy', 'colsample_bylevel': 0.03622784143240171, 'depth': 12, 'boosting_type': 'Plain', 'bootstrap_type': 'Bayesian', 'bagging_temperature': 7.671020862598365}. Best is trial 31 with value: 0.875.
[32m[I 2023-04-20 22:58:36,426][39m Trial 49 finished with value: 0.8305084745762712 and parameters: {'objective': 'CrossEntropy', 'colsample_bylevel': 0.041237931712638703, 'depth': 8, 'boosting_type': 'Plain', 'bootstrap_type': 'Bernoulli', 'subsample': 0.37969355002907645}. Best is trial 31 with value: 0.875.
[32m[I 2023-04-20 22:58:40,376][39m Trial 50 finished with value: 0.8275862068965517 and parameters: {'objective': 'CrossEntropy', 'colsample_bylevel': 0.06263354991876681, 'depth': 11, 'boosting_type': 'Ordered', 'bootstrap_type': 'Bayesian', 'bagging_temperature': 5.005291129313547}. Best is trial 31 with value: 0.875.
[32m[I 2023-04-20 22:58:41,863][39m Trial 51 finished with value: 0.8275862068965517 and parameters: {'objective': 'CrossEntropy', 'colsample_bylevel': 0.056543727326666085, 'depth': 9, 'boosting_type': 'Plain', 'bootstrap_type': 'Bayesian', 'bagging_temperature': 6.390869145597343}. Best is trial 31 with value: 0.875.
[32m[I 2023-04-20 22:58:42,975][39m Trial 52 finished with value: 0.8376068376068375 and parameters: {'objective': 'CrossEntropy', 'colsample_bylevel': 0.047759021900647854, 'depth': 10, 'boosting_type': 'Plain', 'bootstrap_type': 'Bayesian', 'bagging_temperature': 5.8091392049807755}. Best is trial 31 with value: 0.875.
[32m[I 2023-04-20 22:58:44,186][39m Trial 53 finished with value: 0.8495575221238938 and parameters: {'objective': 'CrossEntropy', 'colsample_bylevel': 0.056291300059125825, 'depth': 7, 'boosting_type': 'Plain', 'bootstrap_type': 'Bayesian', 'bagging_temperature': 4.67441261631141}. Best is trial 31 with value: 0.875.
[32m[I 2023-04-20 22:58:45,309][39m Trial 54 finished with value: 0.8495575221238938 and parameters: {'objective': 'CrossEntropy', 'colsample_bylevel': 0.07102050351846995, 'depth': 8, 'boosting_type': 'Plain', 'bootstrap_type': 'Bayesian', 'bagging_temperature': 7.069853044132858}. Best is trial 31 with value: 0.875.
[32m[I 2023-04-20 22:58:45,964][39m Trial 55 finished with value: 0.8376068376068375 and parameters: {'objective': 'CrossEntropy', 'colsample_bylevel': 0.04392743158750164, 'depth': 4, 'boosting_type': 'Plain', 'bootstrap_type': 'Bayesian', 'bagging_temperature': 5.256262015702673}. Best is trial 31 with value: 0.875.
[32m[I 2023-04-20 22:58:46,631][39m Trial 56 finished with value: 0.8275862068965517 and parameters: {'objective': 'CrossEntropy', 'colsample_bylevel': 0.04934639206720889, 'depth': 9, 'boosting_type': 'Plain', 'bootstrap_type': 'MVS'}. Best is trial 31 with value: 0.875.
[32m[I 2023-04-20 22:58:50,926][39m Trial 57 finished with value: 0.8376068376068375 and parameters: {'objective': 'CrossEntropy', 'colsample_bylevel': 0.05955437473304235, 'depth': 10, 'boosting_type': 'Ordered', 'bootstrap_type': 'Bayesian', 'bagging_temperature': 3.8606034053836584}. Best is trial 31 with value: 0.875.
[32m[I 2023-04-20 22:58:51,962][39m Trial 58 finished with value: 0.8347826086956522 and parameters: {'objective': 'CrossEntropy', 'colsample_bylevel': 0.06826077091515688, 'depth': 6, 'boosting_type': 'Plain', 'bootstrap_type': 'Bayesian', 'bagging_temperature': 6.579300947974007}. Best is trial 31 with value: 0.875.
[32m[I 2023-04-20 22:58:53,109][39m Trial 59 finished with value: 0.8495575221238938 and parameters: {'objective': 'Logloss', 'colsample_bylevel': 0.05365535796810503, 'depth': 8, 'boosting_type': 'Plain', 'bootstrap_type': 'Bayesian', 'bagging_temperature': 8.00766354914549}. Best is trial 31 with value: 0.875.
[32m[I 2023-04-20 22:58:54,108][39m Trial 60 finished with value: 0.8521739130434783 and parameters: {'objective': 'CrossEntropy', 'colsample_bylevel': 0.037576822276651496, 'depth': 9, 'boosting_type': 'Plain', 'bootstrap_type': 'Bayesian', 'bagging_temperature': 7.448383505203758}. Best is trial 31 with value: 0.875.
[32m[I 2023-04-20 22:58:54,650][39m Trial 61 finished with value: 0.8468468468468469 and parameters: {'objective': 'CrossEntropy', 'colsample_bylevel': 0.03855146894715632, 'depth': 11, 'boosting_type': 'Plain', 'bootstrap_type': 'Bayesian', 'bagging_temperature': 7.28122210156905}. Best is trial 31 with value: 0.875.
[32m[I 2023-04-20 22:58:55,223][39m Trial 62 finished with value: 0.8596491228070176 and parameters: {'objective': 'CrossEntropy', 'colsample_bylevel': 0.04396393150618112, 'depth': 12, 'boosting_type': 'Plain', 'bootstrap_type': 'Bayesian', 'bagging_temperature': 6.231858303361768}. Best is trial 31 with value: 0.875.
[32m[I 2023-04-20 22:58:55,929][39m Trial 63 finished with value: 0.8305084745762712 and parameters: {'objective': 'CrossEntropy', 'colsample_bylevel': 0.043564688536210795, 'depth': 12, 'boosting_type': 'Plain', 'bootstrap_type': 'Bayesian', 'bagging_temperature': 6.0760581019417685}. Best is trial 31 with value: 0.875.
[32m[I 2023-04-20 22:58:57,180][39m Trial 64 finished with value: 0.8521739130434783 and parameters: {'objective': 'CrossEntropy', 'colsample_bylevel': 0.04732880970432286, 'depth': 12, 'boosting_type': 'Plain', 'bootstrap_type': 'Bayesian', 'bagging_temperature': 9.270498550003538}. Best is trial 31 with value: 0.875.
[32m[I 2023-04-20 22:58:58,267][39m Trial 65 finished with value: 0.8305084745762712 and parameters: {'objective': 'Logloss', 'colsample_bylevel': 0.04269810103823431, 'depth': 11, 'boosting_type': 'Plain', 'bootstrap_type': 'Bayesian', 'bagging_temperature': 6.538936087320034}. Best is trial 31 with value: 0.875.
[32m[I 2023-04-20 22:59:02,406][39m Trial 66 finished with value: 0.8305084745762712 and parameters: {'objective': 'CrossEntropy', 'colsample_bylevel': 0.03200494312282226, 'depth': 10, 'boosting_type': 'Ordered', 'bootstrap_type': 'Bernoulli', 'subsample': 0.36576565654657156}. Best is trial 31 with value: 0.875.
[32m[I 2023-04-20 22:59:03,205][39m Trial 67 finished with value: 0.8596491228070176 and parameters: {'objective': 'CrossEntropy', 'colsample_bylevel': 0.05341422561157172, 'depth': 4, 'boosting_type': 'Plain', 'bootstrap_type': 'Bayesian', 'bagging_temperature': 9.183067475810368}. Best is trial 31 with value: 0.875.
