[32m[I 2023-04-21 00:43:19,095][39m Trial 4871 finished with value: 0.875 and parameters: {'objective': 'Logloss', 'colsample_bylevel': 0.09335154244685775, 'depth': 9, 'boosting_type': 'Plain', 'bootstrap_type': 'Bernoulli', 'subsample': 0.5329566377460088}. Best is trial 1464 with value: 0.8990825688073395.
[32m[I 2023-04-21 00:43:20,345][39m Trial 4872 finished with value: 0.8727272727272727 and parameters: {'objective': 'CrossEntropy', 'colsample_bylevel': 0.08430990671182463, 'depth': 12, 'boosting_type': 'Plain', 'bootstrap_type': 'Bayesian', 'bagging_temperature': 5.058094882655556}. Best is trial 1464 with value: 0.8990825688073395.
[32m[I 2023-04-21 00:43:21,091][39m Trial 4873 finished with value: 0.831858407079646 and parameters: {'objective': 'CrossEntropy', 'colsample_bylevel': 0.08680293213573498, 'depth': 12, 'boosting_type': 'Plain', 'bootstrap_type': 'MVS'}. Best is trial 1464 with value: 0.8990825688073395.
[32m[I 2023-04-21 00:43:22,335][39m Trial 4874 finished with value: 0.875 and parameters: {'objective': 'Logloss', 'colsample_bylevel': 0.09016423870245362, 'depth': 12, 'boosting_type': 'Plain', 'bootstrap_type': 'Bayesian', 'bagging_temperature': 4.8013670553548895}. Best is trial 1464 with value: 0.8990825688073395.
[32m[I 2023-04-21 00:43:23,745][39m Trial 4875 finished with value: 0.8807339449541284 and parameters: {'objective': 'Logloss', 'colsample_bylevel': 0.09473457596067314, 'depth': 11, 'boosting_type': 'Plain', 'bootstrap_type': 'Bayesian', 'bagging_temperature': 4.190225133369628}. Best is trial 1464 with value: 0.8990825688073395.
[32m[I 2023-04-21 00:43:24,653][39m Trial 4876 finished with value: 0.8623853211009175 and parameters: {'objective': 'CrossEntropy', 'colsample_bylevel': 0.08567044637763345, 'depth': 12, 'boosting_type': 'Plain', 'bootstrap_type': 'Bayesian', 'bagging_temperature': 5.12051930421674}. Best is trial 1464 with value: 0.8990825688073395.
[32m[I 2023-04-21 00:43:25,450][39m Trial 4877 finished with value: 0.8727272727272727 and parameters: {'objective': 'CrossEntropy', 'colsample_bylevel': 0.07536500500695775, 'depth': 12, 'boosting_type': 'Plain', 'bootstrap_type': 'Bayesian', 'bagging_temperature': 4.316722776817075}. Best is trial 1464 with value: 0.8990825688073395.
[32m[I 2023-04-21 00:43:30,670][39m Trial 4878 finished with value: 0.8495575221238938 and parameters: {'objective': 'Logloss', 'colsample_bylevel': 0.09359457240282777, 'depth': 10, 'boosting_type': 'Ordered', 'bootstrap_type': 'Bayesian', 'bagging_temperature': 7.207708511005232}. Best is trial 1464 with value: 0.8990825688073395.
[32m[I 2023-04-21 00:43:31,760][39m Trial 4879 finished with value: 0.8703703703703703 and parameters: {'objective': 'Logloss', 'colsample_bylevel': 0.08736648103116715, 'depth': 12, 'boosting_type': 'Plain', 'bootstrap_type': 'Bayesian', 'bagging_temperature': 5.659859258674977}. Best is trial 1464 with value: 0.8990825688073395.
[32m[I 2023-04-21 00:43:32,717][39m Trial 4880 finished with value: 0.8807339449541284 and parameters: {'objective': 'CrossEntropy', 'colsample_bylevel': 0.09513221588915766, 'depth': 12, 'boosting_type': 'Plain', 'bootstrap_type': 'Bayesian', 'bagging_temperature': 4.22240555355123}. Best is trial 1464 with value: 0.8990825688073395.
[32m[I 2023-04-21 00:43:33,826][39m Trial 4881 finished with value: 0.8807339449541284 and parameters: {'objective': 'CrossEntropy', 'colsample_bylevel': 0.09196721191115484, 'depth': 10, 'boosting_type': 'Plain', 'bootstrap_type': 'Bayesian', 'bagging_temperature': 6.438166359845257}. Best is trial 1464 with value: 0.8990825688073395.
[32m[I 2023-04-21 00:43:35,278][39m Trial 4882 finished with value: 0.8785046728971961 and parameters: {'objective': 'Logloss', 'colsample_bylevel': 0.09023464523785314, 'depth': 11, 'boosting_type': 'Plain', 'bootstrap_type': 'Bayesian', 'bagging_temperature': 5.450717138144673}. Best is trial 1464 with value: 0.8990825688073395.
[32m[I 2023-04-21 00:43:36,659][39m Trial 4883 finished with value: 0.8727272727272727 and parameters: {'objective': 'Logloss', 'colsample_bylevel': 0.09226392300461926, 'depth': 8, 'boosting_type': 'Plain', 'bootstrap_type': 'Bayesian', 'bagging_temperature': 5.174531435977972}. Best is trial 1464 with value: 0.8990825688073395.
[32m[I 2023-04-21 00:43:37,794][39m Trial 4884 finished with value: 0.8545454545454546 and parameters: {'objective': 'Logloss', 'colsample_bylevel': 0.08678582354561883, 'depth': 12, 'boosting_type': 'Plain', 'bootstrap_type': 'Bayesian', 'bagging_temperature': 4.988016510289372}. Best is trial 1464 with value: 0.8990825688073395.
[32m[I 2023-04-21 00:43:39,031][39m Trial 4885 finished with value: 0.8495575221238938 and parameters: {'objective': 'Logloss', 'colsample_bylevel': 0.0874730118317003, 'depth': 12, 'boosting_type': 'Plain', 'bootstrap_type': 'Bayesian', 'bagging_temperature': 5.091358682099473}. Best is trial 1464 with value: 0.8990825688073395.
[32m[I 2023-04-21 00:43:39,814][39m Trial 4886 finished with value: 0.8648648648648648 and parameters: {'objective': 'CrossEntropy', 'colsample_bylevel': 0.09324144833663794, 'depth': 5, 'boosting_type': 'Plain', 'bootstrap_type': 'Bayesian', 'bagging_temperature': 7.016345907382269}. Best is trial 1464 with value: 0.8990825688073395.
[32m[I 2023-04-21 00:43:40,758][39m Trial 4887 finished with value: 0.888888888888889 and parameters: {'objective': 'CrossEntropy', 'colsample_bylevel': 0.08857992376879803, 'depth': 12, 'boosting_type': 'Plain', 'bootstrap_type': 'Bayesian', 'bagging_temperature': 5.97063451285282}. Best is trial 1464 with value: 0.8990825688073395.
[32m[I 2023-04-21 00:43:41,563][39m Trial 4888 finished with value: 0.8807339449541284 and parameters: {'objective': 'CrossEntropy', 'colsample_bylevel': 0.08710580385556588, 'depth': 12, 'boosting_type': 'Plain', 'bootstrap_type': 'Bayesian', 'bagging_temperature': 5.167799292959467}. Best is trial 1464 with value: 0.8990825688073395.
[32m[I 2023-04-21 00:43:42,900][39m Trial 4889 finished with value: 0.8495575221238938 and parameters: {'objective': 'Logloss', 'colsample_bylevel': 0.08394440045582371, 'depth': 12, 'boosting_type': 'Plain', 'bootstrap_type': 'Bayesian', 'bagging_temperature': 2.6966219206379067}. Best is trial 1464 with value: 0.8990825688073395.
[32m[I 2023-04-21 00:43:44,027][39m Trial 4890 finished with value: 0.8495575221238938 and parameters: {'objective': 'Logloss', 'colsample_bylevel': 0.09122747806196257, 'depth': 12, 'boosting_type': 'Plain', 'bootstrap_type': 'Bernoulli', 'subsample': 0.9248735464556361}. Best is trial 1464 with value: 0.8990825688073395.
[32m[I 2023-04-21 00:43:45,440][39m Trial 4891 finished with value: 0.8828828828828829 and parameters: {'objective': 'CrossEntropy', 'colsample_bylevel': 0.0956055467137874, 'depth': 9, 'boosting_type': 'Plain', 'bootstrap_type': 'Bayesian', 'bagging_temperature': 4.741575475998428}. Best is trial 1464 with value: 0.8990825688073395.
[32m[I 2023-04-21 00:43:46,441][39m Trial 4892 finished with value: 0.8807339449541284 and parameters: {'objective': 'Logloss', 'colsample_bylevel': 0.09087376172957004, 'depth': 12, 'boosting_type': 'Plain', 'bootstrap_type': 'Bayesian', 'bagging_temperature': 7.48567846139338}. Best is trial 1464 with value: 0.8990825688073395.
[32m[I 2023-04-21 00:43:47,093][39m Trial 4893 finished with value: 0.8275862068965517 and parameters: {'objective': 'Logloss', 'colsample_bylevel': 0.0551242365279839, 'depth': 12, 'boosting_type': 'Plain', 'bootstrap_type': 'Bayesian', 'bagging_temperature': 4.529665553971017}. Best is trial 1464 with value: 0.8990825688073395.
[32m[I 2023-04-21 00:43:47,700][39m Trial 4894 finished with value: 0.8596491228070176 and parameters: {'objective': 'CrossEntropy', 'colsample_bylevel': 0.08886375924900894, 'depth': 11, 'boosting_type': 'Plain', 'bootstrap_type': 'MVS'}. Best is trial 1464 with value: 0.8990825688073395.
[32m[I 2023-04-21 00:43:49,217][39m Trial 4895 finished with value: 0.888888888888889 and parameters: {'objective': 'CrossEntropy', 'colsample_bylevel': 0.08962544863818846, 'depth': 12, 'boosting_type': 'Plain', 'bootstrap_type': 'Bayesian', 'bagging_temperature': 6.937228316292194}. Best is trial 1464 with value: 0.8990825688073395.
[32m[I 2023-04-21 00:43:54,330][39m Trial 4896 finished with value: 0.8571428571428572 and parameters: {'objective': 'Logloss', 'colsample_bylevel': 0.09999151132744791, 'depth': 10, 'boosting_type': 'Ordered', 'bootstrap_type': 'Bayesian', 'bagging_temperature': 4.650340850651495}. Best is trial 1464 with value: 0.8990825688073395.
[32m[I 2023-04-21 00:43:55,480][39m Trial 4897 finished with value: 0.8727272727272727 and parameters: {'objective': 'Logloss', 'colsample_bylevel': 0.09765107980895532, 'depth': 12, 'boosting_type': 'Plain', 'bootstrap_type': 'Bayesian', 'bagging_temperature': 6.164561199814773}. Best is trial 1464 with value: 0.8990825688073395.
[32m[I 2023-04-21 00:43:56,818][39m Trial 4898 finished with value: 0.8727272727272727 and parameters: {'objective': 'CrossEntropy', 'colsample_bylevel': 0.09302782661520215, 'depth': 11, 'boosting_type': 'Plain', 'bootstrap_type': 'Bayesian', 'bagging_temperature': 4.418985907281177}. Best is trial 1464 with value: 0.8990825688073395.
[32m[I 2023-04-21 00:43:58,132][39m Trial 4899 finished with value: 0.8807339449541284 and parameters: {'objective': 'Logloss', 'colsample_bylevel': 0.09464770780200216, 'depth': 10, 'boosting_type': 'Plain', 'bootstrap_type': 'Bayesian', 'bagging_temperature': 7.110465442566879}. Best is trial 1464 with value: 0.8990825688073395.
[32m[I 2023-04-21 00:43:59,430][39m Trial 4900 finished with value: 0.8727272727272727 and parameters: {'objective': 'Logloss', 'colsample_bylevel': 0.09152587143505381, 'depth': 11, 'boosting_type': 'Plain', 'bootstrap_type': 'Bayesian', 'bagging_temperature': 5.560390575114113}. Best is trial 1464 with value: 0.8990825688073395.
[32m[I 2023-04-21 00:44:00,580][39m Trial 4901 finished with value: 0.888888888888889 and parameters: {'objective': 'Logloss', 'colsample_bylevel': 0.09355800405843805, 'depth': 11, 'boosting_type': 'Plain', 'bootstrap_type': 'Bayesian', 'bagging_temperature': 5.859644396344377}. Best is trial 1464 with value: 0.8990825688073395.
[32m[I 2023-04-21 00:44:01,341][39m Trial 4902 finished with value: 0.8807339449541284 and parameters: {'objective': 'Logloss', 'colsample_bylevel': 0.09335809635448372, 'depth': 11, 'boosting_type': 'Plain', 'bootstrap_type': 'Bayesian', 'bagging_temperature': 5.67552238166932}. Best is trial 1464 with value: 0.8990825688073395.
[32m[I 2023-04-21 00:44:02,234][39m Trial 4903 finished with value: 0.8727272727272727 and parameters: {'objective': 'CrossEntropy', 'colsample_bylevel': 0.09730904526195015, 'depth': 12, 'boosting_type': 'Plain', 'bootstrap_type': 'Bayesian', 'bagging_temperature': 6.263752849972294}. Best is trial 1464 with value: 0.8990825688073395.
[32m[I 2023-04-21 00:44:03,478][39m Trial 4904 finished with value: 0.8571428571428572 and parameters: {'objective': 'CrossEntropy', 'colsample_bylevel': 0.08034226088609643, 'depth': 12, 'boosting_type': 'Plain', 'bootstrap_type': 'Bayesian', 'bagging_temperature': 4.812619207051233}. Best is trial 1464 with value: 0.8990825688073395.
[32m[I 2023-04-21 00:44:04,991][39m Trial 4905 finished with value: 0.8807339449541284 and parameters: {'objective': 'Logloss', 'colsample_bylevel': 0.09262697304650534, 'depth': 12, 'boosting_type': 'Plain', 'bootstrap_type': 'Bayesian', 'bagging_temperature': 6.875572812570815}. Best is trial 1464 with value: 0.8990825688073395.
[32m[I 2023-04-21 00:44:06,065][39m Trial 4906 finished with value: 0.8727272727272727 and parameters: {'objective': 'CrossEntropy', 'colsample_bylevel': 0.08752247927577338, 'depth': 11, 'boosting_type': 'Plain', 'bootstrap_type': 'Bayesian', 'bagging_temperature': 5.211474192379933}. Best is trial 1464 with value: 0.8990825688073395.
[32m[I 2023-04-21 00:44:07,090][39m Trial 4907 finished with value: 0.8648648648648648 and parameters: {'objective': 'CrossEntropy', 'colsample_bylevel': 0.08599646762725748, 'depth': 10, 'boosting_type': 'Plain', 'bootstrap_type': 'Bayesian', 'bagging_temperature': 7.015776796695363}. Best is trial 1464 with value: 0.8990825688073395.
[32m[I 2023-04-21 00:44:08,070][39m Trial 4908 finished with value: 0.8672566371681416 and parameters: {'objective': 'Logloss', 'colsample_bylevel': 0.09334164898517948, 'depth': 9, 'boosting_type': 'Plain', 'bootstrap_type': 'Bayesian', 'bagging_temperature': 5.736814967146892}. Best is trial 1464 with value: 0.8990825688073395.
[32m[I 2023-04-21 00:44:09,016][39m Trial 4909 finished with value: 0.8828828828828829 and parameters: {'objective': 'CrossEntropy', 'colsample_bylevel': 0.0905932116717127, 'depth': 11, 'boosting_type': 'Plain', 'bootstrap_type': 'Bayesian', 'bagging_temperature': 6.708203423512482}. Best is trial 1464 with value: 0.8990825688073395.
[32m[I 2023-04-21 00:44:10,160][39m Trial 4910 finished with value: 0.8703703703703703 and parameters: {'objective': 'Logloss', 'colsample_bylevel': 0.09040090338581246, 'depth': 12, 'boosting_type': 'Plain', 'bootstrap_type': 'Bayesian', 'bagging_temperature': 5.690671952742688}. Best is trial 1464 with value: 0.8990825688073395.
[32m[I 2023-04-21 00:44:11,449][39m Trial 4911 finished with value: 0.8421052631578947 and parameters: {'objective': 'CrossEntropy', 'colsample_bylevel': 0.08270927625286334, 'depth': 10, 'boosting_type': 'Plain', 'bootstrap_type': 'Bayesian', 'bagging_temperature': 6.176659180838886}. Best is trial 1464 with value: 0.8990825688073395.
[32m[I 2023-04-21 00:44:12,937][39m Trial 4912 finished with value: 0.8571428571428572 and parameters: {'objective': 'Logloss', 'colsample_bylevel': 0.09691196417613175, 'depth': 9, 'boosting_type': 'Plain', 'bootstrap_type': 'MVS'}. Best is trial 1464 with value: 0.8990825688073395.
[32m[I 2023-04-21 00:44:14,021][39m Trial 4913 finished with value: 0.8727272727272727 and parameters: {'objective': 'CrossEntropy', 'colsample_bylevel': 0.0986961707605301, 'depth': 7, 'boosting_type': 'Plain', 'bootstrap_type': 'Bayesian', 'bagging_temperature': 7.301436429143141}. Best is trial 1464 with value: 0.8990825688073395.
[32m[I 2023-04-21 00:44:14,835][39m Trial 4914 finished with value: 0.8672566371681416 and parameters: {'objective': 'CrossEntropy', 'colsample_bylevel': 0.0924788209947984, 'depth': 10, 'boosting_type': 'Plain', 'bootstrap_type': 'Bernoulli', 'subsample': 0.6294839922427378}. Best is trial 1464 with value: 0.8990825688073395.
[32m[I 2023-04-21 00:44:15,667][39m Trial 4915 finished with value: 0.8672566371681416 and parameters: {'objective': 'Logloss', 'colsample_bylevel': 0.04909572856162185, 'depth': 10, 'boosting_type': 'Plain', 'bootstrap_type': 'Bayesian', 'bagging_temperature': 5.342146792190929}. Best is trial 1464 with value: 0.8990825688073395.
[32m[I 2023-04-21 00:44:21,280][39m Trial 4916 finished with value: 0.8347826086956522 and parameters: {'objective': 'CrossEntropy', 'colsample_bylevel': 0.09184279328002906, 'depth': 5, 'boosting_type': 'Ordered', 'bootstrap_type': 'Bayesian', 'bagging_temperature': 3.3237965874053437}. Best is trial 1464 with value: 0.8990825688073395.
[32m[I 2023-04-21 00:44:22,377][39m Trial 4917 finished with value: 0.8828828828828829 and parameters: {'objective': 'Logloss', 'colsample_bylevel': 0.09578367334926968, 'depth': 7, 'boosting_type': 'Plain', 'bootstrap_type': 'Bayesian', 'bagging_temperature': 5.906177499562187}. Best is trial 1464 with value: 0.8990825688073395.
[32m[I 2023-04-21 00:44:23,240][39m Trial 4918 finished with value: 0.8703703703703703 and parameters: {'objective': 'Logloss', 'colsample_bylevel': 0.09861688346799657, 'depth': 12, 'boosting_type': 'Plain', 'bootstrap_type': 'Bayesian', 'bagging_temperature': 5.056931058041756}. Best is trial 1464 with value: 0.8990825688073395.
[32m[I 2023-04-21 00:44:24,629][39m Trial 4919 finished with value: 0.8648648648648648 and parameters: {'objective': 'Logloss', 'colsample_bylevel': 0.08240508204341372, 'depth': 12, 'boosting_type': 'Plain', 'bootstrap_type': 'Bayesian', 'bagging_temperature': 5.286112609425559}. Best is trial 1464 with value: 0.8990825688073395.
[32m[I 2023-04-21 00:44:25,287][39m Trial 4920 finished with value: 0.8727272727272727 and parameters: {'objective': 'CrossEntropy', 'colsample_bylevel': 0.08970791316141927, 'depth': 11, 'boosting_type': 'Plain', 'bootstrap_type': 'Bayesian', 'bagging_temperature': 5.190020298695757}. Best is trial 1464 with value: 0.8990825688073395.
[32m[I 2023-04-21 00:44:26,640][39m Trial 4921 finished with value: 0.888888888888889 and parameters: {'objective': 'CrossEntropy', 'colsample_bylevel': 0.08828126554744763, 'depth': 12, 'boosting_type': 'Plain', 'bootstrap_type': 'Bayesian', 'bagging_temperature': 6.424380537024855}. Best is trial 1464 with value: 0.8990825688073395.
[32m[I 2023-04-21 00:44:27,788][39m Trial 4922 finished with value: 0.8596491228070176 and parameters: {'objective': 'CrossEntropy', 'colsample_bylevel': 0.08607277623285227, 'depth': 12, 'boosting_type': 'Plain', 'bootstrap_type': 'Bayesian', 'bagging_temperature': 6.484639297500568}. Best is trial 1464 with value: 0.8990825688073395.
[32m[I 2023-04-21 00:44:29,083][39m Trial 4923 finished with value: 0.888888888888889 and parameters: {'objective': 'CrossEntropy', 'colsample_bylevel': 0.08787634801502765, 'depth': 12, 'boosting_type': 'Plain', 'bootstrap_type': 'Bayesian', 'bagging_temperature': 4.645443640244057}. Best is trial 1464 with value: 0.8990825688073395.
[32m[I 2023-04-21 00:44:29,960][39m Trial 4924 finished with value: 0.8623853211009175 and parameters: {'objective': 'Logloss', 'colsample_bylevel': 0.09399254654255118, 'depth': 10, 'boosting_type': 'Plain', 'bootstrap_type': 'Bayesian', 'bagging_temperature': 5.269805911828769}. Best is trial 1464 with value: 0.8990825688073395.
[32m[I 2023-04-21 00:44:31,103][39m Trial 4925 finished with value: 0.8648648648648648 and parameters: {'objective': 'CrossEntropy', 'colsample_bylevel': 0.08985862517597316, 'depth': 9, 'boosting_type': 'Plain', 'bootstrap_type': 'Bayesian', 'bagging_temperature': 3.8189385459286638}. Best is trial 1464 with value: 0.8990825688073395.
[32m[I 2023-04-21 00:44:31,949][39m Trial 4926 finished with value: 0.8727272727272727 and parameters: {'objective': 'CrossEntropy', 'colsample_bylevel': 0.09068075142099077, 'depth': 10, 'boosting_type': 'Plain', 'bootstrap_type': 'Bayesian', 'bagging_temperature': 6.088259925546488}. Best is trial 1464 with value: 0.8990825688073395.
[32m[I 2023-04-21 00:44:32,897][39m Trial 4927 finished with value: 0.8648648648648648 and parameters: {'objective': 'CrossEntropy', 'colsample_bylevel': 0.0953681558942542, 'depth': 6, 'boosting_type': 'Plain', 'bootstrap_type': 'Bayesian', 'bagging_temperature': 3.389715710310073}. Best is trial 1464 with value: 0.8990825688073395.
[32m[I 2023-04-21 00:44:34,175][39m Trial 4928 finished with value: 0.8275862068965517 and parameters: {'objective': 'CrossEntropy', 'colsample_bylevel': 0.07960111589653976, 'depth': 4, 'boosting_type': 'Plain', 'bootstrap_type': 'Bayesian', 'bagging_temperature': 6.02523571135635}. Best is trial 1464 with value: 0.8990825688073395.
[32m[I 2023-04-21 00:44:35,156][39m Trial 4929 finished with value: 0.8623853211009175 and parameters: {'objective': 'CrossEntropy', 'colsample_bylevel': 0.0868785958740248, 'depth': 10, 'boosting_type': 'Plain', 'bootstrap_type': 'Bayesian', 'bagging_temperature': 4.461531533853509}. Best is trial 1464 with value: 0.8990825688073395.
[32m[I 2023-04-21 00:44:36,085][39m Trial 4930 finished with value: 0.8807339449541284 and parameters: {'objective': 'CrossEntropy', 'colsample_bylevel': 0.09996484278637674, 'depth': 11, 'boosting_type': 'Plain', 'bootstrap_type': 'Bayesian', 'bagging_temperature': 5.68355521396285}. Best is trial 1464 with value: 0.8990825688073395.
[32m[I 2023-04-21 00:44:36,977][39m Trial 4931 finished with value: 0.8672566371681416 and parameters: {'objective': 'Logloss', 'colsample_bylevel': 0.09403851153942762, 'depth': 10, 'boosting_type': 'Plain', 'bootstrap_type': 'Bernoulli', 'subsample': 0.1391726497018576}. Best is trial 1464 with value: 0.8990825688073395.
[32m[I 2023-04-21 00:44:38,522][39m Trial 4932 finished with value: 0.8545454545454546 and parameters: {'objective': 'Logloss', 'colsample_bylevel': 0.0876169480266158, 'depth': 12, 'boosting_type': 'Plain', 'bootstrap_type': 'Bayesian', 'bagging_temperature': 4.132681974515609}. Best is trial 1464 with value: 0.8990825688073395.
[32m[I 2023-04-21 00:44:39,255][39m Trial 4933 finished with value: 0.8421052631578947 and parameters: {'objective': 'Logloss', 'colsample_bylevel': 0.06025132209673002, 'depth': 10, 'boosting_type': 'Plain', 'bootstrap_type': 'Bayesian', 'bagging_temperature': 5.422661198412975}. Best is trial 1464 with value: 0.8990825688073395.
[32m[I 2023-04-21 00:44:44,474][39m Trial 4934 finished with value: 0.8545454545454546 and parameters: {'objective': 'CrossEntropy', 'colsample_bylevel': 0.09443649829195935, 'depth': 10, 'boosting_type': 'Ordered', 'bootstrap_type': 'Bayesian', 'bagging_temperature': 6.320601887666671}. Best is trial 1464 with value: 0.8990825688073395.
[32m[I 2023-04-21 00:44:46,090][39m Trial 4935 finished with value: 0.8807339449541284 and parameters: {'objective': 'CrossEntropy', 'colsample_bylevel': 0.09052774370552762, 'depth': 9, 'boosting_type': 'Plain', 'bootstrap_type': 'Bayesian', 'bagging_temperature': 5.053169516279503}. Best is trial 1464 with value: 0.8990825688073395.
