[32m[I 2023-04-21 00:46:15,734][39m Trial 5002 finished with value: 0.8807339449541284 and parameters: {'objective': 'CrossEntropy', 'colsample_bylevel': 0.09561046121265865, 'depth': 7, 'boosting_type': 'Plain', 'bootstrap_type': 'Bayesian', 'bagging_temperature': 3.9566698810536787}. Best is trial 1464 with value: 0.8990825688073395.
[32m[I 2023-04-21 00:46:16,819][39m Trial 5003 finished with value: 0.8648648648648648 and parameters: {'objective': 'CrossEntropy', 'colsample_bylevel': 0.09125659069279723, 'depth': 10, 'boosting_type': 'Plain', 'bootstrap_type': 'Bayesian', 'bagging_temperature': 5.430927968744228}. Best is trial 1464 with value: 0.8990825688073395.
[32m[I 2023-04-21 00:46:17,946][39m Trial 5004 finished with value: 0.8703703703703703 and parameters: {'objective': 'Logloss', 'colsample_bylevel': 0.09416721736808673, 'depth': 10, 'boosting_type': 'Plain', 'bootstrap_type': 'Bayesian', 'bagging_temperature': 6.593920833583142}. Best is trial 1464 with value: 0.8990825688073395.
[32m[I 2023-04-21 00:46:18,747][39m Trial 5005 finished with value: 0.8648648648648648 and parameters: {'objective': 'CrossEntropy', 'colsample_bylevel': 0.09873209106124667, 'depth': 7, 'boosting_type': 'Plain', 'bootstrap_type': 'Bayesian', 'bagging_temperature': 4.479093878606108}. Best is trial 1464 with value: 0.8990825688073395.
[32m[I 2023-04-21 00:46:19,788][39m Trial 5006 finished with value: 0.888888888888889 and parameters: {'objective': 'Logloss', 'colsample_bylevel': 0.09351754600029123, 'depth': 9, 'boosting_type': 'Plain', 'bootstrap_type': 'Bayesian', 'bagging_temperature': 6.734581537865977}. Best is trial 1464 with value: 0.8990825688073395.
[32m[I 2023-04-21 00:46:21,226][39m Trial 5007 finished with value: 0.875 and parameters: {'objective': 'CrossEntropy', 'colsample_bylevel': 0.09369398877035168, 'depth': 12, 'boosting_type': 'Plain', 'bootstrap_type': 'Bayesian', 'bagging_temperature': 5.83564681786009}. Best is trial 1464 with value: 0.8990825688073395.
[32m[I 2023-04-21 00:46:26,402][39m Trial 5008 finished with value: 0.8571428571428572 and parameters: {'objective': 'Logloss', 'colsample_bylevel': 0.09978992692685809, 'depth': 9, 'boosting_type': 'Ordered', 'bootstrap_type': 'Bayesian', 'bagging_temperature': 4.790378726026013}. Best is trial 1464 with value: 0.8990825688073395.
[32m[I 2023-04-21 00:46:27,881][39m Trial 5009 finished with value: 0.875 and parameters: {'objective': 'Logloss', 'colsample_bylevel': 0.09996371553424648, 'depth': 12, 'boosting_type': 'Plain', 'bootstrap_type': 'Bayesian', 'bagging_temperature': 4.781744253921485}. Best is trial 1464 with value: 0.8990825688073395.
[32m[I 2023-04-21 00:46:29,353][39m Trial 5010 finished with value: 0.8521739130434783 and parameters: {'objective': 'Logloss', 'colsample_bylevel': 0.04211378014535374, 'depth': 6, 'boosting_type': 'Plain', 'bootstrap_type': 'Bayesian', 'bagging_temperature': 5.554014438435519}. Best is trial 1464 with value: 0.8990825688073395.
[32m[I 2023-04-21 00:46:30,690][39m Trial 5011 finished with value: 0.8623853211009175 and parameters: {'objective': 'Logloss', 'colsample_bylevel': 0.09590987121852608, 'depth': 9, 'boosting_type': 'Plain', 'bootstrap_type': 'Bayesian', 'bagging_temperature': 5.356711313310599}. Best is trial 1464 with value: 0.8990825688073395.
[32m[I 2023-04-21 00:46:32,233][39m Trial 5012 finished with value: 0.875 and parameters: {'objective': 'CrossEntropy', 'colsample_bylevel': 0.09172143353424696, 'depth': 9, 'boosting_type': 'Plain', 'bootstrap_type': 'Bayesian', 'bagging_temperature': 7.498251770754429}. Best is trial 1464 with value: 0.8990825688073395.
[32m[I 2023-04-21 00:46:33,047][39m Trial 5013 finished with value: 0.888888888888889 and parameters: {'objective': 'CrossEntropy', 'colsample_bylevel': 0.09486086264832203, 'depth': 8, 'boosting_type': 'Plain', 'bootstrap_type': 'Bayesian', 'bagging_temperature': 4.442389075932159}. Best is trial 1464 with value: 0.8990825688073395.
[32m[I 2023-04-21 00:46:34,233][39m Trial 5014 finished with value: 0.8703703703703703 and parameters: {'objective': 'Logloss', 'colsample_bylevel': 0.09584512043809758, 'depth': 6, 'boosting_type': 'Plain', 'bootstrap_type': 'Bayesian', 'bagging_temperature': 6.793777248047056}. Best is trial 1464 with value: 0.8990825688073395.
[32m[I 2023-04-21 00:46:35,655][39m Trial 5015 finished with value: 0.875 and parameters: {'objective': 'Logloss', 'colsample_bylevel': 0.08838371188714418, 'depth': 12, 'boosting_type': 'Plain', 'bootstrap_type': 'Bayesian', 'bagging_temperature': 2.9660052857811015}. Best is trial 1464 with value: 0.8990825688073395.
[32m[I 2023-04-21 00:46:36,368][39m Trial 5016 finished with value: 0.8648648648648648 and parameters: {'objective': 'CrossEntropy', 'colsample_bylevel': 0.09322447938658249, 'depth': 12, 'boosting_type': 'Plain', 'bootstrap_type': 'Bayesian', 'bagging_temperature': 7.060865485762134}. Best is trial 1464 with value: 0.8990825688073395.
[32m[I 2023-04-21 00:46:37,775][39m Trial 5017 finished with value: 0.8703703703703703 and parameters: {'objective': 'Logloss', 'colsample_bylevel': 0.09351931339164335, 'depth': 7, 'boosting_type': 'Plain', 'bootstrap_type': 'Bayesian', 'bagging_temperature': 5.28264551576201}. Best is trial 1464 with value: 0.8990825688073395.
[32m[I 2023-04-21 00:46:38,680][39m Trial 5018 finished with value: 0.8807339449541284 and parameters: {'objective': 'Logloss', 'colsample_bylevel': 0.0985021307112143, 'depth': 7, 'boosting_type': 'Plain', 'bootstrap_type': 'Bayesian', 'bagging_temperature': 4.327849041672116}. Best is trial 1464 with value: 0.8990825688073395.
[32m[I 2023-04-21 00:46:39,903][39m Trial 5019 finished with value: 0.875 and parameters: {'objective': 'Logloss', 'colsample_bylevel': 0.09469677728885008, 'depth': 10, 'boosting_type': 'Plain', 'bootstrap_type': 'Bernoulli', 'subsample': 0.4328981912280371}. Best is trial 1464 with value: 0.8990825688073395.
[32m[I 2023-04-21 00:46:41,040][39m Trial 5020 finished with value: 0.8807339449541284 and parameters: {'objective': 'Logloss', 'colsample_bylevel': 0.08985657128275788, 'depth': 11, 'boosting_type': 'Plain', 'bootstrap_type': 'Bayesian', 'bagging_temperature': 5.648445766590326}. Best is trial 1464 with value: 0.8990825688073395.
[32m[I 2023-04-21 00:46:42,574][39m Trial 5021 finished with value: 0.8648648648648648 and parameters: {'objective': 'Logloss', 'colsample_bylevel': 0.08480780273510341, 'depth': 12, 'boosting_type': 'Plain', 'bootstrap_type': 'Bayesian', 'bagging_temperature': 7.259100432261507}. Best is trial 1464 with value: 0.8990825688073395.
[32m[I 2023-04-21 00:46:43,715][39m Trial 5022 finished with value: 0.8727272727272727 and parameters: {'objective': 'Logloss', 'colsample_bylevel': 0.09164950436841296, 'depth': 10, 'boosting_type': 'Plain', 'bootstrap_type': 'Bayesian', 'bagging_temperature': 5.693625763913104}. Best is trial 1464 with value: 0.8990825688073395.
[32m[I 2023-04-21 00:46:44,512][39m Trial 5023 finished with value: 0.890909090909091 and parameters: {'objective': 'Logloss', 'colsample_bylevel': 0.08682168143054494, 'depth': 12, 'boosting_type': 'Plain', 'bootstrap_type': 'Bayesian', 'bagging_temperature': 5.063972488526196}. Best is trial 1464 with value: 0.8990825688073395.
[32m[I 2023-04-21 00:46:45,721][39m Trial 5024 finished with value: 0.8807339449541284 and parameters: {'objective': 'Logloss', 'colsample_bylevel': 0.09384086494878574, 'depth': 7, 'boosting_type': 'Plain', 'bootstrap_type': 'Bayesian', 'bagging_temperature': 5.525111918272507}. Best is trial 1464 with value: 0.8990825688073395.
[32m[I 2023-04-21 00:46:46,831][39m Trial 5025 finished with value: 0.8571428571428572 and parameters: {'objective': 'Logloss', 'colsample_bylevel': 0.09263486574149547, 'depth': 11, 'boosting_type': 'Plain', 'bootstrap_type': 'MVS'}. Best is trial 1464 with value: 0.8990825688073395.
[32m[I 2023-04-21 00:46:48,463][39m Trial 5026 finished with value: 0.8727272727272727 and parameters: {'objective': 'CrossEntropy', 'colsample_bylevel': 0.09118254978695682, 'depth': 9, 'boosting_type': 'Plain', 'bootstrap_type': 'Bayesian', 'bagging_temperature': 6.106426750963592}. Best is trial 1464 with value: 0.8990825688073395.
[32m[I 2023-04-21 00:46:49,874][39m Trial 5027 finished with value: 0.8571428571428572 and parameters: {'objective': 'Logloss', 'colsample_bylevel': 0.0941530449248974, 'depth': 6, 'boosting_type': 'Plain', 'bootstrap_type': 'Bayesian', 'bagging_temperature': 4.998848936467096}. Best is trial 1464 with value: 0.8990825688073395.
[32m[I 2023-04-21 00:46:54,550][39m Trial 5028 finished with value: 0.8495575221238938 and parameters: {'objective': 'Logloss', 'colsample_bylevel': 0.09685930771431937, 'depth': 9, 'boosting_type': 'Ordered', 'bootstrap_type': 'Bayesian', 'bagging_temperature': 5.705137068536937}. Best is trial 1464 with value: 0.8990825688073395.
[32m[I 2023-04-21 00:46:55,970][39m Trial 5029 finished with value: 0.8727272727272727 and parameters: {'objective': 'Logloss', 'colsample_bylevel': 0.08934954337196273, 'depth': 11, 'boosting_type': 'Plain', 'bootstrap_type': 'Bayesian', 'bagging_temperature': 6.846315454410806}. Best is trial 1464 with value: 0.8990825688073395.
[32m[I 2023-04-21 00:46:57,154][39m Trial 5030 finished with value: 0.8727272727272727 and parameters: {'objective': 'CrossEntropy', 'colsample_bylevel': 0.09999264930770098, 'depth': 12, 'boosting_type': 'Plain', 'bootstrap_type': 'Bayesian', 'bagging_temperature': 5.4528623702931425}. Best is trial 1464 with value: 0.8990825688073395.
[32m[I 2023-04-21 00:46:59,190][39m Trial 5031 finished with value: 0.8807339449541284 and parameters: {'objective': 'CrossEntropy', 'colsample_bylevel': 0.09281128749700181, 'depth': 9, 'boosting_type': 'Plain', 'bootstrap_type': 'Bayesian', 'bagging_temperature': 4.322743230061431}. Best is trial 1464 with value: 0.8990825688073395.
[32m[I 2023-04-21 00:46:59,963][39m Trial 5032 finished with value: 0.888888888888889 and parameters: {'objective': 'CrossEntropy', 'colsample_bylevel': 0.09592376468502979, 'depth': 10, 'boosting_type': 'Plain', 'bootstrap_type': 'Bayesian', 'bagging_temperature': 6.414447228389447}. Best is trial 1464 with value: 0.8990825688073395.
[32m[I 2023-04-21 00:47:01,048][39m Trial 5033 finished with value: 0.8727272727272727 and parameters: {'objective': 'CrossEntropy', 'colsample_bylevel': 0.0974429326482538, 'depth': 11, 'boosting_type': 'Plain', 'bootstrap_type': 'Bayesian', 'bagging_temperature': 4.489962361780655}. Best is trial 1464 with value: 0.8990825688073395.
[32m[I 2023-04-21 00:47:02,171][39m Trial 5034 finished with value: 0.888888888888889 and parameters: {'objective': 'CrossEntropy', 'colsample_bylevel': 0.09383066213809191, 'depth': 12, 'boosting_type': 'Plain', 'bootstrap_type': 'Bayesian', 'bagging_temperature': 6.056175093098609}. Best is trial 1464 with value: 0.8990825688073395.
[32m[I 2023-04-21 00:47:03,214][39m Trial 5035 finished with value: 0.8672566371681416 and parameters: {'objective': 'CrossEntropy', 'colsample_bylevel': 0.08794711114203148, 'depth': 12, 'boosting_type': 'Plain', 'bootstrap_type': 'Bayesian', 'bagging_temperature': 4.8001919931546615}. Best is trial 1464 with value: 0.8990825688073395.
[32m[I 2023-04-21 00:47:04,469][39m Trial 5036 finished with value: 0.8807339449541284 and parameters: {'objective': 'CrossEntropy', 'colsample_bylevel': 0.08913649051759268, 'depth': 10, 'boosting_type': 'Plain', 'bootstrap_type': 'Bayesian', 'bagging_temperature': 7.702517537938439}. Best is trial 1464 with value: 0.8990825688073395.
[32m[I 2023-04-21 00:47:05,765][39m Trial 5037 finished with value: 0.8807339449541284 and parameters: {'objective': 'Logloss', 'colsample_bylevel': 0.09828830444010238, 'depth': 11, 'boosting_type': 'Plain', 'bootstrap_type': 'Bayesian', 'bagging_temperature': 5.548150848572628}. Best is trial 1464 with value: 0.8990825688073395.
[32m[I 2023-04-21 00:47:06,554][39m Trial 5038 finished with value: 0.8727272727272727 and parameters: {'objective': 'Logloss', 'colsample_bylevel': 0.0852864483235709, 'depth': 7, 'boosting_type': 'Plain', 'bootstrap_type': 'Bayesian', 'bagging_temperature': 5.226717272801773}. Best is trial 1464 with value: 0.8990825688073395.
[32m[I 2023-04-21 00:47:07,289][39m Trial 5039 finished with value: 0.8727272727272727 and parameters: {'objective': 'Logloss', 'colsample_bylevel': 0.09507434089622921, 'depth': 12, 'boosting_type': 'Plain', 'bootstrap_type': 'Bayesian', 'bagging_temperature': 3.3406346120813364}. Best is trial 1464 with value: 0.8990825688073395.
[32m[I 2023-04-21 00:47:08,243][39m Trial 5040 finished with value: 0.8648648648648648 and parameters: {'objective': 'Logloss', 'colsample_bylevel': 0.09657339139820095, 'depth': 12, 'boosting_type': 'Plain', 'bootstrap_type': 'Bayesian', 'bagging_temperature': 5.7108566662341955}. Best is trial 1464 with value: 0.8990825688073395.
[32m[I 2023-04-21 00:47:09,349][39m Trial 5041 finished with value: 0.8807339449541284 and parameters: {'objective': 'Logloss', 'colsample_bylevel': 0.0926538167538558, 'depth': 12, 'boosting_type': 'Plain', 'bootstrap_type': 'Bayesian', 'bagging_temperature': 5.443204140373399}. Best is trial 1464 with value: 0.8990825688073395.
[32m[I 2023-04-21 00:47:10,901][39m Trial 5042 finished with value: 0.8648648648648648 and parameters: {'objective': 'Logloss', 'colsample_bylevel': 0.09826627786694757, 'depth': 8, 'boosting_type': 'Plain', 'bootstrap_type': 'Bernoulli', 'subsample': 0.30119931544597567}. Best is trial 1464 with value: 0.8990825688073395.
[32m[I 2023-04-21 00:47:11,984][39m Trial 5043 finished with value: 0.8703703703703703 and parameters: {'objective': 'CrossEntropy', 'colsample_bylevel': 0.0899742460935742, 'depth': 12, 'boosting_type': 'Plain', 'bootstrap_type': 'Bayesian', 'bagging_temperature': 5.457434664163624}. Best is trial 1464 with value: 0.8990825688073395.
[32m[I 2023-04-21 00:47:13,042][39m Trial 5044 finished with value: 0.890909090909091 and parameters: {'objective': 'CrossEntropy', 'colsample_bylevel': 0.09102868211756932, 'depth': 12, 'boosting_type': 'Plain', 'bootstrap_type': 'Bayesian', 'bagging_temperature': 5.316092441461136}. Best is trial 1464 with value: 0.8990825688073395.
[32m[I 2023-04-21 00:47:14,307][39m Trial 5045 finished with value: 0.8495575221238938 and parameters: {'objective': 'Logloss', 'colsample_bylevel': 0.09729370203633698, 'depth': 7, 'boosting_type': 'Plain', 'bootstrap_type': 'MVS'}. Best is trial 1464 with value: 0.8990825688073395.
[32m[I 2023-04-21 00:47:16,106][39m Trial 5046 finished with value: 0.8807339449541284 and parameters: {'objective': 'CrossEntropy', 'colsample_bylevel': 0.09822408922635775, 'depth': 9, 'boosting_type': 'Plain', 'bootstrap_type': 'Bayesian', 'bagging_temperature': 4.830470288154464}. Best is trial 1464 with value: 0.8990825688073395.
[32m[I 2023-04-21 00:47:20,994][39m Trial 5047 finished with value: 0.8347826086956522 and parameters: {'objective': 'Logloss', 'colsample_bylevel': 0.09567116436493595, 'depth': 9, 'boosting_type': 'Ordered', 'bootstrap_type': 'Bayesian', 'bagging_temperature': 5.81949549278736}. Best is trial 1464 with value: 0.8990825688073395.
[32m[I 2023-04-21 00:47:22,208][39m Trial 5048 finished with value: 0.8347826086956522 and parameters: {'objective': 'Logloss', 'colsample_bylevel': 0.09439653504682555, 'depth': 4, 'boosting_type': 'Plain', 'bootstrap_type': 'Bayesian', 'bagging_temperature': 7.59467203080792}. Best is trial 1464 with value: 0.8990825688073395.
[32m[I 2023-04-21 00:47:23,672][39m Trial 5049 finished with value: 0.8785046728971961 and parameters: {'objective': 'CrossEntropy', 'colsample_bylevel': 0.09825262292376999, 'depth': 7, 'boosting_type': 'Plain', 'bootstrap_type': 'Bayesian', 'bagging_temperature': 4.962084231377569}. Best is trial 1464 with value: 0.8990825688073395.
[32m[I 2023-04-21 00:47:24,487][39m Trial 5050 finished with value: 0.8571428571428572 and parameters: {'objective': 'CrossEntropy', 'colsample_bylevel': 0.08244116796340531, 'depth': 6, 'boosting_type': 'Plain', 'bootstrap_type': 'Bayesian', 'bagging_temperature': 5.272865374487084}. Best is trial 1464 with value: 0.8990825688073395.
[32m[I 2023-04-21 00:47:25,785][39m Trial 5051 finished with value: 0.888888888888889 and parameters: {'objective': 'CrossEntropy', 'colsample_bylevel': 0.09175990001556447, 'depth': 11, 'boosting_type': 'Plain', 'bootstrap_type': 'Bayesian', 'bagging_temperature': 4.23677313608706}. Best is trial 1464 with value: 0.8990825688073395.
[32m[I 2023-04-21 00:47:27,208][39m Trial 5052 finished with value: 0.8727272727272727 and parameters: {'objective': 'Logloss', 'colsample_bylevel': 0.0983661000880967, 'depth': 7, 'boosting_type': 'Plain', 'bootstrap_type': 'Bayesian', 'bagging_temperature': 4.348430821939699}. Best is trial 1464 with value: 0.8990825688073395.
[32m[I 2023-04-21 00:47:28,355][39m Trial 5053 finished with value: 0.8727272727272727 and parameters: {'objective': 'Logloss', 'colsample_bylevel': 0.09202633369252988, 'depth': 11, 'boosting_type': 'Plain', 'bootstrap_type': 'Bayesian', 'bagging_temperature': 5.888870255845602}. Best is trial 1464 with value: 0.8990825688073395.
[32m[I 2023-04-21 00:47:29,238][39m Trial 5054 finished with value: 0.888888888888889 and parameters: {'objective': 'CrossEntropy', 'colsample_bylevel': 0.09410368885088109, 'depth': 12, 'boosting_type': 'Plain', 'bootstrap_type': 'Bayesian', 'bagging_temperature': 7.014322820557577}. Best is trial 1464 with value: 0.8990825688073395.
[32m[I 2023-04-21 00:47:30,597][39m Trial 5055 finished with value: 0.8828828828828829 and parameters: {'objective': 'Logloss', 'colsample_bylevel': 0.08947404363831485, 'depth': 12, 'boosting_type': 'Plain', 'bootstrap_type': 'Bayesian', 'bagging_temperature': 5.240631210721843}. Best is trial 1464 with value: 0.8990825688073395.
[32m[I 2023-04-21 00:47:32,077][39m Trial 5056 finished with value: 0.8828828828828829 and parameters: {'objective': 'CrossEntropy', 'colsample_bylevel': 0.09474472116363135, 'depth': 12, 'boosting_type': 'Plain', 'bootstrap_type': 'Bayesian', 'bagging_temperature': 5.970489949226956}. Best is trial 1464 with value: 0.8990825688073395.
[32m[I 2023-04-21 00:47:33,126][39m Trial 5057 finished with value: 0.8807339449541284 and parameters: {'objective': 'Logloss', 'colsample_bylevel': 0.09773009221510096, 'depth': 8, 'boosting_type': 'Plain', 'bootstrap_type': 'Bayesian', 'bagging_temperature': 6.667954671575693}. Best is trial 1464 with value: 0.8990825688073395.
[32m[I 2023-04-21 00:47:34,010][39m Trial 5058 finished with value: 0.8727272727272727 and parameters: {'objective': 'Logloss', 'colsample_bylevel': 0.09740395034276807, 'depth': 8, 'boosting_type': 'Plain', 'bootstrap_type': 'Bayesian', 'bagging_temperature': 5.66031760950274}. Best is trial 1464 with value: 0.8990825688073395.
[32m[I 2023-04-21 00:47:35,505][39m Trial 5059 finished with value: 0.8807339449541284 and parameters: {'objective': 'Logloss', 'colsample_bylevel': 0.09787695239137564, 'depth': 9, 'boosting_type': 'Plain', 'bootstrap_type': 'Bayesian', 'bagging_temperature': 5.882411863682275}. Best is trial 1464 with value: 0.8990825688073395.
[32m[I 2023-04-21 00:47:36,739][39m Trial 5060 finished with value: 0.8807339449541284 and parameters: {'objective': 'Logloss', 'colsample_bylevel': 0.08544343934517744, 'depth': 7, 'boosting_type': 'Plain', 'bootstrap_type': 'Bayesian', 'bagging_temperature': 5.3928615570495255}. Best is trial 1464 with value: 0.8990825688073395.
[32m[I 2023-04-21 00:47:37,433][39m Trial 5061 finished with value: 0.8727272727272727 and parameters: {'objective': 'CrossEntropy', 'colsample_bylevel': 0.0923338558757078, 'depth': 11, 'boosting_type': 'Plain', 'bootstrap_type': 'Bayesian', 'bagging_temperature': 6.680977208861486}. Best is trial 1464 with value: 0.8990825688073395.
[32m[I 2023-04-21 00:47:39,168][39m Trial 5062 finished with value: 0.8727272727272727 and parameters: {'objective': 'Logloss', 'colsample_bylevel': 0.09122677488407381, 'depth': 9, 'boosting_type': 'Plain', 'bootstrap_type': 'Bayesian', 'bagging_temperature': 7.594627166320477}. Best is trial 1464 with value: 0.8990825688073395.
[32m[I 2023-04-21 00:47:40,543][39m Trial 5063 finished with value: 0.8672566371681416 and parameters: {'objective': 'Logloss', 'colsample_bylevel': 0.09718792842680406, 'depth': 9, 'boosting_type': 'Plain', 'bootstrap_type': 'Bernoulli', 'subsample': 0.38463157721404034}. Best is trial 1464 with value: 0.8990825688073395.
[32m[I 2023-04-21 00:47:41,664][39m Trial 5064 finished with value: 0.8596491228070176 and parameters: {'objective': 'CrossEntropy', 'colsample_bylevel': 0.08337570718209784, 'depth': 12, 'boosting_type': 'Plain', 'bootstrap_type': 'Bayesian', 'bagging_temperature': 6.969063201464739}. Best is trial 1464 with value: 0.8990825688073395.
[32m[I 2023-04-21 00:47:42,577][39m Trial 5065 finished with value: 0.8648648648648648 and parameters: {'objective': 'CrossEntropy', 'colsample_bylevel': 0.08610687305928248, 'depth': 12, 'boosting_type': 'Plain', 'bootstrap_type': 'Bayesian', 'bagging_temperature': 6.979621850378256}. Best is trial 1464 with value: 0.8990825688073395.
[32m[I 2023-04-21 00:47:46,336][39m Trial 5066 finished with value: 0.8571428571428572 and parameters: {'objective': 'Logloss', 'colsample_bylevel': 0.08616258926733122, 'depth': 8, 'boosting_type': 'Ordered', 'bootstrap_type': 'MVS'}. Best is trial 1464 with value: 0.8990825688073395.
[32m[I 2023-04-21 00:47:47,563][39m Trial 5067 finished with value: 0.8785046728971961 and parameters: {'objective': 'Logloss', 'colsample_bylevel': 0.09520921001833081, 'depth': 9, 'boosting_type': 'Plain', 'bootstrap_type': 'Bayesian', 'bagging_temperature': 6.1368495079028085}. Best is trial 1464 with value: 0.8990825688073395.
