[32m[I 2023-04-20 23:26:25,916][39m Trial 1391 finished with value: 0.8421052631578947 and parameters: {'objective': 'CrossEntropy', 'colsample_bylevel': 0.09633124889284396, 'depth': 6, 'boosting_type': 'Plain', 'bootstrap_type': 'MVS'}. Best is trial 205 with value: 0.890909090909091.
[32m[I 2023-04-20 23:26:26,894][39m Trial 1392 finished with value: 0.888888888888889 and parameters: {'objective': 'Logloss', 'colsample_bylevel': 0.09621072583419552, 'depth': 7, 'boosting_type': 'Plain', 'bootstrap_type': 'Bayesian', 'bagging_temperature': 6.213841794562645}. Best is trial 205 with value: 0.890909090909091.
[32m[I 2023-04-20 23:26:27,833][39m Trial 1393 finished with value: 0.8807339449541284 and parameters: {'objective': 'Logloss', 'colsample_bylevel': 0.0948361835640063, 'depth': 7, 'boosting_type': 'Plain', 'bootstrap_type': 'Bayesian', 'bagging_temperature': 6.298281961043997}. Best is trial 205 with value: 0.890909090909091.
[32m[I 2023-04-20 23:26:28,686][39m Trial 1394 finished with value: 0.8807339449541284 and parameters: {'objective': 'CrossEntropy', 'colsample_bylevel': 0.09678921440743356, 'depth': 6, 'boosting_type': 'Plain', 'bootstrap_type': 'Bayesian', 'bagging_temperature': 4.476455079134856}. Best is trial 205 with value: 0.890909090909091.
[32m[I 2023-04-20 23:26:29,510][39m Trial 1395 finished with value: 0.8807339449541284 and parameters: {'objective': 'CrossEntropy', 'colsample_bylevel': 0.09343025116413452, 'depth': 12, 'boosting_type': 'Plain', 'bootstrap_type': 'Bayesian', 'bagging_temperature': 3.726117877738629}. Best is trial 205 with value: 0.890909090909091.
[32m[I 2023-04-20 23:26:30,662][39m Trial 1396 finished with value: 0.8807339449541284 and parameters: {'objective': 'CrossEntropy', 'colsample_bylevel': 0.09249023822979924, 'depth': 10, 'boosting_type': 'Plain', 'bootstrap_type': 'Bayesian', 'bagging_temperature': 3.614593908715639}. Best is trial 205 with value: 0.890909090909091.
[32m[I 2023-04-20 23:26:31,780][39m Trial 1397 finished with value: 0.8807339449541284 and parameters: {'objective': 'CrossEntropy', 'colsample_bylevel': 0.09261744201698857, 'depth': 9, 'boosting_type': 'Plain', 'bootstrap_type': 'Bayesian', 'bagging_temperature': 4.955108854088671}. Best is trial 205 with value: 0.890909090909091.
[32m[I 2023-04-20 23:26:38,272][39m Trial 1398 finished with value: 0.8421052631578947 and parameters: {'objective': 'Logloss', 'colsample_bylevel': 0.09720145979598344, 'depth': 6, 'boosting_type': 'Ordered', 'bootstrap_type': 'Bayesian', 'bagging_temperature': 2.086228580371327}. Best is trial 205 with value: 0.890909090909091.
[32m[I 2023-04-20 23:26:39,236][39m Trial 1399 finished with value: 0.8807339449541284 and parameters: {'objective': 'Logloss', 'colsample_bylevel': 0.0947879864396814, 'depth': 10, 'boosting_type': 'Plain', 'bootstrap_type': 'Bayesian', 'bagging_temperature': 3.925647933208383}. Best is trial 205 with value: 0.890909090909091.
[32m[I 2023-04-20 23:26:40,208][39m Trial 1400 finished with value: 0.8807339449541284 and parameters: {'objective': 'CrossEntropy', 'colsample_bylevel': 0.09218666362983638, 'depth': 10, 'boosting_type': 'Plain', 'bootstrap_type': 'Bernoulli', 'subsample': 0.19354414252484775}. Best is trial 205 with value: 0.890909090909091.
[32m[I 2023-04-20 23:26:40,864][39m Trial 1401 finished with value: 0.8571428571428572 and parameters: {'objective': 'CrossEntropy', 'colsample_bylevel': 0.06770886132729385, 'depth': 9, 'boosting_type': 'Plain', 'bootstrap_type': 'Bayesian', 'bagging_temperature': 6.107080099244736}. Best is trial 205 with value: 0.890909090909091.
[32m[I 2023-04-20 23:26:41,435][39m Trial 1402 finished with value: 0.8828828828828829 and parameters: {'objective': 'CrossEntropy', 'colsample_bylevel': 0.09124586290563778, 'depth': 10, 'boosting_type': 'Plain', 'bootstrap_type': 'Bayesian', 'bagging_temperature': 5.041062476225996}. Best is trial 205 with value: 0.890909090909091.
[32m[I 2023-04-20 23:26:43,016][39m Trial 1403 finished with value: 0.8727272727272727 and parameters: {'objective': 'CrossEntropy', 'colsample_bylevel': 0.09265852986850846, 'depth': 9, 'boosting_type': 'Plain', 'bootstrap_type': 'Bayesian', 'bagging_temperature': 4.878403975311581}. Best is trial 205 with value: 0.890909090909091.
[32m[I 2023-04-20 23:26:43,582][39m Trial 1404 finished with value: 0.8807339449541284 and parameters: {'objective': 'CrossEntropy', 'colsample_bylevel': 0.09978390490865835, 'depth': 12, 'boosting_type': 'Plain', 'bootstrap_type': 'Bayesian', 'bagging_temperature': 5.321825704516809}. Best is trial 205 with value: 0.890909090909091.
[32m[I 2023-04-20 23:26:44,414][39m Trial 1405 finished with value: 0.8727272727272727 and parameters: {'objective': 'Logloss', 'colsample_bylevel': 0.09444131886666036, 'depth': 8, 'boosting_type': 'Plain', 'bootstrap_type': 'Bayesian', 'bagging_temperature': 6.125580858556301}. Best is trial 205 with value: 0.890909090909091.
[32m[I 2023-04-20 23:26:45,331][39m Trial 1406 finished with value: 0.8571428571428572 and parameters: {'objective': 'CrossEntropy', 'colsample_bylevel': 0.07652092024340743, 'depth': 12, 'boosting_type': 'Plain', 'bootstrap_type': 'Bayesian', 'bagging_temperature': 7.390348890225045}. Best is trial 205 with value: 0.890909090909091.
[32m[I 2023-04-20 23:26:46,259][39m Trial 1407 finished with value: 0.8785046728971961 and parameters: {'objective': 'CrossEntropy', 'colsample_bylevel': 0.09839872950855619, 'depth': 6, 'boosting_type': 'Plain', 'bootstrap_type': 'Bayesian', 'bagging_temperature': 6.048978778798362}. Best is trial 205 with value: 0.890909090909091.
[32m[I 2023-04-20 23:26:47,867][39m Trial 1408 finished with value: 0.8648648648648648 and parameters: {'objective': 'Logloss', 'colsample_bylevel': 0.09628631681224152, 'depth': 9, 'boosting_type': 'Plain', 'bootstrap_type': 'Bayesian', 'bagging_temperature': 4.221345236498469}. Best is trial 205 with value: 0.890909090909091.
[32m[I 2023-04-20 23:26:48,753][39m Trial 1409 finished with value: 0.8807339449541284 and parameters: {'objective': 'CrossEntropy', 'colsample_bylevel': 0.09529657073672648, 'depth': 9, 'boosting_type': 'Plain', 'bootstrap_type': 'Bayesian', 'bagging_temperature': 4.573821798860962}. Best is trial 205 with value: 0.890909090909091.
[32m[I 2023-04-20 23:26:49,538][39m Trial 1410 finished with value: 0.8807339449541284 and parameters: {'objective': 'CrossEntropy', 'colsample_bylevel': 0.0931031028673781, 'depth': 10, 'boosting_type': 'Plain', 'bootstrap_type': 'Bayesian', 'bagging_temperature': 8.239179621434854}. Best is trial 205 with value: 0.890909090909091.
[32m[I 2023-04-20 23:26:51,073][39m Trial 1411 finished with value: 0.8727272727272727 and parameters: {'objective': 'Logloss', 'colsample_bylevel': 0.09037469705049586, 'depth': 9, 'boosting_type': 'Plain', 'bootstrap_type': 'Bayesian', 'bagging_temperature': 6.568791405338338}. Best is trial 205 with value: 0.890909090909091.
[32m[I 2023-04-20 23:26:51,864][39m Trial 1412 finished with value: 0.8807339449541284 and parameters: {'objective': 'Logloss', 'colsample_bylevel': 0.09765743549962702, 'depth': 7, 'boosting_type': 'Plain', 'bootstrap_type': 'Bayesian', 'bagging_temperature': 5.977807425636591}. Best is trial 205 with value: 0.890909090909091.
[32m[I 2023-04-20 23:26:52,717][39m Trial 1413 finished with value: 0.8807339449541284 and parameters: {'objective': 'CrossEntropy', 'colsample_bylevel': 0.09802456976422769, 'depth': 12, 'boosting_type': 'Plain', 'bootstrap_type': 'Bernoulli', 'subsample': 0.29417415081079146}. Best is trial 205 with value: 0.890909090909091.
[32m[I 2023-04-20 23:26:56,743][39m Trial 1414 finished with value: 0.8347826086956522 and parameters: {'objective': 'CrossEntropy', 'colsample_bylevel': 0.09449302321173762, 'depth': 10, 'boosting_type': 'Ordered', 'bootstrap_type': 'Bayesian', 'bagging_temperature': 3.41070494462539}. Best is trial 205 with value: 0.890909090909091.
[32m[I 2023-04-20 23:26:57,659][39m Trial 1415 finished with value: 0.8571428571428572 and parameters: {'objective': 'Logloss', 'colsample_bylevel': 0.09867434967774531, 'depth': 8, 'boosting_type': 'Plain', 'bootstrap_type': 'MVS'}. Best is trial 205 with value: 0.890909090909091.
[32m[I 2023-04-20 23:26:58,640][39m Trial 1416 finished with value: 0.8596491228070176 and parameters: {'objective': 'Logloss', 'colsample_bylevel': 0.07260133247377384, 'depth': 6, 'boosting_type': 'Plain', 'bootstrap_type': 'Bayesian', 'bagging_temperature': 5.846763440642184}. Best is trial 205 with value: 0.890909090909091.
[32m[I 2023-04-20 23:26:59,838][39m Trial 1417 finished with value: 0.8727272727272727 and parameters: {'objective': 'Logloss', 'colsample_bylevel': 0.09571150436564926, 'depth': 11, 'boosting_type': 'Plain', 'bootstrap_type': 'Bayesian', 'bagging_temperature': 4.706335960186338}. Best is trial 205 with value: 0.890909090909091.
[32m[I 2023-04-20 23:27:00,831][39m Trial 1418 finished with value: 0.888888888888889 and parameters: {'objective': 'Logloss', 'colsample_bylevel': 0.09316559706401652, 'depth': 10, 'boosting_type': 'Plain', 'bootstrap_type': 'Bayesian', 'bagging_temperature': 3.575494607548448}. Best is trial 205 with value: 0.890909090909091.
[32m[I 2023-04-20 23:27:01,844][39m Trial 1419 finished with value: 0.8727272727272727 and parameters: {'objective': 'Logloss', 'colsample_bylevel': 0.09438141917246753, 'depth': 6, 'boosting_type': 'Plain', 'bootstrap_type': 'Bayesian', 'bagging_temperature': 3.7656307310080215}. Best is trial 205 with value: 0.890909090909091.
[32m[I 2023-04-20 23:27:02,714][39m Trial 1420 finished with value: 0.8807339449541284 and parameters: {'objective': 'CrossEntropy', 'colsample_bylevel': 0.0970485799870198, 'depth': 6, 'boosting_type': 'Plain', 'bootstrap_type': 'Bayesian', 'bagging_temperature': 4.121006826250501}. Best is trial 205 with value: 0.890909090909091.
[32m[I 2023-04-20 23:27:03,381][39m Trial 1421 finished with value: 0.875 and parameters: {'objective': 'Logloss', 'colsample_bylevel': 0.09804651476729062, 'depth': 7, 'boosting_type': 'Plain', 'bootstrap_type': 'Bernoulli', 'subsample': 0.1281613954272057}. Best is trial 205 with value: 0.890909090909091.
[32m[I 2023-04-20 23:27:04,660][39m Trial 1422 finished with value: 0.8275862068965517 and parameters: {'objective': 'Logloss', 'colsample_bylevel': 0.0959943593574977, 'depth': 3, 'boosting_type': 'Plain', 'bootstrap_type': 'Bayesian', 'bagging_temperature': 4.0045955376301166}. Best is trial 205 with value: 0.890909090909091.
[32m[I 2023-04-20 23:27:06,112][39m Trial 1423 finished with value: 0.8807339449541284 and parameters: {'objective': 'Logloss', 'colsample_bylevel': 0.09405375154150131, 'depth': 9, 'boosting_type': 'Plain', 'bootstrap_type': 'Bayesian', 'bagging_temperature': 4.445909968373149}. Best is trial 205 with value: 0.890909090909091.
[32m[I 2023-04-20 23:27:07,120][39m Trial 1424 finished with value: 0.8392857142857144 and parameters: {'objective': 'CrossEntropy', 'colsample_bylevel': 0.07974239546331185, 'depth': 6, 'boosting_type': 'Plain', 'bootstrap_type': 'Bayesian', 'bagging_temperature': 4.3026905981239025}. Best is trial 205 with value: 0.890909090909091.
[32m[I 2023-04-20 23:27:07,930][39m Trial 1425 finished with value: 0.888888888888889 and parameters: {'objective': 'Logloss', 'colsample_bylevel': 0.09596274606259297, 'depth': 10, 'boosting_type': 'Plain', 'bootstrap_type': 'Bayesian', 'bagging_temperature': 4.048211073220682}. Best is trial 205 with value: 0.890909090909091.
[32m[I 2023-04-20 23:27:08,695][39m Trial 1426 finished with value: 0.8807339449541284 and parameters: {'objective': 'Logloss', 'colsample_bylevel': 0.09821918918096834, 'depth': 7, 'boosting_type': 'Plain', 'bootstrap_type': 'Bayesian', 'bagging_temperature': 6.626380627594948}. Best is trial 205 with value: 0.890909090909091.
[32m[I 2023-04-20 23:27:09,573][39m Trial 1427 finished with value: 0.8807339449541284 and parameters: {'objective': 'Logloss', 'colsample_bylevel': 0.09786693852530878, 'depth': 8, 'boosting_type': 'Plain', 'bootstrap_type': 'Bayesian', 'bagging_temperature': 3.6880726525882053}. Best is trial 205 with value: 0.890909090909091.
[32m[I 2023-04-20 23:27:10,629][39m Trial 1428 finished with value: 0.8807339449541284 and parameters: {'objective': 'Logloss', 'colsample_bylevel': 0.09832849409172209, 'depth': 7, 'boosting_type': 'Plain', 'bootstrap_type': 'Bayesian', 'bagging_temperature': 5.927280304763345}. Best is trial 205 with value: 0.890909090909091.
[32m[I 2023-04-20 23:27:11,961][39m Trial 1429 finished with value: 0.8648648648648648 and parameters: {'objective': 'CrossEntropy', 'colsample_bylevel': 0.08525252135151964, 'depth': 9, 'boosting_type': 'Plain', 'bootstrap_type': 'Bayesian', 'bagging_temperature': 4.6392184594115085}. Best is trial 205 with value: 0.890909090909091.
[32m[I 2023-04-20 23:27:13,267][39m Trial 1430 finished with value: 0.8727272727272727 and parameters: {'objective': 'CrossEntropy', 'colsample_bylevel': 0.08949179535954996, 'depth': 9, 'boosting_type': 'Plain', 'bootstrap_type': 'Bayesian', 'bagging_temperature': 6.003940433112186}. Best is trial 205 with value: 0.890909090909091.
[32m[I 2023-04-20 23:27:14,565][39m Trial 1431 finished with value: 0.8648648648648648 and parameters: {'objective': 'CrossEntropy', 'colsample_bylevel': 0.08813843951876094, 'depth': 9, 'boosting_type': 'Plain', 'bootstrap_type': 'Bayesian', 'bagging_temperature': 5.185176489151688}. Best is trial 205 with value: 0.890909090909091.
[32m[I 2023-04-20 23:27:15,685][39m Trial 1432 finished with value: 0.8598130841121495 and parameters: {'objective': 'CrossEntropy', 'colsample_bylevel': 0.09368653026739214, 'depth': 10, 'boosting_type': 'Plain', 'bootstrap_type': 'Bayesian', 'bagging_temperature': 5.259129722586863}. Best is trial 205 with value: 0.890909090909091.
[32m[I 2023-04-20 23:27:17,005][39m Trial 1433 finished with value: 0.8807339449541284 and parameters: {'objective': 'CrossEntropy', 'colsample_bylevel': 0.09439000253443147, 'depth': 10, 'boosting_type': 'Plain', 'bootstrap_type': 'Bayesian', 'bagging_temperature': 6.74335639671288}. Best is trial 205 with value: 0.890909090909091.
[32m[I 2023-04-20 23:27:17,568][39m Trial 1434 finished with value: 0.8727272727272727 and parameters: {'objective': 'CrossEntropy', 'colsample_bylevel': 0.0890824052544271, 'depth': 10, 'boosting_type': 'Plain', 'bootstrap_type': 'Bayesian', 'bagging_temperature': 4.91912541976108}. Best is trial 205 with value: 0.890909090909091.
[32m[I 2023-04-20 23:27:22,599][39m Trial 1435 finished with value: 0.8421052631578947 and parameters: {'objective': 'Logloss', 'colsample_bylevel': 0.09134335641676894, 'depth': 9, 'boosting_type': 'Ordered', 'bootstrap_type': 'MVS'}. Best is trial 205 with value: 0.890909090909091.
[32m[I 2023-04-20 23:27:23,616][39m Trial 1436 finished with value: 0.8727272727272727 and parameters: {'objective': 'Logloss', 'colsample_bylevel': 0.09979680259043461, 'depth': 8, 'boosting_type': 'Plain', 'bootstrap_type': 'Bayesian', 'bagging_temperature': 3.6294988004304383}. Best is trial 205 with value: 0.890909090909091.
[32m[I 2023-04-20 23:27:24,793][39m Trial 1437 finished with value: 0.8727272727272727 and parameters: {'objective': 'CrossEntropy', 'colsample_bylevel': 0.09212338728100314, 'depth': 11, 'boosting_type': 'Plain', 'bootstrap_type': 'Bayesian', 'bagging_temperature': 6.422574818631423}. Best is trial 205 with value: 0.890909090909091.
[32m[I 2023-04-20 23:27:25,906][39m Trial 1438 finished with value: 0.8807339449541284 and parameters: {'objective': 'Logloss', 'colsample_bylevel': 0.0965349901690863, 'depth': 9, 'boosting_type': 'Plain', 'bootstrap_type': 'Bayesian', 'bagging_temperature': 4.188341362852598}. Best is trial 205 with value: 0.890909090909091.
[32m[I 2023-04-20 23:27:26,842][39m Trial 1439 finished with value: 0.8807339449541284 and parameters: {'objective': 'Logloss', 'colsample_bylevel': 0.0938149773303137, 'depth': 10, 'boosting_type': 'Plain', 'bootstrap_type': 'Bayesian', 'bagging_temperature': 4.366448868688917}. Best is trial 205 with value: 0.890909090909091.
[32m[I 2023-04-20 23:27:28,223][39m Trial 1440 finished with value: 0.8807339449541284 and parameters: {'objective': 'Logloss', 'colsample_bylevel': 0.09153988645534666, 'depth': 9, 'boosting_type': 'Plain', 'bootstrap_type': 'Bayesian', 'bagging_temperature': 4.24142638995786}. Best is trial 205 with value: 0.890909090909091.
[32m[I 2023-04-20 23:27:29,180][39m Trial 1441 finished with value: 0.8727272727272727 and parameters: {'objective': 'Logloss', 'colsample_bylevel': 0.09304499221120804, 'depth': 11, 'boosting_type': 'Plain', 'bootstrap_type': 'Bayesian', 'bagging_temperature': 8.616735460405058}. Best is trial 205 with value: 0.890909090909091.
[32m[I 2023-04-20 23:27:30,547][39m Trial 1442 finished with value: 0.8727272727272727 and parameters: {'objective': 'Logloss', 'colsample_bylevel': 0.09399418234053987, 'depth': 9, 'boosting_type': 'Plain', 'bootstrap_type': 'Bayesian', 'bagging_temperature': 4.262277693123168}. Best is trial 205 with value: 0.890909090909091.
[32m[I 2023-04-20 23:27:31,492][39m Trial 1443 finished with value: 0.8828828828828829 and parameters: {'objective': 'Logloss', 'colsample_bylevel': 0.09494140868349199, 'depth': 10, 'boosting_type': 'Plain', 'bootstrap_type': 'Bayesian', 'bagging_temperature': 4.0147968253785065}. Best is trial 205 with value: 0.890909090909091.
[32m[I 2023-04-20 23:27:33,042][39m Trial 1445 finished with value: 0.8672566371681416 and parameters: {'objective': 'CrossEntropy', 'colsample_bylevel': 0.09757734034958722, 'depth': 9, 'boosting_type': 'Plain', 'bootstrap_type': 'MVS'}. Best is trial 205 with value: 0.890909090909091.
[32m[I 2023-04-20 23:27:33,935][39m Trial 1446 finished with value: 0.875 and parameters: {'objective': 'CrossEntropy', 'colsample_bylevel': 0.09700089266348401, 'depth': 9, 'boosting_type': 'Plain', 'bootstrap_type': 'Bayesian', 'bagging_temperature': 4.175340833552043}. Best is trial 205 with value: 0.890909090909091.
[32m[I 2023-04-20 23:27:35,116][39m Trial 1447 finished with value: 0.888888888888889 and parameters: {'objective': 'Logloss', 'colsample_bylevel': 0.09775649523439138, 'depth': 12, 'boosting_type': 'Plain', 'bootstrap_type': 'Bayesian', 'bagging_temperature': 4.7888268255085835}. Best is trial 205 with value: 0.890909090909091.
[32m[I 2023-04-20 23:27:36,259][39m Trial 1448 finished with value: 0.8807339449541284 and parameters: {'objective': 'Logloss', 'colsample_bylevel': 0.09823504768198825, 'depth': 8, 'boosting_type': 'Plain', 'bootstrap_type': 'Bayesian', 'bagging_temperature': 5.682406624523015}. Best is trial 205 with value: 0.890909090909091.
[32m[I 2023-04-20 23:27:36,881][39m Trial 1449 finished with value: 0.8828828828828829 and parameters: {'objective': 'CrossEntropy', 'colsample_bylevel': 0.09631914927876911, 'depth': 11, 'boosting_type': 'Plain', 'bootstrap_type': 'Bayesian', 'bagging_temperature': 2.203827882101533}. Best is trial 205 with value: 0.890909090909091.
[32m[I 2023-04-20 23:27:37,774][39m Trial 1450 finished with value: 0.8807339449541284 and parameters: {'objective': 'CrossEntropy', 'colsample_bylevel': 0.09028827346806172, 'depth': 10, 'boosting_type': 'Plain', 'bootstrap_type': 'Bayesian', 'bagging_temperature': 2.9710194933542513}. Best is trial 205 with value: 0.890909090909091.
[32m[I 2023-04-20 23:27:39,031][39m Trial 1451 finished with value: 0.8727272727272727 and parameters: {'objective': 'CrossEntropy', 'colsample_bylevel': 0.09611123954671519, 'depth': 8, 'boosting_type': 'Plain', 'bootstrap_type': 'Bayesian', 'bagging_temperature': 5.844643310262668}. Best is trial 205 with value: 0.890909090909091.
[32m[I 2023-04-20 23:27:39,750][39m Trial 1452 finished with value: 0.8571428571428572 and parameters: {'objective': 'CrossEntropy', 'colsample_bylevel': 0.08705266514130258, 'depth': 7, 'boosting_type': 'Plain', 'bootstrap_type': 'Bayesian', 'bagging_temperature': 2.2668025557247358}. Best is trial 205 with value: 0.890909090909091.
[32m[I 2023-04-20 23:27:40,979][39m Trial 1453 finished with value: 0.8421052631578947 and parameters: {'objective': 'Logloss', 'colsample_bylevel': 0.09666228156543172, 'depth': 5, 'boosting_type': 'Plain', 'bootstrap_type': 'Bernoulli', 'subsample': 0.36610149046069695}. Best is trial 205 with value: 0.890909090909091.
[32m[I 2023-04-20 23:27:41,936][39m Trial 1454 finished with value: 0.8807339449541284 and parameters: {'objective': 'Logloss', 'colsample_bylevel': 0.09356865979691739, 'depth': 10, 'boosting_type': 'Plain', 'bootstrap_type': 'Bayesian', 'bagging_temperature': 6.4260191764360055}. Best is trial 205 with value: 0.890909090909091.
[32m[I 2023-04-20 23:27:47,081][39m Trial 1455 finished with value: 0.8495575221238938 and parameters: {'objective': 'CrossEntropy', 'colsample_bylevel': 0.08959525495483002, 'depth': 10, 'boosting_type': 'Ordered', 'bootstrap_type': 'Bayesian', 'bagging_temperature': 5.047953642449159}. Best is trial 205 with value: 0.890909090909091.
[32m[I 2023-04-20 23:27:48,585][39m Trial 1456 finished with value: 0.8623853211009175 and parameters: {'objective': 'CrossEntropy', 'colsample_bylevel': 0.09860450351406029, 'depth': 9, 'boosting_type': 'Plain', 'bootstrap_type': 'Bayesian', 'bagging_temperature': 4.503822770649579}. Best is trial 205 with value: 0.890909090909091.
[32m[I 2023-04-20 23:27:49,540][39m Trial 1457 finished with value: 0.8347826086956522 and parameters: {'objective': 'CrossEntropy', 'colsample_bylevel': 0.05497744353491851, 'depth': 12, 'boosting_type': 'Plain', 'bootstrap_type': 'Bayesian', 'bagging_temperature': 5.711103685999183}. Best is trial 205 with value: 0.890909090909091.
