[32m[I 2023-04-20 23:42:56,635][39m Trial 2178 finished with value: 0.8421052631578947 and parameters: {'objective': 'CrossEntropy', 'colsample_bylevel': 0.08691716868597996, 'depth': 10, 'boosting_type': 'Plain', 'bootstrap_type': 'Bernoulli', 'subsample': 0.1034135033803689}. Best is trial 1464 with value: 0.8990825688073395.
[32m[I 2023-04-20 23:42:58,027][39m Trial 2179 finished with value: 0.8703703703703703 and parameters: {'objective': 'Logloss', 'colsample_bylevel': 0.0956485598867338, 'depth': 7, 'boosting_type': 'Plain', 'bootstrap_type': 'Bayesian', 'bagging_temperature': 5.560157297775554}. Best is trial 1464 with value: 0.8990825688073395.
[32m[I 2023-04-20 23:42:59,035][39m Trial 2180 finished with value: 0.8703703703703703 and parameters: {'objective': 'CrossEntropy', 'colsample_bylevel': 0.09067592467142628, 'depth': 10, 'boosting_type': 'Plain', 'bootstrap_type': 'Bayesian', 'bagging_temperature': 8.0979075860264}. Best is trial 1464 with value: 0.8990825688073395.
[32m[I 2023-04-20 23:42:59,777][39m Trial 2181 finished with value: 0.8648648648648648 and parameters: {'objective': 'Logloss', 'colsample_bylevel': 0.0996003764148577, 'depth': 8, 'boosting_type': 'Plain', 'bootstrap_type': 'Bayesian', 'bagging_temperature': 3.8947789231647914}. Best is trial 1464 with value: 0.8990825688073395.
[32m[I 2023-04-20 23:43:00,467][39m Trial 2182 finished with value: 0.888888888888889 and parameters: {'objective': 'CrossEntropy', 'colsample_bylevel': 0.08865984896397526, 'depth': 10, 'boosting_type': 'Plain', 'bootstrap_type': 'Bayesian', 'bagging_temperature': 5.6493408513319645}. Best is trial 1464 with value: 0.8990825688073395.
[32m[I 2023-04-20 23:43:01,939][39m Trial 2183 finished with value: 0.888888888888889 and parameters: {'objective': 'CrossEntropy', 'colsample_bylevel': 0.09118893780682576, 'depth': 9, 'boosting_type': 'Plain', 'bootstrap_type': 'Bayesian', 'bagging_temperature': 5.181958549457678}. Best is trial 1464 with value: 0.8990825688073395.
[32m[I 2023-04-20 23:43:03,320][39m Trial 2184 finished with value: 0.8596491228070176 and parameters: {'objective': 'Logloss', 'colsample_bylevel': 0.09251430015653206, 'depth': 9, 'boosting_type': 'Plain', 'bootstrap_type': 'MVS'}. Best is trial 1464 with value: 0.8990825688073395.
[32m[I 2023-04-20 23:43:04,002][39m Trial 2185 finished with value: 0.8305084745762712 and parameters: {'objective': 'CrossEntropy', 'colsample_bylevel': 0.032309192467029, 'depth': 8, 'boosting_type': 'Plain', 'bootstrap_type': 'Bernoulli', 'subsample': 0.371300141372063}. Best is trial 1464 with value: 0.8990825688073395.
[32m[I 2023-04-20 23:43:05,621][39m Trial 2186 finished with value: 0.8648648648648648 and parameters: {'objective': 'Logloss', 'colsample_bylevel': 0.09128422943675213, 'depth': 9, 'boosting_type': 'Plain', 'bootstrap_type': 'Bayesian', 'bagging_temperature': 5.259304611616306}. Best is trial 1464 with value: 0.8990825688073395.
[32m[I 2023-04-20 23:43:06,469][39m Trial 2187 finished with value: 0.8727272727272727 and parameters: {'objective': 'CrossEntropy', 'colsample_bylevel': 0.0936341962015074, 'depth': 9, 'boosting_type': 'Plain', 'bootstrap_type': 'Bayesian', 'bagging_temperature': 5.436161969241587}. Best is trial 1464 with value: 0.8990825688073395.
[32m[I 2023-04-20 23:43:07,155][39m Trial 2188 finished with value: 0.8727272727272727 and parameters: {'objective': 'CrossEntropy', 'colsample_bylevel': 0.08471000963652446, 'depth': 10, 'boosting_type': 'Plain', 'bootstrap_type': 'Bayesian', 'bagging_temperature': 4.744428298243978}. Best is trial 1464 with value: 0.8990825688073395.
[32m[I 2023-04-20 23:43:08,359][39m Trial 2189 finished with value: 0.8807339449541284 and parameters: {'objective': 'CrossEntropy', 'colsample_bylevel': 0.0875167934319905, 'depth': 10, 'boosting_type': 'Plain', 'bootstrap_type': 'Bayesian', 'bagging_temperature': 7.458682476573041}. Best is trial 1464 with value: 0.8990825688073395.
[32m[I 2023-04-20 23:43:09,250][39m Trial 2190 finished with value: 0.8305084745762712 and parameters: {'objective': 'Logloss', 'colsample_bylevel': 0.09596859626660248, 'depth': 2, 'boosting_type': 'Plain', 'bootstrap_type': 'Bayesian', 'bagging_temperature': 5.154270110323604}. Best is trial 1464 with value: 0.8990825688073395.
[32m[I 2023-04-20 23:43:14,558][39m Trial 2191 finished with value: 0.8347826086956522 and parameters: {'objective': 'Logloss', 'colsample_bylevel': 0.09182579977916992, 'depth': 9, 'boosting_type': 'Ordered', 'bootstrap_type': 'Bayesian', 'bagging_temperature': 5.046054667218987}. Best is trial 1464 with value: 0.8990825688073395.
[32m[I 2023-04-20 23:43:15,818][39m Trial 2192 finished with value: 0.8545454545454546 and parameters: {'objective': 'Logloss', 'colsample_bylevel': 0.0783750336634127, 'depth': 10, 'boosting_type': 'Plain', 'bootstrap_type': 'Bayesian', 'bagging_temperature': 3.6244173008323903}. Best is trial 1464 with value: 0.8990825688073395.
[32m[I 2023-04-20 23:43:16,868][39m Trial 2193 finished with value: 0.8727272727272727 and parameters: {'objective': 'CrossEntropy', 'colsample_bylevel': 0.08553625773258988, 'depth': 10, 'boosting_type': 'Plain', 'bootstrap_type': 'Bayesian', 'bagging_temperature': 0.8949091026092015}. Best is trial 1464 with value: 0.8990825688073395.
[32m[I 2023-04-20 23:43:17,714][39m Trial 2194 finished with value: 0.8807339449541284 and parameters: {'objective': 'CrossEntropy', 'colsample_bylevel': 0.09155581676304317, 'depth': 10, 'boosting_type': 'Plain', 'bootstrap_type': 'Bayesian', 'bagging_temperature': 5.516064195111192}. Best is trial 1464 with value: 0.8990825688073395.
[32m[I 2023-04-20 23:43:18,610][39m Trial 2195 finished with value: 0.8623853211009175 and parameters: {'objective': 'Logloss', 'colsample_bylevel': 0.08847833356354139, 'depth': 10, 'boosting_type': 'Plain', 'bootstrap_type': 'Bayesian', 'bagging_temperature': 4.746600295566398}. Best is trial 1464 with value: 0.8990825688073395.
[32m[I 2023-04-20 23:43:19,670][39m Trial 2196 finished with value: 0.8571428571428572 and parameters: {'objective': 'Logloss', 'colsample_bylevel': 0.0812794878584434, 'depth': 10, 'boosting_type': 'Plain', 'bootstrap_type': 'Bayesian', 'bagging_temperature': 5.314323609598687}. Best is trial 1464 with value: 0.8990825688073395.
[32m[I 2023-04-20 23:43:20,746][39m Trial 2197 finished with value: 0.8807339449541284 and parameters: {'objective': 'Logloss', 'colsample_bylevel': 0.09339646866667192, 'depth': 10, 'boosting_type': 'Plain', 'bootstrap_type': 'Bayesian', 'bagging_temperature': 5.449805277612896}. Best is trial 1464 with value: 0.8990825688073395.
[32m[I 2023-04-20 23:43:22,143][39m Trial 2198 finished with value: 0.8545454545454546 and parameters: {'objective': 'CrossEntropy', 'colsample_bylevel': 0.09196719340023546, 'depth': 8, 'boosting_type': 'Plain', 'bootstrap_type': 'Bayesian', 'bagging_temperature': 3.83285987361657}. Best is trial 1464 with value: 0.8990825688073395.
[32m[I 2023-04-20 23:43:23,033][39m Trial 2199 finished with value: 0.8703703703703703 and parameters: {'objective': 'Logloss', 'colsample_bylevel': 0.08524086271491423, 'depth': 8, 'boosting_type': 'Plain', 'bootstrap_type': 'Bayesian', 'bagging_temperature': 5.306197168098285}. Best is trial 1464 with value: 0.8990825688073395.
[32m[I 2023-04-20 23:43:24,295][39m Trial 2200 finished with value: 0.888888888888889 and parameters: {'objective': 'Logloss', 'colsample_bylevel': 0.09413566896454008, 'depth': 9, 'boosting_type': 'Plain', 'bootstrap_type': 'Bayesian', 'bagging_temperature': 4.950145569020292}. Best is trial 1464 with value: 0.8990825688073395.
[32m[I 2023-04-20 23:43:25,237][39m Trial 2201 finished with value: 0.8807339449541284 and parameters: {'objective': 'CrossEntropy', 'colsample_bylevel': 0.09525718949806891, 'depth': 9, 'boosting_type': 'Plain', 'bootstrap_type': 'Bayesian', 'bagging_temperature': 6.714289074117442}. Best is trial 1464 with value: 0.8990825688073395.
[32m[I 2023-04-20 23:43:26,135][39m Trial 2202 finished with value: 0.8807339449541284 and parameters: {'objective': 'Logloss', 'colsample_bylevel': 0.09454206940467541, 'depth': 10, 'boosting_type': 'Plain', 'bootstrap_type': 'Bayesian', 'bagging_temperature': 4.899753580590392}. Best is trial 1464 with value: 0.8990825688073395.
[32m[I 2023-04-20 23:43:27,075][39m Trial 2203 finished with value: 0.8495575221238938 and parameters: {'objective': 'CrossEntropy', 'colsample_bylevel': 0.09265264579759588, 'depth': 5, 'boosting_type': 'Plain', 'bootstrap_type': 'Bayesian', 'bagging_temperature': 4.934596138700565}. Best is trial 1464 with value: 0.8990825688073395.
[32m[I 2023-04-20 23:43:28,246][39m Trial 2204 finished with value: 0.8648648648648648 and parameters: {'objective': 'CrossEntropy', 'colsample_bylevel': 0.08645146448166771, 'depth': 10, 'boosting_type': 'Plain', 'bootstrap_type': 'Bayesian', 'bagging_temperature': 5.8380611184134}. Best is trial 1464 with value: 0.8990825688073395.
[32m[I 2023-04-20 23:43:28,944][39m Trial 2205 finished with value: 0.8347826086956522 and parameters: {'objective': 'CrossEntropy', 'colsample_bylevel': 0.0882278656893542, 'depth': 6, 'boosting_type': 'Plain', 'bootstrap_type': 'MVS'}. Best is trial 1464 with value: 0.8990825688073395.
[32m[I 2023-04-20 23:43:29,597][39m Trial 2206 finished with value: 0.8571428571428572 and parameters: {'objective': 'CrossEntropy', 'colsample_bylevel': 0.06322046572528171, 'depth': 10, 'boosting_type': 'Plain', 'bootstrap_type': 'Bayesian', 'bagging_temperature': 4.081022547269045}. Best is trial 1464 with value: 0.8990825688073395.
[32m[I 2023-04-20 23:43:30,789][39m Trial 2207 finished with value: 0.8807339449541284 and parameters: {'objective': 'CrossEntropy', 'colsample_bylevel': 0.09520562401941815, 'depth': 11, 'boosting_type': 'Plain', 'bootstrap_type': 'Bayesian', 'bagging_temperature': 5.692118376691327}. Best is trial 1464 with value: 0.8990825688073395.
[32m[I 2023-04-20 23:43:31,915][39m Trial 2208 finished with value: 0.8807339449541284 and parameters: {'objective': 'CrossEntropy', 'colsample_bylevel': 0.08774336420339757, 'depth': 11, 'boosting_type': 'Plain', 'bootstrap_type': 'Bayesian', 'bagging_temperature': 5.414752444861368}. Best is trial 1464 with value: 0.8990825688073395.
[32m[I 2023-04-20 23:43:37,132][39m Trial 2209 finished with value: 0.8347826086956522 and parameters: {'objective': 'CrossEntropy', 'colsample_bylevel': 0.08889267219890898, 'depth': 9, 'boosting_type': 'Ordered', 'bootstrap_type': 'Bayesian', 'bagging_temperature': 4.673912162814706}. Best is trial 1464 with value: 0.8990825688073395.
[32m[I 2023-04-20 23:43:38,189][39m Trial 2210 finished with value: 0.8807339449541284 and parameters: {'objective': 'CrossEntropy', 'colsample_bylevel': 0.09022213755484544, 'depth': 10, 'boosting_type': 'Plain', 'bootstrap_type': 'Bayesian', 'bagging_temperature': 4.963645186094576}. Best is trial 1464 with value: 0.8990825688073395.
[32m[I 2023-04-20 23:43:39,490][39m Trial 2211 finished with value: 0.8807339449541284 and parameters: {'objective': 'Logloss', 'colsample_bylevel': 0.09248840968910768, 'depth': 10, 'boosting_type': 'Plain', 'bootstrap_type': 'Bayesian', 'bagging_temperature': 6.45874066448033}. Best is trial 1464 with value: 0.8990825688073395.
[32m[I 2023-04-20 23:43:40,317][39m Trial 2212 finished with value: 0.8727272727272727 and parameters: {'objective': 'CrossEntropy', 'colsample_bylevel': 0.08989811220025372, 'depth': 10, 'boosting_type': 'Plain', 'bootstrap_type': 'Bayesian', 'bagging_temperature': 5.315649718923997}. Best is trial 1464 with value: 0.8990825688073395.
[32m[I 2023-04-20 23:43:41,358][39m Trial 2213 finished with value: 0.8785046728971961 and parameters: {'objective': 'CrossEntropy', 'colsample_bylevel': 0.09419916385721479, 'depth': 10, 'boosting_type': 'Plain', 'bootstrap_type': 'Bayesian', 'bagging_temperature': 4.905936924011499}. Best is trial 1464 with value: 0.8990825688073395.
[32m[I 2023-04-20 23:43:42,603][39m Trial 2214 finished with value: 0.8648648648648648 and parameters: {'objective': 'Logloss', 'colsample_bylevel': 0.09049113993451674, 'depth': 12, 'boosting_type': 'Plain', 'bootstrap_type': 'Bayesian', 'bagging_temperature': 5.697727644690137}. Best is trial 1464 with value: 0.8990825688073395.
[32m[I 2023-04-20 23:43:43,424][39m Trial 2215 finished with value: 0.8727272727272727 and parameters: {'objective': 'Logloss', 'colsample_bylevel': 0.09566976055069726, 'depth': 10, 'boosting_type': 'Plain', 'bootstrap_type': 'Bayesian', 'bagging_temperature': 4.222935103032788}. Best is trial 1464 with value: 0.8990825688073395.
[32m[I 2023-04-20 23:43:44,660][39m Trial 2216 finished with value: 0.8807339449541284 and parameters: {'objective': 'CrossEntropy', 'colsample_bylevel': 0.08425843836921552, 'depth': 10, 'boosting_type': 'Plain', 'bootstrap_type': 'Bayesian', 'bagging_temperature': 6.731387479701178}. Best is trial 1464 with value: 0.8990825688073395.
[32m[I 2023-04-20 23:43:46,030][39m Trial 2217 finished with value: 0.875 and parameters: {'objective': 'Logloss', 'colsample_bylevel': 0.09361389093114111, 'depth': 9, 'boosting_type': 'Plain', 'bootstrap_type': 'Bayesian', 'bagging_temperature': 6.595130919545522}. Best is trial 1464 with value: 0.8990825688073395.
[32m[I 2023-04-20 23:43:46,707][39m Trial 2218 finished with value: 0.8495575221238938 and parameters: {'objective': 'CrossEntropy', 'colsample_bylevel': 0.0841107039690012, 'depth': 11, 'boosting_type': 'Plain', 'bootstrap_type': 'Bayesian', 'bagging_temperature': 5.162968871322951}. Best is trial 1464 with value: 0.8990825688073395.
[32m[I 2023-04-20 23:43:48,032][39m Trial 2219 finished with value: 0.8807339449541284 and parameters: {'objective': 'Logloss', 'colsample_bylevel': 0.09740889251213718, 'depth': 8, 'boosting_type': 'Plain', 'bootstrap_type': 'Bayesian', 'bagging_temperature': 6.6174074008669255}. Best is trial 1464 with value: 0.8990825688073395.
[32m[I 2023-04-20 23:43:49,174][39m Trial 2220 finished with value: 0.8807339449541284 and parameters: {'objective': 'CrossEntropy', 'colsample_bylevel': 0.09012931282812929, 'depth': 10, 'boosting_type': 'Plain', 'bootstrap_type': 'Bayesian', 'bagging_temperature': 9.381906567306556}. Best is trial 1464 with value: 0.8990825688073395.
[32m[I 2023-04-20 23:43:50,330][39m Trial 2221 finished with value: 0.8828828828828829 and parameters: {'objective': 'Logloss', 'colsample_bylevel': 0.09827778155428218, 'depth': 9, 'boosting_type': 'Plain', 'bootstrap_type': 'Bayesian', 'bagging_temperature': 4.542755636599252}. Best is trial 1464 with value: 0.8990825688073395.
[32m[I 2023-04-20 23:43:52,262][39m Trial 2222 finished with value: 0.8807339449541284 and parameters: {'objective': 'Logloss', 'colsample_bylevel': 0.09201606058671313, 'depth': 8, 'boosting_type': 'Plain', 'bootstrap_type': 'Bayesian', 'bagging_temperature': 5.82835889471673}. Best is trial 1464 with value: 0.8990825688073395.
[32m[I 2023-04-20 23:43:52,866][39m Trial 2223 finished with value: 0.8596491228070176 and parameters: {'objective': 'CrossEntropy', 'colsample_bylevel': 0.09717567950289677, 'depth': 12, 'boosting_type': 'Plain', 'bootstrap_type': 'Bernoulli', 'subsample': 0.5484261162651911}. Best is trial 1464 with value: 0.8990825688073395.
[32m[I 2023-04-20 23:43:54,034][39m Trial 2224 finished with value: 0.8571428571428572 and parameters: {'objective': 'Logloss', 'colsample_bylevel': 0.09587340689043765, 'depth': 8, 'boosting_type': 'Plain', 'bootstrap_type': 'Bayesian', 'bagging_temperature': 5.091640742580202}. Best is trial 1464 with value: 0.8990825688073395.
[32m[I 2023-04-20 23:43:54,879][39m Trial 2225 finished with value: 0.8727272727272727 and parameters: {'objective': 'CrossEntropy', 'colsample_bylevel': 0.09011100445026539, 'depth': 9, 'boosting_type': 'Plain', 'bootstrap_type': 'Bayesian', 'bagging_temperature': 5.116122542605571}. Best is trial 1464 with value: 0.8990825688073395.
[32m[I 2023-04-20 23:44:00,420][39m Trial 2226 finished with value: 0.8421052631578947 and parameters: {'objective': 'Logloss', 'colsample_bylevel': 0.0938840545787339, 'depth': 6, 'boosting_type': 'Ordered', 'bootstrap_type': 'MVS'}. Best is trial 1464 with value: 0.8990825688073395.
[32m[I 2023-04-20 23:44:01,034][39m Trial 2227 finished with value: 0.8703703703703703 and parameters: {'objective': 'CrossEntropy', 'colsample_bylevel': 0.09246560556918818, 'depth': 10, 'boosting_type': 'Plain', 'bootstrap_type': 'Bayesian', 'bagging_temperature': 4.887354713715951}. Best is trial 1464 with value: 0.8990825688073395.
[32m[I 2023-04-20 23:44:01,646][39m Trial 2228 finished with value: 0.8596491228070176 and parameters: {'objective': 'Logloss', 'colsample_bylevel': 0.0664751321027229, 'depth': 10, 'boosting_type': 'Plain', 'bootstrap_type': 'Bayesian', 'bagging_temperature': 5.615451447567368}. Best is trial 1464 with value: 0.8990825688073395.
[32m[I 2023-04-20 23:44:02,412][39m Trial 2229 finished with value: 0.8727272727272727 and parameters: {'objective': 'Logloss', 'colsample_bylevel': 0.09856571353597675, 'depth': 8, 'boosting_type': 'Plain', 'bootstrap_type': 'Bayesian', 'bagging_temperature': 5.970061183840322}. Best is trial 1464 with value: 0.8990825688073395.
[32m[I 2023-04-20 23:44:04,056][39m Trial 2230 finished with value: 0.8828828828828829 and parameters: {'objective': 'CrossEntropy', 'colsample_bylevel': 0.08550516508731071, 'depth': 8, 'boosting_type': 'Plain', 'bootstrap_type': 'Bayesian', 'bagging_temperature': 6.1879205636144095}. Best is trial 1464 with value: 0.8990825688073395.
[32m[I 2023-04-20 23:44:04,967][39m Trial 2231 finished with value: 0.8727272727272727 and parameters: {'objective': 'Logloss', 'colsample_bylevel': 0.09300407742480138, 'depth': 10, 'boosting_type': 'Plain', 'bootstrap_type': 'Bayesian', 'bagging_temperature': 5.571122508828336}. Best is trial 1464 with value: 0.8990825688073395.
[32m[I 2023-04-20 23:44:06,538][39m Trial 2232 finished with value: 0.8807339449541284 and parameters: {'objective': 'CrossEntropy', 'colsample_bylevel': 0.09284534746395734, 'depth': 9, 'boosting_type': 'Plain', 'bootstrap_type': 'Bayesian', 'bagging_temperature': 5.246832112370952}. Best is trial 1464 with value: 0.8990825688073395.
[32m[I 2023-04-20 23:44:07,545][39m Trial 2233 finished with value: 0.888888888888889 and parameters: {'objective': 'CrossEntropy', 'colsample_bylevel': 0.08992668899516516, 'depth': 10, 'boosting_type': 'Plain', 'bootstrap_type': 'Bayesian', 'bagging_temperature': 2.8494298954091084}. Best is trial 1464 with value: 0.8990825688073395.
[32m[I 2023-04-20 23:44:08,471][39m Trial 2234 finished with value: 0.8703703703703703 and parameters: {'objective': 'CrossEntropy', 'colsample_bylevel': 0.09109124853717777, 'depth': 9, 'boosting_type': 'Plain', 'bootstrap_type': 'Bayesian', 'bagging_temperature': 6.336328118895819}. Best is trial 1464 with value: 0.8990825688073395.
[32m[I 2023-04-20 23:44:09,167][39m Trial 2235 finished with value: 0.8828828828828829 and parameters: {'objective': 'Logloss', 'colsample_bylevel': 0.09464795408631786, 'depth': 10, 'boosting_type': 'Plain', 'bootstrap_type': 'Bayesian', 'bagging_temperature': 4.147994668483832}. Best is trial 1464 with value: 0.8990825688073395.
[32m[I 2023-04-20 23:44:09,897][39m Trial 2236 finished with value: 0.8828828828828829 and parameters: {'objective': 'Logloss', 'colsample_bylevel': 0.09447131424232937, 'depth': 11, 'boosting_type': 'Plain', 'bootstrap_type': 'Bayesian', 'bagging_temperature': 5.460276548022729}. Best is trial 1464 with value: 0.8990825688073395.
[32m[I 2023-04-20 23:44:10,847][39m Trial 2237 finished with value: 0.8807339449541284 and parameters: {'objective': 'Logloss', 'colsample_bylevel': 0.09997188287914946, 'depth': 10, 'boosting_type': 'Plain', 'bootstrap_type': 'Bayesian', 'bagging_temperature': 4.367431240617218}. Best is trial 1464 with value: 0.8990825688073395.
[32m[I 2023-04-20 23:44:11,797][39m Trial 2238 finished with value: 0.8727272727272727 and parameters: {'objective': 'Logloss', 'colsample_bylevel': 0.09226312344060196, 'depth': 10, 'boosting_type': 'Plain', 'bootstrap_type': 'Bayesian', 'bagging_temperature': 5.589727842040696}. Best is trial 1464 with value: 0.8990825688073395.
[32m[I 2023-04-20 23:44:12,919][39m Trial 2239 finished with value: 0.8807339449541284 and parameters: {'objective': 'Logloss', 'colsample_bylevel': 0.09544643308308995, 'depth': 10, 'boosting_type': 'Plain', 'bootstrap_type': 'Bayesian', 'bagging_temperature': 5.220061342630752}. Best is trial 1464 with value: 0.8990825688073395.
[32m[I 2023-04-20 23:44:13,860][39m Trial 2240 finished with value: 0.875 and parameters: {'objective': 'CrossEntropy', 'colsample_bylevel': 0.09680259002778317, 'depth': 10, 'boosting_type': 'Plain', 'bootstrap_type': 'Bayesian', 'bagging_temperature': 4.38351071821748}. Best is trial 1464 with value: 0.8990825688073395.
[32m[I 2023-04-20 23:44:14,915][39m Trial 2241 finished with value: 0.8376068376068375 and parameters: {'objective': 'Logloss', 'colsample_bylevel': 0.034441791233918884, 'depth': 8, 'boosting_type': 'Plain', 'bootstrap_type': 'Bayesian', 'bagging_temperature': 5.79084375523128}. Best is trial 1464 with value: 0.8990825688073395.
[32m[I 2023-04-20 23:44:15,771][39m Trial 2242 finished with value: 0.8727272727272727 and parameters: {'objective': 'CrossEntropy', 'colsample_bylevel': 0.08935071861286846, 'depth': 10, 'boosting_type': 'Plain', 'bootstrap_type': 'Bayesian', 'bagging_temperature': 5.4434641054798405}. Best is trial 1464 with value: 0.8990825688073395.
