[32m[I 2023-04-20 23:47:03,660][39m Trial 2374 finished with value: 0.8571428571428572 and parameters: {'objective': 'Logloss', 'colsample_bylevel': 0.09594787242155789, 'depth': 10, 'boosting_type': 'Plain', 'bootstrap_type': 'Bayesian', 'bagging_temperature': 4.088466546422301}. Best is trial 1464 with value: 0.8990825688073395.
[32m[I 2023-04-20 23:47:04,363][39m Trial 2375 finished with value: 0.8727272727272727 and parameters: {'objective': 'CrossEntropy', 'colsample_bylevel': 0.09088909673213398, 'depth': 12, 'boosting_type': 'Plain', 'bootstrap_type': 'Bayesian', 'bagging_temperature': 5.692191742249315}. Best is trial 1464 with value: 0.8990825688073395.
[32m[I 2023-04-20 23:47:05,700][39m Trial 2376 finished with value: 0.888888888888889 and parameters: {'objective': 'Logloss', 'colsample_bylevel': 0.09892093416526822, 'depth': 12, 'boosting_type': 'Plain', 'bootstrap_type': 'Bayesian', 'bagging_temperature': 4.829323923692759}. Best is trial 1464 with value: 0.8990825688073395.
[32m[I 2023-04-20 23:47:06,877][39m Trial 2377 finished with value: 0.8648648648648648 and parameters: {'objective': 'Logloss', 'colsample_bylevel': 0.09835395519514487, 'depth': 10, 'boosting_type': 'Plain', 'bootstrap_type': 'Bayesian', 'bagging_temperature': 3.921006432397488}. Best is trial 1464 with value: 0.8990825688073395.
[32m[I 2023-04-20 23:47:11,818][39m Trial 2378 finished with value: 0.8421052631578947 and parameters: {'objective': 'CrossEntropy', 'colsample_bylevel': 0.09997155105908218, 'depth': 8, 'boosting_type': 'Ordered', 'bootstrap_type': 'Bayesian', 'bagging_temperature': 6.373221010627165}. Best is trial 1464 with value: 0.8990825688073395.
[32m[I 2023-04-20 23:47:13,737][39m Trial 2379 finished with value: 0.888888888888889 and parameters: {'objective': 'CrossEntropy', 'colsample_bylevel': 0.09027958519912781, 'depth': 9, 'boosting_type': 'Plain', 'bootstrap_type': 'Bayesian', 'bagging_temperature': 6.070432778907827}. Best is trial 1464 with value: 0.8990825688073395.
[32m[I 2023-04-20 23:47:15,100][39m Trial 2380 finished with value: 0.8807339449541284 and parameters: {'objective': 'Logloss', 'colsample_bylevel': 0.09399927441353471, 'depth': 10, 'boosting_type': 'Plain', 'bootstrap_type': 'Bayesian', 'bagging_temperature': 4.268343424549502}. Best is trial 1464 with value: 0.8990825688073395.
[32m[I 2023-04-20 23:47:16,576][39m Trial 2381 finished with value: 0.8727272727272727 and parameters: {'objective': 'Logloss', 'colsample_bylevel': 0.09280701329104177, 'depth': 9, 'boosting_type': 'Plain', 'bootstrap_type': 'Bayesian', 'bagging_temperature': 2.757126907664065}. Best is trial 1464 with value: 0.8990825688073395.
[32m[I 2023-04-20 23:47:17,264][39m Trial 2382 finished with value: 0.8785046728971961 and parameters: {'objective': 'CrossEntropy', 'colsample_bylevel': 0.09362660870030129, 'depth': 10, 'boosting_type': 'Plain', 'bootstrap_type': 'Bayesian', 'bagging_temperature': 5.828329742843111}. Best is trial 1464 with value: 0.8990825688073395.
[32m[I 2023-04-20 23:47:18,453][39m Trial 2383 finished with value: 0.8828828828828829 and parameters: {'objective': 'CrossEntropy', 'colsample_bylevel': 0.09818211195313369, 'depth': 9, 'boosting_type': 'Plain', 'bootstrap_type': 'Bayesian', 'bagging_temperature': 4.678864051854329}. Best is trial 1464 with value: 0.8990825688073395.
[32m[I 2023-04-20 23:47:19,611][39m Trial 2384 finished with value: 0.8571428571428572 and parameters: {'objective': 'Logloss', 'colsample_bylevel': 0.09531968052693231, 'depth': 11, 'boosting_type': 'Plain', 'bootstrap_type': 'Bernoulli', 'subsample': 0.5101274571191501}. Best is trial 1464 with value: 0.8990825688073395.
[32m[I 2023-04-20 23:47:20,827][39m Trial 2385 finished with value: 0.8727272727272727 and parameters: {'objective': 'Logloss', 'colsample_bylevel': 0.09300312180767012, 'depth': 7, 'boosting_type': 'Plain', 'bootstrap_type': 'Bayesian', 'bagging_temperature': 5.2945898667676135}. Best is trial 1464 with value: 0.8990825688073395.
[32m[I 2023-04-20 23:47:22,242][39m Trial 2386 finished with value: 0.8807339449541284 and parameters: {'objective': 'CrossEntropy', 'colsample_bylevel': 0.09630629837326309, 'depth': 9, 'boosting_type': 'Plain', 'bootstrap_type': 'Bayesian', 'bagging_temperature': 5.850157834170619}. Best is trial 1464 with value: 0.8990825688073395.
[32m[I 2023-04-20 23:47:22,876][39m Trial 2387 finished with value: 0.8421052631578947 and parameters: {'objective': 'CrossEntropy', 'colsample_bylevel': 0.07458834378040559, 'depth': 6, 'boosting_type': 'Plain', 'bootstrap_type': 'Bayesian', 'bagging_temperature': 5.044850958738719}. Best is trial 1464 with value: 0.8990825688073395.
[32m[I 2023-04-20 23:47:23,715][39m Trial 2388 finished with value: 0.8727272727272727 and parameters: {'objective': 'Logloss', 'colsample_bylevel': 0.097356437939077, 'depth': 8, 'boosting_type': 'Plain', 'bootstrap_type': 'Bayesian', 'bagging_temperature': 5.733099461969564}. Best is trial 1464 with value: 0.8990825688073395.
[32m[I 2023-04-20 23:47:24,556][39m Trial 2389 finished with value: 0.8727272727272727 and parameters: {'objective': 'Logloss', 'colsample_bylevel': 0.09658293346571786, 'depth': 8, 'boosting_type': 'Plain', 'bootstrap_type': 'Bayesian', 'bagging_temperature': 5.3367078026092}. Best is trial 1464 with value: 0.8990825688073395.
[32m[I 2023-04-20 23:47:25,763][39m Trial 2390 finished with value: 0.8727272727272727 and parameters: {'objective': 'Logloss', 'colsample_bylevel': 0.09280970610542529, 'depth': 12, 'boosting_type': 'Plain', 'bootstrap_type': 'Bayesian', 'bagging_temperature': 4.776841795768133}. Best is trial 1464 with value: 0.8990825688073395.
[32m[I 2023-04-20 23:47:27,937][39m Trial 2391 finished with value: 0.8727272727272727 and parameters: {'objective': 'Logloss', 'colsample_bylevel': 0.09580302606786131, 'depth': 9, 'boosting_type': 'Plain', 'bootstrap_type': 'Bayesian', 'bagging_temperature': 4.667534242512538}. Best is trial 1464 with value: 0.8990825688073395.
[32m[I 2023-04-20 23:47:29,571][39m Trial 2392 finished with value: 0.8727272727272727 and parameters: {'objective': 'CrossEntropy', 'colsample_bylevel': 0.09461911222008626, 'depth': 8, 'boosting_type': 'Plain', 'bootstrap_type': 'Bayesian', 'bagging_temperature': 6.063025538913219}. Best is trial 1464 with value: 0.8990825688073395.
[32m[I 2023-04-20 23:47:30,409][39m Trial 2393 finished with value: 0.8727272727272727 and parameters: {'objective': 'Logloss', 'colsample_bylevel': 0.09457950325345374, 'depth': 12, 'boosting_type': 'Plain', 'bootstrap_type': 'Bayesian', 'bagging_temperature': 5.018774906907405}. Best is trial 1464 with value: 0.8990825688073395.
[32m[I 2023-04-20 23:47:31,205][39m Trial 2394 finished with value: 0.875 and parameters: {'objective': 'Logloss', 'colsample_bylevel': 0.08823147262019651, 'depth': 12, 'boosting_type': 'Plain', 'bootstrap_type': 'Bayesian', 'bagging_temperature': 9.112636766313987}. Best is trial 1464 with value: 0.8990825688073395.
[32m[I 2023-04-20 23:47:32,461][39m Trial 2395 finished with value: 0.8648648648648648 and parameters: {'objective': 'Logloss', 'colsample_bylevel': 0.09235164334809529, 'depth': 10, 'boosting_type': 'Plain', 'bootstrap_type': 'Bayesian', 'bagging_temperature': 5.430971498903035}. Best is trial 1464 with value: 0.8990825688073395.
[32m[I 2023-04-20 23:47:37,411][39m Trial 2396 finished with value: 0.8468468468468469 and parameters: {'objective': 'CrossEntropy', 'colsample_bylevel': 0.09990707352853004, 'depth': 9, 'boosting_type': 'Ordered', 'bootstrap_type': 'Bayesian', 'bagging_temperature': 3.8740346562846}. Best is trial 1464 with value: 0.8990825688073395.
[32m[I 2023-04-20 23:47:39,252][39m Trial 2397 finished with value: 0.890909090909091 and parameters: {'objective': 'Logloss', 'colsample_bylevel': 0.09794445805198204, 'depth': 9, 'boosting_type': 'Plain', 'bootstrap_type': 'Bayesian', 'bagging_temperature': 4.920431551231735}. Best is trial 1464 with value: 0.8990825688073395.
[32m[I 2023-04-20 23:47:40,485][39m Trial 2398 finished with value: 0.8807339449541284 and parameters: {'objective': 'Logloss', 'colsample_bylevel': 0.09839818430858821, 'depth': 9, 'boosting_type': 'Plain', 'bootstrap_type': 'Bayesian', 'bagging_temperature': 4.957475801473133}. Best is trial 1464 with value: 0.8990825688073395.
[32m[I 2023-04-20 23:47:41,482][39m Trial 2399 finished with value: 0.8521739130434783 and parameters: {'objective': 'Logloss', 'colsample_bylevel': 0.05382223107610308, 'depth': 7, 'boosting_type': 'Plain', 'bootstrap_type': 'Bayesian', 'bagging_temperature': 6.870933416713282}. Best is trial 1464 with value: 0.8990825688073395.
[32m[I 2023-04-20 23:47:42,547][39m Trial 2400 finished with value: 0.8421052631578947 and parameters: {'objective': 'Logloss', 'colsample_bylevel': 0.04336754628846218, 'depth': 7, 'boosting_type': 'Plain', 'bootstrap_type': 'Bayesian', 'bagging_temperature': 5.581475017950094}. Best is trial 1464 with value: 0.8990825688073395.
[32m[I 2023-04-20 23:47:43,599][39m Trial 2401 finished with value: 0.8727272727272727 and parameters: {'objective': 'CrossEntropy', 'colsample_bylevel': 0.09505014244222856, 'depth': 6, 'boosting_type': 'Plain', 'bootstrap_type': 'Bayesian', 'bagging_temperature': 6.644468054487348}. Best is trial 1464 with value: 0.8990825688073395.
[32m[I 2023-04-20 23:47:44,528][39m Trial 2402 finished with value: 0.8807339449541284 and parameters: {'objective': 'Logloss', 'colsample_bylevel': 0.09007911097324123, 'depth': 10, 'boosting_type': 'Plain', 'bootstrap_type': 'Bayesian', 'bagging_temperature': 5.464046177091949}. Best is trial 1464 with value: 0.8990825688073395.
[32m[I 2023-04-20 23:47:45,836][39m Trial 2403 finished with value: 0.888888888888889 and parameters: {'objective': 'CrossEntropy', 'colsample_bylevel': 0.09867809210309829, 'depth': 8, 'boosting_type': 'Plain', 'bootstrap_type': 'Bayesian', 'bagging_temperature': 3.305476619868352}. Best is trial 1464 with value: 0.8990825688073395.
[32m[I 2023-04-20 23:47:47,048][39m Trial 2404 finished with value: 0.8648648648648648 and parameters: {'objective': 'Logloss', 'colsample_bylevel': 0.09714391467990413, 'depth': 9, 'boosting_type': 'Plain', 'bootstrap_type': 'Bayesian', 'bagging_temperature': 4.151146467139191}. Best is trial 1464 with value: 0.8990825688073395.
[32m[I 2023-04-20 23:47:47,707][39m Trial 2405 finished with value: 0.890909090909091 and parameters: {'objective': 'CrossEntropy', 'colsample_bylevel': 0.0953009228095234, 'depth': 8, 'boosting_type': 'Plain', 'bootstrap_type': 'Bayesian', 'bagging_temperature': 6.608011558835502}. Best is trial 1464 with value: 0.8990825688073395.
[32m[I 2023-04-20 23:47:48,693][39m Trial 2406 finished with value: 0.8807339449541284 and parameters: {'objective': 'Logloss', 'colsample_bylevel': 0.09518702486632503, 'depth': 8, 'boosting_type': 'Plain', 'bootstrap_type': 'Bayesian', 'bagging_temperature': 6.653663463145271}. Best is trial 1464 with value: 0.8990825688073395.
[32m[I 2023-04-20 23:47:49,828][39m Trial 2407 finished with value: 0.875 and parameters: {'objective': 'Logloss', 'colsample_bylevel': 0.09413292009466666, 'depth': 11, 'boosting_type': 'Plain', 'bootstrap_type': 'Bayesian', 'bagging_temperature': 4.865899015871634}. Best is trial 1464 with value: 0.8990825688073395.
[32m[I 2023-04-20 23:47:51,408][39m Trial 2408 finished with value: 0.8727272727272727 and parameters: {'objective': 'Logloss', 'colsample_bylevel': 0.09482626420954116, 'depth': 8, 'boosting_type': 'Plain', 'bootstrap_type': 'Bayesian', 'bagging_temperature': 7.044536970872799}. Best is trial 1464 with value: 0.8990825688073395.
[32m[I 2023-04-20 23:47:52,316][39m Trial 2409 finished with value: 0.8571428571428572 and parameters: {'objective': 'CrossEntropy', 'colsample_bylevel': 0.09719745578653155, 'depth': 9, 'boosting_type': 'Plain', 'bootstrap_type': 'MVS'}. Best is trial 1464 with value: 0.8990825688073395.
[32m[I 2023-04-20 23:47:53,123][39m Trial 2410 finished with value: 0.8347826086956522 and parameters: {'objective': 'CrossEntropy', 'colsample_bylevel': 0.051461892389398585, 'depth': 9, 'boosting_type': 'Plain', 'bootstrap_type': 'Bayesian', 'bagging_temperature': 9.66608945376299}. Best is trial 1464 with value: 0.8990825688073395.
[32m[I 2023-04-20 23:47:54,059][39m Trial 2411 finished with value: 0.8727272727272727 and parameters: {'objective': 'Logloss', 'colsample_bylevel': 0.0998800177856553, 'depth': 8, 'boosting_type': 'Plain', 'bootstrap_type': 'Bayesian', 'bagging_temperature': 3.8219777949007723}. Best is trial 1464 with value: 0.8990825688073395.
[32m[I 2023-04-20 23:47:54,685][39m Trial 2412 finished with value: 0.8545454545454546 and parameters: {'objective': 'CrossEntropy', 'colsample_bylevel': 0.09192038555089133, 'depth': 10, 'boosting_type': 'Plain', 'bootstrap_type': 'Bayesian', 'bagging_temperature': 4.866237820253541}. Best is trial 1464 with value: 0.8990825688073395.
[32m[I 2023-04-20 23:47:55,838][39m Trial 2413 finished with value: 0.8807339449541284 and parameters: {'objective': 'CrossEntropy', 'colsample_bylevel': 0.09072242232414682, 'depth': 9, 'boosting_type': 'Plain', 'bootstrap_type': 'Bayesian', 'bagging_temperature': 5.156815776143081}. Best is trial 1464 with value: 0.8990825688073395.
[32m[I 2023-04-20 23:47:57,057][39m Trial 2414 finished with value: 0.8648648648648648 and parameters: {'objective': 'Logloss', 'colsample_bylevel': 0.09854234683734764, 'depth': 8, 'boosting_type': 'Plain', 'bootstrap_type': 'Bayesian', 'bagging_temperature': 6.641050599896993}. Best is trial 1464 with value: 0.8990825688073395.
[32m[I 2023-04-20 23:47:58,254][39m Trial 2415 finished with value: 0.8623853211009175 and parameters: {'objective': 'Logloss', 'colsample_bylevel': 0.09554643665721049, 'depth': 12, 'boosting_type': 'Plain', 'bootstrap_type': 'Bayesian', 'bagging_temperature': 5.002812111216843}. Best is trial 1464 with value: 0.8990825688073395.
[32m[I 2023-04-20 23:47:58,996][39m Trial 2416 finished with value: 0.8648648648648648 and parameters: {'objective': 'CrossEntropy', 'colsample_bylevel': 0.08504143096058528, 'depth': 8, 'boosting_type': 'Plain', 'bootstrap_type': 'Bayesian', 'bagging_temperature': 5.896062991373612}. Best is trial 1464 with value: 0.8990825688073395.
[32m[I 2023-04-20 23:48:04,062][39m Trial 2417 finished with value: 0.8571428571428572 and parameters: {'objective': 'Logloss', 'colsample_bylevel': 0.09485940391185672, 'depth': 8, 'boosting_type': 'Ordered', 'bootstrap_type': 'Bayesian', 'bagging_temperature': 6.861983900986772}. Best is trial 1464 with value: 0.8990825688073395.
[32m[I 2023-04-20 23:48:05,745][39m Trial 2418 finished with value: 0.8648648648648648 and parameters: {'objective': 'Logloss', 'colsample_bylevel': 0.09494867825471978, 'depth': 8, 'boosting_type': 'Plain', 'bootstrap_type': 'Bayesian', 'bagging_temperature': 4.403657181206259}. Best is trial 1464 with value: 0.8990825688073395.
[32m[I 2023-04-20 23:48:06,913][39m Trial 2419 finished with value: 0.8623853211009175 and parameters: {'objective': 'CrossEntropy', 'colsample_bylevel': 0.09283061813895997, 'depth': 9, 'boosting_type': 'Plain', 'bootstrap_type': 'Bayesian', 'bagging_temperature': 6.900481016001728}. Best is trial 1464 with value: 0.8990825688073395.
[32m[I 2023-04-20 23:48:07,864][39m Trial 2420 finished with value: 0.8703703703703703 and parameters: {'objective': 'CrossEntropy', 'colsample_bylevel': 0.09666941595108247, 'depth': 9, 'boosting_type': 'Plain', 'bootstrap_type': 'Bayesian', 'bagging_temperature': 6.710501375820099}. Best is trial 1464 with value: 0.8990825688073395.
[32m[I 2023-04-20 23:48:08,790][39m Trial 2421 finished with value: 0.888888888888889 and parameters: {'objective': 'CrossEntropy', 'colsample_bylevel': 0.09639788876045606, 'depth': 9, 'boosting_type': 'Plain', 'bootstrap_type': 'Bayesian', 'bagging_temperature': 6.446344810289932}. Best is trial 1464 with value: 0.8990825688073395.
[32m[I 2023-04-20 23:48:10,250][39m Trial 2422 finished with value: 0.8623853211009175 and parameters: {'objective': 'Logloss', 'colsample_bylevel': 0.09402604699155968, 'depth': 9, 'boosting_type': 'Plain', 'bootstrap_type': 'Bayesian', 'bagging_temperature': 6.582270381905154}. Best is trial 1464 with value: 0.8990825688073395.
[32m[I 2023-04-20 23:48:10,688][39m Trial 2423 finished with value: 0.8571428571428572 and parameters: {'objective': 'CrossEntropy', 'colsample_bylevel': 0.09266288473512459, 'depth': 10, 'boosting_type': 'Plain', 'bootstrap_type': 'MVS'}. Best is trial 1464 with value: 0.8990825688073395.
[32m[I 2023-04-20 23:48:11,781][39m Trial 2424 finished with value: 0.8727272727272727 and parameters: {'objective': 'Logloss', 'colsample_bylevel': 0.09556917143129513, 'depth': 10, 'boosting_type': 'Plain', 'bootstrap_type': 'Bayesian', 'bagging_temperature': 4.855891975653588}. Best is trial 1464 with value: 0.8990825688073395.
[32m[I 2023-04-20 23:48:12,887][39m Trial 2425 finished with value: 0.8623853211009175 and parameters: {'objective': 'Logloss', 'colsample_bylevel': 0.08720750786659807, 'depth': 10, 'boosting_type': 'Plain', 'bootstrap_type': 'Bayesian', 'bagging_temperature': 5.975184921929119}. Best is trial 1464 with value: 0.8990825688073395.
[32m[I 2023-04-20 23:48:13,583][39m Trial 2426 finished with value: 0.8571428571428572 and parameters: {'objective': 'CrossEntropy', 'colsample_bylevel': 0.08906955227293856, 'depth': 10, 'boosting_type': 'Plain', 'bootstrap_type': 'Bayesian', 'bagging_temperature': 6.85258138829399}. Best is trial 1464 with value: 0.8990825688073395.
[32m[I 2023-04-20 23:48:14,989][39m Trial 2427 finished with value: 0.8807339449541284 and parameters: {'objective': 'Logloss', 'colsample_bylevel': 0.09795745160899666, 'depth': 9, 'boosting_type': 'Plain', 'bootstrap_type': 'Bayesian', 'bagging_temperature': 4.765094809665354}. Best is trial 1464 with value: 0.8990825688073395.
[32m[I 2023-04-20 23:48:15,851][39m Trial 2428 finished with value: 0.8807339449541284 and parameters: {'objective': 'CrossEntropy', 'colsample_bylevel': 0.09202545339133096, 'depth': 11, 'boosting_type': 'Plain', 'bootstrap_type': 'Bayesian', 'bagging_temperature': 6.024510690510226}. Best is trial 1464 with value: 0.8990825688073395.
[32m[I 2023-04-20 23:48:17,200][39m Trial 2429 finished with value: 0.8727272727272727 and parameters: {'objective': 'CrossEntropy', 'colsample_bylevel': 0.09621129689835244, 'depth': 9, 'boosting_type': 'Plain', 'bootstrap_type': 'Bayesian', 'bagging_temperature': 6.547628518315701}. Best is trial 1464 with value: 0.8990825688073395.
[32m[I 2023-04-20 23:48:18,718][39m Trial 2430 finished with value: 0.8623853211009175 and parameters: {'objective': 'Logloss', 'colsample_bylevel': 0.09447910249219439, 'depth': 8, 'boosting_type': 'Plain', 'bootstrap_type': 'Bayesian', 'bagging_temperature': 7.085770648627468}. Best is trial 1464 with value: 0.8990825688073395.
[32m[I 2023-04-20 23:48:19,420][39m Trial 2431 finished with value: 0.8727272727272727 and parameters: {'objective': 'CrossEntropy', 'colsample_bylevel': 0.08828978329333212, 'depth': 5, 'boosting_type': 'Plain', 'bootstrap_type': 'Bayesian', 'bagging_temperature': 5.714945662184998}. Best is trial 1464 with value: 0.8990825688073395.
[32m[I 2023-04-20 23:48:20,845][39m Trial 2432 finished with value: 0.8807339449541284 and parameters: {'objective': 'Logloss', 'colsample_bylevel': 0.09597155688381287, 'depth': 8, 'boosting_type': 'Plain', 'bootstrap_type': 'Bayesian', 'bagging_temperature': 5.664548795118806}. Best is trial 1464 with value: 0.8990825688073395.
[32m[I 2023-04-20 23:48:22,129][39m Trial 2433 finished with value: 0.8623853211009175 and parameters: {'objective': 'Logloss', 'colsample_bylevel': 0.09719387365999387, 'depth': 8, 'boosting_type': 'Plain', 'bootstrap_type': 'Bayesian', 'bagging_temperature': 6.678252128277542}. Best is trial 1464 with value: 0.8990825688073395.
[32m[I 2023-04-20 23:48:22,815][39m Trial 2434 finished with value: 0.875 and parameters: {'objective': 'Logloss', 'colsample_bylevel': 0.09409885135652675, 'depth': 12, 'boosting_type': 'Plain', 'bootstrap_type': 'Bayesian', 'bagging_temperature': 5.873671319925733}. Best is trial 1464 with value: 0.8990825688073395.
[32m[I 2023-04-20 23:48:28,270][39m Trial 2435 finished with value: 0.8448275862068967 and parameters: {'objective': 'Logloss', 'colsample_bylevel': 0.0942034219357925, 'depth': 8, 'boosting_type': 'Ordered', 'bootstrap_type': 'Bayesian', 'bagging_temperature': 6.979026316825387}. Best is trial 1464 with value: 0.8990825688073395.
[32m[I 2023-04-20 23:48:29,412][39m Trial 2436 finished with value: 0.8727272727272727 and parameters: {'objective': 'CrossEntropy', 'colsample_bylevel': 0.09782713975361934, 'depth': 9, 'boosting_type': 'Plain', 'bootstrap_type': 'Bayesian', 'bagging_temperature': 4.836579506118381}. Best is trial 1464 with value: 0.8990825688073395.
[32m[I 2023-04-20 23:48:30,554][39m Trial 2437 finished with value: 0.8727272727272727 and parameters: {'objective': 'Logloss', 'colsample_bylevel': 0.09842100833927139, 'depth': 11, 'boosting_type': 'Plain', 'bootstrap_type': 'Bayesian', 'bagging_temperature': 6.768270532542685}. Best is trial 1464 with value: 0.8990825688073395.
[32m[I 2023-04-20 23:48:31,720][39m Trial 2438 finished with value: 0.8727272727272727 and parameters: {'objective': 'CrossEntropy', 'colsample_bylevel': 0.09347030942517283, 'depth': 6, 'boosting_type': 'Plain', 'bootstrap_type': 'Bayesian', 'bagging_temperature': 5.75004293245576}. Best is trial 1464 with value: 0.8990825688073395.
