[32m[I 2023-04-21 00:01:33,561][39m Trial 3030 finished with value: 0.8807339449541284 and parameters: {'objective': 'Logloss', 'colsample_bylevel': 0.09693207433181632, 'depth': 9, 'boosting_type': 'Plain', 'bootstrap_type': 'Bayesian', 'bagging_temperature': 4.969203016323173}. Best is trial 1464 with value: 0.8990825688073395.
[32m[I 2023-04-21 00:01:34,524][39m Trial 3031 finished with value: 0.875 and parameters: {'objective': 'Logloss', 'colsample_bylevel': 0.09846533079251263, 'depth': 7, 'boosting_type': 'Plain', 'bootstrap_type': 'Bayesian', 'bagging_temperature': 4.1005071428910025}. Best is trial 1464 with value: 0.8990825688073395.
[32m[I 2023-04-21 00:01:35,944][39m Trial 3032 finished with value: 0.8727272727272727 and parameters: {'objective': 'Logloss', 'colsample_bylevel': 0.09419559223244696, 'depth': 7, 'boosting_type': 'Plain', 'bootstrap_type': 'Bayesian', 'bagging_temperature': 7.1075455526975295}. Best is trial 1464 with value: 0.8990825688073395.
[32m[I 2023-04-21 00:01:36,673][39m Trial 3033 finished with value: 0.8807339449541284 and parameters: {'objective': 'Logloss', 'colsample_bylevel': 0.09154558728119071, 'depth': 7, 'boosting_type': 'Plain', 'bootstrap_type': 'Bayesian', 'bagging_temperature': 3.744646460844393}. Best is trial 1464 with value: 0.8990825688073395.
[32m[I 2023-04-21 00:01:38,139][39m Trial 3034 finished with value: 0.8807339449541284 and parameters: {'objective': 'Logloss', 'colsample_bylevel': 0.09468522575628242, 'depth': 7, 'boosting_type': 'Plain', 'bootstrap_type': 'Bayesian', 'bagging_temperature': 6.917888159041829}. Best is trial 1464 with value: 0.8990825688073395.
[32m[I 2023-04-21 00:01:39,372][39m Trial 3035 finished with value: 0.8828828828828829 and parameters: {'objective': 'Logloss', 'colsample_bylevel': 0.09578118893307125, 'depth': 7, 'boosting_type': 'Plain', 'bootstrap_type': 'Bayesian', 'bagging_temperature': 4.040555249985067}. Best is trial 1464 with value: 0.8990825688073395.
[32m[I 2023-04-21 00:01:41,036][39m Trial 3036 finished with value: 0.8703703703703703 and parameters: {'objective': 'Logloss', 'colsample_bylevel': 0.09321453194567443, 'depth': 9, 'boosting_type': 'Plain', 'bootstrap_type': 'Bayesian', 'bagging_temperature': 5.2050854709868615}. Best is trial 1464 with value: 0.8990825688073395.
[32m[I 2023-04-21 00:01:41,752][39m Trial 3037 finished with value: 0.8785046728971961 and parameters: {'objective': 'Logloss', 'colsample_bylevel': 0.0898238697889791, 'depth': 7, 'boosting_type': 'Plain', 'bootstrap_type': 'Bayesian', 'bagging_temperature': 3.5331143017635824}. Best is trial 1464 with value: 0.8990825688073395.
[32m[I 2023-04-21 00:01:42,929][39m Trial 3038 finished with value: 0.875 and parameters: {'objective': 'Logloss', 'colsample_bylevel': 0.09400711181795306, 'depth': 7, 'boosting_type': 'Plain', 'bootstrap_type': 'Bayesian', 'bagging_temperature': 4.176580717530818}. Best is trial 1464 with value: 0.8990825688073395.
[32m[I 2023-04-21 00:01:48,109][39m Trial 3039 finished with value: 0.8571428571428572 and parameters: {'objective': 'Logloss', 'colsample_bylevel': 0.09685249445746984, 'depth': 7, 'boosting_type': 'Ordered', 'bootstrap_type': 'Bayesian', 'bagging_temperature': 4.183962563153953}. Best is trial 1464 with value: 0.8990825688073395.
[32m[I 2023-04-21 00:01:50,010][39m Trial 3040 finished with value: 0.8807339449541284 and parameters: {'objective': 'Logloss', 'colsample_bylevel': 0.09113155800339649, 'depth': 9, 'boosting_type': 'Plain', 'bootstrap_type': 'Bayesian', 'bagging_temperature': 3.978576691442036}. Best is trial 1464 with value: 0.8990825688073395.
[32m[I 2023-04-21 00:01:50,879][39m Trial 3041 finished with value: 0.8495575221238938 and parameters: {'objective': 'Logloss', 'colsample_bylevel': 0.09827738157326132, 'depth': 7, 'boosting_type': 'Plain', 'bootstrap_type': 'Bayesian', 'bagging_temperature': 4.318620793474226}. Best is trial 1464 with value: 0.8990825688073395.
[32m[I 2023-04-21 00:01:51,849][39m Trial 3042 finished with value: 0.8785046728971961 and parameters: {'objective': 'Logloss', 'colsample_bylevel': 0.09384340090657085, 'depth': 7, 'boosting_type': 'Plain', 'bootstrap_type': 'Bayesian', 'bagging_temperature': 6.182494497372418}. Best is trial 1464 with value: 0.8990825688073395.
[32m[I 2023-04-21 00:01:52,612][39m Trial 3043 finished with value: 0.8421052631578947 and parameters: {'objective': 'Logloss', 'colsample_bylevel': 0.08029181001358127, 'depth': 7, 'boosting_type': 'Plain', 'bootstrap_type': 'Bayesian', 'bagging_temperature': 3.819459502602449}. Best is trial 1464 with value: 0.8990825688073395.
[32m[I 2023-04-21 00:01:53,681][39m Trial 3044 finished with value: 0.8828828828828829 and parameters: {'objective': 'Logloss', 'colsample_bylevel': 0.095956615464591, 'depth': 7, 'boosting_type': 'Plain', 'bootstrap_type': 'Bayesian', 'bagging_temperature': 6.737579962409376}. Best is trial 1464 with value: 0.8990825688073395.
[32m[I 2023-04-21 00:01:55,062][39m Trial 3045 finished with value: 0.8392857142857144 and parameters: {'objective': 'Logloss', 'colsample_bylevel': 0.09250839534363614, 'depth': 7, 'boosting_type': 'Plain', 'bootstrap_type': 'MVS'}. Best is trial 1464 with value: 0.8990825688073395.
[32m[I 2023-04-21 00:01:56,692][39m Trial 3046 finished with value: 0.875 and parameters: {'objective': 'Logloss', 'colsample_bylevel': 0.09039331618781438, 'depth': 9, 'boosting_type': 'Plain', 'bootstrap_type': 'Bayesian', 'bagging_temperature': 4.3158221431152075}. Best is trial 1464 with value: 0.8990825688073395.
[32m[I 2023-04-21 00:01:57,698][39m Trial 3047 finished with value: 0.8727272727272727 and parameters: {'objective': 'Logloss', 'colsample_bylevel': 0.09725944865122055, 'depth': 8, 'boosting_type': 'Plain', 'bootstrap_type': 'Bayesian', 'bagging_temperature': 3.881577793497133}. Best is trial 1464 with value: 0.8990825688073395.
[32m[I 2023-04-21 00:01:58,521][39m Trial 3048 finished with value: 0.890909090909091 and parameters: {'objective': 'Logloss', 'colsample_bylevel': 0.09855446785896992, 'depth': 7, 'boosting_type': 'Plain', 'bootstrap_type': 'Bayesian', 'bagging_temperature': 4.035628346561087}. Best is trial 1464 with value: 0.8990825688073395.
[32m[I 2023-04-21 00:01:59,294][39m Trial 3049 finished with value: 0.888888888888889 and parameters: {'objective': 'Logloss', 'colsample_bylevel': 0.09866293103683248, 'depth': 7, 'boosting_type': 'Plain', 'bootstrap_type': 'Bayesian', 'bagging_temperature': 3.5702645529160577}. Best is trial 1464 with value: 0.8990825688073395.
[32m[I 2023-04-21 00:02:00,448][39m Trial 3050 finished with value: 0.8703703703703703 and parameters: {'objective': 'Logloss', 'colsample_bylevel': 0.09985004801975168, 'depth': 7, 'boosting_type': 'Plain', 'bootstrap_type': 'Bayesian', 'bagging_temperature': 3.816252543728103}. Best is trial 1464 with value: 0.8990825688073395.
[32m[I 2023-04-21 00:02:01,761][39m Trial 3051 finished with value: 0.8807339449541284 and parameters: {'objective': 'Logloss', 'colsample_bylevel': 0.09978362531293154, 'depth': 7, 'boosting_type': 'Plain', 'bootstrap_type': 'Bayesian', 'bagging_temperature': 5.3589473005640285}. Best is trial 1464 with value: 0.8990825688073395.
[32m[I 2023-04-21 00:02:02,859][39m Trial 3052 finished with value: 0.8672566371681416 and parameters: {'objective': 'Logloss', 'colsample_bylevel': 0.09842775031976887, 'depth': 7, 'boosting_type': 'Plain', 'bootstrap_type': 'Bayesian', 'bagging_temperature': 3.962423902361242}. Best is trial 1464 with value: 0.8990825688073395.
[32m[I 2023-04-21 00:02:04,010][39m Trial 3053 finished with value: 0.8205128205128206 and parameters: {'objective': 'Logloss', 'colsample_bylevel': 0.09747402805901748, 'depth': 2, 'boosting_type': 'Plain', 'bootstrap_type': 'Bayesian', 'bagging_temperature': 4.063288113727838}. Best is trial 1464 with value: 0.8990825688073395.
[32m[I 2023-04-21 00:02:04,836][39m Trial 3054 finished with value: 0.8703703703703703 and parameters: {'objective': 'Logloss', 'colsample_bylevel': 0.09283049341925052, 'depth': 7, 'boosting_type': 'Plain', 'bootstrap_type': 'Bayesian', 'bagging_temperature': 5.652570822347313}. Best is trial 1464 with value: 0.8990825688073395.
[32m[I 2023-04-21 00:02:05,496][39m Trial 3055 finished with value: 0.8623853211009175 and parameters: {'objective': 'Logloss', 'colsample_bylevel': 0.09992058508114354, 'depth': 7, 'boosting_type': 'Plain', 'bootstrap_type': 'Bayesian', 'bagging_temperature': 3.9205230749594415}. Best is trial 1464 with value: 0.8990825688073395.
[32m[I 2023-04-21 00:02:11,102][39m Trial 3056 finished with value: 0.8571428571428572 and parameters: {'objective': 'Logloss', 'colsample_bylevel': 0.09999259788199434, 'depth': 7, 'boosting_type': 'Ordered', 'bootstrap_type': 'Bayesian', 'bagging_temperature': 4.254593199433828}. Best is trial 1464 with value: 0.8990825688073395.
[32m[I 2023-04-21 00:02:12,181][39m Trial 3057 finished with value: 0.8166666666666667 and parameters: {'objective': 'Logloss', 'colsample_bylevel': 0.09546985166535399, 'depth': 1, 'boosting_type': 'Plain', 'bootstrap_type': 'Bayesian', 'bagging_temperature': 3.861489937884277}. Best is trial 1464 with value: 0.8990825688073395.
[32m[I 2023-04-21 00:02:13,254][39m Trial 3058 finished with value: 0.8623853211009175 and parameters: {'objective': 'Logloss', 'colsample_bylevel': 0.09640662447123703, 'depth': 7, 'boosting_type': 'Plain', 'bootstrap_type': 'Bayesian', 'bagging_temperature': 4.128877209079348}. Best is trial 1464 with value: 0.8990825688073395.
[32m[I 2023-04-21 00:02:14,151][39m Trial 3059 finished with value: 0.8828828828828829 and parameters: {'objective': 'Logloss', 'colsample_bylevel': 0.09472607073496174, 'depth': 7, 'boosting_type': 'Plain', 'bootstrap_type': 'Bayesian', 'bagging_temperature': 3.5750974252222822}. Best is trial 1464 with value: 0.8990825688073395.
[32m[I 2023-04-21 00:02:15,403][39m Trial 3060 finished with value: 0.8672566371681416 and parameters: {'objective': 'Logloss', 'colsample_bylevel': 0.09821185998143928, 'depth': 7, 'boosting_type': 'Plain', 'bootstrap_type': 'Bayesian', 'bagging_temperature': 3.7050214780466386}. Best is trial 1464 with value: 0.8990825688073395.
[32m[I 2023-04-21 00:02:16,585][39m Trial 3061 finished with value: 0.8521739130434783 and parameters: {'objective': 'Logloss', 'colsample_bylevel': 0.07328970125724138, 'depth': 7, 'boosting_type': 'Plain', 'bootstrap_type': 'Bayesian', 'bagging_temperature': 5.862416939192656}. Best is trial 1464 with value: 0.8990825688073395.
[32m[I 2023-04-21 00:02:17,797][39m Trial 3062 finished with value: 0.8727272727272727 and parameters: {'objective': 'Logloss', 'colsample_bylevel': 0.09834156336313678, 'depth': 7, 'boosting_type': 'Plain', 'bootstrap_type': 'Bayesian', 'bagging_temperature': 6.573447209565194}. Best is trial 1464 with value: 0.8990825688073395.
[32m[I 2023-04-21 00:02:18,948][39m Trial 3063 finished with value: 0.8648648648648648 and parameters: {'objective': 'Logloss', 'colsample_bylevel': 0.09413497071393609, 'depth': 7, 'boosting_type': 'Plain', 'bootstrap_type': 'Bayesian', 'bagging_temperature': 4.067846514485739}. Best is trial 1464 with value: 0.8990825688073395.
[32m[I 2023-04-21 00:02:19,791][39m Trial 3064 finished with value: 0.875 and parameters: {'objective': 'Logloss', 'colsample_bylevel': 0.09609022234089991, 'depth': 7, 'boosting_type': 'Plain', 'bootstrap_type': 'Bayesian', 'bagging_temperature': 3.859806030831003}. Best is trial 1464 with value: 0.8990825688073395.
[32m[I 2023-04-21 00:02:21,066][39m Trial 3065 finished with value: 0.8807339449541284 and parameters: {'objective': 'Logloss', 'colsample_bylevel': 0.09796440884106764, 'depth': 7, 'boosting_type': 'Plain', 'bootstrap_type': 'Bayesian', 'bagging_temperature': 7.1835413052552255}. Best is trial 1464 with value: 0.8990825688073395.
[32m[I 2023-04-21 00:02:22,113][39m Trial 3066 finished with value: 0.8571428571428572 and parameters: {'objective': 'Logloss', 'colsample_bylevel': 0.09090860694431703, 'depth': 9, 'boosting_type': 'Plain', 'bootstrap_type': 'MVS'}. Best is trial 1464 with value: 0.8990825688073395.
[32m[I 2023-04-21 00:02:23,070][39m Trial 3067 finished with value: 0.888888888888889 and parameters: {'objective': 'Logloss', 'colsample_bylevel': 0.09519021546755879, 'depth': 7, 'boosting_type': 'Plain', 'bootstrap_type': 'Bayesian', 'bagging_temperature': 3.532910104815143}. Best is trial 1464 with value: 0.8990825688073395.
[32m[I 2023-04-21 00:02:24,168][39m Trial 3068 finished with value: 0.8807339449541284 and parameters: {'objective': 'Logloss', 'colsample_bylevel': 0.09526051641190171, 'depth': 7, 'boosting_type': 'Plain', 'bootstrap_type': 'Bayesian', 'bagging_temperature': 4.042599520112881}. Best is trial 1464 with value: 0.8990825688073395.
[32m[I 2023-04-21 00:02:25,534][39m Trial 3069 finished with value: 0.8807339449541284 and parameters: {'objective': 'Logloss', 'colsample_bylevel': 0.09998045027186642, 'depth': 7, 'boosting_type': 'Plain', 'bootstrap_type': 'Bayesian', 'bagging_temperature': 7.004166945007345}. Best is trial 1464 with value: 0.8990825688073395.
[32m[I 2023-04-21 00:02:27,028][39m Trial 3070 finished with value: 0.8648648648648648 and parameters: {'objective': 'Logloss', 'colsample_bylevel': 0.09225438222426426, 'depth': 8, 'boosting_type': 'Plain', 'bootstrap_type': 'Bayesian', 'bagging_temperature': 4.81946862812555}. Best is trial 1464 with value: 0.8990825688073395.
[32m[I 2023-04-21 00:02:27,732][39m Trial 3071 finished with value: 0.888888888888889 and parameters: {'objective': 'Logloss', 'colsample_bylevel': 0.09478764615704226, 'depth': 8, 'boosting_type': 'Plain', 'bootstrap_type': 'Bayesian', 'bagging_temperature': 6.045566054722923}. Best is trial 1464 with value: 0.8990825688073395.
[32m[I 2023-04-21 00:02:28,773][39m Trial 3072 finished with value: 0.8807339449541284 and parameters: {'objective': 'Logloss', 'colsample_bylevel': 0.0968011472492898, 'depth': 6, 'boosting_type': 'Plain', 'bootstrap_type': 'Bayesian', 'bagging_temperature': 4.368352362326693}. Best is trial 1464 with value: 0.8990825688073395.
[32m[I 2023-04-21 00:02:30,135][39m Trial 3073 finished with value: 0.8727272727272727 and parameters: {'objective': 'Logloss', 'colsample_bylevel': 0.0927272348927189, 'depth': 6, 'boosting_type': 'Plain', 'bootstrap_type': 'Bayesian', 'bagging_temperature': 5.561546255461029}. Best is trial 1464 with value: 0.8990825688073395.
[32m[I 2023-04-21 00:02:31,461][39m Trial 3074 finished with value: 0.8727272727272727 and parameters: {'objective': 'Logloss', 'colsample_bylevel': 0.09662650472931873, 'depth': 8, 'boosting_type': 'Plain', 'bootstrap_type': 'Bayesian', 'bagging_temperature': 3.847295092269149}. Best is trial 1464 with value: 0.8990825688073395.
[32m[I 2023-04-21 00:02:36,530][39m Trial 3075 finished with value: 0.8571428571428572 and parameters: {'objective': 'Logloss', 'colsample_bylevel': 0.0964775893540616, 'depth': 9, 'boosting_type': 'Ordered', 'bootstrap_type': 'Bayesian', 'bagging_temperature': 6.7245880501042095}. Best is trial 1464 with value: 0.8990825688073395.
[32m[I 2023-04-21 00:02:37,814][39m Trial 3076 finished with value: 0.8807339449541284 and parameters: {'objective': 'Logloss', 'colsample_bylevel': 0.09833033459817597, 'depth': 7, 'boosting_type': 'Plain', 'bootstrap_type': 'Bayesian', 'bagging_temperature': 5.227426730492875}. Best is trial 1464 with value: 0.8990825688073395.
[32m[I 2023-04-21 00:02:39,564][39m Trial 3077 finished with value: 0.8807339449541284 and parameters: {'objective': 'Logloss', 'colsample_bylevel': 0.09863448218329547, 'depth': 8, 'boosting_type': 'Plain', 'bootstrap_type': 'Bayesian', 'bagging_temperature': 4.467645325783814}. Best is trial 1464 with value: 0.8990825688073395.
[32m[I 2023-04-21 00:02:40,658][39m Trial 3078 finished with value: 0.8807339449541284 and parameters: {'objective': 'Logloss', 'colsample_bylevel': 0.09524839804573301, 'depth': 7, 'boosting_type': 'Plain', 'bootstrap_type': 'Bayesian', 'bagging_temperature': 4.062236473273066}. Best is trial 1464 with value: 0.8990825688073395.
[32m[I 2023-04-21 00:02:41,678][39m Trial 3079 finished with value: 0.888888888888889 and parameters: {'objective': 'Logloss', 'colsample_bylevel': 0.09996550026393135, 'depth': 7, 'boosting_type': 'Plain', 'bootstrap_type': 'Bayesian', 'bagging_temperature': 7.625868694034557}. Best is trial 1464 with value: 0.8990825688073395.
[32m[I 2023-04-21 00:02:42,647][39m Trial 3080 finished with value: 0.8785046728971961 and parameters: {'objective': 'Logloss', 'colsample_bylevel': 0.09994994957229453, 'depth': 7, 'boosting_type': 'Plain', 'bootstrap_type': 'Bayesian', 'bagging_temperature': 4.26884009489056}. Best is trial 1464 with value: 0.8990825688073395.
[32m[I 2023-04-21 00:02:44,400][39m Trial 3081 finished with value: 0.8623853211009175 and parameters: {'objective': 'Logloss', 'colsample_bylevel': 0.0972028106411135, 'depth': 8, 'boosting_type': 'Plain', 'bootstrap_type': 'Bayesian', 'bagging_temperature': 4.22579834700968}. Best is trial 1464 with value: 0.8990825688073395.
[32m[I 2023-04-21 00:02:45,257][39m Trial 3082 finished with value: 0.8727272727272727 and parameters: {'objective': 'CrossEntropy', 'colsample_bylevel': 0.09698257508654975, 'depth': 7, 'boosting_type': 'Plain', 'bootstrap_type': 'Bayesian', 'bagging_temperature': 3.767969985651466}. Best is trial 1464 with value: 0.8990825688073395.
[32m[I 2023-04-21 00:02:45,899][39m Trial 3083 finished with value: 0.8727272727272727 and parameters: {'objective': 'Logloss', 'colsample_bylevel': 0.09996513971590558, 'depth': 7, 'boosting_type': 'Plain', 'bootstrap_type': 'Bayesian', 'bagging_temperature': 3.9963191004769496}. Best is trial 1464 with value: 0.8990825688073395.
[32m[I 2023-04-21 00:02:47,118][39m Trial 3084 finished with value: 0.8807339449541284 and parameters: {'objective': 'Logloss', 'colsample_bylevel': 0.09812615520553554, 'depth': 7, 'boosting_type': 'Plain', 'bootstrap_type': 'Bayesian', 'bagging_temperature': 4.238396176474396}. Best is trial 1464 with value: 0.8990825688073395.
[32m[I 2023-04-21 00:02:47,737][39m Trial 3085 finished with value: 0.8648648648648648 and parameters: {'objective': 'Logloss', 'colsample_bylevel': 0.09832259655761383, 'depth': 7, 'boosting_type': 'Plain', 'bootstrap_type': 'Bayesian', 'bagging_temperature': 3.6917929908414657}. Best is trial 1464 with value: 0.8990825688073395.
[32m[I 2023-04-21 00:02:48,650][39m Trial 3086 finished with value: 0.8703703703703703 and parameters: {'objective': 'Logloss', 'colsample_bylevel': 0.09998018651618831, 'depth': 7, 'boosting_type': 'Plain', 'bootstrap_type': 'Bayesian', 'bagging_temperature': 4.29720677569369}. Best is trial 1464 with value: 0.8990825688073395.
[32m[I 2023-04-21 00:02:49,571][39m Trial 3087 finished with value: 0.8495575221238938 and parameters: {'objective': 'CrossEntropy', 'colsample_bylevel': 0.09379157838061852, 'depth': 7, 'boosting_type': 'Plain', 'bootstrap_type': 'MVS'}. Best is trial 1464 with value: 0.8990825688073395.
[32m[I 2023-04-21 00:02:50,715][39m Trial 3088 finished with value: 0.8727272727272727 and parameters: {'objective': 'Logloss', 'colsample_bylevel': 0.09561728332131195, 'depth': 7, 'boosting_type': 'Plain', 'bootstrap_type': 'Bayesian', 'bagging_temperature': 6.8710255118470425}. Best is trial 1464 with value: 0.8990825688073395.
[32m[I 2023-04-21 00:02:51,962][39m Trial 3089 finished with value: 0.8727272727272727 and parameters: {'objective': 'CrossEntropy', 'colsample_bylevel': 0.09455239627124266, 'depth': 6, 'boosting_type': 'Plain', 'bootstrap_type': 'Bayesian', 'bagging_temperature': 3.4000476505529478}. Best is trial 1464 with value: 0.8990825688073395.
[32m[I 2023-04-21 00:02:52,690][39m Trial 3090 finished with value: 0.8807339449541284 and parameters: {'objective': 'CrossEntropy', 'colsample_bylevel': 0.09596853417611069, 'depth': 7, 'boosting_type': 'Plain', 'bootstrap_type': 'Bayesian', 'bagging_temperature': 4.013477080910766}. Best is trial 1464 with value: 0.8990825688073395.
[32m[I 2023-04-21 00:02:54,010][39m Trial 3091 finished with value: 0.8807339449541284 and parameters: {'objective': 'Logloss', 'colsample_bylevel': 0.09709747691030365, 'depth': 8, 'boosting_type': 'Plain', 'bootstrap_type': 'Bayesian', 'bagging_temperature': 4.678779754478325}. Best is trial 1464 with value: 0.8990825688073395.
[32m[I 2023-04-21 00:02:55,383][39m Trial 3092 finished with value: 0.888888888888889 and parameters: {'objective': 'Logloss', 'colsample_bylevel': 0.09627193435292093, 'depth': 8, 'boosting_type': 'Plain', 'bootstrap_type': 'Bayesian', 'bagging_temperature': 4.943458290907989}. Best is trial 1464 with value: 0.8990825688073395.
[32m[I 2023-04-21 00:02:56,072][39m Trial 3093 finished with value: 0.8727272727272727 and parameters: {'objective': 'Logloss', 'colsample_bylevel': 0.09764487216454723, 'depth': 7, 'boosting_type': 'Plain', 'bootstrap_type': 'Bayesian', 'bagging_temperature': 3.786608066844142}. Best is trial 1464 with value: 0.8990825688073395.
[32m[I 2023-04-21 00:03:02,962][39m Trial 3094 finished with value: 0.8545454545454546 and parameters: {'objective': 'CrossEntropy', 'colsample_bylevel': 0.0984304180270103, 'depth': 6, 'boosting_type': 'Ordered', 'bootstrap_type': 'Bayesian', 'bagging_temperature': 4.3638587350637055}. Best is trial 1464 with value: 0.8990825688073395.
[32m[I 2023-04-21 00:03:03,842][39m Trial 3095 finished with value: 0.8521739130434783 and parameters: {'objective': 'Logloss', 'colsample_bylevel': 0.09007691493005285, 'depth': 7, 'boosting_type': 'Plain', 'bootstrap_type': 'Bayesian', 'bagging_temperature': 4.037736682795257}. Best is trial 1464 with value: 0.8990825688073395.
