[32m[I 2023-04-20 23:48:33,096][39m Trial 2439 finished with value: 0.8727272727272727 and parameters: {'objective': 'Logloss', 'colsample_bylevel': 0.09516323263218955, 'depth': 8, 'boosting_type': 'Plain', 'bootstrap_type': 'Bayesian', 'bagging_temperature': 6.610244111189518}. Best is trial 1464 with value: 0.8990825688073395.
[32m[I 2023-04-20 23:48:33,994][39m Trial 2440 finished with value: 0.8421052631578947 and parameters: {'objective': 'Logloss', 'colsample_bylevel': 0.08737579817457053, 'depth': 9, 'boosting_type': 'Plain', 'bootstrap_type': 'Bayesian', 'bagging_temperature': 1.5500209780456795}. Best is trial 1464 with value: 0.8990825688073395.
[32m[I 2023-04-20 23:48:34,972][39m Trial 2441 finished with value: 0.8727272727272727 and parameters: {'objective': 'CrossEntropy', 'colsample_bylevel': 0.09324567618783484, 'depth': 10, 'boosting_type': 'Plain', 'bootstrap_type': 'Bayesian', 'bagging_temperature': 3.8551336062880734}. Best is trial 1464 with value: 0.8990825688073395.
[32m[I 2023-04-20 23:48:36,239][39m Trial 2442 finished with value: 0.8807339449541284 and parameters: {'objective': 'Logloss', 'colsample_bylevel': 0.09519823811104032, 'depth': 10, 'boosting_type': 'Plain', 'bootstrap_type': 'Bayesian', 'bagging_temperature': 6.474123053731803}. Best is trial 1464 with value: 0.8990825688073395.
[32m[I 2023-04-20 23:48:37,355][39m Trial 2443 finished with value: 0.8807339449541284 and parameters: {'objective': 'Logloss', 'colsample_bylevel': 0.09648412661364272, 'depth': 9, 'boosting_type': 'Plain', 'bootstrap_type': 'Bayesian', 'bagging_temperature': 5.109896794048775}. Best is trial 1464 with value: 0.8990825688073395.
[32m[I 2023-04-20 23:48:38,144][39m Trial 2444 finished with value: 0.8828828828828829 and parameters: {'objective': 'CrossEntropy', 'colsample_bylevel': 0.0920271769687151, 'depth': 10, 'boosting_type': 'Plain', 'bootstrap_type': 'Bayesian', 'bagging_temperature': 4.52088393316048}. Best is trial 1464 with value: 0.8990825688073395.
[32m[I 2023-04-20 23:48:39,344][39m Trial 2445 finished with value: 0.8807339449541284 and parameters: {'objective': 'Logloss', 'colsample_bylevel': 0.09735920758313901, 'depth': 11, 'boosting_type': 'Plain', 'bootstrap_type': 'Bayesian', 'bagging_temperature': 6.348997798017296}. Best is trial 1464 with value: 0.8990825688073395.
[32m[I 2023-04-20 23:48:40,025][39m Trial 2446 finished with value: 0.8785046728971961 and parameters: {'objective': 'CrossEntropy', 'colsample_bylevel': 0.08911632653641148, 'depth': 11, 'boosting_type': 'Plain', 'bootstrap_type': 'Bayesian', 'bagging_temperature': 5.0599371732088665}. Best is trial 1464 with value: 0.8990825688073395.
[32m[I 2023-04-20 23:48:41,215][39m Trial 2447 finished with value: 0.8727272727272727 and parameters: {'objective': 'Logloss', 'colsample_bylevel': 0.09154185412937746, 'depth': 11, 'boosting_type': 'Plain', 'bootstrap_type': 'Bayesian', 'bagging_temperature': 7.450021665910422}. Best is trial 1464 with value: 0.8990825688073395.
[32m[I 2023-04-20 23:48:42,372][39m Trial 2448 finished with value: 0.8623853211009175 and parameters: {'objective': 'Logloss', 'colsample_bylevel': 0.08556097406610774, 'depth': 10, 'boosting_type': 'Plain', 'bootstrap_type': 'Bayesian', 'bagging_temperature': 5.69592698707268}. Best is trial 1464 with value: 0.8990825688073395.
[32m[I 2023-04-20 23:48:43,088][39m Trial 2449 finished with value: 0.8703703703703703 and parameters: {'objective': 'CrossEntropy', 'colsample_bylevel': 0.0908036375286923, 'depth': 8, 'boosting_type': 'Plain', 'bootstrap_type': 'Bayesian', 'bagging_temperature': 5.194693935632254}. Best is trial 1464 with value: 0.8990825688073395.
[32m[I 2023-04-20 23:48:44,217][39m Trial 2450 finished with value: 0.8596491228070176 and parameters: {'objective': 'Logloss', 'colsample_bylevel': 0.05928990076877935, 'depth': 8, 'boosting_type': 'Plain', 'bootstrap_type': 'Bayesian', 'bagging_temperature': 5.028405863298115}. Best is trial 1464 with value: 0.8990825688073395.
[32m[I 2023-04-20 23:48:45,491][39m Trial 2451 finished with value: 0.8672566371681416 and parameters: {'objective': 'Logloss', 'colsample_bylevel': 0.09746878358493866, 'depth': 8, 'boosting_type': 'Plain', 'bootstrap_type': 'MVS'}. Best is trial 1464 with value: 0.8990825688073395.
[32m[I 2023-04-20 23:48:46,746][39m Trial 2452 finished with value: 0.8727272727272727 and parameters: {'objective': 'Logloss', 'colsample_bylevel': 0.09980626596019898, 'depth': 9, 'boosting_type': 'Plain', 'bootstrap_type': 'Bayesian', 'bagging_temperature': 6.263235675600484}. Best is trial 1464 with value: 0.8990825688073395.
[32m[I 2023-04-20 23:48:47,851][39m Trial 2453 finished with value: 0.8807339449541284 and parameters: {'objective': 'CrossEntropy', 'colsample_bylevel': 0.09340589311763679, 'depth': 8, 'boosting_type': 'Plain', 'bootstrap_type': 'Bayesian', 'bagging_temperature': 5.2833639256547205}. Best is trial 1464 with value: 0.8990825688073395.
[32m[I 2023-04-20 23:48:53,207][39m Trial 2454 finished with value: 0.8495575221238938 and parameters: {'objective': 'Logloss', 'colsample_bylevel': 0.09409082491639692, 'depth': 9, 'boosting_type': 'Ordered', 'bootstrap_type': 'Bayesian', 'bagging_temperature': 4.8519155513259085}. Best is trial 1464 with value: 0.8990825688073395.
[32m[I 2023-04-20 23:48:54,226][39m Trial 2455 finished with value: 0.8807339449541284 and parameters: {'objective': 'CrossEntropy', 'colsample_bylevel': 0.09423883885906763, 'depth': 10, 'boosting_type': 'Plain', 'bootstrap_type': 'Bayesian', 'bagging_temperature': 5.315248836194202}. Best is trial 1464 with value: 0.8990825688073395.
[32m[I 2023-04-20 23:48:55,831][39m Trial 2456 finished with value: 0.8807339449541284 and parameters: {'objective': 'Logloss', 'colsample_bylevel': 0.09694970405757725, 'depth': 8, 'boosting_type': 'Plain', 'bootstrap_type': 'Bayesian', 'bagging_temperature': 3.3616183148216825}. Best is trial 1464 with value: 0.8990825688073395.
[32m[I 2023-04-20 23:48:56,979][39m Trial 2457 finished with value: 0.8807339449541284 and parameters: {'objective': 'CrossEntropy', 'colsample_bylevel': 0.09683820081817615, 'depth': 9, 'boosting_type': 'Plain', 'bootstrap_type': 'Bayesian', 'bagging_temperature': 4.579306407542823}. Best is trial 1464 with value: 0.8990825688073395.
[32m[I 2023-04-20 23:48:58,276][39m Trial 2458 finished with value: 0.888888888888889 and parameters: {'objective': 'CrossEntropy', 'colsample_bylevel': 0.09749761347426845, 'depth': 9, 'boosting_type': 'Plain', 'bootstrap_type': 'Bayesian', 'bagging_temperature': 5.161952347804811}. Best is trial 1464 with value: 0.8990825688073395.
[32m[I 2023-04-20 23:48:59,091][39m Trial 2459 finished with value: 0.888888888888889 and parameters: {'objective': 'Logloss', 'colsample_bylevel': 0.0987161757159656, 'depth': 7, 'boosting_type': 'Plain', 'bootstrap_type': 'Bayesian', 'bagging_temperature': 4.103676688331545}. Best is trial 1464 with value: 0.8990825688073395.
[32m[I 2023-04-20 23:48:59,889][39m Trial 2460 finished with value: 0.875 and parameters: {'objective': 'Logloss', 'colsample_bylevel': 0.09850498846527049, 'depth': 12, 'boosting_type': 'Plain', 'bootstrap_type': 'Bernoulli', 'subsample': 0.4882568530236002}. Best is trial 1464 with value: 0.8990825688073395.
[32m[I 2023-04-20 23:49:00,865][39m Trial 2461 finished with value: 0.8727272727272727 and parameters: {'objective': 'CrossEntropy', 'colsample_bylevel': 0.08925392095067589, 'depth': 10, 'boosting_type': 'Plain', 'bootstrap_type': 'Bayesian', 'bagging_temperature': 5.25891729462089}. Best is trial 1464 with value: 0.8990825688073395.
[32m[I 2023-04-20 23:49:02,019][39m Trial 2462 finished with value: 0.8807339449541284 and parameters: {'objective': 'Logloss', 'colsample_bylevel': 0.0980131799015615, 'depth': 7, 'boosting_type': 'Plain', 'bootstrap_type': 'Bayesian', 'bagging_temperature': 5.076468656178412}. Best is trial 1464 with value: 0.8990825688073395.
[32m[I 2023-04-20 23:49:03,089][39m Trial 2463 finished with value: 0.8727272727272727 and parameters: {'objective': 'Logloss', 'colsample_bylevel': 0.0969647537967312, 'depth': 8, 'boosting_type': 'Plain', 'bootstrap_type': 'Bayesian', 'bagging_temperature': 2.9393626784942697}. Best is trial 1464 with value: 0.8990825688073395.
[32m[I 2023-04-20 23:49:04,094][39m Trial 2464 finished with value: 0.8727272727272727 and parameters: {'objective': 'CrossEntropy', 'colsample_bylevel': 0.09557671648756362, 'depth': 9, 'boosting_type': 'Plain', 'bootstrap_type': 'Bayesian', 'bagging_temperature': 5.252227290967992}. Best is trial 1464 with value: 0.8990825688073395.
[32m[I 2023-04-20 23:49:05,154][39m Trial 2465 finished with value: 0.8807339449541284 and parameters: {'objective': 'Logloss', 'colsample_bylevel': 0.0957653148638162, 'depth': 10, 'boosting_type': 'Plain', 'bootstrap_type': 'Bayesian', 'bagging_temperature': 4.001120492210646}. Best is trial 1464 with value: 0.8990825688073395.
[32m[I 2023-04-20 23:49:06,429][39m Trial 2466 finished with value: 0.8648648648648648 and parameters: {'objective': 'Logloss', 'colsample_bylevel': 0.09542292339330077, 'depth': 8, 'boosting_type': 'Plain', 'bootstrap_type': 'Bayesian', 'bagging_temperature': 3.014143456591308}. Best is trial 1464 with value: 0.8990825688073395.
[32m[I 2023-04-20 23:49:07,797][39m Trial 2467 finished with value: 0.8495575221238938 and parameters: {'objective': 'CrossEntropy', 'colsample_bylevel': 0.09691290962696626, 'depth': 9, 'boosting_type': 'Plain', 'bootstrap_type': 'Bernoulli', 'subsample': 0.8288183440209019}. Best is trial 1464 with value: 0.8990825688073395.
[32m[I 2023-04-20 23:49:08,613][39m Trial 2468 finished with value: 0.8807339449541284 and parameters: {'objective': 'CrossEntropy', 'colsample_bylevel': 0.08658336459589937, 'depth': 6, 'boosting_type': 'Plain', 'bootstrap_type': 'Bayesian', 'bagging_temperature': 6.309771594491222}. Best is trial 1464 with value: 0.8990825688073395.
[32m[I 2023-04-20 23:49:09,794][39m Trial 2469 finished with value: 0.8521739130434783 and parameters: {'objective': 'Logloss', 'colsample_bylevel': 0.056018444081018526, 'depth': 8, 'boosting_type': 'Plain', 'bootstrap_type': 'Bayesian', 'bagging_temperature': 7.940561063618187}. Best is trial 1464 with value: 0.8990825688073395.
[32m[I 2023-04-20 23:49:10,880][39m Trial 2470 finished with value: 0.8727272727272727 and parameters: {'objective': 'Logloss', 'colsample_bylevel': 0.08879446083893426, 'depth': 10, 'boosting_type': 'Plain', 'bootstrap_type': 'Bayesian', 'bagging_temperature': 6.335824779807428}. Best is trial 1464 with value: 0.8990825688073395.
[32m[I 2023-04-20 23:49:11,489][39m Trial 2471 finished with value: 0.8703703703703703 and parameters: {'objective': 'CrossEntropy', 'colsample_bylevel': 0.09966869818893714, 'depth': 8, 'boosting_type': 'Plain', 'bootstrap_type': 'Bayesian', 'bagging_temperature': 5.20536561101787}. Best is trial 1464 with value: 0.8990825688073395.
[32m[I 2023-04-20 23:49:15,874][39m Trial 2472 finished with value: 0.8495575221238938 and parameters: {'objective': 'CrossEntropy', 'colsample_bylevel': 0.08929976919258273, 'depth': 9, 'boosting_type': 'Ordered', 'bootstrap_type': 'MVS'}. Best is trial 1464 with value: 0.8990825688073395.
[32m[I 2023-04-20 23:49:16,674][39m Trial 2473 finished with value: 0.8495575221238938 and parameters: {'objective': 'CrossEntropy', 'colsample_bylevel': 0.08909289744039335, 'depth': 10, 'boosting_type': 'Plain', 'bootstrap_type': 'MVS'}. Best is trial 1464 with value: 0.8990825688073395.
[32m[I 2023-04-20 23:49:17,757][39m Trial 2474 finished with value: 0.8623853211009175 and parameters: {'objective': 'Logloss', 'colsample_bylevel': 0.09997710264109438, 'depth': 8, 'boosting_type': 'Plain', 'bootstrap_type': 'Bayesian', 'bagging_temperature': 3.955665754547527}. Best is trial 1464 with value: 0.8990825688073395.
[32m[I 2023-04-20 23:49:18,706][39m Trial 2475 finished with value: 0.8648648648648648 and parameters: {'objective': 'CrossEntropy', 'colsample_bylevel': 0.0911075796514801, 'depth': 10, 'boosting_type': 'Plain', 'bootstrap_type': 'Bayesian', 'bagging_temperature': 1.8048158454498797}. Best is trial 1464 with value: 0.8990825688073395.
[32m[I 2023-04-20 23:49:19,497][39m Trial 2476 finished with value: 0.8727272727272727 and parameters: {'objective': 'Logloss', 'colsample_bylevel': 0.09558212441257406, 'depth': 12, 'boosting_type': 'Plain', 'bootstrap_type': 'Bayesian', 'bagging_temperature': 4.513503648816763}. Best is trial 1464 with value: 0.8990825688073395.
[32m[I 2023-04-20 23:49:20,580][39m Trial 2477 finished with value: 0.8807339449541284 and parameters: {'objective': 'Logloss', 'colsample_bylevel': 0.09516489165737246, 'depth': 9, 'boosting_type': 'Plain', 'bootstrap_type': 'Bayesian', 'bagging_temperature': 4.481807639679864}. Best is trial 1464 with value: 0.8990825688073395.
[32m[I 2023-04-20 23:49:22,553][39m Trial 2478 finished with value: 0.8703703703703703 and parameters: {'objective': 'CrossEntropy', 'colsample_bylevel': 0.09834101388912135, 'depth': 9, 'boosting_type': 'Plain', 'bootstrap_type': 'Bayesian', 'bagging_temperature': 6.61001351386521}. Best is trial 1464 with value: 0.8990825688073395.
[32m[I 2023-04-20 23:49:23,570][39m Trial 2479 finished with value: 0.8807339449541284 and parameters: {'objective': 'CrossEntropy', 'colsample_bylevel': 0.09580644749535458, 'depth': 9, 'boosting_type': 'Plain', 'bootstrap_type': 'Bayesian', 'bagging_temperature': 6.979731074809465}. Best is trial 1464 with value: 0.8990825688073395.
[32m[I 2023-04-20 23:49:24,707][39m Trial 2480 finished with value: 0.8807339449541284 and parameters: {'objective': 'CrossEntropy', 'colsample_bylevel': 0.08615845446102974, 'depth': 8, 'boosting_type': 'Plain', 'bootstrap_type': 'Bayesian', 'bagging_temperature': 5.15980335995836}. Best is trial 1464 with value: 0.8990825688073395.
[32m[I 2023-04-20 23:49:25,759][39m Trial 2481 finished with value: 0.8727272727272727 and parameters: {'objective': 'Logloss', 'colsample_bylevel': 0.0915079098528886, 'depth': 10, 'boosting_type': 'Plain', 'bootstrap_type': 'Bayesian', 'bagging_temperature': 5.343325270263666}. Best is trial 1464 with value: 0.8990825688073395.
[32m[I 2023-04-20 23:49:26,401][39m Trial 2482 finished with value: 0.8727272727272727 and parameters: {'objective': 'CrossEntropy', 'colsample_bylevel': 0.0968512120712699, 'depth': 8, 'boosting_type': 'Plain', 'bootstrap_type': 'Bayesian', 'bagging_temperature': 6.100736585303382}. Best is trial 1464 with value: 0.8990825688073395.
[32m[I 2023-04-20 23:49:27,430][39m Trial 2483 finished with value: 0.8727272727272727 and parameters: {'objective': 'CrossEntropy', 'colsample_bylevel': 0.09146731578907179, 'depth': 10, 'boosting_type': 'Plain', 'bootstrap_type': 'Bernoulli', 'subsample': 0.27448699763803397}. Best is trial 1464 with value: 0.8990825688073395.
[32m[I 2023-04-20 23:49:28,989][39m Trial 2484 finished with value: 0.8727272727272727 and parameters: {'objective': 'Logloss', 'colsample_bylevel': 0.09374922874626875, 'depth': 9, 'boosting_type': 'Plain', 'bootstrap_type': 'Bernoulli', 'subsample': 0.3832259956233964}. Best is trial 1464 with value: 0.8990825688073395.
[32m[I 2023-04-20 23:49:29,666][39m Trial 2485 finished with value: 0.888888888888889 and parameters: {'objective': 'CrossEntropy', 'colsample_bylevel': 0.09166949763541844, 'depth': 10, 'boosting_type': 'Plain', 'bootstrap_type': 'Bayesian', 'bagging_temperature': 4.910928341358899}. Best is trial 1464 with value: 0.8990825688073395.
[32m[I 2023-04-20 23:49:30,483][39m Trial 2486 finished with value: 0.8421052631578947 and parameters: {'objective': 'CrossEntropy', 'colsample_bylevel': 0.067950043661329, 'depth': 10, 'boosting_type': 'Plain', 'bootstrap_type': 'Bayesian', 'bagging_temperature': 4.953207209325531}. Best is trial 1464 with value: 0.8990825688073395.
[32m[I 2023-04-20 23:49:32,143][39m Trial 2487 finished with value: 0.8807339449541284 and parameters: {'objective': 'Logloss', 'colsample_bylevel': 0.09995789296544977, 'depth': 8, 'boosting_type': 'Plain', 'bootstrap_type': 'Bayesian', 'bagging_temperature': 4.283319115468887}. Best is trial 1464 with value: 0.8990825688073395.
[32m[I 2023-04-20 23:49:32,900][39m Trial 2488 finished with value: 0.8623853211009175 and parameters: {'objective': 'Logloss', 'colsample_bylevel': 0.09797190773293185, 'depth': 7, 'boosting_type': 'Plain', 'bootstrap_type': 'Bayesian', 'bagging_temperature': 4.176350783940294}. Best is trial 1464 with value: 0.8990825688073395.
[32m[I 2023-04-20 23:49:33,607][39m Trial 2489 finished with value: 0.8807339449541284 and parameters: {'objective': 'Logloss', 'colsample_bylevel': 0.09806821451479965, 'depth': 7, 'boosting_type': 'Plain', 'bootstrap_type': 'Bayesian', 'bagging_temperature': 6.673455516363478}. Best is trial 1464 with value: 0.8990825688073395.
[32m[I 2023-04-20 23:49:34,465][39m Trial 2490 finished with value: 0.8807339449541284 and parameters: {'objective': 'Logloss', 'colsample_bylevel': 0.09346903044689817, 'depth': 11, 'boosting_type': 'Plain', 'bootstrap_type': 'Bayesian', 'bagging_temperature': 4.596974781587254}. Best is trial 1464 with value: 0.8990825688073395.
[32m[I 2023-04-20 23:49:36,154][39m Trial 2491 finished with value: 0.890909090909091 and parameters: {'objective': 'CrossEntropy', 'colsample_bylevel': 0.08808751563996241, 'depth': 9, 'boosting_type': 'Plain', 'bootstrap_type': 'Bayesian', 'bagging_temperature': 4.912052531405541}. Best is trial 1464 with value: 0.8990825688073395.
[32m[I 2023-04-20 23:49:41,414][39m Trial 2492 finished with value: 0.8571428571428572 and parameters: {'objective': 'Logloss', 'colsample_bylevel': 0.0981086544728948, 'depth': 9, 'boosting_type': 'Ordered', 'bootstrap_type': 'Bayesian', 'bagging_temperature': 5.020208630161839}. Best is trial 1464 with value: 0.8990825688073395.
[32m[I 2023-04-20 23:49:42,710][39m Trial 2493 finished with value: 0.8596491228070176 and parameters: {'objective': 'CrossEntropy', 'colsample_bylevel': 0.08441889904594133, 'depth': 10, 'boosting_type': 'Plain', 'bootstrap_type': 'Bayesian', 'bagging_temperature': 7.302606895973704}. Best is trial 1464 with value: 0.8990825688073395.
[32m[I 2023-04-20 23:49:43,856][39m Trial 2494 finished with value: 0.8807339449541284 and parameters: {'objective': 'CrossEntropy', 'colsample_bylevel': 0.09389855219668773, 'depth': 9, 'boosting_type': 'Plain', 'bootstrap_type': 'Bayesian', 'bagging_temperature': 4.9889784963827815}. Best is trial 1464 with value: 0.8990825688073395.
[32m[I 2023-04-20 23:49:44,816][39m Trial 2495 finished with value: 0.8807339449541284 and parameters: {'objective': 'Logloss', 'colsample_bylevel': 0.09631975550038004, 'depth': 8, 'boosting_type': 'Plain', 'bootstrap_type': 'Bayesian', 'bagging_temperature': 6.827610825404039}. Best is trial 1464 with value: 0.8990825688073395.
[32m[I 2023-04-20 23:49:45,794][39m Trial 2496 finished with value: 0.8571428571428572 and parameters: {'objective': 'Logloss', 'colsample_bylevel': 0.08615732533403035, 'depth': 9, 'boosting_type': 'Plain', 'bootstrap_type': 'Bayesian', 'bagging_temperature': 5.476726475215725}. Best is trial 1464 with value: 0.8990825688073395.
[32m[I 2023-04-20 23:49:47,564][39m Trial 2497 finished with value: 0.8807339449541284 and parameters: {'objective': 'Logloss', 'colsample_bylevel': 0.0943044343296048, 'depth': 9, 'boosting_type': 'Plain', 'bootstrap_type': 'Bayesian', 'bagging_temperature': 4.688439643258339}. Best is trial 1464 with value: 0.8990825688073395.
[32m[I 2023-04-20 23:49:48,200][39m Trial 2498 finished with value: 0.8648648648648648 and parameters: {'objective': 'CrossEntropy', 'colsample_bylevel': 0.09221301545676217, 'depth': 11, 'boosting_type': 'Plain', 'bootstrap_type': 'Bayesian', 'bagging_temperature': 5.4107596639882125}. Best is trial 1464 with value: 0.8990825688073395.
[32m[I 2023-04-20 23:49:48,840][39m Trial 2499 finished with value: 0.875 and parameters: {'objective': 'CrossEntropy', 'colsample_bylevel': 0.08161686616343974, 'depth': 10, 'boosting_type': 'Plain', 'bootstrap_type': 'Bayesian', 'bagging_temperature': 6.9139087698782795}. Best is trial 1464 with value: 0.8990825688073395.
[32m[I 2023-04-20 23:49:49,722][39m Trial 2500 finished with value: 0.8305084745762712 and parameters: {'objective': 'Logloss', 'colsample_bylevel': 0.09986533068515618, 'depth': 2, 'boosting_type': 'Plain', 'bootstrap_type': 'Bayesian', 'bagging_temperature': 4.088216109472878}. Best is trial 1464 with value: 0.8990825688073395.
[32m[I 2023-04-20 23:49:50,597][39m Trial 2501 finished with value: 0.8571428571428572 and parameters: {'objective': 'CrossEntropy', 'colsample_bylevel': 0.0982779755917823, 'depth': 12, 'boosting_type': 'Plain', 'bootstrap_type': 'Bernoulli', 'subsample': 0.794312561074668}. Best is trial 1464 with value: 0.8990825688073395.
[32m[I 2023-04-20 23:49:51,987][39m Trial 2502 finished with value: 0.8648648648648648 and parameters: {'objective': 'CrossEntropy', 'colsample_bylevel': 0.08870281517661993, 'depth': 9, 'boosting_type': 'Plain', 'bootstrap_type': 'Bayesian', 'bagging_temperature': 4.8348059043796905}. Best is trial 1464 with value: 0.8990825688073395.
[32m[I 2023-04-20 23:49:53,452][39m Trial 2503 finished with value: 0.8807339449541284 and parameters: {'objective': 'Logloss', 'colsample_bylevel': 0.09306799560311169, 'depth': 9, 'boosting_type': 'Plain', 'bootstrap_type': 'Bayesian', 'bagging_temperature': 3.8114187444494867}. Best is trial 1464 with value: 0.8990825688073395.
