[32m[I 2023-04-20 23:18:11,867][39m Trial 994 finished with value: 0.8807339449541284 and parameters: {'objective': 'CrossEntropy', 'colsample_bylevel': 0.08798470591717365, 'depth': 8, 'boosting_type': 'Plain', 'bootstrap_type': 'Bayesian', 'bagging_temperature': 8.241885785089966}. Best is trial 205 with value: 0.890909090909091.
[32m[I 2023-04-20 23:18:13,307][39m Trial 995 finished with value: 0.8648648648648648 and parameters: {'objective': 'Logloss', 'colsample_bylevel': 0.09565601556995448, 'depth': 8, 'boosting_type': 'Plain', 'bootstrap_type': 'Bayesian', 'bagging_temperature': 3.88192680406481}. Best is trial 205 with value: 0.890909090909091.
[32m[I 2023-04-20 23:18:14,678][39m Trial 996 finished with value: 0.8468468468468469 and parameters: {'objective': 'Logloss', 'colsample_bylevel': 0.09062621510266831, 'depth': 8, 'boosting_type': 'Plain', 'bootstrap_type': 'Bayesian', 'bagging_temperature': 4.0164662826774435}. Best is trial 205 with value: 0.890909090909091.
[32m[I 2023-04-20 23:18:15,865][39m Trial 997 finished with value: 0.888888888888889 and parameters: {'objective': 'CrossEntropy', 'colsample_bylevel': 0.09339447875351492, 'depth': 12, 'boosting_type': 'Plain', 'bootstrap_type': 'Bayesian', 'bagging_temperature': 8.981832134876825}. Best is trial 205 with value: 0.890909090909091.
[32m[I 2023-04-20 23:18:16,636][39m Trial 998 finished with value: 0.8807339449541284 and parameters: {'objective': 'CrossEntropy', 'colsample_bylevel': 0.09308619433317598, 'depth': 11, 'boosting_type': 'Plain', 'bootstrap_type': 'Bayesian', 'bagging_temperature': 9.044720520508303}. Best is trial 205 with value: 0.890909090909091.
[32m[I 2023-04-20 23:18:21,854][39m Trial 999 finished with value: 0.8495575221238938 and parameters: {'objective': 'CrossEntropy', 'colsample_bylevel': 0.08869284491344334, 'depth': 12, 'boosting_type': 'Ordered', 'bootstrap_type': 'Bayesian', 'bagging_temperature': 9.157449686910798}. Best is trial 205 with value: 0.890909090909091.
[32m[I 2023-04-20 23:18:23,319][39m Trial 1000 finished with value: 0.8672566371681416 and parameters: {'objective': 'Logloss', 'colsample_bylevel': 0.09957524936360404, 'depth': 8, 'boosting_type': 'Plain', 'bootstrap_type': 'Bernoulli', 'subsample': 0.7546280183958098}. Best is trial 205 with value: 0.890909090909091.
[32m[I 2023-04-20 23:18:24,095][39m Trial 1001 finished with value: 0.8545454545454546 and parameters: {'objective': 'Logloss', 'colsample_bylevel': 0.09057327496174343, 'depth': 12, 'boosting_type': 'Plain', 'bootstrap_type': 'Bayesian', 'bagging_temperature': 4.309732375161594}. Best is trial 205 with value: 0.890909090909091.
[32m[I 2023-04-20 23:18:25,436][39m Trial 1002 finished with value: 0.8703703703703703 and parameters: {'objective': 'Logloss', 'colsample_bylevel': 0.09977980563099956, 'depth': 8, 'boosting_type': 'Plain', 'bootstrap_type': 'Bayesian', 'bagging_temperature': 3.299375307133622}. Best is trial 205 with value: 0.890909090909091.
[32m[I 2023-04-20 23:18:26,254][39m Trial 1003 finished with value: 0.8828828828828829 and parameters: {'objective': 'CrossEntropy', 'colsample_bylevel': 0.09002790753413313, 'depth': 8, 'boosting_type': 'Plain', 'bootstrap_type': 'Bayesian', 'bagging_temperature': 4.35617947788985}. Best is trial 205 with value: 0.890909090909091.
[32m[I 2023-04-20 23:18:27,096][39m Trial 1004 finished with value: 0.8376068376068375 and parameters: {'objective': 'Logloss', 'colsample_bylevel': 0.06297567642189726, 'depth': 10, 'boosting_type': 'Plain', 'bootstrap_type': 'Bayesian', 'bagging_temperature': 8.078896833053198}. Best is trial 205 with value: 0.890909090909091.
[32m[I 2023-04-20 23:18:28,225][39m Trial 1005 finished with value: 0.8703703703703703 and parameters: {'objective': 'Logloss', 'colsample_bylevel': 0.09844335988393381, 'depth': 8, 'boosting_type': 'Plain', 'bootstrap_type': 'Bayesian', 'bagging_temperature': 5.760328775901492}. Best is trial 205 with value: 0.890909090909091.
[32m[I 2023-04-20 23:18:29,450][39m Trial 1006 finished with value: 0.8648648648648648 and parameters: {'objective': 'Logloss', 'colsample_bylevel': 0.09641639765398989, 'depth': 8, 'boosting_type': 'Plain', 'bootstrap_type': 'Bayesian', 'bagging_temperature': 3.592208642837428}. Best is trial 205 with value: 0.890909090909091.
[32m[I 2023-04-20 23:18:30,363][39m Trial 1007 finished with value: 0.8305084745762712 and parameters: {'objective': 'Logloss', 'colsample_bylevel': 0.055492480341721884, 'depth': 10, 'boosting_type': 'Plain', 'bootstrap_type': 'Bayesian', 'bagging_temperature': 7.058617448637574}. Best is trial 205 with value: 0.890909090909091.
[32m[I 2023-04-20 23:18:30,917][39m Trial 1008 finished with value: 0.8807339449541284 and parameters: {'objective': 'Logloss', 'colsample_bylevel': 0.0974214462001071, 'depth': 6, 'boosting_type': 'Plain', 'bootstrap_type': 'Bayesian', 'bagging_temperature': 4.20248073924136}. Best is trial 205 with value: 0.890909090909091.
[32m[I 2023-04-20 23:18:31,902][39m Trial 1009 finished with value: 0.8727272727272727 and parameters: {'objective': 'Logloss', 'colsample_bylevel': 0.09522402040734444, 'depth': 8, 'boosting_type': 'Plain', 'bootstrap_type': 'Bayesian', 'bagging_temperature': 6.383397823919133}. Best is trial 205 with value: 0.890909090909091.
[32m[I 2023-04-20 23:18:33,278][39m Trial 1010 finished with value: 0.8275862068965517 and parameters: {'objective': 'Logloss', 'colsample_bylevel': 0.0666840997107044, 'depth': 9, 'boosting_type': 'Plain', 'bootstrap_type': 'Bayesian', 'bagging_temperature': 2.8889586898587822}. Best is trial 205 with value: 0.890909090909091.
[32m[I 2023-04-20 23:18:33,797][39m Trial 1011 finished with value: 0.8703703703703703 and parameters: {'objective': 'CrossEntropy', 'colsample_bylevel': 0.09333239790874655, 'depth': 12, 'boosting_type': 'Plain', 'bootstrap_type': 'Bayesian', 'bagging_temperature': 9.854312896175841}. Best is trial 205 with value: 0.890909090909091.
[32m[I 2023-04-20 23:18:34,700][39m Trial 1012 finished with value: 0.8727272727272727 and parameters: {'objective': 'Logloss', 'colsample_bylevel': 0.08668598214627062, 'depth': 9, 'boosting_type': 'Plain', 'bootstrap_type': 'Bayesian', 'bagging_temperature': 3.9350104570499136}. Best is trial 205 with value: 0.890909090909091.
[32m[I 2023-04-20 23:18:35,616][39m Trial 1013 finished with value: 0.8623853211009175 and parameters: {'objective': 'CrossEntropy', 'colsample_bylevel': 0.09113927670817207, 'depth': 10, 'boosting_type': 'Plain', 'bootstrap_type': 'Bayesian', 'bagging_temperature': 4.411640139499435}. Best is trial 205 with value: 0.890909090909091.
[32m[I 2023-04-20 23:18:36,672][39m Trial 1014 finished with value: 0.8495575221238938 and parameters: {'objective': 'Logloss', 'colsample_bylevel': 0.09512967231395453, 'depth': 11, 'boosting_type': 'Plain', 'bootstrap_type': 'MVS'}. Best is trial 205 with value: 0.890909090909091.
[32m[I 2023-04-20 23:18:37,559][39m Trial 1015 finished with value: 0.8727272727272727 and parameters: {'objective': 'Logloss', 'colsample_bylevel': 0.091503132121554, 'depth': 10, 'boosting_type': 'Plain', 'bootstrap_type': 'Bayesian', 'bagging_temperature': 4.016295859407372}. Best is trial 205 with value: 0.890909090909091.
[32m[I 2023-04-20 23:18:38,417][39m Trial 1016 finished with value: 0.8648648648648648 and parameters: {'objective': 'Logloss', 'colsample_bylevel': 0.09751495389783126, 'depth': 9, 'boosting_type': 'Plain', 'bootstrap_type': 'Bayesian', 'bagging_temperature': 4.375214618518207}. Best is trial 205 with value: 0.890909090909091.
[32m[I 2023-04-20 23:18:43,893][39m Trial 1017 finished with value: 0.8421052631578947 and parameters: {'objective': 'Logloss', 'colsample_bylevel': 0.09252307226340316, 'depth': 7, 'boosting_type': 'Ordered', 'bootstrap_type': 'Bayesian', 'bagging_temperature': 4.207684043091439}. Best is trial 205 with value: 0.890909090909091.
[32m[I 2023-04-20 23:18:44,838][39m Trial 1018 finished with value: 0.8623853211009175 and parameters: {'objective': 'Logloss', 'colsample_bylevel': 0.09882886971526714, 'depth': 10, 'boosting_type': 'Plain', 'bootstrap_type': 'Bayesian', 'bagging_temperature': 3.759831966433669}. Best is trial 205 with value: 0.890909090909091.
[32m[I 2023-04-20 23:18:45,691][39m Trial 1019 finished with value: 0.8623853211009175 and parameters: {'objective': 'Logloss', 'colsample_bylevel': 0.09985787843388037, 'depth': 8, 'boosting_type': 'Plain', 'bootstrap_type': 'Bayesian', 'bagging_temperature': 6.245613250513933}. Best is trial 205 with value: 0.890909090909091.
[32m[I 2023-04-20 23:18:46,670][39m Trial 1020 finished with value: 0.8807339449541284 and parameters: {'objective': 'Logloss', 'colsample_bylevel': 0.09980430848804892, 'depth': 8, 'boosting_type': 'Plain', 'bootstrap_type': 'Bayesian', 'bagging_temperature': 5.283096213476484}. Best is trial 205 with value: 0.890909090909091.
[32m[I 2023-04-20 23:18:47,835][39m Trial 1021 finished with value: 0.8495575221238938 and parameters: {'objective': 'Logloss', 'colsample_bylevel': 0.09386319452928107, 'depth': 10, 'boosting_type': 'Plain', 'bootstrap_type': 'Bernoulli', 'subsample': 0.8118915693214798}. Best is trial 205 with value: 0.890909090909091.
[32m[I 2023-04-20 23:18:49,109][39m Trial 1022 finished with value: 0.8807339449541284 and parameters: {'objective': 'Logloss', 'colsample_bylevel': 0.0976456420385834, 'depth': 9, 'boosting_type': 'Plain', 'bootstrap_type': 'Bayesian', 'bagging_temperature': 4.678773315052254}. Best is trial 205 with value: 0.890909090909091.
[32m[I 2023-04-20 23:18:50,093][39m Trial 1023 finished with value: 0.8623853211009175 and parameters: {'objective': 'Logloss', 'colsample_bylevel': 0.09552951803114614, 'depth': 6, 'boosting_type': 'Plain', 'bootstrap_type': 'Bayesian', 'bagging_temperature': 2.4895665775878038}. Best is trial 205 with value: 0.890909090909091.
[32m[I 2023-04-20 23:18:51,136][39m Trial 1024 finished with value: 0.8807339449541284 and parameters: {'objective': 'Logloss', 'colsample_bylevel': 0.09984514272026417, 'depth': 8, 'boosting_type': 'Plain', 'bootstrap_type': 'Bayesian', 'bagging_temperature': 6.619107598492554}. Best is trial 205 with value: 0.890909090909091.
[32m[I 2023-04-20 23:18:52,236][39m Trial 1025 finished with value: 0.8807339449541284 and parameters: {'objective': 'Logloss', 'colsample_bylevel': 0.09322873151458282, 'depth': 9, 'boosting_type': 'Plain', 'bootstrap_type': 'Bayesian', 'bagging_temperature': 4.549277512534675}. Best is trial 205 with value: 0.890909090909091.
[32m[I 2023-04-20 23:18:53,598][39m Trial 1026 finished with value: 0.8727272727272727 and parameters: {'objective': 'Logloss', 'colsample_bylevel': 0.09666825146898236, 'depth': 9, 'boosting_type': 'Plain', 'bootstrap_type': 'Bayesian', 'bagging_temperature': 6.588217784317242}. Best is trial 205 with value: 0.890909090909091.
[32m[I 2023-04-20 23:18:54,346][39m Trial 1027 finished with value: 0.8421052631578947 and parameters: {'objective': 'Logloss', 'colsample_bylevel': 0.07481231438967334, 'depth': 11, 'boosting_type': 'Plain', 'bootstrap_type': 'Bayesian', 'bagging_temperature': 2.0705836484229447}. Best is trial 205 with value: 0.890909090909091.
[32m[I 2023-04-20 23:18:55,601][39m Trial 1028 finished with value: 0.8727272727272727 and parameters: {'objective': 'Logloss', 'colsample_bylevel': 0.09603595624910612, 'depth': 11, 'boosting_type': 'Plain', 'bootstrap_type': 'Bayesian', 'bagging_temperature': 4.397326875722438}. Best is trial 205 with value: 0.890909090909091.
[32m[I 2023-04-20 23:18:56,759][39m Trial 1029 finished with value: 0.8807339449541284 and parameters: {'objective': 'Logloss', 'colsample_bylevel': 0.0981020563311638, 'depth': 10, 'boosting_type': 'Plain', 'bootstrap_type': 'Bayesian', 'bagging_temperature': 6.152225517690266}. Best is trial 205 with value: 0.890909090909091.
[32m[I 2023-04-20 23:18:57,568][39m Trial 1030 finished with value: 0.875 and parameters: {'objective': 'Logloss', 'colsample_bylevel': 0.09673396155704309, 'depth': 7, 'boosting_type': 'Plain', 'bootstrap_type': 'Bayesian', 'bagging_temperature': 6.418366976914548}. Best is trial 205 with value: 0.890909090909091.
[32m[I 2023-04-20 23:18:58,578][39m Trial 1031 finished with value: 0.888888888888889 and parameters: {'objective': 'CrossEntropy', 'colsample_bylevel': 0.0951974354578776, 'depth': 10, 'boosting_type': 'Plain', 'bootstrap_type': 'Bayesian', 'bagging_temperature': 4.077177659068302}. Best is trial 205 with value: 0.890909090909091.
[32m[I 2023-04-20 23:18:59,549][39m Trial 1032 finished with value: 0.8571428571428572 and parameters: {'objective': 'CrossEntropy', 'colsample_bylevel': 0.06844900613618062, 'depth': 9, 'boosting_type': 'Plain', 'bootstrap_type': 'Bayesian', 'bagging_temperature': 4.746959095651025}. Best is trial 205 with value: 0.890909090909091.
[32m[I 2023-04-20 23:19:00,468][39m Trial 1033 finished with value: 0.8727272727272727 and parameters: {'objective': 'Logloss', 'colsample_bylevel': 0.0914060930813413, 'depth': 11, 'boosting_type': 'Plain', 'bootstrap_type': 'Bayesian', 'bagging_temperature': 8.789237599435651}. Best is trial 205 with value: 0.890909090909091.
[32m[I 2023-04-20 23:19:06,325][39m Trial 1034 finished with value: 0.8347826086956522 and parameters: {'objective': 'Logloss', 'colsample_bylevel': 0.0958286620684193, 'depth': 4, 'boosting_type': 'Ordered', 'bootstrap_type': 'MVS'}. Best is trial 205 with value: 0.890909090909091.
[32m[I 2023-04-20 23:19:07,316][39m Trial 1035 finished with value: 0.8727272727272727 and parameters: {'objective': 'Logloss', 'colsample_bylevel': 0.09749488308451364, 'depth': 12, 'boosting_type': 'Plain', 'bootstrap_type': 'Bayesian', 'bagging_temperature': 3.561061676072223}. Best is trial 205 with value: 0.890909090909091.
[32m[I 2023-04-20 23:19:08,382][39m Trial 1036 finished with value: 0.8727272727272727 and parameters: {'objective': 'CrossEntropy', 'colsample_bylevel': 0.09259375139351375, 'depth': 10, 'boosting_type': 'Plain', 'bootstrap_type': 'Bayesian', 'bagging_temperature': 2.9593572066082965}. Best is trial 205 with value: 0.890909090909091.
[32m[I 2023-04-20 23:19:09,501][39m Trial 1037 finished with value: 0.8727272727272727 and parameters: {'objective': 'Logloss', 'colsample_bylevel': 0.0944786257751455, 'depth': 7, 'boosting_type': 'Plain', 'bootstrap_type': 'Bayesian', 'bagging_temperature': 3.709079343167344}. Best is trial 205 with value: 0.890909090909091.
[32m[I 2023-04-20 23:19:10,477][39m Trial 1038 finished with value: 0.8727272727272727 and parameters: {'objective': 'Logloss', 'colsample_bylevel': 0.09706580279758202, 'depth': 7, 'boosting_type': 'Plain', 'bootstrap_type': 'Bayesian', 'bagging_temperature': 6.029906052954291}. Best is trial 205 with value: 0.890909090909091.
[32m[I 2023-04-20 23:19:11,228][39m Trial 1039 finished with value: 0.8807339449541284 and parameters: {'objective': 'CrossEntropy', 'colsample_bylevel': 0.09635237430528308, 'depth': 7, 'boosting_type': 'Plain', 'bootstrap_type': 'Bayesian', 'bagging_temperature': 6.233187946085972}. Best is trial 205 with value: 0.890909090909091.
[32m[I 2023-04-20 23:19:12,465][39m Trial 1040 finished with value: 0.8727272727272727 and parameters: {'objective': 'Logloss', 'colsample_bylevel': 0.09300112647795811, 'depth': 11, 'boosting_type': 'Plain', 'bootstrap_type': 'Bayesian', 'bagging_temperature': 4.203176400496667}. Best is trial 205 with value: 0.890909090909091.
[32m[I 2023-04-20 23:19:13,579][39m Trial 1041 finished with value: 0.8807339449541284 and parameters: {'objective': 'Logloss', 'colsample_bylevel': 0.09464052300503113, 'depth': 9, 'boosting_type': 'Plain', 'bootstrap_type': 'Bayesian', 'bagging_temperature': 4.636522988002036}. Best is trial 205 with value: 0.890909090909091.
[32m[I 2023-04-20 23:19:14,692][39m Trial 1042 finished with value: 0.8807339449541284 and parameters: {'objective': 'Logloss', 'colsample_bylevel': 0.09415375286568144, 'depth': 9, 'boosting_type': 'Plain', 'bootstrap_type': 'Bayesian', 'bagging_temperature': 4.557385382984265}. Best is trial 205 with value: 0.890909090909091.
[32m[I 2023-04-20 23:19:15,799][39m Trial 1043 finished with value: 0.875 and parameters: {'objective': 'Logloss', 'colsample_bylevel': 0.09848167884376234, 'depth': 8, 'boosting_type': 'Plain', 'bootstrap_type': 'Bayesian', 'bagging_temperature': 1.7843720744832714}. Best is trial 205 with value: 0.890909090909091.
[32m[I 2023-04-20 23:19:16,588][39m Trial 1044 finished with value: 0.8727272727272727 and parameters: {'objective': 'CrossEntropy', 'colsample_bylevel': 0.0912385831900062, 'depth': 12, 'boosting_type': 'Plain', 'bootstrap_type': 'Bayesian', 'bagging_temperature': 5.185195157379785}. Best is trial 205 with value: 0.890909090909091.
[32m[I 2023-04-20 23:19:17,554][39m Trial 1045 finished with value: 0.8703703703703703 and parameters: {'objective': 'CrossEntropy', 'colsample_bylevel': 0.093841351718406, 'depth': 12, 'boosting_type': 'Plain', 'bootstrap_type': 'Bayesian', 'bagging_temperature': 9.205785079276666}. Best is trial 205 with value: 0.890909090909091.
[32m[I 2023-04-20 23:19:19,058][39m Trial 1046 finished with value: 0.8392857142857144 and parameters: {'objective': 'Logloss', 'colsample_bylevel': 0.09497255154856227, 'depth': 8, 'boosting_type': 'Plain', 'bootstrap_type': 'Bernoulli', 'subsample': 0.2700832642685234}. Best is trial 205 with value: 0.890909090909091.
[32m[I 2023-04-20 23:19:20,019][39m Trial 1047 finished with value: 0.8648648648648648 and parameters: {'objective': 'CrossEntropy', 'colsample_bylevel': 0.0901572840018315, 'depth': 9, 'boosting_type': 'Plain', 'bootstrap_type': 'Bayesian', 'bagging_temperature': 8.958865229329781}. Best is trial 205 with value: 0.890909090909091.
[32m[I 2023-04-20 23:19:20,822][39m Trial 1048 finished with value: 0.8727272727272727 and parameters: {'objective': 'Logloss', 'colsample_bylevel': 0.09580394908291841, 'depth': 9, 'boosting_type': 'Plain', 'bootstrap_type': 'Bayesian', 'bagging_temperature': 4.9925935049235335}. Best is trial 205 with value: 0.890909090909091.
[32m[I 2023-04-20 23:19:22,111][39m Trial 1049 finished with value: 0.8571428571428572 and parameters: {'objective': 'Logloss', 'colsample_bylevel': 0.09378232525496404, 'depth': 8, 'boosting_type': 'Plain', 'bootstrap_type': 'Bayesian', 'bagging_temperature': 5.654249667674277}. Best is trial 205 with value: 0.890909090909091.
[32m[I 2023-04-20 23:19:22,932][39m Trial 1050 finished with value: 0.8727272727272727 and parameters: {'objective': 'CrossEntropy', 'colsample_bylevel': 0.09341919983255444, 'depth': 12, 'boosting_type': 'Plain', 'bootstrap_type': 'Bayesian', 'bagging_temperature': 4.8600884926760015}. Best is trial 205 with value: 0.890909090909091.
[32m[I 2023-04-20 23:19:24,251][39m Trial 1051 finished with value: 0.8785046728971961 and parameters: {'objective': 'CrossEntropy', 'colsample_bylevel': 0.09125480765143676, 'depth': 10, 'boosting_type': 'Plain', 'bootstrap_type': 'Bayesian', 'bagging_temperature': 4.449642675646349}. Best is trial 205 with value: 0.890909090909091.
[32m[I 2023-04-20 23:19:25,163][39m Trial 1052 finished with value: 0.8807339449541284 and parameters: {'objective': 'CrossEntropy', 'colsample_bylevel': 0.0954721293809894, 'depth': 9, 'boosting_type': 'Plain', 'bootstrap_type': 'Bayesian', 'bagging_temperature': 3.2759389147118534}. Best is trial 205 with value: 0.890909090909091.
[32m[I 2023-04-20 23:19:25,894][39m Trial 1053 finished with value: 0.8807339449541284 and parameters: {'objective': 'Logloss', 'colsample_bylevel': 0.09295402138183678, 'depth': 8, 'boosting_type': 'Plain', 'bootstrap_type': 'Bayesian', 'bagging_temperature': 3.762827726862515}. Best is trial 205 with value: 0.890909090909091.
[32m[I 2023-04-20 23:19:27,243][39m Trial 1054 finished with value: 0.8807339449541284 and parameters: {'objective': 'CrossEntropy', 'colsample_bylevel': 0.08815703470119403, 'depth': 8, 'boosting_type': 'Plain', 'bootstrap_type': 'Bayesian', 'bagging_temperature': 5.314921498075617}. Best is trial 205 with value: 0.890909090909091.
[32m[I 2023-04-20 23:19:32,605][39m Trial 1055 finished with value: 0.8571428571428572 and parameters: {'objective': 'Logloss', 'colsample_bylevel': 0.0976396489995543, 'depth': 9, 'boosting_type': 'Ordered', 'bootstrap_type': 'Bayesian', 'bagging_temperature': 4.815603596295578}. Best is trial 205 with value: 0.890909090909091.
[32m[I 2023-04-20 23:19:33,665][39m Trial 1056 finished with value: 0.8807339449541284 and parameters: {'objective': 'CrossEntropy', 'colsample_bylevel': 0.09167741450984361, 'depth': 10, 'boosting_type': 'Plain', 'bootstrap_type': 'Bayesian', 'bagging_temperature': 7.784214719068513}. Best is trial 205 with value: 0.890909090909091.
[32m[I 2023-04-20 23:19:34,863][39m Trial 1057 finished with value: 0.8807339449541284 and parameters: {'objective': 'CrossEntropy', 'colsample_bylevel': 0.09597807819681935, 'depth': 9, 'boosting_type': 'Plain', 'bootstrap_type': 'Bayesian', 'bagging_temperature': 7.154610057030499}. Best is trial 205 with value: 0.890909090909091.
[32m[I 2023-04-20 23:19:35,934][39m Trial 1058 finished with value: 0.8596491228070176 and parameters: {'objective': 'CrossEntropy', 'colsample_bylevel': 0.09032182241288358, 'depth': 9, 'boosting_type': 'Plain', 'bootstrap_type': 'Bayesian', 'bagging_temperature': 9.423719025047218}. Best is trial 205 with value: 0.890909090909091.
[32m[I 2023-04-20 23:19:36,780][39m Trial 1059 finished with value: 0.8305084745762712 and parameters: {'objective': 'CrossEntropy', 'colsample_bylevel': 0.019353529565474294, 'depth': 12, 'boosting_type': 'Plain', 'bootstrap_type': 'MVS'}. Best is trial 205 with value: 0.890909090909091.
