[32m[I 2023-04-20 23:37:25,962][39m Trial 1917 finished with value: 0.8727272727272727 and parameters: {'objective': 'Logloss', 'colsample_bylevel': 0.09589137904394533, 'depth': 9, 'boosting_type': 'Plain', 'bootstrap_type': 'Bayesian', 'bagging_temperature': 4.7321514822199084}. Best is trial 1464 with value: 0.8990825688073395.
[32m[I 2023-04-20 23:37:27,193][39m Trial 1918 finished with value: 0.8807339449541284 and parameters: {'objective': 'Logloss', 'colsample_bylevel': 0.09880374644020416, 'depth': 8, 'boosting_type': 'Plain', 'bootstrap_type': 'Bayesian', 'bagging_temperature': 3.7923159117846685}. Best is trial 1464 with value: 0.8990825688073395.
[32m[I 2023-04-20 23:37:28,267][39m Trial 1919 finished with value: 0.8807339449541284 and parameters: {'objective': 'Logloss', 'colsample_bylevel': 0.09804881080110034, 'depth': 8, 'boosting_type': 'Plain', 'bootstrap_type': 'Bayesian', 'bagging_temperature': 6.625861686698569}. Best is trial 1464 with value: 0.8990825688073395.
[32m[I 2023-04-20 23:37:29,242][39m Trial 1920 finished with value: 0.8727272727272727 and parameters: {'objective': 'Logloss', 'colsample_bylevel': 0.09688278301775913, 'depth': 8, 'boosting_type': 'Plain', 'bootstrap_type': 'Bayesian', 'bagging_temperature': 6.478154118367605}. Best is trial 1464 with value: 0.8990825688073395.
[32m[I 2023-04-20 23:37:30,249][39m Trial 1921 finished with value: 0.8828828828828829 and parameters: {'objective': 'CrossEntropy', 'colsample_bylevel': 0.09151076732557677, 'depth': 9, 'boosting_type': 'Plain', 'bootstrap_type': 'Bayesian', 'bagging_temperature': 6.072040738844278}. Best is trial 1464 with value: 0.8990825688073395.
[32m[I 2023-04-20 23:37:31,756][39m Trial 1922 finished with value: 0.8703703703703703 and parameters: {'objective': 'CrossEntropy', 'colsample_bylevel': 0.09991434638442927, 'depth': 9, 'boosting_type': 'Plain', 'bootstrap_type': 'Bayesian', 'bagging_temperature': 5.038172956901921}. Best is trial 1464 with value: 0.8990825688073395.
[32m[I 2023-04-20 23:37:32,765][39m Trial 1923 finished with value: 0.8807339449541284 and parameters: {'objective': 'CrossEntropy', 'colsample_bylevel': 0.09585273731081334, 'depth': 12, 'boosting_type': 'Plain', 'bootstrap_type': 'Bayesian', 'bagging_temperature': 7.028292231967989}. Best is trial 1464 with value: 0.8990825688073395.
[32m[I 2023-04-20 23:37:33,639][39m Trial 1924 finished with value: 0.8623853211009175 and parameters: {'objective': 'Logloss', 'colsample_bylevel': 0.06935915215353625, 'depth': 12, 'boosting_type': 'Plain', 'bootstrap_type': 'Bayesian', 'bagging_temperature': 5.0335087968740035}. Best is trial 1464 with value: 0.8990825688073395.
[32m[I 2023-04-20 23:37:38,375][39m Trial 1925 finished with value: 0.8495575221238938 and parameters: {'objective': 'Logloss', 'colsample_bylevel': 0.09450994964034316, 'depth': 8, 'boosting_type': 'Ordered', 'bootstrap_type': 'MVS'}. Best is trial 1464 with value: 0.8990825688073395.
[32m[I 2023-04-20 23:37:39,518][39m Trial 1926 finished with value: 0.8727272727272727 and parameters: {'objective': 'CrossEntropy', 'colsample_bylevel': 0.09411856921656264, 'depth': 11, 'boosting_type': 'Plain', 'bootstrap_type': 'Bayesian', 'bagging_temperature': 6.821742321240477}. Best is trial 1464 with value: 0.8990825688073395.
[32m[I 2023-04-20 23:37:40,587][39m Trial 1927 finished with value: 0.8807339449541284 and parameters: {'objective': 'Logloss', 'colsample_bylevel': 0.09586947614478174, 'depth': 10, 'boosting_type': 'Plain', 'bootstrap_type': 'Bayesian', 'bagging_temperature': 4.113275590051266}. Best is trial 1464 with value: 0.8990825688073395.
[32m[I 2023-04-20 23:37:41,400][39m Trial 1928 finished with value: 0.8727272727272727 and parameters: {'objective': 'CrossEntropy', 'colsample_bylevel': 0.09287015585687385, 'depth': 10, 'boosting_type': 'Plain', 'bootstrap_type': 'Bayesian', 'bagging_temperature': 4.799277345353088}. Best is trial 1464 with value: 0.8990825688073395.
[32m[I 2023-04-20 23:37:42,786][39m Trial 1929 finished with value: 0.8807339449541284 and parameters: {'objective': 'Logloss', 'colsample_bylevel': 0.09749784234615573, 'depth': 9, 'boosting_type': 'Plain', 'bootstrap_type': 'Bayesian', 'bagging_temperature': 4.549670558491733}. Best is trial 1464 with value: 0.8990825688073395.
[32m[I 2023-04-20 23:37:43,483][39m Trial 1930 finished with value: 0.8807339449541284 and parameters: {'objective': 'Logloss', 'colsample_bylevel': 0.09792910478042392, 'depth': 9, 'boosting_type': 'Plain', 'bootstrap_type': 'Bayesian', 'bagging_temperature': 4.358823127629996}. Best is trial 1464 with value: 0.8990825688073395.
[32m[I 2023-04-20 23:37:44,067][39m Trial 1931 finished with value: 0.8727272727272727 and parameters: {'objective': 'CrossEntropy', 'colsample_bylevel': 0.0963350984990331, 'depth': 10, 'boosting_type': 'Plain', 'bootstrap_type': 'Bayesian', 'bagging_temperature': 4.805415819956529}. Best is trial 1464 with value: 0.8990825688073395.
[32m[I 2023-04-20 23:37:45,830][39m Trial 1932 finished with value: 0.8703703703703703 and parameters: {'objective': 'CrossEntropy', 'colsample_bylevel': 0.09991140701994138, 'depth': 8, 'boosting_type': 'Plain', 'bootstrap_type': 'Bayesian', 'bagging_temperature': 4.2586851708991444}. Best is trial 1464 with value: 0.8990825688073395.
[32m[I 2023-04-20 23:37:47,402][39m Trial 1933 finished with value: 0.8727272727272727 and parameters: {'objective': 'Logloss', 'colsample_bylevel': 0.09817964750931893, 'depth': 8, 'boosting_type': 'Plain', 'bootstrap_type': 'Bayesian', 'bagging_temperature': 6.102179278582389}. Best is trial 1464 with value: 0.8990825688073395.
[32m[I 2023-04-20 23:37:48,065][39m Trial 1934 finished with value: 0.890909090909091 and parameters: {'objective': 'Logloss', 'colsample_bylevel': 0.09455527146063354, 'depth': 10, 'boosting_type': 'Plain', 'bootstrap_type': 'Bayesian', 'bagging_temperature': 6.636034761366823}. Best is trial 1464 with value: 0.8990825688073395.
[32m[I 2023-04-20 23:37:49,362][39m Trial 1935 finished with value: 0.8703703703703703 and parameters: {'objective': 'Logloss', 'colsample_bylevel': 0.0927454455222279, 'depth': 12, 'boosting_type': 'Plain', 'bootstrap_type': 'Bayesian', 'bagging_temperature': 9.882571249801154}. Best is trial 1464 with value: 0.8990825688073395.
[32m[I 2023-04-20 23:37:50,203][39m Trial 1936 finished with value: 0.8807339449541284 and parameters: {'objective': 'Logloss', 'colsample_bylevel': 0.09686027964476805, 'depth': 8, 'boosting_type': 'Plain', 'bootstrap_type': 'Bayesian', 'bagging_temperature': 6.912832134245422}. Best is trial 1464 with value: 0.8990825688073395.
[32m[I 2023-04-20 23:37:51,083][39m Trial 1937 finished with value: 0.8807339449541284 and parameters: {'objective': 'Logloss', 'colsample_bylevel': 0.09793734122923616, 'depth': 8, 'boosting_type': 'Plain', 'bootstrap_type': 'Bayesian', 'bagging_temperature': 5.0186175268477005}. Best is trial 1464 with value: 0.8990825688073395.
[32m[I 2023-04-20 23:37:52,267][39m Trial 1938 finished with value: 0.8596491228070176 and parameters: {'objective': 'CrossEntropy', 'colsample_bylevel': 0.08549847760651481, 'depth': 10, 'boosting_type': 'Plain', 'bootstrap_type': 'Bayesian', 'bagging_temperature': 8.980473044213454}. Best is trial 1464 with value: 0.8990825688073395.
[32m[I 2023-04-20 23:37:53,199][39m Trial 1939 finished with value: 0.8727272727272727 and parameters: {'objective': 'CrossEntropy', 'colsample_bylevel': 0.096780167696629, 'depth': 11, 'boosting_type': 'Plain', 'bootstrap_type': 'Bayesian', 'bagging_temperature': 7.349719217704721}. Best is trial 1464 with value: 0.8990825688073395.
[32m[I 2023-04-20 23:37:54,499][39m Trial 1940 finished with value: 0.888888888888889 and parameters: {'objective': 'CrossEntropy', 'colsample_bylevel': 0.09433539240610496, 'depth': 9, 'boosting_type': 'Plain', 'bootstrap_type': 'Bayesian', 'bagging_temperature': 6.541470771155454}. Best is trial 1464 with value: 0.8990825688073395.
[32m[I 2023-04-20 23:37:55,548][39m Trial 1941 finished with value: 0.890909090909091 and parameters: {'objective': 'CrossEntropy', 'colsample_bylevel': 0.08924184011935492, 'depth': 10, 'boosting_type': 'Plain', 'bootstrap_type': 'Bayesian', 'bagging_temperature': 5.383412499414201}. Best is trial 1464 with value: 0.8990825688073395.
[32m[I 2023-04-20 23:37:56,119][39m Trial 1942 finished with value: 0.8648648648648648 and parameters: {'objective': 'CrossEntropy', 'colsample_bylevel': 0.09087954021514819, 'depth': 10, 'boosting_type': 'Plain', 'bootstrap_type': 'Bayesian', 'bagging_temperature': 5.8943175220124004}. Best is trial 1464 with value: 0.8990825688073395.
[32m[I 2023-04-20 23:37:57,403][39m Trial 1943 finished with value: 0.875 and parameters: {'objective': 'Logloss', 'colsample_bylevel': 0.09283225229099028, 'depth': 10, 'boosting_type': 'Plain', 'bootstrap_type': 'Bernoulli', 'subsample': 0.22035216809611902}. Best is trial 1464 with value: 0.8990825688073395.
[32m[I 2023-04-20 23:37:58,136][39m Trial 1944 finished with value: 0.8807339449541284 and parameters: {'objective': 'Logloss', 'colsample_bylevel': 0.09603417866707697, 'depth': 10, 'boosting_type': 'Plain', 'bootstrap_type': 'Bayesian', 'bagging_temperature': 6.659993620615266}. Best is trial 1464 with value: 0.8990825688073395.
[32m[I 2023-04-20 23:37:59,385][39m Trial 1945 finished with value: 0.8727272727272727 and parameters: {'objective': 'Logloss', 'colsample_bylevel': 0.08681767572408647, 'depth': 10, 'boosting_type': 'Plain', 'bootstrap_type': 'Bayesian', 'bagging_temperature': 6.946174682221273}. Best is trial 1464 with value: 0.8990825688073395.
[32m[I 2023-04-20 23:38:00,384][39m Trial 1946 finished with value: 0.888888888888889 and parameters: {'objective': 'Logloss', 'colsample_bylevel': 0.0942345789632873, 'depth': 10, 'boosting_type': 'Plain', 'bootstrap_type': 'Bayesian', 'bagging_temperature': 7.108192618438384}. Best is trial 1464 with value: 0.8990825688073395.
[32m[I 2023-04-20 23:38:01,520][39m Trial 1947 finished with value: 0.8545454545454546 and parameters: {'objective': 'CrossEntropy', 'colsample_bylevel': 0.08383679232316335, 'depth': 6, 'boosting_type': 'Plain', 'bootstrap_type': 'Bayesian', 'bagging_temperature': 5.617516934609972}. Best is trial 1464 with value: 0.8990825688073395.
[32m[I 2023-04-20 23:38:06,601][39m Trial 1948 finished with value: 0.8421052631578947 and parameters: {'objective': 'Logloss', 'colsample_bylevel': 0.09105055657897479, 'depth': 10, 'boosting_type': 'Ordered', 'bootstrap_type': 'MVS'}. Best is trial 1464 with value: 0.8990825688073395.
[32m[I 2023-04-20 23:38:07,700][39m Trial 1949 finished with value: 0.888888888888889 and parameters: {'objective': 'Logloss', 'colsample_bylevel': 0.09375325372017485, 'depth': 10, 'boosting_type': 'Plain', 'bootstrap_type': 'Bayesian', 'bagging_temperature': 5.363690071621885}. Best is trial 1464 with value: 0.8990825688073395.
[32m[I 2023-04-20 23:38:08,766][39m Trial 1950 finished with value: 0.8807339449541284 and parameters: {'objective': 'Logloss', 'colsample_bylevel': 0.0941952198639756, 'depth': 11, 'boosting_type': 'Plain', 'bootstrap_type': 'Bayesian', 'bagging_temperature': 4.061267529413525}. Best is trial 1464 with value: 0.8990825688073395.
[32m[I 2023-04-20 23:38:09,693][39m Trial 1951 finished with value: 0.8571428571428572 and parameters: {'objective': 'CrossEntropy', 'colsample_bylevel': 0.09688826974714759, 'depth': 11, 'boosting_type': 'Plain', 'bootstrap_type': 'Bernoulli', 'subsample': 0.41375200782354404}. Best is trial 1464 with value: 0.8990825688073395.
[32m[I 2023-04-20 23:38:11,200][39m Trial 1952 finished with value: 0.8648648648648648 and parameters: {'objective': 'Logloss', 'colsample_bylevel': 0.09681850225973511, 'depth': 9, 'boosting_type': 'Plain', 'bootstrap_type': 'Bernoulli', 'subsample': 0.6665124240764886}. Best is trial 1464 with value: 0.8990825688073395.
[32m[I 2023-04-20 23:38:11,874][39m Trial 1953 finished with value: 0.8648648648648648 and parameters: {'objective': 'Logloss', 'colsample_bylevel': 0.09509157037651966, 'depth': 10, 'boosting_type': 'Plain', 'bootstrap_type': 'Bayesian', 'bagging_temperature': 7.549016543616512}. Best is trial 1464 with value: 0.8990825688073395.
[32m[I 2023-04-20 23:38:12,790][39m Trial 1954 finished with value: 0.8727272727272727 and parameters: {'objective': 'Logloss', 'colsample_bylevel': 0.09514075805142247, 'depth': 10, 'boosting_type': 'Plain', 'bootstrap_type': 'Bayesian', 'bagging_temperature': 2.6978899770014673}. Best is trial 1464 with value: 0.8990825688073395.
[32m[I 2023-04-20 23:38:14,717][39m Trial 1955 finished with value: 0.8807339449541284 and parameters: {'objective': 'Logloss', 'colsample_bylevel': 0.0999197738517592, 'depth': 9, 'boosting_type': 'Plain', 'bootstrap_type': 'Bayesian', 'bagging_temperature': 4.325562175153609}. Best is trial 1464 with value: 0.8990825688073395.
[32m[I 2023-04-20 23:38:15,297][39m Trial 1956 finished with value: 0.8807339449541284 and parameters: {'objective': 'CrossEntropy', 'colsample_bylevel': 0.09833538059810029, 'depth': 10, 'boosting_type': 'Plain', 'bootstrap_type': 'Bayesian', 'bagging_temperature': 7.205911407167244}. Best is trial 1464 with value: 0.8990825688073395.
[32m[I 2023-04-20 23:38:16,350][39m Trial 1957 finished with value: 0.888888888888889 and parameters: {'objective': 'CrossEntropy', 'colsample_bylevel': 0.08767897682119613, 'depth': 10, 'boosting_type': 'Plain', 'bootstrap_type': 'Bayesian', 'bagging_temperature': 6.239531312291556}. Best is trial 1464 with value: 0.8990825688073395.
[32m[I 2023-04-20 23:38:17,121][39m Trial 1958 finished with value: 0.8421052631578947 and parameters: {'objective': 'CrossEntropy', 'colsample_bylevel': 0.0728429275099073, 'depth': 10, 'boosting_type': 'Plain', 'bootstrap_type': 'Bayesian', 'bagging_temperature': 4.113836887282728}. Best is trial 1464 with value: 0.8990825688073395.
[32m[I 2023-04-20 23:38:18,066][39m Trial 1959 finished with value: 0.8623853211009175 and parameters: {'objective': 'CrossEntropy', 'colsample_bylevel': 0.09698677589523215, 'depth': 10, 'boosting_type': 'Plain', 'bootstrap_type': 'Bayesian', 'bagging_temperature': 6.75974906907241}. Best is trial 1464 with value: 0.8990825688073395.
[32m[I 2023-04-20 23:38:19,047][39m Trial 1960 finished with value: 0.8727272727272727 and parameters: {'objective': 'Logloss', 'colsample_bylevel': 0.09571575775247451, 'depth': 10, 'boosting_type': 'Plain', 'bootstrap_type': 'Bayesian', 'bagging_temperature': 6.955627831918969}. Best is trial 1464 with value: 0.8990825688073395.
[32m[I 2023-04-20 23:38:20,171][39m Trial 1961 finished with value: 0.8807339449541284 and parameters: {'objective': 'CrossEntropy', 'colsample_bylevel': 0.09983411399884866, 'depth': 10, 'boosting_type': 'Plain', 'bootstrap_type': 'Bayesian', 'bagging_temperature': 5.4314838784190735}. Best is trial 1464 with value: 0.8990825688073395.
[32m[I 2023-04-20 23:38:21,055][39m Trial 1962 finished with value: 0.888888888888889 and parameters: {'objective': 'CrossEntropy', 'colsample_bylevel': 0.09474137366388839, 'depth': 10, 'boosting_type': 'Plain', 'bootstrap_type': 'Bernoulli', 'subsample': 0.10433646430658677}. Best is trial 1464 with value: 0.8990825688073395.
[32m[I 2023-04-20 23:38:25,898][39m Trial 1963 finished with value: 0.8495575221238938 and parameters: {'objective': 'CrossEntropy', 'colsample_bylevel': 0.09298443223442794, 'depth': 10, 'boosting_type': 'Ordered', 'bootstrap_type': 'Bayesian', 'bagging_temperature': 4.197399333175599}. Best is trial 1464 with value: 0.8990825688073395.
[32m[I 2023-04-20 23:38:27,377][39m Trial 1964 finished with value: 0.8571428571428572 and parameters: {'objective': 'Logloss', 'colsample_bylevel': 0.09832687402663844, 'depth': 9, 'boosting_type': 'Plain', 'bootstrap_type': 'Bernoulli', 'subsample': 0.793323860059573}. Best is trial 1464 with value: 0.8990825688073395.
[32m[I 2023-04-20 23:38:28,161][39m Trial 1965 finished with value: 0.8703703703703703 and parameters: {'objective': 'Logloss', 'colsample_bylevel': 0.08670240122636381, 'depth': 10, 'boosting_type': 'Plain', 'bootstrap_type': 'Bayesian', 'bagging_temperature': 5.292901455369707}. Best is trial 1464 with value: 0.8990825688073395.
[32m[I 2023-04-20 23:38:29,139][39m Trial 1966 finished with value: 0.8448275862068967 and parameters: {'objective': 'Logloss', 'colsample_bylevel': 0.05507520344031443, 'depth': 7, 'boosting_type': 'Plain', 'bootstrap_type': 'Bayesian', 'bagging_temperature': 5.5928791662577515}. Best is trial 1464 with value: 0.8990825688073395.
[32m[I 2023-04-20 23:38:29,974][39m Trial 1967 finished with value: 0.8623853211009175 and parameters: {'objective': 'Logloss', 'colsample_bylevel': 0.08505750846065858, 'depth': 7, 'boosting_type': 'Plain', 'bootstrap_type': 'Bayesian', 'bagging_temperature': 4.1540993108626605}. Best is trial 1464 with value: 0.8990825688073395.
[32m[I 2023-04-20 23:38:31,136][39m Trial 1968 finished with value: 0.8807339449541284 and parameters: {'objective': 'CrossEntropy', 'colsample_bylevel': 0.08784827033420485, 'depth': 10, 'boosting_type': 'Plain', 'bootstrap_type': 'Bayesian', 'bagging_temperature': 5.706218258456068}. Best is trial 1464 with value: 0.8990825688073395.
[32m[I 2023-04-20 23:38:31,895][39m Trial 1969 finished with value: 0.8727272727272727 and parameters: {'objective': 'CrossEntropy', 'colsample_bylevel': 0.09255334202270209, 'depth': 11, 'boosting_type': 'Plain', 'bootstrap_type': 'Bayesian', 'bagging_temperature': 5.403273748386115}. Best is trial 1464 with value: 0.8990825688073395.
[32m[I 2023-04-20 23:38:33,156][39m Trial 1970 finished with value: 0.8828828828828829 and parameters: {'objective': 'Logloss', 'colsample_bylevel': 0.099825716102881, 'depth': 7, 'boosting_type': 'Plain', 'bootstrap_type': 'Bayesian', 'bagging_temperature': 6.274794911018993}. Best is trial 1464 with value: 0.8990825688073395.
[32m[I 2023-04-20 23:38:34,698][39m Trial 1971 finished with value: 0.8807339449541284 and parameters: {'objective': 'CrossEntropy', 'colsample_bylevel': 0.08910286970962572, 'depth': 9, 'boosting_type': 'Plain', 'bootstrap_type': 'Bayesian', 'bagging_temperature': 4.988774958501931}. Best is trial 1464 with value: 0.8990825688073395.
[32m[I 2023-04-20 23:38:35,624][39m Trial 1972 finished with value: 0.8727272727272727 and parameters: {'objective': 'Logloss', 'colsample_bylevel': 0.09113267539082116, 'depth': 7, 'boosting_type': 'Plain', 'bootstrap_type': 'Bayesian', 'bagging_temperature': 6.4883269418918355}. Best is trial 1464 with value: 0.8990825688073395.
[32m[I 2023-04-20 23:38:36,745][39m Trial 1973 finished with value: 0.8727272727272727 and parameters: {'objective': 'CrossEntropy', 'colsample_bylevel': 0.09251188644269609, 'depth': 11, 'boosting_type': 'Plain', 'bootstrap_type': 'Bayesian', 'bagging_temperature': 6.703745711794631}. Best is trial 1464 with value: 0.8990825688073395.
[32m[I 2023-04-20 23:38:37,793][39m Trial 1974 finished with value: 0.888888888888889 and parameters: {'objective': 'Logloss', 'colsample_bylevel': 0.09396224581818667, 'depth': 9, 'boosting_type': 'Plain', 'bootstrap_type': 'Bayesian', 'bagging_temperature': 7.0975781598809675}. Best is trial 1464 with value: 0.8990825688073395.
[32m[I 2023-04-20 23:38:38,967][39m Trial 1975 finished with value: 0.8347826086956522 and parameters: {'objective': 'CrossEntropy', 'colsample_bylevel': 0.09146686675193647, 'depth': 9, 'boosting_type': 'Plain', 'bootstrap_type': 'MVS'}. Best is trial 1464 with value: 0.8990825688073395.
[32m[I 2023-04-20 23:38:39,812][39m Trial 1976 finished with value: 0.875 and parameters: {'objective': 'CrossEntropy', 'colsample_bylevel': 0.09014318339139701, 'depth': 10, 'boosting_type': 'Plain', 'bootstrap_type': 'Bayesian', 'bagging_temperature': 4.424888687435885}. Best is trial 1464 with value: 0.8990825688073395.
[32m[I 2023-04-20 23:38:40,680][39m Trial 1977 finished with value: 0.8703703703703703 and parameters: {'objective': 'CrossEntropy', 'colsample_bylevel': 0.09609977156989827, 'depth': 9, 'boosting_type': 'Plain', 'bootstrap_type': 'Bayesian', 'bagging_temperature': 6.096724803771149}. Best is trial 1464 with value: 0.8990825688073395.
[32m[I 2023-04-20 23:38:41,456][39m Trial 1978 finished with value: 0.8703703703703703 and parameters: {'objective': 'Logloss', 'colsample_bylevel': 0.09291279426303212, 'depth': 10, 'boosting_type': 'Plain', 'bootstrap_type': 'Bayesian', 'bagging_temperature': 5.3666564872205536}. Best is trial 1464 with value: 0.8990825688073395.
[32m[I 2023-04-20 23:38:42,669][39m Trial 1979 finished with value: 0.8672566371681416 and parameters: {'objective': 'Logloss', 'colsample_bylevel': 0.09824818509565778, 'depth': 8, 'boosting_type': 'Plain', 'bootstrap_type': 'Bernoulli', 'subsample': 0.4483930426191337}. Best is trial 1464 with value: 0.8990825688073395.
[32m[I 2023-04-20 23:38:43,478][39m Trial 1980 finished with value: 0.8495575221238938 and parameters: {'objective': 'CrossEntropy', 'colsample_bylevel': 0.0971188305276098, 'depth': 8, 'boosting_type': 'Plain', 'bootstrap_type': 'Bernoulli', 'subsample': 0.9753604351892939}. Best is trial 1464 with value: 0.8990825688073395.
[32m[I 2023-04-20 23:38:44,288][39m Trial 1981 finished with value: 0.8421052631578947 and parameters: {'objective': 'Logloss', 'colsample_bylevel': 0.050072388475084356, 'depth': 9, 'boosting_type': 'Plain', 'bootstrap_type': 'Bayesian', 'bagging_temperature': 5.763673302047775}. Best is trial 1464 with value: 0.8990825688073395.
