[32m[I 2023-04-20 23:51:23,113][39m Trial 2569 finished with value: 0.8727272727272727 and parameters: {'objective': 'CrossEntropy', 'colsample_bylevel': 0.09850213650345939, 'depth': 8, 'boosting_type': 'Plain', 'bootstrap_type': 'Bayesian', 'bagging_temperature': 5.687741783136202}. Best is trial 1464 with value: 0.8990825688073395.
[32m[I 2023-04-20 23:51:24,056][39m Trial 2570 finished with value: 0.8421052631578947 and parameters: {'objective': 'Logloss', 'colsample_bylevel': 0.07300204689889683, 'depth': 12, 'boosting_type': 'Plain', 'bootstrap_type': 'Bayesian', 'bagging_temperature': 4.900420597035914}. Best is trial 1464 with value: 0.8990825688073395.
[32m[I 2023-04-20 23:51:24,937][39m Trial 2571 finished with value: 0.8727272727272727 and parameters: {'objective': 'CrossEntropy', 'colsample_bylevel': 0.08819795672337465, 'depth': 10, 'boosting_type': 'Plain', 'bootstrap_type': 'Bayesian', 'bagging_temperature': 5.680781051767233}. Best is trial 1464 with value: 0.8990825688073395.
[32m[I 2023-04-20 23:51:26,626][39m Trial 2572 finished with value: 0.888888888888889 and parameters: {'objective': 'Logloss', 'colsample_bylevel': 0.09845790965903531, 'depth': 8, 'boosting_type': 'Plain', 'bootstrap_type': 'Bayesian', 'bagging_temperature': 5.4736785219601405}. Best is trial 1464 with value: 0.8990825688073395.
[32m[I 2023-04-20 23:51:27,233][39m Trial 2573 finished with value: 0.8703703703703703 and parameters: {'objective': 'CrossEntropy', 'colsample_bylevel': 0.09107845532001466, 'depth': 10, 'boosting_type': 'Plain', 'bootstrap_type': 'Bayesian', 'bagging_temperature': 4.356423748016274}. Best is trial 1464 with value: 0.8990825688073395.
[32m[I 2023-04-20 23:51:28,689][39m Trial 2574 finished with value: 0.8807339449541284 and parameters: {'objective': 'Logloss', 'colsample_bylevel': 0.09741199846249203, 'depth': 9, 'boosting_type': 'Plain', 'bootstrap_type': 'Bayesian', 'bagging_temperature': 7.104821153868313}. Best is trial 1464 with value: 0.8990825688073395.
[32m[I 2023-04-20 23:51:29,897][39m Trial 2575 finished with value: 0.8828828828828829 and parameters: {'objective': 'CrossEntropy', 'colsample_bylevel': 0.09876043756239797, 'depth': 9, 'boosting_type': 'Plain', 'bootstrap_type': 'Bayesian', 'bagging_temperature': 5.100146315854843}. Best is trial 1464 with value: 0.8990825688073395.
[32m[I 2023-04-20 23:51:30,889][39m Trial 2576 finished with value: 0.8807339449541284 and parameters: {'objective': 'CrossEntropy', 'colsample_bylevel': 0.09523542202218116, 'depth': 8, 'boosting_type': 'Plain', 'bootstrap_type': 'Bayesian', 'bagging_temperature': 4.011295203007146}. Best is trial 1464 with value: 0.8990825688073395.
[32m[I 2023-04-20 23:51:32,094][39m Trial 2577 finished with value: 0.8807339449541284 and parameters: {'objective': 'Logloss', 'colsample_bylevel': 0.09193182359732407, 'depth': 9, 'boosting_type': 'Plain', 'bootstrap_type': 'Bayesian', 'bagging_temperature': 5.211497547427168}. Best is trial 1464 with value: 0.8990825688073395.
[32m[I 2023-04-20 23:51:32,964][39m Trial 2578 finished with value: 0.8727272727272727 and parameters: {'objective': 'Logloss', 'colsample_bylevel': 0.09867551592068155, 'depth': 11, 'boosting_type': 'Plain', 'bootstrap_type': 'Bayesian', 'bagging_temperature': 5.536759161086146}. Best is trial 1464 with value: 0.8990825688073395.
[32m[I 2023-04-20 23:51:33,846][39m Trial 2579 finished with value: 0.831858407079646 and parameters: {'objective': 'CrossEntropy', 'colsample_bylevel': 0.08677492847426281, 'depth': 9, 'boosting_type': 'Plain', 'bootstrap_type': 'Bayesian', 'bagging_temperature': 5.198095745148896}. Best is trial 1464 with value: 0.8990825688073395.
[32m[I 2023-04-20 23:51:35,040][39m Trial 2580 finished with value: 0.8807339449541284 and parameters: {'objective': 'Logloss', 'colsample_bylevel': 0.09386985451695556, 'depth': 11, 'boosting_type': 'Plain', 'bootstrap_type': 'Bayesian', 'bagging_temperature': 4.4067277367470465}. Best is trial 1464 with value: 0.8990825688073395.
[32m[I 2023-04-20 23:51:36,628][39m Trial 2581 finished with value: 0.8727272727272727 and parameters: {'objective': 'Logloss', 'colsample_bylevel': 0.09603434496319017, 'depth': 8, 'boosting_type': 'Plain', 'bootstrap_type': 'Bayesian', 'bagging_temperature': 3.9024677545336663}. Best is trial 1464 with value: 0.8990825688073395.
[32m[I 2023-04-20 23:51:37,625][39m Trial 2582 finished with value: 0.8648648648648648 and parameters: {'objective': 'CrossEntropy', 'colsample_bylevel': 0.09674974281410387, 'depth': 9, 'boosting_type': 'Plain', 'bootstrap_type': 'Bayesian', 'bagging_temperature': 5.269383167440277}. Best is trial 1464 with value: 0.8990825688073395.
[32m[I 2023-04-20 23:51:38,412][39m Trial 2583 finished with value: 0.8421052631578947 and parameters: {'objective': 'CrossEntropy', 'colsample_bylevel': 0.09048742944246124, 'depth': 10, 'boosting_type': 'Plain', 'bootstrap_type': 'MVS'}. Best is trial 1464 with value: 0.8990825688073395.
[32m[I 2023-04-20 23:51:39,232][39m Trial 2584 finished with value: 0.8807339449541284 and parameters: {'objective': 'Logloss', 'colsample_bylevel': 0.09530476608836405, 'depth': 10, 'boosting_type': 'Plain', 'bootstrap_type': 'Bayesian', 'bagging_temperature': 4.271348520546587}. Best is trial 1464 with value: 0.8990825688073395.
[32m[I 2023-04-20 23:51:40,559][39m Trial 2585 finished with value: 0.8807339449541284 and parameters: {'objective': 'CrossEntropy', 'colsample_bylevel': 0.09831092567800652, 'depth': 9, 'boosting_type': 'Plain', 'bootstrap_type': 'Bayesian', 'bagging_temperature': 4.596050509429441}. Best is trial 1464 with value: 0.8990825688073395.
[32m[I 2023-04-20 23:51:45,540][39m Trial 2586 finished with value: 0.8421052631578947 and parameters: {'objective': 'CrossEntropy', 'colsample_bylevel': 0.08801867750892031, 'depth': 8, 'boosting_type': 'Ordered', 'bootstrap_type': 'Bayesian', 'bagging_temperature': 5.3492859105834265}. Best is trial 1464 with value: 0.8990825688073395.
[32m[I 2023-04-20 23:51:47,030][39m Trial 2587 finished with value: 0.8727272727272727 and parameters: {'objective': 'CrossEntropy', 'colsample_bylevel': 0.08745316810457346, 'depth': 9, 'boosting_type': 'Plain', 'bootstrap_type': 'Bayesian', 'bagging_temperature': 5.137550145867366}. Best is trial 1464 with value: 0.8990825688073395.
[32m[I 2023-04-20 23:51:47,674][39m Trial 2588 finished with value: 0.8672566371681416 and parameters: {'objective': 'Logloss', 'colsample_bylevel': 0.04032659504769014, 'depth': 9, 'boosting_type': 'Plain', 'bootstrap_type': 'Bayesian', 'bagging_temperature': 4.67161939230829}. Best is trial 1464 with value: 0.8990825688073395.
[32m[I 2023-04-20 23:51:48,729][39m Trial 2589 finished with value: 0.875 and parameters: {'objective': 'Logloss', 'colsample_bylevel': 0.09422457250995507, 'depth': 10, 'boosting_type': 'Plain', 'bootstrap_type': 'Bayesian', 'bagging_temperature': 7.174644974047797}. Best is trial 1464 with value: 0.8990825688073395.
[32m[I 2023-04-20 23:51:50,536][39m Trial 2590 finished with value: 0.888888888888889 and parameters: {'objective': 'Logloss', 'colsample_bylevel': 0.0942854942868363, 'depth': 9, 'boosting_type': 'Plain', 'bootstrap_type': 'Bayesian', 'bagging_temperature': 6.497319031399627}. Best is trial 1464 with value: 0.8990825688073395.
[32m[I 2023-04-20 23:51:51,544][39m Trial 2591 finished with value: 0.8703703703703703 and parameters: {'objective': 'CrossEntropy', 'colsample_bylevel': 0.09682054540475071, 'depth': 8, 'boosting_type': 'Plain', 'bootstrap_type': 'Bayesian', 'bagging_temperature': 2.8194409877625115}. Best is trial 1464 with value: 0.8990825688073395.
[32m[I 2023-04-20 23:51:52,454][39m Trial 2592 finished with value: 0.8785046728971961 and parameters: {'objective': 'CrossEntropy', 'colsample_bylevel': 0.0955147069508328, 'depth': 6, 'boosting_type': 'Plain', 'bootstrap_type': 'Bayesian', 'bagging_temperature': 6.785311082983857}. Best is trial 1464 with value: 0.8990825688073395.
[32m[I 2023-04-20 23:51:53,277][39m Trial 2593 finished with value: 0.8807339449541284 and parameters: {'objective': 'Logloss', 'colsample_bylevel': 0.09992705490290743, 'depth': 8, 'boosting_type': 'Plain', 'bootstrap_type': 'Bayesian', 'bagging_temperature': 5.873520254856454}. Best is trial 1464 with value: 0.8990825688073395.
[32m[I 2023-04-20 23:51:54,328][39m Trial 2594 finished with value: 0.8807339449541284 and parameters: {'objective': 'CrossEntropy', 'colsample_bylevel': 0.08951888657360235, 'depth': 9, 'boosting_type': 'Plain', 'bootstrap_type': 'Bayesian', 'bagging_temperature': 5.005846201731499}. Best is trial 1464 with value: 0.8990825688073395.
[32m[I 2023-04-20 23:51:55,375][39m Trial 2595 finished with value: 0.8727272727272727 and parameters: {'objective': 'Logloss', 'colsample_bylevel': 0.09383168008438662, 'depth': 10, 'boosting_type': 'Plain', 'bootstrap_type': 'Bayesian', 'bagging_temperature': 4.2285200027948715}. Best is trial 1464 with value: 0.8990825688073395.
[32m[I 2023-04-20 23:51:55,972][39m Trial 2596 finished with value: 0.8703703703703703 and parameters: {'objective': 'CrossEntropy', 'colsample_bylevel': 0.09068067700098814, 'depth': 10, 'boosting_type': 'Plain', 'bootstrap_type': 'Bayesian', 'bagging_temperature': 4.281952425763752}. Best is trial 1464 with value: 0.8990825688073395.
[32m[I 2023-04-20 23:51:56,962][39m Trial 2597 finished with value: 0.8785046728971961 and parameters: {'objective': 'CrossEntropy', 'colsample_bylevel': 0.08467027609229927, 'depth': 12, 'boosting_type': 'Plain', 'bootstrap_type': 'Bayesian', 'bagging_temperature': 6.510513172824126}. Best is trial 1464 with value: 0.8990825688073395.
[32m[I 2023-04-20 23:51:58,008][39m Trial 2598 finished with value: 0.8807339449541284 and parameters: {'objective': 'Logloss', 'colsample_bylevel': 0.08683988753307208, 'depth': 10, 'boosting_type': 'Plain', 'bootstrap_type': 'Bayesian', 'bagging_temperature': 4.934179153629346}. Best is trial 1464 with value: 0.8990825688073395.
[32m[I 2023-04-20 23:51:59,118][39m Trial 2599 finished with value: 0.8807339449541284 and parameters: {'objective': 'CrossEntropy', 'colsample_bylevel': 0.0886003748774699, 'depth': 10, 'boosting_type': 'Plain', 'bootstrap_type': 'Bayesian', 'bagging_temperature': 4.749739454825018}. Best is trial 1464 with value: 0.8990825688073395.
[32m[I 2023-04-20 23:52:00,174][39m Trial 2600 finished with value: 0.8785046728971961 and parameters: {'objective': 'Logloss', 'colsample_bylevel': 0.09048102499631298, 'depth': 10, 'boosting_type': 'Plain', 'bootstrap_type': 'Bayesian', 'bagging_temperature': 5.385820658544738}. Best is trial 1464 with value: 0.8990825688073395.
[32m[I 2023-04-20 23:52:01,303][39m Trial 2601 finished with value: 0.8807339449541284 and parameters: {'objective': 'Logloss', 'colsample_bylevel': 0.09684633873693306, 'depth': 6, 'boosting_type': 'Plain', 'bootstrap_type': 'Bayesian', 'bagging_temperature': 5.5424404289303935}. Best is trial 1464 with value: 0.8990825688073395.
[32m[I 2023-04-20 23:52:02,541][39m Trial 2602 finished with value: 0.8727272727272727 and parameters: {'objective': 'CrossEntropy', 'colsample_bylevel': 0.08914690845310386, 'depth': 9, 'boosting_type': 'Plain', 'bootstrap_type': 'Bayesian', 'bagging_temperature': 5.607994670964109}. Best is trial 1464 with value: 0.8990825688073395.
[32m[I 2023-04-20 23:52:03,496][39m Trial 2603 finished with value: 0.8275862068965517 and parameters: {'objective': 'Logloss', 'colsample_bylevel': 0.09538598577662513, 'depth': 3, 'boosting_type': 'Plain', 'bootstrap_type': 'Bayesian', 'bagging_temperature': 6.2027860902062075}. Best is trial 1464 with value: 0.8990825688073395.
[32m[I 2023-04-20 23:52:07,299][39m Trial 2604 finished with value: 0.8571428571428572 and parameters: {'objective': 'CrossEntropy', 'colsample_bylevel': 0.08943530998386003, 'depth': 10, 'boosting_type': 'Ordered', 'bootstrap_type': 'MVS'}. Best is trial 1464 with value: 0.8990825688073395.
[32m[I 2023-04-20 23:52:08,410][39m Trial 2605 finished with value: 0.8727272727272727 and parameters: {'objective': 'CrossEntropy', 'colsample_bylevel': 0.0901409890048247, 'depth': 10, 'boosting_type': 'Plain', 'bootstrap_type': 'Bayesian', 'bagging_temperature': 7.889976614322403}. Best is trial 1464 with value: 0.8990825688073395.
[32m[I 2023-04-20 23:52:09,996][39m Trial 2606 finished with value: 0.8727272727272727 and parameters: {'objective': 'Logloss', 'colsample_bylevel': 0.09225910329459992, 'depth': 9, 'boosting_type': 'Plain', 'bootstrap_type': 'Bayesian', 'bagging_temperature': 6.767161456987167}. Best is trial 1464 with value: 0.8990825688073395.
[32m[I 2023-04-20 23:52:10,838][39m Trial 2607 finished with value: 0.8275862068965517 and parameters: {'objective': 'Logloss', 'colsample_bylevel': 0.06253232733796481, 'depth': 9, 'boosting_type': 'Plain', 'bootstrap_type': 'Bayesian', 'bagging_temperature': 1.9823032618724374}. Best is trial 1464 with value: 0.8990825688073395.
[32m[I 2023-04-20 23:52:11,944][39m Trial 2608 finished with value: 0.8807339449541284 and parameters: {'objective': 'CrossEntropy', 'colsample_bylevel': 0.0911714368462639, 'depth': 11, 'boosting_type': 'Plain', 'bootstrap_type': 'Bayesian', 'bagging_temperature': 4.882850815205672}. Best is trial 1464 with value: 0.8990825688073395.
[32m[I 2023-04-20 23:52:12,790][39m Trial 2609 finished with value: 0.8807339449541284 and parameters: {'objective': 'CrossEntropy', 'colsample_bylevel': 0.08919333466866912, 'depth': 11, 'boosting_type': 'Plain', 'bootstrap_type': 'Bayesian', 'bagging_temperature': 5.500017078431665}. Best is trial 1464 with value: 0.8990825688073395.
[32m[I 2023-04-20 23:52:13,638][39m Trial 2610 finished with value: 0.8392857142857144 and parameters: {'objective': 'CrossEntropy', 'colsample_bylevel': 0.07652866225781087, 'depth': 10, 'boosting_type': 'Plain', 'bootstrap_type': 'Bayesian', 'bagging_temperature': 4.108244586987526}. Best is trial 1464 with value: 0.8990825688073395.
[32m[I 2023-04-20 23:52:14,671][39m Trial 2611 finished with value: 0.8727272727272727 and parameters: {'objective': 'Logloss', 'colsample_bylevel': 0.09265253982236517, 'depth': 10, 'boosting_type': 'Plain', 'bootstrap_type': 'Bayesian', 'bagging_temperature': 6.133861399848151}. Best is trial 1464 with value: 0.8990825688073395.
[32m[I 2023-04-20 23:52:16,425][39m Trial 2612 finished with value: 0.888888888888889 and parameters: {'objective': 'Logloss', 'colsample_bylevel': 0.09402927213705149, 'depth': 8, 'boosting_type': 'Plain', 'bootstrap_type': 'Bayesian', 'bagging_temperature': 6.910473228526003}. Best is trial 1464 with value: 0.8990825688073395.
[32m[I 2023-04-20 23:52:17,315][39m Trial 2613 finished with value: 0.8727272727272727 and parameters: {'objective': 'Logloss', 'colsample_bylevel': 0.0996885990468209, 'depth': 8, 'boosting_type': 'Plain', 'bootstrap_type': 'Bayesian', 'bagging_temperature': 7.124030160799229}. Best is trial 1464 with value: 0.8990825688073395.
[32m[I 2023-04-20 23:52:18,426][39m Trial 2614 finished with value: 0.8727272727272727 and parameters: {'objective': 'Logloss', 'colsample_bylevel': 0.09519201540906502, 'depth': 10, 'boosting_type': 'Plain', 'bootstrap_type': 'Bayesian', 'bagging_temperature': 4.336213705764582}. Best is trial 1464 with value: 0.8990825688073395.
[32m[I 2023-04-20 23:52:19,659][39m Trial 2615 finished with value: 0.8623853211009175 and parameters: {'objective': 'CrossEntropy', 'colsample_bylevel': 0.09254763509543734, 'depth': 9, 'boosting_type': 'Plain', 'bootstrap_type': 'Bayesian', 'bagging_temperature': 5.293141885381072}. Best is trial 1464 with value: 0.8990825688073395.
[32m[I 2023-04-20 23:52:20,604][39m Trial 2616 finished with value: 0.8727272727272727 and parameters: {'objective': 'Logloss', 'colsample_bylevel': 0.09403575798128902, 'depth': 9, 'boosting_type': 'Plain', 'bootstrap_type': 'Bayesian', 'bagging_temperature': 4.674302964400191}. Best is trial 1464 with value: 0.8990825688073395.
[32m[I 2023-04-20 23:52:21,623][39m Trial 2617 finished with value: 0.8807339449541284 and parameters: {'objective': 'CrossEntropy', 'colsample_bylevel': 0.09495563249373476, 'depth': 8, 'boosting_type': 'Plain', 'bootstrap_type': 'Bayesian', 'bagging_temperature': 6.606979875184567}. Best is trial 1464 with value: 0.8990825688073395.
[32m[I 2023-04-20 23:52:23,143][39m Trial 2618 finished with value: 0.8727272727272727 and parameters: {'objective': 'Logloss', 'colsample_bylevel': 0.09700877088162758, 'depth': 8, 'boosting_type': 'Plain', 'bootstrap_type': 'Bayesian', 'bagging_temperature': 6.522890662838235}. Best is trial 1464 with value: 0.8990825688073395.
[32m[I 2023-04-20 23:52:23,939][39m Trial 2619 finished with value: 0.8727272727272727 and parameters: {'objective': 'Logloss', 'colsample_bylevel': 0.09221836655690199, 'depth': 11, 'boosting_type': 'Plain', 'bootstrap_type': 'Bayesian', 'bagging_temperature': 4.946391630200443}. Best is trial 1464 with value: 0.8990825688073395.
[32m[I 2023-04-20 23:52:24,865][39m Trial 2620 finished with value: 0.8648648648648648 and parameters: {'objective': 'Logloss', 'colsample_bylevel': 0.09732752859811782, 'depth': 8, 'boosting_type': 'Plain', 'bootstrap_type': 'Bayesian', 'bagging_temperature': 4.958029511651333}. Best is trial 1464 with value: 0.8990825688073395.
[32m[I 2023-04-20 23:52:26,539][39m Trial 2621 finished with value: 0.8495575221238938 and parameters: {'objective': 'Logloss', 'colsample_bylevel': 0.09335454619165721, 'depth': 9, 'boosting_type': 'Plain', 'bootstrap_type': 'Bayesian', 'bagging_temperature': 4.866333694691475}. Best is trial 1464 with value: 0.8990825688073395.
[32m[I 2023-04-20 23:52:27,379][39m Trial 2622 finished with value: 0.8727272727272727 and parameters: {'objective': 'CrossEntropy', 'colsample_bylevel': 0.0968886095087862, 'depth': 9, 'boosting_type': 'Plain', 'bootstrap_type': 'Bayesian', 'bagging_temperature': 5.214077959917606}. Best is trial 1464 with value: 0.8990825688073395.
[32m[I 2023-04-20 23:52:32,449][39m Trial 2623 finished with value: 0.8468468468468469 and parameters: {'objective': 'CrossEntropy', 'colsample_bylevel': 0.09836390555005986, 'depth': 8, 'boosting_type': 'Ordered', 'bootstrap_type': 'Bayesian', 'bagging_temperature': 4.703544124388621}. Best is trial 1464 with value: 0.8990825688073395.
[32m[I 2023-04-20 23:52:33,505][39m Trial 2624 finished with value: 0.8571428571428572 and parameters: {'objective': 'Logloss', 'colsample_bylevel': 0.09639592373127395, 'depth': 7, 'boosting_type': 'Plain', 'bootstrap_type': 'MVS'}. Best is trial 1464 with value: 0.8990825688073395.
[32m[I 2023-04-20 23:52:35,375][39m Trial 2625 finished with value: 0.8648648648648648 and parameters: {'objective': 'CrossEntropy', 'colsample_bylevel': 0.09454470913097904, 'depth': 9, 'boosting_type': 'Plain', 'bootstrap_type': 'Bayesian', 'bagging_temperature': 4.67958562783129}. Best is trial 1464 with value: 0.8990825688073395.
[32m[I 2023-04-20 23:52:36,357][39m Trial 2626 finished with value: 0.8623853211009175 and parameters: {'objective': 'CrossEntropy', 'colsample_bylevel': 0.09843558781477224, 'depth': 8, 'boosting_type': 'Plain', 'bootstrap_type': 'Bayesian', 'bagging_temperature': 5.408293172492936}. Best is trial 1464 with value: 0.8990825688073395.
[32m[I 2023-04-20 23:52:37,399][39m Trial 2627 finished with value: 0.8807339449541284 and parameters: {'objective': 'Logloss', 'colsample_bylevel': 0.09279288356622753, 'depth': 10, 'boosting_type': 'Plain', 'bootstrap_type': 'Bayesian', 'bagging_temperature': 5.665494153999729}. Best is trial 1464 with value: 0.8990825688073395.
[32m[I 2023-04-20 23:52:38,087][39m Trial 2628 finished with value: 0.8828828828828829 and parameters: {'objective': 'Logloss', 'colsample_bylevel': 0.09825828199982478, 'depth': 7, 'boosting_type': 'Plain', 'bootstrap_type': 'Bayesian', 'bagging_temperature': 7.0207330919421205}. Best is trial 1464 with value: 0.8990825688073395.
[32m[I 2023-04-20 23:52:38,791][39m Trial 2629 finished with value: 0.8571428571428572 and parameters: {'objective': 'Logloss', 'colsample_bylevel': 0.09997812098765646, 'depth': 7, 'boosting_type': 'Plain', 'bootstrap_type': 'Bernoulli', 'subsample': 0.33417861173446695}. Best is trial 1464 with value: 0.8990825688073395.
[32m[I 2023-04-20 23:52:40,507][39m Trial 2630 finished with value: 0.8807339449541284 and parameters: {'objective': 'Logloss', 'colsample_bylevel': 0.09504844607940845, 'depth': 9, 'boosting_type': 'Plain', 'bootstrap_type': 'Bayesian', 'bagging_temperature': 4.557543390000176}. Best is trial 1464 with value: 0.8990825688073395.
[32m[I 2023-04-20 23:52:41,537][39m Trial 2631 finished with value: 0.8807339449541284 and parameters: {'objective': 'CrossEntropy', 'colsample_bylevel': 0.08145139117071235, 'depth': 10, 'boosting_type': 'Plain', 'bootstrap_type': 'Bayesian', 'bagging_temperature': 4.740476871359639}. Best is trial 1464 with value: 0.8990825688073395.
[32m[I 2023-04-20 23:52:42,605][39m Trial 2632 finished with value: 0.8807339449541284 and parameters: {'objective': 'CrossEntropy', 'colsample_bylevel': 0.08588032733831662, 'depth': 9, 'boosting_type': 'Plain', 'bootstrap_type': 'Bayesian', 'bagging_temperature': 6.069269040934491}. Best is trial 1464 with value: 0.8990825688073395.
[32m[I 2023-04-20 23:52:44,001][39m Trial 2633 finished with value: 0.8807339449541284 and parameters: {'objective': 'CrossEntropy', 'colsample_bylevel': 0.09576585989790261, 'depth': 9, 'boosting_type': 'Plain', 'bootstrap_type': 'Bayesian', 'bagging_temperature': 6.356355341126814}. Best is trial 1464 with value: 0.8990825688073395.
