[32m[I 2023-04-21 00:50:44,134][39m Trial 5199 finished with value: 0.8807339449541284 and parameters: {'objective': 'Logloss', 'colsample_bylevel': 0.09841069325281313, 'depth': 7, 'boosting_type': 'Plain', 'bootstrap_type': 'Bayesian', 'bagging_temperature': 3.3294182498745046}. Best is trial 1464 with value: 0.8990825688073395.
[32m[I 2023-04-21 00:50:45,483][39m Trial 5200 finished with value: 0.8807339449541284 and parameters: {'objective': 'Logloss', 'colsample_bylevel': 0.09451109622775031, 'depth': 9, 'boosting_type': 'Plain', 'bootstrap_type': 'Bayesian', 'bagging_temperature': 3.717001309546381}. Best is trial 1464 with value: 0.8990825688073395.
[32m[I 2023-04-21 00:50:46,831][39m Trial 5201 finished with value: 0.8807339449541284 and parameters: {'objective': 'Logloss', 'colsample_bylevel': 0.09024294685360396, 'depth': 12, 'boosting_type': 'Plain', 'bootstrap_type': 'Bayesian', 'bagging_temperature': 5.354047973304414}. Best is trial 1464 with value: 0.8990825688073395.
[32m[I 2023-04-21 00:50:48,246][39m Trial 5202 finished with value: 0.8648648648648648 and parameters: {'objective': 'Logloss', 'colsample_bylevel': 0.09205152917983, 'depth': 8, 'boosting_type': 'Plain', 'bootstrap_type': 'Bayesian', 'bagging_temperature': 5.592997021520621}. Best is trial 1464 with value: 0.8990825688073395.
[32m[I 2023-04-21 00:50:49,577][39m Trial 5203 finished with value: 0.8703703703703703 and parameters: {'objective': 'CrossEntropy', 'colsample_bylevel': 0.09113112841405425, 'depth': 9, 'boosting_type': 'Plain', 'bootstrap_type': 'Bayesian', 'bagging_temperature': 5.118777708878065}. Best is trial 1464 with value: 0.8990825688073395.
[32m[I 2023-04-21 00:50:50,302][39m Trial 5204 finished with value: 0.8807339449541284 and parameters: {'objective': 'CrossEntropy', 'colsample_bylevel': 0.09652135826187869, 'depth': 6, 'boosting_type': 'Plain', 'bootstrap_type': 'Bayesian', 'bagging_temperature': 5.9508036777035}. Best is trial 1464 with value: 0.8990825688073395.
[32m[I 2023-04-21 00:50:51,718][39m Trial 5205 finished with value: 0.8807339449541284 and parameters: {'objective': 'Logloss', 'colsample_bylevel': 0.08844987587888034, 'depth': 12, 'boosting_type': 'Plain', 'bootstrap_type': 'Bayesian', 'bagging_temperature': 5.047594954934726}. Best is trial 1464 with value: 0.8990825688073395.
[32m[I 2023-04-21 00:50:52,937][39m Trial 5206 finished with value: 0.8828828828828829 and parameters: {'objective': 'CrossEntropy', 'colsample_bylevel': 0.08580247553999237, 'depth': 12, 'boosting_type': 'Plain', 'bootstrap_type': 'Bayesian', 'bagging_temperature': 5.1782234807006695}. Best is trial 1464 with value: 0.8990825688073395.
[32m[I 2023-04-21 00:50:53,967][39m Trial 5207 finished with value: 0.8727272727272727 and parameters: {'objective': 'Logloss', 'colsample_bylevel': 0.09140505548318277, 'depth': 10, 'boosting_type': 'Plain', 'bootstrap_type': 'Bayesian', 'bagging_temperature': 7.230741516208942}. Best is trial 1464 with value: 0.8990825688073395.
[32m[I 2023-04-21 00:50:55,044][39m Trial 5208 finished with value: 0.8785046728971961 and parameters: {'objective': 'CrossEntropy', 'colsample_bylevel': 0.08503459321717576, 'depth': 12, 'boosting_type': 'Plain', 'bootstrap_type': 'Bayesian', 'bagging_temperature': 5.020141862969211}. Best is trial 1464 with value: 0.8990825688073395.
[32m[I 2023-04-21 00:50:56,012][39m Trial 5209 finished with value: 0.8648648648648648 and parameters: {'objective': 'CrossEntropy', 'colsample_bylevel': 0.052318272043159746, 'depth': 10, 'boosting_type': 'Plain', 'bootstrap_type': 'Bayesian', 'bagging_temperature': 5.725217608040151}. Best is trial 1464 with value: 0.8990825688073395.
[32m[I 2023-04-21 00:50:57,350][39m Trial 5210 finished with value: 0.8727272727272727 and parameters: {'objective': 'Logloss', 'colsample_bylevel': 0.09594837201657475, 'depth': 9, 'boosting_type': 'Plain', 'bootstrap_type': 'Bayesian', 'bagging_temperature': 4.238767948135128}. Best is trial 1464 with value: 0.8990825688073395.
[32m[I 2023-04-21 00:50:58,628][39m Trial 5211 finished with value: 0.8807339449541284 and parameters: {'objective': 'Logloss', 'colsample_bylevel': 0.09413448555304167, 'depth': 10, 'boosting_type': 'Plain', 'bootstrap_type': 'Bayesian', 'bagging_temperature': 6.430723344944891}. Best is trial 1464 with value: 0.8990825688073395.
[32m[I 2023-04-21 00:50:59,498][39m Trial 5212 finished with value: 0.8648648648648648 and parameters: {'objective': 'CrossEntropy', 'colsample_bylevel': 0.0911497614910484, 'depth': 12, 'boosting_type': 'Plain', 'bootstrap_type': 'Bayesian', 'bagging_temperature': 1.4808326429453662}. Best is trial 1464 with value: 0.8990825688073395.
[32m[I 2023-04-21 00:51:01,056][39m Trial 5213 finished with value: 0.888888888888889 and parameters: {'objective': 'CrossEntropy', 'colsample_bylevel': 0.08999999306830289, 'depth': 9, 'boosting_type': 'Plain', 'bootstrap_type': 'Bayesian', 'bagging_temperature': 4.954600516674395}. Best is trial 1464 with value: 0.8990825688073395.
[32m[I 2023-04-21 00:51:01,999][39m Trial 5214 finished with value: 0.8807339449541284 and parameters: {'objective': 'Logloss', 'colsample_bylevel': 0.09496825308919707, 'depth': 7, 'boosting_type': 'Plain', 'bootstrap_type': 'Bayesian', 'bagging_temperature': 3.676949125022264}. Best is trial 1464 with value: 0.8990825688073395.
[32m[I 2023-04-21 00:51:02,936][39m Trial 5215 finished with value: 0.8571428571428572 and parameters: {'objective': 'Logloss', 'colsample_bylevel': 0.09037973637903882, 'depth': 8, 'boosting_type': 'Plain', 'bootstrap_type': 'Bernoulli', 'subsample': 0.7662400279825841}. Best is trial 1464 with value: 0.8990825688073395.
[32m[I 2023-04-21 00:51:07,936][39m Trial 5216 finished with value: 0.8347826086956522 and parameters: {'objective': 'Logloss', 'colsample_bylevel': 0.09875784670464054, 'depth': 7, 'boosting_type': 'Ordered', 'bootstrap_type': 'Bayesian', 'bagging_temperature': 4.258743217713301}. Best is trial 1464 with value: 0.8990825688073395.
[32m[I 2023-04-21 00:51:09,330][39m Trial 5217 finished with value: 0.8807339449541284 and parameters: {'objective': 'Logloss', 'colsample_bylevel': 0.09496763095432488, 'depth': 9, 'boosting_type': 'Plain', 'bootstrap_type': 'Bayesian', 'bagging_temperature': 7.461187291976419}. Best is trial 1464 with value: 0.8990825688073395.
[32m[I 2023-04-21 00:51:10,567][39m Trial 5218 finished with value: 0.8807339449541284 and parameters: {'objective': 'Logloss', 'colsample_bylevel': 0.09597835917670847, 'depth': 10, 'boosting_type': 'Plain', 'bootstrap_type': 'Bayesian', 'bagging_temperature': 4.052943005811397}. Best is trial 1464 with value: 0.8990825688073395.
[32m[I 2023-04-21 00:51:11,649][39m Trial 5219 finished with value: 0.888888888888889 and parameters: {'objective': 'Logloss', 'colsample_bylevel': 0.09401423264874134, 'depth': 7, 'boosting_type': 'Plain', 'bootstrap_type': 'Bayesian', 'bagging_temperature': 5.78024925457914}. Best is trial 1464 with value: 0.8990825688073395.
[32m[I 2023-04-21 00:51:12,585][39m Trial 5220 finished with value: 0.8347826086956522 and parameters: {'objective': 'Logloss', 'colsample_bylevel': 0.047883457951565976, 'depth': 9, 'boosting_type': 'Plain', 'bootstrap_type': 'MVS'}. Best is trial 1464 with value: 0.8990825688073395.
[32m[I 2023-04-21 00:51:14,320][39m Trial 5221 finished with value: 0.8623853211009175 and parameters: {'objective': 'Logloss', 'colsample_bylevel': 0.08654489975537569, 'depth': 12, 'boosting_type': 'Plain', 'bootstrap_type': 'Bayesian', 'bagging_temperature': 5.024295007554571}. Best is trial 1464 with value: 0.8990825688073395.
[32m[I 2023-04-21 00:51:15,529][39m Trial 5222 finished with value: 0.8648648648648648 and parameters: {'objective': 'Logloss', 'colsample_bylevel': 0.08743209249878757, 'depth': 12, 'boosting_type': 'Plain', 'bootstrap_type': 'Bayesian', 'bagging_temperature': 5.27608089271635}. Best is trial 1464 with value: 0.8990825688073395.
[32m[I 2023-04-21 00:51:16,423][39m Trial 5223 finished with value: 0.8807339449541284 and parameters: {'objective': 'Logloss', 'colsample_bylevel': 0.09337591245623214, 'depth': 12, 'boosting_type': 'Plain', 'bootstrap_type': 'Bayesian', 'bagging_temperature': 3.201319127015391}. Best is trial 1464 with value: 0.8990825688073395.
[32m[I 2023-04-21 00:51:18,204][39m Trial 5224 finished with value: 0.8727272727272727 and parameters: {'objective': 'Logloss', 'colsample_bylevel': 0.09676151395552471, 'depth': 8, 'boosting_type': 'Plain', 'bootstrap_type': 'Bayesian', 'bagging_temperature': 5.907764384448653}. Best is trial 1464 with value: 0.8990825688073395.
[32m[I 2023-04-21 00:51:19,055][39m Trial 5225 finished with value: 0.8807339449541284 and parameters: {'objective': 'Logloss', 'colsample_bylevel': 0.09738668397667974, 'depth': 8, 'boosting_type': 'Plain', 'bootstrap_type': 'Bayesian', 'bagging_temperature': 6.087012694558323}. Best is trial 1464 with value: 0.8990825688073395.
[32m[I 2023-04-21 00:51:19,905][39m Trial 5226 finished with value: 0.8205128205128206 and parameters: {'objective': 'Logloss', 'colsample_bylevel': 0.028306449902970994, 'depth': 9, 'boosting_type': 'Plain', 'bootstrap_type': 'Bayesian', 'bagging_temperature': 5.434340630910209}. Best is trial 1464 with value: 0.8990825688073395.
[32m[I 2023-04-21 00:51:21,726][39m Trial 5227 finished with value: 0.8623853211009175 and parameters: {'objective': 'CrossEntropy', 'colsample_bylevel': 0.08620627338759664, 'depth': 9, 'boosting_type': 'Plain', 'bootstrap_type': 'Bayesian', 'bagging_temperature': 4.801351650704402}. Best is trial 1464 with value: 0.8990825688073395.
[32m[I 2023-04-21 00:51:22,521][39m Trial 5228 finished with value: 0.8421052631578947 and parameters: {'objective': 'CrossEntropy', 'colsample_bylevel': 0.08340777442421794, 'depth': 12, 'boosting_type': 'Plain', 'bootstrap_type': 'Bayesian', 'bagging_temperature': 0.47552553178798895}. Best is trial 1464 with value: 0.8990825688073395.
[32m[I 2023-04-21 00:51:23,253][39m Trial 5229 finished with value: 0.8648648648648648 and parameters: {'objective': 'CrossEntropy', 'colsample_bylevel': 0.08943874586399414, 'depth': 11, 'boosting_type': 'Plain', 'bootstrap_type': 'Bayesian', 'bagging_temperature': 6.431770641467237}. Best is trial 1464 with value: 0.8990825688073395.
[32m[I 2023-04-21 00:51:24,592][39m Trial 5230 finished with value: 0.8828828828828829 and parameters: {'objective': 'Logloss', 'colsample_bylevel': 0.09719546972397364, 'depth': 7, 'boosting_type': 'Plain', 'bootstrap_type': 'Bayesian', 'bagging_temperature': 5.586973250879638}. Best is trial 1464 with value: 0.8990825688073395.
[32m[I 2023-04-21 00:51:25,639][39m Trial 5231 finished with value: 0.8807339449541284 and parameters: {'objective': 'Logloss', 'colsample_bylevel': 0.09590506172696474, 'depth': 12, 'boosting_type': 'Plain', 'bootstrap_type': 'Bayesian', 'bagging_temperature': 3.4481663464735095}. Best is trial 1464 with value: 0.8990825688073395.
[32m[I 2023-04-21 00:51:26,570][39m Trial 5232 finished with value: 0.890909090909091 and parameters: {'objective': 'Logloss', 'colsample_bylevel': 0.08908031276091884, 'depth': 11, 'boosting_type': 'Plain', 'bootstrap_type': 'Bayesian', 'bagging_temperature': 4.873867229095734}. Best is trial 1464 with value: 0.8990825688073395.
[32m[I 2023-04-21 00:51:27,664][39m Trial 5233 finished with value: 0.8807339449541284 and parameters: {'objective': 'Logloss', 'colsample_bylevel': 0.08952007392163934, 'depth': 12, 'boosting_type': 'Plain', 'bootstrap_type': 'Bayesian', 'bagging_temperature': 3.685738561199151}. Best is trial 1464 with value: 0.8990825688073395.
[32m[I 2023-04-21 00:51:29,013][39m Trial 5234 finished with value: 0.875 and parameters: {'objective': 'CrossEntropy', 'colsample_bylevel': 0.08262916975323883, 'depth': 11, 'boosting_type': 'Plain', 'bootstrap_type': 'Bayesian', 'bagging_temperature': 4.990481649114189}. Best is trial 1464 with value: 0.8990825688073395.
[32m[I 2023-04-21 00:51:30,720][39m Trial 5235 finished with value: 0.8727272727272727 and parameters: {'objective': 'Logloss', 'colsample_bylevel': 0.09176418245360632, 'depth': 9, 'boosting_type': 'Plain', 'bootstrap_type': 'Bayesian', 'bagging_temperature': 2.6200098282520776}. Best is trial 1464 with value: 0.8990825688073395.
[32m[I 2023-04-21 00:51:35,420][39m Trial 5236 finished with value: 0.8571428571428572 and parameters: {'objective': 'CrossEntropy', 'colsample_bylevel': 0.08638733077044876, 'depth': 8, 'boosting_type': 'Ordered', 'bootstrap_type': 'Bayesian', 'bagging_temperature': 5.1910743678565945}. Best is trial 1464 with value: 0.8990825688073395.
[32m[I 2023-04-21 00:51:37,183][39m Trial 5237 finished with value: 0.8727272727272727 and parameters: {'objective': 'Logloss', 'colsample_bylevel': 0.09502939866488064, 'depth': 9, 'boosting_type': 'Plain', 'bootstrap_type': 'Bayesian', 'bagging_temperature': 3.4072107610938347}. Best is trial 1464 with value: 0.8990825688073395.
[32m[I 2023-04-21 00:51:38,428][39m Trial 5238 finished with value: 0.8807339449541284 and parameters: {'objective': 'Logloss', 'colsample_bylevel': 0.09299434432174954, 'depth': 6, 'boosting_type': 'Plain', 'bootstrap_type': 'Bayesian', 'bagging_temperature': 5.555544697463478}. Best is trial 1464 with value: 0.8990825688073395.
[32m[I 2023-04-21 00:51:39,341][39m Trial 5239 finished with value: 0.8495575221238938 and parameters: {'objective': 'CrossEntropy', 'colsample_bylevel': 0.09192656118014361, 'depth': 11, 'boosting_type': 'Plain', 'bootstrap_type': 'Bernoulli', 'subsample': 0.9000624680944289}. Best is trial 1464 with value: 0.8990825688073395.
[32m[I 2023-04-21 00:51:40,307][39m Trial 5240 finished with value: 0.7899159663865546 and parameters: {'objective': 'Logloss', 'colsample_bylevel': 0.018470497673380465, 'depth': 9, 'boosting_type': 'Plain', 'bootstrap_type': 'Bayesian', 'bagging_temperature': 4.578197672221372}. Best is trial 1464 with value: 0.8990825688073395.
[32m[I 2023-04-21 00:51:41,037][39m Trial 5241 finished with value: 0.8727272727272727 and parameters: {'objective': 'CrossEntropy', 'colsample_bylevel': 0.08664278204817902, 'depth': 12, 'boosting_type': 'Plain', 'bootstrap_type': 'Bayesian', 'bagging_temperature': 6.398494984254563}. Best is trial 1464 with value: 0.8990825688073395.
[32m[I 2023-04-21 00:51:42,134][39m Trial 5242 finished with value: 0.8727272727272727 and parameters: {'objective': 'Logloss', 'colsample_bylevel': 0.09221932296576106, 'depth': 12, 'boosting_type': 'Plain', 'bootstrap_type': 'Bayesian', 'bagging_temperature': 5.52866765349008}. Best is trial 1464 with value: 0.8990825688073395.
[32m[I 2023-04-21 00:51:43,556][39m Trial 5243 finished with value: 0.8596491228070176 and parameters: {'objective': 'Logloss', 'colsample_bylevel': 0.0912087880292747, 'depth': 12, 'boosting_type': 'Plain', 'bootstrap_type': 'MVS'}. Best is trial 1464 with value: 0.8990825688073395.
[32m[I 2023-04-21 00:51:44,624][39m Trial 5244 finished with value: 0.8623853211009175 and parameters: {'objective': 'CrossEntropy', 'colsample_bylevel': 0.08839469419059562, 'depth': 12, 'boosting_type': 'Plain', 'bootstrap_type': 'Bayesian', 'bagging_temperature': 5.824138807235699}. Best is trial 1464 with value: 0.8990825688073395.
[32m[I 2023-04-21 00:51:45,634][39m Trial 5245 finished with value: 0.8623853211009175 and parameters: {'objective': 'Logloss', 'colsample_bylevel': 0.08872098401403551, 'depth': 11, 'boosting_type': 'Plain', 'bootstrap_type': 'Bayesian', 'bagging_temperature': 5.381661083003631}. Best is trial 1464 with value: 0.8990825688073395.
[32m[I 2023-04-21 00:51:46,552][39m Trial 5246 finished with value: 0.8703703703703703 and parameters: {'objective': 'Logloss', 'colsample_bylevel': 0.0897407574138051, 'depth': 11, 'boosting_type': 'Plain', 'bootstrap_type': 'Bayesian', 'bagging_temperature': 5.440926004455155}. Best is trial 1464 with value: 0.8990825688073395.
[32m[I 2023-04-21 00:51:47,221][39m Trial 5247 finished with value: 0.8807339449541284 and parameters: {'objective': 'CrossEntropy', 'colsample_bylevel': 0.08979527798233618, 'depth': 12, 'boosting_type': 'Plain', 'bootstrap_type': 'Bayesian', 'bagging_temperature': 5.212722294151752}. Best is trial 1464 with value: 0.8990825688073395.
[32m[I 2023-04-21 00:51:48,111][39m Trial 5248 finished with value: 0.8205128205128206 and parameters: {'objective': 'CrossEntropy', 'colsample_bylevel': 0.013890241928608688, 'depth': 8, 'boosting_type': 'Plain', 'bootstrap_type': 'Bayesian', 'bagging_temperature': 2.625755990287105}. Best is trial 1464 with value: 0.8990825688073395.
[32m[I 2023-04-21 00:51:49,403][39m Trial 5249 finished with value: 0.8727272727272727 and parameters: {'objective': 'CrossEntropy', 'colsample_bylevel': 0.09085754622034921, 'depth': 11, 'boosting_type': 'Plain', 'bootstrap_type': 'Bayesian', 'bagging_temperature': 5.985076423946329}. Best is trial 1464 with value: 0.8990825688073395.
[32m[I 2023-04-21 00:51:51,025][39m Trial 5250 finished with value: 0.8703703703703703 and parameters: {'objective': 'Logloss', 'colsample_bylevel': 0.09648675096480341, 'depth': 8, 'boosting_type': 'Plain', 'bootstrap_type': 'Bayesian', 'bagging_temperature': 5.386941680786097}. Best is trial 1464 with value: 0.8990825688073395.
[32m[I 2023-04-21 00:51:52,020][39m Trial 5251 finished with value: 0.8727272727272727 and parameters: {'objective': 'Logloss', 'colsample_bylevel': 0.09970660041773548, 'depth': 12, 'boosting_type': 'Plain', 'bootstrap_type': 'Bayesian', 'bagging_temperature': 4.889286346846884}. Best is trial 1464 with value: 0.8990825688073395.
[32m[I 2023-04-21 00:51:53,243][39m Trial 5252 finished with value: 0.8648648648648648 and parameters: {'objective': 'CrossEntropy', 'colsample_bylevel': 0.08688134087326439, 'depth': 7, 'boosting_type': 'Plain', 'bootstrap_type': 'Bayesian', 'bagging_temperature': 3.2909110937451573}. Best is trial 1464 with value: 0.8990825688073395.
[32m[I 2023-04-21 00:51:58,217][39m Trial 5253 finished with value: 0.8648648648648648 and parameters: {'objective': 'Logloss', 'colsample_bylevel': 0.09302889609891825, 'depth': 12, 'boosting_type': 'Ordered', 'bootstrap_type': 'Bayesian', 'bagging_temperature': 8.172377609087807}. Best is trial 1464 with value: 0.8990825688073395.
[32m[I 2023-04-21 00:51:59,541][39m Trial 5254 finished with value: 0.8727272727272727 and parameters: {'objective': 'Logloss', 'colsample_bylevel': 0.09619405208768901, 'depth': 9, 'boosting_type': 'Plain', 'bootstrap_type': 'Bayesian', 'bagging_temperature': 4.580941941816709}. Best is trial 1464 with value: 0.8990825688073395.
[32m[I 2023-04-21 00:52:01,472][39m Trial 5255 finished with value: 0.8807339449541284 and parameters: {'objective': 'CrossEntropy', 'colsample_bylevel': 0.09994462807004116, 'depth': 9, 'boosting_type': 'Plain', 'bootstrap_type': 'Bayesian', 'bagging_temperature': 3.5657154969292266}. Best is trial 1464 with value: 0.8990825688073395.
[32m[I 2023-04-21 00:52:02,391][39m Trial 5256 finished with value: 0.875 and parameters: {'objective': 'CrossEntropy', 'colsample_bylevel': 0.09698893671338668, 'depth': 9, 'boosting_type': 'Plain', 'bootstrap_type': 'Bayesian', 'bagging_temperature': 4.772009427386479}. Best is trial 1464 with value: 0.8990825688073395.
[32m[I 2023-04-21 00:52:03,400][39m Trial 5257 finished with value: 0.8275862068965517 and parameters: {'objective': 'Logloss', 'colsample_bylevel': 0.06200900223434498, 'depth': 9, 'boosting_type': 'Plain', 'bootstrap_type': 'Bayesian', 'bagging_temperature': 3.3179331221550488}. Best is trial 1464 with value: 0.8990825688073395.
[32m[I 2023-04-21 00:52:04,784][39m Trial 5258 finished with value: 0.875 and parameters: {'objective': 'CrossEntropy', 'colsample_bylevel': 0.08975201160236915, 'depth': 12, 'boosting_type': 'Plain', 'bootstrap_type': 'Bayesian', 'bagging_temperature': 5.2734549728196}. Best is trial 1464 with value: 0.8990825688073395.
[32m[I 2023-04-21 00:52:05,982][39m Trial 5259 finished with value: 0.8807339449541284 and parameters: {'objective': 'Logloss', 'colsample_bylevel': 0.09166857608476962, 'depth': 10, 'boosting_type': 'Plain', 'bootstrap_type': 'Bayesian', 'bagging_temperature': 6.032942238479243}. Best is trial 1464 with value: 0.8990825688073395.
[32m[I 2023-04-21 00:52:07,024][39m Trial 5260 finished with value: 0.8828828828828829 and parameters: {'objective': 'Logloss', 'colsample_bylevel': 0.0913050540525525, 'depth': 12, 'boosting_type': 'Plain', 'bootstrap_type': 'Bayesian', 'bagging_temperature': 5.764084260761915}. Best is trial 1464 with value: 0.8990825688073395.
[32m[I 2023-04-21 00:52:08,080][39m Trial 5261 finished with value: 0.8672566371681416 and parameters: {'objective': 'Logloss', 'colsample_bylevel': 0.08320418065078794, 'depth': 12, 'boosting_type': 'Plain', 'bootstrap_type': 'Bayesian', 'bagging_temperature': 3.1494224173085525}. Best is trial 1464 with value: 0.8990825688073395.
[32m[I 2023-04-21 00:52:09,241][39m Trial 5262 finished with value: 0.8571428571428572 and parameters: {'objective': 'Logloss', 'colsample_bylevel': 0.09840772704237769, 'depth': 9, 'boosting_type': 'Plain', 'bootstrap_type': 'MVS'}. Best is trial 1464 with value: 0.8990825688073395.
[32m[I 2023-04-21 00:52:10,227][39m Trial 5263 finished with value: 0.8807339449541284 and parameters: {'objective': 'CrossEntropy', 'colsample_bylevel': 0.09976455966181692, 'depth': 12, 'boosting_type': 'Plain', 'bootstrap_type': 'Bernoulli', 'subsample': 0.15714793117441467}. Best is trial 1464 with value: 0.8990825688073395.
