[32m[I 2023-04-21 00:28:34,456][39m Trial 4216 finished with value: 0.8807339449541284 and parameters: {'objective': 'Logloss', 'colsample_bylevel': 0.09607300346426192, 'depth': 7, 'boosting_type': 'Plain', 'bootstrap_type': 'Bayesian', 'bagging_temperature': 6.274712686945978}. Best is trial 1464 with value: 0.8990825688073395.
[32m[I 2023-04-21 00:28:36,540][39m Trial 4217 finished with value: 0.8727272727272727 and parameters: {'objective': 'CrossEntropy', 'colsample_bylevel': 0.09374085361561053, 'depth': 9, 'boosting_type': 'Plain', 'bootstrap_type': 'Bayesian', 'bagging_temperature': 7.158703315863874}. Best is trial 1464 with value: 0.8990825688073395.
[32m[I 2023-04-21 00:28:37,644][39m Trial 4218 finished with value: 0.8448275862068967 and parameters: {'objective': 'Logloss', 'colsample_bylevel': 0.0318633675251017, 'depth': 6, 'boosting_type': 'Plain', 'bootstrap_type': 'Bayesian', 'bagging_temperature': 5.884234798730627}. Best is trial 1464 with value: 0.8990825688073395.
[32m[I 2023-04-21 00:28:38,386][39m Trial 4219 finished with value: 0.8828828828828829 and parameters: {'objective': 'Logloss', 'colsample_bylevel': 0.09405311846049588, 'depth': 10, 'boosting_type': 'Plain', 'bootstrap_type': 'Bayesian', 'bagging_temperature': 4.023951101276208}. Best is trial 1464 with value: 0.8990825688073395.
[32m[I 2023-04-21 00:28:39,613][39m Trial 4220 finished with value: 0.8727272727272727 and parameters: {'objective': 'Logloss', 'colsample_bylevel': 0.09229782265051051, 'depth': 11, 'boosting_type': 'Plain', 'bootstrap_type': 'Bayesian', 'bagging_temperature': 3.432793518723095}. Best is trial 1464 with value: 0.8990825688073395.
[32m[I 2023-04-21 00:28:44,772][39m Trial 4221 finished with value: 0.8672566371681416 and parameters: {'objective': 'Logloss', 'colsample_bylevel': 0.08572712467100735, 'depth': 10, 'boosting_type': 'Ordered', 'bootstrap_type': 'Bayesian', 'bagging_temperature': 6.8047370167502015}. Best is trial 1464 with value: 0.8990825688073395.
[32m[I 2023-04-21 00:28:45,949][39m Trial 4222 finished with value: 0.8727272727272727 and parameters: {'objective': 'CrossEntropy', 'colsample_bylevel': 0.09520986352025185, 'depth': 12, 'boosting_type': 'Plain', 'bootstrap_type': 'Bayesian', 'bagging_temperature': 6.15211444254953}. Best is trial 1464 with value: 0.8990825688073395.
[32m[I 2023-04-21 00:28:47,208][39m Trial 4223 finished with value: 0.8623853211009175 and parameters: {'objective': 'Logloss', 'colsample_bylevel': 0.0847449866172258, 'depth': 8, 'boosting_type': 'Plain', 'bootstrap_type': 'Bayesian', 'bagging_temperature': 5.2860540307240536}. Best is trial 1464 with value: 0.8990825688073395.
[32m[I 2023-04-21 00:28:48,096][39m Trial 4224 finished with value: 0.8727272727272727 and parameters: {'objective': 'Logloss', 'colsample_bylevel': 0.09698581952133607, 'depth': 7, 'boosting_type': 'Plain', 'bootstrap_type': 'Bayesian', 'bagging_temperature': 6.0290062792357695}. Best is trial 1464 with value: 0.8990825688073395.
[32m[I 2023-04-21 00:28:49,508][39m Trial 4225 finished with value: 0.8828828828828829 and parameters: {'objective': 'Logloss', 'colsample_bylevel': 0.0984259354839056, 'depth': 9, 'boosting_type': 'Plain', 'bootstrap_type': 'Bayesian', 'bagging_temperature': 5.269358678630544}. Best is trial 1464 with value: 0.8990825688073395.
[32m[I 2023-04-21 00:28:50,804][39m Trial 4226 finished with value: 0.8807339449541284 and parameters: {'objective': 'Logloss', 'colsample_bylevel': 0.08756348232879914, 'depth': 7, 'boosting_type': 'Plain', 'bootstrap_type': 'Bayesian', 'bagging_temperature': 5.394969600574374}. Best is trial 1464 with value: 0.8990825688073395.
[32m[I 2023-04-21 00:28:51,882][39m Trial 4227 finished with value: 0.8727272727272727 and parameters: {'objective': 'CrossEntropy', 'colsample_bylevel': 0.09991284618877726, 'depth': 7, 'boosting_type': 'Plain', 'bootstrap_type': 'Bayesian', 'bagging_temperature': 4.7209916627767}. Best is trial 1464 with value: 0.8990825688073395.
[32m[I 2023-04-21 00:28:52,858][39m Trial 4228 finished with value: 0.8807339449541284 and parameters: {'objective': 'Logloss', 'colsample_bylevel': 0.09850214626032822, 'depth': 8, 'boosting_type': 'Plain', 'bootstrap_type': 'Bayesian', 'bagging_temperature': 4.869227032538452}. Best is trial 1464 with value: 0.8990825688073395.
[32m[I 2023-04-21 00:28:54,264][39m Trial 4229 finished with value: 0.888888888888889 and parameters: {'objective': 'Logloss', 'colsample_bylevel': 0.0984457650648797, 'depth': 9, 'boosting_type': 'Plain', 'bootstrap_type': 'Bayesian', 'bagging_temperature': 4.987558191283535}. Best is trial 1464 with value: 0.8990825688073395.
[32m[I 2023-04-21 00:28:55,489][39m Trial 4230 finished with value: 0.8703703703703703 and parameters: {'objective': 'CrossEntropy', 'colsample_bylevel': 0.09770752523100175, 'depth': 12, 'boosting_type': 'Plain', 'bootstrap_type': 'Bayesian', 'bagging_temperature': 5.952730152789884}. Best is trial 1464 with value: 0.8990825688073395.
[32m[I 2023-04-21 00:28:56,854][39m Trial 4231 finished with value: 0.8807339449541284 and parameters: {'objective': 'Logloss', 'colsample_bylevel': 0.09597104794614235, 'depth': 7, 'boosting_type': 'Plain', 'bootstrap_type': 'Bayesian', 'bagging_temperature': 3.88075692330419}. Best is trial 1464 with value: 0.8990825688073395.
[32m[I 2023-04-21 00:28:58,004][39m Trial 4232 finished with value: 0.8648648648648648 and parameters: {'objective': 'Logloss', 'colsample_bylevel': 0.08578290799217177, 'depth': 11, 'boosting_type': 'Plain', 'bootstrap_type': 'Bernoulli', 'subsample': 0.39026505916711457}. Best is trial 1464 with value: 0.8990825688073395.
[32m[I 2023-04-21 00:28:58,754][39m Trial 4233 finished with value: 0.8727272727272727 and parameters: {'objective': 'CrossEntropy', 'colsample_bylevel': 0.09558910654215015, 'depth': 7, 'boosting_type': 'Plain', 'bootstrap_type': 'Bayesian', 'bagging_temperature': 5.9925562979872815}. Best is trial 1464 with value: 0.8990825688073395.
[32m[I 2023-04-21 00:29:00,117][39m Trial 4234 finished with value: 0.8807339449541284 and parameters: {'objective': 'Logloss', 'colsample_bylevel': 0.09837435451733523, 'depth': 8, 'boosting_type': 'Plain', 'bootstrap_type': 'Bayesian', 'bagging_temperature': 5.700950237230362}. Best is trial 1464 with value: 0.8990825688073395.
[32m[I 2023-04-21 00:29:00,849][39m Trial 4235 finished with value: 0.8807339449541284 and parameters: {'objective': 'CrossEntropy', 'colsample_bylevel': 0.08684948567732331, 'depth': 12, 'boosting_type': 'Plain', 'bootstrap_type': 'Bayesian', 'bagging_temperature': 4.871503624778696}. Best is trial 1464 with value: 0.8990825688073395.
[32m[I 2023-04-21 00:29:02,137][39m Trial 4236 finished with value: 0.8571428571428572 and parameters: {'objective': 'CrossEntropy', 'colsample_bylevel': 0.09891958211226377, 'depth': 9, 'boosting_type': 'Plain', 'bootstrap_type': 'MVS'}. Best is trial 1464 with value: 0.8990825688073395.
[32m[I 2023-04-21 00:29:02,846][39m Trial 4237 finished with value: 0.8727272727272727 and parameters: {'objective': 'Logloss', 'colsample_bylevel': 0.09396437084300512, 'depth': 10, 'boosting_type': 'Plain', 'bootstrap_type': 'Bayesian', 'bagging_temperature': 6.27221148957236}. Best is trial 1464 with value: 0.8990825688073395.
[32m[I 2023-04-21 00:29:04,154][39m Trial 4238 finished with value: 0.8807339449541284 and parameters: {'objective': 'Logloss', 'colsample_bylevel': 0.08773813779343352, 'depth': 11, 'boosting_type': 'Plain', 'bootstrap_type': 'Bayesian', 'bagging_temperature': 5.33814004218195}. Best is trial 1464 with value: 0.8990825688073395.
[32m[I 2023-04-21 00:29:05,191][39m Trial 4239 finished with value: 0.8727272727272727 and parameters: {'objective': 'Logloss', 'colsample_bylevel': 0.09069648416739176, 'depth': 10, 'boosting_type': 'Plain', 'bootstrap_type': 'Bayesian', 'bagging_temperature': 6.828866054595574}. Best is trial 1464 with value: 0.8990825688073395.
[32m[I 2023-04-21 00:29:06,858][39m Trial 4240 finished with value: 0.8727272727272727 and parameters: {'objective': 'Logloss', 'colsample_bylevel': 0.09572542412825652, 'depth': 9, 'boosting_type': 'Plain', 'bootstrap_type': 'Bayesian', 'bagging_temperature': 4.682835056299154}. Best is trial 1464 with value: 0.8990825688073395.
[32m[I 2023-04-21 00:29:11,892][39m Trial 4241 finished with value: 0.8571428571428572 and parameters: {'objective': 'Logloss', 'colsample_bylevel': 0.09423481134908476, 'depth': 8, 'boosting_type': 'Ordered', 'bootstrap_type': 'Bayesian', 'bagging_temperature': 5.791803952995721}. Best is trial 1464 with value: 0.8990825688073395.
[32m[I 2023-04-21 00:29:13,427][39m Trial 4242 finished with value: 0.8807339449541284 and parameters: {'objective': 'Logloss', 'colsample_bylevel': 0.09634511952169864, 'depth': 8, 'boosting_type': 'Plain', 'bootstrap_type': 'Bayesian', 'bagging_temperature': 5.393758499707301}. Best is trial 1464 with value: 0.8990825688073395.
[32m[I 2023-04-21 00:29:14,410][39m Trial 4243 finished with value: 0.8495575221238938 and parameters: {'objective': 'Logloss', 'colsample_bylevel': 0.09113870519374352, 'depth': 7, 'boosting_type': 'Plain', 'bootstrap_type': 'Bayesian', 'bagging_temperature': 5.563038737707789}. Best is trial 1464 with value: 0.8990825688073395.
[32m[I 2023-04-21 00:29:15,538][39m Trial 4244 finished with value: 0.8727272727272727 and parameters: {'objective': 'Logloss', 'colsample_bylevel': 0.09507439102732884, 'depth': 9, 'boosting_type': 'Plain', 'bootstrap_type': 'Bayesian', 'bagging_temperature': 7.042566910685334}. Best is trial 1464 with value: 0.8990825688073395.
[32m[I 2023-04-21 00:29:16,529][39m Trial 4245 finished with value: 0.888888888888889 and parameters: {'objective': 'Logloss', 'colsample_bylevel': 0.09737271166839692, 'depth': 7, 'boosting_type': 'Plain', 'bootstrap_type': 'Bayesian', 'bagging_temperature': 5.461483695249673}. Best is trial 1464 with value: 0.8990825688073395.
[32m[I 2023-04-21 00:29:17,704][39m Trial 4246 finished with value: 0.8468468468468469 and parameters: {'objective': 'Logloss', 'colsample_bylevel': 0.09412527296868226, 'depth': 7, 'boosting_type': 'Plain', 'bootstrap_type': 'Bayesian', 'bagging_temperature': 6.805027247019699}. Best is trial 1464 with value: 0.8990825688073395.
[32m[I 2023-04-21 00:29:19,212][39m Trial 4247 finished with value: 0.888888888888889 and parameters: {'objective': 'Logloss', 'colsample_bylevel': 0.09501131194343214, 'depth': 8, 'boosting_type': 'Plain', 'bootstrap_type': 'Bayesian', 'bagging_temperature': 6.557747880811756}. Best is trial 1464 with value: 0.8990825688073395.
[32m[I 2023-04-21 00:29:20,543][39m Trial 4248 finished with value: 0.8727272727272727 and parameters: {'objective': 'Logloss', 'colsample_bylevel': 0.09289918183196479, 'depth': 8, 'boosting_type': 'Plain', 'bootstrap_type': 'Bayesian', 'bagging_temperature': 5.964269186625623}. Best is trial 1464 with value: 0.8990825688073395.
[32m[I 2023-04-21 00:29:21,425][39m Trial 4249 finished with value: 0.8623853211009175 and parameters: {'objective': 'CrossEntropy', 'colsample_bylevel': 0.08783455113053529, 'depth': 10, 'boosting_type': 'Plain', 'bootstrap_type': 'Bayesian', 'bagging_temperature': 5.767982581273558}. Best is trial 1464 with value: 0.8990825688073395.
[32m[I 2023-04-21 00:29:22,219][39m Trial 4250 finished with value: 0.8727272727272727 and parameters: {'objective': 'CrossEntropy', 'colsample_bylevel': 0.09791397536047676, 'depth': 7, 'boosting_type': 'Plain', 'bootstrap_type': 'Bayesian', 'bagging_temperature': 6.093814146917413}. Best is trial 1464 with value: 0.8990825688073395.
[32m[I 2023-04-21 00:29:22,973][39m Trial 4251 finished with value: 0.8807339449541284 and parameters: {'objective': 'Logloss', 'colsample_bylevel': 0.09126277938572822, 'depth': 7, 'boosting_type': 'Plain', 'bootstrap_type': 'Bayesian', 'bagging_temperature': 5.382044826346468}. Best is trial 1464 with value: 0.8990825688073395.
[32m[I 2023-04-21 00:29:24,300][39m Trial 4252 finished with value: 0.8571428571428572 and parameters: {'objective': 'Logloss', 'colsample_bylevel': 0.09804380875075525, 'depth': 8, 'boosting_type': 'Plain', 'bootstrap_type': 'Bayesian', 'bagging_temperature': 5.022247046211512}. Best is trial 1464 with value: 0.8990825688073395.
[32m[I 2023-04-21 00:29:25,364][39m Trial 4253 finished with value: 0.8571428571428572 and parameters: {'objective': 'CrossEntropy', 'colsample_bylevel': 0.09508192983141854, 'depth': 7, 'boosting_type': 'Plain', 'bootstrap_type': 'Bernoulli', 'subsample': 0.29399980750080185}. Best is trial 1464 with value: 0.8990825688073395.
[32m[I 2023-04-21 00:29:26,236][39m Trial 4254 finished with value: 0.8807339449541284 and parameters: {'objective': 'CrossEntropy', 'colsample_bylevel': 0.085881962580276, 'depth': 7, 'boosting_type': 'Plain', 'bootstrap_type': 'Bayesian', 'bagging_temperature': 5.5544517442156085}. Best is trial 1464 with value: 0.8990825688073395.
[32m[I 2023-04-21 00:29:27,647][39m Trial 4255 finished with value: 0.8672566371681416 and parameters: {'objective': 'Logloss', 'colsample_bylevel': 0.09079324235930875, 'depth': 10, 'boosting_type': 'Plain', 'bootstrap_type': 'Bayesian', 'bagging_temperature': 5.749234658507599}. Best is trial 1464 with value: 0.8990825688073395.
[32m[I 2023-04-21 00:29:28,620][39m Trial 4256 finished with value: 0.8495575221238938 and parameters: {'objective': 'Logloss', 'colsample_bylevel': 0.08516623349946531, 'depth': 12, 'boosting_type': 'Plain', 'bootstrap_type': 'Bayesian', 'bagging_temperature': 5.253535738787617}. Best is trial 1464 with value: 0.8990825688073395.
[32m[I 2023-04-21 00:29:29,331][39m Trial 4257 finished with value: 0.8727272727272727 and parameters: {'objective': 'Logloss', 'colsample_bylevel': 0.09452994447034262, 'depth': 11, 'boosting_type': 'Plain', 'bootstrap_type': 'Bayesian', 'bagging_temperature': 6.903568464168211}. Best is trial 1464 with value: 0.8990825688073395.
[32m[I 2023-04-21 00:29:30,537][39m Trial 4258 finished with value: 0.8495575221238938 and parameters: {'objective': 'CrossEntropy', 'colsample_bylevel': 0.0803236544613862, 'depth': 7, 'boosting_type': 'Plain', 'bootstrap_type': 'MVS'}. Best is trial 1464 with value: 0.8990825688073395.
[32m[I 2023-04-21 00:29:36,099][39m Trial 4259 finished with value: 0.8495575221238938 and parameters: {'objective': 'Logloss', 'colsample_bylevel': 0.08973859980186585, 'depth': 12, 'boosting_type': 'Ordered', 'bootstrap_type': 'Bayesian', 'bagging_temperature': 5.196847813486441}. Best is trial 1464 with value: 0.8990825688073395.
[32m[I 2023-04-21 00:29:37,161][39m Trial 4260 finished with value: 0.8807339449541284 and parameters: {'objective': 'Logloss', 'colsample_bylevel': 0.09044680054311097, 'depth': 11, 'boosting_type': 'Plain', 'bootstrap_type': 'Bayesian', 'bagging_temperature': 5.530401835452966}. Best is trial 1464 with value: 0.8990825688073395.
[32m[I 2023-04-21 00:29:39,243][39m Trial 4261 finished with value: 0.8807339449541284 and parameters: {'objective': 'Logloss', 'colsample_bylevel': 0.09771410342055438, 'depth': 9, 'boosting_type': 'Plain', 'bootstrap_type': 'Bayesian', 'bagging_temperature': 5.843206618209447}. Best is trial 1464 with value: 0.8990825688073395.
[32m[I 2023-04-21 00:29:40,458][39m Trial 4262 finished with value: 0.8727272727272727 and parameters: {'objective': 'Logloss', 'colsample_bylevel': 0.09837864944196009, 'depth': 9, 'boosting_type': 'Plain', 'bootstrap_type': 'Bayesian', 'bagging_temperature': 5.818892253098722}. Best is trial 1464 with value: 0.8990825688073395.
[32m[I 2023-04-21 00:29:41,164][39m Trial 4263 finished with value: 0.8807339449541284 and parameters: {'objective': 'Logloss', 'colsample_bylevel': 0.09585574180262225, 'depth': 6, 'boosting_type': 'Plain', 'bootstrap_type': 'Bayesian', 'bagging_temperature': 5.480915857055952}. Best is trial 1464 with value: 0.8990825688073395.
[32m[I 2023-04-21 00:29:42,871][39m Trial 4264 finished with value: 0.8807339449541284 and parameters: {'objective': 'Logloss', 'colsample_bylevel': 0.09414670511438371, 'depth': 9, 'boosting_type': 'Plain', 'bootstrap_type': 'Bayesian', 'bagging_temperature': 4.0480167172260515}. Best is trial 1464 with value: 0.8990825688073395.
[32m[I 2023-04-21 00:29:43,563][39m Trial 4265 finished with value: 0.8785046728971961 and parameters: {'objective': 'CrossEntropy', 'colsample_bylevel': 0.09847447298202686, 'depth': 7, 'boosting_type': 'Plain', 'bootstrap_type': 'Bayesian', 'bagging_temperature': 5.140825797529342}. Best is trial 1464 with value: 0.8990825688073395.
[32m[I 2023-04-21 00:29:44,774][39m Trial 4266 finished with value: 0.8648648648648648 and parameters: {'objective': 'Logloss', 'colsample_bylevel': 0.09673782402048237, 'depth': 7, 'boosting_type': 'Plain', 'bootstrap_type': 'Bayesian', 'bagging_temperature': 6.955703265339107}. Best is trial 1464 with value: 0.8990825688073395.
[32m[I 2023-04-21 00:29:45,983][39m Trial 4267 finished with value: 0.8521739130434783 and parameters: {'objective': 'Logloss', 'colsample_bylevel': 0.06878403253475864, 'depth': 9, 'boosting_type': 'Plain', 'bootstrap_type': 'Bayesian', 'bagging_temperature': 5.173120448120447}. Best is trial 1464 with value: 0.8990825688073395.
[32m[I 2023-04-21 00:29:46,837][39m Trial 4268 finished with value: 0.8727272727272727 and parameters: {'objective': 'Logloss', 'colsample_bylevel': 0.09346800658721406, 'depth': 8, 'boosting_type': 'Plain', 'bootstrap_type': 'Bayesian', 'bagging_temperature': 5.989042295962647}. Best is trial 1464 with value: 0.8990825688073395.
[32m[I 2023-04-21 00:29:47,657][39m Trial 4269 finished with value: 0.8727272727272727 and parameters: {'objective': 'Logloss', 'colsample_bylevel': 0.09242541197041797, 'depth': 11, 'boosting_type': 'Plain', 'bootstrap_type': 'Bayesian', 'bagging_temperature': 5.726071144483928}. Best is trial 1464 with value: 0.8990825688073395.
[32m[I 2023-04-21 00:29:48,924][39m Trial 4270 finished with value: 0.8785046728971961 and parameters: {'objective': 'Logloss', 'colsample_bylevel': 0.09357114212254893, 'depth': 7, 'boosting_type': 'Plain', 'bootstrap_type': 'Bayesian', 'bagging_temperature': 5.386476962876788}. Best is trial 1464 with value: 0.8990825688073395.
[32m[I 2023-04-21 00:29:49,998][39m Trial 4271 finished with value: 0.888888888888889 and parameters: {'objective': 'CrossEntropy', 'colsample_bylevel': 0.08566635275696423, 'depth': 11, 'boosting_type': 'Plain', 'bootstrap_type': 'Bayesian', 'bagging_temperature': 6.601550945001185}. Best is trial 1464 with value: 0.8990825688073395.
[32m[I 2023-04-21 00:29:51,122][39m Trial 4272 finished with value: 0.8727272727272727 and parameters: {'objective': 'Logloss', 'colsample_bylevel': 0.09405636674655568, 'depth': 11, 'boosting_type': 'Plain', 'bootstrap_type': 'Bayesian', 'bagging_temperature': 5.6914074996666155}. Best is trial 1464 with value: 0.8990825688073395.
[32m[I 2023-04-21 00:29:52,358][39m Trial 4273 finished with value: 0.8727272727272727 and parameters: {'objective': 'CrossEntropy', 'colsample_bylevel': 0.09640765140709955, 'depth': 7, 'boosting_type': 'Plain', 'bootstrap_type': 'Bayesian', 'bagging_temperature': 3.653084507792978}. Best is trial 1464 with value: 0.8990825688073395.
[32m[I 2023-04-21 00:29:53,579][39m Trial 4274 finished with value: 0.8571428571428572 and parameters: {'objective': 'CrossEntropy', 'colsample_bylevel': 0.09387532925930124, 'depth': 7, 'boosting_type': 'Plain', 'bootstrap_type': 'Bayesian', 'bagging_temperature': 3.4665379197707176}. Best is trial 1464 with value: 0.8990825688073395.
[32m[I 2023-04-21 00:29:54,335][39m Trial 4275 finished with value: 0.8828828828828829 and parameters: {'objective': 'CrossEntropy', 'colsample_bylevel': 0.09182440944750764, 'depth': 10, 'boosting_type': 'Plain', 'bootstrap_type': 'Bayesian', 'bagging_temperature': 5.488467410756808}. Best is trial 1464 with value: 0.8990825688073395.
[32m[I 2023-04-21 00:29:55,316][39m Trial 4276 finished with value: 0.8521739130434783 and parameters: {'objective': 'Logloss', 'colsample_bylevel': 0.07631113914485235, 'depth': 9, 'boosting_type': 'Plain', 'bootstrap_type': 'Bayesian', 'bagging_temperature': 5.897537864653594}. Best is trial 1464 with value: 0.8990825688073395.
[32m[I 2023-04-21 00:30:00,532][39m Trial 4277 finished with value: 0.8571428571428572 and parameters: {'objective': 'Logloss', 'colsample_bylevel': 0.09774884572689213, 'depth': 10, 'boosting_type': 'Ordered', 'bootstrap_type': 'Bernoulli', 'subsample': 0.20580841843088282}. Best is trial 1464 with value: 0.8990825688073395.
[32m[I 2023-04-21 00:30:02,405][39m Trial 4278 finished with value: 0.8468468468468469 and parameters: {'objective': 'CrossEntropy', 'colsample_bylevel': 0.09833880073894243, 'depth': 9, 'boosting_type': 'Plain', 'bootstrap_type': 'Bayesian', 'bagging_temperature': 6.625782275242071}. Best is trial 1464 with value: 0.8990825688073395.
[32m[I 2023-04-21 00:30:03,227][39m Trial 4279 finished with value: 0.8495575221238938 and parameters: {'objective': 'CrossEntropy', 'colsample_bylevel': 0.08903721787144776, 'depth': 10, 'boosting_type': 'Plain', 'bootstrap_type': 'MVS'}. Best is trial 1464 with value: 0.8990825688073395.
[32m[I 2023-04-21 00:30:03,883][39m Trial 4280 finished with value: 0.8347826086956522 and parameters: {'objective': 'CrossEntropy', 'colsample_bylevel': 0.05872517836808141, 'depth': 7, 'boosting_type': 'Plain', 'bootstrap_type': 'Bayesian', 'bagging_temperature': 3.7051111603343116}. Best is trial 1464 with value: 0.8990825688073395.
