[32m[I 2023-04-21 00:04:27,765][39m Trial 3161 finished with value: 0.8421052631578947 and parameters: {'objective': 'CrossEntropy', 'colsample_bylevel': 0.06432391466068389, 'depth': 9, 'boosting_type': 'Plain', 'bootstrap_type': 'Bayesian', 'bagging_temperature': 5.260828909518344}. Best is trial 1464 with value: 0.8990825688073395.
[32m[I 2023-04-21 00:04:28,725][39m Trial 3162 finished with value: 0.8727272727272727 and parameters: {'objective': 'Logloss', 'colsample_bylevel': 0.09295403732300303, 'depth': 9, 'boosting_type': 'Plain', 'bootstrap_type': 'Bayesian', 'bagging_temperature': 6.798633364943979}. Best is trial 1464 with value: 0.8990825688073395.
[32m[I 2023-04-21 00:04:29,743][39m Trial 3163 finished with value: 0.8421052631578947 and parameters: {'objective': 'Logloss', 'colsample_bylevel': 0.08772241553577759, 'depth': 6, 'boosting_type': 'Plain', 'bootstrap_type': 'Bayesian', 'bagging_temperature': 5.306743790235804}. Best is trial 1464 with value: 0.8990825688073395.
[32m[I 2023-04-21 00:04:31,180][39m Trial 3164 finished with value: 0.8807339449541284 and parameters: {'objective': 'Logloss', 'colsample_bylevel': 0.08804147236648127, 'depth': 8, 'boosting_type': 'Plain', 'bootstrap_type': 'Bayesian', 'bagging_temperature': 4.749167921161557}. Best is trial 1464 with value: 0.8990825688073395.
[32m[I 2023-04-21 00:04:32,299][39m Trial 3165 finished with value: 0.8703703703703703 and parameters: {'objective': 'Logloss', 'colsample_bylevel': 0.09807589265338712, 'depth': 6, 'boosting_type': 'Plain', 'bootstrap_type': 'Bayesian', 'bagging_temperature': 4.15340362425861}. Best is trial 1464 with value: 0.8990825688073395.
[32m[I 2023-04-21 00:04:33,470][39m Trial 3166 finished with value: 0.8648648648648648 and parameters: {'objective': 'Logloss', 'colsample_bylevel': 0.08645669592667113, 'depth': 8, 'boosting_type': 'Plain', 'bootstrap_type': 'Bayesian', 'bagging_temperature': 5.583206651553311}. Best is trial 1464 with value: 0.8990825688073395.
[32m[I 2023-04-21 00:04:34,317][39m Trial 3167 finished with value: 0.8727272727272727 and parameters: {'objective': 'CrossEntropy', 'colsample_bylevel': 0.0902503355967523, 'depth': 7, 'boosting_type': 'Plain', 'bootstrap_type': 'Bayesian', 'bagging_temperature': 3.9712097235166404}. Best is trial 1464 with value: 0.8990825688073395.
[32m[I 2023-04-21 00:04:35,264][39m Trial 3168 finished with value: 0.8785046728971961 and parameters: {'objective': 'Logloss', 'colsample_bylevel': 0.09406379963443572, 'depth': 7, 'boosting_type': 'Plain', 'bootstrap_type': 'Bayesian', 'bagging_temperature': 3.9794481936218804}. Best is trial 1464 with value: 0.8990825688073395.
[32m[I 2023-04-21 00:04:40,566][39m Trial 3169 finished with value: 0.8571428571428572 and parameters: {'objective': 'CrossEntropy', 'colsample_bylevel': 0.09082252123838946, 'depth': 8, 'boosting_type': 'Ordered', 'bootstrap_type': 'Bayesian', 'bagging_temperature': 7.246083829549516}. Best is trial 1464 with value: 0.8990825688073395.
[32m[I 2023-04-21 00:04:41,519][39m Trial 3170 finished with value: 0.823529411764706 and parameters: {'objective': 'CrossEntropy', 'colsample_bylevel': 0.031581521625683624, 'depth': 9, 'boosting_type': 'Plain', 'bootstrap_type': 'Bayesian', 'bagging_temperature': 4.309887323838086}. Best is trial 1464 with value: 0.8990825688073395.
[32m[I 2023-04-21 00:04:42,713][39m Trial 3171 finished with value: 0.8495575221238938 and parameters: {'objective': 'CrossEntropy', 'colsample_bylevel': 0.08908706997201137, 'depth': 9, 'boosting_type': 'Plain', 'bootstrap_type': 'MVS'}. Best is trial 1464 with value: 0.8990825688073395.
[32m[I 2023-04-21 00:04:43,732][39m Trial 3172 finished with value: 0.8807339449541284 and parameters: {'objective': 'Logloss', 'colsample_bylevel': 0.09202140778125642, 'depth': 8, 'boosting_type': 'Plain', 'bootstrap_type': 'Bayesian', 'bagging_temperature': 5.836384948000555}. Best is trial 1464 with value: 0.8990825688073395.
[32m[I 2023-04-21 00:04:45,350][39m Trial 3173 finished with value: 0.8727272727272727 and parameters: {'objective': 'Logloss', 'colsample_bylevel': 0.09739924357125102, 'depth': 8, 'boosting_type': 'Plain', 'bootstrap_type': 'Bayesian', 'bagging_temperature': 6.504208809361583}. Best is trial 1464 with value: 0.8990825688073395.
[32m[I 2023-04-21 00:04:46,359][39m Trial 3174 finished with value: 0.8727272727272727 and parameters: {'objective': 'Logloss', 'colsample_bylevel': 0.09661673572409954, 'depth': 8, 'boosting_type': 'Plain', 'bootstrap_type': 'Bayesian', 'bagging_temperature': 4.193023535183034}. Best is trial 1464 with value: 0.8990825688073395.
[32m[I 2023-04-21 00:04:49,091][39m Trial 3176 finished with value: 0.8727272727272727 and parameters: {'objective': 'Logloss', 'colsample_bylevel': 0.09674858441644192, 'depth': 8, 'boosting_type': 'Plain', 'bootstrap_type': 'Bayesian', 'bagging_temperature': 4.553645230995924}. Best is trial 1464 with value: 0.8990825688073395.
[32m[I 2023-04-21 00:04:49,989][39m Trial 3177 finished with value: 0.875 and parameters: {'objective': 'Logloss', 'colsample_bylevel': 0.0984814273942105, 'depth': 7, 'boosting_type': 'Plain', 'bootstrap_type': 'Bayesian', 'bagging_temperature': 5.0803025323981}. Best is trial 1464 with value: 0.8990825688073395.
[32m[I 2023-04-21 00:04:50,872][39m Trial 3178 finished with value: 0.8727272727272727 and parameters: {'objective': 'Logloss', 'colsample_bylevel': 0.09694714720267449, 'depth': 8, 'boosting_type': 'Plain', 'bootstrap_type': 'Bayesian', 'bagging_temperature': 3.749839532029205}. Best is trial 1464 with value: 0.8990825688073395.
[32m[I 2023-04-21 00:04:52,190][39m Trial 3179 finished with value: 0.8807339449541284 and parameters: {'objective': 'Logloss', 'colsample_bylevel': 0.09441886281903342, 'depth': 9, 'boosting_type': 'Plain', 'bootstrap_type': 'Bayesian', 'bagging_temperature': 5.012432817084773}. Best is trial 1464 with value: 0.8990825688073395.
[32m[I 2023-04-21 00:04:52,928][39m Trial 3180 finished with value: 0.8785046728971961 and parameters: {'objective': 'CrossEntropy', 'colsample_bylevel': 0.09582887900605745, 'depth': 10, 'boosting_type': 'Plain', 'bootstrap_type': 'Bayesian', 'bagging_temperature': 4.425472513861112}. Best is trial 1464 with value: 0.8990825688073395.
[32m[I 2023-04-21 00:04:54,427][39m Trial 3181 finished with value: 0.8545454545454546 and parameters: {'objective': 'CrossEntropy', 'colsample_bylevel': 0.09080620301873565, 'depth': 9, 'boosting_type': 'Plain', 'bootstrap_type': 'Bayesian', 'bagging_temperature': 4.87521823863727}. Best is trial 1464 with value: 0.8990825688073395.
[32m[I 2023-04-21 00:04:55,516][39m Trial 3182 finished with value: 0.8828828828828829 and parameters: {'objective': 'Logloss', 'colsample_bylevel': 0.0899907475330751, 'depth': 6, 'boosting_type': 'Plain', 'bootstrap_type': 'Bayesian', 'bagging_temperature': 5.641022841364468}. Best is trial 1464 with value: 0.8990825688073395.
[32m[I 2023-04-21 00:04:56,500][39m Trial 3183 finished with value: 0.8727272727272727 and parameters: {'objective': 'CrossEntropy', 'colsample_bylevel': 0.09858216029453594, 'depth': 7, 'boosting_type': 'Plain', 'bootstrap_type': 'Bayesian', 'bagging_temperature': 4.545872795185973}. Best is trial 1464 with value: 0.8990825688073395.
[32m[I 2023-04-21 00:04:57,442][39m Trial 3184 finished with value: 0.8828828828828829 and parameters: {'objective': 'CrossEntropy', 'colsample_bylevel': 0.08945646742120869, 'depth': 9, 'boosting_type': 'Plain', 'bootstrap_type': 'Bayesian', 'bagging_temperature': 4.879297209684397}. Best is trial 1464 with value: 0.8990825688073395.
[32m[I 2023-04-21 00:04:58,720][39m Trial 3185 finished with value: 0.8828828828828829 and parameters: {'objective': 'Logloss', 'colsample_bylevel': 0.09257766108319974, 'depth': 9, 'boosting_type': 'Plain', 'bootstrap_type': 'Bayesian', 'bagging_temperature': 4.686884126336672}. Best is trial 1464 with value: 0.8990825688073395.
[32m[I 2023-04-21 00:05:00,114][39m Trial 3186 finished with value: 0.8727272727272727 and parameters: {'objective': 'CrossEntropy', 'colsample_bylevel': 0.09394349433662308, 'depth': 7, 'boosting_type': 'Plain', 'bootstrap_type': 'Bayesian', 'bagging_temperature': 3.59101412583563}. Best is trial 1464 with value: 0.8990825688073395.
[32m[I 2023-04-21 00:05:05,193][39m Trial 3187 finished with value: 0.8495575221238938 and parameters: {'objective': 'Logloss', 'colsample_bylevel': 0.09497358483179631, 'depth': 8, 'boosting_type': 'Ordered', 'bootstrap_type': 'Bayesian', 'bagging_temperature': 6.601434466618611}. Best is trial 1464 with value: 0.8990825688073395.
[32m[I 2023-04-21 00:05:06,106][39m Trial 3188 finished with value: 0.8727272727272727 and parameters: {'objective': 'CrossEntropy', 'colsample_bylevel': 0.09081183183242249, 'depth': 10, 'boosting_type': 'Plain', 'bootstrap_type': 'Bayesian', 'bagging_temperature': 6.076366036776614}. Best is trial 1464 with value: 0.8990825688073395.
[32m[I 2023-04-21 00:05:07,245][39m Trial 3189 finished with value: 0.8727272727272727 and parameters: {'objective': 'CrossEntropy', 'colsample_bylevel': 0.08735985006247819, 'depth': 9, 'boosting_type': 'Plain', 'bootstrap_type': 'Bayesian', 'bagging_temperature': 5.121313566949728}. Best is trial 1464 with value: 0.8990825688073395.
[32m[I 2023-04-21 00:05:08,478][39m Trial 3190 finished with value: 0.8807339449541284 and parameters: {'objective': 'Logloss', 'colsample_bylevel': 0.0907530873667974, 'depth': 10, 'boosting_type': 'Plain', 'bootstrap_type': 'Bayesian', 'bagging_temperature': 5.113134293332146}. Best is trial 1464 with value: 0.8990825688073395.
[32m[I 2023-04-21 00:05:09,954][39m Trial 3191 finished with value: 0.8807339449541284 and parameters: {'objective': 'Logloss', 'colsample_bylevel': 0.09245684088749775, 'depth': 9, 'boosting_type': 'Plain', 'bootstrap_type': 'Bayesian', 'bagging_temperature': 5.500069697758842}. Best is trial 1464 with value: 0.8990825688073395.
[32m[I 2023-04-21 00:05:10,790][39m Trial 3192 finished with value: 0.8596491228070176 and parameters: {'objective': 'Logloss', 'colsample_bylevel': 0.0946297589011257, 'depth': 9, 'boosting_type': 'Plain', 'bootstrap_type': 'MVS'}. Best is trial 1464 with value: 0.8990825688073395.
[32m[I 2023-04-21 00:05:12,024][39m Trial 3193 finished with value: 0.8807339449541284 and parameters: {'objective': 'Logloss', 'colsample_bylevel': 0.09420259692957686, 'depth': 8, 'boosting_type': 'Plain', 'bootstrap_type': 'Bayesian', 'bagging_temperature': 4.030352036059776}. Best is trial 1464 with value: 0.8990825688073395.
[32m[I 2023-04-21 00:05:13,436][39m Trial 3194 finished with value: 0.8807339449541284 and parameters: {'objective': 'Logloss', 'colsample_bylevel': 0.0982817210610866, 'depth': 9, 'boosting_type': 'Plain', 'bootstrap_type': 'Bayesian', 'bagging_temperature': 4.677725553008011}. Best is trial 1464 with value: 0.8990825688073395.
[32m[I 2023-04-21 00:05:14,926][39m Trial 3195 finished with value: 0.8807339449541284 and parameters: {'objective': 'CrossEntropy', 'colsample_bylevel': 0.09330521830860398, 'depth': 7, 'boosting_type': 'Plain', 'bootstrap_type': 'Bayesian', 'bagging_temperature': 6.319104259081453}. Best is trial 1464 with value: 0.8990825688073395.
[32m[I 2023-04-21 00:05:15,701][39m Trial 3196 finished with value: 0.8807339449541284 and parameters: {'objective': 'Logloss', 'colsample_bylevel': 0.09544868878133547, 'depth': 7, 'boosting_type': 'Plain', 'bootstrap_type': 'Bayesian', 'bagging_temperature': 5.848966221905205}. Best is trial 1464 with value: 0.8990825688073395.
[32m[I 2023-04-21 00:05:16,500][39m Trial 3197 finished with value: 0.888888888888889 and parameters: {'objective': 'Logloss', 'colsample_bylevel': 0.09600565667283872, 'depth': 7, 'boosting_type': 'Plain', 'bootstrap_type': 'Bayesian', 'bagging_temperature': 4.459472038993052}. Best is trial 1464 with value: 0.8990825688073395.
[32m[I 2023-04-21 00:05:17,881][39m Trial 3198 finished with value: 0.8703703703703703 and parameters: {'objective': 'Logloss', 'colsample_bylevel': 0.09795832702562773, 'depth': 8, 'boosting_type': 'Plain', 'bootstrap_type': 'Bayesian', 'bagging_temperature': 5.5484912664086}. Best is trial 1464 with value: 0.8990825688073395.
[32m[I 2023-04-21 00:05:18,727][39m Trial 3199 finished with value: 0.8571428571428572 and parameters: {'objective': 'CrossEntropy', 'colsample_bylevel': 0.08771336463655742, 'depth': 9, 'boosting_type': 'Plain', 'bootstrap_type': 'Bayesian', 'bagging_temperature': 5.025651945886057}. Best is trial 1464 with value: 0.8990825688073395.
[32m[I 2023-04-21 00:05:20,220][39m Trial 3200 finished with value: 0.8648648648648648 and parameters: {'objective': 'CrossEntropy', 'colsample_bylevel': 0.09853526570514165, 'depth': 9, 'boosting_type': 'Plain', 'bootstrap_type': 'Bayesian', 'bagging_temperature': 5.790044821538092}. Best is trial 1464 with value: 0.8990825688073395.
[32m[I 2023-04-21 00:05:21,243][39m Trial 3201 finished with value: 0.8623853211009175 and parameters: {'objective': 'CrossEntropy', 'colsample_bylevel': 0.09595389638429691, 'depth': 9, 'boosting_type': 'Plain', 'bootstrap_type': 'Bayesian', 'bagging_temperature': 5.657498630341567}. Best is trial 1464 with value: 0.8990825688073395.
[32m[I 2023-04-21 00:05:22,241][39m Trial 3202 finished with value: 0.8727272727272727 and parameters: {'objective': 'Logloss', 'colsample_bylevel': 0.09307161209669527, 'depth': 9, 'boosting_type': 'Plain', 'bootstrap_type': 'Bayesian', 'bagging_temperature': 5.4312637791172795}. Best is trial 1464 with value: 0.8990825688073395.
[32m[I 2023-04-21 00:05:23,428][39m Trial 3203 finished with value: 0.8807339449541284 and parameters: {'objective': 'CrossEntropy', 'colsample_bylevel': 0.09046110461340279, 'depth': 10, 'boosting_type': 'Plain', 'bootstrap_type': 'Bayesian', 'bagging_temperature': 5.384043446094885}. Best is trial 1464 with value: 0.8990825688073395.
[32m[I 2023-04-21 00:05:24,298][39m Trial 3204 finished with value: 0.8807339449541284 and parameters: {'objective': 'Logloss', 'colsample_bylevel': 0.09485110448524274, 'depth': 8, 'boosting_type': 'Plain', 'bootstrap_type': 'Bayesian', 'bagging_temperature': 6.898600530081383}. Best is trial 1464 with value: 0.8990825688073395.
[32m[I 2023-04-21 00:05:25,098][39m Trial 3205 finished with value: 0.8807339449541284 and parameters: {'objective': 'Logloss', 'colsample_bylevel': 0.09250002124560545, 'depth': 10, 'boosting_type': 'Plain', 'bootstrap_type': 'Bayesian', 'bagging_temperature': 5.962324336257072}. Best is trial 1464 with value: 0.8990825688073395.
[32m[I 2023-04-21 00:05:26,111][39m Trial 3206 finished with value: 0.8727272727272727 and parameters: {'objective': 'CrossEntropy', 'colsample_bylevel': 0.08740391501249532, 'depth': 10, 'boosting_type': 'Plain', 'bootstrap_type': 'Bayesian', 'bagging_temperature': 5.329309268082343}. Best is trial 1464 with value: 0.8990825688073395.
[32m[I 2023-04-21 00:05:31,810][39m Trial 3207 finished with value: 0.8495575221238938 and parameters: {'objective': 'CrossEntropy', 'colsample_bylevel': 0.09015294170620708, 'depth': 9, 'boosting_type': 'Ordered', 'bootstrap_type': 'Bayesian', 'bagging_temperature': 5.596215169933523}. Best is trial 1464 with value: 0.8990825688073395.
[32m[I 2023-04-21 00:05:32,784][39m Trial 3208 finished with value: 0.831858407079646 and parameters: {'objective': 'Logloss', 'colsample_bylevel': 0.08975224147112322, 'depth': 3, 'boosting_type': 'Plain', 'bootstrap_type': 'Bayesian', 'bagging_temperature': 6.660491135168959}. Best is trial 1464 with value: 0.8990825688073395.
[32m[I 2023-04-21 00:05:34,456][39m Trial 3209 finished with value: 0.8807339449541284 and parameters: {'objective': 'Logloss', 'colsample_bylevel': 0.09217330795162051, 'depth': 9, 'boosting_type': 'Plain', 'bootstrap_type': 'Bayesian', 'bagging_temperature': 4.263800566953777}. Best is trial 1464 with value: 0.8990825688073395.
[32m[I 2023-04-21 00:05:35,468][39m Trial 3210 finished with value: 0.8727272727272727 and parameters: {'objective': 'Logloss', 'colsample_bylevel': 0.09775289844268861, 'depth': 7, 'boosting_type': 'Plain', 'bootstrap_type': 'Bayesian', 'bagging_temperature': 4.6846221317917}. Best is trial 1464 with value: 0.8990825688073395.
[32m[I 2023-04-21 00:05:36,122][39m Trial 3211 finished with value: 0.8448275862068967 and parameters: {'objective': 'Logloss', 'colsample_bylevel': 0.054378305479914554, 'depth': 7, 'boosting_type': 'Plain', 'bootstrap_type': 'Bayesian', 'bagging_temperature': 5.277111277153936}. Best is trial 1464 with value: 0.8990825688073395.
[32m[I 2023-04-21 00:05:37,626][39m Trial 3212 finished with value: 0.8703703703703703 and parameters: {'objective': 'Logloss', 'colsample_bylevel': 0.08915940913609266, 'depth': 9, 'boosting_type': 'Plain', 'bootstrap_type': 'Bayesian', 'bagging_temperature': 4.838034840604497}. Best is trial 1464 with value: 0.8990825688073395.
[32m[I 2023-04-21 00:05:38,554][39m Trial 3213 finished with value: 0.8672566371681416 and parameters: {'objective': 'Logloss', 'colsample_bylevel': 0.09656867347621642, 'depth': 8, 'boosting_type': 'Plain', 'bootstrap_type': 'MVS'}. Best is trial 1464 with value: 0.8990825688073395.
[32m[I 2023-04-21 00:05:39,209][39m Trial 3214 finished with value: 0.8596491228070176 and parameters: {'objective': 'Logloss', 'colsample_bylevel': 0.051553324731630996, 'depth': 8, 'boosting_type': 'Plain', 'bootstrap_type': 'Bayesian', 'bagging_temperature': 5.461997617532463}. Best is trial 1464 with value: 0.8990825688073395.
[32m[I 2023-04-21 00:05:40,550][39m Trial 3215 finished with value: 0.8703703703703703 and parameters: {'objective': 'Logloss', 'colsample_bylevel': 0.09166514730237467, 'depth': 9, 'boosting_type': 'Plain', 'bootstrap_type': 'Bayesian', 'bagging_temperature': 5.089353087142356}. Best is trial 1464 with value: 0.8990825688073395.
[32m[I 2023-04-21 00:05:41,131][39m Trial 3216 finished with value: 0.8828828828828829 and parameters: {'objective': 'CrossEntropy', 'colsample_bylevel': 0.09076888221800565, 'depth': 10, 'boosting_type': 'Plain', 'bootstrap_type': 'Bayesian', 'bagging_temperature': 5.754560999396458}. Best is trial 1464 with value: 0.8990825688073395.
[32m[I 2023-04-21 00:05:42,665][39m Trial 3217 finished with value: 0.8807339449541284 and parameters: {'objective': 'Logloss', 'colsample_bylevel': 0.09598260323295559, 'depth': 8, 'boosting_type': 'Plain', 'bootstrap_type': 'Bayesian', 'bagging_temperature': 3.6811479574847032}. Best is trial 1464 with value: 0.8990825688073395.
[32m[I 2023-04-21 00:05:43,669][39m Trial 3218 finished with value: 0.8648648648648648 and parameters: {'objective': 'Logloss', 'colsample_bylevel': 0.09849912295639138, 'depth': 8, 'boosting_type': 'Plain', 'bootstrap_type': 'Bayesian', 'bagging_temperature': 7.354322714323771}. Best is trial 1464 with value: 0.8990825688073395.
[32m[I 2023-04-21 00:05:44,375][39m Trial 3219 finished with value: 0.8727272727272727 and parameters: {'objective': 'CrossEntropy', 'colsample_bylevel': 0.08857223473677509, 'depth': 10, 'boosting_type': 'Plain', 'bootstrap_type': 'Bayesian', 'bagging_temperature': 6.416602225694863}. Best is trial 1464 with value: 0.8990825688073395.
[32m[I 2023-04-21 00:05:46,068][39m Trial 3220 finished with value: 0.8807339449541284 and parameters: {'objective': 'Logloss', 'colsample_bylevel': 0.09258244931986392, 'depth': 9, 'boosting_type': 'Plain', 'bootstrap_type': 'Bayesian', 'bagging_temperature': 4.24390505121978}. Best is trial 1464 with value: 0.8990825688073395.
[32m[I 2023-04-21 00:05:47,259][39m Trial 3221 finished with value: 0.8828828828828829 and parameters: {'objective': 'CrossEntropy', 'colsample_bylevel': 0.0887249830829035, 'depth': 9, 'boosting_type': 'Plain', 'bootstrap_type': 'Bayesian', 'bagging_temperature': 4.913666422348487}. Best is trial 1464 with value: 0.8990825688073395.
[32m[I 2023-04-21 00:05:48,846][39m Trial 3222 finished with value: 0.875 and parameters: {'objective': 'CrossEntropy', 'colsample_bylevel': 0.08636653753106192, 'depth': 9, 'boosting_type': 'Plain', 'bootstrap_type': 'Bayesian', 'bagging_temperature': 5.331627049894234}. Best is trial 1464 with value: 0.8990825688073395.
[32m[I 2023-04-21 00:05:50,384][39m Trial 3223 finished with value: 0.888888888888889 and parameters: {'objective': 'Logloss', 'colsample_bylevel': 0.0952818595071668, 'depth': 9, 'boosting_type': 'Plain', 'bootstrap_type': 'Bayesian', 'bagging_temperature': 6.118707894166152}. Best is trial 1464 with value: 0.8990825688073395.
[32m[I 2023-04-21 00:05:51,012][39m Trial 3224 finished with value: 0.8828828828828829 and parameters: {'objective': 'Logloss', 'colsample_bylevel': 0.09419445906915906, 'depth': 7, 'boosting_type': 'Plain', 'bootstrap_type': 'Bayesian', 'bagging_temperature': 5.683059175444028}. Best is trial 1464 with value: 0.8990825688073395.
[32m[I 2023-04-21 00:05:56,305][39m Trial 3225 finished with value: 0.8623853211009175 and parameters: {'objective': 'Logloss', 'colsample_bylevel': 0.09546161418464796, 'depth': 9, 'boosting_type': 'Ordered', 'bootstrap_type': 'Bayesian', 'bagging_temperature': 6.986363074532805}. Best is trial 1464 with value: 0.8990825688073395.
[32m[I 2023-04-21 00:05:57,868][39m Trial 3226 finished with value: 0.8828828828828829 and parameters: {'objective': 'Logloss', 'colsample_bylevel': 0.09648932180367324, 'depth': 8, 'boosting_type': 'Plain', 'bootstrap_type': 'Bayesian', 'bagging_temperature': 5.137931383408159}. Best is trial 1464 with value: 0.8990825688073395.
[32m[I 2023-04-21 00:05:58,880][39m Trial 3227 finished with value: 0.8727272727272727 and parameters: {'objective': 'Logloss', 'colsample_bylevel': 0.09389419161994053, 'depth': 9, 'boosting_type': 'Plain', 'bootstrap_type': 'Bayesian', 'bagging_temperature': 3.9909807199296776}. Best is trial 1464 with value: 0.8990825688073395.
