[32m[I 2023-04-20 23:21:01,262][39m Trial 1127 finished with value: 0.8807339449541284 and parameters: {'objective': 'CrossEntropy', 'colsample_bylevel': 0.08931197399393297, 'depth': 10, 'boosting_type': 'Plain', 'bootstrap_type': 'Bayesian', 'bagging_temperature': 7.505293953573817}. Best is trial 205 with value: 0.890909090909091.
[32m[I 2023-04-20 23:21:02,237][39m Trial 1128 finished with value: 0.8468468468468469 and parameters: {'objective': 'Logloss', 'colsample_bylevel': 0.09557576469429106, 'depth': 5, 'boosting_type': 'Plain', 'bootstrap_type': 'Bayesian', 'bagging_temperature': 3.8431076128380477}. Best is trial 205 with value: 0.890909090909091.
[32m[I 2023-04-20 23:21:03,115][39m Trial 1129 finished with value: 0.8828828828828829 and parameters: {'objective': 'CrossEntropy', 'colsample_bylevel': 0.09221752833712582, 'depth': 12, 'boosting_type': 'Plain', 'bootstrap_type': 'Bayesian', 'bagging_temperature': 7.88336618935603}. Best is trial 205 with value: 0.890909090909091.
[32m[I 2023-04-20 23:21:03,806][39m Trial 1130 finished with value: 0.8807339449541284 and parameters: {'objective': 'Logloss', 'colsample_bylevel': 0.09611982307436857, 'depth': 11, 'boosting_type': 'Plain', 'bootstrap_type': 'Bayesian', 'bagging_temperature': 6.828889480981383}. Best is trial 205 with value: 0.890909090909091.
[32m[I 2023-04-20 23:21:04,456][39m Trial 1131 finished with value: 0.8828828828828829 and parameters: {'objective': 'CrossEntropy', 'colsample_bylevel': 0.09850494420443774, 'depth': 9, 'boosting_type': 'Plain', 'bootstrap_type': 'Bayesian', 'bagging_temperature': 4.621727106899522}. Best is trial 205 with value: 0.890909090909091.
[32m[I 2023-04-20 23:21:10,019][39m Trial 1132 finished with value: 0.8421052631578947 and parameters: {'objective': 'Logloss', 'colsample_bylevel': 0.09989089866179877, 'depth': 8, 'boosting_type': 'Ordered', 'bootstrap_type': 'Bayesian', 'bagging_temperature': 3.8489676463757183}. Best is trial 205 with value: 0.890909090909091.
[32m[I 2023-04-20 23:21:11,944][39m Trial 1133 finished with value: 0.8727272727272727 and parameters: {'objective': 'CrossEntropy', 'colsample_bylevel': 0.09658893635637925, 'depth': 9, 'boosting_type': 'Plain', 'bootstrap_type': 'Bayesian', 'bagging_temperature': 6.263980642128056}. Best is trial 205 with value: 0.890909090909091.
[32m[I 2023-04-20 23:21:12,623][39m Trial 1134 finished with value: 0.8807339449541284 and parameters: {'objective': 'CrossEntropy', 'colsample_bylevel': 0.09138350604761213, 'depth': 12, 'boosting_type': 'Plain', 'bootstrap_type': 'Bayesian', 'bagging_temperature': 9.832573406999618}. Best is trial 205 with value: 0.890909090909091.
[32m[I 2023-04-20 23:21:13,198][39m Trial 1135 finished with value: 0.8571428571428572 and parameters: {'objective': 'CrossEntropy', 'colsample_bylevel': 0.09082608081925733, 'depth': 10, 'boosting_type': 'Plain', 'bootstrap_type': 'Bernoulli', 'subsample': 0.6203890219346107}. Best is trial 205 with value: 0.890909090909091.
[32m[I 2023-04-20 23:21:14,830][39m Trial 1136 finished with value: 0.8807339449541284 and parameters: {'objective': 'Logloss', 'colsample_bylevel': 0.09821402642551343, 'depth': 8, 'boosting_type': 'Plain', 'bootstrap_type': 'Bayesian', 'bagging_temperature': 4.966019709140585}. Best is trial 205 with value: 0.890909090909091.
[32m[I 2023-04-20 23:21:16,327][39m Trial 1137 finished with value: 0.8727272727272727 and parameters: {'objective': 'Logloss', 'colsample_bylevel': 0.09691912656469254, 'depth': 11, 'boosting_type': 'Plain', 'bootstrap_type': 'Bayesian', 'bagging_temperature': 4.044504442058974}. Best is trial 205 with value: 0.890909090909091.
[32m[I 2023-04-20 23:21:17,419][39m Trial 1138 finished with value: 0.7027027027027026 and parameters: {'objective': 'CrossEntropy', 'colsample_bylevel': 0.015284183185538328, 'depth': 9, 'boosting_type': 'Plain', 'bootstrap_type': 'Bayesian', 'bagging_temperature': 4.310273268082022}. Best is trial 205 with value: 0.890909090909091.
[32m[I 2023-04-20 23:21:18,013][39m Trial 1139 finished with value: 0.8807339449541284 and parameters: {'objective': 'CrossEntropy', 'colsample_bylevel': 0.0998120496421828, 'depth': 10, 'boosting_type': 'Plain', 'bootstrap_type': 'Bayesian', 'bagging_temperature': 5.690411712017147}. Best is trial 205 with value: 0.890909090909091.
[32m[I 2023-04-20 23:21:18,628][39m Trial 1140 finished with value: 0.8623853211009175 and parameters: {'objective': 'CrossEntropy', 'colsample_bylevel': 0.09169048159651604, 'depth': 7, 'boosting_type': 'Plain', 'bootstrap_type': 'Bayesian', 'bagging_temperature': 4.211625235556285}. Best is trial 205 with value: 0.890909090909091.
[32m[I 2023-04-20 23:21:19,553][39m Trial 1141 finished with value: 0.8623853211009175 and parameters: {'objective': 'Logloss', 'colsample_bylevel': 0.09707443936575814, 'depth': 8, 'boosting_type': 'Plain', 'bootstrap_type': 'Bayesian', 'bagging_temperature': 4.691439211185192}. Best is trial 205 with value: 0.890909090909091.
[32m[I 2023-04-20 23:21:20,311][39m Trial 1142 finished with value: 0.8727272727272727 and parameters: {'objective': 'Logloss', 'colsample_bylevel': 0.09831373464895678, 'depth': 10, 'boosting_type': 'Plain', 'bootstrap_type': 'Bayesian', 'bagging_temperature': 5.761895118509082}. Best is trial 205 with value: 0.890909090909091.
[32m[I 2023-04-20 23:21:22,177][39m Trial 1143 finished with value: 0.8727272727272727 and parameters: {'objective': 'CrossEntropy', 'colsample_bylevel': 0.09595605012717481, 'depth': 9, 'boosting_type': 'Plain', 'bootstrap_type': 'Bayesian', 'bagging_temperature': 5.346949892913193}. Best is trial 205 with value: 0.890909090909091.
[32m[I 2023-04-20 23:21:23,668][39m Trial 1144 finished with value: 0.8785046728971961 and parameters: {'objective': 'Logloss', 'colsample_bylevel': 0.09992978876866089, 'depth': 9, 'boosting_type': 'Plain', 'bootstrap_type': 'Bayesian', 'bagging_temperature': 5.051449326346873}. Best is trial 205 with value: 0.890909090909091.
[32m[I 2023-04-20 23:21:24,358][39m Trial 1145 finished with value: 0.890909090909091 and parameters: {'objective': 'Logloss', 'colsample_bylevel': 0.09754267763117441, 'depth': 7, 'boosting_type': 'Plain', 'bootstrap_type': 'Bayesian', 'bagging_temperature': 5.553271426746935}. Best is trial 205 with value: 0.890909090909091.
[32m[I 2023-04-20 23:21:25,502][39m Trial 1146 finished with value: 0.8727272727272727 and parameters: {'objective': 'Logloss', 'colsample_bylevel': 0.09666730514916896, 'depth': 9, 'boosting_type': 'Plain', 'bootstrap_type': 'Bayesian', 'bagging_temperature': 5.409423063837722}. Best is trial 205 with value: 0.890909090909091.
[32m[I 2023-04-20 23:21:26,407][39m Trial 1147 finished with value: 0.8571428571428572 and parameters: {'objective': 'Logloss', 'colsample_bylevel': 0.09418327094936416, 'depth': 6, 'boosting_type': 'Plain', 'bootstrap_type': 'MVS'}. Best is trial 205 with value: 0.890909090909091.
[32m[I 2023-04-20 23:21:27,256][39m Trial 1148 finished with value: 0.8623853211009175 and parameters: {'objective': 'Logloss', 'colsample_bylevel': 0.09708698496844831, 'depth': 7, 'boosting_type': 'Plain', 'bootstrap_type': 'Bayesian', 'bagging_temperature': 4.265123592014539}. Best is trial 205 with value: 0.890909090909091.
[32m[I 2023-04-20 23:21:28,725][39m Trial 1149 finished with value: 0.888888888888889 and parameters: {'objective': 'Logloss', 'colsample_bylevel': 0.09765616641161635, 'depth': 7, 'boosting_type': 'Plain', 'bootstrap_type': 'Bayesian', 'bagging_temperature': 6.552678058868904}. Best is trial 205 with value: 0.890909090909091.
[32m[I 2023-04-20 23:21:29,628][39m Trial 1150 finished with value: 0.8807339449541284 and parameters: {'objective': 'Logloss', 'colsample_bylevel': 0.09807164430840451, 'depth': 7, 'boosting_type': 'Plain', 'bootstrap_type': 'Bayesian', 'bagging_temperature': 6.657235538071347}. Best is trial 205 with value: 0.890909090909091.
[32m[I 2023-04-20 23:21:34,774][39m Trial 1151 finished with value: 0.8495575221238938 and parameters: {'objective': 'Logloss', 'colsample_bylevel': 0.09369628617016423, 'depth': 9, 'boosting_type': 'Ordered', 'bootstrap_type': 'Bayesian', 'bagging_temperature': 9.68651202906275}. Best is trial 205 with value: 0.890909090909091.
[32m[I 2023-04-20 23:21:36,031][39m Trial 1152 finished with value: 0.8648648648648648 and parameters: {'objective': 'CrossEntropy', 'colsample_bylevel': 0.08532657923037731, 'depth': 6, 'boosting_type': 'Plain', 'bootstrap_type': 'Bayesian', 'bagging_temperature': 5.985539267060936}. Best is trial 205 with value: 0.890909090909091.
[32m[I 2023-04-20 23:21:37,074][39m Trial 1153 finished with value: 0.8727272727272727 and parameters: {'objective': 'Logloss', 'colsample_bylevel': 0.09997287958818755, 'depth': 10, 'boosting_type': 'Plain', 'bootstrap_type': 'Bayesian', 'bagging_temperature': 5.4919427254084}. Best is trial 205 with value: 0.890909090909091.
[32m[I 2023-04-20 23:21:37,797][39m Trial 1154 finished with value: 0.875 and parameters: {'objective': 'CrossEntropy', 'colsample_bylevel': 0.08725092935177169, 'depth': 10, 'boosting_type': 'Plain', 'bootstrap_type': 'Bayesian', 'bagging_temperature': 5.68450506867947}. Best is trial 205 with value: 0.890909090909091.
[32m[I 2023-04-20 23:21:38,439][39m Trial 1155 finished with value: 0.888888888888889 and parameters: {'objective': 'CrossEntropy', 'colsample_bylevel': 0.09516493387761185, 'depth': 12, 'boosting_type': 'Plain', 'bootstrap_type': 'Bayesian', 'bagging_temperature': 4.758563144164318}. Best is trial 205 with value: 0.890909090909091.
[32m[I 2023-04-20 23:21:39,526][39m Trial 1156 finished with value: 0.8807339449541284 and parameters: {'objective': 'Logloss', 'colsample_bylevel': 0.09477591800568598, 'depth': 10, 'boosting_type': 'Plain', 'bootstrap_type': 'Bayesian', 'bagging_temperature': 8.396986510660371}. Best is trial 205 with value: 0.890909090909091.
[32m[I 2023-04-20 23:21:40,302][39m Trial 1157 finished with value: 0.8648648648648648 and parameters: {'objective': 'CrossEntropy', 'colsample_bylevel': 0.09252111256695492, 'depth': 7, 'boosting_type': 'Plain', 'bootstrap_type': 'Bayesian', 'bagging_temperature': 8.64752867731694}. Best is trial 205 with value: 0.890909090909091.
[32m[I 2023-04-20 23:21:41,045][39m Trial 1158 finished with value: 0.8672566371681416 and parameters: {'objective': 'CrossEntropy', 'colsample_bylevel': 0.0955664940093915, 'depth': 10, 'boosting_type': 'Plain', 'bootstrap_type': 'Bernoulli', 'subsample': 0.45845945114813735}. Best is trial 205 with value: 0.890909090909091.
[32m[I 2023-04-20 23:21:42,138][39m Trial 1159 finished with value: 0.8828828828828829 and parameters: {'objective': 'Logloss', 'colsample_bylevel': 0.09591956509574276, 'depth': 10, 'boosting_type': 'Plain', 'bootstrap_type': 'Bayesian', 'bagging_temperature': 5.219066846022853}. Best is trial 205 with value: 0.890909090909091.
[32m[I 2023-04-20 23:21:43,365][39m Trial 1160 finished with value: 0.8807339449541284 and parameters: {'objective': 'Logloss', 'colsample_bylevel': 0.09843722278591892, 'depth': 11, 'boosting_type': 'Plain', 'bootstrap_type': 'Bayesian', 'bagging_temperature': 3.965124725168968}. Best is trial 205 with value: 0.890909090909091.
[32m[I 2023-04-20 23:21:44,232][39m Trial 1161 finished with value: 0.8807339449541284 and parameters: {'objective': 'Logloss', 'colsample_bylevel': 0.09727163987783546, 'depth': 7, 'boosting_type': 'Plain', 'bootstrap_type': 'Bayesian', 'bagging_temperature': 5.494316876465277}. Best is trial 205 with value: 0.890909090909091.
[32m[I 2023-04-20 23:21:45,365][39m Trial 1162 finished with value: 0.8828828828828829 and parameters: {'objective': 'Logloss', 'colsample_bylevel': 0.09405527602403672, 'depth': 9, 'boosting_type': 'Plain', 'bootstrap_type': 'Bayesian', 'bagging_temperature': 4.775137389255468}. Best is trial 205 with value: 0.890909090909091.
[32m[I 2023-04-20 23:21:46,659][39m Trial 1163 finished with value: 0.875 and parameters: {'objective': 'Logloss', 'colsample_bylevel': 0.08963649909362681, 'depth': 7, 'boosting_type': 'Plain', 'bootstrap_type': 'Bayesian', 'bagging_temperature': 5.492488064561871}. Best is trial 205 with value: 0.890909090909091.
[32m[I 2023-04-20 23:21:47,343][39m Trial 1164 finished with value: 0.8807339449541284 and parameters: {'objective': 'CrossEntropy', 'colsample_bylevel': 0.09685993565671944, 'depth': 7, 'boosting_type': 'Plain', 'bootstrap_type': 'Bayesian', 'bagging_temperature': 5.899216020797132}. Best is trial 205 with value: 0.890909090909091.
[32m[I 2023-04-20 23:21:48,171][39m Trial 1165 finished with value: 0.8807339449541284 and parameters: {'objective': 'CrossEntropy', 'colsample_bylevel': 0.09638805371397997, 'depth': 10, 'boosting_type': 'Plain', 'bootstrap_type': 'Bayesian', 'bagging_temperature': 4.785510375296661}. Best is trial 205 with value: 0.890909090909091.
[32m[I 2023-04-20 23:21:49,361][39m Trial 1166 finished with value: 0.8807339449541284 and parameters: {'objective': 'CrossEntropy', 'colsample_bylevel': 0.09314368583646154, 'depth': 7, 'boosting_type': 'Plain', 'bootstrap_type': 'Bayesian', 'bagging_temperature': 5.692028050366564}. Best is trial 205 with value: 0.890909090909091.
[32m[I 2023-04-20 23:21:50,226][39m Trial 1167 finished with value: 0.8703703703703703 and parameters: {'objective': 'Logloss', 'colsample_bylevel': 0.09863698246444538, 'depth': 8, 'boosting_type': 'Plain', 'bootstrap_type': 'Bayesian', 'bagging_temperature': 5.5683457439303465}. Best is trial 205 with value: 0.890909090909091.
[32m[I 2023-04-20 23:21:51,158][39m Trial 1168 finished with value: 0.8828828828828829 and parameters: {'objective': 'Logloss', 'colsample_bylevel': 0.09584826165616794, 'depth': 11, 'boosting_type': 'Plain', 'bootstrap_type': 'Bayesian', 'bagging_temperature': 6.040657542660531}. Best is trial 205 with value: 0.890909090909091.
[32m[I 2023-04-20 23:21:51,878][39m Trial 1169 finished with value: 0.8807339449541284 and parameters: {'objective': 'CrossEntropy', 'colsample_bylevel': 0.09625808012301111, 'depth': 10, 'boosting_type': 'Plain', 'bootstrap_type': 'Bayesian', 'bagging_temperature': 5.820792720613309}. Best is trial 205 with value: 0.890909090909091.
[32m[I 2023-04-20 23:21:57,135][39m Trial 1170 finished with value: 0.8571428571428572 and parameters: {'objective': 'Logloss', 'colsample_bylevel': 0.09884869160956115, 'depth': 8, 'boosting_type': 'Ordered', 'bootstrap_type': 'Bayesian', 'bagging_temperature': 5.32002350201273}. Best is trial 205 with value: 0.890909090909091.
[32m[I 2023-04-20 23:21:58,293][39m Trial 1171 finished with value: 0.8727272727272727 and parameters: {'objective': 'Logloss', 'colsample_bylevel': 0.09448356845551543, 'depth': 11, 'boosting_type': 'Plain', 'bootstrap_type': 'MVS'}. Best is trial 205 with value: 0.890909090909091.
[32m[I 2023-04-20 23:21:59,400][39m Trial 1172 finished with value: 0.8623853211009175 and parameters: {'objective': 'Logloss', 'colsample_bylevel': 0.09737194808578536, 'depth': 8, 'boosting_type': 'Plain', 'bootstrap_type': 'Bayesian', 'bagging_temperature': 5.7781533682246575}. Best is trial 205 with value: 0.890909090909091.
[32m[I 2023-04-20 23:22:01,079][39m Trial 1173 finished with value: 0.8785046728971961 and parameters: {'objective': 'Logloss', 'colsample_bylevel': 0.09770441690797409, 'depth': 8, 'boosting_type': 'Plain', 'bootstrap_type': 'Bayesian', 'bagging_temperature': 6.183650620655031}. Best is trial 205 with value: 0.890909090909091.
[32m[I 2023-04-20 23:22:01,961][39m Trial 1174 finished with value: 0.8807339449541284 and parameters: {'objective': 'Logloss', 'colsample_bylevel': 0.09471896658389024, 'depth': 9, 'boosting_type': 'Plain', 'bootstrap_type': 'Bayesian', 'bagging_temperature': 4.403756899120583}. Best is trial 205 with value: 0.890909090909091.
[32m[I 2023-04-20 23:22:02,531][39m Trial 1175 finished with value: 0.8305084745762712 and parameters: {'objective': 'Logloss', 'colsample_bylevel': 0.0436169788772042, 'depth': 11, 'boosting_type': 'Plain', 'bootstrap_type': 'Bayesian', 'bagging_temperature': 3.638774147325043}. Best is trial 205 with value: 0.890909090909091.
[32m[I 2023-04-20 23:22:03,643][39m Trial 1176 finished with value: 0.888888888888889 and parameters: {'objective': 'Logloss', 'colsample_bylevel': 0.09489141156206887, 'depth': 6, 'boosting_type': 'Plain', 'bootstrap_type': 'Bayesian', 'bagging_temperature': 4.495545431018218}. Best is trial 205 with value: 0.890909090909091.
[32m[I 2023-04-20 23:22:04,719][39m Trial 1177 finished with value: 0.8545454545454546 and parameters: {'objective': 'Logloss', 'colsample_bylevel': 0.0925187233939467, 'depth': 6, 'boosting_type': 'Plain', 'bootstrap_type': 'Bayesian', 'bagging_temperature': 6.414399695843296}. Best is trial 205 with value: 0.890909090909091.
[32m[I 2023-04-20 23:22:06,087][39m Trial 1178 finished with value: 0.8623853211009175 and parameters: {'objective': 'Logloss', 'colsample_bylevel': 0.09587354184010274, 'depth': 7, 'boosting_type': 'Plain', 'bootstrap_type': 'Bayesian', 'bagging_temperature': 4.058859482327608}. Best is trial 205 with value: 0.890909090909091.
[32m[I 2023-04-20 23:22:06,760][39m Trial 1179 finished with value: 0.8571428571428572 and parameters: {'objective': 'Logloss', 'colsample_bylevel': 0.09809220365923489, 'depth': 7, 'boosting_type': 'Plain', 'bootstrap_type': 'Bernoulli', 'subsample': 0.6819404248128005}. Best is trial 205 with value: 0.890909090909091.
[32m[I 2023-04-20 23:22:07,857][39m Trial 1180 finished with value: 0.8421052631578947 and parameters: {'objective': 'CrossEntropy', 'colsample_bylevel': 0.07816163151113184, 'depth': 7, 'boosting_type': 'Plain', 'bootstrap_type': 'Bayesian', 'bagging_temperature': 4.164595782485915}. Best is trial 205 with value: 0.890909090909091.
[32m[I 2023-04-20 23:22:08,797][39m Trial 1181 finished with value: 0.8392857142857144 and parameters: {'objective': 'Logloss', 'colsample_bylevel': 0.0834611389621107, 'depth': 9, 'boosting_type': 'Plain', 'bootstrap_type': 'Bayesian', 'bagging_temperature': 4.49362279172783}. Best is trial 205 with value: 0.890909090909091.
[32m[I 2023-04-20 23:22:09,878][39m Trial 1182 finished with value: 0.8807339449541284 and parameters: {'objective': 'Logloss', 'colsample_bylevel': 0.09438754972830928, 'depth': 9, 'boosting_type': 'Plain', 'bootstrap_type': 'Bayesian', 'bagging_temperature': 4.680992603268242}. Best is trial 205 with value: 0.890909090909091.
[32m[I 2023-04-20 23:22:11,027][39m Trial 1183 finished with value: 0.8623853211009175 and parameters: {'objective': 'CrossEntropy', 'colsample_bylevel': 0.09673539728533297, 'depth': 9, 'boosting_type': 'Plain', 'bootstrap_type': 'Bayesian', 'bagging_temperature': 7.030545307455888}. Best is trial 205 with value: 0.890909090909091.
[32m[I 2023-04-20 23:22:12,305][39m Trial 1184 finished with value: 0.8807339449541284 and parameters: {'objective': 'Logloss', 'colsample_bylevel': 0.09972565119512701, 'depth': 8, 'boosting_type': 'Plain', 'bootstrap_type': 'Bayesian', 'bagging_temperature': 4.150860881016998}. Best is trial 205 with value: 0.890909090909091.
[32m[I 2023-04-20 23:22:13,117][39m Trial 1185 finished with value: 0.8703703703703703 and parameters: {'objective': 'CrossEntropy', 'colsample_bylevel': 0.09282516219917865, 'depth': 9, 'boosting_type': 'Plain', 'bootstrap_type': 'Bayesian', 'bagging_temperature': 7.945473551546198}. Best is trial 205 with value: 0.890909090909091.
[32m[I 2023-04-20 23:22:14,314][39m Trial 1186 finished with value: 0.8648648648648648 and parameters: {'objective': 'CrossEntropy', 'colsample_bylevel': 0.09142870880649041, 'depth': 10, 'boosting_type': 'Plain', 'bootstrap_type': 'Bayesian', 'bagging_temperature': 3.998032566575125}. Best is trial 205 with value: 0.890909090909091.
[32m[I 2023-04-20 23:22:15,498][39m Trial 1187 finished with value: 0.8807339449541284 and parameters: {'objective': 'Logloss', 'colsample_bylevel': 0.09587446280315581, 'depth': 10, 'boosting_type': 'Plain', 'bootstrap_type': 'Bayesian', 'bagging_temperature': 4.1141912090985135}. Best is trial 205 with value: 0.890909090909091.
[32m[I 2023-04-20 23:22:20,596][39m Trial 1188 finished with value: 0.8347826086956522 and parameters: {'objective': 'Logloss', 'colsample_bylevel': 0.09515817655185232, 'depth': 7, 'boosting_type': 'Ordered', 'bootstrap_type': 'Bayesian', 'bagging_temperature': 5.303156606589603}. Best is trial 205 with value: 0.890909090909091.
[32m[I 2023-04-20 23:22:21,553][39m Trial 1189 finished with value: 0.8807339449541284 and parameters: {'objective': 'Logloss', 'colsample_bylevel': 0.09994884629764349, 'depth': 7, 'boosting_type': 'Plain', 'bootstrap_type': 'Bayesian', 'bagging_temperature': 2.6555810691312383}. Best is trial 205 with value: 0.890909090909091.
[32m[I 2023-04-20 23:22:22,481][39m Trial 1190 finished with value: 0.8623853211009175 and parameters: {'objective': 'CrossEntropy', 'colsample_bylevel': 0.09714252868494481, 'depth': 7, 'boosting_type': 'Plain', 'bootstrap_type': 'Bayesian', 'bagging_temperature': 4.25963646533189}. Best is trial 205 with value: 0.890909090909091.
[32m[I 2023-04-20 23:22:23,512][39m Trial 1191 finished with value: 0.8807339449541284 and parameters: {'objective': 'Logloss', 'colsample_bylevel': 0.09828928760262805, 'depth': 11, 'boosting_type': 'Plain', 'bootstrap_type': 'Bayesian', 'bagging_temperature': 6.3635969406599715}. Best is trial 205 with value: 0.890909090909091.
[32m[I 2023-04-20 23:22:24,416][39m Trial 1192 finished with value: 0.8571428571428572 and parameters: {'objective': 'Logloss', 'colsample_bylevel': 0.09428771307227522, 'depth': 7, 'boosting_type': 'Plain', 'bootstrap_type': 'MVS'}. Best is trial 205 with value: 0.890909090909091.
