[32m[I 2023-04-21 00:06:00,525][39m Trial 3228 finished with value: 0.8807339449541284 and parameters: {'objective': 'Logloss', 'colsample_bylevel': 0.09860413237727815, 'depth': 8, 'boosting_type': 'Plain', 'bootstrap_type': 'Bayesian', 'bagging_temperature': 7.557183505434545}. Best is trial 1464 with value: 0.8990825688073395.
[32m[I 2023-04-21 00:06:01,305][39m Trial 3229 finished with value: 0.8727272727272727 and parameters: {'objective': 'Logloss', 'colsample_bylevel': 0.0960784141291719, 'depth': 6, 'boosting_type': 'Plain', 'bootstrap_type': 'Bayesian', 'bagging_temperature': 3.5713558350807495}. Best is trial 1464 with value: 0.8990825688073395.
[32m[I 2023-04-21 00:06:02,748][39m Trial 3230 finished with value: 0.8785046728971961 and parameters: {'objective': 'CrossEntropy', 'colsample_bylevel': 0.09114161449900568, 'depth': 9, 'boosting_type': 'Plain', 'bootstrap_type': 'Bayesian', 'bagging_temperature': 6.079501442387873}. Best is trial 1464 with value: 0.8990825688073395.
[32m[I 2023-04-21 00:06:03,853][39m Trial 3231 finished with value: 0.8703703703703703 and parameters: {'objective': 'CrossEntropy', 'colsample_bylevel': 0.09033115568119432, 'depth': 6, 'boosting_type': 'Plain', 'bootstrap_type': 'Bayesian', 'bagging_temperature': 6.3424961749387005}. Best is trial 1464 with value: 0.8990825688073395.
[32m[I 2023-04-21 00:06:05,306][39m Trial 3232 finished with value: 0.890909090909091 and parameters: {'objective': 'Logloss', 'colsample_bylevel': 0.09306718249109819, 'depth': 9, 'boosting_type': 'Plain', 'bootstrap_type': 'Bayesian', 'bagging_temperature': 5.168627903920181}. Best is trial 1464 with value: 0.8990825688073395.
[32m[I 2023-04-21 00:06:06,248][39m Trial 3233 finished with value: 0.8596491228070176 and parameters: {'objective': 'Logloss', 'colsample_bylevel': 0.0914429462326498, 'depth': 9, 'boosting_type': 'Plain', 'bootstrap_type': 'MVS'}. Best is trial 1464 with value: 0.8990825688073395.
[32m[I 2023-04-21 00:06:07,141][39m Trial 3234 finished with value: 0.8672566371681416 and parameters: {'objective': 'Logloss', 'colsample_bylevel': 0.09364309480266489, 'depth': 9, 'boosting_type': 'Plain', 'bootstrap_type': 'Bayesian', 'bagging_temperature': 6.644915860580748}. Best is trial 1464 with value: 0.8990825688073395.
[32m[I 2023-04-21 00:06:08,090][39m Trial 3235 finished with value: 0.8727272727272727 and parameters: {'objective': 'Logloss', 'colsample_bylevel': 0.09661221578562681, 'depth': 8, 'boosting_type': 'Plain', 'bootstrap_type': 'Bayesian', 'bagging_temperature': 3.8483565994619293}. Best is trial 1464 with value: 0.8990825688073395.
[32m[I 2023-04-21 00:06:09,565][39m Trial 3236 finished with value: 0.890909090909091 and parameters: {'objective': 'Logloss', 'colsample_bylevel': 0.09187831048887107, 'depth': 9, 'boosting_type': 'Plain', 'bootstrap_type': 'Bayesian', 'bagging_temperature': 5.318990777232101}. Best is trial 1464 with value: 0.8990825688073395.
[32m[I 2023-04-21 00:06:11,262][39m Trial 3237 finished with value: 0.8807339449541284 and parameters: {'objective': 'Logloss', 'colsample_bylevel': 0.09284962007897142, 'depth': 9, 'boosting_type': 'Plain', 'bootstrap_type': 'Bayesian', 'bagging_temperature': 5.4328001605820555}. Best is trial 1464 with value: 0.8990825688073395.
[32m[I 2023-04-21 00:06:12,179][39m Trial 3238 finished with value: 0.890909090909091 and parameters: {'objective': 'Logloss', 'colsample_bylevel': 0.09419008393894673, 'depth': 8, 'boosting_type': 'Plain', 'bootstrap_type': 'Bayesian', 'bagging_temperature': 5.5910311057586295}. Best is trial 1464 with value: 0.8990825688073395.
[32m[I 2023-04-21 00:06:12,914][39m Trial 3239 finished with value: 0.8807339449541284 and parameters: {'objective': 'Logloss', 'colsample_bylevel': 0.09543690260683169, 'depth': 7, 'boosting_type': 'Plain', 'bootstrap_type': 'Bayesian', 'bagging_temperature': 5.81399750568863}. Best is trial 1464 with value: 0.8990825688073395.
[32m[I 2023-04-21 00:06:14,824][39m Trial 3240 finished with value: 0.888888888888889 and parameters: {'objective': 'Logloss', 'colsample_bylevel': 0.09171376845270166, 'depth': 9, 'boosting_type': 'Plain', 'bootstrap_type': 'Bayesian', 'bagging_temperature': 5.15006763140873}. Best is trial 1464 with value: 0.8990825688073395.
[32m[I 2023-04-21 00:06:15,577][39m Trial 3241 finished with value: 0.888888888888889 and parameters: {'objective': 'Logloss', 'colsample_bylevel': 0.09395540172473596, 'depth': 10, 'boosting_type': 'Plain', 'bootstrap_type': 'Bayesian', 'bagging_temperature': 4.768122161679717}. Best is trial 1464 with value: 0.8990825688073395.
[32m[I 2023-04-21 00:06:16,876][39m Trial 3242 finished with value: 0.8727272727272727 and parameters: {'objective': 'Logloss', 'colsample_bylevel': 0.09562506016285804, 'depth': 8, 'boosting_type': 'Plain', 'bootstrap_type': 'Bayesian', 'bagging_temperature': 4.762731132018433}. Best is trial 1464 with value: 0.8990825688073395.
[32m[I 2023-04-21 00:06:21,910][39m Trial 3243 finished with value: 0.8495575221238938 and parameters: {'objective': 'Logloss', 'colsample_bylevel': 0.08672514564971606, 'depth': 9, 'boosting_type': 'Ordered', 'bootstrap_type': 'Bayesian', 'bagging_temperature': 5.260843838511151}. Best is trial 1464 with value: 0.8990825688073395.
[32m[I 2023-04-21 00:06:24,171][39m Trial 3244 finished with value: 0.8727272727272727 and parameters: {'objective': 'Logloss', 'colsample_bylevel': 0.09236689564152033, 'depth': 9, 'boosting_type': 'Plain', 'bootstrap_type': 'Bayesian', 'bagging_temperature': 5.527342794593945}. Best is trial 1464 with value: 0.8990825688073395.
[32m[I 2023-04-21 00:06:25,497][39m Trial 3245 finished with value: 0.8807339449541284 and parameters: {'objective': 'Logloss', 'colsample_bylevel': 0.09986829840232431, 'depth': 8, 'boosting_type': 'Plain', 'bootstrap_type': 'Bayesian', 'bagging_temperature': 4.9738767675425475}. Best is trial 1464 with value: 0.8990825688073395.
[32m[I 2023-04-21 00:06:26,227][39m Trial 3246 finished with value: 0.8727272727272727 and parameters: {'objective': 'Logloss', 'colsample_bylevel': 0.09770808208113711, 'depth': 7, 'boosting_type': 'Plain', 'bootstrap_type': 'Bayesian', 'bagging_temperature': 6.009900097288909}. Best is trial 1464 with value: 0.8990825688073395.
[32m[I 2023-04-21 00:06:26,987][39m Trial 3247 finished with value: 0.875 and parameters: {'objective': 'Logloss', 'colsample_bylevel': 0.08894638695657751, 'depth': 8, 'boosting_type': 'Plain', 'bootstrap_type': 'Bayesian', 'bagging_temperature': 5.147492347449866}. Best is trial 1464 with value: 0.8990825688073395.
[32m[I 2023-04-21 00:06:28,310][39m Trial 3248 finished with value: 0.8648648648648648 and parameters: {'objective': 'Logloss', 'colsample_bylevel': 0.09011228665652639, 'depth': 8, 'boosting_type': 'Plain', 'bootstrap_type': 'Bayesian', 'bagging_temperature': 3.4793932924935467}. Best is trial 1464 with value: 0.8990825688073395.
[32m[I 2023-04-21 00:06:29,725][39m Trial 3249 finished with value: 0.8807339449541284 and parameters: {'objective': 'Logloss', 'colsample_bylevel': 0.09136258535856227, 'depth': 9, 'boosting_type': 'Plain', 'bootstrap_type': 'Bayesian', 'bagging_temperature': 5.447580674999452}. Best is trial 1464 with value: 0.8990825688073395.
[32m[I 2023-04-21 00:06:30,519][39m Trial 3250 finished with value: 0.888888888888889 and parameters: {'objective': 'CrossEntropy', 'colsample_bylevel': 0.08917523449013663, 'depth': 10, 'boosting_type': 'Plain', 'bootstrap_type': 'Bayesian', 'bagging_temperature': 5.216366399570311}. Best is trial 1464 with value: 0.8990825688073395.
[32m[I 2023-04-21 00:06:31,772][39m Trial 3251 finished with value: 0.8623853211009175 and parameters: {'objective': 'CrossEntropy', 'colsample_bylevel': 0.0960400656390428, 'depth': 10, 'boosting_type': 'Plain', 'bootstrap_type': 'Bayesian', 'bagging_temperature': 4.156146159092795}. Best is trial 1464 with value: 0.8990825688073395.
[32m[I 2023-04-21 00:06:32,957][39m Trial 3252 finished with value: 0.8703703703703703 and parameters: {'objective': 'Logloss', 'colsample_bylevel': 0.0930681276064249, 'depth': 9, 'boosting_type': 'Plain', 'bootstrap_type': 'Bayesian', 'bagging_temperature': 5.659265832467979}. Best is trial 1464 with value: 0.8990825688073395.
[32m[I 2023-04-21 00:06:34,074][39m Trial 3253 finished with value: 0.8807339449541284 and parameters: {'objective': 'Logloss', 'colsample_bylevel': 0.09333477808324993, 'depth': 8, 'boosting_type': 'Plain', 'bootstrap_type': 'Bayesian', 'bagging_temperature': 5.053613494581786}. Best is trial 1464 with value: 0.8990825688073395.
[32m[I 2023-04-21 00:06:35,184][39m Trial 3254 finished with value: 0.8807339449541284 and parameters: {'objective': 'Logloss', 'colsample_bylevel': 0.0917206190569664, 'depth': 8, 'boosting_type': 'Plain', 'bootstrap_type': 'Bayesian', 'bagging_temperature': 5.358479959173316}. Best is trial 1464 with value: 0.8990825688073395.
[32m[I 2023-04-21 00:06:36,150][39m Trial 3255 finished with value: 0.8495575221238938 and parameters: {'objective': 'Logloss', 'colsample_bylevel': 0.09296304776259437, 'depth': 9, 'boosting_type': 'Plain', 'bootstrap_type': 'MVS'}. Best is trial 1464 with value: 0.8990825688073395.
[32m[I 2023-04-21 00:06:37,808][39m Trial 3256 finished with value: 0.8727272727272727 and parameters: {'objective': 'Logloss', 'colsample_bylevel': 0.0916417747455606, 'depth': 9, 'boosting_type': 'Plain', 'bootstrap_type': 'Bayesian', 'bagging_temperature': 5.386231258168051}. Best is trial 1464 with value: 0.8990825688073395.
[32m[I 2023-04-21 00:06:39,648][39m Trial 3257 finished with value: 0.8727272727272727 and parameters: {'objective': 'Logloss', 'colsample_bylevel': 0.0984598177077349, 'depth': 9, 'boosting_type': 'Plain', 'bootstrap_type': 'Bayesian', 'bagging_temperature': 4.935714182978313}. Best is trial 1464 with value: 0.8990825688073395.
[32m[I 2023-04-21 00:06:40,339][39m Trial 3258 finished with value: 0.8376068376068375 and parameters: {'objective': 'Logloss', 'colsample_bylevel': 0.048971374374473235, 'depth': 9, 'boosting_type': 'Plain', 'bootstrap_type': 'Bayesian', 'bagging_temperature': 5.021585701724734}. Best is trial 1464 with value: 0.8990825688073395.
[32m[I 2023-04-21 00:06:41,451][39m Trial 3259 finished with value: 0.8727272727272727 and parameters: {'objective': 'Logloss', 'colsample_bylevel': 0.09993056368425751, 'depth': 9, 'boosting_type': 'Plain', 'bootstrap_type': 'Bayesian', 'bagging_temperature': 5.601718928556653}. Best is trial 1464 with value: 0.8990825688073395.
[32m[I 2023-04-21 00:06:43,030][39m Trial 3260 finished with value: 0.888888888888889 and parameters: {'objective': 'Logloss', 'colsample_bylevel': 0.09648605894793204, 'depth': 9, 'boosting_type': 'Plain', 'bootstrap_type': 'Bayesian', 'bagging_temperature': 7.190429842697343}. Best is trial 1464 with value: 0.8990825688073395.
[32m[I 2023-04-21 00:06:44,279][39m Trial 3261 finished with value: 0.8807339449541284 and parameters: {'objective': 'CrossEntropy', 'colsample_bylevel': 0.0903027336690837, 'depth': 9, 'boosting_type': 'Plain', 'bootstrap_type': 'Bayesian', 'bagging_temperature': 5.169672245407131}. Best is trial 1464 with value: 0.8990825688073395.
[32m[I 2023-04-21 00:06:49,099][39m Trial 3262 finished with value: 0.8571428571428572 and parameters: {'objective': 'CrossEntropy', 'colsample_bylevel': 0.08907419955923782, 'depth': 9, 'boosting_type': 'Ordered', 'bootstrap_type': 'Bayesian', 'bagging_temperature': 4.978953311830777}. Best is trial 1464 with value: 0.8990825688073395.
[32m[I 2023-04-21 00:06:50,977][39m Trial 3263 finished with value: 0.8571428571428572 and parameters: {'objective': 'Logloss', 'colsample_bylevel': 0.0940274761444731, 'depth': 9, 'boosting_type': 'Plain', 'bootstrap_type': 'Bayesian', 'bagging_temperature': 4.751502190793571}. Best is trial 1464 with value: 0.8990825688073395.
[32m[I 2023-04-21 00:06:52,059][39m Trial 3264 finished with value: 0.8623853211009175 and parameters: {'objective': 'Logloss', 'colsample_bylevel': 0.09208572748240616, 'depth': 9, 'boosting_type': 'Plain', 'bootstrap_type': 'Bayesian', 'bagging_temperature': 5.346692526934277}. Best is trial 1464 with value: 0.8990825688073395.
[32m[I 2023-04-21 00:06:53,387][39m Trial 3265 finished with value: 0.888888888888889 and parameters: {'objective': 'Logloss', 'colsample_bylevel': 0.09099410493321931, 'depth': 9, 'boosting_type': 'Plain', 'bootstrap_type': 'Bayesian', 'bagging_temperature': 6.829639809792198}. Best is trial 1464 with value: 0.8990825688073395.
[32m[I 2023-04-21 00:06:54,424][39m Trial 3266 finished with value: 0.851851851851852 and parameters: {'objective': 'Logloss', 'colsample_bylevel': 0.09167189930266292, 'depth': 9, 'boosting_type': 'Plain', 'bootstrap_type': 'Bayesian', 'bagging_temperature': 5.664703772546978}. Best is trial 1464 with value: 0.8990825688073395.
[32m[I 2023-04-21 00:06:55,180][39m Trial 3267 finished with value: 0.8828828828828829 and parameters: {'objective': 'Logloss', 'colsample_bylevel': 0.09339126158462129, 'depth': 8, 'boosting_type': 'Plain', 'bootstrap_type': 'Bayesian', 'bagging_temperature': 5.845127048775952}. Best is trial 1464 with value: 0.8990825688073395.
[32m[I 2023-04-21 00:06:56,357][39m Trial 3268 finished with value: 0.8807339449541284 and parameters: {'objective': 'Logloss', 'colsample_bylevel': 0.09186480707854014, 'depth': 9, 'boosting_type': 'Plain', 'bootstrap_type': 'Bayesian', 'bagging_temperature': 5.3111010955456175}. Best is trial 1464 with value: 0.8990825688073395.
[32m[I 2023-04-21 00:06:58,014][39m Trial 3269 finished with value: 0.8807339449541284 and parameters: {'objective': 'Logloss', 'colsample_bylevel': 0.08865055471442135, 'depth': 9, 'boosting_type': 'Plain', 'bootstrap_type': 'Bayesian', 'bagging_temperature': 5.625371329075684}. Best is trial 1464 with value: 0.8990825688073395.
[32m[I 2023-04-21 00:06:59,571][39m Trial 3270 finished with value: 0.8807339449541284 and parameters: {'objective': 'Logloss', 'colsample_bylevel': 0.09131263041781673, 'depth': 9, 'boosting_type': 'Plain', 'bootstrap_type': 'Bayesian', 'bagging_temperature': 5.251954925466177}. Best is trial 1464 with value: 0.8990825688073395.
[32m[I 2023-04-21 00:07:00,709][39m Trial 3271 finished with value: 0.8727272727272727 and parameters: {'objective': 'Logloss', 'colsample_bylevel': 0.09311717045275049, 'depth': 9, 'boosting_type': 'Plain', 'bootstrap_type': 'Bayesian', 'bagging_temperature': 5.62116833467655}. Best is trial 1464 with value: 0.8990825688073395.
[32m[I 2023-04-21 00:07:01,387][39m Trial 3272 finished with value: 0.8727272727272727 and parameters: {'objective': 'CrossEntropy', 'colsample_bylevel': 0.08706983055806859, 'depth': 10, 'boosting_type': 'Plain', 'bootstrap_type': 'Bayesian', 'bagging_temperature': 5.28331496879043}. Best is trial 1464 with value: 0.8990825688073395.
[32m[I 2023-04-21 00:07:02,706][39m Trial 3273 finished with value: 0.8807339449541284 and parameters: {'objective': 'Logloss', 'colsample_bylevel': 0.09296390972915904, 'depth': 9, 'boosting_type': 'Plain', 'bootstrap_type': 'Bayesian', 'bagging_temperature': 7.028824656057214}. Best is trial 1464 with value: 0.8990825688073395.
[32m[I 2023-04-21 00:07:03,723][39m Trial 3274 finished with value: 0.8828828828828829 and parameters: {'objective': 'Logloss', 'colsample_bylevel': 0.09333283091435646, 'depth': 7, 'boosting_type': 'Plain', 'bootstrap_type': 'Bayesian', 'bagging_temperature': 5.436161949571626}. Best is trial 1464 with value: 0.8990825688073395.
[32m[I 2023-04-21 00:07:05,012][39m Trial 3275 finished with value: 0.8785046728971961 and parameters: {'objective': 'Logloss', 'colsample_bylevel': 0.09020046157478283, 'depth': 10, 'boosting_type': 'Plain', 'bootstrap_type': 'Bayesian', 'bagging_temperature': 5.180177019823954}. Best is trial 1464 with value: 0.8990825688073395.
[32m[I 2023-04-21 00:07:06,422][39m Trial 3276 finished with value: 0.875 and parameters: {'objective': 'Logloss', 'colsample_bylevel': 0.08872054681061657, 'depth': 9, 'boosting_type': 'Plain', 'bootstrap_type': 'Bayesian', 'bagging_temperature': 5.06297916603496}. Best is trial 1464 with value: 0.8990825688073395.
[32m[I 2023-04-21 00:07:07,179][39m Trial 3277 finished with value: 0.8421052631578947 and parameters: {'objective': 'Logloss', 'colsample_bylevel': 0.09115172825431243, 'depth': 10, 'boosting_type': 'Plain', 'bootstrap_type': 'MVS'}. Best is trial 1464 with value: 0.8990825688073395.
[32m[I 2023-04-21 00:07:08,317][39m Trial 3278 finished with value: 0.8727272727272727 and parameters: {'objective': 'Logloss', 'colsample_bylevel': 0.09439855765933237, 'depth': 8, 'boosting_type': 'Plain', 'bootstrap_type': 'Bayesian', 'bagging_temperature': 5.977880801068895}. Best is trial 1464 with value: 0.8990825688073395.
[32m[I 2023-04-21 00:07:09,161][39m Trial 3279 finished with value: 0.8807339449541284 and parameters: {'objective': 'CrossEntropy', 'colsample_bylevel': 0.08873821921135955, 'depth': 9, 'boosting_type': 'Plain', 'bootstrap_type': 'Bayesian', 'bagging_temperature': 5.172178087012288}. Best is trial 1464 with value: 0.8990825688073395.
[32m[I 2023-04-21 00:07:10,597][39m Trial 3280 finished with value: 0.8648648648648648 and parameters: {'objective': 'Logloss', 'colsample_bylevel': 0.09229564103997927, 'depth': 9, 'boosting_type': 'Plain', 'bootstrap_type': 'Bayesian', 'bagging_temperature': 5.277065988130822}. Best is trial 1464 with value: 0.8990825688073395.
[32m[I 2023-04-21 00:07:16,015][39m Trial 3281 finished with value: 0.8545454545454546 and parameters: {'objective': 'Logloss', 'colsample_bylevel': 0.08996128007736805, 'depth': 9, 'boosting_type': 'Ordered', 'bootstrap_type': 'Bayesian', 'bagging_temperature': 5.51022624150775}. Best is trial 1464 with value: 0.8990825688073395.
[32m[I 2023-04-21 00:07:17,335][39m Trial 3282 finished with value: 0.8727272727272727 and parameters: {'objective': 'Logloss', 'colsample_bylevel': 0.09334070323090084, 'depth': 7, 'boosting_type': 'Plain', 'bootstrap_type': 'Bayesian', 'bagging_temperature': 5.576780879463003}. Best is trial 1464 with value: 0.8990825688073395.
[32m[I 2023-04-21 00:07:18,897][39m Trial 3283 finished with value: 0.8727272727272727 and parameters: {'objective': 'Logloss', 'colsample_bylevel': 0.09218934961152504, 'depth': 9, 'boosting_type': 'Plain', 'bootstrap_type': 'Bayesian', 'bagging_temperature': 4.342365541199746}. Best is trial 1464 with value: 0.8990825688073395.
[32m[I 2023-04-21 00:07:20,078][39m Trial 3284 finished with value: 0.8727272727272727 and parameters: {'objective': 'Logloss', 'colsample_bylevel': 0.09349989694587654, 'depth': 6, 'boosting_type': 'Plain', 'bootstrap_type': 'Bayesian', 'bagging_temperature': 5.412040869702902}. Best is trial 1464 with value: 0.8990825688073395.
[32m[I 2023-04-21 00:07:20,912][39m Trial 3285 finished with value: 0.8648648648648648 and parameters: {'objective': 'Logloss', 'colsample_bylevel': 0.09242094215888288, 'depth': 10, 'boosting_type': 'Plain', 'bootstrap_type': 'Bayesian', 'bagging_temperature': 5.6175343683560595}. Best is trial 1464 with value: 0.8990825688073395.
[32m[I 2023-04-21 00:07:21,945][39m Trial 3286 finished with value: 0.8703703703703703 and parameters: {'objective': 'Logloss', 'colsample_bylevel': 0.0912313959996327, 'depth': 8, 'boosting_type': 'Plain', 'bootstrap_type': 'Bayesian', 'bagging_temperature': 5.516879383174151}. Best is trial 1464 with value: 0.8990825688073395.
[32m[I 2023-04-21 00:07:22,990][39m Trial 3287 finished with value: 0.8648648648648648 and parameters: {'objective': 'Logloss', 'colsample_bylevel': 0.09511183886054352, 'depth': 7, 'boosting_type': 'Plain', 'bootstrap_type': 'Bayesian', 'bagging_temperature': 5.564214374944781}. Best is trial 1464 with value: 0.8990825688073395.
[32m[I 2023-04-21 00:07:24,203][39m Trial 3288 finished with value: 0.8807339449541284 and parameters: {'objective': 'Logloss', 'colsample_bylevel': 0.0911784758152564, 'depth': 9, 'boosting_type': 'Plain', 'bootstrap_type': 'Bayesian', 'bagging_temperature': 5.230820718223112}. Best is trial 1464 with value: 0.8990825688073395.
[32m[I 2023-04-21 00:07:25,771][39m Trial 3289 finished with value: 0.8727272727272727 and parameters: {'objective': 'Logloss', 'colsample_bylevel': 0.08977743340913445, 'depth': 9, 'boosting_type': 'Plain', 'bootstrap_type': 'Bayesian', 'bagging_temperature': 5.150835589160265}. Best is trial 1464 with value: 0.8990825688073395.
[32m[I 2023-04-21 00:07:26,480][39m Trial 3290 finished with value: 0.8571428571428572 and parameters: {'objective': 'Logloss', 'colsample_bylevel': 0.08635835420310699, 'depth': 7, 'boosting_type': 'Plain', 'bootstrap_type': 'Bayesian', 'bagging_temperature': 5.2799971080444905}. Best is trial 1464 with value: 0.8990825688073395.
[32m[I 2023-04-21 00:07:28,053][39m Trial 3291 finished with value: 0.8727272727272727 and parameters: {'objective': 'Logloss', 'colsample_bylevel': 0.09377651702558042, 'depth': 9, 'boosting_type': 'Plain', 'bootstrap_type': 'Bayesian', 'bagging_temperature': 3.499616495552461}. Best is trial 1464 with value: 0.8990825688073395.
[32m[I 2023-04-21 00:07:29,090][39m Trial 3292 finished with value: 0.8807339449541284 and parameters: {'objective': 'Logloss', 'colsample_bylevel': 0.09336632109020278, 'depth': 9, 'boosting_type': 'Plain', 'bootstrap_type': 'Bayesian', 'bagging_temperature': 3.873402553169992}. Best is trial 1464 with value: 0.8990825688073395.
[32m[I 2023-04-21 00:07:30,363][39m Trial 3293 finished with value: 0.8596491228070176 and parameters: {'objective': 'Logloss', 'colsample_bylevel': 0.09027300529182801, 'depth': 4, 'boosting_type': 'Plain', 'bootstrap_type': 'Bayesian', 'bagging_temperature': 4.897514166015293}. Best is trial 1464 with value: 0.8990825688073395.
