[32m[I 2023-04-20 23:00:20,801][39m Trial 135 finished with value: 0.8648648648648648 and parameters: {'objective': 'Logloss', 'colsample_bylevel': 0.0927627268950436, 'depth': 11, 'boosting_type': 'Plain', 'bootstrap_type': 'Bayesian', 'bagging_temperature': 3.3571513887512894}. Best is trial 121 with value: 0.888888888888889.
[32m[I 2023-04-20 23:00:22,725][39m Trial 136 finished with value: 0.8727272727272727 and parameters: {'objective': 'Logloss', 'colsample_bylevel': 0.08669742142386634, 'depth': 10, 'boosting_type': 'Plain', 'bootstrap_type': 'Bayesian', 'bagging_temperature': 4.876571528644909}. Best is trial 121 with value: 0.888888888888889.
[32m[I 2023-04-20 23:00:26,623][39m Trial 137 finished with value: 0.8421052631578947 and parameters: {'objective': 'Logloss', 'colsample_bylevel': 0.08066954541394113, 'depth': 10, 'boosting_type': 'Ordered', 'bootstrap_type': 'MVS'}. Best is trial 121 with value: 0.888888888888889.
[32m[I 2023-04-20 23:00:28,108][39m Trial 138 finished with value: 0.875 and parameters: {'objective': 'Logloss', 'colsample_bylevel': 0.08878496511754018, 'depth': 9, 'boosting_type': 'Plain', 'bootstrap_type': 'Bayesian', 'bagging_temperature': 4.075584595960617}. Best is trial 121 with value: 0.888888888888889.
[32m[I 2023-04-20 23:00:29,058][39m Trial 139 finished with value: 0.8727272727272727 and parameters: {'objective': 'Logloss', 'colsample_bylevel': 0.09597686932557885, 'depth': 10, 'boosting_type': 'Plain', 'bootstrap_type': 'Bayesian', 'bagging_temperature': 4.465861112253275}. Best is trial 121 with value: 0.888888888888889.
[32m[I 2023-04-20 23:00:29,846][39m Trial 140 finished with value: 0.8623853211009175 and parameters: {'objective': 'Logloss', 'colsample_bylevel': 0.08555216346403731, 'depth': 11, 'boosting_type': 'Plain', 'bootstrap_type': 'Bayesian', 'bagging_temperature': 3.785642872283704}. Best is trial 121 with value: 0.888888888888889.
[32m[I 2023-04-20 23:00:30,530][39m Trial 141 finished with value: 0.8571428571428572 and parameters: {'objective': 'Logloss', 'colsample_bylevel': 0.07943110305033918, 'depth': 9, 'boosting_type': 'Plain', 'bootstrap_type': 'Bayesian', 'bagging_temperature': 4.296124990160671}. Best is trial 121 with value: 0.888888888888889.
[32m[I 2023-04-20 23:00:31,211][39m Trial 142 finished with value: 0.8703703703703703 and parameters: {'objective': 'Logloss', 'colsample_bylevel': 0.0984683574344931, 'depth': 10, 'boosting_type': 'Plain', 'bootstrap_type': 'Bayesian', 'bagging_temperature': 4.727371668286755}. Best is trial 121 with value: 0.888888888888889.
[32m[I 2023-04-20 23:00:32,233][39m Trial 143 finished with value: 0.875 and parameters: {'objective': 'Logloss', 'colsample_bylevel': 0.08830726677467136, 'depth': 9, 'boosting_type': 'Plain', 'bootstrap_type': 'Bayesian', 'bagging_temperature': 4.0935305968758575}. Best is trial 121 with value: 0.888888888888889.
[32m[I 2023-04-20 23:00:33,820][39m Trial 144 finished with value: 0.8807339449541284 and parameters: {'objective': 'Logloss', 'colsample_bylevel': 0.0923758439075981, 'depth': 8, 'boosting_type': 'Plain', 'bootstrap_type': 'Bayesian', 'bagging_temperature': 3.628051510027454}. Best is trial 121 with value: 0.888888888888889.
[32m[I 2023-04-20 23:00:35,279][39m Trial 145 finished with value: 0.8545454545454546 and parameters: {'objective': 'Logloss', 'colsample_bylevel': 0.08550913095468851, 'depth': 8, 'boosting_type': 'Plain', 'bootstrap_type': 'Bayesian', 'bagging_temperature': 2.7405699541394255}. Best is trial 121 with value: 0.888888888888889.
[32m[I 2023-04-20 23:00:36,082][39m Trial 146 finished with value: 0.8807339449541284 and parameters: {'objective': 'Logloss', 'colsample_bylevel': 0.09294393895043446, 'depth': 8, 'boosting_type': 'Plain', 'bootstrap_type': 'Bayesian', 'bagging_temperature': 3.6335026345874235}. Best is trial 121 with value: 0.888888888888889.
[32m[I 2023-04-20 23:00:37,345][39m Trial 147 finished with value: 0.8623853211009175 and parameters: {'objective': 'Logloss', 'colsample_bylevel': 0.09356801355408927, 'depth': 8, 'boosting_type': 'Plain', 'bootstrap_type': 'Bayesian', 'bagging_temperature': 3.618588616589788}. Best is trial 121 with value: 0.888888888888889.
[32m[I 2023-04-20 23:00:38,038][39m Trial 148 finished with value: 0.8727272727272727 and parameters: {'objective': 'Logloss', 'colsample_bylevel': 0.09813382162389087, 'depth': 8, 'boosting_type': 'Plain', 'bootstrap_type': 'Bayesian', 'bagging_temperature': 3.3092377319809154}. Best is trial 121 with value: 0.888888888888889.
[32m[I 2023-04-20 23:00:38,699][39m Trial 149 finished with value: 0.8571428571428572 and parameters: {'objective': 'Logloss', 'colsample_bylevel': 0.09565035020740269, 'depth': 7, 'boosting_type': 'Plain', 'bootstrap_type': 'Bernoulli', 'subsample': 0.2731560112478076}. Best is trial 121 with value: 0.888888888888889.
[32m[I 2023-04-20 23:00:39,417][39m Trial 150 finished with value: 0.8727272727272727 and parameters: {'objective': 'Logloss', 'colsample_bylevel': 0.09262097151741391, 'depth': 8, 'boosting_type': 'Plain', 'bootstrap_type': 'Bayesian', 'bagging_temperature': 3.7480803153613977}. Best is trial 121 with value: 0.888888888888889.
[32m[I 2023-04-20 23:00:40,722][39m Trial 151 finished with value: 0.875 and parameters: {'objective': 'Logloss', 'colsample_bylevel': 0.08812750703187056, 'depth': 8, 'boosting_type': 'Plain', 'bootstrap_type': 'Bayesian', 'bagging_temperature': 4.109836701072759}. Best is trial 121 with value: 0.888888888888889.
[32m[I 2023-04-20 23:00:41,936][39m Trial 152 finished with value: 0.8468468468468469 and parameters: {'objective': 'Logloss', 'colsample_bylevel': 0.09079393730060926, 'depth': 9, 'boosting_type': 'Plain', 'bootstrap_type': 'Bayesian', 'bagging_temperature': 3.5635570328869193}. Best is trial 121 with value: 0.888888888888889.
[32m[I 2023-04-20 23:00:42,777][39m Trial 153 finished with value: 0.888888888888889 and parameters: {'objective': 'Logloss', 'colsample_bylevel': 0.09768871328086866, 'depth': 8, 'boosting_type': 'Plain', 'bootstrap_type': 'Bayesian', 'bagging_temperature': 3.9071670654556}. Best is trial 121 with value: 0.888888888888889.
[32m[I 2023-04-20 23:00:43,783][39m Trial 154 finished with value: 0.875 and parameters: {'objective': 'Logloss', 'colsample_bylevel': 0.0961017814644649, 'depth': 7, 'boosting_type': 'Plain', 'bootstrap_type': 'Bayesian', 'bagging_temperature': 3.8652695971718916}. Best is trial 121 with value: 0.888888888888889.
[32m[I 2023-04-20 23:00:45,082][39m Trial 155 finished with value: 0.888888888888889 and parameters: {'objective': 'Logloss', 'colsample_bylevel': 0.09779577582654307, 'depth': 8, 'boosting_type': 'Plain', 'bootstrap_type': 'Bayesian', 'bagging_temperature': 3.448346169481115}. Best is trial 121 with value: 0.888888888888889.
[32m[I 2023-04-20 23:00:45,763][39m Trial 156 finished with value: 0.831858407079646 and parameters: {'objective': 'Logloss', 'colsample_bylevel': 0.09758593135874648, 'depth': 8, 'boosting_type': 'Plain', 'bootstrap_type': 'Bayesian', 'bagging_temperature': 2.210146548976199}. Best is trial 121 with value: 0.888888888888889.
[32m[I 2023-04-20 23:00:46,549][39m Trial 157 finished with value: 0.8727272727272727 and parameters: {'objective': 'Logloss', 'colsample_bylevel': 0.09486606061553093, 'depth': 8, 'boosting_type': 'Plain', 'bootstrap_type': 'Bayesian', 'bagging_temperature': 3.388901335764461}. Best is trial 121 with value: 0.888888888888889.
[32m[I 2023-04-20 23:00:47,989][39m Trial 158 finished with value: 0.8727272727272727 and parameters: {'objective': 'Logloss', 'colsample_bylevel': 0.09881953851426041, 'depth': 7, 'boosting_type': 'Plain', 'bootstrap_type': 'Bayesian', 'bagging_temperature': 2.90247456706729}. Best is trial 121 with value: 0.888888888888889.
[32m[I 2023-04-20 23:00:49,237][39m Trial 159 finished with value: 0.8807339449541284 and parameters: {'objective': 'Logloss', 'colsample_bylevel': 0.09700336778809857, 'depth': 8, 'boosting_type': 'Plain', 'bootstrap_type': 'Bayesian', 'bagging_temperature': 3.1633866661175425}. Best is trial 121 with value: 0.888888888888889.
[32m[I 2023-04-20 23:00:50,133][39m Trial 160 finished with value: 0.8703703703703703 and parameters: {'objective': 'Logloss', 'colsample_bylevel': 0.09672934871246121, 'depth': 7, 'boosting_type': 'Plain', 'bootstrap_type': 'Bayesian', 'bagging_temperature': 3.2256134564981065}. Best is trial 121 with value: 0.888888888888889.
[32m[I 2023-04-20 23:00:51,826][39m Trial 161 finished with value: 0.8807339449541284 and parameters: {'objective': 'Logloss', 'colsample_bylevel': 0.093106693714541, 'depth': 8, 'boosting_type': 'Plain', 'bootstrap_type': 'Bayesian', 'bagging_temperature': 3.656892436826145}. Best is trial 121 with value: 0.888888888888889.
[32m[I 2023-04-20 23:00:52,526][39m Trial 162 finished with value: 0.8727272727272727 and parameters: {'objective': 'Logloss', 'colsample_bylevel': 0.09279917947390315, 'depth': 8, 'boosting_type': 'Plain', 'bootstrap_type': 'Bayesian', 'bagging_temperature': 3.6276429606552387}. Best is trial 121 with value: 0.888888888888889.
[32m[I 2023-04-20 23:00:53,162][39m Trial 163 finished with value: 0.8495575221238938 and parameters: {'objective': 'Logloss', 'colsample_bylevel': 0.09808775849720539, 'depth': 8, 'boosting_type': 'Plain', 'bootstrap_type': 'Bayesian', 'bagging_temperature': 2.3922025905474418}. Best is trial 121 with value: 0.888888888888889.
[32m[I 2023-04-20 23:00:53,861][39m Trial 164 finished with value: 0.8807339449541284 and parameters: {'objective': 'Logloss', 'colsample_bylevel': 0.09413186967708558, 'depth': 8, 'boosting_type': 'Plain', 'bootstrap_type': 'Bayesian', 'bagging_temperature': 3.44726459817918}. Best is trial 121 with value: 0.888888888888889.
[32m[I 2023-04-20 23:00:54,704][39m Trial 165 finished with value: 0.8727272727272727 and parameters: {'objective': 'Logloss', 'colsample_bylevel': 0.09511520946187406, 'depth': 8, 'boosting_type': 'Plain', 'bootstrap_type': 'Bayesian', 'bagging_temperature': 3.93763561700967}. Best is trial 121 with value: 0.888888888888889.
[32m[I 2023-04-20 23:00:59,698][39m Trial 166 finished with value: 0.8571428571428572 and parameters: {'objective': 'Logloss', 'colsample_bylevel': 0.09677733580860289, 'depth': 8, 'boosting_type': 'Ordered', 'bootstrap_type': 'Bayesian', 'bagging_temperature': 3.162736925491525}. Best is trial 121 with value: 0.888888888888889.
[32m[I 2023-04-20 23:01:00,959][39m Trial 167 finished with value: 0.8727272727272727 and parameters: {'objective': 'Logloss', 'colsample_bylevel': 0.09075176775853136, 'depth': 8, 'boosting_type': 'Plain', 'bootstrap_type': 'Bayesian', 'bagging_temperature': 3.732978419922557}. Best is trial 121 with value: 0.888888888888889.
[32m[I 2023-04-20 23:01:02,295][39m Trial 168 finished with value: 0.8571428571428572 and parameters: {'objective': 'Logloss', 'colsample_bylevel': 0.09426415414975471, 'depth': 8, 'boosting_type': 'Plain', 'bootstrap_type': 'MVS'}. Best is trial 121 with value: 0.888888888888889.
[32m[I 2023-04-20 23:01:03,286][39m Trial 169 finished with value: 0.8623853211009175 and parameters: {'objective': 'Logloss', 'colsample_bylevel': 0.08201502753310556, 'depth': 8, 'boosting_type': 'Plain', 'bootstrap_type': 'Bayesian', 'bagging_temperature': 3.3459992503315914}. Best is trial 121 with value: 0.888888888888889.
[32m[I 2023-04-20 23:01:03,976][39m Trial 170 finished with value: 0.8807339449541284 and parameters: {'objective': 'Logloss', 'colsample_bylevel': 0.09284927670047931, 'depth': 7, 'boosting_type': 'Plain', 'bootstrap_type': 'Bayesian', 'bagging_temperature': 3.013090760030792}. Best is trial 121 with value: 0.888888888888889.
[32m[I 2023-04-20 23:01:05,486][39m Trial 171 finished with value: 0.8623853211009175 and parameters: {'objective': 'Logloss', 'colsample_bylevel': 0.09186079600013723, 'depth': 7, 'boosting_type': 'Plain', 'bootstrap_type': 'Bayesian', 'bagging_temperature': 3.5365214560687055}. Best is trial 121 with value: 0.888888888888889.
[32m[I 2023-04-20 23:01:06,571][39m Trial 172 finished with value: 0.8807339449541284 and parameters: {'objective': 'Logloss', 'colsample_bylevel': 0.09840662133220189, 'depth': 8, 'boosting_type': 'Plain', 'bootstrap_type': 'Bayesian', 'bagging_temperature': 2.967047160261269}. Best is trial 121 with value: 0.888888888888889.
[32m[I 2023-04-20 23:01:07,194][39m Trial 173 finished with value: 0.8571428571428572 and parameters: {'objective': 'Logloss', 'colsample_bylevel': 0.08943543973260824, 'depth': 7, 'boosting_type': 'Plain', 'bootstrap_type': 'Bayesian', 'bagging_temperature': 3.121445154318425}. Best is trial 121 with value: 0.888888888888889.
[32m[I 2023-04-20 23:01:07,940][39m Trial 174 finished with value: 0.888888888888889 and parameters: {'objective': 'Logloss', 'colsample_bylevel': 0.09576653851858646, 'depth': 8, 'boosting_type': 'Plain', 'bootstrap_type': 'Bayesian', 'bagging_temperature': 3.478490589016453}. Best is trial 121 with value: 0.888888888888889.
[32m[I 2023-04-20 23:01:09,798][39m Trial 175 finished with value: 0.8807339449541284 and parameters: {'objective': 'Logloss', 'colsample_bylevel': 0.09973370415058175, 'depth': 8, 'boosting_type': 'Plain', 'bootstrap_type': 'Bayesian', 'bagging_temperature': 2.9115096168928214}. Best is trial 121 with value: 0.888888888888889.
[32m[I 2023-04-20 23:01:10,947][39m Trial 176 finished with value: 0.8648648648648648 and parameters: {'objective': 'Logloss', 'colsample_bylevel': 0.09568854575995164, 'depth': 9, 'boosting_type': 'Plain', 'bootstrap_type': 'Bayesian', 'bagging_temperature': 2.5692081965581464}. Best is trial 121 with value: 0.888888888888889.
[32m[I 2023-04-20 23:01:12,433][39m Trial 177 finished with value: 0.8807339449541284 and parameters: {'objective': 'Logloss', 'colsample_bylevel': 0.09994051607262996, 'depth': 8, 'boosting_type': 'Plain', 'bootstrap_type': 'Bayesian', 'bagging_temperature': 3.926874373427817}. Best is trial 121 with value: 0.888888888888889.
[32m[I 2023-04-20 23:01:13,406][39m Trial 178 finished with value: 0.8807339449541284 and parameters: {'objective': 'Logloss', 'colsample_bylevel': 0.09832357391765069, 'depth': 8, 'boosting_type': 'Plain', 'bootstrap_type': 'Bayesian', 'bagging_temperature': 4.0095350168111015}. Best is trial 121 with value: 0.888888888888889.
[32m[I 2023-04-20 23:01:14,262][39m Trial 179 finished with value: 0.8807339449541284 and parameters: {'objective': 'Logloss', 'colsample_bylevel': 0.09816183288041802, 'depth': 9, 'boosting_type': 'Plain', 'bootstrap_type': 'Bayesian', 'bagging_temperature': 4.286886491110165}. Best is trial 121 with value: 0.888888888888889.
[32m[I 2023-04-20 23:01:15,475][39m Trial 180 finished with value: 0.8807339449541284 and parameters: {'objective': 'Logloss', 'colsample_bylevel': 0.09761891511546188, 'depth': 9, 'boosting_type': 'Plain', 'bootstrap_type': 'Bayesian', 'bagging_temperature': 4.274604925968601}. Best is trial 121 with value: 0.888888888888889.
[32m[I 2023-04-20 23:01:16,738][39m Trial 181 finished with value: 0.888888888888889 and parameters: {'objective': 'Logloss', 'colsample_bylevel': 0.09675369690852335, 'depth': 9, 'boosting_type': 'Plain', 'bootstrap_type': 'Bayesian', 'bagging_temperature': 4.328109805055511}. Best is trial 121 with value: 0.888888888888889.
[32m[I 2023-04-20 23:01:17,927][39m Trial 182 finished with value: 0.8807339449541284 and parameters: {'objective': 'Logloss', 'colsample_bylevel': 0.09318230957831598, 'depth': 9, 'boosting_type': 'Plain', 'bootstrap_type': 'Bayesian', 'bagging_temperature': 3.481395515508208}. Best is trial 121 with value: 0.888888888888889.
[32m[I 2023-04-20 23:01:18,910][39m Trial 183 finished with value: 0.8807339449541284 and parameters: {'objective': 'Logloss', 'colsample_bylevel': 0.09360955606641208, 'depth': 9, 'boosting_type': 'Plain', 'bootstrap_type': 'Bayesian', 'bagging_temperature': 3.4226362398213963}. Best is trial 121 with value: 0.888888888888889.
[32m[I 2023-04-20 23:01:19,813][39m Trial 184 finished with value: 0.8703703703703703 and parameters: {'objective': 'Logloss', 'colsample_bylevel': 0.09306505149060416, 'depth': 10, 'boosting_type': 'Plain', 'bootstrap_type': 'Bayesian', 'bagging_temperature': 3.394850838444362}. Best is trial 121 with value: 0.888888888888889.
[32m[I 2023-04-20 23:01:20,733][39m Trial 185 finished with value: 0.8495575221238938 and parameters: {'objective': 'Logloss', 'colsample_bylevel': 0.09510847729000714, 'depth': 8, 'boosting_type': 'Plain', 'bootstrap_type': 'Bernoulli', 'subsample': 0.9930549278193379}. Best is trial 121 with value: 0.888888888888889.
[32m[I 2023-04-20 23:01:21,922][39m Trial 186 finished with value: 0.8807339449541284 and parameters: {'objective': 'Logloss', 'colsample_bylevel': 0.09039861648265657, 'depth': 8, 'boosting_type': 'Plain', 'bootstrap_type': 'Bayesian', 'bagging_temperature': 3.6940737775292867}. Best is trial 121 with value: 0.888888888888889.
[32m[I 2023-04-20 23:01:22,835][39m Trial 187 finished with value: 0.8703703703703703 and parameters: {'objective': 'Logloss', 'colsample_bylevel': 0.0963483491479704, 'depth': 9, 'boosting_type': 'Plain', 'bootstrap_type': 'Bayesian', 'bagging_temperature': 3.8054317750719684}. Best is trial 121 with value: 0.888888888888889.
[32m[I 2023-04-20 23:01:23,795][39m Trial 188 finished with value: 0.8703703703703703 and parameters: {'objective': 'Logloss', 'colsample_bylevel': 0.09091953583038664, 'depth': 8, 'boosting_type': 'Plain', 'bootstrap_type': 'Bayesian', 'bagging_temperature': 3.195317786620304}. Best is trial 121 with value: 0.888888888888889.
[32m[I 2023-04-20 23:01:25,386][39m Trial 189 finished with value: 0.8727272727272727 and parameters: {'objective': 'Logloss', 'colsample_bylevel': 0.09535916265895449, 'depth': 8, 'boosting_type': 'Plain', 'bootstrap_type': 'Bayesian', 'bagging_temperature': 3.623860044346355}. Best is trial 121 with value: 0.888888888888889.
[32m[I 2023-04-20 23:01:26,367][39m Trial 190 finished with value: 0.8672566371681416 and parameters: {'objective': 'Logloss', 'colsample_bylevel': 0.09411127037697772, 'depth': 7, 'boosting_type': 'Plain', 'bootstrap_type': 'Bayesian', 'bagging_temperature': 5.20042951800186}. Best is trial 121 with value: 0.888888888888889.
[32m[I 2023-04-20 23:01:27,157][39m Trial 191 finished with value: 0.8421052631578947 and parameters: {'objective': 'Logloss', 'colsample_bylevel': 0.07576446104137753, 'depth': 8, 'boosting_type': 'Plain', 'bootstrap_type': 'Bayesian', 'bagging_temperature': 4.540564704214501}. Best is trial 121 with value: 0.888888888888889.
[32m[I 2023-04-20 23:01:27,893][39m Trial 192 finished with value: 0.8727272727272727 and parameters: {'objective': 'Logloss', 'colsample_bylevel': 0.09705069614917959, 'depth': 8, 'boosting_type': 'Plain', 'bootstrap_type': 'Bayesian', 'bagging_temperature': 2.8692606047842686}. Best is trial 121 with value: 0.888888888888889.
[32m[I 2023-04-20 23:01:29,219][39m Trial 193 finished with value: 0.8727272727272727 and parameters: {'objective': 'Logloss', 'colsample_bylevel': 0.09967461327227704, 'depth': 8, 'boosting_type': 'Plain', 'bootstrap_type': 'Bayesian', 'bagging_temperature': 2.962816177738367}. Best is trial 121 with value: 0.888888888888889.
[32m[I 2023-04-20 23:01:30,264][39m Trial 194 finished with value: 0.8648648648648648 and parameters: {'objective': 'Logloss', 'colsample_bylevel': 0.09982417302632454, 'depth': 7, 'boosting_type': 'Plain', 'bootstrap_type': 'Bayesian', 'bagging_temperature': 4.048487182758075}. Best is trial 121 with value: 0.888888888888889.
[32m[I 2023-04-20 23:01:31,220][39m Trial 195 finished with value: 0.8648648648648648 and parameters: {'objective': 'Logloss', 'colsample_bylevel': 0.09635085535173166, 'depth': 10, 'boosting_type': 'Plain', 'bootstrap_type': 'Bayesian', 'bagging_temperature': 3.866656975231302}. Best is trial 121 with value: 0.888888888888889.
[32m[I 2023-04-20 23:01:32,175][39m Trial 196 finished with value: 0.8807339449541284 and parameters: {'objective': 'Logloss', 'colsample_bylevel': 0.0970640557101641, 'depth': 10, 'boosting_type': 'Plain', 'bootstrap_type': 'Bayesian', 'bagging_temperature': 4.212635710199845}. Best is trial 121 with value: 0.888888888888889.
[32m[I 2023-04-20 23:01:36,656][39m Trial 197 finished with value: 0.8347826086956522 and parameters: {'objective': 'Logloss', 'colsample_bylevel': 0.0998643427015972, 'depth': 9, 'boosting_type': 'Ordered', 'bootstrap_type': 'Bayesian', 'bagging_temperature': 4.822569481578293}. Best is trial 121 with value: 0.888888888888889.
[32m[I 2023-04-20 23:01:38,189][39m Trial 198 finished with value: 0.8807339449541284 and parameters: {'objective': 'Logloss', 'colsample_bylevel': 0.09799716789222826, 'depth': 9, 'boosting_type': 'Plain', 'bootstrap_type': 'Bayesian', 'bagging_temperature': 4.292546911719721}. Best is trial 121 with value: 0.888888888888889.
[32m[I 2023-04-20 23:01:39,813][39m Trial 199 finished with value: 0.875 and parameters: {'objective': 'Logloss', 'colsample_bylevel': 0.09256215719287487, 'depth': 9, 'boosting_type': 'Plain', 'bootstrap_type': 'Bayesian', 'bagging_temperature': 2.1837941696817795}. Best is trial 121 with value: 0.888888888888889.
[32m[I 2023-04-20 23:01:41,195][39m Trial 200 finished with value: 0.8727272727272727 and parameters: {'objective': 'Logloss', 'colsample_bylevel': 0.09397183709105018, 'depth': 8, 'boosting_type': 'Plain', 'bootstrap_type': 'Bayesian', 'bagging_temperature': 2.900816950950295}. Best is trial 121 with value: 0.888888888888889.
