[32m[I 2023-04-21 00:37:27,788][39m Trial 4610 finished with value: 0.888888888888889 and parameters: {'objective': 'CrossEntropy', 'colsample_bylevel': 0.08565252131124752, 'depth': 12, 'boosting_type': 'Plain', 'bootstrap_type': 'Bayesian', 'bagging_temperature': 3.9981689257307065}. Best is trial 1464 with value: 0.8990825688073395.
[32m[I 2023-04-21 00:37:29,283][39m Trial 4611 finished with value: 0.8421052631578947 and parameters: {'objective': 'Logloss', 'colsample_bylevel': 0.07264721277737875, 'depth': 12, 'boosting_type': 'Plain', 'bootstrap_type': 'Bayesian', 'bagging_temperature': 4.984317843230233}. Best is trial 1464 with value: 0.8990825688073395.
[32m[I 2023-04-21 00:37:30,320][39m Trial 4612 finished with value: 0.8807339449541284 and parameters: {'objective': 'Logloss', 'colsample_bylevel': 0.09178076512835565, 'depth': 12, 'boosting_type': 'Plain', 'bootstrap_type': 'Bayesian', 'bagging_temperature': 6.080642675802175}. Best is trial 1464 with value: 0.8990825688073395.
[32m[I 2023-04-21 00:37:31,167][39m Trial 4613 finished with value: 0.888888888888889 and parameters: {'objective': 'CrossEntropy', 'colsample_bylevel': 0.09998872672184186, 'depth': 12, 'boosting_type': 'Plain', 'bootstrap_type': 'Bayesian', 'bagging_temperature': 5.941876396530079}. Best is trial 1464 with value: 0.8990825688073395.
[32m[I 2023-04-21 00:37:32,424][39m Trial 4614 finished with value: 0.890909090909091 and parameters: {'objective': 'Logloss', 'colsample_bylevel': 0.08945294578580454, 'depth': 12, 'boosting_type': 'Plain', 'bootstrap_type': 'Bayesian', 'bagging_temperature': 5.335399700629485}. Best is trial 1464 with value: 0.8990825688073395.
[32m[I 2023-04-21 00:37:33,615][39m Trial 4615 finished with value: 0.8727272727272727 and parameters: {'objective': 'Logloss', 'colsample_bylevel': 0.08784178972077406, 'depth': 12, 'boosting_type': 'Plain', 'bootstrap_type': 'Bayesian', 'bagging_temperature': 5.17940516497335}. Best is trial 1464 with value: 0.8990825688073395.
[32m[I 2023-04-21 00:37:34,600][39m Trial 4616 finished with value: 0.8727272727272727 and parameters: {'objective': 'Logloss', 'colsample_bylevel': 0.09389868719778684, 'depth': 12, 'boosting_type': 'Plain', 'bootstrap_type': 'Bayesian', 'bagging_temperature': 6.166236416267053}. Best is trial 1464 with value: 0.8990825688073395.
[32m[I 2023-04-21 00:37:39,757][39m Trial 4617 finished with value: 0.8571428571428572 and parameters: {'objective': 'CrossEntropy', 'colsample_bylevel': 0.09095253302035933, 'depth': 8, 'boosting_type': 'Ordered', 'bootstrap_type': 'Bayesian', 'bagging_temperature': 5.170084332577443}. Best is trial 1464 with value: 0.8990825688073395.
[32m[I 2023-04-21 00:37:41,257][39m Trial 4618 finished with value: 0.8807339449541284 and parameters: {'objective': 'CrossEntropy', 'colsample_bylevel': 0.0932008186695392, 'depth': 11, 'boosting_type': 'Plain', 'bootstrap_type': 'Bayesian', 'bagging_temperature': 7.106947521077833}. Best is trial 1464 with value: 0.8990825688073395.
[32m[I 2023-04-21 00:37:42,585][39m Trial 4619 finished with value: 0.8623853211009175 and parameters: {'objective': 'Logloss', 'colsample_bylevel': 0.08836874467631657, 'depth': 12, 'boosting_type': 'Plain', 'bootstrap_type': 'Bayesian', 'bagging_temperature': 5.320846390791147}. Best is trial 1464 with value: 0.8990825688073395.
[32m[I 2023-04-21 00:37:43,627][39m Trial 4620 finished with value: 0.8448275862068967 and parameters: {'objective': 'CrossEntropy', 'colsample_bylevel': 0.04371861158360882, 'depth': 10, 'boosting_type': 'Plain', 'bootstrap_type': 'Bayesian', 'bagging_temperature': 6.158067502607725}. Best is trial 1464 with value: 0.8990825688073395.
[32m[I 2023-04-21 00:37:45,013][39m Trial 4621 finished with value: 0.8807339449541284 and parameters: {'objective': 'CrossEntropy', 'colsample_bylevel': 0.09178063806969457, 'depth': 11, 'boosting_type': 'Plain', 'bootstrap_type': 'Bayesian', 'bagging_temperature': 3.9106914081749555}. Best is trial 1464 with value: 0.8990825688073395.
[32m[I 2023-04-21 00:37:45,764][39m Trial 4622 finished with value: 0.8571428571428572 and parameters: {'objective': 'Logloss', 'colsample_bylevel': 0.09332151619249618, 'depth': 12, 'boosting_type': 'Plain', 'bootstrap_type': 'Bayesian', 'bagging_temperature': 7.4475534865425965}. Best is trial 1464 with value: 0.8990825688073395.
[32m[I 2023-04-21 00:37:47,332][39m Trial 4623 finished with value: 0.8727272727272727 and parameters: {'objective': 'Logloss', 'colsample_bylevel': 0.097720477251817, 'depth': 7, 'boosting_type': 'Plain', 'bootstrap_type': 'Bayesian', 'bagging_temperature': 5.743326701068471}. Best is trial 1464 with value: 0.8990825688073395.
[32m[I 2023-04-21 00:37:48,224][39m Trial 4624 finished with value: 0.8807339449541284 and parameters: {'objective': 'Logloss', 'colsample_bylevel': 0.09458426854006718, 'depth': 12, 'boosting_type': 'Plain', 'bootstrap_type': 'Bayesian', 'bagging_temperature': 5.550033210990076}. Best is trial 1464 with value: 0.8990825688073395.
[32m[I 2023-04-21 00:37:48,918][39m Trial 4625 finished with value: 0.8598130841121495 and parameters: {'objective': 'CrossEntropy', 'colsample_bylevel': 0.091445112243401, 'depth': 12, 'boosting_type': 'Plain', 'bootstrap_type': 'Bayesian', 'bagging_temperature': 5.10236816930875}. Best is trial 1464 with value: 0.8990825688073395.
[32m[I 2023-04-21 00:37:50,195][39m Trial 4626 finished with value: 0.8727272727272727 and parameters: {'objective': 'CrossEntropy', 'colsample_bylevel': 0.08881883442668097, 'depth': 12, 'boosting_type': 'Plain', 'bootstrap_type': 'Bayesian', 'bagging_temperature': 5.7822803791583715}. Best is trial 1464 with value: 0.8990825688073395.
[32m[I 2023-04-21 00:37:50,897][39m Trial 4627 finished with value: 0.8275862068965517 and parameters: {'objective': 'Logloss', 'colsample_bylevel': 0.07052910442719693, 'depth': 4, 'boosting_type': 'Plain', 'bootstrap_type': 'Bernoulli', 'subsample': 0.6575972152716625}. Best is trial 1464 with value: 0.8990825688073395.
[32m[I 2023-04-21 00:37:52,296][39m Trial 4628 finished with value: 0.8648648648648648 and parameters: {'objective': 'Logloss', 'colsample_bylevel': 0.0968385353358102, 'depth': 8, 'boosting_type': 'Plain', 'bootstrap_type': 'Bayesian', 'bagging_temperature': 6.301653626182812}. Best is trial 1464 with value: 0.8990825688073395.
[32m[I 2023-04-21 00:37:53,424][39m Trial 4629 finished with value: 0.8648648648648648 and parameters: {'objective': 'CrossEntropy', 'colsample_bylevel': 0.08665057003318001, 'depth': 11, 'boosting_type': 'Plain', 'bootstrap_type': 'Bayesian', 'bagging_temperature': 6.968439772894676}. Best is trial 1464 with value: 0.8990825688073395.
[32m[I 2023-04-21 00:37:54,456][39m Trial 4630 finished with value: 0.8672566371681416 and parameters: {'objective': 'Logloss', 'colsample_bylevel': 0.09300203835005179, 'depth': 10, 'boosting_type': 'Plain', 'bootstrap_type': 'MVS'}. Best is trial 1464 with value: 0.8990825688073395.
[32m[I 2023-04-21 00:37:55,113][39m Trial 4631 finished with value: 0.8214285714285715 and parameters: {'objective': 'Logloss', 'colsample_bylevel': 0.027326637662276616, 'depth': 12, 'boosting_type': 'Plain', 'bootstrap_type': 'Bayesian', 'bagging_temperature': 4.822090018116233}. Best is trial 1464 with value: 0.8990825688073395.
[32m[I 2023-04-21 00:37:56,295][39m Trial 4632 finished with value: 0.8468468468468469 and parameters: {'objective': 'CrossEntropy', 'colsample_bylevel': 0.08669933567781567, 'depth': 12, 'boosting_type': 'Plain', 'bootstrap_type': 'Bayesian', 'bagging_temperature': 6.037460636695699}. Best is trial 1464 with value: 0.8990825688073395.
[32m[I 2023-04-21 00:37:57,595][39m Trial 4633 finished with value: 0.8545454545454546 and parameters: {'objective': 'Logloss', 'colsample_bylevel': 0.08925146418835243, 'depth': 6, 'boosting_type': 'Plain', 'bootstrap_type': 'Bayesian', 'bagging_temperature': 5.505352104552762}. Best is trial 1464 with value: 0.8990825688073395.
[32m[I 2023-04-21 00:37:58,900][39m Trial 4634 finished with value: 0.8807339449541284 and parameters: {'objective': 'CrossEntropy', 'colsample_bylevel': 0.09270413300675377, 'depth': 12, 'boosting_type': 'Plain', 'bootstrap_type': 'Bayesian', 'bagging_temperature': 6.17818903114363}. Best is trial 1464 with value: 0.8990825688073395.
[32m[I 2023-04-21 00:38:00,202][39m Trial 4635 finished with value: 0.888888888888889 and parameters: {'objective': 'Logloss', 'colsample_bylevel': 0.09699561133904173, 'depth': 7, 'boosting_type': 'Plain', 'bootstrap_type': 'Bayesian', 'bagging_temperature': 4.596115891572805}. Best is trial 1464 with value: 0.8990825688073395.
[32m[I 2023-04-21 00:38:05,238][39m Trial 4636 finished with value: 0.8727272727272727 and parameters: {'objective': 'CrossEntropy', 'colsample_bylevel': 0.09716209981936694, 'depth': 9, 'boosting_type': 'Ordered', 'bootstrap_type': 'Bayesian', 'bagging_temperature': 4.563766504839061}. Best is trial 1464 with value: 0.8990825688073395.
[32m[I 2023-04-21 00:38:06,612][39m Trial 4637 finished with value: 0.8545454545454546 and parameters: {'objective': 'Logloss', 'colsample_bylevel': 0.08752335418234146, 'depth': 11, 'boosting_type': 'Plain', 'bootstrap_type': 'Bayesian', 'bagging_temperature': 4.699789189170895}. Best is trial 1464 with value: 0.8990825688073395.
[32m[I 2023-04-21 00:38:07,689][39m Trial 4638 finished with value: 0.8807339449541284 and parameters: {'objective': 'Logloss', 'colsample_bylevel': 0.09367391757600516, 'depth': 12, 'boosting_type': 'Plain', 'bootstrap_type': 'Bayesian', 'bagging_temperature': 6.225672260594501}. Best is trial 1464 with value: 0.8990825688073395.
[32m[I 2023-04-21 00:38:08,610][39m Trial 4639 finished with value: 0.8421052631578947 and parameters: {'objective': 'CrossEntropy', 'colsample_bylevel': 0.08058138436797907, 'depth': 12, 'boosting_type': 'Plain', 'bootstrap_type': 'Bayesian', 'bagging_temperature': 4.870337810716862}. Best is trial 1464 with value: 0.8990825688073395.
[32m[I 2023-04-21 00:38:09,497][39m Trial 4640 finished with value: 0.8727272727272727 and parameters: {'objective': 'Logloss', 'colsample_bylevel': 0.09823620599330046, 'depth': 11, 'boosting_type': 'Plain', 'bootstrap_type': 'Bayesian', 'bagging_temperature': 4.275582408924178}. Best is trial 1464 with value: 0.8990825688073395.
[32m[I 2023-04-21 00:38:10,762][39m Trial 4641 finished with value: 0.8545454545454546 and parameters: {'objective': 'CrossEntropy', 'colsample_bylevel': 0.08811754773429992, 'depth': 11, 'boosting_type': 'Plain', 'bootstrap_type': 'Bayesian', 'bagging_temperature': 5.501118235051036}. Best is trial 1464 with value: 0.8990825688073395.
[32m[I 2023-04-21 00:38:12,004][39m Trial 4642 finished with value: 0.8727272727272727 and parameters: {'objective': 'CrossEntropy', 'colsample_bylevel': 0.08965252854411912, 'depth': 12, 'boosting_type': 'Plain', 'bootstrap_type': 'Bayesian', 'bagging_temperature': 4.125672632265612}. Best is trial 1464 with value: 0.8990825688073395.
[32m[I 2023-04-21 00:38:13,127][39m Trial 4643 finished with value: 0.875 and parameters: {'objective': 'Logloss', 'colsample_bylevel': 0.09189329106523798, 'depth': 12, 'boosting_type': 'Plain', 'bootstrap_type': 'Bayesian', 'bagging_temperature': 5.560634418105287}. Best is trial 1464 with value: 0.8990825688073395.
[32m[I 2023-04-21 00:38:14,557][39m Trial 4644 finished with value: 0.8571428571428572 and parameters: {'objective': 'Logloss', 'colsample_bylevel': 0.08577988626501698, 'depth': 12, 'boosting_type': 'Plain', 'bootstrap_type': 'Bayesian', 'bagging_temperature': 5.284691626161277}. Best is trial 1464 with value: 0.8990825688073395.
[32m[I 2023-04-21 00:38:15,603][39m Trial 4645 finished with value: 0.8703703703703703 and parameters: {'objective': 'Logloss', 'colsample_bylevel': 0.09686676816133706, 'depth': 7, 'boosting_type': 'Plain', 'bootstrap_type': 'Bayesian', 'bagging_temperature': 3.6582816937069533}. Best is trial 1464 with value: 0.8990825688073395.
[32m[I 2023-04-21 00:38:16,406][39m Trial 4646 finished with value: 0.8571428571428572 and parameters: {'objective': 'CrossEntropy', 'colsample_bylevel': 0.08887470084659739, 'depth': 12, 'boosting_type': 'Plain', 'bootstrap_type': 'Bayesian', 'bagging_temperature': 4.745670067402295}. Best is trial 1464 with value: 0.8990825688073395.
[32m[I 2023-04-21 00:38:17,156][39m Trial 4647 finished with value: 0.888888888888889 and parameters: {'objective': 'CrossEntropy', 'colsample_bylevel': 0.09272284285934862, 'depth': 11, 'boosting_type': 'Plain', 'bootstrap_type': 'Bayesian', 'bagging_temperature': 4.595691276392278}. Best is trial 1464 with value: 0.8990825688073395.
[32m[I 2023-04-21 00:38:18,130][39m Trial 4648 finished with value: 0.8828828828828829 and parameters: {'objective': 'Logloss', 'colsample_bylevel': 0.09026791021559774, 'depth': 11, 'boosting_type': 'Plain', 'bootstrap_type': 'Bayesian', 'bagging_temperature': 5.817251725814082}. Best is trial 1464 with value: 0.8990825688073395.
[32m[I 2023-04-21 00:38:19,404][39m Trial 4649 finished with value: 0.8807339449541284 and parameters: {'objective': 'Logloss', 'colsample_bylevel': 0.09229018061426389, 'depth': 10, 'boosting_type': 'Plain', 'bootstrap_type': 'Bayesian', 'bagging_temperature': 4.427062359328811}. Best is trial 1464 with value: 0.8990825688073395.
[32m[I 2023-04-21 00:38:20,544][39m Trial 4650 finished with value: 0.8727272727272727 and parameters: {'objective': 'Logloss', 'colsample_bylevel': 0.09278856250680496, 'depth': 12, 'boosting_type': 'Plain', 'bootstrap_type': 'Bayesian', 'bagging_temperature': 4.368462236537982}. Best is trial 1464 with value: 0.8990825688073395.
[32m[I 2023-04-21 00:38:21,699][39m Trial 4651 finished with value: 0.8495575221238938 and parameters: {'objective': 'Logloss', 'colsample_bylevel': 0.08584179593126517, 'depth': 11, 'boosting_type': 'Plain', 'bootstrap_type': 'MVS'}. Best is trial 1464 with value: 0.8990825688073395.
[32m[I 2023-04-21 00:38:22,831][39m Trial 4652 finished with value: 0.8421052631578947 and parameters: {'objective': 'Logloss', 'colsample_bylevel': 0.08679737794812267, 'depth': 12, 'boosting_type': 'Plain', 'bootstrap_type': 'Bernoulli', 'subsample': 0.6116477758159307}. Best is trial 1464 with value: 0.8990825688073395.
[32m[I 2023-04-21 00:38:28,204][39m Trial 4653 finished with value: 0.8571428571428572 and parameters: {'objective': 'Logloss', 'colsample_bylevel': 0.0920284843593886, 'depth': 12, 'boosting_type': 'Ordered', 'bootstrap_type': 'Bayesian', 'bagging_temperature': 7.232085301546685}. Best is trial 1464 with value: 0.8990825688073395.
[32m[I 2023-04-21 00:38:29,538][39m Trial 4654 finished with value: 0.8173913043478261 and parameters: {'objective': 'Logloss', 'colsample_bylevel': 0.02164972864373267, 'depth': 9, 'boosting_type': 'Plain', 'bootstrap_type': 'Bayesian', 'bagging_temperature': 4.542197791035997}. Best is trial 1464 with value: 0.8990825688073395.
[32m[I 2023-04-21 00:38:30,839][39m Trial 4655 finished with value: 0.875 and parameters: {'objective': 'CrossEntropy', 'colsample_bylevel': 0.0947499893247391, 'depth': 10, 'boosting_type': 'Plain', 'bootstrap_type': 'Bayesian', 'bagging_temperature': 6.533633722907421}. Best is trial 1464 with value: 0.8990825688073395.
[32m[I 2023-04-21 00:38:31,549][39m Trial 4656 finished with value: 0.8703703703703703 and parameters: {'objective': 'CrossEntropy', 'colsample_bylevel': 0.085384915323541, 'depth': 12, 'boosting_type': 'Plain', 'bootstrap_type': 'Bayesian', 'bagging_temperature': 5.089670779733431}. Best is trial 1464 with value: 0.8990825688073395.
[32m[I 2023-04-21 00:38:32,055][39m Trial 4657 finished with value: 0.8648648648648648 and parameters: {'objective': 'CrossEntropy', 'colsample_bylevel': 0.09309304669637714, 'depth': 12, 'boosting_type': 'Plain', 'bootstrap_type': 'Bayesian', 'bagging_temperature': 5.3976519047492975}. Best is trial 1464 with value: 0.8990825688073395.
[32m[I 2023-04-21 00:38:33,254][39m Trial 4658 finished with value: 0.8807339449541284 and parameters: {'objective': 'Logloss', 'colsample_bylevel': 0.08459432355930463, 'depth': 11, 'boosting_type': 'Plain', 'bootstrap_type': 'Bayesian', 'bagging_temperature': 4.57747825769151}. Best is trial 1464 with value: 0.8990825688073395.
[32m[I 2023-04-21 00:38:34,396][39m Trial 4659 finished with value: 0.890909090909091 and parameters: {'objective': 'Logloss', 'colsample_bylevel': 0.09135099881276748, 'depth': 11, 'boosting_type': 'Plain', 'bootstrap_type': 'Bayesian', 'bagging_temperature': 5.633441342730709}. Best is trial 1464 with value: 0.8990825688073395.
[32m[I 2023-04-21 00:38:35,630][39m Trial 4660 finished with value: 0.8727272727272727 and parameters: {'objective': 'Logloss', 'colsample_bylevel': 0.09048170934779472, 'depth': 11, 'boosting_type': 'Plain', 'bootstrap_type': 'Bayesian', 'bagging_temperature': 5.242545800268337}. Best is trial 1464 with value: 0.8990825688073395.
[32m[I 2023-04-21 00:38:36,765][39m Trial 4661 finished with value: 0.8807339449541284 and parameters: {'objective': 'Logloss', 'colsample_bylevel': 0.09617761523610201, 'depth': 7, 'boosting_type': 'Plain', 'bootstrap_type': 'Bayesian', 'bagging_temperature': 4.445901187325752}. Best is trial 1464 with value: 0.8990825688073395.
[32m[I 2023-04-21 00:38:38,247][39m Trial 4662 finished with value: 0.888888888888889 and parameters: {'objective': 'Logloss', 'colsample_bylevel': 0.0954203034513961, 'depth': 8, 'boosting_type': 'Plain', 'bootstrap_type': 'Bayesian', 'bagging_temperature': 5.170642512213888}. Best is trial 1464 with value: 0.8990825688073395.
[32m[I 2023-04-21 00:38:39,239][39m Trial 4663 finished with value: 0.8727272727272727 and parameters: {'objective': 'Logloss', 'colsample_bylevel': 0.08997951365481376, 'depth': 9, 'boosting_type': 'Plain', 'bootstrap_type': 'Bayesian', 'bagging_temperature': 5.0114515106431705}. Best is trial 1464 with value: 0.8990825688073395.
[32m[I 2023-04-21 00:38:40,408][39m Trial 4664 finished with value: 0.8807339449541284 and parameters: {'objective': 'Logloss', 'colsample_bylevel': 0.0999675160988247, 'depth': 12, 'boosting_type': 'Plain', 'bootstrap_type': 'Bayesian', 'bagging_temperature': 4.756828593731796}. Best is trial 1464 with value: 0.8990825688073395.
[32m[I 2023-04-21 00:38:42,216][39m Trial 4665 finished with value: 0.8807339449541284 and parameters: {'objective': 'Logloss', 'colsample_bylevel': 0.09998528111824757, 'depth': 8, 'boosting_type': 'Plain', 'bootstrap_type': 'Bayesian', 'bagging_temperature': 4.339260047846126}. Best is trial 1464 with value: 0.8990825688073395.
[32m[I 2023-04-21 00:38:42,999][39m Trial 4666 finished with value: 0.8807339449541284 and parameters: {'objective': 'Logloss', 'colsample_bylevel': 0.09259735141422362, 'depth': 11, 'boosting_type': 'Plain', 'bootstrap_type': 'Bayesian', 'bagging_temperature': 5.530524648899331}. Best is trial 1464 with value: 0.8990825688073395.
[32m[I 2023-04-21 00:38:44,418][39m Trial 4667 finished with value: 0.8727272727272727 and parameters: {'objective': 'Logloss', 'colsample_bylevel': 0.09320439729315991, 'depth': 11, 'boosting_type': 'Plain', 'bootstrap_type': 'Bayesian', 'bagging_temperature': 7.536040943461677}. Best is trial 1464 with value: 0.8990825688073395.
[32m[I 2023-04-21 00:38:45,268][39m Trial 4668 finished with value: 0.8672566371681416 and parameters: {'objective': 'CrossEntropy', 'colsample_bylevel': 0.09410637396931593, 'depth': 11, 'boosting_type': 'Plain', 'bootstrap_type': 'Bayesian', 'bagging_temperature': 4.149193821732478}. Best is trial 1464 with value: 0.8990825688073395.
[32m[I 2023-04-21 00:38:46,183][39m Trial 4669 finished with value: 0.8648648648648648 and parameters: {'objective': 'Logloss', 'colsample_bylevel': 0.09145723181673124, 'depth': 11, 'boosting_type': 'Plain', 'bootstrap_type': 'Bayesian', 'bagging_temperature': 5.850700443286305}. Best is trial 1464 with value: 0.8990825688073395.
[32m[I 2023-04-21 00:38:51,323][39m Trial 4670 finished with value: 0.8571428571428572 and parameters: {'objective': 'CrossEntropy', 'colsample_bylevel': 0.0957835577656999, 'depth': 10, 'boosting_type': 'Ordered', 'bootstrap_type': 'Bayesian', 'bagging_temperature': 4.375995725836413}. Best is trial 1464 with value: 0.8990825688073395.
[32m[I 2023-04-21 00:38:52,462][39m Trial 4671 finished with value: 0.8807339449541284 and parameters: {'objective': 'CrossEntropy', 'colsample_bylevel': 0.09154756242112154, 'depth': 11, 'boosting_type': 'Plain', 'bootstrap_type': 'Bayesian', 'bagging_temperature': 5.632999024260846}. Best is trial 1464 with value: 0.8990825688073395.
[32m[I 2023-04-21 00:38:54,490][39m Trial 4672 finished with value: 0.8807339449541284 and parameters: {'objective': 'CrossEntropy', 'colsample_bylevel': 0.09007530239528663, 'depth': 8, 'boosting_type': 'Plain', 'bootstrap_type': 'Bayesian', 'bagging_temperature': 4.9810088998260955}. Best is trial 1464 with value: 0.8990825688073395.
[32m[I 2023-04-21 00:38:55,588][39m Trial 4673 finished with value: 0.8648648648648648 and parameters: {'objective': 'Logloss', 'colsample_bylevel': 0.08959838986896872, 'depth': 7, 'boosting_type': 'Plain', 'bootstrap_type': 'Bayesian', 'bagging_temperature': 3.831416499018707}. Best is trial 1464 with value: 0.8990825688073395.
[32m[I 2023-04-21 00:38:56,489][39m Trial 4674 finished with value: 0.8623853211009175 and parameters: {'objective': 'CrossEntropy', 'colsample_bylevel': 0.08695914562724869, 'depth': 12, 'boosting_type': 'Plain', 'bootstrap_type': 'Bernoulli', 'subsample': 0.21869050584653144}. Best is trial 1464 with value: 0.8990825688073395.
