[32m[I 2023-04-21 00:31:33,297][39m Trial 4347 finished with value: 0.8703703703703703 and parameters: {'objective': 'Logloss', 'colsample_bylevel': 0.09602213368952732, 'depth': 6, 'boosting_type': 'Plain', 'bootstrap_type': 'Bayesian', 'bagging_temperature': 6.364342754438129}. Best is trial 1464 with value: 0.8990825688073395.
[32m[I 2023-04-21 00:31:34,099][39m Trial 4348 finished with value: 0.8785046728971961 and parameters: {'objective': 'Logloss', 'colsample_bylevel': 0.09204221480799363, 'depth': 12, 'boosting_type': 'Plain', 'bootstrap_type': 'Bayesian', 'bagging_temperature': 5.646866093986701}. Best is trial 1464 with value: 0.8990825688073395.
[32m[I 2023-04-21 00:31:35,203][39m Trial 4349 finished with value: 0.8376068376068375 and parameters: {'objective': 'Logloss', 'colsample_bylevel': 0.04769310023859413, 'depth': 9, 'boosting_type': 'Plain', 'bootstrap_type': 'Bayesian', 'bagging_temperature': 4.631767278290143}. Best is trial 1464 with value: 0.8990825688073395.
[32m[I 2023-04-21 00:31:36,378][39m Trial 4350 finished with value: 0.8623853211009175 and parameters: {'objective': 'CrossEntropy', 'colsample_bylevel': 0.09251891750231958, 'depth': 12, 'boosting_type': 'Plain', 'bootstrap_type': 'Bayesian', 'bagging_temperature': 6.520578842592894}. Best is trial 1464 with value: 0.8990825688073395.
[32m[I 2023-04-21 00:31:37,464][39m Trial 4351 finished with value: 0.8807339449541284 and parameters: {'objective': 'Logloss', 'colsample_bylevel': 0.09009370699240175, 'depth': 11, 'boosting_type': 'Plain', 'bootstrap_type': 'Bayesian', 'bagging_temperature': 5.759202916564812}. Best is trial 1464 with value: 0.8990825688073395.
[32m[I 2023-04-21 00:31:38,425][39m Trial 4352 finished with value: 0.8648648648648648 and parameters: {'objective': 'Logloss', 'colsample_bylevel': 0.09131530289884073, 'depth': 12, 'boosting_type': 'Plain', 'bootstrap_type': 'Bayesian', 'bagging_temperature': 4.394538797729996}. Best is trial 1464 with value: 0.8990825688073395.
[32m[I 2023-04-21 00:31:39,884][39m Trial 4353 finished with value: 0.8828828828828829 and parameters: {'objective': 'Logloss', 'colsample_bylevel': 0.09319958212596559, 'depth': 7, 'boosting_type': 'Plain', 'bootstrap_type': 'Bayesian', 'bagging_temperature': 6.3761708947658455}. Best is trial 1464 with value: 0.8990825688073395.
[32m[I 2023-04-21 00:31:45,061][39m Trial 4354 finished with value: 0.8347826086956522 and parameters: {'objective': 'Logloss', 'colsample_bylevel': 0.09243266902838622, 'depth': 12, 'boosting_type': 'Ordered', 'bootstrap_type': 'Bayesian', 'bagging_temperature': 4.648990874208146}. Best is trial 1464 with value: 0.8990825688073395.
[32m[I 2023-04-21 00:31:46,357][39m Trial 4355 finished with value: 0.890909090909091 and parameters: {'objective': 'CrossEntropy', 'colsample_bylevel': 0.08904947580310373, 'depth': 12, 'boosting_type': 'Plain', 'bootstrap_type': 'Bayesian', 'bagging_temperature': 5.417492126857838}. Best is trial 1464 with value: 0.8990825688073395.
[32m[I 2023-04-21 00:31:47,584][39m Trial 4356 finished with value: 0.7999999999999999 and parameters: {'objective': 'Logloss', 'colsample_bylevel': 0.01739113333162487, 'depth': 12, 'boosting_type': 'Plain', 'bootstrap_type': 'Bayesian', 'bagging_temperature': 5.449040407560846}. Best is trial 1464 with value: 0.8990825688073395.
[32m[I 2023-04-21 00:31:48,509][39m Trial 4357 finished with value: 0.8785046728971961 and parameters: {'objective': 'Logloss', 'colsample_bylevel': 0.0999049760481181, 'depth': 7, 'boosting_type': 'Plain', 'bootstrap_type': 'Bayesian', 'bagging_temperature': 4.1417617856212425}. Best is trial 1464 with value: 0.8990825688073395.
[32m[I 2023-04-21 00:31:49,695][39m Trial 4358 finished with value: 0.888888888888889 and parameters: {'objective': 'Logloss', 'colsample_bylevel': 0.09466385636269731, 'depth': 12, 'boosting_type': 'Plain', 'bootstrap_type': 'Bayesian', 'bagging_temperature': 5.824807100642952}. Best is trial 1464 with value: 0.8990825688073395.
[32m[I 2023-04-21 00:31:50,912][39m Trial 4359 finished with value: 0.8727272727272727 and parameters: {'objective': 'Logloss', 'colsample_bylevel': 0.09606073580195931, 'depth': 12, 'boosting_type': 'Plain', 'bootstrap_type': 'Bayesian', 'bagging_temperature': 4.459054697401489}. Best is trial 1464 with value: 0.8990825688073395.
[32m[I 2023-04-21 00:31:52,635][39m Trial 4360 finished with value: 0.8727272727272727 and parameters: {'objective': 'Logloss', 'colsample_bylevel': 0.09704392566480387, 'depth': 8, 'boosting_type': 'Plain', 'bootstrap_type': 'Bayesian', 'bagging_temperature': 5.713354059799045}. Best is trial 1464 with value: 0.8990825688073395.
[32m[I 2023-04-21 00:31:53,809][39m Trial 4361 finished with value: 0.8807339449541284 and parameters: {'objective': 'Logloss', 'colsample_bylevel': 0.09194198967935356, 'depth': 9, 'boosting_type': 'Plain', 'bootstrap_type': 'Bayesian', 'bagging_temperature': 7.377732958791982}. Best is trial 1464 with value: 0.8990825688073395.
[32m[I 2023-04-21 00:31:55,022][39m Trial 4362 finished with value: 0.8727272727272727 and parameters: {'objective': 'Logloss', 'colsample_bylevel': 0.09498228591422862, 'depth': 12, 'boosting_type': 'Plain', 'bootstrap_type': 'Bayesian', 'bagging_temperature': 6.698280687691354}. Best is trial 1464 with value: 0.8990825688073395.
[32m[I 2023-04-21 00:31:55,774][39m Trial 4363 finished with value: 0.8807339449541284 and parameters: {'objective': 'Logloss', 'colsample_bylevel': 0.09478757278607333, 'depth': 12, 'boosting_type': 'Plain', 'bootstrap_type': 'Bayesian', 'bagging_temperature': 4.228168906676451}. Best is trial 1464 with value: 0.8990825688073395.
[32m[I 2023-04-21 00:31:56,713][39m Trial 4364 finished with value: 0.8571428571428572 and parameters: {'objective': 'CrossEntropy', 'colsample_bylevel': 0.09659949913009347, 'depth': 7, 'boosting_type': 'Plain', 'bootstrap_type': 'Bernoulli', 'subsample': 0.2665513746749872}. Best is trial 1464 with value: 0.8990825688073395.
[32m[I 2023-04-21 00:31:58,189][39m Trial 4365 finished with value: 0.8807339449541284 and parameters: {'objective': 'Logloss', 'colsample_bylevel': 0.09671586138536421, 'depth': 8, 'boosting_type': 'Plain', 'bootstrap_type': 'Bayesian', 'bagging_temperature': 5.102837168295591}. Best is trial 1464 with value: 0.8990825688073395.
[32m[I 2023-04-21 00:31:59,367][39m Trial 4366 finished with value: 0.8807339449541284 and parameters: {'objective': 'Logloss', 'colsample_bylevel': 0.09349996645863067, 'depth': 7, 'boosting_type': 'Plain', 'bootstrap_type': 'Bayesian', 'bagging_temperature': 5.437506707644869}. Best is trial 1464 with value: 0.8990825688073395.
[32m[I 2023-04-21 00:32:00,712][39m Trial 4367 finished with value: 0.8807339449541284 and parameters: {'objective': 'Logloss', 'colsample_bylevel': 0.09322773905063347, 'depth': 8, 'boosting_type': 'Plain', 'bootstrap_type': 'Bayesian', 'bagging_temperature': 5.1712046369853}. Best is trial 1464 with value: 0.8990825688073395.
[32m[I 2023-04-21 00:32:02,185][39m Trial 4368 finished with value: 0.8347826086956522 and parameters: {'objective': 'Logloss', 'colsample_bylevel': 0.09326320356411953, 'depth': 8, 'boosting_type': 'Plain', 'bootstrap_type': 'MVS'}. Best is trial 1464 with value: 0.8990825688073395.
[32m[I 2023-04-21 00:32:03,094][39m Trial 4369 finished with value: 0.8807339449541284 and parameters: {'objective': 'Logloss', 'colsample_bylevel': 0.09301439184519497, 'depth': 9, 'boosting_type': 'Plain', 'bootstrap_type': 'Bayesian', 'bagging_temperature': 5.21580803096125}. Best is trial 1464 with value: 0.8990825688073395.
[32m[I 2023-04-21 00:32:04,117][39m Trial 4370 finished with value: 0.8727272727272727 and parameters: {'objective': 'Logloss', 'colsample_bylevel': 0.09023033405979344, 'depth': 12, 'boosting_type': 'Plain', 'bootstrap_type': 'Bayesian', 'bagging_temperature': 5.8789760192349565}. Best is trial 1464 with value: 0.8990825688073395.
[32m[I 2023-04-21 00:32:09,044][39m Trial 4371 finished with value: 0.8571428571428572 and parameters: {'objective': 'Logloss', 'colsample_bylevel': 0.09852613228854008, 'depth': 12, 'boosting_type': 'Ordered', 'bootstrap_type': 'Bayesian', 'bagging_temperature': 3.9640298822372095}. Best is trial 1464 with value: 0.8990825688073395.
[32m[I 2023-04-21 00:32:10,402][39m Trial 4372 finished with value: 0.8727272727272727 and parameters: {'objective': 'Logloss', 'colsample_bylevel': 0.09549856645226842, 'depth': 12, 'boosting_type': 'Plain', 'bootstrap_type': 'Bayesian', 'bagging_temperature': 4.719954683238874}. Best is trial 1464 with value: 0.8990825688073395.
[32m[I 2023-04-21 00:32:11,703][39m Trial 4373 finished with value: 0.8828828828828829 and parameters: {'objective': 'Logloss', 'colsample_bylevel': 0.08845015214799072, 'depth': 12, 'boosting_type': 'Plain', 'bootstrap_type': 'Bayesian', 'bagging_temperature': 5.0871765685533346}. Best is trial 1464 with value: 0.8990825688073395.
[32m[I 2023-04-21 00:32:13,902][39m Trial 4374 finished with value: 0.8727272727272727 and parameters: {'objective': 'Logloss', 'colsample_bylevel': 0.08917845802388331, 'depth': 9, 'boosting_type': 'Plain', 'bootstrap_type': 'Bayesian', 'bagging_temperature': 4.957308955554626}. Best is trial 1464 with value: 0.8990825688073395.
[32m[I 2023-04-21 00:32:15,026][39m Trial 4375 finished with value: 0.875 and parameters: {'objective': 'Logloss', 'colsample_bylevel': 0.09126018133065102, 'depth': 11, 'boosting_type': 'Plain', 'bootstrap_type': 'Bayesian', 'bagging_temperature': 7.100948722422757}. Best is trial 1464 with value: 0.8990825688073395.
[32m[I 2023-04-21 00:32:16,273][39m Trial 4376 finished with value: 0.888888888888889 and parameters: {'objective': 'Logloss', 'colsample_bylevel': 0.09410967011403762, 'depth': 9, 'boosting_type': 'Plain', 'bootstrap_type': 'Bayesian', 'bagging_temperature': 3.1256811886027434}. Best is trial 1464 with value: 0.8990825688073395.
[32m[I 2023-04-21 00:32:17,272][39m Trial 4377 finished with value: 0.8727272727272727 and parameters: {'objective': 'Logloss', 'colsample_bylevel': 0.09989375737769626, 'depth': 12, 'boosting_type': 'Plain', 'bootstrap_type': 'Bayesian', 'bagging_temperature': 5.43168639305465}. Best is trial 1464 with value: 0.8990825688073395.
[32m[I 2023-04-21 00:32:18,697][39m Trial 4378 finished with value: 0.890909090909091 and parameters: {'objective': 'Logloss', 'colsample_bylevel': 0.08952656185449201, 'depth': 12, 'boosting_type': 'Plain', 'bootstrap_type': 'Bayesian', 'bagging_temperature': 5.953541944090864}. Best is trial 1464 with value: 0.8990825688073395.
[32m[I 2023-04-21 00:32:19,404][39m Trial 4379 finished with value: 0.8727272727272727 and parameters: {'objective': 'Logloss', 'colsample_bylevel': 0.08812214896991413, 'depth': 12, 'boosting_type': 'Plain', 'bootstrap_type': 'Bayesian', 'bagging_temperature': 5.297839839735718}. Best is trial 1464 with value: 0.8990825688073395.
[32m[I 2023-04-21 00:32:20,872][39m Trial 4380 finished with value: 0.8828828828828829 and parameters: {'objective': 'Logloss', 'colsample_bylevel': 0.09686535020726643, 'depth': 7, 'boosting_type': 'Plain', 'bootstrap_type': 'Bayesian', 'bagging_temperature': 6.425006153944418}. Best is trial 1464 with value: 0.8990825688073395.
[32m[I 2023-04-21 00:32:21,994][39m Trial 4381 finished with value: 0.8807339449541284 and parameters: {'objective': 'Logloss', 'colsample_bylevel': 0.09504892541563068, 'depth': 12, 'boosting_type': 'Plain', 'bootstrap_type': 'Bayesian', 'bagging_temperature': 4.966894504886142}. Best is trial 1464 with value: 0.8990825688073395.
[32m[I 2023-04-21 00:32:22,795][39m Trial 4382 finished with value: 0.8727272727272727 and parameters: {'objective': 'CrossEntropy', 'colsample_bylevel': 0.08865561463756755, 'depth': 12, 'boosting_type': 'Plain', 'bootstrap_type': 'Bayesian', 'bagging_temperature': 4.568853702590489}. Best is trial 1464 with value: 0.8990825688073395.
[32m[I 2023-04-21 00:32:23,766][39m Trial 4383 finished with value: 0.8648648648648648 and parameters: {'objective': 'Logloss', 'colsample_bylevel': 0.09720149113220902, 'depth': 9, 'boosting_type': 'Plain', 'bootstrap_type': 'Bayesian', 'bagging_temperature': 4.752838601430178}. Best is trial 1464 with value: 0.8990825688073395.
[32m[I 2023-04-21 00:32:24,930][39m Trial 4384 finished with value: 0.8468468468468469 and parameters: {'objective': 'CrossEntropy', 'colsample_bylevel': 0.08668535939573802, 'depth': 12, 'boosting_type': 'Plain', 'bootstrap_type': 'Bayesian', 'bagging_temperature': 4.908880403448651}. Best is trial 1464 with value: 0.8990825688073395.
[32m[I 2023-04-21 00:32:25,687][39m Trial 4385 finished with value: 0.8623853211009175 and parameters: {'objective': 'Logloss', 'colsample_bylevel': 0.0883925959247385, 'depth': 12, 'boosting_type': 'Plain', 'bootstrap_type': 'Bayesian', 'bagging_temperature': 5.316726353822034}. Best is trial 1464 with value: 0.8990825688073395.
[32m[I 2023-04-21 00:32:26,865][39m Trial 4386 finished with value: 0.8807339449541284 and parameters: {'objective': 'CrossEntropy', 'colsample_bylevel': 0.08878641536512387, 'depth': 12, 'boosting_type': 'Plain', 'bootstrap_type': 'Bayesian', 'bagging_temperature': 5.381154842724209}. Best is trial 1464 with value: 0.8990825688073395.
[32m[I 2023-04-21 00:32:27,866][39m Trial 4387 finished with value: 0.8421052631578947 and parameters: {'objective': 'CrossEntropy', 'colsample_bylevel': 0.09378808201664901, 'depth': 10, 'boosting_type': 'Plain', 'bootstrap_type': 'Bernoulli', 'subsample': 0.5845693043825582}. Best is trial 1464 with value: 0.8990825688073395.
[32m[I 2023-04-21 00:32:29,117][39m Trial 4388 finished with value: 0.8807339449541284 and parameters: {'objective': 'Logloss', 'colsample_bylevel': 0.09283453480610603, 'depth': 12, 'boosting_type': 'Plain', 'bootstrap_type': 'Bayesian', 'bagging_temperature': 5.409092315008365}. Best is trial 1464 with value: 0.8990825688073395.
[32m[I 2023-04-21 00:32:30,194][39m Trial 4389 finished with value: 0.8571428571428572 and parameters: {'objective': 'Logloss', 'colsample_bylevel': 0.09285497807100669, 'depth': 5, 'boosting_type': 'Plain', 'bootstrap_type': 'MVS'}. Best is trial 1464 with value: 0.8990825688073395.
[32m[I 2023-04-21 00:32:35,304][39m Trial 4390 finished with value: 0.8347826086956522 and parameters: {'objective': 'Logloss', 'colsample_bylevel': 0.09870247279760566, 'depth': 12, 'boosting_type': 'Ordered', 'bootstrap_type': 'Bayesian', 'bagging_temperature': 4.29528330067322}. Best is trial 1464 with value: 0.8990825688073395.
[32m[I 2023-04-21 00:32:37,029][39m Trial 4391 finished with value: 0.8596491228070176 and parameters: {'objective': 'CrossEntropy', 'colsample_bylevel': 0.05442987265234403, 'depth': 9, 'boosting_type': 'Plain', 'bootstrap_type': 'Bayesian', 'bagging_temperature': 6.214614956375575}. Best is trial 1464 with value: 0.8990825688073395.
[32m[I 2023-04-21 00:32:38,083][39m Trial 4392 finished with value: 0.8672566371681416 and parameters: {'objective': 'CrossEntropy', 'colsample_bylevel': 0.08687151637846403, 'depth': 10, 'boosting_type': 'Plain', 'bootstrap_type': 'Bayesian', 'bagging_temperature': 6.003415562819253}. Best is trial 1464 with value: 0.8990825688073395.
[32m[I 2023-04-21 00:32:38,853][39m Trial 4393 finished with value: 0.8807339449541284 and parameters: {'objective': 'CrossEntropy', 'colsample_bylevel': 0.08397441653911852, 'depth': 11, 'boosting_type': 'Plain', 'bootstrap_type': 'Bayesian', 'bagging_temperature': 5.2630724193473375}. Best is trial 1464 with value: 0.8990825688073395.
[32m[I 2023-04-21 00:32:39,598][39m Trial 4394 finished with value: 0.8727272727272727 and parameters: {'objective': 'Logloss', 'colsample_bylevel': 0.09646241566440311, 'depth': 12, 'boosting_type': 'Plain', 'bootstrap_type': 'Bayesian', 'bagging_temperature': 6.023530901031592}. Best is trial 1464 with value: 0.8990825688073395.
[32m[I 2023-04-21 00:32:40,922][39m Trial 4395 finished with value: 0.8672566371681416 and parameters: {'objective': 'CrossEntropy', 'colsample_bylevel': 0.05699828839831279, 'depth': 10, 'boosting_type': 'Plain', 'bootstrap_type': 'Bayesian', 'bagging_temperature': 5.950797023303126}. Best is trial 1464 with value: 0.8990825688073395.
[32m[I 2023-04-21 00:32:42,522][39m Trial 4396 finished with value: 0.8545454545454546 and parameters: {'objective': 'Logloss', 'colsample_bylevel': 0.081781426108831, 'depth': 9, 'boosting_type': 'Plain', 'bootstrap_type': 'Bayesian', 'bagging_temperature': 5.115218294967621}. Best is trial 1464 with value: 0.8990825688073395.
[32m[I 2023-04-21 00:32:43,686][39m Trial 4397 finished with value: 0.8807339449541284 and parameters: {'objective': 'Logloss', 'colsample_bylevel': 0.09432644429521611, 'depth': 12, 'boosting_type': 'Plain', 'bootstrap_type': 'Bayesian', 'bagging_temperature': 5.798871958036655}. Best is trial 1464 with value: 0.8990825688073395.
[32m[I 2023-04-21 00:32:45,289][39m Trial 4398 finished with value: 0.8807339449541284 and parameters: {'objective': 'Logloss', 'colsample_bylevel': 0.09849737231040068, 'depth': 9, 'boosting_type': 'Plain', 'bootstrap_type': 'Bayesian', 'bagging_temperature': 4.644633520197188}. Best is trial 1464 with value: 0.8990825688073395.
[32m[I 2023-04-21 00:32:46,550][39m Trial 4399 finished with value: 0.8495575221238938 and parameters: {'objective': 'Logloss', 'colsample_bylevel': 0.09710425722591622, 'depth': 9, 'boosting_type': 'Plain', 'bootstrap_type': 'Bayesian', 'bagging_temperature': 4.6537499858116895}. Best is trial 1464 with value: 0.8990825688073395.
[32m[I 2023-04-21 00:32:47,455][39m Trial 4400 finished with value: 0.8727272727272727 and parameters: {'objective': 'CrossEntropy', 'colsample_bylevel': 0.09014004167842998, 'depth': 12, 'boosting_type': 'Plain', 'bootstrap_type': 'Bayesian', 'bagging_temperature': 6.602001296771455}. Best is trial 1464 with value: 0.8990825688073395.
[32m[I 2023-04-21 00:32:48,909][39m Trial 4401 finished with value: 0.888888888888889 and parameters: {'objective': 'Logloss', 'colsample_bylevel': 0.09470089754997234, 'depth': 8, 'boosting_type': 'Plain', 'bootstrap_type': 'Bayesian', 'bagging_temperature': 4.932009889182402}. Best is trial 1464 with value: 0.8990825688073395.
[32m[I 2023-04-21 00:32:49,703][39m Trial 4402 finished with value: 0.8807339449541284 and parameters: {'objective': 'CrossEntropy', 'colsample_bylevel': 0.09531022936765195, 'depth': 10, 'boosting_type': 'Plain', 'bootstrap_type': 'Bayesian', 'bagging_temperature': 4.0431610182681315}. Best is trial 1464 with value: 0.8990825688073395.
[32m[I 2023-04-21 00:32:50,931][39m Trial 4403 finished with value: 0.8727272727272727 and parameters: {'objective': 'Logloss', 'colsample_bylevel': 0.09247813663111554, 'depth': 12, 'boosting_type': 'Plain', 'bootstrap_type': 'Bayesian', 'bagging_temperature': 5.598322450368113}. Best is trial 1464 with value: 0.8990825688073395.
[32m[I 2023-04-21 00:32:52,264][39m Trial 4404 finished with value: 0.8807339449541284 and parameters: {'objective': 'Logloss', 'colsample_bylevel': 0.09075506663997232, 'depth': 12, 'boosting_type': 'Plain', 'bootstrap_type': 'Bayesian', 'bagging_temperature': 5.534563538828808}. Best is trial 1464 with value: 0.8990825688073395.
[32m[I 2023-04-21 00:32:53,258][39m Trial 4405 finished with value: 0.888888888888889 and parameters: {'objective': 'CrossEntropy', 'colsample_bylevel': 0.09125469477809389, 'depth': 9, 'boosting_type': 'Plain', 'bootstrap_type': 'Bayesian', 'bagging_temperature': 6.682545004587166}. Best is trial 1464 with value: 0.8990825688073395.
[32m[I 2023-04-21 00:32:54,053][39m Trial 4406 finished with value: 0.8648648648648648 and parameters: {'objective': 'Logloss', 'colsample_bylevel': 0.09096052156050827, 'depth': 12, 'boosting_type': 'Plain', 'bootstrap_type': 'Bayesian', 'bagging_temperature': 5.658705349654712}. Best is trial 1464 with value: 0.8990825688073395.
[32m[I 2023-04-21 00:32:55,297][39m Trial 4407 finished with value: 0.8807339449541284 and parameters: {'objective': 'CrossEntropy', 'colsample_bylevel': 0.08945968027250643, 'depth': 12, 'boosting_type': 'Plain', 'bootstrap_type': 'Bayesian', 'bagging_temperature': 5.456764430799552}. Best is trial 1464 with value: 0.8990825688073395.
[32m[I 2023-04-21 00:32:56,482][39m Trial 4408 finished with value: 0.8648648648648648 and parameters: {'objective': 'CrossEntropy', 'colsample_bylevel': 0.08890254965519212, 'depth': 12, 'boosting_type': 'Plain', 'bootstrap_type': 'Bayesian', 'bagging_temperature': 5.091204895783818}. Best is trial 1464 with value: 0.8990825688073395.
[32m[I 2023-04-21 00:32:57,568][39m Trial 4409 finished with value: 0.875 and parameters: {'objective': 'CrossEntropy', 'colsample_bylevel': 0.08766264848236542, 'depth': 12, 'boosting_type': 'Plain', 'bootstrap_type': 'Bayesian', 'bagging_temperature': 5.360459122898292}. Best is trial 1464 with value: 0.8990825688073395.
[32m[I 2023-04-21 00:33:02,544][39m Trial 4410 finished with value: 0.8275862068965517 and parameters: {'objective': 'Logloss', 'colsample_bylevel': 0.0945591464119907, 'depth': 12, 'boosting_type': 'Ordered', 'bootstrap_type': 'Bernoulli', 'subsample': 0.12202530967635605}. Best is trial 1464 with value: 0.8990825688073395.
[32m[I 2023-04-21 00:33:03,867][39m Trial 4411 finished with value: 0.890909090909091 and parameters: {'objective': 'CrossEntropy', 'colsample_bylevel': 0.09382869430262347, 'depth': 12, 'boosting_type': 'Plain', 'bootstrap_type': 'Bayesian', 'bagging_temperature': 5.851939712746167}. Best is trial 1464 with value: 0.8990825688073395.
[32m[I 2023-04-21 00:33:04,813][39m Trial 4412 finished with value: 0.8571428571428572 and parameters: {'objective': 'CrossEntropy', 'colsample_bylevel': 0.08560196682275073, 'depth': 12, 'boosting_type': 'Plain', 'bootstrap_type': 'MVS'}. Best is trial 1464 with value: 0.8990825688073395.
