[32m[I 2023-04-21 00:12:18,982][39m Trial 3492 finished with value: 0.8727272727272727 and parameters: {'objective': 'CrossEntropy', 'colsample_bylevel': 0.09078020394859446, 'depth': 8, 'boosting_type': 'Plain', 'bootstrap_type': 'Bayesian', 'bagging_temperature': 5.442668762210029}. Best is trial 1464 with value: 0.8990825688073395.
[32m[I 2023-04-21 00:12:20,434][39m Trial 3493 finished with value: 0.8727272727272727 and parameters: {'objective': 'Logloss', 'colsample_bylevel': 0.09523011222891563, 'depth': 9, 'boosting_type': 'Plain', 'bootstrap_type': 'Bayesian', 'bagging_temperature': 5.185016952977212}. Best is trial 1464 with value: 0.8990825688073395.
[32m[I 2023-04-21 00:12:21,538][39m Trial 3494 finished with value: 0.8468468468468469 and parameters: {'objective': 'CrossEntropy', 'colsample_bylevel': 0.06894043849810969, 'depth': 9, 'boosting_type': 'Plain', 'bootstrap_type': 'Bayesian', 'bagging_temperature': 5.509739012865372}. Best is trial 1464 with value: 0.8990825688073395.
[32m[I 2023-04-21 00:12:22,385][39m Trial 3495 finished with value: 0.8571428571428572 and parameters: {'objective': 'CrossEntropy', 'colsample_bylevel': 0.09867110598887689, 'depth': 8, 'boosting_type': 'Plain', 'bootstrap_type': 'MVS'}. Best is trial 1464 with value: 0.8990825688073395.
[32m[I 2023-04-21 00:12:23,502][39m Trial 3496 finished with value: 0.875 and parameters: {'objective': 'CrossEntropy', 'colsample_bylevel': 0.09873979896671095, 'depth': 10, 'boosting_type': 'Plain', 'bootstrap_type': 'Bayesian', 'bagging_temperature': 4.82551356296431}. Best is trial 1464 with value: 0.8990825688073395.
[32m[I 2023-04-21 00:12:24,698][39m Trial 3497 finished with value: 0.8828828828828829 and parameters: {'objective': 'Logloss', 'colsample_bylevel': 0.0964414588695281, 'depth': 7, 'boosting_type': 'Plain', 'bootstrap_type': 'Bayesian', 'bagging_temperature': 5.586329450594513}. Best is trial 1464 with value: 0.8990825688073395.
[32m[I 2023-04-21 00:12:26,348][39m Trial 3498 finished with value: 0.8727272727272727 and parameters: {'objective': 'Logloss', 'colsample_bylevel': 0.09857321951297371, 'depth': 8, 'boosting_type': 'Plain', 'bootstrap_type': 'Bayesian', 'bagging_temperature': 5.408122822258596}. Best is trial 1464 with value: 0.8990825688073395.
[32m[I 2023-04-21 00:12:27,032][39m Trial 3499 finished with value: 0.8679245283018867 and parameters: {'objective': 'CrossEntropy', 'colsample_bylevel': 0.0998909568933648, 'depth': 10, 'boosting_type': 'Plain', 'bootstrap_type': 'Bayesian', 'bagging_temperature': 5.648283977430693}. Best is trial 1464 with value: 0.8990825688073395.
[32m[I 2023-04-21 00:12:27,707][39m Trial 3500 finished with value: 0.8703703703703703 and parameters: {'objective': 'CrossEntropy', 'colsample_bylevel': 0.09986438549512727, 'depth': 10, 'boosting_type': 'Plain', 'bootstrap_type': 'Bayesian', 'bagging_temperature': 5.846794117678529}. Best is trial 1464 with value: 0.8990825688073395.
[32m[I 2023-04-21 00:12:28,770][39m Trial 3501 finished with value: 0.8807339449541284 and parameters: {'objective': 'Logloss', 'colsample_bylevel': 0.09246565140721145, 'depth': 9, 'boosting_type': 'Plain', 'bootstrap_type': 'Bayesian', 'bagging_temperature': 3.71054449504993}. Best is trial 1464 with value: 0.8990825688073395.
[32m[I 2023-04-21 00:12:30,621][39m Trial 3502 finished with value: 0.8727272727272727 and parameters: {'objective': 'CrossEntropy', 'colsample_bylevel': 0.08723594214163856, 'depth': 9, 'boosting_type': 'Plain', 'bootstrap_type': 'Bayesian', 'bagging_temperature': 5.2756163690723215}. Best is trial 1464 with value: 0.8990825688073395.
[32m[I 2023-04-21 00:12:31,847][39m Trial 3503 finished with value: 0.8545454545454546 and parameters: {'objective': 'CrossEntropy', 'colsample_bylevel': 0.08976824483733586, 'depth': 9, 'boosting_type': 'Plain', 'bootstrap_type': 'Bayesian', 'bagging_temperature': 4.860189785537147}. Best is trial 1464 with value: 0.8990825688073395.
[32m[I 2023-04-21 00:12:32,708][39m Trial 3504 finished with value: 0.8703703703703703 and parameters: {'objective': 'Logloss', 'colsample_bylevel': 0.0900983713107297, 'depth': 8, 'boosting_type': 'Plain', 'bootstrap_type': 'Bayesian', 'bagging_temperature': 5.28284076278576}. Best is trial 1464 with value: 0.8990825688073395.
[32m[I 2023-04-21 00:12:33,610][39m Trial 3505 finished with value: 0.8727272727272727 and parameters: {'objective': 'Logloss', 'colsample_bylevel': 0.0913313195628524, 'depth': 9, 'boosting_type': 'Plain', 'bootstrap_type': 'Bayesian', 'bagging_temperature': 5.729758553330138}. Best is trial 1464 with value: 0.8990825688073395.
[32m[I 2023-04-21 00:12:34,759][39m Trial 3506 finished with value: 0.8785046728971961 and parameters: {'objective': 'Logloss', 'colsample_bylevel': 0.09131985039814841, 'depth': 9, 'boosting_type': 'Plain', 'bootstrap_type': 'Bayesian', 'bagging_temperature': 5.614610548410607}. Best is trial 1464 with value: 0.8990825688073395.
[32m[I 2023-04-21 00:12:39,376][39m Trial 3507 finished with value: 0.8347826086956522 and parameters: {'objective': 'Logloss', 'colsample_bylevel': 0.09548945535661431, 'depth': 8, 'boosting_type': 'Ordered', 'bootstrap_type': 'Bayesian', 'bagging_temperature': 5.6765308781450114}. Best is trial 1464 with value: 0.8990825688073395.
[32m[I 2023-04-21 00:12:40,817][39m Trial 3508 finished with value: 0.8807339449541284 and parameters: {'objective': 'CrossEntropy', 'colsample_bylevel': 0.09419965395893191, 'depth': 9, 'boosting_type': 'Plain', 'bootstrap_type': 'Bayesian', 'bagging_temperature': 5.834618184649112}. Best is trial 1464 with value: 0.8990825688073395.
[32m[I 2023-04-21 00:12:42,311][39m Trial 3509 finished with value: 0.8623853211009175 and parameters: {'objective': 'Logloss', 'colsample_bylevel': 0.09476633822898106, 'depth': 9, 'boosting_type': 'Plain', 'bootstrap_type': 'Bayesian', 'bagging_temperature': 5.1217611612134615}. Best is trial 1464 with value: 0.8990825688073395.
[32m[I 2023-04-21 00:12:43,605][39m Trial 3510 finished with value: 0.8648648648648648 and parameters: {'objective': 'Logloss', 'colsample_bylevel': 0.08707665574479637, 'depth': 8, 'boosting_type': 'Plain', 'bootstrap_type': 'Bayesian', 'bagging_temperature': 5.446889873044475}. Best is trial 1464 with value: 0.8990825688073395.
[32m[I 2023-04-21 00:12:45,315][39m Trial 3511 finished with value: 0.8785046728971961 and parameters: {'objective': 'CrossEntropy', 'colsample_bylevel': 0.09215495218920501, 'depth': 9, 'boosting_type': 'Plain', 'bootstrap_type': 'Bayesian', 'bagging_temperature': 5.154480133194561}. Best is trial 1464 with value: 0.8990825688073395.
[32m[I 2023-04-21 00:12:46,697][39m Trial 3512 finished with value: 0.8727272727272727 and parameters: {'objective': 'Logloss', 'colsample_bylevel': 0.0981066072669534, 'depth': 8, 'boosting_type': 'Plain', 'bootstrap_type': 'Bayesian', 'bagging_temperature': 6.022546552348566}. Best is trial 1464 with value: 0.8990825688073395.
[32m[I 2023-04-21 00:12:47,402][39m Trial 3513 finished with value: 0.8727272727272727 and parameters: {'objective': 'Logloss', 'colsample_bylevel': 0.09326283233464266, 'depth': 10, 'boosting_type': 'Plain', 'bootstrap_type': 'Bayesian', 'bagging_temperature': 5.4588355925375724}. Best is trial 1464 with value: 0.8990825688073395.
[32m[I 2023-04-21 00:12:48,612][39m Trial 3514 finished with value: 0.8347826086956522 and parameters: {'objective': 'CrossEntropy', 'colsample_bylevel': 0.08735797651334071, 'depth': 9, 'boosting_type': 'Plain', 'bootstrap_type': 'Bernoulli', 'subsample': 0.9998846492208591}. Best is trial 1464 with value: 0.8990825688073395.
[32m[I 2023-04-21 00:12:49,676][39m Trial 3515 finished with value: 0.8596491228070176 and parameters: {'objective': 'Logloss', 'colsample_bylevel': 0.09145343115681254, 'depth': 9, 'boosting_type': 'Plain', 'bootstrap_type': 'MVS'}. Best is trial 1464 with value: 0.8990825688073395.
[32m[I 2023-04-21 00:12:50,481][39m Trial 3516 finished with value: 0.8703703703703703 and parameters: {'objective': 'Logloss', 'colsample_bylevel': 0.09400567422946388, 'depth': 7, 'boosting_type': 'Plain', 'bootstrap_type': 'Bayesian', 'bagging_temperature': 5.357482875121257}. Best is trial 1464 with value: 0.8990825688073395.
[32m[I 2023-04-21 00:12:51,538][39m Trial 3517 finished with value: 0.8275862068965517 and parameters: {'objective': 'Logloss', 'colsample_bylevel': 0.09991584035945726, 'depth': 3, 'boosting_type': 'Plain', 'bootstrap_type': 'Bayesian', 'bagging_temperature': 5.943406575126176}. Best is trial 1464 with value: 0.8990825688073395.
[32m[I 2023-04-21 00:12:52,843][39m Trial 3518 finished with value: 0.8807339449541284 and parameters: {'objective': 'CrossEntropy', 'colsample_bylevel': 0.09746074424518147, 'depth': 8, 'boosting_type': 'Plain', 'bootstrap_type': 'Bayesian', 'bagging_temperature': 5.013815306900288}. Best is trial 1464 with value: 0.8990825688073395.
[32m[I 2023-04-21 00:12:54,451][39m Trial 3519 finished with value: 0.8807339449541284 and parameters: {'objective': 'CrossEntropy', 'colsample_bylevel': 0.0959895561092227, 'depth': 9, 'boosting_type': 'Plain', 'bootstrap_type': 'Bayesian', 'bagging_temperature': 5.938145448781762}. Best is trial 1464 with value: 0.8990825688073395.
[32m[I 2023-04-21 00:12:55,375][39m Trial 3520 finished with value: 0.8648648648648648 and parameters: {'objective': 'Logloss', 'colsample_bylevel': 0.09656312185200872, 'depth': 9, 'boosting_type': 'Plain', 'bootstrap_type': 'Bayesian', 'bagging_temperature': 5.411543960079055}. Best is trial 1464 with value: 0.8990825688073395.
[32m[I 2023-04-21 00:12:56,805][39m Trial 3521 finished with value: 0.8727272727272727 and parameters: {'objective': 'CrossEntropy', 'colsample_bylevel': 0.09468790433755432, 'depth': 9, 'boosting_type': 'Plain', 'bootstrap_type': 'Bayesian', 'bagging_temperature': 4.917654597209977}. Best is trial 1464 with value: 0.8990825688073395.
[32m[I 2023-04-21 00:12:58,022][39m Trial 3522 finished with value: 0.8703703703703703 and parameters: {'objective': 'CrossEntropy', 'colsample_bylevel': 0.09724051412132688, 'depth': 6, 'boosting_type': 'Plain', 'bootstrap_type': 'Bayesian', 'bagging_temperature': 3.576887758357642}. Best is trial 1464 with value: 0.8990825688073395.
[32m[I 2023-04-21 00:12:59,118][39m Trial 3523 finished with value: 0.8807339449541284 and parameters: {'objective': 'CrossEntropy', 'colsample_bylevel': 0.09761138784736333, 'depth': 10, 'boosting_type': 'Plain', 'bootstrap_type': 'Bayesian', 'bagging_temperature': 4.194919208786487}. Best is trial 1464 with value: 0.8990825688073395.
[32m[I 2023-04-21 00:13:00,601][39m Trial 3524 finished with value: 0.8807339449541284 and parameters: {'objective': 'Logloss', 'colsample_bylevel': 0.09812521622551298, 'depth': 9, 'boosting_type': 'Plain', 'bootstrap_type': 'Bayesian', 'bagging_temperature': 4.487889379121941}. Best is trial 1464 with value: 0.8990825688073395.
[32m[I 2023-04-21 00:13:01,348][39m Trial 3525 finished with value: 0.8648648648648648 and parameters: {'objective': 'Logloss', 'colsample_bylevel': 0.09990288529830862, 'depth': 5, 'boosting_type': 'Plain', 'bootstrap_type': 'Bayesian', 'bagging_temperature': 5.16152431147763}. Best is trial 1464 with value: 0.8990825688073395.
[32m[I 2023-04-21 00:13:02,872][39m Trial 3526 finished with value: 0.8727272727272727 and parameters: {'objective': 'Logloss', 'colsample_bylevel': 0.09631361404318647, 'depth': 9, 'boosting_type': 'Plain', 'bootstrap_type': 'Bayesian', 'bagging_temperature': 6.140844660925749}. Best is trial 1464 with value: 0.8990825688073395.
[32m[I 2023-04-21 00:13:04,080][39m Trial 3527 finished with value: 0.8648648648648648 and parameters: {'objective': 'Logloss', 'colsample_bylevel': 0.08855093444154447, 'depth': 9, 'boosting_type': 'Plain', 'bootstrap_type': 'Bayesian', 'bagging_temperature': 5.542843694134626}. Best is trial 1464 with value: 0.8990825688073395.
[32m[I 2023-04-21 00:13:04,909][39m Trial 3528 finished with value: 0.8785046728971961 and parameters: {'objective': 'CrossEntropy', 'colsample_bylevel': 0.09997790930872777, 'depth': 7, 'boosting_type': 'Plain', 'bootstrap_type': 'Bayesian', 'bagging_temperature': 4.95231269146325}. Best is trial 1464 with value: 0.8990825688073395.
[32m[I 2023-04-21 00:13:09,740][39m Trial 3529 finished with value: 0.8571428571428572 and parameters: {'objective': 'Logloss', 'colsample_bylevel': 0.09428092316998687, 'depth': 9, 'boosting_type': 'Ordered', 'bootstrap_type': 'Bayesian', 'bagging_temperature': 6.22301178835347}. Best is trial 1464 with value: 0.8990825688073395.
[32m[I 2023-04-21 00:13:11,037][39m Trial 3530 finished with value: 0.8727272727272727 and parameters: {'objective': 'Logloss', 'colsample_bylevel': 0.09673413226931958, 'depth': 9, 'boosting_type': 'Plain', 'bootstrap_type': 'Bayesian', 'bagging_temperature': 5.3406376734683665}. Best is trial 1464 with value: 0.8990825688073395.
[32m[I 2023-04-21 00:13:12,136][39m Trial 3531 finished with value: 0.8807339449541284 and parameters: {'objective': 'Logloss', 'colsample_bylevel': 0.09742818261156642, 'depth': 7, 'boosting_type': 'Plain', 'bootstrap_type': 'Bayesian', 'bagging_temperature': 4.715007627922541}. Best is trial 1464 with value: 0.8990825688073395.
[32m[I 2023-04-21 00:13:13,641][39m Trial 3532 finished with value: 0.8828828828828829 and parameters: {'objective': 'Logloss', 'colsample_bylevel': 0.09209290203508996, 'depth': 9, 'boosting_type': 'Plain', 'bootstrap_type': 'Bayesian', 'bagging_temperature': 5.71663977814978}. Best is trial 1464 with value: 0.8990825688073395.
[32m[I 2023-04-21 00:13:14,959][39m Trial 3533 finished with value: 0.8807339449541284 and parameters: {'objective': 'CrossEntropy', 'colsample_bylevel': 0.09681700095086439, 'depth': 9, 'boosting_type': 'Plain', 'bootstrap_type': 'Bayesian', 'bagging_temperature': 7.141253159247402}. Best is trial 1464 with value: 0.8990825688073395.
[32m[I 2023-04-21 00:13:15,676][39m Trial 3534 finished with value: 0.8468468468468469 and parameters: {'objective': 'CrossEntropy', 'colsample_bylevel': 0.09448411008064436, 'depth': 10, 'boosting_type': 'Plain', 'bootstrap_type': 'Bernoulli', 'subsample': 0.9586829393177156}. Best is trial 1464 with value: 0.8990825688073395.
[32m[I 2023-04-21 00:13:17,220][39m Trial 3535 finished with value: 0.8727272727272727 and parameters: {'objective': 'Logloss', 'colsample_bylevel': 0.09571743139284203, 'depth': 9, 'boosting_type': 'Plain', 'bootstrap_type': 'Bayesian', 'bagging_temperature': 6.690358919974834}. Best is trial 1464 with value: 0.8990825688073395.
[32m[I 2023-04-21 00:13:18,625][39m Trial 3536 finished with value: 0.8727272727272727 and parameters: {'objective': 'Logloss', 'colsample_bylevel': 0.09651488395305713, 'depth': 10, 'boosting_type': 'Plain', 'bootstrap_type': 'Bayesian', 'bagging_temperature': 6.475474251665439}. Best is trial 1464 with value: 0.8990825688073395.
[32m[I 2023-04-21 00:13:19,758][39m Trial 3537 finished with value: 0.8623853211009175 and parameters: {'objective': 'Logloss', 'colsample_bylevel': 0.09298036207950677, 'depth': 9, 'boosting_type': 'Plain', 'bootstrap_type': 'Bayesian', 'bagging_temperature': 5.736060589046265}. Best is trial 1464 with value: 0.8990825688073395.
[32m[I 2023-04-21 00:13:20,777][39m Trial 3538 finished with value: 0.8648648648648648 and parameters: {'objective': 'Logloss', 'colsample_bylevel': 0.09125979557438926, 'depth': 9, 'boosting_type': 'Plain', 'bootstrap_type': 'Bayesian', 'bagging_temperature': 6.9581209256400465}. Best is trial 1464 with value: 0.8990825688073395.
[32m[I 2023-04-21 00:13:21,313][39m Trial 3539 finished with value: 0.8495575221238938 and parameters: {'objective': 'CrossEntropy', 'colsample_bylevel': 0.09714194911910491, 'depth': 10, 'boosting_type': 'Plain', 'bootstrap_type': 'MVS'}. Best is trial 1464 with value: 0.8990825688073395.
[32m[I 2023-04-21 00:13:22,258][39m Trial 3540 finished with value: 0.8807339449541284 and parameters: {'objective': 'CrossEntropy', 'colsample_bylevel': 0.0886221996397258, 'depth': 9, 'boosting_type': 'Plain', 'bootstrap_type': 'Bayesian', 'bagging_temperature': 5.069564081387042}. Best is trial 1464 with value: 0.8990825688073395.
[32m[I 2023-04-21 00:13:24,380][39m Trial 3541 finished with value: 0.8727272727272727 and parameters: {'objective': 'Logloss', 'colsample_bylevel': 0.09726006925644246, 'depth': 9, 'boosting_type': 'Plain', 'bootstrap_type': 'Bayesian', 'bagging_temperature': 4.578844435973077}. Best is trial 1464 with value: 0.8990825688073395.
[32m[I 2023-04-21 00:13:25,782][39m Trial 3542 finished with value: 0.8807339449541284 and parameters: {'objective': 'Logloss', 'colsample_bylevel': 0.09852941490172548, 'depth': 9, 'boosting_type': 'Plain', 'bootstrap_type': 'Bayesian', 'bagging_temperature': 6.589389571674932}. Best is trial 1464 with value: 0.8990825688073395.
[32m[I 2023-04-21 00:13:26,784][39m Trial 3543 finished with value: 0.8648648648648648 and parameters: {'objective': 'Logloss', 'colsample_bylevel': 0.0846267202433177, 'depth': 9, 'boosting_type': 'Plain', 'bootstrap_type': 'Bayesian', 'bagging_temperature': 5.346620942292323}. Best is trial 1464 with value: 0.8990825688073395.
[32m[I 2023-04-21 00:13:27,724][39m Trial 3544 finished with value: 0.8727272727272727 and parameters: {'objective': 'Logloss', 'colsample_bylevel': 0.0854440226142547, 'depth': 8, 'boosting_type': 'Plain', 'bootstrap_type': 'Bayesian', 'bagging_temperature': 5.241173994973671}. Best is trial 1464 with value: 0.8990825688073395.
[32m[I 2023-04-21 00:13:28,379][39m Trial 3545 finished with value: 0.8727272727272727 and parameters: {'objective': 'CrossEntropy', 'colsample_bylevel': 0.08781263845453639, 'depth': 11, 'boosting_type': 'Plain', 'bootstrap_type': 'Bayesian', 'bagging_temperature': 4.9996227517999}. Best is trial 1464 with value: 0.8990825688073395.
[32m[I 2023-04-21 00:13:33,719][39m Trial 3546 finished with value: 0.8495575221238938 and parameters: {'objective': 'CrossEntropy', 'colsample_bylevel': 0.08566919645134954, 'depth': 10, 'boosting_type': 'Ordered', 'bootstrap_type': 'Bayesian', 'bagging_temperature': 5.072856573754025}. Best is trial 1464 with value: 0.8990825688073395.
[32m[I 2023-04-21 00:13:34,516][39m Trial 3547 finished with value: 0.8727272727272727 and parameters: {'objective': 'Logloss', 'colsample_bylevel': 0.09984851024177771, 'depth': 7, 'boosting_type': 'Plain', 'bootstrap_type': 'Bayesian', 'bagging_temperature': 3.402702256105649}. Best is trial 1464 with value: 0.8990825688073395.
[32m[I 2023-04-21 00:13:35,698][39m Trial 3548 finished with value: 0.8521739130434783 and parameters: {'objective': 'Logloss', 'colsample_bylevel': 0.060178886650538894, 'depth': 10, 'boosting_type': 'Plain', 'bootstrap_type': 'Bayesian', 'bagging_temperature': 7.45288140742481}. Best is trial 1464 with value: 0.8990825688073395.
[32m[I 2023-04-21 00:13:37,487][39m Trial 3549 finished with value: 0.8807339449541284 and parameters: {'objective': 'Logloss', 'colsample_bylevel': 0.0930287637582236, 'depth': 8, 'boosting_type': 'Plain', 'bootstrap_type': 'Bayesian', 'bagging_temperature': 5.847590446637321}. Best is trial 1464 with value: 0.8990825688073395.
[32m[I 2023-04-21 00:13:39,331][39m Trial 3550 finished with value: 0.888888888888889 and parameters: {'objective': 'Logloss', 'colsample_bylevel': 0.09390381300996949, 'depth': 8, 'boosting_type': 'Plain', 'bootstrap_type': 'Bayesian', 'bagging_temperature': 5.628878121186703}. Best is trial 1464 with value: 0.8990825688073395.
[32m[I 2023-04-21 00:13:40,429][39m Trial 3551 finished with value: 0.8727272727272727 and parameters: {'objective': 'CrossEntropy', 'colsample_bylevel': 0.09103218952459663, 'depth': 9, 'boosting_type': 'Plain', 'bootstrap_type': 'Bayesian', 'bagging_temperature': 5.315986530720394}. Best is trial 1464 with value: 0.8990825688073395.
[32m[I 2023-04-21 00:13:41,457][39m Trial 3552 finished with value: 0.8807339449541284 and parameters: {'objective': 'Logloss', 'colsample_bylevel': 0.09996183002843609, 'depth': 9, 'boosting_type': 'Plain', 'bootstrap_type': 'Bayesian', 'bagging_temperature': 4.923295252541946}. Best is trial 1464 with value: 0.8990825688073395.
[32m[I 2023-04-21 00:13:42,514][39m Trial 3553 finished with value: 0.8785046728971961 and parameters: {'objective': 'CrossEntropy', 'colsample_bylevel': 0.09375208326319932, 'depth': 9, 'boosting_type': 'Plain', 'bootstrap_type': 'Bayesian', 'bagging_temperature': 6.0519620234413045}. Best is trial 1464 with value: 0.8990825688073395.
[32m[I 2023-04-21 00:13:43,662][39m Trial 3554 finished with value: 0.8275862068965517 and parameters: {'objective': 'CrossEntropy', 'colsample_bylevel': 0.05331904114652418, 'depth': 8, 'boosting_type': 'Plain', 'bootstrap_type': 'Bayesian', 'bagging_temperature': 5.405823384339174}. Best is trial 1464 with value: 0.8990825688073395.
[32m[I 2023-04-21 00:13:45,168][39m Trial 3555 finished with value: 0.8727272727272727 and parameters: {'objective': 'Logloss', 'colsample_bylevel': 0.09508782270440742, 'depth': 9, 'boosting_type': 'Plain', 'bootstrap_type': 'Bernoulli', 'subsample': 0.8125819600788866}. Best is trial 1464 with value: 0.8990825688073395.
[32m[I 2023-04-21 00:13:46,113][39m Trial 3556 finished with value: 0.8703703703703703 and parameters: {'objective': 'Logloss', 'colsample_bylevel': 0.09707839548001819, 'depth': 8, 'boosting_type': 'Plain', 'bootstrap_type': 'Bayesian', 'bagging_temperature': 4.7842428388592815}. Best is trial 1464 with value: 0.8990825688073395.
