[32m[I 2023-04-20 23:19:38,112][39m Trial 1060 finished with value: 0.890909090909091 and parameters: {'objective': 'CrossEntropy', 'colsample_bylevel': 0.09876976777318781, 'depth': 9, 'boosting_type': 'Plain', 'bootstrap_type': 'Bayesian', 'bagging_temperature': 4.71206677234418}. Best is trial 205 with value: 0.890909090909091.
[32m[I 2023-04-20 23:19:40,240][39m Trial 1062 finished with value: 0.8727272727272727 and parameters: {'objective': 'Logloss', 'colsample_bylevel': 0.09842948494945623, 'depth': 9, 'boosting_type': 'Plain', 'bootstrap_type': 'Bayesian', 'bagging_temperature': 5.003939424243514}. Best is trial 205 with value: 0.890909090909091.
[32m[I 2023-04-20 23:19:41,573][39m Trial 1063 finished with value: 0.8727272727272727 and parameters: {'objective': 'Logloss', 'colsample_bylevel': 0.09705664441714144, 'depth': 9, 'boosting_type': 'Plain', 'bootstrap_type': 'Bayesian', 'bagging_temperature': 4.476509385299976}. Best is trial 205 with value: 0.890909090909091.
[32m[I 2023-04-20 23:19:42,276][39m Trial 1064 finished with value: 0.8727272727272727 and parameters: {'objective': 'CrossEntropy', 'colsample_bylevel': 0.09487708141125616, 'depth': 11, 'boosting_type': 'Plain', 'bootstrap_type': 'Bayesian', 'bagging_temperature': 9.967075788344452}. Best is trial 205 with value: 0.890909090909091.
[32m[I 2023-04-20 23:19:43,782][39m Trial 1065 finished with value: 0.8727272727272727 and parameters: {'objective': 'Logloss', 'colsample_bylevel': 0.09375213197630591, 'depth': 8, 'boosting_type': 'Plain', 'bootstrap_type': 'Bayesian', 'bagging_temperature': 3.447153121286995}. Best is trial 205 with value: 0.890909090909091.
[32m[I 2023-04-20 23:19:45,106][39m Trial 1066 finished with value: 0.8648648648648648 and parameters: {'objective': 'CrossEntropy', 'colsample_bylevel': 0.09489321810753444, 'depth': 9, 'boosting_type': 'Plain', 'bootstrap_type': 'Bernoulli', 'subsample': 0.1480517605793933}. Best is trial 205 with value: 0.890909090909091.
[32m[I 2023-04-20 23:19:45,767][39m Trial 1067 finished with value: 0.8807339449541284 and parameters: {'objective': 'Logloss', 'colsample_bylevel': 0.09297613691940616, 'depth': 11, 'boosting_type': 'Plain', 'bootstrap_type': 'Bayesian', 'bagging_temperature': 5.579269648233374}. Best is trial 205 with value: 0.890909090909091.
[32m[I 2023-04-20 23:19:46,721][39m Trial 1068 finished with value: 0.888888888888889 and parameters: {'objective': 'Logloss', 'colsample_bylevel': 0.09589546161478939, 'depth': 8, 'boosting_type': 'Plain', 'bootstrap_type': 'Bayesian', 'bagging_temperature': 6.514538250829205}. Best is trial 205 with value: 0.890909090909091.
[32m[I 2023-04-20 23:19:48,199][39m Trial 1069 finished with value: 0.888888888888889 and parameters: {'objective': 'Logloss', 'colsample_bylevel': 0.09681649141924967, 'depth': 8, 'boosting_type': 'Plain', 'bootstrap_type': 'Bayesian', 'bagging_temperature': 5.387142639746894}. Best is trial 205 with value: 0.890909090909091.
[32m[I 2023-04-20 23:19:49,430][39m Trial 1070 finished with value: 0.8785046728971961 and parameters: {'objective': 'Logloss', 'colsample_bylevel': 0.09815560751041498, 'depth': 8, 'boosting_type': 'Plain', 'bootstrap_type': 'Bayesian', 'bagging_temperature': 5.257965420106024}. Best is trial 205 with value: 0.890909090909091.
[32m[I 2023-04-20 23:19:50,439][39m Trial 1071 finished with value: 0.8807339449541284 and parameters: {'objective': 'Logloss', 'colsample_bylevel': 0.09576607227022944, 'depth': 11, 'boosting_type': 'Plain', 'bootstrap_type': 'Bayesian', 'bagging_temperature': 5.49751810657256}. Best is trial 205 with value: 0.890909090909091.
[32m[I 2023-04-20 23:19:51,209][39m Trial 1072 finished with value: 0.8648648648648648 and parameters: {'objective': 'Logloss', 'colsample_bylevel': 0.09996599895124715, 'depth': 11, 'boosting_type': 'Plain', 'bootstrap_type': 'Bayesian', 'bagging_temperature': 3.9735819547391267}. Best is trial 205 with value: 0.890909090909091.
[32m[I 2023-04-20 23:19:56,605][39m Trial 1073 finished with value: 0.8571428571428572 and parameters: {'objective': 'Logloss', 'colsample_bylevel': 0.09752834171122071, 'depth': 12, 'boosting_type': 'Ordered', 'bootstrap_type': 'Bayesian', 'bagging_temperature': 5.15906286495809}. Best is trial 205 with value: 0.890909090909091.
[32m[I 2023-04-20 23:19:57,473][39m Trial 1074 finished with value: 0.8807339449541284 and parameters: {'objective': 'CrossEntropy', 'colsample_bylevel': 0.0983908101492492, 'depth': 10, 'boosting_type': 'Plain', 'bootstrap_type': 'Bayesian', 'bagging_temperature': 4.180065624494249}. Best is trial 205 with value: 0.890909090909091.
[32m[I 2023-04-20 23:19:58,867][39m Trial 1075 finished with value: 0.8672566371681416 and parameters: {'objective': 'Logloss', 'colsample_bylevel': 0.04786049110170573, 'depth': 9, 'boosting_type': 'Plain', 'bootstrap_type': 'Bayesian', 'bagging_temperature': 6.840893311781119}. Best is trial 205 with value: 0.890909090909091.
[32m[I 2023-04-20 23:19:59,915][39m Trial 1076 finished with value: 0.8135593220338982 and parameters: {'objective': 'CrossEntropy', 'colsample_bylevel': 0.025457311304672554, 'depth': 9, 'boosting_type': 'Plain', 'bootstrap_type': 'Bayesian', 'bagging_temperature': 4.788683968412394}. Best is trial 205 with value: 0.890909090909091.
[32m[I 2023-04-20 23:20:00,560][39m Trial 1077 finished with value: 0.8571428571428572 and parameters: {'objective': 'CrossEntropy', 'colsample_bylevel': 0.0898084191443786, 'depth': 11, 'boosting_type': 'Plain', 'bootstrap_type': 'Bayesian', 'bagging_temperature': 4.420385928496364}. Best is trial 205 with value: 0.890909090909091.
[32m[I 2023-04-20 23:20:01,387][39m Trial 1078 finished with value: 0.8727272727272727 and parameters: {'objective': 'Logloss', 'colsample_bylevel': 0.09926677867576886, 'depth': 8, 'boosting_type': 'Plain', 'bootstrap_type': 'Bayesian', 'bagging_temperature': 6.128850703014552}. Best is trial 205 with value: 0.890909090909091.
[32m[I 2023-04-20 23:20:02,465][39m Trial 1079 finished with value: 0.8376068376068375 and parameters: {'objective': 'CrossEntropy', 'colsample_bylevel': 0.08017520776543559, 'depth': 2, 'boosting_type': 'Plain', 'bootstrap_type': 'Bayesian', 'bagging_temperature': 6.503401805685404}. Best is trial 205 with value: 0.890909090909091.
[32m[I 2023-04-20 23:20:03,757][39m Trial 1080 finished with value: 0.8521739130434783 and parameters: {'objective': 'CrossEntropy', 'colsample_bylevel': 0.0928527875830783, 'depth': 9, 'boosting_type': 'Plain', 'bootstrap_type': 'MVS'}. Best is trial 205 with value: 0.890909090909091.
[32m[I 2023-04-20 23:20:04,532][39m Trial 1081 finished with value: 0.8727272727272727 and parameters: {'objective': 'CrossEntropy', 'colsample_bylevel': 0.09988531845077615, 'depth': 10, 'boosting_type': 'Plain', 'bootstrap_type': 'Bayesian', 'bagging_temperature': 3.5900910253946803}. Best is trial 205 with value: 0.890909090909091.
[32m[I 2023-04-20 23:20:06,069][39m Trial 1082 finished with value: 0.8807339449541284 and parameters: {'objective': 'CrossEntropy', 'colsample_bylevel': 0.09841527884994969, 'depth': 8, 'boosting_type': 'Plain', 'bootstrap_type': 'Bayesian', 'bagging_temperature': 3.7431935603329745}. Best is trial 205 with value: 0.890909090909091.
[32m[I 2023-04-20 23:20:07,006][39m Trial 1083 finished with value: 0.8571428571428572 and parameters: {'objective': 'Logloss', 'colsample_bylevel': 0.08899195452475821, 'depth': 9, 'boosting_type': 'Plain', 'bootstrap_type': 'Bayesian', 'bagging_temperature': 4.203705754586954}. Best is trial 205 with value: 0.890909090909091.
[32m[I 2023-04-20 23:20:07,968][39m Trial 1084 finished with value: 0.8571428571428572 and parameters: {'objective': 'Logloss', 'colsample_bylevel': 0.09999167654949331, 'depth': 8, 'boosting_type': 'Plain', 'bootstrap_type': 'Bayesian', 'bagging_temperature': 3.879971979640399}. Best is trial 205 with value: 0.890909090909091.
[32m[I 2023-04-20 23:20:08,726][39m Trial 1085 finished with value: 0.8623853211009175 and parameters: {'objective': 'CrossEntropy', 'colsample_bylevel': 0.09708112375983739, 'depth': 9, 'boosting_type': 'Plain', 'bootstrap_type': 'Bayesian', 'bagging_temperature': 5.851687455274138}. Best is trial 205 with value: 0.890909090909091.
[32m[I 2023-04-20 23:20:09,776][39m Trial 1086 finished with value: 0.8727272727272727 and parameters: {'objective': 'CrossEntropy', 'colsample_bylevel': 0.09361879196089334, 'depth': 9, 'boosting_type': 'Plain', 'bootstrap_type': 'Bayesian', 'bagging_temperature': 7.379800647221899}. Best is trial 205 with value: 0.890909090909091.
[32m[I 2023-04-20 23:20:10,731][39m Trial 1087 finished with value: 0.8807339449541284 and parameters: {'objective': 'Logloss', 'colsample_bylevel': 0.0970560745551785, 'depth': 6, 'boosting_type': 'Plain', 'bootstrap_type': 'Bayesian', 'bagging_temperature': 4.35906120576537}. Best is trial 205 with value: 0.890909090909091.
[32m[I 2023-04-20 23:20:11,846][39m Trial 1088 finished with value: 0.8727272727272727 and parameters: {'objective': 'Logloss', 'colsample_bylevel': 0.09998938192844223, 'depth': 8, 'boosting_type': 'Plain', 'bootstrap_type': 'Bayesian', 'bagging_temperature': 3.3951719664139777}. Best is trial 205 with value: 0.890909090909091.
[32m[I 2023-04-20 23:20:13,044][39m Trial 1089 finished with value: 0.8727272727272727 and parameters: {'objective': 'Logloss', 'colsample_bylevel': 0.09652943687882154, 'depth': 8, 'boosting_type': 'Plain', 'bootstrap_type': 'Bayesian', 'bagging_temperature': 5.753442596822406}. Best is trial 205 with value: 0.890909090909091.
[32m[I 2023-04-20 23:20:14,057][39m Trial 1090 finished with value: 0.8468468468468469 and parameters: {'objective': 'Logloss', 'colsample_bylevel': 0.09635826187961682, 'depth': 8, 'boosting_type': 'Plain', 'bootstrap_type': 'Bernoulli', 'subsample': 0.8760280292751008}. Best is trial 205 with value: 0.890909090909091.
[32m[I 2023-04-20 23:20:14,845][39m Trial 1091 finished with value: 0.8703703703703703 and parameters: {'objective': 'CrossEntropy', 'colsample_bylevel': 0.09809910652241204, 'depth': 9, 'boosting_type': 'Plain', 'bootstrap_type': 'Bayesian', 'bagging_temperature': 4.882550731912917}. Best is trial 205 with value: 0.890909090909091.
[32m[I 2023-04-20 23:20:15,673][39m Trial 1092 finished with value: 0.8727272727272727 and parameters: {'objective': 'CrossEntropy', 'colsample_bylevel': 0.0910426549147429, 'depth': 9, 'boosting_type': 'Plain', 'bootstrap_type': 'Bayesian', 'bagging_temperature': 4.601841766772631}. Best is trial 205 with value: 0.890909090909091.
[32m[I 2023-04-20 23:20:16,683][39m Trial 1093 finished with value: 0.8807339449541284 and parameters: {'objective': 'CrossEntropy', 'colsample_bylevel': 0.09443479033569434, 'depth': 9, 'boosting_type': 'Plain', 'bootstrap_type': 'Bayesian', 'bagging_temperature': 4.367001813760312}. Best is trial 205 with value: 0.890909090909091.
[32m[I 2023-04-20 23:20:22,419][39m Trial 1094 finished with value: 0.8571428571428572 and parameters: {'objective': 'Logloss', 'colsample_bylevel': 0.09278175504193589, 'depth': 12, 'boosting_type': 'Ordered', 'bootstrap_type': 'Bayesian', 'bagging_temperature': 9.437668684146303}. Best is trial 205 with value: 0.890909090909091.
[32m[I 2023-04-20 23:20:23,927][39m Trial 1095 finished with value: 0.8807339449541284 and parameters: {'objective': 'Logloss', 'colsample_bylevel': 0.09960980248989273, 'depth': 8, 'boosting_type': 'Plain', 'bootstrap_type': 'Bayesian', 'bagging_temperature': 6.089093511572984}. Best is trial 205 with value: 0.890909090909091.
[32m[I 2023-04-20 23:20:25,043][39m Trial 1096 finished with value: 0.8727272727272727 and parameters: {'objective': 'CrossEntropy', 'colsample_bylevel': 0.09523035791784591, 'depth': 8, 'boosting_type': 'Plain', 'bootstrap_type': 'Bayesian', 'bagging_temperature': 4.669011699075308}. Best is trial 205 with value: 0.890909090909091.
[32m[I 2023-04-20 23:20:26,097][39m Trial 1097 finished with value: 0.8648648648648648 and parameters: {'objective': 'CrossEntropy', 'colsample_bylevel': 0.0846451494025609, 'depth': 10, 'boosting_type': 'Plain', 'bootstrap_type': 'Bayesian', 'bagging_temperature': 4.961066610179545}. Best is trial 205 with value: 0.890909090909091.
[32m[I 2023-04-20 23:20:27,484][39m Trial 1098 finished with value: 0.888888888888889 and parameters: {'objective': 'Logloss', 'colsample_bylevel': 0.09647992496148482, 'depth': 7, 'boosting_type': 'Plain', 'bootstrap_type': 'Bayesian', 'bagging_temperature': 6.114480464891165}. Best is trial 205 with value: 0.890909090909091.
[32m[I 2023-04-20 23:20:28,194][39m Trial 1099 finished with value: 0.8807339449541284 and parameters: {'objective': 'Logloss', 'colsample_bylevel': 0.09514602399097892, 'depth': 10, 'boosting_type': 'Plain', 'bootstrap_type': 'Bayesian', 'bagging_temperature': 6.486135838710718}. Best is trial 205 with value: 0.890909090909091.
[32m[I 2023-04-20 23:20:29,418][39m Trial 1100 finished with value: 0.8727272727272727 and parameters: {'objective': 'Logloss', 'colsample_bylevel': 0.09416421587901147, 'depth': 10, 'boosting_type': 'Plain', 'bootstrap_type': 'Bayesian', 'bagging_temperature': 7.079167659342672}. Best is trial 205 with value: 0.890909090909091.
[32m[I 2023-04-20 23:20:30,130][39m Trial 1101 finished with value: 0.8648648648648648 and parameters: {'objective': 'Logloss', 'colsample_bylevel': 0.0954933854469146, 'depth': 7, 'boosting_type': 'Plain', 'bootstrap_type': 'Bayesian', 'bagging_temperature': 8.514249012422335}. Best is trial 205 with value: 0.890909090909091.
[32m[I 2023-04-20 23:20:31,176][39m Trial 1102 finished with value: 0.8571428571428572 and parameters: {'objective': 'Logloss', 'colsample_bylevel': 0.0980373484073746, 'depth': 9, 'boosting_type': 'Plain', 'bootstrap_type': 'MVS'}. Best is trial 205 with value: 0.890909090909091.
[32m[I 2023-04-20 23:20:32,376][39m Trial 1103 finished with value: 0.8727272727272727 and parameters: {'objective': 'Logloss', 'colsample_bylevel': 0.09214904869347142, 'depth': 10, 'boosting_type': 'Plain', 'bootstrap_type': 'Bayesian', 'bagging_temperature': 5.448939817730994}. Best is trial 205 with value: 0.890909090909091.
[32m[I 2023-04-20 23:20:33,267][39m Trial 1104 finished with value: 0.8828828828828829 and parameters: {'objective': 'CrossEntropy', 'colsample_bylevel': 0.09185684388745782, 'depth': 10, 'boosting_type': 'Plain', 'bootstrap_type': 'Bayesian', 'bagging_temperature': 4.592173984289738}. Best is trial 205 with value: 0.890909090909091.
[32m[I 2023-04-20 23:20:34,146][39m Trial 1105 finished with value: 0.8727272727272727 and parameters: {'objective': 'Logloss', 'colsample_bylevel': 0.09549728680560096, 'depth': 8, 'boosting_type': 'Plain', 'bootstrap_type': 'Bayesian', 'bagging_temperature': 5.611901237993072}. Best is trial 205 with value: 0.890909090909091.
[32m[I 2023-04-20 23:20:35,392][39m Trial 1106 finished with value: 0.888888888888889 and parameters: {'objective': 'CrossEntropy', 'colsample_bylevel': 0.0933550020466763, 'depth': 11, 'boosting_type': 'Plain', 'bootstrap_type': 'Bayesian', 'bagging_temperature': 5.607071143876846}. Best is trial 205 with value: 0.890909090909091.
[32m[I 2023-04-20 23:20:36,234][39m Trial 1107 finished with value: 0.8807339449541284 and parameters: {'objective': 'Logloss', 'colsample_bylevel': 0.0939272286483813, 'depth': 11, 'boosting_type': 'Plain', 'bootstrap_type': 'Bayesian', 'bagging_temperature': 4.499350494983227}. Best is trial 205 with value: 0.890909090909091.
[32m[I 2023-04-20 23:20:37,196][39m Trial 1108 finished with value: 0.8225806451612904 and parameters: {'objective': 'Logloss', 'colsample_bylevel': 0.010187114934449487, 'depth': 9, 'boosting_type': 'Plain', 'bootstrap_type': 'Bayesian', 'bagging_temperature': 4.632290511041811}. Best is trial 205 with value: 0.890909090909091.
[32m[I 2023-04-20 23:20:38,627][39m Trial 1109 finished with value: 0.8807339449541284 and parameters: {'objective': 'Logloss', 'colsample_bylevel': 0.09538465730884647, 'depth': 9, 'boosting_type': 'Plain', 'bootstrap_type': 'Bayesian', 'bagging_temperature': 4.6896349088409}. Best is trial 205 with value: 0.890909090909091.
[32m[I 2023-04-20 23:20:39,373][39m Trial 1110 finished with value: 0.8648648648648648 and parameters: {'objective': 'CrossEntropy', 'colsample_bylevel': 0.09532055543815962, 'depth': 9, 'boosting_type': 'Plain', 'bootstrap_type': 'Bayesian', 'bagging_temperature': 6.729327166048387}. Best is trial 205 with value: 0.890909090909091.
[32m[I 2023-04-20 23:20:44,817][39m Trial 1111 finished with value: 0.8571428571428572 and parameters: {'objective': 'CrossEntropy', 'colsample_bylevel': 0.08765136760003665, 'depth': 11, 'boosting_type': 'Ordered', 'bootstrap_type': 'Bayesian', 'bagging_temperature': 5.160524430304189}. Best is trial 205 with value: 0.890909090909091.
[32m[I 2023-04-20 23:20:46,419][39m Trial 1112 finished with value: 0.8596491228070176 and parameters: {'objective': 'Logloss', 'colsample_bylevel': 0.09738930437500457, 'depth': 9, 'boosting_type': 'Plain', 'bootstrap_type': 'Bernoulli', 'subsample': 0.9743506053796676}. Best is trial 205 with value: 0.890909090909091.
[32m[I 2023-04-20 23:20:47,983][39m Trial 1113 finished with value: 0.8727272727272727 and parameters: {'objective': 'Logloss', 'colsample_bylevel': 0.09840016067104959, 'depth': 8, 'boosting_type': 'Plain', 'bootstrap_type': 'Bayesian', 'bagging_temperature': 4.846215356778006}. Best is trial 205 with value: 0.890909090909091.
[32m[I 2023-04-20 23:20:48,980][39m Trial 1114 finished with value: 0.8807339449541284 and parameters: {'objective': 'Logloss', 'colsample_bylevel': 0.09813625393662576, 'depth': 8, 'boosting_type': 'Plain', 'bootstrap_type': 'Bayesian', 'bagging_temperature': 4.030468589048947}. Best is trial 205 with value: 0.890909090909091.
[32m[I 2023-04-20 23:20:49,811][39m Trial 1115 finished with value: 0.8727272727272727 and parameters: {'objective': 'Logloss', 'colsample_bylevel': 0.09832336899687379, 'depth': 8, 'boosting_type': 'Plain', 'bootstrap_type': 'Bayesian', 'bagging_temperature': 0.9801718937236918}. Best is trial 205 with value: 0.890909090909091.
[32m[I 2023-04-20 23:20:50,493][39m Trial 1116 finished with value: 0.890909090909091 and parameters: {'objective': 'CrossEntropy', 'colsample_bylevel': 0.09399105340935185, 'depth': 10, 'boosting_type': 'Plain', 'bootstrap_type': 'Bayesian', 'bagging_temperature': 4.092040177335644}. Best is trial 205 with value: 0.890909090909091.
[32m[I 2023-04-20 23:20:51,503][39m Trial 1117 finished with value: 0.888888888888889 and parameters: {'objective': 'CrossEntropy', 'colsample_bylevel': 0.08994328382940114, 'depth': 10, 'boosting_type': 'Plain', 'bootstrap_type': 'Bayesian', 'bagging_temperature': 4.517177142681789}. Best is trial 205 with value: 0.890909090909091.
[32m[I 2023-04-20 23:20:52,463][39m Trial 1118 finished with value: 0.8785046728971961 and parameters: {'objective': 'CrossEntropy', 'colsample_bylevel': 0.09371514294680243, 'depth': 10, 'boosting_type': 'Plain', 'bootstrap_type': 'Bayesian', 'bagging_temperature': 4.181979635158466}. Best is trial 205 with value: 0.890909090909091.
[32m[I 2023-04-20 23:20:53,378][39m Trial 1119 finished with value: 0.8807339449541284 and parameters: {'objective': 'CrossEntropy', 'colsample_bylevel': 0.09214467566073598, 'depth': 12, 'boosting_type': 'Plain', 'bootstrap_type': 'Bayesian', 'bagging_temperature': 4.551763952298414}. Best is trial 205 with value: 0.890909090909091.
[32m[I 2023-04-20 23:20:54,614][39m Trial 1120 finished with value: 0.8807339449541284 and parameters: {'objective': 'CrossEntropy', 'colsample_bylevel': 0.09235170950300509, 'depth': 9, 'boosting_type': 'Plain', 'bootstrap_type': 'Bayesian', 'bagging_temperature': 4.994429010820405}. Best is trial 205 with value: 0.890909090909091.
[32m[I 2023-04-20 23:20:55,477][39m Trial 1121 finished with value: 0.8571428571428572 and parameters: {'objective': 'CrossEntropy', 'colsample_bylevel': 0.09390597415637092, 'depth': 12, 'boosting_type': 'Plain', 'bootstrap_type': 'Bayesian', 'bagging_temperature': 0.8554501796753637}. Best is trial 205 with value: 0.890909090909091.
[32m[I 2023-04-20 23:20:56,482][39m Trial 1122 finished with value: 0.8807339449541284 and parameters: {'objective': 'CrossEntropy', 'colsample_bylevel': 0.09424296629196814, 'depth': 9, 'boosting_type': 'Plain', 'bootstrap_type': 'Bayesian', 'bagging_temperature': 4.371144421787184}. Best is trial 205 with value: 0.890909090909091.
[32m[I 2023-04-20 23:20:57,418][39m Trial 1123 finished with value: 0.8727272727272727 and parameters: {'objective': 'Logloss', 'colsample_bylevel': 0.09541267864341184, 'depth': 12, 'boosting_type': 'Plain', 'bootstrap_type': 'Bayesian', 'bagging_temperature': 9.641796729496416}. Best is trial 205 with value: 0.890909090909091.
[32m[I 2023-04-20 23:20:58,048][39m Trial 1124 finished with value: 0.8571428571428572 and parameters: {'objective': 'CrossEntropy', 'colsample_bylevel': 0.09790991329056088, 'depth': 11, 'boosting_type': 'Plain', 'bootstrap_type': 'MVS'}. Best is trial 205 with value: 0.890909090909091.
[32m[I 2023-04-20 23:20:59,034][39m Trial 1125 finished with value: 0.8727272727272727 and parameters: {'objective': 'Logloss', 'colsample_bylevel': 0.09697291752756979, 'depth': 10, 'boosting_type': 'Plain', 'bootstrap_type': 'Bayesian', 'bagging_temperature': 3.6333896362824945}. Best is trial 205 with value: 0.890909090909091.
[32m[I 2023-04-20 23:21:00,009][39m Trial 1126 finished with value: 0.8807339449541284 and parameters: {'objective': 'CrossEntropy', 'colsample_bylevel': 0.0997164473645626, 'depth': 8, 'boosting_type': 'Plain', 'bootstrap_type': 'Bayesian', 'bagging_temperature': 3.917443122895122}. Best is trial 205 with value: 0.890909090909091.
