[32m[I 2023-04-21 00:52:11,317][39m Trial 5264 finished with value: 0.8807339449541284 and parameters: {'objective': 'CrossEntropy', 'colsample_bylevel': 0.0958737326979059, 'depth': 9, 'boosting_type': 'Plain', 'bootstrap_type': 'Bayesian', 'bagging_temperature': 4.844157587052588}. Best is trial 1464 with value: 0.8990825688073395.
[32m[I 2023-04-21 00:52:13,117][39m Trial 5265 finished with value: 0.888888888888889 and parameters: {'objective': 'CrossEntropy', 'colsample_bylevel': 0.09594268452772958, 'depth': 9, 'boosting_type': 'Plain', 'bootstrap_type': 'Bayesian', 'bagging_temperature': 4.8696116148826185}. Best is trial 1464 with value: 0.8990825688073395.
[32m[I 2023-04-21 00:52:13,964][39m Trial 5266 finished with value: 0.8571428571428572 and parameters: {'objective': 'CrossEntropy', 'colsample_bylevel': 0.09832456626755459, 'depth': 9, 'boosting_type': 'Plain', 'bootstrap_type': 'Bayesian', 'bagging_temperature': 3.7920541305786144}. Best is trial 1464 with value: 0.8990825688073395.
[32m[I 2023-04-21 00:52:14,906][39m Trial 5267 finished with value: 0.8807339449541284 and parameters: {'objective': 'Logloss', 'colsample_bylevel': 0.0946228313503831, 'depth': 7, 'boosting_type': 'Plain', 'bootstrap_type': 'Bayesian', 'bagging_temperature': 6.0221021015747525}. Best is trial 1464 with value: 0.8990825688073395.
[32m[I 2023-04-21 00:52:16,411][39m Trial 5268 finished with value: 0.8828828828828829 and parameters: {'objective': 'Logloss', 'colsample_bylevel': 0.09209911958935564, 'depth': 9, 'boosting_type': 'Plain', 'bootstrap_type': 'Bayesian', 'bagging_temperature': 5.271774350941205}. Best is trial 1464 with value: 0.8990825688073395.
[32m[I 2023-04-21 00:52:17,541][39m Trial 5269 finished with value: 0.890909090909091 and parameters: {'objective': 'CrossEntropy', 'colsample_bylevel': 0.09969477455229442, 'depth': 8, 'boosting_type': 'Plain', 'bootstrap_type': 'Bayesian', 'bagging_temperature': 4.671296376303977}. Best is trial 1464 with value: 0.8990825688073395.
[32m[I 2023-04-21 00:52:22,404][39m Trial 5270 finished with value: 0.8571428571428572 and parameters: {'objective': 'Logloss', 'colsample_bylevel': 0.0987973042883987, 'depth': 8, 'boosting_type': 'Ordered', 'bootstrap_type': 'Bayesian', 'bagging_temperature': 4.367782794436955}. Best is trial 1464 with value: 0.8990825688073395.
[32m[I 2023-04-21 00:52:24,111][39m Trial 5271 finished with value: 0.8807339449541284 and parameters: {'objective': 'Logloss', 'colsample_bylevel': 0.09971627705515806, 'depth': 9, 'boosting_type': 'Plain', 'bootstrap_type': 'Bayesian', 'bagging_temperature': 4.711561675893695}. Best is trial 1464 with value: 0.8990825688073395.
[32m[I 2023-04-21 00:52:25,124][39m Trial 5272 finished with value: 0.8807339449541284 and parameters: {'objective': 'Logloss', 'colsample_bylevel': 0.09999159401788758, 'depth': 11, 'boosting_type': 'Plain', 'bootstrap_type': 'Bayesian', 'bagging_temperature': 5.8161992189872205}. Best is trial 1464 with value: 0.8990825688073395.
[32m[I 2023-04-21 00:52:26,496][39m Trial 5273 finished with value: 0.8648648648648648 and parameters: {'objective': 'Logloss', 'colsample_bylevel': 0.09754175908454382, 'depth': 6, 'boosting_type': 'Plain', 'bootstrap_type': 'Bayesian', 'bagging_temperature': 3.2046360028838796}. Best is trial 1464 with value: 0.8990825688073395.
[32m[I 2023-04-21 00:52:27,830][39m Trial 5274 finished with value: 0.875 and parameters: {'objective': 'Logloss', 'colsample_bylevel': 0.09810652474400566, 'depth': 7, 'boosting_type': 'Plain', 'bootstrap_type': 'Bayesian', 'bagging_temperature': 3.3819222475343986}. Best is trial 1464 with value: 0.8990825688073395.
[32m[I 2023-04-21 00:52:28,983][39m Trial 5275 finished with value: 0.8807339449541284 and parameters: {'objective': 'Logloss', 'colsample_bylevel': 0.0999082696391524, 'depth': 9, 'boosting_type': 'Plain', 'bootstrap_type': 'Bayesian', 'bagging_temperature': 4.811510516118671}. Best is trial 1464 with value: 0.8990825688073395.
[32m[I 2023-04-21 00:52:31,126][39m Trial 5276 finished with value: 0.8727272727272727 and parameters: {'objective': 'Logloss', 'colsample_bylevel': 0.09646656699139401, 'depth': 9, 'boosting_type': 'Plain', 'bootstrap_type': 'Bayesian', 'bagging_temperature': 4.91788098452332}. Best is trial 1464 with value: 0.8990825688073395.
[32m[I 2023-04-21 00:52:32,094][39m Trial 5277 finished with value: 0.8727272727272727 and parameters: {'objective': 'CrossEntropy', 'colsample_bylevel': 0.08904856304281651, 'depth': 11, 'boosting_type': 'Plain', 'bootstrap_type': 'Bayesian', 'bagging_temperature': 4.734243259121786}. Best is trial 1464 with value: 0.8990825688073395.
[32m[I 2023-04-21 00:52:32,884][39m Trial 5278 finished with value: 0.8727272727272727 and parameters: {'objective': 'Logloss', 'colsample_bylevel': 0.09641063292221747, 'depth': 10, 'boosting_type': 'Plain', 'bootstrap_type': 'Bayesian', 'bagging_temperature': 6.642811577809229}. Best is trial 1464 with value: 0.8990825688073395.
[32m[I 2023-04-21 00:52:34,177][39m Trial 5279 finished with value: 0.8648648648648648 and parameters: {'objective': 'CrossEntropy', 'colsample_bylevel': 0.09381525633973302, 'depth': 10, 'boosting_type': 'Plain', 'bootstrap_type': 'Bayesian', 'bagging_temperature': 6.936097865079057}. Best is trial 1464 with value: 0.8990825688073395.
[32m[I 2023-04-21 00:52:35,025][39m Trial 5280 finished with value: 0.8727272727272727 and parameters: {'objective': 'Logloss', 'colsample_bylevel': 0.09362385813506094, 'depth': 7, 'boosting_type': 'Plain', 'bootstrap_type': 'Bayesian', 'bagging_temperature': 3.499325931127271}. Best is trial 1464 with value: 0.8990825688073395.
[32m[I 2023-04-21 00:52:36,231][39m Trial 5281 finished with value: 0.8807339449541284 and parameters: {'objective': 'CrossEntropy', 'colsample_bylevel': 0.09527334500511672, 'depth': 9, 'boosting_type': 'Plain', 'bootstrap_type': 'Bayesian', 'bagging_temperature': 4.498049841187373}. Best is trial 1464 with value: 0.8990825688073395.
[32m[I 2023-04-21 00:52:37,135][39m Trial 5282 finished with value: 0.8421052631578947 and parameters: {'objective': 'Logloss', 'colsample_bylevel': 0.0973200365544406, 'depth': 7, 'boosting_type': 'Plain', 'bootstrap_type': 'Bernoulli', 'subsample': 0.6848426051522694}. Best is trial 1464 with value: 0.8990825688073395.
[32m[I 2023-04-21 00:52:38,630][39m Trial 5283 finished with value: 0.8807339449541284 and parameters: {'objective': 'CrossEntropy', 'colsample_bylevel': 0.09800118840571168, 'depth': 8, 'boosting_type': 'Plain', 'bootstrap_type': 'Bayesian', 'bagging_temperature': 4.601091692450078}. Best is trial 1464 with value: 0.8990825688073395.
[32m[I 2023-04-21 00:52:39,957][39m Trial 5284 finished with value: 0.8623853211009175 and parameters: {'objective': 'CrossEntropy', 'colsample_bylevel': 0.09929541363668302, 'depth': 8, 'boosting_type': 'Plain', 'bootstrap_type': 'Bayesian', 'bagging_temperature': 3.4072824338563894}. Best is trial 1464 with value: 0.8990825688073395.
[32m[I 2023-04-21 00:52:41,953][39m Trial 5285 finished with value: 0.888888888888889 and parameters: {'objective': 'Logloss', 'colsample_bylevel': 0.09821182484201484, 'depth': 9, 'boosting_type': 'Plain', 'bootstrap_type': 'Bayesian', 'bagging_temperature': 4.705464376144136}. Best is trial 1464 with value: 0.8990825688073395.
[32m[I 2023-04-21 00:52:42,715][39m Trial 5286 finished with value: 0.8648648648648648 and parameters: {'objective': 'CrossEntropy', 'colsample_bylevel': 0.09981975776779223, 'depth': 8, 'boosting_type': 'Plain', 'bootstrap_type': 'MVS'}. Best is trial 1464 with value: 0.8990825688073395.
[32m[I 2023-04-21 00:52:43,411][39m Trial 5287 finished with value: 0.8623853211009175 and parameters: {'objective': 'CrossEntropy', 'colsample_bylevel': 0.08632965104866222, 'depth': 12, 'boosting_type': 'Plain', 'bootstrap_type': 'Bayesian', 'bagging_temperature': 5.043375240651875}. Best is trial 1464 with value: 0.8990825688073395.
[32m[I 2023-04-21 00:52:44,490][39m Trial 5288 finished with value: 0.875 and parameters: {'objective': 'Logloss', 'colsample_bylevel': 0.09404008763005844, 'depth': 10, 'boosting_type': 'Plain', 'bootstrap_type': 'Bayesian', 'bagging_temperature': 6.934149199665747}. Best is trial 1464 with value: 0.8990825688073395.
[32m[I 2023-04-21 00:52:49,411][39m Trial 5289 finished with value: 0.8648648648648648 and parameters: {'objective': 'CrossEntropy', 'colsample_bylevel': 0.09785718384702428, 'depth': 9, 'boosting_type': 'Ordered', 'bootstrap_type': 'Bayesian', 'bagging_temperature': 5.0489953568012504}. Best is trial 1464 with value: 0.8990825688073395.
[32m[I 2023-04-21 00:52:50,640][39m Trial 5290 finished with value: 0.8807339449541284 and parameters: {'objective': 'CrossEntropy', 'colsample_bylevel': 0.08700174823101475, 'depth': 12, 'boosting_type': 'Plain', 'bootstrap_type': 'Bayesian', 'bagging_temperature': 7.102869876588932}. Best is trial 1464 with value: 0.8990825688073395.
[32m[I 2023-04-21 00:52:51,968][39m Trial 5291 finished with value: 0.875 and parameters: {'objective': 'Logloss', 'colsample_bylevel': 0.099860098994712, 'depth': 12, 'boosting_type': 'Plain', 'bootstrap_type': 'Bayesian', 'bagging_temperature': 5.070994512077482}. Best is trial 1464 with value: 0.8990825688073395.
[32m[I 2023-04-21 00:52:53,035][39m Trial 5292 finished with value: 0.8727272727272727 and parameters: {'objective': 'CrossEntropy', 'colsample_bylevel': 0.0982337477250285, 'depth': 12, 'boosting_type': 'Plain', 'bootstrap_type': 'Bayesian', 'bagging_temperature': 5.742561585958827}. Best is trial 1464 with value: 0.8990825688073395.
[32m[I 2023-04-21 00:52:54,154][39m Trial 5293 finished with value: 0.8727272727272727 and parameters: {'objective': 'CrossEntropy', 'colsample_bylevel': 0.08722752032272746, 'depth': 11, 'boosting_type': 'Plain', 'bootstrap_type': 'Bayesian', 'bagging_temperature': 5.567515135756376}. Best is trial 1464 with value: 0.8990825688073395.
[32m[I 2023-04-21 00:52:55,267][39m Trial 5294 finished with value: 0.875 and parameters: {'objective': 'Logloss', 'colsample_bylevel': 0.08585334603676326, 'depth': 11, 'boosting_type': 'Plain', 'bootstrap_type': 'Bayesian', 'bagging_temperature': 4.140420185637379}. Best is trial 1464 with value: 0.8990825688073395.
[32m[I 2023-04-21 00:52:56,518][39m Trial 5295 finished with value: 0.8392857142857144 and parameters: {'objective': 'Logloss', 'colsample_bylevel': 0.08884159472939686, 'depth': 12, 'boosting_type': 'Plain', 'bootstrap_type': 'Bayesian', 'bagging_temperature': 5.092843089293279}. Best is trial 1464 with value: 0.8990825688073395.
[32m[I 2023-04-21 00:52:57,994][39m Trial 5296 finished with value: 0.890909090909091 and parameters: {'objective': 'Logloss', 'colsample_bylevel': 0.09378740906981947, 'depth': 9, 'boosting_type': 'Plain', 'bootstrap_type': 'Bayesian', 'bagging_temperature': 4.727695579068671}. Best is trial 1464 with value: 0.8990825688073395.
[32m[I 2023-04-21 00:52:59,390][39m Trial 5297 finished with value: 0.8807339449541284 and parameters: {'objective': 'Logloss', 'colsample_bylevel': 0.09303364673686146, 'depth': 9, 'boosting_type': 'Plain', 'bootstrap_type': 'Bayesian', 'bagging_temperature': 5.86072896529119}. Best is trial 1464 with value: 0.8990825688073395.
[32m[I 2023-04-21 00:53:00,314][39m Trial 5298 finished with value: 0.8672566371681416 and parameters: {'objective': 'Logloss', 'colsample_bylevel': 0.05617913091240429, 'depth': 12, 'boosting_type': 'Plain', 'bootstrap_type': 'Bayesian', 'bagging_temperature': 6.370994622041711}. Best is trial 1464 with value: 0.8990825688073395.
[32m[I 2023-04-21 00:53:01,186][39m Trial 5299 finished with value: 0.8727272727272727 and parameters: {'objective': 'Logloss', 'colsample_bylevel': 0.09270904532117681, 'depth': 8, 'boosting_type': 'Plain', 'bootstrap_type': 'Bayesian', 'bagging_temperature': 5.169876730711713}. Best is trial 1464 with value: 0.8990825688073395.
[32m[I 2023-04-21 00:53:01,863][39m Trial 5300 finished with value: 0.8205128205128206 and parameters: {'objective': 'Logloss', 'colsample_bylevel': 0.05059537646064299, 'depth': 10, 'boosting_type': 'Plain', 'bootstrap_type': 'Bayesian', 'bagging_temperature': 5.052855819755608}. Best is trial 1464 with value: 0.8990825688073395.
[32m[I 2023-04-21 00:53:02,803][39m Trial 5301 finished with value: 0.888888888888889 and parameters: {'objective': 'Logloss', 'colsample_bylevel': 0.09716397840901562, 'depth': 7, 'boosting_type': 'Plain', 'bootstrap_type': 'Bayesian', 'bagging_temperature': 3.9959000752689895}. Best is trial 1464 with value: 0.8990825688073395.
[32m[I 2023-04-21 00:53:04,113][39m Trial 5302 finished with value: 0.8495575221238938 and parameters: {'objective': 'CrossEntropy', 'colsample_bylevel': 0.08450367930573349, 'depth': 12, 'boosting_type': 'Plain', 'bootstrap_type': 'Bayesian', 'bagging_temperature': 4.678971942482149}. Best is trial 1464 with value: 0.8990825688073395.
[32m[I 2023-04-21 00:53:05,465][39m Trial 5303 finished with value: 0.8648648648648648 and parameters: {'objective': 'Logloss', 'colsample_bylevel': 0.08962107072088576, 'depth': 12, 'boosting_type': 'Plain', 'bootstrap_type': 'Bayesian', 'bagging_temperature': 6.251003783492341}. Best is trial 1464 with value: 0.8990825688073395.
[32m[I 2023-04-21 00:53:06,674][39m Trial 5304 finished with value: 0.888888888888889 and parameters: {'objective': 'Logloss', 'colsample_bylevel': 0.09396089442137605, 'depth': 7, 'boosting_type': 'Plain', 'bootstrap_type': 'Bayesian', 'bagging_temperature': 3.554404141156965}. Best is trial 1464 with value: 0.8990825688073395.
[32m[I 2023-04-21 00:53:08,080][39m Trial 5305 finished with value: 0.8571428571428572 and parameters: {'objective': 'Logloss', 'colsample_bylevel': 0.09689438201670608, 'depth': 7, 'boosting_type': 'Plain', 'bootstrap_type': 'Bernoulli', 'subsample': 0.8522503942885783}. Best is trial 1464 with value: 0.8990825688073395.
[32m[I 2023-04-21 00:53:09,063][39m Trial 5306 finished with value: 0.8495575221238938 and parameters: {'objective': 'Logloss', 'colsample_bylevel': 0.09715586257474186, 'depth': 7, 'boosting_type': 'Plain', 'bootstrap_type': 'MVS'}. Best is trial 1464 with value: 0.8990825688073395.
[32m[I 2023-04-21 00:53:10,394][39m Trial 5307 finished with value: 0.8807339449541284 and parameters: {'objective': 'Logloss', 'colsample_bylevel': 0.09666931465159685, 'depth': 7, 'boosting_type': 'Plain', 'bootstrap_type': 'Bayesian', 'bagging_temperature': 7.350381006543142}. Best is trial 1464 with value: 0.8990825688073395.
[32m[I 2023-04-21 00:53:11,312][39m Trial 5308 finished with value: 0.8727272727272727 and parameters: {'objective': 'CrossEntropy', 'colsample_bylevel': 0.09483593629580189, 'depth': 12, 'boosting_type': 'Plain', 'bootstrap_type': 'Bayesian', 'bagging_temperature': 4.2868942249689095}. Best is trial 1464 with value: 0.8990825688073395.
[32m[I 2023-04-21 00:53:15,758][39m Trial 5309 finished with value: 0.8421052631578947 and parameters: {'objective': 'CrossEntropy', 'colsample_bylevel': 0.08434121289944498, 'depth': 9, 'boosting_type': 'Ordered', 'bootstrap_type': 'Bayesian', 'bagging_temperature': 4.814536187529909}. Best is trial 1464 with value: 0.8990825688073395.
[32m[I 2023-04-21 00:53:17,004][39m Trial 5310 finished with value: 0.8807339449541284 and parameters: {'objective': 'CrossEntropy', 'colsample_bylevel': 0.09997299251423984, 'depth': 8, 'boosting_type': 'Plain', 'bootstrap_type': 'Bayesian', 'bagging_temperature': 4.5371776830490544}. Best is trial 1464 with value: 0.8990825688073395.
[32m[I 2023-04-21 00:53:18,297][39m Trial 5311 finished with value: 0.8828828828828829 and parameters: {'objective': 'CrossEntropy', 'colsample_bylevel': 0.08779912721741984, 'depth': 12, 'boosting_type': 'Plain', 'bootstrap_type': 'Bayesian', 'bagging_temperature': 4.984946636573305}. Best is trial 1464 with value: 0.8990825688073395.
[32m[I 2023-04-21 00:53:19,384][39m Trial 5312 finished with value: 0.8305084745762712 and parameters: {'objective': 'Logloss', 'colsample_bylevel': 0.09952397043363015, 'depth': 2, 'boosting_type': 'Plain', 'bootstrap_type': 'Bayesian', 'bagging_temperature': 4.774097350588965}. Best is trial 1464 with value: 0.8990825688073395.
[32m[I 2023-04-21 00:53:20,344][39m Trial 5313 finished with value: 0.8807339449541284 and parameters: {'objective': 'Logloss', 'colsample_bylevel': 0.08591520605838063, 'depth': 11, 'boosting_type': 'Plain', 'bootstrap_type': 'Bayesian', 'bagging_temperature': 7.448489094555434}. Best is trial 1464 with value: 0.8990825688073395.
[32m[I 2023-04-21 00:53:21,475][39m Trial 5314 finished with value: 0.8703703703703703 and parameters: {'objective': 'Logloss', 'colsample_bylevel': 0.09073966563591322, 'depth': 11, 'boosting_type': 'Plain', 'bootstrap_type': 'Bayesian', 'bagging_temperature': 3.4900802183110025}. Best is trial 1464 with value: 0.8990825688073395.
[32m[I 2023-04-21 00:53:22,627][39m Trial 5315 finished with value: 0.8727272727272727 and parameters: {'objective': 'Logloss', 'colsample_bylevel': 0.08887860903852045, 'depth': 11, 'boosting_type': 'Plain', 'bootstrap_type': 'Bayesian', 'bagging_temperature': 6.884848546518839}. Best is trial 1464 with value: 0.8990825688073395.
[32m[I 2023-04-21 00:53:23,963][39m Trial 5316 finished with value: 0.875 and parameters: {'objective': 'CrossEntropy', 'colsample_bylevel': 0.09093024606962463, 'depth': 12, 'boosting_type': 'Plain', 'bootstrap_type': 'Bayesian', 'bagging_temperature': 6.125893445400102}. Best is trial 1464 with value: 0.8990825688073395.
[32m[I 2023-04-21 00:53:25,264][39m Trial 5317 finished with value: 0.8623853211009175 and parameters: {'objective': 'Logloss', 'colsample_bylevel': 0.08948567444587609, 'depth': 12, 'boosting_type': 'Plain', 'bootstrap_type': 'Bayesian', 'bagging_temperature': 7.484636785964048}. Best is trial 1464 with value: 0.8990825688073395.
[32m[I 2023-04-21 00:53:26,541][39m Trial 5318 finished with value: 0.8448275862068967 and parameters: {'objective': 'CrossEntropy', 'colsample_bylevel': 0.04536641300519664, 'depth': 8, 'boosting_type': 'Plain', 'bootstrap_type': 'Bayesian', 'bagging_temperature': 5.517483643216463}. Best is trial 1464 with value: 0.8990825688073395.
[32m[I 2023-04-21 00:53:27,692][39m Trial 5319 finished with value: 0.8648648648648648 and parameters: {'objective': 'Logloss', 'colsample_bylevel': 0.09182394361832896, 'depth': 8, 'boosting_type': 'Plain', 'bootstrap_type': 'Bayesian', 'bagging_temperature': 5.667771657086667}. Best is trial 1464 with value: 0.8990825688073395.
[32m[I 2023-04-21 00:53:28,802][39m Trial 5320 finished with value: 0.8727272727272727 and parameters: {'objective': 'Logloss', 'colsample_bylevel': 0.09522796903493057, 'depth': 9, 'boosting_type': 'Plain', 'bootstrap_type': 'Bayesian', 'bagging_temperature': 6.670441456908722}. Best is trial 1464 with value: 0.8990825688073395.
[32m[I 2023-04-21 00:53:29,558][39m Trial 5321 finished with value: 0.8727272727272727 and parameters: {'objective': 'CrossEntropy', 'colsample_bylevel': 0.09599564275787673, 'depth': 10, 'boosting_type': 'Plain', 'bootstrap_type': 'Bayesian', 'bagging_temperature': 6.874532196620079}. Best is trial 1464 with value: 0.8990825688073395.
[32m[I 2023-04-21 00:53:31,040][39m Trial 5322 finished with value: 0.8807339449541284 and parameters: {'objective': 'Logloss', 'colsample_bylevel': 0.09005519075440001, 'depth': 11, 'boosting_type': 'Plain', 'bootstrap_type': 'Bayesian', 'bagging_temperature': 5.165142828380138}. Best is trial 1464 with value: 0.8990825688073395.
[32m[I 2023-04-21 00:53:32,036][39m Trial 5323 finished with value: 0.8807339449541284 and parameters: {'objective': 'CrossEntropy', 'colsample_bylevel': 0.09894731665717948, 'depth': 8, 'boosting_type': 'Plain', 'bootstrap_type': 'Bayesian', 'bagging_temperature': 4.081379994105326}. Best is trial 1464 with value: 0.8990825688073395.
[32m[I 2023-04-21 00:53:32,964][39m Trial 5324 finished with value: 0.8623853211009175 and parameters: {'objective': 'CrossEntropy', 'colsample_bylevel': 0.08462219940216939, 'depth': 11, 'boosting_type': 'Plain', 'bootstrap_type': 'Bayesian', 'bagging_temperature': 4.631632511120146}. Best is trial 1464 with value: 0.8990825688073395.
[32m[I 2023-04-21 00:53:33,992][39m Trial 5325 finished with value: 0.8807339449541284 and parameters: {'objective': 'Logloss', 'colsample_bylevel': 0.09979481571665236, 'depth': 7, 'boosting_type': 'Plain', 'bootstrap_type': 'Bayesian', 'bagging_temperature': 4.858584503118954}. Best is trial 1464 with value: 0.8990825688073395.
[32m[I 2023-04-21 00:53:34,806][39m Trial 5326 finished with value: 0.8392857142857144 and parameters: {'objective': 'Logloss', 'colsample_bylevel': 0.09012666940918959, 'depth': 11, 'boosting_type': 'Plain', 'bootstrap_type': 'Bernoulli', 'subsample': 0.5106670695559709}. Best is trial 1464 with value: 0.8990825688073395.
[32m[I 2023-04-21 00:53:40,231][39m Trial 5327 finished with value: 0.831858407079646 and parameters: {'objective': 'Logloss', 'colsample_bylevel': 0.09793857883475976, 'depth': 12, 'boosting_type': 'Ordered', 'bootstrap_type': 'Bayesian', 'bagging_temperature': 4.307675500047355}. Best is trial 1464 with value: 0.8990825688073395.
[32m[I 2023-04-21 00:53:41,079][39m Trial 5328 finished with value: 0.8495575221238938 and parameters: {'objective': 'CrossEntropy', 'colsample_bylevel': 0.09751355355754171, 'depth': 11, 'boosting_type': 'Plain', 'bootstrap_type': 'MVS'}. Best is trial 1464 with value: 0.8990825688073395.
[32m[I 2023-04-21 00:53:42,952][39m Trial 5329 finished with value: 0.8648648648648648 and parameters: {'objective': 'Logloss', 'colsample_bylevel': 0.09467738256323226, 'depth': 9, 'boosting_type': 'Plain', 'bootstrap_type': 'Bayesian', 'bagging_temperature': 6.813203857269709}. Best is trial 1464 with value: 0.8990825688073395.
