[32m[I 2023-04-20 23:30:38,200][39m Trial 1590 finished with value: 0.8495575221238938 and parameters: {'objective': 'Logloss', 'colsample_bylevel': 0.09851639778191926, 'depth': 12, 'boosting_type': 'Plain', 'bootstrap_type': 'Bernoulli', 'subsample': 0.9510502588776807}. Best is trial 1464 with value: 0.8990825688073395.
[32m[I 2023-04-20 23:30:39,153][39m Trial 1591 finished with value: 0.8828828828828829 and parameters: {'objective': 'Logloss', 'colsample_bylevel': 0.09551933291229837, 'depth': 8, 'boosting_type': 'Plain', 'bootstrap_type': 'Bayesian', 'bagging_temperature': 3.467340052843697}. Best is trial 1464 with value: 0.8990825688073395.
[32m[I 2023-04-20 23:30:39,877][39m Trial 1592 finished with value: 0.8703703703703703 and parameters: {'objective': 'CrossEntropy', 'colsample_bylevel': 0.09480056633069796, 'depth': 9, 'boosting_type': 'Plain', 'bootstrap_type': 'Bayesian', 'bagging_temperature': 7.809017103620673}. Best is trial 1464 with value: 0.8990825688073395.
[32m[I 2023-04-20 23:30:40,849][39m Trial 1593 finished with value: 0.8727272727272727 and parameters: {'objective': 'Logloss', 'colsample_bylevel': 0.0998954453483309, 'depth': 8, 'boosting_type': 'Plain', 'bootstrap_type': 'Bernoulli', 'subsample': 0.3932535890504219}. Best is trial 1464 with value: 0.8990825688073395.
[32m[I 2023-04-20 23:30:42,402][39m Trial 1594 finished with value: 0.8807339449541284 and parameters: {'objective': 'Logloss', 'colsample_bylevel': 0.09648045154447875, 'depth': 8, 'boosting_type': 'Plain', 'bootstrap_type': 'Bayesian', 'bagging_temperature': 4.333264380522212}. Best is trial 1464 with value: 0.8990825688073395.
[32m[I 2023-04-20 23:30:43,061][39m Trial 1595 finished with value: 0.8648648648648648 and parameters: {'objective': 'CrossEntropy', 'colsample_bylevel': 0.09225886897755732, 'depth': 12, 'boosting_type': 'Plain', 'bootstrap_type': 'Bernoulli', 'subsample': 0.6201517121165938}. Best is trial 1464 with value: 0.8990825688073395.
[32m[I 2023-04-20 23:30:43,808][39m Trial 1596 finished with value: 0.8727272727272727 and parameters: {'objective': 'Logloss', 'colsample_bylevel': 0.09789565500785026, 'depth': 7, 'boosting_type': 'Plain', 'bootstrap_type': 'Bayesian', 'bagging_temperature': 6.169877731924403}. Best is trial 1464 with value: 0.8990825688073395.
[32m[I 2023-04-20 23:30:45,501][39m Trial 1597 finished with value: 0.888888888888889 and parameters: {'objective': 'Logloss', 'colsample_bylevel': 0.09999389425922235, 'depth': 9, 'boosting_type': 'Plain', 'bootstrap_type': 'Bayesian', 'bagging_temperature': 4.453428645434791}. Best is trial 1464 with value: 0.8990825688073395.
[32m[I 2023-04-20 23:30:47,006][39m Trial 1598 finished with value: 0.8807339449541284 and parameters: {'objective': 'CrossEntropy', 'colsample_bylevel': 0.09183867955123712, 'depth': 9, 'boosting_type': 'Plain', 'bootstrap_type': 'Bayesian', 'bagging_temperature': 4.3416945040279735}. Best is trial 1464 with value: 0.8990825688073395.
[32m[I 2023-04-20 23:30:47,953][39m Trial 1599 finished with value: 0.8727272727272727 and parameters: {'objective': 'Logloss', 'colsample_bylevel': 0.09993183693544919, 'depth': 8, 'boosting_type': 'Plain', 'bootstrap_type': 'Bernoulli', 'subsample': 0.5448325431461003}. Best is trial 1464 with value: 0.8990825688073395.
[32m[I 2023-04-20 23:30:48,731][39m Trial 1600 finished with value: 0.8648648648648648 and parameters: {'objective': 'Logloss', 'colsample_bylevel': 0.09400799511771708, 'depth': 11, 'boosting_type': 'Plain', 'bootstrap_type': 'Bayesian', 'bagging_temperature': 5.294977207875185}. Best is trial 1464 with value: 0.8990825688073395.
[32m[I 2023-04-20 23:30:49,584][39m Trial 1601 finished with value: 0.8392857142857144 and parameters: {'objective': 'CrossEntropy', 'colsample_bylevel': 0.09579413290256511, 'depth': 5, 'boosting_type': 'Plain', 'bootstrap_type': 'Bayesian', 'bagging_temperature': 4.776921421323968}. Best is trial 1464 with value: 0.8990825688073395.
[32m[I 2023-04-20 23:30:50,470][39m Trial 1602 finished with value: 0.8727272727272727 and parameters: {'objective': 'Logloss', 'colsample_bylevel': 0.09797936333719515, 'depth': 9, 'boosting_type': 'Plain', 'bootstrap_type': 'Bayesian', 'bagging_temperature': 5.188602219534063}. Best is trial 1464 with value: 0.8990825688073395.
[32m[I 2023-04-20 23:30:55,183][39m Trial 1603 finished with value: 0.8305084745762712 and parameters: {'objective': 'Logloss', 'colsample_bylevel': 0.02597149494973698, 'depth': 8, 'boosting_type': 'Ordered', 'bootstrap_type': 'Bayesian', 'bagging_temperature': 5.51998115879541}. Best is trial 1464 with value: 0.8990825688073395.
[32m[I 2023-04-20 23:30:56,390][39m Trial 1604 finished with value: 0.8727272727272727 and parameters: {'objective': 'Logloss', 'colsample_bylevel': 0.09021991709206634, 'depth': 10, 'boosting_type': 'Plain', 'bootstrap_type': 'Bayesian', 'bagging_temperature': 5.545598829242536}. Best is trial 1464 with value: 0.8990825688073395.
[32m[I 2023-04-20 23:30:57,365][39m Trial 1605 finished with value: 0.875 and parameters: {'objective': 'CrossEntropy', 'colsample_bylevel': 0.09402041052516746, 'depth': 11, 'boosting_type': 'Plain', 'bootstrap_type': 'Bayesian', 'bagging_temperature': 4.147076318289125}. Best is trial 1464 with value: 0.8990825688073395.
[32m[I 2023-04-20 23:30:58,544][39m Trial 1606 finished with value: 0.8648648648648648 and parameters: {'objective': 'Logloss', 'colsample_bylevel': 0.09703265569056022, 'depth': 7, 'boosting_type': 'Plain', 'bootstrap_type': 'Bernoulli', 'subsample': 0.17407201563875846}. Best is trial 1464 with value: 0.8990825688073395.
[32m[I 2023-04-20 23:31:00,204][39m Trial 1607 finished with value: 0.8727272727272727 and parameters: {'objective': 'CrossEntropy', 'colsample_bylevel': 0.09603334536600189, 'depth': 9, 'boosting_type': 'Plain', 'bootstrap_type': 'Bayesian', 'bagging_temperature': 4.6681678326881775}. Best is trial 1464 with value: 0.8990825688073395.
[32m[I 2023-04-20 23:31:01,595][39m Trial 1608 finished with value: 0.8807339449541284 and parameters: {'objective': 'CrossEntropy', 'colsample_bylevel': 0.09787205423587488, 'depth': 10, 'boosting_type': 'Plain', 'bootstrap_type': 'MVS'}. Best is trial 1464 with value: 0.8990825688073395.
[32m[I 2023-04-20 23:31:02,586][39m Trial 1609 finished with value: 0.8807339449541284 and parameters: {'objective': 'Logloss', 'colsample_bylevel': 0.0999118517209779, 'depth': 9, 'boosting_type': 'Plain', 'bootstrap_type': 'Bayesian', 'bagging_temperature': 3.6166102391499706}. Best is trial 1464 with value: 0.8990825688073395.
[32m[I 2023-04-20 23:31:03,183][39m Trial 1610 finished with value: 0.8571428571428572 and parameters: {'objective': 'CrossEntropy', 'colsample_bylevel': 0.0930079980504379, 'depth': 9, 'boosting_type': 'Plain', 'bootstrap_type': 'Bernoulli', 'subsample': 0.5708796091481155}. Best is trial 1464 with value: 0.8990825688073395.
[32m[I 2023-04-20 23:31:03,826][39m Trial 1611 finished with value: 0.875 and parameters: {'objective': 'Logloss', 'colsample_bylevel': 0.09681503001396194, 'depth': 7, 'boosting_type': 'Plain', 'bootstrap_type': 'Bayesian', 'bagging_temperature': 6.511433477678066}. Best is trial 1464 with value: 0.8990825688073395.
[32m[I 2023-04-20 23:31:04,797][39m Trial 1612 finished with value: 0.8727272727272727 and parameters: {'objective': 'Logloss', 'colsample_bylevel': 0.09535159458306058, 'depth': 10, 'boosting_type': 'Plain', 'bootstrap_type': 'Bayesian', 'bagging_temperature': 5.603591344679614}. Best is trial 1464 with value: 0.8990825688073395.
[32m[I 2023-04-20 23:31:06,173][39m Trial 1613 finished with value: 0.8807339449541284 and parameters: {'objective': 'Logloss', 'colsample_bylevel': 0.08359602188969333, 'depth': 9, 'boosting_type': 'Plain', 'bootstrap_type': 'Bayesian', 'bagging_temperature': 4.022864378903604}. Best is trial 1464 with value: 0.8990825688073395.
[32m[I 2023-04-20 23:31:06,960][39m Trial 1614 finished with value: 0.8727272727272727 and parameters: {'objective': 'CrossEntropy', 'colsample_bylevel': 0.08855512196316556, 'depth': 9, 'boosting_type': 'Plain', 'bootstrap_type': 'Bayesian', 'bagging_temperature': 4.88562336002471}. Best is trial 1464 with value: 0.8990825688073395.
[32m[I 2023-04-20 23:31:08,206][39m Trial 1615 finished with value: 0.8495575221238938 and parameters: {'objective': 'Logloss', 'colsample_bylevel': 0.09808956485205199, 'depth': 12, 'boosting_type': 'Plain', 'bootstrap_type': 'MVS'}. Best is trial 1464 with value: 0.8990825688073395.
[32m[I 2023-04-20 23:31:09,092][39m Trial 1616 finished with value: 0.8672566371681416 and parameters: {'objective': 'CrossEntropy', 'colsample_bylevel': 0.08962437245103146, 'depth': 10, 'boosting_type': 'Plain', 'bootstrap_type': 'Bayesian', 'bagging_temperature': 9.261808399144524}. Best is trial 1464 with value: 0.8990825688073395.
[32m[I 2023-04-20 23:31:10,376][39m Trial 1617 finished with value: 0.8727272727272727 and parameters: {'objective': 'Logloss', 'colsample_bylevel': 0.09738910173837584, 'depth': 9, 'boosting_type': 'Plain', 'bootstrap_type': 'Bayesian', 'bagging_temperature': 6.9710607650104865}. Best is trial 1464 with value: 0.8990825688073395.
[32m[I 2023-04-20 23:31:11,362][39m Trial 1618 finished with value: 0.8727272727272727 and parameters: {'objective': 'Logloss', 'colsample_bylevel': 0.09415338216905017, 'depth': 10, 'boosting_type': 'Plain', 'bootstrap_type': 'Bayesian', 'bagging_temperature': 4.056987518563256}. Best is trial 1464 with value: 0.8990825688073395.
[32m[I 2023-04-20 23:31:12,339][39m Trial 1619 finished with value: 0.8807339449541284 and parameters: {'objective': 'CrossEntropy', 'colsample_bylevel': 0.0950066518176626, 'depth': 7, 'boosting_type': 'Plain', 'bootstrap_type': 'Bayesian', 'bagging_temperature': 5.088357407739235}. Best is trial 1464 with value: 0.8990825688073395.
[32m[I 2023-04-20 23:31:13,366][39m Trial 1620 finished with value: 0.8596491228070176 and parameters: {'objective': 'CrossEntropy', 'colsample_bylevel': 0.08618967139969257, 'depth': 9, 'boosting_type': 'Plain', 'bootstrap_type': 'Bayesian', 'bagging_temperature': 4.601261305722415}. Best is trial 1464 with value: 0.8990825688073395.
[32m[I 2023-04-20 23:31:15,477][39m Trial 1621 finished with value: 0.8571428571428572 and parameters: {'objective': 'Logloss', 'colsample_bylevel': 0.09670873895626915, 'depth': 9, 'boosting_type': 'Plain', 'bootstrap_type': 'Bernoulli', 'subsample': 0.5057005695396446}. Best is trial 1464 with value: 0.8990825688073395.
[32m[I 2023-04-20 23:31:20,000][39m Trial 1622 finished with value: 0.8347826086956522 and parameters: {'objective': 'Logloss', 'colsample_bylevel': 0.09413031059698207, 'depth': 9, 'boosting_type': 'Ordered', 'bootstrap_type': 'Bayesian', 'bagging_temperature': 3.940650371421619}. Best is trial 1464 with value: 0.8990825688073395.
[32m[I 2023-04-20 23:31:21,360][39m Trial 1623 finished with value: 0.8571428571428572 and parameters: {'objective': 'Logloss', 'colsample_bylevel': 0.098313944135629, 'depth': 8, 'boosting_type': 'Plain', 'bootstrap_type': 'Bayesian', 'bagging_temperature': 6.984928994745289}. Best is trial 1464 with value: 0.8990825688073395.
[32m[I 2023-04-20 23:31:23,087][39m Trial 1624 finished with value: 0.8807339449541284 and parameters: {'objective': 'CrossEntropy', 'colsample_bylevel': 0.0989258274010187, 'depth': 9, 'boosting_type': 'Plain', 'bootstrap_type': 'Bayesian', 'bagging_temperature': 4.51846327376301}. Best is trial 1464 with value: 0.8990825688073395.
[32m[I 2023-04-20 23:31:23,974][39m Trial 1625 finished with value: 0.888888888888889 and parameters: {'objective': 'Logloss', 'colsample_bylevel': 0.09989061955464028, 'depth': 8, 'boosting_type': 'Plain', 'bootstrap_type': 'Bayesian', 'bagging_temperature': 3.3281391221388157}. Best is trial 1464 with value: 0.8990825688073395.
[32m[I 2023-04-20 23:31:24,673][39m Trial 1626 finished with value: 0.8807339449541284 and parameters: {'objective': 'Logloss', 'colsample_bylevel': 0.09739246356021568, 'depth': 7, 'boosting_type': 'Plain', 'bootstrap_type': 'Bayesian', 'bagging_temperature': 5.126121428561226}. Best is trial 1464 with value: 0.8990825688073395.
[32m[I 2023-04-20 23:31:25,803][39m Trial 1627 finished with value: 0.8727272727272727 and parameters: {'objective': 'Logloss', 'colsample_bylevel': 0.09993484549881129, 'depth': 8, 'boosting_type': 'Plain', 'bootstrap_type': 'Bayesian', 'bagging_temperature': 3.6458788009375276}. Best is trial 1464 with value: 0.8990825688073395.
[32m[I 2023-04-20 23:31:27,012][39m Trial 1628 finished with value: 0.8785046728971961 and parameters: {'objective': 'CrossEntropy', 'colsample_bylevel': 0.08912447973870602, 'depth': 10, 'boosting_type': 'Plain', 'bootstrap_type': 'Bayesian', 'bagging_temperature': 4.942236000234494}. Best is trial 1464 with value: 0.8990825688073395.
[32m[I 2023-04-20 23:31:28,241][39m Trial 1629 finished with value: 0.8596491228070176 and parameters: {'objective': 'Logloss', 'colsample_bylevel': 0.038343527462045376, 'depth': 9, 'boosting_type': 'Plain', 'bootstrap_type': 'Bayesian', 'bagging_temperature': 4.616952959049652}. Best is trial 1464 with value: 0.8990825688073395.
[32m[I 2023-04-20 23:31:30,362][39m Trial 1630 finished with value: 0.8623853211009175 and parameters: {'objective': 'Logloss', 'colsample_bylevel': 0.0938649860108688, 'depth': 9, 'boosting_type': 'Plain', 'bootstrap_type': 'Bayesian', 'bagging_temperature': 5.715652683133625}. Best is trial 1464 with value: 0.8990825688073395.
[32m[I 2023-04-20 23:31:31,013][39m Trial 1631 finished with value: 0.8727272727272727 and parameters: {'objective': 'Logloss', 'colsample_bylevel': 0.09357036104719384, 'depth': 11, 'boosting_type': 'Plain', 'bootstrap_type': 'Bayesian', 'bagging_temperature': 3.9700638738832232}. Best is trial 1464 with value: 0.8990825688073395.
[32m[I 2023-04-20 23:31:31,589][39m Trial 1632 finished with value: 0.8596491228070176 and parameters: {'objective': 'Logloss', 'colsample_bylevel': 0.05790637043352527, 'depth': 11, 'boosting_type': 'Plain', 'bootstrap_type': 'Bayesian', 'bagging_temperature': 4.415949147575869}. Best is trial 1464 with value: 0.8990825688073395.
[32m[I 2023-04-20 23:31:32,297][39m Trial 1633 finished with value: 0.8571428571428572 and parameters: {'objective': 'CrossEntropy', 'colsample_bylevel': 0.09650901094277776, 'depth': 9, 'boosting_type': 'Plain', 'bootstrap_type': 'Bernoulli', 'subsample': 0.3256226013780711}. Best is trial 1464 with value: 0.8990825688073395.
[32m[I 2023-04-20 23:31:32,983][39m Trial 1634 finished with value: 0.8727272727272727 and parameters: {'objective': 'Logloss', 'colsample_bylevel': 0.09655716185580882, 'depth': 12, 'boosting_type': 'Plain', 'bootstrap_type': 'Bayesian', 'bagging_temperature': 6.206712554571192}. Best is trial 1464 with value: 0.8990825688073395.
[32m[I 2023-04-20 23:31:34,260][39m Trial 1635 finished with value: 0.8727272727272727 and parameters: {'objective': 'Logloss', 'colsample_bylevel': 0.09196857981934638, 'depth': 8, 'boosting_type': 'Plain', 'bootstrap_type': 'Bayesian', 'bagging_temperature': 5.390213706199653}. Best is trial 1464 with value: 0.8990825688073395.
[32m[I 2023-04-20 23:31:35,824][39m Trial 1636 finished with value: 0.8623853211009175 and parameters: {'objective': 'Logloss', 'colsample_bylevel': 0.09182290870155535, 'depth': 8, 'boosting_type': 'Plain', 'bootstrap_type': 'Bayesian', 'bagging_temperature': 5.206402584976887}. Best is trial 1464 with value: 0.8990825688073395.
[32m[I 2023-04-20 23:31:37,104][39m Trial 1637 finished with value: 0.8703703703703703 and parameters: {'objective': 'Logloss', 'colsample_bylevel': 0.09311771415598653, 'depth': 11, 'boosting_type': 'Plain', 'bootstrap_type': 'Bayesian', 'bagging_temperature': 5.200655783078294}. Best is trial 1464 with value: 0.8990825688073395.
[32m[I 2023-04-20 23:31:37,802][39m Trial 1638 finished with value: 0.8807339449541284 and parameters: {'objective': 'CrossEntropy', 'colsample_bylevel': 0.09197968272569372, 'depth': 11, 'boosting_type': 'Plain', 'bootstrap_type': 'Bayesian', 'bagging_temperature': 5.532118933774863}. Best is trial 1464 with value: 0.8990825688073395.
[32m[I 2023-04-20 23:31:38,578][39m Trial 1639 finished with value: 0.8623853211009175 and parameters: {'objective': 'Logloss', 'colsample_bylevel': 0.09749917398660245, 'depth': 8, 'boosting_type': 'Plain', 'bootstrap_type': 'Bayesian', 'bagging_temperature': 6.631631203259891}. Best is trial 1464 with value: 0.8990825688073395.
[32m[I 2023-04-20 23:31:39,298][39m Trial 1640 finished with value: 0.8828828828828829 and parameters: {'objective': 'Logloss', 'colsample_bylevel': 0.09543635837980792, 'depth': 8, 'boosting_type': 'Plain', 'bootstrap_type': 'Bayesian', 'bagging_temperature': 3.244032111329449}. Best is trial 1464 with value: 0.8990825688073395.
[32m[I 2023-04-20 23:31:44,863][39m Trial 1641 finished with value: 0.8421052631578947 and parameters: {'objective': 'Logloss', 'colsample_bylevel': 0.09862158591643636, 'depth': 9, 'boosting_type': 'Ordered', 'bootstrap_type': 'Bayesian', 'bagging_temperature': 4.90862820289465}. Best is trial 1464 with value: 0.8990825688073395.
[32m[I 2023-04-20 23:31:46,000][39m Trial 1642 finished with value: 0.8571428571428572 and parameters: {'objective': 'Logloss', 'colsample_bylevel': 0.09547641507755825, 'depth': 10, 'boosting_type': 'Plain', 'bootstrap_type': 'Bayesian', 'bagging_temperature': 1.6427925221240005}. Best is trial 1464 with value: 0.8990825688073395.
[32m[I 2023-04-20 23:31:46,991][39m Trial 1643 finished with value: 0.888888888888889 and parameters: {'objective': 'CrossEntropy', 'colsample_bylevel': 0.09574364357300495, 'depth': 10, 'boosting_type': 'Plain', 'bootstrap_type': 'Bayesian', 'bagging_temperature': 4.127875065933616}. Best is trial 1464 with value: 0.8990825688073395.
[32m[I 2023-04-20 23:31:47,697][39m Trial 1644 finished with value: 0.8571428571428572 and parameters: {'objective': 'CrossEntropy', 'colsample_bylevel': 0.09400566428497172, 'depth': 12, 'boosting_type': 'Plain', 'bootstrap_type': 'Bernoulli', 'subsample': 0.5929107454196197}. Best is trial 1464 with value: 0.8990825688073395.
[32m[I 2023-04-20 23:31:49,269][39m Trial 1645 finished with value: 0.8807339449541284 and parameters: {'objective': 'CrossEntropy', 'colsample_bylevel': 0.09471508003049159, 'depth': 12, 'boosting_type': 'Plain', 'bootstrap_type': 'Bayesian', 'bagging_temperature': 5.322300549451808}. Best is trial 1464 with value: 0.8990825688073395.
[32m[I 2023-04-20 23:31:50,952][39m Trial 1646 finished with value: 0.8828828828828829 and parameters: {'objective': 'Logloss', 'colsample_bylevel': 0.09817608759293747, 'depth': 8, 'boosting_type': 'Plain', 'bootstrap_type': 'Bayesian', 'bagging_temperature': 3.7799412576151856}. Best is trial 1464 with value: 0.8990825688073395.
[32m[I 2023-04-20 23:31:52,258][39m Trial 1647 finished with value: 0.888888888888889 and parameters: {'objective': 'Logloss', 'colsample_bylevel': 0.09727718627770551, 'depth': 9, 'boosting_type': 'Plain', 'bootstrap_type': 'Bayesian', 'bagging_temperature': 4.696517656640741}. Best is trial 1464 with value: 0.8990825688073395.
[32m[I 2023-04-20 23:31:52,947][39m Trial 1648 finished with value: 0.8623853211009175 and parameters: {'objective': 'Logloss', 'colsample_bylevel': 0.09505988964169533, 'depth': 7, 'boosting_type': 'Plain', 'bootstrap_type': 'Bayesian', 'bagging_temperature': 5.225631388166715}. Best is trial 1464 with value: 0.8990825688073395.
[32m[I 2023-04-20 23:31:54,143][39m Trial 1649 finished with value: 0.8807339449541284 and parameters: {'objective': 'Logloss', 'colsample_bylevel': 0.09576487896492639, 'depth': 9, 'boosting_type': 'Plain', 'bootstrap_type': 'Bayesian', 'bagging_temperature': 5.023681784822724}. Best is trial 1464 with value: 0.8990825688073395.
[32m[I 2023-04-20 23:31:55,964][39m Trial 1650 finished with value: 0.8807339449541284 and parameters: {'objective': 'Logloss', 'colsample_bylevel': 0.09449928995267017, 'depth': 9, 'boosting_type': 'Plain', 'bootstrap_type': 'Bayesian', 'bagging_temperature': 3.439874173025075}. Best is trial 1464 with value: 0.8990825688073395.
[32m[I 2023-04-20 23:31:57,003][39m Trial 1651 finished with value: 0.8727272727272727 and parameters: {'objective': 'CrossEntropy', 'colsample_bylevel': 0.0998630691132601, 'depth': 11, 'boosting_type': 'Plain', 'bootstrap_type': 'Bernoulli', 'subsample': 0.46937236481637024}. Best is trial 1464 with value: 0.8990825688073395.
[32m[I 2023-04-20 23:31:57,957][39m Trial 1652 finished with value: 0.8623853211009175 and parameters: {'objective': 'CrossEntropy', 'colsample_bylevel': 0.09802346482853692, 'depth': 12, 'boosting_type': 'Plain', 'bootstrap_type': 'Bayesian', 'bagging_temperature': 1.4207008001083306}. Best is trial 1464 with value: 0.8990825688073395.
[32m[I 2023-04-20 23:31:58,527][39m Trial 1653 finished with value: 0.8648648648648648 and parameters: {'objective': 'CrossEntropy', 'colsample_bylevel': 0.09145369707367335, 'depth': 10, 'boosting_type': 'Plain', 'bootstrap_type': 'Bayesian', 'bagging_temperature': 4.416527275167289}. Best is trial 1464 with value: 0.8990825688073395.
[32m[I 2023-04-20 23:31:59,079][39m Trial 1654 finished with value: 0.8648648648648648 and parameters: {'objective': 'CrossEntropy', 'colsample_bylevel': 0.09584473134281762, 'depth': 10, 'boosting_type': 'Plain', 'bootstrap_type': 'Bernoulli', 'subsample': 0.42778583839093876}. Best is trial 1464 with value: 0.8990825688073395.
[32m[I 2023-04-20 23:31:59,749][39m Trial 1655 finished with value: 0.8727272727272727 and parameters: {'objective': 'Logloss', 'colsample_bylevel': 0.09787257962947456, 'depth': 7, 'boosting_type': 'Plain', 'bootstrap_type': 'Bayesian', 'bagging_temperature': 6.468556563263248}. Best is trial 1464 with value: 0.8990825688073395.
