[32m[I 2023-04-20 23:12:34,763][39m Trial 730 finished with value: 0.8807339449541284 and parameters: {'objective': 'Logloss', 'colsample_bylevel': 0.0947120964099615, 'depth': 9, 'boosting_type': 'Plain', 'bootstrap_type': 'Bayesian', 'bagging_temperature': 4.658061462719733}. Best is trial 205 with value: 0.890909090909091.
[32m[I 2023-04-20 23:12:35,469][39m Trial 731 finished with value: 0.8648648648648648 and parameters: {'objective': 'CrossEntropy', 'colsample_bylevel': 0.09550419961021034, 'depth': 10, 'boosting_type': 'Plain', 'bootstrap_type': 'Bernoulli', 'subsample': 0.14829760708824147}. Best is trial 205 with value: 0.890909090909091.
[32m[I 2023-04-20 23:12:36,861][39m Trial 732 finished with value: 0.8828828828828829 and parameters: {'objective': 'Logloss', 'colsample_bylevel': 0.09826692559741737, 'depth': 9, 'boosting_type': 'Plain', 'bootstrap_type': 'Bayesian', 'bagging_temperature': 4.75580500123551}. Best is trial 205 with value: 0.890909090909091.
[32m[I 2023-04-20 23:12:37,662][39m Trial 733 finished with value: 0.8545454545454546 and parameters: {'objective': 'Logloss', 'colsample_bylevel': 0.09887405810071125, 'depth': 8, 'boosting_type': 'Plain', 'bootstrap_type': 'Bayesian', 'bagging_temperature': 3.1437313885669425}. Best is trial 205 with value: 0.890909090909091.
[32m[I 2023-04-20 23:12:38,848][39m Trial 734 finished with value: 0.8648648648648648 and parameters: {'objective': 'Logloss', 'colsample_bylevel': 0.0962464977737245, 'depth': 7, 'boosting_type': 'Plain', 'bootstrap_type': 'Bayesian', 'bagging_temperature': 5.656585139025245}. Best is trial 205 with value: 0.890909090909091.
[32m[I 2023-04-20 23:12:40,411][39m Trial 735 finished with value: 0.8807339449541284 and parameters: {'objective': 'Logloss', 'colsample_bylevel': 0.0999631411266276, 'depth': 9, 'boosting_type': 'Plain', 'bootstrap_type': 'Bayesian', 'bagging_temperature': 5.090004774993644}. Best is trial 205 with value: 0.890909090909091.
[32m[I 2023-04-20 23:12:41,287][39m Trial 736 finished with value: 0.8727272727272727 and parameters: {'objective': 'Logloss', 'colsample_bylevel': 0.09313880729474247, 'depth': 10, 'boosting_type': 'Plain', 'bootstrap_type': 'Bayesian', 'bagging_temperature': 6.4403909683836975}. Best is trial 205 with value: 0.890909090909091.
[32m[I 2023-04-20 23:12:42,119][39m Trial 737 finished with value: 0.8727272727272727 and parameters: {'objective': 'Logloss', 'colsample_bylevel': 0.09547393395023653, 'depth': 8, 'boosting_type': 'Plain', 'bootstrap_type': 'Bayesian', 'bagging_temperature': 4.410770489517751}. Best is trial 205 with value: 0.890909090909091.
[32m[I 2023-04-20 23:12:42,721][39m Trial 738 finished with value: 0.8275862068965517 and parameters: {'objective': 'Logloss', 'colsample_bylevel': 0.09052808233828961, 'depth': 5, 'boosting_type': 'Plain', 'bootstrap_type': 'Bayesian', 'bagging_temperature': 3.9295151757688593}. Best is trial 205 with value: 0.890909090909091.
[32m[I 2023-04-20 23:12:43,567][39m Trial 739 finished with value: 0.8727272727272727 and parameters: {'objective': 'Logloss', 'colsample_bylevel': 0.09661670513306131, 'depth': 9, 'boosting_type': 'Plain', 'bootstrap_type': 'Bayesian', 'bagging_temperature': 4.1954043077567285}. Best is trial 205 with value: 0.890909090909091.
[32m[I 2023-04-20 23:12:44,582][39m Trial 740 finished with value: 0.8648648648648648 and parameters: {'objective': 'Logloss', 'colsample_bylevel': 0.09290313219000441, 'depth': 8, 'boosting_type': 'Plain', 'bootstrap_type': 'Bayesian', 'bagging_temperature': 2.605148844900518}. Best is trial 205 with value: 0.890909090909091.
[32m[I 2023-04-20 23:12:45,492][39m Trial 741 finished with value: 0.8807339449541284 and parameters: {'objective': 'Logloss', 'colsample_bylevel': 0.09813829587486515, 'depth': 7, 'boosting_type': 'Plain', 'bootstrap_type': 'Bayesian', 'bagging_temperature': 4.8760554803386364}. Best is trial 205 with value: 0.890909090909091.
[32m[I 2023-04-20 23:12:46,618][39m Trial 742 finished with value: 0.8347826086956522 and parameters: {'objective': 'Logloss', 'colsample_bylevel': 0.06973153257465019, 'depth': 9, 'boosting_type': 'Plain', 'bootstrap_type': 'Bayesian', 'bagging_temperature': 4.351744446553581}. Best is trial 205 with value: 0.890909090909091.
[32m[I 2023-04-20 23:12:47,674][39m Trial 743 finished with value: 0.8807339449541284 and parameters: {'objective': 'Logloss', 'colsample_bylevel': 0.09178085187284699, 'depth': 10, 'boosting_type': 'Plain', 'bootstrap_type': 'Bayesian', 'bagging_temperature': 4.126020134145215}. Best is trial 205 with value: 0.890909090909091.
[32m[I 2023-04-20 23:12:49,097][39m Trial 744 finished with value: 0.8727272727272727 and parameters: {'objective': 'Logloss', 'colsample_bylevel': 0.09995490779776249, 'depth': 8, 'boosting_type': 'Plain', 'bootstrap_type': 'Bayesian', 'bagging_temperature': 3.7946253545705857}. Best is trial 205 with value: 0.890909090909091.
[32m[I 2023-04-20 23:12:49,840][39m Trial 745 finished with value: 0.8807339449541284 and parameters: {'objective': 'Logloss', 'colsample_bylevel': 0.09422897295916256, 'depth': 8, 'boosting_type': 'Plain', 'bootstrap_type': 'Bayesian', 'bagging_temperature': 3.3706380921290937}. Best is trial 205 with value: 0.890909090909091.
[32m[I 2023-04-20 23:12:55,320][39m Trial 746 finished with value: 0.8347826086956522 and parameters: {'objective': 'Logloss', 'colsample_bylevel': 0.09593136729024512, 'depth': 9, 'boosting_type': 'Ordered', 'bootstrap_type': 'Bayesian', 'bagging_temperature': 4.4804938776552365}. Best is trial 205 with value: 0.890909090909091.
[32m[I 2023-04-20 23:12:56,685][39m Trial 747 finished with value: 0.8703703703703703 and parameters: {'objective': 'Logloss', 'colsample_bylevel': 0.08968169798435756, 'depth': 7, 'boosting_type': 'Plain', 'bootstrap_type': 'Bayesian', 'bagging_temperature': 6.804663155412112}. Best is trial 205 with value: 0.890909090909091.
[32m[I 2023-04-20 23:12:57,902][39m Trial 748 finished with value: 0.8807339449541284 and parameters: {'objective': 'Logloss', 'colsample_bylevel': 0.0998708180992176, 'depth': 8, 'boosting_type': 'Plain', 'bootstrap_type': 'Bayesian', 'bagging_temperature': 3.918038608328119}. Best is trial 205 with value: 0.890909090909091.
[32m[I 2023-04-20 23:12:59,217][39m Trial 749 finished with value: 0.8828828828828829 and parameters: {'objective': 'Logloss', 'colsample_bylevel': 0.09715682286428547, 'depth': 9, 'boosting_type': 'Plain', 'bootstrap_type': 'Bayesian', 'bagging_temperature': 4.584403581090024}. Best is trial 205 with value: 0.890909090909091.
[32m[I 2023-04-20 23:12:59,807][39m Trial 750 finished with value: 0.8468468468468469 and parameters: {'objective': 'CrossEntropy', 'colsample_bylevel': 0.09323500414689483, 'depth': 11, 'boosting_type': 'Plain', 'bootstrap_type': 'MVS'}. Best is trial 205 with value: 0.890909090909091.
[32m[I 2023-04-20 23:13:01,134][39m Trial 751 finished with value: 0.8727272727272727 and parameters: {'objective': 'Logloss', 'colsample_bylevel': 0.09995590836871868, 'depth': 8, 'boosting_type': 'Plain', 'bootstrap_type': 'Bayesian', 'bagging_temperature': 5.246952548843445}. Best is trial 205 with value: 0.890909090909091.
[32m[I 2023-04-20 23:13:02,032][39m Trial 752 finished with value: 0.8571428571428572 and parameters: {'objective': 'Logloss', 'colsample_bylevel': 0.09837400807525444, 'depth': 4, 'boosting_type': 'Plain', 'bootstrap_type': 'Bayesian', 'bagging_temperature': 3.6889284030271217}. Best is trial 205 with value: 0.890909090909091.
[32m[I 2023-04-20 23:13:03,202][39m Trial 753 finished with value: 0.8727272727272727 and parameters: {'objective': 'Logloss', 'colsample_bylevel': 0.0969372777002122, 'depth': 8, 'boosting_type': 'Plain', 'bootstrap_type': 'Bernoulli', 'subsample': 0.31996390016753673}. Best is trial 205 with value: 0.890909090909091.
[32m[I 2023-04-20 23:13:03,951][39m Trial 754 finished with value: 0.8727272727272727 and parameters: {'objective': 'Logloss', 'colsample_bylevel': 0.09860948742451273, 'depth': 8, 'boosting_type': 'Plain', 'bootstrap_type': 'Bayesian', 'bagging_temperature': 5.721922339085237}. Best is trial 205 with value: 0.890909090909091.
[32m[I 2023-04-20 23:13:05,267][39m Trial 755 finished with value: 0.8807339449541284 and parameters: {'objective': 'Logloss', 'colsample_bylevel': 0.09536797530768988, 'depth': 8, 'boosting_type': 'Plain', 'bootstrap_type': 'Bayesian', 'bagging_temperature': 5.482483077052413}. Best is trial 205 with value: 0.890909090909091.
[32m[I 2023-04-20 23:13:06,214][39m Trial 756 finished with value: 0.8807339449541284 and parameters: {'objective': 'Logloss', 'colsample_bylevel': 0.09998573042811748, 'depth': 9, 'boosting_type': 'Plain', 'bootstrap_type': 'Bayesian', 'bagging_temperature': 4.98487022573917}. Best is trial 205 with value: 0.890909090909091.
[32m[I 2023-04-20 23:13:07,564][39m Trial 757 finished with value: 0.8648648648648648 and parameters: {'objective': 'Logloss', 'colsample_bylevel': 0.09553131131856848, 'depth': 10, 'boosting_type': 'Plain', 'bootstrap_type': 'Bayesian', 'bagging_temperature': 6.0701812876211925}. Best is trial 205 with value: 0.890909090909091.
[32m[I 2023-04-20 23:13:08,451][39m Trial 758 finished with value: 0.8727272727272727 and parameters: {'objective': 'Logloss', 'colsample_bylevel': 0.09666381645134861, 'depth': 10, 'boosting_type': 'Plain', 'bootstrap_type': 'Bayesian', 'bagging_temperature': 6.4191796832144306}. Best is trial 205 with value: 0.890909090909091.
[32m[I 2023-04-20 23:13:09,915][39m Trial 759 finished with value: 0.888888888888889 and parameters: {'objective': 'Logloss', 'colsample_bylevel': 0.09844266410608353, 'depth': 9, 'boosting_type': 'Plain', 'bootstrap_type': 'Bayesian', 'bagging_temperature': 4.645581489662089}. Best is trial 205 with value: 0.890909090909091.
[32m[I 2023-04-20 23:13:11,094][39m Trial 760 finished with value: 0.888888888888889 and parameters: {'objective': 'Logloss', 'colsample_bylevel': 0.09380143021588913, 'depth': 9, 'boosting_type': 'Plain', 'bootstrap_type': 'Bayesian', 'bagging_temperature': 4.605418012451316}. Best is trial 205 with value: 0.890909090909091.
[32m[I 2023-04-20 23:13:12,042][39m Trial 761 finished with value: 0.888888888888889 and parameters: {'objective': 'Logloss', 'colsample_bylevel': 0.09716837867072092, 'depth': 9, 'boosting_type': 'Plain', 'bootstrap_type': 'Bayesian', 'bagging_temperature': 4.784272373410438}. Best is trial 205 with value: 0.890909090909091.
[32m[I 2023-04-20 23:13:13,145][39m Trial 762 finished with value: 0.890909090909091 and parameters: {'objective': 'Logloss', 'colsample_bylevel': 0.09748061700053214, 'depth': 9, 'boosting_type': 'Plain', 'bootstrap_type': 'Bayesian', 'bagging_temperature': 4.775678896606087}. Best is trial 205 with value: 0.890909090909091.
[32m[I 2023-04-20 23:13:13,939][39m Trial 763 finished with value: 0.8648648648648648 and parameters: {'objective': 'Logloss', 'colsample_bylevel': 0.09346491408570126, 'depth': 6, 'boosting_type': 'Plain', 'bootstrap_type': 'Bayesian', 'bagging_temperature': 4.96129823556585}. Best is trial 205 with value: 0.890909090909091.
[32m[I 2023-04-20 23:13:15,381][39m Trial 764 finished with value: 0.8807339449541284 and parameters: {'objective': 'Logloss', 'colsample_bylevel': 0.097311576706633, 'depth': 8, 'boosting_type': 'Plain', 'bootstrap_type': 'Bayesian', 'bagging_temperature': 6.04702809307215}. Best is trial 205 with value: 0.890909090909091.
[32m[I 2023-04-20 23:13:17,110][39m Trial 765 finished with value: 0.8807339449541284 and parameters: {'objective': 'Logloss', 'colsample_bylevel': 0.09123273312594471, 'depth': 9, 'boosting_type': 'Plain', 'bootstrap_type': 'Bayesian', 'bagging_temperature': 4.74220614785455}. Best is trial 205 with value: 0.890909090909091.
[32m[I 2023-04-20 23:13:22,054][39m Trial 766 finished with value: 0.8347826086956522 and parameters: {'objective': 'Logloss', 'colsample_bylevel': 0.09452362359525354, 'depth': 9, 'boosting_type': 'Ordered', 'bootstrap_type': 'Bayesian', 'bagging_temperature': 4.222109661408223}. Best is trial 205 with value: 0.890909090909091.
[32m[I 2023-04-20 23:13:23,669][39m Trial 767 finished with value: 0.8807339449541284 and parameters: {'objective': 'Logloss', 'colsample_bylevel': 0.09791326950290512, 'depth': 9, 'boosting_type': 'Plain', 'bootstrap_type': 'Bayesian', 'bagging_temperature': 4.364486653904754}. Best is trial 205 with value: 0.890909090909091.
[32m[I 2023-04-20 23:13:24,620][39m Trial 768 finished with value: 0.8727272727272727 and parameters: {'objective': 'Logloss', 'colsample_bylevel': 0.09457926085001048, 'depth': 9, 'boosting_type': 'Plain', 'bootstrap_type': 'Bayesian', 'bagging_temperature': 5.2528462864422485}. Best is trial 205 with value: 0.890909090909091.
[32m[I 2023-04-20 23:13:25,712][39m Trial 769 finished with value: 0.8305084745762712 and parameters: {'objective': 'Logloss', 'colsample_bylevel': 0.02059362986995026, 'depth': 9, 'boosting_type': 'Plain', 'bootstrap_type': 'MVS'}. Best is trial 205 with value: 0.890909090909091.
[32m[I 2023-04-20 23:13:26,426][39m Trial 770 finished with value: 0.875 and parameters: {'objective': 'Logloss', 'colsample_bylevel': 0.0999765812821005, 'depth': 12, 'boosting_type': 'Plain', 'bootstrap_type': 'Bayesian', 'bagging_temperature': 5.113878400187195}. Best is trial 205 with value: 0.890909090909091.
[32m[I 2023-04-20 23:13:27,963][39m Trial 771 finished with value: 0.890909090909091 and parameters: {'objective': 'Logloss', 'colsample_bylevel': 0.09602138763118186, 'depth': 9, 'boosting_type': 'Plain', 'bootstrap_type': 'Bayesian', 'bagging_temperature': 4.167930828746008}. Best is trial 205 with value: 0.890909090909091.
[32m[I 2023-04-20 23:13:28,974][39m Trial 772 finished with value: 0.888888888888889 and parameters: {'objective': 'CrossEntropy', 'colsample_bylevel': 0.09595895882309755, 'depth': 9, 'boosting_type': 'Plain', 'bootstrap_type': 'Bayesian', 'bagging_temperature': 4.253124512535587}. Best is trial 205 with value: 0.890909090909091.
[32m[I 2023-04-20 23:13:30,156][39m Trial 773 finished with value: 0.8807339449541284 and parameters: {'objective': 'CrossEntropy', 'colsample_bylevel': 0.08896547111954452, 'depth': 9, 'boosting_type': 'Plain', 'bootstrap_type': 'Bayesian', 'bagging_temperature': 4.65913484353164}. Best is trial 205 with value: 0.890909090909091.
[32m[I 2023-04-20 23:13:31,494][39m Trial 774 finished with value: 0.8807339449541284 and parameters: {'objective': 'Logloss', 'colsample_bylevel': 0.0957888002959918, 'depth': 9, 'boosting_type': 'Plain', 'bootstrap_type': 'Bayesian', 'bagging_temperature': 4.9761253170886395}. Best is trial 205 with value: 0.890909090909091.
[32m[I 2023-04-20 23:13:32,521][39m Trial 775 finished with value: 0.8648648648648648 and parameters: {'objective': 'Logloss', 'colsample_bylevel': 0.0925421373342827, 'depth': 9, 'boosting_type': 'Plain', 'bootstrap_type': 'Bayesian', 'bagging_temperature': 5.505726886540851}. Best is trial 205 with value: 0.890909090909091.
[32m[I 2023-04-20 23:13:33,241][39m Trial 776 finished with value: 0.8648648648648648 and parameters: {'objective': 'Logloss', 'colsample_bylevel': 0.09452015795114087, 'depth': 10, 'boosting_type': 'Plain', 'bootstrap_type': 'Bayesian', 'bagging_temperature': 1.2183962185562192}. Best is trial 205 with value: 0.890909090909091.
[32m[I 2023-04-20 23:13:34,438][39m Trial 777 finished with value: 0.8347826086956522 and parameters: {'objective': 'Logloss', 'colsample_bylevel': 0.07344826400839263, 'depth': 8, 'boosting_type': 'Plain', 'bootstrap_type': 'Bernoulli', 'subsample': 0.7038661698935127}. Best is trial 205 with value: 0.890909090909091.
[32m[I 2023-04-20 23:13:36,187][39m Trial 778 finished with value: 0.8807339449541284 and parameters: {'objective': 'Logloss', 'colsample_bylevel': 0.09734363421852905, 'depth': 9, 'boosting_type': 'Plain', 'bootstrap_type': 'Bayesian', 'bagging_temperature': 4.897209742725136}. Best is trial 205 with value: 0.890909090909091.
[32m[I 2023-04-20 23:13:36,860][39m Trial 779 finished with value: 0.875 and parameters: {'objective': 'Logloss', 'colsample_bylevel': 0.08760769303425765, 'depth': 8, 'boosting_type': 'Plain', 'bootstrap_type': 'Bayesian', 'bagging_temperature': 4.020534468759611}. Best is trial 205 with value: 0.890909090909091.
[32m[I 2023-04-20 23:13:38,324][39m Trial 780 finished with value: 0.8807339449541284 and parameters: {'objective': 'Logloss', 'colsample_bylevel': 0.09999682890151548, 'depth': 8, 'boosting_type': 'Plain', 'bootstrap_type': 'Bayesian', 'bagging_temperature': 5.280853561969324}. Best is trial 205 with value: 0.890909090909091.
[32m[I 2023-04-20 23:13:39,111][39m Trial 781 finished with value: 0.8727272727272727 and parameters: {'objective': 'Logloss', 'colsample_bylevel': 0.09827798921827767, 'depth': 9, 'boosting_type': 'Plain', 'bootstrap_type': 'Bayesian', 'bagging_temperature': 3.563344377641378}. Best is trial 205 with value: 0.890909090909091.
[32m[I 2023-04-20 23:13:40,096][39m Trial 782 finished with value: 0.875 and parameters: {'objective': 'Logloss', 'colsample_bylevel': 0.09999440854212467, 'depth': 7, 'boosting_type': 'Plain', 'bootstrap_type': 'Bayesian', 'bagging_temperature': 5.545336205812165}. Best is trial 205 with value: 0.890909090909091.
[32m[I 2023-04-20 23:13:41,256][39m Trial 783 finished with value: 0.8807339449541284 and parameters: {'objective': 'Logloss', 'colsample_bylevel': 0.09256297149868847, 'depth': 8, 'boosting_type': 'Plain', 'bootstrap_type': 'Bayesian', 'bagging_temperature': 5.175450990518287}. Best is trial 205 with value: 0.890909090909091.
[32m[I 2023-04-20 23:13:42,595][39m Trial 784 finished with value: 0.8727272727272727 and parameters: {'objective': 'Logloss', 'colsample_bylevel': 0.09782680181175865, 'depth': 9, 'boosting_type': 'Plain', 'bootstrap_type': 'Bayesian', 'bagging_temperature': 4.2818744867266085}. Best is trial 205 with value: 0.890909090909091.
[32m[I 2023-04-20 23:13:43,143][39m Trial 785 finished with value: 0.7868852459016394 and parameters: {'objective': 'Logloss', 'colsample_bylevel': 0.014205309947489989, 'depth': 7, 'boosting_type': 'Plain', 'bootstrap_type': 'Bayesian', 'bagging_temperature': 5.3968933902033}. Best is trial 205 with value: 0.890909090909091.
[32m[I 2023-04-20 23:13:44,565][39m Trial 786 finished with value: 0.8727272727272727 and parameters: {'objective': 'CrossEntropy', 'colsample_bylevel': 0.09845838443301502, 'depth': 9, 'boosting_type': 'Plain', 'bootstrap_type': 'Bayesian', 'bagging_temperature': 4.393666060813556}. Best is trial 205 with value: 0.890909090909091.
[32m[I 2023-04-20 23:13:49,652][39m Trial 787 finished with value: 0.8421052631578947 and parameters: {'objective': 'Logloss', 'colsample_bylevel': 0.09429286466599797, 'depth': 10, 'boosting_type': 'Ordered', 'bootstrap_type': 'Bayesian', 'bagging_temperature': 4.006340770734256}. Best is trial 205 with value: 0.890909090909091.
[32m[I 2023-04-20 23:13:50,852][39m Trial 788 finished with value: 0.875 and parameters: {'objective': 'Logloss', 'colsample_bylevel': 0.09079395465099488, 'depth': 10, 'boosting_type': 'Plain', 'bootstrap_type': 'Bayesian', 'bagging_temperature': 8.771458420866622}. Best is trial 205 with value: 0.890909090909091.
[32m[I 2023-04-20 23:13:52,454][39m Trial 789 finished with value: 0.890909090909091 and parameters: {'objective': 'Logloss', 'colsample_bylevel': 0.09496592665005976, 'depth': 9, 'boosting_type': 'Plain', 'bootstrap_type': 'Bayesian', 'bagging_temperature': 5.897372030699139}. Best is trial 205 with value: 0.890909090909091.
[32m[I 2023-04-20 23:13:52,941][39m Trial 790 finished with value: 0.8495575221238938 and parameters: {'objective': 'CrossEntropy', 'colsample_bylevel': 0.09567616043519248, 'depth': 9, 'boosting_type': 'Plain', 'bootstrap_type': 'MVS'}. Best is trial 205 with value: 0.890909090909091.
[32m[I 2023-04-20 23:13:53,896][39m Trial 791 finished with value: 0.8648648648648648 and parameters: {'objective': 'Logloss', 'colsample_bylevel': 0.09447505150581721, 'depth': 9, 'boosting_type': 'Plain', 'bootstrap_type': 'Bayesian', 'bagging_temperature': 4.672441136912563}. Best is trial 205 with value: 0.890909090909091.
[32m[I 2023-04-20 23:13:54,916][39m Trial 792 finished with value: 0.890909090909091 and parameters: {'objective': 'Logloss', 'colsample_bylevel': 0.09591688875301975, 'depth': 10, 'boosting_type': 'Plain', 'bootstrap_type': 'Bayesian', 'bagging_temperature': 6.490914109768515}. Best is trial 205 with value: 0.890909090909091.
[32m[I 2023-04-20 23:13:56,583][39m Trial 793 finished with value: 0.8807339449541284 and parameters: {'objective': 'CrossEntropy', 'colsample_bylevel': 0.09621067909086795, 'depth': 9, 'boosting_type': 'Plain', 'bootstrap_type': 'Bayesian', 'bagging_temperature': 4.562197198939711}. Best is trial 205 with value: 0.890909090909091.
[32m[I 2023-04-20 23:13:57,210][39m Trial 794 finished with value: 0.8347826086956522 and parameters: {'objective': 'Logloss', 'colsample_bylevel': 0.02720890977891898, 'depth': 9, 'boosting_type': 'Plain', 'bootstrap_type': 'Bayesian', 'bagging_temperature': 6.55208003366334}. Best is trial 205 with value: 0.890909090909091.
[32m[I 2023-04-20 23:13:58,348][39m Trial 795 finished with value: 0.888888888888889 and parameters: {'objective': 'CrossEntropy', 'colsample_bylevel': 0.09023295146932413, 'depth': 9, 'boosting_type': 'Plain', 'bootstrap_type': 'Bayesian', 'bagging_temperature': 4.504581682288233}. Best is trial 205 with value: 0.890909090909091.
