[32m[I 2023-04-21 00:49:13,685][39m Trial 5133 finished with value: 0.8495575221238938 and parameters: {'objective': 'Logloss', 'colsample_bylevel': 0.08012782904088005, 'depth': 12, 'boosting_type': 'Plain', 'bootstrap_type': 'Bayesian', 'bagging_temperature': 3.6267335953312663}. Best is trial 1464 with value: 0.8990825688073395.
[32m[I 2023-04-21 00:49:14,741][39m Trial 5134 finished with value: 0.8571428571428572 and parameters: {'objective': 'Logloss', 'colsample_bylevel': 0.09108202720337583, 'depth': 9, 'boosting_type': 'Plain', 'bootstrap_type': 'MVS'}. Best is trial 1464 with value: 0.8990825688073395.
[32m[I 2023-04-21 00:49:16,054][39m Trial 5135 finished with value: 0.8545454545454546 and parameters: {'objective': 'CrossEntropy', 'colsample_bylevel': 0.09513901097155991, 'depth': 7, 'boosting_type': 'Plain', 'bootstrap_type': 'Bayesian', 'bagging_temperature': 4.065510849824648}. Best is trial 1464 with value: 0.8990825688073395.
[32m[I 2023-04-21 00:49:17,349][39m Trial 5136 finished with value: 0.875 and parameters: {'objective': 'Logloss', 'colsample_bylevel': 0.09300718235440325, 'depth': 10, 'boosting_type': 'Plain', 'bootstrap_type': 'Bayesian', 'bagging_temperature': 5.51991555012739}. Best is trial 1464 with value: 0.8990825688073395.
[32m[I 2023-04-21 00:49:18,318][39m Trial 5137 finished with value: 0.875 and parameters: {'objective': 'Logloss', 'colsample_bylevel': 0.08896460543102302, 'depth': 12, 'boosting_type': 'Plain', 'bootstrap_type': 'Bayesian', 'bagging_temperature': 4.997492527150088}. Best is trial 1464 with value: 0.8990825688073395.
[32m[I 2023-04-21 00:49:19,898][39m Trial 5138 finished with value: 0.8648648648648648 and parameters: {'objective': 'Logloss', 'colsample_bylevel': 0.09592170076995357, 'depth': 8, 'boosting_type': 'Plain', 'bootstrap_type': 'Bayesian', 'bagging_temperature': 5.110972084681993}. Best is trial 1464 with value: 0.8990825688073395.
[32m[I 2023-04-21 00:49:20,676][39m Trial 5139 finished with value: 0.8571428571428572 and parameters: {'objective': 'Logloss', 'colsample_bylevel': 0.08187766795810707, 'depth': 12, 'boosting_type': 'Plain', 'bootstrap_type': 'Bayesian', 'bagging_temperature': 4.84605695501058}. Best is trial 1464 with value: 0.8990825688073395.
[32m[I 2023-04-21 00:49:21,970][39m Trial 5140 finished with value: 0.8807339449541284 and parameters: {'objective': 'Logloss', 'colsample_bylevel': 0.09821714561378066, 'depth': 7, 'boosting_type': 'Plain', 'bootstrap_type': 'Bayesian', 'bagging_temperature': 5.879849070621399}. Best is trial 1464 with value: 0.8990825688073395.
[32m[I 2023-04-21 00:49:23,578][39m Trial 5141 finished with value: 0.8785046728971961 and parameters: {'objective': 'CrossEntropy', 'colsample_bylevel': 0.09389012258923253, 'depth': 9, 'boosting_type': 'Plain', 'bootstrap_type': 'Bayesian', 'bagging_temperature': 6.769475614275039}. Best is trial 1464 with value: 0.8990825688073395.
[32m[I 2023-04-21 00:49:24,313][39m Trial 5142 finished with value: 0.8623853211009175 and parameters: {'objective': 'CrossEntropy', 'colsample_bylevel': 0.09824919315252512, 'depth': 12, 'boosting_type': 'Plain', 'bootstrap_type': 'Bayesian', 'bagging_temperature': 4.535572708187408}. Best is trial 1464 with value: 0.8990825688073395.
[32m[I 2023-04-21 00:49:28,880][39m Trial 5143 finished with value: 0.8571428571428572 and parameters: {'objective': 'Logloss', 'colsample_bylevel': 0.09005881482320849, 'depth': 12, 'boosting_type': 'Ordered', 'bootstrap_type': 'Bayesian', 'bagging_temperature': 6.691244240026733}. Best is trial 1464 with value: 0.8990825688073395.
[32m[I 2023-04-21 00:49:30,265][39m Trial 5144 finished with value: 0.8807339449541284 and parameters: {'objective': 'Logloss', 'colsample_bylevel': 0.09664688101310202, 'depth': 9, 'boosting_type': 'Plain', 'bootstrap_type': 'Bayesian', 'bagging_temperature': 7.206135745829592}. Best is trial 1464 with value: 0.8990825688073395.
[32m[I 2023-04-21 00:49:31,517][39m Trial 5145 finished with value: 0.8828828828828829 and parameters: {'objective': 'CrossEntropy', 'colsample_bylevel': 0.09582895432893844, 'depth': 12, 'boosting_type': 'Plain', 'bootstrap_type': 'Bayesian', 'bagging_temperature': 4.595468728369524}. Best is trial 1464 with value: 0.8990825688073395.
[32m[I 2023-04-21 00:49:32,673][39m Trial 5146 finished with value: 0.875 and parameters: {'objective': 'CrossEntropy', 'colsample_bylevel': 0.0888160986220491, 'depth': 12, 'boosting_type': 'Plain', 'bootstrap_type': 'Bayesian', 'bagging_temperature': 7.127940891027474}. Best is trial 1464 with value: 0.8990825688073395.
[32m[I 2023-04-21 00:49:33,752][39m Trial 5147 finished with value: 0.8727272727272727 and parameters: {'objective': 'Logloss', 'colsample_bylevel': 0.08867411411882276, 'depth': 12, 'boosting_type': 'Plain', 'bootstrap_type': 'Bayesian', 'bagging_temperature': 5.301832938740018}. Best is trial 1464 with value: 0.8990825688073395.
[32m[I 2023-04-21 00:49:35,445][39m Trial 5148 finished with value: 0.8727272727272727 and parameters: {'objective': 'Logloss', 'colsample_bylevel': 0.09599749199292427, 'depth': 9, 'boosting_type': 'Plain', 'bootstrap_type': 'Bayesian', 'bagging_temperature': 5.089845360146574}. Best is trial 1464 with value: 0.8990825688073395.
[32m[I 2023-04-21 00:49:36,186][39m Trial 5149 finished with value: 0.8807339449541284 and parameters: {'objective': 'Logloss', 'colsample_bylevel': 0.09554278933123281, 'depth': 12, 'boosting_type': 'Plain', 'bootstrap_type': 'Bayesian', 'bagging_temperature': 6.24137374291549}. Best is trial 1464 with value: 0.8990825688073395.
[32m[I 2023-04-21 00:49:37,126][39m Trial 5150 finished with value: 0.8468468468468469 and parameters: {'objective': 'Logloss', 'colsample_bylevel': 0.08505587351563662, 'depth': 12, 'boosting_type': 'Plain', 'bootstrap_type': 'Bayesian', 'bagging_temperature': 5.030904167240504}. Best is trial 1464 with value: 0.8990825688073395.
[32m[I 2023-04-21 00:49:38,707][39m Trial 5151 finished with value: 0.8648648648648648 and parameters: {'objective': 'Logloss', 'colsample_bylevel': 0.09982321141316856, 'depth': 7, 'boosting_type': 'Plain', 'bootstrap_type': 'Bayesian', 'bagging_temperature': 4.911332087311485}. Best is trial 1464 with value: 0.8990825688073395.
[32m[I 2023-04-21 00:49:39,651][39m Trial 5152 finished with value: 0.875 and parameters: {'objective': 'Logloss', 'colsample_bylevel': 0.09196816859848497, 'depth': 12, 'boosting_type': 'Plain', 'bootstrap_type': 'Bayesian', 'bagging_temperature': 5.620021364682787}. Best is trial 1464 with value: 0.8990825688073395.
[32m[I 2023-04-21 00:49:40,556][39m Trial 5153 finished with value: 0.8421052631578947 and parameters: {'objective': 'Logloss', 'colsample_bylevel': 0.08906433865240286, 'depth': 12, 'boosting_type': 'Plain', 'bootstrap_type': 'Bernoulli', 'subsample': 0.8754317280737507}. Best is trial 1464 with value: 0.8990825688073395.
[32m[I 2023-04-21 00:49:41,765][39m Trial 5154 finished with value: 0.8727272727272727 and parameters: {'objective': 'CrossEntropy', 'colsample_bylevel': 0.09808925790633727, 'depth': 7, 'boosting_type': 'Plain', 'bootstrap_type': 'Bayesian', 'bagging_temperature': 4.376879455184335}. Best is trial 1464 with value: 0.8990825688073395.
[32m[I 2023-04-21 00:49:42,810][39m Trial 5155 finished with value: 0.8495575221238938 and parameters: {'objective': 'Logloss', 'colsample_bylevel': 0.09621823920371096, 'depth': 9, 'boosting_type': 'Plain', 'bootstrap_type': 'MVS'}. Best is trial 1464 with value: 0.8990825688073395.
[32m[I 2023-04-21 00:49:43,748][39m Trial 5156 finished with value: 0.888888888888889 and parameters: {'objective': 'Logloss', 'colsample_bylevel': 0.09145574482560898, 'depth': 12, 'boosting_type': 'Plain', 'bootstrap_type': 'Bayesian', 'bagging_temperature': 5.250618340906575}. Best is trial 1464 with value: 0.8990825688073395.
[32m[I 2023-04-21 00:49:44,872][39m Trial 5157 finished with value: 0.8807339449541284 and parameters: {'objective': 'Logloss', 'colsample_bylevel': 0.09652260700104925, 'depth': 12, 'boosting_type': 'Plain', 'bootstrap_type': 'Bayesian', 'bagging_temperature': 4.665677209858298}. Best is trial 1464 with value: 0.8990825688073395.
[32m[I 2023-04-21 00:49:45,975][39m Trial 5158 finished with value: 0.8828828828828829 and parameters: {'objective': 'CrossEntropy', 'colsample_bylevel': 0.09366816236581112, 'depth': 11, 'boosting_type': 'Plain', 'bootstrap_type': 'Bayesian', 'bagging_temperature': 3.8171933053100657}. Best is trial 1464 with value: 0.8990825688073395.
[32m[I 2023-04-21 00:49:51,175][39m Trial 5159 finished with value: 0.8495575221238938 and parameters: {'objective': 'CrossEntropy', 'colsample_bylevel': 0.09783209788144766, 'depth': 7, 'boosting_type': 'Ordered', 'bootstrap_type': 'Bayesian', 'bagging_temperature': 3.9056161333087784}. Best is trial 1464 with value: 0.8990825688073395.
[32m[I 2023-04-21 00:49:52,364][39m Trial 5160 finished with value: 0.8598130841121495 and parameters: {'objective': 'Logloss', 'colsample_bylevel': 0.09362361067422444, 'depth': 12, 'boosting_type': 'Plain', 'bootstrap_type': 'Bayesian', 'bagging_temperature': 2.5770483903347143}. Best is trial 1464 with value: 0.8990825688073395.
[32m[I 2023-04-21 00:49:53,443][39m Trial 5161 finished with value: 0.8703703703703703 and parameters: {'objective': 'CrossEntropy', 'colsample_bylevel': 0.09555852012749073, 'depth': 10, 'boosting_type': 'Plain', 'bootstrap_type': 'Bayesian', 'bagging_temperature': 4.710730192875165}. Best is trial 1464 with value: 0.8990825688073395.
[32m[I 2023-04-21 00:49:54,487][39m Trial 5162 finished with value: 0.8807339449541284 and parameters: {'objective': 'Logloss', 'colsample_bylevel': 0.08791520968501619, 'depth': 12, 'boosting_type': 'Plain', 'bootstrap_type': 'Bayesian', 'bagging_temperature': 5.102645622134894}. Best is trial 1464 with value: 0.8990825688073395.
[32m[I 2023-04-21 00:49:56,188][39m Trial 5163 finished with value: 0.8807339449541284 and parameters: {'objective': 'Logloss', 'colsample_bylevel': 0.09811444716256094, 'depth': 8, 'boosting_type': 'Plain', 'bootstrap_type': 'Bayesian', 'bagging_temperature': 7.490353099356655}. Best is trial 1464 with value: 0.8990825688073395.
[32m[I 2023-04-21 00:49:57,055][39m Trial 5164 finished with value: 0.8648648648648648 and parameters: {'objective': 'Logloss', 'colsample_bylevel': 0.08569463866253901, 'depth': 10, 'boosting_type': 'Plain', 'bootstrap_type': 'Bayesian', 'bagging_temperature': 5.931594826656724}. Best is trial 1464 with value: 0.8990825688073395.
[32m[I 2023-04-21 00:49:58,131][39m Trial 5165 finished with value: 0.8807339449541284 and parameters: {'objective': 'CrossEntropy', 'colsample_bylevel': 0.08906459264403263, 'depth': 12, 'boosting_type': 'Plain', 'bootstrap_type': 'Bayesian', 'bagging_temperature': 5.393214153642958}. Best is trial 1464 with value: 0.8990825688073395.
[32m[I 2023-04-21 00:49:59,281][39m Trial 5166 finished with value: 0.8807339449541284 and parameters: {'objective': 'Logloss', 'colsample_bylevel': 0.09072019775399809, 'depth': 12, 'boosting_type': 'Plain', 'bootstrap_type': 'Bayesian', 'bagging_temperature': 4.994912590898402}. Best is trial 1464 with value: 0.8990825688073395.
[32m[I 2023-04-21 00:50:00,473][39m Trial 5167 finished with value: 0.8648648648648648 and parameters: {'objective': 'Logloss', 'colsample_bylevel': 0.0987836745409752, 'depth': 12, 'boosting_type': 'Plain', 'bootstrap_type': 'Bayesian', 'bagging_temperature': 3.179156849482854}. Best is trial 1464 with value: 0.8990825688073395.
[32m[I 2023-04-21 00:50:01,523][39m Trial 5168 finished with value: 0.8807339449541284 and parameters: {'objective': 'CrossEntropy', 'colsample_bylevel': 0.09868155323017797, 'depth': 7, 'boosting_type': 'Plain', 'bootstrap_type': 'Bayesian', 'bagging_temperature': 4.022481296099148}. Best is trial 1464 with value: 0.8990825688073395.
[32m[I 2023-04-21 00:50:02,677][39m Trial 5169 finished with value: 0.8347826086956522 and parameters: {'objective': 'Logloss', 'colsample_bylevel': 0.038142469261583614, 'depth': 12, 'boosting_type': 'Plain', 'bootstrap_type': 'Bayesian', 'bagging_temperature': 6.9607393769999515}. Best is trial 1464 with value: 0.8990825688073395.
[32m[I 2023-04-21 00:50:03,715][39m Trial 5170 finished with value: 0.8440366972477066 and parameters: {'objective': 'CrossEntropy', 'colsample_bylevel': 0.09730349162381205, 'depth': 12, 'boosting_type': 'Plain', 'bootstrap_type': 'Bayesian', 'bagging_temperature': 6.600700201432327}. Best is trial 1464 with value: 0.8990825688073395.
[32m[I 2023-04-21 00:50:05,016][39m Trial 5171 finished with value: 0.8571428571428572 and parameters: {'objective': 'Logloss', 'colsample_bylevel': 0.08496368733224915, 'depth': 12, 'boosting_type': 'Plain', 'bootstrap_type': 'Bayesian', 'bagging_temperature': 3.177186897367889}. Best is trial 1464 with value: 0.8990825688073395.
[32m[I 2023-04-21 00:50:05,994][39m Trial 5172 finished with value: 0.8727272727272727 and parameters: {'objective': 'CrossEntropy', 'colsample_bylevel': 0.09548328463470927, 'depth': 12, 'boosting_type': 'Plain', 'bootstrap_type': 'Bernoulli', 'subsample': 0.40867810574073193}. Best is trial 1464 with value: 0.8990825688073395.
[32m[I 2023-04-21 00:50:07,037][39m Trial 5173 finished with value: 0.8727272727272727 and parameters: {'objective': 'CrossEntropy', 'colsample_bylevel': 0.0933813455191019, 'depth': 12, 'boosting_type': 'Plain', 'bootstrap_type': 'Bayesian', 'bagging_temperature': 3.141404105581161}. Best is trial 1464 with value: 0.8990825688073395.
[32m[I 2023-04-21 00:50:07,945][39m Trial 5174 finished with value: 0.8571428571428572 and parameters: {'objective': 'Logloss', 'colsample_bylevel': 0.09482260324915905, 'depth': 9, 'boosting_type': 'Plain', 'bootstrap_type': 'Bayesian', 'bagging_temperature': 2.1991377364635043}. Best is trial 1464 with value: 0.8990825688073395.
[32m[I 2023-04-21 00:50:09,035][39m Trial 5175 finished with value: 0.888888888888889 and parameters: {'objective': 'Logloss', 'colsample_bylevel': 0.09373470071129171, 'depth': 10, 'boosting_type': 'Plain', 'bootstrap_type': 'Bayesian', 'bagging_temperature': 5.872398347478799}. Best is trial 1464 with value: 0.8990825688073395.
[32m[I 2023-04-21 00:50:10,393][39m Trial 5176 finished with value: 0.8807339449541284 and parameters: {'objective': 'CrossEntropy', 'colsample_bylevel': 0.08773696596465912, 'depth': 11, 'boosting_type': 'Plain', 'bootstrap_type': 'Bayesian', 'bagging_temperature': 5.128152276004921}. Best is trial 1464 with value: 0.8990825688073395.
[32m[I 2023-04-21 00:50:15,390][39m Trial 5177 finished with value: 0.8421052631578947 and parameters: {'objective': 'Logloss', 'colsample_bylevel': 0.09191601641262385, 'depth': 9, 'boosting_type': 'Ordered', 'bootstrap_type': 'MVS'}. Best is trial 1464 with value: 0.8990825688073395.
[32m[I 2023-04-21 00:50:16,318][39m Trial 5178 finished with value: 0.8807339449541284 and parameters: {'objective': 'CrossEntropy', 'colsample_bylevel': 0.09291217154165198, 'depth': 7, 'boosting_type': 'Plain', 'bootstrap_type': 'Bayesian', 'bagging_temperature': 4.581432055270373}. Best is trial 1464 with value: 0.8990825688073395.
[32m[I 2023-04-21 00:50:17,698][39m Trial 5179 finished with value: 0.8727272727272727 and parameters: {'objective': 'Logloss', 'colsample_bylevel': 0.0934705635432068, 'depth': 10, 'boosting_type': 'Plain', 'bootstrap_type': 'Bayesian', 'bagging_temperature': 4.003597092845865}. Best is trial 1464 with value: 0.8990825688073395.
[32m[I 2023-04-21 00:50:18,873][39m Trial 5180 finished with value: 0.8807339449541284 and parameters: {'objective': 'Logloss', 'colsample_bylevel': 0.09013914804004909, 'depth': 12, 'boosting_type': 'Plain', 'bootstrap_type': 'Bayesian', 'bagging_temperature': 5.2180873069245255}. Best is trial 1464 with value: 0.8990825688073395.
[32m[I 2023-04-21 00:50:20,327][39m Trial 5181 finished with value: 0.8703703703703703 and parameters: {'objective': 'Logloss', 'colsample_bylevel': 0.0951821234174949, 'depth': 9, 'boosting_type': 'Plain', 'bootstrap_type': 'Bayesian', 'bagging_temperature': 5.1199685881527435}. Best is trial 1464 with value: 0.8990825688073395.
[32m[I 2023-04-21 00:50:21,179][39m Trial 5182 finished with value: 0.8448275862068967 and parameters: {'objective': 'Logloss', 'colsample_bylevel': 0.033751049601884874, 'depth': 12, 'boosting_type': 'Plain', 'bootstrap_type': 'Bayesian', 'bagging_temperature': 5.295832853445988}. Best is trial 1464 with value: 0.8990825688073395.
[32m[I 2023-04-21 00:50:22,134][39m Trial 5183 finished with value: 0.8727272727272727 and parameters: {'objective': 'Logloss', 'colsample_bylevel': 0.09637322312120938, 'depth': 12, 'boosting_type': 'Plain', 'bootstrap_type': 'Bayesian', 'bagging_temperature': 3.645617500864791}. Best is trial 1464 with value: 0.8990825688073395.
[32m[I 2023-04-21 00:50:23,363][39m Trial 5184 finished with value: 0.8807339449541284 and parameters: {'objective': 'CrossEntropy', 'colsample_bylevel': 0.084938428393974, 'depth': 11, 'boosting_type': 'Plain', 'bootstrap_type': 'Bayesian', 'bagging_temperature': 7.323444730816191}. Best is trial 1464 with value: 0.8990825688073395.
[32m[I 2023-04-21 00:50:24,262][39m Trial 5185 finished with value: 0.8828828828828829 and parameters: {'objective': 'CrossEntropy', 'colsample_bylevel': 0.09105038347056366, 'depth': 12, 'boosting_type': 'Plain', 'bootstrap_type': 'Bayesian', 'bagging_temperature': 4.893525243638863}. Best is trial 1464 with value: 0.8990825688073395.
[32m[I 2023-04-21 00:50:25,052][39m Trial 5186 finished with value: 0.8785046728971961 and parameters: {'objective': 'CrossEntropy', 'colsample_bylevel': 0.09310948721471682, 'depth': 12, 'boosting_type': 'Plain', 'bootstrap_type': 'Bayesian', 'bagging_temperature': 4.8933188905541956}. Best is trial 1464 with value: 0.8990825688073395.
[32m[I 2023-04-21 00:50:26,143][39m Trial 5187 finished with value: 0.8807339449541284 and parameters: {'objective': 'Logloss', 'colsample_bylevel': 0.08999904933828563, 'depth': 12, 'boosting_type': 'Plain', 'bootstrap_type': 'Bayesian', 'bagging_temperature': 5.08448936386286}. Best is trial 1464 with value: 0.8990825688073395.
[32m[I 2023-04-21 00:50:27,415][39m Trial 5188 finished with value: 0.8807339449541284 and parameters: {'objective': 'Logloss', 'colsample_bylevel': 0.09316162743718627, 'depth': 10, 'boosting_type': 'Plain', 'bootstrap_type': 'Bayesian', 'bagging_temperature': 5.415471696801713}. Best is trial 1464 with value: 0.8990825688073395.
[32m[I 2023-04-21 00:50:28,772][39m Trial 5189 finished with value: 0.8727272727272727 and parameters: {'objective': 'Logloss', 'colsample_bylevel': 0.09274868891212126, 'depth': 8, 'boosting_type': 'Plain', 'bootstrap_type': 'Bayesian', 'bagging_temperature': 5.22307237689034}. Best is trial 1464 with value: 0.8990825688073395.
[32m[I 2023-04-21 00:50:30,025][39m Trial 5190 finished with value: 0.8807339449541284 and parameters: {'objective': 'CrossEntropy', 'colsample_bylevel': 0.08744140219250275, 'depth': 11, 'boosting_type': 'Plain', 'bootstrap_type': 'Bayesian', 'bagging_temperature': 5.357079740517465}. Best is trial 1464 with value: 0.8990825688073395.
[32m[I 2023-04-21 00:50:31,226][39m Trial 5191 finished with value: 0.8545454545454546 and parameters: {'objective': 'Logloss', 'colsample_bylevel': 0.08678263468882347, 'depth': 12, 'boosting_type': 'Plain', 'bootstrap_type': 'Bayesian', 'bagging_temperature': 4.957878939311473}. Best is trial 1464 with value: 0.8990825688073395.
[32m[I 2023-04-21 00:50:32,463][39m Trial 5192 finished with value: 0.8495575221238938 and parameters: {'objective': 'Logloss', 'colsample_bylevel': 0.06447005331962959, 'depth': 7, 'boosting_type': 'Plain', 'bootstrap_type': 'Bayesian', 'bagging_temperature': 3.0633651660914003}. Best is trial 1464 with value: 0.8990825688073395.
[32m[I 2023-04-21 00:50:33,586][39m Trial 5193 finished with value: 0.8807339449541284 and parameters: {'objective': 'Logloss', 'colsample_bylevel': 0.0900712012201708, 'depth': 11, 'boosting_type': 'Plain', 'bootstrap_type': 'Bayesian', 'bagging_temperature': 5.123760724037178}. Best is trial 1464 with value: 0.8990825688073395.
[32m[I 2023-04-21 00:50:34,818][39m Trial 5194 finished with value: 0.888888888888889 and parameters: {'objective': 'CrossEntropy', 'colsample_bylevel': 0.09735106803832012, 'depth': 8, 'boosting_type': 'Plain', 'bootstrap_type': 'Bayesian', 'bagging_temperature': 3.060749312498748}. Best is trial 1464 with value: 0.8990825688073395.
[32m[I 2023-04-21 00:50:35,850][39m Trial 5195 finished with value: 0.8807339449541284 and parameters: {'objective': 'Logloss', 'colsample_bylevel': 0.09685887774846443, 'depth': 12, 'boosting_type': 'Plain', 'bootstrap_type': 'Bayesian', 'bagging_temperature': 5.280156263263862}. Best is trial 1464 with value: 0.8990825688073395.
[32m[I 2023-04-21 00:50:36,860][39m Trial 5196 finished with value: 0.8421052631578947 and parameters: {'objective': 'Logloss', 'colsample_bylevel': 0.08679616360887397, 'depth': 12, 'boosting_type': 'Plain', 'bootstrap_type': 'Bernoulli', 'subsample': 0.5399959779536981}. Best is trial 1464 with value: 0.8990825688073395.
[32m[I 2023-04-21 00:50:38,021][39m Trial 5197 finished with value: 0.8807339449541284 and parameters: {'objective': 'Logloss', 'colsample_bylevel': 0.09467810328570767, 'depth': 7, 'boosting_type': 'Plain', 'bootstrap_type': 'Bayesian', 'bagging_temperature': 5.594565867975778}. Best is trial 1464 with value: 0.8990825688073395.
[32m[I 2023-04-21 00:50:43,021][39m Trial 5198 finished with value: 0.8571428571428572 and parameters: {'objective': 'CrossEntropy', 'colsample_bylevel': 0.08528870104213038, 'depth': 12, 'boosting_type': 'Ordered', 'bootstrap_type': 'MVS'}. Best is trial 1464 with value: 0.8990825688073395.
