[32m[I 2023-04-20 23:15:22,987][39m Trial 862 finished with value: 0.8727272727272727 and parameters: {'objective': 'Logloss', 'colsample_bylevel': 0.09863466718363269, 'depth': 9, 'boosting_type': 'Plain', 'bootstrap_type': 'Bayesian', 'bagging_temperature': 6.393066188850918}. Best is trial 205 with value: 0.890909090909091.
[32m[I 2023-04-20 23:15:24,382][39m Trial 863 finished with value: 0.8672566371681416 and parameters: {'objective': 'Logloss', 'colsample_bylevel': 0.06502430555859454, 'depth': 9, 'boosting_type': 'Plain', 'bootstrap_type': 'Bayesian', 'bagging_temperature': 4.391248010834585}. Best is trial 205 with value: 0.890909090909091.
[32m[I 2023-04-20 23:15:25,275][39m Trial 864 finished with value: 0.8807339449541284 and parameters: {'objective': 'Logloss', 'colsample_bylevel': 0.0941931340947243, 'depth': 10, 'boosting_type': 'Plain', 'bootstrap_type': 'Bayesian', 'bagging_temperature': 2.9793569258405777}. Best is trial 205 with value: 0.890909090909091.
[32m[I 2023-04-20 23:15:25,939][39m Trial 865 finished with value: 0.8727272727272727 and parameters: {'objective': 'Logloss', 'colsample_bylevel': 0.09156409444117115, 'depth': 11, 'boosting_type': 'Plain', 'bootstrap_type': 'Bayesian', 'bagging_temperature': 9.295879975543198}. Best is trial 205 with value: 0.890909090909091.
[32m[I 2023-04-20 23:15:31,389][39m Trial 866 finished with value: 0.8495575221238938 and parameters: {'objective': 'Logloss', 'colsample_bylevel': 0.09377583598193713, 'depth': 9, 'boosting_type': 'Ordered', 'bootstrap_type': 'Bayesian', 'bagging_temperature': 7.251960615831302}. Best is trial 205 with value: 0.890909090909091.
[32m[I 2023-04-20 23:15:32,982][39m Trial 867 finished with value: 0.8727272727272727 and parameters: {'objective': 'CrossEntropy', 'colsample_bylevel': 0.09806415696653059, 'depth': 9, 'boosting_type': 'Plain', 'bootstrap_type': 'Bayesian', 'bagging_temperature': 5.704725694714358}. Best is trial 205 with value: 0.890909090909091.
[32m[I 2023-04-20 23:15:33,698][39m Trial 868 finished with value: 0.8623853211009175 and parameters: {'objective': 'CrossEntropy', 'colsample_bylevel': 0.08777012605397662, 'depth': 9, 'boosting_type': 'Plain', 'bootstrap_type': 'Bayesian', 'bagging_temperature': 1.5064535142717328}. Best is trial 205 with value: 0.890909090909091.
[32m[I 2023-04-20 23:15:34,223][39m Trial 869 finished with value: 0.888888888888889 and parameters: {'objective': 'CrossEntropy', 'colsample_bylevel': 0.09384967292266995, 'depth': 10, 'boosting_type': 'Plain', 'bootstrap_type': 'Bayesian', 'bagging_temperature': 4.565342312221555}. Best is trial 205 with value: 0.890909090909091.
[32m[I 2023-04-20 23:15:35,811][39m Trial 870 finished with value: 0.8495575221238938 and parameters: {'objective': 'Logloss', 'colsample_bylevel': 0.09656707048550009, 'depth': 9, 'boosting_type': 'Plain', 'bootstrap_type': 'Bernoulli', 'subsample': 0.8442976616854425}. Best is trial 205 with value: 0.890909090909091.
[32m[I 2023-04-20 23:15:36,907][39m Trial 871 finished with value: 0.875 and parameters: {'objective': 'CrossEntropy', 'colsample_bylevel': 0.08902028917717444, 'depth': 10, 'boosting_type': 'Plain', 'bootstrap_type': 'Bayesian', 'bagging_temperature': 9.7872952825537}. Best is trial 205 with value: 0.890909090909091.
[32m[I 2023-04-20 23:15:38,537][39m Trial 872 finished with value: 0.8807339449541284 and parameters: {'objective': 'Logloss', 'colsample_bylevel': 0.09060823791559668, 'depth': 9, 'boosting_type': 'Plain', 'bootstrap_type': 'Bayesian', 'bagging_temperature': 4.421085286429}. Best is trial 205 with value: 0.890909090909091.
[32m[I 2023-04-20 23:15:39,448][39m Trial 873 finished with value: 0.888888888888889 and parameters: {'objective': 'Logloss', 'colsample_bylevel': 0.09580840792339368, 'depth': 9, 'boosting_type': 'Plain', 'bootstrap_type': 'Bayesian', 'bagging_temperature': 6.489834638336989}. Best is trial 205 with value: 0.890909090909091.
[32m[I 2023-04-20 23:15:40,215][39m Trial 874 finished with value: 0.8727272727272727 and parameters: {'objective': 'Logloss', 'colsample_bylevel': 0.09896714094029674, 'depth': 8, 'boosting_type': 'Plain', 'bootstrap_type': 'Bayesian', 'bagging_temperature': 6.579028043064705}. Best is trial 205 with value: 0.890909090909091.
[32m[I 2023-04-20 23:15:41,092][39m Trial 875 finished with value: 0.8727272727272727 and parameters: {'objective': 'CrossEntropy', 'colsample_bylevel': 0.09209635689292386, 'depth': 9, 'boosting_type': 'Plain', 'bootstrap_type': 'Bayesian', 'bagging_temperature': 4.86340434395694}. Best is trial 205 with value: 0.890909090909091.
[32m[I 2023-04-20 23:15:42,178][39m Trial 876 finished with value: 0.8727272727272727 and parameters: {'objective': 'CrossEntropy', 'colsample_bylevel': 0.08704232134654198, 'depth': 10, 'boosting_type': 'Plain', 'bootstrap_type': 'Bayesian', 'bagging_temperature': 9.447784388980102}. Best is trial 205 with value: 0.890909090909091.
[32m[I 2023-04-20 23:15:43,317][39m Trial 877 finished with value: 0.8623853211009175 and parameters: {'objective': 'CrossEntropy', 'colsample_bylevel': 0.09564446084438925, 'depth': 10, 'boosting_type': 'Plain', 'bootstrap_type': 'Bayesian', 'bagging_temperature': 9.257972443075301}. Best is trial 205 with value: 0.890909090909091.
[32m[I 2023-04-20 23:15:44,952][39m Trial 878 finished with value: 0.888888888888889 and parameters: {'objective': 'Logloss', 'colsample_bylevel': 0.09366097749503642, 'depth': 9, 'boosting_type': 'Plain', 'bootstrap_type': 'Bayesian', 'bagging_temperature': 3.213581991326035}. Best is trial 205 with value: 0.890909090909091.
[32m[I 2023-04-20 23:15:46,168][39m Trial 879 finished with value: 0.8727272727272727 and parameters: {'objective': 'CrossEntropy', 'colsample_bylevel': 0.0946509668573139, 'depth': 9, 'boosting_type': 'Plain', 'bootstrap_type': 'Bayesian', 'bagging_temperature': 8.003564863990157}. Best is trial 205 with value: 0.890909090909091.
[32m[I 2023-04-20 23:15:46,913][39m Trial 880 finished with value: 0.888888888888889 and parameters: {'objective': 'CrossEntropy', 'colsample_bylevel': 0.09148798286806467, 'depth': 10, 'boosting_type': 'Plain', 'bootstrap_type': 'Bayesian', 'bagging_temperature': 8.05154960634973}. Best is trial 205 with value: 0.890909090909091.
[32m[I 2023-04-20 23:15:47,657][39m Trial 881 finished with value: 0.8672566371681416 and parameters: {'objective': 'Logloss', 'colsample_bylevel': 0.09575871536284775, 'depth': 10, 'boosting_type': 'Plain', 'bootstrap_type': 'MVS'}. Best is trial 205 with value: 0.890909090909091.
[32m[I 2023-04-20 23:15:48,616][39m Trial 882 finished with value: 0.8648648648648648 and parameters: {'objective': 'Logloss', 'colsample_bylevel': 0.09692345648880657, 'depth': 9, 'boosting_type': 'Plain', 'bootstrap_type': 'Bayesian', 'bagging_temperature': 5.7328360522269}. Best is trial 205 with value: 0.890909090909091.
[32m[I 2023-04-20 23:15:49,572][39m Trial 883 finished with value: 0.8807339449541284 and parameters: {'objective': 'Logloss', 'colsample_bylevel': 0.09340969478943154, 'depth': 10, 'boosting_type': 'Plain', 'bootstrap_type': 'Bayesian', 'bagging_temperature': 8.910753770336536}. Best is trial 205 with value: 0.890909090909091.
[32m[I 2023-04-20 23:15:55,104][39m Trial 884 finished with value: 0.8392857142857144 and parameters: {'objective': 'Logloss', 'colsample_bylevel': 0.09437968945987223, 'depth': 11, 'boosting_type': 'Ordered', 'bootstrap_type': 'Bayesian', 'bagging_temperature': 8.539651952658797}. Best is trial 205 with value: 0.890909090909091.
[32m[I 2023-04-20 23:15:56,265][39m Trial 885 finished with value: 0.8727272727272727 and parameters: {'objective': 'Logloss', 'colsample_bylevel': 0.09985980051373354, 'depth': 8, 'boosting_type': 'Plain', 'bootstrap_type': 'Bayesian', 'bagging_temperature': 6.8299116199829495}. Best is trial 205 with value: 0.890909090909091.
[32m[I 2023-04-20 23:15:57,241][39m Trial 886 finished with value: 0.8623853211009175 and parameters: {'objective': 'CrossEntropy', 'colsample_bylevel': 0.08367688141714781, 'depth': 10, 'boosting_type': 'Plain', 'bootstrap_type': 'Bayesian', 'bagging_temperature': 7.894448535582114}. Best is trial 205 with value: 0.890909090909091.
[32m[I 2023-04-20 23:15:58,222][39m Trial 887 finished with value: 0.890909090909091 and parameters: {'objective': 'Logloss', 'colsample_bylevel': 0.0950169946630855, 'depth': 10, 'boosting_type': 'Plain', 'bootstrap_type': 'Bayesian', 'bagging_temperature': 4.113268685694514}. Best is trial 205 with value: 0.890909090909091.
[32m[I 2023-04-20 23:15:59,449][39m Trial 888 finished with value: 0.888888888888889 and parameters: {'objective': 'Logloss', 'colsample_bylevel': 0.09615793734727608, 'depth': 8, 'boosting_type': 'Plain', 'bootstrap_type': 'Bayesian', 'bagging_temperature': 4.006922625486971}. Best is trial 205 with value: 0.890909090909091.
[32m[I 2023-04-20 23:16:00,591][39m Trial 889 finished with value: 0.8571428571428572 and parameters: {'objective': 'Logloss', 'colsample_bylevel': 0.09525350057201264, 'depth': 10, 'boosting_type': 'Plain', 'bootstrap_type': 'Bayesian', 'bagging_temperature': 4.388496985636346}. Best is trial 205 with value: 0.890909090909091.
[32m[I 2023-04-20 23:16:01,283][39m Trial 890 finished with value: 0.8545454545454546 and parameters: {'objective': 'Logloss', 'colsample_bylevel': 0.08961492910088628, 'depth': 11, 'boosting_type': 'Plain', 'bootstrap_type': 'Bayesian', 'bagging_temperature': 8.114551515918672}. Best is trial 205 with value: 0.890909090909091.
[32m[I 2023-04-20 23:16:02,132][39m Trial 891 finished with value: 0.8672566371681416 and parameters: {'objective': 'Logloss', 'colsample_bylevel': 0.09512190278592055, 'depth': 10, 'boosting_type': 'Plain', 'bootstrap_type': 'Bernoulli', 'subsample': 0.2339737577131757}. Best is trial 205 with value: 0.890909090909091.
[32m[I 2023-04-20 23:16:03,258][39m Trial 892 finished with value: 0.8727272727272727 and parameters: {'objective': 'CrossEntropy', 'colsample_bylevel': 0.09262903065225683, 'depth': 10, 'boosting_type': 'Plain', 'bootstrap_type': 'Bayesian', 'bagging_temperature': 9.620170608941516}. Best is trial 205 with value: 0.890909090909091.
[32m[I 2023-04-20 23:16:04,286][39m Trial 893 finished with value: 0.8807339449541284 and parameters: {'objective': 'CrossEntropy', 'colsample_bylevel': 0.09344022995796201, 'depth': 10, 'boosting_type': 'Plain', 'bootstrap_type': 'Bayesian', 'bagging_temperature': 5.063914603308601}. Best is trial 205 with value: 0.890909090909091.
[32m[I 2023-04-20 23:16:05,872][39m Trial 894 finished with value: 0.8727272727272727 and parameters: {'objective': 'CrossEntropy', 'colsample_bylevel': 0.08641207159217226, 'depth': 9, 'boosting_type': 'Plain', 'bootstrap_type': 'Bayesian', 'bagging_temperature': 4.668973499354168}. Best is trial 205 with value: 0.890909090909091.
[32m[I 2023-04-20 23:16:06,400][39m Trial 895 finished with value: 0.8648648648648648 and parameters: {'objective': 'CrossEntropy', 'colsample_bylevel': 0.09493245594491893, 'depth': 10, 'boosting_type': 'Plain', 'bootstrap_type': 'Bayesian', 'bagging_temperature': 4.552966426445057}. Best is trial 205 with value: 0.890909090909091.
[32m[I 2023-04-20 23:16:07,023][39m Trial 896 finished with value: 0.8545454545454546 and parameters: {'objective': 'CrossEntropy', 'colsample_bylevel': 0.09647200493403556, 'depth': 10, 'boosting_type': 'Plain', 'bootstrap_type': 'Bayesian', 'bagging_temperature': 3.9215359904851095}. Best is trial 205 with value: 0.890909090909091.
[32m[I 2023-04-20 23:16:08,319][39m Trial 897 finished with value: 0.8703703703703703 and parameters: {'objective': 'CrossEntropy', 'colsample_bylevel': 0.09784914546207409, 'depth': 8, 'boosting_type': 'Plain', 'bootstrap_type': 'Bayesian', 'bagging_temperature': 5.877660717797893}. Best is trial 205 with value: 0.890909090909091.
[32m[I 2023-04-20 23:16:09,290][39m Trial 898 finished with value: 0.8623853211009175 and parameters: {'objective': 'Logloss', 'colsample_bylevel': 0.09718358002222124, 'depth': 10, 'boosting_type': 'Plain', 'bootstrap_type': 'Bayesian', 'bagging_temperature': 5.305016355557379}. Best is trial 205 with value: 0.890909090909091.
[32m[I 2023-04-20 23:16:10,431][39m Trial 899 finished with value: 0.8807339449541284 and parameters: {'objective': 'Logloss', 'colsample_bylevel': 0.09994135877317648, 'depth': 8, 'boosting_type': 'Plain', 'bootstrap_type': 'Bayesian', 'bagging_temperature': 5.994994443186745}. Best is trial 205 with value: 0.890909090909091.
[32m[I 2023-04-20 23:16:11,903][39m Trial 900 finished with value: 0.8807339449541284 and parameters: {'objective': 'CrossEntropy', 'colsample_bylevel': 0.09480797637313881, 'depth': 9, 'boosting_type': 'Plain', 'bootstrap_type': 'Bayesian', 'bagging_temperature': 4.312317969860148}. Best is trial 205 with value: 0.890909090909091.
[32m[I 2023-04-20 23:16:12,855][39m Trial 901 finished with value: 0.8727272727272727 and parameters: {'objective': 'Logloss', 'colsample_bylevel': 0.09849125307752708, 'depth': 9, 'boosting_type': 'Plain', 'bootstrap_type': 'Bayesian', 'bagging_temperature': 5.050773970320014}. Best is trial 205 with value: 0.890909090909091.
[32m[I 2023-04-20 23:16:13,867][39m Trial 902 finished with value: 0.8703703703703703 and parameters: {'objective': 'CrossEntropy', 'colsample_bylevel': 0.09287499510350104, 'depth': 9, 'boosting_type': 'Plain', 'bootstrap_type': 'Bayesian', 'bagging_temperature': 4.5413733930880245}. Best is trial 205 with value: 0.890909090909091.
[32m[I 2023-04-20 23:16:14,841][39m Trial 903 finished with value: 0.8807339449541284 and parameters: {'objective': 'Logloss', 'colsample_bylevel': 0.09368290669441538, 'depth': 10, 'boosting_type': 'Plain', 'bootstrap_type': 'Bayesian', 'bagging_temperature': 3.913786020201052}. Best is trial 205 with value: 0.890909090909091.
[32m[I 2023-04-20 23:16:19,467][39m Trial 904 finished with value: 0.8305084745762712 and parameters: {'objective': 'CrossEntropy', 'colsample_bylevel': 0.03539200156291789, 'depth': 8, 'boosting_type': 'Ordered', 'bootstrap_type': 'MVS'}. Best is trial 205 with value: 0.890909090909091.
[32m[I 2023-04-20 23:16:20,420][39m Trial 905 finished with value: 0.8376068376068375 and parameters: {'objective': 'Logloss', 'colsample_bylevel': 0.05917569119649924, 'depth': 11, 'boosting_type': 'Plain', 'bootstrap_type': 'Bayesian', 'bagging_temperature': 2.794064874331313}. Best is trial 205 with value: 0.890909090909091.
[32m[I 2023-04-20 23:16:21,659][39m Trial 906 finished with value: 0.8807339449541284 and parameters: {'objective': 'Logloss', 'colsample_bylevel': 0.09812449157653609, 'depth': 8, 'boosting_type': 'Plain', 'bootstrap_type': 'Bayesian', 'bagging_temperature': 5.602876629653805}. Best is trial 205 with value: 0.890909090909091.
[32m[I 2023-04-20 23:16:22,515][39m Trial 907 finished with value: 0.8703703703703703 and parameters: {'objective': 'CrossEntropy', 'colsample_bylevel': 0.09064096567576584, 'depth': 10, 'boosting_type': 'Plain', 'bootstrap_type': 'Bayesian', 'bagging_temperature': 4.839767085543645}. Best is trial 205 with value: 0.890909090909091.
[32m[I 2023-04-20 23:16:23,449][39m Trial 908 finished with value: 0.8727272727272727 and parameters: {'objective': 'CrossEntropy', 'colsample_bylevel': 0.09426967649097431, 'depth': 10, 'boosting_type': 'Plain', 'bootstrap_type': 'Bayesian', 'bagging_temperature': 8.682707323953457}. Best is trial 205 with value: 0.890909090909091.
[32m[I 2023-04-20 23:16:24,051][39m Trial 909 finished with value: 0.823529411764706 and parameters: {'objective': 'Logloss', 'colsample_bylevel': 0.09086738333976903, 'depth': 1, 'boosting_type': 'Plain', 'bootstrap_type': 'Bayesian', 'bagging_temperature': 0.47096498208138105}. Best is trial 205 with value: 0.890909090909091.
[32m[I 2023-04-20 23:16:25,562][39m Trial 910 finished with value: 0.8807339449541284 and parameters: {'objective': 'Logloss', 'colsample_bylevel': 0.09276855107596756, 'depth': 10, 'boosting_type': 'Plain', 'bootstrap_type': 'Bayesian', 'bagging_temperature': 7.548642324866439}. Best is trial 205 with value: 0.890909090909091.
[32m[I 2023-04-20 23:16:26,755][39m Trial 911 finished with value: 0.8727272727272727 and parameters: {'objective': 'Logloss', 'colsample_bylevel': 0.09721769218133923, 'depth': 9, 'boosting_type': 'Plain', 'bootstrap_type': 'Bayesian', 'bagging_temperature': 6.348621184351541}. Best is trial 205 with value: 0.890909090909091.
[32m[I 2023-04-20 23:16:28,087][39m Trial 912 finished with value: 0.8347826086956522 and parameters: {'objective': 'Logloss', 'colsample_bylevel': 0.0770774444916809, 'depth': 9, 'boosting_type': 'Plain', 'bootstrap_type': 'Bernoulli', 'subsample': 0.41178284969391404}. Best is trial 205 with value: 0.890909090909091.
[32m[I 2023-04-20 23:16:29,357][39m Trial 913 finished with value: 0.875 and parameters: {'objective': 'Logloss', 'colsample_bylevel': 0.09624021484374091, 'depth': 9, 'boosting_type': 'Plain', 'bootstrap_type': 'Bayesian', 'bagging_temperature': 6.240713412961236}. Best is trial 205 with value: 0.890909090909091.
[32m[I 2023-04-20 23:16:29,976][39m Trial 914 finished with value: 0.8305084745762712 and parameters: {'objective': 'Logloss', 'colsample_bylevel': 0.030911627059592786, 'depth': 9, 'boosting_type': 'Plain', 'bootstrap_type': 'Bayesian', 'bagging_temperature': 4.239688993916448}. Best is trial 205 with value: 0.890909090909091.
[32m[I 2023-04-20 23:16:30,536][39m Trial 915 finished with value: 0.8703703703703703 and parameters: {'objective': 'Logloss', 'colsample_bylevel': 0.09662499470929284, 'depth': 10, 'boosting_type': 'Plain', 'bootstrap_type': 'Bayesian', 'bagging_temperature': 4.165184711480201}. Best is trial 205 with value: 0.890909090909091.
[32m[I 2023-04-20 23:16:31,184][39m Trial 916 finished with value: 0.8727272727272727 and parameters: {'objective': 'CrossEntropy', 'colsample_bylevel': 0.09007167533351457, 'depth': 10, 'boosting_type': 'Plain', 'bootstrap_type': 'Bayesian', 'bagging_temperature': 9.819739009610327}. Best is trial 205 with value: 0.890909090909091.
[32m[I 2023-04-20 23:16:32,389][39m Trial 917 finished with value: 0.8703703703703703 and parameters: {'objective': 'Logloss', 'colsample_bylevel': 0.09437555494756661, 'depth': 10, 'boosting_type': 'Plain', 'bootstrap_type': 'Bayesian', 'bagging_temperature': 4.368149530363862}. Best is trial 205 with value: 0.890909090909091.
[32m[I 2023-04-20 23:16:33,312][39m Trial 918 finished with value: 0.8727272727272727 and parameters: {'objective': 'Logloss', 'colsample_bylevel': 0.0970732966149669, 'depth': 10, 'boosting_type': 'Plain', 'bootstrap_type': 'Bayesian', 'bagging_temperature': 5.799337116433221}. Best is trial 205 with value: 0.890909090909091.
[32m[I 2023-04-20 23:16:34,743][39m Trial 919 finished with value: 0.8672566371681416 and parameters: {'objective': 'Logloss', 'colsample_bylevel': 0.09238436227318458, 'depth': 9, 'boosting_type': 'Plain', 'bootstrap_type': 'Bayesian', 'bagging_temperature': 6.084579279261536}. Best is trial 205 with value: 0.890909090909091.
[32m[I 2023-04-20 23:16:39,915][39m Trial 920 finished with value: 0.8495575221238938 and parameters: {'objective': 'Logloss', 'colsample_bylevel': 0.09420476277205625, 'depth': 11, 'boosting_type': 'Ordered', 'bootstrap_type': 'Bayesian', 'bagging_temperature': 5.641865680717363}. Best is trial 205 with value: 0.890909090909091.
[32m[I 2023-04-20 23:16:41,258][39m Trial 921 finished with value: 0.8727272727272727 and parameters: {'objective': 'CrossEntropy', 'colsample_bylevel': 0.09010198510104771, 'depth': 10, 'boosting_type': 'Plain', 'bootstrap_type': 'Bayesian', 'bagging_temperature': 3.1044985362747988}. Best is trial 205 with value: 0.890909090909091.
[32m[I 2023-04-20 23:16:41,986][39m Trial 922 finished with value: 0.8727272727272727 and parameters: {'objective': 'Logloss', 'colsample_bylevel': 0.09598739159745744, 'depth': 10, 'boosting_type': 'Plain', 'bootstrap_type': 'Bayesian', 'bagging_temperature': 4.772088881491418}. Best is trial 205 with value: 0.890909090909091.
[32m[I 2023-04-20 23:16:43,319][39m Trial 923 finished with value: 0.8807339449541284 and parameters: {'objective': 'Logloss', 'colsample_bylevel': 0.09255375605457963, 'depth': 9, 'boosting_type': 'Plain', 'bootstrap_type': 'Bayesian', 'bagging_temperature': 6.185432279666218}. Best is trial 205 with value: 0.890909090909091.
[32m[I 2023-04-20 23:16:44,716][39m Trial 924 finished with value: 0.8571428571428572 and parameters: {'objective': 'Logloss', 'colsample_bylevel': 0.09575604329517234, 'depth': 9, 'boosting_type': 'Plain', 'bootstrap_type': 'Bayesian', 'bagging_temperature': 4.917106978409633}. Best is trial 205 with value: 0.890909090909091.
[32m[I 2023-04-20 23:16:45,296][39m Trial 925 finished with value: 0.8623853211009175 and parameters: {'objective': 'CrossEntropy', 'colsample_bylevel': 0.09143680787308181, 'depth': 9, 'boosting_type': 'Plain', 'bootstrap_type': 'Bayesian', 'bagging_temperature': 2.5636798614892746}. Best is trial 205 with value: 0.890909090909091.
[32m[I 2023-04-20 23:16:46,213][39m Trial 926 finished with value: 0.8828828828828829 and parameters: {'objective': 'Logloss', 'colsample_bylevel': 0.09417378412594371, 'depth': 9, 'boosting_type': 'Plain', 'bootstrap_type': 'Bayesian', 'bagging_temperature': 5.902041223409598}. Best is trial 205 with value: 0.890909090909091.
[32m[I 2023-04-20 23:16:47,513][39m Trial 927 finished with value: 0.8495575221238938 and parameters: {'objective': 'Logloss', 'colsample_bylevel': 0.09519419117484368, 'depth': 8, 'boosting_type': 'Plain', 'bootstrap_type': 'MVS'}. Best is trial 205 with value: 0.890909090909091.
