[32m[I 2023-04-21 01:07:30,195][39m Trial 5919 finished with value: 0.8648648648648648 and parameters: {'objective': 'Logloss', 'colsample_bylevel': 0.08975828525278318, 'depth': 8, 'boosting_type': 'Plain', 'bootstrap_type': 'Bayesian', 'bagging_temperature': 5.471948815428296}. Best is trial 1464 with value: 0.8990825688073395.
[32m[I 2023-04-21 01:07:31,012][39m Trial 5920 finished with value: 0.888888888888889 and parameters: {'objective': 'CrossEntropy', 'colsample_bylevel': 0.08619634804315504, 'depth': 12, 'boosting_type': 'Plain', 'bootstrap_type': 'Bayesian', 'bagging_temperature': 6.381431996052526}. Best is trial 1464 with value: 0.8990825688073395.
[32m[I 2023-04-21 01:07:31,939][39m Trial 5921 finished with value: 0.8623853211009175 and parameters: {'objective': 'Logloss', 'colsample_bylevel': 0.08647892309512013, 'depth': 11, 'boosting_type': 'Plain', 'bootstrap_type': 'Bayesian', 'bagging_temperature': 5.5503760013143095}. Best is trial 1464 with value: 0.8990825688073395.
[32m[I 2023-04-21 01:07:33,012][39m Trial 5922 finished with value: 0.8703703703703703 and parameters: {'objective': 'CrossEntropy', 'colsample_bylevel': 0.08588024092130268, 'depth': 10, 'boosting_type': 'Plain', 'bootstrap_type': 'Bayesian', 'bagging_temperature': 5.833728140377556}. Best is trial 1464 with value: 0.8990825688073395.
[32m[I 2023-04-21 01:07:34,159][39m Trial 5923 finished with value: 0.8807339449541284 and parameters: {'objective': 'Logloss', 'colsample_bylevel': 0.09732792160025501, 'depth': 7, 'boosting_type': 'Plain', 'bootstrap_type': 'Bayesian', 'bagging_temperature': 6.188060419549666}. Best is trial 1464 with value: 0.8990825688073395.
[32m[I 2023-04-21 01:07:36,146][39m Trial 5924 finished with value: 0.8828828828828829 and parameters: {'objective': 'Logloss', 'colsample_bylevel': 0.09455663576573752, 'depth': 9, 'boosting_type': 'Plain', 'bootstrap_type': 'Bayesian', 'bagging_temperature': 3.496037809947809}. Best is trial 1464 with value: 0.8990825688073395.
[32m[I 2023-04-21 01:07:40,242][39m Trial 5925 finished with value: 0.8448275862068967 and parameters: {'objective': 'CrossEntropy', 'colsample_bylevel': 0.03813407900331377, 'depth': 8, 'boosting_type': 'Ordered', 'bootstrap_type': 'Bayesian', 'bagging_temperature': 5.588366765059411}. Best is trial 1464 with value: 0.8990825688073395.
[32m[I 2023-04-21 01:07:41,506][39m Trial 5926 finished with value: 0.8448275862068967 and parameters: {'objective': 'Logloss', 'colsample_bylevel': 0.05739727625680907, 'depth': 11, 'boosting_type': 'Plain', 'bootstrap_type': 'Bayesian', 'bagging_temperature': 5.168594208488582}. Best is trial 1464 with value: 0.8990825688073395.
[32m[I 2023-04-21 01:07:43,309][39m Trial 5927 finished with value: 0.8727272727272727 and parameters: {'objective': 'Logloss', 'colsample_bylevel': 0.09795766976003913, 'depth': 9, 'boosting_type': 'Plain', 'bootstrap_type': 'Bayesian', 'bagging_temperature': 6.113099060807153}. Best is trial 1464 with value: 0.8990825688073395.
[32m[I 2023-04-21 01:07:44,707][39m Trial 5928 finished with value: 0.8828828828828829 and parameters: {'objective': 'Logloss', 'colsample_bylevel': 0.09477536081138874, 'depth': 9, 'boosting_type': 'Plain', 'bootstrap_type': 'Bayesian', 'bagging_temperature': 6.620835782138946}. Best is trial 1464 with value: 0.8990825688073395.
[32m[I 2023-04-21 01:07:46,013][39m Trial 5929 finished with value: 0.8727272727272727 and parameters: {'objective': 'Logloss', 'colsample_bylevel': 0.0951694667598582, 'depth': 9, 'boosting_type': 'Plain', 'bootstrap_type': 'Bayesian', 'bagging_temperature': 7.0871287138195385}. Best is trial 1464 with value: 0.8990825688073395.
[32m[I 2023-04-21 01:07:47,519][39m Trial 5930 finished with value: 0.8807339449541284 and parameters: {'objective': 'Logloss', 'colsample_bylevel': 0.09653792529232047, 'depth': 9, 'boosting_type': 'Plain', 'bootstrap_type': 'Bayesian', 'bagging_temperature': 6.543222627239045}. Best is trial 1464 with value: 0.8990825688073395.
[32m[I 2023-04-21 01:07:48,240][39m Trial 5931 finished with value: 0.8521739130434783 and parameters: {'objective': 'Logloss', 'colsample_bylevel': 0.09179591619149734, 'depth': 2, 'boosting_type': 'Plain', 'bootstrap_type': 'Bayesian', 'bagging_temperature': 6.547546132033624}. Best is trial 1464 with value: 0.8990825688073395.
[32m[I 2023-04-21 01:07:49,667][39m Trial 5932 finished with value: 0.8807339449541284 and parameters: {'objective': 'Logloss', 'colsample_bylevel': 0.09767091495106761, 'depth': 7, 'boosting_type': 'Plain', 'bootstrap_type': 'Bayesian', 'bagging_temperature': 5.690018367981258}. Best is trial 1464 with value: 0.8990825688073395.
[32m[I 2023-04-21 01:07:50,747][39m Trial 5933 finished with value: 0.8648648648648648 and parameters: {'objective': 'Logloss', 'colsample_bylevel': 0.08393884388875517, 'depth': 12, 'boosting_type': 'Plain', 'bootstrap_type': 'Bayesian', 'bagging_temperature': 5.33489678113934}. Best is trial 1464 with value: 0.8990825688073395.
[32m[I 2023-04-21 01:07:51,885][39m Trial 5934 finished with value: 0.7966101694915254 and parameters: {'objective': 'Logloss', 'colsample_bylevel': 0.020010018488344744, 'depth': 8, 'boosting_type': 'Plain', 'bootstrap_type': 'Bayesian', 'bagging_temperature': 5.585498458794518}. Best is trial 1464 with value: 0.8990825688073395.
[32m[I 2023-04-21 01:07:52,626][39m Trial 5935 finished with value: 0.8347826086956522 and parameters: {'objective': 'CrossEntropy', 'colsample_bylevel': 0.08404687935429582, 'depth': 6, 'boosting_type': 'Plain', 'bootstrap_type': 'Bayesian', 'bagging_temperature': 4.929276537697341}. Best is trial 1464 with value: 0.8990825688073395.
[32m[I 2023-04-21 01:07:53,478][39m Trial 5936 finished with value: 0.8828828828828829 and parameters: {'objective': 'Logloss', 'colsample_bylevel': 0.09712278827028338, 'depth': 7, 'boosting_type': 'Plain', 'bootstrap_type': 'Bayesian', 'bagging_temperature': 7.015518557771496}. Best is trial 1464 with value: 0.8990825688073395.
[32m[I 2023-04-21 01:07:54,835][39m Trial 5937 finished with value: 0.8421052631578947 and parameters: {'objective': 'Logloss', 'colsample_bylevel': 0.0705019355207686, 'depth': 12, 'boosting_type': 'Plain', 'bootstrap_type': 'Bernoulli', 'subsample': 0.39742211507417796}. Best is trial 1464 with value: 0.8990825688073395.
[32m[I 2023-04-21 01:07:55,876][39m Trial 5938 finished with value: 0.8727272727272727 and parameters: {'objective': 'Logloss', 'colsample_bylevel': 0.09868514030957418, 'depth': 12, 'boosting_type': 'Plain', 'bootstrap_type': 'Bayesian', 'bagging_temperature': 3.7689696697968595}. Best is trial 1464 with value: 0.8990825688073395.
[32m[I 2023-04-21 01:07:57,106][39m Trial 5939 finished with value: 0.8672566371681416 and parameters: {'objective': 'CrossEntropy', 'colsample_bylevel': 0.07628942820941009, 'depth': 12, 'boosting_type': 'Plain', 'bootstrap_type': 'Bayesian', 'bagging_temperature': 5.415848190816588}. Best is trial 1464 with value: 0.8990825688073395.
[32m[I 2023-04-21 01:07:58,474][39m Trial 5940 finished with value: 0.8495575221238938 and parameters: {'objective': 'Logloss', 'colsample_bylevel': 0.09657318451354838, 'depth': 6, 'boosting_type': 'Plain', 'bootstrap_type': 'MVS'}. Best is trial 1464 with value: 0.8990825688073395.
[32m[I 2023-04-21 01:07:59,795][39m Trial 5941 finished with value: 0.8807339449541284 and parameters: {'objective': 'Logloss', 'colsample_bylevel': 0.09213588148551459, 'depth': 10, 'boosting_type': 'Plain', 'bootstrap_type': 'Bayesian', 'bagging_temperature': 5.467126813349213}. Best is trial 1464 with value: 0.8990825688073395.
[32m[I 2023-04-21 01:08:01,334][39m Trial 5942 finished with value: 0.8828828828828829 and parameters: {'objective': 'Logloss', 'colsample_bylevel': 0.09464882420164455, 'depth': 9, 'boosting_type': 'Plain', 'bootstrap_type': 'Bayesian', 'bagging_temperature': 6.213117328718557}. Best is trial 1464 with value: 0.8990825688073395.
[32m[I 2023-04-21 01:08:02,228][39m Trial 5943 finished with value: 0.8807339449541284 and parameters: {'objective': 'CrossEntropy', 'colsample_bylevel': 0.09088175902732303, 'depth': 10, 'boosting_type': 'Plain', 'bootstrap_type': 'Bayesian', 'bagging_temperature': 5.697563097196766}. Best is trial 1464 with value: 0.8990825688073395.
[32m[I 2023-04-21 01:08:03,359][39m Trial 5944 finished with value: 0.888888888888889 and parameters: {'objective': 'Logloss', 'colsample_bylevel': 0.09994233032392633, 'depth': 9, 'boosting_type': 'Plain', 'bootstrap_type': 'Bayesian', 'bagging_temperature': 4.806628453482433}. Best is trial 1464 with value: 0.8990825688073395.
[32m[I 2023-04-21 01:08:05,039][39m Trial 5945 finished with value: 0.8648648648648648 and parameters: {'objective': 'Logloss', 'colsample_bylevel': 0.08837691013212878, 'depth': 12, 'boosting_type': 'Plain', 'bootstrap_type': 'Bayesian', 'bagging_temperature': 5.097882239500309}. Best is trial 1464 with value: 0.8990825688073395.
[32m[I 2023-04-21 01:08:10,188][39m Trial 5946 finished with value: 0.8468468468468469 and parameters: {'objective': 'CrossEntropy', 'colsample_bylevel': 0.09334966238961993, 'depth': 9, 'boosting_type': 'Ordered', 'bootstrap_type': 'Bayesian', 'bagging_temperature': 4.358616821111912}. Best is trial 1464 with value: 0.8990825688073395.
[32m[I 2023-04-21 01:08:11,427][39m Trial 5947 finished with value: 0.8828828828828829 and parameters: {'objective': 'Logloss', 'colsample_bylevel': 0.0967783930292141, 'depth': 7, 'boosting_type': 'Plain', 'bootstrap_type': 'Bayesian', 'bagging_temperature': 3.849012103149863}. Best is trial 1464 with value: 0.8990825688073395.
[32m[I 2023-04-21 01:08:12,655][39m Trial 5948 finished with value: 0.888888888888889 and parameters: {'objective': 'CrossEntropy', 'colsample_bylevel': 0.09606530861345364, 'depth': 10, 'boosting_type': 'Plain', 'bootstrap_type': 'Bayesian', 'bagging_temperature': 6.039665584530672}. Best is trial 1464 with value: 0.8990825688073395.
[32m[I 2023-04-21 01:08:14,127][39m Trial 5949 finished with value: 0.888888888888889 and parameters: {'objective': 'Logloss', 'colsample_bylevel': 0.09365154971039218, 'depth': 8, 'boosting_type': 'Plain', 'bootstrap_type': 'Bayesian', 'bagging_temperature': 5.648954157932669}. Best is trial 1464 with value: 0.8990825688073395.
[32m[I 2023-04-21 01:08:15,906][39m Trial 5950 finished with value: 0.8807339449541284 and parameters: {'objective': 'Logloss', 'colsample_bylevel': 0.09274063632293597, 'depth': 9, 'boosting_type': 'Plain', 'bootstrap_type': 'Bayesian', 'bagging_temperature': 5.394525784490318}. Best is trial 1464 with value: 0.8990825688073395.
[32m[I 2023-04-21 01:08:16,744][39m Trial 5951 finished with value: 0.8648648648648648 and parameters: {'objective': 'Logloss', 'colsample_bylevel': 0.0982712245973708, 'depth': 7, 'boosting_type': 'Plain', 'bootstrap_type': 'Bayesian', 'bagging_temperature': 3.322546183188222}. Best is trial 1464 with value: 0.8990825688073395.
[32m[I 2023-04-21 01:08:17,444][39m Trial 5952 finished with value: 0.8727272727272727 and parameters: {'objective': 'CrossEntropy', 'colsample_bylevel': 0.09970780862661366, 'depth': 11, 'boosting_type': 'Plain', 'bootstrap_type': 'Bayesian', 'bagging_temperature': 7.75166263908198}. Best is trial 1464 with value: 0.8990825688073395.
[32m[I 2023-04-21 01:08:19,021][39m Trial 5953 finished with value: 0.8807339449541284 and parameters: {'objective': 'CrossEntropy', 'colsample_bylevel': 0.09327360232762329, 'depth': 10, 'boosting_type': 'Plain', 'bootstrap_type': 'Bayesian', 'bagging_temperature': 5.068263941988734}. Best is trial 1464 with value: 0.8990825688073395.
[32m[I 2023-04-21 01:08:20,392][39m Trial 5954 finished with value: 0.8807339449541284 and parameters: {'objective': 'Logloss', 'colsample_bylevel': 0.09493246828436339, 'depth': 8, 'boosting_type': 'Plain', 'bootstrap_type': 'Bayesian', 'bagging_temperature': 5.430563214500212}. Best is trial 1464 with value: 0.8990825688073395.
[32m[I 2023-04-21 01:08:21,353][39m Trial 5955 finished with value: 0.8623853211009175 and parameters: {'objective': 'Logloss', 'colsample_bylevel': 0.09838969532633006, 'depth': 7, 'boosting_type': 'Plain', 'bootstrap_type': 'Bayesian', 'bagging_temperature': 3.136380081174628}. Best is trial 1464 with value: 0.8990825688073395.
[32m[I 2023-04-21 01:08:22,198][39m Trial 5956 finished with value: 0.8571428571428572 and parameters: {'objective': 'CrossEntropy', 'colsample_bylevel': 0.09738490956122935, 'depth': 7, 'boosting_type': 'Plain', 'bootstrap_type': 'Bernoulli', 'subsample': 0.7018460717159996}. Best is trial 1464 with value: 0.8990825688073395.
[32m[I 2023-04-21 01:08:22,987][39m Trial 5957 finished with value: 0.8785046728971961 and parameters: {'objective': 'CrossEntropy', 'colsample_bylevel': 0.0866515888956706, 'depth': 11, 'boosting_type': 'Plain', 'bootstrap_type': 'Bayesian', 'bagging_temperature': 4.6777160568803575}. Best is trial 1464 with value: 0.8990825688073395.
[32m[I 2023-04-21 01:08:25,072][39m Trial 5958 finished with value: 0.8495575221238938 and parameters: {'objective': 'Logloss', 'colsample_bylevel': 0.09418470643410207, 'depth': 9, 'boosting_type': 'Plain', 'bootstrap_type': 'Bayesian', 'bagging_temperature': 0.8659644705202201}. Best is trial 1464 with value: 0.8990825688073395.
[32m[I 2023-04-21 01:08:26,687][39m Trial 5959 finished with value: 0.8727272727272727 and parameters: {'objective': 'Logloss', 'colsample_bylevel': 0.0965935537932359, 'depth': 9, 'boosting_type': 'Plain', 'bootstrap_type': 'Bayesian', 'bagging_temperature': 4.652509610358689}. Best is trial 1464 with value: 0.8990825688073395.
[32m[I 2023-04-21 01:08:27,643][39m Trial 5960 finished with value: 0.8807339449541284 and parameters: {'objective': 'Logloss', 'colsample_bylevel': 0.09429412577893684, 'depth': 8, 'boosting_type': 'Plain', 'bootstrap_type': 'Bayesian', 'bagging_temperature': 6.045245509703036}. Best is trial 1464 with value: 0.8990825688073395.
[32m[I 2023-04-21 01:08:28,571][39m Trial 5961 finished with value: 0.8347826086956522 and parameters: {'objective': 'Logloss', 'colsample_bylevel': 0.09410645135807347, 'depth': 4, 'boosting_type': 'Plain', 'bootstrap_type': 'MVS'}. Best is trial 1464 with value: 0.8990825688073395.
[32m[I 2023-04-21 01:08:33,623][39m Trial 5962 finished with value: 0.8347826086956522 and parameters: {'objective': 'Logloss', 'colsample_bylevel': 0.091714341741011, 'depth': 10, 'boosting_type': 'Ordered', 'bootstrap_type': 'Bayesian', 'bagging_temperature': 4.063607820655665}. Best is trial 1464 with value: 0.8990825688073395.
[32m[I 2023-04-21 01:08:35,003][39m Trial 5963 finished with value: 0.8545454545454546 and parameters: {'objective': 'Logloss', 'colsample_bylevel': 0.09016592197196588, 'depth': 11, 'boosting_type': 'Plain', 'bootstrap_type': 'Bayesian', 'bagging_temperature': 4.391391441753109}. Best is trial 1464 with value: 0.8990825688073395.
[32m[I 2023-04-21 01:08:36,746][39m Trial 5964 finished with value: 0.8807339449541284 and parameters: {'objective': 'Logloss', 'colsample_bylevel': 0.09559641017894746, 'depth': 9, 'boosting_type': 'Plain', 'bootstrap_type': 'Bayesian', 'bagging_temperature': 7.477823913620519}. Best is trial 1464 with value: 0.8990825688073395.
[32m[I 2023-04-21 01:08:38,142][39m Trial 5965 finished with value: 0.8648648648648648 and parameters: {'objective': 'CrossEntropy', 'colsample_bylevel': 0.09608206777723549, 'depth': 9, 'boosting_type': 'Plain', 'bootstrap_type': 'Bayesian', 'bagging_temperature': 6.209208259255479}. Best is trial 1464 with value: 0.8990825688073395.
[32m[I 2023-04-21 01:08:40,102][39m Trial 5966 finished with value: 0.8807339449541284 and parameters: {'objective': 'CrossEntropy', 'colsample_bylevel': 0.09581714558492767, 'depth': 9, 'boosting_type': 'Plain', 'bootstrap_type': 'Bayesian', 'bagging_temperature': 5.352747204962881}. Best is trial 1464 with value: 0.8990825688073395.
[32m[I 2023-04-21 01:08:41,241][39m Trial 5967 finished with value: 0.8727272727272727 and parameters: {'objective': 'CrossEntropy', 'colsample_bylevel': 0.09937009858078903, 'depth': 11, 'boosting_type': 'Plain', 'bootstrap_type': 'Bayesian', 'bagging_temperature': 4.745132494160903}. Best is trial 1464 with value: 0.8990825688073395.
[32m[I 2023-04-21 01:08:41,999][39m Trial 5968 finished with value: 0.8727272727272727 and parameters: {'objective': 'CrossEntropy', 'colsample_bylevel': 0.09083479768500774, 'depth': 12, 'boosting_type': 'Plain', 'bootstrap_type': 'Bayesian', 'bagging_temperature': 4.715566676267196}. Best is trial 1464 with value: 0.8990825688073395.
[32m[I 2023-04-21 01:08:42,975][39m Trial 5969 finished with value: 0.888888888888889 and parameters: {'objective': 'Logloss', 'colsample_bylevel': 0.09604793304968022, 'depth': 11, 'boosting_type': 'Plain', 'bootstrap_type': 'Bayesian', 'bagging_temperature': 5.831123865417167}. Best is trial 1464 with value: 0.8990825688073395.
[32m[I 2023-04-21 01:08:43,742][39m Trial 5970 finished with value: 0.8727272727272727 and parameters: {'objective': 'Logloss', 'colsample_bylevel': 0.09114141747709777, 'depth': 12, 'boosting_type': 'Plain', 'bootstrap_type': 'Bayesian', 'bagging_temperature': 6.618679369214535}. Best is trial 1464 with value: 0.8990825688073395.
[32m[I 2023-04-21 01:08:44,676][39m Trial 5971 finished with value: 0.8807339449541284 and parameters: {'objective': 'CrossEntropy', 'colsample_bylevel': 0.09590371306858542, 'depth': 12, 'boosting_type': 'Plain', 'bootstrap_type': 'Bayesian', 'bagging_temperature': 6.6735424187157015}. Best is trial 1464 with value: 0.8990825688073395.
[32m[I 2023-04-21 01:08:46,646][39m Trial 5972 finished with value: 0.888888888888889 and parameters: {'objective': 'CrossEntropy', 'colsample_bylevel': 0.09132817946229026, 'depth': 8, 'boosting_type': 'Plain', 'bootstrap_type': 'Bayesian', 'bagging_temperature': 4.882227469704884}. Best is trial 1464 with value: 0.8990825688073395.
[32m[I 2023-04-21 01:08:47,702][39m Trial 5973 finished with value: 0.8785046728971961 and parameters: {'objective': 'CrossEntropy', 'colsample_bylevel': 0.08842324369558101, 'depth': 12, 'boosting_type': 'Plain', 'bootstrap_type': 'Bayesian', 'bagging_temperature': 4.855968682016567}. Best is trial 1464 with value: 0.8990825688073395.
[32m[I 2023-04-21 01:08:48,753][39m Trial 5974 finished with value: 0.890909090909091 and parameters: {'objective': 'Logloss', 'colsample_bylevel': 0.0938718070627581, 'depth': 8, 'boosting_type': 'Plain', 'bootstrap_type': 'Bayesian', 'bagging_temperature': 5.2751020136789775}. Best is trial 1464 with value: 0.8990825688073395.
[32m[I 2023-04-21 01:08:49,617][39m Trial 5975 finished with value: 0.8648648648648648 and parameters: {'objective': 'Logloss', 'colsample_bylevel': 0.0894033966191126, 'depth': 5, 'boosting_type': 'Plain', 'bootstrap_type': 'Bayesian', 'bagging_temperature': 5.560761134867997}. Best is trial 1464 with value: 0.8990825688073395.
[32m[I 2023-04-21 01:08:50,799][39m Trial 5976 finished with value: 0.8648648648648648 and parameters: {'objective': 'Logloss', 'colsample_bylevel': 0.09165126524904917, 'depth': 12, 'boosting_type': 'Plain', 'bootstrap_type': 'Bayesian', 'bagging_temperature': 5.003561734702667}. Best is trial 1464 with value: 0.8990825688073395.
[32m[I 2023-04-21 01:08:52,287][39m Trial 5977 finished with value: 0.8807339449541284 and parameters: {'objective': 'Logloss', 'colsample_bylevel': 0.09596895233959118, 'depth': 7, 'boosting_type': 'Plain', 'bootstrap_type': 'Bayesian', 'bagging_temperature': 5.960118642277863}. Best is trial 1464 with value: 0.8990825688073395.
[32m[I 2023-04-21 01:08:53,457][39m Trial 5978 finished with value: 0.8672566371681416 and parameters: {'objective': 'Logloss', 'colsample_bylevel': 0.09996623946802277, 'depth': 11, 'boosting_type': 'Plain', 'bootstrap_type': 'Bernoulli', 'subsample': 0.5577448839499092}. Best is trial 1464 with value: 0.8990825688073395.
[32m[I 2023-04-21 01:08:54,773][39m Trial 5979 finished with value: 0.8807339449541284 and parameters: {'objective': 'Logloss', 'colsample_bylevel': 0.08921885734174664, 'depth': 12, 'boosting_type': 'Plain', 'bootstrap_type': 'Bayesian', 'bagging_temperature': 5.209589014330538}. Best is trial 1464 with value: 0.8990825688073395.
[32m[I 2023-04-21 01:08:56,193][39m Trial 5980 finished with value: 0.8571428571428572 and parameters: {'objective': 'CrossEntropy', 'colsample_bylevel': 0.08695994444054944, 'depth': 12, 'boosting_type': 'Plain', 'bootstrap_type': 'Bayesian', 'bagging_temperature': 5.063877616338847}. Best is trial 1464 with value: 0.8990825688073395.
[32m[I 2023-04-21 01:08:57,100][39m Trial 5981 finished with value: 0.875 and parameters: {'objective': 'Logloss', 'colsample_bylevel': 0.09801055226181979, 'depth': 7, 'boosting_type': 'Plain', 'bootstrap_type': 'Bayesian', 'bagging_temperature': 3.8385786856973714}. Best is trial 1464 with value: 0.8990825688073395.
[32m[I 2023-04-21 01:08:58,118][39m Trial 5982 finished with value: 0.8571428571428572 and parameters: {'objective': 'Logloss', 'colsample_bylevel': 0.09831193825492858, 'depth': 7, 'boosting_type': 'Plain', 'bootstrap_type': 'Bayesian', 'bagging_temperature': 7.275045488284703}. Best is trial 1464 with value: 0.8990825688073395.
[32m[I 2023-04-21 01:09:02,946][39m Trial 5983 finished with value: 0.8571428571428572 and parameters: {'objective': 'CrossEntropy', 'colsample_bylevel': 0.09979283308454152, 'depth': 8, 'boosting_type': 'Ordered', 'bootstrap_type': 'MVS'}. Best is trial 1464 with value: 0.8990825688073395.
[32m[I 2023-04-21 01:09:04,561][39m Trial 5984 finished with value: 0.888888888888889 and parameters: {'objective': 'Logloss', 'colsample_bylevel': 0.09795873434628809, 'depth': 8, 'boosting_type': 'Plain', 'bootstrap_type': 'Bayesian', 'bagging_temperature': 5.73763189579484}. Best is trial 1464 with value: 0.8990825688073395.
