[32m[I 2023-04-20 23:38:45,491][39m Trial 1982 finished with value: 0.8727272727272727 and parameters: {'objective': 'CrossEntropy', 'colsample_bylevel': 0.09361907919799006, 'depth': 11, 'boosting_type': 'Plain', 'bootstrap_type': 'Bayesian', 'bagging_temperature': 4.461857445085025}. Best is trial 1464 with value: 0.8990825688073395.
[32m[I 2023-04-20 23:38:50,785][39m Trial 1983 finished with value: 0.8421052631578947 and parameters: {'objective': 'Logloss', 'colsample_bylevel': 0.09997223835536657, 'depth': 8, 'boosting_type': 'Ordered', 'bootstrap_type': 'Bayesian', 'bagging_temperature': 3.6891627807857987}. Best is trial 1464 with value: 0.8990825688073395.
[32m[I 2023-04-20 23:38:52,511][39m Trial 1984 finished with value: 0.888888888888889 and parameters: {'objective': 'Logloss', 'colsample_bylevel': 0.09815961738668867, 'depth': 8, 'boosting_type': 'Plain', 'bootstrap_type': 'Bayesian', 'bagging_temperature': 4.779594929476793}. Best is trial 1464 with value: 0.8990825688073395.
[32m[I 2023-04-20 23:38:53,414][39m Trial 1985 finished with value: 0.8623853211009175 and parameters: {'objective': 'Logloss', 'colsample_bylevel': 0.09087308636308948, 'depth': 9, 'boosting_type': 'Plain', 'bootstrap_type': 'Bayesian', 'bagging_temperature': 4.630445701286163}. Best is trial 1464 with value: 0.8990825688073395.
[32m[I 2023-04-20 23:38:54,872][39m Trial 1986 finished with value: 0.8807339449541284 and parameters: {'objective': 'Logloss', 'colsample_bylevel': 0.0920276718142305, 'depth': 9, 'boosting_type': 'Plain', 'bootstrap_type': 'Bayesian', 'bagging_temperature': 4.983447013541388}. Best is trial 1464 with value: 0.8990825688073395.
[32m[I 2023-04-20 23:38:55,584][39m Trial 1987 finished with value: 0.8807339449541284 and parameters: {'objective': 'Logloss', 'colsample_bylevel': 0.0948548514815826, 'depth': 10, 'boosting_type': 'Plain', 'bootstrap_type': 'Bayesian', 'bagging_temperature': 4.62837688086839}. Best is trial 1464 with value: 0.8990825688073395.
[32m[I 2023-04-20 23:38:56,741][39m Trial 1988 finished with value: 0.8648648648648648 and parameters: {'objective': 'Logloss', 'colsample_bylevel': 0.09243934121200063, 'depth': 10, 'boosting_type': 'Plain', 'bootstrap_type': 'Bayesian', 'bagging_temperature': 6.395705160549828}. Best is trial 1464 with value: 0.8990825688073395.
[32m[I 2023-04-20 23:38:57,936][39m Trial 1989 finished with value: 0.8672566371681416 and parameters: {'objective': 'Logloss', 'colsample_bylevel': 0.09161927011355273, 'depth': 10, 'boosting_type': 'Plain', 'bootstrap_type': 'Bayesian', 'bagging_temperature': 7.017475559706266}. Best is trial 1464 with value: 0.8990825688073395.
[32m[I 2023-04-20 23:38:58,854][39m Trial 1990 finished with value: 0.8727272727272727 and parameters: {'objective': 'Logloss', 'colsample_bylevel': 0.09519562514965971, 'depth': 10, 'boosting_type': 'Plain', 'bootstrap_type': 'Bayesian', 'bagging_temperature': 5.528261360464648}. Best is trial 1464 with value: 0.8990825688073395.
[32m[I 2023-04-20 23:38:59,502][39m Trial 1991 finished with value: 0.8807339449541284 and parameters: {'objective': 'CrossEntropy', 'colsample_bylevel': 0.08903541534763561, 'depth': 12, 'boosting_type': 'Plain', 'bootstrap_type': 'Bayesian', 'bagging_temperature': 7.563989828331386}. Best is trial 1464 with value: 0.8990825688073395.
[32m[I 2023-04-20 23:39:00,674][39m Trial 1992 finished with value: 0.8807339449541284 and parameters: {'objective': 'CrossEntropy', 'colsample_bylevel': 0.08798395022925994, 'depth': 10, 'boosting_type': 'Plain', 'bootstrap_type': 'Bayesian', 'bagging_temperature': 7.290814303387075}. Best is trial 1464 with value: 0.8990825688073395.
[32m[I 2023-04-20 23:39:01,837][39m Trial 1993 finished with value: 0.8807339449541284 and parameters: {'objective': 'Logloss', 'colsample_bylevel': 0.09836526250576637, 'depth': 7, 'boosting_type': 'Plain', 'bootstrap_type': 'Bayesian', 'bagging_temperature': 2.3562391235155355}. Best is trial 1464 with value: 0.8990825688073395.
[32m[I 2023-04-20 23:39:02,954][39m Trial 1994 finished with value: 0.8727272727272727 and parameters: {'objective': 'Logloss', 'colsample_bylevel': 0.0944730305523785, 'depth': 10, 'boosting_type': 'Plain', 'bootstrap_type': 'Bayesian', 'bagging_temperature': 5.1764871969119}. Best is trial 1464 with value: 0.8990825688073395.
[32m[I 2023-04-20 23:39:04,278][39m Trial 1995 finished with value: 0.8807339449541284 and parameters: {'objective': 'Logloss', 'colsample_bylevel': 0.09058042354720733, 'depth': 10, 'boosting_type': 'Plain', 'bootstrap_type': 'Bayesian', 'bagging_temperature': 5.324936240681466}. Best is trial 1464 with value: 0.8990825688073395.
[32m[I 2023-04-20 23:39:05,193][39m Trial 1996 finished with value: 0.8703703703703703 and parameters: {'objective': 'CrossEntropy', 'colsample_bylevel': 0.09294969489915017, 'depth': 10, 'boosting_type': 'Plain', 'bootstrap_type': 'Bayesian', 'bagging_temperature': 5.552513555627359}. Best is trial 1464 with value: 0.8990825688073395.
[32m[I 2023-04-20 23:39:06,348][39m Trial 1997 finished with value: 0.8571428571428572 and parameters: {'objective': 'Logloss', 'colsample_bylevel': 0.08953026235066233, 'depth': 9, 'boosting_type': 'Plain', 'bootstrap_type': 'MVS'}. Best is trial 1464 with value: 0.8990825688073395.
[32m[I 2023-04-20 23:39:07,151][39m Trial 1998 finished with value: 0.8807339449541284 and parameters: {'objective': 'CrossEntropy', 'colsample_bylevel': 0.08798486844476067, 'depth': 10, 'boosting_type': 'Plain', 'bootstrap_type': 'Bayesian', 'bagging_temperature': 6.04389654491339}. Best is trial 1464 with value: 0.8990825688073395.
[32m[I 2023-04-20 23:39:08,040][39m Trial 1999 finished with value: 0.8495575221238938 and parameters: {'objective': 'Logloss', 'colsample_bylevel': 0.09637534750263808, 'depth': 8, 'boosting_type': 'Plain', 'bootstrap_type': 'Bernoulli', 'subsample': 0.731490157832963}. Best is trial 1464 with value: 0.8990825688073395.
[32m[I 2023-04-20 23:39:09,124][39m Trial 2000 finished with value: 0.8727272727272727 and parameters: {'objective': 'CrossEntropy', 'colsample_bylevel': 0.09282531907666311, 'depth': 10, 'boosting_type': 'Plain', 'bootstrap_type': 'Bayesian', 'bagging_temperature': 5.622827673032574}. Best is trial 1464 with value: 0.8990825688073395.
[32m[I 2023-04-20 23:39:10,497][39m Trial 2001 finished with value: 0.8727272727272727 and parameters: {'objective': 'Logloss', 'colsample_bylevel': 0.09316555828621766, 'depth': 7, 'boosting_type': 'Plain', 'bootstrap_type': 'Bayesian', 'bagging_temperature': 6.510379724296578}. Best is trial 1464 with value: 0.8990825688073395.
[32m[I 2023-04-20 23:39:15,955][39m Trial 2002 finished with value: 0.8448275862068967 and parameters: {'objective': 'Logloss', 'colsample_bylevel': 0.08028102464789746, 'depth': 7, 'boosting_type': 'Ordered', 'bootstrap_type': 'Bayesian', 'bagging_temperature': 6.138477166848035}. Best is trial 1464 with value: 0.8990825688073395.
[32m[I 2023-04-20 23:39:17,268][39m Trial 2003 finished with value: 0.8703703703703703 and parameters: {'objective': 'CrossEntropy', 'colsample_bylevel': 0.09142752062748895, 'depth': 10, 'boosting_type': 'Plain', 'bootstrap_type': 'Bayesian', 'bagging_temperature': 4.42006860308037}. Best is trial 1464 with value: 0.8990825688073395.
[32m[I 2023-04-20 23:39:18,444][39m Trial 2004 finished with value: 0.8807339449541284 and parameters: {'objective': 'CrossEntropy', 'colsample_bylevel': 0.09393121193605125, 'depth': 10, 'boosting_type': 'Plain', 'bootstrap_type': 'Bayesian', 'bagging_temperature': 6.854403292732496}. Best is trial 1464 with value: 0.8990825688073395.
[32m[I 2023-04-20 23:39:19,314][39m Trial 2005 finished with value: 0.8727272727272727 and parameters: {'objective': 'CrossEntropy', 'colsample_bylevel': 0.09216025973481085, 'depth': 10, 'boosting_type': 'Plain', 'bootstrap_type': 'Bernoulli', 'subsample': 0.3065155155936421}. Best is trial 1464 with value: 0.8990825688073395.
[32m[I 2023-04-20 23:39:19,881][39m Trial 2006 finished with value: 0.8448275862068967 and parameters: {'objective': 'Logloss', 'colsample_bylevel': 0.09706485401338867, 'depth': 1, 'boosting_type': 'Plain', 'bootstrap_type': 'Bayesian', 'bagging_temperature': 3.50024408230874}. Best is trial 1464 with value: 0.8990825688073395.
[32m[I 2023-04-20 23:39:20,630][39m Trial 2007 finished with value: 0.8648648648648648 and parameters: {'objective': 'CrossEntropy', 'colsample_bylevel': 0.08884275562623167, 'depth': 10, 'boosting_type': 'Plain', 'bootstrap_type': 'Bayesian', 'bagging_temperature': 6.747758091151295}. Best is trial 1464 with value: 0.8990825688073395.
[32m[I 2023-04-20 23:39:22,135][39m Trial 2008 finished with value: 0.8807339449541284 and parameters: {'objective': 'Logloss', 'colsample_bylevel': 0.09752133419921606, 'depth': 8, 'boosting_type': 'Plain', 'bootstrap_type': 'Bayesian', 'bagging_temperature': 3.8094741402835384}. Best is trial 1464 with value: 0.8990825688073395.
[32m[I 2023-04-20 23:39:22,809][39m Trial 2009 finished with value: 0.8807339449541284 and parameters: {'objective': 'Logloss', 'colsample_bylevel': 0.0978705956134253, 'depth': 10, 'boosting_type': 'Plain', 'bootstrap_type': 'Bayesian', 'bagging_temperature': 3.357511922127594}. Best is trial 1464 with value: 0.8990825688073395.
[32m[I 2023-04-20 23:39:23,726][39m Trial 2010 finished with value: 0.8727272727272727 and parameters: {'objective': 'Logloss', 'colsample_bylevel': 0.09838859193359613, 'depth': 10, 'boosting_type': 'Plain', 'bootstrap_type': 'Bayesian', 'bagging_temperature': 2.8213422044799517}. Best is trial 1464 with value: 0.8990825688073395.
[32m[I 2023-04-20 23:39:24,842][39m Trial 2011 finished with value: 0.8648648648648648 and parameters: {'objective': 'CrossEntropy', 'colsample_bylevel': 0.08559035332684573, 'depth': 10, 'boosting_type': 'Plain', 'bootstrap_type': 'Bayesian', 'bagging_temperature': 5.58262195638399}. Best is trial 1464 with value: 0.8990825688073395.
[32m[I 2023-04-20 23:39:26,123][39m Trial 2012 finished with value: 0.888888888888889 and parameters: {'objective': 'Logloss', 'colsample_bylevel': 0.09796777424779551, 'depth': 11, 'boosting_type': 'Plain', 'bootstrap_type': 'Bayesian', 'bagging_temperature': 6.565186898043044}. Best is trial 1464 with value: 0.8990825688073395.
[32m[I 2023-04-20 23:39:26,911][39m Trial 2013 finished with value: 0.8807339449541284 and parameters: {'objective': 'Logloss', 'colsample_bylevel': 0.09825407163908981, 'depth': 10, 'boosting_type': 'Plain', 'bootstrap_type': 'Bayesian', 'bagging_temperature': 5.866786872378914}. Best is trial 1464 with value: 0.8990825688073395.
[32m[I 2023-04-20 23:39:28,332][39m Trial 2014 finished with value: 0.8807339449541284 and parameters: {'objective': 'Logloss', 'colsample_bylevel': 0.09455069985306973, 'depth': 12, 'boosting_type': 'Plain', 'bootstrap_type': 'Bayesian', 'bagging_temperature': 5.190072940703288}. Best is trial 1464 with value: 0.8990825688073395.
[32m[I 2023-04-20 23:39:29,541][39m Trial 2015 finished with value: 0.8727272727272727 and parameters: {'objective': 'Logloss', 'colsample_bylevel': 0.09564650291583435, 'depth': 8, 'boosting_type': 'Plain', 'bootstrap_type': 'Bayesian', 'bagging_temperature': 6.906246525809024}. Best is trial 1464 with value: 0.8990825688073395.
[32m[I 2023-04-20 23:39:30,824][39m Trial 2016 finished with value: 0.8785046728971961 and parameters: {'objective': 'CrossEntropy', 'colsample_bylevel': 0.09239544053082585, 'depth': 9, 'boosting_type': 'Plain', 'bootstrap_type': 'Bayesian', 'bagging_temperature': 7.648430360837431}. Best is trial 1464 with value: 0.8990825688073395.
[32m[I 2023-04-20 23:39:31,898][39m Trial 2017 finished with value: 0.8545454545454546 and parameters: {'objective': 'Logloss', 'colsample_bylevel': 0.09059718479384503, 'depth': 10, 'boosting_type': 'Plain', 'bootstrap_type': 'Bayesian', 'bagging_temperature': 4.02991428432504}. Best is trial 1464 with value: 0.8990825688073395.
[32m[I 2023-04-20 23:39:33,252][39m Trial 2018 finished with value: 0.8727272727272727 and parameters: {'objective': 'Logloss', 'colsample_bylevel': 0.09522437491037342, 'depth': 11, 'boosting_type': 'Plain', 'bootstrap_type': 'Bayesian', 'bagging_temperature': 6.7292108586842065}. Best is trial 1464 with value: 0.8990825688073395.
[32m[I 2023-04-20 23:39:38,164][39m Trial 2019 finished with value: 0.8421052631578947 and parameters: {'objective': 'Logloss', 'colsample_bylevel': 0.09020893095877647, 'depth': 8, 'boosting_type': 'Ordered', 'bootstrap_type': 'MVS'}. Best is trial 1464 with value: 0.8990825688073395.
[32m[I 2023-04-20 23:39:39,772][39m Trial 2020 finished with value: 0.8648648648648648 and parameters: {'objective': 'Logloss', 'colsample_bylevel': 0.09650950527850659, 'depth': 9, 'boosting_type': 'Plain', 'bootstrap_type': 'Bayesian', 'bagging_temperature': 5.179449173397144}. Best is trial 1464 with value: 0.8990825688073395.
[32m[I 2023-04-20 23:39:40,486][39m Trial 2021 finished with value: 0.8727272727272727 and parameters: {'objective': 'CrossEntropy', 'colsample_bylevel': 0.08547460274012053, 'depth': 10, 'boosting_type': 'Plain', 'bootstrap_type': 'Bayesian', 'bagging_temperature': 5.491840891467596}. Best is trial 1464 with value: 0.8990825688073395.
[32m[I 2023-04-20 23:39:42,043][39m Trial 2022 finished with value: 0.8807339449541284 and parameters: {'objective': 'Logloss', 'colsample_bylevel': 0.09510574715422071, 'depth': 9, 'boosting_type': 'Plain', 'bootstrap_type': 'Bayesian', 'bagging_temperature': 4.654577957775491}. Best is trial 1464 with value: 0.8990825688073395.
[32m[I 2023-04-20 23:39:43,183][39m Trial 2023 finished with value: 0.8703703703703703 and parameters: {'objective': 'Logloss', 'colsample_bylevel': 0.09170637364786571, 'depth': 10, 'boosting_type': 'Plain', 'bootstrap_type': 'Bayesian', 'bagging_temperature': 6.3441533792659515}. Best is trial 1464 with value: 0.8990825688073395.
[32m[I 2023-04-20 23:39:43,981][39m Trial 2024 finished with value: 0.8727272727272727 and parameters: {'objective': 'Logloss', 'colsample_bylevel': 0.09018293433295621, 'depth': 10, 'boosting_type': 'Plain', 'bootstrap_type': 'Bayesian', 'bagging_temperature': 4.462226989226837}. Best is trial 1464 with value: 0.8990825688073395.
[32m[I 2023-04-20 23:39:44,789][39m Trial 2025 finished with value: 0.888888888888889 and parameters: {'objective': 'CrossEntropy', 'colsample_bylevel': 0.08684972241748447, 'depth': 10, 'boosting_type': 'Plain', 'bootstrap_type': 'Bayesian', 'bagging_temperature': 5.1356039167709095}. Best is trial 1464 with value: 0.8990825688073395.
[32m[I 2023-04-20 23:39:46,659][39m Trial 2026 finished with value: 0.8648648648648648 and parameters: {'objective': 'Logloss', 'colsample_bylevel': 0.09668487448489076, 'depth': 8, 'boosting_type': 'Plain', 'bootstrap_type': 'Bayesian', 'bagging_temperature': 5.280616422555318}. Best is trial 1464 with value: 0.8990825688073395.
[32m[I 2023-04-20 23:39:47,576][39m Trial 2027 finished with value: 0.8828828828828829 and parameters: {'objective': 'CrossEntropy', 'colsample_bylevel': 0.09798762650688712, 'depth': 10, 'boosting_type': 'Plain', 'bootstrap_type': 'Bayesian', 'bagging_temperature': 5.4515647650709935}. Best is trial 1464 with value: 0.8990825688073395.
[32m[I 2023-04-20 23:39:48,311][39m Trial 2028 finished with value: 0.8727272727272727 and parameters: {'objective': 'Logloss', 'colsample_bylevel': 0.09509230289387643, 'depth': 8, 'boosting_type': 'Plain', 'bootstrap_type': 'Bayesian', 'bagging_temperature': 3.903601502714555}. Best is trial 1464 with value: 0.8990825688073395.
[32m[I 2023-04-20 23:39:49,008][39m Trial 2029 finished with value: 0.8648648648648648 and parameters: {'objective': 'CrossEntropy', 'colsample_bylevel': 0.08716931888885335, 'depth': 11, 'boosting_type': 'Plain', 'bootstrap_type': 'Bayesian', 'bagging_temperature': 5.648718080129498}. Best is trial 1464 with value: 0.8990825688073395.
[32m[I 2023-04-20 23:39:49,926][39m Trial 2030 finished with value: 0.8807339449541284 and parameters: {'objective': 'Logloss', 'colsample_bylevel': 0.09320838088539295, 'depth': 10, 'boosting_type': 'Plain', 'bootstrap_type': 'Bayesian', 'bagging_temperature': 7.22768838822263}. Best is trial 1464 with value: 0.8990825688073395.
[32m[I 2023-04-20 23:39:51,726][39m Trial 2031 finished with value: 0.8807339449541284 and parameters: {'objective': 'Logloss', 'colsample_bylevel': 0.09495326915038037, 'depth': 9, 'boosting_type': 'Plain', 'bootstrap_type': 'Bayesian', 'bagging_temperature': 4.377945855178204}. Best is trial 1464 with value: 0.8990825688073395.
[32m[I 2023-04-20 23:39:52,857][39m Trial 2032 finished with value: 0.8807339449541284 and parameters: {'objective': 'Logloss', 'colsample_bylevel': 0.09976980622007488, 'depth': 9, 'boosting_type': 'Plain', 'bootstrap_type': 'Bayesian', 'bagging_temperature': 5.8876115044699375}. Best is trial 1464 with value: 0.8990825688073395.
[32m[I 2023-04-20 23:39:53,734][39m Trial 2033 finished with value: 0.8545454545454546 and parameters: {'objective': 'CrossEntropy', 'colsample_bylevel': 0.08944516035068187, 'depth': 11, 'boosting_type': 'Plain', 'bootstrap_type': 'Bayesian', 'bagging_temperature': 5.288038152904626}. Best is trial 1464 with value: 0.8990825688073395.
[32m[I 2023-04-20 23:39:54,413][39m Trial 2034 finished with value: 0.8828828828828829 and parameters: {'objective': 'Logloss', 'colsample_bylevel': 0.09365850538628666, 'depth': 7, 'boosting_type': 'Plain', 'bootstrap_type': 'Bayesian', 'bagging_temperature': 5.510628959949996}. Best is trial 1464 with value: 0.8990825688073395.
[32m[I 2023-04-20 23:39:55,861][39m Trial 2035 finished with value: 0.8828828828828829 and parameters: {'objective': 'Logloss', 'colsample_bylevel': 0.08507005871314015, 'depth': 10, 'boosting_type': 'Plain', 'bootstrap_type': 'Bayesian', 'bagging_temperature': 5.870301013064017}. Best is trial 1464 with value: 0.8990825688073395.
[32m[I 2023-04-20 23:39:57,056][39m Trial 2036 finished with value: 0.8727272727272727 and parameters: {'objective': 'Logloss', 'colsample_bylevel': 0.09530933608438558, 'depth': 10, 'boosting_type': 'Plain', 'bootstrap_type': 'Bayesian', 'bagging_temperature': 6.590065335742808}. Best is trial 1464 with value: 0.8990825688073395.
[32m[I 2023-04-20 23:39:57,866][39m Trial 2037 finished with value: 0.8785046728971961 and parameters: {'objective': 'CrossEntropy', 'colsample_bylevel': 0.09644284756785476, 'depth': 10, 'boosting_type': 'Plain', 'bootstrap_type': 'Bayesian', 'bagging_temperature': 5.312645247408032}. Best is trial 1464 with value: 0.8990825688073395.
[32m[I 2023-04-20 23:39:58,451][39m Trial 2038 finished with value: 0.8468468468468469 and parameters: {'objective': 'CrossEntropy', 'colsample_bylevel': 0.09032392108844634, 'depth': 10, 'boosting_type': 'Plain', 'bootstrap_type': 'Bayesian', 'bagging_temperature': 6.3036885538470155}. Best is trial 1464 with value: 0.8990825688073395.
[32m[I 2023-04-20 23:40:03,910][39m Trial 2039 finished with value: 0.8347826086956522 and parameters: {'objective': 'Logloss', 'colsample_bylevel': 0.09073797638028089, 'depth': 10, 'boosting_type': 'Ordered', 'bootstrap_type': 'Bayesian', 'bagging_temperature': 3.2291030475561215}. Best is trial 1464 with value: 0.8990825688073395.
[32m[I 2023-04-20 23:40:05,260][39m Trial 2040 finished with value: 0.8807339449541284 and parameters: {'objective': 'CrossEntropy', 'colsample_bylevel': 0.09572667674104111, 'depth': 9, 'boosting_type': 'Plain', 'bootstrap_type': 'Bayesian', 'bagging_temperature': 6.554216377040543}. Best is trial 1464 with value: 0.8990825688073395.
[32m[I 2023-04-20 23:40:06,444][39m Trial 2041 finished with value: 0.8807339449541284 and parameters: {'objective': 'CrossEntropy', 'colsample_bylevel': 0.08787895575041468, 'depth': 10, 'boosting_type': 'Plain', 'bootstrap_type': 'Bayesian', 'bagging_temperature': 5.4803172517377075}. Best is trial 1464 with value: 0.8990825688073395.
[32m[I 2023-04-20 23:40:07,229][39m Trial 2042 finished with value: 0.8571428571428572 and parameters: {'objective': 'Logloss', 'colsample_bylevel': 0.09668825580727843, 'depth': 11, 'boosting_type': 'Plain', 'bootstrap_type': 'Bernoulli', 'subsample': 0.8615465267129725}. Best is trial 1464 with value: 0.8990825688073395.
[32m[I 2023-04-20 23:40:08,061][39m Trial 2043 finished with value: 0.875 and parameters: {'objective': 'Logloss', 'colsample_bylevel': 0.09378833876832295, 'depth': 12, 'boosting_type': 'Plain', 'bootstrap_type': 'Bayesian', 'bagging_temperature': 5.016533665114392}. Best is trial 1464 with value: 0.8990825688073395.
[32m[I 2023-04-20 23:40:09,074][39m Trial 2044 finished with value: 0.8727272727272727 and parameters: {'objective': 'Logloss', 'colsample_bylevel': 0.09714766901528923, 'depth': 11, 'boosting_type': 'Plain', 'bootstrap_type': 'Bernoulli', 'subsample': 0.6044095993010777}. Best is trial 1464 with value: 0.8990825688073395.
[32m[I 2023-04-20 23:40:10,137][39m Trial 2045 finished with value: 0.8495575221238938 and parameters: {'objective': 'CrossEntropy', 'colsample_bylevel': 0.09281664696835047, 'depth': 10, 'boosting_type': 'Plain', 'bootstrap_type': 'MVS'}. Best is trial 1464 with value: 0.8990825688073395.
[32m[I 2023-04-20 23:40:11,336][39m Trial 2046 finished with value: 0.8807339449541284 and parameters: {'objective': 'CrossEntropy', 'colsample_bylevel': 0.09426826329191022, 'depth': 11, 'boosting_type': 'Plain', 'bootstrap_type': 'Bayesian', 'bagging_temperature': 4.653361678449479}. Best is trial 1464 with value: 0.8990825688073395.
