[32m[I 2023-04-20 23:34:44,906][39m Trial 1787 finished with value: 0.8807339449541284 and parameters: {'objective': 'Logloss', 'colsample_bylevel': 0.09816940979354209, 'depth': 8, 'boosting_type': 'Plain', 'bootstrap_type': 'Bayesian', 'bagging_temperature': 7.252028642863563}. Best is trial 1464 with value: 0.8990825688073395.
[32m[I 2023-04-20 23:34:46,232][39m Trial 1788 finished with value: 0.8347826086956522 and parameters: {'objective': 'Logloss', 'colsample_bylevel': 0.07445311469582092, 'depth': 8, 'boosting_type': 'Plain', 'bootstrap_type': 'Bayesian', 'bagging_temperature': 3.742252894085934}. Best is trial 1464 with value: 0.8990825688073395.
[32m[I 2023-04-20 23:34:46,903][39m Trial 1789 finished with value: 0.8727272727272727 and parameters: {'objective': 'Logloss', 'colsample_bylevel': 0.0998494813107167, 'depth': 7, 'boosting_type': 'Plain', 'bootstrap_type': 'Bayesian', 'bagging_temperature': 3.9911367339728376}. Best is trial 1464 with value: 0.8990825688073395.
[32m[I 2023-04-20 23:34:48,159][39m Trial 1790 finished with value: 0.8807339449541284 and parameters: {'objective': 'Logloss', 'colsample_bylevel': 0.09977129419345093, 'depth': 8, 'boosting_type': 'Plain', 'bootstrap_type': 'Bayesian', 'bagging_temperature': 4.13184264683579}. Best is trial 1464 with value: 0.8990825688073395.
[32m[I 2023-04-20 23:34:49,015][39m Trial 1791 finished with value: 0.8727272727272727 and parameters: {'objective': 'CrossEntropy', 'colsample_bylevel': 0.09986116915964165, 'depth': 9, 'boosting_type': 'Plain', 'bootstrap_type': 'Bayesian', 'bagging_temperature': 4.645149199746215}. Best is trial 1464 with value: 0.8990825688073395.
[32m[I 2023-04-20 23:34:50,305][39m Trial 1792 finished with value: 0.8623853211009175 and parameters: {'objective': 'Logloss', 'colsample_bylevel': 0.09535539203448996, 'depth': 8, 'boosting_type': 'Plain', 'bootstrap_type': 'Bayesian', 'bagging_temperature': 5.2959093614898}. Best is trial 1464 with value: 0.8990825688073395.
[32m[I 2023-04-20 23:34:51,162][39m Trial 1793 finished with value: 0.8727272727272727 and parameters: {'objective': 'CrossEntropy', 'colsample_bylevel': 0.09445932783521012, 'depth': 9, 'boosting_type': 'Plain', 'bootstrap_type': 'Bayesian', 'bagging_temperature': 4.623003724623736}. Best is trial 1464 with value: 0.8990825688073395.
[32m[I 2023-04-20 23:34:56,543][39m Trial 1794 finished with value: 0.8468468468468469 and parameters: {'objective': 'CrossEntropy', 'colsample_bylevel': 0.09361843496800429, 'depth': 10, 'boosting_type': 'Ordered', 'bootstrap_type': 'Bayesian', 'bagging_temperature': 5.853545123987376}. Best is trial 1464 with value: 0.8990825688073395.
[32m[I 2023-04-20 23:34:57,767][39m Trial 1795 finished with value: 0.8727272727272727 and parameters: {'objective': 'Logloss', 'colsample_bylevel': 0.09693890067206481, 'depth': 9, 'boosting_type': 'Plain', 'bootstrap_type': 'Bayesian', 'bagging_temperature': 4.336757554347689}. Best is trial 1464 with value: 0.8990825688073395.
[32m[I 2023-04-20 23:34:58,469][39m Trial 1796 finished with value: 0.8571428571428572 and parameters: {'objective': 'CrossEntropy', 'colsample_bylevel': 0.09679951824796407, 'depth': 12, 'boosting_type': 'Plain', 'bootstrap_type': 'MVS'}. Best is trial 1464 with value: 0.8990825688073395.
[32m[I 2023-04-20 23:34:59,239][39m Trial 1797 finished with value: 0.8785046728971961 and parameters: {'objective': 'CrossEntropy', 'colsample_bylevel': 0.0945984691567318, 'depth': 7, 'boosting_type': 'Plain', 'bootstrap_type': 'Bayesian', 'bagging_temperature': 5.8031167112932085}. Best is trial 1464 with value: 0.8990825688073395.
[32m[I 2023-04-20 23:35:00,594][39m Trial 1798 finished with value: 0.8727272727272727 and parameters: {'objective': 'Logloss', 'colsample_bylevel': 0.09935775298103629, 'depth': 9, 'boosting_type': 'Plain', 'bootstrap_type': 'Bayesian', 'bagging_temperature': 6.7788451950703}. Best is trial 1464 with value: 0.8990825688073395.
[32m[I 2023-04-20 23:35:01,765][39m Trial 1799 finished with value: 0.8648648648648648 and parameters: {'objective': 'Logloss', 'colsample_bylevel': 0.09722054491325215, 'depth': 8, 'boosting_type': 'Plain', 'bootstrap_type': 'Bayesian', 'bagging_temperature': 4.976909993663983}. Best is trial 1464 with value: 0.8990825688073395.
[32m[I 2023-04-20 23:35:02,757][39m Trial 1800 finished with value: 0.8727272727272727 and parameters: {'objective': 'Logloss', 'colsample_bylevel': 0.09363688911223927, 'depth': 10, 'boosting_type': 'Plain', 'bootstrap_type': 'Bayesian', 'bagging_temperature': 6.183404202981834}. Best is trial 1464 with value: 0.8990825688073395.
[32m[I 2023-04-20 23:35:03,661][39m Trial 1801 finished with value: 0.8807339449541284 and parameters: {'objective': 'Logloss', 'colsample_bylevel': 0.099972638531664, 'depth': 8, 'boosting_type': 'Plain', 'bootstrap_type': 'Bayesian', 'bagging_temperature': 5.6983076727939315}. Best is trial 1464 with value: 0.8990825688073395.
[32m[I 2023-04-20 23:35:04,587][39m Trial 1802 finished with value: 0.8807339449541284 and parameters: {'objective': 'Logloss', 'colsample_bylevel': 0.09224889867593397, 'depth': 11, 'boosting_type': 'Plain', 'bootstrap_type': 'Bayesian', 'bagging_temperature': 6.0007138526027415}. Best is trial 1464 with value: 0.8990825688073395.
[32m[I 2023-04-20 23:35:06,045][39m Trial 1803 finished with value: 0.8727272727272727 and parameters: {'objective': 'Logloss', 'colsample_bylevel': 0.09803167974912469, 'depth': 9, 'boosting_type': 'Plain', 'bootstrap_type': 'Bayesian', 'bagging_temperature': 5.01967425252512}. Best is trial 1464 with value: 0.8990825688073395.
[32m[I 2023-04-20 23:35:06,707][39m Trial 1804 finished with value: 0.8727272727272727 and parameters: {'objective': 'CrossEntropy', 'colsample_bylevel': 0.09797305499639297, 'depth': 10, 'boosting_type': 'Plain', 'bootstrap_type': 'Bayesian', 'bagging_temperature': 7.243123135952172}. Best is trial 1464 with value: 0.8990825688073395.
[32m[I 2023-04-20 23:35:07,750][39m Trial 1805 finished with value: 0.8672566371681416 and parameters: {'objective': 'Logloss', 'colsample_bylevel': 0.04436005347810785, 'depth': 7, 'boosting_type': 'Plain', 'bootstrap_type': 'Bayesian', 'bagging_temperature': 6.270903530715889}. Best is trial 1464 with value: 0.8990825688073395.
[32m[I 2023-04-20 23:35:08,657][39m Trial 1806 finished with value: 0.888888888888889 and parameters: {'objective': 'CrossEntropy', 'colsample_bylevel': 0.09218650741735691, 'depth': 10, 'boosting_type': 'Plain', 'bootstrap_type': 'Bayesian', 'bagging_temperature': 6.867344886761162}. Best is trial 1464 with value: 0.8990825688073395.
[32m[I 2023-04-20 23:35:09,681][39m Trial 1807 finished with value: 0.8807339449541284 and parameters: {'objective': 'CrossEntropy', 'colsample_bylevel': 0.09704816743302094, 'depth': 9, 'boosting_type': 'Plain', 'bootstrap_type': 'Bayesian', 'bagging_temperature': 7.068777886957846}. Best is trial 1464 with value: 0.8990825688073395.
[32m[I 2023-04-20 23:35:10,510][39m Trial 1808 finished with value: 0.8672566371681416 and parameters: {'objective': 'CrossEntropy', 'colsample_bylevel': 0.09554245898711752, 'depth': 10, 'boosting_type': 'Plain', 'bootstrap_type': 'Bayesian', 'bagging_temperature': 6.9015545016909625}. Best is trial 1464 with value: 0.8990825688073395.
[32m[I 2023-04-20 23:35:11,557][39m Trial 1809 finished with value: 0.8807339449541284 and parameters: {'objective': 'CrossEntropy', 'colsample_bylevel': 0.09395216346330203, 'depth': 8, 'boosting_type': 'Plain', 'bootstrap_type': 'Bayesian', 'bagging_temperature': 5.480091371742775}. Best is trial 1464 with value: 0.8990825688073395.
[32m[I 2023-04-20 23:35:12,385][39m Trial 1810 finished with value: 0.8807339449541284 and parameters: {'objective': 'CrossEntropy', 'colsample_bylevel': 0.0980622165456623, 'depth': 12, 'boosting_type': 'Plain', 'bootstrap_type': 'Bayesian', 'bagging_temperature': 5.068796229537414}. Best is trial 1464 with value: 0.8990825688073395.
[32m[I 2023-04-20 23:35:13,269][39m Trial 1811 finished with value: 0.8495575221238938 and parameters: {'objective': 'Logloss', 'colsample_bylevel': 0.09644363267202873, 'depth': 12, 'boosting_type': 'Plain', 'bootstrap_type': 'Bernoulli', 'subsample': 0.9381840489456894}. Best is trial 1464 with value: 0.8990825688073395.
[32m[I 2023-04-20 23:35:14,115][39m Trial 1812 finished with value: 0.888888888888889 and parameters: {'objective': 'CrossEntropy', 'colsample_bylevel': 0.09177191769746186, 'depth': 11, 'boosting_type': 'Plain', 'bootstrap_type': 'Bayesian', 'bagging_temperature': 7.954808941887325}. Best is trial 1464 with value: 0.8990825688073395.
[32m[I 2023-04-20 23:35:19,701][39m Trial 1813 finished with value: 0.8468468468468469 and parameters: {'objective': 'CrossEntropy', 'colsample_bylevel': 0.09480820850273532, 'depth': 9, 'boosting_type': 'Ordered', 'bootstrap_type': 'Bayesian', 'bagging_temperature': 5.10255962894089}. Best is trial 1464 with value: 0.8990825688073395.
[32m[I 2023-04-20 23:35:20,836][39m Trial 1814 finished with value: 0.8703703703703703 and parameters: {'objective': 'CrossEntropy', 'colsample_bylevel': 0.09035319920142396, 'depth': 9, 'boosting_type': 'Plain', 'bootstrap_type': 'Bayesian', 'bagging_temperature': 4.2479769579767375}. Best is trial 1464 with value: 0.8990825688073395.
[32m[I 2023-04-20 23:35:21,733][39m Trial 1815 finished with value: 0.8727272727272727 and parameters: {'objective': 'CrossEntropy', 'colsample_bylevel': 0.09628124698982318, 'depth': 12, 'boosting_type': 'Plain', 'bootstrap_type': 'Bayesian', 'bagging_temperature': 6.523054010262902}. Best is trial 1464 with value: 0.8990825688073395.
[32m[I 2023-04-20 23:35:22,326][39m Trial 1816 finished with value: 0.8807339449541284 and parameters: {'objective': 'CrossEntropy', 'colsample_bylevel': 0.09595173674393302, 'depth': 12, 'boosting_type': 'Plain', 'bootstrap_type': 'Bayesian', 'bagging_temperature': 6.608768114535924}. Best is trial 1464 with value: 0.8990825688073395.
[32m[I 2023-04-20 23:35:23,106][39m Trial 1817 finished with value: 0.8828828828828829 and parameters: {'objective': 'CrossEntropy', 'colsample_bylevel': 0.09812031030668088, 'depth': 11, 'boosting_type': 'Plain', 'bootstrap_type': 'Bayesian', 'bagging_temperature': 6.002494170743624}. Best is trial 1464 with value: 0.8990825688073395.
[32m[I 2023-04-20 23:35:23,843][39m Trial 1818 finished with value: 0.8571428571428572 and parameters: {'objective': 'Logloss', 'colsample_bylevel': 0.09947205002088251, 'depth': 7, 'boosting_type': 'Plain', 'bootstrap_type': 'MVS'}. Best is trial 1464 with value: 0.8990825688073395.
[32m[I 2023-04-20 23:35:24,535][39m Trial 1819 finished with value: 0.8648648648648648 and parameters: {'objective': 'CrossEntropy', 'colsample_bylevel': 0.09399566147587497, 'depth': 12, 'boosting_type': 'Plain', 'bootstrap_type': 'Bayesian', 'bagging_temperature': 4.773106075680838}. Best is trial 1464 with value: 0.8990825688073395.
[32m[I 2023-04-20 23:35:25,542][39m Trial 1820 finished with value: 0.8807339449541284 and parameters: {'objective': 'CrossEntropy', 'colsample_bylevel': 0.08928857210675598, 'depth': 10, 'boosting_type': 'Plain', 'bootstrap_type': 'Bayesian', 'bagging_temperature': 8.02442342388316}. Best is trial 1464 with value: 0.8990825688073395.
[32m[I 2023-04-20 23:35:26,726][39m Trial 1821 finished with value: 0.8623853211009175 and parameters: {'objective': 'CrossEntropy', 'colsample_bylevel': 0.09426096868235304, 'depth': 9, 'boosting_type': 'Plain', 'bootstrap_type': 'Bayesian', 'bagging_temperature': 4.823004358824812}. Best is trial 1464 with value: 0.8990825688073395.
[32m[I 2023-04-20 23:35:27,769][39m Trial 1822 finished with value: 0.8623853211009175 and parameters: {'objective': 'Logloss', 'colsample_bylevel': 0.09589381613906661, 'depth': 10, 'boosting_type': 'Plain', 'bootstrap_type': 'Bayesian', 'bagging_temperature': 3.7134821806647516}. Best is trial 1464 with value: 0.8990825688073395.
[32m[I 2023-04-20 23:35:28,477][39m Trial 1823 finished with value: 0.888888888888889 and parameters: {'objective': 'Logloss', 'colsample_bylevel': 0.09552447368255683, 'depth': 10, 'boosting_type': 'Plain', 'bootstrap_type': 'Bayesian', 'bagging_temperature': 7.041062971285344}. Best is trial 1464 with value: 0.8990825688073395.
[32m[I 2023-04-20 23:35:29,685][39m Trial 1824 finished with value: 0.8648648648648648 and parameters: {'objective': 'CrossEntropy', 'colsample_bylevel': 0.0970877594917944, 'depth': 12, 'boosting_type': 'Plain', 'bootstrap_type': 'Bernoulli', 'subsample': 0.13909399973358294}. Best is trial 1464 with value: 0.8990825688073395.
[32m[I 2023-04-20 23:35:30,539][39m Trial 1825 finished with value: 0.8545454545454546 and parameters: {'objective': 'CrossEntropy', 'colsample_bylevel': 0.09533854926091251, 'depth': 9, 'boosting_type': 'Plain', 'bootstrap_type': 'Bayesian', 'bagging_temperature': 7.152720892888548}. Best is trial 1464 with value: 0.8990825688073395.
[32m[I 2023-04-20 23:35:31,438][39m Trial 1826 finished with value: 0.8828828828828829 and parameters: {'objective': 'Logloss', 'colsample_bylevel': 0.0977914190196048, 'depth': 6, 'boosting_type': 'Plain', 'bootstrap_type': 'Bayesian', 'bagging_temperature': 5.851571161088562}. Best is trial 1464 with value: 0.8990825688073395.
[32m[I 2023-04-20 23:35:32,362][39m Trial 1827 finished with value: 0.8807339449541284 and parameters: {'objective': 'CrossEntropy', 'colsample_bylevel': 0.09410788123758385, 'depth': 10, 'boosting_type': 'Plain', 'bootstrap_type': 'Bayesian', 'bagging_temperature': 5.3129840239540025}. Best is trial 1464 with value: 0.8990825688073395.
[32m[I 2023-04-20 23:35:33,865][39m Trial 1828 finished with value: 0.8623853211009175 and parameters: {'objective': 'Logloss', 'colsample_bylevel': 0.09357384955907687, 'depth': 9, 'boosting_type': 'Plain', 'bootstrap_type': 'Bernoulli', 'subsample': 0.2798076120285177}. Best is trial 1464 with value: 0.8990825688073395.
[32m[I 2023-04-20 23:35:34,792][39m Trial 1829 finished with value: 0.851851851851852 and parameters: {'objective': 'CrossEntropy', 'colsample_bylevel': 0.09728129016625796, 'depth': 9, 'boosting_type': 'Plain', 'bootstrap_type': 'Bayesian', 'bagging_temperature': 4.480785448394717}. Best is trial 1464 with value: 0.8990825688073395.
[32m[I 2023-04-20 23:35:35,834][39m Trial 1830 finished with value: 0.8828828828828829 and parameters: {'objective': 'Logloss', 'colsample_bylevel': 0.09597360274793255, 'depth': 7, 'boosting_type': 'Plain', 'bootstrap_type': 'Bayesian', 'bagging_temperature': 6.719124528867854}. Best is trial 1464 with value: 0.8990825688073395.
[32m[I 2023-04-20 23:35:41,011][39m Trial 1831 finished with value: 0.8495575221238938 and parameters: {'objective': 'Logloss', 'colsample_bylevel': 0.09690751080328645, 'depth': 9, 'boosting_type': 'Ordered', 'bootstrap_type': 'Bayesian', 'bagging_temperature': 6.589054665181462}. Best is trial 1464 with value: 0.8990825688073395.
[32m[I 2023-04-20 23:35:42,041][39m Trial 1832 finished with value: 0.8807339449541284 and parameters: {'objective': 'CrossEntropy', 'colsample_bylevel': 0.08916319744801873, 'depth': 10, 'boosting_type': 'Plain', 'bootstrap_type': 'Bayesian', 'bagging_temperature': 5.477926708521238}. Best is trial 1464 with value: 0.8990825688073395.
[32m[I 2023-04-20 23:35:42,799][39m Trial 1833 finished with value: 0.8421052631578947 and parameters: {'objective': 'CrossEntropy', 'colsample_bylevel': 0.0873979108657707, 'depth': 10, 'boosting_type': 'Plain', 'bootstrap_type': 'Bayesian', 'bagging_temperature': 1.5336414891034917}. Best is trial 1464 with value: 0.8990825688073395.
[32m[I 2023-04-20 23:35:44,139][39m Trial 1834 finished with value: 0.8703703703703703 and parameters: {'objective': 'CrossEntropy', 'colsample_bylevel': 0.09174770132692261, 'depth': 9, 'boosting_type': 'Plain', 'bootstrap_type': 'Bayesian', 'bagging_temperature': 4.289014313315293}. Best is trial 1464 with value: 0.8990825688073395.
[32m[I 2023-04-20 23:35:44,875][39m Trial 1835 finished with value: 0.888888888888889 and parameters: {'objective': 'CrossEntropy', 'colsample_bylevel': 0.0972394711406602, 'depth': 8, 'boosting_type': 'Plain', 'bootstrap_type': 'Bayesian', 'bagging_temperature': 5.38366314562927}. Best is trial 1464 with value: 0.8990825688073395.
[32m[I 2023-04-20 23:35:45,999][39m Trial 1836 finished with value: 0.8807339449541284 and parameters: {'objective': 'CrossEntropy', 'colsample_bylevel': 0.09792902228885922, 'depth': 9, 'boosting_type': 'Plain', 'bootstrap_type': 'Bayesian', 'bagging_temperature': 6.206797868086023}. Best is trial 1464 with value: 0.8990825688073395.
[32m[I 2023-04-20 23:35:47,188][39m Trial 1837 finished with value: 0.8727272727272727 and parameters: {'objective': 'Logloss', 'colsample_bylevel': 0.096404902290331, 'depth': 8, 'boosting_type': 'Plain', 'bootstrap_type': 'Bayesian', 'bagging_temperature': 6.324746176596494}. Best is trial 1464 with value: 0.8990825688073395.
[32m[I 2023-04-20 23:35:48,125][39m Trial 1838 finished with value: 0.8807339449541284 and parameters: {'objective': 'CrossEntropy', 'colsample_bylevel': 0.09024965975923724, 'depth': 10, 'boosting_type': 'Plain', 'bootstrap_type': 'Bayesian', 'bagging_temperature': 5.588568268499023}. Best is trial 1464 with value: 0.8990825688073395.
[32m[I 2023-04-20 23:35:48,818][39m Trial 1839 finished with value: 0.8648648648648648 and parameters: {'objective': 'CrossEntropy', 'colsample_bylevel': 0.0935455456507275, 'depth': 5, 'boosting_type': 'Plain', 'bootstrap_type': 'Bayesian', 'bagging_temperature': 3.314876256538019}. Best is trial 1464 with value: 0.8990825688073395.
[32m[I 2023-04-20 23:35:49,984][39m Trial 1840 finished with value: 0.8495575221238938 and parameters: {'objective': 'CrossEntropy', 'colsample_bylevel': 0.0955534210281605, 'depth': 8, 'boosting_type': 'Plain', 'bootstrap_type': 'MVS'}. Best is trial 1464 with value: 0.8990825688073395.
[32m[I 2023-04-20 23:35:50,902][39m Trial 1841 finished with value: 0.8807339449541284 and parameters: {'objective': 'Logloss', 'colsample_bylevel': 0.09990533322887866, 'depth': 8, 'boosting_type': 'Plain', 'bootstrap_type': 'Bayesian', 'bagging_temperature': 5.547069880062468}. Best is trial 1464 with value: 0.8990825688073395.
[32m[I 2023-04-20 23:35:51,881][39m Trial 1842 finished with value: 0.8672566371681416 and parameters: {'objective': 'Logloss', 'colsample_bylevel': 0.0950979393446734, 'depth': 10, 'boosting_type': 'Plain', 'bootstrap_type': 'Bayesian', 'bagging_temperature': 4.219546530866643}. Best is trial 1464 with value: 0.8990825688073395.
[32m[I 2023-04-20 23:35:53,342][39m Trial 1843 finished with value: 0.8727272727272727 and parameters: {'objective': 'Logloss', 'colsample_bylevel': 0.08628304804247011, 'depth': 10, 'boosting_type': 'Plain', 'bootstrap_type': 'Bayesian', 'bagging_temperature': 3.8412269159758163}. Best is trial 1464 with value: 0.8990825688073395.
[32m[I 2023-04-20 23:35:54,543][39m Trial 1844 finished with value: 0.8727272727272727 and parameters: {'objective': 'Logloss', 'colsample_bylevel': 0.0971855384285013, 'depth': 8, 'boosting_type': 'Plain', 'bootstrap_type': 'Bayesian', 'bagging_temperature': 6.0070634825042335}. Best is trial 1464 with value: 0.8990825688073395.
[32m[I 2023-04-20 23:35:55,138][39m Trial 1845 finished with value: 0.8571428571428572 and parameters: {'objective': 'CrossEntropy', 'colsample_bylevel': 0.09260026686648794, 'depth': 10, 'boosting_type': 'Plain', 'bootstrap_type': 'Bayesian', 'bagging_temperature': 5.712523890079006}. Best is trial 1464 with value: 0.8990825688073395.
[32m[I 2023-04-20 23:35:55,967][39m Trial 1846 finished with value: 0.8347826086956522 and parameters: {'objective': 'CrossEntropy', 'colsample_bylevel': 0.052624555633328136, 'depth': 9, 'boosting_type': 'Plain', 'bootstrap_type': 'Bayesian', 'bagging_temperature': 1.1647188830101856}. Best is trial 1464 with value: 0.8990825688073395.
[32m[I 2023-04-20 23:35:57,445][39m Trial 1847 finished with value: 0.8392857142857144 and parameters: {'objective': 'CrossEntropy', 'colsample_bylevel': 0.07688871326432102, 'depth': 9, 'boosting_type': 'Plain', 'bootstrap_type': 'Bayesian', 'bagging_temperature': 4.790058714165231}. Best is trial 1464 with value: 0.8990825688073395.
[32m[I 2023-04-20 23:35:58,408][39m Trial 1848 finished with value: 0.8727272727272727 and parameters: {'objective': 'Logloss', 'colsample_bylevel': 0.09145930251113557, 'depth': 10, 'boosting_type': 'Plain', 'bootstrap_type': 'Bayesian', 'bagging_temperature': 5.34002243416471}. Best is trial 1464 with value: 0.8990825688073395.
[32m[I 2023-04-20 23:36:03,487][39m Trial 1849 finished with value: 0.8521739130434783 and parameters: {'objective': 'Logloss', 'colsample_bylevel': 0.06586497228335929, 'depth': 7, 'boosting_type': 'Ordered', 'bootstrap_type': 'Bayesian', 'bagging_temperature': 6.1734933769572296}. Best is trial 1464 with value: 0.8990825688073395.
[32m[I 2023-04-20 23:36:04,783][39m Trial 1850 finished with value: 0.8785046728971961 and parameters: {'objective': 'CrossEntropy', 'colsample_bylevel': 0.09483574952955191, 'depth': 9, 'boosting_type': 'Plain', 'bootstrap_type': 'Bayesian', 'bagging_temperature': 6.263853271409399}. Best is trial 1464 with value: 0.8990825688073395.
[32m[I 2023-04-20 23:36:05,970][39m Trial 1851 finished with value: 0.888888888888889 and parameters: {'objective': 'CrossEntropy', 'colsample_bylevel': 0.0923051698843512, 'depth': 10, 'boosting_type': 'Plain', 'bootstrap_type': 'Bayesian', 'bagging_temperature': 4.025589589676519}. Best is trial 1464 with value: 0.8990825688073395.
