[32m[I 2023-04-21 00:19:48,912][39m Trial 3821 finished with value: 0.8468468468468469 and parameters: {'objective': 'CrossEntropy', 'colsample_bylevel': 0.08681800637392825, 'depth': 9, 'boosting_type': 'Plain', 'bootstrap_type': 'Bayesian', 'bagging_temperature': 5.181008749686768}. Best is trial 1464 with value: 0.8990825688073395.
[32m[I 2023-04-21 00:19:50,145][39m Trial 3822 finished with value: 0.8727272727272727 and parameters: {'objective': 'Logloss', 'colsample_bylevel': 0.09516443601003163, 'depth': 8, 'boosting_type': 'Plain', 'bootstrap_type': 'Bayesian', 'bagging_temperature': 5.700855540443713}. Best is trial 1464 with value: 0.8990825688073395.
[32m[I 2023-04-21 00:19:51,288][39m Trial 3823 finished with value: 0.8807339449541284 and parameters: {'objective': 'Logloss', 'colsample_bylevel': 0.0959063447209755, 'depth': 9, 'boosting_type': 'Plain', 'bootstrap_type': 'Bayesian', 'bagging_temperature': 5.798600828435498}. Best is trial 1464 with value: 0.8990825688073395.
[32m[I 2023-04-21 00:19:52,011][39m Trial 3824 finished with value: 0.8785046728971961 and parameters: {'objective': 'CrossEntropy', 'colsample_bylevel': 0.09127468692160984, 'depth': 10, 'boosting_type': 'Plain', 'bootstrap_type': 'Bayesian', 'bagging_temperature': 6.35984233611872}. Best is trial 1464 with value: 0.8990825688073395.
[32m[I 2023-04-21 00:19:53,306][39m Trial 3825 finished with value: 0.8807339449541284 and parameters: {'objective': 'CrossEntropy', 'colsample_bylevel': 0.09135056794809637, 'depth': 9, 'boosting_type': 'Plain', 'bootstrap_type': 'Bayesian', 'bagging_temperature': 4.94665882433831}. Best is trial 1464 with value: 0.8990825688073395.
[32m[I 2023-04-21 00:19:58,641][39m Trial 3826 finished with value: 0.8347826086956522 and parameters: {'objective': 'Logloss', 'colsample_bylevel': 0.09843881924014952, 'depth': 8, 'boosting_type': 'Ordered', 'bootstrap_type': 'Bayesian', 'bagging_temperature': 4.542638929581998}. Best is trial 1464 with value: 0.8990825688073395.
[32m[I 2023-04-21 00:19:59,835][39m Trial 3827 finished with value: 0.8623853211009175 and parameters: {'objective': 'Logloss', 'colsample_bylevel': 0.0943618601436172, 'depth': 7, 'boosting_type': 'Plain', 'bootstrap_type': 'Bayesian', 'bagging_temperature': 6.213307390595739}. Best is trial 1464 with value: 0.8990825688073395.
[32m[I 2023-04-21 00:20:01,034][39m Trial 3828 finished with value: 0.888888888888889 and parameters: {'objective': 'CrossEntropy', 'colsample_bylevel': 0.09060313558633798, 'depth': 9, 'boosting_type': 'Plain', 'bootstrap_type': 'Bayesian', 'bagging_temperature': 4.008522734083374}. Best is trial 1464 with value: 0.8990825688073395.
[32m[I 2023-04-21 00:20:02,013][39m Trial 3829 finished with value: 0.888888888888889 and parameters: {'objective': 'CrossEntropy', 'colsample_bylevel': 0.09848330356150946, 'depth': 8, 'boosting_type': 'Plain', 'bootstrap_type': 'Bayesian', 'bagging_temperature': 5.595696729444795}. Best is trial 1464 with value: 0.8990825688073395.
[32m[I 2023-04-21 00:20:02,702][39m Trial 3830 finished with value: 0.8807339449541284 and parameters: {'objective': 'CrossEntropy', 'colsample_bylevel': 0.09254440708156869, 'depth': 10, 'boosting_type': 'Plain', 'bootstrap_type': 'Bayesian', 'bagging_temperature': 5.393002851866316}. Best is trial 1464 with value: 0.8990825688073395.
[32m[I 2023-04-21 00:20:04,080][39m Trial 3831 finished with value: 0.8807339449541284 and parameters: {'objective': 'Logloss', 'colsample_bylevel': 0.0958623447545707, 'depth': 9, 'boosting_type': 'Plain', 'bootstrap_type': 'Bayesian', 'bagging_temperature': 6.587579056388417}. Best is trial 1464 with value: 0.8990825688073395.
[32m[I 2023-04-21 00:20:05,811][39m Trial 3832 finished with value: 0.8807339449541284 and parameters: {'objective': 'Logloss', 'colsample_bylevel': 0.09615781211825941, 'depth': 9, 'boosting_type': 'Plain', 'bootstrap_type': 'Bayesian', 'bagging_temperature': 6.399715295593519}. Best is trial 1464 with value: 0.8990825688073395.
[32m[I 2023-04-21 00:20:06,639][39m Trial 3833 finished with value: 0.8727272727272727 and parameters: {'objective': 'Logloss', 'colsample_bylevel': 0.08830495620661757, 'depth': 9, 'boosting_type': 'Plain', 'bootstrap_type': 'Bayesian', 'bagging_temperature': 5.558160802966535}. Best is trial 1464 with value: 0.8990825688073395.
[32m[I 2023-04-21 00:20:07,589][39m Trial 3834 finished with value: 0.8727272727272727 and parameters: {'objective': 'Logloss', 'colsample_bylevel': 0.09699013064147649, 'depth': 9, 'boosting_type': 'Plain', 'bootstrap_type': 'Bayesian', 'bagging_temperature': 6.215011018727226}. Best is trial 1464 with value: 0.8990825688073395.
[32m[I 2023-04-21 00:20:08,560][39m Trial 3835 finished with value: 0.8727272727272727 and parameters: {'objective': 'Logloss', 'colsample_bylevel': 0.09441038659037652, 'depth': 9, 'boosting_type': 'Plain', 'bootstrap_type': 'Bayesian', 'bagging_temperature': 7.610487150649728}. Best is trial 1464 with value: 0.8990825688073395.
[32m[I 2023-04-21 00:20:09,693][39m Trial 3836 finished with value: 0.8807339449541284 and parameters: {'objective': 'CrossEntropy', 'colsample_bylevel': 0.09892923453101056, 'depth': 7, 'boosting_type': 'Plain', 'bootstrap_type': 'Bayesian', 'bagging_temperature': 5.822181773483053}. Best is trial 1464 with value: 0.8990825688073395.
[32m[I 2023-04-21 00:20:11,005][39m Trial 3837 finished with value: 0.8828828828828829 and parameters: {'objective': 'Logloss', 'colsample_bylevel': 0.09831949436981836, 'depth': 7, 'boosting_type': 'Plain', 'bootstrap_type': 'Bayesian', 'bagging_temperature': 6.3507209933119615}. Best is trial 1464 with value: 0.8990825688073395.
[32m[I 2023-04-21 00:20:12,905][39m Trial 3838 finished with value: 0.8727272727272727 and parameters: {'objective': 'Logloss', 'colsample_bylevel': 0.09080051337590206, 'depth': 9, 'boosting_type': 'Plain', 'bootstrap_type': 'Bayesian', 'bagging_temperature': 4.873691456682363}. Best is trial 1464 with value: 0.8990825688073395.
[32m[I 2023-04-21 00:20:13,805][39m Trial 3839 finished with value: 0.875 and parameters: {'objective': 'CrossEntropy', 'colsample_bylevel': 0.09161794638127481, 'depth': 9, 'boosting_type': 'Plain', 'bootstrap_type': 'Bayesian', 'bagging_temperature': 7.590515312178259}. Best is trial 1464 with value: 0.8990825688073395.
[32m[I 2023-04-21 00:20:14,766][39m Trial 3840 finished with value: 0.8672566371681416 and parameters: {'objective': 'Logloss', 'colsample_bylevel': 0.09839685701379747, 'depth': 9, 'boosting_type': 'Plain', 'bootstrap_type': 'Bayesian', 'bagging_temperature': 4.375842491967654}. Best is trial 1464 with value: 0.8990825688073395.
[32m[I 2023-04-21 00:20:16,376][39m Trial 3841 finished with value: 0.8571428571428572 and parameters: {'objective': 'Logloss', 'colsample_bylevel': 0.08841387382918703, 'depth': 9, 'boosting_type': 'Plain', 'bootstrap_type': 'Bernoulli', 'subsample': 0.4392728845186143}. Best is trial 1464 with value: 0.8990825688073395.
[32m[I 2023-04-21 00:20:17,101][39m Trial 3842 finished with value: 0.8727272727272727 and parameters: {'objective': 'Logloss', 'colsample_bylevel': 0.09607106838154005, 'depth': 7, 'boosting_type': 'Plain', 'bootstrap_type': 'Bayesian', 'bagging_temperature': 5.527065104353654}. Best is trial 1464 with value: 0.8990825688073395.
[32m[I 2023-04-21 00:20:18,378][39m Trial 3843 finished with value: 0.8648648648648648 and parameters: {'objective': 'CrossEntropy', 'colsample_bylevel': 0.09887458414622662, 'depth': 7, 'boosting_type': 'Plain', 'bootstrap_type': 'Bayesian', 'bagging_temperature': 4.177981599708953}. Best is trial 1464 with value: 0.8990825688073395.
[32m[I 2023-04-21 00:20:19,453][39m Trial 3844 finished with value: 0.8727272727272727 and parameters: {'objective': 'Logloss', 'colsample_bylevel': 0.09979089581047383, 'depth': 7, 'boosting_type': 'Plain', 'bootstrap_type': 'Bayesian', 'bagging_temperature': 3.982872604888879}. Best is trial 1464 with value: 0.8990825688073395.
[32m[I 2023-04-21 00:20:20,558][39m Trial 3845 finished with value: 0.8828828828828829 and parameters: {'objective': 'Logloss', 'colsample_bylevel': 0.09314286536553995, 'depth': 7, 'boosting_type': 'Plain', 'bootstrap_type': 'Bayesian', 'bagging_temperature': 5.864236167881946}. Best is trial 1464 with value: 0.8990825688073395.
[32m[I 2023-04-21 00:20:25,794][39m Trial 3846 finished with value: 0.8571428571428572 and parameters: {'objective': 'Logloss', 'colsample_bylevel': 0.09517222304052825, 'depth': 9, 'boosting_type': 'Ordered', 'bootstrap_type': 'MVS'}. Best is trial 1464 with value: 0.8990825688073395.
[32m[I 2023-04-21 00:20:27,575][39m Trial 3847 finished with value: 0.8727272727272727 and parameters: {'objective': 'Logloss', 'colsample_bylevel': 0.09391408844594011, 'depth': 9, 'boosting_type': 'Plain', 'bootstrap_type': 'Bayesian', 'bagging_temperature': 6.011780294237382}. Best is trial 1464 with value: 0.8990825688073395.
[32m[I 2023-04-21 00:20:28,622][39m Trial 3848 finished with value: 0.8807339449541284 and parameters: {'objective': 'CrossEntropy', 'colsample_bylevel': 0.09112945979465832, 'depth': 9, 'boosting_type': 'Plain', 'bootstrap_type': 'Bayesian', 'bagging_temperature': 5.67930457246496}. Best is trial 1464 with value: 0.8990825688073395.
[32m[I 2023-04-21 00:20:29,330][39m Trial 3849 finished with value: 0.875 and parameters: {'objective': 'CrossEntropy', 'colsample_bylevel': 0.091107643578529, 'depth': 7, 'boosting_type': 'Plain', 'bootstrap_type': 'Bayesian', 'bagging_temperature': 5.227969142654964}. Best is trial 1464 with value: 0.8990825688073395.
[32m[I 2023-04-21 00:20:30,242][39m Trial 3850 finished with value: 0.8807339449541284 and parameters: {'objective': 'CrossEntropy', 'colsample_bylevel': 0.09323334806053901, 'depth': 10, 'boosting_type': 'Plain', 'bootstrap_type': 'Bayesian', 'bagging_temperature': 5.86387091791119}. Best is trial 1464 with value: 0.8990825688073395.
[32m[I 2023-04-21 00:20:31,088][39m Trial 3851 finished with value: 0.8828828828828829 and parameters: {'objective': 'CrossEntropy', 'colsample_bylevel': 0.09560659834945079, 'depth': 9, 'boosting_type': 'Plain', 'bootstrap_type': 'Bayesian', 'bagging_temperature': 5.983442889142569}. Best is trial 1464 with value: 0.8990825688073395.
[32m[I 2023-04-21 00:20:32,282][39m Trial 3852 finished with value: 0.8623853211009175 and parameters: {'objective': 'CrossEntropy', 'colsample_bylevel': 0.09724810458801514, 'depth': 10, 'boosting_type': 'Plain', 'bootstrap_type': 'Bayesian', 'bagging_temperature': 6.189239313366516}. Best is trial 1464 with value: 0.8990825688073395.
[32m[I 2023-04-21 00:20:33,300][39m Trial 3853 finished with value: 0.8727272727272727 and parameters: {'objective': 'Logloss', 'colsample_bylevel': 0.09761429601765553, 'depth': 7, 'boosting_type': 'Plain', 'bootstrap_type': 'Bayesian', 'bagging_temperature': 6.033301274807374}. Best is trial 1464 with value: 0.8990825688073395.
[32m[I 2023-04-21 00:20:34,586][39m Trial 3854 finished with value: 0.875 and parameters: {'objective': 'Logloss', 'colsample_bylevel': 0.09068929433373843, 'depth': 9, 'boosting_type': 'Plain', 'bootstrap_type': 'Bayesian', 'bagging_temperature': 5.738637909570224}. Best is trial 1464 with value: 0.8990825688073395.
[32m[I 2023-04-21 00:20:35,365][39m Trial 3855 finished with value: 0.8545454545454546 and parameters: {'objective': 'CrossEntropy', 'colsample_bylevel': 0.093861227972629, 'depth': 4, 'boosting_type': 'Plain', 'bootstrap_type': 'Bayesian', 'bagging_temperature': 5.968600506052914}. Best is trial 1464 with value: 0.8990825688073395.
[32m[I 2023-04-21 00:20:36,531][39m Trial 3856 finished with value: 0.8807339449541284 and parameters: {'objective': 'Logloss', 'colsample_bylevel': 0.09343052154823253, 'depth': 7, 'boosting_type': 'Plain', 'bootstrap_type': 'Bayesian', 'bagging_temperature': 5.737532111660578}. Best is trial 1464 with value: 0.8990825688073395.
[32m[I 2023-04-21 00:20:37,863][39m Trial 3857 finished with value: 0.875 and parameters: {'objective': 'CrossEntropy', 'colsample_bylevel': 0.09669906016764598, 'depth': 9, 'boosting_type': 'Plain', 'bootstrap_type': 'Bayesian', 'bagging_temperature': 5.726349089224346}. Best is trial 1464 with value: 0.8990825688073395.
[32m[I 2023-04-21 00:20:39,010][39m Trial 3858 finished with value: 0.8807339449541284 and parameters: {'objective': 'CrossEntropy', 'colsample_bylevel': 0.0949843744577318, 'depth': 9, 'boosting_type': 'Plain', 'bootstrap_type': 'Bayesian', 'bagging_temperature': 6.615395335704762}. Best is trial 1464 with value: 0.8990825688073395.
[32m[I 2023-04-21 00:20:39,772][39m Trial 3859 finished with value: 0.8521739130434783 and parameters: {'objective': 'Logloss', 'colsample_bylevel': 0.055034439665420834, 'depth': 9, 'boosting_type': 'Plain', 'bootstrap_type': 'Bayesian', 'bagging_temperature': 5.716329738524532}. Best is trial 1464 with value: 0.8990825688073395.
[32m[I 2023-04-21 00:20:40,557][39m Trial 3860 finished with value: 0.8727272727272727 and parameters: {'objective': 'Logloss', 'colsample_bylevel': 0.09298469834290088, 'depth': 7, 'boosting_type': 'Plain', 'bootstrap_type': 'Bayesian', 'bagging_temperature': 6.238932558089585}. Best is trial 1464 with value: 0.8990825688073395.
[32m[I 2023-04-21 00:20:41,631][39m Trial 3861 finished with value: 0.888888888888889 and parameters: {'objective': 'Logloss', 'colsample_bylevel': 0.09635963182544514, 'depth': 7, 'boosting_type': 'Plain', 'bootstrap_type': 'Bayesian', 'bagging_temperature': 5.496698165548062}. Best is trial 1464 with value: 0.8990825688073395.
[32m[I 2023-04-21 00:20:42,944][39m Trial 3862 finished with value: 0.8571428571428572 and parameters: {'objective': 'Logloss', 'colsample_bylevel': 0.09716774423212199, 'depth': 7, 'boosting_type': 'Plain', 'bootstrap_type': 'Bernoulli', 'subsample': 0.3102988298568564}. Best is trial 1464 with value: 0.8990825688073395.
[32m[I 2023-04-21 00:20:44,643][39m Trial 3863 finished with value: 0.8727272727272727 and parameters: {'objective': 'Logloss', 'colsample_bylevel': 0.09387714840918018, 'depth': 9, 'boosting_type': 'Plain', 'bootstrap_type': 'Bayesian', 'bagging_temperature': 5.9289614387706076}. Best is trial 1464 with value: 0.8990825688073395.
[32m[I 2023-04-21 00:20:49,219][39m Trial 3864 finished with value: 0.8376068376068375 and parameters: {'objective': 'Logloss', 'colsample_bylevel': 0.06559252371971394, 'depth': 8, 'boosting_type': 'Ordered', 'bootstrap_type': 'Bayesian', 'bagging_temperature': 3.7237921341727676}. Best is trial 1464 with value: 0.8990825688073395.
[32m[I 2023-04-21 00:20:50,104][39m Trial 3865 finished with value: 0.8468468468468469 and parameters: {'objective': 'CrossEntropy', 'colsample_bylevel': 0.08866559947304455, 'depth': 10, 'boosting_type': 'Plain', 'bootstrap_type': 'MVS'}. Best is trial 1464 with value: 0.8990825688073395.
[32m[I 2023-04-21 00:20:51,464][39m Trial 3866 finished with value: 0.888888888888889 and parameters: {'objective': 'CrossEntropy', 'colsample_bylevel': 0.09983377067159897, 'depth': 8, 'boosting_type': 'Plain', 'bootstrap_type': 'Bayesian', 'bagging_temperature': 5.576741771045506}. Best is trial 1464 with value: 0.8990825688073395.
[32m[I 2023-04-21 00:20:52,483][39m Trial 3867 finished with value: 0.8648648648648648 and parameters: {'objective': 'Logloss', 'colsample_bylevel': 0.09256779090414323, 'depth': 7, 'boosting_type': 'Plain', 'bootstrap_type': 'Bayesian', 'bagging_temperature': 5.427072763203328}. Best is trial 1464 with value: 0.8990825688073395.
[32m[I 2023-04-21 00:20:53,487][39m Trial 3868 finished with value: 0.8596491228070176 and parameters: {'objective': 'CrossEntropy', 'colsample_bylevel': 0.04278618120639556, 'depth': 10, 'boosting_type': 'Plain', 'bootstrap_type': 'Bayesian', 'bagging_temperature': 5.575877414401824}. Best is trial 1464 with value: 0.8990825688073395.
[32m[I 2023-04-21 00:20:54,233][39m Trial 3869 finished with value: 0.8727272727272727 and parameters: {'objective': 'CrossEntropy', 'colsample_bylevel': 0.09546508398635453, 'depth': 10, 'boosting_type': 'Plain', 'bootstrap_type': 'Bayesian', 'bagging_temperature': 6.184202097630111}. Best is trial 1464 with value: 0.8990825688073395.
[32m[I 2023-04-21 00:20:54,991][39m Trial 3870 finished with value: 0.888888888888889 and parameters: {'objective': 'CrossEntropy', 'colsample_bylevel': 0.09693436044531842, 'depth': 6, 'boosting_type': 'Plain', 'bootstrap_type': 'Bayesian', 'bagging_temperature': 6.994539508292647}. Best is trial 1464 with value: 0.8990825688073395.
[32m[I 2023-04-21 00:20:56,508][39m Trial 3871 finished with value: 0.8623853211009175 and parameters: {'objective': 'CrossEntropy', 'colsample_bylevel': 0.09976084600759483, 'depth': 11, 'boosting_type': 'Plain', 'bootstrap_type': 'Bayesian', 'bagging_temperature': 5.604406314247472}. Best is trial 1464 with value: 0.8990825688073395.
[32m[I 2023-04-21 00:20:57,204][39m Trial 3872 finished with value: 0.8421052631578947 and parameters: {'objective': 'CrossEntropy', 'colsample_bylevel': 0.06750173069629237, 'depth': 10, 'boosting_type': 'Plain', 'bootstrap_type': 'Bayesian', 'bagging_temperature': 5.502377927622589}. Best is trial 1464 with value: 0.8990825688073395.
[32m[I 2023-04-21 00:20:57,841][39m Trial 3873 finished with value: 0.888888888888889 and parameters: {'objective': 'CrossEntropy', 'colsample_bylevel': 0.0902477936970863, 'depth': 6, 'boosting_type': 'Plain', 'bootstrap_type': 'Bayesian', 'bagging_temperature': 5.39137358937202}. Best is trial 1464 with value: 0.8990825688073395.
[32m[I 2023-04-21 00:20:59,392][39m Trial 3874 finished with value: 0.8727272727272727 and parameters: {'objective': 'Logloss', 'colsample_bylevel': 0.09994064026635587, 'depth': 9, 'boosting_type': 'Plain', 'bootstrap_type': 'Bayesian', 'bagging_temperature': 6.0188262673878015}. Best is trial 1464 with value: 0.8990825688073395.
[32m[I 2023-04-21 00:21:00,924][39m Trial 3875 finished with value: 0.8727272727272727 and parameters: {'objective': 'Logloss', 'colsample_bylevel': 0.09439695072671615, 'depth': 9, 'boosting_type': 'Plain', 'bootstrap_type': 'Bayesian', 'bagging_temperature': 6.094322475224964}. Best is trial 1464 with value: 0.8990825688073395.
[32m[I 2023-04-21 00:21:01,784][39m Trial 3876 finished with value: 0.8727272727272727 and parameters: {'objective': 'CrossEntropy', 'colsample_bylevel': 0.09857850801099441, 'depth': 9, 'boosting_type': 'Plain', 'bootstrap_type': 'Bayesian', 'bagging_temperature': 4.804664592220648}. Best is trial 1464 with value: 0.8990825688073395.
[32m[I 2023-04-21 00:21:02,483][39m Trial 3877 finished with value: 0.890909090909091 and parameters: {'objective': 'Logloss', 'colsample_bylevel': 0.0934446678979412, 'depth': 7, 'boosting_type': 'Plain', 'bootstrap_type': 'Bayesian', 'bagging_temperature': 5.410723457227245}. Best is trial 1464 with value: 0.8990825688073395.
[32m[I 2023-04-21 00:21:03,883][39m Trial 3878 finished with value: 0.8648648648648648 and parameters: {'objective': 'Logloss', 'colsample_bylevel': 0.09368751727495854, 'depth': 9, 'boosting_type': 'Plain', 'bootstrap_type': 'Bayesian', 'bagging_temperature': 6.575046352525363}. Best is trial 1464 with value: 0.8990825688073395.
[32m[I 2023-04-21 00:21:05,092][39m Trial 3879 finished with value: 0.8785046728971961 and parameters: {'objective': 'CrossEntropy', 'colsample_bylevel': 0.08987417554207007, 'depth': 11, 'boosting_type': 'Plain', 'bootstrap_type': 'Bayesian', 'bagging_temperature': 5.801052197805213}. Best is trial 1464 with value: 0.8990825688073395.
[32m[I 2023-04-21 00:21:06,393][39m Trial 3880 finished with value: 0.8727272727272727 and parameters: {'objective': 'CrossEntropy', 'colsample_bylevel': 0.09630933702180675, 'depth': 9, 'boosting_type': 'Plain', 'bootstrap_type': 'Bayesian', 'bagging_temperature': 5.992803603005785}. Best is trial 1464 with value: 0.8990825688073395.
[32m[I 2023-04-21 00:21:07,927][39m Trial 3881 finished with value: 0.8727272727272727 and parameters: {'objective': 'Logloss', 'colsample_bylevel': 0.09191309523347004, 'depth': 9, 'boosting_type': 'Plain', 'bootstrap_type': 'Bayesian', 'bagging_temperature': 3.8446233499290816}. Best is trial 1464 with value: 0.8990825688073395.
[32m[I 2023-04-21 00:21:12,817][39m Trial 3882 finished with value: 0.8571428571428572 and parameters: {'objective': 'CrossEntropy', 'colsample_bylevel': 0.09617076860619353, 'depth': 9, 'boosting_type': 'Ordered', 'bootstrap_type': 'Bernoulli', 'subsample': 0.16745566284593594}. Best is trial 1464 with value: 0.8990825688073395.
[32m[I 2023-04-21 00:21:13,923][39m Trial 3883 finished with value: 0.8807339449541284 and parameters: {'objective': 'Logloss', 'colsample_bylevel': 0.09679085448806674, 'depth': 10, 'boosting_type': 'Plain', 'bootstrap_type': 'Bayesian', 'bagging_temperature': 5.420250461911753}. Best is trial 1464 with value: 0.8990825688073395.
[32m[I 2023-04-21 00:21:14,884][39m Trial 3884 finished with value: 0.8807339449541284 and parameters: {'objective': 'Logloss', 'colsample_bylevel': 0.09616929604201208, 'depth': 10, 'boosting_type': 'Plain', 'bootstrap_type': 'Bayesian', 'bagging_temperature': 7.167533058542478}. Best is trial 1464 with value: 0.8990825688073395.
[32m[I 2023-04-21 00:21:16,180][39m Trial 3885 finished with value: 0.8623853211009175 and parameters: {'objective': 'Logloss', 'colsample_bylevel': 0.09981229351738577, 'depth': 7, 'boosting_type': 'Plain', 'bootstrap_type': 'Bayesian', 'bagging_temperature': 4.9287069945525275}. Best is trial 1464 with value: 0.8990825688073395.
[32m[I 2023-04-21 00:21:16,860][39m Trial 3886 finished with value: 0.8571428571428572 and parameters: {'objective': 'CrossEntropy', 'colsample_bylevel': 0.09313469355864434, 'depth': 9, 'boosting_type': 'Plain', 'bootstrap_type': 'MVS'}. Best is trial 1464 with value: 0.8990825688073395.
