[32m[I 2023-04-21 00:58:16,985][39m Trial 5526 finished with value: 0.8672566371681416 and parameters: {'objective': 'Logloss', 'colsample_bylevel': 0.0937515026796236, 'depth': 9, 'boosting_type': 'Plain', 'bootstrap_type': 'MVS'}. Best is trial 1464 with value: 0.8990825688073395.
[32m[I 2023-04-21 00:58:18,554][39m Trial 5527 finished with value: 0.8703703703703703 and parameters: {'objective': 'CrossEntropy', 'colsample_bylevel': 0.09868475115679858, 'depth': 8, 'boosting_type': 'Plain', 'bootstrap_type': 'Bayesian', 'bagging_temperature': 5.807260560637097}. Best is trial 1464 with value: 0.8990825688073395.
[32m[I 2023-04-21 00:58:19,845][39m Trial 5528 finished with value: 0.8275862068965517 and parameters: {'objective': 'CrossEntropy', 'colsample_bylevel': 0.09830315450196667, 'depth': 3, 'boosting_type': 'Plain', 'bootstrap_type': 'Bayesian', 'bagging_temperature': 5.740895459085258}. Best is trial 1464 with value: 0.8990825688073395.
[32m[I 2023-04-21 00:58:20,783][39m Trial 5529 finished with value: 0.8727272727272727 and parameters: {'objective': 'Logloss', 'colsample_bylevel': 0.09789969789545035, 'depth': 8, 'boosting_type': 'Plain', 'bootstrap_type': 'Bayesian', 'bagging_temperature': 4.188920502300888}. Best is trial 1464 with value: 0.8990825688073395.
[32m[I 2023-04-21 00:58:21,557][39m Trial 5530 finished with value: 0.8807339449541284 and parameters: {'objective': 'Logloss', 'colsample_bylevel': 0.09736123739482337, 'depth': 10, 'boosting_type': 'Plain', 'bootstrap_type': 'Bayesian', 'bagging_temperature': 3.599148509848793}. Best is trial 1464 with value: 0.8990825688073395.
[32m[I 2023-04-21 00:58:22,607][39m Trial 5531 finished with value: 0.8807339449541284 and parameters: {'objective': 'CrossEntropy', 'colsample_bylevel': 0.08581904895767979, 'depth': 12, 'boosting_type': 'Plain', 'bootstrap_type': 'Bayesian', 'bagging_temperature': 4.922413372762746}. Best is trial 1464 with value: 0.8990825688073395.
[32m[I 2023-04-21 00:58:23,784][39m Trial 5532 finished with value: 0.8828828828828829 and parameters: {'objective': 'CrossEntropy', 'colsample_bylevel': 0.08574518705650638, 'depth': 12, 'boosting_type': 'Plain', 'bootstrap_type': 'Bayesian', 'bagging_temperature': 4.9806332971316465}. Best is trial 1464 with value: 0.8990825688073395.
[32m[I 2023-04-21 00:58:28,982][39m Trial 5533 finished with value: 0.8421052631578947 and parameters: {'objective': 'Logloss', 'colsample_bylevel': 0.09663788240579542, 'depth': 11, 'boosting_type': 'Ordered', 'bootstrap_type': 'Bayesian', 'bagging_temperature': 4.41014127589034}. Best is trial 1464 with value: 0.8990825688073395.
[32m[I 2023-04-21 00:58:31,020][39m Trial 5534 finished with value: 0.8807339449541284 and parameters: {'objective': 'Logloss', 'colsample_bylevel': 0.09267279250616828, 'depth': 9, 'boosting_type': 'Plain', 'bootstrap_type': 'Bayesian', 'bagging_temperature': 4.087553744571767}. Best is trial 1464 with value: 0.8990825688073395.
[32m[I 2023-04-21 00:58:32,453][39m Trial 5535 finished with value: 0.8727272727272727 and parameters: {'objective': 'Logloss', 'colsample_bylevel': 0.09591374451639208, 'depth': 9, 'boosting_type': 'Plain', 'bootstrap_type': 'Bayesian', 'bagging_temperature': 3.94182277583895}. Best is trial 1464 with value: 0.8990825688073395.
[32m[I 2023-04-21 00:58:33,815][39m Trial 5536 finished with value: 0.8703703703703703 and parameters: {'objective': 'CrossEntropy', 'colsample_bylevel': 0.0941354837674054, 'depth': 8, 'boosting_type': 'Plain', 'bootstrap_type': 'Bayesian', 'bagging_temperature': 5.590942685606164}. Best is trial 1464 with value: 0.8990825688073395.
[32m[I 2023-04-21 00:58:35,206][39m Trial 5537 finished with value: 0.8648648648648648 and parameters: {'objective': 'CrossEntropy', 'colsample_bylevel': 0.09278044326161479, 'depth': 9, 'boosting_type': 'Plain', 'bootstrap_type': 'Bayesian', 'bagging_temperature': 4.770576698191387}. Best is trial 1464 with value: 0.8990825688073395.
[32m[I 2023-04-21 00:58:36,051][39m Trial 5538 finished with value: 0.8828828828828829 and parameters: {'objective': 'Logloss', 'colsample_bylevel': 0.09892905960640935, 'depth': 7, 'boosting_type': 'Plain', 'bootstrap_type': 'Bayesian', 'bagging_temperature': 4.762951147953627}. Best is trial 1464 with value: 0.8990825688073395.
[32m[I 2023-04-21 00:58:37,214][39m Trial 5539 finished with value: 0.8727272727272727 and parameters: {'objective': 'Logloss', 'colsample_bylevel': 0.08980922034898457, 'depth': 12, 'boosting_type': 'Plain', 'bootstrap_type': 'Bayesian', 'bagging_temperature': 5.414109564145723}. Best is trial 1464 with value: 0.8990825688073395.
[32m[I 2023-04-21 00:58:38,268][39m Trial 5540 finished with value: 0.8807339449541284 and parameters: {'objective': 'CrossEntropy', 'colsample_bylevel': 0.09060594991364311, 'depth': 10, 'boosting_type': 'Plain', 'bootstrap_type': 'Bayesian', 'bagging_temperature': 5.384114283676927}. Best is trial 1464 with value: 0.8990825688073395.
[32m[I 2023-04-21 00:58:39,444][39m Trial 5541 finished with value: 0.8623853211009175 and parameters: {'objective': 'CrossEntropy', 'colsample_bylevel': 0.09161003421170136, 'depth': 12, 'boosting_type': 'Plain', 'bootstrap_type': 'Bayesian', 'bagging_temperature': 4.493199722114894}. Best is trial 1464 with value: 0.8990825688073395.
[32m[I 2023-04-21 00:58:40,780][39m Trial 5542 finished with value: 0.8347826086956522 and parameters: {'objective': 'CrossEntropy', 'colsample_bylevel': 0.09562954224493775, 'depth': 3, 'boosting_type': 'Plain', 'bootstrap_type': 'Bayesian', 'bagging_temperature': 4.61235399290018}. Best is trial 1464 with value: 0.8990825688073395.
[32m[I 2023-04-21 00:58:41,984][39m Trial 5543 finished with value: 0.8571428571428572 and parameters: {'objective': 'CrossEntropy', 'colsample_bylevel': 0.08640535242779995, 'depth': 12, 'boosting_type': 'Plain', 'bootstrap_type': 'Bayesian', 'bagging_temperature': 4.930967778313075}. Best is trial 1464 with value: 0.8990825688073395.
[32m[I 2023-04-21 00:58:42,963][39m Trial 5544 finished with value: 0.8785046728971961 and parameters: {'objective': 'Logloss', 'colsample_bylevel': 0.09295572838118484, 'depth': 9, 'boosting_type': 'Plain', 'bootstrap_type': 'Bayesian', 'bagging_temperature': 5.79515104257529}. Best is trial 1464 with value: 0.8990825688073395.
[32m[I 2023-04-21 00:58:44,016][39m Trial 5545 finished with value: 0.875 and parameters: {'objective': 'Logloss', 'colsample_bylevel': 0.0946775585218875, 'depth': 10, 'boosting_type': 'Plain', 'bootstrap_type': 'Bayesian', 'bagging_temperature': 4.009399779234067}. Best is trial 1464 with value: 0.8990825688073395.
[32m[I 2023-04-21 00:58:45,477][39m Trial 5546 finished with value: 0.875 and parameters: {'objective': 'Logloss', 'colsample_bylevel': 0.09309369306087918, 'depth': 12, 'boosting_type': 'Plain', 'bootstrap_type': 'Bernoulli', 'subsample': 0.6425466757210285}. Best is trial 1464 with value: 0.8990825688073395.
[32m[I 2023-04-21 00:58:46,159][39m Trial 5547 finished with value: 0.8495575221238938 and parameters: {'objective': 'CrossEntropy', 'colsample_bylevel': 0.09627620306157644, 'depth': 7, 'boosting_type': 'Plain', 'bootstrap_type': 'MVS'}. Best is trial 1464 with value: 0.8990825688073395.
[32m[I 2023-04-21 00:58:47,173][39m Trial 5548 finished with value: 0.8648648648648648 and parameters: {'objective': 'Logloss', 'colsample_bylevel': 0.09660861273568208, 'depth': 11, 'boosting_type': 'Plain', 'bootstrap_type': 'Bayesian', 'bagging_temperature': 4.310267769429393}. Best is trial 1464 with value: 0.8990825688073395.
[32m[I 2023-04-21 00:58:48,356][39m Trial 5549 finished with value: 0.8807339449541284 and parameters: {'objective': 'CrossEntropy', 'colsample_bylevel': 0.0923974364484323, 'depth': 10, 'boosting_type': 'Plain', 'bootstrap_type': 'Bayesian', 'bagging_temperature': 7.197231692555196}. Best is trial 1464 with value: 0.8990825688073395.
[32m[I 2023-04-21 00:58:50,183][39m Trial 5550 finished with value: 0.8828828828828829 and parameters: {'objective': 'Logloss', 'colsample_bylevel': 0.09182573573067328, 'depth': 9, 'boosting_type': 'Plain', 'bootstrap_type': 'Bayesian', 'bagging_temperature': 5.392965318757421}. Best is trial 1464 with value: 0.8990825688073395.
[32m[I 2023-04-21 00:58:51,152][39m Trial 5551 finished with value: 0.888888888888889 and parameters: {'objective': 'Logloss', 'colsample_bylevel': 0.08788189002088949, 'depth': 12, 'boosting_type': 'Plain', 'bootstrap_type': 'Bayesian', 'bagging_temperature': 4.97068261223185}. Best is trial 1464 with value: 0.8990825688073395.
[32m[I 2023-04-21 00:58:55,936][39m Trial 5552 finished with value: 0.8571428571428572 and parameters: {'objective': 'CrossEntropy', 'colsample_bylevel': 0.09425671147974628, 'depth': 9, 'boosting_type': 'Ordered', 'bootstrap_type': 'Bayesian', 'bagging_temperature': 4.725885305414849}. Best is trial 1464 with value: 0.8990825688073395.
[32m[I 2023-04-21 00:58:56,873][39m Trial 5553 finished with value: 0.8648648648648648 and parameters: {'objective': 'CrossEntropy', 'colsample_bylevel': 0.09406742770843876, 'depth': 12, 'boosting_type': 'Plain', 'bootstrap_type': 'Bayesian', 'bagging_temperature': 6.40664409074404}. Best is trial 1464 with value: 0.8990825688073395.
[32m[I 2023-04-21 00:58:58,955][39m Trial 5554 finished with value: 0.8807339449541284 and parameters: {'objective': 'CrossEntropy', 'colsample_bylevel': 0.08884420623109911, 'depth': 9, 'boosting_type': 'Plain', 'bootstrap_type': 'Bayesian', 'bagging_temperature': 4.631754821134104}. Best is trial 1464 with value: 0.8990825688073395.
[32m[I 2023-04-21 00:59:00,158][39m Trial 5555 finished with value: 0.8545454545454546 and parameters: {'objective': 'CrossEntropy', 'colsample_bylevel': 0.08830796719333747, 'depth': 12, 'boosting_type': 'Plain', 'bootstrap_type': 'Bayesian', 'bagging_temperature': 3.784039270855253}. Best is trial 1464 with value: 0.8990825688073395.
[32m[I 2023-04-21 00:59:00,995][39m Trial 5556 finished with value: 0.8807339449541284 and parameters: {'objective': 'Logloss', 'colsample_bylevel': 0.09806965918838624, 'depth': 7, 'boosting_type': 'Plain', 'bootstrap_type': 'Bayesian', 'bagging_temperature': 3.6647074320864133}. Best is trial 1464 with value: 0.8990825688073395.
[32m[I 2023-04-21 00:59:02,228][39m Trial 5557 finished with value: 0.8727272727272727 and parameters: {'objective': 'CrossEntropy', 'colsample_bylevel': 0.09683116028808508, 'depth': 9, 'boosting_type': 'Plain', 'bootstrap_type': 'Bayesian', 'bagging_temperature': 4.4893765368006235}. Best is trial 1464 with value: 0.8990825688073395.
[32m[I 2023-04-21 00:59:03,688][39m Trial 5558 finished with value: 0.888888888888889 and parameters: {'objective': 'Logloss', 'colsample_bylevel': 0.09559012534078919, 'depth': 8, 'boosting_type': 'Plain', 'bootstrap_type': 'Bayesian', 'bagging_temperature': 6.573806265740919}. Best is trial 1464 with value: 0.8990825688073395.
[32m[I 2023-04-21 00:59:04,932][39m Trial 5559 finished with value: 0.8807339449541284 and parameters: {'objective': 'CrossEntropy', 'colsample_bylevel': 0.0998204921223115, 'depth': 7, 'boosting_type': 'Plain', 'bootstrap_type': 'Bayesian', 'bagging_temperature': 3.6889213177902396}. Best is trial 1464 with value: 0.8990825688073395.
[32m[I 2023-04-21 00:59:06,049][39m Trial 5560 finished with value: 0.8727272727272727 and parameters: {'objective': 'CrossEntropy', 'colsample_bylevel': 0.09077624880386675, 'depth': 12, 'boosting_type': 'Plain', 'bootstrap_type': 'Bayesian', 'bagging_temperature': 5.1581105563380545}. Best is trial 1464 with value: 0.8990825688073395.
[32m[I 2023-04-21 00:59:06,894][39m Trial 5561 finished with value: 0.8807339449541284 and parameters: {'objective': 'Logloss', 'colsample_bylevel': 0.09788407219904166, 'depth': 11, 'boosting_type': 'Plain', 'bootstrap_type': 'Bayesian', 'bagging_temperature': 4.559867055108557}. Best is trial 1464 with value: 0.8990825688073395.
[32m[I 2023-04-21 00:59:08,134][39m Trial 5562 finished with value: 0.888888888888889 and parameters: {'objective': 'Logloss', 'colsample_bylevel': 0.09802187304905666, 'depth': 9, 'boosting_type': 'Plain', 'bootstrap_type': 'Bayesian', 'bagging_temperature': 4.619970551183413}. Best is trial 1464 with value: 0.8990825688073395.
[32m[I 2023-04-21 00:59:09,028][39m Trial 5563 finished with value: 0.8828828828828829 and parameters: {'objective': 'Logloss', 'colsample_bylevel': 0.09087426889560805, 'depth': 9, 'boosting_type': 'Plain', 'bootstrap_type': 'Bayesian', 'bagging_temperature': 5.289527012127615}. Best is trial 1464 with value: 0.8990825688073395.
[32m[I 2023-04-21 00:59:10,025][39m Trial 5564 finished with value: 0.8571428571428572 and parameters: {'objective': 'Logloss', 'colsample_bylevel': 0.09258542893069104, 'depth': 9, 'boosting_type': 'Plain', 'bootstrap_type': 'Bernoulli', 'subsample': 0.13116103314568078}. Best is trial 1464 with value: 0.8990825688073395.
[32m[I 2023-04-21 00:59:11,692][39m Trial 5565 finished with value: 0.8703703703703703 and parameters: {'objective': 'Logloss', 'colsample_bylevel': 0.09813532312853473, 'depth': 7, 'boosting_type': 'Plain', 'bootstrap_type': 'Bayesian', 'bagging_temperature': 6.826166705189952}. Best is trial 1464 with value: 0.8990825688073395.
[32m[I 2023-04-21 00:59:13,785][39m Trial 5566 finished with value: 0.8727272727272727 and parameters: {'objective': 'CrossEntropy', 'colsample_bylevel': 0.09110544030842568, 'depth': 9, 'boosting_type': 'Plain', 'bootstrap_type': 'Bayesian', 'bagging_temperature': 7.676190516071235}. Best is trial 1464 with value: 0.8990825688073395.
[32m[I 2023-04-21 00:59:14,823][39m Trial 5567 finished with value: 0.8571428571428572 and parameters: {'objective': 'Logloss', 'colsample_bylevel': 0.09574395287649272, 'depth': 9, 'boosting_type': 'Plain', 'bootstrap_type': 'MVS'}. Best is trial 1464 with value: 0.8990825688073395.
[32m[I 2023-04-21 00:59:15,720][39m Trial 5568 finished with value: 0.8648648648648648 and parameters: {'objective': 'CrossEntropy', 'colsample_bylevel': 0.09051893337199299, 'depth': 11, 'boosting_type': 'Plain', 'bootstrap_type': 'Bayesian', 'bagging_temperature': 5.609271356868103}. Best is trial 1464 with value: 0.8990825688073395.
[32m[I 2023-04-21 00:59:16,450][39m Trial 5569 finished with value: 0.875 and parameters: {'objective': 'CrossEntropy', 'colsample_bylevel': 0.08817550923197895, 'depth': 10, 'boosting_type': 'Plain', 'bootstrap_type': 'Bayesian', 'bagging_temperature': 4.509217207708734}. Best is trial 1464 with value: 0.8990825688073395.
[32m[I 2023-04-21 00:59:17,694][39m Trial 5570 finished with value: 0.8807339449541284 and parameters: {'objective': 'Logloss', 'colsample_bylevel': 0.09504337038635521, 'depth': 7, 'boosting_type': 'Plain', 'bootstrap_type': 'Bayesian', 'bagging_temperature': 7.094130538145996}. Best is trial 1464 with value: 0.8990825688073395.
[32m[I 2023-04-21 00:59:19,728][39m Trial 5571 finished with value: 0.8623853211009175 and parameters: {'objective': 'Logloss', 'colsample_bylevel': 0.09410153635717859, 'depth': 9, 'boosting_type': 'Plain', 'bootstrap_type': 'Bayesian', 'bagging_temperature': 5.774587385667415}. Best is trial 1464 with value: 0.8990825688073395.
[32m[I 2023-04-21 00:59:24,161][39m Trial 5572 finished with value: 0.8347826086956522 and parameters: {'objective': 'CrossEntropy', 'colsample_bylevel': 0.08714808820408325, 'depth': 12, 'boosting_type': 'Ordered', 'bootstrap_type': 'Bayesian', 'bagging_temperature': 5.194360172492938}. Best is trial 1464 with value: 0.8990825688073395.
[32m[I 2023-04-21 00:59:25,655][39m Trial 5573 finished with value: 0.8648648648648648 and parameters: {'objective': 'Logloss', 'colsample_bylevel': 0.09430493484877839, 'depth': 9, 'boosting_type': 'Plain', 'bootstrap_type': 'Bayesian', 'bagging_temperature': 7.378459807004898}. Best is trial 1464 with value: 0.8990825688073395.
[32m[I 2023-04-21 00:59:27,014][39m Trial 5574 finished with value: 0.8807339449541284 and parameters: {'objective': 'CrossEntropy', 'colsample_bylevel': 0.09599158328743403, 'depth': 7, 'boosting_type': 'Plain', 'bootstrap_type': 'Bayesian', 'bagging_temperature': 8.026087360435646}. Best is trial 1464 with value: 0.8990825688073395.
[32m[I 2023-04-21 00:59:28,198][39m Trial 5575 finished with value: 0.8672566371681416 and parameters: {'objective': 'CrossEntropy', 'colsample_bylevel': 0.09074524192846546, 'depth': 11, 'boosting_type': 'Plain', 'bootstrap_type': 'Bayesian', 'bagging_temperature': 5.219169537949936}. Best is trial 1464 with value: 0.8990825688073395.
[32m[I 2023-04-21 00:59:29,335][39m Trial 5576 finished with value: 0.8347826086956522 and parameters: {'objective': 'Logloss', 'colsample_bylevel': 0.02617172102886745, 'depth': 7, 'boosting_type': 'Plain', 'bootstrap_type': 'Bayesian', 'bagging_temperature': 5.536214055351313}. Best is trial 1464 with value: 0.8990825688073395.
[32m[I 2023-04-21 00:59:30,292][39m Trial 5577 finished with value: 0.8623853211009175 and parameters: {'objective': 'CrossEntropy', 'colsample_bylevel': 0.09999896006995217, 'depth': 11, 'boosting_type': 'Plain', 'bootstrap_type': 'Bayesian', 'bagging_temperature': 4.228808193545098}. Best is trial 1464 with value: 0.8990825688073395.
[32m[I 2023-04-21 00:59:31,222][39m Trial 5578 finished with value: 0.8623853211009175 and parameters: {'objective': 'CrossEntropy', 'colsample_bylevel': 0.09984965919495722, 'depth': 10, 'boosting_type': 'Plain', 'bootstrap_type': 'Bayesian', 'bagging_temperature': 4.007104257452214}. Best is trial 1464 with value: 0.8990825688073395.
[32m[I 2023-04-21 00:59:32,357][39m Trial 5579 finished with value: 0.8703703703703703 and parameters: {'objective': 'CrossEntropy', 'colsample_bylevel': 0.09809241479222365, 'depth': 10, 'boosting_type': 'Plain', 'bootstrap_type': 'Bayesian', 'bagging_temperature': 3.9340722977359732}. Best is trial 1464 with value: 0.8990825688073395.
[32m[I 2023-04-21 00:59:33,410][39m Trial 5580 finished with value: 0.8727272727272727 and parameters: {'objective': 'CrossEntropy', 'colsample_bylevel': 0.09066010375387602, 'depth': 11, 'boosting_type': 'Plain', 'bootstrap_type': 'Bayesian', 'bagging_temperature': 4.574924959906287}. Best is trial 1464 with value: 0.8990825688073395.
[32m[I 2023-04-21 00:59:34,832][39m Trial 5581 finished with value: 0.8807339449541284 and parameters: {'objective': 'Logloss', 'colsample_bylevel': 0.09745715970707684, 'depth': 8, 'boosting_type': 'Plain', 'bootstrap_type': 'Bayesian', 'bagging_temperature': 6.414415554376475}. Best is trial 1464 with value: 0.8990825688073395.
[32m[I 2023-04-21 00:59:36,256][39m Trial 5582 finished with value: 0.8623853211009175 and parameters: {'objective': 'Logloss', 'colsample_bylevel': 0.08720623748538794, 'depth': 9, 'boosting_type': 'Plain', 'bootstrap_type': 'Bayesian', 'bagging_temperature': 4.519717082917349}. Best is trial 1464 with value: 0.8990825688073395.
[32m[I 2023-04-21 00:59:37,075][39m Trial 5583 finished with value: 0.8807339449541284 and parameters: {'objective': 'CrossEntropy', 'colsample_bylevel': 0.09859797680395938, 'depth': 8, 'boosting_type': 'Plain', 'bootstrap_type': 'Bayesian', 'bagging_temperature': 4.526707406259832}. Best is trial 1464 with value: 0.8990825688073395.
[32m[I 2023-04-21 00:59:38,157][39m Trial 5584 finished with value: 0.8807339449541284 and parameters: {'objective': 'Logloss', 'colsample_bylevel': 0.09665474986463998, 'depth': 9, 'boosting_type': 'Plain', 'bootstrap_type': 'Bayesian', 'bagging_temperature': 4.390014429202881}. Best is trial 1464 with value: 0.8990825688073395.
[32m[I 2023-04-21 00:59:39,120][39m Trial 5585 finished with value: 0.8727272727272727 and parameters: {'objective': 'Logloss', 'colsample_bylevel': 0.084704625266107, 'depth': 6, 'boosting_type': 'Plain', 'bootstrap_type': 'Bayesian', 'bagging_temperature': 7.95691923917205}. Best is trial 1464 with value: 0.8990825688073395.
[32m[I 2023-04-21 00:59:40,418][39m Trial 5586 finished with value: 0.8495575221238938 and parameters: {'objective': 'CrossEntropy', 'colsample_bylevel': 0.07384774420732768, 'depth': 11, 'boosting_type': 'Plain', 'bootstrap_type': 'Bayesian', 'bagging_temperature': 5.987979964409573}. Best is trial 1464 with value: 0.8990825688073395.
[32m[I 2023-04-21 00:59:41,554][39m Trial 5587 finished with value: 0.8727272727272727 and parameters: {'objective': 'Logloss', 'colsample_bylevel': 0.09030128247644863, 'depth': 12, 'boosting_type': 'Plain', 'bootstrap_type': 'Bayesian', 'bagging_temperature': 5.5107777675066405}. Best is trial 1464 with value: 0.8990825688073395.
[32m[I 2023-04-21 00:59:42,957][39m Trial 5588 finished with value: 0.8727272727272727 and parameters: {'objective': 'CrossEntropy', 'colsample_bylevel': 0.08716945306272492, 'depth': 12, 'boosting_type': 'Plain', 'bootstrap_type': 'Bernoulli', 'subsample': 0.22355376438420121}. Best is trial 1464 with value: 0.8990825688073395.
[32m[I 2023-04-21 00:59:44,355][39m Trial 5589 finished with value: 0.8807339449541284 and parameters: {'objective': 'Logloss', 'colsample_bylevel': 0.08985878272117483, 'depth': 8, 'boosting_type': 'Plain', 'bootstrap_type': 'Bayesian', 'bagging_temperature': 5.303281671207741}. Best is trial 1464 with value: 0.8990825688073395.
[32m[I 2023-04-21 00:59:49,060][39m Trial 5590 finished with value: 0.8571428571428572 and parameters: {'objective': 'CrossEntropy', 'colsample_bylevel': 0.09299960891463288, 'depth': 11, 'boosting_type': 'Ordered', 'bootstrap_type': 'Bayesian', 'bagging_temperature': 5.948924548173418}. Best is trial 1464 with value: 0.8990825688073395.
[32m[I 2023-04-21 00:59:50,497][39m Trial 5591 finished with value: 0.8495575221238938 and parameters: {'objective': 'Logloss', 'colsample_bylevel': 0.09510018997241583, 'depth': 9, 'boosting_type': 'Plain', 'bootstrap_type': 'MVS'}. Best is trial 1464 with value: 0.8990825688073395.
