[32m[I 2023-04-20 23:33:27,173][39m Trial 1721 finished with value: 0.8703703703703703 and parameters: {'objective': 'CrossEntropy', 'colsample_bylevel': 0.09479310248205443, 'depth': 6, 'boosting_type': 'Plain', 'bootstrap_type': 'Bayesian', 'bagging_temperature': 4.822278085780657}. Best is trial 1464 with value: 0.8990825688073395.
[32m[I 2023-04-20 23:33:28,387][39m Trial 1722 finished with value: 0.8727272727272727 and parameters: {'objective': 'Logloss', 'colsample_bylevel': 0.09005244743612738, 'depth': 10, 'boosting_type': 'Plain', 'bootstrap_type': 'Bayesian', 'bagging_temperature': 8.478880766775948}. Best is trial 1464 with value: 0.8990825688073395.
[32m[I 2023-04-20 23:33:29,235][39m Trial 1723 finished with value: 0.8571428571428572 and parameters: {'objective': 'Logloss', 'colsample_bylevel': 0.09835471218429337, 'depth': 9, 'boosting_type': 'Plain', 'bootstrap_type': 'Bayesian', 'bagging_temperature': 2.8379090119352894}. Best is trial 1464 with value: 0.8990825688073395.
[32m[I 2023-04-20 23:33:30,745][39m Trial 1724 finished with value: 0.8727272727272727 and parameters: {'objective': 'Logloss', 'colsample_bylevel': 0.09565188419451041, 'depth': 9, 'boosting_type': 'Plain', 'bootstrap_type': 'Bayesian', 'bagging_temperature': 4.521117713124864}. Best is trial 1464 with value: 0.8990825688073395.
[32m[I 2023-04-20 23:33:31,937][39m Trial 1725 finished with value: 0.8596491228070176 and parameters: {'objective': 'CrossEntropy', 'colsample_bylevel': 0.09997294285413444, 'depth': 9, 'boosting_type': 'Plain', 'bootstrap_type': 'Bernoulli', 'subsample': 0.7035701911813318}. Best is trial 1464 with value: 0.8990825688073395.
[32m[I 2023-04-20 23:33:32,663][39m Trial 1726 finished with value: 0.8623853211009175 and parameters: {'objective': 'Logloss', 'colsample_bylevel': 0.08757126096566889, 'depth': 8, 'boosting_type': 'Plain', 'bootstrap_type': 'Bayesian', 'bagging_temperature': 4.096219566125504}. Best is trial 1464 with value: 0.8990825688073395.
[32m[I 2023-04-20 23:33:33,205][39m Trial 1727 finished with value: 0.831858407079646 and parameters: {'objective': 'CrossEntropy', 'colsample_bylevel': 0.09835219467344027, 'depth': 6, 'boosting_type': 'Plain', 'bootstrap_type': 'MVS'}. Best is trial 1464 with value: 0.8990825688073395.
[32m[I 2023-04-20 23:33:34,591][39m Trial 1728 finished with value: 0.888888888888889 and parameters: {'objective': 'Logloss', 'colsample_bylevel': 0.09629657034552075, 'depth': 9, 'boosting_type': 'Plain', 'bootstrap_type': 'Bayesian', 'bagging_temperature': 4.702987995889836}. Best is trial 1464 with value: 0.8990825688073395.
[32m[I 2023-04-20 23:33:35,345][39m Trial 1729 finished with value: 0.8421052631578947 and parameters: {'objective': 'Logloss', 'colsample_bylevel': 0.08225484885053756, 'depth': 11, 'boosting_type': 'Plain', 'bootstrap_type': 'Bayesian', 'bagging_temperature': 6.722662921167937}. Best is trial 1464 with value: 0.8990825688073395.
[32m[I 2023-04-20 23:33:36,866][39m Trial 1730 finished with value: 0.8727272727272727 and parameters: {'objective': 'Logloss', 'colsample_bylevel': 0.09997069407849103, 'depth': 8, 'boosting_type': 'Plain', 'bootstrap_type': 'Bayesian', 'bagging_temperature': 3.787744606855744}. Best is trial 1464 with value: 0.8990825688073395.
[32m[I 2023-04-20 23:33:37,782][39m Trial 1731 finished with value: 0.8727272727272727 and parameters: {'objective': 'Logloss', 'colsample_bylevel': 0.09842466327871177, 'depth': 7, 'boosting_type': 'Plain', 'bootstrap_type': 'Bayesian', 'bagging_temperature': 5.452052942950463}. Best is trial 1464 with value: 0.8990825688073395.
[32m[I 2023-04-20 23:33:38,834][39m Trial 1732 finished with value: 0.8468468468468469 and parameters: {'objective': 'CrossEntropy', 'colsample_bylevel': 0.09862144660382313, 'depth': 9, 'boosting_type': 'Plain', 'bootstrap_type': 'Bernoulli', 'subsample': 0.7611154143966903}. Best is trial 1464 with value: 0.8990825688073395.
[32m[I 2023-04-20 23:33:39,919][39m Trial 1733 finished with value: 0.8807339449541284 and parameters: {'objective': 'Logloss', 'colsample_bylevel': 0.09707107754340441, 'depth': 8, 'boosting_type': 'Plain', 'bootstrap_type': 'Bayesian', 'bagging_temperature': 4.892594236363746}. Best is trial 1464 with value: 0.8990825688073395.
[32m[I 2023-04-20 23:33:40,844][39m Trial 1734 finished with value: 0.8727272727272727 and parameters: {'objective': 'CrossEntropy', 'colsample_bylevel': 0.09665698125015258, 'depth': 7, 'boosting_type': 'Plain', 'bootstrap_type': 'Bayesian', 'bagging_temperature': 6.463076675977129}. Best is trial 1464 with value: 0.8990825688073395.
[32m[I 2023-04-20 23:33:41,832][39m Trial 1735 finished with value: 0.8376068376068375 and parameters: {'objective': 'Logloss', 'colsample_bylevel': 0.034518889832843735, 'depth': 9, 'boosting_type': 'Plain', 'bootstrap_type': 'Bayesian', 'bagging_temperature': 2.5978691291756997}. Best is trial 1464 with value: 0.8990825688073395.
[32m[I 2023-04-20 23:33:42,991][39m Trial 1736 finished with value: 0.8623853211009175 and parameters: {'objective': 'Logloss', 'colsample_bylevel': 0.09029011978481866, 'depth': 8, 'boosting_type': 'Plain', 'bootstrap_type': 'Bayesian', 'bagging_temperature': 8.363316424013615}. Best is trial 1464 with value: 0.8990825688073395.
[32m[I 2023-04-20 23:33:44,161][39m Trial 1737 finished with value: 0.888888888888889 and parameters: {'objective': 'Logloss', 'colsample_bylevel': 0.09501579660987064, 'depth': 8, 'boosting_type': 'Plain', 'bootstrap_type': 'Bayesian', 'bagging_temperature': 4.1204141504179175}. Best is trial 1464 with value: 0.8990825688073395.
[32m[I 2023-04-20 23:33:49,283][39m Trial 1738 finished with value: 0.8421052631578947 and parameters: {'objective': 'Logloss', 'colsample_bylevel': 0.09480724299127495, 'depth': 9, 'boosting_type': 'Ordered', 'bootstrap_type': 'Bayesian', 'bagging_temperature': 4.953884043762914}. Best is trial 1464 with value: 0.8990825688073395.
[32m[I 2023-04-20 23:33:50,046][39m Trial 1739 finished with value: 0.8468468468468469 and parameters: {'objective': 'CrossEntropy', 'colsample_bylevel': 0.09340124614398895, 'depth': 10, 'boosting_type': 'Plain', 'bootstrap_type': 'Bayesian', 'bagging_temperature': 5.66181934571806}. Best is trial 1464 with value: 0.8990825688073395.
[32m[I 2023-04-20 23:33:51,719][39m Trial 1740 finished with value: 0.8807339449541284 and parameters: {'objective': 'Logloss', 'colsample_bylevel': 0.09698725702021925, 'depth': 8, 'boosting_type': 'Plain', 'bootstrap_type': 'Bayesian', 'bagging_temperature': 6.457277875589911}. Best is trial 1464 with value: 0.8990825688073395.
[32m[I 2023-04-20 23:33:52,305][39m Trial 1741 finished with value: 0.8990825688073395 and parameters: {'objective': 'CrossEntropy', 'colsample_bylevel': 0.09672402829466269, 'depth': 12, 'boosting_type': 'Plain', 'bootstrap_type': 'Bayesian', 'bagging_temperature': 6.656835085191949}. Best is trial 1464 with value: 0.8990825688073395.
[32m[I 2023-04-20 23:33:52,941][39m Trial 1742 finished with value: 0.8727272727272727 and parameters: {'objective': 'CrossEntropy', 'colsample_bylevel': 0.09767272893705248, 'depth': 9, 'boosting_type': 'Plain', 'bootstrap_type': 'Bayesian', 'bagging_temperature': 4.644957341373959}. Best is trial 1464 with value: 0.8990825688073395.
[32m[I 2023-04-20 23:33:54,005][39m Trial 1743 finished with value: 0.8807339449541284 and parameters: {'objective': 'Logloss', 'colsample_bylevel': 0.09244068920133541, 'depth': 12, 'boosting_type': 'Plain', 'bootstrap_type': 'Bayesian', 'bagging_temperature': 6.235904529194896}. Best is trial 1464 with value: 0.8990825688073395.
[32m[I 2023-04-20 23:33:54,560][39m Trial 1744 finished with value: 0.8571428571428572 and parameters: {'objective': 'CrossEntropy', 'colsample_bylevel': 0.09993901701823472, 'depth': 11, 'boosting_type': 'Plain', 'bootstrap_type': 'Bayesian', 'bagging_temperature': 1.1208125848293515}. Best is trial 1464 with value: 0.8990825688073395.
[32m[I 2023-04-20 23:33:55,603][39m Trial 1745 finished with value: 0.888888888888889 and parameters: {'objective': 'CrossEntropy', 'colsample_bylevel': 0.09492236189803688, 'depth': 10, 'boosting_type': 'Plain', 'bootstrap_type': 'Bayesian', 'bagging_temperature': 7.082388532203769}. Best is trial 1464 with value: 0.8990825688073395.
[32m[I 2023-04-20 23:33:56,736][39m Trial 1746 finished with value: 0.8421052631578947 and parameters: {'objective': 'CrossEntropy', 'colsample_bylevel': 0.09364252398839154, 'depth': 4, 'boosting_type': 'Plain', 'bootstrap_type': 'Bayesian', 'bagging_temperature': 6.518984768391718}. Best is trial 1464 with value: 0.8990825688073395.
[32m[I 2023-04-20 23:33:58,379][39m Trial 1747 finished with value: 0.8727272727272727 and parameters: {'objective': 'Logloss', 'colsample_bylevel': 0.09843659228154933, 'depth': 9, 'boosting_type': 'Plain', 'bootstrap_type': 'Bayesian', 'bagging_temperature': 4.97785678523712}. Best is trial 1464 with value: 0.8990825688073395.
[32m[I 2023-04-20 23:33:58,929][39m Trial 1748 finished with value: 0.8623853211009175 and parameters: {'objective': 'CrossEntropy', 'colsample_bylevel': 0.09496546002686504, 'depth': 12, 'boosting_type': 'Plain', 'bootstrap_type': 'Bayesian', 'bagging_temperature': 5.295109709908006}. Best is trial 1464 with value: 0.8990825688073395.
[32m[I 2023-04-20 23:33:59,577][39m Trial 1749 finished with value: 0.8623853211009175 and parameters: {'objective': 'Logloss', 'colsample_bylevel': 0.09531039099413187, 'depth': 10, 'boosting_type': 'Plain', 'bootstrap_type': 'Bayesian', 'bagging_temperature': 3.96171991947478}. Best is trial 1464 with value: 0.8990825688073395.
[32m[I 2023-04-20 23:34:00,890][39m Trial 1750 finished with value: 0.8571428571428572 and parameters: {'objective': 'Logloss', 'colsample_bylevel': 0.09690585158146475, 'depth': 8, 'boosting_type': 'Plain', 'bootstrap_type': 'MVS'}. Best is trial 1464 with value: 0.8990825688073395.
[32m[I 2023-04-20 23:34:01,764][39m Trial 1751 finished with value: 0.8727272727272727 and parameters: {'objective': 'Logloss', 'colsample_bylevel': 0.09296579103358317, 'depth': 10, 'boosting_type': 'Plain', 'bootstrap_type': 'Bayesian', 'bagging_temperature': 3.5956315985487435}. Best is trial 1464 with value: 0.8990825688073395.
[32m[I 2023-04-20 23:34:02,875][39m Trial 1752 finished with value: 0.8703703703703703 and parameters: {'objective': 'CrossEntropy', 'colsample_bylevel': 0.09852169957908188, 'depth': 11, 'boosting_type': 'Plain', 'bootstrap_type': 'Bernoulli', 'subsample': 0.4959333361530035}. Best is trial 1464 with value: 0.8990825688073395.
[32m[I 2023-04-20 23:34:04,102][39m Trial 1753 finished with value: 0.8807339449541284 and parameters: {'objective': 'Logloss', 'colsample_bylevel': 0.09684091233667741, 'depth': 12, 'boosting_type': 'Plain', 'bootstrap_type': 'Bayesian', 'bagging_temperature': 7.09822017482835}. Best is trial 1464 with value: 0.8990825688073395.
[32m[I 2023-04-20 23:34:05,263][39m Trial 1754 finished with value: 0.8727272727272727 and parameters: {'objective': 'Logloss', 'colsample_bylevel': 0.09266525610952793, 'depth': 11, 'boosting_type': 'Plain', 'bootstrap_type': 'Bayesian', 'bagging_temperature': 5.611862952695705}. Best is trial 1464 with value: 0.8990825688073395.
[32m[I 2023-04-20 23:34:06,302][39m Trial 1755 finished with value: 0.8807339449541284 and parameters: {'objective': 'CrossEntropy', 'colsample_bylevel': 0.09314151877217842, 'depth': 10, 'boosting_type': 'Plain', 'bootstrap_type': 'Bayesian', 'bagging_temperature': 5.868329954359341}. Best is trial 1464 with value: 0.8990825688073395.
[32m[I 2023-04-20 23:34:11,422][39m Trial 1756 finished with value: 0.8571428571428572 and parameters: {'objective': 'Logloss', 'colsample_bylevel': 0.09631707141583619, 'depth': 12, 'boosting_type': 'Ordered', 'bootstrap_type': 'Bayesian', 'bagging_temperature': 6.673758483760022}. Best is trial 1464 with value: 0.8990825688073395.
[32m[I 2023-04-20 23:34:12,703][39m Trial 1757 finished with value: 0.8807339449541284 and parameters: {'objective': 'Logloss', 'colsample_bylevel': 0.09160950271947117, 'depth': 9, 'boosting_type': 'Plain', 'bootstrap_type': 'Bayesian', 'bagging_temperature': 4.302447136105477}. Best is trial 1464 with value: 0.8990825688073395.
[32m[I 2023-04-20 23:34:13,741][39m Trial 1758 finished with value: 0.8807339449541284 and parameters: {'objective': 'CrossEntropy', 'colsample_bylevel': 0.09052857124096458, 'depth': 12, 'boosting_type': 'Plain', 'bootstrap_type': 'Bayesian', 'bagging_temperature': 6.887214355705927}. Best is trial 1464 with value: 0.8990825688073395.
[32m[I 2023-04-20 23:34:14,682][39m Trial 1759 finished with value: 0.888888888888889 and parameters: {'objective': 'CrossEntropy', 'colsample_bylevel': 0.09056729578102853, 'depth': 12, 'boosting_type': 'Plain', 'bootstrap_type': 'Bayesian', 'bagging_temperature': 5.115876003471243}. Best is trial 1464 with value: 0.8990825688073395.
[32m[I 2023-04-20 23:34:15,456][39m Trial 1760 finished with value: 0.8727272727272727 and parameters: {'objective': 'Logloss', 'colsample_bylevel': 0.09211039630940573, 'depth': 10, 'boosting_type': 'Plain', 'bootstrap_type': 'Bayesian', 'bagging_temperature': 3.4349748580058774}. Best is trial 1464 with value: 0.8990825688073395.
[32m[I 2023-04-20 23:34:16,282][39m Trial 1761 finished with value: 0.8807339449541284 and parameters: {'objective': 'Logloss', 'colsample_bylevel': 0.09556497040517606, 'depth': 6, 'boosting_type': 'Plain', 'bootstrap_type': 'Bayesian', 'bagging_temperature': 6.382828803127379}. Best is trial 1464 with value: 0.8990825688073395.
[32m[I 2023-04-20 23:34:17,394][39m Trial 1762 finished with value: 0.8623853211009175 and parameters: {'objective': 'CrossEntropy', 'colsample_bylevel': 0.09320454213912326, 'depth': 6, 'boosting_type': 'Plain', 'bootstrap_type': 'Bayesian', 'bagging_temperature': 5.4026943267842}. Best is trial 1464 with value: 0.8990825688073395.
[32m[I 2023-04-20 23:34:18,371][39m Trial 1763 finished with value: 0.8727272727272727 and parameters: {'objective': 'Logloss', 'colsample_bylevel': 0.09695503834182999, 'depth': 8, 'boosting_type': 'Plain', 'bootstrap_type': 'Bayesian', 'bagging_temperature': 7.372026571383128}. Best is trial 1464 with value: 0.8990825688073395.
[32m[I 2023-04-20 23:34:19,399][39m Trial 1764 finished with value: 0.8807339449541284 and parameters: {'objective': 'Logloss', 'colsample_bylevel': 0.0998632200866706, 'depth': 10, 'boosting_type': 'Plain', 'bootstrap_type': 'Bayesian', 'bagging_temperature': 4.2421162517421775}. Best is trial 1464 with value: 0.8990825688073395.
[32m[I 2023-04-20 23:34:20,347][39m Trial 1765 finished with value: 0.888888888888889 and parameters: {'objective': 'Logloss', 'colsample_bylevel': 0.09572619758215298, 'depth': 10, 'boosting_type': 'Plain', 'bootstrap_type': 'Bayesian', 'bagging_temperature': 4.498121520063657}. Best is trial 1464 with value: 0.8990825688073395.
[32m[I 2023-04-20 23:34:21,282][39m Trial 1766 finished with value: 0.875 and parameters: {'objective': 'Logloss', 'colsample_bylevel': 0.09277731629387416, 'depth': 10, 'boosting_type': 'Plain', 'bootstrap_type': 'Bayesian', 'bagging_temperature': 3.6518727966314333}. Best is trial 1464 with value: 0.8990825688073395.
[32m[I 2023-04-20 23:34:22,001][39m Trial 1767 finished with value: 0.7796610169491527 and parameters: {'objective': 'Logloss', 'colsample_bylevel': 0.012332872609913947, 'depth': 9, 'boosting_type': 'Plain', 'bootstrap_type': 'Bayesian', 'bagging_temperature': 4.281463029933949}. Best is trial 1464 with value: 0.8990825688073395.
[32m[I 2023-04-20 23:34:22,909][39m Trial 1768 finished with value: 0.875 and parameters: {'objective': 'Logloss', 'colsample_bylevel': 0.06103761119242173, 'depth': 10, 'boosting_type': 'Plain', 'bootstrap_type': 'Bayesian', 'bagging_temperature': 5.950092047498934}. Best is trial 1464 with value: 0.8990825688073395.
[32m[I 2023-04-20 23:34:23,758][39m Trial 1769 finished with value: 0.8672566371681416 and parameters: {'objective': 'Logloss', 'colsample_bylevel': 0.08890596991328376, 'depth': 10, 'boosting_type': 'Plain', 'bootstrap_type': 'Bayesian', 'bagging_temperature': 5.500135738666917}. Best is trial 1464 with value: 0.8990825688073395.
[32m[I 2023-04-20 23:34:24,546][39m Trial 1770 finished with value: 0.8703703703703703 and parameters: {'objective': 'CrossEntropy', 'colsample_bylevel': 0.09041939606660392, 'depth': 10, 'boosting_type': 'Plain', 'bootstrap_type': 'Bayesian', 'bagging_temperature': 2.6974574797205104}. Best is trial 1464 with value: 0.8990825688073395.
[32m[I 2023-04-20 23:34:25,695][39m Trial 1771 finished with value: 0.8571428571428572 and parameters: {'objective': 'Logloss', 'colsample_bylevel': 0.09797325712391931, 'depth': 9, 'boosting_type': 'Plain', 'bootstrap_type': 'MVS'}. Best is trial 1464 with value: 0.8990825688073395.
[32m[I 2023-04-20 23:34:26,483][39m Trial 1772 finished with value: 0.888888888888889 and parameters: {'objective': 'Logloss', 'colsample_bylevel': 0.09695040432235179, 'depth': 7, 'boosting_type': 'Plain', 'bootstrap_type': 'Bayesian', 'bagging_temperature': 6.661669051118892}. Best is trial 1464 with value: 0.8990825688073395.
[32m[I 2023-04-20 23:34:27,648][39m Trial 1773 finished with value: 0.8648648648648648 and parameters: {'objective': 'Logloss', 'colsample_bylevel': 0.09465596326423423, 'depth': 7, 'boosting_type': 'Plain', 'bootstrap_type': 'Bernoulli', 'subsample': 0.5340692427559446}. Best is trial 1464 with value: 0.8990825688073395.
[32m[I 2023-04-20 23:34:28,591][39m Trial 1774 finished with value: 0.8807339449541284 and parameters: {'objective': 'CrossEntropy', 'colsample_bylevel': 0.09422475440556345, 'depth': 10, 'boosting_type': 'Plain', 'bootstrap_type': 'Bayesian', 'bagging_temperature': 4.525989332506828}. Best is trial 1464 with value: 0.8990825688073395.
[32m[I 2023-04-20 23:34:33,942][39m Trial 1775 finished with value: 0.8495575221238938 and parameters: {'objective': 'CrossEntropy', 'colsample_bylevel': 0.09641898520254573, 'depth': 12, 'boosting_type': 'Ordered', 'bootstrap_type': 'Bayesian', 'bagging_temperature': 6.773409189224245}. Best is trial 1464 with value: 0.8990825688073395.
[32m[I 2023-04-20 23:34:35,187][39m Trial 1776 finished with value: 0.8703703703703703 and parameters: {'objective': 'CrossEntropy', 'colsample_bylevel': 0.0918430392988228, 'depth': 10, 'boosting_type': 'Plain', 'bootstrap_type': 'Bayesian', 'bagging_temperature': 7.576285735714413}. Best is trial 1464 with value: 0.8990825688073395.
[32m[I 2023-04-20 23:34:35,889][39m Trial 1777 finished with value: 0.8727272727272727 and parameters: {'objective': 'CrossEntropy', 'colsample_bylevel': 0.09783921459552193, 'depth': 12, 'boosting_type': 'Plain', 'bootstrap_type': 'Bayesian', 'bagging_temperature': 4.902408801465921}. Best is trial 1464 with value: 0.8990825688073395.
[32m[I 2023-04-20 23:34:36,642][39m Trial 1778 finished with value: 0.8648648648648648 and parameters: {'objective': 'CrossEntropy', 'colsample_bylevel': 0.068132963349962, 'depth': 11, 'boosting_type': 'Plain', 'bootstrap_type': 'Bayesian', 'bagging_temperature': 0.25943860298555244}. Best is trial 1464 with value: 0.8990825688073395.
[32m[I 2023-04-20 23:34:37,636][39m Trial 1779 finished with value: 0.8448275862068967 and parameters: {'objective': 'Logloss', 'colsample_bylevel': 0.04749830177086126, 'depth': 7, 'boosting_type': 'Plain', 'bootstrap_type': 'Bayesian', 'bagging_temperature': 2.4489074696147837}. Best is trial 1464 with value: 0.8990825688073395.
[32m[I 2023-04-20 23:34:38,274][39m Trial 1780 finished with value: 0.875 and parameters: {'objective': 'CrossEntropy', 'colsample_bylevel': 0.09445683557730605, 'depth': 11, 'boosting_type': 'Plain', 'bootstrap_type': 'Bayesian', 'bagging_temperature': 6.297545986898313}. Best is trial 1464 with value: 0.8990825688073395.
[32m[I 2023-04-20 23:34:39,230][39m Trial 1781 finished with value: 0.8807339449541284 and parameters: {'objective': 'CrossEntropy', 'colsample_bylevel': 0.09634008080084844, 'depth': 8, 'boosting_type': 'Plain', 'bootstrap_type': 'Bayesian', 'bagging_temperature': 5.37794658932738}. Best is trial 1464 with value: 0.8990825688073395.
[32m[I 2023-04-20 23:34:40,401][39m Trial 1782 finished with value: 0.8807339449541284 and parameters: {'objective': 'CrossEntropy', 'colsample_bylevel': 0.09334784647982738, 'depth': 9, 'boosting_type': 'Plain', 'bootstrap_type': 'Bayesian', 'bagging_temperature': 5.222713876210077}. Best is trial 1464 with value: 0.8990825688073395.
[32m[I 2023-04-20 23:34:41,439][39m Trial 1783 finished with value: 0.8571428571428572 and parameters: {'objective': 'CrossEntropy', 'colsample_bylevel': 0.09491606529916248, 'depth': 9, 'boosting_type': 'Plain', 'bootstrap_type': 'Bernoulli', 'subsample': 0.633631309742982}. Best is trial 1464 with value: 0.8990825688073395.
[32m[I 2023-04-20 23:34:42,412][39m Trial 1784 finished with value: 0.8807339449541284 and parameters: {'objective': 'Logloss', 'colsample_bylevel': 0.09911061196687092, 'depth': 8, 'boosting_type': 'Plain', 'bootstrap_type': 'Bayesian', 'bagging_temperature': 5.823432677173643}. Best is trial 1464 with value: 0.8990825688073395.
[32m[I 2023-04-20 23:34:43,220][39m Trial 1785 finished with value: 0.8703703703703703 and parameters: {'objective': 'Logloss', 'colsample_bylevel': 0.09428746594815897, 'depth': 6, 'boosting_type': 'Plain', 'bootstrap_type': 'Bayesian', 'bagging_temperature': 5.670346494824002}. Best is trial 1464 with value: 0.8990825688073395.
[32m[I 2023-04-20 23:34:43,981][39m Trial 1786 finished with value: 0.8807339449541284 and parameters: {'objective': 'CrossEntropy', 'colsample_bylevel': 0.09066092386377993, 'depth': 12, 'boosting_type': 'Plain', 'bootstrap_type': 'Bayesian', 'bagging_temperature': 6.1434887827848375}. Best is trial 1464 with value: 0.8990825688073395.
