[32m[I 2023-04-20 23:55:43,085][39m Trial 2767 finished with value: 0.8623853211009175 and parameters: {'objective': 'CrossEntropy', 'colsample_bylevel': 0.09533553645522322, 'depth': 9, 'boosting_type': 'Plain', 'bootstrap_type': 'Bayesian', 'bagging_temperature': 7.4281095739456084}. Best is trial 1464 with value: 0.8990825688073395.
[32m[I 2023-04-20 23:55:43,994][39m Trial 2768 finished with value: 0.8727272727272727 and parameters: {'objective': 'Logloss', 'colsample_bylevel': 0.09527682678314071, 'depth': 9, 'boosting_type': 'Plain', 'bootstrap_type': 'Bayesian', 'bagging_temperature': 6.917588958427982}. Best is trial 1464 with value: 0.8990825688073395.
[32m[I 2023-04-20 23:55:44,987][39m Trial 2769 finished with value: 0.888888888888889 and parameters: {'objective': 'Logloss', 'colsample_bylevel': 0.0933855675435439, 'depth': 9, 'boosting_type': 'Plain', 'bootstrap_type': 'Bayesian', 'bagging_temperature': 6.984525664800555}. Best is trial 1464 with value: 0.8990825688073395.
[32m[I 2023-04-20 23:55:46,336][39m Trial 2770 finished with value: 0.8727272727272727 and parameters: {'objective': 'Logloss', 'colsample_bylevel': 0.09661802019558308, 'depth': 9, 'boosting_type': 'Plain', 'bootstrap_type': 'Bayesian', 'bagging_temperature': 6.988866253819482}. Best is trial 1464 with value: 0.8990825688073395.
[32m[I 2023-04-20 23:55:47,185][39m Trial 2771 finished with value: 0.8703703703703703 and parameters: {'objective': 'CrossEntropy', 'colsample_bylevel': 0.09205269474995534, 'depth': 9, 'boosting_type': 'Plain', 'bootstrap_type': 'Bayesian', 'bagging_temperature': 7.140417508168164}. Best is trial 1464 with value: 0.8990825688073395.
[32m[I 2023-04-20 23:55:48,585][39m Trial 2772 finished with value: 0.8807339449541284 and parameters: {'objective': 'Logloss', 'colsample_bylevel': 0.09450593343028098, 'depth': 9, 'boosting_type': 'Plain', 'bootstrap_type': 'Bayesian', 'bagging_temperature': 7.08132216794149}. Best is trial 1464 with value: 0.8990825688073395.
[32m[I 2023-04-20 23:55:49,659][39m Trial 2773 finished with value: 0.8807339449541284 and parameters: {'objective': 'Logloss', 'colsample_bylevel': 0.09807028232093741, 'depth': 7, 'boosting_type': 'Plain', 'bootstrap_type': 'Bayesian', 'bagging_temperature': 7.113309517475642}. Best is trial 1464 with value: 0.8990825688073395.
[32m[I 2023-04-20 23:55:54,385][39m Trial 2774 finished with value: 0.8347826086956522 and parameters: {'objective': 'Logloss', 'colsample_bylevel': 0.09655818106508622, 'depth': 7, 'boosting_type': 'Ordered', 'bootstrap_type': 'MVS'}. Best is trial 1464 with value: 0.8990825688073395.
[32m[I 2023-04-20 23:55:55,431][39m Trial 2775 finished with value: 0.8807339449541284 and parameters: {'objective': 'Logloss', 'colsample_bylevel': 0.09550047791111327, 'depth': 7, 'boosting_type': 'Plain', 'bootstrap_type': 'Bayesian', 'bagging_temperature': 6.796534796081476}. Best is trial 1464 with value: 0.8990825688073395.
[32m[I 2023-04-20 23:55:56,617][39m Trial 2776 finished with value: 0.8807339449541284 and parameters: {'objective': 'Logloss', 'colsample_bylevel': 0.09388839735053482, 'depth': 7, 'boosting_type': 'Plain', 'bootstrap_type': 'Bayesian', 'bagging_temperature': 6.636746962684675}. Best is trial 1464 with value: 0.8990825688073395.
[32m[I 2023-04-20 23:55:58,231][39m Trial 2777 finished with value: 0.8596491228070176 and parameters: {'objective': 'CrossEntropy', 'colsample_bylevel': 0.08926741316711266, 'depth': 9, 'boosting_type': 'Plain', 'bootstrap_type': 'Bayesian', 'bagging_temperature': 6.2002186280766765}. Best is trial 1464 with value: 0.8990825688073395.
[32m[I 2023-04-20 23:55:59,587][39m Trial 2778 finished with value: 0.8727272727272727 and parameters: {'objective': 'CrossEntropy', 'colsample_bylevel': 0.0921877626344555, 'depth': 9, 'boosting_type': 'Plain', 'bootstrap_type': 'Bayesian', 'bagging_temperature': 7.276697526948076}. Best is trial 1464 with value: 0.8990825688073395.
[32m[I 2023-04-20 23:56:00,767][39m Trial 2779 finished with value: 0.8495575221238938 and parameters: {'objective': 'CrossEntropy', 'colsample_bylevel': 0.08993096229756341, 'depth': 9, 'boosting_type': 'Plain', 'bootstrap_type': 'Bayesian', 'bagging_temperature': 0.41557534901086157}. Best is trial 1464 with value: 0.8990825688073395.
[32m[I 2023-04-20 23:56:01,857][39m Trial 2780 finished with value: 0.8807339449541284 and parameters: {'objective': 'Logloss', 'colsample_bylevel': 0.09797637575610474, 'depth': 9, 'boosting_type': 'Plain', 'bootstrap_type': 'Bayesian', 'bagging_temperature': 6.911209845682478}. Best is trial 1464 with value: 0.8990825688073395.
[32m[I 2023-04-20 23:56:03,025][39m Trial 2781 finished with value: 0.8727272727272727 and parameters: {'objective': 'CrossEntropy', 'colsample_bylevel': 0.09830836127236973, 'depth': 8, 'boosting_type': 'Plain', 'bootstrap_type': 'Bayesian', 'bagging_temperature': 6.845469070537804}. Best is trial 1464 with value: 0.8990825688073395.
[32m[I 2023-04-20 23:56:04,460][39m Trial 2782 finished with value: 0.8807339449541284 and parameters: {'objective': 'CrossEntropy', 'colsample_bylevel': 0.09823856149593166, 'depth': 8, 'boosting_type': 'Plain', 'bootstrap_type': 'Bayesian', 'bagging_temperature': 7.347434958224909}. Best is trial 1464 with value: 0.8990825688073395.
[32m[I 2023-04-20 23:56:05,264][39m Trial 2783 finished with value: 0.8727272727272727 and parameters: {'objective': 'Logloss', 'colsample_bylevel': 0.09099894615075971, 'depth': 9, 'boosting_type': 'Plain', 'bootstrap_type': 'Bayesian', 'bagging_temperature': 6.905198770182589}. Best is trial 1464 with value: 0.8990825688073395.
[32m[I 2023-04-20 23:56:05,974][39m Trial 2784 finished with value: 0.8807339449541284 and parameters: {'objective': 'Logloss', 'colsample_bylevel': 0.09607086332848183, 'depth': 7, 'boosting_type': 'Plain', 'bootstrap_type': 'Bayesian', 'bagging_temperature': 7.154503518077428}. Best is trial 1464 with value: 0.8990825688073395.
[32m[I 2023-04-20 23:56:06,737][39m Trial 2785 finished with value: 0.8807339449541284 and parameters: {'objective': 'Logloss', 'colsample_bylevel': 0.09555508695478089, 'depth': 8, 'boosting_type': 'Plain', 'bootstrap_type': 'Bayesian', 'bagging_temperature': 7.138109972132157}. Best is trial 1464 with value: 0.8990825688073395.
[32m[I 2023-04-20 23:56:08,070][39m Trial 2786 finished with value: 0.8807339449541284 and parameters: {'objective': 'Logloss', 'colsample_bylevel': 0.09481429068270057, 'depth': 8, 'boosting_type': 'Plain', 'bootstrap_type': 'Bayesian', 'bagging_temperature': 6.986511530705398}. Best is trial 1464 with value: 0.8990825688073395.
[32m[I 2023-04-20 23:56:08,999][39m Trial 2787 finished with value: 0.8807339449541284 and parameters: {'objective': 'Logloss', 'colsample_bylevel': 0.09388364898656125, 'depth': 7, 'boosting_type': 'Plain', 'bootstrap_type': 'Bayesian', 'bagging_temperature': 6.71666413176331}. Best is trial 1464 with value: 0.8990825688073395.
[32m[I 2023-04-20 23:56:10,660][39m Trial 2788 finished with value: 0.8727272727272727 and parameters: {'objective': 'CrossEntropy', 'colsample_bylevel': 0.0960911723014201, 'depth': 9, 'boosting_type': 'Plain', 'bootstrap_type': 'Bayesian', 'bagging_temperature': 7.31230330611989}. Best is trial 1464 with value: 0.8990825688073395.
[32m[I 2023-04-20 23:56:12,028][39m Trial 2789 finished with value: 0.8727272727272727 and parameters: {'objective': 'CrossEntropy', 'colsample_bylevel': 0.0921056119630579, 'depth': 9, 'boosting_type': 'Plain', 'bootstrap_type': 'Bayesian', 'bagging_temperature': 7.0133813806074095}. Best is trial 1464 with value: 0.8990825688073395.
[32m[I 2023-04-20 23:56:12,896][39m Trial 2790 finished with value: 0.8545454545454546 and parameters: {'objective': 'CrossEntropy', 'colsample_bylevel': 0.08963662276558115, 'depth': 9, 'boosting_type': 'Plain', 'bootstrap_type': 'Bayesian', 'bagging_temperature': 6.875630014057683}. Best is trial 1464 with value: 0.8990825688073395.
[32m[I 2023-04-20 23:56:14,429][39m Trial 2791 finished with value: 0.8672566371681416 and parameters: {'objective': 'Logloss', 'colsample_bylevel': 0.0927888409617416, 'depth': 9, 'boosting_type': 'Plain', 'bootstrap_type': 'Bayesian', 'bagging_temperature': 6.7636741984463065}. Best is trial 1464 with value: 0.8990825688073395.
[32m[I 2023-04-20 23:56:15,156][39m Trial 2792 finished with value: 0.8305084745762712 and parameters: {'objective': 'Logloss', 'colsample_bylevel': 0.09308398729875438, 'depth': 2, 'boosting_type': 'Plain', 'bootstrap_type': 'Bayesian', 'bagging_temperature': 7.1510305053948136}. Best is trial 1464 with value: 0.8990825688073395.
[32m[I 2023-04-20 23:56:20,278][39m Trial 2793 finished with value: 0.8421052631578947 and parameters: {'objective': 'Logloss', 'colsample_bylevel': 0.0935424167383809, 'depth': 9, 'boosting_type': 'Ordered', 'bootstrap_type': 'Bayesian', 'bagging_temperature': 5.2294815483245705}. Best is trial 1464 with value: 0.8990825688073395.
[32m[I 2023-04-20 23:56:21,945][39m Trial 2794 finished with value: 0.8596491228070176 and parameters: {'objective': 'Logloss', 'colsample_bylevel': 0.09472868585644265, 'depth': 9, 'boosting_type': 'Plain', 'bootstrap_type': 'MVS'}. Best is trial 1464 with value: 0.8990825688073395.
[32m[I 2023-04-20 23:56:22,729][39m Trial 2795 finished with value: 0.8807339449541284 and parameters: {'objective': 'Logloss', 'colsample_bylevel': 0.0971720342182897, 'depth': 8, 'boosting_type': 'Plain', 'bootstrap_type': 'Bayesian', 'bagging_temperature': 5.445771099739949}. Best is trial 1464 with value: 0.8990825688073395.
[32m[I 2023-04-20 23:56:24,497][39m Trial 2796 finished with value: 0.8727272727272727 and parameters: {'objective': 'CrossEntropy', 'colsample_bylevel': 0.09068375513497387, 'depth': 9, 'boosting_type': 'Plain', 'bootstrap_type': 'Bayesian', 'bagging_temperature': 5.486726256947077}. Best is trial 1464 with value: 0.8990825688073395.
[32m[I 2023-04-20 23:56:25,849][39m Trial 2797 finished with value: 0.8807339449541284 and parameters: {'objective': 'CrossEntropy', 'colsample_bylevel': 0.09194793030067819, 'depth': 9, 'boosting_type': 'Plain', 'bootstrap_type': 'Bayesian', 'bagging_temperature': 9.082527805467226}. Best is trial 1464 with value: 0.8990825688073395.
[32m[I 2023-04-20 23:56:26,877][39m Trial 2798 finished with value: 0.888888888888889 and parameters: {'objective': 'Logloss', 'colsample_bylevel': 0.09313686065155154, 'depth': 9, 'boosting_type': 'Plain', 'bootstrap_type': 'Bayesian', 'bagging_temperature': 5.251468520079772}. Best is trial 1464 with value: 0.8990825688073395.
[32m[I 2023-04-20 23:56:28,174][39m Trial 2799 finished with value: 0.8596491228070176 and parameters: {'objective': 'Logloss', 'colsample_bylevel': 0.05958343324194806, 'depth': 8, 'boosting_type': 'Plain', 'bootstrap_type': 'Bayesian', 'bagging_temperature': 6.793708324539899}. Best is trial 1464 with value: 0.8990825688073395.
[32m[I 2023-04-20 23:56:29,234][39m Trial 2800 finished with value: 0.8166666666666667 and parameters: {'objective': 'Logloss', 'colsample_bylevel': 0.02495867186457999, 'depth': 9, 'boosting_type': 'Plain', 'bootstrap_type': 'Bayesian', 'bagging_temperature': 7.002936939483661}. Best is trial 1464 with value: 0.8990825688073395.
[32m[I 2023-04-20 23:56:30,063][39m Trial 2801 finished with value: 0.8727272727272727 and parameters: {'objective': 'Logloss', 'colsample_bylevel': 0.09820630123191247, 'depth': 8, 'boosting_type': 'Plain', 'bootstrap_type': 'Bayesian', 'bagging_temperature': 5.845953166261222}. Best is trial 1464 with value: 0.8990825688073395.
[32m[I 2023-04-20 23:56:30,626][39m Trial 2802 finished with value: 0.8828828828828829 and parameters: {'objective': 'CrossEntropy', 'colsample_bylevel': 0.09172537440299958, 'depth': 10, 'boosting_type': 'Plain', 'bootstrap_type': 'Bayesian', 'bagging_temperature': 5.616203216194477}. Best is trial 1464 with value: 0.8990825688073395.
[32m[I 2023-04-20 23:56:31,819][39m Trial 2803 finished with value: 0.8703703703703703 and parameters: {'objective': 'Logloss', 'colsample_bylevel': 0.09852321011096152, 'depth': 8, 'boosting_type': 'Plain', 'bootstrap_type': 'Bayesian', 'bagging_temperature': 7.365492604926046}. Best is trial 1464 with value: 0.8990825688073395.
[32m[I 2023-04-20 23:56:33,196][39m Trial 2804 finished with value: 0.8727272727272727 and parameters: {'objective': 'Logloss', 'colsample_bylevel': 0.09845551414178834, 'depth': 8, 'boosting_type': 'Plain', 'bootstrap_type': 'Bayesian', 'bagging_temperature': 7.0688769227712}. Best is trial 1464 with value: 0.8990825688073395.
[32m[I 2023-04-20 23:56:34,653][39m Trial 2805 finished with value: 0.888888888888889 and parameters: {'objective': 'CrossEntropy', 'colsample_bylevel': 0.09388271300345084, 'depth': 9, 'boosting_type': 'Plain', 'bootstrap_type': 'Bayesian', 'bagging_temperature': 4.6047164276797945}. Best is trial 1464 with value: 0.8990825688073395.
[32m[I 2023-04-20 23:56:35,484][39m Trial 2806 finished with value: 0.8468468468468469 and parameters: {'objective': 'Logloss', 'colsample_bylevel': 0.08922452372114204, 'depth': 10, 'boosting_type': 'Plain', 'bootstrap_type': 'Bayesian', 'bagging_temperature': 5.3026103294818}. Best is trial 1464 with value: 0.8990825688073395.
[32m[I 2023-04-20 23:56:36,246][39m Trial 2807 finished with value: 0.8727272727272727 and parameters: {'objective': 'Logloss', 'colsample_bylevel': 0.0996846864070717, 'depth': 8, 'boosting_type': 'Plain', 'bootstrap_type': 'Bayesian', 'bagging_temperature': 6.777306954015354}. Best is trial 1464 with value: 0.8990825688073395.
[32m[I 2023-04-20 23:56:37,010][39m Trial 2808 finished with value: 0.8448275862068967 and parameters: {'objective': 'Logloss', 'colsample_bylevel': 0.06477125836543352, 'depth': 9, 'boosting_type': 'Plain', 'bootstrap_type': 'Bayesian', 'bagging_temperature': 4.813233231884786}. Best is trial 1464 with value: 0.8990825688073395.
[32m[I 2023-04-20 23:56:38,250][39m Trial 2809 finished with value: 0.8807339449541284 and parameters: {'objective': 'Logloss', 'colsample_bylevel': 0.09662827418459277, 'depth': 7, 'boosting_type': 'Plain', 'bootstrap_type': 'Bayesian', 'bagging_temperature': 5.645505066349908}. Best is trial 1464 with value: 0.8990825688073395.
[32m[I 2023-04-20 23:56:39,812][39m Trial 2810 finished with value: 0.8807339449541284 and parameters: {'objective': 'Logloss', 'colsample_bylevel': 0.0952085576536755, 'depth': 9, 'boosting_type': 'Plain', 'bootstrap_type': 'Bayesian', 'bagging_temperature': 6.70422089696316}. Best is trial 1464 with value: 0.8990825688073395.
[32m[I 2023-04-20 23:56:40,856][39m Trial 2811 finished with value: 0.875 and parameters: {'objective': 'CrossEntropy', 'colsample_bylevel': 0.09078875403022772, 'depth': 10, 'boosting_type': 'Plain', 'bootstrap_type': 'Bayesian', 'bagging_temperature': 6.7234214100442875}. Best is trial 1464 with value: 0.8990825688073395.
[32m[I 2023-04-20 23:56:45,856][39m Trial 2812 finished with value: 0.8495575221238938 and parameters: {'objective': 'Logloss', 'colsample_bylevel': 0.0951944177808024, 'depth': 9, 'boosting_type': 'Ordered', 'bootstrap_type': 'Bayesian', 'bagging_temperature': 4.435126447977831}. Best is trial 1464 with value: 0.8990825688073395.
[32m[I 2023-04-20 23:56:47,216][39m Trial 2813 finished with value: 0.8727272727272727 and parameters: {'objective': 'CrossEntropy', 'colsample_bylevel': 0.0964881427688048, 'depth': 9, 'boosting_type': 'Plain', 'bootstrap_type': 'Bayesian', 'bagging_temperature': 5.136203856303015}. Best is trial 1464 with value: 0.8990825688073395.
[32m[I 2023-04-20 23:56:48,485][39m Trial 2814 finished with value: 0.8672566371681416 and parameters: {'objective': 'CrossEntropy', 'colsample_bylevel': 0.09864408470702225, 'depth': 9, 'boosting_type': 'Plain', 'bootstrap_type': 'MVS'}. Best is trial 1464 with value: 0.8990825688073395.
[32m[I 2023-04-20 23:56:49,523][39m Trial 2815 finished with value: 0.8807339449541284 and parameters: {'objective': 'CrossEntropy', 'colsample_bylevel': 0.09727982549356377, 'depth': 8, 'boosting_type': 'Plain', 'bootstrap_type': 'Bayesian', 'bagging_temperature': 4.954656355360673}. Best is trial 1464 with value: 0.8990825688073395.
[32m[I 2023-04-20 23:56:50,417][39m Trial 2816 finished with value: 0.8807339449541284 and parameters: {'objective': 'CrossEntropy', 'colsample_bylevel': 0.09462360569854995, 'depth': 9, 'boosting_type': 'Plain', 'bootstrap_type': 'Bayesian', 'bagging_temperature': 6.625010435121301}. Best is trial 1464 with value: 0.8990825688073395.
[32m[I 2023-04-20 23:56:50,974][39m Trial 2817 finished with value: 0.8807339449541284 and parameters: {'objective': 'CrossEntropy', 'colsample_bylevel': 0.09220791537682277, 'depth': 10, 'boosting_type': 'Plain', 'bootstrap_type': 'Bayesian', 'bagging_temperature': 7.04772127048868}. Best is trial 1464 with value: 0.8990825688073395.
[32m[I 2023-04-20 23:56:52,022][39m Trial 2818 finished with value: 0.888888888888889 and parameters: {'objective': 'Logloss', 'colsample_bylevel': 0.09714624285300878, 'depth': 8, 'boosting_type': 'Plain', 'bootstrap_type': 'Bayesian', 'bagging_temperature': 5.449071192043589}. Best is trial 1464 with value: 0.8990825688073395.
[32m[I 2023-04-20 23:56:53,345][39m Trial 2819 finished with value: 0.8807339449541284 and parameters: {'objective': 'Logloss', 'colsample_bylevel': 0.0925237517964803, 'depth': 9, 'boosting_type': 'Plain', 'bootstrap_type': 'Bayesian', 'bagging_temperature': 4.62201656776442}. Best is trial 1464 with value: 0.8990825688073395.
[32m[I 2023-04-20 23:56:54,847][39m Trial 2820 finished with value: 0.8727272727272727 and parameters: {'objective': 'CrossEntropy', 'colsample_bylevel': 0.0975221416322644, 'depth': 9, 'boosting_type': 'Plain', 'bootstrap_type': 'Bayesian', 'bagging_temperature': 4.4386652211782565}. Best is trial 1464 with value: 0.8990825688073395.
[32m[I 2023-04-20 23:56:55,635][39m Trial 2821 finished with value: 0.8623853211009175 and parameters: {'objective': 'Logloss', 'colsample_bylevel': 0.09597250905590106, 'depth': 7, 'boosting_type': 'Plain', 'bootstrap_type': 'Bayesian', 'bagging_temperature': 6.554268866887386}. Best is trial 1464 with value: 0.8990825688073395.
[32m[I 2023-04-20 23:56:57,179][39m Trial 2822 finished with value: 0.8807339449541284 and parameters: {'objective': 'Logloss', 'colsample_bylevel': 0.0971619560921334, 'depth': 9, 'boosting_type': 'Plain', 'bootstrap_type': 'Bayesian', 'bagging_temperature': 6.9148090820045525}. Best is trial 1464 with value: 0.8990825688073395.
[32m[I 2023-04-20 23:56:58,008][39m Trial 2823 finished with value: 0.8807339449541284 and parameters: {'objective': 'CrossEntropy', 'colsample_bylevel': 0.0941575351482635, 'depth': 9, 'boosting_type': 'Plain', 'bootstrap_type': 'Bayesian', 'bagging_temperature': 6.472400947881565}. Best is trial 1464 with value: 0.8990825688073395.
[32m[I 2023-04-20 23:56:58,761][39m Trial 2824 finished with value: 0.8623853211009175 and parameters: {'objective': 'Logloss', 'colsample_bylevel': 0.0999956848696764, 'depth': 8, 'boosting_type': 'Plain', 'bootstrap_type': 'Bayesian', 'bagging_temperature': 5.103007201846483}. Best is trial 1464 with value: 0.8990825688073395.
[32m[I 2023-04-20 23:56:59,773][39m Trial 2825 finished with value: 0.888888888888889 and parameters: {'objective': 'Logloss', 'colsample_bylevel': 0.0937886732955274, 'depth': 11, 'boosting_type': 'Plain', 'bootstrap_type': 'Bayesian', 'bagging_temperature': 4.52884522879448}. Best is trial 1464 with value: 0.8990825688073395.
[32m[I 2023-04-20 23:57:00,854][39m Trial 2826 finished with value: 0.8305084745762712 and parameters: {'objective': 'CrossEntropy', 'colsample_bylevel': 0.050234912514291574, 'depth': 10, 'boosting_type': 'Plain', 'bootstrap_type': 'Bayesian', 'bagging_temperature': 5.424818807631265}. Best is trial 1464 with value: 0.8990825688073395.
[32m[I 2023-04-20 23:57:01,948][39m Trial 2827 finished with value: 0.8727272727272727 and parameters: {'objective': 'CrossEntropy', 'colsample_bylevel': 0.08845375352514998, 'depth': 10, 'boosting_type': 'Plain', 'bootstrap_type': 'Bayesian', 'bagging_temperature': 5.704221617855208}. Best is trial 1464 with value: 0.8990825688073395.
[32m[I 2023-04-20 23:57:03,302][39m Trial 2828 finished with value: 0.8703703703703703 and parameters: {'objective': 'CrossEntropy', 'colsample_bylevel': 0.09541327762996578, 'depth': 9, 'boosting_type': 'Plain', 'bootstrap_type': 'Bayesian', 'bagging_temperature': 6.553282669218649}. Best is trial 1464 with value: 0.8990825688073395.
[32m[I 2023-04-20 23:57:04,908][39m Trial 2829 finished with value: 0.8727272727272727 and parameters: {'objective': 'Logloss', 'colsample_bylevel': 0.09313476648676483, 'depth': 9, 'boosting_type': 'Plain', 'bootstrap_type': 'Bayesian', 'bagging_temperature': 5.038108223632144}. Best is trial 1464 with value: 0.8990825688073395.
[32m[I 2023-04-20 23:57:05,629][39m Trial 2830 finished with value: 0.8807339449541284 and parameters: {'objective': 'Logloss', 'colsample_bylevel': 0.09492789370974387, 'depth': 7, 'boosting_type': 'Plain', 'bootstrap_type': 'Bayesian', 'bagging_temperature': 5.642794192047258}. Best is trial 1464 with value: 0.8990825688073395.
[32m[I 2023-04-20 23:57:10,949][39m Trial 2831 finished with value: 0.8421052631578947 and parameters: {'objective': 'CrossEntropy', 'colsample_bylevel': 0.09172743301548575, 'depth': 11, 'boosting_type': 'Ordered', 'bootstrap_type': 'Bayesian', 'bagging_temperature': 4.737612593875185}. Best is trial 1464 with value: 0.8990825688073395.
