[32m[I 2023-04-20 23:49:54,298][39m Trial 2504 finished with value: 0.8727272727272727 and parameters: {'objective': 'CrossEntropy', 'colsample_bylevel': 0.08924988197529432, 'depth': 9, 'boosting_type': 'Plain', 'bootstrap_type': 'Bayesian', 'bagging_temperature': 4.705572784199002}. Best is trial 1464 with value: 0.8990825688073395.
[32m[I 2023-04-20 23:49:55,039][39m Trial 2505 finished with value: 0.8672566371681416 and parameters: {'objective': 'CrossEntropy', 'colsample_bylevel': 0.0984159415751502, 'depth': 12, 'boosting_type': 'Plain', 'bootstrap_type': 'Bernoulli', 'subsample': 0.6691048293712255}. Best is trial 1464 with value: 0.8990825688073395.
[32m[I 2023-04-20 23:49:55,895][39m Trial 2506 finished with value: 0.8727272727272727 and parameters: {'objective': 'CrossEntropy', 'colsample_bylevel': 0.09626363289999197, 'depth': 7, 'boosting_type': 'Plain', 'bootstrap_type': 'Bayesian', 'bagging_temperature': 4.888921669679233}. Best is trial 1464 with value: 0.8990825688073395.
[32m[I 2023-04-20 23:49:57,678][39m Trial 2507 finished with value: 0.8495575221238938 and parameters: {'objective': 'Logloss', 'colsample_bylevel': 0.08267413299011359, 'depth': 9, 'boosting_type': 'Plain', 'bootstrap_type': 'Bayesian', 'bagging_temperature': 4.80961588149485}. Best is trial 1464 with value: 0.8990825688073395.
[32m[I 2023-04-20 23:49:58,415][39m Trial 2508 finished with value: 0.8392857142857144 and parameters: {'objective': 'Logloss', 'colsample_bylevel': 0.07863898832236788, 'depth': 9, 'boosting_type': 'Plain', 'bootstrap_type': 'Bayesian', 'bagging_temperature': 4.86487480469061}. Best is trial 1464 with value: 0.8990825688073395.
[32m[I 2023-04-20 23:49:59,238][39m Trial 2509 finished with value: 0.8571428571428572 and parameters: {'objective': 'Logloss', 'colsample_bylevel': 0.0879229659396625, 'depth': 8, 'boosting_type': 'Plain', 'bootstrap_type': 'Bayesian', 'bagging_temperature': 5.081844617379194}. Best is trial 1464 with value: 0.8990825688073395.
[32m[I 2023-04-20 23:50:04,623][39m Trial 2510 finished with value: 0.8495575221238938 and parameters: {'objective': 'Logloss', 'colsample_bylevel': 0.08823433738775299, 'depth': 8, 'boosting_type': 'Ordered', 'bootstrap_type': 'Bayesian', 'bagging_temperature': 6.125066249296043}. Best is trial 1464 with value: 0.8990825688073395.
[32m[I 2023-04-20 23:50:06,457][39m Trial 2511 finished with value: 0.8727272727272727 and parameters: {'objective': 'Logloss', 'colsample_bylevel': 0.09626159850558688, 'depth': 9, 'boosting_type': 'Plain', 'bootstrap_type': 'Bayesian', 'bagging_temperature': 4.52879503362147}. Best is trial 1464 with value: 0.8990825688073395.
[32m[I 2023-04-20 23:50:08,034][39m Trial 2512 finished with value: 0.8648648648648648 and parameters: {'objective': 'Logloss', 'colsample_bylevel': 0.09898304549421702, 'depth': 9, 'boosting_type': 'Plain', 'bootstrap_type': 'Bayesian', 'bagging_temperature': 1.0961011513159065}. Best is trial 1464 with value: 0.8990825688073395.
[32m[I 2023-04-20 23:50:09,028][39m Trial 2513 finished with value: 0.8648648648648648 and parameters: {'objective': 'Logloss', 'colsample_bylevel': 0.09383863190412134, 'depth': 9, 'boosting_type': 'Plain', 'bootstrap_type': 'Bayesian', 'bagging_temperature': 5.015855281610254}. Best is trial 1464 with value: 0.8990825688073395.
[32m[I 2023-04-20 23:50:09,701][39m Trial 2514 finished with value: 0.8495575221238938 and parameters: {'objective': 'Logloss', 'colsample_bylevel': 0.0954449886094874, 'depth': 4, 'boosting_type': 'Plain', 'bootstrap_type': 'Bayesian', 'bagging_temperature': 5.093208309120525}. Best is trial 1464 with value: 0.8990825688073395.
[32m[I 2023-04-20 23:50:10,962][39m Trial 2515 finished with value: 0.8807339449541284 and parameters: {'objective': 'CrossEntropy', 'colsample_bylevel': 0.09264126799104114, 'depth': 12, 'boosting_type': 'Plain', 'bootstrap_type': 'Bayesian', 'bagging_temperature': 4.469388623524683}. Best is trial 1464 with value: 0.8990825688073395.
[32m[I 2023-04-20 23:50:12,006][39m Trial 2516 finished with value: 0.8807339449541284 and parameters: {'objective': 'Logloss', 'colsample_bylevel': 0.09038274381597965, 'depth': 11, 'boosting_type': 'Plain', 'bootstrap_type': 'Bayesian', 'bagging_temperature': 7.484532799675042}. Best is trial 1464 with value: 0.8990825688073395.
[32m[I 2023-04-20 23:50:13,237][39m Trial 2517 finished with value: 0.8807339449541284 and parameters: {'objective': 'CrossEntropy', 'colsample_bylevel': 0.09057242386341918, 'depth': 10, 'boosting_type': 'Plain', 'bootstrap_type': 'Bayesian', 'bagging_temperature': 4.735027275902644}. Best is trial 1464 with value: 0.8990825688073395.
[32m[I 2023-04-20 23:50:14,286][39m Trial 2518 finished with value: 0.8807339449541284 and parameters: {'objective': 'Logloss', 'colsample_bylevel': 0.09999218055468316, 'depth': 12, 'boosting_type': 'Plain', 'bootstrap_type': 'Bayesian', 'bagging_temperature': 4.872197117323444}. Best is trial 1464 with value: 0.8990825688073395.
[32m[I 2023-04-20 23:50:14,810][39m Trial 2519 finished with value: 0.8571428571428572 and parameters: {'objective': 'CrossEntropy', 'colsample_bylevel': 0.0901192340415419, 'depth': 6, 'boosting_type': 'Plain', 'bootstrap_type': 'MVS'}. Best is trial 1464 with value: 0.8990825688073395.
[32m[I 2023-04-20 23:50:15,546][39m Trial 2520 finished with value: 0.8785046728971961 and parameters: {'objective': 'Logloss', 'colsample_bylevel': 0.09232704131374092, 'depth': 8, 'boosting_type': 'Plain', 'bootstrap_type': 'Bayesian', 'bagging_temperature': 5.24786294980239}. Best is trial 1464 with value: 0.8990825688073395.
[32m[I 2023-04-20 23:50:16,789][39m Trial 2521 finished with value: 0.8828828828828829 and parameters: {'objective': 'Logloss', 'colsample_bylevel': 0.09573400314151206, 'depth': 9, 'boosting_type': 'Plain', 'bootstrap_type': 'Bayesian', 'bagging_temperature': 3.6227418884865648}. Best is trial 1464 with value: 0.8990825688073395.
[32m[I 2023-04-20 23:50:18,323][39m Trial 2522 finished with value: 0.8648648648648648 and parameters: {'objective': 'CrossEntropy', 'colsample_bylevel': 0.08693494869576665, 'depth': 9, 'boosting_type': 'Plain', 'bootstrap_type': 'Bayesian', 'bagging_temperature': 5.481952990101759}. Best is trial 1464 with value: 0.8990825688073395.
[32m[I 2023-04-20 23:50:19,697][39m Trial 2523 finished with value: 0.8727272727272727 and parameters: {'objective': 'Logloss', 'colsample_bylevel': 0.09721405469279654, 'depth': 9, 'boosting_type': 'Plain', 'bootstrap_type': 'Bayesian', 'bagging_temperature': 4.788028951914959}. Best is trial 1464 with value: 0.8990825688073395.
[32m[I 2023-04-20 23:50:20,430][39m Trial 2524 finished with value: 0.6727272727272728 and parameters: {'objective': 'Logloss', 'colsample_bylevel': 0.010792164981940876, 'depth': 9, 'boosting_type': 'Plain', 'bootstrap_type': 'Bayesian', 'bagging_temperature': 4.680862474395794}. Best is trial 1464 with value: 0.8990825688073395.
[32m[I 2023-04-20 23:50:21,913][39m Trial 2525 finished with value: 0.8727272727272727 and parameters: {'objective': 'CrossEntropy', 'colsample_bylevel': 0.09452493132281915, 'depth': 9, 'boosting_type': 'Plain', 'bootstrap_type': 'Bayesian', 'bagging_temperature': 4.5212405660798}. Best is trial 1464 with value: 0.8990825688073395.
[32m[I 2023-04-20 23:50:22,978][39m Trial 2526 finished with value: 0.8828828828828829 and parameters: {'objective': 'CrossEntropy', 'colsample_bylevel': 0.08443236915435862, 'depth': 10, 'boosting_type': 'Plain', 'bootstrap_type': 'Bayesian', 'bagging_temperature': 5.306253374707262}. Best is trial 1464 with value: 0.8990825688073395.
[32m[I 2023-04-20 23:50:23,892][39m Trial 2527 finished with value: 0.8623853211009175 and parameters: {'objective': 'CrossEntropy', 'colsample_bylevel': 0.09521581716886356, 'depth': 9, 'boosting_type': 'Plain', 'bootstrap_type': 'Bayesian', 'bagging_temperature': 6.137201547489546}. Best is trial 1464 with value: 0.8990825688073395.
[32m[I 2023-04-20 23:50:25,052][39m Trial 2528 finished with value: 0.8727272727272727 and parameters: {'objective': 'CrossEntropy', 'colsample_bylevel': 0.08968521346593383, 'depth': 10, 'boosting_type': 'Plain', 'bootstrap_type': 'Bayesian', 'bagging_temperature': 4.674495719127237}. Best is trial 1464 with value: 0.8990825688073395.
[32m[I 2023-04-20 23:50:30,016][39m Trial 2529 finished with value: 0.8623853211009175 and parameters: {'objective': 'Logloss', 'colsample_bylevel': 0.0968613239190869, 'depth': 9, 'boosting_type': 'Ordered', 'bootstrap_type': 'Bayesian', 'bagging_temperature': 4.796247626628792}. Best is trial 1464 with value: 0.8990825688073395.
[32m[I 2023-04-20 23:50:31,465][39m Trial 2530 finished with value: 0.8703703703703703 and parameters: {'objective': 'Logloss', 'colsample_bylevel': 0.09367300149602893, 'depth': 8, 'boosting_type': 'Plain', 'bootstrap_type': 'Bayesian', 'bagging_temperature': 6.639667227762167}. Best is trial 1464 with value: 0.8990825688073395.
[32m[I 2023-04-20 23:50:32,673][39m Trial 2531 finished with value: 0.8648648648648648 and parameters: {'objective': 'CrossEntropy', 'colsample_bylevel': 0.08200354069083185, 'depth': 10, 'boosting_type': 'Plain', 'bootstrap_type': 'Bayesian', 'bagging_temperature': 5.658338859019354}. Best is trial 1464 with value: 0.8990825688073395.
[32m[I 2023-04-20 23:50:33,594][39m Trial 2532 finished with value: 0.8623853211009175 and parameters: {'objective': 'Logloss', 'colsample_bylevel': 0.09716886303719112, 'depth': 7, 'boosting_type': 'Plain', 'bootstrap_type': 'Bayesian', 'bagging_temperature': 4.416027929367017}. Best is trial 1464 with value: 0.8990825688073395.
[32m[I 2023-04-20 23:50:34,309][39m Trial 2533 finished with value: 0.8807339449541284 and parameters: {'objective': 'CrossEntropy', 'colsample_bylevel': 0.08622056882258844, 'depth': 10, 'boosting_type': 'Plain', 'bootstrap_type': 'Bayesian', 'bagging_temperature': 5.482466937504443}. Best is trial 1464 with value: 0.8990825688073395.
[32m[I 2023-04-20 23:50:35,835][39m Trial 2534 finished with value: 0.8727272727272727 and parameters: {'objective': 'CrossEntropy', 'colsample_bylevel': 0.098155921980974, 'depth': 9, 'boosting_type': 'Plain', 'bootstrap_type': 'Bayesian', 'bagging_temperature': 4.26616139872352}. Best is trial 1464 with value: 0.8990825688073395.
[32m[I 2023-04-20 23:50:37,259][39m Trial 2535 finished with value: 0.8703703703703703 and parameters: {'objective': 'Logloss', 'colsample_bylevel': 0.08895586610495992, 'depth': 9, 'boosting_type': 'Plain', 'bootstrap_type': 'Bayesian', 'bagging_temperature': 5.27899726164028}. Best is trial 1464 with value: 0.8990825688073395.
[32m[I 2023-04-20 23:50:38,331][39m Trial 2536 finished with value: 0.8807339449541284 and parameters: {'objective': 'Logloss', 'colsample_bylevel': 0.09865662734031694, 'depth': 8, 'boosting_type': 'Plain', 'bootstrap_type': 'Bayesian', 'bagging_temperature': 5.06582717099532}. Best is trial 1464 with value: 0.8990825688073395.
[32m[I 2023-04-20 23:50:39,683][39m Trial 2537 finished with value: 0.888888888888889 and parameters: {'objective': 'Logloss', 'colsample_bylevel': 0.09706114064634971, 'depth': 8, 'boosting_type': 'Plain', 'bootstrap_type': 'Bayesian', 'bagging_temperature': 4.53821557572355}. Best is trial 1464 with value: 0.8990825688073395.
[32m[I 2023-04-20 23:50:40,419][39m Trial 2538 finished with value: 0.8727272727272727 and parameters: {'objective': 'Logloss', 'colsample_bylevel': 0.09630848062850159, 'depth': 8, 'boosting_type': 'Plain', 'bootstrap_type': 'Bayesian', 'bagging_temperature': 7.216900158825219}. Best is trial 1464 with value: 0.8990825688073395.
[32m[I 2023-04-20 23:50:41,417][39m Trial 2539 finished with value: 0.8495575221238938 and parameters: {'objective': 'Logloss', 'colsample_bylevel': 0.09419711500702824, 'depth': 9, 'boosting_type': 'Plain', 'bootstrap_type': 'MVS'}. Best is trial 1464 with value: 0.8990825688073395.
[32m[I 2023-04-20 23:50:43,231][39m Trial 2540 finished with value: 0.8807339449541284 and parameters: {'objective': 'Logloss', 'colsample_bylevel': 0.09530730004895793, 'depth': 9, 'boosting_type': 'Plain', 'bootstrap_type': 'Bayesian', 'bagging_temperature': 4.871316661834308}. Best is trial 1464 with value: 0.8990825688073395.
[32m[I 2023-04-20 23:50:44,311][39m Trial 2541 finished with value: 0.8807339449541284 and parameters: {'objective': 'Logloss', 'colsample_bylevel': 0.09566042936214174, 'depth': 7, 'boosting_type': 'Plain', 'bootstrap_type': 'Bayesian', 'bagging_temperature': 6.43819594313373}. Best is trial 1464 with value: 0.8990825688073395.
[32m[I 2023-04-20 23:50:45,682][39m Trial 2542 finished with value: 0.888888888888889 and parameters: {'objective': 'CrossEntropy', 'colsample_bylevel': 0.09833190127248648, 'depth': 8, 'boosting_type': 'Plain', 'bootstrap_type': 'Bayesian', 'bagging_temperature': 5.086575094105059}. Best is trial 1464 with value: 0.8990825688073395.
[32m[I 2023-04-20 23:50:46,358][39m Trial 2543 finished with value: 0.8727272727272727 and parameters: {'objective': 'Logloss', 'colsample_bylevel': 0.09274122975608423, 'depth': 10, 'boosting_type': 'Plain', 'bootstrap_type': 'Bayesian', 'bagging_temperature': 8.418640294348403}. Best is trial 1464 with value: 0.8990825688073395.
[32m[I 2023-04-20 23:50:47,917][39m Trial 2544 finished with value: 0.888888888888889 and parameters: {'objective': 'CrossEntropy', 'colsample_bylevel': 0.09434366590598545, 'depth': 9, 'boosting_type': 'Plain', 'bootstrap_type': 'Bayesian', 'bagging_temperature': 5.75804720032525}. Best is trial 1464 with value: 0.8990825688073395.
[32m[I 2023-04-20 23:50:48,930][39m Trial 2545 finished with value: 0.8727272727272727 and parameters: {'objective': 'CrossEntropy', 'colsample_bylevel': 0.0843582815282342, 'depth': 10, 'boosting_type': 'Plain', 'bootstrap_type': 'Bayesian', 'bagging_temperature': 6.321133240282675}. Best is trial 1464 with value: 0.8990825688073395.
[32m[I 2023-04-20 23:50:49,845][39m Trial 2546 finished with value: 0.8596491228070176 and parameters: {'objective': 'Logloss', 'colsample_bylevel': 0.0895263096726418, 'depth': 10, 'boosting_type': 'Plain', 'bootstrap_type': 'Bayesian', 'bagging_temperature': 5.482327622774781}. Best is trial 1464 with value: 0.8990825688073395.
[32m[I 2023-04-20 23:50:50,592][39m Trial 2547 finished with value: 0.8596491228070176 and parameters: {'objective': 'CrossEntropy', 'colsample_bylevel': 0.08560552574162242, 'depth': 9, 'boosting_type': 'Plain', 'bootstrap_type': 'Bayesian', 'bagging_temperature': 6.669932575564846}. Best is trial 1464 with value: 0.8990825688073395.
[32m[I 2023-04-20 23:50:51,917][39m Trial 2548 finished with value: 0.8807339449541284 and parameters: {'objective': 'CrossEntropy', 'colsample_bylevel': 0.08799213345196237, 'depth': 9, 'boosting_type': 'Plain', 'bootstrap_type': 'Bayesian', 'bagging_temperature': 4.867363801307488}. Best is trial 1464 with value: 0.8990825688073395.
[32m[I 2023-04-20 23:50:57,155][39m Trial 2549 finished with value: 0.8545454545454546 and parameters: {'objective': 'CrossEntropy', 'colsample_bylevel': 0.09124982286964482, 'depth': 10, 'boosting_type': 'Ordered', 'bootstrap_type': 'Bayesian', 'bagging_temperature': 4.992211080224663}. Best is trial 1464 with value: 0.8990825688073395.
[32m[I 2023-04-20 23:50:58,667][39m Trial 2550 finished with value: 0.8807339449541284 and parameters: {'objective': 'Logloss', 'colsample_bylevel': 0.09552243814425507, 'depth': 9, 'boosting_type': 'Plain', 'bootstrap_type': 'Bayesian', 'bagging_temperature': 4.837603398019218}. Best is trial 1464 with value: 0.8990825688073395.
[32m[I 2023-04-20 23:50:59,749][39m Trial 2551 finished with value: 0.8807339449541284 and parameters: {'objective': 'CrossEntropy', 'colsample_bylevel': 0.09229953350248059, 'depth': 7, 'boosting_type': 'Plain', 'bootstrap_type': 'Bayesian', 'bagging_temperature': 6.029391917880696}. Best is trial 1464 with value: 0.8990825688073395.
[32m[I 2023-04-20 23:51:00,647][39m Trial 2552 finished with value: 0.8623853211009175 and parameters: {'objective': 'CrossEntropy', 'colsample_bylevel': 0.09150768135785417, 'depth': 9, 'boosting_type': 'Plain', 'bootstrap_type': 'Bayesian', 'bagging_temperature': 4.5430088248975595}. Best is trial 1464 with value: 0.8990825688073395.
[32m[I 2023-04-20 23:51:02,184][39m Trial 2553 finished with value: 0.8807339449541284 and parameters: {'objective': 'Logloss', 'colsample_bylevel': 0.0930945635310936, 'depth': 9, 'boosting_type': 'Plain', 'bootstrap_type': 'Bayesian', 'bagging_temperature': 5.5948988252706435}. Best is trial 1464 with value: 0.8990825688073395.
[32m[I 2023-04-20 23:51:03,329][39m Trial 2554 finished with value: 0.8495575221238938 and parameters: {'objective': 'CrossEntropy', 'colsample_bylevel': 0.0857854647598929, 'depth': 10, 'boosting_type': 'Plain', 'bootstrap_type': 'Bernoulli', 'subsample': 0.987714781021936}. Best is trial 1464 with value: 0.8990825688073395.
[32m[I 2023-04-20 23:51:04,505][39m Trial 2555 finished with value: 0.8807339449541284 and parameters: {'objective': 'Logloss', 'colsample_bylevel': 0.09729713065151008, 'depth': 9, 'boosting_type': 'Plain', 'bootstrap_type': 'Bayesian', 'bagging_temperature': 5.983582016286147}. Best is trial 1464 with value: 0.8990825688073395.
[32m[I 2023-04-20 23:51:05,697][39m Trial 2556 finished with value: 0.8807339449541284 and parameters: {'objective': 'Logloss', 'colsample_bylevel': 0.09281303842505416, 'depth': 8, 'boosting_type': 'Plain', 'bootstrap_type': 'Bayesian', 'bagging_temperature': 5.227092910145593}. Best is trial 1464 with value: 0.8990825688073395.
[32m[I 2023-04-20 23:51:06,553][39m Trial 2557 finished with value: 0.875 and parameters: {'objective': 'CrossEntropy', 'colsample_bylevel': 0.09367393198992108, 'depth': 9, 'boosting_type': 'Plain', 'bootstrap_type': 'Bayesian', 'bagging_temperature': 6.459509946820257}. Best is trial 1464 with value: 0.8990825688073395.
[32m[I 2023-04-20 23:51:07,724][39m Trial 2558 finished with value: 0.888888888888889 and parameters: {'objective': 'Logloss', 'colsample_bylevel': 0.0999379573383639, 'depth': 8, 'boosting_type': 'Plain', 'bootstrap_type': 'Bayesian', 'bagging_temperature': 5.062842674109258}. Best is trial 1464 with value: 0.8990825688073395.
[32m[I 2023-04-20 23:51:08,699][39m Trial 2559 finished with value: 0.8807339449541284 and parameters: {'objective': 'CrossEntropy', 'colsample_bylevel': 0.09001223196902407, 'depth': 11, 'boosting_type': 'Plain', 'bootstrap_type': 'Bayesian', 'bagging_temperature': 5.817333256201942}. Best is trial 1464 with value: 0.8990825688073395.
[32m[I 2023-04-20 23:51:10,186][39m Trial 2560 finished with value: 0.8807339449541284 and parameters: {'objective': 'Logloss', 'colsample_bylevel': 0.09846177222233865, 'depth': 8, 'boosting_type': 'Plain', 'bootstrap_type': 'Bayesian', 'bagging_temperature': 5.310260307941827}. Best is trial 1464 with value: 0.8990825688073395.
[32m[I 2023-04-20 23:51:11,160][39m Trial 2561 finished with value: 0.8807339449541284 and parameters: {'objective': 'CrossEntropy', 'colsample_bylevel': 0.08423291816116325, 'depth': 9, 'boosting_type': 'Plain', 'bootstrap_type': 'Bayesian', 'bagging_temperature': 5.511659847473442}. Best is trial 1464 with value: 0.8990825688073395.
[32m[I 2023-04-20 23:51:11,843][39m Trial 2562 finished with value: 0.8571428571428572 and parameters: {'objective': 'CrossEntropy', 'colsample_bylevel': 0.0914379739043563, 'depth': 10, 'boosting_type': 'Plain', 'bootstrap_type': 'MVS'}. Best is trial 1464 with value: 0.8990825688073395.
[32m[I 2023-04-20 23:51:12,859][39m Trial 2563 finished with value: 0.8727272727272727 and parameters: {'objective': 'CrossEntropy', 'colsample_bylevel': 0.09681369990682834, 'depth': 7, 'boosting_type': 'Plain', 'bootstrap_type': 'Bernoulli', 'subsample': 0.5692643001686756}. Best is trial 1464 with value: 0.8990825688073395.
[32m[I 2023-04-20 23:51:14,012][39m Trial 2564 finished with value: 0.8421052631578947 and parameters: {'objective': 'Logloss', 'colsample_bylevel': 0.03032636298923368, 'depth': 11, 'boosting_type': 'Plain', 'bootstrap_type': 'Bayesian', 'bagging_temperature': 6.298797385013683}. Best is trial 1464 with value: 0.8990825688073395.
[32m[I 2023-04-20 23:51:14,899][39m Trial 2565 finished with value: 0.888888888888889 and parameters: {'objective': 'CrossEntropy', 'colsample_bylevel': 0.09584372223619073, 'depth': 9, 'boosting_type': 'Plain', 'bootstrap_type': 'Bayesian', 'bagging_temperature': 6.373146868324124}. Best is trial 1464 with value: 0.8990825688073395.
[32m[I 2023-04-20 23:51:16,147][39m Trial 2566 finished with value: 0.8495575221238938 and parameters: {'objective': 'CrossEntropy', 'colsample_bylevel': 0.08511020883906494, 'depth': 10, 'boosting_type': 'Plain', 'bootstrap_type': 'Bayesian', 'bagging_temperature': 5.144710618084277}. Best is trial 1464 with value: 0.8990825688073395.
[32m[I 2023-04-20 23:51:21,138][39m Trial 2567 finished with value: 0.8521739130434783 and parameters: {'objective': 'CrossEntropy', 'colsample_bylevel': 0.08752816400895706, 'depth': 11, 'boosting_type': 'Ordered', 'bootstrap_type': 'Bayesian', 'bagging_temperature': 5.377014932832922}. Best is trial 1464 with value: 0.8990825688073395.
[32m[I 2023-04-20 23:51:22,366][39m Trial 2568 finished with value: 0.8376068376068375 and parameters: {'objective': 'CrossEntropy', 'colsample_bylevel': 0.04561300918741071, 'depth': 9, 'boosting_type': 'Plain', 'bootstrap_type': 'Bayesian', 'bagging_temperature': 4.610192380031741}. Best is trial 1464 with value: 0.8990825688073395.
