[32m[I 2023-04-21 01:09:06,584][39m Trial 5985 finished with value: 0.8623853211009175 and parameters: {'objective': 'Logloss', 'colsample_bylevel': 0.09152713166307105, 'depth': 9, 'boosting_type': 'Plain', 'bootstrap_type': 'Bayesian', 'bagging_temperature': 5.3893975360425115}. Best is trial 1464 with value: 0.8990825688073395.
[32m[I 2023-04-21 01:09:08,051][39m Trial 5986 finished with value: 0.8727272727272727 and parameters: {'objective': 'Logloss', 'colsample_bylevel': 0.09430592650401408, 'depth': 9, 'boosting_type': 'Plain', 'bootstrap_type': 'Bayesian', 'bagging_temperature': 5.654667562573635}. Best is trial 1464 with value: 0.8990825688073395.
[32m[I 2023-04-21 01:09:09,765][39m Trial 5987 finished with value: 0.8807339449541284 and parameters: {'objective': 'Logloss', 'colsample_bylevel': 0.09747470870257476, 'depth': 9, 'boosting_type': 'Plain', 'bootstrap_type': 'Bayesian', 'bagging_temperature': 5.1749835516250355}. Best is trial 1464 with value: 0.8990825688073395.
[32m[I 2023-04-21 01:09:10,999][39m Trial 5988 finished with value: 0.8672566371681416 and parameters: {'objective': 'CrossEntropy', 'colsample_bylevel': 0.08644809847101469, 'depth': 12, 'boosting_type': 'Plain', 'bootstrap_type': 'Bayesian', 'bagging_temperature': 4.788199589104566}. Best is trial 1464 with value: 0.8990825688073395.
[32m[I 2023-04-21 01:09:11,802][39m Trial 5989 finished with value: 0.8828828828828829 and parameters: {'objective': 'Logloss', 'colsample_bylevel': 0.09683053733485363, 'depth': 7, 'boosting_type': 'Plain', 'bootstrap_type': 'Bayesian', 'bagging_temperature': 6.089360541128814}. Best is trial 1464 with value: 0.8990825688073395.
[32m[I 2023-04-21 01:09:12,792][39m Trial 5990 finished with value: 0.8807339449541284 and parameters: {'objective': 'Logloss', 'colsample_bylevel': 0.09286273566552783, 'depth': 12, 'boosting_type': 'Plain', 'bootstrap_type': 'Bayesian', 'bagging_temperature': 7.096954359359094}. Best is trial 1464 with value: 0.8990825688073395.
[32m[I 2023-04-21 01:09:14,163][39m Trial 5991 finished with value: 0.8807339449541284 and parameters: {'objective': 'Logloss', 'colsample_bylevel': 0.09633867966629005, 'depth': 7, 'boosting_type': 'Plain', 'bootstrap_type': 'Bayesian', 'bagging_temperature': 3.844767691752553}. Best is trial 1464 with value: 0.8990825688073395.
[32m[I 2023-04-21 01:09:15,432][39m Trial 5992 finished with value: 0.888888888888889 and parameters: {'objective': 'Logloss', 'colsample_bylevel': 0.0961936367213027, 'depth': 7, 'boosting_type': 'Plain', 'bootstrap_type': 'Bayesian', 'bagging_temperature': 3.93434127590508}. Best is trial 1464 with value: 0.8990825688073395.
[32m[I 2023-04-21 01:09:16,413][39m Trial 5993 finished with value: 0.8727272727272727 and parameters: {'objective': 'CrossEntropy', 'colsample_bylevel': 0.09180157741430683, 'depth': 11, 'boosting_type': 'Plain', 'bootstrap_type': 'Bayesian', 'bagging_temperature': 5.841316343729778}. Best is trial 1464 with value: 0.8990825688073395.
[32m[I 2023-04-21 01:09:17,255][39m Trial 5994 finished with value: 0.8703703703703703 and parameters: {'objective': 'Logloss', 'colsample_bylevel': 0.09200844123345732, 'depth': 11, 'boosting_type': 'Plain', 'bootstrap_type': 'Bayesian', 'bagging_temperature': 7.356260194091044}. Best is trial 1464 with value: 0.8990825688073395.
[32m[I 2023-04-21 01:09:18,601][39m Trial 5995 finished with value: 0.8828828828828829 and parameters: {'objective': 'Logloss', 'colsample_bylevel': 0.08996790714299334, 'depth': 7, 'boosting_type': 'Plain', 'bootstrap_type': 'Bayesian', 'bagging_temperature': 5.273566837945608}. Best is trial 1464 with value: 0.8990825688073395.
[32m[I 2023-04-21 01:09:20,610][39m Trial 5996 finished with value: 0.8807339449541284 and parameters: {'objective': 'Logloss', 'colsample_bylevel': 0.09722129593599074, 'depth': 9, 'boosting_type': 'Plain', 'bootstrap_type': 'Bayesian', 'bagging_temperature': 3.373306207338823}. Best is trial 1464 with value: 0.8990825688073395.
[32m[I 2023-04-21 01:09:21,857][39m Trial 5997 finished with value: 0.8807339449541284 and parameters: {'objective': 'CrossEntropy', 'colsample_bylevel': 0.09006615678138104, 'depth': 12, 'boosting_type': 'Plain', 'bootstrap_type': 'Bayesian', 'bagging_temperature': 6.771009209751897}. Best is trial 1464 with value: 0.8990825688073395.
[32m[I 2023-04-21 01:09:23,343][39m Trial 5998 finished with value: 0.8421052631578947 and parameters: {'objective': 'Logloss', 'colsample_bylevel': 0.0873170243181466, 'depth': 11, 'boosting_type': 'Plain', 'bootstrap_type': 'Bayesian', 'bagging_temperature': 4.138731482436702}. Best is trial 1464 with value: 0.8990825688073395.
[32m[I 2023-04-21 01:09:24,997][39m Trial 5999 finished with value: 0.8807339449541284 and parameters: {'objective': 'Logloss', 'colsample_bylevel': 0.09182174473043074, 'depth': 9, 'boosting_type': 'Plain', 'bootstrap_type': 'Bayesian', 'bagging_temperature': 5.233098542021627}. Best is trial 1464 with value: 0.8990825688073395.
[32m[I 2023-04-21 01:09:25,809][39m Trial 6000 finished with value: 0.8727272727272727 and parameters: {'objective': 'Logloss', 'colsample_bylevel': 0.08454457823838236, 'depth': 12, 'boosting_type': 'Plain', 'bootstrap_type': 'Bayesian', 'bagging_temperature': 6.8560699460595265}. Best is trial 1464 with value: 0.8990825688073395.
[32m[I 2023-04-21 01:09:30,321][39m Trial 6001 finished with value: 0.8347826086956522 and parameters: {'objective': 'Logloss', 'colsample_bylevel': 0.09438849755379292, 'depth': 8, 'boosting_type': 'Ordered', 'bootstrap_type': 'Bernoulli', 'subsample': 0.25808686352149346}. Best is trial 1464 with value: 0.8990825688073395.
[32m[I 2023-04-21 01:09:31,449][39m Trial 6002 finished with value: 0.8648648648648648 and parameters: {'objective': 'CrossEntropy', 'colsample_bylevel': 0.09858355296350275, 'depth': 6, 'boosting_type': 'Plain', 'bootstrap_type': 'Bayesian', 'bagging_temperature': 3.573734550778274}. Best is trial 1464 with value: 0.8990825688073395.
[32m[I 2023-04-21 01:09:32,861][39m Trial 6003 finished with value: 0.8521739130434783 and parameters: {'objective': 'Logloss', 'colsample_bylevel': 0.07829239619625569, 'depth': 11, 'boosting_type': 'Plain', 'bootstrap_type': 'Bayesian', 'bagging_temperature': 4.294955501819002}. Best is trial 1464 with value: 0.8990825688073395.
[32m[I 2023-04-21 01:09:33,767][39m Trial 6004 finished with value: 0.8571428571428572 and parameters: {'objective': 'CrossEntropy', 'colsample_bylevel': 0.09986333477245433, 'depth': 10, 'boosting_type': 'Plain', 'bootstrap_type': 'MVS'}. Best is trial 1464 with value: 0.8990825688073395.
[32m[I 2023-04-21 01:09:35,105][39m Trial 6005 finished with value: 0.8807339449541284 and parameters: {'objective': 'CrossEntropy', 'colsample_bylevel': 0.09852223050385348, 'depth': 10, 'boosting_type': 'Plain', 'bootstrap_type': 'Bayesian', 'bagging_temperature': 6.7356609791752415}. Best is trial 1464 with value: 0.8990825688073395.
[32m[I 2023-04-21 01:09:36,604][39m Trial 6006 finished with value: 0.8205128205128206 and parameters: {'objective': 'Logloss', 'colsample_bylevel': 0.02183944083976956, 'depth': 11, 'boosting_type': 'Plain', 'bootstrap_type': 'Bayesian', 'bagging_temperature': 5.745850803356927}. Best is trial 1464 with value: 0.8990825688073395.
[32m[I 2023-04-21 01:09:37,771][39m Trial 6007 finished with value: 0.8468468468468469 and parameters: {'objective': 'Logloss', 'colsample_bylevel': 0.09215037121980914, 'depth': 11, 'boosting_type': 'Plain', 'bootstrap_type': 'Bayesian', 'bagging_temperature': 3.589351827253454}. Best is trial 1464 with value: 0.8990825688073395.
[32m[I 2023-04-21 01:09:38,742][39m Trial 6008 finished with value: 0.8648648648648648 and parameters: {'objective': 'CrossEntropy', 'colsample_bylevel': 0.09281393687446331, 'depth': 12, 'boosting_type': 'Plain', 'bootstrap_type': 'Bayesian', 'bagging_temperature': 6.6224789680960505}. Best is trial 1464 with value: 0.8990825688073395.
[32m[I 2023-04-21 01:09:40,559][39m Trial 6009 finished with value: 0.8807339449541284 and parameters: {'objective': 'Logloss', 'colsample_bylevel': 0.09784147026655023, 'depth': 10, 'boosting_type': 'Plain', 'bootstrap_type': 'Bayesian', 'bagging_temperature': 6.615319541441401}. Best is trial 1464 with value: 0.8990825688073395.
[32m[I 2023-04-21 01:09:41,342][39m Trial 6010 finished with value: 0.8807339449541284 and parameters: {'objective': 'Logloss', 'colsample_bylevel': 0.09026907097431909, 'depth': 11, 'boosting_type': 'Plain', 'bootstrap_type': 'Bayesian', 'bagging_temperature': 5.106387159491198}. Best is trial 1464 with value: 0.8990825688073395.
[32m[I 2023-04-21 01:09:42,523][39m Trial 6011 finished with value: 0.8703703703703703 and parameters: {'objective': 'Logloss', 'colsample_bylevel': 0.08606313935094662, 'depth': 9, 'boosting_type': 'Plain', 'bootstrap_type': 'Bayesian', 'bagging_temperature': 4.574563800711078}. Best is trial 1464 with value: 0.8990825688073395.
[32m[I 2023-04-21 01:09:43,900][39m Trial 6012 finished with value: 0.8648648648648648 and parameters: {'objective': 'Logloss', 'colsample_bylevel': 0.09457962279283277, 'depth': 9, 'boosting_type': 'Plain', 'bootstrap_type': 'Bayesian', 'bagging_temperature': 6.958290964088241}. Best is trial 1464 with value: 0.8990825688073395.
[32m[I 2023-04-21 01:09:44,696][39m Trial 6013 finished with value: 0.8807339449541284 and parameters: {'objective': 'CrossEntropy', 'colsample_bylevel': 0.09632297222458586, 'depth': 8, 'boosting_type': 'Plain', 'bootstrap_type': 'Bayesian', 'bagging_temperature': 3.846851310329214}. Best is trial 1464 with value: 0.8990825688073395.
[32m[I 2023-04-21 01:09:46,126][39m Trial 6014 finished with value: 0.8785046728971961 and parameters: {'objective': 'Logloss', 'colsample_bylevel': 0.09276621653354397, 'depth': 9, 'boosting_type': 'Plain', 'bootstrap_type': 'Bayesian', 'bagging_temperature': 6.21807921299712}. Best is trial 1464 with value: 0.8990825688073395.
[32m[I 2023-04-21 01:09:47,142][39m Trial 6015 finished with value: 0.8807339449541284 and parameters: {'objective': 'Logloss', 'colsample_bylevel': 0.09684378896785636, 'depth': 9, 'boosting_type': 'Plain', 'bootstrap_type': 'Bayesian', 'bagging_temperature': 4.704459589854856}. Best is trial 1464 with value: 0.8990825688073395.
[32m[I 2023-04-21 01:09:48,729][39m Trial 6016 finished with value: 0.8727272727272727 and parameters: {'objective': 'CrossEntropy', 'colsample_bylevel': 0.09744390406874288, 'depth': 9, 'boosting_type': 'Plain', 'bootstrap_type': 'Bayesian', 'bagging_temperature': 4.446629617173071}. Best is trial 1464 with value: 0.8990825688073395.
[32m[I 2023-04-21 01:09:50,497][39m Trial 6017 finished with value: 0.888888888888889 and parameters: {'objective': 'Logloss', 'colsample_bylevel': 0.09791120103207158, 'depth': 8, 'boosting_type': 'Plain', 'bootstrap_type': 'Bayesian', 'bagging_temperature': 5.562899285277695}. Best is trial 1464 with value: 0.8990825688073395.
[32m[I 2023-04-21 01:09:51,492][39m Trial 6018 finished with value: 0.8807339449541284 and parameters: {'objective': 'Logloss', 'colsample_bylevel': 0.09835663713071284, 'depth': 7, 'boosting_type': 'Plain', 'bootstrap_type': 'Bayesian', 'bagging_temperature': 5.83148886009279}. Best is trial 1464 with value: 0.8990825688073395.
[32m[I 2023-04-21 01:09:53,370][39m Trial 6019 finished with value: 0.8727272727272727 and parameters: {'objective': 'Logloss', 'colsample_bylevel': 0.095924390156781, 'depth': 9, 'boosting_type': 'Plain', 'bootstrap_type': 'Bayesian', 'bagging_temperature': 4.615991076605089}. Best is trial 1464 with value: 0.8990825688073395.
[32m[I 2023-04-21 01:09:54,451][39m Trial 6020 finished with value: 0.8672566371681416 and parameters: {'objective': 'Logloss', 'colsample_bylevel': 0.08270059037009266, 'depth': 11, 'boosting_type': 'Plain', 'bootstrap_type': 'Bayesian', 'bagging_temperature': 7.411498902449891}. Best is trial 1464 with value: 0.8990825688073395.
[32m[I 2023-04-21 01:09:58,816][39m Trial 6021 finished with value: 0.8571428571428572 and parameters: {'objective': 'CrossEntropy', 'colsample_bylevel': 0.09848278065004741, 'depth': 9, 'boosting_type': 'Ordered', 'bootstrap_type': 'Bernoulli', 'subsample': 0.9508749584573468}. Best is trial 1464 with value: 0.8990825688073395.
[32m[I 2023-04-21 01:10:00,541][39m Trial 6022 finished with value: 0.8807339449541284 and parameters: {'objective': 'Logloss', 'colsample_bylevel': 0.09997396319284166, 'depth': 8, 'boosting_type': 'Plain', 'bootstrap_type': 'Bayesian', 'bagging_temperature': 4.424644675068196}. Best is trial 1464 with value: 0.8990825688073395.
[32m[I 2023-04-21 01:10:01,748][39m Trial 6023 finished with value: 0.8807339449541284 and parameters: {'objective': 'Logloss', 'colsample_bylevel': 0.0860444063718423, 'depth': 12, 'boosting_type': 'Plain', 'bootstrap_type': 'Bayesian', 'bagging_temperature': 5.120066242032042}. Best is trial 1464 with value: 0.8990825688073395.
[32m[I 2023-04-21 01:10:02,587][39m Trial 6024 finished with value: 0.8727272727272727 and parameters: {'objective': 'CrossEntropy', 'colsample_bylevel': 0.09103665277951746, 'depth': 12, 'boosting_type': 'Plain', 'bootstrap_type': 'Bayesian', 'bagging_temperature': 5.714377168133396}. Best is trial 1464 with value: 0.8990825688073395.
[32m[I 2023-04-21 01:10:04,046][39m Trial 6025 finished with value: 0.8495575221238938 and parameters: {'objective': 'CrossEntropy', 'colsample_bylevel': 0.09369254431235556, 'depth': 8, 'boosting_type': 'Plain', 'bootstrap_type': 'MVS'}. Best is trial 1464 with value: 0.8990825688073395.
