[32m[I 2023-04-21 00:25:44,073][39m Trial 4085 finished with value: 0.8727272727272727 and parameters: {'objective': 'Logloss', 'colsample_bylevel': 0.08995672040219854, 'depth': 11, 'boosting_type': 'Plain', 'bootstrap_type': 'Bayesian', 'bagging_temperature': 6.927403967813698}. Best is trial 1464 with value: 0.8990825688073395.
[32m[I 2023-04-21 00:25:45,028][39m Trial 4086 finished with value: 0.8807339449541284 and parameters: {'objective': 'Logloss', 'colsample_bylevel': 0.090403731897962, 'depth': 12, 'boosting_type': 'Plain', 'bootstrap_type': 'Bayesian', 'bagging_temperature': 5.597198901885835}. Best is trial 1464 with value: 0.8990825688073395.
[32m[I 2023-04-21 00:25:46,513][39m Trial 4087 finished with value: 0.8807339449541284 and parameters: {'objective': 'Logloss', 'colsample_bylevel': 0.09528664137861426, 'depth': 10, 'boosting_type': 'Plain', 'bootstrap_type': 'Bayesian', 'bagging_temperature': 5.864205219584364}. Best is trial 1464 with value: 0.8990825688073395.
[32m[I 2023-04-21 00:25:51,655][39m Trial 4088 finished with value: 0.8347826086956522 and parameters: {'objective': 'Logloss', 'colsample_bylevel': 0.0946748380199574, 'depth': 10, 'boosting_type': 'Ordered', 'bootstrap_type': 'Bayesian', 'bagging_temperature': 5.8979059050807585}. Best is trial 1464 with value: 0.8990825688073395.
[32m[I 2023-04-21 00:25:52,972][39m Trial 4089 finished with value: 0.8807339449541284 and parameters: {'objective': 'Logloss', 'colsample_bylevel': 0.09018271362866997, 'depth': 11, 'boosting_type': 'Plain', 'bootstrap_type': 'Bayesian', 'bagging_temperature': 6.5035132617684255}. Best is trial 1464 with value: 0.8990825688073395.
[32m[I 2023-04-21 00:25:54,426][39m Trial 4090 finished with value: 0.8807339449541284 and parameters: {'objective': 'CrossEntropy', 'colsample_bylevel': 0.09390050137019854, 'depth': 8, 'boosting_type': 'Plain', 'bootstrap_type': 'Bayesian', 'bagging_temperature': 5.2520926237622785}. Best is trial 1464 with value: 0.8990825688073395.
[32m[I 2023-04-21 00:25:55,495][39m Trial 4091 finished with value: 0.8807339449541284 and parameters: {'objective': 'Logloss', 'colsample_bylevel': 0.09171312805283666, 'depth': 12, 'boosting_type': 'Plain', 'bootstrap_type': 'Bayesian', 'bagging_temperature': 5.701807122547378}. Best is trial 1464 with value: 0.8990825688073395.
[32m[I 2023-04-21 00:25:56,730][39m Trial 4092 finished with value: 0.8807339449541284 and parameters: {'objective': 'Logloss', 'colsample_bylevel': 0.0964996044966419, 'depth': 10, 'boosting_type': 'Plain', 'bootstrap_type': 'Bayesian', 'bagging_temperature': 5.929386095627242}. Best is trial 1464 with value: 0.8990825688073395.
[32m[I 2023-04-21 00:25:57,762][39m Trial 4093 finished with value: 0.8571428571428572 and parameters: {'objective': 'Logloss', 'colsample_bylevel': 0.09830352276132595, 'depth': 5, 'boosting_type': 'Plain', 'bootstrap_type': 'Bayesian', 'bagging_temperature': 4.380383480102378}. Best is trial 1464 with value: 0.8990825688073395.
[32m[I 2023-04-21 00:25:59,020][39m Trial 4094 finished with value: 0.8828828828828829 and parameters: {'objective': 'CrossEntropy', 'colsample_bylevel': 0.08791989507128342, 'depth': 10, 'boosting_type': 'Plain', 'bootstrap_type': 'Bayesian', 'bagging_temperature': 6.803846511369369}. Best is trial 1464 with value: 0.8990825688073395.
[32m[I 2023-04-21 00:25:59,872][39m Trial 4095 finished with value: 0.8727272727272727 and parameters: {'objective': 'CrossEntropy', 'colsample_bylevel': 0.09466389629743632, 'depth': 10, 'boosting_type': 'Plain', 'bootstrap_type': 'Bayesian', 'bagging_temperature': 6.469451421728923}. Best is trial 1464 with value: 0.8990825688073395.
[32m[I 2023-04-21 00:26:00,875][39m Trial 4096 finished with value: 0.8807339449541284 and parameters: {'objective': 'CrossEntropy', 'colsample_bylevel': 0.09996338225112134, 'depth': 10, 'boosting_type': 'Plain', 'bootstrap_type': 'Bayesian', 'bagging_temperature': 6.351175230790452}. Best is trial 1464 with value: 0.8990825688073395.
[32m[I 2023-04-21 00:26:01,784][39m Trial 4097 finished with value: 0.8727272727272727 and parameters: {'objective': 'CrossEntropy', 'colsample_bylevel': 0.09663137166647719, 'depth': 10, 'boosting_type': 'Plain', 'bootstrap_type': 'Bayesian', 'bagging_temperature': 3.4626976480775045}. Best is trial 1464 with value: 0.8990825688073395.
[32m[I 2023-04-21 00:26:02,519][39m Trial 4098 finished with value: 0.8727272727272727 and parameters: {'objective': 'Logloss', 'colsample_bylevel': 0.09296286975596477, 'depth': 12, 'boosting_type': 'Plain', 'bootstrap_type': 'Bayesian', 'bagging_temperature': 5.00507222749889}. Best is trial 1464 with value: 0.8990825688073395.
[32m[I 2023-04-21 00:26:03,768][39m Trial 4099 finished with value: 0.8807339449541284 and parameters: {'objective': 'CrossEntropy', 'colsample_bylevel': 0.09671095238434815, 'depth': 12, 'boosting_type': 'Plain', 'bootstrap_type': 'Bayesian', 'bagging_temperature': 6.830997215590166}. Best is trial 1464 with value: 0.8990825688073395.
[32m[I 2023-04-21 00:26:04,875][39m Trial 4100 finished with value: 0.8727272727272727 and parameters: {'objective': 'Logloss', 'colsample_bylevel': 0.09561442946127706, 'depth': 11, 'boosting_type': 'Plain', 'bootstrap_type': 'Bayesian', 'bagging_temperature': 6.159893225466094}. Best is trial 1464 with value: 0.8990825688073395.
[32m[I 2023-04-21 00:26:05,902][39m Trial 4101 finished with value: 0.823529411764706 and parameters: {'objective': 'CrossEntropy', 'colsample_bylevel': 0.028825201726907192, 'depth': 11, 'boosting_type': 'Plain', 'bootstrap_type': 'Bernoulli', 'subsample': 0.566551989301016}. Best is trial 1464 with value: 0.8990825688073395.
[32m[I 2023-04-21 00:26:06,890][39m Trial 4102 finished with value: 0.8828828828828829 and parameters: {'objective': 'CrossEntropy', 'colsample_bylevel': 0.09968560230272777, 'depth': 12, 'boosting_type': 'Plain', 'bootstrap_type': 'Bayesian', 'bagging_temperature': 4.477190504085085}. Best is trial 1464 with value: 0.8990825688073395.
[32m[I 2023-04-21 00:26:08,334][39m Trial 4103 finished with value: 0.8703703703703703 and parameters: {'objective': 'CrossEntropy', 'colsample_bylevel': 0.09466803350056623, 'depth': 11, 'boosting_type': 'Plain', 'bootstrap_type': 'Bayesian', 'bagging_temperature': 3.85051757601526}. Best is trial 1464 with value: 0.8990825688073395.
[32m[I 2023-04-21 00:26:09,441][39m Trial 4104 finished with value: 0.8727272727272727 and parameters: {'objective': 'CrossEntropy', 'colsample_bylevel': 0.09378447346067205, 'depth': 11, 'boosting_type': 'Plain', 'bootstrap_type': 'Bayesian', 'bagging_temperature': 3.5635814451457577}. Best is trial 1464 with value: 0.8990825688073395.
[32m[I 2023-04-21 00:26:10,797][39m Trial 4105 finished with value: 0.8807339449541284 and parameters: {'objective': 'Logloss', 'colsample_bylevel': 0.09093434193329385, 'depth': 9, 'boosting_type': 'Plain', 'bootstrap_type': 'Bayesian', 'bagging_temperature': 5.432084921362321}. Best is trial 1464 with value: 0.8990825688073395.
[32m[I 2023-04-21 00:26:11,542][39m Trial 4106 finished with value: 0.8807339449541284 and parameters: {'objective': 'Logloss', 'colsample_bylevel': 0.09334840174712707, 'depth': 10, 'boosting_type': 'Plain', 'bootstrap_type': 'Bayesian', 'bagging_temperature': 5.990858374583909}. Best is trial 1464 with value: 0.8990825688073395.
[32m[I 2023-04-21 00:26:13,198][39m Trial 4107 finished with value: 0.8807339449541284 and parameters: {'objective': 'CrossEntropy', 'colsample_bylevel': 0.09672893639119902, 'depth': 9, 'boosting_type': 'Plain', 'bootstrap_type': 'Bayesian', 'bagging_temperature': 4.837426083565976}. Best is trial 1464 with value: 0.8990825688073395.
[32m[I 2023-04-21 00:26:17,760][39m Trial 4108 finished with value: 0.8495575221238938 and parameters: {'objective': 'CrossEntropy', 'colsample_bylevel': 0.09093638225017343, 'depth': 11, 'boosting_type': 'Ordered', 'bootstrap_type': 'MVS'}. Best is trial 1464 with value: 0.8990825688073395.
[32m[I 2023-04-21 00:26:18,924][39m Trial 4109 finished with value: 0.875 and parameters: {'objective': 'Logloss', 'colsample_bylevel': 0.09228198211056517, 'depth': 11, 'boosting_type': 'Plain', 'bootstrap_type': 'Bayesian', 'bagging_temperature': 5.13936551498036}. Best is trial 1464 with value: 0.8990825688073395.
[32m[I 2023-04-21 00:26:20,026][39m Trial 4110 finished with value: 0.8703703703703703 and parameters: {'objective': 'CrossEntropy', 'colsample_bylevel': 0.08731812575900547, 'depth': 11, 'boosting_type': 'Plain', 'bootstrap_type': 'Bayesian', 'bagging_temperature': 5.26519488384066}. Best is trial 1464 with value: 0.8990825688073395.
[32m[I 2023-04-21 00:26:21,270][39m Trial 4111 finished with value: 0.8727272727272727 and parameters: {'objective': 'Logloss', 'colsample_bylevel': 0.09520527527289663, 'depth': 12, 'boosting_type': 'Plain', 'bootstrap_type': 'Bayesian', 'bagging_temperature': 5.707195461552449}. Best is trial 1464 with value: 0.8990825688073395.
[32m[I 2023-04-21 00:26:22,383][39m Trial 4112 finished with value: 0.888888888888889 and parameters: {'objective': 'CrossEntropy', 'colsample_bylevel': 0.09174938904767888, 'depth': 11, 'boosting_type': 'Plain', 'bootstrap_type': 'Bayesian', 'bagging_temperature': 6.136364194319767}. Best is trial 1464 with value: 0.8990825688073395.
[32m[I 2023-04-21 00:26:23,539][39m Trial 4113 finished with value: 0.8648648648648648 and parameters: {'objective': 'Logloss', 'colsample_bylevel': 0.09145674453893274, 'depth': 12, 'boosting_type': 'Plain', 'bootstrap_type': 'Bayesian', 'bagging_temperature': 5.105749441714201}. Best is trial 1464 with value: 0.8990825688073395.
[32m[I 2023-04-21 00:26:24,791][39m Trial 4114 finished with value: 0.8672566371681416 and parameters: {'objective': 'Logloss', 'colsample_bylevel': 0.08959510703916335, 'depth': 11, 'boosting_type': 'Plain', 'bootstrap_type': 'Bayesian', 'bagging_temperature': 5.559148693883805}. Best is trial 1464 with value: 0.8990825688073395.
[32m[I 2023-04-21 00:26:25,731][39m Trial 4115 finished with value: 0.8468468468468469 and parameters: {'objective': 'Logloss', 'colsample_bylevel': 0.09063587297109223, 'depth': 11, 'boosting_type': 'Plain', 'bootstrap_type': 'Bayesian', 'bagging_temperature': 3.688257359608731}. Best is trial 1464 with value: 0.8990825688073395.
[32m[I 2023-04-21 00:26:27,199][39m Trial 4116 finished with value: 0.8807339449541284 and parameters: {'objective': 'CrossEntropy', 'colsample_bylevel': 0.0974452270414615, 'depth': 11, 'boosting_type': 'Plain', 'bootstrap_type': 'Bayesian', 'bagging_temperature': 6.1958650600013785}. Best is trial 1464 with value: 0.8990825688073395.
[32m[I 2023-04-21 00:26:27,763][39m Trial 4117 finished with value: 0.8828828828828829 and parameters: {'objective': 'CrossEntropy', 'colsample_bylevel': 0.0902435022952015, 'depth': 12, 'boosting_type': 'Plain', 'bootstrap_type': 'Bayesian', 'bagging_temperature': 5.090038584488169}. Best is trial 1464 with value: 0.8990825688073395.
[32m[I 2023-04-21 00:26:28,434][39m Trial 4118 finished with value: 0.8807339449541284 and parameters: {'objective': 'Logloss', 'colsample_bylevel': 0.09994234873583013, 'depth': 8, 'boosting_type': 'Plain', 'bootstrap_type': 'Bayesian', 'bagging_temperature': 4.371875573620791}. Best is trial 1464 with value: 0.8990825688073395.
[32m[I 2023-04-21 00:26:29,377][39m Trial 4119 finished with value: 0.8648648648648648 and parameters: {'objective': 'Logloss', 'colsample_bylevel': 0.0970381479733649, 'depth': 8, 'boosting_type': 'Plain', 'bootstrap_type': 'Bayesian', 'bagging_temperature': 5.6756953480393415}. Best is trial 1464 with value: 0.8990825688073395.
[32m[I 2023-04-21 00:26:30,694][39m Trial 4120 finished with value: 0.8828828828828829 and parameters: {'objective': 'Logloss', 'colsample_bylevel': 0.09548679899753769, 'depth': 8, 'boosting_type': 'Plain', 'bootstrap_type': 'Bayesian', 'bagging_temperature': 5.627623346751748}. Best is trial 1464 with value: 0.8990825688073395.
[32m[I 2023-04-21 00:26:31,916][39m Trial 4121 finished with value: 0.8623853211009175 and parameters: {'objective': 'CrossEntropy', 'colsample_bylevel': 0.09180619710492802, 'depth': 11, 'boosting_type': 'Plain', 'bootstrap_type': 'Bayesian', 'bagging_temperature': 7.181280092617574}. Best is trial 1464 with value: 0.8990825688073395.
[32m[I 2023-04-21 00:26:33,746][39m Trial 4123 finished with value: 0.8623853211009175 and parameters: {'objective': 'Logloss', 'colsample_bylevel': 0.09440226002040816, 'depth': 11, 'boosting_type': 'Plain', 'bootstrap_type': 'Bernoulli', 'subsample': 0.23767641930212752}. Best is trial 1464 with value: 0.8990825688073395.
[32m[I 2023-04-21 00:26:35,032][39m Trial 4124 finished with value: 0.8545454545454546 and parameters: {'objective': 'Logloss', 'colsample_bylevel': 0.09138464027799378, 'depth': 12, 'boosting_type': 'Plain', 'bootstrap_type': 'Bayesian', 'bagging_temperature': 5.624551244370691}. Best is trial 1464 with value: 0.8990825688073395.
[32m[I 2023-04-21 00:26:35,818][39m Trial 4125 finished with value: 0.8703703703703703 and parameters: {'objective': 'Logloss', 'colsample_bylevel': 0.09278527414491608, 'depth': 7, 'boosting_type': 'Plain', 'bootstrap_type': 'Bayesian', 'bagging_temperature': 5.431978898433136}. Best is trial 1464 with value: 0.8990825688073395.
[32m[I 2023-04-21 00:26:36,704][39m Trial 4126 finished with value: 0.8785046728971961 and parameters: {'objective': 'Logloss', 'colsample_bylevel': 0.09392347033442648, 'depth': 7, 'boosting_type': 'Plain', 'bootstrap_type': 'Bayesian', 'bagging_temperature': 5.803870001656652}. Best is trial 1464 with value: 0.8990825688073395.
[32m[I 2023-04-21 00:26:41,708][39m Trial 4127 finished with value: 0.8448275862068967 and parameters: {'objective': 'Logloss', 'colsample_bylevel': 0.07237717487095148, 'depth': 7, 'boosting_type': 'Ordered', 'bootstrap_type': 'Bayesian', 'bagging_temperature': 6.951774923657896}. Best is trial 1464 with value: 0.8990825688073395.
[32m[I 2023-04-21 00:26:42,834][39m Trial 4128 finished with value: 0.8571428571428572 and parameters: {'objective': 'CrossEntropy', 'colsample_bylevel': 0.09499223982913507, 'depth': 10, 'boosting_type': 'Plain', 'bootstrap_type': 'MVS'}. Best is trial 1464 with value: 0.8990825688073395.
[32m[I 2023-04-21 00:26:43,940][39m Trial 4129 finished with value: 0.8623853211009175 and parameters: {'objective': 'CrossEntropy', 'colsample_bylevel': 0.09779487164209927, 'depth': 12, 'boosting_type': 'Plain', 'bootstrap_type': 'Bayesian', 'bagging_temperature': 5.8747576756219}. Best is trial 1464 with value: 0.8990825688073395.
[32m[I 2023-04-21 00:26:45,151][39m Trial 4130 finished with value: 0.8807339449541284 and parameters: {'objective': 'Logloss', 'colsample_bylevel': 0.09265045862227912, 'depth': 11, 'boosting_type': 'Plain', 'bootstrap_type': 'Bayesian', 'bagging_temperature': 5.521388027211854}. Best is trial 1464 with value: 0.8990825688073395.
[32m[I 2023-04-21 00:26:46,559][39m Trial 4131 finished with value: 0.8571428571428572 and parameters: {'objective': 'CrossEntropy', 'colsample_bylevel': 0.08554543129244536, 'depth': 12, 'boosting_type': 'Plain', 'bootstrap_type': 'Bayesian', 'bagging_temperature': 5.070790689340921}. Best is trial 1464 with value: 0.8990825688073395.
[32m[I 2023-04-21 00:26:47,746][39m Trial 4132 finished with value: 0.8727272727272727 and parameters: {'objective': 'Logloss', 'colsample_bylevel': 0.09224756599413177, 'depth': 11, 'boosting_type': 'Plain', 'bootstrap_type': 'Bayesian', 'bagging_temperature': 7.023954584572582}. Best is trial 1464 with value: 0.8990825688073395.
[32m[I 2023-04-21 00:26:48,503][39m Trial 4133 finished with value: 0.8727272727272727 and parameters: {'objective': 'Logloss', 'colsample_bylevel': 0.0954865260719074, 'depth': 7, 'boosting_type': 'Plain', 'bootstrap_type': 'Bayesian', 'bagging_temperature': 6.082748369178739}. Best is trial 1464 with value: 0.8990825688073395.
[32m[I 2023-04-21 00:26:49,613][39m Trial 4134 finished with value: 0.8703703703703703 and parameters: {'objective': 'Logloss', 'colsample_bylevel': 0.09438855786093733, 'depth': 7, 'boosting_type': 'Plain', 'bootstrap_type': 'Bayesian', 'bagging_temperature': 6.078502831495309}. Best is trial 1464 with value: 0.8990825688073395.
[32m[I 2023-04-21 00:26:50,345][39m Trial 4135 finished with value: 0.890909090909091 and parameters: {'objective': 'Logloss', 'colsample_bylevel': 0.09863362336083378, 'depth': 7, 'boosting_type': 'Plain', 'bootstrap_type': 'Bayesian', 'bagging_temperature': 5.769794725160683}. Best is trial 1464 with value: 0.8990825688073395.
[32m[I 2023-04-21 00:26:51,528][39m Trial 4136 finished with value: 0.8571428571428572 and parameters: {'objective': 'CrossEntropy', 'colsample_bylevel': 0.08410967750035733, 'depth': 12, 'boosting_type': 'Plain', 'bootstrap_type': 'Bayesian', 'bagging_temperature': 4.434885053445647}. Best is trial 1464 with value: 0.8990825688073395.
[32m[I 2023-04-21 00:26:52,700][39m Trial 4137 finished with value: 0.8807339449541284 and parameters: {'objective': 'Logloss', 'colsample_bylevel': 0.09725499628446384, 'depth': 7, 'boosting_type': 'Plain', 'bootstrap_type': 'Bayesian', 'bagging_temperature': 5.012114092560012}. Best is trial 1464 with value: 0.8990825688073395.
[32m[I 2023-04-21 00:26:53,684][39m Trial 4138 finished with value: 0.8807339449541284 and parameters: {'objective': 'CrossEntropy', 'colsample_bylevel': 0.09172688326773393, 'depth': 10, 'boosting_type': 'Plain', 'bootstrap_type': 'Bayesian', 'bagging_temperature': 6.6389227583461485}. Best is trial 1464 with value: 0.8990825688073395.
[32m[I 2023-04-21 00:26:54,666][39m Trial 4139 finished with value: 0.8703703703703703 and parameters: {'objective': 'Logloss', 'colsample_bylevel': 0.0999336605921354, 'depth': 7, 'boosting_type': 'Plain', 'bootstrap_type': 'Bayesian', 'bagging_temperature': 4.73326534790409}. Best is trial 1464 with value: 0.8990825688073395.
[32m[I 2023-04-21 00:26:55,749][39m Trial 4140 finished with value: 0.8703703703703703 and parameters: {'objective': 'Logloss', 'colsample_bylevel': 0.09427619836309754, 'depth': 11, 'boosting_type': 'Plain', 'bootstrap_type': 'Bayesian', 'bagging_temperature': 7.085198368414649}. Best is trial 1464 with value: 0.8990825688073395.
[32m[I 2023-04-21 00:26:56,882][39m Trial 4141 finished with value: 0.8672566371681416 and parameters: {'objective': 'Logloss', 'colsample_bylevel': 0.08757734393559566, 'depth': 9, 'boosting_type': 'Plain', 'bootstrap_type': 'Bayesian', 'bagging_temperature': 5.840734487950399}. Best is trial 1464 with value: 0.8990825688073395.
[32m[I 2023-04-21 00:26:57,711][39m Trial 4142 finished with value: 0.8727272727272727 and parameters: {'objective': 'Logloss', 'colsample_bylevel': 0.09845214171390139, 'depth': 12, 'boosting_type': 'Plain', 'bootstrap_type': 'Bayesian', 'bagging_temperature': 5.372411608175557}. Best is trial 1464 with value: 0.8990825688073395.
[32m[I 2023-04-21 00:26:59,058][39m Trial 4143 finished with value: 0.8727272727272727 and parameters: {'objective': 'Logloss', 'colsample_bylevel': 0.09981421625395934, 'depth': 8, 'boosting_type': 'Plain', 'bootstrap_type': 'Bayesian', 'bagging_temperature': 6.114676858559101}. Best is trial 1464 with value: 0.8990825688073395.
[32m[I 2023-04-21 00:27:00,350][39m Trial 4144 finished with value: 0.8672566371681416 and parameters: {'objective': 'CrossEntropy', 'colsample_bylevel': 0.08554642784173482, 'depth': 11, 'boosting_type': 'Plain', 'bootstrap_type': 'Bayesian', 'bagging_temperature': 6.364116824711863}. Best is trial 1464 with value: 0.8990825688073395.
[32m[I 2023-04-21 00:27:05,828][39m Trial 4145 finished with value: 0.8421052631578947 and parameters: {'objective': 'Logloss', 'colsample_bylevel': 0.09333729312315228, 'depth': 10, 'boosting_type': 'Ordered', 'bootstrap_type': 'Bernoulli', 'subsample': 0.15015815183592474}. Best is trial 1464 with value: 0.8990825688073395.
[32m[I 2023-04-21 00:27:06,996][39m Trial 4146 finished with value: 0.8807339449541284 and parameters: {'objective': 'Logloss', 'colsample_bylevel': 0.09095304732909282, 'depth': 11, 'boosting_type': 'Plain', 'bootstrap_type': 'Bayesian', 'bagging_temperature': 5.329071931039615}. Best is trial 1464 with value: 0.8990825688073395.
[32m[I 2023-04-21 00:27:07,936][39m Trial 4147 finished with value: 0.8596491228070176 and parameters: {'objective': 'CrossEntropy', 'colsample_bylevel': 0.06352921197383085, 'depth': 11, 'boosting_type': 'Plain', 'bootstrap_type': 'Bayesian', 'bagging_temperature': 4.963300988572781}. Best is trial 1464 with value: 0.8990825688073395.
[32m[I 2023-04-21 00:27:09,125][39m Trial 4148 finished with value: 0.8495575221238938 and parameters: {'objective': 'CrossEntropy', 'colsample_bylevel': 0.08287601428961121, 'depth': 11, 'boosting_type': 'Plain', 'bootstrap_type': 'Bayesian', 'bagging_temperature': 6.735874925955286}. Best is trial 1464 with value: 0.8990825688073395.
[32m[I 2023-04-21 00:27:10,359][39m Trial 4149 finished with value: 0.888888888888889 and parameters: {'objective': 'Logloss', 'colsample_bylevel': 0.09542770258491672, 'depth': 10, 'boosting_type': 'Plain', 'bootstrap_type': 'Bayesian', 'bagging_temperature': 6.994628004730735}. Best is trial 1464 with value: 0.8990825688073395.
[32m[I 2023-04-21 00:27:11,198][39m Trial 4150 finished with value: 0.8672566371681416 and parameters: {'objective': 'Logloss', 'colsample_bylevel': 0.09551585401322053, 'depth': 11, 'boosting_type': 'Plain', 'bootstrap_type': 'MVS'}. Best is trial 1464 with value: 0.8990825688073395.
