[32m[I 2023-04-21 01:04:23,581][39m Trial 5787 finished with value: 0.875 and parameters: {'objective': 'Logloss', 'colsample_bylevel': 0.09167865552345233, 'depth': 10, 'boosting_type': 'Plain', 'bootstrap_type': 'Bayesian', 'bagging_temperature': 3.674068293852133}. Best is trial 1464 with value: 0.8990825688073395.
[32m[I 2023-04-21 01:04:24,706][39m Trial 5788 finished with value: 0.8703703703703703 and parameters: {'objective': 'CrossEntropy', 'colsample_bylevel': 0.09150996984782958, 'depth': 12, 'boosting_type': 'Plain', 'bootstrap_type': 'Bayesian', 'bagging_temperature': 5.874659414205421}. Best is trial 1464 with value: 0.8990825688073395.
[32m[I 2023-04-21 01:04:25,888][39m Trial 5789 finished with value: 0.8421052631578947 and parameters: {'objective': 'CrossEntropy', 'colsample_bylevel': 0.08793663067521375, 'depth': 11, 'boosting_type': 'Plain', 'bootstrap_type': 'MVS'}. Best is trial 1464 with value: 0.8990825688073395.
[32m[I 2023-04-21 01:04:26,988][39m Trial 5790 finished with value: 0.888888888888889 and parameters: {'objective': 'Logloss', 'colsample_bylevel': 0.09688537342085304, 'depth': 8, 'boosting_type': 'Plain', 'bootstrap_type': 'Bayesian', 'bagging_temperature': 3.7376734302468684}. Best is trial 1464 with value: 0.8990825688073395.
[32m[I 2023-04-21 01:04:27,755][39m Trial 5791 finished with value: 0.8545454545454546 and parameters: {'objective': 'CrossEntropy', 'colsample_bylevel': 0.08564419394758238, 'depth': 11, 'boosting_type': 'Plain', 'bootstrap_type': 'Bayesian', 'bagging_temperature': 4.9639131575841775}. Best is trial 1464 with value: 0.8990825688073395.
[32m[I 2023-04-21 01:04:28,611][39m Trial 5792 finished with value: 0.8672566371681416 and parameters: {'objective': 'Logloss', 'colsample_bylevel': 0.09877797985957316, 'depth': 7, 'boosting_type': 'Plain', 'bootstrap_type': 'Bayesian', 'bagging_temperature': 5.982121413682379}. Best is trial 1464 with value: 0.8990825688073395.
[32m[I 2023-04-21 01:04:29,362][39m Trial 5793 finished with value: 0.8448275862068967 and parameters: {'objective': 'Logloss', 'colsample_bylevel': 0.04602067855940717, 'depth': 8, 'boosting_type': 'Plain', 'bootstrap_type': 'Bayesian', 'bagging_temperature': 4.949252892419838}. Best is trial 1464 with value: 0.8990825688073395.
[32m[I 2023-04-21 01:04:31,214][39m Trial 5794 finished with value: 0.8623853211009175 and parameters: {'objective': 'Logloss', 'colsample_bylevel': 0.09422500795720941, 'depth': 9, 'boosting_type': 'Plain', 'bootstrap_type': 'Bayesian', 'bagging_temperature': 5.547953680399039}. Best is trial 1464 with value: 0.8990825688073395.
[32m[I 2023-04-21 01:04:32,336][39m Trial 5795 finished with value: 0.8648648648648648 and parameters: {'objective': 'Logloss', 'colsample_bylevel': 0.08662841178396175, 'depth': 7, 'boosting_type': 'Plain', 'bootstrap_type': 'Bayesian', 'bagging_temperature': 3.578450216100288}. Best is trial 1464 with value: 0.8990825688073395.
[32m[I 2023-04-21 01:04:33,494][39m Trial 5796 finished with value: 0.8648648648648648 and parameters: {'objective': 'Logloss', 'colsample_bylevel': 0.0902734687808925, 'depth': 11, 'boosting_type': 'Plain', 'bootstrap_type': 'Bayesian', 'bagging_temperature': 4.648879206489781}. Best is trial 1464 with value: 0.8990825688073395.
[32m[I 2023-04-21 01:04:38,238][39m Trial 5797 finished with value: 0.8421052631578947 and parameters: {'objective': 'Logloss', 'colsample_bylevel': 0.08934196218551443, 'depth': 12, 'boosting_type': 'Ordered', 'bootstrap_type': 'Bayesian', 'bagging_temperature': 5.353670042279747}. Best is trial 1464 with value: 0.8990825688073395.
[32m[I 2023-04-21 01:04:39,587][39m Trial 5798 finished with value: 0.888888888888889 and parameters: {'objective': 'CrossEntropy', 'colsample_bylevel': 0.08766412024841047, 'depth': 11, 'boosting_type': 'Plain', 'bootstrap_type': 'Bayesian', 'bagging_temperature': 3.940132061985683}. Best is trial 1464 with value: 0.8990825688073395.
[32m[I 2023-04-21 01:04:40,624][39m Trial 5799 finished with value: 0.8392857142857144 and parameters: {'objective': 'Logloss', 'colsample_bylevel': 0.07182075399764104, 'depth': 10, 'boosting_type': 'Plain', 'bootstrap_type': 'Bayesian', 'bagging_temperature': 5.109965837941093}. Best is trial 1464 with value: 0.8990825688073395.
[32m[I 2023-04-21 01:04:42,217][39m Trial 5800 finished with value: 0.8807339449541284 and parameters: {'objective': 'CrossEntropy', 'colsample_bylevel': 0.09006877606303546, 'depth': 12, 'boosting_type': 'Plain', 'bootstrap_type': 'Bayesian', 'bagging_temperature': 6.3035145526061545}. Best is trial 1464 with value: 0.8990825688073395.
[32m[I 2023-04-21 01:04:43,102][39m Trial 5801 finished with value: 0.875 and parameters: {'objective': 'Logloss', 'colsample_bylevel': 0.09298289417594437, 'depth': 12, 'boosting_type': 'Plain', 'bootstrap_type': 'Bayesian', 'bagging_temperature': 6.845296754270297}. Best is trial 1464 with value: 0.8990825688073395.
[32m[I 2023-04-21 01:04:44,313][39m Trial 5802 finished with value: 0.8727272727272727 and parameters: {'objective': 'CrossEntropy', 'colsample_bylevel': 0.09241178857238297, 'depth': 11, 'boosting_type': 'Plain', 'bootstrap_type': 'Bayesian', 'bagging_temperature': 5.866718718838487}. Best is trial 1464 with value: 0.8990825688073395.
[32m[I 2023-04-21 01:04:45,416][39m Trial 5803 finished with value: 0.8672566371681416 and parameters: {'objective': 'CrossEntropy', 'colsample_bylevel': 0.08027236522848413, 'depth': 11, 'boosting_type': 'Plain', 'bootstrap_type': 'Bayesian', 'bagging_temperature': 5.529674648864634}. Best is trial 1464 with value: 0.8990825688073395.
[32m[I 2023-04-21 01:04:46,392][39m Trial 5804 finished with value: 0.8623853211009175 and parameters: {'objective': 'CrossEntropy', 'colsample_bylevel': 0.09798822939228798, 'depth': 7, 'boosting_type': 'Plain', 'bootstrap_type': 'Bayesian', 'bagging_temperature': 1.1038793922543038}. Best is trial 1464 with value: 0.8990825688073395.
[32m[I 2023-04-21 01:04:48,021][39m Trial 5805 finished with value: 0.8571428571428572 and parameters: {'objective': 'Logloss', 'colsample_bylevel': 0.09203033380030863, 'depth': 8, 'boosting_type': 'Plain', 'bootstrap_type': 'Bayesian', 'bagging_temperature': 5.039543572784823}. Best is trial 1464 with value: 0.8990825688073395.
[32m[I 2023-04-21 01:04:49,087][39m Trial 5806 finished with value: 0.8807339449541284 and parameters: {'objective': 'Logloss', 'colsample_bylevel': 0.09852880869976618, 'depth': 8, 'boosting_type': 'Plain', 'bootstrap_type': 'Bernoulli', 'subsample': 0.47410929523854617}. Best is trial 1464 with value: 0.8990825688073395.
[32m[I 2023-04-21 01:04:50,564][39m Trial 5807 finished with value: 0.8807339449541284 and parameters: {'objective': 'Logloss', 'colsample_bylevel': 0.09620144779831165, 'depth': 9, 'boosting_type': 'Plain', 'bootstrap_type': 'Bayesian', 'bagging_temperature': 6.33084129996332}. Best is trial 1464 with value: 0.8990825688073395.
[32m[I 2023-04-21 01:04:51,715][39m Trial 5808 finished with value: 0.8571428571428572 and parameters: {'objective': 'CrossEntropy', 'colsample_bylevel': 0.09790088587589638, 'depth': 9, 'boosting_type': 'Plain', 'bootstrap_type': 'MVS'}. Best is trial 1464 with value: 0.8990825688073395.
[32m[I 2023-04-21 01:04:52,506][39m Trial 5809 finished with value: 0.8807339449541284 and parameters: {'objective': 'Logloss', 'colsample_bylevel': 0.09888098445856497, 'depth': 8, 'boosting_type': 'Plain', 'bootstrap_type': 'Bayesian', 'bagging_temperature': 4.055679884160469}. Best is trial 1464 with value: 0.8990825688073395.
[32m[I 2023-04-21 01:04:53,836][39m Trial 5810 finished with value: 0.8807339449541284 and parameters: {'objective': 'Logloss', 'colsample_bylevel': 0.09986321104889258, 'depth': 8, 'boosting_type': 'Plain', 'bootstrap_type': 'Bayesian', 'bagging_temperature': 4.332306963592825}. Best is trial 1464 with value: 0.8990825688073395.
[32m[I 2023-04-21 01:04:55,311][39m Trial 5811 finished with value: 0.8807339449541284 and parameters: {'objective': 'Logloss', 'colsample_bylevel': 0.09528316508344671, 'depth': 9, 'boosting_type': 'Plain', 'bootstrap_type': 'Bayesian', 'bagging_temperature': 6.843958032311613}. Best is trial 1464 with value: 0.8990825688073395.
[32m[I 2023-04-21 01:04:56,086][39m Trial 5812 finished with value: 0.8571428571428572 and parameters: {'objective': 'CrossEntropy', 'colsample_bylevel': 0.09203347684209244, 'depth': 7, 'boosting_type': 'Plain', 'bootstrap_type': 'Bayesian', 'bagging_temperature': 6.600363585706615}. Best is trial 1464 with value: 0.8990825688073395.
[32m[I 2023-04-21 01:05:00,820][39m Trial 5813 finished with value: 0.8596491228070176 and parameters: {'objective': 'Logloss', 'colsample_bylevel': 0.07583286825125882, 'depth': 12, 'boosting_type': 'Ordered', 'bootstrap_type': 'Bayesian', 'bagging_temperature': 6.312930937550899}. Best is trial 1464 with value: 0.8990825688073395.
[32m[I 2023-04-21 01:05:01,971][39m Trial 5814 finished with value: 0.875 and parameters: {'objective': 'CrossEntropy', 'colsample_bylevel': 0.09028397333081697, 'depth': 11, 'boosting_type': 'Plain', 'bootstrap_type': 'Bayesian', 'bagging_temperature': 4.535126611679681}. Best is trial 1464 with value: 0.8990825688073395.
[32m[I 2023-04-21 01:05:03,576][39m Trial 5815 finished with value: 0.8807339449541284 and parameters: {'objective': 'Logloss', 'colsample_bylevel': 0.09466711901945728, 'depth': 9, 'boosting_type': 'Plain', 'bootstrap_type': 'Bayesian', 'bagging_temperature': 6.091567906496172}. Best is trial 1464 with value: 0.8990825688073395.
[32m[I 2023-04-21 01:05:04,931][39m Trial 5816 finished with value: 0.8828828828828829 and parameters: {'objective': 'Logloss', 'colsample_bylevel': 0.09192464200693758, 'depth': 12, 'boosting_type': 'Plain', 'bootstrap_type': 'Bayesian', 'bagging_temperature': 5.330305252441467}. Best is trial 1464 with value: 0.8990825688073395.
[32m[I 2023-04-21 01:05:06,580][39m Trial 5817 finished with value: 0.8727272727272727 and parameters: {'objective': 'Logloss', 'colsample_bylevel': 0.09608454817700356, 'depth': 9, 'boosting_type': 'Plain', 'bootstrap_type': 'Bayesian', 'bagging_temperature': 6.758585414591493}. Best is trial 1464 with value: 0.8990825688073395.
[32m[I 2023-04-21 01:05:07,406][39m Trial 5818 finished with value: 0.8727272727272727 and parameters: {'objective': 'Logloss', 'colsample_bylevel': 0.09038664732561952, 'depth': 12, 'boosting_type': 'Plain', 'bootstrap_type': 'Bayesian', 'bagging_temperature': 5.254616524039386}. Best is trial 1464 with value: 0.8990825688073395.
[32m[I 2023-04-21 01:05:08,793][39m Trial 5819 finished with value: 0.888888888888889 and parameters: {'objective': 'Logloss', 'colsample_bylevel': 0.09645176656059773, 'depth': 6, 'boosting_type': 'Plain', 'bootstrap_type': 'Bayesian', 'bagging_temperature': 6.126362712046255}. Best is trial 1464 with value: 0.8990825688073395.
[32m[I 2023-04-21 01:05:09,686][39m Trial 5820 finished with value: 0.8727272727272727 and parameters: {'objective': 'Logloss', 'colsample_bylevel': 0.09825800375278912, 'depth': 7, 'boosting_type': 'Plain', 'bootstrap_type': 'Bayesian', 'bagging_temperature': 5.889581149201271}. Best is trial 1464 with value: 0.8990825688073395.
[32m[I 2023-04-21 01:05:10,632][39m Trial 5821 finished with value: 0.8807339449541284 and parameters: {'objective': 'Logloss', 'colsample_bylevel': 0.09731550148831235, 'depth': 6, 'boosting_type': 'Plain', 'bootstrap_type': 'Bayesian', 'bagging_temperature': 4.540429294281681}. Best is trial 1464 with value: 0.8990825688073395.
[32m[I 2023-04-21 01:05:12,294][39m Trial 5822 finished with value: 0.8727272727272727 and parameters: {'objective': 'CrossEntropy', 'colsample_bylevel': 0.08849183316106914, 'depth': 12, 'boosting_type': 'Plain', 'bootstrap_type': 'Bayesian', 'bagging_temperature': 6.254743546001981}. Best is trial 1464 with value: 0.8990825688073395.
[32m[I 2023-04-21 01:05:13,114][39m Trial 5823 finished with value: 0.8828828828828829 and parameters: {'objective': 'Logloss', 'colsample_bylevel': 0.09208947860954501, 'depth': 8, 'boosting_type': 'Plain', 'bootstrap_type': 'Bayesian', 'bagging_temperature': 5.290208238081016}. Best is trial 1464 with value: 0.8990825688073395.
[32m[I 2023-04-21 01:05:13,873][39m Trial 5824 finished with value: 0.888888888888889 and parameters: {'objective': 'CrossEntropy', 'colsample_bylevel': 0.09988743544868095, 'depth': 12, 'boosting_type': 'Plain', 'bootstrap_type': 'Bayesian', 'bagging_temperature': 4.847102843152664}. Best is trial 1464 with value: 0.8990825688073395.
[32m[I 2023-04-21 01:05:15,496][39m Trial 5825 finished with value: 0.8807339449541284 and parameters: {'objective': 'Logloss', 'colsample_bylevel': 0.0856976349946049, 'depth': 9, 'boosting_type': 'Plain', 'bootstrap_type': 'Bayesian', 'bagging_temperature': 4.970121752775143}. Best is trial 1464 with value: 0.8990825688073395.
[32m[I 2023-04-21 01:05:16,280][39m Trial 5826 finished with value: 0.8727272727272727 and parameters: {'objective': 'Logloss', 'colsample_bylevel': 0.08882691106513481, 'depth': 12, 'boosting_type': 'Plain', 'bootstrap_type': 'Bayesian', 'bagging_temperature': 6.84564426750991}. Best is trial 1464 with value: 0.8990825688073395.
[32m[I 2023-04-21 01:05:17,942][39m Trial 5827 finished with value: 0.8648648648648648 and parameters: {'objective': 'Logloss', 'colsample_bylevel': 0.08858235485988475, 'depth': 12, 'boosting_type': 'Plain', 'bootstrap_type': 'Bayesian', 'bagging_temperature': 4.74095359746877}. Best is trial 1464 with value: 0.8990825688073395.
[32m[I 2023-04-21 01:05:19,470][39m Trial 5828 finished with value: 0.8727272727272727 and parameters: {'objective': 'Logloss', 'colsample_bylevel': 0.09428173890966296, 'depth': 9, 'boosting_type': 'Plain', 'bootstrap_type': 'Bayesian', 'bagging_temperature': 6.277269995135511}. Best is trial 1464 with value: 0.8990825688073395.
[32m[I 2023-04-21 01:05:20,546][39m Trial 5829 finished with value: 0.8703703703703703 and parameters: {'objective': 'Logloss', 'colsample_bylevel': 0.09524792025107355, 'depth': 7, 'boosting_type': 'Plain', 'bootstrap_type': 'Bayesian', 'bagging_temperature': 7.517382612811632}. Best is trial 1464 with value: 0.8990825688073395.
[32m[I 2023-04-21 01:05:21,544][39m Trial 5830 finished with value: 0.8571428571428572 and parameters: {'objective': 'Logloss', 'colsample_bylevel': 0.09048395854939904, 'depth': 7, 'boosting_type': 'Plain', 'bootstrap_type': 'Bernoulli', 'subsample': 0.723848826193743}. Best is trial 1464 with value: 0.8990825688073395.
[32m[I 2023-04-21 01:05:23,345][39m Trial 5831 finished with value: 0.8727272727272727 and parameters: {'objective': 'CrossEntropy', 'colsample_bylevel': 0.09767780194296215, 'depth': 9, 'boosting_type': 'Plain', 'bootstrap_type': 'Bayesian', 'bagging_temperature': 5.820885017539378}. Best is trial 1464 with value: 0.8990825688073395.
[32m[I 2023-04-21 01:05:24,644][39m Trial 5832 finished with value: 0.8495575221238938 and parameters: {'objective': 'Logloss', 'colsample_bylevel': 0.0953885597390821, 'depth': 9, 'boosting_type': 'Plain', 'bootstrap_type': 'MVS'}. Best is trial 1464 with value: 0.8990825688073395.
[32m[I 2023-04-21 01:05:25,532][39m Trial 5833 finished with value: 0.8727272727272727 and parameters: {'objective': 'Logloss', 'colsample_bylevel': 0.099865759042033, 'depth': 12, 'boosting_type': 'Plain', 'bootstrap_type': 'Bayesian', 'bagging_temperature': 5.9064176694836545}. Best is trial 1464 with value: 0.8990825688073395.
[32m[I 2023-04-21 01:05:30,390][39m Trial 5834 finished with value: 0.8347826086956522 and parameters: {'objective': 'Logloss', 'colsample_bylevel': 0.08880018599342818, 'depth': 12, 'boosting_type': 'Ordered', 'bootstrap_type': 'Bayesian', 'bagging_temperature': 5.603116208571375}. Best is trial 1464 with value: 0.8990825688073395.
[32m[I 2023-04-21 01:05:31,792][39m Trial 5835 finished with value: 0.8545454545454546 and parameters: {'objective': 'Logloss', 'colsample_bylevel': 0.09084668291843899, 'depth': 11, 'boosting_type': 'Plain', 'bootstrap_type': 'Bayesian', 'bagging_temperature': 5.439581083748665}. Best is trial 1464 with value: 0.8990825688073395.
[32m[I 2023-04-21 01:05:33,016][39m Trial 5836 finished with value: 0.8807339449541284 and parameters: {'objective': 'CrossEntropy', 'colsample_bylevel': 0.09772784425189879, 'depth': 8, 'boosting_type': 'Plain', 'bootstrap_type': 'Bayesian', 'bagging_temperature': 4.157114998733077}. Best is trial 1464 with value: 0.8990825688073395.
[32m[I 2023-04-21 01:05:34,229][39m Trial 5837 finished with value: 0.8807339449541284 and parameters: {'objective': 'CrossEntropy', 'colsample_bylevel': 0.09266095393410721, 'depth': 10, 'boosting_type': 'Plain', 'bootstrap_type': 'Bayesian', 'bagging_temperature': 4.675754551658462}. Best is trial 1464 with value: 0.8990825688073395.
[32m[I 2023-04-21 01:05:36,158][39m Trial 5838 finished with value: 0.8807339449541284 and parameters: {'objective': 'CrossEntropy', 'colsample_bylevel': 0.09557719013857356, 'depth': 9, 'boosting_type': 'Plain', 'bootstrap_type': 'Bayesian', 'bagging_temperature': 4.045207745387749}. Best is trial 1464 with value: 0.8990825688073395.
[32m[I 2023-04-21 01:05:37,497][39m Trial 5839 finished with value: 0.8648648648648648 and parameters: {'objective': 'CrossEntropy', 'colsample_bylevel': 0.09413054942282464, 'depth': 11, 'boosting_type': 'Plain', 'bootstrap_type': 'Bayesian', 'bagging_temperature': 5.907215973706937}. Best is trial 1464 with value: 0.8990825688073395.
[32m[I 2023-04-21 01:05:38,704][39m Trial 5840 finished with value: 0.8703703703703703 and parameters: {'objective': 'CrossEntropy', 'colsample_bylevel': 0.08215329088047084, 'depth': 12, 'boosting_type': 'Plain', 'bootstrap_type': 'Bayesian', 'bagging_temperature': 5.872305023180927}. Best is trial 1464 with value: 0.8990825688073395.
[32m[I 2023-04-21 01:05:39,575][39m Trial 5841 finished with value: 0.8727272727272727 and parameters: {'objective': 'Logloss', 'colsample_bylevel': 0.09503751084416676, 'depth': 9, 'boosting_type': 'Plain', 'bootstrap_type': 'Bayesian', 'bagging_temperature': 5.745935725383423}. Best is trial 1464 with value: 0.8990825688073395.
[32m[I 2023-04-21 01:05:40,499][39m Trial 5842 finished with value: 0.8727272727272727 and parameters: {'objective': 'Logloss', 'colsample_bylevel': 0.09805733595795937, 'depth': 9, 'boosting_type': 'Plain', 'bootstrap_type': 'Bayesian', 'bagging_temperature': 4.228355311926991}. Best is trial 1464 with value: 0.8990825688073395.
[32m[I 2023-04-21 01:05:41,829][39m Trial 5843 finished with value: 0.8807339449541284 and parameters: {'objective': 'Logloss', 'colsample_bylevel': 0.087515227203524, 'depth': 12, 'boosting_type': 'Plain', 'bootstrap_type': 'Bayesian', 'bagging_temperature': 5.055399351963358}. Best is trial 1464 with value: 0.8990825688073395.
[32m[I 2023-04-21 01:05:43,161][39m Trial 5844 finished with value: 0.8545454545454546 and parameters: {'objective': 'Logloss', 'colsample_bylevel': 0.09963039688745116, 'depth': 8, 'boosting_type': 'Plain', 'bootstrap_type': 'Bayesian', 'bagging_temperature': 2.2420210607829985}. Best is trial 1464 with value: 0.8990825688073395.
[32m[I 2023-04-21 01:05:44,416][39m Trial 5845 finished with value: 0.8727272727272727 and parameters: {'objective': 'Logloss', 'colsample_bylevel': 0.0973561396887789, 'depth': 9, 'boosting_type': 'Plain', 'bootstrap_type': 'Bayesian', 'bagging_temperature': 6.840604090128753}. Best is trial 1464 with value: 0.8990825688073395.
[32m[I 2023-04-21 01:05:45,369][39m Trial 5846 finished with value: 0.8727272727272727 and parameters: {'objective': 'Logloss', 'colsample_bylevel': 0.09584381729979963, 'depth': 10, 'boosting_type': 'Plain', 'bootstrap_type': 'Bayesian', 'bagging_temperature': 7.01971064867683}. Best is trial 1464 with value: 0.8990825688073395.
[32m[I 2023-04-21 01:05:46,370][39m Trial 5847 finished with value: 0.8807339449541284 and parameters: {'objective': 'Logloss', 'colsample_bylevel': 0.0960161439878802, 'depth': 10, 'boosting_type': 'Plain', 'bootstrap_type': 'Bayesian', 'bagging_temperature': 7.020139655130214}. Best is trial 1464 with value: 0.8990825688073395.
[32m[I 2023-04-21 01:05:47,725][39m Trial 5848 finished with value: 0.8495575221238938 and parameters: {'objective': 'CrossEntropy', 'colsample_bylevel': 0.06636717036682344, 'depth': 12, 'boosting_type': 'Plain', 'bootstrap_type': 'Bayesian', 'bagging_temperature': 6.392004881604117}. Best is trial 1464 with value: 0.8990825688073395.
[32m[I 2023-04-21 01:05:48,748][39m Trial 5849 finished with value: 0.8623853211009175 and parameters: {'objective': 'CrossEntropy', 'colsample_bylevel': 0.09519720381867763, 'depth': 10, 'boosting_type': 'Plain', 'bootstrap_type': 'Bernoulli', 'subsample': 0.4982560159750528}. Best is trial 1464 with value: 0.8990825688073395.
[32m[I 2023-04-21 01:05:49,920][39m Trial 5850 finished with value: 0.8448275862068967 and parameters: {'objective': 'Logloss', 'colsample_bylevel': 0.050741751139359956, 'depth': 9, 'boosting_type': 'Plain', 'bootstrap_type': 'Bayesian', 'bagging_temperature': 5.004026785486638}. Best is trial 1464 with value: 0.8990825688073395.
[32m[I 2023-04-21 01:05:55,242][39m Trial 5851 finished with value: 0.8571428571428572 and parameters: {'objective': 'CrossEntropy', 'colsample_bylevel': 0.0950610599577804, 'depth': 10, 'boosting_type': 'Ordered', 'bootstrap_type': 'Bayesian', 'bagging_temperature': 6.568077953223531}. Best is trial 1464 with value: 0.8990825688073395.
[32m[I 2023-04-21 01:05:55,968][39m Trial 5852 finished with value: 0.8648648648648648 and parameters: {'objective': 'Logloss', 'colsample_bylevel': 0.08974413125554757, 'depth': 12, 'boosting_type': 'Plain', 'bootstrap_type': 'Bayesian', 'bagging_temperature': 6.4120731358936425}. Best is trial 1464 with value: 0.8990825688073395.
