[32m[I 2023-04-20 23:08:20,637][39m Trial 532 finished with value: 0.8623853211009175 and parameters: {'objective': 'Logloss', 'colsample_bylevel': 0.09339769516114589, 'depth': 7, 'boosting_type': 'Plain', 'bootstrap_type': 'Bayesian', 'bagging_temperature': 4.902085433860796}. Best is trial 205 with value: 0.890909090909091.
[32m[I 2023-04-20 23:08:21,381][39m Trial 533 finished with value: 0.8727272727272727 and parameters: {'objective': 'Logloss', 'colsample_bylevel': 0.0956896381752575, 'depth': 8, 'boosting_type': 'Plain', 'bootstrap_type': 'Bayesian', 'bagging_temperature': 7.4531552924966205}. Best is trial 205 with value: 0.890909090909091.
[32m[I 2023-04-20 23:08:22,247][39m Trial 534 finished with value: 0.8703703703703703 and parameters: {'objective': 'Logloss', 'colsample_bylevel': 0.09860574416570542, 'depth': 8, 'boosting_type': 'Plain', 'bootstrap_type': 'Bayesian', 'bagging_temperature': 4.486038146840157}. Best is trial 205 with value: 0.890909090909091.
[32m[I 2023-04-20 23:08:27,666][39m Trial 535 finished with value: 0.8421052631578947 and parameters: {'objective': 'Logloss', 'colsample_bylevel': 0.09995543636321877, 'depth': 8, 'boosting_type': 'Ordered', 'bootstrap_type': 'Bayesian', 'bagging_temperature': 4.481802668664507}. Best is trial 205 with value: 0.890909090909091.
[32m[I 2023-04-20 23:08:28,601][39m Trial 536 finished with value: 0.8648648648648648 and parameters: {'objective': 'Logloss', 'colsample_bylevel': 0.09199376632217401, 'depth': 7, 'boosting_type': 'Plain', 'bootstrap_type': 'Bayesian', 'bagging_temperature': 4.742954769159892}. Best is trial 205 with value: 0.890909090909091.
[32m[I 2023-04-20 23:08:29,602][39m Trial 537 finished with value: 0.8807339449541284 and parameters: {'objective': 'Logloss', 'colsample_bylevel': 0.0952914729409826, 'depth': 8, 'boosting_type': 'Plain', 'bootstrap_type': 'Bayesian', 'bagging_temperature': 5.597341723730017}. Best is trial 205 with value: 0.890909090909091.
[32m[I 2023-04-20 23:08:30,726][39m Trial 538 finished with value: 0.8807339449541284 and parameters: {'objective': 'Logloss', 'colsample_bylevel': 0.09708177172379402, 'depth': 8, 'boosting_type': 'Plain', 'bootstrap_type': 'Bayesian', 'bagging_temperature': 5.209589861221666}. Best is trial 205 with value: 0.890909090909091.
[32m[I 2023-04-20 23:08:31,760][39m Trial 539 finished with value: 0.8421052631578947 and parameters: {'objective': 'CrossEntropy', 'colsample_bylevel': 0.06264228902595084, 'depth': 9, 'boosting_type': 'Plain', 'bootstrap_type': 'Bayesian', 'bagging_temperature': 4.133898842206117}. Best is trial 205 with value: 0.890909090909091.
[32m[I 2023-04-20 23:08:32,546][39m Trial 540 finished with value: 0.8727272727272727 and parameters: {'objective': 'Logloss', 'colsample_bylevel': 0.09822133337862343, 'depth': 7, 'boosting_type': 'Plain', 'bootstrap_type': 'Bayesian', 'bagging_temperature': 4.187050626361149}. Best is trial 205 with value: 0.890909090909091.
[32m[I 2023-04-20 23:08:33,783][39m Trial 541 finished with value: 0.8807339449541284 and parameters: {'objective': 'Logloss', 'colsample_bylevel': 0.09502330774971232, 'depth': 8, 'boosting_type': 'Plain', 'bootstrap_type': 'Bayesian', 'bagging_temperature': 6.98842196811165}. Best is trial 205 with value: 0.890909090909091.
[32m[I 2023-04-20 23:08:34,962][39m Trial 542 finished with value: 0.8807339449541284 and parameters: {'objective': 'Logloss', 'colsample_bylevel': 0.09675290377317412, 'depth': 8, 'boosting_type': 'Plain', 'bootstrap_type': 'Bayesian', 'bagging_temperature': 3.638404466206126}. Best is trial 205 with value: 0.890909090909091.
[32m[I 2023-04-20 23:08:35,663][39m Trial 543 finished with value: 0.8807339449541284 and parameters: {'objective': 'Logloss', 'colsample_bylevel': 0.09418955359632283, 'depth': 7, 'boosting_type': 'Plain', 'bootstrap_type': 'Bayesian', 'bagging_temperature': 5.781061341481215}. Best is trial 205 with value: 0.890909090909091.
[32m[I 2023-04-20 23:08:36,494][39m Trial 544 finished with value: 0.823529411764706 and parameters: {'objective': 'Logloss', 'colsample_bylevel': 0.09394510561121552, 'depth': 1, 'boosting_type': 'Plain', 'bootstrap_type': 'MVS'}. Best is trial 205 with value: 0.890909090909091.
[32m[I 2023-04-20 23:08:37,769][39m Trial 545 finished with value: 0.8807339449541284 and parameters: {'objective': 'Logloss', 'colsample_bylevel': 0.09717276376761698, 'depth': 8, 'boosting_type': 'Plain', 'bootstrap_type': 'Bayesian', 'bagging_temperature': 5.438147315537101}. Best is trial 205 with value: 0.890909090909091.
[32m[I 2023-04-20 23:08:38,790][39m Trial 546 finished with value: 0.8727272727272727 and parameters: {'objective': 'Logloss', 'colsample_bylevel': 0.09232754987854887, 'depth': 8, 'boosting_type': 'Plain', 'bootstrap_type': 'Bayesian', 'bagging_temperature': 5.867261350815726}. Best is trial 205 with value: 0.890909090909091.
[32m[I 2023-04-20 23:08:39,728][39m Trial 547 finished with value: 0.8727272727272727 and parameters: {'objective': 'Logloss', 'colsample_bylevel': 0.098284329110677, 'depth': 6, 'boosting_type': 'Plain', 'bootstrap_type': 'Bayesian', 'bagging_temperature': 3.982804721914257}. Best is trial 205 with value: 0.890909090909091.
[32m[I 2023-04-20 23:08:40,692][39m Trial 548 finished with value: 0.8596491228070176 and parameters: {'objective': 'Logloss', 'colsample_bylevel': 0.09992339935083198, 'depth': 6, 'boosting_type': 'Plain', 'bootstrap_type': 'Bayesian', 'bagging_temperature': 4.325723701709241}. Best is trial 205 with value: 0.890909090909091.
[32m[I 2023-04-20 23:08:41,657][39m Trial 549 finished with value: 0.8672566371681416 and parameters: {'objective': 'Logloss', 'colsample_bylevel': 0.08943386094365639, 'depth': 7, 'boosting_type': 'Plain', 'bootstrap_type': 'Bayesian', 'bagging_temperature': 5.6543670269579245}. Best is trial 205 with value: 0.890909090909091.
[32m[I 2023-04-20 23:08:42,549][39m Trial 550 finished with value: 0.8648648648648648 and parameters: {'objective': 'Logloss', 'colsample_bylevel': 0.09801963841110709, 'depth': 9, 'boosting_type': 'Plain', 'bootstrap_type': 'Bayesian', 'bagging_temperature': 3.609301969707621}. Best is trial 205 with value: 0.890909090909091.
[32m[I 2023-04-20 23:08:43,488][39m Trial 551 finished with value: 0.8807339449541284 and parameters: {'objective': 'Logloss', 'colsample_bylevel': 0.09860432540546589, 'depth': 6, 'boosting_type': 'Plain', 'bootstrap_type': 'Bayesian', 'bagging_temperature': 4.299342749163211}. Best is trial 205 with value: 0.890909090909091.
[32m[I 2023-04-20 23:08:44,325][39m Trial 552 finished with value: 0.8727272727272727 and parameters: {'objective': 'Logloss', 'colsample_bylevel': 0.09617647608635975, 'depth': 7, 'boosting_type': 'Plain', 'bootstrap_type': 'Bernoulli', 'subsample': 0.3081587568020425}. Best is trial 205 with value: 0.890909090909091.
[32m[I 2023-04-20 23:08:45,613][39m Trial 553 finished with value: 0.8727272727272727 and parameters: {'objective': 'Logloss', 'colsample_bylevel': 0.0982921414635197, 'depth': 8, 'boosting_type': 'Plain', 'bootstrap_type': 'Bayesian', 'bagging_temperature': 4.5356427260246255}. Best is trial 205 with value: 0.890909090909091.
[32m[I 2023-04-20 23:08:50,711][39m Trial 554 finished with value: 0.8421052631578947 and parameters: {'objective': 'Logloss', 'colsample_bylevel': 0.0943200442762304, 'depth': 8, 'boosting_type': 'Ordered', 'bootstrap_type': 'Bayesian', 'bagging_temperature': 6.076000021834234}. Best is trial 205 with value: 0.890909090909091.
[32m[I 2023-04-20 23:08:51,661][39m Trial 555 finished with value: 0.8623853211009175 and parameters: {'objective': 'Logloss', 'colsample_bylevel': 0.09668026642334601, 'depth': 8, 'boosting_type': 'Plain', 'bootstrap_type': 'Bayesian', 'bagging_temperature': 4.114788907258702}. Best is trial 205 with value: 0.890909090909091.
[32m[I 2023-04-20 23:08:52,506][39m Trial 556 finished with value: 0.8807339449541284 and parameters: {'objective': 'Logloss', 'colsample_bylevel': 0.09474500690713786, 'depth': 8, 'boosting_type': 'Plain', 'bootstrap_type': 'Bayesian', 'bagging_temperature': 6.427146568815079}. Best is trial 205 with value: 0.890909090909091.
[32m[I 2023-04-20 23:08:53,786][39m Trial 557 finished with value: 0.8727272727272727 and parameters: {'objective': 'Logloss', 'colsample_bylevel': 0.09715801010524347, 'depth': 7, 'boosting_type': 'Plain', 'bootstrap_type': 'Bayesian', 'bagging_temperature': 3.0172095329089346}. Best is trial 205 with value: 0.890909090909091.
[32m[I 2023-04-20 23:08:54,975][39m Trial 558 finished with value: 0.8275862068965517 and parameters: {'objective': 'CrossEntropy', 'colsample_bylevel': 0.06644949190152771, 'depth': 9, 'boosting_type': 'Plain', 'bootstrap_type': 'Bayesian', 'bagging_temperature': 5.137608409473431}. Best is trial 205 with value: 0.890909090909091.
[32m[I 2023-04-20 23:08:55,714][39m Trial 559 finished with value: 0.8727272727272727 and parameters: {'objective': 'Logloss', 'colsample_bylevel': 0.09520411496612906, 'depth': 8, 'boosting_type': 'Plain', 'bootstrap_type': 'Bayesian', 'bagging_temperature': 3.3515411882300894}. Best is trial 205 with value: 0.890909090909091.
[32m[I 2023-04-20 23:08:56,647][39m Trial 560 finished with value: 0.8828828828828829 and parameters: {'objective': 'Logloss', 'colsample_bylevel': 0.09841118017375751, 'depth': 7, 'boosting_type': 'Plain', 'bootstrap_type': 'Bayesian', 'bagging_temperature': 2.854678973934868}. Best is trial 205 with value: 0.890909090909091.
[32m[I 2023-04-20 23:08:58,117][39m Trial 561 finished with value: 0.8807339449541284 and parameters: {'objective': 'Logloss', 'colsample_bylevel': 0.09636553432073898, 'depth': 8, 'boosting_type': 'Plain', 'bootstrap_type': 'Bayesian', 'bagging_temperature': 6.753988892275853}. Best is trial 205 with value: 0.890909090909091.
[32m[I 2023-04-20 23:08:58,967][39m Trial 562 finished with value: 0.8807339449541284 and parameters: {'objective': 'Logloss', 'colsample_bylevel': 0.0931996153134593, 'depth': 8, 'boosting_type': 'Plain', 'bootstrap_type': 'Bayesian', 'bagging_temperature': 5.6565755455312505}. Best is trial 205 with value: 0.890909090909091.
[32m[I 2023-04-20 23:09:00,528][39m Trial 563 finished with value: 0.888888888888889 and parameters: {'objective': 'Logloss', 'colsample_bylevel': 0.09816574729471496, 'depth': 9, 'boosting_type': 'Plain', 'bootstrap_type': 'Bayesian', 'bagging_temperature': 3.704241305794235}. Best is trial 205 with value: 0.890909090909091.
[32m[I 2023-04-20 23:09:01,652][39m Trial 564 finished with value: 0.8727272727272727 and parameters: {'objective': 'Logloss', 'colsample_bylevel': 0.09997685943250403, 'depth': 9, 'boosting_type': 'Plain', 'bootstrap_type': 'Bayesian', 'bagging_temperature': 3.8552888473082447}. Best is trial 205 with value: 0.890909090909091.
[32m[I 2023-04-20 23:09:02,591][39m Trial 565 finished with value: 0.8727272727272727 and parameters: {'objective': 'Logloss', 'colsample_bylevel': 0.09622944204041348, 'depth': 9, 'boosting_type': 'Plain', 'bootstrap_type': 'Bayesian', 'bagging_temperature': 3.6600029875624545}. Best is trial 205 with value: 0.890909090909091.
[32m[I 2023-04-20 23:09:03,654][39m Trial 566 finished with value: 0.8495575221238938 and parameters: {'objective': 'Logloss', 'colsample_bylevel': 0.09750209743140333, 'depth': 7, 'boosting_type': 'Plain', 'bootstrap_type': 'MVS'}. Best is trial 205 with value: 0.890909090909091.
[32m[I 2023-04-20 23:09:05,181][39m Trial 567 finished with value: 0.8807339449541284 and parameters: {'objective': 'Logloss', 'colsample_bylevel': 0.09577720286064877, 'depth': 9, 'boosting_type': 'Plain', 'bootstrap_type': 'Bayesian', 'bagging_temperature': 3.4699183886219056}. Best is trial 205 with value: 0.890909090909091.
[32m[I 2023-04-20 23:09:06,040][39m Trial 568 finished with value: 0.8807339449541284 and parameters: {'objective': 'Logloss', 'colsample_bylevel': 0.09831821851790143, 'depth': 12, 'boosting_type': 'Plain', 'bootstrap_type': 'Bayesian', 'bagging_temperature': 3.716023653787497}. Best is trial 205 with value: 0.890909090909091.
[32m[I 2023-04-20 23:09:06,703][39m Trial 569 finished with value: 0.8828828828828829 and parameters: {'objective': 'Logloss', 'colsample_bylevel': 0.09702151490711804, 'depth': 11, 'boosting_type': 'Plain', 'bootstrap_type': 'Bayesian', 'bagging_temperature': 3.2921531475147665}. Best is trial 205 with value: 0.890909090909091.
[32m[I 2023-04-20 23:09:07,855][39m Trial 570 finished with value: 0.8807339449541284 and parameters: {'objective': 'Logloss', 'colsample_bylevel': 0.0998167420222307, 'depth': 7, 'boosting_type': 'Plain', 'bootstrap_type': 'Bayesian', 'bagging_temperature': 3.788687379938673}. Best is trial 205 with value: 0.890909090909091.
[32m[I 2023-04-20 23:09:09,346][39m Trial 571 finished with value: 0.875 and parameters: {'objective': 'Logloss', 'colsample_bylevel': 0.09460186341363395, 'depth': 9, 'boosting_type': 'Plain', 'bootstrap_type': 'Bayesian', 'bagging_temperature': 3.526320774535543}. Best is trial 205 with value: 0.890909090909091.
[32m[I 2023-04-20 23:09:10,016][39m Trial 572 finished with value: 0.8648648648648648 and parameters: {'objective': 'Logloss', 'colsample_bylevel': 0.09788602003059801, 'depth': 7, 'boosting_type': 'Plain', 'bootstrap_type': 'Bayesian', 'bagging_temperature': 3.923005138680102}. Best is trial 205 with value: 0.890909090909091.
[32m[I 2023-04-20 23:09:10,826][39m Trial 573 finished with value: 0.8727272727272727 and parameters: {'objective': 'Logloss', 'colsample_bylevel': 0.09582361305311221, 'depth': 8, 'boosting_type': 'Plain', 'bootstrap_type': 'Bayesian', 'bagging_temperature': 4.037176576020216}. Best is trial 205 with value: 0.890909090909091.
[32m[I 2023-04-20 23:09:16,537][39m Trial 574 finished with value: 0.8571428571428572 and parameters: {'objective': 'Logloss', 'colsample_bylevel': 0.0937543260628333, 'depth': 7, 'boosting_type': 'Ordered', 'bootstrap_type': 'Bayesian', 'bagging_temperature': 2.041241396779948}. Best is trial 205 with value: 0.890909090909091.
[32m[I 2023-04-20 23:09:17,791][39m Trial 575 finished with value: 0.8672566371681416 and parameters: {'objective': 'Logloss', 'colsample_bylevel': 0.09136238741323323, 'depth': 8, 'boosting_type': 'Plain', 'bootstrap_type': 'Bernoulli', 'subsample': 0.6050213746530799}. Best is trial 205 with value: 0.890909090909091.
[32m[I 2023-04-20 23:09:18,641][39m Trial 576 finished with value: 0.8347826086956522 and parameters: {'objective': 'Logloss', 'colsample_bylevel': 0.0979293572683469, 'depth': 3, 'boosting_type': 'Plain', 'bootstrap_type': 'Bayesian', 'bagging_temperature': 3.7278504889325133}. Best is trial 205 with value: 0.890909090909091.
[32m[I 2023-04-20 23:09:20,200][39m Trial 577 finished with value: 0.8727272727272727 and parameters: {'objective': 'CrossEntropy', 'colsample_bylevel': 0.09590567626309515, 'depth': 8, 'boosting_type': 'Plain', 'bootstrap_type': 'Bayesian', 'bagging_temperature': 4.14811578440671}. Best is trial 205 with value: 0.890909090909091.
[32m[I 2023-04-20 23:09:20,902][39m Trial 578 finished with value: 0.8807339449541284 and parameters: {'objective': 'Logloss', 'colsample_bylevel': 0.09986386363014337, 'depth': 8, 'boosting_type': 'Plain', 'bootstrap_type': 'Bayesian', 'bagging_temperature': 3.5344706469749796}. Best is trial 205 with value: 0.890909090909091.
[32m[I 2023-04-20 23:09:22,270][39m Trial 579 finished with value: 0.8807339449541284 and parameters: {'objective': 'Logloss', 'colsample_bylevel': 0.09342495063127754, 'depth': 9, 'boosting_type': 'Plain', 'bootstrap_type': 'Bayesian', 'bagging_temperature': 3.1439795233718146}. Best is trial 205 with value: 0.890909090909091.
[32m[I 2023-04-20 23:09:23,395][39m Trial 580 finished with value: 0.8727272727272727 and parameters: {'objective': 'Logloss', 'colsample_bylevel': 0.0967713699912937, 'depth': 7, 'boosting_type': 'Plain', 'bootstrap_type': 'Bayesian', 'bagging_temperature': 4.9858299028216875}. Best is trial 205 with value: 0.890909090909091.
[32m[I 2023-04-20 23:09:24,163][39m Trial 581 finished with value: 0.8448275862068967 and parameters: {'objective': 'Logloss', 'colsample_bylevel': 0.03671170087777352, 'depth': 8, 'boosting_type': 'Plain', 'bootstrap_type': 'Bayesian', 'bagging_temperature': 4.022919145926169}. Best is trial 205 with value: 0.890909090909091.
[32m[I 2023-04-20 23:09:24,770][39m Trial 582 finished with value: 0.8305084745762712 and parameters: {'objective': 'Logloss', 'colsample_bylevel': 0.09805172464227405, 'depth': 2, 'boosting_type': 'Plain', 'bootstrap_type': 'Bayesian', 'bagging_temperature': 4.345358841295366}. Best is trial 205 with value: 0.890909090909091.
[32m[I 2023-04-20 23:09:25,757][39m Trial 583 finished with value: 0.8727272727272727 and parameters: {'objective': 'Logloss', 'colsample_bylevel': 0.09997278276374727, 'depth': 8, 'boosting_type': 'Plain', 'bootstrap_type': 'Bayesian', 'bagging_temperature': 5.275743784540469}. Best is trial 205 with value: 0.890909090909091.
[32m[I 2023-04-20 23:09:26,664][39m Trial 584 finished with value: 0.8727272727272727 and parameters: {'objective': 'Logloss', 'colsample_bylevel': 0.09529841885047148, 'depth': 7, 'boosting_type': 'Plain', 'bootstrap_type': 'Bayesian', 'bagging_temperature': 3.8302411223406985}. Best is trial 205 with value: 0.890909090909091.
[32m[I 2023-04-20 23:09:27,598][39m Trial 585 finished with value: 0.8807339449541284 and parameters: {'objective': 'Logloss', 'colsample_bylevel': 0.0969877297150228, 'depth': 8, 'boosting_type': 'Plain', 'bootstrap_type': 'Bayesian', 'bagging_temperature': 4.075783292980155}. Best is trial 205 with value: 0.890909090909091.
[32m[I 2023-04-20 23:09:28,690][39m Trial 586 finished with value: 0.8807339449541284 and parameters: {'objective': 'Logloss', 'colsample_bylevel': 0.0937237767493562, 'depth': 7, 'boosting_type': 'Plain', 'bootstrap_type': 'Bayesian', 'bagging_temperature': 8.317016526439668}. Best is trial 205 with value: 0.890909090909091.
[32m[I 2023-04-20 23:09:29,904][39m Trial 587 finished with value: 0.8727272727272727 and parameters: {'objective': 'Logloss', 'colsample_bylevel': 0.09821827354850289, 'depth': 9, 'boosting_type': 'Plain', 'bootstrap_type': 'Bayesian', 'bagging_temperature': 1.0945369880010651}. Best is trial 205 with value: 0.890909090909091.
[32m[I 2023-04-20 23:09:30,717][39m Trial 588 finished with value: 0.8672566371681416 and parameters: {'objective': 'Logloss', 'colsample_bylevel': 0.09533698600895309, 'depth': 8, 'boosting_type': 'Plain', 'bootstrap_type': 'MVS'}. Best is trial 205 with value: 0.890909090909091.
[32m[I 2023-04-20 23:09:31,697][39m Trial 589 finished with value: 0.8807339449541284 and parameters: {'objective': 'Logloss', 'colsample_bylevel': 0.0915361324107929, 'depth': 7, 'boosting_type': 'Plain', 'bootstrap_type': 'Bayesian', 'bagging_temperature': 6.604725488821998}. Best is trial 205 with value: 0.890909090909091.
[32m[I 2023-04-20 23:09:32,983][39m Trial 590 finished with value: 0.8305084745762712 and parameters: {'objective': 'Logloss', 'colsample_bylevel': 0.04257884643857826, 'depth': 8, 'boosting_type': 'Plain', 'bootstrap_type': 'Bayesian', 'bagging_temperature': 3.413987757920959}. Best is trial 205 with value: 0.890909090909091.
[32m[I 2023-04-20 23:09:33,795][39m Trial 591 finished with value: 0.8305084745762712 and parameters: {'objective': 'Logloss', 'colsample_bylevel': 0.027271970851963544, 'depth': 8, 'boosting_type': 'Plain', 'bootstrap_type': 'Bayesian', 'bagging_temperature': 4.732248736610415}. Best is trial 205 with value: 0.890909090909091.
[32m[I 2023-04-20 23:09:34,697][39m Trial 592 finished with value: 0.875 and parameters: {'objective': 'Logloss', 'colsample_bylevel': 0.09994853221773897, 'depth': 7, 'boosting_type': 'Plain', 'bootstrap_type': 'Bayesian', 'bagging_temperature': 3.653721511368682}. Best is trial 205 with value: 0.890909090909091.
[32m[I 2023-04-20 23:09:35,345][39m Trial 593 finished with value: 0.8727272727272727 and parameters: {'objective': 'Logloss', 'colsample_bylevel': 0.09681019526117429, 'depth': 8, 'boosting_type': 'Plain', 'bootstrap_type': 'Bayesian', 'bagging_temperature': 4.295265611296862}. Best is trial 205 with value: 0.890909090909091.
[32m[I 2023-04-20 23:09:40,462][39m Trial 594 finished with value: 0.8421052631578947 and parameters: {'objective': 'Logloss', 'colsample_bylevel': 0.09409828452932427, 'depth': 9, 'boosting_type': 'Ordered', 'bootstrap_type': 'Bayesian', 'bagging_temperature': 3.9169340283988365}. Best is trial 205 with value: 0.890909090909091.
[32m[I 2023-04-20 23:09:41,807][39m Trial 595 finished with value: 0.8807339449541284 and parameters: {'objective': 'Logloss', 'colsample_bylevel': 0.09834892545953636, 'depth': 8, 'boosting_type': 'Plain', 'bootstrap_type': 'Bayesian', 'bagging_temperature': 4.976815654255043}. Best is trial 205 with value: 0.890909090909091.
[32m[I 2023-04-20 23:09:43,238][39m Trial 596 finished with value: 0.8727272727272727 and parameters: {'objective': 'Logloss', 'colsample_bylevel': 0.09598684457116843, 'depth': 8, 'boosting_type': 'Plain', 'bootstrap_type': 'Bayesian', 'bagging_temperature': 5.448842865976651}. Best is trial 205 with value: 0.890909090909091.
[32m[I 2023-04-20 23:09:43,892][39m Trial 597 finished with value: 0.8727272727272727 and parameters: {'objective': 'CrossEntropy', 'colsample_bylevel': 0.09297446531699584, 'depth': 7, 'boosting_type': 'Plain', 'bootstrap_type': 'Bayesian', 'bagging_temperature': 4.460011184843783}. Best is trial 205 with value: 0.890909090909091.
