[32m[I 2023-04-21 00:59:51,704][39m Trial 5592 finished with value: 0.8648648648648648 and parameters: {'objective': 'CrossEntropy', 'colsample_bylevel': 0.08949757274526049, 'depth': 12, 'boosting_type': 'Plain', 'bootstrap_type': 'Bayesian', 'bagging_temperature': 6.930769121315639}. Best is trial 1464 with value: 0.8990825688073395.
[32m[I 2023-04-21 00:59:52,746][39m Trial 5593 finished with value: 0.8672566371681416 and parameters: {'objective': 'Logloss', 'colsample_bylevel': 0.08902795813477506, 'depth': 10, 'boosting_type': 'Plain', 'bootstrap_type': 'Bayesian', 'bagging_temperature': 5.487258574804198}. Best is trial 1464 with value: 0.8990825688073395.
[32m[I 2023-04-21 00:59:53,817][39m Trial 5594 finished with value: 0.8807339449541284 and parameters: {'objective': 'CrossEntropy', 'colsample_bylevel': 0.09036546352386167, 'depth': 11, 'boosting_type': 'Plain', 'bootstrap_type': 'Bayesian', 'bagging_temperature': 5.774956272155196}. Best is trial 1464 with value: 0.8990825688073395.
[32m[I 2023-04-21 00:59:54,931][39m Trial 5595 finished with value: 0.888888888888889 and parameters: {'objective': 'Logloss', 'colsample_bylevel': 0.09263733864705877, 'depth': 12, 'boosting_type': 'Plain', 'bootstrap_type': 'Bayesian', 'bagging_temperature': 6.427786280355245}. Best is trial 1464 with value: 0.8990825688073395.
[32m[I 2023-04-21 00:59:56,453][39m Trial 5596 finished with value: 0.8807339449541284 and parameters: {'objective': 'CrossEntropy', 'colsample_bylevel': 0.09645516743719582, 'depth': 7, 'boosting_type': 'Plain', 'bootstrap_type': 'Bayesian', 'bagging_temperature': 5.083967064546045}. Best is trial 1464 with value: 0.8990825688073395.
[32m[I 2023-04-21 00:59:57,652][39m Trial 5597 finished with value: 0.8807339449541284 and parameters: {'objective': 'Logloss', 'colsample_bylevel': 0.09181302977949983, 'depth': 10, 'boosting_type': 'Plain', 'bootstrap_type': 'Bayesian', 'bagging_temperature': 5.99378663849554}. Best is trial 1464 with value: 0.8990825688073395.
[32m[I 2023-04-21 00:59:58,672][39m Trial 5598 finished with value: 0.875 and parameters: {'objective': 'CrossEntropy', 'colsample_bylevel': 0.09419907124196206, 'depth': 12, 'boosting_type': 'Plain', 'bootstrap_type': 'Bayesian', 'bagging_temperature': 7.016662919456926}. Best is trial 1464 with value: 0.8990825688073395.
[32m[I 2023-04-21 01:00:00,178][39m Trial 5599 finished with value: 0.8807339449541284 and parameters: {'objective': 'CrossEntropy', 'colsample_bylevel': 0.09043106770837554, 'depth': 11, 'boosting_type': 'Plain', 'bootstrap_type': 'Bayesian', 'bagging_temperature': 5.6177658566484086}. Best is trial 1464 with value: 0.8990825688073395.
[32m[I 2023-04-21 01:00:00,996][39m Trial 5600 finished with value: 0.8376068376068375 and parameters: {'objective': 'Logloss', 'colsample_bylevel': 0.03285204570822132, 'depth': 10, 'boosting_type': 'Plain', 'bootstrap_type': 'Bayesian', 'bagging_temperature': 6.473962573175895}. Best is trial 1464 with value: 0.8990825688073395.
[32m[I 2023-04-21 01:00:01,599][39m Trial 5601 finished with value: 0.8545454545454546 and parameters: {'objective': 'CrossEntropy', 'colsample_bylevel': 0.09672343179558857, 'depth': 7, 'boosting_type': 'Plain', 'bootstrap_type': 'Bayesian', 'bagging_temperature': 6.556196780018996}. Best is trial 1464 with value: 0.8990825688073395.
[32m[I 2023-04-21 01:00:02,936][39m Trial 5602 finished with value: 0.8807339449541284 and parameters: {'objective': 'CrossEntropy', 'colsample_bylevel': 0.0943996365665606, 'depth': 9, 'boosting_type': 'Plain', 'bootstrap_type': 'Bayesian', 'bagging_temperature': 6.828525177458364}. Best is trial 1464 with value: 0.8990825688073395.
[32m[I 2023-04-21 01:00:03,866][39m Trial 5603 finished with value: 0.8807339449541284 and parameters: {'objective': 'Logloss', 'colsample_bylevel': 0.09639008824102949, 'depth': 9, 'boosting_type': 'Plain', 'bootstrap_type': 'Bayesian', 'bagging_temperature': 6.08235007512345}. Best is trial 1464 with value: 0.8990825688073395.
[32m[I 2023-04-21 01:00:05,496][39m Trial 5604 finished with value: 0.8807339449541284 and parameters: {'objective': 'Logloss', 'colsample_bylevel': 0.09534777246565798, 'depth': 9, 'boosting_type': 'Plain', 'bootstrap_type': 'Bayesian', 'bagging_temperature': 4.388723749886639}. Best is trial 1464 with value: 0.8990825688073395.
[32m[I 2023-04-21 01:00:07,313][39m Trial 5605 finished with value: 0.888888888888889 and parameters: {'objective': 'Logloss', 'colsample_bylevel': 0.09757749560197958, 'depth': 8, 'boosting_type': 'Plain', 'bootstrap_type': 'Bayesian', 'bagging_temperature': 5.212573661953752}. Best is trial 1464 with value: 0.8990825688073395.
[32m[I 2023-04-21 01:00:08,117][39m Trial 5606 finished with value: 0.8648648648648648 and parameters: {'objective': 'Logloss', 'colsample_bylevel': 0.09804663360314997, 'depth': 8, 'boosting_type': 'Plain', 'bootstrap_type': 'Bayesian', 'bagging_temperature': 5.012514934404077}. Best is trial 1464 with value: 0.8990825688073395.
[32m[I 2023-04-21 01:00:08,749][39m Trial 5607 finished with value: 0.8623853211009175 and parameters: {'objective': 'CrossEntropy', 'colsample_bylevel': 0.08702092342663592, 'depth': 12, 'boosting_type': 'Plain', 'bootstrap_type': 'Bayesian', 'bagging_temperature': 5.245277482377247}. Best is trial 1464 with value: 0.8990825688073395.
[32m[I 2023-04-21 01:00:14,228][39m Trial 5608 finished with value: 0.8347826086956522 and parameters: {'objective': 'Logloss', 'colsample_bylevel': 0.096950422580488, 'depth': 7, 'boosting_type': 'Ordered', 'bootstrap_type': 'Bernoulli', 'subsample': 0.5993118695761072}. Best is trial 1464 with value: 0.8990825688073395.
[32m[I 2023-04-21 01:00:15,286][39m Trial 5609 finished with value: 0.8727272727272727 and parameters: {'objective': 'CrossEntropy', 'colsample_bylevel': 0.09096829372040754, 'depth': 12, 'boosting_type': 'Plain', 'bootstrap_type': 'Bayesian', 'bagging_temperature': 5.2326159083742345}. Best is trial 1464 with value: 0.8990825688073395.
[32m[I 2023-04-21 01:00:16,701][39m Trial 5610 finished with value: 0.8727272727272727 and parameters: {'objective': 'Logloss', 'colsample_bylevel': 0.09122138977689156, 'depth': 12, 'boosting_type': 'Plain', 'bootstrap_type': 'Bayesian', 'bagging_temperature': 5.464873344266984}. Best is trial 1464 with value: 0.8990825688073395.
[32m[I 2023-04-21 01:00:17,711][39m Trial 5611 finished with value: 0.8623853211009175 and parameters: {'objective': 'CrossEntropy', 'colsample_bylevel': 0.08726116424216533, 'depth': 12, 'boosting_type': 'Plain', 'bootstrap_type': 'Bayesian', 'bagging_temperature': 5.113494613133899}. Best is trial 1464 with value: 0.8990825688073395.
[32m[I 2023-04-21 01:00:18,877][39m Trial 5612 finished with value: 0.8807339449541284 and parameters: {'objective': 'CrossEntropy', 'colsample_bylevel': 0.08871141184410299, 'depth': 11, 'boosting_type': 'Plain', 'bootstrap_type': 'Bayesian', 'bagging_temperature': 4.899721792205721}. Best is trial 1464 with value: 0.8990825688073395.
[32m[I 2023-04-21 01:00:20,168][39m Trial 5613 finished with value: 0.8727272727272727 and parameters: {'objective': 'CrossEntropy', 'colsample_bylevel': 0.0954417223366631, 'depth': 11, 'boosting_type': 'Plain', 'bootstrap_type': 'Bayesian', 'bagging_temperature': 5.954249383692424}. Best is trial 1464 with value: 0.8990825688073395.
[32m[I 2023-04-21 01:00:21,182][39m Trial 5614 finished with value: 0.8571428571428572 and parameters: {'objective': 'Logloss', 'colsample_bylevel': 0.08886178309115858, 'depth': 12, 'boosting_type': 'Plain', 'bootstrap_type': 'MVS'}. Best is trial 1464 with value: 0.8990825688073395.
[32m[I 2023-04-21 01:00:22,074][39m Trial 5615 finished with value: 0.8648648648648648 and parameters: {'objective': 'Logloss', 'colsample_bylevel': 0.08862481116353067, 'depth': 6, 'boosting_type': 'Plain', 'bootstrap_type': 'Bayesian', 'bagging_temperature': 3.172241348535907}. Best is trial 1464 with value: 0.8990825688073395.
[32m[I 2023-04-21 01:00:23,014][39m Trial 5616 finished with value: 0.8468468468468469 and parameters: {'objective': 'Logloss', 'colsample_bylevel': 0.0910309983098622, 'depth': 12, 'boosting_type': 'Plain', 'bootstrap_type': 'Bayesian', 'bagging_temperature': 5.567320092201334}. Best is trial 1464 with value: 0.8990825688073395.
[32m[I 2023-04-21 01:00:23,735][39m Trial 5617 finished with value: 0.8305084745762712 and parameters: {'objective': 'CrossEntropy', 'colsample_bylevel': 0.07688432897837559, 'depth': 1, 'boosting_type': 'Plain', 'bootstrap_type': 'Bayesian', 'bagging_temperature': 7.451843298026409}. Best is trial 1464 with value: 0.8990825688073395.
[32m[I 2023-04-21 01:00:24,876][39m Trial 5618 finished with value: 0.8727272727272727 and parameters: {'objective': 'CrossEntropy', 'colsample_bylevel': 0.08731866184633702, 'depth': 12, 'boosting_type': 'Plain', 'bootstrap_type': 'Bayesian', 'bagging_temperature': 5.72072072793556}. Best is trial 1464 with value: 0.8990825688073395.
[32m[I 2023-04-21 01:00:25,987][39m Trial 5619 finished with value: 0.8623853211009175 and parameters: {'objective': 'CrossEntropy', 'colsample_bylevel': 0.0929245491586945, 'depth': 9, 'boosting_type': 'Plain', 'bootstrap_type': 'Bayesian', 'bagging_temperature': 5.458609072207749}. Best is trial 1464 with value: 0.8990825688073395.
[32m[I 2023-04-21 01:00:27,288][39m Trial 5620 finished with value: 0.8807339449541284 and parameters: {'objective': 'CrossEntropy', 'colsample_bylevel': 0.08673612284999396, 'depth': 10, 'boosting_type': 'Plain', 'bootstrap_type': 'Bayesian', 'bagging_temperature': 5.088089172831054}. Best is trial 1464 with value: 0.8990825688073395.
[32m[I 2023-04-21 01:00:28,413][39m Trial 5621 finished with value: 0.8421052631578947 and parameters: {'objective': 'Logloss', 'colsample_bylevel': 0.04292399279939168, 'depth': 10, 'boosting_type': 'Plain', 'bootstrap_type': 'Bayesian', 'bagging_temperature': 3.2520611083716884}. Best is trial 1464 with value: 0.8990825688073395.
[32m[I 2023-04-21 01:00:29,512][39m Trial 5622 finished with value: 0.888888888888889 and parameters: {'objective': 'Logloss', 'colsample_bylevel': 0.08983199112043294, 'depth': 12, 'boosting_type': 'Plain', 'bootstrap_type': 'Bayesian', 'bagging_temperature': 4.932801711311569}. Best is trial 1464 with value: 0.8990825688073395.
[32m[I 2023-04-21 01:00:30,652][39m Trial 5623 finished with value: 0.8807339449541284 and parameters: {'objective': 'Logloss', 'colsample_bylevel': 0.09992782998021696, 'depth': 12, 'boosting_type': 'Plain', 'bootstrap_type': 'Bayesian', 'bagging_temperature': 3.4877785899648988}. Best is trial 1464 with value: 0.8990825688073395.
[32m[I 2023-04-21 01:00:32,120][39m Trial 5624 finished with value: 0.8727272727272727 and parameters: {'objective': 'Logloss', 'colsample_bylevel': 0.09626936685968936, 'depth': 9, 'boosting_type': 'Plain', 'bootstrap_type': 'Bayesian', 'bagging_temperature': 4.762897411034409}. Best is trial 1464 with value: 0.8990825688073395.
[32m[I 2023-04-21 01:00:33,038][39m Trial 5625 finished with value: 0.8275862068965517 and parameters: {'objective': 'Logloss', 'colsample_bylevel': 0.05367382722718269, 'depth': 10, 'boosting_type': 'Plain', 'bootstrap_type': 'Bayesian', 'bagging_temperature': 3.3814322084115402}. Best is trial 1464 with value: 0.8990825688073395.
[32m[I 2023-04-21 01:00:37,925][39m Trial 5626 finished with value: 0.8623853211009175 and parameters: {'objective': 'CrossEntropy', 'colsample_bylevel': 0.09249505120901053, 'depth': 9, 'boosting_type': 'Ordered', 'bootstrap_type': 'Bayesian', 'bagging_temperature': 6.628604291275865}. Best is trial 1464 with value: 0.8990825688073395.
[32m[I 2023-04-21 01:00:39,227][39m Trial 5627 finished with value: 0.890909090909091 and parameters: {'objective': 'CrossEntropy', 'colsample_bylevel': 0.09129986100979368, 'depth': 12, 'boosting_type': 'Plain', 'bootstrap_type': 'Bayesian', 'bagging_temperature': 6.3332345639487055}. Best is trial 1464 with value: 0.8990825688073395.
[32m[I 2023-04-21 01:00:40,515][39m Trial 5628 finished with value: 0.8807339449541284 and parameters: {'objective': 'CrossEntropy', 'colsample_bylevel': 0.0996168357941593, 'depth': 12, 'boosting_type': 'Plain', 'bootstrap_type': 'Bayesian', 'bagging_temperature': 6.324076229630056}. Best is trial 1464 with value: 0.8990825688073395.
[32m[I 2023-04-21 01:00:41,956][39m Trial 5629 finished with value: 0.8571428571428572 and parameters: {'objective': 'Logloss', 'colsample_bylevel': 0.08191961210448172, 'depth': 9, 'boosting_type': 'Plain', 'bootstrap_type': 'Bayesian', 'bagging_temperature': 6.424407659180525}. Best is trial 1464 with value: 0.8990825688073395.
[32m[I 2023-04-21 01:00:43,288][39m Trial 5630 finished with value: 0.875 and parameters: {'objective': 'CrossEntropy', 'colsample_bylevel': 0.0961325663187055, 'depth': 7, 'boosting_type': 'Plain', 'bootstrap_type': 'Bernoulli', 'subsample': 0.42117865773909957}. Best is trial 1464 with value: 0.8990825688073395.
[32m[I 2023-04-21 01:00:44,340][39m Trial 5631 finished with value: 0.8727272727272727 and parameters: {'objective': 'CrossEntropy', 'colsample_bylevel': 0.08918948392996863, 'depth': 11, 'boosting_type': 'Plain', 'bootstrap_type': 'Bayesian', 'bagging_temperature': 7.141286814071649}. Best is trial 1464 with value: 0.8990825688073395.
[32m[I 2023-04-21 01:00:45,451][39m Trial 5632 finished with value: 0.8807339449541284 and parameters: {'objective': 'Logloss', 'colsample_bylevel': 0.09844622948231677, 'depth': 6, 'boosting_type': 'Plain', 'bootstrap_type': 'Bayesian', 'bagging_temperature': 6.238062972128029}. Best is trial 1464 with value: 0.8990825688073395.
[32m[I 2023-04-21 01:00:46,840][39m Trial 5633 finished with value: 0.875 and parameters: {'objective': 'CrossEntropy', 'colsample_bylevel': 0.0837400118621045, 'depth': 8, 'boosting_type': 'Plain', 'bootstrap_type': 'Bayesian', 'bagging_temperature': 5.691234908849688}. Best is trial 1464 with value: 0.8990825688073395.
[32m[I 2023-04-21 01:00:47,792][39m Trial 5634 finished with value: 0.8421052631578947 and parameters: {'objective': 'Logloss', 'colsample_bylevel': 0.0935738598502944, 'depth': 9, 'boosting_type': 'Plain', 'bootstrap_type': 'MVS'}. Best is trial 1464 with value: 0.8990825688073395.
[32m[I 2023-04-21 01:00:48,698][39m Trial 5635 finished with value: 0.8807339449541284 and parameters: {'objective': 'Logloss', 'colsample_bylevel': 0.09497358943937614, 'depth': 9, 'boosting_type': 'Plain', 'bootstrap_type': 'Bayesian', 'bagging_temperature': 3.4892948842062914}. Best is trial 1464 with value: 0.8990825688073395.
[32m[I 2023-04-21 01:00:50,039][39m Trial 5636 finished with value: 0.8596491228070176 and parameters: {'objective': 'Logloss', 'colsample_bylevel': 0.06315397424837428, 'depth': 11, 'boosting_type': 'Plain', 'bootstrap_type': 'Bayesian', 'bagging_temperature': 5.47724942808807}. Best is trial 1464 with value: 0.8990825688073395.
[32m[I 2023-04-21 01:00:52,156][39m Trial 5637 finished with value: 0.8727272727272727 and parameters: {'objective': 'Logloss', 'colsample_bylevel': 0.09546394520620381, 'depth': 9, 'boosting_type': 'Plain', 'bootstrap_type': 'Bayesian', 'bagging_temperature': 7.094842364626968}. Best is trial 1464 with value: 0.8990825688073395.
[32m[I 2023-04-21 01:00:53,025][39m Trial 5638 finished with value: 0.8727272727272727 and parameters: {'objective': 'Logloss', 'colsample_bylevel': 0.0981860407748517, 'depth': 6, 'boosting_type': 'Plain', 'bootstrap_type': 'Bayesian', 'bagging_temperature': 5.714275595444568}. Best is trial 1464 with value: 0.8990825688073395.
[32m[I 2023-04-21 01:00:54,287][39m Trial 5639 finished with value: 0.8727272727272727 and parameters: {'objective': 'Logloss', 'colsample_bylevel': 0.09378618283288034, 'depth': 9, 'boosting_type': 'Plain', 'bootstrap_type': 'Bayesian', 'bagging_temperature': 7.222225575187171}. Best is trial 1464 with value: 0.8990825688073395.
[32m[I 2023-04-21 01:00:55,178][39m Trial 5640 finished with value: 0.8571428571428572 and parameters: {'objective': 'Logloss', 'colsample_bylevel': 0.09229229495613502, 'depth': 9, 'boosting_type': 'Plain', 'bootstrap_type': 'Bayesian', 'bagging_temperature': 6.044273801115171}. Best is trial 1464 with value: 0.8990825688073395.
[32m[I 2023-04-21 01:00:56,449][39m Trial 5641 finished with value: 0.8648648648648648 and parameters: {'objective': 'Logloss', 'colsample_bylevel': 0.09122097538926159, 'depth': 11, 'boosting_type': 'Plain', 'bootstrap_type': 'Bayesian', 'bagging_temperature': 4.127865112943447}. Best is trial 1464 with value: 0.8990825688073395.
[32m[I 2023-04-21 01:00:57,446][39m Trial 5642 finished with value: 0.8727272727272727 and parameters: {'objective': 'CrossEntropy', 'colsample_bylevel': 0.09170293712831443, 'depth': 11, 'boosting_type': 'Plain', 'bootstrap_type': 'Bayesian', 'bagging_temperature': 5.750797776175296}. Best is trial 1464 with value: 0.8990825688073395.
[32m[I 2023-04-21 01:00:58,923][39m Trial 5643 finished with value: 0.8727272727272727 and parameters: {'objective': 'Logloss', 'colsample_bylevel': 0.09419861889757826, 'depth': 9, 'boosting_type': 'Plain', 'bootstrap_type': 'Bayesian', 'bagging_temperature': 6.815079051589558}. Best is trial 1464 with value: 0.8990825688073395.
[32m[I 2023-04-21 01:01:00,577][39m Trial 5644 finished with value: 0.8623853211009175 and parameters: {'objective': 'CrossEntropy', 'colsample_bylevel': 0.09290286382630661, 'depth': 9, 'boosting_type': 'Plain', 'bootstrap_type': 'Bayesian', 'bagging_temperature': 6.42842261088594}. Best is trial 1464 with value: 0.8990825688073395.
[32m[I 2023-04-21 01:01:05,173][39m Trial 5645 finished with value: 0.8648648648648648 and parameters: {'objective': 'CrossEntropy', 'colsample_bylevel': 0.09434078471377975, 'depth': 10, 'boosting_type': 'Ordered', 'bootstrap_type': 'Bayesian', 'bagging_temperature': 6.111158581873777}. Best is trial 1464 with value: 0.8990825688073395.
[32m[I 2023-04-21 01:01:07,085][39m Trial 5646 finished with value: 0.8727272727272727 and parameters: {'objective': 'Logloss', 'colsample_bylevel': 0.09570584922913598, 'depth': 9, 'boosting_type': 'Plain', 'bootstrap_type': 'Bayesian', 'bagging_temperature': 7.24508054080073}. Best is trial 1464 with value: 0.8990825688073395.
[32m[I 2023-04-21 01:01:08,597][39m Trial 5647 finished with value: 0.8727272727272727 and parameters: {'objective': 'Logloss', 'colsample_bylevel': 0.09264395487765671, 'depth': 10, 'boosting_type': 'Plain', 'bootstrap_type': 'Bayesian', 'bagging_temperature': 6.293557608428642}. Best is trial 1464 with value: 0.8990825688073395.
[32m[I 2023-04-21 01:01:09,353][39m Trial 5648 finished with value: 0.888888888888889 and parameters: {'objective': 'Logloss', 'colsample_bylevel': 0.09220548205871262, 'depth': 10, 'boosting_type': 'Plain', 'bootstrap_type': 'Bayesian', 'bagging_temperature': 6.055577987572375}. Best is trial 1464 with value: 0.8990825688073395.
[32m[I 2023-04-21 01:01:10,738][39m Trial 5649 finished with value: 0.8785046728971961 and parameters: {'objective': 'CrossEntropy', 'colsample_bylevel': 0.09978453444681741, 'depth': 7, 'boosting_type': 'Plain', 'bootstrap_type': 'Bayesian', 'bagging_temperature': 4.873182677927143}. Best is trial 1464 with value: 0.8990825688073395.
[32m[I 2023-04-21 01:01:11,653][39m Trial 5650 finished with value: 0.8807339449541284 and parameters: {'objective': 'Logloss', 'colsample_bylevel': 0.09016402151261177, 'depth': 12, 'boosting_type': 'Plain', 'bootstrap_type': 'Bayesian', 'bagging_temperature': 5.408907257787747}. Best is trial 1464 with value: 0.8990825688073395.
[32m[I 2023-04-21 01:01:13,047][39m Trial 5651 finished with value: 0.8807339449541284 and parameters: {'objective': 'CrossEntropy', 'colsample_bylevel': 0.09457186059231981, 'depth': 7, 'boosting_type': 'Plain', 'bootstrap_type': 'Bayesian', 'bagging_temperature': 5.26609828502598}. Best is trial 1464 with value: 0.8990825688073395.
[32m[I 2023-04-21 01:01:14,120][39m Trial 5652 finished with value: 0.8828828828828829 and parameters: {'objective': 'Logloss', 'colsample_bylevel': 0.09459452857179945, 'depth': 7, 'boosting_type': 'Plain', 'bootstrap_type': 'Bayesian', 'bagging_temperature': 7.3028676756328865}. Best is trial 1464 with value: 0.8990825688073395.
[32m[I 2023-04-21 01:01:15,256][39m Trial 5653 finished with value: 0.875 and parameters: {'objective': 'CrossEntropy', 'colsample_bylevel': 0.08674246643914957, 'depth': 12, 'boosting_type': 'Plain', 'bootstrap_type': 'Bernoulli', 'subsample': 0.8066308532549262}. Best is trial 1464 with value: 0.8990825688073395.
[32m[I 2023-04-21 01:01:15,997][39m Trial 5654 finished with value: 0.8727272727272727 and parameters: {'objective': 'Logloss', 'colsample_bylevel': 0.08912481498692121, 'depth': 12, 'boosting_type': 'Plain', 'bootstrap_type': 'Bayesian', 'bagging_temperature': 4.854195078573853}. Best is trial 1464 with value: 0.8990825688073395.
[32m[I 2023-04-21 01:01:16,864][39m Trial 5655 finished with value: 0.8672566371681416 and parameters: {'objective': 'CrossEntropy', 'colsample_bylevel': 0.08911823323944766, 'depth': 11, 'boosting_type': 'Plain', 'bootstrap_type': 'Bayesian', 'bagging_temperature': 5.812194668733862}. Best is trial 1464 with value: 0.8990825688073395.
[32m[I 2023-04-21 01:01:18,946][39m Trial 5656 finished with value: 0.8727272727272727 and parameters: {'objective': 'Logloss', 'colsample_bylevel': 0.09271660810980677, 'depth': 9, 'boosting_type': 'Plain', 'bootstrap_type': 'Bayesian', 'bagging_temperature': 3.765536249863369}. Best is trial 1464 with value: 0.8990825688073395.
