[32m[I 2023-04-21 00:18:20,636][39m Trial 3755 finished with value: 0.875 and parameters: {'objective': 'Logloss', 'colsample_bylevel': 0.09601916691953065, 'depth': 6, 'boosting_type': 'Plain', 'bootstrap_type': 'Bayesian', 'bagging_temperature': 4.219140394839355}. Best is trial 1464 with value: 0.8990825688073395.
[32m[I 2023-04-21 00:18:22,242][39m Trial 3756 finished with value: 0.8495575221238938 and parameters: {'objective': 'Logloss', 'colsample_bylevel': 0.09411399555195843, 'depth': 9, 'boosting_type': 'Plain', 'bootstrap_type': 'MVS'}. Best is trial 1464 with value: 0.8990825688073395.
[32m[I 2023-04-21 00:18:23,272][39m Trial 3757 finished with value: 0.8727272727272727 and parameters: {'objective': 'Logloss', 'colsample_bylevel': 0.09837501284524795, 'depth': 8, 'boosting_type': 'Plain', 'bootstrap_type': 'Bayesian', 'bagging_temperature': 6.265582220928616}. Best is trial 1464 with value: 0.8990825688073395.
[32m[I 2023-04-21 00:18:24,042][39m Trial 3758 finished with value: 0.8807339449541284 and parameters: {'objective': 'Logloss', 'colsample_bylevel': 0.09996513485989404, 'depth': 7, 'boosting_type': 'Plain', 'bootstrap_type': 'Bayesian', 'bagging_temperature': 6.030337789401368}. Best is trial 1464 with value: 0.8990825688073395.
[32m[I 2023-04-21 00:18:25,001][39m Trial 3759 finished with value: 0.8807339449541284 and parameters: {'objective': 'CrossEntropy', 'colsample_bylevel': 0.0925757094598582, 'depth': 8, 'boosting_type': 'Plain', 'bootstrap_type': 'Bayesian', 'bagging_temperature': 5.387944741446305}. Best is trial 1464 with value: 0.8990825688073395.
[32m[I 2023-04-21 00:18:26,849][39m Trial 3760 finished with value: 0.8785046728971961 and parameters: {'objective': 'Logloss', 'colsample_bylevel': 0.09639135332323172, 'depth': 8, 'boosting_type': 'Plain', 'bootstrap_type': 'Bayesian', 'bagging_temperature': 5.140166056070888}. Best is trial 1464 with value: 0.8990825688073395.
[32m[I 2023-04-21 00:18:27,590][39m Trial 3761 finished with value: 0.8727272727272727 and parameters: {'objective': 'CrossEntropy', 'colsample_bylevel': 0.08959350899679337, 'depth': 11, 'boosting_type': 'Plain', 'bootstrap_type': 'Bayesian', 'bagging_temperature': 5.530931930166828}. Best is trial 1464 with value: 0.8990825688073395.
[32m[I 2023-04-21 00:18:28,723][39m Trial 3762 finished with value: 0.8727272727272727 and parameters: {'objective': 'CrossEntropy', 'colsample_bylevel': 0.09716883627857127, 'depth': 10, 'boosting_type': 'Plain', 'bootstrap_type': 'Bayesian', 'bagging_temperature': 6.799285002378979}. Best is trial 1464 with value: 0.8990825688073395.
[32m[I 2023-04-21 00:18:29,860][39m Trial 3763 finished with value: 0.8807339449541284 and parameters: {'objective': 'Logloss', 'colsample_bylevel': 0.09811707807392171, 'depth': 8, 'boosting_type': 'Plain', 'bootstrap_type': 'Bayesian', 'bagging_temperature': 5.0282933367605995}. Best is trial 1464 with value: 0.8990825688073395.
[32m[I 2023-04-21 00:18:31,064][39m Trial 3764 finished with value: 0.8727272727272727 and parameters: {'objective': 'Logloss', 'colsample_bylevel': 0.09522569943118432, 'depth': 7, 'boosting_type': 'Plain', 'bootstrap_type': 'Bayesian', 'bagging_temperature': 5.831028430413807}. Best is trial 1464 with value: 0.8990825688073395.
[32m[I 2023-04-21 00:18:31,987][39m Trial 3765 finished with value: 0.8545454545454546 and parameters: {'objective': 'Logloss', 'colsample_bylevel': 0.09518928613137784, 'depth': 7, 'boosting_type': 'Plain', 'bootstrap_type': 'Bayesian', 'bagging_temperature': 7.3783875569880175}. Best is trial 1464 with value: 0.8990825688073395.
[32m[I 2023-04-21 00:18:33,644][39m Trial 3766 finished with value: 0.8727272727272727 and parameters: {'objective': 'Logloss', 'colsample_bylevel': 0.0983244503401304, 'depth': 8, 'boosting_type': 'Plain', 'bootstrap_type': 'Bayesian', 'bagging_temperature': 4.374327825940912}. Best is trial 1464 with value: 0.8990825688073395.
[32m[I 2023-04-21 00:18:34,719][39m Trial 3767 finished with value: 0.888888888888889 and parameters: {'objective': 'Logloss', 'colsample_bylevel': 0.09780785615876682, 'depth': 10, 'boosting_type': 'Plain', 'bootstrap_type': 'Bayesian', 'bagging_temperature': 5.722623285581443}. Best is trial 1464 with value: 0.8990825688073395.
[32m[I 2023-04-21 00:18:35,999][39m Trial 3768 finished with value: 0.8807339449541284 and parameters: {'objective': 'Logloss', 'colsample_bylevel': 0.09234706660816398, 'depth': 10, 'boosting_type': 'Plain', 'bootstrap_type': 'Bayesian', 'bagging_temperature': 3.6538180297723217}. Best is trial 1464 with value: 0.8990825688073395.
[32m[I 2023-04-21 00:18:37,576][39m Trial 3769 finished with value: 0.8727272727272727 and parameters: {'objective': 'Logloss', 'colsample_bylevel': 0.09388838312639326, 'depth': 9, 'boosting_type': 'Plain', 'bootstrap_type': 'Bayesian', 'bagging_temperature': 5.7697871411419035}. Best is trial 1464 with value: 0.8990825688073395.
[32m[I 2023-04-21 00:18:41,861][39m Trial 3770 finished with value: 0.8275862068965517 and parameters: {'objective': 'CrossEntropy', 'colsample_bylevel': 0.09353127300965837, 'depth': 9, 'boosting_type': 'Ordered', 'bootstrap_type': 'Bayesian', 'bagging_temperature': 5.00082321612421}. Best is trial 1464 with value: 0.8990825688073395.
[32m[I 2023-04-21 00:18:43,170][39m Trial 3771 finished with value: 0.8376068376068375 and parameters: {'objective': 'Logloss', 'colsample_bylevel': 0.03322381182462223, 'depth': 9, 'boosting_type': 'Plain', 'bootstrap_type': 'Bayesian', 'bagging_temperature': 5.959300998914619}. Best is trial 1464 with value: 0.8990825688073395.
[32m[I 2023-04-21 00:18:44,476][39m Trial 3772 finished with value: 0.888888888888889 and parameters: {'objective': 'Logloss', 'colsample_bylevel': 0.09561253555199584, 'depth': 10, 'boosting_type': 'Plain', 'bootstrap_type': 'Bayesian', 'bagging_temperature': 6.050004117847332}. Best is trial 1464 with value: 0.8990825688073395.
[32m[I 2023-04-21 00:18:45,194][39m Trial 3773 finished with value: 0.888888888888889 and parameters: {'objective': 'Logloss', 'colsample_bylevel': 0.09364578534281798, 'depth': 10, 'boosting_type': 'Plain', 'bootstrap_type': 'Bayesian', 'bagging_temperature': 4.075355252764467}. Best is trial 1464 with value: 0.8990825688073395.
[32m[I 2023-04-21 00:18:46,604][39m Trial 3774 finished with value: 0.875 and parameters: {'objective': 'Logloss', 'colsample_bylevel': 0.0933948096623941, 'depth': 10, 'boosting_type': 'Plain', 'bootstrap_type': 'Bernoulli', 'subsample': 0.5909863451549258}. Best is trial 1464 with value: 0.8990825688073395.
[32m[I 2023-04-21 00:18:47,931][39m Trial 3775 finished with value: 0.8807339449541284 and parameters: {'objective': 'Logloss', 'colsample_bylevel': 0.09990100346766512, 'depth': 9, 'boosting_type': 'Plain', 'bootstrap_type': 'Bayesian', 'bagging_temperature': 6.066020040754148}. Best is trial 1464 with value: 0.8990825688073395.
[32m[I 2023-04-21 00:18:49,284][39m Trial 3776 finished with value: 0.8672566371681416 and parameters: {'objective': 'Logloss', 'colsample_bylevel': 0.090397096174893, 'depth': 9, 'boosting_type': 'Plain', 'bootstrap_type': 'Bayesian', 'bagging_temperature': 5.611827164420849}. Best is trial 1464 with value: 0.8990825688073395.
[32m[I 2023-04-21 00:18:50,681][39m Trial 3777 finished with value: 0.8672566371681416 and parameters: {'objective': 'Logloss', 'colsample_bylevel': 0.09849557248352651, 'depth': 9, 'boosting_type': 'Plain', 'bootstrap_type': 'MVS'}. Best is trial 1464 with value: 0.8990825688073395.
[32m[I 2023-04-21 00:18:51,605][39m Trial 3778 finished with value: 0.8727272727272727 and parameters: {'objective': 'CrossEntropy', 'colsample_bylevel': 0.09871156097141226, 'depth': 9, 'boosting_type': 'Plain', 'bootstrap_type': 'Bayesian', 'bagging_temperature': 5.072269542037856}. Best is trial 1464 with value: 0.8990825688073395.
[32m[I 2023-04-21 00:18:52,729][39m Trial 3779 finished with value: 0.8521739130434783 and parameters: {'objective': 'Logloss', 'colsample_bylevel': 0.05043322988712385, 'depth': 9, 'boosting_type': 'Plain', 'bootstrap_type': 'Bayesian', 'bagging_temperature': 5.741629562735477}. Best is trial 1464 with value: 0.8990825688073395.
[32m[I 2023-04-21 00:18:53,587][39m Trial 3780 finished with value: 0.8648648648648648 and parameters: {'objective': 'Logloss', 'colsample_bylevel': 0.08957789849665158, 'depth': 8, 'boosting_type': 'Plain', 'bootstrap_type': 'Bayesian', 'bagging_temperature': 5.881616599537724}. Best is trial 1464 with value: 0.8990825688073395.
[32m[I 2023-04-21 00:18:54,394][39m Trial 3781 finished with value: 0.8727272727272727 and parameters: {'objective': 'Logloss', 'colsample_bylevel': 0.09188448083806947, 'depth': 9, 'boosting_type': 'Plain', 'bootstrap_type': 'Bayesian', 'bagging_temperature': 5.680217655810448}. Best is trial 1464 with value: 0.8990825688073395.
[32m[I 2023-04-21 00:18:55,814][39m Trial 3782 finished with value: 0.8623853211009175 and parameters: {'objective': 'Logloss', 'colsample_bylevel': 0.09594536063944752, 'depth': 6, 'boosting_type': 'Plain', 'bootstrap_type': 'Bayesian', 'bagging_temperature': 6.331518467589974}. Best is trial 1464 with value: 0.8990825688073395.
[32m[I 2023-04-21 00:18:57,103][39m Trial 3783 finished with value: 0.8648648648648648 and parameters: {'objective': 'Logloss', 'colsample_bylevel': 0.09506303401270584, 'depth': 10, 'boosting_type': 'Plain', 'bootstrap_type': 'Bayesian', 'bagging_temperature': 6.011031897977182}. Best is trial 1464 with value: 0.8990825688073395.
[32m[I 2023-04-21 00:18:58,592][39m Trial 3784 finished with value: 0.8727272727272727 and parameters: {'objective': 'Logloss', 'colsample_bylevel': 0.09520718633196228, 'depth': 9, 'boosting_type': 'Plain', 'bootstrap_type': 'Bayesian', 'bagging_temperature': 5.734805070259162}. Best is trial 1464 with value: 0.8990825688073395.
[32m[I 2023-04-21 00:18:59,312][39m Trial 3785 finished with value: 0.8727272727272727 and parameters: {'objective': 'CrossEntropy', 'colsample_bylevel': 0.0948288373724207, 'depth': 10, 'boosting_type': 'Plain', 'bootstrap_type': 'Bayesian', 'bagging_temperature': 6.039496747944443}. Best is trial 1464 with value: 0.8990825688073395.
[32m[I 2023-04-21 00:19:00,622][39m Trial 3786 finished with value: 0.875 and parameters: {'objective': 'Logloss', 'colsample_bylevel': 0.09773886852473516, 'depth': 6, 'boosting_type': 'Plain', 'bootstrap_type': 'Bayesian', 'bagging_temperature': 3.398270781051203}. Best is trial 1464 with value: 0.8990825688073395.
[32m[I 2023-04-21 00:19:01,404][39m Trial 3787 finished with value: 0.8807339449541284 and parameters: {'objective': 'Logloss', 'colsample_bylevel': 0.09613868452891891, 'depth': 10, 'boosting_type': 'Plain', 'bootstrap_type': 'Bayesian', 'bagging_temperature': 5.8749783575869365}. Best is trial 1464 with value: 0.8990825688073395.
[32m[I 2023-04-21 00:19:03,241][39m Trial 3788 finished with value: 0.8727272727272727 and parameters: {'objective': 'Logloss', 'colsample_bylevel': 0.09439460086072192, 'depth': 9, 'boosting_type': 'Plain', 'bootstrap_type': 'Bayesian', 'bagging_temperature': 6.5228363194893575}. Best is trial 1464 with value: 0.8990825688073395.
[32m[I 2023-04-21 00:19:08,226][39m Trial 3789 finished with value: 0.8596491228070176 and parameters: {'objective': 'Logloss', 'colsample_bylevel': 0.0952782840883813, 'depth': 9, 'boosting_type': 'Ordered', 'bootstrap_type': 'Bayesian', 'bagging_temperature': 5.1223427841292315}. Best is trial 1464 with value: 0.8990825688073395.
[32m[I 2023-04-21 00:19:09,189][39m Trial 3790 finished with value: 0.888888888888889 and parameters: {'objective': 'Logloss', 'colsample_bylevel': 0.09680866081337677, 'depth': 11, 'boosting_type': 'Plain', 'bootstrap_type': 'Bayesian', 'bagging_temperature': 6.817069047731437}. Best is trial 1464 with value: 0.8990825688073395.
[32m[I 2023-04-21 00:19:10,248][39m Trial 3791 finished with value: 0.890909090909091 and parameters: {'objective': 'Logloss', 'colsample_bylevel': 0.09644445695313442, 'depth': 7, 'boosting_type': 'Plain', 'bootstrap_type': 'Bayesian', 'bagging_temperature': 5.934401329202264}. Best is trial 1464 with value: 0.8990825688073395.
[32m[I 2023-04-21 00:19:11,346][39m Trial 3792 finished with value: 0.8807339449541284 and parameters: {'objective': 'Logloss', 'colsample_bylevel': 0.09718105960157457, 'depth': 7, 'boosting_type': 'Plain', 'bootstrap_type': 'Bayesian', 'bagging_temperature': 6.136864706496286}. Best is trial 1464 with value: 0.8990825688073395.
[32m[I 2023-04-21 00:19:12,640][39m Trial 3793 finished with value: 0.8727272727272727 and parameters: {'objective': 'Logloss', 'colsample_bylevel': 0.096707009328423, 'depth': 11, 'boosting_type': 'Plain', 'bootstrap_type': 'Bayesian', 'bagging_temperature': 6.071797698920604}. Best is trial 1464 with value: 0.8990825688073395.
[32m[I 2023-04-21 00:19:13,678][39m Trial 3794 finished with value: 0.890909090909091 and parameters: {'objective': 'CrossEntropy', 'colsample_bylevel': 0.09424953811627626, 'depth': 10, 'boosting_type': 'Plain', 'bootstrap_type': 'Bayesian', 'bagging_temperature': 5.886615153964479}. Best is trial 1464 with value: 0.8990825688073395.
[32m[I 2023-04-21 00:19:14,847][39m Trial 3795 finished with value: 0.8545454545454546 and parameters: {'objective': 'Logloss', 'colsample_bylevel': 0.09287316403159948, 'depth': 6, 'boosting_type': 'Plain', 'bootstrap_type': 'Bayesian', 'bagging_temperature': 3.959107938108401}. Best is trial 1464 with value: 0.8990825688073395.
[32m[I 2023-04-21 00:19:15,739][39m Trial 3796 finished with value: 0.8807339449541284 and parameters: {'objective': 'Logloss', 'colsample_bylevel': 0.0950968152562979, 'depth': 8, 'boosting_type': 'Plain', 'bootstrap_type': 'Bayesian', 'bagging_temperature': 5.989930546838199}. Best is trial 1464 with value: 0.8990825688073395.
[32m[I 2023-04-21 00:19:17,175][39m Trial 3797 finished with value: 0.8571428571428572 and parameters: {'objective': 'Logloss', 'colsample_bylevel': 0.09258468502518559, 'depth': 9, 'boosting_type': 'Plain', 'bootstrap_type': 'Bernoulli', 'subsample': 0.7790745144886243}. Best is trial 1464 with value: 0.8990825688073395.
[32m[I 2023-04-21 00:19:18,280][39m Trial 3798 finished with value: 0.8727272727272727 and parameters: {'objective': 'Logloss', 'colsample_bylevel': 0.09315837210053915, 'depth': 10, 'boosting_type': 'Plain', 'bootstrap_type': 'Bayesian', 'bagging_temperature': 5.436866477782509}. Best is trial 1464 with value: 0.8990825688073395.
[32m[I 2023-04-21 00:19:19,538][39m Trial 3799 finished with value: 0.8807339449541284 and parameters: {'objective': 'Logloss', 'colsample_bylevel': 0.09455180223726, 'depth': 9, 'boosting_type': 'Plain', 'bootstrap_type': 'Bayesian', 'bagging_temperature': 4.39747336295687}. Best is trial 1464 with value: 0.8990825688073395.
[32m[I 2023-04-21 00:19:20,436][39m Trial 3800 finished with value: 0.8807339449541284 and parameters: {'objective': 'Logloss', 'colsample_bylevel': 0.09844560876102468, 'depth': 7, 'boosting_type': 'Plain', 'bootstrap_type': 'Bayesian', 'bagging_temperature': 4.531203847229604}. Best is trial 1464 with value: 0.8990825688073395.
[32m[I 2023-04-21 00:19:21,388][39m Trial 3801 finished with value: 0.8623853211009175 and parameters: {'objective': 'Logloss', 'colsample_bylevel': 0.09260791127541296, 'depth': 10, 'boosting_type': 'Plain', 'bootstrap_type': 'MVS'}. Best is trial 1464 with value: 0.8990825688073395.
[32m[I 2023-04-21 00:19:23,243][39m Trial 3802 finished with value: 0.8727272727272727 and parameters: {'objective': 'Logloss', 'colsample_bylevel': 0.096892610831823, 'depth': 9, 'boosting_type': 'Plain', 'bootstrap_type': 'Bayesian', 'bagging_temperature': 5.777102870775323}. Best is trial 1464 with value: 0.8990825688073395.
[32m[I 2023-04-21 00:19:24,159][39m Trial 3803 finished with value: 0.8727272727272727 and parameters: {'objective': 'CrossEntropy', 'colsample_bylevel': 0.09467272059914429, 'depth': 10, 'boosting_type': 'Plain', 'bootstrap_type': 'Bayesian', 'bagging_temperature': 6.22004318217654}. Best is trial 1464 with value: 0.8990825688073395.
[32m[I 2023-04-21 00:19:24,782][39m Trial 3804 finished with value: 0.8448275862068967 and parameters: {'objective': 'CrossEntropy', 'colsample_bylevel': 0.030183978635953013, 'depth': 10, 'boosting_type': 'Plain', 'bootstrap_type': 'Bayesian', 'bagging_temperature': 6.147034411982371}. Best is trial 1464 with value: 0.8990825688073395.
[32m[I 2023-04-21 00:19:25,976][39m Trial 3805 finished with value: 0.8703703703703703 and parameters: {'objective': 'CrossEntropy', 'colsample_bylevel': 0.0938437566472992, 'depth': 7, 'boosting_type': 'Plain', 'bootstrap_type': 'Bayesian', 'bagging_temperature': 3.2480518104940495}. Best is trial 1464 with value: 0.8990825688073395.
[32m[I 2023-04-21 00:19:27,138][39m Trial 3806 finished with value: 0.8166666666666667 and parameters: {'objective': 'Logloss', 'colsample_bylevel': 0.09380582236178253, 'depth': 1, 'boosting_type': 'Plain', 'bootstrap_type': 'Bayesian', 'bagging_temperature': 5.761089059398735}. Best is trial 1464 with value: 0.8990825688073395.
[32m[I 2023-04-21 00:19:28,257][39m Trial 3807 finished with value: 0.8807339449541284 and parameters: {'objective': 'Logloss', 'colsample_bylevel': 0.09576574676796538, 'depth': 7, 'boosting_type': 'Plain', 'bootstrap_type': 'Bayesian', 'bagging_temperature': 6.084430509112909}. Best is trial 1464 with value: 0.8990825688073395.
[32m[I 2023-04-21 00:19:33,318][39m Trial 3808 finished with value: 0.8571428571428572 and parameters: {'objective': 'Logloss', 'colsample_bylevel': 0.09602999137703998, 'depth': 8, 'boosting_type': 'Ordered', 'bootstrap_type': 'Bayesian', 'bagging_temperature': 3.512700059150451}. Best is trial 1464 with value: 0.8990825688073395.
[32m[I 2023-04-21 00:19:35,031][39m Trial 3809 finished with value: 0.8727272727272727 and parameters: {'objective': 'CrossEntropy', 'colsample_bylevel': 0.09986461255823062, 'depth': 8, 'boosting_type': 'Plain', 'bootstrap_type': 'Bayesian', 'bagging_temperature': 4.667360785836851}. Best is trial 1464 with value: 0.8990825688073395.
[32m[I 2023-04-21 00:19:35,805][39m Trial 3810 finished with value: 0.8807339449541284 and parameters: {'objective': 'CrossEntropy', 'colsample_bylevel': 0.09786377342831233, 'depth': 10, 'boosting_type': 'Plain', 'bootstrap_type': 'Bayesian', 'bagging_temperature': 6.2147477631096635}. Best is trial 1464 with value: 0.8990825688073395.
[32m[I 2023-04-21 00:19:37,698][39m Trial 3811 finished with value: 0.875 and parameters: {'objective': 'Logloss', 'colsample_bylevel': 0.09813689939581019, 'depth': 9, 'boosting_type': 'Plain', 'bootstrap_type': 'Bayesian', 'bagging_temperature': 6.491395530281393}. Best is trial 1464 with value: 0.8990825688073395.
[32m[I 2023-04-21 00:19:38,729][39m Trial 3812 finished with value: 0.875 and parameters: {'objective': 'Logloss', 'colsample_bylevel': 0.09374262719831901, 'depth': 8, 'boosting_type': 'Plain', 'bootstrap_type': 'Bayesian', 'bagging_temperature': 5.943588729940635}. Best is trial 1464 with value: 0.8990825688073395.
[32m[I 2023-04-21 00:19:39,632][39m Trial 3813 finished with value: 0.8807339449541284 and parameters: {'objective': 'Logloss', 'colsample_bylevel': 0.09862570583096374, 'depth': 8, 'boosting_type': 'Plain', 'bootstrap_type': 'Bayesian', 'bagging_temperature': 5.346268675544011}. Best is trial 1464 with value: 0.8990825688073395.
[32m[I 2023-04-21 00:19:40,389][39m Trial 3814 finished with value: 0.8275862068965517 and parameters: {'objective': 'Logloss', 'colsample_bylevel': 0.09703301182384458, 'depth': 3, 'boosting_type': 'Plain', 'bootstrap_type': 'Bayesian', 'bagging_temperature': 0.38232259340420427}. Best is trial 1464 with value: 0.8990825688073395.
[32m[I 2023-04-21 00:19:41,882][39m Trial 3815 finished with value: 0.888888888888889 and parameters: {'objective': 'CrossEntropy', 'colsample_bylevel': 0.08361620342386489, 'depth': 8, 'boosting_type': 'Plain', 'bootstrap_type': 'Bayesian', 'bagging_temperature': 5.973972980504865}. Best is trial 1464 with value: 0.8990825688073395.
[32m[I 2023-04-21 00:19:43,159][39m Trial 3816 finished with value: 0.8495575221238938 and parameters: {'objective': 'Logloss', 'colsample_bylevel': 0.08559498571702924, 'depth': 10, 'boosting_type': 'Plain', 'bootstrap_type': 'Bernoulli', 'subsample': 0.6196847956636814}. Best is trial 1464 with value: 0.8990825688073395.
[32m[I 2023-04-21 00:19:44,585][39m Trial 3817 finished with value: 0.8727272727272727 and parameters: {'objective': 'CrossEntropy', 'colsample_bylevel': 0.08917753544547216, 'depth': 9, 'boosting_type': 'Plain', 'bootstrap_type': 'Bayesian', 'bagging_temperature': 5.8217858826744395}. Best is trial 1464 with value: 0.8990825688073395.
[32m[I 2023-04-21 00:19:45,217][39m Trial 3818 finished with value: 0.8807339449541284 and parameters: {'objective': 'Logloss', 'colsample_bylevel': 0.09241183081089888, 'depth': 11, 'boosting_type': 'Plain', 'bootstrap_type': 'Bayesian', 'bagging_temperature': 6.000841662396866}. Best is trial 1464 with value: 0.8990825688073395.
[32m[I 2023-04-21 00:19:45,970][39m Trial 3819 finished with value: 0.8807339449541284 and parameters: {'objective': 'Logloss', 'colsample_bylevel': 0.09695715700910168, 'depth': 8, 'boosting_type': 'Plain', 'bootstrap_type': 'Bayesian', 'bagging_temperature': 6.360420175748871}. Best is trial 1464 with value: 0.8990825688073395.
[32m[I 2023-04-21 00:19:47,030][39m Trial 3820 finished with value: 0.8571428571428572 and parameters: {'objective': 'Logloss', 'colsample_bylevel': 0.09718934935271405, 'depth': 8, 'boosting_type': 'Plain', 'bootstrap_type': 'MVS'}. Best is trial 1464 with value: 0.8990825688073395.
