[32m[I 2023-04-20 23:16:48,829][39m Trial 928 finished with value: 0.8807339449541284 and parameters: {'objective': 'CrossEntropy', 'colsample_bylevel': 0.09119371425758932, 'depth': 8, 'boosting_type': 'Plain', 'bootstrap_type': 'Bayesian', 'bagging_temperature': 8.385565483900791}. Best is trial 205 with value: 0.890909090909091.
[32m[I 2023-04-20 23:16:49,639][39m Trial 929 finished with value: 0.8727272727272727 and parameters: {'objective': 'CrossEntropy', 'colsample_bylevel': 0.09763172839290019, 'depth': 9, 'boosting_type': 'Plain', 'bootstrap_type': 'Bayesian', 'bagging_temperature': 3.3837924525325667}. Best is trial 205 with value: 0.890909090909091.
[32m[I 2023-04-20 23:16:50,546][39m Trial 930 finished with value: 0.8807339449541284 and parameters: {'objective': 'Logloss', 'colsample_bylevel': 0.09735635813231873, 'depth': 11, 'boosting_type': 'Plain', 'bootstrap_type': 'Bayesian', 'bagging_temperature': 6.695326770763282}. Best is trial 205 with value: 0.890909090909091.
[32m[I 2023-04-20 23:16:51,449][39m Trial 931 finished with value: 0.8727272727272727 and parameters: {'objective': 'Logloss', 'colsample_bylevel': 0.09644388635611753, 'depth': 9, 'boosting_type': 'Plain', 'bootstrap_type': 'Bayesian', 'bagging_temperature': 6.943882209305853}. Best is trial 205 with value: 0.890909090909091.
[32m[I 2023-04-20 23:16:52,338][39m Trial 932 finished with value: 0.8807339449541284 and parameters: {'objective': 'Logloss', 'colsample_bylevel': 0.09458240392990412, 'depth': 9, 'boosting_type': 'Plain', 'bootstrap_type': 'Bayesian', 'bagging_temperature': 6.019368185952401}. Best is trial 205 with value: 0.890909090909091.
[32m[I 2023-04-20 23:16:53,438][39m Trial 933 finished with value: 0.8807339449541284 and parameters: {'objective': 'Logloss', 'colsample_bylevel': 0.09251327406775658, 'depth': 10, 'boosting_type': 'Plain', 'bootstrap_type': 'Bayesian', 'bagging_temperature': 6.421934778683187}. Best is trial 205 with value: 0.890909090909091.
[32m[I 2023-04-20 23:16:54,766][39m Trial 934 finished with value: 0.8205128205128206 and parameters: {'objective': 'Logloss', 'colsample_bylevel': 0.0379443734941828, 'depth': 9, 'boosting_type': 'Plain', 'bootstrap_type': 'Bernoulli', 'subsample': 0.3430836177569653}. Best is trial 205 with value: 0.890909090909091.
[32m[I 2023-04-20 23:16:55,927][39m Trial 935 finished with value: 0.888888888888889 and parameters: {'objective': 'CrossEntropy', 'colsample_bylevel': 0.09622108018327352, 'depth': 9, 'boosting_type': 'Plain', 'bootstrap_type': 'Bayesian', 'bagging_temperature': 6.295540149614843}. Best is trial 205 with value: 0.890909090909091.
[32m[I 2023-04-20 23:16:56,528][39m Trial 936 finished with value: 0.8448275862068967 and parameters: {'objective': 'Logloss', 'colsample_bylevel': 0.05160898829894779, 'depth': 8, 'boosting_type': 'Plain', 'bootstrap_type': 'Bayesian', 'bagging_temperature': 5.37866978625854}. Best is trial 205 with value: 0.890909090909091.
[32m[I 2023-04-20 23:16:57,562][39m Trial 937 finished with value: 0.8495575221238938 and parameters: {'objective': 'Logloss', 'colsample_bylevel': 0.09436416515589241, 'depth': 8, 'boosting_type': 'Plain', 'bootstrap_type': 'Bayesian', 'bagging_temperature': 2.7520154917460053}. Best is trial 205 with value: 0.890909090909091.
[32m[I 2023-04-20 23:16:58,637][39m Trial 938 finished with value: 0.8807339449541284 and parameters: {'objective': 'Logloss', 'colsample_bylevel': 0.09187549252809761, 'depth': 10, 'boosting_type': 'Plain', 'bootstrap_type': 'Bayesian', 'bagging_temperature': 6.599603501238263}. Best is trial 205 with value: 0.890909090909091.
[32m[I 2023-04-20 23:16:59,595][39m Trial 939 finished with value: 0.8807339449541284 and parameters: {'objective': 'Logloss', 'colsample_bylevel': 0.09527379292875456, 'depth': 8, 'boosting_type': 'Plain', 'bootstrap_type': 'Bayesian', 'bagging_temperature': 5.155981680129327}. Best is trial 205 with value: 0.890909090909091.
[32m[I 2023-04-20 23:17:00,685][39m Trial 940 finished with value: 0.8727272727272727 and parameters: {'objective': 'Logloss', 'colsample_bylevel': 0.09835383632259112, 'depth': 9, 'boosting_type': 'Plain', 'bootstrap_type': 'Bayesian', 'bagging_temperature': 3.641690611834455}. Best is trial 205 with value: 0.890909090909091.
[32m[I 2023-04-20 23:17:02,012][39m Trial 941 finished with value: 0.8807339449541284 and parameters: {'objective': 'Logloss', 'colsample_bylevel': 0.09981417935537391, 'depth': 10, 'boosting_type': 'Plain', 'bootstrap_type': 'Bayesian', 'bagging_temperature': 3.857514412310516}. Best is trial 205 with value: 0.890909090909091.
[32m[I 2023-04-20 23:17:07,393][39m Trial 942 finished with value: 0.8347826086956522 and parameters: {'objective': 'Logloss', 'colsample_bylevel': 0.08955215030593038, 'depth': 10, 'boosting_type': 'Ordered', 'bootstrap_type': 'Bayesian', 'bagging_temperature': 2.890623562582785}. Best is trial 205 with value: 0.890909090909091.
[32m[I 2023-04-20 23:17:08,315][39m Trial 943 finished with value: 0.8828828828828829 and parameters: {'objective': 'Logloss', 'colsample_bylevel': 0.09807331607002168, 'depth': 10, 'boosting_type': 'Plain', 'bootstrap_type': 'Bayesian', 'bagging_temperature': 3.4199264664229734}. Best is trial 205 with value: 0.890909090909091.
[32m[I 2023-04-20 23:17:09,836][39m Trial 944 finished with value: 0.8727272727272727 and parameters: {'objective': 'CrossEntropy', 'colsample_bylevel': 0.09138278323194118, 'depth': 9, 'boosting_type': 'Plain', 'bootstrap_type': 'Bayesian', 'bagging_temperature': 5.058019253145909}. Best is trial 205 with value: 0.890909090909091.
[32m[I 2023-04-20 23:17:10,592][39m Trial 945 finished with value: 0.8807339449541284 and parameters: {'objective': 'Logloss', 'colsample_bylevel': 0.0938351896671359, 'depth': 10, 'boosting_type': 'Plain', 'bootstrap_type': 'Bayesian', 'bagging_temperature': 7.60634576048789}. Best is trial 205 with value: 0.890909090909091.
[32m[I 2023-04-20 23:17:12,020][39m Trial 946 finished with value: 0.8672566371681416 and parameters: {'objective': 'Logloss', 'colsample_bylevel': 0.09299383706102189, 'depth': 9, 'boosting_type': 'Plain', 'bootstrap_type': 'Bayesian', 'bagging_temperature': 5.38908580489837}. Best is trial 205 with value: 0.890909090909091.
[32m[I 2023-04-20 23:17:13,259][39m Trial 947 finished with value: 0.8623853211009175 and parameters: {'objective': 'CrossEntropy', 'colsample_bylevel': 0.08563659551457337, 'depth': 8, 'boosting_type': 'Plain', 'bootstrap_type': 'Bayesian', 'bagging_temperature': 3.9982349764147274}. Best is trial 205 with value: 0.890909090909091.
[32m[I 2023-04-20 23:17:14,180][39m Trial 948 finished with value: 0.8727272727272727 and parameters: {'objective': 'Logloss', 'colsample_bylevel': 0.09217004907897153, 'depth': 9, 'boosting_type': 'Plain', 'bootstrap_type': 'Bayesian', 'bagging_temperature': 6.299985644493415}. Best is trial 205 with value: 0.890909090909091.
[32m[I 2023-04-20 23:17:14,983][39m Trial 949 finished with value: 0.8495575221238938 and parameters: {'objective': 'Logloss', 'colsample_bylevel': 0.09359040399184039, 'depth': 9, 'boosting_type': 'Plain', 'bootstrap_type': 'MVS'}. Best is trial 205 with value: 0.890909090909091.
[32m[I 2023-04-20 23:17:16,015][39m Trial 950 finished with value: 0.8727272727272727 and parameters: {'objective': 'CrossEntropy', 'colsample_bylevel': 0.09618345896971614, 'depth': 9, 'boosting_type': 'Plain', 'bootstrap_type': 'Bayesian', 'bagging_temperature': 4.580165020465696}. Best is trial 205 with value: 0.890909090909091.
[32m[I 2023-04-20 23:17:16,885][39m Trial 951 finished with value: 0.8571428571428572 and parameters: {'objective': 'CrossEntropy', 'colsample_bylevel': 0.08969543746023806, 'depth': 10, 'boosting_type': 'Plain', 'bootstrap_type': 'Bayesian', 'bagging_temperature': 9.15239639918421}. Best is trial 205 with value: 0.890909090909091.
[32m[I 2023-04-20 23:17:17,946][39m Trial 952 finished with value: 0.8648648648648648 and parameters: {'objective': 'Logloss', 'colsample_bylevel': 0.09668965783114818, 'depth': 8, 'boosting_type': 'Plain', 'bootstrap_type': 'Bayesian', 'bagging_temperature': 6.874626513083823}. Best is trial 205 with value: 0.890909090909091.
[32m[I 2023-04-20 23:17:18,905][39m Trial 953 finished with value: 0.888888888888889 and parameters: {'objective': 'Logloss', 'colsample_bylevel': 0.09336954131168489, 'depth': 10, 'boosting_type': 'Plain', 'bootstrap_type': 'Bayesian', 'bagging_temperature': 4.18958425211578}. Best is trial 205 with value: 0.890909090909091.
[32m[I 2023-04-20 23:17:19,787][39m Trial 954 finished with value: 0.8275862068965517 and parameters: {'objective': 'Logloss', 'colsample_bylevel': 0.07181026409317083, 'depth': 11, 'boosting_type': 'Plain', 'bootstrap_type': 'Bayesian', 'bagging_temperature': 3.2323903766558097}. Best is trial 205 with value: 0.890909090909091.
[32m[I 2023-04-20 23:17:20,901][39m Trial 955 finished with value: 0.8807339449541284 and parameters: {'objective': 'Logloss', 'colsample_bylevel': 0.09169358994495476, 'depth': 9, 'boosting_type': 'Plain', 'bootstrap_type': 'Bayesian', 'bagging_temperature': 4.139321258773047}. Best is trial 205 with value: 0.890909090909091.
[32m[I 2023-04-20 23:17:21,908][39m Trial 956 finished with value: 0.8807339449541284 and parameters: {'objective': 'CrossEntropy', 'colsample_bylevel': 0.09442144449318822, 'depth': 10, 'boosting_type': 'Plain', 'bootstrap_type': 'Bayesian', 'bagging_temperature': 4.62201626173351}. Best is trial 205 with value: 0.890909090909091.
[32m[I 2023-04-20 23:17:22,979][39m Trial 957 finished with value: 0.8727272727272727 and parameters: {'objective': 'Logloss', 'colsample_bylevel': 0.09618367163107215, 'depth': 9, 'boosting_type': 'Plain', 'bootstrap_type': 'Bernoulli', 'subsample': 0.18645972140165656}. Best is trial 205 with value: 0.890909090909091.
[32m[I 2023-04-20 23:17:24,385][39m Trial 958 finished with value: 0.8727272727272727 and parameters: {'objective': 'Logloss', 'colsample_bylevel': 0.09864196468124212, 'depth': 9, 'boosting_type': 'Plain', 'bootstrap_type': 'Bayesian', 'bagging_temperature': 5.894314911582608}. Best is trial 205 with value: 0.890909090909091.
[32m[I 2023-04-20 23:17:25,615][39m Trial 959 finished with value: 0.8727272727272727 and parameters: {'objective': 'Logloss', 'colsample_bylevel': 0.0987932396640303, 'depth': 9, 'boosting_type': 'Plain', 'bootstrap_type': 'Bayesian', 'bagging_temperature': 6.620765156031885}. Best is trial 205 with value: 0.890909090909091.
[32m[I 2023-04-20 23:17:26,743][39m Trial 960 finished with value: 0.8727272727272727 and parameters: {'objective': 'CrossEntropy', 'colsample_bylevel': 0.09507803210805937, 'depth': 10, 'boosting_type': 'Plain', 'bootstrap_type': 'Bayesian', 'bagging_temperature': 2.398333140639693}. Best is trial 205 with value: 0.890909090909091.
[32m[I 2023-04-20 23:17:33,494][39m Trial 961 finished with value: 0.8571428571428572 and parameters: {'objective': 'CrossEntropy', 'colsample_bylevel': 0.0934062096460717, 'depth': 6, 'boosting_type': 'Ordered', 'bootstrap_type': 'Bayesian', 'bagging_temperature': 6.4758849445388975}. Best is trial 205 with value: 0.890909090909091.
[32m[I 2023-04-20 23:17:34,144][39m Trial 962 finished with value: 0.8807339449541284 and parameters: {'objective': 'Logloss', 'colsample_bylevel': 0.09306837120483341, 'depth': 10, 'boosting_type': 'Plain', 'bootstrap_type': 'Bayesian', 'bagging_temperature': 8.568526348659555}. Best is trial 205 with value: 0.890909090909091.
[32m[I 2023-04-20 23:17:34,927][39m Trial 963 finished with value: 0.8623853211009175 and parameters: {'objective': 'CrossEntropy', 'colsample_bylevel': 0.09729789092087678, 'depth': 9, 'boosting_type': 'Plain', 'bootstrap_type': 'Bayesian', 'bagging_temperature': 5.150840778008693}. Best is trial 205 with value: 0.890909090909091.
[32m[I 2023-04-20 23:17:36,233][39m Trial 964 finished with value: 0.8703703703703703 and parameters: {'objective': 'Logloss', 'colsample_bylevel': 0.09858130946118909, 'depth': 9, 'boosting_type': 'Plain', 'bootstrap_type': 'Bayesian', 'bagging_temperature': 4.837084884109945}. Best is trial 205 with value: 0.890909090909091.
[32m[I 2023-04-20 23:17:36,936][39m Trial 965 finished with value: 0.888888888888889 and parameters: {'objective': 'Logloss', 'colsample_bylevel': 0.09532035035402855, 'depth': 11, 'boosting_type': 'Plain', 'bootstrap_type': 'Bayesian', 'bagging_temperature': 4.425561915453915}. Best is trial 205 with value: 0.890909090909091.
[32m[I 2023-04-20 23:17:37,799][39m Trial 966 finished with value: 0.8648648648648648 and parameters: {'objective': 'Logloss', 'colsample_bylevel': 0.09619879099130253, 'depth': 11, 'boosting_type': 'Plain', 'bootstrap_type': 'Bayesian', 'bagging_temperature': 6.242780997195195}. Best is trial 205 with value: 0.890909090909091.
[32m[I 2023-04-20 23:17:38,830][39m Trial 967 finished with value: 0.8275862068965517 and parameters: {'objective': 'Logloss', 'colsample_bylevel': 0.09544667877922934, 'depth': 3, 'boosting_type': 'Plain', 'bootstrap_type': 'Bayesian', 'bagging_temperature': 3.1544644495218797}. Best is trial 205 with value: 0.890909090909091.
[32m[I 2023-04-20 23:17:39,701][39m Trial 968 finished with value: 0.8571428571428572 and parameters: {'objective': 'Logloss', 'colsample_bylevel': 0.09982508831742895, 'depth': 7, 'boosting_type': 'Plain', 'bootstrap_type': 'MVS'}. Best is trial 205 with value: 0.890909090909091.
[32m[I 2023-04-20 23:17:41,227][39m Trial 969 finished with value: 0.8727272727272727 and parameters: {'objective': 'Logloss', 'colsample_bylevel': 0.09971581872309057, 'depth': 8, 'boosting_type': 'Plain', 'bootstrap_type': 'Bayesian', 'bagging_temperature': 6.715663904830235}. Best is trial 205 with value: 0.890909090909091.
[32m[I 2023-04-20 23:17:41,927][39m Trial 970 finished with value: 0.8727272727272727 and parameters: {'objective': 'CrossEntropy', 'colsample_bylevel': 0.09543225850845882, 'depth': 10, 'boosting_type': 'Plain', 'bootstrap_type': 'Bayesian', 'bagging_temperature': 4.08693527923801}. Best is trial 205 with value: 0.890909090909091.
[32m[I 2023-04-20 23:17:42,521][39m Trial 971 finished with value: 0.8771929824561403 and parameters: {'objective': 'Logloss', 'colsample_bylevel': 0.09170279705269535, 'depth': 10, 'boosting_type': 'Plain', 'bootstrap_type': 'Bayesian', 'bagging_temperature': 9.574347193767675}. Best is trial 205 with value: 0.890909090909091.
[32m[I 2023-04-20 23:17:43,672][39m Trial 972 finished with value: 0.8623853211009175 and parameters: {'objective': 'CrossEntropy', 'colsample_bylevel': 0.09719574488388906, 'depth': 10, 'boosting_type': 'Plain', 'bootstrap_type': 'Bayesian', 'bagging_temperature': 4.299336264120528}. Best is trial 205 with value: 0.890909090909091.
[32m[I 2023-04-20 23:17:45,285][39m Trial 973 finished with value: 0.8807339449541284 and parameters: {'objective': 'Logloss', 'colsample_bylevel': 0.09982659060330908, 'depth': 8, 'boosting_type': 'Plain', 'bootstrap_type': 'Bayesian', 'bagging_temperature': 3.462854356249335}. Best is trial 205 with value: 0.890909090909091.
[32m[I 2023-04-20 23:17:46,575][39m Trial 974 finished with value: 0.8648648648648648 and parameters: {'objective': 'Logloss', 'colsample_bylevel': 0.08816612716420487, 'depth': 10, 'boosting_type': 'Plain', 'bootstrap_type': 'Bayesian', 'bagging_temperature': 4.060060958559246}. Best is trial 205 with value: 0.890909090909091.
[32m[I 2023-04-20 23:17:47,711][39m Trial 975 finished with value: 0.8571428571428572 and parameters: {'objective': 'Logloss', 'colsample_bylevel': 0.09821412948443058, 'depth': 10, 'boosting_type': 'Plain', 'bootstrap_type': 'Bayesian', 'bagging_temperature': 5.496611148223503}. Best is trial 205 with value: 0.890909090909091.
[32m[I 2023-04-20 23:17:48,371][39m Trial 976 finished with value: 0.8807339449541284 and parameters: {'objective': 'Logloss', 'colsample_bylevel': 0.09700301363894911, 'depth': 12, 'boosting_type': 'Plain', 'bootstrap_type': 'Bayesian', 'bagging_temperature': 4.519150132770546}. Best is trial 205 with value: 0.890909090909091.
[32m[I 2023-04-20 23:17:49,936][39m Trial 977 finished with value: 0.8672566371681416 and parameters: {'objective': 'Logloss', 'colsample_bylevel': 0.0946781317955838, 'depth': 9, 'boosting_type': 'Plain', 'bootstrap_type': 'Bayesian', 'bagging_temperature': 4.7929700963215724}. Best is trial 205 with value: 0.890909090909091.
[32m[I 2023-04-20 23:17:54,781][39m Trial 978 finished with value: 0.8347826086956522 and parameters: {'objective': 'Logloss', 'colsample_bylevel': 0.09495540173140793, 'depth': 8, 'boosting_type': 'Ordered', 'bootstrap_type': 'Bernoulli', 'subsample': 0.4845676354740979}. Best is trial 205 with value: 0.890909090909091.
[32m[I 2023-04-20 23:17:55,794][39m Trial 979 finished with value: 0.8807339449541284 and parameters: {'objective': 'Logloss', 'colsample_bylevel': 0.09289591851028048, 'depth': 10, 'boosting_type': 'Plain', 'bootstrap_type': 'Bayesian', 'bagging_temperature': 5.1233083706586315}. Best is trial 205 with value: 0.890909090909091.
[32m[I 2023-04-20 23:17:56,954][39m Trial 980 finished with value: 0.8703703703703703 and parameters: {'objective': 'Logloss', 'colsample_bylevel': 0.09700542271715822, 'depth': 8, 'boosting_type': 'Plain', 'bootstrap_type': 'Bayesian', 'bagging_temperature': 2.6887196336095953}. Best is trial 205 with value: 0.890909090909091.
[32m[I 2023-04-20 23:17:58,073][39m Trial 981 finished with value: 0.8571428571428572 and parameters: {'objective': 'CrossEntropy', 'colsample_bylevel': 0.0924505797556793, 'depth': 8, 'boosting_type': 'Plain', 'bootstrap_type': 'Bayesian', 'bagging_temperature': 6.214595671741288}. Best is trial 205 with value: 0.890909090909091.
[32m[I 2023-04-20 23:17:59,570][39m Trial 982 finished with value: 0.8807339449541284 and parameters: {'objective': 'Logloss', 'colsample_bylevel': 0.09526147407624705, 'depth': 8, 'boosting_type': 'Plain', 'bootstrap_type': 'Bayesian', 'bagging_temperature': 6.736647407792032}. Best is trial 205 with value: 0.890909090909091.
[32m[I 2023-04-20 23:18:00,865][39m Trial 983 finished with value: 0.8807339449541284 and parameters: {'objective': 'CrossEntropy', 'colsample_bylevel': 0.09388762996224213, 'depth': 9, 'boosting_type': 'Plain', 'bootstrap_type': 'Bayesian', 'bagging_temperature': 4.9450424694236474}. Best is trial 205 with value: 0.890909090909091.
[32m[I 2023-04-20 23:18:02,130][39m Trial 984 finished with value: 0.8672566371681416 and parameters: {'objective': 'CrossEntropy', 'colsample_bylevel': 0.09455763385839247, 'depth': 9, 'boosting_type': 'Plain', 'bootstrap_type': 'Bayesian', 'bagging_temperature': 6.387741500535438}. Best is trial 205 with value: 0.890909090909091.
[32m[I 2023-04-20 23:18:02,977][39m Trial 985 finished with value: 0.8571428571428572 and parameters: {'objective': 'Logloss', 'colsample_bylevel': 0.08950329863889538, 'depth': 8, 'boosting_type': 'Plain', 'bootstrap_type': 'Bayesian', 'bagging_temperature': 5.492262085470822}. Best is trial 205 with value: 0.890909090909091.
[32m[I 2023-04-20 23:18:03,596][39m Trial 986 finished with value: 0.8727272727272727 and parameters: {'objective': 'Logloss', 'colsample_bylevel': 0.09714160252862138, 'depth': 8, 'boosting_type': 'Plain', 'bootstrap_type': 'Bayesian', 'bagging_temperature': 5.891400814239803}. Best is trial 205 with value: 0.890909090909091.
[32m[I 2023-04-20 23:18:04,974][39m Trial 987 finished with value: 0.888888888888889 and parameters: {'objective': 'Logloss', 'colsample_bylevel': 0.09496948617288793, 'depth': 9, 'boosting_type': 'Plain', 'bootstrap_type': 'Bayesian', 'bagging_temperature': 4.639377399129274}. Best is trial 205 with value: 0.890909090909091.
[32m[I 2023-04-20 23:18:05,628][39m Trial 988 finished with value: 0.8727272727272727 and parameters: {'objective': 'Logloss', 'colsample_bylevel': 0.09660326625651476, 'depth': 10, 'boosting_type': 'Plain', 'bootstrap_type': 'Bayesian', 'bagging_temperature': 4.147226981559352}. Best is trial 205 with value: 0.890909090909091.
[32m[I 2023-04-20 23:18:06,747][39m Trial 989 finished with value: 0.8571428571428572 and parameters: {'objective': 'CrossEntropy', 'colsample_bylevel': 0.09163319909938868, 'depth': 5, 'boosting_type': 'Plain', 'bootstrap_type': 'Bayesian', 'bagging_temperature': 6.3039174810467795}. Best is trial 205 with value: 0.890909090909091.
[32m[I 2023-04-20 23:18:07,957][39m Trial 990 finished with value: 0.8807339449541284 and parameters: {'objective': 'Logloss', 'colsample_bylevel': 0.09255413954144891, 'depth': 10, 'boosting_type': 'Plain', 'bootstrap_type': 'Bayesian', 'bagging_temperature': 5.158924696169119}. Best is trial 205 with value: 0.890909090909091.
[32m[I 2023-04-20 23:18:08,812][39m Trial 991 finished with value: 0.8727272727272727 and parameters: {'objective': 'Logloss', 'colsample_bylevel': 0.09830372630711556, 'depth': 8, 'boosting_type': 'Plain', 'bootstrap_type': 'Bayesian', 'bagging_temperature': 6.04483300092697}. Best is trial 205 with value: 0.890909090909091.
[32m[I 2023-04-20 23:18:09,845][39m Trial 992 finished with value: 0.8571428571428572 and parameters: {'objective': 'Logloss', 'colsample_bylevel': 0.09114593756474801, 'depth': 9, 'boosting_type': 'Plain', 'bootstrap_type': 'MVS'}. Best is trial 205 with value: 0.890909090909091.
[32m[I 2023-04-20 23:18:11,040][39m Trial 993 finished with value: 0.8703703703703703 and parameters: {'objective': 'CrossEntropy', 'colsample_bylevel': 0.09413545234133903, 'depth': 8, 'boosting_type': 'Plain', 'bootstrap_type': 'Bayesian', 'bagging_temperature': 3.7712059457942733}. Best is trial 205 with value: 0.890909090909091.
