[32m[I 2023-04-21 00:47:49,549][39m Trial 5068 finished with value: 0.888888888888889 and parameters: {'objective': 'Logloss', 'colsample_bylevel': 0.09543654525908501, 'depth': 9, 'boosting_type': 'Plain', 'bootstrap_type': 'Bayesian', 'bagging_temperature': 3.8964558850138458}. Best is trial 1464 with value: 0.8990825688073395.
[32m[I 2023-04-21 00:47:50,882][39m Trial 5069 finished with value: 0.8807339449541284 and parameters: {'objective': 'CrossEntropy', 'colsample_bylevel': 0.09331719592900588, 'depth': 9, 'boosting_type': 'Plain', 'bootstrap_type': 'Bayesian', 'bagging_temperature': 6.788633119917745}. Best is trial 1464 with value: 0.8990825688073395.
[32m[I 2023-04-21 00:47:51,738][39m Trial 5070 finished with value: 0.8727272727272727 and parameters: {'objective': 'Logloss', 'colsample_bylevel': 0.09653040016270659, 'depth': 8, 'boosting_type': 'Plain', 'bootstrap_type': 'Bayesian', 'bagging_temperature': 6.541734692017815}. Best is trial 1464 with value: 0.8990825688073395.
[32m[I 2023-04-21 00:47:52,606][39m Trial 5071 finished with value: 0.888888888888889 and parameters: {'objective': 'Logloss', 'colsample_bylevel': 0.09288619013341065, 'depth': 12, 'boosting_type': 'Plain', 'bootstrap_type': 'Bayesian', 'bagging_temperature': 4.166955542418422}. Best is trial 1464 with value: 0.8990825688073395.
[32m[I 2023-04-21 00:47:54,138][39m Trial 5072 finished with value: 0.8727272727272727 and parameters: {'objective': 'CrossEntropy', 'colsample_bylevel': 0.09257415760122621, 'depth': 11, 'boosting_type': 'Plain', 'bootstrap_type': 'Bayesian', 'bagging_temperature': 7.126808775140034}. Best is trial 1464 with value: 0.8990825688073395.
[32m[I 2023-04-21 00:47:55,738][39m Trial 5073 finished with value: 0.8727272727272727 and parameters: {'objective': 'Logloss', 'colsample_bylevel': 0.09484601898117437, 'depth': 8, 'boosting_type': 'Plain', 'bootstrap_type': 'Bayesian', 'bagging_temperature': 4.970736959591811}. Best is trial 1464 with value: 0.8990825688073395.
[32m[I 2023-04-21 00:47:56,730][39m Trial 5074 finished with value: 0.8828828828828829 and parameters: {'objective': 'Logloss', 'colsample_bylevel': 0.09541451305952689, 'depth': 10, 'boosting_type': 'Plain', 'bootstrap_type': 'Bayesian', 'bagging_temperature': 6.494918151203265}. Best is trial 1464 with value: 0.8990825688073395.
[32m[I 2023-04-21 00:47:57,625][39m Trial 5075 finished with value: 0.8648648648648648 and parameters: {'objective': 'CrossEntropy', 'colsample_bylevel': 0.08863963434849789, 'depth': 12, 'boosting_type': 'Plain', 'bootstrap_type': 'Bayesian', 'bagging_temperature': 5.344317757727419}. Best is trial 1464 with value: 0.8990825688073395.
[32m[I 2023-04-21 00:47:58,290][39m Trial 5076 finished with value: 0.8468468468468469 and parameters: {'objective': 'Logloss', 'colsample_bylevel': 0.09508843914888272, 'depth': 10, 'boosting_type': 'Plain', 'bootstrap_type': 'Bayesian', 'bagging_temperature': 6.672586671482902}. Best is trial 1464 with value: 0.8990825688073395.
[32m[I 2023-04-21 00:47:59,855][39m Trial 5077 finished with value: 0.888888888888889 and parameters: {'objective': 'Logloss', 'colsample_bylevel': 0.09477346172852617, 'depth': 12, 'boosting_type': 'Plain', 'bootstrap_type': 'Bayesian', 'bagging_temperature': 5.712658616291927}. Best is trial 1464 with value: 0.8990825688073395.
[32m[I 2023-04-21 00:48:01,055][39m Trial 5078 finished with value: 0.8807339449541284 and parameters: {'objective': 'CrossEntropy', 'colsample_bylevel': 0.09409787644660147, 'depth': 12, 'boosting_type': 'Plain', 'bootstrap_type': 'Bayesian', 'bagging_temperature': 4.121206984615716}. Best is trial 1464 with value: 0.8990825688073395.
[32m[I 2023-04-21 00:48:02,495][39m Trial 5079 finished with value: 0.8596491228070176 and parameters: {'objective': 'CrossEntropy', 'colsample_bylevel': 0.08518085878280945, 'depth': 12, 'boosting_type': 'Plain', 'bootstrap_type': 'Bayesian', 'bagging_temperature': 4.997514135687674}. Best is trial 1464 with value: 0.8990825688073395.
[32m[I 2023-04-21 00:48:03,276][39m Trial 5080 finished with value: 0.8807339449541284 and parameters: {'objective': 'Logloss', 'colsample_bylevel': 0.09068586887992401, 'depth': 12, 'boosting_type': 'Plain', 'bootstrap_type': 'Bayesian', 'bagging_temperature': 5.307420589915196}. Best is trial 1464 with value: 0.8990825688073395.
[32m[I 2023-04-21 00:48:04,553][39m Trial 5081 finished with value: 0.8807339449541284 and parameters: {'objective': 'CrossEntropy', 'colsample_bylevel': 0.09118615354898353, 'depth': 11, 'boosting_type': 'Plain', 'bootstrap_type': 'Bayesian', 'bagging_temperature': 5.455278573816415}. Best is trial 1464 with value: 0.8990825688073395.
[32m[I 2023-04-21 00:48:05,621][39m Trial 5082 finished with value: 0.8807339449541284 and parameters: {'objective': 'CrossEntropy', 'colsample_bylevel': 0.09789447275457469, 'depth': 10, 'boosting_type': 'Plain', 'bootstrap_type': 'Bayesian', 'bagging_temperature': 4.560332880048813}. Best is trial 1464 with value: 0.8990825688073395.
[32m[I 2023-04-21 00:48:09,810][39m Trial 5083 finished with value: 0.8571428571428572 and parameters: {'objective': 'Logloss', 'colsample_bylevel': 0.09694446034501089, 'depth': 7, 'boosting_type': 'Ordered', 'bootstrap_type': 'Bernoulli', 'subsample': 0.9764705695649294}. Best is trial 1464 with value: 0.8990825688073395.
[32m[I 2023-04-21 00:48:10,956][39m Trial 5084 finished with value: 0.8807339449541284 and parameters: {'objective': 'Logloss', 'colsample_bylevel': 0.09530270559074244, 'depth': 8, 'boosting_type': 'Plain', 'bootstrap_type': 'Bayesian', 'bagging_temperature': 5.548184075979703}. Best is trial 1464 with value: 0.8990825688073395.
[32m[I 2023-04-21 00:48:12,934][39m Trial 5085 finished with value: 0.8596491228070176 and parameters: {'objective': 'Logloss', 'colsample_bylevel': 0.06682040701608465, 'depth': 8, 'boosting_type': 'Plain', 'bootstrap_type': 'Bayesian', 'bagging_temperature': 4.926961582789373}. Best is trial 1464 with value: 0.8990825688073395.
[32m[I 2023-04-21 00:48:13,790][39m Trial 5086 finished with value: 0.8727272727272727 and parameters: {'objective': 'Logloss', 'colsample_bylevel': 0.09633273539997651, 'depth': 12, 'boosting_type': 'Plain', 'bootstrap_type': 'Bayesian', 'bagging_temperature': 5.0522407104114055}. Best is trial 1464 with value: 0.8990825688073395.
[32m[I 2023-04-21 00:48:14,571][39m Trial 5087 finished with value: 0.8727272727272727 and parameters: {'objective': 'Logloss', 'colsample_bylevel': 0.09406015696727439, 'depth': 12, 'boosting_type': 'Plain', 'bootstrap_type': 'Bayesian', 'bagging_temperature': 5.948930328749123}. Best is trial 1464 with value: 0.8990825688073395.
[32m[I 2023-04-21 00:48:16,181][39m Trial 5088 finished with value: 0.8807339449541284 and parameters: {'objective': 'Logloss', 'colsample_bylevel': 0.08881883148548322, 'depth': 12, 'boosting_type': 'Plain', 'bootstrap_type': 'Bayesian', 'bagging_temperature': 4.400887820640893}. Best is trial 1464 with value: 0.8990825688073395.
[32m[I 2023-04-21 00:48:17,373][39m Trial 5089 finished with value: 0.8392857142857144 and parameters: {'objective': 'Logloss', 'colsample_bylevel': 0.08795571237713042, 'depth': 8, 'boosting_type': 'Plain', 'bootstrap_type': 'MVS'}. Best is trial 1464 with value: 0.8990825688073395.
[32m[I 2023-04-21 00:48:18,608][39m Trial 5090 finished with value: 0.8727272727272727 and parameters: {'objective': 'Logloss', 'colsample_bylevel': 0.09602941121459807, 'depth': 12, 'boosting_type': 'Plain', 'bootstrap_type': 'Bayesian', 'bagging_temperature': 5.494651951788873}. Best is trial 1464 with value: 0.8990825688073395.
[32m[I 2023-04-21 00:48:20,056][39m Trial 5091 finished with value: 0.8347826086956522 and parameters: {'objective': 'Logloss', 'colsample_bylevel': 0.07359308957183874, 'depth': 12, 'boosting_type': 'Plain', 'bootstrap_type': 'Bayesian', 'bagging_temperature': 4.8244316517543115}. Best is trial 1464 with value: 0.8990825688073395.
[32m[I 2023-04-21 00:48:20,695][39m Trial 5092 finished with value: 0.8672566371681416 and parameters: {'objective': 'CrossEntropy', 'colsample_bylevel': 0.08795784572547401, 'depth': 12, 'boosting_type': 'Plain', 'bootstrap_type': 'Bayesian', 'bagging_temperature': 4.797840026453908}. Best is trial 1464 with value: 0.8990825688073395.
[32m[I 2023-04-21 00:48:21,408][39m Trial 5093 finished with value: 0.8807339449541284 and parameters: {'objective': 'CrossEntropy', 'colsample_bylevel': 0.08798930372188365, 'depth': 12, 'boosting_type': 'Plain', 'bootstrap_type': 'Bayesian', 'bagging_temperature': 5.231994677385869}. Best is trial 1464 with value: 0.8990825688073395.
[32m[I 2023-04-21 00:48:22,958][39m Trial 5094 finished with value: 0.8392857142857144 and parameters: {'objective': 'CrossEntropy', 'colsample_bylevel': 0.071360073316969, 'depth': 9, 'boosting_type': 'Plain', 'bootstrap_type': 'Bayesian', 'bagging_temperature': 4.885034135844429}. Best is trial 1464 with value: 0.8990825688073395.
[32m[I 2023-04-21 00:48:24,231][39m Trial 5095 finished with value: 0.875 and parameters: {'objective': 'CrossEntropy', 'colsample_bylevel': 0.08174905269407141, 'depth': 12, 'boosting_type': 'Plain', 'bootstrap_type': 'Bayesian', 'bagging_temperature': 6.517769013405775}. Best is trial 1464 with value: 0.8990825688073395.
[32m[I 2023-04-21 00:48:25,608][39m Trial 5096 finished with value: 0.8828828828828829 and parameters: {'objective': 'CrossEntropy', 'colsample_bylevel': 0.08469703918264737, 'depth': 12, 'boosting_type': 'Plain', 'bootstrap_type': 'Bayesian', 'bagging_temperature': 6.060798234835293}. Best is trial 1464 with value: 0.8990825688073395.
[32m[I 2023-04-21 00:48:26,635][39m Trial 5097 finished with value: 0.8727272727272727 and parameters: {'objective': 'Logloss', 'colsample_bylevel': 0.09233352869810466, 'depth': 10, 'boosting_type': 'Plain', 'bootstrap_type': 'Bayesian', 'bagging_temperature': 7.1585089631037535}. Best is trial 1464 with value: 0.8990825688073395.
[32m[I 2023-04-21 00:48:27,923][39m Trial 5098 finished with value: 0.8648648648648648 and parameters: {'objective': 'Logloss', 'colsample_bylevel': 0.09054951671837567, 'depth': 12, 'boosting_type': 'Plain', 'bootstrap_type': 'Bayesian', 'bagging_temperature': 6.533868185972909}. Best is trial 1464 with value: 0.8990825688073395.
[32m[I 2023-04-21 00:48:28,670][39m Trial 5099 finished with value: 0.888888888888889 and parameters: {'objective': 'CrossEntropy', 'colsample_bylevel': 0.09468376573236009, 'depth': 7, 'boosting_type': 'Plain', 'bootstrap_type': 'Bayesian', 'bagging_temperature': 6.294954304686781}. Best is trial 1464 with value: 0.8990825688073395.
[32m[I 2023-04-21 00:48:29,797][39m Trial 5100 finished with value: 0.8807339449541284 and parameters: {'objective': 'CrossEntropy', 'colsample_bylevel': 0.09166072081802483, 'depth': 12, 'boosting_type': 'Plain', 'bootstrap_type': 'Bayesian', 'bagging_temperature': 7.356825677734512}. Best is trial 1464 with value: 0.8990825688073395.
[32m[I 2023-04-21 00:48:34,679][39m Trial 5101 finished with value: 0.8495575221238938 and parameters: {'objective': 'Logloss', 'colsample_bylevel': 0.09859618502928136, 'depth': 7, 'boosting_type': 'Ordered', 'bootstrap_type': 'Bayesian', 'bagging_temperature': 4.577930772082999}. Best is trial 1464 with value: 0.8990825688073395.
[32m[I 2023-04-21 00:48:35,668][39m Trial 5102 finished with value: 0.8785046728971961 and parameters: {'objective': 'CrossEntropy', 'colsample_bylevel': 0.09881279903594135, 'depth': 7, 'boosting_type': 'Plain', 'bootstrap_type': 'Bayesian', 'bagging_temperature': 4.761956620898708}. Best is trial 1464 with value: 0.8990825688073395.
[32m[I 2023-04-21 00:48:36,883][39m Trial 5103 finished with value: 0.8727272727272727 and parameters: {'objective': 'CrossEntropy', 'colsample_bylevel': 0.08757276091943662, 'depth': 12, 'boosting_type': 'Plain', 'bootstrap_type': 'Bayesian', 'bagging_temperature': 4.961932377678075}. Best is trial 1464 with value: 0.8990825688073395.
[32m[I 2023-04-21 00:48:37,811][39m Trial 5104 finished with value: 0.888888888888889 and parameters: {'objective': 'CrossEntropy', 'colsample_bylevel': 0.08722502234636481, 'depth': 12, 'boosting_type': 'Plain', 'bootstrap_type': 'Bayesian', 'bagging_temperature': 5.153271961868808}. Best is trial 1464 with value: 0.8990825688073395.
[32m[I 2023-04-21 00:48:38,989][39m Trial 5105 finished with value: 0.8727272727272727 and parameters: {'objective': 'Logloss', 'colsample_bylevel': 0.09648875413866337, 'depth': 11, 'boosting_type': 'Plain', 'bootstrap_type': 'Bayesian', 'bagging_temperature': 5.824847650178857}. Best is trial 1464 with value: 0.8990825688073395.
[32m[I 2023-04-21 00:48:40,444][39m Trial 5106 finished with value: 0.8099173553719008 and parameters: {'objective': 'CrossEntropy', 'colsample_bylevel': 0.023765716897619818, 'depth': 12, 'boosting_type': 'Plain', 'bootstrap_type': 'Bernoulli', 'subsample': 0.28130064968839824}. Best is trial 1464 with value: 0.8990825688073395.
[32m[I 2023-04-21 00:48:41,333][39m Trial 5107 finished with value: 0.8807339449541284 and parameters: {'objective': 'CrossEntropy', 'colsample_bylevel': 0.09641085083237703, 'depth': 6, 'boosting_type': 'Plain', 'bootstrap_type': 'Bayesian', 'bagging_temperature': 4.142694627004732}. Best is trial 1464 with value: 0.8990825688073395.
[32m[I 2023-04-21 00:48:42,464][39m Trial 5108 finished with value: 0.8807339449541284 and parameters: {'objective': 'Logloss', 'colsample_bylevel': 0.09836873736097625, 'depth': 8, 'boosting_type': 'Plain', 'bootstrap_type': 'Bayesian', 'bagging_temperature': 3.713414082951698}. Best is trial 1464 with value: 0.8990825688073395.
[32m[I 2023-04-21 00:48:43,246][39m Trial 5109 finished with value: 0.8807339449541284 and parameters: {'objective': 'Logloss', 'colsample_bylevel': 0.09171352506991044, 'depth': 11, 'boosting_type': 'Plain', 'bootstrap_type': 'Bayesian', 'bagging_temperature': 5.151097541795171}. Best is trial 1464 with value: 0.8990825688073395.
[32m[I 2023-04-21 00:48:44,652][39m Trial 5110 finished with value: 0.888888888888889 and parameters: {'objective': 'CrossEntropy', 'colsample_bylevel': 0.09003985626235826, 'depth': 11, 'boosting_type': 'Plain', 'bootstrap_type': 'Bayesian', 'bagging_temperature': 4.829725736280783}. Best is trial 1464 with value: 0.8990825688073395.
[32m[I 2023-04-21 00:48:45,599][39m Trial 5111 finished with value: 0.8571428571428572 and parameters: {'objective': 'CrossEntropy', 'colsample_bylevel': 0.08631346916253792, 'depth': 8, 'boosting_type': 'Plain', 'bootstrap_type': 'MVS'}. Best is trial 1464 with value: 0.8990825688073395.
[32m[I 2023-04-21 00:48:46,545][39m Trial 5112 finished with value: 0.888888888888889 and parameters: {'objective': 'Logloss', 'colsample_bylevel': 0.09866787769733786, 'depth': 8, 'boosting_type': 'Plain', 'bootstrap_type': 'Bayesian', 'bagging_temperature': 4.888961102090075}. Best is trial 1464 with value: 0.8990825688073395.
[32m[I 2023-04-21 00:48:47,516][39m Trial 5113 finished with value: 0.8807339449541284 and parameters: {'objective': 'CrossEntropy', 'colsample_bylevel': 0.09273295073144863, 'depth': 12, 'boosting_type': 'Plain', 'bootstrap_type': 'Bayesian', 'bagging_temperature': 5.666840452659236}. Best is trial 1464 with value: 0.8990825688073395.
[32m[I 2023-04-21 00:48:48,722][39m Trial 5114 finished with value: 0.8828828828828829 and parameters: {'objective': 'CrossEntropy', 'colsample_bylevel': 0.08806654168167512, 'depth': 9, 'boosting_type': 'Plain', 'bootstrap_type': 'Bayesian', 'bagging_temperature': 5.718246573468836}. Best is trial 1464 with value: 0.8990825688073395.
[32m[I 2023-04-21 00:48:50,200][39m Trial 5115 finished with value: 0.888888888888889 and parameters: {'objective': 'CrossEntropy', 'colsample_bylevel': 0.09695682332394397, 'depth': 9, 'boosting_type': 'Plain', 'bootstrap_type': 'Bayesian', 'bagging_temperature': 6.209204179541503}. Best is trial 1464 with value: 0.8990825688073395.
[32m[I 2023-04-21 00:48:51,517][39m Trial 5116 finished with value: 0.888888888888889 and parameters: {'objective': 'Logloss', 'colsample_bylevel': 0.0996885747662597, 'depth': 11, 'boosting_type': 'Plain', 'bootstrap_type': 'Bayesian', 'bagging_temperature': 4.120005888730451}. Best is trial 1464 with value: 0.8990825688073395.
[32m[I 2023-04-21 00:48:52,338][39m Trial 5117 finished with value: 0.8807339449541284 and parameters: {'objective': 'CrossEntropy', 'colsample_bylevel': 0.08870806601204728, 'depth': 12, 'boosting_type': 'Plain', 'bootstrap_type': 'Bayesian', 'bagging_temperature': 5.241490890041764}. Best is trial 1464 with value: 0.8990825688073395.
[32m[I 2023-04-21 00:48:53,022][39m Trial 5118 finished with value: 0.8545454545454546 and parameters: {'objective': 'CrossEntropy', 'colsample_bylevel': 0.08936452674917726, 'depth': 12, 'boosting_type': 'Plain', 'bootstrap_type': 'Bayesian', 'bagging_temperature': 5.552952840797177}. Best is trial 1464 with value: 0.8990825688073395.
[32m[I 2023-04-21 00:48:58,045][39m Trial 5119 finished with value: 0.8421052631578947 and parameters: {'objective': 'CrossEntropy', 'colsample_bylevel': 0.09784889687287526, 'depth': 9, 'boosting_type': 'Ordered', 'bootstrap_type': 'Bayesian', 'bagging_temperature': 6.037208968957701}. Best is trial 1464 with value: 0.8990825688073395.
[32m[I 2023-04-21 00:48:59,115][39m Trial 5120 finished with value: 0.8648648648648648 and parameters: {'objective': 'Logloss', 'colsample_bylevel': 0.08346265535947921, 'depth': 12, 'boosting_type': 'Plain', 'bootstrap_type': 'Bayesian', 'bagging_temperature': 6.274966557052814}. Best is trial 1464 with value: 0.8990825688073395.
[32m[I 2023-04-21 00:49:00,296][39m Trial 5121 finished with value: 0.875 and parameters: {'objective': 'Logloss', 'colsample_bylevel': 0.0875255855240414, 'depth': 12, 'boosting_type': 'Plain', 'bootstrap_type': 'Bayesian', 'bagging_temperature': 7.291223177260379}. Best is trial 1464 with value: 0.8990825688073395.
[32m[I 2023-04-21 00:49:01,557][39m Trial 5122 finished with value: 0.888888888888889 and parameters: {'objective': 'CrossEntropy', 'colsample_bylevel': 0.09420302157085775, 'depth': 11, 'boosting_type': 'Plain', 'bootstrap_type': 'Bayesian', 'bagging_temperature': 6.802699815138974}. Best is trial 1464 with value: 0.8990825688073395.
[32m[I 2023-04-21 00:49:02,773][39m Trial 5123 finished with value: 0.8807339449541284 and parameters: {'objective': 'Logloss', 'colsample_bylevel': 0.09986407413886472, 'depth': 7, 'boosting_type': 'Plain', 'bootstrap_type': 'Bayesian', 'bagging_temperature': 4.7917627156539435}. Best is trial 1464 with value: 0.8990825688073395.
[32m[I 2023-04-21 00:49:04,035][39m Trial 5124 finished with value: 0.8648648648648648 and parameters: {'objective': 'Logloss', 'colsample_bylevel': 0.08293789178175238, 'depth': 12, 'boosting_type': 'Plain', 'bootstrap_type': 'Bayesian', 'bagging_temperature': 7.177814365946487}. Best is trial 1464 with value: 0.8990825688073395.
[32m[I 2023-04-21 00:49:04,836][39m Trial 5125 finished with value: 0.8727272727272727 and parameters: {'objective': 'CrossEntropy', 'colsample_bylevel': 0.09347109866176948, 'depth': 7, 'boosting_type': 'Plain', 'bootstrap_type': 'Bayesian', 'bagging_temperature': 4.3604069950820525}. Best is trial 1464 with value: 0.8990825688073395.
[32m[I 2023-04-21 00:49:06,245][39m Trial 5126 finished with value: 0.8727272727272727 and parameters: {'objective': 'Logloss', 'colsample_bylevel': 0.0928483985363226, 'depth': 7, 'boosting_type': 'Plain', 'bootstrap_type': 'Bayesian', 'bagging_temperature': 3.690493714239755}. Best is trial 1464 with value: 0.8990825688073395.
[32m[I 2023-04-21 00:49:07,542][39m Trial 5127 finished with value: 0.8807339449541284 and parameters: {'objective': 'Logloss', 'colsample_bylevel': 0.09183238456899516, 'depth': 12, 'boosting_type': 'Plain', 'bootstrap_type': 'Bayesian', 'bagging_temperature': 5.705151718462815}. Best is trial 1464 with value: 0.8990825688073395.
[32m[I 2023-04-21 00:49:08,316][39m Trial 5128 finished with value: 0.8807339449541284 and parameters: {'objective': 'Logloss', 'colsample_bylevel': 0.09170731412340392, 'depth': 12, 'boosting_type': 'Plain', 'bootstrap_type': 'Bayesian', 'bagging_temperature': 6.141536783337704}. Best is trial 1464 with value: 0.8990825688073395.
[32m[I 2023-04-21 00:49:09,455][39m Trial 5129 finished with value: 0.8703703703703703 and parameters: {'objective': 'CrossEntropy', 'colsample_bylevel': 0.09992102262322708, 'depth': 6, 'boosting_type': 'Plain', 'bootstrap_type': 'Bayesian', 'bagging_temperature': 4.9633535961941915}. Best is trial 1464 with value: 0.8990825688073395.
[32m[I 2023-04-21 00:49:10,275][39m Trial 5130 finished with value: 0.8807339449541284 and parameters: {'objective': 'CrossEntropy', 'colsample_bylevel': 0.09282221494907004, 'depth': 12, 'boosting_type': 'Plain', 'bootstrap_type': 'Bayesian', 'bagging_temperature': 3.8443015780025545}. Best is trial 1464 with value: 0.8990825688073395.
[32m[I 2023-04-21 00:49:11,201][39m Trial 5131 finished with value: 0.8571428571428572 and parameters: {'objective': 'CrossEntropy', 'colsample_bylevel': 0.08483079702401533, 'depth': 12, 'boosting_type': 'Plain', 'bootstrap_type': 'Bernoulli', 'subsample': 0.4681288863544738}. Best is trial 1464 with value: 0.8990825688073395.
[32m[I 2023-04-21 00:49:12,401][39m Trial 5132 finished with value: 0.890909090909091 and parameters: {'objective': 'Logloss', 'colsample_bylevel': 0.09841738907143659, 'depth': 7, 'boosting_type': 'Plain', 'bootstrap_type': 'Bayesian', 'bagging_temperature': 3.55169520075783}. Best is trial 1464 with value: 0.8990825688073395.
