[32m[I 2023-04-21 00:10:41,897][39m Trial 3426 finished with value: 0.8807339449541284 and parameters: {'objective': 'CrossEntropy', 'colsample_bylevel': 0.08533379205454845, 'depth': 8, 'boosting_type': 'Plain', 'bootstrap_type': 'Bayesian', 'bagging_temperature': 5.369441305871536}. Best is trial 1464 with value: 0.8990825688073395.
[32m[I 2023-04-21 00:10:43,330][39m Trial 3427 finished with value: 0.8727272727272727 and parameters: {'objective': 'Logloss', 'colsample_bylevel': 0.08977316394442418, 'depth': 9, 'boosting_type': 'Plain', 'bootstrap_type': 'Bayesian', 'bagging_temperature': 4.98634151187729}. Best is trial 1464 with value: 0.8990825688073395.
[32m[I 2023-04-21 00:10:44,414][39m Trial 3428 finished with value: 0.8807339449541284 and parameters: {'objective': 'Logloss', 'colsample_bylevel': 0.09323889297356275, 'depth': 9, 'boosting_type': 'Plain', 'bootstrap_type': 'Bayesian', 'bagging_temperature': 5.5034525874626326}. Best is trial 1464 with value: 0.8990825688073395.
[32m[I 2023-04-21 00:10:45,674][39m Trial 3429 finished with value: 0.8521739130434783 and parameters: {'objective': 'Logloss', 'colsample_bylevel': 0.09317233940843096, 'depth': 9, 'boosting_type': 'Plain', 'bootstrap_type': 'MVS'}. Best is trial 1464 with value: 0.8990825688073395.
[32m[I 2023-04-21 00:10:47,600][39m Trial 3430 finished with value: 0.8596491228070176 and parameters: {'objective': 'Logloss', 'colsample_bylevel': 0.09436279458929711, 'depth': 9, 'boosting_type': 'Plain', 'bootstrap_type': 'Bayesian', 'bagging_temperature': 6.069933973257277}. Best is trial 1464 with value: 0.8990825688073395.
[32m[I 2023-04-21 00:10:48,852][39m Trial 3431 finished with value: 0.8807339449541284 and parameters: {'objective': 'Logloss', 'colsample_bylevel': 0.09712443640851556, 'depth': 8, 'boosting_type': 'Plain', 'bootstrap_type': 'Bayesian', 'bagging_temperature': 5.498979449572701}. Best is trial 1464 with value: 0.8990825688073395.
[32m[I 2023-04-21 00:10:50,523][39m Trial 3432 finished with value: 0.8807339449541284 and parameters: {'objective': 'Logloss', 'colsample_bylevel': 0.09595320654949303, 'depth': 9, 'boosting_type': 'Plain', 'bootstrap_type': 'Bayesian', 'bagging_temperature': 7.519778412308203}. Best is trial 1464 with value: 0.8990825688073395.
[32m[I 2023-04-21 00:10:51,326][39m Trial 3433 finished with value: 0.8648648648648648 and parameters: {'objective': 'Logloss', 'colsample_bylevel': 0.08735982147558814, 'depth': 9, 'boosting_type': 'Plain', 'bootstrap_type': 'Bayesian', 'bagging_temperature': 5.38097024017058}. Best is trial 1464 with value: 0.8990825688073395.
[32m[I 2023-04-21 00:10:55,692][39m Trial 3434 finished with value: 0.8421052631578947 and parameters: {'objective': 'Logloss', 'colsample_bylevel': 0.09977173437918378, 'depth': 9, 'boosting_type': 'Ordered', 'bootstrap_type': 'Bayesian', 'bagging_temperature': 5.904364981725534}. Best is trial 1464 with value: 0.8990825688073395.
[32m[I 2023-04-21 00:10:57,483][39m Trial 3435 finished with value: 0.8807339449541284 and parameters: {'objective': 'Logloss', 'colsample_bylevel': 0.08977287232590626, 'depth': 9, 'boosting_type': 'Plain', 'bootstrap_type': 'Bayesian', 'bagging_temperature': 5.6731982330489625}. Best is trial 1464 with value: 0.8990825688073395.
[32m[I 2023-04-21 00:10:58,828][39m Trial 3436 finished with value: 0.8807339449541284 and parameters: {'objective': 'Logloss', 'colsample_bylevel': 0.09713544237734396, 'depth': 9, 'boosting_type': 'Plain', 'bootstrap_type': 'Bayesian', 'bagging_temperature': 3.8689961032428815}. Best is trial 1464 with value: 0.8990825688073395.
[32m[I 2023-04-21 00:10:59,692][39m Trial 3437 finished with value: 0.8807339449541284 and parameters: {'objective': 'Logloss', 'colsample_bylevel': 0.09845984607699361, 'depth': 8, 'boosting_type': 'Plain', 'bootstrap_type': 'Bayesian', 'bagging_temperature': 4.966296919109308}. Best is trial 1464 with value: 0.8990825688073395.
[32m[I 2023-04-21 00:11:01,890][39m Trial 3438 finished with value: 0.8727272727272727 and parameters: {'objective': 'Logloss', 'colsample_bylevel': 0.09682172217148823, 'depth': 9, 'boosting_type': 'Plain', 'bootstrap_type': 'Bayesian', 'bagging_temperature': 5.235517559875687}. Best is trial 1464 with value: 0.8990825688073395.
[32m[I 2023-04-21 00:11:03,801][39m Trial 3439 finished with value: 0.8571428571428572 and parameters: {'objective': 'Logloss', 'colsample_bylevel': 0.08302628529837325, 'depth': 9, 'boosting_type': 'Plain', 'bootstrap_type': 'Bayesian', 'bagging_temperature': 6.901824356138883}. Best is trial 1464 with value: 0.8990825688073395.
[32m[I 2023-04-21 00:11:05,046][39m Trial 3440 finished with value: 0.8785046728971961 and parameters: {'objective': 'Logloss', 'colsample_bylevel': 0.09740731393756916, 'depth': 8, 'boosting_type': 'Plain', 'bootstrap_type': 'Bayesian', 'bagging_temperature': 5.910808130956662}. Best is trial 1464 with value: 0.8990825688073395.
[32m[I 2023-04-21 00:11:06,181][39m Trial 3441 finished with value: 0.8785046728971961 and parameters: {'objective': 'Logloss', 'colsample_bylevel': 0.09421266863619229, 'depth': 9, 'boosting_type': 'Plain', 'bootstrap_type': 'Bayesian', 'bagging_temperature': 5.433101350645703}. Best is trial 1464 with value: 0.8990825688073395.
[32m[I 2023-04-21 00:11:07,212][39m Trial 3442 finished with value: 0.8807339449541284 and parameters: {'objective': 'CrossEntropy', 'colsample_bylevel': 0.09707030130471034, 'depth': 9, 'boosting_type': 'Plain', 'bootstrap_type': 'Bayesian', 'bagging_temperature': 4.641828767158278}. Best is trial 1464 with value: 0.8990825688073395.
[32m[I 2023-04-21 00:11:08,787][39m Trial 3443 finished with value: 0.8828828828828829 and parameters: {'objective': 'Logloss', 'colsample_bylevel': 0.09098841279160948, 'depth': 9, 'boosting_type': 'Plain', 'bootstrap_type': 'Bayesian', 'bagging_temperature': 5.7436418518382695}. Best is trial 1464 with value: 0.8990825688073395.
[32m[I 2023-04-21 00:11:10,065][39m Trial 3444 finished with value: 0.8727272727272727 and parameters: {'objective': 'CrossEntropy', 'colsample_bylevel': 0.0982709059392952, 'depth': 6, 'boosting_type': 'Plain', 'bootstrap_type': 'Bayesian', 'bagging_temperature': 4.552271090347801}. Best is trial 1464 with value: 0.8990825688073395.
[32m[I 2023-04-21 00:11:11,407][39m Trial 3445 finished with value: 0.8703703703703703 and parameters: {'objective': 'Logloss', 'colsample_bylevel': 0.09029019149190831, 'depth': 9, 'boosting_type': 'Plain', 'bootstrap_type': 'Bayesian', 'bagging_temperature': 5.11888723217314}. Best is trial 1464 with value: 0.8990825688073395.
[32m[I 2023-04-21 00:11:12,403][39m Trial 3446 finished with value: 0.875 and parameters: {'objective': 'Logloss', 'colsample_bylevel': 0.09459051169531696, 'depth': 9, 'boosting_type': 'Plain', 'bootstrap_type': 'Bayesian', 'bagging_temperature': 5.7970905022511205}. Best is trial 1464 with value: 0.8990825688073395.
[32m[I 2023-04-21 00:11:12,970][39m Trial 3447 finished with value: 0.8571428571428572 and parameters: {'objective': 'CrossEntropy', 'colsample_bylevel': 0.0999551498467477, 'depth': 8, 'boosting_type': 'Plain', 'bootstrap_type': 'Bernoulli', 'subsample': 0.9494225378630894}. Best is trial 1464 with value: 0.8990825688073395.
[32m[I 2023-04-21 00:11:14,208][39m Trial 3448 finished with value: 0.8727272727272727 and parameters: {'objective': 'Logloss', 'colsample_bylevel': 0.09714305349908195, 'depth': 9, 'boosting_type': 'Plain', 'bootstrap_type': 'Bayesian', 'bagging_temperature': 6.199811498148478}. Best is trial 1464 with value: 0.8990825688073395.
[32m[I 2023-04-21 00:11:15,423][39m Trial 3449 finished with value: 0.8807339449541284 and parameters: {'objective': 'Logloss', 'colsample_bylevel': 0.09706904788288832, 'depth': 7, 'boosting_type': 'Plain', 'bootstrap_type': 'Bayesian', 'bagging_temperature': 5.542256311642097}. Best is trial 1464 with value: 0.8990825688073395.
[32m[I 2023-04-21 00:11:17,306][39m Trial 3450 finished with value: 0.8598130841121495 and parameters: {'objective': 'Logloss', 'colsample_bylevel': 0.0927231283724858, 'depth': 9, 'boosting_type': 'Plain', 'bootstrap_type': 'Bayesian', 'bagging_temperature': 5.280040593077906}. Best is trial 1464 with value: 0.8990825688073395.
[32m[I 2023-04-21 00:11:18,560][39m Trial 3451 finished with value: 0.8596491228070176 and parameters: {'objective': 'CrossEntropy', 'colsample_bylevel': 0.09307811117345792, 'depth': 11, 'boosting_type': 'Plain', 'bootstrap_type': 'MVS'}. Best is trial 1464 with value: 0.8990825688073395.
[32m[I 2023-04-21 00:11:19,488][39m Trial 3452 finished with value: 0.8727272727272727 and parameters: {'objective': 'Logloss', 'colsample_bylevel': 0.09594187600295168, 'depth': 9, 'boosting_type': 'Plain', 'bootstrap_type': 'Bayesian', 'bagging_temperature': 5.806636968992382}. Best is trial 1464 with value: 0.8990825688073395.
[32m[I 2023-04-21 00:11:23,597][39m Trial 3453 finished with value: 0.8275862068965517 and parameters: {'objective': 'CrossEntropy', 'colsample_bylevel': 0.04128311405436376, 'depth': 10, 'boosting_type': 'Ordered', 'bootstrap_type': 'Bayesian', 'bagging_temperature': 6.049635029875306}. Best is trial 1464 with value: 0.8990825688073395.
[32m[I 2023-04-21 00:11:25,176][39m Trial 3454 finished with value: 0.888888888888889 and parameters: {'objective': 'Logloss', 'colsample_bylevel': 0.09463384641618997, 'depth': 8, 'boosting_type': 'Plain', 'bootstrap_type': 'Bayesian', 'bagging_temperature': 5.64817403131327}. Best is trial 1464 with value: 0.8990825688073395.
[32m[I 2023-04-21 00:11:26,408][39m Trial 3455 finished with value: 0.8727272727272727 and parameters: {'objective': 'CrossEntropy', 'colsample_bylevel': 0.09836447765841498, 'depth': 9, 'boosting_type': 'Plain', 'bootstrap_type': 'Bayesian', 'bagging_temperature': 6.160388196713754}. Best is trial 1464 with value: 0.8990825688073395.
[32m[I 2023-04-21 00:11:27,853][39m Trial 3456 finished with value: 0.8807339449541284 and parameters: {'objective': 'Logloss', 'colsample_bylevel': 0.09241121949698843, 'depth': 9, 'boosting_type': 'Plain', 'bootstrap_type': 'Bayesian', 'bagging_temperature': 6.435450116087823}. Best is trial 1464 with value: 0.8990825688073395.
[32m[I 2023-04-21 00:11:28,725][39m Trial 3457 finished with value: 0.875 and parameters: {'objective': 'Logloss', 'colsample_bylevel': 0.0944725840042637, 'depth': 9, 'boosting_type': 'Plain', 'bootstrap_type': 'Bayesian', 'bagging_temperature': 7.390590440612759}. Best is trial 1464 with value: 0.8990825688073395.
[32m[I 2023-04-21 00:11:30,232][39m Trial 3458 finished with value: 0.8727272727272727 and parameters: {'objective': 'Logloss', 'colsample_bylevel': 0.09585295939940415, 'depth': 9, 'boosting_type': 'Plain', 'bootstrap_type': 'Bayesian', 'bagging_temperature': 3.704376714913157}. Best is trial 1464 with value: 0.8990825688073395.
[32m[I 2023-04-21 00:11:31,614][39m Trial 3459 finished with value: 0.8727272727272727 and parameters: {'objective': 'Logloss', 'colsample_bylevel': 0.09870955153032207, 'depth': 8, 'boosting_type': 'Plain', 'bootstrap_type': 'Bayesian', 'bagging_temperature': 5.109696973459409}. Best is trial 1464 with value: 0.8990825688073395.
[32m[I 2023-04-21 00:11:32,740][39m Trial 3460 finished with value: 0.7833333333333333 and parameters: {'objective': 'Logloss', 'colsample_bylevel': 0.012179118007938729, 'depth': 7, 'boosting_type': 'Plain', 'bootstrap_type': 'Bayesian', 'bagging_temperature': 5.164886366892429}. Best is trial 1464 with value: 0.8990825688073395.
[32m[I 2023-04-21 00:11:33,931][39m Trial 3461 finished with value: 0.8545454545454546 and parameters: {'objective': 'Logloss', 'colsample_bylevel': 0.08846038616478215, 'depth': 9, 'boosting_type': 'Plain', 'bootstrap_type': 'Bayesian', 'bagging_temperature': 5.417329128632559}. Best is trial 1464 with value: 0.8990825688073395.
[32m[I 2023-04-21 00:11:34,845][39m Trial 3462 finished with value: 0.8727272727272727 and parameters: {'objective': 'Logloss', 'colsample_bylevel': 0.09840664321507857, 'depth': 9, 'boosting_type': 'Plain', 'bootstrap_type': 'Bayesian', 'bagging_temperature': 5.851328205414686}. Best is trial 1464 with value: 0.8990825688073395.
[32m[I 2023-04-21 00:11:35,671][39m Trial 3463 finished with value: 0.8727272727272727 and parameters: {'objective': 'Logloss', 'colsample_bylevel': 0.09751241627327546, 'depth': 8, 'boosting_type': 'Plain', 'bootstrap_type': 'Bayesian', 'bagging_temperature': 5.708979762035357}. Best is trial 1464 with value: 0.8990825688073395.
[32m[I 2023-04-21 00:11:36,369][39m Trial 3464 finished with value: 0.8807339449541284 and parameters: {'objective': 'CrossEntropy', 'colsample_bylevel': 0.09409302109838348, 'depth': 9, 'boosting_type': 'Plain', 'bootstrap_type': 'Bayesian', 'bagging_temperature': 5.4814996077795115}. Best is trial 1464 with value: 0.8990825688073395.
[32m[I 2023-04-21 00:11:37,239][39m Trial 3465 finished with value: 0.8828828828828829 and parameters: {'objective': 'CrossEntropy', 'colsample_bylevel': 0.09019703299534518, 'depth': 9, 'boosting_type': 'Plain', 'bootstrap_type': 'Bayesian', 'bagging_temperature': 5.02951176829514}. Best is trial 1464 with value: 0.8990825688073395.
[32m[I 2023-04-21 00:11:38,629][39m Trial 3466 finished with value: 0.8623853211009175 and parameters: {'objective': 'Logloss', 'colsample_bylevel': 0.09947244374198214, 'depth': 8, 'boosting_type': 'Plain', 'bootstrap_type': 'Bayesian', 'bagging_temperature': 5.779538316564798}. Best is trial 1464 with value: 0.8990825688073395.
[32m[I 2023-04-21 00:11:40,439][39m Trial 3467 finished with value: 0.8727272727272727 and parameters: {'objective': 'Logloss', 'colsample_bylevel': 0.09689338691155, 'depth': 9, 'boosting_type': 'Plain', 'bootstrap_type': 'Bayesian', 'bagging_temperature': 5.704053489039686}. Best is trial 1464 with value: 0.8990825688073395.
[32m[I 2023-04-21 00:11:41,342][39m Trial 3468 finished with value: 0.8347826086956522 and parameters: {'objective': 'Logloss', 'colsample_bylevel': 0.07643608789551161, 'depth': 10, 'boosting_type': 'Plain', 'bootstrap_type': 'Bernoulli', 'subsample': 0.6514996175482745}. Best is trial 1464 with value: 0.8990825688073395.
[32m[I 2023-04-21 00:11:42,273][39m Trial 3469 finished with value: 0.8672566371681416 and parameters: {'objective': 'Logloss', 'colsample_bylevel': 0.09509543925738714, 'depth': 8, 'boosting_type': 'Plain', 'bootstrap_type': 'Bayesian', 'bagging_temperature': 4.83567483648473}. Best is trial 1464 with value: 0.8990825688073395.
[32m[I 2023-04-21 00:11:43,004][39m Trial 3470 finished with value: 0.8648648648648648 and parameters: {'objective': 'CrossEntropy', 'colsample_bylevel': 0.09998764952228009, 'depth': 9, 'boosting_type': 'Plain', 'bootstrap_type': 'Bayesian', 'bagging_temperature': 5.56830440052829}. Best is trial 1464 with value: 0.8990825688073395.
[32m[I 2023-04-21 00:11:44,524][39m Trial 3471 finished with value: 0.8807339449541284 and parameters: {'objective': 'CrossEntropy', 'colsample_bylevel': 0.0932692266490354, 'depth': 9, 'boosting_type': 'Plain', 'bootstrap_type': 'Bayesian', 'bagging_temperature': 4.773179737176327}. Best is trial 1464 with value: 0.8990825688073395.
[32m[I 2023-04-21 00:11:51,305][39m Trial 3472 finished with value: 0.8421052631578947 and parameters: {'objective': 'Logloss', 'colsample_bylevel': 0.09660906883035264, 'depth': 6, 'boosting_type': 'Ordered', 'bootstrap_type': 'Bayesian', 'bagging_temperature': 5.411517394953877}. Best is trial 1464 with value: 0.8990825688073395.
[32m[I 2023-04-21 00:11:52,315][39m Trial 3473 finished with value: 0.8807339449541284 and parameters: {'objective': 'Logloss', 'colsample_bylevel': 0.09418245770483369, 'depth': 7, 'boosting_type': 'Plain', 'bootstrap_type': 'Bayesian', 'bagging_temperature': 5.55327891435238}. Best is trial 1464 with value: 0.8990825688073395.
[32m[I 2023-04-21 00:11:53,304][39m Trial 3474 finished with value: 0.8571428571428572 and parameters: {'objective': 'Logloss', 'colsample_bylevel': 0.09269856818271707, 'depth': 10, 'boosting_type': 'Plain', 'bootstrap_type': 'MVS'}. Best is trial 1464 with value: 0.8990825688073395.
[32m[I 2023-04-21 00:11:54,840][39m Trial 3475 finished with value: 0.8807339449541284 and parameters: {'objective': 'Logloss', 'colsample_bylevel': 0.0960072819564086, 'depth': 9, 'boosting_type': 'Plain', 'bootstrap_type': 'Bayesian', 'bagging_temperature': 6.64696931766665}. Best is trial 1464 with value: 0.8990825688073395.
[32m[I 2023-04-21 00:11:55,860][39m Trial 3476 finished with value: 0.8571428571428572 and parameters: {'objective': 'Logloss', 'colsample_bylevel': 0.0927505786751752, 'depth': 9, 'boosting_type': 'Plain', 'bootstrap_type': 'Bayesian', 'bagging_temperature': 0.6438195057926324}. Best is trial 1464 with value: 0.8990825688073395.
[32m[I 2023-04-21 00:11:56,677][39m Trial 3477 finished with value: 0.8166666666666667 and parameters: {'objective': 'Logloss', 'colsample_bylevel': 0.0920042958348815, 'depth': 1, 'boosting_type': 'Plain', 'bootstrap_type': 'Bayesian', 'bagging_temperature': 7.671429385047479}. Best is trial 1464 with value: 0.8990825688073395.
[32m[I 2023-04-21 00:11:57,985][39m Trial 3478 finished with value: 0.8807339449541284 and parameters: {'objective': 'Logloss', 'colsample_bylevel': 0.09200954011988724, 'depth': 9, 'boosting_type': 'Plain', 'bootstrap_type': 'Bayesian', 'bagging_temperature': 5.05309078881927}. Best is trial 1464 with value: 0.8990825688073395.
[32m[I 2023-04-21 00:11:59,501][39m Trial 3479 finished with value: 0.8703703703703703 and parameters: {'objective': 'CrossEntropy', 'colsample_bylevel': 0.09623005472870758, 'depth': 8, 'boosting_type': 'Plain', 'bootstrap_type': 'Bayesian', 'bagging_temperature': 5.876966587196496}. Best is trial 1464 with value: 0.8990825688073395.
[32m[I 2023-04-21 00:12:00,460][39m Trial 3480 finished with value: 0.8828828828828829 and parameters: {'objective': 'Logloss', 'colsample_bylevel': 0.09067750435375362, 'depth': 9, 'boosting_type': 'Plain', 'bootstrap_type': 'Bayesian', 'bagging_temperature': 5.638873913494232}. Best is trial 1464 with value: 0.8990825688073395.
[32m[I 2023-04-21 00:12:01,990][39m Trial 3481 finished with value: 0.8727272727272727 and parameters: {'objective': 'Logloss', 'colsample_bylevel': 0.0919643821456739, 'depth': 9, 'boosting_type': 'Plain', 'bootstrap_type': 'Bayesian', 'bagging_temperature': 7.308256324363352}. Best is trial 1464 with value: 0.8990825688073395.
[32m[I 2023-04-21 00:12:03,297][39m Trial 3482 finished with value: 0.875 and parameters: {'objective': 'Logloss', 'colsample_bylevel': 0.09585488473544282, 'depth': 9, 'boosting_type': 'Plain', 'bootstrap_type': 'Bayesian', 'bagging_temperature': 7.072433870926}. Best is trial 1464 with value: 0.8990825688073395.
[32m[I 2023-04-21 00:12:04,892][39m Trial 3483 finished with value: 0.8807339449541284 and parameters: {'objective': 'CrossEntropy', 'colsample_bylevel': 0.08879525333678713, 'depth': 9, 'boosting_type': 'Plain', 'bootstrap_type': 'Bayesian', 'bagging_temperature': 5.924688496055479}. Best is trial 1464 with value: 0.8990825688073395.
[32m[I 2023-04-21 00:12:05,904][39m Trial 3484 finished with value: 0.875 and parameters: {'objective': 'Logloss', 'colsample_bylevel': 0.08635339415743262, 'depth': 8, 'boosting_type': 'Plain', 'bootstrap_type': 'Bayesian', 'bagging_temperature': 5.301850211045183}. Best is trial 1464 with value: 0.8990825688073395.
[32m[I 2023-04-21 00:12:06,675][39m Trial 3485 finished with value: 0.7787610619469026 and parameters: {'objective': 'Logloss', 'colsample_bylevel': 0.014790856757262327, 'depth': 9, 'boosting_type': 'Plain', 'bootstrap_type': 'Bayesian', 'bagging_temperature': 4.838028474824016}. Best is trial 1464 with value: 0.8990825688073395.
[32m[I 2023-04-21 00:12:07,599][39m Trial 3486 finished with value: 0.8648648648648648 and parameters: {'objective': 'Logloss', 'colsample_bylevel': 0.09327198294085083, 'depth': 9, 'boosting_type': 'Plain', 'bootstrap_type': 'Bayesian', 'bagging_temperature': 6.054335116673033}. Best is trial 1464 with value: 0.8990825688073395.
[32m[I 2023-04-21 00:12:09,107][39m Trial 3487 finished with value: 0.8807339449541284 and parameters: {'objective': 'Logloss', 'colsample_bylevel': 0.09526843279400601, 'depth': 8, 'boosting_type': 'Plain', 'bootstrap_type': 'Bayesian', 'bagging_temperature': 5.80024246672381}. Best is trial 1464 with value: 0.8990825688073395.
[32m[I 2023-04-21 00:12:10,901][39m Trial 3488 finished with value: 0.8807339449541284 and parameters: {'objective': 'Logloss', 'colsample_bylevel': 0.09533650417914961, 'depth': 9, 'boosting_type': 'Plain', 'bootstrap_type': 'Bayesian', 'bagging_temperature': 6.190908614533191}. Best is trial 1464 with value: 0.8990825688073395.
[32m[I 2023-04-21 00:12:11,753][39m Trial 3489 finished with value: 0.8468468468468469 and parameters: {'objective': 'CrossEntropy', 'colsample_bylevel': 0.09162183543473812, 'depth': 9, 'boosting_type': 'Plain', 'bootstrap_type': 'Bayesian', 'bagging_temperature': 5.25033291532485}. Best is trial 1464 with value: 0.8990825688073395.
[32m[I 2023-04-21 00:12:16,147][39m Trial 3490 finished with value: 0.8495575221238938 and parameters: {'objective': 'Logloss', 'colsample_bylevel': 0.09734584209225404, 'depth': 8, 'boosting_type': 'Ordered', 'bootstrap_type': 'Bayesian', 'bagging_temperature': 6.344048239897846}. Best is trial 1464 with value: 0.8990825688073395.
[32m[I 2023-04-21 00:12:17,759][39m Trial 3491 finished with value: 0.8672566371681416 and parameters: {'objective': 'Logloss', 'colsample_bylevel': 0.09306418024401092, 'depth': 9, 'boosting_type': 'Plain', 'bootstrap_type': 'Bernoulli', 'subsample': 0.7009354947832597}. Best is trial 1464 with value: 0.8990825688073395.
