[32m[I 2023-04-21 00:15:19,825][39m Trial 3623 finished with value: 0.8807339449541284 and parameters: {'objective': 'Logloss', 'colsample_bylevel': 0.09550157275779093, 'depth': 10, 'boosting_type': 'Plain', 'bootstrap_type': 'Bayesian', 'bagging_temperature': 6.852726179276916}. Best is trial 1464 with value: 0.8990825688073395.
[32m[I 2023-04-21 00:15:20,593][39m Trial 3624 finished with value: 0.8703703703703703 and parameters: {'objective': 'Logloss', 'colsample_bylevel': 0.09274790102392796, 'depth': 7, 'boosting_type': 'Plain', 'bootstrap_type': 'Bayesian', 'bagging_temperature': 5.367871449328035}. Best is trial 1464 with value: 0.8990825688073395.
[32m[I 2023-04-21 00:15:21,806][39m Trial 3625 finished with value: 0.8521739130434783 and parameters: {'objective': 'Logloss', 'colsample_bylevel': 0.04709694230165168, 'depth': 8, 'boosting_type': 'Plain', 'bootstrap_type': 'Bayesian', 'bagging_temperature': 5.24408272119232}. Best is trial 1464 with value: 0.8990825688073395.
[32m[I 2023-04-21 00:15:22,873][39m Trial 3626 finished with value: 0.8807339449541284 and parameters: {'objective': 'CrossEntropy', 'colsample_bylevel': 0.09183072758498426, 'depth': 11, 'boosting_type': 'Plain', 'bootstrap_type': 'Bayesian', 'bagging_temperature': 6.36285216347436}. Best is trial 1464 with value: 0.8990825688073395.
[32m[I 2023-04-21 00:15:24,768][39m Trial 3627 finished with value: 0.8347826086956522 and parameters: {'objective': 'Logloss', 'colsample_bylevel': 0.07804849207261645, 'depth': 8, 'boosting_type': 'Plain', 'bootstrap_type': 'Bayesian', 'bagging_temperature': 5.459059479389506}. Best is trial 1464 with value: 0.8990825688073395.
[32m[I 2023-04-21 00:15:26,062][39m Trial 3628 finished with value: 0.8571428571428572 and parameters: {'objective': 'Logloss', 'colsample_bylevel': 0.09446350078413437, 'depth': 9, 'boosting_type': 'Plain', 'bootstrap_type': 'MVS'}. Best is trial 1464 with value: 0.8990825688073395.
[32m[I 2023-04-21 00:15:26,576][39m Trial 3629 finished with value: 0.8468468468468469 and parameters: {'objective': 'CrossEntropy', 'colsample_bylevel': 0.09378316674892165, 'depth': 10, 'boosting_type': 'Plain', 'bootstrap_type': 'Bayesian', 'bagging_temperature': 3.465007989229406}. Best is trial 1464 with value: 0.8990825688073395.
[32m[I 2023-04-21 00:15:27,283][39m Trial 3630 finished with value: 0.8807339449541284 and parameters: {'objective': 'Logloss', 'colsample_bylevel': 0.09352656453179853, 'depth': 10, 'boosting_type': 'Plain', 'bootstrap_type': 'Bayesian', 'bagging_temperature': 6.631968531142913}. Best is trial 1464 with value: 0.8990825688073395.
[32m[I 2023-04-21 00:15:28,158][39m Trial 3631 finished with value: 0.8828828828828829 and parameters: {'objective': 'Logloss', 'colsample_bylevel': 0.095744959989575, 'depth': 7, 'boosting_type': 'Plain', 'bootstrap_type': 'Bayesian', 'bagging_temperature': 6.960162262134622}. Best is trial 1464 with value: 0.8990825688073395.
[32m[I 2023-04-21 00:15:29,053][39m Trial 3632 finished with value: 0.8727272727272727 and parameters: {'objective': 'Logloss', 'colsample_bylevel': 0.09837905873456423, 'depth': 10, 'boosting_type': 'Plain', 'bootstrap_type': 'Bayesian', 'bagging_temperature': 4.666828804750065}. Best is trial 1464 with value: 0.8990825688073395.
[32m[I 2023-04-21 00:15:30,708][39m Trial 3633 finished with value: 0.8648648648648648 and parameters: {'objective': 'CrossEntropy', 'colsample_bylevel': 0.08769643018066342, 'depth': 8, 'boosting_type': 'Plain', 'bootstrap_type': 'Bayesian', 'bagging_temperature': 5.284424789043688}. Best is trial 1464 with value: 0.8990825688073395.
[32m[I 2023-04-21 00:15:31,562][39m Trial 3634 finished with value: 0.8571428571428572 and parameters: {'objective': 'Logloss', 'colsample_bylevel': 0.09720461341125117, 'depth': 7, 'boosting_type': 'Plain', 'bootstrap_type': 'Bayesian', 'bagging_temperature': 3.82247745421785}. Best is trial 1464 with value: 0.8990825688073395.
[32m[I 2023-04-21 00:15:32,633][39m Trial 3635 finished with value: 0.8703703703703703 and parameters: {'objective': 'CrossEntropy', 'colsample_bylevel': 0.09277890586222778, 'depth': 7, 'boosting_type': 'Plain', 'bootstrap_type': 'Bayesian', 'bagging_temperature': 5.4032176553109155}. Best is trial 1464 with value: 0.8990825688073395.
[32m[I 2023-04-21 00:15:33,939][39m Trial 3636 finished with value: 0.7731092436974789 and parameters: {'objective': 'Logloss', 'colsample_bylevel': 0.010334526307879746, 'depth': 9, 'boosting_type': 'Plain', 'bootstrap_type': 'Bayesian', 'bagging_temperature': 5.012474519865715}. Best is trial 1464 with value: 0.8990825688073395.
[32m[I 2023-04-21 00:15:34,886][39m Trial 3637 finished with value: 0.8727272727272727 and parameters: {'objective': 'Logloss', 'colsample_bylevel': 0.09572525738018813, 'depth': 9, 'boosting_type': 'Plain', 'bootstrap_type': 'Bayesian', 'bagging_temperature': 6.589813920616764}. Best is trial 1464 with value: 0.8990825688073395.
[32m[I 2023-04-21 00:15:35,531][39m Trial 3638 finished with value: 0.8275862068965517 and parameters: {'objective': 'Logloss', 'colsample_bylevel': 0.02445334627970164, 'depth': 7, 'boosting_type': 'Plain', 'bootstrap_type': 'Bayesian', 'bagging_temperature': 3.610250142842502}. Best is trial 1464 with value: 0.8990825688073395.
[32m[I 2023-04-21 00:15:40,660][39m Trial 3639 finished with value: 0.8421052631578947 and parameters: {'objective': 'Logloss', 'colsample_bylevel': 0.09280492954237182, 'depth': 9, 'boosting_type': 'Ordered', 'bootstrap_type': 'Bayesian', 'bagging_temperature': 5.085357925736041}. Best is trial 1464 with value: 0.8990825688073395.
[32m[I 2023-04-21 00:15:41,833][39m Trial 3640 finished with value: 0.8727272727272727 and parameters: {'objective': 'Logloss', 'colsample_bylevel': 0.09053275924712524, 'depth': 11, 'boosting_type': 'Plain', 'bootstrap_type': 'Bayesian', 'bagging_temperature': 5.451562926262007}. Best is trial 1464 with value: 0.8990825688073395.
[32m[I 2023-04-21 00:15:42,745][39m Trial 3641 finished with value: 0.888888888888889 and parameters: {'objective': 'CrossEntropy', 'colsample_bylevel': 0.09932207935872313, 'depth': 8, 'boosting_type': 'Plain', 'bootstrap_type': 'Bayesian', 'bagging_temperature': 4.353833227652926}. Best is trial 1464 with value: 0.8990825688073395.
[32m[I 2023-04-21 00:15:43,725][39m Trial 3642 finished with value: 0.8571428571428572 and parameters: {'objective': 'CrossEntropy', 'colsample_bylevel': 0.09834555854281261, 'depth': 8, 'boosting_type': 'Plain', 'bootstrap_type': 'Bayesian', 'bagging_temperature': 5.283337873866405}. Best is trial 1464 with value: 0.8990825688073395.
[32m[I 2023-04-21 00:15:45,250][39m Trial 3643 finished with value: 0.8807339449541284 and parameters: {'objective': 'Logloss', 'colsample_bylevel': 0.09843946176402721, 'depth': 8, 'boosting_type': 'Plain', 'bootstrap_type': 'Bayesian', 'bagging_temperature': 5.897819660561168}. Best is trial 1464 with value: 0.8990825688073395.
[32m[I 2023-04-21 00:15:45,971][39m Trial 3644 finished with value: 0.8703703703703703 and parameters: {'objective': 'Logloss', 'colsample_bylevel': 0.09818060159300725, 'depth': 6, 'boosting_type': 'Plain', 'bootstrap_type': 'Bayesian', 'bagging_temperature': 5.084053061415839}. Best is trial 1464 with value: 0.8990825688073395.
[32m[I 2023-04-21 00:15:46,905][39m Trial 3645 finished with value: 0.8571428571428572 and parameters: {'objective': 'CrossEntropy', 'colsample_bylevel': 0.09857045800033502, 'depth': 8, 'boosting_type': 'Plain', 'bootstrap_type': 'Bernoulli', 'subsample': 0.8725063376081161}. Best is trial 1464 with value: 0.8990825688073395.
[32m[I 2023-04-21 00:15:48,292][39m Trial 3646 finished with value: 0.8495575221238938 and parameters: {'objective': 'Logloss', 'colsample_bylevel': 0.09498399288343219, 'depth': 8, 'boosting_type': 'Plain', 'bootstrap_type': 'MVS'}. Best is trial 1464 with value: 0.8990825688073395.
[32m[I 2023-04-21 00:15:49,816][39m Trial 3647 finished with value: 0.8807339449541284 and parameters: {'objective': 'CrossEntropy', 'colsample_bylevel': 0.09198475279776377, 'depth': 9, 'boosting_type': 'Plain', 'bootstrap_type': 'Bayesian', 'bagging_temperature': 5.737911577295735}. Best is trial 1464 with value: 0.8990825688073395.
[32m[I 2023-04-21 00:15:50,961][39m Trial 3648 finished with value: 0.8703703703703703 and parameters: {'objective': 'Logloss', 'colsample_bylevel': 0.09319251262456013, 'depth': 9, 'boosting_type': 'Plain', 'bootstrap_type': 'Bayesian', 'bagging_temperature': 5.718095576650134}. Best is trial 1464 with value: 0.8990825688073395.
[32m[I 2023-04-21 00:15:51,773][39m Trial 3649 finished with value: 0.8828828828828829 and parameters: {'objective': 'CrossEntropy', 'colsample_bylevel': 0.0876799898872677, 'depth': 9, 'boosting_type': 'Plain', 'bootstrap_type': 'Bayesian', 'bagging_temperature': 5.112836341410758}. Best is trial 1464 with value: 0.8990825688073395.
[32m[I 2023-04-21 00:15:52,782][39m Trial 3650 finished with value: 0.8545454545454546 and parameters: {'objective': 'Logloss', 'colsample_bylevel': 0.09370101557241194, 'depth': 6, 'boosting_type': 'Plain', 'bootstrap_type': 'Bayesian', 'bagging_temperature': 3.9814372093434423}. Best is trial 1464 with value: 0.8990825688073395.
[32m[I 2023-04-21 00:15:55,014][39m Trial 3651 finished with value: 0.8727272727272727 and parameters: {'objective': 'Logloss', 'colsample_bylevel': 0.09750927372820337, 'depth': 9, 'boosting_type': 'Plain', 'bootstrap_type': 'Bayesian', 'bagging_temperature': 6.402323374472604}. Best is trial 1464 with value: 0.8990825688073395.
[32m[I 2023-04-21 00:15:56,007][39m Trial 3652 finished with value: 0.8807339449541284 and parameters: {'objective': 'Logloss', 'colsample_bylevel': 0.09494396241811925, 'depth': 9, 'boosting_type': 'Plain', 'bootstrap_type': 'Bayesian', 'bagging_temperature': 7.219468576207289}. Best is trial 1464 with value: 0.8990825688073395.
[32m[I 2023-04-21 00:15:56,968][39m Trial 3653 finished with value: 0.8807339449541284 and parameters: {'objective': 'CrossEntropy', 'colsample_bylevel': 0.08911409961516363, 'depth': 9, 'boosting_type': 'Plain', 'bootstrap_type': 'Bayesian', 'bagging_temperature': 5.159830996517793}. Best is trial 1464 with value: 0.8990825688073395.
[32m[I 2023-04-21 00:15:57,917][39m Trial 3654 finished with value: 0.8392857142857144 and parameters: {'objective': 'CrossEntropy', 'colsample_bylevel': 0.08465643973467703, 'depth': 9, 'boosting_type': 'Plain', 'bootstrap_type': 'Bayesian', 'bagging_temperature': 5.539383564621028}. Best is trial 1464 with value: 0.8990825688073395.
[32m[I 2023-04-21 00:15:59,119][39m Trial 3655 finished with value: 0.8807339449541284 and parameters: {'objective': 'Logloss', 'colsample_bylevel': 0.09557351564907596, 'depth': 7, 'boosting_type': 'Plain', 'bootstrap_type': 'Bayesian', 'bagging_temperature': 5.85424349289649}. Best is trial 1464 with value: 0.8990825688073395.
[32m[I 2023-04-21 00:16:00,187][39m Trial 3656 finished with value: 0.8807339449541284 and parameters: {'objective': 'Logloss', 'colsample_bylevel': 0.09740847755738076, 'depth': 7, 'boosting_type': 'Plain', 'bootstrap_type': 'Bayesian', 'bagging_temperature': 6.815784344986704}. Best is trial 1464 with value: 0.8990825688073395.
[32m[I 2023-04-21 00:16:05,313][39m Trial 3657 finished with value: 0.8648648648648648 and parameters: {'objective': 'CrossEntropy', 'colsample_bylevel': 0.0970351509362153, 'depth': 9, 'boosting_type': 'Ordered', 'bootstrap_type': 'Bayesian', 'bagging_temperature': 4.602882420503089}. Best is trial 1464 with value: 0.8990825688073395.
[32m[I 2023-04-21 00:16:06,485][39m Trial 3658 finished with value: 0.8623853211009175 and parameters: {'objective': 'CrossEntropy', 'colsample_bylevel': 0.09612931883422664, 'depth': 10, 'boosting_type': 'Plain', 'bootstrap_type': 'Bayesian', 'bagging_temperature': 6.476188214827688}. Best is trial 1464 with value: 0.8990825688073395.
[32m[I 2023-04-21 00:16:08,372][39m Trial 3659 finished with value: 0.8727272727272727 and parameters: {'objective': 'Logloss', 'colsample_bylevel': 0.09707268311464846, 'depth': 8, 'boosting_type': 'Plain', 'bootstrap_type': 'Bayesian', 'bagging_temperature': 4.5430171396419015}. Best is trial 1464 with value: 0.8990825688073395.
[32m[I 2023-04-21 00:16:09,611][39m Trial 3660 finished with value: 0.875 and parameters: {'objective': 'CrossEntropy', 'colsample_bylevel': 0.08942211732935348, 'depth': 10, 'boosting_type': 'Plain', 'bootstrap_type': 'Bayesian', 'bagging_temperature': 4.586482056519697}. Best is trial 1464 with value: 0.8990825688073395.
[32m[I 2023-04-21 00:16:10,356][39m Trial 3661 finished with value: 0.8468468468468469 and parameters: {'objective': 'Logloss', 'colsample_bylevel': 0.08365248514608736, 'depth': 6, 'boosting_type': 'Plain', 'bootstrap_type': 'Bayesian', 'bagging_temperature': 3.532937108879033}. Best is trial 1464 with value: 0.8990825688073395.
[32m[I 2023-04-21 00:16:11,543][39m Trial 3662 finished with value: 0.8648648648648648 and parameters: {'objective': 'Logloss', 'colsample_bylevel': 0.09321090108938303, 'depth': 9, 'boosting_type': 'Plain', 'bootstrap_type': 'Bayesian', 'bagging_temperature': 4.0521575552089715}. Best is trial 1464 with value: 0.8990825688073395.
[32m[I 2023-04-21 00:16:12,837][39m Trial 3663 finished with value: 0.8571428571428572 and parameters: {'objective': 'Logloss', 'colsample_bylevel': 0.08972340590670128, 'depth': 9, 'boosting_type': 'Plain', 'bootstrap_type': 'Bayesian', 'bagging_temperature': 4.707500959493279}. Best is trial 1464 with value: 0.8990825688073395.
[32m[I 2023-04-21 00:16:14,421][39m Trial 3664 finished with value: 0.8571428571428572 and parameters: {'objective': 'Logloss', 'colsample_bylevel': 0.09421728547448682, 'depth': 9, 'boosting_type': 'Plain', 'bootstrap_type': 'Bayesian', 'bagging_temperature': 7.435508007060624}. Best is trial 1464 with value: 0.8990825688073395.
[32m[I 2023-04-21 00:16:15,997][39m Trial 3665 finished with value: 0.8807339449541284 and parameters: {'objective': 'Logloss', 'colsample_bylevel': 0.09245956048435706, 'depth': 9, 'boosting_type': 'Plain', 'bootstrap_type': 'Bayesian', 'bagging_temperature': 4.237391761126829}. Best is trial 1464 with value: 0.8990825688073395.
[32m[I 2023-04-21 00:16:16,841][39m Trial 3666 finished with value: 0.8703703703703703 and parameters: {'objective': 'Logloss', 'colsample_bylevel': 0.09508186433152041, 'depth': 7, 'boosting_type': 'Plain', 'bootstrap_type': 'Bayesian', 'bagging_temperature': 7.188958548335251}. Best is trial 1464 with value: 0.8990825688073395.
[32m[I 2023-04-21 00:16:17,860][39m Trial 3667 finished with value: 0.8672566371681416 and parameters: {'objective': 'Logloss', 'colsample_bylevel': 0.09547217529177383, 'depth': 9, 'boosting_type': 'Plain', 'bootstrap_type': 'Bernoulli', 'subsample': 0.673358516674068}. Best is trial 1464 with value: 0.8990825688073395.
[32m[I 2023-04-21 00:16:18,558][39m Trial 3668 finished with value: 0.8807339449541284 and parameters: {'objective': 'CrossEntropy', 'colsample_bylevel': 0.09017835515035463, 'depth': 11, 'boosting_type': 'Plain', 'bootstrap_type': 'Bayesian', 'bagging_temperature': 5.249066500261465}. Best is trial 1464 with value: 0.8990825688073395.
[32m[I 2023-04-21 00:16:20,039][39m Trial 3669 finished with value: 0.8571428571428572 and parameters: {'objective': 'Logloss', 'colsample_bylevel': 0.09579999310090316, 'depth': 8, 'boosting_type': 'Plain', 'bootstrap_type': 'MVS'}. Best is trial 1464 with value: 0.8990825688073395.
[32m[I 2023-04-21 00:16:21,125][39m Trial 3670 finished with value: 0.8623853211009175 and parameters: {'objective': 'CrossEntropy', 'colsample_bylevel': 0.09982185205837964, 'depth': 10, 'boosting_type': 'Plain', 'bootstrap_type': 'Bayesian', 'bagging_temperature': 6.518132333152281}. Best is trial 1464 with value: 0.8990825688073395.
[32m[I 2023-04-21 00:16:22,301][39m Trial 3671 finished with value: 0.8727272727272727 and parameters: {'objective': 'Logloss', 'colsample_bylevel': 0.09844169370352898, 'depth': 9, 'boosting_type': 'Plain', 'bootstrap_type': 'Bayesian', 'bagging_temperature': 4.876735782294674}. Best is trial 1464 with value: 0.8990825688073395.
[32m[I 2023-04-21 00:16:23,129][39m Trial 3672 finished with value: 0.8828828828828829 and parameters: {'objective': 'CrossEntropy', 'colsample_bylevel': 0.09175358090908561, 'depth': 10, 'boosting_type': 'Plain', 'bootstrap_type': 'Bayesian', 'bagging_temperature': 6.8093810344675285}. Best is trial 1464 with value: 0.8990825688073395.
[32m[I 2023-04-21 00:16:24,004][39m Trial 3673 finished with value: 0.8727272727272727 and parameters: {'objective': 'Logloss', 'colsample_bylevel': 0.09380223397618982, 'depth': 10, 'boosting_type': 'Plain', 'bootstrap_type': 'Bayesian', 'bagging_temperature': 6.322640899349165}. Best is trial 1464 with value: 0.8990825688073395.
[32m[I 2023-04-21 00:16:24,757][39m Trial 3674 finished with value: 0.8828828828828829 and parameters: {'objective': 'Logloss', 'colsample_bylevel': 0.09124736837153137, 'depth': 10, 'boosting_type': 'Plain', 'bootstrap_type': 'Bayesian', 'bagging_temperature': 5.634922109263639}. Best is trial 1464 with value: 0.8990825688073395.
[32m[I 2023-04-21 00:16:26,232][39m Trial 3675 finished with value: 0.8598130841121495 and parameters: {'objective': 'Logloss', 'colsample_bylevel': 0.09378241677696268, 'depth': 9, 'boosting_type': 'Plain', 'bootstrap_type': 'Bayesian', 'bagging_temperature': 6.872386192751426}. Best is trial 1464 with value: 0.8990825688073395.
[32m[I 2023-04-21 00:16:27,494][39m Trial 3676 finished with value: 0.8828828828828829 and parameters: {'objective': 'CrossEntropy', 'colsample_bylevel': 0.08586233089590577, 'depth': 8, 'boosting_type': 'Plain', 'bootstrap_type': 'Bayesian', 'bagging_temperature': 5.242924325582003}. Best is trial 1464 with value: 0.8990825688073395.
[32m[I 2023-04-21 00:16:32,539][39m Trial 3677 finished with value: 0.8495575221238938 and parameters: {'objective': 'Logloss', 'colsample_bylevel': 0.09273486189121152, 'depth': 10, 'boosting_type': 'Ordered', 'bootstrap_type': 'Bayesian', 'bagging_temperature': 6.433743201869269}. Best is trial 1464 with value: 0.8990825688073395.
[32m[I 2023-04-21 00:16:33,708][39m Trial 3678 finished with value: 0.8648648648648648 and parameters: {'objective': 'Logloss', 'colsample_bylevel': 0.09999613973168126, 'depth': 7, 'boosting_type': 'Plain', 'bootstrap_type': 'Bayesian', 'bagging_temperature': 7.349372602791996}. Best is trial 1464 with value: 0.8990825688073395.
[32m[I 2023-04-21 00:16:35,469][39m Trial 3679 finished with value: 0.8727272727272727 and parameters: {'objective': 'Logloss', 'colsample_bylevel': 0.09601414240557005, 'depth': 9, 'boosting_type': 'Plain', 'bootstrap_type': 'Bayesian', 'bagging_temperature': 3.768682169140449}. Best is trial 1464 with value: 0.8990825688073395.
[32m[I 2023-04-21 00:16:36,392][39m Trial 3680 finished with value: 0.8703703703703703 and parameters: {'objective': 'CrossEntropy', 'colsample_bylevel': 0.09183026896181519, 'depth': 9, 'boosting_type': 'Plain', 'bootstrap_type': 'Bayesian', 'bagging_temperature': 5.16646441103485}. Best is trial 1464 with value: 0.8990825688073395.
[32m[I 2023-04-21 00:16:37,260][39m Trial 3681 finished with value: 0.8785046728971961 and parameters: {'objective': 'Logloss', 'colsample_bylevel': 0.09870969257545967, 'depth': 8, 'boosting_type': 'Plain', 'bootstrap_type': 'Bayesian', 'bagging_temperature': 5.4588667659727275}. Best is trial 1464 with value: 0.8990825688073395.
[32m[I 2023-04-21 00:16:38,190][39m Trial 3682 finished with value: 0.8807339449541284 and parameters: {'objective': 'CrossEntropy', 'colsample_bylevel': 0.09838392192514718, 'depth': 7, 'boosting_type': 'Plain', 'bootstrap_type': 'Bayesian', 'bagging_temperature': 7.254165361191263}. Best is trial 1464 with value: 0.8990825688073395.
[32m[I 2023-04-21 00:16:39,083][39m Trial 3683 finished with value: 0.8807339449541284 and parameters: {'objective': 'Logloss', 'colsample_bylevel': 0.09834482263452411, 'depth': 7, 'boosting_type': 'Plain', 'bootstrap_type': 'Bayesian', 'bagging_temperature': 3.338714225216901}. Best is trial 1464 with value: 0.8990825688073395.
[32m[I 2023-04-21 00:16:40,319][39m Trial 3684 finished with value: 0.8807339449541284 and parameters: {'objective': 'Logloss', 'colsample_bylevel': 0.09876548896934782, 'depth': 9, 'boosting_type': 'Plain', 'bootstrap_type': 'Bayesian', 'bagging_temperature': 4.791093963934338}. Best is trial 1464 with value: 0.8990825688073395.
[32m[I 2023-04-21 00:16:41,377][39m Trial 3685 finished with value: 0.8495575221238938 and parameters: {'objective': 'Logloss', 'colsample_bylevel': 0.09612012188457215, 'depth': 10, 'boosting_type': 'Plain', 'bootstrap_type': 'Bernoulli', 'subsample': 0.9653398163665472}. Best is trial 1464 with value: 0.8990825688073395.
[32m[I 2023-04-21 00:16:42,290][39m Trial 3686 finished with value: 0.8807339449541284 and parameters: {'objective': 'Logloss', 'colsample_bylevel': 0.09729073249239066, 'depth': 10, 'boosting_type': 'Plain', 'bootstrap_type': 'Bayesian', 'bagging_temperature': 4.280366547083349}. Best is trial 1464 with value: 0.8990825688073395.
[32m[I 2023-04-21 00:16:43,716][39m Trial 3687 finished with value: 0.8785046728971961 and parameters: {'objective': 'CrossEntropy', 'colsample_bylevel': 0.09493934297748823, 'depth': 11, 'boosting_type': 'Plain', 'bootstrap_type': 'Bayesian', 'bagging_temperature': 6.565490334088506}. Best is trial 1464 with value: 0.8990825688073395.
[32m[I 2023-04-21 00:16:44,787][39m Trial 3688 finished with value: 0.888888888888889 and parameters: {'objective': 'CrossEntropy', 'colsample_bylevel': 0.09301645365863553, 'depth': 8, 'boosting_type': 'Plain', 'bootstrap_type': 'Bayesian', 'bagging_temperature': 5.39464796423948}. Best is trial 1464 with value: 0.8990825688073395.
