[32m[I 2023-04-20 23:40:12,203][39m Trial 2047 finished with value: 0.8727272727272727 and parameters: {'objective': 'CrossEntropy', 'colsample_bylevel': 0.09443889055695355, 'depth': 10, 'boosting_type': 'Plain', 'bootstrap_type': 'Bayesian', 'bagging_temperature': 5.6827049937409315}. Best is trial 1464 with value: 0.8990825688073395.
[32m[I 2023-04-20 23:40:13,268][39m Trial 2048 finished with value: 0.8807339449541284 and parameters: {'objective': 'Logloss', 'colsample_bylevel': 0.09836506961049814, 'depth': 8, 'boosting_type': 'Plain', 'bootstrap_type': 'Bayesian', 'bagging_temperature': 5.697818903107374}. Best is trial 1464 with value: 0.8990825688073395.
[32m[I 2023-04-20 23:40:14,538][39m Trial 2049 finished with value: 0.8727272727272727 and parameters: {'objective': 'Logloss', 'colsample_bylevel': 0.09439312523274923, 'depth': 9, 'boosting_type': 'Plain', 'bootstrap_type': 'Bayesian', 'bagging_temperature': 4.1347490942903455}. Best is trial 1464 with value: 0.8990825688073395.
[32m[I 2023-04-20 23:40:15,369][39m Trial 2050 finished with value: 0.8275862068965517 and parameters: {'objective': 'CrossEntropy', 'colsample_bylevel': 0.027720850031298757, 'depth': 10, 'boosting_type': 'Plain', 'bootstrap_type': 'Bayesian', 'bagging_temperature': 6.822087758069931}. Best is trial 1464 with value: 0.8990825688073395.
[32m[I 2023-04-20 23:40:16,394][39m Trial 2051 finished with value: 0.8727272727272727 and parameters: {'objective': 'CrossEntropy', 'colsample_bylevel': 0.09465157969495488, 'depth': 10, 'boosting_type': 'Plain', 'bootstrap_type': 'Bayesian', 'bagging_temperature': 5.862384295737011}. Best is trial 1464 with value: 0.8990825688073395.
[32m[I 2023-04-20 23:40:17,347][39m Trial 2052 finished with value: 0.8703703703703703 and parameters: {'objective': 'Logloss', 'colsample_bylevel': 0.09656216817723062, 'depth': 8, 'boosting_type': 'Plain', 'bootstrap_type': 'Bayesian', 'bagging_temperature': 6.818896176536938}. Best is trial 1464 with value: 0.8990825688073395.
[32m[I 2023-04-20 23:40:18,297][39m Trial 2053 finished with value: 0.875 and parameters: {'objective': 'Logloss', 'colsample_bylevel': 0.09982105428597857, 'depth': 8, 'boosting_type': 'Plain', 'bootstrap_type': 'Bernoulli', 'subsample': 0.5767378497652759}. Best is trial 1464 with value: 0.8990825688073395.
[32m[I 2023-04-20 23:40:19,385][39m Trial 2054 finished with value: 0.8571428571428572 and parameters: {'objective': 'CrossEntropy', 'colsample_bylevel': 0.09253776681343816, 'depth': 9, 'boosting_type': 'Plain', 'bootstrap_type': 'Bayesian', 'bagging_temperature': 4.793861840865563}. Best is trial 1464 with value: 0.8990825688073395.
[32m[I 2023-04-20 23:40:20,745][39m Trial 2055 finished with value: 0.8807339449541284 and parameters: {'objective': 'CrossEntropy', 'colsample_bylevel': 0.09358322011294228, 'depth': 11, 'boosting_type': 'Plain', 'bootstrap_type': 'Bayesian', 'bagging_temperature': 5.761516209686201}. Best is trial 1464 with value: 0.8990825688073395.
[32m[I 2023-04-20 23:40:21,798][39m Trial 2056 finished with value: 0.8807339449541284 and parameters: {'objective': 'CrossEntropy', 'colsample_bylevel': 0.09194788110798927, 'depth': 9, 'boosting_type': 'Plain', 'bootstrap_type': 'Bayesian', 'bagging_temperature': 5.966583808287613}. Best is trial 1464 with value: 0.8990825688073395.
[32m[I 2023-04-20 23:40:22,465][39m Trial 2057 finished with value: 0.875 and parameters: {'objective': 'Logloss', 'colsample_bylevel': 0.09799992925605477, 'depth': 8, 'boosting_type': 'Plain', 'bootstrap_type': 'Bayesian', 'bagging_temperature': 3.4362661387019418}. Best is trial 1464 with value: 0.8990825688073395.
[32m[I 2023-04-20 23:40:27,516][39m Trial 2058 finished with value: 0.8495575221238938 and parameters: {'objective': 'CrossEntropy', 'colsample_bylevel': 0.08714652635774471, 'depth': 10, 'boosting_type': 'Ordered', 'bootstrap_type': 'Bayesian', 'bagging_temperature': 5.718754591965884}. Best is trial 1464 with value: 0.8990825688073395.
[32m[I 2023-04-20 23:40:28,533][39m Trial 2059 finished with value: 0.8648648648648648 and parameters: {'objective': 'CrossEntropy', 'colsample_bylevel': 0.09397099672789105, 'depth': 11, 'boosting_type': 'Plain', 'bootstrap_type': 'Bernoulli', 'subsample': 0.15938097256367767}. Best is trial 1464 with value: 0.8990825688073395.
[32m[I 2023-04-20 23:40:29,601][39m Trial 2060 finished with value: 0.8727272727272727 and parameters: {'objective': 'Logloss', 'colsample_bylevel': 0.0982051852324534, 'depth': 8, 'boosting_type': 'Plain', 'bootstrap_type': 'Bayesian', 'bagging_temperature': 3.9802899541681365}. Best is trial 1464 with value: 0.8990825688073395.
[32m[I 2023-04-20 23:40:30,529][39m Trial 2061 finished with value: 0.8305084745762712 and parameters: {'objective': 'CrossEntropy', 'colsample_bylevel': 0.039428784065751316, 'depth': 10, 'boosting_type': 'Plain', 'bootstrap_type': 'Bernoulli', 'subsample': 0.24081443945362024}. Best is trial 1464 with value: 0.8990825688073395.
[32m[I 2023-04-20 23:40:31,761][39m Trial 2062 finished with value: 0.8727272727272727 and parameters: {'objective': 'CrossEntropy', 'colsample_bylevel': 0.0964472631435732, 'depth': 9, 'boosting_type': 'Plain', 'bootstrap_type': 'Bernoulli', 'subsample': 0.3571316987426118}. Best is trial 1464 with value: 0.8990825688073395.
[32m[I 2023-04-20 23:40:32,839][39m Trial 2063 finished with value: 0.8571428571428572 and parameters: {'objective': 'CrossEntropy', 'colsample_bylevel': 0.0894107695492706, 'depth': 5, 'boosting_type': 'Plain', 'bootstrap_type': 'Bayesian', 'bagging_temperature': 5.079669830755076}. Best is trial 1464 with value: 0.8990825688073395.
[32m[I 2023-04-20 23:40:34,168][39m Trial 2064 finished with value: 0.8703703703703703 and parameters: {'objective': 'CrossEntropy', 'colsample_bylevel': 0.08205943784431924, 'depth': 10, 'boosting_type': 'Plain', 'bootstrap_type': 'Bayesian', 'bagging_temperature': 5.922836235221281}. Best is trial 1464 with value: 0.8990825688073395.
[32m[I 2023-04-20 23:40:35,508][39m Trial 2065 finished with value: 0.888888888888889 and parameters: {'objective': 'Logloss', 'colsample_bylevel': 0.09563154794110434, 'depth': 12, 'boosting_type': 'Plain', 'bootstrap_type': 'Bayesian', 'bagging_temperature': 5.067709954965861}. Best is trial 1464 with value: 0.8990825688073395.
[32m[I 2023-04-20 23:40:36,682][39m Trial 2066 finished with value: 0.8828828828828829 and parameters: {'objective': 'Logloss', 'colsample_bylevel': 0.09647772507222054, 'depth': 9, 'boosting_type': 'Plain', 'bootstrap_type': 'Bayesian', 'bagging_temperature': 7.681494331088799}. Best is trial 1464 with value: 0.8990825688073395.
[32m[I 2023-04-20 23:40:37,368][39m Trial 2067 finished with value: 0.8727272727272727 and parameters: {'objective': 'Logloss', 'colsample_bylevel': 0.09236073540287035, 'depth': 5, 'boosting_type': 'Plain', 'bootstrap_type': 'Bayesian', 'bagging_temperature': 5.354896433735246}. Best is trial 1464 with value: 0.8990825688073395.
[32m[I 2023-04-20 23:40:38,265][39m Trial 2068 finished with value: 0.8347826086956522 and parameters: {'objective': 'CrossEntropy', 'colsample_bylevel': 0.09001279193664606, 'depth': 3, 'boosting_type': 'Plain', 'bootstrap_type': 'MVS'}. Best is trial 1464 with value: 0.8990825688073395.
[32m[I 2023-04-20 23:40:39,595][39m Trial 2069 finished with value: 0.8807339449541284 and parameters: {'objective': 'CrossEntropy', 'colsample_bylevel': 0.09992958920503223, 'depth': 8, 'boosting_type': 'Plain', 'bootstrap_type': 'Bayesian', 'bagging_temperature': 6.279661547332132}. Best is trial 1464 with value: 0.8990825688073395.
[32m[I 2023-04-20 23:40:40,729][39m Trial 2070 finished with value: 0.8545454545454546 and parameters: {'objective': 'CrossEntropy', 'colsample_bylevel': 0.08753336456886769, 'depth': 6, 'boosting_type': 'Plain', 'bootstrap_type': 'Bayesian', 'bagging_temperature': 4.900886386118135}. Best is trial 1464 with value: 0.8990825688073395.
[32m[I 2023-04-20 23:40:41,645][39m Trial 2071 finished with value: 0.8807339449541284 and parameters: {'objective': 'CrossEntropy', 'colsample_bylevel': 0.09561205272853371, 'depth': 10, 'boosting_type': 'Plain', 'bootstrap_type': 'Bayesian', 'bagging_temperature': 6.586263980677408}. Best is trial 1464 with value: 0.8990825688073395.
[32m[I 2023-04-20 23:40:42,676][39m Trial 2072 finished with value: 0.8703703703703703 and parameters: {'objective': 'Logloss', 'colsample_bylevel': 0.09282000805181538, 'depth': 10, 'boosting_type': 'Plain', 'bootstrap_type': 'Bayesian', 'bagging_temperature': 5.985545670682622}. Best is trial 1464 with value: 0.8990825688073395.
[32m[I 2023-04-20 23:40:43,407][39m Trial 2073 finished with value: 0.875 and parameters: {'objective': 'Logloss', 'colsample_bylevel': 0.0706129752287916, 'depth': 8, 'boosting_type': 'Plain', 'bootstrap_type': 'Bayesian', 'bagging_temperature': 6.005041478637024}. Best is trial 1464 with value: 0.8990825688073395.
[32m[I 2023-04-20 23:40:44,442][39m Trial 2074 finished with value: 0.8727272727272727 and parameters: {'objective': 'Logloss', 'colsample_bylevel': 0.09127768280990832, 'depth': 11, 'boosting_type': 'Plain', 'bootstrap_type': 'Bayesian', 'bagging_temperature': 6.11384260372264}. Best is trial 1464 with value: 0.8990825688073395.
[32m[I 2023-04-20 23:40:49,591][39m Trial 2075 finished with value: 0.8495575221238938 and parameters: {'objective': 'Logloss', 'colsample_bylevel': 0.09535972681572087, 'depth': 7, 'boosting_type': 'Ordered', 'bootstrap_type': 'Bayesian', 'bagging_temperature': 4.04754230471576}. Best is trial 1464 with value: 0.8990825688073395.
[32m[I 2023-04-20 23:40:50,404][39m Trial 2076 finished with value: 0.8468468468468469 and parameters: {'objective': 'CrossEntropy', 'colsample_bylevel': 0.08859280181185761, 'depth': 10, 'boosting_type': 'Plain', 'bootstrap_type': 'MVS'}. Best is trial 1464 with value: 0.8990825688073395.
[32m[I 2023-04-20 23:40:51,302][39m Trial 2077 finished with value: 0.8807339449541284 and parameters: {'objective': 'Logloss', 'colsample_bylevel': 0.0986834009902514, 'depth': 10, 'boosting_type': 'Plain', 'bootstrap_type': 'Bayesian', 'bagging_temperature': 3.963723153757328}. Best is trial 1464 with value: 0.8990825688073395.
[32m[I 2023-04-20 23:40:52,317][39m Trial 2078 finished with value: 0.8623853211009175 and parameters: {'objective': 'CrossEntropy', 'colsample_bylevel': 0.08639771415979564, 'depth': 12, 'boosting_type': 'Plain', 'bootstrap_type': 'Bayesian', 'bagging_temperature': 5.016717888567011}. Best is trial 1464 with value: 0.8990825688073395.
[32m[I 2023-04-20 23:40:53,199][39m Trial 2079 finished with value: 0.8623853211009175 and parameters: {'objective': 'CrossEntropy', 'colsample_bylevel': 0.09421562193468896, 'depth': 11, 'boosting_type': 'Plain', 'bootstrap_type': 'Bernoulli', 'subsample': 0.19378027794213054}. Best is trial 1464 with value: 0.8990825688073395.
[32m[I 2023-04-20 23:40:54,108][39m Trial 2080 finished with value: 0.8275862068965517 and parameters: {'objective': 'CrossEntropy', 'colsample_bylevel': 0.0645995706884555, 'depth': 10, 'boosting_type': 'Plain', 'bootstrap_type': 'Bayesian', 'bagging_temperature': 6.180993913490163}. Best is trial 1464 with value: 0.8990825688073395.
[32m[I 2023-04-20 23:40:55,175][39m Trial 2081 finished with value: 0.875 and parameters: {'objective': 'CrossEntropy', 'colsample_bylevel': 0.0865613110832762, 'depth': 11, 'boosting_type': 'Plain', 'bootstrap_type': 'Bayesian', 'bagging_temperature': 5.220169283267577}. Best is trial 1464 with value: 0.8990825688073395.
[32m[I 2023-04-20 23:40:56,391][39m Trial 2082 finished with value: 0.8648648648648648 and parameters: {'objective': 'CrossEntropy', 'colsample_bylevel': 0.09850598707739507, 'depth': 8, 'boosting_type': 'Plain', 'bootstrap_type': 'Bayesian', 'bagging_temperature': 4.864460594116011}. Best is trial 1464 with value: 0.8990825688073395.
[32m[I 2023-04-20 23:40:57,297][39m Trial 2083 finished with value: 0.8807339449541284 and parameters: {'objective': 'Logloss', 'colsample_bylevel': 0.09656421061582832, 'depth': 8, 'boosting_type': 'Plain', 'bootstrap_type': 'Bayesian', 'bagging_temperature': 4.988137115464176}. Best is trial 1464 with value: 0.8990825688073395.
[32m[I 2023-04-20 23:40:58,184][39m Trial 2084 finished with value: 0.8623853211009175 and parameters: {'objective': 'CrossEntropy', 'colsample_bylevel': 0.09857688140743978, 'depth': 9, 'boosting_type': 'Plain', 'bootstrap_type': 'Bayesian', 'bagging_temperature': 4.525273399567793}. Best is trial 1464 with value: 0.8990825688073395.
[32m[I 2023-04-20 23:40:59,157][39m Trial 2085 finished with value: 0.8807339449541284 and parameters: {'objective': 'CrossEntropy', 'colsample_bylevel': 0.09676383590208347, 'depth': 9, 'boosting_type': 'Plain', 'bootstrap_type': 'Bayesian', 'bagging_temperature': 4.76061405606738}. Best is trial 1464 with value: 0.8990825688073395.
[32m[I 2023-04-20 23:41:00,382][39m Trial 2086 finished with value: 0.8205128205128206 and parameters: {'objective': 'CrossEntropy', 'colsample_bylevel': 0.05709301028235591, 'depth': 8, 'boosting_type': 'Plain', 'bootstrap_type': 'Bayesian', 'bagging_temperature': 3.244312478654912}. Best is trial 1464 with value: 0.8990825688073395.
[32m[I 2023-04-20 23:41:01,843][39m Trial 2087 finished with value: 0.8807339449541284 and parameters: {'objective': 'Logloss', 'colsample_bylevel': 0.09581925837938488, 'depth': 9, 'boosting_type': 'Plain', 'bootstrap_type': 'Bayesian', 'bagging_temperature': 4.513263412778194}. Best is trial 1464 with value: 0.8990825688073395.
[32m[I 2023-04-20 23:41:02,901][39m Trial 2088 finished with value: 0.888888888888889 and parameters: {'objective': 'CrossEntropy', 'colsample_bylevel': 0.09089720425334384, 'depth': 11, 'boosting_type': 'Plain', 'bootstrap_type': 'Bayesian', 'bagging_temperature': 7.189844189138853}. Best is trial 1464 with value: 0.8990825688073395.
[32m[I 2023-04-20 23:41:03,742][39m Trial 2089 finished with value: 0.8571428571428572 and parameters: {'objective': 'Logloss', 'colsample_bylevel': 0.08907267895272333, 'depth': 9, 'boosting_type': 'Plain', 'bootstrap_type': 'Bayesian', 'bagging_temperature': 5.7605782418802605}. Best is trial 1464 with value: 0.8990825688073395.
[32m[I 2023-04-20 23:41:04,403][39m Trial 2090 finished with value: 0.888888888888889 and parameters: {'objective': 'Logloss', 'colsample_bylevel': 0.09326602852564221, 'depth': 10, 'boosting_type': 'Plain', 'bootstrap_type': 'Bayesian', 'bagging_temperature': 7.228802806912531}. Best is trial 1464 with value: 0.8990825688073395.
[32m[I 2023-04-20 23:41:05,108][39m Trial 2091 finished with value: 0.8727272727272727 and parameters: {'objective': 'CrossEntropy', 'colsample_bylevel': 0.09024657591163217, 'depth': 10, 'boosting_type': 'Plain', 'bootstrap_type': 'Bayesian', 'bagging_temperature': 7.850044177549455}. Best is trial 1464 with value: 0.8990825688073395.
[32m[I 2023-04-20 23:41:06,337][39m Trial 2092 finished with value: 0.8571428571428572 and parameters: {'objective': 'Logloss', 'colsample_bylevel': 0.09427599325715294, 'depth': 10, 'boosting_type': 'Plain', 'bootstrap_type': 'Bernoulli', 'subsample': 0.39329745126258264}. Best is trial 1464 with value: 0.8990825688073395.
[32m[I 2023-04-20 23:41:07,251][39m Trial 2093 finished with value: 0.8305084745762712 and parameters: {'objective': 'Logloss', 'colsample_bylevel': 0.041940264379443204, 'depth': 8, 'boosting_type': 'Plain', 'bootstrap_type': 'Bernoulli', 'subsample': 0.9234175535146876}. Best is trial 1464 with value: 0.8990825688073395.
[32m[I 2023-04-20 23:41:08,649][39m Trial 2094 finished with value: 0.888888888888889 and parameters: {'objective': 'Logloss', 'colsample_bylevel': 0.0982558576294502, 'depth': 8, 'boosting_type': 'Plain', 'bootstrap_type': 'Bayesian', 'bagging_temperature': 6.465347030198789}. Best is trial 1464 with value: 0.8990825688073395.
[32m[I 2023-04-20 23:41:13,441][39m Trial 2095 finished with value: 0.8571428571428572 and parameters: {'objective': 'Logloss', 'colsample_bylevel': 0.09792961965054135, 'depth': 8, 'boosting_type': 'Ordered', 'bootstrap_type': 'Bayesian', 'bagging_temperature': 5.523930633426972}. Best is trial 1464 with value: 0.8990825688073395.
[32m[I 2023-04-20 23:41:14,603][39m Trial 2096 finished with value: 0.8807339449541284 and parameters: {'objective': 'CrossEntropy', 'colsample_bylevel': 0.096381913543651, 'depth': 9, 'boosting_type': 'Plain', 'bootstrap_type': 'Bayesian', 'bagging_temperature': 6.341440975851788}. Best is trial 1464 with value: 0.8990825688073395.
[32m[I 2023-04-20 23:41:15,663][39m Trial 2097 finished with value: 0.8623853211009175 and parameters: {'objective': 'Logloss', 'colsample_bylevel': 0.09295797330832789, 'depth': 12, 'boosting_type': 'Plain', 'bootstrap_type': 'Bayesian', 'bagging_temperature': 5.143574048721895}. Best is trial 1464 with value: 0.8990825688073395.
[32m[I 2023-04-20 23:41:17,060][39m Trial 2098 finished with value: 0.888888888888889 and parameters: {'objective': 'CrossEntropy', 'colsample_bylevel': 0.0969237641035289, 'depth': 9, 'boosting_type': 'Plain', 'bootstrap_type': 'Bayesian', 'bagging_temperature': 4.779045448040238}. Best is trial 1464 with value: 0.8990825688073395.
[32m[I 2023-04-20 23:41:17,786][39m Trial 2099 finished with value: 0.8495575221238938 and parameters: {'objective': 'CrossEntropy', 'colsample_bylevel': 0.09246926847038765, 'depth': 11, 'boosting_type': 'Plain', 'bootstrap_type': 'Bernoulli', 'subsample': 0.5223358103199428}. Best is trial 1464 with value: 0.8990825688073395.
[32m[I 2023-04-20 23:41:18,322][39m Trial 2100 finished with value: 0.875 and parameters: {'objective': 'CrossEntropy', 'colsample_bylevel': 0.091467063116903, 'depth': 6, 'boosting_type': 'Plain', 'bootstrap_type': 'Bayesian', 'bagging_temperature': 6.128780709197959}. Best is trial 1464 with value: 0.8990825688073395.
[32m[I 2023-04-20 23:41:19,043][39m Trial 2101 finished with value: 0.8623853211009175 and parameters: {'objective': 'CrossEntropy', 'colsample_bylevel': 0.09241839823265366, 'depth': 10, 'boosting_type': 'Plain', 'bootstrap_type': 'Bayesian', 'bagging_temperature': 5.608002555965642}. Best is trial 1464 with value: 0.8990825688073395.
[32m[I 2023-04-20 23:41:19,833][39m Trial 2102 finished with value: 0.8703703703703703 and parameters: {'objective': 'CrossEntropy', 'colsample_bylevel': 0.0940837186319747, 'depth': 7, 'boosting_type': 'Plain', 'bootstrap_type': 'Bayesian', 'bagging_temperature': 7.3771377800512425}. Best is trial 1464 with value: 0.8990825688073395.
[32m[I 2023-04-20 23:41:20,805][39m Trial 2103 finished with value: 0.8807339449541284 and parameters: {'objective': 'Logloss', 'colsample_bylevel': 0.09329701485195843, 'depth': 10, 'boosting_type': 'Plain', 'bootstrap_type': 'Bayesian', 'bagging_temperature': 7.387284937895266}. Best is trial 1464 with value: 0.8990825688073395.
[32m[I 2023-04-20 23:41:21,982][39m Trial 2104 finished with value: 0.8807339449541284 and parameters: {'objective': 'Logloss', 'colsample_bylevel': 0.09217085066024924, 'depth': 11, 'boosting_type': 'Plain', 'bootstrap_type': 'Bayesian', 'bagging_temperature': 6.200531085143979}. Best is trial 1464 with value: 0.8990825688073395.
[32m[I 2023-04-20 23:41:23,208][39m Trial 2105 finished with value: 0.8727272727272727 and parameters: {'objective': 'CrossEntropy', 'colsample_bylevel': 0.09052485269482108, 'depth': 12, 'boosting_type': 'Plain', 'bootstrap_type': 'Bayesian', 'bagging_temperature': 7.180413878571483}. Best is trial 1464 with value: 0.8990825688073395.
[32m[I 2023-04-20 23:41:24,332][39m Trial 2106 finished with value: 0.8727272727272727 and parameters: {'objective': 'CrossEntropy', 'colsample_bylevel': 0.09452437182802277, 'depth': 10, 'boosting_type': 'Plain', 'bootstrap_type': 'Bayesian', 'bagging_temperature': 4.2462732650243025}. Best is trial 1464 with value: 0.8990825688073395.
[32m[I 2023-04-20 23:41:24,890][39m Trial 2107 finished with value: 0.8727272727272727 and parameters: {'objective': 'CrossEntropy', 'colsample_bylevel': 0.0947753655286859, 'depth': 10, 'boosting_type': 'Plain', 'bootstrap_type': 'Bayesian', 'bagging_temperature': 6.701703042276479}. Best is trial 1464 with value: 0.8990825688073395.
[32m[I 2023-04-20 23:41:25,588][39m Trial 2108 finished with value: 0.8571428571428572 and parameters: {'objective': 'CrossEntropy', 'colsample_bylevel': 0.09484113525390948, 'depth': 7, 'boosting_type': 'Plain', 'bootstrap_type': 'Bernoulli', 'subsample': 0.8138817479699134}. Best is trial 1464 with value: 0.8990825688073395.
[32m[I 2023-04-20 23:41:26,561][39m Trial 2109 finished with value: 0.8376068376068375 and parameters: {'objective': 'CrossEntropy', 'colsample_bylevel': 0.04606436697518968, 'depth': 10, 'boosting_type': 'Plain', 'bootstrap_type': 'Bayesian', 'bagging_temperature': 6.8240537376055475}. Best is trial 1464 with value: 0.8990825688073395.
[32m[I 2023-04-20 23:41:27,424][39m Trial 2110 finished with value: 0.8727272727272727 and parameters: {'objective': 'Logloss', 'colsample_bylevel': 0.09842407773614992, 'depth': 12, 'boosting_type': 'Plain', 'bootstrap_type': 'Bayesian', 'bagging_temperature': 6.961994654190573}. Best is trial 1464 with value: 0.8990825688073395.
[32m[I 2023-04-20 23:41:28,309][39m Trial 2111 finished with value: 0.8703703703703703 and parameters: {'objective': 'CrossEntropy', 'colsample_bylevel': 0.09696548104622786, 'depth': 8, 'boosting_type': 'Plain', 'bootstrap_type': 'Bayesian', 'bagging_temperature': 5.436627830212578}. Best is trial 1464 with value: 0.8990825688073395.
