[32m[I 2023-04-21 01:02:53,583][39m Trial 5722 finished with value: 0.8421052631578947 and parameters: {'objective': 'CrossEntropy', 'colsample_bylevel': 0.08235995005352315, 'depth': 12, 'boosting_type': 'Plain', 'bootstrap_type': 'MVS'}. Best is trial 1464 with value: 0.8990825688073395.
[32m[I 2023-04-21 01:02:55,602][39m Trial 5723 finished with value: 0.8807339449541284 and parameters: {'objective': 'Logloss', 'colsample_bylevel': 0.09020521417310073, 'depth': 9, 'boosting_type': 'Plain', 'bootstrap_type': 'Bayesian', 'bagging_temperature': 4.935531789650107}. Best is trial 1464 with value: 0.8990825688073395.
[32m[I 2023-04-21 01:02:56,337][39m Trial 5724 finished with value: 0.8828828828828829 and parameters: {'objective': 'CrossEntropy', 'colsample_bylevel': 0.09465075360705157, 'depth': 10, 'boosting_type': 'Plain', 'bootstrap_type': 'Bayesian', 'bagging_temperature': 5.902257224393418}. Best is trial 1464 with value: 0.8990825688073395.
[32m[I 2023-04-21 01:02:57,271][39m Trial 5725 finished with value: 0.888888888888889 and parameters: {'objective': 'CrossEntropy', 'colsample_bylevel': 0.08782350288634005, 'depth': 11, 'boosting_type': 'Plain', 'bootstrap_type': 'Bayesian', 'bagging_temperature': 4.727242436795122}. Best is trial 1464 with value: 0.8990825688073395.
[32m[I 2023-04-21 01:02:59,043][39m Trial 5726 finished with value: 0.8648648648648648 and parameters: {'objective': 'Logloss', 'colsample_bylevel': 0.09561609884685222, 'depth': 9, 'boosting_type': 'Plain', 'bootstrap_type': 'Bayesian', 'bagging_temperature': 5.0670879441364844}. Best is trial 1464 with value: 0.8990825688073395.
[32m[I 2023-04-21 01:03:00,214][39m Trial 5727 finished with value: 0.8807339449541284 and parameters: {'objective': 'Logloss', 'colsample_bylevel': 0.09440820205740252, 'depth': 9, 'boosting_type': 'Plain', 'bootstrap_type': 'Bayesian', 'bagging_temperature': 7.137041119081163}. Best is trial 1464 with value: 0.8990825688073395.
[32m[I 2023-04-21 01:03:01,551][39m Trial 5728 finished with value: 0.8571428571428572 and parameters: {'objective': 'CrossEntropy', 'colsample_bylevel': 0.0895958470731301, 'depth': 12, 'boosting_type': 'Plain', 'bootstrap_type': 'Bayesian', 'bagging_temperature': 4.45486925286564}. Best is trial 1464 with value: 0.8990825688073395.
[32m[I 2023-04-21 01:03:02,971][39m Trial 5729 finished with value: 0.8727272727272727 and parameters: {'objective': 'CrossEntropy', 'colsample_bylevel': 0.09979744072673602, 'depth': 8, 'boosting_type': 'Plain', 'bootstrap_type': 'Bayesian', 'bagging_temperature': 4.451623146858313}. Best is trial 1464 with value: 0.8990825688073395.
[32m[I 2023-04-21 01:03:03,947][39m Trial 5730 finished with value: 0.8828828828828829 and parameters: {'objective': 'Logloss', 'colsample_bylevel': 0.08971277543217153, 'depth': 11, 'boosting_type': 'Plain', 'bootstrap_type': 'Bayesian', 'bagging_temperature': 5.299530678980841}. Best is trial 1464 with value: 0.8990825688073395.
[32m[I 2023-04-21 01:03:04,637][39m Trial 5731 finished with value: 0.8521739130434783 and parameters: {'objective': 'Logloss', 'colsample_bylevel': 0.0640123609186113, 'depth': 12, 'boosting_type': 'Plain', 'bootstrap_type': 'Bayesian', 'bagging_temperature': 5.317000034153525}. Best is trial 1464 with value: 0.8990825688073395.
[32m[I 2023-04-21 01:03:05,605][39m Trial 5732 finished with value: 0.8807339449541284 and parameters: {'objective': 'Logloss', 'colsample_bylevel': 0.09457682410173603, 'depth': 9, 'boosting_type': 'Plain', 'bootstrap_type': 'Bayesian', 'bagging_temperature': 4.665749105068958}. Best is trial 1464 with value: 0.8990825688073395.
[32m[I 2023-04-21 01:03:07,146][39m Trial 5733 finished with value: 0.8596491228070176 and parameters: {'objective': 'Logloss', 'colsample_bylevel': 0.0936318239044278, 'depth': 8, 'boosting_type': 'Plain', 'bootstrap_type': 'Bayesian', 'bagging_temperature': 5.153188962390198}. Best is trial 1464 with value: 0.8990825688073395.
[32m[I 2023-04-21 01:03:08,702][39m Trial 5734 finished with value: 0.8727272727272727 and parameters: {'objective': 'CrossEntropy', 'colsample_bylevel': 0.09016318586281682, 'depth': 11, 'boosting_type': 'Plain', 'bootstrap_type': 'Bayesian', 'bagging_temperature': 4.277174322526593}. Best is trial 1464 with value: 0.8990825688073395.
[32m[I 2023-04-21 01:03:09,838][39m Trial 5735 finished with value: 0.8596491228070176 and parameters: {'objective': 'Logloss', 'colsample_bylevel': 0.09661224896078763, 'depth': 6, 'boosting_type': 'Plain', 'bootstrap_type': 'Bayesian', 'bagging_temperature': 2.998056856433804}. Best is trial 1464 with value: 0.8990825688073395.
[32m[I 2023-04-21 01:03:10,867][39m Trial 5736 finished with value: 0.8727272727272727 and parameters: {'objective': 'Logloss', 'colsample_bylevel': 0.09637356082284067, 'depth': 10, 'boosting_type': 'Plain', 'bootstrap_type': 'Bayesian', 'bagging_temperature': 6.878920225314362}. Best is trial 1464 with value: 0.8990825688073395.
[32m[I 2023-04-21 01:03:11,917][39m Trial 5737 finished with value: 0.8727272727272727 and parameters: {'objective': 'Logloss', 'colsample_bylevel': 0.09991471264743229, 'depth': 9, 'boosting_type': 'Plain', 'bootstrap_type': 'Bayesian', 'bagging_temperature': 6.754370719510742}. Best is trial 1464 with value: 0.8990825688073395.
[32m[I 2023-04-21 01:03:13,268][39m Trial 5738 finished with value: 0.8807339449541284 and parameters: {'objective': 'CrossEntropy', 'colsample_bylevel': 0.09388031558667193, 'depth': 12, 'boosting_type': 'Plain', 'bootstrap_type': 'Bayesian', 'bagging_temperature': 6.515197170696563}. Best is trial 1464 with value: 0.8990825688073395.
[32m[I 2023-04-21 01:03:14,695][39m Trial 5739 finished with value: 0.8596491228070176 and parameters: {'objective': 'CrossEntropy', 'colsample_bylevel': 0.08685244212520633, 'depth': 12, 'boosting_type': 'Plain', 'bootstrap_type': 'Bayesian', 'bagging_temperature': 3.1134405145251844}. Best is trial 1464 with value: 0.8990825688073395.
[32m[I 2023-04-21 01:03:18,944][39m Trial 5740 finished with value: 0.8571428571428572 and parameters: {'objective': 'Logloss', 'colsample_bylevel': 0.0978214333715266, 'depth': 12, 'boosting_type': 'Ordered', 'bootstrap_type': 'Bernoulli', 'subsample': 0.9392042970686616}. Best is trial 1464 with value: 0.8990825688073395.
[32m[I 2023-04-21 01:03:20,468][39m Trial 5741 finished with value: 0.8571428571428572 and parameters: {'objective': 'Logloss', 'colsample_bylevel': 0.09479945534895774, 'depth': 9, 'boosting_type': 'Plain', 'bootstrap_type': 'Bayesian', 'bagging_temperature': 0.6269050986165627}. Best is trial 1464 with value: 0.8990825688073395.
[32m[I 2023-04-21 01:03:22,025][39m Trial 5742 finished with value: 0.8727272727272727 and parameters: {'objective': 'CrossEntropy', 'colsample_bylevel': 0.09011980543917893, 'depth': 11, 'boosting_type': 'Plain', 'bootstrap_type': 'Bayesian', 'bagging_temperature': 4.753152050257386}. Best is trial 1464 with value: 0.8990825688073395.
[32m[I 2023-04-21 01:03:22,775][39m Trial 5743 finished with value: 0.8672566371681416 and parameters: {'objective': 'Logloss', 'colsample_bylevel': 0.0849387438157908, 'depth': 12, 'boosting_type': 'Plain', 'bootstrap_type': 'Bayesian', 'bagging_temperature': 4.832822144281005}. Best is trial 1464 with value: 0.8990825688073395.
[32m[I 2023-04-21 01:03:24,386][39m Trial 5744 finished with value: 0.8521739130434783 and parameters: {'objective': 'CrossEntropy', 'colsample_bylevel': 0.09102353205914221, 'depth': 9, 'boosting_type': 'Plain', 'bootstrap_type': 'MVS'}. Best is trial 1464 with value: 0.8990825688073395.
[32m[I 2023-04-21 01:03:25,255][39m Trial 5745 finished with value: 0.8727272727272727 and parameters: {'objective': 'CrossEntropy', 'colsample_bylevel': 0.09582756981259541, 'depth': 8, 'boosting_type': 'Plain', 'bootstrap_type': 'Bayesian', 'bagging_temperature': 6.154095062715692}. Best is trial 1464 with value: 0.8990825688073395.
[32m[I 2023-04-21 01:03:26,057][39m Trial 5746 finished with value: 0.8807339449541284 and parameters: {'objective': 'CrossEntropy', 'colsample_bylevel': 0.0890083003380226, 'depth': 11, 'boosting_type': 'Plain', 'bootstrap_type': 'Bayesian', 'bagging_temperature': 4.821570232949853}. Best is trial 1464 with value: 0.8990825688073395.
[32m[I 2023-04-21 01:03:27,867][39m Trial 5747 finished with value: 0.8807339449541284 and parameters: {'objective': 'Logloss', 'colsample_bylevel': 0.09552002484750739, 'depth': 11, 'boosting_type': 'Plain', 'bootstrap_type': 'Bayesian', 'bagging_temperature': 4.262665944599292}. Best is trial 1464 with value: 0.8990825688073395.
[32m[I 2023-04-21 01:03:29,479][39m Trial 5748 finished with value: 0.8807339449541284 and parameters: {'objective': 'Logloss', 'colsample_bylevel': 0.09291903041381148, 'depth': 8, 'boosting_type': 'Plain', 'bootstrap_type': 'Bayesian', 'bagging_temperature': 6.690408119670122}. Best is trial 1464 with value: 0.8990825688073395.
[32m[I 2023-04-21 01:03:30,245][39m Trial 5749 finished with value: 0.8727272727272727 and parameters: {'objective': 'Logloss', 'colsample_bylevel': 0.09106726916367414, 'depth': 12, 'boosting_type': 'Plain', 'bootstrap_type': 'Bayesian', 'bagging_temperature': 5.516420767669244}. Best is trial 1464 with value: 0.8990825688073395.
[32m[I 2023-04-21 01:03:31,558][39m Trial 5750 finished with value: 0.8807339449541284 and parameters: {'objective': 'Logloss', 'colsample_bylevel': 0.09665328976052305, 'depth': 9, 'boosting_type': 'Plain', 'bootstrap_type': 'Bayesian', 'bagging_temperature': 6.534059877914268}. Best is trial 1464 with value: 0.8990825688073395.
[32m[I 2023-04-21 01:03:32,333][39m Trial 5751 finished with value: 0.8347826086956522 and parameters: {'objective': 'Logloss', 'colsample_bylevel': 0.06810649184124354, 'depth': 11, 'boosting_type': 'Plain', 'bootstrap_type': 'Bayesian', 'bagging_temperature': 4.383280738767698}. Best is trial 1464 with value: 0.8990825688073395.
[32m[I 2023-04-21 01:03:33,098][39m Trial 5752 finished with value: 0.8785046728971961 and parameters: {'objective': 'Logloss', 'colsample_bylevel': 0.085242913875101, 'depth': 12, 'boosting_type': 'Plain', 'bootstrap_type': 'Bayesian', 'bagging_temperature': 4.510656440974243}. Best is trial 1464 with value: 0.8990825688073395.
[32m[I 2023-04-21 01:03:34,723][39m Trial 5753 finished with value: 0.888888888888889 and parameters: {'objective': 'CrossEntropy', 'colsample_bylevel': 0.09332713937580148, 'depth': 8, 'boosting_type': 'Plain', 'bootstrap_type': 'Bayesian', 'bagging_temperature': 5.005138789423396}. Best is trial 1464 with value: 0.8990825688073395.
[32m[I 2023-04-21 01:03:36,356][39m Trial 5754 finished with value: 0.8807339449541284 and parameters: {'objective': 'Logloss', 'colsample_bylevel': 0.09676029679583124, 'depth': 9, 'boosting_type': 'Plain', 'bootstrap_type': 'Bayesian', 'bagging_temperature': 6.041899864900965}. Best is trial 1464 with value: 0.8990825688073395.
[32m[I 2023-04-21 01:03:37,313][39m Trial 5755 finished with value: 0.888888888888889 and parameters: {'objective': 'CrossEntropy', 'colsample_bylevel': 0.09064341653953949, 'depth': 12, 'boosting_type': 'Plain', 'bootstrap_type': 'Bayesian', 'bagging_temperature': 6.490853790527127}. Best is trial 1464 with value: 0.8990825688073395.
[32m[I 2023-04-21 01:03:38,575][39m Trial 5756 finished with value: 0.8807339449541284 and parameters: {'objective': 'Logloss', 'colsample_bylevel': 0.09980725964599112, 'depth': 12, 'boosting_type': 'Plain', 'bootstrap_type': 'Bayesian', 'bagging_temperature': 3.597361921906985}. Best is trial 1464 with value: 0.8990825688073395.
[32m[I 2023-04-21 01:03:39,268][39m Trial 5757 finished with value: 0.8828828828828829 and parameters: {'objective': 'CrossEntropy', 'colsample_bylevel': 0.09063643173487977, 'depth': 12, 'boosting_type': 'Plain', 'bootstrap_type': 'Bayesian', 'bagging_temperature': 4.197716656675398}. Best is trial 1464 with value: 0.8990825688073395.
[32m[I 2023-04-21 01:03:44,725][39m Trial 5758 finished with value: 0.8421052631578947 and parameters: {'objective': 'Logloss', 'colsample_bylevel': 0.09741047111283968, 'depth': 10, 'boosting_type': 'Ordered', 'bootstrap_type': 'Bayesian', 'bagging_temperature': 3.989434288178907}. Best is trial 1464 with value: 0.8990825688073395.
[32m[I 2023-04-21 01:03:45,969][39m Trial 5759 finished with value: 0.8727272727272727 and parameters: {'objective': 'CrossEntropy', 'colsample_bylevel': 0.09252265942968697, 'depth': 9, 'boosting_type': 'Plain', 'bootstrap_type': 'Bayesian', 'bagging_temperature': 6.642030475525763}. Best is trial 1464 with value: 0.8990825688073395.
[32m[I 2023-04-21 01:03:47,760][39m Trial 5760 finished with value: 0.8727272727272727 and parameters: {'objective': 'Logloss', 'colsample_bylevel': 0.09670357158034534, 'depth': 9, 'boosting_type': 'Plain', 'bootstrap_type': 'Bernoulli', 'subsample': 0.27661740963316883}. Best is trial 1464 with value: 0.8990825688073395.
[32m[I 2023-04-21 01:03:49,131][39m Trial 5761 finished with value: 0.8807339449541284 and parameters: {'objective': 'Logloss', 'colsample_bylevel': 0.09309081818114881, 'depth': 12, 'boosting_type': 'Plain', 'bootstrap_type': 'Bayesian', 'bagging_temperature': 5.800293156834366}. Best is trial 1464 with value: 0.8990825688073395.
[32m[I 2023-04-21 01:03:50,507][39m Trial 5762 finished with value: 0.8785046728971961 and parameters: {'objective': 'CrossEntropy', 'colsample_bylevel': 0.09492243572496072, 'depth': 8, 'boosting_type': 'Plain', 'bootstrap_type': 'Bayesian', 'bagging_temperature': 6.243720429379223}. Best is trial 1464 with value: 0.8990825688073395.
[32m[I 2023-04-21 01:03:52,040][39m Trial 5763 finished with value: 0.8495575221238938 and parameters: {'objective': 'Logloss', 'colsample_bylevel': 0.09299789632889448, 'depth': 9, 'boosting_type': 'Plain', 'bootstrap_type': 'Bayesian', 'bagging_temperature': 0.0528907453495675}. Best is trial 1464 with value: 0.8990825688073395.
[32m[I 2023-04-21 01:03:53,281][39m Trial 5764 finished with value: 0.8727272727272727 and parameters: {'objective': 'Logloss', 'colsample_bylevel': 0.09534696695777559, 'depth': 8, 'boosting_type': 'Plain', 'bootstrap_type': 'Bayesian', 'bagging_temperature': 4.292986117198614}. Best is trial 1464 with value: 0.8990825688073395.
[32m[I 2023-04-21 01:03:54,096][39m Trial 5765 finished with value: 0.888888888888889 and parameters: {'objective': 'CrossEntropy', 'colsample_bylevel': 0.09266498136758129, 'depth': 12, 'boosting_type': 'Plain', 'bootstrap_type': 'Bayesian', 'bagging_temperature': 4.39845151117516}. Best is trial 1464 with value: 0.8990825688073395.
[32m[I 2023-04-21 01:03:54,927][39m Trial 5766 finished with value: 0.8448275862068967 and parameters: {'objective': 'Logloss', 'colsample_bylevel': 0.09329767052986221, 'depth': 10, 'boosting_type': 'Plain', 'bootstrap_type': 'MVS'}. Best is trial 1464 with value: 0.8990825688073395.
[32m[I 2023-04-21 01:03:56,377][39m Trial 5767 finished with value: 0.8807339449541284 and parameters: {'objective': 'CrossEntropy', 'colsample_bylevel': 0.08364866067074511, 'depth': 12, 'boosting_type': 'Plain', 'bootstrap_type': 'Bayesian', 'bagging_temperature': 4.167098217984692}. Best is trial 1464 with value: 0.8990825688073395.
[32m[I 2023-04-21 01:03:57,579][39m Trial 5768 finished with value: 0.8807339449541284 and parameters: {'objective': 'CrossEntropy', 'colsample_bylevel': 0.09176994476772403, 'depth': 11, 'boosting_type': 'Plain', 'bootstrap_type': 'Bayesian', 'bagging_temperature': 3.8979622602798076}. Best is trial 1464 with value: 0.8990825688073395.
[32m[I 2023-04-21 01:03:58,792][39m Trial 5769 finished with value: 0.8807339449541284 and parameters: {'objective': 'CrossEntropy', 'colsample_bylevel': 0.09177745786968634, 'depth': 11, 'boosting_type': 'Plain', 'bootstrap_type': 'Bayesian', 'bagging_temperature': 3.9076989562223656}. Best is trial 1464 with value: 0.8990825688073395.
[32m[I 2023-04-21 01:03:59,758][39m Trial 5770 finished with value: 0.8727272727272727 and parameters: {'objective': 'Logloss', 'colsample_bylevel': 0.09739847497787671, 'depth': 11, 'boosting_type': 'Plain', 'bootstrap_type': 'Bayesian', 'bagging_temperature': 5.901761904137334}. Best is trial 1464 with value: 0.8990825688073395.
[32m[I 2023-04-21 01:04:00,560][39m Trial 5771 finished with value: 0.888888888888889 and parameters: {'objective': 'Logloss', 'colsample_bylevel': 0.0894839694410357, 'depth': 8, 'boosting_type': 'Plain', 'bootstrap_type': 'Bayesian', 'bagging_temperature': 5.0851687146500195}. Best is trial 1464 with value: 0.8990825688073395.
[32m[I 2023-04-21 01:04:01,813][39m Trial 5772 finished with value: 0.888888888888889 and parameters: {'objective': 'Logloss', 'colsample_bylevel': 0.09364963196642201, 'depth': 7, 'boosting_type': 'Plain', 'bootstrap_type': 'Bayesian', 'bagging_temperature': 5.979118025889334}. Best is trial 1464 with value: 0.8990825688073395.
[32m[I 2023-04-21 01:04:03,021][39m Trial 5773 finished with value: 0.8545454545454546 and parameters: {'objective': 'Logloss', 'colsample_bylevel': 0.09480842421735314, 'depth': 7, 'boosting_type': 'Plain', 'bootstrap_type': 'Bayesian', 'bagging_temperature': 3.298003947155392}. Best is trial 1464 with value: 0.8990825688073395.
[32m[I 2023-04-21 01:04:04,401][39m Trial 5774 finished with value: 0.8727272727272727 and parameters: {'objective': 'CrossEntropy', 'colsample_bylevel': 0.09824354431580351, 'depth': 11, 'boosting_type': 'Plain', 'bootstrap_type': 'Bayesian', 'bagging_temperature': 4.709775177640023}. Best is trial 1464 with value: 0.8990825688073395.
[32m[I 2023-04-21 01:04:05,540][39m Trial 5775 finished with value: 0.875 and parameters: {'objective': 'CrossEntropy', 'colsample_bylevel': 0.09434242288067898, 'depth': 10, 'boosting_type': 'Plain', 'bootstrap_type': 'Bayesian', 'bagging_temperature': 6.289703098628554}. Best is trial 1464 with value: 0.8990825688073395.
[32m[I 2023-04-21 01:04:06,632][39m Trial 5776 finished with value: 0.8347826086956522 and parameters: {'objective': 'Logloss', 'colsample_bylevel': 0.055691445459213174, 'depth': 11, 'boosting_type': 'Plain', 'bootstrap_type': 'Bayesian', 'bagging_temperature': 3.7153923937151827}. Best is trial 1464 with value: 0.8990825688073395.
[32m[I 2023-04-21 01:04:11,068][39m Trial 5777 finished with value: 0.831858407079646 and parameters: {'objective': 'CrossEntropy', 'colsample_bylevel': 0.0999216994463167, 'depth': 10, 'boosting_type': 'Ordered', 'bootstrap_type': 'Bayesian', 'bagging_temperature': 6.840450903576347}. Best is trial 1464 with value: 0.8990825688073395.
[32m[I 2023-04-21 01:04:12,371][39m Trial 5778 finished with value: 0.888888888888889 and parameters: {'objective': 'Logloss', 'colsample_bylevel': 0.0939324527015514, 'depth': 10, 'boosting_type': 'Plain', 'bootstrap_type': 'Bayesian', 'bagging_temperature': 5.681261967479321}. Best is trial 1464 with value: 0.8990825688073395.
[32m[I 2023-04-21 01:04:13,694][39m Trial 5779 finished with value: 0.8727272727272727 and parameters: {'objective': 'Logloss', 'colsample_bylevel': 0.095616826404887, 'depth': 12, 'boosting_type': 'Plain', 'bootstrap_type': 'Bayesian', 'bagging_temperature': 7.138427582163645}. Best is trial 1464 with value: 0.8990825688073395.
[32m[I 2023-04-21 01:04:15,662][39m Trial 5780 finished with value: 0.8727272727272727 and parameters: {'objective': 'Logloss', 'colsample_bylevel': 0.09585898612655555, 'depth': 9, 'boosting_type': 'Plain', 'bootstrap_type': 'Bayesian', 'bagging_temperature': 7.034240805004334}. Best is trial 1464 with value: 0.8990825688073395.
[32m[I 2023-04-21 01:04:17,010][39m Trial 5781 finished with value: 0.8807339449541284 and parameters: {'objective': 'CrossEntropy', 'colsample_bylevel': 0.09082359785318384, 'depth': 11, 'boosting_type': 'Plain', 'bootstrap_type': 'Bayesian', 'bagging_temperature': 5.648709658363988}. Best is trial 1464 with value: 0.8990825688073395.
[32m[I 2023-04-21 01:04:18,312][39m Trial 5782 finished with value: 0.8807339449541284 and parameters: {'objective': 'CrossEntropy', 'colsample_bylevel': 0.09025705186133352, 'depth': 11, 'boosting_type': 'Plain', 'bootstrap_type': 'Bayesian', 'bagging_temperature': 5.624075261004142}. Best is trial 1464 with value: 0.8990825688073395.
[32m[I 2023-04-21 01:04:19,868][39m Trial 5783 finished with value: 0.8347826086956522 and parameters: {'objective': 'Logloss', 'colsample_bylevel': 0.08426207717955765, 'depth': 9, 'boosting_type': 'Plain', 'bootstrap_type': 'Bernoulli', 'subsample': 0.7847405610946856}. Best is trial 1464 with value: 0.8990825688073395.
[32m[I 2023-04-21 01:04:20,973][39m Trial 5784 finished with value: 0.8785046728971961 and parameters: {'objective': 'CrossEntropy', 'colsample_bylevel': 0.09736933330351098, 'depth': 8, 'boosting_type': 'Plain', 'bootstrap_type': 'Bayesian', 'bagging_temperature': 6.70856266248551}. Best is trial 1464 with value: 0.8990825688073395.
[32m[I 2023-04-21 01:04:21,785][39m Trial 5785 finished with value: 0.8727272727272727 and parameters: {'objective': 'Logloss', 'colsample_bylevel': 0.09759516766741104, 'depth': 11, 'boosting_type': 'Plain', 'bootstrap_type': 'Bayesian', 'bagging_temperature': 6.598427992965739}. Best is trial 1464 with value: 0.8990825688073395.
[32m[I 2023-04-21 01:04:22,730][39m Trial 5786 finished with value: 0.8703703703703703 and parameters: {'objective': 'CrossEntropy', 'colsample_bylevel': 0.09845749285536252, 'depth': 10, 'boosting_type': 'Plain', 'bootstrap_type': 'Bayesian', 'bagging_temperature': 4.476164113614436}. Best is trial 1464 with value: 0.8990825688073395.
