[32m[I 2023-04-20 23:45:41,137][39m Trial 2308 finished with value: 0.8807339449541284 and parameters: {'objective': 'Logloss', 'colsample_bylevel': 0.09181873817677955, 'depth': 10, 'boosting_type': 'Plain', 'bootstrap_type': 'Bayesian', 'bagging_temperature': 5.767597100126496}. Best is trial 1464 with value: 0.8990825688073395.
[32m[I 2023-04-20 23:45:42,492][39m Trial 2309 finished with value: 0.8807339449541284 and parameters: {'objective': 'Logloss', 'colsample_bylevel': 0.09720341840424972, 'depth': 9, 'boosting_type': 'Plain', 'bootstrap_type': 'Bayesian', 'bagging_temperature': 5.010704687114039}. Best is trial 1464 with value: 0.8990825688073395.
[32m[I 2023-04-20 23:45:43,199][39m Trial 2310 finished with value: 0.8571428571428572 and parameters: {'objective': 'CrossEntropy', 'colsample_bylevel': 0.08795526926342002, 'depth': 8, 'boosting_type': 'Plain', 'bootstrap_type': 'Bernoulli', 'subsample': 0.6048713408092239}. Best is trial 1464 with value: 0.8990825688073395.
[32m[I 2023-04-20 23:45:44,098][39m Trial 2311 finished with value: 0.875 and parameters: {'objective': 'CrossEntropy', 'colsample_bylevel': 0.08703709370130422, 'depth': 9, 'boosting_type': 'Plain', 'bootstrap_type': 'Bayesian', 'bagging_temperature': 4.905960689102822}. Best is trial 1464 with value: 0.8990825688073395.
[32m[I 2023-04-20 23:45:45,621][39m Trial 2312 finished with value: 0.888888888888889 and parameters: {'objective': 'Logloss', 'colsample_bylevel': 0.09315040414545231, 'depth': 9, 'boosting_type': 'Plain', 'bootstrap_type': 'Bayesian', 'bagging_temperature': 5.325082628727617}. Best is trial 1464 with value: 0.8990825688073395.
[32m[I 2023-04-20 23:45:46,237][39m Trial 2313 finished with value: 0.8521739130434783 and parameters: {'objective': 'CrossEntropy', 'colsample_bylevel': 0.03705866904316074, 'depth': 9, 'boosting_type': 'Plain', 'bootstrap_type': 'Bayesian', 'bagging_temperature': 5.6577952759228545}. Best is trial 1464 with value: 0.8990825688073395.
[32m[I 2023-04-20 23:45:47,418][39m Trial 2314 finished with value: 0.8623853211009175 and parameters: {'objective': 'Logloss', 'colsample_bylevel': 0.09448341281184411, 'depth': 6, 'boosting_type': 'Plain', 'bootstrap_type': 'Bayesian', 'bagging_temperature': 7.089139275890441}. Best is trial 1464 with value: 0.8990825688073395.
[32m[I 2023-04-20 23:45:48,395][39m Trial 2315 finished with value: 0.8495575221238938 and parameters: {'objective': 'Logloss', 'colsample_bylevel': 0.09135365923045413, 'depth': 10, 'boosting_type': 'Plain', 'bootstrap_type': 'Bernoulli', 'subsample': 0.7529021022259199}. Best is trial 1464 with value: 0.8990825688073395.
[32m[I 2023-04-20 23:45:49,678][39m Trial 2316 finished with value: 0.8807339449541284 and parameters: {'objective': 'CrossEntropy', 'colsample_bylevel': 0.0967129690662534, 'depth': 8, 'boosting_type': 'Plain', 'bootstrap_type': 'Bayesian', 'bagging_temperature': 3.6484465945274303}. Best is trial 1464 with value: 0.8990825688073395.
[32m[I 2023-04-20 23:45:50,288][39m Trial 2317 finished with value: 0.8648648648648648 and parameters: {'objective': 'CrossEntropy', 'colsample_bylevel': 0.09648725430044582, 'depth': 7, 'boosting_type': 'Plain', 'bootstrap_type': 'Bayesian', 'bagging_temperature': 4.50596596131848}. Best is trial 1464 with value: 0.8990825688073395.
[32m[I 2023-04-20 23:45:51,487][39m Trial 2318 finished with value: 0.8032786885245901 and parameters: {'objective': 'CrossEntropy', 'colsample_bylevel': 0.02294097759509337, 'depth': 10, 'boosting_type': 'Plain', 'bootstrap_type': 'Bayesian', 'bagging_temperature': 9.00260649624784}. Best is trial 1464 with value: 0.8990825688073395.
[32m[I 2023-04-20 23:45:52,292][39m Trial 2319 finished with value: 0.8571428571428572 and parameters: {'objective': 'CrossEntropy', 'colsample_bylevel': 0.0873876749957785, 'depth': 10, 'boosting_type': 'Plain', 'bootstrap_type': 'MVS'}. Best is trial 1464 with value: 0.8990825688073395.
[32m[I 2023-04-20 23:45:53,102][39m Trial 2320 finished with value: 0.8807339449541284 and parameters: {'objective': 'CrossEntropy', 'colsample_bylevel': 0.09338541520856487, 'depth': 9, 'boosting_type': 'Plain', 'bootstrap_type': 'Bayesian', 'bagging_temperature': 6.2196832828655655}. Best is trial 1464 with value: 0.8990825688073395.
[32m[I 2023-04-20 23:45:57,876][39m Trial 2321 finished with value: 0.8392857142857144 and parameters: {'objective': 'CrossEntropy', 'colsample_bylevel': 0.09537854651238759, 'depth': 8, 'boosting_type': 'Ordered', 'bootstrap_type': 'Bayesian', 'bagging_temperature': 6.409557739244901}. Best is trial 1464 with value: 0.8990825688073395.
[32m[I 2023-04-20 23:45:59,078][39m Trial 2322 finished with value: 0.8347826086956522 and parameters: {'objective': 'Logloss', 'colsample_bylevel': 0.07171678081979056, 'depth': 10, 'boosting_type': 'Plain', 'bootstrap_type': 'Bayesian', 'bagging_temperature': 4.06554024301089}. Best is trial 1464 with value: 0.8990825688073395.
[32m[I 2023-04-20 23:46:00,104][39m Trial 2323 finished with value: 0.8571428571428572 and parameters: {'objective': 'CrossEntropy', 'colsample_bylevel': 0.08039233235850854, 'depth': 11, 'boosting_type': 'Plain', 'bootstrap_type': 'Bayesian', 'bagging_temperature': 1.2980887663240102}. Best is trial 1464 with value: 0.8990825688073395.
[32m[I 2023-04-20 23:46:01,132][39m Trial 2324 finished with value: 0.8727272727272727 and parameters: {'objective': 'Logloss', 'colsample_bylevel': 0.09660224812168301, 'depth': 9, 'boosting_type': 'Plain', 'bootstrap_type': 'Bayesian', 'bagging_temperature': 4.686191942774749}. Best is trial 1464 with value: 0.8990825688073395.
[32m[I 2023-04-20 23:46:02,673][39m Trial 2325 finished with value: 0.888888888888889 and parameters: {'objective': 'Logloss', 'colsample_bylevel': 0.09965012445172154, 'depth': 8, 'boosting_type': 'Plain', 'bootstrap_type': 'Bayesian', 'bagging_temperature': 5.871811708511236}. Best is trial 1464 with value: 0.8990825688073395.
[32m[I 2023-04-20 23:46:03,668][39m Trial 2326 finished with value: 0.8807339449541284 and parameters: {'objective': 'Logloss', 'colsample_bylevel': 0.09555652911711698, 'depth': 7, 'boosting_type': 'Plain', 'bootstrap_type': 'Bayesian', 'bagging_temperature': 5.940044843780113}. Best is trial 1464 with value: 0.8990825688073395.
[32m[I 2023-04-20 23:46:04,536][39m Trial 2327 finished with value: 0.8785046728971961 and parameters: {'objective': 'CrossEntropy', 'colsample_bylevel': 0.09106742313027723, 'depth': 8, 'boosting_type': 'Plain', 'bootstrap_type': 'Bayesian', 'bagging_temperature': 5.916085581210005}. Best is trial 1464 with value: 0.8990825688073395.
[32m[I 2023-04-20 23:46:05,556][39m Trial 2328 finished with value: 0.8727272727272727 and parameters: {'objective': 'CrossEntropy', 'colsample_bylevel': 0.08923673689666738, 'depth': 11, 'boosting_type': 'Plain', 'bootstrap_type': 'Bayesian', 'bagging_temperature': 6.786884854893339}. Best is trial 1464 with value: 0.8990825688073395.
[32m[I 2023-04-20 23:46:06,896][39m Trial 2329 finished with value: 0.8807339449541284 and parameters: {'objective': 'CrossEntropy', 'colsample_bylevel': 0.09248443070725249, 'depth': 10, 'boosting_type': 'Plain', 'bootstrap_type': 'Bayesian', 'bagging_temperature': 4.542114949333572}. Best is trial 1464 with value: 0.8990825688073395.
[32m[I 2023-04-20 23:46:07,787][39m Trial 2330 finished with value: 0.8727272727272727 and parameters: {'objective': 'Logloss', 'colsample_bylevel': 0.0952327849582994, 'depth': 10, 'boosting_type': 'Plain', 'bootstrap_type': 'Bayesian', 'bagging_temperature': 5.135246544439111}. Best is trial 1464 with value: 0.8990825688073395.
[32m[I 2023-04-20 23:46:08,607][39m Trial 2331 finished with value: 0.8807339449541284 and parameters: {'objective': 'CrossEntropy', 'colsample_bylevel': 0.09355542931233295, 'depth': 10, 'boosting_type': 'Plain', 'bootstrap_type': 'Bayesian', 'bagging_temperature': 4.334044546312218}. Best is trial 1464 with value: 0.8990825688073395.
[32m[I 2023-04-20 23:46:09,465][39m Trial 2332 finished with value: 0.823529411764706 and parameters: {'objective': 'CrossEntropy', 'colsample_bylevel': 0.09721242578871628, 'depth': 1, 'boosting_type': 'Plain', 'bootstrap_type': 'Bayesian', 'bagging_temperature': 6.184499077554023}. Best is trial 1464 with value: 0.8990825688073395.
[32m[I 2023-04-20 23:46:10,303][39m Trial 2333 finished with value: 0.8648648648648648 and parameters: {'objective': 'CrossEntropy', 'colsample_bylevel': 0.08959501135486946, 'depth': 10, 'boosting_type': 'Plain', 'bootstrap_type': 'Bayesian', 'bagging_temperature': 4.288541759236265}. Best is trial 1464 with value: 0.8990825688073395.
[32m[I 2023-04-20 23:46:11,140][39m Trial 2334 finished with value: 0.8785046728971961 and parameters: {'objective': 'CrossEntropy', 'colsample_bylevel': 0.08702885037033521, 'depth': 10, 'boosting_type': 'Plain', 'bootstrap_type': 'Bayesian', 'bagging_temperature': 4.877371706305658}. Best is trial 1464 with value: 0.8990825688073395.
[32m[I 2023-04-20 23:46:12,147][39m Trial 2335 finished with value: 0.8648648648648648 and parameters: {'objective': 'Logloss', 'colsample_bylevel': 0.09689702453345646, 'depth': 9, 'boosting_type': 'Plain', 'bootstrap_type': 'Bayesian', 'bagging_temperature': 3.279807594773647}. Best is trial 1464 with value: 0.8990825688073395.
[32m[I 2023-04-20 23:46:13,246][39m Trial 2336 finished with value: 0.8703703703703703 and parameters: {'objective': 'CrossEntropy', 'colsample_bylevel': 0.09023235554525742, 'depth': 10, 'boosting_type': 'Plain', 'bootstrap_type': 'Bayesian', 'bagging_temperature': 4.610713571833822}. Best is trial 1464 with value: 0.8990825688073395.
[32m[I 2023-04-20 23:46:14,520][39m Trial 2337 finished with value: 0.8727272727272727 and parameters: {'objective': 'Logloss', 'colsample_bylevel': 0.09705808443430171, 'depth': 11, 'boosting_type': 'Plain', 'bootstrap_type': 'Bayesian', 'bagging_temperature': 5.121737790177204}. Best is trial 1464 with value: 0.8990825688073395.
[32m[I 2023-04-20 23:46:15,954][39m Trial 2338 finished with value: 0.8727272727272727 and parameters: {'objective': 'Logloss', 'colsample_bylevel': 0.09982088728766941, 'depth': 8, 'boosting_type': 'Plain', 'bootstrap_type': 'Bayesian', 'bagging_temperature': 5.577451502297273}. Best is trial 1464 with value: 0.8990825688073395.
[32m[I 2023-04-20 23:46:16,787][39m Trial 2339 finished with value: 0.8571428571428572 and parameters: {'objective': 'Logloss', 'colsample_bylevel': 0.09858195691878334, 'depth': 9, 'boosting_type': 'Plain', 'bootstrap_type': 'MVS'}. Best is trial 1464 with value: 0.8990825688073395.
[32m[I 2023-04-20 23:46:22,025][39m Trial 2340 finished with value: 0.8648648648648648 and parameters: {'objective': 'CrossEntropy', 'colsample_bylevel': 0.09996748266350707, 'depth': 9, 'boosting_type': 'Ordered', 'bootstrap_type': 'Bernoulli', 'subsample': 0.25650412104020576}. Best is trial 1464 with value: 0.8990825688073395.
[32m[I 2023-04-20 23:46:23,948][39m Trial 2341 finished with value: 0.888888888888889 and parameters: {'objective': 'Logloss', 'colsample_bylevel': 0.0979418966879514, 'depth': 9, 'boosting_type': 'Plain', 'bootstrap_type': 'Bayesian', 'bagging_temperature': 4.008457376514358}. Best is trial 1464 with value: 0.8990825688073395.
[32m[I 2023-04-20 23:46:24,630][39m Trial 2342 finished with value: 0.8421052631578947 and parameters: {'objective': 'Logloss', 'colsample_bylevel': 0.09580130848013155, 'depth': 7, 'boosting_type': 'Plain', 'bootstrap_type': 'Bernoulli', 'subsample': 0.20628503707444557}. Best is trial 1464 with value: 0.8990825688073395.
[32m[I 2023-04-20 23:46:26,036][39m Trial 2343 finished with value: 0.888888888888889 and parameters: {'objective': 'Logloss', 'colsample_bylevel': 0.09605517331308831, 'depth': 9, 'boosting_type': 'Plain', 'bootstrap_type': 'Bayesian', 'bagging_temperature': 4.352596612416188}. Best is trial 1464 with value: 0.8990825688073395.
[32m[I 2023-04-20 23:46:26,665][39m Trial 2344 finished with value: 0.8727272727272727 and parameters: {'objective': 'CrossEntropy', 'colsample_bylevel': 0.0898024317168332, 'depth': 10, 'boosting_type': 'Plain', 'bootstrap_type': 'Bayesian', 'bagging_temperature': 7.504936683195082}. Best is trial 1464 with value: 0.8990825688073395.
[32m[I 2023-04-20 23:46:27,883][39m Trial 2345 finished with value: 0.8672566371681416 and parameters: {'objective': 'CrossEntropy', 'colsample_bylevel': 0.08353822143772778, 'depth': 10, 'boosting_type': 'Plain', 'bootstrap_type': 'Bayesian', 'bagging_temperature': 6.582366781584833}. Best is trial 1464 with value: 0.8990825688073395.
[32m[I 2023-04-20 23:46:29,163][39m Trial 2346 finished with value: 0.8727272727272727 and parameters: {'objective': 'CrossEntropy', 'colsample_bylevel': 0.08750535984216168, 'depth': 10, 'boosting_type': 'Plain', 'bootstrap_type': 'Bayesian', 'bagging_temperature': 5.227617696123243}. Best is trial 1464 with value: 0.8990825688073395.
[32m[I 2023-04-20 23:46:30,132][39m Trial 2347 finished with value: 0.875 and parameters: {'objective': 'Logloss', 'colsample_bylevel': 0.0860210404568429, 'depth': 10, 'boosting_type': 'Plain', 'bootstrap_type': 'Bayesian', 'bagging_temperature': 5.39426015428265}. Best is trial 1464 with value: 0.8990825688073395.
[32m[I 2023-04-20 23:46:30,842][39m Trial 2348 finished with value: 0.8727272727272727 and parameters: {'objective': 'Logloss', 'colsample_bylevel': 0.09998760852866062, 'depth': 8, 'boosting_type': 'Plain', 'bootstrap_type': 'Bayesian', 'bagging_temperature': 3.1362450460986278}. Best is trial 1464 with value: 0.8990825688073395.
[32m[I 2023-04-20 23:46:31,878][39m Trial 2349 finished with value: 0.8807339449541284 and parameters: {'objective': 'Logloss', 'colsample_bylevel': 0.0953221376050706, 'depth': 9, 'boosting_type': 'Plain', 'bootstrap_type': 'Bayesian', 'bagging_temperature': 5.7671456208127205}. Best is trial 1464 with value: 0.8990825688073395.
[32m[I 2023-04-20 23:46:33,067][39m Trial 2350 finished with value: 0.888888888888889 and parameters: {'objective': 'CrossEntropy', 'colsample_bylevel': 0.08789226750467859, 'depth': 9, 'boosting_type': 'Plain', 'bootstrap_type': 'Bayesian', 'bagging_temperature': 6.151440156825298}. Best is trial 1464 with value: 0.8990825688073395.
[32m[I 2023-04-20 23:46:34,110][39m Trial 2351 finished with value: 0.8727272727272727 and parameters: {'objective': 'CrossEntropy', 'colsample_bylevel': 0.09006762950471507, 'depth': 11, 'boosting_type': 'Plain', 'bootstrap_type': 'Bayesian', 'bagging_temperature': 6.223617894326423}. Best is trial 1464 with value: 0.8990825688073395.
[32m[I 2023-04-20 23:46:35,237][39m Trial 2352 finished with value: 0.8785046728971961 and parameters: {'objective': 'Logloss', 'colsample_bylevel': 0.09244312502062858, 'depth': 6, 'boosting_type': 'Plain', 'bootstrap_type': 'Bayesian', 'bagging_temperature': 5.5418948422898735}. Best is trial 1464 with value: 0.8990825688073395.
[32m[I 2023-04-20 23:46:36,339][39m Trial 2353 finished with value: 0.8703703703703703 and parameters: {'objective': 'Logloss', 'colsample_bylevel': 0.09697198231678533, 'depth': 7, 'boosting_type': 'Plain', 'bootstrap_type': 'Bayesian', 'bagging_temperature': 5.372036622046522}. Best is trial 1464 with value: 0.8990825688073395.
[32m[I 2023-04-20 23:46:37,207][39m Trial 2354 finished with value: 0.8727272727272727 and parameters: {'objective': 'CrossEntropy', 'colsample_bylevel': 0.09146104177308662, 'depth': 10, 'boosting_type': 'Plain', 'bootstrap_type': 'Bayesian', 'bagging_temperature': 6.931687479206691}. Best is trial 1464 with value: 0.8990825688073395.
[32m[I 2023-04-20 23:46:38,503][39m Trial 2355 finished with value: 0.8727272727272727 and parameters: {'objective': 'CrossEntropy', 'colsample_bylevel': 0.0910776245605128, 'depth': 9, 'boosting_type': 'Plain', 'bootstrap_type': 'Bayesian', 'bagging_temperature': 5.432361936604916}. Best is trial 1464 with value: 0.8990825688073395.
[32m[I 2023-04-20 23:46:39,021][39m Trial 2356 finished with value: 0.888888888888889 and parameters: {'objective': 'CrossEntropy', 'colsample_bylevel': 0.09353659268985162, 'depth': 10, 'boosting_type': 'Plain', 'bootstrap_type': 'Bayesian', 'bagging_temperature': 5.425761275409304}. Best is trial 1464 with value: 0.8990825688073395.
[32m[I 2023-04-20 23:46:40,500][39m Trial 2357 finished with value: 0.8807339449541284 and parameters: {'objective': 'Logloss', 'colsample_bylevel': 0.09513457898395797, 'depth': 8, 'boosting_type': 'Plain', 'bootstrap_type': 'Bayesian', 'bagging_temperature': 3.6577607387591136}. Best is trial 1464 with value: 0.8990825688073395.
[32m[I 2023-04-20 23:46:41,765][39m Trial 2358 finished with value: 0.8828828828828829 and parameters: {'objective': 'CrossEntropy', 'colsample_bylevel': 0.08800791265254104, 'depth': 9, 'boosting_type': 'Plain', 'bootstrap_type': 'Bayesian', 'bagging_temperature': 5.604108852042857}. Best is trial 1464 with value: 0.8990825688073395.
[32m[I 2023-04-20 23:46:47,103][39m Trial 2359 finished with value: 0.8648648648648648 and parameters: {'objective': 'CrossEntropy', 'colsample_bylevel': 0.09509548948412876, 'depth': 10, 'boosting_type': 'Ordered', 'bootstrap_type': 'Bayesian', 'bagging_temperature': 5.507375630788132}. Best is trial 1464 with value: 0.8990825688073395.
[32m[I 2023-04-20 23:46:48,918][39m Trial 2360 finished with value: 0.8807339449541284 and parameters: {'objective': 'CrossEntropy', 'colsample_bylevel': 0.09650825349950594, 'depth': 9, 'boosting_type': 'Plain', 'bootstrap_type': 'Bayesian', 'bagging_temperature': 4.300851411888968}. Best is trial 1464 with value: 0.8990825688073395.
[32m[I 2023-04-20 23:46:49,805][39m Trial 2361 finished with value: 0.8807339449541284 and parameters: {'objective': 'Logloss', 'colsample_bylevel': 0.09294289789166499, 'depth': 9, 'boosting_type': 'Plain', 'bootstrap_type': 'Bayesian', 'bagging_temperature': 4.575761312969035}. Best is trial 1464 with value: 0.8990825688073395.
[32m[I 2023-04-20 23:46:50,619][39m Trial 2362 finished with value: 0.8623853211009175 and parameters: {'objective': 'CrossEntropy', 'colsample_bylevel': 0.09405993912490364, 'depth': 9, 'boosting_type': 'Plain', 'bootstrap_type': 'Bayesian', 'bagging_temperature': 6.440157939699743}. Best is trial 1464 with value: 0.8990825688073395.
[32m[I 2023-04-20 23:46:51,820][39m Trial 2363 finished with value: 0.8347826086956522 and parameters: {'objective': 'Logloss', 'colsample_bylevel': 0.08984960677371227, 'depth': 9, 'boosting_type': 'Plain', 'bootstrap_type': 'MVS'}. Best is trial 1464 with value: 0.8990825688073395.
[32m[I 2023-04-20 23:46:52,855][39m Trial 2364 finished with value: 0.888888888888889 and parameters: {'objective': 'CrossEntropy', 'colsample_bylevel': 0.09301201108709356, 'depth': 10, 'boosting_type': 'Plain', 'bootstrap_type': 'Bayesian', 'bagging_temperature': 7.134400967552376}. Best is trial 1464 with value: 0.8990825688073395.
[32m[I 2023-04-20 23:46:53,516][39m Trial 2365 finished with value: 0.8205128205128206 and parameters: {'objective': 'Logloss', 'colsample_bylevel': 0.013393214381153262, 'depth': 10, 'boosting_type': 'Plain', 'bootstrap_type': 'MVS'}. Best is trial 1464 with value: 0.8990825688073395.
[32m[I 2023-04-20 23:46:54,879][39m Trial 2366 finished with value: 0.888888888888889 and parameters: {'objective': 'CrossEntropy', 'colsample_bylevel': 0.09207506626185101, 'depth': 10, 'boosting_type': 'Plain', 'bootstrap_type': 'Bayesian', 'bagging_temperature': 5.231387452131473}. Best is trial 1464 with value: 0.8990825688073395.
[32m[I 2023-04-20 23:46:56,112][39m Trial 2367 finished with value: 0.8807339449541284 and parameters: {'objective': 'Logloss', 'colsample_bylevel': 0.09825560235977752, 'depth': 9, 'boosting_type': 'Plain', 'bootstrap_type': 'Bayesian', 'bagging_temperature': 4.20956212154104}. Best is trial 1464 with value: 0.8990825688073395.
[32m[I 2023-04-20 23:46:56,783][39m Trial 2368 finished with value: 0.8623853211009175 and parameters: {'objective': 'Logloss', 'colsample_bylevel': 0.08612048461912175, 'depth': 10, 'boosting_type': 'Plain', 'bootstrap_type': 'Bayesian', 'bagging_temperature': 5.336376937498245}. Best is trial 1464 with value: 0.8990825688073395.
[32m[I 2023-04-20 23:46:57,604][39m Trial 2369 finished with value: 0.875 and parameters: {'objective': 'CrossEntropy', 'colsample_bylevel': 0.09726492278807326, 'depth': 9, 'boosting_type': 'Plain', 'bootstrap_type': 'Bernoulli', 'subsample': 0.4055969830866993}. Best is trial 1464 with value: 0.8990825688073395.
[32m[I 2023-04-20 23:46:58,609][39m Trial 2370 finished with value: 0.8571428571428572 and parameters: {'objective': 'Logloss', 'colsample_bylevel': 0.08345425633312147, 'depth': 12, 'boosting_type': 'Plain', 'bootstrap_type': 'Bayesian', 'bagging_temperature': 5.054579322539322}. Best is trial 1464 with value: 0.8990825688073395.
[32m[I 2023-04-20 23:47:00,447][39m Trial 2371 finished with value: 0.8623853211009175 and parameters: {'objective': 'CrossEntropy', 'colsample_bylevel': 0.09740820336327684, 'depth': 9, 'boosting_type': 'Plain', 'bootstrap_type': 'Bayesian', 'bagging_temperature': 5.950956054352119}. Best is trial 1464 with value: 0.8990825688073395.
[32m[I 2023-04-20 23:47:01,952][39m Trial 2372 finished with value: 0.8727272727272727 and parameters: {'objective': 'CrossEntropy', 'colsample_bylevel': 0.09153573612737377, 'depth': 9, 'boosting_type': 'Plain', 'bootstrap_type': 'Bayesian', 'bagging_temperature': 4.674617880519864}. Best is trial 1464 with value: 0.8990825688073395.
[32m[I 2023-04-20 23:47:02,736][39m Trial 2373 finished with value: 0.8807339449541284 and parameters: {'objective': 'Logloss', 'colsample_bylevel': 0.09737924347950798, 'depth': 10, 'boosting_type': 'Plain', 'bootstrap_type': 'Bernoulli', 'subsample': 0.1172711478583584}. Best is trial 1464 with value: 0.8990825688073395.
