[32m[I 2023-04-20 23:23:43,341][39m Trial 1259 finished with value: 0.8672566371681416 and parameters: {'objective': 'Logloss', 'colsample_bylevel': 0.09873643979282078, 'depth': 5, 'boosting_type': 'Plain', 'bootstrap_type': 'Bayesian', 'bagging_temperature': 6.178252901907429}. Best is trial 205 with value: 0.890909090909091.
[32m[I 2023-04-20 23:23:44,316][39m Trial 1260 finished with value: 0.8571428571428572 and parameters: {'objective': 'Logloss', 'colsample_bylevel': 0.09118446225750042, 'depth': 6, 'boosting_type': 'Plain', 'bootstrap_type': 'Bayesian', 'bagging_temperature': 2.139347105134295}. Best is trial 205 with value: 0.890909090909091.
[32m[I 2023-04-20 23:23:45,288][39m Trial 1261 finished with value: 0.8807339449541284 and parameters: {'objective': 'Logloss', 'colsample_bylevel': 0.09600120205261853, 'depth': 6, 'boosting_type': 'Plain', 'bootstrap_type': 'Bayesian', 'bagging_temperature': 5.108184117718358}. Best is trial 205 with value: 0.890909090909091.
[32m[I 2023-04-20 23:23:46,128][39m Trial 1262 finished with value: 0.8672566371681416 and parameters: {'objective': 'Logloss', 'colsample_bylevel': 0.06002482600291683, 'depth': 8, 'boosting_type': 'Plain', 'bootstrap_type': 'Bayesian', 'bagging_temperature': 5.240168715142779}. Best is trial 205 with value: 0.890909090909091.
[32m[I 2023-04-20 23:23:46,795][39m Trial 1263 finished with value: 0.888888888888889 and parameters: {'objective': 'CrossEntropy', 'colsample_bylevel': 0.0970341838431404, 'depth': 10, 'boosting_type': 'Plain', 'bootstrap_type': 'Bayesian', 'bagging_temperature': 4.828211514336155}. Best is trial 205 with value: 0.890909090909091.
[32m[I 2023-04-20 23:23:52,096][39m Trial 1264 finished with value: 0.8421052631578947 and parameters: {'objective': 'CrossEntropy', 'colsample_bylevel': 0.09320892827092461, 'depth': 11, 'boosting_type': 'Ordered', 'bootstrap_type': 'Bayesian', 'bagging_temperature': 3.787677440515816}. Best is trial 205 with value: 0.890909090909091.
[32m[I 2023-04-20 23:23:53,147][39m Trial 1265 finished with value: 0.8807339449541284 and parameters: {'objective': 'Logloss', 'colsample_bylevel': 0.09481839187271968, 'depth': 12, 'boosting_type': 'Plain', 'bootstrap_type': 'Bayesian', 'bagging_temperature': 3.0488657853653565}. Best is trial 205 with value: 0.890909090909091.
[32m[I 2023-04-20 23:23:54,083][39m Trial 1266 finished with value: 0.8571428571428572 and parameters: {'objective': 'Logloss', 'colsample_bylevel': 0.09495596379611862, 'depth': 10, 'boosting_type': 'Plain', 'bootstrap_type': 'Bernoulli', 'subsample': 0.5245140759614321}. Best is trial 205 with value: 0.890909090909091.
[32m[I 2023-04-20 23:23:55,302][39m Trial 1267 finished with value: 0.8727272727272727 and parameters: {'objective': 'CrossEntropy', 'colsample_bylevel': 0.09320029749845524, 'depth': 9, 'boosting_type': 'Plain', 'bootstrap_type': 'Bayesian', 'bagging_temperature': 6.5504036000039365}. Best is trial 205 with value: 0.890909090909091.
[32m[I 2023-04-20 23:23:55,947][39m Trial 1268 finished with value: 0.8807339449541284 and parameters: {'objective': 'CrossEntropy', 'colsample_bylevel': 0.09676029987012799, 'depth': 10, 'boosting_type': 'Plain', 'bootstrap_type': 'Bayesian', 'bagging_temperature': 6.66381812119257}. Best is trial 205 with value: 0.890909090909091.
[32m[I 2023-04-20 23:23:57,225][39m Trial 1269 finished with value: 0.888888888888889 and parameters: {'objective': 'CrossEntropy', 'colsample_bylevel': 0.09450442097598329, 'depth': 6, 'boosting_type': 'Plain', 'bootstrap_type': 'Bayesian', 'bagging_temperature': 5.978884246773415}. Best is trial 205 with value: 0.890909090909091.
[32m[I 2023-04-20 23:23:58,015][39m Trial 1270 finished with value: 0.8785046728971961 and parameters: {'objective': 'Logloss', 'colsample_bylevel': 0.09869719621061554, 'depth': 9, 'boosting_type': 'Plain', 'bootstrap_type': 'Bayesian', 'bagging_temperature': 4.824029236430047}. Best is trial 205 with value: 0.890909090909091.
[32m[I 2023-04-20 23:23:59,291][39m Trial 1271 finished with value: 0.8648648648648648 and parameters: {'objective': 'Logloss', 'colsample_bylevel': 0.09594041148258753, 'depth': 9, 'boosting_type': 'Plain', 'bootstrap_type': 'Bayesian', 'bagging_temperature': 3.864890373498835}. Best is trial 205 with value: 0.890909090909091.
[32m[I 2023-04-20 23:24:00,078][39m Trial 1272 finished with value: 0.8703703703703703 and parameters: {'objective': 'CrossEntropy', 'colsample_bylevel': 0.0937635137571983, 'depth': 12, 'boosting_type': 'Plain', 'bootstrap_type': 'Bayesian', 'bagging_temperature': 6.771297263384401}. Best is trial 205 with value: 0.890909090909091.
[32m[I 2023-04-20 23:24:01,449][39m Trial 1273 finished with value: 0.8495575221238938 and parameters: {'objective': 'CrossEntropy', 'colsample_bylevel': 0.06989949192447245, 'depth': 8, 'boosting_type': 'Plain', 'bootstrap_type': 'Bayesian', 'bagging_temperature': 6.918237681673242}. Best is trial 205 with value: 0.890909090909091.
[32m[I 2023-04-20 23:24:02,192][39m Trial 1274 finished with value: 0.8392857142857144 and parameters: {'objective': 'CrossEntropy', 'colsample_bylevel': 0.09696342484851417, 'depth': 5, 'boosting_type': 'Plain', 'bootstrap_type': 'Bayesian', 'bagging_temperature': 5.882209045048346}. Best is trial 205 with value: 0.890909090909091.
[32m[I 2023-04-20 23:24:03,688][39m Trial 1275 finished with value: 0.8648648648648648 and parameters: {'objective': 'Logloss', 'colsample_bylevel': 0.09438539548906498, 'depth': 9, 'boosting_type': 'Plain', 'bootstrap_type': 'Bayesian', 'bagging_temperature': 5.283357513551844}. Best is trial 205 with value: 0.890909090909091.
[32m[I 2023-04-20 23:24:04,638][39m Trial 1276 finished with value: 0.8623853211009175 and parameters: {'objective': 'Logloss', 'colsample_bylevel': 0.09303007133557946, 'depth': 8, 'boosting_type': 'Plain', 'bootstrap_type': 'Bayesian', 'bagging_temperature': 5.514658311657172}. Best is trial 205 with value: 0.890909090909091.
[32m[I 2023-04-20 23:24:05,513][39m Trial 1277 finished with value: 0.8648648648648648 and parameters: {'objective': 'CrossEntropy', 'colsample_bylevel': 0.09052946642420295, 'depth': 10, 'boosting_type': 'Plain', 'bootstrap_type': 'Bayesian', 'bagging_temperature': 5.943099283753393}. Best is trial 205 with value: 0.890909090909091.
[32m[I 2023-04-20 23:24:06,163][39m Trial 1278 finished with value: 0.8807339449541284 and parameters: {'objective': 'CrossEntropy', 'colsample_bylevel': 0.09268416335902016, 'depth': 11, 'boosting_type': 'Plain', 'bootstrap_type': 'Bayesian', 'bagging_temperature': 5.3505847453936415}. Best is trial 205 with value: 0.890909090909091.
[32m[I 2023-04-20 23:24:07,447][39m Trial 1279 finished with value: 0.8571428571428572 and parameters: {'objective': 'Logloss', 'colsample_bylevel': 0.09000499231664759, 'depth': 6, 'boosting_type': 'Plain', 'bootstrap_type': 'Bayesian', 'bagging_temperature': 4.528566290804954}. Best is trial 205 with value: 0.890909090909091.
[32m[I 2023-04-20 23:24:07,954][39m Trial 1280 finished with value: 0.8421052631578947 and parameters: {'objective': 'CrossEntropy', 'colsample_bylevel': 0.09653560469928721, 'depth': 7, 'boosting_type': 'Plain', 'bootstrap_type': 'MVS'}. Best is trial 205 with value: 0.890909090909091.
[32m[I 2023-04-20 23:24:08,970][39m Trial 1281 finished with value: 0.8468468468468469 and parameters: {'objective': 'Logloss', 'colsample_bylevel': 0.08595202869237169, 'depth': 10, 'boosting_type': 'Plain', 'bootstrap_type': 'Bayesian', 'bagging_temperature': 3.263871974631793}. Best is trial 205 with value: 0.890909090909091.
[32m[I 2023-04-20 23:24:10,045][39m Trial 1282 finished with value: 0.8807339449541284 and parameters: {'objective': 'CrossEntropy', 'colsample_bylevel': 0.09474221008666754, 'depth': 9, 'boosting_type': 'Plain', 'bootstrap_type': 'Bayesian', 'bagging_temperature': 5.155594705187996}. Best is trial 205 with value: 0.890909090909091.
[32m[I 2023-04-20 23:24:11,241][39m Trial 1283 finished with value: 0.8807339449541284 and parameters: {'objective': 'CrossEntropy', 'colsample_bylevel': 0.08668095767720285, 'depth': 10, 'boosting_type': 'Plain', 'bootstrap_type': 'Bayesian', 'bagging_temperature': 4.308588199568213}. Best is trial 205 with value: 0.890909090909091.
[32m[I 2023-04-20 23:24:11,930][39m Trial 1284 finished with value: 0.888888888888889 and parameters: {'objective': 'CrossEntropy', 'colsample_bylevel': 0.09782100771755461, 'depth': 12, 'boosting_type': 'Plain', 'bootstrap_type': 'Bayesian', 'bagging_temperature': 4.563831614564161}. Best is trial 205 with value: 0.890909090909091.
[32m[I 2023-04-20 23:24:13,055][39m Trial 1285 finished with value: 0.8648648648648648 and parameters: {'objective': 'Logloss', 'colsample_bylevel': 0.09713318603855481, 'depth': 5, 'boosting_type': 'Plain', 'bootstrap_type': 'Bayesian', 'bagging_temperature': 4.464714456021955}. Best is trial 205 with value: 0.890909090909091.
[32m[I 2023-04-20 23:24:18,487][39m Trial 1286 finished with value: 0.8347826086956522 and parameters: {'objective': 'CrossEntropy', 'colsample_bylevel': 0.09211002328903084, 'depth': 12, 'boosting_type': 'Ordered', 'bootstrap_type': 'Bayesian', 'bagging_temperature': 7.644029040070911}. Best is trial 205 with value: 0.890909090909091.
[32m[I 2023-04-20 23:24:19,660][39m Trial 1287 finished with value: 0.875 and parameters: {'objective': 'CrossEntropy', 'colsample_bylevel': 0.09246981430830173, 'depth': 10, 'boosting_type': 'Plain', 'bootstrap_type': 'Bayesian', 'bagging_temperature': 8.452883985095342}. Best is trial 205 with value: 0.890909090909091.
[32m[I 2023-04-20 23:24:21,091][39m Trial 1288 finished with value: 0.8727272727272727 and parameters: {'objective': 'Logloss', 'colsample_bylevel': 0.09721164505384945, 'depth': 8, 'boosting_type': 'Plain', 'bootstrap_type': 'Bernoulli', 'subsample': 0.33934993702607097}. Best is trial 205 with value: 0.890909090909091.
[32m[I 2023-04-20 23:24:21,825][39m Trial 1289 finished with value: 0.8727272727272727 and parameters: {'objective': 'Logloss', 'colsample_bylevel': 0.09998740387133101, 'depth': 12, 'boosting_type': 'Plain', 'bootstrap_type': 'Bayesian', 'bagging_temperature': 4.886711693862788}. Best is trial 205 with value: 0.890909090909091.
[32m[I 2023-04-20 23:24:22,734][39m Trial 1290 finished with value: 0.8807339449541284 and parameters: {'objective': 'Logloss', 'colsample_bylevel': 0.09723294445664211, 'depth': 8, 'boosting_type': 'Plain', 'bootstrap_type': 'Bayesian', 'bagging_temperature': 3.821326306758291}. Best is trial 205 with value: 0.890909090909091.
[32m[I 2023-04-20 23:24:23,896][39m Trial 1291 finished with value: 0.8421052631578947 and parameters: {'objective': 'Logloss', 'colsample_bylevel': 0.09135014248307459, 'depth': 6, 'boosting_type': 'Plain', 'bootstrap_type': 'Bayesian', 'bagging_temperature': 2.7201256291889058}. Best is trial 205 with value: 0.890909090909091.
[32m[I 2023-04-20 23:24:24,910][39m Trial 1292 finished with value: 0.888888888888889 and parameters: {'objective': 'CrossEntropy', 'colsample_bylevel': 0.08847132745832026, 'depth': 10, 'boosting_type': 'Plain', 'bootstrap_type': 'Bayesian', 'bagging_temperature': 2.3680708678015825}. Best is trial 205 with value: 0.890909090909091.
[32m[I 2023-04-20 23:24:26,171][39m Trial 1293 finished with value: 0.8727272727272727 and parameters: {'objective': 'Logloss', 'colsample_bylevel': 0.09804072594303137, 'depth': 7, 'boosting_type': 'Plain', 'bootstrap_type': 'Bayesian', 'bagging_temperature': 3.8297220805579}. Best is trial 205 with value: 0.890909090909091.
[32m[I 2023-04-20 23:24:26,932][39m Trial 1294 finished with value: 0.8521739130434783 and parameters: {'objective': 'Logloss', 'colsample_bylevel': 0.0533184932906174, 'depth': 12, 'boosting_type': 'Plain', 'bootstrap_type': 'Bayesian', 'bagging_temperature': 4.77438692735039}. Best is trial 205 with value: 0.890909090909091.
[32m[I 2023-04-20 23:24:27,800][39m Trial 1295 finished with value: 0.8596491228070176 and parameters: {'objective': 'Logloss', 'colsample_bylevel': 0.08866458135819873, 'depth': 9, 'boosting_type': 'Plain', 'bootstrap_type': 'Bayesian', 'bagging_temperature': 5.105656580054809}. Best is trial 205 with value: 0.890909090909091.
[32m[I 2023-04-20 23:24:28,423][39m Trial 1296 finished with value: 0.8598130841121495 and parameters: {'objective': 'CrossEntropy', 'colsample_bylevel': 0.0961005342559479, 'depth': 10, 'boosting_type': 'Plain', 'bootstrap_type': 'Bayesian', 'bagging_temperature': 5.892600600157136}. Best is trial 205 with value: 0.890909090909091.
[32m[I 2023-04-20 23:24:29,502][39m Trial 1297 finished with value: 0.8448275862068967 and parameters: {'objective': 'CrossEntropy', 'colsample_bylevel': 0.03325723690186942, 'depth': 10, 'boosting_type': 'Plain', 'bootstrap_type': 'Bayesian', 'bagging_temperature': 7.224095204223354}. Best is trial 205 with value: 0.890909090909091.
[32m[I 2023-04-20 23:24:30,995][39m Trial 1298 finished with value: 0.888888888888889 and parameters: {'objective': 'Logloss', 'colsample_bylevel': 0.09981399737006541, 'depth': 9, 'boosting_type': 'Plain', 'bootstrap_type': 'Bayesian', 'bagging_temperature': 5.145223886147154}. Best is trial 205 with value: 0.890909090909091.
[32m[I 2023-04-20 23:24:31,594][39m Trial 1299 finished with value: 0.8545454545454546 and parameters: {'objective': 'Logloss', 'colsample_bylevel': 0.09992235804290137, 'depth': 6, 'boosting_type': 'Plain', 'bootstrap_type': 'Bayesian', 'bagging_temperature': 5.208505529110889}. Best is trial 205 with value: 0.890909090909091.
[32m[I 2023-04-20 23:24:32,707][39m Trial 1300 finished with value: 0.8807339449541284 and parameters: {'objective': 'Logloss', 'colsample_bylevel': 0.09594668683872015, 'depth': 7, 'boosting_type': 'Plain', 'bootstrap_type': 'Bayesian', 'bagging_temperature': 4.337190884055563}. Best is trial 205 with value: 0.890909090909091.
[32m[I 2023-04-20 23:24:38,048][39m Trial 1301 finished with value: 0.8347826086956522 and parameters: {'objective': 'Logloss', 'colsample_bylevel': 0.09505068247196173, 'depth': 11, 'boosting_type': 'Ordered', 'bootstrap_type': 'Bayesian', 'bagging_temperature': 4.00140567185417}. Best is trial 205 with value: 0.890909090909091.
[32m[I 2023-04-20 23:24:39,385][39m Trial 1302 finished with value: 0.8727272727272727 and parameters: {'objective': 'CrossEntropy', 'colsample_bylevel': 0.09682063968852518, 'depth': 9, 'boosting_type': 'Plain', 'bootstrap_type': 'Bayesian', 'bagging_temperature': 3.4807647842986182}. Best is trial 205 with value: 0.890909090909091.
[32m[I 2023-04-20 23:24:40,843][39m Trial 1303 finished with value: 0.8807339449541284 and parameters: {'objective': 'Logloss', 'colsample_bylevel': 0.09909140357917474, 'depth': 8, 'boosting_type': 'Plain', 'bootstrap_type': 'Bayesian', 'bagging_temperature': 5.460565464682415}. Best is trial 205 with value: 0.890909090909091.
[32m[I 2023-04-20 23:24:41,572][39m Trial 1304 finished with value: 0.8596491228070176 and parameters: {'objective': 'Logloss', 'colsample_bylevel': 0.0949551798434354, 'depth': 11, 'boosting_type': 'Plain', 'bootstrap_type': 'MVS'}. Best is trial 205 with value: 0.890909090909091.
[32m[I 2023-04-20 23:24:42,306][39m Trial 1305 finished with value: 0.888888888888889 and parameters: {'objective': 'CrossEntropy', 'colsample_bylevel': 0.09632422901336586, 'depth': 11, 'boosting_type': 'Plain', 'bootstrap_type': 'Bayesian', 'bagging_temperature': 6.5647286800132525}. Best is trial 205 with value: 0.890909090909091.
[32m[I 2023-04-20 23:24:43,121][39m Trial 1306 finished with value: 0.8727272727272727 and parameters: {'objective': 'CrossEntropy', 'colsample_bylevel': 0.09367828763229541, 'depth': 10, 'boosting_type': 'Plain', 'bootstrap_type': 'Bayesian', 'bagging_temperature': 3.126185063004621}. Best is trial 205 with value: 0.890909090909091.
[32m[I 2023-04-20 23:24:44,069][39m Trial 1307 finished with value: 0.8727272727272727 and parameters: {'objective': 'CrossEntropy', 'colsample_bylevel': 0.0958809129412347, 'depth': 6, 'boosting_type': 'Plain', 'bootstrap_type': 'Bayesian', 'bagging_temperature': 5.7818975187602675}. Best is trial 205 with value: 0.890909090909091.
[32m[I 2023-04-20 23:24:45,134][39m Trial 1308 finished with value: 0.8703703703703703 and parameters: {'objective': 'Logloss', 'colsample_bylevel': 0.09814844588953316, 'depth': 6, 'boosting_type': 'Plain', 'bootstrap_type': 'Bayesian', 'bagging_temperature': 6.088640742592784}. Best is trial 205 with value: 0.890909090909091.
[32m[I 2023-04-20 23:24:46,029][39m Trial 1309 finished with value: 0.8545454545454546 and parameters: {'objective': 'Logloss', 'colsample_bylevel': 0.09557268278200326, 'depth': 7, 'boosting_type': 'Plain', 'bootstrap_type': 'Bernoulli', 'subsample': 0.24241937408341974}. Best is trial 205 with value: 0.890909090909091.
[32m[I 2023-04-20 23:24:47,193][39m Trial 1310 finished with value: 0.8807339449541284 and parameters: {'objective': 'CrossEntropy', 'colsample_bylevel': 0.09278221644367984, 'depth': 11, 'boosting_type': 'Plain', 'bootstrap_type': 'Bayesian', 'bagging_temperature': 6.760318711628776}. Best is trial 205 with value: 0.890909090909091.
[32m[I 2023-04-20 23:24:47,916][39m Trial 1311 finished with value: 0.8727272727272727 and parameters: {'objective': 'CrossEntropy', 'colsample_bylevel': 0.09059389174662125, 'depth': 11, 'boosting_type': 'Plain', 'bootstrap_type': 'Bayesian', 'bagging_temperature': 5.512601946712676}. Best is trial 205 with value: 0.890909090909091.
[32m[I 2023-04-20 23:24:48,671][39m Trial 1312 finished with value: 0.8727272727272727 and parameters: {'objective': 'Logloss', 'colsample_bylevel': 0.09174326469258799, 'depth': 11, 'boosting_type': 'Plain', 'bootstrap_type': 'Bayesian', 'bagging_temperature': 5.323176156657443}. Best is trial 205 with value: 0.890909090909091.
[32m[I 2023-04-20 23:24:49,915][39m Trial 1313 finished with value: 0.8727272727272727 and parameters: {'objective': 'Logloss', 'colsample_bylevel': 0.09743141006115254, 'depth': 7, 'boosting_type': 'Plain', 'bootstrap_type': 'Bayesian', 'bagging_temperature': 6.468662318696281}. Best is trial 205 with value: 0.890909090909091.
[32m[I 2023-04-20 23:24:51,356][39m Trial 1314 finished with value: 0.8807339449541284 and parameters: {'objective': 'Logloss', 'colsample_bylevel': 0.09998586663119319, 'depth': 9, 'boosting_type': 'Plain', 'bootstrap_type': 'Bayesian', 'bagging_temperature': 4.668899938278355}. Best is trial 205 with value: 0.890909090909091.
[32m[I 2023-04-20 23:24:51,929][39m Trial 1315 finished with value: 0.8727272727272727 and parameters: {'objective': 'CrossEntropy', 'colsample_bylevel': 0.09816692785730037, 'depth': 12, 'boosting_type': 'Plain', 'bootstrap_type': 'Bayesian', 'bagging_temperature': 4.6009910769761015}. Best is trial 205 with value: 0.890909090909091.
[32m[I 2023-04-20 23:24:53,131][39m Trial 1316 finished with value: 0.8703703703703703 and parameters: {'objective': 'Logloss', 'colsample_bylevel': 0.09035487511017139, 'depth': 7, 'boosting_type': 'Plain', 'bootstrap_type': 'Bayesian', 'bagging_temperature': 5.162810330236343}. Best is trial 205 with value: 0.890909090909091.
[32m[I 2023-04-20 23:24:54,671][39m Trial 1317 finished with value: 0.8807339449541284 and parameters: {'objective': 'Logloss', 'colsample_bylevel': 0.09973881994563004, 'depth': 8, 'boosting_type': 'Plain', 'bootstrap_type': 'Bayesian', 'bagging_temperature': 3.5817279211651183}. Best is trial 205 with value: 0.890909090909091.
[32m[I 2023-04-20 23:24:55,601][39m Trial 1318 finished with value: 0.8703703703703703 and parameters: {'objective': 'Logloss', 'colsample_bylevel': 0.09778782215488029, 'depth': 6, 'boosting_type': 'Plain', 'bootstrap_type': 'Bayesian', 'bagging_temperature': 4.2160587104382}. Best is trial 205 with value: 0.890909090909091.
[32m[I 2023-04-20 23:25:00,630][39m Trial 1319 finished with value: 0.8571428571428572 and parameters: {'objective': 'Logloss', 'colsample_bylevel': 0.09710073598117867, 'depth': 7, 'boosting_type': 'Ordered', 'bootstrap_type': 'Bayesian', 'bagging_temperature': 5.7053842931321155}. Best is trial 205 with value: 0.890909090909091.
[32m[I 2023-04-20 23:25:01,994][39m Trial 1320 finished with value: 0.8703703703703703 and parameters: {'objective': 'Logloss', 'colsample_bylevel': 0.09405569805979572, 'depth': 6, 'boosting_type': 'Plain', 'bootstrap_type': 'Bayesian', 'bagging_temperature': 5.507865778882033}. Best is trial 205 with value: 0.890909090909091.
[32m[I 2023-04-20 23:25:02,795][39m Trial 1321 finished with value: 0.8828828828828829 and parameters: {'objective': 'Logloss', 'colsample_bylevel': 0.09398983859376413, 'depth': 7, 'boosting_type': 'Plain', 'bootstrap_type': 'Bayesian', 'bagging_temperature': 9.38020967867331}. Best is trial 205 with value: 0.890909090909091.
[32m[I 2023-04-20 23:25:03,771][39m Trial 1322 finished with value: 0.8828828828828829 and parameters: {'objective': 'CrossEntropy', 'colsample_bylevel': 0.09186991205631666, 'depth': 10, 'boosting_type': 'Plain', 'bootstrap_type': 'Bayesian', 'bagging_temperature': 5.4720817556142585}. Best is trial 205 with value: 0.890909090909091.
[32m[I 2023-04-20 23:25:04,861][39m Trial 1323 finished with value: 0.8376068376068375 and parameters: {'objective': 'CrossEntropy', 'colsample_bylevel': 0.046008431331864406, 'depth': 10, 'boosting_type': 'Plain', 'bootstrap_type': 'Bayesian', 'bagging_temperature': 6.562030004523944}. Best is trial 205 with value: 0.890909090909091.
[32m[I 2023-04-20 23:25:06,195][39m Trial 1324 finished with value: 0.8727272727272727 and parameters: {'objective': 'Logloss', 'colsample_bylevel': 0.09453480323843037, 'depth': 9, 'boosting_type': 'Plain', 'bootstrap_type': 'Bayesian', 'bagging_temperature': 5.592000951977196}. Best is trial 205 with value: 0.890909090909091.
