[32m[I 2023-04-20 23:22:25,990][39m Trial 1193 finished with value: 0.8727272727272727 and parameters: {'objective': 'Logloss', 'colsample_bylevel': 0.09772036632740737, 'depth': 8, 'boosting_type': 'Plain', 'bootstrap_type': 'Bayesian', 'bagging_temperature': 6.3261676659677635}. Best is trial 205 with value: 0.890909090909091.
[32m[I 2023-04-20 23:22:26,833][39m Trial 1194 finished with value: 0.8807339449541284 and parameters: {'objective': 'Logloss', 'colsample_bylevel': 0.09679554150063345, 'depth': 9, 'boosting_type': 'Plain', 'bootstrap_type': 'Bayesian', 'bagging_temperature': 5.064810530832622}. Best is trial 205 with value: 0.890909090909091.
[32m[I 2023-04-20 23:22:27,415][39m Trial 1195 finished with value: 0.8305084745762712 and parameters: {'objective': 'Logloss', 'colsample_bylevel': 0.028931016276444226, 'depth': 9, 'boosting_type': 'Plain', 'bootstrap_type': 'Bayesian', 'bagging_temperature': 5.025598758509168}. Best is trial 205 with value: 0.890909090909091.
[32m[I 2023-04-20 23:22:28,384][39m Trial 1196 finished with value: 0.8807339449541284 and parameters: {'objective': 'Logloss', 'colsample_bylevel': 0.0982572815939492, 'depth': 6, 'boosting_type': 'Plain', 'bootstrap_type': 'Bayesian', 'bagging_temperature': 6.388627449055615}. Best is trial 205 with value: 0.890909090909091.
[32m[I 2023-04-20 23:22:29,373][39m Trial 1197 finished with value: 0.8598130841121495 and parameters: {'objective': 'Logloss', 'colsample_bylevel': 0.09552719849443811, 'depth': 11, 'boosting_type': 'Plain', 'bootstrap_type': 'Bayesian', 'bagging_temperature': 4.325057573870914}. Best is trial 205 with value: 0.890909090909091.
[32m[I 2023-04-20 23:22:30,293][39m Trial 1198 finished with value: 0.8727272727272727 and parameters: {'objective': 'Logloss', 'colsample_bylevel': 0.09694576461833423, 'depth': 9, 'boosting_type': 'Plain', 'bootstrap_type': 'Bayesian', 'bagging_temperature': 5.061793113142378}. Best is trial 205 with value: 0.890909090909091.
[32m[I 2023-04-20 23:22:31,131][39m Trial 1199 finished with value: 0.8807339449541284 and parameters: {'objective': 'CrossEntropy', 'colsample_bylevel': 0.09173388602359883, 'depth': 10, 'boosting_type': 'Plain', 'bootstrap_type': 'Bayesian', 'bagging_temperature': 3.056445879740893}. Best is trial 205 with value: 0.890909090909091.
[32m[I 2023-04-20 23:22:32,278][39m Trial 1200 finished with value: 0.888888888888889 and parameters: {'objective': 'Logloss', 'colsample_bylevel': 0.09956981105789235, 'depth': 8, 'boosting_type': 'Plain', 'bootstrap_type': 'Bayesian', 'bagging_temperature': 3.523333953314812}. Best is trial 205 with value: 0.890909090909091.
[32m[I 2023-04-20 23:22:33,003][39m Trial 1201 finished with value: 0.8571428571428572 and parameters: {'objective': 'CrossEntropy', 'colsample_bylevel': 0.08930646126882627, 'depth': 10, 'boosting_type': 'Plain', 'bootstrap_type': 'Bernoulli', 'subsample': 0.7209214469224996}. Best is trial 205 with value: 0.890909090909091.
[32m[I 2023-04-20 23:22:34,141][39m Trial 1202 finished with value: 0.8727272727272727 and parameters: {'objective': 'Logloss', 'colsample_bylevel': 0.09777868684052833, 'depth': 10, 'boosting_type': 'Plain', 'bootstrap_type': 'Bayesian', 'bagging_temperature': 4.33598911476594}. Best is trial 205 with value: 0.890909090909091.
[32m[I 2023-04-20 23:22:35,341][39m Trial 1203 finished with value: 0.8807339449541284 and parameters: {'objective': 'Logloss', 'colsample_bylevel': 0.0962496856432039, 'depth': 8, 'boosting_type': 'Plain', 'bootstrap_type': 'Bayesian', 'bagging_temperature': 5.358946531845588}. Best is trial 205 with value: 0.890909090909091.
[32m[I 2023-04-20 23:22:36,137][39m Trial 1204 finished with value: 0.888888888888889 and parameters: {'objective': 'CrossEntropy', 'colsample_bylevel': 0.0933263240675053, 'depth': 10, 'boosting_type': 'Plain', 'bootstrap_type': 'Bayesian', 'bagging_temperature': 5.56567640956421}. Best is trial 205 with value: 0.890909090909091.
[32m[I 2023-04-20 23:22:36,970][39m Trial 1205 finished with value: 0.8648648648648648 and parameters: {'objective': 'CrossEntropy', 'colsample_bylevel': 0.09371884587471939, 'depth': 10, 'boosting_type': 'Plain', 'bootstrap_type': 'Bayesian', 'bagging_temperature': 4.297354145748866}. Best is trial 205 with value: 0.890909090909091.
[32m[I 2023-04-20 23:22:38,000][39m Trial 1206 finished with value: 0.8648648648648648 and parameters: {'objective': 'CrossEntropy', 'colsample_bylevel': 0.09003203585308983, 'depth': 10, 'boosting_type': 'Plain', 'bootstrap_type': 'Bayesian', 'bagging_temperature': 4.37469654999918}. Best is trial 205 with value: 0.890909090909091.
[32m[I 2023-04-20 23:22:43,256][39m Trial 1207 finished with value: 0.8571428571428572 and parameters: {'objective': 'Logloss', 'colsample_bylevel': 0.09968581680070461, 'depth': 7, 'boosting_type': 'Ordered', 'bootstrap_type': 'Bayesian', 'bagging_temperature': 5.722415039533755}. Best is trial 205 with value: 0.890909090909091.
[32m[I 2023-04-20 23:22:44,275][39m Trial 1208 finished with value: 0.8828828828828829 and parameters: {'objective': 'Logloss', 'colsample_bylevel': 0.09807918177237654, 'depth': 12, 'boosting_type': 'Plain', 'bootstrap_type': 'Bayesian', 'bagging_temperature': 3.9517396604037818}. Best is trial 205 with value: 0.890909090909091.
[32m[I 2023-04-20 23:22:45,230][39m Trial 1209 finished with value: 0.875 and parameters: {'objective': 'Logloss', 'colsample_bylevel': 0.0998377596528933, 'depth': 8, 'boosting_type': 'Plain', 'bootstrap_type': 'Bayesian', 'bagging_temperature': 4.8047624372090905}. Best is trial 205 with value: 0.890909090909091.
[32m[I 2023-04-20 23:22:46,379][39m Trial 1210 finished with value: 0.8807339449541284 and parameters: {'objective': 'CrossEntropy', 'colsample_bylevel': 0.09434083361764438, 'depth': 9, 'boosting_type': 'Plain', 'bootstrap_type': 'Bayesian', 'bagging_temperature': 5.937964812907843}. Best is trial 205 with value: 0.890909090909091.
[32m[I 2023-04-20 23:22:47,444][39m Trial 1211 finished with value: 0.888888888888889 and parameters: {'objective': 'Logloss', 'colsample_bylevel': 0.09282860384478678, 'depth': 10, 'boosting_type': 'Plain', 'bootstrap_type': 'Bayesian', 'bagging_temperature': 5.299329740406982}. Best is trial 205 with value: 0.890909090909091.
[32m[I 2023-04-20 23:22:48,064][39m Trial 1212 finished with value: 0.8571428571428572 and parameters: {'objective': 'CrossEntropy', 'colsample_bylevel': 0.09526987796221113, 'depth': 10, 'boosting_type': 'Plain', 'bootstrap_type': 'MVS'}. Best is trial 205 with value: 0.890909090909091.
[32m[I 2023-04-20 23:22:48,794][39m Trial 1213 finished with value: 0.8421052631578947 and parameters: {'objective': 'CrossEntropy', 'colsample_bylevel': 0.09203737677579941, 'depth': 10, 'boosting_type': 'Plain', 'bootstrap_type': 'Bayesian', 'bagging_temperature': 1.3607245908669003}. Best is trial 205 with value: 0.890909090909091.
[32m[I 2023-04-20 23:22:50,048][39m Trial 1214 finished with value: 0.8421052631578947 and parameters: {'objective': 'Logloss', 'colsample_bylevel': 0.09356521105768005, 'depth': 6, 'boosting_type': 'Plain', 'bootstrap_type': 'Bayesian', 'bagging_temperature': 5.2988175587682145}. Best is trial 205 with value: 0.890909090909091.
[32m[I 2023-04-20 23:22:51,013][39m Trial 1215 finished with value: 0.8807339449541284 and parameters: {'objective': 'Logloss', 'colsample_bylevel': 0.08861430544585067, 'depth': 9, 'boosting_type': 'Plain', 'bootstrap_type': 'Bayesian', 'bagging_temperature': 4.597987223839326}. Best is trial 205 with value: 0.890909090909091.
[32m[I 2023-04-20 23:22:51,953][39m Trial 1216 finished with value: 0.888888888888889 and parameters: {'objective': 'CrossEntropy', 'colsample_bylevel': 0.09384842666093841, 'depth': 11, 'boosting_type': 'Plain', 'bootstrap_type': 'Bayesian', 'bagging_temperature': 4.547188668417331}. Best is trial 205 with value: 0.890909090909091.
[32m[I 2023-04-20 23:22:53,320][39m Trial 1217 finished with value: 0.888888888888889 and parameters: {'objective': 'CrossEntropy', 'colsample_bylevel': 0.09655690002668552, 'depth': 9, 'boosting_type': 'Plain', 'bootstrap_type': 'Bayesian', 'bagging_temperature': 6.5359687257153505}. Best is trial 205 with value: 0.890909090909091.
[32m[I 2023-04-20 23:22:54,083][39m Trial 1218 finished with value: 0.8596491228070176 and parameters: {'objective': 'CrossEntropy', 'colsample_bylevel': 0.0932849610139546, 'depth': 12, 'boosting_type': 'Plain', 'bootstrap_type': 'Bayesian', 'bagging_temperature': 5.320542941249968}. Best is trial 205 with value: 0.890909090909091.
[32m[I 2023-04-20 23:22:54,837][39m Trial 1219 finished with value: 0.8571428571428572 and parameters: {'objective': 'Logloss', 'colsample_bylevel': 0.09066830204516674, 'depth': 8, 'boosting_type': 'Plain', 'bootstrap_type': 'Bayesian', 'bagging_temperature': 5.438227451245727}. Best is trial 205 with value: 0.890909090909091.
[32m[I 2023-04-20 23:22:56,060][39m Trial 1220 finished with value: 0.8807339449541284 and parameters: {'objective': 'CrossEntropy', 'colsample_bylevel': 0.09535929470152543, 'depth': 7, 'boosting_type': 'Plain', 'bootstrap_type': 'Bayesian', 'bagging_temperature': 6.734496271360579}. Best is trial 205 with value: 0.890909090909091.
[32m[I 2023-04-20 23:22:56,625][39m Trial 1221 finished with value: 0.8703703703703703 and parameters: {'objective': 'CrossEntropy', 'colsample_bylevel': 0.09117054262599711, 'depth': 10, 'boosting_type': 'Plain', 'bootstrap_type': 'Bayesian', 'bagging_temperature': 7.2402973368106665}. Best is trial 205 with value: 0.890909090909091.
[32m[I 2023-04-20 23:22:57,702][39m Trial 1222 finished with value: 0.8807339449541284 and parameters: {'objective': 'Logloss', 'colsample_bylevel': 0.09665164295797167, 'depth': 10, 'boosting_type': 'Plain', 'bootstrap_type': 'Bernoulli', 'subsample': 0.3887873409255216}. Best is trial 205 with value: 0.890909090909091.
[32m[I 2023-04-20 23:22:58,847][39m Trial 1223 finished with value: 0.8807339449541284 and parameters: {'objective': 'CrossEntropy', 'colsample_bylevel': 0.09596445863753451, 'depth': 7, 'boosting_type': 'Plain', 'bootstrap_type': 'Bayesian', 'bagging_temperature': 5.97721951806828}. Best is trial 205 with value: 0.890909090909091.
[32m[I 2023-04-20 23:22:59,875][39m Trial 1224 finished with value: 0.8703703703703703 and parameters: {'objective': 'Logloss', 'colsample_bylevel': 0.09471248895841089, 'depth': 7, 'boosting_type': 'Plain', 'bootstrap_type': 'Bayesian', 'bagging_temperature': 6.1146109006637746}. Best is trial 205 with value: 0.890909090909091.
[32m[I 2023-04-20 23:23:01,063][39m Trial 1225 finished with value: 0.8205128205128206 and parameters: {'objective': 'Logloss', 'colsample_bylevel': 0.012894117225613663, 'depth': 9, 'boosting_type': 'Plain', 'bootstrap_type': 'Bayesian', 'bagging_temperature': 6.1346880991531965}. Best is trial 205 with value: 0.890909090909091.
[32m[I 2023-04-20 23:23:06,001][39m Trial 1226 finished with value: 0.8421052631578947 and parameters: {'objective': 'CrossEntropy', 'colsample_bylevel': 0.0890909375857672, 'depth': 10, 'boosting_type': 'Ordered', 'bootstrap_type': 'Bayesian', 'bagging_temperature': 9.36824490933008}. Best is trial 205 with value: 0.890909090909091.
[32m[I 2023-04-20 23:23:07,069][39m Trial 1227 finished with value: 0.8596491228070176 and parameters: {'objective': 'Logloss', 'colsample_bylevel': 0.09400458026656659, 'depth': 10, 'boosting_type': 'Plain', 'bootstrap_type': 'Bayesian', 'bagging_temperature': 4.956972243741486}. Best is trial 205 with value: 0.890909090909091.
[32m[I 2023-04-20 23:23:08,155][39m Trial 1228 finished with value: 0.8648648648648648 and parameters: {'objective': 'CrossEntropy', 'colsample_bylevel': 0.05744604691445086, 'depth': 12, 'boosting_type': 'Plain', 'bootstrap_type': 'Bayesian', 'bagging_temperature': 5.445518316869456}. Best is trial 205 with value: 0.890909090909091.
[32m[I 2023-04-20 23:23:08,909][39m Trial 1229 finished with value: 0.8807339449541284 and parameters: {'objective': 'Logloss', 'colsample_bylevel': 0.09809703074798161, 'depth': 7, 'boosting_type': 'Plain', 'bootstrap_type': 'Bayesian', 'bagging_temperature': 6.977917240963219}. Best is trial 205 with value: 0.890909090909091.
[32m[I 2023-04-20 23:23:10,090][39m Trial 1230 finished with value: 0.8807339449541284 and parameters: {'objective': 'CrossEntropy', 'colsample_bylevel': 0.0960781266757156, 'depth': 9, 'boosting_type': 'Plain', 'bootstrap_type': 'Bayesian', 'bagging_temperature': 4.476906342258242}. Best is trial 205 with value: 0.890909090909091.
[32m[I 2023-04-20 23:23:10,877][39m Trial 1231 finished with value: 0.8828828828828829 and parameters: {'objective': 'CrossEntropy', 'colsample_bylevel': 0.0879520525709166, 'depth': 7, 'boosting_type': 'Plain', 'bootstrap_type': 'Bayesian', 'bagging_temperature': 4.165237686575485}. Best is trial 205 with value: 0.890909090909091.
[32m[I 2023-04-20 23:23:11,810][39m Trial 1232 finished with value: 0.888888888888889 and parameters: {'objective': 'CrossEntropy', 'colsample_bylevel': 0.09076731208784718, 'depth': 10, 'boosting_type': 'Plain', 'bootstrap_type': 'Bayesian', 'bagging_temperature': 5.87887268453601}. Best is trial 205 with value: 0.890909090909091.
[32m[I 2023-04-20 23:23:12,610][39m Trial 1233 finished with value: 0.8785046728971961 and parameters: {'objective': 'CrossEntropy', 'colsample_bylevel': 0.09072471379886039, 'depth': 11, 'boosting_type': 'Plain', 'bootstrap_type': 'Bayesian', 'bagging_temperature': 4.000327307154614}. Best is trial 205 with value: 0.890909090909091.
[32m[I 2023-04-20 23:23:13,849][39m Trial 1234 finished with value: 0.8807339449541284 and parameters: {'objective': 'CrossEntropy', 'colsample_bylevel': 0.0871693978512448, 'depth': 10, 'boosting_type': 'Plain', 'bootstrap_type': 'Bayesian', 'bagging_temperature': 5.790174265615409}. Best is trial 205 with value: 0.890909090909091.
[32m[I 2023-04-20 23:23:14,724][39m Trial 1235 finished with value: 0.8571428571428572 and parameters: {'objective': 'CrossEntropy', 'colsample_bylevel': 0.09211822166079267, 'depth': 10, 'boosting_type': 'Plain', 'bootstrap_type': 'Bayesian', 'bagging_temperature': 8.818070348073}. Best is trial 205 with value: 0.890909090909091.
[32m[I 2023-04-20 23:23:15,479][39m Trial 1236 finished with value: 0.875 and parameters: {'objective': 'Logloss', 'colsample_bylevel': 0.09815893644431484, 'depth': 6, 'boosting_type': 'Plain', 'bootstrap_type': 'Bayesian', 'bagging_temperature': 4.8884552957564456}. Best is trial 205 with value: 0.890909090909091.
[32m[I 2023-04-20 23:23:16,164][39m Trial 1237 finished with value: 0.8727272727272727 and parameters: {'objective': 'Logloss', 'colsample_bylevel': 0.0949896951283933, 'depth': 11, 'boosting_type': 'Plain', 'bootstrap_type': 'Bayesian', 'bagging_temperature': 5.657032654060086}. Best is trial 205 with value: 0.890909090909091.
[32m[I 2023-04-20 23:23:17,491][39m Trial 1238 finished with value: 0.8727272727272727 and parameters: {'objective': 'Logloss', 'colsample_bylevel': 0.0983339334534584, 'depth': 9, 'boosting_type': 'Plain', 'bootstrap_type': 'Bayesian', 'bagging_temperature': 5.797615525873913}. Best is trial 205 with value: 0.890909090909091.
[32m[I 2023-04-20 23:23:18,234][39m Trial 1239 finished with value: 0.8727272727272727 and parameters: {'objective': 'Logloss', 'colsample_bylevel': 0.0930801893762029, 'depth': 11, 'boosting_type': 'Plain', 'bootstrap_type': 'Bayesian', 'bagging_temperature': 3.1908687528338278}. Best is trial 205 with value: 0.890909090909091.
[32m[I 2023-04-20 23:23:19,468][39m Trial 1240 finished with value: 0.8648648648648648 and parameters: {'objective': 'CrossEntropy', 'colsample_bylevel': 0.09982771867567644, 'depth': 8, 'boosting_type': 'Plain', 'bootstrap_type': 'MVS'}. Best is trial 205 with value: 0.890909090909091.
[32m[I 2023-04-20 23:23:20,220][39m Trial 1241 finished with value: 0.8727272727272727 and parameters: {'objective': 'Logloss', 'colsample_bylevel': 0.09709890073243381, 'depth': 8, 'boosting_type': 'Plain', 'bootstrap_type': 'Bayesian', 'bagging_temperature': 3.4123760770156806}. Best is trial 205 with value: 0.890909090909091.
[32m[I 2023-04-20 23:23:21,463][39m Trial 1242 finished with value: 0.8347826086956522 and parameters: {'objective': 'Logloss', 'colsample_bylevel': 0.04938308558680035, 'depth': 8, 'boosting_type': 'Plain', 'bootstrap_type': 'Bayesian', 'bagging_temperature': 5.182589777644365}. Best is trial 205 with value: 0.890909090909091.
[32m[I 2023-04-20 23:23:22,844][39m Trial 1243 finished with value: 0.888888888888889 and parameters: {'objective': 'Logloss', 'colsample_bylevel': 0.09643752118415655, 'depth': 9, 'boosting_type': 'Plain', 'bootstrap_type': 'Bayesian', 'bagging_temperature': 4.735724549292851}. Best is trial 205 with value: 0.890909090909091.
[32m[I 2023-04-20 23:23:28,166][39m Trial 1244 finished with value: 0.8421052631578947 and parameters: {'objective': 'Logloss', 'colsample_bylevel': 0.09644885808732565, 'depth': 10, 'boosting_type': 'Ordered', 'bootstrap_type': 'Bernoulli', 'subsample': 0.5900614939274973}. Best is trial 205 with value: 0.890909090909091.
[32m[I 2023-04-20 23:23:29,146][39m Trial 1245 finished with value: 0.8571428571428572 and parameters: {'objective': 'Logloss', 'colsample_bylevel': 0.09398807364823651, 'depth': 6, 'boosting_type': 'Plain', 'bootstrap_type': 'Bayesian', 'bagging_temperature': 5.011727670901753}. Best is trial 205 with value: 0.890909090909091.
[32m[I 2023-04-20 23:23:30,340][39m Trial 1246 finished with value: 0.8703703703703703 and parameters: {'objective': 'CrossEntropy', 'colsample_bylevel': 0.09999851358400472, 'depth': 11, 'boosting_type': 'Plain', 'bootstrap_type': 'Bayesian', 'bagging_temperature': 5.630649092768686}. Best is trial 205 with value: 0.890909090909091.
[32m[I 2023-04-20 23:23:31,602][39m Trial 1247 finished with value: 0.8703703703703703 and parameters: {'objective': 'CrossEntropy', 'colsample_bylevel': 0.09805723715228747, 'depth': 12, 'boosting_type': 'Plain', 'bootstrap_type': 'Bayesian', 'bagging_temperature': 9.017451457282514}. Best is trial 205 with value: 0.890909090909091.
[32m[I 2023-04-20 23:23:32,304][39m Trial 1248 finished with value: 0.8807339449541284 and parameters: {'objective': 'CrossEntropy', 'colsample_bylevel': 0.09802863785199128, 'depth': 12, 'boosting_type': 'Plain', 'bootstrap_type': 'Bayesian', 'bagging_temperature': 9.73531941393744}. Best is trial 205 with value: 0.890909090909091.
[32m[I 2023-04-20 23:23:33,518][39m Trial 1249 finished with value: 0.8807339449541284 and parameters: {'objective': 'Logloss', 'colsample_bylevel': 0.09881068806993717, 'depth': 8, 'boosting_type': 'Plain', 'bootstrap_type': 'Bayesian', 'bagging_temperature': 3.7970344274003107}. Best is trial 205 with value: 0.890909090909091.
[32m[I 2023-04-20 23:23:34,476][39m Trial 1250 finished with value: 0.8807339449541284 and parameters: {'objective': 'Logloss', 'colsample_bylevel': 0.09870317034803633, 'depth': 8, 'boosting_type': 'Plain', 'bootstrap_type': 'Bayesian', 'bagging_temperature': 3.998373293522035}. Best is trial 205 with value: 0.890909090909091.
[32m[I 2023-04-20 23:23:35,453][39m Trial 1251 finished with value: 0.8623853211009175 and parameters: {'objective': 'Logloss', 'colsample_bylevel': 0.09273520580468383, 'depth': 10, 'boosting_type': 'Plain', 'bootstrap_type': 'Bayesian', 'bagging_temperature': 4.173941293944088}. Best is trial 205 with value: 0.890909090909091.
[32m[I 2023-04-20 23:23:36,478][39m Trial 1252 finished with value: 0.8727272727272727 and parameters: {'objective': 'Logloss', 'colsample_bylevel': 0.0960971782954439, 'depth': 6, 'boosting_type': 'Plain', 'bootstrap_type': 'Bayesian', 'bagging_temperature': 4.31526681842222}. Best is trial 205 with value: 0.890909090909091.
[32m[I 2023-04-20 23:23:37,981][39m Trial 1253 finished with value: 0.8727272727272727 and parameters: {'objective': 'Logloss', 'colsample_bylevel': 0.09984543112553208, 'depth': 8, 'boosting_type': 'Plain', 'bootstrap_type': 'Bayesian', 'bagging_temperature': 3.730088913614357}. Best is trial 205 with value: 0.890909090909091.
[32m[I 2023-04-20 23:23:38,699][39m Trial 1254 finished with value: 0.8648648648648648 and parameters: {'objective': 'CrossEntropy', 'colsample_bylevel': 0.09236979362069332, 'depth': 9, 'boosting_type': 'Plain', 'bootstrap_type': 'Bayesian', 'bagging_temperature': 3.5518328615138968}. Best is trial 205 with value: 0.890909090909091.
[32m[I 2023-04-20 23:23:39,358][39m Trial 1255 finished with value: 0.8703703703703703 and parameters: {'objective': 'Logloss', 'colsample_bylevel': 0.09855950667280926, 'depth': 5, 'boosting_type': 'Plain', 'bootstrap_type': 'Bayesian', 'bagging_temperature': 5.990651762448655}. Best is trial 205 with value: 0.890909090909091.
[32m[I 2023-04-20 23:23:40,360][39m Trial 1256 finished with value: 0.888888888888889 and parameters: {'objective': 'Logloss', 'colsample_bylevel': 0.09492115053357435, 'depth': 6, 'boosting_type': 'Plain', 'bootstrap_type': 'Bayesian', 'bagging_temperature': 5.640046190419546}. Best is trial 205 with value: 0.890909090909091.
[32m[I 2023-04-20 23:23:41,233][39m Trial 1257 finished with value: 0.8828828828828829 and parameters: {'objective': 'Logloss', 'colsample_bylevel': 0.09024608588306116, 'depth': 6, 'boosting_type': 'Plain', 'bootstrap_type': 'Bayesian', 'bagging_temperature': 5.648954721257774}. Best is trial 205 with value: 0.890909090909091.
[32m[I 2023-04-20 23:23:42,254][39m Trial 1258 finished with value: 0.8495575221238938 and parameters: {'objective': 'Logloss', 'colsample_bylevel': 0.09502786983698121, 'depth': 8, 'boosting_type': 'Plain', 'bootstrap_type': 'MVS'}. Best is trial 205 with value: 0.890909090909091.
