[32m[I 2023-04-20 23:13:58,961][39m Trial 796 finished with value: 0.8727272727272727 and parameters: {'objective': 'CrossEntropy', 'colsample_bylevel': 0.092679129554848, 'depth': 10, 'boosting_type': 'Plain', 'bootstrap_type': 'Bayesian', 'bagging_temperature': 6.548030157175266}. Best is trial 205 with value: 0.890909090909091.
[32m[I 2023-04-20 23:13:59,800][39m Trial 797 finished with value: 0.8807339449541284 and parameters: {'objective': 'Logloss', 'colsample_bylevel': 0.09845107330496852, 'depth': 10, 'boosting_type': 'Plain', 'bootstrap_type': 'Bayesian', 'bagging_temperature': 4.134376407556008}. Best is trial 205 with value: 0.890909090909091.
[32m[I 2023-04-20 23:14:01,374][39m Trial 798 finished with value: 0.8807339449541284 and parameters: {'objective': 'Logloss', 'colsample_bylevel': 0.096059091342247, 'depth': 9, 'boosting_type': 'Plain', 'bootstrap_type': 'Bayesian', 'bagging_temperature': 6.115959565987771}. Best is trial 205 with value: 0.890909090909091.
[32m[I 2023-04-20 23:14:02,820][39m Trial 799 finished with value: 0.8727272727272727 and parameters: {'objective': 'Logloss', 'colsample_bylevel': 0.09850168395759452, 'depth': 9, 'boosting_type': 'Plain', 'bootstrap_type': 'Bayesian', 'bagging_temperature': 5.86271621445127}. Best is trial 205 with value: 0.890909090909091.
[32m[I 2023-04-20 23:14:03,680][39m Trial 800 finished with value: 0.8727272727272727 and parameters: {'objective': 'Logloss', 'colsample_bylevel': 0.09997570097341033, 'depth': 9, 'boosting_type': 'Plain', 'bootstrap_type': 'Bayesian', 'bagging_temperature': 4.653676131036047}. Best is trial 205 with value: 0.890909090909091.
[32m[I 2023-04-20 23:14:04,420][39m Trial 801 finished with value: 0.8672566371681416 and parameters: {'objective': 'CrossEntropy', 'colsample_bylevel': 0.09583955653277924, 'depth': 9, 'boosting_type': 'Plain', 'bootstrap_type': 'Bernoulli', 'subsample': 0.5606253911330414}. Best is trial 205 with value: 0.890909090909091.
[32m[I 2023-04-20 23:14:05,961][39m Trial 802 finished with value: 0.888888888888889 and parameters: {'objective': 'CrossEntropy', 'colsample_bylevel': 0.09681888828746289, 'depth': 9, 'boosting_type': 'Plain', 'bootstrap_type': 'Bayesian', 'bagging_temperature': 4.759199707180491}. Best is trial 205 with value: 0.890909090909091.
[32m[I 2023-04-20 23:14:07,431][39m Trial 803 finished with value: 0.8727272727272727 and parameters: {'objective': 'CrossEntropy', 'colsample_bylevel': 0.09256491632478131, 'depth': 9, 'boosting_type': 'Plain', 'bootstrap_type': 'Bayesian', 'bagging_temperature': 4.743145552180214}. Best is trial 205 with value: 0.890909090909091.
[32m[I 2023-04-20 23:14:08,158][39m Trial 804 finished with value: 0.8807339449541284 and parameters: {'objective': 'Logloss', 'colsample_bylevel': 0.09712979873199251, 'depth': 10, 'boosting_type': 'Plain', 'bootstrap_type': 'Bayesian', 'bagging_temperature': 4.79900383587439}. Best is trial 205 with value: 0.890909090909091.
[32m[I 2023-04-20 23:14:09,058][39m Trial 805 finished with value: 0.8727272727272727 and parameters: {'objective': 'Logloss', 'colsample_bylevel': 0.09432536003958084, 'depth': 10, 'boosting_type': 'Plain', 'bootstrap_type': 'Bayesian', 'bagging_temperature': 4.495355002329773}. Best is trial 205 with value: 0.890909090909091.
[32m[I 2023-04-20 23:14:14,663][39m Trial 806 finished with value: 0.8623853211009175 and parameters: {'objective': 'Logloss', 'colsample_bylevel': 0.09390111481115306, 'depth': 10, 'boosting_type': 'Ordered', 'bootstrap_type': 'Bayesian', 'bagging_temperature': 4.152146080746672}. Best is trial 205 with value: 0.890909090909091.
[32m[I 2023-04-20 23:14:16,125][39m Trial 807 finished with value: 0.8807339449541284 and parameters: {'objective': 'Logloss', 'colsample_bylevel': 0.09998497853534037, 'depth': 9, 'boosting_type': 'Plain', 'bootstrap_type': 'Bayesian', 'bagging_temperature': 4.478692767491588}. Best is trial 205 with value: 0.890909090909091.
[32m[I 2023-04-20 23:14:17,809][39m Trial 808 finished with value: 0.8623853211009175 and parameters: {'objective': 'Logloss', 'colsample_bylevel': 0.09714419325968113, 'depth': 9, 'boosting_type': 'Plain', 'bootstrap_type': 'Bayesian', 'bagging_temperature': 5.495546441741029}. Best is trial 205 with value: 0.890909090909091.
[32m[I 2023-04-20 23:14:18,710][39m Trial 809 finished with value: 0.8648648648648648 and parameters: {'objective': 'CrossEntropy', 'colsample_bylevel': 0.09415842806294036, 'depth': 9, 'boosting_type': 'Plain', 'bootstrap_type': 'Bayesian', 'bagging_temperature': 4.484750279722793}. Best is trial 205 with value: 0.890909090909091.
[32m[I 2023-04-20 23:14:19,349][39m Trial 810 finished with value: 0.8807339449541284 and parameters: {'objective': 'CrossEntropy', 'colsample_bylevel': 0.09664071533479014, 'depth': 10, 'boosting_type': 'Plain', 'bootstrap_type': 'Bayesian', 'bagging_temperature': 4.911005534423947}. Best is trial 205 with value: 0.890909090909091.
[32m[I 2023-04-20 23:14:20,112][39m Trial 811 finished with value: 0.888888888888889 and parameters: {'objective': 'Logloss', 'colsample_bylevel': 0.09705020792134768, 'depth': 10, 'boosting_type': 'Plain', 'bootstrap_type': 'Bayesian', 'bagging_temperature': 6.86725985400571}. Best is trial 205 with value: 0.890909090909091.
[32m[I 2023-04-20 23:14:21,575][39m Trial 812 finished with value: 0.8703703703703703 and parameters: {'objective': 'Logloss', 'colsample_bylevel': 0.09190257335966318, 'depth': 8, 'boosting_type': 'Plain', 'bootstrap_type': 'Bayesian', 'bagging_temperature': 6.86557948924883}. Best is trial 205 with value: 0.890909090909091.
[32m[I 2023-04-20 23:14:23,199][39m Trial 813 finished with value: 0.8828828828828829 and parameters: {'objective': 'CrossEntropy', 'colsample_bylevel': 0.09477024423611421, 'depth': 9, 'boosting_type': 'Plain', 'bootstrap_type': 'Bayesian', 'bagging_temperature': 7.369918325373176}. Best is trial 205 with value: 0.890909090909091.
[32m[I 2023-04-20 23:14:24,134][39m Trial 814 finished with value: 0.8807339449541284 and parameters: {'objective': 'Logloss', 'colsample_bylevel': 0.09174815575735072, 'depth': 8, 'boosting_type': 'Plain', 'bootstrap_type': 'Bayesian', 'bagging_temperature': 3.782020486170811}. Best is trial 205 with value: 0.890909090909091.
[32m[I 2023-04-20 23:14:24,939][39m Trial 815 finished with value: 0.8571428571428572 and parameters: {'objective': 'CrossEntropy', 'colsample_bylevel': 0.09790250748401279, 'depth': 9, 'boosting_type': 'Plain', 'bootstrap_type': 'MVS'}. Best is trial 205 with value: 0.890909090909091.
[32m[I 2023-04-20 23:14:25,461][39m Trial 816 finished with value: 0.888888888888889 and parameters: {'objective': 'CrossEntropy', 'colsample_bylevel': 0.09354731827786485, 'depth': 10, 'boosting_type': 'Plain', 'bootstrap_type': 'Bayesian', 'bagging_temperature': 9.649274579401013}. Best is trial 205 with value: 0.890909090909091.
[32m[I 2023-04-20 23:14:26,175][39m Trial 817 finished with value: 0.8807339449541284 and parameters: {'objective': 'Logloss', 'colsample_bylevel': 0.0978998660967134, 'depth': 11, 'boosting_type': 'Plain', 'bootstrap_type': 'Bayesian', 'bagging_temperature': 7.738134744177085}. Best is trial 205 with value: 0.890909090909091.
[32m[I 2023-04-20 23:14:27,723][39m Trial 818 finished with value: 0.8807339449541284 and parameters: {'objective': 'Logloss', 'colsample_bylevel': 0.0960250165266566, 'depth': 9, 'boosting_type': 'Plain', 'bootstrap_type': 'Bayesian', 'bagging_temperature': 4.731754111851144}. Best is trial 205 with value: 0.890909090909091.
[32m[I 2023-04-20 23:14:28,717][39m Trial 819 finished with value: 0.8495575221238938 and parameters: {'objective': 'Logloss', 'colsample_bylevel': 0.08970758295536933, 'depth': 8, 'boosting_type': 'Plain', 'bootstrap_type': 'Bayesian', 'bagging_temperature': 6.405158936963482}. Best is trial 205 with value: 0.890909090909091.
[32m[I 2023-04-20 23:14:29,776][39m Trial 820 finished with value: 0.8623853211009175 and parameters: {'objective': 'CrossEntropy', 'colsample_bylevel': 0.09571382936432192, 'depth': 9, 'boosting_type': 'Plain', 'bootstrap_type': 'Bayesian', 'bagging_temperature': 4.439203416774335}. Best is trial 205 with value: 0.890909090909091.
[32m[I 2023-04-20 23:14:30,440][39m Trial 821 finished with value: 0.8623853211009175 and parameters: {'objective': 'CrossEntropy', 'colsample_bylevel': 0.09541420671163235, 'depth': 10, 'boosting_type': 'Plain', 'bootstrap_type': 'Bayesian', 'bagging_temperature': 4.292999606245001}. Best is trial 205 with value: 0.890909090909091.
[32m[I 2023-04-20 23:14:31,719][39m Trial 822 finished with value: 0.8807339449541284 and parameters: {'objective': 'CrossEntropy', 'colsample_bylevel': 0.09860334740585452, 'depth': 9, 'boosting_type': 'Plain', 'bootstrap_type': 'Bayesian', 'bagging_temperature': 6.267044340409308}. Best is trial 205 with value: 0.890909090909091.
[32m[I 2023-04-20 23:14:32,882][39m Trial 823 finished with value: 0.8495575221238938 and parameters: {'objective': 'CrossEntropy', 'colsample_bylevel': 0.09317637265589285, 'depth': 9, 'boosting_type': 'Plain', 'bootstrap_type': 'Bernoulli', 'subsample': 0.9131903351958165}. Best is trial 205 with value: 0.890909090909091.
[32m[I 2023-04-20 23:14:37,854][39m Trial 824 finished with value: 0.8495575221238938 and parameters: {'objective': 'CrossEntropy', 'colsample_bylevel': 0.09088435686102754, 'depth': 9, 'boosting_type': 'Ordered', 'bootstrap_type': 'Bayesian', 'bagging_temperature': 4.282875192700158}. Best is trial 205 with value: 0.890909090909091.
[32m[I 2023-04-20 23:14:38,953][39m Trial 825 finished with value: 0.8807339449541284 and parameters: {'objective': 'CrossEntropy', 'colsample_bylevel': 0.09564061998589378, 'depth': 9, 'boosting_type': 'Plain', 'bootstrap_type': 'Bayesian', 'bagging_temperature': 4.274096134233836}. Best is trial 205 with value: 0.890909090909091.
[32m[I 2023-04-20 23:14:39,940][39m Trial 826 finished with value: 0.8807339449541284 and parameters: {'objective': 'Logloss', 'colsample_bylevel': 0.0999129739692732, 'depth': 9, 'boosting_type': 'Plain', 'bootstrap_type': 'Bayesian', 'bagging_temperature': 5.810846696071851}. Best is trial 205 with value: 0.890909090909091.
[32m[I 2023-04-20 23:14:41,286][39m Trial 827 finished with value: 0.875 and parameters: {'objective': 'Logloss', 'colsample_bylevel': 0.09417267697831881, 'depth': 9, 'boosting_type': 'Plain', 'bootstrap_type': 'Bayesian', 'bagging_temperature': 5.060344047224992}. Best is trial 205 with value: 0.890909090909091.
[32m[I 2023-04-20 23:14:42,732][39m Trial 828 finished with value: 0.8521739130434783 and parameters: {'objective': 'Logloss', 'colsample_bylevel': 0.044610872946763525, 'depth': 9, 'boosting_type': 'Plain', 'bootstrap_type': 'Bayesian', 'bagging_temperature': 4.631780948544235}. Best is trial 205 with value: 0.890909090909091.
[32m[I 2023-04-20 23:14:43,692][39m Trial 829 finished with value: 0.8596491228070176 and parameters: {'objective': 'CrossEntropy', 'colsample_bylevel': 0.04081902287141693, 'depth': 9, 'boosting_type': 'Plain', 'bootstrap_type': 'Bayesian', 'bagging_temperature': 4.494004110853653}. Best is trial 205 with value: 0.890909090909091.
[32m[I 2023-04-20 23:14:44,354][39m Trial 830 finished with value: 0.875 and parameters: {'objective': 'Logloss', 'colsample_bylevel': 0.09293978476545679, 'depth': 10, 'boosting_type': 'Plain', 'bootstrap_type': 'Bayesian', 'bagging_temperature': 2.2551350867491116}. Best is trial 205 with value: 0.890909090909091.
[32m[I 2023-04-20 23:14:45,556][39m Trial 831 finished with value: 0.8727272727272727 and parameters: {'objective': 'CrossEntropy', 'colsample_bylevel': 0.09579224986537968, 'depth': 9, 'boosting_type': 'Plain', 'bootstrap_type': 'Bayesian', 'bagging_temperature': 6.79515364622252}. Best is trial 205 with value: 0.890909090909091.
[32m[I 2023-04-20 23:14:46,082][39m Trial 832 finished with value: 0.8828828828828829 and parameters: {'objective': 'CrossEntropy', 'colsample_bylevel': 0.0941583791104213, 'depth': 10, 'boosting_type': 'Plain', 'bootstrap_type': 'Bayesian', 'bagging_temperature': 6.673463225690767}. Best is trial 205 with value: 0.890909090909091.
[32m[I 2023-04-20 23:14:47,227][39m Trial 833 finished with value: 0.8648648648648648 and parameters: {'objective': 'Logloss', 'colsample_bylevel': 0.09500031363576868, 'depth': 9, 'boosting_type': 'Plain', 'bootstrap_type': 'Bayesian', 'bagging_temperature': 4.790368562702986}. Best is trial 205 with value: 0.890909090909091.
[32m[I 2023-04-20 23:14:48,831][39m Trial 834 finished with value: 0.8807339449541284 and parameters: {'objective': 'CrossEntropy', 'colsample_bylevel': 0.09640673478118628, 'depth': 9, 'boosting_type': 'Plain', 'bootstrap_type': 'Bayesian', 'bagging_temperature': 4.576829832922234}. Best is trial 205 with value: 0.890909090909091.
[32m[I 2023-04-20 23:14:50,226][39m Trial 835 finished with value: 0.8623853211009175 and parameters: {'objective': 'Logloss', 'colsample_bylevel': 0.09855453118426773, 'depth': 9, 'boosting_type': 'Plain', 'bootstrap_type': 'Bayesian', 'bagging_temperature': 6.042896594660928}. Best is trial 205 with value: 0.890909090909091.
[32m[I 2023-04-20 23:14:51,140][39m Trial 836 finished with value: 0.8495575221238938 and parameters: {'objective': 'CrossEntropy', 'colsample_bylevel': 0.08835711096732586, 'depth': 9, 'boosting_type': 'Plain', 'bootstrap_type': 'MVS'}. Best is trial 205 with value: 0.890909090909091.
[32m[I 2023-04-20 23:14:52,042][39m Trial 837 finished with value: 0.8727272727272727 and parameters: {'objective': 'CrossEntropy', 'colsample_bylevel': 0.09807877841088182, 'depth': 9, 'boosting_type': 'Plain', 'bootstrap_type': 'Bayesian', 'bagging_temperature': 7.000986598909876}. Best is trial 205 with value: 0.890909090909091.
[32m[I 2023-04-20 23:14:53,543][39m Trial 838 finished with value: 0.8648648648648648 and parameters: {'objective': 'CrossEntropy', 'colsample_bylevel': 0.08989751586952355, 'depth': 9, 'boosting_type': 'Plain', 'bootstrap_type': 'Bayesian', 'bagging_temperature': 4.759144786565985}. Best is trial 205 with value: 0.890909090909091.
[32m[I 2023-04-20 23:14:54,812][39m Trial 839 finished with value: 0.8828828828828829 and parameters: {'objective': 'CrossEntropy', 'colsample_bylevel': 0.09048358109061601, 'depth': 8, 'boosting_type': 'Plain', 'bootstrap_type': 'Bayesian', 'bagging_temperature': 4.967211570612105}. Best is trial 205 with value: 0.890909090909091.
[32m[I 2023-04-20 23:14:55,872][39m Trial 840 finished with value: 0.8807339449541284 and parameters: {'objective': 'CrossEntropy', 'colsample_bylevel': 0.09317398855339488, 'depth': 11, 'boosting_type': 'Plain', 'bootstrap_type': 'Bayesian', 'bagging_temperature': 6.092082076587187}. Best is trial 205 with value: 0.890909090909091.
[32m[I 2023-04-20 23:14:57,103][39m Trial 841 finished with value: 0.8727272727272727 and parameters: {'objective': 'Logloss', 'colsample_bylevel': 0.09874377963705949, 'depth': 9, 'boosting_type': 'Plain', 'bootstrap_type': 'Bayesian', 'bagging_temperature': 6.371936391455721}. Best is trial 205 with value: 0.890909090909091.
[32m[I 2023-04-20 23:14:57,840][39m Trial 842 finished with value: 0.875 and parameters: {'objective': 'Logloss', 'colsample_bylevel': 0.08155062428283805, 'depth': 9, 'boosting_type': 'Plain', 'bootstrap_type': 'Bayesian', 'bagging_temperature': 6.204510027116658}. Best is trial 205 with value: 0.890909090909091.
[32m[I 2023-04-20 23:14:58,791][39m Trial 843 finished with value: 0.8727272727272727 and parameters: {'objective': 'Logloss', 'colsample_bylevel': 0.09666494967238635, 'depth': 9, 'boosting_type': 'Plain', 'bootstrap_type': 'Bayesian', 'bagging_temperature': 5.876225596527816}. Best is trial 205 with value: 0.890909090909091.
[32m[I 2023-04-20 23:15:00,419][39m Trial 844 finished with value: 0.8468468468468469 and parameters: {'objective': 'CrossEntropy', 'colsample_bylevel': 0.09147950003377604, 'depth': 9, 'boosting_type': 'Plain', 'bootstrap_type': 'Bayesian', 'bagging_temperature': 4.890826838717456}. Best is trial 205 with value: 0.890909090909091.
[32m[I 2023-04-20 23:15:01,128][39m Trial 845 finished with value: 0.8623853211009175 and parameters: {'objective': 'CrossEntropy', 'colsample_bylevel': 0.09033259178786736, 'depth': 10, 'boosting_type': 'Plain', 'bootstrap_type': 'Bayesian', 'bagging_temperature': 7.202709652268253}. Best is trial 205 with value: 0.890909090909091.
[32m[I 2023-04-20 23:15:05,416][39m Trial 846 finished with value: 0.8421052631578947 and parameters: {'objective': 'CrossEntropy', 'colsample_bylevel': 0.09804801018009501, 'depth': 8, 'boosting_type': 'Ordered', 'bootstrap_type': 'Bernoulli', 'subsample': 0.9542333790946558}. Best is trial 205 with value: 0.890909090909091.
[32m[I 2023-04-20 23:15:06,762][39m Trial 847 finished with value: 0.875 and parameters: {'objective': 'CrossEntropy', 'colsample_bylevel': 0.08812019059972453, 'depth': 10, 'boosting_type': 'Plain', 'bootstrap_type': 'Bayesian', 'bagging_temperature': 2.032937699701711}. Best is trial 205 with value: 0.890909090909091.
[32m[I 2023-04-20 23:15:07,971][39m Trial 848 finished with value: 0.8727272727272727 and parameters: {'objective': 'Logloss', 'colsample_bylevel': 0.09717733555609989, 'depth': 9, 'boosting_type': 'Plain', 'bootstrap_type': 'Bayesian', 'bagging_temperature': 4.161024149548083}. Best is trial 205 with value: 0.890909090909091.
[32m[I 2023-04-20 23:15:09,346][39m Trial 849 finished with value: 0.8648648648648648 and parameters: {'objective': 'CrossEntropy', 'colsample_bylevel': 0.09308700532441827, 'depth': 9, 'boosting_type': 'Plain', 'bootstrap_type': 'Bayesian', 'bagging_temperature': 7.114021126647902}. Best is trial 205 with value: 0.890909090909091.
[32m[I 2023-04-20 23:15:10,390][39m Trial 850 finished with value: 0.8623853211009175 and parameters: {'objective': 'CrossEntropy', 'colsample_bylevel': 0.08893843661624905, 'depth': 10, 'boosting_type': 'Plain', 'bootstrap_type': 'Bayesian', 'bagging_temperature': 4.584533188059794}. Best is trial 205 with value: 0.890909090909091.
[32m[I 2023-04-20 23:15:11,173][39m Trial 851 finished with value: 0.8807339449541284 and parameters: {'objective': 'CrossEntropy', 'colsample_bylevel': 0.09233159677397455, 'depth': 10, 'boosting_type': 'Plain', 'bootstrap_type': 'Bayesian', 'bagging_temperature': 4.652747745449942}. Best is trial 205 with value: 0.890909090909091.
[32m[I 2023-04-20 23:15:11,861][39m Trial 852 finished with value: 0.8807339449541284 and parameters: {'objective': 'CrossEntropy', 'colsample_bylevel': 0.09662355695164658, 'depth': 9, 'boosting_type': 'Plain', 'bootstrap_type': 'Bayesian', 'bagging_temperature': 5.698769931823841}. Best is trial 205 with value: 0.890909090909091.
[32m[I 2023-04-20 23:15:13,166][39m Trial 853 finished with value: 0.888888888888889 and parameters: {'objective': 'Logloss', 'colsample_bylevel': 0.09812214524358791, 'depth': 8, 'boosting_type': 'Plain', 'bootstrap_type': 'Bayesian', 'bagging_temperature': 5.975180654821144}. Best is trial 205 with value: 0.890909090909091.
[32m[I 2023-04-20 23:15:14,727][39m Trial 854 finished with value: 0.8703703703703703 and parameters: {'objective': 'Logloss', 'colsample_bylevel': 0.09845870859461459, 'depth': 8, 'boosting_type': 'Plain', 'bootstrap_type': 'Bayesian', 'bagging_temperature': 5.957221957022124}. Best is trial 205 with value: 0.890909090909091.
[32m[I 2023-04-20 23:15:15,926][39m Trial 855 finished with value: 0.8807339449541284 and parameters: {'objective': 'CrossEntropy', 'colsample_bylevel': 0.0945257215072434, 'depth': 9, 'boosting_type': 'Plain', 'bootstrap_type': 'Bayesian', 'bagging_temperature': 6.565971846202843}. Best is trial 205 with value: 0.890909090909091.
[32m[I 2023-04-20 23:15:17,576][39m Trial 856 finished with value: 0.8727272727272727 and parameters: {'objective': 'Logloss', 'colsample_bylevel': 0.0976027495644087, 'depth': 9, 'boosting_type': 'Plain', 'bootstrap_type': 'Bayesian', 'bagging_temperature': 4.781015349726176}. Best is trial 205 with value: 0.890909090909091.
[32m[I 2023-04-20 23:15:18,200][39m Trial 857 finished with value: 0.8648648648648648 and parameters: {'objective': 'Logloss', 'colsample_bylevel': 0.09174837761203569, 'depth': 10, 'boosting_type': 'Plain', 'bootstrap_type': 'Bayesian', 'bagging_temperature': 4.227250960469068}. Best is trial 205 with value: 0.890909090909091.
[32m[I 2023-04-20 23:15:18,887][39m Trial 858 finished with value: 0.8727272727272727 and parameters: {'objective': 'CrossEntropy', 'colsample_bylevel': 0.0969531368885535, 'depth': 9, 'boosting_type': 'Plain', 'bootstrap_type': 'Bayesian', 'bagging_temperature': 5.656631035002982}. Best is trial 205 with value: 0.890909090909091.
[32m[I 2023-04-20 23:15:19,765][39m Trial 859 finished with value: 0.8571428571428572 and parameters: {'objective': 'CrossEntropy', 'colsample_bylevel': 0.09649244895706839, 'depth': 9, 'boosting_type': 'Plain', 'bootstrap_type': 'MVS'}. Best is trial 205 with value: 0.890909090909091.
[32m[I 2023-04-20 23:15:20,697][39m Trial 860 finished with value: 0.8807339449541284 and parameters: {'objective': 'CrossEntropy', 'colsample_bylevel': 0.09281488345249757, 'depth': 10, 'boosting_type': 'Plain', 'bootstrap_type': 'Bayesian', 'bagging_temperature': 8.263945937198224}. Best is trial 205 with value: 0.890909090909091.
[32m[I 2023-04-20 23:15:22,079][39m Trial 861 finished with value: 0.8807339449541284 and parameters: {'objective': 'Logloss', 'colsample_bylevel': 0.09571923516048281, 'depth': 9, 'boosting_type': 'Plain', 'bootstrap_type': 'Bayesian', 'bagging_temperature': 4.989447645695721}. Best is trial 205 with value: 0.890909090909091.
