[32m[I 2023-04-20 23:36:06,981][39m Trial 1852 finished with value: 0.8807339449541284 and parameters: {'objective': 'Logloss', 'colsample_bylevel': 0.0997996924149336, 'depth': 8, 'boosting_type': 'Plain', 'bootstrap_type': 'Bayesian', 'bagging_temperature': 3.8557706069237945}. Best is trial 1464 with value: 0.8990825688073395.
[32m[I 2023-04-20 23:36:08,145][39m Trial 1853 finished with value: 0.8807339449541284 and parameters: {'objective': 'Logloss', 'colsample_bylevel': 0.09960908371129067, 'depth': 8, 'boosting_type': 'Plain', 'bootstrap_type': 'Bayesian', 'bagging_temperature': 6.491062917404425}. Best is trial 1464 with value: 0.8990825688073395.
[32m[I 2023-04-20 23:36:08,783][39m Trial 1854 finished with value: 0.8807339449541284 and parameters: {'objective': 'CrossEntropy', 'colsample_bylevel': 0.09835988441700638, 'depth': 6, 'boosting_type': 'Plain', 'bootstrap_type': 'Bayesian', 'bagging_temperature': 6.003635052275981}. Best is trial 1464 with value: 0.8990825688073395.
[32m[I 2023-04-20 23:36:09,592][39m Trial 1855 finished with value: 0.8807339449541284 and parameters: {'objective': 'CrossEntropy', 'colsample_bylevel': 0.09193552112434321, 'depth': 9, 'boosting_type': 'Plain', 'bootstrap_type': 'Bayesian', 'bagging_temperature': 6.418532060448768}. Best is trial 1464 with value: 0.8990825688073395.
[32m[I 2023-04-20 23:36:11,043][39m Trial 1856 finished with value: 0.888888888888889 and parameters: {'objective': 'CrossEntropy', 'colsample_bylevel': 0.09130838797487559, 'depth': 9, 'boosting_type': 'Plain', 'bootstrap_type': 'Bayesian', 'bagging_temperature': 6.389429253814104}. Best is trial 1464 with value: 0.8990825688073395.
[32m[I 2023-04-20 23:36:11,792][39m Trial 1857 finished with value: 0.8828828828828829 and parameters: {'objective': 'CrossEntropy', 'colsample_bylevel': 0.09298904771800659, 'depth': 10, 'boosting_type': 'Plain', 'bootstrap_type': 'Bayesian', 'bagging_temperature': 6.198269340550265}. Best is trial 1464 with value: 0.8990825688073395.
[32m[I 2023-04-20 23:36:12,607][39m Trial 1858 finished with value: 0.8807339449541284 and parameters: {'objective': 'CrossEntropy', 'colsample_bylevel': 0.09755501700803333, 'depth': 7, 'boosting_type': 'Plain', 'bootstrap_type': 'Bayesian', 'bagging_temperature': 3.9911726534335514}. Best is trial 1464 with value: 0.8990825688073395.
[32m[I 2023-04-20 23:36:13,261][39m Trial 1859 finished with value: 0.8305084745762712 and parameters: {'objective': 'CrossEntropy', 'colsample_bylevel': 0.016262498185851265, 'depth': 9, 'boosting_type': 'Plain', 'bootstrap_type': 'Bayesian', 'bagging_temperature': 4.666494380605063}. Best is trial 1464 with value: 0.8990825688073395.
[32m[I 2023-04-20 23:36:14,117][39m Trial 1860 finished with value: 0.8495575221238938 and parameters: {'objective': 'Logloss', 'colsample_bylevel': 0.09493990996938068, 'depth': 12, 'boosting_type': 'Plain', 'bootstrap_type': 'MVS'}. Best is trial 1464 with value: 0.8990825688073395.
[32m[I 2023-04-20 23:36:14,719][39m Trial 1861 finished with value: 0.8571428571428572 and parameters: {'objective': 'CrossEntropy', 'colsample_bylevel': 0.09858795141319704, 'depth': 8, 'boosting_type': 'Plain', 'bootstrap_type': 'MVS'}. Best is trial 1464 with value: 0.8990825688073395.
[32m[I 2023-04-20 23:36:15,614][39m Trial 1862 finished with value: 0.8648648648648648 and parameters: {'objective': 'CrossEntropy', 'colsample_bylevel': 0.0949900625179773, 'depth': 10, 'boosting_type': 'Plain', 'bootstrap_type': 'Bayesian', 'bagging_temperature': 4.576799658312045}. Best is trial 1464 with value: 0.8990825688073395.
[32m[I 2023-04-20 23:36:16,522][39m Trial 1863 finished with value: 0.8727272727272727 and parameters: {'objective': 'CrossEntropy', 'colsample_bylevel': 0.09603757194233177, 'depth': 10, 'boosting_type': 'Plain', 'bootstrap_type': 'Bayesian', 'bagging_temperature': 4.134370577665838}. Best is trial 1464 with value: 0.8990825688073395.
[32m[I 2023-04-20 23:36:17,711][39m Trial 1864 finished with value: 0.8703703703703703 and parameters: {'objective': 'CrossEntropy', 'colsample_bylevel': 0.09544014462073676, 'depth': 11, 'boosting_type': 'Plain', 'bootstrap_type': 'Bayesian', 'bagging_temperature': 3.5875358329157585}. Best is trial 1464 with value: 0.8990825688073395.
[32m[I 2023-04-20 23:36:19,062][39m Trial 1865 finished with value: 0.875 and parameters: {'objective': 'Logloss', 'colsample_bylevel': 0.09465666027713938, 'depth': 9, 'boosting_type': 'Plain', 'bootstrap_type': 'Bayesian', 'bagging_temperature': 6.829259760797489}. Best is trial 1464 with value: 0.8990825688073395.
[32m[I 2023-04-20 23:36:19,756][39m Trial 1866 finished with value: 0.8828828828828829 and parameters: {'objective': 'CrossEntropy', 'colsample_bylevel': 0.09358413028853581, 'depth': 10, 'boosting_type': 'Plain', 'bootstrap_type': 'Bayesian', 'bagging_temperature': 4.176407891161012}. Best is trial 1464 with value: 0.8990825688073395.
[32m[I 2023-04-20 23:36:20,702][39m Trial 1867 finished with value: 0.8727272727272727 and parameters: {'objective': 'CrossEntropy', 'colsample_bylevel': 0.09808756190870604, 'depth': 12, 'boosting_type': 'Plain', 'bootstrap_type': 'Bayesian', 'bagging_temperature': 6.00123418795972}. Best is trial 1464 with value: 0.8990825688073395.
[32m[I 2023-04-20 23:36:21,618][39m Trial 1868 finished with value: 0.8305084745762712 and parameters: {'objective': 'CrossEntropy', 'colsample_bylevel': 0.0980918333042784, 'depth': 2, 'boosting_type': 'Plain', 'bootstrap_type': 'Bayesian', 'bagging_temperature': 5.727189017275203}. Best is trial 1464 with value: 0.8990825688073395.
[32m[I 2023-04-20 23:36:27,136][39m Trial 1869 finished with value: 0.8571428571428572 and parameters: {'objective': 'CrossEntropy', 'colsample_bylevel': 0.09979551727496999, 'depth': 11, 'boosting_type': 'Ordered', 'bootstrap_type': 'Bayesian', 'bagging_temperature': 5.708784640286265}. Best is trial 1464 with value: 0.8990825688073395.
[32m[I 2023-04-20 23:36:28,338][39m Trial 1870 finished with value: 0.875 and parameters: {'objective': 'CrossEntropy', 'colsample_bylevel': 0.0957909215192901, 'depth': 9, 'boosting_type': 'Plain', 'bootstrap_type': 'Bayesian', 'bagging_temperature': 5.5017358285982745}. Best is trial 1464 with value: 0.8990825688073395.
[32m[I 2023-04-20 23:36:29,131][39m Trial 1871 finished with value: 0.8648648648648648 and parameters: {'objective': 'Logloss', 'colsample_bylevel': 0.09146341016187391, 'depth': 10, 'boosting_type': 'Plain', 'bootstrap_type': 'Bayesian', 'bagging_temperature': 8.244718590068793}. Best is trial 1464 with value: 0.8990825688073395.
[32m[I 2023-04-20 23:36:30,279][39m Trial 1872 finished with value: 0.8727272727272727 and parameters: {'objective': 'CrossEntropy', 'colsample_bylevel': 0.09871292166414802, 'depth': 9, 'boosting_type': 'Plain', 'bootstrap_type': 'Bayesian', 'bagging_temperature': 5.275388205634515}. Best is trial 1464 with value: 0.8990825688073395.
[32m[I 2023-04-20 23:36:31,343][39m Trial 1873 finished with value: 0.8571428571428572 and parameters: {'objective': 'CrossEntropy', 'colsample_bylevel': 0.09789952696659408, 'depth': 11, 'boosting_type': 'Plain', 'bootstrap_type': 'MVS'}. Best is trial 1464 with value: 0.8990825688073395.
[32m[I 2023-04-20 23:36:32,212][39m Trial 1874 finished with value: 0.888888888888889 and parameters: {'objective': 'CrossEntropy', 'colsample_bylevel': 0.09727484676954824, 'depth': 8, 'boosting_type': 'Plain', 'bootstrap_type': 'Bayesian', 'bagging_temperature': 5.898066997308784}. Best is trial 1464 with value: 0.8990825688073395.
[32m[I 2023-04-20 23:36:33,046][39m Trial 1875 finished with value: 0.8727272727272727 and parameters: {'objective': 'Logloss', 'colsample_bylevel': 0.0952776126468874, 'depth': 11, 'boosting_type': 'Plain', 'bootstrap_type': 'Bayesian', 'bagging_temperature': 4.378715204690058}. Best is trial 1464 with value: 0.8990825688073395.
[32m[I 2023-04-20 23:36:34,005][39m Trial 1876 finished with value: 0.8376068376068375 and parameters: {'objective': 'CrossEntropy', 'colsample_bylevel': 0.029846055882978464, 'depth': 9, 'boosting_type': 'Plain', 'bootstrap_type': 'Bayesian', 'bagging_temperature': 6.218560150859671}. Best is trial 1464 with value: 0.8990825688073395.
[32m[I 2023-04-20 23:36:34,937][39m Trial 1877 finished with value: 0.8807339449541284 and parameters: {'objective': 'CrossEntropy', 'colsample_bylevel': 0.08857768791863388, 'depth': 12, 'boosting_type': 'Plain', 'bootstrap_type': 'Bayesian', 'bagging_temperature': 5.973650171620394}. Best is trial 1464 with value: 0.8990825688073395.
[32m[I 2023-04-20 23:36:35,934][39m Trial 1878 finished with value: 0.888888888888889 and parameters: {'objective': 'Logloss', 'colsample_bylevel': 0.09996916064428275, 'depth': 10, 'boosting_type': 'Plain', 'bootstrap_type': 'Bayesian', 'bagging_temperature': 4.330190287601647}. Best is trial 1464 with value: 0.8990825688073395.
[32m[I 2023-04-20 23:36:36,724][39m Trial 1879 finished with value: 0.8672566371681416 and parameters: {'objective': 'CrossEntropy', 'colsample_bylevel': 0.09397592489405387, 'depth': 11, 'boosting_type': 'Plain', 'bootstrap_type': 'Bayesian', 'bagging_temperature': 4.8477861199414205}. Best is trial 1464 with value: 0.8990825688073395.
[32m[I 2023-04-20 23:36:38,153][39m Trial 1880 finished with value: 0.875 and parameters: {'objective': 'CrossEntropy', 'colsample_bylevel': 0.08972710486803964, 'depth': 9, 'boosting_type': 'Plain', 'bootstrap_type': 'Bayesian', 'bagging_temperature': 4.45920614213888}. Best is trial 1464 with value: 0.8990825688073395.
[32m[I 2023-04-20 23:36:38,814][39m Trial 1881 finished with value: 0.8672566371681416 and parameters: {'objective': 'CrossEntropy', 'colsample_bylevel': 0.08848561027198214, 'depth': 10, 'boosting_type': 'Plain', 'bootstrap_type': 'Bayesian', 'bagging_temperature': 5.421623865737204}. Best is trial 1464 with value: 0.8990825688073395.
[32m[I 2023-04-20 23:36:39,837][39m Trial 1882 finished with value: 0.8545454545454546 and parameters: {'objective': 'Logloss', 'colsample_bylevel': 0.09978188321473902, 'depth': 8, 'boosting_type': 'Plain', 'bootstrap_type': 'Bayesian', 'bagging_temperature': 5.140667397034618}. Best is trial 1464 with value: 0.8990825688073395.
[32m[I 2023-04-20 23:36:40,805][39m Trial 1883 finished with value: 0.8598130841121495 and parameters: {'objective': 'Logloss', 'colsample_bylevel': 0.09665068950779171, 'depth': 7, 'boosting_type': 'Plain', 'bootstrap_type': 'Bayesian', 'bagging_temperature': 6.65686397825016}. Best is trial 1464 with value: 0.8990825688073395.
[32m[I 2023-04-20 23:36:42,294][39m Trial 1884 finished with value: 0.8596491228070176 and parameters: {'objective': 'CrossEntropy', 'colsample_bylevel': 0.09022338967929422, 'depth': 9, 'boosting_type': 'Plain', 'bootstrap_type': 'Bayesian', 'bagging_temperature': 9.406534196999942}. Best is trial 1464 with value: 0.8990825688073395.
[32m[I 2023-04-20 23:36:43,377][39m Trial 1885 finished with value: 0.8648648648648648 and parameters: {'objective': 'Logloss', 'colsample_bylevel': 0.09637665011346414, 'depth': 9, 'boosting_type': 'Plain', 'bootstrap_type': 'Bayesian', 'bagging_temperature': 4.493016539962228}. Best is trial 1464 with value: 0.8990825688073395.
[32m[I 2023-04-20 23:36:44,426][39m Trial 1886 finished with value: 0.8623853211009175 and parameters: {'objective': 'CrossEntropy', 'colsample_bylevel': 0.0916780363159241, 'depth': 9, 'boosting_type': 'Plain', 'bootstrap_type': 'Bayesian', 'bagging_temperature': 6.924764043136892}. Best is trial 1464 with value: 0.8990825688073395.
[32m[I 2023-04-20 23:36:45,389][39m Trial 1887 finished with value: 0.8703703703703703 and parameters: {'objective': 'Logloss', 'colsample_bylevel': 0.09014321837201253, 'depth': 6, 'boosting_type': 'Plain', 'bootstrap_type': 'Bayesian', 'bagging_temperature': 8.763449787078631}. Best is trial 1464 with value: 0.8990825688073395.
[32m[I 2023-04-20 23:36:50,507][39m Trial 1888 finished with value: 0.8495575221238938 and parameters: {'objective': 'CrossEntropy', 'colsample_bylevel': 0.0883798882028722, 'depth': 10, 'boosting_type': 'Ordered', 'bootstrap_type': 'Bayesian', 'bagging_temperature': 4.567504869351776}. Best is trial 1464 with value: 0.8990825688073395.
[32m[I 2023-04-20 23:36:51,721][39m Trial 1889 finished with value: 0.875 and parameters: {'objective': 'CrossEntropy', 'colsample_bylevel': 0.09365242903751805, 'depth': 10, 'boosting_type': 'Plain', 'bootstrap_type': 'Bayesian', 'bagging_temperature': 6.535812287217583}. Best is trial 1464 with value: 0.8990825688073395.
[32m[I 2023-04-20 23:36:52,556][39m Trial 1890 finished with value: 0.888888888888889 and parameters: {'objective': 'CrossEntropy', 'colsample_bylevel': 0.0900881652341868, 'depth': 10, 'boosting_type': 'Plain', 'bootstrap_type': 'Bayesian', 'bagging_temperature': 5.743786967211914}. Best is trial 1464 with value: 0.8990825688073395.
[32m[I 2023-04-20 23:36:53,834][39m Trial 1891 finished with value: 0.8623853211009175 and parameters: {'objective': 'Logloss', 'colsample_bylevel': 0.09692108800025098, 'depth': 8, 'boosting_type': 'Plain', 'bootstrap_type': 'Bayesian', 'bagging_temperature': 5.053849083053733}. Best is trial 1464 with value: 0.8990825688073395.
[32m[I 2023-04-20 23:36:54,702][39m Trial 1892 finished with value: 0.8807339449541284 and parameters: {'objective': 'Logloss', 'colsample_bylevel': 0.0970203375333389, 'depth': 8, 'boosting_type': 'Plain', 'bootstrap_type': 'Bayesian', 'bagging_temperature': 3.719714008662928}. Best is trial 1464 with value: 0.8990825688073395.
[32m[I 2023-04-20 23:36:55,616][39m Trial 1893 finished with value: 0.8623853211009175 and parameters: {'objective': 'CrossEntropy', 'colsample_bylevel': 0.09561992587658023, 'depth': 12, 'boosting_type': 'Plain', 'bootstrap_type': 'Bayesian', 'bagging_temperature': 4.105560831588404}. Best is trial 1464 with value: 0.8990825688073395.
[32m[I 2023-04-20 23:36:56,638][39m Trial 1894 finished with value: 0.8571428571428572 and parameters: {'objective': 'Logloss', 'colsample_bylevel': 0.09200494948258385, 'depth': 10, 'boosting_type': 'Plain', 'bootstrap_type': 'Bayesian', 'bagging_temperature': 4.145046756112088}. Best is trial 1464 with value: 0.8990825688073395.
[32m[I 2023-04-20 23:36:57,888][39m Trial 1895 finished with value: 0.8807339449541284 and parameters: {'objective': 'Logloss', 'colsample_bylevel': 0.0929129474236476, 'depth': 10, 'boosting_type': 'Plain', 'bootstrap_type': 'Bayesian', 'bagging_temperature': 2.997134590259028}. Best is trial 1464 with value: 0.8990825688073395.
[32m[I 2023-04-20 23:36:58,835][39m Trial 1896 finished with value: 0.8828828828828829 and parameters: {'objective': 'Logloss', 'colsample_bylevel': 0.09524270265828276, 'depth': 8, 'boosting_type': 'Plain', 'bootstrap_type': 'Bayesian', 'bagging_temperature': 6.719258182917219}. Best is trial 1464 with value: 0.8990825688073395.
[32m[I 2023-04-20 23:37:00,014][39m Trial 1897 finished with value: 0.8648648648648648 and parameters: {'objective': 'Logloss', 'colsample_bylevel': 0.09826444083839023, 'depth': 8, 'boosting_type': 'Plain', 'bootstrap_type': 'Bayesian', 'bagging_temperature': 3.4730521990172587}. Best is trial 1464 with value: 0.8990825688073395.
[32m[I 2023-04-20 23:37:00,988][39m Trial 1898 finished with value: 0.8421052631578947 and parameters: {'objective': 'Logloss', 'colsample_bylevel': 0.0824183393129003, 'depth': 7, 'boosting_type': 'Plain', 'bootstrap_type': 'Bayesian', 'bagging_temperature': 5.093880296880591}. Best is trial 1464 with value: 0.8990825688073395.
[32m[I 2023-04-20 23:37:02,088][39m Trial 1899 finished with value: 0.8672566371681416 and parameters: {'objective': 'CrossEntropy', 'colsample_bylevel': 0.09328952992763447, 'depth': 9, 'boosting_type': 'Plain', 'bootstrap_type': 'Bernoulli', 'subsample': 0.2599425035482792}. Best is trial 1464 with value: 0.8990825688073395.
[32m[I 2023-04-20 23:37:03,126][39m Trial 1900 finished with value: 0.8828828828828829 and parameters: {'objective': 'Logloss', 'colsample_bylevel': 0.0935784559227043, 'depth': 9, 'boosting_type': 'Plain', 'bootstrap_type': 'Bayesian', 'bagging_temperature': 4.659727189861992}. Best is trial 1464 with value: 0.8990825688073395.
[32m[I 2023-04-20 23:37:04,089][39m Trial 1901 finished with value: 0.8807339449541284 and parameters: {'objective': 'CrossEntropy', 'colsample_bylevel': 0.09855431162066083, 'depth': 8, 'boosting_type': 'Plain', 'bootstrap_type': 'Bayesian', 'bagging_temperature': 3.4923183653655276}. Best is trial 1464 with value: 0.8990825688073395.
[32m[I 2023-04-20 23:37:05,783][39m Trial 1902 finished with value: 0.8785046728971961 and parameters: {'objective': 'CrossEntropy', 'colsample_bylevel': 0.0971813000432365, 'depth': 8, 'boosting_type': 'Plain', 'bootstrap_type': 'Bayesian', 'bagging_temperature': 3.451478625138234}. Best is trial 1464 with value: 0.8990825688073395.
[32m[I 2023-04-20 23:37:06,870][39m Trial 1903 finished with value: 0.8727272727272727 and parameters: {'objective': 'CrossEntropy', 'colsample_bylevel': 0.0986027096702196, 'depth': 9, 'boosting_type': 'Plain', 'bootstrap_type': 'Bayesian', 'bagging_temperature': 4.933457655499225}. Best is trial 1464 with value: 0.8990825688073395.
[32m[I 2023-04-20 23:37:07,741][39m Trial 1904 finished with value: 0.8807339449541284 and parameters: {'objective': 'Logloss', 'colsample_bylevel': 0.09248828560653509, 'depth': 9, 'boosting_type': 'Plain', 'bootstrap_type': 'Bayesian', 'bagging_temperature': 4.458346477311055}. Best is trial 1464 with value: 0.8990825688073395.
[32m[I 2023-04-20 23:37:12,879][39m Trial 1905 finished with value: 0.8421052631578947 and parameters: {'objective': 'CrossEntropy', 'colsample_bylevel': 0.09637947569549553, 'depth': 9, 'boosting_type': 'Ordered', 'bootstrap_type': 'Bernoulli', 'subsample': 0.3249796377528233}. Best is trial 1464 with value: 0.8990825688073395.
[32m[I 2023-04-20 23:37:14,403][39m Trial 1906 finished with value: 0.8727272727272727 and parameters: {'objective': 'Logloss', 'colsample_bylevel': 0.09599420819343468, 'depth': 8, 'boosting_type': 'Plain', 'bootstrap_type': 'Bayesian', 'bagging_temperature': 6.36716934896765}. Best is trial 1464 with value: 0.8990825688073395.
[32m[I 2023-04-20 23:37:15,202][39m Trial 1907 finished with value: 0.8596491228070176 and parameters: {'objective': 'Logloss', 'colsample_bylevel': 0.05888918363384991, 'depth': 8, 'boosting_type': 'Plain', 'bootstrap_type': 'Bayesian', 'bagging_temperature': 6.3577631600752555}. Best is trial 1464 with value: 0.8990825688073395.
[32m[I 2023-04-20 23:37:15,932][39m Trial 1908 finished with value: 0.8392857142857144 and parameters: {'objective': 'CrossEntropy', 'colsample_bylevel': 0.09440218615769908, 'depth': 6, 'boosting_type': 'Plain', 'bootstrap_type': 'Bayesian', 'bagging_temperature': 3.4071292735763534}. Best is trial 1464 with value: 0.8990825688073395.
[32m[I 2023-04-20 23:37:17,229][39m Trial 1909 finished with value: 0.8807339449541284 and parameters: {'objective': 'Logloss', 'colsample_bylevel': 0.0999335090243535, 'depth': 11, 'boosting_type': 'Plain', 'bootstrap_type': 'Bayesian', 'bagging_temperature': 3.808335960561709}. Best is trial 1464 with value: 0.8990825688073395.
[32m[I 2023-04-20 23:37:18,861][39m Trial 1910 finished with value: 0.8672566371681416 and parameters: {'objective': 'Logloss', 'colsample_bylevel': 0.09977748193173662, 'depth': 9, 'boosting_type': 'Plain', 'bootstrap_type': 'Bernoulli', 'subsample': 0.47901211475864414}. Best is trial 1464 with value: 0.8990825688073395.
[32m[I 2023-04-20 23:37:20,394][39m Trial 1911 finished with value: 0.8807339449541284 and parameters: {'objective': 'Logloss', 'colsample_bylevel': 0.09444313246218806, 'depth': 9, 'boosting_type': 'Plain', 'bootstrap_type': 'Bayesian', 'bagging_temperature': 3.9847686544293084}. Best is trial 1464 with value: 0.8990825688073395.
[32m[I 2023-04-20 23:37:21,183][39m Trial 1912 finished with value: 0.8727272727272727 and parameters: {'objective': 'CrossEntropy', 'colsample_bylevel': 0.09582358664156915, 'depth': 11, 'boosting_type': 'Plain', 'bootstrap_type': 'Bayesian', 'bagging_temperature': 7.039576631933684}. Best is trial 1464 with value: 0.8990825688073395.
[32m[I 2023-04-20 23:37:21,808][39m Trial 1913 finished with value: 0.8807339449541284 and parameters: {'objective': 'Logloss', 'colsample_bylevel': 0.09965771413257332, 'depth': 8, 'boosting_type': 'Plain', 'bootstrap_type': 'Bayesian', 'bagging_temperature': 3.641547088423562}. Best is trial 1464 with value: 0.8990825688073395.
[32m[I 2023-04-20 23:37:22,515][39m Trial 1914 finished with value: 0.8785046728971961 and parameters: {'objective': 'Logloss', 'colsample_bylevel': 0.09797614375085845, 'depth': 9, 'boosting_type': 'Plain', 'bootstrap_type': 'Bayesian', 'bagging_temperature': 4.801578163151068}. Best is trial 1464 with value: 0.8990825688073395.
[32m[I 2023-04-20 23:37:24,039][39m Trial 1915 finished with value: 0.8727272727272727 and parameters: {'objective': 'Logloss', 'colsample_bylevel': 0.09989194261311432, 'depth': 9, 'boosting_type': 'Plain', 'bootstrap_type': 'Bayesian', 'bagging_temperature': 4.340070592910019}. Best is trial 1464 with value: 0.8990825688073395.
[32m[I 2023-04-20 23:37:24,596][39m Trial 1916 finished with value: 0.8703703703703703 and parameters: {'objective': 'CrossEntropy', 'colsample_bylevel': 0.09828558895923648, 'depth': 7, 'boosting_type': 'Plain', 'bootstrap_type': 'Bayesian', 'bagging_temperature': 5.186249459217842}. Best is trial 1464 with value: 0.8990825688073395.
