[32m[I 2023-04-21 00:30:05,164][39m Trial 4281 finished with value: 0.8727272727272727 and parameters: {'objective': 'Logloss', 'colsample_bylevel': 0.09982342723678278, 'depth': 7, 'boosting_type': 'Plain', 'bootstrap_type': 'Bayesian', 'bagging_temperature': 5.669026924362362}. Best is trial 1464 with value: 0.8990825688073395.
[32m[I 2023-04-21 00:30:06,375][39m Trial 4282 finished with value: 0.8468468468468469 and parameters: {'objective': 'CrossEntropy', 'colsample_bylevel': 0.093630764768833, 'depth': 10, 'boosting_type': 'Plain', 'bootstrap_type': 'Bayesian', 'bagging_temperature': 5.736550805562147}. Best is trial 1464 with value: 0.8990825688073395.
[32m[I 2023-04-21 00:30:07,498][39m Trial 4283 finished with value: 0.890909090909091 and parameters: {'objective': 'Logloss', 'colsample_bylevel': 0.09172094009701956, 'depth': 12, 'boosting_type': 'Plain', 'bootstrap_type': 'Bayesian', 'bagging_temperature': 5.451010523161765}. Best is trial 1464 with value: 0.8990825688073395.
[32m[I 2023-04-21 00:30:08,503][39m Trial 4284 finished with value: 0.8807339449541284 and parameters: {'objective': 'Logloss', 'colsample_bylevel': 0.09615680510827099, 'depth': 12, 'boosting_type': 'Plain', 'bootstrap_type': 'Bayesian', 'bagging_temperature': 3.8605511264131818}. Best is trial 1464 with value: 0.8990825688073395.
[32m[I 2023-04-21 00:30:09,251][39m Trial 4285 finished with value: 0.8623853211009175 and parameters: {'objective': 'Logloss', 'colsample_bylevel': 0.0952310847843034, 'depth': 7, 'boosting_type': 'Plain', 'bootstrap_type': 'Bayesian', 'bagging_temperature': 5.765300716941634}. Best is trial 1464 with value: 0.8990825688073395.
[32m[I 2023-04-21 00:30:10,493][39m Trial 4286 finished with value: 0.8807339449541284 and parameters: {'objective': 'CrossEntropy', 'colsample_bylevel': 0.09281598327000676, 'depth': 11, 'boosting_type': 'Plain', 'bootstrap_type': 'Bayesian', 'bagging_temperature': 5.5249616259340515}. Best is trial 1464 with value: 0.8990825688073395.
[32m[I 2023-04-21 00:30:11,215][39m Trial 4287 finished with value: 0.8648648648648648 and parameters: {'objective': 'CrossEntropy', 'colsample_bylevel': 0.09803561061681387, 'depth': 6, 'boosting_type': 'Plain', 'bootstrap_type': 'Bayesian', 'bagging_temperature': 6.225668718754773}. Best is trial 1464 with value: 0.8990825688073395.
[32m[I 2023-04-21 00:30:12,710][39m Trial 4288 finished with value: 0.890909090909091 and parameters: {'objective': 'Logloss', 'colsample_bylevel': 0.09194139289663941, 'depth': 9, 'boosting_type': 'Plain', 'bootstrap_type': 'Bayesian', 'bagging_temperature': 4.951259989244396}. Best is trial 1464 with value: 0.8990825688073395.
[32m[I 2023-04-21 00:30:14,379][39m Trial 4289 finished with value: 0.8703703703703703 and parameters: {'objective': 'Logloss', 'colsample_bylevel': 0.09192136734974904, 'depth': 9, 'boosting_type': 'Plain', 'bootstrap_type': 'Bayesian', 'bagging_temperature': 7.180019848063656}. Best is trial 1464 with value: 0.8990825688073395.
[32m[I 2023-04-21 00:30:15,270][39m Trial 4290 finished with value: 0.8807339449541284 and parameters: {'objective': 'Logloss', 'colsample_bylevel': 0.08766106197399146, 'depth': 10, 'boosting_type': 'Plain', 'bootstrap_type': 'Bayesian', 'bagging_temperature': 5.116885201872957}. Best is trial 1464 with value: 0.8990825688073395.
[32m[I 2023-04-21 00:30:16,573][39m Trial 4291 finished with value: 0.8703703703703703 and parameters: {'objective': 'Logloss', 'colsample_bylevel': 0.09121958923549214, 'depth': 8, 'boosting_type': 'Plain', 'bootstrap_type': 'Bayesian', 'bagging_temperature': 5.3441029745953665}. Best is trial 1464 with value: 0.8990825688073395.
[32m[I 2023-04-21 00:30:17,571][39m Trial 4292 finished with value: 0.8807339449541284 and parameters: {'objective': 'Logloss', 'colsample_bylevel': 0.09859203935708495, 'depth': 7, 'boosting_type': 'Plain', 'bootstrap_type': 'Bayesian', 'bagging_temperature': 7.077532601067492}. Best is trial 1464 with value: 0.8990825688073395.
[32m[I 2023-04-21 00:30:18,294][39m Trial 4293 finished with value: 0.8648648648648648 and parameters: {'objective': 'Logloss', 'colsample_bylevel': 0.09342179279084742, 'depth': 6, 'boosting_type': 'Plain', 'bootstrap_type': 'Bayesian', 'bagging_temperature': 5.667362354246206}. Best is trial 1464 with value: 0.8990825688073395.
[32m[I 2023-04-21 00:30:19,698][39m Trial 4294 finished with value: 0.8828828828828829 and parameters: {'objective': 'Logloss', 'colsample_bylevel': 0.09855648841445748, 'depth': 8, 'boosting_type': 'Plain', 'bootstrap_type': 'Bayesian', 'bagging_temperature': 5.646598467589798}. Best is trial 1464 with value: 0.8990825688073395.
[32m[I 2023-04-21 00:30:21,654][39m Trial 4295 finished with value: 0.8807339449541284 and parameters: {'objective': 'Logloss', 'colsample_bylevel': 0.09847019848961724, 'depth': 9, 'boosting_type': 'Plain', 'bootstrap_type': 'Bayesian', 'bagging_temperature': 4.8474795717191945}. Best is trial 1464 with value: 0.8990825688073395.
[32m[I 2023-04-21 00:30:26,557][39m Trial 4296 finished with value: 0.8347826086956522 and parameters: {'objective': 'Logloss', 'colsample_bylevel': 0.095965187620368, 'depth': 7, 'boosting_type': 'Ordered', 'bootstrap_type': 'Bayesian', 'bagging_temperature': 5.942787888911933}. Best is trial 1464 with value: 0.8990825688073395.
[32m[I 2023-04-21 00:30:27,896][39m Trial 4297 finished with value: 0.8672566371681416 and parameters: {'objective': 'Logloss', 'colsample_bylevel': 0.09649292564240536, 'depth': 8, 'boosting_type': 'Plain', 'bootstrap_type': 'Bernoulli', 'subsample': 0.6428379813699179}. Best is trial 1464 with value: 0.8990825688073395.
[32m[I 2023-04-21 00:30:29,241][39m Trial 4298 finished with value: 0.8807339449541284 and parameters: {'objective': 'Logloss', 'colsample_bylevel': 0.09682728232621687, 'depth': 7, 'boosting_type': 'Plain', 'bootstrap_type': 'Bayesian', 'bagging_temperature': 5.612522595473008}. Best is trial 1464 with value: 0.8990825688073395.
[32m[I 2023-04-21 00:30:30,153][39m Trial 4299 finished with value: 0.888888888888889 and parameters: {'objective': 'CrossEntropy', 'colsample_bylevel': 0.0961080276601318, 'depth': 10, 'boosting_type': 'Plain', 'bootstrap_type': 'Bayesian', 'bagging_temperature': 3.6437473176160156}. Best is trial 1464 with value: 0.8990825688073395.
[32m[I 2023-04-21 00:30:31,117][39m Trial 4300 finished with value: 0.8727272727272727 and parameters: {'objective': 'CrossEntropy', 'colsample_bylevel': 0.0966323821437426, 'depth': 7, 'boosting_type': 'Plain', 'bootstrap_type': 'Bayesian', 'bagging_temperature': 5.911010836851652}. Best is trial 1464 with value: 0.8990825688073395.
[32m[I 2023-04-21 00:30:32,300][39m Trial 4301 finished with value: 0.8727272727272727 and parameters: {'objective': 'Logloss', 'colsample_bylevel': 0.09594777910798627, 'depth': 9, 'boosting_type': 'Plain', 'bootstrap_type': 'Bayesian', 'bagging_temperature': 4.541459022213116}. Best is trial 1464 with value: 0.8990825688073395.
[32m[I 2023-04-21 00:30:34,244][39m Trial 4302 finished with value: 0.8727272727272727 and parameters: {'objective': 'Logloss', 'colsample_bylevel': 0.09477023147062935, 'depth': 9, 'boosting_type': 'Plain', 'bootstrap_type': 'Bayesian', 'bagging_temperature': 6.379154943078505}. Best is trial 1464 with value: 0.8990825688073395.
[32m[I 2023-04-21 00:30:35,418][39m Trial 4303 finished with value: 0.8495575221238938 and parameters: {'objective': 'Logloss', 'colsample_bylevel': 0.09988259176919086, 'depth': 7, 'boosting_type': 'Plain', 'bootstrap_type': 'MVS'}. Best is trial 1464 with value: 0.8990825688073395.
[32m[I 2023-04-21 00:30:36,538][39m Trial 4304 finished with value: 0.8727272727272727 and parameters: {'objective': 'Logloss', 'colsample_bylevel': 0.09503289113301425, 'depth': 10, 'boosting_type': 'Plain', 'bootstrap_type': 'Bayesian', 'bagging_temperature': 6.52491032581113}. Best is trial 1464 with value: 0.8990825688073395.
[32m[I 2023-04-21 00:30:37,452][39m Trial 4305 finished with value: 0.8807339449541284 and parameters: {'objective': 'CrossEntropy', 'colsample_bylevel': 0.08926348411137867, 'depth': 9, 'boosting_type': 'Plain', 'bootstrap_type': 'Bayesian', 'bagging_temperature': 4.920939887791497}. Best is trial 1464 with value: 0.8990825688073395.
[32m[I 2023-04-21 00:30:38,415][39m Trial 4306 finished with value: 0.8623853211009175 and parameters: {'objective': 'Logloss', 'colsample_bylevel': 0.09989168159350474, 'depth': 8, 'boosting_type': 'Plain', 'bootstrap_type': 'Bayesian', 'bagging_temperature': 4.781603869631341}. Best is trial 1464 with value: 0.8990825688073395.
[32m[I 2023-04-21 00:30:39,773][39m Trial 4307 finished with value: 0.8623853211009175 and parameters: {'objective': 'Logloss', 'colsample_bylevel': 0.09301891076877009, 'depth': 8, 'boosting_type': 'Plain', 'bootstrap_type': 'Bayesian', 'bagging_temperature': 5.343928020254015}. Best is trial 1464 with value: 0.8990825688073395.
[32m[I 2023-04-21 00:30:41,372][39m Trial 4308 finished with value: 0.8727272727272727 and parameters: {'objective': 'CrossEntropy', 'colsample_bylevel': 0.0984795809254505, 'depth': 9, 'boosting_type': 'Plain', 'bootstrap_type': 'Bayesian', 'bagging_temperature': 4.893830717963831}. Best is trial 1464 with value: 0.8990825688073395.
[32m[I 2023-04-21 00:30:42,504][39m Trial 4309 finished with value: 0.8828828828828829 and parameters: {'objective': 'Logloss', 'colsample_bylevel': 0.08901509177910084, 'depth': 9, 'boosting_type': 'Plain', 'bootstrap_type': 'Bayesian', 'bagging_temperature': 5.47841052196574}. Best is trial 1464 with value: 0.8990825688073395.
[32m[I 2023-04-21 00:30:43,395][39m Trial 4310 finished with value: 0.8807339449541284 and parameters: {'objective': 'Logloss', 'colsample_bylevel': 0.09972259981957732, 'depth': 6, 'boosting_type': 'Plain', 'bootstrap_type': 'Bayesian', 'bagging_temperature': 4.334634225549728}. Best is trial 1464 with value: 0.8990825688073395.
[32m[I 2023-04-21 00:30:44,798][39m Trial 4311 finished with value: 0.8807339449541284 and parameters: {'objective': 'Logloss', 'colsample_bylevel': 0.09254959824928667, 'depth': 9, 'boosting_type': 'Plain', 'bootstrap_type': 'Bayesian', 'bagging_temperature': 3.640571912415152}. Best is trial 1464 with value: 0.8990825688073395.
[32m[I 2023-04-21 00:30:45,594][39m Trial 4312 finished with value: 0.8727272727272727 and parameters: {'objective': 'CrossEntropy', 'colsample_bylevel': 0.09278412544694253, 'depth': 9, 'boosting_type': 'Plain', 'bootstrap_type': 'Bayesian', 'bagging_temperature': 5.021021594175351}. Best is trial 1464 with value: 0.8990825688073395.
[32m[I 2023-04-21 00:30:50,664][39m Trial 4313 finished with value: 0.8347826086956522 and parameters: {'objective': 'Logloss', 'colsample_bylevel': 0.09767631582448635, 'depth': 10, 'boosting_type': 'Ordered', 'bootstrap_type': 'Bayesian', 'bagging_temperature': 3.8503635598279025}. Best is trial 1464 with value: 0.8990825688073395.
[32m[I 2023-04-21 00:30:51,809][39m Trial 4314 finished with value: 0.875 and parameters: {'objective': 'CrossEntropy', 'colsample_bylevel': 0.0911145947716691, 'depth': 12, 'boosting_type': 'Plain', 'bootstrap_type': 'Bayesian', 'bagging_temperature': 4.925593847869164}. Best is trial 1464 with value: 0.8990825688073395.
[32m[I 2023-04-21 00:30:52,851][39m Trial 4315 finished with value: 0.8807339449541284 and parameters: {'objective': 'Logloss', 'colsample_bylevel': 0.09746463728481276, 'depth': 7, 'boosting_type': 'Plain', 'bootstrap_type': 'Bayesian', 'bagging_temperature': 6.8897716359557055}. Best is trial 1464 with value: 0.8990825688073395.
[32m[I 2023-04-21 00:30:53,932][39m Trial 4316 finished with value: 0.8828828828828829 and parameters: {'objective': 'Logloss', 'colsample_bylevel': 0.09032327949471736, 'depth': 11, 'boosting_type': 'Plain', 'bootstrap_type': 'Bayesian', 'bagging_temperature': 5.259769271904953}. Best is trial 1464 with value: 0.8990825688073395.
[32m[I 2023-04-21 00:30:55,209][39m Trial 4317 finished with value: 0.8623853211009175 and parameters: {'objective': 'CrossEntropy', 'colsample_bylevel': 0.09832428193983993, 'depth': 7, 'boosting_type': 'Plain', 'bootstrap_type': 'Bayesian', 'bagging_temperature': 5.169636941824218}. Best is trial 1464 with value: 0.8990825688073395.
[32m[I 2023-04-21 00:30:56,482][39m Trial 4318 finished with value: 0.8596491228070176 and parameters: {'objective': 'CrossEntropy', 'colsample_bylevel': 0.09057988215296041, 'depth': 6, 'boosting_type': 'Plain', 'bootstrap_type': 'Bayesian', 'bagging_temperature': 4.456539503711763}. Best is trial 1464 with value: 0.8990825688073395.
[32m[I 2023-04-21 00:30:57,578][39m Trial 4319 finished with value: 0.8571428571428572 and parameters: {'objective': 'Logloss', 'colsample_bylevel': 0.09641871274282386, 'depth': 10, 'boosting_type': 'Plain', 'bootstrap_type': 'Bernoulli', 'subsample': 0.8180118425887872}. Best is trial 1464 with value: 0.8990825688073395.
[32m[I 2023-04-21 00:30:58,809][39m Trial 4320 finished with value: 0.8807339449541284 and parameters: {'objective': 'Logloss', 'colsample_bylevel': 0.088928738055832, 'depth': 12, 'boosting_type': 'Plain', 'bootstrap_type': 'Bayesian', 'bagging_temperature': 5.22845518309951}. Best is trial 1464 with value: 0.8990825688073395.
[32m[I 2023-04-21 00:30:59,718][39m Trial 4321 finished with value: 0.8807339449541284 and parameters: {'objective': 'Logloss', 'colsample_bylevel': 0.09799778840670569, 'depth': 12, 'boosting_type': 'Plain', 'bootstrap_type': 'Bayesian', 'bagging_temperature': 3.7713114618037245}. Best is trial 1464 with value: 0.8990825688073395.
[32m[I 2023-04-21 00:31:00,671][39m Trial 4322 finished with value: 0.8596491228070176 and parameters: {'objective': 'Logloss', 'colsample_bylevel': 0.09997139883630232, 'depth': 7, 'boosting_type': 'Plain', 'bootstrap_type': 'MVS'}. Best is trial 1464 with value: 0.8990825688073395.
[32m[I 2023-04-21 00:31:01,265][39m Trial 4323 finished with value: 0.8623853211009175 and parameters: {'objective': 'CrossEntropy', 'colsample_bylevel': 0.09615111085965068, 'depth': 12, 'boosting_type': 'Plain', 'bootstrap_type': 'Bayesian', 'bagging_temperature': 4.1051395215949045}. Best is trial 1464 with value: 0.8990825688073395.
[32m[I 2023-04-21 00:31:02,526][39m Trial 4324 finished with value: 0.8205128205128206 and parameters: {'objective': 'Logloss', 'colsample_bylevel': 0.03457317646455742, 'depth': 12, 'boosting_type': 'Plain', 'bootstrap_type': 'Bayesian', 'bagging_temperature': 4.54254833796814}. Best is trial 1464 with value: 0.8990825688073395.
[32m[I 2023-04-21 00:31:03,360][39m Trial 4325 finished with value: 0.8727272727272727 and parameters: {'objective': 'CrossEntropy', 'colsample_bylevel': 0.09854118439196208, 'depth': 7, 'boosting_type': 'Plain', 'bootstrap_type': 'Bayesian', 'bagging_temperature': 3.1468841375603542}. Best is trial 1464 with value: 0.8990825688073395.
[32m[I 2023-04-21 00:31:04,339][39m Trial 4326 finished with value: 0.888888888888889 and parameters: {'objective': 'Logloss', 'colsample_bylevel': 0.09632364606169735, 'depth': 8, 'boosting_type': 'Plain', 'bootstrap_type': 'Bayesian', 'bagging_temperature': 5.492575656028961}. Best is trial 1464 with value: 0.8990825688073395.
[32m[I 2023-04-21 00:31:05,614][39m Trial 4327 finished with value: 0.8727272727272727 and parameters: {'objective': 'Logloss', 'colsample_bylevel': 0.09504285743268903, 'depth': 12, 'boosting_type': 'Plain', 'bootstrap_type': 'Bayesian', 'bagging_temperature': 6.131382413079207}. Best is trial 1464 with value: 0.8990825688073395.
[32m[I 2023-04-21 00:31:07,474][39m Trial 4328 finished with value: 0.8807339449541284 and parameters: {'objective': 'Logloss', 'colsample_bylevel': 0.09373956748404717, 'depth': 9, 'boosting_type': 'Plain', 'bootstrap_type': 'Bayesian', 'bagging_temperature': 4.957835430836685}. Best is trial 1464 with value: 0.8990825688073395.
[32m[I 2023-04-21 00:31:08,266][39m Trial 4329 finished with value: 0.8727272727272727 and parameters: {'objective': 'Logloss', 'colsample_bylevel': 0.09805978559142665, 'depth': 11, 'boosting_type': 'Plain', 'bootstrap_type': 'Bayesian', 'bagging_temperature': 4.143934791279075}. Best is trial 1464 with value: 0.8990825688073395.
[32m[I 2023-04-21 00:31:09,611][39m Trial 4330 finished with value: 0.8648648648648648 and parameters: {'objective': 'Logloss', 'colsample_bylevel': 0.09374270324317706, 'depth': 12, 'boosting_type': 'Plain', 'bootstrap_type': 'Bayesian', 'bagging_temperature': 6.140278422034406}. Best is trial 1464 with value: 0.8990825688073395.
[32m[I 2023-04-21 00:31:10,697][39m Trial 4331 finished with value: 0.8807339449541284 and parameters: {'objective': 'Logloss', 'colsample_bylevel': 0.09437376018393656, 'depth': 12, 'boosting_type': 'Plain', 'bootstrap_type': 'Bayesian', 'bagging_temperature': 6.758670464455885}. Best is trial 1464 with value: 0.8990825688073395.
[32m[I 2023-04-21 00:31:15,853][39m Trial 4332 finished with value: 0.8421052631578947 and parameters: {'objective': 'Logloss', 'colsample_bylevel': 0.09880481642167137, 'depth': 9, 'boosting_type': 'Ordered', 'bootstrap_type': 'Bayesian', 'bagging_temperature': 4.743562875441618}. Best is trial 1464 with value: 0.8990825688073395.
[32m[I 2023-04-21 00:31:16,975][39m Trial 4333 finished with value: 0.888888888888889 and parameters: {'objective': 'CrossEntropy', 'colsample_bylevel': 0.09216678503744691, 'depth': 12, 'boosting_type': 'Plain', 'bootstrap_type': 'Bayesian', 'bagging_temperature': 3.488158061804232}. Best is trial 1464 with value: 0.8990825688073395.
[32m[I 2023-04-21 00:31:18,353][39m Trial 4334 finished with value: 0.8727272727272727 and parameters: {'objective': 'Logloss', 'colsample_bylevel': 0.090209180159145, 'depth': 12, 'boosting_type': 'Plain', 'bootstrap_type': 'Bayesian', 'bagging_temperature': 5.18024871449465}. Best is trial 1464 with value: 0.8990825688073395.
[32m[I 2023-04-21 00:31:19,374][39m Trial 4335 finished with value: 0.888888888888889 and parameters: {'objective': 'Logloss', 'colsample_bylevel': 0.09834792562618493, 'depth': 12, 'boosting_type': 'Plain', 'bootstrap_type': 'Bayesian', 'bagging_temperature': 6.848170796738239}. Best is trial 1464 with value: 0.8990825688073395.
[32m[I 2023-04-21 00:31:20,141][39m Trial 4336 finished with value: 0.8623853211009175 and parameters: {'objective': 'Logloss', 'colsample_bylevel': 0.09018769261486156, 'depth': 7, 'boosting_type': 'Plain', 'bootstrap_type': 'Bayesian', 'bagging_temperature': 7.142448227204351}. Best is trial 1464 with value: 0.8990825688073395.
[32m[I 2023-04-21 00:31:21,482][39m Trial 4337 finished with value: 0.8727272727272727 and parameters: {'objective': 'Logloss', 'colsample_bylevel': 0.09295352763674074, 'depth': 12, 'boosting_type': 'Plain', 'bootstrap_type': 'Bayesian', 'bagging_temperature': 5.537449383135623}. Best is trial 1464 with value: 0.8990825688073395.
[32m[I 2023-04-21 00:31:22,808][39m Trial 4338 finished with value: 0.8807339449541284 and parameters: {'objective': 'Logloss', 'colsample_bylevel': 0.09262050468278864, 'depth': 12, 'boosting_type': 'Plain', 'bootstrap_type': 'Bayesian', 'bagging_temperature': 5.231479165388633}. Best is trial 1464 with value: 0.8990825688073395.
[32m[I 2023-04-21 00:31:24,107][39m Trial 4339 finished with value: 0.8648648648648648 and parameters: {'objective': 'CrossEntropy', 'colsample_bylevel': 0.08729667282837165, 'depth': 11, 'boosting_type': 'Plain', 'bootstrap_type': 'Bayesian', 'bagging_temperature': 5.27531454948548}. Best is trial 1464 with value: 0.8990825688073395.
[32m[I 2023-04-21 00:31:25,040][39m Trial 4340 finished with value: 0.8648648648648648 and parameters: {'objective': 'CrossEntropy', 'colsample_bylevel': 0.09053261614403822, 'depth': 12, 'boosting_type': 'Plain', 'bootstrap_type': 'Bayesian', 'bagging_temperature': 5.696115469790002}. Best is trial 1464 with value: 0.8990825688073395.
[32m[I 2023-04-21 00:31:26,164][39m Trial 4341 finished with value: 0.8623853211009175 and parameters: {'objective': 'Logloss', 'colsample_bylevel': 0.09150984662775892, 'depth': 6, 'boosting_type': 'Plain', 'bootstrap_type': 'Bayesian', 'bagging_temperature': 6.949938882245243}. Best is trial 1464 with value: 0.8990825688073395.
[32m[I 2023-04-21 00:31:26,931][39m Trial 4342 finished with value: 0.8347826086956522 and parameters: {'objective': 'Logloss', 'colsample_bylevel': 0.06531597535555086, 'depth': 12, 'boosting_type': 'Plain', 'bootstrap_type': 'Bernoulli', 'subsample': 0.763010363443464}. Best is trial 1464 with value: 0.8990825688073395.
[32m[I 2023-04-21 00:31:28,241][39m Trial 4343 finished with value: 0.8727272727272727 and parameters: {'objective': 'CrossEntropy', 'colsample_bylevel': 0.08902684508933101, 'depth': 9, 'boosting_type': 'Plain', 'bootstrap_type': 'Bayesian', 'bagging_temperature': 7.478974253955124}. Best is trial 1464 with value: 0.8990825688073395.
[32m[I 2023-04-21 00:31:29,123][39m Trial 4344 finished with value: 0.888888888888889 and parameters: {'objective': 'CrossEntropy', 'colsample_bylevel': 0.09117715613025378, 'depth': 7, 'boosting_type': 'Plain', 'bootstrap_type': 'Bayesian', 'bagging_temperature': 5.148197292706711}. Best is trial 1464 with value: 0.8990825688073395.
[32m[I 2023-04-21 00:31:30,736][39m Trial 4345 finished with value: 0.8727272727272727 and parameters: {'objective': 'Logloss', 'colsample_bylevel': 0.09500936365125702, 'depth': 9, 'boosting_type': 'Plain', 'bootstrap_type': 'Bayesian', 'bagging_temperature': 4.960684198157075}. Best is trial 1464 with value: 0.8990825688073395.
[32m[I 2023-04-21 00:31:32,225][39m Trial 4346 finished with value: 0.8521739130434783 and parameters: {'objective': 'CrossEntropy', 'colsample_bylevel': 0.09115971427128872, 'depth': 9, 'boosting_type': 'Plain', 'bootstrap_type': 'MVS'}. Best is trial 1464 with value: 0.8990825688073395.
