[32m[I 2023-04-21 00:41:53,416][39m Trial 4806 finished with value: 0.8623853211009175 and parameters: {'objective': 'CrossEntropy', 'colsample_bylevel': 0.09151399288436583, 'depth': 12, 'boosting_type': 'Plain', 'bootstrap_type': 'Bayesian', 'bagging_temperature': 3.874945665627761}. Best is trial 1464 with value: 0.8990825688073395.
[32m[I 2023-04-21 00:41:55,155][39m Trial 4807 finished with value: 0.8807339449541284 and parameters: {'objective': 'CrossEntropy', 'colsample_bylevel': 0.09497820838587362, 'depth': 8, 'boosting_type': 'Plain', 'bootstrap_type': 'Bayesian', 'bagging_temperature': 7.329177747176695}. Best is trial 1464 with value: 0.8990825688073395.
[32m[I 2023-04-21 00:41:56,297][39m Trial 4808 finished with value: 0.8545454545454546 and parameters: {'objective': 'CrossEntropy', 'colsample_bylevel': 0.08622490627814781, 'depth': 11, 'boosting_type': 'Plain', 'bootstrap_type': 'Bayesian', 'bagging_temperature': 4.803420630737455}. Best is trial 1464 with value: 0.8990825688073395.
[32m[I 2023-04-21 00:41:57,417][39m Trial 4809 finished with value: 0.8727272727272727 and parameters: {'objective': 'Logloss', 'colsample_bylevel': 0.0916180462825139, 'depth': 9, 'boosting_type': 'Plain', 'bootstrap_type': 'Bayesian', 'bagging_temperature': 4.780495348707351}. Best is trial 1464 with value: 0.8990825688073395.
[32m[I 2023-04-21 00:41:58,935][39m Trial 4810 finished with value: 0.8785046728971961 and parameters: {'objective': 'CrossEntropy', 'colsample_bylevel': 0.08381796467965331, 'depth': 9, 'boosting_type': 'Plain', 'bootstrap_type': 'Bayesian', 'bagging_temperature': 6.964266448954232}. Best is trial 1464 with value: 0.8990825688073395.
[32m[I 2023-04-21 00:42:00,502][39m Trial 4811 finished with value: 0.8807339449541284 and parameters: {'objective': 'Logloss', 'colsample_bylevel': 0.09173843952078146, 'depth': 8, 'boosting_type': 'Plain', 'bootstrap_type': 'Bayesian', 'bagging_temperature': 5.367821613939458}. Best is trial 1464 with value: 0.8990825688073395.
[32m[I 2023-04-21 00:42:01,282][39m Trial 4812 finished with value: 0.8495575221238938 and parameters: {'objective': 'CrossEntropy', 'colsample_bylevel': 0.0857600714438218, 'depth': 12, 'boosting_type': 'Plain', 'bootstrap_type': 'Bayesian', 'bagging_temperature': 4.608905706688578}. Best is trial 1464 with value: 0.8990825688073395.
[32m[I 2023-04-21 00:42:02,015][39m Trial 4813 finished with value: 0.8727272727272727 and parameters: {'objective': 'CrossEntropy', 'colsample_bylevel': 0.09059239119125606, 'depth': 10, 'boosting_type': 'Plain', 'bootstrap_type': 'Bayesian', 'bagging_temperature': 3.2086239104703616}. Best is trial 1464 with value: 0.8990825688073395.
[32m[I 2023-04-21 00:42:03,356][39m Trial 4814 finished with value: 0.8727272727272727 and parameters: {'objective': 'CrossEntropy', 'colsample_bylevel': 0.08189172071347638, 'depth': 12, 'boosting_type': 'Plain', 'bootstrap_type': 'Bayesian', 'bagging_temperature': 4.100183327239425}. Best is trial 1464 with value: 0.8990825688073395.
[32m[I 2023-04-21 00:42:04,583][39m Trial 4815 finished with value: 0.8571428571428572 and parameters: {'objective': 'Logloss', 'colsample_bylevel': 0.08377465287363454, 'depth': 12, 'boosting_type': 'Plain', 'bootstrap_type': 'Bayesian', 'bagging_temperature': 5.72913793451124}. Best is trial 1464 with value: 0.8990825688073395.
[32m[I 2023-04-21 00:42:05,373][39m Trial 4816 finished with value: 0.8648648648648648 and parameters: {'objective': 'CrossEntropy', 'colsample_bylevel': 0.08364228961737614, 'depth': 12, 'boosting_type': 'Plain', 'bootstrap_type': 'Bayesian', 'bagging_temperature': 4.998144047157014}. Best is trial 1464 with value: 0.8990825688073395.
[32m[I 2023-04-21 00:42:06,478][39m Trial 4817 finished with value: 0.8648648648648648 and parameters: {'objective': 'CrossEntropy', 'colsample_bylevel': 0.08098389419520333, 'depth': 12, 'boosting_type': 'Plain', 'bootstrap_type': 'Bayesian', 'bagging_temperature': 5.378825928748871}. Best is trial 1464 with value: 0.8990825688073395.
[32m[I 2023-04-21 00:42:07,543][39m Trial 4818 finished with value: 0.8727272727272727 and parameters: {'objective': 'CrossEntropy', 'colsample_bylevel': 0.08720941656903351, 'depth': 12, 'boosting_type': 'Plain', 'bootstrap_type': 'Bayesian', 'bagging_temperature': 5.357054628558995}. Best is trial 1464 with value: 0.8990825688073395.
[32m[I 2023-04-21 00:42:08,791][39m Trial 4819 finished with value: 0.8571428571428572 and parameters: {'objective': 'Logloss', 'colsample_bylevel': 0.08066409441913028, 'depth': 12, 'boosting_type': 'Plain', 'bootstrap_type': 'Bayesian', 'bagging_temperature': 5.000450113036021}. Best is trial 1464 with value: 0.8990825688073395.
[32m[I 2023-04-21 00:42:09,752][39m Trial 4820 finished with value: 0.8807339449541284 and parameters: {'objective': 'Logloss', 'colsample_bylevel': 0.0922775002497433, 'depth': 9, 'boosting_type': 'Plain', 'bootstrap_type': 'Bayesian', 'bagging_temperature': 4.983752128945511}. Best is trial 1464 with value: 0.8990825688073395.
[32m[I 2023-04-21 00:42:14,798][39m Trial 4821 finished with value: 0.8571428571428572 and parameters: {'objective': 'Logloss', 'colsample_bylevel': 0.09463453555924278, 'depth': 10, 'boosting_type': 'Ordered', 'bootstrap_type': 'Bayesian', 'bagging_temperature': 6.640697363680928}. Best is trial 1464 with value: 0.8990825688073395.
[32m[I 2023-04-21 00:42:16,341][39m Trial 4822 finished with value: 0.8596491228070176 and parameters: {'objective': 'CrossEntropy', 'colsample_bylevel': 0.08203139996503532, 'depth': 9, 'boosting_type': 'Plain', 'bootstrap_type': 'Bayesian', 'bagging_temperature': 5.020846677221229}. Best is trial 1464 with value: 0.8990825688073395.
[32m[I 2023-04-21 00:42:17,613][39m Trial 4823 finished with value: 0.8672566371681416 and parameters: {'objective': 'Logloss', 'colsample_bylevel': 0.08763179205208904, 'depth': 12, 'boosting_type': 'Plain', 'bootstrap_type': 'Bayesian', 'bagging_temperature': 5.869657023998299}. Best is trial 1464 with value: 0.8990825688073395.
[32m[I 2023-04-21 00:42:18,961][39m Trial 4824 finished with value: 0.8807339449541284 and parameters: {'objective': 'CrossEntropy', 'colsample_bylevel': 0.08483069898492794, 'depth': 12, 'boosting_type': 'Plain', 'bootstrap_type': 'Bayesian', 'bagging_temperature': 5.0506936972458725}. Best is trial 1464 with value: 0.8990825688073395.
[32m[I 2023-04-21 00:42:19,712][39m Trial 4825 finished with value: 0.8571428571428572 and parameters: {'objective': 'Logloss', 'colsample_bylevel': 0.08843744839769287, 'depth': 12, 'boosting_type': 'Plain', 'bootstrap_type': 'Bernoulli', 'subsample': 0.4897187311140554}. Best is trial 1464 with value: 0.8990825688073395.
[32m[I 2023-04-21 00:42:20,883][39m Trial 4826 finished with value: 0.875 and parameters: {'objective': 'CrossEntropy', 'colsample_bylevel': 0.08809805261833994, 'depth': 5, 'boosting_type': 'Plain', 'bootstrap_type': 'Bayesian', 'bagging_temperature': 5.357956149556564}. Best is trial 1464 with value: 0.8990825688073395.
[32m[I 2023-04-21 00:42:22,117][39m Trial 4827 finished with value: 0.8727272727272727 and parameters: {'objective': 'Logloss', 'colsample_bylevel': 0.08916865234778407, 'depth': 11, 'boosting_type': 'Plain', 'bootstrap_type': 'Bayesian', 'bagging_temperature': 5.519804967329545}. Best is trial 1464 with value: 0.8990825688073395.
[32m[I 2023-04-21 00:42:23,160][39m Trial 4828 finished with value: 0.8495575221238938 and parameters: {'objective': 'CrossEntropy', 'colsample_bylevel': 0.08891140197331755, 'depth': 12, 'boosting_type': 'Plain', 'bootstrap_type': 'MVS'}. Best is trial 1464 with value: 0.8990825688073395.
[32m[I 2023-04-21 00:42:23,899][39m Trial 4829 finished with value: 0.8807339449541284 and parameters: {'objective': 'Logloss', 'colsample_bylevel': 0.09120415780299741, 'depth': 11, 'boosting_type': 'Plain', 'bootstrap_type': 'Bayesian', 'bagging_temperature': 7.164600638032828}. Best is trial 1464 with value: 0.8990825688073395.
[32m[I 2023-04-21 00:42:25,274][39m Trial 4830 finished with value: 0.8727272727272727 and parameters: {'objective': 'CrossEntropy', 'colsample_bylevel': 0.08665774000871573, 'depth': 12, 'boosting_type': 'Plain', 'bootstrap_type': 'Bayesian', 'bagging_temperature': 4.478952647985686}. Best is trial 1464 with value: 0.8990825688073395.
[32m[I 2023-04-21 00:42:26,348][39m Trial 4831 finished with value: 0.888888888888889 and parameters: {'objective': 'CrossEntropy', 'colsample_bylevel': 0.0929826748034453, 'depth': 9, 'boosting_type': 'Plain', 'bootstrap_type': 'Bayesian', 'bagging_temperature': 5.044250727453274}. Best is trial 1464 with value: 0.8990825688073395.
[32m[I 2023-04-21 00:42:27,101][39m Trial 4832 finished with value: 0.8623853211009175 and parameters: {'objective': 'Logloss', 'colsample_bylevel': 0.0858447975550954, 'depth': 12, 'boosting_type': 'Plain', 'bootstrap_type': 'Bayesian', 'bagging_temperature': 4.687964126138049}. Best is trial 1464 with value: 0.8990825688073395.
[32m[I 2023-04-21 00:42:27,881][39m Trial 4833 finished with value: 0.875 and parameters: {'objective': 'CrossEntropy', 'colsample_bylevel': 0.09163299072633262, 'depth': 10, 'boosting_type': 'Plain', 'bootstrap_type': 'Bayesian', 'bagging_temperature': 6.943984267439449}. Best is trial 1464 with value: 0.8990825688073395.
[32m[I 2023-04-21 00:42:29,115][39m Trial 4834 finished with value: 0.875 and parameters: {'objective': 'CrossEntropy', 'colsample_bylevel': 0.09002296199853647, 'depth': 11, 'boosting_type': 'Plain', 'bootstrap_type': 'Bayesian', 'bagging_temperature': 4.5147428065203075}. Best is trial 1464 with value: 0.8990825688073395.
[32m[I 2023-04-21 00:42:30,913][39m Trial 4835 finished with value: 0.8703703703703703 and parameters: {'objective': 'Logloss', 'colsample_bylevel': 0.09044551742205535, 'depth': 9, 'boosting_type': 'Plain', 'bootstrap_type': 'Bayesian', 'bagging_temperature': 4.7983142216495684}. Best is trial 1464 with value: 0.8990825688073395.
[32m[I 2023-04-21 00:42:32,669][39m Trial 4836 finished with value: 0.8807339449541284 and parameters: {'objective': 'Logloss', 'colsample_bylevel': 0.088481180376332, 'depth': 9, 'boosting_type': 'Plain', 'bootstrap_type': 'Bayesian', 'bagging_temperature': 4.974352476438212}. Best is trial 1464 with value: 0.8990825688073395.
[32m[I 2023-04-21 00:42:33,570][39m Trial 4837 finished with value: 0.8596491228070176 and parameters: {'objective': 'CrossEntropy', 'colsample_bylevel': 0.05755764002638078, 'depth': 12, 'boosting_type': 'Plain', 'bootstrap_type': 'Bayesian', 'bagging_temperature': 7.284509141136541}. Best is trial 1464 with value: 0.8990825688073395.
[32m[I 2023-04-21 00:42:34,483][39m Trial 4838 finished with value: 0.888888888888889 and parameters: {'objective': 'Logloss', 'colsample_bylevel': 0.09022685261769377, 'depth': 12, 'boosting_type': 'Plain', 'bootstrap_type': 'Bayesian', 'bagging_temperature': 5.129193314869257}. Best is trial 1464 with value: 0.8990825688073395.
[32m[I 2023-04-21 00:42:35,139][39m Trial 4839 finished with value: 0.8305084745762712 and parameters: {'objective': 'CrossEntropy', 'colsample_bylevel': 0.04088817850055892, 'depth': 11, 'boosting_type': 'Plain', 'bootstrap_type': 'Bayesian', 'bagging_temperature': 4.774216312913043}. Best is trial 1464 with value: 0.8990825688073395.
[32m[I 2023-04-21 00:42:36,451][39m Trial 4840 finished with value: 0.7652173913043477 and parameters: {'objective': 'Logloss', 'colsample_bylevel': 0.012056558282368693, 'depth': 12, 'boosting_type': 'Plain', 'bootstrap_type': 'Bayesian', 'bagging_temperature': 4.953206928433703}. Best is trial 1464 with value: 0.8990825688073395.
[32m[I 2023-04-21 00:42:37,720][39m Trial 4841 finished with value: 0.8727272727272727 and parameters: {'objective': 'CrossEntropy', 'colsample_bylevel': 0.08839538332162179, 'depth': 11, 'boosting_type': 'Plain', 'bootstrap_type': 'Bayesian', 'bagging_temperature': 5.132933144530962}. Best is trial 1464 with value: 0.8990825688073395.
[32m[I 2023-04-21 00:42:38,448][39m Trial 4842 finished with value: 0.8703703703703703 and parameters: {'objective': 'CrossEntropy', 'colsample_bylevel': 0.08386857457960059, 'depth': 12, 'boosting_type': 'Plain', 'bootstrap_type': 'Bayesian', 'bagging_temperature': 5.76258511687692}. Best is trial 1464 with value: 0.8990825688073395.
[32m[I 2023-04-21 00:42:43,190][39m Trial 4843 finished with value: 0.8421052631578947 and parameters: {'objective': 'Logloss', 'colsample_bylevel': 0.0961690842931475, 'depth': 7, 'boosting_type': 'Ordered', 'bootstrap_type': 'Bayesian', 'bagging_temperature': 3.6651242431387026}. Best is trial 1464 with value: 0.8990825688073395.
[32m[I 2023-04-21 00:42:44,175][39m Trial 4844 finished with value: 0.8571428571428572 and parameters: {'objective': 'Logloss', 'colsample_bylevel': 0.09610613972665379, 'depth': 6, 'boosting_type': 'Plain', 'bootstrap_type': 'Bernoulli', 'subsample': 0.962214348508664}. Best is trial 1464 with value: 0.8990825688073395.
[32m[I 2023-04-21 00:42:45,507][39m Trial 4845 finished with value: 0.8807339449541284 and parameters: {'objective': 'CrossEntropy', 'colsample_bylevel': 0.0839073987840855, 'depth': 12, 'boosting_type': 'Plain', 'bootstrap_type': 'Bayesian', 'bagging_temperature': 4.809812975587159}. Best is trial 1464 with value: 0.8990825688073395.
[32m[I 2023-04-21 00:42:46,611][39m Trial 4846 finished with value: 0.8495575221238938 and parameters: {'objective': 'Logloss', 'colsample_bylevel': 0.08899850912534626, 'depth': 12, 'boosting_type': 'Plain', 'bootstrap_type': 'Bayesian', 'bagging_temperature': 5.439417555840208}. Best is trial 1464 with value: 0.8990825688073395.
[32m[I 2023-04-21 00:42:48,351][39m Trial 4847 finished with value: 0.8807339449541284 and parameters: {'objective': 'Logloss', 'colsample_bylevel': 0.09204282024090885, 'depth': 9, 'boosting_type': 'Plain', 'bootstrap_type': 'Bayesian', 'bagging_temperature': 5.208499673900495}. Best is trial 1464 with value: 0.8990825688073395.
[32m[I 2023-04-21 00:42:49,304][39m Trial 4848 finished with value: 0.8807339449541284 and parameters: {'objective': 'Logloss', 'colsample_bylevel': 0.08496230575051798, 'depth': 12, 'boosting_type': 'Plain', 'bootstrap_type': 'Bayesian', 'bagging_temperature': 7.056874933659022}. Best is trial 1464 with value: 0.8990825688073395.
[32m[I 2023-04-21 00:42:50,047][39m Trial 4849 finished with value: 0.8495575221238938 and parameters: {'objective': 'CrossEntropy', 'colsample_bylevel': 0.09405954744927456, 'depth': 7, 'boosting_type': 'Plain', 'bootstrap_type': 'MVS'}. Best is trial 1464 with value: 0.8990825688073395.
[32m[I 2023-04-21 00:42:51,041][39m Trial 4850 finished with value: 0.8807339449541284 and parameters: {'objective': 'CrossEntropy', 'colsample_bylevel': 0.0902144884027329, 'depth': 11, 'boosting_type': 'Plain', 'bootstrap_type': 'Bayesian', 'bagging_temperature': 4.131879475743688}. Best is trial 1464 with value: 0.8990825688073395.
[32m[I 2023-04-21 00:42:52,489][39m Trial 4851 finished with value: 0.8703703703703703 and parameters: {'objective': 'CrossEntropy', 'colsample_bylevel': 0.07846348628852015, 'depth': 11, 'boosting_type': 'Plain', 'bootstrap_type': 'Bayesian', 'bagging_temperature': 7.730790648135565}. Best is trial 1464 with value: 0.8990825688073395.
[32m[I 2023-04-21 00:42:53,965][39m Trial 4852 finished with value: 0.8807339449541284 and parameters: {'objective': 'Logloss', 'colsample_bylevel': 0.09285324839009441, 'depth': 9, 'boosting_type': 'Plain', 'bootstrap_type': 'Bayesian', 'bagging_temperature': 4.796014593862416}. Best is trial 1464 with value: 0.8990825688073395.
[32m[I 2023-04-21 00:42:54,699][39m Trial 4853 finished with value: 0.8596491228070176 and parameters: {'objective': 'Logloss', 'colsample_bylevel': 0.08755456842633615, 'depth': 10, 'boosting_type': 'Plain', 'bootstrap_type': 'Bayesian', 'bagging_temperature': 6.377454262197089}. Best is trial 1464 with value: 0.8990825688073395.
[32m[I 2023-04-21 00:42:55,311][39m Trial 4854 finished with value: 0.8807339449541284 and parameters: {'objective': 'CrossEntropy', 'colsample_bylevel': 0.09836324887285043, 'depth': 10, 'boosting_type': 'Plain', 'bootstrap_type': 'Bayesian', 'bagging_temperature': 4.5080975996568515}. Best is trial 1464 with value: 0.8990825688073395.
[32m[I 2023-04-21 00:42:56,547][39m Trial 4855 finished with value: 0.8598130841121495 and parameters: {'objective': 'CrossEntropy', 'colsample_bylevel': 0.09710120930062845, 'depth': 11, 'boosting_type': 'Plain', 'bootstrap_type': 'Bayesian', 'bagging_temperature': 7.429375828844151}. Best is trial 1464 with value: 0.8990825688073395.
[32m[I 2023-04-21 00:42:57,660][39m Trial 4856 finished with value: 0.8672566371681416 and parameters: {'objective': 'Logloss', 'colsample_bylevel': 0.08246361069463042, 'depth': 12, 'boosting_type': 'Plain', 'bootstrap_type': 'Bayesian', 'bagging_temperature': 5.95512320010766}. Best is trial 1464 with value: 0.8990825688073395.
[32m[I 2023-04-21 00:42:59,392][39m Trial 4857 finished with value: 0.8648648648648648 and parameters: {'objective': 'Logloss', 'colsample_bylevel': 0.09389562136650823, 'depth': 9, 'boosting_type': 'Plain', 'bootstrap_type': 'Bayesian', 'bagging_temperature': 6.630384056443009}. Best is trial 1464 with value: 0.8990825688073395.
[32m[I 2023-04-21 00:43:00,465][39m Trial 4858 finished with value: 0.8703703703703703 and parameters: {'objective': 'Logloss', 'colsample_bylevel': 0.09615507431085815, 'depth': 7, 'boosting_type': 'Plain', 'bootstrap_type': 'Bayesian', 'bagging_temperature': 5.460871203787969}. Best is trial 1464 with value: 0.8990825688073395.
[32m[I 2023-04-21 00:43:04,660][39m Trial 4859 finished with value: 0.8347826086956522 and parameters: {'objective': 'Logloss', 'colsample_bylevel': 0.036095624564520694, 'depth': 8, 'boosting_type': 'Ordered', 'bootstrap_type': 'Bayesian', 'bagging_temperature': 5.276106237300411}. Best is trial 1464 with value: 0.8990825688073395.
[32m[I 2023-04-21 00:43:05,885][39m Trial 4860 finished with value: 0.8376068376068375 and parameters: {'objective': 'CrossEntropy', 'colsample_bylevel': 0.09283866823978187, 'depth': 2, 'boosting_type': 'Plain', 'bootstrap_type': 'Bayesian', 'bagging_temperature': 6.410308707068489}. Best is trial 1464 with value: 0.8990825688073395.
[32m[I 2023-04-21 00:43:07,198][39m Trial 4861 finished with value: 0.8807339449541284 and parameters: {'objective': 'Logloss', 'colsample_bylevel': 0.08831007240494773, 'depth': 12, 'boosting_type': 'Plain', 'bootstrap_type': 'Bayesian', 'bagging_temperature': 5.758616954556873}. Best is trial 1464 with value: 0.8990825688073395.
[32m[I 2023-04-21 00:43:08,298][39m Trial 4862 finished with value: 0.888888888888889 and parameters: {'objective': 'Logloss', 'colsample_bylevel': 0.09287716199287256, 'depth': 10, 'boosting_type': 'Plain', 'bootstrap_type': 'Bayesian', 'bagging_temperature': 4.331832849952193}. Best is trial 1464 with value: 0.8990825688073395.
[32m[I 2023-04-21 00:43:10,157][39m Trial 4863 finished with value: 0.8727272727272727 and parameters: {'objective': 'Logloss', 'colsample_bylevel': 0.09418146028044742, 'depth': 9, 'boosting_type': 'Plain', 'bootstrap_type': 'Bayesian', 'bagging_temperature': 5.82218702855215}. Best is trial 1464 with value: 0.8990825688073395.
[32m[I 2023-04-21 00:43:10,863][39m Trial 4864 finished with value: 0.8648648648648648 and parameters: {'objective': 'Logloss', 'colsample_bylevel': 0.08388889987565194, 'depth': 7, 'boosting_type': 'Plain', 'bootstrap_type': 'Bayesian', 'bagging_temperature': 5.583095668961782}. Best is trial 1464 with value: 0.8990825688073395.
[32m[I 2023-04-21 00:43:12,162][39m Trial 4865 finished with value: 0.8807339449541284 and parameters: {'objective': 'Logloss', 'colsample_bylevel': 0.09565503560363268, 'depth': 10, 'boosting_type': 'Plain', 'bootstrap_type': 'Bayesian', 'bagging_temperature': 6.4203662636608145}. Best is trial 1464 with value: 0.8990825688073395.
[32m[I 2023-04-21 00:43:13,298][39m Trial 4866 finished with value: 0.8807339449541284 and parameters: {'objective': 'CrossEntropy', 'colsample_bylevel': 0.09242966443828389, 'depth': 12, 'boosting_type': 'Plain', 'bootstrap_type': 'Bayesian', 'bagging_temperature': 6.7221188655031305}. Best is trial 1464 with value: 0.8990825688073395.
[32m[I 2023-04-21 00:43:14,390][39m Trial 4867 finished with value: 0.8727272727272727 and parameters: {'objective': 'CrossEntropy', 'colsample_bylevel': 0.08725826390170775, 'depth': 10, 'boosting_type': 'Plain', 'bootstrap_type': 'Bayesian', 'bagging_temperature': 5.495795104852599}. Best is trial 1464 with value: 0.8990825688073395.
[32m[I 2023-04-21 00:43:15,530][39m Trial 4868 finished with value: 0.8727272727272727 and parameters: {'objective': 'Logloss', 'colsample_bylevel': 0.09527428491441833, 'depth': 7, 'boosting_type': 'Plain', 'bootstrap_type': 'Bayesian', 'bagging_temperature': 5.078971102517066}. Best is trial 1464 with value: 0.8990825688073395.
[32m[I 2023-04-21 00:43:16,470][39m Trial 4869 finished with value: 0.8623853211009175 and parameters: {'objective': 'Logloss', 'colsample_bylevel': 0.08587938902060863, 'depth': 12, 'boosting_type': 'Plain', 'bootstrap_type': 'Bayesian', 'bagging_temperature': 5.172820801643596}. Best is trial 1464 with value: 0.8990825688073395.
[32m[I 2023-04-21 00:43:17,291][39m Trial 4870 finished with value: 0.8807339449541284 and parameters: {'objective': 'Logloss', 'colsample_bylevel': 0.09328930856994462, 'depth': 12, 'boosting_type': 'Plain', 'bootstrap_type': 'Bayesian', 'bagging_temperature': 5.985040193445219}. Best is trial 1464 with value: 0.8990825688073395.
