[32m[I 2023-04-21 00:22:45,686][39m Trial 3953 finished with value: 0.8727272727272727 and parameters: {'objective': 'Logloss', 'colsample_bylevel': 0.09803814646714908, 'depth': 11, 'boosting_type': 'Plain', 'bootstrap_type': 'Bayesian', 'bagging_temperature': 4.345216274480944}. Best is trial 1464 with value: 0.8990825688073395.
[32m[I 2023-04-21 00:22:46,455][39m Trial 3954 finished with value: 0.8807339449541284 and parameters: {'objective': 'Logloss', 'colsample_bylevel': 0.09988551334618762, 'depth': 7, 'boosting_type': 'Plain', 'bootstrap_type': 'Bayesian', 'bagging_temperature': 6.304191133370261}. Best is trial 1464 with value: 0.8990825688073395.
[32m[I 2023-04-21 00:22:47,161][39m Trial 3955 finished with value: 0.8807339449541284 and parameters: {'objective': 'CrossEntropy', 'colsample_bylevel': 0.09423750256024559, 'depth': 7, 'boosting_type': 'Plain', 'bootstrap_type': 'Bayesian', 'bagging_temperature': 5.172092439876046}. Best is trial 1464 with value: 0.8990825688073395.
[32m[I 2023-04-21 00:22:47,872][39m Trial 3956 finished with value: 0.8828828828828829 and parameters: {'objective': 'Logloss', 'colsample_bylevel': 0.0930694971019986, 'depth': 10, 'boosting_type': 'Plain', 'bootstrap_type': 'Bayesian', 'bagging_temperature': 5.87137609292058}. Best is trial 1464 with value: 0.8990825688073395.
[32m[I 2023-04-21 00:22:49,216][39m Trial 3957 finished with value: 0.888888888888889 and parameters: {'objective': 'Logloss', 'colsample_bylevel': 0.09592086271765556, 'depth': 6, 'boosting_type': 'Plain', 'bootstrap_type': 'Bayesian', 'bagging_temperature': 5.774606127825019}. Best is trial 1464 with value: 0.8990825688073395.
[32m[I 2023-04-21 00:22:50,365][39m Trial 3958 finished with value: 0.888888888888889 and parameters: {'objective': 'Logloss', 'colsample_bylevel': 0.09134509526169045, 'depth': 10, 'boosting_type': 'Plain', 'bootstrap_type': 'Bayesian', 'bagging_temperature': 5.314171755008559}. Best is trial 1464 with value: 0.8990825688073395.
[32m[I 2023-04-21 00:22:55,794][39m Trial 3959 finished with value: 0.8495575221238938 and parameters: {'objective': 'Logloss', 'colsample_bylevel': 0.09416974600250504, 'depth': 7, 'boosting_type': 'Ordered', 'bootstrap_type': 'Bayesian', 'bagging_temperature': 5.572288117660895}. Best is trial 1464 with value: 0.8990825688073395.
[32m[I 2023-04-21 00:22:56,980][39m Trial 3960 finished with value: 0.8807339449541284 and parameters: {'objective': 'Logloss', 'colsample_bylevel': 0.09435180320201203, 'depth': 11, 'boosting_type': 'Plain', 'bootstrap_type': 'Bayesian', 'bagging_temperature': 5.962938224322182}. Best is trial 1464 with value: 0.8990825688073395.
[32m[I 2023-04-21 00:22:58,095][39m Trial 3961 finished with value: 0.8807339449541284 and parameters: {'objective': 'Logloss', 'colsample_bylevel': 0.0959055661331432, 'depth': 6, 'boosting_type': 'Plain', 'bootstrap_type': 'Bayesian', 'bagging_temperature': 4.26503482318301}. Best is trial 1464 with value: 0.8990825688073395.
[32m[I 2023-04-21 00:22:59,928][39m Trial 3962 finished with value: 0.888888888888889 and parameters: {'objective': 'Logloss', 'colsample_bylevel': 0.09526796250133418, 'depth': 9, 'boosting_type': 'Plain', 'bootstrap_type': 'Bayesian', 'bagging_temperature': 6.13914461578223}. Best is trial 1464 with value: 0.8990825688073395.
[32m[I 2023-04-21 00:23:00,894][39m Trial 3963 finished with value: 0.8376068376068375 and parameters: {'objective': 'Logloss', 'colsample_bylevel': 0.058869921599582466, 'depth': 9, 'boosting_type': 'Plain', 'bootstrap_type': 'Bayesian', 'bagging_temperature': 5.163026436657675}. Best is trial 1464 with value: 0.8990825688073395.
[32m[I 2023-04-21 00:23:01,757][39m Trial 3964 finished with value: 0.8727272727272727 and parameters: {'objective': 'CrossEntropy', 'colsample_bylevel': 0.09704767293396901, 'depth': 9, 'boosting_type': 'Plain', 'bootstrap_type': 'Bayesian', 'bagging_temperature': 4.7805589195823925}. Best is trial 1464 with value: 0.8990825688073395.
[32m[I 2023-04-21 00:23:02,337][39m Trial 3965 finished with value: 0.831858407079646 and parameters: {'objective': 'Logloss', 'colsample_bylevel': 0.09341269943526626, 'depth': 7, 'boosting_type': 'Plain', 'bootstrap_type': 'Bayesian', 'bagging_temperature': 4.180052152429656}. Best is trial 1464 with value: 0.8990825688073395.
[32m[I 2023-04-21 00:23:03,189][39m Trial 3966 finished with value: 0.8598130841121495 and parameters: {'objective': 'CrossEntropy', 'colsample_bylevel': 0.09752762440019819, 'depth': 10, 'boosting_type': 'Plain', 'bootstrap_type': 'Bayesian', 'bagging_temperature': 5.736676309471999}. Best is trial 1464 with value: 0.8990825688073395.
[32m[I 2023-04-21 00:23:04,535][39m Trial 3967 finished with value: 0.8807339449541284 and parameters: {'objective': 'CrossEntropy', 'colsample_bylevel': 0.0962457191569406, 'depth': 7, 'boosting_type': 'Plain', 'bootstrap_type': 'Bayesian', 'bagging_temperature': 4.964035608979246}. Best is trial 1464 with value: 0.8990825688073395.
[32m[I 2023-04-21 00:23:05,753][39m Trial 3968 finished with value: 0.8598130841121495 and parameters: {'objective': 'CrossEntropy', 'colsample_bylevel': 0.09456352191241058, 'depth': 7, 'boosting_type': 'Plain', 'bootstrap_type': 'Bayesian', 'bagging_temperature': 5.546182596846641}. Best is trial 1464 with value: 0.8990825688073395.
[32m[I 2023-04-21 00:23:06,690][39m Trial 3969 finished with value: 0.8727272727272727 and parameters: {'objective': 'Logloss', 'colsample_bylevel': 0.09711693107186738, 'depth': 8, 'boosting_type': 'Plain', 'bootstrap_type': 'Bayesian', 'bagging_temperature': 5.901631577344545}. Best is trial 1464 with value: 0.8990825688073395.
[32m[I 2023-04-21 00:23:07,941][39m Trial 3970 finished with value: 0.8727272727272727 and parameters: {'objective': 'Logloss', 'colsample_bylevel': 0.09697567728221462, 'depth': 9, 'boosting_type': 'Plain', 'bootstrap_type': 'Bayesian', 'bagging_temperature': 4.52012213624519}. Best is trial 1464 with value: 0.8990825688073395.
[32m[I 2023-04-21 00:23:09,138][39m Trial 3971 finished with value: 0.8727272727272727 and parameters: {'objective': 'Logloss', 'colsample_bylevel': 0.09519136268864592, 'depth': 9, 'boosting_type': 'Plain', 'bootstrap_type': 'Bayesian', 'bagging_temperature': 6.900506092722364}. Best is trial 1464 with value: 0.8990825688073395.
[32m[I 2023-04-21 00:23:10,398][39m Trial 3972 finished with value: 0.8727272727272727 and parameters: {'objective': 'Logloss', 'colsample_bylevel': 0.08954392432160356, 'depth': 9, 'boosting_type': 'Plain', 'bootstrap_type': 'Bayesian', 'bagging_temperature': 6.9657284412219855}. Best is trial 1464 with value: 0.8990825688073395.
[32m[I 2023-04-21 00:23:11,114][39m Trial 3973 finished with value: 0.8495575221238938 and parameters: {'objective': 'CrossEntropy', 'colsample_bylevel': 0.0958598086114593, 'depth': 11, 'boosting_type': 'Plain', 'bootstrap_type': 'Bernoulli', 'subsample': 0.9793475346692421}. Best is trial 1464 with value: 0.8990825688073395.
[32m[I 2023-04-21 00:23:12,302][39m Trial 3974 finished with value: 0.888888888888889 and parameters: {'objective': 'Logloss', 'colsample_bylevel': 0.09456545443059437, 'depth': 10, 'boosting_type': 'Plain', 'bootstrap_type': 'Bayesian', 'bagging_temperature': 6.414700313801133}. Best is trial 1464 with value: 0.8990825688073395.
[32m[I 2023-04-21 00:23:13,241][39m Trial 3975 finished with value: 0.8305084745762712 and parameters: {'objective': 'Logloss', 'colsample_bylevel': 0.09562472941707927, 'depth': 2, 'boosting_type': 'Plain', 'bootstrap_type': 'Bayesian', 'bagging_temperature': 5.989435410038985}. Best is trial 1464 with value: 0.8990825688073395.
[32m[I 2023-04-21 00:23:14,321][39m Trial 3976 finished with value: 0.8571428571428572 and parameters: {'objective': 'Logloss', 'colsample_bylevel': 0.0871562515210171, 'depth': 8, 'boosting_type': 'Plain', 'bootstrap_type': 'MVS'}. Best is trial 1464 with value: 0.8990825688073395.
[32m[I 2023-04-21 00:23:18,912][39m Trial 3977 finished with value: 0.8392857142857144 and parameters: {'objective': 'CrossEntropy', 'colsample_bylevel': 0.0877997951564546, 'depth': 8, 'boosting_type': 'Ordered', 'bootstrap_type': 'Bayesian', 'bagging_temperature': 5.3335937903234125}. Best is trial 1464 with value: 0.8990825688073395.
[32m[I 2023-04-21 00:23:20,024][39m Trial 3978 finished with value: 0.8727272727272727 and parameters: {'objective': 'Logloss', 'colsample_bylevel': 0.09832205922875963, 'depth': 8, 'boosting_type': 'Plain', 'bootstrap_type': 'Bayesian', 'bagging_temperature': 3.733957808156823}. Best is trial 1464 with value: 0.8990825688073395.
[32m[I 2023-04-21 00:23:21,934][39m Trial 3979 finished with value: 0.8727272727272727 and parameters: {'objective': 'Logloss', 'colsample_bylevel': 0.09291470227456504, 'depth': 9, 'boosting_type': 'Plain', 'bootstrap_type': 'Bayesian', 'bagging_temperature': 5.593268331117008}. Best is trial 1464 with value: 0.8990825688073395.
[32m[I 2023-04-21 00:23:22,842][39m Trial 3980 finished with value: 0.8807339449541284 and parameters: {'objective': 'Logloss', 'colsample_bylevel': 0.0971000155006714, 'depth': 9, 'boosting_type': 'Plain', 'bootstrap_type': 'Bayesian', 'bagging_temperature': 6.391663049201976}. Best is trial 1464 with value: 0.8990825688073395.
[32m[I 2023-04-21 00:23:23,570][39m Trial 3981 finished with value: 0.875 and parameters: {'objective': 'Logloss', 'colsample_bylevel': 0.09602946270723964, 'depth': 8, 'boosting_type': 'Plain', 'bootstrap_type': 'Bayesian', 'bagging_temperature': 5.822500074238078}. Best is trial 1464 with value: 0.8990825688073395.
[32m[I 2023-04-21 00:23:24,514][39m Trial 3982 finished with value: 0.875 and parameters: {'objective': 'CrossEntropy', 'colsample_bylevel': 0.09193541127497666, 'depth': 10, 'boosting_type': 'Plain', 'bootstrap_type': 'Bayesian', 'bagging_temperature': 5.7081624644444275}. Best is trial 1464 with value: 0.8990825688073395.
[32m[I 2023-04-21 00:23:25,835][39m Trial 3983 finished with value: 0.8807339449541284 and parameters: {'objective': 'Logloss', 'colsample_bylevel': 0.09408862080379342, 'depth': 11, 'boosting_type': 'Plain', 'bootstrap_type': 'Bayesian', 'bagging_temperature': 6.154401550953647}. Best is trial 1464 with value: 0.8990825688073395.
[32m[I 2023-04-21 00:23:27,366][39m Trial 3984 finished with value: 0.8807339449541284 and parameters: {'objective': 'Logloss', 'colsample_bylevel': 0.09290306261513911, 'depth': 9, 'boosting_type': 'Plain', 'bootstrap_type': 'Bayesian', 'bagging_temperature': 5.5210739093858425}. Best is trial 1464 with value: 0.8990825688073395.
[32m[I 2023-04-21 00:23:28,655][39m Trial 3985 finished with value: 0.875 and parameters: {'objective': 'Logloss', 'colsample_bylevel': 0.09400681534540724, 'depth': 9, 'boosting_type': 'Plain', 'bootstrap_type': 'Bayesian', 'bagging_temperature': 6.803495909821297}. Best is trial 1464 with value: 0.8990825688073395.
[32m[I 2023-04-21 00:23:29,378][39m Trial 3986 finished with value: 0.888888888888889 and parameters: {'objective': 'Logloss', 'colsample_bylevel': 0.08856697854039464, 'depth': 10, 'boosting_type': 'Plain', 'bootstrap_type': 'Bayesian', 'bagging_temperature': 5.451733094926424}. Best is trial 1464 with value: 0.8990825688073395.
[32m[I 2023-04-21 00:23:30,492][39m Trial 3987 finished with value: 0.8623853211009175 and parameters: {'objective': 'Logloss', 'colsample_bylevel': 0.09999033532487953, 'depth': 7, 'boosting_type': 'Plain', 'bootstrap_type': 'Bayesian', 'bagging_temperature': 3.7622770108105}. Best is trial 1464 with value: 0.8990825688073395.
[32m[I 2023-04-21 00:23:32,049][39m Trial 3988 finished with value: 0.8727272727272727 and parameters: {'objective': 'Logloss', 'colsample_bylevel': 0.09532570690538594, 'depth': 9, 'boosting_type': 'Plain', 'bootstrap_type': 'Bayesian', 'bagging_temperature': 5.295612356666339}. Best is trial 1464 with value: 0.8990825688073395.
[32m[I 2023-04-21 00:23:33,328][39m Trial 3989 finished with value: 0.8807339449541284 and parameters: {'objective': 'Logloss', 'colsample_bylevel': 0.09845783710506374, 'depth': 9, 'boosting_type': 'Plain', 'bootstrap_type': 'Bayesian', 'bagging_temperature': 7.756137959806456}. Best is trial 1464 with value: 0.8990825688073395.
[32m[I 2023-04-21 00:23:34,900][39m Trial 3990 finished with value: 0.8727272727272727 and parameters: {'objective': 'Logloss', 'colsample_bylevel': 0.0950975507784986, 'depth': 8, 'boosting_type': 'Plain', 'bootstrap_type': 'Bayesian', 'bagging_temperature': 4.199162487311702}. Best is trial 1464 with value: 0.8990825688073395.
[32m[I 2023-04-21 00:23:35,800][39m Trial 3991 finished with value: 0.8703703703703703 and parameters: {'objective': 'CrossEntropy', 'colsample_bylevel': 0.0959194403641494, 'depth': 9, 'boosting_type': 'Plain', 'bootstrap_type': 'Bayesian', 'bagging_temperature': 6.079810585088365}. Best is trial 1464 with value: 0.8990825688073395.
[32m[I 2023-04-21 00:23:36,674][39m Trial 3992 finished with value: 0.8275862068965517 and parameters: {'objective': 'CrossEntropy', 'colsample_bylevel': 0.061963615006026346, 'depth': 6, 'boosting_type': 'Plain', 'bootstrap_type': 'Bernoulli', 'subsample': 0.5005488508143278}. Best is trial 1464 with value: 0.8990825688073395.
[32m[I 2023-04-21 00:23:38,176][39m Trial 3993 finished with value: 0.888888888888889 and parameters: {'objective': 'Logloss', 'colsample_bylevel': 0.09273542895381602, 'depth': 9, 'boosting_type': 'Plain', 'bootstrap_type': 'Bayesian', 'bagging_temperature': 5.580245243056399}. Best is trial 1464 with value: 0.8990825688073395.
[32m[I 2023-04-21 00:23:43,267][39m Trial 3994 finished with value: 0.8392857142857144 and parameters: {'objective': 'CrossEntropy', 'colsample_bylevel': 0.08923183536043086, 'depth': 10, 'boosting_type': 'Ordered', 'bootstrap_type': 'Bayesian', 'bagging_temperature': 5.296798609455365}. Best is trial 1464 with value: 0.8990825688073395.
[32m[I 2023-04-21 00:23:44,504][39m Trial 3995 finished with value: 0.8623853211009175 and parameters: {'objective': 'Logloss', 'colsample_bylevel': 0.09340857113153124, 'depth': 6, 'boosting_type': 'Plain', 'bootstrap_type': 'Bayesian', 'bagging_temperature': 5.8830001344180225}. Best is trial 1464 with value: 0.8990825688073395.
[32m[I 2023-04-21 00:23:46,062][39m Trial 3996 finished with value: 0.8672566371681416 and parameters: {'objective': 'CrossEntropy', 'colsample_bylevel': 0.09994736335168027, 'depth': 9, 'boosting_type': 'Plain', 'bootstrap_type': 'MVS'}. Best is trial 1464 with value: 0.8990825688073395.
[32m[I 2023-04-21 00:23:47,001][39m Trial 3997 finished with value: 0.8648648648648648 and parameters: {'objective': 'Logloss', 'colsample_bylevel': 0.09421773821958379, 'depth': 9, 'boosting_type': 'Plain', 'bootstrap_type': 'Bayesian', 'bagging_temperature': 4.761194827864618}. Best is trial 1464 with value: 0.8990825688073395.
[32m[I 2023-04-21 00:23:48,557][39m Trial 3998 finished with value: 0.888888888888889 and parameters: {'objective': 'Logloss', 'colsample_bylevel': 0.09997760038507304, 'depth': 8, 'boosting_type': 'Plain', 'bootstrap_type': 'Bayesian', 'bagging_temperature': 5.485303287587644}. Best is trial 1464 with value: 0.8990825688073395.
[32m[I 2023-04-21 00:23:49,581][39m Trial 3999 finished with value: 0.8807339449541284 and parameters: {'objective': 'Logloss', 'colsample_bylevel': 0.09588548637477369, 'depth': 8, 'boosting_type': 'Plain', 'bootstrap_type': 'Bayesian', 'bagging_temperature': 5.464470091499937}. Best is trial 1464 with value: 0.8990825688073395.
[32m[I 2023-04-21 00:23:50,595][39m Trial 4000 finished with value: 0.888888888888889 and parameters: {'objective': 'Logloss', 'colsample_bylevel': 0.0911905410150432, 'depth': 8, 'boosting_type': 'Plain', 'bootstrap_type': 'Bayesian', 'bagging_temperature': 6.778468000093131}. Best is trial 1464 with value: 0.8990825688073395.
[32m[I 2023-04-21 00:23:51,786][39m Trial 4001 finished with value: 0.8807339449541284 and parameters: {'objective': 'Logloss', 'colsample_bylevel': 0.0959051331192908, 'depth': 9, 'boosting_type': 'Plain', 'bootstrap_type': 'Bayesian', 'bagging_temperature': 4.20185379379017}. Best is trial 1464 with value: 0.8990825688073395.
[32m[I 2023-04-21 00:23:52,844][39m Trial 4002 finished with value: 0.8648648648648648 and parameters: {'objective': 'Logloss', 'colsample_bylevel': 0.0920038084345477, 'depth': 7, 'boosting_type': 'Plain', 'bootstrap_type': 'Bayesian', 'bagging_temperature': 5.454680790187928}. Best is trial 1464 with value: 0.8990825688073395.
[32m[I 2023-04-21 00:23:54,291][39m Trial 4003 finished with value: 0.8495575221238938 and parameters: {'objective': 'Logloss', 'colsample_bylevel': 0.09459103729282961, 'depth': 8, 'boosting_type': 'Plain', 'bootstrap_type': 'Bayesian', 'bagging_temperature': 5.217966811352624}. Best is trial 1464 with value: 0.8990825688073395.
[32m[I 2023-04-21 00:23:55,761][39m Trial 4004 finished with value: 0.8727272727272727 and parameters: {'objective': 'Logloss', 'colsample_bylevel': 0.09044143927241172, 'depth': 9, 'boosting_type': 'Plain', 'bootstrap_type': 'Bayesian', 'bagging_temperature': 5.386975437431116}. Best is trial 1464 with value: 0.8990825688073395.
[32m[I 2023-04-21 00:23:56,886][39m Trial 4005 finished with value: 0.8727272727272727 and parameters: {'objective': 'Logloss', 'colsample_bylevel': 0.09679710766030443, 'depth': 8, 'boosting_type': 'Plain', 'bootstrap_type': 'Bayesian', 'bagging_temperature': 6.402640217590341}. Best is trial 1464 with value: 0.8990825688073395.
[32m[I 2023-04-21 00:23:57,689][39m Trial 4006 finished with value: 0.888888888888889 and parameters: {'objective': 'Logloss', 'colsample_bylevel': 0.09994674663228248, 'depth': 7, 'boosting_type': 'Plain', 'bootstrap_type': 'Bayesian', 'bagging_temperature': 4.09559839586679}. Best is trial 1464 with value: 0.8990825688073395.
[32m[I 2023-04-21 00:23:58,372][39m Trial 4007 finished with value: 0.8807339449541284 and parameters: {'objective': 'CrossEntropy', 'colsample_bylevel': 0.08511111144756331, 'depth': 11, 'boosting_type': 'Plain', 'bootstrap_type': 'Bayesian', 'bagging_temperature': 6.620186909536242}. Best is trial 1464 with value: 0.8990825688073395.
[32m[I 2023-04-21 00:23:59,447][39m Trial 4008 finished with value: 0.888888888888889 and parameters: {'objective': 'CrossEntropy', 'colsample_bylevel': 0.09312597007216024, 'depth': 10, 'boosting_type': 'Plain', 'bootstrap_type': 'Bayesian', 'bagging_temperature': 5.693373512628231}. Best is trial 1464 with value: 0.8990825688073395.
[32m[I 2023-04-21 00:24:00,816][39m Trial 4009 finished with value: 0.8807339449541284 and parameters: {'objective': 'Logloss', 'colsample_bylevel': 0.09547801377638362, 'depth': 7, 'boosting_type': 'Plain', 'bootstrap_type': 'Bayesian', 'bagging_temperature': 5.387903892902584}. Best is trial 1464 with value: 0.8990825688073395.
[32m[I 2023-04-21 00:24:02,095][39m Trial 4010 finished with value: 0.890909090909091 and parameters: {'objective': 'CrossEntropy', 'colsample_bylevel': 0.09372685247748494, 'depth': 10, 'boosting_type': 'Plain', 'bootstrap_type': 'Bayesian', 'bagging_temperature': 6.525848954975537}. Best is trial 1464 with value: 0.8990825688073395.
[32m[I 2023-04-21 00:24:03,455][39m Trial 4011 finished with value: 0.8785046728971961 and parameters: {'objective': 'CrossEntropy', 'colsample_bylevel': 0.08933265590851545, 'depth': 10, 'boosting_type': 'Plain', 'bootstrap_type': 'Bayesian', 'bagging_temperature': 5.194386467383585}. Best is trial 1464 with value: 0.8990825688073395.
[32m[I 2023-04-21 00:24:07,250][39m Trial 4012 finished with value: 0.8571428571428572 and parameters: {'objective': 'CrossEntropy', 'colsample_bylevel': 0.08859748015983168, 'depth': 10, 'boosting_type': 'Ordered', 'bootstrap_type': 'Bernoulli', 'subsample': 0.7426204165564255}. Best is trial 1464 with value: 0.8990825688073395.
[32m[I 2023-04-21 00:24:08,653][39m Trial 4013 finished with value: 0.8807339449541284 and parameters: {'objective': 'Logloss', 'colsample_bylevel': 0.09713508765887122, 'depth': 7, 'boosting_type': 'Plain', 'bootstrap_type': 'Bayesian', 'bagging_temperature': 5.754383207982924}. Best is trial 1464 with value: 0.8990825688073395.
[32m[I 2023-04-21 00:24:09,840][39m Trial 4014 finished with value: 0.8376068376068375 and parameters: {'objective': 'CrossEntropy', 'colsample_bylevel': 0.04550982188970453, 'depth': 7, 'boosting_type': 'Plain', 'bootstrap_type': 'Bayesian', 'bagging_temperature': 5.317528468086944}. Best is trial 1464 with value: 0.8990825688073395.
[32m[I 2023-04-21 00:24:11,484][39m Trial 4015 finished with value: 0.875 and parameters: {'objective': 'Logloss', 'colsample_bylevel': 0.09813387765380886, 'depth': 8, 'boosting_type': 'Plain', 'bootstrap_type': 'Bayesian', 'bagging_temperature': 4.905929495547031}. Best is trial 1464 with value: 0.8990825688073395.
[32m[I 2023-04-21 00:24:12,294][39m Trial 4016 finished with value: 0.8275862068965517 and parameters: {'objective': 'Logloss', 'colsample_bylevel': 0.09704123378048236, 'depth': 9, 'boosting_type': 'Plain', 'bootstrap_type': 'MVS'}. Best is trial 1464 with value: 0.8990825688073395.
[32m[I 2023-04-21 00:24:13,407][39m Trial 4017 finished with value: 0.8807339449541284 and parameters: {'objective': 'Logloss', 'colsample_bylevel': 0.09196370773709409, 'depth': 9, 'boosting_type': 'Plain', 'bootstrap_type': 'Bayesian', 'bagging_temperature': 4.969118613357811}. Best is trial 1464 with value: 0.8990825688073395.
[32m[I 2023-04-21 00:24:14,973][39m Trial 4018 finished with value: 0.888888888888889 and parameters: {'objective': 'CrossEntropy', 'colsample_bylevel': 0.0930603213742974, 'depth': 10, 'boosting_type': 'Plain', 'bootstrap_type': 'Bayesian', 'bagging_temperature': 6.253251802733996}. Best is trial 1464 with value: 0.8990825688073395.
