[32m[I 2023-04-20 23:44:16,825][39m Trial 2243 finished with value: 0.8727272727272727 and parameters: {'objective': 'Logloss', 'colsample_bylevel': 0.09667279517046325, 'depth': 9, 'boosting_type': 'Plain', 'bootstrap_type': 'Bayesian', 'bagging_temperature': 6.741000548055322}. Best is trial 1464 with value: 0.8990825688073395.
[32m[I 2023-04-20 23:44:17,901][39m Trial 2244 finished with value: 0.8807339449541284 and parameters: {'objective': 'Logloss', 'colsample_bylevel': 0.09548572697181198, 'depth': 9, 'boosting_type': 'Plain', 'bootstrap_type': 'Bayesian', 'bagging_temperature': 4.778444991634546}. Best is trial 1464 with value: 0.8990825688073395.
[32m[I 2023-04-20 23:44:18,879][39m Trial 2245 finished with value: 0.8545454545454546 and parameters: {'objective': 'CrossEntropy', 'colsample_bylevel': 0.08850408888518185, 'depth': 10, 'boosting_type': 'Plain', 'bootstrap_type': 'Bayesian', 'bagging_temperature': 3.8605396803353353}. Best is trial 1464 with value: 0.8990825688073395.
[32m[I 2023-04-20 23:44:24,101][39m Trial 2246 finished with value: 0.8571428571428572 and parameters: {'objective': 'Logloss', 'colsample_bylevel': 0.09421247106609441, 'depth': 9, 'boosting_type': 'Ordered', 'bootstrap_type': 'Bayesian', 'bagging_temperature': 5.136990174385671}. Best is trial 1464 with value: 0.8990825688073395.
[32m[I 2023-04-20 23:44:25,373][39m Trial 2247 finished with value: 0.8727272727272727 and parameters: {'objective': 'CrossEntropy', 'colsample_bylevel': 0.09850381339308865, 'depth': 12, 'boosting_type': 'Plain', 'bootstrap_type': 'Bernoulli', 'subsample': 0.8866783791643761}. Best is trial 1464 with value: 0.8990825688073395.
[32m[I 2023-04-20 23:44:26,159][39m Trial 2248 finished with value: 0.8571428571428572 and parameters: {'objective': 'Logloss', 'colsample_bylevel': 0.09138690727107242, 'depth': 9, 'boosting_type': 'Plain', 'bootstrap_type': 'MVS'}. Best is trial 1464 with value: 0.8990825688073395.
[32m[I 2023-04-20 23:44:27,300][39m Trial 2249 finished with value: 0.8727272727272727 and parameters: {'objective': 'CrossEntropy', 'colsample_bylevel': 0.09562696906980876, 'depth': 9, 'boosting_type': 'Plain', 'bootstrap_type': 'Bayesian', 'bagging_temperature': 4.503625763696738}. Best is trial 1464 with value: 0.8990825688073395.
[32m[I 2023-04-20 23:44:28,606][39m Trial 2250 finished with value: 0.8727272727272727 and parameters: {'objective': 'Logloss', 'colsample_bylevel': 0.0954564564952208, 'depth': 9, 'boosting_type': 'Plain', 'bootstrap_type': 'Bayesian', 'bagging_temperature': 4.655501549073166}. Best is trial 1464 with value: 0.8990825688073395.
[32m[I 2023-04-20 23:44:29,721][39m Trial 2251 finished with value: 0.8275862068965517 and parameters: {'objective': 'Logloss', 'colsample_bylevel': 0.0966130868197492, 'depth': 3, 'boosting_type': 'Plain', 'bootstrap_type': 'Bayesian', 'bagging_temperature': 5.228535773277692}. Best is trial 1464 with value: 0.8990825688073395.
[32m[I 2023-04-20 23:44:30,601][39m Trial 2252 finished with value: 0.8807339449541284 and parameters: {'objective': 'CrossEntropy', 'colsample_bylevel': 0.09727828789286519, 'depth': 9, 'boosting_type': 'Plain', 'bootstrap_type': 'Bayesian', 'bagging_temperature': 4.93115583649884}. Best is trial 1464 with value: 0.8990825688073395.
[32m[I 2023-04-20 23:44:31,330][39m Trial 2253 finished with value: 0.8703703703703703 and parameters: {'objective': 'CrossEntropy', 'colsample_bylevel': 0.0866582274212366, 'depth': 10, 'boosting_type': 'Plain', 'bootstrap_type': 'Bayesian', 'bagging_temperature': 5.394067302860385}. Best is trial 1464 with value: 0.8990825688073395.
[32m[I 2023-04-20 23:44:32,194][39m Trial 2254 finished with value: 0.8421052631578947 and parameters: {'objective': 'CrossEntropy', 'colsample_bylevel': 0.08387560150132836, 'depth': 10, 'boosting_type': 'Plain', 'bootstrap_type': 'Bernoulli', 'subsample': 0.6913660303606999}. Best is trial 1464 with value: 0.8990825688073395.
[32m[I 2023-04-20 23:44:33,468][39m Trial 2255 finished with value: 0.8807339449541284 and parameters: {'objective': 'CrossEntropy', 'colsample_bylevel': 0.08610803655865079, 'depth': 10, 'boosting_type': 'Plain', 'bootstrap_type': 'Bayesian', 'bagging_temperature': 5.340688234454952}. Best is trial 1464 with value: 0.8990825688073395.
[32m[I 2023-04-20 23:44:34,530][39m Trial 2256 finished with value: 0.8495575221238938 and parameters: {'objective': 'CrossEntropy', 'colsample_bylevel': 0.06116291912934504, 'depth': 9, 'boosting_type': 'Plain', 'bootstrap_type': 'Bayesian', 'bagging_temperature': 4.966078692903665}. Best is trial 1464 with value: 0.8990825688073395.
[32m[I 2023-04-20 23:44:35,819][39m Trial 2257 finished with value: 0.8703703703703703 and parameters: {'objective': 'Logloss', 'colsample_bylevel': 0.09840910903072889, 'depth': 8, 'boosting_type': 'Plain', 'bootstrap_type': 'Bayesian', 'bagging_temperature': 7.285880437924583}. Best is trial 1464 with value: 0.8990825688073395.
[32m[I 2023-04-20 23:44:36,523][39m Trial 2258 finished with value: 0.8807339449541284 and parameters: {'objective': 'Logloss', 'colsample_bylevel': 0.09339110775469942, 'depth': 7, 'boosting_type': 'Plain', 'bootstrap_type': 'Bayesian', 'bagging_temperature': 5.597931372704923}. Best is trial 1464 with value: 0.8990825688073395.
[32m[I 2023-04-20 23:44:37,457][39m Trial 2259 finished with value: 0.8807339449541284 and parameters: {'objective': 'CrossEntropy', 'colsample_bylevel': 0.0901493820926929, 'depth': 10, 'boosting_type': 'Plain', 'bootstrap_type': 'Bayesian', 'bagging_temperature': 5.47506904455534}. Best is trial 1464 with value: 0.8990825688073395.
[32m[I 2023-04-20 23:44:38,290][39m Trial 2260 finished with value: 0.8623853211009175 and parameters: {'objective': 'CrossEntropy', 'colsample_bylevel': 0.09808221736019002, 'depth': 10, 'boosting_type': 'Plain', 'bootstrap_type': 'Bayesian', 'bagging_temperature': 4.975862002413243}. Best is trial 1464 with value: 0.8990825688073395.
[32m[I 2023-04-20 23:44:39,398][39m Trial 2261 finished with value: 0.8727272727272727 and parameters: {'objective': 'Logloss', 'colsample_bylevel': 0.09116638045965181, 'depth': 11, 'boosting_type': 'Plain', 'bootstrap_type': 'Bayesian', 'bagging_temperature': 7.395875037000297}. Best is trial 1464 with value: 0.8990825688073395.
[32m[I 2023-04-20 23:44:40,430][39m Trial 2262 finished with value: 0.888888888888889 and parameters: {'objective': 'CrossEntropy', 'colsample_bylevel': 0.09655266379626888, 'depth': 9, 'boosting_type': 'Plain', 'bootstrap_type': 'Bayesian', 'bagging_temperature': 6.519617396906606}. Best is trial 1464 with value: 0.8990825688073395.
[32m[I 2023-04-20 23:44:41,009][39m Trial 2263 finished with value: 0.8648648648648648 and parameters: {'objective': 'CrossEntropy', 'colsample_bylevel': 0.09269688314095911, 'depth': 10, 'boosting_type': 'Plain', 'bootstrap_type': 'Bayesian', 'bagging_temperature': 6.293128561052667}. Best is trial 1464 with value: 0.8990825688073395.
[32m[I 2023-04-20 23:44:42,314][39m Trial 2264 finished with value: 0.8727272727272727 and parameters: {'objective': 'Logloss', 'colsample_bylevel': 0.0939364801564446, 'depth': 12, 'boosting_type': 'Plain', 'bootstrap_type': 'Bayesian', 'bagging_temperature': 5.055975401946572}. Best is trial 1464 with value: 0.8990825688073395.
[32m[I 2023-04-20 23:44:47,526][39m Trial 2265 finished with value: 0.8571428571428572 and parameters: {'objective': 'CrossEntropy', 'colsample_bylevel': 0.09149907783994479, 'depth': 11, 'boosting_type': 'Ordered', 'bootstrap_type': 'Bayesian', 'bagging_temperature': 6.098731220960186}. Best is trial 1464 with value: 0.8990825688073395.
[32m[I 2023-04-20 23:44:48,854][39m Trial 2266 finished with value: 0.888888888888889 and parameters: {'objective': 'Logloss', 'colsample_bylevel': 0.09339503755951191, 'depth': 9, 'boosting_type': 'Plain', 'bootstrap_type': 'Bayesian', 'bagging_temperature': 4.577435737348629}. Best is trial 1464 with value: 0.8990825688073395.
[32m[I 2023-04-20 23:44:50,231][39m Trial 2267 finished with value: 0.8807339449541284 and parameters: {'objective': 'Logloss', 'colsample_bylevel': 0.09187244123232888, 'depth': 9, 'boosting_type': 'Plain', 'bootstrap_type': 'Bayesian', 'bagging_temperature': 7.05321541883003}. Best is trial 1464 with value: 0.8990825688073395.
[32m[I 2023-04-20 23:44:51,471][39m Trial 2268 finished with value: 0.8727272727272727 and parameters: {'objective': 'Logloss', 'colsample_bylevel': 0.09837176137769425, 'depth': 8, 'boosting_type': 'Plain', 'bootstrap_type': 'Bayesian', 'bagging_temperature': 5.935598800462762}. Best is trial 1464 with value: 0.8990825688073395.
[32m[I 2023-04-20 23:44:52,545][39m Trial 2269 finished with value: 0.8421052631578947 and parameters: {'objective': 'CrossEntropy', 'colsample_bylevel': 0.08500662859154966, 'depth': 4, 'boosting_type': 'Plain', 'bootstrap_type': 'Bayesian', 'bagging_temperature': 6.327742158172148}. Best is trial 1464 with value: 0.8990825688073395.
[32m[I 2023-04-20 23:44:53,870][39m Trial 2270 finished with value: 0.8648648648648648 and parameters: {'objective': 'Logloss', 'colsample_bylevel': 0.09670867730304226, 'depth': 10, 'boosting_type': 'Plain', 'bootstrap_type': 'MVS'}. Best is trial 1464 with value: 0.8990825688073395.
[32m[I 2023-04-20 23:44:54,713][39m Trial 2271 finished with value: 0.8828828828828829 and parameters: {'objective': 'CrossEntropy', 'colsample_bylevel': 0.0870751504081397, 'depth': 10, 'boosting_type': 'Plain', 'bootstrap_type': 'Bayesian', 'bagging_temperature': 5.422042080486735}. Best is trial 1464 with value: 0.8990825688073395.
[32m[I 2023-04-20 23:44:55,557][39m Trial 2272 finished with value: 0.8468468468468469 and parameters: {'objective': 'Logloss', 'colsample_bylevel': 0.09465058685069402, 'depth': 11, 'boosting_type': 'Plain', 'bootstrap_type': 'Bernoulli', 'subsample': 0.23095046825089183}. Best is trial 1464 with value: 0.8990825688073395.
[32m[I 2023-04-20 23:44:56,383][39m Trial 2273 finished with value: 0.8648648648648648 and parameters: {'objective': 'CrossEntropy', 'colsample_bylevel': 0.09578611161949058, 'depth': 8, 'boosting_type': 'Plain', 'bootstrap_type': 'Bayesian', 'bagging_temperature': 4.42218695244483}. Best is trial 1464 with value: 0.8990825688073395.
[32m[I 2023-04-20 23:44:57,486][39m Trial 2274 finished with value: 0.8571428571428572 and parameters: {'objective': 'Logloss', 'colsample_bylevel': 0.09446042783846775, 'depth': 9, 'boosting_type': 'Plain', 'bootstrap_type': 'Bayesian', 'bagging_temperature': 4.648801658290648}. Best is trial 1464 with value: 0.8990825688073395.
[32m[I 2023-04-20 23:44:58,288][39m Trial 2275 finished with value: 0.8571428571428572 and parameters: {'objective': 'CrossEntropy', 'colsample_bylevel': 0.09994430640794559, 'depth': 9, 'boosting_type': 'Plain', 'bootstrap_type': 'Bernoulli', 'subsample': 0.28768440507370513}. Best is trial 1464 with value: 0.8990825688073395.
[32m[I 2023-04-20 23:44:59,774][39m Trial 2276 finished with value: 0.8807339449541284 and parameters: {'objective': 'CrossEntropy', 'colsample_bylevel': 0.09156052428001507, 'depth': 9, 'boosting_type': 'Plain', 'bootstrap_type': 'Bernoulli', 'subsample': 0.32222687712413217}. Best is trial 1464 with value: 0.8990825688073395.
[32m[I 2023-04-20 23:45:00,608][39m Trial 2277 finished with value: 0.8727272727272727 and parameters: {'objective': 'Logloss', 'colsample_bylevel': 0.0938239315899249, 'depth': 10, 'boosting_type': 'Plain', 'bootstrap_type': 'Bayesian', 'bagging_temperature': 4.191306388646165}. Best is trial 1464 with value: 0.8990825688073395.
[32m[I 2023-04-20 23:45:01,449][39m Trial 2278 finished with value: 0.8807339449541284 and parameters: {'objective': 'Logloss', 'colsample_bylevel': 0.09841682736144396, 'depth': 8, 'boosting_type': 'Plain', 'bootstrap_type': 'Bayesian', 'bagging_temperature': 4.116092297440549}. Best is trial 1464 with value: 0.8990825688073395.
[32m[I 2023-04-20 23:45:02,522][39m Trial 2279 finished with value: 0.8807339449541284 and parameters: {'objective': 'CrossEntropy', 'colsample_bylevel': 0.09990598650888786, 'depth': 8, 'boosting_type': 'Plain', 'bootstrap_type': 'Bayesian', 'bagging_temperature': 6.569660309236627}. Best is trial 1464 with value: 0.8990825688073395.
[32m[I 2023-04-20 23:45:03,447][39m Trial 2280 finished with value: 0.8623853211009175 and parameters: {'objective': 'Logloss', 'colsample_bylevel': 0.09735977299083097, 'depth': 8, 'boosting_type': 'Plain', 'bootstrap_type': 'Bayesian', 'bagging_temperature': 4.933650030660657}. Best is trial 1464 with value: 0.8990825688073395.
[32m[I 2023-04-20 23:45:04,420][39m Trial 2281 finished with value: 0.8807339449541284 and parameters: {'objective': 'CrossEntropy', 'colsample_bylevel': 0.09295696534992325, 'depth': 11, 'boosting_type': 'Plain', 'bootstrap_type': 'Bayesian', 'bagging_temperature': 4.358748430669186}. Best is trial 1464 with value: 0.8990825688073395.
[32m[I 2023-04-20 23:45:05,314][39m Trial 2282 finished with value: 0.8807339449541284 and parameters: {'objective': 'CrossEntropy', 'colsample_bylevel': 0.09024452257066512, 'depth': 11, 'boosting_type': 'Plain', 'bootstrap_type': 'Bayesian', 'bagging_temperature': 8.263328115893557}. Best is trial 1464 with value: 0.8990825688073395.
[32m[I 2023-04-20 23:45:06,543][39m Trial 2283 finished with value: 0.8623853211009175 and parameters: {'objective': 'CrossEntropy', 'colsample_bylevel': 0.09693772040866984, 'depth': 9, 'boosting_type': 'Plain', 'bootstrap_type': 'Bayesian', 'bagging_temperature': 6.095022048515457}. Best is trial 1464 with value: 0.8990825688073395.
[32m[I 2023-04-20 23:45:11,790][39m Trial 2284 finished with value: 0.8571428571428572 and parameters: {'objective': 'CrossEntropy', 'colsample_bylevel': 0.09522460172365331, 'depth': 9, 'boosting_type': 'Ordered', 'bootstrap_type': 'Bayesian', 'bagging_temperature': 6.918094104362105}. Best is trial 1464 with value: 0.8990825688073395.
[32m[I 2023-04-20 23:45:12,880][39m Trial 2285 finished with value: 0.8596491228070176 and parameters: {'objective': 'Logloss', 'colsample_bylevel': 0.09833681968990113, 'depth': 6, 'boosting_type': 'Plain', 'bootstrap_type': 'Bayesian', 'bagging_temperature': 5.6600347526288015}. Best is trial 1464 with value: 0.8990825688073395.
[32m[I 2023-04-20 23:45:13,704][39m Trial 2286 finished with value: 0.888888888888889 and parameters: {'objective': 'CrossEntropy', 'colsample_bylevel': 0.09124563359247395, 'depth': 11, 'boosting_type': 'Plain', 'bootstrap_type': 'Bayesian', 'bagging_temperature': 3.87775852666479}. Best is trial 1464 with value: 0.8990825688073395.
[32m[I 2023-04-20 23:45:15,006][39m Trial 2287 finished with value: 0.8571428571428572 and parameters: {'objective': 'Logloss', 'colsample_bylevel': 0.08947821374756725, 'depth': 8, 'boosting_type': 'Plain', 'bootstrap_type': 'Bayesian', 'bagging_temperature': 5.210044394726743}. Best is trial 1464 with value: 0.8990825688073395.
[32m[I 2023-04-20 23:45:15,752][39m Trial 2288 finished with value: 0.8545454545454546 and parameters: {'objective': 'Logloss', 'colsample_bylevel': 0.09494474086439664, 'depth': 9, 'boosting_type': 'Plain', 'bootstrap_type': 'Bayesian', 'bagging_temperature': 4.715699726157235}. Best is trial 1464 with value: 0.8990825688073395.
[32m[I 2023-04-20 23:45:16,772][39m Trial 2289 finished with value: 0.8807339449541284 and parameters: {'objective': 'CrossEntropy', 'colsample_bylevel': 0.08842263561193145, 'depth': 10, 'boosting_type': 'Plain', 'bootstrap_type': 'Bayesian', 'bagging_temperature': 5.605423671981886}. Best is trial 1464 with value: 0.8990825688073395.
[32m[I 2023-04-20 23:45:17,479][39m Trial 2290 finished with value: 0.8305084745762712 and parameters: {'objective': 'CrossEntropy', 'colsample_bylevel': 0.025938685750250566, 'depth': 12, 'boosting_type': 'Plain', 'bootstrap_type': 'Bayesian', 'bagging_temperature': 5.793639225161755}. Best is trial 1464 with value: 0.8990825688073395.
[32m[I 2023-04-20 23:45:18,898][39m Trial 2291 finished with value: 0.888888888888889 and parameters: {'objective': 'CrossEntropy', 'colsample_bylevel': 0.08907390345304421, 'depth': 10, 'boosting_type': 'Plain', 'bootstrap_type': 'Bayesian', 'bagging_temperature': 2.7424018470498592}. Best is trial 1464 with value: 0.8990825688073395.
[32m[I 2023-04-20 23:45:19,815][39m Trial 2292 finished with value: 0.875 and parameters: {'objective': 'CrossEntropy', 'colsample_bylevel': 0.09292065347620325, 'depth': 10, 'boosting_type': 'Plain', 'bootstrap_type': 'Bayesian', 'bagging_temperature': 1.7114128087836675}. Best is trial 1464 with value: 0.8990825688073395.
[32m[I 2023-04-20 23:45:21,215][39m Trial 2293 finished with value: 0.8727272727272727 and parameters: {'objective': 'CrossEntropy', 'colsample_bylevel': 0.09652480202309643, 'depth': 12, 'boosting_type': 'Plain', 'bootstrap_type': 'Bernoulli', 'subsample': 0.1406866917828119}. Best is trial 1464 with value: 0.8990825688073395.
[32m[I 2023-04-20 23:45:21,880][39m Trial 2294 finished with value: 0.8421052631578947 and parameters: {'objective': 'Logloss', 'colsample_bylevel': 0.09566984639824426, 'depth': 5, 'boosting_type': 'Plain', 'bootstrap_type': 'Bayesian', 'bagging_temperature': 4.694824205333343}. Best is trial 1464 with value: 0.8990825688073395.
[32m[I 2023-04-20 23:45:22,706][39m Trial 2295 finished with value: 0.8571428571428572 and parameters: {'objective': 'Logloss', 'colsample_bylevel': 0.09719006935432695, 'depth': 10, 'boosting_type': 'Plain', 'bootstrap_type': 'MVS'}. Best is trial 1464 with value: 0.8990825688073395.
[32m[I 2023-04-20 23:45:23,945][39m Trial 2296 finished with value: 0.888888888888889 and parameters: {'objective': 'Logloss', 'colsample_bylevel': 0.09413525949196701, 'depth': 12, 'boosting_type': 'Plain', 'bootstrap_type': 'Bayesian', 'bagging_temperature': 4.4874423348142205}. Best is trial 1464 with value: 0.8990825688073395.
[32m[I 2023-04-20 23:45:24,707][39m Trial 2297 finished with value: 0.8727272727272727 and parameters: {'objective': 'CrossEntropy', 'colsample_bylevel': 0.09479649749688797, 'depth': 12, 'boosting_type': 'Plain', 'bootstrap_type': 'Bayesian', 'bagging_temperature': 4.447606288008744}. Best is trial 1464 with value: 0.8990825688073395.
[32m[I 2023-04-20 23:45:25,958][39m Trial 2298 finished with value: 0.8807339449541284 and parameters: {'objective': 'Logloss', 'colsample_bylevel': 0.09624307299100072, 'depth': 8, 'boosting_type': 'Plain', 'bootstrap_type': 'Bayesian', 'bagging_temperature': 5.152586962306477}. Best is trial 1464 with value: 0.8990825688073395.
[32m[I 2023-04-20 23:45:26,905][39m Trial 2299 finished with value: 0.8807339449541284 and parameters: {'objective': 'CrossEntropy', 'colsample_bylevel': 0.09860015352393972, 'depth': 7, 'boosting_type': 'Plain', 'bootstrap_type': 'Bayesian', 'bagging_temperature': 5.0921804825539}. Best is trial 1464 with value: 0.8990825688073395.
[32m[I 2023-04-20 23:45:27,870][39m Trial 2300 finished with value: 0.8727272727272727 and parameters: {'objective': 'CrossEntropy', 'colsample_bylevel': 0.0984134442864082, 'depth': 7, 'boosting_type': 'Plain', 'bootstrap_type': 'Bayesian', 'bagging_temperature': 5.237679228514443}. Best is trial 1464 with value: 0.8990825688073395.
[32m[I 2023-04-20 23:45:28,871][39m Trial 2301 finished with value: 0.8807339449541284 and parameters: {'objective': 'Logloss', 'colsample_bylevel': 0.09294210263260823, 'depth': 12, 'boosting_type': 'Plain', 'bootstrap_type': 'Bayesian', 'bagging_temperature': 7.1945447743817885}. Best is trial 1464 with value: 0.8990825688073395.
[32m[I 2023-04-20 23:45:29,546][39m Trial 2302 finished with value: 0.8596491228070176 and parameters: {'objective': 'CrossEntropy', 'colsample_bylevel': 0.08321846969773176, 'depth': 10, 'boosting_type': 'Plain', 'bootstrap_type': 'Bayesian', 'bagging_temperature': 5.098199380565567}. Best is trial 1464 with value: 0.8990825688073395.
[32m[I 2023-04-20 23:45:35,003][39m Trial 2303 finished with value: 0.8571428571428572 and parameters: {'objective': 'CrossEntropy', 'colsample_bylevel': 0.09503089373744207, 'depth': 10, 'boosting_type': 'Ordered', 'bootstrap_type': 'Bernoulli', 'subsample': 0.7763755829997628}. Best is trial 1464 with value: 0.8990825688073395.
[32m[I 2023-04-20 23:45:36,534][39m Trial 2304 finished with value: 0.8727272727272727 and parameters: {'objective': 'Logloss', 'colsample_bylevel': 0.09386872893616924, 'depth': 9, 'boosting_type': 'Plain', 'bootstrap_type': 'Bayesian', 'bagging_temperature': 7.3420127653278735}. Best is trial 1464 with value: 0.8990825688073395.
[32m[I 2023-04-20 23:45:37,052][39m Trial 2305 finished with value: 0.8623853211009175 and parameters: {'objective': 'CrossEntropy', 'colsample_bylevel': 0.09145830130768125, 'depth': 8, 'boosting_type': 'Plain', 'bootstrap_type': 'Bayesian', 'bagging_temperature': 3.741935867746815}. Best is trial 1464 with value: 0.8990825688073395.
[32m[I 2023-04-20 23:45:38,559][39m Trial 2306 finished with value: 0.8807339449541284 and parameters: {'objective': 'Logloss', 'colsample_bylevel': 0.0982285780165847, 'depth': 9, 'boosting_type': 'Plain', 'bootstrap_type': 'Bayesian', 'bagging_temperature': 4.807670310230464}. Best is trial 1464 with value: 0.8990825688073395.
[32m[I 2023-04-20 23:45:39,857][39m Trial 2307 finished with value: 0.8807339449541284 and parameters: {'objective': 'Logloss', 'colsample_bylevel': 0.09832076648247334, 'depth': 8, 'boosting_type': 'Plain', 'bootstrap_type': 'Bayesian', 'bagging_temperature': 7.660256446333433}. Best is trial 1464 with value: 0.8990825688073395.
