[32m[I 2023-04-21 01:01:19,949][39m Trial 5657 finished with value: 0.8828828828828829 and parameters: {'objective': 'CrossEntropy', 'colsample_bylevel': 0.0964366603411929, 'depth': 5, 'boosting_type': 'Plain', 'bootstrap_type': 'Bayesian', 'bagging_temperature': 6.223123268481615}. Best is trial 1464 with value: 0.8990825688073395.
[32m[I 2023-04-21 01:01:21,825][39m Trial 5658 finished with value: 0.8495575221238938 and parameters: {'objective': 'Logloss', 'colsample_bylevel': 0.09719872276292427, 'depth': 8, 'boosting_type': 'Plain', 'bootstrap_type': 'MVS'}. Best is trial 1464 with value: 0.8990825688073395.
[32m[I 2023-04-21 01:01:22,831][39m Trial 5659 finished with value: 0.8807339449541284 and parameters: {'objective': 'CrossEntropy', 'colsample_bylevel': 0.09664512805225658, 'depth': 9, 'boosting_type': 'Plain', 'bootstrap_type': 'Bayesian', 'bagging_temperature': 4.58004617124043}. Best is trial 1464 with value: 0.8990825688073395.
[32m[I 2023-04-21 01:01:23,899][39m Trial 5660 finished with value: 0.888888888888889 and parameters: {'objective': 'Logloss', 'colsample_bylevel': 0.0999805715246999, 'depth': 9, 'boosting_type': 'Plain', 'bootstrap_type': 'Bayesian', 'bagging_temperature': 4.568428640612862}. Best is trial 1464 with value: 0.8990825688073395.
[32m[I 2023-04-21 01:01:25,210][39m Trial 5661 finished with value: 0.8571428571428572 and parameters: {'objective': 'CrossEntropy', 'colsample_bylevel': 0.09289642084446648, 'depth': 9, 'boosting_type': 'Plain', 'bootstrap_type': 'Bayesian', 'bagging_temperature': 5.889163615599575}. Best is trial 1464 with value: 0.8990825688073395.
[32m[I 2023-04-21 01:01:26,535][39m Trial 5662 finished with value: 0.8807339449541284 and parameters: {'objective': 'CrossEntropy', 'colsample_bylevel': 0.096895239257456, 'depth': 9, 'boosting_type': 'Plain', 'bootstrap_type': 'Bayesian', 'bagging_temperature': 6.762177911132794}. Best is trial 1464 with value: 0.8990825688073395.
[32m[I 2023-04-21 01:01:27,912][39m Trial 5663 finished with value: 0.8727272727272727 and parameters: {'objective': 'Logloss', 'colsample_bylevel': 0.0951552375635585, 'depth': 12, 'boosting_type': 'Plain', 'bootstrap_type': 'Bayesian', 'bagging_temperature': 4.801077423702623}. Best is trial 1464 with value: 0.8990825688073395.
[32m[I 2023-04-21 01:01:29,268][39m Trial 5664 finished with value: 0.8571428571428572 and parameters: {'objective': 'Logloss', 'colsample_bylevel': 0.08460168558725674, 'depth': 12, 'boosting_type': 'Plain', 'bootstrap_type': 'Bayesian', 'bagging_temperature': 4.6489752021887085}. Best is trial 1464 with value: 0.8990825688073395.
[32m[I 2023-04-21 01:01:30,218][39m Trial 5665 finished with value: 0.875 and parameters: {'objective': 'CrossEntropy', 'colsample_bylevel': 0.09453033110869952, 'depth': 8, 'boosting_type': 'Plain', 'bootstrap_type': 'Bayesian', 'bagging_temperature': 5.569030744394448}. Best is trial 1464 with value: 0.8990825688073395.
[32m[I 2023-04-21 01:01:31,291][39m Trial 5666 finished with value: 0.888888888888889 and parameters: {'objective': 'CrossEntropy', 'colsample_bylevel': 0.09965446533847441, 'depth': 8, 'boosting_type': 'Plain', 'bootstrap_type': 'Bayesian', 'bagging_temperature': 5.744861872280057}. Best is trial 1464 with value: 0.8990825688073395.
[32m[I 2023-04-21 01:01:36,528][39m Trial 5667 finished with value: 0.8672566371681416 and parameters: {'objective': 'CrossEntropy', 'colsample_bylevel': 0.08870524117560125, 'depth': 11, 'boosting_type': 'Ordered', 'bootstrap_type': 'Bayesian', 'bagging_temperature': 4.894772678898696}. Best is trial 1464 with value: 0.8990825688073395.
[32m[I 2023-04-21 01:01:37,397][39m Trial 5668 finished with value: 0.8648648648648648 and parameters: {'objective': 'CrossEntropy', 'colsample_bylevel': 0.09707301336122585, 'depth': 6, 'boosting_type': 'Plain', 'bootstrap_type': 'Bayesian', 'bagging_temperature': 6.375465055570359}. Best is trial 1464 with value: 0.8990825688073395.
[32m[I 2023-04-21 01:01:39,006][39m Trial 5669 finished with value: 0.875 and parameters: {'objective': 'Logloss', 'colsample_bylevel': 0.09061482371505514, 'depth': 12, 'boosting_type': 'Plain', 'bootstrap_type': 'Bayesian', 'bagging_temperature': 5.0679155333840535}. Best is trial 1464 with value: 0.8990825688073395.
[32m[I 2023-04-21 01:01:39,918][39m Trial 5670 finished with value: 0.8727272727272727 and parameters: {'objective': 'CrossEntropy', 'colsample_bylevel': 0.09757210480030828, 'depth': 8, 'boosting_type': 'Plain', 'bootstrap_type': 'Bayesian', 'bagging_temperature': 2.2931453777348287}. Best is trial 1464 with value: 0.8990825688073395.
[32m[I 2023-04-21 01:01:41,198][39m Trial 5671 finished with value: 0.8648648648648648 and parameters: {'objective': 'CrossEntropy', 'colsample_bylevel': 0.09667814174675499, 'depth': 8, 'boosting_type': 'Plain', 'bootstrap_type': 'Bayesian', 'bagging_temperature': 5.694641400754548}. Best is trial 1464 with value: 0.8990825688073395.
[32m[I 2023-04-21 01:01:42,645][39m Trial 5672 finished with value: 0.8648648648648648 and parameters: {'objective': 'CrossEntropy', 'colsample_bylevel': 0.08966790541994041, 'depth': 12, 'boosting_type': 'Plain', 'bootstrap_type': 'Bayesian', 'bagging_temperature': 5.7543311300810185}. Best is trial 1464 with value: 0.8990825688073395.
[32m[I 2023-04-21 01:01:43,892][39m Trial 5673 finished with value: 0.8727272727272727 and parameters: {'objective': 'CrossEntropy', 'colsample_bylevel': 0.09748335524487053, 'depth': 9, 'boosting_type': 'Plain', 'bootstrap_type': 'Bayesian', 'bagging_temperature': 6.137781882331552}. Best is trial 1464 with value: 0.8990825688073395.
[32m[I 2023-04-21 01:01:44,957][39m Trial 5674 finished with value: 0.8727272727272727 and parameters: {'objective': 'Logloss', 'colsample_bylevel': 0.09543875356744899, 'depth': 8, 'boosting_type': 'Plain', 'bootstrap_type': 'Bernoulli', 'subsample': 0.3749367711238689}. Best is trial 1464 with value: 0.8990825688073395.
[32m[I 2023-04-21 01:01:45,854][39m Trial 5675 finished with value: 0.8807339449541284 and parameters: {'objective': 'CrossEntropy', 'colsample_bylevel': 0.09046517124521332, 'depth': 11, 'boosting_type': 'Plain', 'bootstrap_type': 'Bayesian', 'bagging_temperature': 5.520869337690346}. Best is trial 1464 with value: 0.8990825688073395.
[32m[I 2023-04-21 01:01:47,004][39m Trial 5676 finished with value: 0.8807339449541284 and parameters: {'objective': 'Logloss', 'colsample_bylevel': 0.08754778935795408, 'depth': 12, 'boosting_type': 'Plain', 'bootstrap_type': 'Bayesian', 'bagging_temperature': 5.254828091208358}. Best is trial 1464 with value: 0.8990825688073395.
[32m[I 2023-04-21 01:01:48,156][39m Trial 5677 finished with value: 0.8275862068965517 and parameters: {'objective': 'Logloss', 'colsample_bylevel': 0.05989836097665762, 'depth': 10, 'boosting_type': 'Plain', 'bootstrap_type': 'MVS'}. Best is trial 1464 with value: 0.8990825688073395.
[32m[I 2023-04-21 01:01:49,554][39m Trial 5678 finished with value: 0.8727272727272727 and parameters: {'objective': 'CrossEntropy', 'colsample_bylevel': 0.08318895760773133, 'depth': 11, 'boosting_type': 'Plain', 'bootstrap_type': 'Bayesian', 'bagging_temperature': 4.84999338498439}. Best is trial 1464 with value: 0.8990825688073395.
[32m[I 2023-04-21 01:01:50,822][39m Trial 5679 finished with value: 0.8828828828828829 and parameters: {'objective': 'Logloss', 'colsample_bylevel': 0.09398111379384029, 'depth': 11, 'boosting_type': 'Plain', 'bootstrap_type': 'Bayesian', 'bagging_temperature': 6.559423497276389}. Best is trial 1464 with value: 0.8990825688073395.
[32m[I 2023-04-21 01:01:52,092][39m Trial 5680 finished with value: 0.8807339449541284 and parameters: {'objective': 'CrossEntropy', 'colsample_bylevel': 0.09266443978840957, 'depth': 9, 'boosting_type': 'Plain', 'bootstrap_type': 'Bayesian', 'bagging_temperature': 6.726652788967283}. Best is trial 1464 with value: 0.8990825688073395.
[32m[I 2023-04-21 01:01:53,068][39m Trial 5681 finished with value: 0.875 and parameters: {'objective': 'Logloss', 'colsample_bylevel': 0.09983278518346936, 'depth': 8, 'boosting_type': 'Plain', 'bootstrap_type': 'Bayesian', 'bagging_temperature': 5.166070596312832}. Best is trial 1464 with value: 0.8990825688073395.
[32m[I 2023-04-21 01:01:53,822][39m Trial 5682 finished with value: 0.8421052631578947 and parameters: {'objective': 'Logloss', 'colsample_bylevel': 0.09504034078428374, 'depth': 4, 'boosting_type': 'Plain', 'bootstrap_type': 'Bayesian', 'bagging_temperature': 2.5166106036572646}. Best is trial 1464 with value: 0.8990825688073395.
[32m[I 2023-04-21 01:01:55,150][39m Trial 5683 finished with value: 0.8807339449541284 and parameters: {'objective': 'CrossEntropy', 'colsample_bylevel': 0.08820299151776308, 'depth': 11, 'boosting_type': 'Plain', 'bootstrap_type': 'Bayesian', 'bagging_temperature': 5.18400810018988}. Best is trial 1464 with value: 0.8990825688073395.
[32m[I 2023-04-21 01:02:00,190][39m Trial 5684 finished with value: 0.8571428571428572 and parameters: {'objective': 'Logloss', 'colsample_bylevel': 0.09361787443717687, 'depth': 8, 'boosting_type': 'Ordered', 'bootstrap_type': 'Bayesian', 'bagging_temperature': 5.556131542964147}. Best is trial 1464 with value: 0.8990825688073395.
[32m[I 2023-04-21 01:02:01,326][39m Trial 5685 finished with value: 0.8807339449541284 and parameters: {'objective': 'CrossEntropy', 'colsample_bylevel': 0.08678077791849323, 'depth': 11, 'boosting_type': 'Plain', 'bootstrap_type': 'Bayesian', 'bagging_temperature': 4.773211276581083}. Best is trial 1464 with value: 0.8990825688073395.
[32m[I 2023-04-21 01:02:03,620][39m Trial 5686 finished with value: 0.8727272727272727 and parameters: {'objective': 'Logloss', 'colsample_bylevel': 0.09556898201832224, 'depth': 9, 'boosting_type': 'Plain', 'bootstrap_type': 'Bayesian', 'bagging_temperature': 5.350240677830242}. Best is trial 1464 with value: 0.8990825688073395.
[32m[I 2023-04-21 01:02:05,275][39m Trial 5687 finished with value: 0.851851851851852 and parameters: {'objective': 'CrossEntropy', 'colsample_bylevel': 0.09105247524613543, 'depth': 8, 'boosting_type': 'Plain', 'bootstrap_type': 'Bayesian', 'bagging_temperature': 5.513882741243728}. Best is trial 1464 with value: 0.8990825688073395.
[32m[I 2023-04-21 01:02:06,439][39m Trial 5688 finished with value: 0.8828828828828829 and parameters: {'objective': 'CrossEntropy', 'colsample_bylevel': 0.08867417399370188, 'depth': 12, 'boosting_type': 'Plain', 'bootstrap_type': 'Bayesian', 'bagging_temperature': 1.5172057322729717}. Best is trial 1464 with value: 0.8990825688073395.
[32m[I 2023-04-21 01:02:07,393][39m Trial 5689 finished with value: 0.8807339449541284 and parameters: {'objective': 'CrossEntropy', 'colsample_bylevel': 0.08511264933338332, 'depth': 7, 'boosting_type': 'Plain', 'bootstrap_type': 'Bayesian', 'bagging_temperature': 7.479346616908862}. Best is trial 1464 with value: 0.8990825688073395.
[32m[I 2023-04-21 01:02:08,257][39m Trial 5690 finished with value: 0.8807339449541284 and parameters: {'objective': 'Logloss', 'colsample_bylevel': 0.09578412617423755, 'depth': 8, 'boosting_type': 'Plain', 'bootstrap_type': 'Bayesian', 'bagging_temperature': 5.6550880066445695}. Best is trial 1464 with value: 0.8990825688073395.
[32m[I 2023-04-21 01:02:09,353][39m Trial 5691 finished with value: 0.8828828828828829 and parameters: {'objective': 'Logloss', 'colsample_bylevel': 0.09576453839508811, 'depth': 7, 'boosting_type': 'Plain', 'bootstrap_type': 'Bayesian', 'bagging_temperature': 6.1345423844391345}. Best is trial 1464 with value: 0.8990825688073395.
[32m[I 2023-04-21 01:02:10,912][39m Trial 5692 finished with value: 0.8807339449541284 and parameters: {'objective': 'CrossEntropy', 'colsample_bylevel': 0.08638302790173624, 'depth': 12, 'boosting_type': 'Plain', 'bootstrap_type': 'Bayesian', 'bagging_temperature': 6.329468660661345}. Best is trial 1464 with value: 0.8990825688073395.
[32m[I 2023-04-21 01:02:12,079][39m Trial 5693 finished with value: 0.8648648648648648 and parameters: {'objective': 'CrossEntropy', 'colsample_bylevel': 0.08858237824117875, 'depth': 12, 'boosting_type': 'Plain', 'bootstrap_type': 'Bayesian', 'bagging_temperature': 5.3722384355255715}. Best is trial 1464 with value: 0.8990825688073395.
[32m[I 2023-04-21 01:02:13,023][39m Trial 5694 finished with value: 0.8596491228070176 and parameters: {'objective': 'Logloss', 'colsample_bylevel': 0.08886587414605274, 'depth': 12, 'boosting_type': 'Plain', 'bootstrap_type': 'Bayesian', 'bagging_temperature': 4.825924861160586}. Best is trial 1464 with value: 0.8990825688073395.
[32m[I 2023-04-21 01:02:13,970][39m Trial 5695 finished with value: 0.8828828828828829 and parameters: {'objective': 'Logloss', 'colsample_bylevel': 0.08785475897611857, 'depth': 9, 'boosting_type': 'Plain', 'bootstrap_type': 'Bayesian', 'bagging_temperature': 4.886998338939612}. Best is trial 1464 with value: 0.8990825688073395.
[32m[I 2023-04-21 01:02:14,734][39m Trial 5696 finished with value: 0.8807339449541284 and parameters: {'objective': 'CrossEntropy', 'colsample_bylevel': 0.08842420534071808, 'depth': 11, 'boosting_type': 'Plain', 'bootstrap_type': 'Bayesian', 'bagging_temperature': 6.284748949329018}. Best is trial 1464 with value: 0.8990825688073395.
[32m[I 2023-04-21 01:02:16,302][39m Trial 5697 finished with value: 0.8672566371681416 and parameters: {'objective': 'Logloss', 'colsample_bylevel': 0.09223293772326986, 'depth': 11, 'boosting_type': 'Plain', 'bootstrap_type': 'Bernoulli', 'subsample': 0.6583551540079527}. Best is trial 1464 with value: 0.8990825688073395.
[32m[I 2023-04-21 01:02:17,279][39m Trial 5698 finished with value: 0.875 and parameters: {'objective': 'CrossEntropy', 'colsample_bylevel': 0.09171158559755323, 'depth': 12, 'boosting_type': 'Plain', 'bootstrap_type': 'Bayesian', 'bagging_temperature': 5.66890665257231}. Best is trial 1464 with value: 0.8990825688073395.
[32m[I 2023-04-21 01:02:18,516][39m Trial 5699 finished with value: 0.8305084745762712 and parameters: {'objective': 'Logloss', 'colsample_bylevel': 0.03485930193965012, 'depth': 8, 'boosting_type': 'Plain', 'bootstrap_type': 'MVS'}. Best is trial 1464 with value: 0.8990825688073395.
[32m[I 2023-04-21 01:02:19,975][39m Trial 5700 finished with value: 0.8623853211009175 and parameters: {'objective': 'Logloss', 'colsample_bylevel': 0.08661975114677757, 'depth': 12, 'boosting_type': 'Plain', 'bootstrap_type': 'Bayesian', 'bagging_temperature': 5.371673679275471}. Best is trial 1464 with value: 0.8990825688073395.
[32m[I 2023-04-21 01:02:21,462][39m Trial 5701 finished with value: 0.8807339449541284 and parameters: {'objective': 'CrossEntropy', 'colsample_bylevel': 0.09693292154472749, 'depth': 9, 'boosting_type': 'Plain', 'bootstrap_type': 'Bayesian', 'bagging_temperature': 4.620359887716116}. Best is trial 1464 with value: 0.8990825688073395.
[32m[I 2023-04-21 01:02:22,330][39m Trial 5702 finished with value: 0.8807339449541284 and parameters: {'objective': 'CrossEntropy', 'colsample_bylevel': 0.09836972025762176, 'depth': 8, 'boosting_type': 'Plain', 'bootstrap_type': 'Bayesian', 'bagging_temperature': 4.2647315884419825}. Best is trial 1464 with value: 0.8990825688073395.
[32m[I 2023-04-21 01:02:26,910][39m Trial 5703 finished with value: 0.8571428571428572 and parameters: {'objective': 'CrossEntropy', 'colsample_bylevel': 0.0983323067431144, 'depth': 9, 'boosting_type': 'Ordered', 'bootstrap_type': 'Bayesian', 'bagging_temperature': 4.141234131944274}. Best is trial 1464 with value: 0.8990825688073395.
[32m[I 2023-04-21 01:02:28,194][39m Trial 5704 finished with value: 0.8672566371681416 and parameters: {'objective': 'Logloss', 'colsample_bylevel': 0.0941134123813769, 'depth': 10, 'boosting_type': 'Plain', 'bootstrap_type': 'Bayesian', 'bagging_temperature': 5.3732508122861296}. Best is trial 1464 with value: 0.8990825688073395.
[32m[I 2023-04-21 01:02:30,166][39m Trial 5705 finished with value: 0.8648648648648648 and parameters: {'objective': 'Logloss', 'colsample_bylevel': 0.09273890675872547, 'depth': 8, 'boosting_type': 'Plain', 'bootstrap_type': 'Bayesian', 'bagging_temperature': 6.3956381664213495}. Best is trial 1464 with value: 0.8990825688073395.
[32m[I 2023-04-21 01:02:31,351][39m Trial 5706 finished with value: 0.8571428571428572 and parameters: {'objective': 'Logloss', 'colsample_bylevel': 0.09201824731004082, 'depth': 8, 'boosting_type': 'Plain', 'bootstrap_type': 'Bayesian', 'bagging_temperature': 6.313244729203031}. Best is trial 1464 with value: 0.8990825688073395.
[32m[I 2023-04-21 01:02:32,132][39m Trial 5707 finished with value: 0.8545454545454546 and parameters: {'objective': 'CrossEntropy', 'colsample_bylevel': 0.09850366626905312, 'depth': 7, 'boosting_type': 'Plain', 'bootstrap_type': 'Bayesian', 'bagging_temperature': 6.2793661679200685}. Best is trial 1464 with value: 0.8990825688073395.
[32m[I 2023-04-21 01:02:33,606][39m Trial 5708 finished with value: 0.8648648648648648 and parameters: {'objective': 'Logloss', 'colsample_bylevel': 0.0906863363118841, 'depth': 12, 'boosting_type': 'Plain', 'bootstrap_type': 'Bayesian', 'bagging_temperature': 6.381956253502408}. Best is trial 1464 with value: 0.8990825688073395.
[32m[I 2023-04-21 01:02:34,785][39m Trial 5709 finished with value: 0.8807339449541284 and parameters: {'objective': 'CrossEntropy', 'colsample_bylevel': 0.09101630668411093, 'depth': 10, 'boosting_type': 'Plain', 'bootstrap_type': 'Bayesian', 'bagging_temperature': 7.098739699352022}. Best is trial 1464 with value: 0.8990825688073395.
[32m[I 2023-04-21 01:02:36,562][39m Trial 5710 finished with value: 0.8785046728971961 and parameters: {'objective': 'CrossEntropy', 'colsample_bylevel': 0.09219028170516283, 'depth': 9, 'boosting_type': 'Plain', 'bootstrap_type': 'Bayesian', 'bagging_temperature': 4.810272229080456}. Best is trial 1464 with value: 0.8990825688073395.
[32m[I 2023-04-21 01:02:37,482][39m Trial 5711 finished with value: 0.8376068376068375 and parameters: {'objective': 'Logloss', 'colsample_bylevel': 0.09698634646959298, 'depth': 2, 'boosting_type': 'Plain', 'bootstrap_type': 'Bayesian', 'bagging_temperature': 5.973538521918982}. Best is trial 1464 with value: 0.8990825688073395.
[32m[I 2023-04-21 01:02:38,120][39m Trial 5712 finished with value: 0.888888888888889 and parameters: {'objective': 'CrossEntropy', 'colsample_bylevel': 0.09877915682945491, 'depth': 12, 'boosting_type': 'Plain', 'bootstrap_type': 'Bayesian', 'bagging_temperature': 3.548744892810798}. Best is trial 1464 with value: 0.8990825688073395.
[32m[I 2023-04-21 01:02:39,066][39m Trial 5713 finished with value: 0.8703703703703703 and parameters: {'objective': 'CrossEntropy', 'colsample_bylevel': 0.09449015507497105, 'depth': 9, 'boosting_type': 'Plain', 'bootstrap_type': 'Bayesian', 'bagging_temperature': 5.241325459168586}. Best is trial 1464 with value: 0.8990825688073395.
[32m[I 2023-04-21 01:02:40,280][39m Trial 5714 finished with value: 0.888888888888889 and parameters: {'objective': 'Logloss', 'colsample_bylevel': 0.0958828233627072, 'depth': 9, 'boosting_type': 'Plain', 'bootstrap_type': 'Bayesian', 'bagging_temperature': 6.258240128945621}. Best is trial 1464 with value: 0.8990825688073395.
[32m[I 2023-04-21 01:02:41,120][39m Trial 5715 finished with value: 0.8785046728971961 and parameters: {'objective': 'Logloss', 'colsample_bylevel': 0.09925274559250406, 'depth': 7, 'boosting_type': 'Plain', 'bootstrap_type': 'Bayesian', 'bagging_temperature': 5.584974406146736}. Best is trial 1464 with value: 0.8990825688073395.
[32m[I 2023-04-21 01:02:42,225][39m Trial 5716 finished with value: 0.8703703703703703 and parameters: {'objective': 'CrossEntropy', 'colsample_bylevel': 0.08794759979409773, 'depth': 11, 'boosting_type': 'Plain', 'bootstrap_type': 'Bayesian', 'bagging_temperature': 7.39453553321098}. Best is trial 1464 with value: 0.8990825688073395.
[32m[I 2023-04-21 01:02:43,741][39m Trial 5717 finished with value: 0.888888888888889 and parameters: {'objective': 'CrossEntropy', 'colsample_bylevel': 0.09202854821227907, 'depth': 11, 'boosting_type': 'Plain', 'bootstrap_type': 'Bayesian', 'bagging_temperature': 6.677218796935974}. Best is trial 1464 with value: 0.8990825688073395.
[32m[I 2023-04-21 01:02:44,964][39m Trial 5718 finished with value: 0.8495575221238938 and parameters: {'objective': 'CrossEntropy', 'colsample_bylevel': 0.07919367981750919, 'depth': 12, 'boosting_type': 'Plain', 'bootstrap_type': 'Bernoulli', 'subsample': 0.7481157640852758}. Best is trial 1464 with value: 0.8990825688073395.
[32m[I 2023-04-21 01:02:46,292][39m Trial 5719 finished with value: 0.8703703703703703 and parameters: {'objective': 'CrossEntropy', 'colsample_bylevel': 0.09988300493855087, 'depth': 5, 'boosting_type': 'Plain', 'bootstrap_type': 'Bayesian', 'bagging_temperature': 4.740131360558217}. Best is trial 1464 with value: 0.8990825688073395.
[32m[I 2023-04-21 01:02:47,475][39m Trial 5720 finished with value: 0.8727272727272727 and parameters: {'objective': 'CrossEntropy', 'colsample_bylevel': 0.09822336583089412, 'depth': 12, 'boosting_type': 'Plain', 'bootstrap_type': 'Bayesian', 'bagging_temperature': 4.616644885966022}. Best is trial 1464 with value: 0.8990825688073395.
[32m[I 2023-04-21 01:02:52,198][39m Trial 5721 finished with value: 0.8448275862068967 and parameters: {'objective': 'Logloss', 'colsample_bylevel': 0.08721538436609047, 'depth': 12, 'boosting_type': 'Ordered', 'bootstrap_type': 'Bayesian', 'bagging_temperature': 4.887683273474544}. Best is trial 1464 with value: 0.8990825688073395.
