[32m[I 2023-04-21 00:38:57,157][39m Trial 4675 finished with value: 0.8571428571428572 and parameters: {'objective': 'Logloss', 'colsample_bylevel': 0.0968904298113331, 'depth': 7, 'boosting_type': 'Plain', 'bootstrap_type': 'MVS'}. Best is trial 1464 with value: 0.8990825688073395.
[32m[I 2023-04-21 00:38:58,370][39m Trial 4676 finished with value: 0.8495575221238938 and parameters: {'objective': 'Logloss', 'colsample_bylevel': 0.08908706707570743, 'depth': 11, 'boosting_type': 'Plain', 'bootstrap_type': 'Bayesian', 'bagging_temperature': 4.560526514065588}. Best is trial 1464 with value: 0.8990825688073395.
[32m[I 2023-04-21 00:38:59,590][39m Trial 4677 finished with value: 0.8727272727272727 and parameters: {'objective': 'Logloss', 'colsample_bylevel': 0.09652745684550004, 'depth': 12, 'boosting_type': 'Plain', 'bootstrap_type': 'Bayesian', 'bagging_temperature': 6.090298160675337}. Best is trial 1464 with value: 0.8990825688073395.
[32m[I 2023-04-21 00:39:00,858][39m Trial 4678 finished with value: 0.8807339449541284 and parameters: {'objective': 'CrossEntropy', 'colsample_bylevel': 0.09087702304353144, 'depth': 12, 'boosting_type': 'Plain', 'bootstrap_type': 'Bayesian', 'bagging_temperature': 4.208744957150504}. Best is trial 1464 with value: 0.8990825688073395.
[32m[I 2023-04-21 00:39:01,932][39m Trial 4679 finished with value: 0.8828828828828829 and parameters: {'objective': 'Logloss', 'colsample_bylevel': 0.0925087840733025, 'depth': 12, 'boosting_type': 'Plain', 'bootstrap_type': 'Bayesian', 'bagging_temperature': 5.757703523708092}. Best is trial 1464 with value: 0.8990825688073395.
[32m[I 2023-04-21 00:39:02,663][39m Trial 4680 finished with value: 0.8545454545454546 and parameters: {'objective': 'Logloss', 'colsample_bylevel': 0.09297353673762493, 'depth': 5, 'boosting_type': 'Plain', 'bootstrap_type': 'Bayesian', 'bagging_temperature': 5.002114952454334}. Best is trial 1464 with value: 0.8990825688073395.
[32m[I 2023-04-21 00:39:03,597][39m Trial 4681 finished with value: 0.875 and parameters: {'objective': 'Logloss', 'colsample_bylevel': 0.0921517585573923, 'depth': 10, 'boosting_type': 'Plain', 'bootstrap_type': 'Bayesian', 'bagging_temperature': 4.114315492087525}. Best is trial 1464 with value: 0.8990825688073395.
[32m[I 2023-04-21 00:39:04,696][39m Trial 4682 finished with value: 0.8623853211009175 and parameters: {'objective': 'CrossEntropy', 'colsample_bylevel': 0.09476073042329844, 'depth': 10, 'boosting_type': 'Plain', 'bootstrap_type': 'Bayesian', 'bagging_temperature': 4.251030688590494}. Best is trial 1464 with value: 0.8990825688073395.
[32m[I 2023-04-21 00:39:05,793][39m Trial 4683 finished with value: 0.8727272727272727 and parameters: {'objective': 'CrossEntropy', 'colsample_bylevel': 0.09337891463676241, 'depth': 12, 'boosting_type': 'Plain', 'bootstrap_type': 'Bayesian', 'bagging_temperature': 4.722393386176262}. Best is trial 1464 with value: 0.8990825688073395.
[32m[I 2023-04-21 00:39:06,752][39m Trial 4684 finished with value: 0.8727272727272727 and parameters: {'objective': 'Logloss', 'colsample_bylevel': 0.09451412428755376, 'depth': 10, 'boosting_type': 'Plain', 'bootstrap_type': 'Bayesian', 'bagging_temperature': 3.74435159357711}. Best is trial 1464 with value: 0.8990825688073395.
[32m[I 2023-04-21 00:39:07,986][39m Trial 4685 finished with value: 0.8807339449541284 and parameters: {'objective': 'Logloss', 'colsample_bylevel': 0.09857037095174985, 'depth': 12, 'boosting_type': 'Plain', 'bootstrap_type': 'Bayesian', 'bagging_temperature': 4.709734203327265}. Best is trial 1464 with value: 0.8990825688073395.
[32m[I 2023-04-21 00:39:09,403][39m Trial 4686 finished with value: 0.875 and parameters: {'objective': 'Logloss', 'colsample_bylevel': 0.09054470826631897, 'depth': 11, 'boosting_type': 'Plain', 'bootstrap_type': 'Bayesian', 'bagging_temperature': 4.9316391764688525}. Best is trial 1464 with value: 0.8990825688073395.
[32m[I 2023-04-21 00:39:10,585][39m Trial 4687 finished with value: 0.8807339449541284 and parameters: {'objective': 'Logloss', 'colsample_bylevel': 0.091615542977494, 'depth': 12, 'boosting_type': 'Plain', 'bootstrap_type': 'Bayesian', 'bagging_temperature': 5.183070661608836}. Best is trial 1464 with value: 0.8990825688073395.
[32m[I 2023-04-21 00:39:11,698][39m Trial 4688 finished with value: 0.8807339449541284 and parameters: {'objective': 'Logloss', 'colsample_bylevel': 0.09011180646285212, 'depth': 12, 'boosting_type': 'Plain', 'bootstrap_type': 'Bayesian', 'bagging_temperature': 5.474916583411968}. Best is trial 1464 with value: 0.8990825688073395.
[32m[I 2023-04-21 00:39:13,052][39m Trial 4689 finished with value: 0.8727272727272727 and parameters: {'objective': 'Logloss', 'colsample_bylevel': 0.09420033677834333, 'depth': 11, 'boosting_type': 'Plain', 'bootstrap_type': 'Bayesian', 'bagging_temperature': 6.021645755787976}. Best is trial 1464 with value: 0.8990825688073395.
[32m[I 2023-04-21 00:39:14,751][39m Trial 4690 finished with value: 0.8703703703703703 and parameters: {'objective': 'Logloss', 'colsample_bylevel': 0.09064273314945631, 'depth': 11, 'boosting_type': 'Plain', 'bootstrap_type': 'Bayesian', 'bagging_temperature': 5.3747491739865145}. Best is trial 1464 with value: 0.8990825688073395.
[32m[I 2023-04-21 00:39:16,288][39m Trial 4691 finished with value: 0.8785046728971961 and parameters: {'objective': 'Logloss', 'colsample_bylevel': 0.09475077603297734, 'depth': 9, 'boosting_type': 'Plain', 'bootstrap_type': 'Bayesian', 'bagging_temperature': 5.331119705182793}. Best is trial 1464 with value: 0.8990825688073395.
[32m[I 2023-04-21 00:39:17,012][39m Trial 4692 finished with value: 0.8727272727272727 and parameters: {'objective': 'Logloss', 'colsample_bylevel': 0.0906826548909734, 'depth': 11, 'boosting_type': 'Plain', 'bootstrap_type': 'Bayesian', 'bagging_temperature': 4.897324646904684}. Best is trial 1464 with value: 0.8990825688073395.
[32m[I 2023-04-21 00:39:21,905][39m Trial 4693 finished with value: 0.8571428571428572 and parameters: {'objective': 'Logloss', 'colsample_bylevel': 0.09249274495649086, 'depth': 9, 'boosting_type': 'Ordered', 'bootstrap_type': 'Bayesian', 'bagging_temperature': 5.933963198592254}. Best is trial 1464 with value: 0.8990825688073395.
[32m[I 2023-04-21 00:39:22,961][39m Trial 4694 finished with value: 0.8347826086956522 and parameters: {'objective': 'Logloss', 'colsample_bylevel': 0.07783643898445272, 'depth': 11, 'boosting_type': 'Plain', 'bootstrap_type': 'Bayesian', 'bagging_temperature': 6.4985386479008}. Best is trial 1464 with value: 0.8990825688073395.
[32m[I 2023-04-21 00:39:24,054][39m Trial 4695 finished with value: 0.8421052631578947 and parameters: {'objective': 'CrossEntropy', 'colsample_bylevel': 0.07515562761631711, 'depth': 12, 'boosting_type': 'Plain', 'bootstrap_type': 'Bernoulli', 'subsample': 0.3197487331759873}. Best is trial 1464 with value: 0.8990825688073395.
[32m[I 2023-04-21 00:39:25,303][39m Trial 4696 finished with value: 0.8648648648648648 and parameters: {'objective': 'Logloss', 'colsample_bylevel': 0.08713284566091825, 'depth': 12, 'boosting_type': 'Plain', 'bootstrap_type': 'Bayesian', 'bagging_temperature': 5.308940128207557}. Best is trial 1464 with value: 0.8990825688073395.
[32m[I 2023-04-21 00:39:26,407][39m Trial 4697 finished with value: 0.8672566371681416 and parameters: {'objective': 'CrossEntropy', 'colsample_bylevel': 0.09528750932175542, 'depth': 11, 'boosting_type': 'Plain', 'bootstrap_type': 'MVS'}. Best is trial 1464 with value: 0.8990825688073395.
[32m[I 2023-04-21 00:39:27,577][39m Trial 4698 finished with value: 0.8727272727272727 and parameters: {'objective': 'Logloss', 'colsample_bylevel': 0.09067102079168488, 'depth': 12, 'boosting_type': 'Plain', 'bootstrap_type': 'Bayesian', 'bagging_temperature': 4.697046520204422}. Best is trial 1464 with value: 0.8990825688073395.
[32m[I 2023-04-21 00:39:28,824][39m Trial 4699 finished with value: 0.8727272727272727 and parameters: {'objective': 'CrossEntropy', 'colsample_bylevel': 0.0889878364166298, 'depth': 12, 'boosting_type': 'Plain', 'bootstrap_type': 'Bayesian', 'bagging_temperature': 5.569979778904341}. Best is trial 1464 with value: 0.8990825688073395.
[32m[I 2023-04-21 00:39:29,741][39m Trial 4700 finished with value: 0.8648648648648648 and parameters: {'objective': 'CrossEntropy', 'colsample_bylevel': 0.09486288719773799, 'depth': 12, 'boosting_type': 'Plain', 'bootstrap_type': 'Bayesian', 'bagging_temperature': 4.346064453799132}. Best is trial 1464 with value: 0.8990825688073395.
[32m[I 2023-04-21 00:39:31,006][39m Trial 4701 finished with value: 0.8807339449541284 and parameters: {'objective': 'CrossEntropy', 'colsample_bylevel': 0.09121929038135021, 'depth': 12, 'boosting_type': 'Plain', 'bootstrap_type': 'Bayesian', 'bagging_temperature': 4.79317184770093}. Best is trial 1464 with value: 0.8990825688073395.
[32m[I 2023-04-21 00:39:31,703][39m Trial 4702 finished with value: 0.8672566371681416 and parameters: {'objective': 'Logloss', 'colsample_bylevel': 0.04605816378980443, 'depth': 10, 'boosting_type': 'Plain', 'bootstrap_type': 'Bayesian', 'bagging_temperature': 4.028970480316904}. Best is trial 1464 with value: 0.8990825688073395.
[32m[I 2023-04-21 00:39:32,464][39m Trial 4703 finished with value: 0.8828828828828829 and parameters: {'objective': 'CrossEntropy', 'colsample_bylevel': 0.08809178342411549, 'depth': 12, 'boosting_type': 'Plain', 'bootstrap_type': 'Bayesian', 'bagging_temperature': 5.442726177631202}. Best is trial 1464 with value: 0.8990825688073395.
[32m[I 2023-04-21 00:39:33,374][39m Trial 4704 finished with value: 0.875 and parameters: {'objective': 'Logloss', 'colsample_bylevel': 0.08854027062740144, 'depth': 10, 'boosting_type': 'Plain', 'bootstrap_type': 'Bayesian', 'bagging_temperature': 5.278396455179589}. Best is trial 1464 with value: 0.8990825688073395.
[32m[I 2023-04-21 00:39:34,401][39m Trial 4705 finished with value: 0.8727272727272727 and parameters: {'objective': 'CrossEntropy', 'colsample_bylevel': 0.09327154913071217, 'depth': 10, 'boosting_type': 'Plain', 'bootstrap_type': 'Bayesian', 'bagging_temperature': 4.384045465261892}. Best is trial 1464 with value: 0.8990825688073395.
[32m[I 2023-04-21 00:39:35,762][39m Trial 4706 finished with value: 0.8807339449541284 and parameters: {'objective': 'Logloss', 'colsample_bylevel': 0.08839145489992424, 'depth': 12, 'boosting_type': 'Plain', 'bootstrap_type': 'Bayesian', 'bagging_temperature': 4.772657757767676}. Best is trial 1464 with value: 0.8990825688073395.
[32m[I 2023-04-21 00:39:36,867][39m Trial 4707 finished with value: 0.890909090909091 and parameters: {'objective': 'CrossEntropy', 'colsample_bylevel': 0.08389183933526106, 'depth': 12, 'boosting_type': 'Plain', 'bootstrap_type': 'Bayesian', 'bagging_temperature': 7.036099896069012}. Best is trial 1464 with value: 0.8990825688073395.
[32m[I 2023-04-21 00:39:38,740][39m Trial 4708 finished with value: 0.8623853211009175 and parameters: {'objective': 'Logloss', 'colsample_bylevel': 0.09375300664287035, 'depth': 9, 'boosting_type': 'Plain', 'bootstrap_type': 'Bayesian', 'bagging_temperature': 4.725679167603976}. Best is trial 1464 with value: 0.8990825688073395.
[32m[I 2023-04-21 00:39:39,479][39m Trial 4709 finished with value: 0.8807339449541284 and parameters: {'objective': 'Logloss', 'colsample_bylevel': 0.09814508083860934, 'depth': 7, 'boosting_type': 'Plain', 'bootstrap_type': 'Bayesian', 'bagging_temperature': 5.653773554327453}. Best is trial 1464 with value: 0.8990825688073395.
[32m[I 2023-04-21 00:39:40,946][39m Trial 4710 finished with value: 0.8807339449541284 and parameters: {'objective': 'Logloss', 'colsample_bylevel': 0.09328069996096246, 'depth': 9, 'boosting_type': 'Plain', 'bootstrap_type': 'Bayesian', 'bagging_temperature': 5.849247039747616}. Best is trial 1464 with value: 0.8990825688073395.
[32m[I 2023-04-21 00:39:42,431][39m Trial 4711 finished with value: 0.8727272727272727 and parameters: {'objective': 'Logloss', 'colsample_bylevel': 0.09492217944219151, 'depth': 10, 'boosting_type': 'Plain', 'bootstrap_type': 'Bayesian', 'bagging_temperature': 6.7445960442938535}. Best is trial 1464 with value: 0.8990825688073395.
[32m[I 2023-04-21 00:39:46,958][39m Trial 4712 finished with value: 0.8305084745762712 and parameters: {'objective': 'CrossEntropy', 'colsample_bylevel': 0.09990353358438976, 'depth': 1, 'boosting_type': 'Ordered', 'bootstrap_type': 'Bayesian', 'bagging_temperature': 4.631808865228675}. Best is trial 1464 with value: 0.8990825688073395.
[32m[I 2023-04-21 00:39:48,010][39m Trial 4713 finished with value: 0.8807339449541284 and parameters: {'objective': 'CrossEntropy', 'colsample_bylevel': 0.08862109153990755, 'depth': 12, 'boosting_type': 'Plain', 'bootstrap_type': 'Bayesian', 'bagging_temperature': 4.404427603892201}. Best is trial 1464 with value: 0.8990825688073395.
[32m[I 2023-04-21 00:39:49,644][39m Trial 4714 finished with value: 0.8672566371681416 and parameters: {'objective': 'Logloss', 'colsample_bylevel': 0.08572128485627369, 'depth': 12, 'boosting_type': 'Plain', 'bootstrap_type': 'Bernoulli', 'subsample': 0.2513218299538104}. Best is trial 1464 with value: 0.8990825688073395.
[32m[I 2023-04-21 00:39:50,538][39m Trial 4715 finished with value: 0.888888888888889 and parameters: {'objective': 'Logloss', 'colsample_bylevel': 0.09212574862054496, 'depth': 10, 'boosting_type': 'Plain', 'bootstrap_type': 'Bayesian', 'bagging_temperature': 5.996958200320666}. Best is trial 1464 with value: 0.8990825688073395.
[32m[I 2023-04-21 00:39:51,514][39m Trial 4716 finished with value: 0.8727272727272727 and parameters: {'objective': 'Logloss', 'colsample_bylevel': 0.09247525404644087, 'depth': 11, 'boosting_type': 'Plain', 'bootstrap_type': 'Bayesian', 'bagging_temperature': 5.842381224569891}. Best is trial 1464 with value: 0.8990825688073395.
[32m[I 2023-04-21 00:39:52,640][39m Trial 4717 finished with value: 0.8807339449541284 and parameters: {'objective': 'Logloss', 'colsample_bylevel': 0.0920601647520187, 'depth': 12, 'boosting_type': 'Plain', 'bootstrap_type': 'Bayesian', 'bagging_temperature': 4.912501729709248}. Best is trial 1464 with value: 0.8990825688073395.
[32m[I 2023-04-21 00:39:53,761][39m Trial 4718 finished with value: 0.8596491228070176 and parameters: {'objective': 'CrossEntropy', 'colsample_bylevel': 0.09440106099633223, 'depth': 12, 'boosting_type': 'Plain', 'bootstrap_type': 'MVS'}. Best is trial 1464 with value: 0.8990825688073395.
[32m[I 2023-04-21 00:39:54,795][39m Trial 4719 finished with value: 0.8807339449541284 and parameters: {'objective': 'Logloss', 'colsample_bylevel': 0.09324251542878718, 'depth': 11, 'boosting_type': 'Plain', 'bootstrap_type': 'Bayesian', 'bagging_temperature': 6.271683675602938}. Best is trial 1464 with value: 0.8990825688073395.
[32m[I 2023-04-21 00:39:56,015][39m Trial 4720 finished with value: 0.8807339449541284 and parameters: {'objective': 'Logloss', 'colsample_bylevel': 0.08888579668299763, 'depth': 11, 'boosting_type': 'Plain', 'bootstrap_type': 'Bayesian', 'bagging_temperature': 5.417885704228717}. Best is trial 1464 with value: 0.8990825688073395.
[32m[I 2023-04-21 00:39:57,397][39m Trial 4721 finished with value: 0.888888888888889 and parameters: {'objective': 'Logloss', 'colsample_bylevel': 0.08901487793476309, 'depth': 12, 'boosting_type': 'Plain', 'bootstrap_type': 'Bayesian', 'bagging_temperature': 5.211229841724087}. Best is trial 1464 with value: 0.8990825688073395.
[32m[I 2023-04-21 00:39:58,156][39m Trial 4722 finished with value: 0.8571428571428572 and parameters: {'objective': 'Logloss', 'colsample_bylevel': 0.09655524512163732, 'depth': 12, 'boosting_type': 'Plain', 'bootstrap_type': 'Bayesian', 'bagging_temperature': 7.581814613215013}. Best is trial 1464 with value: 0.8990825688073395.
[32m[I 2023-04-21 00:39:59,092][39m Trial 4723 finished with value: 0.8828828828828829 and parameters: {'objective': 'CrossEntropy', 'colsample_bylevel': 0.09044051770335314, 'depth': 11, 'boosting_type': 'Plain', 'bootstrap_type': 'Bayesian', 'bagging_temperature': 4.685803339481224}. Best is trial 1464 with value: 0.8990825688073395.
[32m[I 2023-04-21 00:40:00,204][39m Trial 4724 finished with value: 0.8495575221238938 and parameters: {'objective': 'CrossEntropy', 'colsample_bylevel': 0.0897712151114922, 'depth': 11, 'boosting_type': 'Plain', 'bootstrap_type': 'Bayesian', 'bagging_temperature': 5.230287406959171}. Best is trial 1464 with value: 0.8990825688073395.
[32m[I 2023-04-21 00:40:01,670][39m Trial 4725 finished with value: 0.8623853211009175 and parameters: {'objective': 'CrossEntropy', 'colsample_bylevel': 0.08978054953571556, 'depth': 11, 'boosting_type': 'Plain', 'bootstrap_type': 'Bayesian', 'bagging_temperature': 7.1992804948509}. Best is trial 1464 with value: 0.8990825688073395.
[32m[I 2023-04-21 00:40:02,794][39m Trial 4726 finished with value: 0.8648648648648648 and parameters: {'objective': 'Logloss', 'colsample_bylevel': 0.0908126059295443, 'depth': 11, 'boosting_type': 'Plain', 'bootstrap_type': 'Bayesian', 'bagging_temperature': 5.651110932443148}. Best is trial 1464 with value: 0.8990825688073395.
[32m[I 2023-04-21 00:40:03,717][39m Trial 4727 finished with value: 0.8571428571428572 and parameters: {'objective': 'CrossEntropy', 'colsample_bylevel': 0.08371475439528753, 'depth': 12, 'boosting_type': 'Plain', 'bootstrap_type': 'Bayesian', 'bagging_temperature': 5.6449867244321315}. Best is trial 1464 with value: 0.8990825688073395.
[32m[I 2023-04-21 00:40:04,622][39m Trial 4728 finished with value: 0.8727272727272727 and parameters: {'objective': 'CrossEntropy', 'colsample_bylevel': 0.08685735178727795, 'depth': 12, 'boosting_type': 'Plain', 'bootstrap_type': 'Bayesian', 'bagging_temperature': 5.588421628482114}. Best is trial 1464 with value: 0.8990825688073395.
[32m[I 2023-04-21 00:40:05,355][39m Trial 4729 finished with value: 0.8545454545454546 and parameters: {'objective': 'Logloss', 'colsample_bylevel': 0.09384380215924702, 'depth': 11, 'boosting_type': 'Plain', 'bootstrap_type': 'Bayesian', 'bagging_temperature': 6.768878136964282}. Best is trial 1464 with value: 0.8990825688073395.
[32m[I 2023-04-21 00:40:10,744][39m Trial 4730 finished with value: 0.8495575221238938 and parameters: {'objective': 'CrossEntropy', 'colsample_bylevel': 0.09115716402242928, 'depth': 12, 'boosting_type': 'Ordered', 'bootstrap_type': 'Bayesian', 'bagging_temperature': 5.519935528418392}. Best is trial 1464 with value: 0.8990825688073395.
[32m[I 2023-04-21 00:40:12,384][39m Trial 4731 finished with value: 0.8648648648648648 and parameters: {'objective': 'CrossEntropy', 'colsample_bylevel': 0.09650785972850195, 'depth': 9, 'boosting_type': 'Plain', 'bootstrap_type': 'Bayesian', 'bagging_temperature': 7.09908920512361}. Best is trial 1464 with value: 0.8990825688073395.
[32m[I 2023-04-21 00:40:13,858][39m Trial 4732 finished with value: 0.8807339449541284 and parameters: {'objective': 'Logloss', 'colsample_bylevel': 0.08976738927617718, 'depth': 12, 'boosting_type': 'Plain', 'bootstrap_type': 'Bayesian', 'bagging_temperature': 7.261572721049937}. Best is trial 1464 with value: 0.8990825688073395.
[32m[I 2023-04-21 00:40:14,920][39m Trial 4733 finished with value: 0.8623853211009175 and parameters: {'objective': 'Logloss', 'colsample_bylevel': 0.08838108925575512, 'depth': 12, 'boosting_type': 'Plain', 'bootstrap_type': 'Bayesian', 'bagging_temperature': 5.315063218975491}. Best is trial 1464 with value: 0.8990825688073395.
[32m[I 2023-04-21 00:40:16,042][39m Trial 4734 finished with value: 0.8727272727272727 and parameters: {'objective': 'Logloss', 'colsample_bylevel': 0.09809598562748834, 'depth': 7, 'boosting_type': 'Plain', 'bootstrap_type': 'Bayesian', 'bagging_temperature': 3.7349991380569323}. Best is trial 1464 with value: 0.8990825688073395.
[32m[I 2023-04-21 00:40:17,463][39m Trial 4735 finished with value: 0.888888888888889 and parameters: {'objective': 'CrossEntropy', 'colsample_bylevel': 0.09120684622831658, 'depth': 11, 'boosting_type': 'Plain', 'bootstrap_type': 'Bayesian', 'bagging_temperature': 6.505769190180418}. Best is trial 1464 with value: 0.8990825688073395.
[32m[I 2023-04-21 00:40:18,594][39m Trial 4736 finished with value: 0.8648648648648648 and parameters: {'objective': 'Logloss', 'colsample_bylevel': 0.0916363920196118, 'depth': 9, 'boosting_type': 'Plain', 'bootstrap_type': 'Bernoulli', 'subsample': 0.6773671564981614}. Best is trial 1464 with value: 0.8990825688073395.
[32m[I 2023-04-21 00:40:19,243][39m Trial 4737 finished with value: 0.752136752136752 and parameters: {'objective': 'CrossEntropy', 'colsample_bylevel': 0.010026843841498656, 'depth': 9, 'boosting_type': 'Plain', 'bootstrap_type': 'Bayesian', 'bagging_temperature': 4.899447161586965}. Best is trial 1464 with value: 0.8990825688073395.
[32m[I 2023-04-21 00:40:20,405][39m Trial 4738 finished with value: 0.8727272727272727 and parameters: {'objective': 'CrossEntropy', 'colsample_bylevel': 0.08584187321213617, 'depth': 12, 'boosting_type': 'Plain', 'bootstrap_type': 'Bayesian', 'bagging_temperature': 6.871133659181574}. Best is trial 1464 with value: 0.8990825688073395.
[32m[I 2023-04-21 00:40:22,175][39m Trial 4739 finished with value: 0.888888888888889 and parameters: {'objective': 'Logloss', 'colsample_bylevel': 0.09357492726584732, 'depth': 8, 'boosting_type': 'Plain', 'bootstrap_type': 'Bayesian', 'bagging_temperature': 5.319560987615822}. Best is trial 1464 with value: 0.8990825688073395.
[32m[I 2023-04-21 00:40:22,947][39m Trial 4740 finished with value: 0.8571428571428572 and parameters: {'objective': 'CrossEntropy', 'colsample_bylevel': 0.08575987812399144, 'depth': 11, 'boosting_type': 'Plain', 'bootstrap_type': 'MVS'}. Best is trial 1464 with value: 0.8990825688073395.
