[32m[I 2023-04-21 01:05:56,870][39m Trial 5853 finished with value: 0.8571428571428572 and parameters: {'objective': 'CrossEntropy', 'colsample_bylevel': 0.09407918030363485, 'depth': 10, 'boosting_type': 'Plain', 'bootstrap_type': 'MVS'}. Best is trial 1464 with value: 0.8990825688073395.
[32m[I 2023-04-21 01:05:58,209][39m Trial 5854 finished with value: 0.8807339449541284 and parameters: {'objective': 'CrossEntropy', 'colsample_bylevel': 0.09597948463793987, 'depth': 12, 'boosting_type': 'Plain', 'bootstrap_type': 'Bayesian', 'bagging_temperature': 4.432382519716682}. Best is trial 1464 with value: 0.8990825688073395.
[32m[I 2023-04-21 01:05:59,308][39m Trial 5855 finished with value: 0.875 and parameters: {'objective': 'Logloss', 'colsample_bylevel': 0.0964742118081028, 'depth': 12, 'boosting_type': 'Plain', 'bootstrap_type': 'Bayesian', 'bagging_temperature': 3.86502891402738}. Best is trial 1464 with value: 0.8990825688073395.
[32m[I 2023-04-21 01:06:00,523][39m Trial 5856 finished with value: 0.8727272727272727 and parameters: {'objective': 'Logloss', 'colsample_bylevel': 0.09685531891175755, 'depth': 8, 'boosting_type': 'Plain', 'bootstrap_type': 'Bayesian', 'bagging_temperature': 6.278377589887518}. Best is trial 1464 with value: 0.8990825688073395.
[32m[I 2023-04-21 01:06:02,051][39m Trial 5857 finished with value: 0.8703703703703703 and parameters: {'objective': 'CrossEntropy', 'colsample_bylevel': 0.09288981450071425, 'depth': 10, 'boosting_type': 'Plain', 'bootstrap_type': 'Bayesian', 'bagging_temperature': 4.592087981314589}. Best is trial 1464 with value: 0.8990825688073395.
[32m[I 2023-04-21 01:06:03,525][39m Trial 5858 finished with value: 0.8571428571428572 and parameters: {'objective': 'Logloss', 'colsample_bylevel': 0.09372664485096115, 'depth': 9, 'boosting_type': 'Plain', 'bootstrap_type': 'Bayesian', 'bagging_temperature': 6.450340625584}. Best is trial 1464 with value: 0.8990825688073395.
[32m[I 2023-04-21 01:06:04,975][39m Trial 5859 finished with value: 0.8703703703703703 and parameters: {'objective': 'Logloss', 'colsample_bylevel': 0.09967537665527922, 'depth': 8, 'boosting_type': 'Plain', 'bootstrap_type': 'Bayesian', 'bagging_temperature': 4.899004837954821}. Best is trial 1464 with value: 0.8990825688073395.
[32m[I 2023-04-21 01:06:05,863][39m Trial 5860 finished with value: 0.8727272727272727 and parameters: {'objective': 'CrossEntropy', 'colsample_bylevel': 0.08908980169110242, 'depth': 12, 'boosting_type': 'Plain', 'bootstrap_type': 'Bayesian', 'bagging_temperature': 5.553778770822536}. Best is trial 1464 with value: 0.8990825688073395.
[32m[I 2023-04-21 01:06:07,066][39m Trial 5861 finished with value: 0.8571428571428572 and parameters: {'objective': 'Logloss', 'colsample_bylevel': 0.09292665141544262, 'depth': 12, 'boosting_type': 'Plain', 'bootstrap_type': 'Bayesian', 'bagging_temperature': 6.322109612172115}. Best is trial 1464 with value: 0.8990825688073395.
[32m[I 2023-04-21 01:06:08,557][39m Trial 5862 finished with value: 0.888888888888889 and parameters: {'objective': 'Logloss', 'colsample_bylevel': 0.09724106433010832, 'depth': 9, 'boosting_type': 'Plain', 'bootstrap_type': 'Bayesian', 'bagging_temperature': 5.489370268852183}. Best is trial 1464 with value: 0.8990825688073395.
[32m[I 2023-04-21 01:06:09,384][39m Trial 5863 finished with value: 0.8807339449541284 and parameters: {'objective': 'Logloss', 'colsample_bylevel': 0.0951560946564335, 'depth': 7, 'boosting_type': 'Plain', 'bootstrap_type': 'Bayesian', 'bagging_temperature': 3.54141231694702}. Best is trial 1464 with value: 0.8990825688073395.
[32m[I 2023-04-21 01:06:10,070][39m Trial 5864 finished with value: 0.8807339449541284 and parameters: {'objective': 'CrossEntropy', 'colsample_bylevel': 0.09732908337076035, 'depth': 7, 'boosting_type': 'Plain', 'bootstrap_type': 'Bayesian', 'bagging_temperature': 3.8154813042273124}. Best is trial 1464 with value: 0.8990825688073395.
[32m[I 2023-04-21 01:06:12,120][39m Trial 5865 finished with value: 0.8468468468468469 and parameters: {'objective': 'Logloss', 'colsample_bylevel': 0.09391266673440014, 'depth': 9, 'boosting_type': 'Plain', 'bootstrap_type': 'Bayesian', 'bagging_temperature': 0.268026410575807}. Best is trial 1464 with value: 0.8990825688073395.
[32m[I 2023-04-21 01:06:13,359][39m Trial 5866 finished with value: 0.8807339449541284 and parameters: {'objective': 'Logloss', 'colsample_bylevel': 0.09300284259665811, 'depth': 10, 'boosting_type': 'Plain', 'bootstrap_type': 'Bayesian', 'bagging_temperature': 5.960950320137879}. Best is trial 1464 with value: 0.8990825688073395.
[32m[I 2023-04-21 01:06:14,657][39m Trial 5867 finished with value: 0.8392857142857144 and parameters: {'objective': 'Logloss', 'colsample_bylevel': 0.0878352093477978, 'depth': 7, 'boosting_type': 'Plain', 'bootstrap_type': 'Bayesian', 'bagging_temperature': 3.588047778177395}. Best is trial 1464 with value: 0.8990825688073395.
[32m[I 2023-04-21 01:06:15,441][39m Trial 5868 finished with value: 0.8807339449541284 and parameters: {'objective': 'Logloss', 'colsample_bylevel': 0.09035711899629578, 'depth': 10, 'boosting_type': 'Plain', 'bootstrap_type': 'Bayesian', 'bagging_temperature': 4.978696963274603}. Best is trial 1464 with value: 0.8990825688073395.
[32m[I 2023-04-21 01:06:17,100][39m Trial 5869 finished with value: 0.8727272727272727 and parameters: {'objective': 'Logloss', 'colsample_bylevel': 0.09184618148207035, 'depth': 9, 'boosting_type': 'Plain', 'bootstrap_type': 'Bayesian', 'bagging_temperature': 4.98684968861085}. Best is trial 1464 with value: 0.8990825688073395.
[32m[I 2023-04-21 01:06:21,990][39m Trial 5870 finished with value: 0.8545454545454546 and parameters: {'objective': 'CrossEntropy', 'colsample_bylevel': 0.0949438211961523, 'depth': 9, 'boosting_type': 'Ordered', 'bootstrap_type': 'Bernoulli', 'subsample': 0.20078497721908578}. Best is trial 1464 with value: 0.8990825688073395.
[32m[I 2023-04-21 01:06:23,997][39m Trial 5871 finished with value: 0.8703703703703703 and parameters: {'objective': 'Logloss', 'colsample_bylevel': 0.09189617682363184, 'depth': 8, 'boosting_type': 'Plain', 'bootstrap_type': 'Bayesian', 'bagging_temperature': 5.495502741877596}. Best is trial 1464 with value: 0.8990825688073395.
[32m[I 2023-04-21 01:06:24,952][39m Trial 5872 finished with value: 0.8571428571428572 and parameters: {'objective': 'Logloss', 'colsample_bylevel': 0.08550017380100004, 'depth': 12, 'boosting_type': 'Plain', 'bootstrap_type': 'Bayesian', 'bagging_temperature': 5.099301682915441}. Best is trial 1464 with value: 0.8990825688073395.
[32m[I 2023-04-21 01:06:26,584][39m Trial 5873 finished with value: 0.8703703703703703 and parameters: {'objective': 'CrossEntropy', 'colsample_bylevel': 0.0943502050884132, 'depth': 9, 'boosting_type': 'Plain', 'bootstrap_type': 'Bayesian', 'bagging_temperature': 5.686738319392558}. Best is trial 1464 with value: 0.8990825688073395.
[32m[I 2023-04-21 01:06:28,285][39m Trial 5874 finished with value: 0.8495575221238938 and parameters: {'objective': 'Logloss', 'colsample_bylevel': 0.08800429675998561, 'depth': 9, 'boosting_type': 'Plain', 'bootstrap_type': 'MVS'}. Best is trial 1464 with value: 0.8990825688073395.
[32m[I 2023-04-21 01:06:29,404][39m Trial 5875 finished with value: 0.8376068376068375 and parameters: {'objective': 'CrossEntropy', 'colsample_bylevel': 0.03628719458693344, 'depth': 8, 'boosting_type': 'Plain', 'bootstrap_type': 'Bayesian', 'bagging_temperature': 4.712040225608931}. Best is trial 1464 with value: 0.8990825688073395.
[32m[I 2023-04-21 01:06:30,469][39m Trial 5876 finished with value: 0.8807339449541284 and parameters: {'objective': 'CrossEntropy', 'colsample_bylevel': 0.09979925838758169, 'depth': 12, 'boosting_type': 'Plain', 'bootstrap_type': 'Bayesian', 'bagging_temperature': 5.49401035977402}. Best is trial 1464 with value: 0.8990825688073395.
[32m[I 2023-04-21 01:06:31,360][39m Trial 5877 finished with value: 0.8648648648648648 and parameters: {'objective': 'CrossEntropy', 'colsample_bylevel': 0.08860645366418306, 'depth': 11, 'boosting_type': 'Plain', 'bootstrap_type': 'Bayesian', 'bagging_temperature': 5.235267262062365}. Best is trial 1464 with value: 0.8990825688073395.
[32m[I 2023-04-21 01:06:32,761][39m Trial 5878 finished with value: 0.8828828828828829 and parameters: {'objective': 'Logloss', 'colsample_bylevel': 0.0938635935816857, 'depth': 9, 'boosting_type': 'Plain', 'bootstrap_type': 'Bayesian', 'bagging_temperature': 7.192223494609023}. Best is trial 1464 with value: 0.8990825688073395.
[32m[I 2023-04-21 01:06:33,781][39m Trial 5879 finished with value: 0.8807339449541284 and parameters: {'objective': 'CrossEntropy', 'colsample_bylevel': 0.09607535156643854, 'depth': 9, 'boosting_type': 'Plain', 'bootstrap_type': 'Bayesian', 'bagging_temperature': 6.9481731644107105}. Best is trial 1464 with value: 0.8990825688073395.
[32m[I 2023-04-21 01:06:34,407][39m Trial 5880 finished with value: 0.875 and parameters: {'objective': 'CrossEntropy', 'colsample_bylevel': 0.09805097221833428, 'depth': 12, 'boosting_type': 'Plain', 'bootstrap_type': 'Bayesian', 'bagging_temperature': 4.222260651077205}. Best is trial 1464 with value: 0.8990825688073395.
[32m[I 2023-04-21 01:06:35,306][39m Trial 5881 finished with value: 0.8727272727272727 and parameters: {'objective': 'Logloss', 'colsample_bylevel': 0.09821389650168545, 'depth': 11, 'boosting_type': 'Plain', 'bootstrap_type': 'Bayesian', 'bagging_temperature': 7.5755507399269}. Best is trial 1464 with value: 0.8990825688073395.
[32m[I 2023-04-21 01:06:36,312][39m Trial 5882 finished with value: 0.8571428571428572 and parameters: {'objective': 'CrossEntropy', 'colsample_bylevel': 0.0890992249620186, 'depth': 10, 'boosting_type': 'Plain', 'bootstrap_type': 'Bayesian', 'bagging_temperature': 6.605465849578759}. Best is trial 1464 with value: 0.8990825688073395.
[32m[I 2023-04-21 01:06:38,281][39m Trial 5883 finished with value: 0.888888888888889 and parameters: {'objective': 'Logloss', 'colsample_bylevel': 0.09553770267194434, 'depth': 9, 'boosting_type': 'Plain', 'bootstrap_type': 'Bayesian', 'bagging_temperature': 6.133375009478582}. Best is trial 1464 with value: 0.8990825688073395.
[32m[I 2023-04-21 01:06:39,586][39m Trial 5884 finished with value: 0.8785046728971961 and parameters: {'objective': 'Logloss', 'colsample_bylevel': 0.09851035701312857, 'depth': 9, 'boosting_type': 'Plain', 'bootstrap_type': 'Bayesian', 'bagging_temperature': 4.7533727268309125}. Best is trial 1464 with value: 0.8990825688073395.
[32m[I 2023-04-21 01:06:40,840][39m Trial 5885 finished with value: 0.8807339449541284 and parameters: {'objective': 'Logloss', 'colsample_bylevel': 0.0970423622091843, 'depth': 9, 'boosting_type': 'Plain', 'bootstrap_type': 'Bayesian', 'bagging_temperature': 4.949936673196333}. Best is trial 1464 with value: 0.8990825688073395.
[32m[I 2023-04-21 01:06:42,267][39m Trial 5886 finished with value: 0.888888888888889 and parameters: {'objective': 'CrossEntropy', 'colsample_bylevel': 0.08730222783906526, 'depth': 12, 'boosting_type': 'Plain', 'bootstrap_type': 'Bayesian', 'bagging_temperature': 4.686744511114819}. Best is trial 1464 with value: 0.8990825688073395.
[32m[I 2023-04-21 01:06:43,513][39m Trial 5887 finished with value: 0.8727272727272727 and parameters: {'objective': 'CrossEntropy', 'colsample_bylevel': 0.08930286250776673, 'depth': 12, 'boosting_type': 'Plain', 'bootstrap_type': 'Bayesian', 'bagging_temperature': 5.000368582749397}. Best is trial 1464 with value: 0.8990825688073395.
[32m[I 2023-04-21 01:06:44,679][39m Trial 5888 finished with value: 0.8495575221238938 and parameters: {'objective': 'CrossEntropy', 'colsample_bylevel': 0.08847420528320417, 'depth': 11, 'boosting_type': 'Plain', 'bootstrap_type': 'Bayesian', 'bagging_temperature': 3.2305697537212965}. Best is trial 1464 with value: 0.8990825688073395.
[32m[I 2023-04-21 01:06:45,869][39m Trial 5889 finished with value: 0.8727272727272727 and parameters: {'objective': 'CrossEntropy', 'colsample_bylevel': 0.09386881080697981, 'depth': 9, 'boosting_type': 'Plain', 'bootstrap_type': 'Bayesian', 'bagging_temperature': 5.881148507837913}. Best is trial 1464 with value: 0.8990825688073395.
[32m[I 2023-04-21 01:06:50,123][39m Trial 5890 finished with value: 0.8347826086956522 and parameters: {'objective': 'CrossEntropy', 'colsample_bylevel': 0.09675463331308239, 'depth': 10, 'boosting_type': 'Ordered', 'bootstrap_type': 'Bernoulli', 'subsample': 0.31259809332046884}. Best is trial 1464 with value: 0.8990825688073395.
[32m[I 2023-04-21 01:06:51,365][39m Trial 5891 finished with value: 0.8032786885245901 and parameters: {'objective': 'CrossEntropy', 'colsample_bylevel': 0.015991409147401776, 'depth': 11, 'boosting_type': 'Plain', 'bootstrap_type': 'Bayesian', 'bagging_temperature': 4.069523651909005}. Best is trial 1464 with value: 0.8990825688073395.
[32m[I 2023-04-21 01:06:52,570][39m Trial 5892 finished with value: 0.8703703703703703 and parameters: {'objective': 'CrossEntropy', 'colsample_bylevel': 0.08624350592187378, 'depth': 12, 'boosting_type': 'Plain', 'bootstrap_type': 'Bayesian', 'bagging_temperature': 5.676729141413522}. Best is trial 1464 with value: 0.8990825688073395.
[32m[I 2023-04-21 01:06:53,696][39m Trial 5893 finished with value: 0.8596491228070176 and parameters: {'objective': 'Logloss', 'colsample_bylevel': 0.09245450512844451, 'depth': 8, 'boosting_type': 'Plain', 'bootstrap_type': 'Bayesian', 'bagging_temperature': 5.682907284423475}. Best is trial 1464 with value: 0.8990825688073395.
[32m[I 2023-04-21 01:06:54,867][39m Trial 5894 finished with value: 0.8598130841121495 and parameters: {'objective': 'Logloss', 'colsample_bylevel': 0.09258065470563344, 'depth': 8, 'boosting_type': 'Plain', 'bootstrap_type': 'Bayesian', 'bagging_temperature': 5.988138989684076}. Best is trial 1464 with value: 0.8990825688073395.
[32m[I 2023-04-21 01:06:56,118][39m Trial 5895 finished with value: 0.8807339449541284 and parameters: {'objective': 'CrossEntropy', 'colsample_bylevel': 0.09051332150111523, 'depth': 11, 'boosting_type': 'Plain', 'bootstrap_type': 'Bayesian', 'bagging_temperature': 4.8050729800292995}. Best is trial 1464 with value: 0.8990825688073395.
[32m[I 2023-04-21 01:06:57,305][39m Trial 5896 finished with value: 0.8347826086956522 and parameters: {'objective': 'Logloss', 'colsample_bylevel': 0.09549238860055208, 'depth': 6, 'boosting_type': 'Plain', 'bootstrap_type': 'MVS'}. Best is trial 1464 with value: 0.8990825688073395.
[32m[I 2023-04-21 01:06:58,963][39m Trial 5897 finished with value: 0.8571428571428572 and parameters: {'objective': 'CrossEntropy', 'colsample_bylevel': 0.09413293877513397, 'depth': 9, 'boosting_type': 'Plain', 'bootstrap_type': 'Bayesian', 'bagging_temperature': 7.024649993368964}. Best is trial 1464 with value: 0.8990825688073395.
[32m[I 2023-04-21 01:06:59,826][39m Trial 5898 finished with value: 0.875 and parameters: {'objective': 'Logloss', 'colsample_bylevel': 0.09377622493196912, 'depth': 11, 'boosting_type': 'Plain', 'bootstrap_type': 'Bayesian', 'bagging_temperature': 6.577622827560298}. Best is trial 1464 with value: 0.8990825688073395.
[32m[I 2023-04-21 01:07:00,454][39m Trial 5899 finished with value: 0.888888888888889 and parameters: {'objective': 'CrossEntropy', 'colsample_bylevel': 0.09967861301012078, 'depth': 7, 'boosting_type': 'Plain', 'bootstrap_type': 'Bayesian', 'bagging_temperature': 5.41040568133003}. Best is trial 1464 with value: 0.8990825688073395.
[32m[I 2023-04-21 01:07:01,435][39m Trial 5900 finished with value: 0.8727272727272727 and parameters: {'objective': 'Logloss', 'colsample_bylevel': 0.09520611240862828, 'depth': 12, 'boosting_type': 'Plain', 'bootstrap_type': 'Bayesian', 'bagging_temperature': 4.005418672744976}. Best is trial 1464 with value: 0.8990825688073395.
[32m[I 2023-04-21 01:07:02,819][39m Trial 5901 finished with value: 0.8828828828828829 and parameters: {'objective': 'Logloss', 'colsample_bylevel': 0.09466778773049521, 'depth': 9, 'boosting_type': 'Plain', 'bootstrap_type': 'Bayesian', 'bagging_temperature': 6.283447247546872}. Best is trial 1464 with value: 0.8990825688073395.
[32m[I 2023-04-21 01:07:04,467][39m Trial 5902 finished with value: 0.888888888888889 and parameters: {'objective': 'Logloss', 'colsample_bylevel': 0.09363762376470033, 'depth': 9, 'boosting_type': 'Plain', 'bootstrap_type': 'Bayesian', 'bagging_temperature': 7.092150450551744}. Best is trial 1464 with value: 0.8990825688073395.
[32m[I 2023-04-21 01:07:05,552][39m Trial 5903 finished with value: 0.8648648648648648 and parameters: {'objective': 'CrossEntropy', 'colsample_bylevel': 0.08785962924363014, 'depth': 12, 'boosting_type': 'Plain', 'bootstrap_type': 'Bayesian', 'bagging_temperature': 5.385446371477615}. Best is trial 1464 with value: 0.8990825688073395.
[32m[I 2023-04-21 01:07:06,388][39m Trial 5904 finished with value: 0.8807339449541284 and parameters: {'objective': 'Logloss', 'colsample_bylevel': 0.09222962691940345, 'depth': 11, 'boosting_type': 'Plain', 'bootstrap_type': 'Bayesian', 'bagging_temperature': 6.8004600430637225}. Best is trial 1464 with value: 0.8990825688073395.
[32m[I 2023-04-21 01:07:07,713][39m Trial 5905 finished with value: 0.8376068376068375 and parameters: {'objective': 'Logloss', 'colsample_bylevel': 0.06139757587477657, 'depth': 9, 'boosting_type': 'Plain', 'bootstrap_type': 'Bayesian', 'bagging_temperature': 4.462869179802138}. Best is trial 1464 with value: 0.8990825688073395.
[32m[I 2023-04-21 01:07:08,498][39m Trial 5906 finished with value: 0.8727272727272727 and parameters: {'objective': 'Logloss', 'colsample_bylevel': 0.08972084591205212, 'depth': 12, 'boosting_type': 'Plain', 'bootstrap_type': 'Bayesian', 'bagging_temperature': 5.254752187980079}. Best is trial 1464 with value: 0.8990825688073395.
[32m[I 2023-04-21 01:07:09,727][39m Trial 5907 finished with value: 0.8703703703703703 and parameters: {'objective': 'CrossEntropy', 'colsample_bylevel': 0.08412790659524029, 'depth': 11, 'boosting_type': 'Plain', 'bootstrap_type': 'Bayesian', 'bagging_temperature': 4.344201481209809}. Best is trial 1464 with value: 0.8990825688073395.
[32m[I 2023-04-21 01:07:11,471][39m Trial 5908 finished with value: 0.8672566371681416 and parameters: {'objective': 'Logloss', 'colsample_bylevel': 0.08831458857782562, 'depth': 11, 'boosting_type': 'Plain', 'bootstrap_type': 'Bayesian', 'bagging_temperature': 5.614362298703692}. Best is trial 1464 with value: 0.8990825688073395.
[32m[I 2023-04-21 01:07:12,924][39m Trial 5909 finished with value: 0.8703703703703703 and parameters: {'objective': 'Logloss', 'colsample_bylevel': 0.09984668700811952, 'depth': 7, 'boosting_type': 'Plain', 'bootstrap_type': 'Bayesian', 'bagging_temperature': 3.6467207185355264}. Best is trial 1464 with value: 0.8990825688073395.
[32m[I 2023-04-21 01:07:14,336][39m Trial 5910 finished with value: 0.875 and parameters: {'objective': 'CrossEntropy', 'colsample_bylevel': 0.08884822828776386, 'depth': 9, 'boosting_type': 'Plain', 'bootstrap_type': 'Bayesian', 'bagging_temperature': 4.494695092820223}. Best is trial 1464 with value: 0.8990825688073395.
[32m[I 2023-04-21 01:07:15,192][39m Trial 5911 finished with value: 0.8807339449541284 and parameters: {'objective': 'Logloss', 'colsample_bylevel': 0.09797180099934685, 'depth': 8, 'boosting_type': 'Plain', 'bootstrap_type': 'Bayesian', 'bagging_temperature': 5.133782454271803}. Best is trial 1464 with value: 0.8990825688073395.
[32m[I 2023-04-21 01:07:20,154][39m Trial 5912 finished with value: 0.8545454545454546 and parameters: {'objective': 'CrossEntropy', 'colsample_bylevel': 0.08888895493692812, 'depth': 11, 'boosting_type': 'Ordered', 'bootstrap_type': 'Bayesian', 'bagging_temperature': 4.602032127717293}. Best is trial 1464 with value: 0.8990825688073395.
[32m[I 2023-04-21 01:07:22,251][39m Trial 5913 finished with value: 0.8648648648648648 and parameters: {'objective': 'Logloss', 'colsample_bylevel': 0.09387410873359113, 'depth': 9, 'boosting_type': 'Plain', 'bootstrap_type': 'Bayesian', 'bagging_temperature': 6.105914506615125}. Best is trial 1464 with value: 0.8990825688073395.
[32m[I 2023-04-21 01:07:23,291][39m Trial 5914 finished with value: 0.8672566371681416 and parameters: {'objective': 'Logloss', 'colsample_bylevel': 0.09995816487574678, 'depth': 12, 'boosting_type': 'Plain', 'bootstrap_type': 'Bernoulli', 'subsample': 0.9114592054740734}. Best is trial 1464 with value: 0.8990825688073395.
[32m[I 2023-04-21 01:07:24,612][39m Trial 5915 finished with value: 0.8807339449541284 and parameters: {'objective': 'Logloss', 'colsample_bylevel': 0.09110839000334355, 'depth': 10, 'boosting_type': 'Plain', 'bootstrap_type': 'Bayesian', 'bagging_temperature': 5.380114380654883}. Best is trial 1464 with value: 0.8990825688073395.
[32m[I 2023-04-21 01:07:25,973][39m Trial 5916 finished with value: 0.888888888888889 and parameters: {'objective': 'Logloss', 'colsample_bylevel': 0.09635553879744035, 'depth': 12, 'boosting_type': 'Plain', 'bootstrap_type': 'Bayesian', 'bagging_temperature': 3.9943320997623917}. Best is trial 1464 with value: 0.8990825688073395.
[32m[I 2023-04-21 01:07:27,770][39m Trial 5917 finished with value: 0.8521739130434783 and parameters: {'objective': 'CrossEntropy', 'colsample_bylevel': 0.0934499721960415, 'depth': 9, 'boosting_type': 'Plain', 'bootstrap_type': 'MVS'}. Best is trial 1464 with value: 0.8990825688073395.
[32m[I 2023-04-21 01:07:29,144][39m Trial 5918 finished with value: 0.8727272727272727 and parameters: {'objective': 'Logloss', 'colsample_bylevel': 0.09508468045448835, 'depth': 7, 'boosting_type': 'Plain', 'bootstrap_type': 'Bayesian', 'bagging_temperature': 7.62912675282588}. Best is trial 1464 with value: 0.8990825688073395.
