[32m[I 2023-04-21 00:27:12,332][39m Trial 4151 finished with value: 0.8448275862068967 and parameters: {'objective': 'CrossEntropy', 'colsample_bylevel': 0.08925055915891818, 'depth': 1, 'boosting_type': 'Plain', 'bootstrap_type': 'Bayesian', 'bagging_temperature': 5.108783114583219}. Best is trial 1464 with value: 0.8990825688073395.
[32m[I 2023-04-21 00:27:13,177][39m Trial 4152 finished with value: 0.8828828828828829 and parameters: {'objective': 'CrossEntropy', 'colsample_bylevel': 0.09314064439357314, 'depth': 12, 'boosting_type': 'Plain', 'bootstrap_type': 'Bayesian', 'bagging_temperature': 5.641807998234676}. Best is trial 1464 with value: 0.8990825688073395.
[32m[I 2023-04-21 00:27:14,391][39m Trial 4153 finished with value: 0.7457627118644068 and parameters: {'objective': 'CrossEntropy', 'colsample_bylevel': 0.013739743657437284, 'depth': 10, 'boosting_type': 'Plain', 'bootstrap_type': 'Bayesian', 'bagging_temperature': 6.301781084323787}. Best is trial 1464 with value: 0.8990825688073395.
[32m[I 2023-04-21 00:27:15,471][39m Trial 4154 finished with value: 0.7999999999999999 and parameters: {'objective': 'CrossEntropy', 'colsample_bylevel': 0.019216145231794407, 'depth': 7, 'boosting_type': 'Plain', 'bootstrap_type': 'Bayesian', 'bagging_temperature': 6.267914736237756}. Best is trial 1464 with value: 0.8990825688073395.
[32m[I 2023-04-21 00:27:16,450][39m Trial 4155 finished with value: 0.8807339449541284 and parameters: {'objective': 'Logloss', 'colsample_bylevel': 0.09453206392794346, 'depth': 10, 'boosting_type': 'Plain', 'bootstrap_type': 'Bayesian', 'bagging_temperature': 6.509753923497488}. Best is trial 1464 with value: 0.8990825688073395.
[32m[I 2023-04-21 00:27:17,198][39m Trial 4156 finished with value: 0.8807339449541284 and parameters: {'objective': 'CrossEntropy', 'colsample_bylevel': 0.08800041246745717, 'depth': 10, 'boosting_type': 'Plain', 'bootstrap_type': 'Bayesian', 'bagging_temperature': 6.044219487594725}. Best is trial 1464 with value: 0.8990825688073395.
[32m[I 2023-04-21 00:27:17,988][39m Trial 4157 finished with value: 0.8727272727272727 and parameters: {'objective': 'CrossEntropy', 'colsample_bylevel': 0.09991055904515968, 'depth': 7, 'boosting_type': 'Plain', 'bootstrap_type': 'Bayesian', 'bagging_temperature': 5.710328109249947}. Best is trial 1464 with value: 0.8990825688073395.
[32m[I 2023-04-21 00:27:19,051][39m Trial 4158 finished with value: 0.8807339449541284 and parameters: {'objective': 'Logloss', 'colsample_bylevel': 0.09616001624789532, 'depth': 8, 'boosting_type': 'Plain', 'bootstrap_type': 'Bayesian', 'bagging_temperature': 5.836561131268169}. Best is trial 1464 with value: 0.8990825688073395.
[32m[I 2023-04-21 00:27:20,332][39m Trial 4159 finished with value: 0.8807339449541284 and parameters: {'objective': 'Logloss', 'colsample_bylevel': 0.09698313257617305, 'depth': 10, 'boosting_type': 'Plain', 'bootstrap_type': 'Bayesian', 'bagging_temperature': 7.324912519760711}. Best is trial 1464 with value: 0.8990825688073395.
[32m[I 2023-04-21 00:27:21,620][39m Trial 4160 finished with value: 0.888888888888889 and parameters: {'objective': 'Logloss', 'colsample_bylevel': 0.09429845343316019, 'depth': 10, 'boosting_type': 'Plain', 'bootstrap_type': 'Bayesian', 'bagging_temperature': 4.399171318120829}. Best is trial 1464 with value: 0.8990825688073395.
[32m[I 2023-04-21 00:27:22,685][39m Trial 4161 finished with value: 0.8703703703703703 and parameters: {'objective': 'CrossEntropy', 'colsample_bylevel': 0.09862375628259738, 'depth': 8, 'boosting_type': 'Plain', 'bootstrap_type': 'Bayesian', 'bagging_temperature': 6.030576118436512}. Best is trial 1464 with value: 0.8990825688073395.
[32m[I 2023-04-21 00:27:23,724][39m Trial 4162 finished with value: 0.8648648648648648 and parameters: {'objective': 'Logloss', 'colsample_bylevel': 0.09761629682619906, 'depth': 11, 'boosting_type': 'Plain', 'bootstrap_type': 'Bayesian', 'bagging_temperature': 6.056223075245548}. Best is trial 1464 with value: 0.8990825688073395.
[32m[I 2023-04-21 00:27:24,810][39m Trial 4163 finished with value: 0.8648648648648648 and parameters: {'objective': 'Logloss', 'colsample_bylevel': 0.09606742096711587, 'depth': 9, 'boosting_type': 'Plain', 'bootstrap_type': 'Bayesian', 'bagging_temperature': 7.281385661286044}. Best is trial 1464 with value: 0.8990825688073395.
[32m[I 2023-04-21 00:27:29,747][39m Trial 4164 finished with value: 0.8347826086956522 and parameters: {'objective': 'Logloss', 'colsample_bylevel': 0.09355093607704744, 'depth': 9, 'boosting_type': 'Ordered', 'bootstrap_type': 'Bayesian', 'bagging_temperature': 4.8394671006911505}. Best is trial 1464 with value: 0.8990825688073395.
[32m[I 2023-04-21 00:27:31,124][39m Trial 4165 finished with value: 0.8376068376068375 and parameters: {'objective': 'CrossEntropy', 'colsample_bylevel': 0.0369295478745959, 'depth': 7, 'boosting_type': 'Plain', 'bootstrap_type': 'Bayesian', 'bagging_temperature': 3.7514395316077964}. Best is trial 1464 with value: 0.8990825688073395.
[32m[I 2023-04-21 00:27:32,346][39m Trial 4166 finished with value: 0.8727272727272727 and parameters: {'objective': 'Logloss', 'colsample_bylevel': 0.09262607215772072, 'depth': 7, 'boosting_type': 'Plain', 'bootstrap_type': 'Bayesian', 'bagging_temperature': 5.731085566706594}. Best is trial 1464 with value: 0.8990825688073395.
[32m[I 2023-04-21 00:27:33,515][39m Trial 4167 finished with value: 0.8648648648648648 and parameters: {'objective': 'CrossEntropy', 'colsample_bylevel': 0.07925310960777905, 'depth': 10, 'boosting_type': 'Plain', 'bootstrap_type': 'Bernoulli', 'subsample': 0.4261923921011572}. Best is trial 1464 with value: 0.8990825688073395.
[32m[I 2023-04-21 00:27:34,736][39m Trial 4168 finished with value: 0.8807339449541284 and parameters: {'objective': 'CrossEntropy', 'colsample_bylevel': 0.09779017329130497, 'depth': 10, 'boosting_type': 'Plain', 'bootstrap_type': 'Bayesian', 'bagging_temperature': 4.669695457614216}. Best is trial 1464 with value: 0.8990825688073395.
[32m[I 2023-04-21 00:27:35,757][39m Trial 4169 finished with value: 0.8727272727272727 and parameters: {'objective': 'CrossEntropy', 'colsample_bylevel': 0.0882777114477878, 'depth': 10, 'boosting_type': 'Plain', 'bootstrap_type': 'Bayesian', 'bagging_temperature': 5.5179816037520695}. Best is trial 1464 with value: 0.8990825688073395.
[32m[I 2023-04-21 00:27:36,831][39m Trial 4170 finished with value: 0.8495575221238938 and parameters: {'objective': 'Logloss', 'colsample_bylevel': 0.09582802518642011, 'depth': 4, 'boosting_type': 'Plain', 'bootstrap_type': 'Bayesian', 'bagging_temperature': 5.946388135315625}. Best is trial 1464 with value: 0.8990825688073395.
[32m[I 2023-04-21 00:27:37,581][39m Trial 4171 finished with value: 0.8672566371681416 and parameters: {'objective': 'Logloss', 'colsample_bylevel': 0.09789527910008558, 'depth': 11, 'boosting_type': 'Plain', 'bootstrap_type': 'MVS'}. Best is trial 1464 with value: 0.8990825688073395.
[32m[I 2023-04-21 00:27:38,672][39m Trial 4172 finished with value: 0.8571428571428572 and parameters: {'objective': 'Logloss', 'colsample_bylevel': 0.09238671390435507, 'depth': 7, 'boosting_type': 'Plain', 'bootstrap_type': 'Bayesian', 'bagging_temperature': 5.911839440277754}. Best is trial 1464 with value: 0.8990825688073395.
[32m[I 2023-04-21 00:27:39,720][39m Trial 4173 finished with value: 0.8807339449541284 and parameters: {'objective': 'Logloss', 'colsample_bylevel': 0.09251564270668156, 'depth': 10, 'boosting_type': 'Plain', 'bootstrap_type': 'Bayesian', 'bagging_temperature': 5.706394357475354}. Best is trial 1464 with value: 0.8990825688073395.
[32m[I 2023-04-21 00:27:40,819][39m Trial 4174 finished with value: 0.8545454545454546 and parameters: {'objective': 'CrossEntropy', 'colsample_bylevel': 0.09852818806173605, 'depth': 7, 'boosting_type': 'Plain', 'bootstrap_type': 'Bayesian', 'bagging_temperature': 3.1567617049786376}. Best is trial 1464 with value: 0.8990825688073395.
[32m[I 2023-04-21 00:27:41,584][39m Trial 4175 finished with value: 0.8623853211009175 and parameters: {'objective': 'Logloss', 'colsample_bylevel': 0.08978881395925521, 'depth': 11, 'boosting_type': 'Plain', 'bootstrap_type': 'Bayesian', 'bagging_temperature': 5.776202145390998}. Best is trial 1464 with value: 0.8990825688073395.
[32m[I 2023-04-21 00:27:42,307][39m Trial 4176 finished with value: 0.888888888888889 and parameters: {'objective': 'Logloss', 'colsample_bylevel': 0.09725701384289745, 'depth': 10, 'boosting_type': 'Plain', 'bootstrap_type': 'Bayesian', 'bagging_temperature': 4.572536634413263}. Best is trial 1464 with value: 0.8990825688073395.
[32m[I 2023-04-21 00:27:43,918][39m Trial 4177 finished with value: 0.888888888888889 and parameters: {'objective': 'Logloss', 'colsample_bylevel': 0.0923410096522936, 'depth': 9, 'boosting_type': 'Plain', 'bootstrap_type': 'Bayesian', 'bagging_temperature': 5.403971151169833}. Best is trial 1464 with value: 0.8990825688073395.
[32m[I 2023-04-21 00:27:45,044][39m Trial 4178 finished with value: 0.8727272727272727 and parameters: {'objective': 'CrossEntropy', 'colsample_bylevel': 0.09306388849086598, 'depth': 9, 'boosting_type': 'Plain', 'bootstrap_type': 'Bayesian', 'bagging_temperature': 5.467506353351363}. Best is trial 1464 with value: 0.8990825688073395.
[32m[I 2023-04-21 00:27:46,284][39m Trial 4179 finished with value: 0.8727272727272727 and parameters: {'objective': 'Logloss', 'colsample_bylevel': 0.09491533577415148, 'depth': 12, 'boosting_type': 'Plain', 'bootstrap_type': 'Bayesian', 'bagging_temperature': 5.5483261352425055}. Best is trial 1464 with value: 0.8990825688073395.
[32m[I 2023-04-21 00:27:47,422][39m Trial 4180 finished with value: 0.8828828828828829 and parameters: {'objective': 'Logloss', 'colsample_bylevel': 0.09596726249587285, 'depth': 12, 'boosting_type': 'Plain', 'bootstrap_type': 'Bayesian', 'bagging_temperature': 6.49050949895435}. Best is trial 1464 with value: 0.8990825688073395.
[32m[I 2023-04-21 00:27:48,614][39m Trial 4181 finished with value: 0.8648648648648648 and parameters: {'objective': 'CrossEntropy', 'colsample_bylevel': 0.08980935593312103, 'depth': 6, 'boosting_type': 'Plain', 'bootstrap_type': 'Bayesian', 'bagging_temperature': 5.3004530904055125}. Best is trial 1464 with value: 0.8990825688073395.
[32m[I 2023-04-21 00:27:49,840][39m Trial 4182 finished with value: 0.8648648648648648 and parameters: {'objective': 'CrossEntropy', 'colsample_bylevel': 0.0889354303137693, 'depth': 10, 'boosting_type': 'Plain', 'bootstrap_type': 'Bayesian', 'bagging_temperature': 6.140039093756755}. Best is trial 1464 with value: 0.8990825688073395.
[32m[I 2023-04-21 00:27:54,857][39m Trial 4183 finished with value: 0.8421052631578947 and parameters: {'objective': 'Logloss', 'colsample_bylevel': 0.09524066272192012, 'depth': 9, 'boosting_type': 'Ordered', 'bootstrap_type': 'Bayesian', 'bagging_temperature': 3.9284919331436625}. Best is trial 1464 with value: 0.8990825688073395.
[32m[I 2023-04-21 00:27:55,886][39m Trial 4184 finished with value: 0.8807339449541284 and parameters: {'objective': 'Logloss', 'colsample_bylevel': 0.09680616364926871, 'depth': 11, 'boosting_type': 'Plain', 'bootstrap_type': 'Bayesian', 'bagging_temperature': 6.660042147816375}. Best is trial 1464 with value: 0.8990825688073395.
[32m[I 2023-04-21 00:27:56,896][39m Trial 4185 finished with value: 0.875 and parameters: {'objective': 'Logloss', 'colsample_bylevel': 0.0895018261649146, 'depth': 11, 'boosting_type': 'Plain', 'bootstrap_type': 'Bayesian', 'bagging_temperature': 5.365723219259583}. Best is trial 1464 with value: 0.8990825688073395.
[32m[I 2023-04-21 00:27:58,754][39m Trial 4186 finished with value: 0.8828828828828829 and parameters: {'objective': 'Logloss', 'colsample_bylevel': 0.09265241860346433, 'depth': 9, 'boosting_type': 'Plain', 'bootstrap_type': 'Bayesian', 'bagging_temperature': 5.778337219375827}. Best is trial 1464 with value: 0.8990825688073395.
[32m[I 2023-04-21 00:27:59,503][39m Trial 4187 finished with value: 0.875 and parameters: {'objective': 'Logloss', 'colsample_bylevel': 0.09224032181572965, 'depth': 11, 'boosting_type': 'Plain', 'bootstrap_type': 'Bayesian', 'bagging_temperature': 5.52009283185297}. Best is trial 1464 with value: 0.8990825688073395.
[32m[I 2023-04-21 00:28:00,707][39m Trial 4188 finished with value: 0.8571428571428572 and parameters: {'objective': 'Logloss', 'colsample_bylevel': 0.09989453558980987, 'depth': 6, 'boosting_type': 'Plain', 'bootstrap_type': 'Bernoulli', 'subsample': 0.9082486693967999}. Best is trial 1464 with value: 0.8990825688073395.
[32m[I 2023-04-21 00:28:02,092][39m Trial 4189 finished with value: 0.8727272727272727 and parameters: {'objective': 'Logloss', 'colsample_bylevel': 0.09365283381567324, 'depth': 8, 'boosting_type': 'Plain', 'bootstrap_type': 'Bayesian', 'bagging_temperature': 6.357792347310875}. Best is trial 1464 with value: 0.8990825688073395.
[32m[I 2023-04-21 00:28:04,053][39m Trial 4190 finished with value: 0.8727272727272727 and parameters: {'objective': 'Logloss', 'colsample_bylevel': 0.09464670075604292, 'depth': 9, 'boosting_type': 'Plain', 'bootstrap_type': 'Bayesian', 'bagging_temperature': 6.603615201685065}. Best is trial 1464 with value: 0.8990825688073395.
[32m[I 2023-04-21 00:28:05,072][39m Trial 4191 finished with value: 0.8545454545454546 and parameters: {'objective': 'Logloss', 'colsample_bylevel': 0.09728341315671923, 'depth': 7, 'boosting_type': 'Plain', 'bootstrap_type': 'Bayesian', 'bagging_temperature': 5.638242746828427}. Best is trial 1464 with value: 0.8990825688073395.
[32m[I 2023-04-21 00:28:05,650][39m Trial 4192 finished with value: 0.8571428571428572 and parameters: {'objective': 'Logloss', 'colsample_bylevel': 0.09849334983097224, 'depth': 7, 'boosting_type': 'Plain', 'bootstrap_type': 'MVS'}. Best is trial 1464 with value: 0.8990825688073395.
[32m[I 2023-04-21 00:28:06,757][39m Trial 4193 finished with value: 0.8727272727272727 and parameters: {'objective': 'Logloss', 'colsample_bylevel': 0.09993482633752572, 'depth': 8, 'boosting_type': 'Plain', 'bootstrap_type': 'Bayesian', 'bagging_temperature': 5.976509308794481}. Best is trial 1464 with value: 0.8990825688073395.
[32m[I 2023-04-21 00:28:07,849][39m Trial 4194 finished with value: 0.875 and parameters: {'objective': 'Logloss', 'colsample_bylevel': 0.09693760936107966, 'depth': 9, 'boosting_type': 'Plain', 'bootstrap_type': 'Bayesian', 'bagging_temperature': 7.119022747729428}. Best is trial 1464 with value: 0.8990825688073395.
[32m[I 2023-04-21 00:28:08,818][39m Trial 4195 finished with value: 0.8347826086956522 and parameters: {'objective': 'Logloss', 'colsample_bylevel': 0.04934563575426984, 'depth': 7, 'boosting_type': 'Plain', 'bootstrap_type': 'Bayesian', 'bagging_temperature': 5.178715452032852}. Best is trial 1464 with value: 0.8990825688073395.
[32m[I 2023-04-21 00:28:09,977][39m Trial 4196 finished with value: 0.888888888888889 and parameters: {'objective': 'CrossEntropy', 'colsample_bylevel': 0.09045753983528663, 'depth': 11, 'boosting_type': 'Plain', 'bootstrap_type': 'Bayesian', 'bagging_temperature': 6.3374539322274455}. Best is trial 1464 with value: 0.8990825688073395.
[32m[I 2023-04-21 00:28:10,962][39m Trial 4197 finished with value: 0.888888888888889 and parameters: {'objective': 'CrossEntropy', 'colsample_bylevel': 0.0963395924862695, 'depth': 10, 'boosting_type': 'Plain', 'bootstrap_type': 'Bayesian', 'bagging_temperature': 6.307933109065556}. Best is trial 1464 with value: 0.8990825688073395.
[32m[I 2023-04-21 00:28:12,126][39m Trial 4198 finished with value: 0.8807339449541284 and parameters: {'objective': 'CrossEntropy', 'colsample_bylevel': 0.09799350205164967, 'depth': 10, 'boosting_type': 'Plain', 'bootstrap_type': 'Bayesian', 'bagging_temperature': 6.768510785220687}. Best is trial 1464 with value: 0.8990825688073395.
[32m[I 2023-04-21 00:28:12,852][39m Trial 4199 finished with value: 0.888888888888889 and parameters: {'objective': 'Logloss', 'colsample_bylevel': 0.09401863816303802, 'depth': 10, 'boosting_type': 'Plain', 'bootstrap_type': 'Bayesian', 'bagging_temperature': 5.8400921171087266}. Best is trial 1464 with value: 0.8990825688073395.
[32m[I 2023-04-21 00:28:13,575][39m Trial 4200 finished with value: 0.8623853211009175 and parameters: {'objective': 'Logloss', 'colsample_bylevel': 0.09215150417724859, 'depth': 12, 'boosting_type': 'Plain', 'bootstrap_type': 'Bayesian', 'bagging_temperature': 5.657996104090111}. Best is trial 1464 with value: 0.8990825688073395.
[32m[I 2023-04-21 00:28:14,731][39m Trial 4201 finished with value: 0.8807339449541284 and parameters: {'objective': 'CrossEntropy', 'colsample_bylevel': 0.09119764389958304, 'depth': 6, 'boosting_type': 'Plain', 'bootstrap_type': 'Bayesian', 'bagging_temperature': 5.6146535407005995}. Best is trial 1464 with value: 0.8990825688073395.
[32m[I 2023-04-21 00:28:20,387][39m Trial 4202 finished with value: 0.8392857142857144 and parameters: {'objective': 'CrossEntropy', 'colsample_bylevel': 0.08350592847434667, 'depth': 12, 'boosting_type': 'Ordered', 'bootstrap_type': 'Bayesian', 'bagging_temperature': 5.16245792931759}. Best is trial 1464 with value: 0.8990825688073395.
[32m[I 2023-04-21 00:28:21,459][39m Trial 4203 finished with value: 0.8648648648648648 and parameters: {'objective': 'Logloss', 'colsample_bylevel': 0.0961693565716344, 'depth': 10, 'boosting_type': 'Plain', 'bootstrap_type': 'Bayesian', 'bagging_temperature': 6.136279181105117}. Best is trial 1464 with value: 0.8990825688073395.
[32m[I 2023-04-21 00:28:22,703][39m Trial 4204 finished with value: 0.8727272727272727 and parameters: {'objective': 'Logloss', 'colsample_bylevel': 0.0999603884533686, 'depth': 11, 'boosting_type': 'Plain', 'bootstrap_type': 'Bayesian', 'bagging_temperature': 6.487814635896994}. Best is trial 1464 with value: 0.8990825688073395.
[32m[I 2023-04-21 00:28:23,519][39m Trial 4205 finished with value: 0.8807339449541284 and parameters: {'objective': 'CrossEntropy', 'colsample_bylevel': 0.09730842419530543, 'depth': 7, 'boosting_type': 'Plain', 'bootstrap_type': 'Bayesian', 'bagging_temperature': 6.132659771269894}. Best is trial 1464 with value: 0.8990825688073395.
[32m[I 2023-04-21 00:28:24,824][39m Trial 4206 finished with value: 0.8598130841121495 and parameters: {'objective': 'CrossEntropy', 'colsample_bylevel': 0.0882592687986528, 'depth': 10, 'boosting_type': 'Plain', 'bootstrap_type': 'Bayesian', 'bagging_temperature': 6.556722082868806}. Best is trial 1464 with value: 0.8990825688073395.
[32m[I 2023-04-21 00:28:25,866][39m Trial 4207 finished with value: 0.8648648648648648 and parameters: {'objective': 'Logloss', 'colsample_bylevel': 0.09694437531876973, 'depth': 6, 'boosting_type': 'Plain', 'bootstrap_type': 'Bayesian', 'bagging_temperature': 5.898021419798068}. Best is trial 1464 with value: 0.8990825688073395.
[32m[I 2023-04-21 00:28:26,830][39m Trial 4208 finished with value: 0.8807339449541284 and parameters: {'objective': 'Logloss', 'colsample_bylevel': 0.09043676411362155, 'depth': 11, 'boosting_type': 'Plain', 'bootstrap_type': 'Bayesian', 'bagging_temperature': 5.992318438338201}. Best is trial 1464 with value: 0.8990825688073395.
[32m[I 2023-04-21 00:28:27,464][39m Trial 4209 finished with value: 0.8727272727272727 and parameters: {'objective': 'CrossEntropy', 'colsample_bylevel': 0.09092539299028846, 'depth': 10, 'boosting_type': 'Plain', 'bootstrap_type': 'Bayesian', 'bagging_temperature': 5.927372711132349}. Best is trial 1464 with value: 0.8990825688073395.
[32m[I 2023-04-21 00:28:28,368][39m Trial 4210 finished with value: 0.8623853211009175 and parameters: {'objective': 'CrossEntropy', 'colsample_bylevel': 0.09134377290356147, 'depth': 7, 'boosting_type': 'Plain', 'bootstrap_type': 'Bayesian', 'bagging_temperature': 3.295125847263443}. Best is trial 1464 with value: 0.8990825688073395.
[32m[I 2023-04-21 00:28:29,789][39m Trial 4211 finished with value: 0.8571428571428572 and parameters: {'objective': 'Logloss', 'colsample_bylevel': 0.09986893482735074, 'depth': 8, 'boosting_type': 'Plain', 'bootstrap_type': 'Bayesian', 'bagging_temperature': 0.184142665221378}. Best is trial 1464 with value: 0.8990825688073395.
[32m[I 2023-04-21 00:28:30,631][39m Trial 4212 finished with value: 0.8495575221238938 and parameters: {'objective': 'CrossEntropy', 'colsample_bylevel': 0.08712154833150593, 'depth': 10, 'boosting_type': 'Plain', 'bootstrap_type': 'Bernoulli', 'subsample': 0.6952784868230962}. Best is trial 1464 with value: 0.8990825688073395.
[32m[I 2023-04-21 00:28:31,155][39m Trial 4213 finished with value: 0.8545454545454546 and parameters: {'objective': 'CrossEntropy', 'colsample_bylevel': 0.09868341540059189, 'depth': 7, 'boosting_type': 'Plain', 'bootstrap_type': 'Bayesian', 'bagging_temperature': 5.86418390415723}. Best is trial 1464 with value: 0.8990825688073395.
[32m[I 2023-04-21 00:28:32,233][39m Trial 4214 finished with value: 0.8571428571428572 and parameters: {'objective': 'Logloss', 'colsample_bylevel': 0.09864812513345653, 'depth': 8, 'boosting_type': 'Plain', 'bootstrap_type': 'MVS'}. Best is trial 1464 with value: 0.8990825688073395.
[32m[I 2023-04-21 00:28:33,660][39m Trial 4215 finished with value: 0.8807339449541284 and parameters: {'objective': 'CrossEntropy', 'colsample_bylevel': 0.09857780329710081, 'depth': 10, 'boosting_type': 'Plain', 'bootstrap_type': 'Bayesian', 'bagging_temperature': 6.054577382202611}. Best is trial 1464 with value: 0.8990825688073395.
