[32m[I 2023-04-20 23:06:58,932][39m Trial 465 finished with value: 0.8807339449541284 and parameters: {'objective': 'Logloss', 'colsample_bylevel': 0.0936077799880529, 'depth': 8, 'boosting_type': 'Plain', 'bootstrap_type': 'Bayesian', 'bagging_temperature': 4.569550883648011}. Best is trial 205 with value: 0.890909090909091.
[32m[I 2023-04-20 23:06:59,988][39m Trial 466 finished with value: 0.8807339449541284 and parameters: {'objective': 'Logloss', 'colsample_bylevel': 0.09483709407041159, 'depth': 8, 'boosting_type': 'Plain', 'bootstrap_type': 'Bayesian', 'bagging_temperature': 5.422843212809079}. Best is trial 205 with value: 0.890909090909091.
[32m[I 2023-04-20 23:07:01,148][39m Trial 467 finished with value: 0.8807339449541284 and parameters: {'objective': 'Logloss', 'colsample_bylevel': 0.09421909528108739, 'depth': 8, 'boosting_type': 'Plain', 'bootstrap_type': 'Bayesian', 'bagging_temperature': 5.985644860365609}. Best is trial 205 with value: 0.890909090909091.
[32m[I 2023-04-20 23:07:02,080][39m Trial 468 finished with value: 0.888888888888889 and parameters: {'objective': 'Logloss', 'colsample_bylevel': 0.09159235280517192, 'depth': 8, 'boosting_type': 'Plain', 'bootstrap_type': 'Bayesian', 'bagging_temperature': 5.262932311814236}. Best is trial 205 with value: 0.890909090909091.
[32m[I 2023-04-20 23:07:03,183][39m Trial 469 finished with value: 0.888888888888889 and parameters: {'objective': 'Logloss', 'colsample_bylevel': 0.09996132907814088, 'depth': 8, 'boosting_type': 'Plain', 'bootstrap_type': 'Bayesian', 'bagging_temperature': 4.017459923083901}. Best is trial 205 with value: 0.890909090909091.
[32m[I 2023-04-20 23:07:04,071][39m Trial 470 finished with value: 0.8703703703703703 and parameters: {'objective': 'Logloss', 'colsample_bylevel': 0.09998818624030281, 'depth': 7, 'boosting_type': 'Plain', 'bootstrap_type': 'Bayesian', 'bagging_temperature': 5.088381415546538}. Best is trial 205 with value: 0.890909090909091.
[32m[I 2023-04-20 23:07:05,583][39m Trial 471 finished with value: 0.8727272727272727 and parameters: {'objective': 'Logloss', 'colsample_bylevel': 0.09519087918564059, 'depth': 8, 'boosting_type': 'Plain', 'bootstrap_type': 'Bayesian', 'bagging_temperature': 6.362491563941363}. Best is trial 205 with value: 0.890909090909091.
[32m[I 2023-04-20 23:07:06,428][39m Trial 472 finished with value: 0.8571428571428572 and parameters: {'objective': 'Logloss', 'colsample_bylevel': 0.09602299324459738, 'depth': 8, 'boosting_type': 'Plain', 'bootstrap_type': 'Bayesian', 'bagging_temperature': 5.575428778027159}. Best is trial 205 with value: 0.890909090909091.
[32m[I 2023-04-20 23:07:07,542][39m Trial 473 finished with value: 0.8727272727272727 and parameters: {'objective': 'Logloss', 'colsample_bylevel': 0.09684917820557551, 'depth': 8, 'boosting_type': 'Plain', 'bootstrap_type': 'Bayesian', 'bagging_temperature': 5.2431448327426455}. Best is trial 205 with value: 0.890909090909091.
[32m[I 2023-04-20 23:07:08,267][39m Trial 474 finished with value: 0.7796610169491527 and parameters: {'objective': 'Logloss', 'colsample_bylevel': 0.011126281277009362, 'depth': 8, 'boosting_type': 'Plain', 'bootstrap_type': 'Bayesian', 'bagging_temperature': 3.984714685431927}. Best is trial 205 with value: 0.890909090909091.
[32m[I 2023-04-20 23:07:09,159][39m Trial 475 finished with value: 0.875 and parameters: {'objective': 'Logloss', 'colsample_bylevel': 0.09033369932629756, 'depth': 8, 'boosting_type': 'Plain', 'bootstrap_type': 'Bayesian', 'bagging_temperature': 5.2951930367810975}. Best is trial 205 with value: 0.890909090909091.
[32m[I 2023-04-20 23:07:10,434][39m Trial 476 finished with value: 0.8545454545454546 and parameters: {'objective': 'Logloss', 'colsample_bylevel': 0.09561577293782107, 'depth': 8, 'boosting_type': 'Plain', 'bootstrap_type': 'Bayesian', 'bagging_temperature': 5.419947221407144}. Best is trial 205 with value: 0.890909090909091.
[32m[I 2023-04-20 23:07:11,290][39m Trial 477 finished with value: 0.8571428571428572 and parameters: {'objective': 'Logloss', 'colsample_bylevel': 0.09212426132390769, 'depth': 5, 'boosting_type': 'Plain', 'bootstrap_type': 'MVS'}. Best is trial 205 with value: 0.890909090909091.
[32m[I 2023-04-20 23:07:16,412][39m Trial 478 finished with value: 0.8347826086956522 and parameters: {'objective': 'Logloss', 'colsample_bylevel': 0.09831801249102787, 'depth': 8, 'boosting_type': 'Ordered', 'bootstrap_type': 'Bayesian', 'bagging_temperature': 4.087180904619525}. Best is trial 205 with value: 0.890909090909091.
[32m[I 2023-04-20 23:07:17,578][39m Trial 479 finished with value: 0.8623853211009175 and parameters: {'objective': 'Logloss', 'colsample_bylevel': 0.09231759528360908, 'depth': 7, 'boosting_type': 'Plain', 'bootstrap_type': 'Bayesian', 'bagging_temperature': 4.262005796008148}. Best is trial 205 with value: 0.890909090909091.
[32m[I 2023-04-20 23:07:19,112][39m Trial 480 finished with value: 0.888888888888889 and parameters: {'objective': 'Logloss', 'colsample_bylevel': 0.09414011998311375, 'depth': 8, 'boosting_type': 'Plain', 'bootstrap_type': 'Bayesian', 'bagging_temperature': 3.834388005017753}. Best is trial 205 with value: 0.890909090909091.
[32m[I 2023-04-20 23:07:19,623][39m Trial 481 finished with value: 0.8067226890756303 and parameters: {'objective': 'Logloss', 'colsample_bylevel': 0.01451898282180808, 'depth': 6, 'boosting_type': 'Plain', 'bootstrap_type': 'Bayesian', 'bagging_temperature': 3.789013075468324}. Best is trial 205 with value: 0.890909090909091.
[32m[I 2023-04-20 23:07:20,761][39m Trial 482 finished with value: 0.8807339449541284 and parameters: {'objective': 'Logloss', 'colsample_bylevel': 0.0970234707845152, 'depth': 8, 'boosting_type': 'Plain', 'bootstrap_type': 'Bayesian', 'bagging_temperature': 3.671268230750486}. Best is trial 205 with value: 0.890909090909091.
[32m[I 2023-04-20 23:07:21,525][39m Trial 483 finished with value: 0.875 and parameters: {'objective': 'Logloss', 'colsample_bylevel': 0.08868230555801024, 'depth': 8, 'boosting_type': 'Plain', 'bootstrap_type': 'Bayesian', 'bagging_temperature': 3.883377340184286}. Best is trial 205 with value: 0.890909090909091.
[32m[I 2023-04-20 23:07:22,398][39m Trial 484 finished with value: 0.8727272727272727 and parameters: {'objective': 'CrossEntropy', 'colsample_bylevel': 0.09361744349437012, 'depth': 7, 'boosting_type': 'Plain', 'bootstrap_type': 'Bayesian', 'bagging_temperature': 4.257923706099076}. Best is trial 205 with value: 0.890909090909091.
[32m[I 2023-04-20 23:07:24,097][39m Trial 485 finished with value: 0.8807339449541284 and parameters: {'objective': 'Logloss', 'colsample_bylevel': 0.09414471132970006, 'depth': 8, 'boosting_type': 'Plain', 'bootstrap_type': 'Bayesian', 'bagging_temperature': 3.817076934411462}. Best is trial 205 with value: 0.890909090909091.
[32m[I 2023-04-20 23:07:24,915][39m Trial 486 finished with value: 0.8703703703703703 and parameters: {'objective': 'Logloss', 'colsample_bylevel': 0.08899126378884821, 'depth': 8, 'boosting_type': 'Plain', 'bootstrap_type': 'Bayesian', 'bagging_temperature': 4.372759981794592}. Best is trial 205 with value: 0.890909090909091.
[32m[I 2023-04-20 23:07:26,270][39m Trial 487 finished with value: 0.8672566371681416 and parameters: {'objective': 'Logloss', 'colsample_bylevel': 0.09443111787394834, 'depth': 8, 'boosting_type': 'Plain', 'bootstrap_type': 'Bernoulli', 'subsample': 0.43710852942654504}. Best is trial 205 with value: 0.890909090909091.
[32m[I 2023-04-20 23:07:27,148][39m Trial 488 finished with value: 0.8807339449541284 and parameters: {'objective': 'Logloss', 'colsample_bylevel': 0.09636130188479027, 'depth': 8, 'boosting_type': 'Plain', 'bootstrap_type': 'Bayesian', 'bagging_temperature': 4.0495533422265595}. Best is trial 205 with value: 0.890909090909091.
[32m[I 2023-04-20 23:07:27,884][39m Trial 489 finished with value: 0.8727272727272727 and parameters: {'objective': 'Logloss', 'colsample_bylevel': 0.09858684651894158, 'depth': 7, 'boosting_type': 'Plain', 'bootstrap_type': 'Bayesian', 'bagging_temperature': 4.859426464766063}. Best is trial 205 with value: 0.890909090909091.
[32m[I 2023-04-20 23:07:29,265][39m Trial 490 finished with value: 0.8807339449541284 and parameters: {'objective': 'Logloss', 'colsample_bylevel': 0.09778413537130944, 'depth': 8, 'boosting_type': 'Plain', 'bootstrap_type': 'Bayesian', 'bagging_temperature': 4.059755308942033}. Best is trial 205 with value: 0.890909090909091.
[32m[I 2023-04-20 23:07:30,282][39m Trial 491 finished with value: 0.8807339449541284 and parameters: {'objective': 'Logloss', 'colsample_bylevel': 0.09854415073136973, 'depth': 8, 'boosting_type': 'Plain', 'bootstrap_type': 'Bayesian', 'bagging_temperature': 3.7893914228522747}. Best is trial 205 with value: 0.890909090909091.
[32m[I 2023-04-20 23:07:30,947][39m Trial 492 finished with value: 0.8807339449541284 and parameters: {'objective': 'Logloss', 'colsample_bylevel': 0.0957328383975701, 'depth': 8, 'boosting_type': 'Plain', 'bootstrap_type': 'Bayesian', 'bagging_temperature': 3.4983103468860843}. Best is trial 205 with value: 0.890909090909091.
[32m[I 2023-04-20 23:07:32,010][39m Trial 493 finished with value: 0.8495575221238938 and parameters: {'objective': 'Logloss', 'colsample_bylevel': 0.0791316668327059, 'depth': 8, 'boosting_type': 'Plain', 'bootstrap_type': 'Bayesian', 'bagging_temperature': 1.5998679086129457}. Best is trial 205 with value: 0.890909090909091.
[32m[I 2023-04-20 23:07:33,034][39m Trial 494 finished with value: 0.8807339449541284 and parameters: {'objective': 'Logloss', 'colsample_bylevel': 0.09164088827916919, 'depth': 8, 'boosting_type': 'Plain', 'bootstrap_type': 'Bayesian', 'bagging_temperature': 6.789006989961566}. Best is trial 205 with value: 0.890909090909091.
[32m[I 2023-04-20 23:07:33,919][39m Trial 495 finished with value: 0.8571428571428572 and parameters: {'objective': 'Logloss', 'colsample_bylevel': 0.09032255770135475, 'depth': 8, 'boosting_type': 'Plain', 'bootstrap_type': 'Bayesian', 'bagging_temperature': 0.6272007419091281}. Best is trial 205 with value: 0.890909090909091.
[32m[I 2023-04-20 23:07:35,036][39m Trial 496 finished with value: 0.8807339449541284 and parameters: {'objective': 'Logloss', 'colsample_bylevel': 0.09331316767387718, 'depth': 8, 'boosting_type': 'Plain', 'bootstrap_type': 'Bayesian', 'bagging_temperature': 5.157938928344646}. Best is trial 205 with value: 0.890909090909091.
[32m[I 2023-04-20 23:07:35,769][39m Trial 497 finished with value: 0.8623853211009175 and parameters: {'objective': 'Logloss', 'colsample_bylevel': 0.09923410361865352, 'depth': 5, 'boosting_type': 'Plain', 'bootstrap_type': 'Bayesian', 'bagging_temperature': 4.380668262718248}. Best is trial 205 with value: 0.890909090909091.
[32m[I 2023-04-20 23:07:37,010][39m Trial 498 finished with value: 0.875 and parameters: {'objective': 'Logloss', 'colsample_bylevel': 0.0923871580484105, 'depth': 8, 'boosting_type': 'Plain', 'bootstrap_type': 'Bayesian', 'bagging_temperature': 4.167818298157865}. Best is trial 205 with value: 0.890909090909091.
[32m[I 2023-04-20 23:07:38,653][39m Trial 499 finished with value: 0.8807339449541284 and parameters: {'objective': 'Logloss', 'colsample_bylevel': 0.09618863599368596, 'depth': 8, 'boosting_type': 'Plain', 'bootstrap_type': 'Bayesian', 'bagging_temperature': 5.320551203552943}. Best is trial 205 with value: 0.890909090909091.
[32m[I 2023-04-20 23:07:43,457][39m Trial 500 finished with value: 0.8421052631578947 and parameters: {'objective': 'Logloss', 'colsample_bylevel': 0.09874653954459749, 'depth': 8, 'boosting_type': 'Ordered', 'bootstrap_type': 'MVS'}. Best is trial 205 with value: 0.890909090909091.
[32m[I 2023-04-20 23:07:44,227][39m Trial 501 finished with value: 0.8785046728971961 and parameters: {'objective': 'CrossEntropy', 'colsample_bylevel': 0.09733613795889083, 'depth': 7, 'boosting_type': 'Plain', 'bootstrap_type': 'Bayesian', 'bagging_temperature': 4.615716321603314}. Best is trial 205 with value: 0.890909090909091.
[32m[I 2023-04-20 23:07:45,020][39m Trial 502 finished with value: 0.8495575221238938 and parameters: {'objective': 'Logloss', 'colsample_bylevel': 0.09720595160591548, 'depth': 7, 'boosting_type': 'Plain', 'bootstrap_type': 'Bayesian', 'bagging_temperature': 3.394635355266488}. Best is trial 205 with value: 0.890909090909091.
[32m[I 2023-04-20 23:07:46,666][39m Trial 503 finished with value: 0.8807339449541284 and parameters: {'objective': 'Logloss', 'colsample_bylevel': 0.09449928089127785, 'depth': 9, 'boosting_type': 'Plain', 'bootstrap_type': 'Bayesian', 'bagging_temperature': 3.915653137043228}. Best is trial 205 with value: 0.890909090909091.
[32m[I 2023-04-20 23:07:47,465][39m Trial 504 finished with value: 0.8703703703703703 and parameters: {'objective': 'Logloss', 'colsample_bylevel': 0.09977777340128513, 'depth': 7, 'boosting_type': 'Plain', 'bootstrap_type': 'Bayesian', 'bagging_temperature': 4.350285245159299}. Best is trial 205 with value: 0.890909090909091.
[32m[I 2023-04-20 23:07:48,092][39m Trial 505 finished with value: 0.8571428571428572 and parameters: {'objective': 'Logloss', 'colsample_bylevel': 0.09850771852565052, 'depth': 6, 'boosting_type': 'Plain', 'bootstrap_type': 'Bayesian', 'bagging_temperature': 4.460926340214423}. Best is trial 205 with value: 0.890909090909091.
[32m[I 2023-04-20 23:07:49,163][39m Trial 506 finished with value: 0.8648648648648648 and parameters: {'objective': 'Logloss', 'colsample_bylevel': 0.09287303602310444, 'depth': 10, 'boosting_type': 'Plain', 'bootstrap_type': 'Bayesian', 'bagging_temperature': 4.697140541517312}. Best is trial 205 with value: 0.890909090909091.
[32m[I 2023-04-20 23:07:50,171][39m Trial 507 finished with value: 0.8828828828828829 and parameters: {'objective': 'Logloss', 'colsample_bylevel': 0.09561849238806647, 'depth': 8, 'boosting_type': 'Plain', 'bootstrap_type': 'Bayesian', 'bagging_temperature': 6.981390427424038}. Best is trial 205 with value: 0.890909090909091.
[32m[I 2023-04-20 23:07:51,070][39m Trial 508 finished with value: 0.8495575221238938 and parameters: {'objective': 'Logloss', 'colsample_bylevel': 0.09663554116690835, 'depth': 7, 'boosting_type': 'Plain', 'bootstrap_type': 'Bernoulli', 'subsample': 0.6479425641590988}. Best is trial 205 with value: 0.890909090909091.
[32m[I 2023-04-20 23:07:52,347][39m Trial 509 finished with value: 0.8521739130434783 and parameters: {'objective': 'Logloss', 'colsample_bylevel': 0.03947270930070495, 'depth': 8, 'boosting_type': 'Plain', 'bootstrap_type': 'Bayesian', 'bagging_temperature': 7.515513996599374}. Best is trial 205 with value: 0.890909090909091.
[32m[I 2023-04-20 23:07:53,355][39m Trial 510 finished with value: 0.8727272727272727 and parameters: {'objective': 'Logloss', 'colsample_bylevel': 0.09707273718864802, 'depth': 9, 'boosting_type': 'Plain', 'bootstrap_type': 'Bayesian', 'bagging_temperature': 3.979996770038152}. Best is trial 205 with value: 0.890909090909091.
[32m[I 2023-04-20 23:07:54,142][39m Trial 511 finished with value: 0.8727272727272727 and parameters: {'objective': 'Logloss', 'colsample_bylevel': 0.0909734705059918, 'depth': 8, 'boosting_type': 'Plain', 'bootstrap_type': 'Bayesian', 'bagging_temperature': 5.539654667052372}. Best is trial 205 with value: 0.890909090909091.
[32m[I 2023-04-20 23:07:55,042][39m Trial 512 finished with value: 0.8448275862068967 and parameters: {'objective': 'Logloss', 'colsample_bylevel': 0.09501445181428538, 'depth': 3, 'boosting_type': 'Plain', 'bootstrap_type': 'Bayesian', 'bagging_temperature': 7.166094885503437}. Best is trial 205 with value: 0.890909090909091.
[32m[I 2023-04-20 23:07:55,991][39m Trial 513 finished with value: 0.8648648648648648 and parameters: {'objective': 'Logloss', 'colsample_bylevel': 0.09982348705714218, 'depth': 6, 'boosting_type': 'Plain', 'bootstrap_type': 'Bayesian', 'bagging_temperature': 4.273684246203636}. Best is trial 205 with value: 0.890909090909091.
[32m[I 2023-04-20 23:07:56,914][39m Trial 514 finished with value: 0.8807339449541284 and parameters: {'objective': 'Logloss', 'colsample_bylevel': 0.09327334567874881, 'depth': 10, 'boosting_type': 'Plain', 'bootstrap_type': 'Bayesian', 'bagging_temperature': 3.5744009066996516}. Best is trial 205 with value: 0.890909090909091.
[32m[I 2023-04-20 23:07:57,806][39m Trial 515 finished with value: 0.875 and parameters: {'objective': 'Logloss', 'colsample_bylevel': 0.09195509074324848, 'depth': 8, 'boosting_type': 'Plain', 'bootstrap_type': 'Bayesian', 'bagging_temperature': 5.733560574266822}. Best is trial 205 with value: 0.890909090909091.
[32m[I 2023-04-20 23:07:59,354][39m Trial 516 finished with value: 0.8727272727272727 and parameters: {'objective': 'Logloss', 'colsample_bylevel': 0.09496571341285115, 'depth': 8, 'boosting_type': 'Plain', 'bootstrap_type': 'Bayesian', 'bagging_temperature': 6.97581033911222}. Best is trial 205 with value: 0.890909090909091.
[32m[I 2023-04-20 23:08:00,299][39m Trial 517 finished with value: 0.8807339449541284 and parameters: {'objective': 'Logloss', 'colsample_bylevel': 0.09757692426298875, 'depth': 7, 'boosting_type': 'Plain', 'bootstrap_type': 'Bayesian', 'bagging_temperature': 3.934107457616909}. Best is trial 205 with value: 0.890909090909091.
[32m[I 2023-04-20 23:08:06,207][39m Trial 518 finished with value: 0.8648648648648648 and parameters: {'objective': 'Logloss', 'colsample_bylevel': 0.09852567280737104, 'depth': 6, 'boosting_type': 'Ordered', 'bootstrap_type': 'Bayesian', 'bagging_temperature': 4.142310533370855}. Best is trial 205 with value: 0.890909090909091.
[32m[I 2023-04-20 23:08:07,358][39m Trial 519 finished with value: 0.8727272727272727 and parameters: {'objective': 'Logloss', 'colsample_bylevel': 0.09677733174265489, 'depth': 9, 'boosting_type': 'Plain', 'bootstrap_type': 'Bayesian', 'bagging_temperature': 3.889076157127917}. Best is trial 205 with value: 0.890909090909091.
[32m[I 2023-04-20 23:08:07,887][39m Trial 520 finished with value: 0.8648648648648648 and parameters: {'objective': 'CrossEntropy', 'colsample_bylevel': 0.09491847875282473, 'depth': 8, 'boosting_type': 'Plain', 'bootstrap_type': 'Bayesian', 'bagging_temperature': 5.100765351155059}. Best is trial 205 with value: 0.890909090909091.
[32m[I 2023-04-20 23:08:09,157][39m Trial 521 finished with value: 0.8448275862068967 and parameters: {'objective': 'Logloss', 'colsample_bylevel': 0.07734299609063494, 'depth': 8, 'boosting_type': 'Plain', 'bootstrap_type': 'Bayesian', 'bagging_temperature': 4.944206660028542}. Best is trial 205 with value: 0.890909090909091.
[32m[I 2023-04-20 23:08:09,869][39m Trial 522 finished with value: 0.8571428571428572 and parameters: {'objective': 'Logloss', 'colsample_bylevel': 0.09586200093166965, 'depth': 8, 'boosting_type': 'Plain', 'bootstrap_type': 'MVS'}. Best is trial 205 with value: 0.890909090909091.
[32m[I 2023-04-20 23:08:10,896][39m Trial 523 finished with value: 0.8727272727272727 and parameters: {'objective': 'Logloss', 'colsample_bylevel': 0.09047307015807374, 'depth': 10, 'boosting_type': 'Plain', 'bootstrap_type': 'Bayesian', 'bagging_temperature': 4.61964520370041}. Best is trial 205 with value: 0.890909090909091.
[32m[I 2023-04-20 23:08:12,345][39m Trial 524 finished with value: 0.8727272727272727 and parameters: {'objective': 'Logloss', 'colsample_bylevel': 0.09379957888671382, 'depth': 8, 'boosting_type': 'Plain', 'bootstrap_type': 'Bayesian', 'bagging_temperature': 5.408341481952866}. Best is trial 205 with value: 0.890909090909091.
[32m[I 2023-04-20 23:08:13,988][39m Trial 525 finished with value: 0.8727272727272727 and parameters: {'objective': 'Logloss', 'colsample_bylevel': 0.09640653037178479, 'depth': 8, 'boosting_type': 'Plain', 'bootstrap_type': 'Bayesian', 'bagging_temperature': 3.278972661680787}. Best is trial 205 with value: 0.890909090909091.
[32m[I 2023-04-20 23:08:14,732][39m Trial 526 finished with value: 0.8703703703703703 and parameters: {'objective': 'Logloss', 'colsample_bylevel': 0.09459792153491163, 'depth': 8, 'boosting_type': 'Plain', 'bootstrap_type': 'Bayesian', 'bagging_temperature': 6.557216537992545}. Best is trial 205 with value: 0.890909090909091.
[32m[I 2023-04-20 23:08:15,267][39m Trial 527 finished with value: 0.8305084745762712 and parameters: {'objective': 'Logloss', 'colsample_bylevel': 0.021096861524124023, 'depth': 7, 'boosting_type': 'Plain', 'bootstrap_type': 'Bayesian', 'bagging_temperature': 2.5284207103441383}. Best is trial 205 with value: 0.890909090909091.
[32m[I 2023-04-20 23:08:15,901][39m Trial 528 finished with value: 0.8785046728971961 and parameters: {'objective': 'Logloss', 'colsample_bylevel': 0.09995864344545217, 'depth': 8, 'boosting_type': 'Plain', 'bootstrap_type': 'Bayesian', 'bagging_temperature': 7.809215984052283}. Best is trial 205 with value: 0.890909090909091.
[32m[I 2023-04-20 23:08:17,120][39m Trial 529 finished with value: 0.8807339449541284 and parameters: {'objective': 'Logloss', 'colsample_bylevel': 0.09275388277771804, 'depth': 8, 'boosting_type': 'Plain', 'bootstrap_type': 'Bayesian', 'bagging_temperature': 3.783072892750919}. Best is trial 205 with value: 0.890909090909091.
[32m[I 2023-04-20 23:08:18,130][39m Trial 530 finished with value: 0.8672566371681416 and parameters: {'objective': 'Logloss', 'colsample_bylevel': 0.09998947788547223, 'depth': 7, 'boosting_type': 'Plain', 'bootstrap_type': 'Bernoulli', 'subsample': 0.19101081796002733}. Best is trial 205 with value: 0.890909090909091.
[32m[I 2023-04-20 23:08:19,601][39m Trial 531 finished with value: 0.8703703703703703 and parameters: {'objective': 'Logloss', 'colsample_bylevel': 0.09748038578847837, 'depth': 8, 'boosting_type': 'Plain', 'bootstrap_type': 'Bayesian', 'bagging_temperature': 6.216974706435626}. Best is trial 205 with value: 0.890909090909091.
