[32m[I 2023-04-21 00:35:59,261][39m Trial 4543 finished with value: 0.8807339449541284 and parameters: {'objective': 'CrossEntropy', 'colsample_bylevel': 0.08750364781337716, 'depth': 12, 'boosting_type': 'Plain', 'bootstrap_type': 'Bayesian', 'bagging_temperature': 5.247920875873397}. Best is trial 1464 with value: 0.8990825688073395.
[32m[I 2023-04-21 00:36:00,254][39m Trial 4544 finished with value: 0.8623853211009175 and parameters: {'objective': 'CrossEntropy', 'colsample_bylevel': 0.09156296755948276, 'depth': 12, 'boosting_type': 'Plain', 'bootstrap_type': 'Bayesian', 'bagging_temperature': 5.892305420266039}. Best is trial 1464 with value: 0.8990825688073395.
[32m[I 2023-04-21 00:36:01,475][39m Trial 4545 finished with value: 0.8495575221238938 and parameters: {'objective': 'Logloss', 'colsample_bylevel': 0.08488289579522451, 'depth': 12, 'boosting_type': 'Plain', 'bootstrap_type': 'MVS'}. Best is trial 1464 with value: 0.8990825688073395.
[32m[I 2023-04-21 00:36:03,127][39m Trial 4546 finished with value: 0.888888888888889 and parameters: {'objective': 'Logloss', 'colsample_bylevel': 0.0927186632931121, 'depth': 11, 'boosting_type': 'Plain', 'bootstrap_type': 'Bayesian', 'bagging_temperature': 3.952296583738137}. Best is trial 1464 with value: 0.8990825688073395.
[32m[I 2023-04-21 00:36:04,053][39m Trial 4547 finished with value: 0.8648648648648648 and parameters: {'objective': 'Logloss', 'colsample_bylevel': 0.08899764809811692, 'depth': 12, 'boosting_type': 'Plain', 'bootstrap_type': 'Bayesian', 'bagging_temperature': 5.421946962693367}. Best is trial 1464 with value: 0.8990825688073395.
[32m[I 2023-04-21 00:36:04,777][39m Trial 4548 finished with value: 0.8623853211009175 and parameters: {'objective': 'Logloss', 'colsample_bylevel': 0.08809988556978009, 'depth': 12, 'boosting_type': 'Plain', 'bootstrap_type': 'Bayesian', 'bagging_temperature': 5.890501217337614}. Best is trial 1464 with value: 0.8990825688073395.
[32m[I 2023-04-21 00:36:05,736][39m Trial 4549 finished with value: 0.8807339449541284 and parameters: {'objective': 'Logloss', 'colsample_bylevel': 0.09136570482616439, 'depth': 11, 'boosting_type': 'Plain', 'bootstrap_type': 'Bayesian', 'bagging_temperature': 5.39638667535744}. Best is trial 1464 with value: 0.8990825688073395.
[32m[I 2023-04-21 00:36:06,651][39m Trial 4550 finished with value: 0.8448275862068967 and parameters: {'objective': 'CrossEntropy', 'colsample_bylevel': 0.08392630271862679, 'depth': 10, 'boosting_type': 'Plain', 'bootstrap_type': 'Bayesian', 'bagging_temperature': 5.722429799374623}. Best is trial 1464 with value: 0.8990825688073395.
[32m[I 2023-04-21 00:36:07,762][39m Trial 4551 finished with value: 0.8727272727272727 and parameters: {'objective': 'CrossEntropy', 'colsample_bylevel': 0.09513901968255115, 'depth': 12, 'boosting_type': 'Plain', 'bootstrap_type': 'Bayesian', 'bagging_temperature': 6.310881030766803}. Best is trial 1464 with value: 0.8990825688073395.
[32m[I 2023-04-21 00:36:09,048][39m Trial 4552 finished with value: 0.8807339449541284 and parameters: {'objective': 'Logloss', 'colsample_bylevel': 0.09320173639503619, 'depth': 11, 'boosting_type': 'Plain', 'bootstrap_type': 'Bayesian', 'bagging_temperature': 5.255843671676309}. Best is trial 1464 with value: 0.8990825688073395.
[32m[I 2023-04-21 00:36:11,077][39m Trial 4554 finished with value: 0.8807339449541284 and parameters: {'objective': 'Logloss', 'colsample_bylevel': 0.09926204621146108, 'depth': 12, 'boosting_type': 'Plain', 'bootstrap_type': 'Bayesian', 'bagging_temperature': 5.8292696059257265}. Best is trial 1464 with value: 0.8990825688073395.
[32m[I 2023-04-21 00:36:12,281][39m Trial 4555 finished with value: 0.8807339449541284 and parameters: {'objective': 'Logloss', 'colsample_bylevel': 0.08740834493322051, 'depth': 12, 'boosting_type': 'Plain', 'bootstrap_type': 'Bayesian', 'bagging_temperature': 5.1009967196397055}. Best is trial 1464 with value: 0.8990825688073395.
[32m[I 2023-04-21 00:36:13,095][39m Trial 4556 finished with value: 0.8828828828828829 and parameters: {'objective': 'Logloss', 'colsample_bylevel': 0.08781279560918118, 'depth': 12, 'boosting_type': 'Plain', 'bootstrap_type': 'Bayesian', 'bagging_temperature': 5.182362553508514}. Best is trial 1464 with value: 0.8990825688073395.
[32m[I 2023-04-21 00:36:14,338][39m Trial 4557 finished with value: 0.8785046728971961 and parameters: {'objective': 'Logloss', 'colsample_bylevel': 0.09988221898942655, 'depth': 12, 'boosting_type': 'Plain', 'bootstrap_type': 'Bayesian', 'bagging_temperature': 5.735105344245041}. Best is trial 1464 with value: 0.8990825688073395.
[32m[I 2023-04-21 00:36:15,194][39m Trial 4558 finished with value: 0.8347826086956522 and parameters: {'objective': 'CrossEntropy', 'colsample_bylevel': 0.05083892654008321, 'depth': 12, 'boosting_type': 'Plain', 'bootstrap_type': 'Bayesian', 'bagging_temperature': 6.182812459868299}. Best is trial 1464 with value: 0.8990825688073395.
[32m[I 2023-04-21 00:36:16,409][39m Trial 4559 finished with value: 0.8727272727272727 and parameters: {'objective': 'Logloss', 'colsample_bylevel': 0.08610447916729494, 'depth': 12, 'boosting_type': 'Plain', 'bootstrap_type': 'Bayesian', 'bagging_temperature': 5.724046680148501}. Best is trial 1464 with value: 0.8990825688073395.
[32m[I 2023-04-21 00:36:21,985][39m Trial 4560 finished with value: 0.8495575221238938 and parameters: {'objective': 'Logloss', 'colsample_bylevel': 0.08983373184926431, 'depth': 11, 'boosting_type': 'Ordered', 'bootstrap_type': 'Bayesian', 'bagging_temperature': 5.242958717554897}. Best is trial 1464 with value: 0.8990825688073395.
[32m[I 2023-04-21 00:36:23,031][39m Trial 4561 finished with value: 0.8672566371681416 and parameters: {'objective': 'Logloss', 'colsample_bylevel': 0.08507168369900107, 'depth': 12, 'boosting_type': 'Plain', 'bootstrap_type': 'Bayesian', 'bagging_temperature': 5.1275485489066055}. Best is trial 1464 with value: 0.8990825688073395.
[32m[I 2023-04-21 00:36:24,221][39m Trial 4562 finished with value: 0.8727272727272727 and parameters: {'objective': 'Logloss', 'colsample_bylevel': 0.08537019789273509, 'depth': 12, 'boosting_type': 'Plain', 'bootstrap_type': 'Bayesian', 'bagging_temperature': 5.521455513056119}. Best is trial 1464 with value: 0.8990825688073395.
[32m[I 2023-04-21 00:36:24,813][39m Trial 4563 finished with value: 0.8421052631578947 and parameters: {'objective': 'CrossEntropy', 'colsample_bylevel': 0.08868115735376421, 'depth': 12, 'boosting_type': 'Plain', 'bootstrap_type': 'Bernoulli', 'subsample': 0.5562748442299698}. Best is trial 1464 with value: 0.8990825688073395.
[32m[I 2023-04-21 00:36:26,330][39m Trial 4564 finished with value: 0.8727272727272727 and parameters: {'objective': 'CrossEntropy', 'colsample_bylevel': 0.08961854353009138, 'depth': 12, 'boosting_type': 'Plain', 'bootstrap_type': 'Bayesian', 'bagging_temperature': 4.940378120754569}. Best is trial 1464 with value: 0.8990825688073395.
[32m[I 2023-04-21 00:36:27,155][39m Trial 4565 finished with value: 0.8727272727272727 and parameters: {'objective': 'Logloss', 'colsample_bylevel': 0.0900945277265308, 'depth': 12, 'boosting_type': 'Plain', 'bootstrap_type': 'Bayesian', 'bagging_temperature': 6.645413332899692}. Best is trial 1464 with value: 0.8990825688073395.
[32m[I 2023-04-21 00:36:28,397][39m Trial 4566 finished with value: 0.8727272727272727 and parameters: {'objective': 'Logloss', 'colsample_bylevel': 0.08958790579931336, 'depth': 12, 'boosting_type': 'Plain', 'bootstrap_type': 'Bayesian', 'bagging_temperature': 5.340921649878401}. Best is trial 1464 with value: 0.8990825688073395.
[32m[I 2023-04-21 00:36:29,380][39m Trial 4567 finished with value: 0.8495575221238938 and parameters: {'objective': 'Logloss', 'colsample_bylevel': 0.09995602602378571, 'depth': 6, 'boosting_type': 'Plain', 'bootstrap_type': 'MVS'}. Best is trial 1464 with value: 0.8990825688073395.
[32m[I 2023-04-21 00:36:31,310][39m Trial 4568 finished with value: 0.8623853211009175 and parameters: {'objective': 'Logloss', 'colsample_bylevel': 0.08978960510576871, 'depth': 9, 'boosting_type': 'Plain', 'bootstrap_type': 'Bayesian', 'bagging_temperature': 5.0811484966462075}. Best is trial 1464 with value: 0.8990825688073395.
[32m[I 2023-04-21 00:36:32,056][39m Trial 4569 finished with value: 0.8828828828828829 and parameters: {'objective': 'Logloss', 'colsample_bylevel': 0.09705470317479047, 'depth': 12, 'boosting_type': 'Plain', 'bootstrap_type': 'Bayesian', 'bagging_temperature': 5.6565093471831185}. Best is trial 1464 with value: 0.8990825688073395.
[32m[I 2023-04-21 00:36:32,881][39m Trial 4570 finished with value: 0.8828828828828829 and parameters: {'objective': 'Logloss', 'colsample_bylevel': 0.09435158327290835, 'depth': 12, 'boosting_type': 'Plain', 'bootstrap_type': 'Bayesian', 'bagging_temperature': 6.076242864865148}. Best is trial 1464 with value: 0.8990825688073395.
[32m[I 2023-04-21 00:36:33,795][39m Trial 4571 finished with value: 0.8727272727272727 and parameters: {'objective': 'CrossEntropy', 'colsample_bylevel': 0.09532143584331709, 'depth': 7, 'boosting_type': 'Plain', 'bootstrap_type': 'Bayesian', 'bagging_temperature': 6.18558442684089}. Best is trial 1464 with value: 0.8990825688073395.
[32m[I 2023-04-21 00:36:35,112][39m Trial 4572 finished with value: 0.8727272727272727 and parameters: {'objective': 'Logloss', 'colsample_bylevel': 0.09702349040801829, 'depth': 7, 'boosting_type': 'Plain', 'bootstrap_type': 'Bayesian', 'bagging_temperature': 6.730663391095855}. Best is trial 1464 with value: 0.8990825688073395.
[32m[I 2023-04-21 00:36:36,333][39m Trial 4573 finished with value: 0.8648648648648648 and parameters: {'objective': 'Logloss', 'colsample_bylevel': 0.08313108296325337, 'depth': 12, 'boosting_type': 'Plain', 'bootstrap_type': 'Bayesian', 'bagging_temperature': 4.582403150659294}. Best is trial 1464 with value: 0.8990825688073395.
[32m[I 2023-04-21 00:36:37,363][39m Trial 4574 finished with value: 0.8727272727272727 and parameters: {'objective': 'Logloss', 'colsample_bylevel': 0.09405594732961246, 'depth': 12, 'boosting_type': 'Plain', 'bootstrap_type': 'Bayesian', 'bagging_temperature': 5.819385987531916}. Best is trial 1464 with value: 0.8990825688073395.
[32m[I 2023-04-21 00:36:38,685][39m Trial 4575 finished with value: 0.8807339449541284 and parameters: {'objective': 'CrossEntropy', 'colsample_bylevel': 0.09242639345928787, 'depth': 9, 'boosting_type': 'Plain', 'bootstrap_type': 'Bayesian', 'bagging_temperature': 5.5936014468870106}. Best is trial 1464 with value: 0.8990825688073395.
[32m[I 2023-04-21 00:36:39,365][39m Trial 4576 finished with value: 0.890909090909091 and parameters: {'objective': 'CrossEntropy', 'colsample_bylevel': 0.09123278451914023, 'depth': 11, 'boosting_type': 'Plain', 'bootstrap_type': 'Bayesian', 'bagging_temperature': 4.3594939147044585}. Best is trial 1464 with value: 0.8990825688073395.
[32m[I 2023-04-21 00:36:40,451][39m Trial 4577 finished with value: 0.8807339449541284 and parameters: {'objective': 'CrossEntropy', 'colsample_bylevel': 0.0868787793099184, 'depth': 12, 'boosting_type': 'Plain', 'bootstrap_type': 'Bayesian', 'bagging_temperature': 4.8169966387970655}. Best is trial 1464 with value: 0.8990825688073395.
[32m[I 2023-04-21 00:36:45,654][39m Trial 4578 finished with value: 0.8421052631578947 and parameters: {'objective': 'CrossEntropy', 'colsample_bylevel': 0.09100786302810909, 'depth': 11, 'boosting_type': 'Ordered', 'bootstrap_type': 'Bayesian', 'bagging_temperature': 3.2698005434851876}. Best is trial 1464 with value: 0.8990825688073395.
[32m[I 2023-04-21 00:36:46,994][39m Trial 4579 finished with value: 0.8703703703703703 and parameters: {'objective': 'Logloss', 'colsample_bylevel': 0.08903588268549736, 'depth': 12, 'boosting_type': 'Plain', 'bootstrap_type': 'Bayesian', 'bagging_temperature': 5.326770248235378}. Best is trial 1464 with value: 0.8990825688073395.
[32m[I 2023-04-21 00:36:47,980][39m Trial 4580 finished with value: 0.8807339449541284 and parameters: {'objective': 'Logloss', 'colsample_bylevel': 0.09180100271557974, 'depth': 12, 'boosting_type': 'Plain', 'bootstrap_type': 'Bayesian', 'bagging_temperature': 6.2945799190496725}. Best is trial 1464 with value: 0.8990825688073395.
[32m[I 2023-04-21 00:36:48,882][39m Trial 4581 finished with value: 0.8828828828828829 and parameters: {'objective': 'Logloss', 'colsample_bylevel': 0.09971290644139556, 'depth': 7, 'boosting_type': 'Plain', 'bootstrap_type': 'Bayesian', 'bagging_temperature': 7.379624763652929}. Best is trial 1464 with value: 0.8990825688073395.
[32m[I 2023-04-21 00:36:50,165][39m Trial 4582 finished with value: 0.8807339449541284 and parameters: {'objective': 'Logloss', 'colsample_bylevel': 0.08349293479591338, 'depth': 11, 'boosting_type': 'Plain', 'bootstrap_type': 'Bayesian', 'bagging_temperature': 2.986322400198361}. Best is trial 1464 with value: 0.8990825688073395.
[32m[I 2023-04-21 00:36:51,209][39m Trial 4583 finished with value: 0.8421052631578947 and parameters: {'objective': 'Logloss', 'colsample_bylevel': 0.08818061197141014, 'depth': 12, 'boosting_type': 'Plain', 'bootstrap_type': 'Bernoulli', 'subsample': 0.5157264308158073}. Best is trial 1464 with value: 0.8990825688073395.
[32m[I 2023-04-21 00:36:52,744][39m Trial 4584 finished with value: 0.8727272727272727 and parameters: {'objective': 'CrossEntropy', 'colsample_bylevel': 0.09442207240591696, 'depth': 12, 'boosting_type': 'Plain', 'bootstrap_type': 'Bayesian', 'bagging_temperature': 7.79720253433722}. Best is trial 1464 with value: 0.8990825688073395.
[32m[I 2023-04-21 00:36:53,557][39m Trial 4585 finished with value: 0.8727272727272727 and parameters: {'objective': 'CrossEntropy', 'colsample_bylevel': 0.08335425147044, 'depth': 12, 'boosting_type': 'Plain', 'bootstrap_type': 'Bayesian', 'bagging_temperature': 5.6213952367676185}. Best is trial 1464 with value: 0.8990825688073395.
[32m[I 2023-04-21 00:36:54,786][39m Trial 4586 finished with value: 0.8807339449541284 and parameters: {'objective': 'CrossEntropy', 'colsample_bylevel': 0.08426314521939746, 'depth': 12, 'boosting_type': 'Plain', 'bootstrap_type': 'Bayesian', 'bagging_temperature': 5.855554728095912}. Best is trial 1464 with value: 0.8990825688073395.
[32m[I 2023-04-21 00:36:56,010][39m Trial 4587 finished with value: 0.8807339449541284 and parameters: {'objective': 'Logloss', 'colsample_bylevel': 0.0909046508042604, 'depth': 12, 'boosting_type': 'Plain', 'bootstrap_type': 'Bayesian', 'bagging_temperature': 5.5829433283079215}. Best is trial 1464 with value: 0.8990825688073395.
[32m[I 2023-04-21 00:36:56,790][39m Trial 4588 finished with value: 0.8545454545454546 and parameters: {'objective': 'Logloss', 'colsample_bylevel': 0.09595392410109334, 'depth': 11, 'boosting_type': 'Plain', 'bootstrap_type': 'MVS'}. Best is trial 1464 with value: 0.8990825688073395.
[32m[I 2023-04-21 00:36:58,082][39m Trial 4589 finished with value: 0.8807339449541284 and parameters: {'objective': 'Logloss', 'colsample_bylevel': 0.08854591933742567, 'depth': 12, 'boosting_type': 'Plain', 'bootstrap_type': 'Bayesian', 'bagging_temperature': 5.956638803092731}. Best is trial 1464 with value: 0.8990825688073395.
[32m[I 2023-04-21 00:36:58,969][39m Trial 4590 finished with value: 0.8727272727272727 and parameters: {'objective': 'Logloss', 'colsample_bylevel': 0.0875925628375888, 'depth': 12, 'boosting_type': 'Plain', 'bootstrap_type': 'Bayesian', 'bagging_temperature': 5.048495280095748}. Best is trial 1464 with value: 0.8990825688073395.
[32m[I 2023-04-21 00:37:00,176][39m Trial 4591 finished with value: 0.823529411764706 and parameters: {'objective': 'Logloss', 'colsample_bylevel': 0.02479312000400502, 'depth': 12, 'boosting_type': 'Plain', 'bootstrap_type': 'Bayesian', 'bagging_temperature': 3.817008855866522}. Best is trial 1464 with value: 0.8990825688073395.
[32m[I 2023-04-21 00:37:01,490][39m Trial 4592 finished with value: 0.8807339449541284 and parameters: {'objective': 'CrossEntropy', 'colsample_bylevel': 0.08744491878056486, 'depth': 12, 'boosting_type': 'Plain', 'bootstrap_type': 'Bayesian', 'bagging_temperature': 4.518900184550901}. Best is trial 1464 with value: 0.8990825688073395.
[32m[I 2023-04-21 00:37:02,396][39m Trial 4593 finished with value: 0.8571428571428572 and parameters: {'objective': 'Logloss', 'colsample_bylevel': 0.08142651863005294, 'depth': 12, 'boosting_type': 'Plain', 'bootstrap_type': 'Bayesian', 'bagging_temperature': 4.885053638225666}. Best is trial 1464 with value: 0.8990825688073395.
[32m[I 2023-04-21 00:37:03,519][39m Trial 4594 finished with value: 0.8703703703703703 and parameters: {'objective': 'Logloss', 'colsample_bylevel': 0.0914679871007361, 'depth': 12, 'boosting_type': 'Plain', 'bootstrap_type': 'Bayesian', 'bagging_temperature': 4.8057094374397495}. Best is trial 1464 with value: 0.8990825688073395.
[32m[I 2023-04-21 00:37:04,787][39m Trial 4595 finished with value: 0.875 and parameters: {'objective': 'Logloss', 'colsample_bylevel': 0.08605837700498253, 'depth': 12, 'boosting_type': 'Plain', 'bootstrap_type': 'Bayesian', 'bagging_temperature': 5.645389736568309}. Best is trial 1464 with value: 0.8990825688073395.
[32m[I 2023-04-21 00:37:11,601][39m Trial 4596 finished with value: 0.8571428571428572 and parameters: {'objective': 'Logloss', 'colsample_bylevel': 0.09644719681510175, 'depth': 6, 'boosting_type': 'Ordered', 'bootstrap_type': 'Bayesian', 'bagging_temperature': 3.76935679701026}. Best is trial 1464 with value: 0.8990825688073395.
[32m[I 2023-04-21 00:37:12,758][39m Trial 4597 finished with value: 0.8703703703703703 and parameters: {'objective': 'CrossEntropy', 'colsample_bylevel': 0.09112111701169792, 'depth': 10, 'boosting_type': 'Plain', 'bootstrap_type': 'Bayesian', 'bagging_temperature': 6.439583164137645}. Best is trial 1464 with value: 0.8990825688073395.
[32m[I 2023-04-21 00:37:14,359][39m Trial 4598 finished with value: 0.8703703703703703 and parameters: {'objective': 'Logloss', 'colsample_bylevel': 0.0870376519899284, 'depth': 9, 'boosting_type': 'Plain', 'bootstrap_type': 'Bayesian', 'bagging_temperature': 5.120423655698109}. Best is trial 1464 with value: 0.8990825688073395.
[32m[I 2023-04-21 00:37:15,626][39m Trial 4599 finished with value: 0.8727272727272727 and parameters: {'objective': 'Logloss', 'colsample_bylevel': 0.08729955214634644, 'depth': 9, 'boosting_type': 'Plain', 'bootstrap_type': 'Bayesian', 'bagging_temperature': 5.107388750907868}. Best is trial 1464 with value: 0.8990825688073395.
[32m[I 2023-04-21 00:37:16,355][39m Trial 4600 finished with value: 0.8807339449541284 and parameters: {'objective': 'Logloss', 'colsample_bylevel': 0.09373915972532235, 'depth': 12, 'boosting_type': 'Plain', 'bootstrap_type': 'Bayesian', 'bagging_temperature': 5.953117383563432}. Best is trial 1464 with value: 0.8990825688073395.
[32m[I 2023-04-21 00:37:17,246][39m Trial 4601 finished with value: 0.8807339449541284 and parameters: {'objective': 'CrossEntropy', 'colsample_bylevel': 0.08475209009391772, 'depth': 12, 'boosting_type': 'Plain', 'bootstrap_type': 'Bayesian', 'bagging_temperature': 5.300803330161901}. Best is trial 1464 with value: 0.8990825688073395.
[32m[I 2023-04-21 00:37:18,003][39m Trial 4602 finished with value: 0.8727272727272727 and parameters: {'objective': 'CrossEntropy', 'colsample_bylevel': 0.0881421532586448, 'depth': 12, 'boosting_type': 'Plain', 'bootstrap_type': 'Bayesian', 'bagging_temperature': 5.384585731855053}. Best is trial 1464 with value: 0.8990825688073395.
[32m[I 2023-04-21 00:37:18,981][39m Trial 4603 finished with value: 0.8623853211009175 and parameters: {'objective': 'Logloss', 'colsample_bylevel': 0.09376054551676577, 'depth': 7, 'boosting_type': 'Plain', 'bootstrap_type': 'Bayesian', 'bagging_temperature': 3.7989806709144625}. Best is trial 1464 with value: 0.8990825688073395.
[32m[I 2023-04-21 00:37:20,028][39m Trial 4604 finished with value: 0.8623853211009175 and parameters: {'objective': 'Logloss', 'colsample_bylevel': 0.09483105646024911, 'depth': 7, 'boosting_type': 'Plain', 'bootstrap_type': 'Bayesian', 'bagging_temperature': 5.662472593901575}. Best is trial 1464 with value: 0.8990825688073395.
[32m[I 2023-04-21 00:37:22,044][39m Trial 4605 finished with value: 0.8703703703703703 and parameters: {'objective': 'Logloss', 'colsample_bylevel': 0.09081415344338341, 'depth': 8, 'boosting_type': 'Plain', 'bootstrap_type': 'Bayesian', 'bagging_temperature': 6.221006069579335}. Best is trial 1464 with value: 0.8990825688073395.
[32m[I 2023-04-21 00:37:23,723][39m Trial 4606 finished with value: 0.8672566371681416 and parameters: {'objective': 'Logloss', 'colsample_bylevel': 0.09199074349976769, 'depth': 9, 'boosting_type': 'Plain', 'bootstrap_type': 'MVS'}. Best is trial 1464 with value: 0.8990825688073395.
[32m[I 2023-04-21 00:37:24,464][39m Trial 4607 finished with value: 0.8571428571428572 and parameters: {'objective': 'Logloss', 'colsample_bylevel': 0.09023749271229761, 'depth': 12, 'boosting_type': 'Plain', 'bootstrap_type': 'Bernoulli', 'subsample': 0.4549294044855974}. Best is trial 1464 with value: 0.8990825688073395.
[32m[I 2023-04-21 00:37:25,364][39m Trial 4608 finished with value: 0.8727272727272727 and parameters: {'objective': 'CrossEntropy', 'colsample_bylevel': 0.08833045215256798, 'depth': 11, 'boosting_type': 'Plain', 'bootstrap_type': 'Bayesian', 'bagging_temperature': 6.132425419308932}. Best is trial 1464 with value: 0.8990825688073395.
[32m[I 2023-04-21 00:37:26,604][39m Trial 4609 finished with value: 0.875 and parameters: {'objective': 'CrossEntropy', 'colsample_bylevel': 0.08547592519249012, 'depth': 11, 'boosting_type': 'Plain', 'bootstrap_type': 'Bayesian', 'bagging_temperature': 5.308980067435739}. Best is trial 1464 with value: 0.8990825688073395.
