[32m[I 2023-04-20 23:54:14,889][39m Trial 2701 finished with value: 0.8623853211009175 and parameters: {'objective': 'Logloss', 'colsample_bylevel': 0.08740443704113515, 'depth': 10, 'boosting_type': 'Plain', 'bootstrap_type': 'Bayesian', 'bagging_temperature': 5.64531575042825}. Best is trial 1464 with value: 0.8990825688073395.
[32m[I 2023-04-20 23:54:16,347][39m Trial 2702 finished with value: 0.8807339449541284 and parameters: {'objective': 'Logloss', 'colsample_bylevel': 0.09216863668972203, 'depth': 8, 'boosting_type': 'Plain', 'bootstrap_type': 'Bayesian', 'bagging_temperature': 3.1799486981632947}. Best is trial 1464 with value: 0.8990825688073395.
[32m[I 2023-04-20 23:54:17,766][39m Trial 2703 finished with value: 0.875 and parameters: {'objective': 'Logloss', 'colsample_bylevel': 0.09718251873677192, 'depth': 8, 'boosting_type': 'Plain', 'bootstrap_type': 'Bayesian', 'bagging_temperature': 5.232597090943349}. Best is trial 1464 with value: 0.8990825688073395.
[32m[I 2023-04-20 23:54:18,527][39m Trial 2704 finished with value: 0.888888888888889 and parameters: {'objective': 'CrossEntropy', 'colsample_bylevel': 0.09665457050941494, 'depth': 9, 'boosting_type': 'Plain', 'bootstrap_type': 'Bayesian', 'bagging_temperature': 4.822254636815275}. Best is trial 1464 with value: 0.8990825688073395.
[32m[I 2023-04-20 23:54:19,514][39m Trial 2705 finished with value: 0.8727272727272727 and parameters: {'objective': 'Logloss', 'colsample_bylevel': 0.09876199285651475, 'depth': 8, 'boosting_type': 'Plain', 'bootstrap_type': 'Bayesian', 'bagging_temperature': 2.9767280258448716}. Best is trial 1464 with value: 0.8990825688073395.
[32m[I 2023-04-20 23:54:20,566][39m Trial 2706 finished with value: 0.888888888888889 and parameters: {'objective': 'Logloss', 'colsample_bylevel': 0.09821174692211238, 'depth': 7, 'boosting_type': 'Plain', 'bootstrap_type': 'Bayesian', 'bagging_temperature': 5.329809230578209}. Best is trial 1464 with value: 0.8990825688073395.
[32m[I 2023-04-20 23:54:21,321][39m Trial 2707 finished with value: 0.8727272727272727 and parameters: {'objective': 'CrossEntropy', 'colsample_bylevel': 0.09476359112131487, 'depth': 10, 'boosting_type': 'Plain', 'bootstrap_type': 'Bayesian', 'bagging_temperature': 5.01593209583909}. Best is trial 1464 with value: 0.8990825688073395.
[32m[I 2023-04-20 23:54:22,371][39m Trial 2708 finished with value: 0.8623853211009175 and parameters: {'objective': 'Logloss', 'colsample_bylevel': 0.09611036038586822, 'depth': 9, 'boosting_type': 'Plain', 'bootstrap_type': 'Bayesian', 'bagging_temperature': 6.606558906310848}. Best is trial 1464 with value: 0.8990825688073395.
[32m[I 2023-04-20 23:54:23,063][39m Trial 2709 finished with value: 0.8421052631578947 and parameters: {'objective': 'CrossEntropy', 'colsample_bylevel': 0.09048211490266533, 'depth': 10, 'boosting_type': 'Plain', 'bootstrap_type': 'MVS'}. Best is trial 1464 with value: 0.8990825688073395.
[32m[I 2023-04-20 23:54:24,374][39m Trial 2710 finished with value: 0.888888888888889 and parameters: {'objective': 'Logloss', 'colsample_bylevel': 0.09353044597156986, 'depth': 10, 'boosting_type': 'Plain', 'bootstrap_type': 'Bayesian', 'bagging_temperature': 4.542153236361262}. Best is trial 1464 with value: 0.8990825688073395.
[32m[I 2023-04-20 23:54:25,516][39m Trial 2711 finished with value: 0.8807339449541284 and parameters: {'objective': 'CrossEntropy', 'colsample_bylevel': 0.09628983261548202, 'depth': 11, 'boosting_type': 'Plain', 'bootstrap_type': 'Bayesian', 'bagging_temperature': 4.771161702789358}. Best is trial 1464 with value: 0.8990825688073395.
[32m[I 2023-04-20 23:54:26,989][39m Trial 2712 finished with value: 0.888888888888889 and parameters: {'objective': 'Logloss', 'colsample_bylevel': 0.09376875059063897, 'depth': 10, 'boosting_type': 'Plain', 'bootstrap_type': 'Bayesian', 'bagging_temperature': 9.651004367045568}. Best is trial 1464 with value: 0.8990825688073395.
[32m[I 2023-04-20 23:54:28,202][39m Trial 2713 finished with value: 0.8727272727272727 and parameters: {'objective': 'Logloss', 'colsample_bylevel': 0.09816859137471412, 'depth': 8, 'boosting_type': 'Plain', 'bootstrap_type': 'Bayesian', 'bagging_temperature': 6.638909848514859}. Best is trial 1464 with value: 0.8990825688073395.
[32m[I 2023-04-20 23:54:29,007][39m Trial 2714 finished with value: 0.8807339449541284 and parameters: {'objective': 'CrossEntropy', 'colsample_bylevel': 0.09566938421669195, 'depth': 9, 'boosting_type': 'Plain', 'bootstrap_type': 'Bayesian', 'bagging_temperature': 6.359945668638016}. Best is trial 1464 with value: 0.8990825688073395.
[32m[I 2023-04-20 23:54:29,724][39m Trial 2715 finished with value: 0.8571428571428572 and parameters: {'objective': 'Logloss', 'colsample_bylevel': 0.08778155103186358, 'depth': 9, 'boosting_type': 'Plain', 'bootstrap_type': 'Bayesian', 'bagging_temperature': 4.845495145545713}. Best is trial 1464 with value: 0.8990825688073395.
[32m[I 2023-04-20 23:54:30,752][39m Trial 2716 finished with value: 0.8727272727272727 and parameters: {'objective': 'Logloss', 'colsample_bylevel': 0.09829873642081972, 'depth': 10, 'boosting_type': 'Plain', 'bootstrap_type': 'Bayesian', 'bagging_temperature': 4.296171052160677}. Best is trial 1464 with value: 0.8990825688073395.
[32m[I 2023-04-20 23:54:35,905][39m Trial 2717 finished with value: 0.8495575221238938 and parameters: {'objective': 'CrossEntropy', 'colsample_bylevel': 0.09200278937142954, 'depth': 11, 'boosting_type': 'Ordered', 'bootstrap_type': 'Bayesian', 'bagging_temperature': 5.605056253115853}. Best is trial 1464 with value: 0.8990825688073395.
[32m[I 2023-04-20 23:54:37,311][39m Trial 2718 finished with value: 0.8807339449541284 and parameters: {'objective': 'Logloss', 'colsample_bylevel': 0.09041355584624337, 'depth': 10, 'boosting_type': 'Plain', 'bootstrap_type': 'Bayesian', 'bagging_temperature': 5.767934005349957}. Best is trial 1464 with value: 0.8990825688073395.
[32m[I 2023-04-20 23:54:38,591][39m Trial 2719 finished with value: 0.8727272727272727 and parameters: {'objective': 'Logloss', 'colsample_bylevel': 0.09679010223711894, 'depth': 8, 'boosting_type': 'Plain', 'bootstrap_type': 'Bayesian', 'bagging_temperature': 4.2326828645300605}. Best is trial 1464 with value: 0.8990825688073395.
[32m[I 2023-04-20 23:54:39,308][39m Trial 2720 finished with value: 0.8807339449541284 and parameters: {'objective': 'CrossEntropy', 'colsample_bylevel': 0.09983137406296472, 'depth': 8, 'boosting_type': 'Plain', 'bootstrap_type': 'Bayesian', 'bagging_temperature': 5.193222526447778}. Best is trial 1464 with value: 0.8990825688073395.
[32m[I 2023-04-20 23:54:40,870][39m Trial 2721 finished with value: 0.8545454545454546 and parameters: {'objective': 'Logloss', 'colsample_bylevel': 0.08624023293619065, 'depth': 8, 'boosting_type': 'Plain', 'bootstrap_type': 'Bayesian', 'bagging_temperature': 5.287601708114699}. Best is trial 1464 with value: 0.8990825688073395.
[32m[I 2023-04-20 23:54:42,351][39m Trial 2722 finished with value: 0.8648648648648648 and parameters: {'objective': 'Logloss', 'colsample_bylevel': 0.09994380325498282, 'depth': 8, 'boosting_type': 'Plain', 'bootstrap_type': 'Bayesian', 'bagging_temperature': 5.0106127669449805}. Best is trial 1464 with value: 0.8990825688073395.
[32m[I 2023-04-20 23:54:43,108][39m Trial 2723 finished with value: 0.8807339449541284 and parameters: {'objective': 'Logloss', 'colsample_bylevel': 0.0955498964865854, 'depth': 8, 'boosting_type': 'Plain', 'bootstrap_type': 'Bayesian', 'bagging_temperature': 4.803459347672838}. Best is trial 1464 with value: 0.8990825688073395.
[32m[I 2023-04-20 23:54:43,846][39m Trial 2724 finished with value: 0.8807339449541284 and parameters: {'objective': 'CrossEntropy', 'colsample_bylevel': 0.09271910324788572, 'depth': 11, 'boosting_type': 'Plain', 'bootstrap_type': 'Bayesian', 'bagging_temperature': 5.670413183761856}. Best is trial 1464 with value: 0.8990825688073395.
[32m[I 2023-04-20 23:54:45,107][39m Trial 2725 finished with value: 0.8440366972477066 and parameters: {'objective': 'CrossEntropy', 'colsample_bylevel': 0.09433717747712304, 'depth': 8, 'boosting_type': 'Plain', 'bootstrap_type': 'Bayesian', 'bagging_temperature': 5.844315036546542}. Best is trial 1464 with value: 0.8990825688073395.
[32m[I 2023-04-20 23:54:45,939][39m Trial 2726 finished with value: 0.8727272727272727 and parameters: {'objective': 'CrossEntropy', 'colsample_bylevel': 0.09050142327967921, 'depth': 10, 'boosting_type': 'Plain', 'bootstrap_type': 'Bayesian', 'bagging_temperature': 4.4490885678451875}. Best is trial 1464 with value: 0.8990825688073395.
[32m[I 2023-04-20 23:54:47,536][39m Trial 2727 finished with value: 0.8727272727272727 and parameters: {'objective': 'CrossEntropy', 'colsample_bylevel': 0.08708047549437081, 'depth': 9, 'boosting_type': 'Plain', 'bootstrap_type': 'Bayesian', 'bagging_temperature': 5.140550121547925}. Best is trial 1464 with value: 0.8990825688073395.
[32m[I 2023-04-20 23:54:48,432][39m Trial 2728 finished with value: 0.8807339449541284 and parameters: {'objective': 'Logloss', 'colsample_bylevel': 0.09706433858871982, 'depth': 7, 'boosting_type': 'Plain', 'bootstrap_type': 'Bayesian', 'bagging_temperature': 4.425526935586928}. Best is trial 1464 with value: 0.8990825688073395.
[32m[I 2023-04-20 23:54:49,170][39m Trial 2729 finished with value: 0.8672566371681416 and parameters: {'objective': 'Logloss', 'colsample_bylevel': 0.09346097662545737, 'depth': 8, 'boosting_type': 'Plain', 'bootstrap_type': 'Bayesian', 'bagging_temperature': 5.630812871247106}. Best is trial 1464 with value: 0.8990825688073395.
[32m[I 2023-04-20 23:54:49,892][39m Trial 2730 finished with value: 0.8672566371681416 and parameters: {'objective': 'CrossEntropy', 'colsample_bylevel': 0.09256530506976635, 'depth': 10, 'boosting_type': 'Plain', 'bootstrap_type': 'MVS'}. Best is trial 1464 with value: 0.8990825688073395.
[32m[I 2023-04-20 23:54:51,615][39m Trial 2731 finished with value: 0.888888888888889 and parameters: {'objective': 'Logloss', 'colsample_bylevel': 0.09846460048993738, 'depth': 9, 'boosting_type': 'Plain', 'bootstrap_type': 'Bayesian', 'bagging_temperature': 5.351442693379379}. Best is trial 1464 with value: 0.8990825688073395.
[32m[I 2023-04-20 23:54:52,692][39m Trial 2732 finished with value: 0.8545454545454546 and parameters: {'objective': 'Logloss', 'colsample_bylevel': 0.09525580852193395, 'depth': 9, 'boosting_type': 'Plain', 'bootstrap_type': 'Bayesian', 'bagging_temperature': 4.653026844054093}. Best is trial 1464 with value: 0.8990825688073395.
[32m[I 2023-04-20 23:54:53,421][39m Trial 2733 finished with value: 0.8545454545454546 and parameters: {'objective': 'CrossEntropy', 'colsample_bylevel': 0.09079593336163072, 'depth': 7, 'boosting_type': 'Plain', 'bootstrap_type': 'Bayesian', 'bagging_temperature': 5.689710591053378}. Best is trial 1464 with value: 0.8990825688073395.
[32m[I 2023-04-20 23:54:54,696][39m Trial 2734 finished with value: 0.890909090909091 and parameters: {'objective': 'Logloss', 'colsample_bylevel': 0.09460257937357011, 'depth': 7, 'boosting_type': 'Plain', 'bootstrap_type': 'Bayesian', 'bagging_temperature': 7.05539272149242}. Best is trial 1464 with value: 0.8990825688073395.
[32m[I 2023-04-20 23:54:56,089][39m Trial 2735 finished with value: 0.8807339449541284 and parameters: {'objective': 'Logloss', 'colsample_bylevel': 0.09971245222369993, 'depth': 7, 'boosting_type': 'Plain', 'bootstrap_type': 'Bayesian', 'bagging_temperature': 4.946832577415918}. Best is trial 1464 with value: 0.8990825688073395.
[32m[I 2023-04-20 23:55:01,095][39m Trial 2736 finished with value: 0.8421052631578947 and parameters: {'objective': 'CrossEntropy', 'colsample_bylevel': 0.09815251876848315, 'depth': 9, 'boosting_type': 'Ordered', 'bootstrap_type': 'Bayesian', 'bagging_temperature': 5.9796997420044855}. Best is trial 1464 with value: 0.8990825688073395.
[32m[I 2023-04-20 23:55:02,634][39m Trial 2737 finished with value: 0.8727272727272727 and parameters: {'objective': 'Logloss', 'colsample_bylevel': 0.09494519305375809, 'depth': 7, 'boosting_type': 'Plain', 'bootstrap_type': 'Bayesian', 'bagging_temperature': 7.402701431177606}. Best is trial 1464 with value: 0.8990825688073395.
[32m[I 2023-04-20 23:55:03,827][39m Trial 2738 finished with value: 0.8703703703703703 and parameters: {'objective': 'Logloss', 'colsample_bylevel': 0.09246966515868209, 'depth': 8, 'boosting_type': 'Plain', 'bootstrap_type': 'Bayesian', 'bagging_temperature': 6.921076042361418}. Best is trial 1464 with value: 0.8990825688073395.
[32m[I 2023-04-20 23:55:05,276][39m Trial 2739 finished with value: 0.8807339449541284 and parameters: {'objective': 'Logloss', 'colsample_bylevel': 0.09616185198262608, 'depth': 9, 'boosting_type': 'Plain', 'bootstrap_type': 'Bayesian', 'bagging_temperature': 4.776790992366283}. Best is trial 1464 with value: 0.8990825688073395.
[32m[I 2023-04-20 23:55:06,136][39m Trial 2740 finished with value: 0.8828828828828829 and parameters: {'objective': 'Logloss', 'colsample_bylevel': 0.09494849002802522, 'depth': 7, 'boosting_type': 'Plain', 'bootstrap_type': 'Bayesian', 'bagging_temperature': 5.116822442513941}. Best is trial 1464 with value: 0.8990825688073395.
[32m[I 2023-04-20 23:55:07,472][39m Trial 2741 finished with value: 0.888888888888889 and parameters: {'objective': 'Logloss', 'colsample_bylevel': 0.09326946609160701, 'depth': 9, 'boosting_type': 'Plain', 'bootstrap_type': 'Bayesian', 'bagging_temperature': 4.935147948163491}. Best is trial 1464 with value: 0.8990825688073395.
[32m[I 2023-04-20 23:55:09,170][39m Trial 2742 finished with value: 0.8703703703703703 and parameters: {'objective': 'Logloss', 'colsample_bylevel': 0.09385291798637155, 'depth': 7, 'boosting_type': 'Plain', 'bootstrap_type': 'Bayesian', 'bagging_temperature': 7.151171793613341}. Best is trial 1464 with value: 0.8990825688073395.
[32m[I 2023-04-20 23:55:10,556][39m Trial 2743 finished with value: 0.8727272727272727 and parameters: {'objective': 'Logloss', 'colsample_bylevel': 0.09545188888010482, 'depth': 11, 'boosting_type': 'Plain', 'bootstrap_type': 'Bayesian', 'bagging_temperature': 6.989368033647398}. Best is trial 1464 with value: 0.8990825688073395.
[32m[I 2023-04-20 23:55:11,329][39m Trial 2744 finished with value: 0.8521739130434783 and parameters: {'objective': 'Logloss', 'colsample_bylevel': 0.05273872521511568, 'depth': 8, 'boosting_type': 'Plain', 'bootstrap_type': 'Bayesian', 'bagging_temperature': 4.916123840031272}. Best is trial 1464 with value: 0.8990825688073395.
[32m[I 2023-04-20 23:55:12,071][39m Trial 2745 finished with value: 0.8807339449541284 and parameters: {'objective': 'Logloss', 'colsample_bylevel': 0.09383068185441559, 'depth': 7, 'boosting_type': 'Plain', 'bootstrap_type': 'Bayesian', 'bagging_temperature': 5.453661270522892}. Best is trial 1464 with value: 0.8990825688073395.
[32m[I 2023-04-20 23:55:12,753][39m Trial 2746 finished with value: 0.8672566371681416 and parameters: {'objective': 'Logloss', 'colsample_bylevel': 0.0834148087079536, 'depth': 7, 'boosting_type': 'Plain', 'bootstrap_type': 'Bayesian', 'bagging_temperature': 5.124059444658281}. Best is trial 1464 with value: 0.8990825688073395.
[32m[I 2023-04-20 23:55:13,503][39m Trial 2747 finished with value: 0.8623853211009175 and parameters: {'objective': 'Logloss', 'colsample_bylevel': 0.0940362961428401, 'depth': 10, 'boosting_type': 'Plain', 'bootstrap_type': 'Bayesian', 'bagging_temperature': 7.281081776612737}. Best is trial 1464 with value: 0.8990825688073395.
[32m[I 2023-04-20 23:55:15,125][39m Trial 2748 finished with value: 0.8727272727272727 and parameters: {'objective': 'Logloss', 'colsample_bylevel': 0.0974693150025771, 'depth': 8, 'boosting_type': 'Plain', 'bootstrap_type': 'Bayesian', 'bagging_temperature': 6.470534294093019}. Best is trial 1464 with value: 0.8990825688073395.
[32m[I 2023-04-20 23:55:16,192][39m Trial 2749 finished with value: 0.8571428571428572 and parameters: {'objective': 'Logloss', 'colsample_bylevel': 0.09236555843613589, 'depth': 10, 'boosting_type': 'Plain', 'bootstrap_type': 'Bayesian', 'bagging_temperature': 7.567748391866191}. Best is trial 1464 with value: 0.8990825688073395.
[32m[I 2023-04-20 23:55:17,725][39m Trial 2750 finished with value: 0.875 and parameters: {'objective': 'Logloss', 'colsample_bylevel': 0.04825527473099877, 'depth': 8, 'boosting_type': 'Plain', 'bootstrap_type': 'Bayesian', 'bagging_temperature': 7.863343507018344}. Best is trial 1464 with value: 0.8990825688073395.
[32m[I 2023-04-20 23:55:18,315][39m Trial 2751 finished with value: 0.8205128205128206 and parameters: {'objective': 'Logloss', 'colsample_bylevel': 0.0356206942657615, 'depth': 9, 'boosting_type': 'Plain', 'bootstrap_type': 'MVS'}. Best is trial 1464 with value: 0.8990825688073395.
[32m[I 2023-04-20 23:55:19,528][39m Trial 2752 finished with value: 0.8672566371681416 and parameters: {'objective': 'Logloss', 'colsample_bylevel': 0.06660117425921037, 'depth': 8, 'boosting_type': 'Plain', 'bootstrap_type': 'Bayesian', 'bagging_temperature': 6.935252547367794}. Best is trial 1464 with value: 0.8990825688073395.
[32m[I 2023-04-20 23:55:20,347][39m Trial 2753 finished with value: 0.8807339449541284 and parameters: {'objective': 'CrossEntropy', 'colsample_bylevel': 0.09705539795249862, 'depth': 8, 'boosting_type': 'Plain', 'bootstrap_type': 'Bayesian', 'bagging_temperature': 5.893178226149265}. Best is trial 1464 with value: 0.8990825688073395.
[32m[I 2023-04-20 23:55:21,691][39m Trial 2754 finished with value: 0.8828828828828829 and parameters: {'objective': 'Logloss', 'colsample_bylevel': 0.09111523803471332, 'depth': 9, 'boosting_type': 'Plain', 'bootstrap_type': 'Bayesian', 'bagging_temperature': 4.084578271403811}. Best is trial 1464 with value: 0.8990825688073395.
[32m[I 2023-04-20 23:55:28,671][39m Trial 2755 finished with value: 0.8571428571428572 and parameters: {'objective': 'Logloss', 'colsample_bylevel': 0.09538419825854488, 'depth': 6, 'boosting_type': 'Ordered', 'bootstrap_type': 'Bayesian', 'bagging_temperature': 6.801851912341492}. Best is trial 1464 with value: 0.8990825688073395.
[32m[I 2023-04-20 23:55:29,507][39m Trial 2756 finished with value: 0.8727272727272727 and parameters: {'objective': 'Logloss', 'colsample_bylevel': 0.09483484517410432, 'depth': 7, 'boosting_type': 'Plain', 'bootstrap_type': 'Bayesian', 'bagging_temperature': 5.062304988571285}. Best is trial 1464 with value: 0.8990825688073395.
[32m[I 2023-04-20 23:55:30,619][39m Trial 2757 finished with value: 0.8727272727272727 and parameters: {'objective': 'Logloss', 'colsample_bylevel': 0.09653448079395324, 'depth': 8, 'boosting_type': 'Plain', 'bootstrap_type': 'Bayesian', 'bagging_temperature': 6.440104482455105}. Best is trial 1464 with value: 0.8990825688073395.
[32m[I 2023-04-20 23:55:32,138][39m Trial 2758 finished with value: 0.888888888888889 and parameters: {'objective': 'Logloss', 'colsample_bylevel': 0.09667162520197363, 'depth': 8, 'boosting_type': 'Plain', 'bootstrap_type': 'Bayesian', 'bagging_temperature': 6.711260533835851}. Best is trial 1464 with value: 0.8990825688073395.
[32m[I 2023-04-20 23:55:32,984][39m Trial 2759 finished with value: 0.8785046728971961 and parameters: {'objective': 'Logloss', 'colsample_bylevel': 0.0975819455354168, 'depth': 8, 'boosting_type': 'Plain', 'bootstrap_type': 'Bayesian', 'bagging_temperature': 3.9077682770537328}. Best is trial 1464 with value: 0.8990825688073395.
[32m[I 2023-04-20 23:55:33,728][39m Trial 2760 finished with value: 0.8648648648648648 and parameters: {'objective': 'Logloss', 'colsample_bylevel': 0.09507511349750813, 'depth': 7, 'boosting_type': 'Plain', 'bootstrap_type': 'Bayesian', 'bagging_temperature': 5.543015687567778}. Best is trial 1464 with value: 0.8990825688073395.
[32m[I 2023-04-20 23:55:35,135][39m Trial 2761 finished with value: 0.890909090909091 and parameters: {'objective': 'Logloss', 'colsample_bylevel': 0.09427721101317056, 'depth': 9, 'boosting_type': 'Plain', 'bootstrap_type': 'Bayesian', 'bagging_temperature': 6.989847834262009}. Best is trial 1464 with value: 0.8990825688073395.
[32m[I 2023-04-20 23:55:36,920][39m Trial 2762 finished with value: 0.8727272727272727 and parameters: {'objective': 'Logloss', 'colsample_bylevel': 0.09580742870737588, 'depth': 9, 'boosting_type': 'Plain', 'bootstrap_type': 'Bayesian', 'bagging_temperature': 7.2813170334069115}. Best is trial 1464 with value: 0.8990825688073395.
[32m[I 2023-04-20 23:55:37,948][39m Trial 2763 finished with value: 0.8672566371681416 and parameters: {'objective': 'Logloss', 'colsample_bylevel': 0.09383690814055479, 'depth': 8, 'boosting_type': 'Plain', 'bootstrap_type': 'Bayesian', 'bagging_temperature': 6.880493305637113}. Best is trial 1464 with value: 0.8990825688073395.
[32m[I 2023-04-20 23:55:39,242][39m Trial 2764 finished with value: 0.8703703703703703 and parameters: {'objective': 'Logloss', 'colsample_bylevel': 0.0834605403698471, 'depth': 9, 'boosting_type': 'Plain', 'bootstrap_type': 'Bayesian', 'bagging_temperature': 6.672512428018481}. Best is trial 1464 with value: 0.8990825688073395.
[32m[I 2023-04-20 23:55:40,043][39m Trial 2765 finished with value: 0.8807339449541284 and parameters: {'objective': 'CrossEntropy', 'colsample_bylevel': 0.09109444687574465, 'depth': 9, 'boosting_type': 'Plain', 'bootstrap_type': 'Bayesian', 'bagging_temperature': 7.250014474864307}. Best is trial 1464 with value: 0.8990825688073395.
[32m[I 2023-04-20 23:55:41,319][39m Trial 2766 finished with value: 0.8727272727272727 and parameters: {'objective': 'Logloss', 'colsample_bylevel': 0.09349367848713121, 'depth': 9, 'boosting_type': 'Plain', 'bootstrap_type': 'Bayesian', 'bagging_temperature': 7.059097993941901}. Best is trial 1464 with value: 0.8990825688073395.
