[32m[I 2023-04-21 00:09:07,652][39m Trial 3360 finished with value: 0.8623853211009175 and parameters: {'objective': 'Logloss', 'colsample_bylevel': 0.09548931753297056, 'depth': 8, 'boosting_type': 'Plain', 'bootstrap_type': 'Bayesian', 'bagging_temperature': 5.988020779146891}. Best is trial 1464 with value: 0.8990825688073395.
[32m[I 2023-04-21 00:09:08,597][39m Trial 3361 finished with value: 0.8807339449541284 and parameters: {'objective': 'Logloss', 'colsample_bylevel': 0.09348926664718174, 'depth': 10, 'boosting_type': 'Plain', 'bootstrap_type': 'Bayesian', 'bagging_temperature': 3.653317480663407}. Best is trial 1464 with value: 0.8990825688073395.
[32m[I 2023-04-21 00:09:09,757][39m Trial 3362 finished with value: 0.8495575221238938 and parameters: {'objective': 'Logloss', 'colsample_bylevel': 0.09432039344850694, 'depth': 9, 'boosting_type': 'Plain', 'bootstrap_type': 'MVS'}. Best is trial 1464 with value: 0.8990825688073395.
[32m[I 2023-04-21 00:09:10,669][39m Trial 3363 finished with value: 0.8807339449541284 and parameters: {'objective': 'Logloss', 'colsample_bylevel': 0.09318081878580427, 'depth': 7, 'boosting_type': 'Plain', 'bootstrap_type': 'Bayesian', 'bagging_temperature': 5.625782711456843}. Best is trial 1464 with value: 0.8990825688073395.
[32m[I 2023-04-21 00:09:12,071][39m Trial 3364 finished with value: 0.8807339449541284 and parameters: {'objective': 'Logloss', 'colsample_bylevel': 0.09421139970338178, 'depth': 8, 'boosting_type': 'Plain', 'bootstrap_type': 'Bayesian', 'bagging_temperature': 5.766138698063908}. Best is trial 1464 with value: 0.8990825688073395.
[32m[I 2023-04-21 00:09:13,877][39m Trial 3365 finished with value: 0.8990825688073395 and parameters: {'objective': 'Logloss', 'colsample_bylevel': 0.09821739897806246, 'depth': 9, 'boosting_type': 'Plain', 'bootstrap_type': 'Bayesian', 'bagging_temperature': 5.501657676575233}. Best is trial 1464 with value: 0.8990825688073395.
[32m[I 2023-04-21 00:09:15,103][39m Trial 3366 finished with value: 0.8596491228070176 and parameters: {'objective': 'Logloss', 'colsample_bylevel': 0.08742016936193775, 'depth': 9, 'boosting_type': 'Plain', 'bootstrap_type': 'Bayesian', 'bagging_temperature': 5.13225225662987}. Best is trial 1464 with value: 0.8990825688073395.
[32m[I 2023-04-21 00:09:15,812][39m Trial 3367 finished with value: 0.8807339449541284 and parameters: {'objective': 'Logloss', 'colsample_bylevel': 0.08885358490524686, 'depth': 10, 'boosting_type': 'Plain', 'bootstrap_type': 'Bayesian', 'bagging_temperature': 5.617247663496796}. Best is trial 1464 with value: 0.8990825688073395.
[32m[I 2023-04-21 00:09:16,513][39m Trial 3368 finished with value: 0.8807339449541284 and parameters: {'objective': 'Logloss', 'colsample_bylevel': 0.09650329151388629, 'depth': 10, 'boosting_type': 'Plain', 'bootstrap_type': 'Bayesian', 'bagging_temperature': 5.513656874231502}. Best is trial 1464 with value: 0.8990825688073395.
[32m[I 2023-04-21 00:09:17,787][39m Trial 3369 finished with value: 0.7999999999999999 and parameters: {'objective': 'Logloss', 'colsample_bylevel': 0.017174595500547722, 'depth': 9, 'boosting_type': 'Plain', 'bootstrap_type': 'Bayesian', 'bagging_temperature': 7.699616187337306}. Best is trial 1464 with value: 0.8990825688073395.
[32m[I 2023-04-21 00:09:19,317][39m Trial 3370 finished with value: 0.8727272727272727 and parameters: {'objective': 'Logloss', 'colsample_bylevel': 0.09711715893115927, 'depth': 9, 'boosting_type': 'Plain', 'bootstrap_type': 'Bayesian', 'bagging_temperature': 5.42389141579269}. Best is trial 1464 with value: 0.8990825688073395.
[32m[I 2023-04-21 00:09:20,768][39m Trial 3371 finished with value: 0.8807339449541284 and parameters: {'objective': 'Logloss', 'colsample_bylevel': 0.09321387859760093, 'depth': 8, 'boosting_type': 'Plain', 'bootstrap_type': 'Bayesian', 'bagging_temperature': 5.443228324890422}. Best is trial 1464 with value: 0.8990825688073395.
[32m[I 2023-04-21 00:09:22,618][39m Trial 3372 finished with value: 0.8727272727272727 and parameters: {'objective': 'Logloss', 'colsample_bylevel': 0.09722598296671191, 'depth': 9, 'boosting_type': 'Plain', 'bootstrap_type': 'Bayesian', 'bagging_temperature': 6.007923085990411}. Best is trial 1464 with value: 0.8990825688073395.
[32m[I 2023-04-21 00:09:23,387][39m Trial 3373 finished with value: 0.888888888888889 and parameters: {'objective': 'Logloss', 'colsample_bylevel': 0.08950639436372254, 'depth': 10, 'boosting_type': 'Plain', 'bootstrap_type': 'Bayesian', 'bagging_temperature': 5.63316764232172}. Best is trial 1464 with value: 0.8990825688073395.
[32m[I 2023-04-21 00:09:24,791][39m Trial 3374 finished with value: 0.8807339449541284 and parameters: {'objective': 'Logloss', 'colsample_bylevel': 0.09402297263443567, 'depth': 9, 'boosting_type': 'Plain', 'bootstrap_type': 'Bayesian', 'bagging_temperature': 4.975199557184148}. Best is trial 1464 with value: 0.8990825688073395.
[32m[I 2023-04-21 00:09:25,688][39m Trial 3375 finished with value: 0.8727272727272727 and parameters: {'objective': 'Logloss', 'colsample_bylevel': 0.09886659834218321, 'depth': 8, 'boosting_type': 'Plain', 'bootstrap_type': 'Bayesian', 'bagging_temperature': 5.734866266089274}. Best is trial 1464 with value: 0.8990825688073395.
[32m[I 2023-04-21 00:09:27,657][39m Trial 3376 finished with value: 0.8727272727272727 and parameters: {'objective': 'Logloss', 'colsample_bylevel': 0.0953601077820243, 'depth': 9, 'boosting_type': 'Plain', 'bootstrap_type': 'Bayesian', 'bagging_temperature': 5.495949911944744}. Best is trial 1464 with value: 0.8990825688073395.
[32m[I 2023-04-21 00:09:28,899][39m Trial 3377 finished with value: 0.8807339449541284 and parameters: {'objective': 'Logloss', 'colsample_bylevel': 0.09797209683236299, 'depth': 8, 'boosting_type': 'Plain', 'bootstrap_type': 'Bayesian', 'bagging_temperature': 3.884888602848642}. Best is trial 1464 with value: 0.8990825688073395.
[32m[I 2023-04-21 00:09:29,926][39m Trial 3378 finished with value: 0.8727272727272727 and parameters: {'objective': 'Logloss', 'colsample_bylevel': 0.0981132096063575, 'depth': 8, 'boosting_type': 'Plain', 'bootstrap_type': 'Bayesian', 'bagging_temperature': 4.098243038083412}. Best is trial 1464 with value: 0.8990825688073395.
[32m[I 2023-04-21 00:09:33,834][39m Trial 3379 finished with value: 0.8421052631578947 and parameters: {'objective': 'CrossEntropy', 'colsample_bylevel': 0.09703408482544018, 'depth': 8, 'boosting_type': 'Ordered', 'bootstrap_type': 'Bernoulli', 'subsample': 0.6200345791268006}. Best is trial 1464 with value: 0.8990825688073395.
[32m[I 2023-04-21 00:09:35,413][39m Trial 3380 finished with value: 0.8807339449541284 and parameters: {'objective': 'CrossEntropy', 'colsample_bylevel': 0.098445917067115, 'depth': 9, 'boosting_type': 'Plain', 'bootstrap_type': 'Bayesian', 'bagging_temperature': 4.814250553235071}. Best is trial 1464 with value: 0.8990825688073395.
[32m[I 2023-04-21 00:09:37,284][39m Trial 3381 finished with value: 0.8623853211009175 and parameters: {'objective': 'Logloss', 'colsample_bylevel': 0.09209413567103662, 'depth': 9, 'boosting_type': 'Plain', 'bootstrap_type': 'Bayesian', 'bagging_temperature': 5.583099364769476}. Best is trial 1464 with value: 0.8990825688073395.
[32m[I 2023-04-21 00:09:38,168][39m Trial 3382 finished with value: 0.8648648648648648 and parameters: {'objective': 'Logloss', 'colsample_bylevel': 0.08550660290878091, 'depth': 10, 'boosting_type': 'Plain', 'bootstrap_type': 'Bayesian', 'bagging_temperature': 5.667825431826576}. Best is trial 1464 with value: 0.8990825688073395.
[32m[I 2023-04-21 00:09:39,347][39m Trial 3383 finished with value: 0.8807339449541284 and parameters: {'objective': 'Logloss', 'colsample_bylevel': 0.09154452736773308, 'depth': 9, 'boosting_type': 'Plain', 'bootstrap_type': 'Bayesian', 'bagging_temperature': 5.49713281167812}. Best is trial 1464 with value: 0.8990825688073395.
[32m[I 2023-04-21 00:09:41,106][39m Trial 3384 finished with value: 0.8807339449541284 and parameters: {'objective': 'Logloss', 'colsample_bylevel': 0.09841644342029975, 'depth': 8, 'boosting_type': 'Plain', 'bootstrap_type': 'Bayesian', 'bagging_temperature': 5.311840616820502}. Best is trial 1464 with value: 0.8990825688073395.
[32m[I 2023-04-21 00:09:42,345][39m Trial 3385 finished with value: 0.8648648648648648 and parameters: {'objective': 'Logloss', 'colsample_bylevel': 0.09857294809506015, 'depth': 7, 'boosting_type': 'Plain', 'bootstrap_type': 'MVS'}. Best is trial 1464 with value: 0.8990825688073395.
[32m[I 2023-04-21 00:09:43,451][39m Trial 3386 finished with value: 0.8727272727272727 and parameters: {'objective': 'Logloss', 'colsample_bylevel': 0.09994154319230426, 'depth': 9, 'boosting_type': 'Plain', 'bootstrap_type': 'Bayesian', 'bagging_temperature': 5.320049245224047}. Best is trial 1464 with value: 0.8990825688073395.
[32m[I 2023-04-21 00:09:44,427][39m Trial 3387 finished with value: 0.8828828828828829 and parameters: {'objective': 'Logloss', 'colsample_bylevel': 0.09452807091177268, 'depth': 9, 'boosting_type': 'Plain', 'bootstrap_type': 'Bayesian', 'bagging_temperature': 5.179515731686876}. Best is trial 1464 with value: 0.8990825688073395.
[32m[I 2023-04-21 00:09:45,206][39m Trial 3388 finished with value: 0.8807339449541284 and parameters: {'objective': 'Logloss', 'colsample_bylevel': 0.09182455697396884, 'depth': 8, 'boosting_type': 'Plain', 'bootstrap_type': 'Bayesian', 'bagging_temperature': 5.448072154739671}. Best is trial 1464 with value: 0.8990825688073395.
[32m[I 2023-04-21 00:09:46,225][39m Trial 3389 finished with value: 0.8703703703703703 and parameters: {'objective': 'Logloss', 'colsample_bylevel': 0.09530768194030646, 'depth': 9, 'boosting_type': 'Plain', 'bootstrap_type': 'Bayesian', 'bagging_temperature': 5.314595953867824}. Best is trial 1464 with value: 0.8990825688073395.
[32m[I 2023-04-21 00:09:47,161][39m Trial 3390 finished with value: 0.8648648648648648 and parameters: {'objective': 'Logloss', 'colsample_bylevel': 0.09544329888990474, 'depth': 9, 'boosting_type': 'Plain', 'bootstrap_type': 'Bayesian', 'bagging_temperature': 5.309308600701911}. Best is trial 1464 with value: 0.8990825688073395.
[32m[I 2023-04-21 00:09:48,797][39m Trial 3391 finished with value: 0.8807339449541284 and parameters: {'objective': 'CrossEntropy', 'colsample_bylevel': 0.08362622296410407, 'depth': 8, 'boosting_type': 'Plain', 'bootstrap_type': 'Bayesian', 'bagging_temperature': 5.461008675821246}. Best is trial 1464 with value: 0.8990825688073395.
[32m[I 2023-04-21 00:09:50,771][39m Trial 3392 finished with value: 0.8807339449541284 and parameters: {'objective': 'Logloss', 'colsample_bylevel': 0.09298102522949851, 'depth': 9, 'boosting_type': 'Plain', 'bootstrap_type': 'Bayesian', 'bagging_temperature': 5.838239138457454}. Best is trial 1464 with value: 0.8990825688073395.
[32m[I 2023-04-21 00:09:51,750][39m Trial 3393 finished with value: 0.8807339449541284 and parameters: {'objective': 'Logloss', 'colsample_bylevel': 0.09354419518930257, 'depth': 9, 'boosting_type': 'Plain', 'bootstrap_type': 'Bayesian', 'bagging_temperature': 5.652519648854683}. Best is trial 1464 with value: 0.8990825688073395.
[32m[I 2023-04-21 00:09:52,828][39m Trial 3394 finished with value: 0.8727272727272727 and parameters: {'objective': 'Logloss', 'colsample_bylevel': 0.09699852236942236, 'depth': 9, 'boosting_type': 'Plain', 'bootstrap_type': 'Bayesian', 'bagging_temperature': 5.924891954624627}. Best is trial 1464 with value: 0.8990825688073395.
[32m[I 2023-04-21 00:09:54,870][39m Trial 3395 finished with value: 0.888888888888889 and parameters: {'objective': 'Logloss', 'colsample_bylevel': 0.09521534099363436, 'depth': 8, 'boosting_type': 'Plain', 'bootstrap_type': 'Bayesian', 'bagging_temperature': 5.587757826218113}. Best is trial 1464 with value: 0.8990825688073395.
[32m[I 2023-04-21 00:09:59,582][39m Trial 3396 finished with value: 0.8392857142857144 and parameters: {'objective': 'Logloss', 'colsample_bylevel': 0.09645751712118926, 'depth': 8, 'boosting_type': 'Ordered', 'bootstrap_type': 'Bayesian', 'bagging_temperature': 5.188752858680655}. Best is trial 1464 with value: 0.8990825688073395.
[32m[I 2023-04-21 00:10:01,274][39m Trial 3397 finished with value: 0.8727272727272727 and parameters: {'objective': 'Logloss', 'colsample_bylevel': 0.09545795110774578, 'depth': 9, 'boosting_type': 'Plain', 'bootstrap_type': 'Bayesian', 'bagging_temperature': 4.538133129953024}. Best is trial 1464 with value: 0.8990825688073395.
[32m[I 2023-04-21 00:10:02,599][39m Trial 3398 finished with value: 0.8727272727272727 and parameters: {'objective': 'Logloss', 'colsample_bylevel': 0.09511242181782961, 'depth': 9, 'boosting_type': 'Plain', 'bootstrap_type': 'Bayesian', 'bagging_temperature': 6.182531862755345}. Best is trial 1464 with value: 0.8990825688073395.
[32m[I 2023-04-21 00:10:03,402][39m Trial 3399 finished with value: 0.8807339449541284 and parameters: {'objective': 'Logloss', 'colsample_bylevel': 0.09715132767104077, 'depth': 7, 'boosting_type': 'Plain', 'bootstrap_type': 'Bayesian', 'bagging_temperature': 6.0250228632117775}. Best is trial 1464 with value: 0.8990825688073395.
[32m[I 2023-04-21 00:10:05,248][39m Trial 3400 finished with value: 0.8807339449541284 and parameters: {'objective': 'Logloss', 'colsample_bylevel': 0.09548583396305861, 'depth': 9, 'boosting_type': 'Plain', 'bootstrap_type': 'Bayesian', 'bagging_temperature': 6.714672135827374}. Best is trial 1464 with value: 0.8990825688073395.
[32m[I 2023-04-21 00:10:06,761][39m Trial 3401 finished with value: 0.8807339449541284 and parameters: {'objective': 'Logloss', 'colsample_bylevel': 0.08884096445674113, 'depth': 9, 'boosting_type': 'Plain', 'bootstrap_type': 'Bayesian', 'bagging_temperature': 6.26050362165575}. Best is trial 1464 with value: 0.8990825688073395.
[32m[I 2023-04-21 00:10:08,172][39m Trial 3402 finished with value: 0.8571428571428572 and parameters: {'objective': 'Logloss', 'colsample_bylevel': 0.096321614954016, 'depth': 9, 'boosting_type': 'Plain', 'bootstrap_type': 'Bernoulli', 'subsample': 0.7621842433849613}. Best is trial 1464 with value: 0.8990825688073395.
[32m[I 2023-04-21 00:10:09,612][39m Trial 3403 finished with value: 0.8785046728971961 and parameters: {'objective': 'Logloss', 'colsample_bylevel': 0.0897767135374494, 'depth': 9, 'boosting_type': 'Plain', 'bootstrap_type': 'Bayesian', 'bagging_temperature': 5.279904927119329}. Best is trial 1464 with value: 0.8990825688073395.
[32m[I 2023-04-21 00:10:10,489][39m Trial 3404 finished with value: 0.8807339449541284 and parameters: {'objective': 'Logloss', 'colsample_bylevel': 0.09972728538121796, 'depth': 8, 'boosting_type': 'Plain', 'bootstrap_type': 'Bayesian', 'bagging_temperature': 5.28528123603459}. Best is trial 1464 with value: 0.8990825688073395.
[32m[I 2023-04-21 00:10:11,588][39m Trial 3405 finished with value: 0.8727272727272727 and parameters: {'objective': 'Logloss', 'colsample_bylevel': 0.09668173021640886, 'depth': 9, 'boosting_type': 'Plain', 'bootstrap_type': 'Bayesian', 'bagging_temperature': 4.265015700673672}. Best is trial 1464 with value: 0.8990825688073395.
[32m[I 2023-04-21 00:10:13,187][39m Trial 3406 finished with value: 0.8648648648648648 and parameters: {'objective': 'Logloss', 'colsample_bylevel': 0.09258500084559075, 'depth': 8, 'boosting_type': 'Plain', 'bootstrap_type': 'Bayesian', 'bagging_temperature': 7.014314006020987}. Best is trial 1464 with value: 0.8990825688073395.
[32m[I 2023-04-21 00:10:14,165][39m Trial 3407 finished with value: 0.8672566371681416 and parameters: {'objective': 'Logloss', 'colsample_bylevel': 0.09846396069567097, 'depth': 9, 'boosting_type': 'Plain', 'bootstrap_type': 'MVS'}. Best is trial 1464 with value: 0.8990825688073395.
[32m[I 2023-04-21 00:10:15,427][39m Trial 3408 finished with value: 0.8623853211009175 and parameters: {'objective': 'Logloss', 'colsample_bylevel': 0.09855389888119606, 'depth': 9, 'boosting_type': 'Plain', 'bootstrap_type': 'Bayesian', 'bagging_temperature': 5.779913093973164}. Best is trial 1464 with value: 0.8990825688073395.
[32m[I 2023-04-21 00:10:16,146][39m Trial 3409 finished with value: 0.8727272727272727 and parameters: {'objective': 'Logloss', 'colsample_bylevel': 0.09031362013609005, 'depth': 10, 'boosting_type': 'Plain', 'bootstrap_type': 'Bayesian', 'bagging_temperature': 5.9479371467625235}. Best is trial 1464 with value: 0.8990825688073395.
[32m[I 2023-04-21 00:10:17,440][39m Trial 3410 finished with value: 0.888888888888889 and parameters: {'objective': 'Logloss', 'colsample_bylevel': 0.08800219278639793, 'depth': 9, 'boosting_type': 'Plain', 'bootstrap_type': 'Bayesian', 'bagging_temperature': 5.084014715160803}. Best is trial 1464 with value: 0.8990825688073395.
[32m[I 2023-04-21 00:10:19,038][39m Trial 3411 finished with value: 0.890909090909091 and parameters: {'objective': 'Logloss', 'colsample_bylevel': 0.09468950512415997, 'depth': 9, 'boosting_type': 'Plain', 'bootstrap_type': 'Bayesian', 'bagging_temperature': 5.672094708337075}. Best is trial 1464 with value: 0.8990825688073395.
[32m[I 2023-04-21 00:10:20,670][39m Trial 3412 finished with value: 0.8727272727272727 and parameters: {'objective': 'Logloss', 'colsample_bylevel': 0.09159610597411677, 'depth': 9, 'boosting_type': 'Plain', 'bootstrap_type': 'Bayesian', 'bagging_temperature': 5.5721227895856}. Best is trial 1464 with value: 0.8990825688073395.
[32m[I 2023-04-21 00:10:21,465][39m Trial 3413 finished with value: 0.875 and parameters: {'objective': 'Logloss', 'colsample_bylevel': 0.09461026266032499, 'depth': 8, 'boosting_type': 'Plain', 'bootstrap_type': 'Bayesian', 'bagging_temperature': 5.205683213053273}. Best is trial 1464 with value: 0.8990825688073395.
[32m[I 2023-04-21 00:10:26,322][39m Trial 3414 finished with value: 0.8347826086956522 and parameters: {'objective': 'Logloss', 'colsample_bylevel': 0.08650959360393708, 'depth': 9, 'boosting_type': 'Ordered', 'bootstrap_type': 'Bayesian', 'bagging_temperature': 5.115755737777041}. Best is trial 1464 with value: 0.8990825688073395.
[32m[I 2023-04-21 00:10:27,457][39m Trial 3415 finished with value: 0.8785046728971961 and parameters: {'objective': 'Logloss', 'colsample_bylevel': 0.09195227180863777, 'depth': 7, 'boosting_type': 'Plain', 'bootstrap_type': 'Bayesian', 'bagging_temperature': 5.274708303363047}. Best is trial 1464 with value: 0.8990825688073395.
[32m[I 2023-04-21 00:10:29,643][39m Trial 3416 finished with value: 0.8648648648648648 and parameters: {'objective': 'Logloss', 'colsample_bylevel': 0.09041516532669465, 'depth': 9, 'boosting_type': 'Plain', 'bootstrap_type': 'Bayesian', 'bagging_temperature': 5.649931260430819}. Best is trial 1464 with value: 0.8990825688073395.
[32m[I 2023-04-21 00:10:30,605][39m Trial 3417 finished with value: 0.8807339449541284 and parameters: {'objective': 'Logloss', 'colsample_bylevel': 0.09236728429879601, 'depth': 9, 'boosting_type': 'Plain', 'bootstrap_type': 'Bayesian', 'bagging_temperature': 5.772234614446892}. Best is trial 1464 with value: 0.8990825688073395.
[32m[I 2023-04-21 00:10:32,402][39m Trial 3418 finished with value: 0.8727272727272727 and parameters: {'objective': 'Logloss', 'colsample_bylevel': 0.09571049782968283, 'depth': 9, 'boosting_type': 'Plain', 'bootstrap_type': 'Bayesian', 'bagging_temperature': 5.532080786432701}. Best is trial 1464 with value: 0.8990825688073395.
[32m[I 2023-04-21 00:10:34,177][39m Trial 3419 finished with value: 0.8648648648648648 and parameters: {'objective': 'Logloss', 'colsample_bylevel': 0.09431844359491133, 'depth': 9, 'boosting_type': 'Plain', 'bootstrap_type': 'Bayesian', 'bagging_temperature': 4.597152017311006}. Best is trial 1464 with value: 0.8990825688073395.
[32m[I 2023-04-21 00:10:35,836][39m Trial 3420 finished with value: 0.888888888888889 and parameters: {'objective': 'Logloss', 'colsample_bylevel': 0.0999624357016975, 'depth': 9, 'boosting_type': 'Plain', 'bootstrap_type': 'Bayesian', 'bagging_temperature': 5.0028862302345365}. Best is trial 1464 with value: 0.8990825688073395.
[32m[I 2023-04-21 00:10:36,523][39m Trial 3421 finished with value: 0.888888888888889 and parameters: {'objective': 'Logloss', 'colsample_bylevel': 0.09842329834159019, 'depth': 6, 'boosting_type': 'Plain', 'bootstrap_type': 'Bayesian', 'bagging_temperature': 4.372367745689782}. Best is trial 1464 with value: 0.8990825688073395.
[32m[I 2023-04-21 00:10:37,143][39m Trial 3422 finished with value: 0.8727272727272727 and parameters: {'objective': 'Logloss', 'colsample_bylevel': 0.09752832936185754, 'depth': 7, 'boosting_type': 'Plain', 'bootstrap_type': 'Bayesian', 'bagging_temperature': 4.422137205283734}. Best is trial 1464 with value: 0.8990825688073395.
[32m[I 2023-04-21 00:10:37,939][39m Trial 3423 finished with value: 0.8648648648648648 and parameters: {'objective': 'Logloss', 'colsample_bylevel': 0.09331744725493511, 'depth': 9, 'boosting_type': 'Plain', 'bootstrap_type': 'Bayesian', 'bagging_temperature': 5.420669612001369}. Best is trial 1464 with value: 0.8990825688073395.
[32m[I 2023-04-21 00:10:38,655][39m Trial 3424 finished with value: 0.8828828828828829 and parameters: {'objective': 'Logloss', 'colsample_bylevel': 0.09851298095154194, 'depth': 7, 'boosting_type': 'Plain', 'bootstrap_type': 'Bayesian', 'bagging_temperature': 4.8099267531939995}. Best is trial 1464 with value: 0.8990825688073395.
[32m[I 2023-04-21 00:10:40,076][39m Trial 3425 finished with value: 0.8648648648648648 and parameters: {'objective': 'Logloss', 'colsample_bylevel': 0.09585667102496989, 'depth': 9, 'boosting_type': 'Plain', 'bootstrap_type': 'Bernoulli', 'subsample': 0.7352449313042785}. Best is trial 1464 with value: 0.8990825688073395.
