[32m[I 2023-04-21 00:40:23,671][39m Trial 4741 finished with value: 0.8727272727272727 and parameters: {'objective': 'Logloss', 'colsample_bylevel': 0.08953223130349167, 'depth': 12, 'boosting_type': 'Plain', 'bootstrap_type': 'Bayesian', 'bagging_temperature': 5.831971307762902}. Best is trial 1464 with value: 0.8990825688073395.
[32m[I 2023-04-21 00:40:24,566][39m Trial 4742 finished with value: 0.8807339449541284 and parameters: {'objective': 'Logloss', 'colsample_bylevel': 0.09043381085955776, 'depth': 12, 'boosting_type': 'Plain', 'bootstrap_type': 'Bayesian', 'bagging_temperature': 5.427704881932844}. Best is trial 1464 with value: 0.8990825688073395.
[32m[I 2023-04-21 00:40:25,300][39m Trial 4743 finished with value: 0.8807339449541284 and parameters: {'objective': 'Logloss', 'colsample_bylevel': 0.09220746316551004, 'depth': 12, 'boosting_type': 'Plain', 'bootstrap_type': 'Bayesian', 'bagging_temperature': 4.502197635541923}. Best is trial 1464 with value: 0.8990825688073395.
[32m[I 2023-04-21 00:40:26,395][39m Trial 4744 finished with value: 0.8623853211009175 and parameters: {'objective': 'Logloss', 'colsample_bylevel': 0.08686560454489654, 'depth': 12, 'boosting_type': 'Plain', 'bootstrap_type': 'Bayesian', 'bagging_temperature': 5.58257850917034}. Best is trial 1464 with value: 0.8990825688073395.
[32m[I 2023-04-21 00:40:27,670][39m Trial 4745 finished with value: 0.890909090909091 and parameters: {'objective': 'CrossEntropy', 'colsample_bylevel': 0.08886189272293345, 'depth': 12, 'boosting_type': 'Plain', 'bootstrap_type': 'Bayesian', 'bagging_temperature': 4.86392496255317}. Best is trial 1464 with value: 0.8990825688073395.
[32m[I 2023-04-21 00:40:29,479][39m Trial 4746 finished with value: 0.8828828828828829 and parameters: {'objective': 'Logloss', 'colsample_bylevel': 0.09464526251931442, 'depth': 9, 'boosting_type': 'Plain', 'bootstrap_type': 'Bayesian', 'bagging_temperature': 4.859786568871291}. Best is trial 1464 with value: 0.8990825688073395.
[32m[I 2023-04-21 00:40:30,746][39m Trial 4747 finished with value: 0.8703703703703703 and parameters: {'objective': 'Logloss', 'colsample_bylevel': 0.09685952945929963, 'depth': 7, 'boosting_type': 'Plain', 'bootstrap_type': 'Bayesian', 'bagging_temperature': 4.0957137552647085}. Best is trial 1464 with value: 0.8990825688073395.
[32m[I 2023-04-21 00:40:35,791][39m Trial 4748 finished with value: 0.8347826086956522 and parameters: {'objective': 'Logloss', 'colsample_bylevel': 0.09836673694829191, 'depth': 9, 'boosting_type': 'Ordered', 'bootstrap_type': 'Bayesian', 'bagging_temperature': 5.106668228516121}. Best is trial 1464 with value: 0.8990825688073395.
[32m[I 2023-04-21 00:40:37,104][39m Trial 4749 finished with value: 0.8648648648648648 and parameters: {'objective': 'CrossEntropy', 'colsample_bylevel': 0.08168237291687529, 'depth': 12, 'boosting_type': 'Plain', 'bootstrap_type': 'Bayesian', 'bagging_temperature': 6.009607385554032}. Best is trial 1464 with value: 0.8990825688073395.
[32m[I 2023-04-21 00:40:38,290][39m Trial 4750 finished with value: 0.8807339449541284 and parameters: {'objective': 'CrossEntropy', 'colsample_bylevel': 0.08937483466125874, 'depth': 12, 'boosting_type': 'Plain', 'bootstrap_type': 'Bayesian', 'bagging_temperature': 6.004572617023237}. Best is trial 1464 with value: 0.8990825688073395.
[32m[I 2023-04-21 00:40:39,320][39m Trial 4751 finished with value: 0.875 and parameters: {'objective': 'CrossEntropy', 'colsample_bylevel': 0.08763912046499507, 'depth': 11, 'boosting_type': 'Plain', 'bootstrap_type': 'Bayesian', 'bagging_temperature': 7.47312628771407}. Best is trial 1464 with value: 0.8990825688073395.
[32m[I 2023-04-21 00:40:40,108][39m Trial 4752 finished with value: 0.736842105263158 and parameters: {'objective': 'Logloss', 'colsample_bylevel': 0.016080710790415613, 'depth': 11, 'boosting_type': 'Plain', 'bootstrap_type': 'Bayesian', 'bagging_temperature': 3.93221542187299}. Best is trial 1464 with value: 0.8990825688073395.
[32m[I 2023-04-21 00:40:40,930][39m Trial 4753 finished with value: 0.8727272727272727 and parameters: {'objective': 'CrossEntropy', 'colsample_bylevel': 0.09588550310922428, 'depth': 11, 'boosting_type': 'Plain', 'bootstrap_type': 'Bayesian', 'bagging_temperature': 7.449546327970761}. Best is trial 1464 with value: 0.8990825688073395.
[32m[I 2023-04-21 00:40:42,841][39m Trial 4754 finished with value: 0.888888888888889 and parameters: {'objective': 'Logloss', 'colsample_bylevel': 0.09161099858348475, 'depth': 9, 'boosting_type': 'Plain', 'bootstrap_type': 'Bayesian', 'bagging_temperature': 5.146898088303737}. Best is trial 1464 with value: 0.8990825688073395.
[32m[I 2023-04-21 00:40:44,059][39m Trial 4755 finished with value: 0.8727272727272727 and parameters: {'objective': 'Logloss', 'colsample_bylevel': 0.08761988364820303, 'depth': 12, 'boosting_type': 'Plain', 'bootstrap_type': 'Bayesian', 'bagging_temperature': 4.917290313262444}. Best is trial 1464 with value: 0.8990825688073395.
[32m[I 2023-04-21 00:40:45,366][39m Trial 4756 finished with value: 0.8571428571428572 and parameters: {'objective': 'Logloss', 'colsample_bylevel': 0.09066109744530886, 'depth': 11, 'boosting_type': 'Plain', 'bootstrap_type': 'Bayesian', 'bagging_temperature': 5.488138182977454}. Best is trial 1464 with value: 0.8990825688073395.
[32m[I 2023-04-21 00:40:46,150][39m Trial 4757 finished with value: 0.8727272727272727 and parameters: {'objective': 'Logloss', 'colsample_bylevel': 0.09792318331623637, 'depth': 7, 'boosting_type': 'Plain', 'bootstrap_type': 'Bayesian', 'bagging_temperature': 3.498716790738598}. Best is trial 1464 with value: 0.8990825688073395.
[32m[I 2023-04-21 00:40:47,580][39m Trial 4758 finished with value: 0.8571428571428572 and parameters: {'objective': 'Logloss', 'colsample_bylevel': 0.08812758279499826, 'depth': 9, 'boosting_type': 'Plain', 'bootstrap_type': 'Bernoulli', 'subsample': 0.7862047929526681}. Best is trial 1464 with value: 0.8990825688073395.
[32m[I 2023-04-21 00:40:48,425][39m Trial 4759 finished with value: 0.8828828828828829 and parameters: {'objective': 'CrossEntropy', 'colsample_bylevel': 0.09089204199925602, 'depth': 11, 'boosting_type': 'Plain', 'bootstrap_type': 'Bayesian', 'bagging_temperature': 4.89648765026202}. Best is trial 1464 with value: 0.8990825688073395.
[32m[I 2023-04-21 00:40:49,186][39m Trial 4760 finished with value: 0.8727272727272727 and parameters: {'objective': 'Logloss', 'colsample_bylevel': 0.09153344351516586, 'depth': 7, 'boosting_type': 'Plain', 'bootstrap_type': 'Bayesian', 'bagging_temperature': 5.800125542928227}. Best is trial 1464 with value: 0.8990825688073395.
[32m[I 2023-04-21 00:40:51,407][39m Trial 4761 finished with value: 0.8807339449541284 and parameters: {'objective': 'Logloss', 'colsample_bylevel': 0.09228454548300848, 'depth': 8, 'boosting_type': 'Plain', 'bootstrap_type': 'Bayesian', 'bagging_temperature': 4.992361423087857}. Best is trial 1464 with value: 0.8990825688073395.
[32m[I 2023-04-21 00:40:52,181][39m Trial 4762 finished with value: 0.8571428571428572 and parameters: {'objective': 'Logloss', 'colsample_bylevel': 0.0882300493293597, 'depth': 12, 'boosting_type': 'Plain', 'bootstrap_type': 'MVS'}. Best is trial 1464 with value: 0.8990825688073395.
[32m[I 2023-04-21 00:40:54,057][39m Trial 4763 finished with value: 0.8807339449541284 and parameters: {'objective': 'CrossEntropy', 'colsample_bylevel': 0.09965878484606684, 'depth': 9, 'boosting_type': 'Plain', 'bootstrap_type': 'Bayesian', 'bagging_temperature': 4.672524241851437}. Best is trial 1464 with value: 0.8990825688073395.
[32m[I 2023-04-21 00:40:54,982][39m Trial 4764 finished with value: 0.888888888888889 and parameters: {'objective': 'Logloss', 'colsample_bylevel': 0.09676650860792385, 'depth': 11, 'boosting_type': 'Plain', 'bootstrap_type': 'Bayesian', 'bagging_temperature': 5.634389751870031}. Best is trial 1464 with value: 0.8990825688073395.
[32m[I 2023-04-21 00:40:55,709][39m Trial 4765 finished with value: 0.8545454545454546 and parameters: {'objective': 'Logloss', 'colsample_bylevel': 0.08893436001965782, 'depth': 12, 'boosting_type': 'Plain', 'bootstrap_type': 'Bayesian', 'bagging_temperature': 5.118052397925693}. Best is trial 1464 with value: 0.8990825688073395.
[32m[I 2023-04-21 00:40:56,616][39m Trial 4766 finished with value: 0.8275862068965517 and parameters: {'objective': 'Logloss', 'colsample_bylevel': 0.0632317320220996, 'depth': 12, 'boosting_type': 'Plain', 'bootstrap_type': 'Bayesian', 'bagging_temperature': 2.988398456944935}. Best is trial 1464 with value: 0.8990825688073395.
[32m[I 2023-04-21 00:41:01,985][39m Trial 4767 finished with value: 0.8495575221238938 and parameters: {'objective': 'Logloss', 'colsample_bylevel': 0.09695264113651504, 'depth': 12, 'boosting_type': 'Ordered', 'bootstrap_type': 'Bayesian', 'bagging_temperature': 7.3118645969720335}. Best is trial 1464 with value: 0.8990825688073395.
[32m[I 2023-04-21 00:41:03,369][39m Trial 4768 finished with value: 0.8545454545454546 and parameters: {'objective': 'Logloss', 'colsample_bylevel': 0.09858766880466636, 'depth': 12, 'boosting_type': 'Plain', 'bootstrap_type': 'Bayesian', 'bagging_temperature': 3.6774345730672273}. Best is trial 1464 with value: 0.8990825688073395.
[32m[I 2023-04-21 00:41:04,542][39m Trial 4769 finished with value: 0.8347826086956522 and parameters: {'objective': 'Logloss', 'colsample_bylevel': 0.07730185372266489, 'depth': 12, 'boosting_type': 'Plain', 'bootstrap_type': 'Bayesian', 'bagging_temperature': 4.05802944435094}. Best is trial 1464 with value: 0.8990825688073395.
[32m[I 2023-04-21 00:41:05,763][39m Trial 4770 finished with value: 0.8347826086956522 and parameters: {'objective': 'CrossEntropy', 'colsample_bylevel': 0.05311039167707956, 'depth': 12, 'boosting_type': 'Plain', 'bootstrap_type': 'Bayesian', 'bagging_temperature': 5.573282233737048}. Best is trial 1464 with value: 0.8990825688073395.
[32m[I 2023-04-21 00:41:06,436][39m Trial 4771 finished with value: 0.8807339449541284 and parameters: {'objective': 'CrossEntropy', 'colsample_bylevel': 0.08642085131213909, 'depth': 12, 'boosting_type': 'Plain', 'bootstrap_type': 'Bayesian', 'bagging_temperature': 4.466862376106084}. Best is trial 1464 with value: 0.8990825688073395.
[32m[I 2023-04-21 00:41:07,696][39m Trial 4772 finished with value: 0.8623853211009175 and parameters: {'objective': 'Logloss', 'colsample_bylevel': 0.09361535334928363, 'depth': 11, 'boosting_type': 'Plain', 'bootstrap_type': 'Bayesian', 'bagging_temperature': 6.431297763121756}. Best is trial 1464 with value: 0.8990825688073395.
[32m[I 2023-04-21 00:41:09,108][39m Trial 4773 finished with value: 0.8727272727272727 and parameters: {'objective': 'CrossEntropy', 'colsample_bylevel': 0.08504837106492072, 'depth': 12, 'boosting_type': 'Plain', 'bootstrap_type': 'Bayesian', 'bagging_temperature': 6.875122913157442}. Best is trial 1464 with value: 0.8990825688073395.
[32m[I 2023-04-21 00:41:10,124][39m Trial 4774 finished with value: 0.875 and parameters: {'objective': 'Logloss', 'colsample_bylevel': 0.09033076190240312, 'depth': 10, 'boosting_type': 'Plain', 'bootstrap_type': 'Bayesian', 'bagging_temperature': 6.23677715789007}. Best is trial 1464 with value: 0.8990825688073395.
[32m[I 2023-04-21 00:41:10,934][39m Trial 4775 finished with value: 0.8828828828828829 and parameters: {'objective': 'Logloss', 'colsample_bylevel': 0.09621875535101103, 'depth': 6, 'boosting_type': 'Plain', 'bootstrap_type': 'Bayesian', 'bagging_temperature': 5.631366483107568}. Best is trial 1464 with value: 0.8990825688073395.
[32m[I 2023-04-21 00:41:12,261][39m Trial 4776 finished with value: 0.8571428571428572 and parameters: {'objective': 'CrossEntropy', 'colsample_bylevel': 0.08281190848173146, 'depth': 12, 'boosting_type': 'Plain', 'bootstrap_type': 'Bayesian', 'bagging_temperature': 7.070520472887221}. Best is trial 1464 with value: 0.8990825688073395.
[32m[I 2023-04-21 00:41:13,113][39m Trial 4777 finished with value: 0.8495575221238938 and parameters: {'objective': 'CrossEntropy', 'colsample_bylevel': 0.06914155366573224, 'depth': 11, 'boosting_type': 'Plain', 'bootstrap_type': 'Bayesian', 'bagging_temperature': 6.6926548752871495}. Best is trial 1464 with value: 0.8990825688073395.
[32m[I 2023-04-21 00:41:14,124][39m Trial 4778 finished with value: 0.888888888888889 and parameters: {'objective': 'CrossEntropy', 'colsample_bylevel': 0.08523257453015748, 'depth': 9, 'boosting_type': 'Plain', 'bootstrap_type': 'Bayesian', 'bagging_temperature': 4.82199468847869}. Best is trial 1464 with value: 0.8990825688073395.
[32m[I 2023-04-21 00:41:14,976][39m Trial 4779 finished with value: 0.8727272727272727 and parameters: {'objective': 'CrossEntropy', 'colsample_bylevel': 0.08936843052741839, 'depth': 11, 'boosting_type': 'Plain', 'bootstrap_type': 'Bayesian', 'bagging_temperature': 5.919597493041328}. Best is trial 1464 with value: 0.8990825688073395.
[32m[I 2023-04-21 00:41:16,442][39m Trial 4780 finished with value: 0.8571428571428572 and parameters: {'objective': 'Logloss', 'colsample_bylevel': 0.09755293574706478, 'depth': 6, 'boosting_type': 'Plain', 'bootstrap_type': 'Bernoulli', 'subsample': 0.17806488150455163}. Best is trial 1464 with value: 0.8990825688073395.
[32m[I 2023-04-21 00:41:17,579][39m Trial 4781 finished with value: 0.8305084745762712 and parameters: {'objective': 'Logloss', 'colsample_bylevel': 0.09442058316776225, 'depth': 3, 'boosting_type': 'Plain', 'bootstrap_type': 'Bayesian', 'bagging_temperature': 5.41578135748007}. Best is trial 1464 with value: 0.8990825688073395.
[32m[I 2023-04-21 00:41:19,216][39m Trial 4782 finished with value: 0.8421052631578947 and parameters: {'objective': 'CrossEntropy', 'colsample_bylevel': 0.0842031139746343, 'depth': 9, 'boosting_type': 'Plain', 'bootstrap_type': 'MVS'}. Best is trial 1464 with value: 0.8990825688073395.
[32m[I 2023-04-21 00:41:20,375][39m Trial 4783 finished with value: 0.8545454545454546 and parameters: {'objective': 'CrossEntropy', 'colsample_bylevel': 0.08733593678687149, 'depth': 12, 'boosting_type': 'Plain', 'bootstrap_type': 'Bayesian', 'bagging_temperature': 4.914472449005984}. Best is trial 1464 with value: 0.8990825688073395.
[32m[I 2023-04-21 00:41:25,108][39m Trial 4784 finished with value: 0.8347826086956522 and parameters: {'objective': 'Logloss', 'colsample_bylevel': 0.09524025085389612, 'depth': 11, 'boosting_type': 'Ordered', 'bootstrap_type': 'Bayesian', 'bagging_temperature': 7.0665475152822355}. Best is trial 1464 with value: 0.8990825688073395.
[32m[I 2023-04-21 00:41:26,376][39m Trial 4785 finished with value: 0.888888888888889 and parameters: {'objective': 'CrossEntropy', 'colsample_bylevel': 0.08734057640211146, 'depth': 12, 'boosting_type': 'Plain', 'bootstrap_type': 'Bayesian', 'bagging_temperature': 5.936087642902755}. Best is trial 1464 with value: 0.8990825688073395.
[32m[I 2023-04-21 00:41:27,427][39m Trial 4786 finished with value: 0.888888888888889 and parameters: {'objective': 'CrossEntropy', 'colsample_bylevel': 0.09179730958934555, 'depth': 11, 'boosting_type': 'Plain', 'bootstrap_type': 'Bayesian', 'bagging_temperature': 4.209511924310836}. Best is trial 1464 with value: 0.8990825688073395.
[32m[I 2023-04-21 00:41:28,525][39m Trial 4787 finished with value: 0.8807339449541284 and parameters: {'objective': 'CrossEntropy', 'colsample_bylevel': 0.09174883636571733, 'depth': 11, 'boosting_type': 'Plain', 'bootstrap_type': 'Bayesian', 'bagging_temperature': 4.299783708726308}. Best is trial 1464 with value: 0.8990825688073395.
[32m[I 2023-04-21 00:41:29,515][39m Trial 4788 finished with value: 0.8785046728971961 and parameters: {'objective': 'Logloss', 'colsample_bylevel': 0.08998991829952949, 'depth': 11, 'boosting_type': 'Plain', 'bootstrap_type': 'Bayesian', 'bagging_temperature': 4.475500481966946}. Best is trial 1464 with value: 0.8990825688073395.
[32m[I 2023-04-21 00:41:30,696][39m Trial 4789 finished with value: 0.8571428571428572 and parameters: {'objective': 'CrossEntropy', 'colsample_bylevel': 0.08858301683781575, 'depth': 12, 'boosting_type': 'Plain', 'bootstrap_type': 'Bayesian', 'bagging_temperature': 5.253265896948761}. Best is trial 1464 with value: 0.8990825688073395.
[32m[I 2023-04-21 00:41:31,951][39m Trial 4790 finished with value: 0.8703703703703703 and parameters: {'objective': 'CrossEntropy', 'colsample_bylevel': 0.08977306858923059, 'depth': 10, 'boosting_type': 'Plain', 'bootstrap_type': 'Bayesian', 'bagging_temperature': 3.56705931611517}. Best is trial 1464 with value: 0.8990825688073395.
[32m[I 2023-04-21 00:41:33,211][39m Trial 4791 finished with value: 0.8807339449541284 and parameters: {'objective': 'Logloss', 'colsample_bylevel': 0.08917379709910025, 'depth': 11, 'boosting_type': 'Plain', 'bootstrap_type': 'Bayesian', 'bagging_temperature': 5.421742741538819}. Best is trial 1464 with value: 0.8990825688073395.
[32m[I 2023-04-21 00:41:34,244][39m Trial 4792 finished with value: 0.8807339449541284 and parameters: {'objective': 'Logloss', 'colsample_bylevel': 0.09582639023696328, 'depth': 7, 'boosting_type': 'Plain', 'bootstrap_type': 'Bayesian', 'bagging_temperature': 5.6417964666650535}. Best is trial 1464 with value: 0.8990825688073395.
[32m[I 2023-04-21 00:41:34,940][39m Trial 4793 finished with value: 0.875 and parameters: {'objective': 'Logloss', 'colsample_bylevel': 0.09790877287690847, 'depth': 7, 'boosting_type': 'Plain', 'bootstrap_type': 'Bayesian', 'bagging_temperature': 3.294258030139542}. Best is trial 1464 with value: 0.8990825688073395.
[32m[I 2023-04-21 00:41:35,777][39m Trial 4794 finished with value: 0.8807339449541284 and parameters: {'objective': 'CrossEntropy', 'colsample_bylevel': 0.09645334249713042, 'depth': 12, 'boosting_type': 'Plain', 'bootstrap_type': 'Bayesian', 'bagging_temperature': 5.8882068789133255}. Best is trial 1464 with value: 0.8990825688073395.
[32m[I 2023-04-21 00:41:36,950][39m Trial 4795 finished with value: 0.8807339449541284 and parameters: {'objective': 'CrossEntropy', 'colsample_bylevel': 0.08702854374391515, 'depth': 11, 'boosting_type': 'Plain', 'bootstrap_type': 'Bayesian', 'bagging_temperature': 3.6226094868596865}. Best is trial 1464 with value: 0.8990825688073395.
[32m[I 2023-04-21 00:41:38,035][39m Trial 4796 finished with value: 0.888888888888889 and parameters: {'objective': 'CrossEntropy', 'colsample_bylevel': 0.08680702168180768, 'depth': 11, 'boosting_type': 'Plain', 'bootstrap_type': 'Bayesian', 'bagging_temperature': 4.393330290948914}. Best is trial 1464 with value: 0.8990825688073395.
[32m[I 2023-04-21 00:41:39,407][39m Trial 4797 finished with value: 0.8828828828828829 and parameters: {'objective': 'Logloss', 'colsample_bylevel': 0.09047812949888484, 'depth': 10, 'boosting_type': 'Plain', 'bootstrap_type': 'Bayesian', 'bagging_temperature': 5.201299908583619}. Best is trial 1464 with value: 0.8990825688073395.
[32m[I 2023-04-21 00:41:40,444][39m Trial 4798 finished with value: 0.875 and parameters: {'objective': 'CrossEntropy', 'colsample_bylevel': 0.08554945423376145, 'depth': 11, 'boosting_type': 'Plain', 'bootstrap_type': 'Bayesian', 'bagging_temperature': 4.089122774988168}. Best is trial 1464 with value: 0.8990825688073395.
[32m[I 2023-04-21 00:41:41,194][39m Trial 4799 finished with value: 0.8672566371681416 and parameters: {'objective': 'Logloss', 'colsample_bylevel': 0.08716595249667329, 'depth': 12, 'boosting_type': 'Plain', 'bootstrap_type': 'Bayesian', 'bagging_temperature': 5.676693873416762}. Best is trial 1464 with value: 0.8990825688073395.
[32m[I 2023-04-21 00:41:42,426][39m Trial 4800 finished with value: 0.8495575221238938 and parameters: {'objective': 'Logloss', 'colsample_bylevel': 0.0780483176354759, 'depth': 12, 'boosting_type': 'Plain', 'bootstrap_type': 'Bayesian', 'bagging_temperature': 4.900719057660941}. Best is trial 1464 with value: 0.8990825688073395.
[32m[I 2023-04-21 00:41:43,132][39m Trial 4801 finished with value: 0.8648648648648648 and parameters: {'objective': 'Logloss', 'colsample_bylevel': 0.0894417773325274, 'depth': 10, 'boosting_type': 'Plain', 'bootstrap_type': 'Bernoulli', 'subsample': 0.8379742666529131}. Best is trial 1464 with value: 0.8990825688073395.
[32m[I 2023-04-21 00:41:44,222][39m Trial 4802 finished with value: 0.8727272727272727 and parameters: {'objective': 'Logloss', 'colsample_bylevel': 0.09454607067269018, 'depth': 7, 'boosting_type': 'Plain', 'bootstrap_type': 'Bayesian', 'bagging_temperature': 6.835850297134379}. Best is trial 1464 with value: 0.8990825688073395.
[32m[I 2023-04-21 00:41:49,647][39m Trial 4803 finished with value: 0.8421052631578947 and parameters: {'objective': 'Logloss', 'colsample_bylevel': 0.09348471163014857, 'depth': 9, 'boosting_type': 'Ordered', 'bootstrap_type': 'MVS'}. Best is trial 1464 with value: 0.8990825688073395.
[32m[I 2023-04-21 00:41:51,095][39m Trial 4804 finished with value: 0.8807339449541284 and parameters: {'objective': 'CrossEntropy', 'colsample_bylevel': 0.09143652583934749, 'depth': 12, 'boosting_type': 'Plain', 'bootstrap_type': 'Bayesian', 'bagging_temperature': 7.753491025530293}. Best is trial 1464 with value: 0.8990825688073395.
[32m[I 2023-04-21 00:41:52,296][39m Trial 4805 finished with value: 0.8807339449541284 and parameters: {'objective': 'CrossEntropy', 'colsample_bylevel': 0.08610227570070353, 'depth': 11, 'boosting_type': 'Plain', 'bootstrap_type': 'Bayesian', 'bagging_temperature': 5.516781114292961}. Best is trial 1464 with value: 0.8990825688073395.
