[32m[I 2023-04-20 23:25:06,680][39m Trial 1325 finished with value: 0.8421052631578947 and parameters: {'objective': 'CrossEntropy', 'colsample_bylevel': 0.08891057984074299, 'depth': 7, 'boosting_type': 'Plain', 'bootstrap_type': 'MVS'}. Best is trial 205 with value: 0.890909090909091.
[32m[I 2023-04-20 23:25:07,851][39m Trial 1326 finished with value: 0.8807339449541284 and parameters: {'objective': 'Logloss', 'colsample_bylevel': 0.09800155231650376, 'depth': 8, 'boosting_type': 'Plain', 'bootstrap_type': 'Bayesian', 'bagging_temperature': 6.2740935943526726}. Best is trial 205 with value: 0.890909090909091.
[32m[I 2023-04-20 23:25:09,089][39m Trial 1327 finished with value: 0.8807339449541284 and parameters: {'objective': 'Logloss', 'colsample_bylevel': 0.09692552946705883, 'depth': 11, 'boosting_type': 'Plain', 'bootstrap_type': 'Bayesian', 'bagging_temperature': 4.4736354890745025}. Best is trial 205 with value: 0.890909090909091.
[32m[I 2023-04-20 23:25:09,881][39m Trial 1328 finished with value: 0.8807339449541284 and parameters: {'objective': 'CrossEntropy', 'colsample_bylevel': 0.09280042178794658, 'depth': 10, 'boosting_type': 'Plain', 'bootstrap_type': 'Bayesian', 'bagging_temperature': 3.352995828913083}. Best is trial 205 with value: 0.890909090909091.
[32m[I 2023-04-20 23:25:10,962][39m Trial 1329 finished with value: 0.8703703703703703 and parameters: {'objective': 'Logloss', 'colsample_bylevel': 0.09804264441076513, 'depth': 7, 'boosting_type': 'Plain', 'bootstrap_type': 'Bayesian', 'bagging_temperature': 6.428651166545162}. Best is trial 205 with value: 0.890909090909091.
[32m[I 2023-04-20 23:25:11,789][39m Trial 1330 finished with value: 0.8448275862068967 and parameters: {'objective': 'Logloss', 'colsample_bylevel': 0.08156341211647432, 'depth': 5, 'boosting_type': 'Plain', 'bootstrap_type': 'Bayesian', 'bagging_temperature': 9.821828490819264}. Best is trial 205 with value: 0.890909090909091.
[32m[I 2023-04-20 23:25:13,201][39m Trial 1331 finished with value: 0.875 and parameters: {'objective': 'Logloss', 'colsample_bylevel': 0.09443964152675281, 'depth': 9, 'boosting_type': 'Plain', 'bootstrap_type': 'Bayesian', 'bagging_temperature': 4.8667662427785645}. Best is trial 205 with value: 0.890909090909091.
[32m[I 2023-04-20 23:25:14,009][39m Trial 1332 finished with value: 0.8347826086956522 and parameters: {'objective': 'Logloss', 'colsample_bylevel': 0.09778225628789684, 'depth': 4, 'boosting_type': 'Plain', 'bootstrap_type': 'Bayesian', 'bagging_temperature': 5.018550326719178}. Best is trial 205 with value: 0.890909090909091.
[32m[I 2023-04-20 23:25:14,854][39m Trial 1333 finished with value: 0.8727272727272727 and parameters: {'objective': 'CrossEntropy', 'colsample_bylevel': 0.09245021683006267, 'depth': 11, 'boosting_type': 'Plain', 'bootstrap_type': 'Bayesian', 'bagging_temperature': 6.046046722857707}. Best is trial 205 with value: 0.890909090909091.
[32m[I 2023-04-20 23:25:15,900][39m Trial 1334 finished with value: 0.8807339449541284 and parameters: {'objective': 'CrossEntropy', 'colsample_bylevel': 0.09113574026719494, 'depth': 10, 'boosting_type': 'Plain', 'bootstrap_type': 'Bayesian', 'bagging_temperature': 5.332781540896971}. Best is trial 205 with value: 0.890909090909091.
[32m[I 2023-04-20 23:25:16,789][39m Trial 1335 finished with value: 0.8495575221238938 and parameters: {'objective': 'CrossEntropy', 'colsample_bylevel': 0.09303316904748207, 'depth': 10, 'boosting_type': 'Plain', 'bootstrap_type': 'Bernoulli', 'subsample': 0.9966350351897433}. Best is trial 205 with value: 0.890909090909091.
[32m[I 2023-04-20 23:25:17,910][39m Trial 1336 finished with value: 0.8571428571428572 and parameters: {'objective': 'Logloss', 'colsample_bylevel': 0.0953854532386798, 'depth': 8, 'boosting_type': 'Plain', 'bootstrap_type': 'Bayesian', 'bagging_temperature': 4.579684839207096}. Best is trial 205 with value: 0.890909090909091.
[32m[I 2023-04-20 23:25:18,658][39m Trial 1337 finished with value: 0.8828828828828829 and parameters: {'objective': 'CrossEntropy', 'colsample_bylevel': 0.09560581807348785, 'depth': 10, 'boosting_type': 'Plain', 'bootstrap_type': 'Bayesian', 'bagging_temperature': 4.7070334699810195}. Best is trial 205 with value: 0.890909090909091.
[32m[I 2023-04-20 23:25:19,849][39m Trial 1338 finished with value: 0.8672566371681416 and parameters: {'objective': 'CrossEntropy', 'colsample_bylevel': 0.09680916522223718, 'depth': 9, 'boosting_type': 'Plain', 'bootstrap_type': 'Bayesian', 'bagging_temperature': 0.23142412444541183}. Best is trial 205 with value: 0.890909090909091.
[32m[I 2023-04-20 23:25:20,610][39m Trial 1339 finished with value: 0.8807339449541284 and parameters: {'objective': 'Logloss', 'colsample_bylevel': 0.09968259202439078, 'depth': 11, 'boosting_type': 'Plain', 'bootstrap_type': 'Bayesian', 'bagging_temperature': 5.030115399489735}. Best is trial 205 with value: 0.890909090909091.
[32m[I 2023-04-20 23:25:26,042][39m Trial 1340 finished with value: 0.8421052631578947 and parameters: {'objective': 'Logloss', 'colsample_bylevel': 0.09845907927765885, 'depth': 11, 'boosting_type': 'Ordered', 'bootstrap_type': 'Bayesian', 'bagging_temperature': 4.7611378029696745}. Best is trial 205 with value: 0.890909090909091.
[32m[I 2023-04-20 23:25:27,229][39m Trial 1341 finished with value: 0.8828828828828829 and parameters: {'objective': 'CrossEntropy', 'colsample_bylevel': 0.09367025924542112, 'depth': 9, 'boosting_type': 'Plain', 'bootstrap_type': 'Bayesian', 'bagging_temperature': 4.142160005979947}. Best is trial 205 with value: 0.890909090909091.
[32m[I 2023-04-20 23:25:28,244][39m Trial 1342 finished with value: 0.888888888888889 and parameters: {'objective': 'CrossEntropy', 'colsample_bylevel': 0.09417444821352385, 'depth': 10, 'boosting_type': 'Plain', 'bootstrap_type': 'Bayesian', 'bagging_temperature': 5.709221871500903}. Best is trial 205 with value: 0.890909090909091.
[32m[I 2023-04-20 23:25:29,045][39m Trial 1343 finished with value: 0.8807339449541284 and parameters: {'objective': 'CrossEntropy', 'colsample_bylevel': 0.09298106151956978, 'depth': 10, 'boosting_type': 'Plain', 'bootstrap_type': 'Bayesian', 'bagging_temperature': 5.580571063894614}. Best is trial 205 with value: 0.890909090909091.
[32m[I 2023-04-20 23:25:29,745][39m Trial 1344 finished with value: 0.8495575221238938 and parameters: {'objective': 'Logloss', 'colsample_bylevel': 0.09045610199333283, 'depth': 10, 'boosting_type': 'Plain', 'bootstrap_type': 'MVS'}. Best is trial 205 with value: 0.890909090909091.
[32m[I 2023-04-20 23:25:31,926][39m Trial 1345 finished with value: 0.8727272727272727 and parameters: {'objective': 'Logloss', 'colsample_bylevel': 0.09518391479085694, 'depth': 8, 'boosting_type': 'Plain', 'bootstrap_type': 'Bayesian', 'bagging_temperature': 3.5898209429703423}. Best is trial 205 with value: 0.890909090909091.
[32m[I 2023-04-20 23:25:32,552][39m Trial 1346 finished with value: 0.8672566371681416 and parameters: {'objective': 'Logloss', 'colsample_bylevel': 0.09583209923034103, 'depth': 7, 'boosting_type': 'Plain', 'bootstrap_type': 'Bayesian', 'bagging_temperature': 8.716242581280868}. Best is trial 205 with value: 0.890909090909091.
[32m[I 2023-04-20 23:25:33,597][39m Trial 1347 finished with value: 0.8807339449541284 and parameters: {'objective': 'Logloss', 'colsample_bylevel': 0.0957014789155137, 'depth': 12, 'boosting_type': 'Plain', 'bootstrap_type': 'Bayesian', 'bagging_temperature': 8.160109170821205}. Best is trial 205 with value: 0.890909090909091.
[32m[I 2023-04-20 23:25:34,718][39m Trial 1348 finished with value: 0.8727272727272727 and parameters: {'objective': 'Logloss', 'colsample_bylevel': 0.09593882735186078, 'depth': 11, 'boosting_type': 'Plain', 'bootstrap_type': 'Bayesian', 'bagging_temperature': 4.924838295998123}. Best is trial 205 with value: 0.890909090909091.
[32m[I 2023-04-20 23:25:35,501][39m Trial 1349 finished with value: 0.8648648648648648 and parameters: {'objective': 'Logloss', 'colsample_bylevel': 0.09276695579573929, 'depth': 9, 'boosting_type': 'Plain', 'bootstrap_type': 'Bayesian', 'bagging_temperature': 1.3464107738632403}. Best is trial 205 with value: 0.890909090909091.
[32m[I 2023-04-20 23:25:36,370][39m Trial 1350 finished with value: 0.8648648648648648 and parameters: {'objective': 'Logloss', 'colsample_bylevel': 0.09486871137461436, 'depth': 8, 'boosting_type': 'Plain', 'bootstrap_type': 'Bayesian', 'bagging_temperature': 3.217860848491121}. Best is trial 205 with value: 0.890909090909091.
[32m[I 2023-04-20 23:25:37,982][39m Trial 1351 finished with value: 0.888888888888889 and parameters: {'objective': 'Logloss', 'colsample_bylevel': 0.09846690670319712, 'depth': 9, 'boosting_type': 'Plain', 'bootstrap_type': 'Bayesian', 'bagging_temperature': 4.167231995210269}. Best is trial 205 with value: 0.890909090909091.
[32m[I 2023-04-20 23:25:38,901][39m Trial 1352 finished with value: 0.8807339449541284 and parameters: {'objective': 'Logloss', 'colsample_bylevel': 0.09978315591008302, 'depth': 8, 'boosting_type': 'Plain', 'bootstrap_type': 'Bayesian', 'bagging_temperature': 5.4606079431778305}. Best is trial 205 with value: 0.890909090909091.
[32m[I 2023-04-20 23:25:39,588][39m Trial 1353 finished with value: 0.8448275862068967 and parameters: {'objective': 'Logloss', 'colsample_bylevel': 0.06181035655105005, 'depth': 9, 'boosting_type': 'Plain', 'bootstrap_type': 'Bayesian', 'bagging_temperature': 4.395579040993621}. Best is trial 205 with value: 0.890909090909091.
[32m[I 2023-04-20 23:25:41,111][39m Trial 1354 finished with value: 0.8648648648648648 and parameters: {'objective': 'Logloss', 'colsample_bylevel': 0.08752373241028111, 'depth': 9, 'boosting_type': 'Plain', 'bootstrap_type': 'Bayesian', 'bagging_temperature': 4.678216523400391}. Best is trial 205 with value: 0.890909090909091.
[32m[I 2023-04-20 23:25:42,511][39m Trial 1355 finished with value: 0.8623853211009175 and parameters: {'objective': 'CrossEntropy', 'colsample_bylevel': 0.0982423825654664, 'depth': 9, 'boosting_type': 'Plain', 'bootstrap_type': 'Bayesian', 'bagging_temperature': 0.8504730336675541}. Best is trial 205 with value: 0.890909090909091.
[32m[I 2023-04-20 23:25:43,071][39m Trial 1356 finished with value: 0.7704918032786885 and parameters: {'objective': 'CrossEntropy', 'colsample_bylevel': 0.017549293986350092, 'depth': 6, 'boosting_type': 'Plain', 'bootstrap_type': 'Bayesian', 'bagging_temperature': 4.883343511620771}. Best is trial 205 with value: 0.890909090909091.
[32m[I 2023-04-20 23:25:44,378][39m Trial 1357 finished with value: 0.8727272727272727 and parameters: {'objective': 'CrossEntropy', 'colsample_bylevel': 0.09767337256947936, 'depth': 10, 'boosting_type': 'Plain', 'bootstrap_type': 'Bayesian', 'bagging_temperature': 5.552076048927783}. Best is trial 205 with value: 0.890909090909091.
[32m[I 2023-04-20 23:25:45,018][39m Trial 1358 finished with value: 0.8807339449541284 and parameters: {'objective': 'Logloss', 'colsample_bylevel': 0.09419592140581093, 'depth': 6, 'boosting_type': 'Plain', 'bootstrap_type': 'Bayesian', 'bagging_temperature': 4.359297590837121}. Best is trial 205 with value: 0.890909090909091.
[32m[I 2023-04-20 23:25:50,318][39m Trial 1359 finished with value: 0.8421052631578947 and parameters: {'objective': 'Logloss', 'colsample_bylevel': 0.09565010948991512, 'depth': 10, 'boosting_type': 'Ordered', 'bootstrap_type': 'Bernoulli', 'subsample': 0.8882108652398069}. Best is trial 205 with value: 0.890909090909091.
[32m[I 2023-04-20 23:25:51,128][39m Trial 1360 finished with value: 0.888888888888889 and parameters: {'objective': 'CrossEntropy', 'colsample_bylevel': 0.09400786439531594, 'depth': 11, 'boosting_type': 'Plain', 'bootstrap_type': 'Bayesian', 'bagging_temperature': 4.490502874052463}. Best is trial 205 with value: 0.890909090909091.
[32m[I 2023-04-20 23:25:52,497][39m Trial 1361 finished with value: 0.8727272727272727 and parameters: {'objective': 'Logloss', 'colsample_bylevel': 0.0965542334671255, 'depth': 7, 'boosting_type': 'Plain', 'bootstrap_type': 'Bayesian', 'bagging_temperature': 6.352866263137923}. Best is trial 205 with value: 0.890909090909091.
[32m[I 2023-04-20 23:25:53,025][39m Trial 1362 finished with value: 0.8703703703703703 and parameters: {'objective': 'CrossEntropy', 'colsample_bylevel': 0.0999574205252565, 'depth': 11, 'boosting_type': 'Plain', 'bootstrap_type': 'Bayesian', 'bagging_temperature': 4.0109864465626215}. Best is trial 205 with value: 0.890909090909091.
[32m[I 2023-04-20 23:25:53,928][39m Trial 1363 finished with value: 0.8468468468468469 and parameters: {'objective': 'Logloss', 'colsample_bylevel': 0.08945002336189055, 'depth': 10, 'boosting_type': 'Plain', 'bootstrap_type': 'Bayesian', 'bagging_temperature': 4.254602606467766}. Best is trial 205 with value: 0.890909090909091.
[32m[I 2023-04-20 23:25:55,187][39m Trial 1364 finished with value: 0.8648648648648648 and parameters: {'objective': 'CrossEntropy', 'colsample_bylevel': 0.0871830593522781, 'depth': 10, 'boosting_type': 'Plain', 'bootstrap_type': 'Bayesian', 'bagging_temperature': 3.848991119723398}. Best is trial 205 with value: 0.890909090909091.
[32m[I 2023-04-20 23:25:56,358][39m Trial 1365 finished with value: 0.8727272727272727 and parameters: {'objective': 'Logloss', 'colsample_bylevel': 0.09739663597803255, 'depth': 11, 'boosting_type': 'Plain', 'bootstrap_type': 'Bayesian', 'bagging_temperature': 5.686388711693203}. Best is trial 205 with value: 0.890909090909091.
[32m[I 2023-04-20 23:25:57,024][39m Trial 1366 finished with value: 0.8495575221238938 and parameters: {'objective': 'Logloss', 'colsample_bylevel': 0.09531066562263488, 'depth': 10, 'boosting_type': 'Plain', 'bootstrap_type': 'MVS'}. Best is trial 205 with value: 0.890909090909091.
[32m[I 2023-04-20 23:25:58,029][39m Trial 1367 finished with value: 0.8495575221238938 and parameters: {'objective': 'CrossEntropy', 'colsample_bylevel': 0.07463597036709672, 'depth': 12, 'boosting_type': 'Plain', 'bootstrap_type': 'Bayesian', 'bagging_temperature': 4.593755173371521}. Best is trial 205 with value: 0.890909090909091.
[32m[I 2023-04-20 23:25:58,775][39m Trial 1368 finished with value: 0.8305084745762712 and parameters: {'objective': 'Logloss', 'colsample_bylevel': 0.09870768611252759, 'depth': 1, 'boosting_type': 'Plain', 'bootstrap_type': 'Bayesian', 'bagging_temperature': 4.070310936578472}. Best is trial 205 with value: 0.890909090909091.
[32m[I 2023-04-20 23:26:00,042][39m Trial 1369 finished with value: 0.8727272727272727 and parameters: {'objective': 'Logloss', 'colsample_bylevel': 0.09693059611404316, 'depth': 8, 'boosting_type': 'Plain', 'bootstrap_type': 'Bayesian', 'bagging_temperature': 4.384455253492441}. Best is trial 205 with value: 0.890909090909091.
[32m[I 2023-04-20 23:26:01,589][39m Trial 1370 finished with value: 0.8623853211009175 and parameters: {'objective': 'Logloss', 'colsample_bylevel': 0.09837897618924049, 'depth': 9, 'boosting_type': 'Plain', 'bootstrap_type': 'Bayesian', 'bagging_temperature': 3.817130310788417}. Best is trial 205 with value: 0.890909090909091.
[32m[I 2023-04-20 23:26:02,303][39m Trial 1371 finished with value: 0.8648648648648648 and parameters: {'objective': 'Logloss', 'colsample_bylevel': 0.09968518256195216, 'depth': 7, 'boosting_type': 'Plain', 'bootstrap_type': 'Bayesian', 'bagging_temperature': 7.047555668016015}. Best is trial 205 with value: 0.890909090909091.
[32m[I 2023-04-20 23:26:03,017][39m Trial 1372 finished with value: 0.8807339449541284 and parameters: {'objective': 'Logloss', 'colsample_bylevel': 0.09990297284300774, 'depth': 8, 'boosting_type': 'Plain', 'bootstrap_type': 'Bayesian', 'bagging_temperature': 5.983436858893421}. Best is trial 205 with value: 0.890909090909091.
[32m[I 2023-04-20 23:26:03,998][39m Trial 1373 finished with value: 0.8347826086956522 and parameters: {'objective': 'CrossEntropy', 'colsample_bylevel': 0.0649091904298866, 'depth': 6, 'boosting_type': 'Plain', 'bootstrap_type': 'Bayesian', 'bagging_temperature': 1.9154125430681508}. Best is trial 205 with value: 0.890909090909091.
[32m[I 2023-04-20 23:26:05,145][39m Trial 1374 finished with value: 0.888888888888889 and parameters: {'objective': 'CrossEntropy', 'colsample_bylevel': 0.09974589256694123, 'depth': 9, 'boosting_type': 'Plain', 'bootstrap_type': 'Bayesian', 'bagging_temperature': 4.901636659085041}. Best is trial 205 with value: 0.890909090909091.
[32m[I 2023-04-20 23:26:06,511][39m Trial 1375 finished with value: 0.8672566371681416 and parameters: {'objective': 'CrossEntropy', 'colsample_bylevel': 0.09149350979058736, 'depth': 9, 'boosting_type': 'Plain', 'bootstrap_type': 'Bayesian', 'bagging_temperature': 2.3710105192808246}. Best is trial 205 with value: 0.890909090909091.
[32m[I 2023-04-20 23:26:07,536][39m Trial 1376 finished with value: 0.8807339449541284 and parameters: {'objective': 'Logloss', 'colsample_bylevel': 0.09527688891966274, 'depth': 6, 'boosting_type': 'Plain', 'bootstrap_type': 'Bayesian', 'bagging_temperature': 6.840781130522345}. Best is trial 205 with value: 0.890909090909091.
[32m[I 2023-04-20 23:26:12,003][39m Trial 1377 finished with value: 0.8376068376068375 and parameters: {'objective': 'CrossEntropy', 'colsample_bylevel': 0.04010096202078951, 'depth': 9, 'boosting_type': 'Ordered', 'bootstrap_type': 'Bayesian', 'bagging_temperature': 4.692261823859932}. Best is trial 205 with value: 0.890909090909091.
[32m[I 2023-04-20 23:26:13,164][39m Trial 1378 finished with value: 0.888888888888889 and parameters: {'objective': 'CrossEntropy', 'colsample_bylevel': 0.0973875622335914, 'depth': 12, 'boosting_type': 'Plain', 'bootstrap_type': 'Bernoulli', 'subsample': 0.10056201472899645}. Best is trial 205 with value: 0.890909090909091.
[32m[I 2023-04-20 23:26:14,464][39m Trial 1379 finished with value: 0.8727272727272727 and parameters: {'objective': 'Logloss', 'colsample_bylevel': 0.09803301817073411, 'depth': 8, 'boosting_type': 'Plain', 'bootstrap_type': 'Bayesian', 'bagging_temperature': 4.850508753842367}. Best is trial 205 with value: 0.890909090909091.
[32m[I 2023-04-20 23:26:15,481][39m Trial 1380 finished with value: 0.8807339449541284 and parameters: {'objective': 'CrossEntropy', 'colsample_bylevel': 0.09258135664716141, 'depth': 12, 'boosting_type': 'Plain', 'bootstrap_type': 'Bayesian', 'bagging_temperature': 4.511253798892207}. Best is trial 205 with value: 0.890909090909091.
[32m[I 2023-04-20 23:26:16,361][39m Trial 1381 finished with value: 0.888888888888889 and parameters: {'objective': 'Logloss', 'colsample_bylevel': 0.09893601778266697, 'depth': 8, 'boosting_type': 'Plain', 'bootstrap_type': 'Bayesian', 'bagging_temperature': 5.444197003545468}. Best is trial 205 with value: 0.890909090909091.
[32m[I 2023-04-20 23:26:17,054][39m Trial 1382 finished with value: 0.8648648648648648 and parameters: {'objective': 'CrossEntropy', 'colsample_bylevel': 0.09461539473100153, 'depth': 9, 'boosting_type': 'Plain', 'bootstrap_type': 'Bayesian', 'bagging_temperature': 4.499368356540242}. Best is trial 205 with value: 0.890909090909091.
[32m[I 2023-04-20 23:26:17,898][39m Trial 1383 finished with value: 0.8785046728971961 and parameters: {'objective': 'CrossEntropy', 'colsample_bylevel': 0.09694755608793112, 'depth': 12, 'boosting_type': 'Plain', 'bootstrap_type': 'Bayesian', 'bagging_temperature': 5.7892402477371165}. Best is trial 205 with value: 0.890909090909091.
[32m[I 2023-04-20 23:26:19,138][39m Trial 1384 finished with value: 0.8785046728971961 and parameters: {'objective': 'Logloss', 'colsample_bylevel': 0.09707305231599309, 'depth': 8, 'boosting_type': 'Plain', 'bootstrap_type': 'Bayesian', 'bagging_temperature': 4.134685921653951}. Best is trial 205 with value: 0.890909090909091.
[32m[I 2023-04-20 23:26:19,970][39m Trial 1385 finished with value: 0.8571428571428572 and parameters: {'objective': 'CrossEntropy', 'colsample_bylevel': 0.09704684920810727, 'depth': 6, 'boosting_type': 'Plain', 'bootstrap_type': 'Bayesian', 'bagging_temperature': 0.004497850404620252}. Best is trial 205 with value: 0.890909090909091.
[32m[I 2023-04-20 23:26:21,518][39m Trial 1386 finished with value: 0.8727272727272727 and parameters: {'objective': 'Logloss', 'colsample_bylevel': 0.09976827393071855, 'depth': 9, 'boosting_type': 'Plain', 'bootstrap_type': 'Bayesian', 'bagging_temperature': 5.046315460373173}. Best is trial 205 with value: 0.890909090909091.
[32m[I 2023-04-20 23:26:22,503][39m Trial 1387 finished with value: 0.8807339449541284 and parameters: {'objective': 'Logloss', 'colsample_bylevel': 0.09594934718768022, 'depth': 9, 'boosting_type': 'Plain', 'bootstrap_type': 'Bayesian', 'bagging_temperature': 6.317678490621855}. Best is trial 205 with value: 0.890909090909091.
[32m[I 2023-04-20 23:26:23,415][39m Trial 1388 finished with value: 0.8807339449541284 and parameters: {'objective': 'Logloss', 'colsample_bylevel': 0.09810945519463429, 'depth': 9, 'boosting_type': 'Plain', 'bootstrap_type': 'Bayesian', 'bagging_temperature': 4.7030552653870155}. Best is trial 205 with value: 0.890909090909091.
[32m[I 2023-04-20 23:26:24,449][39m Trial 1389 finished with value: 0.8807339449541284 and parameters: {'objective': 'Logloss', 'colsample_bylevel': 0.09995378869005332, 'depth': 8, 'boosting_type': 'Plain', 'bootstrap_type': 'Bayesian', 'bagging_temperature': 5.122700083056681}. Best is trial 205 with value: 0.890909090909091.
[32m[I 2023-04-20 23:26:25,228][39m Trial 1390 finished with value: 0.8727272727272727 and parameters: {'objective': 'Logloss', 'colsample_bylevel': 0.09501049950918547, 'depth': 12, 'boosting_type': 'Plain', 'bootstrap_type': 'Bayesian', 'bagging_temperature': 6.160329201361421}. Best is trial 205 with value: 0.890909090909091.
