[32m[I 2023-04-21 00:21:18,474][39m Trial 3887 finished with value: 0.888888888888889 and parameters: {'objective': 'Logloss', 'colsample_bylevel': 0.09478387334995463, 'depth': 8, 'boosting_type': 'Plain', 'bootstrap_type': 'Bayesian', 'bagging_temperature': 5.588399190595861}. Best is trial 1464 with value: 0.8990825688073395.
[32m[I 2023-04-21 00:21:19,501][39m Trial 3888 finished with value: 0.8807339449541284 and parameters: {'objective': 'CrossEntropy', 'colsample_bylevel': 0.09211544036195293, 'depth': 7, 'boosting_type': 'Plain', 'bootstrap_type': 'Bayesian', 'bagging_temperature': 7.308663245803034}. Best is trial 1464 with value: 0.8990825688073395.
[32m[I 2023-04-21 00:21:20,839][39m Trial 3889 finished with value: 0.8727272727272727 and parameters: {'objective': 'Logloss', 'colsample_bylevel': 0.09209951419099943, 'depth': 9, 'boosting_type': 'Plain', 'bootstrap_type': 'Bayesian', 'bagging_temperature': 5.85593090102558}. Best is trial 1464 with value: 0.8990825688073395.
[32m[I 2023-04-21 00:21:21,992][39m Trial 3890 finished with value: 0.8807339449541284 and parameters: {'objective': 'CrossEntropy', 'colsample_bylevel': 0.09058402497194909, 'depth': 9, 'boosting_type': 'Plain', 'bootstrap_type': 'Bayesian', 'bagging_temperature': 5.2396839892214215}. Best is trial 1464 with value: 0.8990825688073395.
[32m[I 2023-04-21 00:21:22,909][39m Trial 3891 finished with value: 0.8703703703703703 and parameters: {'objective': 'CrossEntropy', 'colsample_bylevel': 0.09194452207643102, 'depth': 9, 'boosting_type': 'Plain', 'bootstrap_type': 'Bayesian', 'bagging_temperature': 5.622886471647154}. Best is trial 1464 with value: 0.8990825688073395.
[32m[I 2023-04-21 00:21:23,702][39m Trial 3892 finished with value: 0.8648648648648648 and parameters: {'objective': 'CrossEntropy', 'colsample_bylevel': 0.09207612219862168, 'depth': 9, 'boosting_type': 'Plain', 'bootstrap_type': 'Bayesian', 'bagging_temperature': 5.7936620359368725}. Best is trial 1464 with value: 0.8990825688073395.
[32m[I 2023-04-21 00:21:25,002][39m Trial 3893 finished with value: 0.8807339449541284 and parameters: {'objective': 'CrossEntropy', 'colsample_bylevel': 0.09572517200736921, 'depth': 9, 'boosting_type': 'Plain', 'bootstrap_type': 'Bayesian', 'bagging_temperature': 4.754182193612728}. Best is trial 1464 with value: 0.8990825688073395.
[32m[I 2023-04-21 00:21:26,357][39m Trial 3894 finished with value: 0.8828828828828829 and parameters: {'objective': 'CrossEntropy', 'colsample_bylevel': 0.09730041867280818, 'depth': 10, 'boosting_type': 'Plain', 'bootstrap_type': 'Bayesian', 'bagging_temperature': 6.209623608669519}. Best is trial 1464 with value: 0.8990825688073395.
[32m[I 2023-04-21 00:21:27,016][39m Trial 3895 finished with value: 0.8305084745762712 and parameters: {'objective': 'Logloss', 'colsample_bylevel': 0.09744518547951372, 'depth': 2, 'boosting_type': 'Plain', 'bootstrap_type': 'Bayesian', 'bagging_temperature': 4.67145652878454}. Best is trial 1464 with value: 0.8990825688073395.
[32m[I 2023-04-21 00:21:28,030][39m Trial 3896 finished with value: 0.8571428571428572 and parameters: {'objective': 'Logloss', 'colsample_bylevel': 0.09456491336571415, 'depth': 7, 'boosting_type': 'Plain', 'bootstrap_type': 'Bayesian', 'bagging_temperature': 5.778699290426489}. Best is trial 1464 with value: 0.8990825688073395.
[32m[I 2023-04-21 00:21:29,064][39m Trial 3897 finished with value: 0.8727272727272727 and parameters: {'objective': 'CrossEntropy', 'colsample_bylevel': 0.08942228371354699, 'depth': 11, 'boosting_type': 'Plain', 'bootstrap_type': 'Bayesian', 'bagging_temperature': 5.510994561958011}. Best is trial 1464 with value: 0.8990825688073395.
[32m[I 2023-04-21 00:21:30,298][39m Trial 3898 finished with value: 0.8807339449541284 and parameters: {'objective': 'CrossEntropy', 'colsample_bylevel': 0.08573985746820999, 'depth': 10, 'boosting_type': 'Plain', 'bootstrap_type': 'Bayesian', 'bagging_temperature': 5.875984825746306}. Best is trial 1464 with value: 0.8990825688073395.
[32m[I 2023-04-21 00:21:31,379][39m Trial 3899 finished with value: 0.8727272727272727 and parameters: {'objective': 'Logloss', 'colsample_bylevel': 0.099953563422627, 'depth': 7, 'boosting_type': 'Plain', 'bootstrap_type': 'Bayesian', 'bagging_temperature': 3.5386720937891845}. Best is trial 1464 with value: 0.8990825688073395.
[32m[I 2023-04-21 00:21:32,505][39m Trial 3900 finished with value: 0.8305084745762712 and parameters: {'objective': 'CrossEntropy', 'colsample_bylevel': 0.022998434762071238, 'depth': 9, 'boosting_type': 'Plain', 'bootstrap_type': 'Bayesian', 'bagging_temperature': 6.137746884950158}. Best is trial 1464 with value: 0.8990825688073395.
[32m[I 2023-04-21 00:21:33,958][39m Trial 3901 finished with value: 0.8727272727272727 and parameters: {'objective': 'Logloss', 'colsample_bylevel': 0.09763541833849608, 'depth': 8, 'boosting_type': 'Plain', 'bootstrap_type': 'Bayesian', 'bagging_temperature': 5.69741616619413}. Best is trial 1464 with value: 0.8990825688073395.
[32m[I 2023-04-21 00:21:34,871][39m Trial 3902 finished with value: 0.888888888888889 and parameters: {'objective': 'Logloss', 'colsample_bylevel': 0.09519103256088861, 'depth': 10, 'boosting_type': 'Plain', 'bootstrap_type': 'Bayesian', 'bagging_temperature': 5.620564281310247}. Best is trial 1464 with value: 0.8990825688073395.
[32m[I 2023-04-21 00:21:35,721][39m Trial 3903 finished with value: 0.8807339449541284 and parameters: {'objective': 'CrossEntropy', 'colsample_bylevel': 0.09410581047991268, 'depth': 10, 'boosting_type': 'Plain', 'bootstrap_type': 'Bayesian', 'bagging_temperature': 5.9235488255781465}. Best is trial 1464 with value: 0.8990825688073395.
[32m[I 2023-04-21 00:21:40,905][39m Trial 3904 finished with value: 0.8495575221238938 and parameters: {'objective': 'Logloss', 'colsample_bylevel': 0.09471691357485855, 'depth': 10, 'boosting_type': 'Ordered', 'bootstrap_type': 'Bayesian', 'bagging_temperature': 6.15041783054868}. Best is trial 1464 with value: 0.8990825688073395.
[32m[I 2023-04-21 00:21:41,936][39m Trial 3905 finished with value: 0.8727272727272727 and parameters: {'objective': 'Logloss', 'colsample_bylevel': 0.0928017399556756, 'depth': 6, 'boosting_type': 'Plain', 'bootstrap_type': 'Bayesian', 'bagging_temperature': 5.599781241408769}. Best is trial 1464 with value: 0.8990825688073395.
[32m[I 2023-04-21 00:21:43,161][39m Trial 3906 finished with value: 0.8648648648648648 and parameters: {'objective': 'CrossEntropy', 'colsample_bylevel': 0.09523188388963474, 'depth': 7, 'boosting_type': 'Plain', 'bootstrap_type': 'Bernoulli', 'subsample': 0.353593464140467}. Best is trial 1464 with value: 0.8990825688073395.
[32m[I 2023-04-21 00:21:44,405][39m Trial 3907 finished with value: 0.875 and parameters: {'objective': 'CrossEntropy', 'colsample_bylevel': 0.09346819944049671, 'depth': 7, 'boosting_type': 'Plain', 'bootstrap_type': 'Bayesian', 'bagging_temperature': 5.874375526218605}. Best is trial 1464 with value: 0.8990825688073395.
[32m[I 2023-04-21 00:21:46,049][39m Trial 3908 finished with value: 0.8571428571428572 and parameters: {'objective': 'Logloss', 'colsample_bylevel': 0.08610227683879096, 'depth': 9, 'boosting_type': 'Plain', 'bootstrap_type': 'MVS'}. Best is trial 1464 with value: 0.8990825688073395.
[32m[I 2023-04-21 00:21:47,687][39m Trial 3909 finished with value: 0.8807339449541284 and parameters: {'objective': 'Logloss', 'colsample_bylevel': 0.09395175810883905, 'depth': 9, 'boosting_type': 'Plain', 'bootstrap_type': 'Bayesian', 'bagging_temperature': 5.209026269086621}. Best is trial 1464 with value: 0.8990825688073395.
[32m[I 2023-04-21 00:21:49,173][39m Trial 3910 finished with value: 0.8807339449541284 and parameters: {'objective': 'Logloss', 'colsample_bylevel': 0.09146844191153941, 'depth': 9, 'boosting_type': 'Plain', 'bootstrap_type': 'Bayesian', 'bagging_temperature': 5.495785110286215}. Best is trial 1464 with value: 0.8990825688073395.
[32m[I 2023-04-21 00:21:49,926][39m Trial 3911 finished with value: 0.8828828828828829 and parameters: {'objective': 'Logloss', 'colsample_bylevel': 0.0954533269188412, 'depth': 7, 'boosting_type': 'Plain', 'bootstrap_type': 'Bayesian', 'bagging_temperature': 5.830608163572622}. Best is trial 1464 with value: 0.8990825688073395.
[32m[I 2023-04-21 00:21:51,018][39m Trial 3912 finished with value: 0.8807339449541284 and parameters: {'objective': 'Logloss', 'colsample_bylevel': 0.09491551285516017, 'depth': 9, 'boosting_type': 'Plain', 'bootstrap_type': 'Bayesian', 'bagging_temperature': 6.66145542991221}. Best is trial 1464 with value: 0.8990825688073395.
[32m[I 2023-04-21 00:21:51,795][39m Trial 3913 finished with value: 0.8648648648648648 and parameters: {'objective': 'CrossEntropy', 'colsample_bylevel': 0.09200842933179032, 'depth': 9, 'boosting_type': 'Plain', 'bootstrap_type': 'Bayesian', 'bagging_temperature': 3.395652784430752}. Best is trial 1464 with value: 0.8990825688073395.
[32m[I 2023-04-21 00:21:52,785][39m Trial 3914 finished with value: 0.8807339449541284 and parameters: {'objective': 'CrossEntropy', 'colsample_bylevel': 0.09712904457374354, 'depth': 7, 'boosting_type': 'Plain', 'bootstrap_type': 'Bayesian', 'bagging_temperature': 3.4870907822555806}. Best is trial 1464 with value: 0.8990825688073395.
[32m[I 2023-04-21 00:21:53,746][39m Trial 3915 finished with value: 0.8807339449541284 and parameters: {'objective': 'Logloss', 'colsample_bylevel': 0.09999657243208437, 'depth': 7, 'boosting_type': 'Plain', 'bootstrap_type': 'Bayesian', 'bagging_temperature': 6.208482612864887}. Best is trial 1464 with value: 0.8990825688073395.
[32m[I 2023-04-21 00:21:54,934][39m Trial 3916 finished with value: 0.8807339449541284 and parameters: {'objective': 'Logloss', 'colsample_bylevel': 0.0974989948554756, 'depth': 7, 'boosting_type': 'Plain', 'bootstrap_type': 'Bayesian', 'bagging_temperature': 6.107873504415686}. Best is trial 1464 with value: 0.8990825688073395.
[32m[I 2023-04-21 00:21:56,647][39m Trial 3917 finished with value: 0.8727272727272727 and parameters: {'objective': 'Logloss', 'colsample_bylevel': 0.09801777232913608, 'depth': 9, 'boosting_type': 'Plain', 'bootstrap_type': 'Bayesian', 'bagging_temperature': 5.592825837550419}. Best is trial 1464 with value: 0.8990825688073395.
[32m[I 2023-04-21 00:21:57,453][39m Trial 3918 finished with value: 0.8727272727272727 and parameters: {'objective': 'Logloss', 'colsample_bylevel': 0.09415027427004628, 'depth': 7, 'boosting_type': 'Plain', 'bootstrap_type': 'Bayesian', 'bagging_temperature': 5.082272181797563}. Best is trial 1464 with value: 0.8990825688073395.
[32m[I 2023-04-21 00:21:58,609][39m Trial 3919 finished with value: 0.8807339449541284 and parameters: {'objective': 'Logloss', 'colsample_bylevel': 0.09036567721691383, 'depth': 8, 'boosting_type': 'Plain', 'bootstrap_type': 'Bayesian', 'bagging_temperature': 5.66838319303048}. Best is trial 1464 with value: 0.8990825688073395.
[32m[I 2023-04-21 00:22:03,414][39m Trial 3920 finished with value: 0.8347826086956522 and parameters: {'objective': 'Logloss', 'colsample_bylevel': 0.09081873744792074, 'depth': 9, 'boosting_type': 'Ordered', 'bootstrap_type': 'Bayesian', 'bagging_temperature': 4.438716025358457}. Best is trial 1464 with value: 0.8990825688073395.
[32m[I 2023-04-21 00:22:04,500][39m Trial 3921 finished with value: 0.8703703703703703 and parameters: {'objective': 'CrossEntropy', 'colsample_bylevel': 0.09993283937759419, 'depth': 7, 'boosting_type': 'Plain', 'bootstrap_type': 'Bayesian', 'bagging_temperature': 5.98031032057505}. Best is trial 1464 with value: 0.8990825688073395.
[32m[I 2023-04-21 00:22:05,824][39m Trial 3922 finished with value: 0.8807339449541284 and parameters: {'objective': 'Logloss', 'colsample_bylevel': 0.09287738953083464, 'depth': 7, 'boosting_type': 'Plain', 'bootstrap_type': 'Bayesian', 'bagging_temperature': 5.668305140351255}. Best is trial 1464 with value: 0.8990825688073395.
[32m[I 2023-04-21 00:22:07,271][39m Trial 3923 finished with value: 0.875 and parameters: {'objective': 'Logloss', 'colsample_bylevel': 0.09121130868781771, 'depth': 9, 'boosting_type': 'Plain', 'bootstrap_type': 'Bayesian', 'bagging_temperature': 5.565859700700096}. Best is trial 1464 with value: 0.8990825688073395.
[32m[I 2023-04-21 00:22:08,320][39m Trial 3924 finished with value: 0.8785046728971961 and parameters: {'objective': 'Logloss', 'colsample_bylevel': 0.09625643630354491, 'depth': 7, 'boosting_type': 'Plain', 'bootstrap_type': 'Bayesian', 'bagging_temperature': 5.444823103337869}. Best is trial 1464 with value: 0.8990825688073395.
[32m[I 2023-04-21 00:22:09,963][39m Trial 3925 finished with value: 0.8807339449541284 and parameters: {'objective': 'Logloss', 'colsample_bylevel': 0.09506615673979925, 'depth': 9, 'boosting_type': 'Plain', 'bootstrap_type': 'Bayesian', 'bagging_temperature': 5.654927076683701}. Best is trial 1464 with value: 0.8990825688073395.
[32m[I 2023-04-21 00:22:11,363][39m Trial 3926 finished with value: 0.8571428571428572 and parameters: {'objective': 'Logloss', 'colsample_bylevel': 0.08960310166697656, 'depth': 8, 'boosting_type': 'Plain', 'bootstrap_type': 'Bayesian', 'bagging_temperature': 5.35025965447141}. Best is trial 1464 with value: 0.8990825688073395.
[32m[I 2023-04-21 00:22:12,053][39m Trial 3927 finished with value: 0.8623853211009175 and parameters: {'objective': 'CrossEntropy', 'colsample_bylevel': 0.08348707579070111, 'depth': 10, 'boosting_type': 'Plain', 'bootstrap_type': 'Bayesian', 'bagging_temperature': 5.117260831079583}. Best is trial 1464 with value: 0.8990825688073395.
[32m[I 2023-04-21 00:22:12,812][39m Trial 3928 finished with value: 0.8545454545454546 and parameters: {'objective': 'Logloss', 'colsample_bylevel': 0.09351452382467093, 'depth': 7, 'boosting_type': 'Plain', 'bootstrap_type': 'Bernoulli', 'subsample': 0.4092212837555874}. Best is trial 1464 with value: 0.8990825688073395.
[32m[I 2023-04-21 00:22:14,274][39m Trial 3929 finished with value: 0.888888888888889 and parameters: {'objective': 'Logloss', 'colsample_bylevel': 0.09995694733954284, 'depth': 9, 'boosting_type': 'Plain', 'bootstrap_type': 'Bayesian', 'bagging_temperature': 5.424524761644065}. Best is trial 1464 with value: 0.8990825688073395.
[32m[I 2023-04-21 00:22:15,080][39m Trial 3930 finished with value: 0.8807339449541284 and parameters: {'objective': 'Logloss', 'colsample_bylevel': 0.09796888962200266, 'depth': 8, 'boosting_type': 'Plain', 'bootstrap_type': 'Bayesian', 'bagging_temperature': 4.829378461052421}. Best is trial 1464 with value: 0.8990825688073395.
[32m[I 2023-04-21 00:22:16,344][39m Trial 3931 finished with value: 0.8495575221238938 and parameters: {'objective': 'Logloss', 'colsample_bylevel': 0.09737126043590896, 'depth': 7, 'boosting_type': 'Plain', 'bootstrap_type': 'MVS'}. Best is trial 1464 with value: 0.8990825688073395.
[32m[I 2023-04-21 00:22:17,255][39m Trial 3932 finished with value: 0.8807339449541284 and parameters: {'objective': 'CrossEntropy', 'colsample_bylevel': 0.09548059193275375, 'depth': 8, 'boosting_type': 'Plain', 'bootstrap_type': 'Bayesian', 'bagging_temperature': 5.884941924173681}. Best is trial 1464 with value: 0.8990825688073395.
[32m[I 2023-04-21 00:22:18,299][39m Trial 3933 finished with value: 0.888888888888889 and parameters: {'objective': 'Logloss', 'colsample_bylevel': 0.09424161146822449, 'depth': 9, 'boosting_type': 'Plain', 'bootstrap_type': 'Bayesian', 'bagging_temperature': 5.838514970303431}. Best is trial 1464 with value: 0.8990825688073395.
[32m[I 2023-04-21 00:22:19,071][39m Trial 3934 finished with value: 0.8807339449541284 and parameters: {'objective': 'Logloss', 'colsample_bylevel': 0.09633466759276092, 'depth': 7, 'boosting_type': 'Plain', 'bootstrap_type': 'Bayesian', 'bagging_temperature': 5.921646947795415}. Best is trial 1464 with value: 0.8990825688073395.
[32m[I 2023-04-21 00:22:20,636][39m Trial 3935 finished with value: 0.8727272727272727 and parameters: {'objective': 'Logloss', 'colsample_bylevel': 0.09607147809623286, 'depth': 9, 'boosting_type': 'Plain', 'bootstrap_type': 'Bayesian', 'bagging_temperature': 4.921446514017866}. Best is trial 1464 with value: 0.8990825688073395.
[32m[I 2023-04-21 00:22:22,304][39m Trial 3936 finished with value: 0.8807339449541284 and parameters: {'objective': 'Logloss', 'colsample_bylevel': 0.09845413378563263, 'depth': 9, 'boosting_type': 'Plain', 'bootstrap_type': 'Bayesian', 'bagging_temperature': 4.71169675301637}. Best is trial 1464 with value: 0.8990825688073395.
[32m[I 2023-04-21 00:22:23,300][39m Trial 3937 finished with value: 0.8648648648648648 and parameters: {'objective': 'CrossEntropy', 'colsample_bylevel': 0.09862089997172452, 'depth': 11, 'boosting_type': 'Plain', 'bootstrap_type': 'Bayesian', 'bagging_temperature': 6.377516476616414}. Best is trial 1464 with value: 0.8990825688073395.
[32m[I 2023-04-21 00:22:24,622][39m Trial 3938 finished with value: 0.875 and parameters: {'objective': 'Logloss', 'colsample_bylevel': 0.093883160657929, 'depth': 7, 'boosting_type': 'Plain', 'bootstrap_type': 'Bayesian', 'bagging_temperature': 5.9642701065253805}. Best is trial 1464 with value: 0.8990825688073395.
[32m[I 2023-04-21 00:22:25,718][39m Trial 3939 finished with value: 0.8727272727272727 and parameters: {'objective': 'CrossEntropy', 'colsample_bylevel': 0.09219797159210116, 'depth': 7, 'boosting_type': 'Plain', 'bootstrap_type': 'Bayesian', 'bagging_temperature': 5.778513991939603}. Best is trial 1464 with value: 0.8990825688073395.
[32m[I 2023-04-21 00:22:31,836][39m Trial 3940 finished with value: 0.8376068376068375 and parameters: {'objective': 'Logloss', 'colsample_bylevel': 0.09217191646338488, 'depth': 6, 'boosting_type': 'Ordered', 'bootstrap_type': 'Bayesian', 'bagging_temperature': 3.88652680378923}. Best is trial 1464 with value: 0.8990825688073395.
[32m[I 2023-04-21 00:22:32,557][39m Trial 3941 finished with value: 0.875 and parameters: {'objective': 'Logloss', 'colsample_bylevel': 0.09386591340424487, 'depth': 10, 'boosting_type': 'Plain', 'bootstrap_type': 'Bayesian', 'bagging_temperature': 6.021965985452709}. Best is trial 1464 with value: 0.8990825688073395.
[32m[I 2023-04-21 00:22:33,236][39m Trial 3942 finished with value: 0.8648648648648648 and parameters: {'objective': 'CrossEntropy', 'colsample_bylevel': 0.07368636266864881, 'depth': 9, 'boosting_type': 'Plain', 'bootstrap_type': 'Bayesian', 'bagging_temperature': 7.158592489557779}. Best is trial 1464 with value: 0.8990825688073395.
[32m[I 2023-04-21 00:22:34,463][39m Trial 3943 finished with value: 0.8828828828828829 and parameters: {'objective': 'Logloss', 'colsample_bylevel': 0.09033055622015808, 'depth': 7, 'boosting_type': 'Plain', 'bootstrap_type': 'Bayesian', 'bagging_temperature': 5.295498982568098}. Best is trial 1464 with value: 0.8990825688073395.
[32m[I 2023-04-21 00:22:36,035][39m Trial 3944 finished with value: 0.8623853211009175 and parameters: {'objective': 'Logloss', 'colsample_bylevel': 0.09086662908206619, 'depth': 8, 'boosting_type': 'Plain', 'bootstrap_type': 'Bayesian', 'bagging_temperature': 5.292924839200298}. Best is trial 1464 with value: 0.8990825688073395.
[32m[I 2023-04-21 00:22:37,146][39m Trial 3945 finished with value: 0.8807339449541284 and parameters: {'objective': 'Logloss', 'colsample_bylevel': 0.09521073991376562, 'depth': 6, 'boosting_type': 'Plain', 'bootstrap_type': 'Bayesian', 'bagging_temperature': 6.02476232460105}. Best is trial 1464 with value: 0.8990825688073395.
[32m[I 2023-04-21 00:22:37,940][39m Trial 3946 finished with value: 0.8727272727272727 and parameters: {'objective': 'CrossEntropy', 'colsample_bylevel': 0.09705467471415091, 'depth': 10, 'boosting_type': 'Plain', 'bootstrap_type': 'Bayesian', 'bagging_temperature': 5.270522110087701}. Best is trial 1464 with value: 0.8990825688073395.
[32m[I 2023-04-21 00:22:39,290][39m Trial 3947 finished with value: 0.888888888888889 and parameters: {'objective': 'Logloss', 'colsample_bylevel': 0.09838275633844316, 'depth': 8, 'boosting_type': 'Plain', 'bootstrap_type': 'Bayesian', 'bagging_temperature': 5.153571650095167}. Best is trial 1464 with value: 0.8990825688073395.
[32m[I 2023-04-21 00:22:40,082][39m Trial 3948 finished with value: 0.8727272727272727 and parameters: {'objective': 'CrossEntropy', 'colsample_bylevel': 0.09999785781552917, 'depth': 10, 'boosting_type': 'Plain', 'bootstrap_type': 'Bernoulli', 'subsample': 0.8372946757335217}. Best is trial 1464 with value: 0.8990825688073395.
[32m[I 2023-04-21 00:22:40,990][39m Trial 3949 finished with value: 0.888888888888889 and parameters: {'objective': 'Logloss', 'colsample_bylevel': 0.09827322316225406, 'depth': 7, 'boosting_type': 'Plain', 'bootstrap_type': 'Bayesian', 'bagging_temperature': 5.784822070552372}. Best is trial 1464 with value: 0.8990825688073395.
[32m[I 2023-04-21 00:22:41,891][39m Trial 3950 finished with value: 0.8727272727272727 and parameters: {'objective': 'Logloss', 'colsample_bylevel': 0.09845289112186935, 'depth': 9, 'boosting_type': 'Plain', 'bootstrap_type': 'Bayesian', 'bagging_temperature': 5.6234099538942335}. Best is trial 1464 with value: 0.8990825688073395.
[32m[I 2023-04-21 00:22:43,291][39m Trial 3951 finished with value: 0.8727272727272727 and parameters: {'objective': 'CrossEntropy', 'colsample_bylevel': 0.09805892860687242, 'depth': 9, 'boosting_type': 'Plain', 'bootstrap_type': 'Bayesian', 'bagging_temperature': 4.725845458565809}. Best is trial 1464 with value: 0.8990825688073395.
[32m[I 2023-04-21 00:22:44,313][39m Trial 3952 finished with value: 0.8571428571428572 and parameters: {'objective': 'CrossEntropy', 'colsample_bylevel': 0.09622952391668821, 'depth': 8, 'boosting_type': 'Plain', 'bootstrap_type': 'MVS'}. Best is trial 1464 with value: 0.8990825688073395.
