[32m[I 2023-04-20 23:05:36,029][39m Trial 399 finished with value: 0.8807339449541284 and parameters: {'objective': 'Logloss', 'colsample_bylevel': 0.09562499368870095, 'depth': 8, 'boosting_type': 'Plain', 'bootstrap_type': 'Bayesian', 'bagging_temperature': 5.277206408767982}. Best is trial 205 with value: 0.890909090909091.
[32m[I 2023-04-20 23:05:41,259][39m Trial 400 finished with value: 0.8347826086956522 and parameters: {'objective': 'Logloss', 'colsample_bylevel': 0.09226455190920564, 'depth': 8, 'boosting_type': 'Ordered', 'bootstrap_type': 'Bayesian', 'bagging_temperature': 5.2590920713871485}. Best is trial 205 with value: 0.890909090909091.
[32m[I 2023-04-20 23:05:42,213][39m Trial 401 finished with value: 0.8703703703703703 and parameters: {'objective': 'Logloss', 'colsample_bylevel': 0.09337821138304302, 'depth': 6, 'boosting_type': 'Plain', 'bootstrap_type': 'Bayesian', 'bagging_temperature': 5.395787105504741}. Best is trial 205 with value: 0.890909090909091.
[32m[I 2023-04-20 23:05:43,290][39m Trial 402 finished with value: 0.8727272727272727 and parameters: {'objective': 'Logloss', 'colsample_bylevel': 0.09849164907984156, 'depth': 7, 'boosting_type': 'Plain', 'bootstrap_type': 'Bayesian', 'bagging_temperature': 4.844279150473615}. Best is trial 205 with value: 0.890909090909091.
[32m[I 2023-04-20 23:05:44,208][39m Trial 403 finished with value: 0.8807339449541284 and parameters: {'objective': 'Logloss', 'colsample_bylevel': 0.09992612529624995, 'depth': 7, 'boosting_type': 'Plain', 'bootstrap_type': 'Bayesian', 'bagging_temperature': 6.630891877433611}. Best is trial 205 with value: 0.890909090909091.
[32m[I 2023-04-20 23:05:45,102][39m Trial 404 finished with value: 0.8727272727272727 and parameters: {'objective': 'Logloss', 'colsample_bylevel': 0.0962051488856764, 'depth': 8, 'boosting_type': 'Plain', 'bootstrap_type': 'Bayesian', 'bagging_temperature': 5.807101875290021}. Best is trial 205 with value: 0.890909090909091.
[32m[I 2023-04-20 23:05:46,036][39m Trial 405 finished with value: 0.8807339449541284 and parameters: {'objective': 'CrossEntropy', 'colsample_bylevel': 0.09494460822871603, 'depth': 7, 'boosting_type': 'Plain', 'bootstrap_type': 'Bayesian', 'bagging_temperature': 5.0859605992761034}. Best is trial 205 with value: 0.890909090909091.
[32m[I 2023-04-20 23:05:46,970][39m Trial 406 finished with value: 0.8807339449541284 and parameters: {'objective': 'Logloss', 'colsample_bylevel': 0.09673779032285365, 'depth': 7, 'boosting_type': 'Plain', 'bootstrap_type': 'Bayesian', 'bagging_temperature': 4.715975277724309}. Best is trial 205 with value: 0.890909090909091.
[32m[I 2023-04-20 23:05:47,749][39m Trial 407 finished with value: 0.8727272727272727 and parameters: {'objective': 'Logloss', 'colsample_bylevel': 0.0943910806992091, 'depth': 8, 'boosting_type': 'Plain', 'bootstrap_type': 'Bayesian', 'bagging_temperature': 6.098220101619335}. Best is trial 205 with value: 0.890909090909091.
[32m[I 2023-04-20 23:05:49,011][39m Trial 408 finished with value: 0.8727272727272727 and parameters: {'objective': 'Logloss', 'colsample_bylevel': 0.09727091001265183, 'depth': 8, 'boosting_type': 'Plain', 'bootstrap_type': 'Bayesian', 'bagging_temperature': 5.545368487971097}. Best is trial 205 with value: 0.890909090909091.
[32m[I 2023-04-20 23:05:49,870][39m Trial 409 finished with value: 0.8828828828828829 and parameters: {'objective': 'Logloss', 'colsample_bylevel': 0.09251279000693413, 'depth': 8, 'boosting_type': 'Plain', 'bootstrap_type': 'Bayesian', 'bagging_temperature': 5.828326834796873}. Best is trial 205 with value: 0.890909090909091.
[32m[I 2023-04-20 23:05:50,955][39m Trial 410 finished with value: 0.8596491228070176 and parameters: {'objective': 'Logloss', 'colsample_bylevel': 0.09847501246593725, 'depth': 8, 'boosting_type': 'Plain', 'bootstrap_type': 'MVS'}. Best is trial 205 with value: 0.890909090909091.
[32m[I 2023-04-20 23:05:52,408][39m Trial 411 finished with value: 0.8703703703703703 and parameters: {'objective': 'Logloss', 'colsample_bylevel': 0.09333017380903098, 'depth': 8, 'boosting_type': 'Plain', 'bootstrap_type': 'Bayesian', 'bagging_temperature': 5.829844538030813}. Best is trial 205 with value: 0.890909090909091.
[32m[I 2023-04-20 23:05:53,311][39m Trial 412 finished with value: 0.8807339449541284 and parameters: {'objective': 'Logloss', 'colsample_bylevel': 0.09554443272762977, 'depth': 8, 'boosting_type': 'Plain', 'bootstrap_type': 'Bayesian', 'bagging_temperature': 5.535488616971633}. Best is trial 205 with value: 0.890909090909091.
[32m[I 2023-04-20 23:05:54,646][39m Trial 413 finished with value: 0.8727272727272727 and parameters: {'objective': 'Logloss', 'colsample_bylevel': 0.09714686497502739, 'depth': 8, 'boosting_type': 'Plain', 'bootstrap_type': 'Bayesian', 'bagging_temperature': 5.418016384236026}. Best is trial 205 with value: 0.890909090909091.
[32m[I 2023-04-20 23:05:55,463][39m Trial 414 finished with value: 0.8828828828828829 and parameters: {'objective': 'Logloss', 'colsample_bylevel': 0.09461299445843821, 'depth': 8, 'boosting_type': 'Plain', 'bootstrap_type': 'Bayesian', 'bagging_temperature': 5.9835300659889565}. Best is trial 205 with value: 0.890909090909091.
[32m[I 2023-04-20 23:05:56,336][39m Trial 415 finished with value: 0.8347826086956522 and parameters: {'objective': 'Logloss', 'colsample_bylevel': 0.06986156577741517, 'depth': 7, 'boosting_type': 'Plain', 'bootstrap_type': 'Bayesian', 'bagging_temperature': 5.305333067332372}. Best is trial 205 with value: 0.890909090909091.
[32m[I 2023-04-20 23:05:57,351][39m Trial 416 finished with value: 0.8727272727272727 and parameters: {'objective': 'Logloss', 'colsample_bylevel': 0.0921824604964814, 'depth': 7, 'boosting_type': 'Plain', 'bootstrap_type': 'Bayesian', 'bagging_temperature': 5.999899222524079}. Best is trial 205 with value: 0.890909090909091.
[32m[I 2023-04-20 23:05:58,812][39m Trial 417 finished with value: 0.8807339449541284 and parameters: {'objective': 'Logloss', 'colsample_bylevel': 0.09554590789127289, 'depth': 8, 'boosting_type': 'Plain', 'bootstrap_type': 'Bayesian', 'bagging_temperature': 5.106021855597998}. Best is trial 205 with value: 0.890909090909091.
[32m[I 2023-04-20 23:05:59,438][39m Trial 418 finished with value: 0.8571428571428572 and parameters: {'objective': 'Logloss', 'colsample_bylevel': 0.09046255614317272, 'depth': 8, 'boosting_type': 'Plain', 'bootstrap_type': 'Bernoulli', 'subsample': 0.7485823273051648}. Best is trial 205 with value: 0.890909090909091.
[32m[I 2023-04-20 23:06:04,392][39m Trial 419 finished with value: 0.8347826086956522 and parameters: {'objective': 'Logloss', 'colsample_bylevel': 0.09839310586169445, 'depth': 8, 'boosting_type': 'Ordered', 'bootstrap_type': 'Bayesian', 'bagging_temperature': 6.400242910873129}. Best is trial 205 with value: 0.890909090909091.
[32m[I 2023-04-20 23:06:05,524][39m Trial 420 finished with value: 0.8807339449541284 and parameters: {'objective': 'Logloss', 'colsample_bylevel': 0.09856384046533405, 'depth': 7, 'boosting_type': 'Plain', 'bootstrap_type': 'Bayesian', 'bagging_temperature': 4.602983326567657}. Best is trial 205 with value: 0.890909090909091.
[32m[I 2023-04-20 23:06:07,114][39m Trial 421 finished with value: 0.8828828828828829 and parameters: {'objective': 'Logloss', 'colsample_bylevel': 0.09982895172844301, 'depth': 8, 'boosting_type': 'Plain', 'bootstrap_type': 'Bayesian', 'bagging_temperature': 4.48812144856427}. Best is trial 205 with value: 0.890909090909091.
[32m[I 2023-04-20 23:06:07,630][39m Trial 422 finished with value: 0.8623853211009175 and parameters: {'objective': 'Logloss', 'colsample_bylevel': 0.09607975343038593, 'depth': 7, 'boosting_type': 'Plain', 'bootstrap_type': 'Bayesian', 'bagging_temperature': 2.342574192709834}. Best is trial 205 with value: 0.890909090909091.
[32m[I 2023-04-20 23:06:08,473][39m Trial 423 finished with value: 0.8727272727272727 and parameters: {'objective': 'Logloss', 'colsample_bylevel': 0.09173677525874724, 'depth': 8, 'boosting_type': 'Plain', 'bootstrap_type': 'Bayesian', 'bagging_temperature': 5.9308425675603775}. Best is trial 205 with value: 0.890909090909091.
[32m[I 2023-04-20 23:06:09,348][39m Trial 424 finished with value: 0.8623853211009175 and parameters: {'objective': 'CrossEntropy', 'colsample_bylevel': 0.09691735470922011, 'depth': 8, 'boosting_type': 'Plain', 'bootstrap_type': 'Bayesian', 'bagging_temperature': 5.689551136571234}. Best is trial 205 with value: 0.890909090909091.
[32m[I 2023-04-20 23:06:10,622][39m Trial 425 finished with value: 0.8727272727272727 and parameters: {'objective': 'Logloss', 'colsample_bylevel': 0.09816744733460464, 'depth': 8, 'boosting_type': 'Plain', 'bootstrap_type': 'Bayesian', 'bagging_temperature': 5.610950568073465}. Best is trial 205 with value: 0.890909090909091.
[32m[I 2023-04-20 23:06:12,288][39m Trial 426 finished with value: 0.8727272727272727 and parameters: {'objective': 'Logloss', 'colsample_bylevel': 0.09378866855555215, 'depth': 8, 'boosting_type': 'Plain', 'bootstrap_type': 'Bayesian', 'bagging_temperature': 5.270153219293052}. Best is trial 205 with value: 0.890909090909091.
[32m[I 2023-04-20 23:06:13,486][39m Trial 427 finished with value: 0.8727272727272727 and parameters: {'objective': 'Logloss', 'colsample_bylevel': 0.0997689216783612, 'depth': 8, 'boosting_type': 'Plain', 'bootstrap_type': 'Bayesian', 'bagging_temperature': 6.103891575227031}. Best is trial 205 with value: 0.890909090909091.
[32m[I 2023-04-20 23:06:14,215][39m Trial 428 finished with value: 0.8648648648648648 and parameters: {'objective': 'Logloss', 'colsample_bylevel': 0.09993429080112577, 'depth': 7, 'boosting_type': 'Plain', 'bootstrap_type': 'Bayesian', 'bagging_temperature': 4.482005143645461}. Best is trial 205 with value: 0.890909090909091.
[32m[I 2023-04-20 23:06:14,913][39m Trial 429 finished with value: 0.8727272727272727 and parameters: {'objective': 'Logloss', 'colsample_bylevel': 0.09616295184713235, 'depth': 7, 'boosting_type': 'Plain', 'bootstrap_type': 'Bayesian', 'bagging_temperature': 7.046334574393529}. Best is trial 205 with value: 0.890909090909091.
[32m[I 2023-04-20 23:06:15,754][39m Trial 430 finished with value: 0.8807339449541284 and parameters: {'objective': 'Logloss', 'colsample_bylevel': 0.09985171065327102, 'depth': 8, 'boosting_type': 'Plain', 'bootstrap_type': 'Bayesian', 'bagging_temperature': 4.921926193999463}. Best is trial 205 with value: 0.890909090909091.
[32m[I 2023-04-20 23:06:17,040][39m Trial 431 finished with value: 0.8807339449541284 and parameters: {'objective': 'Logloss', 'colsample_bylevel': 0.09426063293798917, 'depth': 8, 'boosting_type': 'Plain', 'bootstrap_type': 'Bayesian', 'bagging_temperature': 6.57028893623312}. Best is trial 205 with value: 0.890909090909091.
[32m[I 2023-04-20 23:06:17,908][39m Trial 432 finished with value: 0.8421052631578947 and parameters: {'objective': 'Logloss', 'colsample_bylevel': 0.09727619812259135, 'depth': 6, 'boosting_type': 'Plain', 'bootstrap_type': 'MVS'}. Best is trial 205 with value: 0.890909090909091.
[32m[I 2023-04-20 23:06:19,142][39m Trial 433 finished with value: 0.8727272727272727 and parameters: {'objective': 'Logloss', 'colsample_bylevel': 0.09110858673317626, 'depth': 8, 'boosting_type': 'Plain', 'bootstrap_type': 'Bayesian', 'bagging_temperature': 5.71520048932094}. Best is trial 205 with value: 0.890909090909091.
[32m[I 2023-04-20 23:06:20,065][39m Trial 434 finished with value: 0.8703703703703703 and parameters: {'objective': 'Logloss', 'colsample_bylevel': 0.09376695398774115, 'depth': 8, 'boosting_type': 'Plain', 'bootstrap_type': 'Bayesian', 'bagging_temperature': 1.9163353270961834}. Best is trial 205 with value: 0.890909090909091.
[32m[I 2023-04-20 23:06:20,773][39m Trial 435 finished with value: 0.8807339449541284 and parameters: {'objective': 'Logloss', 'colsample_bylevel': 0.09835346507127109, 'depth': 8, 'boosting_type': 'Plain', 'bootstrap_type': 'Bayesian', 'bagging_temperature': 4.173142032725508}. Best is trial 205 with value: 0.890909090909091.
[32m[I 2023-04-20 23:06:21,884][39m Trial 436 finished with value: 0.8807339449541284 and parameters: {'objective': 'Logloss', 'colsample_bylevel': 0.09739460756987832, 'depth': 7, 'boosting_type': 'Plain', 'bootstrap_type': 'Bayesian', 'bagging_temperature': 4.689730677579784}. Best is trial 205 with value: 0.890909090909091.
[32m[I 2023-04-20 23:06:22,591][39m Trial 437 finished with value: 0.8807339449541284 and parameters: {'objective': 'Logloss', 'colsample_bylevel': 0.09503997129509868, 'depth': 7, 'boosting_type': 'Plain', 'bootstrap_type': 'Bayesian', 'bagging_temperature': 6.213335074899074}. Best is trial 205 with value: 0.890909090909091.
[32m[I 2023-04-20 23:06:27,795][39m Trial 438 finished with value: 0.8596491228070176 and parameters: {'objective': 'Logloss', 'colsample_bylevel': 0.09465384491610783, 'depth': 8, 'boosting_type': 'Ordered', 'bootstrap_type': 'Bayesian', 'bagging_temperature': 6.140125754884892}. Best is trial 205 with value: 0.890909090909091.
[32m[I 2023-04-20 23:06:29,157][39m Trial 439 finished with value: 0.8727272727272727 and parameters: {'objective': 'Logloss', 'colsample_bylevel': 0.09310921556487813, 'depth': 8, 'boosting_type': 'Plain', 'bootstrap_type': 'Bayesian', 'bagging_temperature': 5.754738816494156}. Best is trial 205 with value: 0.890909090909091.
[32m[I 2023-04-20 23:06:29,814][39m Trial 440 finished with value: 0.8347826086956522 and parameters: {'objective': 'Logloss', 'colsample_bylevel': 0.09190858289559979, 'depth': 8, 'boosting_type': 'Plain', 'bootstrap_type': 'Bernoulli', 'subsample': 0.9123542048954032}. Best is trial 205 with value: 0.890909090909091.
[32m[I 2023-04-20 23:06:31,158][39m Trial 441 finished with value: 0.8648648648648648 and parameters: {'objective': 'Logloss', 'colsample_bylevel': 0.09567614751396376, 'depth': 8, 'boosting_type': 'Plain', 'bootstrap_type': 'Bayesian', 'bagging_temperature': 5.861147789149903}. Best is trial 205 with value: 0.890909090909091.
[32m[I 2023-04-20 23:06:31,932][39m Trial 442 finished with value: 0.8807339449541284 and parameters: {'objective': 'Logloss', 'colsample_bylevel': 0.09739639191065538, 'depth': 7, 'boosting_type': 'Plain', 'bootstrap_type': 'Bayesian', 'bagging_temperature': 6.29582206036297}. Best is trial 205 with value: 0.890909090909091.
[32m[I 2023-04-20 23:06:33,239][39m Trial 443 finished with value: 0.8807339449541284 and parameters: {'objective': 'Logloss', 'colsample_bylevel': 0.09608893434736895, 'depth': 6, 'boosting_type': 'Plain', 'bootstrap_type': 'Bayesian', 'bagging_temperature': 5.4316386342565375}. Best is trial 205 with value: 0.890909090909091.
[32m[I 2023-04-20 23:06:34,131][39m Trial 444 finished with value: 0.8623853211009175 and parameters: {'objective': 'Logloss', 'colsample_bylevel': 0.09322852053770248, 'depth': 7, 'boosting_type': 'Plain', 'bootstrap_type': 'Bayesian', 'bagging_temperature': 6.691783039643454}. Best is trial 205 with value: 0.890909090909091.
[32m[I 2023-04-20 23:06:34,812][39m Trial 445 finished with value: 0.8807339449541284 and parameters: {'objective': 'CrossEntropy', 'colsample_bylevel': 0.09727393556005982, 'depth': 7, 'boosting_type': 'Plain', 'bootstrap_type': 'Bayesian', 'bagging_temperature': 7.6662546769683}. Best is trial 205 with value: 0.890909090909091.
[32m[I 2023-04-20 23:06:36,010][39m Trial 446 finished with value: 0.8727272727272727 and parameters: {'objective': 'Logloss', 'colsample_bylevel': 0.0982229327666944, 'depth': 8, 'boosting_type': 'Plain', 'bootstrap_type': 'Bayesian', 'bagging_temperature': 5.525637809817675}. Best is trial 205 with value: 0.890909090909091.
[32m[I 2023-04-20 23:06:36,861][39m Trial 447 finished with value: 0.8727272727272727 and parameters: {'objective': 'Logloss', 'colsample_bylevel': 0.09999023704476226, 'depth': 8, 'boosting_type': 'Plain', 'bootstrap_type': 'Bayesian', 'bagging_temperature': 5.915520169949429}. Best is trial 205 with value: 0.890909090909091.
[32m[I 2023-04-20 23:06:37,834][39m Trial 448 finished with value: 0.8727272727272727 and parameters: {'objective': 'Logloss', 'colsample_bylevel': 0.09642532387904743, 'depth': 8, 'boosting_type': 'Plain', 'bootstrap_type': 'Bayesian', 'bagging_temperature': 5.118407996933012}. Best is trial 205 with value: 0.890909090909091.
[32m[I 2023-04-20 23:06:38,806][39m Trial 449 finished with value: 0.875 and parameters: {'objective': 'Logloss', 'colsample_bylevel': 0.09509655663960126, 'depth': 8, 'boosting_type': 'Plain', 'bootstrap_type': 'Bayesian', 'bagging_temperature': 6.419993505278854}. Best is trial 205 with value: 0.890909090909091.
[32m[I 2023-04-20 23:06:39,828][39m Trial 450 finished with value: 0.888888888888889 and parameters: {'objective': 'Logloss', 'colsample_bylevel': 0.09866328106908323, 'depth': 7, 'boosting_type': 'Plain', 'bootstrap_type': 'Bayesian', 'bagging_temperature': 4.459828716796137}. Best is trial 205 with value: 0.890909090909091.
[32m[I 2023-04-20 23:06:40,833][39m Trial 451 finished with value: 0.8468468468468469 and parameters: {'objective': 'Logloss', 'colsample_bylevel': 0.09000844077615562, 'depth': 8, 'boosting_type': 'Plain', 'bootstrap_type': 'Bayesian', 'bagging_temperature': 4.543349075711749}. Best is trial 205 with value: 0.890909090909091.
[32m[I 2023-04-20 23:06:41,933][39m Trial 452 finished with value: 0.875 and parameters: {'objective': 'Logloss', 'colsample_bylevel': 0.09266638108639169, 'depth': 7, 'boosting_type': 'Plain', 'bootstrap_type': 'Bayesian', 'bagging_temperature': 4.432062738205202}. Best is trial 205 with value: 0.890909090909091.
[32m[I 2023-04-20 23:06:43,632][39m Trial 453 finished with value: 0.8727272727272727 and parameters: {'objective': 'Logloss', 'colsample_bylevel': 0.09839315614617125, 'depth': 9, 'boosting_type': 'Plain', 'bootstrap_type': 'Bayesian', 'bagging_temperature': 4.251164739425443}. Best is trial 205 with value: 0.890909090909091.
[32m[I 2023-04-20 23:06:44,294][39m Trial 454 finished with value: 0.8807339449541284 and parameters: {'objective': 'Logloss', 'colsample_bylevel': 0.09490413101133947, 'depth': 7, 'boosting_type': 'Plain', 'bootstrap_type': 'Bayesian', 'bagging_temperature': 4.695596738553114}. Best is trial 205 with value: 0.890909090909091.
[32m[I 2023-04-20 23:06:45,436][39m Trial 455 finished with value: 0.823529411764706 and parameters: {'objective': 'Logloss', 'colsample_bylevel': 0.024075754924790096, 'depth': 7, 'boosting_type': 'Plain', 'bootstrap_type': 'Bayesian', 'bagging_temperature': 4.829952044833494}. Best is trial 205 with value: 0.890909090909091.
[32m[I 2023-04-20 23:06:46,023][39m Trial 456 finished with value: 0.8275862068965517 and parameters: {'objective': 'Logloss', 'colsample_bylevel': 0.07243664607533659, 'depth': 7, 'boosting_type': 'Plain', 'bootstrap_type': 'Bayesian', 'bagging_temperature': 4.949748072923527}. Best is trial 205 with value: 0.890909090909091.
[32m[I 2023-04-20 23:06:47,156][39m Trial 457 finished with value: 0.8421052631578947 and parameters: {'objective': 'Logloss', 'colsample_bylevel': 0.09851133153641685, 'depth': 4, 'boosting_type': 'Plain', 'bootstrap_type': 'Bayesian', 'bagging_temperature': 4.06614215363632}. Best is trial 205 with value: 0.890909090909091.
[32m[I 2023-04-20 23:06:52,290][39m Trial 458 finished with value: 0.8571428571428572 and parameters: {'objective': 'Logloss', 'colsample_bylevel': 0.09622897818459884, 'depth': 7, 'boosting_type': 'Ordered', 'bootstrap_type': 'Bayesian', 'bagging_temperature': 5.213792357741808}. Best is trial 205 with value: 0.890909090909091.
[32m[I 2023-04-20 23:06:53,283][39m Trial 459 finished with value: 0.8807339449541284 and parameters: {'objective': 'Logloss', 'colsample_bylevel': 0.09700770415946203, 'depth': 7, 'boosting_type': 'Plain', 'bootstrap_type': 'Bayesian', 'bagging_temperature': 4.970016967250038}. Best is trial 205 with value: 0.890909090909091.
[32m[I 2023-04-20 23:06:54,297][39m Trial 460 finished with value: 0.8275862068965517 and parameters: {'objective': 'Logloss', 'colsample_bylevel': 0.09693480751186082, 'depth': 9, 'boosting_type': 'Plain', 'bootstrap_type': 'MVS'}. Best is trial 205 with value: 0.890909090909091.
[32m[I 2023-04-20 23:06:55,149][39m Trial 461 finished with value: 0.8828828828828829 and parameters: {'objective': 'Logloss', 'colsample_bylevel': 0.09970946984711027, 'depth': 6, 'boosting_type': 'Plain', 'bootstrap_type': 'Bayesian', 'bagging_temperature': 4.381010036747395}. Best is trial 205 with value: 0.890909090909091.
[32m[I 2023-04-20 23:06:55,983][39m Trial 462 finished with value: 0.8785046728971961 and parameters: {'objective': 'CrossEntropy', 'colsample_bylevel': 0.09811156503583596, 'depth': 7, 'boosting_type': 'Plain', 'bootstrap_type': 'Bayesian', 'bagging_temperature': 4.197828771376506}. Best is trial 205 with value: 0.890909090909091.
[32m[I 2023-04-20 23:06:57,291][39m Trial 463 finished with value: 0.890909090909091 and parameters: {'objective': 'Logloss', 'colsample_bylevel': 0.09447911704460502, 'depth': 8, 'boosting_type': 'Plain', 'bootstrap_type': 'Bayesian', 'bagging_temperature': 5.404851509806891}. Best is trial 205 with value: 0.890909090909091.
[32m[I 2023-04-20 23:06:58,006][39m Trial 464 finished with value: 0.8571428571428572 and parameters: {'objective': 'Logloss', 'colsample_bylevel': 0.0996345154024247, 'depth': 7, 'boosting_type': 'Plain', 'bootstrap_type': 'Bernoulli', 'subsample': 0.5842752423991998}. Best is trial 205 with value: 0.890909090909091.
