[32m[I 2023-04-21 00:00:09,018][39m Trial 2963 finished with value: 0.8807339449541284 and parameters: {'objective': 'CrossEntropy', 'colsample_bylevel': 0.09123966023138402, 'depth': 9, 'boosting_type': 'Plain', 'bootstrap_type': 'Bayesian', 'bagging_temperature': 4.332722110206208}. Best is trial 1464 with value: 0.8990825688073395.
[32m[I 2023-04-21 00:00:09,760][39m Trial 2964 finished with value: 0.8807339449541284 and parameters: {'objective': 'Logloss', 'colsample_bylevel': 0.09685977016355785, 'depth': 10, 'boosting_type': 'Plain', 'bootstrap_type': 'Bayesian', 'bagging_temperature': 7.1081827746599275}. Best is trial 1464 with value: 0.8990825688073395.
[32m[I 2023-04-21 00:00:10,434][39m Trial 2965 finished with value: 0.8807339449541284 and parameters: {'objective': 'CrossEntropy', 'colsample_bylevel': 0.09146808332193114, 'depth': 10, 'boosting_type': 'Plain', 'bootstrap_type': 'Bayesian', 'bagging_temperature': 4.147189505419047}. Best is trial 1464 with value: 0.8990825688073395.
[32m[I 2023-04-21 00:00:11,620][39m Trial 2966 finished with value: 0.8727272727272727 and parameters: {'objective': 'Logloss', 'colsample_bylevel': 0.09805588601671074, 'depth': 8, 'boosting_type': 'Plain', 'bootstrap_type': 'Bayesian', 'bagging_temperature': 6.4457071843626395}. Best is trial 1464 with value: 0.8990825688073395.
[32m[I 2023-04-21 00:00:12,885][39m Trial 2967 finished with value: 0.890909090909091 and parameters: {'objective': 'Logloss', 'colsample_bylevel': 0.09680772701175767, 'depth': 7, 'boosting_type': 'Plain', 'bootstrap_type': 'Bayesian', 'bagging_temperature': 3.8407456546049072}. Best is trial 1464 with value: 0.8990825688073395.
[32m[I 2023-04-21 00:00:13,875][39m Trial 2968 finished with value: 0.8785046728971961 and parameters: {'objective': 'Logloss', 'colsample_bylevel': 0.09448516149780745, 'depth': 7, 'boosting_type': 'Plain', 'bootstrap_type': 'Bayesian', 'bagging_temperature': 3.7782216310483854}. Best is trial 1464 with value: 0.8990825688073395.
[32m[I 2023-04-21 00:00:15,105][39m Trial 2969 finished with value: 0.8828828828828829 and parameters: {'objective': 'Logloss', 'colsample_bylevel': 0.09534009263657743, 'depth': 7, 'boosting_type': 'Plain', 'bootstrap_type': 'Bayesian', 'bagging_temperature': 7.009299807669208}. Best is trial 1464 with value: 0.8990825688073395.
[32m[I 2023-04-21 00:00:16,241][39m Trial 2970 finished with value: 0.8305084745762712 and parameters: {'objective': 'Logloss', 'colsample_bylevel': 0.022099703230539003, 'depth': 7, 'boosting_type': 'Plain', 'bootstrap_type': 'Bayesian', 'bagging_temperature': 3.9039345850101212}. Best is trial 1464 with value: 0.8990825688073395.
[32m[I 2023-04-21 00:00:17,895][39m Trial 2971 finished with value: 0.8727272727272727 and parameters: {'objective': 'Logloss', 'colsample_bylevel': 0.09682371256003332, 'depth': 9, 'boosting_type': 'Plain', 'bootstrap_type': 'Bayesian', 'bagging_temperature': 5.152556359301805}. Best is trial 1464 with value: 0.8990825688073395.
[32m[I 2023-04-21 00:00:18,601][39m Trial 2972 finished with value: 0.8545454545454546 and parameters: {'objective': 'Logloss', 'colsample_bylevel': 0.09410685558169773, 'depth': 7, 'boosting_type': 'Plain', 'bootstrap_type': 'Bayesian', 'bagging_temperature': 6.710094474410557}. Best is trial 1464 with value: 0.8990825688073395.
[32m[I 2023-04-21 00:00:19,346][39m Trial 2973 finished with value: 0.8727272727272727 and parameters: {'objective': 'Logloss', 'colsample_bylevel': 0.09675689484420444, 'depth': 7, 'boosting_type': 'Plain', 'bootstrap_type': 'Bayesian', 'bagging_temperature': 3.8953379264643093}. Best is trial 1464 with value: 0.8990825688073395.
[32m[I 2023-04-21 00:00:20,045][39m Trial 2974 finished with value: 0.8727272727272727 and parameters: {'objective': 'Logloss', 'colsample_bylevel': 0.09546704098740184, 'depth': 7, 'boosting_type': 'Plain', 'bootstrap_type': 'Bayesian', 'bagging_temperature': 5.159492950443517}. Best is trial 1464 with value: 0.8990825688073395.
[32m[I 2023-04-21 00:00:21,252][39m Trial 2975 finished with value: 0.875 and parameters: {'objective': 'Logloss', 'colsample_bylevel': 0.09399266932883768, 'depth': 7, 'boosting_type': 'Plain', 'bootstrap_type': 'Bayesian', 'bagging_temperature': 4.1773211701803525}. Best is trial 1464 with value: 0.8990825688073395.
[32m[I 2023-04-21 00:00:22,156][39m Trial 2976 finished with value: 0.8495575221238938 and parameters: {'objective': 'Logloss', 'colsample_bylevel': 0.09679453573276364, 'depth': 7, 'boosting_type': 'Plain', 'bootstrap_type': 'Bayesian', 'bagging_temperature': 3.723106744100646}. Best is trial 1464 with value: 0.8990825688073395.
[32m[I 2023-04-21 00:00:23,309][39m Trial 2977 finished with value: 0.875 and parameters: {'objective': 'Logloss', 'colsample_bylevel': 0.09526297290852456, 'depth': 7, 'boosting_type': 'Plain', 'bootstrap_type': 'Bayesian', 'bagging_temperature': 4.050519167273381}. Best is trial 1464 with value: 0.8990825688073395.
[32m[I 2023-04-21 00:00:24,523][39m Trial 2978 finished with value: 0.8807339449541284 and parameters: {'objective': 'Logloss', 'colsample_bylevel': 0.09354695234458138, 'depth': 7, 'boosting_type': 'Plain', 'bootstrap_type': 'Bayesian', 'bagging_temperature': 7.251490606493267}. Best is trial 1464 with value: 0.8990825688073395.
[32m[I 2023-04-21 00:00:25,249][39m Trial 2979 finished with value: 0.8727272727272727 and parameters: {'objective': 'Logloss', 'colsample_bylevel': 0.09656607489503685, 'depth': 7, 'boosting_type': 'Plain', 'bootstrap_type': 'Bayesian', 'bagging_temperature': 5.337467003264832}. Best is trial 1464 with value: 0.8990825688073395.
[32m[I 2023-04-21 00:00:26,490][39m Trial 2980 finished with value: 0.8807339449541284 and parameters: {'objective': 'Logloss', 'colsample_bylevel': 0.09714689749996143, 'depth': 7, 'boosting_type': 'Plain', 'bootstrap_type': 'Bayesian', 'bagging_temperature': 5.109896665103175}. Best is trial 1464 with value: 0.8990825688073395.
[32m[I 2023-04-21 00:00:31,837][39m Trial 2981 finished with value: 0.8596491228070176 and parameters: {'objective': 'Logloss', 'colsample_bylevel': 0.09474876560947525, 'depth': 7, 'boosting_type': 'Ordered', 'bootstrap_type': 'Bayesian', 'bagging_temperature': 6.879179013480347}. Best is trial 1464 with value: 0.8990825688073395.
[32m[I 2023-04-21 00:00:32,853][39m Trial 2982 finished with value: 0.8727272727272727 and parameters: {'objective': 'Logloss', 'colsample_bylevel': 0.09293517169217563, 'depth': 7, 'boosting_type': 'Plain', 'bootstrap_type': 'Bayesian', 'bagging_temperature': 6.6711418911094755}. Best is trial 1464 with value: 0.8990825688073395.
[32m[I 2023-04-21 00:00:34,057][39m Trial 2983 finished with value: 0.8495575221238938 and parameters: {'objective': 'Logloss', 'colsample_bylevel': 0.09734076024313038, 'depth': 7, 'boosting_type': 'Plain', 'bootstrap_type': 'MVS'}. Best is trial 1464 with value: 0.8990825688073395.
[32m[I 2023-04-21 00:00:34,976][39m Trial 2984 finished with value: 0.8828828828828829 and parameters: {'objective': 'Logloss', 'colsample_bylevel': 0.09508531363084638, 'depth': 7, 'boosting_type': 'Plain', 'bootstrap_type': 'Bayesian', 'bagging_temperature': 5.545114173063511}. Best is trial 1464 with value: 0.8990825688073395.
[32m[I 2023-04-21 00:00:35,962][39m Trial 2985 finished with value: 0.8623853211009175 and parameters: {'objective': 'Logloss', 'colsample_bylevel': 0.09568363718404588, 'depth': 7, 'boosting_type': 'Plain', 'bootstrap_type': 'Bayesian', 'bagging_temperature': 7.100446391796362}. Best is trial 1464 with value: 0.8990825688073395.
[32m[I 2023-04-21 00:00:36,937][39m Trial 2986 finished with value: 0.8648648648648648 and parameters: {'objective': 'Logloss', 'colsample_bylevel': 0.09341680466016415, 'depth': 7, 'boosting_type': 'Plain', 'bootstrap_type': 'Bayesian', 'bagging_temperature': 5.344612835675772}. Best is trial 1464 with value: 0.8990825688073395.
[32m[I 2023-04-21 00:00:38,197][39m Trial 2987 finished with value: 0.8727272727272727 and parameters: {'objective': 'Logloss', 'colsample_bylevel': 0.09821193114859836, 'depth': 7, 'boosting_type': 'Plain', 'bootstrap_type': 'Bayesian', 'bagging_temperature': 4.179494566863163}. Best is trial 1464 with value: 0.8990825688073395.
[32m[I 2023-04-21 00:00:39,190][39m Trial 2988 finished with value: 0.8807339449541284 and parameters: {'objective': 'Logloss', 'colsample_bylevel': 0.09660817338559818, 'depth': 7, 'boosting_type': 'Plain', 'bootstrap_type': 'Bayesian', 'bagging_temperature': 5.582609922087007}. Best is trial 1464 with value: 0.8990825688073395.
[32m[I 2023-04-21 00:00:40,031][39m Trial 2989 finished with value: 0.890909090909091 and parameters: {'objective': 'Logloss', 'colsample_bylevel': 0.09412267281626106, 'depth': 7, 'boosting_type': 'Plain', 'bootstrap_type': 'Bayesian', 'bagging_temperature': 3.75876237525034}. Best is trial 1464 with value: 0.8990825688073395.
[32m[I 2023-04-21 00:00:41,230][39m Trial 2990 finished with value: 0.8807339449541284 and parameters: {'objective': 'Logloss', 'colsample_bylevel': 0.09212909713265081, 'depth': 7, 'boosting_type': 'Plain', 'bootstrap_type': 'Bayesian', 'bagging_temperature': 3.7320257050304897}. Best is trial 1464 with value: 0.8990825688073395.
[32m[I 2023-04-21 00:00:42,183][39m Trial 2991 finished with value: 0.8648648648648648 and parameters: {'objective': 'Logloss', 'colsample_bylevel': 0.09177230656429013, 'depth': 7, 'boosting_type': 'Plain', 'bootstrap_type': 'Bayesian', 'bagging_temperature': 4.006918731611093}. Best is trial 1464 with value: 0.8990825688073395.
[32m[I 2023-04-21 00:00:43,253][39m Trial 2992 finished with value: 0.8648648648648648 and parameters: {'objective': 'Logloss', 'colsample_bylevel': 0.0922947978480942, 'depth': 7, 'boosting_type': 'Plain', 'bootstrap_type': 'Bayesian', 'bagging_temperature': 3.878908827692824}. Best is trial 1464 with value: 0.8990825688073395.
[32m[I 2023-04-21 00:00:44,550][39m Trial 2993 finished with value: 0.8785046728971961 and parameters: {'objective': 'Logloss', 'colsample_bylevel': 0.09387390352520054, 'depth': 7, 'boosting_type': 'Plain', 'bootstrap_type': 'Bayesian', 'bagging_temperature': 3.5589087546636655}. Best is trial 1464 with value: 0.8990825688073395.
[32m[I 2023-04-21 00:00:45,661][39m Trial 2994 finished with value: 0.8727272727272727 and parameters: {'objective': 'Logloss', 'colsample_bylevel': 0.09155347511939577, 'depth': 7, 'boosting_type': 'Plain', 'bootstrap_type': 'Bayesian', 'bagging_temperature': 5.015910950819157}. Best is trial 1464 with value: 0.8990825688073395.
[32m[I 2023-04-21 00:00:46,627][39m Trial 2995 finished with value: 0.888888888888889 and parameters: {'objective': 'Logloss', 'colsample_bylevel': 0.09700467915743922, 'depth': 7, 'boosting_type': 'Plain', 'bootstrap_type': 'Bayesian', 'bagging_temperature': 6.8161709579961824}. Best is trial 1464 with value: 0.8990825688073395.
[32m[I 2023-04-21 00:00:47,536][39m Trial 2996 finished with value: 0.8623853211009175 and parameters: {'objective': 'Logloss', 'colsample_bylevel': 0.0924912147540819, 'depth': 7, 'boosting_type': 'Plain', 'bootstrap_type': 'Bayesian', 'bagging_temperature': 3.66040463771557}. Best is trial 1464 with value: 0.8990825688073395.
[32m[I 2023-04-21 00:00:48,598][39m Trial 2997 finished with value: 0.8623853211009175 and parameters: {'objective': 'Logloss', 'colsample_bylevel': 0.0914378401874586, 'depth': 7, 'boosting_type': 'Plain', 'bootstrap_type': 'Bayesian', 'bagging_temperature': 3.932330409136632}. Best is trial 1464 with value: 0.8990825688073395.
[32m[I 2023-04-21 00:00:49,749][39m Trial 2998 finished with value: 0.8807339449541284 and parameters: {'objective': 'Logloss', 'colsample_bylevel': 0.09843117007927724, 'depth': 7, 'boosting_type': 'Plain', 'bootstrap_type': 'Bayesian', 'bagging_temperature': 3.7580258757312826}. Best is trial 1464 with value: 0.8990825688073395.
[32m[I 2023-04-21 00:00:55,132][39m Trial 2999 finished with value: 0.8376068376068375 and parameters: {'objective': 'Logloss', 'colsample_bylevel': 0.09507260178482557, 'depth': 4, 'boosting_type': 'Ordered', 'bootstrap_type': 'Bayesian', 'bagging_temperature': 5.232792525105596}. Best is trial 1464 with value: 0.8990825688073395.
[32m[I 2023-04-21 00:00:56,188][39m Trial 3000 finished with value: 0.8545454545454546 and parameters: {'objective': 'Logloss', 'colsample_bylevel': 0.09329961004726206, 'depth': 7, 'boosting_type': 'Plain', 'bootstrap_type': 'Bayesian', 'bagging_temperature': 3.5436077629080662}. Best is trial 1464 with value: 0.8990825688073395.
[32m[I 2023-04-21 00:00:57,422][39m Trial 3001 finished with value: 0.8807339449541284 and parameters: {'objective': 'Logloss', 'colsample_bylevel': 0.09685860630840282, 'depth': 7, 'boosting_type': 'Plain', 'bootstrap_type': 'Bayesian', 'bagging_temperature': 3.6333475153781687}. Best is trial 1464 with value: 0.8990825688073395.
[32m[I 2023-04-21 00:00:58,349][39m Trial 3002 finished with value: 0.8703703703703703 and parameters: {'objective': 'Logloss', 'colsample_bylevel': 0.0931705911379428, 'depth': 7, 'boosting_type': 'Plain', 'bootstrap_type': 'Bayesian', 'bagging_temperature': 3.569506623728964}. Best is trial 1464 with value: 0.8990825688073395.
[32m[I 2023-04-21 00:00:59,524][39m Trial 3003 finished with value: 0.8495575221238938 and parameters: {'objective': 'Logloss', 'colsample_bylevel': 0.09118248398473401, 'depth': 7, 'boosting_type': 'Plain', 'bootstrap_type': 'MVS'}. Best is trial 1464 with value: 0.8990825688073395.
[32m[I 2023-04-21 00:01:00,438][39m Trial 3004 finished with value: 0.875 and parameters: {'objective': 'Logloss', 'colsample_bylevel': 0.09339030430626584, 'depth': 7, 'boosting_type': 'Plain', 'bootstrap_type': 'Bayesian', 'bagging_temperature': 3.7141991394683087}. Best is trial 1464 with value: 0.8990825688073395.
[32m[I 2023-04-21 00:01:01,193][39m Trial 3005 finished with value: 0.8448275862068967 and parameters: {'objective': 'Logloss', 'colsample_bylevel': 0.06198636498117395, 'depth': 7, 'boosting_type': 'Plain', 'bootstrap_type': 'Bayesian', 'bagging_temperature': 5.686786604398169}. Best is trial 1464 with value: 0.8990825688073395.
[32m[I 2023-04-21 00:01:02,230][39m Trial 3006 finished with value: 0.8727272727272727 and parameters: {'objective': 'Logloss', 'colsample_bylevel': 0.095615963725699, 'depth': 7, 'boosting_type': 'Plain', 'bootstrap_type': 'Bayesian', 'bagging_temperature': 3.8775936202239047}. Best is trial 1464 with value: 0.8990825688073395.
[32m[I 2023-04-21 00:01:03,525][39m Trial 3007 finished with value: 0.875 and parameters: {'objective': 'Logloss', 'colsample_bylevel': 0.0980979655917932, 'depth': 7, 'boosting_type': 'Plain', 'bootstrap_type': 'Bayesian', 'bagging_temperature': 3.626140215961337}. Best is trial 1464 with value: 0.8990825688073395.
[32m[I 2023-04-21 00:01:04,419][39m Trial 3008 finished with value: 0.8648648648648648 and parameters: {'objective': 'Logloss', 'colsample_bylevel': 0.09831893854700736, 'depth': 7, 'boosting_type': 'Plain', 'bootstrap_type': 'Bayesian', 'bagging_temperature': 6.022957082064084}. Best is trial 1464 with value: 0.8990825688073395.
[32m[I 2023-04-21 00:01:05,771][39m Trial 3009 finished with value: 0.8727272727272727 and parameters: {'objective': 'Logloss', 'colsample_bylevel': 0.09293787177006496, 'depth': 7, 'boosting_type': 'Plain', 'bootstrap_type': 'Bayesian', 'bagging_temperature': 6.621750799998276}. Best is trial 1464 with value: 0.8990825688073395.
[32m[I 2023-04-21 00:01:06,667][39m Trial 3010 finished with value: 0.8727272727272727 and parameters: {'objective': 'Logloss', 'colsample_bylevel': 0.09132069473363119, 'depth': 7, 'boosting_type': 'Plain', 'bootstrap_type': 'Bayesian', 'bagging_temperature': 3.743961740052553}. Best is trial 1464 with value: 0.8990825688073395.
[32m[I 2023-04-21 00:01:07,755][39m Trial 3011 finished with value: 0.8807339449541284 and parameters: {'objective': 'Logloss', 'colsample_bylevel': 0.09360529258758331, 'depth': 7, 'boosting_type': 'Plain', 'bootstrap_type': 'Bayesian', 'bagging_temperature': 4.174167980699888}. Best is trial 1464 with value: 0.8990825688073395.
[32m[I 2023-04-21 00:01:08,981][39m Trial 3012 finished with value: 0.8672566371681416 and parameters: {'objective': 'Logloss', 'colsample_bylevel': 0.09408947250105561, 'depth': 7, 'boosting_type': 'Plain', 'bootstrap_type': 'Bayesian', 'bagging_temperature': 3.8788230294723713}. Best is trial 1464 with value: 0.8990825688073395.
[32m[I 2023-04-21 00:01:10,099][39m Trial 3013 finished with value: 0.8623853211009175 and parameters: {'objective': 'Logloss', 'colsample_bylevel': 0.09091896003521376, 'depth': 7, 'boosting_type': 'Plain', 'bootstrap_type': 'Bayesian', 'bagging_temperature': 3.9530939260653866}. Best is trial 1464 with value: 0.8990825688073395.
[32m[I 2023-04-21 00:01:11,405][39m Trial 3014 finished with value: 0.8648648648648648 and parameters: {'objective': 'Logloss', 'colsample_bylevel': 0.09413661173516177, 'depth': 7, 'boosting_type': 'Plain', 'bootstrap_type': 'Bayesian', 'bagging_temperature': 3.5810812720850294}. Best is trial 1464 with value: 0.8990825688073395.
[32m[I 2023-04-21 00:01:12,573][39m Trial 3015 finished with value: 0.8545454545454546 and parameters: {'objective': 'Logloss', 'colsample_bylevel': 0.09595895299665756, 'depth': 7, 'boosting_type': 'Plain', 'bootstrap_type': 'Bayesian', 'bagging_temperature': 3.7912437373549763}. Best is trial 1464 with value: 0.8990825688073395.
[32m[I 2023-04-21 00:01:13,657][39m Trial 3016 finished with value: 0.8727272727272727 and parameters: {'objective': 'Logloss', 'colsample_bylevel': 0.09995606555060413, 'depth': 7, 'boosting_type': 'Plain', 'bootstrap_type': 'Bayesian', 'bagging_temperature': 4.018812385028034}. Best is trial 1464 with value: 0.8990825688073395.
[32m[I 2023-04-21 00:01:14,792][39m Trial 3017 finished with value: 0.8807339449541284 and parameters: {'objective': 'Logloss', 'colsample_bylevel': 0.09535371276746157, 'depth': 7, 'boosting_type': 'Plain', 'bootstrap_type': 'Bayesian', 'bagging_temperature': 3.7070104814325915}. Best is trial 1464 with value: 0.8990825688073395.
[32m[I 2023-04-21 00:01:20,077][39m Trial 3018 finished with value: 0.8421052631578947 and parameters: {'objective': 'Logloss', 'colsample_bylevel': 0.09724383931378879, 'depth': 7, 'boosting_type': 'Ordered', 'bootstrap_type': 'Bayesian', 'bagging_temperature': 3.970039143711543}. Best is trial 1464 with value: 0.8990825688073395.
[32m[I 2023-04-21 00:01:21,066][39m Trial 3019 finished with value: 0.8727272727272727 and parameters: {'objective': 'Logloss', 'colsample_bylevel': 0.04672561191936949, 'depth': 7, 'boosting_type': 'Plain', 'bootstrap_type': 'Bayesian', 'bagging_temperature': 4.159683233185227}. Best is trial 1464 with value: 0.8990825688073395.
[32m[I 2023-04-21 00:01:22,296][39m Trial 3020 finished with value: 0.8785046728971961 and parameters: {'objective': 'Logloss', 'colsample_bylevel': 0.0923978821179368, 'depth': 7, 'boosting_type': 'Plain', 'bootstrap_type': 'Bayesian', 'bagging_temperature': 3.9348043391250442}. Best is trial 1464 with value: 0.8990825688073395.
[32m[I 2023-04-21 00:01:23,281][39m Trial 3021 finished with value: 0.8623853211009175 and parameters: {'objective': 'Logloss', 'colsample_bylevel': 0.09531818847929152, 'depth': 7, 'boosting_type': 'Plain', 'bootstrap_type': 'Bayesian', 'bagging_temperature': 3.7316040564175914}. Best is trial 1464 with value: 0.8990825688073395.
[32m[I 2023-04-21 00:01:24,129][39m Trial 3022 finished with value: 0.8828828828828829 and parameters: {'objective': 'Logloss', 'colsample_bylevel': 0.09502291637003495, 'depth': 7, 'boosting_type': 'Plain', 'bootstrap_type': 'Bayesian', 'bagging_temperature': 3.8109656849982487}. Best is trial 1464 with value: 0.8990825688073395.
[32m[I 2023-04-21 00:01:25,532][39m Trial 3023 finished with value: 0.8703703703703703 and parameters: {'objective': 'Logloss', 'colsample_bylevel': 0.0983254125944208, 'depth': 9, 'boosting_type': 'Plain', 'bootstrap_type': 'Bayesian', 'bagging_temperature': 5.05915183229284}. Best is trial 1464 with value: 0.8990825688073395.
[32m[I 2023-04-21 00:01:26,712][39m Trial 3024 finished with value: 0.8571428571428572 and parameters: {'objective': 'Logloss', 'colsample_bylevel': 0.09650015784251338, 'depth': 7, 'boosting_type': 'Plain', 'bootstrap_type': 'MVS'}. Best is trial 1464 with value: 0.8990825688073395.
[32m[I 2023-04-21 00:01:27,884][39m Trial 3025 finished with value: 0.8623853211009175 and parameters: {'objective': 'Logloss', 'colsample_bylevel': 0.0954085932427938, 'depth': 7, 'boosting_type': 'Plain', 'bootstrap_type': 'Bayesian', 'bagging_temperature': 3.5080797046655783}. Best is trial 1464 with value: 0.8990825688073395.
[32m[I 2023-04-21 00:01:28,851][39m Trial 3026 finished with value: 0.888888888888889 and parameters: {'objective': 'Logloss', 'colsample_bylevel': 0.09824348685941531, 'depth': 7, 'boosting_type': 'Plain', 'bootstrap_type': 'Bayesian', 'bagging_temperature': 5.756945521173443}. Best is trial 1464 with value: 0.8990825688073395.
[32m[I 2023-04-21 00:01:31,114][39m Trial 3028 finished with value: 0.8703703703703703 and parameters: {'objective': 'Logloss', 'colsample_bylevel': 0.09229144932532664, 'depth': 7, 'boosting_type': 'Plain', 'bootstrap_type': 'Bayesian', 'bagging_temperature': 5.424552407955786}. Best is trial 1464 with value: 0.8990825688073395.
[32m[I 2023-04-21 00:01:32,316][39m Trial 3029 finished with value: 0.8703703703703703 and parameters: {'objective': 'Logloss', 'colsample_bylevel': 0.0971407343597, 'depth': 7, 'boosting_type': 'Plain', 'bootstrap_type': 'Bayesian', 'bagging_temperature': 4.239915194143252}. Best is trial 1464 with value: 0.8990825688073395.
