[32m[I 2023-04-20 23:52:44,652][39m Trial 2634 finished with value: 0.8648648648648648 and parameters: {'objective': 'CrossEntropy', 'colsample_bylevel': 0.09611913826043211, 'depth': 11, 'boosting_type': 'Plain', 'bootstrap_type': 'Bayesian', 'bagging_temperature': 4.395485505829836}. Best is trial 1464 with value: 0.8990825688073395.
[32m[I 2023-04-20 23:52:46,010][39m Trial 2635 finished with value: 0.8807339449541284 and parameters: {'objective': 'Logloss', 'colsample_bylevel': 0.09725306667837226, 'depth': 9, 'boosting_type': 'Plain', 'bootstrap_type': 'Bayesian', 'bagging_temperature': 7.037952355590621}. Best is trial 1464 with value: 0.8990825688073395.
[32m[I 2023-04-20 23:52:47,288][39m Trial 2636 finished with value: 0.8807339449541284 and parameters: {'objective': 'Logloss', 'colsample_bylevel': 0.09734042032580137, 'depth': 9, 'boosting_type': 'Plain', 'bootstrap_type': 'Bayesian', 'bagging_temperature': 5.057074979293339}. Best is trial 1464 with value: 0.8990825688073395.
[32m[I 2023-04-20 23:52:48,009][39m Trial 2637 finished with value: 0.8623853211009175 and parameters: {'objective': 'Logloss', 'colsample_bylevel': 0.09457128245072799, 'depth': 6, 'boosting_type': 'Plain', 'bootstrap_type': 'Bayesian', 'bagging_temperature': 5.698475452946392}. Best is trial 1464 with value: 0.8990825688073395.
[32m[I 2023-04-20 23:52:49,140][39m Trial 2638 finished with value: 0.890909090909091 and parameters: {'objective': 'Logloss', 'colsample_bylevel': 0.09865425958736254, 'depth': 8, 'boosting_type': 'Plain', 'bootstrap_type': 'Bayesian', 'bagging_temperature': 5.305296015350557}. Best is trial 1464 with value: 0.8990825688073395.
[32m[I 2023-04-20 23:52:50,616][39m Trial 2639 finished with value: 0.8623853211009175 and parameters: {'objective': 'Logloss', 'colsample_bylevel': 0.09695729833396179, 'depth': 8, 'boosting_type': 'Plain', 'bootstrap_type': 'Bayesian', 'bagging_temperature': 4.035768269843758}. Best is trial 1464 with value: 0.8990825688073395.
[32m[I 2023-04-20 23:52:51,674][39m Trial 2640 finished with value: 0.8828828828828829 and parameters: {'objective': 'CrossEntropy', 'colsample_bylevel': 0.09114321440428343, 'depth': 8, 'boosting_type': 'Plain', 'bootstrap_type': 'Bayesian', 'bagging_temperature': 5.38007732296033}. Best is trial 1464 with value: 0.8990825688073395.
[32m[I 2023-04-20 23:52:52,348][39m Trial 2641 finished with value: 0.7964601769911505 and parameters: {'objective': 'Logloss', 'colsample_bylevel': 0.020618400503349635, 'depth': 10, 'boosting_type': 'Plain', 'bootstrap_type': 'Bayesian', 'bagging_temperature': 5.111814924433902}. Best is trial 1464 with value: 0.8990825688073395.
[32m[I 2023-04-20 23:52:57,332][39m Trial 2642 finished with value: 0.831858407079646 and parameters: {'objective': 'Logloss', 'colsample_bylevel': 0.0923893822679911, 'depth': 10, 'boosting_type': 'Ordered', 'bootstrap_type': 'Bayesian', 'bagging_temperature': 5.270241341080316}. Best is trial 1464 with value: 0.8990825688073395.
[32m[I 2023-04-20 23:52:59,007][39m Trial 2643 finished with value: 0.8828828828828829 and parameters: {'objective': 'CrossEntropy', 'colsample_bylevel': 0.08281494356716029, 'depth': 9, 'boosting_type': 'Plain', 'bootstrap_type': 'Bayesian', 'bagging_temperature': 5.557642336685289}. Best is trial 1464 with value: 0.8990825688073395.
[32m[I 2023-04-20 23:52:59,820][39m Trial 2644 finished with value: 0.8727272727272727 and parameters: {'objective': 'Logloss', 'colsample_bylevel': 0.0973169061035305, 'depth': 8, 'boosting_type': 'Plain', 'bootstrap_type': 'Bayesian', 'bagging_temperature': 5.065641180838213}. Best is trial 1464 with value: 0.8990825688073395.
[32m[I 2023-04-20 23:53:00,805][39m Trial 2645 finished with value: 0.8648648648648648 and parameters: {'objective': 'Logloss', 'colsample_bylevel': 0.09034390238834868, 'depth': 10, 'boosting_type': 'Plain', 'bootstrap_type': 'Bayesian', 'bagging_temperature': 5.49807693499183}. Best is trial 1464 with value: 0.8990825688073395.
[32m[I 2023-04-20 23:53:01,769][39m Trial 2646 finished with value: 0.8807339449541284 and parameters: {'objective': 'Logloss', 'colsample_bylevel': 0.09885958702694085, 'depth': 8, 'boosting_type': 'Plain', 'bootstrap_type': 'Bayesian', 'bagging_temperature': 5.265314135259114}. Best is trial 1464 with value: 0.8990825688073395.
[32m[I 2023-04-20 23:53:02,690][39m Trial 2647 finished with value: 0.8807339449541284 and parameters: {'objective': 'Logloss', 'colsample_bylevel': 0.09819142373554414, 'depth': 9, 'boosting_type': 'Plain', 'bootstrap_type': 'Bayesian', 'bagging_temperature': 5.259064992282125}. Best is trial 1464 with value: 0.8990825688073395.
[32m[I 2023-04-20 23:53:04,212][39m Trial 2648 finished with value: 0.8571428571428572 and parameters: {'objective': 'Logloss', 'colsample_bylevel': 0.09531712801907036, 'depth': 8, 'boosting_type': 'Plain', 'bootstrap_type': 'MVS'}. Best is trial 1464 with value: 0.8990825688073395.
[32m[I 2023-04-20 23:53:05,253][39m Trial 2649 finished with value: 0.8648648648648648 and parameters: {'objective': 'Logloss', 'colsample_bylevel': 0.087492413555914, 'depth': 10, 'boosting_type': 'Plain', 'bootstrap_type': 'Bayesian', 'bagging_temperature': 5.291327451309642}. Best is trial 1464 with value: 0.8990825688073395.
[32m[I 2023-04-20 23:53:06,591][39m Trial 2650 finished with value: 0.8703703703703703 and parameters: {'objective': 'Logloss', 'colsample_bylevel': 0.09291201034218964, 'depth': 8, 'boosting_type': 'Plain', 'bootstrap_type': 'Bayesian', 'bagging_temperature': 7.149177835899522}. Best is trial 1464 with value: 0.8990825688073395.
[32m[I 2023-04-20 23:53:07,290][39m Trial 2651 finished with value: 0.8785046728971961 and parameters: {'objective': 'Logloss', 'colsample_bylevel': 0.09427674280999414, 'depth': 5, 'boosting_type': 'Plain', 'bootstrap_type': 'Bayesian', 'bagging_temperature': 5.427238327520464}. Best is trial 1464 with value: 0.8990825688073395.
[32m[I 2023-04-20 23:53:08,145][39m Trial 2652 finished with value: 0.8828828828828829 and parameters: {'objective': 'Logloss', 'colsample_bylevel': 0.0985229752965191, 'depth': 8, 'boosting_type': 'Plain', 'bootstrap_type': 'Bayesian', 'bagging_temperature': 5.056264106012871}. Best is trial 1464 with value: 0.8990825688073395.
[32m[I 2023-04-20 23:53:09,038][39m Trial 2653 finished with value: 0.8703703703703703 and parameters: {'objective': 'Logloss', 'colsample_bylevel': 0.0983230243833901, 'depth': 8, 'boosting_type': 'Plain', 'bootstrap_type': 'Bayesian', 'bagging_temperature': 5.1677780332643275}. Best is trial 1464 with value: 0.8990825688073395.
[32m[I 2023-04-20 23:53:10,664][39m Trial 2654 finished with value: 0.8828828828828829 and parameters: {'objective': 'Logloss', 'colsample_bylevel': 0.09458225133179103, 'depth': 9, 'boosting_type': 'Plain', 'bootstrap_type': 'Bayesian', 'bagging_temperature': 4.9304142936208475}. Best is trial 1464 with value: 0.8990825688073395.
[32m[I 2023-04-20 23:53:12,435][39m Trial 2655 finished with value: 0.8495575221238938 and parameters: {'objective': 'Logloss', 'colsample_bylevel': 0.09653386016851691, 'depth': 8, 'boosting_type': 'Plain', 'bootstrap_type': 'Bayesian', 'bagging_temperature': 5.637708312557222}. Best is trial 1464 with value: 0.8990825688073395.
[32m[I 2023-04-20 23:53:12,972][39m Trial 2656 finished with value: 0.8727272727272727 and parameters: {'objective': 'CrossEntropy', 'colsample_bylevel': 0.09601717243093996, 'depth': 7, 'boosting_type': 'Plain', 'bootstrap_type': 'Bayesian', 'bagging_temperature': 4.811283075690286}. Best is trial 1464 with value: 0.8990825688073395.
[32m[I 2023-04-20 23:53:13,868][39m Trial 2657 finished with value: 0.8807339449541284 and parameters: {'objective': 'Logloss', 'colsample_bylevel': 0.09725888021144505, 'depth': 8, 'boosting_type': 'Plain', 'bootstrap_type': 'Bayesian', 'bagging_temperature': 5.524517335357286}. Best is trial 1464 with value: 0.8990825688073395.
[32m[I 2023-04-20 23:53:15,147][39m Trial 2658 finished with value: 0.8623853211009175 and parameters: {'objective': 'Logloss', 'colsample_bylevel': 0.09855525608561624, 'depth': 8, 'boosting_type': 'Plain', 'bootstrap_type': 'Bayesian', 'bagging_temperature': 5.852875889810928}. Best is trial 1464 with value: 0.8990825688073395.
[32m[I 2023-04-20 23:53:16,043][39m Trial 2659 finished with value: 0.8495575221238938 and parameters: {'objective': 'Logloss', 'colsample_bylevel': 0.08001725568803525, 'depth': 8, 'boosting_type': 'Plain', 'bootstrap_type': 'Bayesian', 'bagging_temperature': 6.094672617761125}. Best is trial 1464 with value: 0.8990825688073395.
[32m[I 2023-04-20 23:53:17,049][39m Trial 2660 finished with value: 0.8703703703703703 and parameters: {'objective': 'Logloss', 'colsample_bylevel': 0.09979387514523468, 'depth': 8, 'boosting_type': 'Plain', 'bootstrap_type': 'Bayesian', 'bagging_temperature': 4.200781523853828}. Best is trial 1464 with value: 0.8990825688073395.
[32m[I 2023-04-20 23:53:22,595][39m Trial 2661 finished with value: 0.8421052631578947 and parameters: {'objective': 'Logloss', 'colsample_bylevel': 0.09591292438884806, 'depth': 8, 'boosting_type': 'Ordered', 'bootstrap_type': 'Bayesian', 'bagging_temperature': 4.016299144062255}. Best is trial 1464 with value: 0.8990825688073395.
[32m[I 2023-04-20 23:53:23,735][39m Trial 2662 finished with value: 0.8807339449541284 and parameters: {'objective': 'Logloss', 'colsample_bylevel': 0.0922016437044678, 'depth': 7, 'boosting_type': 'Plain', 'bootstrap_type': 'Bayesian', 'bagging_temperature': 6.92037543335424}. Best is trial 1464 with value: 0.8990825688073395.
[32m[I 2023-04-20 23:53:24,670][39m Trial 2663 finished with value: 0.8727272727272727 and parameters: {'objective': 'CrossEntropy', 'colsample_bylevel': 0.09302284771273193, 'depth': 10, 'boosting_type': 'Plain', 'bootstrap_type': 'Bayesian', 'bagging_temperature': 5.505447502416286}. Best is trial 1464 with value: 0.8990825688073395.
[32m[I 2023-04-20 23:53:25,884][39m Trial 2664 finished with value: 0.875 and parameters: {'objective': 'CrossEntropy', 'colsample_bylevel': 0.09671664037393941, 'depth': 9, 'boosting_type': 'Plain', 'bootstrap_type': 'Bayesian', 'bagging_temperature': 5.733377658595986}. Best is trial 1464 with value: 0.8990825688073395.
[32m[I 2023-04-20 23:53:27,139][39m Trial 2665 finished with value: 0.8807339449541284 and parameters: {'objective': 'Logloss', 'colsample_bylevel': 0.09470378293057428, 'depth': 10, 'boosting_type': 'Plain', 'bootstrap_type': 'Bayesian', 'bagging_temperature': 6.225362754739068}. Best is trial 1464 with value: 0.8990825688073395.
[32m[I 2023-04-20 23:53:27,698][39m Trial 2666 finished with value: 0.8495575221238938 and parameters: {'objective': 'CrossEntropy', 'colsample_bylevel': 0.08957588358937443, 'depth': 10, 'boosting_type': 'Plain', 'bootstrap_type': 'Bayesian', 'bagging_temperature': 5.168638002431719}. Best is trial 1464 with value: 0.8990825688073395.
[32m[I 2023-04-20 23:53:29,028][39m Trial 2667 finished with value: 0.8703703703703703 and parameters: {'objective': 'Logloss', 'colsample_bylevel': 0.09972931311888734, 'depth': 10, 'boosting_type': 'Plain', 'bootstrap_type': 'Bayesian', 'bagging_temperature': 5.040103383862395}. Best is trial 1464 with value: 0.8990825688073395.
[32m[I 2023-04-20 23:53:30,019][39m Trial 2668 finished with value: 0.8807339449541284 and parameters: {'objective': 'CrossEntropy', 'colsample_bylevel': 0.09432927329311928, 'depth': 11, 'boosting_type': 'Plain', 'bootstrap_type': 'Bayesian', 'bagging_temperature': 6.810350613899234}. Best is trial 1464 with value: 0.8990825688073395.
[32m[I 2023-04-20 23:53:31,039][39m Trial 2669 finished with value: 0.8807339449541284 and parameters: {'objective': 'Logloss', 'colsample_bylevel': 0.09596208287308691, 'depth': 9, 'boosting_type': 'Plain', 'bootstrap_type': 'Bayesian', 'bagging_temperature': 6.501812991958128}. Best is trial 1464 with value: 0.8990825688073395.
[32m[I 2023-04-20 23:53:32,165][39m Trial 2670 finished with value: 0.8648648648648648 and parameters: {'objective': 'Logloss', 'colsample_bylevel': 0.09512879879845713, 'depth': 12, 'boosting_type': 'Plain', 'bootstrap_type': 'Bayesian', 'bagging_temperature': 8.90125735788139}. Best is trial 1464 with value: 0.8990825688073395.
[32m[I 2023-04-20 23:53:33,231][39m Trial 2671 finished with value: 0.8672566371681416 and parameters: {'objective': 'Logloss', 'colsample_bylevel': 0.09995676332350405, 'depth': 9, 'boosting_type': 'Plain', 'bootstrap_type': 'MVS'}. Best is trial 1464 with value: 0.8990825688073395.
[32m[I 2023-04-20 23:53:34,253][39m Trial 2672 finished with value: 0.8545454545454546 and parameters: {'objective': 'CrossEntropy', 'colsample_bylevel': 0.08463940582739601, 'depth': 8, 'boosting_type': 'Plain', 'bootstrap_type': 'Bayesian', 'bagging_temperature': 5.410762819838332}. Best is trial 1464 with value: 0.8990825688073395.
[32m[I 2023-04-20 23:53:35,407][39m Trial 2673 finished with value: 0.8347826086956522 and parameters: {'objective': 'Logloss', 'colsample_bylevel': 0.06910876426034934, 'depth': 11, 'boosting_type': 'Plain', 'bootstrap_type': 'Bayesian', 'bagging_temperature': 4.473161815312587}. Best is trial 1464 with value: 0.8990825688073395.
[32m[I 2023-04-20 23:53:36,383][39m Trial 2674 finished with value: 0.875 and parameters: {'objective': 'Logloss', 'colsample_bylevel': 0.09265017463465093, 'depth': 11, 'boosting_type': 'Plain', 'bootstrap_type': 'Bayesian', 'bagging_temperature': 5.3628428563793475}. Best is trial 1464 with value: 0.8990825688073395.
[32m[I 2023-04-20 23:53:38,960][39m Trial 2676 finished with value: 0.8727272727272727 and parameters: {'objective': 'Logloss', 'colsample_bylevel': 0.08464423982745314, 'depth': 8, 'boosting_type': 'Plain', 'bootstrap_type': 'Bayesian', 'bagging_temperature': 5.218401468256903}. Best is trial 1464 with value: 0.8990825688073395.
[32m[I 2023-04-20 23:53:40,359][39m Trial 2677 finished with value: 0.8807339449541284 and parameters: {'objective': 'CrossEntropy', 'colsample_bylevel': 0.09996908774039731, 'depth': 8, 'boosting_type': 'Plain', 'bootstrap_type': 'Bayesian', 'bagging_temperature': 5.488225987111128}. Best is trial 1464 with value: 0.8990825688073395.
[32m[I 2023-04-20 23:53:41,597][39m Trial 2678 finished with value: 0.851851851851852 and parameters: {'objective': 'Logloss', 'colsample_bylevel': 0.09793224270874454, 'depth': 9, 'boosting_type': 'Plain', 'bootstrap_type': 'Bayesian', 'bagging_temperature': 5.097209270889135}. Best is trial 1464 with value: 0.8990825688073395.
[32m[I 2023-04-20 23:53:42,793][39m Trial 2679 finished with value: 0.8828828828828829 and parameters: {'objective': 'Logloss', 'colsample_bylevel': 0.09814582069088339, 'depth': 9, 'boosting_type': 'Plain', 'bootstrap_type': 'Bayesian', 'bagging_temperature': 4.975918673949853}. Best is trial 1464 with value: 0.8990825688073395.
[32m[I 2023-04-20 23:53:43,802][39m Trial 2680 finished with value: 0.8807339449541284 and parameters: {'objective': 'CrossEntropy', 'colsample_bylevel': 0.08628740610110316, 'depth': 9, 'boosting_type': 'Plain', 'bootstrap_type': 'Bayesian', 'bagging_temperature': 6.393437096850403}. Best is trial 1464 with value: 0.8990825688073395.
[32m[I 2023-04-20 23:53:48,807][39m Trial 2681 finished with value: 0.8421052631578947 and parameters: {'objective': 'Logloss', 'colsample_bylevel': 0.09713012350092216, 'depth': 7, 'boosting_type': 'Ordered', 'bootstrap_type': 'Bayesian', 'bagging_temperature': 5.173919243031903}. Best is trial 1464 with value: 0.8990825688073395.
[32m[I 2023-04-20 23:53:49,832][39m Trial 2682 finished with value: 0.875 and parameters: {'objective': 'Logloss', 'colsample_bylevel': 0.09690835695374282, 'depth': 7, 'boosting_type': 'Plain', 'bootstrap_type': 'Bayesian', 'bagging_temperature': 4.851510349335174}. Best is trial 1464 with value: 0.8990825688073395.
[32m[I 2023-04-20 23:53:50,808][39m Trial 2683 finished with value: 0.7272727272727274 and parameters: {'objective': 'Logloss', 'colsample_bylevel': 0.01544013650060539, 'depth': 8, 'boosting_type': 'Plain', 'bootstrap_type': 'Bayesian', 'bagging_temperature': 3.9468287484440494}. Best is trial 1464 with value: 0.8990825688073395.
[32m[I 2023-04-20 23:53:52,137][39m Trial 2684 finished with value: 0.8807339449541284 and parameters: {'objective': 'CrossEntropy', 'colsample_bylevel': 0.09395613094375994, 'depth': 8, 'boosting_type': 'Plain', 'bootstrap_type': 'Bayesian', 'bagging_temperature': 7.569298700284079}. Best is trial 1464 with value: 0.8990825688073395.
[32m[I 2023-04-20 23:53:53,447][39m Trial 2685 finished with value: 0.8648648648648648 and parameters: {'objective': 'CrossEntropy', 'colsample_bylevel': 0.08834638702631202, 'depth': 11, 'boosting_type': 'Plain', 'bootstrap_type': 'Bayesian', 'bagging_temperature': 1.8877626409112485}. Best is trial 1464 with value: 0.8990825688073395.
[32m[I 2023-04-20 23:53:55,254][39m Trial 2686 finished with value: 0.8807339449541284 and parameters: {'objective': 'Logloss', 'colsample_bylevel': 0.09979061089259118, 'depth': 8, 'boosting_type': 'Plain', 'bootstrap_type': 'Bayesian', 'bagging_temperature': 5.412851383820474}. Best is trial 1464 with value: 0.8990825688073395.
[32m[I 2023-04-20 23:53:55,822][39m Trial 2687 finished with value: 0.8807339449541284 and parameters: {'objective': 'CrossEntropy', 'colsample_bylevel': 0.0905321950229917, 'depth': 10, 'boosting_type': 'Plain', 'bootstrap_type': 'Bayesian', 'bagging_temperature': 6.909848676707498}. Best is trial 1464 with value: 0.8990825688073395.
[32m[I 2023-04-20 23:53:57,097][39m Trial 2688 finished with value: 0.8807339449541284 and parameters: {'objective': 'Logloss', 'colsample_bylevel': 0.0983948522558437, 'depth': 8, 'boosting_type': 'Plain', 'bootstrap_type': 'Bayesian', 'bagging_temperature': 5.511927090654001}. Best is trial 1464 with value: 0.8990825688073395.
[32m[I 2023-04-20 23:53:57,980][39m Trial 2689 finished with value: 0.8807339449541284 and parameters: {'objective': 'Logloss', 'colsample_bylevel': 0.09693890092153154, 'depth': 9, 'boosting_type': 'Plain', 'bootstrap_type': 'Bayesian', 'bagging_temperature': 4.905940860533065}. Best is trial 1464 with value: 0.8990825688073395.
[32m[I 2023-04-20 23:53:58,574][39m Trial 2690 finished with value: 0.8495575221238938 and parameters: {'objective': 'CrossEntropy', 'colsample_bylevel': 0.08538717592668299, 'depth': 8, 'boosting_type': 'Plain', 'bootstrap_type': 'MVS'}. Best is trial 1464 with value: 0.8990825688073395.
[32m[I 2023-04-20 23:53:59,793][39m Trial 2691 finished with value: 0.8703703703703703 and parameters: {'objective': 'CrossEntropy', 'colsample_bylevel': 0.09345750145413093, 'depth': 9, 'boosting_type': 'Plain', 'bootstrap_type': 'Bayesian', 'bagging_temperature': 6.764296081070394}. Best is trial 1464 with value: 0.8990825688073395.
[32m[I 2023-04-20 23:54:01,274][39m Trial 2692 finished with value: 0.8807339449541284 and parameters: {'objective': 'Logloss', 'colsample_bylevel': 0.09601119515483561, 'depth': 9, 'boosting_type': 'Plain', 'bootstrap_type': 'Bayesian', 'bagging_temperature': 7.232100553831237}. Best is trial 1464 with value: 0.8990825688073395.
[32m[I 2023-04-20 23:54:02,703][39m Trial 2693 finished with value: 0.8785046728971961 and parameters: {'objective': 'CrossEntropy', 'colsample_bylevel': 0.09490794770538788, 'depth': 9, 'boosting_type': 'Plain', 'bootstrap_type': 'Bayesian', 'bagging_temperature': 6.204998716942941}. Best is trial 1464 with value: 0.8990825688073395.
[32m[I 2023-04-20 23:54:03,651][39m Trial 2694 finished with value: 0.8807339449541284 and parameters: {'objective': 'CrossEntropy', 'colsample_bylevel': 0.09716499169527054, 'depth': 11, 'boosting_type': 'Plain', 'bootstrap_type': 'Bayesian', 'bagging_temperature': 5.314405642440996}. Best is trial 1464 with value: 0.8990825688073395.
[32m[I 2023-04-20 23:54:04,301][39m Trial 2695 finished with value: 0.8727272727272727 and parameters: {'objective': 'CrossEntropy', 'colsample_bylevel': 0.09822329126310977, 'depth': 12, 'boosting_type': 'Plain', 'bootstrap_type': 'Bayesian', 'bagging_temperature': 4.717675513107714}. Best is trial 1464 with value: 0.8990825688073395.
[32m[I 2023-04-20 23:54:05,143][39m Trial 2696 finished with value: 0.8571428571428572 and parameters: {'objective': 'CrossEntropy', 'colsample_bylevel': 0.08674875666076962, 'depth': 9, 'boosting_type': 'Plain', 'bootstrap_type': 'Bayesian', 'bagging_temperature': 5.971922951181766}. Best is trial 1464 with value: 0.8990825688073395.
[32m[I 2023-04-20 23:54:06,065][39m Trial 2697 finished with value: 0.8421052631578947 and parameters: {'objective': 'CrossEntropy', 'colsample_bylevel': 0.09338713483657375, 'depth': 4, 'boosting_type': 'Plain', 'bootstrap_type': 'Bayesian', 'bagging_temperature': 6.7738135664275125}. Best is trial 1464 with value: 0.8990825688073395.
[32m[I 2023-04-20 23:54:10,763][39m Trial 2698 finished with value: 0.8376068376068375 and parameters: {'objective': 'CrossEntropy', 'colsample_bylevel': 0.09149015364199642, 'depth': 1, 'boosting_type': 'Ordered', 'bootstrap_type': 'Bayesian', 'bagging_temperature': 7.42182286404992}. Best is trial 1464 with value: 0.8990825688073395.
[32m[I 2023-04-20 23:54:12,452][39m Trial 2699 finished with value: 0.8672566371681416 and parameters: {'objective': 'CrossEntropy', 'colsample_bylevel': 0.08793715131536181, 'depth': 9, 'boosting_type': 'Plain', 'bootstrap_type': 'Bayesian', 'bagging_temperature': 5.8806763900190955}. Best is trial 1464 with value: 0.8990825688073395.
[32m[I 2023-04-20 23:54:14,018][39m Trial 2700 finished with value: 0.8828828828828829 and parameters: {'objective': 'CrossEntropy', 'colsample_bylevel': 0.08723069851775206, 'depth': 8, 'boosting_type': 'Plain', 'bootstrap_type': 'Bayesian', 'bagging_temperature': 4.614035236589431}. Best is trial 1464 with value: 0.8990825688073395.
