[32m[I 2023-04-26 15:03:20,337][39m A new study created in memory with name: no-name-3c1d61ae-b578-4ac7-be52-afa7e462a567
[32m[I 2023-04-26 15:03:20,347][39m Trial 0 finished with value: 0.6823529411764706 and parameters: {'algorithm': 'ball_tree', 'n_neighbors': 7, 'weights': 'distance', 'metric': 'minkowski'}. Best is trial 0 with value: 0.6823529411764706.
[32m[I 2023-04-26 15:03:20,353][39m Trial 1 finished with value: 0.6923076923076923 and parameters: {'algorithm': 'kd_tree', 'n_neighbors': 5, 'weights': 'distance', 'metric': 'minkowski'}. Best is trial 1 with value: 0.6923076923076923.
[32m[I 2023-04-26 15:03:20,361][39m Trial 2 finished with value: 0.7191011235955055 and parameters: {'algorithm': 'kd_tree', 'n_neighbors': 13, 'weights': 'distance', 'metric': 'euclidean'}. Best is trial 2 with value: 0.7191011235955055.
[32m[I 2023-04-26 15:03:20,380][39m Trial 3 finished with value: 0.711111111111111 and parameters: {'algorithm': 'brute', 'n_neighbors': 16, 'weights': 'uniform', 'metric': 'manhattan'}. Best is trial 2 with value: 0.7191011235955055.
[32m[I 2023-04-26 15:03:20,406][39m Trial 4 finished with value: 0.7356321839080461 and parameters: {'algorithm': 'brute', 'n_neighbors': 20, 'weights': 'distance', 'metric': 'manhattan'}. Best is trial 4 with value: 0.7356321839080461.
[32m[I 2023-04-26 15:03:20,418][39m Trial 5 finished with value: 0.6818181818181819 and parameters: {'algorithm': 'auto', 'n_neighbors': 12, 'weights': 'uniform', 'metric': 'minkowski'}. Best is trial 4 with value: 0.7356321839080461.
[32m[I 2023-04-26 15:03:20,440][39m Trial 6 finished with value: 0.7157894736842105 and parameters: {'algorithm': 'brute', 'n_neighbors': 13, 'weights': 'uniform', 'metric': 'minkowski'}. Best is trial 4 with value: 0.7356321839080461.
[32m[I 2023-04-26 15:03:20,448][39m Trial 7 finished with value: 0.7191011235955055 and parameters: {'algorithm': 'ball_tree', 'n_neighbors': 13, 'weights': 'distance', 'metric': 'minkowski'}. Best is trial 4 with value: 0.7356321839080461.
[32m[I 2023-04-26 15:03:20,454][39m Trial 8 finished with value: 0.6923076923076923 and parameters: {'algorithm': 'ball_tree', 'n_neighbors': 4, 'weights': 'distance', 'metric': 'manhattan'}. Best is trial 4 with value: 0.7356321839080461.
[32m[I 2023-04-26 15:03:20,484][39m Trial 9 finished with value: 0.6842105263157895 and parameters: {'algorithm': 'brute', 'n_neighbors': 8, 'weights': 'uniform', 'metric': 'minkowski'}. Best is trial 4 with value: 0.7356321839080461.
[32m[I 2023-04-26 15:03:20,496][39m Trial 10 finished with value: 0.7441860465116279 and parameters: {'algorithm': 'auto', 'n_neighbors': 26, 'weights': 'distance', 'metric': 'manhattan'}. Best is trial 10 with value: 0.7441860465116279.
[32m[I 2023-04-26 15:03:20,507][39m Trial 11 finished with value: 0.7441860465116279 and parameters: {'algorithm': 'auto', 'n_neighbors': 25, 'weights': 'distance', 'metric': 'manhattan'}. Best is trial 10 with value: 0.7441860465116279.
[32m[I 2023-04-26 15:03:20,519][39m Trial 12 finished with value: 0.7142857142857143 and parameters: {'algorithm': 'auto', 'n_neighbors': 30, 'weights': 'distance', 'metric': 'manhattan'}. Best is trial 10 with value: 0.7441860465116279.
[32m[I 2023-04-26 15:03:20,530][39m Trial 13 finished with value: 0.7441860465116279 and parameters: {'algorithm': 'auto', 'n_neighbors': 27, 'weights': 'distance', 'metric': 'manhattan'}. Best is trial 10 with value: 0.7441860465116279.
[32m[I 2023-04-26 15:03:20,541][39m Trial 14 finished with value: 0.7380952380952381 and parameters: {'algorithm': 'auto', 'n_neighbors': 23, 'weights': 'distance', 'metric': 'euclidean'}. Best is trial 10 with value: 0.7441860465116279.
[32m[I 2023-04-26 15:03:20,552][39m Trial 15 finished with value: 0.7441860465116279 and parameters: {'algorithm': 'auto', 'n_neighbors': 22, 'weights': 'distance', 'metric': 'manhattan'}. Best is trial 10 with value: 0.7441860465116279.
[32m[I 2023-04-26 15:03:20,564][39m Trial 16 finished with value: 0.7441860465116279 and parameters: {'algorithm': 'auto', 'n_neighbors': 26, 'weights': 'distance', 'metric': 'manhattan'}. Best is trial 10 with value: 0.7441860465116279.
[32m[I 2023-04-26 15:03:20,574][39m Trial 17 finished with value: 0.7142857142857143 and parameters: {'algorithm': 'auto', 'n_neighbors': 30, 'weights': 'distance', 'metric': 'manhattan'}. Best is trial 10 with value: 0.7441860465116279.
[32m[I 2023-04-26 15:03:20,590][39m Trial 18 finished with value: 0.7764705882352942 and parameters: {'algorithm': 'auto', 'n_neighbors': 20, 'weights': 'uniform', 'metric': 'euclidean'}. Best is trial 18 with value: 0.7764705882352942.
[32m[I 2023-04-26 15:03:20,605][39m Trial 19 finished with value: 0.7674418604651163 and parameters: {'algorithm': 'kd_tree', 'n_neighbors': 18, 'weights': 'uniform', 'metric': 'euclidean'}. Best is trial 18 with value: 0.7764705882352942.
[32m[I 2023-04-26 15:03:20,620][39m Trial 20 finished with value: 0.7674418604651163 and parameters: {'algorithm': 'kd_tree', 'n_neighbors': 18, 'weights': 'uniform', 'metric': 'euclidean'}. Best is trial 18 with value: 0.7764705882352942.
[32m[I 2023-04-26 15:03:20,635][39m Trial 21 finished with value: 0.7674418604651163 and parameters: {'algorithm': 'kd_tree', 'n_neighbors': 19, 'weights': 'uniform', 'metric': 'euclidean'}. Best is trial 18 with value: 0.7764705882352942.
[32m[I 2023-04-26 15:03:20,650][39m Trial 22 finished with value: 0.7674418604651163 and parameters: {'algorithm': 'kd_tree', 'n_neighbors': 18, 'weights': 'uniform', 'metric': 'euclidean'}. Best is trial 18 with value: 0.7764705882352942.
[32m[I 2023-04-26 15:03:20,663][39m Trial 23 finished with value: 0.7526881720430108 and parameters: {'algorithm': 'kd_tree', 'n_neighbors': 17, 'weights': 'uniform', 'metric': 'euclidean'}. Best is trial 18 with value: 0.7764705882352942.
[32m[I 2023-04-26 15:03:20,678][39m Trial 24 finished with value: 0.7727272727272727 and parameters: {'algorithm': 'kd_tree', 'n_neighbors': 21, 'weights': 'uniform', 'metric': 'euclidean'}. Best is trial 18 with value: 0.7764705882352942.
[32m[I 2023-04-26 15:03:20,695][39m Trial 25 finished with value: 0.7727272727272727 and parameters: {'algorithm': 'kd_tree', 'n_neighbors': 21, 'weights': 'uniform', 'metric': 'euclidean'}. Best is trial 18 with value: 0.7764705882352942.
[32m[I 2023-04-26 15:03:20,709][39m Trial 26 finished with value: 0.7727272727272727 and parameters: {'algorithm': 'kd_tree', 'n_neighbors': 22, 'weights': 'uniform', 'metric': 'euclidean'}. Best is trial 18 with value: 0.7764705882352942.
[32m[I 2023-04-26 15:03:20,724][39m Trial 27 finished with value: 0.7727272727272727 and parameters: {'algorithm': 'kd_tree', 'n_neighbors': 23, 'weights': 'uniform', 'metric': 'euclidean'}. Best is trial 18 with value: 0.7764705882352942.
[32m[I 2023-04-26 15:03:20,741][39m Trial 28 finished with value: 0.7816091954022988 and parameters: {'algorithm': 'kd_tree', 'n_neighbors': 24, 'weights': 'uniform', 'metric': 'euclidean'}. Best is trial 28 with value: 0.7816091954022988.
[32m[I 2023-04-26 15:03:20,756][39m Trial 29 finished with value: 0.6666666666666667 and parameters: {'algorithm': 'ball_tree', 'n_neighbors': 28, 'weights': 'uniform', 'metric': 'euclidean'}. Best is trial 28 with value: 0.7816091954022988.
[32m[I 2023-04-26 15:03:20,771][39m Trial 30 finished with value: 0.7727272727272727 and parameters: {'algorithm': 'ball_tree', 'n_neighbors': 23, 'weights': 'uniform', 'metric': 'euclidean'}. Best is trial 28 with value: 0.7816091954022988.
[32m[I 2023-04-26 15:03:20,786][39m Trial 31 finished with value: 0.7816091954022988 and parameters: {'algorithm': 'ball_tree', 'n_neighbors': 24, 'weights': 'uniform', 'metric': 'euclidean'}. Best is trial 28 with value: 0.7816091954022988.
[32m[I 2023-04-26 15:03:20,802][39m Trial 32 finished with value: 0.7816091954022988 and parameters: {'algorithm': 'ball_tree', 'n_neighbors': 24, 'weights': 'uniform', 'metric': 'euclidean'}. Best is trial 28 with value: 0.7816091954022988.
[32m[I 2023-04-26 15:03:20,817][39m Trial 33 finished with value: 0.7777777777777778 and parameters: {'algorithm': 'ball_tree', 'n_neighbors': 25, 'weights': 'uniform', 'metric': 'euclidean'}. Best is trial 28 with value: 0.7816091954022988.
[32m[I 2023-04-26 15:03:20,833][39m Trial 34 finished with value: 0.6923076923076923 and parameters: {'algorithm': 'ball_tree', 'n_neighbors': 1, 'weights': 'uniform', 'metric': 'euclidean'}. Best is trial 28 with value: 0.7816091954022988.
[32m[I 2023-04-26 15:03:20,849][39m Trial 35 finished with value: 0.7777777777777778 and parameters: {'algorithm': 'ball_tree', 'n_neighbors': 25, 'weights': 'uniform', 'metric': 'euclidean'}. Best is trial 28 with value: 0.7816091954022988.
[32m[I 2023-04-26 15:03:20,863][39m Trial 36 finished with value: 0.6666666666666667 and parameters: {'algorithm': 'ball_tree', 'n_neighbors': 28, 'weights': 'uniform', 'metric': 'euclidean'}. Best is trial 28 with value: 0.7816091954022988.
[32m[I 2023-04-26 15:03:20,878][39m Trial 37 finished with value: 0.7816091954022988 and parameters: {'algorithm': 'ball_tree', 'n_neighbors': 24, 'weights': 'uniform', 'metric': 'euclidean'}. Best is trial 28 with value: 0.7816091954022988.
[32m[I 2023-04-26 15:03:20,893][39m Trial 38 finished with value: 0.7659574468085106 and parameters: {'algorithm': 'ball_tree', 'n_neighbors': 15, 'weights': 'uniform', 'metric': 'euclidean'}. Best is trial 28 with value: 0.7816091954022988.
[32m[I 2023-04-26 15:03:20,908][39m Trial 39 finished with value: 0.7816091954022988 and parameters: {'algorithm': 'ball_tree', 'n_neighbors': 24, 'weights': 'uniform', 'metric': 'minkowski'}. Best is trial 28 with value: 0.7816091954022988.
[32m[I 2023-04-26 15:03:20,923][39m Trial 40 finished with value: 0.6666666666666667 and parameters: {'algorithm': 'ball_tree', 'n_neighbors': 29, 'weights': 'uniform', 'metric': 'minkowski'}. Best is trial 28 with value: 0.7816091954022988.
[32m[I 2023-04-26 15:03:20,938][39m Trial 41 finished with value: 0.7816091954022988 and parameters: {'algorithm': 'ball_tree', 'n_neighbors': 24, 'weights': 'uniform', 'metric': 'minkowski'}. Best is trial 28 with value: 0.7816091954022988.
[32m[I 2023-04-26 15:03:20,953][39m Trial 42 finished with value: 0.7356321839080461 and parameters: {'algorithm': 'ball_tree', 'n_neighbors': 27, 'weights': 'uniform', 'metric': 'minkowski'}. Best is trial 28 with value: 0.7816091954022988.
[32m[I 2023-04-26 15:03:20,968][39m Trial 43 finished with value: 0.7816091954022988 and parameters: {'algorithm': 'ball_tree', 'n_neighbors': 24, 'weights': 'uniform', 'metric': 'minkowski'}. Best is trial 28 with value: 0.7816091954022988.
[32m[I 2023-04-26 15:03:20,984][39m Trial 44 finished with value: 0.7311827956989247 and parameters: {'algorithm': 'ball_tree', 'n_neighbors': 11, 'weights': 'uniform', 'metric': 'minkowski'}. Best is trial 28 with value: 0.7816091954022988.
[32m[I 2023-04-26 15:03:21,023][39m Trial 45 finished with value: 0.7764705882352942 and parameters: {'algorithm': 'brute', 'n_neighbors': 20, 'weights': 'uniform', 'metric': 'minkowski'}. Best is trial 28 with value: 0.7816091954022988.
[32m[I 2023-04-26 15:03:21,039][39m Trial 46 finished with value: 0.7209302325581395 and parameters: {'algorithm': 'ball_tree', 'n_neighbors': 26, 'weights': 'uniform', 'metric': 'minkowski'}. Best is trial 28 with value: 0.7816091954022988.
[32m[I 2023-04-26 15:03:21,074][39m Trial 47 finished with value: 0.7659574468085106 and parameters: {'algorithm': 'brute', 'n_neighbors': 15, 'weights': 'uniform', 'metric': 'minkowski'}. Best is trial 28 with value: 0.7816091954022988.
[32m[I 2023-04-26 15:03:21,090][39m Trial 48 finished with value: 0.7816091954022988 and parameters: {'algorithm': 'ball_tree', 'n_neighbors': 24, 'weights': 'uniform', 'metric': 'minkowski'}. Best is trial 28 with value: 0.7816091954022988.
[32m[I 2023-04-26 15:03:21,106][39m Trial 49 finished with value: 0.7727272727272727 and parameters: {'algorithm': 'ball_tree', 'n_neighbors': 22, 'weights': 'uniform', 'metric': 'minkowski'}. Best is trial 28 with value: 0.7816091954022988.
[32m[I 2023-04-26 15:03:21,121][39m Trial 50 finished with value: 0.7356321839080461 and parameters: {'algorithm': 'ball_tree', 'n_neighbors': 27, 'weights': 'uniform', 'metric': 'minkowski'}. Best is trial 28 with value: 0.7816091954022988.
[32m[I 2023-04-26 15:03:21,138][39m Trial 51 finished with value: 0.7816091954022988 and parameters: {'algorithm': 'ball_tree', 'n_neighbors': 24, 'weights': 'uniform', 'metric': 'minkowski'}. Best is trial 28 with value: 0.7816091954022988.
[32m[I 2023-04-26 15:03:21,153][39m Trial 52 finished with value: 0.7777777777777778 and parameters: {'algorithm': 'ball_tree', 'n_neighbors': 25, 'weights': 'uniform', 'metric': 'minkowski'}. Best is trial 28 with value: 0.7816091954022988.
[32m[I 2023-04-26 15:03:21,169][39m Trial 53 finished with value: 0.7727272727272727 and parameters: {'algorithm': 'ball_tree', 'n_neighbors': 21, 'weights': 'uniform', 'metric': 'minkowski'}. Best is trial 28 with value: 0.7816091954022988.
[32m[I 2023-04-26 15:03:21,185][39m Trial 54 finished with value: 0.6666666666666667 and parameters: {'algorithm': 'ball_tree', 'n_neighbors': 28, 'weights': 'uniform', 'metric': 'minkowski'}. Best is trial 28 with value: 0.7816091954022988.
[32m[I 2023-04-26 15:03:21,220][39m Trial 55 finished with value: 0.7727272727272727 and parameters: {'algorithm': 'brute', 'n_neighbors': 23, 'weights': 'uniform', 'metric': 'minkowski'}. Best is trial 28 with value: 0.7816091954022988.
[32m[I 2023-04-26 15:03:21,238][39m Trial 56 finished with value: 0.7209302325581395 and parameters: {'algorithm': 'ball_tree', 'n_neighbors': 26, 'weights': 'uniform', 'metric': 'minkowski'}. Best is trial 28 with value: 0.7816091954022988.
[32m[I 2023-04-26 15:03:21,251][39m Trial 57 finished with value: 0.7228915662650603 and parameters: {'algorithm': 'ball_tree', 'n_neighbors': 9, 'weights': 'distance', 'metric': 'euclidean'}. Best is trial 28 with value: 0.7816091954022988.
[32m[I 2023-04-26 15:03:21,266][39m Trial 58 finished with value: 0.7674418604651163 and parameters: {'algorithm': 'ball_tree', 'n_neighbors': 19, 'weights': 'uniform', 'metric': 'minkowski'}. Best is trial 28 with value: 0.7816091954022988.
[32m[I 2023-04-26 15:03:21,281][39m Trial 59 finished with value: 0.7816091954022988 and parameters: {'algorithm': 'ball_tree', 'n_neighbors': 24, 'weights': 'uniform', 'metric': 'minkowski'}. Best is trial 28 with value: 0.7816091954022988.
[32m[I 2023-04-26 15:03:21,297][39m Trial 60 finished with value: 0.7727272727272727 and parameters: {'algorithm': 'kd_tree', 'n_neighbors': 22, 'weights': 'uniform', 'metric': 'minkowski'}. Best is trial 28 with value: 0.7816091954022988.
[32m[I 2023-04-26 15:03:21,312][39m Trial 61 finished with value: 0.7816091954022988 and parameters: {'algorithm': 'ball_tree', 'n_neighbors': 24, 'weights': 'uniform', 'metric': 'euclidean'}. Best is trial 28 with value: 0.7816091954022988.
[32m[I 2023-04-26 15:03:21,329][39m Trial 62 finished with value: 0.7209302325581395 and parameters: {'algorithm': 'ball_tree', 'n_neighbors': 26, 'weights': 'uniform', 'metric': 'euclidean'}. Best is trial 28 with value: 0.7816091954022988.
[32m[I 2023-04-26 15:03:21,345][39m Trial 63 finished with value: 0.7777777777777778 and parameters: {'algorithm': 'ball_tree', 'n_neighbors': 25, 'weights': 'uniform', 'metric': 'minkowski'}. Best is trial 28 with value: 0.7816091954022988.
[32m[I 2023-04-26 15:03:21,354][39m Trial 64 finished with value: 0.7727272727272727 and parameters: {'algorithm': 'ball_tree', 'n_neighbors': 23, 'weights': 'uniform', 'metric': 'minkowski'}. Best is trial 28 with value: 0.7816091954022988.
[32m[I 2023-04-26 15:03:21,366][39m Trial 65 finished with value: 0.7356321839080461 and parameters: {'algorithm': 'ball_tree', 'n_neighbors': 21, 'weights': 'distance', 'metric': 'manhattan'}. Best is trial 28 with value: 0.7816091954022988.
[32m[I 2023-04-26 15:03:21,382][39m Trial 66 finished with value: 0.6410256410256411 and parameters: {'algorithm': 'kd_tree', 'n_neighbors': 30, 'weights': 'uniform', 'metric': 'euclidean'}. Best is trial 28 with value: 0.7816091954022988.
[32m[I 2023-04-26 15:03:21,398][39m Trial 67 finished with value: 0.7816091954022988 and parameters: {'algorithm': 'ball_tree', 'n_neighbors': 24, 'weights': 'uniform', 'metric': 'minkowski'}. Best is trial 28 with value: 0.7816091954022988.
[32m[I 2023-04-26 15:03:21,413][39m Trial 68 finished with value: 0.7764705882352942 and parameters: {'algorithm': 'ball_tree', 'n_neighbors': 20, 'weights': 'uniform', 'metric': 'minkowski'}. Best is trial 28 with value: 0.7816091954022988.
[32m[I 2023-04-26 15:03:21,441][39m Trial 69 finished with value: 0.7142857142857143 and parameters: {'algorithm': 'brute', 'n_neighbors': 29, 'weights': 'uniform', 'metric': 'manhattan'}. Best is trial 28 with value: 0.7816091954022988.
[32m[I 2023-04-26 15:03:21,453][39m Trial 70 finished with value: 0.7294117647058823 and parameters: {'algorithm': 'auto', 'n_neighbors': 27, 'weights': 'distance', 'metric': 'minkowski'}. Best is trial 28 with value: 0.7816091954022988.
[32m[I 2023-04-26 15:03:21,468][39m Trial 71 finished with value: 0.7816091954022988 and parameters: {'algorithm': 'ball_tree', 'n_neighbors': 24, 'weights': 'uniform', 'metric': 'euclidean'}. Best is trial 28 with value: 0.7816091954022988.
[32m[I 2023-04-26 15:03:21,484][39m Trial 72 finished with value: 0.7727272727272727 and parameters: {'algorithm': 'ball_tree', 'n_neighbors': 22, 'weights': 'uniform', 'metric': 'minkowski'}. Best is trial 28 with value: 0.7816091954022988.
[32m[I 2023-04-26 15:03:21,500][39m Trial 73 finished with value: 0.7727272727272727 and parameters: {'algorithm': 'ball_tree', 'n_neighbors': 23, 'weights': 'uniform', 'metric': 'euclidean'}. Best is trial 28 with value: 0.7816091954022988.
[32m[I 2023-04-26 15:03:21,515][39m Trial 74 finished with value: 0.7816091954022988 and parameters: {'algorithm': 'ball_tree', 'n_neighbors': 24, 'weights': 'uniform', 'metric': 'minkowski'}. Best is trial 28 with value: 0.7816091954022988.
[32m[I 2023-04-26 15:03:21,531][39m Trial 75 finished with value: 0.7777777777777778 and parameters: {'algorithm': 'ball_tree', 'n_neighbors': 25, 'weights': 'uniform', 'metric': 'minkowski'}. Best is trial 28 with value: 0.7816091954022988.
[32m[I 2023-04-26 15:03:21,546][39m Trial 76 finished with value: 0.7674418604651163 and parameters: {'algorithm': 'ball_tree', 'n_neighbors': 19, 'weights': 'uniform', 'metric': 'minkowski'}. Best is trial 28 with value: 0.7816091954022988.
[32m[I 2023-04-26 15:03:21,561][39m Trial 77 finished with value: 0.7209302325581395 and parameters: {'algorithm': 'kd_tree', 'n_neighbors': 26, 'weights': 'uniform', 'metric': 'euclidean'}. Best is trial 28 with value: 0.7816091954022988.
[32m[I 2023-04-26 15:03:21,576][39m Trial 78 finished with value: 0.7727272727272727 and parameters: {'algorithm': 'kd_tree', 'n_neighbors': 21, 'weights': 'uniform', 'metric': 'euclidean'}. Best is trial 28 with value: 0.7816091954022988.
[32m[I 2023-04-26 15:03:21,591][39m Trial 79 finished with value: 0.7727272727272727 and parameters: {'algorithm': 'ball_tree', 'n_neighbors': 23, 'weights': 'uniform', 'metric': 'minkowski'}. Best is trial 28 with value: 0.7816091954022988.
[32m[I 2023-04-26 15:03:21,608][39m Trial 80 finished with value: 0.7777777777777778 and parameters: {'algorithm': 'auto', 'n_neighbors': 27, 'weights': 'uniform', 'metric': 'manhattan'}. Best is trial 28 with value: 0.7816091954022988.
[32m[I 2023-04-26 15:03:21,623][39m Trial 81 finished with value: 0.7777777777777778 and parameters: {'algorithm': 'ball_tree', 'n_neighbors': 25, 'weights': 'uniform', 'metric': 'minkowski'}. Best is trial 28 with value: 0.7816091954022988.
[32m[I 2023-04-26 15:03:21,639][39m Trial 82 finished with value: 0.7816091954022988 and parameters: {'algorithm': 'ball_tree', 'n_neighbors': 24, 'weights': 'uniform', 'metric': 'minkowski'}. Best is trial 28 with value: 0.7816091954022988.
[32m[I 2023-04-26 15:03:21,654][39m Trial 83 finished with value: 0.7816091954022988 and parameters: {'algorithm': 'ball_tree', 'n_neighbors': 24, 'weights': 'uniform', 'metric': 'minkowski'}. Best is trial 28 with value: 0.7816091954022988.
[32m[I 2023-04-26 15:03:21,669][39m Trial 84 finished with value: 0.7727272727272727 and parameters: {'algorithm': 'ball_tree', 'n_neighbors': 22, 'weights': 'uniform', 'metric': 'minkowski'}. Best is trial 28 with value: 0.7816091954022988.
[32m[I 2023-04-26 15:03:21,685][39m Trial 85 finished with value: 0.7209302325581395 and parameters: {'algorithm': 'ball_tree', 'n_neighbors': 26, 'weights': 'uniform', 'metric': 'euclidean'}. Best is trial 28 with value: 0.7816091954022988.
[32m[I 2023-04-26 15:03:21,700][39m Trial 86 finished with value: 0.7727272727272727 and parameters: {'algorithm': 'ball_tree', 'n_neighbors': 22, 'weights': 'uniform', 'metric': 'euclidean'}. Best is trial 28 with value: 0.7816091954022988.
[32m[I 2023-04-26 15:03:21,741][39m Trial 87 finished with value: 0.7228915662650603 and parameters: {'algorithm': 'brute', 'n_neighbors': 25, 'weights': 'distance', 'metric': 'minkowski'}. Best is trial 28 with value: 0.7816091954022988.
[32m[I 2023-04-26 15:03:21,759][39m Trial 88 finished with value: 0.7816091954022988 and parameters: {'algorithm': 'ball_tree', 'n_neighbors': 24, 'weights': 'uniform', 'metric': 'minkowski'}. Best is trial 28 with value: 0.7816091954022988.
[32m[I 2023-04-26 15:03:21,774][39m Trial 89 finished with value: 0.7160493827160495 and parameters: {'algorithm': 'ball_tree', 'n_neighbors': 5, 'weights': 'uniform', 'metric': 'minkowski'}. Best is trial 28 with value: 0.7816091954022988.
