[32m[I 2023-04-26 15:03:24,966][39m Trial 270 finished with value: 0.7727272727272727 and parameters: {'algorithm': 'ball_tree', 'n_neighbors': 23, 'weights': 'uniform', 'metric': 'minkowski'}. Best is trial 28 with value: 0.7816091954022988.
[32m[I 2023-04-26 15:03:24,977][39m Trial 271 finished with value: 0.7816091954022988 and parameters: {'algorithm': 'ball_tree', 'n_neighbors': 24, 'weights': 'uniform', 'metric': 'euclidean'}. Best is trial 28 with value: 0.7816091954022988.
[32m[I 2023-04-26 15:03:24,991][39m Trial 272 finished with value: 0.7209302325581395 and parameters: {'algorithm': 'ball_tree', 'n_neighbors': 26, 'weights': 'uniform', 'metric': 'euclidean'}. Best is trial 28 with value: 0.7816091954022988.
[32m[I 2023-04-26 15:03:25,005][39m Trial 273 finished with value: 0.7816091954022988 and parameters: {'algorithm': 'ball_tree', 'n_neighbors': 24, 'weights': 'uniform', 'metric': 'minkowski'}. Best is trial 28 with value: 0.7816091954022988.
[32m[I 2023-04-26 15:03:25,018][39m Trial 274 finished with value: 0.7777777777777778 and parameters: {'algorithm': 'ball_tree', 'n_neighbors': 25, 'weights': 'uniform', 'metric': 'minkowski'}. Best is trial 28 with value: 0.7816091954022988.
[32m[I 2023-04-26 15:03:25,030][39m Trial 275 finished with value: 0.7727272727272727 and parameters: {'algorithm': 'kd_tree', 'n_neighbors': 22, 'weights': 'uniform', 'metric': 'minkowski'}. Best is trial 28 with value: 0.7816091954022988.
[32m[I 2023-04-26 15:03:25,041][39m Trial 276 finished with value: 0.7727272727272727 and parameters: {'algorithm': 'ball_tree', 'n_neighbors': 23, 'weights': 'uniform', 'metric': 'minkowski'}. Best is trial 28 with value: 0.7816091954022988.
[32m[I 2023-04-26 15:03:25,051][39m Trial 277 finished with value: 0.7816091954022988 and parameters: {'algorithm': 'ball_tree', 'n_neighbors': 24, 'weights': 'uniform', 'metric': 'euclidean'}. Best is trial 28 with value: 0.7816091954022988.
[32m[I 2023-04-26 15:03:25,080][39m Trial 278 finished with value: 0.7816091954022988 and parameters: {'algorithm': 'brute', 'n_neighbors': 24, 'weights': 'uniform', 'metric': 'euclidean'}. Best is trial 28 with value: 0.7816091954022988.
[32m[I 2023-04-26 15:03:25,111][39m Trial 279 finished with value: 0.7777777777777778 and parameters: {'algorithm': 'brute', 'n_neighbors': 25, 'weights': 'uniform', 'metric': 'euclidean'}. Best is trial 28 with value: 0.7816091954022988.
[32m[I 2023-04-26 15:03:25,124][39m Trial 280 finished with value: 0.7727272727272727 and parameters: {'algorithm': 'ball_tree', 'n_neighbors': 23, 'weights': 'uniform', 'metric': 'euclidean'}. Best is trial 28 with value: 0.7816091954022988.
[32m[I 2023-04-26 15:03:25,137][39m Trial 281 finished with value: 0.7816091954022988 and parameters: {'algorithm': 'auto', 'n_neighbors': 24, 'weights': 'uniform', 'metric': 'minkowski'}. Best is trial 28 with value: 0.7816091954022988.
[32m[I 2023-04-26 15:03:25,148][39m Trial 282 finished with value: 0.7816091954022988 and parameters: {'algorithm': 'auto', 'n_neighbors': 24, 'weights': 'uniform', 'metric': 'minkowski'}. Best is trial 28 with value: 0.7816091954022988.
[32m[I 2023-04-26 15:03:25,160][39m Trial 283 finished with value: 0.7777777777777778 and parameters: {'algorithm': 'ball_tree', 'n_neighbors': 25, 'weights': 'uniform', 'metric': 'minkowski'}. Best is trial 28 with value: 0.7816091954022988.
[32m[I 2023-04-26 15:03:25,175][39m Trial 284 finished with value: 0.7294117647058823 and parameters: {'algorithm': 'ball_tree', 'n_neighbors': 26, 'weights': 'distance', 'metric': 'minkowski'}. Best is trial 28 with value: 0.7816091954022988.
[32m[I 2023-04-26 15:03:25,204][39m Trial 285 finished with value: 0.7727272727272727 and parameters: {'algorithm': 'brute', 'n_neighbors': 23, 'weights': 'uniform', 'metric': 'minkowski'}. Best is trial 28 with value: 0.7816091954022988.
[32m[I 2023-04-26 15:03:25,218][39m Trial 286 finished with value: 0.7727272727272727 and parameters: {'algorithm': 'ball_tree', 'n_neighbors': 22, 'weights': 'uniform', 'metric': 'euclidean'}. Best is trial 28 with value: 0.7816091954022988.
[32m[I 2023-04-26 15:03:25,232][39m Trial 287 finished with value: 0.7727272727272727 and parameters: {'algorithm': 'ball_tree', 'n_neighbors': 23, 'weights': 'uniform', 'metric': 'euclidean'}. Best is trial 28 with value: 0.7816091954022988.
[32m[I 2023-04-26 15:03:25,244][39m Trial 288 finished with value: 0.7816091954022988 and parameters: {'algorithm': 'ball_tree', 'n_neighbors': 24, 'weights': 'uniform', 'metric': 'euclidean'}. Best is trial 28 with value: 0.7816091954022988.
[32m[I 2023-04-26 15:03:25,256][39m Trial 289 finished with value: 0.7777777777777778 and parameters: {'algorithm': 'auto', 'n_neighbors': 25, 'weights': 'uniform', 'metric': 'manhattan'}. Best is trial 28 with value: 0.7816091954022988.
[32m[I 2023-04-26 15:03:25,268][39m Trial 290 finished with value: 0.7816091954022988 and parameters: {'algorithm': 'ball_tree', 'n_neighbors': 24, 'weights': 'uniform', 'metric': 'minkowski'}. Best is trial 28 with value: 0.7816091954022988.
[32m[I 2023-04-26 15:03:25,283][39m Trial 291 finished with value: 0.7209302325581395 and parameters: {'algorithm': 'kd_tree', 'n_neighbors': 26, 'weights': 'uniform', 'metric': 'minkowski'}. Best is trial 28 with value: 0.7816091954022988.
[32m[I 2023-04-26 15:03:25,297][39m Trial 292 finished with value: 0.7727272727272727 and parameters: {'algorithm': 'ball_tree', 'n_neighbors': 23, 'weights': 'uniform', 'metric': 'euclidean'}. Best is trial 28 with value: 0.7816091954022988.
[32m[I 2023-04-26 15:03:25,309][39m Trial 293 finished with value: 0.7777777777777778 and parameters: {'algorithm': 'kd_tree', 'n_neighbors': 25, 'weights': 'uniform', 'metric': 'euclidean'}. Best is trial 28 with value: 0.7816091954022988.
[32m[I 2023-04-26 15:03:25,326][39m Trial 294 finished with value: 0.7816091954022988 and parameters: {'algorithm': 'kd_tree', 'n_neighbors': 24, 'weights': 'uniform', 'metric': 'euclidean'}. Best is trial 28 with value: 0.7816091954022988.
[32m[I 2023-04-26 15:03:25,341][39m Trial 295 finished with value: 0.7816091954022988 and parameters: {'algorithm': 'ball_tree', 'n_neighbors': 24, 'weights': 'uniform', 'metric': 'minkowski'}. Best is trial 28 with value: 0.7816091954022988.
[32m[I 2023-04-26 15:03:25,359][39m Trial 296 finished with value: 0.7777777777777778 and parameters: {'algorithm': 'ball_tree', 'n_neighbors': 25, 'weights': 'uniform', 'metric': 'minkowski'}. Best is trial 28 with value: 0.7816091954022988.
[32m[I 2023-04-26 15:03:25,374][39m Trial 297 finished with value: 0.7727272727272727 and parameters: {'algorithm': 'brute', 'n_neighbors': 23, 'weights': 'uniform', 'metric': 'minkowski'}. Best is trial 28 with value: 0.7816091954022988.
[32m[I 2023-04-26 15:03:25,401][39m Trial 298 finished with value: 0.7816091954022988 and parameters: {'algorithm': 'ball_tree', 'n_neighbors': 24, 'weights': 'uniform', 'metric': 'euclidean'}. Best is trial 28 with value: 0.7816091954022988.
[32m[I 2023-04-26 15:03:25,412][39m Trial 299 finished with value: 0.7727272727272727 and parameters: {'algorithm': 'ball_tree', 'n_neighbors': 23, 'weights': 'uniform', 'metric': 'euclidean'}. Best is trial 28 with value: 0.7816091954022988.
[32m[I 2023-04-26 15:03:25,425][39m Trial 300 finished with value: 0.7727272727272727 and parameters: {'algorithm': 'ball_tree', 'n_neighbors': 22, 'weights': 'uniform', 'metric': 'minkowski'}. Best is trial 28 with value: 0.7816091954022988.
[32m[I 2023-04-26 15:03:25,454][39m Trial 301 finished with value: 0.7777777777777778 and parameters: {'algorithm': 'brute', 'n_neighbors': 25, 'weights': 'uniform', 'metric': 'minkowski'}. Best is trial 28 with value: 0.7816091954022988.
[32m[I 2023-04-26 15:03:25,466][39m Trial 302 finished with value: 0.7816091954022988 and parameters: {'algorithm': 'ball_tree', 'n_neighbors': 24, 'weights': 'uniform', 'metric': 'euclidean'}. Best is trial 28 with value: 0.7816091954022988.
[32m[I 2023-04-26 15:03:25,481][39m Trial 303 finished with value: 0.7777777777777778 and parameters: {'algorithm': 'ball_tree', 'n_neighbors': 25, 'weights': 'uniform', 'metric': 'minkowski'}. Best is trial 28 with value: 0.7816091954022988.
[32m[I 2023-04-26 15:03:25,481][39m Trial 304 finished with value: 0.7441860465116279 and parameters: {'algorithm': 'ball_tree', 'n_neighbors': 24, 'weights': 'distance', 'metric': 'manhattan'}. Best is trial 28 with value: 0.7816091954022988.
[32m[I 2023-04-26 15:03:25,511][39m Trial 305 finished with value: 0.7816091954022988 and parameters: {'algorithm': 'kd_tree', 'n_neighbors': 24, 'weights': 'uniform', 'metric': 'minkowski'}. Best is trial 28 with value: 0.7816091954022988.
[32m[I 2023-04-26 15:03:25,530][39m Trial 306 finished with value: 0.7816091954022988 and parameters: {'algorithm': 'ball_tree', 'n_neighbors': 24, 'weights': 'uniform', 'metric': 'minkowski'}. Best is trial 28 with value: 0.7816091954022988.
[32m[I 2023-04-26 15:03:25,546][39m Trial 307 finished with value: 0.7727272727272727 and parameters: {'algorithm': 'ball_tree', 'n_neighbors': 23, 'weights': 'uniform', 'metric': 'euclidean'}. Best is trial 28 with value: 0.7816091954022988.
[32m[I 2023-04-26 15:03:25,560][39m Trial 308 finished with value: 0.7209302325581395 and parameters: {'algorithm': 'ball_tree', 'n_neighbors': 26, 'weights': 'uniform', 'metric': 'minkowski'}. Best is trial 28 with value: 0.7816091954022988.
[32m[I 2023-04-26 15:03:25,571][39m Trial 309 finished with value: 0.7816091954022988 and parameters: {'algorithm': 'auto', 'n_neighbors': 24, 'weights': 'uniform', 'metric': 'minkowski'}. Best is trial 28 with value: 0.7816091954022988.
[32m[I 2023-04-26 15:03:25,581][39m Trial 310 finished with value: 0.7777777777777778 and parameters: {'algorithm': 'ball_tree', 'n_neighbors': 25, 'weights': 'uniform', 'metric': 'minkowski'}. Best is trial 28 with value: 0.7816091954022988.
[32m[I 2023-04-26 15:03:25,598][39m Trial 311 finished with value: 0.6575342465753423 and parameters: {'algorithm': 'ball_tree', 'n_neighbors': 4, 'weights': 'uniform', 'metric': 'minkowski'}. Best is trial 28 with value: 0.7816091954022988.
[32m[I 2023-04-26 15:03:25,610][39m Trial 312 finished with value: 0.7727272727272727 and parameters: {'algorithm': 'ball_tree', 'n_neighbors': 23, 'weights': 'uniform', 'metric': 'euclidean'}. Best is trial 28 with value: 0.7816091954022988.
[32m[I 2023-04-26 15:03:25,620][39m Trial 313 finished with value: 0.7816091954022988 and parameters: {'algorithm': 'ball_tree', 'n_neighbors': 24, 'weights': 'uniform', 'metric': 'minkowski'}. Best is trial 28 with value: 0.7816091954022988.
[32m[I 2023-04-26 15:03:25,630][39m Trial 314 finished with value: 0.7727272727272727 and parameters: {'algorithm': 'auto', 'n_neighbors': 23, 'weights': 'uniform', 'metric': 'euclidean'}. Best is trial 28 with value: 0.7816091954022988.
[32m[I 2023-04-26 15:03:25,662][39m Trial 315 finished with value: 0.7777777777777778 and parameters: {'algorithm': 'brute', 'n_neighbors': 25, 'weights': 'uniform', 'metric': 'minkowski'}. Best is trial 28 with value: 0.7816091954022988.
[32m[I 2023-04-26 15:03:25,676][39m Trial 316 finished with value: 0.7727272727272727 and parameters: {'algorithm': 'ball_tree', 'n_neighbors': 22, 'weights': 'uniform', 'metric': 'minkowski'}. Best is trial 28 with value: 0.7816091954022988.
[32m[I 2023-04-26 15:03:25,709][39m Trial 317 finished with value: 0.7816091954022988 and parameters: {'algorithm': 'brute', 'n_neighbors': 24, 'weights': 'uniform', 'metric': 'minkowski'}. Best is trial 28 with value: 0.7816091954022988.
[32m[I 2023-04-26 15:03:25,743][39m Trial 318 finished with value: 0.7816091954022988 and parameters: {'algorithm': 'brute', 'n_neighbors': 24, 'weights': 'uniform', 'metric': 'euclidean'}. Best is trial 28 with value: 0.7816091954022988.
[32m[I 2023-04-26 15:03:25,779][39m Trial 319 finished with value: 0.7777777777777778 and parameters: {'algorithm': 'brute', 'n_neighbors': 25, 'weights': 'uniform', 'metric': 'euclidean'}. Best is trial 28 with value: 0.7816091954022988.
[32m[I 2023-04-26 15:03:25,792][39m Trial 320 finished with value: 0.7727272727272727 and parameters: {'algorithm': 'ball_tree', 'n_neighbors': 23, 'weights': 'uniform', 'metric': 'euclidean'}. Best is trial 28 with value: 0.7816091954022988.
[32m[I 2023-04-26 15:03:25,811][39m Trial 321 finished with value: 0.7816091954022988 and parameters: {'algorithm': 'auto', 'n_neighbors': 24, 'weights': 'uniform', 'metric': 'minkowski'}. Best is trial 28 with value: 0.7816091954022988.
[32m[I 2023-04-26 15:03:25,824][39m Trial 322 finished with value: 0.7816091954022988 and parameters: {'algorithm': 'auto', 'n_neighbors': 24, 'weights': 'uniform', 'metric': 'minkowski'}. Best is trial 28 with value: 0.7816091954022988.
[32m[I 2023-04-26 15:03:25,835][39m Trial 323 finished with value: 0.7228915662650603 and parameters: {'algorithm': 'ball_tree', 'n_neighbors': 25, 'weights': 'distance', 'metric': 'minkowski'}. Best is trial 28 with value: 0.7816091954022988.
[32m[I 2023-04-26 15:03:25,850][39m Trial 324 finished with value: 0.7209302325581395 and parameters: {'algorithm': 'auto', 'n_neighbors': 26, 'weights': 'uniform', 'metric': 'minkowski'}. Best is trial 28 with value: 0.7816091954022988.
[32m[I 2023-04-26 15:03:25,864][39m Trial 325 finished with value: 0.7727272727272727 and parameters: {'algorithm': 'ball_tree', 'n_neighbors': 23, 'weights': 'uniform', 'metric': 'euclidean'}. Best is trial 28 with value: 0.7816091954022988.
[32m[I 2023-04-26 15:03:25,890][39m Trial 326 finished with value: 0.7727272727272727 and parameters: {'algorithm': 'kd_tree', 'n_neighbors': 23, 'weights': 'uniform', 'metric': 'minkowski'}. Best is trial 28 with value: 0.7816091954022988.
[32m[I 2023-04-26 15:03:25,911][39m Trial 327 finished with value: 0.7674418604651163 and parameters: {'algorithm': 'ball_tree', 'n_neighbors': 18, 'weights': 'uniform', 'metric': 'minkowski'}. Best is trial 28 with value: 0.7816091954022988.
[32m[I 2023-04-26 15:03:25,923][39m Trial 328 finished with value: 0.7777777777777778 and parameters: {'algorithm': 'ball_tree', 'n_neighbors': 25, 'weights': 'uniform', 'metric': 'minkowski'}. Best is trial 28 with value: 0.7816091954022988.
[32m[I 2023-04-26 15:03:25,934][39m Trial 329 finished with value: 0.7816091954022988 and parameters: {'algorithm': 'ball_tree', 'n_neighbors': 24, 'weights': 'uniform', 'metric': 'euclidean'}. Best is trial 28 with value: 0.7816091954022988.
[32m[I 2023-04-26 15:03:26,061][39m Trial 330 finished with value: 0.7816091954022988 and parameters: {'algorithm': 'ball_tree', 'n_neighbors': 24, 'weights': 'uniform', 'metric': 'euclidean'}. Best is trial 28 with value: 0.7816091954022988.
[32m[I 2023-04-26 15:03:26,071][39m Trial 331 finished with value: 0.7727272727272727 and parameters: {'algorithm': 'ball_tree', 'n_neighbors': 22, 'weights': 'uniform', 'metric': 'euclidean'}. Best is trial 28 with value: 0.7816091954022988.
[32m[I 2023-04-26 15:03:26,083][39m Trial 332 finished with value: 0.7816091954022988 and parameters: {'algorithm': 'kd_tree', 'n_neighbors': 24, 'weights': 'uniform', 'metric': 'minkowski'}. Best is trial 28 with value: 0.7816091954022988.
[32m[I 2023-04-26 15:03:26,113][39m Trial 333 finished with value: 0.7157894736842105 and parameters: {'algorithm': 'brute', 'n_neighbors': 13, 'weights': 'uniform', 'metric': 'minkowski'}. Best is trial 28 with value: 0.7816091954022988.
[32m[I 2023-04-26 15:03:26,140][39m Trial 334 finished with value: 0.7096774193548387 and parameters: {'algorithm': 'brute', 'n_neighbors': 14, 'weights': 'uniform', 'metric': 'manhattan'}. Best is trial 28 with value: 0.7816091954022988.
[32m[I 2023-04-26 15:03:26,177][39m Trial 335 finished with value: 0.7777777777777778 and parameters: {'algorithm': 'brute', 'n_neighbors': 25, 'weights': 'uniform', 'metric': 'euclidean'}. Best is trial 28 with value: 0.7816091954022988.
[32m[I 2023-04-26 15:03:26,206][39m Trial 336 finished with value: 0.7727272727272727 and parameters: {'algorithm': 'brute', 'n_neighbors': 23, 'weights': 'uniform', 'metric': 'euclidean'}. Best is trial 28 with value: 0.7816091954022988.
[32m[I 2023-04-26 15:03:26,222][39m Trial 337 finished with value: 0.7777777777777778 and parameters: {'algorithm': 'ball_tree', 'n_neighbors': 25, 'weights': 'uniform', 'metric': 'minkowski'}. Best is trial 28 with value: 0.7816091954022988.
[32m[I 2023-04-26 15:03:26,234][39m Trial 338 finished with value: 0.7209302325581395 and parameters: {'algorithm': 'ball_tree', 'n_neighbors': 26, 'weights': 'uniform', 'metric': 'minkowski'}. Best is trial 28 with value: 0.7816091954022988.
[32m[I 2023-04-26 15:03:26,252][39m Trial 339 finished with value: 0.7816091954022988 and parameters: {'algorithm': 'auto', 'n_neighbors': 24, 'weights': 'uniform', 'metric': 'minkowski'}. Best is trial 28 with value: 0.7816091954022988.
[32m[I 2023-04-26 15:03:26,266][39m Trial 340 finished with value: 0.7727272727272727 and parameters: {'algorithm': 'ball_tree', 'n_neighbors': 23, 'weights': 'uniform', 'metric': 'minkowski'}. Best is trial 28 with value: 0.7816091954022988.
[32m[I 2023-04-26 15:03:26,298][39m Trial 341 finished with value: 0.7816091954022988 and parameters: {'algorithm': 'brute', 'n_neighbors': 24, 'weights': 'uniform', 'metric': 'minkowski'}. Best is trial 28 with value: 0.7816091954022988.
[32m[I 2023-04-26 15:03:26,331][39m Trial 342 finished with value: 0.7777777777777778 and parameters: {'algorithm': 'brute', 'n_neighbors': 25, 'weights': 'uniform', 'metric': 'minkowski'}. Best is trial 28 with value: 0.7816091954022988.
[32m[I 2023-04-26 15:03:26,350][39m Trial 343 finished with value: 0.7380952380952381 and parameters: {'algorithm': 'kd_tree', 'n_neighbors': 23, 'weights': 'distance', 'metric': 'minkowski'}. Best is trial 28 with value: 0.7816091954022988.
[32m[I 2023-04-26 15:03:26,364][39m Trial 344 finished with value: 0.7816091954022988 and parameters: {'algorithm': 'auto', 'n_neighbors': 24, 'weights': 'uniform', 'metric': 'minkowski'}. Best is trial 28 with value: 0.7816091954022988.
[32m[I 2023-04-26 15:03:26,382][39m Trial 345 finished with value: 0.7816091954022988 and parameters: {'algorithm': 'ball_tree', 'n_neighbors': 24, 'weights': 'uniform', 'metric': 'euclidean'}. Best is trial 28 with value: 0.7816091954022988.
[32m[I 2023-04-26 15:03:26,394][39m Trial 346 finished with value: 0.7816091954022988 and parameters: {'algorithm': 'ball_tree', 'n_neighbors': 24, 'weights': 'uniform', 'metric': 'euclidean'}. Best is trial 28 with value: 0.7816091954022988.
[32m[I 2023-04-26 15:03:26,407][39m Trial 347 finished with value: 0.7727272727272727 and parameters: {'algorithm': 'ball_tree', 'n_neighbors': 22, 'weights': 'uniform', 'metric': 'minkowski'}. Best is trial 28 with value: 0.7816091954022988.
[32m[I 2023-04-26 15:03:26,423][39m Trial 348 finished with value: 0.7777777777777778 and parameters: {'algorithm': 'auto', 'n_neighbors': 25, 'weights': 'uniform', 'metric': 'euclidean'}. Best is trial 28 with value: 0.7816091954022988.
[32m[I 2023-04-26 15:03:26,437][39m Trial 349 finished with value: 0.7727272727272727 and parameters: {'algorithm': 'ball_tree', 'n_neighbors': 23, 'weights': 'uniform', 'metric': 'euclidean'}. Best is trial 28 with value: 0.7816091954022988.
[32m[I 2023-04-26 15:03:26,452][39m Trial 350 finished with value: 0.7777777777777778 and parameters: {'algorithm': 'auto', 'n_neighbors': 25, 'weights': 'uniform', 'metric': 'euclidean'}. Best is trial 28 with value: 0.7816091954022988.
[32m[I 2023-04-26 15:03:26,487][39m Trial 351 finished with value: 0.7727272727272727 and parameters: {'algorithm': 'brute', 'n_neighbors': 23, 'weights': 'uniform', 'metric': 'minkowski'}. Best is trial 28 with value: 0.7816091954022988.
[32m[I 2023-04-26 15:03:26,501][39m Trial 352 finished with value: 0.7356321839080461 and parameters: {'algorithm': 'auto', 'n_neighbors': 27, 'weights': 'uniform', 'metric': 'euclidean'}. Best is trial 28 with value: 0.7816091954022988.
[32m[I 2023-04-26 15:03:26,514][39m Trial 353 finished with value: 0.7816091954022988 and parameters: {'algorithm': 'ball_tree', 'n_neighbors': 24, 'weights': 'uniform', 'metric': 'minkowski'}. Best is trial 28 with value: 0.7816091954022988.
[32m[I 2023-04-26 15:03:26,526][39m Trial 354 finished with value: 0.7816091954022988 and parameters: {'algorithm': 'ball_tree', 'n_neighbors': 24, 'weights': 'uniform', 'metric': 'euclidean'}. Best is trial 28 with value: 0.7816091954022988.
[32m[I 2023-04-26 15:03:26,539][39m Trial 355 finished with value: 0.7356321839080461 and parameters: {'algorithm': 'ball_tree', 'n_neighbors': 26, 'weights': 'uniform', 'metric': 'manhattan'}. Best is trial 28 with value: 0.7816091954022988.
[32m[I 2023-04-26 15:03:26,571][39m Trial 356 finished with value: 0.7727272727272727 and parameters: {'algorithm': 'brute', 'n_neighbors': 23, 'weights': 'uniform', 'metric': 'minkowski'}. Best is trial 28 with value: 0.7816091954022988.
[32m[I 2023-04-26 15:03:26,586][39m Trial 357 finished with value: 0.7777777777777778 and parameters: {'algorithm': 'ball_tree', 'n_neighbors': 25, 'weights': 'uniform', 'metric': 'minkowski'}. Best is trial 28 with value: 0.7816091954022988.
[32m[I 2023-04-26 15:03:26,601][39m Trial 358 finished with value: 0.7727272727272727 and parameters: {'algorithm': 'auto', 'n_neighbors': 21, 'weights': 'uniform', 'metric': 'minkowski'}. Best is trial 28 with value: 0.7816091954022988.
[32m[I 2023-04-26 15:03:26,616][39m Trial 359 finished with value: 0.7816091954022988 and parameters: {'algorithm': 'auto', 'n_neighbors': 24, 'weights': 'uniform', 'metric': 'minkowski'}. Best is trial 28 with value: 0.7816091954022988.
