[32m[I 2023-04-26 15:03:23,486][39m Trial 180 finished with value: 0.7727272727272727 and parameters: {'algorithm': 'ball_tree', 'n_neighbors': 23, 'weights': 'uniform', 'metric': 'minkowski'}. Best is trial 28 with value: 0.7816091954022988.
[32m[I 2023-04-26 15:03:23,503][39m Trial 181 finished with value: 0.7816091954022988 and parameters: {'algorithm': 'ball_tree', 'n_neighbors': 24, 'weights': 'uniform', 'metric': 'minkowski'}. Best is trial 28 with value: 0.7816091954022988.
[32m[I 2023-04-26 15:03:23,520][39m Trial 182 finished with value: 0.7816091954022988 and parameters: {'algorithm': 'ball_tree', 'n_neighbors': 24, 'weights': 'uniform', 'metric': 'minkowski'}. Best is trial 28 with value: 0.7816091954022988.
[32m[I 2023-04-26 15:03:23,537][39m Trial 183 finished with value: 0.7777777777777778 and parameters: {'algorithm': 'ball_tree', 'n_neighbors': 25, 'weights': 'uniform', 'metric': 'minkowski'}. Best is trial 28 with value: 0.7816091954022988.
[32m[I 2023-04-26 15:03:23,554][39m Trial 184 finished with value: 0.7816091954022988 and parameters: {'algorithm': 'ball_tree', 'n_neighbors': 24, 'weights': 'uniform', 'metric': 'minkowski'}. Best is trial 28 with value: 0.7816091954022988.
[32m[I 2023-04-26 15:03:23,571][39m Trial 185 finished with value: 0.7816091954022988 and parameters: {'algorithm': 'ball_tree', 'n_neighbors': 24, 'weights': 'uniform', 'metric': 'minkowski'}. Best is trial 28 with value: 0.7816091954022988.
[32m[I 2023-04-26 15:03:23,588][39m Trial 186 finished with value: 0.7777777777777778 and parameters: {'algorithm': 'ball_tree', 'n_neighbors': 25, 'weights': 'uniform', 'metric': 'minkowski'}. Best is trial 28 with value: 0.7816091954022988.
[32m[I 2023-04-26 15:03:23,606][39m Trial 187 finished with value: 0.7727272727272727 and parameters: {'algorithm': 'ball_tree', 'n_neighbors': 23, 'weights': 'uniform', 'metric': 'minkowski'}. Best is trial 28 with value: 0.7816091954022988.
[32m[I 2023-04-26 15:03:23,622][39m Trial 188 finished with value: 0.7816091954022988 and parameters: {'algorithm': 'ball_tree', 'n_neighbors': 24, 'weights': 'uniform', 'metric': 'minkowski'}. Best is trial 28 with value: 0.7816091954022988.
[32m[I 2023-04-26 15:03:23,639][39m Trial 189 finished with value: 0.7777777777777778 and parameters: {'algorithm': 'ball_tree', 'n_neighbors': 25, 'weights': 'uniform', 'metric': 'minkowski'}. Best is trial 28 with value: 0.7816091954022988.
[32m[I 2023-04-26 15:03:23,658][39m Trial 190 finished with value: 0.7356321839080461 and parameters: {'algorithm': 'ball_tree', 'n_neighbors': 26, 'weights': 'uniform', 'metric': 'manhattan'}. Best is trial 28 with value: 0.7816091954022988.
[32m[I 2023-04-26 15:03:23,676][39m Trial 191 finished with value: 0.7816091954022988 and parameters: {'algorithm': 'ball_tree', 'n_neighbors': 24, 'weights': 'uniform', 'metric': 'euclidean'}. Best is trial 28 with value: 0.7816091954022988.
[32m[I 2023-04-26 15:03:23,693][39m Trial 192 finished with value: 0.7727272727272727 and parameters: {'algorithm': 'auto', 'n_neighbors': 23, 'weights': 'uniform', 'metric': 'minkowski'}. Best is trial 28 with value: 0.7816091954022988.
[32m[I 2023-04-26 15:03:23,710][39m Trial 193 finished with value: 0.7816091954022988 and parameters: {'algorithm': 'auto', 'n_neighbors': 24, 'weights': 'uniform', 'metric': 'minkowski'}. Best is trial 28 with value: 0.7816091954022988.
[32m[I 2023-04-26 15:03:23,727][39m Trial 194 finished with value: 0.6818181818181819 and parameters: {'algorithm': 'auto', 'n_neighbors': 12, 'weights': 'uniform', 'metric': 'minkowski'}. Best is trial 28 with value: 0.7816091954022988.
[32m[I 2023-04-26 15:03:23,745][39m Trial 195 finished with value: 0.7777777777777778 and parameters: {'algorithm': 'ball_tree', 'n_neighbors': 25, 'weights': 'uniform', 'metric': 'minkowski'}. Best is trial 28 with value: 0.7816091954022988.
[32m[I 2023-04-26 15:03:23,762][39m Trial 196 finished with value: 0.7816091954022988 and parameters: {'algorithm': 'ball_tree', 'n_neighbors': 24, 'weights': 'uniform', 'metric': 'euclidean'}. Best is trial 28 with value: 0.7816091954022988.
[32m[I 2023-04-26 15:03:23,780][39m Trial 197 finished with value: 0.7727272727272727 and parameters: {'algorithm': 'ball_tree', 'n_neighbors': 23, 'weights': 'uniform', 'metric': 'euclidean'}. Best is trial 28 with value: 0.7816091954022988.
[32m[I 2023-04-26 15:03:23,814][39m Trial 198 finished with value: 0.7816091954022988 and parameters: {'algorithm': 'brute', 'n_neighbors': 24, 'weights': 'uniform', 'metric': 'minkowski'}. Best is trial 28 with value: 0.7816091954022988.
[32m[I 2023-04-26 15:03:23,845][39m Trial 199 finished with value: 0.7727272727272727 and parameters: {'algorithm': 'brute', 'n_neighbors': 22, 'weights': 'uniform', 'metric': 'minkowski'}. Best is trial 28 with value: 0.7816091954022988.
[32m[I 2023-04-26 15:03:23,858][39m Trial 200 finished with value: 0.7228915662650603 and parameters: {'algorithm': 'auto', 'n_neighbors': 25, 'weights': 'distance', 'metric': 'euclidean'}. Best is trial 28 with value: 0.7816091954022988.
[32m[I 2023-04-26 15:03:23,869][39m Trial 201 finished with value: 0.7816091954022988 and parameters: {'algorithm': 'ball_tree', 'n_neighbors': 24, 'weights': 'uniform', 'metric': 'minkowski'}. Best is trial 28 with value: 0.7816091954022988.
[32m[I 2023-04-26 15:03:23,881][39m Trial 202 finished with value: 0.7727272727272727 and parameters: {'algorithm': 'ball_tree', 'n_neighbors': 23, 'weights': 'uniform', 'metric': 'minkowski'}. Best is trial 28 with value: 0.7816091954022988.
[32m[I 2023-04-26 15:03:23,891][39m Trial 203 finished with value: 0.7816091954022988 and parameters: {'algorithm': 'ball_tree', 'n_neighbors': 24, 'weights': 'uniform', 'metric': 'minkowski'}. Best is trial 28 with value: 0.7816091954022988.
[32m[I 2023-04-26 15:03:23,905][39m Trial 204 finished with value: 0.7816091954022988 and parameters: {'algorithm': 'ball_tree', 'n_neighbors': 24, 'weights': 'uniform', 'metric': 'minkowski'}. Best is trial 28 with value: 0.7816091954022988.
[32m[I 2023-04-26 15:03:23,916][39m Trial 205 finished with value: 0.7727272727272727 and parameters: {'algorithm': 'ball_tree', 'n_neighbors': 23, 'weights': 'uniform', 'metric': 'minkowski'}. Best is trial 28 with value: 0.7816091954022988.
[32m[I 2023-04-26 15:03:23,944][39m Trial 206 finished with value: 0.7209302325581395 and parameters: {'algorithm': 'brute', 'n_neighbors': 26, 'weights': 'uniform', 'metric': 'euclidean'}. Best is trial 28 with value: 0.7816091954022988.
[32m[I 2023-04-26 15:03:23,955][39m Trial 207 finished with value: 0.7777777777777778 and parameters: {'algorithm': 'kd_tree', 'n_neighbors': 25, 'weights': 'uniform', 'metric': 'minkowski'}. Best is trial 28 with value: 0.7816091954022988.
[32m[I 2023-04-26 15:03:23,985][39m Trial 208 finished with value: 0.7816091954022988 and parameters: {'algorithm': 'brute', 'n_neighbors': 24, 'weights': 'uniform', 'metric': 'euclidean'}. Best is trial 28 with value: 0.7816091954022988.
[32m[I 2023-04-26 15:03:24,018][39m Trial 209 finished with value: 0.7816091954022988 and parameters: {'algorithm': 'brute', 'n_neighbors': 24, 'weights': 'uniform', 'metric': 'euclidean'}. Best is trial 28 with value: 0.7816091954022988.
[32m[I 2023-04-26 15:03:24,045][39m Trial 210 finished with value: 0.7777777777777778 and parameters: {'algorithm': 'brute', 'n_neighbors': 25, 'weights': 'uniform', 'metric': 'euclidean'}. Best is trial 28 with value: 0.7816091954022988.
[32m[I 2023-04-26 15:03:24,073][39m Trial 211 finished with value: 0.7727272727272727 and parameters: {'algorithm': 'brute', 'n_neighbors': 23, 'weights': 'uniform', 'metric': 'minkowski'}. Best is trial 28 with value: 0.7816091954022988.
[32m[I 2023-04-26 15:03:24,086][39m Trial 212 finished with value: 0.7816091954022988 and parameters: {'algorithm': 'ball_tree', 'n_neighbors': 24, 'weights': 'uniform', 'metric': 'minkowski'}. Best is trial 28 with value: 0.7816091954022988.
[32m[I 2023-04-26 15:03:24,103][39m Trial 213 finished with value: 0.7816091954022988 and parameters: {'algorithm': 'ball_tree', 'n_neighbors': 24, 'weights': 'uniform', 'metric': 'minkowski'}. Best is trial 28 with value: 0.7816091954022988.
[32m[I 2023-04-26 15:03:24,114][39m Trial 214 finished with value: 0.7816091954022988 and parameters: {'algorithm': 'ball_tree', 'n_neighbors': 24, 'weights': 'uniform', 'metric': 'minkowski'}. Best is trial 28 with value: 0.7816091954022988.
[32m[I 2023-04-26 15:03:24,124][39m Trial 215 finished with value: 0.7816091954022988 and parameters: {'algorithm': 'ball_tree', 'n_neighbors': 24, 'weights': 'uniform', 'metric': 'minkowski'}. Best is trial 28 with value: 0.7816091954022988.
[32m[I 2023-04-26 15:03:24,136][39m Trial 216 finished with value: 0.7777777777777778 and parameters: {'algorithm': 'ball_tree', 'n_neighbors': 25, 'weights': 'uniform', 'metric': 'minkowski'}. Best is trial 28 with value: 0.7816091954022988.
[32m[I 2023-04-26 15:03:24,149][39m Trial 217 finished with value: 0.7727272727272727 and parameters: {'algorithm': 'kd_tree', 'n_neighbors': 23, 'weights': 'uniform', 'metric': 'minkowski'}. Best is trial 28 with value: 0.7816091954022988.
[32m[I 2023-04-26 15:03:24,163][39m Trial 218 finished with value: 0.7816091954022988 and parameters: {'algorithm': 'ball_tree', 'n_neighbors': 24, 'weights': 'uniform', 'metric': 'euclidean'}. Best is trial 28 with value: 0.7816091954022988.
[32m[I 2023-04-26 15:03:24,179][39m Trial 219 finished with value: 0.7777777777777778 and parameters: {'algorithm': 'auto', 'n_neighbors': 25, 'weights': 'uniform', 'metric': 'minkowski'}. Best is trial 28 with value: 0.7816091954022988.
[32m[I 2023-04-26 15:03:24,195][39m Trial 220 finished with value: 0.7727272727272727 and parameters: {'algorithm': 'ball_tree', 'n_neighbors': 23, 'weights': 'uniform', 'metric': 'minkowski'}. Best is trial 28 with value: 0.7816091954022988.
[32m[I 2023-04-26 15:03:24,213][39m Trial 221 finished with value: 0.7816091954022988 and parameters: {'algorithm': 'ball_tree', 'n_neighbors': 24, 'weights': 'uniform', 'metric': 'euclidean'}. Best is trial 28 with value: 0.7816091954022988.
[32m[I 2023-04-26 15:03:24,223][39m Trial 222 finished with value: 0.7816091954022988 and parameters: {'algorithm': 'ball_tree', 'n_neighbors': 24, 'weights': 'uniform', 'metric': 'euclidean'}. Best is trial 28 with value: 0.7816091954022988.
[32m[I 2023-04-26 15:03:24,238][39m Trial 223 finished with value: 0.7816091954022988 and parameters: {'algorithm': 'ball_tree', 'n_neighbors': 24, 'weights': 'uniform', 'metric': 'euclidean'}. Best is trial 28 with value: 0.7816091954022988.
[32m[I 2023-04-26 15:03:24,247][39m Trial 224 finished with value: 0.7727272727272727 and parameters: {'algorithm': 'ball_tree', 'n_neighbors': 23, 'weights': 'uniform', 'metric': 'minkowski'}. Best is trial 28 with value: 0.7816091954022988.
[32m[I 2023-04-26 15:03:24,261][39m Trial 225 finished with value: 0.7816091954022988 and parameters: {'algorithm': 'ball_tree', 'n_neighbors': 24, 'weights': 'uniform', 'metric': 'euclidean'}. Best is trial 28 with value: 0.7816091954022988.
[32m[I 2023-04-26 15:03:24,278][39m Trial 226 finished with value: 0.7777777777777778 and parameters: {'algorithm': 'auto', 'n_neighbors': 25, 'weights': 'uniform', 'metric': 'minkowski'}. Best is trial 28 with value: 0.7816091954022988.
[32m[I 2023-04-26 15:03:24,287][39m Trial 227 finished with value: 0.7727272727272727 and parameters: {'algorithm': 'auto', 'n_neighbors': 23, 'weights': 'uniform', 'metric': 'minkowski'}. Best is trial 28 with value: 0.7816091954022988.
[32m[I 2023-04-26 15:03:24,303][39m Trial 228 finished with value: 0.7126436781609194 and parameters: {'algorithm': 'ball_tree', 'n_neighbors': 7, 'weights': 'uniform', 'metric': 'minkowski'}. Best is trial 28 with value: 0.7816091954022988.
[32m[I 2023-04-26 15:03:24,314][39m Trial 229 finished with value: 0.7777777777777778 and parameters: {'algorithm': 'ball_tree', 'n_neighbors': 25, 'weights': 'uniform', 'metric': 'euclidean'}. Best is trial 28 with value: 0.7816091954022988.
[32m[I 2023-04-26 15:03:24,331][39m Trial 230 finished with value: 0.7727272727272727 and parameters: {'algorithm': 'ball_tree', 'n_neighbors': 22, 'weights': 'uniform', 'metric': 'minkowski'}. Best is trial 28 with value: 0.7816091954022988.
[32m[I 2023-04-26 15:03:24,341][39m Trial 231 finished with value: 0.7816091954022988 and parameters: {'algorithm': 'ball_tree', 'n_neighbors': 24, 'weights': 'uniform', 'metric': 'minkowski'}. Best is trial 28 with value: 0.7816091954022988.
[32m[I 2023-04-26 15:03:24,349][39m Trial 232 finished with value: 0.7294117647058823 and parameters: {'algorithm': 'ball_tree', 'n_neighbors': 24, 'weights': 'uniform', 'metric': 'manhattan'}. Best is trial 28 with value: 0.7816091954022988.
[32m[I 2023-04-26 15:03:24,359][39m Trial 233 finished with value: 0.7816091954022988 and parameters: {'algorithm': 'ball_tree', 'n_neighbors': 24, 'weights': 'uniform', 'metric': 'minkowski'}. Best is trial 28 with value: 0.7816091954022988.
[32m[I 2023-04-26 15:03:24,369][39m Trial 234 finished with value: 0.7816091954022988 and parameters: {'algorithm': 'ball_tree', 'n_neighbors': 24, 'weights': 'uniform', 'metric': 'minkowski'}. Best is trial 28 with value: 0.7816091954022988.
[32m[I 2023-04-26 15:03:24,379][39m Trial 235 finished with value: 0.7777777777777778 and parameters: {'algorithm': 'auto', 'n_neighbors': 25, 'weights': 'uniform', 'metric': 'minkowski'}. Best is trial 28 with value: 0.7816091954022988.
[32m[I 2023-04-26 15:03:24,388][39m Trial 236 finished with value: 0.7727272727272727 and parameters: {'algorithm': 'kd_tree', 'n_neighbors': 23, 'weights': 'uniform', 'metric': 'minkowski'}. Best is trial 28 with value: 0.7816091954022988.
[32m[I 2023-04-26 15:03:24,396][39m Trial 237 finished with value: 0.7526881720430108 and parameters: {'algorithm': 'ball_tree', 'n_neighbors': 17, 'weights': 'uniform', 'metric': 'minkowski'}. Best is trial 28 with value: 0.7816091954022988.
[32m[I 2023-04-26 15:03:24,410][39m Trial 238 finished with value: 0.7380952380952381 and parameters: {'algorithm': 'ball_tree', 'n_neighbors': 23, 'weights': 'distance', 'metric': 'minkowski'}. Best is trial 28 with value: 0.7816091954022988.
[32m[I 2023-04-26 15:03:24,423][39m Trial 239 finished with value: 0.7816091954022988 and parameters: {'algorithm': 'kd_tree', 'n_neighbors': 24, 'weights': 'uniform', 'metric': 'minkowski'}. Best is trial 28 with value: 0.7816091954022988.
[32m[I 2023-04-26 15:03:24,434][39m Trial 240 finished with value: 0.7777777777777778 and parameters: {'algorithm': 'kd_tree', 'n_neighbors': 25, 'weights': 'uniform', 'metric': 'minkowski'}. Best is trial 28 with value: 0.7816091954022988.
[32m[I 2023-04-26 15:03:24,442][39m Trial 241 finished with value: 0.7816091954022988 and parameters: {'algorithm': 'ball_tree', 'n_neighbors': 24, 'weights': 'uniform', 'metric': 'minkowski'}. Best is trial 28 with value: 0.7816091954022988.
[32m[I 2023-04-26 15:03:24,473][39m Trial 242 finished with value: 0.7816091954022988 and parameters: {'algorithm': 'brute', 'n_neighbors': 24, 'weights': 'uniform', 'metric': 'minkowski'}. Best is trial 28 with value: 0.7816091954022988.
[32m[I 2023-04-26 15:03:24,489][39m Trial 243 finished with value: 0.7816091954022988 and parameters: {'algorithm': 'ball_tree', 'n_neighbors': 24, 'weights': 'uniform', 'metric': 'minkowski'}. Best is trial 28 with value: 0.7816091954022988.
[32m[I 2023-04-26 15:03:24,520][39m Trial 244 finished with value: 0.7816091954022988 and parameters: {'algorithm': 'brute', 'n_neighbors': 24, 'weights': 'uniform', 'metric': 'minkowski'}. Best is trial 28 with value: 0.7816091954022988.
[32m[I 2023-04-26 15:03:24,534][39m Trial 245 finished with value: 0.7777777777777778 and parameters: {'algorithm': 'ball_tree', 'n_neighbors': 25, 'weights': 'uniform', 'metric': 'minkowski'}. Best is trial 28 with value: 0.7816091954022988.
[32m[I 2023-04-26 15:03:24,544][39m Trial 246 finished with value: 0.7727272727272727 and parameters: {'algorithm': 'ball_tree', 'n_neighbors': 23, 'weights': 'uniform', 'metric': 'euclidean'}. Best is trial 28 with value: 0.7816091954022988.
[32m[I 2023-04-26 15:03:24,581][39m Trial 247 finished with value: 0.7816091954022988 and parameters: {'algorithm': 'brute', 'n_neighbors': 24, 'weights': 'uniform', 'metric': 'euclidean'}. Best is trial 28 with value: 0.7816091954022988.
[32m[I 2023-04-26 15:03:24,615][39m Trial 248 finished with value: 0.7777777777777778 and parameters: {'algorithm': 'brute', 'n_neighbors': 25, 'weights': 'uniform', 'metric': 'euclidean'}. Best is trial 28 with value: 0.7816091954022988.
[32m[I 2023-04-26 15:03:24,633][39m Trial 249 finished with value: 0.7727272727272727 and parameters: {'algorithm': 'ball_tree', 'n_neighbors': 23, 'weights': 'uniform', 'metric': 'euclidean'}. Best is trial 28 with value: 0.7816091954022988.
[32m[I 2023-04-26 15:03:24,665][39m Trial 250 finished with value: 0.7816091954022988 and parameters: {'algorithm': 'brute', 'n_neighbors': 24, 'weights': 'uniform', 'metric': 'minkowski'}. Best is trial 28 with value: 0.7816091954022988.
[32m[I 2023-04-26 15:03:24,680][39m Trial 251 finished with value: 0.7816091954022988 and parameters: {'algorithm': 'ball_tree', 'n_neighbors': 24, 'weights': 'uniform', 'metric': 'minkowski'}. Best is trial 28 with value: 0.7816091954022988.
[32m[I 2023-04-26 15:03:24,696][39m Trial 252 finished with value: 0.7777777777777778 and parameters: {'algorithm': 'ball_tree', 'n_neighbors': 25, 'weights': 'uniform', 'metric': 'minkowski'}. Best is trial 28 with value: 0.7816091954022988.
[32m[I 2023-04-26 15:03:24,711][39m Trial 253 finished with value: 0.7727272727272727 and parameters: {'algorithm': 'ball_tree', 'n_neighbors': 23, 'weights': 'uniform', 'metric': 'minkowski'}. Best is trial 28 with value: 0.7816091954022988.
[32m[I 2023-04-26 15:03:24,723][39m Trial 254 finished with value: 0.7816091954022988 and parameters: {'algorithm': 'ball_tree', 'n_neighbors': 24, 'weights': 'uniform', 'metric': 'minkowski'}. Best is trial 28 with value: 0.7816091954022988.
[32m[I 2023-04-26 15:03:24,735][39m Trial 255 finished with value: 0.7727272727272727 and parameters: {'algorithm': 'ball_tree', 'n_neighbors': 23, 'weights': 'uniform', 'metric': 'euclidean'}. Best is trial 28 with value: 0.7816091954022988.
[32m[I 2023-04-26 15:03:24,746][39m Trial 256 finished with value: 0.7777777777777778 and parameters: {'algorithm': 'auto', 'n_neighbors': 25, 'weights': 'uniform', 'metric': 'minkowski'}. Best is trial 28 with value: 0.7816091954022988.
[32m[I 2023-04-26 15:03:24,757][39m Trial 257 finished with value: 0.7816091954022988 and parameters: {'algorithm': 'ball_tree', 'n_neighbors': 24, 'weights': 'uniform', 'metric': 'euclidean'}. Best is trial 28 with value: 0.7816091954022988.
[32m[I 2023-04-26 15:03:24,768][39m Trial 258 finished with value: 0.7816091954022988 and parameters: {'algorithm': 'ball_tree', 'n_neighbors': 24, 'weights': 'uniform', 'metric': 'euclidean'}. Best is trial 28 with value: 0.7816091954022988.
[32m[I 2023-04-26 15:03:24,778][39m Trial 259 finished with value: 0.7816091954022988 and parameters: {'algorithm': 'kd_tree', 'n_neighbors': 24, 'weights': 'uniform', 'metric': 'minkowski'}. Best is trial 28 with value: 0.7816091954022988.
[32m[I 2023-04-26 15:03:24,787][39m Trial 260 finished with value: 0.7777777777777778 and parameters: {'algorithm': 'kd_tree', 'n_neighbors': 25, 'weights': 'uniform', 'metric': 'minkowski'}. Best is trial 28 with value: 0.7816091954022988.
[32m[I 2023-04-26 15:03:24,817][39m Trial 261 finished with value: 0.7209302325581395 and parameters: {'algorithm': 'brute', 'n_neighbors': 26, 'weights': 'uniform', 'metric': 'minkowski'}. Best is trial 28 with value: 0.7816091954022988.
[32m[I 2023-04-26 15:03:24,831][39m Trial 262 finished with value: 0.7816091954022988 and parameters: {'algorithm': 'ball_tree', 'n_neighbors': 24, 'weights': 'uniform', 'metric': 'minkowski'}. Best is trial 28 with value: 0.7816091954022988.
[32m[I 2023-04-26 15:03:24,844][39m Trial 263 finished with value: 0.7727272727272727 and parameters: {'algorithm': 'ball_tree', 'n_neighbors': 23, 'weights': 'uniform', 'metric': 'minkowski'}. Best is trial 28 with value: 0.7816091954022988.
[32m[I 2023-04-26 15:03:24,860][39m Trial 264 finished with value: 0.7727272727272727 and parameters: {'algorithm': 'ball_tree', 'n_neighbors': 22, 'weights': 'uniform', 'metric': 'euclidean'}. Best is trial 28 with value: 0.7816091954022988.
[32m[I 2023-04-26 15:03:24,883][39m Trial 265 finished with value: 0.7294117647058823 and parameters: {'algorithm': 'brute', 'n_neighbors': 24, 'weights': 'uniform', 'metric': 'manhattan'}. Best is trial 28 with value: 0.7816091954022988.
[32m[I 2023-04-26 15:03:24,893][39m Trial 266 finished with value: 0.7228915662650603 and parameters: {'algorithm': 'ball_tree', 'n_neighbors': 25, 'weights': 'distance', 'metric': 'minkowski'}. Best is trial 28 with value: 0.7816091954022988.
[32m[I 2023-04-26 15:03:24,923][39m Trial 267 finished with value: 0.7816091954022988 and parameters: {'algorithm': 'brute', 'n_neighbors': 24, 'weights': 'uniform', 'metric': 'minkowski'}. Best is trial 28 with value: 0.7816091954022988.
[32m[I 2023-04-26 15:03:24,927][39m Trial 268 finished with value: 0.7727272727272727 and parameters: {'algorithm': 'ball_tree', 'n_neighbors': 23, 'weights': 'uniform', 'metric': 'euclidean'}. Best is trial 28 with value: 0.7816091954022988.
[32m[I 2023-04-26 15:03:24,948][39m Trial 269 finished with value: 0.7777777777777778 and parameters: {'algorithm': 'ball_tree', 'n_neighbors': 25, 'weights': 'uniform', 'metric': 'euclidean'}. Best is trial 28 with value: 0.7816091954022988.
