[32m[I 2023-04-26 14:56:15,840][39m Trial 146 finished with value: 0.7764705882352942 and parameters: {'criterion': 'entropy', 'n_estimators': 97, 'max_features': 0.9187148791375183, 'max_depth': 34, 'min_samples_split': 7, 'min_samples_leaf': 4}. Best is trial 145 with value: 0.7999999999999999.
[32m[I 2023-04-26 14:56:15,933][39m Trial 147 finished with value: 0.7999999999999999 and parameters: {'criterion': 'entropy', 'n_estimators': 99, 'max_features': 0.9590180595609805, 'max_depth': 22, 'min_samples_split': 6, 'min_samples_leaf': 4}. Best is trial 145 with value: 0.7999999999999999.
[32m[I 2023-04-26 14:56:16,022][39m Trial 148 finished with value: 0.7594936708860759 and parameters: {'criterion': 'entropy', 'n_estimators': 100, 'max_features': 0.964539139046311, 'max_depth': 27, 'min_samples_split': 6, 'min_samples_leaf': 3}. Best is trial 145 with value: 0.7999999999999999.
[32m[I 2023-04-26 14:56:16,117][39m Trial 149 finished with value: 0.7674418604651163 and parameters: {'criterion': 'entropy', 'n_estimators': 103, 'max_features': 0.8819025229934497, 'max_depth': 22, 'min_samples_split': 6, 'min_samples_leaf': 4}. Best is trial 145 with value: 0.7999999999999999.
[32m[I 2023-04-26 14:56:16,217][39m Trial 150 finished with value: 0.7500000000000001 and parameters: {'criterion': 'entropy', 'n_estimators': 98, 'max_features': 0.981674753803254, 'max_depth': 24, 'min_samples_split': 6, 'min_samples_leaf': 5}. Best is trial 145 with value: 0.7999999999999999.
[32m[I 2023-04-26 14:56:16,329][39m Trial 151 finished with value: 0.7560975609756099 and parameters: {'criterion': 'entropy', 'n_estimators': 108, 'max_features': 0.9507301514759391, 'max_depth': 19, 'min_samples_split': 6, 'min_samples_leaf': 4}. Best is trial 145 with value: 0.7999999999999999.
[32m[I 2023-04-26 14:56:16,438][39m Trial 152 finished with value: 0.7674418604651163 and parameters: {'criterion': 'entropy', 'n_estimators': 104, 'max_features': 0.9328239301952934, 'max_depth': 22, 'min_samples_split': 7, 'min_samples_leaf': 4}. Best is trial 145 with value: 0.7999999999999999.
[32m[I 2023-04-26 14:56:16,534][39m Trial 153 finished with value: 0.7529411764705882 and parameters: {'criterion': 'entropy', 'n_estimators': 94, 'max_features': 0.8547269416833277, 'max_depth': 26, 'min_samples_split': 6, 'min_samples_leaf': 4}. Best is trial 145 with value: 0.7999999999999999.
[32m[I 2023-04-26 14:56:16,620][39m Trial 154 finished with value: 0.7560975609756099 and parameters: {'criterion': 'entropy', 'n_estimators': 78, 'max_features': 0.9977830508577981, 'max_depth': 17, 'min_samples_split': 5, 'min_samples_leaf': 4}. Best is trial 145 with value: 0.7999999999999999.
[32m[I 2023-04-26 14:56:16,726][39m Trial 155 finished with value: 0.8095238095238095 and parameters: {'criterion': 'gini', 'n_estimators': 113, 'max_features': 0.8244828661087025, 'max_depth': 28, 'min_samples_split': 6, 'min_samples_leaf': 3}. Best is trial 155 with value: 0.8095238095238095.
[32m[I 2023-04-26 14:56:16,831][39m Trial 156 finished with value: 0.7407407407407408 and parameters: {'criterion': 'gini', 'n_estimators': 107, 'max_features': 0.8160836488586558, 'max_depth': 28, 'min_samples_split': 6, 'min_samples_leaf': 3}. Best is trial 155 with value: 0.8095238095238095.
[32m[I 2023-04-26 14:56:16,970][39m Trial 157 finished with value: 0.7560975609756099 and parameters: {'criterion': 'gini', 'n_estimators': 149, 'max_features': 0.9557271193163355, 'max_depth': 24, 'min_samples_split': 6, 'min_samples_leaf': 3}. Best is trial 155 with value: 0.8095238095238095.
[32m[I 2023-04-26 14:56:17,080][39m Trial 158 finished with value: 0.7560975609756099 and parameters: {'criterion': 'gini', 'n_estimators': 114, 'max_features': 0.8330037612001019, 'max_depth': 22, 'min_samples_split': 7, 'min_samples_leaf': 2}. Best is trial 155 with value: 0.8095238095238095.
[32m[I 2023-04-26 14:56:17,192][39m Trial 159 finished with value: 0.761904761904762 and parameters: {'criterion': 'gini', 'n_estimators': 119, 'max_features': 0.8734245309686434, 'max_depth': 36, 'min_samples_split': 6, 'min_samples_leaf': 3}. Best is trial 155 with value: 0.8095238095238095.
[32m[I 2023-04-26 14:56:17,282][39m Trial 160 finished with value: 0.7764705882352942 and parameters: {'criterion': 'gini', 'n_estimators': 90, 'max_features': 0.9767844469028549, 'max_depth': 30, 'min_samples_split': 5, 'min_samples_leaf': 3}. Best is trial 155 with value: 0.8095238095238095.
[32m[I 2023-04-26 14:56:17,385][39m Trial 161 finished with value: 0.7764705882352942 and parameters: {'criterion': 'entropy', 'n_estimators': 99, 'max_features': 0.9060947921477581, 'max_depth': 21, 'min_samples_split': 6, 'min_samples_leaf': 4}. Best is trial 155 with value: 0.8095238095238095.
[32m[I 2023-04-26 14:56:17,491][39m Trial 162 finished with value: 0.7951807228915663 and parameters: {'criterion': 'entropy', 'n_estimators': 102, 'max_features': 0.9232914049673884, 'max_depth': 19, 'min_samples_split': 6, 'min_samples_leaf': 4}. Best is trial 155 with value: 0.8095238095238095.
[32m[I 2023-04-26 14:56:17,597][39m Trial 163 finished with value: 0.761904761904762 and parameters: {'criterion': 'entropy', 'n_estimators': 103, 'max_features': 0.8016284579829128, 'max_depth': 25, 'min_samples_split': 6, 'min_samples_leaf': 4}. Best is trial 155 with value: 0.8095238095238095.
[32m[I 2023-04-26 14:56:17,694][39m Trial 164 finished with value: 0.7999999999999999 and parameters: {'criterion': 'entropy', 'n_estimators': 94, 'max_features': 0.9150913982335321, 'max_depth': 16, 'min_samples_split': 6, 'min_samples_leaf': 4}. Best is trial 155 with value: 0.8095238095238095.
[32m[I 2023-04-26 14:56:17,793][39m Trial 165 finished with value: 0.7674418604651163 and parameters: {'criterion': 'entropy', 'n_estimators': 94, 'max_features': 0.9251441712588632, 'max_depth': 20, 'min_samples_split': 6, 'min_samples_leaf': 4}. Best is trial 155 with value: 0.8095238095238095.
[32m[I 2023-04-26 14:56:17,906][39m Trial 166 finished with value: 0.7692307692307694 and parameters: {'criterion': 'entropy', 'n_estimators': 110, 'max_features': 0.8999568607983583, 'max_depth': 19, 'min_samples_split': 6, 'min_samples_leaf': 4}. Best is trial 155 with value: 0.8095238095238095.
[32m[I 2023-04-26 14:56:18,001][39m Trial 167 finished with value: 0.7333333333333334 and parameters: {'criterion': 'gini', 'n_estimators': 101, 'max_features': 0.8883537234890722, 'max_depth': 28, 'min_samples_split': 6, 'min_samples_leaf': 8}. Best is trial 155 with value: 0.8095238095238095.
[32m[I 2023-04-26 14:56:18,108][39m Trial 168 finished with value: 0.7500000000000001 and parameters: {'criterion': 'entropy', 'n_estimators': 106, 'max_features': 0.9252974442298122, 'max_depth': 16, 'min_samples_split': 7, 'min_samples_leaf': 5}. Best is trial 155 with value: 0.8095238095238095.
[32m[I 2023-04-26 14:56:18,235][39m Trial 169 finished with value: 0.7857142857142858 and parameters: {'criterion': 'entropy', 'n_estimators': 127, 'max_features': 0.9617657008987607, 'max_depth': 32, 'min_samples_split': 6, 'min_samples_leaf': 4}. Best is trial 155 with value: 0.8095238095238095.
[32m[I 2023-04-26 14:56:18,329][39m Trial 170 finished with value: 0.717391304347826 and parameters: {'criterion': 'entropy', 'n_estimators': 96, 'max_features': 0.9700484754271063, 'max_depth': 32, 'min_samples_split': 6, 'min_samples_leaf': 11}. Best is trial 155 with value: 0.8095238095238095.
[32m[I 2023-04-26 14:56:18,471][39m Trial 171 finished with value: 0.7088607594936709 and parameters: {'criterion': 'entropy', 'n_estimators': 131, 'max_features': 0.9442000773379353, 'max_depth': 34, 'min_samples_split': 6, 'min_samples_leaf': 1}. Best is trial 155 with value: 0.8095238095238095.
[32m[I 2023-04-26 14:56:18,598][39m Trial 172 finished with value: 0.7816091954022988 and parameters: {'criterion': 'entropy', 'n_estimators': 122, 'max_features': 0.9625762715142732, 'max_depth': 42, 'min_samples_split': 6, 'min_samples_leaf': 4}. Best is trial 155 with value: 0.8095238095238095.
[32m[I 2023-04-26 14:56:18,727][39m Trial 173 finished with value: 0.746987951807229 and parameters: {'criterion': 'entropy', 'n_estimators': 126, 'max_features': 0.9866007865759525, 'max_depth': 37, 'min_samples_split': 6, 'min_samples_leaf': 4}. Best is trial 155 with value: 0.8095238095238095.
[32m[I 2023-04-26 14:56:18,855][39m Trial 174 finished with value: 0.7857142857142858 and parameters: {'criterion': 'entropy', 'n_estimators': 121, 'max_features': 0.9595853667137908, 'max_depth': 40, 'min_samples_split': 6, 'min_samples_leaf': 4}. Best is trial 155 with value: 0.8095238095238095.
[32m[I 2023-04-26 14:56:18,994][39m Trial 175 finished with value: 0.7640449438202247 and parameters: {'criterion': 'entropy', 'n_estimators': 118, 'max_features': 0.9615940019884368, 'max_depth': 41, 'min_samples_split': 6, 'min_samples_leaf': 7}. Best is trial 155 with value: 0.8095238095238095.
[32m[I 2023-04-26 14:56:19,102][39m Trial 176 finished with value: 0.7529411764705882 and parameters: {'criterion': 'entropy', 'n_estimators': 102, 'max_features': 0.9230466066775559, 'max_depth': 26, 'min_samples_split': 6, 'min_samples_leaf': 4}. Best is trial 155 with value: 0.8095238095238095.
[32m[I 2023-04-26 14:56:19,207][39m Trial 177 finished with value: 0.7380952380952381 and parameters: {'criterion': 'entropy', 'n_estimators': 98, 'max_features': 0.9467313122322053, 'max_depth': 23, 'min_samples_split': 7, 'min_samples_leaf': 4}. Best is trial 155 with value: 0.8095238095238095.
[32m[I 2023-04-26 14:56:19,318][39m Trial 178 finished with value: 0.7529411764705882 and parameters: {'criterion': 'entropy', 'n_estimators': 111, 'max_features': 0.9994770898260554, 'max_depth': 34, 'min_samples_split': 6, 'min_samples_leaf': 4}. Best is trial 155 with value: 0.8095238095238095.
[32m[I 2023-04-26 14:56:19,427][39m Trial 179 finished with value: 0.7499999999999999 and parameters: {'criterion': 'entropy', 'n_estimators': 105, 'max_features': 0.9151154945944866, 'max_depth': 32, 'min_samples_split': 6, 'min_samples_leaf': 3}. Best is trial 155 with value: 0.8095238095238095.
[32m[I 2023-04-26 14:56:19,522][39m Trial 180 finished with value: 0.7441860465116279 and parameters: {'criterion': 'entropy', 'n_estimators': 91, 'max_features': 0.977434844702008, 'max_depth': 28, 'min_samples_split': 6, 'min_samples_leaf': 5}. Best is trial 155 with value: 0.8095238095238095.
[32m[I 2023-04-26 14:56:19,648][39m Trial 181 finished with value: 0.7710843373493976 and parameters: {'criterion': 'entropy', 'n_estimators': 123, 'max_features': 0.9427755401564665, 'max_depth': 40, 'min_samples_split': 6, 'min_samples_leaf': 4}. Best is trial 155 with value: 0.8095238095238095.
[32m[I 2023-04-26 14:56:19,775][39m Trial 182 finished with value: 0.7586206896551724 and parameters: {'criterion': 'entropy', 'n_estimators': 122, 'max_features': 0.9692441528279871, 'max_depth': 42, 'min_samples_split': 6, 'min_samples_leaf': 4}. Best is trial 155 with value: 0.8095238095238095.
[32m[I 2023-04-26 14:56:19,907][39m Trial 183 finished with value: 0.7529411764705882 and parameters: {'criterion': 'entropy', 'n_estimators': 127, 'max_features': 0.9536360042349028, 'max_depth': 43, 'min_samples_split': 6, 'min_samples_leaf': 4}. Best is trial 155 with value: 0.8095238095238095.
[32m[I 2023-04-26 14:56:19,968][39m Trial 184 finished with value: 0.717391304347826 and parameters: {'criterion': 'entropy', 'n_estimators': 50, 'max_features': 0.9628763943025678, 'max_depth': 21, 'min_samples_split': 6, 'min_samples_leaf': 10}. Best is trial 155 with value: 0.8095238095238095.
[32m[I 2023-04-26 14:56:20,086][39m Trial 185 finished with value: 0.7441860465116279 and parameters: {'criterion': 'entropy', 'n_estimators': 113, 'max_features': 0.9341775606294588, 'max_depth': 39, 'min_samples_split': 6, 'min_samples_leaf': 4}. Best is trial 155 with value: 0.8095238095238095.
[32m[I 2023-04-26 14:56:20,187][39m Trial 186 finished with value: 0.7857142857142858 and parameters: {'criterion': 'entropy', 'n_estimators': 96, 'max_features': 0.8942340764689936, 'max_depth': 23, 'min_samples_split': 7, 'min_samples_leaf': 4}. Best is trial 155 with value: 0.8095238095238095.
[32m[I 2023-04-26 14:56:20,269][39m Trial 187 finished with value: 0.7500000000000001 and parameters: {'criterion': 'entropy', 'n_estimators': 93, 'max_features': 0.26195969546158754, 'max_depth': 25, 'min_samples_split': 7, 'min_samples_leaf': 4}. Best is trial 155 with value: 0.8095238095238095.
[32m[I 2023-04-26 14:56:20,372][39m Trial 188 finished with value: 0.7560975609756099 and parameters: {'criterion': 'entropy', 'n_estimators': 98, 'max_features': 0.8975219992278691, 'max_depth': 23, 'min_samples_split': 7, 'min_samples_leaf': 4}. Best is trial 155 with value: 0.8095238095238095.
[32m[I 2023-04-26 14:56:20,562][39m Trial 189 finished with value: 0.7764705882352942 and parameters: {'criterion': 'entropy', 'n_estimators': 192, 'max_features': 0.9878073497019128, 'max_depth': 44, 'min_samples_split': 7, 'min_samples_leaf': 4}. Best is trial 155 with value: 0.8095238095238095.
[32m[I 2023-04-26 14:56:20,686][39m Trial 190 finished with value: 0.7654320987654322 and parameters: {'criterion': 'entropy', 'n_estimators': 121, 'max_features': 0.9251840720974003, 'max_depth': 16, 'min_samples_split': 8, 'min_samples_leaf': 3}. Best is trial 155 with value: 0.8095238095238095.
[32m[I 2023-04-26 14:56:20,796][39m Trial 191 finished with value: 0.7999999999999999 and parameters: {'criterion': 'entropy', 'n_estimators': 101, 'max_features': 0.9068707884623409, 'max_depth': 49, 'min_samples_split': 6, 'min_samples_leaf': 4}. Best is trial 155 with value: 0.8095238095238095.
[32m[I 2023-04-26 14:56:20,889][39m Trial 192 finished with value: 0.7380952380952381 and parameters: {'criterion': 'entropy', 'n_estimators': 95, 'max_features': 0.5802523298696121, 'max_depth': 52, 'min_samples_split': 6, 'min_samples_leaf': 4}. Best is trial 155 with value: 0.8095238095238095.
[32m[I 2023-04-26 14:56:20,982][39m Trial 193 finished with value: 0.7816091954022988 and parameters: {'criterion': 'entropy', 'n_estimators': 88, 'max_features': 0.8827383764208302, 'max_depth': 47, 'min_samples_split': 6, 'min_samples_leaf': 4}. Best is trial 155 with value: 0.8095238095238095.
[32m[I 2023-04-26 14:56:21,085][39m Trial 194 finished with value: 0.7857142857142858 and parameters: {'criterion': 'entropy', 'n_estimators': 97, 'max_features': 0.8772837187216428, 'max_depth': 49, 'min_samples_split': 7, 'min_samples_leaf': 4}. Best is trial 155 with value: 0.8095238095238095.
[32m[I 2023-04-26 14:56:21,188][39m Trial 195 finished with value: 0.7586206896551724 and parameters: {'criterion': 'entropy', 'n_estimators': 100, 'max_features': 0.8710982657001485, 'max_depth': 48, 'min_samples_split': 7, 'min_samples_leaf': 5}. Best is trial 155 with value: 0.8095238095238095.
[32m[I 2023-04-26 14:56:21,286][39m Trial 196 finished with value: 0.7209302325581395 and parameters: {'criterion': 'gini', 'n_estimators': 97, 'max_features': 0.8424121339970103, 'max_depth': 50, 'min_samples_split': 7, 'min_samples_leaf': 4}. Best is trial 155 with value: 0.8095238095238095.
[32m[I 2023-04-26 14:56:21,397][39m Trial 197 finished with value: 0.7857142857142858 and parameters: {'criterion': 'entropy', 'n_estimators': 105, 'max_features': 0.9109875416200917, 'max_depth': 48, 'min_samples_split': 7, 'min_samples_leaf': 4}. Best is trial 155 with value: 0.8095238095238095.
[32m[I 2023-04-26 14:56:21,503][39m Trial 198 finished with value: 0.7710843373493976 and parameters: {'criterion': 'entropy', 'n_estimators': 108, 'max_features': 0.865828084526148, 'max_depth': 60, 'min_samples_split': 7, 'min_samples_leaf': 4}. Best is trial 155 with value: 0.8095238095238095.
[32m[I 2023-04-26 14:56:21,613][39m Trial 199 finished with value: 0.7710843373493976 and parameters: {'criterion': 'entropy', 'n_estimators': 104, 'max_features': 0.9034497748825381, 'max_depth': 19, 'min_samples_split': 7, 'min_samples_leaf': 4}. Best is trial 155 with value: 0.8095238095238095.
[32m[I 2023-04-26 14:56:21,716][39m Trial 200 finished with value: 0.7710843373493976 and parameters: {'criterion': 'entropy', 'n_estimators': 102, 'max_features': 0.8871351420017914, 'max_depth': 46, 'min_samples_split': 7, 'min_samples_leaf': 4}. Best is trial 155 with value: 0.8095238095238095.
[32m[I 2023-04-26 14:56:21,825][39m Trial 201 finished with value: 0.7764705882352942 and parameters: {'criterion': 'entropy', 'n_estimators': 106, 'max_features': 0.9194630036696052, 'max_depth': 55, 'min_samples_split': 8, 'min_samples_leaf': 4}. Best is trial 155 with value: 0.8095238095238095.
[32m[I 2023-04-26 14:56:21,924][39m Trial 202 finished with value: 0.761904761904762 and parameters: {'criterion': 'entropy', 'n_estimators': 96, 'max_features': 0.9365633259711323, 'max_depth': 49, 'min_samples_split': 7, 'min_samples_leaf': 4}. Best is trial 155 with value: 0.8095238095238095.
[32m[I 2023-04-26 14:56:22,029][39m Trial 203 finished with value: 0.7441860465116279 and parameters: {'criterion': 'entropy', 'n_estimators': 99, 'max_features': 0.9181270661717512, 'max_depth': 53, 'min_samples_split': 9, 'min_samples_leaf': 4}. Best is trial 155 with value: 0.8095238095238095.
[32m[I 2023-04-26 14:56:22,137][39m Trial 204 finished with value: 0.8 and parameters: {'criterion': 'entropy', 'n_estimators': 104, 'max_features': 0.8946886654699818, 'max_depth': 45, 'min_samples_split': 7, 'min_samples_leaf': 3}. Best is trial 155 with value: 0.8095238095238095.
[32m[I 2023-04-26 14:56:22,240][39m Trial 205 finished with value: 0.7407407407407408 and parameters: {'criterion': 'entropy', 'n_estimators': 102, 'max_features': 0.8527864570605289, 'max_depth': 18, 'min_samples_split': 7, 'min_samples_leaf': 3}. Best is trial 155 with value: 0.8095238095238095.
[32m[I 2023-04-26 14:56:22,352][39m Trial 206 finished with value: 0.7764705882352942 and parameters: {'criterion': 'entropy', 'n_estimators': 109, 'max_features': 0.8902886579700012, 'max_depth': 52, 'min_samples_split': 7, 'min_samples_leaf': 4}. Best is trial 155 with value: 0.8095238095238095.
[32m[I 2023-04-26 14:56:22,462][39m Trial 207 finished with value: 0.7441860465116279 and parameters: {'criterion': 'entropy', 'n_estimators': 106, 'max_features': 0.9000892644757957, 'max_depth': 47, 'min_samples_split': 7, 'min_samples_leaf': 4}. Best is trial 155 with value: 0.8095238095238095.
[32m[I 2023-04-26 14:56:22,559][39m Trial 208 finished with value: 0.7529411764705882 and parameters: {'criterion': 'entropy', 'n_estimators': 95, 'max_features': 0.8220087887978714, 'max_depth': 49, 'min_samples_split': 7, 'min_samples_leaf': 5}. Best is trial 155 with value: 0.8095238095238095.
[32m[I 2023-04-26 14:56:22,670][39m Trial 209 finished with value: 0.7560975609756099 and parameters: {'criterion': 'entropy', 'n_estimators': 104, 'max_features': 0.9377687848526891, 'max_depth': 45, 'min_samples_split': 6, 'min_samples_leaf': 4}. Best is trial 155 with value: 0.8095238095238095.
[32m[I 2023-04-26 14:56:22,781][39m Trial 210 finished with value: 0.7317073170731707 and parameters: {'criterion': 'entropy', 'n_estimators': 116, 'max_features': 0.6535433749476064, 'max_depth': 21, 'min_samples_split': 7, 'min_samples_leaf': 3}. Best is trial 155 with value: 0.8095238095238095.
[32m[I 2023-04-26 14:56:22,895][39m Trial 211 finished with value: 0.7848101265822786 and parameters: {'criterion': 'entropy', 'n_estimators': 101, 'max_features': 0.9506834802035001, 'max_depth': 50, 'min_samples_split': 6, 'min_samples_leaf': 3}. Best is trial 155 with value: 0.8095238095238095.
[32m[I 2023-04-26 14:56:22,998][39m Trial 212 finished with value: 0.7710843373493976 and parameters: {'criterion': 'entropy', 'n_estimators': 98, 'max_features': 0.8713225441134932, 'max_depth': 14, 'min_samples_split': 8, 'min_samples_leaf': 3}. Best is trial 155 with value: 0.8095238095238095.
[32m[I 2023-04-26 14:56:23,100][39m Trial 213 finished with value: 0.7073170731707317 and parameters: {'criterion': 'entropy', 'n_estimators': 93, 'max_features': 0.911570629935386, 'max_depth': 17, 'min_samples_split': 6, 'min_samples_leaf': 2}. Best is trial 155 with value: 0.8095238095238095.
[32m[I 2023-04-26 14:56:23,277][39m Trial 214 finished with value: 0.7710843373493976 and parameters: {'criterion': 'entropy', 'n_estimators': 175, 'max_features': 0.9296525496296846, 'max_depth': 47, 'min_samples_split': 6, 'min_samples_leaf': 4}. Best is trial 155 with value: 0.8095238095238095.
[32m[I 2023-04-26 14:56:23,383][39m Trial 215 finished with value: 0.7710843373493976 and parameters: {'criterion': 'entropy', 'n_estimators': 100, 'max_features': 0.8914279318258753, 'max_depth': 45, 'min_samples_split': 6, 'min_samples_leaf': 4}. Best is trial 155 with value: 0.8095238095238095.
[32m[I 2023-04-26 14:56:23,477][39m Trial 216 finished with value: 0.7228915662650603 and parameters: {'criterion': 'gini', 'n_estimators': 104, 'max_features': 0.49331212987663686, 'max_depth': 38, 'min_samples_split': 6, 'min_samples_leaf': 3}. Best is trial 155 with value: 0.8095238095238095.
[32m[I 2023-04-26 14:56:23,592][39m Trial 217 finished with value: 0.7529411764705882 and parameters: {'criterion': 'entropy', 'n_estimators': 108, 'max_features': 0.9623555789149021, 'max_depth': 20, 'min_samples_split': 6, 'min_samples_leaf': 4}. Best is trial 155 with value: 0.8095238095238095.
[32m[I 2023-04-26 14:56:23,699][39m Trial 218 finished with value: 0.7764705882352942 and parameters: {'criterion': 'entropy', 'n_estimators': 101, 'max_features': 0.9442729113593624, 'max_depth': 51, 'min_samples_split': 6, 'min_samples_leaf': 4}. Best is trial 155 with value: 0.8095238095238095.
