[32m[I 2023-04-26 14:56:49,183][39m Trial 438 finished with value: 0.7560975609756099 and parameters: {'criterion': 'entropy', 'n_estimators': 106, 'max_features': 0.9462547149837957, 'max_depth': 19, 'min_samples_split': 5, 'min_samples_leaf': 3}. Best is trial 155 with value: 0.8095238095238095.
[32m[I 2023-04-26 14:56:49,288][39m Trial 439 finished with value: 0.7407407407407408 and parameters: {'criterion': 'entropy', 'n_estimators': 92, 'max_features': 0.9994648144696494, 'max_depth': 30, 'min_samples_split': 6, 'min_samples_leaf': 2}. Best is trial 155 with value: 0.8095238095238095.
[32m[I 2023-04-26 14:56:49,398][39m Trial 440 finished with value: 0.7441860465116279 and parameters: {'criterion': 'entropy', 'n_estimators': 104, 'max_features': 0.8503285714161224, 'max_depth': 11, 'min_samples_split': 7, 'min_samples_leaf': 4}. Best is trial 155 with value: 0.8095238095238095.
[32m[I 2023-04-26 14:56:49,492][39m Trial 441 finished with value: 0.7317073170731707 and parameters: {'criterion': 'gini', 'n_estimators': 86, 'max_features': 0.8842084129358605, 'max_depth': 25, 'min_samples_split': 7, 'min_samples_leaf': 3}. Best is trial 155 with value: 0.8095238095238095.
[32m[I 2023-04-26 14:56:49,625][39m Trial 442 finished with value: 0.7764705882352942 and parameters: {'criterion': 'entropy', 'n_estimators': 122, 'max_features': 0.9691172453900125, 'max_depth': 38, 'min_samples_split': 7, 'min_samples_leaf': 4}. Best is trial 155 with value: 0.8095238095238095.
[32m[I 2023-04-26 14:56:49,758][39m Trial 443 finished with value: 0.7560975609756099 and parameters: {'criterion': 'entropy', 'n_estimators': 121, 'max_features': 0.8981186266674037, 'max_depth': 34, 'min_samples_split': 7, 'min_samples_leaf': 4}. Best is trial 155 with value: 0.8095238095238095.
[32m[I 2023-04-26 14:56:49,848][39m Trial 444 finished with value: 0.7710843373493976 and parameters: {'criterion': 'entropy', 'n_estimators': 77, 'max_features': 0.8032337512299549, 'max_depth': 70, 'min_samples_split': 6, 'min_samples_leaf': 4}. Best is trial 155 with value: 0.8095238095238095.
[32m[I 2023-04-26 14:56:49,959][39m Trial 445 finished with value: 0.7764705882352942 and parameters: {'criterion': 'entropy', 'n_estimators': 95, 'max_features': 0.9852384468763224, 'max_depth': 27, 'min_samples_split': 4, 'min_samples_leaf': 4}. Best is trial 155 with value: 0.8095238095238095.
[32m[I 2023-04-26 14:56:50,071][39m Trial 446 finished with value: 0.7415730337078651 and parameters: {'criterion': 'entropy', 'n_estimators': 102, 'max_features': 0.9222939071746267, 'max_depth': 18, 'min_samples_split': 6, 'min_samples_leaf': 8}. Best is trial 155 with value: 0.8095238095238095.
[32m[I 2023-04-26 14:56:50,181][39m Trial 447 finished with value: 0.7654320987654322 and parameters: {'criterion': 'entropy', 'n_estimators': 97, 'max_features': 0.8763679251994767, 'max_depth': 51, 'min_samples_split': 7, 'min_samples_leaf': 3}. Best is trial 155 with value: 0.8095238095238095.
[32m[I 2023-04-26 14:56:50,321][39m Trial 448 finished with value: 0.7586206896551724 and parameters: {'criterion': 'entropy', 'n_estimators': 123, 'max_features': 0.9404056926526313, 'max_depth': 16, 'min_samples_split': 6, 'min_samples_leaf': 5}. Best is trial 155 with value: 0.8095238095238095.
[32m[I 2023-04-26 14:56:50,446][39m Trial 449 finished with value: 0.7749999999999999 and parameters: {'criterion': 'entropy', 'n_estimators': 114, 'max_features': 0.9615041119628556, 'max_depth': 32, 'min_samples_split': 6, 'min_samples_leaf': 3}. Best is trial 155 with value: 0.8095238095238095.
[32m[I 2023-04-26 14:56:50,544][39m Trial 450 finished with value: 0.7674418604651163 and parameters: {'criterion': 'gini', 'n_estimators': 99, 'max_features': 0.7396705788766418, 'max_depth': 22, 'min_samples_split': 6, 'min_samples_leaf': 4}. Best is trial 155 with value: 0.8095238095238095.
[32m[I 2023-04-26 14:56:50,657][39m Trial 451 finished with value: 0.7764705882352942 and parameters: {'criterion': 'entropy', 'n_estimators': 104, 'max_features': 0.9144896026535146, 'max_depth': 14, 'min_samples_split': 6, 'min_samples_leaf': 4}. Best is trial 155 with value: 0.8095238095238095.
[32m[I 2023-04-26 14:56:50,804][39m Trial 452 finished with value: 0.7586206896551724 and parameters: {'criterion': 'entropy', 'n_estimators': 144, 'max_features': 0.9998245761438785, 'max_depth': 44, 'min_samples_split': 6, 'min_samples_leaf': 4}. Best is trial 155 with value: 0.8095238095238095.
[32m[I 2023-04-26 14:56:50,916][39m Trial 453 finished with value: 0.7857142857142858 and parameters: {'criterion': 'entropy', 'n_estimators': 103, 'max_features': 0.9203033577700918, 'max_depth': 54, 'min_samples_split': 6, 'min_samples_leaf': 4}. Best is trial 155 with value: 0.8095238095238095.
[32m[I 2023-04-26 14:56:51,048][39m Trial 454 finished with value: 0.7341772151898733 and parameters: {'criterion': 'entropy', 'n_estimators': 117, 'max_features': 0.8915642760513831, 'max_depth': 25, 'min_samples_split': 3, 'min_samples_leaf': 3}. Best is trial 155 with value: 0.8095238095238095.
[32m[I 2023-04-26 14:56:51,163][39m Trial 455 finished with value: 0.7640449438202247 and parameters: {'criterion': 'entropy', 'n_estimators': 107, 'max_features': 0.9432488487483529, 'max_depth': 8, 'min_samples_split': 5, 'min_samples_leaf': 3}. Best is trial 155 with value: 0.8095238095238095.
[32m[I 2023-04-26 14:56:51,283][39m Trial 456 finished with value: 0.7654320987654322 and parameters: {'criterion': 'entropy', 'n_estimators': 111, 'max_features': 0.938245060703973, 'max_depth': 29, 'min_samples_split': 5, 'min_samples_leaf': 3}. Best is trial 155 with value: 0.8095238095238095.
[32m[I 2023-04-26 14:56:51,490][39m Trial 457 finished with value: 0.7560975609756099 and parameters: {'criterion': 'entropy', 'n_estimators': 182, 'max_features': 0.926758832725011, 'max_depth': 17, 'min_samples_split': 6, 'min_samples_leaf': 3}. Best is trial 155 with value: 0.8095238095238095.
[32m[I 2023-04-26 14:56:51,607][39m Trial 458 finished with value: 0.7804878048780488 and parameters: {'criterion': 'entropy', 'n_estimators': 108, 'max_features': 0.8329869090100505, 'max_depth': 55, 'min_samples_split': 7, 'min_samples_leaf': 3}. Best is trial 155 with value: 0.8095238095238095.
[32m[I 2023-04-26 14:56:51,741][39m Trial 459 finished with value: 0.7804878048780488 and parameters: {'criterion': 'entropy', 'n_estimators': 126, 'max_features': 0.9174524703761294, 'max_depth': 40, 'min_samples_split': 6, 'min_samples_leaf': 4}. Best is trial 155 with value: 0.8095238095238095.
[32m[I 2023-04-26 14:56:51,875][39m Trial 460 finished with value: 0.7764705882352942 and parameters: {'criterion': 'entropy', 'n_estimators': 121, 'max_features': 0.9735127069138911, 'max_depth': 24, 'min_samples_split': 6, 'min_samples_leaf': 5}. Best is trial 155 with value: 0.8095238095238095.
[32m[I 2023-04-26 14:56:51,975][39m Trial 461 finished with value: 0.7560975609756099 and parameters: {'criterion': 'gini', 'n_estimators': 94, 'max_features': 0.9552442269153455, 'max_depth': 14, 'min_samples_split': 6, 'min_samples_leaf': 3}. Best is trial 155 with value: 0.8095238095238095.
[32m[I 2023-04-26 14:56:52,090][39m Trial 462 finished with value: 0.7764705882352942 and parameters: {'criterion': 'entropy', 'n_estimators': 109, 'max_features': 0.8635221614204601, 'max_depth': 20, 'min_samples_split': 7, 'min_samples_leaf': 4}. Best is trial 155 with value: 0.8095238095238095.
[32m[I 2023-04-26 14:56:52,201][39m Trial 463 finished with value: 0.7441860465116279 and parameters: {'criterion': 'entropy', 'n_estimators': 100, 'max_features': 0.8987240913101247, 'max_depth': 23, 'min_samples_split': 4, 'min_samples_leaf': 4}. Best is trial 155 with value: 0.8095238095238095.
[32m[I 2023-04-26 14:56:52,293][39m Trial 464 finished with value: 0.7391304347826086 and parameters: {'criterion': 'entropy', 'n_estimators': 82, 'max_features': 0.9805398717889239, 'max_depth': 29, 'min_samples_split': 6, 'min_samples_leaf': 10}. Best is trial 155 with value: 0.8095238095238095.
[32m[I 2023-04-26 14:56:52,459][39m Trial 465 finished with value: 0.761904761904762 and parameters: {'criterion': 'entropy', 'n_estimators': 165, 'max_features': 0.9605147137122428, 'max_depth': 25, 'min_samples_split': 6, 'min_samples_leaf': 4}. Best is trial 155 with value: 0.8095238095238095.
[32m[I 2023-04-26 14:56:52,573][39m Trial 466 finished with value: 0.7594936708860759 and parameters: {'criterion': 'entropy', 'n_estimators': 101, 'max_features': 0.9385351616785267, 'max_depth': 19, 'min_samples_split': 5, 'min_samples_leaf': 3}. Best is trial 155 with value: 0.8095238095238095.
[32m[I 2023-04-26 14:56:52,688][39m Trial 467 finished with value: 0.7901234567901235 and parameters: {'criterion': 'entropy', 'n_estimators': 104, 'max_features': 0.9541334005660039, 'max_depth': 49, 'min_samples_split': 5, 'min_samples_leaf': 3}. Best is trial 155 with value: 0.8095238095238095.
[32m[I 2023-04-26 14:56:52,801][39m Trial 468 finished with value: 0.7951807228915663 and parameters: {'criterion': 'entropy', 'n_estimators': 106, 'max_features': 0.8674539053722494, 'max_depth': 48, 'min_samples_split': 5, 'min_samples_leaf': 3}. Best is trial 155 with value: 0.8095238095238095.
[32m[I 2023-04-26 14:56:52,916][39m Trial 469 finished with value: 0.7407407407407408 and parameters: {'criterion': 'entropy', 'n_estimators': 106, 'max_features': 0.8406679754219766, 'max_depth': 96, 'min_samples_split': 5, 'min_samples_leaf': 2}. Best is trial 155 with value: 0.8095238095238095.
[32m[I 2023-04-26 14:56:53,100][39m Trial 470 finished with value: 0.725 and parameters: {'criterion': 'entropy', 'n_estimators': 172, 'max_features': 0.982406238899983, 'max_depth': 53, 'min_samples_split': 5, 'min_samples_leaf': 3}. Best is trial 155 with value: 0.8095238095238095.
[32m[I 2023-04-26 14:56:53,218][39m Trial 471 finished with value: 0.7407407407407408 and parameters: {'criterion': 'entropy', 'n_estimators': 104, 'max_features': 0.8809498435658165, 'max_depth': 49, 'min_samples_split': 6, 'min_samples_leaf': 2}. Best is trial 155 with value: 0.8095238095238095.
[32m[I 2023-04-26 14:56:53,333][39m Trial 472 finished with value: 0.7710843373493976 and parameters: {'criterion': 'entropy', 'n_estimators': 103, 'max_features': 0.9450209866426972, 'max_depth': 28, 'min_samples_split': 5, 'min_samples_leaf': 3}. Best is trial 155 with value: 0.8095238095238095.
[32m[I 2023-04-26 14:56:53,439][39m Trial 473 finished with value: 0.7674418604651163 and parameters: {'criterion': 'entropy', 'n_estimators': 98, 'max_features': 0.8638664006737581, 'max_depth': 47, 'min_samples_split': 7, 'min_samples_leaf': 4}. Best is trial 155 with value: 0.8095238095238095.
[32m[I 2023-04-26 14:56:53,556][39m Trial 474 finished with value: 0.761904761904762 and parameters: {'criterion': 'gini', 'n_estimators': 115, 'max_features': 0.8503371075459343, 'max_depth': 45, 'min_samples_split': 4, 'min_samples_leaf': 3}. Best is trial 155 with value: 0.8095238095238095.
[32m[I 2023-04-26 14:56:53,668][39m Trial 475 finished with value: 0.7848101265822786 and parameters: {'criterion': 'entropy', 'n_estimators': 100, 'max_features': 0.9164416264587985, 'max_depth': 26, 'min_samples_split': 5, 'min_samples_leaf': 3}. Best is trial 155 with value: 0.8095238095238095.
[32m[I 2023-04-26 14:56:53,791][39m Trial 476 finished with value: 0.7407407407407408 and parameters: {'criterion': 'entropy', 'n_estimators': 111, 'max_features': 0.9359014654388689, 'max_depth': 21, 'min_samples_split': 5, 'min_samples_leaf': 3}. Best is trial 155 with value: 0.8095238095238095.
[32m[I 2023-04-26 14:56:53,869][39m Trial 477 finished with value: 0.7764705882352942 and parameters: {'criterion': 'entropy', 'n_estimators': 63, 'max_features': 0.9753277452043009, 'max_depth': 51, 'min_samples_split': 8, 'min_samples_leaf': 4}. Best is trial 155 with value: 0.8095238095238095.
[32m[I 2023-04-26 14:56:53,980][39m Trial 478 finished with value: 0.7529411764705882 and parameters: {'criterion': 'entropy', 'n_estimators': 107, 'max_features': 0.7580628326488293, 'max_depth': 46, 'min_samples_split': 5, 'min_samples_leaf': 3}. Best is trial 155 with value: 0.8095238095238095.
[32m[I 2023-04-26 14:56:54,085][39m Trial 479 finished with value: 0.7346938775510203 and parameters: {'criterion': 'entropy', 'n_estimators': 106, 'max_features': 0.7960474406972192, 'max_depth': 5, 'min_samples_split': 7, 'min_samples_leaf': 7}. Best is trial 155 with value: 0.8095238095238095.
[32m[I 2023-04-26 14:56:54,187][39m Trial 480 finished with value: 0.7804878048780488 and parameters: {'criterion': 'entropy', 'n_estimators': 89, 'max_features': 0.9569177579205848, 'max_depth': 30, 'min_samples_split': 5, 'min_samples_leaf': 3}. Best is trial 155 with value: 0.8095238095238095.
[32m[I 2023-04-26 14:56:54,311][39m Trial 481 finished with value: 0.7654320987654322 and parameters: {'criterion': 'entropy', 'n_estimators': 113, 'max_features': 0.9814513013534791, 'max_depth': 27, 'min_samples_split': 5, 'min_samples_leaf': 3}. Best is trial 155 with value: 0.8095238095238095.
[32m[I 2023-04-26 14:56:54,419][39m Trial 482 finished with value: 0.7228915662650603 and parameters: {'criterion': 'entropy', 'n_estimators': 93, 'max_features': 0.9505431986785793, 'max_depth': 24, 'min_samples_split': 5, 'min_samples_leaf': 2}. Best is trial 155 with value: 0.8095238095238095.
[32m[I 2023-04-26 14:56:54,540][39m Trial 483 finished with value: 0.7804878048780488 and parameters: {'criterion': 'entropy', 'n_estimators': 109, 'max_features': 0.9098274794532194, 'max_depth': 17, 'min_samples_split': 4, 'min_samples_leaf': 3}. Best is trial 155 with value: 0.8095238095238095.
[32m[I 2023-04-26 14:56:54,658][39m Trial 484 finished with value: 0.7560975609756099 and parameters: {'criterion': 'entropy', 'n_estimators': 109, 'max_features': 0.8210978514475271, 'max_depth': 61, 'min_samples_split': 5, 'min_samples_leaf': 3}. Best is trial 155 with value: 0.8095238095238095.
[32m[I 2023-04-26 14:56:54,757][39m Trial 485 finished with value: 0.7529411764705882 and parameters: {'criterion': 'gini', 'n_estimators': 97, 'max_features': 0.8817263347309989, 'max_depth': 48, 'min_samples_split': 7, 'min_samples_leaf': 4}. Best is trial 155 with value: 0.8095238095238095.
[32m[I 2023-04-26 14:56:54,887][39m Trial 486 finished with value: 0.7529411764705882 and parameters: {'criterion': 'entropy', 'n_estimators': 126, 'max_features': 0.964803875648409, 'max_depth': 43, 'min_samples_split': 6, 'min_samples_leaf': 5}. Best is trial 155 with value: 0.8095238095238095.
[32m[I 2023-04-26 14:56:55,003][39m Trial 487 finished with value: 0.7710843373493976 and parameters: {'criterion': 'entropy', 'n_estimators': 104, 'max_features': 0.9251257290333135, 'max_depth': 22, 'min_samples_split': 6, 'min_samples_leaf': 4}. Best is trial 155 with value: 0.8095238095238095.
[32m[I 2023-04-26 14:56:55,121][39m Trial 488 finished with value: 0.746987951807229 and parameters: {'criterion': 'entropy', 'n_estimators': 103, 'max_features': 0.9228900303297652, 'max_depth': 53, 'min_samples_split': 10, 'min_samples_leaf': 3}. Best is trial 155 with value: 0.8095238095238095.
[32m[I 2023-04-26 14:56:55,234][39m Trial 489 finished with value: 0.7816091954022988 and parameters: {'criterion': 'entropy', 'n_estimators': 105, 'max_features': 0.8852350335932061, 'max_depth': 31, 'min_samples_split': 7, 'min_samples_leaf': 4}. Best is trial 155 with value: 0.8095238095238095.
[32m[I 2023-04-26 14:56:55,358][39m Trial 490 finished with value: 0.7804878048780488 and parameters: {'criterion': 'entropy', 'n_estimators': 113, 'max_features': 0.9518590542987856, 'max_depth': 26, 'min_samples_split': 5, 'min_samples_leaf': 3}. Best is trial 155 with value: 0.8095238095238095.
[32m[I 2023-04-26 14:56:55,470][39m Trial 491 finished with value: 0.7951807228915663 and parameters: {'criterion': 'entropy', 'n_estimators': 101, 'max_features': 0.9051395899916714, 'max_depth': 48, 'min_samples_split': 6, 'min_samples_leaf': 4}. Best is trial 155 with value: 0.8095238095238095.
[32m[I 2023-04-26 14:56:55,586][39m Trial 492 finished with value: 0.7764705882352942 and parameters: {'criterion': 'entropy', 'n_estimators': 100, 'max_features': 0.9036004660073652, 'max_depth': 22, 'min_samples_split': 6, 'min_samples_leaf': 4}. Best is trial 155 with value: 0.8095238095238095.
[32m[I 2023-04-26 14:56:55,703][39m Trial 493 finished with value: 0.7654320987654322 and parameters: {'criterion': 'entropy', 'n_estimators': 105, 'max_features': 0.8969848597083518, 'max_depth': 48, 'min_samples_split': 4, 'min_samples_leaf': 4}. Best is trial 155 with value: 0.8095238095238095.
[32m[I 2023-04-26 14:56:55,812][39m Trial 494 finished with value: 0.7901234567901235 and parameters: {'criterion': 'entropy', 'n_estimators': 100, 'max_features': 0.8476393616900961, 'max_depth': 46, 'min_samples_split': 5, 'min_samples_leaf': 3}. Best is trial 155 with value: 0.8095238095238095.
[32m[I 2023-04-26 14:56:55,923][39m Trial 495 finished with value: 0.7654320987654322 and parameters: {'criterion': 'entropy', 'n_estimators': 101, 'max_features': 0.8582689132169877, 'max_depth': 45, 'min_samples_split': 5, 'min_samples_leaf': 3}. Best is trial 155 with value: 0.8095238095238095.
[32m[I 2023-04-26 14:56:56,035][39m Trial 496 finished with value: 0.7901234567901235 and parameters: {'criterion': 'entropy', 'n_estimators': 99, 'max_features': 0.8414597442587913, 'max_depth': 43, 'min_samples_split': 6, 'min_samples_leaf': 3}. Best is trial 155 with value: 0.8095238095238095.
[32m[I 2023-04-26 14:56:56,146][39m Trial 497 finished with value: 0.7692307692307694 and parameters: {'criterion': 'entropy', 'n_estimators': 99, 'max_features': 0.8442550252941615, 'max_depth': 43, 'min_samples_split': 5, 'min_samples_leaf': 3}. Best is trial 155 with value: 0.8095238095238095.
[32m[I 2023-04-26 14:56:56,252][39m Trial 498 finished with value: 0.7341772151898733 and parameters: {'criterion': 'entropy', 'n_estimators': 97, 'max_features': 0.86802038186025, 'max_depth': 46, 'min_samples_split': 5, 'min_samples_leaf': 3}. Best is trial 155 with value: 0.8095238095238095.
[32m[I 2023-04-26 14:56:56,350][39m Trial 499 finished with value: 0.7710843373493976 and parameters: {'criterion': 'gini', 'n_estimators': 95, 'max_features': 0.8632517322265243, 'max_depth': 45, 'min_samples_split': 5, 'min_samples_leaf': 3}. Best is trial 155 with value: 0.8095238095238095.
Number of finished trials: 500