[32m[I 2023-04-26 12:27:55,718][39m Trial 366 finished with value: 0.8547008547008546 and parameters: {'criterion': 'gini', 'n_estimators': 192, 'max_features': 0.9908250832597503, 'max_depth': 97, 'min_samples_split': 11, 'min_samples_leaf': 3}. Best is trial 321 with value: 0.8771929824561403.
[32m[I 2023-04-26 12:27:55,862][39m Trial 367 finished with value: 0.8495575221238938 and parameters: {'criterion': 'gini', 'n_estimators': 189, 'max_features': 0.5457539789672252, 'max_depth': 99, 'min_samples_split': 5, 'min_samples_leaf': 3}. Best is trial 321 with value: 0.8771929824561403.
[32m[I 2023-04-26 12:27:55,946][39m Trial 368 finished with value: 0.8376068376068375 and parameters: {'criterion': 'gini', 'n_estimators': 92, 'max_features': 0.6851294439305294, 'max_depth': 89, 'min_samples_split': 10, 'min_samples_leaf': 3}. Best is trial 321 with value: 0.8771929824561403.
[32m[I 2023-04-26 12:27:56,079][39m Trial 369 finished with value: 0.8421052631578947 and parameters: {'criterion': 'gini', 'n_estimators': 167, 'max_features': 0.575376598124428, 'max_depth': 11, 'min_samples_split': 8, 'min_samples_leaf': 3}. Best is trial 321 with value: 0.8771929824561403.
[32m[I 2023-04-26 12:27:56,219][39m Trial 370 finished with value: 0.8421052631578947 and parameters: {'criterion': 'gini', 'n_estimators': 163, 'max_features': 0.8179046113218019, 'max_depth': 92, 'min_samples_split': 9, 'min_samples_leaf': 2}. Best is trial 321 with value: 0.8771929824561403.
[32m[I 2023-04-26 12:27:56,353][39m Trial 371 finished with value: 0.8421052631578947 and parameters: {'criterion': 'gini', 'n_estimators': 176, 'max_features': 0.49208570567401066, 'max_depth': 42, 'min_samples_split': 9, 'min_samples_leaf': 3}. Best is trial 321 with value: 0.8771929824561403.
[32m[I 2023-04-26 12:27:56,430][39m Trial 372 finished with value: 0.8347826086956522 and parameters: {'criterion': 'gini', 'n_estimators': 87, 'max_features': 0.5161719649101255, 'max_depth': 91, 'min_samples_split': 7, 'min_samples_leaf': 3}. Best is trial 321 with value: 0.8771929824561403.
[32m[I 2023-04-26 12:27:56,522][39m Trial 373 finished with value: 0.8495575221238938 and parameters: {'criterion': 'gini', 'n_estimators': 104, 'max_features': 0.7040705717759339, 'max_depth': 91, 'min_samples_split': 9, 'min_samples_leaf': 3}. Best is trial 321 with value: 0.8771929824561403.
[32m[I 2023-04-26 12:27:56,659][39m Trial 374 finished with value: 0.864406779661017 and parameters: {'criterion': 'gini', 'n_estimators': 185, 'max_features': 0.49103354942091987, 'max_depth': 46, 'min_samples_split': 11, 'min_samples_leaf': 7}. Best is trial 321 with value: 0.8771929824561403.
[32m[I 2023-04-26 12:27:56,753][39m Trial 375 finished with value: 0.8347826086956522 and parameters: {'criterion': 'gini', 'n_estimators': 111, 'max_features': 0.5733685823792974, 'max_depth': 86, 'min_samples_split': 4, 'min_samples_leaf': 6}. Best is trial 321 with value: 0.8771929824561403.
[32m[I 2023-04-26 12:27:56,899][39m Trial 376 finished with value: 0.847457627118644 and parameters: {'criterion': 'gini', 'n_estimators': 195, 'max_features': 0.5485489226574894, 'max_depth': 100, 'min_samples_split': 10, 'min_samples_leaf': 8}. Best is trial 321 with value: 0.8771929824561403.
[32m[I 2023-04-26 12:27:56,989][39m Trial 377 finished with value: 0.8771929824561403 and parameters: {'criterion': 'gini', 'n_estimators': 100, 'max_features': 0.7580204867464152, 'max_depth': 94, 'min_samples_split': 9, 'min_samples_leaf': 3}. Best is trial 321 with value: 0.8771929824561403.
[32m[I 2023-04-26 12:27:57,078][39m Trial 378 finished with value: 0.8571428571428572 and parameters: {'criterion': 'gini', 'n_estimators': 97, 'max_features': 0.7689108556115144, 'max_depth': 95, 'min_samples_split': 8, 'min_samples_leaf': 3}. Best is trial 321 with value: 0.8771929824561403.
[32m[I 2023-04-26 12:27:57,226][39m Trial 379 finished with value: 0.8448275862068967 and parameters: {'criterion': 'gini', 'n_estimators': 191, 'max_features': 0.5431836025215454, 'max_depth': 101, 'min_samples_split': 9, 'min_samples_leaf': 7}. Best is trial 321 with value: 0.8771929824561403.
[32m[I 2023-04-26 12:27:57,363][39m Trial 380 finished with value: 0.8547008547008546 and parameters: {'criterion': 'gini', 'n_estimators': 180, 'max_features': 0.5002033149630357, 'max_depth': 47, 'min_samples_split': 11, 'min_samples_leaf': 7}. Best is trial 321 with value: 0.8771929824561403.
[32m[I 2023-04-26 12:27:57,450][39m Trial 381 finished with value: 0.8448275862068967 and parameters: {'criterion': 'gini', 'n_estimators': 95, 'max_features': 0.7978807681691794, 'max_depth': 94, 'min_samples_split': 9, 'min_samples_leaf': 3}. Best is trial 321 with value: 0.8771929824561403.
[32m[I 2023-04-26 12:27:57,590][39m Trial 382 finished with value: 0.8448275862068967 and parameters: {'criterion': 'gini', 'n_estimators': 187, 'max_features': 0.5192380881808679, 'max_depth': 98, 'min_samples_split': 4, 'min_samples_leaf': 7}. Best is trial 321 with value: 0.8771929824561403.
[32m[I 2023-04-26 12:27:57,740][39m Trial 383 finished with value: 0.8421052631578947 and parameters: {'criterion': 'gini', 'n_estimators': 182, 'max_features': 0.6738219737027561, 'max_depth': 93, 'min_samples_split': 10, 'min_samples_leaf': 2}. Best is trial 321 with value: 0.8771929824561403.
[32m[I 2023-04-26 12:27:57,824][39m Trial 384 finished with value: 0.8495575221238938 and parameters: {'criterion': 'gini', 'n_estimators': 101, 'max_features': 0.46050945857245296, 'max_depth': 95, 'min_samples_split': 3, 'min_samples_leaf': 3}. Best is trial 321 with value: 0.8771929824561403.
[32m[I 2023-04-26 12:27:57,979][39m Trial 385 finished with value: 0.8495575221238938 and parameters: {'criterion': 'entropy', 'n_estimators': 176, 'max_features': 0.6053028252380616, 'max_depth': 89, 'min_samples_split': 9, 'min_samples_leaf': 3}. Best is trial 321 with value: 0.8771929824561403.
[32m[I 2023-04-26 12:27:58,127][39m Trial 386 finished with value: 0.8521739130434783 and parameters: {'criterion': 'gini', 'n_estimators': 178, 'max_features': 0.7610681937687991, 'max_depth': 93, 'min_samples_split': 9, 'min_samples_leaf': 2}. Best is trial 321 with value: 0.8771929824561403.
[32m[I 2023-04-26 12:27:58,264][39m Trial 387 finished with value: 0.8347826086956522 and parameters: {'criterion': 'gini', 'n_estimators': 170, 'max_features': 0.5817198498609113, 'max_depth': 91, 'min_samples_split': 9, 'min_samples_leaf': 3}. Best is trial 321 with value: 0.8771929824561403.
[32m[I 2023-04-26 12:27:58,354][39m Trial 388 finished with value: 0.8421052631578947 and parameters: {'criterion': 'gini', 'n_estimators': 98, 'max_features': 0.7230862580177732, 'max_depth': 97, 'min_samples_split': 8, 'min_samples_leaf': 3}. Best is trial 321 with value: 0.8771929824561403.
[32m[I 2023-04-26 12:27:58,499][39m Trial 389 finished with value: 0.8547008547008546 and parameters: {'criterion': 'gini', 'n_estimators': 191, 'max_features': 0.5244299128220047, 'max_depth': 101, 'min_samples_split': 10, 'min_samples_leaf': 7}. Best is trial 321 with value: 0.8771929824561403.
[32m[I 2023-04-26 12:27:58,584][39m Trial 390 finished with value: 0.823529411764706 and parameters: {'criterion': 'gini', 'n_estimators': 94, 'max_features': 0.7486446335097237, 'max_depth': 88, 'min_samples_split': 9, 'min_samples_leaf': 3}. Best is trial 321 with value: 0.8771929824561403.
[32m[I 2023-04-26 12:27:58,675][39m Trial 391 finished with value: 0.8468468468468469 and parameters: {'criterion': 'gini', 'n_estimators': 96, 'max_features': 0.7854587745923156, 'max_depth': 95, 'min_samples_split': 8, 'min_samples_leaf': 3}. Best is trial 321 with value: 0.8771929824561403.
[32m[I 2023-04-26 12:27:58,853][39m Trial 392 finished with value: 0.8620689655172413 and parameters: {'criterion': 'gini', 'n_estimators': 196, 'max_features': 0.9128380915716553, 'max_depth': 96, 'min_samples_split': 10, 'min_samples_leaf': 3}. Best is trial 321 with value: 0.8771929824561403.
[32m[I 2023-04-26 12:27:58,944][39m Trial 393 finished with value: 0.8448275862068967 and parameters: {'criterion': 'gini', 'n_estimators': 105, 'max_features': 0.4288464036378527, 'max_depth': 93, 'min_samples_split': 5, 'min_samples_leaf': 6}. Best is trial 321 with value: 0.8771929824561403.
[32m[I 2023-04-26 12:27:59,096][39m Trial 394 finished with value: 0.8468468468468469 and parameters: {'criterion': 'gini', 'n_estimators': 187, 'max_features': 0.5658718834998254, 'max_depth': 99, 'min_samples_split': 3, 'min_samples_leaf': 2}. Best is trial 321 with value: 0.8771929824561403.
[32m[I 2023-04-26 12:27:59,282][39m Trial 395 finished with value: 0.8333333333333334 and parameters: {'criterion': 'gini', 'n_estimators': 201, 'max_features': 0.9037034162587421, 'max_depth': 96, 'min_samples_split': 11, 'min_samples_leaf': 8}. Best is trial 321 with value: 0.8771929824561403.
[32m[I 2023-04-26 12:27:59,380][39m Trial 396 finished with value: 0.8672566371681416 and parameters: {'criterion': 'gini', 'n_estimators': 108, 'max_features': 0.7401100718702328, 'max_depth': 91, 'min_samples_split': 9, 'min_samples_leaf': 3}. Best is trial 321 with value: 0.8771929824561403.
[32m[I 2023-04-26 12:27:59,475][39m Trial 397 finished with value: 0.8421052631578947 and parameters: {'criterion': 'gini', 'n_estimators': 107, 'max_features': 0.7622176641834545, 'max_depth': 91, 'min_samples_split': 9, 'min_samples_leaf': 3}. Best is trial 321 with value: 0.8771929824561403.
[32m[I 2023-04-26 12:27:59,565][39m Trial 398 finished with value: 0.8596491228070176 and parameters: {'criterion': 'gini', 'n_estimators': 104, 'max_features': 0.7033385987965783, 'max_depth': 93, 'min_samples_split': 9, 'min_samples_leaf': 3}. Best is trial 321 with value: 0.8771929824561403.
[32m[I 2023-04-26 12:27:59,663][39m Trial 399 finished with value: 0.8672566371681416 and parameters: {'criterion': 'gini', 'n_estimators': 110, 'max_features': 0.7398418151641274, 'max_depth': 85, 'min_samples_split': 4, 'min_samples_leaf': 3}. Best is trial 321 with value: 0.8771929824561403.
[32m[I 2023-04-26 12:27:59,761][39m Trial 400 finished with value: 0.8495575221238938 and parameters: {'criterion': 'gini', 'n_estimators': 107, 'max_features': 0.741713977811933, 'max_depth': 85, 'min_samples_split': 4, 'min_samples_leaf': 3}. Best is trial 321 with value: 0.8771929824561403.
[32m[I 2023-04-26 12:27:59,862][39m Trial 401 finished with value: 0.8596491228070176 and parameters: {'criterion': 'gini', 'n_estimators': 110, 'max_features': 0.7904894824912057, 'max_depth': 84, 'min_samples_split': 3, 'min_samples_leaf': 3}. Best is trial 321 with value: 0.8771929824561403.
[32m[I 2023-04-26 12:27:59,958][39m Trial 402 finished with value: 0.8571428571428572 and parameters: {'criterion': 'gini', 'n_estimators': 109, 'max_features': 0.7581833125699171, 'max_depth': 87, 'min_samples_split': 4, 'min_samples_leaf': 3}. Best is trial 321 with value: 0.8771929824561403.
[32m[I 2023-04-26 12:28:00,053][39m Trial 403 finished with value: 0.8571428571428572 and parameters: {'criterion': 'gini', 'n_estimators': 101, 'max_features': 0.7113015564495649, 'max_depth': 89, 'min_samples_split': 4, 'min_samples_leaf': 3}. Best is trial 321 with value: 0.8771929824561403.
[32m[I 2023-04-26 12:28:00,161][39m Trial 404 finished with value: 0.8288288288288289 and parameters: {'criterion': 'entropy', 'n_estimators': 105, 'max_features': 0.7418446666560591, 'max_depth': 94, 'min_samples_split': 4, 'min_samples_leaf': 2}. Best is trial 321 with value: 0.8771929824561403.
[32m[I 2023-04-26 12:28:00,266][39m Trial 405 finished with value: 0.8571428571428572 and parameters: {'criterion': 'gini', 'n_estimators': 115, 'max_features': 0.6861348927957422, 'max_depth': 85, 'min_samples_split': 4, 'min_samples_leaf': 3}. Best is trial 321 with value: 0.8771929824561403.
[32m[I 2023-04-26 12:28:00,357][39m Trial 406 finished with value: 0.8275862068965517 and parameters: {'criterion': 'gini', 'n_estimators': 103, 'max_features': 0.7148460311157802, 'max_depth': 91, 'min_samples_split': 4, 'min_samples_leaf': 3}. Best is trial 321 with value: 0.8771929824561403.
[32m[I 2023-04-26 12:28:00,453][39m Trial 407 finished with value: 0.8521739130434783 and parameters: {'criterion': 'gini', 'n_estimators': 107, 'max_features': 0.7699835023422739, 'max_depth': 90, 'min_samples_split': 6, 'min_samples_leaf': 3}. Best is trial 321 with value: 0.8771929824561403.
[32m[I 2023-04-26 12:28:00,543][39m Trial 408 finished with value: 0.8672566371681416 and parameters: {'criterion': 'gini', 'n_estimators': 99, 'max_features': 0.8113596111706103, 'max_depth': 88, 'min_samples_split': 4, 'min_samples_leaf': 3}. Best is trial 321 with value: 0.8771929824561403.
[32m[I 2023-04-26 12:28:00,636][39m Trial 409 finished with value: 0.8495575221238938 and parameters: {'criterion': 'gini', 'n_estimators': 102, 'max_features': 0.8107569141919714, 'max_depth': 88, 'min_samples_split': 4, 'min_samples_leaf': 3}. Best is trial 321 with value: 0.8771929824561403.
[32m[I 2023-04-26 12:28:00,730][39m Trial 410 finished with value: 0.8421052631578947 and parameters: {'criterion': 'gini', 'n_estimators': 100, 'max_features': 0.8227351971544752, 'max_depth': 93, 'min_samples_split': 4, 'min_samples_leaf': 3}. Best is trial 321 with value: 0.8771929824561403.
[32m[I 2023-04-26 12:28:00,891][39m Trial 411 finished with value: 0.8392857142857144 and parameters: {'criterion': 'gini', 'n_estimators': 185, 'max_features': 0.8258607363423932, 'max_depth': 86, 'min_samples_split': 4, 'min_samples_leaf': 2}. Best is trial 321 with value: 0.8771929824561403.
[32m[I 2023-04-26 12:28:00,992][39m Trial 412 finished with value: 0.8392857142857144 and parameters: {'criterion': 'gini', 'n_estimators': 112, 'max_features': 0.7981013341962503, 'max_depth': 91, 'min_samples_split': 4, 'min_samples_leaf': 3}. Best is trial 321 with value: 0.8771929824561403.
[32m[I 2023-04-26 12:28:01,145][39m Trial 413 finished with value: 0.8672566371681416 and parameters: {'criterion': 'gini', 'n_estimators': 183, 'max_features': 0.7689271673511536, 'max_depth': 46, 'min_samples_split': 4, 'min_samples_leaf': 3}. Best is trial 321 with value: 0.8771929824561403.
[32m[I 2023-04-26 12:28:01,300][39m Trial 414 finished with value: 0.8672566371681416 and parameters: {'criterion': 'gini', 'n_estimators': 180, 'max_features': 0.7907994697139955, 'max_depth': 40, 'min_samples_split': 4, 'min_samples_leaf': 3}. Best is trial 321 with value: 0.8771929824561403.
[32m[I 2023-04-26 12:28:01,461][39m Trial 415 finished with value: 0.8571428571428572 and parameters: {'criterion': 'gini', 'n_estimators': 181, 'max_features': 0.7934908702051036, 'max_depth': 39, 'min_samples_split': 4, 'min_samples_leaf': 3}. Best is trial 321 with value: 0.8771929824561403.
[32m[I 2023-04-26 12:28:01,612][39m Trial 416 finished with value: 0.8672566371681416 and parameters: {'criterion': 'gini', 'n_estimators': 180, 'max_features': 0.7785250257595425, 'max_depth': 30, 'min_samples_split': 4, 'min_samples_leaf': 3}. Best is trial 321 with value: 0.8771929824561403.
[32m[I 2023-04-26 12:28:01,764][39m Trial 417 finished with value: 0.8571428571428572 and parameters: {'criterion': 'gini', 'n_estimators': 179, 'max_features': 0.8057298485384925, 'max_depth': 26, 'min_samples_split': 4, 'min_samples_leaf': 3}. Best is trial 321 with value: 0.8771929824561403.
[32m[I 2023-04-26 12:28:01,914][39m Trial 418 finished with value: 0.8468468468468469 and parameters: {'criterion': 'gini', 'n_estimators': 177, 'max_features': 0.7830734978081759, 'max_depth': 21, 'min_samples_split': 4, 'min_samples_leaf': 3}. Best is trial 321 with value: 0.8771929824561403.
[32m[I 2023-04-26 12:28:02,066][39m Trial 419 finished with value: 0.8596491228070176 and parameters: {'criterion': 'gini', 'n_estimators': 183, 'max_features': 0.7636014709370739, 'max_depth': 39, 'min_samples_split': 5, 'min_samples_leaf': 3}. Best is trial 321 with value: 0.8771929824561403.
[32m[I 2023-04-26 12:28:02,214][39m Trial 420 finished with value: 0.8596491228070176 and parameters: {'criterion': 'gini', 'n_estimators': 174, 'max_features': 0.797811363259058, 'max_depth': 55, 'min_samples_split': 4, 'min_samples_leaf': 3}. Best is trial 321 with value: 0.8771929824561403.
[32m[I 2023-04-26 12:28:02,378][39m Trial 421 finished with value: 0.8521739130434783 and parameters: {'criterion': 'gini', 'n_estimators': 188, 'max_features': 0.835606585789311, 'max_depth': 42, 'min_samples_split': 4, 'min_samples_leaf': 3}. Best is trial 321 with value: 0.8771929824561403.
[32m[I 2023-04-26 12:28:02,531][39m Trial 422 finished with value: 0.8672566371681416 and parameters: {'criterion': 'gini', 'n_estimators': 178, 'max_features': 0.8789872178183231, 'max_depth': 32, 'min_samples_split': 4, 'min_samples_leaf': 3}. Best is trial 321 with value: 0.8771929824561403.
[32m[I 2023-04-26 12:28:02,686][39m Trial 423 finished with value: 0.8495575221238938 and parameters: {'criterion': 'gini', 'n_estimators': 180, 'max_features': 0.8638660601430598, 'max_depth': 30, 'min_samples_split': 4, 'min_samples_leaf': 3}. Best is trial 321 with value: 0.8771929824561403.
[32m[I 2023-04-26 12:28:02,841][39m Trial 424 finished with value: 0.8421052631578947 and parameters: {'criterion': 'gini', 'n_estimators': 180, 'max_features': 0.8623129781120846, 'max_depth': 32, 'min_samples_split': 4, 'min_samples_leaf': 3}. Best is trial 321 with value: 0.8771929824561403.
[32m[I 2023-04-26 12:28:03,020][39m Trial 425 finished with value: 0.8392857142857144 and parameters: {'criterion': 'entropy', 'n_estimators': 182, 'max_features': 0.8788579107954129, 'max_depth': 34, 'min_samples_split': 4, 'min_samples_leaf': 2}. Best is trial 321 with value: 0.8771929824561403.
[32m[I 2023-04-26 12:28:03,180][39m Trial 426 finished with value: 0.8571428571428572 and parameters: {'criterion': 'gini', 'n_estimators': 175, 'max_features': 0.9578302492077194, 'max_depth': 25, 'min_samples_split': 4, 'min_samples_leaf': 3}. Best is trial 321 with value: 0.8771929824561403.
[32m[I 2023-04-26 12:28:03,330][39m Trial 427 finished with value: 0.8495575221238938 and parameters: {'criterion': 'gini', 'n_estimators': 175, 'max_features': 0.7532132728334328, 'max_depth': 31, 'min_samples_split': 4, 'min_samples_leaf': 3}. Best is trial 321 with value: 0.8771929824561403.
[32m[I 2023-04-26 12:28:03,476][39m Trial 428 finished with value: 0.8495575221238938 and parameters: {'criterion': 'gini', 'n_estimators': 172, 'max_features': 0.7430842259327807, 'max_depth': 29, 'min_samples_split': 4, 'min_samples_leaf': 3}. Best is trial 321 with value: 0.8771929824561403.
[32m[I 2023-04-26 12:28:03,641][39m Trial 429 finished with value: 0.8495575221238938 and parameters: {'criterion': 'gini', 'n_estimators': 184, 'max_features': 0.8438014569123289, 'max_depth': 88, 'min_samples_split': 3, 'min_samples_leaf': 2}. Best is trial 321 with value: 0.8771929824561403.
[32m[I 2023-04-26 12:28:03,799][39m Trial 430 finished with value: 0.8596491228070176 and parameters: {'criterion': 'gini', 'n_estimators': 184, 'max_features': 0.734508842358002, 'max_depth': 27, 'min_samples_split': 4, 'min_samples_leaf': 3}. Best is trial 321 with value: 0.8771929824561403.
[32m[I 2023-04-26 12:28:03,953][39m Trial 431 finished with value: 0.8521739130434783 and parameters: {'criterion': 'gini', 'n_estimators': 187, 'max_features': 0.777392135353747, 'max_depth': 33, 'min_samples_split': 4, 'min_samples_leaf': 3}. Best is trial 321 with value: 0.8771929824561403.
[32m[I 2023-04-26 12:28:04,104][39m Trial 432 finished with value: 0.8392857142857144 and parameters: {'criterion': 'gini', 'n_estimators': 178, 'max_features': 0.8129210278607489, 'max_depth': 20, 'min_samples_split': 5, 'min_samples_leaf': 3}. Best is trial 321 with value: 0.8771929824561403.
[32m[I 2023-04-26 12:28:04,257][39m Trial 433 finished with value: 0.8571428571428572 and parameters: {'criterion': 'gini', 'n_estimators': 172, 'max_features': 0.7801710668213935, 'max_depth': 49, 'min_samples_split': 4, 'min_samples_leaf': 3}. Best is trial 321 with value: 0.8771929824561403.
[32m[I 2023-04-26 12:28:04,422][39m Trial 434 finished with value: 0.8521739130434783 and parameters: {'criterion': 'gini', 'n_estimators': 190, 'max_features': 0.9392240568560766, 'max_depth': 29, 'min_samples_split': 4, 'min_samples_leaf': 3}. Best is trial 321 with value: 0.8771929824561403.
[32m[I 2023-04-26 12:28:04,514][39m Trial 435 finished with value: 0.8495575221238938 and parameters: {'criterion': 'gini', 'n_estimators': 101, 'max_features': 0.7546853142238276, 'max_depth': 98, 'min_samples_split': 3, 'min_samples_leaf': 3}. Best is trial 321 with value: 0.8771929824561403.
[32m[I 2023-04-26 12:28:04,667][39m Trial 436 finished with value: 0.8392857142857144 and parameters: {'criterion': 'gini', 'n_estimators': 184, 'max_features': 0.7741399046581585, 'max_depth': 95, 'min_samples_split': 5, 'min_samples_leaf': 2}. Best is trial 321 with value: 0.8771929824561403.
[32m[I 2023-04-26 12:28:04,815][39m Trial 437 finished with value: 0.8672566371681416 and parameters: {'criterion': 'gini', 'n_estimators': 176, 'max_features': 0.725581009288418, 'max_depth': 51, 'min_samples_split': 4, 'min_samples_leaf': 3}. Best is trial 321 with value: 0.8771929824561403.
[32m[I 2023-04-26 12:28:04,971][39m Trial 438 finished with value: 0.8596491228070176 and parameters: {'criterion': 'gini', 'n_estimators': 175, 'max_features': 0.7925338267692836, 'max_depth': 18, 'min_samples_split': 4, 'min_samples_leaf': 3}. Best is trial 321 with value: 0.8771929824561403.
