[32m[I 2023-04-26 12:28:05,119][39m Trial 439 finished with value: 0.8596491228070176 and parameters: {'criterion': 'gini', 'n_estimators': 179, 'max_features': 0.7265020356936992, 'max_depth': 11, 'min_samples_split': 4, 'min_samples_leaf': 3}. Best is trial 321 with value: 0.8771929824561403.
[32m[I 2023-04-26 12:28:05,272][39m Trial 440 finished with value: 0.8521739130434783 and parameters: {'criterion': 'gini', 'n_estimators': 180, 'max_features': 0.7645657500317292, 'max_depth': 36, 'min_samples_split': 4, 'min_samples_leaf': 3}. Best is trial 321 with value: 0.8771929824561403.
[32m[I 2023-04-26 12:28:05,426][39m Trial 441 finished with value: 0.8571428571428572 and parameters: {'criterion': 'gini', 'n_estimators': 182, 'max_features': 0.7422018216466494, 'max_depth': 30, 'min_samples_split': 4, 'min_samples_leaf': 3}. Best is trial 321 with value: 0.8771929824561403.
[32m[I 2023-04-26 12:28:05,584][39m Trial 442 finished with value: 0.8571428571428572 and parameters: {'criterion': 'gini', 'n_estimators': 187, 'max_features': 0.8096456565233123, 'max_depth': 37, 'min_samples_split': 3, 'min_samples_leaf': 3}. Best is trial 321 with value: 0.8771929824561403.
[32m[I 2023-04-26 12:28:05,728][39m Trial 443 finished with value: 0.8495575221238938 and parameters: {'criterion': 'gini', 'n_estimators': 176, 'max_features': 0.7102870672750741, 'max_depth': 29, 'min_samples_split': 4, 'min_samples_leaf': 3}. Best is trial 321 with value: 0.8771929824561403.
[32m[I 2023-04-26 12:28:05,900][39m Trial 444 finished with value: 0.8392857142857144 and parameters: {'criterion': 'entropy', 'n_estimators': 173, 'max_features': 0.8891294430166875, 'max_depth': 33, 'min_samples_split': 4, 'min_samples_leaf': 3}. Best is trial 321 with value: 0.8771929824561403.
[32m[I 2023-04-26 12:28:06,064][39m Trial 445 finished with value: 0.8392857142857144 and parameters: {'criterion': 'gini', 'n_estimators': 191, 'max_features': 0.8644214808012781, 'max_depth': 39, 'min_samples_split': 5, 'min_samples_leaf': 2}. Best is trial 321 with value: 0.8771929824561403.
[32m[I 2023-04-26 12:28:06,212][39m Trial 446 finished with value: 0.8421052631578947 and parameters: {'criterion': 'gini', 'n_estimators': 172, 'max_features': 0.7768427652807536, 'max_depth': 51, 'min_samples_split': 4, 'min_samples_leaf': 3}. Best is trial 321 with value: 0.8771929824561403.
[32m[I 2023-04-26 12:28:06,377][39m Trial 447 finished with value: 0.8596491228070176 and parameters: {'criterion': 'gini', 'n_estimators': 179, 'max_features': 0.6866833814052851, 'max_depth': 86, 'min_samples_split': 4, 'min_samples_leaf': 3}. Best is trial 321 with value: 0.8771929824561403.
[32m[I 2023-04-26 12:28:06,521][39m Trial 448 finished with value: 0.8392857142857144 and parameters: {'criterion': 'gini', 'n_estimators': 168, 'max_features': 0.8311315213525936, 'max_depth': 98, 'min_samples_split': 4, 'min_samples_leaf': 2}. Best is trial 321 with value: 0.8771929824561403.
[32m[I 2023-04-26 12:28:06,672][39m Trial 449 finished with value: 0.8521739130434783 and parameters: {'criterion': 'gini', 'n_estimators': 183, 'max_features': 0.756883351105254, 'max_depth': 34, 'min_samples_split': 3, 'min_samples_leaf': 3}. Best is trial 321 with value: 0.8771929824561403.
[32m[I 2023-04-26 12:28:06,832][39m Trial 450 finished with value: 0.8672566371681416 and parameters: {'criterion': 'gini', 'n_estimators': 194, 'max_features': 0.7272712550020807, 'max_depth': 24, 'min_samples_split': 3, 'min_samples_leaf': 3}. Best is trial 321 with value: 0.8771929824561403.
[32m[I 2023-04-26 12:28:06,964][39m Trial 451 finished with value: 0.8256880733944953 and parameters: {'criterion': 'gini', 'n_estimators': 196, 'max_features': 0.1825172728048362, 'max_depth': 24, 'min_samples_split': 4, 'min_samples_leaf': 3}. Best is trial 321 with value: 0.8771929824561403.
[32m[I 2023-04-26 12:28:07,087][39m Trial 452 finished with value: 0.831858407079646 and parameters: {'criterion': 'gini', 'n_estimators': 195, 'max_features': 0.09839749927080893, 'max_depth': 14, 'min_samples_split': 10, 'min_samples_leaf': 3}. Best is trial 321 with value: 0.8771929824561403.
[32m[I 2023-04-26 12:28:07,191][39m Trial 453 finished with value: 0.8468468468468469 and parameters: {'criterion': 'gini', 'n_estimators': 119, 'max_features': 0.7738115417565155, 'max_depth': 25, 'min_samples_split': 3, 'min_samples_leaf': 3}. Best is trial 321 with value: 0.8771929824561403.
[32m[I 2023-04-26 12:28:07,337][39m Trial 454 finished with value: 0.8495575221238938 and parameters: {'criterion': 'gini', 'n_estimators': 164, 'max_features': 0.7896110015969239, 'max_depth': 43, 'min_samples_split': 5, 'min_samples_leaf': 2}. Best is trial 321 with value: 0.8771929824561403.
[32m[I 2023-04-26 12:28:07,478][39m Trial 455 finished with value: 0.8196721311475409 and parameters: {'criterion': 'gini', 'n_estimators': 178, 'max_features': 0.7342284233083523, 'max_depth': 3, 'min_samples_split': 4, 'min_samples_leaf': 3}. Best is trial 321 with value: 0.8771929824561403.
[32m[I 2023-04-26 12:28:07,571][39m Trial 456 finished with value: 0.8596491228070176 and parameters: {'criterion': 'gini', 'n_estimators': 99, 'max_features': 0.7500242520886038, 'max_depth': 92, 'min_samples_split': 10, 'min_samples_leaf': 3}. Best is trial 321 with value: 0.8771929824561403.
[32m[I 2023-04-26 12:28:07,740][39m Trial 457 finished with value: 0.8495575221238938 and parameters: {'criterion': 'gini', 'n_estimators': 198, 'max_features': 0.7201682928845298, 'max_depth': 27, 'min_samples_split': 3, 'min_samples_leaf': 3}. Best is trial 321 with value: 0.8771929824561403.
[32m[I 2023-04-26 12:28:07,897][39m Trial 458 finished with value: 0.8448275862068967 and parameters: {'criterion': 'gini', 'n_estimators': 189, 'max_features': 0.6610004798206607, 'max_depth': 41, 'min_samples_split': 4, 'min_samples_leaf': 3}. Best is trial 321 with value: 0.8771929824561403.
[32m[I 2023-04-26 12:28:08,042][39m Trial 459 finished with value: 0.8571428571428572 and parameters: {'criterion': 'gini', 'n_estimators': 169, 'max_features': 0.7173880555487919, 'max_depth': 53, 'min_samples_split': 3, 'min_samples_leaf': 3}. Best is trial 321 with value: 0.8771929824561403.
[32m[I 2023-04-26 12:28:08,134][39m Trial 460 finished with value: 0.8672566371681416 and parameters: {'criterion': 'gini', 'n_estimators': 104, 'max_features': 0.6888068552718339, 'max_depth': 97, 'min_samples_split': 10, 'min_samples_leaf': 3}. Best is trial 321 with value: 0.8771929824561403.
[32m[I 2023-04-26 12:28:08,286][39m Trial 461 finished with value: 0.8596491228070176 and parameters: {'criterion': 'gini', 'n_estimators': 177, 'max_features': 0.738083226368616, 'max_depth': 60, 'min_samples_split': 3, 'min_samples_leaf': 3}. Best is trial 321 with value: 0.8771929824561403.
[32m[I 2023-04-26 12:28:08,435][39m Trial 462 finished with value: 0.8448275862068967 and parameters: {'criterion': 'gini', 'n_estimators': 175, 'max_features': 0.6983295839704381, 'max_depth': 101, 'min_samples_split': 10, 'min_samples_leaf': 1}. Best is trial 321 with value: 0.8771929824561403.
[32m[I 2023-04-26 12:28:08,600][39m Trial 463 finished with value: 0.8672566371681416 and parameters: {'criterion': 'gini', 'n_estimators': 192, 'max_features': 0.7902838934509111, 'max_depth': 23, 'min_samples_split': 3, 'min_samples_leaf': 3}. Best is trial 321 with value: 0.8771929824561403.
[32m[I 2023-04-26 12:28:08,702][39m Trial 464 finished with value: 0.8521739130434783 and parameters: {'criterion': 'gini', 'n_estimators': 109, 'max_features': 0.8077264775338195, 'max_depth': 25, 'min_samples_split': 10, 'min_samples_leaf': 2}. Best is trial 321 with value: 0.8771929824561403.
[32m[I 2023-04-26 12:28:08,891][39m Trial 465 finished with value: 0.8392857142857144 and parameters: {'criterion': 'entropy', 'n_estimators': 192, 'max_features': 0.8345154801981937, 'max_depth': 20, 'min_samples_split': 4, 'min_samples_leaf': 3}. Best is trial 321 with value: 0.8771929824561403.
[32m[I 2023-04-26 12:28:08,978][39m Trial 466 finished with value: 0.8495575221238938 and parameters: {'criterion': 'gini', 'n_estimators': 90, 'max_features': 0.7566368215503776, 'max_depth': 36, 'min_samples_split': 2, 'min_samples_leaf': 3}. Best is trial 321 with value: 0.8771929824561403.
[32m[I 2023-04-26 12:28:09,133][39m Trial 467 finished with value: 0.8571428571428572 and parameters: {'criterion': 'gini', 'n_estimators': 183, 'max_features': 0.731344288382145, 'max_depth': 16, 'min_samples_split': 4, 'min_samples_leaf': 3}. Best is trial 321 with value: 0.8771929824561403.
[32m[I 2023-04-26 12:28:09,279][39m Trial 468 finished with value: 0.8392857142857144 and parameters: {'criterion': 'gini', 'n_estimators': 165, 'max_features': 0.70857544640361, 'max_depth': 23, 'min_samples_split': 3, 'min_samples_leaf': 2}. Best is trial 321 with value: 0.8771929824561403.
[32m[I 2023-04-26 12:28:09,438][39m Trial 469 finished with value: 0.8521739130434783 and parameters: {'criterion': 'gini', 'n_estimators': 180, 'max_features': 0.7983506475700798, 'max_depth': 47, 'min_samples_split': 4, 'min_samples_leaf': 3}. Best is trial 321 with value: 0.8771929824561403.
[32m[I 2023-04-26 12:28:09,541][39m Trial 470 finished with value: 0.8596491228070176 and parameters: {'criterion': 'gini', 'n_estimators': 112, 'max_features': 0.7709723045688375, 'max_depth': 65, 'min_samples_split': 4, 'min_samples_leaf': 3}. Best is trial 321 with value: 0.8771929824561403.
[32m[I 2023-04-26 12:28:09,637][39m Trial 471 finished with value: 0.8421052631578947 and parameters: {'criterion': 'gini', 'n_estimators': 103, 'max_features': 0.8533247516752791, 'max_depth': 98, 'min_samples_split': 10, 'min_samples_leaf': 3}. Best is trial 321 with value: 0.8771929824561403.
[32m[I 2023-04-26 12:28:09,790][39m Trial 472 finished with value: 0.8672566371681416 and parameters: {'criterion': 'gini', 'n_estimators': 188, 'max_features': 0.716033150384428, 'max_depth': 84, 'min_samples_split': 3, 'min_samples_leaf': 3}. Best is trial 321 with value: 0.8771929824561403.
[32m[I 2023-04-26 12:28:09,950][39m Trial 473 finished with value: 0.8596491228070176 and parameters: {'criterion': 'gini', 'n_estimators': 189, 'max_features': 0.7859259808367676, 'max_depth': 90, 'min_samples_split': 10, 'min_samples_leaf': 3}. Best is trial 321 with value: 0.8771929824561403.
[32m[I 2023-04-26 12:28:10,106][39m Trial 474 finished with value: 0.8495575221238938 and parameters: {'criterion': 'gini', 'n_estimators': 186, 'max_features': 0.7865865419717013, 'max_depth': 84, 'min_samples_split': 3, 'min_samples_leaf': 3}. Best is trial 321 with value: 0.8771929824561403.
[32m[I 2023-04-26 12:28:10,252][39m Trial 475 finished with value: 0.8596491228070176 and parameters: {'criterion': 'gini', 'n_estimators': 177, 'max_features': 0.7541496509149603, 'max_depth': 57, 'min_samples_split': 4, 'min_samples_leaf': 3}. Best is trial 321 with value: 0.8771929824561403.
[32m[I 2023-04-26 12:28:10,404][39m Trial 476 finished with value: 0.8596491228070176 and parameters: {'criterion': 'gini', 'n_estimators': 179, 'max_features': 0.7610490773298249, 'max_depth': 88, 'min_samples_split': 3, 'min_samples_leaf': 3}. Best is trial 321 with value: 0.8771929824561403.
[32m[I 2023-04-26 12:28:10,554][39m Trial 477 finished with value: 0.8672566371681416 and parameters: {'criterion': 'gini', 'n_estimators': 181, 'max_features': 0.7300450611324635, 'max_depth': 87, 'min_samples_split': 4, 'min_samples_leaf': 3}. Best is trial 321 with value: 0.8771929824561403.
[32m[I 2023-04-26 12:28:10,641][39m Trial 478 finished with value: 0.8545454545454546 and parameters: {'criterion': 'gini', 'n_estimators': 97, 'max_features': 0.6568176037787753, 'max_depth': 86, 'min_samples_split': 3, 'min_samples_leaf': 2}. Best is trial 321 with value: 0.8771929824561403.
[32m[I 2023-04-26 12:28:10,796][39m Trial 479 finished with value: 0.8571428571428572 and parameters: {'criterion': 'gini', 'n_estimators': 182, 'max_features': 0.7384815965504342, 'max_depth': 34, 'min_samples_split': 4, 'min_samples_leaf': 3}. Best is trial 321 with value: 0.8771929824561403.
[32m[I 2023-04-26 12:28:10,956][39m Trial 480 finished with value: 0.8468468468468469 and parameters: {'criterion': 'gini', 'n_estimators': 194, 'max_features': 0.6690478316589642, 'max_depth': 24, 'min_samples_split': 3, 'min_samples_leaf': 3}. Best is trial 321 with value: 0.8771929824561403.
[32m[I 2023-04-26 12:28:11,117][39m Trial 481 finished with value: 0.8288288288288289 and parameters: {'criterion': 'gini', 'n_estimators': 197, 'max_features': 0.6938829603495195, 'max_depth': 90, 'min_samples_split': 3, 'min_samples_leaf': 2}. Best is trial 321 with value: 0.8771929824561403.
[32m[I 2023-04-26 12:28:11,213][39m Trial 482 finished with value: 0.8495575221238938 and parameters: {'criterion': 'gini', 'n_estimators': 105, 'max_features': 0.6870430224917942, 'max_depth': 55, 'min_samples_split': 10, 'min_samples_leaf': 3}. Best is trial 321 with value: 0.8771929824561403.
[32m[I 2023-04-26 12:28:11,385][39m Trial 483 finished with value: 0.8495575221238938 and parameters: {'criterion': 'gini', 'n_estimators': 201, 'max_features': 0.8175292682927433, 'max_depth': 23, 'min_samples_split': 6, 'min_samples_leaf': 3}. Best is trial 321 with value: 0.8771929824561403.
[32m[I 2023-04-26 12:28:11,542][39m Trial 484 finished with value: 0.8421052631578947 and parameters: {'criterion': 'entropy', 'n_estimators': 170, 'max_features': 0.6725256124342356, 'max_depth': 27, 'min_samples_split': 4, 'min_samples_leaf': 3}. Best is trial 321 with value: 0.8771929824561403.
[32m[I 2023-04-26 12:28:11,665][39m Trial 485 finished with value: 0.8256880733944953 and parameters: {'criterion': 'gini', 'n_estimators': 175, 'max_features': 0.24885877838196735, 'max_depth': 101, 'min_samples_split': 3, 'min_samples_leaf': 3}. Best is trial 321 with value: 0.8771929824561403.
[32m[I 2023-04-26 12:28:11,756][39m Trial 486 finished with value: 0.8596491228070176 and parameters: {'criterion': 'gini', 'n_estimators': 100, 'max_features': 0.7068200117479506, 'max_depth': 63, 'min_samples_split': 2, 'min_samples_leaf': 3}. Best is trial 321 with value: 0.8771929824561403.
[32m[I 2023-04-26 12:28:11,924][39m Trial 487 finished with value: 0.8672566371681416 and parameters: {'criterion': 'gini', 'n_estimators': 185, 'max_features': 0.7678398690059421, 'max_depth': 87, 'min_samples_split': 4, 'min_samples_leaf': 3}. Best is trial 321 with value: 0.8771929824561403.
[32m[I 2023-04-26 12:28:12,084][39m Trial 488 finished with value: 0.8596491228070176 and parameters: {'criterion': 'gini', 'n_estimators': 186, 'max_features': 0.8048161629526689, 'max_depth': 45, 'min_samples_split': 10, 'min_samples_leaf': 2}. Best is trial 321 with value: 0.8771929824561403.
[32m[I 2023-04-26 12:28:12,240][39m Trial 489 finished with value: 0.8495575221238938 and parameters: {'criterion': 'gini', 'n_estimators': 185, 'max_features': 0.7739269528826753, 'max_depth': 89, 'min_samples_split': 4, 'min_samples_leaf': 3}. Best is trial 321 with value: 0.8771929824561403.
[32m[I 2023-04-26 12:28:12,401][39m Trial 490 finished with value: 0.8468468468468469 and parameters: {'criterion': 'gini', 'n_estimators': 194, 'max_features': 0.7244545042592757, 'max_depth': 18, 'min_samples_split': 4, 'min_samples_leaf': 3}. Best is trial 321 with value: 0.8771929824561403.
[32m[I 2023-04-26 12:28:12,499][39m Trial 491 finished with value: 0.8495575221238938 and parameters: {'criterion': 'gini', 'n_estimators': 107, 'max_features': 0.6853435865610933, 'max_depth': 23, 'min_samples_split': 3, 'min_samples_leaf': 3}. Best is trial 321 with value: 0.8771929824561403.
[32m[I 2023-04-26 12:28:12,642][39m Trial 492 finished with value: 0.8495575221238938 and parameters: {'criterion': 'gini', 'n_estimators': 171, 'max_features': 0.684067865366063, 'max_depth': 95, 'min_samples_split': 3, 'min_samples_leaf': 2}. Best is trial 321 with value: 0.8771929824561403.
[32m[I 2023-04-26 12:28:12,808][39m Trial 493 finished with value: 0.8672566371681416 and parameters: {'criterion': 'gini', 'n_estimators': 191, 'max_features': 0.9387356826573867, 'max_depth': 84, 'min_samples_split': 3, 'min_samples_leaf': 3}. Best is trial 321 with value: 0.8771929824561403.
[32m[I 2023-04-26 12:28:12,977][39m Trial 494 finished with value: 0.8571428571428572 and parameters: {'criterion': 'gini', 'n_estimators': 189, 'max_features': 0.9454716886096874, 'max_depth': 84, 'min_samples_split': 3, 'min_samples_leaf': 3}. Best is trial 321 with value: 0.8771929824561403.
[32m[I 2023-04-26 12:28:13,067][39m Trial 495 finished with value: 0.8468468468468469 and parameters: {'criterion': 'gini', 'n_estimators': 102, 'max_features': 0.6543444168405255, 'max_depth': 31, 'min_samples_split': 4, 'min_samples_leaf': 3}. Best is trial 321 with value: 0.8771929824561403.
[32m[I 2023-04-26 12:28:13,164][39m Trial 496 finished with value: 0.8672566371681416 and parameters: {'criterion': 'gini', 'n_estimators': 103, 'max_features': 0.8288204304380717, 'max_depth': 27, 'min_samples_split': 5, 'min_samples_leaf': 3}. Best is trial 321 with value: 0.8771929824561403.
[32m[I 2023-04-26 12:28:13,326][39m Trial 497 finished with value: 0.8695652173913043 and parameters: {'criterion': 'gini', 'n_estimators': 193, 'max_features': 0.7513250223575082, 'max_depth': 98, 'min_samples_split': 10, 'min_samples_leaf': 3}. Best is trial 321 with value: 0.8771929824561403.
[32m[I 2023-04-26 12:28:13,484][39m Trial 498 finished with value: 0.8596491228070176 and parameters: {'criterion': 'gini', 'n_estimators': 198, 'max_features': 0.6472213712628977, 'max_depth': 20, 'min_samples_split': 10, 'min_samples_leaf': 3}. Best is trial 321 with value: 0.8771929824561403.
[32m[I 2023-04-26 12:28:13,652][39m Trial 499 finished with value: 0.8596491228070176 and parameters: {'criterion': 'gini', 'n_estimators': 191, 'max_features': 0.9276604190220021, 'max_depth': 28, 'min_samples_split': 5, 'min_samples_leaf': 3}. Best is trial 321 with value: 0.8771929824561403.
Number of finished trials: 500