[32m[I 2023-04-26 12:26:59,874][39m Trial 73 finished with value: 0.8448275862068967 and parameters: {'criterion': 'gini', 'n_estimators': 201, 'max_features': 0.6446773254366528, 'max_depth': 70, 'min_samples_split': 10, 'min_samples_leaf': 6}. Best is trial 30 with value: 0.864406779661017.
[32m[I 2023-04-26 12:27:00,082][39m Trial 74 finished with value: 0.8547008547008546 and parameters: {'criterion': 'gini', 'n_estimators': 159, 'max_features': 0.40589327124935526, 'max_depth': 75, 'min_samples_split': 9, 'min_samples_leaf': 5}. Best is trial 30 with value: 0.864406779661017.
[32m[I 2023-04-26 12:27:00,226][39m Trial 75 finished with value: 0.8347826086956522 and parameters: {'criterion': 'gini', 'n_estimators': 109, 'max_features': 0.374433289108324, 'max_depth': 63, 'min_samples_split': 10, 'min_samples_leaf': 5}. Best is trial 30 with value: 0.864406779661017.
[32m[I 2023-04-26 12:27:00,473][39m Trial 76 finished with value: 0.8347826086956522 and parameters: {'criterion': 'gini', 'n_estimators': 190, 'max_features': 0.5097323911285433, 'max_depth': 75, 'min_samples_split': 9, 'min_samples_leaf': 5}. Best is trial 30 with value: 0.864406779661017.
[32m[I 2023-04-26 12:27:00,708][39m Trial 77 finished with value: 0.8448275862068967 and parameters: {'criterion': 'gini', 'n_estimators': 159, 'max_features': 0.9174478812962079, 'max_depth': 82, 'min_samples_split': 7, 'min_samples_leaf': 4}. Best is trial 30 with value: 0.864406779661017.
[32m[I 2023-04-26 12:27:00,883][39m Trial 78 finished with value: 0.8333333333333334 and parameters: {'criterion': 'gini', 'n_estimators': 126, 'max_features': 0.7352451547971152, 'max_depth': 87, 'min_samples_split': 8, 'min_samples_leaf': 8}. Best is trial 30 with value: 0.864406779661017.
[32m[I 2023-04-26 12:27:01,015][39m Trial 79 finished with value: 0.8245614035087718 and parameters: {'criterion': 'gini', 'n_estimators': 99, 'max_features': 0.32896975329275724, 'max_depth': 66, 'min_samples_split': 5, 'min_samples_leaf': 6}. Best is trial 30 with value: 0.864406779661017.
[32m[I 2023-04-26 12:27:01,185][39m Trial 80 finished with value: 0.8421052631578947 and parameters: {'criterion': 'gini', 'n_estimators': 138, 'max_features': 0.28461767337182614, 'max_depth': 54, 'min_samples_split': 9, 'min_samples_leaf': 10}. Best is trial 30 with value: 0.864406779661017.
[32m[I 2023-04-26 12:27:01,409][39m Trial 81 finished with value: 0.8448275862068967 and parameters: {'criterion': 'gini', 'n_estimators': 178, 'max_features': 0.3954499418820001, 'max_depth': 72, 'min_samples_split': 10, 'min_samples_leaf': 5}. Best is trial 30 with value: 0.864406779661017.
[32m[I 2023-04-26 12:27:01,586][39m Trial 82 finished with value: 0.8333333333333334 and parameters: {'criterion': 'gini', 'n_estimators': 132, 'max_features': 0.5955730431112128, 'max_depth': 68, 'min_samples_split': 9, 'min_samples_leaf': 8}. Best is trial 30 with value: 0.864406779661017.
[32m[I 2023-04-26 12:27:01,742][39m Trial 83 finished with value: 0.8448275862068967 and parameters: {'criterion': 'gini', 'n_estimators': 116, 'max_features': 0.4592779221286151, 'max_depth': 78, 'min_samples_split': 10, 'min_samples_leaf': 6}. Best is trial 30 with value: 0.864406779661017.
[32m[I 2023-04-26 12:27:01,895][39m Trial 84 finished with value: 0.8547008547008546 and parameters: {'criterion': 'gini', 'n_estimators': 120, 'max_features': 0.7007706069845919, 'max_depth': 80, 'min_samples_split': 8, 'min_samples_leaf': 9}. Best is trial 30 with value: 0.864406779661017.
[32m[I 2023-04-26 12:27:02,081][39m Trial 85 finished with value: 0.8333333333333334 and parameters: {'criterion': 'entropy', 'n_estimators': 123, 'max_features': 0.7066197532861493, 'max_depth': 80, 'min_samples_split': 7, 'min_samples_leaf': 9}. Best is trial 30 with value: 0.864406779661017.
[32m[I 2023-04-26 12:27:02,225][39m Trial 86 finished with value: 0.8421052631578947 and parameters: {'criterion': 'gini', 'n_estimators': 112, 'max_features': 0.238816325499406, 'max_depth': 73, 'min_samples_split': 9, 'min_samples_leaf': 5}. Best is trial 30 with value: 0.864406779661017.
[32m[I 2023-04-26 12:27:02,355][39m Trial 87 finished with value: 0.8347826086956522 and parameters: {'criterion': 'gini', 'n_estimators': 93, 'max_features': 0.4380631699840206, 'max_depth': 61, 'min_samples_split': 10, 'min_samples_leaf': 4}. Best is trial 30 with value: 0.864406779661017.
[32m[I 2023-04-26 12:27:02,494][39m Trial 88 finished with value: 0.8547008547008546 and parameters: {'criterion': 'gini', 'n_estimators': 107, 'max_features': 0.36341189161091314, 'max_depth': 69, 'min_samples_split': 9, 'min_samples_leaf': 11}. Best is trial 30 with value: 0.864406779661017.
[32m[I 2023-04-26 12:27:02,638][39m Trial 89 finished with value: 0.8547008547008546 and parameters: {'criterion': 'gini', 'n_estimators': 107, 'max_features': 0.35458758916303396, 'max_depth': 94, 'min_samples_split': 9, 'min_samples_leaf': 11}. Best is trial 30 with value: 0.864406779661017.
[32m[I 2023-04-26 12:27:02,814][39m Trial 90 finished with value: 0.8264462809917354 and parameters: {'criterion': 'gini', 'n_estimators': 128, 'max_features': 0.5286763412956957, 'max_depth': 64, 'min_samples_split': 9, 'min_samples_leaf': 11}. Best is trial 30 with value: 0.864406779661017.
[32m[I 2023-04-26 12:27:02,940][39m Trial 91 finished with value: 0.8547008547008546 and parameters: {'criterion': 'gini', 'n_estimators': 87, 'max_features': 0.4016034124651847, 'max_depth': 84, 'min_samples_split': 8, 'min_samples_leaf': 10}. Best is trial 30 with value: 0.864406779661017.
[32m[I 2023-04-26 12:27:03,141][39m Trial 92 finished with value: 0.8448275862068967 and parameters: {'criterion': 'gini', 'n_estimators': 144, 'max_features': 0.5008206996181966, 'max_depth': 76, 'min_samples_split': 10, 'min_samples_leaf': 5}. Best is trial 30 with value: 0.864406779661017.
[32m[I 2023-04-26 12:27:03,285][39m Trial 93 finished with value: 0.8521739130434783 and parameters: {'criterion': 'gini', 'n_estimators': 107, 'max_features': 0.35936861484032495, 'max_depth': 59, 'min_samples_split': 11, 'min_samples_leaf': 11}. Best is trial 30 with value: 0.864406779661017.
[32m[I 2023-04-26 12:27:03,532][39m Trial 94 finished with value: 0.8547008547008546 and parameters: {'criterion': 'gini', 'n_estimators': 193, 'max_features': 0.4556697960109097, 'max_depth': 71, 'min_samples_split': 8, 'min_samples_leaf': 7}. Best is trial 30 with value: 0.864406779661017.
[32m[I 2023-04-26 12:27:03,665][39m Trial 95 finished with value: 0.8347826086956522 and parameters: {'criterion': 'gini', 'n_estimators': 95, 'max_features': 0.4269449690324319, 'max_depth': 51, 'min_samples_split': 11, 'min_samples_leaf': 6}. Best is trial 30 with value: 0.864406779661017.
[32m[I 2023-04-26 12:27:03,822][39m Trial 96 finished with value: 0.8347826086956522 and parameters: {'criterion': 'gini', 'n_estimators': 116, 'max_features': 0.45655394423858703, 'max_depth': 70, 'min_samples_split': 8, 'min_samples_leaf': 5}. Best is trial 30 with value: 0.864406779661017.
[32m[I 2023-04-26 12:27:04,060][39m Trial 97 finished with value: 0.8305084745762712 and parameters: {'criterion': 'gini', 'n_estimators': 171, 'max_features': 0.7497985403709307, 'max_depth': 77, 'min_samples_split': 7, 'min_samples_leaf': 6}. Best is trial 30 with value: 0.864406779661017.
[32m[I 2023-04-26 12:27:04,187][39m Trial 98 finished with value: 0.823529411764706 and parameters: {'criterion': 'entropy', 'n_estimators': 72, 'max_features': 0.8453734747252606, 'max_depth': 87, 'min_samples_split': 8, 'min_samples_leaf': 7}. Best is trial 30 with value: 0.864406779661017.
[32m[I 2023-04-26 12:27:04,346][39m Trial 99 finished with value: 0.8448275862068967 and parameters: {'criterion': 'gini', 'n_estimators': 120, 'max_features': 0.49296775894196676, 'max_depth': 56, 'min_samples_split': 11, 'min_samples_leaf': 8}. Best is trial 30 with value: 0.864406779661017.
[32m[I 2023-04-26 12:27:04,446][39m Trial 100 finished with value: 0.8333333333333334 and parameters: {'criterion': 'gini', 'n_estimators': 65, 'max_features': 0.5581692656491133, 'max_depth': 47, 'min_samples_split': 10, 'min_samples_leaf': 9}. Best is trial 30 with value: 0.864406779661017.
[32m[I 2023-04-26 12:27:04,563][39m Trial 101 finished with value: 0.8521739130434783 and parameters: {'criterion': 'gini', 'n_estimators': 86, 'max_features': 0.33320877537208565, 'max_depth': 91, 'min_samples_split': 9, 'min_samples_leaf': 10}. Best is trial 30 with value: 0.864406779661017.
[32m[I 2023-04-26 12:27:04,694][39m Trial 102 finished with value: 0.8333333333333334 and parameters: {'criterion': 'gini', 'n_estimators': 97, 'max_features': 0.4076960473256938, 'max_depth': 99, 'min_samples_split': 9, 'min_samples_leaf': 11}. Best is trial 30 with value: 0.864406779661017.
[32m[I 2023-04-26 12:27:04,898][39m Trial 103 finished with value: 0.8448275862068967 and parameters: {'criterion': 'gini', 'n_estimators': 156, 'max_features': 0.4677277669788836, 'max_depth': 67, 'min_samples_split': 10, 'min_samples_leaf': 7}. Best is trial 30 with value: 0.864406779661017.
[32m[I 2023-04-26 12:27:05,142][39m Trial 104 finished with value: 0.8547008547008546 and parameters: {'criterion': 'gini', 'n_estimators': 192, 'max_features': 0.47639242477021415, 'max_depth': 83, 'min_samples_split': 8, 'min_samples_leaf': 6}. Best is trial 30 with value: 0.864406779661017.
[32m[I 2023-04-26 12:27:05,290][39m Trial 105 finished with value: 0.8347826086956522 and parameters: {'criterion': 'gini', 'n_estimators': 112, 'max_features': 0.38398954547542496, 'max_depth': 79, 'min_samples_split': 11, 'min_samples_leaf': 5}. Best is trial 30 with value: 0.864406779661017.
[32m[I 2023-04-26 12:27:05,464][39m Trial 106 finished with value: 0.8547008547008546 and parameters: {'criterion': 'gini', 'n_estimators': 131, 'max_features': 0.522704054529647, 'max_depth': 84, 'min_samples_split': 8, 'min_samples_leaf': 6}. Best is trial 30 with value: 0.864406779661017.
[32m[I 2023-04-26 12:27:05,641][39m Trial 107 finished with value: 0.823529411764706 and parameters: {'criterion': 'gini', 'n_estimators': 126, 'max_features': 0.6488312125265371, 'max_depth': 74, 'min_samples_split': 10, 'min_samples_leaf': 5}. Best is trial 30 with value: 0.864406779661017.
[32m[I 2023-04-26 12:27:05,876][39m Trial 108 finished with value: 0.8333333333333334 and parameters: {'criterion': 'gini', 'n_estimators': 177, 'max_features': 0.6790495801493401, 'max_depth': 80, 'min_samples_split': 9, 'min_samples_leaf': 9}. Best is trial 30 with value: 0.864406779661017.
[32m[I 2023-04-26 12:27:06,090][39m Trial 109 finished with value: 0.864406779661017 and parameters: {'criterion': 'gini', 'n_estimators': 160, 'max_features': 0.607625980748804, 'max_depth': 83, 'min_samples_split': 8, 'min_samples_leaf': 6}. Best is trial 30 with value: 0.864406779661017.
[32m[I 2023-04-26 12:27:06,303][39m Trial 110 finished with value: 0.8376068376068375 and parameters: {'criterion': 'gini', 'n_estimators': 153, 'max_features': 0.7274584800078746, 'max_depth': 82, 'min_samples_split': 7, 'min_samples_leaf': 6}. Best is trial 30 with value: 0.864406779661017.
[32m[I 2023-04-26 12:27:06,447][39m Trial 111 finished with value: 0.8571428571428572 and parameters: {'criterion': 'gini', 'n_estimators': 101, 'max_features': 0.5822111248776232, 'max_depth': 7, 'min_samples_split': 9, 'min_samples_leaf': 5}. Best is trial 30 with value: 0.864406779661017.
[32m[I 2023-04-26 12:27:06,614][39m Trial 112 finished with value: 0.8448275862068967 and parameters: {'criterion': 'gini', 'n_estimators': 118, 'max_features': 0.6194180187583543, 'max_depth': 8, 'min_samples_split': 9, 'min_samples_leaf': 5}. Best is trial 30 with value: 0.864406779661017.
[32m[I 2023-04-26 12:27:06,709][39m Trial 113 finished with value: 0.8448275862068967 and parameters: {'criterion': 'gini', 'n_estimators': 60, 'max_features': 0.5423157603652964, 'max_depth': 16, 'min_samples_split': 9, 'min_samples_leaf': 6}. Best is trial 30 with value: 0.864406779661017.
[32m[I 2023-04-26 12:27:06,935][39m Trial 114 finished with value: 0.8620689655172413 and parameters: {'criterion': 'gini', 'n_estimators': 168, 'max_features': 0.5960505216437006, 'max_depth': 88, 'min_samples_split': 9, 'min_samples_leaf': 4}. Best is trial 30 with value: 0.864406779661017.
[32m[I 2023-04-26 12:27:07,079][39m Trial 115 finished with value: 0.8695652173913043 and parameters: {'criterion': 'gini', 'n_estimators': 100, 'max_features': 0.5900602417868192, 'max_depth': 96, 'min_samples_split': 10, 'min_samples_leaf': 4}. Best is trial 115 with value: 0.8695652173913043.
[32m[I 2023-04-26 12:27:07,228][39m Trial 116 finished with value: 0.8672566371681416 and parameters: {'criterion': 'gini', 'n_estimators': 103, 'max_features': 0.5734472496594945, 'max_depth': 97, 'min_samples_split': 10, 'min_samples_leaf': 3}. Best is trial 115 with value: 0.8695652173913043.
[32m[I 2023-04-26 12:27:07,455][39m Trial 117 finished with value: 0.8495575221238938 and parameters: {'criterion': 'gini', 'n_estimators': 165, 'max_features': 0.5916471849511761, 'max_depth': 95, 'min_samples_split': 8, 'min_samples_leaf': 2}. Best is trial 115 with value: 0.8695652173913043.
[32m[I 2023-04-26 12:27:07,644][39m Trial 118 finished with value: 0.8495575221238938 and parameters: {'criterion': 'entropy', 'n_estimators': 122, 'max_features': 0.5792852166427508, 'max_depth': 96, 'min_samples_split': 9, 'min_samples_leaf': 3}. Best is trial 115 with value: 0.8695652173913043.
[32m[I 2023-04-26 12:27:07,797][39m Trial 119 finished with value: 0.8521739130434783 and parameters: {'criterion': 'gini', 'n_estimators': 103, 'max_features': 0.6188911464339408, 'max_depth': 97, 'min_samples_split': 9, 'min_samples_leaf': 3}. Best is trial 115 with value: 0.8695652173913043.
[32m[I 2023-04-26 12:27:08,017][39m Trial 120 finished with value: 0.8672566371681416 and parameters: {'criterion': 'gini', 'n_estimators': 159, 'max_features': 0.6590719141175321, 'max_depth': 92, 'min_samples_split': 10, 'min_samples_leaf': 2}. Best is trial 115 with value: 0.8695652173913043.
[32m[I 2023-04-26 12:27:08,162][39m Trial 121 finished with value: 0.8468468468468469 and parameters: {'criterion': 'gini', 'n_estimators': 99, 'max_features': 0.5661841854587786, 'max_depth': 92, 'min_samples_split': 10, 'min_samples_leaf': 2}. Best is trial 115 with value: 0.8695652173913043.
[32m[I 2023-04-26 12:27:08,320][39m Trial 122 finished with value: 0.8596491228070176 and parameters: {'criterion': 'gini', 'n_estimators': 107, 'max_features': 0.6556764495753722, 'max_depth': 93, 'min_samples_split': 10, 'min_samples_leaf': 1}. Best is trial 115 with value: 0.8695652173913043.
[32m[I 2023-04-26 12:27:08,481][39m Trial 123 finished with value: 0.8421052631578947 and parameters: {'criterion': 'gini', 'n_estimators': 109, 'max_features': 0.6407465166932896, 'max_depth': 93, 'min_samples_split': 10, 'min_samples_leaf': 1}. Best is trial 115 with value: 0.8695652173913043.
[32m[I 2023-04-26 12:27:08,619][39m Trial 124 finished with value: 0.8347826086956522 and parameters: {'criterion': 'gini', 'n_estimators': 90, 'max_features': 0.6111899270902721, 'max_depth': 100, 'min_samples_split': 10, 'min_samples_leaf': 1}. Best is trial 115 with value: 0.8695652173913043.
[32m[I 2023-04-26 12:27:08,894][39m Trial 125 finished with value: 0.831858407079646 and parameters: {'criterion': 'gini', 'n_estimators': 198, 'max_features': 0.6591389945785529, 'max_depth': 88, 'min_samples_split': 8, 'min_samples_leaf': 2}. Best is trial 115 with value: 0.8695652173913043.
[32m[I 2023-04-26 12:27:09,041][39m Trial 126 finished with value: 0.8347826086956522 and parameters: {'criterion': 'gini', 'n_estimators': 101, 'max_features': 0.583504249927334, 'max_depth': 97, 'min_samples_split': 10, 'min_samples_leaf': 4}. Best is trial 115 with value: 0.8695652173913043.
[32m[I 2023-04-26 12:27:09,187][39m Trial 127 finished with value: 0.8376068376068375 and parameters: {'criterion': 'gini', 'n_estimators': 96, 'max_features': 0.6893438324622334, 'max_depth': 89, 'min_samples_split': 10, 'min_samples_leaf': 1}. Best is trial 115 with value: 0.8695652173913043.
[32m[I 2023-04-26 12:27:09,316][39m Trial 128 finished with value: 0.8173913043478261 and parameters: {'criterion': 'gini', 'n_estimators': 84, 'max_features': 0.630267485449995, 'max_depth': 94, 'min_samples_split': 10, 'min_samples_leaf': 2}. Best is trial 115 with value: 0.8695652173913043.
[32m[I 2023-04-26 12:27:09,541][39m Trial 129 finished with value: 0.8571428571428572 and parameters: {'criterion': 'gini', 'n_estimators': 161, 'max_features': 0.6646782773273527, 'max_depth': 91, 'min_samples_split': 10, 'min_samples_leaf': 2}. Best is trial 115 with value: 0.8695652173913043.
[32m[I 2023-04-26 12:27:09,769][39m Trial 130 finished with value: 0.8495575221238938 and parameters: {'criterion': 'gini', 'n_estimators': 163, 'max_features': 0.7114773965384741, 'max_depth': 91, 'min_samples_split': 10, 'min_samples_leaf': 3}. Best is trial 115 with value: 0.8695652173913043.
[32m[I 2023-04-26 12:27:10,003][39m Trial 131 finished with value: 0.8448275862068967 and parameters: {'criterion': 'gini', 'n_estimators': 170, 'max_features': 0.6615652028439779, 'max_depth': 98, 'min_samples_split': 11, 'min_samples_leaf': 4}. Best is trial 115 with value: 0.8695652173913043.
[32m[I 2023-04-26 12:27:10,157][39m Trial 132 finished with value: 0.8495575221238938 and parameters: {'criterion': 'gini', 'n_estimators': 107, 'max_features': 0.5949798477289268, 'max_depth': 101, 'min_samples_split': 9, 'min_samples_leaf': 3}. Best is trial 115 with value: 0.8695652173913043.
[32m[I 2023-04-26 12:27:10,308][39m Trial 133 finished with value: 0.8468468468468469 and parameters: {'criterion': 'gini', 'n_estimators': 104, 'max_features': 0.5630934229040727, 'max_depth': 94, 'min_samples_split': 10, 'min_samples_leaf': 2}. Best is trial 115 with value: 0.8695652173913043.
[32m[I 2023-04-26 12:27:10,515][39m Trial 134 finished with value: 0.847457627118644 and parameters: {'criterion': 'gini', 'n_estimators': 161, 'max_features': 0.5438732215418217, 'max_depth': 85, 'min_samples_split': 9, 'min_samples_leaf': 11}. Best is trial 115 with value: 0.8695652173913043.
[32m[I 2023-04-26 12:27:10,654][39m Trial 135 finished with value: 0.831858407079646 and parameters: {'criterion': 'gini', 'n_estimators': 89, 'max_features': 0.6743600110109808, 'max_depth': 89, 'min_samples_split': 9, 'min_samples_leaf': 1}. Best is trial 115 with value: 0.8695652173913043.
[32m[I 2023-04-26 12:27:10,868][39m Trial 136 finished with value: 0.8596491228070176 and parameters: {'criterion': 'gini', 'n_estimators': 152, 'max_features': 0.6432189911680081, 'max_depth': 86, 'min_samples_split': 10, 'min_samples_leaf': 2}. Best is trial 115 with value: 0.8695652173913043.
[32m[I 2023-04-26 12:27:11,087][39m Trial 137 finished with value: 0.8392857142857144 and parameters: {'criterion': 'gini', 'n_estimators': 153, 'max_features': 0.635935706116147, 'max_depth': 86, 'min_samples_split': 10, 'min_samples_leaf': 2}. Best is trial 115 with value: 0.8695652173913043.
[32m[I 2023-04-26 12:27:11,297][39m Trial 138 finished with value: 0.8245614035087718 and parameters: {'criterion': 'gini', 'n_estimators': 150, 'max_features': 0.5984916874197225, 'max_depth': 91, 'min_samples_split': 10, 'min_samples_leaf': 2}. Best is trial 115 with value: 0.8695652173913043.
[32m[I 2023-04-26 12:27:11,515][39m Trial 139 finished with value: 0.8571428571428572 and parameters: {'criterion': 'gini', 'n_estimators': 157, 'max_features': 0.6606031331773854, 'max_depth': 88, 'min_samples_split': 5, 'min_samples_leaf': 3}. Best is trial 115 with value: 0.8695652173913043.
[32m[I 2023-04-26 12:27:11,738][39m Trial 140 finished with value: 0.8596491228070176 and parameters: {'criterion': 'gini', 'n_estimators': 157, 'max_features': 0.6867971755517391, 'max_depth': 87, 'min_samples_split': 5, 'min_samples_leaf': 3}. Best is trial 115 with value: 0.8695652173913043.
[32m[I 2023-04-26 12:27:11,963][39m Trial 141 finished with value: 0.8495575221238938 and parameters: {'criterion': 'gini', 'n_estimators': 160, 'max_features': 0.6469127562848116, 'max_depth': 86, 'min_samples_split': 5, 'min_samples_leaf': 3}. Best is trial 115 with value: 0.8695652173913043.
[32m[I 2023-04-26 12:27:12,186][39m Trial 142 finished with value: 0.8495575221238938 and parameters: {'criterion': 'gini', 'n_estimators': 156, 'max_features': 0.6880042842747408, 'max_depth': 88, 'min_samples_split': 5, 'min_samples_leaf': 3}. Best is trial 115 with value: 0.8695652173913043.
[32m[I 2023-04-26 12:27:12,394][39m Trial 143 finished with value: 0.8495575221238938 and parameters: {'criterion': 'gini', 'n_estimators': 146, 'max_features': 0.6200622109832479, 'max_depth': 26, 'min_samples_split': 6, 'min_samples_leaf': 3}. Best is trial 115 with value: 0.8695652173913043.
[32m[I 2023-04-26 12:27:12,627][39m Trial 144 finished with value: 0.8448275862068967 and parameters: {'criterion': 'gini', 'n_estimators': 167, 'max_features': 0.671700854429953, 'max_depth': 96, 'min_samples_split': 5, 'min_samples_leaf': 4}. Best is trial 115 with value: 0.8695652173913043.
[32m[I 2023-04-26 12:27:12,853][39m Trial 145 finished with value: 0.8468468468468469 and parameters: {'criterion': 'gini', 'n_estimators': 157, 'max_features': 0.6111090343417906, 'max_depth': 84, 'min_samples_split': 5, 'min_samples_leaf': 2}. Best is trial 115 with value: 0.8695652173913043.
[32m[I 2023-04-26 12:27:13,107][39m Trial 146 finished with value: 0.8596491228070176 and parameters: {'criterion': 'gini', 'n_estimators': 175, 'max_features': 0.7215054677886844, 'max_depth': 92, 'min_samples_split': 4, 'min_samples_leaf': 3}. Best is trial 115 with value: 0.8695652173913043.
