[32m[I 2023-04-26 12:27:13,391][39m Trial 147 finished with value: 0.8495575221238938 and parameters: {'criterion': 'entropy', 'n_estimators': 175, 'max_features': 0.7204149034788205, 'max_depth': 92, 'min_samples_split': 4, 'min_samples_leaf': 3}. Best is trial 115 with value: 0.8695652173913043.
[32m[I 2023-04-26 12:27:13,598][39m Trial 148 finished with value: 0.7419354838709677 and parameters: {'criterion': 'gini', 'n_estimators': 170, 'max_features': 0.7669688143936586, 'max_depth': 1, 'min_samples_split': 6, 'min_samples_leaf': 2}. Best is trial 115 with value: 0.8695652173913043.
[32m[I 2023-04-26 12:27:13,839][39m Trial 149 finished with value: 0.8672566371681416 and parameters: {'criterion': 'gini', 'n_estimators': 163, 'max_features': 0.6808415224727364, 'max_depth': 89, 'min_samples_split': 4, 'min_samples_leaf': 3}. Best is trial 115 with value: 0.8695652173913043.
[32m[I 2023-04-26 12:27:14,086][39m Trial 150 finished with value: 0.8571428571428572 and parameters: {'criterion': 'gini', 'n_estimators': 166, 'max_features': 0.7468713278209764, 'max_depth': 89, 'min_samples_split': 4, 'min_samples_leaf': 3}. Best is trial 115 with value: 0.8695652173913043.
[32m[I 2023-04-26 12:27:14,318][39m Trial 151 finished with value: 0.8468468468468469 and parameters: {'criterion': 'gini', 'n_estimators': 163, 'max_features': 0.6972521070603261, 'max_depth': 91, 'min_samples_split': 4, 'min_samples_leaf': 3}. Best is trial 115 with value: 0.8695652173913043.
[32m[I 2023-04-26 12:27:14,551][39m Trial 152 finished with value: 0.8571428571428572 and parameters: {'criterion': 'gini', 'n_estimators': 167, 'max_features': 0.6869561598980489, 'max_depth': 93, 'min_samples_split': 3, 'min_samples_leaf': 3}. Best is trial 115 with value: 0.8695652173913043.
[32m[I 2023-04-26 12:27:14,788][39m Trial 153 finished with value: 0.8521739130434783 and parameters: {'criterion': 'gini', 'n_estimators': 173, 'max_features': 0.6510811643210207, 'max_depth': 95, 'min_samples_split': 3, 'min_samples_leaf': 4}. Best is trial 115 with value: 0.8695652173913043.
[32m[I 2023-04-26 12:27:15,026][39m Trial 154 finished with value: 0.8173913043478261 and parameters: {'criterion': 'gini', 'n_estimators': 162, 'max_features': 0.6688019758093957, 'max_depth': 87, 'min_samples_split': 4, 'min_samples_leaf': 1}. Best is trial 115 with value: 0.8695652173913043.
[32m[I 2023-04-26 12:27:15,242][39m Trial 155 finished with value: 0.8448275862068967 and parameters: {'criterion': 'gini', 'n_estimators': 151, 'max_features': 0.7690299921686459, 'max_depth': 93, 'min_samples_split': 3, 'min_samples_leaf': 4}. Best is trial 115 with value: 0.8695652173913043.
[32m[I 2023-04-26 12:27:15,496][39m Trial 156 finished with value: 0.8495575221238938 and parameters: {'criterion': 'gini', 'n_estimators': 180, 'max_features': 0.6868846441580881, 'max_depth': 98, 'min_samples_split': 3, 'min_samples_leaf': 2}. Best is trial 115 with value: 0.8695652173913043.
[32m[I 2023-04-26 12:27:15,728][39m Trial 157 finished with value: 0.8596491228070176 and parameters: {'criterion': 'gini', 'n_estimators': 168, 'max_features': 0.629980659566788, 'max_depth': 90, 'min_samples_split': 2, 'min_samples_leaf': 3}. Best is trial 115 with value: 0.8695652173913043.
[32m[I 2023-04-26 12:27:15,960][39m Trial 158 finished with value: 0.8521739130434783 and parameters: {'criterion': 'gini', 'n_estimators': 168, 'max_features': 0.6331296581516079, 'max_depth': 89, 'min_samples_split': 3, 'min_samples_leaf': 3}. Best is trial 115 with value: 0.8695652173913043.
[32m[I 2023-04-26 12:27:16,197][39m Trial 159 finished with value: 0.8571428571428572 and parameters: {'criterion': 'gini', 'n_estimators': 174, 'max_features': 0.609687384217237, 'max_depth': 90, 'min_samples_split': 5, 'min_samples_leaf': 3}. Best is trial 115 with value: 0.8695652173913043.
[32m[I 2023-04-26 12:27:16,423][39m Trial 160 finished with value: 0.8495575221238938 and parameters: {'criterion': 'gini', 'n_estimators': 159, 'max_features': 0.6519606864299076, 'max_depth': 86, 'min_samples_split': 2, 'min_samples_leaf': 2}. Best is trial 115 with value: 0.8695652173913043.
[32m[I 2023-04-26 12:27:16,658][39m Trial 161 finished with value: 0.8571428571428572 and parameters: {'criterion': 'gini', 'n_estimators': 165, 'max_features': 0.7462987694932917, 'max_depth': 95, 'min_samples_split': 4, 'min_samples_leaf': 3}. Best is trial 115 with value: 0.8695652173913043.
[32m[I 2023-04-26 12:27:16,889][39m Trial 162 finished with value: 0.8672566371681416 and parameters: {'criterion': 'gini', 'n_estimators': 164, 'max_features': 0.7156408133546371, 'max_depth': 96, 'min_samples_split': 4, 'min_samples_leaf': 3}. Best is trial 115 with value: 0.8695652173913043.
[32m[I 2023-04-26 12:27:17,110][39m Trial 163 finished with value: 0.8571428571428572 and parameters: {'criterion': 'gini', 'n_estimators': 155, 'max_features': 0.7217154954344068, 'max_depth': 96, 'min_samples_split': 4, 'min_samples_leaf': 3}. Best is trial 115 with value: 0.8695652173913043.
[32m[I 2023-04-26 12:27:17,258][39m Trial 164 finished with value: 0.823529411764706 and parameters: {'criterion': 'gini', 'n_estimators': 93, 'max_features': 0.706563941787209, 'max_depth': 92, 'min_samples_split': 2, 'min_samples_leaf': 4}. Best is trial 115 with value: 0.8695652173913043.
[32m[I 2023-04-26 12:27:17,511][39m Trial 165 finished with value: 0.8495575221238938 and parameters: {'criterion': 'gini', 'n_estimators': 171, 'max_features': 0.7377132643567587, 'max_depth': 96, 'min_samples_split': 4, 'min_samples_leaf': 3}. Best is trial 115 with value: 0.8695652173913043.
[32m[I 2023-04-26 12:27:17,752][39m Trial 166 finished with value: 0.8495575221238938 and parameters: {'criterion': 'gini', 'n_estimators': 164, 'max_features': 0.8032400345700156, 'max_depth': 100, 'min_samples_split': 4, 'min_samples_leaf': 2}. Best is trial 115 with value: 0.8695652173913043.
[32m[I 2023-04-26 12:27:17,999][39m Trial 167 finished with value: 0.8571428571428572 and parameters: {'criterion': 'gini', 'n_estimators': 167, 'max_features': 0.7873687957138313, 'max_depth': 89, 'min_samples_split': 4, 'min_samples_leaf': 3}. Best is trial 115 with value: 0.8695652173913043.
[32m[I 2023-04-26 12:27:18,256][39m Trial 168 finished with value: 0.8448275862068967 and parameters: {'criterion': 'gini', 'n_estimators': 184, 'max_features': 0.574037359149973, 'max_depth': 36, 'min_samples_split': 5, 'min_samples_leaf': 4}. Best is trial 115 with value: 0.8695652173913043.
[32m[I 2023-04-26 12:27:18,490][39m Trial 169 finished with value: 0.8392857142857144 and parameters: {'criterion': 'gini', 'n_estimators': 162, 'max_features': 0.6894314604031464, 'max_depth': 93, 'min_samples_split': 2, 'min_samples_leaf': 2}. Best is trial 115 with value: 0.8695652173913043.
[32m[I 2023-04-26 12:27:18,738][39m Trial 170 finished with value: 0.8421052631578947 and parameters: {'criterion': 'entropy', 'n_estimators': 152, 'max_features': 0.7262137485620854, 'max_depth': 99, 'min_samples_split': 3, 'min_samples_leaf': 3}. Best is trial 115 with value: 0.8695652173913043.
[32m[I 2023-04-26 12:27:18,961][39m Trial 171 finished with value: 0.8596491228070176 and parameters: {'criterion': 'gini', 'n_estimators': 157, 'max_features': 0.6386705109090579, 'max_depth': 83, 'min_samples_split': 3, 'min_samples_leaf': 3}. Best is trial 115 with value: 0.8695652173913043.
[32m[I 2023-04-26 12:27:19,183][39m Trial 172 finished with value: 0.8571428571428572 and parameters: {'criterion': 'gini', 'n_estimators': 158, 'max_features': 0.6207258124773454, 'max_depth': 83, 'min_samples_split': 4, 'min_samples_leaf': 3}. Best is trial 115 with value: 0.8695652173913043.
[32m[I 2023-04-26 12:27:19,409][39m Trial 173 finished with value: 0.8495575221238938 and parameters: {'criterion': 'gini', 'n_estimators': 161, 'max_features': 0.6631197355500957, 'max_depth': 88, 'min_samples_split': 4, 'min_samples_leaf': 3}. Best is trial 115 with value: 0.8695652173913043.
[32m[I 2023-04-26 12:27:19,626][39m Trial 174 finished with value: 0.8392857142857144 and parameters: {'criterion': 'gini', 'n_estimators': 155, 'max_features': 0.6389156214678188, 'max_depth': 90, 'min_samples_split': 2, 'min_samples_leaf': 3}. Best is trial 115 with value: 0.8695652173913043.
[32m[I 2023-04-26 12:27:19,845][39m Trial 175 finished with value: 0.8571428571428572 and parameters: {'criterion': 'gini', 'n_estimators': 159, 'max_features': 0.6059286642930415, 'max_depth': 84, 'min_samples_split': 4, 'min_samples_leaf': 3}. Best is trial 115 with value: 0.8695652173913043.
[32m[I 2023-04-26 12:27:20,088][39m Trial 176 finished with value: 0.8495575221238938 and parameters: {'criterion': 'gini', 'n_estimators': 170, 'max_features': 0.6855094645467809, 'max_depth': 93, 'min_samples_split': 3, 'min_samples_leaf': 2}. Best is trial 115 with value: 0.8695652173913043.
[32m[I 2023-04-26 12:27:20,327][39m Trial 177 finished with value: 0.8547008547008546 and parameters: {'criterion': 'gini', 'n_estimators': 176, 'max_features': 0.5897474429171934, 'max_depth': 95, 'min_samples_split': 10, 'min_samples_leaf': 4}. Best is trial 115 with value: 0.8695652173913043.
[32m[I 2023-04-26 12:27:20,446][39m Trial 178 finished with value: 0.8521739130434783 and parameters: {'criterion': 'gini', 'n_estimators': 77, 'max_features': 0.5573029047433541, 'max_depth': 81, 'min_samples_split': 6, 'min_samples_leaf': 4}. Best is trial 115 with value: 0.8695652173913043.
[32m[I 2023-04-26 12:27:20,642][39m Trial 179 finished with value: 0.831858407079646 and parameters: {'criterion': 'gini', 'n_estimators': 165, 'max_features': 0.15483909015194025, 'max_depth': 85, 'min_samples_split': 4, 'min_samples_leaf': 3}. Best is trial 115 with value: 0.8695652173913043.
[32m[I 2023-04-26 12:27:20,861][39m Trial 180 finished with value: 0.8421052631578947 and parameters: {'criterion': 'gini', 'n_estimators': 154, 'max_features': 0.7158353039137767, 'max_depth': 87, 'min_samples_split': 4, 'min_samples_leaf': 3}. Best is trial 115 with value: 0.8695652173913043.
[32m[I 2023-04-26 12:27:21,106][39m Trial 181 finished with value: 0.8347826086956522 and parameters: {'criterion': 'gini', 'n_estimators': 166, 'max_features': 0.7553669117303228, 'max_depth': 94, 'min_samples_split': 3, 'min_samples_leaf': 1}. Best is trial 115 with value: 0.8695652173913043.
[32m[I 2023-04-26 12:27:21,312][39m Trial 182 finished with value: 0.8468468468468469 and parameters: {'criterion': 'gini', 'n_estimators': 142, 'max_features': 0.7691460137768856, 'max_depth': 89, 'min_samples_split': 4, 'min_samples_leaf': 3}. Best is trial 115 with value: 0.8695652173913043.
[32m[I 2023-04-26 12:27:21,549][39m Trial 183 finished with value: 0.8521739130434783 and parameters: {'criterion': 'gini', 'n_estimators': 174, 'max_features': 0.60381100632977, 'max_depth': 91, 'min_samples_split': 5, 'min_samples_leaf': 4}. Best is trial 115 with value: 0.8695652173913043.
[32m[I 2023-04-26 12:27:21,778][39m Trial 184 finished with value: 0.8596491228070176 and parameters: {'criterion': 'gini', 'n_estimators': 159, 'max_features': 0.6301152999967712, 'max_depth': 83, 'min_samples_split': 10, 'min_samples_leaf': 2}. Best is trial 115 with value: 0.8695652173913043.
[32m[I 2023-04-26 12:27:21,998][39m Trial 185 finished with value: 0.8448275862068967 and parameters: {'criterion': 'gini', 'n_estimators': 157, 'max_features': 0.6344075264431682, 'max_depth': 87, 'min_samples_split': 10, 'min_samples_leaf': 3}. Best is trial 115 with value: 0.8695652173913043.
[32m[I 2023-04-26 12:27:22,208][39m Trial 186 finished with value: 0.8521739130434783 and parameters: {'criterion': 'gini', 'n_estimators': 149, 'max_features': 0.6634827130052255, 'max_depth': 98, 'min_samples_split': 10, 'min_samples_leaf': 3}. Best is trial 115 with value: 0.8695652173913043.
[32m[I 2023-04-26 12:27:22,442][39m Trial 187 finished with value: 0.8448275862068967 and parameters: {'criterion': 'gini', 'n_estimators': 162, 'max_features': 0.648424970352439, 'max_depth': 82, 'min_samples_split': 10, 'min_samples_leaf': 2}. Best is trial 115 with value: 0.8695652173913043.
[32m[I 2023-04-26 12:27:22,679][39m Trial 188 finished with value: 0.8672566371681416 and parameters: {'criterion': 'gini', 'n_estimators': 167, 'max_features': 0.7001145601078913, 'max_depth': 86, 'min_samples_split': 3, 'min_samples_leaf': 3}. Best is trial 115 with value: 0.8695652173913043.
[32m[I 2023-04-26 12:27:22,924][39m Trial 189 finished with value: 0.8495575221238938 and parameters: {'criterion': 'gini', 'n_estimators': 168, 'max_features': 0.7093354588988628, 'max_depth': 78, 'min_samples_split': 3, 'min_samples_leaf': 2}. Best is trial 115 with value: 0.8695652173913043.
[32m[I 2023-04-26 12:27:23,169][39m Trial 190 finished with value: 0.8672566371681416 and parameters: {'criterion': 'gini', 'n_estimators': 171, 'max_features': 0.6962462328467346, 'max_depth': 85, 'min_samples_split': 3, 'min_samples_leaf': 3}. Best is trial 115 with value: 0.8695652173913043.
[32m[I 2023-04-26 12:27:23,393][39m Trial 191 finished with value: 0.8363636363636363 and parameters: {'criterion': 'gini', 'n_estimators': 159, 'max_features': 0.6219607456503451, 'max_depth': 84, 'min_samples_split': 3, 'min_samples_leaf': 3}. Best is trial 115 with value: 0.8695652173913043.
[32m[I 2023-04-26 12:27:23,640][39m Trial 192 finished with value: 0.8571428571428572 and parameters: {'criterion': 'gini', 'n_estimators': 171, 'max_features': 0.6185433007368482, 'max_depth': 83, 'min_samples_split': 2, 'min_samples_leaf': 3}. Best is trial 115 with value: 0.8695652173913043.
[32m[I 2023-04-26 12:27:23,902][39m Trial 193 finished with value: 0.8672566371681416 and parameters: {'criterion': 'gini', 'n_estimators': 180, 'max_features': 0.6922520831431321, 'max_depth': 86, 'min_samples_split': 3, 'min_samples_leaf': 3}. Best is trial 115 with value: 0.8695652173913043.
[32m[I 2023-04-26 12:27:24,161][39m Trial 194 finished with value: 0.8495575221238938 and parameters: {'criterion': 'gini', 'n_estimators': 179, 'max_features': 0.6783373260747796, 'max_depth': 85, 'min_samples_split': 3, 'min_samples_leaf': 3}. Best is trial 115 with value: 0.8695652173913043.
[32m[I 2023-04-26 12:27:24,414][39m Trial 195 finished with value: 0.8448275862068967 and parameters: {'criterion': 'gini', 'n_estimators': 182, 'max_features': 0.6995329958535822, 'max_depth': 81, 'min_samples_split': 3, 'min_samples_leaf': 4}. Best is trial 115 with value: 0.8695652173913043.
[32m[I 2023-04-26 12:27:24,560][39m Trial 196 finished with value: 0.8495575221238938 and parameters: {'criterion': 'gini', 'n_estimators': 98, 'max_features': 0.5776843431113563, 'max_depth': 86, 'min_samples_split': 3, 'min_samples_leaf': 3}. Best is trial 115 with value: 0.8695652173913043.
[32m[I 2023-04-26 12:27:24,802][39m Trial 197 finished with value: 0.8468468468468469 and parameters: {'criterion': 'gini', 'n_estimators': 172, 'max_features': 0.7202194929069364, 'max_depth': 101, 'min_samples_split': 2, 'min_samples_leaf': 3}. Best is trial 115 with value: 0.8695652173913043.
[32m[I 2023-04-26 12:27:25,027][39m Trial 198 finished with value: 0.8672566371681416 and parameters: {'criterion': 'gini', 'n_estimators': 155, 'max_features': 0.7312263598177302, 'max_depth': 97, 'min_samples_split': 3, 'min_samples_leaf': 3}. Best is trial 115 with value: 0.8695652173913043.
[32m[I 2023-04-26 12:27:25,264][39m Trial 199 finished with value: 0.8392857142857144 and parameters: {'criterion': 'gini', 'n_estimators': 163, 'max_features': 0.7013710206152466, 'max_depth': 87, 'min_samples_split': 3, 'min_samples_leaf': 2}. Best is trial 115 with value: 0.8695652173913043.
[32m[I 2023-04-26 12:27:25,527][39m Trial 200 finished with value: 0.8141592920353982 and parameters: {'criterion': 'gini', 'n_estimators': 186, 'max_features': 0.6725376984955325, 'max_depth': 91, 'min_samples_split': 3, 'min_samples_leaf': 1}. Best is trial 115 with value: 0.8695652173913043.
[32m[I 2023-04-26 12:27:25,767][39m Trial 201 finished with value: 0.831858407079646 and parameters: {'criterion': 'gini', 'n_estimators': 167, 'max_features': 0.7339657647712942, 'max_depth': 89, 'min_samples_split': 3, 'min_samples_leaf': 3}. Best is trial 115 with value: 0.8695652173913043.
[32m[I 2023-04-26 12:27:25,987][39m Trial 202 finished with value: 0.8596491228070176 and parameters: {'criterion': 'gini', 'n_estimators': 157, 'max_features': 0.6338867768655173, 'max_depth': 82, 'min_samples_split': 3, 'min_samples_leaf': 3}. Best is trial 115 with value: 0.8695652173913043.
[32m[I 2023-04-26 12:27:26,201][39m Trial 203 finished with value: 0.8495575221238938 and parameters: {'criterion': 'gini', 'n_estimators': 151, 'max_features': 0.6449958856435738, 'max_depth': 79, 'min_samples_split': 3, 'min_samples_leaf': 3}. Best is trial 115 with value: 0.8695652173913043.
[32m[I 2023-04-26 12:27:26,408][39m Trial 204 finished with value: 0.8468468468468469 and parameters: {'criterion': 'gini', 'n_estimators': 146, 'max_features': 0.6432293299308252, 'max_depth': 83, 'min_samples_split': 3, 'min_samples_leaf': 3}. Best is trial 115 with value: 0.8695652173913043.
[32m[I 2023-04-26 12:27:26,663][39m Trial 205 finished with value: 0.8596491228070176 and parameters: {'criterion': 'gini', 'n_estimators': 179, 'max_features': 0.6754911319630871, 'max_depth': 97, 'min_samples_split': 3, 'min_samples_leaf': 3}. Best is trial 115 with value: 0.8695652173913043.
[32m[I 2023-04-26 12:27:26,916][39m Trial 206 finished with value: 0.8495575221238938 and parameters: {'criterion': 'gini', 'n_estimators': 181, 'max_features': 0.679773761618461, 'max_depth': 96, 'min_samples_split': 3, 'min_samples_leaf': 3}. Best is trial 115 with value: 0.8695652173913043.
[32m[I 2023-04-26 12:27:27,204][39m Trial 207 finished with value: 0.8495575221238938 and parameters: {'criterion': 'entropy', 'n_estimators': 178, 'max_features': 0.6959921841354724, 'max_depth': 99, 'min_samples_split': 3, 'min_samples_leaf': 3}. Best is trial 115 with value: 0.8695652173913043.
[32m[I 2023-04-26 12:27:27,445][39m Trial 208 finished with value: 0.8392857142857144 and parameters: {'criterion': 'gini', 'n_estimators': 169, 'max_features': 0.6621493197056584, 'max_depth': 98, 'min_samples_split': 2, 'min_samples_leaf': 2}. Best is trial 115 with value: 0.8695652173913043.
[32m[I 2023-04-26 12:27:27,691][39m Trial 209 finished with value: 0.8547008547008546 and parameters: {'criterion': 'gini', 'n_estimators': 177, 'max_features': 0.705444995845564, 'max_depth': 94, 'min_samples_split': 10, 'min_samples_leaf': 4}. Best is trial 115 with value: 0.8695652173913043.
[32m[I 2023-04-26 12:27:27,907][39m Trial 210 finished with value: 0.8448275862068967 and parameters: {'criterion': 'gini', 'n_estimators': 154, 'max_features': 0.633101155328845, 'max_depth': 85, 'min_samples_split': 10, 'min_samples_leaf': 3}. Best is trial 115 with value: 0.8695652173913043.
[32m[I 2023-04-26 12:27:28,131][39m Trial 211 finished with value: 0.8596491228070176 and parameters: {'criterion': 'gini', 'n_estimators': 160, 'max_features': 0.6592462469569573, 'max_depth': 81, 'min_samples_split': 3, 'min_samples_leaf': 3}. Best is trial 115 with value: 0.8695652173913043.
[32m[I 2023-04-26 12:27:28,359][39m Trial 212 finished with value: 0.8596491228070176 and parameters: {'criterion': 'gini', 'n_estimators': 160, 'max_features': 0.684273583781674, 'max_depth': 80, 'min_samples_split': 3, 'min_samples_leaf': 3}. Best is trial 115 with value: 0.8695652173913043.
[32m[I 2023-04-26 12:27:28,606][39m Trial 213 finished with value: 0.8571428571428572 and parameters: {'criterion': 'gini', 'n_estimators': 175, 'max_features': 0.682133050424233, 'max_depth': 80, 'min_samples_split': 3, 'min_samples_leaf': 3}. Best is trial 115 with value: 0.8695652173913043.
[32m[I 2023-04-26 12:27:28,841][39m Trial 214 finished with value: 0.8571428571428572 and parameters: {'criterion': 'gini', 'n_estimators': 163, 'max_features': 0.732320734664114, 'max_depth': 97, 'min_samples_split': 3, 'min_samples_leaf': 3}. Best is trial 115 with value: 0.8695652173913043.
[32m[I 2023-04-26 12:27:29,095][39m Trial 215 finished with value: 0.8173913043478261 and parameters: {'criterion': 'gini', 'n_estimators': 173, 'max_features': 0.6981964161641537, 'max_depth': 92, 'min_samples_split': 10, 'min_samples_leaf': 2}. Best is trial 115 with value: 0.8695652173913043.
[32m[I 2023-04-26 12:27:29,369][39m Trial 216 finished with value: 0.8596491228070176 and parameters: {'criterion': 'gini', 'n_estimators': 188, 'max_features': 0.6678839731690962, 'max_depth': 81, 'min_samples_split': 3, 'min_samples_leaf': 3}. Best is trial 115 with value: 0.8695652173913043.
[32m[I 2023-04-26 12:27:29,592][39m Trial 217 finished with value: 0.8392857142857144 and parameters: {'criterion': 'gini', 'n_estimators': 156, 'max_features': 0.6262528886129652, 'max_depth': 78, 'min_samples_split': 2, 'min_samples_leaf': 2}. Best is trial 115 with value: 0.8695652173913043.
[32m[I 2023-04-26 12:27:29,852][39m Trial 218 finished with value: 0.8392857142857144 and parameters: {'criterion': 'gini', 'n_estimators': 188, 'max_features': 0.6603609502504166, 'max_depth': 81, 'min_samples_split': 3, 'min_samples_leaf': 3}. Best is trial 115 with value: 0.8695652173913043.
[32m[I 2023-04-26 12:27:30,122][39m Trial 219 finished with value: 0.8376068376068375 and parameters: {'criterion': 'gini', 'n_estimators': 195, 'max_features': 0.672792646013897, 'max_depth': 76, 'min_samples_split': 3, 'min_samples_leaf': 4}. Best is trial 115 with value: 0.8695652173913043.
