[32m[I 2023-04-26 12:26:48,720][39m A new study created in memory with name: no-name-82a8edf1-23ba-41a3-affc-54c534b7ad78
[32m[I 2023-04-26 12:26:48,832][39m Trial 0 finished with value: 0.8448275862068967 and parameters: {'criterion': 'gini', 'n_estimators': 116, 'max_features': 0.3917588693947244, 'max_depth': 48, 'min_samples_split': 9, 'min_samples_leaf': 8}. Best is trial 0 with value: 0.8448275862068967.
[32m[I 2023-04-26 12:26:48,988][39m Trial 1 finished with value: 0.8214285714285715 and parameters: {'criterion': 'entropy', 'n_estimators': 183, 'max_features': 0.3244767611076691, 'max_depth': 25, 'min_samples_split': 10, 'min_samples_leaf': 2}. Best is trial 0 with value: 0.8448275862068967.
[32m[I 2023-04-26 12:26:49,069][39m Trial 2 finished with value: 0.8214285714285715 and parameters: {'criterion': 'entropy', 'n_estimators': 73, 'max_features': 0.7630513340251072, 'max_depth': 39, 'min_samples_split': 6, 'min_samples_leaf': 2}. Best is trial 0 with value: 0.8448275862068967.
[32m[I 2023-04-26 12:26:49,165][39m Trial 3 finished with value: 0.8363636363636363 and parameters: {'criterion': 'entropy', 'n_estimators': 136, 'max_features': 0.07251446642620096, 'max_depth': 28, 'min_samples_split': 9, 'min_samples_leaf': 3}. Best is trial 0 with value: 0.8448275862068967.
[32m[I 2023-04-26 12:26:49,218][39m Trial 4 finished with value: 0.831858407079646 and parameters: {'criterion': 'gini', 'n_estimators': 74, 'max_features': 0.028915314588521368, 'max_depth': 6, 'min_samples_split': 4, 'min_samples_leaf': 2}. Best is trial 0 with value: 0.8448275862068967.
[32m[I 2023-04-26 12:26:49,289][39m Trial 5 finished with value: 0.8264462809917354 and parameters: {'criterion': 'gini', 'n_estimators': 87, 'max_features': 0.47131525485444825, 'max_depth': 39, 'min_samples_split': 9, 'min_samples_leaf': 11}. Best is trial 0 with value: 0.8448275862068967.
[32m[I 2023-04-26 12:26:49,394][39m Trial 6 finished with value: 0.8347826086956522 and parameters: {'criterion': 'gini', 'n_estimators': 133, 'max_features': 0.3414704887247031, 'max_depth': 94, 'min_samples_split': 10, 'min_samples_leaf': 5}. Best is trial 0 with value: 0.8448275862068967.
[32m[I 2023-04-26 12:26:49,544][39m Trial 7 finished with value: 0.8333333333333334 and parameters: {'criterion': 'entropy', 'n_estimators': 167, 'max_features': 0.632817369295861, 'max_depth': 48, 'min_samples_split': 5, 'min_samples_leaf': 9}. Best is trial 0 with value: 0.8448275862068967.
[32m[I 2023-04-26 12:26:49,705][39m Trial 8 finished with value: 0.8099173553719008 and parameters: {'criterion': 'gini', 'n_estimators': 196, 'max_features': 0.882166811401475, 'max_depth': 3, 'min_samples_split': 2, 'min_samples_leaf': 10}. Best is trial 0 with value: 0.8448275862068967.
[32m[I 2023-04-26 12:26:49,765][39m Trial 9 finished with value: 0.831858407079646 and parameters: {'criterion': 'entropy', 'n_estimators': 77, 'max_features': 0.20425418811350393, 'max_depth': 65, 'min_samples_split': 11, 'min_samples_leaf': 8}. Best is trial 0 with value: 0.8448275862068967.
[32m[I 2023-04-26 12:26:49,874][39m Trial 10 finished with value: 0.8305084745762712 and parameters: {'criterion': 'gini', 'n_estimators': 108, 'max_features': 0.564311276563725, 'max_depth': 72, 'min_samples_split': 7, 'min_samples_leaf': 7}. Best is trial 0 with value: 0.8448275862068967.
[32m[I 2023-04-26 12:26:49,977][39m Trial 11 finished with value: 0.8288288288288289 and parameters: {'criterion': 'entropy', 'n_estimators': 135, 'max_features': 6.15237715335254e-05, 'max_depth': 23, 'min_samples_split': 8, 'min_samples_leaf': 5}. Best is trial 0 with value: 0.8448275862068967.
[32m[I 2023-04-26 12:26:50,114][39m Trial 12 finished with value: 0.8392857142857144 and parameters: {'criterion': 'gini', 'n_estimators': 154, 'max_features': 0.2135451051859919, 'max_depth': 61, 'min_samples_split': 8, 'min_samples_leaf': 4}. Best is trial 0 with value: 0.8448275862068967.
[32m[I 2023-04-26 12:26:50,329][39m Trial 13 finished with value: 0.831858407079646 and parameters: {'criterion': 'gini', 'n_estimators': 155, 'max_features': 0.2726795856251064, 'max_depth': 67, 'min_samples_split': 7, 'min_samples_leaf': 5}. Best is trial 0 with value: 0.8448275862068967.
[32m[I 2023-04-26 12:26:50,487][39m Trial 14 finished with value: 0.8347826086956522 and parameters: {'criterion': 'gini', 'n_estimators': 105, 'max_features': 0.4151808334865399, 'max_depth': 87, 'min_samples_split': 8, 'min_samples_leaf': 7}. Best is trial 0 with value: 0.8448275862068967.
[32m[I 2023-04-26 12:26:50,577][39m Trial 15 finished with value: 0.8288288288288289 and parameters: {'criterion': 'gini', 'n_estimators': 53, 'max_features': 0.19810387910516666, 'max_depth': 53, 'min_samples_split': 11, 'min_samples_leaf': 4}. Best is trial 0 with value: 0.8448275862068967.
[32m[I 2023-04-26 12:26:50,822][39m Trial 16 finished with value: 0.8547008547008546 and parameters: {'criterion': 'gini', 'n_estimators': 165, 'max_features': 0.6708307836795593, 'max_depth': 80, 'min_samples_split': 8, 'min_samples_leaf': 7}. Best is trial 16 with value: 0.8547008547008546.
[32m[I 2023-04-26 12:26:50,975][39m Trial 17 finished with value: 0.8333333333333334 and parameters: {'criterion': 'gini', 'n_estimators': 109, 'max_features': 0.7037461762638874, 'max_depth': 83, 'min_samples_split': 6, 'min_samples_leaf': 8}. Best is trial 16 with value: 0.8547008547008546.
[32m[I 2023-04-26 12:26:51,213][39m Trial 18 finished with value: 0.823529411764706 and parameters: {'criterion': 'gini', 'n_estimators': 168, 'max_features': 0.9713629903904991, 'max_depth': 99, 'min_samples_split': 4, 'min_samples_leaf': 7}. Best is trial 16 with value: 0.8547008547008546.
[32m[I 2023-04-26 12:26:51,382][39m Trial 19 finished with value: 0.8547008547008546 and parameters: {'criterion': 'gini', 'n_estimators': 121, 'max_features': 0.7608941803592219, 'max_depth': 76, 'min_samples_split': 9, 'min_samples_leaf': 9}. Best is trial 16 with value: 0.8547008547008546.
[32m[I 2023-04-26 12:26:51,587][39m Trial 20 finished with value: 0.8403361344537814 and parameters: {'criterion': 'gini', 'n_estimators': 149, 'max_features': 0.7856053142953447, 'max_depth': 78, 'min_samples_split': 10, 'min_samples_leaf': 11}. Best is trial 16 with value: 0.8547008547008546.
[32m[I 2023-04-26 12:26:51,749][39m Trial 21 finished with value: 0.8547008547008546 and parameters: {'criterion': 'gini', 'n_estimators': 121, 'max_features': 0.5754952834364612, 'max_depth': 54, 'min_samples_split': 9, 'min_samples_leaf': 9}. Best is trial 16 with value: 0.8547008547008546.
[32m[I 2023-04-26 12:26:51,912][39m Trial 22 finished with value: 0.847457627118644 and parameters: {'criterion': 'gini', 'n_estimators': 121, 'max_features': 0.6024606640530673, 'max_depth': 74, 'min_samples_split': 8, 'min_samples_leaf': 9}. Best is trial 16 with value: 0.8547008547008546.
[32m[I 2023-04-26 12:26:52,044][39m Trial 23 finished with value: 0.8264462809917354 and parameters: {'criterion': 'gini', 'n_estimators': 94, 'max_features': 0.6819289308037917, 'max_depth': 60, 'min_samples_split': 9, 'min_samples_leaf': 10}. Best is trial 16 with value: 0.8547008547008546.
[32m[I 2023-04-26 12:26:52,234][39m Trial 24 finished with value: 0.8403361344537814 and parameters: {'criterion': 'gini', 'n_estimators': 147, 'max_features': 0.5287673023133503, 'max_depth': 90, 'min_samples_split': 7, 'min_samples_leaf': 9}. Best is trial 16 with value: 0.8547008547008546.
[32m[I 2023-04-26 12:26:52,477][39m Trial 25 finished with value: 0.823529411764706 and parameters: {'criterion': 'gini', 'n_estimators': 173, 'max_features': 0.8557722048433856, 'max_depth': 84, 'min_samples_split': 10, 'min_samples_leaf': 6}. Best is trial 16 with value: 0.8547008547008546.
[32m[I 2023-04-26 12:26:52,652][39m Trial 26 finished with value: 0.8166666666666667 and parameters: {'criterion': 'gini', 'n_estimators': 128, 'max_features': 0.7587593935470902, 'max_depth': 101, 'min_samples_split': 11, 'min_samples_leaf': 10}. Best is trial 16 with value: 0.8547008547008546.
[32m[I 2023-04-26 12:26:52,902][39m Trial 27 finished with value: 0.8547008547008546 and parameters: {'criterion': 'gini', 'n_estimators': 199, 'max_features': 0.48188969259764397, 'max_depth': 78, 'min_samples_split': 8, 'min_samples_leaf': 6}. Best is trial 16 with value: 0.8547008547008546.
[32m[I 2023-04-26 12:26:53,152][39m Trial 28 finished with value: 0.8347826086956522 and parameters: {'criterion': 'gini', 'n_estimators': 198, 'max_features': 0.49065786900085423, 'max_depth': 56, 'min_samples_split': 9, 'min_samples_leaf': 6}. Best is trial 16 with value: 0.8547008547008546.
[32m[I 2023-04-26 12:26:53,324][39m Trial 29 finished with value: 0.8333333333333334 and parameters: {'criterion': 'gini', 'n_estimators': 118, 'max_features': 0.8584949213338811, 'max_depth': 39, 'min_samples_split': 6, 'min_samples_leaf': 8}. Best is trial 16 with value: 0.8547008547008546.
[32m[I 2023-04-26 12:26:53,455][39m Trial 30 finished with value: 0.864406779661017 and parameters: {'criterion': 'gini', 'n_estimators': 96, 'max_features': 0.4334276425799457, 'max_depth': 73, 'min_samples_split': 9, 'min_samples_leaf': 6}. Best is trial 30 with value: 0.864406779661017.
[32m[I 2023-04-26 12:26:53,587][39m Trial 31 finished with value: 0.8421052631578947 and parameters: {'criterion': 'gini', 'n_estimators': 98, 'max_features': 0.3878099975489841, 'max_depth': 71, 'min_samples_split': 9, 'min_samples_leaf': 6}. Best is trial 30 with value: 0.864406779661017.
[32m[I 2023-04-26 12:26:53,739][39m Trial 32 finished with value: 0.8347826086956522 and parameters: {'criterion': 'gini', 'n_estimators': 114, 'max_features': 0.43383804796166303, 'max_depth': 76, 'min_samples_split': 10, 'min_samples_leaf': 4}. Best is trial 30 with value: 0.864406779661017.
[32m[I 2023-04-26 12:26:53,985][39m Trial 33 finished with value: 0.8333333333333334 and parameters: {'criterion': 'gini', 'n_estimators': 185, 'max_features': 0.5782843665558675, 'max_depth': 81, 'min_samples_split': 8, 'min_samples_leaf': 7}. Best is trial 30 with value: 0.864406779661017.
[32m[I 2023-04-26 12:26:54,244][39m Trial 34 finished with value: 0.8333333333333334 and parameters: {'criterion': 'entropy', 'n_estimators': 182, 'max_features': 0.6342296625623159, 'max_depth': 66, 'min_samples_split': 7, 'min_samples_leaf': 8}. Best is trial 30 with value: 0.864406779661017.
[32m[I 2023-04-26 12:26:54,361][39m Trial 35 finished with value: 0.8245614035087718 and parameters: {'criterion': 'gini', 'n_estimators': 83, 'max_features': 0.34347137805881334, 'max_depth': 93, 'min_samples_split': 9, 'min_samples_leaf': 1}. Best is trial 30 with value: 0.864406779661017.
[32m[I 2023-04-26 12:26:54,503][39m Trial 36 finished with value: 0.8305084745762712 and parameters: {'criterion': 'entropy', 'n_estimators': 97, 'max_features': 0.5050748754077258, 'max_depth': 45, 'min_samples_split': 10, 'min_samples_leaf': 9}. Best is trial 30 with value: 0.864406779661017.
[32m[I 2023-04-26 12:26:54,599][39m Trial 37 finished with value: 0.8571428571428572 and parameters: {'criterion': 'gini', 'n_estimators': 63, 'max_features': 0.45434169809827313, 'max_depth': 59, 'min_samples_split': 9, 'min_samples_leaf': 6}. Best is trial 30 with value: 0.864406779661017.
[32m[I 2023-04-26 12:26:54,693][39m Trial 38 finished with value: 0.8521739130434783 and parameters: {'criterion': 'gini', 'n_estimators': 62, 'max_features': 0.4507595490245363, 'max_depth': 31, 'min_samples_split': 10, 'min_samples_leaf': 5}. Best is trial 30 with value: 0.864406779661017.
[32m[I 2023-04-26 12:26:54,791][39m Trial 39 finished with value: 0.831858407079646 and parameters: {'criterion': 'entropy', 'n_estimators': 68, 'max_features': 0.277203376330847, 'max_depth': 71, 'min_samples_split': 8, 'min_samples_leaf': 6}. Best is trial 30 with value: 0.864406779661017.
[32m[I 2023-04-26 12:26:54,870][39m Trial 40 finished with value: 0.8214285714285715 and parameters: {'criterion': 'gini', 'n_estimators': 54, 'max_features': 0.1144167598771561, 'max_depth': 61, 'min_samples_split': 2, 'min_samples_leaf': 3}. Best is trial 30 with value: 0.864406779661017.
[32m[I 2023-04-26 12:26:55,037][39m Trial 41 finished with value: 0.8245614035087718 and parameters: {'criterion': 'gini', 'n_estimators': 125, 'max_features': 0.5366098618073614, 'max_depth': 55, 'min_samples_split': 9, 'min_samples_leaf': 6}. Best is trial 30 with value: 0.864406779661017.
[32m[I 2023-04-26 12:26:55,217][39m Trial 42 finished with value: 0.8347826086956522 and parameters: {'criterion': 'gini', 'n_estimators': 140, 'max_features': 0.3794542234229112, 'max_depth': 46, 'min_samples_split': 9, 'min_samples_leaf': 5}. Best is trial 30 with value: 0.864406779661017.
[32m[I 2023-04-26 12:26:55,343][39m Trial 43 finished with value: 0.8521739130434783 and parameters: {'criterion': 'gini', 'n_estimators': 91, 'max_features': 0.48295524901576214, 'max_depth': 66, 'min_samples_split': 10, 'min_samples_leaf': 8}. Best is trial 30 with value: 0.864406779661017.
[32m[I 2023-04-26 12:26:55,464][39m Trial 44 finished with value: 0.8264462809917354 and parameters: {'criterion': 'gini', 'n_estimators': 81, 'max_features': 0.7359138092400117, 'max_depth': 51, 'min_samples_split': 9, 'min_samples_leaf': 10}. Best is trial 30 with value: 0.864406779661017.
[32m[I 2023-04-26 12:26:55,561][39m Trial 45 finished with value: 0.8376068376068375 and parameters: {'criterion': 'gini', 'n_estimators': 70, 'max_features': 0.30514463606064246, 'max_depth': 60, 'min_samples_split': 7, 'min_samples_leaf': 11}. Best is trial 30 with value: 0.864406779661017.
[32m[I 2023-04-26 12:26:55,717][39m Trial 46 finished with value: 0.847457627118644 and parameters: {'criterion': 'entropy', 'n_estimators': 104, 'max_features': 0.6007872344183462, 'max_depth': 18, 'min_samples_split': 8, 'min_samples_leaf': 7}. Best is trial 30 with value: 0.864406779661017.
[32m[I 2023-04-26 12:26:55,891][39m Trial 47 finished with value: 0.8421052631578947 and parameters: {'criterion': 'gini', 'n_estimators': 130, 'max_features': 0.34986650251950796, 'max_depth': 69, 'min_samples_split': 11, 'min_samples_leaf': 6}. Best is trial 30 with value: 0.864406779661017.
[32m[I 2023-04-26 12:26:56,078][39m Trial 48 finished with value: 0.8421052631578947 and parameters: {'criterion': 'gini', 'n_estimators': 140, 'max_features': 0.5435620042979803, 'max_depth': 86, 'min_samples_split': 9, 'min_samples_leaf': 4}. Best is trial 30 with value: 0.864406779661017.
[32m[I 2023-04-26 12:26:56,229][39m Trial 49 finished with value: 0.8547008547008546 and parameters: {'criterion': 'gini', 'n_estimators': 115, 'max_features': 0.430260018577162, 'max_depth': 75, 'min_samples_split': 9, 'min_samples_leaf': 5}. Best is trial 30 with value: 0.864406779661017.
[32m[I 2023-04-26 12:26:56,380][39m Trial 50 finished with value: 0.8421052631578947 and parameters: {'criterion': 'gini', 'n_estimators': 112, 'max_features': 0.4417848824860221, 'max_depth': 42, 'min_samples_split': 3, 'min_samples_leaf': 3}. Best is trial 30 with value: 0.864406779661017.
[32m[I 2023-04-26 12:26:56,545][39m Trial 51 finished with value: 0.8620689655172413 and parameters: {'criterion': 'gini', 'n_estimators': 122, 'max_features': 0.4680444918012226, 'max_depth': 76, 'min_samples_split': 10, 'min_samples_leaf': 5}. Best is trial 30 with value: 0.864406779661017.
[32m[I 2023-04-26 12:26:56,689][39m Trial 52 finished with value: 0.8547008547008546 and parameters: {'criterion': 'gini', 'n_estimators': 102, 'max_features': 0.3983527652352548, 'max_depth': 63, 'min_samples_split': 10, 'min_samples_leaf': 5}. Best is trial 30 with value: 0.864406779661017.
[32m[I 2023-04-26 12:26:56,829][39m Trial 53 finished with value: 0.8347826086956522 and parameters: {'criterion': 'gini', 'n_estimators': 103, 'max_features': 0.4053121253633835, 'max_depth': 78, 'min_samples_split': 11, 'min_samples_leaf': 5}. Best is trial 30 with value: 0.864406779661017.
[32m[I 2023-04-26 12:26:56,957][39m Trial 54 finished with value: 0.8448275862068967 and parameters: {'criterion': 'gini', 'n_estimators': 90, 'max_features': 0.4595392565576409, 'max_depth': 63, 'min_samples_split': 10, 'min_samples_leaf': 4}. Best is trial 30 with value: 0.864406779661017.
[32m[I 2023-04-26 12:26:57,091][39m Trial 55 finished with value: 0.8547008547008546 and parameters: {'criterion': 'gini', 'n_estimators': 100, 'max_features': 0.3839469658159508, 'max_depth': 71, 'min_samples_split': 11, 'min_samples_leaf': 5}. Best is trial 30 with value: 0.864406779661017.
[32m[I 2023-04-26 12:26:57,207][39m Trial 56 finished with value: 0.8108108108108107 and parameters: {'criterion': 'gini', 'n_estimators': 86, 'max_features': 0.2280988681582229, 'max_depth': 74, 'min_samples_split': 10, 'min_samples_leaf': 5}. Best is trial 30 with value: 0.864406779661017.
[32m[I 2023-04-26 12:26:57,390][39m Trial 57 finished with value: 0.8264462809917354 and parameters: {'criterion': 'entropy', 'n_estimators': 122, 'max_features': 0.6202617189196684, 'max_depth': 57, 'min_samples_split': 8, 'min_samples_leaf': 7}. Best is trial 30 with value: 0.864406779661017.
[32m[I 2023-04-26 12:26:57,501][39m Trial 58 finished with value: 0.8347826086956522 and parameters: {'criterion': 'gini', 'n_estimators': 75, 'max_features': 0.5186542928888884, 'max_depth': 90, 'min_samples_split': 11, 'min_samples_leaf': 6}. Best is trial 30 with value: 0.864406779661017.
[32m[I 2023-04-26 12:26:57,687][39m Trial 59 finished with value: 0.8333333333333334 and parameters: {'criterion': 'gini', 'n_estimators': 135, 'max_features': 0.5744711338854671, 'max_depth': 49, 'min_samples_split': 11, 'min_samples_leaf': 4}. Best is trial 30 with value: 0.864406779661017.
[32m[I 2023-04-26 12:26:57,936][39m Trial 60 finished with value: 0.8448275862068967 and parameters: {'criterion': 'gini', 'n_estimators': 187, 'max_features': 0.6652643978424843, 'max_depth': 81, 'min_samples_split': 6, 'min_samples_leaf': 7}. Best is trial 30 with value: 0.864406779661017.
[32m[I 2023-04-26 12:26:58,085][39m Trial 61 finished with value: 0.8448275862068967 and parameters: {'criterion': 'gini', 'n_estimators': 108, 'max_features': 0.36627580750030947, 'max_depth': 68, 'min_samples_split': 10, 'min_samples_leaf': 5}. Best is trial 30 with value: 0.864406779661017.
[32m[I 2023-04-26 12:26:58,223][39m Trial 62 finished with value: 0.831858407079646 and parameters: {'criterion': 'gini', 'n_estimators': 101, 'max_features': 0.312360717400594, 'max_depth': 64, 'min_samples_split': 10, 'min_samples_leaf': 5}. Best is trial 30 with value: 0.864406779661017.
[32m[I 2023-04-26 12:26:58,323][39m Trial 63 finished with value: 0.8547008547008546 and parameters: {'criterion': 'gini', 'n_estimators': 64, 'max_features': 0.47987903817410094, 'max_depth': 58, 'min_samples_split': 11, 'min_samples_leaf': 6}. Best is trial 30 with value: 0.864406779661017.
[32m[I 2023-04-26 12:26:58,419][39m Trial 64 finished with value: 0.8214285714285715 and parameters: {'criterion': 'gini', 'n_estimators': 62, 'max_features': 0.4920782081783612, 'max_depth': 79, 'min_samples_split': 8, 'min_samples_leaf': 6}. Best is trial 30 with value: 0.864406779661017.
[32m[I 2023-04-26 12:26:58,512][39m Trial 65 finished with value: 0.847457627118644 and parameters: {'criterion': 'gini', 'n_estimators': 58, 'max_features': 0.5556433581468132, 'max_depth': 58, 'min_samples_split': 11, 'min_samples_leaf': 6}. Best is trial 30 with value: 0.864406779661017.
[32m[I 2023-04-26 12:26:58,597][39m Trial 66 finished with value: 0.8333333333333334 and parameters: {'criterion': 'gini', 'n_estimators': 50, 'max_features': 0.7981317180325597, 'max_depth': 72, 'min_samples_split': 11, 'min_samples_leaf': 7}. Best is trial 30 with value: 0.864406779661017.
[32m[I 2023-04-26 12:26:58,709][39m Trial 67 finished with value: 0.8376068376068375 and parameters: {'criterion': 'gini', 'n_estimators': 79, 'max_features': 0.4197899510345512, 'max_depth': 53, 'min_samples_split': 11, 'min_samples_leaf': 6}. Best is trial 30 with value: 0.864406779661017.
[32m[I 2023-04-26 12:26:58,809][39m Trial 68 finished with value: 0.8245614035087718 and parameters: {'criterion': 'gini', 'n_estimators': 66, 'max_features': 0.47165500561618384, 'max_depth': 35, 'min_samples_split': 9, 'min_samples_leaf': 4}. Best is trial 30 with value: 0.864406779661017.
[32m[I 2023-04-26 12:26:58,987][39m Trial 69 finished with value: 0.8333333333333334 and parameters: {'criterion': 'gini', 'n_estimators': 114, 'max_features': 0.9547702605337904, 'max_depth': 76, 'min_samples_split': 9, 'min_samples_leaf': 7}. Best is trial 30 with value: 0.864406779661017.
[32m[I 2023-04-26 12:26:59,206][39m Trial 70 finished with value: 0.8521739130434783 and parameters: {'criterion': 'entropy', 'n_estimators': 148, 'max_features': 0.4281471159849069, 'max_depth': 85, 'min_samples_split': 9, 'min_samples_leaf': 3}. Best is trial 30 with value: 0.864406779661017.
[32m[I 2023-04-26 12:26:59,378][39m Trial 71 finished with value: 0.8547008547008546 and parameters: {'criterion': 'gini', 'n_estimators': 119, 'max_features': 0.7118422952875625, 'max_depth': 82, 'min_samples_split': 8, 'min_samples_leaf': 9}. Best is trial 30 with value: 0.864406779661017.
[32m[I 2023-04-26 12:26:59,604][39m Trial 72 finished with value: 0.8264462809917354 and parameters: {'criterion': 'gini', 'n_estimators': 165, 'max_features': 0.8148000647064018, 'max_depth': 90, 'min_samples_split': 8, 'min_samples_leaf': 9}. Best is trial 30 with value: 0.864406779661017.
