[32m[I 2023-04-26 00:19:02,122][39m Trial 365 finished with value: 0.851851851851852 and parameters: {'criterion': 'entropy', 'n_estimators': 112, 'max_features': 0.20086393848104073, 'max_depth': 6, 'min_samples_split': 8, 'min_samples_leaf': 1}. Best is trial 303 with value: 0.8947368421052632.
[32m[I 2023-04-26 00:19:02,206][39m Trial 366 finished with value: 0.8363636363636363 and parameters: {'criterion': 'entropy', 'n_estimators': 110, 'max_features': 0.11205051235105284, 'max_depth': 50, 'min_samples_split': 8, 'min_samples_leaf': 5}. Best is trial 303 with value: 0.8947368421052632.
[32m[I 2023-04-26 00:19:02,298][39m Trial 367 finished with value: 0.8571428571428572 and parameters: {'criterion': 'entropy', 'n_estimators': 113, 'max_features': 0.13114488034382038, 'max_depth': 11, 'min_samples_split': 8, 'min_samples_leaf': 2}. Best is trial 303 with value: 0.8947368421052632.
[32m[I 2023-04-26 00:19:02,388][39m Trial 368 finished with value: 0.8672566371681416 and parameters: {'criterion': 'entropy', 'n_estimators': 108, 'max_features': 0.054532951075062425, 'max_depth': 16, 'min_samples_split': 9, 'min_samples_leaf': 1}. Best is trial 303 with value: 0.8947368421052632.
[32m[I 2023-04-26 00:19:02,465][39m Trial 369 finished with value: 0.8495575221238938 and parameters: {'criterion': 'entropy', 'n_estimators': 85, 'max_features': 0.23305034360609542, 'max_depth': 26, 'min_samples_split': 8, 'min_samples_leaf': 1}. Best is trial 303 with value: 0.8947368421052632.
[32m[I 2023-04-26 00:19:02,548][39m Trial 370 finished with value: 0.8771929824561403 and parameters: {'criterion': 'entropy', 'n_estimators': 97, 'max_features': 0.13726636522405658, 'max_depth': 47, 'min_samples_split': 9, 'min_samples_leaf': 1}. Best is trial 303 with value: 0.8947368421052632.
[32m[I 2023-04-26 00:19:02,648][39m Trial 371 finished with value: 0.875 and parameters: {'criterion': 'entropy', 'n_estimators': 115, 'max_features': 0.20177579072843518, 'max_depth': 24, 'min_samples_split': 8, 'min_samples_leaf': 1}. Best is trial 303 with value: 0.8947368421052632.
[32m[I 2023-04-26 00:19:02,735][39m Trial 372 finished with value: 0.8468468468468469 and parameters: {'criterion': 'entropy', 'n_estimators': 102, 'max_features': 0.18271983954900217, 'max_depth': 46, 'min_samples_split': 8, 'min_samples_leaf': 1}. Best is trial 303 with value: 0.8947368421052632.
[32m[I 2023-04-26 00:19:02,836][39m Trial 373 finished with value: 0.8849557522123893 and parameters: {'criterion': 'gini', 'n_estimators': 128, 'max_features': 0.1643858699159067, 'max_depth': 27, 'min_samples_split': 8, 'min_samples_leaf': 2}. Best is trial 303 with value: 0.8947368421052632.
[32m[I 2023-04-26 00:19:02,944][39m Trial 374 finished with value: 0.875 and parameters: {'criterion': 'gini', 'n_estimators': 143, 'max_features': 0.08849258831162848, 'max_depth': 27, 'min_samples_split': 8, 'min_samples_leaf': 2}. Best is trial 303 with value: 0.8947368421052632.
[32m[I 2023-04-26 00:19:03,056][39m Trial 375 finished with value: 0.8571428571428572 and parameters: {'criterion': 'gini', 'n_estimators': 148, 'max_features': 0.16239709037532155, 'max_depth': 22, 'min_samples_split': 8, 'min_samples_leaf': 2}. Best is trial 303 with value: 0.8947368421052632.
[32m[I 2023-04-26 00:19:03,136][39m Trial 376 finished with value: 0.8275862068965517 and parameters: {'criterion': 'gini', 'n_estimators': 105, 'max_features': 0.1073101524983402, 'max_depth': 27, 'min_samples_split': 8, 'min_samples_leaf': 6}. Best is trial 303 with value: 0.8947368421052632.
[32m[I 2023-04-26 00:19:03,207][39m Trial 377 finished with value: 0.8448275862068967 and parameters: {'criterion': 'gini', 'n_estimators': 87, 'max_features': 0.15160269195318765, 'max_depth': 24, 'min_samples_split': 8, 'min_samples_leaf': 9}. Best is trial 303 with value: 0.8947368421052632.
[32m[I 2023-04-26 00:19:03,280][39m Trial 378 finished with value: 0.8771929824561403 and parameters: {'criterion': 'gini', 'n_estimators': 81, 'max_features': 0.12174224171355075, 'max_depth': 26, 'min_samples_split': 5, 'min_samples_leaf': 2}. Best is trial 303 with value: 0.8947368421052632.
[32m[I 2023-04-26 00:19:03,363][39m Trial 379 finished with value: 0.8672566371681416 and parameters: {'criterion': 'entropy', 'n_estimators': 100, 'max_features': 0.03877250238775476, 'max_depth': 18, 'min_samples_split': 8, 'min_samples_leaf': 2}. Best is trial 303 with value: 0.8947368421052632.
[32m[I 2023-04-26 00:19:03,444][39m Trial 380 finished with value: 0.8672566371681416 and parameters: {'criterion': 'entropy', 'n_estimators': 94, 'max_features': 0.16815469450884998, 'max_depth': 28, 'min_samples_split': 8, 'min_samples_leaf': 2}. Best is trial 303 with value: 0.8947368421052632.
[32m[I 2023-04-26 00:19:03,547][39m Trial 381 finished with value: 0.8849557522123893 and parameters: {'criterion': 'gini', 'n_estimators': 130, 'max_features': 0.21776977148135257, 'max_depth': 33, 'min_samples_split': 8, 'min_samples_leaf': 1}. Best is trial 303 with value: 0.8947368421052632.
[32m[I 2023-04-26 00:19:03,651][39m Trial 382 finished with value: 0.8256880733944953 and parameters: {'criterion': 'gini', 'n_estimators': 132, 'max_features': 0.23338802004737863, 'max_depth': 33, 'min_samples_split': 8, 'min_samples_leaf': 1}. Best is trial 303 with value: 0.8947368421052632.
[32m[I 2023-04-26 00:19:03,753][39m Trial 383 finished with value: 0.8672566371681416 and parameters: {'criterion': 'gini', 'n_estimators': 131, 'max_features': 0.14360586814823736, 'max_depth': 31, 'min_samples_split': 8, 'min_samples_leaf': 2}. Best is trial 303 with value: 0.8947368421052632.
[32m[I 2023-04-26 00:19:03,854][39m Trial 384 finished with value: 0.8521739130434783 and parameters: {'criterion': 'gini', 'n_estimators': 128, 'max_features': 0.2169454880462407, 'max_depth': 35, 'min_samples_split': 8, 'min_samples_leaf': 1}. Best is trial 303 with value: 0.8947368421052632.
[32m[I 2023-04-26 00:19:03,957][39m Trial 385 finished with value: 0.8148148148148148 and parameters: {'criterion': 'gini', 'n_estimators': 128, 'max_features': 0.3622149468428587, 'max_depth': 30, 'min_samples_split': 8, 'min_samples_leaf': 2}. Best is trial 303 with value: 0.8947368421052632.
[32m[I 2023-04-26 00:19:04,030][39m Trial 386 finished with value: 0.8256880733944953 and parameters: {'criterion': 'gini', 'n_estimators': 83, 'max_features': 0.23982352136124976, 'max_depth': 37, 'min_samples_split': 8, 'min_samples_leaf': 1}. Best is trial 303 with value: 0.8947368421052632.
[32m[I 2023-04-26 00:19:04,137][39m Trial 387 finished with value: 0.875 and parameters: {'criterion': 'gini', 'n_estimators': 138, 'max_features': 0.21553325785598243, 'max_depth': 29, 'min_samples_split': 8, 'min_samples_leaf': 1}. Best is trial 303 with value: 0.8947368421052632.
[32m[I 2023-04-26 00:19:04,233][39m Trial 388 finished with value: 0.8648648648648648 and parameters: {'criterion': 'gini', 'n_estimators': 126, 'max_features': 0.18699030399825534, 'max_depth': 40, 'min_samples_split': 9, 'min_samples_leaf': 2}. Best is trial 303 with value: 0.8947368421052632.
[32m[I 2023-04-26 00:19:04,338][39m Trial 389 finished with value: 0.8468468468468469 and parameters: {'criterion': 'gini', 'n_estimators': 136, 'max_features': 0.25149281386022004, 'max_depth': 34, 'min_samples_split': 9, 'min_samples_leaf': 1}. Best is trial 303 with value: 0.8947368421052632.
[32m[I 2023-04-26 00:19:04,422][39m Trial 390 finished with value: 0.8596491228070176 and parameters: {'criterion': 'gini', 'n_estimators': 107, 'max_features': 0.08334458860132732, 'max_depth': 33, 'min_samples_split': 8, 'min_samples_leaf': 2}. Best is trial 303 with value: 0.8947368421052632.
[32m[I 2023-04-26 00:19:04,502][39m Trial 391 finished with value: 0.8181818181818181 and parameters: {'criterion': 'gini', 'n_estimators': 91, 'max_features': 0.5073214580337181, 'max_depth': 25, 'min_samples_split': 8, 'min_samples_leaf': 1}. Best is trial 303 with value: 0.8947368421052632.
[32m[I 2023-04-26 00:19:04,600][39m Trial 392 finished with value: 0.8771929824561403 and parameters: {'criterion': 'entropy', 'n_estimators': 124, 'max_features': 0.20505041691583337, 'max_depth': 28, 'min_samples_split': 8, 'min_samples_leaf': 1}. Best is trial 303 with value: 0.8947368421052632.
[32m[I 2023-04-26 00:19:04,681][39m Trial 393 finished with value: 0.8035714285714286 and parameters: {'criterion': 'entropy', 'n_estimators': 87, 'max_features': 0.805678416579338, 'max_depth': 4, 'min_samples_split': 9, 'min_samples_leaf': 1}. Best is trial 303 with value: 0.8947368421052632.
[32m[I 2023-04-26 00:19:04,758][39m Trial 394 finished with value: 0.7402597402597402 and parameters: {'criterion': 'entropy', 'n_estimators': 96, 'max_features': 0.905267316904375, 'max_depth': 1, 'min_samples_split': 8, 'min_samples_leaf': 1}. Best is trial 303 with value: 0.8947368421052632.
[32m[I 2023-04-26 00:19:04,846][39m Trial 395 finished with value: 0.8468468468468469 and parameters: {'criterion': 'entropy', 'n_estimators': 110, 'max_features': 0.12369482642091362, 'max_depth': 40, 'min_samples_split': 9, 'min_samples_leaf': 4}. Best is trial 303 with value: 0.8947368421052632.
[32m[I 2023-04-26 00:19:04,916][39m Trial 396 finished with value: 0.8648648648648648 and parameters: {'criterion': 'gini', 'n_estimators': 81, 'max_features': 0.2835888684640272, 'max_depth': 22, 'min_samples_split': 9, 'min_samples_leaf': 1}. Best is trial 303 with value: 0.8947368421052632.
[32m[I 2023-04-26 00:19:04,989][39m Trial 397 finished with value: 0.8256880733944953 and parameters: {'criterion': 'entropy', 'n_estimators': 84, 'max_features': 0.17111937127039653, 'max_depth': 37, 'min_samples_split': 8, 'min_samples_leaf': 2}. Best is trial 303 with value: 0.8947368421052632.
[32m[I 2023-04-26 00:19:05,074][39m Trial 398 finished with value: 0.8596491228070176 and parameters: {'criterion': 'entropy', 'n_estimators': 103, 'max_features': 0.19170435642218536, 'max_depth': 31, 'min_samples_split': 8, 'min_samples_leaf': 1}. Best is trial 303 with value: 0.8947368421052632.
[32m[I 2023-04-26 00:19:05,169][39m Trial 399 finished with value: 0.8571428571428572 and parameters: {'criterion': 'entropy', 'n_estimators': 129, 'max_features': 0.22198707910761314, 'max_depth': 5, 'min_samples_split': 9, 'min_samples_leaf': 1}. Best is trial 303 with value: 0.8947368421052632.
[32m[I 2023-04-26 00:19:05,266][39m Trial 400 finished with value: 0.8596491228070176 and parameters: {'criterion': 'entropy', 'n_estimators': 121, 'max_features': 0.1468276129845605, 'max_depth': 18, 'min_samples_split': 7, 'min_samples_leaf': 2}. Best is trial 303 with value: 0.8947368421052632.
[32m[I 2023-04-26 00:19:05,355][39m Trial 401 finished with value: 0.8363636363636363 and parameters: {'criterion': 'gini', 'n_estimators': 98, 'max_features': 0.44892736687389656, 'max_depth': 25, 'min_samples_split': 8, 'min_samples_leaf': 1}. Best is trial 303 with value: 0.8947368421052632.
[32m[I 2023-04-26 00:19:05,426][39m Trial 402 finished with value: 0.8672566371681416 and parameters: {'criterion': 'entropy', 'n_estimators': 90, 'max_features': 0.16596619401255416, 'max_depth': 43, 'min_samples_split': 9, 'min_samples_leaf': 3}. Best is trial 303 with value: 0.8947368421052632.
[32m[I 2023-04-26 00:19:05,501][39m Trial 403 finished with value: 0.8468468468468469 and parameters: {'criterion': 'entropy', 'n_estimators': 78, 'max_features': 0.2373864791035098, 'max_depth': 7, 'min_samples_split': 9, 'min_samples_leaf': 1}. Best is trial 303 with value: 0.8947368421052632.
[32m[I 2023-04-26 00:19:05,574][39m Trial 404 finished with value: 0.8468468468468469 and parameters: {'criterion': 'entropy', 'n_estimators': 86, 'max_features': 0.1028082522401984, 'max_depth': 52, 'min_samples_split': 8, 'min_samples_leaf': 2}. Best is trial 303 with value: 0.8947368421052632.
[32m[I 2023-04-26 00:19:05,661][39m Trial 405 finished with value: 0.8648648648648648 and parameters: {'criterion': 'entropy', 'n_estimators': 111, 'max_features': 0.13401708284418257, 'max_depth': 50, 'min_samples_split': 9, 'min_samples_leaf': 2}. Best is trial 303 with value: 0.8947368421052632.
[32m[I 2023-04-26 00:19:05,739][39m Trial 406 finished with value: 0.8571428571428572 and parameters: {'criterion': 'gini', 'n_estimators': 93, 'max_features': 0.18664161055494027, 'max_depth': 33, 'min_samples_split': 8, 'min_samples_leaf': 2}. Best is trial 303 with value: 0.8947368421052632.
[32m[I 2023-04-26 00:19:05,838][39m Trial 407 finished with value: 0.8421052631578947 and parameters: {'criterion': 'entropy', 'n_estimators': 124, 'max_features': 0.16834783952409743, 'max_depth': 42, 'min_samples_split': 8, 'min_samples_leaf': 2}. Best is trial 303 with value: 0.8947368421052632.
[32m[I 2023-04-26 00:19:05,924][39m Trial 408 finished with value: 0.8695652173913043 and parameters: {'criterion': 'entropy', 'n_estimators': 104, 'max_features': 0.14661254548911437, 'max_depth': 22, 'min_samples_split': 7, 'min_samples_leaf': 2}. Best is trial 303 with value: 0.8947368421052632.
[32m[I 2023-04-26 00:19:05,996][39m Trial 409 finished with value: 0.8468468468468469 and parameters: {'criterion': 'entropy', 'n_estimators': 82, 'max_features': 0.19810174815771098, 'max_depth': 20, 'min_samples_split': 9, 'min_samples_leaf': 2}. Best is trial 303 with value: 0.8947368421052632.
[32m[I 2023-04-26 00:19:06,083][39m Trial 410 finished with value: 0.8070175438596492 and parameters: {'criterion': 'entropy', 'n_estimators': 118, 'max_features': 0.11327124223639153, 'max_depth': 3, 'min_samples_split': 8, 'min_samples_leaf': 8}. Best is trial 303 with value: 0.8947368421052632.
[32m[I 2023-04-26 00:19:06,169][39m Trial 411 finished with value: 0.8545454545454546 and parameters: {'criterion': 'gini', 'n_estimators': 106, 'max_features': 0.15623747394966703, 'max_depth': 35, 'min_samples_split': 9, 'min_samples_leaf': 3}. Best is trial 303 with value: 0.8947368421052632.
[32m[I 2023-04-26 00:19:06,254][39m Trial 412 finished with value: 0.8695652173913043 and parameters: {'criterion': 'entropy', 'n_estimators': 100, 'max_features': 0.2231650295887532, 'max_depth': 27, 'min_samples_split': 8, 'min_samples_leaf': 1}. Best is trial 303 with value: 0.8947368421052632.
[32m[I 2023-04-26 00:19:06,346][39m Trial 413 finished with value: 0.8421052631578947 and parameters: {'criterion': 'entropy', 'n_estimators': 114, 'max_features': 0.20870461518015843, 'max_depth': 28, 'min_samples_split': 8, 'min_samples_leaf': 1}. Best is trial 303 with value: 0.8947368421052632.
[32m[I 2023-04-26 00:19:06,441][39m Trial 414 finished with value: 0.8771929824561403 and parameters: {'criterion': 'entropy', 'n_estimators': 120, 'max_features': 0.06057200662413405, 'max_depth': 38, 'min_samples_split': 8, 'min_samples_leaf': 1}. Best is trial 303 with value: 0.8947368421052632.
[32m[I 2023-04-26 00:19:06,510][39m Trial 415 finished with value: 0.8214285714285715 and parameters: {'criterion': 'gini', 'n_estimators': 89, 'max_features': 0.2520727686311633, 'max_depth': 24, 'min_samples_split': 9, 'min_samples_leaf': 10}. Best is trial 303 with value: 0.8947368421052632.
[32m[I 2023-04-26 00:19:06,628][39m Trial 416 finished with value: 0.8440366972477066 and parameters: {'criterion': 'entropy', 'n_estimators': 135, 'max_features': 0.3014681378910242, 'max_depth': 7, 'min_samples_split': 8, 'min_samples_leaf': 1}. Best is trial 303 with value: 0.8947368421052632.
[32m[I 2023-04-26 00:19:06,723][39m Trial 417 finished with value: 0.8695652173913043 and parameters: {'criterion': 'entropy', 'n_estimators': 110, 'max_features': 0.19199666329162404, 'max_depth': 26, 'min_samples_split': 8, 'min_samples_leaf': 1}. Best is trial 303 with value: 0.8947368421052632.
[32m[I 2023-04-26 00:19:06,788][39m Trial 418 finished with value: 0.8495575221238938 and parameters: {'criterion': 'entropy', 'n_estimators': 77, 'max_features': 0.030075393063174395, 'max_depth': 11, 'min_samples_split': 9, 'min_samples_leaf': 1}. Best is trial 303 with value: 0.8947368421052632.
[32m[I 2023-04-26 00:19:06,880][39m Trial 419 finished with value: 0.8571428571428572 and parameters: {'criterion': 'gini', 'n_estimators': 107, 'max_features': 0.12914860050136034, 'max_depth': 31, 'min_samples_split': 7, 'min_samples_leaf': 2}. Best is trial 303 with value: 0.8947368421052632.
[32m[I 2023-04-26 00:19:06,978][39m Trial 420 finished with value: 0.8849557522123893 and parameters: {'criterion': 'entropy', 'n_estimators': 127, 'max_features': 0.08153116048373613, 'max_depth': 41, 'min_samples_split': 9, 'min_samples_leaf': 4}. Best is trial 303 with value: 0.8947368421052632.
[32m[I 2023-04-26 00:19:07,074][39m Trial 421 finished with value: 0.8288288288288289 and parameters: {'criterion': 'entropy', 'n_estimators': 127, 'max_features': 0.05810308755009209, 'max_depth': 40, 'min_samples_split': 9, 'min_samples_leaf': 5}. Best is trial 303 with value: 0.8947368421052632.
[32m[I 2023-04-26 00:19:07,170][39m Trial 422 finished with value: 0.8623853211009175 and parameters: {'criterion': 'entropy', 'n_estimators': 131, 'max_features': 0.08802661274834453, 'max_depth': 39, 'min_samples_split': 9, 'min_samples_leaf': 4}. Best is trial 303 with value: 0.8947368421052632.
[32m[I 2023-04-26 00:19:07,267][39m Trial 423 finished with value: 0.8363636363636363 and parameters: {'criterion': 'entropy', 'n_estimators': 130, 'max_features': 0.07646550988661, 'max_depth': 36, 'min_samples_split': 8, 'min_samples_leaf': 4}. Best is trial 303 with value: 0.8947368421052632.
[32m[I 2023-04-26 00:19:07,342][39m Trial 424 finished with value: 0.8672566371681416 and parameters: {'criterion': 'gini', 'n_estimators': 84, 'max_features': 0.09979693315836718, 'max_depth': 43, 'min_samples_split': 9, 'min_samples_leaf': 4}. Best is trial 303 with value: 0.8947368421052632.
[32m[I 2023-04-26 00:19:07,438][39m Trial 425 finished with value: 0.8545454545454546 and parameters: {'criterion': 'entropy', 'n_estimators': 125, 'max_features': 0.1101641257327472, 'max_depth': 41, 'min_samples_split': 10, 'min_samples_leaf': 5}. Best is trial 303 with value: 0.8947368421052632.
[32m[I 2023-04-26 00:19:07,531][39m Trial 426 finished with value: 0.8571428571428572 and parameters: {'criterion': 'entropy', 'n_estimators': 123, 'max_features': 0.054308804153236134, 'max_depth': 14, 'min_samples_split': 8, 'min_samples_leaf': 4}. Best is trial 303 with value: 0.8947368421052632.
[32m[I 2023-04-26 00:19:07,622][39m Trial 427 finished with value: 0.8672566371681416 and parameters: {'criterion': 'entropy', 'n_estimators': 115, 'max_features': 0.09090005642504771, 'max_depth': 45, 'min_samples_split': 9, 'min_samples_leaf': 3}. Best is trial 303 with value: 0.8947368421052632.
[32m[I 2023-04-26 00:19:07,724][39m Trial 428 finished with value: 0.875 and parameters: {'criterion': 'gini', 'n_estimators': 128, 'max_features': 0.12478077348058339, 'max_depth': 42, 'min_samples_split': 9, 'min_samples_leaf': 3}. Best is trial 303 with value: 0.8947368421052632.
[32m[I 2023-04-26 00:19:07,821][39m Trial 429 finished with value: 0.8468468468468469 and parameters: {'criterion': 'entropy', 'n_estimators': 122, 'max_features': 0.17823048694345223, 'max_depth': 39, 'min_samples_split': 8, 'min_samples_leaf': 4}. Best is trial 303 with value: 0.8947368421052632.
[32m[I 2023-04-26 00:19:07,890][39m Trial 430 finished with value: 0.8620689655172413 and parameters: {'criterion': 'entropy', 'n_estimators': 72, 'max_features': 0.15332208647080575, 'max_depth': 44, 'min_samples_split': 9, 'min_samples_leaf': 5}. Best is trial 303 with value: 0.8947368421052632.
[32m[I 2023-04-26 00:19:07,963][39m Trial 431 finished with value: 0.8672566371681416 and parameters: {'criterion': 'entropy', 'n_estimators': 88, 'max_features': 0.06851193837203516, 'max_depth': 37, 'min_samples_split': 9, 'min_samples_leaf': 3}. Best is trial 303 with value: 0.8947368421052632.
[32m[I 2023-04-26 00:19:08,043][39m Trial 432 finished with value: 0.8256880733944953 and parameters: {'criterion': 'entropy', 'n_estimators': 93, 'max_features': 0.22931950098940596, 'max_depth': 5, 'min_samples_split': 8, 'min_samples_leaf': 1}. Best is trial 303 with value: 0.8947368421052632.
[32m[I 2023-04-26 00:19:08,123][39m Trial 433 finished with value: 0.8672566371681416 and parameters: {'criterion': 'gini', 'n_estimators': 101, 'max_features': 0.027081261222946074, 'max_depth': 30, 'min_samples_split': 8, 'min_samples_leaf': 2}. Best is trial 303 with value: 0.8947368421052632.
[32m[I 2023-04-26 00:19:08,223][39m Trial 434 finished with value: 0.875 and parameters: {'criterion': 'entropy', 'n_estimators': 127, 'max_features': 0.14593300343201565, 'max_depth': 45, 'min_samples_split': 10, 'min_samples_leaf': 2}. Best is trial 303 with value: 0.8947368421052632.
[32m[I 2023-04-26 00:19:08,320][39m Trial 435 finished with value: 0.8421052631578947 and parameters: {'criterion': 'entropy', 'n_estimators': 118, 'max_features': 0.2760472385505904, 'max_depth': 22, 'min_samples_split': 8, 'min_samples_leaf': 1}. Best is trial 303 with value: 0.8947368421052632.
[32m[I 2023-04-26 00:19:08,402][39m Trial 436 finished with value: 0.8672566371681416 and parameters: {'criterion': 'entropy', 'n_estimators': 98, 'max_features': 0.17535781381672183, 'max_depth': 10, 'min_samples_split': 8, 'min_samples_leaf': 3}. Best is trial 303 with value: 0.8947368421052632.
[32m[I 2023-04-26 00:19:08,489][39m Trial 437 finished with value: 0.8440366972477066 and parameters: {'criterion': 'gini', 'n_estimators': 113, 'max_features': 0.1130744882002772, 'max_depth': 41, 'min_samples_split': 9, 'min_samples_leaf': 5}. Best is trial 303 with value: 0.8947368421052632.
