[32m[I 2023-04-26 00:18:43,568][39m Trial 146 finished with value: 0.8521739130434783 and parameters: {'criterion': 'entropy', 'n_estimators': 151, 'max_features': 0.17241990317528819, 'max_depth': 31, 'min_samples_split': 3, 'min_samples_leaf': 1}. Best is trial 73 with value: 0.8869565217391304.
[32m[I 2023-04-26 00:18:43,642][39m Trial 147 finished with value: 0.8849557522123893 and parameters: {'criterion': 'gini', 'n_estimators': 85, 'max_features': 0.25968227849293124, 'max_depth': 48, 'min_samples_split': 9, 'min_samples_leaf': 1}. Best is trial 73 with value: 0.8869565217391304.
[32m[I 2023-04-26 00:18:43,722][39m Trial 148 finished with value: 0.8468468468468469 and parameters: {'criterion': 'entropy', 'n_estimators': 98, 'max_features': 0.29845762959543254, 'max_depth': 45, 'min_samples_split': 9, 'min_samples_leaf': 1}. Best is trial 73 with value: 0.8869565217391304.
[32m[I 2023-04-26 00:18:43,797][39m Trial 149 finished with value: 0.8648648648648648 and parameters: {'criterion': 'gini', 'n_estimators': 102, 'max_features': 0.07254851148955073, 'max_depth': 72, 'min_samples_split': 10, 'min_samples_leaf': 2}. Best is trial 73 with value: 0.8869565217391304.
[32m[I 2023-04-26 00:18:43,878][39m Trial 150 finished with value: 0.8547008547008546 and parameters: {'criterion': 'entropy', 'n_estimators': 104, 'max_features': 0.10015490500962587, 'max_depth': 34, 'min_samples_split': 4, 'min_samples_leaf': 1}. Best is trial 73 with value: 0.8869565217391304.
[32m[I 2023-04-26 00:18:43,947][39m Trial 151 finished with value: 0.8849557522123893 and parameters: {'criterion': 'gini', 'n_estimators': 86, 'max_features': 0.26720927537129363, 'max_depth': 24, 'min_samples_split': 8, 'min_samples_leaf': 2}. Best is trial 73 with value: 0.8869565217391304.
[32m[I 2023-04-26 00:18:44,016][39m Trial 152 finished with value: 0.8468468468468469 and parameters: {'criterion': 'gini', 'n_estimators': 87, 'max_features': 0.2753093083743721, 'max_depth': 25, 'min_samples_split': 8, 'min_samples_leaf': 2}. Best is trial 73 with value: 0.8869565217391304.
[32m[I 2023-04-26 00:18:44,096][39m Trial 153 finished with value: 0.8849557522123893 and parameters: {'criterion': 'gini', 'n_estimators': 108, 'max_features': 0.11886937481634696, 'max_depth': 29, 'min_samples_split': 8, 'min_samples_leaf': 2}. Best is trial 73 with value: 0.8869565217391304.
[32m[I 2023-04-26 00:18:44,165][39m Trial 154 finished with value: 0.8495575221238938 and parameters: {'criterion': 'gini', 'n_estimators': 85, 'max_features': 0.3563753580970894, 'max_depth': 23, 'min_samples_split': 8, 'min_samples_leaf': 2}. Best is trial 73 with value: 0.8869565217391304.
[32m[I 2023-04-26 00:18:44,238][39m Trial 155 finished with value: 0.8545454545454546 and parameters: {'criterion': 'gini', 'n_estimators': 91, 'max_features': 0.24515820768317206, 'max_depth': 18, 'min_samples_split': 8, 'min_samples_leaf': 2}. Best is trial 73 with value: 0.8869565217391304.
[32m[I 2023-04-26 00:18:44,303][39m Trial 156 finished with value: 0.8495575221238938 and parameters: {'criterion': 'gini', 'n_estimators': 83, 'max_features': 0.1774407073959252, 'max_depth': 29, 'min_samples_split': 9, 'min_samples_leaf': 1}. Best is trial 73 with value: 0.8869565217391304.
[32m[I 2023-04-26 00:18:44,374][39m Trial 157 finished with value: 0.8648648648648648 and parameters: {'criterion': 'gini', 'n_estimators': 94, 'max_features': 0.052634237667944686, 'max_depth': 83, 'min_samples_split': 9, 'min_samples_leaf': 2}. Best is trial 73 with value: 0.8869565217391304.
[32m[I 2023-04-26 00:18:44,464][39m Trial 158 finished with value: 0.8440366972477066 and parameters: {'criterion': 'gini', 'n_estimators': 109, 'max_features': 0.7824599535255432, 'max_depth': 28, 'min_samples_split': 8, 'min_samples_leaf': 1}. Best is trial 73 with value: 0.8869565217391304.
[32m[I 2023-04-26 00:18:44,607][39m Trial 159 finished with value: 0.8440366972477066 and parameters: {'criterion': 'gini', 'n_estimators': 195, 'max_features': 0.292922299600694, 'max_depth': 48, 'min_samples_split': 9, 'min_samples_leaf': 1}. Best is trial 73 with value: 0.8869565217391304.
[32m[I 2023-04-26 00:18:44,686][39m Trial 160 finished with value: 0.8571428571428572 and parameters: {'criterion': 'gini', 'n_estimators': 99, 'max_features': 0.3139826427477979, 'max_depth': 21, 'min_samples_split': 9, 'min_samples_leaf': 1}. Best is trial 73 with value: 0.8869565217391304.
[32m[I 2023-04-26 00:18:44,770][39m Trial 161 finished with value: 0.8256880733944953 and parameters: {'criterion': 'gini', 'n_estimators': 113, 'max_features': 0.26274621591182595, 'max_depth': 60, 'min_samples_split': 8, 'min_samples_leaf': 2}. Best is trial 73 with value: 0.8869565217391304.
[32m[I 2023-04-26 00:18:44,834][39m Trial 162 finished with value: 0.8672566371681416 and parameters: {'criterion': 'gini', 'n_estimators': 78, 'max_features': 0.1417290902561723, 'max_depth': 24, 'min_samples_split': 9, 'min_samples_leaf': 2}. Best is trial 73 with value: 0.8869565217391304.
[32m[I 2023-04-26 00:18:44,908][39m Trial 163 finished with value: 0.8545454545454546 and parameters: {'criterion': 'gini', 'n_estimators': 107, 'max_features': 0.20245536971044856, 'max_depth': 51, 'min_samples_split': 8, 'min_samples_leaf': 3}. Best is trial 73 with value: 0.8869565217391304.
[32m[I 2023-04-26 00:18:44,995][39m Trial 164 finished with value: 0.875 and parameters: {'criterion': 'gini', 'n_estimators': 110, 'max_features': 0.07901606686400858, 'max_depth': 96, 'min_samples_split': 8, 'min_samples_leaf': 3}. Best is trial 73 with value: 0.8869565217391304.
[32m[I 2023-04-26 00:18:45,078][39m Trial 165 finished with value: 0.8571428571428572 and parameters: {'criterion': 'gini', 'n_estimators': 115, 'max_features': 0.11366780275265166, 'max_depth': 44, 'min_samples_split': 9, 'min_samples_leaf': 3}. Best is trial 73 with value: 0.8869565217391304.
[32m[I 2023-04-26 00:18:45,146][39m Trial 166 finished with value: 0.8440366972477066 and parameters: {'criterion': 'gini', 'n_estimators': 89, 'max_features': 0.15299757915436848, 'max_depth': 91, 'min_samples_split': 10, 'min_samples_leaf': 2}. Best is trial 73 with value: 0.8869565217391304.
[32m[I 2023-04-26 00:18:45,228][39m Trial 167 finished with value: 0.8571428571428572 and parameters: {'criterion': 'gini', 'n_estimators': 111, 'max_features': 0.23970851165376017, 'max_depth': 50, 'min_samples_split': 9, 'min_samples_leaf': 1}. Best is trial 73 with value: 0.8869565217391304.
[32m[I 2023-04-26 00:18:45,311][39m Trial 168 finished with value: 0.8695652173913043 and parameters: {'criterion': 'gini', 'n_estimators': 106, 'max_features': 0.18855963471594223, 'max_depth': 47, 'min_samples_split': 9, 'min_samples_leaf': 1}. Best is trial 73 with value: 0.8869565217391304.
[32m[I 2023-04-26 00:18:45,388][39m Trial 169 finished with value: 0.8793103448275863 and parameters: {'criterion': 'entropy', 'n_estimators': 102, 'max_features': 0.16702853003776555, 'max_depth': 27, 'min_samples_split': 8, 'min_samples_leaf': 2}. Best is trial 73 with value: 0.8869565217391304.
[32m[I 2023-04-26 00:18:45,482][39m Trial 170 finished with value: 0.8545454545454546 and parameters: {'criterion': 'entropy', 'n_estimators': 121, 'max_features': 0.1736887094821819, 'max_depth': 54, 'min_samples_split': 8, 'min_samples_leaf': 3}. Best is trial 73 with value: 0.8869565217391304.
[32m[I 2023-04-26 00:18:45,611][39m Trial 171 finished with value: 0.8571428571428572 and parameters: {'criterion': 'gini', 'n_estimators': 187, 'max_features': 0.1207730551145568, 'max_depth': 101, 'min_samples_split': 8, 'min_samples_leaf': 2}. Best is trial 73 with value: 0.8869565217391304.
[32m[I 2023-04-26 00:18:45,687][39m Trial 172 finished with value: 0.8648648648648648 and parameters: {'criterion': 'entropy', 'n_estimators': 103, 'max_features': 0.13742215982003014, 'max_depth': 31, 'min_samples_split': 8, 'min_samples_leaf': 3}. Best is trial 73 with value: 0.8869565217391304.
[32m[I 2023-04-26 00:18:45,765][39m Trial 173 finished with value: 0.8440366972477066 and parameters: {'criterion': 'entropy', 'n_estimators': 97, 'max_features': 0.2104704749415968, 'max_depth': 27, 'min_samples_split': 7, 'min_samples_leaf': 2}. Best is trial 73 with value: 0.8869565217391304.
[32m[I 2023-04-26 00:18:45,886][39m Trial 174 finished with value: 0.8672566371681416 and parameters: {'criterion': 'entropy', 'n_estimators': 161, 'max_features': 0.16194578522380026, 'max_depth': 15, 'min_samples_split': 3, 'min_samples_leaf': 2}. Best is trial 73 with value: 0.8869565217391304.
[32m[I 2023-04-26 00:18:45,977][39m Trial 175 finished with value: 0.8468468468468469 and parameters: {'criterion': 'entropy', 'n_estimators': 114, 'max_features': 0.21967369462346437, 'max_depth': 27, 'min_samples_split': 8, 'min_samples_leaf': 1}. Best is trial 73 with value: 0.8869565217391304.
[32m[I 2023-04-26 00:18:46,065][39m Trial 176 finished with value: 0.8849557522123893 and parameters: {'criterion': 'entropy', 'n_estimators': 118, 'max_features': 0.14359473919688548, 'max_depth': 37, 'min_samples_split': 8, 'min_samples_leaf': 2}. Best is trial 73 with value: 0.8869565217391304.
[32m[I 2023-04-26 00:18:46,159][39m Trial 177 finished with value: 0.8771929824561403 and parameters: {'criterion': 'gini', 'n_estimators': 124, 'max_features': 0.1525575814160888, 'max_depth': 37, 'min_samples_split': 9, 'min_samples_leaf': 2}. Best is trial 73 with value: 0.8869565217391304.
[32m[I 2023-04-26 00:18:46,259][39m Trial 178 finished with value: 0.8545454545454546 and parameters: {'criterion': 'gini', 'n_estimators': 126, 'max_features': 0.07144487964830619, 'max_depth': 38, 'min_samples_split': 9, 'min_samples_leaf': 2}. Best is trial 73 with value: 0.8869565217391304.
[32m[I 2023-04-26 00:18:46,352][39m Trial 179 finished with value: 0.8571428571428572 and parameters: {'criterion': 'gini', 'n_estimators': 129, 'max_features': 0.000838195957337657, 'max_depth': 32, 'min_samples_split': 9, 'min_samples_leaf': 2}. Best is trial 73 with value: 0.8869565217391304.
[32m[I 2023-04-26 00:18:46,446][39m Trial 180 finished with value: 0.8672566371681416 and parameters: {'criterion': 'entropy', 'n_estimators': 124, 'max_features': 0.1832087560901992, 'max_depth': 36, 'min_samples_split': 8, 'min_samples_leaf': 2}. Best is trial 73 with value: 0.8869565217391304.
[32m[I 2023-04-26 00:18:46,534][39m Trial 181 finished with value: 0.8648648648648648 and parameters: {'criterion': 'gini', 'n_estimators': 118, 'max_features': 0.1416244369187727, 'max_depth': 41, 'min_samples_split': 9, 'min_samples_leaf': 2}. Best is trial 73 with value: 0.8869565217391304.
[32m[I 2023-04-26 00:18:46,670][39m Trial 182 finished with value: 0.8596491228070176 and parameters: {'criterion': 'entropy', 'n_estimators': 196, 'max_features': 0.08891410561251989, 'max_depth': 34, 'min_samples_split': 8, 'min_samples_leaf': 2}. Best is trial 73 with value: 0.8869565217391304.
[32m[I 2023-04-26 00:18:46,740][39m Trial 183 finished with value: 0.8468468468468469 and parameters: {'criterion': 'gini', 'n_estimators': 93, 'max_features': 0.15637939207717705, 'max_depth': 5, 'min_samples_split': 10, 'min_samples_leaf': 2}. Best is trial 73 with value: 0.8869565217391304.
[32m[I 2023-04-26 00:18:46,818][39m Trial 184 finished with value: 0.875 and parameters: {'criterion': 'entropy', 'n_estimators': 101, 'max_features': 0.12393853399550035, 'max_depth': 20, 'min_samples_split': 8, 'min_samples_leaf': 2}. Best is trial 73 with value: 0.8869565217391304.
[32m[I 2023-04-26 00:18:46,930][39m Trial 185 finished with value: 0.8672566371681416 and parameters: {'criterion': 'gini', 'n_estimators': 165, 'max_features': 0.022068414151850707, 'max_depth': 37, 'min_samples_split': 9, 'min_samples_leaf': 1}. Best is trial 73 with value: 0.8869565217391304.
[32m[I 2023-04-26 00:18:47,019][39m Trial 186 finished with value: 0.8214285714285715 and parameters: {'criterion': 'gini', 'n_estimators': 106, 'max_features': 0.6218340130070028, 'max_depth': 30, 'min_samples_split': 8, 'min_samples_leaf': 10}. Best is trial 73 with value: 0.8869565217391304.
[32m[I 2023-04-26 00:18:47,089][39m Trial 187 finished with value: 0.8695652173913043 and parameters: {'criterion': 'entropy', 'n_estimators': 100, 'max_features': 0.13258273307120405, 'max_depth': 23, 'min_samples_split': 8, 'min_samples_leaf': 1}. Best is trial 73 with value: 0.8869565217391304.
[32m[I 2023-04-26 00:18:47,196][39m Trial 188 finished with value: 0.875 and parameters: {'criterion': 'entropy', 'n_estimators': 134, 'max_features': 0.0904593973017619, 'max_depth': 26, 'min_samples_split': 7, 'min_samples_leaf': 2}. Best is trial 73 with value: 0.8869565217391304.
[32m[I 2023-04-26 00:18:47,270][39m Trial 189 finished with value: 0.875 and parameters: {'criterion': 'entropy', 'n_estimators': 96, 'max_features': 0.1175926887095956, 'max_depth': 34, 'min_samples_split': 7, 'min_samples_leaf': 3}. Best is trial 73 with value: 0.8869565217391304.
[32m[I 2023-04-26 00:18:47,344][39m Trial 190 finished with value: 0.8672566371681416 and parameters: {'criterion': 'entropy', 'n_estimators': 95, 'max_features': 0.11118875500558761, 'max_depth': 39, 'min_samples_split': 6, 'min_samples_leaf': 3}. Best is trial 73 with value: 0.8869565217391304.
[32m[I 2023-04-26 00:18:47,438][39m Trial 191 finished with value: 0.8035714285714286 and parameters: {'criterion': 'gini', 'n_estimators': 118, 'max_features': 0.4622844453879883, 'max_depth': 70, 'min_samples_split': 9, 'min_samples_leaf': 3}. Best is trial 73 with value: 0.8869565217391304.
[32m[I 2023-04-26 00:18:47,517][39m Trial 192 finished with value: 0.8468468468468469 and parameters: {'criterion': 'entropy', 'n_estimators': 101, 'max_features': 0.15244858580213394, 'max_depth': 29, 'min_samples_split': 8, 'min_samples_leaf': 2}. Best is trial 73 with value: 0.8869565217391304.
[32m[I 2023-04-26 00:18:47,585][39m Trial 193 finished with value: 0.8468468468468469 and parameters: {'criterion': 'gini', 'n_estimators': 84, 'max_features': 0.19622658058790154, 'max_depth': 42, 'min_samples_split': 8, 'min_samples_leaf': 2}. Best is trial 73 with value: 0.8869565217391304.
[32m[I 2023-04-26 00:18:47,655][39m Trial 194 finished with value: 0.8545454545454546 and parameters: {'criterion': 'gini', 'n_estimators': 88, 'max_features': 0.23146663562198488, 'max_depth': 25, 'min_samples_split': 8, 'min_samples_leaf': 3}. Best is trial 73 with value: 0.8869565217391304.
[32m[I 2023-04-26 00:18:47,780][39m Trial 195 finished with value: 0.8596491228070176 and parameters: {'criterion': 'entropy', 'n_estimators': 169, 'max_features': 0.1662672758830491, 'max_depth': 32, 'min_samples_split': 3, 'min_samples_leaf': 2}. Best is trial 73 with value: 0.8869565217391304.
[32m[I 2023-04-26 00:18:47,895][39m Trial 196 finished with value: 0.8392857142857144 and parameters: {'criterion': 'gini', 'n_estimators': 161, 'max_features': 0.10374987907011321, 'max_depth': 76, 'min_samples_split': 2, 'min_samples_leaf': 2}. Best is trial 73 with value: 0.8869565217391304.
[32m[I 2023-04-26 00:18:47,985][39m Trial 197 finished with value: 0.8771929824561403 and parameters: {'criterion': 'entropy', 'n_estimators': 121, 'max_features': 0.17703786544535885, 'max_depth': 45, 'min_samples_split': 9, 'min_samples_leaf': 2}. Best is trial 73 with value: 0.8869565217391304.
[32m[I 2023-04-26 00:18:48,083][39m Trial 198 finished with value: 0.8928571428571429 and parameters: {'criterion': 'entropy', 'n_estimators': 123, 'max_features': 0.18291159817502745, 'max_depth': 44, 'min_samples_split': 9, 'min_samples_leaf': 5}. Best is trial 198 with value: 0.8928571428571429.
[32m[I 2023-04-26 00:18:48,175][39m Trial 199 finished with value: 0.8596491228070176 and parameters: {'criterion': 'gini', 'n_estimators': 123, 'max_features': 0.21099821354521084, 'max_depth': 46, 'min_samples_split': 9, 'min_samples_leaf': 5}. Best is trial 198 with value: 0.8928571428571429.
[32m[I 2023-04-26 00:18:48,268][39m Trial 200 finished with value: 0.8256880733944953 and parameters: {'criterion': 'gini', 'n_estimators': 127, 'max_features': 0.17740531570335422, 'max_depth': 43, 'min_samples_split': 9, 'min_samples_leaf': 8}. Best is trial 198 with value: 0.8928571428571429.
[32m[I 2023-04-26 00:18:48,347][39m Trial 201 finished with value: 0.8648648648648648 and parameters: {'criterion': 'entropy', 'n_estimators': 108, 'max_features': 0.12766575233488944, 'max_depth': 48, 'min_samples_split': 9, 'min_samples_leaf': 6}. Best is trial 198 with value: 0.8928571428571429.
[32m[I 2023-04-26 00:18:48,437][39m Trial 202 finished with value: 0.8288288288288289 and parameters: {'criterion': 'entropy', 'n_estimators': 121, 'max_features': 0.1857262910934245, 'max_depth': 80, 'min_samples_split': 8, 'min_samples_leaf': 4}. Best is trial 198 with value: 0.8928571428571429.
[32m[I 2023-04-26 00:18:48,525][39m Trial 203 finished with value: 0.8571428571428572 and parameters: {'criterion': 'entropy', 'n_estimators': 114, 'max_features': 0.1610770873100786, 'max_depth': 21, 'min_samples_split': 8, 'min_samples_leaf': 2}. Best is trial 198 with value: 0.8928571428571429.
[32m[I 2023-04-26 00:18:48,618][39m Trial 204 finished with value: 0.8771929824561403 and parameters: {'criterion': 'entropy', 'n_estimators': 119, 'max_features': 0.18839066635321547, 'max_depth': 45, 'min_samples_split': 9, 'min_samples_leaf': 1}. Best is trial 198 with value: 0.8928571428571429.
[32m[I 2023-04-26 00:18:48,746][39m Trial 205 finished with value: 0.8545454545454546 and parameters: {'criterion': 'entropy', 'n_estimators': 181, 'max_features': 0.20095382722745228, 'max_depth': 46, 'min_samples_split': 9, 'min_samples_leaf': 5}. Best is trial 198 with value: 0.8928571428571429.
[32m[I 2023-04-26 00:18:48,838][39m Trial 206 finished with value: 0.8571428571428572 and parameters: {'criterion': 'entropy', 'n_estimators': 118, 'max_features': 0.2577277675511412, 'max_depth': 40, 'min_samples_split': 9, 'min_samples_leaf': 2}. Best is trial 198 with value: 0.8928571428571429.
[32m[I 2023-04-26 00:18:48,935][39m Trial 207 finished with value: 0.8717948717948718 and parameters: {'criterion': 'gini', 'n_estimators': 131, 'max_features': 0.18151821175976773, 'max_depth': 52, 'min_samples_split': 9, 'min_samples_leaf': 1}. Best is trial 198 with value: 0.8928571428571429.
[32m[I 2023-04-26 00:18:49,027][39m Trial 208 finished with value: 0.8440366972477066 and parameters: {'criterion': 'entropy', 'n_estimators': 122, 'max_features': 0.14673261344876845, 'max_depth': 45, 'min_samples_split': 9, 'min_samples_leaf': 2}. Best is trial 198 with value: 0.8928571428571429.
[32m[I 2023-04-26 00:18:49,121][39m Trial 209 finished with value: 0.8648648648648648 and parameters: {'criterion': 'gini', 'n_estimators': 119, 'max_features': 0.047975182512901865, 'max_depth': 73, 'min_samples_split': 3, 'min_samples_leaf': 4}. Best is trial 198 with value: 0.8928571428571429.
[32m[I 2023-04-26 00:18:49,263][39m Trial 210 finished with value: 0.8468468468468469 and parameters: {'criterion': 'entropy', 'n_estimators': 189, 'max_features': 0.21790189982196032, 'max_depth': 49, 'min_samples_split': 9, 'min_samples_leaf': 1}. Best is trial 198 with value: 0.8928571428571429.
[32m[I 2023-04-26 00:18:49,347][39m Trial 211 finished with value: 0.8648648648648648 and parameters: {'criterion': 'entropy', 'n_estimators': 111, 'max_features': 0.0385742431276035, 'max_depth': 43, 'min_samples_split': 8, 'min_samples_leaf': 3}. Best is trial 198 with value: 0.8928571428571429.
[32m[I 2023-04-26 00:18:49,465][39m Trial 212 finished with value: 0.8545454545454546 and parameters: {'criterion': 'entropy', 'n_estimators': 175, 'max_features': 0.13845325852534432, 'max_depth': 86, 'min_samples_split': 3, 'min_samples_leaf': 6}. Best is trial 198 with value: 0.8928571428571429.
[32m[I 2023-04-26 00:18:49,562][39m Trial 213 finished with value: 0.831858407079646 and parameters: {'criterion': 'entropy', 'n_estimators': 123, 'max_features': 0.23626370790845885, 'max_depth': 23, 'min_samples_split': 10, 'min_samples_leaf': 2}. Best is trial 198 with value: 0.8928571428571429.
[32m[I 2023-04-26 00:18:49,634][39m Trial 214 finished with value: 0.8648648648648648 and parameters: {'criterion': 'entropy', 'n_estimators': 91, 'max_features': 0.13349586887829687, 'max_depth': 26, 'min_samples_split': 8, 'min_samples_leaf': 2}. Best is trial 198 with value: 0.8928571428571429.
[32m[I 2023-04-26 00:18:49,750][39m Trial 215 finished with value: 0.8672566371681416 and parameters: {'criterion': 'entropy', 'n_estimators': 165, 'max_features': 0.07654913092810003, 'max_depth': 95, 'min_samples_split': 9, 'min_samples_leaf': 3}. Best is trial 198 with value: 0.8928571428571429.
[32m[I 2023-04-26 00:18:49,833][39m Trial 216 finished with value: 0.8392857142857144 and parameters: {'criterion': 'gini', 'n_estimators': 110, 'max_features': 0.1664460788001391, 'max_depth': 36, 'min_samples_split': 9, 'min_samples_leaf': 3}. Best is trial 198 with value: 0.8928571428571429.
[32m[I 2023-04-26 00:18:49,922][39m Trial 217 finished with value: 0.8771929824561403 and parameters: {'criterion': 'entropy', 'n_estimators': 116, 'max_features': 0.19360539817139122, 'max_depth': 8, 'min_samples_split': 7, 'min_samples_leaf': 2}. Best is trial 198 with value: 0.8928571428571429.
[32m[I 2023-04-26 00:18:50,010][39m Trial 218 finished with value: 0.8648648648648648 and parameters: {'criterion': 'entropy', 'n_estimators': 116, 'max_features': 0.18680563647271908, 'max_depth': 7, 'min_samples_split': 8, 'min_samples_leaf': 2}. Best is trial 198 with value: 0.8928571428571429.
