[32m[I 2023-04-26 00:18:36,351][39m Trial 73 finished with value: 0.8869565217391304 and parameters: {'criterion': 'entropy', 'n_estimators': 109, 'max_features': 0.042820710411564475, 'max_depth': 38, 'min_samples_split': 8, 'min_samples_leaf': 2}. Best is trial 73 with value: 0.8869565217391304.
[32m[I 2023-04-26 00:18:36,433][39m Trial 74 finished with value: 0.8571428571428572 and parameters: {'criterion': 'entropy', 'n_estimators': 108, 'max_features': 0.03530482191857087, 'max_depth': 51, 'min_samples_split': 8, 'min_samples_leaf': 2}. Best is trial 73 with value: 0.8869565217391304.
[32m[I 2023-04-26 00:18:36,492][39m Trial 75 finished with value: 0.8672566371681416 and parameters: {'criterion': 'entropy', 'n_estimators': 73, 'max_features': 0.07547033546734086, 'max_depth': 46, 'min_samples_split': 7, 'min_samples_leaf': 3}. Best is trial 73 with value: 0.8869565217391304.
[32m[I 2023-04-26 00:18:36,571][39m Trial 76 finished with value: 0.8672566371681416 and parameters: {'criterion': 'entropy', 'n_estimators': 99, 'max_features': 0.02837985793437539, 'max_depth': 38, 'min_samples_split': 9, 'min_samples_leaf': 1}. Best is trial 73 with value: 0.8869565217391304.
[32m[I 2023-04-26 00:18:36,663][39m Trial 77 finished with value: 0.8073394495412843 and parameters: {'criterion': 'entropy', 'n_estimators': 113, 'max_features': 0.48807959502632453, 'max_depth': 58, 'min_samples_split': 8, 'min_samples_leaf': 2}. Best is trial 73 with value: 0.8869565217391304.
[32m[I 2023-04-26 00:18:36,734][39m Trial 78 finished with value: 0.875 and parameters: {'criterion': 'entropy', 'n_estimators': 89, 'max_features': 0.2625140302497806, 'max_depth': 19, 'min_samples_split': 8, 'min_samples_leaf': 2}. Best is trial 73 with value: 0.8869565217391304.
[32m[I 2023-04-26 00:18:36,835][39m Trial 79 finished with value: 0.8495575221238938 and parameters: {'criterion': 'entropy', 'n_estimators': 127, 'max_features': 0.21256493210502195, 'max_depth': 27, 'min_samples_split': 5, 'min_samples_leaf': 1}. Best is trial 73 with value: 0.8869565217391304.
[32m[I 2023-04-26 00:18:36,904][39m Trial 80 finished with value: 0.8596491228070176 and parameters: {'criterion': 'entropy', 'n_estimators': 88, 'max_features': 0.2724032195745565, 'max_depth': 20, 'min_samples_split': 10, 'min_samples_leaf': 1}. Best is trial 73 with value: 0.8869565217391304.
[32m[I 2023-04-26 00:18:36,957][39m Trial 81 finished with value: 0.8596491228070176 and parameters: {'criterion': 'entropy', 'n_estimators': 59, 'max_features': 0.09568514380364629, 'max_depth': 24, 'min_samples_split': 8, 'min_samples_leaf': 3}. Best is trial 73 with value: 0.8869565217391304.
[32m[I 2023-04-26 00:18:37,001][39m Trial 82 finished with value: 0.8571428571428572 and parameters: {'criterion': 'entropy', 'n_estimators': 50, 'max_features': 0.13090140991911106, 'max_depth': 34, 'min_samples_split': 6, 'min_samples_leaf': 2}. Best is trial 73 with value: 0.8869565217391304.
[32m[I 2023-04-26 00:18:37,091][39m Trial 83 finished with value: 0.831858407079646 and parameters: {'criterion': 'entropy', 'n_estimators': 110, 'max_features': 0.3235293193772168, 'max_depth': 23, 'min_samples_split': 4, 'min_samples_leaf': 2}. Best is trial 73 with value: 0.8869565217391304.
[32m[I 2023-04-26 00:18:37,192][39m Trial 84 finished with value: 0.8672566371681416 and parameters: {'criterion': 'entropy', 'n_estimators': 134, 'max_features': 0.1767153842558087, 'max_depth': 30, 'min_samples_split': 9, 'min_samples_leaf': 2}. Best is trial 73 with value: 0.8869565217391304.
[32m[I 2023-04-26 00:18:37,270][39m Trial 85 finished with value: 0.8495575221238938 and parameters: {'criterion': 'entropy', 'n_estimators': 104, 'max_features': 0.05951867366617125, 'max_depth': 16, 'min_samples_split': 7, 'min_samples_leaf': 4}. Best is trial 73 with value: 0.8869565217391304.
[32m[I 2023-04-26 00:18:37,358][39m Trial 86 finished with value: 0.8545454545454546 and parameters: {'criterion': 'gini', 'n_estimators': 122, 'max_features': 0.10118317017053996, 'max_depth': 40, 'min_samples_split': 9, 'min_samples_leaf': 3}. Best is trial 73 with value: 0.8869565217391304.
[32m[I 2023-04-26 00:18:37,434][39m Trial 87 finished with value: 0.8363636363636363 and parameters: {'criterion': 'entropy', 'n_estimators': 97, 'max_features': 0.2565640535310264, 'max_depth': 36, 'min_samples_split': 8, 'min_samples_leaf': 4}. Best is trial 73 with value: 0.8869565217391304.
[32m[I 2023-04-26 00:18:37,547][39m Trial 88 finished with value: 0.8771929824561403 and parameters: {'criterion': 'entropy', 'n_estimators': 158, 'max_features': 0.1549229297052571, 'max_depth': 43, 'min_samples_split': 9, 'min_samples_leaf': 3}. Best is trial 73 with value: 0.8869565217391304.
[32m[I 2023-04-26 00:18:37,685][39m Trial 89 finished with value: 0.8035714285714286 and parameters: {'criterion': 'entropy', 'n_estimators': 167, 'max_features': 0.9117414216192036, 'max_depth': 44, 'min_samples_split': 10, 'min_samples_leaf': 11}. Best is trial 73 with value: 0.8869565217391304.
[32m[I 2023-04-26 00:18:37,829][39m Trial 90 finished with value: 0.8571428571428572 and parameters: {'criterion': 'entropy', 'n_estimators': 193, 'max_features': 0.22751350650853747, 'max_depth': 19, 'min_samples_split': 8, 'min_samples_leaf': 2}. Best is trial 73 with value: 0.8869565217391304.
[32m[I 2023-04-26 00:18:37,926][39m Trial 91 finished with value: 0.875 and parameters: {'criterion': 'entropy', 'n_estimators': 116, 'max_features': 0.18996273788341433, 'max_depth': 48, 'min_samples_split': 8, 'min_samples_leaf': 3}. Best is trial 73 with value: 0.8869565217391304.
[32m[I 2023-04-26 00:18:38,011][39m Trial 92 finished with value: 0.8571428571428572 and parameters: {'criterion': 'entropy', 'n_estimators': 115, 'max_features': 0.1536535823538537, 'max_depth': 46, 'min_samples_split': 9, 'min_samples_leaf': 3}. Best is trial 73 with value: 0.8869565217391304.
[32m[I 2023-04-26 00:18:38,125][39m Trial 93 finished with value: 0.8672566371681416 and parameters: {'criterion': 'entropy', 'n_estimators': 158, 'max_features': 0.1981663886416222, 'max_depth': 50, 'min_samples_split': 9, 'min_samples_leaf': 4}. Best is trial 73 with value: 0.8869565217391304.
[32m[I 2023-04-26 00:18:38,243][39m Trial 94 finished with value: 0.8648648648648648 and parameters: {'criterion': 'gini', 'n_estimators': 172, 'max_features': 0.1353273429252359, 'max_depth': 55, 'min_samples_split': 10, 'min_samples_leaf': 2}. Best is trial 73 with value: 0.8869565217391304.
[32m[I 2023-04-26 00:18:38,344][39m Trial 95 finished with value: 0.8468468468468469 and parameters: {'criterion': 'entropy', 'n_estimators': 139, 'max_features': 0.1750273155128907, 'max_depth': 33, 'min_samples_split': 9, 'min_samples_leaf': 3}. Best is trial 73 with value: 0.8869565217391304.
[32m[I 2023-04-26 00:18:38,400][39m Trial 96 finished with value: 0.8648648648648648 and parameters: {'criterion': 'entropy', 'n_estimators': 71, 'max_features': 0.08238360761294153, 'max_depth': 52, 'min_samples_split': 8, 'min_samples_leaf': 3}. Best is trial 73 with value: 0.8869565217391304.
[32m[I 2023-04-26 00:18:38,466][39m Trial 97 finished with value: 0.8288288288288289 and parameters: {'criterion': 'gini', 'n_estimators': 81, 'max_features': 0.2536422639524806, 'max_depth': 40, 'min_samples_split': 7, 'min_samples_leaf': 3}. Best is trial 73 with value: 0.8869565217391304.
[32m[I 2023-04-26 00:18:38,567][39m Trial 98 finished with value: 0.8363636363636363 and parameters: {'criterion': 'entropy', 'n_estimators': 123, 'max_features': 0.5283314655996586, 'max_depth': 28, 'min_samples_split': 7, 'min_samples_leaf': 2}. Best is trial 73 with value: 0.8869565217391304.
[32m[I 2023-04-26 00:18:38,630][39m Trial 99 finished with value: 0.8596491228070176 and parameters: {'criterion': 'gini', 'n_estimators': 78, 'max_features': 0.022442227101834283, 'max_depth': 37, 'min_samples_split': 9, 'min_samples_leaf': 1}. Best is trial 73 with value: 0.8869565217391304.
[32m[I 2023-04-26 00:18:38,716][39m Trial 100 finished with value: 0.8333333333333334 and parameters: {'criterion': 'entropy', 'n_estimators': 118, 'max_features': 0.048977727267576016, 'max_depth': 43, 'min_samples_split': 8, 'min_samples_leaf': 3}. Best is trial 73 with value: 0.8869565217391304.
[32m[I 2023-04-26 00:18:38,798][39m Trial 101 finished with value: 0.8596491228070176 and parameters: {'criterion': 'entropy', 'n_estimators': 106, 'max_features': 0.18934289899174087, 'max_depth': 47, 'min_samples_split': 8, 'min_samples_leaf': 3}. Best is trial 73 with value: 0.8869565217391304.
[32m[I 2023-04-26 00:18:38,898][39m Trial 102 finished with value: 0.8468468468468469 and parameters: {'criterion': 'entropy', 'n_estimators': 131, 'max_features': 0.2253760153400457, 'max_depth': 30, 'min_samples_split': 9, 'min_samples_leaf': 2}. Best is trial 73 with value: 0.8869565217391304.
[32m[I 2023-04-26 00:18:39,013][39m Trial 103 finished with value: 0.875 and parameters: {'criterion': 'entropy', 'n_estimators': 161, 'max_features': 0.15276781197369269, 'max_depth': 8, 'min_samples_split': 3, 'min_samples_leaf': 2}. Best is trial 73 with value: 0.8869565217391304.
[32m[I 2023-04-26 00:18:39,126][39m Trial 104 finished with value: 0.8849557522123893 and parameters: {'criterion': 'entropy', 'n_estimators': 161, 'max_features': 0.13219378959445804, 'max_depth': 6, 'min_samples_split': 3, 'min_samples_leaf': 2}. Best is trial 73 with value: 0.8869565217391304.
[32m[I 2023-04-26 00:18:39,236][39m Trial 105 finished with value: 0.8545454545454546 and parameters: {'criterion': 'entropy', 'n_estimators': 158, 'max_features': 0.10999161424808404, 'max_depth': 6, 'min_samples_split': 10, 'min_samples_leaf': 1}. Best is trial 73 with value: 0.8869565217391304.
[32m[I 2023-04-26 00:18:39,346][39m Trial 106 finished with value: 0.8672566371681416 and parameters: {'criterion': 'gini', 'n_estimators': 154, 'max_features': 0.14942858971445794, 'max_depth': 7, 'min_samples_split': 3, 'min_samples_leaf': 2}. Best is trial 73 with value: 0.8869565217391304.
[32m[I 2023-04-26 00:18:39,439][39m Trial 107 finished with value: 0.7586206896551724 and parameters: {'criterion': 'entropy', 'n_estimators': 142, 'max_features': 0.11459218048728596, 'max_depth': 1, 'min_samples_split': 2, 'min_samples_leaf': 7}. Best is trial 73 with value: 0.8869565217391304.
[32m[I 2023-04-26 00:18:39,565][39m Trial 108 finished with value: 0.875 and parameters: {'criterion': 'gini', 'n_estimators': 182, 'max_features': 0.06336789178344314, 'max_depth': 77, 'min_samples_split': 2, 'min_samples_leaf': 4}. Best is trial 73 with value: 0.8869565217391304.
[32m[I 2023-04-26 00:18:39,687][39m Trial 109 finished with value: 0.8648648648648648 and parameters: {'criterion': 'gini', 'n_estimators': 176, 'max_features': 0.08541015283069936, 'max_depth': 78, 'min_samples_split': 2, 'min_samples_leaf': 4}. Best is trial 73 with value: 0.8869565217391304.
[32m[I 2023-04-26 00:18:39,802][39m Trial 110 finished with value: 0.875 and parameters: {'criterion': 'gini', 'n_estimators': 164, 'max_features': 0.007230469079402731, 'max_depth': 69, 'min_samples_split': 3, 'min_samples_leaf': 3}. Best is trial 73 with value: 0.8869565217391304.
[32m[I 2023-04-26 00:18:39,924][39m Trial 111 finished with value: 0.8620689655172413 and parameters: {'criterion': 'entropy', 'n_estimators': 164, 'max_features': 0.01787227357617122, 'max_depth': 71, 'min_samples_split': 4, 'min_samples_leaf': 2}. Best is trial 73 with value: 0.8869565217391304.
[32m[I 2023-04-26 00:18:40,035][39m Trial 112 finished with value: 0.8440366972477066 and parameters: {'criterion': 'entropy', 'n_estimators': 152, 'max_features': 0.16441720488497874, 'max_depth': 13, 'min_samples_split': 8, 'min_samples_leaf': 2}. Best is trial 73 with value: 0.8869565217391304.
[32m[I 2023-04-26 00:18:40,105][39m Trial 113 finished with value: 0.8849557522123893 and parameters: {'criterion': 'entropy', 'n_estimators': 92, 'max_features': 0.13307832845622136, 'max_depth': 25, 'min_samples_split': 8, 'min_samples_leaf': 3}. Best is trial 73 with value: 0.8869565217391304.
[32m[I 2023-04-26 00:18:40,189][39m Trial 114 finished with value: 0.8468468468468469 and parameters: {'criterion': 'entropy', 'n_estimators': 112, 'max_features': 0.1305846512945618, 'max_depth': 26, 'min_samples_split': 8, 'min_samples_leaf': 3}. Best is trial 73 with value: 0.8869565217391304.
[32m[I 2023-04-26 00:18:40,300][39m Trial 115 finished with value: 0.8672566371681416 and parameters: {'criterion': 'entropy', 'n_estimators': 144, 'max_features': 0.1469044086723774, 'max_depth': 9, 'min_samples_split': 5, 'min_samples_leaf': 3}. Best is trial 73 with value: 0.8869565217391304.
[32m[I 2023-04-26 00:18:40,373][39m Trial 116 finished with value: 0.8468468468468469 and parameters: {'criterion': 'entropy', 'n_estimators': 93, 'max_features': 0.09604018573003881, 'max_depth': 35, 'min_samples_split': 4, 'min_samples_leaf': 2}. Best is trial 73 with value: 0.8869565217391304.
[32m[I 2023-04-26 00:18:40,439][39m Trial 117 finished with value: 0.8672566371681416 and parameters: {'criterion': 'entropy', 'n_estimators': 84, 'max_features': 0.12343067010678943, 'max_depth': 22, 'min_samples_split': 7, 'min_samples_leaf': 3}. Best is trial 73 with value: 0.8869565217391304.
[32m[I 2023-04-26 00:18:40,559][39m Trial 118 finished with value: 0.8245614035087718 and parameters: {'criterion': 'entropy', 'n_estimators': 177, 'max_features': 0.06339584980287835, 'max_depth': 3, 'min_samples_split': 2, 'min_samples_leaf': 4}. Best is trial 73 with value: 0.8869565217391304.
[32m[I 2023-04-26 00:18:40,683][39m Trial 119 finished with value: 0.8495575221238938 and parameters: {'criterion': 'gini', 'n_estimators': 186, 'max_features': 0.039774466213763696, 'max_depth': 32, 'min_samples_split': 3, 'min_samples_leaf': 6}. Best is trial 73 with value: 0.8869565217391304.
[32m[I 2023-04-26 00:18:40,799][39m Trial 120 finished with value: 0.8421052631578947 and parameters: {'criterion': 'entropy', 'n_estimators': 173, 'max_features': 0.06538648169021337, 'max_depth': 4, 'min_samples_split': 3, 'min_samples_leaf': 5}. Best is trial 73 with value: 0.8869565217391304.
[32m[I 2023-04-26 00:18:40,920][39m Trial 121 finished with value: 0.8495575221238938 and parameters: {'criterion': 'entropy', 'n_estimators': 161, 'max_features': 0.16814178464005333, 'max_depth': 85, 'min_samples_split': 2, 'min_samples_leaf': 2}. Best is trial 73 with value: 0.8869565217391304.
[32m[I 2023-04-26 00:18:41,037][39m Trial 122 finished with value: 0.875 and parameters: {'criterion': 'entropy', 'n_estimators': 162, 'max_features': 0.0009217979515978858, 'max_depth': 73, 'min_samples_split': 3, 'min_samples_leaf': 3}. Best is trial 73 with value: 0.8869565217391304.
[32m[I 2023-04-26 00:18:41,111][39m Trial 123 finished with value: 0.8495575221238938 and parameters: {'criterion': 'entropy', 'n_estimators': 90, 'max_features': 0.2283827668800163, 'max_depth': 75, 'min_samples_split': 8, 'min_samples_leaf': 3}. Best is trial 73 with value: 0.8869565217391304.
[32m[I 2023-04-26 00:18:41,206][39m Trial 124 finished with value: 0.8648648648648648 and parameters: {'criterion': 'entropy', 'n_estimators': 126, 'max_features': 0.20738978713312678, 'max_depth': 17, 'min_samples_split': 8, 'min_samples_leaf': 2}. Best is trial 73 with value: 0.8869565217391304.
[32m[I 2023-04-26 00:18:41,338][39m Trial 125 finished with value: 0.831858407079646 and parameters: {'criterion': 'gini', 'n_estimators': 185, 'max_features': 0.18608130092984237, 'max_depth': 63, 'min_samples_split': 3, 'min_samples_leaf': 4}. Best is trial 73 with value: 0.8869565217391304.
[32m[I 2023-04-26 00:18:41,467][39m Trial 126 finished with value: 0.875 and parameters: {'criterion': 'gini', 'n_estimators': 169, 'max_features': 0.10907093764570203, 'max_depth': 90, 'min_samples_split': 3, 'min_samples_leaf': 3}. Best is trial 73 with value: 0.8869565217391304.
[32m[I 2023-04-26 00:18:41,585][39m Trial 127 finished with value: 0.8596491228070176 and parameters: {'criterion': 'entropy', 'n_estimators': 167, 'max_features': 0.03642734897698876, 'max_depth': 91, 'min_samples_split': 3, 'min_samples_leaf': 3}. Best is trial 73 with value: 0.8869565217391304.
[32m[I 2023-04-26 00:18:41,662][39m Trial 128 finished with value: 0.8571428571428572 and parameters: {'criterion': 'entropy', 'n_estimators': 101, 'max_features': 0.1350448563570567, 'max_depth': 25, 'min_samples_split': 8, 'min_samples_leaf': 2}. Best is trial 73 with value: 0.8869565217391304.
[32m[I 2023-04-26 00:18:41,787][39m Trial 129 finished with value: 0.8288288288288289 and parameters: {'criterion': 'entropy', 'n_estimators': 147, 'max_features': 0.6765058191405344, 'max_depth': 28, 'min_samples_split': 6, 'min_samples_leaf': 1}. Best is trial 73 with value: 0.8869565217391304.
[32m[I 2023-04-26 00:18:41,866][39m Trial 130 finished with value: 0.8392857142857144 and parameters: {'criterion': 'gini', 'n_estimators': 120, 'max_features': 0.08019957898660685, 'max_depth': 68, 'min_samples_split': 2, 'min_samples_leaf': 4}. Best is trial 73 with value: 0.8869565217391304.
[32m[I 2023-04-26 00:18:41,987][39m Trial 131 finished with value: 0.8571428571428572 and parameters: {'criterion': 'gini', 'n_estimators': 163, 'max_features': 0.02258091022407853, 'max_depth': 56, 'min_samples_split': 3, 'min_samples_leaf': 3}. Best is trial 73 with value: 0.8869565217391304.
[32m[I 2023-04-26 00:18:42,111][39m Trial 132 finished with value: 0.8545454545454546 and parameters: {'criterion': 'entropy', 'n_estimators': 180, 'max_features': 0.05906345117097904, 'max_depth': 11, 'min_samples_split': 11, 'min_samples_leaf': 2}. Best is trial 73 with value: 0.8869565217391304.
[32m[I 2023-04-26 00:18:42,185][39m Trial 133 finished with value: 0.8495575221238938 and parameters: {'criterion': 'entropy', 'n_estimators': 95, 'max_features': 0.15955383484946645, 'max_depth': 9, 'min_samples_split': 4, 'min_samples_leaf': 2}. Best is trial 73 with value: 0.8869565217391304.
[32m[I 2023-04-26 00:18:42,269][39m Trial 134 finished with value: 0.8468468468468469 and parameters: {'criterion': 'gini', 'n_estimators': 116, 'max_features': 0.19411832217649955, 'max_depth': 42, 'min_samples_split': 4, 'min_samples_leaf': 2}. Best is trial 73 with value: 0.8869565217391304.
[32m[I 2023-04-26 00:18:42,406][39m Trial 135 finished with value: 0.8648648648648648 and parameters: {'criterion': 'gini', 'n_estimators': 200, 'max_features': 0.0021251196248760207, 'max_depth': 74, 'min_samples_split': 9, 'min_samples_leaf': 3}. Best is trial 73 with value: 0.8869565217391304.
[32m[I 2023-04-26 00:18:42,488][39m Trial 136 finished with value: 0.8672566371681416 and parameters: {'criterion': 'entropy', 'n_estimators': 110, 'max_features': 0.09353702962062607, 'max_depth': 77, 'min_samples_split': 9, 'min_samples_leaf': 3}. Best is trial 73 with value: 0.8869565217391304.
[32m[I 2023-04-26 00:18:42,536][39m Trial 137 finished with value: 0.864406779661017 and parameters: {'criterion': 'gini', 'n_estimators': 56, 'max_features': 0.10548451299731167, 'max_depth': 80, 'min_samples_split': 2, 'min_samples_leaf': 3}. Best is trial 73 with value: 0.8869565217391304.
[32m[I 2023-04-26 00:18:42,610][39m Trial 138 finished with value: 0.8648648648648648 and parameters: {'criterion': 'entropy', 'n_estimators': 106, 'max_features': 0.11777158371848333, 'max_depth': 99, 'min_samples_split': 7, 'min_samples_leaf': 4}. Best is trial 73 with value: 0.8869565217391304.
[32m[I 2023-04-26 00:18:42,686][39m Trial 139 finished with value: 0.8771929824561403 and parameters: {'criterion': 'entropy', 'n_estimators': 99, 'max_features': 0.13741115629252296, 'max_depth': 20, 'min_samples_split': 9, 'min_samples_leaf': 1}. Best is trial 73 with value: 0.8869565217391304.
[32m[I 2023-04-26 00:18:42,829][39m Trial 140 finished with value: 0.875 and parameters: {'criterion': 'gini', 'n_estimators': 193, 'max_features': 0.21100678221399777, 'max_depth': 49, 'min_samples_split': 9, 'min_samples_leaf': 1}. Best is trial 73 with value: 0.8869565217391304.
[32m[I 2023-04-26 00:18:42,971][39m Trial 141 finished with value: 0.8571428571428572 and parameters: {'criterion': 'entropy', 'n_estimators': 193, 'max_features': 0.21822412958181517, 'max_depth': 21, 'min_samples_split': 9, 'min_samples_leaf': 1}. Best is trial 73 with value: 0.8869565217391304.
[32m[I 2023-04-26 00:18:43,089][39m Trial 142 finished with value: 0.8672566371681416 and parameters: {'criterion': 'entropy', 'n_estimators': 156, 'max_features': 0.15197724152120204, 'max_depth': 39, 'min_samples_split': 5, 'min_samples_leaf': 2}. Best is trial 73 with value: 0.8869565217391304.
[32m[I 2023-04-26 00:18:43,215][39m Trial 143 finished with value: 0.8596491228070176 and parameters: {'criterion': 'entropy', 'n_estimators': 168, 'max_features': 0.045270712692842455, 'max_depth': 93, 'min_samples_split': 3, 'min_samples_leaf': 3}. Best is trial 73 with value: 0.8869565217391304.
[32m[I 2023-04-26 00:18:43,336][39m Trial 144 finished with value: 0.8448275862068967 and parameters: {'criterion': 'entropy', 'n_estimators': 159, 'max_features': 0.012266835873014532, 'max_depth': 69, 'min_samples_split': 3, 'min_samples_leaf': 1}. Best is trial 73 with value: 0.8869565217391304.
[32m[I 2023-04-26 00:18:43,457][39m Trial 145 finished with value: 0.8468468468468469 and parameters: {'criterion': 'gini', 'n_estimators': 171, 'max_features': 0.1305131251256895, 'max_depth': 66, 'min_samples_split': 10, 'min_samples_leaf': 3}. Best is trial 73 with value: 0.8869565217391304.
