[32m[I 2023-04-26 00:19:08,595][39m Trial 438 finished with value: 0.8771929824561403 and parameters: {'criterion': 'entropy', 'n_estimators': 133, 'max_features': 0.13298677865645425, 'max_depth': 46, 'min_samples_split': 9, 'min_samples_leaf': 1}. Best is trial 303 with value: 0.8947368421052632.
[32m[I 2023-04-26 00:19:08,688][39m Trial 439 finished with value: 0.8571428571428572 and parameters: {'criterion': 'entropy', 'n_estimators': 119, 'max_features': 0.09009765534823112, 'max_depth': 34, 'min_samples_split': 9, 'min_samples_leaf': 2}. Best is trial 303 with value: 0.8947368421052632.
[32m[I 2023-04-26 00:19:08,787][39m Trial 440 finished with value: 0.875 and parameters: {'criterion': 'entropy', 'n_estimators': 125, 'max_features': 0.20715909355680187, 'max_depth': 20, 'min_samples_split': 4, 'min_samples_leaf': 4}. Best is trial 303 with value: 0.8947368421052632.
[32m[I 2023-04-26 00:19:08,868][39m Trial 441 finished with value: 0.8571428571428572 and parameters: {'criterion': 'gini', 'n_estimators': 96, 'max_features': 0.1691916186574316, 'max_depth': 29, 'min_samples_split': 7, 'min_samples_leaf': 1}. Best is trial 303 with value: 0.8947368421052632.
[32m[I 2023-04-26 00:19:08,940][39m Trial 442 finished with value: 0.8363636363636363 and parameters: {'criterion': 'entropy', 'n_estimators': 79, 'max_features': 0.19484465801385528, 'max_depth': 8, 'min_samples_split': 9, 'min_samples_leaf': 2}. Best is trial 303 with value: 0.8947368421052632.
[32m[I 2023-04-26 00:19:09,044][39m Trial 443 finished with value: 0.8695652173913043 and parameters: {'criterion': 'entropy', 'n_estimators': 129, 'max_features': 0.15008253226631696, 'max_depth': 48, 'min_samples_split': 9, 'min_samples_leaf': 2}. Best is trial 303 with value: 0.8947368421052632.
[32m[I 2023-04-26 00:19:09,139][39m Trial 444 finished with value: 0.8545454545454546 and parameters: {'criterion': 'entropy', 'n_estimators': 117, 'max_features': 0.24638271028905387, 'max_depth': 41, 'min_samples_split': 9, 'min_samples_leaf': 3}. Best is trial 303 with value: 0.8947368421052632.
[32m[I 2023-04-26 00:19:09,209][39m Trial 445 finished with value: 0.8648648648648648 and parameters: {'criterion': 'entropy', 'n_estimators': 81, 'max_features': 0.12907498388808503, 'max_depth': 39, 'min_samples_split': 9, 'min_samples_leaf': 2}. Best is trial 303 with value: 0.8947368421052632.
[32m[I 2023-04-26 00:19:09,306][39m Trial 446 finished with value: 0.8495575221238938 and parameters: {'criterion': 'gini', 'n_estimators': 121, 'max_features': 0.10734672926463157, 'max_depth': 17, 'min_samples_split': 5, 'min_samples_leaf': 1}. Best is trial 303 with value: 0.8947368421052632.
[32m[I 2023-04-26 00:19:09,392][39m Trial 447 finished with value: 0.8596491228070176 and parameters: {'criterion': 'entropy', 'n_estimators': 104, 'max_features': 0.18416938800087124, 'max_depth': 24, 'min_samples_split': 8, 'min_samples_leaf': 1}. Best is trial 303 with value: 0.8947368421052632.
[32m[I 2023-04-26 00:19:09,466][39m Trial 448 finished with value: 0.8067226890756303 and parameters: {'criterion': 'entropy', 'n_estimators': 91, 'max_features': 0.21915612819530952, 'max_depth': 2, 'min_samples_split': 8, 'min_samples_leaf': 1}. Best is trial 303 with value: 0.8947368421052632.
[32m[I 2023-04-26 00:19:09,558][39m Trial 449 finished with value: 0.8672566371681416 and parameters: {'criterion': 'entropy', 'n_estimators': 112, 'max_features': 0.253064148875905, 'max_depth': 6, 'min_samples_split': 7, 'min_samples_leaf': 1}. Best is trial 303 with value: 0.8947368421052632.
[32m[I 2023-04-26 00:19:09,651][39m Trial 450 finished with value: 0.8256880733944953 and parameters: {'criterion': 'gini', 'n_estimators': 108, 'max_features': 0.5689112695639756, 'max_depth': 35, 'min_samples_split': 8, 'min_samples_leaf': 2}. Best is trial 303 with value: 0.8947368421052632.
[32m[I 2023-04-26 00:19:09,738][39m Trial 451 finished with value: 0.8571428571428572 and parameters: {'criterion': 'entropy', 'n_estimators': 107, 'max_features': 0.1652286737032062, 'max_depth': 28, 'min_samples_split': 8, 'min_samples_leaf': 5}. Best is trial 303 with value: 0.8947368421052632.
[32m[I 2023-04-26 00:19:09,840][39m Trial 452 finished with value: 0.875 and parameters: {'criterion': 'entropy', 'n_estimators': 123, 'max_features': 0.19064875174452892, 'max_depth': 23, 'min_samples_split': 8, 'min_samples_leaf': 2}. Best is trial 303 with value: 0.8947368421052632.
[32m[I 2023-04-26 00:19:09,906][39m Trial 453 finished with value: 0.8495575221238938 and parameters: {'criterion': 'entropy', 'n_estimators': 75, 'max_features': 0.06721983455456236, 'max_depth': 43, 'min_samples_split': 9, 'min_samples_leaf': 1}. Best is trial 303 with value: 0.8947368421052632.
[32m[I 2023-04-26 00:19:09,999][39m Trial 454 finished with value: 0.8648648648648648 and parameters: {'criterion': 'gini', 'n_estimators': 114, 'max_features': 0.14489169599211243, 'max_depth': 12, 'min_samples_split': 10, 'min_samples_leaf': 3}. Best is trial 303 with value: 0.8947368421052632.
[32m[I 2023-04-26 00:19:10,084][39m Trial 455 finished with value: 0.8771929824561403 and parameters: {'criterion': 'entropy', 'n_estimators': 102, 'max_features': 0.16234674300159677, 'max_depth': 33, 'min_samples_split': 9, 'min_samples_leaf': 2}. Best is trial 303 with value: 0.8947368421052632.
[32m[I 2023-04-26 00:19:10,158][39m Trial 456 finished with value: 0.8648648648648648 and parameters: {'criterion': 'entropy', 'n_estimators': 85, 'max_features': 0.21017812316510154, 'max_depth': 37, 'min_samples_split': 9, 'min_samples_leaf': 1}. Best is trial 303 with value: 0.8947368421052632.
[32m[I 2023-04-26 00:19:10,236][39m Trial 457 finished with value: 0.8392857142857144 and parameters: {'criterion': 'entropy', 'n_estimators': 88, 'max_features': 0.2292722853062311, 'max_depth': 25, 'min_samples_split': 8, 'min_samples_leaf': 1}. Best is trial 303 with value: 0.8947368421052632.
[32m[I 2023-04-26 00:19:10,306][39m Trial 458 finished with value: 0.875 and parameters: {'criterion': 'entropy', 'n_estimators': 81, 'max_features': 0.12325539839848662, 'max_depth': 9, 'min_samples_split': 9, 'min_samples_leaf': 2}. Best is trial 303 with value: 0.8947368421052632.
[32m[I 2023-04-26 00:19:10,421][39m Trial 459 finished with value: 0.8571428571428572 and parameters: {'criterion': 'gini', 'n_estimators': 151, 'max_features': 0.14671944193259662, 'max_depth': 47, 'min_samples_split': 9, 'min_samples_leaf': 2}. Best is trial 303 with value: 0.8947368421052632.
[32m[I 2023-04-26 00:19:10,510][39m Trial 460 finished with value: 0.8392857142857144 and parameters: {'criterion': 'entropy', 'n_estimators': 116, 'max_features': 0.038164192460805484, 'max_depth': 4, 'min_samples_split': 9, 'min_samples_leaf': 6}. Best is trial 303 with value: 0.8947368421052632.
[32m[I 2023-04-26 00:19:10,608][39m Trial 461 finished with value: 0.8695652173913043 and parameters: {'criterion': 'entropy', 'n_estimators': 131, 'max_features': 0.16658372574831, 'max_depth': 15, 'min_samples_split': 9, 'min_samples_leaf': 2}. Best is trial 303 with value: 0.8947368421052632.
[32m[I 2023-04-26 00:19:10,686][39m Trial 462 finished with value: 0.8672566371681416 and parameters: {'criterion': 'entropy', 'n_estimators': 85, 'max_features': 0.09379008358481768, 'max_depth': 41, 'min_samples_split': 8, 'min_samples_leaf': 1}. Best is trial 303 with value: 0.8947368421052632.
[32m[I 2023-04-26 00:19:10,753][39m Trial 463 finished with value: 0.8596491228070176 and parameters: {'criterion': 'gini', 'n_estimators': 77, 'max_features': 0.13200400370533544, 'max_depth': 44, 'min_samples_split': 9, 'min_samples_leaf': 2}. Best is trial 303 with value: 0.8947368421052632.
[32m[I 2023-04-26 00:19:10,830][39m Trial 464 finished with value: 0.8648648648648648 and parameters: {'criterion': 'entropy', 'n_estimators': 93, 'max_features': 0.2228656332642992, 'max_depth': 20, 'min_samples_split': 8, 'min_samples_leaf': 1}. Best is trial 303 with value: 0.8947368421052632.
[32m[I 2023-04-26 00:19:10,938][39m Trial 465 finished with value: 0.8695652173913043 and parameters: {'criterion': 'entropy', 'n_estimators': 126, 'max_features': 0.1785982262125659, 'max_depth': 39, 'min_samples_split': 9, 'min_samples_leaf': 3}. Best is trial 303 with value: 0.8947368421052632.
[32m[I 2023-04-26 00:19:11,022][39m Trial 466 finished with value: 0.7735849056603773 and parameters: {'criterion': 'entropy', 'n_estimators': 89, 'max_features': 0.6551638826325169, 'max_depth': 5, 'min_samples_split': 6, 'min_samples_leaf': 1}. Best is trial 303 with value: 0.8947368421052632.
[32m[I 2023-04-26 00:19:11,105][39m Trial 467 finished with value: 0.8545454545454546 and parameters: {'criterion': 'gini', 'n_estimators': 99, 'max_features': 0.20070512731204318, 'max_depth': 27, 'min_samples_split': 8, 'min_samples_leaf': 4}. Best is trial 303 with value: 0.8947368421052632.
[32m[I 2023-04-26 00:19:11,213][39m Trial 468 finished with value: 0.8648648648648648 and parameters: {'criterion': 'entropy', 'n_estimators': 141, 'max_features': 0.11138779690051454, 'max_depth': 7, 'min_samples_split': 7, 'min_samples_leaf': 2}. Best is trial 303 with value: 0.8947368421052632.
[32m[I 2023-04-26 00:19:11,286][39m Trial 469 finished with value: 0.8571428571428572 and parameters: {'criterion': 'entropy', 'n_estimators': 83, 'max_features': 0.07906866809335691, 'max_depth': 57, 'min_samples_split': 10, 'min_samples_leaf': 1}. Best is trial 303 with value: 0.8947368421052632.
[32m[I 2023-04-26 00:19:11,382][39m Trial 470 finished with value: 0.8440366972477066 and parameters: {'criterion': 'entropy', 'n_estimators': 111, 'max_features': 0.26538431885586106, 'max_depth': 49, 'min_samples_split': 9, 'min_samples_leaf': 1}. Best is trial 303 with value: 0.8947368421052632.
[32m[I 2023-04-26 00:19:11,468][39m Trial 471 finished with value: 0.8869565217391304 and parameters: {'criterion': 'gini', 'n_estimators': 94, 'max_features': 0.18611746647241278, 'max_depth': 31, 'min_samples_split': 8, 'min_samples_leaf': 1}. Best is trial 303 with value: 0.8947368421052632.
[32m[I 2023-04-26 00:19:11,547][39m Trial 472 finished with value: 0.8672566371681416 and parameters: {'criterion': 'gini', 'n_estimators': 94, 'max_features': 0.1861602109651504, 'max_depth': 31, 'min_samples_split': 9, 'min_samples_leaf': 2}. Best is trial 303 with value: 0.8947368421052632.
[32m[I 2023-04-26 00:19:11,625][39m Trial 473 finished with value: 0.8672566371681416 and parameters: {'criterion': 'gini', 'n_estimators': 87, 'max_features': 0.20867056682978732, 'max_depth': 34, 'min_samples_split': 8, 'min_samples_leaf': 1}. Best is trial 303 with value: 0.8947368421052632.
[32m[I 2023-04-26 00:19:11,705][39m Trial 474 finished with value: 0.875 and parameters: {'criterion': 'gini', 'n_estimators': 96, 'max_features': 0.19516577605906918, 'max_depth': 33, 'min_samples_split': 8, 'min_samples_leaf': 1}. Best is trial 303 with value: 0.8947368421052632.
[32m[I 2023-04-26 00:19:11,786][39m Trial 475 finished with value: 0.8468468468468469 and parameters: {'criterion': 'gini', 'n_estimators': 91, 'max_features': 0.17889309005488382, 'max_depth': 29, 'min_samples_split': 8, 'min_samples_leaf': 1}. Best is trial 303 with value: 0.8947368421052632.
[32m[I 2023-04-26 00:19:11,865][39m Trial 476 finished with value: 0.8495575221238938 and parameters: {'criterion': 'gini', 'n_estimators': 97, 'max_features': 0.17196593551271658, 'max_depth': 31, 'min_samples_split': 8, 'min_samples_leaf': 2}. Best is trial 303 with value: 0.8947368421052632.
[32m[I 2023-04-26 00:19:11,954][39m Trial 477 finished with value: 0.8392857142857144 and parameters: {'criterion': 'gini', 'n_estimators': 103, 'max_features': 0.1597629427486926, 'max_depth': 37, 'min_samples_split': 8, 'min_samples_leaf': 4}. Best is trial 303 with value: 0.8947368421052632.
[32m[I 2023-04-26 00:19:12,052][39m Trial 478 finished with value: 0.875 and parameters: {'criterion': 'gini', 'n_estimators': 121, 'max_features': 0.1472733372435672, 'max_depth': 31, 'min_samples_split': 8, 'min_samples_leaf': 3}. Best is trial 303 with value: 0.8947368421052632.
[32m[I 2023-04-26 00:19:12,136][39m Trial 479 finished with value: 0.875 and parameters: {'criterion': 'gini', 'n_estimators': 100, 'max_features': 0.17583944492253634, 'max_depth': 32, 'min_samples_split': 7, 'min_samples_leaf': 2}. Best is trial 303 with value: 0.8947368421052632.
[32m[I 2023-04-26 00:19:12,244][39m Trial 480 finished with value: 0.8571428571428572 and parameters: {'criterion': 'gini', 'n_estimators': 135, 'max_features': 0.24399477765340624, 'max_depth': 35, 'min_samples_split': 8, 'min_samples_leaf': 1}. Best is trial 303 with value: 0.8947368421052632.
[32m[I 2023-04-26 00:19:12,321][39m Trial 481 finished with value: 0.8495575221238938 and parameters: {'criterion': 'gini', 'n_estimators': 91, 'max_features': 0.20572067761266, 'max_depth': 18, 'min_samples_split': 8, 'min_samples_leaf': 1}. Best is trial 303 with value: 0.8947368421052632.
[32m[I 2023-04-26 00:19:12,419][39m Trial 482 finished with value: 0.8392857142857144 and parameters: {'criterion': 'gini', 'n_estimators': 117, 'max_features': 0.29079680758786236, 'max_depth': 13, 'min_samples_split': 8, 'min_samples_leaf': 1}. Best is trial 303 with value: 0.8947368421052632.
[32m[I 2023-04-26 00:19:12,510][39m Trial 483 finished with value: 0.8135593220338982 and parameters: {'criterion': 'gini', 'n_estimators': 119, 'max_features': 0.23273537118219864, 'max_depth': 3, 'min_samples_split': 6, 'min_samples_leaf': 1}. Best is trial 303 with value: 0.8947368421052632.
[32m[I 2023-04-26 00:19:12,580][39m Trial 484 finished with value: 0.8596491228070176 and parameters: {'criterion': 'entropy', 'n_estimators': 79, 'max_features': 0.12591565193171575, 'max_depth': 42, 'min_samples_split': 9, 'min_samples_leaf': 2}. Best is trial 303 with value: 0.8947368421052632.
[32m[I 2023-04-26 00:19:12,723][39m Trial 485 finished with value: 0.8363636363636363 and parameters: {'criterion': 'entropy', 'n_estimators': 201, 'max_features': 0.21067309174815163, 'max_depth': 7, 'min_samples_split': 8, 'min_samples_leaf': 6}. Best is trial 303 with value: 0.8947368421052632.
[32m[I 2023-04-26 00:19:12,823][39m Trial 486 finished with value: 0.8545454545454546 and parameters: {'criterion': 'gini', 'n_estimators': 124, 'max_features': 0.15789522930415795, 'max_depth': 27, 'min_samples_split': 8, 'min_samples_leaf': 2}. Best is trial 303 with value: 0.8947368421052632.
[32m[I 2023-04-26 00:19:12,925][39m Trial 487 finished with value: 0.8849557522123893 and parameters: {'criterion': 'entropy', 'n_estimators': 128, 'max_features': 0.10514908435761952, 'max_depth': 45, 'min_samples_split': 9, 'min_samples_leaf': 3}. Best is trial 303 with value: 0.8947368421052632.
[32m[I 2023-04-26 00:19:13,028][39m Trial 488 finished with value: 0.8828828828828829 and parameters: {'criterion': 'entropy', 'n_estimators': 131, 'max_features': 0.04738143294499591, 'max_depth': 54, 'min_samples_split': 9, 'min_samples_leaf': 3}. Best is trial 303 with value: 0.8947368421052632.
[32m[I 2023-04-26 00:19:13,143][39m Trial 489 finished with value: 0.875 and parameters: {'criterion': 'entropy', 'n_estimators': 128, 'max_features': 0.07066268254869827, 'max_depth': 10, 'min_samples_split': 4, 'min_samples_leaf': 3}. Best is trial 303 with value: 0.8947368421052632.
[32m[I 2023-04-26 00:19:13,240][39m Trial 490 finished with value: 0.8545454545454546 and parameters: {'criterion': 'gini', 'n_estimators': 127, 'max_features': 0.09940976438894539, 'max_depth': 47, 'min_samples_split': 9, 'min_samples_leaf': 3}. Best is trial 303 with value: 0.8947368421052632.
[32m[I 2023-04-26 00:19:13,343][39m Trial 491 finished with value: 0.8648648648648648 and parameters: {'criterion': 'entropy', 'n_estimators': 133, 'max_features': 0.02380361658799391, 'max_depth': 59, 'min_samples_split': 9, 'min_samples_leaf': 3}. Best is trial 303 with value: 0.8947368421052632.
[32m[I 2023-04-26 00:19:13,442][39m Trial 492 finished with value: 0.8672566371681416 and parameters: {'criterion': 'entropy', 'n_estimators': 128, 'max_features': 0.08093584436131546, 'max_depth': 55, 'min_samples_split': 9, 'min_samples_leaf': 3}. Best is trial 303 with value: 0.8947368421052632.
[32m[I 2023-04-26 00:19:13,541][39m Trial 493 finished with value: 0.8545454545454546 and parameters: {'criterion': 'entropy', 'n_estimators': 122, 'max_features': 0.09904870693774163, 'max_depth': 46, 'min_samples_split': 10, 'min_samples_leaf': 3}. Best is trial 303 with value: 0.8947368421052632.
[32m[I 2023-04-26 00:19:13,638][39m Trial 494 finished with value: 0.8672566371681416 and parameters: {'criterion': 'gini', 'n_estimators': 125, 'max_features': 0.12583692167028565, 'max_depth': 44, 'min_samples_split': 7, 'min_samples_leaf': 3}. Best is trial 303 with value: 0.8947368421052632.
[32m[I 2023-04-26 00:19:13,745][39m Trial 495 finished with value: 0.8672566371681416 and parameters: {'criterion': 'entropy', 'n_estimators': 130, 'max_features': 0.1384925196495848, 'max_depth': 38, 'min_samples_split': 5, 'min_samples_leaf': 3}. Best is trial 303 with value: 0.8947368421052632.
[32m[I 2023-04-26 00:19:13,847][39m Trial 496 finished with value: 0.8363636363636363 and parameters: {'criterion': 'entropy', 'n_estimators': 123, 'max_features': 0.053810337473213746, 'max_depth': 50, 'min_samples_split': 9, 'min_samples_leaf': 4}. Best is trial 303 with value: 0.8947368421052632.
[32m[I 2023-04-26 00:19:13,954][39m Trial 497 finished with value: 0.8648648648648648 and parameters: {'criterion': 'entropy', 'n_estimators': 131, 'max_features': 0.0506285785466608, 'max_depth': 49, 'min_samples_split': 9, 'min_samples_leaf': 3}. Best is trial 303 with value: 0.8947368421052632.
Number of finished trials: 500
[32m[I 2023-04-26 00:19:14,059][39m Trial 498 finished with value: 0.8363636363636363 and parameters: {'criterion': 'entropy', 'n_estimators': 131, 'max_features': 0.04215092917908825, 'max_depth': 53, 'min_samples_split': 9, 'min_samples_leaf': 3}. Best is trial 303 with value: 0.8947368421052632.
[32m[I 2023-04-26 00:19:14,167][39m Trial 499 finished with value: 0.8648648648648648 and parameters: {'criterion': 'gini', 'n_estimators': 139, 'max_features': 0.005961693916887681, 'max_depth': 53, 'min_samples_split': 9, 'min_samples_leaf': 3}. Best is trial 303 with value: 0.8947368421052632.