[32m[I 2023-04-26 00:18:29,997][39m A new study created in memory with name: no-name-e4b789a8-09e2-4330-8ffd-6fadee88b6df
[32m[I 2023-04-26 00:18:30,118][39m Trial 0 finished with value: 0.8141592920353982 and parameters: {'criterion': 'entropy', 'n_estimators': 147, 'max_features': 0.5714941345743346, 'max_depth': 29, 'min_samples_split': 11, 'min_samples_leaf': 7}. Best is trial 0 with value: 0.8141592920353982.
[32m[I 2023-04-26 00:18:30,204][39m Trial 1 finished with value: 0.8288288288288289 and parameters: {'criterion': 'entropy', 'n_estimators': 120, 'max_features': 0.4403205498204421, 'max_depth': 54, 'min_samples_split': 9, 'min_samples_leaf': 5}. Best is trial 1 with value: 0.8288288288288289.
[32m[I 2023-04-26 00:18:30,316][39m Trial 2 finished with value: 0.8214285714285715 and parameters: {'criterion': 'gini', 'n_estimators': 170, 'max_features': 0.28690780620204726, 'max_depth': 85, 'min_samples_split': 6, 'min_samples_leaf': 11}. Best is trial 1 with value: 0.8288288288288289.
[32m[I 2023-04-26 00:18:30,355][39m Trial 3 finished with value: 0.8288288288288289 and parameters: {'criterion': 'gini', 'n_estimators': 52, 'max_features': 0.41335752690123495, 'max_depth': 12, 'min_samples_split': 7, 'min_samples_leaf': 1}. Best is trial 1 with value: 0.8288288288288289.
[32m[I 2023-04-26 00:18:30,436][39m Trial 4 finished with value: 0.8440366972477066 and parameters: {'criterion': 'entropy', 'n_estimators': 105, 'max_features': 0.531316547275288, 'max_depth': 88, 'min_samples_split': 9, 'min_samples_leaf': 1}. Best is trial 4 with value: 0.8440366972477066.
[32m[I 2023-04-26 00:18:30,543][39m Trial 5 finished with value: 0.8108108108108107 and parameters: {'criterion': 'gini', 'n_estimators': 145, 'max_features': 0.7010581850941343, 'max_depth': 82, 'min_samples_split': 7, 'min_samples_leaf': 5}. Best is trial 4 with value: 0.8440366972477066.
[32m[I 2023-04-26 00:18:30,615][39m Trial 6 finished with value: 0.8 and parameters: {'criterion': 'gini', 'n_estimators': 91, 'max_features': 0.8636708145425219, 'max_depth': 87, 'min_samples_split': 6, 'min_samples_leaf': 4}. Best is trial 4 with value: 0.8440366972477066.
[32m[I 2023-04-26 00:18:30,686][39m Trial 7 finished with value: 0.8108108108108107 and parameters: {'criterion': 'entropy', 'n_estimators': 92, 'max_features': 0.8421412089537035, 'max_depth': 5, 'min_samples_split': 6, 'min_samples_leaf': 8}. Best is trial 4 with value: 0.8440366972477066.
[32m[I 2023-04-26 00:18:30,808][39m Trial 8 finished with value: 0.8108108108108107 and parameters: {'criterion': 'gini', 'n_estimators': 163, 'max_features': 0.8714973959781138, 'max_depth': 75, 'min_samples_split': 5, 'min_samples_leaf': 7}. Best is trial 4 with value: 0.8440366972477066.
[32m[I 2023-04-26 00:18:30,868][39m Trial 9 finished with value: 0.8108108108108107 and parameters: {'criterion': 'gini', 'n_estimators': 80, 'max_features': 0.7404023146382265, 'max_depth': 95, 'min_samples_split': 11, 'min_samples_leaf': 11}. Best is trial 4 with value: 0.8440366972477066.
[32m[I 2023-04-26 00:18:31,010][39m Trial 10 finished with value: 0.8421052631578947 and parameters: {'criterion': 'entropy', 'n_estimators': 199, 'max_features': 0.00586534962901436, 'max_depth': 61, 'min_samples_split': 3, 'min_samples_leaf': 1}. Best is trial 4 with value: 0.8440366972477066.
[32m[I 2023-04-26 00:18:31,155][39m Trial 11 finished with value: 0.8421052631578947 and parameters: {'criterion': 'entropy', 'n_estimators': 191, 'max_features': 0.007722426329098919, 'max_depth': 58, 'min_samples_split': 2, 'min_samples_leaf': 1}. Best is trial 4 with value: 0.8440366972477066.
[32m[I 2023-04-26 00:18:31,245][39m Trial 12 finished with value: 0.8495575221238938 and parameters: {'criterion': 'entropy', 'n_estimators': 120, 'max_features': 0.010551660384217398, 'max_depth': 63, 'min_samples_split': 2, 'min_samples_leaf': 3}. Best is trial 12 with value: 0.8495575221238938.
[32m[I 2023-04-26 00:18:31,331][39m Trial 13 finished with value: 0.8392857142857144 and parameters: {'criterion': 'entropy', 'n_estimators': 116, 'max_features': 0.24093753895190148, 'max_depth': 70, 'min_samples_split': 9, 'min_samples_leaf': 3}. Best is trial 12 with value: 0.8495575221238938.
[32m[I 2023-04-26 00:18:31,411][39m Trial 14 finished with value: 0.8849557522123893 and parameters: {'criterion': 'entropy', 'n_estimators': 110, 'max_features': 0.20444508681226775, 'max_depth': 29, 'min_samples_split': 9, 'min_samples_leaf': 3}. Best is trial 14 with value: 0.8849557522123893.
[32m[I 2023-04-26 00:18:31,514][39m Trial 15 finished with value: 0.875 and parameters: {'criterion': 'entropy', 'n_estimators': 138, 'max_features': 0.1492552794995166, 'max_depth': 31, 'min_samples_split': 4, 'min_samples_leaf': 3}. Best is trial 14 with value: 0.8849557522123893.
[32m[I 2023-04-26 00:18:31,619][39m Trial 16 finished with value: 0.8440366972477066 and parameters: {'criterion': 'entropy', 'n_estimators': 141, 'max_features': 0.17841288519821952, 'max_depth': 34, 'min_samples_split': 4, 'min_samples_leaf': 3}. Best is trial 14 with value: 0.8849557522123893.
[32m[I 2023-04-26 00:18:31,671][39m Trial 17 finished with value: 0.8695652173913043 and parameters: {'criterion': 'entropy', 'n_estimators': 66, 'max_features': 0.14619275402967852, 'max_depth': 39, 'min_samples_split': 8, 'min_samples_leaf': 4}. Best is trial 14 with value: 0.8849557522123893.
[32m[I 2023-04-26 00:18:31,779][39m Trial 18 finished with value: 0.8363636363636363 and parameters: {'criterion': 'entropy', 'n_estimators': 135, 'max_features': 0.29767065198021686, 'max_depth': 22, 'min_samples_split': 4, 'min_samples_leaf': 2}. Best is trial 14 with value: 0.8849557522123893.
[32m[I 2023-04-26 00:18:31,893][39m Trial 19 finished with value: 0.8173913043478261 and parameters: {'criterion': 'entropy', 'n_estimators': 167, 'max_features': 0.12470986232940373, 'max_depth': 45, 'min_samples_split': 10, 'min_samples_leaf': 9}. Best is trial 14 with value: 0.8849557522123893.
[32m[I 2023-04-26 00:18:31,971][39m Trial 20 finished with value: 0.8288288288288289 and parameters: {'criterion': 'entropy', 'n_estimators': 102, 'max_features': 0.3801742441823964, 'max_depth': 19, 'min_samples_split': 4, 'min_samples_leaf': 5}. Best is trial 14 with value: 0.8849557522123893.
[32m[I 2023-04-26 00:18:32,024][39m Trial 21 finished with value: 0.8545454545454546 and parameters: {'criterion': 'entropy', 'n_estimators': 64, 'max_features': 0.13637487644111096, 'max_depth': 41, 'min_samples_split': 8, 'min_samples_leaf': 4}. Best is trial 14 with value: 0.8849557522123893.
[32m[I 2023-04-26 00:18:32,097][39m Trial 22 finished with value: 0.8256880733944953 and parameters: {'criterion': 'entropy', 'n_estimators': 76, 'max_features': 0.9986048820313036, 'max_depth': 37, 'min_samples_split': 8, 'min_samples_leaf': 4}. Best is trial 14 with value: 0.8849557522123893.
[32m[I 2023-04-26 00:18:32,139][39m Trial 23 finished with value: 0.875 and parameters: {'criterion': 'entropy', 'n_estimators': 50, 'max_features': 0.11360022668796223, 'max_depth': 27, 'min_samples_split': 8, 'min_samples_leaf': 2}. Best is trial 14 with value: 0.8849557522123893.
[32m[I 2023-04-26 00:18:32,184][39m Trial 24 finished with value: 0.8672566371681416 and parameters: {'criterion': 'entropy', 'n_estimators': 51, 'max_features': 0.09035663816713124, 'max_depth': 28, 'min_samples_split': 10, 'min_samples_leaf': 2}. Best is trial 14 with value: 0.8849557522123893.
[32m[I 2023-04-26 00:18:32,300][39m Trial 25 finished with value: 0.8672566371681416 and parameters: {'criterion': 'entropy', 'n_estimators': 157, 'max_features': 0.2545002085590781, 'max_depth': 48, 'min_samples_split': 5, 'min_samples_leaf': 2}. Best is trial 14 with value: 0.8849557522123893.
[32m[I 2023-04-26 00:18:32,399][39m Trial 26 finished with value: 0.8468468468468469 and parameters: {'criterion': 'entropy', 'n_estimators': 129, 'max_features': 0.3395041572480995, 'max_depth': 16, 'min_samples_split': 10, 'min_samples_leaf': 6}. Best is trial 14 with value: 0.8849557522123893.
[32m[I 2023-04-26 00:18:32,516][39m Trial 27 finished with value: 0.8 and parameters: {'criterion': 'entropy', 'n_estimators': 183, 'max_features': 0.20980828308420435, 'max_depth': 2, 'min_samples_split': 7, 'min_samples_leaf': 3}. Best is trial 14 with value: 0.8849557522123893.
[32m[I 2023-04-26 00:18:32,595][39m Trial 28 finished with value: 0.875 and parameters: {'criterion': 'entropy', 'n_estimators': 105, 'max_features': 0.05229000003497958, 'max_depth': 26, 'min_samples_split': 8, 'min_samples_leaf': 2}. Best is trial 14 with value: 0.8849557522123893.
[32m[I 2023-04-26 00:18:32,716][39m Trial 29 finished with value: 0.8288288288288289 and parameters: {'criterion': 'entropy', 'n_estimators': 155, 'max_features': 0.4810886607343925, 'max_depth': 11, 'min_samples_split': 11, 'min_samples_leaf': 6}. Best is trial 14 with value: 0.8849557522123893.
[32m[I 2023-04-26 00:18:32,796][39m Trial 30 finished with value: 0.8571428571428572 and parameters: {'criterion': 'entropy', 'n_estimators': 106, 'max_features': 0.07349263309657728, 'max_depth': 24, 'min_samples_split': 8, 'min_samples_leaf': 2}. Best is trial 14 with value: 0.8849557522123893.
[32m[I 2023-04-26 00:18:32,893][39m Trial 31 finished with value: 0.8672566371681416 and parameters: {'criterion': 'entropy', 'n_estimators': 132, 'max_features': 0.07093093647076654, 'max_depth': 31, 'min_samples_split': 9, 'min_samples_leaf': 2}. Best is trial 14 with value: 0.8849557522123893.
[32m[I 2023-04-26 00:18:32,978][39m Trial 32 finished with value: 0.8363636363636363 and parameters: {'criterion': 'entropy', 'n_estimators': 114, 'max_features': 0.18499188031983793, 'max_depth': 26, 'min_samples_split': 9, 'min_samples_leaf': 3}. Best is trial 14 with value: 0.8849557522123893.
[32m[I 2023-04-26 00:18:33,047][39m Trial 33 finished with value: 0.8648648648648648 and parameters: {'criterion': 'entropy', 'n_estimators': 96, 'max_features': 0.0645259331601708, 'max_depth': 32, 'min_samples_split': 7, 'min_samples_leaf': 5}. Best is trial 14 with value: 0.8849557522123893.
[32m[I 2023-04-26 00:18:33,112][39m Trial 34 finished with value: 0.8495575221238938 and parameters: {'criterion': 'entropy', 'n_estimators': 82, 'max_features': 0.28514177412821784, 'max_depth': 53, 'min_samples_split': 8, 'min_samples_leaf': 2}. Best is trial 14 with value: 0.8849557522123893.
[32m[I 2023-04-26 00:18:33,216][39m Trial 35 finished with value: 0.8468468468468469 and parameters: {'criterion': 'gini', 'n_estimators': 125, 'max_features': 0.5907355481585869, 'max_depth': 11, 'min_samples_split': 5, 'min_samples_leaf': 1}. Best is trial 14 with value: 0.8849557522123893.
[32m[I 2023-04-26 00:18:33,268][39m Trial 36 finished with value: 0.8288288288288289 and parameters: {'criterion': 'entropy', 'n_estimators': 61, 'max_features': 0.2011310651105115, 'max_depth': 44, 'min_samples_split': 7, 'min_samples_leaf': 4}. Best is trial 14 with value: 0.8849557522123893.
[32m[I 2023-04-26 00:18:33,356][39m Trial 37 finished with value: 0.8468468468468469 and parameters: {'criterion': 'gini', 'n_estimators': 112, 'max_features': 0.3435747592873871, 'max_depth': 18, 'min_samples_split': 9, 'min_samples_leaf': 3}. Best is trial 14 with value: 0.8849557522123893.
[32m[I 2023-04-26 00:18:33,457][39m Trial 38 finished with value: 0.8596491228070176 and parameters: {'criterion': 'entropy', 'n_estimators': 140, 'max_features': 0.11390141178278307, 'max_depth': 28, 'min_samples_split': 6, 'min_samples_leaf': 1}. Best is trial 14 with value: 0.8849557522123893.
[32m[I 2023-04-26 00:18:33,578][39m Trial 39 finished with value: 0.8392857142857144 and parameters: {'criterion': 'entropy', 'n_estimators': 177, 'max_features': 0.04906666283501096, 'max_depth': 36, 'min_samples_split': 10, 'min_samples_leaf': 7}. Best is trial 14 with value: 0.8849557522123893.
[32m[I 2023-04-26 00:18:33,697][39m Trial 40 finished with value: 0.8108108108108107 and parameters: {'criterion': 'gini', 'n_estimators': 150, 'max_features': 0.5865085880564569, 'max_depth': 8, 'min_samples_split': 3, 'min_samples_leaf': 5}. Best is trial 14 with value: 0.8849557522123893.
[32m[I 2023-04-26 00:18:33,752][39m Trial 41 finished with value: 0.8672566371681416 and parameters: {'criterion': 'entropy', 'n_estimators': 66, 'max_features': 0.16471659940014902, 'max_depth': 38, 'min_samples_split': 8, 'min_samples_leaf': 4}. Best is trial 14 with value: 0.8849557522123893.
[32m[I 2023-04-26 00:18:33,798][39m Trial 42 finished with value: 0.8521739130434783 and parameters: {'criterion': 'entropy', 'n_estimators': 56, 'max_features': 0.1416341191927533, 'max_depth': 41, 'min_samples_split': 8, 'min_samples_leaf': 4}. Best is trial 14 with value: 0.8849557522123893.
[32m[I 2023-04-26 00:18:33,860][39m Trial 43 finished with value: 0.8695652173913043 and parameters: {'criterion': 'entropy', 'n_estimators': 75, 'max_features': 0.2268813916716238, 'max_depth': 22, 'min_samples_split': 7, 'min_samples_leaf': 2}. Best is trial 14 with value: 0.8849557522123893.
[32m[I 2023-04-26 00:18:33,928][39m Trial 44 finished with value: 0.8288288288288289 and parameters: {'criterion': 'entropy', 'n_estimators': 82, 'max_features': 0.23965158868307768, 'max_depth': 21, 'min_samples_split': 7, 'min_samples_leaf': 1}. Best is trial 14 with value: 0.8849557522123893.
[32m[I 2023-04-26 00:18:33,983][39m Trial 45 finished with value: 0.8672566371681416 and parameters: {'criterion': 'entropy', 'n_estimators': 68, 'max_features': 0.036782508247372836, 'max_depth': 16, 'min_samples_split': 6, 'min_samples_leaf': 3}. Best is trial 14 with value: 0.8849557522123893.
[32m[I 2023-04-26 00:18:34,049][39m Trial 46 finished with value: 0.875 and parameters: {'criterion': 'gini', 'n_estimators': 88, 'max_features': 0.11985484960430551, 'max_depth': 49, 'min_samples_split': 9, 'min_samples_leaf': 3}. Best is trial 14 with value: 0.8849557522123893.
[32m[I 2023-04-26 00:18:34,113][39m Trial 47 finished with value: 0.8275862068965517 and parameters: {'criterion': 'gini', 'n_estimators': 87, 'max_features': 0.1005828895072808, 'max_depth': 48, 'min_samples_split': 9, 'min_samples_leaf': 10}. Best is trial 14 with value: 0.8849557522123893.
[32m[I 2023-04-26 00:18:34,191][39m Trial 48 finished with value: 0.8256880733944953 and parameters: {'criterion': 'gini', 'n_estimators': 101, 'max_features': 0.29467889942251246, 'max_depth': 56, 'min_samples_split': 9, 'min_samples_leaf': 3}. Best is trial 14 with value: 0.8849557522123893.
[32m[I 2023-04-26 00:18:34,283][39m Trial 49 finished with value: 0.8771929824561403 and parameters: {'criterion': 'gini', 'n_estimators': 125, 'max_features': 0.17604915474978733, 'max_depth': 32, 'min_samples_split': 10, 'min_samples_leaf': 2}. Best is trial 14 with value: 0.8849557522123893.
[32m[I 2023-04-26 00:18:34,376][39m Trial 50 finished with value: 0.8214285714285715 and parameters: {'criterion': 'gini', 'n_estimators': 122, 'max_features': 0.4294136079569662, 'max_depth': 62, 'min_samples_split': 11, 'min_samples_leaf': 1}. Best is trial 14 with value: 0.8849557522123893.
[32m[I 2023-04-26 00:18:34,452][39m Trial 51 finished with value: 0.8648648648648648 and parameters: {'criterion': 'gini', 'n_estimators': 109, 'max_features': 0.021505595154136997, 'max_depth': 33, 'min_samples_split': 10, 'min_samples_leaf': 2}. Best is trial 14 with value: 0.8849557522123893.
[32m[I 2023-04-26 00:18:34,525][39m Trial 52 finished with value: 0.8545454545454546 and parameters: {'criterion': 'gini', 'n_estimators': 98, 'max_features': 0.14652642087939408, 'max_depth': 29, 'min_samples_split': 10, 'min_samples_leaf': 3}. Best is trial 14 with value: 0.8849557522123893.
[32m[I 2023-04-26 00:18:34,610][39m Trial 53 finished with value: 0.875 and parameters: {'criterion': 'gini', 'n_estimators': 118, 'max_features': 0.18307942964384158, 'max_depth': 67, 'min_samples_split': 9, 'min_samples_leaf': 2}. Best is trial 14 with value: 0.8849557522123893.
[32m[I 2023-04-26 00:18:34,693][39m Trial 54 finished with value: 0.8256880733944953 and parameters: {'criterion': 'gini', 'n_estimators': 116, 'max_features': 0.18680290767538665, 'max_depth': 67, 'min_samples_split': 9, 'min_samples_leaf': 3}. Best is trial 14 with value: 0.8849557522123893.
[32m[I 2023-04-26 00:18:34,794][39m Trial 55 finished with value: 0.8392857142857144 and parameters: {'criterion': 'gini', 'n_estimators': 138, 'max_features': 0.2747615003789515, 'max_depth': 78, 'min_samples_split': 11, 'min_samples_leaf': 2}. Best is trial 14 with value: 0.8849557522123893.
[32m[I 2023-04-26 00:18:34,862][39m Trial 56 finished with value: 0.8571428571428572 and parameters: {'criterion': 'gini', 'n_estimators': 91, 'max_features': 0.10746048472274454, 'max_depth': 25, 'min_samples_split': 10, 'min_samples_leaf': 1}. Best is trial 14 with value: 0.8849557522123893.
[32m[I 2023-04-26 00:18:34,957][39m Trial 57 finished with value: 0.8392857142857144 and parameters: {'criterion': 'gini', 'n_estimators': 128, 'max_features': 0.32763022150746723, 'max_depth': 98, 'min_samples_split': 9, 'min_samples_leaf': 4}. Best is trial 14 with value: 0.8849557522123893.
[32m[I 2023-04-26 00:18:35,042][39m Trial 58 finished with value: 0.8672566371681416 and parameters: {'criterion': 'gini', 'n_estimators': 120, 'max_features': 0.0004466919719561327, 'max_depth': 72, 'min_samples_split': 9, 'min_samples_leaf': 2}. Best is trial 14 with value: 0.8849557522123893.
[32m[I 2023-04-26 00:18:35,130][39m Trial 59 finished with value: 0.8363636363636363 and parameters: {'criterion': 'gini', 'n_estimators': 108, 'max_features': 0.6759587402016907, 'max_depth': 91, 'min_samples_split': 8, 'min_samples_leaf': 1}. Best is trial 14 with value: 0.8849557522123893.
[32m[I 2023-04-26 00:18:35,232][39m Trial 60 finished with value: 0.8648648648648648 and parameters: {'criterion': 'entropy', 'n_estimators': 135, 'max_features': 0.21465501638625975, 'max_depth': 14, 'min_samples_split': 3, 'min_samples_leaf': 2}. Best is trial 14 with value: 0.8849557522123893.
[32m[I 2023-04-26 00:18:35,314][39m Trial 61 finished with value: 0.8571428571428572 and parameters: {'criterion': 'gini', 'n_estimators': 117, 'max_features': 0.09099295238196879, 'max_depth': 49, 'min_samples_split': 10, 'min_samples_leaf': 2}. Best is trial 14 with value: 0.8849557522123893.
[32m[I 2023-04-26 00:18:35,419][39m Trial 62 finished with value: 0.8440366972477066 and parameters: {'criterion': 'gini', 'n_estimators': 149, 'max_features': 0.1625665055884585, 'max_depth': 35, 'min_samples_split': 8, 'min_samples_leaf': 3}. Best is trial 14 with value: 0.8849557522123893.
[32m[I 2023-04-26 00:18:35,530][39m Trial 63 finished with value: 0.8214285714285715 and parameters: {'criterion': 'gini', 'n_estimators': 145, 'max_features': 0.3936933267772631, 'max_depth': 43, 'min_samples_split': 9, 'min_samples_leaf': 3}. Best is trial 14 with value: 0.8849557522123893.
[32m[I 2023-04-26 00:18:35,618][39m Trial 64 finished with value: 0.8571428571428572 and parameters: {'criterion': 'gini', 'n_estimators': 124, 'max_features': 0.05132006873809028, 'max_depth': 30, 'min_samples_split': 8, 'min_samples_leaf': 1}. Best is trial 14 with value: 0.8849557522123893.
[32m[I 2023-04-26 00:18:35,711][39m Trial 65 finished with value: 0.8596491228070176 and parameters: {'criterion': 'entropy', 'n_estimators': 130, 'max_features': 0.125444988880433, 'max_depth': 65, 'min_samples_split': 10, 'min_samples_leaf': 5}. Best is trial 14 with value: 0.8849557522123893.
[32m[I 2023-04-26 00:18:35,794][39m Trial 66 finished with value: 0.8672566371681416 and parameters: {'criterion': 'entropy', 'n_estimators': 104, 'max_features': 0.2461804927813389, 'max_depth': 59, 'min_samples_split': 9, 'min_samples_leaf': 2}. Best is trial 14 with value: 0.8849557522123893.
[32m[I 2023-04-26 00:18:35,864][39m Trial 67 finished with value: 0.8347826086956522 and parameters: {'criterion': 'gini', 'n_estimators': 94, 'max_features': 0.07654196927506421, 'max_depth': 82, 'min_samples_split': 11, 'min_samples_leaf': 8}. Best is trial 14 with value: 0.8849557522123893.
[32m[I 2023-04-26 00:18:35,932][39m Trial 68 finished with value: 0.8288288288288289 and parameters: {'criterion': 'entropy', 'n_estimators': 87, 'max_features': 0.17340778102334709, 'max_depth': 26, 'min_samples_split': 2, 'min_samples_leaf': 4}. Best is trial 14 with value: 0.8849557522123893.
[32m[I 2023-04-26 00:18:36,015][39m Trial 69 finished with value: 0.875 and parameters: {'criterion': 'entropy', 'n_estimators': 111, 'max_features': 0.12435238915372357, 'max_depth': 52, 'min_samples_split': 8, 'min_samples_leaf': 3}. Best is trial 14 with value: 0.8849557522123893.
[32m[I 2023-04-26 00:18:36,100][39m Trial 70 finished with value: 0.8596491228070176 and parameters: {'criterion': 'gini', 'n_estimators': 112, 'max_features': 0.19966902125744052, 'max_depth': 53, 'min_samples_split': 7, 'min_samples_leaf': 3}. Best is trial 14 with value: 0.8849557522123893.
[32m[I 2023-04-26 00:18:36,178][39m Trial 71 finished with value: 0.8571428571428572 and parameters: {'criterion': 'entropy', 'n_estimators': 101, 'max_features': 0.1185777477423009, 'max_depth': 41, 'min_samples_split': 8, 'min_samples_leaf': 2}. Best is trial 14 with value: 0.8849557522123893.
[32m[I 2023-04-26 00:18:36,269][39m Trial 72 finished with value: 0.8495575221238938 and parameters: {'criterion': 'entropy', 'n_estimators': 119, 'max_features': 0.15060922805527524, 'max_depth': 32, 'min_samples_split': 9, 'min_samples_leaf': 3}. Best is trial 14 with value: 0.8849557522123893.
