[32m[I 2023-04-26 02:21:00,826][39m A new study created in memory with name: no-name-d5f986c8-06be-4bbb-b4ec-3263f5a9992b
[32m[I 2023-04-26 02:21:00,832][39m Trial 0 finished with value: 0.717391304347826 and parameters: {'algorithm': 'auto', 'n_neighbors': 16, 'weights': 'distance', 'metric': 'minkowski'}. Best is trial 0 with value: 0.717391304347826.
[32m[I 2023-04-26 02:21:00,854][39m Trial 1 finished with value: 0.7042253521126761 and parameters: {'algorithm': 'brute', 'n_neighbors': 2, 'weights': 'uniform', 'metric': 'minkowski'}. Best is trial 0 with value: 0.717391304347826.
[32m[I 2023-04-26 02:21:00,861][39m Trial 2 finished with value: 0.7294117647058823 and parameters: {'algorithm': 'ball_tree', 'n_neighbors': 26, 'weights': 'distance', 'metric': 'minkowski'}. Best is trial 2 with value: 0.7294117647058823.
[32m[I 2023-04-26 02:21:00,868][39m Trial 3 finished with value: 0.7096774193548387 and parameters: {'algorithm': 'ball_tree', 'n_neighbors': 14, 'weights': 'uniform', 'metric': 'manhattan'}. Best is trial 2 with value: 0.7294117647058823.
[32m[I 2023-04-26 02:21:00,872][39m Trial 4 finished with value: 0.717391304347826 and parameters: {'algorithm': 'ball_tree', 'n_neighbors': 19, 'weights': 'distance', 'metric': 'euclidean'}. Best is trial 2 with value: 0.7294117647058823.
[32m[I 2023-04-26 02:21:00,878][39m Trial 5 finished with value: 0.7191011235955055 and parameters: {'algorithm': 'kd_tree', 'n_neighbors': 17, 'weights': 'distance', 'metric': 'euclidean'}. Best is trial 2 with value: 0.7294117647058823.
[32m[I 2023-04-26 02:21:00,911][39m Trial 6 finished with value: 0.717391304347826 and parameters: {'algorithm': 'brute', 'n_neighbors': 19, 'weights': 'distance', 'metric': 'euclidean'}. Best is trial 2 with value: 0.7294117647058823.
[32m[I 2023-04-26 02:21:00,923][39m Trial 7 finished with value: 0.7526881720430108 and parameters: {'algorithm': 'ball_tree', 'n_neighbors': 17, 'weights': 'uniform', 'metric': 'euclidean'}. Best is trial 7 with value: 0.7526881720430108.
[32m[I 2023-04-26 02:21:00,933][39m Trial 8 finished with value: 0.7472527472527474 and parameters: {'algorithm': 'ball_tree', 'n_neighbors': 14, 'weights': 'distance', 'metric': 'manhattan'}. Best is trial 7 with value: 0.7526881720430108.
[32m[I 2023-04-26 02:21:00,959][39m Trial 9 finished with value: 0.717391304347826 and parameters: {'algorithm': 'brute', 'n_neighbors': 16, 'weights': 'distance', 'metric': 'euclidean'}. Best is trial 7 with value: 0.7526881720430108.
[32m[I 2023-04-26 02:21:00,975][39m Trial 10 finished with value: 0.6842105263157895 and parameters: {'algorithm': 'auto', 'n_neighbors': 8, 'weights': 'uniform', 'metric': 'euclidean'}. Best is trial 7 with value: 0.7526881720430108.
[32m[I 2023-04-26 02:21:00,990][39m Trial 11 finished with value: 0.7777777777777778 and parameters: {'algorithm': 'ball_tree', 'n_neighbors': 25, 'weights': 'uniform', 'metric': 'manhattan'}. Best is trial 11 with value: 0.7777777777777778.
[32m[I 2023-04-26 02:21:01,006][39m Trial 12 finished with value: 0.6987951807228916 and parameters: {'algorithm': 'ball_tree', 'n_neighbors': 30, 'weights': 'uniform', 'metric': 'manhattan'}. Best is trial 11 with value: 0.7777777777777778.
[32m[I 2023-04-26 02:21:01,022][39m Trial 13 finished with value: 0.7294117647058823 and parameters: {'algorithm': 'kd_tree', 'n_neighbors': 24, 'weights': 'uniform', 'metric': 'manhattan'}. Best is trial 11 with value: 0.7777777777777778.
[32m[I 2023-04-26 02:21:01,038][39m Trial 14 finished with value: 0.7294117647058823 and parameters: {'algorithm': 'ball_tree', 'n_neighbors': 24, 'weights': 'uniform', 'metric': 'manhattan'}. Best is trial 11 with value: 0.7777777777777778.
[32m[I 2023-04-26 02:21:01,054][39m Trial 15 finished with value: 0.7727272727272727 and parameters: {'algorithm': 'ball_tree', 'n_neighbors': 9, 'weights': 'uniform', 'metric': 'manhattan'}. Best is trial 11 with value: 0.7777777777777778.
[32m[I 2023-04-26 02:21:01,064][39m Trial 16 finished with value: 0.7727272727272727 and parameters: {'algorithm': 'ball_tree', 'n_neighbors': 9, 'weights': 'uniform', 'metric': 'manhattan'}. Best is trial 11 with value: 0.7777777777777778.
[32m[I 2023-04-26 02:21:01,075][39m Trial 17 finished with value: 0.7727272727272727 and parameters: {'algorithm': 'kd_tree', 'n_neighbors': 9, 'weights': 'uniform', 'metric': 'manhattan'}. Best is trial 11 with value: 0.7777777777777778.
[32m[I 2023-04-26 02:21:01,083][39m Trial 18 finished with value: 0.7012987012987012 and parameters: {'algorithm': 'kd_tree', 'n_neighbors': 3, 'weights': 'uniform', 'metric': 'manhattan'}. Best is trial 11 with value: 0.7777777777777778.
[32m[I 2023-04-26 02:21:01,092][39m Trial 19 finished with value: 0.6835443037974684 and parameters: {'algorithm': 'auto', 'n_neighbors': 6, 'weights': 'uniform', 'metric': 'manhattan'}. Best is trial 11 with value: 0.7777777777777778.
[32m[I 2023-04-26 02:21:01,107][39m Trial 20 finished with value: 0.6818181818181819 and parameters: {'algorithm': 'kd_tree', 'n_neighbors': 12, 'weights': 'uniform', 'metric': 'manhattan'}. Best is trial 11 with value: 0.7777777777777778.
[32m[I 2023-04-26 02:21:01,115][39m Trial 21 finished with value: 0.6835443037974684 and parameters: {'algorithm': 'kd_tree', 'n_neighbors': 10, 'weights': 'uniform', 'metric': 'manhattan'}. Best is trial 11 with value: 0.7777777777777778.
[32m[I 2023-04-26 02:21:01,126][39m Trial 22 finished with value: 0.7380952380952381 and parameters: {'algorithm': 'kd_tree', 'n_neighbors': 5, 'weights': 'uniform', 'metric': 'manhattan'}. Best is trial 11 with value: 0.7777777777777778.
[32m[I 2023-04-26 02:21:01,134][39m Trial 23 finished with value: 0.7311827956989247 and parameters: {'algorithm': 'ball_tree', 'n_neighbors': 11, 'weights': 'uniform', 'metric': 'manhattan'}. Best is trial 11 with value: 0.7777777777777778.
[32m[I 2023-04-26 02:21:01,144][39m Trial 24 finished with value: 0.6896551724137931 and parameters: {'algorithm': 'ball_tree', 'n_neighbors': 7, 'weights': 'uniform', 'metric': 'manhattan'}. Best is trial 11 with value: 0.7777777777777778.
[32m[I 2023-04-26 02:21:01,152][39m Trial 25 finished with value: 0.7727272727272727 and parameters: {'algorithm': 'ball_tree', 'n_neighbors': 21, 'weights': 'uniform', 'metric': 'minkowski'}. Best is trial 11 with value: 0.7777777777777778.
[32m[I 2023-04-26 02:21:01,160][39m Trial 26 finished with value: 0.7727272727272727 and parameters: {'algorithm': 'kd_tree', 'n_neighbors': 21, 'weights': 'uniform', 'metric': 'minkowski'}. Best is trial 11 with value: 0.7777777777777778.
[32m[I 2023-04-26 02:21:01,168][39m Trial 27 finished with value: 0.6666666666666667 and parameters: {'algorithm': 'kd_tree', 'n_neighbors': 29, 'weights': 'uniform', 'metric': 'minkowski'}. Best is trial 11 with value: 0.7777777777777778.
[32m[I 2023-04-26 02:21:01,176][39m Trial 28 finished with value: 0.7727272727272727 and parameters: {'algorithm': 'auto', 'n_neighbors': 22, 'weights': 'uniform', 'metric': 'minkowski'}. Best is trial 11 with value: 0.7777777777777778.
[32m[I 2023-04-26 02:21:01,186][39m Trial 29 finished with value: 0.7727272727272727 and parameters: {'algorithm': 'auto', 'n_neighbors': 22, 'weights': 'uniform', 'metric': 'minkowski'}. Best is trial 11 with value: 0.7777777777777778.
[32m[I 2023-04-26 02:21:01,195][39m Trial 30 finished with value: 0.7356321839080461 and parameters: {'algorithm': 'auto', 'n_neighbors': 27, 'weights': 'uniform', 'metric': 'minkowski'}. Best is trial 11 with value: 0.7777777777777778.
[32m[I 2023-04-26 02:21:01,202][39m Trial 31 finished with value: 0.7727272727272727 and parameters: {'algorithm': 'auto', 'n_neighbors': 22, 'weights': 'uniform', 'metric': 'minkowski'}. Best is trial 11 with value: 0.7777777777777778.
[32m[I 2023-04-26 02:21:01,211][39m Trial 32 finished with value: 0.7777777777777778 and parameters: {'algorithm': 'auto', 'n_neighbors': 25, 'weights': 'uniform', 'metric': 'minkowski'}. Best is trial 11 with value: 0.7777777777777778.
[32m[I 2023-04-26 02:21:01,224][39m Trial 33 finished with value: 0.7209302325581395 and parameters: {'algorithm': 'auto', 'n_neighbors': 26, 'weights': 'uniform', 'metric': 'minkowski'}. Best is trial 11 with value: 0.7777777777777778.
[32m[I 2023-04-26 02:21:01,234][39m Trial 34 finished with value: 0.6756756756756757 and parameters: {'algorithm': 'ball_tree', 'n_neighbors': 4, 'weights': 'uniform', 'metric': 'manhattan'}. Best is trial 11 with value: 0.7777777777777778.
[32m[I 2023-04-26 02:21:01,252][39m Trial 35 finished with value: 0.723404255319149 and parameters: {'algorithm': 'brute', 'n_neighbors': 13, 'weights': 'uniform', 'metric': 'manhattan'}. Best is trial 11 with value: 0.7777777777777778.
[32m[I 2023-04-26 02:21:01,280][39m Trial 36 finished with value: 0.7441860465116279 and parameters: {'algorithm': 'brute', 'n_neighbors': 27, 'weights': 'distance', 'metric': 'manhattan'}. Best is trial 11 with value: 0.7777777777777778.
[32m[I 2023-04-26 02:21:01,296][39m Trial 37 finished with value: 0.7816091954022988 and parameters: {'algorithm': 'auto', 'n_neighbors': 24, 'weights': 'uniform', 'metric': 'minkowski'}. Best is trial 37 with value: 0.7816091954022988.
[32m[I 2023-04-26 02:21:01,309][39m Trial 38 finished with value: 0.7380952380952381 and parameters: {'algorithm': 'auto', 'n_neighbors': 24, 'weights': 'distance', 'metric': 'minkowski'}. Best is trial 37 with value: 0.7816091954022988.
[32m[I 2023-04-26 02:21:01,326][39m Trial 39 finished with value: 0.7674418604651163 and parameters: {'algorithm': 'auto', 'n_neighbors': 19, 'weights': 'uniform', 'metric': 'minkowski'}. Best is trial 37 with value: 0.7816091954022988.
[32m[I 2023-04-26 02:21:01,339][39m Trial 40 finished with value: 0.7272727272727273 and parameters: {'algorithm': 'auto', 'n_neighbors': 20, 'weights': 'distance', 'metric': 'minkowski'}. Best is trial 37 with value: 0.7816091954022988.
[32m[I 2023-04-26 02:21:01,355][39m Trial 41 finished with value: 0.7727272727272727 and parameters: {'algorithm': 'auto', 'n_neighbors': 23, 'weights': 'uniform', 'metric': 'minkowski'}. Best is trial 37 with value: 0.7816091954022988.
[32m[I 2023-04-26 02:21:01,374][39m Trial 42 finished with value: 0.7777777777777778 and parameters: {'algorithm': 'auto', 'n_neighbors': 25, 'weights': 'uniform', 'metric': 'minkowski'}. Best is trial 37 with value: 0.7816091954022988.
[32m[I 2023-04-26 02:21:01,386][39m Trial 43 finished with value: 0.7209302325581395 and parameters: {'algorithm': 'auto', 'n_neighbors': 26, 'weights': 'uniform', 'metric': 'minkowski'}. Best is trial 37 with value: 0.7816091954022988.
[32m[I 2023-04-26 02:21:01,395][39m Trial 44 finished with value: 0.6666666666666667 and parameters: {'algorithm': 'auto', 'n_neighbors': 28, 'weights': 'uniform', 'metric': 'minkowski'}. Best is trial 37 with value: 0.7816091954022988.
[32m[I 2023-04-26 02:21:01,403][39m Trial 45 finished with value: 0.7816091954022988 and parameters: {'algorithm': 'auto', 'n_neighbors': 24, 'weights': 'uniform', 'metric': 'minkowski'}. Best is trial 37 with value: 0.7816091954022988.
[32m[I 2023-04-26 02:21:01,410][39m Trial 46 finished with value: 0.7228915662650603 and parameters: {'algorithm': 'auto', 'n_neighbors': 25, 'weights': 'distance', 'metric': 'minkowski'}. Best is trial 37 with value: 0.7816091954022988.
[32m[I 2023-04-26 02:21:01,418][39m Trial 47 finished with value: 0.6410256410256411 and parameters: {'algorithm': 'auto', 'n_neighbors': 30, 'weights': 'uniform', 'metric': 'euclidean'}. Best is trial 37 with value: 0.7816091954022988.
[32m[I 2023-04-26 02:21:01,427][39m Trial 48 finished with value: 0.7674418604651163 and parameters: {'algorithm': 'auto', 'n_neighbors': 18, 'weights': 'uniform', 'metric': 'minkowski'}. Best is trial 37 with value: 0.7816091954022988.
[32m[I 2023-04-26 02:21:01,436][39m Trial 49 finished with value: 0.7777777777777778 and parameters: {'algorithm': 'auto', 'n_neighbors': 25, 'weights': 'uniform', 'metric': 'minkowski'}. Best is trial 37 with value: 0.7816091954022988.
[32m[I 2023-04-26 02:21:01,461][39m Trial 50 finished with value: 0.6666666666666667 and parameters: {'algorithm': 'brute', 'n_neighbors': 28, 'weights': 'uniform', 'metric': 'euclidean'}. Best is trial 37 with value: 0.7816091954022988.
[32m[I 2023-04-26 02:21:01,470][39m Trial 51 finished with value: 0.7777777777777778 and parameters: {'algorithm': 'auto', 'n_neighbors': 25, 'weights': 'uniform', 'metric': 'minkowski'}. Best is trial 37 with value: 0.7816091954022988.
[32m[I 2023-04-26 02:21:01,479][39m Trial 52 finished with value: 0.7777777777777778 and parameters: {'algorithm': 'auto', 'n_neighbors': 25, 'weights': 'uniform', 'metric': 'minkowski'}. Best is trial 37 with value: 0.7816091954022988.
[32m[I 2023-04-26 02:21:01,488][39m Trial 53 finished with value: 0.7727272727272727 and parameters: {'algorithm': 'auto', 'n_neighbors': 23, 'weights': 'uniform', 'metric': 'minkowski'}. Best is trial 37 with value: 0.7816091954022988.
[32m[I 2023-04-26 02:21:01,498][39m Trial 54 finished with value: 0.7209302325581395 and parameters: {'algorithm': 'auto', 'n_neighbors': 26, 'weights': 'uniform', 'metric': 'minkowski'}. Best is trial 37 with value: 0.7816091954022988.
[32m[I 2023-04-26 02:21:01,506][39m Trial 55 finished with value: 0.7816091954022988 and parameters: {'algorithm': 'auto', 'n_neighbors': 24, 'weights': 'uniform', 'metric': 'minkowski'}. Best is trial 37 with value: 0.7816091954022988.
[32m[I 2023-04-26 02:21:01,515][39m Trial 56 finished with value: 0.6666666666666667 and parameters: {'algorithm': 'auto', 'n_neighbors': 28, 'weights': 'uniform', 'metric': 'minkowski'}. Best is trial 37 with value: 0.7816091954022988.
[32m[I 2023-04-26 02:21:01,524][39m Trial 57 finished with value: 0.717391304347826 and parameters: {'algorithm': 'auto', 'n_neighbors': 16, 'weights': 'distance', 'metric': 'minkowski'}. Best is trial 37 with value: 0.7816091954022988.
[32m[I 2023-04-26 02:21:01,532][39m Trial 58 finished with value: 0.7727272727272727 and parameters: {'algorithm': 'auto', 'n_neighbors': 23, 'weights': 'uniform', 'metric': 'minkowski'}. Best is trial 37 with value: 0.7816091954022988.
[32m[I 2023-04-26 02:21:01,541][39m Trial 59 finished with value: 0.7764705882352942 and parameters: {'algorithm': 'auto', 'n_neighbors': 20, 'weights': 'uniform', 'metric': 'minkowski'}. Best is trial 37 with value: 0.7816091954022988.
[32m[I 2023-04-26 02:21:01,555][39m Trial 60 finished with value: 0.6923076923076923 and parameters: {'algorithm': 'auto', 'n_neighbors': 1, 'weights': 'uniform', 'metric': 'minkowski'}. Best is trial 37 with value: 0.7816091954022988.
[32m[I 2023-04-26 02:21:01,565][39m Trial 61 finished with value: 0.7816091954022988 and parameters: {'algorithm': 'ball_tree', 'n_neighbors': 24, 'weights': 'uniform', 'metric': 'euclidean'}. Best is trial 37 with value: 0.7816091954022988.
[32m[I 2023-04-26 02:21:01,573][39m Trial 62 finished with value: 0.7816091954022988 and parameters: {'algorithm': 'auto', 'n_neighbors': 24, 'weights': 'uniform', 'metric': 'euclidean'}. Best is trial 37 with value: 0.7816091954022988.
[32m[I 2023-04-26 02:21:01,581][39m Trial 63 finished with value: 0.7816091954022988 and parameters: {'algorithm': 'ball_tree', 'n_neighbors': 24, 'weights': 'uniform', 'metric': 'euclidean'}. Best is trial 37 with value: 0.7816091954022988.
[32m[I 2023-04-26 02:21:01,590][39m Trial 64 finished with value: 0.7727272727272727 and parameters: {'algorithm': 'ball_tree', 'n_neighbors': 23, 'weights': 'uniform', 'metric': 'euclidean'}. Best is trial 37 with value: 0.7816091954022988.
[32m[I 2023-04-26 02:21:01,599][39m Trial 65 finished with value: 0.7727272727272727 and parameters: {'algorithm': 'ball_tree', 'n_neighbors': 21, 'weights': 'uniform', 'metric': 'euclidean'}. Best is trial 37 with value: 0.7816091954022988.
[32m[I 2023-04-26 02:21:01,616][39m Trial 66 finished with value: 0.7816091954022988 and parameters: {'algorithm': 'ball_tree', 'n_neighbors': 24, 'weights': 'uniform', 'metric': 'euclidean'}. Best is trial 37 with value: 0.7816091954022988.
[32m[I 2023-04-26 02:21:01,625][39m Trial 67 finished with value: 0.7816091954022988 and parameters: {'algorithm': 'ball_tree', 'n_neighbors': 24, 'weights': 'uniform', 'metric': 'euclidean'}. Best is trial 37 with value: 0.7816091954022988.
[32m[I 2023-04-26 02:21:01,634][39m Trial 68 finished with value: 0.7356321839080461 and parameters: {'algorithm': 'ball_tree', 'n_neighbors': 27, 'weights': 'uniform', 'metric': 'euclidean'}. Best is trial 37 with value: 0.7816091954022988.
[32m[I 2023-04-26 02:21:01,642][39m Trial 69 finished with value: 0.7727272727272727 and parameters: {'algorithm': 'ball_tree', 'n_neighbors': 22, 'weights': 'uniform', 'metric': 'euclidean'}. Best is trial 37 with value: 0.7816091954022988.
[32m[I 2023-04-26 02:21:01,650][39m Trial 70 finished with value: 0.7764705882352942 and parameters: {'algorithm': 'ball_tree', 'n_neighbors': 20, 'weights': 'uniform', 'metric': 'euclidean'}. Best is trial 37 with value: 0.7816091954022988.
[32m[I 2023-04-26 02:21:01,660][39m Trial 71 finished with value: 0.7816091954022988 and parameters: {'algorithm': 'ball_tree', 'n_neighbors': 24, 'weights': 'uniform', 'metric': 'euclidean'}. Best is trial 37 with value: 0.7816091954022988.
[32m[I 2023-04-26 02:21:01,670][39m Trial 72 finished with value: 0.7816091954022988 and parameters: {'algorithm': 'ball_tree', 'n_neighbors': 24, 'weights': 'uniform', 'metric': 'euclidean'}. Best is trial 37 with value: 0.7816091954022988.
[32m[I 2023-04-26 02:21:01,679][39m Trial 73 finished with value: 0.7727272727272727 and parameters: {'algorithm': 'ball_tree', 'n_neighbors': 23, 'weights': 'uniform', 'metric': 'euclidean'}. Best is trial 37 with value: 0.7816091954022988.
[32m[I 2023-04-26 02:21:01,687][39m Trial 74 finished with value: 0.7727272727272727 and parameters: {'algorithm': 'ball_tree', 'n_neighbors': 21, 'weights': 'uniform', 'metric': 'euclidean'}. Best is trial 37 with value: 0.7816091954022988.
[32m[I 2023-04-26 02:21:01,697][39m Trial 75 finished with value: 0.7816091954022988 and parameters: {'algorithm': 'ball_tree', 'n_neighbors': 24, 'weights': 'uniform', 'metric': 'euclidean'}. Best is trial 37 with value: 0.7816091954022988.
[32m[I 2023-04-26 02:21:01,706][39m Trial 76 finished with value: 0.7209302325581395 and parameters: {'algorithm': 'ball_tree', 'n_neighbors': 26, 'weights': 'uniform', 'metric': 'euclidean'}. Best is trial 37 with value: 0.7816091954022988.
[32m[I 2023-04-26 02:21:01,716][39m Trial 77 finished with value: 0.7142857142857143 and parameters: {'algorithm': 'ball_tree', 'n_neighbors': 29, 'weights': 'distance', 'metric': 'euclidean'}. Best is trial 37 with value: 0.7816091954022988.
[32m[I 2023-04-26 02:21:01,725][39m Trial 78 finished with value: 0.7674418604651163 and parameters: {'algorithm': 'ball_tree', 'n_neighbors': 18, 'weights': 'uniform', 'metric': 'euclidean'}. Best is trial 37 with value: 0.7816091954022988.
[32m[I 2023-04-26 02:21:01,759][39m Trial 79 finished with value: 0.7727272727272727 and parameters: {'algorithm': 'brute', 'n_neighbors': 22, 'weights': 'uniform', 'metric': 'euclidean'}. Best is trial 37 with value: 0.7816091954022988.
[32m[I 2023-04-26 02:21:01,769][39m Trial 80 finished with value: 0.7356321839080461 and parameters: {'algorithm': 'ball_tree', 'n_neighbors': 27, 'weights': 'uniform', 'metric': 'euclidean'}. Best is trial 37 with value: 0.7816091954022988.
[32m[I 2023-04-26 02:21:01,779][39m Trial 81 finished with value: 0.7816091954022988 and parameters: {'algorithm': 'ball_tree', 'n_neighbors': 24, 'weights': 'uniform', 'metric': 'euclidean'}. Best is trial 37 with value: 0.7816091954022988.
[32m[I 2023-04-26 02:21:01,787][39m Trial 82 finished with value: 0.7816091954022988 and parameters: {'algorithm': 'ball_tree', 'n_neighbors': 24, 'weights': 'uniform', 'metric': 'euclidean'}. Best is trial 37 with value: 0.7816091954022988.
[32m[I 2023-04-26 02:21:01,802][39m Trial 83 finished with value: 0.7727272727272727 and parameters: {'algorithm': 'ball_tree', 'n_neighbors': 22, 'weights': 'uniform', 'metric': 'euclidean'}. Best is trial 37 with value: 0.7816091954022988.
[32m[I 2023-04-26 02:21:01,812][39m Trial 84 finished with value: 0.7727272727272727 and parameters: {'algorithm': 'ball_tree', 'n_neighbors': 23, 'weights': 'uniform', 'metric': 'euclidean'}. Best is trial 37 with value: 0.7816091954022988.
[32m[I 2023-04-26 02:21:01,821][39m Trial 85 finished with value: 0.7209302325581395 and parameters: {'algorithm': 'ball_tree', 'n_neighbors': 26, 'weights': 'uniform', 'metric': 'euclidean'}. Best is trial 37 with value: 0.7816091954022988.
[32m[I 2023-04-26 02:21:01,828][39m Trial 86 finished with value: 0.7816091954022988 and parameters: {'algorithm': 'ball_tree', 'n_neighbors': 24, 'weights': 'uniform', 'metric': 'euclidean'}. Best is trial 37 with value: 0.7816091954022988.
[32m[I 2023-04-26 02:21:01,840][39m Trial 87 finished with value: 0.7727272727272727 and parameters: {'algorithm': 'ball_tree', 'n_neighbors': 21, 'weights': 'uniform', 'metric': 'euclidean'}. Best is trial 37 with value: 0.7816091954022988.
[32m[I 2023-04-26 02:21:01,849][39m Trial 88 finished with value: 0.7356321839080461 and parameters: {'algorithm': 'ball_tree', 'n_neighbors': 27, 'weights': 'uniform', 'metric': 'euclidean'}. Best is trial 37 with value: 0.7816091954022988.
[32m[I 2023-04-26 02:21:01,858][39m Trial 89 finished with value: 0.7294117647058823 and parameters: {'algorithm': 'kd_tree', 'n_neighbors': 26, 'weights': 'distance', 'metric': 'euclidean'}. Best is trial 37 with value: 0.7816091954022988.
