[32m[I 2023-04-26 02:21:01,867][39m Trial 90 finished with value: 0.7777777777777778 and parameters: {'algorithm': 'ball_tree', 'n_neighbors': 25, 'weights': 'uniform', 'metric': 'euclidean'}. Best is trial 37 with value: 0.7816091954022988.
[32m[I 2023-04-26 02:21:01,896][39m Trial 91 finished with value: 0.7816091954022988 and parameters: {'algorithm': 'brute', 'n_neighbors': 24, 'weights': 'uniform', 'metric': 'euclidean'}. Best is trial 37 with value: 0.7816091954022988.
[32m[I 2023-04-26 02:21:01,905][39m Trial 92 finished with value: 0.7816091954022988 and parameters: {'algorithm': 'ball_tree', 'n_neighbors': 24, 'weights': 'uniform', 'metric': 'euclidean'}. Best is trial 37 with value: 0.7816091954022988.
[32m[I 2023-04-26 02:21:01,935][39m Trial 93 finished with value: 0.7727272727272727 and parameters: {'algorithm': 'brute', 'n_neighbors': 23, 'weights': 'uniform', 'metric': 'euclidean'}. Best is trial 37 with value: 0.7816091954022988.
[32m[I 2023-04-26 02:21:01,945][39m Trial 94 finished with value: 0.7727272727272727 and parameters: {'algorithm': 'ball_tree', 'n_neighbors': 22, 'weights': 'uniform', 'metric': 'euclidean'}. Best is trial 37 with value: 0.7816091954022988.
[32m[I 2023-04-26 02:21:01,954][39m Trial 95 finished with value: 0.7777777777777778 and parameters: {'algorithm': 'ball_tree', 'n_neighbors': 25, 'weights': 'uniform', 'metric': 'euclidean'}. Best is trial 37 with value: 0.7816091954022988.
[32m[I 2023-04-26 02:21:01,963][39m Trial 96 finished with value: 0.7727272727272727 and parameters: {'algorithm': 'ball_tree', 'n_neighbors': 23, 'weights': 'uniform', 'metric': 'euclidean'}. Best is trial 37 with value: 0.7816091954022988.
[32m[I 2023-04-26 02:21:01,972][39m Trial 97 finished with value: 0.7764705882352942 and parameters: {'algorithm': 'auto', 'n_neighbors': 20, 'weights': 'uniform', 'metric': 'euclidean'}. Best is trial 37 with value: 0.7816091954022988.
[32m[I 2023-04-26 02:21:02,000][39m Trial 98 finished with value: 0.7816091954022988 and parameters: {'algorithm': 'brute', 'n_neighbors': 24, 'weights': 'uniform', 'metric': 'euclidean'}. Best is trial 37 with value: 0.7816091954022988.
[32m[I 2023-04-26 02:21:02,028][39m Trial 99 finished with value: 0.7659574468085106 and parameters: {'algorithm': 'brute', 'n_neighbors': 15, 'weights': 'uniform', 'metric': 'euclidean'}. Best is trial 37 with value: 0.7816091954022988.
[32m[I 2023-04-26 02:21:02,054][39m Trial 100 finished with value: 0.7209302325581395 and parameters: {'algorithm': 'brute', 'n_neighbors': 26, 'weights': 'uniform', 'metric': 'euclidean'}. Best is trial 37 with value: 0.7816091954022988.
[32m[I 2023-04-26 02:21:02,064][39m Trial 101 finished with value: 0.7777777777777778 and parameters: {'algorithm': 'ball_tree', 'n_neighbors': 25, 'weights': 'uniform', 'metric': 'euclidean'}. Best is trial 37 with value: 0.7816091954022988.
[32m[I 2023-04-26 02:21:02,072][39m Trial 102 finished with value: 0.7816091954022988 and parameters: {'algorithm': 'ball_tree', 'n_neighbors': 24, 'weights': 'uniform', 'metric': 'euclidean'}. Best is trial 37 with value: 0.7816091954022988.
[32m[I 2023-04-26 02:21:02,082][39m Trial 103 finished with value: 0.7727272727272727 and parameters: {'algorithm': 'ball_tree', 'n_neighbors': 23, 'weights': 'uniform', 'metric': 'euclidean'}. Best is trial 37 with value: 0.7816091954022988.
[32m[I 2023-04-26 02:21:02,091][39m Trial 104 finished with value: 0.7777777777777778 and parameters: {'algorithm': 'ball_tree', 'n_neighbors': 25, 'weights': 'uniform', 'metric': 'euclidean'}. Best is trial 37 with value: 0.7816091954022988.
[32m[I 2023-04-26 02:21:02,102][39m Trial 105 finished with value: 0.7727272727272727 and parameters: {'algorithm': 'ball_tree', 'n_neighbors': 22, 'weights': 'uniform', 'metric': 'euclidean'}. Best is trial 37 with value: 0.7816091954022988.
[32m[I 2023-04-26 02:21:02,112][39m Trial 106 finished with value: 0.7816091954022988 and parameters: {'algorithm': 'ball_tree', 'n_neighbors': 24, 'weights': 'uniform', 'metric': 'euclidean'}. Best is trial 37 with value: 0.7816091954022988.
[32m[I 2023-04-26 02:21:02,121][39m Trial 107 finished with value: 0.7816091954022988 and parameters: {'algorithm': 'ball_tree', 'n_neighbors': 24, 'weights': 'uniform', 'metric': 'euclidean'}. Best is trial 37 with value: 0.7816091954022988.
[32m[I 2023-04-26 02:21:02,127][39m Trial 108 finished with value: 0.7209302325581395 and parameters: {'algorithm': 'kd_tree', 'n_neighbors': 21, 'weights': 'distance', 'metric': 'minkowski'}. Best is trial 37 with value: 0.7816091954022988.
[32m[I 2023-04-26 02:21:02,137][39m Trial 109 finished with value: 0.7209302325581395 and parameters: {'algorithm': 'ball_tree', 'n_neighbors': 26, 'weights': 'uniform', 'metric': 'euclidean'}. Best is trial 37 with value: 0.7816091954022988.
[32m[I 2023-04-26 02:21:02,147][39m Trial 110 finished with value: 0.6666666666666667 and parameters: {'algorithm': 'ball_tree', 'n_neighbors': 28, 'weights': 'uniform', 'metric': 'euclidean'}. Best is trial 37 with value: 0.7816091954022988.
[32m[I 2023-04-26 02:21:02,157][39m Trial 111 finished with value: 0.7727272727272727 and parameters: {'algorithm': 'auto', 'n_neighbors': 23, 'weights': 'uniform', 'metric': 'euclidean'}. Best is trial 37 with value: 0.7816091954022988.
[32m[I 2023-04-26 02:21:02,183][39m Trial 112 finished with value: 0.7816091954022988 and parameters: {'algorithm': 'brute', 'n_neighbors': 24, 'weights': 'uniform', 'metric': 'euclidean'}. Best is trial 37 with value: 0.7816091954022988.
[32m[I 2023-04-26 02:21:02,214][39m Trial 113 finished with value: 0.7777777777777778 and parameters: {'algorithm': 'brute', 'n_neighbors': 25, 'weights': 'uniform', 'metric': 'minkowski'}. Best is trial 37 with value: 0.7816091954022988.
[32m[I 2023-04-26 02:21:02,224][39m Trial 114 finished with value: 0.7727272727272727 and parameters: {'algorithm': 'auto', 'n_neighbors': 22, 'weights': 'uniform', 'metric': 'euclidean'}. Best is trial 37 with value: 0.7816091954022988.
[32m[I 2023-04-26 02:21:02,235][39m Trial 115 finished with value: 0.7209302325581395 and parameters: {'algorithm': 'auto', 'n_neighbors': 26, 'weights': 'uniform', 'metric': 'minkowski'}. Best is trial 37 with value: 0.7816091954022988.
[32m[I 2023-04-26 02:21:02,266][39m Trial 116 finished with value: 0.7816091954022988 and parameters: {'algorithm': 'brute', 'n_neighbors': 24, 'weights': 'uniform', 'metric': 'euclidean'}. Best is trial 37 with value: 0.7816091954022988.
[32m[I 2023-04-26 02:21:02,276][39m Trial 117 finished with value: 0.7727272727272727 and parameters: {'algorithm': 'auto', 'n_neighbors': 23, 'weights': 'uniform', 'metric': 'euclidean'}. Best is trial 37 with value: 0.7816091954022988.
[32m[I 2023-04-26 02:21:02,291][39m Trial 118 finished with value: 0.7356321839080461 and parameters: {'algorithm': 'ball_tree', 'n_neighbors': 27, 'weights': 'uniform', 'metric': 'euclidean'}. Best is trial 37 with value: 0.7816091954022988.
[32m[I 2023-04-26 02:21:02,310][39m Trial 119 finished with value: 0.7294117647058823 and parameters: {'algorithm': 'brute', 'n_neighbors': 24, 'weights': 'uniform', 'metric': 'manhattan'}. Best is trial 37 with value: 0.7816091954022988.
[32m[I 2023-04-26 02:21:02,322][39m Trial 120 finished with value: 0.7777777777777778 and parameters: {'algorithm': 'auto', 'n_neighbors': 25, 'weights': 'uniform', 'metric': 'minkowski'}. Best is trial 37 with value: 0.7816091954022988.
[32m[I 2023-04-26 02:21:02,340][39m Trial 121 finished with value: 0.7816091954022988 and parameters: {'algorithm': 'ball_tree', 'n_neighbors': 24, 'weights': 'uniform', 'metric': 'euclidean'}. Best is trial 37 with value: 0.7816091954022988.
[32m[I 2023-04-26 02:21:02,350][39m Trial 122 finished with value: 0.7727272727272727 and parameters: {'algorithm': 'ball_tree', 'n_neighbors': 23, 'weights': 'uniform', 'metric': 'euclidean'}. Best is trial 37 with value: 0.7816091954022988.
[32m[I 2023-04-26 02:21:02,359][39m Trial 123 finished with value: 0.7777777777777778 and parameters: {'algorithm': 'ball_tree', 'n_neighbors': 25, 'weights': 'uniform', 'metric': 'euclidean'}. Best is trial 37 with value: 0.7816091954022988.
[32m[I 2023-04-26 02:21:02,368][39m Trial 124 finished with value: 0.7727272727272727 and parameters: {'algorithm': 'ball_tree', 'n_neighbors': 22, 'weights': 'uniform', 'metric': 'euclidean'}. Best is trial 37 with value: 0.7816091954022988.
[32m[I 2023-04-26 02:21:02,377][39m Trial 125 finished with value: 0.7727272727272727 and parameters: {'algorithm': 'ball_tree', 'n_neighbors': 23, 'weights': 'uniform', 'metric': 'euclidean'}. Best is trial 37 with value: 0.7816091954022988.
[32m[I 2023-04-26 02:21:02,406][39m Trial 126 finished with value: 0.7727272727272727 and parameters: {'algorithm': 'brute', 'n_neighbors': 21, 'weights': 'uniform', 'metric': 'euclidean'}. Best is trial 37 with value: 0.7816091954022988.
[32m[I 2023-04-26 02:21:02,415][39m Trial 127 finished with value: 0.7228915662650603 and parameters: {'algorithm': 'ball_tree', 'n_neighbors': 25, 'weights': 'distance', 'metric': 'euclidean'}. Best is trial 37 with value: 0.7816091954022988.
[32m[I 2023-04-26 02:21:02,443][39m Trial 128 finished with value: 0.7816091954022988 and parameters: {'algorithm': 'brute', 'n_neighbors': 24, 'weights': 'uniform', 'metric': 'minkowski'}. Best is trial 37 with value: 0.7816091954022988.
[32m[I 2023-04-26 02:21:02,454][39m Trial 129 finished with value: 0.7816091954022988 and parameters: {'algorithm': 'ball_tree', 'n_neighbors': 24, 'weights': 'uniform', 'metric': 'minkowski'}. Best is trial 37 with value: 0.7816091954022988.
[32m[I 2023-04-26 02:21:02,463][39m Trial 130 finished with value: 0.7209302325581395 and parameters: {'algorithm': 'ball_tree', 'n_neighbors': 26, 'weights': 'uniform', 'metric': 'euclidean'}. Best is trial 37 with value: 0.7816091954022988.
[32m[I 2023-04-26 02:21:02,473][39m Trial 131 finished with value: 0.7816091954022988 and parameters: {'algorithm': 'ball_tree', 'n_neighbors': 24, 'weights': 'uniform', 'metric': 'euclidean'}. Best is trial 37 with value: 0.7816091954022988.
[32m[I 2023-04-26 02:21:02,502][39m Trial 132 finished with value: 0.7727272727272727 and parameters: {'algorithm': 'brute', 'n_neighbors': 22, 'weights': 'uniform', 'metric': 'euclidean'}. Best is trial 37 with value: 0.7816091954022988.
[32m[I 2023-04-26 02:21:02,512][39m Trial 133 finished with value: 0.7727272727272727 and parameters: {'algorithm': 'ball_tree', 'n_neighbors': 23, 'weights': 'uniform', 'metric': 'euclidean'}. Best is trial 37 with value: 0.7816091954022988.
[32m[I 2023-04-26 02:21:02,522][39m Trial 134 finished with value: 0.7777777777777778 and parameters: {'algorithm': 'kd_tree', 'n_neighbors': 25, 'weights': 'uniform', 'metric': 'euclidean'}. Best is trial 37 with value: 0.7816091954022988.
[32m[I 2023-04-26 02:21:02,532][39m Trial 135 finished with value: 0.7727272727272727 and parameters: {'algorithm': 'ball_tree', 'n_neighbors': 23, 'weights': 'uniform', 'metric': 'euclidean'}. Best is trial 37 with value: 0.7816091954022988.
[32m[I 2023-04-26 02:21:02,561][39m Trial 136 finished with value: 0.7816091954022988 and parameters: {'algorithm': 'brute', 'n_neighbors': 24, 'weights': 'uniform', 'metric': 'euclidean'}. Best is trial 37 with value: 0.7816091954022988.
[32m[I 2023-04-26 02:21:02,592][39m Trial 137 finished with value: 0.7816091954022988 and parameters: {'algorithm': 'brute', 'n_neighbors': 24, 'weights': 'uniform', 'metric': 'euclidean'}. Best is trial 37 with value: 0.7816091954022988.
[32m[I 2023-04-26 02:21:02,620][39m Trial 138 finished with value: 0.7209302325581395 and parameters: {'algorithm': 'brute', 'n_neighbors': 26, 'weights': 'uniform', 'metric': 'euclidean'}. Best is trial 37 with value: 0.7816091954022988.
[32m[I 2023-04-26 02:21:02,630][39m Trial 139 finished with value: 0.7777777777777778 and parameters: {'algorithm': 'ball_tree', 'n_neighbors': 25, 'weights': 'uniform', 'metric': 'euclidean'}. Best is trial 37 with value: 0.7816091954022988.
[32m[I 2023-04-26 02:21:02,661][39m Trial 140 finished with value: 0.7816091954022988 and parameters: {'algorithm': 'brute', 'n_neighbors': 24, 'weights': 'uniform', 'metric': 'euclidean'}. Best is trial 37 with value: 0.7816091954022988.
[32m[I 2023-04-26 02:21:02,691][39m Trial 141 finished with value: 0.7777777777777778 and parameters: {'algorithm': 'brute', 'n_neighbors': 25, 'weights': 'uniform', 'metric': 'euclidean'}. Best is trial 37 with value: 0.7816091954022988.
[32m[I 2023-04-26 02:21:02,702][39m Trial 142 finished with value: 0.7727272727272727 and parameters: {'algorithm': 'ball_tree', 'n_neighbors': 23, 'weights': 'uniform', 'metric': 'euclidean'}. Best is trial 37 with value: 0.7816091954022988.
[32m[I 2023-04-26 02:21:02,712][39m Trial 143 finished with value: 0.7816091954022988 and parameters: {'algorithm': 'ball_tree', 'n_neighbors': 24, 'weights': 'uniform', 'metric': 'euclidean'}. Best is trial 37 with value: 0.7816091954022988.
[32m[I 2023-04-26 02:21:02,723][39m Trial 144 finished with value: 0.7727272727272727 and parameters: {'algorithm': 'ball_tree', 'n_neighbors': 22, 'weights': 'uniform', 'metric': 'euclidean'}. Best is trial 37 with value: 0.7816091954022988.
[32m[I 2023-04-26 02:21:02,742][39m Trial 145 finished with value: 0.7294117647058823 and parameters: {'algorithm': 'brute', 'n_neighbors': 24, 'weights': 'uniform', 'metric': 'manhattan'}. Best is trial 37 with value: 0.7816091954022988.
[32m[I 2023-04-26 02:21:02,759][39m Trial 146 finished with value: 0.7777777777777778 and parameters: {'algorithm': 'auto', 'n_neighbors': 25, 'weights': 'uniform', 'metric': 'minkowski'}. Best is trial 37 with value: 0.7816091954022988.
[32m[I 2023-04-26 02:21:02,789][39m Trial 147 finished with value: 0.7816091954022988 and parameters: {'algorithm': 'brute', 'n_neighbors': 24, 'weights': 'uniform', 'metric': 'minkowski'}. Best is trial 37 with value: 0.7816091954022988.
[32m[I 2023-04-26 02:21:02,825][39m Trial 148 finished with value: 0.7380952380952381 and parameters: {'algorithm': 'brute', 'n_neighbors': 23, 'weights': 'distance', 'metric': 'minkowski'}. Best is trial 37 with value: 0.7816091954022988.
[32m[I 2023-04-26 02:21:02,855][39m Trial 149 finished with value: 0.7777777777777778 and parameters: {'algorithm': 'brute', 'n_neighbors': 25, 'weights': 'uniform', 'metric': 'minkowski'}. Best is trial 37 with value: 0.7816091954022988.
[32m[I 2023-04-26 02:21:02,884][39m Trial 150 finished with value: 0.7816091954022988 and parameters: {'algorithm': 'brute', 'n_neighbors': 24, 'weights': 'uniform', 'metric': 'euclidean'}. Best is trial 37 with value: 0.7816091954022988.
[32m[I 2023-04-26 02:21:02,895][39m Trial 151 finished with value: 0.7727272727272727 and parameters: {'algorithm': 'ball_tree', 'n_neighbors': 23, 'weights': 'uniform', 'metric': 'euclidean'}. Best is trial 37 with value: 0.7816091954022988.
[32m[I 2023-04-26 02:21:02,929][39m Trial 152 finished with value: 0.7727272727272727 and parameters: {'algorithm': 'brute', 'n_neighbors': 22, 'weights': 'uniform', 'metric': 'euclidean'}. Best is trial 37 with value: 0.7816091954022988.
[32m[I 2023-04-26 02:21:02,956][39m Trial 153 finished with value: 0.7816091954022988 and parameters: {'algorithm': 'brute', 'n_neighbors': 24, 'weights': 'uniform', 'metric': 'euclidean'}. Best is trial 37 with value: 0.7816091954022988.
[32m[I 2023-04-26 02:21:02,966][39m Trial 154 finished with value: 0.7209302325581395 and parameters: {'algorithm': 'ball_tree', 'n_neighbors': 26, 'weights': 'uniform', 'metric': 'minkowski'}. Best is trial 37 with value: 0.7816091954022988.
[32m[I 2023-04-26 02:21:02,996][39m Trial 155 finished with value: 0.7816091954022988 and parameters: {'algorithm': 'brute', 'n_neighbors': 24, 'weights': 'uniform', 'metric': 'euclidean'}. Best is trial 37 with value: 0.7816091954022988.
[32m[I 2023-04-26 02:21:03,007][39m Trial 156 finished with value: 0.7356321839080461 and parameters: {'algorithm': 'auto', 'n_neighbors': 27, 'weights': 'uniform', 'metric': 'euclidean'}. Best is trial 37 with value: 0.7816091954022988.
[32m[I 2023-04-26 02:21:03,018][39m Trial 157 finished with value: 0.7727272727272727 and parameters: {'algorithm': 'kd_tree', 'n_neighbors': 23, 'weights': 'uniform', 'metric': 'minkowski'}. Best is trial 37 with value: 0.7816091954022988.
[32m[I 2023-04-26 02:21:03,028][39m Trial 158 finished with value: 0.7777777777777778 and parameters: {'algorithm': 'ball_tree', 'n_neighbors': 25, 'weights': 'uniform', 'metric': 'minkowski'}. Best is trial 37 with value: 0.7816091954022988.
[32m[I 2023-04-26 02:21:03,039][39m Trial 159 finished with value: 0.7209302325581395 and parameters: {'algorithm': 'ball_tree', 'n_neighbors': 26, 'weights': 'uniform', 'metric': 'minkowski'}. Best is trial 37 with value: 0.7816091954022988.
[32m[I 2023-04-26 02:21:03,050][39m Trial 160 finished with value: 0.7816091954022988 and parameters: {'algorithm': 'auto', 'n_neighbors': 24, 'weights': 'uniform', 'metric': 'euclidean'}. Best is trial 37 with value: 0.7816091954022988.
[32m[I 2023-04-26 02:21:03,081][39m Trial 161 finished with value: 0.7816091954022988 and parameters: {'algorithm': 'brute', 'n_neighbors': 24, 'weights': 'uniform', 'metric': 'euclidean'}. Best is trial 37 with value: 0.7816091954022988.
[32m[I 2023-04-26 02:21:03,110][39m Trial 162 finished with value: 0.7816091954022988 and parameters: {'algorithm': 'brute', 'n_neighbors': 24, 'weights': 'uniform', 'metric': 'euclidean'}. Best is trial 37 with value: 0.7816091954022988.
[32m[I 2023-04-26 02:21:03,122][39m Trial 163 finished with value: 0.7727272727272727 and parameters: {'algorithm': 'ball_tree', 'n_neighbors': 22, 'weights': 'uniform', 'metric': 'euclidean'}. Best is trial 37 with value: 0.7816091954022988.
[32m[I 2023-04-26 02:21:03,132][39m Trial 164 finished with value: 0.7727272727272727 and parameters: {'algorithm': 'auto', 'n_neighbors': 23, 'weights': 'uniform', 'metric': 'euclidean'}. Best is trial 37 with value: 0.7816091954022988.
[32m[I 2023-04-26 02:21:03,143][39m Trial 165 finished with value: 0.7777777777777778 and parameters: {'algorithm': 'ball_tree', 'n_neighbors': 25, 'weights': 'uniform', 'metric': 'euclidean'}. Best is trial 37 with value: 0.7816091954022988.
[32m[I 2023-04-26 02:21:03,152][39m Trial 166 finished with value: 0.7816091954022988 and parameters: {'algorithm': 'ball_tree', 'n_neighbors': 24, 'weights': 'uniform', 'metric': 'euclidean'}. Best is trial 37 with value: 0.7816091954022988.
[32m[I 2023-04-26 02:21:03,183][39m Trial 167 finished with value: 0.7816091954022988 and parameters: {'algorithm': 'brute', 'n_neighbors': 24, 'weights': 'uniform', 'metric': 'euclidean'}. Best is trial 37 with value: 0.7816091954022988.
[32m[I 2023-04-26 02:21:03,209][39m Trial 168 finished with value: 0.7727272727272727 and parameters: {'algorithm': 'brute', 'n_neighbors': 23, 'weights': 'uniform', 'metric': 'minkowski'}. Best is trial 37 with value: 0.7816091954022988.
[32m[I 2023-04-26 02:21:03,220][39m Trial 169 finished with value: 0.7777777777777778 and parameters: {'algorithm': 'auto', 'n_neighbors': 25, 'weights': 'uniform', 'metric': 'minkowski'}. Best is trial 37 with value: 0.7816091954022988.
[32m[I 2023-04-26 02:21:03,231][39m Trial 170 finished with value: 0.7157894736842105 and parameters: {'algorithm': 'auto', 'n_neighbors': 13, 'weights': 'uniform', 'metric': 'minkowski'}. Best is trial 37 with value: 0.7816091954022988.
[32m[I 2023-04-26 02:21:03,262][39m Trial 171 finished with value: 0.7816091954022988 and parameters: {'algorithm': 'brute', 'n_neighbors': 24, 'weights': 'uniform', 'metric': 'euclidean'}. Best is trial 37 with value: 0.7816091954022988.
[32m[I 2023-04-26 02:21:03,273][39m Trial 172 finished with value: 0.7777777777777778 and parameters: {'algorithm': 'ball_tree', 'n_neighbors': 25, 'weights': 'uniform', 'metric': 'euclidean'}. Best is trial 37 with value: 0.7816091954022988.
[32m[I 2023-04-26 02:21:03,284][39m Trial 173 finished with value: 0.7727272727272727 and parameters: {'algorithm': 'ball_tree', 'n_neighbors': 23, 'weights': 'uniform', 'metric': 'euclidean'}. Best is trial 37 with value: 0.7816091954022988.
[32m[I 2023-04-26 02:21:03,311][39m Trial 174 finished with value: 0.7816091954022988 and parameters: {'algorithm': 'brute', 'n_neighbors': 24, 'weights': 'uniform', 'metric': 'minkowski'}. Best is trial 37 with value: 0.7816091954022988.
[32m[I 2023-04-26 02:21:03,339][39m Trial 175 finished with value: 0.7816091954022988 and parameters: {'algorithm': 'brute', 'n_neighbors': 24, 'weights': 'uniform', 'metric': 'minkowski'}. Best is trial 37 with value: 0.7816091954022988.
[32m[I 2023-04-26 02:21:03,367][39m Trial 176 finished with value: 0.7727272727272727 and parameters: {'algorithm': 'brute', 'n_neighbors': 22, 'weights': 'uniform', 'metric': 'minkowski'}. Best is trial 37 with value: 0.7816091954022988.
[32m[I 2023-04-26 02:21:03,376][39m Trial 177 finished with value: 0.7294117647058823 and parameters: {'algorithm': 'auto', 'n_neighbors': 26, 'weights': 'distance', 'metric': 'euclidean'}. Best is trial 37 with value: 0.7816091954022988.
[32m[I 2023-04-26 02:21:03,403][39m Trial 178 finished with value: 0.7816091954022988 and parameters: {'algorithm': 'brute', 'n_neighbors': 24, 'weights': 'uniform', 'metric': 'minkowski'}. Best is trial 37 with value: 0.7816091954022988.
[32m[I 2023-04-26 02:21:03,414][39m Trial 179 finished with value: 0.7294117647058823 and parameters: {'algorithm': 'ball_tree', 'n_neighbors': 23, 'weights': 'uniform', 'metric': 'manhattan'}. Best is trial 37 with value: 0.7816091954022988.
