[32m[I 2023-04-26 02:21:03,443][39m Trial 180 finished with value: 0.7777777777777778 and parameters: {'algorithm': 'brute', 'n_neighbors': 25, 'weights': 'uniform', 'metric': 'euclidean'}. Best is trial 37 with value: 0.7816091954022988.
[32m[I 2023-04-26 02:21:03,455][39m Trial 181 finished with value: 0.7777777777777778 and parameters: {'algorithm': 'ball_tree', 'n_neighbors': 25, 'weights': 'uniform', 'metric': 'euclidean'}. Best is trial 37 with value: 0.7816091954022988.
[32m[I 2023-04-26 02:21:03,466][39m Trial 182 finished with value: 0.7727272727272727 and parameters: {'algorithm': 'ball_tree', 'n_neighbors': 23, 'weights': 'uniform', 'metric': 'euclidean'}. Best is trial 37 with value: 0.7816091954022988.
[32m[I 2023-04-26 02:21:03,494][39m Trial 183 finished with value: 0.7816091954022988 and parameters: {'algorithm': 'brute', 'n_neighbors': 24, 'weights': 'uniform', 'metric': 'euclidean'}. Best is trial 37 with value: 0.7816091954022988.
[32m[I 2023-04-26 02:21:03,505][39m Trial 184 finished with value: 0.7777777777777778 and parameters: {'algorithm': 'ball_tree', 'n_neighbors': 25, 'weights': 'uniform', 'metric': 'euclidean'}. Best is trial 37 with value: 0.7816091954022988.
[32m[I 2023-04-26 02:21:03,516][39m Trial 185 finished with value: 0.7727272727272727 and parameters: {'algorithm': 'ball_tree', 'n_neighbors': 23, 'weights': 'uniform', 'metric': 'euclidean'}. Best is trial 37 with value: 0.7816091954022988.
[32m[I 2023-04-26 02:21:03,543][39m Trial 186 finished with value: 0.6842105263157895 and parameters: {'algorithm': 'brute', 'n_neighbors': 8, 'weights': 'uniform', 'metric': 'euclidean'}. Best is trial 37 with value: 0.7816091954022988.
[32m[I 2023-04-26 02:21:03,554][39m Trial 187 finished with value: 0.7816091954022988 and parameters: {'algorithm': 'ball_tree', 'n_neighbors': 24, 'weights': 'uniform', 'metric': 'euclidean'}. Best is trial 37 with value: 0.7816091954022988.
[32m[I 2023-04-26 02:21:03,583][39m Trial 188 finished with value: 0.7816091954022988 and parameters: {'algorithm': 'brute', 'n_neighbors': 24, 'weights': 'uniform', 'metric': 'euclidean'}. Best is trial 37 with value: 0.7816091954022988.
[32m[I 2023-04-26 02:21:03,614][39m Trial 189 finished with value: 0.7727272727272727 and parameters: {'algorithm': 'brute', 'n_neighbors': 22, 'weights': 'uniform', 'metric': 'euclidean'}. Best is trial 37 with value: 0.7816091954022988.
[32m[I 2023-04-26 02:21:03,645][39m Trial 190 finished with value: 0.7816091954022988 and parameters: {'algorithm': 'brute', 'n_neighbors': 24, 'weights': 'uniform', 'metric': 'euclidean'}. Best is trial 37 with value: 0.7816091954022988.
[32m[I 2023-04-26 02:21:03,657][39m Trial 191 finished with value: 0.7727272727272727 and parameters: {'algorithm': 'ball_tree', 'n_neighbors': 23, 'weights': 'uniform', 'metric': 'minkowski'}. Best is trial 37 with value: 0.7816091954022988.
[32m[I 2023-04-26 02:21:03,668][39m Trial 192 finished with value: 0.7816091954022988 and parameters: {'algorithm': 'auto', 'n_neighbors': 24, 'weights': 'uniform', 'metric': 'euclidean'}. Best is trial 37 with value: 0.7816091954022988.
[32m[I 2023-04-26 02:21:03,678][39m Trial 193 finished with value: 0.7777777777777778 and parameters: {'algorithm': 'auto', 'n_neighbors': 25, 'weights': 'uniform', 'metric': 'minkowski'}. Best is trial 37 with value: 0.7816091954022988.
[32m[I 2023-04-26 02:21:03,704][39m Trial 194 finished with value: 0.7816091954022988 and parameters: {'algorithm': 'brute', 'n_neighbors': 24, 'weights': 'uniform', 'metric': 'euclidean'}. Best is trial 37 with value: 0.7816091954022988.
[32m[I 2023-04-26 02:21:03,737][39m Trial 195 finished with value: 0.7209302325581395 and parameters: {'algorithm': 'brute', 'n_neighbors': 26, 'weights': 'uniform', 'metric': 'euclidean'}. Best is trial 37 with value: 0.7816091954022988.
[32m[I 2023-04-26 02:21:03,767][39m Trial 196 finished with value: 0.7816091954022988 and parameters: {'algorithm': 'brute', 'n_neighbors': 24, 'weights': 'uniform', 'metric': 'minkowski'}. Best is trial 37 with value: 0.7816091954022988.
[32m[I 2023-04-26 02:21:03,778][39m Trial 197 finished with value: 0.7727272727272727 and parameters: {'algorithm': 'ball_tree', 'n_neighbors': 23, 'weights': 'uniform', 'metric': 'euclidean'}. Best is trial 37 with value: 0.7816091954022988.
[32m[I 2023-04-26 02:21:03,809][39m Trial 198 finished with value: 0.7777777777777778 and parameters: {'algorithm': 'brute', 'n_neighbors': 25, 'weights': 'uniform', 'metric': 'minkowski'}. Best is trial 37 with value: 0.7816091954022988.
[32m[I 2023-04-26 02:21:03,821][39m Trial 199 finished with value: 0.7777777777777778 and parameters: {'algorithm': 'kd_tree', 'n_neighbors': 25, 'weights': 'uniform', 'metric': 'euclidean'}. Best is trial 37 with value: 0.7816091954022988.
[32m[I 2023-04-26 02:21:03,853][39m Trial 200 finished with value: 0.7727272727272727 and parameters: {'algorithm': 'brute', 'n_neighbors': 23, 'weights': 'uniform', 'metric': 'euclidean'}. Best is trial 37 with value: 0.7816091954022988.
[32m[I 2023-04-26 02:21:03,863][39m Trial 201 finished with value: 0.7816091954022988 and parameters: {'algorithm': 'auto', 'n_neighbors': 24, 'weights': 'uniform', 'metric': 'minkowski'}. Best is trial 37 with value: 0.7816091954022988.
[32m[I 2023-04-26 02:21:03,874][39m Trial 202 finished with value: 0.7816091954022988 and parameters: {'algorithm': 'ball_tree', 'n_neighbors': 24, 'weights': 'uniform', 'metric': 'euclidean'}. Best is trial 37 with value: 0.7816091954022988.
[32m[I 2023-04-26 02:21:03,905][39m Trial 203 finished with value: 0.7816091954022988 and parameters: {'algorithm': 'brute', 'n_neighbors': 24, 'weights': 'uniform', 'metric': 'euclidean'}. Best is trial 37 with value: 0.7816091954022988.
[32m[I 2023-04-26 02:21:03,917][39m Trial 204 finished with value: 0.7727272727272727 and parameters: {'algorithm': 'ball_tree', 'n_neighbors': 23, 'weights': 'uniform', 'metric': 'euclidean'}. Best is trial 37 with value: 0.7816091954022988.
[32m[I 2023-04-26 02:21:03,945][39m Trial 205 finished with value: 0.7816091954022988 and parameters: {'algorithm': 'brute', 'n_neighbors': 24, 'weights': 'uniform', 'metric': 'euclidean'}. Best is trial 37 with value: 0.7816091954022988.
[32m[I 2023-04-26 02:21:03,957][39m Trial 206 finished with value: 0.7777777777777778 and parameters: {'algorithm': 'ball_tree', 'n_neighbors': 25, 'weights': 'uniform', 'metric': 'euclidean'}. Best is trial 37 with value: 0.7816091954022988.
[32m[I 2023-04-26 02:21:03,991][39m Trial 207 finished with value: 0.7380952380952381 and parameters: {'algorithm': 'brute', 'n_neighbors': 24, 'weights': 'distance', 'metric': 'euclidean'}. Best is trial 37 with value: 0.7816091954022988.
[32m[I 2023-04-26 02:21:04,021][39m Trial 208 finished with value: 0.7727272727272727 and parameters: {'algorithm': 'brute', 'n_neighbors': 23, 'weights': 'uniform', 'metric': 'minkowski'}. Best is trial 37 with value: 0.7816091954022988.
[32m[I 2023-04-26 02:21:04,033][39m Trial 209 finished with value: 0.7777777777777778 and parameters: {'algorithm': 'auto', 'n_neighbors': 25, 'weights': 'uniform', 'metric': 'euclidean'}. Best is trial 37 with value: 0.7816091954022988.
[32m[I 2023-04-26 02:21:04,052][39m Trial 210 finished with value: 0.7294117647058823 and parameters: {'algorithm': 'brute', 'n_neighbors': 24, 'weights': 'uniform', 'metric': 'manhattan'}. Best is trial 37 with value: 0.7816091954022988.
[32m[I 2023-04-26 02:21:04,063][39m Trial 211 finished with value: 0.7816091954022988 and parameters: {'algorithm': 'ball_tree', 'n_neighbors': 24, 'weights': 'uniform', 'metric': 'minkowski'}. Best is trial 37 with value: 0.7816091954022988.
[32m[I 2023-04-26 02:21:04,074][39m Trial 212 finished with value: 0.7727272727272727 and parameters: {'algorithm': 'auto', 'n_neighbors': 23, 'weights': 'uniform', 'metric': 'euclidean'}. Best is trial 37 with value: 0.7816091954022988.
[32m[I 2023-04-26 02:21:04,102][39m Trial 213 finished with value: 0.7777777777777778 and parameters: {'algorithm': 'brute', 'n_neighbors': 25, 'weights': 'uniform', 'metric': 'euclidean'}. Best is trial 37 with value: 0.7816091954022988.
[32m[I 2023-04-26 02:21:04,113][39m Trial 214 finished with value: 0.7727272727272727 and parameters: {'algorithm': 'ball_tree', 'n_neighbors': 23, 'weights': 'uniform', 'metric': 'euclidean'}. Best is trial 37 with value: 0.7816091954022988.
[32m[I 2023-04-26 02:21:04,126][39m Trial 215 finished with value: 0.7816091954022988 and parameters: {'algorithm': 'ball_tree', 'n_neighbors': 24, 'weights': 'uniform', 'metric': 'euclidean'}. Best is trial 37 with value: 0.7816091954022988.
[32m[I 2023-04-26 02:21:04,136][39m Trial 216 finished with value: 0.7777777777777778 and parameters: {'algorithm': 'ball_tree', 'n_neighbors': 25, 'weights': 'uniform', 'metric': 'euclidean'}. Best is trial 37 with value: 0.7816091954022988.
[32m[I 2023-04-26 02:21:04,148][39m Trial 217 finished with value: 0.7816091954022988 and parameters: {'algorithm': 'ball_tree', 'n_neighbors': 24, 'weights': 'uniform', 'metric': 'euclidean'}. Best is trial 37 with value: 0.7816091954022988.
[32m[I 2023-04-26 02:21:04,160][39m Trial 218 finished with value: 0.7209302325581395 and parameters: {'algorithm': 'ball_tree', 'n_neighbors': 26, 'weights': 'uniform', 'metric': 'euclidean'}. Best is trial 37 with value: 0.7816091954022988.
[32m[I 2023-04-26 02:21:04,188][39m Trial 219 finished with value: 0.7816091954022988 and parameters: {'algorithm': 'brute', 'n_neighbors': 24, 'weights': 'uniform', 'metric': 'euclidean'}. Best is trial 37 with value: 0.7816091954022988.
[32m[I 2023-04-26 02:21:04,199][39m Trial 220 finished with value: 0.7526881720430108 and parameters: {'algorithm': 'ball_tree', 'n_neighbors': 17, 'weights': 'uniform', 'metric': 'euclidean'}. Best is trial 37 with value: 0.7816091954022988.
[32m[I 2023-04-26 02:21:04,210][39m Trial 221 finished with value: 0.7816091954022988 and parameters: {'algorithm': 'auto', 'n_neighbors': 24, 'weights': 'uniform', 'metric': 'euclidean'}. Best is trial 37 with value: 0.7816091954022988.
[32m[I 2023-04-26 02:21:04,222][39m Trial 222 finished with value: 0.7777777777777778 and parameters: {'algorithm': 'ball_tree', 'n_neighbors': 25, 'weights': 'uniform', 'metric': 'euclidean'}. Best is trial 37 with value: 0.7816091954022988.
[32m[I 2023-04-26 02:21:04,250][39m Trial 223 finished with value: 0.7727272727272727 and parameters: {'algorithm': 'brute', 'n_neighbors': 23, 'weights': 'uniform', 'metric': 'euclidean'}. Best is trial 37 with value: 0.7816091954022988.
[32m[I 2023-04-26 02:21:04,281][39m Trial 224 finished with value: 0.7816091954022988 and parameters: {'algorithm': 'brute', 'n_neighbors': 24, 'weights': 'uniform', 'metric': 'euclidean'}. Best is trial 37 with value: 0.7816091954022988.
[32m[I 2023-04-26 02:21:04,292][39m Trial 225 finished with value: 0.7727272727272727 and parameters: {'algorithm': 'ball_tree', 'n_neighbors': 23, 'weights': 'uniform', 'metric': 'euclidean'}. Best is trial 37 with value: 0.7816091954022988.
[32m[I 2023-04-26 02:21:04,322][39m Trial 226 finished with value: 0.7816091954022988 and parameters: {'algorithm': 'brute', 'n_neighbors': 24, 'weights': 'uniform', 'metric': 'euclidean'}. Best is trial 37 with value: 0.7816091954022988.
[32m[I 2023-04-26 02:21:04,351][39m Trial 227 finished with value: 0.7816091954022988 and parameters: {'algorithm': 'brute', 'n_neighbors': 24, 'weights': 'uniform', 'metric': 'euclidean'}. Best is trial 37 with value: 0.7816091954022988.
[32m[I 2023-04-26 02:21:04,382][39m Trial 228 finished with value: 0.7816091954022988 and parameters: {'algorithm': 'brute', 'n_neighbors': 24, 'weights': 'uniform', 'metric': 'euclidean'}. Best is trial 37 with value: 0.7816091954022988.
[32m[I 2023-04-26 02:21:04,412][39m Trial 229 finished with value: 0.7777777777777778 and parameters: {'algorithm': 'brute', 'n_neighbors': 25, 'weights': 'uniform', 'metric': 'euclidean'}. Best is trial 37 with value: 0.7816091954022988.
[32m[I 2023-04-26 02:21:04,444][39m Trial 230 finished with value: 0.7816091954022988 and parameters: {'algorithm': 'brute', 'n_neighbors': 24, 'weights': 'uniform', 'metric': 'minkowski'}. Best is trial 37 with value: 0.7816091954022988.
[32m[I 2023-04-26 02:21:04,475][39m Trial 231 finished with value: 0.7727272727272727 and parameters: {'algorithm': 'brute', 'n_neighbors': 23, 'weights': 'uniform', 'metric': 'minkowski'}. Best is trial 37 with value: 0.7816091954022988.
[32m[I 2023-04-26 02:21:04,486][39m Trial 232 finished with value: 0.7816091954022988 and parameters: {'algorithm': 'auto', 'n_neighbors': 24, 'weights': 'uniform', 'metric': 'euclidean'}. Best is trial 37 with value: 0.7816091954022988.
[32m[I 2023-04-26 02:21:04,498][39m Trial 233 finished with value: 0.7777777777777778 and parameters: {'algorithm': 'ball_tree', 'n_neighbors': 25, 'weights': 'uniform', 'metric': 'euclidean'}. Best is trial 37 with value: 0.7816091954022988.
[32m[I 2023-04-26 02:21:04,527][39m Trial 234 finished with value: 0.7727272727272727 and parameters: {'algorithm': 'brute', 'n_neighbors': 23, 'weights': 'uniform', 'metric': 'euclidean'}. Best is trial 37 with value: 0.7816091954022988.
[32m[I 2023-04-26 02:21:04,539][39m Trial 235 finished with value: 0.7311827956989247 and parameters: {'algorithm': 'ball_tree', 'n_neighbors': 11, 'weights': 'uniform', 'metric': 'euclidean'}. Best is trial 37 with value: 0.7816091954022988.
[32m[I 2023-04-26 02:21:04,550][39m Trial 236 finished with value: 0.7816091954022988 and parameters: {'algorithm': 'ball_tree', 'n_neighbors': 24, 'weights': 'uniform', 'metric': 'euclidean'}. Best is trial 37 with value: 0.7816091954022988.
[32m[I 2023-04-26 02:21:04,560][39m Trial 237 finished with value: 0.7777777777777778 and parameters: {'algorithm': 'ball_tree', 'n_neighbors': 25, 'weights': 'uniform', 'metric': 'euclidean'}. Best is trial 37 with value: 0.7816091954022988.
[32m[I 2023-04-26 02:21:04,589][39m Trial 238 finished with value: 0.7816091954022988 and parameters: {'algorithm': 'brute', 'n_neighbors': 24, 'weights': 'uniform', 'metric': 'minkowski'}. Best is trial 37 with value: 0.7816091954022988.
[32m[I 2023-04-26 02:21:04,600][39m Trial 239 finished with value: 0.7777777777777778 and parameters: {'algorithm': 'ball_tree', 'n_neighbors': 25, 'weights': 'uniform', 'metric': 'euclidean'}. Best is trial 37 with value: 0.7816091954022988.
[32m[I 2023-04-26 02:21:04,611][39m Trial 240 finished with value: 0.7380952380952381 and parameters: {'algorithm': 'ball_tree', 'n_neighbors': 24, 'weights': 'distance', 'metric': 'minkowski'}. Best is trial 37 with value: 0.7816091954022988.
[32m[I 2023-04-26 02:21:04,639][39m Trial 241 finished with value: 0.7816091954022988 and parameters: {'algorithm': 'brute', 'n_neighbors': 24, 'weights': 'uniform', 'metric': 'minkowski'}. Best is trial 37 with value: 0.7816091954022988.
[32m[I 2023-04-26 02:21:04,669][39m Trial 242 finished with value: 0.7727272727272727 and parameters: {'algorithm': 'brute', 'n_neighbors': 23, 'weights': 'uniform', 'metric': 'euclidean'}. Best is trial 37 with value: 0.7816091954022988.
[32m[I 2023-04-26 02:21:04,681][39m Trial 243 finished with value: 0.7727272727272727 and parameters: {'algorithm': 'ball_tree', 'n_neighbors': 23, 'weights': 'uniform', 'metric': 'euclidean'}. Best is trial 37 with value: 0.7816091954022988.
[32m[I 2023-04-26 02:21:04,691][39m Trial 244 finished with value: 0.7816091954022988 and parameters: {'algorithm': 'ball_tree', 'n_neighbors': 24, 'weights': 'uniform', 'metric': 'euclidean'}. Best is trial 37 with value: 0.7816091954022988.
[32m[I 2023-04-26 02:21:04,721][39m Trial 245 finished with value: 0.7816091954022988 and parameters: {'algorithm': 'brute', 'n_neighbors': 24, 'weights': 'uniform', 'metric': 'euclidean'}. Best is trial 37 with value: 0.7816091954022988.
[32m[I 2023-04-26 02:21:04,747][39m Trial 246 finished with value: 0.7777777777777778 and parameters: {'algorithm': 'brute', 'n_neighbors': 25, 'weights': 'uniform', 'metric': 'euclidean'}. Best is trial 37 with value: 0.7816091954022988.
[32m[I 2023-04-26 02:21:04,777][39m Trial 247 finished with value: 0.7816091954022988 and parameters: {'algorithm': 'brute', 'n_neighbors': 24, 'weights': 'uniform', 'metric': 'minkowski'}. Best is trial 37 with value: 0.7816091954022988.
[32m[I 2023-04-26 02:21:04,805][39m Trial 248 finished with value: 0.7727272727272727 and parameters: {'algorithm': 'brute', 'n_neighbors': 22, 'weights': 'uniform', 'metric': 'euclidean'}. Best is trial 37 with value: 0.7816091954022988.
[32m[I 2023-04-26 02:21:04,835][39m Trial 249 finished with value: 0.7777777777777778 and parameters: {'algorithm': 'brute', 'n_neighbors': 25, 'weights': 'uniform', 'metric': 'euclidean'}. Best is trial 37 with value: 0.7816091954022988.
[32m[I 2023-04-26 02:21:04,848][39m Trial 250 finished with value: 0.7816091954022988 and parameters: {'algorithm': 'auto', 'n_neighbors': 24, 'weights': 'uniform', 'metric': 'minkowski'}. Best is trial 37 with value: 0.7816091954022988.
[32m[I 2023-04-26 02:21:04,860][39m Trial 251 finished with value: 0.7727272727272727 and parameters: {'algorithm': 'kd_tree', 'n_neighbors': 23, 'weights': 'uniform', 'metric': 'euclidean'}. Best is trial 37 with value: 0.7816091954022988.
[32m[I 2023-04-26 02:21:04,871][39m Trial 252 finished with value: 0.7816091954022988 and parameters: {'algorithm': 'auto', 'n_neighbors': 24, 'weights': 'uniform', 'metric': 'euclidean'}. Best is trial 37 with value: 0.7816091954022988.
[32m[I 2023-04-26 02:21:04,881][39m Trial 253 finished with value: 0.7727272727272727 and parameters: {'algorithm': 'auto', 'n_neighbors': 23, 'weights': 'uniform', 'metric': 'minkowski'}. Best is trial 37 with value: 0.7816091954022988.
[32m[I 2023-04-26 02:21:04,893][39m Trial 254 finished with value: 0.7777777777777778 and parameters: {'algorithm': 'ball_tree', 'n_neighbors': 25, 'weights': 'uniform', 'metric': 'manhattan'}. Best is trial 37 with value: 0.7816091954022988.
[32m[I 2023-04-26 02:21:04,924][39m Trial 255 finished with value: 0.7816091954022988 and parameters: {'algorithm': 'brute', 'n_neighbors': 24, 'weights': 'uniform', 'metric': 'euclidean'}. Best is trial 37 with value: 0.7816091954022988.
[32m[I 2023-04-26 02:21:04,936][39m Trial 256 finished with value: 0.7816091954022988 and parameters: {'algorithm': 'ball_tree', 'n_neighbors': 24, 'weights': 'uniform', 'metric': 'euclidean'}. Best is trial 37 with value: 0.7816091954022988.
[32m[I 2023-04-26 02:21:04,962][39m Trial 257 finished with value: 0.7777777777777778 and parameters: {'algorithm': 'brute', 'n_neighbors': 25, 'weights': 'uniform', 'metric': 'euclidean'}. Best is trial 37 with value: 0.7816091954022988.
[32m[I 2023-04-26 02:21:04,993][39m Trial 258 finished with value: 0.7209302325581395 and parameters: {'algorithm': 'brute', 'n_neighbors': 26, 'weights': 'uniform', 'metric': 'euclidean'}. Best is trial 37 with value: 0.7816091954022988.
[32m[I 2023-04-26 02:21:05,005][39m Trial 259 finished with value: 0.7727272727272727 and parameters: {'algorithm': 'ball_tree', 'n_neighbors': 23, 'weights': 'uniform', 'metric': 'euclidean'}. Best is trial 37 with value: 0.7816091954022988.
[32m[I 2023-04-26 02:21:05,017][39m Trial 260 finished with value: 0.7816091954022988 and parameters: {'algorithm': 'ball_tree', 'n_neighbors': 24, 'weights': 'uniform', 'metric': 'euclidean'}. Best is trial 37 with value: 0.7816091954022988.
[32m[I 2023-04-26 02:21:05,036][39m Trial 261 finished with value: 0.7727272727272727 and parameters: {'algorithm': 'ball_tree', 'n_neighbors': 22, 'weights': 'uniform', 'metric': 'euclidean'}. Best is trial 37 with value: 0.7816091954022988.
[32m[I 2023-04-26 02:21:05,048][39m Trial 262 finished with value: 0.7727272727272727 and parameters: {'algorithm': 'auto', 'n_neighbors': 23, 'weights': 'uniform', 'metric': 'euclidean'}. Best is trial 37 with value: 0.7816091954022988.
[32m[I 2023-04-26 02:21:05,059][39m Trial 263 finished with value: 0.7777777777777778 and parameters: {'algorithm': 'ball_tree', 'n_neighbors': 25, 'weights': 'uniform', 'metric': 'euclidean'}. Best is trial 37 with value: 0.7816091954022988.
[32m[I 2023-04-26 02:21:05,091][39m Trial 264 finished with value: 0.7012987012987012 and parameters: {'algorithm': 'brute', 'n_neighbors': 6, 'weights': 'uniform', 'metric': 'euclidean'}. Best is trial 37 with value: 0.7816091954022988.
[32m[I 2023-04-26 02:21:05,120][39m Trial 265 finished with value: 0.7816091954022988 and parameters: {'algorithm': 'brute', 'n_neighbors': 24, 'weights': 'uniform', 'metric': 'euclidean'}. Best is trial 37 with value: 0.7816091954022988.
[32m[I 2023-04-26 02:21:05,132][39m Trial 266 finished with value: 0.7816091954022988 and parameters: {'algorithm': 'ball_tree', 'n_neighbors': 24, 'weights': 'uniform', 'metric': 'euclidean'}. Best is trial 37 with value: 0.7816091954022988.
[32m[I 2023-04-26 02:21:05,141][39m Trial 267 finished with value: 0.7228915662650603 and parameters: {'algorithm': 'ball_tree', 'n_neighbors': 25, 'weights': 'distance', 'metric': 'euclidean'}. Best is trial 37 with value: 0.7816091954022988.
[32m[I 2023-04-26 02:21:05,154][39m Trial 268 finished with value: 0.7727272727272727 and parameters: {'algorithm': 'ball_tree', 'n_neighbors': 23, 'weights': 'uniform', 'metric': 'euclidean'}. Best is trial 37 with value: 0.7816091954022988.
[32m[I 2023-04-26 02:21:05,165][39m Trial 269 finished with value: 0.7209302325581395 and parameters: {'algorithm': 'kd_tree', 'n_neighbors': 26, 'weights': 'uniform', 'metric': 'minkowski'}. Best is trial 37 with value: 0.7816091954022988.
