[32m[I 2023-04-23 21:53:18,937][39m A new study created in memory with name: no-name-a848d29d-7065-476b-9fe1-de14c02c62db
[32m[I 2023-04-23 21:53:19,531][39m Trial 0 finished with value: 0.43478260869565216 and parameters: {'objective': 'Logloss', 'colsample_bylevel': 0.08972210513178908, 'depth': 4, 'boosting_type': 'Plain', 'bootstrap_type': 'Bernoulli', 'subsample': 0.6313250025761973}. Best is trial 0 with value: 0.43478260869565216.
[32m[I 2023-04-23 21:53:22,108][39m Trial 1 finished with value: 0.4166666666666667 and parameters: {'objective': 'Logloss', 'colsample_bylevel': 0.09613429098640514, 'depth': 7, 'boosting_type': 'Ordered', 'bootstrap_type': 'Bayesian', 'bagging_temperature': 9.386289086254786}. Best is trial 0 with value: 0.43478260869565216.
[32m[I 2023-04-23 21:53:24,512][39m Trial 2 finished with value: 0.5833333333333334 and parameters: {'objective': 'Logloss', 'colsample_bylevel': 0.09438138459657182, 'depth': 4, 'boosting_type': 'Ordered', 'bootstrap_type': 'Bernoulli', 'subsample': 0.9677161727761704}. Best is trial 2 with value: 0.5833333333333334.
[32m[I 2023-04-23 21:53:27,262][39m Trial 3 finished with value: 0.48000000000000004 and parameters: {'objective': 'Logloss', 'colsample_bylevel': 0.06869055379113956, 'depth': 6, 'boosting_type': 'Ordered', 'bootstrap_type': 'Bayesian', 'bagging_temperature': 6.413841750320297}. Best is trial 2 with value: 0.5833333333333334.
[32m[I 2023-04-23 21:53:28,220][39m Trial 4 finished with value: 0.4166666666666667 and parameters: {'objective': 'Logloss', 'colsample_bylevel': 0.02809670800556703, 'depth': 5, 'boosting_type': 'Plain', 'bootstrap_type': 'Bernoulli', 'subsample': 0.7537703141103795}. Best is trial 2 with value: 0.5833333333333334.
[32m[I 2023-04-23 21:53:29,282][39m Trial 5 finished with value: 0.5 and parameters: {'objective': 'Logloss', 'colsample_bylevel': 0.03443394409988609, 'depth': 10, 'boosting_type': 'Plain', 'bootstrap_type': 'Bayesian', 'bagging_temperature': 9.22167444270444}. Best is trial 2 with value: 0.5833333333333334.
[32m[I 2023-04-23 21:53:30,172][39m Trial 6 finished with value: 0.5 and parameters: {'objective': 'CrossEntropy', 'colsample_bylevel': 0.06687421088676328, 'depth': 7, 'boosting_type': 'Plain', 'bootstrap_type': 'Bernoulli', 'subsample': 0.7388169363908028}. Best is trial 2 with value: 0.5833333333333334.
[32m[I 2023-04-23 21:53:33,358][39m Trial 7 finished with value: 0.5384615384615384 and parameters: {'objective': 'Logloss', 'colsample_bylevel': 0.0651731542065585, 'depth': 8, 'boosting_type': 'Ordered', 'bootstrap_type': 'Bayesian', 'bagging_temperature': 6.560169024407244}. Best is trial 2 with value: 0.5833333333333334.
[32m[I 2023-04-23 21:53:33,721][39m Trial 8 finished with value: 0.4166666666666667 and parameters: {'objective': 'CrossEntropy', 'colsample_bylevel': 0.09547275574508847, 'depth': 8, 'boosting_type': 'Plain', 'bootstrap_type': 'MVS'}. Best is trial 2 with value: 0.5833333333333334.
[32m[I 2023-04-23 21:53:37,564][39m Trial 9 finished with value: 0.5925925925925926 and parameters: {'objective': 'CrossEntropy', 'colsample_bylevel': 0.02755943950658886, 'depth': 11, 'boosting_type': 'Ordered', 'bootstrap_type': 'Bayesian', 'bagging_temperature': 8.159458396845869}. Best is trial 9 with value: 0.5925925925925926.
[32m[I 2023-04-23 21:53:39,853][39m Trial 10 finished with value: 0.5185185185185186 and parameters: {'objective': 'CrossEntropy', 'colsample_bylevel': 0.013922987159466731, 'depth': 1, 'boosting_type': 'Ordered', 'bootstrap_type': 'MVS'}. Best is trial 9 with value: 0.5925925925925926.
[32m[I 2023-04-23 21:53:43,031][39m Trial 11 finished with value: 0.5833333333333334 and parameters: {'objective': 'CrossEntropy', 'colsample_bylevel': 0.04725066369886503, 'depth': 12, 'boosting_type': 'Ordered', 'bootstrap_type': 'Bernoulli', 'subsample': 0.12643174332414614}. Best is trial 9 with value: 0.5925925925925926.
[32m[I 2023-04-23 21:53:46,422][39m Trial 12 finished with value: 0.5833333333333334 and parameters: {'objective': 'CrossEntropy', 'colsample_bylevel': 0.047783792988448946, 'depth': 3, 'boosting_type': 'Ordered', 'bootstrap_type': 'Bernoulli', 'subsample': 0.9321692485242727}. Best is trial 9 with value: 0.5925925925925926.
[32m[I 2023-04-23 21:53:48,406][39m Trial 13 finished with value: 0.5833333333333334 and parameters: {'objective': 'CrossEntropy', 'colsample_bylevel': 0.07914609424830321, 'depth': 12, 'boosting_type': 'Ordered', 'bootstrap_type': 'Bayesian', 'bagging_temperature': 9.307497540778087e-05}. Best is trial 9 with value: 0.5925925925925926.
[32m[I 2023-04-23 21:53:52,109][39m Trial 14 finished with value: 0.5384615384615384 and parameters: {'objective': 'CrossEntropy', 'colsample_bylevel': 0.012957243510170503, 'depth': 2, 'boosting_type': 'Ordered', 'bootstrap_type': 'MVS'}. Best is trial 9 with value: 0.5925925925925926.
[32m[I 2023-04-23 21:53:54,624][39m Trial 15 finished with value: 0.5384615384615384 and parameters: {'objective': 'Logloss', 'colsample_bylevel': 0.02948586144136645, 'depth': 10, 'boosting_type': 'Ordered', 'bootstrap_type': 'Bayesian', 'bagging_temperature': 3.572588218159363}. Best is trial 9 with value: 0.5925925925925926.
[32m[I 2023-04-23 21:53:58,391][39m Trial 16 finished with value: 0.4166666666666667 and parameters: {'objective': 'Logloss', 'colsample_bylevel': 0.08151530838994775, 'depth': 10, 'boosting_type': 'Ordered', 'bootstrap_type': 'Bernoulli', 'subsample': 0.2837019103468577}. Best is trial 9 with value: 0.5925925925925926.
[32m[I 2023-04-23 21:54:01,061][39m Trial 17 finished with value: 0.5833333333333334 and parameters: {'objective': 'CrossEntropy', 'colsample_bylevel': 0.0545504812461616, 'depth': 4, 'boosting_type': 'Ordered', 'bootstrap_type': 'Bernoulli', 'subsample': 0.9871297639866705}. Best is trial 9 with value: 0.5925925925925926.
[32m[I 2023-04-23 21:54:04,701][39m Trial 18 finished with value: 0.6153846153846153 and parameters: {'objective': 'CrossEntropy', 'colsample_bylevel': 0.04059422385139841, 'depth': 5, 'boosting_type': 'Ordered', 'bootstrap_type': 'Bayesian', 'bagging_temperature': 3.771564276914624}. Best is trial 18 with value: 0.6153846153846153.
[32m[I 2023-04-23 21:54:08,182][39m Trial 19 finished with value: 0.5384615384615384 and parameters: {'objective': 'CrossEntropy', 'colsample_bylevel': 0.03931648567076035, 'depth': 9, 'boosting_type': 'Ordered', 'bootstrap_type': 'Bayesian', 'bagging_temperature': 3.1579063159632983}. Best is trial 18 with value: 0.6153846153846153.
[32m[I 2023-04-23 21:54:13,999][39m Trial 20 finished with value: 0.5384615384615384 and parameters: {'objective': 'CrossEntropy', 'colsample_bylevel': 0.024471213578829865, 'depth': 6, 'boosting_type': 'Ordered', 'bootstrap_type': 'Bayesian', 'bagging_temperature': 4.876908968156334}. Best is trial 18 with value: 0.6153846153846153.
[32m[I 2023-04-23 21:54:20,523][39m Trial 21 finished with value: 0.48000000000000004 and parameters: {'objective': 'CrossEntropy', 'colsample_bylevel': 0.04046587184767729, 'depth': 5, 'boosting_type': 'Ordered', 'bootstrap_type': 'Bayesian', 'bagging_temperature': 1.8043306798002425}. Best is trial 18 with value: 0.6153846153846153.
[32m[I 2023-04-23 21:54:23,691][39m Trial 22 finished with value: 0.6923076923076924 and parameters: {'objective': 'CrossEntropy', 'colsample_bylevel': 0.023561360103057608, 'depth': 3, 'boosting_type': 'Ordered', 'bootstrap_type': 'Bayesian', 'bagging_temperature': 7.0729565078502805}. Best is trial 22 with value: 0.6923076923076924.
[32m[I 2023-04-23 21:54:27,414][39m Trial 23 finished with value: 0.5384615384615384 and parameters: {'objective': 'CrossEntropy', 'colsample_bylevel': 0.021051244396018364, 'depth': 2, 'boosting_type': 'Ordered', 'bootstrap_type': 'Bayesian', 'bagging_temperature': 7.483928471568689}. Best is trial 22 with value: 0.6923076923076924.
[32m[I 2023-04-23 21:54:31,333][39m Trial 24 finished with value: 0.5384615384615384 and parameters: {'objective': 'CrossEntropy', 'colsample_bylevel': 0.020246443602747306, 'depth': 3, 'boosting_type': 'Ordered', 'bootstrap_type': 'Bayesian', 'bagging_temperature': 7.916582876046805}. Best is trial 22 with value: 0.6923076923076924.
[32m[I 2023-04-23 21:54:35,469][39m Trial 25 finished with value: 0.5599999999999999 and parameters: {'objective': 'CrossEntropy', 'colsample_bylevel': 0.03411326150233948, 'depth': 5, 'boosting_type': 'Ordered', 'bootstrap_type': 'Bayesian', 'bagging_temperature': 5.053218593649364}. Best is trial 22 with value: 0.6923076923076924.
[32m[I 2023-04-23 21:54:36,449][39m Trial 26 finished with value: 0.5 and parameters: {'objective': 'CrossEntropy', 'colsample_bylevel': 0.0481764278445799, 'depth': 1, 'boosting_type': 'Plain', 'bootstrap_type': 'Bayesian', 'bagging_temperature': 8.082236532123133}. Best is trial 22 with value: 0.6923076923076924.
[32m[I 2023-04-23 21:54:40,573][39m Trial 27 finished with value: 0.5384615384615384 and parameters: {'objective': 'CrossEntropy', 'colsample_bylevel': 0.017570731975894545, 'depth': 11, 'boosting_type': 'Ordered', 'bootstrap_type': 'MVS'}. Best is trial 22 with value: 0.6923076923076924.
[32m[I 2023-04-23 21:54:44,630][39m Trial 28 finished with value: 0.5384615384615384 and parameters: {'objective': 'CrossEntropy', 'colsample_bylevel': 0.040764464898484086, 'depth': 3, 'boosting_type': 'Ordered', 'bootstrap_type': 'Bayesian', 'bagging_temperature': 5.6623273353799}. Best is trial 22 with value: 0.6923076923076924.
[32m[I 2023-04-23 21:54:45,506][39m Trial 29 finished with value: 0.5185185185185186 and parameters: {'objective': 'CrossEntropy', 'colsample_bylevel': 0.03187086309404366, 'depth': 4, 'boosting_type': 'Plain', 'bootstrap_type': 'Bayesian', 'bagging_temperature': 3.829696709819144}. Best is trial 22 with value: 0.6923076923076924.
[32m[I 2023-04-23 21:54:50,935][39m Trial 30 finished with value: 0.6428571428571429 and parameters: {'objective': 'CrossEntropy', 'colsample_bylevel': 0.010269716957838649, 'depth': 8, 'boosting_type': 'Ordered', 'bootstrap_type': 'Bayesian', 'bagging_temperature': 6.988938955519378}. Best is trial 22 with value: 0.6923076923076924.
[32m[I 2023-04-23 21:54:56,074][39m Trial 31 finished with value: 0.5185185185185186 and parameters: {'objective': 'CrossEntropy', 'colsample_bylevel': 0.010859371834910352, 'depth': 8, 'boosting_type': 'Ordered', 'bootstrap_type': 'Bayesian', 'bagging_temperature': 7.102380813990388}. Best is trial 22 with value: 0.6923076923076924.
[32m[I 2023-04-23 21:55:02,732][39m Trial 32 finished with value: 0.5384615384615384 and parameters: {'objective': 'CrossEntropy', 'colsample_bylevel': 0.021639759721059106, 'depth': 9, 'boosting_type': 'Ordered', 'bootstrap_type': 'Bayesian', 'bagging_temperature': 8.41396049219339}. Best is trial 22 with value: 0.6923076923076924.
[32m[I 2023-04-23 21:55:08,480][39m Trial 33 finished with value: 0.5 and parameters: {'objective': 'CrossEntropy', 'colsample_bylevel': 0.027463465178198053, 'depth': 6, 'boosting_type': 'Ordered', 'bootstrap_type': 'Bayesian', 'bagging_temperature': 6.095594058322342}. Best is trial 22 with value: 0.6923076923076924.
[32m[I 2023-04-23 21:55:15,117][39m Trial 34 finished with value: 0.64 and parameters: {'objective': 'CrossEntropy', 'colsample_bylevel': 0.016238308657896026, 'depth': 11, 'boosting_type': 'Ordered', 'bootstrap_type': 'Bayesian', 'bagging_temperature': 9.844910316986082}. Best is trial 22 with value: 0.6923076923076924.
[32m[I 2023-04-23 21:55:22,501][39m Trial 35 finished with value: 0.5384615384615384 and parameters: {'objective': 'CrossEntropy', 'colsample_bylevel': 0.01567064982916025, 'depth': 7, 'boosting_type': 'Ordered', 'bootstrap_type': 'Bayesian', 'bagging_temperature': 2.4718078938034083}. Best is trial 22 with value: 0.6923076923076924.
[32m[I 2023-04-23 21:55:28,506][39m Trial 36 finished with value: 0.5185185185185186 and parameters: {'objective': 'CrossEntropy', 'colsample_bylevel': 0.011226432794872825, 'depth': 5, 'boosting_type': 'Ordered', 'bootstrap_type': 'Bayesian', 'bagging_temperature': 4.8274719845389775}. Best is trial 22 with value: 0.6923076923076924.
[32m[I 2023-04-23 21:55:29,923][39m Trial 37 finished with value: 0.5454545454545454 and parameters: {'objective': 'Logloss', 'colsample_bylevel': 0.023483756704683237, 'depth': 7, 'boosting_type': 'Plain', 'bootstrap_type': 'Bayesian', 'bagging_temperature': 9.65699508292796}. Best is trial 22 with value: 0.6923076923076924.
[32m[I 2023-04-23 21:55:35,945][39m Trial 38 finished with value: 0.5925925925925926 and parameters: {'objective': 'CrossEntropy', 'colsample_bylevel': 0.017539571771801623, 'depth': 2, 'boosting_type': 'Ordered', 'bootstrap_type': 'MVS'}. Best is trial 22 with value: 0.6923076923076924.
[32m[I 2023-04-23 21:55:36,854][39m Trial 39 finished with value: 0.5 and parameters: {'objective': 'Logloss', 'colsample_bylevel': 0.03377536129702709, 'depth': 9, 'boosting_type': 'Plain', 'bootstrap_type': 'Bayesian', 'bagging_temperature': 8.793670656344606}. Best is trial 22 with value: 0.6923076923076924.
[32m[I 2023-04-23 21:55:43,603][39m Trial 40 finished with value: 0.5925925925925926 and parameters: {'objective': 'CrossEntropy', 'colsample_bylevel': 0.05999803553190908, 'depth': 4, 'boosting_type': 'Ordered', 'bootstrap_type': 'Bayesian', 'bagging_temperature': 9.989495351376899}. Best is trial 22 with value: 0.6923076923076924.
[32m[I 2023-04-23 21:55:50,496][39m Trial 41 finished with value: 0.48000000000000004 and parameters: {'objective': 'CrossEntropy', 'colsample_bylevel': 0.057569397990450515, 'depth': 4, 'boosting_type': 'Ordered', 'bootstrap_type': 'Bayesian', 'bagging_temperature': 9.053378393522785}. Best is trial 22 with value: 0.6923076923076924.
[32m[I 2023-04-23 21:55:56,774][39m Trial 42 finished with value: 0.4166666666666667 and parameters: {'objective': 'CrossEntropy', 'colsample_bylevel': 0.05981805554566695, 'depth': 6, 'boosting_type': 'Ordered', 'bootstrap_type': 'Bayesian', 'bagging_temperature': 9.742179353317146}. Best is trial 22 with value: 0.6923076923076924.
[32m[I 2023-04-23 21:56:04,370][39m Trial 43 finished with value: 0.43478260869565216 and parameters: {'objective': 'CrossEntropy', 'colsample_bylevel': 0.06175133816281854, 'depth': 4, 'boosting_type': 'Ordered', 'bootstrap_type': 'Bayesian', 'bagging_temperature': 9.843477625235584}. Best is trial 22 with value: 0.6923076923076924.
[32m[I 2023-04-23 21:56:10,917][39m Trial 44 finished with value: 0.4166666666666667 and parameters: {'objective': 'CrossEntropy', 'colsample_bylevel': 0.07207156313869695, 'depth': 5, 'boosting_type': 'Ordered', 'bootstrap_type': 'Bayesian', 'bagging_temperature': 7.234360533571797}. Best is trial 22 with value: 0.6923076923076924.
[32m[I 2023-04-23 21:56:16,859][39m Trial 45 finished with value: 0.48000000000000004 and parameters: {'objective': 'CrossEntropy', 'colsample_bylevel': 0.07386047280002836, 'depth': 3, 'boosting_type': 'Ordered', 'bootstrap_type': 'Bayesian', 'bagging_temperature': 4.1943642328395}. Best is trial 22 with value: 0.6923076923076924.
[32m[I 2023-04-23 21:56:22,792][39m Trial 46 finished with value: 0.5599999999999999 and parameters: {'objective': 'CrossEntropy', 'colsample_bylevel': 0.026709361467890522, 'depth': 11, 'boosting_type': 'Ordered', 'bootstrap_type': 'MVS'}. Best is trial 22 with value: 0.6923076923076924.
[32m[I 2023-04-23 21:56:28,802][39m Trial 47 finished with value: 0.48000000000000004 and parameters: {'objective': 'Logloss', 'colsample_bylevel': 0.03762650921677604, 'depth': 11, 'boosting_type': 'Ordered', 'bootstrap_type': 'Bernoulli', 'subsample': 0.43440549163300557}. Best is trial 22 with value: 0.6923076923076924.
[32m[I 2023-04-23 21:56:30,098][39m Trial 48 finished with value: 0.5384615384615384 and parameters: {'objective': 'CrossEntropy', 'colsample_bylevel': 0.01817448372628195, 'depth': 2, 'boosting_type': 'Plain', 'bootstrap_type': 'MVS'}. Best is trial 22 with value: 0.6923076923076924.
[32m[I 2023-04-23 21:56:35,184][39m Trial 49 finished with value: 0.48000000000000004 and parameters: {'objective': 'CrossEntropy', 'colsample_bylevel': 0.05538489074642548, 'depth': 8, 'boosting_type': 'Ordered', 'bootstrap_type': 'Bayesian', 'bagging_temperature': 8.826327383120137}. Best is trial 22 with value: 0.6923076923076924.
[32m[I 2023-04-23 21:56:40,383][39m Trial 50 finished with value: 0.48000000000000004 and parameters: {'objective': 'CrossEntropy', 'colsample_bylevel': 0.04911102581189423, 'depth': 12, 'boosting_type': 'Ordered', 'bootstrap_type': 'Bayesian', 'bagging_temperature': 5.575874507863764}. Best is trial 22 with value: 0.6923076923076924.
[32m[I 2023-04-23 21:56:45,998][39m Trial 51 finished with value: 0.5599999999999999 and parameters: {'objective': 'CrossEntropy', 'colsample_bylevel': 0.014872003106742521, 'depth': 2, 'boosting_type': 'Ordered', 'bootstrap_type': 'MVS'}. Best is trial 22 with value: 0.6923076923076924.
[32m[I 2023-04-23 21:56:51,123][39m Trial 52 finished with value: 0.5599999999999999 and parameters: {'objective': 'CrossEntropy', 'colsample_bylevel': 0.010116370723883265, 'depth': 3, 'boosting_type': 'Ordered', 'bootstrap_type': 'MVS'}. Best is trial 22 with value: 0.6923076923076924.
[32m[I 2023-04-23 21:56:56,180][39m Trial 53 finished with value: 0.5714285714285715 and parameters: {'objective': 'CrossEntropy', 'colsample_bylevel': 0.017194541334238474, 'depth': 1, 'boosting_type': 'Ordered', 'bootstrap_type': 'MVS'}. Best is trial 22 with value: 0.6923076923076924.
[32m[I 2023-04-23 21:57:01,534][39m Trial 54 finished with value: 0.6153846153846153 and parameters: {'objective': 'CrossEntropy', 'colsample_bylevel': 0.025024382943715628, 'depth': 2, 'boosting_type': 'Ordered', 'bootstrap_type': 'MVS'}. Best is trial 22 with value: 0.6923076923076924.
[32m[I 2023-04-23 21:57:07,380][39m Trial 55 finished with value: 0.48000000000000004 and parameters: {'objective': 'CrossEntropy', 'colsample_bylevel': 0.0439588180922019, 'depth': 4, 'boosting_type': 'Ordered', 'bootstrap_type': 'Bernoulli', 'subsample': 0.4485928940914053}. Best is trial 22 with value: 0.6923076923076924.
[32m[I 2023-04-23 21:57:12,885][39m Trial 56 finished with value: 0.5217391304347826 and parameters: {'objective': 'Logloss', 'colsample_bylevel': 0.024560821212453687, 'depth': 2, 'boosting_type': 'Ordered', 'bootstrap_type': 'MVS'}. Best is trial 22 with value: 0.6923076923076924.
[32m[I 2023-04-23 21:57:17,870][39m Trial 57 finished with value: 0.5384615384615384 and parameters: {'objective': 'CrossEntropy', 'colsample_bylevel': 0.02979123639584068, 'depth': 1, 'boosting_type': 'Ordered', 'bootstrap_type': 'MVS'}. Best is trial 22 with value: 0.6923076923076924.
[32m[I 2023-04-23 21:57:23,529][39m Trial 58 finished with value: 0.48000000000000004 and parameters: {'objective': 'CrossEntropy', 'colsample_bylevel': 0.037541036317235064, 'depth': 5, 'boosting_type': 'Ordered', 'bootstrap_type': 'Bayesian', 'bagging_temperature': 6.779138797031493}. Best is trial 22 with value: 0.6923076923076924.
[32m[I 2023-04-23 21:57:28,738][39m Trial 59 finished with value: 0.43478260869565216 and parameters: {'objective': 'CrossEntropy', 'colsample_bylevel': 0.08563171159453983, 'depth': 3, 'boosting_type': 'Ordered', 'bootstrap_type': 'Bayesian', 'bagging_temperature': 9.192856932847942}. Best is trial 22 with value: 0.6923076923076924.
[32m[I 2023-04-23 21:57:30,413][39m Trial 60 finished with value: 0.5384615384615384 and parameters: {'objective': 'CrossEntropy', 'colsample_bylevel': 0.013956832966564834, 'depth': 2, 'boosting_type': 'Plain', 'bootstrap_type': 'MVS'}. Best is trial 22 with value: 0.6923076923076924.
[32m[I 2023-04-23 21:57:35,194][39m Trial 61 finished with value: 0.5 and parameters: {'objective': 'CrossEntropy', 'colsample_bylevel': 0.01958964340312055, 'depth': 10, 'boosting_type': 'Ordered', 'bootstrap_type': 'MVS'}. Best is trial 22 with value: 0.6923076923076924.
[32m[I 2023-04-23 21:57:40,461][39m Trial 62 finished with value: 0.5 and parameters: {'objective': 'CrossEntropy', 'colsample_bylevel': 0.03116913546552822, 'depth': 12, 'boosting_type': 'Ordered', 'bootstrap_type': 'Bayesian', 'bagging_temperature': 7.8476744000644905}. Best is trial 22 with value: 0.6923076923076924.
[32m[I 2023-04-23 21:57:45,012][39m Trial 63 finished with value: 0.5833333333333334 and parameters: {'objective': 'CrossEntropy', 'colsample_bylevel': 0.053020836162253816, 'depth': 3, 'boosting_type': 'Ordered', 'bootstrap_type': 'MVS'}. Best is trial 22 with value: 0.6923076923076924.
[32m[I 2023-04-23 21:57:50,177][39m Trial 64 finished with value: 0.45454545454545453 and parameters: {'objective': 'CrossEntropy', 'colsample_bylevel': 0.06361151035574227, 'depth': 4, 'boosting_type': 'Ordered', 'bootstrap_type': 'MVS'}. Best is trial 22 with value: 0.6923076923076924.
[32m[I 2023-04-23 21:57:55,403][39m Trial 65 finished with value: 0.5599999999999999 and parameters: {'objective': 'CrossEntropy', 'colsample_bylevel': 0.022935377173573315, 'depth': 2, 'boosting_type': 'Ordered', 'bootstrap_type': 'Bernoulli', 'subsample': 0.14156972366670267}. Best is trial 22 with value: 0.6923076923076924.
[32m[I 2023-04-23 21:58:00,310][39m Trial 66 finished with value: 0.5384615384615384 and parameters: {'objective': 'CrossEntropy', 'colsample_bylevel': 0.026880808393772646, 'depth': 11, 'boosting_type': 'Ordered', 'bootstrap_type': 'Bayesian', 'bagging_temperature': 6.419050647141354}. Best is trial 22 with value: 0.6923076923076924.
[32m[I 2023-04-23 21:58:05,414][39m Trial 67 finished with value: 0.5833333333333334 and parameters: {'objective': 'CrossEntropy', 'colsample_bylevel': 0.02540411086396768, 'depth': 9, 'boosting_type': 'Ordered', 'bootstrap_type': 'Bayesian', 'bagging_temperature': 8.465499082747838}. Best is trial 22 with value: 0.6923076923076924.
