[32m[I 2023-04-23 21:58:10,014][39m Trial 68 finished with value: 0.5925925925925926 and parameters: {'objective': 'Logloss', 'colsample_bylevel': 0.01322294147434916, 'depth': 3, 'boosting_type': 'Ordered', 'bootstrap_type': 'MVS'}. Best is trial 22 with value: 0.6923076923076924.
[32m[I 2023-04-23 21:58:14,981][39m Trial 69 finished with value: 0.5599999999999999 and parameters: {'objective': 'CrossEntropy', 'colsample_bylevel': 0.016426507183013635, 'depth': 1, 'boosting_type': 'Ordered', 'bootstrap_type': 'Bayesian', 'bagging_temperature': 2.5949032370017537}. Best is trial 22 with value: 0.6923076923076924.
Number of finished trials: 70
F1 Train:	71.72% (std: 9.52%)
F1 Test:	0.00% (std: 0.00%)
F1 Train:	71.72% (std: 9.52%)
