[32m[I 2023-04-26 00:25:23,518][39m Trial 68 finished with value: 0.7311827956989247 and parameters: {'objective': 'CrossEntropy', 'colsample_bylevel': 0.0643317918075418, 'depth': 11, 'boosting_type': 'Ordered', 'bootstrap_type': 'Bernoulli', 'subsample': 0.6584822199908036}. Best is trial 19 with value: 0.7526881720430108.
[32m[I 2023-04-26 00:25:26,937][39m Trial 69 finished with value: 0.712871287128713 and parameters: {'objective': 'CrossEntropy', 'colsample_bylevel': 0.050718632873198694, 'depth': 12, 'boosting_type': 'Ordered', 'bootstrap_type': 'Bayesian', 'bagging_temperature': 9.276975301274918}. Best is trial 19 with value: 0.7526881720430108.
[32m[I 2023-04-26 00:25:30,684][39m Trial 70 finished with value: 0.7254901960784315 and parameters: {'objective': 'CrossEntropy', 'colsample_bylevel': 0.034922925971623095, 'depth': 11, 'boosting_type': 'Ordered', 'bootstrap_type': 'Bernoulli', 'subsample': 0.5794550748150918}. Best is trial 19 with value: 0.7526881720430108.
[32m[I 2023-04-26 00:25:32,202][39m Trial 71 finished with value: 0.7368421052631579 and parameters: {'objective': 'CrossEntropy', 'colsample_bylevel': 0.049810154052235565, 'depth': 5, 'boosting_type': 'Plain', 'bootstrap_type': 'Bernoulli', 'subsample': 0.4455622914557485}. Best is trial 19 with value: 0.7526881720430108.
[32m[I 2023-04-26 00:25:33,689][39m Trial 72 finished with value: 0.7142857142857142 and parameters: {'objective': 'CrossEntropy', 'colsample_bylevel': 0.06746760511642493, 'depth': 2, 'boosting_type': 'Plain', 'bootstrap_type': 'Bernoulli', 'subsample': 0.7443193709852799}. Best is trial 19 with value: 0.7526881720430108.
[32m[I 2023-04-26 00:25:37,685][39m Trial 73 finished with value: 0.7368421052631579 and parameters: {'objective': 'CrossEntropy', 'colsample_bylevel': 0.06250753483143197, 'depth': 9, 'boosting_type': 'Ordered', 'bootstrap_type': 'Bernoulli', 'subsample': 0.7009983298955367}. Best is trial 19 with value: 0.7526881720430108.
[32m[I 2023-04-26 00:25:42,385][39m Trial 74 finished with value: 0.7446808510638298 and parameters: {'objective': 'CrossEntropy', 'colsample_bylevel': 0.09019367199110151, 'depth': 3, 'boosting_type': 'Ordered', 'bootstrap_type': 'Bernoulli', 'subsample': 0.9593539314529338}. Best is trial 19 with value: 0.7526881720430108.
[32m[I 2023-04-26 00:25:46,202][39m Trial 75 finished with value: 0.7070707070707071 and parameters: {'objective': 'CrossEntropy', 'colsample_bylevel': 0.05724254436504833, 'depth': 12, 'boosting_type': 'Ordered', 'bootstrap_type': 'Bernoulli', 'subsample': 0.650191736244107}. Best is trial 19 with value: 0.7526881720430108.
[32m[I 2023-04-26 00:25:50,210][39m Trial 76 finished with value: 0.7346938775510203 and parameters: {'objective': 'CrossEntropy', 'colsample_bylevel': 0.05852010260117957, 'depth': 12, 'boosting_type': 'Ordered', 'bootstrap_type': 'Bernoulli', 'subsample': 0.12400091005605507}. Best is trial 19 with value: 0.7526881720430108.
[32m[I 2023-04-26 00:25:54,459][39m Trial 77 finished with value: 0.7216494845360826 and parameters: {'objective': 'Logloss', 'colsample_bylevel': 0.0608737118515309, 'depth': 10, 'boosting_type': 'Ordered', 'bootstrap_type': 'Bernoulli', 'subsample': 0.6842337558968837}. Best is trial 19 with value: 0.7526881720430108.
[32m[I 2023-04-26 00:25:58,095][39m Trial 78 finished with value: 0.6999999999999998 and parameters: {'objective': 'CrossEntropy', 'colsample_bylevel': 0.0478743644293983, 'depth': 7, 'boosting_type': 'Ordered', 'bootstrap_type': 'Bernoulli', 'subsample': 0.5736174123112908}. Best is trial 19 with value: 0.7526881720430108.
[32m[I 2023-04-26 00:26:02,164][39m Trial 79 finished with value: 0.7446808510638298 and parameters: {'objective': 'CrossEntropy', 'colsample_bylevel': 0.06399414096831359, 'depth': 11, 'boosting_type': 'Ordered', 'bootstrap_type': 'Bernoulli', 'subsample': 0.6090757899327581}. Best is trial 19 with value: 0.7526881720430108.
[32m[I 2023-04-26 00:26:06,648][39m Trial 80 finished with value: 0.7291666666666666 and parameters: {'objective': 'CrossEntropy', 'colsample_bylevel': 0.06520790980932266, 'depth': 4, 'boosting_type': 'Ordered', 'bootstrap_type': 'Bayesian', 'bagging_temperature': 2.143508799819024}. Best is trial 19 with value: 0.7526881720430108.
[32m[I 2023-04-26 00:26:08,034][39m Trial 81 finished with value: 0.7216494845360826 and parameters: {'objective': 'CrossEntropy', 'colsample_bylevel': 0.05434920104878401, 'depth': 3, 'boosting_type': 'Plain', 'bootstrap_type': 'Bernoulli', 'subsample': 0.7741256130918444}. Best is trial 19 with value: 0.7526881720430108.
[32m[I 2023-04-26 00:26:10,561][39m Trial 82 finished with value: 0.7096774193548387 and parameters: {'objective': 'CrossEntropy', 'colsample_bylevel': 0.07110422365960002, 'depth': 9, 'boosting_type': 'Plain', 'bootstrap_type': 'Bernoulli', 'subsample': 0.7334936804844001}. Best is trial 19 with value: 0.7526881720430108.
[32m[I 2023-04-26 00:26:11,888][39m Trial 83 finished with value: 0.7216494845360826 and parameters: {'objective': 'CrossEntropy', 'colsample_bylevel': 0.055894124421854666, 'depth': 2, 'boosting_type': 'Plain', 'bootstrap_type': 'Bernoulli', 'subsample': 0.6528037294826825}. Best is trial 19 with value: 0.7526881720430108.
[32m[I 2023-04-26 00:26:15,473][39m Trial 84 finished with value: 0.6999999999999998 and parameters: {'objective': 'CrossEntropy', 'colsample_bylevel': 0.052290572191814495, 'depth': 12, 'boosting_type': 'Ordered', 'bootstrap_type': 'Bernoulli', 'subsample': 0.7188676966617414}. Best is trial 19 with value: 0.7526881720430108.
[32m[I 2023-04-26 00:26:17,592][39m Trial 85 finished with value: 0.7272727272727273 and parameters: {'objective': 'CrossEntropy', 'colsample_bylevel': 0.04509917910304051, 'depth': 12, 'boosting_type': 'Plain', 'bootstrap_type': 'Bernoulli', 'subsample': 0.32705752843091995}. Best is trial 19 with value: 0.7526881720430108.
[32m[I 2023-04-26 00:26:21,868][39m Trial 86 finished with value: 0.7291666666666666 and parameters: {'objective': 'CrossEntropy', 'colsample_bylevel': 0.055751994669966255, 'depth': 6, 'boosting_type': 'Ordered', 'bootstrap_type': 'Bernoulli', 'subsample': 0.5535654249532489}. Best is trial 19 with value: 0.7526881720430108.
[32m[I 2023-04-26 00:26:26,050][39m Trial 87 finished with value: 0.7216494845360826 and parameters: {'objective': 'CrossEntropy', 'colsample_bylevel': 0.05847646962775491, 'depth': 10, 'boosting_type': 'Ordered', 'bootstrap_type': 'MVS'}. Best is trial 19 with value: 0.7526881720430108.
[32m[I 2023-04-26 00:26:29,668][39m Trial 88 finished with value: 0.6857142857142857 and parameters: {'objective': 'Logloss', 'colsample_bylevel': 0.046402752433370664, 'depth': 1, 'boosting_type': 'Ordered', 'bootstrap_type': 'Bernoulli', 'subsample': 0.776288063169849}. Best is trial 19 with value: 0.7526881720430108.
[32m[I 2023-04-26 00:26:33,368][39m Trial 89 finished with value: 0.7070707070707071 and parameters: {'objective': 'CrossEntropy', 'colsample_bylevel': 0.04295671837955912, 'depth': 11, 'boosting_type': 'Ordered', 'bootstrap_type': 'Bernoulli', 'subsample': 0.6887320012944812}. Best is trial 19 with value: 0.7526881720430108.
[32m[I 2023-04-26 00:26:35,241][39m Trial 90 finished with value: 0.717391304347826 and parameters: {'objective': 'CrossEntropy', 'colsample_bylevel': 0.07644948165904833, 'depth': 8, 'boosting_type': 'Plain', 'bootstrap_type': 'Bernoulli', 'subsample': 0.8295015785682747}. Best is trial 19 with value: 0.7526881720430108.
[32m[I 2023-04-26 00:26:39,279][39m Trial 91 finished with value: 0.7446808510638298 and parameters: {'objective': 'CrossEntropy', 'colsample_bylevel': 0.07249272300414268, 'depth': 11, 'boosting_type': 'Ordered', 'bootstrap_type': 'Bernoulli', 'subsample': 0.8144867753567527}. Best is trial 19 with value: 0.7526881720430108.
[32m[I 2023-04-26 00:26:43,950][39m Trial 92 finished with value: 0.7368421052631579 and parameters: {'objective': 'CrossEntropy', 'colsample_bylevel': 0.09951682737600467, 'depth': 3, 'boosting_type': 'Ordered', 'bootstrap_type': 'Bernoulli', 'subsample': 0.9830048274701523}. Best is trial 19 with value: 0.7526881720430108.
[32m[I 2023-04-26 00:26:48,042][39m Trial 93 finished with value: 0.7446808510638298 and parameters: {'objective': 'CrossEntropy', 'colsample_bylevel': 0.06234513595017081, 'depth': 12, 'boosting_type': 'Ordered', 'bootstrap_type': 'Bernoulli', 'subsample': 0.7915774464702118}. Best is trial 19 with value: 0.7526881720430108.
[32m[I 2023-04-26 00:26:52,018][39m Trial 94 finished with value: 0.7216494845360826 and parameters: {'objective': 'CrossEntropy', 'colsample_bylevel': 0.05328303182628911, 'depth': 11, 'boosting_type': 'Ordered', 'bootstrap_type': 'Bernoulli', 'subsample': 0.5230012841916389}. Best is trial 19 with value: 0.7526881720430108.
[32m[I 2023-04-26 00:26:54,238][39m Trial 95 finished with value: 0.7096774193548387 and parameters: {'objective': 'CrossEntropy', 'colsample_bylevel': 0.09333461768481138, 'depth': 4, 'boosting_type': 'Plain', 'bootstrap_type': 'Bernoulli', 'subsample': 0.8900563311430343}. Best is trial 19 with value: 0.7526881720430108.
[32m[I 2023-04-26 00:26:58,621][39m Trial 96 finished with value: 0.7499999999999999 and parameters: {'objective': 'CrossEntropy', 'colsample_bylevel': 0.08122658400084015, 'depth': 10, 'boosting_type': 'Ordered', 'bootstrap_type': 'MVS'}. Best is trial 19 with value: 0.7526881720430108.
[32m[I 2023-04-26 00:27:02,697][39m Trial 97 finished with value: 0.7368421052631579 and parameters: {'objective': 'CrossEntropy', 'colsample_bylevel': 0.06766671689659262, 'depth': 10, 'boosting_type': 'Ordered', 'bootstrap_type': 'MVS'}. Best is trial 19 with value: 0.7526881720430108.
[32m[I 2023-04-26 00:27:06,997][39m Trial 98 finished with value: 0.7368421052631579 and parameters: {'objective': 'Logloss', 'colsample_bylevel': 0.08168198941174853, 'depth': 9, 'boosting_type': 'Ordered', 'bootstrap_type': 'MVS'}. Best is trial 19 with value: 0.7526881720430108.
[32m[I 2023-04-26 00:27:11,765][39m Trial 99 finished with value: 0.7446808510638298 and parameters: {'objective': 'CrossEntropy', 'colsample_bylevel': 0.08460670805246767, 'depth': 12, 'boosting_type': 'Ordered', 'bootstrap_type': 'MVS'}. Best is trial 19 with value: 0.7526881720430108.
[32m[I 2023-04-26 00:27:16,141][39m Trial 100 finished with value: 0.723404255319149 and parameters: {'objective': 'CrossEntropy', 'colsample_bylevel': 0.07985460936212917, 'depth': 11, 'boosting_type': 'Ordered', 'bootstrap_type': 'MVS'}. Best is trial 19 with value: 0.7526881720430108.
[32m[I 2023-04-26 00:27:19,630][39m Trial 101 finished with value: 0.7346938775510203 and parameters: {'objective': 'CrossEntropy', 'colsample_bylevel': 0.023965917976015653, 'depth': 12, 'boosting_type': 'Ordered', 'bootstrap_type': 'MVS'}. Best is trial 19 with value: 0.7526881720430108.
[32m[I 2023-04-26 00:27:24,493][39m Trial 102 finished with value: 0.717391304347826 and parameters: {'objective': 'CrossEntropy', 'colsample_bylevel': 0.0894770797361294, 'depth': 10, 'boosting_type': 'Ordered', 'bootstrap_type': 'Bernoulli', 'subsample': 0.594717061619845}. Best is trial 19 with value: 0.7526881720430108.
[32m[I 2023-04-26 00:27:28,494][39m Trial 103 finished with value: 0.7526881720430108 and parameters: {'objective': 'CrossEntropy', 'colsample_bylevel': 0.059767252743573536, 'depth': 11, 'boosting_type': 'Ordered', 'bootstrap_type': 'Bernoulli', 'subsample': 0.45967677979117527}. Best is trial 19 with value: 0.7526881720430108.
[32m[I 2023-04-26 00:27:32,442][39m Trial 104 finished with value: 0.7216494845360826 and parameters: {'objective': 'CrossEntropy', 'colsample_bylevel': 0.06378523180325374, 'depth': 11, 'boosting_type': 'Ordered', 'bootstrap_type': 'Bayesian', 'bagging_temperature': 0.4744114702550055}. Best is trial 19 with value: 0.7526881720430108.
[32m[I 2023-04-26 00:27:36,571][39m Trial 105 finished with value: 0.7216494845360826 and parameters: {'objective': 'CrossEntropy', 'colsample_bylevel': 0.05752711114155487, 'depth': 11, 'boosting_type': 'Ordered', 'bootstrap_type': 'MVS'}. Best is trial 19 with value: 0.7526881720430108.
[32m[I 2023-04-26 00:27:40,564][39m Trial 106 finished with value: 0.7578947368421053 and parameters: {'objective': 'CrossEntropy', 'colsample_bylevel': 0.060684906838682405, 'depth': 12, 'boosting_type': 'Ordered', 'bootstrap_type': 'Bernoulli', 'subsample': 0.6222683768510009}. Best is trial 106 with value: 0.7578947368421053.
[32m[I 2023-04-26 00:27:44,642][39m Trial 107 finished with value: 0.7368421052631579 and parameters: {'objective': 'CrossEntropy', 'colsample_bylevel': 0.059977504750053715, 'depth': 12, 'boosting_type': 'Ordered', 'bootstrap_type': 'Bernoulli', 'subsample': 0.4450319952908701}. Best is trial 106 with value: 0.7578947368421053.
[32m[I 2023-04-26 00:27:48,620][39m Trial 108 finished with value: 0.7216494845360826 and parameters: {'objective': 'Logloss', 'colsample_bylevel': 0.06117699273011264, 'depth': 12, 'boosting_type': 'Ordered', 'bootstrap_type': 'Bernoulli', 'subsample': 0.416829407721143}. Best is trial 106 with value: 0.7578947368421053.
[32m[I 2023-04-26 00:27:52,848][39m Trial 109 finished with value: 0.7446808510638298 and parameters: {'objective': 'CrossEntropy', 'colsample_bylevel': 0.06613913371341108, 'depth': 11, 'boosting_type': 'Ordered', 'bootstrap_type': 'Bernoulli', 'subsample': 0.6418427905189278}. Best is trial 106 with value: 0.7578947368421053.
[32m[I 2023-04-26 00:27:56,899][39m Trial 110 finished with value: 0.7291666666666666 and parameters: {'objective': 'CrossEntropy', 'colsample_bylevel': 0.06544719627254217, 'depth': 12, 'boosting_type': 'Ordered', 'bootstrap_type': 'MVS'}. Best is trial 106 with value: 0.7578947368421053.
[32m[I 2023-04-26 00:28:01,131][39m Trial 111 finished with value: 0.7368421052631579 and parameters: {'objective': 'CrossEntropy', 'colsample_bylevel': 0.07306489137625498, 'depth': 11, 'boosting_type': 'Ordered', 'bootstrap_type': 'Bernoulli', 'subsample': 0.794067275299817}. Best is trial 106 with value: 0.7578947368421053.
[32m[I 2023-04-26 00:28:04,947][39m Trial 112 finished with value: 0.7446808510638298 and parameters: {'objective': 'CrossEntropy', 'colsample_bylevel': 0.049905312719224416, 'depth': 12, 'boosting_type': 'Ordered', 'bootstrap_type': 'Bernoulli', 'subsample': 0.48961684830740043}. Best is trial 106 with value: 0.7578947368421053.
[32m[I 2023-04-26 00:28:06,528][39m Trial 113 finished with value: 0.7446808510638298 and parameters: {'objective': 'CrossEntropy', 'colsample_bylevel': 0.05208346878580165, 'depth': 5, 'boosting_type': 'Plain', 'bootstrap_type': 'Bernoulli', 'subsample': 0.8212863145131276}. Best is trial 106 with value: 0.7578947368421053.
[32m[I 2023-04-26 00:28:10,276][39m Trial 114 finished with value: 0.7216494845360826 and parameters: {'objective': 'CrossEntropy', 'colsample_bylevel': 0.05658604120250615, 'depth': 10, 'boosting_type': 'Ordered', 'bootstrap_type': 'Bernoulli', 'subsample': 0.6719121270979354}. Best is trial 106 with value: 0.7578947368421053.
[32m[I 2023-04-26 00:28:12,747][39m Trial 115 finished with value: 0.7526881720430108 and parameters: {'objective': 'CrossEntropy', 'colsample_bylevel': 0.058548200097545994, 'depth': 12, 'boosting_type': 'Plain', 'bootstrap_type': 'Bernoulli', 'subsample': 0.5442652823267887}. Best is trial 106 with value: 0.7578947368421053.
[32m[I 2023-04-26 00:28:16,468][39m Trial 116 finished with value: 0.7578947368421053 and parameters: {'objective': 'CrossEntropy', 'colsample_bylevel': 0.0590841376305525, 'depth': 12, 'boosting_type': 'Ordered', 'bootstrap_type': 'Bernoulli', 'subsample': 0.5484392168388326}. Best is trial 106 with value: 0.7578947368421053.
[32m[I 2023-04-26 00:28:20,510][39m Trial 117 finished with value: 0.7446808510638298 and parameters: {'objective': 'CrossEntropy', 'colsample_bylevel': 0.05932981818674672, 'depth': 12, 'boosting_type': 'Ordered', 'bootstrap_type': 'Bernoulli', 'subsample': 0.5137171659897013}. Best is trial 106 with value: 0.7578947368421053.
[32m[I 2023-04-26 00:28:24,787][39m Trial 118 finished with value: 0.7446808510638298 and parameters: {'objective': 'CrossEntropy', 'colsample_bylevel': 0.053477848058628805, 'depth': 12, 'boosting_type': 'Ordered', 'bootstrap_type': 'Bernoulli', 'subsample': 0.5516326785162907}. Best is trial 106 with value: 0.7578947368421053.
[32m[I 2023-04-26 00:28:26,245][39m Trial 119 finished with value: 0.7526881720430108 and parameters: {'objective': 'Logloss', 'colsample_bylevel': 0.05598322609056172, 'depth': 6, 'boosting_type': 'Plain', 'bootstrap_type': 'Bernoulli', 'subsample': 0.46926545912318884}. Best is trial 106 with value: 0.7578947368421053.
[32m[I 2023-04-26 00:28:27,756][39m Trial 120 finished with value: 0.7446808510638298 and parameters: {'objective': 'Logloss', 'colsample_bylevel': 0.05431685560143215, 'depth': 7, 'boosting_type': 'Plain', 'bootstrap_type': 'Bernoulli', 'subsample': 0.5616252791431423}. Best is trial 106 with value: 0.7578947368421053.
[32m[I 2023-04-26 00:28:29,226][39m Trial 121 finished with value: 0.7578947368421053 and parameters: {'objective': 'Logloss', 'colsample_bylevel': 0.05805260858489103, 'depth': 12, 'boosting_type': 'Plain', 'bootstrap_type': 'Bernoulli', 'subsample': 0.46827439044359936}. Best is trial 106 with value: 0.7578947368421053.
[32m[I 2023-04-26 00:28:30,696][39m Trial 122 finished with value: 0.7368421052631579 and parameters: {'objective': 'Logloss', 'colsample_bylevel': 0.05801479104533735, 'depth': 6, 'boosting_type': 'Plain', 'bootstrap_type': 'Bernoulli', 'subsample': 0.47024597729220097}. Best is trial 106 with value: 0.7578947368421053.
[32m[I 2023-04-26 00:28:32,256][39m Trial 123 finished with value: 0.7216494845360826 and parameters: {'objective': 'Logloss', 'colsample_bylevel': 0.04777487666816933, 'depth': 12, 'boosting_type': 'Plain', 'bootstrap_type': 'Bernoulli', 'subsample': 0.4884746988580951}. Best is trial 106 with value: 0.7578947368421053.
[32m[I 2023-04-26 00:28:33,908][39m Trial 124 finished with value: 0.7446808510638298 and parameters: {'objective': 'Logloss', 'colsample_bylevel': 0.05976607808611218, 'depth': 12, 'boosting_type': 'Plain', 'bootstrap_type': 'Bernoulli', 'subsample': 0.38091088571411635}. Best is trial 106 with value: 0.7578947368421053.
[32m[I 2023-04-26 00:28:35,610][39m Trial 125 finished with value: 0.7157894736842105 and parameters: {'objective': 'Logloss', 'colsample_bylevel': 0.06222953193833279, 'depth': 11, 'boosting_type': 'Plain', 'bootstrap_type': 'Bernoulli', 'subsample': 0.6279947099366058}. Best is trial 106 with value: 0.7578947368421053.
[32m[I 2023-04-26 00:28:37,283][39m Trial 126 finished with value: 0.7446808510638298 and parameters: {'objective': 'Logloss', 'colsample_bylevel': 0.09580169845527817, 'depth': 2, 'boosting_type': 'Plain', 'bootstrap_type': 'Bayesian', 'bagging_temperature': 5.017395617877053}. Best is trial 106 with value: 0.7578947368421053.
[32m[I 2023-04-26 00:28:38,661][39m Trial 127 finished with value: 0.7446808510638298 and parameters: {'objective': 'Logloss', 'colsample_bylevel': 0.055634789928024245, 'depth': 12, 'boosting_type': 'Plain', 'bootstrap_type': 'Bernoulli', 'subsample': 0.413302746726565}. Best is trial 106 with value: 0.7578947368421053.
[32m[I 2023-04-26 00:28:40,519][39m Trial 128 finished with value: 0.7446808510638298 and parameters: {'objective': 'Logloss', 'colsample_bylevel': 0.06389970703729483, 'depth': 9, 'boosting_type': 'Plain', 'bootstrap_type': 'Bernoulli', 'subsample': 0.5294766223719927}. Best is trial 106 with value: 0.7578947368421053.
[32m[I 2023-04-26 00:28:42,326][39m Trial 129 finished with value: 0.7096774193548387 and parameters: {'objective': 'Logloss', 'colsample_bylevel': 0.08544322952787303, 'depth': 12, 'boosting_type': 'Plain', 'bootstrap_type': 'MVS'}. Best is trial 106 with value: 0.7578947368421053.
[32m[I 2023-04-26 00:28:44,134][39m Trial 130 finished with value: 0.7311827956989247 and parameters: {'objective': 'Logloss', 'colsample_bylevel': 0.09012802575412468, 'depth': 12, 'boosting_type': 'Plain', 'bootstrap_type': 'Bernoulli', 'subsample': 0.3210914479725272}. Best is trial 106 with value: 0.7578947368421053.
[32m[I 2023-04-26 00:28:48,337][39m Trial 131 finished with value: 0.7291666666666666 and parameters: {'objective': 'CrossEntropy', 'colsample_bylevel': 0.05738117556502058, 'depth': 6, 'boosting_type': 'Ordered', 'bootstrap_type': 'Bernoulli', 'subsample': 0.5950628701658404}. Best is trial 106 with value: 0.7578947368421053.
[32m[I 2023-04-26 00:28:52,725][39m Trial 132 finished with value: 0.7446808510638298 and parameters: {'objective': 'CrossEntropy', 'colsample_bylevel': 0.08767878687014496, 'depth': 12, 'boosting_type': 'Ordered', 'bootstrap_type': 'MVS'}. Best is trial 106 with value: 0.7578947368421053.
[32m[I 2023-04-26 00:28:54,352][39m Trial 133 finished with value: 0.7526881720430108 and parameters: {'objective': 'CrossEntropy', 'colsample_bylevel': 0.0593359640622001, 'depth': 5, 'boosting_type': 'Plain', 'bootstrap_type': 'Bernoulli', 'subsample': 0.5173577155885756}. Best is trial 106 with value: 0.7578947368421053.
[32m[I 2023-04-26 00:28:57,074][39m Trial 134 finished with value: 0.7578947368421053 and parameters: {'objective': 'CrossEntropy', 'colsample_bylevel': 0.060463018708509265, 'depth': 4, 'boosting_type': 'Plain', 'bootstrap_type': 'Bernoulli', 'subsample': 0.4592619359344583}. Best is trial 106 with value: 0.7578947368421053.
[32m[I 2023-04-26 00:28:58,557][39m Trial 135 finished with value: 0.7291666666666666 and parameters: {'objective': 'CrossEntropy', 'colsample_bylevel': 0.060860897315877564, 'depth': 5, 'boosting_type': 'Plain', 'bootstrap_type': 'Bernoulli', 'subsample': 0.474749154908164}. Best is trial 106 with value: 0.7578947368421053.
