[32m[I 2023-04-26 00:29:00,046][39m Trial 136 finished with value: 0.7311827956989247 and parameters: {'objective': 'CrossEntropy', 'colsample_bylevel': 0.06309034571742224, 'depth': 4, 'boosting_type': 'Plain', 'bootstrap_type': 'Bernoulli', 'subsample': 0.4171804556078889}. Best is trial 106 with value: 0.7578947368421053.
[32m[I 2023-04-26 00:29:01,602][39m Trial 137 finished with value: 0.7368421052631579 and parameters: {'objective': 'Logloss', 'colsample_bylevel': 0.05898171371325389, 'depth': 6, 'boosting_type': 'Plain', 'bootstrap_type': 'Bernoulli', 'subsample': 0.5106076045167779}. Best is trial 106 with value: 0.7578947368421053.
[32m[I 2023-04-26 00:29:03,200][39m Trial 138 finished with value: 0.7526881720430108 and parameters: {'objective': 'CrossEntropy', 'colsample_bylevel': 0.06915131566576929, 'depth': 5, 'boosting_type': 'Plain', 'bootstrap_type': 'Bernoulli', 'subsample': 0.4587368666236528}. Best is trial 106 with value: 0.7578947368421053.
[32m[I 2023-04-26 00:29:04,244][39m Trial 139 finished with value: 0.7058823529411764 and parameters: {'objective': 'CrossEntropy', 'colsample_bylevel': 0.010415361803901013, 'depth': 5, 'boosting_type': 'Plain', 'bootstrap_type': 'Bernoulli', 'subsample': 0.4504735623975504}. Best is trial 106 with value: 0.7578947368421053.
[32m[I 2023-04-26 00:29:05,860][39m Trial 140 finished with value: 0.7368421052631579 and parameters: {'objective': 'CrossEntropy', 'colsample_bylevel': 0.06843872082149541, 'depth': 5, 'boosting_type': 'Plain', 'bootstrap_type': 'Bernoulli', 'subsample': 0.46688248550850875}. Best is trial 106 with value: 0.7578947368421053.
[32m[I 2023-04-26 00:29:07,364][39m Trial 141 finished with value: 0.7311827956989247 and parameters: {'objective': 'CrossEntropy', 'colsample_bylevel': 0.060618938823437, 'depth': 6, 'boosting_type': 'Plain', 'bootstrap_type': 'Bernoulli', 'subsample': 0.540003394079648}. Best is trial 106 with value: 0.7578947368421053.
[32m[I 2023-04-26 00:29:08,786][39m Trial 142 finished with value: 0.7368421052631579 and parameters: {'objective': 'CrossEntropy', 'colsample_bylevel': 0.05548859438544791, 'depth': 5, 'boosting_type': 'Plain', 'bootstrap_type': 'Bernoulli', 'subsample': 0.49886264187192575}. Best is trial 106 with value: 0.7578947368421053.
[32m[I 2023-04-26 00:29:10,320][39m Trial 143 finished with value: 0.7096774193548387 and parameters: {'objective': 'CrossEntropy', 'colsample_bylevel': 0.06574163972648037, 'depth': 4, 'boosting_type': 'Plain', 'bootstrap_type': 'MVS'}. Best is trial 106 with value: 0.7578947368421053.
[32m[I 2023-04-26 00:29:12,334][39m Trial 144 finished with value: 0.7578947368421053 and parameters: {'objective': 'CrossEntropy', 'colsample_bylevel': 0.0610337249574918, 'depth': 5, 'boosting_type': 'Plain', 'bootstrap_type': 'Bernoulli', 'subsample': 0.43095221080888624}. Best is trial 106 with value: 0.7578947368421053.
[32m[I 2023-04-26 00:29:13,826][39m Trial 145 finished with value: 0.7252747252747254 and parameters: {'objective': 'CrossEntropy', 'colsample_bylevel': 0.06296591690960061, 'depth': 5, 'boosting_type': 'Plain', 'bootstrap_type': 'Bernoulli', 'subsample': 0.40714871704704525}. Best is trial 106 with value: 0.7578947368421053.
[32m[I 2023-04-26 00:29:15,361][39m Trial 146 finished with value: 0.7526881720430108 and parameters: {'objective': 'CrossEntropy', 'colsample_bylevel': 0.06141833061956886, 'depth': 5, 'boosting_type': 'Plain', 'bootstrap_type': 'Bernoulli', 'subsample': 0.43417543623885996}. Best is trial 106 with value: 0.7578947368421053.
[32m[I 2023-04-26 00:29:17,120][39m Trial 147 finished with value: 0.7142857142857142 and parameters: {'objective': 'CrossEntropy', 'colsample_bylevel': 0.061464782525386535, 'depth': 4, 'boosting_type': 'Plain', 'bootstrap_type': 'Bernoulli', 'subsample': 0.3787187303143933}. Best is trial 106 with value: 0.7578947368421053.
[32m[I 2023-04-26 00:29:19,348][39m Trial 148 finished with value: 0.717391304347826 and parameters: {'objective': 'CrossEntropy', 'colsample_bylevel': 0.06696010380503661, 'depth': 5, 'boosting_type': 'Plain', 'bootstrap_type': 'Bernoulli', 'subsample': 0.4573360838241829}. Best is trial 106 with value: 0.7578947368421053.
[32m[I 2023-04-26 00:29:20,674][39m Trial 149 finished with value: 0.7446808510638298 and parameters: {'objective': 'CrossEntropy', 'colsample_bylevel': 0.05899204090171267, 'depth': 4, 'boosting_type': 'Plain', 'bootstrap_type': 'Bernoulli', 'subsample': 0.4049549938235052}. Best is trial 106 with value: 0.7578947368421053.
[32m[I 2023-04-26 00:29:22,062][39m Trial 150 finished with value: 0.7291666666666666 and parameters: {'objective': 'Logloss', 'colsample_bylevel': 0.05669687035286126, 'depth': 5, 'boosting_type': 'Plain', 'bootstrap_type': 'Bernoulli', 'subsample': 0.43583591310547204}. Best is trial 106 with value: 0.7578947368421053.
[32m[I 2023-04-26 00:29:24,327][39m Trial 151 finished with value: 0.7526881720430108 and parameters: {'objective': 'CrossEntropy', 'colsample_bylevel': 0.06463917928817518, 'depth': 6, 'boosting_type': 'Plain', 'bootstrap_type': 'Bernoulli', 'subsample': 0.3542998284279095}. Best is trial 106 with value: 0.7578947368421053.
[32m[I 2023-04-26 00:29:26,457][39m Trial 152 finished with value: 0.717391304347826 and parameters: {'objective': 'CrossEntropy', 'colsample_bylevel': 0.06459502949657459, 'depth': 6, 'boosting_type': 'Plain', 'bootstrap_type': 'Bernoulli', 'subsample': 0.3599952156700119}. Best is trial 106 with value: 0.7578947368421053.
[32m[I 2023-04-26 00:29:28,029][39m Trial 153 finished with value: 0.7096774193548387 and parameters: {'objective': 'CrossEntropy', 'colsample_bylevel': 0.06093105787731402, 'depth': 7, 'boosting_type': 'Plain', 'bootstrap_type': 'Bernoulli', 'subsample': 0.4307763655019065}. Best is trial 106 with value: 0.7578947368421053.
[32m[I 2023-04-26 00:29:29,710][39m Trial 154 finished with value: 0.7368421052631579 and parameters: {'objective': 'CrossEntropy', 'colsample_bylevel': 0.06822426156157357, 'depth': 6, 'boosting_type': 'Plain', 'bootstrap_type': 'Bernoulli', 'subsample': 0.2889414034287105}. Best is trial 106 with value: 0.7578947368421053.
[32m[I 2023-04-26 00:29:31,104][39m Trial 155 finished with value: 0.7311827956989247 and parameters: {'objective': 'CrossEntropy', 'colsample_bylevel': 0.0588578468677743, 'depth': 6, 'boosting_type': 'Plain', 'bootstrap_type': 'Bernoulli', 'subsample': 0.5047248978519673}. Best is trial 106 with value: 0.7578947368421053.
[32m[I 2023-04-26 00:29:32,530][39m Trial 156 finished with value: 0.7368421052631579 and parameters: {'objective': 'CrossEntropy', 'colsample_bylevel': 0.06264921149409776, 'depth': 5, 'boosting_type': 'Plain', 'bootstrap_type': 'Bernoulli', 'subsample': 0.46524260885071594}. Best is trial 106 with value: 0.7578947368421053.
[32m[I 2023-04-26 00:29:34,097][39m Trial 157 finished with value: 0.7446808510638298 and parameters: {'objective': 'CrossEntropy', 'colsample_bylevel': 0.06528082796185733, 'depth': 5, 'boosting_type': 'Plain', 'bootstrap_type': 'Bernoulli', 'subsample': 0.567053610475791}. Best is trial 106 with value: 0.7578947368421053.
[32m[I 2023-04-26 00:29:35,461][39m Trial 158 finished with value: 0.7446808510638298 and parameters: {'objective': 'CrossEntropy', 'colsample_bylevel': 0.056987662974031024, 'depth': 6, 'boosting_type': 'Plain', 'bootstrap_type': 'Bayesian', 'bagging_temperature': 8.322748386535011}. Best is trial 106 with value: 0.7578947368421053.
[32m[I 2023-04-26 00:29:37,031][39m Trial 159 finished with value: 0.7096774193548387 and parameters: {'objective': 'CrossEntropy', 'colsample_bylevel': 0.0701367753267289, 'depth': 7, 'boosting_type': 'Plain', 'bootstrap_type': 'Bernoulli', 'subsample': 0.48332436783581834}. Best is trial 106 with value: 0.7578947368421053.
[32m[I 2023-04-26 00:29:38,865][39m Trial 160 finished with value: 0.7368421052631579 and parameters: {'objective': 'Logloss', 'colsample_bylevel': 0.060275191969591656, 'depth': 4, 'boosting_type': 'Plain', 'bootstrap_type': 'Bernoulli', 'subsample': 0.5247497852557278}. Best is trial 106 with value: 0.7578947368421053.
[32m[I 2023-04-26 00:29:40,553][39m Trial 161 finished with value: 0.7291666666666666 and parameters: {'objective': 'CrossEntropy', 'colsample_bylevel': 0.06352773199182188, 'depth': 5, 'boosting_type': 'Plain', 'bootstrap_type': 'Bernoulli', 'subsample': 0.3920025273648867}. Best is trial 106 with value: 0.7578947368421053.
[32m[I 2023-04-26 00:29:42,072][39m Trial 162 finished with value: 0.717391304347826 and parameters: {'objective': 'CrossEntropy', 'colsample_bylevel': 0.06113827145470198, 'depth': 6, 'boosting_type': 'Plain', 'bootstrap_type': 'Bernoulli', 'subsample': 0.42679554996268304}. Best is trial 106 with value: 0.7578947368421053.
[32m[I 2023-04-26 00:29:43,507][39m Trial 163 finished with value: 0.7083333333333334 and parameters: {'objective': 'CrossEntropy', 'colsample_bylevel': 0.05516462919102697, 'depth': 5, 'boosting_type': 'Plain', 'bootstrap_type': 'Bernoulli', 'subsample': 0.5399660810689314}. Best is trial 106 with value: 0.7578947368421053.
[32m[I 2023-04-26 00:29:45,029][39m Trial 164 finished with value: 0.7578947368421053 and parameters: {'objective': 'CrossEntropy', 'colsample_bylevel': 0.058226930390692086, 'depth': 5, 'boosting_type': 'Plain', 'bootstrap_type': 'Bernoulli', 'subsample': 0.44655954156691197}. Best is trial 106 with value: 0.7578947368421053.
[32m[I 2023-04-26 00:29:46,833][39m Trial 165 finished with value: 0.7446808510638298 and parameters: {'objective': 'CrossEntropy', 'colsample_bylevel': 0.05851398088867043, 'depth': 5, 'boosting_type': 'Plain', 'bootstrap_type': 'Bernoulli', 'subsample': 0.4533842930019721}. Best is trial 106 with value: 0.7578947368421053.
[32m[I 2023-04-26 00:29:48,416][39m Trial 166 finished with value: 0.7142857142857142 and parameters: {'objective': 'CrossEntropy', 'colsample_bylevel': 0.05332013157016272, 'depth': 4, 'boosting_type': 'Plain', 'bootstrap_type': 'MVS'}. Best is trial 106 with value: 0.7578947368421053.
[32m[I 2023-04-26 00:29:49,789][39m Trial 167 finished with value: 0.7446808510638298 and parameters: {'objective': 'CrossEntropy', 'colsample_bylevel': 0.05738155710119798, 'depth': 12, 'boosting_type': 'Plain', 'bootstrap_type': 'Bernoulli', 'subsample': 0.47586294920018324}. Best is trial 106 with value: 0.7578947368421053.
[32m[I 2023-04-26 00:29:51,222][39m Trial 168 finished with value: 0.7368421052631579 and parameters: {'objective': 'CrossEntropy', 'colsample_bylevel': 0.05945378575207104, 'depth': 5, 'boosting_type': 'Plain', 'bootstrap_type': 'Bernoulli', 'subsample': 0.340515184206483}. Best is trial 106 with value: 0.7578947368421053.
[32m[I 2023-04-26 00:29:53,358][39m Trial 169 finished with value: 0.7368421052631579 and parameters: {'objective': 'CrossEntropy', 'colsample_bylevel': 0.06182983186435098, 'depth': 6, 'boosting_type': 'Plain', 'bootstrap_type': 'Bernoulli', 'subsample': 0.7031168504523557}. Best is trial 106 with value: 0.7578947368421053.
[32m[I 2023-04-26 00:29:54,770][39m Trial 170 finished with value: 0.7446808510638298 and parameters: {'objective': 'Logloss', 'colsample_bylevel': 0.05446526043949787, 'depth': 5, 'boosting_type': 'Plain', 'bootstrap_type': 'Bernoulli', 'subsample': 0.44027420045568877}. Best is trial 106 with value: 0.7578947368421053.
[32m[I 2023-04-26 00:29:56,222][39m Trial 171 finished with value: 0.7446808510638298 and parameters: {'objective': 'CrossEntropy', 'colsample_bylevel': 0.06348112859540253, 'depth': 5, 'boosting_type': 'Plain', 'bootstrap_type': 'Bernoulli', 'subsample': 0.49880529843517235}. Best is trial 106 with value: 0.7578947368421053.
[32m[I 2023-04-26 00:29:57,822][39m Trial 172 finished with value: 0.7446808510638298 and parameters: {'objective': 'CrossEntropy', 'colsample_bylevel': 0.0660583445505533, 'depth': 4, 'boosting_type': 'Plain', 'bootstrap_type': 'Bernoulli', 'subsample': 0.23525648549599837}. Best is trial 106 with value: 0.7578947368421053.
[32m[I 2023-04-26 00:29:59,364][39m Trial 173 finished with value: 0.7446808510638298 and parameters: {'objective': 'CrossEntropy', 'colsample_bylevel': 0.0580805217853424, 'depth': 12, 'boosting_type': 'Plain', 'bootstrap_type': 'Bernoulli', 'subsample': 0.7404253965764487}. Best is trial 106 with value: 0.7578947368421053.
[32m[I 2023-04-26 00:30:00,959][39m Trial 174 finished with value: 0.7216494845360826 and parameters: {'objective': 'CrossEntropy', 'colsample_bylevel': 0.060316640234555643, 'depth': 3, 'boosting_type': 'Plain', 'bootstrap_type': 'Bernoulli', 'subsample': 0.6043927799465019}. Best is trial 106 with value: 0.7578947368421053.
[32m[I 2023-04-26 00:30:02,417][39m Trial 175 finished with value: 0.7578947368421053 and parameters: {'objective': 'CrossEntropy', 'colsample_bylevel': 0.05674316568853581, 'depth': 5, 'boosting_type': 'Plain', 'bootstrap_type': 'Bernoulli', 'subsample': 0.4797898061557478}. Best is trial 106 with value: 0.7578947368421053.
[32m[I 2023-04-26 00:30:04,297][39m Trial 176 finished with value: 0.7368421052631579 and parameters: {'objective': 'CrossEntropy', 'colsample_bylevel': 0.05624990748937533, 'depth': 5, 'boosting_type': 'Plain', 'bootstrap_type': 'Bernoulli', 'subsample': 0.4843602192047342}. Best is trial 106 with value: 0.7578947368421053.
[32m[I 2023-04-26 00:30:05,627][39m Trial 177 finished with value: 0.7526881720430108 and parameters: {'objective': 'CrossEntropy', 'colsample_bylevel': 0.051988789951995976, 'depth': 5, 'boosting_type': 'Plain', 'bootstrap_type': 'Bernoulli', 'subsample': 0.4584554953135345}. Best is trial 106 with value: 0.7578947368421053.
[32m[I 2023-04-26 00:30:07,598][39m Trial 178 finished with value: 0.7216494845360826 and parameters: {'objective': 'CrossEntropy', 'colsample_bylevel': 0.05158750469301917, 'depth': 5, 'boosting_type': 'Plain', 'bootstrap_type': 'Bernoulli', 'subsample': 0.4547048782515839}. Best is trial 106 with value: 0.7578947368421053.
[32m[I 2023-04-26 00:30:09,009][39m Trial 179 finished with value: 0.7446808510638298 and parameters: {'objective': 'CrossEntropy', 'colsample_bylevel': 0.05559244185609265, 'depth': 4, 'boosting_type': 'Plain', 'bootstrap_type': 'Bernoulli', 'subsample': 0.43296626174045166}. Best is trial 106 with value: 0.7578947368421053.
[32m[I 2023-04-26 00:30:10,386][39m Trial 180 finished with value: 0.7446808510638298 and parameters: {'objective': 'Logloss', 'colsample_bylevel': 0.052725575303552374, 'depth': 5, 'boosting_type': 'Plain', 'bootstrap_type': 'Bernoulli', 'subsample': 0.5013795039686865}. Best is trial 106 with value: 0.7578947368421053.
[32m[I 2023-04-26 00:30:11,817][39m Trial 181 finished with value: 0.7096774193548387 and parameters: {'objective': 'CrossEntropy', 'colsample_bylevel': 0.05851477136966371, 'depth': 6, 'boosting_type': 'Plain', 'bootstrap_type': 'Bernoulli', 'subsample': 0.39497069447087496}. Best is trial 106 with value: 0.7578947368421053.
[32m[I 2023-04-26 00:30:13,837][39m Trial 182 finished with value: 0.7096774193548387 and parameters: {'objective': 'CrossEntropy', 'colsample_bylevel': 0.0613000054585314, 'depth': 5, 'boosting_type': 'Plain', 'bootstrap_type': 'MVS'}. Best is trial 106 with value: 0.7578947368421053.
[32m[I 2023-04-26 00:30:15,325][39m Trial 183 finished with value: 0.7368421052631579 and parameters: {'objective': 'CrossEntropy', 'colsample_bylevel': 0.06252170541844876, 'depth': 5, 'boosting_type': 'Plain', 'bootstrap_type': 'Bernoulli', 'subsample': 0.46317540331939294}. Best is trial 106 with value: 0.7578947368421053.
[32m[I 2023-04-26 00:30:16,837][39m Trial 184 finished with value: 0.7311827956989247 and parameters: {'objective': 'CrossEntropy', 'colsample_bylevel': 0.06419459609916454, 'depth': 6, 'boosting_type': 'Plain', 'bootstrap_type': 'Bernoulli', 'subsample': 0.5123518568547882}. Best is trial 106 with value: 0.7578947368421053.
[32m[I 2023-04-26 00:30:20,907][39m Trial 185 finished with value: 0.7446808510638298 and parameters: {'objective': 'CrossEntropy', 'colsample_bylevel': 0.05759479963432386, 'depth': 12, 'boosting_type': 'Ordered', 'bootstrap_type': 'Bernoulli', 'subsample': 0.4827409224763164}. Best is trial 106 with value: 0.7578947368421053.
[32m[I 2023-04-26 00:30:22,809][39m Trial 186 finished with value: 0.7446808510638298 and parameters: {'objective': 'CrossEntropy', 'colsample_bylevel': 0.059910346021865284, 'depth': 5, 'boosting_type': 'Plain', 'bootstrap_type': 'Bernoulli', 'subsample': 0.4459980356309737}. Best is trial 106 with value: 0.7578947368421053.
[32m[I 2023-04-26 00:30:26,119][39m Trial 187 finished with value: 0.7368421052631579 and parameters: {'objective': 'CrossEntropy', 'colsample_bylevel': 0.05402394473208594, 'depth': 12, 'boosting_type': 'Ordered', 'bootstrap_type': 'Bernoulli', 'subsample': 0.5347661511996973}. Best is trial 106 with value: 0.7578947368421053.
[32m[I 2023-04-26 00:30:28,700][39m Trial 188 finished with value: 0.7446808510638298 and parameters: {'objective': 'Logloss', 'colsample_bylevel': 0.05611331569186989, 'depth': 5, 'boosting_type': 'Plain', 'bootstrap_type': 'Bernoulli', 'subsample': 0.4672863558025787}. Best is trial 106 with value: 0.7578947368421053.
[32m[I 2023-04-26 00:30:30,381][39m Trial 189 finished with value: 0.7578947368421053 and parameters: {'objective': 'CrossEntropy', 'colsample_bylevel': 0.06684702850798294, 'depth': 6, 'boosting_type': 'Plain', 'bootstrap_type': 'Bernoulli', 'subsample': 0.5815751153475088}. Best is trial 106 with value: 0.7578947368421053.
[32m[I 2023-04-26 00:30:32,021][39m Trial 190 finished with value: 0.7446808510638298 and parameters: {'objective': 'CrossEntropy', 'colsample_bylevel': 0.06919376069418698, 'depth': 7, 'boosting_type': 'Plain', 'bootstrap_type': 'Bernoulli', 'subsample': 0.563953398775761}. Best is trial 106 with value: 0.7578947368421053.
[32m[I 2023-04-26 00:30:33,486][39m Trial 191 finished with value: 0.7446808510638298 and parameters: {'objective': 'CrossEntropy', 'colsample_bylevel': 0.06639099824073934, 'depth': 6, 'boosting_type': 'Plain', 'bootstrap_type': 'Bernoulli', 'subsample': 0.42530636521344906}. Best is trial 106 with value: 0.7578947368421053.
[32m[I 2023-04-26 00:30:35,084][39m Trial 192 finished with value: 0.7446808510638298 and parameters: {'objective': 'CrossEntropy', 'colsample_bylevel': 0.06492224090161082, 'depth': 6, 'boosting_type': 'Plain', 'bootstrap_type': 'Bernoulli', 'subsample': 0.5517039102791013}. Best is trial 106 with value: 0.7578947368421053.
[32m[I 2023-04-26 00:30:36,582][39m Trial 193 finished with value: 0.717391304347826 and parameters: {'objective': 'CrossEntropy', 'colsample_bylevel': 0.06186087536689218, 'depth': 5, 'boosting_type': 'Plain', 'bootstrap_type': 'Bernoulli', 'subsample': 0.5856709056683247}. Best is trial 106 with value: 0.7578947368421053.
[32m[I 2023-04-26 00:30:38,070][39m Trial 194 finished with value: 0.7311827956989247 and parameters: {'objective': 'CrossEntropy', 'colsample_bylevel': 0.059799403632277315, 'depth': 6, 'boosting_type': 'Plain', 'bootstrap_type': 'Bayesian', 'bagging_temperature': 5.964808445602406}. Best is trial 106 with value: 0.7578947368421053.
[32m[I 2023-04-26 00:30:39,689][39m Trial 195 finished with value: 0.7368421052631579 and parameters: {'objective': 'CrossEntropy', 'colsample_bylevel': 0.06777892664648295, 'depth': 4, 'boosting_type': 'Plain', 'bootstrap_type': 'Bernoulli', 'subsample': 0.5178881329245115}. Best is trial 106 with value: 0.7578947368421053.
[32m[I 2023-04-26 00:30:43,659][39m Trial 196 finished with value: 0.6857142857142857 and parameters: {'objective': 'CrossEntropy', 'colsample_bylevel': 0.058551504328724434, 'depth': 1, 'boosting_type': 'Ordered', 'bootstrap_type': 'Bernoulli', 'subsample': 0.6704129833066363}. Best is trial 106 with value: 0.7578947368421053.
[32m[I 2023-04-26 00:30:45,210][39m Trial 197 finished with value: 0.717391304347826 and parameters: {'objective': 'CrossEntropy', 'colsample_bylevel': 0.07143362967793593, 'depth': 5, 'boosting_type': 'Plain', 'bootstrap_type': 'Bernoulli', 'subsample': 0.6318593106918691}. Best is trial 106 with value: 0.7578947368421053.
[32m[I 2023-04-26 00:30:46,679][39m Trial 198 finished with value: 0.7446808510638298 and parameters: {'objective': 'Logloss', 'colsample_bylevel': 0.05702229057936708, 'depth': 5, 'boosting_type': 'Plain', 'bootstrap_type': 'MVS'}. Best is trial 106 with value: 0.7578947368421053.
[32m[I 2023-04-26 00:30:48,968][39m Trial 199 finished with value: 0.7526881720430108 and parameters: {'objective': 'CrossEntropy', 'colsample_bylevel': 0.06388943424599265, 'depth': 12, 'boosting_type': 'Plain', 'bootstrap_type': 'Bernoulli', 'subsample': 0.3713095748696861}. Best is trial 106 with value: 0.7578947368421053.
[32m[I 2023-04-26 00:30:50,757][39m Trial 200 finished with value: 0.7578947368421053 and parameters: {'objective': 'CrossEntropy', 'colsample_bylevel': 0.06437913048459641, 'depth': 7, 'boosting_type': 'Plain', 'bootstrap_type': 'Bernoulli', 'subsample': 0.4120678720218026}. Best is trial 106 with value: 0.7578947368421053.
[32m[I 2023-04-26 00:30:52,251][39m Trial 201 finished with value: 0.7311827956989247 and parameters: {'objective': 'CrossEntropy', 'colsample_bylevel': 0.06377460633702005, 'depth': 7, 'boosting_type': 'Plain', 'bootstrap_type': 'Bernoulli', 'subsample': 0.40390370902380107}. Best is trial 106 with value: 0.7578947368421053.
[32m[I 2023-04-26 00:30:53,670][39m Trial 202 finished with value: 0.7446808510638298 and parameters: {'objective': 'CrossEntropy', 'colsample_bylevel': 0.06128251944219885, 'depth': 12, 'boosting_type': 'Plain', 'bootstrap_type': 'Bernoulli', 'subsample': 0.3664137160644576}. Best is trial 106 with value: 0.7578947368421053.
