[32m[I 2023-04-26 00:40:57,577][39m Trial 469 finished with value: 0.7526881720430108 and parameters: {'objective': 'Logloss', 'colsample_bylevel': 0.07546143365562949, 'depth': 4, 'boosting_type': 'Plain', 'bootstrap_type': 'Bayesian', 'bagging_temperature': 9.594673854873657}. Best is trial 382 with value: 0.7789473684210526.
[32m[I 2023-04-26 00:40:59,237][39m Trial 470 finished with value: 0.7526881720430108 and parameters: {'objective': 'Logloss', 'colsample_bylevel': 0.07746245649014837, 'depth': 4, 'boosting_type': 'Plain', 'bootstrap_type': 'Bayesian', 'bagging_temperature': 9.803617195386863}. Best is trial 382 with value: 0.7789473684210526.
[32m[I 2023-04-26 00:41:00,766][39m Trial 471 finished with value: 0.7446808510638298 and parameters: {'objective': 'Logloss', 'colsample_bylevel': 0.07529976577741365, 'depth': 4, 'boosting_type': 'Plain', 'bootstrap_type': 'Bayesian', 'bagging_temperature': 9.9945877694488}. Best is trial 382 with value: 0.7789473684210526.
[32m[I 2023-04-26 00:41:02,506][39m Trial 472 finished with value: 0.7578947368421053 and parameters: {'objective': 'Logloss', 'colsample_bylevel': 0.07838957129046738, 'depth': 3, 'boosting_type': 'Plain', 'bootstrap_type': 'Bayesian', 'bagging_temperature': 9.34421699269552}. Best is trial 382 with value: 0.7789473684210526.
[32m[I 2023-04-26 00:41:04,033][39m Trial 473 finished with value: 0.7446808510638298 and parameters: {'objective': 'Logloss', 'colsample_bylevel': 0.07368472748519687, 'depth': 3, 'boosting_type': 'Plain', 'bootstrap_type': 'Bayesian', 'bagging_temperature': 9.355324554335704}. Best is trial 382 with value: 0.7789473684210526.
[32m[I 2023-04-26 00:41:05,654][39m Trial 474 finished with value: 0.7311827956989247 and parameters: {'objective': 'Logloss', 'colsample_bylevel': 0.07139008006647247, 'depth': 4, 'boosting_type': 'Plain', 'bootstrap_type': 'Bayesian', 'bagging_temperature': 9.125810287109019}. Best is trial 382 with value: 0.7789473684210526.
[32m[I 2023-04-26 00:41:07,753][39m Trial 475 finished with value: 0.7391304347826086 and parameters: {'objective': 'Logloss', 'colsample_bylevel': 0.08155128410383142, 'depth': 8, 'boosting_type': 'Plain', 'bootstrap_type': 'Bayesian', 'bagging_temperature': 9.6368810155232}. Best is trial 382 with value: 0.7789473684210526.
[32m[I 2023-04-26 00:41:09,432][39m Trial 476 finished with value: 0.7659574468085106 and parameters: {'objective': 'Logloss', 'colsample_bylevel': 0.07614038857676081, 'depth': 4, 'boosting_type': 'Plain', 'bootstrap_type': 'Bayesian', 'bagging_temperature': 9.755673704345597}. Best is trial 382 with value: 0.7789473684210526.
[32m[I 2023-04-26 00:41:11,008][39m Trial 477 finished with value: 0.7789473684210526 and parameters: {'objective': 'Logloss', 'colsample_bylevel': 0.07713357220047959, 'depth': 4, 'boosting_type': 'Plain', 'bootstrap_type': 'Bayesian', 'bagging_temperature': 9.854098439414193}. Best is trial 382 with value: 0.7789473684210526.
[32m[I 2023-04-26 00:41:12,842][39m Trial 478 finished with value: 0.7311827956989247 and parameters: {'objective': 'Logloss', 'colsample_bylevel': 0.0813253585355081, 'depth': 4, 'boosting_type': 'Plain', 'bootstrap_type': 'Bayesian', 'bagging_temperature': 9.808706373693305}. Best is trial 382 with value: 0.7789473684210526.
[32m[I 2023-04-26 00:41:14,322][39m Trial 479 finished with value: 0.717391304347826 and parameters: {'objective': 'Logloss', 'colsample_bylevel': 0.07503745182880418, 'depth': 4, 'boosting_type': 'Plain', 'bootstrap_type': 'Bayesian', 'bagging_temperature': 9.505086959177527}. Best is trial 382 with value: 0.7789473684210526.
[32m[I 2023-04-26 00:41:15,977][39m Trial 480 finished with value: 0.7578947368421053 and parameters: {'objective': 'Logloss', 'colsample_bylevel': 0.07800276690807027, 'depth': 4, 'boosting_type': 'Plain', 'bootstrap_type': 'Bayesian', 'bagging_temperature': 9.8143047425444}. Best is trial 382 with value: 0.7789473684210526.
[32m[I 2023-04-26 00:41:17,531][39m Trial 481 finished with value: 0.7789473684210526 and parameters: {'objective': 'Logloss', 'colsample_bylevel': 0.07707803909490885, 'depth': 4, 'boosting_type': 'Plain', 'bootstrap_type': 'Bayesian', 'bagging_temperature': 9.822803404571589}. Best is trial 382 with value: 0.7789473684210526.
[32m[I 2023-04-26 00:41:19,202][39m Trial 482 finished with value: 0.7472527472527474 and parameters: {'objective': 'Logloss', 'colsample_bylevel': 0.07651804180575515, 'depth': 4, 'boosting_type': 'Plain', 'bootstrap_type': 'Bayesian', 'bagging_temperature': 9.680019532204811}. Best is trial 382 with value: 0.7789473684210526.
[32m[I 2023-04-26 00:41:21,045][39m Trial 483 finished with value: 0.7311827956989247 and parameters: {'objective': 'Logloss', 'colsample_bylevel': 0.0788761617198803, 'depth': 4, 'boosting_type': 'Plain', 'bootstrap_type': 'Bayesian', 'bagging_temperature': 9.9868872169071}. Best is trial 382 with value: 0.7789473684210526.
[32m[I 2023-04-26 00:41:23,195][39m Trial 484 finished with value: 0.7659574468085106 and parameters: {'objective': 'Logloss', 'colsample_bylevel': 0.07462658930466795, 'depth': 4, 'boosting_type': 'Plain', 'bootstrap_type': 'Bayesian', 'bagging_temperature': 9.366007880921403}. Best is trial 382 with value: 0.7789473684210526.
[32m[I 2023-04-26 00:41:24,810][39m Trial 485 finished with value: 0.7526881720430108 and parameters: {'objective': 'Logloss', 'colsample_bylevel': 0.07569147283889882, 'depth': 4, 'boosting_type': 'Plain', 'bootstrap_type': 'Bayesian', 'bagging_temperature': 9.559665712146032}. Best is trial 382 with value: 0.7789473684210526.
[32m[I 2023-04-26 00:41:26,380][39m Trial 486 finished with value: 0.7526881720430108 and parameters: {'objective': 'Logloss', 'colsample_bylevel': 0.07387563667612153, 'depth': 4, 'boosting_type': 'Plain', 'bootstrap_type': 'Bayesian', 'bagging_temperature': 9.78778876834374}. Best is trial 382 with value: 0.7789473684210526.
[32m[I 2023-04-26 00:41:28,109][39m Trial 487 finished with value: 0.7311827956989247 and parameters: {'objective': 'Logloss', 'colsample_bylevel': 0.0793418225934201, 'depth': 4, 'boosting_type': 'Plain', 'bootstrap_type': 'Bayesian', 'bagging_temperature': 9.45150717510774}. Best is trial 382 with value: 0.7789473684210526.
[32m[I 2023-04-26 00:41:30,005][39m Trial 488 finished with value: 0.7252747252747254 and parameters: {'objective': 'Logloss', 'colsample_bylevel': 0.08439066056350697, 'depth': 4, 'boosting_type': 'Plain', 'bootstrap_type': 'Bayesian', 'bagging_temperature': 8.339374325761877}. Best is trial 382 with value: 0.7789473684210526.
[32m[I 2023-04-26 00:41:31,815][39m Trial 489 finished with value: 0.7252747252747254 and parameters: {'objective': 'Logloss', 'colsample_bylevel': 0.08201536214488568, 'depth': 4, 'boosting_type': 'Plain', 'bootstrap_type': 'Bayesian', 'bagging_temperature': 9.998389606131711}. Best is trial 382 with value: 0.7789473684210526.
[32m[I 2023-04-26 00:41:33,674][39m Trial 490 finished with value: 0.7526881720430108 and parameters: {'objective': 'Logloss', 'colsample_bylevel': 0.07995069768727986, 'depth': 4, 'boosting_type': 'Plain', 'bootstrap_type': 'Bayesian', 'bagging_temperature': 9.029047552382423}. Best is trial 382 with value: 0.7789473684210526.
[32m[I 2023-04-26 00:41:35,291][39m Trial 491 finished with value: 0.7311827956989247 and parameters: {'objective': 'Logloss', 'colsample_bylevel': 0.0743833287040129, 'depth': 4, 'boosting_type': 'Plain', 'bootstrap_type': 'Bayesian', 'bagging_temperature': 9.310919039149152}. Best is trial 382 with value: 0.7789473684210526.
[32m[I 2023-04-26 00:41:36,961][39m Trial 492 finished with value: 0.7526881720430108 and parameters: {'objective': 'Logloss', 'colsample_bylevel': 0.07653439787646653, 'depth': 4, 'boosting_type': 'Plain', 'bootstrap_type': 'Bayesian', 'bagging_temperature': 9.702947351394663}. Best is trial 382 with value: 0.7789473684210526.
[32m[I 2023-04-26 00:41:38,956][39m Trial 493 finished with value: 0.7311827956989247 and parameters: {'objective': 'Logloss', 'colsample_bylevel': 0.07793867833077037, 'depth': 9, 'boosting_type': 'Plain', 'bootstrap_type': 'Bayesian', 'bagging_temperature': 9.32210300225032}. Best is trial 382 with value: 0.7789473684210526.
[32m[I 2023-04-26 00:41:40,526][39m Trial 494 finished with value: 0.7526881720430108 and parameters: {'objective': 'Logloss', 'colsample_bylevel': 0.07581971038062796, 'depth': 3, 'boosting_type': 'Plain', 'bootstrap_type': 'Bayesian', 'bagging_temperature': 9.62938082136058}. Best is trial 382 with value: 0.7789473684210526.
[32m[I 2023-04-26 00:41:42,107][39m Trial 495 finished with value: 0.7291666666666666 and parameters: {'objective': 'Logloss', 'colsample_bylevel': 0.07400053474944106, 'depth': 3, 'boosting_type': 'Plain', 'bootstrap_type': 'Bayesian', 'bagging_temperature': 9.166564860887027}. Best is trial 382 with value: 0.7789473684210526.
[32m[I 2023-04-26 00:41:43,651][39m Trial 496 finished with value: 0.7526881720430108 and parameters: {'objective': 'Logloss', 'colsample_bylevel': 0.07905747926198659, 'depth': 3, 'boosting_type': 'Plain', 'bootstrap_type': 'Bayesian', 'bagging_temperature': 9.45884343301215}. Best is trial 382 with value: 0.7789473684210526.
[32m[I 2023-04-26 00:41:45,259][39m Trial 497 finished with value: 0.7446808510638298 and parameters: {'objective': 'Logloss', 'colsample_bylevel': 0.0771571576590544, 'depth': 4, 'boosting_type': 'Plain', 'bootstrap_type': 'Bayesian', 'bagging_temperature': 8.655731205421977}. Best is trial 382 with value: 0.7789473684210526.
[32m[I 2023-04-26 00:41:46,925][39m Trial 498 finished with value: 0.7252747252747254 and parameters: {'objective': 'Logloss', 'colsample_bylevel': 0.07201816596277723, 'depth': 4, 'boosting_type': 'Plain', 'bootstrap_type': 'Bayesian', 'bagging_temperature': 9.836051995912708}. Best is trial 382 with value: 0.7789473684210526.
[32m[I 2023-04-26 00:41:48,498][39m Trial 499 finished with value: 0.7526881720430108 and parameters: {'objective': 'Logloss', 'colsample_bylevel': 0.0788918259307517, 'depth': 3, 'boosting_type': 'Plain', 'bootstrap_type': 'Bayesian', 'bagging_temperature': 8.895205242112079}. Best is trial 382 with value: 0.7789473684210526.
Number of finished trials: 500