
[32m[I 2023-04-26 00:21:51,439][39m A new study created in memory with name: no-name-64ced4ac-6abe-4a04-a43a-c79fa63367c2
[32m[I 2023-04-26 00:21:54,550][39m Trial 0 finished with value: 0.6981132075471698 and parameters: {'objective': 'CrossEntropy', 'colsample_bylevel': 0.08601378123618846, 'depth': 1, 'boosting_type': 'Ordered', 'bootstrap_type': 'Bayesian', 'bagging_temperature': 6.674274842064406}. Best is trial 0 with value: 0.6981132075471698.
[32m[I 2023-04-26 00:21:57,450][39m Trial 1 finished with value: 0.7115384615384616 and parameters: {'objective': 'CrossEntropy', 'colsample_bylevel': 0.019320280288929965, 'depth': 4, 'boosting_type': 'Ordered', 'bootstrap_type': 'Bernoulli', 'subsample': 0.5232986770539205}. Best is trial 1 with value: 0.7115384615384616.
[32m[I 2023-04-26 00:21:57,759][39m Trial 2 finished with value: 0.689655172413793 and parameters: {'objective': 'CrossEntropy', 'colsample_bylevel': 0.013420017259192079, 'depth': 4, 'boosting_type': 'Plain', 'bootstrap_type': 'Bayesian', 'bagging_temperature': 7.72568053728302}. Best is trial 1 with value: 0.7115384615384616.
[32m[I 2023-04-26 00:21:59,191][39m Trial 3 finished with value: 0.7291666666666666 and parameters: {'objective': 'Logloss', 'colsample_bylevel': 0.04377616026018087, 'depth': 9, 'boosting_type': 'Plain', 'bootstrap_type': 'Bernoulli', 'subsample': 0.5892075410194951}. Best is trial 3 with value: 0.7291666666666666.
[32m[I 2023-04-26 00:22:02,428][39m Trial 4 finished with value: 0.6999999999999998 and parameters: {'objective': 'Logloss', 'colsample_bylevel': 0.038831505207853376, 'depth': 8, 'boosting_type': 'Ordered', 'bootstrap_type': 'MVS'}. Best is trial 3 with value: 0.7291666666666666.
[32m[I 2023-04-26 00:22:06,254][39m Trial 5 finished with value: 0.7368421052631579 and parameters: {'objective': 'CrossEntropy', 'colsample_bylevel': 0.08047898373281395, 'depth': 4, 'boosting_type': 'Ordered', 'bootstrap_type': 'Bernoulli', 'subsample': 0.7463893494680102}. Best is trial 5 with value: 0.7368421052631579.
[32m[I 2023-04-26 00:22:07,727][39m Trial 6 finished with value: 0.7346938775510203 and parameters: {'objective': 'CrossEntropy', 'colsample_bylevel': 0.05070627376580433, 'depth': 8, 'boosting_type': 'Plain', 'bootstrap_type': 'Bayesian', 'bagging_temperature': 4.299322872065407}. Best is trial 5 with value: 0.7368421052631579.
[32m[I 2023-04-26 00:22:09,414][39m Trial 7 finished with value: 0.7096774193548387 and parameters: {'objective': 'Logloss', 'colsample_bylevel': 0.08558897467168429, 'depth': 4, 'boosting_type': 'Plain', 'bootstrap_type': 'MVS'}. Best is trial 5 with value: 0.7368421052631579.
[32m[I 2023-04-26 00:22:10,719][39m Trial 8 finished with value: 0.7446808510638298 and parameters: {'objective': 'CrossEntropy', 'colsample_bylevel': 0.04738543694950036, 'depth': 3, 'boosting_type': 'Plain', 'bootstrap_type': 'MVS'}. Best is trial 8 with value: 0.7446808510638298.
[32m[I 2023-04-26 00:22:12,060][39m Trial 9 finished with value: 0.7216494845360826 and parameters: {'objective': 'Logloss', 'colsample_bylevel': 0.039494455317973055, 'depth': 7, 'boosting_type': 'Plain', 'bootstrap_type': 'MVS'}. Best is trial 8 with value: 0.7446808510638298.
[32m[I 2023-04-26 00:22:13,540][39m Trial 10 finished with value: 0.7096774193548387 and parameters: {'objective': 'CrossEntropy', 'colsample_bylevel': 0.061723533247923096, 'depth': 12, 'boosting_type': 'Plain', 'bootstrap_type': 'MVS'}. Best is trial 8 with value: 0.7446808510638298.
[32m[I 2023-04-26 00:22:17,137][39m Trial 11 finished with value: 0.6930693069306931 and parameters: {'objective': 'CrossEntropy', 'colsample_bylevel': 0.06829588784103469, 'depth': 1, 'boosting_type': 'Ordered', 'bootstrap_type': 'Bernoulli', 'subsample': 0.9871914049765027}. Best is trial 8 with value: 0.7446808510638298.
[32m[I 2023-04-26 00:22:20,032][39m Trial 12 finished with value: 0.7446808510638298 and parameters: {'objective': 'CrossEntropy', 'colsample_bylevel': 0.09719191504473557, 'depth': 3, 'boosting_type': 'Ordered', 'bootstrap_type': 'Bernoulli', 'subsample': 0.8892352066421139}. Best is trial 8 with value: 0.7446808510638298.
[32m[I 2023-04-26 00:22:23,873][39m Trial 13 finished with value: 0.7291666666666666 and parameters: {'objective': 'CrossEntropy', 'colsample_bylevel': 0.0975383146898797, 'depth': 2, 'boosting_type': 'Ordered', 'bootstrap_type': 'Bernoulli', 'subsample': 0.16851251528222255}. Best is trial 8 with value: 0.7446808510638298.
[32m[I 2023-04-26 00:22:27,388][39m Trial 14 finished with value: 0.6666666666666666 and parameters: {'objective': 'CrossEntropy', 'colsample_bylevel': 0.02574237045991879, 'depth': 6, 'boosting_type': 'Ordered', 'bootstrap_type': 'MVS'}. Best is trial 8 with value: 0.7446808510638298.
[32m[I 2023-04-26 00:22:28,899][39m Trial 15 finished with value: 0.7096774193548387 and parameters: {'objective': 'CrossEntropy', 'colsample_bylevel': 0.06997211281138592, 'depth': 3, 'boosting_type': 'Plain', 'bootstrap_type': 'MVS'}. Best is trial 8 with value: 0.7446808510638298.
[32m[I 2023-04-26 00:22:32,569][39m Trial 16 finished with value: 0.7216494845360826 and parameters: {'objective': 'CrossEntropy', 'colsample_bylevel': 0.02995842847287887, 'depth': 6, 'boosting_type': 'Ordered', 'bootstrap_type': 'Bernoulli', 'subsample': 0.9699638583947168}. Best is trial 8 with value: 0.7446808510638298.
[32m[I 2023-04-26 00:22:33,948][39m Trial 17 finished with value: 0.7446808510638298 and parameters: {'objective': 'CrossEntropy', 'colsample_bylevel': 0.05456457594865504, 'depth': 2, 'boosting_type': 'Plain', 'bootstrap_type': 'Bernoulli', 'subsample': 0.7520561381316865}. Best is trial 8 with value: 0.7446808510638298.
[32m[I 2023-04-26 00:22:35,926][39m Trial 18 finished with value: 0.717391304347826 and parameters: {'objective': 'Logloss', 'colsample_bylevel': 0.09752688675291586, 'depth': 5, 'boosting_type': 'Plain', 'bootstrap_type': 'MVS'}. Best is trial 8 with value: 0.7446808510638298.
[32m[I 2023-04-26 00:22:39,448][39m Trial 19 finished with value: 0.7526881720430108 and parameters: {'objective': 'CrossEntropy', 'colsample_bylevel': 0.0582299386891648, 'depth': 2, 'boosting_type': 'Ordered', 'bootstrap_type': 'Bernoulli', 'subsample': 0.7576950854527229}. Best is trial 19 with value: 0.7526881720430108.
[32m[I 2023-04-26 00:22:42,977][39m Trial 20 finished with value: 0.7446808510638298 and parameters: {'objective': 'CrossEntropy', 'colsample_bylevel': 0.0574285831663106, 'depth': 11, 'boosting_type': 'Ordered', 'bootstrap_type': 'Bernoulli', 'subsample': 0.6725436967686806}. Best is trial 19 with value: 0.7526881720430108.
[32m[I 2023-04-26 00:22:46,538][39m Trial 21 finished with value: 0.7446808510638298 and parameters: {'objective': 'CrossEntropy', 'colsample_bylevel': 0.0580338583667463, 'depth': 12, 'boosting_type': 'Ordered', 'bootstrap_type': 'Bernoulli', 'subsample': 0.7122350497687813}. Best is trial 19 with value: 0.7526881720430108.
[32m[I 2023-04-26 00:22:50,262][39m Trial 22 finished with value: 0.7368421052631579 and parameters: {'objective': 'CrossEntropy', 'colsample_bylevel': 0.06507241919214168, 'depth': 10, 'boosting_type': 'Ordered', 'bootstrap_type': 'Bernoulli', 'subsample': 0.7744817459531399}. Best is trial 19 with value: 0.7526881720430108.
[32m[I 2023-04-26 00:22:53,666][39m Trial 23 finished with value: 0.7142857142857142 and parameters: {'objective': 'CrossEntropy', 'colsample_bylevel': 0.04934376649272789, 'depth': 2, 'boosting_type': 'Ordered', 'bootstrap_type': 'Bayesian', 'bagging_temperature': 0.03688095347886389}. Best is trial 19 with value: 0.7526881720430108.
[32m[I 2023-04-26 00:22:57,080][39m Trial 24 finished with value: 0.6990291262135923 and parameters: {'objective': 'CrossEntropy', 'colsample_bylevel': 0.07310921937704193, 'depth': 1, 'boosting_type': 'Ordered', 'bootstrap_type': 'Bernoulli', 'subsample': 0.4414619021982512}. Best is trial 19 with value: 0.7526881720430108.
[32m[I 2023-04-26 00:23:00,750][39m Trial 25 finished with value: 0.7446808510638298 and parameters: {'objective': 'CrossEntropy', 'colsample_bylevel': 0.055028245893937726, 'depth': 11, 'boosting_type': 'Ordered', 'bootstrap_type': 'Bernoulli', 'subsample': 0.6177173696901241}. Best is trial 19 with value: 0.7526881720430108.
[32m[I 2023-04-26 00:23:05,228][39m Trial 26 finished with value: 0.7291666666666666 and parameters: {'objective': 'Logloss', 'colsample_bylevel': 0.07831269837320035, 'depth': 5, 'boosting_type': 'Ordered', 'bootstrap_type': 'Bernoulli', 'subsample': 0.8721502950933799}. Best is trial 19 with value: 0.7526881720430108.
[32m[I 2023-04-26 00:23:08,826][39m Trial 27 finished with value: 0.7526881720430108 and parameters: {'objective': 'CrossEntropy', 'colsample_bylevel': 0.059784113112932795, 'depth': 12, 'boosting_type': 'Ordered', 'bootstrap_type': 'Bernoulli', 'subsample': 0.6797005392950329}. Best is trial 19 with value: 0.7526881720430108.
[32m[I 2023-04-26 00:23:12,320][39m Trial 28 finished with value: 0.6999999999999998 and parameters: {'objective': 'CrossEntropy', 'colsample_bylevel': 0.03315693834332441, 'depth': 11, 'boosting_type': 'Ordered', 'bootstrap_type': 'Bernoulli', 'subsample': 0.3848170730457916}. Best is trial 19 with value: 0.7526881720430108.
[32m[I 2023-04-26 00:23:16,301][39m Trial 29 finished with value: 0.7291666666666666 and parameters: {'objective': 'CrossEntropy', 'colsample_bylevel': 0.09236914499520942, 'depth': 3, 'boosting_type': 'Ordered', 'bootstrap_type': 'Bayesian', 'bagging_temperature': 9.741008730798168}. Best is trial 19 with value: 0.7526881720430108.
[32m[I 2023-04-26 00:23:20,000][39m Trial 30 finished with value: 0.7070707070707071 and parameters: {'objective': 'CrossEntropy', 'colsample_bylevel': 0.08970696645897208, 'depth': 1, 'boosting_type': 'Ordered', 'bootstrap_type': 'Bernoulli', 'subsample': 0.8592844028897203}. Best is trial 19 with value: 0.7526881720430108.
[32m[I 2023-04-26 00:23:23,495][39m Trial 31 finished with value: 0.7446808510638298 and parameters: {'objective': 'CrossEntropy', 'colsample_bylevel': 0.05775965494934475, 'depth': 11, 'boosting_type': 'Ordered', 'bootstrap_type': 'Bernoulli', 'subsample': 0.631384459674429}. Best is trial 19 with value: 0.7526881720430108.
[32m[I 2023-04-26 00:23:25,236][39m Trial 32 finished with value: 0.7096774193548387 and parameters: {'objective': 'CrossEntropy', 'colsample_bylevel': 0.062315742905819434, 'depth': 10, 'boosting_type': 'Plain', 'bootstrap_type': 'Bernoulli', 'subsample': 0.789357284211565}. Best is trial 19 with value: 0.7526881720430108.
[32m[I 2023-04-26 00:23:28,811][39m Trial 33 finished with value: 0.7446808510638298 and parameters: {'objective': 'CrossEntropy', 'colsample_bylevel': 0.05156174982708308, 'depth': 12, 'boosting_type': 'Ordered', 'bootstrap_type': 'Bernoulli', 'subsample': 0.5270227698941958}. Best is trial 19 with value: 0.7526881720430108.
[32m[I 2023-04-26 00:23:32,324][39m Trial 34 finished with value: 0.7291666666666666 and parameters: {'objective': 'CrossEntropy', 'colsample_bylevel': 0.04361228946582659, 'depth': 12, 'boosting_type': 'Ordered', 'bootstrap_type': 'Bernoulli', 'subsample': 0.48177371008053704}. Best is trial 19 with value: 0.7526881720430108.
[32m[I 2023-04-26 00:23:34,181][39m Trial 35 finished with value: 0.717391304347826 and parameters: {'objective': 'CrossEntropy', 'colsample_bylevel': 0.0742653596642721, 'depth': 9, 'boosting_type': 'Plain', 'bootstrap_type': 'Bernoulli', 'subsample': 0.6623591695726743}. Best is trial 19 with value: 0.7526881720430108.
[32m[I 2023-04-26 00:23:38,206][39m Trial 36 finished with value: 0.7422680412371134 and parameters: {'objective': 'Logloss', 'colsample_bylevel': 0.08283778900483581, 'depth': 10, 'boosting_type': 'Ordered', 'bootstrap_type': 'Bayesian', 'bagging_temperature': 1.8823470674915854}. Best is trial 19 with value: 0.7526881720430108.
[32m[I 2023-04-26 00:23:39,589][39m Trial 37 finished with value: 0.7368421052631579 and parameters: {'objective': 'CrossEntropy', 'colsample_bylevel': 0.0594288396650266, 'depth': 2, 'boosting_type': 'Plain', 'bootstrap_type': 'Bernoulli', 'subsample': 0.7243815252022398}. Best is trial 19 with value: 0.7526881720430108.
[32m[I 2023-04-26 00:23:43,214][39m Trial 38 finished with value: 0.7368421052631579 and parameters: {'objective': 'CrossEntropy', 'colsample_bylevel': 0.053214225977039814, 'depth': 11, 'boosting_type': 'Ordered', 'bootstrap_type': 'Bernoulli', 'subsample': 0.35560847500737347}. Best is trial 19 with value: 0.7526881720430108.
[32m[I 2023-04-26 00:23:46,666][39m Trial 39 finished with value: 0.6999999999999998 and parameters: {'objective': 'Logloss', 'colsample_bylevel': 0.0446677171508816, 'depth': 9, 'boosting_type': 'Ordered', 'bootstrap_type': 'Bernoulli', 'subsample': 0.5484554690989342}. Best is trial 19 with value: 0.7526881720430108.
[32m[I 2023-04-26 00:23:50,199][39m Trial 40 finished with value: 0.7378640776699029 and parameters: {'objective': 'CrossEntropy', 'colsample_bylevel': 0.03956523650748805, 'depth': 12, 'boosting_type': 'Ordered', 'bootstrap_type': 'Bayesian', 'bagging_temperature': 3.4918301777064595}. Best is trial 19 with value: 0.7526881720430108.
[32m[I 2023-04-26 00:23:53,847][39m Trial 41 finished with value: 0.7346938775510203 and parameters: {'objective': 'CrossEntropy', 'colsample_bylevel': 0.06608636911907531, 'depth': 11, 'boosting_type': 'Ordered', 'bootstrap_type': 'Bernoulli', 'subsample': 0.6764763569468026}. Best is trial 19 with value: 0.7526881720430108.
[32m[I 2023-04-26 00:23:57,522][39m Trial 42 finished with value: 0.7272727272727273 and parameters: {'objective': 'CrossEntropy', 'colsample_bylevel': 0.05643297917328344, 'depth': 11, 'boosting_type': 'Ordered', 'bootstrap_type': 'Bernoulli', 'subsample': 0.6200823105108381}. Best is trial 19 with value: 0.7526881720430108.
[32m[I 2023-04-26 00:24:01,266][39m Trial 43 finished with value: 0.7499999999999999 and parameters: {'objective': 'CrossEntropy', 'colsample_bylevel': 0.06253722493087267, 'depth': 12, 'boosting_type': 'Ordered', 'bootstrap_type': 'Bernoulli', 'subsample': 0.700598961502862}. Best is trial 19 with value: 0.7526881720430108.
[32m[I 2023-04-26 00:24:04,859][39m Trial 44 finished with value: 0.7446808510638298 and parameters: {'objective': 'CrossEntropy', 'colsample_bylevel': 0.05029852194889334, 'depth': 12, 'boosting_type': 'Ordered', 'bootstrap_type': 'Bernoulli', 'subsample': 0.8206501298855431}. Best is trial 19 with value: 0.7526881720430108.
[32m[I 2023-04-26 00:24:08,407][39m Trial 45 finished with value: 0.6999999999999998 and parameters: {'objective': 'CrossEntropy', 'colsample_bylevel': 0.048118444130313985, 'depth': 12, 'boosting_type': 'Ordered', 'bootstrap_type': 'Bernoulli', 'subsample': 0.8039362725830308}. Best is trial 19 with value: 0.7526881720430108.
[32m[I 2023-04-26 00:24:12,109][39m Trial 46 finished with value: 0.7446808510638298 and parameters: {'objective': 'CrossEntropy', 'colsample_bylevel': 0.06218052474160972, 'depth': 10, 'boosting_type': 'Ordered', 'bootstrap_type': 'Bernoulli', 'subsample': 0.5252121016479119}. Best is trial 19 with value: 0.7526881720430108.
[32m[I 2023-04-26 00:24:15,839][39m Trial 47 finished with value: 0.7216494845360826 and parameters: {'objective': 'Logloss', 'colsample_bylevel': 0.06248163294604033, 'depth': 8, 'boosting_type': 'Ordered', 'bootstrap_type': 'Bernoulli', 'subsample': 0.49985130188478066}. Best is trial 19 with value: 0.7526881720430108.
[32m[I 2023-04-26 00:24:19,554][39m Trial 48 finished with value: 0.7446808510638298 and parameters: {'objective': 'CrossEntropy', 'colsample_bylevel': 0.06964184533293162, 'depth': 9, 'boosting_type': 'Ordered', 'bootstrap_type': 'Bernoulli', 'subsample': 0.8201696731226071}. Best is trial 19 with value: 0.7526881720430108.
[32m[I 2023-04-26 00:24:23,352][39m Trial 49 finished with value: 0.7096774193548387 and parameters: {'objective': 'CrossEntropy', 'colsample_bylevel': 0.07499045531121816, 'depth': 12, 'boosting_type': 'Ordered', 'bootstrap_type': 'Bernoulli', 'subsample': 0.5828950222315942}. Best is trial 19 with value: 0.7526881720430108.
[32m[I 2023-04-26 00:24:26,920][39m Trial 50 finished with value: 0.7200000000000001 and parameters: {'objective': 'CrossEntropy', 'colsample_bylevel': 0.045437692992266035, 'depth': 7, 'boosting_type': 'Ordered', 'bootstrap_type': 'Bayesian', 'bagging_temperature': 6.373335227451504}. Best is trial 19 with value: 0.7526881720430108.
[32m[I 2023-04-26 00:24:31,295][39m Trial 51 finished with value: 0.7216494845360826 and parameters: {'objective': 'CrossEntropy', 'colsample_bylevel': 0.05316994501808886, 'depth': 12, 'boosting_type': 'Ordered', 'bootstrap_type': 'Bernoulli', 'subsample': 0.697265335874464}. Best is trial 19 with value: 0.7526881720430108.
[32m[I 2023-04-26 00:24:35,438][39m Trial 52 finished with value: 0.7368421052631579 and parameters: {'objective': 'CrossEntropy', 'colsample_bylevel': 0.0701636276633095, 'depth': 11, 'boosting_type': 'Ordered', 'bootstrap_type': 'Bernoulli', 'subsample': 0.6160278608182083}. Best is trial 19 with value: 0.7526881720430108.
[32m[I 2023-04-26 00:24:39,041][39m Trial 53 finished with value: 0.6915887850467289 and parameters: {'objective': 'CrossEntropy', 'colsample_bylevel': 0.016415583520861803, 'depth': 4, 'boosting_type': 'Ordered', 'bootstrap_type': 'Bernoulli', 'subsample': 0.9136259420349669}. Best is trial 19 with value: 0.7526881720430108.
[32m[I 2023-04-26 00:24:43,529][39m Trial 54 finished with value: 0.7422680412371134 and parameters: {'objective': 'CrossEntropy', 'colsample_bylevel': 0.0667994449417363, 'depth': 8, 'boosting_type': 'Ordered', 'bootstrap_type': 'MVS'}. Best is trial 19 with value: 0.7526881720430108.
[32m[I 2023-04-26 00:24:47,175][39m Trial 55 finished with value: 0.7216494845360826 and parameters: {'objective': 'CrossEntropy', 'colsample_bylevel': 0.06160526206209549, 'depth': 10, 'boosting_type': 'Ordered', 'bootstrap_type': 'Bernoulli', 'subsample': 0.8495888229411027}. Best is trial 19 with value: 0.7526881720430108.
[32m[I 2023-04-26 00:24:51,232][39m Trial 56 finished with value: 0.7368421052631579 and parameters: {'objective': 'CrossEntropy', 'colsample_bylevel': 0.05748885815674821, 'depth': 11, 'boosting_type': 'Ordered', 'bootstrap_type': 'Bernoulli', 'subsample': 0.7151002285635436}. Best is trial 19 with value: 0.7526881720430108.
[32m[I 2023-04-26 00:24:52,714][39m Trial 57 finished with value: 0.7446808510638298 and parameters: {'objective': 'CrossEntropy', 'colsample_bylevel': 0.055276621665311935, 'depth': 5, 'boosting_type': 'Plain', 'bootstrap_type': 'Bernoulli', 'subsample': 0.7503892499832504}. Best is trial 19 with value: 0.7526881720430108.
[32m[I 2023-04-26 00:24:54,216][39m Trial 58 finished with value: 0.7499999999999999 and parameters: {'objective': 'Logloss', 'colsample_bylevel': 0.06417218230566331, 'depth': 5, 'boosting_type': 'Plain', 'bootstrap_type': 'MVS'}. Best is trial 19 with value: 0.7526881720430108.
[32m[I 2023-04-26 00:24:56,373][39m Trial 59 finished with value: 0.7368421052631579 and parameters: {'objective': 'Logloss', 'colsample_bylevel': 0.07119682488684781, 'depth': 6, 'boosting_type': 'Plain', 'bootstrap_type': 'MVS'}. Best is trial 19 with value: 0.7526881720430108.
[32m[I 2023-04-26 00:24:58,096][39m Trial 60 finished with value: 0.717391304347826 and parameters: {'objective': 'Logloss', 'colsample_bylevel': 0.07752195166559855, 'depth': 3, 'boosting_type': 'Plain', 'bootstrap_type': 'MVS'}. Best is trial 19 with value: 0.7526881720430108.
[32m[I 2023-04-26 00:25:01,909][39m Trial 61 finished with value: 0.7142857142857142 and parameters: {'objective': 'Logloss', 'colsample_bylevel': 0.06426263882435779, 'depth': 2, 'boosting_type': 'Ordered', 'bootstrap_type': 'MVS'}. Best is trial 19 with value: 0.7526881720430108.
[32m[I 2023-04-26 00:25:04,376][39m Trial 62 finished with value: 0.717391304347826 and parameters: {'objective': 'Logloss', 'colsample_bylevel': 0.05989107859212265, 'depth': 12, 'boosting_type': 'Plain', 'bootstrap_type': 'MVS'}. Best is trial 19 with value: 0.7526881720430108.
[32m[I 2023-04-26 00:25:07,709][39m Trial 63 finished with value: 0.7216494845360826 and parameters: {'objective': 'Logloss', 'colsample_bylevel': 0.051319229873685396, 'depth': 12, 'boosting_type': 'Ordered', 'bootstrap_type': 'MVS'}. Best is trial 19 with value: 0.7526881720430108.
[32m[I 2023-04-26 00:25:11,917][39m Trial 64 finished with value: 0.7368421052631579 and parameters: {'objective': 'CrossEntropy', 'colsample_bylevel': 0.05450152652456036, 'depth': 11, 'boosting_type': 'Ordered', 'bootstrap_type': 'Bernoulli', 'subsample': 0.6302977484730721}. Best is trial 19 with value: 0.7526881720430108.
[32m[I 2023-04-26 00:25:13,190][39m Trial 65 finished with value: 0.7216494845360826 and parameters: {'objective': 'CrossEntropy', 'colsample_bylevel': 0.06884062939290318, 'depth': 1, 'boosting_type': 'Plain', 'bootstrap_type': 'Bernoulli', 'subsample': 0.7598829056967861}. Best is trial 19 with value: 0.7526881720430108.
[32m[I 2023-04-26 00:25:14,940][39m Trial 66 finished with value: 0.7216494845360826 and parameters: {'objective': 'Logloss', 'colsample_bylevel': 0.04077515801350807, 'depth': 5, 'boosting_type': 'Plain', 'bootstrap_type': 'MVS'}. Best is trial 19 with value: 0.7526881720430108.
[32m[I 2023-04-26 00:25:18,937][39m Trial 67 finished with value: 0.7216494845360826 and parameters: {'objective': 'CrossEntropy', 'colsample_bylevel': 0.05982616479896882, 'depth': 10, 'boosting_type': 'Ordered', 'bootstrap_type': 'Bernoulli', 'subsample': 0.9203548135495875}. Best is trial 19 with value: 0.7526881720430108.
