[32m[I 2023-04-26 00:36:47,911][39m Trial 336 finished with value: 0.6999999999999998 and parameters: {'objective': 'Logloss', 'colsample_bylevel': 0.05163498417101697, 'depth': 5, 'boosting_type': 'Ordered', 'bootstrap_type': 'Bernoulli', 'subsample': 0.5253768758799375}. Best is trial 106 with value: 0.7578947368421053.
[32m[I 2023-04-26 00:36:49,390][39m Trial 337 finished with value: 0.717391304347826 and parameters: {'objective': 'CrossEntropy', 'colsample_bylevel': 0.05807131576568132, 'depth': 5, 'boosting_type': 'Plain', 'bootstrap_type': 'Bernoulli', 'subsample': 0.5918416087442939}. Best is trial 106 with value: 0.7578947368421053.
[32m[I 2023-04-26 00:36:53,530][39m Trial 338 finished with value: 0.7252747252747254 and parameters: {'objective': 'CrossEntropy', 'colsample_bylevel': 0.09653891639489381, 'depth': 12, 'boosting_type': 'Ordered', 'bootstrap_type': 'Bernoulli', 'subsample': 0.40575187755947617}. Best is trial 106 with value: 0.7578947368421053.
[32m[I 2023-04-26 00:36:55,979][39m Trial 339 finished with value: 0.7368421052631579 and parameters: {'objective': 'CrossEntropy', 'colsample_bylevel': 0.05568864201271817, 'depth': 6, 'boosting_type': 'Plain', 'bootstrap_type': 'Bernoulli', 'subsample': 0.5708540732589887}. Best is trial 106 with value: 0.7578947368421053.
[32m[I 2023-04-26 00:36:57,550][39m Trial 340 finished with value: 0.7368421052631579 and parameters: {'objective': 'CrossEntropy', 'colsample_bylevel': 0.056932394301684085, 'depth': 5, 'boosting_type': 'Plain', 'bootstrap_type': 'Bernoulli', 'subsample': 0.5084999785054991}. Best is trial 106 with value: 0.7578947368421053.
[32m[I 2023-04-26 00:37:01,817][39m Trial 341 finished with value: 0.7422680412371134 and parameters: {'objective': 'CrossEntropy', 'colsample_bylevel': 0.0656662846448053, 'depth': 7, 'boosting_type': 'Ordered', 'bootstrap_type': 'MVS'}. Best is trial 106 with value: 0.7578947368421053.
[32m[I 2023-04-26 00:37:05,193][39m Trial 342 finished with value: 0.7446808510638298 and parameters: {'objective': 'CrossEntropy', 'colsample_bylevel': 0.06002890237351541, 'depth': 12, 'boosting_type': 'Ordered', 'bootstrap_type': 'Bernoulli', 'subsample': 0.26846639672862005}. Best is trial 106 with value: 0.7578947368421053.
[32m[I 2023-04-26 00:37:09,442][39m Trial 343 finished with value: 0.7446808510638298 and parameters: {'objective': 'CrossEntropy', 'colsample_bylevel': 0.06357544341295969, 'depth': 12, 'boosting_type': 'Ordered', 'bootstrap_type': 'Bernoulli', 'subsample': 0.4147514907578358}. Best is trial 106 with value: 0.7578947368421053.
[32m[I 2023-04-26 00:37:10,898][39m Trial 344 finished with value: 0.7216494845360826 and parameters: {'objective': 'Logloss', 'colsample_bylevel': 0.05975307479210614, 'depth': 5, 'boosting_type': 'Plain', 'bootstrap_type': 'Bernoulli', 'subsample': 0.4452187483390843}. Best is trial 106 with value: 0.7578947368421053.
[32m[I 2023-04-26 00:37:15,270][39m Trial 345 finished with value: 0.7368421052631579 and parameters: {'objective': 'CrossEntropy', 'colsample_bylevel': 0.06201707345796328, 'depth': 12, 'boosting_type': 'Ordered', 'bootstrap_type': 'Bernoulli', 'subsample': 0.33295201130553087}. Best is trial 106 with value: 0.7578947368421053.
[32m[I 2023-04-26 00:37:18,856][39m Trial 346 finished with value: 0.7216494845360826 and parameters: {'objective': 'CrossEntropy', 'colsample_bylevel': 0.05742213140678411, 'depth': 11, 'boosting_type': 'Ordered', 'bootstrap_type': 'Bernoulli', 'subsample': 0.3895154731408315}. Best is trial 106 with value: 0.7578947368421053.
[32m[I 2023-04-26 00:37:21,368][39m Trial 347 finished with value: 0.7578947368421053 and parameters: {'objective': 'CrossEntropy', 'colsample_bylevel': 0.05383425865999988, 'depth': 3, 'boosting_type': 'Plain', 'bootstrap_type': 'Bernoulli', 'subsample': 0.4752319969111902}. Best is trial 106 with value: 0.7578947368421053.
[32m[I 2023-04-26 00:37:22,730][39m Trial 348 finished with value: 0.7526881720430108 and parameters: {'objective': 'CrossEntropy', 'colsample_bylevel': 0.0532819193433335, 'depth': 4, 'boosting_type': 'Plain', 'bootstrap_type': 'Bernoulli', 'subsample': 0.490655507138813}. Best is trial 106 with value: 0.7578947368421053.
[32m[I 2023-04-26 00:37:24,017][39m Trial 349 finished with value: 0.7216494845360826 and parameters: {'objective': 'CrossEntropy', 'colsample_bylevel': 0.04936732107238409, 'depth': 4, 'boosting_type': 'Plain', 'bootstrap_type': 'Bernoulli', 'subsample': 0.5072670870655701}. Best is trial 106 with value: 0.7578947368421053.
[32m[I 2023-04-26 00:37:25,409][39m Trial 350 finished with value: 0.7216494845360826 and parameters: {'objective': 'CrossEntropy', 'colsample_bylevel': 0.05333151525548258, 'depth': 4, 'boosting_type': 'Plain', 'bootstrap_type': 'Bernoulli', 'subsample': 0.5371230520086189}. Best is trial 106 with value: 0.7578947368421053.
[32m[I 2023-04-26 00:37:26,836][39m Trial 351 finished with value: 0.7070707070707071 and parameters: {'objective': 'Logloss', 'colsample_bylevel': 0.050376821952251565, 'depth': 3, 'boosting_type': 'Plain', 'bootstrap_type': 'Bernoulli', 'subsample': 0.4828581660340277}. Best is trial 106 with value: 0.7578947368421053.
[32m[I 2023-04-26 00:37:28,298][39m Trial 352 finished with value: 0.7291666666666666 and parameters: {'objective': 'CrossEntropy', 'colsample_bylevel': 0.052920006895904634, 'depth': 3, 'boosting_type': 'Plain', 'bootstrap_type': 'Bernoulli', 'subsample': 0.49699940158849093}. Best is trial 106 with value: 0.7578947368421053.
[32m[I 2023-04-26 00:37:30,106][39m Trial 353 finished with value: 0.717391304347826 and parameters: {'objective': 'CrossEntropy', 'colsample_bylevel': 0.07032380925285985, 'depth': 6, 'boosting_type': 'Plain', 'bootstrap_type': 'Bayesian', 'bagging_temperature': 1.0096344218641997}. Best is trial 106 with value: 0.7578947368421053.
[32m[I 2023-04-26 00:37:31,627][39m Trial 354 finished with value: 0.7446808510638298 and parameters: {'objective': 'CrossEntropy', 'colsample_bylevel': 0.0738128981995064, 'depth': 12, 'boosting_type': 'Plain', 'bootstrap_type': 'Bernoulli', 'subsample': 0.4372596921764789}. Best is trial 106 with value: 0.7578947368421053.
[32m[I 2023-04-26 00:37:32,926][39m Trial 355 finished with value: 0.7368421052631579 and parameters: {'objective': 'CrossEntropy', 'colsample_bylevel': 0.054734775911382115, 'depth': 3, 'boosting_type': 'Plain', 'bootstrap_type': 'Bernoulli', 'subsample': 0.35712250826576386}. Best is trial 106 with value: 0.7578947368421053.
[32m[I 2023-04-26 00:37:37,241][39m Trial 356 finished with value: 0.7446808510638298 and parameters: {'objective': 'CrossEntropy', 'colsample_bylevel': 0.05543722570156531, 'depth': 12, 'boosting_type': 'Ordered', 'bootstrap_type': 'MVS'}. Best is trial 106 with value: 0.7578947368421053.
[32m[I 2023-04-26 00:37:40,648][39m Trial 357 finished with value: 0.6999999999999998 and parameters: {'objective': 'CrossEntropy', 'colsample_bylevel': 0.06525322688866418, 'depth': 2, 'boosting_type': 'Ordered', 'bootstrap_type': 'Bernoulli', 'subsample': 0.4152946691621235}. Best is trial 106 with value: 0.7578947368421053.
[32m[I 2023-04-26 00:37:43,177][39m Trial 358 finished with value: 0.7291666666666666 and parameters: {'objective': 'CrossEntropy', 'colsample_bylevel': 0.055887109758913575, 'depth': 2, 'boosting_type': 'Plain', 'bootstrap_type': 'Bernoulli', 'subsample': 0.6113050746847138}. Best is trial 106 with value: 0.7578947368421053.
[32m[I 2023-04-26 00:37:44,462][39m Trial 359 finished with value: 0.7291666666666666 and parameters: {'objective': 'CrossEntropy', 'colsample_bylevel': 0.0529020189086733, 'depth': 3, 'boosting_type': 'Plain', 'bootstrap_type': 'Bernoulli', 'subsample': 0.46551011738021464}. Best is trial 106 with value: 0.7578947368421053.
[32m[I 2023-04-26 00:37:45,823][39m Trial 360 finished with value: 0.7446808510638298 and parameters: {'objective': 'Logloss', 'colsample_bylevel': 0.052140416937831696, 'depth': 6, 'boosting_type': 'Plain', 'bootstrap_type': 'Bernoulli', 'subsample': 0.47423946895578645}. Best is trial 106 with value: 0.7578947368421053.
[32m[I 2023-04-26 00:37:49,787][39m Trial 361 finished with value: 0.6728971962616822 and parameters: {'objective': 'CrossEntropy', 'colsample_bylevel': 0.04715603229136654, 'depth': 1, 'boosting_type': 'Ordered', 'bootstrap_type': 'Bernoulli', 'subsample': 0.45698168415252394}. Best is trial 106 with value: 0.7578947368421053.
[32m[I 2023-04-26 00:37:53,583][39m Trial 362 finished with value: 0.7216494845360826 and parameters: {'objective': 'CrossEntropy', 'colsample_bylevel': 0.06691581871110337, 'depth': 4, 'boosting_type': 'Ordered', 'bootstrap_type': 'Bernoulli', 'subsample': 0.24974666838629933}. Best is trial 106 with value: 0.7578947368421053.
[32m[I 2023-04-26 00:37:55,986][39m Trial 363 finished with value: 0.7578947368421053 and parameters: {'objective': 'CrossEntropy', 'colsample_bylevel': 0.06928132917779581, 'depth': 4, 'boosting_type': 'Plain', 'bootstrap_type': 'Bernoulli', 'subsample': 0.2063268656576075}. Best is trial 106 with value: 0.7578947368421053.
[32m[I 2023-04-26 00:37:57,486][39m Trial 364 finished with value: 0.7368421052631579 and parameters: {'objective': 'CrossEntropy', 'colsample_bylevel': 0.05876984120339227, 'depth': 3, 'boosting_type': 'Plain', 'bootstrap_type': 'Bernoulli', 'subsample': 0.5210808353355985}. Best is trial 106 with value: 0.7578947368421053.
[32m[I 2023-04-26 00:37:59,039][39m Trial 365 finished with value: 0.7526881720430108 and parameters: {'objective': 'CrossEntropy', 'colsample_bylevel': 0.06806100079058014, 'depth': 4, 'boosting_type': 'Plain', 'bootstrap_type': 'Bernoulli', 'subsample': 0.2185539094652406}. Best is trial 106 with value: 0.7578947368421053.
[32m[I 2023-04-26 00:38:00,677][39m Trial 366 finished with value: 0.7578947368421053 and parameters: {'objective': 'CrossEntropy', 'colsample_bylevel': 0.07101768975219601, 'depth': 4, 'boosting_type': 'Plain', 'bootstrap_type': 'Bernoulli', 'subsample': 0.14741233944853604}. Best is trial 106 with value: 0.7578947368421053.
[32m[I 2023-04-26 00:38:02,359][39m Trial 367 finished with value: 0.7578947368421053 and parameters: {'objective': 'CrossEntropy', 'colsample_bylevel': 0.07149031393955753, 'depth': 4, 'boosting_type': 'Plain', 'bootstrap_type': 'Bernoulli', 'subsample': 0.21933492773203905}. Best is trial 106 with value: 0.7578947368421053.
[32m[I 2023-04-26 00:38:04,020][39m Trial 368 finished with value: 0.7499999999999999 and parameters: {'objective': 'Logloss', 'colsample_bylevel': 0.07183764593805693, 'depth': 4, 'boosting_type': 'Plain', 'bootstrap_type': 'Bernoulli', 'subsample': 0.1410178522427496}. Best is trial 106 with value: 0.7578947368421053.
[32m[I 2023-04-26 00:38:05,659][39m Trial 369 finished with value: 0.7446808510638298 and parameters: {'objective': 'CrossEntropy', 'colsample_bylevel': 0.07044970237767545, 'depth': 4, 'boosting_type': 'Plain', 'bootstrap_type': 'Bernoulli', 'subsample': 0.1885496013749366}. Best is trial 106 with value: 0.7578947368421053.
[32m[I 2023-04-26 00:38:07,344][39m Trial 370 finished with value: 0.7578947368421053 and parameters: {'objective': 'CrossEntropy', 'colsample_bylevel': 0.07104955857162164, 'depth': 4, 'boosting_type': 'Plain', 'bootstrap_type': 'MVS'}. Best is trial 106 with value: 0.7578947368421053.
[32m[I 2023-04-26 00:38:08,884][39m Trial 371 finished with value: 0.7096774193548387 and parameters: {'objective': 'CrossEntropy', 'colsample_bylevel': 0.06987753748544263, 'depth': 4, 'boosting_type': 'Plain', 'bootstrap_type': 'MVS'}. Best is trial 106 with value: 0.7578947368421053.
[32m[I 2023-04-26 00:38:10,649][39m Trial 372 finished with value: 0.7096774193548387 and parameters: {'objective': 'CrossEntropy', 'colsample_bylevel': 0.07463271593985989, 'depth': 4, 'boosting_type': 'Plain', 'bootstrap_type': 'MVS'}. Best is trial 106 with value: 0.7578947368421053.
[32m[I 2023-04-26 00:38:12,085][39m Trial 373 finished with value: 0.7368421052631579 and parameters: {'objective': 'CrossEntropy', 'colsample_bylevel': 0.07097364115919255, 'depth': 4, 'boosting_type': 'Plain', 'bootstrap_type': 'Bernoulli', 'subsample': 0.2153855466511174}. Best is trial 106 with value: 0.7578947368421053.
[32m[I 2023-04-26 00:38:13,663][39m Trial 374 finished with value: 0.7096774193548387 and parameters: {'objective': 'CrossEntropy', 'colsample_bylevel': 0.07240019030730344, 'depth': 4, 'boosting_type': 'Plain', 'bootstrap_type': 'Bernoulli', 'subsample': 0.1374780392598676}. Best is trial 106 with value: 0.7578947368421053.
[32m[I 2023-04-26 00:38:15,486][39m Trial 375 finished with value: 0.7096774193548387 and parameters: {'objective': 'CrossEntropy', 'colsample_bylevel': 0.07627560429382187, 'depth': 4, 'boosting_type': 'Plain', 'bootstrap_type': 'MVS'}. Best is trial 106 with value: 0.7578947368421053.
[32m[I 2023-04-26 00:38:17,105][39m Trial 376 finished with value: 0.7446808510638298 and parameters: {'objective': 'CrossEntropy', 'colsample_bylevel': 0.06989935081382509, 'depth': 4, 'boosting_type': 'Plain', 'bootstrap_type': 'Bernoulli', 'subsample': 0.16902225844930996}. Best is trial 106 with value: 0.7578947368421053.
[32m[I 2023-04-26 00:38:18,815][39m Trial 377 finished with value: 0.717391304347826 and parameters: {'objective': 'CrossEntropy', 'colsample_bylevel': 0.06884399379607091, 'depth': 3, 'boosting_type': 'Plain', 'bootstrap_type': 'MVS'}. Best is trial 106 with value: 0.7578947368421053.
[32m[I 2023-04-26 00:38:20,318][39m Trial 378 finished with value: 0.7368421052631579 and parameters: {'objective': 'CrossEntropy', 'colsample_bylevel': 0.07109920470362963, 'depth': 4, 'boosting_type': 'Plain', 'bootstrap_type': 'Bernoulli', 'subsample': 0.20376698512742134}. Best is trial 106 with value: 0.7578947368421053.
[32m[I 2023-04-26 00:38:21,776][39m Trial 379 finished with value: 0.7659574468085106 and parameters: {'objective': 'Logloss', 'colsample_bylevel': 0.06888588591270974, 'depth': 4, 'boosting_type': 'Plain', 'bootstrap_type': 'Bayesian', 'bagging_temperature': 8.937024259250737}. Best is trial 379 with value: 0.7659574468085106.
[32m[I 2023-04-26 00:38:23,520][39m Trial 380 finished with value: 0.7368421052631579 and parameters: {'objective': 'CrossEntropy', 'colsample_bylevel': 0.072359616829648, 'depth': 4, 'boosting_type': 'Plain', 'bootstrap_type': 'Bayesian', 'bagging_temperature': 8.821542460758872}. Best is trial 379 with value: 0.7659574468085106.
[32m[I 2023-04-26 00:38:25,404][39m Trial 381 finished with value: 0.7252747252747254 and parameters: {'objective': 'Logloss', 'colsample_bylevel': 0.06890121028837981, 'depth': 4, 'boosting_type': 'Plain', 'bootstrap_type': 'Bayesian', 'bagging_temperature': 6.97657869418704}. Best is trial 379 with value: 0.7659574468085106.
[32m[I 2023-04-26 00:38:27,107][39m Trial 382 finished with value: 0.7789473684210526 and parameters: {'objective': 'Logloss', 'colsample_bylevel': 0.0747246835944931, 'depth': 4, 'boosting_type': 'Plain', 'bootstrap_type': 'Bayesian', 'bagging_temperature': 9.912313549678027}. Best is trial 382 with value: 0.7789473684210526.
[32m[I 2023-04-26 00:38:28,909][39m Trial 383 finished with value: 0.7659574468085106 and parameters: {'objective': 'Logloss', 'colsample_bylevel': 0.07583118491743777, 'depth': 4, 'boosting_type': 'Plain', 'bootstrap_type': 'Bayesian', 'bagging_temperature': 9.99268507424123}. Best is trial 382 with value: 0.7789473684210526.
[32m[I 2023-04-26 00:38:30,587][39m Trial 384 finished with value: 0.7391304347826086 and parameters: {'objective': 'Logloss', 'colsample_bylevel': 0.07389111398654832, 'depth': 4, 'boosting_type': 'Plain', 'bootstrap_type': 'Bayesian', 'bagging_temperature': 9.742684719756248}. Best is trial 382 with value: 0.7789473684210526.
[32m[I 2023-04-26 00:38:32,294][39m Trial 385 finished with value: 0.7391304347826086 and parameters: {'objective': 'Logloss', 'colsample_bylevel': 0.0752791604729048, 'depth': 4, 'boosting_type': 'Plain', 'bootstrap_type': 'Bayesian', 'bagging_temperature': 8.692627762480065}. Best is trial 382 with value: 0.7789473684210526.
[32m[I 2023-04-26 00:38:33,838][39m Trial 386 finished with value: 0.7789473684210526 and parameters: {'objective': 'Logloss', 'colsample_bylevel': 0.07720166221671071, 'depth': 4, 'boosting_type': 'Plain', 'bootstrap_type': 'Bayesian', 'bagging_temperature': 9.867260172336515}. Best is trial 382 with value: 0.7789473684210526.
[32m[I 2023-04-26 00:38:35,930][39m Trial 387 finished with value: 0.7526881720430108 and parameters: {'objective': 'Logloss', 'colsample_bylevel': 0.07917142921913121, 'depth': 4, 'boosting_type': 'Plain', 'bootstrap_type': 'Bayesian', 'bagging_temperature': 9.962199439958308}. Best is trial 382 with value: 0.7789473684210526.
[32m[I 2023-04-26 00:38:37,556][39m Trial 388 finished with value: 0.7446808510638298 and parameters: {'objective': 'Logloss', 'colsample_bylevel': 0.07728931255831183, 'depth': 4, 'boosting_type': 'Plain', 'bootstrap_type': 'Bayesian', 'bagging_temperature': 9.218708407098088}. Best is trial 382 with value: 0.7789473684210526.
[32m[I 2023-04-26 00:38:39,315][39m Trial 389 finished with value: 0.7252747252747254 and parameters: {'objective': 'Logloss', 'colsample_bylevel': 0.07722350441873742, 'depth': 4, 'boosting_type': 'Plain', 'bootstrap_type': 'Bayesian', 'bagging_temperature': 7.360812234588281}. Best is trial 382 with value: 0.7789473684210526.
[32m[I 2023-04-26 00:38:40,850][39m Trial 390 finished with value: 0.7608695652173912 and parameters: {'objective': 'Logloss', 'colsample_bylevel': 0.07162671437779242, 'depth': 4, 'boosting_type': 'Plain', 'bootstrap_type': 'Bayesian', 'bagging_temperature': 8.964283912542266}. Best is trial 382 with value: 0.7789473684210526.
[32m[I 2023-04-26 00:38:42,425][39m Trial 391 finished with value: 0.7659574468085106 and parameters: {'objective': 'Logloss', 'colsample_bylevel': 0.08006919039662165, 'depth': 4, 'boosting_type': 'Plain', 'bootstrap_type': 'Bayesian', 'bagging_temperature': 9.954375767307509}. Best is trial 382 with value: 0.7789473684210526.
[32m[I 2023-04-26 00:38:44,038][39m Trial 392 finished with value: 0.7252747252747254 and parameters: {'objective': 'Logloss', 'colsample_bylevel': 0.07864952882858134, 'depth': 4, 'boosting_type': 'Plain', 'bootstrap_type': 'Bayesian', 'bagging_temperature': 9.999338216695035}. Best is trial 382 with value: 0.7789473684210526.
[32m[I 2023-04-26 00:38:45,568][39m Trial 393 finished with value: 0.7446808510638298 and parameters: {'objective': 'Logloss', 'colsample_bylevel': 0.0741918941372211, 'depth': 4, 'boosting_type': 'Plain', 'bootstrap_type': 'Bayesian', 'bagging_temperature': 9.124413361832927}. Best is trial 382 with value: 0.7789473684210526.
[32m[I 2023-04-26 00:38:47,158][39m Trial 394 finished with value: 0.7659574468085106 and parameters: {'objective': 'Logloss', 'colsample_bylevel': 0.07344855355145093, 'depth': 4, 'boosting_type': 'Plain', 'bootstrap_type': 'Bayesian', 'bagging_temperature': 8.284324105344778}. Best is trial 382 with value: 0.7789473684210526.
[32m[I 2023-04-26 00:38:48,787][39m Trial 395 finished with value: 0.7499999999999999 and parameters: {'objective': 'Logloss', 'colsample_bylevel': 0.07599181196684537, 'depth': 4, 'boosting_type': 'Plain', 'bootstrap_type': 'Bayesian', 'bagging_temperature': 8.258246783862646}. Best is trial 382 with value: 0.7789473684210526.
[32m[I 2023-04-26 00:38:50,421][39m Trial 396 finished with value: 0.7472527472527474 and parameters: {'objective': 'Logloss', 'colsample_bylevel': 0.07252011899926161, 'depth': 4, 'boosting_type': 'Plain', 'bootstrap_type': 'Bayesian', 'bagging_temperature': 9.39535529633586}. Best is trial 382 with value: 0.7789473684210526.
[32m[I 2023-04-26 00:38:52,377][39m Trial 397 finished with value: 0.7252747252747254 and parameters: {'objective': 'Logloss', 'colsample_bylevel': 0.0741164409160039, 'depth': 4, 'boosting_type': 'Plain', 'bootstrap_type': 'Bayesian', 'bagging_temperature': 8.54406480574663}. Best is trial 382 with value: 0.7789473684210526.
[32m[I 2023-04-26 00:38:54,161][39m Trial 398 finished with value: 0.7311827956989247 and parameters: {'objective': 'Logloss', 'colsample_bylevel': 0.07753738670108667, 'depth': 4, 'boosting_type': 'Plain', 'bootstrap_type': 'Bayesian', 'bagging_temperature': 9.4418137903862}. Best is trial 382 with value: 0.7789473684210526.
[32m[I 2023-04-26 00:38:55,927][39m Trial 399 finished with value: 0.7252747252747254 and parameters: {'objective': 'Logloss', 'colsample_bylevel': 0.07313181246909253, 'depth': 4, 'boosting_type': 'Plain', 'bootstrap_type': 'Bayesian', 'bagging_temperature': 8.975362663684304}. Best is trial 382 with value: 0.7789473684210526.
[32m[I 2023-04-26 00:38:57,601][39m Trial 400 finished with value: 0.7659574468085106 and parameters: {'objective': 'Logloss', 'colsample_bylevel': 0.07941119284651044, 'depth': 4, 'boosting_type': 'Plain', 'bootstrap_type': 'Bayesian', 'bagging_temperature': 9.918443313090895}. Best is trial 382 with value: 0.7789473684210526.
[32m[I 2023-04-26 00:38:59,379][39m Trial 401 finished with value: 0.7526881720430108 and parameters: {'objective': 'Logloss', 'colsample_bylevel': 0.07918143316365385, 'depth': 4, 'boosting_type': 'Plain', 'bootstrap_type': 'Bayesian', 'bagging_temperature': 9.91196200683996}. Best is trial 382 with value: 0.7789473684210526.
[32m[I 2023-04-26 00:39:01,206][39m Trial 402 finished with value: 0.7252747252747254 and parameters: {'objective': 'Logloss', 'colsample_bylevel': 0.08123694066183826, 'depth': 4, 'boosting_type': 'Plain', 'bootstrap_type': 'Bayesian', 'bagging_temperature': 9.474423216744404}. Best is trial 382 with value: 0.7789473684210526.
