[32m[I 2023-04-26 00:39:02,737][39m Trial 403 finished with value: 0.7446808510638298 and parameters: {'objective': 'Logloss', 'colsample_bylevel': 0.07606255103492005, 'depth': 4, 'boosting_type': 'Plain', 'bootstrap_type': 'Bayesian', 'bagging_temperature': 9.989276234186656}. Best is trial 382 with value: 0.7789473684210526.
[32m[I 2023-04-26 00:39:04,398][39m Trial 404 finished with value: 0.7526881720430108 and parameters: {'objective': 'Logloss', 'colsample_bylevel': 0.07535211874538772, 'depth': 4, 'boosting_type': 'Plain', 'bootstrap_type': 'Bayesian', 'bagging_temperature': 7.904314442988262}. Best is trial 382 with value: 0.7789473684210526.
[32m[I 2023-04-26 00:39:05,970][39m Trial 405 finished with value: 0.7252747252747254 and parameters: {'objective': 'Logloss', 'colsample_bylevel': 0.07230788992837864, 'depth': 4, 'boosting_type': 'Plain', 'bootstrap_type': 'Bayesian', 'bagging_temperature': 8.985793665317225}. Best is trial 382 with value: 0.7789473684210526.
[32m[I 2023-04-26 00:39:08,628][39m Trial 406 finished with value: 0.7578947368421053 and parameters: {'objective': 'Logloss', 'colsample_bylevel': 0.07642566832605456, 'depth': 4, 'boosting_type': 'Plain', 'bootstrap_type': 'Bayesian', 'bagging_temperature': 7.905533227309849}. Best is trial 382 with value: 0.7789473684210526.
[32m[I 2023-04-26 00:39:10,250][39m Trial 407 finished with value: 0.723404255319149 and parameters: {'objective': 'Logloss', 'colsample_bylevel': 0.07809962082774774, 'depth': 4, 'boosting_type': 'Plain', 'bootstrap_type': 'Bayesian', 'bagging_temperature': 9.428465351232576}. Best is trial 382 with value: 0.7789473684210526.
[32m[I 2023-04-26 00:39:11,868][39m Trial 408 finished with value: 0.7499999999999999 and parameters: {'objective': 'Logloss', 'colsample_bylevel': 0.08017108767859737, 'depth': 4, 'boosting_type': 'Plain', 'bootstrap_type': 'Bayesian', 'bagging_temperature': 8.326840471901434}. Best is trial 382 with value: 0.7789473684210526.
[32m[I 2023-04-26 00:39:13,409][39m Trial 409 finished with value: 0.7499999999999999 and parameters: {'objective': 'Logloss', 'colsample_bylevel': 0.0744570570556387, 'depth': 4, 'boosting_type': 'Plain', 'bootstrap_type': 'Bayesian', 'bagging_temperature': 9.5863310920846}. Best is trial 382 with value: 0.7789473684210526.
[32m[I 2023-04-26 00:39:15,504][39m Trial 410 finished with value: 0.723404255319149 and parameters: {'objective': 'Logloss', 'colsample_bylevel': 0.07718502659514126, 'depth': 4, 'boosting_type': 'Plain', 'bootstrap_type': 'Bayesian', 'bagging_temperature': 8.908698225029667}. Best is trial 382 with value: 0.7789473684210526.
[32m[I 2023-04-26 00:39:16,996][39m Trial 411 finished with value: 0.7252747252747254 and parameters: {'objective': 'Logloss', 'colsample_bylevel': 0.07194880499142432, 'depth': 4, 'boosting_type': 'Plain', 'bootstrap_type': 'Bayesian', 'bagging_temperature': 9.551456455655428}. Best is trial 382 with value: 0.7789473684210526.
[32m[I 2023-04-26 00:39:18,740][39m Trial 412 finished with value: 0.7311827956989247 and parameters: {'objective': 'Logloss', 'colsample_bylevel': 0.07662196608272206, 'depth': 4, 'boosting_type': 'Plain', 'bootstrap_type': 'Bayesian', 'bagging_temperature': 8.618387050139656}. Best is trial 382 with value: 0.7789473684210526.
[32m[I 2023-04-26 00:39:20,441][39m Trial 413 finished with value: 0.7526881720430108 and parameters: {'objective': 'Logloss', 'colsample_bylevel': 0.07441034307444926, 'depth': 4, 'boosting_type': 'Plain', 'bootstrap_type': 'Bayesian', 'bagging_temperature': 7.594249917070671}. Best is trial 382 with value: 0.7789473684210526.
[32m[I 2023-04-26 00:39:22,345][39m Trial 414 finished with value: 0.7446808510638298 and parameters: {'objective': 'Logloss', 'colsample_bylevel': 0.08266923668669685, 'depth': 4, 'boosting_type': 'Plain', 'bootstrap_type': 'Bayesian', 'bagging_temperature': 9.15303477530945}. Best is trial 382 with value: 0.7789473684210526.
[32m[I 2023-04-26 00:39:24,097][39m Trial 415 finished with value: 0.7291666666666666 and parameters: {'objective': 'Logloss', 'colsample_bylevel': 0.08032504054309171, 'depth': 3, 'boosting_type': 'Plain', 'bootstrap_type': 'Bayesian', 'bagging_temperature': 8.120775596327473}. Best is trial 382 with value: 0.7789473684210526.
[32m[I 2023-04-26 00:39:25,544][39m Trial 416 finished with value: 0.7252747252747254 and parameters: {'objective': 'Logloss', 'colsample_bylevel': 0.07201878478820373, 'depth': 4, 'boosting_type': 'Plain', 'bootstrap_type': 'Bayesian', 'bagging_temperature': 9.543260999547122}. Best is trial 382 with value: 0.7789473684210526.
[32m[I 2023-04-26 00:39:27,093][39m Trial 417 finished with value: 0.7526881720430108 and parameters: {'objective': 'Logloss', 'colsample_bylevel': 0.07061800697362997, 'depth': 4, 'boosting_type': 'Plain', 'bootstrap_type': 'Bayesian', 'bagging_temperature': 8.702429685096673}. Best is trial 382 with value: 0.7789473684210526.
[32m[I 2023-04-26 00:39:28,755][39m Trial 418 finished with value: 0.7526881720430108 and parameters: {'objective': 'Logloss', 'colsample_bylevel': 0.07544869830916237, 'depth': 3, 'boosting_type': 'Plain', 'bootstrap_type': 'Bayesian', 'bagging_temperature': 6.0984172744557705}. Best is trial 382 with value: 0.7789473684210526.
[32m[I 2023-04-26 00:39:30,454][39m Trial 419 finished with value: 0.7526881720430108 and parameters: {'objective': 'Logloss', 'colsample_bylevel': 0.0790003049442449, 'depth': 4, 'boosting_type': 'Plain', 'bootstrap_type': 'Bayesian', 'bagging_temperature': 9.691186001095119}. Best is trial 382 with value: 0.7789473684210526.
[32m[I 2023-04-26 00:39:32,024][39m Trial 420 finished with value: 0.7311827956989247 and parameters: {'objective': 'Logloss', 'colsample_bylevel': 0.07406800853626727, 'depth': 4, 'boosting_type': 'Plain', 'bootstrap_type': 'Bayesian', 'bagging_temperature': 7.316205488043951}. Best is trial 382 with value: 0.7789473684210526.
[32m[I 2023-04-26 00:39:33,539][39m Trial 421 finished with value: 0.7252747252747254 and parameters: {'objective': 'Logloss', 'colsample_bylevel': 0.07134556468404364, 'depth': 4, 'boosting_type': 'Plain', 'bootstrap_type': 'Bayesian', 'bagging_temperature': 9.174402709013544}. Best is trial 382 with value: 0.7789473684210526.
[32m[I 2023-04-26 00:39:35,155][39m Trial 422 finished with value: 0.7446808510638298 and parameters: {'objective': 'Logloss', 'colsample_bylevel': 0.07333430492803761, 'depth': 3, 'boosting_type': 'Plain', 'bootstrap_type': 'Bayesian', 'bagging_temperature': 4.53056950344029}. Best is trial 382 with value: 0.7789473684210526.
[32m[I 2023-04-26 00:39:36,754][39m Trial 423 finished with value: 0.7526881720430108 and parameters: {'objective': 'Logloss', 'colsample_bylevel': 0.06953619849351722, 'depth': 4, 'boosting_type': 'Plain', 'bootstrap_type': 'Bayesian', 'bagging_temperature': 9.967074915838378}. Best is trial 382 with value: 0.7789473684210526.
[32m[I 2023-04-26 00:39:38,302][39m Trial 424 finished with value: 0.7578947368421053 and parameters: {'objective': 'Logloss', 'colsample_bylevel': 0.0778451898664975, 'depth': 4, 'boosting_type': 'Plain', 'bootstrap_type': 'Bayesian', 'bagging_temperature': 8.420837825801346}. Best is trial 382 with value: 0.7789473684210526.
[32m[I 2023-04-26 00:39:39,896][39m Trial 425 finished with value: 0.7368421052631579 and parameters: {'objective': 'Logloss', 'colsample_bylevel': 0.06971409384601689, 'depth': 4, 'boosting_type': 'Plain', 'bootstrap_type': 'Bayesian', 'bagging_temperature': 8.433938495875426}. Best is trial 382 with value: 0.7789473684210526.
[32m[I 2023-04-26 00:39:41,899][39m Trial 426 finished with value: 0.7659574468085106 and parameters: {'objective': 'Logloss', 'colsample_bylevel': 0.07908012566027894, 'depth': 4, 'boosting_type': 'Plain', 'bootstrap_type': 'Bayesian', 'bagging_temperature': 8.86392175239622}. Best is trial 382 with value: 0.7789473684210526.
[32m[I 2023-04-26 00:39:43,666][39m Trial 427 finished with value: 0.7391304347826086 and parameters: {'objective': 'Logloss', 'colsample_bylevel': 0.08426612773247309, 'depth': 4, 'boosting_type': 'Plain', 'bootstrap_type': 'Bayesian', 'bagging_temperature': 8.7198034004491}. Best is trial 382 with value: 0.7789473684210526.
[32m[I 2023-04-26 00:39:45,552][39m Trial 428 finished with value: 0.7578947368421053 and parameters: {'objective': 'Logloss', 'colsample_bylevel': 0.08105795733492506, 'depth': 4, 'boosting_type': 'Plain', 'bootstrap_type': 'Bayesian', 'bagging_temperature': 8.158286411069707}. Best is trial 382 with value: 0.7789473684210526.
[32m[I 2023-04-26 00:39:47,792][39m Trial 429 finished with value: 0.7291666666666666 and parameters: {'objective': 'Logloss', 'colsample_bylevel': 0.08076201218003358, 'depth': 4, 'boosting_type': 'Plain', 'bootstrap_type': 'Bayesian', 'bagging_temperature': 7.854016757868979}. Best is trial 382 with value: 0.7789473684210526.
[32m[I 2023-04-26 00:39:49,662][39m Trial 430 finished with value: 0.7446808510638298 and parameters: {'objective': 'Logloss', 'colsample_bylevel': 0.07923359051106416, 'depth': 4, 'boosting_type': 'Plain', 'bootstrap_type': 'Bayesian', 'bagging_temperature': 8.026572631192915}. Best is trial 382 with value: 0.7789473684210526.
[32m[I 2023-04-26 00:39:51,369][39m Trial 431 finished with value: 0.7659574468085106 and parameters: {'objective': 'Logloss', 'colsample_bylevel': 0.08159868791952946, 'depth': 3, 'boosting_type': 'Plain', 'bootstrap_type': 'Bayesian', 'bagging_temperature': 9.294314660000422}. Best is trial 382 with value: 0.7789473684210526.
[32m[I 2023-04-26 00:39:53,105][39m Trial 432 finished with value: 0.7526881720430108 and parameters: {'objective': 'Logloss', 'colsample_bylevel': 0.0841217567563176, 'depth': 3, 'boosting_type': 'Plain', 'bootstrap_type': 'Bayesian', 'bagging_temperature': 9.146098360732292}. Best is trial 382 with value: 0.7789473684210526.
[32m[I 2023-04-26 00:39:54,819][39m Trial 433 finished with value: 0.7659574468085106 and parameters: {'objective': 'Logloss', 'colsample_bylevel': 0.07844443149809599, 'depth': 3, 'boosting_type': 'Plain', 'bootstrap_type': 'Bayesian', 'bagging_temperature': 9.701234744775343}. Best is trial 382 with value: 0.7789473684210526.
[32m[I 2023-04-26 00:39:56,620][39m Trial 434 finished with value: 0.7526881720430108 and parameters: {'objective': 'Logloss', 'colsample_bylevel': 0.08274196485261091, 'depth': 3, 'boosting_type': 'Plain', 'bootstrap_type': 'Bayesian', 'bagging_temperature': 9.72525661034447}. Best is trial 382 with value: 0.7789473684210526.
[32m[I 2023-04-26 00:39:58,267][39m Trial 435 finished with value: 0.7526881720430108 and parameters: {'objective': 'Logloss', 'colsample_bylevel': 0.080306830751287, 'depth': 3, 'boosting_type': 'Plain', 'bootstrap_type': 'Bayesian', 'bagging_temperature': 9.709894704816836}. Best is trial 382 with value: 0.7789473684210526.
[32m[I 2023-04-26 00:39:59,857][39m Trial 436 finished with value: 0.7472527472527474 and parameters: {'objective': 'Logloss', 'colsample_bylevel': 0.07673438140042878, 'depth': 3, 'boosting_type': 'Plain', 'bootstrap_type': 'Bayesian', 'bagging_temperature': 9.207514245682855}. Best is trial 382 with value: 0.7789473684210526.
[32m[I 2023-04-26 00:40:01,623][39m Trial 437 finished with value: 0.7311827956989247 and parameters: {'objective': 'Logloss', 'colsample_bylevel': 0.07822159485142698, 'depth': 3, 'boosting_type': 'Plain', 'bootstrap_type': 'Bayesian', 'bagging_temperature': 9.389939792041607}. Best is trial 382 with value: 0.7789473684210526.
[32m[I 2023-04-26 00:40:03,329][39m Trial 438 finished with value: 0.7526881720430108 and parameters: {'objective': 'Logloss', 'colsample_bylevel': 0.08059051769835049, 'depth': 3, 'boosting_type': 'Plain', 'bootstrap_type': 'Bayesian', 'bagging_temperature': 9.776623801394619}. Best is trial 382 with value: 0.7789473684210526.
[32m[I 2023-04-26 00:40:05,018][39m Trial 439 finished with value: 0.7391304347826086 and parameters: {'objective': 'Logloss', 'colsample_bylevel': 0.07615953706120768, 'depth': 3, 'boosting_type': 'Plain', 'bootstrap_type': 'Bayesian', 'bagging_temperature': 8.871499109227383}. Best is trial 382 with value: 0.7789473684210526.
[32m[I 2023-04-26 00:40:06,618][39m Trial 440 finished with value: 0.7526881720430108 and parameters: {'objective': 'Logloss', 'colsample_bylevel': 0.0853698292803488, 'depth': 3, 'boosting_type': 'Plain', 'bootstrap_type': 'Bayesian', 'bagging_temperature': 9.983163016481498}. Best is trial 382 with value: 0.7789473684210526.
[32m[I 2023-04-26 00:40:08,444][39m Trial 441 finished with value: 0.7446808510638298 and parameters: {'objective': 'Logloss', 'colsample_bylevel': 0.0818862959777453, 'depth': 3, 'boosting_type': 'Plain', 'bootstrap_type': 'Bayesian', 'bagging_temperature': 8.413541114463497}. Best is trial 382 with value: 0.7789473684210526.
[32m[I 2023-04-26 00:40:10,564][39m Trial 442 finished with value: 0.7252747252747254 and parameters: {'objective': 'Logloss', 'colsample_bylevel': 0.07866833388876221, 'depth': 4, 'boosting_type': 'Plain', 'bootstrap_type': 'Bayesian', 'bagging_temperature': 9.273004174606653}. Best is trial 382 with value: 0.7789473684210526.
[32m[I 2023-04-26 00:40:12,178][39m Trial 443 finished with value: 0.7391304347826086 and parameters: {'objective': 'Logloss', 'colsample_bylevel': 0.07800958953342178, 'depth': 4, 'boosting_type': 'Plain', 'bootstrap_type': 'Bayesian', 'bagging_temperature': 8.93947616346842}. Best is trial 382 with value: 0.7789473684210526.
[32m[I 2023-04-26 00:40:14,153][39m Trial 444 finished with value: 0.7526881720430108 and parameters: {'objective': 'Logloss', 'colsample_bylevel': 0.08728434112053599, 'depth': 3, 'boosting_type': 'Plain', 'bootstrap_type': 'Bayesian', 'bagging_temperature': 9.609993915162752}. Best is trial 382 with value: 0.7789473684210526.
[32m[I 2023-04-26 00:40:16,053][39m Trial 445 finished with value: 0.7578947368421053 and parameters: {'objective': 'Logloss', 'colsample_bylevel': 0.08177640741209614, 'depth': 4, 'boosting_type': 'Plain', 'bootstrap_type': 'Bayesian', 'bagging_temperature': 8.230686686882576}. Best is trial 382 with value: 0.7789473684210526.
[32m[I 2023-04-26 00:40:17,854][39m Trial 446 finished with value: 0.7446808510638298 and parameters: {'objective': 'Logloss', 'colsample_bylevel': 0.08298030732805926, 'depth': 4, 'boosting_type': 'Plain', 'bootstrap_type': 'Bayesian', 'bagging_temperature': 5.4341618410359835}. Best is trial 382 with value: 0.7789473684210526.
[32m[I 2023-04-26 00:40:19,568][39m Trial 447 finished with value: 0.7252747252747254 and parameters: {'objective': 'Logloss', 'colsample_bylevel': 0.08220847940117672, 'depth': 4, 'boosting_type': 'Plain', 'bootstrap_type': 'Bayesian', 'bagging_temperature': 9.398683364675216}. Best is trial 382 with value: 0.7789473684210526.
[32m[I 2023-04-26 00:40:21,155][39m Trial 448 finished with value: 0.7446808510638298 and parameters: {'objective': 'Logloss', 'colsample_bylevel': 0.07618724466399383, 'depth': 3, 'boosting_type': 'Plain', 'bootstrap_type': 'Bayesian', 'bagging_temperature': 9.798680438599927}. Best is trial 382 with value: 0.7789473684210526.
[32m[I 2023-04-26 00:40:22,916][39m Trial 449 finished with value: 0.7526881720430108 and parameters: {'objective': 'Logloss', 'colsample_bylevel': 0.07944470515506208, 'depth': 4, 'boosting_type': 'Plain', 'bootstrap_type': 'Bayesian', 'bagging_temperature': 8.546076952206414}. Best is trial 382 with value: 0.7789473684210526.
[32m[I 2023-04-26 00:40:24,635][39m Trial 450 finished with value: 0.7446808510638298 and parameters: {'objective': 'Logloss', 'colsample_bylevel': 0.0778990328635433, 'depth': 4, 'boosting_type': 'Plain', 'bootstrap_type': 'Bayesian', 'bagging_temperature': 7.496467571084975}. Best is trial 382 with value: 0.7789473684210526.
[32m[I 2023-04-26 00:40:26,254][39m Trial 451 finished with value: 0.7499999999999999 and parameters: {'objective': 'Logloss', 'colsample_bylevel': 0.07517517140826381, 'depth': 4, 'boosting_type': 'Plain', 'bootstrap_type': 'Bayesian', 'bagging_temperature': 9.017444346721604}. Best is trial 382 with value: 0.7789473684210526.
[32m[I 2023-04-26 00:40:27,900][39m Trial 452 finished with value: 0.7526881720430108 and parameters: {'objective': 'Logloss', 'colsample_bylevel': 0.08027501739495399, 'depth': 3, 'boosting_type': 'Plain', 'bootstrap_type': 'Bayesian', 'bagging_temperature': 6.637833756150733}. Best is trial 382 with value: 0.7789473684210526.
[32m[I 2023-04-26 00:40:29,591][39m Trial 453 finished with value: 0.7578947368421053 and parameters: {'objective': 'Logloss', 'colsample_bylevel': 0.08108891754990732, 'depth': 4, 'boosting_type': 'Plain', 'bootstrap_type': 'Bayesian', 'bagging_temperature': 8.13198697412468}. Best is trial 382 with value: 0.7789473684210526.
[32m[I 2023-04-26 00:40:31,338][39m Trial 454 finished with value: 0.7368421052631579 and parameters: {'objective': 'Logloss', 'colsample_bylevel': 0.07855218076789487, 'depth': 4, 'boosting_type': 'Plain', 'bootstrap_type': 'Bayesian', 'bagging_temperature': 2.902682510672498}. Best is trial 382 with value: 0.7789473684210526.
[32m[I 2023-04-26 00:40:33,017][39m Trial 455 finished with value: 0.7311827956989247 and parameters: {'objective': 'Logloss', 'colsample_bylevel': 0.08586418874135857, 'depth': 4, 'boosting_type': 'Plain', 'bootstrap_type': 'Bayesian', 'bagging_temperature': 7.770531423986686}. Best is trial 382 with value: 0.7789473684210526.
[32m[I 2023-04-26 00:40:34,648][39m Trial 456 finished with value: 0.7446808510638298 and parameters: {'objective': 'Logloss', 'colsample_bylevel': 0.08256362247508882, 'depth': 4, 'boosting_type': 'Plain', 'bootstrap_type': 'Bayesian', 'bagging_temperature': 8.14322324165115}. Best is trial 382 with value: 0.7789473684210526.
[32m[I 2023-04-26 00:40:36,181][39m Trial 457 finished with value: 0.7422680412371134 and parameters: {'objective': 'Logloss', 'colsample_bylevel': 0.07385233829483723, 'depth': 3, 'boosting_type': 'Plain', 'bootstrap_type': 'Bayesian', 'bagging_temperature': 8.782905736136954}. Best is trial 382 with value: 0.7789473684210526.
[32m[I 2023-04-26 00:40:37,896][39m Trial 458 finished with value: 0.7526881720430108 and parameters: {'objective': 'Logloss', 'colsample_bylevel': 0.08032081967715252, 'depth': 3, 'boosting_type': 'Plain', 'bootstrap_type': 'Bayesian', 'bagging_temperature': 9.48739641253852}. Best is trial 382 with value: 0.7789473684210526.
[32m[I 2023-04-26 00:40:40,154][39m Trial 459 finished with value: 0.7578947368421053 and parameters: {'objective': 'Logloss', 'colsample_bylevel': 0.08132993215219188, 'depth': 4, 'boosting_type': 'Plain', 'bootstrap_type': 'Bayesian', 'bagging_temperature': 8.152670220438967}. Best is trial 382 with value: 0.7789473684210526.
[32m[I 2023-04-26 00:40:41,844][39m Trial 460 finished with value: 0.7659574468085106 and parameters: {'objective': 'Logloss', 'colsample_bylevel': 0.08147596302475678, 'depth': 4, 'boosting_type': 'Plain', 'bootstrap_type': 'Bayesian', 'bagging_temperature': 9.763575430672583}. Best is trial 382 with value: 0.7789473684210526.
[32m[I 2023-04-26 00:40:43,580][39m Trial 461 finished with value: 0.7526881720430108 and parameters: {'objective': 'Logloss', 'colsample_bylevel': 0.08409254790158438, 'depth': 4, 'boosting_type': 'Plain', 'bootstrap_type': 'Bayesian', 'bagging_temperature': 9.752177612372599}. Best is trial 382 with value: 0.7789473684210526.
[32m[I 2023-04-26 00:40:45,156][39m Trial 462 finished with value: 0.7659574468085106 and parameters: {'objective': 'Logloss', 'colsample_bylevel': 0.07736455901950356, 'depth': 4, 'boosting_type': 'Plain', 'bootstrap_type': 'Bayesian', 'bagging_temperature': 9.999025199566162}. Best is trial 382 with value: 0.7789473684210526.
[32m[I 2023-04-26 00:40:46,726][39m Trial 463 finished with value: 0.7526881720430108 and parameters: {'objective': 'Logloss', 'colsample_bylevel': 0.07695858799441159, 'depth': 4, 'boosting_type': 'Plain', 'bootstrap_type': 'Bayesian', 'bagging_temperature': 9.962752091063779}. Best is trial 382 with value: 0.7789473684210526.
[32m[I 2023-04-26 00:40:48,798][39m Trial 464 finished with value: 0.7526881720430108 and parameters: {'objective': 'Logloss', 'colsample_bylevel': 0.07935794712044046, 'depth': 4, 'boosting_type': 'Plain', 'bootstrap_type': 'Bayesian', 'bagging_temperature': 9.291946069653635}. Best is trial 382 with value: 0.7789473684210526.
[32m[I 2023-04-26 00:40:51,022][39m Trial 465 finished with value: 0.7526881720430108 and parameters: {'objective': 'Logloss', 'colsample_bylevel': 0.07686021645546935, 'depth': 4, 'boosting_type': 'Plain', 'bootstrap_type': 'Bayesian', 'bagging_temperature': 9.596912063724146}. Best is trial 382 with value: 0.7789473684210526.
[32m[I 2023-04-26 00:40:52,707][39m Trial 466 finished with value: 0.7659574468085106 and parameters: {'objective': 'Logloss', 'colsample_bylevel': 0.07515774036710882, 'depth': 4, 'boosting_type': 'Plain', 'bootstrap_type': 'Bayesian', 'bagging_temperature': 9.797768310378212}. Best is trial 382 with value: 0.7789473684210526.
[32m[I 2023-04-26 00:40:54,380][39m Trial 467 finished with value: 0.7659574468085106 and parameters: {'objective': 'Logloss', 'colsample_bylevel': 0.07338362837887095, 'depth': 4, 'boosting_type': 'Plain', 'bootstrap_type': 'Bayesian', 'bagging_temperature': 9.80822121591404}. Best is trial 382 with value: 0.7789473684210526.
[32m[I 2023-04-26 00:40:55,984][39m Trial 468 finished with value: 0.7391304347826086 and parameters: {'objective': 'Logloss', 'colsample_bylevel': 0.07261344148645435, 'depth': 4, 'boosting_type': 'Plain', 'bootstrap_type': 'Bayesian', 'bagging_temperature': 9.86416102635789}. Best is trial 382 with value: 0.7789473684210526.
