[32m[I 2023-04-26 00:30:55,241][39m Trial 203 finished with value: 0.7368421052631579 and parameters: {'objective': 'CrossEntropy', 'colsample_bylevel': 0.06633199440929367, 'depth': 6, 'boosting_type': 'Plain', 'bootstrap_type': 'Bernoulli', 'subsample': 0.34650409490582323}. Best is trial 106 with value: 0.7578947368421053.
[32m[I 2023-04-26 00:30:57,468][39m Trial 204 finished with value: 0.7368421052631579 and parameters: {'objective': 'CrossEntropy', 'colsample_bylevel': 0.06278610106356981, 'depth': 12, 'boosting_type': 'Plain', 'bootstrap_type': 'Bernoulli', 'subsample': 0.4233667795216688}. Best is trial 106 with value: 0.7578947368421053.
[32m[I 2023-04-26 00:30:58,907][39m Trial 205 finished with value: 0.7391304347826086 and parameters: {'objective': 'CrossEntropy', 'colsample_bylevel': 0.06485586683276136, 'depth': 5, 'boosting_type': 'Plain', 'bootstrap_type': 'Bernoulli', 'subsample': 0.36728497713153135}. Best is trial 106 with value: 0.7578947368421053.
[32m[I 2023-04-26 00:31:00,380][39m Trial 206 finished with value: 0.7446808510638298 and parameters: {'objective': 'CrossEntropy', 'colsample_bylevel': 0.060194222027386904, 'depth': 12, 'boosting_type': 'Plain', 'bootstrap_type': 'Bernoulli', 'subsample': 0.4475518855851269}. Best is trial 106 with value: 0.7578947368421053.
[32m[I 2023-04-26 00:31:01,858][39m Trial 207 finished with value: 0.7391304347826086 and parameters: {'objective': 'CrossEntropy', 'colsample_bylevel': 0.05925796639286191, 'depth': 12, 'boosting_type': 'Plain', 'bootstrap_type': 'Bernoulli', 'subsample': 0.32211412730810374}. Best is trial 106 with value: 0.7578947368421053.
[32m[I 2023-04-26 00:31:03,701][39m Trial 208 finished with value: 0.717391304347826 and parameters: {'objective': 'CrossEntropy', 'colsample_bylevel': 0.062417573944095146, 'depth': 8, 'boosting_type': 'Plain', 'bootstrap_type': 'Bernoulli', 'subsample': 0.47271753006706313}. Best is trial 106 with value: 0.7578947368421053.
[32m[I 2023-04-26 00:31:05,256][39m Trial 209 finished with value: 0.7368421052631579 and parameters: {'objective': 'Logloss', 'colsample_bylevel': 0.06772052839262156, 'depth': 6, 'boosting_type': 'Plain', 'bootstrap_type': 'Bernoulli', 'subsample': 0.3989589799092762}. Best is trial 106 with value: 0.7578947368421053.
[32m[I 2023-04-26 00:31:06,765][39m Trial 210 finished with value: 0.7216494845360826 and parameters: {'objective': 'CrossEntropy', 'colsample_bylevel': 0.05616490807525511, 'depth': 5, 'boosting_type': 'Plain', 'bootstrap_type': 'Bernoulli', 'subsample': 0.4896250616290789}. Best is trial 106 with value: 0.7578947368421053.
[32m[I 2023-04-26 00:31:08,266][39m Trial 211 finished with value: 0.7499999999999999 and parameters: {'objective': 'CrossEntropy', 'colsample_bylevel': 0.06394823010043492, 'depth': 12, 'boosting_type': 'Plain', 'bootstrap_type': 'Bernoulli', 'subsample': 0.7626524885409354}. Best is trial 106 with value: 0.7578947368421053.
[32m[I 2023-04-26 00:31:09,708][39m Trial 212 finished with value: 0.7446808510638298 and parameters: {'objective': 'CrossEntropy', 'colsample_bylevel': 0.06084949229459043, 'depth': 12, 'boosting_type': 'Plain', 'bootstrap_type': 'Bernoulli', 'subsample': 0.38248982705967277}. Best is trial 106 with value: 0.7578947368421053.
[32m[I 2023-04-26 00:31:11,167][39m Trial 213 finished with value: 0.6947368421052632 and parameters: {'objective': 'CrossEntropy', 'colsample_bylevel': 0.05797382019072089, 'depth': 12, 'boosting_type': 'Plain', 'bootstrap_type': 'Bernoulli', 'subsample': 0.43808347554432636}. Best is trial 106 with value: 0.7578947368421053.
[32m[I 2023-04-26 00:31:13,182][39m Trial 214 finished with value: 0.7291666666666666 and parameters: {'objective': 'CrossEntropy', 'colsample_bylevel': 0.06548944535449769, 'depth': 4, 'boosting_type': 'Plain', 'bootstrap_type': 'Bernoulli', 'subsample': 0.2979982588168042}. Best is trial 106 with value: 0.7578947368421053.
[32m[I 2023-04-26 00:31:14,680][39m Trial 215 finished with value: 0.7446808510638298 and parameters: {'objective': 'CrossEntropy', 'colsample_bylevel': 0.0626154381662191, 'depth': 12, 'boosting_type': 'Plain', 'bootstrap_type': 'Bernoulli', 'subsample': 0.7556891218757374}. Best is trial 106 with value: 0.7578947368421053.
[32m[I 2023-04-26 00:31:16,249][39m Trial 216 finished with value: 0.7311827956989247 and parameters: {'objective': 'CrossEntropy', 'colsample_bylevel': 0.06448550742054572, 'depth': 5, 'boosting_type': 'Plain', 'bootstrap_type': 'Bernoulli', 'subsample': 0.459999635027292}. Best is trial 106 with value: 0.7578947368421053.
[32m[I 2023-04-26 00:31:17,730][39m Trial 217 finished with value: 0.723404255319149 and parameters: {'objective': 'CrossEntropy', 'colsample_bylevel': 0.059138491472658976, 'depth': 12, 'boosting_type': 'Plain', 'bootstrap_type': 'Bernoulli', 'subsample': 0.7604274011906295}. Best is trial 106 with value: 0.7578947368421053.
[32m[I 2023-04-26 00:31:19,503][39m Trial 218 finished with value: 0.7096774193548387 and parameters: {'objective': 'CrossEntropy', 'colsample_bylevel': 0.07043351795732529, 'depth': 6, 'boosting_type': 'Plain', 'bootstrap_type': 'Bernoulli', 'subsample': 0.41541159664145366}. Best is trial 106 with value: 0.7578947368421053.
[32m[I 2023-04-26 00:31:21,063][39m Trial 219 finished with value: 0.7446808510638298 and parameters: {'objective': 'Logloss', 'colsample_bylevel': 0.054545666552251584, 'depth': 5, 'boosting_type': 'Plain', 'bootstrap_type': 'Bernoulli', 'subsample': 0.4995325253310523}. Best is trial 106 with value: 0.7578947368421053.
[32m[I 2023-04-26 00:31:22,540][39m Trial 220 finished with value: 0.717391304347826 and parameters: {'objective': 'CrossEntropy', 'colsample_bylevel': 0.06074854875781454, 'depth': 12, 'boosting_type': 'Plain', 'bootstrap_type': 'Bernoulli', 'subsample': 0.43730240878445986}. Best is trial 106 with value: 0.7578947368421053.
[32m[I 2023-04-26 00:31:24,118][39m Trial 221 finished with value: 0.7252747252747254 and parameters: {'objective': 'CrossEntropy', 'colsample_bylevel': 0.06328399040584147, 'depth': 12, 'boosting_type': 'Plain', 'bootstrap_type': 'Bernoulli', 'subsample': 0.732596710550207}. Best is trial 106 with value: 0.7578947368421053.
[32m[I 2023-04-26 00:31:28,107][39m Trial 222 finished with value: 0.7446808510638298 and parameters: {'objective': 'CrossEntropy', 'colsample_bylevel': 0.05686598241298441, 'depth': 11, 'boosting_type': 'Ordered', 'bootstrap_type': 'MVS'}. Best is trial 106 with value: 0.7578947368421053.
[32m[I 2023-04-26 00:31:32,540][39m Trial 223 finished with value: 0.7368421052631579 and parameters: {'objective': 'CrossEntropy', 'colsample_bylevel': 0.05886254978364424, 'depth': 5, 'boosting_type': 'Ordered', 'bootstrap_type': 'MVS'}. Best is trial 106 with value: 0.7578947368421053.
[32m[I 2023-04-26 00:31:34,081][39m Trial 224 finished with value: 0.717391304347826 and parameters: {'objective': 'CrossEntropy', 'colsample_bylevel': 0.06658213740678885, 'depth': 12, 'boosting_type': 'Plain', 'bootstrap_type': 'Bernoulli', 'subsample': 0.7181255440383066}. Best is trial 106 with value: 0.7578947368421053.
[32m[I 2023-04-26 00:31:36,118][39m Trial 225 finished with value: 0.7216494845360826 and parameters: {'objective': 'CrossEntropy', 'colsample_bylevel': 0.061308227706638026, 'depth': 7, 'boosting_type': 'Plain', 'bootstrap_type': 'Bernoulli', 'subsample': 0.5853467453433936}. Best is trial 106 with value: 0.7578947368421053.
[32m[I 2023-04-26 00:31:37,606][39m Trial 226 finished with value: 0.7311827956989247 and parameters: {'objective': 'CrossEntropy', 'colsample_bylevel': 0.06398890759253859, 'depth': 12, 'boosting_type': 'Plain', 'bootstrap_type': 'Bernoulli', 'subsample': 0.6918785838859534}. Best is trial 106 with value: 0.7578947368421053.
[32m[I 2023-04-26 00:31:39,524][39m Trial 227 finished with value: 0.7096774193548387 and parameters: {'objective': 'CrossEntropy', 'colsample_bylevel': 0.06847678369228336, 'depth': 8, 'boosting_type': 'Plain', 'bootstrap_type': 'Bernoulli', 'subsample': 0.6105486360205918}. Best is trial 106 with value: 0.7578947368421053.
[32m[I 2023-04-26 00:31:43,461][39m Trial 228 finished with value: 0.7216494845360826 and parameters: {'objective': 'CrossEntropy', 'colsample_bylevel': 0.05796704455019922, 'depth': 11, 'boosting_type': 'Ordered', 'bootstrap_type': 'Bernoulli', 'subsample': 0.4534578392777807}. Best is trial 106 with value: 0.7578947368421053.
[32m[I 2023-04-26 00:31:45,270][39m Trial 229 finished with value: 0.7446808510638298 and parameters: {'objective': 'Logloss', 'colsample_bylevel': 0.062167086558726325, 'depth': 12, 'boosting_type': 'Plain', 'bootstrap_type': 'Bernoulli', 'subsample': 0.7754831704361917}. Best is trial 106 with value: 0.7578947368421053.
[32m[I 2023-04-26 00:31:49,179][39m Trial 230 finished with value: 0.7216494845360826 and parameters: {'objective': 'CrossEntropy', 'colsample_bylevel': 0.051198169370391955, 'depth': 11, 'boosting_type': 'Ordered', 'bootstrap_type': 'Bernoulli', 'subsample': 0.4737381488480985}. Best is trial 106 with value: 0.7578947368421053.
[32m[I 2023-04-26 00:31:52,922][39m Trial 231 finished with value: 0.7291666666666666 and parameters: {'objective': 'CrossEntropy', 'colsample_bylevel': 0.06011484299278313, 'depth': 12, 'boosting_type': 'Ordered', 'bootstrap_type': 'Bayesian', 'bagging_temperature': 1.7161220968014819}. Best is trial 106 with value: 0.7578947368421053.
[32m[I 2023-04-26 00:31:57,437][39m Trial 232 finished with value: 0.7446808510638298 and parameters: {'objective': 'CrossEntropy', 'colsample_bylevel': 0.06380667932493204, 'depth': 5, 'boosting_type': 'Ordered', 'bootstrap_type': 'Bernoulli', 'subsample': 0.5346881677593088}. Best is trial 106 with value: 0.7578947368421053.
[32m[I 2023-04-26 00:32:02,082][39m Trial 233 finished with value: 0.7526881720430108 and parameters: {'objective': 'CrossEntropy', 'colsample_bylevel': 0.08276928563498075, 'depth': 3, 'boosting_type': 'Ordered', 'bootstrap_type': 'Bernoulli', 'subsample': 0.41793686894553006}. Best is trial 106 with value: 0.7578947368421053.
[32m[I 2023-04-26 00:32:06,003][39m Trial 234 finished with value: 0.7446808510638298 and parameters: {'objective': 'CrossEntropy', 'colsample_bylevel': 0.08393909745054617, 'depth': 3, 'boosting_type': 'Ordered', 'bootstrap_type': 'Bernoulli', 'subsample': 0.4167291137251349}. Best is trial 106 with value: 0.7578947368421053.
[32m[I 2023-04-26 00:32:08,622][39m Trial 235 finished with value: 0.717391304347826 and parameters: {'objective': 'CrossEntropy', 'colsample_bylevel': 0.08010108403658785, 'depth': 4, 'boosting_type': 'Plain', 'bootstrap_type': 'Bernoulli', 'subsample': 0.4337297725293466}. Best is trial 106 with value: 0.7578947368421053.
[32m[I 2023-04-26 00:32:12,042][39m Trial 236 finished with value: 0.7070707070707071 and parameters: {'objective': 'CrossEntropy', 'colsample_bylevel': 0.08272810581777944, 'depth': 2, 'boosting_type': 'Ordered', 'bootstrap_type': 'MVS'}. Best is trial 106 with value: 0.7578947368421053.
[32m[I 2023-04-26 00:32:13,939][39m Trial 237 finished with value: 0.7368421052631579 and parameters: {'objective': 'CrossEntropy', 'colsample_bylevel': 0.05549064028654682, 'depth': 3, 'boosting_type': 'Plain', 'bootstrap_type': 'Bernoulli', 'subsample': 0.3855717319797601}. Best is trial 106 with value: 0.7578947368421053.
[32m[I 2023-04-26 00:32:15,920][39m Trial 238 finished with value: 0.7200000000000001 and parameters: {'objective': 'CrossEntropy', 'colsample_bylevel': 0.057914012778972616, 'depth': 3, 'boosting_type': 'Plain', 'bootstrap_type': 'Bernoulli', 'subsample': 0.8433892438175016}. Best is trial 106 with value: 0.7578947368421053.
[32m[I 2023-04-26 00:32:17,690][39m Trial 239 finished with value: 0.7096774193548387 and parameters: {'objective': 'CrossEntropy', 'colsample_bylevel': 0.07568198876154499, 'depth': 4, 'boosting_type': 'Plain', 'bootstrap_type': 'Bernoulli', 'subsample': 0.45839903164568674}. Best is trial 106 with value: 0.7578947368421053.
[32m[I 2023-04-26 00:32:22,411][39m Trial 240 finished with value: 0.7446808510638298 and parameters: {'objective': 'Logloss', 'colsample_bylevel': 0.0812507371921403, 'depth': 5, 'boosting_type': 'Ordered', 'bootstrap_type': 'Bernoulli', 'subsample': 0.4850344927009282}. Best is trial 106 with value: 0.7578947368421053.
[32m[I 2023-04-26 00:32:25,991][39m Trial 241 finished with value: 0.7446808510638298 and parameters: {'objective': 'CrossEntropy', 'colsample_bylevel': 0.06053930887190526, 'depth': 12, 'boosting_type': 'Ordered', 'bootstrap_type': 'Bernoulli', 'subsample': 0.5697529284341454}. Best is trial 106 with value: 0.7578947368421053.
[32m[I 2023-04-26 00:32:29,974][39m Trial 242 finished with value: 0.7526881720430108 and parameters: {'objective': 'CrossEntropy', 'colsample_bylevel': 0.06196420821495592, 'depth': 12, 'boosting_type': 'Ordered', 'bootstrap_type': 'Bernoulli', 'subsample': 0.43075652551965304}. Best is trial 106 with value: 0.7578947368421053.
[32m[I 2023-04-26 00:32:34,320][39m Trial 243 finished with value: 0.7291666666666666 and parameters: {'objective': 'CrossEntropy', 'colsample_bylevel': 0.06199005605981023, 'depth': 2, 'boosting_type': 'Ordered', 'bootstrap_type': 'Bernoulli', 'subsample': 0.40025043749733696}. Best is trial 106 with value: 0.7578947368421053.
[32m[I 2023-04-26 00:32:37,607][39m Trial 244 finished with value: 0.7368421052631579 and parameters: {'objective': 'CrossEntropy', 'colsample_bylevel': 0.05933767444546976, 'depth': 12, 'boosting_type': 'Ordered', 'bootstrap_type': 'Bernoulli', 'subsample': 0.44072398687769354}. Best is trial 106 with value: 0.7578947368421053.
[32m[I 2023-04-26 00:32:42,470][39m Trial 245 finished with value: 0.7216494845360826 and parameters: {'objective': 'CrossEntropy', 'colsample_bylevel': 0.056917115889241664, 'depth': 5, 'boosting_type': 'Ordered', 'bootstrap_type': 'Bernoulli', 'subsample': 0.4664334292810058}. Best is trial 106 with value: 0.7578947368421053.
[32m[I 2023-04-26 00:32:43,997][39m Trial 246 finished with value: 0.7333333333333334 and parameters: {'objective': 'CrossEntropy', 'colsample_bylevel': 0.0652125603292881, 'depth': 12, 'boosting_type': 'Plain', 'bootstrap_type': 'Bernoulli', 'subsample': 0.6487455795603505}. Best is trial 106 with value: 0.7578947368421053.
[32m[I 2023-04-26 00:32:48,389][39m Trial 247 finished with value: 0.717391304347826 and parameters: {'objective': 'CrossEntropy', 'colsample_bylevel': 0.08774544402197873, 'depth': 12, 'boosting_type': 'Ordered', 'bootstrap_type': 'Bernoulli', 'subsample': 0.4189811430226776}. Best is trial 106 with value: 0.7578947368421053.
[32m[I 2023-04-26 00:32:50,321][39m Trial 248 finished with value: 0.7346938775510203 and parameters: {'objective': 'CrossEntropy', 'colsample_bylevel': 0.0626228184074906, 'depth': 12, 'boosting_type': 'Plain', 'bootstrap_type': 'Bernoulli', 'subsample': 0.45138709486151934}. Best is trial 106 with value: 0.7578947368421053.
[32m[I 2023-04-26 00:32:55,130][39m Trial 249 finished with value: 0.7526881720430108 and parameters: {'objective': 'CrossEntropy', 'colsample_bylevel': 0.05997885227905597, 'depth': 5, 'boosting_type': 'Ordered', 'bootstrap_type': 'MVS'}. Best is trial 106 with value: 0.7578947368421053.
[32m[I 2023-04-26 00:32:56,617][39m Trial 250 finished with value: 0.7526881720430108 and parameters: {'objective': 'CrossEntropy', 'colsample_bylevel': 0.06004367539603554, 'depth': 5, 'boosting_type': 'Plain', 'bootstrap_type': 'Bernoulli', 'subsample': 0.5141385502503926}. Best is trial 106 with value: 0.7578947368421053.
[32m[I 2023-04-26 00:32:58,117][39m Trial 251 finished with value: 0.7422680412371134 and parameters: {'objective': 'CrossEntropy', 'colsample_bylevel': 0.06010611102788375, 'depth': 5, 'boosting_type': 'Plain', 'bootstrap_type': 'Bernoulli', 'subsample': 0.5190275465723214}. Best is trial 106 with value: 0.7578947368421053.
[32m[I 2023-04-26 00:33:02,166][39m Trial 252 finished with value: 0.7216494845360826 and parameters: {'objective': 'CrossEntropy', 'colsample_bylevel': 0.059324883617974215, 'depth': 5, 'boosting_type': 'Ordered', 'bootstrap_type': 'Bernoulli', 'subsample': 0.5023354269852291}. Best is trial 106 with value: 0.7578947368421053.
[32m[I 2023-04-26 00:33:03,537][39m Trial 253 finished with value: 0.7446808510638298 and parameters: {'objective': 'Logloss', 'colsample_bylevel': 0.057675374338553305, 'depth': 5, 'boosting_type': 'Plain', 'bootstrap_type': 'Bernoulli', 'subsample': 0.541713644290009}. Best is trial 106 with value: 0.7578947368421053.
[32m[I 2023-04-26 00:33:04,995][39m Trial 254 finished with value: 0.7216494845360826 and parameters: {'objective': 'CrossEntropy', 'colsample_bylevel': 0.05428510173722691, 'depth': 6, 'boosting_type': 'Plain', 'bootstrap_type': 'MVS'}. Best is trial 106 with value: 0.7578947368421053.
[32m[I 2023-04-26 00:33:09,084][39m Trial 255 finished with value: 0.6999999999999998 and parameters: {'objective': 'CrossEntropy', 'colsample_bylevel': 0.06146883122935114, 'depth': 4, 'boosting_type': 'Ordered', 'bootstrap_type': 'Bernoulli', 'subsample': 0.42070504640551265}. Best is trial 106 with value: 0.7578947368421053.
[32m[I 2023-04-26 00:33:13,620][39m Trial 256 finished with value: 0.7291666666666666 and parameters: {'objective': 'CrossEntropy', 'colsample_bylevel': 0.056017550728972104, 'depth': 6, 'boosting_type': 'Ordered', 'bootstrap_type': 'Bernoulli', 'subsample': 0.4894947240478968}. Best is trial 106 with value: 0.7578947368421053.
[32m[I 2023-04-26 00:33:15,072][39m Trial 257 finished with value: 0.7578947368421053 and parameters: {'objective': 'CrossEntropy', 'colsample_bylevel': 0.058350631189692526, 'depth': 5, 'boosting_type': 'Plain', 'bootstrap_type': 'Bernoulli', 'subsample': 0.47390074186886555}. Best is trial 106 with value: 0.7578947368421053.
[32m[I 2023-04-26 00:33:16,498][39m Trial 258 finished with value: 0.7446808510638298 and parameters: {'objective': 'CrossEntropy', 'colsample_bylevel': 0.05830693328598616, 'depth': 5, 'boosting_type': 'Plain', 'bootstrap_type': 'Bernoulli', 'subsample': 0.4829068341063955}. Best is trial 106 with value: 0.7578947368421053.
[32m[I 2023-04-26 00:33:17,959][39m Trial 259 finished with value: 0.7311827956989247 and parameters: {'objective': 'CrossEntropy', 'colsample_bylevel': 0.0597041437073112, 'depth': 5, 'boosting_type': 'Plain', 'bootstrap_type': 'Bernoulli', 'subsample': 0.46804775186125624}. Best is trial 106 with value: 0.7578947368421053.
[32m[I 2023-04-26 00:33:19,418][39m Trial 260 finished with value: 0.723404255319149 and parameters: {'objective': 'CrossEntropy', 'colsample_bylevel': 0.056376586967053416, 'depth': 5, 'boosting_type': 'Plain', 'bootstrap_type': 'Bernoulli', 'subsample': 0.5158068404300068}. Best is trial 106 with value: 0.7578947368421053.
[32m[I 2023-04-26 00:33:20,825][39m Trial 261 finished with value: 0.7216494845360826 and parameters: {'objective': 'CrossEntropy', 'colsample_bylevel': 0.05249933057347909, 'depth': 5, 'boosting_type': 'Plain', 'bootstrap_type': 'Bernoulli', 'subsample': 0.4396015094760896}. Best is trial 106 with value: 0.7578947368421053.
[32m[I 2023-04-26 00:33:22,450][39m Trial 262 finished with value: 0.7446808510638298 and parameters: {'objective': 'CrossEntropy', 'colsample_bylevel': 0.061299321116050166, 'depth': 5, 'boosting_type': 'Plain', 'bootstrap_type': 'Bernoulli', 'subsample': 0.5513700808812629}. Best is trial 106 with value: 0.7578947368421053.
[32m[I 2023-04-26 00:33:26,445][39m Trial 263 finished with value: 0.6999999999999998 and parameters: {'objective': 'CrossEntropy', 'colsample_bylevel': 0.05753083433752391, 'depth': 2, 'boosting_type': 'Ordered', 'bootstrap_type': 'Bernoulli', 'subsample': 0.45701689202791707}. Best is trial 106 with value: 0.7578947368421053.
[32m[I 2023-04-26 00:33:28,258][39m Trial 264 finished with value: 0.723404255319149 and parameters: {'objective': 'CrossEntropy', 'colsample_bylevel': 0.058805592603161476, 'depth': 6, 'boosting_type': 'Plain', 'bootstrap_type': 'Bayesian', 'bagging_temperature': 3.381094115870023}. Best is trial 106 with value: 0.7578947368421053.
[32m[I 2023-04-26 00:33:29,686][39m Trial 265 finished with value: 0.7446808510638298 and parameters: {'objective': 'CrossEntropy', 'colsample_bylevel': 0.05499857480249572, 'depth': 3, 'boosting_type': 'Plain', 'bootstrap_type': 'Bernoulli', 'subsample': 0.3699539724382779}. Best is trial 106 with value: 0.7578947368421053.
[32m[I 2023-04-26 00:33:33,565][39m Trial 266 finished with value: 0.7216494845360826 and parameters: {'objective': 'CrossEntropy', 'colsample_bylevel': 0.04871502648171545, 'depth': 5, 'boosting_type': 'Ordered', 'bootstrap_type': 'Bernoulli', 'subsample': 0.4750917066789497}. Best is trial 106 with value: 0.7578947368421053.
[32m[I 2023-04-26 00:33:35,270][39m Trial 267 finished with value: 0.7096774193548387 and parameters: {'objective': 'CrossEntropy', 'colsample_bylevel': 0.060601454004335274, 'depth': 6, 'boosting_type': 'Plain', 'bootstrap_type': 'Bernoulli', 'subsample': 0.40502787231074383}. Best is trial 106 with value: 0.7578947368421053.
[32m[I 2023-04-26 00:33:37,019][39m Trial 268 finished with value: 0.717391304347826 and parameters: {'objective': 'CrossEntropy', 'colsample_bylevel': 0.07818047528351806, 'depth': 5, 'boosting_type': 'Plain', 'bootstrap_type': 'Bernoulli', 'subsample': 0.5018661188731913}. Best is trial 106 with value: 0.7578947368421053.
[32m[I 2023-04-26 00:33:40,389][39m Trial 269 finished with value: 0.6792452830188679 and parameters: {'objective': 'CrossEntropy', 'colsample_bylevel': 0.057077546037838524, 'depth': 1, 'boosting_type': 'Ordered', 'bootstrap_type': 'Bernoulli', 'subsample': 0.4256516585502605}. Best is trial 106 with value: 0.7578947368421053.
