[32m[I 2023-04-26 00:33:42,965][39m Trial 270 finished with value: 0.7446808510638298 and parameters: {'objective': 'CrossEntropy', 'colsample_bylevel': 0.062322269347464036, 'depth': 4, 'boosting_type': 'Plain', 'bootstrap_type': 'Bernoulli', 'subsample': 0.4422298441599002}. Best is trial 106 with value: 0.7578947368421053.
[32m[I 2023-04-26 00:33:44,682][39m Trial 271 finished with value: 0.7446808510638298 and parameters: {'objective': 'CrossEntropy', 'colsample_bylevel': 0.0591172779258257, 'depth': 5, 'boosting_type': 'Plain', 'bootstrap_type': 'Bernoulli', 'subsample': 0.34915041291862436}. Best is trial 106 with value: 0.7578947368421053.
[32m[I 2023-04-26 00:33:48,755][39m Trial 272 finished with value: 0.7216494845360826 and parameters: {'objective': 'CrossEntropy', 'colsample_bylevel': 0.05346732184423159, 'depth': 5, 'boosting_type': 'Ordered', 'bootstrap_type': 'Bernoulli', 'subsample': 0.5334341847366345}. Best is trial 106 with value: 0.7578947368421053.
[32m[I 2023-04-26 00:33:50,306][39m Trial 273 finished with value: 0.7252747252747254 and parameters: {'objective': 'CrossEntropy', 'colsample_bylevel': 0.06045986191559924, 'depth': 6, 'boosting_type': 'Plain', 'bootstrap_type': 'Bernoulli', 'subsample': 0.45714534166941045}. Best is trial 106 with value: 0.7578947368421053.
[32m[I 2023-04-26 00:33:51,732][39m Trial 274 finished with value: 0.7216494845360826 and parameters: {'objective': 'CrossEntropy', 'colsample_bylevel': 0.05572473276484691, 'depth': 4, 'boosting_type': 'Plain', 'bootstrap_type': 'Bernoulli', 'subsample': 0.49018316405937634}. Best is trial 106 with value: 0.7578947368421053.
[32m[I 2023-04-26 00:33:55,552][39m Trial 275 finished with value: 0.7446808510638298 and parameters: {'objective': 'CrossEntropy', 'colsample_bylevel': 0.058015845002024724, 'depth': 4, 'boosting_type': 'Ordered', 'bootstrap_type': 'Bernoulli', 'subsample': 0.5707278440432614}. Best is trial 106 with value: 0.7578947368421053.
[32m[I 2023-04-26 00:33:57,688][39m Trial 276 finished with value: 0.7368421052631579 and parameters: {'objective': 'CrossEntropy', 'colsample_bylevel': 0.06194168034882238, 'depth': 5, 'boosting_type': 'Plain', 'bootstrap_type': 'Bernoulli', 'subsample': 0.475440381588502}. Best is trial 106 with value: 0.7578947368421053.
[32m[I 2023-04-26 00:33:59,080][39m Trial 277 finished with value: 0.7446808510638298 and parameters: {'objective': 'CrossEntropy', 'colsample_bylevel': 0.06321542917202308, 'depth': 5, 'boosting_type': 'Plain', 'bootstrap_type': 'Bernoulli', 'subsample': 0.39647034488382066}. Best is trial 106 with value: 0.7578947368421053.
[32m[I 2023-04-26 00:34:04,094][39m Trial 278 finished with value: 0.7578947368421053 and parameters: {'objective': 'CrossEntropy', 'colsample_bylevel': 0.05942016060422152, 'depth': 6, 'boosting_type': 'Ordered', 'bootstrap_type': 'Bernoulli', 'subsample': 0.5163639110426581}. Best is trial 106 with value: 0.7578947368421053.
[32m[I 2023-04-26 00:34:05,534][39m Trial 279 finished with value: 0.7096774193548387 and parameters: {'objective': 'CrossEntropy', 'colsample_bylevel': 0.05938420462620966, 'depth': 6, 'boosting_type': 'Plain', 'bootstrap_type': 'Bernoulli', 'subsample': 0.5220410944075189}. Best is trial 106 with value: 0.7578947368421053.
[32m[I 2023-04-26 00:34:09,630][39m Trial 280 finished with value: 0.7291666666666666 and parameters: {'objective': 'CrossEntropy', 'colsample_bylevel': 0.06647898233079491, 'depth': 6, 'boosting_type': 'Ordered', 'bootstrap_type': 'Bernoulli', 'subsample': 0.5066366708572623}. Best is trial 106 with value: 0.7578947368421053.
[32m[I 2023-04-26 00:34:15,688][39m Trial 281 finished with value: 0.717391304347826 and parameters: {'objective': 'CrossEntropy', 'colsample_bylevel': 0.09311662144630425, 'depth': 6, 'boosting_type': 'Ordered', 'bootstrap_type': 'Bernoulli', 'subsample': 0.594628375258145}. Best is trial 106 with value: 0.7578947368421053.
[32m[I 2023-04-26 00:34:17,151][39m Trial 282 finished with value: 0.7096774193548387 and parameters: {'objective': 'CrossEntropy', 'colsample_bylevel': 0.05694341235118133, 'depth': 6, 'boosting_type': 'Plain', 'bootstrap_type': 'Bernoulli', 'subsample': 0.541823856820938}. Best is trial 106 with value: 0.7578947368421053.
[32m[I 2023-04-26 00:34:18,785][39m Trial 283 finished with value: 0.717391304347826 and parameters: {'objective': 'CrossEntropy', 'colsample_bylevel': 0.06082815705535525, 'depth': 7, 'boosting_type': 'Plain', 'bootstrap_type': 'Bernoulli', 'subsample': 0.43469778099848416}. Best is trial 106 with value: 0.7578947368421053.
[32m[I 2023-04-26 00:34:22,869][39m Trial 284 finished with value: 0.7446808510638298 and parameters: {'objective': 'CrossEntropy', 'colsample_bylevel': 0.0632170889834789, 'depth': 5, 'boosting_type': 'Ordered', 'bootstrap_type': 'Bernoulli', 'subsample': 0.5629545367631227}. Best is trial 106 with value: 0.7578947368421053.
[32m[I 2023-04-26 00:34:26,161][39m Trial 285 finished with value: 0.7216494845360826 and parameters: {'objective': 'CrossEntropy', 'colsample_bylevel': 0.06512544028545376, 'depth': 2, 'boosting_type': 'Ordered', 'bootstrap_type': 'Bernoulli', 'subsample': 0.4534239776555514}. Best is trial 106 with value: 0.7578947368421053.
[32m[I 2023-04-26 00:34:31,612][39m Trial 286 finished with value: 0.7200000000000001 and parameters: {'objective': 'CrossEntropy', 'colsample_bylevel': 0.058647419116298574, 'depth': 6, 'boosting_type': 'Ordered', 'bootstrap_type': 'Bayesian', 'bagging_temperature': 7.889714879695385}. Best is trial 106 with value: 0.7578947368421053.
[32m[I 2023-04-26 00:34:33,066][39m Trial 287 finished with value: 0.7368421052631579 and parameters: {'objective': 'CrossEntropy', 'colsample_bylevel': 0.05470945861551907, 'depth': 5, 'boosting_type': 'Plain', 'bootstrap_type': 'Bernoulli', 'subsample': 0.48974756019631693}. Best is trial 106 with value: 0.7578947368421053.
[32m[I 2023-04-26 00:34:37,171][39m Trial 288 finished with value: 0.7070707070707071 and parameters: {'objective': 'CrossEntropy', 'colsample_bylevel': 0.0566021682982368, 'depth': 3, 'boosting_type': 'Ordered', 'bootstrap_type': 'Bernoulli', 'subsample': 0.5201230023052658}. Best is trial 106 with value: 0.7578947368421053.
[32m[I 2023-04-26 00:34:38,830][39m Trial 289 finished with value: 0.7368421052631579 and parameters: {'objective': 'CrossEntropy', 'colsample_bylevel': 0.060904543778068955, 'depth': 7, 'boosting_type': 'Plain', 'bootstrap_type': 'Bernoulli', 'subsample': 0.4691034104744933}. Best is trial 106 with value: 0.7578947368421053.
[32m[I 2023-04-26 00:34:42,440][39m Trial 290 finished with value: 0.7422680412371134 and parameters: {'objective': 'CrossEntropy', 'colsample_bylevel': 0.06191819994825984, 'depth': 12, 'boosting_type': 'Ordered', 'bootstrap_type': 'Bernoulli', 'subsample': 0.42713118161790115}. Best is trial 106 with value: 0.7578947368421053.
[32m[I 2023-04-26 00:34:46,929][39m Trial 291 finished with value: 0.6915887850467289 and parameters: {'objective': 'CrossEntropy', 'colsample_bylevel': 0.023474272164464238, 'depth': 6, 'boosting_type': 'Ordered', 'bootstrap_type': 'Bernoulli', 'subsample': 0.3791342054210035}. Best is trial 106 with value: 0.7578947368421053.
[32m[I 2023-04-26 00:34:48,319][39m Trial 292 finished with value: 0.7446808510638298 and parameters: {'objective': 'CrossEntropy', 'colsample_bylevel': 0.05970654155676431, 'depth': 5, 'boosting_type': 'Plain', 'bootstrap_type': 'Bernoulli', 'subsample': 0.4985431784961855}. Best is trial 106 with value: 0.7578947368421053.
[32m[I 2023-04-26 00:34:52,344][39m Trial 293 finished with value: 0.6999999999999998 and parameters: {'objective': 'CrossEntropy', 'colsample_bylevel': 0.05054543108521898, 'depth': 12, 'boosting_type': 'Ordered', 'bootstrap_type': 'Bernoulli', 'subsample': 0.443682583902325}. Best is trial 106 with value: 0.7578947368421053.
[32m[I 2023-04-26 00:34:56,608][39m Trial 294 finished with value: 0.7446808510638298 and parameters: {'objective': 'CrossEntropy', 'colsample_bylevel': 0.058357708748660454, 'depth': 5, 'boosting_type': 'Ordered', 'bootstrap_type': 'Bernoulli', 'subsample': 0.6193031033034228}. Best is trial 106 with value: 0.7578947368421053.
[32m[I 2023-04-26 00:35:00,230][39m Trial 295 finished with value: 0.7216494845360826 and parameters: {'objective': 'Logloss', 'colsample_bylevel': 0.053356017166820216, 'depth': 4, 'boosting_type': 'Ordered', 'bootstrap_type': 'Bernoulli', 'subsample': 0.5516152496061082}. Best is trial 106 with value: 0.7578947368421053.
[32m[I 2023-04-26 00:35:02,026][39m Trial 296 finished with value: 0.7446808510638298 and parameters: {'objective': 'CrossEntropy', 'colsample_bylevel': 0.06451384456606685, 'depth': 5, 'boosting_type': 'Plain', 'bootstrap_type': 'Bernoulli', 'subsample': 0.47534509274242437}. Best is trial 106 with value: 0.7578947368421053.
[32m[I 2023-04-26 00:35:03,690][39m Trial 297 finished with value: 0.7252747252747254 and parameters: {'objective': 'CrossEntropy', 'colsample_bylevel': 0.06933735996951841, 'depth': 6, 'boosting_type': 'Plain', 'bootstrap_type': 'Bernoulli', 'subsample': 0.5093490832276976}. Best is trial 106 with value: 0.7578947368421053.
[32m[I 2023-04-26 00:35:05,099][39m Trial 298 finished with value: 0.7446808510638298 and parameters: {'objective': 'CrossEntropy', 'colsample_bylevel': 0.05533758524032645, 'depth': 5, 'boosting_type': 'Plain', 'bootstrap_type': 'Bernoulli', 'subsample': 0.5240604177264105}. Best is trial 106 with value: 0.7578947368421053.
[32m[I 2023-04-26 00:35:06,558][39m Trial 299 finished with value: 0.7446808510638298 and parameters: {'objective': 'CrossEntropy', 'colsample_bylevel': 0.05809862040921518, 'depth': 5, 'boosting_type': 'Plain', 'bootstrap_type': 'Bernoulli', 'subsample': 0.41049607820943074}. Best is trial 106 with value: 0.7578947368421053.
[32m[I 2023-04-26 00:35:10,701][39m Trial 300 finished with value: 0.7216494845360826 and parameters: {'objective': 'CrossEntropy', 'colsample_bylevel': 0.06677168003196217, 'depth': 11, 'boosting_type': 'Ordered', 'bootstrap_type': 'Bernoulli', 'subsample': 0.41342755987066504}. Best is trial 106 with value: 0.7578947368421053.
[32m[I 2023-04-26 00:35:14,778][39m Trial 301 finished with value: 0.7368421052631579 and parameters: {'objective': 'CrossEntropy', 'colsample_bylevel': 0.0632644918774199, 'depth': 12, 'boosting_type': 'Ordered', 'bootstrap_type': 'Bernoulli', 'subsample': 0.45429344855538617}. Best is trial 106 with value: 0.7578947368421053.
[32m[I 2023-04-26 00:35:18,608][39m Trial 302 finished with value: 0.7291666666666666 and parameters: {'objective': 'Logloss', 'colsample_bylevel': 0.06010980888647915, 'depth': 12, 'boosting_type': 'Ordered', 'bootstrap_type': 'Bernoulli', 'subsample': 0.3334158347547478}. Best is trial 106 with value: 0.7578947368421053.
[32m[I 2023-04-26 00:35:23,228][39m Trial 303 finished with value: 0.7142857142857142 and parameters: {'objective': 'CrossEntropy', 'colsample_bylevel': 0.056790061701810765, 'depth': 6, 'boosting_type': 'Ordered', 'bootstrap_type': 'Bernoulli', 'subsample': 0.5806733888746257}. Best is trial 106 with value: 0.7578947368421053.
[32m[I 2023-04-26 00:35:24,666][39m Trial 304 finished with value: 0.7291666666666666 and parameters: {'objective': 'CrossEntropy', 'colsample_bylevel': 0.061525423060646525, 'depth': 5, 'boosting_type': 'Plain', 'bootstrap_type': 'Bernoulli', 'subsample': 0.4851502505707952}. Best is trial 106 with value: 0.7578947368421053.
[32m[I 2023-04-26 00:35:26,083][39m Trial 305 finished with value: 0.7446808510638298 and parameters: {'objective': 'CrossEntropy', 'colsample_bylevel': 0.059232424001142106, 'depth': 3, 'boosting_type': 'Plain', 'bootstrap_type': 'Bernoulli', 'subsample': 0.3943051484989273}. Best is trial 106 with value: 0.7578947368421053.
[32m[I 2023-04-26 00:35:28,465][39m Trial 306 finished with value: 0.717391304347826 and parameters: {'objective': 'CrossEntropy', 'colsample_bylevel': 0.06440829171108428, 'depth': 4, 'boosting_type': 'Plain', 'bootstrap_type': 'Bernoulli', 'subsample': 0.42772709223227207}. Best is trial 106 with value: 0.7578947368421053.
[32m[I 2023-04-26 00:35:29,801][39m Trial 307 finished with value: 0.7446808510638298 and parameters: {'objective': 'CrossEntropy', 'colsample_bylevel': 0.05476850400037843, 'depth': 6, 'boosting_type': 'Plain', 'bootstrap_type': 'Bernoulli', 'subsample': 0.46998320580824}. Best is trial 106 with value: 0.7578947368421053.
[32m[I 2023-04-26 00:35:33,763][39m Trial 308 finished with value: 0.7291666666666666 and parameters: {'objective': 'CrossEntropy', 'colsample_bylevel': 0.06160137418035922, 'depth': 12, 'boosting_type': 'Ordered', 'bootstrap_type': 'Bernoulli', 'subsample': 0.4462931856498906}. Best is trial 106 with value: 0.7578947368421053.
[32m[I 2023-04-26 00:35:35,638][39m Trial 309 finished with value: 0.7216494845360826 and parameters: {'objective': 'CrossEntropy', 'colsample_bylevel': 0.057445086341829786, 'depth': 12, 'boosting_type': 'Plain', 'bootstrap_type': 'Bernoulli', 'subsample': 0.5358792055796971}. Best is trial 106 with value: 0.7578947368421053.
[32m[I 2023-04-26 00:35:39,097][39m Trial 310 finished with value: 0.6788990825688074 and parameters: {'objective': 'Logloss', 'colsample_bylevel': 0.0593187774864112, 'depth': 1, 'boosting_type': 'Ordered', 'bootstrap_type': 'Bayesian', 'bagging_temperature': 5.175214686598887}. Best is trial 106 with value: 0.7578947368421053.
[32m[I 2023-04-26 00:35:43,308][39m Trial 311 finished with value: 0.7526881720430108 and parameters: {'objective': 'CrossEntropy', 'colsample_bylevel': 0.06250386126279724, 'depth': 12, 'boosting_type': 'Ordered', 'bootstrap_type': 'Bernoulli', 'subsample': 0.30015199356624495}. Best is trial 106 with value: 0.7578947368421053.
[32m[I 2023-04-26 00:35:44,945][39m Trial 312 finished with value: 0.717391304347826 and parameters: {'objective': 'CrossEntropy', 'colsample_bylevel': 0.07265990907894344, 'depth': 5, 'boosting_type': 'Plain', 'bootstrap_type': 'Bernoulli', 'subsample': 0.8826380010867316}. Best is trial 106 with value: 0.7578947368421053.
[32m[I 2023-04-26 00:35:46,641][39m Trial 313 finished with value: 0.7446808510638298 and parameters: {'objective': 'CrossEntropy', 'colsample_bylevel': 0.0667887136944184, 'depth': 6, 'boosting_type': 'Plain', 'bootstrap_type': 'Bernoulli', 'subsample': 0.2249704470443487}. Best is trial 106 with value: 0.7578947368421053.
[32m[I 2023-04-26 00:35:50,479][39m Trial 314 finished with value: 0.7446808510638298 and parameters: {'objective': 'CrossEntropy', 'colsample_bylevel': 0.06346325178283763, 'depth': 12, 'boosting_type': 'Ordered', 'bootstrap_type': 'Bernoulli', 'subsample': 0.23955197092856262}. Best is trial 106 with value: 0.7578947368421053.
[32m[I 2023-04-26 00:35:52,129][39m Trial 315 finished with value: 0.7368421052631579 and parameters: {'objective': 'CrossEntropy', 'colsample_bylevel': 0.0652458396991027, 'depth': 12, 'boosting_type': 'Plain', 'bootstrap_type': 'Bernoulli', 'subsample': 0.2966289760453707}. Best is trial 106 with value: 0.7578947368421053.
[32m[I 2023-04-26 00:35:55,843][39m Trial 316 finished with value: 0.7346938775510203 and parameters: {'objective': 'CrossEntropy', 'colsample_bylevel': 0.06113155520899961, 'depth': 12, 'boosting_type': 'Ordered', 'bootstrap_type': 'MVS'}. Best is trial 106 with value: 0.7578947368421053.
[32m[I 2023-04-26 00:36:00,180][39m Trial 317 finished with value: 0.7252747252747254 and parameters: {'objective': 'CrossEntropy', 'colsample_bylevel': 0.06267179526250469, 'depth': 11, 'boosting_type': 'Ordered', 'bootstrap_type': 'Bernoulli', 'subsample': 0.3515346991434795}. Best is trial 106 with value: 0.7578947368421053.
[32m[I 2023-04-26 00:36:04,305][39m Trial 318 finished with value: 0.7368421052631579 and parameters: {'objective': 'CrossEntropy', 'colsample_bylevel': 0.06267828979649448, 'depth': 12, 'boosting_type': 'Ordered', 'bootstrap_type': 'Bernoulli', 'subsample': 0.3683618234395725}. Best is trial 106 with value: 0.7578947368421053.
[32m[I 2023-04-26 00:36:06,200][39m Trial 319 finished with value: 0.7200000000000001 and parameters: {'objective': 'Logloss', 'colsample_bylevel': 0.056022218285445194, 'depth': 7, 'boosting_type': 'Plain', 'bootstrap_type': 'Bernoulli', 'subsample': 0.2780696853111395}. Best is trial 106 with value: 0.7578947368421053.
[32m[I 2023-04-26 00:36:07,616][39m Trial 320 finished with value: 0.7311827956989247 and parameters: {'objective': 'CrossEntropy', 'colsample_bylevel': 0.060029654982148385, 'depth': 5, 'boosting_type': 'Plain', 'bootstrap_type': 'Bernoulli', 'subsample': 0.4574642822844347}. Best is trial 106 with value: 0.7578947368421053.
[32m[I 2023-04-26 00:36:09,070][39m Trial 321 finished with value: 0.7070707070707071 and parameters: {'objective': 'CrossEntropy', 'colsample_bylevel': 0.032381567033515773, 'depth': 2, 'boosting_type': 'Plain', 'bootstrap_type': 'Bernoulli', 'subsample': 0.5520284421609403}. Best is trial 106 with value: 0.7578947368421053.
[32m[I 2023-04-26 00:36:11,716][39m Trial 322 finished with value: 0.7252747252747254 and parameters: {'objective': 'CrossEntropy', 'colsample_bylevel': 0.06789763729215519, 'depth': 5, 'boosting_type': 'Plain', 'bootstrap_type': 'Bernoulli', 'subsample': 0.6366247809458268}. Best is trial 106 with value: 0.7578947368421053.
[32m[I 2023-04-26 00:36:13,349][39m Trial 323 finished with value: 0.7446808510638298 and parameters: {'objective': 'CrossEntropy', 'colsample_bylevel': 0.05263059496544773, 'depth': 8, 'boosting_type': 'Plain', 'bootstrap_type': 'Bernoulli', 'subsample': 0.48557398604539337}. Best is trial 106 with value: 0.7578947368421053.
[32m[I 2023-04-26 00:36:14,815][39m Trial 324 finished with value: 0.6999999999999998 and parameters: {'objective': 'CrossEntropy', 'colsample_bylevel': 0.056391852869234455, 'depth': 6, 'boosting_type': 'Plain', 'bootstrap_type': 'Bernoulli', 'subsample': 0.5040167783809869}. Best is trial 106 with value: 0.7578947368421053.
[32m[I 2023-04-26 00:36:16,271][39m Trial 325 finished with value: 0.7446808510638298 and parameters: {'objective': 'CrossEntropy', 'colsample_bylevel': 0.05834782548842522, 'depth': 4, 'boosting_type': 'Plain', 'bootstrap_type': 'Bernoulli', 'subsample': 0.4266239690254894}. Best is trial 106 with value: 0.7578947368421053.
[32m[I 2023-04-26 00:36:20,154][39m Trial 326 finished with value: 0.7446808510638298 and parameters: {'objective': 'CrossEntropy', 'colsample_bylevel': 0.06495767577671181, 'depth': 12, 'boosting_type': 'Ordered', 'bootstrap_type': 'Bernoulli', 'subsample': 0.39014236341944697}. Best is trial 106 with value: 0.7578947368421053.
[32m[I 2023-04-26 00:36:23,845][39m Trial 327 finished with value: 0.7216494845360826 and parameters: {'objective': 'CrossEntropy', 'colsample_bylevel': 0.06202045231930136, 'depth': 12, 'boosting_type': 'Ordered', 'bootstrap_type': 'Bayesian', 'bagging_temperature': 3.293758563908187}. Best is trial 106 with value: 0.7578947368421053.
[32m[I 2023-04-26 00:36:25,704][39m Trial 328 finished with value: 0.7499999999999999 and parameters: {'objective': 'Logloss', 'colsample_bylevel': 0.057984258990326804, 'depth': 6, 'boosting_type': 'Plain', 'bootstrap_type': 'Bernoulli', 'subsample': 0.4487708583649187}. Best is trial 106 with value: 0.7578947368421053.
[32m[I 2023-04-26 00:36:28,526][39m Trial 329 finished with value: 0.717391304347826 and parameters: {'objective': 'CrossEntropy', 'colsample_bylevel': 0.06059652807012706, 'depth': 9, 'boosting_type': 'Plain', 'bootstrap_type': 'MVS'}. Best is trial 106 with value: 0.7578947368421053.
[32m[I 2023-04-26 00:36:31,654][39m Trial 330 finished with value: 0.7446808510638298 and parameters: {'objective': 'CrossEntropy', 'colsample_bylevel': 0.06356621730459837, 'depth': 3, 'boosting_type': 'Ordered', 'bootstrap_type': 'Bernoulli', 'subsample': 0.3099241143677644}. Best is trial 106 with value: 0.7578947368421053.
[32m[I 2023-04-26 00:36:33,821][39m Trial 331 finished with value: 0.7311827956989247 and parameters: {'objective': 'CrossEntropy', 'colsample_bylevel': 0.054029788795943695, 'depth': 11, 'boosting_type': 'Plain', 'bootstrap_type': 'Bernoulli', 'subsample': 0.4312745707761778}. Best is trial 106 with value: 0.7578947368421053.
[32m[I 2023-04-26 00:36:35,780][39m Trial 332 finished with value: 0.7446808510638298 and parameters: {'objective': 'CrossEntropy', 'colsample_bylevel': 0.05900596811772338, 'depth': 5, 'boosting_type': 'Plain', 'bootstrap_type': 'Bernoulli', 'subsample': 0.47035884451203974}. Best is trial 106 with value: 0.7578947368421053.
[32m[I 2023-04-26 00:36:39,019][39m Trial 333 finished with value: 0.7446808510638298 and parameters: {'objective': 'CrossEntropy', 'colsample_bylevel': 0.06133856448397136, 'depth': 12, 'boosting_type': 'Ordered', 'bootstrap_type': 'Bernoulli', 'subsample': 0.46376350314525655}. Best is trial 106 with value: 0.7578947368421053.
[32m[I 2023-04-26 00:36:41,805][39m Trial 334 finished with value: 0.723404255319149 and parameters: {'objective': 'CrossEntropy', 'colsample_bylevel': 0.06811037296811638, 'depth': 5, 'boosting_type': 'Plain', 'bootstrap_type': 'Bernoulli', 'subsample': 0.48919364699734913}. Best is trial 106 with value: 0.7578947368421053.
[32m[I 2023-04-26 00:36:43,340][39m Trial 335 finished with value: 0.7311827956989247 and parameters: {'objective': 'CrossEntropy', 'colsample_bylevel': 0.06028051476849807, 'depth': 4, 'boosting_type': 'Plain', 'bootstrap_type': 'Bernoulli', 'subsample': 0.6721210379298334}. Best is trial 106 with value: 0.7578947368421053.
