[32m[I 2023-04-26 02:19:39,093][39m Trial 73 finished with value: 0.8148148148148149 and parameters: {'criterion': 'entropy', 'n_estimators': 184, 'max_features': 0.8900548349219694, 'max_depth': 74, 'min_samples_split': 4, 'min_samples_leaf': 2}. Best is trial 61 with value: 0.8604651162790697.
[32m[I 2023-04-26 02:19:39,306][39m Trial 74 finished with value: 0.8275862068965518 and parameters: {'criterion': 'entropy', 'n_estimators': 163, 'max_features': 0.9183310917007448, 'max_depth': 57, 'min_samples_split': 3, 'min_samples_leaf': 4}. Best is trial 61 with value: 0.8604651162790697.
[32m[I 2023-04-26 02:19:39,502][39m Trial 75 finished with value: 0.7777777777777778 and parameters: {'criterion': 'entropy', 'n_estimators': 170, 'max_features': 0.759796544935737, 'max_depth': 101, 'min_samples_split': 5, 'min_samples_leaf': 8}. Best is trial 61 with value: 0.8604651162790697.
[32m[I 2023-04-26 02:19:39,725][39m Trial 76 finished with value: 0.8470588235294119 and parameters: {'criterion': 'entropy', 'n_estimators': 176, 'max_features': 0.8046066003710685, 'max_depth': 50, 'min_samples_split': 4, 'min_samples_leaf': 3}. Best is trial 61 with value: 0.8604651162790697.
[32m[I 2023-04-26 02:19:39,863][39m Trial 77 finished with value: 0.8192771084337348 and parameters: {'criterion': 'entropy', 'n_estimators': 110, 'max_features': 0.7044849308817496, 'max_depth': 50, 'min_samples_split': 6, 'min_samples_leaf': 3}. Best is trial 61 with value: 0.8604651162790697.
[32m[I 2023-04-26 02:19:40,055][39m Trial 78 finished with value: 0.8235294117647058 and parameters: {'criterion': 'entropy', 'n_estimators': 178, 'max_features': 0.5333178879795264, 'max_depth': 47, 'min_samples_split': 3, 'min_samples_leaf': 4}. Best is trial 61 with value: 0.8604651162790697.
[32m[I 2023-04-26 02:19:40,206][39m Trial 79 finished with value: 0.8275862068965518 and parameters: {'criterion': 'gini', 'n_estimators': 140, 'max_features': 0.8076628133839169, 'max_depth': 32, 'min_samples_split': 2, 'min_samples_leaf': 4}. Best is trial 61 with value: 0.8604651162790697.
[32m[I 2023-04-26 02:19:40,346][39m Trial 80 finished with value: 0.8433734939759037 and parameters: {'criterion': 'entropy', 'n_estimators': 120, 'max_features': 0.5880896443850794, 'max_depth': 36, 'min_samples_split': 4, 'min_samples_leaf': 3}. Best is trial 61 with value: 0.8604651162790697.
[32m[I 2023-04-26 02:19:40,578][39m Trial 81 finished with value: 0.8148148148148149 and parameters: {'criterion': 'entropy', 'n_estimators': 174, 'max_features': 0.8418629464321191, 'max_depth': 54, 'min_samples_split': 4, 'min_samples_leaf': 2}. Best is trial 61 with value: 0.8604651162790697.
[32m[I 2023-04-26 02:19:40,801][39m Trial 82 finished with value: 0.8292682926829268 and parameters: {'criterion': 'entropy', 'n_estimators': 182, 'max_features': 0.7352552754550601, 'max_depth': 41, 'min_samples_split': 5, 'min_samples_leaf': 2}. Best is trial 61 with value: 0.8604651162790697.
[32m[I 2023-04-26 02:19:40,904][39m Trial 83 finished with value: 0.8148148148148149 and parameters: {'criterion': 'entropy', 'n_estimators': 91, 'max_features': 0.5881332844444005, 'max_depth': 35, 'min_samples_split': 4, 'min_samples_leaf': 3}. Best is trial 61 with value: 0.8604651162790697.
[32m[I 2023-04-26 02:19:41,025][39m Trial 84 finished with value: 0.8192771084337348 and parameters: {'criterion': 'entropy', 'n_estimators': 99, 'max_features': 0.6864075561213785, 'max_depth': 26, 'min_samples_split': 3, 'min_samples_leaf': 3}. Best is trial 61 with value: 0.8604651162790697.
[32m[I 2023-04-26 02:19:41,158][39m Trial 85 finished with value: 0.8275862068965518 and parameters: {'criterion': 'entropy', 'n_estimators': 117, 'max_features': 0.6281022885836398, 'max_depth': 36, 'min_samples_split': 5, 'min_samples_leaf': 5}. Best is trial 61 with value: 0.8604651162790697.
[32m[I 2023-04-26 02:19:41,287][39m Trial 86 finished with value: 0.8333333333333333 and parameters: {'criterion': 'entropy', 'n_estimators': 127, 'max_features': 0.4950839679739897, 'max_depth': 29, 'min_samples_split': 4, 'min_samples_leaf': 4}. Best is trial 61 with value: 0.8604651162790697.
[32m[I 2023-04-26 02:19:41,433][39m Trial 87 finished with value: 0.8470588235294119 and parameters: {'criterion': 'entropy', 'n_estimators': 121, 'max_features': 0.6667392029398626, 'max_depth': 43, 'min_samples_split': 3, 'min_samples_leaf': 3}. Best is trial 61 with value: 0.8604651162790697.
[32m[I 2023-04-26 02:19:41,573][39m Trial 88 finished with value: 0.8250000000000001 and parameters: {'criterion': 'entropy', 'n_estimators': 108, 'max_features': 0.7606659862694458, 'max_depth': 48, 'min_samples_split': 2, 'min_samples_leaf': 2}. Best is trial 61 with value: 0.8604651162790697.
[32m[I 2023-04-26 02:19:41,761][39m Trial 89 finished with value: 0.8 and parameters: {'criterion': 'entropy', 'n_estimators': 134, 'max_features': 0.8731633320966179, 'max_depth': 97, 'min_samples_split': 3, 'min_samples_leaf': 1}. Best is trial 61 with value: 0.8604651162790697.
[32m[I 2023-04-26 02:19:41,824][39m Trial 90 finished with value: 0.7555555555555555 and parameters: {'criterion': 'gini', 'n_estimators': 73, 'max_features': 0.2464089294861877, 'max_depth': 43, 'min_samples_split': 2, 'min_samples_leaf': 11}. Best is trial 61 with value: 0.8604651162790697.
[32m[I 2023-04-26 02:19:42,010][39m Trial 91 finished with value: 0.8292682926829268 and parameters: {'criterion': 'entropy', 'n_estimators': 164, 'max_features': 0.6501222349229929, 'max_depth': 45, 'min_samples_split': 3, 'min_samples_leaf': 2}. Best is trial 61 with value: 0.8604651162790697.
[32m[I 2023-04-26 02:19:42,085][39m Trial 92 finished with value: 0.8148148148148149 and parameters: {'criterion': 'entropy', 'n_estimators': 58, 'max_features': 0.588790172872652, 'max_depth': 40, 'min_samples_split': 4, 'min_samples_leaf': 3}. Best is trial 61 with value: 0.8604651162790697.
[32m[I 2023-04-26 02:19:42,287][39m Trial 93 finished with value: 0.8505747126436782 and parameters: {'criterion': 'entropy', 'n_estimators': 157, 'max_features': 0.9444435126335863, 'max_depth': 67, 'min_samples_split': 2, 'min_samples_leaf': 4}. Best is trial 61 with value: 0.8604651162790697.
[32m[I 2023-04-26 02:19:42,501][39m Trial 94 finished with value: 0.8314606741573034 and parameters: {'criterion': 'entropy', 'n_estimators': 158, 'max_features': 0.9137026755036234, 'max_depth': 85, 'min_samples_split': 2, 'min_samples_leaf': 4}. Best is trial 61 with value: 0.8604651162790697.
[32m[I 2023-04-26 02:19:42,727][39m Trial 95 finished with value: 0.8089887640449439 and parameters: {'criterion': 'entropy', 'n_estimators': 170, 'max_features': 0.9715011488540762, 'max_depth': 51, 'min_samples_split': 2, 'min_samples_leaf': 4}. Best is trial 61 with value: 0.8604651162790697.
[32m[I 2023-04-26 02:19:42,926][39m Trial 96 finished with value: 0.8314606741573034 and parameters: {'criterion': 'entropy', 'n_estimators': 151, 'max_features': 0.9531311341819217, 'max_depth': 91, 'min_samples_split': 2, 'min_samples_leaf': 5}. Best is trial 61 with value: 0.8604651162790697.
[32m[I 2023-04-26 02:19:43,140][39m Trial 97 finished with value: 0.8275862068965518 and parameters: {'criterion': 'entropy', 'n_estimators': 156, 'max_features': 0.8990743344357696, 'max_depth': 61, 'min_samples_split': 3, 'min_samples_leaf': 3}. Best is trial 61 with value: 0.8604651162790697.
[32m[I 2023-04-26 02:19:43,355][39m Trial 98 finished with value: 0.8372093023255814 and parameters: {'criterion': 'entropy', 'n_estimators': 187, 'max_features': 0.6788850375850881, 'max_depth': 56, 'min_samples_split': 2, 'min_samples_leaf': 4}. Best is trial 61 with value: 0.8604651162790697.
[32m[I 2023-04-26 02:19:43,428][39m Trial 99 finished with value: 0.8045977011494252 and parameters: {'criterion': 'entropy', 'n_estimators': 51, 'max_features': 0.786077848389511, 'max_depth': 66, 'min_samples_split': 3, 'min_samples_leaf': 5}. Best is trial 61 with value: 0.8604651162790697.
[32m[I 2023-04-26 02:19:43,639][39m Trial 100 finished with value: 0.8048780487804877 and parameters: {'criterion': 'entropy', 'n_estimators': 149, 'max_features': 0.937993212630581, 'max_depth': 51, 'min_samples_split': 2, 'min_samples_leaf': 2}. Best is trial 61 with value: 0.8604651162790697.
[32m[I 2023-04-26 02:19:43,848][39m Trial 101 finished with value: 0.810126582278481 and parameters: {'criterion': 'entropy', 'n_estimators': 161, 'max_features': 0.8153908329240978, 'max_depth': 44, 'min_samples_split': 5, 'min_samples_leaf': 1}. Best is trial 61 with value: 0.8604651162790697.
[32m[I 2023-04-26 02:19:44,083][39m Trial 102 finished with value: 0.7901234567901235 and parameters: {'criterion': 'entropy', 'n_estimators': 178, 'max_features': 0.860431417173945, 'max_depth': 76, 'min_samples_split': 4, 'min_samples_leaf': 2}. Best is trial 61 with value: 0.8604651162790697.
[32m[I 2023-04-26 02:19:44,298][39m Trial 103 finished with value: 0.8333333333333333 and parameters: {'criterion': 'entropy', 'n_estimators': 169, 'max_features': 0.8338826518844745, 'max_depth': 82, 'min_samples_split': 3, 'min_samples_leaf': 3}. Best is trial 61 with value: 0.8604651162790697.
[32m[I 2023-04-26 02:19:44,502][39m Trial 104 finished with value: 0.7848101265822786 and parameters: {'criterion': 'entropy', 'n_estimators': 166, 'max_features': 0.7192780000688279, 'max_depth': 70, 'min_samples_split': 5, 'min_samples_leaf': 1}. Best is trial 61 with value: 0.8604651162790697.
[32m[I 2023-04-26 02:19:44,718][39m Trial 105 finished with value: 0.8 and parameters: {'criterion': 'entropy', 'n_estimators': 173, 'max_features': 0.7746012602912764, 'max_depth': 71, 'min_samples_split': 4, 'min_samples_leaf': 2}. Best is trial 61 with value: 0.8604651162790697.
[32m[I 2023-04-26 02:19:44,859][39m Trial 106 finished with value: 0.8192771084337348 and parameters: {'criterion': 'entropy', 'n_estimators': 121, 'max_features': 0.6248012705525485, 'max_depth': 37, 'min_samples_split': 4, 'min_samples_leaf': 3}. Best is trial 61 with value: 0.8604651162790697.
[32m[I 2023-04-26 02:19:45,087][39m Trial 107 finished with value: 0.8505747126436782 and parameters: {'criterion': 'entropy', 'n_estimators': 193, 'max_features': 0.7476377715555276, 'max_depth': 73, 'min_samples_split': 3, 'min_samples_leaf': 4}. Best is trial 61 with value: 0.8604651162790697.
[32m[I 2023-04-26 02:19:45,323][39m Trial 108 finished with value: 0.8505747126436782 and parameters: {'criterion': 'entropy', 'n_estimators': 195, 'max_features': 0.7990983921271942, 'max_depth': 66, 'min_samples_split': 3, 'min_samples_leaf': 4}. Best is trial 61 with value: 0.8604651162790697.
[32m[I 2023-04-26 02:19:45,547][39m Trial 109 finished with value: 0.8372093023255814 and parameters: {'criterion': 'entropy', 'n_estimators': 191, 'max_features': 0.7449370089890063, 'max_depth': 66, 'min_samples_split': 3, 'min_samples_leaf': 4}. Best is trial 61 with value: 0.8604651162790697.
[32m[I 2023-04-26 02:19:45,745][39m Trial 110 finished with value: 0.8045977011494252 and parameters: {'criterion': 'gini', 'n_estimators': 196, 'max_features': 0.7998014695076338, 'max_depth': 61, 'min_samples_split': 2, 'min_samples_leaf': 5}. Best is trial 61 with value: 0.8604651162790697.
[32m[I 2023-04-26 02:19:45,971][39m Trial 111 finished with value: 0.8470588235294119 and parameters: {'criterion': 'entropy', 'n_estimators': 198, 'max_features': 0.6707518844651821, 'max_depth': 64, 'min_samples_split': 3, 'min_samples_leaf': 4}. Best is trial 61 with value: 0.8604651162790697.
[32m[I 2023-04-26 02:19:46,192][39m Trial 112 finished with value: 0.8505747126436782 and parameters: {'criterion': 'entropy', 'n_estimators': 198, 'max_features': 0.6618950960293636, 'max_depth': 67, 'min_samples_split': 3, 'min_samples_leaf': 4}. Best is trial 61 with value: 0.8604651162790697.
[32m[I 2023-04-26 02:19:46,419][39m Trial 113 finished with value: 0.8604651162790697 and parameters: {'criterion': 'entropy', 'n_estimators': 201, 'max_features': 0.6973920366753461, 'max_depth': 73, 'min_samples_split': 3, 'min_samples_leaf': 4}. Best is trial 61 with value: 0.8604651162790697.
[32m[I 2023-04-26 02:19:46,649][39m Trial 114 finished with value: 0.8333333333333333 and parameters: {'criterion': 'entropy', 'n_estimators': 201, 'max_features': 0.6955525914531122, 'max_depth': 73, 'min_samples_split': 3, 'min_samples_leaf': 4}. Best is trial 61 with value: 0.8604651162790697.
[32m[I 2023-04-26 02:19:46,857][39m Trial 115 finished with value: 0.8235294117647058 and parameters: {'criterion': 'entropy', 'n_estimators': 191, 'max_features': 0.6568584558477882, 'max_depth': 68, 'min_samples_split': 3, 'min_samples_leaf': 5}. Best is trial 61 with value: 0.8604651162790697.
[32m[I 2023-04-26 02:19:47,085][39m Trial 116 finished with value: 0.8235294117647058 and parameters: {'criterion': 'entropy', 'n_estimators': 198, 'max_features': 0.7211473084582682, 'max_depth': 65, 'min_samples_split': 2, 'min_samples_leaf': 4}. Best is trial 61 with value: 0.8604651162790697.
[32m[I 2023-04-26 02:19:47,299][39m Trial 117 finished with value: 0.8235294117647058 and parameters: {'criterion': 'entropy', 'n_estimators': 194, 'max_features': 0.6365380068252849, 'max_depth': 78, 'min_samples_split': 3, 'min_samples_leaf': 4}. Best is trial 61 with value: 0.8604651162790697.
[32m[I 2023-04-26 02:19:47,511][39m Trial 118 finished with value: 0.8372093023255814 and parameters: {'criterion': 'entropy', 'n_estimators': 185, 'max_features': 0.7541466185242538, 'max_depth': 75, 'min_samples_split': 2, 'min_samples_leaf': 4}. Best is trial 61 with value: 0.8604651162790697.
[32m[I 2023-04-26 02:19:47,736][39m Trial 119 finished with value: 0.8235294117647058 and parameters: {'criterion': 'entropy', 'n_estimators': 192, 'max_features': 0.7020055107106997, 'max_depth': 81, 'min_samples_split': 2, 'min_samples_leaf': 4}. Best is trial 61 with value: 0.8604651162790697.
[32m[I 2023-04-26 02:19:47,939][39m Trial 120 finished with value: 0.8275862068965518 and parameters: {'criterion': 'entropy', 'n_estimators': 195, 'max_features': 0.6071220214020082, 'max_depth': 72, 'min_samples_split': 3, 'min_samples_leaf': 6}. Best is trial 61 with value: 0.8604651162790697.
[32m[I 2023-04-26 02:19:48,163][39m Trial 121 finished with value: 0.8372093023255814 and parameters: {'criterion': 'entropy', 'n_estimators': 189, 'max_features': 0.7308496985633054, 'max_depth': 69, 'min_samples_split': 3, 'min_samples_leaf': 4}. Best is trial 61 with value: 0.8604651162790697.
[32m[I 2023-04-26 02:19:48,393][39m Trial 122 finished with value: 0.8235294117647058 and parameters: {'criterion': 'entropy', 'n_estimators': 201, 'max_features': 0.6686420232095905, 'max_depth': 68, 'min_samples_split': 3, 'min_samples_leaf': 4}. Best is trial 61 with value: 0.8604651162790697.
[32m[I 2023-04-26 02:19:48,623][39m Trial 123 finished with value: 0.8505747126436782 and parameters: {'criterion': 'entropy', 'n_estimators': 198, 'max_features': 0.6727467560693925, 'max_depth': 63, 'min_samples_split': 3, 'min_samples_leaf': 5}. Best is trial 61 with value: 0.8604651162790697.
[32m[I 2023-04-26 02:19:48,860][39m Trial 124 finished with value: 0.8505747126436782 and parameters: {'criterion': 'entropy', 'n_estimators': 196, 'max_features': 0.6896730431090908, 'max_depth': 59, 'min_samples_split': 3, 'min_samples_leaf': 5}. Best is trial 61 with value: 0.8604651162790697.
[32m[I 2023-04-26 02:19:49,083][39m Trial 125 finished with value: 0.8372093023255814 and parameters: {'criterion': 'entropy', 'n_estimators': 198, 'max_features': 0.6896672500857794, 'max_depth': 59, 'min_samples_split': 3, 'min_samples_leaf': 5}. Best is trial 61 with value: 0.8604651162790697.
[32m[I 2023-04-26 02:19:49,247][39m Trial 126 finished with value: 0.8275862068965518 and parameters: {'criterion': 'entropy', 'n_estimators': 144, 'max_features': 0.7111464257801352, 'max_depth': 63, 'min_samples_split': 2, 'min_samples_leaf': 6}. Best is trial 61 with value: 0.8604651162790697.
[32m[I 2023-04-26 02:19:49,462][39m Trial 127 finished with value: 0.8275862068965518 and parameters: {'criterion': 'entropy', 'n_estimators': 199, 'max_features': 0.6567132188239865, 'max_depth': 63, 'min_samples_split': 3, 'min_samples_leaf': 5}. Best is trial 61 with value: 0.8604651162790697.
[32m[I 2023-04-26 02:19:49,690][39m Trial 128 finished with value: 0.8181818181818182 and parameters: {'criterion': 'entropy', 'n_estimators': 195, 'max_features': 0.7734559613189294, 'max_depth': 67, 'min_samples_split': 8, 'min_samples_leaf': 5}. Best is trial 61 with value: 0.8604651162790697.
[32m[I 2023-04-26 02:19:49,900][39m Trial 129 finished with value: 0.8181818181818182 and parameters: {'criterion': 'entropy', 'n_estimators': 183, 'max_features': 0.7418168736506264, 'max_depth': 71, 'min_samples_split': 2, 'min_samples_leaf': 6}. Best is trial 61 with value: 0.8604651162790697.
[32m[I 2023-04-26 02:19:50,087][39m Trial 130 finished with value: 0.7500000000000001 and parameters: {'criterion': 'gini', 'n_estimators': 191, 'max_features': 0.8820961794500672, 'max_depth': 61, 'min_samples_split': 2, 'min_samples_leaf': 10}. Best is trial 61 with value: 0.8604651162790697.
[32m[I 2023-04-26 02:19:50,319][39m Trial 131 finished with value: 0.8235294117647058 and parameters: {'criterion': 'entropy', 'n_estimators': 198, 'max_features': 0.6876060369545446, 'max_depth': 65, 'min_samples_split': 3, 'min_samples_leaf': 4}. Best is trial 61 with value: 0.8604651162790697.
[32m[I 2023-04-26 02:19:50,541][39m Trial 132 finished with value: 0.8409090909090909 and parameters: {'criterion': 'entropy', 'n_estimators': 196, 'max_features': 0.6712546352761389, 'max_depth': 64, 'min_samples_split': 3, 'min_samples_leaf': 4}. Best is trial 61 with value: 0.8604651162790697.
[32m[I 2023-04-26 02:19:50,764][39m Trial 133 finished with value: 0.8275862068965518 and parameters: {'criterion': 'entropy', 'n_estimators': 185, 'max_features': 0.7924505912566677, 'max_depth': 57, 'min_samples_split': 4, 'min_samples_leaf': 5}. Best is trial 61 with value: 0.8604651162790697.
[32m[I 2023-04-26 02:19:50,965][39m Trial 134 finished with value: 0.8470588235294119 and parameters: {'criterion': 'entropy', 'n_estimators': 189, 'max_features': 0.6093173917112543, 'max_depth': 77, 'min_samples_split': 3, 'min_samples_leaf': 4}. Best is trial 61 with value: 0.8604651162790697.
[32m[I 2023-04-26 02:19:51,182][39m Trial 135 finished with value: 0.8314606741573034 and parameters: {'criterion': 'entropy', 'n_estimators': 180, 'max_features': 0.8290773823855647, 'max_depth': 74, 'min_samples_split': 4, 'min_samples_leaf': 4}. Best is trial 61 with value: 0.8604651162790697.
[32m[I 2023-04-26 02:19:51,404][39m Trial 136 finished with value: 0.8505747126436782 and parameters: {'criterion': 'entropy', 'n_estimators': 201, 'max_features': 0.6448639236244696, 'max_depth': 60, 'min_samples_split': 3, 'min_samples_leaf': 4}. Best is trial 61 with value: 0.8604651162790697.
[32m[I 2023-04-26 02:19:51,622][39m Trial 137 finished with value: 0.8372093023255814 and parameters: {'criterion': 'entropy', 'n_estimators': 201, 'max_features': 0.6445985403304655, 'max_depth': 58, 'min_samples_split': 3, 'min_samples_leaf': 5}. Best is trial 61 with value: 0.8604651162790697.
[32m[I 2023-04-26 02:19:51,768][39m Trial 138 finished with value: 0.8372093023255814 and parameters: {'criterion': 'entropy', 'n_estimators': 137, 'max_features': 0.5671553139776626, 'max_depth': 89, 'min_samples_split': 3, 'min_samples_leaf': 4}. Best is trial 61 with value: 0.8604651162790697.
[32m[I 2023-04-26 02:19:51,956][39m Trial 139 finished with value: 0.8235294117647058 and parameters: {'criterion': 'entropy', 'n_estimators': 154, 'max_features': 0.7094203961138821, 'max_depth': 54, 'min_samples_split': 2, 'min_samples_leaf': 3}. Best is trial 61 with value: 0.8604651162790697.
[32m[I 2023-04-26 02:19:52,166][39m Trial 140 finished with value: 0.8409090909090909 and parameters: {'criterion': 'entropy', 'n_estimators': 193, 'max_features': 0.6341482877307789, 'max_depth': 62, 'min_samples_split': 2, 'min_samples_leaf': 5}. Best is trial 61 with value: 0.8604651162790697.
[32m[I 2023-04-26 02:19:52,378][39m Trial 141 finished with value: 0.8433734939759037 and parameters: {'criterion': 'entropy', 'n_estimators': 190, 'max_features': 0.6180116244358514, 'max_depth': 79, 'min_samples_split': 3, 'min_samples_leaf': 4}. Best is trial 61 with value: 0.8604651162790697.
[32m[I 2023-04-26 02:19:52,565][39m Trial 142 finished with value: 0.8048780487804877 and parameters: {'criterion': 'entropy', 'n_estimators': 159, 'max_features': 0.6691199727554568, 'max_depth': 40, 'min_samples_split': 3, 'min_samples_leaf': 3}. Best is trial 61 with value: 0.8604651162790697.
[32m[I 2023-04-26 02:19:52,755][39m Trial 143 finished with value: 0.8095238095238095 and parameters: {'criterion': 'entropy', 'n_estimators': 198, 'max_features': 0.40690616205506003, 'max_depth': 47, 'min_samples_split': 3, 'min_samples_leaf': 4}. Best is trial 61 with value: 0.8604651162790697.
[32m[I 2023-04-26 02:19:52,983][39m Trial 144 finished with value: 0.8333333333333333 and parameters: {'criterion': 'entropy', 'n_estimators': 194, 'max_features': 0.7319666777857649, 'max_depth': 53, 'min_samples_split': 4, 'min_samples_leaf': 4}. Best is trial 61 with value: 0.8604651162790697.
[32m[I 2023-04-26 02:19:53,098][39m Trial 145 finished with value: 0.8181818181818182 and parameters: {'criterion': 'entropy', 'n_estimators': 80, 'max_features': 0.9839131109511572, 'max_depth': 67, 'min_samples_split': 3, 'min_samples_leaf': 5}. Best is trial 61 with value: 0.8604651162790697.
