[32m[I 2023-04-26 02:19:27,729][39m A new study created in memory with name: no-name-f0652613-b681-4c70-b602-9587ee8d47ac
[32m[I 2023-04-26 02:19:27,912][39m Trial 0 finished with value: 0.8045977011494252 and parameters: {'criterion': 'entropy', 'n_estimators': 201, 'max_features': 0.415493628798137, 'max_depth': 47, 'min_samples_split': 6, 'min_samples_leaf': 7}. Best is trial 0 with value: 0.8045977011494252.
[32m[I 2023-04-26 02:19:28,023][39m Trial 1 finished with value: 0.761904761904762 and parameters: {'criterion': 'entropy', 'n_estimators': 153, 'max_features': 0.15032127350215863, 'max_depth': 65, 'min_samples_split': 5, 'min_samples_leaf': 4}. Best is trial 0 with value: 0.8045977011494252.
[32m[I 2023-04-26 02:19:28,230][39m Trial 2 finished with value: 0.7500000000000001 and parameters: {'criterion': 'entropy', 'n_estimators': 183, 'max_features': 0.8379787011738226, 'max_depth': 74, 'min_samples_split': 3, 'min_samples_leaf': 9}. Best is trial 0 with value: 0.8045977011494252.
[32m[I 2023-04-26 02:19:28,306][39m Trial 3 finished with value: 0.7560975609756099 and parameters: {'criterion': 'gini', 'n_estimators': 102, 'max_features': 0.17391822401230383, 'max_depth': 28, 'min_samples_split': 9, 'min_samples_leaf': 4}. Best is trial 0 with value: 0.8045977011494252.
[32m[I 2023-04-26 02:19:28,433][39m Trial 4 finished with value: 0.761904761904762 and parameters: {'criterion': 'gini', 'n_estimators': 165, 'max_features': 0.18714817072163792, 'max_depth': 63, 'min_samples_split': 11, 'min_samples_leaf': 5}. Best is trial 0 with value: 0.8045977011494252.
[32m[I 2023-04-26 02:19:28,595][39m Trial 5 finished with value: 0.7954545454545454 and parameters: {'criterion': 'gini', 'n_estimators': 198, 'max_features': 0.4898313215863428, 'max_depth': 9, 'min_samples_split': 8, 'min_samples_leaf': 7}. Best is trial 0 with value: 0.8045977011494252.
[32m[I 2023-04-26 02:19:28,639][39m Trial 6 finished with value: 0.7654320987654322 and parameters: {'criterion': 'gini', 'n_estimators': 56, 'max_features': 0.1923295735164906, 'max_depth': 53, 'min_samples_split': 11, 'min_samples_leaf': 2}. Best is trial 0 with value: 0.8045977011494252.
[32m[I 2023-04-26 02:19:28,717][39m Trial 7 finished with value: 0.7045454545454545 and parameters: {'criterion': 'entropy', 'n_estimators': 112, 'max_features': 0.024368388971877875, 'max_depth': 83, 'min_samples_split': 3, 'min_samples_leaf': 10}. Best is trial 0 with value: 0.8045977011494252.
[32m[I 2023-04-26 02:19:28,785][39m Trial 8 finished with value: 0.7710843373493976 and parameters: {'criterion': 'gini', 'n_estimators': 97, 'max_features': 0.1514532360550388, 'max_depth': 44, 'min_samples_split': 11, 'min_samples_leaf': 6}. Best is trial 0 with value: 0.8045977011494252.
[32m[I 2023-04-26 02:19:28,893][39m Trial 9 finished with value: 0.7816091954022988 and parameters: {'criterion': 'entropy', 'n_estimators': 96, 'max_features': 0.8477075088935904, 'max_depth': 82, 'min_samples_split': 7, 'min_samples_leaf': 9}. Best is trial 0 with value: 0.8045977011494252.
[32m[I 2023-04-26 02:19:29,058][39m Trial 10 finished with value: 0.810126582278481 and parameters: {'criterion': 'entropy', 'n_estimators': 148, 'max_features': 0.5162732655775991, 'max_depth': 100, 'min_samples_split': 5, 'min_samples_leaf': 1}. Best is trial 10 with value: 0.810126582278481.
[32m[I 2023-04-26 02:19:29,222][39m Trial 11 finished with value: 0.8148148148148149 and parameters: {'criterion': 'entropy', 'n_estimators': 150, 'max_features': 0.5142380409088511, 'max_depth': 100, 'min_samples_split': 5, 'min_samples_leaf': 1}. Best is trial 11 with value: 0.8148148148148149.
[32m[I 2023-04-26 02:19:29,386][39m Trial 12 finished with value: 0.8051948051948052 and parameters: {'criterion': 'entropy', 'n_estimators': 139, 'max_features': 0.664363843937241, 'max_depth': 100, 'min_samples_split': 5, 'min_samples_leaf': 1}. Best is trial 11 with value: 0.8148148148148149.
[32m[I 2023-04-26 02:19:29,540][39m Trial 13 finished with value: 0.8500000000000001 and parameters: {'criterion': 'entropy', 'n_estimators': 131, 'max_features': 0.6606030958728074, 'max_depth': 100, 'min_samples_split': 2, 'min_samples_leaf': 2}. Best is trial 13 with value: 0.8500000000000001.
[32m[I 2023-04-26 02:19:29,684][39m Trial 14 finished with value: 0.8292682926829268 and parameters: {'criterion': 'entropy', 'n_estimators': 125, 'max_features': 0.6654384316343076, 'max_depth': 92, 'min_samples_split': 2, 'min_samples_leaf': 3}. Best is trial 13 with value: 0.8500000000000001.
[32m[I 2023-04-26 02:19:29,836][39m Trial 15 finished with value: 0.8148148148148149 and parameters: {'criterion': 'entropy', 'n_estimators': 125, 'max_features': 0.7038056778425119, 'max_depth': 89, 'min_samples_split': 2, 'min_samples_leaf': 3}. Best is trial 13 with value: 0.8500000000000001.
[32m[I 2023-04-26 02:19:29,952][39m Trial 16 finished with value: 0.8372093023255814 and parameters: {'criterion': 'entropy', 'n_estimators': 81, 'max_features': 0.9852717385325902, 'max_depth': 88, 'min_samples_split': 2, 'min_samples_leaf': 3}. Best is trial 13 with value: 0.8500000000000001.
[32m[I 2023-04-26 02:19:30,056][39m Trial 17 finished with value: 0.8333333333333333 and parameters: {'criterion': 'entropy', 'n_estimators': 72, 'max_features': 0.9940745039580121, 'max_depth': 72, 'min_samples_split': 3, 'min_samples_leaf': 3}. Best is trial 13 with value: 0.8500000000000001.
[32m[I 2023-04-26 02:19:30,161][39m Trial 18 finished with value: 0.8181818181818182 and parameters: {'criterion': 'entropy', 'n_estimators': 76, 'max_features': 0.9765276575792491, 'max_depth': 27, 'min_samples_split': 4, 'min_samples_leaf': 5}. Best is trial 13 with value: 0.8500000000000001.
[32m[I 2023-04-26 02:19:30,237][39m Trial 19 finished with value: 0.8571428571428572 and parameters: {'criterion': 'entropy', 'n_estimators': 50, 'max_features': 0.8562208135872043, 'max_depth': 79, 'min_samples_split': 2, 'min_samples_leaf': 2}. Best is trial 19 with value: 0.8571428571428572.
[32m[I 2023-04-26 02:19:30,453][39m Trial 20 finished with value: 0.8433734939759037 and parameters: {'criterion': 'entropy', 'n_estimators': 167, 'max_features': 0.806174150809654, 'max_depth': 76, 'min_samples_split': 4, 'min_samples_leaf': 2}. Best is trial 19 with value: 0.8571428571428572.
[32m[I 2023-04-26 02:19:30,673][39m Trial 21 finished with value: 0.8 and parameters: {'criterion': 'entropy', 'n_estimators': 173, 'max_features': 0.809720268350534, 'max_depth': 74, 'min_samples_split': 4, 'min_samples_leaf': 2}. Best is trial 19 with value: 0.8571428571428572.
[32m[I 2023-04-26 02:19:30,843][39m Trial 22 finished with value: 0.7848101265822786 and parameters: {'criterion': 'entropy', 'n_estimators': 137, 'max_features': 0.730198533637987, 'max_depth': 60, 'min_samples_split': 3, 'min_samples_leaf': 2}. Best is trial 19 with value: 0.8571428571428572.
[32m[I 2023-04-26 02:19:31,023][39m Trial 23 finished with value: 0.8372093023255814 and parameters: {'criterion': 'entropy', 'n_estimators': 168, 'max_features': 0.6053296742383283, 'max_depth': 80, 'min_samples_split': 2, 'min_samples_leaf': 4}. Best is trial 19 with value: 0.8571428571428572.
[32m[I 2023-04-26 02:19:31,099][39m Trial 24 finished with value: 0.7466666666666667 and parameters: {'criterion': 'entropy', 'n_estimators': 55, 'max_features': 0.789100165808283, 'max_depth': 91, 'min_samples_split': 4, 'min_samples_leaf': 2}. Best is trial 19 with value: 0.8571428571428572.
[32m[I 2023-04-26 02:19:31,261][39m Trial 25 finished with value: 0.7948717948717948 and parameters: {'criterion': 'entropy', 'n_estimators': 113, 'max_features': 0.8939157352702554, 'max_depth': 38, 'min_samples_split': 3, 'min_samples_leaf': 1}. Best is trial 19 with value: 0.8571428571428572.
[32m[I 2023-04-26 02:19:31,387][39m Trial 26 finished with value: 0.8275862068965518 and parameters: {'criterion': 'gini', 'n_estimators': 133, 'max_features': 0.6091337799752145, 'max_depth': 69, 'min_samples_split': 2, 'min_samples_leaf': 5}. Best is trial 19 with value: 0.8571428571428572.
[32m[I 2023-04-26 02:19:31,634][39m Trial 27 finished with value: 0.8148148148148149 and parameters: {'criterion': 'entropy', 'n_estimators': 183, 'max_features': 0.8982818856906015, 'max_depth': 79, 'min_samples_split': 4, 'min_samples_leaf': 2}. Best is trial 19 with value: 0.8571428571428572.
[32m[I 2023-04-26 02:19:31,803][39m Trial 28 finished with value: 0.7356321839080461 and parameters: {'criterion': 'entropy', 'n_estimators': 158, 'max_features': 0.761883301330948, 'max_depth': 58, 'min_samples_split': 6, 'min_samples_leaf': 11}. Best is trial 19 with value: 0.8571428571428572.
[32m[I 2023-04-26 02:19:31,980][39m Trial 29 finished with value: 0.8139534883720929 and parameters: {'criterion': 'entropy', 'n_estimators': 195, 'max_features': 0.43682837790764806, 'max_depth': 93, 'min_samples_split': 7, 'min_samples_leaf': 7}. Best is trial 19 with value: 0.8571428571428572.
[32m[I 2023-04-26 02:19:32,075][39m Trial 30 finished with value: 0.7578947368421053 and parameters: {'criterion': 'entropy', 'n_estimators': 83, 'max_features': 0.9194331779083776, 'max_depth': 4, 'min_samples_split': 6, 'min_samples_leaf': 4}. Best is trial 19 with value: 0.8571428571428572.
[32m[I 2023-04-26 02:19:32,265][39m Trial 31 finished with value: 0.8235294117647058 and parameters: {'criterion': 'entropy', 'n_estimators': 167, 'max_features': 0.6137585834523105, 'max_depth': 79, 'min_samples_split': 2, 'min_samples_leaf': 4}. Best is trial 19 with value: 0.8571428571428572.
[32m[I 2023-04-26 02:19:32,466][39m Trial 32 finished with value: 0.8292682926829268 and parameters: {'criterion': 'entropy', 'n_estimators': 180, 'max_features': 0.588569341913545, 'max_depth': 86, 'min_samples_split': 2, 'min_samples_leaf': 3}. Best is trial 19 with value: 0.8571428571428572.
[32m[I 2023-04-26 02:19:32,527][39m Trial 33 finished with value: 0.8148148148148149 and parameters: {'criterion': 'entropy', 'n_estimators': 60, 'max_features': 0.3010997333670322, 'max_depth': 95, 'min_samples_split': 3, 'min_samples_leaf': 3}. Best is trial 19 with value: 0.8571428571428572.
[32m[I 2023-04-26 02:19:32,629][39m Trial 34 finished with value: 0.7692307692307694 and parameters: {'criterion': 'entropy', 'n_estimators': 68, 'max_features': 0.9431437096332287, 'max_depth': 68, 'min_samples_split': 4, 'min_samples_leaf': 2}. Best is trial 19 with value: 0.8571428571428572.
[32m[I 2023-04-26 02:19:32,751][39m Trial 35 finished with value: 0.8051948051948052 and parameters: {'criterion': 'entropy', 'n_estimators': 84, 'max_features': 0.8398390498591513, 'max_depth': 87, 'min_samples_split': 2, 'min_samples_leaf': 1}. Best is trial 19 with value: 0.8571428571428572.
[32m[I 2023-04-26 02:19:32,886][39m Trial 36 finished with value: 0.8292682926829268 and parameters: {'criterion': 'gini', 'n_estimators': 160, 'max_features': 0.36139244653584035, 'max_depth': 77, 'min_samples_split': 3, 'min_samples_leaf': 4}. Best is trial 19 with value: 0.8571428571428572.
[32m[I 2023-04-26 02:19:33,103][39m Trial 37 finished with value: 0.8275862068965518 and parameters: {'criterion': 'entropy', 'n_estimators': 193, 'max_features': 0.7020370767311904, 'max_depth': 53, 'min_samples_split': 3, 'min_samples_leaf': 5}. Best is trial 19 with value: 0.8571428571428572.
[32m[I 2023-04-26 02:19:33,260][39m Trial 38 finished with value: 0.8275862068965518 and parameters: {'criterion': 'gini', 'n_estimators': 175, 'max_features': 0.5487494066069248, 'max_depth': 69, 'min_samples_split': 2, 'min_samples_leaf': 6}. Best is trial 19 with value: 0.8571428571428572.
[32m[I 2023-04-26 02:19:33,404][39m Trial 39 finished with value: 0.8372093023255814 and parameters: {'criterion': 'entropy', 'n_estimators': 116, 'max_features': 0.7658689515262755, 'max_depth': 63, 'min_samples_split': 3, 'min_samples_leaf': 4}. Best is trial 19 with value: 0.8571428571428572.
[32m[I 2023-04-26 02:19:33,541][39m Trial 40 finished with value: 0.7640449438202247 and parameters: {'criterion': 'gini', 'n_estimators': 144, 'max_features': 0.6500392326074014, 'max_depth': 83, 'min_samples_split': 9, 'min_samples_leaf': 8}. Best is trial 19 with value: 0.8571428571428572.
[32m[I 2023-04-26 02:19:33,613][39m Trial 41 finished with value: 0.7857142857142858 and parameters: {'criterion': 'entropy', 'n_estimators': 50, 'max_features': 0.8649961045629833, 'max_depth': 63, 'min_samples_split': 3, 'min_samples_leaf': 3}. Best is trial 19 with value: 0.8571428571428572.
[32m[I 2023-04-26 02:19:33,751][39m Trial 42 finished with value: 0.7848101265822786 and parameters: {'criterion': 'entropy', 'n_estimators': 105, 'max_features': 0.8040622952804489, 'max_depth': 95, 'min_samples_split': 2, 'min_samples_leaf': 2}. Best is trial 19 with value: 0.8571428571428572.
[32m[I 2023-04-26 02:19:33,938][39m Trial 43 finished with value: 0.8505747126436782 and parameters: {'criterion': 'entropy', 'n_estimators': 157, 'max_features': 0.7541395659868145, 'max_depth': 48, 'min_samples_split': 4, 'min_samples_leaf': 4}. Best is trial 19 with value: 0.8571428571428572.
[32m[I 2023-04-26 02:19:34,066][39m Trial 44 finished with value: 0.8470588235294119 and parameters: {'criterion': 'entropy', 'n_estimators': 88, 'max_features': 0.9472535968457555, 'max_depth': 44, 'min_samples_split': 5, 'min_samples_leaf': 2}. Best is trial 19 with value: 0.8571428571428572.
[32m[I 2023-04-26 02:19:34,265][39m Trial 45 finished with value: 0.8 and parameters: {'criterion': 'entropy', 'n_estimators': 157, 'max_features': 0.7426950777409327, 'max_depth': 42, 'min_samples_split': 5, 'min_samples_leaf': 1}. Best is trial 19 with value: 0.8571428571428572.
[32m[I 2023-04-26 02:19:34,442][39m Trial 46 finished with value: 0.8292682926829268 and parameters: {'criterion': 'entropy', 'n_estimators': 129, 'max_features': 0.9364308284149565, 'max_depth': 34, 'min_samples_split': 5, 'min_samples_leaf': 2}. Best is trial 19 with value: 0.8571428571428572.
[32m[I 2023-04-26 02:19:34,560][39m Trial 47 finished with value: 0.8314606741573034 and parameters: {'criterion': 'entropy', 'n_estimators': 90, 'max_features': 0.862537918795983, 'max_depth': 25, 'min_samples_split': 4, 'min_samples_leaf': 6}. Best is trial 19 with value: 0.8571428571428572.
[32m[I 2023-04-26 02:19:34,751][39m Trial 48 finished with value: 0.7692307692307694 and parameters: {'criterion': 'entropy', 'n_estimators': 144, 'max_features': 0.8227824240578918, 'max_depth': 48, 'min_samples_split': 6, 'min_samples_leaf': 1}. Best is trial 19 with value: 0.8571428571428572.
[32m[I 2023-04-26 02:19:34,875][39m Trial 49 finished with value: 0.7901234567901235 and parameters: {'criterion': 'gini', 'n_estimators': 121, 'max_features': 0.7111997887741321, 'max_depth': 22, 'min_samples_split': 7, 'min_samples_leaf': 3}. Best is trial 19 with value: 0.8571428571428572.
[32m[I 2023-04-26 02:19:34,967][39m Trial 50 finished with value: 0.8292682926829268 and parameters: {'criterion': 'entropy', 'n_estimators': 64, 'max_features': 0.881597325209767, 'max_depth': 49, 'min_samples_split': 6, 'min_samples_leaf': 2}. Best is trial 19 with value: 0.8571428571428572.
[32m[I 2023-04-26 02:19:35,153][39m Trial 51 finished with value: 0.8409090909090909 and parameters: {'criterion': 'entropy', 'n_estimators': 166, 'max_features': 0.6463550379413225, 'max_depth': 34, 'min_samples_split': 5, 'min_samples_leaf': 4}. Best is trial 19 with value: 0.8571428571428572.
[32m[I 2023-04-26 02:19:35,293][39m Trial 52 finished with value: 0.7749999999999999 and parameters: {'criterion': 'entropy', 'n_estimators': 188, 'max_features': 0.003822962230473459, 'max_depth': 33, 'min_samples_split': 5, 'min_samples_leaf': 3}. Best is trial 19 with value: 0.8571428571428572.
[32m[I 2023-04-26 02:19:35,465][39m Trial 53 finished with value: 0.8409090909090909 and parameters: {'criterion': 'entropy', 'n_estimators': 152, 'max_features': 0.6722018841745379, 'max_depth': 16, 'min_samples_split': 5, 'min_samples_leaf': 5}. Best is trial 19 with value: 0.8571428571428572.
[32m[I 2023-04-26 02:19:35,639][39m Trial 54 finished with value: 0.8275862068965518 and parameters: {'criterion': 'entropy', 'n_estimators': 153, 'max_features': 0.6854323663373343, 'max_depth': 16, 'min_samples_split': 4, 'min_samples_leaf': 5}. Best is trial 19 with value: 0.8571428571428572.
[32m[I 2023-04-26 02:19:35,807][39m Trial 55 finished with value: 0.8089887640449439 and parameters: {'criterion': 'entropy', 'n_estimators': 140, 'max_features': 0.779637324398574, 'max_depth': 55, 'min_samples_split': 4, 'min_samples_leaf': 6}. Best is trial 19 with value: 0.8571428571428572.
[32m[I 2023-04-26 02:19:35,948][39m Trial 56 finished with value: 0.8314606741573034 and parameters: {'criterion': 'entropy', 'n_estimators': 104, 'max_features': 0.9611152747640661, 'max_depth': 16, 'min_samples_split': 10, 'min_samples_leaf': 5}. Best is trial 19 with value: 0.8571428571428572.
[32m[I 2023-04-26 02:19:36,134][39m Trial 57 finished with value: 0.7848101265822786 and parameters: {'criterion': 'entropy', 'n_estimators': 148, 'max_features': 0.743487508004741, 'max_depth': 44, 'min_samples_split': 5, 'min_samples_leaf': 1}. Best is trial 19 with value: 0.8571428571428572.
[32m[I 2023-04-26 02:19:36,272][39m Trial 58 finished with value: 0.7999999999999999 and parameters: {'criterion': 'entropy', 'n_estimators': 132, 'max_features': 0.5567627602803132, 'max_depth': 59, 'min_samples_split': 4, 'min_samples_leaf': 7}. Best is trial 19 with value: 0.8571428571428572.
[32m[I 2023-04-26 02:19:36,439][39m Trial 59 finished with value: 0.810126582278481 and parameters: {'criterion': 'entropy', 'n_estimators': 160, 'max_features': 0.4766207022291742, 'max_depth': 41, 'min_samples_split': 7, 'min_samples_leaf': 2}. Best is trial 19 with value: 0.8571428571428572.
[32m[I 2023-04-26 02:19:36,569][39m Trial 60 finished with value: 0.6612903225806451 and parameters: {'criterion': 'entropy', 'n_estimators': 173, 'max_features': 0.8277009781325361, 'max_depth': 1, 'min_samples_split': 6, 'min_samples_leaf': 3}. Best is trial 19 with value: 0.8571428571428572.
[32m[I 2023-04-26 02:19:36,750][39m Trial 61 finished with value: 0.8604651162790697 and parameters: {'criterion': 'entropy', 'n_estimators': 164, 'max_features': 0.650742030849369, 'max_depth': 37, 'min_samples_split': 5, 'min_samples_leaf': 4}. Best is trial 61 with value: 0.8604651162790697.
[32m[I 2023-04-26 02:19:36,927][39m Trial 62 finished with value: 0.8604651162790697 and parameters: {'criterion': 'entropy', 'n_estimators': 155, 'max_features': 0.6723336614548022, 'max_depth': 39, 'min_samples_split': 5, 'min_samples_leaf': 4}. Best is trial 61 with value: 0.8604651162790697.
[32m[I 2023-04-26 02:19:37,002][39m Trial 63 finished with value: 0.7317073170731707 and parameters: {'criterion': 'entropy', 'n_estimators': 95, 'max_features': 0.0890407138050116, 'max_depth': 38, 'min_samples_split': 5, 'min_samples_leaf': 4}. Best is trial 61 with value: 0.8604651162790697.
[32m[I 2023-04-26 02:19:37,241][39m Trial 64 finished with value: 0.8470588235294119 and parameters: {'criterion': 'entropy', 'n_estimators': 177, 'max_features': 0.9081167681968406, 'max_depth': 46, 'min_samples_split': 6, 'min_samples_leaf': 2}. Best is trial 61 with value: 0.8604651162790697.
[32m[I 2023-04-26 02:19:37,508][39m Trial 65 finished with value: 0.8333333333333333 and parameters: {'criterion': 'entropy', 'n_estimators': 201, 'max_features': 0.915653692034959, 'max_depth': 51, 'min_samples_split': 6, 'min_samples_leaf': 3}. Best is trial 61 with value: 0.8604651162790697.
[32m[I 2023-04-26 02:19:37,705][39m Trial 66 finished with value: 0.8148148148148149 and parameters: {'criterion': 'entropy', 'n_estimators': 178, 'max_features': 0.5692129330486984, 'max_depth': 46, 'min_samples_split': 6, 'min_samples_leaf': 2}. Best is trial 61 with value: 0.8604651162790697.
[32m[I 2023-04-26 02:19:37,967][39m Trial 67 finished with value: 0.7901234567901235 and parameters: {'criterion': 'entropy', 'n_estimators': 188, 'max_features': 0.965477469568794, 'max_depth': 30, 'min_samples_split': 8, 'min_samples_leaf': 1}. Best is trial 61 with value: 0.8604651162790697.
[32m[I 2023-04-26 02:19:38,159][39m Trial 68 finished with value: 0.8192771084337348 and parameters: {'criterion': 'gini', 'n_estimators': 170, 'max_features': 0.9933855976349016, 'max_depth': 38, 'min_samples_split': 7, 'min_samples_leaf': 2}. Best is trial 61 with value: 0.8604651162790697.
[32m[I 2023-04-26 02:19:38,355][39m Trial 69 finished with value: 0.7951807228915663 and parameters: {'criterion': 'entropy', 'n_estimators': 163, 'max_features': 0.7223165775052471, 'max_depth': 45, 'min_samples_split': 5, 'min_samples_leaf': 3}. Best is trial 61 with value: 0.8604651162790697.
[32m[I 2023-04-26 02:19:38,523][39m Trial 70 finished with value: 0.8333333333333333 and parameters: {'criterion': 'entropy', 'n_estimators': 146, 'max_features': 0.6292767109498787, 'max_depth': 53, 'min_samples_split': 6, 'min_samples_leaf': 3}. Best is trial 61 with value: 0.8604651162790697.
[32m[I 2023-04-26 02:19:38,727][39m Trial 71 finished with value: 0.8292682926829268 and parameters: {'criterion': 'entropy', 'n_estimators': 155, 'max_features': 0.7893502761401138, 'max_depth': 42, 'min_samples_split': 4, 'min_samples_leaf': 2}. Best is trial 61 with value: 0.8604651162790697.
[32m[I 2023-04-26 02:19:38,838][39m Trial 72 finished with value: 0.7692307692307694 and parameters: {'criterion': 'entropy', 'n_estimators': 77, 'max_features': 0.8526576289811351, 'max_depth': 39, 'min_samples_split': 5, 'min_samples_leaf': 1}. Best is trial 61 with value: 0.8604651162790697.
