[32m[I 2023-04-26 02:20:44,222][39m Trial 438 finished with value: 0.8 and parameters: {'criterion': 'entropy', 'n_estimators': 58, 'max_features': 0.5459425574662822, 'max_depth': 78, 'min_samples_split': 3, 'min_samples_leaf': 2}. Best is trial 61 with value: 0.8604651162790697.
[32m[I 2023-04-26 02:20:44,306][39m Trial 439 finished with value: 0.8051948051948052 and parameters: {'criterion': 'entropy', 'n_estimators': 59, 'max_features': 0.6037627787984116, 'max_depth': 28, 'min_samples_split': 4, 'min_samples_leaf': 1}. Best is trial 61 with value: 0.8604651162790697.
[32m[I 2023-04-26 02:20:44,389][39m Trial 440 finished with value: 0.8139534883720929 and parameters: {'criterion': 'entropy', 'n_estimators': 62, 'max_features': 0.5797540710748659, 'max_depth': 25, 'min_samples_split': 3, 'min_samples_leaf': 4}. Best is trial 61 with value: 0.8604651162790697.
[32m[I 2023-04-26 02:20:44,463][39m Trial 441 finished with value: 0.8292682926829268 and parameters: {'criterion': 'entropy', 'n_estimators': 53, 'max_features': 0.5799102206610436, 'max_depth': 28, 'min_samples_split': 3, 'min_samples_leaf': 4}. Best is trial 61 with value: 0.8604651162790697.
[32m[I 2023-04-26 02:20:44,538][39m Trial 442 finished with value: 0.7999999999999999 and parameters: {'criterion': 'entropy', 'n_estimators': 56, 'max_features': 0.6056375863044485, 'max_depth': 32, 'min_samples_split': 2, 'min_samples_leaf': 4}. Best is trial 61 with value: 0.8604651162790697.
[32m[I 2023-04-26 02:20:44,614][39m Trial 443 finished with value: 0.8292682926829268 and parameters: {'criterion': 'entropy', 'n_estimators': 53, 'max_features': 0.6236851621240843, 'max_depth': 31, 'min_samples_split': 4, 'min_samples_leaf': 3}. Best is trial 61 with value: 0.8604651162790697.
[32m[I 2023-04-26 02:20:44,772][39m Trial 444 finished with value: 0.8372093023255814 and parameters: {'criterion': 'entropy', 'n_estimators': 129, 'max_features': 0.6269510634488409, 'max_depth': 32, 'min_samples_split': 2, 'min_samples_leaf': 4}. Best is trial 61 with value: 0.8604651162790697.
[32m[I 2023-04-26 02:20:44,852][39m Trial 445 finished with value: 0.8409090909090909 and parameters: {'criterion': 'entropy', 'n_estimators': 56, 'max_features': 0.6569111369979377, 'max_depth': 29, 'min_samples_split': 2, 'min_samples_leaf': 4}. Best is trial 61 with value: 0.8604651162790697.
[32m[I 2023-04-26 02:20:45,070][39m Trial 446 finished with value: 0.8333333333333333 and parameters: {'criterion': 'entropy', 'n_estimators': 198, 'max_features': 0.5976013679103773, 'max_depth': 86, 'min_samples_split': 2, 'min_samples_leaf': 4}. Best is trial 61 with value: 0.8604651162790697.
[32m[I 2023-04-26 02:20:45,267][39m Trial 447 finished with value: 0.8 and parameters: {'criterion': 'entropy', 'n_estimators': 170, 'max_features': 0.6399927230855159, 'max_depth': 82, 'min_samples_split': 5, 'min_samples_leaf': 8}. Best is trial 61 with value: 0.8604651162790697.
[32m[I 2023-04-26 02:20:45,351][39m Trial 448 finished with value: 0.7954545454545454 and parameters: {'criterion': 'entropy', 'n_estimators': 61, 'max_features': 0.6361491926094082, 'max_depth': 79, 'min_samples_split': 2, 'min_samples_leaf': 5}. Best is trial 61 with value: 0.8604651162790697.
[32m[I 2023-04-26 02:20:45,570][39m Trial 449 finished with value: 0.8571428571428572 and parameters: {'criterion': 'entropy', 'n_estimators': 153, 'max_features': 0.9594290392374994, 'max_depth': 87, 'min_samples_split': 5, 'min_samples_leaf': 3}. Best is trial 61 with value: 0.8604651162790697.
[32m[I 2023-04-26 02:20:45,648][39m Trial 450 finished with value: 0.8 and parameters: {'criterion': 'gini', 'n_estimators': 57, 'max_features': 0.6195685108729573, 'max_depth': 26, 'min_samples_split': 5, 'min_samples_leaf': 3}. Best is trial 61 with value: 0.8604651162790697.
[32m[I 2023-04-26 02:20:45,825][39m Trial 451 finished with value: 0.8433734939759037 and parameters: {'criterion': 'entropy', 'n_estimators': 153, 'max_features': 0.5859208972731901, 'max_depth': 90, 'min_samples_split': 5, 'min_samples_leaf': 3}. Best is trial 61 with value: 0.8604651162790697.
[32m[I 2023-04-26 02:20:46,034][39m Trial 452 finished with value: 0.8292682926829268 and parameters: {'criterion': 'entropy', 'n_estimators': 148, 'max_features': 0.939322653497617, 'max_depth': 88, 'min_samples_split': 5, 'min_samples_leaf': 2}. Best is trial 61 with value: 0.8604651162790697.
[32m[I 2023-04-26 02:20:46,209][39m Trial 453 finished with value: 0.8192771084337348 and parameters: {'criterion': 'entropy', 'n_estimators': 146, 'max_features': 0.6982260271109259, 'max_depth': 84, 'min_samples_split': 2, 'min_samples_leaf': 3}. Best is trial 61 with value: 0.8604651162790697.
[32m[I 2023-04-26 02:20:46,410][39m Trial 454 finished with value: 0.8292682926829268 and parameters: {'criterion': 'entropy', 'n_estimators': 154, 'max_features': 0.7368941551252501, 'max_depth': 92, 'min_samples_split': 5, 'min_samples_leaf': 3}. Best is trial 61 with value: 0.8604651162790697.
[32m[I 2023-04-26 02:20:46,568][39m Trial 455 finished with value: 0.8 and parameters: {'criterion': 'entropy', 'n_estimators': 138, 'max_features': 0.5487652941486599, 'max_depth': 86, 'min_samples_split': 7, 'min_samples_leaf': 3}. Best is trial 61 with value: 0.8604651162790697.
[32m[I 2023-04-26 02:20:46,653][39m Trial 456 finished with value: 0.7951807228915663 and parameters: {'criterion': 'entropy', 'n_estimators': 60, 'max_features': 0.6489024738683702, 'max_depth': 40, 'min_samples_split': 5, 'min_samples_leaf': 3}. Best is trial 61 with value: 0.8604651162790697.
[32m[I 2023-04-26 02:20:46,740][39m Trial 457 finished with value: 0.7951807228915663 and parameters: {'criterion': 'entropy', 'n_estimators': 64, 'max_features': 0.6664373101024107, 'max_depth': 29, 'min_samples_split': 3, 'min_samples_leaf': 4}. Best is trial 61 with value: 0.8604651162790697.
[32m[I 2023-04-26 02:20:46,820][39m Trial 458 finished with value: 0.8095238095238095 and parameters: {'criterion': 'entropy', 'n_estimators': 54, 'max_features': 0.6526693458097196, 'max_depth': 31, 'min_samples_split': 3, 'min_samples_leaf': 4}. Best is trial 61 with value: 0.8604651162790697.
[32m[I 2023-04-26 02:20:46,919][39m Trial 459 finished with value: 0.8314606741573034 and parameters: {'criterion': 'entropy', 'n_estimators': 59, 'max_features': 0.9674307963582466, 'max_depth': 36, 'min_samples_split': 3, 'min_samples_leaf': 4}. Best is trial 61 with value: 0.8604651162790697.
[32m[I 2023-04-26 02:20:46,997][39m Trial 460 finished with value: 0.7848101265822786 and parameters: {'criterion': 'entropy', 'n_estimators': 50, 'max_features': 0.6357938038980796, 'max_depth': 94, 'min_samples_split': 3, 'min_samples_leaf': 2}. Best is trial 61 with value: 0.8604651162790697.
[32m[I 2023-04-26 02:20:47,100][39m Trial 461 finished with value: 0.8314606741573034 and parameters: {'criterion': 'entropy', 'n_estimators': 64, 'max_features': 0.9600740090451639, 'max_depth': 76, 'min_samples_split': 5, 'min_samples_leaf': 4}. Best is trial 61 with value: 0.8604651162790697.
[32m[I 2023-04-26 02:20:47,264][39m Trial 462 finished with value: 0.8333333333333333 and parameters: {'criterion': 'entropy', 'n_estimators': 132, 'max_features': 0.6126085667485025, 'max_depth': 82, 'min_samples_split': 5, 'min_samples_leaf': 4}. Best is trial 61 with value: 0.8604651162790697.
[32m[I 2023-04-26 02:20:47,337][39m Trial 463 finished with value: 0.8250000000000001 and parameters: {'criterion': 'entropy', 'n_estimators': 54, 'max_features': 0.4763925028314119, 'max_depth': 40, 'min_samples_split': 7, 'min_samples_leaf': 1}. Best is trial 61 with value: 0.8604651162790697.
[32m[I 2023-04-26 02:20:47,517][39m Trial 464 finished with value: 0.8181818181818182 and parameters: {'criterion': 'entropy', 'n_estimators': 129, 'max_features': 0.9418620878128142, 'max_depth': 98, 'min_samples_split': 6, 'min_samples_leaf': 4}. Best is trial 61 with value: 0.8604651162790697.
[32m[I 2023-04-26 02:20:47,682][39m Trial 465 finished with value: 0.8505747126436782 and parameters: {'criterion': 'entropy', 'n_estimators': 143, 'max_features': 0.6025490101355074, 'max_depth': 34, 'min_samples_split': 7, 'min_samples_leaf': 4}. Best is trial 61 with value: 0.8604651162790697.
[32m[I 2023-04-26 02:20:47,827][39m Trial 466 finished with value: 0.8192771084337348 and parameters: {'criterion': 'entropy', 'n_estimators': 122, 'max_features': 0.6218373553456971, 'max_depth': 80, 'min_samples_split': 6, 'min_samples_leaf': 3}. Best is trial 61 with value: 0.8604651162790697.
[32m[I 2023-04-26 02:20:47,998][39m Trial 467 finished with value: 0.8192771084337348 and parameters: {'criterion': 'entropy', 'n_estimators': 143, 'max_features': 0.5973911467415471, 'max_depth': 34, 'min_samples_split': 3, 'min_samples_leaf': 4}. Best is trial 61 with value: 0.8604651162790697.
[32m[I 2023-04-26 02:20:48,230][39m Trial 468 finished with value: 0.8372093023255814 and parameters: {'criterion': 'entropy', 'n_estimators': 194, 'max_features': 0.7556690717132921, 'max_depth': 88, 'min_samples_split': 2, 'min_samples_leaf': 4}. Best is trial 61 with value: 0.8604651162790697.
[32m[I 2023-04-26 02:20:48,423][39m Trial 469 finished with value: 0.8275862068965518 and parameters: {'criterion': 'gini', 'n_estimators': 162, 'max_features': 0.9744481612714079, 'max_depth': 85, 'min_samples_split': 2, 'min_samples_leaf': 4}. Best is trial 61 with value: 0.8604651162790697.
[32m[I 2023-04-26 02:20:48,628][39m Trial 470 finished with value: 0.8505747126436782 and parameters: {'criterion': 'entropy', 'n_estimators': 174, 'max_features': 0.6959726237980269, 'max_depth': 81, 'min_samples_split': 2, 'min_samples_leaf': 4}. Best is trial 61 with value: 0.8604651162790697.
[32m[I 2023-04-26 02:20:48,789][39m Trial 471 finished with value: 0.8314606741573034 and parameters: {'criterion': 'entropy', 'n_estimators': 136, 'max_features': 0.6514260344320006, 'max_depth': 63, 'min_samples_split': 3, 'min_samples_leaf': 5}. Best is trial 61 with value: 0.8604651162790697.
[32m[I 2023-04-26 02:20:49,006][39m Trial 472 finished with value: 0.8222222222222222 and parameters: {'criterion': 'entropy', 'n_estimators': 187, 'max_features': 0.6705041343648275, 'max_depth': 52, 'min_samples_split': 3, 'min_samples_leaf': 6}. Best is trial 61 with value: 0.8604651162790697.
[32m[I 2023-04-26 02:20:49,189][39m Trial 473 finished with value: 0.7777777777777778 and parameters: {'criterion': 'entropy', 'n_estimators': 151, 'max_features': 0.8854064371820508, 'max_depth': 37, 'min_samples_split': 2, 'min_samples_leaf': 10}. Best is trial 61 with value: 0.8604651162790697.
[32m[I 2023-04-26 02:20:49,279][39m Trial 474 finished with value: 0.7951807228915663 and parameters: {'criterion': 'entropy', 'n_estimators': 65, 'max_features': 0.6661459991177974, 'max_depth': 79, 'min_samples_split': 3, 'min_samples_leaf': 4}. Best is trial 61 with value: 0.8604651162790697.
[32m[I 2023-04-26 02:20:49,411][39m Trial 475 finished with value: 0.7804878048780488 and parameters: {'criterion': 'entropy', 'n_estimators': 161, 'max_features': 0.15871314016474236, 'max_depth': 46, 'min_samples_split': 5, 'min_samples_leaf': 3}. Best is trial 61 with value: 0.8604651162790697.
[32m[I 2023-04-26 02:20:49,605][39m Trial 476 finished with value: 0.8292682926829268 and parameters: {'criterion': 'entropy', 'n_estimators': 156, 'max_features': 0.7098731643845579, 'max_depth': 83, 'min_samples_split': 4, 'min_samples_leaf': 3}. Best is trial 61 with value: 0.8604651162790697.
[32m[I 2023-04-26 02:20:49,753][39m Trial 477 finished with value: 0.8048780487804877 and parameters: {'criterion': 'entropy', 'n_estimators': 155, 'max_features': 0.2679625074001799, 'max_depth': 31, 'min_samples_split': 3, 'min_samples_leaf': 4}. Best is trial 61 with value: 0.8604651162790697.
[32m[I 2023-04-26 02:20:49,925][39m Trial 478 finished with value: 0.8604651162790697 and parameters: {'criterion': 'entropy', 'n_estimators': 139, 'max_features': 0.6308084146321912, 'max_depth': 80, 'min_samples_split': 2, 'min_samples_leaf': 4}. Best is trial 61 with value: 0.8604651162790697.
[32m[I 2023-04-26 02:20:50,025][39m Trial 479 finished with value: 0.8148148148148149 and parameters: {'criterion': 'entropy', 'n_estimators': 69, 'max_features': 0.6320851670110887, 'max_depth': 77, 'min_samples_split': 2, 'min_samples_leaf': 3}. Best is trial 61 with value: 0.8604651162790697.
[32m[I 2023-04-26 02:20:50,186][39m Trial 480 finished with value: 0.8235294117647058 and parameters: {'criterion': 'entropy', 'n_estimators': 141, 'max_features': 0.6102519865667158, 'max_depth': 86, 'min_samples_split': 2, 'min_samples_leaf': 4}. Best is trial 61 with value: 0.8604651162790697.
[32m[I 2023-04-26 02:20:50,390][39m Trial 481 finished with value: 0.7848101265822786 and parameters: {'criterion': 'entropy', 'n_estimators': 141, 'max_features': 0.8996472234974221, 'max_depth': 73, 'min_samples_split': 2, 'min_samples_leaf': 2}. Best is trial 61 with value: 0.8604651162790697.
[32m[I 2023-04-26 02:20:50,566][39m Trial 482 finished with value: 0.8275862068965518 and parameters: {'criterion': 'entropy', 'n_estimators': 148, 'max_features': 0.6406577597832767, 'max_depth': 34, 'min_samples_split': 3, 'min_samples_leaf': 4}. Best is trial 61 with value: 0.8604651162790697.
[32m[I 2023-04-26 02:20:50,748][39m Trial 483 finished with value: 0.8292682926829268 and parameters: {'criterion': 'entropy', 'n_estimators': 157, 'max_features': 0.5689802041816729, 'max_depth': 49, 'min_samples_split': 4, 'min_samples_leaf': 3}. Best is trial 61 with value: 0.8604651162790697.
[32m[I 2023-04-26 02:20:50,909][39m Trial 484 finished with value: 0.8235294117647058 and parameters: {'criterion': 'entropy', 'n_estimators': 136, 'max_features': 0.655873595136379, 'max_depth': 80, 'min_samples_split': 2, 'min_samples_leaf': 4}. Best is trial 61 with value: 0.8604651162790697.
[32m[I 2023-04-26 02:20:51,073][39m Trial 485 finished with value: 0.7999999999999999 and parameters: {'criterion': 'entropy', 'n_estimators': 139, 'max_features': 0.6332663759781063, 'max_depth': 31, 'min_samples_split': 2, 'min_samples_leaf': 4}. Best is trial 61 with value: 0.8604651162790697.
[32m[I 2023-04-26 02:20:51,147][39m Trial 486 finished with value: 0.7857142857142858 and parameters: {'criterion': 'entropy', 'n_estimators': 50, 'max_features': 0.684163123933813, 'max_depth': 47, 'min_samples_split': 4, 'min_samples_leaf': 3}. Best is trial 61 with value: 0.8604651162790697.
[32m[I 2023-04-26 02:20:51,354][39m Trial 487 finished with value: 0.8139534883720929 and parameters: {'criterion': 'entropy', 'n_estimators': 182, 'max_features': 0.5915252290709849, 'max_depth': 76, 'min_samples_split': 3, 'min_samples_leaf': 4}. Best is trial 61 with value: 0.8604651162790697.
[32m[I 2023-04-26 02:20:51,509][39m Trial 488 finished with value: 0.8372093023255814 and parameters: {'criterion': 'entropy', 'n_estimators': 134, 'max_features': 0.6158988518495858, 'max_depth': 80, 'min_samples_split': 2, 'min_samples_leaf': 4}. Best is trial 61 with value: 0.8604651162790697.
[32m[I 2023-04-26 02:20:51,681][39m Trial 489 finished with value: 0.8604651162790697 and parameters: {'criterion': 'entropy', 'n_estimators': 144, 'max_features': 0.5772346527657793, 'max_depth': 33, 'min_samples_split': 2, 'min_samples_leaf': 4}. Best is trial 61 with value: 0.8604651162790697.
[32m[I 2023-04-26 02:20:51,848][39m Trial 490 finished with value: 0.8192771084337348 and parameters: {'criterion': 'entropy', 'n_estimators': 145, 'max_features': 0.5845208378338274, 'max_depth': 33, 'min_samples_split': 2, 'min_samples_leaf': 4}. Best is trial 61 with value: 0.8604651162790697.
[32m[I 2023-04-26 02:20:52,009][39m Trial 491 finished with value: 0.8181818181818182 and parameters: {'criterion': 'gini', 'n_estimators': 140, 'max_features': 0.9350022602748276, 'max_depth': 70, 'min_samples_split': 2, 'min_samples_leaf': 4}. Best is trial 61 with value: 0.8604651162790697.
[32m[I 2023-04-26 02:20:52,168][39m Trial 492 finished with value: 0.8333333333333333 and parameters: {'criterion': 'entropy', 'n_estimators': 146, 'max_features': 0.5245481607814576, 'max_depth': 37, 'min_samples_split': 2, 'min_samples_leaf': 4}. Best is trial 61 with value: 0.8604651162790697.
[32m[I 2023-04-26 02:20:52,337][39m Trial 493 finished with value: 0.8235294117647058 and parameters: {'criterion': 'entropy', 'n_estimators': 144, 'max_features': 0.5615667131363113, 'max_depth': 84, 'min_samples_split': 2, 'min_samples_leaf': 4}. Best is trial 61 with value: 0.8604651162790697.
[32m[I 2023-04-26 02:20:52,519][39m Trial 494 finished with value: 0.8048780487804877 and parameters: {'criterion': 'entropy', 'n_estimators': 153, 'max_features': 0.5824059914391111, 'max_depth': 52, 'min_samples_split': 4, 'min_samples_leaf': 2}. Best is trial 61 with value: 0.8604651162790697.
[32m[I 2023-04-26 02:20:52,689][39m Trial 495 finished with value: 0.8095238095238095 and parameters: {'criterion': 'entropy', 'n_estimators': 150, 'max_features': 0.5562190181746489, 'max_depth': 75, 'min_samples_split': 2, 'min_samples_leaf': 4}. Best is trial 61 with value: 0.8604651162790697.
[32m[I 2023-04-26 02:20:52,843][39m Trial 496 finished with value: 0.8139534883720929 and parameters: {'criterion': 'entropy', 'n_estimators': 138, 'max_features': 0.5424291714191546, 'max_depth': 83, 'min_samples_split': 2, 'min_samples_leaf': 4}. Best is trial 61 with value: 0.8604651162790697.
[32m[I 2023-04-26 02:20:53,008][39m Trial 497 finished with value: 0.8235294117647058 and parameters: {'criterion': 'entropy', 'n_estimators': 141, 'max_features': 0.6044395676989746, 'max_depth': 30, 'min_samples_split': 3, 'min_samples_leaf': 4}. Best is trial 61 with value: 0.8604651162790697.
[32m[I 2023-04-26 02:20:53,092][39m Trial 498 finished with value: 0.8372093023255814 and parameters: {'criterion': 'entropy', 'n_estimators': 58, 'max_features': 0.6700248318687186, 'max_depth': 28, 'min_samples_split': 2, 'min_samples_leaf': 4}. Best is trial 61 with value: 0.8604651162790697.
[32m[I 2023-04-26 02:20:53,254][39m Trial 499 finished with value: 0.8409090909090909 and parameters: {'criterion': 'entropy', 'n_estimators': 134, 'max_features': 0.6199251815775435, 'max_depth': 78, 'min_samples_split': 2, 'min_samples_leaf': 4}. Best is trial 61 with value: 0.8604651162790697.
Number of finished trials: 500