[32m[I 2023-04-26 02:20:31,626][39m Trial 365 finished with value: 0.8470588235294119 and parameters: {'criterion': 'entropy', 'n_estimators': 157, 'max_features': 0.530487362530134, 'max_depth': 81, 'min_samples_split': 2, 'min_samples_leaf': 4}. Best is trial 61 with value: 0.8604651162790697.
[32m[I 2023-04-26 02:20:31,776][39m Trial 366 finished with value: 0.7954545454545454 and parameters: {'criterion': 'entropy', 'n_estimators': 127, 'max_features': 0.6832516956622375, 'max_depth': 20, 'min_samples_split': 6, 'min_samples_leaf': 7}. Best is trial 61 with value: 0.8604651162790697.
[32m[I 2023-04-26 02:20:31,984][39m Trial 367 finished with value: 0.8505747126436782 and parameters: {'criterion': 'entropy', 'n_estimators': 190, 'max_features': 0.6410516700748855, 'max_depth': 59, 'min_samples_split': 7, 'min_samples_leaf': 6}. Best is trial 61 with value: 0.8604651162790697.
[32m[I 2023-04-26 02:20:32,164][39m Trial 368 finished with value: 0.8 and parameters: {'criterion': 'entropy', 'n_estimators': 151, 'max_features': 0.65764465645365, 'max_depth': 53, 'min_samples_split': 4, 'min_samples_leaf': 3}. Best is trial 61 with value: 0.8604651162790697.
[32m[I 2023-04-26 02:20:32,282][39m Trial 369 finished with value: 0.8192771084337348 and parameters: {'criterion': 'entropy', 'n_estimators': 86, 'max_features': 0.7659175466859877, 'max_depth': 66, 'min_samples_split': 4, 'min_samples_leaf': 3}. Best is trial 61 with value: 0.8604651162790697.
[32m[I 2023-04-26 02:20:32,526][39m Trial 370 finished with value: 0.8409090909090909 and parameters: {'criterion': 'entropy', 'n_estimators': 194, 'max_features': 0.880503034914161, 'max_depth': 78, 'min_samples_split': 2, 'min_samples_leaf': 4}. Best is trial 61 with value: 0.8604651162790697.
[32m[I 2023-04-26 02:20:32,741][39m Trial 371 finished with value: 0.8235294117647058 and parameters: {'criterion': 'gini', 'n_estimators': 201, 'max_features': 0.7232502860025991, 'max_depth': 80, 'min_samples_split': 3, 'min_samples_leaf': 4}. Best is trial 61 with value: 0.8604651162790697.
[32m[I 2023-04-26 02:20:32,927][39m Trial 372 finished with value: 0.8275862068965518 and parameters: {'criterion': 'entropy', 'n_estimators': 160, 'max_features': 0.6180086883879649, 'max_depth': 37, 'min_samples_split': 3, 'min_samples_leaf': 4}. Best is trial 61 with value: 0.8604651162790697.
[32m[I 2023-04-26 02:20:33,149][39m Trial 373 finished with value: 0.8372093023255814 and parameters: {'criterion': 'entropy', 'n_estimators': 190, 'max_features': 0.6963201462764133, 'max_depth': 39, 'min_samples_split': 3, 'min_samples_leaf': 4}. Best is trial 61 with value: 0.8604651162790697.
[32m[I 2023-04-26 02:20:33,347][39m Trial 374 finished with value: 0.8181818181818182 and parameters: {'criterion': 'entropy', 'n_estimators': 163, 'max_features': 0.7452244614498478, 'max_depth': 44, 'min_samples_split': 2, 'min_samples_leaf': 5}. Best is trial 61 with value: 0.8604651162790697.
[32m[I 2023-04-26 02:20:33,517][39m Trial 375 finished with value: 0.8372093023255814 and parameters: {'criterion': 'entropy', 'n_estimators': 133, 'max_features': 0.7811068860965665, 'max_depth': 87, 'min_samples_split': 5, 'min_samples_leaf': 4}. Best is trial 61 with value: 0.8604651162790697.
[32m[I 2023-04-26 02:20:33,752][39m Trial 376 finished with value: 0.8372093023255814 and parameters: {'criterion': 'entropy', 'n_estimators': 201, 'max_features': 0.7085184602358778, 'max_depth': 40, 'min_samples_split': 2, 'min_samples_leaf': 4}. Best is trial 61 with value: 0.8604651162790697.
[32m[I 2023-04-26 02:20:33,940][39m Trial 377 finished with value: 0.8181818181818182 and parameters: {'criterion': 'entropy', 'n_estimators': 176, 'max_features': 0.5666818987577391, 'max_depth': 76, 'min_samples_split': 7, 'min_samples_leaf': 7}. Best is trial 61 with value: 0.8604651162790697.
[32m[I 2023-04-26 02:20:34,109][39m Trial 378 finished with value: 0.8048780487804877 and parameters: {'criterion': 'entropy', 'n_estimators': 134, 'max_features': 0.6825636476980095, 'max_depth': 83, 'min_samples_split': 6, 'min_samples_leaf': 1}. Best is trial 61 with value: 0.8604651162790697.
[32m[I 2023-04-26 02:20:34,335][39m Trial 379 finished with value: 0.8372093023255814 and parameters: {'criterion': 'entropy', 'n_estimators': 198, 'max_features': 0.6517633589450772, 'max_depth': 84, 'min_samples_split': 5, 'min_samples_leaf': 4}. Best is trial 61 with value: 0.8604651162790697.
[32m[I 2023-04-26 02:20:34,487][39m Trial 380 finished with value: 0.8275862068965518 and parameters: {'criterion': 'entropy', 'n_estimators': 127, 'max_features': 0.6340000610012769, 'max_depth': 36, 'min_samples_split': 3, 'min_samples_leaf': 4}. Best is trial 61 with value: 0.8604651162790697.
[32m[I 2023-04-26 02:20:34,719][39m Trial 381 finished with value: 0.8314606741573034 and parameters: {'criterion': 'entropy', 'n_estimators': 195, 'max_features': 0.6943371658741563, 'max_depth': 81, 'min_samples_split': 3, 'min_samples_leaf': 6}. Best is trial 61 with value: 0.8604651162790697.
[32m[I 2023-04-26 02:20:34,947][39m Trial 382 finished with value: 0.8433734939759037 and parameters: {'criterion': 'entropy', 'n_estimators': 197, 'max_features': 0.6613366691242608, 'max_depth': 27, 'min_samples_split': 3, 'min_samples_leaf': 3}. Best is trial 61 with value: 0.8604651162790697.
[32m[I 2023-04-26 02:20:35,180][39m Trial 383 finished with value: 0.8095238095238095 and parameters: {'criterion': 'entropy', 'n_estimators': 193, 'max_features': 0.7284776809132781, 'max_depth': 95, 'min_samples_split': 3, 'min_samples_leaf': 4}. Best is trial 61 with value: 0.8604651162790697.
[32m[I 2023-04-26 02:20:35,252][39m Trial 384 finished with value: 0.8089887640449439 and parameters: {'criterion': 'entropy', 'n_estimators': 53, 'max_features': 0.5954011417114314, 'max_depth': 43, 'min_samples_split': 3, 'min_samples_leaf': 5}. Best is trial 61 with value: 0.8604651162790697.
[32m[I 2023-04-26 02:20:35,404][39m Trial 385 finished with value: 0.7951807228915663 and parameters: {'criterion': 'entropy', 'n_estimators': 120, 'max_features': 0.6691635142040998, 'max_depth': 70, 'min_samples_split': 6, 'min_samples_leaf': 3}. Best is trial 61 with value: 0.8604651162790697.
[32m[I 2023-04-26 02:20:35,618][39m Trial 386 finished with value: 0.8 and parameters: {'criterion': 'entropy', 'n_estimators': 189, 'max_features': 0.6989291591322278, 'max_depth': 56, 'min_samples_split': 7, 'min_samples_leaf': 6}. Best is trial 61 with value: 0.8604651162790697.
[32m[I 2023-04-26 02:20:35,776][39m Trial 387 finished with value: 0.8095238095238095 and parameters: {'criterion': 'entropy', 'n_estimators': 129, 'max_features': 0.6886649458707949, 'max_depth': 88, 'min_samples_split': 7, 'min_samples_leaf': 4}. Best is trial 61 with value: 0.8604651162790697.
[32m[I 2023-04-26 02:20:35,965][39m Trial 388 finished with value: 0.8235294117647058 and parameters: {'criterion': 'entropy', 'n_estimators': 157, 'max_features': 0.6766121241634404, 'max_depth': 45, 'min_samples_split': 4, 'min_samples_leaf': 4}. Best is trial 61 with value: 0.8604651162790697.
[32m[I 2023-04-26 02:20:36,195][39m Trial 389 finished with value: 0.8275862068965518 and parameters: {'criterion': 'entropy', 'n_estimators': 197, 'max_features': 0.7148007561145513, 'max_depth': 74, 'min_samples_split': 3, 'min_samples_leaf': 4}. Best is trial 61 with value: 0.8604651162790697.
[32m[I 2023-04-26 02:20:36,334][39m Trial 390 finished with value: 0.8372093023255814 and parameters: {'criterion': 'gini', 'n_estimators': 135, 'max_features': 0.6368754787176085, 'max_depth': 79, 'min_samples_split': 9, 'min_samples_leaf': 4}. Best is trial 61 with value: 0.8604651162790697.
[32m[I 2023-04-26 02:20:36,536][39m Trial 391 finished with value: 0.8470588235294119 and parameters: {'criterion': 'entropy', 'n_estimators': 171, 'max_features': 0.7158460486260062, 'max_depth': 42, 'min_samples_split': 2, 'min_samples_leaf': 4}. Best is trial 61 with value: 0.8604651162790697.
[32m[I 2023-04-26 02:20:36,725][39m Trial 392 finished with value: 0.8235294117647058 and parameters: {'criterion': 'entropy', 'n_estimators': 159, 'max_features': 0.7213433092236792, 'max_depth': 77, 'min_samples_split': 2, 'min_samples_leaf': 4}. Best is trial 61 with value: 0.8604651162790697.
[32m[I 2023-04-26 02:20:36,930][39m Trial 393 finished with value: 0.8181818181818182 and parameters: {'criterion': 'entropy', 'n_estimators': 147, 'max_features': 0.9845697444422705, 'max_depth': 51, 'min_samples_split': 5, 'min_samples_leaf': 4}. Best is trial 61 with value: 0.8604651162790697.
[32m[I 2023-04-26 02:20:37,115][39m Trial 394 finished with value: 0.7749999999999999 and parameters: {'criterion': 'entropy', 'n_estimators': 153, 'max_features': 0.6176288835795954, 'max_depth': 30, 'min_samples_split': 7, 'min_samples_leaf': 1}. Best is trial 61 with value: 0.8604651162790697.
[32m[I 2023-04-26 02:20:37,322][39m Trial 395 finished with value: 0.7727272727272727 and parameters: {'criterion': 'entropy', 'n_estimators': 180, 'max_features': 0.8054777494561001, 'max_depth': 34, 'min_samples_split': 3, 'min_samples_leaf': 11}. Best is trial 61 with value: 0.8604651162790697.
[32m[I 2023-04-26 02:20:37,559][39m Trial 396 finished with value: 0.8505747126436782 and parameters: {'criterion': 'entropy', 'n_estimators': 201, 'max_features': 0.7042893779625476, 'max_depth': 40, 'min_samples_split': 7, 'min_samples_leaf': 4}. Best is trial 61 with value: 0.8604651162790697.
[32m[I 2023-04-26 02:20:37,799][39m Trial 397 finished with value: 0.8372093023255814 and parameters: {'criterion': 'entropy', 'n_estimators': 201, 'max_features': 0.7023488324925083, 'max_depth': 40, 'min_samples_split': 8, 'min_samples_leaf': 4}. Best is trial 61 with value: 0.8604651162790697.
[32m[I 2023-04-26 02:20:37,997][39m Trial 398 finished with value: 0.8409090909090909 and parameters: {'criterion': 'entropy', 'n_estimators': 161, 'max_features': 0.7373606961951414, 'max_depth': 38, 'min_samples_split': 4, 'min_samples_leaf': 4}. Best is trial 61 with value: 0.8604651162790697.
[32m[I 2023-04-26 02:20:38,166][39m Trial 399 finished with value: 0.8235294117647058 and parameters: {'criterion': 'entropy', 'n_estimators': 139, 'max_features': 0.6822111284397488, 'max_depth': 85, 'min_samples_split': 2, 'min_samples_leaf': 5}. Best is trial 61 with value: 0.8604651162790697.
[32m[I 2023-04-26 02:20:38,318][39m Trial 400 finished with value: 0.8536585365853658 and parameters: {'criterion': 'entropy', 'n_estimators': 131, 'max_features': 0.6479226545492364, 'max_depth': 80, 'min_samples_split': 7, 'min_samples_leaf': 3}. Best is trial 61 with value: 0.8604651162790697.
[32m[I 2023-04-26 02:20:38,485][39m Trial 401 finished with value: 0.8372093023255814 and parameters: {'criterion': 'entropy', 'n_estimators': 143, 'max_features': 0.6561153985755773, 'max_depth': 90, 'min_samples_split': 2, 'min_samples_leaf': 4}. Best is trial 61 with value: 0.8604651162790697.
[32m[I 2023-04-26 02:20:38,569][39m Trial 402 finished with value: 0.8192771084337348 and parameters: {'criterion': 'entropy', 'n_estimators': 55, 'max_features': 0.6706700193962823, 'max_depth': 75, 'min_samples_split': 3, 'min_samples_leaf': 3}. Best is trial 61 with value: 0.8604651162790697.
[32m[I 2023-04-26 02:20:38,767][39m Trial 403 finished with value: 0.8192771084337348 and parameters: {'criterion': 'entropy', 'n_estimators': 166, 'max_features': 0.6477724641536243, 'max_depth': 35, 'min_samples_split': 4, 'min_samples_leaf': 3}. Best is trial 61 with value: 0.8604651162790697.
[32m[I 2023-04-26 02:20:38,939][39m Trial 404 finished with value: 0.8181818181818182 and parameters: {'criterion': 'entropy', 'n_estimators': 156, 'max_features': 0.5873749233895046, 'max_depth': 79, 'min_samples_split': 7, 'min_samples_leaf': 6}. Best is trial 61 with value: 0.8604651162790697.
[32m[I 2023-04-26 02:20:39,088][39m Trial 405 finished with value: 0.7727272727272727 and parameters: {'criterion': 'entropy', 'n_estimators': 131, 'max_features': 0.6076565927704872, 'max_depth': 81, 'min_samples_split': 5, 'min_samples_leaf': 8}. Best is trial 61 with value: 0.8604651162790697.
[32m[I 2023-04-26 02:20:39,305][39m Trial 406 finished with value: 0.8314606741573034 and parameters: {'criterion': 'entropy', 'n_estimators': 195, 'max_features': 0.6264350742493375, 'max_depth': 58, 'min_samples_split': 7, 'min_samples_leaf': 5}. Best is trial 61 with value: 0.8604651162790697.
[32m[I 2023-04-26 02:20:39,466][39m Trial 407 finished with value: 0.8148148148148149 and parameters: {'criterion': 'entropy', 'n_estimators': 126, 'max_features': 0.7108867659378553, 'max_depth': 42, 'min_samples_split': 7, 'min_samples_leaf': 2}. Best is trial 61 with value: 0.8604651162790697.
[32m[I 2023-04-26 02:20:39,627][39m Trial 408 finished with value: 0.8192771084337348 and parameters: {'criterion': 'entropy', 'n_estimators': 131, 'max_features': 0.6420796284408423, 'max_depth': 82, 'min_samples_split': 7, 'min_samples_leaf': 3}. Best is trial 61 with value: 0.8604651162790697.
[32m[I 2023-04-26 02:20:39,841][39m Trial 409 finished with value: 0.8333333333333333 and parameters: {'criterion': 'gini', 'n_estimators': 192, 'max_features': 0.7675980985073534, 'max_depth': 72, 'min_samples_split': 4, 'min_samples_leaf': 3}. Best is trial 61 with value: 0.8604651162790697.
[32m[I 2023-04-26 02:20:40,069][39m Trial 410 finished with value: 0.8505747126436782 and parameters: {'criterion': 'entropy', 'n_estimators': 198, 'max_features': 0.669345893628382, 'max_depth': 36, 'min_samples_split': 3, 'min_samples_leaf': 4}. Best is trial 61 with value: 0.8604651162790697.
[32m[I 2023-04-26 02:20:40,245][39m Trial 411 finished with value: 0.8095238095238095 and parameters: {'criterion': 'entropy', 'n_estimators': 136, 'max_features': 0.735888016205228, 'max_depth': 79, 'min_samples_split': 8, 'min_samples_leaf': 4}. Best is trial 61 with value: 0.8604651162790697.
[32m[I 2023-04-26 02:20:40,481][39m Trial 412 finished with value: 0.8470588235294119 and parameters: {'criterion': 'entropy', 'n_estimators': 189, 'max_features': 0.751755231016473, 'max_depth': 33, 'min_samples_split': 7, 'min_samples_leaf': 3}. Best is trial 61 with value: 0.8604651162790697.
[32m[I 2023-04-26 02:20:40,546][39m Trial 413 finished with value: 0.7906976744186047 and parameters: {'criterion': 'entropy', 'n_estimators': 50, 'max_features': 0.40055953338918837, 'max_depth': 78, 'min_samples_split': 2, 'min_samples_leaf': 4}. Best is trial 61 with value: 0.8604651162790697.
[32m[I 2023-04-26 02:20:40,685][39m Trial 414 finished with value: 0.8192771084337348 and parameters: {'criterion': 'entropy', 'n_estimators': 124, 'max_features': 0.5037828929653282, 'max_depth': 76, 'min_samples_split': 2, 'min_samples_leaf': 4}. Best is trial 61 with value: 0.8604651162790697.
[32m[I 2023-04-26 02:20:40,786][39m Trial 415 finished with value: 0.8409090909090909 and parameters: {'criterion': 'entropy', 'n_estimators': 67, 'max_features': 0.9110142718930246, 'max_depth': 60, 'min_samples_split': 3, 'min_samples_leaf': 5}. Best is trial 61 with value: 0.8604651162790697.
[32m[I 2023-04-26 02:20:41,019][39m Trial 416 finished with value: 0.7999999999999999 and parameters: {'criterion': 'entropy', 'n_estimators': 198, 'max_features': 0.6855046758947798, 'max_depth': 47, 'min_samples_split': 4, 'min_samples_leaf': 4}. Best is trial 61 with value: 0.8604651162790697.
[32m[I 2023-04-26 02:20:41,223][39m Trial 417 finished with value: 0.8192771084337348 and parameters: {'criterion': 'entropy', 'n_estimators': 150, 'max_features': 0.8516238237343116, 'max_depth': 68, 'min_samples_split': 4, 'min_samples_leaf': 3}. Best is trial 61 with value: 0.8604651162790697.
[32m[I 2023-04-26 02:20:41,429][39m Trial 418 finished with value: 0.8372093023255814 and parameters: {'criterion': 'entropy', 'n_estimators': 164, 'max_features': 0.7839755091477233, 'max_depth': 62, 'min_samples_split': 7, 'min_samples_leaf': 5}. Best is trial 61 with value: 0.8604651162790697.
[32m[I 2023-04-26 02:20:41,601][39m Trial 419 finished with value: 0.8181818181818182 and parameters: {'criterion': 'entropy', 'n_estimators': 133, 'max_features': 0.8188132748781706, 'max_depth': 83, 'min_samples_split': 6, 'min_samples_leaf': 4}. Best is trial 61 with value: 0.8604651162790697.
[32m[I 2023-04-26 02:20:41,778][39m Trial 420 finished with value: 0.8571428571428572 and parameters: {'criterion': 'entropy', 'n_estimators': 137, 'max_features': 0.6581446310059219, 'max_depth': 82, 'min_samples_split': 2, 'min_samples_leaf': 2}. Best is trial 61 with value: 0.8604651162790697.
[32m[I 2023-04-26 02:20:41,949][39m Trial 421 finished with value: 0.8292682926829268 and parameters: {'criterion': 'entropy', 'n_estimators': 139, 'max_features': 0.6165534484916174, 'max_depth': 42, 'min_samples_split': 7, 'min_samples_leaf': 2}. Best is trial 61 with value: 0.8604651162790697.
[32m[I 2023-04-26 02:20:42,124][39m Trial 422 finished with value: 0.8148148148148149 and parameters: {'criterion': 'entropy', 'n_estimators': 141, 'max_features': 0.6423955062444885, 'max_depth': 78, 'min_samples_split': 2, 'min_samples_leaf': 2}. Best is trial 61 with value: 0.8604651162790697.
[32m[I 2023-04-26 02:20:42,298][39m Trial 423 finished with value: 0.8 and parameters: {'criterion': 'entropy', 'n_estimators': 141, 'max_features': 0.6587879823733187, 'max_depth': 81, 'min_samples_split': 3, 'min_samples_leaf': 2}. Best is trial 61 with value: 0.8604651162790697.
[32m[I 2023-04-26 02:20:42,463][39m Trial 424 finished with value: 0.8148148148148149 and parameters: {'criterion': 'entropy', 'n_estimators': 137, 'max_features': 0.62428652870677, 'max_depth': 49, 'min_samples_split': 7, 'min_samples_leaf': 2}. Best is trial 61 with value: 0.8604651162790697.
[32m[I 2023-04-26 02:20:42,674][39m Trial 425 finished with value: 0.8181818181818182 and parameters: {'criterion': 'entropy', 'n_estimators': 190, 'max_features': 0.639719483937362, 'max_depth': 55, 'min_samples_split': 8, 'min_samples_leaf': 6}. Best is trial 61 with value: 0.8604651162790697.
[32m[I 2023-04-26 02:20:42,839][39m Trial 426 finished with value: 0.8148148148148149 and parameters: {'criterion': 'entropy', 'n_estimators': 134, 'max_features': 0.653292259279427, 'max_depth': 76, 'min_samples_split': 3, 'min_samples_leaf': 2}. Best is trial 61 with value: 0.8604651162790697.
[32m[I 2023-04-26 02:20:43,070][39m Trial 427 finished with value: 0.8192771084337348 and parameters: {'criterion': 'entropy', 'n_estimators': 201, 'max_features': 0.609890303953611, 'max_depth': 57, 'min_samples_split': 3, 'min_samples_leaf': 2}. Best is trial 61 with value: 0.8604651162790697.
[32m[I 2023-04-26 02:20:43,237][39m Trial 428 finished with value: 0.8139534883720929 and parameters: {'criterion': 'entropy', 'n_estimators': 145, 'max_features': 0.6611857806057863, 'max_depth': 58, 'min_samples_split': 2, 'min_samples_leaf': 5}. Best is trial 61 with value: 0.8604651162790697.
[32m[I 2023-04-26 02:20:43,382][39m Trial 429 finished with value: 0.8372093023255814 and parameters: {'criterion': 'gini', 'n_estimators': 137, 'max_features': 0.6886808117968576, 'max_depth': 85, 'min_samples_split': 2, 'min_samples_leaf': 4}. Best is trial 61 with value: 0.8604651162790697.
[32m[I 2023-04-26 02:20:43,542][39m Trial 430 finished with value: 0.8470588235294119 and parameters: {'criterion': 'entropy', 'n_estimators': 128, 'max_features': 0.6772489392171872, 'max_depth': 83, 'min_samples_split': 6, 'min_samples_leaf': 4}. Best is trial 61 with value: 0.8604651162790697.
[32m[I 2023-04-26 02:20:43,625][39m Trial 431 finished with value: 0.7857142857142858 and parameters: {'criterion': 'entropy', 'n_estimators': 63, 'max_features': 0.6691572955900754, 'max_depth': 101, 'min_samples_split': 3, 'min_samples_leaf': 4}. Best is trial 61 with value: 0.8604651162790697.
[32m[I 2023-04-26 02:20:43,750][39m Trial 432 finished with value: 0.8095238095238095 and parameters: {'criterion': 'entropy', 'n_estimators': 100, 'max_features': 0.5937533777582529, 'max_depth': 71, 'min_samples_split': 3, 'min_samples_leaf': 4}. Best is trial 61 with value: 0.8604651162790697.
[32m[I 2023-04-26 02:20:43,827][39m Trial 433 finished with value: 0.8604651162790697 and parameters: {'criterion': 'entropy', 'n_estimators': 58, 'max_features': 0.6325981932705202, 'max_depth': 80, 'min_samples_split': 3, 'min_samples_leaf': 4}. Best is trial 61 with value: 0.8604651162790697.
[32m[I 2023-04-26 02:20:43,910][39m Trial 434 finished with value: 0.8604651162790697 and parameters: {'criterion': 'entropy', 'n_estimators': 59, 'max_features': 0.6295221739201162, 'max_depth': 31, 'min_samples_split': 2, 'min_samples_leaf': 4}. Best is trial 61 with value: 0.8604651162790697.
[32m[I 2023-04-26 02:20:43,986][39m Trial 435 finished with value: 0.7654320987654322 and parameters: {'criterion': 'entropy', 'n_estimators': 52, 'max_features': 0.5646385065553011, 'max_depth': 80, 'min_samples_split': 4, 'min_samples_leaf': 2}. Best is trial 61 with value: 0.8604651162790697.
[32m[I 2023-04-26 02:20:44,067][39m Trial 436 finished with value: 0.8192771084337348 and parameters: {'criterion': 'entropy', 'n_estimators': 57, 'max_features': 0.6279536331330994, 'max_depth': 74, 'min_samples_split': 2, 'min_samples_leaf': 4}. Best is trial 61 with value: 0.8604651162790697.
[32m[I 2023-04-26 02:20:44,143][39m Trial 437 finished with value: 0.8604651162790697 and parameters: {'criterion': 'entropy', 'n_estimators': 58, 'max_features': 0.5839227711189544, 'max_depth': 31, 'min_samples_split': 3, 'min_samples_leaf': 4}. Best is trial 61 with value: 0.8604651162790697.
