[32m[I 2023-04-26 02:19:53,182][39m Trial 146 finished with value: 0.8275862068965518 and parameters: {'criterion': 'entropy', 'n_estimators': 65, 'max_features': 0.6890409304093552, 'max_depth': 70, 'min_samples_split': 2, 'min_samples_leaf': 4}. Best is trial 61 with value: 0.8604651162790697.
[32m[I 2023-04-26 02:19:53,387][39m Trial 147 finished with value: 0.8095238095238095 and parameters: {'criterion': 'entropy', 'n_estimators': 187, 'max_features': 0.6448405604814932, 'max_depth': 73, 'min_samples_split': 3, 'min_samples_leaf': 4}. Best is trial 61 with value: 0.8604651162790697.
[32m[I 2023-04-26 02:19:53,618][39m Trial 148 finished with value: 0.7951807228915663 and parameters: {'criterion': 'entropy', 'n_estimators': 177, 'max_features': 0.8450796433945874, 'max_depth': 60, 'min_samples_split': 7, 'min_samples_leaf': 3}. Best is trial 61 with value: 0.8604651162790697.
[32m[I 2023-04-26 02:19:53,866][39m Trial 149 finished with value: 0.8181818181818182 and parameters: {'criterion': 'entropy', 'n_estimators': 201, 'max_features': 0.940357615791266, 'max_depth': 56, 'min_samples_split': 6, 'min_samples_leaf': 7}. Best is trial 61 with value: 0.8604651162790697.
[32m[I 2023-04-26 02:19:54,067][39m Trial 150 finished with value: 0.8235294117647058 and parameters: {'criterion': 'entropy', 'n_estimators': 188, 'max_features': 0.5996073198743365, 'max_depth': 77, 'min_samples_split': 10, 'min_samples_leaf': 4}. Best is trial 61 with value: 0.8604651162790697.
[32m[I 2023-04-26 02:19:54,277][39m Trial 151 finished with value: 0.8292682926829268 and parameters: {'criterion': 'entropy', 'n_estimators': 152, 'max_features': 0.9022396226771121, 'max_depth': 42, 'min_samples_split': 5, 'min_samples_leaf': 2}. Best is trial 61 with value: 0.8604651162790697.
[32m[I 2023-04-26 02:19:54,499][39m Trial 152 finished with value: 0.8333333333333333 and parameters: {'criterion': 'entropy', 'n_estimators': 196, 'max_features': 0.6197512337841424, 'max_depth': 72, 'min_samples_split': 6, 'min_samples_leaf': 4}. Best is trial 61 with value: 0.8604651162790697.
[32m[I 2023-04-26 02:19:54,602][39m Trial 153 finished with value: 0.8505747126436782 and parameters: {'criterion': 'entropy', 'n_estimators': 86, 'max_features': 0.665405605620576, 'max_depth': 65, 'min_samples_split': 3, 'min_samples_leaf': 4}. Best is trial 61 with value: 0.8604651162790697.
[32m[I 2023-04-26 02:19:54,790][39m Trial 154 finished with value: 0.8192771084337348 and parameters: {'criterion': 'entropy', 'n_estimators': 163, 'max_features': 0.7074780443782571, 'max_depth': 97, 'min_samples_split': 3, 'min_samples_leaf': 3}. Best is trial 61 with value: 0.8604651162790697.
[32m[I 2023-04-26 02:19:54,963][39m Trial 155 finished with value: 0.8333333333333333 and parameters: {'criterion': 'entropy', 'n_estimators': 147, 'max_features': 0.6591285323232021, 'max_depth': 66, 'min_samples_split': 3, 'min_samples_leaf': 4}. Best is trial 61 with value: 0.8604651162790697.
[32m[I 2023-04-26 02:19:55,186][39m Trial 156 finished with value: 0.8181818181818182 and parameters: {'criterion': 'entropy', 'n_estimators': 197, 'max_features': 0.6746359377699603, 'max_depth': 63, 'min_samples_split': 3, 'min_samples_leaf': 4}. Best is trial 61 with value: 0.8604651162790697.
[32m[I 2023-04-26 02:19:55,383][39m Trial 157 finished with value: 0.8045977011494252 and parameters: {'criterion': 'gini', 'n_estimators': 191, 'max_features': 0.7576969803313526, 'max_depth': 76, 'min_samples_split': 4, 'min_samples_leaf': 5}. Best is trial 61 with value: 0.8604651162790697.
[32m[I 2023-04-26 02:19:55,609][39m Trial 158 finished with value: 0.8372093023255814 and parameters: {'criterion': 'entropy', 'n_estimators': 193, 'max_features': 0.7277114733718983, 'max_depth': 65, 'min_samples_split': 2, 'min_samples_leaf': 4}. Best is trial 61 with value: 0.8604651162790697.
[32m[I 2023-04-26 02:19:55,726][39m Trial 159 finished with value: 0.8372093023255814 and parameters: {'criterion': 'entropy', 'n_estimators': 98, 'max_features': 0.6466641756264494, 'max_depth': 69, 'min_samples_split': 3, 'min_samples_leaf': 5}. Best is trial 61 with value: 0.8604651162790697.
[32m[I 2023-04-26 02:19:55,931][39m Trial 160 finished with value: 0.8433734939759037 and parameters: {'criterion': 'entropy', 'n_estimators': 198, 'max_features': 0.5292707052651957, 'max_depth': 84, 'min_samples_split': 3, 'min_samples_leaf': 4}. Best is trial 61 with value: 0.8604651162790697.
[32m[I 2023-04-26 02:19:56,165][39m Trial 161 finished with value: 0.8139534883720929 and parameters: {'criterion': 'entropy', 'n_estimators': 201, 'max_features': 0.6894537328606984, 'max_depth': 59, 'min_samples_split': 3, 'min_samples_leaf': 4}. Best is trial 61 with value: 0.8604651162790697.
[32m[I 2023-04-26 02:19:56,359][39m Trial 162 finished with value: 0.8333333333333333 and parameters: {'criterion': 'entropy', 'n_estimators': 161, 'max_features': 0.8202903007222093, 'max_depth': 46, 'min_samples_split': 4, 'min_samples_leaf': 3}. Best is trial 61 with value: 0.8604651162790697.
[32m[I 2023-04-26 02:19:56,498][39m Trial 163 finished with value: 0.8314606741573034 and parameters: {'criterion': 'entropy', 'n_estimators': 92, 'max_features': 0.9340498941977876, 'max_depth': 48, 'min_samples_split': 5, 'min_samples_leaf': 4}. Best is trial 61 with value: 0.8604651162790697.
[32m[I 2023-04-26 02:19:56,589][39m Trial 164 finished with value: 0.8372093023255814 and parameters: {'criterion': 'entropy', 'n_estimators': 73, 'max_features': 0.7709317518747193, 'max_depth': 51, 'min_samples_split': 2, 'min_samples_leaf': 4}. Best is trial 61 with value: 0.8604651162790697.
[32m[I 2023-04-26 02:19:56,750][39m Trial 165 finished with value: 0.8192771084337348 and parameters: {'criterion': 'entropy', 'n_estimators': 131, 'max_features': 0.6674291131366694, 'max_depth': 62, 'min_samples_split': 3, 'min_samples_leaf': 3}. Best is trial 61 with value: 0.8604651162790697.
[32m[I 2023-04-26 02:19:56,848][39m Trial 166 finished with value: 0.8292682926829268 and parameters: {'criterion': 'entropy', 'n_estimators': 84, 'max_features': 0.6007178536477191, 'max_depth': 70, 'min_samples_split': 3, 'min_samples_leaf': 4}. Best is trial 61 with value: 0.8604651162790697.
[32m[I 2023-04-26 02:19:57,053][39m Trial 167 finished with value: 0.7999999999999999 and parameters: {'criterion': 'entropy', 'n_estimators': 186, 'max_features': 0.625757069980283, 'max_depth': 67, 'min_samples_split': 4, 'min_samples_leaf': 5}. Best is trial 61 with value: 0.8604651162790697.
[32m[I 2023-04-26 02:19:57,159][39m Trial 168 finished with value: 0.8433734939759037 and parameters: {'criterion': 'entropy', 'n_estimators': 69, 'max_features': 0.9558143965039108, 'max_depth': 39, 'min_samples_split': 5, 'min_samples_leaf': 2}. Best is trial 61 with value: 0.8604651162790697.
[32m[I 2023-04-26 02:19:57,290][39m Trial 169 finished with value: 0.8275862068965518 and parameters: {'criterion': 'entropy', 'n_estimators': 101, 'max_features': 0.8042368688353231, 'max_depth': 44, 'min_samples_split': 2, 'min_samples_leaf': 3}. Best is trial 61 with value: 0.8604651162790697.
[32m[I 2023-04-26 02:19:57,493][39m Trial 170 finished with value: 0.8048780487804877 and parameters: {'criterion': 'entropy', 'n_estimators': 181, 'max_features': 0.5768143522026851, 'max_depth': 74, 'min_samples_split': 6, 'min_samples_leaf': 2}. Best is trial 61 with value: 0.8604651162790697.
[32m[I 2023-04-26 02:19:57,647][39m Trial 171 finished with value: 0.7848101265822786 and parameters: {'criterion': 'entropy', 'n_estimators': 113, 'max_features': 0.8672102512069749, 'max_depth': 45, 'min_samples_split': 5, 'min_samples_leaf': 2}. Best is trial 61 with value: 0.8604651162790697.
[32m[I 2023-04-26 02:19:57,794][39m Trial 172 finished with value: 0.8505747126436782 and parameters: {'criterion': 'entropy', 'n_estimators': 123, 'max_features': 0.6981595437254831, 'max_depth': 80, 'min_samples_split': 3, 'min_samples_leaf': 4}. Best is trial 61 with value: 0.8604651162790697.
[32m[I 2023-04-26 02:19:57,971][39m Trial 173 finished with value: 0.8470588235294119 and parameters: {'criterion': 'entropy', 'n_estimators': 156, 'max_features': 0.7040267367608948, 'max_depth': 48, 'min_samples_split': 4, 'min_samples_leaf': 4}. Best is trial 61 with value: 0.8604651162790697.
[32m[I 2023-04-26 02:19:58,130][39m Trial 174 finished with value: 0.8235294117647058 and parameters: {'criterion': 'entropy', 'n_estimators': 126, 'max_features': 0.7465493458452457, 'max_depth': 32, 'min_samples_split': 3, 'min_samples_leaf': 4}. Best is trial 61 with value: 0.8604651162790697.
[32m[I 2023-04-26 02:19:58,352][39m Trial 175 finished with value: 0.8139534883720929 and parameters: {'criterion': 'entropy', 'n_estimators': 194, 'max_features': 0.7187672650958818, 'max_depth': 65, 'min_samples_split': 3, 'min_samples_leaf': 4}. Best is trial 61 with value: 0.8604651162790697.
[32m[I 2023-04-26 02:19:58,580][39m Trial 176 finished with value: 0.8372093023255814 and parameters: {'criterion': 'entropy', 'n_estimators': 199, 'max_features': 0.6817888164936149, 'max_depth': 64, 'min_samples_split': 3, 'min_samples_leaf': 4}. Best is trial 61 with value: 0.8604651162790697.
[32m[I 2023-04-26 02:19:58,728][39m Trial 177 finished with value: 0.8409090909090909 and parameters: {'criterion': 'entropy', 'n_estimators': 124, 'max_features': 0.7102647591502044, 'max_depth': 49, 'min_samples_split': 3, 'min_samples_leaf': 4}. Best is trial 61 with value: 0.8604651162790697.
[32m[I 2023-04-26 02:19:58,921][39m Trial 178 finished with value: 0.8181818181818182 and parameters: {'criterion': 'entropy', 'n_estimators': 166, 'max_features': 0.6463072597617405, 'max_depth': 80, 'min_samples_split': 2, 'min_samples_leaf': 5}. Best is trial 61 with value: 0.8604651162790697.
[32m[I 2023-04-26 02:19:59,037][39m Trial 179 finished with value: 0.7865168539325843 and parameters: {'criterion': 'entropy', 'n_estimators': 105, 'max_features': 0.6637319928436642, 'max_depth': 78, 'min_samples_split': 3, 'min_samples_leaf': 8}. Best is trial 61 with value: 0.8604651162790697.
[32m[I 2023-04-26 02:19:59,166][39m Trial 180 finished with value: 0.8192771084337348 and parameters: {'criterion': 'gini', 'n_estimators': 118, 'max_features': 0.7445263409516211, 'max_depth': 41, 'min_samples_split': 4, 'min_samples_leaf': 3}. Best is trial 61 with value: 0.8604651162790697.
[32m[I 2023-04-26 02:19:59,352][39m Trial 181 finished with value: 0.8470588235294119 and parameters: {'criterion': 'entropy', 'n_estimators': 156, 'max_features': 0.699138871440312, 'max_depth': 86, 'min_samples_split': 4, 'min_samples_leaf': 4}. Best is trial 61 with value: 0.8604651162790697.
[32m[I 2023-04-26 02:19:59,527][39m Trial 182 finished with value: 0.8139534883720929 and parameters: {'criterion': 'entropy', 'n_estimators': 154, 'max_features': 0.6977215443968879, 'max_depth': 82, 'min_samples_split': 4, 'min_samples_leaf': 4}. Best is trial 61 with value: 0.8604651162790697.
[32m[I 2023-04-26 02:19:59,659][39m Trial 183 finished with value: 0.8470588235294119 and parameters: {'criterion': 'entropy', 'n_estimators': 87, 'max_features': 0.9264262244722588, 'max_depth': 43, 'min_samples_split': 3, 'min_samples_leaf': 2}. Best is trial 61 with value: 0.8604651162790697.
[32m[I 2023-04-26 02:19:59,765][39m Trial 184 finished with value: 0.7999999999999999 and parameters: {'criterion': 'entropy', 'n_estimators': 88, 'max_features': 0.6319108278314309, 'max_depth': 75, 'min_samples_split': 3, 'min_samples_leaf': 4}. Best is trial 61 with value: 0.8604651162790697.
[32m[I 2023-04-26 02:19:59,930][39m Trial 185 finished with value: 0.8604651162790697 and parameters: {'criterion': 'entropy', 'n_estimators': 138, 'max_features': 0.681182080813216, 'max_depth': 36, 'min_samples_split': 3, 'min_samples_leaf': 4}. Best is trial 61 with value: 0.8604651162790697.
[32m[I 2023-04-26 02:20:00,132][39m Trial 186 finished with value: 0.8314606741573034 and parameters: {'criterion': 'entropy', 'n_estimators': 150, 'max_features': 0.9995950553650731, 'max_depth': 88, 'min_samples_split': 3, 'min_samples_leaf': 4}. Best is trial 61 with value: 0.8604651162790697.
[32m[I 2023-04-26 02:20:00,292][39m Trial 187 finished with value: 0.8470588235294119 and parameters: {'criterion': 'entropy', 'n_estimators': 135, 'max_features': 0.6558197703597006, 'max_depth': 34, 'min_samples_split': 2, 'min_samples_leaf': 4}. Best is trial 61 with value: 0.8604651162790697.
[32m[I 2023-04-26 02:20:00,459][39m Trial 188 finished with value: 0.8139534883720929 and parameters: {'criterion': 'entropy', 'n_estimators': 143, 'max_features': 0.678215875938989, 'max_depth': 60, 'min_samples_split': 3, 'min_samples_leaf': 4}. Best is trial 61 with value: 0.8604651162790697.
[32m[I 2023-04-26 02:20:00,600][39m Trial 189 finished with value: 0.8235294117647058 and parameters: {'criterion': 'entropy', 'n_estimators': 123, 'max_features': 0.6416992363802461, 'max_depth': 37, 'min_samples_split': 3, 'min_samples_leaf': 4}. Best is trial 61 with value: 0.8604651162790697.
[32m[I 2023-04-26 02:20:00,766][39m Trial 190 finished with value: 0.8409090909090909 and parameters: {'criterion': 'entropy', 'n_estimators': 138, 'max_features': 0.7730033154345521, 'max_depth': 30, 'min_samples_split': 2, 'min_samples_leaf': 5}. Best is trial 61 with value: 0.8604651162790697.
[32m[I 2023-04-26 02:20:00,958][39m Trial 191 finished with value: 0.8505747126436782 and parameters: {'criterion': 'entropy', 'n_estimators': 158, 'max_features': 0.7285692859345279, 'max_depth': 48, 'min_samples_split': 4, 'min_samples_leaf': 3}. Best is trial 61 with value: 0.8604651162790697.
[32m[I 2023-04-26 02:20:01,123][39m Trial 192 finished with value: 0.8372093023255814 and parameters: {'criterion': 'entropy', 'n_estimators': 136, 'max_features': 0.7247337181074062, 'max_depth': 34, 'min_samples_split': 2, 'min_samples_leaf': 4}. Best is trial 61 with value: 0.8604651162790697.
[32m[I 2023-04-26 02:20:01,284][39m Trial 193 finished with value: 0.8095238095238095 and parameters: {'criterion': 'entropy', 'n_estimators': 130, 'max_features': 0.7359596774988986, 'max_depth': 68, 'min_samples_split': 4, 'min_samples_leaf': 3}. Best is trial 61 with value: 0.8604651162790697.
[32m[I 2023-04-26 02:20:01,366][39m Trial 194 finished with value: 0.8372093023255814 and parameters: {'criterion': 'entropy', 'n_estimators': 54, 'max_features': 0.8989881169204699, 'max_depth': 42, 'min_samples_split': 5, 'min_samples_leaf': 3}. Best is trial 61 with value: 0.8604651162790697.
[32m[I 2023-04-26 02:20:01,527][39m Trial 195 finished with value: 0.8333333333333333 and parameters: {'criterion': 'entropy', 'n_estimators': 141, 'max_features': 0.6572495113301107, 'max_depth': 36, 'min_samples_split': 2, 'min_samples_leaf': 4}. Best is trial 61 with value: 0.8604651162790697.
[32m[I 2023-04-26 02:20:01,722][39m Trial 196 finished with value: 0.8314606741573034 and parameters: {'criterion': 'entropy', 'n_estimators': 159, 'max_features': 0.6848008509410898, 'max_depth': 72, 'min_samples_split': 3, 'min_samples_leaf': 4}. Best is trial 61 with value: 0.8604651162790697.
[32m[I 2023-04-26 02:20:01,905][39m Trial 197 finished with value: 0.8372093023255814 and parameters: {'criterion': 'entropy', 'n_estimators': 156, 'max_features': 0.7006773920934433, 'max_depth': 98, 'min_samples_split': 4, 'min_samples_leaf': 4}. Best is trial 61 with value: 0.8604651162790697.
[32m[I 2023-04-26 02:20:02,057][39m Trial 198 finished with value: 0.8372093023255814 and parameters: {'criterion': 'entropy', 'n_estimators': 134, 'max_features': 0.6080787798651903, 'max_depth': 32, 'min_samples_split': 2, 'min_samples_leaf': 4}. Best is trial 61 with value: 0.8604651162790697.
[32m[I 2023-04-26 02:20:02,291][39m Trial 199 finished with value: 0.8292682926829268 and parameters: {'criterion': 'entropy', 'n_estimators': 195, 'max_features': 0.6777333651333963, 'max_depth': 63, 'min_samples_split': 3, 'min_samples_leaf': 2}. Best is trial 61 with value: 0.8604651162790697.
[32m[I 2023-04-26 02:20:02,499][39m Trial 200 finished with value: 0.8372093023255814 and parameters: {'criterion': 'entropy', 'n_estimators': 171, 'max_features': 0.7913109402095598, 'max_depth': 51, 'min_samples_split': 3, 'min_samples_leaf': 5}. Best is trial 61 with value: 0.8604651162790697.
[32m[I 2023-04-26 02:20:02,709][39m Trial 201 finished with value: 0.8089887640449439 and parameters: {'criterion': 'entropy', 'n_estimators': 156, 'max_features': 0.9249316097517833, 'max_depth': 46, 'min_samples_split': 4, 'min_samples_leaf': 4}. Best is trial 61 with value: 0.8604651162790697.
[32m[I 2023-04-26 02:20:02,797][39m Trial 202 finished with value: 0.8 and parameters: {'criterion': 'entropy', 'n_estimators': 62, 'max_features': 0.7105777039781386, 'max_depth': 49, 'min_samples_split': 3, 'min_samples_leaf': 2}. Best is trial 61 with value: 0.8604651162790697.
[32m[I 2023-04-26 02:20:02,946][39m Trial 203 finished with value: 0.8604651162790697 and parameters: {'criterion': 'entropy', 'n_estimators': 128, 'max_features': 0.6581546761676836, 'max_depth': 55, 'min_samples_split': 4, 'min_samples_leaf': 4}. Best is trial 61 with value: 0.8604651162790697.
[32m[I 2023-04-26 02:20:03,143][39m Trial 204 finished with value: 0.8292682926829268 and parameters: {'criterion': 'entropy', 'n_estimators': 162, 'max_features': 0.7210558167244063, 'max_depth': 55, 'min_samples_split': 4, 'min_samples_leaf': 3}. Best is trial 61 with value: 0.8604651162790697.
[32m[I 2023-04-26 02:20:03,326][39m Trial 205 finished with value: 0.8372093023255814 and parameters: {'criterion': 'entropy', 'n_estimators': 151, 'max_features': 0.6932208480002837, 'max_depth': 48, 'min_samples_split': 5, 'min_samples_leaf': 4}. Best is trial 61 with value: 0.8604651162790697.
[32m[I 2023-04-26 02:20:03,477][39m Trial 206 finished with value: 0.7999999999999999 and parameters: {'criterion': 'entropy', 'n_estimators': 128, 'max_features': 0.6650001651250569, 'max_depth': 57, 'min_samples_split': 4, 'min_samples_leaf': 4}. Best is trial 61 with value: 0.8604651162790697.
[32m[I 2023-04-26 02:20:03,633][39m Trial 207 finished with value: 0.8604651162790697 and parameters: {'criterion': 'entropy', 'n_estimators': 135, 'max_features': 0.6562239846635165, 'max_depth': 94, 'min_samples_split': 2, 'min_samples_leaf': 4}. Best is trial 61 with value: 0.8604651162790697.
[32m[I 2023-04-26 02:20:03,785][39m Trial 208 finished with value: 0.7906976744186047 and parameters: {'criterion': 'entropy', 'n_estimators': 129, 'max_features': 0.6251409846738775, 'max_depth': 94, 'min_samples_split': 2, 'min_samples_leaf': 4}. Best is trial 61 with value: 0.8604651162790697.
[32m[I 2023-04-26 02:20:03,968][39m Trial 209 finished with value: 0.8372093023255814 and parameters: {'criterion': 'entropy', 'n_estimators': 148, 'max_features': 0.7600361926360922, 'max_depth': 96, 'min_samples_split': 4, 'min_samples_leaf': 4}. Best is trial 61 with value: 0.8604651162790697.
[32m[I 2023-04-26 02:20:04,204][39m Trial 210 finished with value: 0.8604651162790697 and parameters: {'criterion': 'entropy', 'n_estimators': 201, 'max_features': 0.6853060512666108, 'max_depth': 86, 'min_samples_split': 3, 'min_samples_leaf': 4}. Best is trial 61 with value: 0.8604651162790697.
[32m[I 2023-04-26 02:20:04,325][39m Trial 211 finished with value: 0.8470588235294119 and parameters: {'criterion': 'entropy', 'n_estimators': 80, 'max_features': 0.9618758449824221, 'max_depth': 84, 'min_samples_split': 3, 'min_samples_leaf': 2}. Best is trial 61 with value: 0.8604651162790697.
[32m[I 2023-04-26 02:20:04,484][39m Trial 212 finished with value: 0.8505747126436782 and parameters: {'criterion': 'entropy', 'n_estimators': 135, 'max_features': 0.6523895500332793, 'max_depth': 82, 'min_samples_split': 2, 'min_samples_leaf': 4}. Best is trial 61 with value: 0.8604651162790697.
[32m[I 2023-04-26 02:20:04,638][39m Trial 213 finished with value: 0.8275862068965518 and parameters: {'criterion': 'entropy', 'n_estimators': 133, 'max_features': 0.6421948095622043, 'max_depth': 100, 'min_samples_split': 2, 'min_samples_leaf': 4}. Best is trial 61 with value: 0.8604651162790697.
[32m[I 2023-04-26 02:20:04,793][39m Trial 214 finished with value: 0.8275862068965518 and parameters: {'criterion': 'entropy', 'n_estimators': 126, 'max_features': 0.6711025103652714, 'max_depth': 93, 'min_samples_split': 2, 'min_samples_leaf': 4}. Best is trial 61 with value: 0.8604651162790697.
[32m[I 2023-04-26 02:20:04,956][39m Trial 215 finished with value: 0.8095238095238095 and parameters: {'criterion': 'entropy', 'n_estimators': 139, 'max_features': 0.6496558210012293, 'max_depth': 83, 'min_samples_split': 3, 'min_samples_leaf': 4}. Best is trial 61 with value: 0.8604651162790697.
[32m[I 2023-04-26 02:20:05,110][39m Trial 216 finished with value: 0.8372093023255814 and parameters: {'criterion': 'entropy', 'n_estimators': 130, 'max_features': 0.6840068216629428, 'max_depth': 90, 'min_samples_split': 3, 'min_samples_leaf': 5}. Best is trial 61 with value: 0.8604651162790697.
[32m[I 2023-04-26 02:20:05,334][39m Trial 217 finished with value: 0.8095238095238095 and parameters: {'criterion': 'entropy', 'n_estimators': 201, 'max_features': 0.6594972729178562, 'max_depth': 82, 'min_samples_split': 2, 'min_samples_leaf': 4}. Best is trial 61 with value: 0.8604651162790697.
[32m[I 2023-04-26 02:20:05,569][39m Trial 218 finished with value: 0.8505747126436782 and parameters: {'criterion': 'entropy', 'n_estimators': 197, 'max_features': 0.7249807724345242, 'max_depth': 79, 'min_samples_split': 2, 'min_samples_leaf': 4}. Best is trial 61 with value: 0.8604651162790697.
