[32m[I 2023-04-26 12:33:05,207][39m Trial 270 finished with value: 0.8275862068965517 and parameters: {'algorithm': 'ball_tree', 'n_neighbors': 3, 'weights': 'distance', 'metric': 'manhattan'}. Best is trial 44 with value: 0.8571428571428572.
[32m[I 2023-04-26 12:33:05,216][39m Trial 271 finished with value: 0.8181818181818181 and parameters: {'algorithm': 'auto', 'n_neighbors': 7, 'weights': 'distance', 'metric': 'manhattan'}. Best is trial 44 with value: 0.8571428571428572.
[32m[I 2023-04-26 12:33:05,245][39m Trial 272 finished with value: 0.8571428571428572 and parameters: {'algorithm': 'brute', 'n_neighbors': 8, 'weights': 'distance', 'metric': 'manhattan'}. Best is trial 44 with value: 0.8571428571428572.
[32m[I 2023-04-26 12:33:05,263][39m Trial 273 finished with value: 0.8571428571428572 and parameters: {'algorithm': 'kd_tree', 'n_neighbors': 6, 'weights': 'distance', 'metric': 'manhattan'}. Best is trial 44 with value: 0.8571428571428572.
[32m[I 2023-04-26 12:33:05,279][39m Trial 274 finished with value: 0.8288288288288289 and parameters: {'algorithm': 'kd_tree', 'n_neighbors': 12, 'weights': 'distance', 'metric': 'manhattan'}. Best is trial 44 with value: 0.8571428571428572.
[32m[I 2023-04-26 12:33:05,296][39m Trial 275 finished with value: 0.8571428571428572 and parameters: {'algorithm': 'ball_tree', 'n_neighbors': 8, 'weights': 'distance', 'metric': 'manhattan'}. Best is trial 44 with value: 0.8571428571428572.
[32m[I 2023-04-26 12:33:05,313][39m Trial 276 finished with value: 0.8181818181818181 and parameters: {'algorithm': 'auto', 'n_neighbors': 7, 'weights': 'distance', 'metric': 'manhattan'}. Best is trial 44 with value: 0.8571428571428572.
[32m[I 2023-04-26 12:33:05,329][39m Trial 277 finished with value: 0.8571428571428572 and parameters: {'algorithm': 'auto', 'n_neighbors': 6, 'weights': 'distance', 'metric': 'manhattan'}. Best is trial 44 with value: 0.8571428571428572.
[32m[I 2023-04-26 12:33:05,349][39m Trial 278 finished with value: 0.8545454545454546 and parameters: {'algorithm': 'kd_tree', 'n_neighbors': 5, 'weights': 'uniform', 'metric': 'manhattan'}. Best is trial 44 with value: 0.8571428571428572.
[32m[I 2023-04-26 12:33:05,360][39m Trial 279 finished with value: 0.831858407079646 and parameters: {'algorithm': 'kd_tree', 'n_neighbors': 9, 'weights': 'distance', 'metric': 'manhattan'}. Best is trial 44 with value: 0.8571428571428572.
[32m[I 2023-04-26 12:33:05,369][39m Trial 280 finished with value: 0.8392857142857144 and parameters: {'algorithm': 'ball_tree', 'n_neighbors': 10, 'weights': 'distance', 'metric': 'manhattan'}. Best is trial 44 with value: 0.8571428571428572.
[32m[I 2023-04-26 12:33:05,397][39m Trial 281 finished with value: 0.8571428571428572 and parameters: {'algorithm': 'brute', 'n_neighbors': 5, 'weights': 'distance', 'metric': 'manhattan'}. Best is trial 44 with value: 0.8571428571428572.
[32m[I 2023-04-26 12:33:05,414][39m Trial 282 finished with value: 0.8571428571428572 and parameters: {'algorithm': 'kd_tree', 'n_neighbors': 5, 'weights': 'distance', 'metric': 'manhattan'}. Best is trial 44 with value: 0.8571428571428572.
[32m[I 2023-04-26 12:33:05,431][39m Trial 283 finished with value: 0.8571428571428572 and parameters: {'algorithm': 'auto', 'n_neighbors': 6, 'weights': 'distance', 'metric': 'manhattan'}. Best is trial 44 with value: 0.8571428571428572.
[32m[I 2023-04-26 12:33:05,448][39m Trial 284 finished with value: 0.8181818181818181 and parameters: {'algorithm': 'auto', 'n_neighbors': 7, 'weights': 'distance', 'metric': 'manhattan'}. Best is trial 44 with value: 0.8571428571428572.
[32m[I 2023-04-26 12:33:05,464][39m Trial 285 finished with value: 0.8571428571428572 and parameters: {'algorithm': 'kd_tree', 'n_neighbors': 6, 'weights': 'distance', 'metric': 'manhattan'}. Best is trial 44 with value: 0.8571428571428572.
[32m[I 2023-04-26 12:33:05,481][39m Trial 286 finished with value: 0.8571428571428572 and parameters: {'algorithm': 'kd_tree', 'n_neighbors': 5, 'weights': 'distance', 'metric': 'manhattan'}. Best is trial 44 with value: 0.8571428571428572.
[32m[I 2023-04-26 12:33:05,496][39m Trial 287 finished with value: 0.831858407079646 and parameters: {'algorithm': 'kd_tree', 'n_neighbors': 4, 'weights': 'distance', 'metric': 'manhattan'}. Best is trial 44 with value: 0.8571428571428572.
[32m[I 2023-04-26 12:33:05,505][39m Trial 288 finished with value: 0.8571428571428572 and parameters: {'algorithm': 'auto', 'n_neighbors': 6, 'weights': 'distance', 'metric': 'manhattan'}. Best is trial 44 with value: 0.8571428571428572.
[32m[I 2023-04-26 12:33:05,516][39m Trial 289 finished with value: 0.8545454545454546 and parameters: {'algorithm': 'kd_tree', 'n_neighbors': 5, 'weights': 'distance', 'metric': 'euclidean'}. Best is trial 44 with value: 0.8571428571428572.
[32m[I 2023-04-26 12:33:05,525][39m Trial 290 finished with value: 0.8495575221238938 and parameters: {'algorithm': 'ball_tree', 'n_neighbors': 9, 'weights': 'distance', 'metric': 'minkowski'}. Best is trial 44 with value: 0.8571428571428572.
[32m[I 2023-04-26 12:33:05,540][39m Trial 291 finished with value: 0.8181818181818181 and parameters: {'algorithm': 'ball_tree', 'n_neighbors': 7, 'weights': 'distance', 'metric': 'manhattan'}. Best is trial 44 with value: 0.8571428571428572.
[32m[I 2023-04-26 12:33:05,550][39m Trial 292 finished with value: 0.8571428571428572 and parameters: {'algorithm': 'kd_tree', 'n_neighbors': 5, 'weights': 'distance', 'metric': 'manhattan'}. Best is trial 44 with value: 0.8571428571428572.
[32m[I 2023-04-26 12:33:05,562][39m Trial 293 finished with value: 0.831858407079646 and parameters: {'algorithm': 'kd_tree', 'n_neighbors': 4, 'weights': 'distance', 'metric': 'manhattan'}. Best is trial 44 with value: 0.8571428571428572.
[32m[I 2023-04-26 12:33:05,575][39m Trial 294 finished with value: 0.8181818181818181 and parameters: {'algorithm': 'auto', 'n_neighbors': 7, 'weights': 'distance', 'metric': 'manhattan'}. Best is trial 44 with value: 0.8571428571428572.
[32m[I 2023-04-26 12:33:05,585][39m Trial 295 finished with value: 0.8288288288288289 and parameters: {'algorithm': 'kd_tree', 'n_neighbors': 17, 'weights': 'distance', 'metric': 'manhattan'}. Best is trial 44 with value: 0.8571428571428572.
[32m[I 2023-04-26 12:33:05,596][39m Trial 296 finished with value: 0.8571428571428572 and parameters: {'algorithm': 'kd_tree', 'n_neighbors': 6, 'weights': 'distance', 'metric': 'manhattan'}. Best is trial 44 with value: 0.8571428571428572.
[32m[I 2023-04-26 12:33:05,607][39m Trial 297 finished with value: 0.8181818181818181 and parameters: {'algorithm': 'kd_tree', 'n_neighbors': 21, 'weights': 'distance', 'metric': 'manhattan'}. Best is trial 44 with value: 0.8571428571428572.
[32m[I 2023-04-26 12:33:05,616][39m Trial 298 finished with value: 0.831858407079646 and parameters: {'algorithm': 'kd_tree', 'n_neighbors': 4, 'weights': 'distance', 'metric': 'manhattan'}. Best is trial 44 with value: 0.8571428571428572.
[32m[I 2023-04-26 12:33:05,626][39m Trial 299 finished with value: 0.8181818181818181 and parameters: {'algorithm': 'auto', 'n_neighbors': 7, 'weights': 'distance', 'metric': 'manhattan'}. Best is trial 44 with value: 0.8571428571428572.
[32m[I 2023-04-26 12:33:05,638][39m Trial 300 finished with value: 0.8545454545454546 and parameters: {'algorithm': 'kd_tree', 'n_neighbors': 5, 'weights': 'uniform', 'metric': 'manhattan'}. Best is trial 44 with value: 0.8571428571428572.
[32m[I 2023-04-26 12:33:05,648][39m Trial 301 finished with value: 0.831858407079646 and parameters: {'algorithm': 'ball_tree', 'n_neighbors': 9, 'weights': 'distance', 'metric': 'manhattan'}. Best is trial 44 with value: 0.8571428571428572.
[32m[I 2023-04-26 12:33:05,659][39m Trial 302 finished with value: 0.8571428571428572 and parameters: {'algorithm': 'auto', 'n_neighbors': 8, 'weights': 'distance', 'metric': 'manhattan'}. Best is trial 44 with value: 0.8571428571428572.
[32m[I 2023-04-26 12:33:05,672][39m Trial 303 finished with value: 0.8571428571428572 and parameters: {'algorithm': 'kd_tree', 'n_neighbors': 5, 'weights': 'distance', 'metric': 'manhattan'}. Best is trial 44 with value: 0.8571428571428572.
[32m[I 2023-04-26 12:33:05,686][39m Trial 304 finished with value: 0.831858407079646 and parameters: {'algorithm': 'kd_tree', 'n_neighbors': 13, 'weights': 'distance', 'metric': 'manhattan'}. Best is trial 44 with value: 0.8571428571428572.
[32m[I 2023-04-26 12:33:05,720][39m Trial 305 finished with value: 0.8571428571428572 and parameters: {'algorithm': 'brute', 'n_neighbors': 6, 'weights': 'distance', 'metric': 'manhattan'}. Best is trial 44 with value: 0.8571428571428572.
[32m[I 2023-04-26 12:33:05,738][39m Trial 306 finished with value: 0.8571428571428572 and parameters: {'algorithm': 'auto', 'n_neighbors': 5, 'weights': 'distance', 'metric': 'manhattan'}. Best is trial 44 with value: 0.8571428571428572.
[32m[I 2023-04-26 12:33:05,773][39m Trial 307 finished with value: 0.8571428571428572 and parameters: {'algorithm': 'brute', 'n_neighbors': 6, 'weights': 'distance', 'metric': 'manhattan'}. Best is trial 44 with value: 0.8571428571428572.
[32m[I 2023-04-26 12:33:05,809][39m Trial 308 finished with value: 0.8571428571428572 and parameters: {'algorithm': 'brute', 'n_neighbors': 6, 'weights': 'distance', 'metric': 'manhattan'}. Best is trial 44 with value: 0.8571428571428572.
[32m[I 2023-04-26 12:33:05,841][39m Trial 309 finished with value: 0.8571428571428572 and parameters: {'algorithm': 'brute', 'n_neighbors': 6, 'weights': 'distance', 'metric': 'manhattan'}. Best is trial 44 with value: 0.8571428571428572.
[32m[I 2023-04-26 12:33:05,874][39m Trial 310 finished with value: 0.8181818181818181 and parameters: {'algorithm': 'brute', 'n_neighbors': 7, 'weights': 'distance', 'metric': 'manhattan'}. Best is trial 44 with value: 0.8571428571428572.
[32m[I 2023-04-26 12:33:05,907][39m Trial 311 finished with value: 0.831858407079646 and parameters: {'algorithm': 'brute', 'n_neighbors': 4, 'weights': 'distance', 'metric': 'manhattan'}. Best is trial 44 with value: 0.8571428571428572.
[32m[I 2023-04-26 12:33:05,925][39m Trial 312 finished with value: 0.8545454545454546 and parameters: {'algorithm': 'kd_tree', 'n_neighbors': 6, 'weights': 'distance', 'metric': 'euclidean'}. Best is trial 44 with value: 0.8571428571428572.
[32m[I 2023-04-26 12:33:05,943][39m Trial 313 finished with value: 0.8148148148148148 and parameters: {'algorithm': 'kd_tree', 'n_neighbors': 7, 'weights': 'distance', 'metric': 'minkowski'}. Best is trial 44 with value: 0.8571428571428572.
[32m[I 2023-04-26 12:33:05,961][39m Trial 314 finished with value: 0.8571428571428572 and parameters: {'algorithm': 'auto', 'n_neighbors': 5, 'weights': 'distance', 'metric': 'manhattan'}. Best is trial 44 with value: 0.8571428571428572.
[32m[I 2023-04-26 12:33:05,977][39m Trial 315 finished with value: 0.8275862068965517 and parameters: {'algorithm': 'auto', 'n_neighbors': 3, 'weights': 'distance', 'metric': 'manhattan'}. Best is trial 44 with value: 0.8571428571428572.
[32m[I 2023-04-26 12:33:06,001][39m Trial 316 finished with value: 0.8545454545454546 and parameters: {'algorithm': 'kd_tree', 'n_neighbors': 5, 'weights': 'uniform', 'metric': 'manhattan'}. Best is trial 44 with value: 0.8571428571428572.
[32m[I 2023-04-26 12:33:06,017][39m Trial 317 finished with value: 0.8571428571428572 and parameters: {'algorithm': 'ball_tree', 'n_neighbors': 5, 'weights': 'distance', 'metric': 'manhattan'}. Best is trial 44 with value: 0.8571428571428572.
[32m[I 2023-04-26 12:33:06,029][39m Trial 318 finished with value: 0.8571428571428572 and parameters: {'algorithm': 'auto', 'n_neighbors': 6, 'weights': 'distance', 'metric': 'manhattan'}. Best is trial 44 with value: 0.8571428571428572.
[32m[I 2023-04-26 12:33:06,040][39m Trial 319 finished with value: 0.8571428571428572 and parameters: {'algorithm': 'auto', 'n_neighbors': 6, 'weights': 'distance', 'metric': 'manhattan'}. Best is trial 44 with value: 0.8571428571428572.
[32m[I 2023-04-26 12:33:06,052][39m Trial 320 finished with value: 0.8571428571428572 and parameters: {'algorithm': 'auto', 'n_neighbors': 6, 'weights': 'distance', 'metric': 'manhattan'}. Best is trial 44 with value: 0.8571428571428572.
[32m[I 2023-04-26 12:33:06,062][39m Trial 321 finished with value: 0.8571428571428572 and parameters: {'algorithm': 'kd_tree', 'n_neighbors': 5, 'weights': 'distance', 'metric': 'manhattan'}. Best is trial 44 with value: 0.8571428571428572.
[32m[I 2023-04-26 12:33:06,071][39m Trial 322 finished with value: 0.831858407079646 and parameters: {'algorithm': 'kd_tree', 'n_neighbors': 4, 'weights': 'distance', 'metric': 'manhattan'}. Best is trial 44 with value: 0.8571428571428572.
[32m[I 2023-04-26 12:33:06,101][39m Trial 323 finished with value: 0.8275862068965517 and parameters: {'algorithm': 'brute', 'n_neighbors': 3, 'weights': 'distance', 'metric': 'manhattan'}. Best is trial 44 with value: 0.8571428571428572.
[32m[I 2023-04-26 12:33:06,120][39m Trial 324 finished with value: 0.8571428571428572 and parameters: {'algorithm': 'kd_tree', 'n_neighbors': 8, 'weights': 'distance', 'metric': 'manhattan'}. Best is trial 44 with value: 0.8571428571428572.
[32m[I 2023-04-26 12:33:06,138][39m Trial 325 finished with value: 0.8181818181818181 and parameters: {'algorithm': 'auto', 'n_neighbors': 7, 'weights': 'distance', 'metric': 'manhattan'}. Best is trial 44 with value: 0.8571428571428572.
[32m[I 2023-04-26 12:33:06,156][39m Trial 326 finished with value: 0.831858407079646 and parameters: {'algorithm': 'kd_tree', 'n_neighbors': 4, 'weights': 'distance', 'metric': 'manhattan'}. Best is trial 44 with value: 0.8571428571428572.
[32m[I 2023-04-26 12:33:06,174][39m Trial 327 finished with value: 0.8181818181818181 and parameters: {'algorithm': 'auto', 'n_neighbors': 7, 'weights': 'distance', 'metric': 'manhattan'}. Best is trial 44 with value: 0.8571428571428572.
[32m[I 2023-04-26 12:33:06,193][39m Trial 328 finished with value: 0.8571428571428572 and parameters: {'algorithm': 'auto', 'n_neighbors': 5, 'weights': 'distance', 'metric': 'manhattan'}. Best is trial 44 with value: 0.8571428571428572.
[32m[I 2023-04-26 12:33:06,205][39m Trial 329 finished with value: 0.8288288288288289 and parameters: {'algorithm': 'kd_tree', 'n_neighbors': 29, 'weights': 'distance', 'metric': 'manhattan'}. Best is trial 44 with value: 0.8571428571428572.
[32m[I 2023-04-26 12:33:06,217][39m Trial 330 finished with value: 0.8571428571428572 and parameters: {'algorithm': 'auto', 'n_neighbors': 5, 'weights': 'distance', 'metric': 'manhattan'}. Best is trial 44 with value: 0.8571428571428572.
[32m[I 2023-04-26 12:33:06,226][39m Trial 331 finished with value: 0.8571428571428572 and parameters: {'algorithm': 'ball_tree', 'n_neighbors': 8, 'weights': 'distance', 'metric': 'manhattan'}. Best is trial 44 with value: 0.8571428571428572.
[32m[I 2023-04-26 12:33:06,236][39m Trial 332 finished with value: 0.831858407079646 and parameters: {'algorithm': 'auto', 'n_neighbors': 11, 'weights': 'distance', 'metric': 'manhattan'}. Best is trial 44 with value: 0.8571428571428572.
[32m[I 2023-04-26 12:33:06,267][39m Trial 333 finished with value: 0.831858407079646 and parameters: {'algorithm': 'brute', 'n_neighbors': 4, 'weights': 'distance', 'metric': 'manhattan'}. Best is trial 44 with value: 0.8571428571428572.
[32m[I 2023-04-26 12:33:06,302][39m Trial 334 finished with value: 0.8545454545454546 and parameters: {'algorithm': 'brute', 'n_neighbors': 6, 'weights': 'distance', 'metric': 'euclidean'}. Best is trial 44 with value: 0.8571428571428572.
[32m[I 2023-04-26 12:33:06,321][39m Trial 335 finished with value: 0.8440366972477066 and parameters: {'algorithm': 'ball_tree', 'n_neighbors': 10, 'weights': 'distance', 'metric': 'minkowski'}. Best is trial 44 with value: 0.8571428571428572.
[32m[I 2023-04-26 12:33:06,342][39m Trial 336 finished with value: 0.8421052631578947 and parameters: {'algorithm': 'auto', 'n_neighbors': 9, 'weights': 'uniform', 'metric': 'manhattan'}. Best is trial 44 with value: 0.8571428571428572.
[32m[I 2023-04-26 12:33:06,360][39m Trial 337 finished with value: 0.831858407079646 and parameters: {'algorithm': 'kd_tree', 'n_neighbors': 4, 'weights': 'distance', 'metric': 'manhattan'}. Best is trial 44 with value: 0.8571428571428572.
[32m[I 2023-04-26 12:33:06,378][39m Trial 338 finished with value: 0.8571428571428572 and parameters: {'algorithm': 'kd_tree', 'n_neighbors': 5, 'weights': 'distance', 'metric': 'manhattan'}. Best is trial 44 with value: 0.8571428571428572.
[32m[I 2023-04-26 12:33:06,396][39m Trial 339 finished with value: 0.8571428571428572 and parameters: {'algorithm': 'ball_tree', 'n_neighbors': 8, 'weights': 'distance', 'metric': 'manhattan'}. Best is trial 44 with value: 0.8571428571428572.
[32m[I 2023-04-26 12:33:06,407][39m Trial 340 finished with value: 0.8571428571428572 and parameters: {'algorithm': 'ball_tree', 'n_neighbors': 8, 'weights': 'distance', 'metric': 'manhattan'}. Best is trial 44 with value: 0.8571428571428572.
[32m[I 2023-04-26 12:33:06,418][39m Trial 341 finished with value: 0.8571428571428572 and parameters: {'algorithm': 'kd_tree', 'n_neighbors': 8, 'weights': 'distance', 'metric': 'manhattan'}. Best is trial 44 with value: 0.8571428571428572.
[32m[I 2023-04-26 12:33:06,427][39m Trial 342 finished with value: 0.8181818181818181 and parameters: {'algorithm': 'auto', 'n_neighbors': 7, 'weights': 'distance', 'metric': 'manhattan'}. Best is trial 44 with value: 0.8571428571428572.
[32m[I 2023-04-26 12:33:06,456][39m Trial 343 finished with value: 0.8571428571428572 and parameters: {'algorithm': 'brute', 'n_neighbors': 6, 'weights': 'distance', 'metric': 'manhattan'}. Best is trial 44 with value: 0.8571428571428572.
[32m[I 2023-04-26 12:33:06,493][39m Trial 344 finished with value: 0.8181818181818181 and parameters: {'algorithm': 'brute', 'n_neighbors': 7, 'weights': 'distance', 'metric': 'manhattan'}. Best is trial 44 with value: 0.8571428571428572.
[32m[I 2023-04-26 12:33:06,525][39m Trial 345 finished with value: 0.8181818181818181 and parameters: {'algorithm': 'brute', 'n_neighbors': 23, 'weights': 'distance', 'metric': 'manhattan'}. Best is trial 44 with value: 0.8571428571428572.
[32m[I 2023-04-26 12:33:06,558][39m Trial 346 finished with value: 0.8288288288288289 and parameters: {'algorithm': 'brute', 'n_neighbors': 25, 'weights': 'distance', 'metric': 'manhattan'}. Best is trial 44 with value: 0.8571428571428572.
[32m[I 2023-04-26 12:33:06,590][39m Trial 347 finished with value: 0.8571428571428572 and parameters: {'algorithm': 'brute', 'n_neighbors': 8, 'weights': 'distance', 'metric': 'manhattan'}. Best is trial 44 with value: 0.8571428571428572.
[32m[I 2023-04-26 12:33:06,622][39m Trial 348 finished with value: 0.831858407079646 and parameters: {'algorithm': 'brute', 'n_neighbors': 9, 'weights': 'distance', 'metric': 'manhattan'}. Best is trial 44 with value: 0.8571428571428572.
[32m[I 2023-04-26 12:33:06,642][39m Trial 349 finished with value: 0.8571428571428572 and parameters: {'algorithm': 'kd_tree', 'n_neighbors': 5, 'weights': 'distance', 'metric': 'manhattan'}. Best is trial 44 with value: 0.8571428571428572.
[32m[I 2023-04-26 12:33:06,661][39m Trial 350 finished with value: 0.8571428571428572 and parameters: {'algorithm': 'kd_tree', 'n_neighbors': 5, 'weights': 'distance', 'metric': 'manhattan'}. Best is trial 44 with value: 0.8571428571428572.
[32m[I 2023-04-26 12:33:06,679][39m Trial 351 finished with value: 0.8571428571428572 and parameters: {'algorithm': 'auto', 'n_neighbors': 5, 'weights': 'distance', 'metric': 'manhattan'}. Best is trial 44 with value: 0.8571428571428572.
[32m[I 2023-04-26 12:33:06,697][39m Trial 352 finished with value: 0.8571428571428572 and parameters: {'algorithm': 'auto', 'n_neighbors': 6, 'weights': 'distance', 'metric': 'manhattan'}. Best is trial 44 with value: 0.8571428571428572.
[32m[I 2023-04-26 12:33:06,715][39m Trial 353 finished with value: 0.831858407079646 and parameters: {'algorithm': 'auto', 'n_neighbors': 4, 'weights': 'distance', 'metric': 'manhattan'}. Best is trial 44 with value: 0.8571428571428572.
[32m[I 2023-04-26 12:33:06,728][39m Trial 354 finished with value: 0.8571428571428572 and parameters: {'algorithm': 'auto', 'n_neighbors': 6, 'weights': 'distance', 'metric': 'manhattan'}. Best is trial 44 with value: 0.8571428571428572.
[32m[I 2023-04-26 12:33:06,745][39m Trial 355 finished with value: 0.8571428571428572 and parameters: {'algorithm': 'auto', 'n_neighbors': 6, 'weights': 'distance', 'metric': 'manhattan'}. Best is trial 44 with value: 0.8571428571428572.
[32m[I 2023-04-26 12:33:06,755][39m Trial 356 finished with value: 0.8181818181818181 and parameters: {'algorithm': 'auto', 'n_neighbors': 15, 'weights': 'distance', 'metric': 'euclidean'}. Best is trial 44 with value: 0.8571428571428572.
[32m[I 2023-04-26 12:33:06,766][39m Trial 357 finished with value: 0.8571428571428572 and parameters: {'algorithm': 'auto', 'n_neighbors': 5, 'weights': 'distance', 'metric': 'manhattan'}. Best is trial 44 with value: 0.8571428571428572.
[32m[I 2023-04-26 12:33:06,778][39m Trial 358 finished with value: 0.7999999999999999 and parameters: {'algorithm': 'auto', 'n_neighbors': 6, 'weights': 'uniform', 'metric': 'manhattan'}. Best is trial 44 with value: 0.8571428571428572.
[32m[I 2023-04-26 12:33:06,788][39m Trial 359 finished with value: 0.8571428571428572 and parameters: {'algorithm': 'kd_tree', 'n_neighbors': 5, 'weights': 'distance', 'metric': 'manhattan'}. Best is trial 44 with value: 0.8571428571428572.
[32m[I 2023-04-26 12:33:06,799][39m Trial 360 finished with value: 0.8545454545454546 and parameters: {'algorithm': 'auto', 'n_neighbors': 6, 'weights': 'distance', 'metric': 'minkowski'}. Best is trial 44 with value: 0.8571428571428572.
