[32m[I 2023-04-26 12:33:03,989][39m Trial 180 finished with value: 0.831858407079646 and parameters: {'algorithm': 'ball_tree', 'n_neighbors': 4, 'weights': 'distance', 'metric': 'manhattan'}. Best is trial 44 with value: 0.8571428571428572.
[32m[I 2023-04-26 12:33:03,998][39m Trial 181 finished with value: 0.8571428571428572 and parameters: {'algorithm': 'ball_tree', 'n_neighbors': 8, 'weights': 'distance', 'metric': 'manhattan'}. Best is trial 44 with value: 0.8571428571428572.
[32m[I 2023-04-26 12:33:04,006][39m Trial 182 finished with value: 0.8571428571428572 and parameters: {'algorithm': 'ball_tree', 'n_neighbors': 8, 'weights': 'distance', 'metric': 'manhattan'}. Best is trial 44 with value: 0.8571428571428572.
[32m[I 2023-04-26 12:33:04,016][39m Trial 183 finished with value: 0.8181818181818181 and parameters: {'algorithm': 'auto', 'n_neighbors': 7, 'weights': 'distance', 'metric': 'manhattan'}. Best is trial 44 with value: 0.8571428571428572.
[32m[I 2023-04-26 12:33:04,024][39m Trial 184 finished with value: 0.8571428571428572 and parameters: {'algorithm': 'auto', 'n_neighbors': 8, 'weights': 'distance', 'metric': 'manhattan'}. Best is trial 44 with value: 0.8571428571428572.
[32m[I 2023-04-26 12:33:04,054][39m Trial 185 finished with value: 0.8571428571428572 and parameters: {'algorithm': 'brute', 'n_neighbors': 5, 'weights': 'distance', 'metric': 'manhattan'}. Best is trial 44 with value: 0.8571428571428572.
[32m[I 2023-04-26 12:33:04,069][39m Trial 186 finished with value: 0.8571428571428572 and parameters: {'algorithm': 'auto', 'n_neighbors': 6, 'weights': 'distance', 'metric': 'manhattan'}. Best is trial 44 with value: 0.8571428571428572.
[32m[I 2023-04-26 12:33:04,085][39m Trial 187 finished with value: 0.8392857142857144 and parameters: {'algorithm': 'auto', 'n_neighbors': 10, 'weights': 'distance', 'metric': 'manhattan'}. Best is trial 44 with value: 0.8571428571428572.
[32m[I 2023-04-26 12:33:04,101][39m Trial 188 finished with value: 0.8571428571428572 and parameters: {'algorithm': 'ball_tree', 'n_neighbors': 5, 'weights': 'distance', 'metric': 'manhattan'}. Best is trial 44 with value: 0.8571428571428572.
[32m[I 2023-04-26 12:33:04,122][39m Trial 189 finished with value: 0.8421052631578947 and parameters: {'algorithm': 'ball_tree', 'n_neighbors': 9, 'weights': 'uniform', 'metric': 'manhattan'}. Best is trial 44 with value: 0.8571428571428572.
[32m[I 2023-04-26 12:33:04,138][39m Trial 190 finished with value: 0.8571428571428572 and parameters: {'algorithm': 'ball_tree', 'n_neighbors': 8, 'weights': 'distance', 'metric': 'manhattan'}. Best is trial 44 with value: 0.8571428571428572.
[32m[I 2023-04-26 12:33:04,152][39m Trial 191 finished with value: 0.8571428571428572 and parameters: {'algorithm': 'ball_tree', 'n_neighbors': 8, 'weights': 'distance', 'metric': 'manhattan'}. Best is trial 44 with value: 0.8571428571428572.
[32m[I 2023-04-26 12:33:04,162][39m Trial 192 finished with value: 0.8181818181818181 and parameters: {'algorithm': 'ball_tree', 'n_neighbors': 7, 'weights': 'distance', 'metric': 'manhattan'}. Best is trial 44 with value: 0.8571428571428572.
[32m[I 2023-04-26 12:33:04,172][39m Trial 193 finished with value: 0.831858407079646 and parameters: {'algorithm': 'ball_tree', 'n_neighbors': 9, 'weights': 'distance', 'metric': 'manhattan'}. Best is trial 44 with value: 0.8571428571428572.
[32m[I 2023-04-26 12:33:04,181][39m Trial 194 finished with value: 0.8571428571428572 and parameters: {'algorithm': 'kd_tree', 'n_neighbors': 5, 'weights': 'distance', 'metric': 'manhattan'}. Best is trial 44 with value: 0.8571428571428572.
[32m[I 2023-04-26 12:33:04,190][39m Trial 195 finished with value: 0.8181818181818181 and parameters: {'algorithm': 'ball_tree', 'n_neighbors': 24, 'weights': 'distance', 'metric': 'manhattan'}. Best is trial 44 with value: 0.8571428571428572.
[32m[I 2023-04-26 12:33:04,199][39m Trial 196 finished with value: 0.8571428571428572 and parameters: {'algorithm': 'ball_tree', 'n_neighbors': 5, 'weights': 'distance', 'metric': 'manhattan'}. Best is trial 44 with value: 0.8571428571428572.
[32m[I 2023-04-26 12:33:04,208][39m Trial 197 finished with value: 0.8545454545454546 and parameters: {'algorithm': 'kd_tree', 'n_neighbors': 5, 'weights': 'distance', 'metric': 'minkowski'}. Best is trial 44 with value: 0.8571428571428572.
[32m[I 2023-04-26 12:33:04,217][39m Trial 198 finished with value: 0.831858407079646 and parameters: {'algorithm': 'kd_tree', 'n_neighbors': 4, 'weights': 'distance', 'metric': 'manhattan'}. Best is trial 44 with value: 0.8571428571428572.
[32m[I 2023-04-26 12:33:04,228][39m Trial 199 finished with value: 0.831858407079646 and parameters: {'algorithm': 'kd_tree', 'n_neighbors': 4, 'weights': 'distance', 'metric': 'manhattan'}. Best is trial 44 with value: 0.8571428571428572.
[32m[I 2023-04-26 12:33:04,236][39m Trial 200 finished with value: 0.831858407079646 and parameters: {'algorithm': 'ball_tree', 'n_neighbors': 4, 'weights': 'distance', 'metric': 'euclidean'}. Best is trial 44 with value: 0.8571428571428572.
[32m[I 2023-04-26 12:33:04,246][39m Trial 201 finished with value: 0.8571428571428572 and parameters: {'algorithm': 'ball_tree', 'n_neighbors': 5, 'weights': 'distance', 'metric': 'manhattan'}. Best is trial 44 with value: 0.8571428571428572.
[32m[I 2023-04-26 12:33:04,260][39m Trial 202 finished with value: 0.8571428571428572 and parameters: {'algorithm': 'auto', 'n_neighbors': 5, 'weights': 'distance', 'metric': 'manhattan'}. Best is trial 44 with value: 0.8571428571428572.
[32m[I 2023-04-26 12:33:04,270][39m Trial 203 finished with value: 0.8571428571428572 and parameters: {'algorithm': 'auto', 'n_neighbors': 6, 'weights': 'distance', 'metric': 'manhattan'}. Best is trial 44 with value: 0.8571428571428572.
[32m[I 2023-04-26 12:33:04,278][39m Trial 204 finished with value: 0.8571428571428572 and parameters: {'algorithm': 'auto', 'n_neighbors': 6, 'weights': 'distance', 'metric': 'manhattan'}. Best is trial 44 with value: 0.8571428571428572.
[32m[I 2023-04-26 12:33:04,286][39m Trial 205 finished with value: 0.8571428571428572 and parameters: {'algorithm': 'auto', 'n_neighbors': 6, 'weights': 'distance', 'metric': 'manhattan'}. Best is trial 44 with value: 0.8571428571428572.
[32m[I 2023-04-26 12:33:04,295][39m Trial 206 finished with value: 0.8181818181818181 and parameters: {'algorithm': 'auto', 'n_neighbors': 7, 'weights': 'distance', 'metric': 'manhattan'}. Best is trial 44 with value: 0.8571428571428572.
[32m[I 2023-04-26 12:33:04,303][39m Trial 207 finished with value: 0.8571428571428572 and parameters: {'algorithm': 'auto', 'n_neighbors': 6, 'weights': 'distance', 'metric': 'manhattan'}. Best is trial 44 with value: 0.8571428571428572.
[32m[I 2023-04-26 12:33:04,313][39m Trial 208 finished with value: 0.8571428571428572 and parameters: {'algorithm': 'ball_tree', 'n_neighbors': 5, 'weights': 'distance', 'metric': 'manhattan'}. Best is trial 44 with value: 0.8571428571428572.
[32m[I 2023-04-26 12:33:04,323][39m Trial 209 finished with value: 0.8571428571428572 and parameters: {'algorithm': 'ball_tree', 'n_neighbors': 5, 'weights': 'distance', 'metric': 'manhattan'}. Best is trial 44 with value: 0.8571428571428572.
[32m[I 2023-04-26 12:33:04,332][39m Trial 210 finished with value: 0.8181818181818181 and parameters: {'algorithm': 'ball_tree', 'n_neighbors': 7, 'weights': 'distance', 'metric': 'manhattan'}. Best is trial 44 with value: 0.8571428571428572.
[32m[I 2023-04-26 12:33:04,341][39m Trial 211 finished with value: 0.8571428571428572 and parameters: {'algorithm': 'ball_tree', 'n_neighbors': 8, 'weights': 'distance', 'metric': 'manhattan'}. Best is trial 44 with value: 0.8571428571428572.
[32m[I 2023-04-26 12:33:04,349][39m Trial 212 finished with value: 0.8571428571428572 and parameters: {'algorithm': 'kd_tree', 'n_neighbors': 6, 'weights': 'distance', 'metric': 'manhattan'}. Best is trial 44 with value: 0.8571428571428572.
[32m[I 2023-04-26 12:33:04,358][39m Trial 213 finished with value: 0.8571428571428572 and parameters: {'algorithm': 'auto', 'n_neighbors': 6, 'weights': 'distance', 'metric': 'manhattan'}. Best is trial 44 with value: 0.8571428571428572.
[32m[I 2023-04-26 12:33:04,367][39m Trial 214 finished with value: 0.8571428571428572 and parameters: {'algorithm': 'kd_tree', 'n_neighbors': 8, 'weights': 'distance', 'metric': 'manhattan'}. Best is trial 44 with value: 0.8571428571428572.
[32m[I 2023-04-26 12:33:04,375][39m Trial 215 finished with value: 0.8181818181818181 and parameters: {'algorithm': 'ball_tree', 'n_neighbors': 7, 'weights': 'distance', 'metric': 'manhattan'}. Best is trial 44 with value: 0.8571428571428572.
[32m[I 2023-04-26 12:33:04,385][39m Trial 216 finished with value: 0.831858407079646 and parameters: {'algorithm': 'ball_tree', 'n_neighbors': 9, 'weights': 'distance', 'metric': 'manhattan'}. Best is trial 44 with value: 0.8571428571428572.
[32m[I 2023-04-26 12:33:04,393][39m Trial 217 finished with value: 0.831858407079646 and parameters: {'algorithm': 'ball_tree', 'n_neighbors': 4, 'weights': 'distance', 'metric': 'manhattan'}. Best is trial 44 with value: 0.8571428571428572.
[32m[I 2023-04-26 12:33:04,402][39m Trial 218 finished with value: 0.831858407079646 and parameters: {'algorithm': 'ball_tree', 'n_neighbors': 9, 'weights': 'distance', 'metric': 'manhattan'}. Best is trial 44 with value: 0.8571428571428572.
[32m[I 2023-04-26 12:33:04,411][39m Trial 219 finished with value: 0.8275862068965517 and parameters: {'algorithm': 'kd_tree', 'n_neighbors': 3, 'weights': 'distance', 'metric': 'manhattan'}. Best is trial 44 with value: 0.8571428571428572.
[32m[I 2023-04-26 12:33:04,420][39m Trial 220 finished with value: 0.8571428571428572 and parameters: {'algorithm': 'ball_tree', 'n_neighbors': 8, 'weights': 'distance', 'metric': 'manhattan'}. Best is trial 44 with value: 0.8571428571428572.
[32m[I 2023-04-26 12:33:04,447][39m Trial 221 finished with value: 0.8571428571428572 and parameters: {'algorithm': 'brute', 'n_neighbors': 5, 'weights': 'distance', 'metric': 'manhattan'}. Best is trial 44 with value: 0.8571428571428572.
[32m[I 2023-04-26 12:33:04,480][39m Trial 222 finished with value: 0.8571428571428572 and parameters: {'algorithm': 'brute', 'n_neighbors': 5, 'weights': 'distance', 'metric': 'manhattan'}. Best is trial 44 with value: 0.8571428571428572.
[32m[I 2023-04-26 12:33:04,495][39m Trial 223 finished with value: 0.8571428571428572 and parameters: {'algorithm': 'auto', 'n_neighbors': 6, 'weights': 'distance', 'metric': 'manhattan'}. Best is trial 44 with value: 0.8571428571428572.
[32m[I 2023-04-26 12:33:04,511][39m Trial 224 finished with value: 0.8571428571428572 and parameters: {'algorithm': 'auto', 'n_neighbors': 6, 'weights': 'distance', 'metric': 'manhattan'}. Best is trial 44 with value: 0.8571428571428572.
[32m[I 2023-04-26 12:33:04,526][39m Trial 225 finished with value: 0.8181818181818181 and parameters: {'algorithm': 'kd_tree', 'n_neighbors': 7, 'weights': 'distance', 'metric': 'manhattan'}. Best is trial 44 with value: 0.8571428571428572.
[32m[I 2023-04-26 12:33:04,541][39m Trial 226 finished with value: 0.8571428571428572 and parameters: {'algorithm': 'kd_tree', 'n_neighbors': 5, 'weights': 'distance', 'metric': 'manhattan'}. Best is trial 44 with value: 0.8571428571428572.
[32m[I 2023-04-26 12:33:04,569][39m Trial 227 finished with value: 0.8113207547169813 and parameters: {'algorithm': 'brute', 'n_neighbors': 10, 'weights': 'uniform', 'metric': 'manhattan'}. Best is trial 44 with value: 0.8571428571428572.
[32m[I 2023-04-26 12:33:04,578][39m Trial 228 finished with value: 0.8571428571428572 and parameters: {'algorithm': 'auto', 'n_neighbors': 5, 'weights': 'distance', 'metric': 'manhattan'}. Best is trial 44 with value: 0.8571428571428572.
[32m[I 2023-04-26 12:33:04,590][39m Trial 229 finished with value: 0.8571428571428572 and parameters: {'algorithm': 'kd_tree', 'n_neighbors': 6, 'weights': 'distance', 'metric': 'manhattan'}. Best is trial 44 with value: 0.8571428571428572.
[32m[I 2023-04-26 12:33:04,601][39m Trial 230 finished with value: 0.8571428571428572 and parameters: {'algorithm': 'kd_tree', 'n_neighbors': 6, 'weights': 'distance', 'metric': 'manhattan'}. Best is trial 44 with value: 0.8571428571428572.
[32m[I 2023-04-26 12:33:04,616][39m Trial 231 finished with value: 0.8571428571428572 and parameters: {'algorithm': 'auto', 'n_neighbors': 6, 'weights': 'distance', 'metric': 'manhattan'}. Best is trial 44 with value: 0.8571428571428572.
[32m[I 2023-04-26 12:33:04,625][39m Trial 232 finished with value: 0.8571428571428572 and parameters: {'algorithm': 'kd_tree', 'n_neighbors': 5, 'weights': 'distance', 'metric': 'manhattan'}. Best is trial 44 with value: 0.8571428571428572.
[32m[I 2023-04-26 12:33:04,640][39m Trial 233 finished with value: 0.831858407079646 and parameters: {'algorithm': 'ball_tree', 'n_neighbors': 4, 'weights': 'distance', 'metric': 'manhattan'}. Best is trial 44 with value: 0.8571428571428572.
[32m[I 2023-04-26 12:33:04,651][39m Trial 234 finished with value: 0.8181818181818181 and parameters: {'algorithm': 'ball_tree', 'n_neighbors': 7, 'weights': 'distance', 'metric': 'manhattan'}. Best is trial 44 with value: 0.8571428571428572.
[32m[I 2023-04-26 12:33:04,661][39m Trial 235 finished with value: 0.8181818181818181 and parameters: {'algorithm': 'ball_tree', 'n_neighbors': 7, 'weights': 'distance', 'metric': 'manhattan'}. Best is trial 44 with value: 0.8571428571428572.
[32m[I 2023-04-26 12:33:04,671][39m Trial 236 finished with value: 0.8571428571428572 and parameters: {'algorithm': 'ball_tree', 'n_neighbors': 8, 'weights': 'distance', 'metric': 'manhattan'}. Best is trial 44 with value: 0.8571428571428572.
[32m[I 2023-04-26 12:33:04,680][39m Trial 237 finished with value: 0.8571428571428572 and parameters: {'algorithm': 'kd_tree', 'n_neighbors': 6, 'weights': 'distance', 'metric': 'manhattan'}. Best is trial 44 with value: 0.8571428571428572.
[32m[I 2023-04-26 12:33:04,688][39m Trial 238 finished with value: 0.8571428571428572 and parameters: {'algorithm': 'kd_tree', 'n_neighbors': 6, 'weights': 'distance', 'metric': 'manhattan'}. Best is trial 44 with value: 0.8571428571428572.
[32m[I 2023-04-26 12:33:04,698][39m Trial 239 finished with value: 0.8545454545454546 and parameters: {'algorithm': 'kd_tree', 'n_neighbors': 5, 'weights': 'distance', 'metric': 'euclidean'}. Best is trial 44 with value: 0.8571428571428572.
[32m[I 2023-04-26 12:33:04,706][39m Trial 240 finished with value: 0.831858407079646 and parameters: {'algorithm': 'ball_tree', 'n_neighbors': 4, 'weights': 'distance', 'metric': 'minkowski'}. Best is trial 44 with value: 0.8571428571428572.
[32m[I 2023-04-26 12:33:04,716][39m Trial 241 finished with value: 0.8571428571428572 and parameters: {'algorithm': 'auto', 'n_neighbors': 8, 'weights': 'distance', 'metric': 'manhattan'}. Best is trial 44 with value: 0.8571428571428572.
[32m[I 2023-04-26 12:33:04,724][39m Trial 242 finished with value: 0.8571428571428572 and parameters: {'algorithm': 'kd_tree', 'n_neighbors': 6, 'weights': 'distance', 'metric': 'manhattan'}. Best is trial 44 with value: 0.8571428571428572.
[32m[I 2023-04-26 12:33:04,733][39m Trial 243 finished with value: 0.8181818181818181 and parameters: {'algorithm': 'auto', 'n_neighbors': 7, 'weights': 'distance', 'metric': 'manhattan'}. Best is trial 44 with value: 0.8571428571428572.
[32m[I 2023-04-26 12:33:04,760][39m Trial 244 finished with value: 0.8571428571428572 and parameters: {'algorithm': 'brute', 'n_neighbors': 8, 'weights': 'distance', 'metric': 'manhattan'}. Best is trial 44 with value: 0.8571428571428572.
[32m[I 2023-04-26 12:33:04,777][39m Trial 245 finished with value: 0.8571428571428572 and parameters: {'algorithm': 'kd_tree', 'n_neighbors': 6, 'weights': 'distance', 'metric': 'manhattan'}. Best is trial 44 with value: 0.8571428571428572.
[32m[I 2023-04-26 12:33:04,792][39m Trial 246 finished with value: 0.8571428571428572 and parameters: {'algorithm': 'kd_tree', 'n_neighbors': 5, 'weights': 'distance', 'metric': 'manhattan'}. Best is trial 44 with value: 0.8571428571428572.
[32m[I 2023-04-26 12:33:04,826][39m Trial 247 finished with value: 0.8571428571428572 and parameters: {'algorithm': 'brute', 'n_neighbors': 5, 'weights': 'distance', 'metric': 'manhattan'}. Best is trial 44 with value: 0.8571428571428572.
[32m[I 2023-04-26 12:33:04,862][39m Trial 248 finished with value: 0.8181818181818181 and parameters: {'algorithm': 'brute', 'n_neighbors': 19, 'weights': 'distance', 'metric': 'manhattan'}. Best is trial 44 with value: 0.8571428571428572.
[32m[I 2023-04-26 12:33:04,895][39m Trial 249 finished with value: 0.8571428571428572 and parameters: {'algorithm': 'brute', 'n_neighbors': 6, 'weights': 'distance', 'metric': 'manhattan'}. Best is trial 44 with value: 0.8571428571428572.
[32m[I 2023-04-26 12:33:04,913][39m Trial 250 finished with value: 0.8571428571428572 and parameters: {'algorithm': 'kd_tree', 'n_neighbors': 6, 'weights': 'distance', 'metric': 'manhattan'}. Best is trial 44 with value: 0.8571428571428572.
[32m[I 2023-04-26 12:33:04,929][39m Trial 251 finished with value: 0.8571428571428572 and parameters: {'algorithm': 'kd_tree', 'n_neighbors': 5, 'weights': 'distance', 'metric': 'manhattan'}. Best is trial 44 with value: 0.8571428571428572.
[32m[I 2023-04-26 12:33:04,948][39m Trial 252 finished with value: 0.8571428571428572 and parameters: {'algorithm': 'kd_tree', 'n_neighbors': 5, 'weights': 'distance', 'metric': 'manhattan'}. Best is trial 44 with value: 0.8571428571428572.
[32m[I 2023-04-26 12:33:04,966][39m Trial 253 finished with value: 0.8571428571428572 and parameters: {'algorithm': 'kd_tree', 'n_neighbors': 5, 'weights': 'distance', 'metric': 'manhattan'}. Best is trial 44 with value: 0.8571428571428572.
[32m[I 2023-04-26 12:33:04,982][39m Trial 254 finished with value: 0.8571428571428572 and parameters: {'algorithm': 'kd_tree', 'n_neighbors': 5, 'weights': 'distance', 'metric': 'manhattan'}. Best is trial 44 with value: 0.8571428571428572.
[32m[I 2023-04-26 12:33:05,012][39m Trial 255 finished with value: 0.831858407079646 and parameters: {'algorithm': 'brute', 'n_neighbors': 4, 'weights': 'distance', 'metric': 'manhattan'}. Best is trial 44 with value: 0.8571428571428572.
[32m[I 2023-04-26 12:33:05,028][39m Trial 256 finished with value: 0.8571428571428572 and parameters: {'algorithm': 'auto', 'n_neighbors': 8, 'weights': 'distance', 'metric': 'manhattan'}. Best is trial 44 with value: 0.8571428571428572.
[32m[I 2023-04-26 12:33:05,048][39m Trial 257 finished with value: 0.7999999999999999 and parameters: {'algorithm': 'auto', 'n_neighbors': 6, 'weights': 'uniform', 'metric': 'manhattan'}. Best is trial 44 with value: 0.8571428571428572.
[32m[I 2023-04-26 12:33:05,063][39m Trial 258 finished with value: 0.831858407079646 and parameters: {'algorithm': 'ball_tree', 'n_neighbors': 4, 'weights': 'distance', 'metric': 'manhattan'}. Best is trial 44 with value: 0.8571428571428572.
[32m[I 2023-04-26 12:33:05,080][39m Trial 259 finished with value: 0.8571428571428572 and parameters: {'algorithm': 'auto', 'n_neighbors': 5, 'weights': 'distance', 'metric': 'manhattan'}. Best is trial 44 with value: 0.8571428571428572.
[32m[I 2023-04-26 12:33:05,096][39m Trial 260 finished with value: 0.831858407079646 and parameters: {'algorithm': 'ball_tree', 'n_neighbors': 9, 'weights': 'distance', 'metric': 'manhattan'}. Best is trial 44 with value: 0.8571428571428572.
[32m[I 2023-04-26 12:33:05,112][39m Trial 261 finished with value: 0.8571428571428572 and parameters: {'algorithm': 'ball_tree', 'n_neighbors': 8, 'weights': 'distance', 'metric': 'manhattan'}. Best is trial 44 with value: 0.8571428571428572.
[32m[I 2023-04-26 12:33:05,123][39m Trial 262 finished with value: 0.8181818181818181 and parameters: {'algorithm': 'kd_tree', 'n_neighbors': 7, 'weights': 'distance', 'metric': 'manhattan'}. Best is trial 44 with value: 0.8571428571428572.
[32m[I 2023-04-26 12:33:05,133][39m Trial 263 finished with value: 0.8181818181818181 and parameters: {'algorithm': 'auto', 'n_neighbors': 7, 'weights': 'distance', 'metric': 'manhattan'}. Best is trial 44 with value: 0.8571428571428572.
[32m[I 2023-04-26 12:33:05,147][39m Trial 264 finished with value: 0.8571428571428572 and parameters: {'algorithm': 'auto', 'n_neighbors': 6, 'weights': 'distance', 'metric': 'manhattan'}. Best is trial 44 with value: 0.8571428571428572.
[32m[I 2023-04-26 12:33:05,159][39m Trial 265 finished with value: 0.831858407079646 and parameters: {'algorithm': 'ball_tree', 'n_neighbors': 4, 'weights': 'distance', 'metric': 'minkowski'}. Best is trial 44 with value: 0.8571428571428572.
[32m[I 2023-04-26 12:33:05,169][39m Trial 266 finished with value: 0.831858407079646 and parameters: {'algorithm': 'ball_tree', 'n_neighbors': 4, 'weights': 'distance', 'metric': 'manhattan'}. Best is trial 44 with value: 0.8571428571428572.
[32m[I 2023-04-26 12:33:05,179][39m Trial 267 finished with value: 0.8571428571428572 and parameters: {'algorithm': 'ball_tree', 'n_neighbors': 5, 'weights': 'distance', 'metric': 'manhattan'}. Best is trial 44 with value: 0.8571428571428572.
[32m[I 2023-04-26 12:33:05,188][39m Trial 268 finished with value: 0.8545454545454546 and parameters: {'algorithm': 'kd_tree', 'n_neighbors': 6, 'weights': 'distance', 'metric': 'euclidean'}. Best is trial 44 with value: 0.8571428571428572.
[32m[I 2023-04-26 12:33:05,198][39m Trial 269 finished with value: 0.8571428571428572 and parameters: {'algorithm': 'ball_tree', 'n_neighbors': 8, 'weights': 'distance', 'metric': 'manhattan'}. Best is trial 44 with value: 0.8571428571428572.
