[32m[I 2023-04-26 12:22:46,228][39m Trial 441 finished with value: 0.8468468468468469 and parameters: {'criterion': 'entropy', 'n_estimators': 119, 'max_features': 0.18138505649642286, 'max_depth': 54, 'min_samples_split': 11, 'min_samples_leaf': 2}. Best is trial 310 with value: 0.8947368421052632.
[32m[I 2023-04-26 12:22:46,330][39m Trial 442 finished with value: 0.8695652173913043 and parameters: {'criterion': 'gini', 'n_estimators': 147, 'max_features': 0.24597615008001603, 'max_depth': 48, 'min_samples_split': 11, 'min_samples_leaf': 1}. Best is trial 310 with value: 0.8947368421052632.
[32m[I 2023-04-26 12:22:46,429][39m Trial 443 finished with value: 0.8849557522123893 and parameters: {'criterion': 'gini', 'n_estimators': 143, 'max_features': 0.05821053282297821, 'max_depth': 63, 'min_samples_split': 9, 'min_samples_leaf': 1}. Best is trial 310 with value: 0.8947368421052632.
[32m[I 2023-04-26 12:22:46,529][39m Trial 444 finished with value: 0.8672566371681416 and parameters: {'criterion': 'gini', 'n_estimators': 141, 'max_features': 0.10646458926559185, 'max_depth': 68, 'min_samples_split': 9, 'min_samples_leaf': 1}. Best is trial 310 with value: 0.8947368421052632.
[32m[I 2023-04-26 12:22:46,624][39m Trial 445 finished with value: 0.8571428571428572 and parameters: {'criterion': 'entropy', 'n_estimators': 136, 'max_features': 0.014303455213216798, 'max_depth': 63, 'min_samples_split': 11, 'min_samples_leaf': 1}. Best is trial 310 with value: 0.8947368421052632.
[32m[I 2023-04-26 12:22:46,731][39m Trial 446 finished with value: 0.8648648648648648 and parameters: {'criterion': 'gini', 'n_estimators': 161, 'max_features': 0.054456151764397914, 'max_depth': 65, 'min_samples_split': 10, 'min_samples_leaf': 2}. Best is trial 310 with value: 0.8947368421052632.
[32m[I 2023-04-26 12:22:46,831][39m Trial 447 finished with value: 0.8468468468468469 and parameters: {'criterion': 'entropy', 'n_estimators': 143, 'max_features': 0.1076396301685314, 'max_depth': 61, 'min_samples_split': 11, 'min_samples_leaf': 1}. Best is trial 310 with value: 0.8947368421052632.
[32m[I 2023-04-26 12:22:46,930][39m Trial 448 finished with value: 0.8672566371681416 and parameters: {'criterion': 'gini', 'n_estimators': 139, 'max_features': 0.05688629545764402, 'max_depth': 65, 'min_samples_split': 9, 'min_samples_leaf': 1}. Best is trial 310 with value: 0.8947368421052632.
[32m[I 2023-04-26 12:22:47,024][39m Trial 449 finished with value: 0.8672566371681416 and parameters: {'criterion': 'gini', 'n_estimators': 133, 'max_features': 0.05325959562449565, 'max_depth': 89, 'min_samples_split': 11, 'min_samples_leaf': 1}. Best is trial 310 with value: 0.8947368421052632.
[32m[I 2023-04-26 12:22:47,111][39m Trial 450 finished with value: 0.8648648648648648 and parameters: {'criterion': 'gini', 'n_estimators': 125, 'max_features': 0.030205086575404105, 'max_depth': 63, 'min_samples_split': 10, 'min_samples_leaf': 1}. Best is trial 310 with value: 0.8947368421052632.
[32m[I 2023-04-26 12:22:47,213][39m Trial 451 finished with value: 0.8545454545454546 and parameters: {'criterion': 'gini', 'n_estimators': 153, 'max_features': 0.0011079695501891307, 'max_depth': 59, 'min_samples_split': 11, 'min_samples_leaf': 3}. Best is trial 310 with value: 0.8947368421052632.
[32m[I 2023-04-26 12:22:47,315][39m Trial 452 finished with value: 0.8596491228070176 and parameters: {'criterion': 'gini', 'n_estimators': 145, 'max_features': 0.06497434437375291, 'max_depth': 67, 'min_samples_split': 4, 'min_samples_leaf': 1}. Best is trial 310 with value: 0.8947368421052632.
[32m[I 2023-04-26 12:22:47,416][39m Trial 453 finished with value: 0.8672566371681416 and parameters: {'criterion': 'entropy', 'n_estimators': 141, 'max_features': 0.07452862324325524, 'max_depth': 61, 'min_samples_split': 9, 'min_samples_leaf': 1}. Best is trial 310 with value: 0.8947368421052632.
[32m[I 2023-04-26 12:22:47,517][39m Trial 454 finished with value: 0.8571428571428572 and parameters: {'criterion': 'gini', 'n_estimators': 147, 'max_features': 0.13487030846453493, 'max_depth': 50, 'min_samples_split': 8, 'min_samples_leaf': 2}. Best is trial 310 with value: 0.8947368421052632.
[32m[I 2023-04-26 12:22:47,620][39m Trial 455 finished with value: 0.8571428571428572 and parameters: {'criterion': 'entropy', 'n_estimators': 150, 'max_features': 0.08572586088011142, 'max_depth': 58, 'min_samples_split': 10, 'min_samples_leaf': 1}. Best is trial 310 with value: 0.8947368421052632.
[32m[I 2023-04-26 12:22:47,749][39m Trial 456 finished with value: 0.8363636363636363 and parameters: {'criterion': 'gini', 'n_estimators': 198, 'max_features': 0.20177492872542369, 'max_depth': 92, 'min_samples_split': 11, 'min_samples_leaf': 2}. Best is trial 310 with value: 0.8947368421052632.
[32m[I 2023-04-26 12:22:47,850][39m Trial 457 finished with value: 0.8648648648648648 and parameters: {'criterion': 'gini', 'n_estimators': 144, 'max_features': 0.2227365076555855, 'max_depth': 60, 'min_samples_split': 10, 'min_samples_leaf': 1}. Best is trial 310 with value: 0.8947368421052632.
[32m[I 2023-04-26 12:22:47,914][39m Trial 458 finished with value: 0.8672566371681416 and parameters: {'criterion': 'gini', 'n_estimators': 78, 'max_features': 0.03489368176539229, 'max_depth': 56, 'min_samples_split': 3, 'min_samples_leaf': 3}. Best is trial 310 with value: 0.8947368421052632.
[32m[I 2023-04-26 12:22:48,018][39m Trial 459 finished with value: 0.8620689655172413 and parameters: {'criterion': 'gini', 'n_estimators': 139, 'max_features': 0.14332341961495307, 'max_depth': 52, 'min_samples_split': 8, 'min_samples_leaf': 1}. Best is trial 310 with value: 0.8947368421052632.
[32m[I 2023-04-26 12:22:48,127][39m Trial 460 finished with value: 0.8771929824561403 and parameters: {'criterion': 'gini', 'n_estimators': 147, 'max_features': 0.16003952519170445, 'max_depth': 64, 'min_samples_split': 9, 'min_samples_leaf': 1}. Best is trial 310 with value: 0.8947368421052632.
[32m[I 2023-04-26 12:22:48,208][39m Trial 461 finished with value: 0.8849557522123893 and parameters: {'criterion': 'gini', 'n_estimators': 111, 'max_features': 0.18969720223942346, 'max_depth': 44, 'min_samples_split': 9, 'min_samples_leaf': 1}. Best is trial 310 with value: 0.8947368421052632.
[32m[I 2023-04-26 12:22:48,290][39m Trial 462 finished with value: 0.8495575221238938 and parameters: {'criterion': 'gini', 'n_estimators': 112, 'max_features': 0.17649442978205598, 'max_depth': 44, 'min_samples_split': 9, 'min_samples_leaf': 1}. Best is trial 310 with value: 0.8947368421052632.
[32m[I 2023-04-26 12:22:48,384][39m Trial 463 finished with value: 0.8571428571428572 and parameters: {'criterion': 'gini', 'n_estimators': 121, 'max_features': 0.39287904324490874, 'max_depth': 42, 'min_samples_split': 9, 'min_samples_leaf': 1}. Best is trial 310 with value: 0.8947368421052632.
[32m[I 2023-04-26 12:22:48,464][39m Trial 464 finished with value: 0.875 and parameters: {'criterion': 'gini', 'n_estimators': 109, 'max_features': 0.12313127006642044, 'max_depth': 48, 'min_samples_split': 9, 'min_samples_leaf': 1}. Best is trial 310 with value: 0.8947368421052632.
[32m[I 2023-04-26 12:22:48,543][39m Trial 465 finished with value: 0.8 and parameters: {'criterion': 'gini', 'n_estimators': 105, 'max_features': 0.1847740821357916, 'max_depth': 1, 'min_samples_split': 10, 'min_samples_leaf': 4}. Best is trial 310 with value: 0.8947368421052632.
[32m[I 2023-04-26 12:22:48,626][39m Trial 466 finished with value: 0.8849557522123893 and parameters: {'criterion': 'gini', 'n_estimators': 115, 'max_features': 0.094231354673597, 'max_depth': 46, 'min_samples_split': 10, 'min_samples_leaf': 1}. Best is trial 310 with value: 0.8947368421052632.
[32m[I 2023-04-26 12:22:48,712][39m Trial 467 finished with value: 0.8468468468468469 and parameters: {'criterion': 'gini', 'n_estimators': 109, 'max_features': 0.08633303890822631, 'max_depth': 46, 'min_samples_split': 10, 'min_samples_leaf': 1}. Best is trial 310 with value: 0.8947368421052632.
[32m[I 2023-04-26 12:22:48,801][39m Trial 468 finished with value: 0.8648648648648648 and parameters: {'criterion': 'gini', 'n_estimators': 123, 'max_features': 0.09863939813250813, 'max_depth': 49, 'min_samples_split': 10, 'min_samples_leaf': 1}. Best is trial 310 with value: 0.8947368421052632.
[32m[I 2023-04-26 12:22:48,887][39m Trial 469 finished with value: 0.8849557522123893 and parameters: {'criterion': 'gini', 'n_estimators': 115, 'max_features': 0.06662976722153266, 'max_depth': 81, 'min_samples_split': 10, 'min_samples_leaf': 1}. Best is trial 310 with value: 0.8947368421052632.
[32m[I 2023-04-26 12:22:48,968][39m Trial 470 finished with value: 0.8571428571428572 and parameters: {'criterion': 'gini', 'n_estimators': 112, 'max_features': 0.06159089378458926, 'max_depth': 98, 'min_samples_split': 10, 'min_samples_leaf': 1}. Best is trial 310 with value: 0.8947368421052632.
[32m[I 2023-04-26 12:22:49,053][39m Trial 471 finished with value: 0.8648648648648648 and parameters: {'criterion': 'gini', 'n_estimators': 117, 'max_features': 0.08079164511636619, 'max_depth': 86, 'min_samples_split': 10, 'min_samples_leaf': 1}. Best is trial 310 with value: 0.8947368421052632.
[32m[I 2023-04-26 12:22:49,134][39m Trial 472 finished with value: 0.8672566371681416 and parameters: {'criterion': 'gini', 'n_estimators': 110, 'max_features': 0.03980179415489732, 'max_depth': 47, 'min_samples_split': 10, 'min_samples_leaf': 1}. Best is trial 310 with value: 0.8947368421052632.
[32m[I 2023-04-26 12:22:49,219][39m Trial 473 finished with value: 0.8648648648648648 and parameters: {'criterion': 'gini', 'n_estimators': 120, 'max_features': 0.07017255357584172, 'max_depth': 81, 'min_samples_split': 10, 'min_samples_leaf': 1}. Best is trial 310 with value: 0.8947368421052632.
[32m[I 2023-04-26 12:22:49,303][39m Trial 474 finished with value: 0.8672566371681416 and parameters: {'criterion': 'gini', 'n_estimators': 115, 'max_features': 0.04514263758104681, 'max_depth': 51, 'min_samples_split': 10, 'min_samples_leaf': 1}. Best is trial 310 with value: 0.8947368421052632.
[32m[I 2023-04-26 12:22:49,385][39m Trial 475 finished with value: 0.8672566371681416 and parameters: {'criterion': 'gini', 'n_estimators': 113, 'max_features': 0.12390852629595753, 'max_depth': 84, 'min_samples_split': 10, 'min_samples_leaf': 1}. Best is trial 310 with value: 0.8947368421052632.
[32m[I 2023-04-26 12:22:49,472][39m Trial 476 finished with value: 0.8288288288288289 and parameters: {'criterion': 'gini', 'n_estimators': 118, 'max_features': 0.14578845568923318, 'max_depth': 50, 'min_samples_split': 10, 'min_samples_leaf': 7}. Best is trial 310 with value: 0.8947368421052632.
[32m[I 2023-04-26 12:22:49,554][39m Trial 477 finished with value: 0.875 and parameters: {'criterion': 'gini', 'n_estimators': 116, 'max_features': 0.018055638056338336, 'max_depth': 62, 'min_samples_split': 10, 'min_samples_leaf': 1}. Best is trial 310 with value: 0.8947368421052632.
[32m[I 2023-04-26 12:22:49,648][39m Trial 478 finished with value: 0.875 and parameters: {'criterion': 'gini', 'n_estimators': 121, 'max_features': 0.11461554276339607, 'max_depth': 46, 'min_samples_split': 10, 'min_samples_leaf': 1}. Best is trial 310 with value: 0.8947368421052632.
[32m[I 2023-04-26 12:22:49,738][39m Trial 479 finished with value: 0.8672566371681416 and parameters: {'criterion': 'gini', 'n_estimators': 116, 'max_features': 0.06733113878231267, 'max_depth': 48, 'min_samples_split': 10, 'min_samples_leaf': 1}. Best is trial 310 with value: 0.8947368421052632.
[32m[I 2023-04-26 12:22:49,816][39m Trial 480 finished with value: 0.8672566371681416 and parameters: {'criterion': 'gini', 'n_estimators': 106, 'max_features': 0.1634855844436815, 'max_depth': 66, 'min_samples_split': 10, 'min_samples_leaf': 1}. Best is trial 310 with value: 0.8947368421052632.
[32m[I 2023-04-26 12:22:49,914][39m Trial 481 finished with value: 0.875 and parameters: {'criterion': 'gini', 'n_estimators': 115, 'max_features': 0.0996706250192273, 'max_depth': 52, 'min_samples_split': 9, 'min_samples_leaf': 3}. Best is trial 310 with value: 0.8947368421052632.
[32m[I 2023-04-26 12:22:50,008][39m Trial 482 finished with value: 0.8571428571428572 and parameters: {'criterion': 'gini', 'n_estimators': 119, 'max_features': 0.1388733661713421, 'max_depth': 63, 'min_samples_split': 6, 'min_samples_leaf': 1}. Best is trial 310 with value: 0.8947368421052632.
[32m[I 2023-04-26 12:22:50,091][39m Trial 483 finished with value: 0.8547008547008546 and parameters: {'criterion': 'gini', 'n_estimators': 111, 'max_features': 0.1961796361467777, 'max_depth': 68, 'min_samples_split': 4, 'min_samples_leaf': 1}. Best is trial 310 with value: 0.8947368421052632.
[32m[I 2023-04-26 12:22:50,178][39m Trial 484 finished with value: 0.8214285714285715 and parameters: {'criterion': 'gini', 'n_estimators': 101, 'max_features': 0.8624561228987091, 'max_depth': 45, 'min_samples_split': 10, 'min_samples_leaf': 1}. Best is trial 310 with value: 0.8947368421052632.
[32m[I 2023-04-26 12:22:50,262][39m Trial 485 finished with value: 0.8648648648648648 and parameters: {'criterion': 'gini', 'n_estimators': 113, 'max_features': 0.1527140195772728, 'max_depth': 91, 'min_samples_split': 9, 'min_samples_leaf': 1}. Best is trial 310 with value: 0.8947368421052632.
[32m[I 2023-04-26 12:22:50,350][39m Trial 486 finished with value: 0.8495575221238938 and parameters: {'criterion': 'gini', 'n_estimators': 122, 'max_features': 0.1754140731016567, 'max_depth': 60, 'min_samples_split': 9, 'min_samples_leaf': 1}. Best is trial 310 with value: 0.8947368421052632.
[32m[I 2023-04-26 12:22:50,438][39m Trial 487 finished with value: 0.8648648648648648 and parameters: {'criterion': 'gini', 'n_estimators': 125, 'max_features': 0.12329465600859726, 'max_depth': 50, 'min_samples_split': 10, 'min_samples_leaf': 1}. Best is trial 310 with value: 0.8947368421052632.
[32m[I 2023-04-26 12:22:50,527][39m Trial 488 finished with value: 0.8495575221238938 and parameters: {'criterion': 'gini', 'n_estimators': 117, 'max_features': 0.08830842774503501, 'max_depth': 70, 'min_samples_split': 9, 'min_samples_leaf': 1}. Best is trial 310 with value: 0.8947368421052632.
[32m[I 2023-04-26 12:22:50,609][39m Trial 489 finished with value: 0.8347826086956522 and parameters: {'criterion': 'gini', 'n_estimators': 107, 'max_features': 0.16503738525011397, 'max_depth': 53, 'min_samples_split': 10, 'min_samples_leaf': 10}. Best is trial 310 with value: 0.8947368421052632.
[32m[I 2023-04-26 12:22:50,710][39m Trial 490 finished with value: 0.8148148148148148 and parameters: {'criterion': 'gini', 'n_estimators': 129, 'max_features': 0.6882124399472861, 'max_depth': 43, 'min_samples_split': 5, 'min_samples_leaf': 4}. Best is trial 310 with value: 0.8947368421052632.
[32m[I 2023-04-26 12:22:50,787][39m Trial 491 finished with value: 0.8620689655172413 and parameters: {'criterion': 'gini', 'n_estimators': 98, 'max_features': 0.19679946119344505, 'max_depth': 57, 'min_samples_split': 9, 'min_samples_leaf': 1}. Best is trial 310 with value: 0.8947368421052632.
[32m[I 2023-04-26 12:22:50,857][39m Trial 492 finished with value: 0.8571428571428572 and parameters: {'criterion': 'gini', 'n_estimators': 94, 'max_features': 0.11165453930712824, 'max_depth': 54, 'min_samples_split': 2, 'min_samples_leaf': 5}. Best is trial 310 with value: 0.8947368421052632.
[32m[I 2023-04-26 12:22:50,944][39m Trial 493 finished with value: 0.8440366972477066 and parameters: {'criterion': 'gini', 'n_estimators': 118, 'max_features': 0.14279946371763158, 'max_depth': 48, 'min_samples_split': 10, 'min_samples_leaf': 3}. Best is trial 310 with value: 0.8947368421052632.
[32m[I 2023-04-26 12:22:51,044][39m Trial 494 finished with value: 0.8771929824561403 and parameters: {'criterion': 'gini', 'n_estimators': 136, 'max_features': 0.1836914668836911, 'max_depth': 64, 'min_samples_split': 9, 'min_samples_leaf': 1}. Best is trial 310 with value: 0.8947368421052632.
[32m[I 2023-04-26 12:22:51,171][39m Trial 495 finished with value: 0.8545454545454546 and parameters: {'criterion': 'gini', 'n_estimators': 193, 'max_features': 0.07122377882251421, 'max_depth': 51, 'min_samples_split': 10, 'min_samples_leaf': 1}. Best is trial 310 with value: 0.8947368421052632.
[32m[I 2023-04-26 12:22:51,261][39m Trial 496 finished with value: 0.8771929824561403 and parameters: {'criterion': 'gini', 'n_estimators': 114, 'max_features': 0.1292466334407694, 'max_depth': 61, 'min_samples_split': 9, 'min_samples_leaf': 1}. Best is trial 310 with value: 0.8947368421052632.
[32m[I 2023-04-26 12:22:51,346][39m Trial 497 finished with value: 0.8545454545454546 and parameters: {'criterion': 'gini', 'n_estimators': 103, 'max_features': 0.16353514090687066, 'max_depth': 58, 'min_samples_split': 10, 'min_samples_leaf': 1}. Best is trial 310 with value: 0.8947368421052632.
[32m[I 2023-04-26 12:22:51,445][39m Trial 498 finished with value: 0.8672566371681416 and parameters: {'criterion': 'gini', 'n_estimators': 142, 'max_features': 0.04860369389690376, 'max_depth': 87, 'min_samples_split': 9, 'min_samples_leaf': 1}. Best is trial 310 with value: 0.8947368421052632.
[32m[I 2023-04-26 12:22:51,548][39m Trial 499 finished with value: 0.8571428571428572 and parameters: {'criterion': 'gini', 'n_estimators': 137, 'max_features': 0.20180041814181365, 'max_depth': 48, 'min_samples_split': 3, 'min_samples_leaf': 2}. Best is trial 310 with value: 0.8947368421052632.
Number of finished trials: 500