[32m[I 2023-04-26 12:22:02,130][39m A new study created in memory with name: no-name-bbae4128-8b86-4ffa-ad5d-946c97710c9a
[32m[I 2023-04-26 12:22:02,199][39m Trial 0 finished with value: 0.8181818181818181 and parameters: {'criterion': 'gini', 'n_estimators': 77, 'max_features': 0.7824981447262075, 'max_depth': 66, 'min_samples_split': 10, 'min_samples_leaf': 4}. Best is trial 0 with value: 0.8181818181818181.
[32m[I 2023-04-26 12:22:02,240][39m Trial 1 finished with value: 0.8 and parameters: {'criterion': 'entropy', 'n_estimators': 53, 'max_features': 0.5610904696027685, 'max_depth': 94, 'min_samples_split': 10, 'min_samples_leaf': 5}. Best is trial 0 with value: 0.8181818181818181.
[32m[I 2023-04-26 12:22:02,365][39m Trial 2 finished with value: 0.8392857142857144 and parameters: {'criterion': 'entropy', 'n_estimators': 195, 'max_features': 0.35107429146244784, 'max_depth': 81, 'min_samples_split': 2, 'min_samples_leaf': 5}. Best is trial 2 with value: 0.8392857142857144.
[32m[I 2023-04-26 12:22:02,474][39m Trial 3 finished with value: 0.8245614035087718 and parameters: {'criterion': 'entropy', 'n_estimators': 164, 'max_features': 0.5574650204620905, 'max_depth': 81, 'min_samples_split': 7, 'min_samples_leaf': 5}. Best is trial 2 with value: 0.8392857142857144.
[32m[I 2023-04-26 12:22:02,544][39m Trial 4 finished with value: 0.8181818181818181 and parameters: {'criterion': 'gini', 'n_estimators': 113, 'max_features': 0.41111820683444555, 'max_depth': 77, 'min_samples_split': 3, 'min_samples_leaf': 5}. Best is trial 2 with value: 0.8392857142857144.
[32m[I 2023-04-26 12:22:02,583][39m Trial 5 finished with value: 0.7964601769911505 and parameters: {'criterion': 'entropy', 'n_estimators': 50, 'max_features': 0.9587670260001506, 'max_depth': 86, 'min_samples_split': 7, 'min_samples_leaf': 7}. Best is trial 2 with value: 0.8392857142857144.
[32m[I 2023-04-26 12:22:02,694][39m Trial 6 finished with value: 0.875 and parameters: {'criterion': 'entropy', 'n_estimators': 192, 'max_features': 0.12469461182025621, 'max_depth': 63, 'min_samples_split': 3, 'min_samples_leaf': 3}. Best is trial 6 with value: 0.875.
[32m[I 2023-04-26 12:22:02,799][39m Trial 7 finished with value: 0.8347826086956522 and parameters: {'criterion': 'gini', 'n_estimators': 193, 'max_features': 0.11130146813753428, 'max_depth': 54, 'min_samples_split': 2, 'min_samples_leaf': 10}. Best is trial 6 with value: 0.875.
[32m[I 2023-04-26 12:22:02,882][39m Trial 8 finished with value: 0.8648648648648648 and parameters: {'criterion': 'gini', 'n_estimators': 147, 'max_features': 0.037106514224761855, 'max_depth': 35, 'min_samples_split': 9, 'min_samples_leaf': 3}. Best is trial 6 with value: 0.875.
[32m[I 2023-04-26 12:22:02,949][39m Trial 9 finished with value: 0.8214285714285715 and parameters: {'criterion': 'gini', 'n_estimators': 97, 'max_features': 0.8992108322948515, 'max_depth': 101, 'min_samples_split': 4, 'min_samples_leaf': 6}. Best is trial 6 with value: 0.875.
[32m[I 2023-04-26 12:22:03,040][39m Trial 10 finished with value: 0.7964601769911505 and parameters: {'criterion': 'entropy', 'n_estimators': 158, 'max_features': 0.2274089973979086, 'max_depth': 1, 'min_samples_split': 5, 'min_samples_leaf': 1}. Best is trial 6 with value: 0.875.
[32m[I 2023-04-26 12:22:03,130][39m Trial 11 finished with value: 0.8648648648648648 and parameters: {'criterion': 'gini', 'n_estimators': 145, 'max_features': 0.012288872208915266, 'max_depth': 30, 'min_samples_split': 9, 'min_samples_leaf': 2}. Best is trial 6 with value: 0.875.
[32m[I 2023-04-26 12:22:03,218][39m Trial 12 finished with value: 0.875 and parameters: {'criterion': 'entropy', 'n_estimators': 134, 'max_features': 0.0008142459649726347, 'max_depth': 35, 'min_samples_split': 8, 'min_samples_leaf': 3}. Best is trial 6 with value: 0.875.
[32m[I 2023-04-26 12:22:03,324][39m Trial 13 finished with value: 0.8181818181818181 and parameters: {'criterion': 'entropy', 'n_estimators': 176, 'max_features': 0.23460842672989052, 'max_depth': 34, 'min_samples_split': 6, 'min_samples_leaf': 8}. Best is trial 6 with value: 0.875.
[32m[I 2023-04-26 12:22:03,402][39m Trial 14 finished with value: 0.875 and parameters: {'criterion': 'entropy', 'n_estimators': 124, 'max_features': 0.18268217661856873, 'max_depth': 52, 'min_samples_split': 8, 'min_samples_leaf': 1}. Best is trial 6 with value: 0.875.
[32m[I 2023-04-26 12:22:03,470][39m Trial 15 finished with value: 0.8468468468468469 and parameters: {'criterion': 'entropy', 'n_estimators': 102, 'max_features': 0.3000485048886099, 'max_depth': 11, 'min_samples_split': 5, 'min_samples_leaf': 3}. Best is trial 6 with value: 0.875.
[32m[I 2023-04-26 12:22:03,556][39m Trial 16 finished with value: 0.875 and parameters: {'criterion': 'entropy', 'n_estimators': 134, 'max_features': 0.110850476584274, 'max_depth': 64, 'min_samples_split': 11, 'min_samples_leaf': 3}. Best is trial 6 with value: 0.875.
[32m[I 2023-04-26 12:22:03,639][39m Trial 17 finished with value: 0.8623853211009175 and parameters: {'criterion': 'entropy', 'n_estimators': 124, 'max_features': 0.44653730944187636, 'max_depth': 49, 'min_samples_split': 11, 'min_samples_leaf': 1}. Best is trial 6 with value: 0.875.
[32m[I 2023-04-26 12:22:03,703][39m Trial 18 finished with value: 0.8648648648648648 and parameters: {'criterion': 'entropy', 'n_estimators': 85, 'max_features': 0.2090573045366074, 'max_depth': 17, 'min_samples_split': 8, 'min_samples_leaf': 1}. Best is trial 6 with value: 0.875.
[32m[I 2023-04-26 12:22:03,792][39m Trial 19 finished with value: 0.8181818181818181 and parameters: {'criterion': 'entropy', 'n_estimators': 119, 'max_features': 0.7116016998432682, 'max_depth': 52, 'min_samples_split': 11, 'min_samples_leaf': 2}. Best is trial 6 with value: 0.875.
[32m[I 2023-04-26 12:22:03,900][39m Trial 20 finished with value: 0.8392857142857144 and parameters: {'criterion': 'entropy', 'n_estimators': 179, 'max_features': 0.1620082194701395, 'max_depth': 63, 'min_samples_split': 4, 'min_samples_leaf': 9}. Best is trial 6 with value: 0.875.
[32m[I 2023-04-26 12:22:03,983][39m Trial 21 finished with value: 0.875 and parameters: {'criterion': 'entropy', 'n_estimators': 137, 'max_features': 0.08413492180942553, 'max_depth': 65, 'min_samples_split': 6, 'min_samples_leaf': 3}. Best is trial 6 with value: 0.875.
[32m[I 2023-04-26 12:22:04,072][39m Trial 22 finished with value: 0.8648648648648648 and parameters: {'criterion': 'entropy', 'n_estimators': 143, 'max_features': 0.042768372695610235, 'max_depth': 71, 'min_samples_split': 6, 'min_samples_leaf': 4}. Best is trial 6 with value: 0.875.
[32m[I 2023-04-26 12:22:04,158][39m Trial 23 finished with value: 0.8468468468468469 and parameters: {'criterion': 'entropy', 'n_estimators': 128, 'max_features': 0.27096873341333033, 'max_depth': 45, 'min_samples_split': 8, 'min_samples_leaf': 2}. Best is trial 6 with value: 0.875.
[32m[I 2023-04-26 12:22:04,258][39m Trial 24 finished with value: 0.875 and parameters: {'criterion': 'entropy', 'n_estimators': 167, 'max_features': 0.11789852170283345, 'max_depth': 62, 'min_samples_split': 3, 'min_samples_leaf': 3}. Best is trial 6 with value: 0.875.
[32m[I 2023-04-26 12:22:04,338][39m Trial 25 finished with value: 0.8440366972477066 and parameters: {'criterion': 'entropy', 'n_estimators': 136, 'max_features': 0.007235528878747496, 'max_depth': 41, 'min_samples_split': 10, 'min_samples_leaf': 4}. Best is trial 6 with value: 0.875.
[32m[I 2023-04-26 12:22:04,455][39m Trial 26 finished with value: 0.8571428571428572 and parameters: {'criterion': 'entropy', 'n_estimators': 200, 'max_features': 0.10150281550094598, 'max_depth': 28, 'min_samples_split': 5, 'min_samples_leaf': 6}. Best is trial 6 with value: 0.875.
[32m[I 2023-04-26 12:22:04,576][39m Trial 27 finished with value: 0.8108108108108107 and parameters: {'criterion': 'entropy', 'n_estimators': 181, 'max_features': 0.3803840617960661, 'max_depth': 59, 'min_samples_split': 3, 'min_samples_leaf': 11}. Best is trial 6 with value: 0.875.
[32m[I 2023-04-26 12:22:04,678][39m Trial 28 finished with value: 0.8596491228070176 and parameters: {'criterion': 'entropy', 'n_estimators': 163, 'max_features': 0.13906691359332152, 'max_depth': 73, 'min_samples_split': 3, 'min_samples_leaf': 2}. Best is trial 6 with value: 0.875.
[32m[I 2023-04-26 12:22:04,750][39m Trial 29 finished with value: 0.8495575221238938 and parameters: {'criterion': 'gini', 'n_estimators': 109, 'max_features': 0.3218828406189752, 'max_depth': 56, 'min_samples_split': 7, 'min_samples_leaf': 1}. Best is trial 6 with value: 0.875.
[32m[I 2023-04-26 12:22:04,852][39m Trial 30 finished with value: 0.8181818181818181 and parameters: {'criterion': 'entropy', 'n_estimators': 152, 'max_features': 0.4731492292347747, 'max_depth': 68, 'min_samples_split': 9, 'min_samples_leaf': 4}. Best is trial 6 with value: 0.875.
[32m[I 2023-04-26 12:22:04,934][39m Trial 31 finished with value: 0.8672566371681416 and parameters: {'criterion': 'entropy', 'n_estimators': 131, 'max_features': 0.17868570121754024, 'max_depth': 41, 'min_samples_split': 8, 'min_samples_leaf': 2}. Best is trial 6 with value: 0.875.
[32m[I 2023-04-26 12:22:05,034][39m Trial 32 finished with value: 0.875 and parameters: {'criterion': 'entropy', 'n_estimators': 169, 'max_features': 0.09821667997978942, 'max_depth': 63, 'min_samples_split': 4, 'min_samples_leaf': 3}. Best is trial 6 with value: 0.875.
[32m[I 2023-04-26 12:22:05,088][39m Trial 33 finished with value: 0.7818181818181817 and parameters: {'criterion': 'entropy', 'n_estimators': 65, 'max_features': 0.7302643434176677, 'max_depth': 59, 'min_samples_split': 10, 'min_samples_leaf': 4}. Best is trial 6 with value: 0.875.
[32m[I 2023-04-26 12:22:05,155][39m Trial 34 finished with value: 0.8256880733944953 and parameters: {'criterion': 'entropy', 'n_estimators': 88, 'max_features': 0.5455241382752725, 'max_depth': 88, 'min_samples_split': 6, 'min_samples_leaf': 4}. Best is trial 6 with value: 0.875.
[32m[I 2023-04-26 12:22:05,266][39m Trial 35 finished with value: 0.8545454545454546 and parameters: {'criterion': 'entropy', 'n_estimators': 190, 'max_features': 0.08544326378499763, 'max_depth': 66, 'min_samples_split': 4, 'min_samples_leaf': 5}. Best is trial 6 with value: 0.875.
[32m[I 2023-04-26 12:22:05,373][39m Trial 36 finished with value: 0.8648648648648648 and parameters: {'criterion': 'entropy', 'n_estimators': 171, 'max_features': 0.26488752624120393, 'max_depth': 76, 'min_samples_split': 2, 'min_samples_leaf': 3}. Best is trial 6 with value: 0.875.
[32m[I 2023-04-26 12:22:05,481][39m Trial 37 finished with value: 0.8571428571428572 and parameters: {'criterion': 'entropy', 'n_estimators': 187, 'max_features': 0.09236922429031719, 'max_depth': 81, 'min_samples_split': 3, 'min_samples_leaf': 5}. Best is trial 6 with value: 0.875.
[32m[I 2023-04-26 12:22:05,578][39m Trial 38 finished with value: 0.8571428571428572 and parameters: {'criterion': 'gini', 'n_estimators': 168, 'max_features': 0.06105625906141057, 'max_depth': 61, 'min_samples_split': 4, 'min_samples_leaf': 7}. Best is trial 6 with value: 0.875.
[32m[I 2023-04-26 12:22:05,662][39m Trial 39 finished with value: 0.8440366972477066 and parameters: {'criterion': 'entropy', 'n_estimators': 118, 'max_features': 0.6340736879700262, 'max_depth': 46, 'min_samples_split': 8, 'min_samples_leaf': 2}. Best is trial 6 with value: 0.875.
[32m[I 2023-04-26 12:22:05,763][39m Trial 40 finished with value: 0.8793103448275863 and parameters: {'criterion': 'entropy', 'n_estimators': 153, 'max_features': 0.1611848726943349, 'max_depth': 21, 'min_samples_split': 9, 'min_samples_leaf': 1}. Best is trial 40 with value: 0.8793103448275863.
[32m[I 2023-04-26 12:22:05,856][39m Trial 41 finished with value: 0.8771929824561403 and parameters: {'criterion': 'entropy', 'n_estimators': 152, 'max_features': 0.18397178724500238, 'max_depth': 54, 'min_samples_split': 9, 'min_samples_leaf': 1}. Best is trial 40 with value: 0.8793103448275863.
[32m[I 2023-04-26 12:22:05,952][39m Trial 42 finished with value: 0.8771929824561403 and parameters: {'criterion': 'entropy', 'n_estimators': 155, 'max_features': 0.1863212659442106, 'max_depth': 52, 'min_samples_split': 9, 'min_samples_leaf': 1}. Best is trial 40 with value: 0.8793103448275863.
[32m[I 2023-04-26 12:22:06,052][39m Trial 43 finished with value: 0.8468468468468469 and parameters: {'criterion': 'entropy', 'n_estimators': 156, 'max_features': 0.33983085751590736, 'max_depth': 45, 'min_samples_split': 9, 'min_samples_leaf': 1}. Best is trial 40 with value: 0.8793103448275863.
[32m[I 2023-04-26 12:22:06,147][39m Trial 44 finished with value: 0.875 and parameters: {'criterion': 'gini', 'n_estimators': 150, 'max_features': 0.20733214163876867, 'max_depth': 55, 'min_samples_split': 10, 'min_samples_leaf': 2}. Best is trial 40 with value: 0.8793103448275863.
[32m[I 2023-04-26 12:22:06,244][39m Trial 45 finished with value: 0.8468468468468469 and parameters: {'criterion': 'gini', 'n_estimators': 150, 'max_features': 0.2524930992146756, 'max_depth': 56, 'min_samples_split': 10, 'min_samples_leaf': 1}. Best is trial 40 with value: 0.8793103448275863.
[32m[I 2023-04-26 12:22:06,340][39m Trial 46 finished with value: 0.875 and parameters: {'criterion': 'gini', 'n_estimators': 159, 'max_features': 0.18128757507456408, 'max_depth': 20, 'min_samples_split': 9, 'min_samples_leaf': 2}. Best is trial 40 with value: 0.8793103448275863.
[32m[I 2023-04-26 12:22:06,429][39m Trial 47 finished with value: 0.8620689655172413 and parameters: {'criterion': 'gini', 'n_estimators': 144, 'max_features': 0.16176331050549053, 'max_depth': 21, 'min_samples_split': 7, 'min_samples_leaf': 1}. Best is trial 40 with value: 0.8793103448275863.
[32m[I 2023-04-26 12:22:06,533][39m Trial 48 finished with value: 0.8108108108108107 and parameters: {'criterion': 'gini', 'n_estimators': 162, 'max_features': 0.41292424026559993, 'max_depth': 49, 'min_samples_split': 10, 'min_samples_leaf': 2}. Best is trial 40 with value: 0.8793103448275863.
[32m[I 2023-04-26 12:22:06,632][39m Trial 49 finished with value: 0.8623853211009175 and parameters: {'criterion': 'gini', 'n_estimators': 160, 'max_features': 0.27988113202855225, 'max_depth': 7, 'min_samples_split': 9, 'min_samples_leaf': 1}. Best is trial 40 with value: 0.8793103448275863.
[32m[I 2023-04-26 12:22:06,742][39m Trial 50 finished with value: 0.7889908256880734 and parameters: {'criterion': 'gini', 'n_estimators': 174, 'max_features': 0.36579133839344774, 'max_depth': 23, 'min_samples_split': 9, 'min_samples_leaf': 2}. Best is trial 40 with value: 0.8793103448275863.
[32m[I 2023-04-26 12:22:06,847][39m Trial 51 finished with value: 0.8468468468468469 and parameters: {'criterion': 'entropy', 'n_estimators': 168, 'max_features': 0.14341662178670733, 'max_depth': 40, 'min_samples_split': 9, 'min_samples_leaf': 3}. Best is trial 40 with value: 0.8793103448275863.
[32m[I 2023-04-26 12:22:06,933][39m Trial 52 finished with value: 0.8571428571428572 and parameters: {'criterion': 'entropy', 'n_estimators': 140, 'max_features': 0.04502616752688203, 'max_depth': 69, 'min_samples_split': 11, 'min_samples_leaf': 3}. Best is trial 40 with value: 0.8793103448275863.
[32m[I 2023-04-26 12:22:07,019][39m Trial 53 finished with value: 0.8596491228070176 and parameters: {'criterion': 'entropy', 'n_estimators': 139, 'max_features': 0.007259046211895853, 'max_depth': 15, 'min_samples_split': 7, 'min_samples_leaf': 1}. Best is trial 40 with value: 0.8793103448275863.
[32m[I 2023-04-26 12:22:07,120][39m Trial 54 finished with value: 0.7962962962962963 and parameters: {'criterion': 'entropy', 'n_estimators': 132, 'max_features': 0.875384109319522, 'max_depth': 33, 'min_samples_split': 11, 'min_samples_leaf': 3}. Best is trial 40 with value: 0.8793103448275863.
[32m[I 2023-04-26 12:22:07,216][39m Trial 55 finished with value: 0.8672566371681416 and parameters: {'criterion': 'gini', 'n_estimators': 154, 'max_features': 0.21040050974601515, 'max_depth': 54, 'min_samples_split': 2, 'min_samples_leaf': 2}. Best is trial 40 with value: 0.8793103448275863.
[32m[I 2023-04-26 12:22:07,310][39m Trial 56 finished with value: 0.8495575221238938 and parameters: {'criterion': 'entropy', 'n_estimators': 149, 'max_features': 0.22075046383746766, 'max_depth': 59, 'min_samples_split': 10, 'min_samples_leaf': 1}. Best is trial 40 with value: 0.8793103448275863.
[32m[I 2023-04-26 12:22:07,419][39m Trial 57 finished with value: 0.8495575221238938 and parameters: {'criterion': 'entropy', 'n_estimators': 183, 'max_features': 0.13457732985622822, 'max_depth': 51, 'min_samples_split': 8, 'min_samples_leaf': 1}. Best is trial 40 with value: 0.8793103448275863.
[32m[I 2023-04-26 12:22:07,489][39m Trial 58 finished with value: 0.8695652173913043 and parameters: {'criterion': 'entropy', 'n_estimators': 110, 'max_features': 0.06777061404424617, 'max_depth': 47, 'min_samples_split': 8, 'min_samples_leaf': 1}. Best is trial 40 with value: 0.8793103448275863.
[32m[I 2023-04-26 12:22:07,575][39m Trial 59 finished with value: 0.8545454545454546 and parameters: {'criterion': 'entropy', 'n_estimators': 140, 'max_features': 0.11909305577067103, 'max_depth': 74, 'min_samples_split': 6, 'min_samples_leaf': 5}. Best is trial 40 with value: 0.8793103448275863.
[32m[I 2023-04-26 12:22:07,654][39m Trial 60 finished with value: 0.8288288288288289 and parameters: {'criterion': 'entropy', 'n_estimators': 121, 'max_features': 0.30980536491979704, 'max_depth': 81, 'min_samples_split': 5, 'min_samples_leaf': 7}. Best is trial 40 with value: 0.8793103448275863.
[32m[I 2023-04-26 12:22:07,748][39m Trial 61 finished with value: 0.8421052631578947 and parameters: {'criterion': 'entropy', 'n_estimators': 146, 'max_features': 0.19830666284885856, 'max_depth': 63, 'min_samples_split': 11, 'min_samples_leaf': 2}. Best is trial 40 with value: 0.8793103448275863.
[32m[I 2023-04-26 12:22:07,830][39m Trial 62 finished with value: 0.8648648648648648 and parameters: {'criterion': 'entropy', 'n_estimators': 129, 'max_features': 0.019158303911040356, 'max_depth': 39, 'min_samples_split': 8, 'min_samples_leaf': 3}. Best is trial 40 with value: 0.8793103448275863.
[32m[I 2023-04-26 12:22:07,929][39m Trial 63 finished with value: 0.8545454545454546 and parameters: {'criterion': 'gini', 'n_estimators': 156, 'max_features': 0.2441359068684235, 'max_depth': 55, 'min_samples_split': 9, 'min_samples_leaf': 2}. Best is trial 40 with value: 0.8793103448275863.
[32m[I 2023-04-26 12:22:08,012][39m Trial 64 finished with value: 0.8214285714285715 and parameters: {'criterion': 'entropy', 'n_estimators': 136, 'max_features': 0.12298739827768042, 'max_depth': 66, 'min_samples_split': 3, 'min_samples_leaf': 6}. Best is trial 40 with value: 0.8793103448275863.
[32m[I 2023-04-26 12:22:08,104][39m Trial 65 finished with value: 0.8623853211009175 and parameters: {'criterion': 'gini', 'n_estimators': 159, 'max_features': 0.17460260459629834, 'max_depth': 5, 'min_samples_split': 10, 'min_samples_leaf': 2}. Best is trial 40 with value: 0.8793103448275863.
[32m[I 2023-04-26 12:22:08,186][39m Trial 66 finished with value: 0.8596491228070176 and parameters: {'criterion': 'entropy', 'n_estimators': 125, 'max_features': 0.0498069977932995, 'max_depth': 27, 'min_samples_split': 7, 'min_samples_leaf': 1}. Best is trial 40 with value: 0.8793103448275863.
[32m[I 2023-04-26 12:22:08,288][39m Trial 67 finished with value: 0.8648648648648648 and parameters: {'criterion': 'entropy', 'n_estimators': 164, 'max_features': 0.08145564827447849, 'max_depth': 70, 'min_samples_split': 4, 'min_samples_leaf': 3}. Best is trial 40 with value: 0.8793103448275863.
[32m[I 2023-04-26 12:22:08,401][39m Trial 68 finished with value: 0.8849557522123893 and parameters: {'criterion': 'gini', 'n_estimators': 186, 'max_features': 0.19088782741982063, 'max_depth': 15, 'min_samples_split': 10, 'min_samples_leaf': 2}. Best is trial 68 with value: 0.8849557522123893.
[32m[I 2023-04-26 12:22:08,526][39m Trial 69 finished with value: 0.8256880733944953 and parameters: {'criterion': 'gini', 'n_estimators': 201, 'max_features': 0.2894790816662246, 'max_depth': 16, 'min_samples_split': 10, 'min_samples_leaf': 2}. Best is trial 68 with value: 0.8849557522123893.
[32m[I 2023-04-26 12:22:08,632][39m Trial 70 finished with value: 0.8440366972477066 and parameters: {'criterion': 'entropy', 'n_estimators': 175, 'max_features': 0.11156351178401654, 'max_depth': 12, 'min_samples_split': 11, 'min_samples_leaf': 3}. Best is trial 68 with value: 0.8849557522123893.
[32m[I 2023-04-26 12:22:08,724][39m Trial 71 finished with value: 0.8793103448275863 and parameters: {'criterion': 'gini', 'n_estimators': 148, 'max_features': 0.20915274291369235, 'max_depth': 36, 'min_samples_split': 9, 'min_samples_leaf': 1}. Best is trial 68 with value: 0.8849557522123893.
[32m[I 2023-04-26 12:22:08,814][39m Trial 72 finished with value: 0.8672566371681416 and parameters: {'criterion': 'gini', 'n_estimators': 142, 'max_features': 0.16792653535242502, 'max_depth': 25, 'min_samples_split': 9, 'min_samples_leaf': 1}. Best is trial 68 with value: 0.8849557522123893.
[32m[I 2023-04-26 12:22:08,920][39m Trial 73 finished with value: 0.8468468468468469 and parameters: {'criterion': 'entropy', 'n_estimators': 168, 'max_features': 0.23466593320345572, 'max_depth': 62, 'min_samples_split': 11, 'min_samples_leaf': 4}. Best is trial 68 with value: 0.8849557522123893.
[32m[I 2023-04-26 12:22:09,032][39m Trial 74 finished with value: 0.875 and parameters: {'criterion': 'gini', 'n_estimators': 184, 'max_features': 0.14669492432346168, 'max_depth': 20, 'min_samples_split': 9, 'min_samples_leaf': 2}. Best is trial 68 with value: 0.8849557522123893.
