[32m[I 2023-04-26 12:22:17,029][39m Trial 149 finished with value: 0.8468468468468469 and parameters: {'criterion': 'gini', 'n_estimators': 142, 'max_features': 0.18541131633053826, 'max_depth': 52, 'min_samples_split': 10, 'min_samples_leaf': 2}. Best is trial 68 with value: 0.8849557522123893.
[32m[I 2023-04-26 12:22:17,147][39m Trial 150 finished with value: 0.8672566371681416 and parameters: {'criterion': 'entropy', 'n_estimators': 193, 'max_features': 0.10388113737951081, 'max_depth': 16, 'min_samples_split': 8, 'min_samples_leaf': 3}. Best is trial 68 with value: 0.8849557522123893.
[32m[I 2023-04-26 12:22:17,244][39m Trial 151 finished with value: 0.8545454545454546 and parameters: {'criterion': 'gini', 'n_estimators': 156, 'max_features': 0.2029129758449553, 'max_depth': 26, 'min_samples_split': 7, 'min_samples_leaf': 2}. Best is trial 68 with value: 0.8849557522123893.
[32m[I 2023-04-26 12:22:17,352][39m Trial 152 finished with value: 0.8288288288288289 and parameters: {'criterion': 'entropy', 'n_estimators': 170, 'max_features': 0.20529363237458598, 'max_depth': 54, 'min_samples_split': 8, 'min_samples_leaf': 4}. Best is trial 68 with value: 0.8849557522123893.
[32m[I 2023-04-26 12:22:17,448][39m Trial 153 finished with value: 0.8440366972477066 and parameters: {'criterion': 'entropy', 'n_estimators': 148, 'max_features': 0.17885986051945535, 'max_depth': 10, 'min_samples_split': 8, 'min_samples_leaf': 1}. Best is trial 68 with value: 0.8849557522123893.
[32m[I 2023-04-26 12:22:17,549][39m Trial 154 finished with value: 0.8648648648648648 and parameters: {'criterion': 'entropy', 'n_estimators': 164, 'max_features': 0.12111715745988744, 'max_depth': 63, 'min_samples_split': 4, 'min_samples_leaf': 3}. Best is trial 68 with value: 0.8849557522123893.
[32m[I 2023-04-26 12:22:17,659][39m Trial 155 finished with value: 0.8545454545454546 and parameters: {'criterion': 'entropy', 'n_estimators': 179, 'max_features': 0.07577989587596803, 'max_depth': 61, 'min_samples_split': 2, 'min_samples_leaf': 3}. Best is trial 68 with value: 0.8849557522123893.
[32m[I 2023-04-26 12:22:17,782][39m Trial 156 finished with value: 0.875 and parameters: {'criterion': 'gini', 'n_estimators': 194, 'max_features': 0.2276167868141728, 'max_depth': 18, 'min_samples_split': 7, 'min_samples_leaf': 1}. Best is trial 68 with value: 0.8849557522123893.
[32m[I 2023-04-26 12:22:17,884][39m Trial 157 finished with value: 0.8545454545454546 and parameters: {'criterion': 'gini', 'n_estimators': 159, 'max_features': 0.18977943676540865, 'max_depth': 44, 'min_samples_split': 10, 'min_samples_leaf': 2}. Best is trial 68 with value: 0.8849557522123893.
[32m[I 2023-04-26 12:22:18,018][39m Trial 158 finished with value: 0.8214285714285715 and parameters: {'criterion': 'gini', 'n_estimators': 190, 'max_features': 0.8189588721111831, 'max_depth': 28, 'min_samples_split': 11, 'min_samples_leaf': 1}. Best is trial 68 with value: 0.8849557522123893.
[32m[I 2023-04-26 12:22:18,127][39m Trial 159 finished with value: 0.8521739130434783 and parameters: {'criterion': 'entropy', 'n_estimators': 170, 'max_features': 0.09769626671829451, 'max_depth': 49, 'min_samples_split': 4, 'min_samples_leaf': 1}. Best is trial 68 with value: 0.8849557522123893.
[32m[I 2023-04-26 12:22:18,246][39m Trial 160 finished with value: 0.8672566371681416 and parameters: {'criterion': 'gini', 'n_estimators': 184, 'max_features': 0.14559777670787374, 'max_depth': 46, 'min_samples_split': 8, 'min_samples_leaf': 2}. Best is trial 68 with value: 0.8849557522123893.
[32m[I 2023-04-26 12:22:18,347][39m Trial 161 finished with value: 0.8849557522123893 and parameters: {'criterion': 'entropy', 'n_estimators': 153, 'max_features': 0.12326807474937104, 'max_depth': 55, 'min_samples_split': 9, 'min_samples_leaf': 3}. Best is trial 68 with value: 0.8849557522123893.
[32m[I 2023-04-26 12:22:18,448][39m Trial 162 finished with value: 0.875 and parameters: {'criterion': 'gini', 'n_estimators': 154, 'max_features': 0.1606773881052521, 'max_depth': 56, 'min_samples_split': 9, 'min_samples_leaf': 2}. Best is trial 68 with value: 0.8849557522123893.
[32m[I 2023-04-26 12:22:18,546][39m Trial 163 finished with value: 0.8440366972477066 and parameters: {'criterion': 'gini', 'n_estimators': 151, 'max_features': 0.15301434386207452, 'max_depth': 51, 'min_samples_split': 9, 'min_samples_leaf': 2}. Best is trial 68 with value: 0.8849557522123893.
[32m[I 2023-04-26 12:22:18,672][39m Trial 164 finished with value: 0.8545454545454546 and parameters: {'criterion': 'entropy', 'n_estimators': 199, 'max_features': 0.0644438180998353, 'max_depth': 48, 'min_samples_split': 9, 'min_samples_leaf': 4}. Best is trial 68 with value: 0.8849557522123893.
[32m[I 2023-04-26 12:22:18,776][39m Trial 165 finished with value: 0.8545454545454546 and parameters: {'criterion': 'entropy', 'n_estimators': 148, 'max_features': 0.2414927564938442, 'max_depth': 55, 'min_samples_split': 8, 'min_samples_leaf': 1}. Best is trial 68 with value: 0.8849557522123893.
[32m[I 2023-04-26 12:22:18,882][39m Trial 166 finished with value: 0.8363636363636363 and parameters: {'criterion': 'entropy', 'n_estimators': 156, 'max_features': 0.2698388303590197, 'max_depth': 57, 'min_samples_split': 8, 'min_samples_leaf': 2}. Best is trial 68 with value: 0.8849557522123893.
[32m[I 2023-04-26 12:22:19,001][39m Trial 167 finished with value: 0.8468468468468469 and parameters: {'criterion': 'entropy', 'n_estimators': 185, 'max_features': 0.12349515541659074, 'max_depth': 6, 'min_samples_split': 9, 'min_samples_leaf': 1}. Best is trial 68 with value: 0.8849557522123893.
[32m[I 2023-04-26 12:22:19,111][39m Trial 168 finished with value: 0.8648648648648648 and parameters: {'criterion': 'entropy', 'n_estimators': 167, 'max_features': 0.1737476749158031, 'max_depth': 40, 'min_samples_split': 9, 'min_samples_leaf': 3}. Best is trial 68 with value: 0.8849557522123893.
[32m[I 2023-04-26 12:22:19,217][39m Trial 169 finished with value: 0.875 and parameters: {'criterion': 'entropy', 'n_estimators': 159, 'max_features': 0.045900644800173265, 'max_depth': 35, 'min_samples_split': 10, 'min_samples_leaf': 2}. Best is trial 68 with value: 0.8849557522123893.
[32m[I 2023-04-26 12:22:19,324][39m Trial 170 finished with value: 0.8695652173913043 and parameters: {'criterion': 'entropy', 'n_estimators': 162, 'max_features': 0.05336161445374843, 'max_depth': 37, 'min_samples_split': 8, 'min_samples_leaf': 1}. Best is trial 68 with value: 0.8849557522123893.
[32m[I 2023-04-26 12:22:19,438][39m Trial 171 finished with value: 0.8392857142857144 and parameters: {'criterion': 'entropy', 'n_estimators': 174, 'max_features': 0.10341561924485823, 'max_depth': 12, 'min_samples_split': 3, 'min_samples_leaf': 3}. Best is trial 68 with value: 0.8849557522123893.
[32m[I 2023-04-26 12:22:19,530][39m Trial 172 finished with value: 0.8275862068965517 and parameters: {'criterion': 'entropy', 'n_estimators': 144, 'max_features': 0.047428652160604504, 'max_depth': 35, 'min_samples_split': 9, 'min_samples_leaf': 11}. Best is trial 68 with value: 0.8849557522123893.
[32m[I 2023-04-26 12:22:19,648][39m Trial 173 finished with value: 0.8468468468468469 and parameters: {'criterion': 'gini', 'n_estimators': 182, 'max_features': 0.1580830090972057, 'max_depth': 11, 'min_samples_split': 9, 'min_samples_leaf': 2}. Best is trial 68 with value: 0.8849557522123893.
[32m[I 2023-04-26 12:22:19,749][39m Trial 174 finished with value: 0.8545454545454546 and parameters: {'criterion': 'gini', 'n_estimators': 151, 'max_features': 0.20775746913418938, 'max_depth': 18, 'min_samples_split': 7, 'min_samples_leaf': 3}. Best is trial 68 with value: 0.8849557522123893.
[32m[I 2023-04-26 12:22:19,865][39m Trial 175 finished with value: 0.8571428571428572 and parameters: {'criterion': 'gini', 'n_estimators': 179, 'max_features': 0.1398312666324971, 'max_depth': 52, 'min_samples_split': 9, 'min_samples_leaf': 2}. Best is trial 68 with value: 0.8849557522123893.
[32m[I 2023-04-26 12:22:19,987][39m Trial 176 finished with value: 0.8468468468468469 and parameters: {'criterion': 'gini', 'n_estimators': 186, 'max_features': 0.18477181126822623, 'max_depth': 24, 'min_samples_split': 7, 'min_samples_leaf': 4}. Best is trial 68 with value: 0.8849557522123893.
[32m[I 2023-04-26 12:22:20,099][39m Trial 177 finished with value: 0.8468468468468469 and parameters: {'criterion': 'gini', 'n_estimators': 162, 'max_features': 0.2271562516454325, 'max_depth': 96, 'min_samples_split': 9, 'min_samples_leaf': 1}. Best is trial 68 with value: 0.8849557522123893.
[32m[I 2023-04-26 12:22:20,203][39m Trial 178 finished with value: 0.8468468468468469 and parameters: {'criterion': 'gini', 'n_estimators': 155, 'max_features': 0.2250736991109352, 'max_depth': 53, 'min_samples_split': 10, 'min_samples_leaf': 2}. Best is trial 68 with value: 0.8849557522123893.
[32m[I 2023-04-26 12:22:20,329][39m Trial 179 finished with value: 0.8495575221238938 and parameters: {'criterion': 'entropy', 'n_estimators': 195, 'max_features': 0.12221833320912136, 'max_depth': 21, 'min_samples_split': 9, 'min_samples_leaf': 1}. Best is trial 68 with value: 0.8849557522123893.
[32m[I 2023-04-26 12:22:20,401][39m Trial 180 finished with value: 0.8771929824561403 and parameters: {'criterion': 'gini', 'n_estimators': 102, 'max_features': 0.15590005161696124, 'max_depth': 8, 'min_samples_split': 9, 'min_samples_leaf': 2}. Best is trial 68 with value: 0.8849557522123893.
[32m[I 2023-04-26 12:22:20,487][39m Trial 181 finished with value: 0.8245614035087718 and parameters: {'criterion': 'entropy', 'n_estimators': 121, 'max_features': 0.01548097655480507, 'max_depth': 32, 'min_samples_split': 9, 'min_samples_leaf': 9}. Best is trial 68 with value: 0.8849557522123893.
[32m[I 2023-04-26 12:22:20,560][39m Trial 182 finished with value: 0.8571428571428572 and parameters: {'criterion': 'gini', 'n_estimators': 106, 'max_features': 0.16893388488682526, 'max_depth': 5, 'min_samples_split': 9, 'min_samples_leaf': 2}. Best is trial 68 with value: 0.8849557522123893.
[32m[I 2023-04-26 12:22:20,634][39m Trial 183 finished with value: 0.7899159663865546 and parameters: {'criterion': 'gini', 'n_estimators': 113, 'max_features': 0.1911219666393803, 'max_depth': 2, 'min_samples_split': 9, 'min_samples_leaf': 1}. Best is trial 68 with value: 0.8849557522123893.
[32m[I 2023-04-26 12:22:20,698][39m Trial 184 finished with value: 0.8596491228070176 and parameters: {'criterion': 'gini', 'n_estimators': 86, 'max_features': 0.18764778541995866, 'max_depth': 14, 'min_samples_split': 8, 'min_samples_leaf': 2}. Best is trial 68 with value: 0.8849557522123893.
[32m[I 2023-04-26 12:22:20,768][39m Trial 185 finished with value: 0.8849557522123893 and parameters: {'criterion': 'gini', 'n_estimators': 101, 'max_features': 0.1350987442738702, 'max_depth': 17, 'min_samples_split': 3, 'min_samples_leaf': 3}. Best is trial 68 with value: 0.8849557522123893.
[32m[I 2023-04-26 12:22:20,873][39m Trial 186 finished with value: 0.8495575221238938 and parameters: {'criterion': 'gini', 'n_estimators': 155, 'max_features': 0.24301173915221622, 'max_depth': 56, 'min_samples_split': 9, 'min_samples_leaf': 1}. Best is trial 68 with value: 0.8849557522123893.
[32m[I 2023-04-26 12:22:20,945][39m Trial 187 finished with value: 0.8648648648648648 and parameters: {'criterion': 'gini', 'n_estimators': 102, 'max_features': 0.1617414100530776, 'max_depth': 17, 'min_samples_split': 10, 'min_samples_leaf': 2}. Best is trial 68 with value: 0.8849557522123893.
[32m[I 2023-04-26 12:22:21,001][39m Trial 188 finished with value: 0.8771929824561403 and parameters: {'criterion': 'gini', 'n_estimators': 74, 'max_features': 0.20662197298231594, 'max_depth': 58, 'min_samples_split': 10, 'min_samples_leaf': 2}. Best is trial 68 with value: 0.8849557522123893.
[32m[I 2023-04-26 12:22:21,070][39m Trial 189 finished with value: 0.8245614035087718 and parameters: {'criterion': 'gini', 'n_estimators': 82, 'max_features': 0.3707873385786216, 'max_depth': 58, 'min_samples_split': 10, 'min_samples_leaf': 6}. Best is trial 68 with value: 0.8849557522123893.
[32m[I 2023-04-26 12:22:21,122][39m Trial 190 finished with value: 0.8468468468468469 and parameters: {'criterion': 'gini', 'n_estimators': 68, 'max_features': 0.21029720768262636, 'max_depth': 8, 'min_samples_split': 10, 'min_samples_leaf': 2}. Best is trial 68 with value: 0.8849557522123893.
[32m[I 2023-04-26 12:22:21,190][39m Trial 191 finished with value: 0.8672566371681416 and parameters: {'criterion': 'gini', 'n_estimators': 95, 'max_features': 0.18259540562449025, 'max_depth': 22, 'min_samples_split': 10, 'min_samples_leaf': 2}. Best is trial 68 with value: 0.8849557522123893.
[32m[I 2023-04-26 12:22:21,235][39m Trial 192 finished with value: 0.8596491228070176 and parameters: {'criterion': 'entropy', 'n_estimators': 54, 'max_features': 0.13057346283567017, 'max_depth': 53, 'min_samples_split': 3, 'min_samples_leaf': 3}. Best is trial 68 with value: 0.8849557522123893.
[32m[I 2023-04-26 12:22:21,307][39m Trial 193 finished with value: 0.8571428571428572 and parameters: {'criterion': 'gini', 'n_estimators': 93, 'max_features': 0.1574680297386093, 'max_depth': 56, 'min_samples_split': 9, 'min_samples_leaf': 3}. Best is trial 68 with value: 0.8849557522123893.
[32m[I 2023-04-26 12:22:21,362][39m Trial 194 finished with value: 0.8495575221238938 and parameters: {'criterion': 'gini', 'n_estimators': 72, 'max_features': 0.2169395994585753, 'max_depth': 13, 'min_samples_split': 9, 'min_samples_leaf': 1}. Best is trial 68 with value: 0.8849557522123893.
[32m[I 2023-04-26 12:22:21,486][39m Trial 195 finished with value: 0.8596491228070176 and parameters: {'criterion': 'gini', 'n_estimators': 189, 'max_features': 0.1410638692666958, 'max_depth': 12, 'min_samples_split': 5, 'min_samples_leaf': 2}. Best is trial 68 with value: 0.8849557522123893.
[32m[I 2023-04-26 12:22:21,550][39m Trial 196 finished with value: 0.8468468468468469 and parameters: {'criterion': 'gini', 'n_estimators': 90, 'max_features': 0.10923731472637639, 'max_depth': 44, 'min_samples_split': 8, 'min_samples_leaf': 1}. Best is trial 68 with value: 0.8849557522123893.
[32m[I 2023-04-26 12:22:21,665][39m Trial 197 finished with value: 0.8181818181818181 and parameters: {'criterion': 'gini', 'n_estimators': 159, 'max_features': 0.4498435438600492, 'max_depth': 54, 'min_samples_split': 10, 'min_samples_leaf': 2}. Best is trial 68 with value: 0.8849557522123893.
[32m[I 2023-04-26 12:22:21,712][39m Trial 198 finished with value: 0.8648648648648648 and parameters: {'criterion': 'gini', 'n_estimators': 59, 'max_features': 0.13740743570560415, 'max_depth': 50, 'min_samples_split': 11, 'min_samples_leaf': 1}. Best is trial 68 with value: 0.8849557522123893.
[32m[I 2023-04-26 12:22:21,797][39m Trial 199 finished with value: 0.8468468468468469 and parameters: {'criterion': 'entropy', 'n_estimators': 115, 'max_features': 0.2811890244155602, 'max_depth': 60, 'min_samples_split': 8, 'min_samples_leaf': 1}. Best is trial 68 with value: 0.8849557522123893.
[32m[I 2023-04-26 12:22:21,903][39m Trial 200 finished with value: 0.8672566371681416 and parameters: {'criterion': 'entropy', 'n_estimators': 149, 'max_features': 0.08856743872725695, 'max_depth': 48, 'min_samples_split': 7, 'min_samples_leaf': 1}. Best is trial 68 with value: 0.8849557522123893.
[32m[I 2023-04-26 12:22:22,004][39m Trial 201 finished with value: 0.8648648648648648 and parameters: {'criterion': 'gini', 'n_estimators': 152, 'max_features': 0.16644541613621375, 'max_depth': 25, 'min_samples_split': 9, 'min_samples_leaf': 2}. Best is trial 68 with value: 0.8849557522123893.
[32m[I 2023-04-26 12:22:22,102][39m Trial 202 finished with value: 0.8771929824561403 and parameters: {'criterion': 'gini', 'n_estimators': 147, 'max_features': 0.10974772144743626, 'max_depth': 50, 'min_samples_split': 5, 'min_samples_leaf': 3}. Best is trial 68 with value: 0.8849557522123893.
[32m[I 2023-04-26 12:22:22,161][39m Trial 203 finished with value: 0.8545454545454546 and parameters: {'criterion': 'gini', 'n_estimators': 80, 'max_features': 0.12954745672217216, 'max_depth': 20, 'min_samples_split': 5, 'min_samples_leaf': 3}. Best is trial 68 with value: 0.8849557522123893.
[32m[I 2023-04-26 12:22:22,219][39m Trial 204 finished with value: 0.8440366972477066 and parameters: {'criterion': 'gini', 'n_estimators': 75, 'max_features': 0.1507860040533698, 'max_depth': 13, 'min_samples_split': 9, 'min_samples_leaf': 2}. Best is trial 68 with value: 0.8849557522123893.
[32m[I 2023-04-26 12:22:22,363][39m Trial 205 finished with value: 0.8849557522123893 and parameters: {'criterion': 'gini', 'n_estimators': 184, 'max_features': 0.08612862116141505, 'max_depth': 47, 'min_samples_split': 5, 'min_samples_leaf': 3}. Best is trial 68 with value: 0.8849557522123893.
[32m[I 2023-04-26 12:22:22,462][39m Trial 206 finished with value: 0.875 and parameters: {'criterion': 'gini', 'n_estimators': 146, 'max_features': 0.08417252950920356, 'max_depth': 23, 'min_samples_split': 4, 'min_samples_leaf': 3}. Best is trial 68 with value: 0.8849557522123893.
[32m[I 2023-04-26 12:22:22,557][39m Trial 207 finished with value: 0.875 and parameters: {'criterion': 'entropy', 'n_estimators': 139, 'max_features': 0.10490355314349661, 'max_depth': 42, 'min_samples_split': 5, 'min_samples_leaf': 3}. Best is trial 68 with value: 0.8849557522123893.
[32m[I 2023-04-26 12:22:22,653][39m Trial 208 finished with value: 0.8648648648648648 and parameters: {'criterion': 'gini', 'n_estimators': 146, 'max_features': 0.07578664990031077, 'max_depth': 50, 'min_samples_split': 4, 'min_samples_leaf': 3}. Best is trial 68 with value: 0.8849557522123893.
[32m[I 2023-04-26 12:22:22,757][39m Trial 209 finished with value: 0.8648648648648648 and parameters: {'criterion': 'gini', 'n_estimators': 153, 'max_features': 0.2024764526059357, 'max_depth': 55, 'min_samples_split': 11, 'min_samples_leaf': 3}. Best is trial 68 with value: 0.8849557522123893.
[32m[I 2023-04-26 12:22:22,850][39m Trial 210 finished with value: 0.8545454545454546 and parameters: {'criterion': 'entropy', 'n_estimators': 142, 'max_features': 0.12258873274363596, 'max_depth': 51, 'min_samples_split': 11, 'min_samples_leaf': 4}. Best is trial 68 with value: 0.8849557522123893.
[32m[I 2023-04-26 12:22:22,972][39m Trial 211 finished with value: 0.875 and parameters: {'criterion': 'gini', 'n_estimators': 192, 'max_features': 0.09717976023286864, 'max_depth': 47, 'min_samples_split': 4, 'min_samples_leaf': 3}. Best is trial 68 with value: 0.8849557522123893.
[32m[I 2023-04-26 12:22:23,096][39m Trial 212 finished with value: 0.8468468468468469 and parameters: {'criterion': 'gini', 'n_estimators': 191, 'max_features': 0.25163910290206376, 'max_depth': 46, 'min_samples_split': 6, 'min_samples_leaf': 3}. Best is trial 68 with value: 0.8849557522123893.
[32m[I 2023-04-26 12:22:23,190][39m Trial 213 finished with value: 0.8648648648648648 and parameters: {'criterion': 'entropy', 'n_estimators': 139, 'max_features': 0.11592699053039277, 'max_depth': 19, 'min_samples_split': 3, 'min_samples_leaf': 3}. Best is trial 68 with value: 0.8849557522123893.
[32m[I 2023-04-26 12:22:23,303][39m Trial 214 finished with value: 0.8695652173913043 and parameters: {'criterion': 'gini', 'n_estimators': 183, 'max_features': 0.11379689293852402, 'max_depth': 43, 'min_samples_split': 9, 'min_samples_leaf': 1}. Best is trial 68 with value: 0.8849557522123893.
[32m[I 2023-04-26 12:22:23,402][39m Trial 215 finished with value: 0.875 and parameters: {'criterion': 'gini', 'n_estimators': 158, 'max_features': 0.06553840297413151, 'max_depth': 9, 'min_samples_split': 9, 'min_samples_leaf': 2}. Best is trial 68 with value: 0.8849557522123893.
[32m[I 2023-04-26 12:22:23,517][39m Trial 216 finished with value: 0.8672566371681416 and parameters: {'criterion': 'gini', 'n_estimators': 180, 'max_features': 0.14231148482580072, 'max_depth': 19, 'min_samples_split': 5, 'min_samples_leaf': 3}. Best is trial 68 with value: 0.8849557522123893.
[32m[I 2023-04-26 12:22:23,621][39m Trial 217 finished with value: 0.8363636363636363 and parameters: {'criterion': 'gini', 'n_estimators': 148, 'max_features': 0.16829975255775853, 'max_depth': 48, 'min_samples_split': 8, 'min_samples_leaf': 2}. Best is trial 68 with value: 0.8849557522123893.
[32m[I 2023-04-26 12:22:23,729][39m Trial 218 finished with value: 0.8672566371681416 and parameters: {'criterion': 'entropy', 'n_estimators': 166, 'max_features': 0.18916858954501714, 'max_depth': 53, 'min_samples_split': 10, 'min_samples_leaf': 1}. Best is trial 68 with value: 0.8849557522123893.
[32m[I 2023-04-26 12:22:23,849][39m Trial 219 finished with value: 0.8571428571428572 and parameters: {'criterion': 'entropy', 'n_estimators': 188, 'max_features': 0.08472260525941121, 'max_depth': 64, 'min_samples_split': 8, 'min_samples_leaf': 4}. Best is trial 68 with value: 0.8849557522123893.
[32m[I 2023-04-26 12:22:23,932][39m Trial 220 finished with value: 0.875 and parameters: {'criterion': 'gini', 'n_estimators': 127, 'max_features': 0.1998943428277295, 'max_depth': 58, 'min_samples_split': 10, 'min_samples_leaf': 2}. Best is trial 68 with value: 0.8849557522123893.
[32m[I 2023-04-26 12:22:23,999][39m Trial 221 finished with value: 0.8672566371681416 and parameters: {'criterion': 'gini', 'n_estimators': 99, 'max_features': 0.06940654786911198, 'max_depth': 47, 'min_samples_split': 5, 'min_samples_leaf': 3}. Best is trial 68 with value: 0.8849557522123893.
