[32m[I 2023-04-26 12:22:24,111][39m Trial 222 finished with value: 0.8468468468468469 and parameters: {'criterion': 'gini', 'n_estimators': 178, 'max_features': 0.14625303962612127, 'max_depth': 15, 'min_samples_split': 5, 'min_samples_leaf': 3}. Best is trial 68 with value: 0.8849557522123893.
[32m[I 2023-04-26 12:22:24,227][39m Trial 223 finished with value: 0.8648648648648648 and parameters: {'criterion': 'gini', 'n_estimators': 182, 'max_features': 0.13062031492439208, 'max_depth': 16, 'min_samples_split': 6, 'min_samples_leaf': 2}. Best is trial 68 with value: 0.8849557522123893.
[32m[I 2023-04-26 12:22:24,366][39m Trial 224 finished with value: 0.8181818181818181 and parameters: {'criterion': 'entropy', 'n_estimators': 186, 'max_features': 0.6822071149590265, 'max_depth': 49, 'min_samples_split': 7, 'min_samples_leaf': 5}. Best is trial 68 with value: 0.8849557522123893.
[32m[I 2023-04-26 12:22:24,479][39m Trial 225 finished with value: 0.8468468468468469 and parameters: {'criterion': 'gini', 'n_estimators': 177, 'max_features': 0.17524045441215874, 'max_depth': 23, 'min_samples_split': 7, 'min_samples_leaf': 3}. Best is trial 68 with value: 0.8849557522123893.
[32m[I 2023-04-26 12:22:24,589][39m Trial 226 finished with value: 0.8672566371681416 and parameters: {'criterion': 'gini', 'n_estimators': 173, 'max_features': 0.03488560542672177, 'max_depth': 35, 'min_samples_split': 7, 'min_samples_leaf': 2}. Best is trial 68 with value: 0.8849557522123893.
[32m[I 2023-04-26 12:22:24,706][39m Trial 227 finished with value: 0.875 and parameters: {'criterion': 'gini', 'n_estimators': 187, 'max_features': 0.17426116182263535, 'max_depth': 17, 'min_samples_split': 9, 'min_samples_leaf': 1}. Best is trial 68 with value: 0.8849557522123893.
[32m[I 2023-04-26 12:22:24,803][39m Trial 228 finished with value: 0.8771929824561403 and parameters: {'criterion': 'gini', 'n_estimators': 151, 'max_features': 0.13877781786655033, 'max_depth': 51, 'min_samples_split': 9, 'min_samples_leaf': 2}. Best is trial 68 with value: 0.8849557522123893.
[32m[I 2023-04-26 12:22:24,913][39m Trial 229 finished with value: 0.8288288288288289 and parameters: {'criterion': 'gini', 'n_estimators': 155, 'max_features': 0.5415079349167752, 'max_depth': 56, 'min_samples_split': 9, 'min_samples_leaf': 2}. Best is trial 68 with value: 0.8849557522123893.
[32m[I 2023-04-26 12:22:25,003][39m Trial 230 finished with value: 0.875 and parameters: {'criterion': 'entropy', 'n_estimators': 136, 'max_features': 0.09555460578932193, 'max_depth': 41, 'min_samples_split': 3, 'min_samples_leaf': 3}. Best is trial 68 with value: 0.8849557522123893.
[32m[I 2023-04-26 12:22:25,106][39m Trial 231 finished with value: 0.8672566371681416 and parameters: {'criterion': 'entropy', 'n_estimators': 153, 'max_features': 0.15582064924443156, 'max_depth': 51, 'min_samples_split': 9, 'min_samples_leaf': 2}. Best is trial 68 with value: 0.8849557522123893.
[32m[I 2023-04-26 12:22:25,203][39m Trial 232 finished with value: 0.8545454545454546 and parameters: {'criterion': 'gini', 'n_estimators': 151, 'max_features': 0.1938226114616839, 'max_depth': 53, 'min_samples_split': 7, 'min_samples_leaf': 2}. Best is trial 68 with value: 0.8849557522123893.
[32m[I 2023-04-26 12:22:25,306][39m Trial 233 finished with value: 0.8648648648648648 and parameters: {'criterion': 'entropy', 'n_estimators': 157, 'max_features': 0.05735748568329281, 'max_depth': 54, 'min_samples_split': 10, 'min_samples_leaf': 2}. Best is trial 68 with value: 0.8849557522123893.
[32m[I 2023-04-26 12:22:25,408][39m Trial 234 finished with value: 0.8771929824561403 and parameters: {'criterion': 'gini', 'n_estimators': 159, 'max_features': 0.21372135215645774, 'max_depth': 10, 'min_samples_split': 9, 'min_samples_leaf': 2}. Best is trial 68 with value: 0.8849557522123893.
[32m[I 2023-04-26 12:22:25,512][39m Trial 235 finished with value: 0.8672566371681416 and parameters: {'criterion': 'gini', 'n_estimators': 161, 'max_features': 0.18473309879246955, 'max_depth': 8, 'min_samples_split': 9, 'min_samples_leaf': 2}. Best is trial 68 with value: 0.8849557522123893.
[32m[I 2023-04-26 12:22:25,609][39m Trial 236 finished with value: 0.8495575221238938 and parameters: {'criterion': 'gini', 'n_estimators': 146, 'max_features': 0.23341154698086658, 'max_depth': 39, 'min_samples_split': 5, 'min_samples_leaf': 3}. Best is trial 68 with value: 0.8849557522123893.
[32m[I 2023-04-26 12:22:25,736][39m Trial 237 finished with value: 0.8571428571428572 and parameters: {'criterion': 'gini', 'n_estimators': 197, 'max_features': 0.21910789424324323, 'max_depth': 45, 'min_samples_split': 8, 'min_samples_leaf': 1}. Best is trial 68 with value: 0.8849557522123893.
[32m[I 2023-04-26 12:22:25,836][39m Trial 238 finished with value: 0.8440366972477066 and parameters: {'criterion': 'gini', 'n_estimators': 150, 'max_features': 0.1077047807270743, 'max_depth': 58, 'min_samples_split': 9, 'min_samples_leaf': 3}. Best is trial 68 with value: 0.8849557522123893.
[32m[I 2023-04-26 12:22:25,961][39m Trial 239 finished with value: 0.8672566371681416 and parameters: {'criterion': 'gini', 'n_estimators': 190, 'max_features': 0.17056415979067363, 'max_depth': 51, 'min_samples_split': 4, 'min_samples_leaf': 1}. Best is trial 68 with value: 0.8849557522123893.
[32m[I 2023-04-26 12:22:26,083][39m Trial 240 finished with value: 0.8869565217391304 and parameters: {'criterion': 'gini', 'n_estimators': 194, 'max_features': 0.20980279820013858, 'max_depth': 15, 'min_samples_split': 8, 'min_samples_leaf': 2}. Best is trial 240 with value: 0.8869565217391304.
[32m[I 2023-04-26 12:22:26,183][39m Trial 241 finished with value: 0.8545454545454546 and parameters: {'criterion': 'gini', 'n_estimators': 144, 'max_features': 0.14751014663326362, 'max_depth': 21, 'min_samples_split': 5, 'min_samples_leaf': 3}. Best is trial 240 with value: 0.8869565217391304.
[32m[I 2023-04-26 12:22:26,304][39m Trial 242 finished with value: 0.8623853211009175 and parameters: {'criterion': 'gini', 'n_estimators': 192, 'max_features': 0.09462995740283517, 'max_depth': 48, 'min_samples_split': 8, 'min_samples_leaf': 3}. Best is trial 240 with value: 0.8869565217391304.
[32m[I 2023-04-26 12:22:26,405][39m Trial 243 finished with value: 0.8545454545454546 and parameters: {'criterion': 'gini', 'n_estimators': 149, 'max_features': 0.19462938233486918, 'max_depth': 45, 'min_samples_split': 9, 'min_samples_leaf': 2}. Best is trial 240 with value: 0.8869565217391304.
[32m[I 2023-04-26 12:22:26,513][39m Trial 244 finished with value: 0.8672566371681416 and parameters: {'criterion': 'gini', 'n_estimators': 154, 'max_features': 0.07217229193972872, 'max_depth': 9, 'min_samples_split': 5, 'min_samples_leaf': 2}. Best is trial 240 with value: 0.8869565217391304.
[32m[I 2023-04-26 12:22:26,618][39m Trial 245 finished with value: 0.8596491228070176 and parameters: {'criterion': 'gini', 'n_estimators': 160, 'max_features': 0.21064060986913266, 'max_depth': 34, 'min_samples_split': 10, 'min_samples_leaf': 2}. Best is trial 240 with value: 0.8869565217391304.
[32m[I 2023-04-26 12:22:26,724][39m Trial 246 finished with value: 0.8421052631578947 and parameters: {'criterion': 'gini', 'n_estimators': 163, 'max_features': 0.23158052845152322, 'max_depth': 4, 'min_samples_split': 9, 'min_samples_leaf': 1}. Best is trial 240 with value: 0.8869565217391304.
[32m[I 2023-04-26 12:22:26,848][39m Trial 247 finished with value: 0.8672566371681416 and parameters: {'criterion': 'gini', 'n_estimators': 184, 'max_features': 0.1562767193480586, 'max_depth': 11, 'min_samples_split': 9, 'min_samples_leaf': 2}. Best is trial 240 with value: 0.8869565217391304.
[32m[I 2023-04-26 12:22:26,949][39m Trial 248 finished with value: 0.8571428571428572 and parameters: {'criterion': 'gini', 'n_estimators': 149, 'max_features': 0.1632400764850544, 'max_depth': 18, 'min_samples_split': 9, 'min_samples_leaf': 2}. Best is trial 240 with value: 0.8869565217391304.
[32m[I 2023-04-26 12:22:27,073][39m Trial 249 finished with value: 0.8672566371681416 and parameters: {'criterion': 'gini', 'n_estimators': 187, 'max_features': 0.1763742302071893, 'max_depth': 15, 'min_samples_split': 9, 'min_samples_leaf': 1}. Best is trial 240 with value: 0.8869565217391304.
[32m[I 2023-04-26 12:22:27,161][39m Trial 250 finished with value: 0.8468468468468469 and parameters: {'criterion': 'gini', 'n_estimators': 129, 'max_features': 0.12950215718183794, 'max_depth': 10, 'min_samples_split': 8, 'min_samples_leaf': 2}. Best is trial 240 with value: 0.8869565217391304.
[32m[I 2023-04-26 12:22:27,284][39m Trial 251 finished with value: 0.8571428571428572 and parameters: {'criterion': 'gini', 'n_estimators': 187, 'max_features': 0.13178988047360246, 'max_depth': 16, 'min_samples_split': 9, 'min_samples_leaf': 1}. Best is trial 240 with value: 0.8869565217391304.
[32m[I 2023-04-26 12:22:27,395][39m Trial 252 finished with value: 0.8214285714285715 and parameters: {'criterion': 'entropy', 'n_estimators': 154, 'max_features': 0.35253999754701704, 'max_depth': 39, 'min_samples_split': 9, 'min_samples_leaf': 2}. Best is trial 240 with value: 0.8869565217391304.
[32m[I 2023-04-26 12:22:27,527][39m Trial 253 finished with value: 0.8141592920353982 and parameters: {'criterion': 'gini', 'n_estimators': 201, 'max_features': 0.21897111427926827, 'max_depth': 14, 'min_samples_split': 6, 'min_samples_leaf': 7}. Best is trial 240 with value: 0.8869565217391304.
[32m[I 2023-04-26 12:22:27,634][39m Trial 254 finished with value: 0.8468468468468469 and parameters: {'criterion': 'gini', 'n_estimators': 152, 'max_features': 0.25612767989516394, 'max_depth': 13, 'min_samples_split': 4, 'min_samples_leaf': 1}. Best is trial 240 with value: 0.8869565217391304.
[32m[I 2023-04-26 12:22:27,740][39m Trial 255 finished with value: 0.875 and parameters: {'criterion': 'gini', 'n_estimators': 157, 'max_features': 0.20979474469702697, 'max_depth': 7, 'min_samples_split': 3, 'min_samples_leaf': 2}. Best is trial 240 with value: 0.8869565217391304.
[32m[I 2023-04-26 12:22:27,869][39m Trial 256 finished with value: 0.8771929824561403 and parameters: {'criterion': 'gini', 'n_estimators': 184, 'max_features': 0.1455418753769058, 'max_depth': 11, 'min_samples_split': 9, 'min_samples_leaf': 2}. Best is trial 240 with value: 0.8869565217391304.
[32m[I 2023-04-26 12:22:27,993][39m Trial 257 finished with value: 0.8672566371681416 and parameters: {'criterion': 'gini', 'n_estimators': 193, 'max_features': 0.10917698708719949, 'max_depth': 46, 'min_samples_split': 5, 'min_samples_leaf': 3}. Best is trial 240 with value: 0.8869565217391304.
[32m[I 2023-04-26 12:22:28,114][39m Trial 258 finished with value: 0.8495575221238938 and parameters: {'criterion': 'gini', 'n_estimators': 183, 'max_features': 0.13892922845869465, 'max_depth': 41, 'min_samples_split': 3, 'min_samples_leaf': 2}. Best is trial 240 with value: 0.8869565217391304.
[32m[I 2023-04-26 12:22:28,204][39m Trial 259 finished with value: 0.8571428571428572 and parameters: {'criterion': 'gini', 'n_estimators': 125, 'max_features': 0.1943089346699125, 'max_depth': 12, 'min_samples_split': 9, 'min_samples_leaf': 2}. Best is trial 240 with value: 0.8869565217391304.
[32m[I 2023-04-26 12:22:28,281][39m Trial 260 finished with value: 0.8468468468468469 and parameters: {'criterion': 'entropy', 'n_estimators': 108, 'max_features': 0.12135284915378584, 'max_depth': 30, 'min_samples_split': 9, 'min_samples_leaf': 2}. Best is trial 240 with value: 0.8869565217391304.
[32m[I 2023-04-26 12:22:28,390][39m Trial 261 finished with value: 0.8363636363636363 and parameters: {'criterion': 'gini', 'n_estimators': 158, 'max_features': 0.1745012760041228, 'max_depth': 13, 'min_samples_split': 9, 'min_samples_leaf': 8}. Best is trial 240 with value: 0.8869565217391304.
[32m[I 2023-04-26 12:22:28,493][39m Trial 262 finished with value: 0.8771929824561403 and parameters: {'criterion': 'gini', 'n_estimators': 133, 'max_features': 0.15042644124621807, 'max_depth': 52, 'min_samples_split': 9, 'min_samples_leaf': 1}. Best is trial 240 with value: 0.8869565217391304.
[32m[I 2023-04-26 12:22:28,586][39m Trial 263 finished with value: 0.875 and parameters: {'criterion': 'entropy', 'n_estimators': 135, 'max_features': 0.08446742141334551, 'max_depth': 42, 'min_samples_split': 3, 'min_samples_leaf': 3}. Best is trial 240 with value: 0.8869565217391304.
[32m[I 2023-04-26 12:22:28,708][39m Trial 264 finished with value: 0.8771929824561403 and parameters: {'criterion': 'gini', 'n_estimators': 181, 'max_features': 0.14695702585780104, 'max_depth': 51, 'min_samples_split': 9, 'min_samples_leaf': 1}. Best is trial 240 with value: 0.8869565217391304.
[32m[I 2023-04-26 12:22:28,769][39m Trial 265 finished with value: 0.8288288288288289 and parameters: {'criterion': 'gini', 'n_estimators': 63, 'max_features': 0.15566998324791134, 'max_depth': 54, 'min_samples_split': 9, 'min_samples_leaf': 1}. Best is trial 240 with value: 0.8869565217391304.
[32m[I 2023-04-26 12:22:28,880][39m Trial 266 finished with value: 0.875 and parameters: {'criterion': 'gini', 'n_estimators': 164, 'max_features': 0.13953269840456367, 'max_depth': 52, 'min_samples_split': 9, 'min_samples_leaf': 1}. Best is trial 240 with value: 0.8869565217391304.
[32m[I 2023-04-26 12:22:29,008][39m Trial 267 finished with value: 0.8571428571428572 and parameters: {'criterion': 'gini', 'n_estimators': 197, 'max_features': 0.11269525210359321, 'max_depth': 50, 'min_samples_split': 8, 'min_samples_leaf': 1}. Best is trial 240 with value: 0.8869565217391304.
[32m[I 2023-04-26 12:22:29,093][39m Trial 268 finished with value: 0.8869565217391304 and parameters: {'criterion': 'gini', 'n_estimators': 120, 'max_features': 0.17674388189059084, 'max_depth': 50, 'min_samples_split': 9, 'min_samples_leaf': 1}. Best is trial 240 with value: 0.8869565217391304.
[32m[I 2023-04-26 12:22:29,176][39m Trial 269 finished with value: 0.8717948717948718 and parameters: {'criterion': 'gini', 'n_estimators': 104, 'max_features': 0.1533127379800725, 'max_depth': 49, 'min_samples_split': 9, 'min_samples_leaf': 1}. Best is trial 240 with value: 0.8869565217391304.
[32m[I 2023-04-26 12:22:29,269][39m Trial 270 finished with value: 0.8648648648648648 and parameters: {'criterion': 'gini', 'n_estimators': 121, 'max_features': 0.2048596266486818, 'max_depth': 51, 'min_samples_split': 9, 'min_samples_leaf': 1}. Best is trial 240 with value: 0.8869565217391304.
[32m[I 2023-04-26 12:22:29,368][39m Trial 271 finished with value: 0.8849557522123893 and parameters: {'criterion': 'gini', 'n_estimators': 140, 'max_features': 0.1740566756976515, 'max_depth': 50, 'min_samples_split': 9, 'min_samples_leaf': 1}. Best is trial 240 with value: 0.8869565217391304.
[32m[I 2023-04-26 12:22:29,465][39m Trial 272 finished with value: 0.8333333333333334 and parameters: {'criterion': 'gini', 'n_estimators': 143, 'max_features': 0.18422658777301276, 'max_depth': 50, 'min_samples_split': 9, 'min_samples_leaf': 1}. Best is trial 240 with value: 0.8869565217391304.
[32m[I 2023-04-26 12:22:29,555][39m Trial 273 finished with value: 0.8571428571428572 and parameters: {'criterion': 'gini', 'n_estimators': 132, 'max_features': 0.16843575285381812, 'max_depth': 52, 'min_samples_split': 9, 'min_samples_leaf': 1}. Best is trial 240 with value: 0.8869565217391304.
[32m[I 2023-04-26 12:22:29,648][39m Trial 274 finished with value: 0.8849557522123893 and parameters: {'criterion': 'gini', 'n_estimators': 142, 'max_features': 0.1420768710853208, 'max_depth': 55, 'min_samples_split': 9, 'min_samples_leaf': 1}. Best is trial 240 with value: 0.8869565217391304.
[32m[I 2023-04-26 12:22:29,747][39m Trial 275 finished with value: 0.8672566371681416 and parameters: {'criterion': 'gini', 'n_estimators': 145, 'max_features': 0.31030716567988537, 'max_depth': 55, 'min_samples_split': 9, 'min_samples_leaf': 1}. Best is trial 240 with value: 0.8869565217391304.
[32m[I 2023-04-26 12:22:29,847][39m Trial 276 finished with value: 0.8392857142857144 and parameters: {'criterion': 'gini', 'n_estimators': 139, 'max_features': 0.1492259825364746, 'max_depth': 53, 'min_samples_split': 9, 'min_samples_leaf': 1}. Best is trial 240 with value: 0.8869565217391304.
[32m[I 2023-04-26 12:22:29,945][39m Trial 277 finished with value: 0.8648648648648648 and parameters: {'criterion': 'gini', 'n_estimators': 140, 'max_features': 0.17982061059354787, 'max_depth': 56, 'min_samples_split': 9, 'min_samples_leaf': 1}. Best is trial 240 with value: 0.8869565217391304.
[32m[I 2023-04-26 12:22:30,046][39m Trial 278 finished with value: 0.8173913043478261 and parameters: {'criterion': 'gini', 'n_estimators': 147, 'max_features': 0.19335476322409595, 'max_depth': 47, 'min_samples_split': 2, 'min_samples_leaf': 1}. Best is trial 240 with value: 0.8869565217391304.
[32m[I 2023-04-26 12:22:30,128][39m Trial 279 finished with value: 0.8672566371681416 and parameters: {'criterion': 'gini', 'n_estimators': 117, 'max_features': 0.15389528141217576, 'max_depth': 54, 'min_samples_split': 9, 'min_samples_leaf': 1}. Best is trial 240 with value: 0.8869565217391304.
[32m[I 2023-04-26 12:22:30,213][39m Trial 280 finished with value: 0.8648648648648648 and parameters: {'criterion': 'gini', 'n_estimators': 112, 'max_features': 0.13479179832578178, 'max_depth': 49, 'min_samples_split': 9, 'min_samples_leaf': 1}. Best is trial 240 with value: 0.8869565217391304.
[32m[I 2023-04-26 12:22:30,302][39m Trial 281 finished with value: 0.875 and parameters: {'criterion': 'gini', 'n_estimators': 132, 'max_features': 0.16977167765011003, 'max_depth': 52, 'min_samples_split': 9, 'min_samples_leaf': 1}. Best is trial 240 with value: 0.8869565217391304.
[32m[I 2023-04-26 12:22:30,403][39m Trial 282 finished with value: 0.8571428571428572 and parameters: {'criterion': 'gini', 'n_estimators': 141, 'max_features': 0.2370339060413067, 'max_depth': 50, 'min_samples_split': 9, 'min_samples_leaf': 1}. Best is trial 240 with value: 0.8869565217391304.
[32m[I 2023-04-26 12:22:30,497][39m Trial 283 finished with value: 0.8849557522123893 and parameters: {'criterion': 'gini', 'n_estimators': 144, 'max_features': 0.1356770405848691, 'max_depth': 52, 'min_samples_split': 9, 'min_samples_leaf': 1}. Best is trial 240 with value: 0.8869565217391304.
[32m[I 2023-04-26 12:22:30,590][39m Trial 284 finished with value: 0.8571428571428572 and parameters: {'criterion': 'gini', 'n_estimators': 142, 'max_features': 0.12075994909754077, 'max_depth': 56, 'min_samples_split': 8, 'min_samples_leaf': 1}. Best is trial 240 with value: 0.8869565217391304.
[32m[I 2023-04-26 12:22:30,686][39m Trial 285 finished with value: 0.8771929824561403 and parameters: {'criterion': 'gini', 'n_estimators': 145, 'max_features': 0.2071998435193427, 'max_depth': 60, 'min_samples_split': 9, 'min_samples_leaf': 1}. Best is trial 240 with value: 0.8869565217391304.
[32m[I 2023-04-26 12:22:30,786][39m Trial 286 finished with value: 0.8468468468468469 and parameters: {'criterion': 'gini', 'n_estimators': 145, 'max_features': 0.21887592722707713, 'max_depth': 59, 'min_samples_split': 6, 'min_samples_leaf': 1}. Best is trial 240 with value: 0.8869565217391304.
[32m[I 2023-04-26 12:22:30,880][39m Trial 287 finished with value: 0.8363636363636363 and parameters: {'criterion': 'gini', 'n_estimators': 137, 'max_features': 0.13071425083235788, 'max_depth': 60, 'min_samples_split': 9, 'min_samples_leaf': 1}. Best is trial 240 with value: 0.8869565217391304.
[32m[I 2023-04-26 12:22:30,977][39m Trial 288 finished with value: 0.8849557522123893 and parameters: {'criterion': 'gini', 'n_estimators': 144, 'max_features': 0.14682719374704511, 'max_depth': 51, 'min_samples_split': 9, 'min_samples_leaf': 1}. Best is trial 240 with value: 0.8869565217391304.
[32m[I 2023-04-26 12:22:31,091][39m Trial 289 finished with value: 0.8214285714285715 and parameters: {'criterion': 'gini', 'n_estimators': 149, 'max_features': 0.9163643252367211, 'max_depth': 49, 'min_samples_split': 9, 'min_samples_leaf': 1}. Best is trial 240 with value: 0.8869565217391304.
[32m[I 2023-04-26 12:22:31,189][39m Trial 290 finished with value: 0.8869565217391304 and parameters: {'criterion': 'entropy', 'n_estimators': 142, 'max_features': 0.1632148077044138, 'max_depth': 53, 'min_samples_split': 8, 'min_samples_leaf': 1}. Best is trial 240 with value: 0.8869565217391304.
[32m[I 2023-04-26 12:22:31,281][39m Trial 291 finished with value: 0.875 and parameters: {'criterion': 'gini', 'n_estimators': 137, 'max_features': 0.15684594564550866, 'max_depth': 52, 'min_samples_split': 9, 'min_samples_leaf': 1}. Best is trial 240 with value: 0.8869565217391304.
[32m[I 2023-04-26 12:22:31,353][39m Trial 292 finished with value: 0.8571428571428572 and parameters: {'criterion': 'entropy', 'n_estimators': 100, 'max_features': 0.14165097082974926, 'max_depth': 54, 'min_samples_split': 9, 'min_samples_leaf': 1}. Best is trial 240 with value: 0.8869565217391304.
[32m[I 2023-04-26 12:22:31,452][39m Trial 293 finished with value: 0.8849557522123893 and parameters: {'criterion': 'gini', 'n_estimators': 140, 'max_features': 0.17631788962233735, 'max_depth': 61, 'min_samples_split': 8, 'min_samples_leaf': 1}. Best is trial 240 with value: 0.8869565217391304.
[32m[I 2023-04-26 12:22:31,548][39m Trial 294 finished with value: 0.8648648648648648 and parameters: {'criterion': 'gini', 'n_estimators': 142, 'max_features': 0.18077665765411777, 'max_depth': 55, 'min_samples_split': 8, 'min_samples_leaf': 1}. Best is trial 240 with value: 0.8869565217391304.
