[32m[I 2023-04-20 22:08:42,649][39m Trial 49 finished with value: 0.8421052631578947 and parameters: {'objective': 'Logloss', 'colsample_bylevel': 0.07675388504953067, 'depth': 4, 'boosting_type': 'Ordered', 'bootstrap_type': 'Bernoulli', 'subsample': 0.1733295927261469}. Best is trial 46 with value: 0.8596491228070176.
[32m[I 2023-04-20 22:08:48,717][39m Trial 50 finished with value: 0.8521739130434783 and parameters: {'objective': 'Logloss', 'colsample_bylevel': 0.06831144017542251, 'depth': 6, 'boosting_type': 'Ordered', 'bootstrap_type': 'Bayesian', 'bagging_temperature': 9.36378598928933}. Best is trial 46 with value: 0.8596491228070176.
[32m[I 2023-04-20 22:08:55,147][39m Trial 51 finished with value: 0.8521739130434783 and parameters: {'objective': 'Logloss', 'colsample_bylevel': 0.06151156361929162, 'depth': 6, 'boosting_type': 'Ordered', 'bootstrap_type': 'Bayesian', 'bagging_temperature': 8.260385996116284}. Best is trial 46 with value: 0.8596491228070176.
[32m[I 2023-04-20 22:08:59,797][39m Trial 52 finished with value: 0.8448275862068967 and parameters: {'objective': 'Logloss', 'colsample_bylevel': 0.058918825781224565, 'depth': 9, 'boosting_type': 'Ordered', 'bootstrap_type': 'Bayesian', 'bagging_temperature': 7.941861624420969}. Best is trial 46 with value: 0.8596491228070176.
[32m[I 2023-04-20 22:09:00,707][39m Trial 53 finished with value: 0.8347826086956522 and parameters: {'objective': 'Logloss', 'colsample_bylevel': 0.0755691998302441, 'depth': 6, 'boosting_type': 'Plain', 'bootstrap_type': 'MVS'}. Best is trial 46 with value: 0.8596491228070176.
[32m[I 2023-04-20 22:09:05,698][39m Trial 54 finished with value: 0.8448275862068967 and parameters: {'objective': 'Logloss', 'colsample_bylevel': 0.07190501113376645, 'depth': 5, 'boosting_type': 'Ordered', 'bootstrap_type': 'Bayesian', 'bagging_temperature': 8.927514530665514}. Best is trial 46 with value: 0.8596491228070176.
[32m[I 2023-04-20 22:09:10,228][39m Trial 55 finished with value: 0.8448275862068967 and parameters: {'objective': 'Logloss', 'colsample_bylevel': 0.050464414653089866, 'depth': 8, 'boosting_type': 'Ordered', 'bootstrap_type': 'Bayesian', 'bagging_temperature': 7.419621748812561}. Best is trial 46 with value: 0.8596491228070176.
[32m[I 2023-04-20 22:09:14,682][39m Trial 56 finished with value: 0.8596491228070176 and parameters: {'objective': 'Logloss', 'colsample_bylevel': 0.062200423459222824, 'depth': 7, 'boosting_type': 'Ordered', 'bootstrap_type': 'Bayesian', 'bagging_temperature': 8.428307040095547}. Best is trial 46 with value: 0.8596491228070176.
[32m[I 2023-04-20 22:09:19,137][39m Trial 57 finished with value: 0.8596491228070176 and parameters: {'objective': 'Logloss', 'colsample_bylevel': 0.05573768560357738, 'depth': 7, 'boosting_type': 'Ordered', 'bootstrap_type': 'Bayesian', 'bagging_temperature': 6.841169445396321}. Best is trial 46 with value: 0.8596491228070176.
[32m[I 2023-04-20 22:09:24,177][39m Trial 58 finished with value: 0.8596491228070176 and parameters: {'objective': 'Logloss', 'colsample_bylevel': 0.0616693087546732, 'depth': 5, 'boosting_type': 'Ordered', 'bootstrap_type': 'Bayesian', 'bagging_temperature': 8.297803218122283}. Best is trial 46 with value: 0.8596491228070176.
[32m[I 2023-04-20 22:09:28,382][39m Trial 59 finished with value: 0.8205128205128206 and parameters: {'objective': 'Logloss', 'colsample_bylevel': 0.04201538575457682, 'depth': 5, 'boosting_type': 'Ordered', 'bootstrap_type': 'Bayesian', 'bagging_temperature': 9.343825062449069}. Best is trial 46 with value: 0.8596491228070176.
[32m[I 2023-04-20 22:09:32,703][39m Trial 60 finished with value: 0.8521739130434783 and parameters: {'objective': 'Logloss', 'colsample_bylevel': 0.0554526951088926, 'depth': 3, 'boosting_type': 'Ordered', 'bootstrap_type': 'Bayesian', 'bagging_temperature': 9.796345297958098}. Best is trial 46 with value: 0.8596491228070176.
[32m[I 2023-04-20 22:09:36,975][39m Trial 61 finished with value: 0.8205128205128206 and parameters: {'objective': 'Logloss', 'colsample_bylevel': 0.05596785451219499, 'depth': 2, 'boosting_type': 'Ordered', 'bootstrap_type': 'Bayesian', 'bagging_temperature': 9.747426351334472}. Best is trial 46 with value: 0.8596491228070176.
[32m[I 2023-04-20 22:09:42,499][39m Trial 62 finished with value: 0.8448275862068967 and parameters: {'objective': 'Logloss', 'colsample_bylevel': 0.062084075131936735, 'depth': 6, 'boosting_type': 'Ordered', 'bootstrap_type': 'Bayesian', 'bagging_temperature': 7.7963720093195725}. Best is trial 46 with value: 0.8596491228070176.
[32m[I 2023-04-20 22:09:46,980][39m Trial 63 finished with value: 0.8376068376068375 and parameters: {'objective': 'Logloss', 'colsample_bylevel': 0.0743539442107404, 'depth': 7, 'boosting_type': 'Ordered', 'bootstrap_type': 'Bayesian', 'bagging_temperature': 8.81117355233872}. Best is trial 46 with value: 0.8596491228070176.
[32m[I 2023-04-20 22:09:51,300][39m Trial 64 finished with value: 0.8521739130434783 and parameters: {'objective': 'Logloss', 'colsample_bylevel': 0.049647800727823654, 'depth': 7, 'boosting_type': 'Ordered', 'bootstrap_type': 'Bayesian', 'bagging_temperature': 5.135367299586437}. Best is trial 46 with value: 0.8596491228070176.
[32m[I 2023-04-20 22:09:56,100][39m Trial 65 finished with value: 0.8571428571428572 and parameters: {'objective': 'Logloss', 'colsample_bylevel': 0.04731602233420819, 'depth': 6, 'boosting_type': 'Ordered', 'bootstrap_type': 'Bayesian', 'bagging_temperature': 5.685575364635313}. Best is trial 46 with value: 0.8596491228070176.
[32m[I 2023-04-20 22:10:03,797][39m Trial 66 finished with value: 0.8421052631578947 and parameters: {'objective': 'Logloss', 'colsample_bylevel': 0.09744445987300165, 'depth': 6, 'boosting_type': 'Ordered', 'bootstrap_type': 'Bernoulli', 'subsample': 0.7574235237212616}. Best is trial 46 with value: 0.8596491228070176.
[32m[I 2023-04-20 22:10:08,531][39m Trial 67 finished with value: 0.8521739130434783 and parameters: {'objective': 'Logloss', 'colsample_bylevel': 0.058395558880860024, 'depth': 5, 'boosting_type': 'Ordered', 'bootstrap_type': 'Bayesian', 'bagging_temperature': 5.5424938271845825}. Best is trial 46 with value: 0.8596491228070176.
[32m[I 2023-04-20 22:10:12,246][39m Trial 68 finished with value: 0.8099173553719008 and parameters: {'objective': 'Logloss', 'colsample_bylevel': 0.038857268854226336, 'depth': 4, 'boosting_type': 'Ordered', 'bootstrap_type': 'Bayesian', 'bagging_temperature': 5.599398746135761}. Best is trial 46 with value: 0.8596491228070176.
[32m[I 2023-04-20 22:10:15,615][39m Trial 69 finished with value: 0.8521739130434783 and parameters: {'objective': 'Logloss', 'colsample_bylevel': 0.04657082222513402, 'depth': 7, 'boosting_type': 'Ordered', 'bootstrap_type': 'Bayesian', 'bagging_temperature': 8.550024316827042}. Best is trial 46 with value: 0.8596491228070176.
[32m[I 2023-04-20 22:10:18,298][39m Trial 70 finished with value: 0.8305084745762712 and parameters: {'objective': 'Logloss', 'colsample_bylevel': 0.03313635550665939, 'depth': 5, 'boosting_type': 'Ordered', 'bootstrap_type': 'Bayesian', 'bagging_temperature': 0.8611120479045198}. Best is trial 46 with value: 0.8596491228070176.
[32m[I 2023-04-20 22:10:21,808][39m Trial 71 finished with value: 0.8521739130434783 and parameters: {'objective': 'Logloss', 'colsample_bylevel': 0.06912063074853286, 'depth': 6, 'boosting_type': 'Ordered', 'bootstrap_type': 'Bayesian', 'bagging_temperature': 6.785241304542127}. Best is trial 46 with value: 0.8596491228070176.
[32m[I 2023-04-20 22:10:24,727][39m Trial 72 finished with value: 0.8376068376068375 and parameters: {'objective': 'Logloss', 'colsample_bylevel': 0.049012113365084736, 'depth': 7, 'boosting_type': 'Ordered', 'bootstrap_type': 'Bayesian', 'bagging_temperature': 5.2049989970472526}. Best is trial 46 with value: 0.8596491228070176.
[32m[I 2023-04-20 22:10:28,318][39m Trial 73 finished with value: 0.8521739130434783 and parameters: {'objective': 'Logloss', 'colsample_bylevel': 0.06995659580739726, 'depth': 6, 'boosting_type': 'Ordered', 'bootstrap_type': 'Bayesian', 'bagging_temperature': 8.974405221513907}. Best is trial 46 with value: 0.8596491228070176.
[32m[I 2023-04-20 22:10:31,644][39m Trial 74 finished with value: 0.8521739130434783 and parameters: {'objective': 'Logloss', 'colsample_bylevel': 0.052306994210648314, 'depth': 6, 'boosting_type': 'Ordered', 'bootstrap_type': 'Bayesian', 'bagging_temperature': 6.181368513864918}. Best is trial 46 with value: 0.8596491228070176.
[32m[I 2023-04-20 22:10:35,102][39m Trial 75 finished with value: 0.8275862068965517 and parameters: {'objective': 'CrossEntropy', 'colsample_bylevel': 0.053368235337813166, 'depth': 6, 'boosting_type': 'Ordered', 'bootstrap_type': 'Bayesian', 'bagging_temperature': 7.529691473008227}. Best is trial 46 with value: 0.8596491228070176.
[32m[I 2023-04-20 22:10:38,431][39m Trial 76 finished with value: 0.8596491228070176 and parameters: {'objective': 'CrossEntropy', 'colsample_bylevel': 0.06359572613368558, 'depth': 8, 'boosting_type': 'Ordered', 'bootstrap_type': 'Bayesian', 'bagging_temperature': 8.093759467767319}. Best is trial 46 with value: 0.8596491228070176.
[32m[I 2023-04-20 22:10:41,985][39m Trial 77 finished with value: 0.8376068376068375 and parameters: {'objective': 'CrossEntropy', 'colsample_bylevel': 0.06448343279574378, 'depth': 5, 'boosting_type': 'Ordered', 'bootstrap_type': 'Bayesian', 'bagging_temperature': 6.708445567026488}. Best is trial 46 with value: 0.8596491228070176.
[32m[I 2023-04-20 22:10:46,122][39m Trial 78 finished with value: 0.8275862068965517 and parameters: {'objective': 'Logloss', 'colsample_bylevel': 0.07750431253203158, 'depth': 6, 'boosting_type': 'Ordered', 'bootstrap_type': 'Bernoulli', 'subsample': 0.36193254469535624}. Best is trial 46 with value: 0.8596491228070176.
[32m[I 2023-04-20 22:10:49,543][39m Trial 79 finished with value: 0.8421052631578947 and parameters: {'objective': 'CrossEntropy', 'colsample_bylevel': 0.08380315393396448, 'depth': 9, 'boosting_type': 'Ordered', 'bootstrap_type': 'Bayesian', 'bagging_temperature': 7.010017018444427}. Best is trial 46 with value: 0.8596491228070176.
[32m[I 2023-04-20 22:10:52,729][39m Trial 80 finished with value: 0.8521739130434783 and parameters: {'objective': 'Logloss', 'colsample_bylevel': 0.0628267943765856, 'depth': 8, 'boosting_type': 'Ordered', 'bootstrap_type': 'Bayesian', 'bagging_temperature': 8.206883459938155}. Best is trial 46 with value: 0.8596491228070176.
[32m[I 2023-04-20 22:10:56,102][39m Trial 81 finished with value: 0.8305084745762712 and parameters: {'objective': 'Logloss', 'colsample_bylevel': 0.06683814225520189, 'depth': 8, 'boosting_type': 'Ordered', 'bootstrap_type': 'Bayesian', 'bagging_temperature': 5.771113345462057}. Best is trial 46 with value: 0.8596491228070176.
[32m[I 2023-04-20 22:10:59,412][39m Trial 82 finished with value: 0.8521739130434783 and parameters: {'objective': 'CrossEntropy', 'colsample_bylevel': 0.05707016301554506, 'depth': 7, 'boosting_type': 'Ordered', 'bootstrap_type': 'Bayesian', 'bagging_temperature': 7.43125606915391}. Best is trial 46 with value: 0.8596491228070176.
[32m[I 2023-04-20 22:11:02,765][39m Trial 83 finished with value: 0.8448275862068967 and parameters: {'objective': 'Logloss', 'colsample_bylevel': 0.06017829996450869, 'depth': 7, 'boosting_type': 'Ordered', 'bootstrap_type': 'Bayesian', 'bagging_temperature': 8.067968783553013}. Best is trial 46 with value: 0.8596491228070176.
[32m[I 2023-04-20 22:11:06,040][39m Trial 84 finished with value: 0.8305084745762712 and parameters: {'objective': 'Logloss', 'colsample_bylevel': 0.04405382748830894, 'depth': 3, 'boosting_type': 'Ordered', 'bootstrap_type': 'Bayesian', 'bagging_temperature': 9.845554884319451}. Best is trial 46 with value: 0.8596491228070176.
[32m[I 2023-04-20 22:11:09,430][39m Trial 85 finished with value: 0.8421052631578947 and parameters: {'objective': 'Logloss', 'colsample_bylevel': 0.06484401797338689, 'depth': 2, 'boosting_type': 'Ordered', 'bootstrap_type': 'Bayesian', 'bagging_temperature': 8.69322450861001}. Best is trial 46 with value: 0.8596491228070176.
[32m[I 2023-04-20 22:11:13,009][39m Trial 86 finished with value: 0.8448275862068967 and parameters: {'objective': 'Logloss', 'colsample_bylevel': 0.05949251509264689, 'depth': 5, 'boosting_type': 'Ordered', 'bootstrap_type': 'Bayesian', 'bagging_temperature': 9.436158802532335}. Best is trial 46 with value: 0.8596491228070176.
[32m[I 2023-04-20 22:11:16,582][39m Trial 87 finished with value: 0.8347826086956522 and parameters: {'objective': 'Logloss', 'colsample_bylevel': 0.05260485877637503, 'depth': 7, 'boosting_type': 'Ordered', 'bootstrap_type': 'Bayesian', 'bagging_temperature': 6.377771818020722}. Best is trial 46 with value: 0.8596491228070176.
[32m[I 2023-04-20 22:11:19,985][39m Trial 88 finished with value: 0.8376068376068375 and parameters: {'objective': 'Logloss', 'colsample_bylevel': 0.054787801205520126, 'depth': 3, 'boosting_type': 'Ordered', 'bootstrap_type': 'Bayesian', 'bagging_temperature': 4.625724553926185}. Best is trial 46 with value: 0.8596491228070176.
[32m[I 2023-04-20 22:11:23,493][39m Trial 89 finished with value: 0.8448275862068967 and parameters: {'objective': 'Logloss', 'colsample_bylevel': 0.047131551591713075, 'depth': 7, 'boosting_type': 'Ordered', 'bootstrap_type': 'Bayesian', 'bagging_temperature': 5.050730065329075}. Best is trial 46 with value: 0.8596491228070176.
[32m[I 2023-04-20 22:11:24,270][39m Trial 90 finished with value: 0.8275862068965517 and parameters: {'objective': 'Logloss', 'colsample_bylevel': 0.06577630270148745, 'depth': 8, 'boosting_type': 'Plain', 'bootstrap_type': 'MVS'}. Best is trial 46 with value: 0.8596491228070176.
[32m[I 2023-04-20 22:11:28,179][39m Trial 91 finished with value: 0.8596491228070176 and parameters: {'objective': 'Logloss', 'colsample_bylevel': 0.054230326198245374, 'depth': 6, 'boosting_type': 'Ordered', 'bootstrap_type': 'Bayesian', 'bagging_temperature': 5.870009767617875}. Best is trial 46 with value: 0.8596491228070176.
[32m[I 2023-04-20 22:11:32,357][39m Trial 92 finished with value: 0.8376068376068375 and parameters: {'objective': 'Logloss', 'colsample_bylevel': 0.06926060916352537, 'depth': 6, 'boosting_type': 'Ordered', 'bootstrap_type': 'Bayesian', 'bagging_temperature': 5.859802096980367}. Best is trial 46 with value: 0.8596491228070176.
[32m[I 2023-04-20 22:11:35,900][39m Trial 93 finished with value: 0.8448275862068967 and parameters: {'objective': 'CrossEntropy', 'colsample_bylevel': 0.07210229586187845, 'depth': 9, 'boosting_type': 'Ordered', 'bootstrap_type': 'Bayesian', 'bagging_temperature': 7.582245820373397}. Best is trial 46 with value: 0.8596491228070176.
[32m[I 2023-04-20 22:11:39,739][39m Trial 94 finished with value: 0.8448275862068967 and parameters: {'objective': 'Logloss', 'colsample_bylevel': 0.06252635324409252, 'depth': 6, 'boosting_type': 'Ordered', 'bootstrap_type': 'Bayesian', 'bagging_temperature': 8.229620769332325}. Best is trial 46 with value: 0.8596491228070176.
[32m[I 2023-04-20 22:11:43,243][39m Trial 95 finished with value: 0.8521739130434783 and parameters: {'objective': 'Logloss', 'colsample_bylevel': 0.04912158687616943, 'depth': 7, 'boosting_type': 'Ordered', 'bootstrap_type': 'Bayesian', 'bagging_temperature': 5.202484154275127}. Best is trial 46 with value: 0.8596491228070176.
[32m[I 2023-04-20 22:11:46,823][39m Trial 96 finished with value: 0.8448275862068967 and parameters: {'objective': 'Logloss', 'colsample_bylevel': 0.041551795184614944, 'depth': 8, 'boosting_type': 'Ordered', 'bootstrap_type': 'Bayesian', 'bagging_temperature': 4.746692324527563}. Best is trial 46 with value: 0.8596491228070176.
[32m[I 2023-04-20 22:11:50,476][39m Trial 97 finished with value: 0.8521739130434783 and parameters: {'objective': 'Logloss', 'colsample_bylevel': 0.06075831798767444, 'depth': 5, 'boosting_type': 'Ordered', 'bootstrap_type': 'Bayesian', 'bagging_temperature': 6.400819889691954}. Best is trial 46 with value: 0.8596491228070176.
[32m[I 2023-04-20 22:11:54,259][39m Trial 98 finished with value: 0.8347826086956522 and parameters: {'objective': 'Logloss', 'colsample_bylevel': 0.05686708209459245, 'depth': 6, 'boosting_type': 'Ordered', 'bootstrap_type': 'Bernoulli', 'subsample': 0.7807076010063931}. Best is trial 46 with value: 0.8596491228070176.
[32m[I 2023-04-20 22:11:58,007][39m Trial 99 finished with value: 0.8596491228070176 and parameters: {'objective': 'CrossEntropy', 'colsample_bylevel': 0.07365516324066074, 'depth': 5, 'boosting_type': 'Ordered', 'bootstrap_type': 'Bayesian', 'bagging_temperature': 6.932301017585426}. Best is trial 46 with value: 0.8596491228070176.
Number of finished trials: 100
F1 Train:	77.37% (std: 4.51%)
F1 Test:	78.93% (std: 9.14%)
############################################################################################
############       F A S T   F E A T U R E  E N G G    A N D    S E L E C T I O N ! ########
# Be judicious with featurewiz. Don't use it to create too many un-interpretable features! #
############################################################################################
featurewiz has selected 0.7 as the correlation limit. Change this limit to fit your needs...
Skipping feature engineering since no feature_engg input...
Skipping category encoding since no category encoders specified in input...
#### Single_Label Binary_Classification problem ####
    Loaded train data. Shape = (372, 23)
#### Single_Label Binary_Classification problem ####
No test data filename given...
#######################################################################################
######################## C L A S S I F Y I N G  V A R I A B L E S  ####################
#######################################################################################
        No variables were removed since no ID or low-information variables found in data set
#######################################################################################
#####  Searching for Uncorrelated List Of Variables (SULOV) in 19 features ############
#######################################################################################
    there are no null values in dataset...
    Removing (7) highly correlated variables:
    ['Re', 'height', 'liquid_density', 'particle_droplet_diameter_ratio', 'roughness_binary', 'velocity', 'volume_fraction']
    Following (12) vars selected: ['droplet_diameter', 'inclination', 'long_impulse_duration', 'particle_liquid_density_ratio', 'surface_tension', 'voltage', 'roughness', 'We_Re', 'viscosity', 'We', 'particle_mean_diameter', 'volume_fraction_binary']
Completed SULOV. 12 features selected
Time taken for SULOV method = 0 seconds
Finally 15 vars selected after SULOV
Converting all features to numeric before sending to XGBoost...
    there were no mixed data types or object columns that errored. Data is all numeric...
Shape of train data after adding missing values flags = (372, 16)
#######################################################################################
#####    R E C U R S I V E   X G B O O S T : F E A T U R E   S E L E C T I O N  #######
#######################################################################################
Current number of predictors before recursive XGBoost = 15
Number of booster rounds = 100
            selecting 6 features in this iteration
            selecting 5 features in this iteration
            selecting 4 features in this iteration
            selecting 2 features in this iteration
            selecting 1 features in this iteration
    Completed XGBoost feature selection in 0 seconds
#######################################################################################
#####          F E A T U R E   S E L E C T I O N   C O M P L E T E D            #######
#######################################################################################
Selected 8 important features:
['roughness', 'viscosity', 'inclination', 'surface_tension', 'particle_mean_diameter', 'particle_liquid_density_ratio', 'We_Re', 'wettability']
Total Time taken for featurewiz selection = 0 seconds
Output contains a list of 8 important features and a train dataframe