[32m[I 2023-04-20 22:01:50,046][39m A new study created in memory with name: no-name-4ce6d517-334e-4291-acf3-b86c0fa3177f
[32m[I 2023-04-20 22:01:50,961][39m Trial 0 finished with value: 0.8571428571428572 and parameters: {'objective': 'Logloss', 'colsample_bylevel': 0.09119486135574104, 'depth': 7, 'boosting_type': 'Plain', 'bootstrap_type': 'Bernoulli', 'subsample': 0.7010081277565663}. Best is trial 0 with value: 0.8571428571428572.
[32m[I 2023-04-20 22:01:52,432][39m Trial 1 finished with value: 0.8521739130434783 and parameters: {'objective': 'CrossEntropy', 'colsample_bylevel': 0.048746643415168454, 'depth': 8, 'boosting_type': 'Plain', 'bootstrap_type': 'Bayesian', 'bagging_temperature': 7.854052832362322}. Best is trial 0 with value: 0.8571428571428572.
[32m[I 2023-04-20 22:01:57,730][39m Trial 2 finished with value: 0.8347826086956522 and parameters: {'objective': 'Logloss', 'colsample_bylevel': 0.02595206044109761, 'depth': 9, 'boosting_type': 'Ordered', 'bootstrap_type': 'Bayesian', 'bagging_temperature': 1.498993526196618}. Best is trial 0 with value: 0.8571428571428572.
[32m[I 2023-04-20 22:01:59,191][39m Trial 3 finished with value: 0.8034188034188032 and parameters: {'objective': 'Logloss', 'colsample_bylevel': 0.012013073051315035, 'depth': 6, 'boosting_type': 'Plain', 'bootstrap_type': 'MVS'}. Best is trial 0 with value: 0.8571428571428572.
[32m[I 2023-04-20 22:02:04,340][39m Trial 4 finished with value: 0.8305084745762712 and parameters: {'objective': 'Logloss', 'colsample_bylevel': 0.05425356376957892, 'depth': 2, 'boosting_type': 'Ordered', 'bootstrap_type': 'Bernoulli', 'subsample': 0.4987606966502035}. Best is trial 0 with value: 0.8571428571428572.
[32m[I 2023-04-20 22:02:09,381][39m Trial 5 finished with value: 0.8166666666666667 and parameters: {'objective': 'CrossEntropy', 'colsample_bylevel': 0.01704378260800809, 'depth': 4, 'boosting_type': 'Ordered', 'bootstrap_type': 'Bernoulli', 'subsample': 0.6353404656574405}. Best is trial 0 with value: 0.8571428571428572.
[32m[I 2023-04-20 22:02:10,671][39m Trial 6 finished with value: 0.8275862068965517 and parameters: {'objective': 'CrossEntropy', 'colsample_bylevel': 0.04291165496125669, 'depth': 9, 'boosting_type': 'Plain', 'bootstrap_type': 'MVS'}. Best is trial 0 with value: 0.8571428571428572.
[32m[I 2023-04-20 22:02:11,943][39m Trial 7 finished with value: 0.784 and parameters: {'objective': 'Logloss', 'colsample_bylevel': 0.01534464685318973, 'depth': 4, 'boosting_type': 'Plain', 'bootstrap_type': 'Bernoulli', 'subsample': 0.5259865397688359}. Best is trial 0 with value: 0.8571428571428572.
[32m[I 2023-04-20 22:02:17,192][39m Trial 8 finished with value: 0.8305084745762712 and parameters: {'objective': 'Logloss', 'colsample_bylevel': 0.026021997802834318, 'depth': 12, 'boosting_type': 'Ordered', 'bootstrap_type': 'Bayesian', 'bagging_temperature': 5.557987661763956}. Best is trial 0 with value: 0.8571428571428572.
[32m[I 2023-04-20 22:02:18,391][39m Trial 9 finished with value: 0.8275862068965517 and parameters: {'objective': 'CrossEntropy', 'colsample_bylevel': 0.09390282804499689, 'depth': 10, 'boosting_type': 'Plain', 'bootstrap_type': 'Bernoulli', 'subsample': 0.8971895733321882}. Best is trial 0 with value: 0.8571428571428572.
[32m[I 2023-04-20 22:02:19,462][39m Trial 10 finished with value: 0.8571428571428572 and parameters: {'objective': 'Logloss', 'colsample_bylevel': 0.09709195498468828, 'depth': 6, 'boosting_type': 'Plain', 'bootstrap_type': 'Bernoulli', 'subsample': 0.19310341490901067}. Best is trial 0 with value: 0.8571428571428572.
[33m[W 2023-04-20 22:02:19,620][39m Trial 11 failed because of the following error: KeyboardInterrupt('')
Traceback (most recent call last):
  File "C:\Users\dimaz\AppData\Local\Packages\PythonSoftwareFoundation.Python.3.10_qbz5n2kfra8p0\LocalCache\local-packages\Python310\site-packages\optuna\study\_optimize.py", line 196, in _run_trial
    value_or_values = func(trial)
  File "d:\ФТиАД\vkr_gh\Drop_wall_impact\notebooks\../utils_functionality\models\hyperparams_tuning.py", line 41, in obj
    def obj(trial): return objective(
  File "d:\ФТиАД\vkr_gh\Drop_wall_impact\notebooks\../utils_functionality\models\hyperparams_tuning.py", line 28, in objective
    gbm.fit(train_x, train_y, eval_set=[
  File "C:\Users\dimaz\AppData\Local\Packages\PythonSoftwareFoundation.Python.3.10_qbz5n2kfra8p0\LocalCache\local-packages\Python310\site-packages\catboost\core.py", line 5128, in fit
    self._fit(X, y, cat_features, text_features, embedding_features, None, sample_weight, None, None, None, None, baseline, use_best_model,
  File "C:\Users\dimaz\AppData\Local\Packages\PythonSoftwareFoundation.Python.3.10_qbz5n2kfra8p0\LocalCache\local-packages\Python310\site-packages\catboost\core.py", line 2355, in _fit
    self._train(
  File "C:\Users\dimaz\AppData\Local\Packages\PythonSoftwareFoundation.Python.3.10_qbz5n2kfra8p0\LocalCache\local-packages\Python310\site-packages\catboost\core.py", line 1759, in _train
    self._object._train(train_pool, test_pool, params, allow_clear_pool, init_model._object if init_model else None)
  File "_catboost.pyx", line 4622, in _catboost._CatBoost._train
  File "_catboost.pyx", line 4671, in _catboost._CatBoost._train
KeyboardInterrupt
[32m[I 2023-04-20 22:02:31,374][39m A new study created in memory with name: no-name-30c87423-4302-4a39-8d2d-d314bcf7605a
[32m[I 2023-04-20 22:02:32,210][39m Trial 0 finished with value: 0.8571428571428572 and parameters: {'objective': 'CrossEntropy', 'colsample_bylevel': 0.08969699313032663, 'depth': 11, 'boosting_type': 'Plain', 'bootstrap_type': 'Bernoulli', 'subsample': 0.8162734053471495}. Best is trial 0 with value: 0.8571428571428572.
[32m[I 2023-04-20 22:02:33,363][39m Trial 1 finished with value: 0.8275862068965517 and parameters: {'objective': 'CrossEntropy', 'colsample_bylevel': 0.060008507812919894, 'depth': 11, 'boosting_type': 'Plain', 'bootstrap_type': 'Bernoulli', 'subsample': 0.43552710762424884}. Best is trial 0 with value: 0.8571428571428572.
Number of finished trials: 2
[32m[I 2023-04-20 22:05:35,995][39m A new study created in memory with name: no-name-0f287cb9-bd9b-4191-b9e5-aa9c2008ddde
[32m[I 2023-04-20 22:05:36,847][39m Trial 0 finished with value: 0.8205128205128206 and parameters: {'objective': 'CrossEntropy', 'colsample_bylevel': 0.03618318340182489, 'depth': 3, 'boosting_type': 'Plain', 'bootstrap_type': 'MVS'}. Best is trial 0 with value: 0.8205128205128206.
[32m[I 2023-04-20 22:05:37,667][39m Trial 1 finished with value: 0.8205128205128206 and parameters: {'objective': 'CrossEntropy', 'colsample_bylevel': 0.08817831274498375, 'depth': 1, 'boosting_type': 'Plain', 'bootstrap_type': 'Bayesian', 'bagging_temperature': 9.278852565672159}. Best is trial 0 with value: 0.8205128205128206.
[32m[I 2023-04-20 22:05:41,987][39m Trial 2 finished with value: 0.8495575221238938 and parameters: {'objective': 'CrossEntropy', 'colsample_bylevel': 0.05839242440307504, 'depth': 7, 'boosting_type': 'Ordered', 'bootstrap_type': 'Bayesian', 'bagging_temperature': 8.984220907596987}. Best is trial 2 with value: 0.8495575221238938.
[32m[I 2023-04-20 22:05:43,113][39m Trial 3 finished with value: 0.8347826086956522 and parameters: {'objective': 'CrossEntropy', 'colsample_bylevel': 0.055336199833429106, 'depth': 5, 'boosting_type': 'Plain', 'bootstrap_type': 'Bernoulli', 'subsample': 0.5634780569292034}. Best is trial 2 with value: 0.8495575221238938.
[32m[I 2023-04-20 22:05:44,164][39m Trial 4 finished with value: 0.8347826086956522 and parameters: {'objective': 'CrossEntropy', 'colsample_bylevel': 0.08527651561124776, 'depth': 3, 'boosting_type': 'Plain', 'bootstrap_type': 'Bayesian', 'bagging_temperature': 3.011472175112183}. Best is trial 2 with value: 0.8495575221238938.
[32m[I 2023-04-20 22:05:44,957][39m Trial 5 finished with value: 0.8421052631578947 and parameters: {'objective': 'CrossEntropy', 'colsample_bylevel': 0.091165325307439, 'depth': 6, 'boosting_type': 'Plain', 'bootstrap_type': 'Bernoulli', 'subsample': 0.47952391567883446}. Best is trial 2 with value: 0.8495575221238938.
[32m[I 2023-04-20 22:05:46,171][39m Trial 6 finished with value: 0.8275862068965517 and parameters: {'objective': 'CrossEntropy', 'colsample_bylevel': 0.05537370263444938, 'depth': 5, 'boosting_type': 'Plain', 'bootstrap_type': 'Bernoulli', 'subsample': 0.57615965612657}. Best is trial 2 with value: 0.8495575221238938.
[32m[I 2023-04-20 22:05:50,532][39m Trial 7 finished with value: 0.8135593220338982 and parameters: {'objective': 'Logloss', 'colsample_bylevel': 0.05239821429643038, 'depth': 10, 'boosting_type': 'Ordered', 'bootstrap_type': 'MVS'}. Best is trial 2 with value: 0.8495575221238938.
[32m[I 2023-04-20 22:05:51,602][39m Trial 8 finished with value: 0.8521739130434783 and parameters: {'objective': 'Logloss', 'colsample_bylevel': 0.025391634728308063, 'depth': 11, 'boosting_type': 'Plain', 'bootstrap_type': 'MVS'}. Best is trial 8 with value: 0.8521739130434783.
[32m[I 2023-04-20 22:05:52,565][39m Trial 9 finished with value: 0.8275862068965517 and parameters: {'objective': 'CrossEntropy', 'colsample_bylevel': 0.05969116994810576, 'depth': 7, 'boosting_type': 'Plain', 'bootstrap_type': 'MVS'}. Best is trial 8 with value: 0.8521739130434783.
[32m[I 2023-04-20 22:05:57,016][39m Trial 10 finished with value: 0.8032786885245901 and parameters: {'objective': 'Logloss', 'colsample_bylevel': 0.012661719576251458, 'depth': 12, 'boosting_type': 'Ordered', 'bootstrap_type': 'MVS'}. Best is trial 8 with value: 0.8521739130434783.
[32m[I 2023-04-20 22:06:02,308][39m Trial 11 finished with value: 0.8166666666666667 and parameters: {'objective': 'Logloss', 'colsample_bylevel': 0.024904310437957128, 'depth': 9, 'boosting_type': 'Ordered', 'bootstrap_type': 'Bayesian', 'bagging_temperature': 9.654562240000093}. Best is trial 8 with value: 0.8521739130434783.
[32m[I 2023-04-20 22:06:07,760][39m Trial 12 finished with value: 0.8521739130434783 and parameters: {'objective': 'Logloss', 'colsample_bylevel': 0.07116977276178485, 'depth': 12, 'boosting_type': 'Ordered', 'bootstrap_type': 'Bayesian', 'bagging_temperature': 6.008569560950848}. Best is trial 8 with value: 0.8521739130434783.
[32m[I 2023-04-20 22:06:13,520][39m Trial 13 finished with value: 0.8275862068965517 and parameters: {'objective': 'Logloss', 'colsample_bylevel': 0.07484354487031536, 'depth': 12, 'boosting_type': 'Ordered', 'bootstrap_type': 'MVS'}. Best is trial 8 with value: 0.8521739130434783.
[32m[I 2023-04-20 22:06:18,207][39m Trial 14 finished with value: 0.8347826086956522 and parameters: {'objective': 'Logloss', 'colsample_bylevel': 0.03484145277600318, 'depth': 10, 'boosting_type': 'Ordered', 'bootstrap_type': 'Bayesian', 'bagging_temperature': 5.186242034435808}. Best is trial 8 with value: 0.8521739130434783.
[32m[I 2023-04-20 22:06:23,139][39m Trial 15 finished with value: 0.8347826086956522 and parameters: {'objective': 'Logloss', 'colsample_bylevel': 0.07268517869877725, 'depth': 9, 'boosting_type': 'Ordered', 'bootstrap_type': 'MVS'}. Best is trial 8 with value: 0.8521739130434783.
[32m[I 2023-04-20 22:06:24,451][39m Trial 16 finished with value: 0.8347826086956522 and parameters: {'objective': 'Logloss', 'colsample_bylevel': 0.07261440193696372, 'depth': 12, 'boosting_type': 'Plain', 'bootstrap_type': 'Bayesian', 'bagging_temperature': 0.17534004768325406}. Best is trial 8 with value: 0.8521739130434783.
[32m[I 2023-04-20 22:06:30,669][39m Trial 17 finished with value: 0.8468468468468469 and parameters: {'objective': 'Logloss', 'colsample_bylevel': 0.09968130704882255, 'depth': 10, 'boosting_type': 'Ordered', 'bootstrap_type': 'Bayesian', 'bagging_temperature': 5.532859617369481}. Best is trial 8 with value: 0.8521739130434783.
[32m[I 2023-04-20 22:06:35,859][39m Trial 18 finished with value: 0.8205128205128206 and parameters: {'objective': 'Logloss', 'colsample_bylevel': 0.04344139927761852, 'depth': 11, 'boosting_type': 'Ordered', 'bootstrap_type': 'MVS'}. Best is trial 8 with value: 0.8521739130434783.
[32m[I 2023-04-20 22:06:37,077][39m Trial 19 finished with value: 0.8166666666666667 and parameters: {'objective': 'Logloss', 'colsample_bylevel': 0.011435998128169443, 'depth': 8, 'boosting_type': 'Plain', 'bootstrap_type': 'Bernoulli', 'subsample': 0.9825084137582307}. Best is trial 8 with value: 0.8521739130434783.
[32m[I 2023-04-20 22:06:38,117][39m Trial 20 finished with value: 0.8099173553719008 and parameters: {'objective': 'Logloss', 'colsample_bylevel': 0.022244571729119932, 'depth': 11, 'boosting_type': 'Plain', 'bootstrap_type': 'MVS'}. Best is trial 8 with value: 0.8521739130434783.
[32m[I 2023-04-20 22:06:42,997][39m Trial 21 finished with value: 0.8521739130434783 and parameters: {'objective': 'CrossEntropy', 'colsample_bylevel': 0.06591599064591122, 'depth': 8, 'boosting_type': 'Ordered', 'bootstrap_type': 'Bayesian', 'bagging_temperature': 7.355053664051899}. Best is trial 8 with value: 0.8521739130434783.
[32m[I 2023-04-20 22:06:48,769][39m Trial 22 finished with value: 0.8521739130434783 and parameters: {'objective': 'Logloss', 'colsample_bylevel': 0.0686315378123266, 'depth': 8, 'boosting_type': 'Ordered', 'bootstrap_type': 'Bayesian', 'bagging_temperature': 6.8560452014412405}. Best is trial 8 with value: 0.8521739130434783.
[32m[I 2023-04-20 22:06:54,437][39m Trial 23 finished with value: 0.8421052631578947 and parameters: {'objective': 'CrossEntropy', 'colsample_bylevel': 0.06434213845164395, 'depth': 8, 'boosting_type': 'Ordered', 'bootstrap_type': 'Bayesian', 'bagging_temperature': 7.2864592871102865}. Best is trial 8 with value: 0.8521739130434783.
[32m[I 2023-04-20 22:07:00,592][39m Trial 24 finished with value: 0.8448275862068967 and parameters: {'objective': 'Logloss', 'colsample_bylevel': 0.08066546162442557, 'depth': 11, 'boosting_type': 'Ordered', 'bootstrap_type': 'Bayesian', 'bagging_temperature': 3.51634045757259}. Best is trial 8 with value: 0.8521739130434783.
[32m[I 2023-04-20 22:07:06,220][39m Trial 25 finished with value: 0.8521739130434783 and parameters: {'objective': 'Logloss', 'colsample_bylevel': 0.06607657168177292, 'depth': 8, 'boosting_type': 'Ordered', 'bootstrap_type': 'Bayesian', 'bagging_temperature': 6.95818074555984}. Best is trial 8 with value: 0.8521739130434783.
[32m[I 2023-04-20 22:07:11,899][39m Trial 26 finished with value: 0.8305084745762712 and parameters: {'objective': 'CrossEntropy', 'colsample_bylevel': 0.04548075741431959, 'depth': 6, 'boosting_type': 'Ordered', 'bootstrap_type': 'Bayesian', 'bagging_temperature': 7.256652488370322}. Best is trial 8 with value: 0.8521739130434783.
[32m[I 2023-04-20 22:07:17,627][39m Trial 27 finished with value: 0.8305084745762712 and parameters: {'objective': 'Logloss', 'colsample_bylevel': 0.047206242122681846, 'depth': 9, 'boosting_type': 'Ordered', 'bootstrap_type': 'MVS'}. Best is trial 8 with value: 0.8521739130434783.
[32m[I 2023-04-20 22:07:18,909][39m Trial 28 finished with value: 0.8376068376068375 and parameters: {'objective': 'Logloss', 'colsample_bylevel': 0.030229167562632088, 'depth': 11, 'boosting_type': 'Plain', 'bootstrap_type': 'Bayesian', 'bagging_temperature': 3.1229534196757056}. Best is trial 8 with value: 0.8521739130434783.
[32m[I 2023-04-20 22:07:23,732][39m Trial 29 finished with value: 0.8495575221238938 and parameters: {'objective': 'CrossEntropy', 'colsample_bylevel': 0.06672010831590514, 'depth': 8, 'boosting_type': 'Ordered', 'bootstrap_type': 'Bayesian', 'bagging_temperature': 7.78696844552701}. Best is trial 8 with value: 0.8521739130434783.
[32m[I 2023-04-20 22:07:28,351][39m Trial 30 finished with value: 0.8495575221238938 and parameters: {'objective': 'CrossEntropy', 'colsample_bylevel': 0.08032870928640612, 'depth': 4, 'boosting_type': 'Ordered', 'bootstrap_type': 'Bayesian', 'bagging_temperature': 6.58337371757189}. Best is trial 8 with value: 0.8521739130434783.
[32m[I 2023-04-20 22:07:32,937][39m Trial 31 finished with value: 0.8521739130434783 and parameters: {'objective': 'Logloss', 'colsample_bylevel': 0.06486691034880858, 'depth': 7, 'boosting_type': 'Ordered', 'bootstrap_type': 'Bayesian', 'bagging_temperature': 8.521431883417423}. Best is trial 8 with value: 0.8521739130434783.
[32m[I 2023-04-20 22:07:37,336][39m Trial 32 finished with value: 0.8205128205128206 and parameters: {'objective': 'Logloss', 'colsample_bylevel': 0.06354560563374682, 'depth': 1, 'boosting_type': 'Ordered', 'bootstrap_type': 'Bayesian', 'bagging_temperature': 8.598419118186882}. Best is trial 8 with value: 0.8521739130434783.
[32m[I 2023-04-20 22:07:41,717][39m Trial 33 finished with value: 0.8521739130434783 and parameters: {'objective': 'Logloss', 'colsample_bylevel': 0.0496043946525978, 'depth': 8, 'boosting_type': 'Ordered', 'bootstrap_type': 'Bayesian', 'bagging_temperature': 6.310707705979537}. Best is trial 8 with value: 0.8521739130434783.
[32m[I 2023-04-20 22:07:42,738][39m Trial 34 finished with value: 0.8376068376068375 and parameters: {'objective': 'Logloss', 'colsample_bylevel': 0.03839653164535347, 'depth': 7, 'boosting_type': 'Plain', 'bootstrap_type': 'Bernoulli', 'subsample': 0.20862639588751664}. Best is trial 8 with value: 0.8521739130434783.
[32m[I 2023-04-20 22:07:48,214][39m Trial 35 finished with value: 0.8448275862068967 and parameters: {'objective': 'Logloss', 'colsample_bylevel': 0.07922005625025348, 'depth': 5, 'boosting_type': 'Ordered', 'bootstrap_type': 'Bayesian', 'bagging_temperature': 4.343416164106056}. Best is trial 8 with value: 0.8521739130434783.
[32m[I 2023-04-20 22:07:49,087][39m Trial 36 finished with value: 0.8347826086956522 and parameters: {'objective': 'Logloss', 'colsample_bylevel': 0.05064071444194918, 'depth': 6, 'boosting_type': 'Plain', 'bootstrap_type': 'MVS'}. Best is trial 8 with value: 0.8521739130434783.
[32m[I 2023-04-20 22:07:50,007][39m Trial 37 finished with value: 0.8205128205128206 and parameters: {'objective': 'Logloss', 'colsample_bylevel': 0.05780356081173377, 'depth': 10, 'boosting_type': 'Plain', 'bootstrap_type': 'Bernoulli', 'subsample': 0.9525467677486277}. Best is trial 8 with value: 0.8521739130434783.
[32m[I 2023-04-20 22:07:54,827][39m Trial 38 finished with value: 0.8347826086956522 and parameters: {'objective': 'Logloss', 'colsample_bylevel': 0.0892262519999186, 'depth': 12, 'boosting_type': 'Ordered', 'bootstrap_type': 'Bayesian', 'bagging_temperature': 8.392429399301959}. Best is trial 8 with value: 0.8521739130434783.
[32m[I 2023-04-20 22:07:55,913][39m Trial 39 finished with value: 0.8067226890756303 and parameters: {'objective': 'Logloss', 'colsample_bylevel': 0.019206341483692622, 'depth': 9, 'boosting_type': 'Plain', 'bootstrap_type': 'Bayesian', 'bagging_temperature': 6.014838200226519}. Best is trial 8 with value: 0.8521739130434783.
[32m[I 2023-04-20 22:08:00,417][39m Trial 40 finished with value: 0.8305084745762712 and parameters: {'objective': 'CrossEntropy', 'colsample_bylevel': 0.06999167597118681, 'depth': 4, 'boosting_type': 'Ordered', 'bootstrap_type': 'Bayesian', 'bagging_temperature': 6.16888446574636}. Best is trial 8 with value: 0.8521739130434783.
[32m[I 2023-04-20 22:08:04,492][39m Trial 41 finished with value: 0.8347826086956522 and parameters: {'objective': 'CrossEntropy', 'colsample_bylevel': 0.06038107087167495, 'depth': 7, 'boosting_type': 'Ordered', 'bootstrap_type': 'Bayesian', 'bagging_temperature': 7.841061817957957}. Best is trial 8 with value: 0.8521739130434783.
[32m[I 2023-04-20 22:08:08,470][39m Trial 42 finished with value: 0.8448275862068967 and parameters: {'objective': 'CrossEntropy', 'colsample_bylevel': 0.05306190570030923, 'depth': 7, 'boosting_type': 'Ordered', 'bootstrap_type': 'Bayesian', 'bagging_temperature': 6.564706265049464}. Best is trial 8 with value: 0.8521739130434783.
[32m[I 2023-04-20 22:08:12,567][39m Trial 43 finished with value: 0.8521739130434783 and parameters: {'objective': 'Logloss', 'colsample_bylevel': 0.06218244400589941, 'depth': 8, 'boosting_type': 'Ordered', 'bootstrap_type': 'Bayesian', 'bagging_temperature': 7.9993236120189755}. Best is trial 8 with value: 0.8521739130434783.
[32m[I 2023-04-20 22:08:16,497][39m Trial 44 finished with value: 0.8448275862068967 and parameters: {'objective': 'CrossEntropy', 'colsample_bylevel': 0.06724830088611936, 'depth': 8, 'boosting_type': 'Ordered', 'bootstrap_type': 'Bayesian', 'bagging_temperature': 7.0852132022066145}. Best is trial 8 with value: 0.8521739130434783.
[32m[I 2023-04-20 22:08:20,537][39m Trial 45 finished with value: 0.8275862068965517 and parameters: {'objective': 'Logloss', 'colsample_bylevel': 0.05560469398707882, 'depth': 7, 'boosting_type': 'Ordered', 'bootstrap_type': 'MVS'}. Best is trial 8 with value: 0.8521739130434783.
[32m[I 2023-04-20 22:08:26,128][39m Trial 46 finished with value: 0.8596491228070176 and parameters: {'objective': 'Logloss', 'colsample_bylevel': 0.0626962612604579, 'depth': 6, 'boosting_type': 'Ordered', 'bootstrap_type': 'Bayesian', 'bagging_temperature': 8.075072644248651}. Best is trial 46 with value: 0.8596491228070176.
[32m[I 2023-04-20 22:08:31,317][39m Trial 47 finished with value: 0.8347826086956522 and parameters: {'objective': 'CrossEntropy', 'colsample_bylevel': 0.08358969581292519, 'depth': 5, 'boosting_type': 'Ordered', 'bootstrap_type': 'Bayesian', 'bagging_temperature': 4.595045321428193}. Best is trial 46 with value: 0.8596491228070176.
[32m[I 2023-04-20 22:08:37,987][39m Trial 48 finished with value: 0.8596491228070176 and parameters: {'objective': 'Logloss', 'colsample_bylevel': 0.07683658113154736, 'depth': 6, 'boosting_type': 'Ordered', 'bootstrap_type': 'Bayesian', 'bagging_temperature': 5.837753144429016}. Best is trial 46 with value: 0.8596491228070176.
