[32m[I 2023-04-26 00:18:14,182][39m Trial 438 finished with value: 0.8288288288288289 and parameters: {'criterion': 'entropy', 'n_estimators': 201, 'max_features': 0.4728482249298517, 'max_depth': 39, 'min_samples_split': 2, 'min_samples_leaf': 2}. Best is trial 308 with value: 0.8947368421052632.
[32m[I 2023-04-26 00:18:14,307][39m Trial 439 finished with value: 0.8672566371681416 and parameters: {'criterion': 'entropy', 'n_estimators': 160, 'max_features': 0.3052767951658479, 'max_depth': 63, 'min_samples_split': 2, 'min_samples_leaf': 4}. Best is trial 308 with value: 0.8947368421052632.
[32m[I 2023-04-26 00:18:14,425][39m Trial 440 finished with value: 0.8571428571428572 and parameters: {'criterion': 'gini', 'n_estimators': 166, 'max_features': 0.22760475345286846, 'max_depth': 4, 'min_samples_split': 2, 'min_samples_leaf': 4}. Best is trial 308 with value: 0.8947368421052632.
[32m[I 2023-04-26 00:18:14,540][39m Trial 441 finished with value: 0.8392857142857144 and parameters: {'criterion': 'entropy', 'n_estimators': 131, 'max_features': 0.41069221743056344, 'max_depth': 57, 'min_samples_split': 2, 'min_samples_leaf': 3}. Best is trial 308 with value: 0.8947368421052632.
[32m[I 2023-04-26 00:18:14,662][39m Trial 442 finished with value: 0.8849557522123893 and parameters: {'criterion': 'entropy', 'n_estimators': 156, 'max_features': 0.2779393300106485, 'max_depth': 67, 'min_samples_split': 2, 'min_samples_leaf': 4}. Best is trial 308 with value: 0.8947368421052632.
[32m[I 2023-04-26 00:18:14,789][39m Trial 443 finished with value: 0.8849557522123893 and parameters: {'criterion': 'entropy', 'n_estimators': 159, 'max_features': 0.23651882011992245, 'max_depth': 71, 'min_samples_split': 2, 'min_samples_leaf': 3}. Best is trial 308 with value: 0.8947368421052632.
[32m[I 2023-04-26 00:18:14,944][39m Trial 444 finished with value: 0.8596491228070176 and parameters: {'criterion': 'entropy', 'n_estimators': 197, 'max_features': 0.38886516459596226, 'max_depth': 59, 'min_samples_split': 10, 'min_samples_leaf': 4}. Best is trial 308 with value: 0.8947368421052632.
[32m[I 2023-04-26 00:18:15,070][39m Trial 445 finished with value: 0.8596491228070176 and parameters: {'criterion': 'entropy', 'n_estimators': 172, 'max_features': 0.2124749625491152, 'max_depth': 56, 'min_samples_split': 6, 'min_samples_leaf': 2}. Best is trial 308 with value: 0.8947368421052632.
[32m[I 2023-04-26 00:18:15,218][39m Trial 446 finished with value: 0.8771929824561403 and parameters: {'criterion': 'gini', 'n_estimators': 198, 'max_features': 0.24835921299310282, 'max_depth': 60, 'min_samples_split': 2, 'min_samples_leaf': 4}. Best is trial 308 with value: 0.8947368421052632.
[32m[I 2023-04-26 00:18:15,339][39m Trial 447 finished with value: 0.8771929824561403 and parameters: {'criterion': 'entropy', 'n_estimators': 156, 'max_features': 0.2852814197734771, 'max_depth': 65, 'min_samples_split': 2, 'min_samples_leaf': 4}. Best is trial 308 with value: 0.8947368421052632.
[32m[I 2023-04-26 00:18:15,460][39m Trial 448 finished with value: 0.8869565217391304 and parameters: {'criterion': 'entropy', 'n_estimators': 151, 'max_features': 0.3222688064948634, 'max_depth': 61, 'min_samples_split': 2, 'min_samples_leaf': 4}. Best is trial 308 with value: 0.8947368421052632.
[32m[I 2023-04-26 00:18:15,579][39m Trial 449 finished with value: 0.8695652173913043 and parameters: {'criterion': 'entropy', 'n_estimators': 150, 'max_features': 0.3174804519653357, 'max_depth': 67, 'min_samples_split': 2, 'min_samples_leaf': 4}. Best is trial 308 with value: 0.8947368421052632.
[32m[I 2023-04-26 00:18:15,702][39m Trial 450 finished with value: 0.8596491228070176 and parameters: {'criterion': 'entropy', 'n_estimators': 147, 'max_features': 0.34026050501320404, 'max_depth': 61, 'min_samples_split': 2, 'min_samples_leaf': 3}. Best is trial 308 with value: 0.8947368421052632.
[32m[I 2023-04-26 00:18:15,826][39m Trial 451 finished with value: 0.8672566371681416 and parameters: {'criterion': 'entropy', 'n_estimators': 149, 'max_features': 0.45157898151575093, 'max_depth': 62, 'min_samples_split': 2, 'min_samples_leaf': 4}. Best is trial 308 with value: 0.8947368421052632.
[32m[I 2023-04-26 00:18:15,940][39m Trial 452 finished with value: 0.8672566371681416 and parameters: {'criterion': 'entropy', 'n_estimators': 140, 'max_features': 0.2634891211138054, 'max_depth': 57, 'min_samples_split': 10, 'min_samples_leaf': 4}. Best is trial 308 with value: 0.8947368421052632.
[32m[I 2023-04-26 00:18:16,070][39m Trial 453 finished with value: 0.8672566371681416 and parameters: {'criterion': 'gini', 'n_estimators': 165, 'max_features': 0.4296605969996665, 'max_depth': 69, 'min_samples_split': 7, 'min_samples_leaf': 4}. Best is trial 308 with value: 0.8947368421052632.
[32m[I 2023-04-26 00:18:16,188][39m Trial 454 finished with value: 0.8571428571428572 and parameters: {'criterion': 'entropy', 'n_estimators': 154, 'max_features': 0.2774595749713375, 'max_depth': 35, 'min_samples_split': 2, 'min_samples_leaf': 7}. Best is trial 308 with value: 0.8947368421052632.
[32m[I 2023-04-26 00:18:16,338][39m Trial 455 finished with value: 0.8771929824561403 and parameters: {'criterion': 'entropy', 'n_estimators': 194, 'max_features': 0.32359131953219306, 'max_depth': 76, 'min_samples_split': 2, 'min_samples_leaf': 4}. Best is trial 308 with value: 0.8947368421052632.
[32m[I 2023-04-26 00:18:16,457][39m Trial 456 finished with value: 0.8672566371681416 and parameters: {'criterion': 'entropy', 'n_estimators': 152, 'max_features': 0.29909340366951886, 'max_depth': 64, 'min_samples_split': 2, 'min_samples_leaf': 4}. Best is trial 308 with value: 0.8947368421052632.
[32m[I 2023-04-26 00:18:16,591][39m Trial 457 finished with value: 0.8672566371681416 and parameters: {'criterion': 'entropy', 'n_estimators': 170, 'max_features': 0.28306366641745634, 'max_depth': 64, 'min_samples_split': 2, 'min_samples_leaf': 3}. Best is trial 308 with value: 0.8947368421052632.
[32m[I 2023-04-26 00:18:16,716][39m Trial 458 finished with value: 0.8771929824561403 and parameters: {'criterion': 'entropy', 'n_estimators': 163, 'max_features': 0.293075113215107, 'max_depth': 66, 'min_samples_split': 2, 'min_samples_leaf': 4}. Best is trial 308 with value: 0.8947368421052632.
[32m[I 2023-04-26 00:18:16,827][39m Trial 459 finished with value: 0.8771929824561403 and parameters: {'criterion': 'entropy', 'n_estimators': 144, 'max_features': 0.25224687747696856, 'max_depth': 60, 'min_samples_split': 2, 'min_samples_leaf': 4}. Best is trial 308 with value: 0.8947368421052632.
[32m[I 2023-04-26 00:18:16,944][39m Trial 460 finished with value: 0.8771929824561403 and parameters: {'criterion': 'entropy', 'n_estimators': 135, 'max_features': 0.2333205225693483, 'max_depth': 58, 'min_samples_split': 2, 'min_samples_leaf': 4}. Best is trial 308 with value: 0.8947368421052632.
[32m[I 2023-04-26 00:18:17,065][39m Trial 461 finished with value: 0.8793103448275863 and parameters: {'criterion': 'gini', 'n_estimators': 150, 'max_features': 0.34157175682421476, 'max_depth': 62, 'min_samples_split': 2, 'min_samples_leaf': 4}. Best is trial 308 with value: 0.8947368421052632.
[32m[I 2023-04-26 00:18:17,188][39m Trial 462 finished with value: 0.8793103448275863 and parameters: {'criterion': 'entropy', 'n_estimators': 159, 'max_features': 0.314785622145586, 'max_depth': 10, 'min_samples_split': 2, 'min_samples_leaf': 4}. Best is trial 308 with value: 0.8947368421052632.
[32m[I 2023-04-26 00:18:17,306][39m Trial 463 finished with value: 0.8672566371681416 and parameters: {'criterion': 'entropy', 'n_estimators': 151, 'max_features': 0.289737388673705, 'max_depth': 6, 'min_samples_split': 2, 'min_samples_leaf': 3}. Best is trial 308 with value: 0.8947368421052632.
[32m[I 2023-04-26 00:18:17,436][39m Trial 464 finished with value: 0.8771929824561403 and parameters: {'criterion': 'entropy', 'n_estimators': 155, 'max_features': 0.26900722179595055, 'max_depth': 72, 'min_samples_split': 2, 'min_samples_leaf': 4}. Best is trial 308 with value: 0.8947368421052632.
[32m[I 2023-04-26 00:18:17,583][39m Trial 465 finished with value: 0.8648648648648648 and parameters: {'criterion': 'gini', 'n_estimators': 193, 'max_features': 0.18335982422717695, 'max_depth': 91, 'min_samples_split': 10, 'min_samples_leaf': 4}. Best is trial 308 with value: 0.8947368421052632.
[32m[I 2023-04-26 00:18:17,730][39m Trial 466 finished with value: 0.8695652173913043 and parameters: {'criterion': 'entropy', 'n_estimators': 196, 'max_features': 0.31080939223332943, 'max_depth': 59, 'min_samples_split': 2, 'min_samples_leaf': 6}. Best is trial 308 with value: 0.8947368421052632.
[32m[I 2023-04-26 00:18:17,855][39m Trial 467 finished with value: 0.8771929824561403 and parameters: {'criterion': 'entropy', 'n_estimators': 147, 'max_features': 0.33748888466753996, 'max_depth': 28, 'min_samples_split': 2, 'min_samples_leaf': 4}. Best is trial 308 with value: 0.8947368421052632.
[32m[I 2023-04-26 00:18:17,984][39m Trial 468 finished with value: 0.8771929824561403 and parameters: {'criterion': 'entropy', 'n_estimators': 154, 'max_features': 0.46090421313525404, 'max_depth': 12, 'min_samples_split': 6, 'min_samples_leaf': 6}. Best is trial 308 with value: 0.8947368421052632.
[32m[I 2023-04-26 00:18:18,114][39m Trial 469 finished with value: 0.8771929824561403 and parameters: {'criterion': 'entropy', 'n_estimators': 152, 'max_features': 0.3083364781775334, 'max_depth': 69, 'min_samples_split': 3, 'min_samples_leaf': 4}. Best is trial 308 with value: 0.8947368421052632.
[32m[I 2023-04-26 00:18:18,244][39m Trial 470 finished with value: 0.8288288288288289 and parameters: {'criterion': 'entropy', 'n_estimators': 158, 'max_features': 0.34913962273174004, 'max_depth': 63, 'min_samples_split': 2, 'min_samples_leaf': 3}. Best is trial 308 with value: 0.8947368421052632.
[32m[I 2023-04-26 00:18:18,367][39m Trial 471 finished with value: 0.8771929824561403 and parameters: {'criterion': 'gini', 'n_estimators': 151, 'max_features': 0.37619582575765065, 'max_depth': 65, 'min_samples_split': 2, 'min_samples_leaf': 4}. Best is trial 308 with value: 0.8947368421052632.
[32m[I 2023-04-26 00:18:18,525][39m Trial 472 finished with value: 0.8771929824561403 and parameters: {'criterion': 'entropy', 'n_estimators': 199, 'max_features': 0.2831334713770874, 'max_depth': 68, 'min_samples_split': 5, 'min_samples_leaf': 4}. Best is trial 308 with value: 0.8947368421052632.
[32m[I 2023-04-26 00:18:18,608][39m Trial 473 finished with value: 0.8547008547008546 and parameters: {'criterion': 'entropy', 'n_estimators': 92, 'max_features': 0.47825485770396486, 'max_depth': 66, 'min_samples_split': 2, 'min_samples_leaf': 10}. Best is trial 308 with value: 0.8947368421052632.
[32m[I 2023-04-26 00:18:18,758][39m Trial 474 finished with value: 0.8620689655172413 and parameters: {'criterion': 'entropy', 'n_estimators': 175, 'max_features': 0.63646327482621, 'max_depth': 75, 'min_samples_split': 10, 'min_samples_leaf': 6}. Best is trial 308 with value: 0.8947368421052632.
[32m[I 2023-04-26 00:18:18,880][39m Trial 475 finished with value: 0.8695652173913043 and parameters: {'criterion': 'entropy', 'n_estimators': 156, 'max_features': 0.30231489586525495, 'max_depth': 62, 'min_samples_split': 2, 'min_samples_leaf': 4}. Best is trial 308 with value: 0.8947368421052632.
[32m[I 2023-04-26 00:18:19,022][39m Trial 476 finished with value: 0.8571428571428572 and parameters: {'criterion': 'entropy', 'n_estimators': 162, 'max_features': 0.21070586056397436, 'max_depth': 89, 'min_samples_split': 9, 'min_samples_leaf': 6}. Best is trial 308 with value: 0.8947368421052632.
[32m[I 2023-04-26 00:18:19,167][39m Trial 477 finished with value: 0.8596491228070176 and parameters: {'criterion': 'gini', 'n_estimators': 191, 'max_features': 0.3909401607660877, 'max_depth': 70, 'min_samples_split': 4, 'min_samples_leaf': 4}. Best is trial 308 with value: 0.8947368421052632.
[32m[I 2023-04-26 00:18:19,226][39m Trial 478 finished with value: 0.8521739130434783 and parameters: {'criterion': 'entropy', 'n_estimators': 54, 'max_features': 0.2525843923749555, 'max_depth': 68, 'min_samples_split': 3, 'min_samples_leaf': 3}. Best is trial 308 with value: 0.8947368421052632.
[32m[I 2023-04-26 00:18:19,328][39m Trial 479 finished with value: 0.8849557522123893 and parameters: {'criterion': 'entropy', 'n_estimators': 129, 'max_features': 0.27024457515475864, 'max_depth': 7, 'min_samples_split': 2, 'min_samples_leaf': 4}. Best is trial 308 with value: 0.8947368421052632.
[32m[I 2023-04-26 00:18:19,442][39m Trial 480 finished with value: 0.875 and parameters: {'criterion': 'entropy', 'n_estimators': 139, 'max_features': 0.3538578642139044, 'max_depth': 56, 'min_samples_split': 8, 'min_samples_leaf': 6}. Best is trial 308 with value: 0.8947368421052632.
[32m[I 2023-04-26 00:18:19,568][39m Trial 481 finished with value: 0.875 and parameters: {'criterion': 'entropy', 'n_estimators': 165, 'max_features': 0.22661739346679116, 'max_depth': 99, 'min_samples_split': 3, 'min_samples_leaf': 4}. Best is trial 308 with value: 0.8947368421052632.
[32m[I 2023-04-26 00:18:19,674][39m Trial 482 finished with value: 0.7999999999999999 and parameters: {'criterion': 'gini', 'n_estimators': 143, 'max_features': 0.3255651700303795, 'max_depth': 2, 'min_samples_split': 2, 'min_samples_leaf': 4}. Best is trial 308 with value: 0.8947368421052632.
[32m[I 2023-04-26 00:18:19,793][39m Trial 483 finished with value: 0.8771929824561403 and parameters: {'criterion': 'entropy', 'n_estimators': 148, 'max_features': 0.3033188341484826, 'max_depth': 59, 'min_samples_split': 2, 'min_samples_leaf': 3}. Best is trial 308 with value: 0.8947368421052632.
[32m[I 2023-04-26 00:18:19,926][39m Trial 484 finished with value: 0.8695652173913043 and parameters: {'criterion': 'entropy', 'n_estimators': 169, 'max_features': 0.3455382639486411, 'max_depth': 65, 'min_samples_split': 5, 'min_samples_leaf': 4}. Best is trial 308 with value: 0.8947368421052632.
[32m[I 2023-04-26 00:18:20,050][39m Trial 485 finished with value: 0.8849557522123893 and parameters: {'criterion': 'entropy', 'n_estimators': 159, 'max_features': 0.24622881956701684, 'max_depth': 73, 'min_samples_split': 2, 'min_samples_leaf': 5}. Best is trial 308 with value: 0.8947368421052632.
[32m[I 2023-04-26 00:18:20,207][39m Trial 486 finished with value: 0.8849557522123893 and parameters: {'criterion': 'entropy', 'n_estimators': 201, 'max_features': 0.40291784518138113, 'max_depth': 93, 'min_samples_split': 2, 'min_samples_leaf': 5}. Best is trial 308 with value: 0.8947368421052632.
[32m[I 2023-04-26 00:18:20,307][39m Trial 487 finished with value: 0.7874015748031497 and parameters: {'criterion': 'entropy', 'n_estimators': 145, 'max_features': 0.3176802379047784, 'max_depth': 1, 'min_samples_split': 3, 'min_samples_leaf': 4}. Best is trial 308 with value: 0.8947368421052632.
[32m[I 2023-04-26 00:18:20,444][39m Trial 488 finished with value: 0.875 and parameters: {'criterion': 'entropy', 'n_estimators': 174, 'max_features': 0.26431002053765656, 'max_depth': 12, 'min_samples_split': 4, 'min_samples_leaf': 6}. Best is trial 308 with value: 0.8947368421052632.
[32m[I 2023-04-26 00:18:20,519][39m Trial 489 finished with value: 0.8672566371681416 and parameters: {'criterion': 'entropy', 'n_estimators': 84, 'max_features': 0.2883339655844789, 'max_depth': 63, 'min_samples_split': 2, 'min_samples_leaf': 4}. Best is trial 308 with value: 0.8947368421052632.
[32m[I 2023-04-26 00:18:20,635][39m Trial 490 finished with value: 0.8672566371681416 and parameters: {'criterion': 'gini', 'n_estimators': 147, 'max_features': 0.43230993540200424, 'max_depth': 56, 'min_samples_split': 10, 'min_samples_leaf': 3}. Best is trial 308 with value: 0.8947368421052632.
[32m[I 2023-04-26 00:18:20,763][39m Trial 491 finished with value: 0.8596491228070176 and parameters: {'criterion': 'entropy', 'n_estimators': 152, 'max_features': 0.6112891184709676, 'max_depth': 61, 'min_samples_split': 10, 'min_samples_leaf': 4}. Best is trial 308 with value: 0.8947368421052632.
[32m[I 2023-04-26 00:18:20,911][39m Trial 492 finished with value: 0.8771929824561403 and parameters: {'criterion': 'entropy', 'n_estimators': 196, 'max_features': 0.3310923361608113, 'max_depth': 58, 'min_samples_split': 9, 'min_samples_leaf': 4}. Best is trial 308 with value: 0.8947368421052632.
[32m[I 2023-04-26 00:18:21,077][39m Trial 493 finished with value: 0.8571428571428572 and parameters: {'criterion': 'entropy', 'n_estimators': 194, 'max_features': 0.8544254501212991, 'max_depth': 60, 'min_samples_split': 10, 'min_samples_leaf': 5}. Best is trial 308 with value: 0.8947368421052632.
[32m[I 2023-04-26 00:18:21,229][39m Trial 494 finished with value: 0.8869565217391304 and parameters: {'criterion': 'entropy', 'n_estimators': 190, 'max_features': 0.31825359225688266, 'max_depth': 55, 'min_samples_split': 6, 'min_samples_leaf': 4}. Best is trial 308 with value: 0.8947368421052632.
[32m[I 2023-04-26 00:18:21,369][39m Trial 495 finished with value: 0.8695652173913043 and parameters: {'criterion': 'entropy', 'n_estimators': 191, 'max_features': 0.23790445930474, 'max_depth': 55, 'min_samples_split': 6, 'min_samples_leaf': 6}. Best is trial 308 with value: 0.8947368421052632.
[32m[I 2023-04-26 00:18:21,485][39m Trial 496 finished with value: 0.8849557522123893 and parameters: {'criterion': 'entropy', 'n_estimators': 142, 'max_features': 0.3312681714067668, 'max_depth': 59, 'min_samples_split': 7, 'min_samples_leaf': 5}. Best is trial 308 with value: 0.8947368421052632.
[32m[I 2023-04-26 00:18:21,604][39m Trial 497 finished with value: 0.875 and parameters: {'criterion': 'entropy', 'n_estimators': 154, 'max_features': 0.27480643592223636, 'max_depth': 68, 'min_samples_split': 2, 'min_samples_leaf': 4}. Best is trial 308 with value: 0.8947368421052632.
[32m[I 2023-04-26 00:18:21,710][39m Trial 498 finished with value: 0.8495575221238938 and parameters: {'criterion': 'gini', 'n_estimators': 133, 'max_features': 0.4087816946855494, 'max_depth': 90, 'min_samples_split': 2, 'min_samples_leaf': 3}. Best is trial 308 with value: 0.8947368421052632.
[32m[I 2023-04-26 00:18:21,865][39m Trial 499 finished with value: 0.8695652173913043 and parameters: {'criterion': 'entropy', 'n_estimators': 198, 'max_features': 0.35772741753562703, 'max_depth': 87, 'min_samples_split': 5, 'min_samples_leaf': 4}. Best is trial 308 with value: 0.8947368421052632.
Number of finished trials: 500