[32m[I 2023-04-26 00:17:37,706][39m Trial 146 finished with value: 0.8620689655172413 and parameters: {'criterion': 'gini', 'n_estimators': 102, 'max_features': 0.4614016024688364, 'max_depth': 61, 'min_samples_split': 11, 'min_samples_leaf': 6}. Best is trial 15 with value: 0.8869565217391304.
[32m[I 2023-04-26 00:17:37,781][39m Trial 147 finished with value: 0.8264462809917354 and parameters: {'criterion': 'gini', 'n_estimators': 92, 'max_features': 0.5004573923383404, 'max_depth': 3, 'min_samples_split': 11, 'min_samples_leaf': 5}. Best is trial 15 with value: 0.8869565217391304.
[32m[I 2023-04-26 00:17:37,868][39m Trial 148 finished with value: 0.8672566371681416 and parameters: {'criterion': 'entropy', 'n_estimators': 117, 'max_features': 0.35623631314451426, 'max_depth': 96, 'min_samples_split': 6, 'min_samples_leaf': 4}. Best is trial 15 with value: 0.8869565217391304.
[32m[I 2023-04-26 00:17:38,028][39m Trial 149 finished with value: 0.8869565217391304 and parameters: {'criterion': 'entropy', 'n_estimators': 201, 'max_features': 0.564788676792108, 'max_depth': 91, 'min_samples_split': 4, 'min_samples_leaf': 5}. Best is trial 15 with value: 0.8869565217391304.
[32m[I 2023-04-26 00:17:38,179][39m Trial 150 finished with value: 0.8869565217391304 and parameters: {'criterion': 'entropy', 'n_estimators': 195, 'max_features': 0.5269959685530835, 'max_depth': 89, 'min_samples_split': 10, 'min_samples_leaf': 5}. Best is trial 15 with value: 0.8869565217391304.
[32m[I 2023-04-26 00:17:38,290][39m Trial 151 finished with value: 0.8363636363636363 and parameters: {'criterion': 'entropy', 'n_estimators': 133, 'max_features': 0.5634376018773211, 'max_depth': 100, 'min_samples_split': 5, 'min_samples_leaf': 4}. Best is trial 15 with value: 0.8869565217391304.
[32m[I 2023-04-26 00:17:38,448][39m Trial 152 finished with value: 0.8596491228070176 and parameters: {'criterion': 'entropy', 'n_estimators': 196, 'max_features': 0.5964602486773792, 'max_depth': 92, 'min_samples_split': 4, 'min_samples_leaf': 5}. Best is trial 15 with value: 0.8869565217391304.
[32m[I 2023-04-26 00:17:38,596][39m Trial 153 finished with value: 0.8793103448275863 and parameters: {'criterion': 'entropy', 'n_estimators': 190, 'max_features': 0.5723911560288232, 'max_depth': 88, 'min_samples_split': 3, 'min_samples_leaf': 5}. Best is trial 15 with value: 0.8869565217391304.
[32m[I 2023-04-26 00:17:38,749][39m Trial 154 finished with value: 0.8793103448275863 and parameters: {'criterion': 'entropy', 'n_estimators': 200, 'max_features': 0.5324748383293074, 'max_depth': 71, 'min_samples_split': 10, 'min_samples_leaf': 6}. Best is trial 15 with value: 0.8869565217391304.
[32m[I 2023-04-26 00:17:38,889][39m Trial 155 finished with value: 0.8717948717948718 and parameters: {'criterion': 'gini', 'n_estimators': 201, 'max_features': 0.5320065448297654, 'max_depth': 71, 'min_samples_split': 10, 'min_samples_leaf': 6}. Best is trial 15 with value: 0.8869565217391304.
[32m[I 2023-04-26 00:17:39,055][39m Trial 156 finished with value: 0.8521739130434783 and parameters: {'criterion': 'entropy', 'n_estimators': 195, 'max_features': 0.6715787691125339, 'max_depth': 96, 'min_samples_split': 10, 'min_samples_leaf': 5}. Best is trial 15 with value: 0.8869565217391304.
[32m[I 2023-04-26 00:17:39,140][39m Trial 157 finished with value: 0.8695652173913043 and parameters: {'criterion': 'gini', 'n_estimators': 104, 'max_features': 0.5046046888809466, 'max_depth': 90, 'min_samples_split': 11, 'min_samples_leaf': 5}. Best is trial 15 with value: 0.8869565217391304.
[32m[I 2023-04-26 00:17:39,284][39m Trial 158 finished with value: 0.8717948717948718 and parameters: {'criterion': 'gini', 'n_estimators': 189, 'max_features': 0.4446931659459705, 'max_depth': 85, 'min_samples_split': 3, 'min_samples_leaf': 5}. Best is trial 15 with value: 0.8869565217391304.
[32m[I 2023-04-26 00:17:39,431][39m Trial 159 finished with value: 0.8596491228070176 and parameters: {'criterion': 'entropy', 'n_estimators': 190, 'max_features': 0.5666084769894596, 'max_depth': 64, 'min_samples_split': 10, 'min_samples_leaf': 4}. Best is trial 15 with value: 0.8869565217391304.
[32m[I 2023-04-26 00:17:39,585][39m Trial 160 finished with value: 0.8695652173913043 and parameters: {'criterion': 'entropy', 'n_estimators': 197, 'max_features': 0.38809903443620575, 'max_depth': 54, 'min_samples_split': 2, 'min_samples_leaf': 4}. Best is trial 15 with value: 0.8869565217391304.
[32m[I 2023-04-26 00:17:39,667][39m Trial 161 finished with value: 0.8347826086956522 and parameters: {'criterion': 'gini', 'n_estimators': 108, 'max_features': 0.5153340702532662, 'max_depth': 92, 'min_samples_split': 4, 'min_samples_leaf': 5}. Best is trial 15 with value: 0.8869565217391304.
[32m[I 2023-04-26 00:17:39,821][39m Trial 162 finished with value: 0.8695652173913043 and parameters: {'criterion': 'entropy', 'n_estimators': 193, 'max_features': 0.551404871135357, 'max_depth': 89, 'min_samples_split': 10, 'min_samples_leaf': 5}. Best is trial 15 with value: 0.8869565217391304.
[32m[I 2023-04-26 00:17:39,910][39m Trial 163 finished with value: 0.8793103448275863 and parameters: {'criterion': 'gini', 'n_estimators': 113, 'max_features': 0.5950643622431369, 'max_depth': 94, 'min_samples_split': 2, 'min_samples_leaf': 5}. Best is trial 15 with value: 0.8869565217391304.
[32m[I 2023-04-26 00:17:40,006][39m Trial 164 finished with value: 0.8403361344537814 and parameters: {'criterion': 'entropy', 'n_estimators': 123, 'max_features': 0.4852621803764957, 'max_depth': 86, 'min_samples_split': 4, 'min_samples_leaf': 9}. Best is trial 15 with value: 0.8869565217391304.
[32m[I 2023-04-26 00:17:40,157][39m Trial 165 finished with value: 0.8596491228070176 and parameters: {'criterion': 'gini', 'n_estimators': 199, 'max_features': 0.5830071558556983, 'max_depth': 73, 'min_samples_split': 2, 'min_samples_leaf': 4}. Best is trial 15 with value: 0.8869565217391304.
[32m[I 2023-04-26 00:17:40,237][39m Trial 166 finished with value: 0.8793103448275863 and parameters: {'criterion': 'gini', 'n_estimators': 100, 'max_features': 0.5349560912957897, 'max_depth': 94, 'min_samples_split': 4, 'min_samples_leaf': 5}. Best is trial 15 with value: 0.8869565217391304.
[32m[I 2023-04-26 00:17:40,327][39m Trial 167 finished with value: 0.8771929824561403 and parameters: {'criterion': 'entropy', 'n_estimators': 121, 'max_features': 0.325659868326264, 'max_depth': 98, 'min_samples_split': 11, 'min_samples_leaf': 4}. Best is trial 15 with value: 0.8869565217391304.
[32m[I 2023-04-26 00:17:40,475][39m Trial 168 finished with value: 0.8771929824561403 and parameters: {'criterion': 'entropy', 'n_estimators': 185, 'max_features': 0.30840553927633135, 'max_depth': 51, 'min_samples_split': 9, 'min_samples_leaf': 3}. Best is trial 15 with value: 0.8869565217391304.
[32m[I 2023-04-26 00:17:40,593][39m Trial 169 finished with value: 0.864406779661017 and parameters: {'criterion': 'entropy', 'n_estimators': 138, 'max_features': 0.629947564723456, 'max_depth': 65, 'min_samples_split': 5, 'min_samples_leaf': 6}. Best is trial 15 with value: 0.8869565217391304.
[32m[I 2023-04-26 00:17:40,698][39m Trial 170 finished with value: 0.8793103448275863 and parameters: {'criterion': 'entropy', 'n_estimators': 126, 'max_features': 0.5553288595047665, 'max_depth': 83, 'min_samples_split': 11, 'min_samples_leaf': 5}. Best is trial 15 with value: 0.8869565217391304.
[32m[I 2023-04-26 00:17:40,785][39m Trial 171 finished with value: 0.8596491228070176 and parameters: {'criterion': 'entropy', 'n_estimators': 106, 'max_features': 0.5153180538137927, 'max_depth': 87, 'min_samples_split': 3, 'min_samples_leaf': 5}. Best is trial 15 with value: 0.8869565217391304.
[32m[I 2023-04-26 00:17:40,886][39m Trial 172 finished with value: 0.8521739130434783 and parameters: {'criterion': 'entropy', 'n_estimators': 117, 'max_features': 0.5542972307508406, 'max_depth': 12, 'min_samples_split': 11, 'min_samples_leaf': 4}. Best is trial 15 with value: 0.8869565217391304.
[32m[I 2023-04-26 00:17:41,028][39m Trial 173 finished with value: 0.8448275862068967 and parameters: {'criterion': 'entropy', 'n_estimators': 201, 'max_features': 0.3459431077983466, 'max_depth': 9, 'min_samples_split': 11, 'min_samples_leaf': 7}. Best is trial 15 with value: 0.8869565217391304.
[32m[I 2023-04-26 00:17:41,177][39m Trial 174 finished with value: 0.8869565217391304 and parameters: {'criterion': 'entropy', 'n_estimators': 191, 'max_features': 0.6011369798766001, 'max_depth': 58, 'min_samples_split': 9, 'min_samples_leaf': 6}. Best is trial 15 with value: 0.8869565217391304.
[32m[I 2023-04-26 00:17:41,326][39m Trial 175 finished with value: 0.8695652173913043 and parameters: {'criterion': 'entropy', 'n_estimators': 191, 'max_features': 0.610257502450746, 'max_depth': 59, 'min_samples_split': 3, 'min_samples_leaf': 6}. Best is trial 15 with value: 0.8869565217391304.
[32m[I 2023-04-26 00:17:41,478][39m Trial 176 finished with value: 0.8376068376068375 and parameters: {'criterion': 'entropy', 'n_estimators': 196, 'max_features': 0.5821342454819491, 'max_depth': 57, 'min_samples_split': 9, 'min_samples_leaf': 6}. Best is trial 15 with value: 0.8869565217391304.
[32m[I 2023-04-26 00:17:41,592][39m Trial 177 finished with value: 0.8620689655172413 and parameters: {'criterion': 'gini', 'n_estimators': 145, 'max_features': 0.5420352297530094, 'max_depth': 66, 'min_samples_split': 2, 'min_samples_leaf': 4}. Best is trial 15 with value: 0.8869565217391304.
[32m[I 2023-04-26 00:17:41,699][39m Trial 178 finished with value: 0.8288288288288289 and parameters: {'criterion': 'entropy', 'n_estimators': 131, 'max_features': 0.4699523771263576, 'max_depth': 49, 'min_samples_split': 9, 'min_samples_leaf': 3}. Best is trial 15 with value: 0.8869565217391304.
[32m[I 2023-04-26 00:17:41,851][39m Trial 179 finished with value: 0.8620689655172413 and parameters: {'criterion': 'entropy', 'n_estimators': 192, 'max_features': 0.5929016362008651, 'max_depth': 70, 'min_samples_split': 2, 'min_samples_leaf': 6}. Best is trial 15 with value: 0.8869565217391304.
[32m[I 2023-04-26 00:17:41,987][39m Trial 180 finished with value: 0.8869565217391304 and parameters: {'criterion': 'entropy', 'n_estimators': 188, 'max_features': 0.41532289395761723, 'max_depth': 55, 'min_samples_split': 10, 'min_samples_leaf': 6}. Best is trial 15 with value: 0.8869565217391304.
[32m[I 2023-04-26 00:17:42,147][39m Trial 181 finished with value: 0.8793103448275863 and parameters: {'criterion': 'entropy', 'n_estimators': 189, 'max_features': 0.6602268054220831, 'max_depth': 55, 'min_samples_split': 3, 'min_samples_leaf': 6}. Best is trial 15 with value: 0.8869565217391304.
[32m[I 2023-04-26 00:17:42,300][39m Trial 182 finished with value: 0.8771929824561403 and parameters: {'criterion': 'entropy', 'n_estimators': 199, 'max_features': 0.39825841968785247, 'max_depth': 89, 'min_samples_split': 3, 'min_samples_leaf': 5}. Best is trial 15 with value: 0.8869565217391304.
[32m[I 2023-04-26 00:17:42,435][39m Trial 183 finished with value: 0.8571428571428572 and parameters: {'criterion': 'entropy', 'n_estimators': 186, 'max_features': 0.37739635307197783, 'max_depth': 54, 'min_samples_split': 9, 'min_samples_leaf': 7}. Best is trial 15 with value: 0.8869565217391304.
[32m[I 2023-04-26 00:17:42,581][39m Trial 184 finished with value: 0.8648648648648648 and parameters: {'criterion': 'entropy', 'n_estimators': 201, 'max_features': 0.2681082290378792, 'max_depth': 46, 'min_samples_split': 10, 'min_samples_leaf': 6}. Best is trial 15 with value: 0.8869565217391304.
[32m[I 2023-04-26 00:17:42,685][39m Trial 185 finished with value: 0.8596491228070176 and parameters: {'criterion': 'entropy', 'n_estimators': 128, 'max_features': 0.4152500967597279, 'max_depth': 58, 'min_samples_split': 9, 'min_samples_leaf': 4}. Best is trial 15 with value: 0.8869565217391304.
[32m[I 2023-04-26 00:17:42,772][39m Trial 186 finished with value: 0.8771929824561403 and parameters: {'criterion': 'gini', 'n_estimators': 112, 'max_features': 0.36693781759546734, 'max_depth': 52, 'min_samples_split': 2, 'min_samples_leaf': 5}. Best is trial 15 with value: 0.8869565217391304.
[32m[I 2023-04-26 00:17:42,920][39m Trial 187 finished with value: 0.8620689655172413 and parameters: {'criterion': 'entropy', 'n_estimators': 183, 'max_features': 0.6623964481886379, 'max_depth': 61, 'min_samples_split': 9, 'min_samples_leaf': 6}. Best is trial 15 with value: 0.8869565217391304.
[32m[I 2023-04-26 00:17:43,069][39m Trial 188 finished with value: 0.8717948717948718 and parameters: {'criterion': 'entropy', 'n_estimators': 195, 'max_features': 0.5350894152839922, 'max_depth': 79, 'min_samples_split': 4, 'min_samples_leaf': 6}. Best is trial 15 with value: 0.8869565217391304.
[32m[I 2023-04-26 00:17:43,189][39m Trial 189 finished with value: 0.8771929824561403 and parameters: {'criterion': 'entropy', 'n_estimators': 149, 'max_features': 0.43032814651028317, 'max_depth': 101, 'min_samples_split': 9, 'min_samples_leaf': 4}. Best is trial 15 with value: 0.8869565217391304.
[32m[I 2023-04-26 00:17:43,314][39m Trial 190 finished with value: 0.8771929824561403 and parameters: {'criterion': 'entropy', 'n_estimators': 166, 'max_features': 0.2977658935392929, 'max_depth': 57, 'min_samples_split': 2, 'min_samples_leaf': 3}. Best is trial 15 with value: 0.8869565217391304.
[32m[I 2023-04-26 00:17:43,411][39m Trial 191 finished with value: 0.8717948717948718 and parameters: {'criterion': 'gini', 'n_estimators': 97, 'max_features': 0.5648041137162491, 'max_depth': 91, 'min_samples_split': 5, 'min_samples_leaf': 5}. Best is trial 15 with value: 0.8869565217391304.
[32m[I 2023-04-26 00:17:43,493][39m Trial 192 finished with value: 0.8695652173913043 and parameters: {'criterion': 'gini', 'n_estimators': 99, 'max_features': 0.5308207114354024, 'max_depth': 88, 'min_samples_split': 10, 'min_samples_leaf': 5}. Best is trial 15 with value: 0.8869565217391304.
[32m[I 2023-04-26 00:17:43,645][39m Trial 193 finished with value: 0.8793103448275863 and parameters: {'criterion': 'gini', 'n_estimators': 197, 'max_features': 0.5846490907469519, 'max_depth': 81, 'min_samples_split': 10, 'min_samples_leaf': 5}. Best is trial 15 with value: 0.8869565217391304.
[32m[I 2023-04-26 00:17:43,730][39m Trial 194 finished with value: 0.8793103448275863 and parameters: {'criterion': 'gini', 'n_estimators': 102, 'max_features': 0.5349094795623776, 'max_depth': 94, 'min_samples_split': 11, 'min_samples_leaf': 5}. Best is trial 15 with value: 0.8869565217391304.
[32m[I 2023-04-26 00:17:43,835][39m Trial 195 finished with value: 0.8495575221238938 and parameters: {'criterion': 'entropy', 'n_estimators': 125, 'max_features': 0.6124496757585586, 'max_depth': 16, 'min_samples_split': 10, 'min_samples_leaf': 4}. Best is trial 15 with value: 0.8869565217391304.
[32m[I 2023-04-26 00:17:43,976][39m Trial 196 finished with value: 0.875 and parameters: {'criterion': 'entropy', 'n_estimators': 188, 'max_features': 0.34094855718875083, 'max_depth': 55, 'min_samples_split': 11, 'min_samples_leaf': 6}. Best is trial 15 with value: 0.8869565217391304.
[32m[I 2023-04-26 00:17:44,068][39m Trial 197 finished with value: 0.8771929824561403 and parameters: {'criterion': 'entropy', 'n_estimators': 105, 'max_features': 0.48562894163442594, 'max_depth': 92, 'min_samples_split': 4, 'min_samples_leaf': 5}. Best is trial 15 with value: 0.8869565217391304.
[32m[I 2023-04-26 00:17:44,151][39m Trial 198 finished with value: 0.8672566371681416 and parameters: {'criterion': 'entropy', 'n_estimators': 108, 'max_features': 0.24805511646806372, 'max_depth': 20, 'min_samples_split': 11, 'min_samples_leaf': 5}. Best is trial 15 with value: 0.8869565217391304.
[32m[I 2023-04-26 00:17:44,245][39m Trial 199 finished with value: 0.8695652173913043 and parameters: {'criterion': 'gini', 'n_estimators': 110, 'max_features': 0.41164751334255006, 'max_depth': 94, 'min_samples_split': 11, 'min_samples_leaf': 5}. Best is trial 15 with value: 0.8869565217391304.
[32m[I 2023-04-26 00:17:44,334][39m Trial 200 finished with value: 0.8717948717948718 and parameters: {'criterion': 'gini', 'n_estimators': 110, 'max_features': 0.5173721255850602, 'max_depth': 14, 'min_samples_split': 10, 'min_samples_leaf': 4}. Best is trial 15 with value: 0.8869565217391304.
[32m[I 2023-04-26 00:17:44,433][39m Trial 201 finished with value: 0.8793103448275863 and parameters: {'criterion': 'entropy', 'n_estimators': 119, 'max_features': 0.5627395333931215, 'max_depth': 91, 'min_samples_split': 4, 'min_samples_leaf': 5}. Best is trial 15 with value: 0.8869565217391304.
[32m[I 2023-04-26 00:17:44,522][39m Trial 202 finished with value: 0.7651006711409395 and parameters: {'criterion': 'entropy', 'n_estimators': 130, 'max_features': 0.49821441346116346, 'max_depth': 1, 'min_samples_split': 11, 'min_samples_leaf': 5}. Best is trial 15 with value: 0.8869565217391304.
[32m[I 2023-04-26 00:17:44,603][39m Trial 203 finished with value: 0.8695652173913043 and parameters: {'criterion': 'gini', 'n_estimators': 102, 'max_features': 0.4445952450770134, 'max_depth': 97, 'min_samples_split': 11, 'min_samples_leaf': 5}. Best is trial 15 with value: 0.8869565217391304.
[32m[I 2023-04-26 00:17:44,754][39m Trial 204 finished with value: 0.8793103448275863 and parameters: {'criterion': 'entropy', 'n_estimators': 195, 'max_features': 0.5828480090437659, 'max_depth': 67, 'min_samples_split': 10, 'min_samples_leaf': 6}. Best is trial 15 with value: 0.8869565217391304.
[32m[I 2023-04-26 00:17:44,851][39m Trial 205 finished with value: 0.8672566371681416 and parameters: {'criterion': 'entropy', 'n_estimators': 115, 'max_features': 0.5079402121342196, 'max_depth': 26, 'min_samples_split': 9, 'min_samples_leaf': 4}. Best is trial 15 with value: 0.8869565217391304.
[32m[I 2023-04-26 00:17:44,954][39m Trial 206 finished with value: 0.8620689655172413 and parameters: {'criterion': 'entropy', 'n_estimators': 123, 'max_features': 0.6074696711853351, 'max_depth': 68, 'min_samples_split': 10, 'min_samples_leaf': 6}. Best is trial 15 with value: 0.8869565217391304.
[32m[I 2023-04-26 00:17:45,098][39m Trial 207 finished with value: 0.8717948717948718 and parameters: {'criterion': 'gini', 'n_estimators': 188, 'max_features': 0.6347048802476614, 'max_depth': 83, 'min_samples_split': 2, 'min_samples_leaf': 6}. Best is trial 15 with value: 0.8869565217391304.
[32m[I 2023-04-26 00:17:45,250][39m Trial 208 finished with value: 0.8596491228070176 and parameters: {'criterion': 'entropy', 'n_estimators': 192, 'max_features': 0.570541344522266, 'max_depth': 89, 'min_samples_split': 3, 'min_samples_leaf': 5}. Best is trial 15 with value: 0.8869565217391304.
[32m[I 2023-04-26 00:17:45,344][39m Trial 209 finished with value: 0.8547008547008546 and parameters: {'criterion': 'gini', 'n_estimators': 115, 'max_features': 0.5915584359744326, 'max_depth': 99, 'min_samples_split': 4, 'min_samples_leaf': 5}. Best is trial 15 with value: 0.8869565217391304.
[32m[I 2023-04-26 00:17:45,423][39m Trial 210 finished with value: 0.8571428571428572 and parameters: {'criterion': 'gini', 'n_estimators': 94, 'max_features': 0.35804739560484367, 'max_depth': 95, 'min_samples_split': 5, 'min_samples_leaf': 5}. Best is trial 15 with value: 0.8869565217391304.
[32m[I 2023-04-26 00:17:45,589][39m Trial 211 finished with value: 0.8793103448275863 and parameters: {'criterion': 'entropy', 'n_estimators': 197, 'max_features': 0.6540185230785552, 'max_depth': 86, 'min_samples_split': 3, 'min_samples_leaf': 6}. Best is trial 15 with value: 0.8869565217391304.
[32m[I 2023-04-26 00:17:45,739][39m Trial 212 finished with value: 0.8547008547008546 and parameters: {'criterion': 'gini', 'n_estimators': 198, 'max_features': 0.5463260786992585, 'max_depth': 53, 'min_samples_split': 11, 'min_samples_leaf': 7}. Best is trial 15 with value: 0.8869565217391304.
[32m[I 2023-04-26 00:17:45,887][39m Trial 213 finished with value: 0.8695652173913043 and parameters: {'criterion': 'entropy', 'n_estimators': 181, 'max_features': 0.6859537176985249, 'max_depth': 55, 'min_samples_split': 3, 'min_samples_leaf': 5}. Best is trial 15 with value: 0.8869565217391304.
[32m[I 2023-04-26 00:17:46,041][39m Trial 214 finished with value: 0.8793103448275863 and parameters: {'criterion': 'entropy', 'n_estimators': 194, 'max_features': 0.5258324121851771, 'max_depth': 84, 'min_samples_split': 3, 'min_samples_leaf': 6}. Best is trial 15 with value: 0.8869565217391304.
[32m[I 2023-04-26 00:17:46,189][39m Trial 215 finished with value: 0.8596491228070176 and parameters: {'criterion': 'entropy', 'n_estimators': 201, 'max_features': 0.5260100915573799, 'max_depth': 59, 'min_samples_split': 11, 'min_samples_leaf': 6}. Best is trial 15 with value: 0.8869565217391304.
[32m[I 2023-04-26 00:17:46,293][39m Trial 216 finished with value: 0.875 and parameters: {'criterion': 'entropy', 'n_estimators': 128, 'max_features': 0.2746981306300887, 'max_depth': 84, 'min_samples_split': 3, 'min_samples_leaf': 6}. Best is trial 15 with value: 0.8869565217391304.
[32m[I 2023-04-26 00:17:46,385][39m Trial 217 finished with value: 0.8596491228070176 and parameters: {'criterion': 'entropy', 'n_estimators': 106, 'max_features': 0.5614990842224409, 'max_depth': 91, 'min_samples_split': 4, 'min_samples_leaf': 5}. Best is trial 15 with value: 0.8869565217391304.
[32m[I 2023-04-26 00:17:46,467][39m Trial 218 finished with value: 0.8672566371681416 and parameters: {'criterion': 'entropy', 'n_estimators': 100, 'max_features': 0.5380259415827159, 'max_depth': 94, 'min_samples_split': 2, 'min_samples_leaf': 6}. Best is trial 15 with value: 0.8869565217391304.
