[32m[I 2023-04-26 00:17:29,870][39m Trial 73 finished with value: 0.8547008547008546 and parameters: {'criterion': 'entropy', 'n_estimators': 138, 'max_features': 0.5273853615826609, 'max_depth': 32, 'min_samples_split': 11, 'min_samples_leaf': 10}. Best is trial 15 with value: 0.8869565217391304.
[32m[I 2023-04-26 00:17:29,977][39m Trial 74 finished with value: 0.8521739130434783 and parameters: {'criterion': 'gini', 'n_estimators': 140, 'max_features': 0.3907786205547976, 'max_depth': 89, 'min_samples_split': 3, 'min_samples_leaf': 4}. Best is trial 15 with value: 0.8869565217391304.
[32m[I 2023-04-26 00:17:30,077][39m Trial 75 finished with value: 0.8571428571428572 and parameters: {'criterion': 'gini', 'n_estimators': 128, 'max_features': 0.4331452065063931, 'max_depth': 59, 'min_samples_split': 4, 'min_samples_leaf': 3}. Best is trial 15 with value: 0.8869565217391304.
[32m[I 2023-04-26 00:17:30,169][39m Trial 76 finished with value: 0.8771929824561403 and parameters: {'criterion': 'gini', 'n_estimators': 117, 'max_features': 0.3385829134139893, 'max_depth': 69, 'min_samples_split': 2, 'min_samples_leaf': 3}. Best is trial 15 with value: 0.8869565217391304.
[32m[I 2023-04-26 00:17:30,247][39m Trial 77 finished with value: 0.8695652173913043 and parameters: {'criterion': 'entropy', 'n_estimators': 88, 'max_features': 0.6932598628482187, 'max_depth': 46, 'min_samples_split': 10, 'min_samples_leaf': 4}. Best is trial 15 with value: 0.8869565217391304.
[32m[I 2023-04-26 00:17:30,331][39m Trial 78 finished with value: 0.8571428571428572 and parameters: {'criterion': 'gini', 'n_estimators': 105, 'max_features': 0.4513534709898149, 'max_depth': 84, 'min_samples_split': 2, 'min_samples_leaf': 4}. Best is trial 15 with value: 0.8869565217391304.
[32m[I 2023-04-26 00:17:30,418][39m Trial 79 finished with value: 0.8347826086956522 and parameters: {'criterion': 'gini', 'n_estimators': 114, 'max_features': 0.37161897012292405, 'max_depth': 99, 'min_samples_split': 6, 'min_samples_leaf': 2}. Best is trial 15 with value: 0.8869565217391304.
[32m[I 2023-04-26 00:17:30,509][39m Trial 80 finished with value: 0.8771929824561403 and parameters: {'criterion': 'entropy', 'n_estimators': 117, 'max_features': 0.3397715601081751, 'max_depth': 60, 'min_samples_split': 11, 'min_samples_leaf': 5}. Best is trial 15 with value: 0.8869565217391304.
[32m[I 2023-04-26 00:17:30,598][39m Trial 81 finished with value: 0.8849557522123893 and parameters: {'criterion': 'entropy', 'n_estimators': 120, 'max_features': 0.28988527773150846, 'max_depth': 54, 'min_samples_split': 11, 'min_samples_leaf': 5}. Best is trial 15 with value: 0.8869565217391304.
[32m[I 2023-04-26 00:17:30,688][39m Trial 82 finished with value: 0.8672566371681416 and parameters: {'criterion': 'entropy', 'n_estimators': 120, 'max_features': 0.33906829864903143, 'max_depth': 55, 'min_samples_split': 11, 'min_samples_leaf': 5}. Best is trial 15 with value: 0.8869565217391304.
[32m[I 2023-04-26 00:17:30,838][39m Trial 83 finished with value: 0.8869565217391304 and parameters: {'criterion': 'entropy', 'n_estimators': 201, 'max_features': 0.4022774614641289, 'max_depth': 68, 'min_samples_split': 2, 'min_samples_leaf': 4}. Best is trial 15 with value: 0.8869565217391304.
[32m[I 2023-04-26 00:17:30,964][39m Trial 84 finished with value: 0.8672566371681416 and parameters: {'criterion': 'entropy', 'n_estimators': 179, 'max_features': 0.27314100433872035, 'max_depth': 60, 'min_samples_split': 11, 'min_samples_leaf': 5}. Best is trial 15 with value: 0.8869565217391304.
[32m[I 2023-04-26 00:17:31,116][39m Trial 85 finished with value: 0.8793103448275863 and parameters: {'criterion': 'entropy', 'n_estimators': 196, 'max_features': 0.5068949382826142, 'max_depth': 53, 'min_samples_split': 9, 'min_samples_leaf': 6}. Best is trial 15 with value: 0.8869565217391304.
[32m[I 2023-04-26 00:17:31,263][39m Trial 86 finished with value: 0.8695652173913043 and parameters: {'criterion': 'entropy', 'n_estimators': 197, 'max_features': 0.5068435727598581, 'max_depth': 53, 'min_samples_split': 9, 'min_samples_leaf': 7}. Best is trial 15 with value: 0.8869565217391304.
[32m[I 2023-04-26 00:17:31,413][39m Trial 87 finished with value: 0.8547008547008546 and parameters: {'criterion': 'entropy', 'n_estimators': 194, 'max_features': 0.5581367856116578, 'max_depth': 66, 'min_samples_split': 10, 'min_samples_leaf': 6}. Best is trial 15 with value: 0.8869565217391304.
[32m[I 2023-04-26 00:17:31,562][39m Trial 88 finished with value: 0.864406779661017 and parameters: {'criterion': 'entropy', 'n_estimators': 189, 'max_features': 0.6240755670139687, 'max_depth': 41, 'min_samples_split': 2, 'min_samples_leaf': 7}. Best is trial 15 with value: 0.8869565217391304.
[32m[I 2023-04-26 00:17:31,709][39m Trial 89 finished with value: 0.8771929824561403 and parameters: {'criterion': 'entropy', 'n_estimators': 199, 'max_features': 0.40941575732499286, 'max_depth': 76, 'min_samples_split': 10, 'min_samples_leaf': 6}. Best is trial 15 with value: 0.8869565217391304.
[32m[I 2023-04-26 00:17:31,852][39m Trial 90 finished with value: 0.8596491228070176 and parameters: {'criterion': 'entropy', 'n_estimators': 190, 'max_features': 0.46688622732727714, 'max_depth': 47, 'min_samples_split': 11, 'min_samples_leaf': 6}. Best is trial 15 with value: 0.8869565217391304.
[32m[I 2023-04-26 00:17:31,929][39m Trial 91 finished with value: 0.8771929824561403 and parameters: {'criterion': 'entropy', 'n_estimators': 97, 'max_features': 0.3281215952109995, 'max_depth': 62, 'min_samples_split': 11, 'min_samples_leaf': 5}. Best is trial 15 with value: 0.8869565217391304.
[32m[I 2023-04-26 00:17:32,010][39m Trial 92 finished with value: 0.847457627118644 and parameters: {'criterion': 'entropy', 'n_estimators': 96, 'max_features': 0.5942402260505066, 'max_depth': 67, 'min_samples_split': 11, 'min_samples_leaf': 5}. Best is trial 15 with value: 0.8869565217391304.
[32m[I 2023-04-26 00:17:32,139][39m Trial 93 finished with value: 0.8771929824561403 and parameters: {'criterion': 'entropy', 'n_estimators': 173, 'max_features': 0.3760261568381816, 'max_depth': 52, 'min_samples_split': 2, 'min_samples_leaf': 4}. Best is trial 15 with value: 0.8869565217391304.
[32m[I 2023-04-26 00:17:32,238][39m Trial 94 finished with value: 0.8771929824561403 and parameters: {'criterion': 'entropy', 'n_estimators': 132, 'max_features': 0.2938626995187543, 'max_depth': 8, 'min_samples_split': 8, 'min_samples_leaf': 4}. Best is trial 15 with value: 0.8869565217391304.
[32m[I 2023-04-26 00:17:32,324][39m Trial 95 finished with value: 0.8672566371681416 and parameters: {'criterion': 'entropy', 'n_estimators': 108, 'max_features': 0.40486006301988864, 'max_depth': 81, 'min_samples_split': 3, 'min_samples_leaf': 4}. Best is trial 15 with value: 0.8869565217391304.
[32m[I 2023-04-26 00:17:32,380][39m Trial 96 finished with value: 0.8620689655172413 and parameters: {'criterion': 'entropy', 'n_estimators': 61, 'max_features': 0.6785397389323646, 'max_depth': 39, 'min_samples_split': 10, 'min_samples_leaf': 6}. Best is trial 15 with value: 0.8869565217391304.
[32m[I 2023-04-26 00:17:32,458][39m Trial 97 finished with value: 0.8771929824561403 and parameters: {'criterion': 'entropy', 'n_estimators': 100, 'max_features': 0.2567435601071184, 'max_depth': 54, 'min_samples_split': 9, 'min_samples_leaf': 5}. Best is trial 15 with value: 0.8869565217391304.
[32m[I 2023-04-26 00:17:32,592][39m Trial 98 finished with value: 0.8771929824561403 and parameters: {'criterion': 'entropy', 'n_estimators': 178, 'max_features': 0.4464218350432112, 'max_depth': 62, 'min_samples_split': 11, 'min_samples_leaf': 5}. Best is trial 15 with value: 0.8869565217391304.
[32m[I 2023-04-26 00:17:32,734][39m Trial 99 finished with value: 0.8695652173913043 and parameters: {'criterion': 'entropy', 'n_estimators': 187, 'max_features': 0.5127123428088731, 'max_depth': 48, 'min_samples_split': 10, 'min_samples_leaf': 3}. Best is trial 15 with value: 0.8869565217391304.
[32m[I 2023-04-26 00:17:32,875][39m Trial 100 finished with value: 0.8771929824561403 and parameters: {'criterion': 'entropy', 'n_estimators': 193, 'max_features': 0.3241275198868904, 'max_depth': 56, 'min_samples_split': 11, 'min_samples_leaf': 4}. Best is trial 15 with value: 0.8869565217391304.
[32m[I 2023-04-26 00:17:33,022][39m Trial 101 finished with value: 0.8771929824561403 and parameters: {'criterion': 'entropy', 'n_estimators': 199, 'max_features': 0.42010100006202794, 'max_depth': 75, 'min_samples_split': 9, 'min_samples_leaf': 6}. Best is trial 15 with value: 0.8869565217391304.
[32m[I 2023-04-26 00:17:33,110][39m Trial 102 finished with value: 0.8771929824561403 and parameters: {'criterion': 'entropy', 'n_estimators': 126, 'max_features': 0.20769809448073434, 'max_depth': 19, 'min_samples_split': 8, 'min_samples_leaf': 3}. Best is trial 15 with value: 0.8869565217391304.
[32m[I 2023-04-26 00:17:33,207][39m Trial 103 finished with value: 0.8793103448275863 and parameters: {'criterion': 'entropy', 'n_estimators': 128, 'max_features': 0.2469999874953803, 'max_depth': 19, 'min_samples_split': 9, 'min_samples_leaf': 3}. Best is trial 15 with value: 0.8869565217391304.
[32m[I 2023-04-26 00:17:33,349][39m Trial 104 finished with value: 0.8672566371681416 and parameters: {'criterion': 'entropy', 'n_estimators': 197, 'max_features': 0.358942808412566, 'max_depth': 74, 'min_samples_split': 9, 'min_samples_leaf': 8}. Best is trial 15 with value: 0.8869565217391304.
[32m[I 2023-04-26 00:17:33,430][39m Trial 105 finished with value: 0.8545454545454546 and parameters: {'criterion': 'entropy', 'n_estimators': 118, 'max_features': 0.1522735621903571, 'max_depth': 11, 'min_samples_split': 10, 'min_samples_leaf': 4}. Best is trial 15 with value: 0.8869565217391304.
[32m[I 2023-04-26 00:17:33,519][39m Trial 106 finished with value: 0.8695652173913043 and parameters: {'criterion': 'gini', 'n_estimators': 111, 'max_features': 0.5401562376461213, 'max_depth': 6, 'min_samples_split': 3, 'min_samples_leaf': 3}. Best is trial 15 with value: 0.8869565217391304.
[32m[I 2023-04-26 00:17:33,645][39m Trial 107 finished with value: 0.8672566371681416 and parameters: {'criterion': 'entropy', 'n_estimators': 163, 'max_features': 0.4879034849860646, 'max_depth': 52, 'min_samples_split': 2, 'min_samples_leaf': 4}. Best is trial 15 with value: 0.8869565217391304.
[32m[I 2023-04-26 00:17:33,719][39m Trial 108 finished with value: 0.8448275862068967 and parameters: {'criterion': 'gini', 'n_estimators': 103, 'max_features': 0.2460066781497278, 'max_depth': 3, 'min_samples_split': 6, 'min_samples_leaf': 3}. Best is trial 15 with value: 0.8869565217391304.
[32m[I 2023-04-26 00:17:33,846][39m Trial 109 finished with value: 0.8648648648648648 and parameters: {'criterion': 'entropy', 'n_estimators': 181, 'max_features': 0.2877709791624173, 'max_depth': 15, 'min_samples_split': 11, 'min_samples_leaf': 5}. Best is trial 15 with value: 0.8869565217391304.
[32m[I 2023-04-26 00:17:33,993][39m Trial 110 finished with value: 0.8596491228070176 and parameters: {'criterion': 'entropy', 'n_estimators': 200, 'max_features': 0.4313514408090096, 'max_depth': 10, 'min_samples_split': 9, 'min_samples_leaf': 7}. Best is trial 15 with value: 0.8869565217391304.
[32m[I 2023-04-26 00:17:34,085][39m Trial 111 finished with value: 0.8672566371681416 and parameters: {'criterion': 'entropy', 'n_estimators': 126, 'max_features': 0.10544172881262043, 'max_depth': 18, 'min_samples_split': 2, 'min_samples_leaf': 3}. Best is trial 15 with value: 0.8869565217391304.
[32m[I 2023-04-26 00:17:34,180][39m Trial 112 finished with value: 0.8771929824561403 and parameters: {'criterion': 'entropy', 'n_estimators': 128, 'max_features': 0.2093260415141427, 'max_depth': 69, 'min_samples_split': 8, 'min_samples_leaf': 3}. Best is trial 15 with value: 0.8869565217391304.
[32m[I 2023-04-26 00:17:34,316][39m Trial 113 finished with value: 0.8596491228070176 and parameters: {'criterion': 'entropy', 'n_estimators': 176, 'max_features': 0.3977056916100826, 'max_depth': 63, 'min_samples_split': 2, 'min_samples_leaf': 4}. Best is trial 15 with value: 0.8869565217391304.
[32m[I 2023-04-26 00:17:34,464][39m Trial 114 finished with value: 0.8849557522123893 and parameters: {'criterion': 'entropy', 'n_estimators': 185, 'max_features': 0.34138238179261693, 'max_depth': 57, 'min_samples_split': 11, 'min_samples_leaf': 4}. Best is trial 15 with value: 0.8869565217391304.
[32m[I 2023-04-26 00:17:34,598][39m Trial 115 finished with value: 0.8771929824561403 and parameters: {'criterion': 'entropy', 'n_estimators': 184, 'max_features': 0.23574973342444253, 'max_depth': 50, 'min_samples_split': 7, 'min_samples_leaf': 4}. Best is trial 15 with value: 0.8869565217391304.
[32m[I 2023-04-26 00:17:34,729][39m Trial 116 finished with value: 0.8672566371681416 and parameters: {'criterion': 'entropy', 'n_estimators': 175, 'max_features': 0.37713172521601984, 'max_depth': 58, 'min_samples_split': 2, 'min_samples_leaf': 4}. Best is trial 15 with value: 0.8869565217391304.
[32m[I 2023-04-26 00:17:34,874][39m Trial 117 finished with value: 0.8771929824561403 and parameters: {'criterion': 'entropy', 'n_estimators': 193, 'max_features': 0.3106607328118954, 'max_depth': 7, 'min_samples_split': 7, 'min_samples_leaf': 4}. Best is trial 15 with value: 0.8869565217391304.
[32m[I 2023-04-26 00:17:34,968][39m Trial 118 finished with value: 0.8571428571428572 and parameters: {'criterion': 'gini', 'n_estimators': 123, 'max_features': 0.29584537155319524, 'max_depth': 13, 'min_samples_split': 9, 'min_samples_leaf': 2}. Best is trial 15 with value: 0.8869565217391304.
[32m[I 2023-04-26 00:17:35,083][39m Trial 119 finished with value: 0.8771929824561403 and parameters: {'criterion': 'entropy', 'n_estimators': 136, 'max_features': 0.7504258892355836, 'max_depth': 29, 'min_samples_split': 10, 'min_samples_leaf': 5}. Best is trial 15 with value: 0.8869565217391304.
[32m[I 2023-04-26 00:17:35,229][39m Trial 120 finished with value: 0.8695652173913043 and parameters: {'criterion': 'entropy', 'n_estimators': 193, 'max_features': 0.3520478672409227, 'max_depth': 7, 'min_samples_split': 7, 'min_samples_leaf': 4}. Best is trial 15 with value: 0.8869565217391304.
[32m[I 2023-04-26 00:17:35,333][39m Trial 121 finished with value: 0.8672566371681416 and parameters: {'criterion': 'entropy', 'n_estimators': 141, 'max_features': 0.1907973779040774, 'max_depth': 56, 'min_samples_split': 11, 'min_samples_leaf': 3}. Best is trial 15 with value: 0.8869565217391304.
[32m[I 2023-04-26 00:17:35,442][39m Trial 122 finished with value: 0.8771929824561403 and parameters: {'criterion': 'entropy', 'n_estimators': 146, 'max_features': 0.32310753190217967, 'max_depth': 44, 'min_samples_split': 11, 'min_samples_leaf': 4}. Best is trial 15 with value: 0.8869565217391304.
[32m[I 2023-04-26 00:17:35,569][39m Trial 123 finished with value: 0.8571428571428572 and parameters: {'criterion': 'gini', 'n_estimators': 186, 'max_features': 0.28340932191632756, 'max_depth': 23, 'min_samples_split': 8, 'min_samples_leaf': 2}. Best is trial 15 with value: 0.8869565217391304.
[32m[I 2023-04-26 00:17:35,662][39m Trial 124 finished with value: 0.8648648648648648 and parameters: {'criterion': 'gini', 'n_estimators': 120, 'max_features': 0.22140624152390614, 'max_depth': 93, 'min_samples_split': 8, 'min_samples_leaf': 3}. Best is trial 15 with value: 0.8869565217391304.
[32m[I 2023-04-26 00:17:35,759][39m Trial 125 finished with value: 0.8869565217391304 and parameters: {'criterion': 'entropy', 'n_estimators': 129, 'max_features': 0.26308975303841253, 'max_depth': 69, 'min_samples_split': 11, 'min_samples_leaf': 4}. Best is trial 15 with value: 0.8869565217391304.
[32m[I 2023-04-26 00:17:35,855][39m Trial 126 finished with value: 0.8771929824561403 and parameters: {'criterion': 'entropy', 'n_estimators': 129, 'max_features': 0.25519044489119136, 'max_depth': 68, 'min_samples_split': 9, 'min_samples_leaf': 3}. Best is trial 15 with value: 0.8869565217391304.
[32m[I 2023-04-26 00:17:35,947][39m Trial 127 finished with value: 0.8793103448275863 and parameters: {'criterion': 'gini', 'n_estimators': 115, 'max_features': 0.5677010891965029, 'max_depth': 96, 'min_samples_split': 5, 'min_samples_leaf': 4}. Best is trial 15 with value: 0.8869565217391304.
[32m[I 2023-04-26 00:17:36,044][39m Trial 128 finished with value: 0.8596491228070176 and parameters: {'criterion': 'gini', 'n_estimators': 114, 'max_features': 0.5683504848060942, 'max_depth': 72, 'min_samples_split': 5, 'min_samples_leaf': 4}. Best is trial 15 with value: 0.8869565217391304.
[32m[I 2023-04-26 00:17:36,153][39m Trial 129 finished with value: 0.8596491228070176 and parameters: {'criterion': 'entropy', 'n_estimators': 134, 'max_features': 0.5794495682268122, 'max_depth': 97, 'min_samples_split': 10, 'min_samples_leaf': 4}. Best is trial 15 with value: 0.8869565217391304.
[32m[I 2023-04-26 00:17:36,252][39m Trial 130 finished with value: 0.8793103448275863 and parameters: {'criterion': 'entropy', 'n_estimators': 122, 'max_features': 0.6098514261545522, 'max_depth': 95, 'min_samples_split': 4, 'min_samples_leaf': 5}. Best is trial 15 with value: 0.8869565217391304.
[32m[I 2023-04-26 00:17:36,352][39m Trial 131 finished with value: 0.8521739130434783 and parameters: {'criterion': 'entropy', 'n_estimators': 121, 'max_features': 0.6447930165249086, 'max_depth': 94, 'min_samples_split': 4, 'min_samples_leaf': 5}. Best is trial 15 with value: 0.8869565217391304.
[32m[I 2023-04-26 00:17:36,441][39m Trial 132 finished with value: 0.8596491228070176 and parameters: {'criterion': 'entropy', 'n_estimators': 110, 'max_features': 0.4745140440190859, 'max_depth': 101, 'min_samples_split': 4, 'min_samples_leaf': 5}. Best is trial 15 with value: 0.8869565217391304.
[32m[I 2023-04-26 00:17:36,540][39m Trial 133 finished with value: 0.8695652173913043 and parameters: {'criterion': 'entropy', 'n_estimators': 115, 'max_features': 0.6171576109224041, 'max_depth': 99, 'min_samples_split': 5, 'min_samples_leaf': 4}. Best is trial 15 with value: 0.8869565217391304.
[32m[I 2023-04-26 00:17:36,630][39m Trial 134 finished with value: 0.8793103448275863 and parameters: {'criterion': 'entropy', 'n_estimators': 107, 'max_features': 0.5362542750757112, 'max_depth': 91, 'min_samples_split': 3, 'min_samples_leaf': 5}. Best is trial 15 with value: 0.8869565217391304.
[32m[I 2023-04-26 00:17:36,718][39m Trial 135 finished with value: 0.8695652173913043 and parameters: {'criterion': 'entropy', 'n_estimators': 107, 'max_features': 0.5437777622642508, 'max_depth': 90, 'min_samples_split': 3, 'min_samples_leaf': 4}. Best is trial 15 with value: 0.8869565217391304.
[32m[I 2023-04-26 00:17:36,802][39m Trial 136 finished with value: 0.8793103448275863 and parameters: {'criterion': 'gini', 'n_estimators': 104, 'max_features': 0.5140787566130168, 'max_depth': 87, 'min_samples_split': 3, 'min_samples_leaf': 5}. Best is trial 15 with value: 0.8869565217391304.
[32m[I 2023-04-26 00:17:36,893][39m Trial 137 finished with value: 0.847457627118644 and parameters: {'criterion': 'entropy', 'n_estimators': 108, 'max_features': 0.6069610582082333, 'max_depth': 97, 'min_samples_split': 4, 'min_samples_leaf': 4}. Best is trial 15 with value: 0.8869565217391304.
[32m[I 2023-04-26 00:17:37,018][39m Trial 138 finished with value: 0.8771929824561403 and parameters: {'criterion': 'gini', 'n_estimators': 156, 'max_features': 0.5892192654297612, 'max_depth': 88, 'min_samples_split': 3, 'min_samples_leaf': 5}. Best is trial 15 with value: 0.8869565217391304.
[32m[I 2023-04-26 00:17:37,105][39m Trial 139 finished with value: 0.8793103448275863 and parameters: {'criterion': 'entropy', 'n_estimators': 104, 'max_features': 0.5149460417547569, 'max_depth': 91, 'min_samples_split': 11, 'min_samples_leaf': 5}. Best is trial 15 with value: 0.8869565217391304.
[32m[I 2023-04-26 00:17:37,185][39m Trial 140 finished with value: 0.8672566371681416 and parameters: {'criterion': 'entropy', 'n_estimators': 98, 'max_features': 0.27223094928758484, 'max_depth': 78, 'min_samples_split': 11, 'min_samples_leaf': 6}. Best is trial 15 with value: 0.8869565217391304.
[32m[I 2023-04-26 00:17:37,271][39m Trial 141 finished with value: 0.8695652173913043 and parameters: {'criterion': 'entropy', 'n_estimators': 102, 'max_features': 0.5151944611462287, 'max_depth': 86, 'min_samples_split': 11, 'min_samples_leaf': 5}. Best is trial 15 with value: 0.8869565217391304.
[32m[I 2023-04-26 00:17:37,368][39m Trial 142 finished with value: 0.8495575221238938 and parameters: {'criterion': 'entropy', 'n_estimators': 112, 'max_features': 0.6366237757439728, 'max_depth': 93, 'min_samples_split': 2, 'min_samples_leaf': 4}. Best is trial 15 with value: 0.8869565217391304.
[32m[I 2023-04-26 00:17:37,445][39m Trial 143 finished with value: 0.864406779661017 and parameters: {'criterion': 'entropy', 'n_estimators': 90, 'max_features': 0.55140528568558, 'max_depth': 95, 'min_samples_split': 11, 'min_samples_leaf': 5}. Best is trial 15 with value: 0.8869565217391304.
[32m[I 2023-04-26 00:17:37,528][39m Trial 144 finished with value: 0.8717948717948718 and parameters: {'criterion': 'entropy', 'n_estimators': 105, 'max_features': 0.492658829748329, 'max_depth': 82, 'min_samples_split': 3, 'min_samples_leaf': 6}. Best is trial 15 with value: 0.8869565217391304.
[32m[I 2023-04-26 00:17:37,622][39m Trial 145 finished with value: 0.8793103448275863 and parameters: {'criterion': 'gini', 'n_estimators': 105, 'max_features': 0.5301345096822289, 'max_depth': 91, 'min_samples_split': 4, 'min_samples_leaf': 5}. Best is trial 15 with value: 0.8869565217391304.
