[32m[I 2023-04-26 00:17:22,890][39m A new study created in memory with name: no-name-61d0ae5f-29be-4c6c-98ca-2819ecc0a144
[32m[I 2023-04-26 00:17:23,020][39m Trial 0 finished with value: 0.8333333333333334 and parameters: {'criterion': 'entropy', 'n_estimators': 159, 'max_features': 0.8047149344379985, 'max_depth': 25, 'min_samples_split': 10, 'min_samples_leaf': 11}. Best is trial 0 with value: 0.8333333333333334.
[32m[I 2023-04-26 00:17:23,125][39m Trial 1 finished with value: 0.8495575221238938 and parameters: {'criterion': 'entropy', 'n_estimators': 136, 'max_features': 0.6634196390113999, 'max_depth': 57, 'min_samples_split': 11, 'min_samples_leaf': 3}. Best is trial 1 with value: 0.8495575221238938.
[32m[I 2023-04-26 00:17:23,203][39m Trial 2 finished with value: 0.7812500000000001 and parameters: {'criterion': 'entropy', 'n_estimators': 123, 'max_features': 0.5142913698337066, 'max_depth': 1, 'min_samples_split': 2, 'min_samples_leaf': 5}. Best is trial 1 with value: 0.8495575221238938.
[32m[I 2023-04-26 00:17:23,268][39m Trial 3 finished with value: 0.8648648648648648 and parameters: {'criterion': 'gini', 'n_estimators': 98, 'max_features': 0.17318692651378387, 'max_depth': 51, 'min_samples_split': 3, 'min_samples_leaf': 5}. Best is trial 3 with value: 0.8648648648648648.
[32m[I 2023-04-26 00:17:23,309][39m Trial 4 finished with value: 0.8363636363636363 and parameters: {'criterion': 'gini', 'n_estimators': 54, 'max_features': 0.45418739397353525, 'max_depth': 90, 'min_samples_split': 2, 'min_samples_leaf': 1}. Best is trial 3 with value: 0.8648648648648648.
[32m[I 2023-04-26 00:17:23,407][39m Trial 5 finished with value: 0.8214285714285715 and parameters: {'criterion': 'gini', 'n_estimators': 124, 'max_features': 0.8926112559332158, 'max_depth': 20, 'min_samples_split': 4, 'min_samples_leaf': 1}. Best is trial 3 with value: 0.8648648648648648.
[32m[I 2023-04-26 00:17:23,533][39m Trial 6 finished with value: 0.8547008547008546 and parameters: {'criterion': 'gini', 'n_estimators': 183, 'max_features': 0.4620538985579532, 'max_depth': 63, 'min_samples_split': 5, 'min_samples_leaf': 11}. Best is trial 3 with value: 0.8648648648648648.
[32m[I 2023-04-26 00:17:23,627][39m Trial 7 finished with value: 0.8771929824561403 and parameters: {'criterion': 'gini', 'n_estimators': 131, 'max_features': 0.3995140140673542, 'max_depth': 83, 'min_samples_split': 2, 'min_samples_leaf': 4}. Best is trial 7 with value: 0.8771929824561403.
[32m[I 2023-04-26 00:17:23,676][39m Trial 8 finished with value: 0.8695652173913043 and parameters: {'criterion': 'entropy', 'n_estimators': 62, 'max_features': 0.42087098909768583, 'max_depth': 71, 'min_samples_split': 9, 'min_samples_leaf': 5}. Best is trial 7 with value: 0.8771929824561403.
[32m[I 2023-04-26 00:17:23,730][39m Trial 9 finished with value: 0.8571428571428572 and parameters: {'criterion': 'entropy', 'n_estimators': 78, 'max_features': 0.23762883045581085, 'max_depth': 17, 'min_samples_split': 4, 'min_samples_leaf': 6}. Best is trial 7 with value: 0.8771929824561403.
[32m[I 2023-04-26 00:17:23,858][39m Trial 10 finished with value: 0.8571428571428572 and parameters: {'criterion': 'gini', 'n_estimators': 201, 'max_features': 0.059503481435699, 'max_depth': 101, 'min_samples_split': 7, 'min_samples_leaf': 8}. Best is trial 7 with value: 0.8771929824561403.
[32m[I 2023-04-26 00:17:23,925][39m Trial 11 finished with value: 0.8545454545454546 and parameters: {'criterion': 'entropy', 'n_estimators': 91, 'max_features': 0.2916500980269269, 'max_depth': 77, 'min_samples_split': 8, 'min_samples_leaf': 8}. Best is trial 7 with value: 0.8771929824561403.
[32m[I 2023-04-26 00:17:23,973][39m Trial 12 finished with value: 0.8392857142857144 and parameters: {'criterion': 'entropy', 'n_estimators': 51, 'max_features': 0.6197506484484386, 'max_depth': 74, 'min_samples_split': 9, 'min_samples_leaf': 3}. Best is trial 7 with value: 0.8771929824561403.
[32m[I 2023-04-26 00:17:24,086][39m Trial 13 finished with value: 0.8571428571428572 and parameters: {'criterion': 'gini', 'n_estimators': 154, 'max_features': 0.3413722825620525, 'max_depth': 43, 'min_samples_split': 6, 'min_samples_leaf': 3}. Best is trial 7 with value: 0.8771929824561403.
[32m[I 2023-04-26 00:17:24,165][39m Trial 14 finished with value: 0.8547008547008546 and parameters: {'criterion': 'gini', 'n_estimators': 101, 'max_features': 0.647376791934565, 'max_depth': 81, 'min_samples_split': 8, 'min_samples_leaf': 8}. Best is trial 7 with value: 0.8771929824561403.
[32m[I 2023-04-26 00:17:24,272][39m Trial 15 finished with value: 0.8869565217391304 and parameters: {'criterion': 'entropy', 'n_estimators': 145, 'max_features': 0.356708469677088, 'max_depth': 98, 'min_samples_split': 11, 'min_samples_leaf': 4}. Best is trial 15 with value: 0.8869565217391304.
[32m[I 2023-04-26 00:17:24,377][39m Trial 16 finished with value: 0.8571428571428572 and parameters: {'criterion': 'entropy', 'n_estimators': 155, 'max_features': 0.016873617743694225, 'max_depth': 101, 'min_samples_split': 11, 'min_samples_leaf': 4}. Best is trial 15 with value: 0.8869565217391304.
[32m[I 2023-04-26 00:17:24,471][39m Trial 17 finished with value: 0.8648648648648648 and parameters: {'criterion': 'gini', 'n_estimators': 135, 'max_features': 0.14650618197322313, 'max_depth': 92, 'min_samples_split': 6, 'min_samples_leaf': 2}. Best is trial 15 with value: 0.8869565217391304.
[32m[I 2023-04-26 00:17:24,588][39m Trial 18 finished with value: 0.8695652173913043 and parameters: {'criterion': 'gini', 'n_estimators': 169, 'max_features': 0.35478380106080115, 'max_depth': 85, 'min_samples_split': 5, 'min_samples_leaf': 7}. Best is trial 15 with value: 0.8869565217391304.
[32m[I 2023-04-26 00:17:24,684][39m Trial 19 finished with value: 0.8495575221238938 and parameters: {'criterion': 'entropy', 'n_estimators': 118, 'max_features': 0.5449439390526062, 'max_depth': 41, 'min_samples_split': 7, 'min_samples_leaf': 4}. Best is trial 15 with value: 0.8869565217391304.
[32m[I 2023-04-26 00:17:24,796][39m Trial 20 finished with value: 0.8403361344537814 and parameters: {'criterion': 'gini', 'n_estimators': 142, 'max_features': 0.8009075972705905, 'max_depth': 93, 'min_samples_split': 3, 'min_samples_leaf': 6}. Best is trial 15 with value: 0.8869565217391304.
[32m[I 2023-04-26 00:17:24,916][39m Trial 21 finished with value: 0.8421052631578947 and parameters: {'criterion': 'gini', 'n_estimators': 171, 'max_features': 0.36329697545163786, 'max_depth': 84, 'min_samples_split': 4, 'min_samples_leaf': 7}. Best is trial 15 with value: 0.8869565217391304.
[32m[I 2023-04-26 00:17:25,040][39m Trial 22 finished with value: 0.8521739130434783 and parameters: {'criterion': 'gini', 'n_estimators': 181, 'max_features': 0.26251269316118137, 'max_depth': 70, 'min_samples_split': 5, 'min_samples_leaf': 9}. Best is trial 15 with value: 0.8869565217391304.
[32m[I 2023-04-26 00:17:25,123][39m Trial 23 finished with value: 0.8771929824561403 and parameters: {'criterion': 'gini', 'n_estimators': 111, 'max_features': 0.3751975006535265, 'max_depth': 87, 'min_samples_split': 5, 'min_samples_leaf': 4}. Best is trial 15 with value: 0.8869565217391304.
[32m[I 2023-04-26 00:17:25,213][39m Trial 24 finished with value: 0.8620689655172413 and parameters: {'criterion': 'gini', 'n_estimators': 116, 'max_features': 0.5553163504603379, 'max_depth': 97, 'min_samples_split': 3, 'min_samples_leaf': 4}. Best is trial 15 with value: 0.8869565217391304.
[32m[I 2023-04-26 00:17:25,288][39m Trial 25 finished with value: 0.8672566371681416 and parameters: {'criterion': 'gini', 'n_estimators': 104, 'max_features': 0.12000524935031198, 'max_depth': 87, 'min_samples_split': 2, 'min_samples_leaf': 2}. Best is trial 15 with value: 0.8869565217391304.
[32m[I 2023-04-26 00:17:25,398][39m Trial 26 finished with value: 0.8495575221238938 and parameters: {'criterion': 'entropy', 'n_estimators': 144, 'max_features': 0.41272348303472195, 'max_depth': 65, 'min_samples_split': 10, 'min_samples_leaf': 2}. Best is trial 15 with value: 0.8869565217391304.
[32m[I 2023-04-26 00:17:25,463][39m Trial 27 finished with value: 0.8695652173913043 and parameters: {'criterion': 'gini', 'n_estimators': 83, 'max_features': 0.23105602879189377, 'max_depth': 80, 'min_samples_split': 8, 'min_samples_leaf': 4}. Best is trial 15 with value: 0.8869565217391304.
[32m[I 2023-04-26 00:17:25,544][39m Trial 28 finished with value: 0.8672566371681416 and parameters: {'criterion': 'entropy', 'n_estimators': 107, 'max_features': 0.3365672718976494, 'max_depth': 91, 'min_samples_split': 6, 'min_samples_leaf': 6}. Best is trial 15 with value: 0.8869565217391304.
[32m[I 2023-04-26 00:17:25,650][39m Trial 29 finished with value: 0.8793103448275863 and parameters: {'criterion': 'entropy', 'n_estimators': 132, 'max_features': 0.5546741940826785, 'max_depth': 31, 'min_samples_split': 10, 'min_samples_leaf': 5}. Best is trial 15 with value: 0.8869565217391304.
[32m[I 2023-04-26 00:17:25,746][39m Trial 30 finished with value: 0.8771929824561403 and parameters: {'criterion': 'entropy', 'n_estimators': 113, 'max_features': 0.732484568763468, 'max_depth': 35, 'min_samples_split': 10, 'min_samples_leaf': 5}. Best is trial 15 with value: 0.8869565217391304.
[32m[I 2023-04-26 00:17:25,851][39m Trial 31 finished with value: 0.8495575221238938 and parameters: {'criterion': 'entropy', 'n_estimators': 130, 'max_features': 0.5820028278763639, 'max_depth': 30, 'min_samples_split': 11, 'min_samples_leaf': 3}. Best is trial 15 with value: 0.8869565217391304.
[32m[I 2023-04-26 00:17:25,962][39m Trial 32 finished with value: 0.8695652173913043 and parameters: {'criterion': 'entropy', 'n_estimators': 144, 'max_features': 0.4972771766377586, 'max_depth': 9, 'min_samples_split': 10, 'min_samples_leaf': 4}. Best is trial 15 with value: 0.8869565217391304.
[32m[I 2023-04-26 00:17:26,072][39m Trial 33 finished with value: 0.8717948717948718 and parameters: {'criterion': 'entropy', 'n_estimators': 130, 'max_features': 0.7228698378484768, 'max_depth': 31, 'min_samples_split': 9, 'min_samples_leaf': 5}. Best is trial 15 with value: 0.8869565217391304.
[32m[I 2023-04-26 00:17:26,195][39m Trial 34 finished with value: 0.8547008547008546 and parameters: {'criterion': 'entropy', 'n_estimators': 152, 'max_features': 0.7310321174188266, 'max_depth': 38, 'min_samples_split': 11, 'min_samples_leaf': 6}. Best is trial 15 with value: 0.8869565217391304.
[32m[I 2023-04-26 00:17:26,344][39m Trial 35 finished with value: 0.8547008547008546 and parameters: {'criterion': 'entropy', 'n_estimators': 163, 'max_features': 0.9661471145307895, 'max_depth': 49, 'min_samples_split': 10, 'min_samples_leaf': 5}. Best is trial 15 with value: 0.8869565217391304.
[32m[I 2023-04-26 00:17:26,449][39m Trial 36 finished with value: 0.8695652173913043 and parameters: {'criterion': 'entropy', 'n_estimators': 120, 'max_features': 0.6938881718935792, 'max_depth': 57, 'min_samples_split': 11, 'min_samples_leaf': 5}. Best is trial 15 with value: 0.8869565217391304.
[32m[I 2023-04-26 00:17:26,539][39m Trial 37 finished with value: 0.864406779661017 and parameters: {'criterion': 'entropy', 'n_estimators': 106, 'max_features': 0.8349462888509235, 'max_depth': 28, 'min_samples_split': 10, 'min_samples_leaf': 7}. Best is trial 15 with value: 0.8869565217391304.
[32m[I 2023-04-26 00:17:26,648][39m Trial 38 finished with value: 0.8672566371681416 and parameters: {'criterion': 'entropy', 'n_estimators': 139, 'max_features': 0.4694511870315833, 'max_depth': 21, 'min_samples_split': 9, 'min_samples_leaf': 3}. Best is trial 15 with value: 0.8869565217391304.
[32m[I 2023-04-26 00:17:26,744][39m Trial 39 finished with value: 0.8620689655172413 and parameters: {'criterion': 'entropy', 'n_estimators': 116, 'max_features': 0.6011795165901376, 'max_depth': 34, 'min_samples_split': 10, 'min_samples_leaf': 5}. Best is trial 15 with value: 0.8869565217391304.
[32m[I 2023-04-26 00:17:26,821][39m Trial 40 finished with value: 0.8695652173913043 and parameters: {'criterion': 'entropy', 'n_estimators': 92, 'max_features': 0.518828019171163, 'max_depth': 50, 'min_samples_split': 11, 'min_samples_leaf': 6}. Best is trial 15 with value: 0.8869565217391304.
[32m[I 2023-04-26 00:17:26,908][39m Trial 41 finished with value: 0.8793103448275863 and parameters: {'criterion': 'gini', 'n_estimators': 110, 'max_features': 0.407315241025767, 'max_depth': 10, 'min_samples_split': 2, 'min_samples_leaf': 4}. Best is trial 15 with value: 0.8869565217391304.
[32m[I 2023-04-26 00:17:27,005][39m Trial 42 finished with value: 0.8672566371681416 and parameters: {'criterion': 'entropy', 'n_estimators': 128, 'max_features': 0.4267549539666282, 'max_depth': 4, 'min_samples_split': 2, 'min_samples_leaf': 3}. Best is trial 15 with value: 0.8869565217391304.
[32m[I 2023-04-26 00:17:27,087][39m Trial 43 finished with value: 0.8869565217391304 and parameters: {'criterion': 'gini', 'n_estimators': 110, 'max_features': 0.30671657323229534, 'max_depth': 14, 'min_samples_split': 9, 'min_samples_leaf': 4}. Best is trial 15 with value: 0.8869565217391304.
[32m[I 2023-04-26 00:17:27,160][39m Trial 44 finished with value: 0.8672566371681416 and parameters: {'criterion': 'gini', 'n_estimators': 95, 'max_features': 0.17512537728569855, 'max_depth': 12, 'min_samples_split': 9, 'min_samples_leaf': 4}. Best is trial 15 with value: 0.8869565217391304.
[32m[I 2023-04-26 00:17:27,228][39m Trial 45 finished with value: 0.8672566371681416 and parameters: {'criterion': 'entropy', 'n_estimators': 81, 'max_features': 0.2957371580732561, 'max_depth': 24, 'min_samples_split': 10, 'min_samples_leaf': 5}. Best is trial 15 with value: 0.8869565217391304.
[32m[I 2023-04-26 00:17:27,322][39m Trial 46 finished with value: 0.8771929824561403 and parameters: {'criterion': 'gini', 'n_estimators': 124, 'max_features': 0.30336736580976525, 'max_depth': 16, 'min_samples_split': 8, 'min_samples_leaf': 2}. Best is trial 15 with value: 0.8869565217391304.
[32m[I 2023-04-26 00:17:27,398][39m Trial 47 finished with value: 0.7874015748031497 and parameters: {'criterion': 'gini', 'n_estimators': 109, 'max_features': 0.3884358695207781, 'max_depth': 1, 'min_samples_split': 7, 'min_samples_leaf': 4}. Best is trial 15 with value: 0.8869565217391304.
[32m[I 2023-04-26 00:17:27,482][39m Trial 48 finished with value: 0.8264462809917354 and parameters: {'criterion': 'entropy', 'n_estimators': 99, 'max_features': 0.7722096740401727, 'max_depth': 8, 'min_samples_split': 9, 'min_samples_leaf': 11}. Best is trial 15 with value: 0.8869565217391304.
[32m[I 2023-04-26 00:17:27,576][39m Trial 49 finished with value: 0.8363636363636363 and parameters: {'criterion': 'gini', 'n_estimators': 123, 'max_features': 0.3147739935590923, 'max_depth': 16, 'min_samples_split': 8, 'min_samples_leaf': 1}. Best is trial 15 with value: 0.8869565217391304.
[32m[I 2023-04-26 00:17:27,638][39m Trial 50 finished with value: 0.8245614035087718 and parameters: {'criterion': 'gini', 'n_estimators': 72, 'max_features': 0.46003045166452206, 'max_depth': 16, 'min_samples_split': 8, 'min_samples_leaf': 1}. Best is trial 15 with value: 0.8869565217391304.
[32m[I 2023-04-26 00:17:27,737][39m Trial 51 finished with value: 0.8695652173913043 and parameters: {'criterion': 'gini', 'n_estimators': 135, 'max_features': 0.20738582764002012, 'max_depth': 11, 'min_samples_split': 3, 'min_samples_leaf': 2}. Best is trial 15 with value: 0.8869565217391304.
[32m[I 2023-04-26 00:17:27,832][39m Trial 52 finished with value: 0.8695652173913043 and parameters: {'criterion': 'gini', 'n_estimators': 125, 'max_features': 0.2644242555830038, 'max_depth': 21, 'min_samples_split': 5, 'min_samples_leaf': 3}. Best is trial 15 with value: 0.8869565217391304.
[32m[I 2023-04-26 00:17:27,941][39m Trial 53 finished with value: 0.8717948717948718 and parameters: {'criterion': 'gini', 'n_estimators': 149, 'max_features': 0.4390679198328528, 'max_depth': 25, 'min_samples_split': 10, 'min_samples_leaf': 5}. Best is trial 15 with value: 0.8869565217391304.
[32m[I 2023-04-26 00:17:28,035][39m Trial 54 finished with value: 0.8288288288288289 and parameters: {'criterion': 'entropy', 'n_estimators': 112, 'max_features': 0.651541981879693, 'max_depth': 36, 'min_samples_split': 2, 'min_samples_leaf': 4}. Best is trial 15 with value: 0.8869565217391304.
[32m[I 2023-04-26 00:17:28,104][39m Trial 55 finished with value: 0.8468468468468469 and parameters: {'criterion': 'gini', 'n_estimators': 87, 'max_features': 0.3859382551548356, 'max_depth': 98, 'min_samples_split': 4, 'min_samples_leaf': 3}. Best is trial 15 with value: 0.8869565217391304.
[32m[I 2023-04-26 00:17:28,225][39m Trial 56 finished with value: 0.8392857142857144 and parameters: {'criterion': 'gini', 'n_estimators': 160, 'max_features': 0.4898797182037493, 'max_depth': 14, 'min_samples_split': 9, 'min_samples_leaf': 2}. Best is trial 15 with value: 0.8869565217391304.
[32m[I 2023-04-26 00:17:28,325][39m Trial 57 finished with value: 0.875 and parameters: {'criterion': 'gini', 'n_estimators': 135, 'max_features': 0.3199488700963026, 'max_depth': 44, 'min_samples_split': 11, 'min_samples_leaf': 5}. Best is trial 15 with value: 0.8869565217391304.
[32m[I 2023-04-26 00:17:28,424][39m Trial 58 finished with value: 0.8333333333333334 and parameters: {'criterion': 'entropy', 'n_estimators': 113, 'max_features': 0.9533900849990913, 'max_depth': 57, 'min_samples_split': 3, 'min_samples_leaf': 6}. Best is trial 15 with value: 0.8869565217391304.
[32m[I 2023-04-26 00:17:28,501][39m Trial 59 finished with value: 0.8869565217391304 and parameters: {'criterion': 'gini', 'n_estimators': 101, 'max_features': 0.3813476832033403, 'max_depth': 5, 'min_samples_split': 7, 'min_samples_leaf': 3}. Best is trial 15 with value: 0.8869565217391304.
[32m[I 2023-04-26 00:17:28,582][39m Trial 60 finished with value: 0.8571428571428572 and parameters: {'criterion': 'gini', 'n_estimators': 100, 'max_features': 0.5361467448119441, 'max_depth': 9, 'min_samples_split': 7, 'min_samples_leaf': 3}. Best is trial 15 with value: 0.8869565217391304.
[32m[I 2023-04-26 00:17:28,663][39m Trial 61 finished with value: 0.8521739130434783 and parameters: {'criterion': 'gini', 'n_estimators': 110, 'max_features': 0.3659942057077814, 'max_depth': 5, 'min_samples_split': 6, 'min_samples_leaf': 4}. Best is trial 15 with value: 0.8869565217391304.
[32m[I 2023-04-26 00:17:28,749][39m Trial 62 finished with value: 0.7874015748031497 and parameters: {'criterion': 'gini', 'n_estimators': 132, 'max_features': 0.40835578066754863, 'max_depth': 1, 'min_samples_split': 10, 'min_samples_leaf': 5}. Best is trial 15 with value: 0.8869565217391304.
[32m[I 2023-04-26 00:17:28,841][39m Trial 63 finished with value: 0.8545454545454546 and parameters: {'criterion': 'gini', 'n_estimators': 120, 'max_features': 0.27546877726208235, 'max_depth': 18, 'min_samples_split': 7, 'min_samples_leaf': 2}. Best is trial 15 with value: 0.8869565217391304.
[32m[I 2023-04-26 00:17:28,917][39m Trial 64 finished with value: 0.8448275862068967 and parameters: {'criterion': 'gini', 'n_estimators': 103, 'max_features': 0.35524035874711624, 'max_depth': 5, 'min_samples_split': 5, 'min_samples_leaf': 4}. Best is trial 15 with value: 0.8869565217391304.
[32m[I 2023-04-26 00:17:28,976][39m Trial 65 finished with value: 0.8672566371681416 and parameters: {'criterion': 'gini', 'n_estimators': 74, 'max_features': 0.3085188163856444, 'max_depth': 95, 'min_samples_split': 8, 'min_samples_leaf': 3}. Best is trial 15 with value: 0.8869565217391304.
[32m[I 2023-04-26 00:17:29,087][39m Trial 66 finished with value: 0.8035714285714286 and parameters: {'criterion': 'entropy', 'n_estimators': 123, 'max_features': 0.8515248079294896, 'max_depth': 22, 'min_samples_split': 8, 'min_samples_leaf': 1}. Best is trial 15 with value: 0.8869565217391304.
[32m[I 2023-04-26 00:17:29,160][39m Trial 67 finished with value: 0.8695652173913043 and parameters: {'criterion': 'gini', 'n_estimators': 94, 'max_features': 0.23637274915761536, 'max_depth': 26, 'min_samples_split': 9, 'min_samples_leaf': 2}. Best is trial 15 with value: 0.8869565217391304.
[32m[I 2023-04-26 00:17:29,277][39m Trial 68 finished with value: 0.8793103448275863 and parameters: {'criterion': 'entropy', 'n_estimators': 147, 'max_features': 0.5658891436400941, 'max_depth': 66, 'min_samples_split': 2, 'min_samples_leaf': 4}. Best is trial 15 with value: 0.8869565217391304.
[32m[I 2023-04-26 00:17:29,395][39m Trial 69 finished with value: 0.8620689655172413 and parameters: {'criterion': 'gini', 'n_estimators': 146, 'max_features': 0.5702683003190436, 'max_depth': 72, 'min_samples_split': 2, 'min_samples_leaf': 4}. Best is trial 15 with value: 0.8869565217391304.
[32m[I 2023-04-26 00:17:29,516][39m Trial 70 finished with value: 0.8672566371681416 and parameters: {'criterion': 'entropy', 'n_estimators': 167, 'max_features': 0.20393284878611934, 'max_depth': 13, 'min_samples_split': 7, 'min_samples_leaf': 3}. Best is trial 15 with value: 0.8869565217391304.
[32m[I 2023-04-26 00:17:29,639][39m Trial 71 finished with value: 0.8596491228070176 and parameters: {'criterion': 'gini', 'n_estimators': 150, 'max_features': 0.6220928005750197, 'max_depth': 64, 'min_samples_split': 2, 'min_samples_leaf': 4}. Best is trial 15 with value: 0.8869565217391304.
[32m[I 2023-04-26 00:17:29,763][39m Trial 72 finished with value: 0.8717948717948718 and parameters: {'criterion': 'entropy', 'n_estimators': 156, 'max_features': 0.4821670141275468, 'max_depth': 78, 'min_samples_split': 3, 'min_samples_leaf': 5}. Best is trial 15 with value: 0.8869565217391304.
