[32m[I 2023-04-26 00:21:38,811][39m Trial 360 finished with value: 0.8695652173913043 and parameters: {'algorithm': 'brute', 'n_neighbors': 25, 'weights': 'distance', 'metric': 'manhattan'}. Best is trial 12 with value: 0.8695652173913043.
[32m[I 2023-04-26 00:21:38,852][39m Trial 361 finished with value: 0.8695652173913043 and parameters: {'algorithm': 'brute', 'n_neighbors': 24, 'weights': 'distance', 'metric': 'manhattan'}. Best is trial 12 with value: 0.8695652173913043.
[32m[I 2023-04-26 00:21:38,876][39m Trial 362 finished with value: 0.8695652173913043 and parameters: {'algorithm': 'kd_tree', 'n_neighbors': 24, 'weights': 'distance', 'metric': 'manhattan'}. Best is trial 12 with value: 0.8695652173913043.
[32m[I 2023-04-26 00:21:38,901][39m Trial 363 finished with value: 0.8695652173913043 and parameters: {'algorithm': 'kd_tree', 'n_neighbors': 24, 'weights': 'distance', 'metric': 'manhattan'}. Best is trial 12 with value: 0.8695652173913043.
[32m[I 2023-04-26 00:21:38,926][39m Trial 364 finished with value: 0.8695652173913043 and parameters: {'algorithm': 'kd_tree', 'n_neighbors': 25, 'weights': 'distance', 'metric': 'manhattan'}. Best is trial 12 with value: 0.8695652173913043.
[32m[I 2023-04-26 00:21:38,950][39m Trial 365 finished with value: 0.7964601769911505 and parameters: {'algorithm': 'kd_tree', 'n_neighbors': 25, 'weights': 'uniform', 'metric': 'manhattan'}. Best is trial 12 with value: 0.8695652173913043.
[32m[I 2023-04-26 00:21:38,981][39m Trial 366 finished with value: 0.8695652173913043 and parameters: {'algorithm': 'auto', 'n_neighbors': 25, 'weights': 'distance', 'metric': 'manhattan'}. Best is trial 12 with value: 0.8695652173913043.
[32m[I 2023-04-26 00:21:39,005][39m Trial 367 finished with value: 0.8695652173913043 and parameters: {'algorithm': 'kd_tree', 'n_neighbors': 29, 'weights': 'distance', 'metric': 'euclidean'}. Best is trial 12 with value: 0.8695652173913043.
[32m[I 2023-04-26 00:21:39,029][39m Trial 368 finished with value: 0.831858407079646 and parameters: {'algorithm': 'kd_tree', 'n_neighbors': 1, 'weights': 'distance', 'metric': 'euclidean'}. Best is trial 12 with value: 0.8695652173913043.
[32m[I 2023-04-26 00:21:39,054][39m Trial 369 finished with value: 0.8695652173913043 and parameters: {'algorithm': 'ball_tree', 'n_neighbors': 26, 'weights': 'distance', 'metric': 'manhattan'}. Best is trial 12 with value: 0.8695652173913043.
[32m[I 2023-04-26 00:21:39,097][39m Trial 370 finished with value: 0.8695652173913043 and parameters: {'algorithm': 'auto', 'n_neighbors': 26, 'weights': 'distance', 'metric': 'manhattan'}. Best is trial 12 with value: 0.8695652173913043.
[32m[I 2023-04-26 00:21:39,142][39m Trial 371 finished with value: 0.8695652173913043 and parameters: {'algorithm': 'auto', 'n_neighbors': 24, 'weights': 'distance', 'metric': 'manhattan'}. Best is trial 12 with value: 0.8695652173913043.
[32m[I 2023-04-26 00:21:39,183][39m Trial 372 finished with value: 0.8695652173913043 and parameters: {'algorithm': 'auto', 'n_neighbors': 24, 'weights': 'distance', 'metric': 'manhattan'}. Best is trial 12 with value: 0.8695652173913043.
[32m[I 2023-04-26 00:21:39,222][39m Trial 373 finished with value: 0.8571428571428572 and parameters: {'algorithm': 'auto', 'n_neighbors': 24, 'weights': 'distance', 'metric': 'minkowski'}. Best is trial 12 with value: 0.8695652173913043.
[32m[I 2023-04-26 00:21:39,247][39m Trial 374 finished with value: 0.8495575221238938 and parameters: {'algorithm': 'ball_tree', 'n_neighbors': 28, 'weights': 'distance', 'metric': 'euclidean'}. Best is trial 12 with value: 0.8695652173913043.
[32m[I 2023-04-26 00:21:39,267][39m Trial 375 finished with value: 0.8363636363636363 and parameters: {'algorithm': 'kd_tree', 'n_neighbors': 22, 'weights': 'distance', 'metric': 'euclidean'}. Best is trial 12 with value: 0.8695652173913043.
[32m[I 2023-04-26 00:21:39,314][39m Trial 376 finished with value: 0.8695652173913043 and parameters: {'algorithm': 'brute', 'n_neighbors': 27, 'weights': 'distance', 'metric': 'manhattan'}. Best is trial 12 with value: 0.8695652173913043.
[32m[I 2023-04-26 00:21:39,339][39m Trial 377 finished with value: 0.8695652173913043 and parameters: {'algorithm': 'ball_tree', 'n_neighbors': 25, 'weights': 'distance', 'metric': 'manhattan'}. Best is trial 12 with value: 0.8695652173913043.
[32m[I 2023-04-26 00:21:39,380][39m Trial 378 finished with value: 0.8695652173913043 and parameters: {'algorithm': 'auto', 'n_neighbors': 25, 'weights': 'distance', 'metric': 'manhattan'}. Best is trial 12 with value: 0.8695652173913043.
[32m[I 2023-04-26 00:21:39,421][39m Trial 379 finished with value: 0.8695652173913043 and parameters: {'algorithm': 'auto', 'n_neighbors': 23, 'weights': 'distance', 'metric': 'manhattan'}. Best is trial 12 with value: 0.8695652173913043.
[32m[I 2023-04-26 00:21:39,463][39m Trial 380 finished with value: 0.8695652173913043 and parameters: {'algorithm': 'auto', 'n_neighbors': 23, 'weights': 'distance', 'metric': 'manhattan'}. Best is trial 12 with value: 0.8695652173913043.
[32m[I 2023-04-26 00:21:39,503][39m Trial 381 finished with value: 0.8695652173913043 and parameters: {'algorithm': 'auto', 'n_neighbors': 25, 'weights': 'distance', 'metric': 'manhattan'}. Best is trial 12 with value: 0.8695652173913043.
[32m[I 2023-04-26 00:21:39,526][39m Trial 382 finished with value: 0.8695652173913043 and parameters: {'algorithm': 'ball_tree', 'n_neighbors': 25, 'weights': 'distance', 'metric': 'manhattan'}. Best is trial 12 with value: 0.8695652173913043.
[32m[I 2023-04-26 00:21:39,551][39m Trial 383 finished with value: 0.8695652173913043 and parameters: {'algorithm': 'ball_tree', 'n_neighbors': 25, 'weights': 'distance', 'metric': 'manhattan'}. Best is trial 12 with value: 0.8695652173913043.
[32m[I 2023-04-26 00:21:39,582][39m Trial 384 finished with value: 0.7964601769911505 and parameters: {'algorithm': 'ball_tree', 'n_neighbors': 25, 'weights': 'uniform', 'metric': 'manhattan'}. Best is trial 12 with value: 0.8695652173913043.
[32m[I 2023-04-26 00:21:39,605][39m Trial 385 finished with value: 0.8695652173913043 and parameters: {'algorithm': 'ball_tree', 'n_neighbors': 25, 'weights': 'distance', 'metric': 'manhattan'}. Best is trial 12 with value: 0.8695652173913043.
[32m[I 2023-04-26 00:21:39,620][39m Trial 386 finished with value: 0.8363636363636363 and parameters: {'algorithm': 'kd_tree', 'n_neighbors': 22, 'weights': 'distance', 'metric': 'euclidean'}. Best is trial 12 with value: 0.8695652173913043.
[32m[I 2023-04-26 00:21:39,629][39m Trial 387 finished with value: 0.8695652173913043 and parameters: {'algorithm': 'kd_tree', 'n_neighbors': 24, 'weights': 'distance', 'metric': 'manhattan'}. Best is trial 12 with value: 0.8695652173913043.
[32m[I 2023-04-26 00:21:39,647][39m Trial 388 finished with value: 0.8596491228070176 and parameters: {'algorithm': 'ball_tree', 'n_neighbors': 14, 'weights': 'distance', 'metric': 'manhattan'}. Best is trial 12 with value: 0.8695652173913043.
[32m[I 2023-04-26 00:21:39,677][39m Trial 389 finished with value: 0.8695652173913043 and parameters: {'algorithm': 'auto', 'n_neighbors': 26, 'weights': 'distance', 'metric': 'manhattan'}. Best is trial 12 with value: 0.8695652173913043.
[32m[I 2023-04-26 00:21:39,700][39m Trial 390 finished with value: 0.8695652173913043 and parameters: {'algorithm': 'ball_tree', 'n_neighbors': 24, 'weights': 'distance', 'metric': 'manhattan'}. Best is trial 12 with value: 0.8695652173913043.
[32m[I 2023-04-26 00:21:39,742][39m Trial 391 finished with value: 0.8571428571428572 and parameters: {'algorithm': 'auto', 'n_neighbors': 24, 'weights': 'distance', 'metric': 'minkowski'}. Best is trial 12 with value: 0.8695652173913043.
[32m[I 2023-04-26 00:21:39,782][39m Trial 392 finished with value: 0.8695652173913043 and parameters: {'algorithm': 'brute', 'n_neighbors': 23, 'weights': 'distance', 'metric': 'manhattan'}. Best is trial 12 with value: 0.8695652173913043.
[32m[I 2023-04-26 00:21:39,807][39m Trial 393 finished with value: 0.8695652173913043 and parameters: {'algorithm': 'ball_tree', 'n_neighbors': 24, 'weights': 'distance', 'metric': 'manhattan'}. Best is trial 12 with value: 0.8695652173913043.
[32m[I 2023-04-26 00:21:39,830][39m Trial 394 finished with value: 0.8695652173913043 and parameters: {'algorithm': 'ball_tree', 'n_neighbors': 24, 'weights': 'distance', 'metric': 'manhattan'}. Best is trial 12 with value: 0.8695652173913043.
[32m[I 2023-04-26 00:21:39,875][39m Trial 395 finished with value: 0.8695652173913043 and parameters: {'algorithm': 'brute', 'n_neighbors': 25, 'weights': 'distance', 'metric': 'manhattan'}. Best is trial 12 with value: 0.8695652173913043.
[32m[I 2023-04-26 00:21:39,901][39m Trial 396 finished with value: 0.8571428571428572 and parameters: {'algorithm': 'ball_tree', 'n_neighbors': 30, 'weights': 'distance', 'metric': 'euclidean'}. Best is trial 12 with value: 0.8695652173913043.
[32m[I 2023-04-26 00:21:39,926][39m Trial 397 finished with value: 0.8363636363636363 and parameters: {'algorithm': 'kd_tree', 'n_neighbors': 22, 'weights': 'distance', 'metric': 'euclidean'}. Best is trial 12 with value: 0.8695652173913043.
[32m[I 2023-04-26 00:21:39,952][39m Trial 398 finished with value: 0.8695652173913043 and parameters: {'algorithm': 'kd_tree', 'n_neighbors': 24, 'weights': 'distance', 'metric': 'manhattan'}. Best is trial 12 with value: 0.8695652173913043.
[32m[I 2023-04-26 00:21:39,990][39m Trial 399 finished with value: 0.8363636363636363 and parameters: {'algorithm': 'brute', 'n_neighbors': 22, 'weights': 'distance', 'metric': 'euclidean'}. Best is trial 12 with value: 0.8695652173913043.
[32m[I 2023-04-26 00:21:40,021][39m Trial 400 finished with value: 0.8695652173913043 and parameters: {'algorithm': 'kd_tree', 'n_neighbors': 24, 'weights': 'distance', 'metric': 'manhattan'}. Best is trial 12 with value: 0.8695652173913043.
[32m[I 2023-04-26 00:21:40,046][39m Trial 401 finished with value: 0.8695652173913043 and parameters: {'algorithm': 'ball_tree', 'n_neighbors': 26, 'weights': 'distance', 'metric': 'manhattan'}. Best is trial 12 with value: 0.8695652173913043.
[32m[I 2023-04-26 00:21:40,066][39m Trial 402 finished with value: 0.8695652173913043 and parameters: {'algorithm': 'ball_tree', 'n_neighbors': 26, 'weights': 'distance', 'metric': 'manhattan'}. Best is trial 12 with value: 0.8695652173913043.
[32m[I 2023-04-26 00:21:40,095][39m Trial 403 finished with value: 0.7964601769911505 and parameters: {'algorithm': 'ball_tree', 'n_neighbors': 25, 'weights': 'uniform', 'metric': 'manhattan'}. Best is trial 12 with value: 0.8695652173913043.
[32m[I 2023-04-26 00:21:40,108][39m Trial 404 finished with value: 0.8695652173913043 and parameters: {'algorithm': 'ball_tree', 'n_neighbors': 25, 'weights': 'distance', 'metric': 'manhattan'}. Best is trial 12 with value: 0.8695652173913043.
[32m[I 2023-04-26 00:21:40,122][39m Trial 405 finished with value: 0.8695652173913043 and parameters: {'algorithm': 'ball_tree', 'n_neighbors': 26, 'weights': 'distance', 'metric': 'manhattan'}. Best is trial 12 with value: 0.8695652173913043.
[32m[I 2023-04-26 00:21:40,129][39m Trial 406 finished with value: 0.8695652173913043 and parameters: {'algorithm': 'ball_tree', 'n_neighbors': 26, 'weights': 'distance', 'metric': 'manhattan'}. Best is trial 12 with value: 0.8695652173913043.
[32m[I 2023-04-26 00:21:40,148][39m Trial 407 finished with value: 0.8695652173913043 and parameters: {'algorithm': 'ball_tree', 'n_neighbors': 25, 'weights': 'distance', 'metric': 'manhattan'}. Best is trial 12 with value: 0.8695652173913043.
[32m[I 2023-04-26 00:21:40,181][39m Trial 408 finished with value: 0.8695652173913043 and parameters: {'algorithm': 'brute', 'n_neighbors': 25, 'weights': 'distance', 'metric': 'manhattan'}. Best is trial 12 with value: 0.8695652173913043.
[32m[I 2023-04-26 00:21:40,205][39m Trial 409 finished with value: 0.8695652173913043 and parameters: {'algorithm': 'ball_tree', 'n_neighbors': 25, 'weights': 'distance', 'metric': 'manhattan'}. Best is trial 12 with value: 0.8695652173913043.
[32m[I 2023-04-26 00:21:40,249][39m Trial 410 finished with value: 0.8596491228070176 and parameters: {'algorithm': 'brute', 'n_neighbors': 18, 'weights': 'distance', 'metric': 'manhattan'}. Best is trial 12 with value: 0.8695652173913043.
[32m[I 2023-04-26 00:21:40,275][39m Trial 411 finished with value: 0.8695652173913043 and parameters: {'algorithm': 'ball_tree', 'n_neighbors': 24, 'weights': 'distance', 'metric': 'manhattan'}. Best is trial 12 with value: 0.8695652173913043.
[32m[I 2023-04-26 00:21:40,303][39m Trial 412 finished with value: 0.8695652173913043 and parameters: {'algorithm': 'ball_tree', 'n_neighbors': 24, 'weights': 'distance', 'metric': 'manhattan'}. Best is trial 12 with value: 0.8695652173913043.
[32m[I 2023-04-26 00:21:40,330][39m Trial 413 finished with value: 0.8695652173913043 and parameters: {'algorithm': 'ball_tree', 'n_neighbors': 26, 'weights': 'distance', 'metric': 'manhattan'}. Best is trial 12 with value: 0.8695652173913043.
[32m[I 2023-04-26 00:21:40,356][39m Trial 414 finished with value: 0.8695652173913043 and parameters: {'algorithm': 'ball_tree', 'n_neighbors': 26, 'weights': 'distance', 'metric': 'manhattan'}. Best is trial 12 with value: 0.8695652173913043.
[32m[I 2023-04-26 00:21:40,386][39m Trial 415 finished with value: 0.8695652173913043 and parameters: {'algorithm': 'auto', 'n_neighbors': 27, 'weights': 'distance', 'metric': 'manhattan'}. Best is trial 12 with value: 0.8695652173913043.
[32m[I 2023-04-26 00:21:40,427][39m Trial 416 finished with value: 0.8695652173913043 and parameters: {'algorithm': 'auto', 'n_neighbors': 27, 'weights': 'distance', 'metric': 'manhattan'}. Best is trial 12 with value: 0.8695652173913043.
[32m[I 2023-04-26 00:21:40,470][39m Trial 417 finished with value: 0.8695652173913043 and parameters: {'algorithm': 'auto', 'n_neighbors': 27, 'weights': 'distance', 'metric': 'manhattan'}. Best is trial 12 with value: 0.8695652173913043.
[32m[I 2023-04-26 00:21:40,511][39m Trial 418 finished with value: 0.8695652173913043 and parameters: {'algorithm': 'auto', 'n_neighbors': 27, 'weights': 'distance', 'metric': 'manhattan'}. Best is trial 12 with value: 0.8695652173913043.
[32m[I 2023-04-26 00:21:40,554][39m Trial 419 finished with value: 0.8392857142857144 and parameters: {'algorithm': 'brute', 'n_neighbors': 28, 'weights': 'distance', 'metric': 'manhattan'}. Best is trial 12 with value: 0.8695652173913043.
[32m[I 2023-04-26 00:21:40,596][39m Trial 420 finished with value: 0.8695652173913043 and parameters: {'algorithm': 'auto', 'n_neighbors': 23, 'weights': 'distance', 'metric': 'manhattan'}. Best is trial 12 with value: 0.8695652173913043.
[32m[I 2023-04-26 00:21:40,639][39m Trial 421 finished with value: 0.8495575221238938 and parameters: {'algorithm': 'auto', 'n_neighbors': 28, 'weights': 'distance', 'metric': 'minkowski'}. Best is trial 12 with value: 0.8695652173913043.
[32m[I 2023-04-26 00:21:40,682][39m Trial 422 finished with value: 0.8695652173913043 and parameters: {'algorithm': 'brute', 'n_neighbors': 27, 'weights': 'distance', 'metric': 'manhattan'}. Best is trial 12 with value: 0.8695652173913043.
[32m[I 2023-04-26 00:21:40,724][39m Trial 423 finished with value: 0.8695652173913043 and parameters: {'algorithm': 'auto', 'n_neighbors': 22, 'weights': 'distance', 'metric': 'manhattan'}. Best is trial 12 with value: 0.8695652173913043.
[32m[I 2023-04-26 00:21:40,753][39m Trial 424 finished with value: 0.8392857142857144 and parameters: {'algorithm': 'ball_tree', 'n_neighbors': 15, 'weights': 'uniform', 'metric': 'manhattan'}. Best is trial 12 with value: 0.8695652173913043.
[32m[I 2023-04-26 00:21:40,780][39m Trial 425 finished with value: 0.8695652173913043 and parameters: {'algorithm': 'ball_tree', 'n_neighbors': 24, 'weights': 'distance', 'metric': 'manhattan'}. Best is trial 12 with value: 0.8695652173913043.
[32m[I 2023-04-26 00:21:40,823][39m Trial 426 finished with value: 0.8695652173913043 and parameters: {'algorithm': 'auto', 'n_neighbors': 22, 'weights': 'distance', 'metric': 'manhattan'}. Best is trial 12 with value: 0.8695652173913043.
[32m[I 2023-04-26 00:21:40,863][39m Trial 427 finished with value: 0.8695652173913043 and parameters: {'algorithm': 'brute', 'n_neighbors': 21, 'weights': 'distance', 'metric': 'manhattan'}. Best is trial 12 with value: 0.8695652173913043.
[32m[I 2023-04-26 00:21:40,907][39m Trial 428 finished with value: 0.8695652173913043 and parameters: {'algorithm': 'brute', 'n_neighbors': 21, 'weights': 'distance', 'metric': 'manhattan'}. Best is trial 12 with value: 0.8695652173913043.
[32m[I 2023-04-26 00:21:40,949][39m Trial 429 finished with value: 0.8695652173913043 and parameters: {'algorithm': 'auto', 'n_neighbors': 21, 'weights': 'distance', 'metric': 'manhattan'}. Best is trial 12 with value: 0.8695652173913043.
[32m[I 2023-04-26 00:21:40,969][39m Trial 430 finished with value: 0.8695652173913043 and parameters: {'algorithm': 'ball_tree', 'n_neighbors': 22, 'weights': 'distance', 'metric': 'manhattan'}. Best is trial 12 with value: 0.8695652173913043.
[32m[I 2023-04-26 00:21:41,011][39m Trial 431 finished with value: 0.8695652173913043 and parameters: {'algorithm': 'auto', 'n_neighbors': 22, 'weights': 'distance', 'metric': 'manhattan'}. Best is trial 12 with value: 0.8695652173913043.
[32m[I 2023-04-26 00:21:41,059][39m Trial 432 finished with value: 0.8695652173913043 and parameters: {'algorithm': 'auto', 'n_neighbors': 22, 'weights': 'distance', 'metric': 'manhattan'}. Best is trial 12 with value: 0.8695652173913043.
[32m[I 2023-04-26 00:21:41,102][39m Trial 433 finished with value: 0.8695652173913043 and parameters: {'algorithm': 'brute', 'n_neighbors': 29, 'weights': 'distance', 'metric': 'euclidean'}. Best is trial 12 with value: 0.8695652173913043.
[32m[I 2023-04-26 00:21:41,145][39m Trial 434 finished with value: 0.8672566371681416 and parameters: {'algorithm': 'brute', 'n_neighbors': 13, 'weights': 'distance', 'metric': 'euclidean'}. Best is trial 12 with value: 0.8695652173913043.
[32m[I 2023-04-26 00:21:41,171][39m Trial 435 finished with value: 0.8695652173913043 and parameters: {'algorithm': 'kd_tree', 'n_neighbors': 29, 'weights': 'distance', 'metric': 'euclidean'}. Best is trial 12 with value: 0.8695652173913043.
[32m[I 2023-04-26 00:21:41,200][39m Trial 436 finished with value: 0.8695652173913043 and parameters: {'algorithm': 'kd_tree', 'n_neighbors': 24, 'weights': 'distance', 'metric': 'manhattan'}. Best is trial 12 with value: 0.8695652173913043.
[32m[I 2023-04-26 00:21:41,226][39m Trial 437 finished with value: 0.8571428571428572 and parameters: {'algorithm': 'kd_tree', 'n_neighbors': 30, 'weights': 'distance', 'metric': 'euclidean'}. Best is trial 12 with value: 0.8695652173913043.
[32m[I 2023-04-26 00:21:41,266][39m Trial 438 finished with value: 0.8695652173913043 and parameters: {'algorithm': 'brute', 'n_neighbors': 27, 'weights': 'distance', 'metric': 'manhattan'}. Best is trial 12 with value: 0.8695652173913043.
[32m[I 2023-04-26 00:21:41,308][39m Trial 439 finished with value: 0.8672566371681416 and parameters: {'algorithm': 'brute', 'n_neighbors': 21, 'weights': 'distance', 'metric': 'euclidean'}. Best is trial 12 with value: 0.8695652173913043.
[32m[I 2023-04-26 00:21:41,350][39m Trial 440 finished with value: 0.8363636363636363 and parameters: {'algorithm': 'brute', 'n_neighbors': 22, 'weights': 'distance', 'metric': 'euclidean'}. Best is trial 12 with value: 0.8695652173913043.
[32m[I 2023-04-26 00:21:41,394][39m Trial 441 finished with value: 0.8695652173913043 and parameters: {'algorithm': 'auto', 'n_neighbors': 26, 'weights': 'distance', 'metric': 'manhattan'}. Best is trial 12 with value: 0.8695652173913043.
[32m[I 2023-04-26 00:21:41,420][39m Trial 442 finished with value: 0.8695652173913043 and parameters: {'algorithm': 'ball_tree', 'n_neighbors': 23, 'weights': 'distance', 'metric': 'manhattan'}. Best is trial 12 with value: 0.8695652173913043.
[32m[I 2023-04-26 00:21:41,448][39m Trial 443 finished with value: 0.7777777777777777 and parameters: {'algorithm': 'ball_tree', 'n_neighbors': 4, 'weights': 'uniform', 'metric': 'manhattan'}. Best is trial 12 with value: 0.8695652173913043.
[32m[I 2023-04-26 00:21:41,495][39m Trial 444 finished with value: 0.8392857142857144 and parameters: {'algorithm': 'auto', 'n_neighbors': 28, 'weights': 'distance', 'metric': 'manhattan'}. Best is trial 12 with value: 0.8695652173913043.
[32m[I 2023-04-26 00:21:41,537][39m Trial 445 finished with value: 0.8695652173913043 and parameters: {'algorithm': 'brute', 'n_neighbors': 25, 'weights': 'distance', 'metric': 'manhattan'}. Best is trial 12 with value: 0.8695652173913043.
[32m[I 2023-04-26 00:21:41,564][39m Trial 446 finished with value: 0.8695652173913043 and parameters: {'algorithm': 'ball_tree', 'n_neighbors': 23, 'weights': 'distance', 'metric': 'manhattan'}. Best is trial 12 with value: 0.8695652173913043.
[32m[I 2023-04-26 00:21:41,587][39m Trial 447 finished with value: 0.8695652173913043 and parameters: {'algorithm': 'ball_tree', 'n_neighbors': 23, 'weights': 'distance', 'metric': 'manhattan'}. Best is trial 12 with value: 0.8695652173913043.
[32m[I 2023-04-26 00:21:41,619][39m Trial 448 finished with value: 0.8495575221238938 and parameters: {'algorithm': 'ball_tree', 'n_neighbors': 23, 'weights': 'distance', 'metric': 'minkowski'}. Best is trial 12 with value: 0.8695652173913043.
[32m[I 2023-04-26 00:21:41,643][39m Trial 449 finished with value: 0.8695652173913043 and parameters: {'algorithm': 'kd_tree', 'n_neighbors': 24, 'weights': 'distance', 'metric': 'manhattan'}. Best is trial 12 with value: 0.8695652173913043.
