[32m[I 2023-04-26 00:21:35,846][39m Trial 270 finished with value: 0.8695652173913043 and parameters: {'algorithm': 'brute', 'n_neighbors': 22, 'weights': 'distance', 'metric': 'manhattan'}. Best is trial 12 with value: 0.8695652173913043.
[32m[I 2023-04-26 00:21:35,883][39m Trial 271 finished with value: 0.8495575221238938 and parameters: {'algorithm': 'auto', 'n_neighbors': 28, 'weights': 'distance', 'metric': 'euclidean'}. Best is trial 12 with value: 0.8695652173913043.
[32m[I 2023-04-26 00:21:35,920][39m Trial 272 finished with value: 0.8695652173913043 and parameters: {'algorithm': 'brute', 'n_neighbors': 22, 'weights': 'distance', 'metric': 'manhattan'}. Best is trial 12 with value: 0.8695652173913043.
[32m[I 2023-04-26 00:21:35,941][39m Trial 273 finished with value: 0.8695652173913043 and parameters: {'algorithm': 'ball_tree', 'n_neighbors': 29, 'weights': 'distance', 'metric': 'euclidean'}. Best is trial 12 with value: 0.8695652173913043.
[32m[I 2023-04-26 00:21:35,963][39m Trial 274 finished with value: 0.8495575221238938 and parameters: {'algorithm': 'ball_tree', 'n_neighbors': 26, 'weights': 'distance', 'metric': 'euclidean'}. Best is trial 12 with value: 0.8695652173913043.
[32m[I 2023-04-26 00:21:35,986][39m Trial 275 finished with value: 0.8695652173913043 and parameters: {'algorithm': 'ball_tree', 'n_neighbors': 25, 'weights': 'distance', 'metric': 'manhattan'}. Best is trial 12 with value: 0.8695652173913043.
[32m[I 2023-04-26 00:21:36,008][39m Trial 276 finished with value: 0.8695652173913043 and parameters: {'algorithm': 'ball_tree', 'n_neighbors': 26, 'weights': 'distance', 'metric': 'manhattan'}. Best is trial 12 with value: 0.8695652173913043.
[32m[I 2023-04-26 00:21:36,046][39m Trial 277 finished with value: 0.8695652173913043 and parameters: {'algorithm': 'brute', 'n_neighbors': 24, 'weights': 'distance', 'metric': 'manhattan'}. Best is trial 12 with value: 0.8695652173913043.
[32m[I 2023-04-26 00:21:36,083][39m Trial 278 finished with value: 0.8695652173913043 and parameters: {'algorithm': 'brute', 'n_neighbors': 24, 'weights': 'distance', 'metric': 'manhattan'}. Best is trial 12 with value: 0.8695652173913043.
[32m[I 2023-04-26 00:21:36,106][39m Trial 279 finished with value: 0.8468468468468469 and parameters: {'algorithm': 'ball_tree', 'n_neighbors': 30, 'weights': 'distance', 'metric': 'manhattan'}. Best is trial 12 with value: 0.8695652173913043.
[32m[I 2023-04-26 00:21:36,144][39m Trial 280 finished with value: 0.8695652173913043 and parameters: {'algorithm': 'brute', 'n_neighbors': 25, 'weights': 'distance', 'metric': 'manhattan'}. Best is trial 12 with value: 0.8695652173913043.
[32m[I 2023-04-26 00:21:36,183][39m Trial 281 finished with value: 0.8695652173913043 and parameters: {'algorithm': 'brute', 'n_neighbors': 23, 'weights': 'distance', 'metric': 'manhattan'}. Best is trial 12 with value: 0.8695652173913043.
[32m[I 2023-04-26 00:21:36,222][39m Trial 282 finished with value: 0.8695652173913043 and parameters: {'algorithm': 'brute', 'n_neighbors': 23, 'weights': 'distance', 'metric': 'manhattan'}. Best is trial 12 with value: 0.8695652173913043.
[32m[I 2023-04-26 00:21:36,259][39m Trial 283 finished with value: 0.8695652173913043 and parameters: {'algorithm': 'brute', 'n_neighbors': 24, 'weights': 'distance', 'metric': 'manhattan'}. Best is trial 12 with value: 0.8695652173913043.
[32m[I 2023-04-26 00:21:36,300][39m Trial 284 finished with value: 0.8695652173913043 and parameters: {'algorithm': 'auto', 'n_neighbors': 24, 'weights': 'distance', 'metric': 'manhattan'}. Best is trial 12 with value: 0.8695652173913043.
[32m[I 2023-04-26 00:21:36,327][39m Trial 285 finished with value: 0.8495575221238938 and parameters: {'algorithm': 'ball_tree', 'n_neighbors': 25, 'weights': 'distance', 'metric': 'euclidean'}. Best is trial 12 with value: 0.8695652173913043.
[32m[I 2023-04-26 00:21:36,367][39m Trial 286 finished with value: 0.8073394495412843 and parameters: {'algorithm': 'auto', 'n_neighbors': 24, 'weights': 'uniform', 'metric': 'manhattan'}. Best is trial 12 with value: 0.8695652173913043.
[32m[I 2023-04-26 00:21:36,395][39m Trial 287 finished with value: 0.8695652173913043 and parameters: {'algorithm': 'auto', 'n_neighbors': 27, 'weights': 'distance', 'metric': 'manhattan'}. Best is trial 12 with value: 0.8695652173913043.
[32m[I 2023-04-26 00:21:36,433][39m Trial 288 finished with value: 0.8672566371681416 and parameters: {'algorithm': 'brute', 'n_neighbors': 21, 'weights': 'distance', 'metric': 'euclidean'}. Best is trial 12 with value: 0.8695652173913043.
[32m[I 2023-04-26 00:21:36,471][39m Trial 289 finished with value: 0.8695652173913043 and parameters: {'algorithm': 'brute', 'n_neighbors': 27, 'weights': 'distance', 'metric': 'manhattan'}. Best is trial 12 with value: 0.8695652173913043.
[32m[I 2023-04-26 00:21:36,512][39m Trial 290 finished with value: 0.8392857142857144 and parameters: {'algorithm': 'brute', 'n_neighbors': 17, 'weights': 'distance', 'metric': 'manhattan'}. Best is trial 12 with value: 0.8695652173913043.
[32m[I 2023-04-26 00:21:36,552][39m Trial 291 finished with value: 0.8695652173913043 and parameters: {'algorithm': 'auto', 'n_neighbors': 26, 'weights': 'distance', 'metric': 'manhattan'}. Best is trial 12 with value: 0.8695652173913043.
[32m[I 2023-04-26 00:21:36,592][39m Trial 292 finished with value: 0.8695652173913043 and parameters: {'algorithm': 'brute', 'n_neighbors': 27, 'weights': 'distance', 'metric': 'manhattan'}. Best is trial 12 with value: 0.8695652173913043.
[32m[I 2023-04-26 00:21:36,615][39m Trial 293 finished with value: 0.8695652173913043 and parameters: {'algorithm': 'ball_tree', 'n_neighbors': 26, 'weights': 'distance', 'metric': 'manhattan'}. Best is trial 12 with value: 0.8695652173913043.
[32m[I 2023-04-26 00:21:36,638][39m Trial 294 finished with value: 0.8695652173913043 and parameters: {'algorithm': 'ball_tree', 'n_neighbors': 26, 'weights': 'distance', 'metric': 'manhattan'}. Best is trial 12 with value: 0.8695652173913043.
[32m[I 2023-04-26 00:21:36,679][39m Trial 295 finished with value: 0.8695652173913043 and parameters: {'algorithm': 'auto', 'n_neighbors': 23, 'weights': 'distance', 'metric': 'manhattan'}. Best is trial 12 with value: 0.8695652173913043.
[32m[I 2023-04-26 00:21:36,700][39m Trial 296 finished with value: 0.8695652173913043 and parameters: {'algorithm': 'ball_tree', 'n_neighbors': 23, 'weights': 'distance', 'metric': 'manhattan'}. Best is trial 12 with value: 0.8695652173913043.
[32m[I 2023-04-26 00:21:36,723][39m Trial 297 finished with value: 0.8695652173913043 and parameters: {'algorithm': 'ball_tree', 'n_neighbors': 25, 'weights': 'distance', 'metric': 'manhattan'}. Best is trial 12 with value: 0.8695652173913043.
[32m[I 2023-04-26 00:21:36,746][39m Trial 298 finished with value: 0.8695652173913043 and parameters: {'algorithm': 'ball_tree', 'n_neighbors': 25, 'weights': 'distance', 'metric': 'manhattan'}. Best is trial 12 with value: 0.8695652173913043.
[32m[I 2023-04-26 00:21:36,769][39m Trial 299 finished with value: 0.8571428571428572 and parameters: {'algorithm': 'ball_tree', 'n_neighbors': 24, 'weights': 'distance', 'metric': 'euclidean'}. Best is trial 12 with value: 0.8695652173913043.
[32m[I 2023-04-26 00:21:36,784][39m Trial 300 finished with value: 0.8695652173913043 and parameters: {'algorithm': 'ball_tree', 'n_neighbors': 25, 'weights': 'distance', 'metric': 'manhattan'}. Best is trial 12 with value: 0.8695652173913043.
[32m[I 2023-04-26 00:21:36,816][39m Trial 301 finished with value: 0.8695652173913043 and parameters: {'algorithm': 'brute', 'n_neighbors': 29, 'weights': 'distance', 'metric': 'euclidean'}. Best is trial 12 with value: 0.8695652173913043.
[32m[I 2023-04-26 00:21:36,855][39m Trial 302 finished with value: 0.8695652173913043 and parameters: {'algorithm': 'brute', 'n_neighbors': 23, 'weights': 'distance', 'metric': 'manhattan'}. Best is trial 12 with value: 0.8695652173913043.
[32m[I 2023-04-26 00:21:36,894][39m Trial 303 finished with value: 0.8695652173913043 and parameters: {'algorithm': 'brute', 'n_neighbors': 23, 'weights': 'distance', 'metric': 'manhattan'}. Best is trial 12 with value: 0.8695652173913043.
[32m[I 2023-04-26 00:21:36,935][39m Trial 304 finished with value: 0.8392857142857144 and parameters: {'algorithm': 'brute', 'n_neighbors': 28, 'weights': 'distance', 'metric': 'manhattan'}. Best is trial 12 with value: 0.8695652173913043.
[32m[I 2023-04-26 00:21:36,958][39m Trial 305 finished with value: 0.8392857142857144 and parameters: {'algorithm': 'ball_tree', 'n_neighbors': 28, 'weights': 'distance', 'metric': 'manhattan'}. Best is trial 12 with value: 0.8695652173913043.
[32m[I 2023-04-26 00:21:36,984][39m Trial 306 finished with value: 0.7610619469026548 and parameters: {'algorithm': 'ball_tree', 'n_neighbors': 26, 'weights': 'uniform', 'metric': 'euclidean'}. Best is trial 12 with value: 0.8695652173913043.
[32m[I 2023-04-26 00:21:37,008][39m Trial 307 finished with value: 0.8596491228070176 and parameters: {'algorithm': 'ball_tree', 'n_neighbors': 20, 'weights': 'distance', 'metric': 'manhattan'}. Best is trial 12 with value: 0.8695652173913043.
[32m[I 2023-04-26 00:21:37,031][39m Trial 308 finished with value: 0.8695652173913043 and parameters: {'algorithm': 'kd_tree', 'n_neighbors': 27, 'weights': 'distance', 'metric': 'manhattan'}. Best is trial 12 with value: 0.8695652173913043.
[32m[I 2023-04-26 00:21:37,067][39m Trial 309 finished with value: 0.8695652173913043 and parameters: {'algorithm': 'brute', 'n_neighbors': 22, 'weights': 'distance', 'metric': 'manhattan'}. Best is trial 12 with value: 0.8695652173913043.
[32m[I 2023-04-26 00:21:37,104][39m Trial 310 finished with value: 0.8468468468468469 and parameters: {'algorithm': 'brute', 'n_neighbors': 30, 'weights': 'distance', 'metric': 'manhattan'}. Best is trial 12 with value: 0.8695652173913043.
[32m[I 2023-04-26 00:21:37,126][39m Trial 311 finished with value: 0.8695652173913043 and parameters: {'algorithm': 'ball_tree', 'n_neighbors': 24, 'weights': 'distance', 'metric': 'manhattan'}. Best is trial 12 with value: 0.8695652173913043.
[32m[I 2023-04-26 00:21:37,166][39m Trial 312 finished with value: 0.8468468468468469 and parameters: {'algorithm': 'brute', 'n_neighbors': 29, 'weights': 'distance', 'metric': 'manhattan'}. Best is trial 12 with value: 0.8695652173913043.
[32m[I 2023-04-26 00:21:37,204][39m Trial 313 finished with value: 0.8695652173913043 and parameters: {'algorithm': 'auto', 'n_neighbors': 21, 'weights': 'distance', 'metric': 'manhattan'}. Best is trial 12 with value: 0.8695652173913043.
[32m[I 2023-04-26 00:21:37,243][39m Trial 314 finished with value: 0.8495575221238938 and parameters: {'algorithm': 'brute', 'n_neighbors': 7, 'weights': 'distance', 'metric': 'euclidean'}. Best is trial 12 with value: 0.8695652173913043.
[32m[I 2023-04-26 00:21:37,281][39m Trial 315 finished with value: 0.8695652173913043 and parameters: {'algorithm': 'auto', 'n_neighbors': 25, 'weights': 'distance', 'metric': 'manhattan'}. Best is trial 12 with value: 0.8695652173913043.
[32m[I 2023-04-26 00:21:37,304][39m Trial 316 finished with value: 0.8392857142857144 and parameters: {'algorithm': 'kd_tree', 'n_neighbors': 28, 'weights': 'distance', 'metric': 'manhattan'}. Best is trial 12 with value: 0.8695652173913043.
[32m[I 2023-04-26 00:21:37,327][39m Trial 317 finished with value: 0.8695652173913043 and parameters: {'algorithm': 'kd_tree', 'n_neighbors': 21, 'weights': 'distance', 'metric': 'manhattan'}. Best is trial 12 with value: 0.8695652173913043.
[32m[I 2023-04-26 00:21:37,351][39m Trial 318 finished with value: 0.8695652173913043 and parameters: {'algorithm': 'kd_tree', 'n_neighbors': 27, 'weights': 'distance', 'metric': 'manhattan'}. Best is trial 12 with value: 0.8695652173913043.
[32m[I 2023-04-26 00:21:37,391][39m Trial 319 finished with value: 0.8695652173913043 and parameters: {'algorithm': 'auto', 'n_neighbors': 24, 'weights': 'distance', 'metric': 'manhattan'}. Best is trial 12 with value: 0.8695652173913043.
[32m[I 2023-04-26 00:21:37,429][39m Trial 320 finished with value: 0.8695652173913043 and parameters: {'algorithm': 'auto', 'n_neighbors': 24, 'weights': 'distance', 'metric': 'manhattan'}. Best is trial 12 with value: 0.8695652173913043.
[32m[I 2023-04-26 00:21:37,453][39m Trial 321 finished with value: 0.8495575221238938 and parameters: {'algorithm': 'ball_tree', 'n_neighbors': 26, 'weights': 'distance', 'metric': 'euclidean'}. Best is trial 12 with value: 0.8695652173913043.
[32m[I 2023-04-26 00:21:37,493][39m Trial 322 finished with value: 0.8596491228070176 and parameters: {'algorithm': 'brute', 'n_neighbors': 20, 'weights': 'distance', 'metric': 'manhattan'}. Best is trial 12 with value: 0.8695652173913043.
[32m[I 2023-04-26 00:21:37,531][39m Trial 323 finished with value: 0.8695652173913043 and parameters: {'algorithm': 'auto', 'n_neighbors': 25, 'weights': 'distance', 'metric': 'manhattan'}. Best is trial 12 with value: 0.8695652173913043.
[32m[I 2023-04-26 00:21:37,570][39m Trial 324 finished with value: 0.8695652173913043 and parameters: {'algorithm': 'brute', 'n_neighbors': 22, 'weights': 'distance', 'metric': 'manhattan'}. Best is trial 12 with value: 0.8695652173913043.
[32m[I 2023-04-26 00:21:37,594][39m Trial 325 finished with value: 0.8695652173913043 and parameters: {'algorithm': 'ball_tree', 'n_neighbors': 25, 'weights': 'distance', 'metric': 'manhattan'}. Best is trial 12 with value: 0.8695652173913043.
[32m[I 2023-04-26 00:21:37,622][39m Trial 326 finished with value: 0.7999999999999999 and parameters: {'algorithm': 'ball_tree', 'n_neighbors': 26, 'weights': 'uniform', 'metric': 'manhattan'}. Best is trial 12 with value: 0.8695652173913043.
[32m[I 2023-04-26 00:21:37,662][39m Trial 327 finished with value: 0.8495575221238938 and parameters: {'algorithm': 'brute', 'n_neighbors': 28, 'weights': 'distance', 'metric': 'euclidean'}. Best is trial 12 with value: 0.8695652173913043.
[32m[I 2023-04-26 00:21:37,702][39m Trial 328 finished with value: 0.8596491228070176 and parameters: {'algorithm': 'auto', 'n_neighbors': 19, 'weights': 'distance', 'metric': 'manhattan'}. Best is trial 12 with value: 0.8695652173913043.
[32m[I 2023-04-26 00:21:37,742][39m Trial 329 finished with value: 0.8695652173913043 and parameters: {'algorithm': 'brute', 'n_neighbors': 22, 'weights': 'distance', 'metric': 'manhattan'}. Best is trial 12 with value: 0.8695652173913043.
[32m[I 2023-04-26 00:21:37,784][39m Trial 330 finished with value: 0.8695652173913043 and parameters: {'algorithm': 'auto', 'n_neighbors': 21, 'weights': 'distance', 'metric': 'manhattan'}. Best is trial 12 with value: 0.8695652173913043.
[32m[I 2023-04-26 00:21:37,821][39m Trial 331 finished with value: 0.8468468468468469 and parameters: {'algorithm': 'auto', 'n_neighbors': 29, 'weights': 'distance', 'metric': 'manhattan'}. Best is trial 12 with value: 0.8695652173913043.
[32m[I 2023-04-26 00:21:37,845][39m Trial 332 finished with value: 0.8695652173913043 and parameters: {'algorithm': 'ball_tree', 'n_neighbors': 23, 'weights': 'distance', 'metric': 'manhattan'}. Best is trial 12 with value: 0.8695652173913043.
[32m[I 2023-04-26 00:21:37,884][39m Trial 333 finished with value: 0.8695652173913043 and parameters: {'algorithm': 'brute', 'n_neighbors': 24, 'weights': 'distance', 'metric': 'manhattan'}. Best is trial 12 with value: 0.8695652173913043.
[32m[I 2023-04-26 00:21:37,923][39m Trial 334 finished with value: 0.8571428571428572 and parameters: {'algorithm': 'brute', 'n_neighbors': 24, 'weights': 'distance', 'metric': 'euclidean'}. Best is trial 12 with value: 0.8695652173913043.
[32m[I 2023-04-26 00:21:37,963][39m Trial 335 finished with value: 0.8695652173913043 and parameters: {'algorithm': 'auto', 'n_neighbors': 26, 'weights': 'distance', 'metric': 'manhattan'}. Best is trial 12 with value: 0.8695652173913043.
[32m[I 2023-04-26 00:21:38,003][39m Trial 336 finished with value: 0.8695652173913043 and parameters: {'algorithm': 'auto', 'n_neighbors': 24, 'weights': 'distance', 'metric': 'manhattan'}. Best is trial 12 with value: 0.8695652173913043.
[32m[I 2023-04-26 00:21:38,042][39m Trial 337 finished with value: 0.8695652173913043 and parameters: {'algorithm': 'brute', 'n_neighbors': 24, 'weights': 'distance', 'metric': 'manhattan'}. Best is trial 12 with value: 0.8695652173913043.
[32m[I 2023-04-26 00:21:38,082][39m Trial 338 finished with value: 0.8695652173913043 and parameters: {'algorithm': 'auto', 'n_neighbors': 24, 'weights': 'distance', 'metric': 'manhattan'}. Best is trial 12 with value: 0.8695652173913043.
[32m[I 2023-04-26 00:21:38,123][39m Trial 339 finished with value: 0.8695652173913043 and parameters: {'algorithm': 'brute', 'n_neighbors': 23, 'weights': 'distance', 'metric': 'manhattan'}. Best is trial 12 with value: 0.8695652173913043.
[32m[I 2023-04-26 00:21:38,162][39m Trial 340 finished with value: 0.8695652173913043 and parameters: {'algorithm': 'brute', 'n_neighbors': 23, 'weights': 'distance', 'metric': 'manhattan'}. Best is trial 12 with value: 0.8695652173913043.
[32m[I 2023-04-26 00:21:38,200][39m Trial 341 finished with value: 0.8495575221238938 and parameters: {'algorithm': 'brute', 'n_neighbors': 23, 'weights': 'distance', 'metric': 'euclidean'}. Best is trial 12 with value: 0.8695652173913043.
[32m[I 2023-04-26 00:21:38,223][39m Trial 342 finished with value: 0.8695652173913043 and parameters: {'algorithm': 'kd_tree', 'n_neighbors': 22, 'weights': 'distance', 'metric': 'manhattan'}. Best is trial 12 with value: 0.8695652173913043.
[32m[I 2023-04-26 00:21:38,264][39m Trial 343 finished with value: 0.8695652173913043 and parameters: {'algorithm': 'brute', 'n_neighbors': 23, 'weights': 'distance', 'metric': 'manhattan'}. Best is trial 12 with value: 0.8695652173913043.
[32m[I 2023-04-26 00:21:38,304][39m Trial 344 finished with value: 0.8695652173913043 and parameters: {'algorithm': 'auto', 'n_neighbors': 23, 'weights': 'distance', 'metric': 'manhattan'}. Best is trial 12 with value: 0.8695652173913043.
[32m[I 2023-04-26 00:21:38,340][39m Trial 345 finished with value: 0.8214285714285715 and parameters: {'algorithm': 'auto', 'n_neighbors': 23, 'weights': 'uniform', 'metric': 'manhattan'}. Best is trial 12 with value: 0.8695652173913043.
[32m[I 2023-04-26 00:21:38,354][39m Trial 346 finished with value: 0.8695652173913043 and parameters: {'algorithm': 'ball_tree', 'n_neighbors': 25, 'weights': 'distance', 'metric': 'manhattan'}. Best is trial 12 with value: 0.8695652173913043.
[32m[I 2023-04-26 00:21:38,367][39m Trial 347 finished with value: 0.8695652173913043 and parameters: {'algorithm': 'ball_tree', 'n_neighbors': 26, 'weights': 'distance', 'metric': 'manhattan'}. Best is trial 12 with value: 0.8695652173913043.
[32m[I 2023-04-26 00:21:38,395][39m Trial 348 finished with value: 0.8695652173913043 and parameters: {'algorithm': 'brute', 'n_neighbors': 27, 'weights': 'distance', 'metric': 'manhattan'}. Best is trial 12 with value: 0.8695652173913043.
[32m[I 2023-04-26 00:21:38,419][39m Trial 349 finished with value: 0.8695652173913043 and parameters: {'algorithm': 'ball_tree', 'n_neighbors': 26, 'weights': 'distance', 'metric': 'manhattan'}. Best is trial 12 with value: 0.8695652173913043.
[32m[I 2023-04-26 00:21:38,448][39m Trial 350 finished with value: 0.8695652173913043 and parameters: {'algorithm': 'ball_tree', 'n_neighbors': 26, 'weights': 'distance', 'metric': 'manhattan'}. Best is trial 12 with value: 0.8695652173913043.
[32m[I 2023-04-26 00:21:38,474][39m Trial 351 finished with value: 0.8695652173913043 and parameters: {'algorithm': 'ball_tree', 'n_neighbors': 27, 'weights': 'distance', 'metric': 'manhattan'}. Best is trial 12 with value: 0.8695652173913043.
[32m[I 2023-04-26 00:21:38,497][39m Trial 352 finished with value: 0.8695652173913043 and parameters: {'algorithm': 'ball_tree', 'n_neighbors': 27, 'weights': 'distance', 'metric': 'manhattan'}. Best is trial 12 with value: 0.8695652173913043.
[32m[I 2023-04-26 00:21:38,528][39m Trial 353 finished with value: 0.8695652173913043 and parameters: {'algorithm': 'brute', 'n_neighbors': 27, 'weights': 'distance', 'metric': 'manhattan'}. Best is trial 12 with value: 0.8695652173913043.
[32m[I 2023-04-26 00:21:38,567][39m Trial 354 finished with value: 0.8695652173913043 and parameters: {'algorithm': 'brute', 'n_neighbors': 27, 'weights': 'distance', 'metric': 'manhattan'}. Best is trial 12 with value: 0.8695652173913043.
[32m[I 2023-04-26 00:21:38,609][39m Trial 355 finished with value: 0.8695652173913043 and parameters: {'algorithm': 'brute', 'n_neighbors': 27, 'weights': 'distance', 'metric': 'manhattan'}. Best is trial 12 with value: 0.8695652173913043.
[32m[I 2023-04-26 00:21:38,648][39m Trial 356 finished with value: 0.8695652173913043 and parameters: {'algorithm': 'brute', 'n_neighbors': 26, 'weights': 'distance', 'metric': 'manhattan'}. Best is trial 12 with value: 0.8695652173913043.
[32m[I 2023-04-26 00:21:38,688][39m Trial 357 finished with value: 0.8596491228070176 and parameters: {'algorithm': 'brute', 'n_neighbors': 10, 'weights': 'distance', 'metric': 'manhattan'}. Best is trial 12 with value: 0.8695652173913043.
[32m[I 2023-04-26 00:21:38,730][39m Trial 358 finished with value: 0.8695652173913043 and parameters: {'algorithm': 'auto', 'n_neighbors': 26, 'weights': 'distance', 'metric': 'manhattan'}. Best is trial 12 with value: 0.8695652173913043.
[32m[I 2023-04-26 00:21:38,771][39m Trial 359 finished with value: 0.8695652173913043 and parameters: {'algorithm': 'brute', 'n_neighbors': 25, 'weights': 'distance', 'metric': 'manhattan'}. Best is trial 12 with value: 0.8695652173913043.
