[32m[I 2023-04-26 00:21:28,919][39m A new study created in memory with name: no-name-528cea12-e339-4366-9409-ad85d5e2d004
[32m[I 2023-04-26 00:21:28,927][39m Trial 0 finished with value: 0.8333333333333334 and parameters: {'algorithm': 'ball_tree', 'n_neighbors': 14, 'weights': 'uniform', 'metric': 'manhattan'}. Best is trial 0 with value: 0.8333333333333334.
[32m[I 2023-04-26 00:21:28,935][39m Trial 1 finished with value: 0.8148148148148148 and parameters: {'algorithm': 'kd_tree', 'n_neighbors': 22, 'weights': 'uniform', 'metric': 'manhattan'}. Best is trial 0 with value: 0.8333333333333334.
[32m[I 2023-04-26 00:21:28,961][39m Trial 2 finished with value: 0.8421052631578947 and parameters: {'algorithm': 'auto', 'n_neighbors': 4, 'weights': 'distance', 'metric': 'euclidean'}. Best is trial 2 with value: 0.8421052631578947.
[32m[I 2023-04-26 00:21:28,973][39m Trial 3 finished with value: 0.8275862068965517 and parameters: {'algorithm': 'ball_tree', 'n_neighbors': 3, 'weights': 'uniform', 'metric': 'euclidean'}. Best is trial 2 with value: 0.8421052631578947.
[32m[I 2023-04-26 00:21:29,000][39m Trial 4 finished with value: 0.8596491228070176 and parameters: {'algorithm': 'auto', 'n_neighbors': 19, 'weights': 'distance', 'metric': 'manhattan'}. Best is trial 4 with value: 0.8596491228070176.
[32m[I 2023-04-26 00:21:29,021][39m Trial 5 finished with value: 0.8073394495412843 and parameters: {'algorithm': 'brute', 'n_neighbors': 4, 'weights': 'uniform', 'metric': 'minkowski'}. Best is trial 4 with value: 0.8596491228070176.
[32m[I 2023-04-26 00:21:29,026][39m Trial 6 finished with value: 0.8495575221238938 and parameters: {'algorithm': 'ball_tree', 'n_neighbors': 23, 'weights': 'distance', 'metric': 'minkowski'}. Best is trial 4 with value: 0.8596491228070176.
[32m[I 2023-04-26 00:21:29,058][39m Trial 7 finished with value: 0.8596491228070176 and parameters: {'algorithm': 'auto', 'n_neighbors': 19, 'weights': 'distance', 'metric': 'euclidean'}. Best is trial 4 with value: 0.8596491228070176.
[32m[I 2023-04-26 00:21:29,071][39m Trial 8 finished with value: 0.7863247863247863 and parameters: {'algorithm': 'kd_tree', 'n_neighbors': 30, 'weights': 'uniform', 'metric': 'euclidean'}. Best is trial 4 with value: 0.8596491228070176.
[32m[I 2023-04-26 00:21:29,097][39m Trial 9 finished with value: 0.8392857142857144 and parameters: {'algorithm': 'brute', 'n_neighbors': 6, 'weights': 'distance', 'metric': 'minkowski'}. Best is trial 4 with value: 0.8596491228070176.
[32m[I 2023-04-26 00:21:29,127][39m Trial 10 finished with value: 0.8495575221238938 and parameters: {'algorithm': 'auto', 'n_neighbors': 11, 'weights': 'distance', 'metric': 'manhattan'}. Best is trial 4 with value: 0.8596491228070176.
[32m[I 2023-04-26 00:21:29,155][39m Trial 11 finished with value: 0.8672566371681416 and parameters: {'algorithm': 'auto', 'n_neighbors': 21, 'weights': 'distance', 'metric': 'euclidean'}. Best is trial 11 with value: 0.8672566371681416.
[32m[I 2023-04-26 00:21:29,184][39m Trial 12 finished with value: 0.8695652173913043 and parameters: {'algorithm': 'auto', 'n_neighbors': 26, 'weights': 'distance', 'metric': 'manhattan'}. Best is trial 12 with value: 0.8695652173913043.
[32m[I 2023-04-26 00:21:29,210][39m Trial 13 finished with value: 0.8571428571428572 and parameters: {'algorithm': 'auto', 'n_neighbors': 30, 'weights': 'distance', 'metric': 'euclidean'}. Best is trial 12 with value: 0.8695652173913043.
[32m[I 2023-04-26 00:21:29,237][39m Trial 14 finished with value: 0.8695652173913043 and parameters: {'algorithm': 'auto', 'n_neighbors': 25, 'weights': 'distance', 'metric': 'manhattan'}. Best is trial 12 with value: 0.8695652173913043.
[32m[I 2023-04-26 00:21:29,264][39m Trial 15 finished with value: 0.8695652173913043 and parameters: {'algorithm': 'auto', 'n_neighbors': 26, 'weights': 'distance', 'metric': 'manhattan'}. Best is trial 12 with value: 0.8695652173913043.
[32m[I 2023-04-26 00:21:29,290][39m Trial 16 finished with value: 0.8695652173913043 and parameters: {'algorithm': 'auto', 'n_neighbors': 26, 'weights': 'distance', 'metric': 'manhattan'}. Best is trial 12 with value: 0.8695652173913043.
[32m[I 2023-04-26 00:21:29,303][39m Trial 17 finished with value: 0.8695652173913043 and parameters: {'algorithm': 'kd_tree', 'n_neighbors': 26, 'weights': 'distance', 'metric': 'manhattan'}. Best is trial 12 with value: 0.8695652173913043.
[32m[I 2023-04-26 00:21:29,318][39m Trial 18 finished with value: 0.8392857142857144 and parameters: {'algorithm': 'kd_tree', 'n_neighbors': 16, 'weights': 'distance', 'metric': 'manhattan'}. Best is trial 12 with value: 0.8695652173913043.
[32m[I 2023-04-26 00:21:29,344][39m Trial 19 finished with value: 0.8596491228070176 and parameters: {'algorithm': 'brute', 'n_neighbors': 10, 'weights': 'distance', 'metric': 'manhattan'}. Best is trial 12 with value: 0.8695652173913043.
[32m[I 2023-04-26 00:21:29,357][39m Trial 20 finished with value: 0.8392857142857144 and parameters: {'algorithm': 'kd_tree', 'n_neighbors': 28, 'weights': 'distance', 'metric': 'manhattan'}. Best is trial 12 with value: 0.8695652173913043.
[32m[I 2023-04-26 00:21:29,372][39m Trial 21 finished with value: 0.8695652173913043 and parameters: {'algorithm': 'kd_tree', 'n_neighbors': 26, 'weights': 'distance', 'metric': 'manhattan'}. Best is trial 12 with value: 0.8695652173913043.
[32m[I 2023-04-26 00:21:29,385][39m Trial 22 finished with value: 0.8695652173913043 and parameters: {'algorithm': 'kd_tree', 'n_neighbors': 24, 'weights': 'distance', 'metric': 'manhattan'}. Best is trial 12 with value: 0.8695652173913043.
[32m[I 2023-04-26 00:21:29,399][39m Trial 23 finished with value: 0.8695652173913043 and parameters: {'algorithm': 'kd_tree', 'n_neighbors': 24, 'weights': 'distance', 'metric': 'manhattan'}. Best is trial 12 with value: 0.8695652173913043.
[32m[I 2023-04-26 00:21:29,413][39m Trial 24 finished with value: 0.8596491228070176 and parameters: {'algorithm': 'kd_tree', 'n_neighbors': 19, 'weights': 'distance', 'metric': 'manhattan'}. Best is trial 12 with value: 0.8695652173913043.
[32m[I 2023-04-26 00:21:29,427][39m Trial 25 finished with value: 0.8495575221238938 and parameters: {'algorithm': 'kd_tree', 'n_neighbors': 28, 'weights': 'distance', 'metric': 'minkowski'}. Best is trial 12 with value: 0.8695652173913043.
[32m[I 2023-04-26 00:21:29,445][39m Trial 26 finished with value: 0.8214285714285715 and parameters: {'algorithm': 'kd_tree', 'n_neighbors': 23, 'weights': 'uniform', 'metric': 'manhattan'}. Best is trial 12 with value: 0.8695652173913043.
[32m[I 2023-04-26 00:21:29,454][39m Trial 27 finished with value: 0.8392857142857144 and parameters: {'algorithm': 'kd_tree', 'n_neighbors': 16, 'weights': 'distance', 'metric': 'manhattan'}. Best is trial 12 with value: 0.8695652173913043.
[32m[I 2023-04-26 00:21:29,478][39m Trial 28 finished with value: 0.8695652173913043 and parameters: {'algorithm': 'auto', 'n_neighbors': 27, 'weights': 'distance', 'metric': 'manhattan'}. Best is trial 12 with value: 0.8695652173913043.
[32m[I 2023-04-26 00:21:29,495][39m Trial 29 finished with value: 0.8073394495412843 and parameters: {'algorithm': 'ball_tree', 'n_neighbors': 24, 'weights': 'uniform', 'metric': 'manhattan'}. Best is trial 12 with value: 0.8695652173913043.
[32m[I 2023-04-26 00:21:29,523][39m Trial 30 finished with value: 0.8672566371681416 and parameters: {'algorithm': 'auto', 'n_neighbors': 20, 'weights': 'distance', 'metric': 'minkowski'}. Best is trial 12 with value: 0.8695652173913043.
[32m[I 2023-04-26 00:21:29,552][39m Trial 31 finished with value: 0.8392857142857144 and parameters: {'algorithm': 'brute', 'n_neighbors': 28, 'weights': 'distance', 'metric': 'manhattan'}. Best is trial 12 with value: 0.8695652173913043.
[32m[I 2023-04-26 00:21:29,565][39m Trial 32 finished with value: 0.8695652173913043 and parameters: {'algorithm': 'kd_tree', 'n_neighbors': 22, 'weights': 'distance', 'metric': 'manhattan'}. Best is trial 12 with value: 0.8695652173913043.
[32m[I 2023-04-26 00:21:29,594][39m Trial 33 finished with value: 0.8392857142857144 and parameters: {'algorithm': 'auto', 'n_neighbors': 28, 'weights': 'distance', 'metric': 'manhattan'}. Best is trial 12 with value: 0.8695652173913043.
[32m[I 2023-04-26 00:21:29,612][39m Trial 34 finished with value: 0.8148148148148148 and parameters: {'algorithm': 'kd_tree', 'n_neighbors': 22, 'weights': 'uniform', 'metric': 'manhattan'}. Best is trial 12 with value: 0.8695652173913043.
[32m[I 2023-04-26 00:21:29,626][39m Trial 35 finished with value: 0.8392857142857144 and parameters: {'algorithm': 'kd_tree', 'n_neighbors': 17, 'weights': 'distance', 'metric': 'manhattan'}. Best is trial 12 with value: 0.8695652173913043.
[32m[I 2023-04-26 00:21:29,640][39m Trial 36 finished with value: 0.8695652173913043 and parameters: {'algorithm': 'ball_tree', 'n_neighbors': 26, 'weights': 'distance', 'metric': 'manhattan'}. Best is trial 12 with value: 0.8695652173913043.
[32m[I 2023-04-26 00:21:29,659][39m Trial 37 finished with value: 0.8073394495412843 and parameters: {'algorithm': 'ball_tree', 'n_neighbors': 30, 'weights': 'uniform', 'metric': 'manhattan'}. Best is trial 12 with value: 0.8695652173913043.
[32m[I 2023-04-26 00:21:29,674][39m Trial 38 finished with value: 0.8695652173913043 and parameters: {'algorithm': 'kd_tree', 'n_neighbors': 24, 'weights': 'distance', 'metric': 'manhattan'}. Best is trial 12 with value: 0.8695652173913043.
[32m[I 2023-04-26 00:21:29,688][39m Trial 39 finished with value: 0.8672566371681416 and parameters: {'algorithm': 'ball_tree', 'n_neighbors': 21, 'weights': 'distance', 'metric': 'minkowski'}. Best is trial 12 with value: 0.8695652173913043.
[32m[I 2023-04-26 00:21:29,701][39m Trial 40 finished with value: 0.8141592920353982 and parameters: {'algorithm': 'ball_tree', 'n_neighbors': 13, 'weights': 'uniform', 'metric': 'euclidean'}. Best is trial 12 with value: 0.8695652173913043.
[32m[I 2023-04-26 00:21:29,710][39m Trial 41 finished with value: 0.8695652173913043 and parameters: {'algorithm': 'ball_tree', 'n_neighbors': 27, 'weights': 'distance', 'metric': 'manhattan'}. Best is trial 12 with value: 0.8695652173913043.
[32m[I 2023-04-26 00:21:29,717][39m Trial 42 finished with value: 0.8695652173913043 and parameters: {'algorithm': 'kd_tree', 'n_neighbors': 23, 'weights': 'distance', 'metric': 'manhattan'}. Best is trial 12 with value: 0.8695652173913043.
[32m[I 2023-04-26 00:21:29,726][39m Trial 43 finished with value: 0.8596491228070176 and parameters: {'algorithm': 'ball_tree', 'n_neighbors': 18, 'weights': 'distance', 'metric': 'manhattan'}. Best is trial 12 with value: 0.8695652173913043.
[32m[I 2023-04-26 00:21:29,748][39m Trial 44 finished with value: 0.8695652173913043 and parameters: {'algorithm': 'auto', 'n_neighbors': 25, 'weights': 'distance', 'metric': 'manhattan'}. Best is trial 12 with value: 0.8695652173913043.
[32m[I 2023-04-26 00:21:29,762][39m Trial 45 finished with value: 0.8695652173913043 and parameters: {'algorithm': 'ball_tree', 'n_neighbors': 24, 'weights': 'distance', 'metric': 'manhattan'}. Best is trial 12 with value: 0.8695652173913043.
[32m[I 2023-04-26 00:21:29,776][39m Trial 46 finished with value: 0.8495575221238938 and parameters: {'algorithm': 'ball_tree', 'n_neighbors': 23, 'weights': 'distance', 'metric': 'euclidean'}. Best is trial 12 with value: 0.8695652173913043.
[32m[I 2023-04-26 00:21:29,791][39m Trial 47 finished with value: 0.8468468468468469 and parameters: {'algorithm': 'kd_tree', 'n_neighbors': 29, 'weights': 'distance', 'metric': 'manhattan'}. Best is trial 12 with value: 0.8695652173913043.
[32m[I 2023-04-26 00:21:29,806][39m Trial 48 finished with value: 0.8672566371681416 and parameters: {'algorithm': 'kd_tree', 'n_neighbors': 21, 'weights': 'distance', 'metric': 'minkowski'}. Best is trial 12 with value: 0.8695652173913043.
[32m[I 2023-04-26 00:21:29,835][39m Trial 49 finished with value: 0.8695652173913043 and parameters: {'algorithm': 'brute', 'n_neighbors': 25, 'weights': 'distance', 'metric': 'manhattan'}. Best is trial 12 with value: 0.8695652173913043.
[32m[I 2023-04-26 00:21:29,863][39m Trial 50 finished with value: 0.8495575221238938 and parameters: {'algorithm': 'brute', 'n_neighbors': 7, 'weights': 'distance', 'metric': 'euclidean'}. Best is trial 12 with value: 0.8695652173913043.
[32m[I 2023-04-26 00:21:29,893][39m Trial 51 finished with value: 0.8695652173913043 and parameters: {'algorithm': 'brute', 'n_neighbors': 25, 'weights': 'distance', 'metric': 'manhattan'}. Best is trial 12 with value: 0.8695652173913043.
[32m[I 2023-04-26 00:21:29,923][39m Trial 52 finished with value: 0.8695652173913043 and parameters: {'algorithm': 'brute', 'n_neighbors': 22, 'weights': 'distance', 'metric': 'manhattan'}. Best is trial 12 with value: 0.8695652173913043.
[32m[I 2023-04-26 00:21:29,938][39m Trial 53 finished with value: 0.8695652173913043 and parameters: {'algorithm': 'ball_tree', 'n_neighbors': 22, 'weights': 'distance', 'metric': 'manhattan'}. Best is trial 12 with value: 0.8695652173913043.
[32m[I 2023-04-26 00:21:29,954][39m Trial 54 finished with value: 0.8695652173913043 and parameters: {'algorithm': 'ball_tree', 'n_neighbors': 27, 'weights': 'distance', 'metric': 'manhattan'}. Best is trial 12 with value: 0.8695652173913043.
[32m[I 2023-04-26 00:21:29,986][39m Trial 55 finished with value: 0.8695652173913043 and parameters: {'algorithm': 'auto', 'n_neighbors': 27, 'weights': 'distance', 'metric': 'manhattan'}. Best is trial 12 with value: 0.8695652173913043.
[32m[I 2023-04-26 00:21:30,017][39m Trial 56 finished with value: 0.8468468468468469 and parameters: {'algorithm': 'auto', 'n_neighbors': 30, 'weights': 'distance', 'metric': 'manhattan'}. Best is trial 12 with value: 0.8695652173913043.
[32m[I 2023-04-26 00:21:30,047][39m Trial 57 finished with value: 0.8695652173913043 and parameters: {'algorithm': 'auto', 'n_neighbors': 27, 'weights': 'distance', 'metric': 'manhattan'}. Best is trial 12 with value: 0.8695652173913043.
[32m[I 2023-04-26 00:21:30,063][39m Trial 58 finished with value: 0.8468468468468469 and parameters: {'algorithm': 'ball_tree', 'n_neighbors': 29, 'weights': 'distance', 'metric': 'manhattan'}. Best is trial 12 with value: 0.8695652173913043.
[32m[I 2023-04-26 00:21:30,084][39m Trial 59 finished with value: 0.8073394495412843 and parameters: {'algorithm': 'kd_tree', 'n_neighbors': 24, 'weights': 'uniform', 'metric': 'manhattan'}. Best is trial 12 with value: 0.8695652173913043.
[32m[I 2023-04-26 00:21:30,101][39m Trial 60 finished with value: 0.8495575221238938 and parameters: {'algorithm': 'ball_tree', 'n_neighbors': 25, 'weights': 'distance', 'metric': 'minkowski'}. Best is trial 12 with value: 0.8695652173913043.
[32m[I 2023-04-26 00:21:30,130][39m Trial 61 finished with value: 0.8596491228070176 and parameters: {'algorithm': 'auto', 'n_neighbors': 20, 'weights': 'distance', 'metric': 'manhattan'}. Best is trial 12 with value: 0.8695652173913043.
[32m[I 2023-04-26 00:21:30,160][39m Trial 62 finished with value: 0.8695652173913043 and parameters: {'algorithm': 'auto', 'n_neighbors': 26, 'weights': 'distance', 'metric': 'manhattan'}. Best is trial 12 with value: 0.8695652173913043.
[32m[I 2023-04-26 00:21:30,176][39m Trial 63 finished with value: 0.8695652173913043 and parameters: {'algorithm': 'ball_tree', 'n_neighbors': 23, 'weights': 'distance', 'metric': 'manhattan'}. Best is trial 12 with value: 0.8695652173913043.
[32m[I 2023-04-26 00:21:30,206][39m Trial 64 finished with value: 0.8596491228070176 and parameters: {'algorithm': 'brute', 'n_neighbors': 20, 'weights': 'distance', 'metric': 'manhattan'}. Best is trial 12 with value: 0.8695652173913043.
[32m[I 2023-04-26 00:21:30,220][39m Trial 65 finished with value: 0.8695652173913043 and parameters: {'algorithm': 'kd_tree', 'n_neighbors': 27, 'weights': 'distance', 'metric': 'manhattan'}. Best is trial 12 with value: 0.8695652173913043.
[32m[I 2023-04-26 00:21:30,235][39m Trial 66 finished with value: 0.8596491228070176 and parameters: {'algorithm': 'kd_tree', 'n_neighbors': 2, 'weights': 'distance', 'metric': 'manhattan'}. Best is trial 12 with value: 0.8695652173913043.
[32m[I 2023-04-26 00:21:30,268][39m Trial 67 finished with value: 0.8495575221238938 and parameters: {'algorithm': 'brute', 'n_neighbors': 25, 'weights': 'distance', 'metric': 'euclidean'}. Best is trial 12 with value: 0.8695652173913043.
[32m[I 2023-04-26 00:21:30,299][39m Trial 68 finished with value: 0.8468468468468469 and parameters: {'algorithm': 'auto', 'n_neighbors': 29, 'weights': 'distance', 'metric': 'manhattan'}. Best is trial 12 with value: 0.8695652173913043.
[32m[I 2023-04-26 00:21:30,315][39m Trial 69 finished with value: 0.8695652173913043 and parameters: {'algorithm': 'kd_tree', 'n_neighbors': 26, 'weights': 'distance', 'metric': 'manhattan'}. Best is trial 12 with value: 0.8695652173913043.
[32m[I 2023-04-26 00:21:30,341][39m Trial 70 finished with value: 0.8 and parameters: {'algorithm': 'auto', 'n_neighbors': 28, 'weights': 'uniform', 'metric': 'manhattan'}. Best is trial 12 with value: 0.8695652173913043.
[32m[I 2023-04-26 00:21:30,365][39m Trial 71 finished with value: 0.8695652173913043 and parameters: {'algorithm': 'brute', 'n_neighbors': 25, 'weights': 'distance', 'metric': 'manhattan'}. Best is trial 12 with value: 0.8695652173913043.
[32m[I 2023-04-26 00:21:30,395][39m Trial 72 finished with value: 0.8695652173913043 and parameters: {'algorithm': 'brute', 'n_neighbors': 27, 'weights': 'distance', 'metric': 'manhattan'}. Best is trial 12 with value: 0.8695652173913043.
[32m[I 2023-04-26 00:21:30,412][39m Trial 73 finished with value: 0.8695652173913043 and parameters: {'algorithm': 'kd_tree', 'n_neighbors': 23, 'weights': 'distance', 'metric': 'manhattan'}. Best is trial 12 with value: 0.8695652173913043.
[32m[I 2023-04-26 00:21:30,429][39m Trial 74 finished with value: 0.8695652173913043 and parameters: {'algorithm': 'ball_tree', 'n_neighbors': 24, 'weights': 'distance', 'metric': 'manhattan'}. Best is trial 12 with value: 0.8695652173913043.
[32m[I 2023-04-26 00:21:30,446][39m Trial 75 finished with value: 0.8596491228070176 and parameters: {'algorithm': 'kd_tree', 'n_neighbors': 14, 'weights': 'distance', 'metric': 'manhattan'}. Best is trial 12 with value: 0.8695652173913043.
[32m[I 2023-04-26 00:21:30,463][39m Trial 76 finished with value: 0.8695652173913043 and parameters: {'algorithm': 'kd_tree', 'n_neighbors': 22, 'weights': 'distance', 'metric': 'manhattan'}. Best is trial 12 with value: 0.8695652173913043.
[32m[I 2023-04-26 00:21:30,496][39m Trial 77 finished with value: 0.8695652173913043 and parameters: {'algorithm': 'brute', 'n_neighbors': 25, 'weights': 'distance', 'metric': 'manhattan'}. Best is trial 12 with value: 0.8695652173913043.
[32m[I 2023-04-26 00:21:30,511][39m Trial 78 finished with value: 0.8571428571428572 and parameters: {'algorithm': 'ball_tree', 'n_neighbors': 24, 'weights': 'distance', 'metric': 'minkowski'}. Best is trial 12 with value: 0.8695652173913043.
[32m[I 2023-04-26 00:21:30,542][39m Trial 79 finished with value: 0.8695652173913043 and parameters: {'algorithm': 'auto', 'n_neighbors': 27, 'weights': 'distance', 'metric': 'manhattan'}. Best is trial 12 with value: 0.8695652173913043.
[32m[I 2023-04-26 00:21:30,573][39m Trial 80 finished with value: 0.8695652173913043 and parameters: {'algorithm': 'auto', 'n_neighbors': 29, 'weights': 'distance', 'metric': 'euclidean'}. Best is trial 12 with value: 0.8695652173913043.
[32m[I 2023-04-26 00:21:30,589][39m Trial 81 finished with value: 0.8495575221238938 and parameters: {'algorithm': 'kd_tree', 'n_neighbors': 23, 'weights': 'distance', 'metric': 'euclidean'}. Best is trial 12 with value: 0.8695652173913043.
[32m[I 2023-04-26 00:21:30,606][39m Trial 82 finished with value: 0.8695652173913043 and parameters: {'algorithm': 'kd_tree', 'n_neighbors': 29, 'weights': 'distance', 'metric': 'euclidean'}. Best is trial 12 with value: 0.8695652173913043.
[32m[I 2023-04-26 00:21:30,638][39m Trial 83 finished with value: 0.8695652173913043 and parameters: {'algorithm': 'brute', 'n_neighbors': 25, 'weights': 'distance', 'metric': 'manhattan'}. Best is trial 12 with value: 0.8695652173913043.
[32m[I 2023-04-26 00:21:30,654][39m Trial 84 finished with value: 0.8495575221238938 and parameters: {'algorithm': 'ball_tree', 'n_neighbors': 26, 'weights': 'distance', 'metric': 'euclidean'}. Best is trial 12 with value: 0.8695652173913043.
[32m[I 2023-04-26 00:21:30,686][39m Trial 85 finished with value: 0.8695652173913043 and parameters: {'algorithm': 'brute', 'n_neighbors': 22, 'weights': 'distance', 'metric': 'manhattan'}. Best is trial 12 with value: 0.8695652173913043.
[32m[I 2023-04-26 00:21:30,717][39m Trial 86 finished with value: 0.8596491228070176 and parameters: {'algorithm': 'brute', 'n_neighbors': 19, 'weights': 'distance', 'metric': 'manhattan'}. Best is trial 12 with value: 0.8695652173913043.
[32m[I 2023-04-26 00:21:30,736][39m Trial 87 finished with value: 0.7999999999999999 and parameters: {'algorithm': 'ball_tree', 'n_neighbors': 26, 'weights': 'uniform', 'metric': 'manhattan'}. Best is trial 12 with value: 0.8695652173913043.
[32m[I 2023-04-26 00:21:30,767][39m Trial 88 finished with value: 0.8495575221238938 and parameters: {'algorithm': 'auto', 'n_neighbors': 28, 'weights': 'distance', 'metric': 'euclidean'}. Best is trial 12 with value: 0.8695652173913043.
[32m[I 2023-04-26 00:21:30,782][39m Trial 89 finished with value: 0.8695652173913043 and parameters: {'algorithm': 'kd_tree', 'n_neighbors': 21, 'weights': 'distance', 'metric': 'manhattan'}. Best is trial 12 with value: 0.8695652173913043.
