[32m[I 2023-04-26 00:21:41,671][39m Trial 450 finished with value: 0.8695652173913043 and parameters: {'algorithm': 'auto', 'n_neighbors': 23, 'weights': 'distance', 'metric': 'manhattan'}. Best is trial 12 with value: 0.8695652173913043.
[32m[I 2023-04-26 00:21:41,697][39m Trial 451 finished with value: 0.8695652173913043 and parameters: {'algorithm': 'ball_tree', 'n_neighbors': 23, 'weights': 'distance', 'metric': 'manhattan'}. Best is trial 12 with value: 0.8695652173913043.
[32m[I 2023-04-26 00:21:41,740][39m Trial 452 finished with value: 0.8695652173913043 and parameters: {'algorithm': 'auto', 'n_neighbors': 23, 'weights': 'distance', 'metric': 'manhattan'}. Best is trial 12 with value: 0.8695652173913043.
[32m[I 2023-04-26 00:21:41,783][39m Trial 453 finished with value: 0.8695652173913043 and parameters: {'algorithm': 'auto', 'n_neighbors': 24, 'weights': 'distance', 'metric': 'manhattan'}. Best is trial 12 with value: 0.8695652173913043.
[32m[I 2023-04-26 00:21:41,824][39m Trial 454 finished with value: 0.8695652173913043 and parameters: {'algorithm': 'auto', 'n_neighbors': 23, 'weights': 'distance', 'metric': 'manhattan'}. Best is trial 12 with value: 0.8695652173913043.
[32m[I 2023-04-26 00:21:41,865][39m Trial 455 finished with value: 0.8695652173913043 and parameters: {'algorithm': 'auto', 'n_neighbors': 24, 'weights': 'distance', 'metric': 'manhattan'}. Best is trial 12 with value: 0.8695652173913043.
[32m[I 2023-04-26 00:21:41,907][39m Trial 456 finished with value: 0.8695652173913043 and parameters: {'algorithm': 'brute', 'n_neighbors': 23, 'weights': 'distance', 'metric': 'manhattan'}. Best is trial 12 with value: 0.8695652173913043.
[32m[I 2023-04-26 00:21:41,957][39m Trial 457 finished with value: 0.8695652173913043 and parameters: {'algorithm': 'auto', 'n_neighbors': 27, 'weights': 'distance', 'metric': 'manhattan'}. Best is trial 12 with value: 0.8695652173913043.
[32m[I 2023-04-26 00:21:42,005][39m Trial 458 finished with value: 0.8695652173913043 and parameters: {'algorithm': 'auto', 'n_neighbors': 24, 'weights': 'distance', 'metric': 'manhattan'}. Best is trial 12 with value: 0.8695652173913043.
[32m[I 2023-04-26 00:21:42,050][39m Trial 459 finished with value: 0.8695652173913043 and parameters: {'algorithm': 'brute', 'n_neighbors': 24, 'weights': 'distance', 'metric': 'manhattan'}. Best is trial 12 with value: 0.8695652173913043.
[32m[I 2023-04-26 00:21:42,102][39m Trial 460 finished with value: 0.8695652173913043 and parameters: {'algorithm': 'auto', 'n_neighbors': 23, 'weights': 'distance', 'metric': 'manhattan'}. Best is trial 12 with value: 0.8695652173913043.
[32m[I 2023-04-26 00:21:42,152][39m Trial 461 finished with value: 0.8392857142857144 and parameters: {'algorithm': 'auto', 'n_neighbors': 28, 'weights': 'distance', 'metric': 'manhattan'}. Best is trial 12 with value: 0.8695652173913043.
[32m[I 2023-04-26 00:21:42,194][39m Trial 462 finished with value: 0.8411214953271028 and parameters: {'algorithm': 'brute', 'n_neighbors': 20, 'weights': 'uniform', 'metric': 'manhattan'}. Best is trial 12 with value: 0.8695652173913043.
[32m[I 2023-04-26 00:21:42,224][39m Trial 463 finished with value: 0.8695652173913043 and parameters: {'algorithm': 'auto', 'n_neighbors': 26, 'weights': 'distance', 'metric': 'manhattan'}. Best is trial 12 with value: 0.8695652173913043.
[32m[I 2023-04-26 00:21:42,266][39m Trial 464 finished with value: 0.8695652173913043 and parameters: {'algorithm': 'brute', 'n_neighbors': 23, 'weights': 'distance', 'metric': 'manhattan'}. Best is trial 12 with value: 0.8695652173913043.
[32m[I 2023-04-26 00:21:42,310][39m Trial 465 finished with value: 0.8392857142857144 and parameters: {'algorithm': 'brute', 'n_neighbors': 17, 'weights': 'distance', 'metric': 'manhattan'}. Best is trial 12 with value: 0.8695652173913043.
[32m[I 2023-04-26 00:21:42,351][39m Trial 466 finished with value: 0.8695652173913043 and parameters: {'algorithm': 'auto', 'n_neighbors': 22, 'weights': 'distance', 'metric': 'manhattan'}. Best is trial 12 with value: 0.8695652173913043.
[32m[I 2023-04-26 00:21:42,394][39m Trial 467 finished with value: 0.8695652173913043 and parameters: {'algorithm': 'brute', 'n_neighbors': 23, 'weights': 'distance', 'metric': 'manhattan'}. Best is trial 12 with value: 0.8695652173913043.
[32m[I 2023-04-26 00:21:42,438][39m Trial 468 finished with value: 0.8695652173913043 and parameters: {'algorithm': 'brute', 'n_neighbors': 25, 'weights': 'distance', 'metric': 'manhattan'}. Best is trial 12 with value: 0.8695652173913043.
[32m[I 2023-04-26 00:21:42,480][39m Trial 469 finished with value: 0.8695652173913043 and parameters: {'algorithm': 'brute', 'n_neighbors': 23, 'weights': 'distance', 'metric': 'manhattan'}. Best is trial 12 with value: 0.8695652173913043.
[32m[I 2023-04-26 00:21:42,523][39m Trial 470 finished with value: 0.8695652173913043 and parameters: {'algorithm': 'brute', 'n_neighbors': 24, 'weights': 'distance', 'metric': 'manhattan'}. Best is trial 12 with value: 0.8695652173913043.
[32m[I 2023-04-26 00:21:42,566][39m Trial 471 finished with value: 0.8495575221238938 and parameters: {'algorithm': 'brute', 'n_neighbors': 23, 'weights': 'distance', 'metric': 'minkowski'}. Best is trial 12 with value: 0.8695652173913043.
[32m[I 2023-04-26 00:21:42,588][39m Trial 472 finished with value: 0.8695652173913043 and parameters: {'algorithm': 'ball_tree', 'n_neighbors': 24, 'weights': 'distance', 'metric': 'manhattan'}. Best is trial 12 with value: 0.8695652173913043.
[32m[I 2023-04-26 00:21:42,621][39m Trial 473 finished with value: 0.8695652173913043 and parameters: {'algorithm': 'ball_tree', 'n_neighbors': 25, 'weights': 'distance', 'metric': 'manhattan'}. Best is trial 12 with value: 0.8695652173913043.
[32m[I 2023-04-26 00:21:42,649][39m Trial 474 finished with value: 0.8695652173913043 and parameters: {'algorithm': 'ball_tree', 'n_neighbors': 25, 'weights': 'distance', 'metric': 'manhattan'}. Best is trial 12 with value: 0.8695652173913043.
[32m[I 2023-04-26 00:21:42,671][39m Trial 475 finished with value: 0.8695652173913043 and parameters: {'algorithm': 'ball_tree', 'n_neighbors': 25, 'weights': 'distance', 'metric': 'manhattan'}. Best is trial 12 with value: 0.8695652173913043.
[32m[I 2023-04-26 00:21:42,688][39m Trial 476 finished with value: 0.8695652173913043 and parameters: {'algorithm': 'ball_tree', 'n_neighbors': 25, 'weights': 'distance', 'metric': 'manhattan'}. Best is trial 12 with value: 0.8695652173913043.
[32m[I 2023-04-26 00:21:42,701][39m Trial 477 finished with value: 0.8695652173913043 and parameters: {'algorithm': 'ball_tree', 'n_neighbors': 26, 'weights': 'distance', 'metric': 'manhattan'}. Best is trial 12 with value: 0.8695652173913043.
[32m[I 2023-04-26 00:21:42,716][39m Trial 478 finished with value: 0.8695652173913043 and parameters: {'algorithm': 'ball_tree', 'n_neighbors': 26, 'weights': 'distance', 'metric': 'manhattan'}. Best is trial 12 with value: 0.8695652173913043.
[32m[I 2023-04-26 00:21:42,749][39m Trial 479 finished with value: 0.8695652173913043 and parameters: {'algorithm': 'brute', 'n_neighbors': 26, 'weights': 'distance', 'metric': 'manhattan'}. Best is trial 12 with value: 0.8695652173913043.
[32m[I 2023-04-26 00:21:42,789][39m Trial 480 finished with value: 0.8695652173913043 and parameters: {'algorithm': 'brute', 'n_neighbors': 26, 'weights': 'distance', 'metric': 'manhattan'}. Best is trial 12 with value: 0.8695652173913043.
[32m[I 2023-04-26 00:21:42,821][39m Trial 481 finished with value: 0.8495575221238938 and parameters: {'algorithm': 'ball_tree', 'n_neighbors': 28, 'weights': 'distance', 'metric': 'minkowski'}. Best is trial 12 with value: 0.8695652173913043.
[32m[I 2023-04-26 00:21:42,853][39m Trial 482 finished with value: 0.7999999999999999 and parameters: {'algorithm': 'ball_tree', 'n_neighbors': 26, 'weights': 'uniform', 'metric': 'manhattan'}. Best is trial 12 with value: 0.8695652173913043.
[32m[I 2023-04-26 00:21:42,897][39m Trial 483 finished with value: 0.8695652173913043 and parameters: {'algorithm': 'auto', 'n_neighbors': 27, 'weights': 'distance', 'metric': 'manhattan'}. Best is trial 12 with value: 0.8695652173913043.
[32m[I 2023-04-26 00:21:42,941][39m Trial 484 finished with value: 0.8695652173913043 and parameters: {'algorithm': 'brute', 'n_neighbors': 25, 'weights': 'distance', 'metric': 'manhattan'}. Best is trial 12 with value: 0.8695652173913043.
[32m[I 2023-04-26 00:21:42,985][39m Trial 485 finished with value: 0.8695652173913043 and parameters: {'algorithm': 'brute', 'n_neighbors': 27, 'weights': 'distance', 'metric': 'manhattan'}. Best is trial 12 with value: 0.8695652173913043.
[32m[I 2023-04-26 00:21:43,025][39m Trial 486 finished with value: 0.8695652173913043 and parameters: {'algorithm': 'brute', 'n_neighbors': 27, 'weights': 'distance', 'metric': 'manhattan'}. Best is trial 12 with value: 0.8695652173913043.
[32m[I 2023-04-26 00:21:43,067][39m Trial 487 finished with value: 0.8695652173913043 and parameters: {'algorithm': 'brute', 'n_neighbors': 26, 'weights': 'distance', 'metric': 'manhattan'}. Best is trial 12 with value: 0.8695652173913043.
[32m[I 2023-04-26 00:21:43,116][39m Trial 488 finished with value: 0.8695652173913043 and parameters: {'algorithm': 'brute', 'n_neighbors': 24, 'weights': 'distance', 'metric': 'manhattan'}. Best is trial 12 with value: 0.8695652173913043.
[32m[I 2023-04-26 00:21:43,160][39m Trial 489 finished with value: 0.8392857142857144 and parameters: {'algorithm': 'brute', 'n_neighbors': 8, 'weights': 'distance', 'metric': 'manhattan'}. Best is trial 12 with value: 0.8695652173913043.
[32m[I 2023-04-26 00:21:43,206][39m Trial 490 finished with value: 0.8695652173913043 and parameters: {'algorithm': 'brute', 'n_neighbors': 25, 'weights': 'distance', 'metric': 'manhattan'}. Best is trial 12 with value: 0.8695652173913043.
[32m[I 2023-04-26 00:21:43,249][39m Trial 491 finished with value: 0.8695652173913043 and parameters: {'algorithm': 'brute', 'n_neighbors': 23, 'weights': 'distance', 'metric': 'manhattan'}. Best is trial 12 with value: 0.8695652173913043.
[32m[I 2023-04-26 00:21:43,289][39m Trial 492 finished with value: 0.8695652173913043 and parameters: {'algorithm': 'brute', 'n_neighbors': 23, 'weights': 'distance', 'metric': 'manhattan'}. Best is trial 12 with value: 0.8695652173913043.
[32m[I 2023-04-26 00:21:43,338][39m Trial 493 finished with value: 0.8695652173913043 and parameters: {'algorithm': 'brute', 'n_neighbors': 21, 'weights': 'distance', 'metric': 'manhattan'}. Best is trial 12 with value: 0.8695652173913043.
[32m[I 2023-04-26 00:21:43,365][39m Trial 494 finished with value: 0.8596491228070176 and parameters: {'algorithm': 'kd_tree', 'n_neighbors': 20, 'weights': 'distance', 'metric': 'manhattan'}. Best is trial 12 with value: 0.8695652173913043.
[32m[I 2023-04-26 00:21:43,394][39m Trial 495 finished with value: 0.8695652173913043 and parameters: {'algorithm': 'ball_tree', 'n_neighbors': 24, 'weights': 'distance', 'metric': 'manhattan'}. Best is trial 12 with value: 0.8695652173913043.
[32m[I 2023-04-26 00:21:43,422][39m Trial 496 finished with value: 0.8695652173913043 and parameters: {'algorithm': 'ball_tree', 'n_neighbors': 25, 'weights': 'distance', 'metric': 'manhattan'}. Best is trial 12 with value: 0.8695652173913043.
[32m[I 2023-04-26 00:21:43,445][39m Trial 497 finished with value: 0.8695652173913043 and parameters: {'algorithm': 'ball_tree', 'n_neighbors': 26, 'weights': 'distance', 'metric': 'manhattan'}. Best is trial 12 with value: 0.8695652173913043.
[32m[I 2023-04-26 00:21:43,462][39m Trial 498 finished with value: 0.8695652173913043 and parameters: {'algorithm': 'ball_tree', 'n_neighbors': 26, 'weights': 'distance', 'metric': 'manhattan'}. Best is trial 12 with value: 0.8695652173913043.
[32m[I 2023-04-26 00:21:43,477][39m Trial 499 finished with value: 0.8695652173913043 and parameters: {'algorithm': 'kd_tree', 'n_neighbors': 27, 'weights': 'distance', 'metric': 'manhattan'}. Best is trial 12 with value: 0.8695652173913043.
Number of finished trials: 500