[32m[I 2023-04-26 00:16:58,569][39m Trial 365 finished with value: 0.8672566371681416 and parameters: {'criterion': 'gini', 'n_estimators': 163, 'max_features': 0.332037133316416, 'max_depth': 64, 'min_samples_split': 2, 'min_samples_leaf': 4}. Best is trial 311 with value: 0.8869565217391304.
[32m[I 2023-04-26 00:16:58,676][39m Trial 366 finished with value: 0.8596491228070176 and parameters: {'criterion': 'gini', 'n_estimators': 159, 'max_features': 0.25887788910845094, 'max_depth': 70, 'min_samples_split': 3, 'min_samples_leaf': 4}. Best is trial 311 with value: 0.8869565217391304.
[32m[I 2023-04-26 00:16:58,777][39m Trial 367 finished with value: 0.8672566371681416 and parameters: {'criterion': 'gini', 'n_estimators': 154, 'max_features': 0.2998108915541807, 'max_depth': 61, 'min_samples_split': 3, 'min_samples_leaf': 4}. Best is trial 311 with value: 0.8869565217391304.
[32m[I 2023-04-26 00:16:58,882][39m Trial 368 finished with value: 0.831858407079646 and parameters: {'criterion': 'gini', 'n_estimators': 162, 'max_features': 0.3224557866949967, 'max_depth': 65, 'min_samples_split': 2, 'min_samples_leaf': 5}. Best is trial 311 with value: 0.8869565217391304.
[32m[I 2023-04-26 00:16:58,997][39m Trial 369 finished with value: 0.8771929824561403 and parameters: {'criterion': 'gini', 'n_estimators': 171, 'max_features': 0.24738804419176402, 'max_depth': 68, 'min_samples_split': 2, 'min_samples_leaf': 3}. Best is trial 311 with value: 0.8869565217391304.
[32m[I 2023-04-26 00:16:59,109][39m Trial 370 finished with value: 0.8695652173913043 and parameters: {'criterion': 'gini', 'n_estimators': 172, 'max_features': 0.24104285484881788, 'max_depth': 70, 'min_samples_split': 2, 'min_samples_leaf': 3}. Best is trial 311 with value: 0.8869565217391304.
[32m[I 2023-04-26 00:16:59,222][39m Trial 371 finished with value: 0.8547008547008546 and parameters: {'criterion': 'gini', 'n_estimators': 177, 'max_features': 0.24726447210312077, 'max_depth': 68, 'min_samples_split': 2, 'min_samples_leaf': 2}. Best is trial 311 with value: 0.8869565217391304.
[32m[I 2023-04-26 00:16:59,339][39m Trial 372 finished with value: 0.8672566371681416 and parameters: {'criterion': 'gini', 'n_estimators': 170, 'max_features': 0.22750184406832227, 'max_depth': 68, 'min_samples_split': 7, 'min_samples_leaf': 3}. Best is trial 311 with value: 0.8869565217391304.
[32m[I 2023-04-26 00:16:59,465][39m Trial 373 finished with value: 0.8672566371681416 and parameters: {'criterion': 'gini', 'n_estimators': 175, 'max_features': 0.2816241554741561, 'max_depth': 66, 'min_samples_split': 4, 'min_samples_leaf': 4}. Best is trial 311 with value: 0.8869565217391304.
[32m[I 2023-04-26 00:16:59,584][39m Trial 374 finished with value: 0.8347826086956522 and parameters: {'criterion': 'gini', 'n_estimators': 166, 'max_features': 0.28980989634192345, 'max_depth': 63, 'min_samples_split': 2, 'min_samples_leaf': 11}. Best is trial 311 with value: 0.8869565217391304.
[32m[I 2023-04-26 00:16:59,701][39m Trial 375 finished with value: 0.8672566371681416 and parameters: {'criterion': 'gini', 'n_estimators': 156, 'max_features': 0.26824365392811433, 'max_depth': 63, 'min_samples_split': 3, 'min_samples_leaf': 3}. Best is trial 311 with value: 0.8869565217391304.
[32m[I 2023-04-26 00:16:59,820][39m Trial 376 finished with value: 0.8672566371681416 and parameters: {'criterion': 'gini', 'n_estimators': 158, 'max_features': 0.25392370926813207, 'max_depth': 67, 'min_samples_split': 3, 'min_samples_leaf': 4}. Best is trial 311 with value: 0.8869565217391304.
[32m[I 2023-04-26 00:16:59,937][39m Trial 377 finished with value: 0.8771929824561403 and parameters: {'criterion': 'gini', 'n_estimators': 153, 'max_features': 0.2860487310997682, 'max_depth': 70, 'min_samples_split': 3, 'min_samples_leaf': 3}. Best is trial 311 with value: 0.8869565217391304.
[32m[I 2023-04-26 00:17:00,053][39m Trial 378 finished with value: 0.8695652173913043 and parameters: {'criterion': 'gini', 'n_estimators': 151, 'max_features': 0.27007116217927823, 'max_depth': 60, 'min_samples_split': 3, 'min_samples_leaf': 3}. Best is trial 311 with value: 0.8869565217391304.
[32m[I 2023-04-26 00:17:00,167][39m Trial 379 finished with value: 0.8571428571428572 and parameters: {'criterion': 'gini', 'n_estimators': 162, 'max_features': 0.30758056068851963, 'max_depth': 72, 'min_samples_split': 3, 'min_samples_leaf': 6}. Best is trial 311 with value: 0.8869565217391304.
[32m[I 2023-04-26 00:17:00,286][39m Trial 380 finished with value: 0.8672566371681416 and parameters: {'criterion': 'gini', 'n_estimators': 154, 'max_features': 0.25071486493988987, 'max_depth': 70, 'min_samples_split': 3, 'min_samples_leaf': 3}. Best is trial 311 with value: 0.8869565217391304.
[32m[I 2023-04-26 00:17:00,410][39m Trial 381 finished with value: 0.864406779661017 and parameters: {'criterion': 'gini', 'n_estimators': 171, 'max_features': 0.21880953510584994, 'max_depth': 67, 'min_samples_split': 3, 'min_samples_leaf': 3}. Best is trial 311 with value: 0.8869565217391304.
[32m[I 2023-04-26 00:17:00,529][39m Trial 382 finished with value: 0.8672566371681416 and parameters: {'criterion': 'entropy', 'n_estimators': 149, 'max_features': 0.34574521191773633, 'max_depth': 71, 'min_samples_split': 2, 'min_samples_leaf': 3}. Best is trial 311 with value: 0.8869565217391304.
[32m[I 2023-04-26 00:17:00,656][39m Trial 383 finished with value: 0.8571428571428572 and parameters: {'criterion': 'gini', 'n_estimators': 167, 'max_features': 0.297511648906593, 'max_depth': 65, 'min_samples_split': 2, 'min_samples_leaf': 2}. Best is trial 311 with value: 0.8869565217391304.
[32m[I 2023-04-26 00:17:00,789][39m Trial 384 finished with value: 0.8571428571428572 and parameters: {'criterion': 'gini', 'n_estimators': 161, 'max_features': 0.3282167163897023, 'max_depth': 68, 'min_samples_split': 2, 'min_samples_leaf': 4}. Best is trial 311 with value: 0.8869565217391304.
[32m[I 2023-04-26 00:17:00,910][39m Trial 385 finished with value: 0.8717948717948718 and parameters: {'criterion': 'gini', 'n_estimators': 156, 'max_features': 0.2801647319106545, 'max_depth': 50, 'min_samples_split': 6, 'min_samples_leaf': 3}. Best is trial 311 with value: 0.8869565217391304.
[32m[I 2023-04-26 00:17:01,040][39m Trial 386 finished with value: 0.8421052631578947 and parameters: {'criterion': 'gini', 'n_estimators': 159, 'max_features': 0.3085893904428559, 'max_depth': 66, 'min_samples_split': 2, 'min_samples_leaf': 3}. Best is trial 311 with value: 0.8869565217391304.
[32m[I 2023-04-26 00:17:01,160][39m Trial 387 finished with value: 0.875 and parameters: {'criterion': 'gini', 'n_estimators': 153, 'max_features': 0.3338383847160032, 'max_depth': 65, 'min_samples_split': 3, 'min_samples_leaf': 3}. Best is trial 311 with value: 0.8869565217391304.
[32m[I 2023-04-26 00:17:01,289][39m Trial 388 finished with value: 0.8571428571428572 and parameters: {'criterion': 'gini', 'n_estimators': 173, 'max_features': 0.23356682611869237, 'max_depth': 40, 'min_samples_split': 2, 'min_samples_leaf': 3}. Best is trial 311 with value: 0.8869565217391304.
[32m[I 2023-04-26 00:17:01,408][39m Trial 389 finished with value: 0.8771929824561403 and parameters: {'criterion': 'gini', 'n_estimators': 166, 'max_features': 0.20664579475625725, 'max_depth': 69, 'min_samples_split': 2, 'min_samples_leaf': 3}. Best is trial 311 with value: 0.8869565217391304.
[32m[I 2023-04-26 00:17:01,461][39m Trial 390 finished with value: 0.847457627118644 and parameters: {'criterion': 'gini', 'n_estimators': 57, 'max_features': 0.17279210265172762, 'max_depth': 72, 'min_samples_split': 4, 'min_samples_leaf': 3}. Best is trial 311 with value: 0.8869565217391304.
[32m[I 2023-04-26 00:17:01,584][39m Trial 391 finished with value: 0.8571428571428572 and parameters: {'criterion': 'gini', 'n_estimators': 166, 'max_features': 0.1944843521383724, 'max_depth': 69, 'min_samples_split': 2, 'min_samples_leaf': 2}. Best is trial 311 with value: 0.8869565217391304.
[32m[I 2023-04-26 00:17:01,703][39m Trial 392 finished with value: 0.8672566371681416 and parameters: {'criterion': 'gini', 'n_estimators': 158, 'max_features': 0.31993598064195705, 'max_depth': 62, 'min_samples_split': 3, 'min_samples_leaf': 4}. Best is trial 311 with value: 0.8869565217391304.
[32m[I 2023-04-26 00:17:01,827][39m Trial 393 finished with value: 0.8571428571428572 and parameters: {'criterion': 'gini', 'n_estimators': 161, 'max_features': 0.3971830625196457, 'max_depth': 73, 'min_samples_split': 3, 'min_samples_leaf': 3}. Best is trial 311 with value: 0.8869565217391304.
[32m[I 2023-04-26 00:17:01,907][39m Trial 394 finished with value: 0.8620689655172413 and parameters: {'criterion': 'gini', 'n_estimators': 100, 'max_features': 0.19844893011703826, 'max_depth': 69, 'min_samples_split': 2, 'min_samples_leaf': 5}. Best is trial 311 with value: 0.8869565217391304.
[32m[I 2023-04-26 00:17:02,028][39m Trial 395 finished with value: 0.8596491228070176 and parameters: {'criterion': 'gini', 'n_estimators': 170, 'max_features': 0.20803469807041222, 'max_depth': 64, 'min_samples_split': 2, 'min_samples_leaf': 3}. Best is trial 311 with value: 0.8869565217391304.
[32m[I 2023-04-26 00:17:02,144][39m Trial 396 finished with value: 0.8672566371681416 and parameters: {'criterion': 'entropy', 'n_estimators': 151, 'max_features': 0.28749876620000514, 'max_depth': 67, 'min_samples_split': 3, 'min_samples_leaf': 4}. Best is trial 311 with value: 0.8869565217391304.
[32m[I 2023-04-26 00:17:02,269][39m Trial 397 finished with value: 0.8620689655172413 and parameters: {'criterion': 'gini', 'n_estimators': 169, 'max_features': 0.2696775283224337, 'max_depth': 70, 'min_samples_split': 2, 'min_samples_leaf': 3}. Best is trial 311 with value: 0.8869565217391304.
[32m[I 2023-04-26 00:17:02,389][39m Trial 398 finished with value: 0.8771929824561403 and parameters: {'criterion': 'entropy', 'n_estimators': 158, 'max_features': 0.2627047441505181, 'max_depth': 63, 'min_samples_split': 3, 'min_samples_leaf': 3}. Best is trial 311 with value: 0.8869565217391304.
[32m[I 2023-04-26 00:17:02,503][39m Trial 399 finished with value: 0.8793103448275863 and parameters: {'criterion': 'entropy', 'n_estimators': 148, 'max_features': 0.26391041167463786, 'max_depth': 60, 'min_samples_split': 3, 'min_samples_leaf': 3}. Best is trial 311 with value: 0.8869565217391304.
[32m[I 2023-04-26 00:17:02,624][39m Trial 400 finished with value: 0.8672566371681416 and parameters: {'criterion': 'entropy', 'n_estimators': 148, 'max_features': 0.41410716379961443, 'max_depth': 58, 'min_samples_split': 3, 'min_samples_leaf': 3}. Best is trial 311 with value: 0.8869565217391304.
[32m[I 2023-04-26 00:17:02,753][39m Trial 401 finished with value: 0.8672566371681416 and parameters: {'criterion': 'gini', 'n_estimators': 175, 'max_features': 0.24539875899741517, 'max_depth': 55, 'min_samples_split': 2, 'min_samples_leaf': 3}. Best is trial 311 with value: 0.8869565217391304.
[32m[I 2023-04-26 00:17:02,867][39m Trial 402 finished with value: 0.8672566371681416 and parameters: {'criterion': 'entropy', 'n_estimators': 147, 'max_features': 0.298886252979755, 'max_depth': 61, 'min_samples_split': 4, 'min_samples_leaf': 4}. Best is trial 311 with value: 0.8869565217391304.
[32m[I 2023-04-26 00:17:02,984][39m Trial 403 finished with value: 0.8429752066115702 and parameters: {'criterion': 'gini', 'n_estimators': 153, 'max_features': 0.2829730389944322, 'max_depth': 59, 'min_samples_split': 3, 'min_samples_leaf': 2}. Best is trial 311 with value: 0.8869565217391304.
[32m[I 2023-04-26 00:17:03,097][39m Trial 404 finished with value: 0.8596491228070176 and parameters: {'criterion': 'gini', 'n_estimators': 150, 'max_features': 0.26898696721649, 'max_depth': 60, 'min_samples_split': 2, 'min_samples_leaf': 3}. Best is trial 311 with value: 0.8869565217391304.
[32m[I 2023-04-26 00:17:03,214][39m Trial 405 finished with value: 0.8771929824561403 and parameters: {'criterion': 'gini', 'n_estimators': 155, 'max_features': 0.3083826089989944, 'max_depth': 72, 'min_samples_split': 2, 'min_samples_leaf': 3}. Best is trial 311 with value: 0.8869565217391304.
[32m[I 2023-04-26 00:17:03,327][39m Trial 406 finished with value: 0.8596491228070176 and parameters: {'criterion': 'gini', 'n_estimators': 155, 'max_features': 0.29019045893554957, 'max_depth': 67, 'min_samples_split': 2, 'min_samples_leaf': 3}. Best is trial 311 with value: 0.8869565217391304.
[32m[I 2023-04-26 00:17:03,453][39m Trial 407 finished with value: 0.8717948717948718 and parameters: {'criterion': 'gini', 'n_estimators': 164, 'max_features': 0.12258252888788007, 'max_depth': 70, 'min_samples_split': 2, 'min_samples_leaf': 3}. Best is trial 311 with value: 0.8869565217391304.
[32m[I 2023-04-26 00:17:03,570][39m Trial 408 finished with value: 0.8571428571428572 and parameters: {'criterion': 'entropy', 'n_estimators': 153, 'max_features': 0.3424647950739627, 'max_depth': 74, 'min_samples_split': 3, 'min_samples_leaf': 3}. Best is trial 311 with value: 0.8869565217391304.
[32m[I 2023-04-26 00:17:03,688][39m Trial 409 finished with value: 0.8695652173913043 and parameters: {'criterion': 'gini', 'n_estimators': 160, 'max_features': 0.3147208453736121, 'max_depth': 62, 'min_samples_split': 2, 'min_samples_leaf': 5}. Best is trial 311 with value: 0.8869565217391304.
[32m[I 2023-04-26 00:17:03,813][39m Trial 410 finished with value: 0.8620689655172413 and parameters: {'criterion': 'entropy', 'n_estimators': 156, 'max_features': 0.23029948105235226, 'max_depth': 71, 'min_samples_split': 3, 'min_samples_leaf': 3}. Best is trial 311 with value: 0.8869565217391304.
[32m[I 2023-04-26 00:17:03,936][39m Trial 411 finished with value: 0.8571428571428572 and parameters: {'criterion': 'entropy', 'n_estimators': 163, 'max_features': 0.1500813668778248, 'max_depth': 65, 'min_samples_split': 2, 'min_samples_leaf': 2}. Best is trial 311 with value: 0.8869565217391304.
[32m[I 2023-04-26 00:17:04,061][39m Trial 412 finished with value: 0.8448275862068967 and parameters: {'criterion': 'entropy', 'n_estimators': 167, 'max_features': 0.2176156908033892, 'max_depth': 68, 'min_samples_split': 3, 'min_samples_leaf': 3}. Best is trial 311 with value: 0.8869565217391304.
[32m[I 2023-04-26 00:17:04,188][39m Trial 413 finished with value: 0.8771929824561403 and parameters: {'criterion': 'entropy', 'n_estimators': 166, 'max_features': 0.43978890010130034, 'max_depth': 70, 'min_samples_split': 3, 'min_samples_leaf': 3}. Best is trial 311 with value: 0.8869565217391304.
[32m[I 2023-04-26 00:17:04,327][39m Trial 414 finished with value: 0.8672566371681416 and parameters: {'criterion': 'entropy', 'n_estimators': 178, 'max_features': 0.33065346999335743, 'max_depth': 64, 'min_samples_split': 3, 'min_samples_leaf': 4}. Best is trial 311 with value: 0.8869565217391304.
[32m[I 2023-04-26 00:17:04,446][39m Trial 415 finished with value: 0.8793103448275863 and parameters: {'criterion': 'entropy', 'n_estimators': 147, 'max_features': 0.25069858655011645, 'max_depth': 67, 'min_samples_split': 3, 'min_samples_leaf': 3}. Best is trial 311 with value: 0.8869565217391304.
[32m[I 2023-04-26 00:17:04,564][39m Trial 416 finished with value: 0.8672566371681416 and parameters: {'criterion': 'entropy', 'n_estimators': 146, 'max_features': 0.2605689869857902, 'max_depth': 53, 'min_samples_split': 3, 'min_samples_leaf': 3}. Best is trial 311 with value: 0.8869565217391304.
[32m[I 2023-04-26 00:17:04,688][39m Trial 417 finished with value: 0.8695652173913043 and parameters: {'criterion': 'gini', 'n_estimators': 173, 'max_features': 0.30288133619854807, 'max_depth': 60, 'min_samples_split': 4, 'min_samples_leaf': 3}. Best is trial 311 with value: 0.8869565217391304.
[32m[I 2023-04-26 00:17:04,806][39m Trial 418 finished with value: 0.864406779661017 and parameters: {'criterion': 'entropy', 'n_estimators': 151, 'max_features': 0.17294743500135706, 'max_depth': 73, 'min_samples_split': 3, 'min_samples_leaf': 3}. Best is trial 311 with value: 0.8869565217391304.
[32m[I 2023-04-26 00:17:04,936][39m Trial 419 finished with value: 0.8672566371681416 and parameters: {'criterion': 'entropy', 'n_estimators': 164, 'max_features': 0.23498980485231147, 'max_depth': 68, 'min_samples_split': 3, 'min_samples_leaf': 4}. Best is trial 311 with value: 0.8869565217391304.
[32m[I 2023-04-26 00:17:05,055][39m Trial 420 finished with value: 0.8695652173913043 and parameters: {'criterion': 'entropy', 'n_estimators': 144, 'max_features': 0.2605850993755728, 'max_depth': 63, 'min_samples_split': 3, 'min_samples_leaf': 3}. Best is trial 311 with value: 0.8869565217391304.
[32m[I 2023-04-26 00:17:05,167][39m Trial 421 finished with value: 0.8521739130434783 and parameters: {'criterion': 'entropy', 'n_estimators': 148, 'max_features': 0.2798416505179402, 'max_depth': 57, 'min_samples_split': 3, 'min_samples_leaf': 3}. Best is trial 311 with value: 0.8869565217391304.
[32m[I 2023-04-26 00:17:05,292][39m Trial 422 finished with value: 0.8524590163934426 and parameters: {'criterion': 'entropy', 'n_estimators': 158, 'max_features': 0.21374868276433934, 'max_depth': 66, 'min_samples_split': 3, 'min_samples_leaf': 2}. Best is trial 311 with value: 0.8869565217391304.
[32m[I 2023-04-26 00:17:05,419][39m Trial 423 finished with value: 0.8571428571428572 and parameters: {'criterion': 'entropy', 'n_estimators': 162, 'max_features': 0.2456480275029891, 'max_depth': 65, 'min_samples_split': 3, 'min_samples_leaf': 4}. Best is trial 311 with value: 0.8869565217391304.
[32m[I 2023-04-26 00:17:05,544][39m Trial 424 finished with value: 0.8596491228070176 and parameters: {'criterion': 'entropy', 'n_estimators': 158, 'max_features': 0.25089004870599435, 'max_depth': 63, 'min_samples_split': 3, 'min_samples_leaf': 3}. Best is trial 311 with value: 0.8869565217391304.
[32m[I 2023-04-26 00:17:05,654][39m Trial 425 finished with value: 0.8695652173913043 and parameters: {'criterion': 'gini', 'n_estimators': 142, 'max_features': 0.2697667117438627, 'max_depth': 63, 'min_samples_split': 3, 'min_samples_leaf': 3}. Best is trial 311 with value: 0.8869565217391304.
[32m[I 2023-04-26 00:17:05,765][39m Trial 426 finished with value: 0.8771929824561403 and parameters: {'criterion': 'gini', 'n_estimators': 140, 'max_features': 0.23461047287507442, 'max_depth': 67, 'min_samples_split': 3, 'min_samples_leaf': 3}. Best is trial 311 with value: 0.8869565217391304.
[32m[I 2023-04-26 00:17:05,879][39m Trial 427 finished with value: 0.8672566371681416 and parameters: {'criterion': 'gini', 'n_estimators': 145, 'max_features': 0.22977796557778316, 'max_depth': 58, 'min_samples_split': 2, 'min_samples_leaf': 3}. Best is trial 311 with value: 0.8869565217391304.
[32m[I 2023-04-26 00:17:05,997][39m Trial 428 finished with value: 0.8448275862068967 and parameters: {'criterion': 'gini', 'n_estimators': 150, 'max_features': 0.20136411922616937, 'max_depth': 72, 'min_samples_split': 3, 'min_samples_leaf': 3}. Best is trial 311 with value: 0.8869565217391304.
[32m[I 2023-04-26 00:17:06,105][39m Trial 429 finished with value: 0.8672566371681416 and parameters: {'criterion': 'gini', 'n_estimators': 147, 'max_features': 0.3133894200214057, 'max_depth': 75, 'min_samples_split': 2, 'min_samples_leaf': 3}. Best is trial 311 with value: 0.8869565217391304.
[32m[I 2023-04-26 00:17:06,238][39m Trial 430 finished with value: 0.8672566371681416 and parameters: {'criterion': 'entropy', 'n_estimators': 160, 'max_features': 0.35515423391866385, 'max_depth': 66, 'min_samples_split': 5, 'min_samples_leaf': 2}. Best is trial 311 with value: 0.8869565217391304.
[32m[I 2023-04-26 00:17:06,362][39m Trial 431 finished with value: 0.8571428571428572 and parameters: {'criterion': 'entropy', 'n_estimators': 169, 'max_features': 0.27183221950211267, 'max_depth': 61, 'min_samples_split': 8, 'min_samples_leaf': 7}. Best is trial 311 with value: 0.8869565217391304.
[32m[I 2023-04-26 00:17:06,480][39m Trial 432 finished with value: 0.8695652173913043 and parameters: {'criterion': 'gini', 'n_estimators': 155, 'max_features': 0.24197510663371313, 'max_depth': 76, 'min_samples_split': 3, 'min_samples_leaf': 3}. Best is trial 311 with value: 0.8869565217391304.
[32m[I 2023-04-26 00:17:06,595][39m Trial 433 finished with value: 0.8596491228070176 and parameters: {'criterion': 'gini', 'n_estimators': 151, 'max_features': 0.255540718388993, 'max_depth': 37, 'min_samples_split': 4, 'min_samples_leaf': 4}. Best is trial 311 with value: 0.8869565217391304.
[32m[I 2023-04-26 00:17:06,709][39m Trial 434 finished with value: 0.8695652173913043 and parameters: {'criterion': 'gini', 'n_estimators': 155, 'max_features': 0.3124168473123946, 'max_depth': 18, 'min_samples_split': 4, 'min_samples_leaf': 3}. Best is trial 311 with value: 0.8869565217391304.
[32m[I 2023-04-26 00:17:06,828][39m Trial 435 finished with value: 0.8672566371681416 and parameters: {'criterion': 'entropy', 'n_estimators': 148, 'max_features': 0.2906235399954203, 'max_depth': 64, 'min_samples_split': 3, 'min_samples_leaf': 3}. Best is trial 311 with value: 0.8869565217391304.
[32m[I 2023-04-26 00:17:06,947][39m Trial 436 finished with value: 0.8596491228070176 and parameters: {'criterion': 'entropy', 'n_estimators': 153, 'max_features': 0.33125252251801257, 'max_depth': 70, 'min_samples_split': 3, 'min_samples_leaf': 3}. Best is trial 311 with value: 0.8869565217391304.
[32m[I 2023-04-26 00:17:07,071][39m Trial 437 finished with value: 0.8648648648648648 and parameters: {'criterion': 'entropy', 'n_estimators': 154, 'max_features': 0.3537610163286339, 'max_depth': 72, 'min_samples_split': 11, 'min_samples_leaf': 3}. Best is trial 311 with value: 0.8869565217391304.
