[32m[I 2023-04-26 00:16:30,049][39m Trial 146 finished with value: 0.8596491228070176 and parameters: {'criterion': 'entropy', 'n_estimators': 166, 'max_features': 0.21239767082183852, 'max_depth': 66, 'min_samples_split': 3, 'min_samples_leaf': 8}. Best is trial 25 with value: 0.8793103448275863.
[32m[I 2023-04-26 00:16:30,168][39m Trial 147 finished with value: 0.8672566371681416 and parameters: {'criterion': 'entropy', 'n_estimators': 145, 'max_features': 0.30745924703858185, 'max_depth': 73, 'min_samples_split': 6, 'min_samples_leaf': 4}. Best is trial 25 with value: 0.8793103448275863.
[32m[I 2023-04-26 00:16:30,297][39m Trial 148 finished with value: 0.8521739130434783 and parameters: {'criterion': 'entropy', 'n_estimators': 152, 'max_features': 0.2686962018166687, 'max_depth': 82, 'min_samples_split': 6, 'min_samples_leaf': 3}. Best is trial 25 with value: 0.8793103448275863.
[32m[I 2023-04-26 00:16:30,429][39m Trial 149 finished with value: 0.8672566371681416 and parameters: {'criterion': 'entropy', 'n_estimators': 158, 'max_features': 0.3968927644237692, 'max_depth': 68, 'min_samples_split': 2, 'min_samples_leaf': 3}. Best is trial 25 with value: 0.8793103448275863.
[32m[I 2023-04-26 00:16:30,564][39m Trial 150 finished with value: 0.8403361344537814 and parameters: {'criterion': 'entropy', 'n_estimators': 165, 'max_features': 0.3258918163320907, 'max_depth': 77, 'min_samples_split': 3, 'min_samples_leaf': 2}. Best is trial 25 with value: 0.8793103448275863.
[32m[I 2023-04-26 00:16:30,710][39m Trial 151 finished with value: 0.8571428571428572 and parameters: {'criterion': 'entropy', 'n_estimators': 145, 'max_features': 0.44083390044023396, 'max_depth': 70, 'min_samples_split': 2, 'min_samples_leaf': 3}. Best is trial 25 with value: 0.8793103448275863.
[32m[I 2023-04-26 00:16:30,853][39m Trial 152 finished with value: 0.875 and parameters: {'criterion': 'entropy', 'n_estimators': 149, 'max_features': 0.374417566735133, 'max_depth': 87, 'min_samples_split': 3, 'min_samples_leaf': 3}. Best is trial 25 with value: 0.8793103448275863.
[32m[I 2023-04-26 00:16:30,967][39m Trial 153 finished with value: 0.875 and parameters: {'criterion': 'entropy', 'n_estimators': 132, 'max_features': 0.5983388752703218, 'max_depth': 90, 'min_samples_split': 3, 'min_samples_leaf': 3}. Best is trial 25 with value: 0.8793103448275863.
[32m[I 2023-04-26 00:16:31,094][39m Trial 154 finished with value: 0.8495575221238938 and parameters: {'criterion': 'entropy', 'n_estimators': 133, 'max_features': 0.6138343876210578, 'max_depth': 93, 'min_samples_split': 3, 'min_samples_leaf': 3}. Best is trial 25 with value: 0.8793103448275863.
[32m[I 2023-04-26 00:16:31,209][39m Trial 155 finished with value: 0.8468468468468469 and parameters: {'criterion': 'entropy', 'n_estimators': 130, 'max_features': 0.53713326094148, 'max_depth': 88, 'min_samples_split': 3, 'min_samples_leaf': 3}. Best is trial 25 with value: 0.8793103448275863.
[32m[I 2023-04-26 00:16:31,328][39m Trial 156 finished with value: 0.8440366972477066 and parameters: {'criterion': 'entropy', 'n_estimators': 137, 'max_features': 0.6470168079390072, 'max_depth': 97, 'min_samples_split': 3, 'min_samples_leaf': 3}. Best is trial 25 with value: 0.8793103448275863.
[32m[I 2023-04-26 00:16:31,462][39m Trial 157 finished with value: 0.8448275862068967 and parameters: {'criterion': 'entropy', 'n_estimators': 148, 'max_features': 0.460624037667386, 'max_depth': 87, 'min_samples_split': 3, 'min_samples_leaf': 2}. Best is trial 25 with value: 0.8793103448275863.
[32m[I 2023-04-26 00:16:31,597][39m Trial 158 finished with value: 0.8571428571428572 and parameters: {'criterion': 'entropy', 'n_estimators': 161, 'max_features': 0.37426668689814346, 'max_depth': 91, 'min_samples_split': 4, 'min_samples_leaf': 3}. Best is trial 25 with value: 0.8793103448275863.
[32m[I 2023-04-26 00:16:31,727][39m Trial 159 finished with value: 0.8571428571428572 and parameters: {'criterion': 'entropy', 'n_estimators': 142, 'max_features': 0.6092885097726152, 'max_depth': 86, 'min_samples_split': 3, 'min_samples_leaf': 2}. Best is trial 25 with value: 0.8793103448275863.
[32m[I 2023-04-26 00:16:31,828][39m Trial 160 finished with value: 0.7927927927927928 and parameters: {'criterion': 'gini', 'n_estimators': 122, 'max_features': 0.34510255482303337, 'max_depth': 89, 'min_samples_split': 3, 'min_samples_leaf': 1}. Best is trial 25 with value: 0.8793103448275863.
[32m[I 2023-04-26 00:16:31,963][39m Trial 161 finished with value: 0.8793103448275863 and parameters: {'criterion': 'entropy', 'n_estimators': 154, 'max_features': 0.41353464148438235, 'max_depth': 68, 'min_samples_split': 3, 'min_samples_leaf': 3}. Best is trial 25 with value: 0.8793103448275863.
[32m[I 2023-04-26 00:16:32,092][39m Trial 162 finished with value: 0.8771929824561403 and parameters: {'criterion': 'entropy', 'n_estimators': 153, 'max_features': 0.42930380125942236, 'max_depth': 68, 'min_samples_split': 3, 'min_samples_leaf': 3}. Best is trial 25 with value: 0.8793103448275863.
[32m[I 2023-04-26 00:16:32,226][39m Trial 163 finished with value: 0.8771929824561403 and parameters: {'criterion': 'entropy', 'n_estimators': 153, 'max_features': 0.4141451122723137, 'max_depth': 65, 'min_samples_split': 3, 'min_samples_leaf': 3}. Best is trial 25 with value: 0.8793103448275863.
[32m[I 2023-04-26 00:16:32,356][39m Trial 164 finished with value: 0.8571428571428572 and parameters: {'criterion': 'entropy', 'n_estimators': 154, 'max_features': 0.4129252185987022, 'max_depth': 65, 'min_samples_split': 3, 'min_samples_leaf': 3}. Best is trial 25 with value: 0.8793103448275863.
[32m[I 2023-04-26 00:16:32,482][39m Trial 165 finished with value: 0.8545454545454546 and parameters: {'criterion': 'entropy', 'n_estimators': 150, 'max_features': 0.42843552228206083, 'max_depth': 64, 'min_samples_split': 3, 'min_samples_leaf': 3}. Best is trial 25 with value: 0.8793103448275863.
[32m[I 2023-04-26 00:16:32,621][39m Trial 166 finished with value: 0.8571428571428572 and parameters: {'criterion': 'entropy', 'n_estimators': 158, 'max_features': 0.4923846233548843, 'max_depth': 68, 'min_samples_split': 3, 'min_samples_leaf': 3}. Best is trial 25 with value: 0.8793103448275863.
[32m[I 2023-04-26 00:16:32,731][39m Trial 167 finished with value: 0.8571428571428572 and parameters: {'criterion': 'entropy', 'n_estimators': 132, 'max_features': 0.39337891591905344, 'max_depth': 66, 'min_samples_split': 3, 'min_samples_leaf': 3}. Best is trial 25 with value: 0.8793103448275863.
[32m[I 2023-04-26 00:16:32,865][39m Trial 168 finished with value: 0.8648648648648648 and parameters: {'criterion': 'entropy', 'n_estimators': 151, 'max_features': 0.45921164464346115, 'max_depth': 91, 'min_samples_split': 3, 'min_samples_leaf': 3}. Best is trial 25 with value: 0.8793103448275863.
[32m[I 2023-04-26 00:16:32,984][39m Trial 169 finished with value: 0.8648648648648648 and parameters: {'criterion': 'entropy', 'n_estimators': 135, 'max_features': 0.5368824435983642, 'max_depth': 84, 'min_samples_split': 3, 'min_samples_leaf': 4}. Best is trial 25 with value: 0.8793103448275863.
[32m[I 2023-04-26 00:16:33,107][39m Trial 170 finished with value: 0.8672566371681416 and parameters: {'criterion': 'entropy', 'n_estimators': 147, 'max_features': 0.4145608682257078, 'max_depth': 61, 'min_samples_split': 2, 'min_samples_leaf': 3}. Best is trial 25 with value: 0.8793103448275863.
[32m[I 2023-04-26 00:16:33,238][39m Trial 171 finished with value: 0.8771929824561403 and parameters: {'criterion': 'entropy', 'n_estimators': 154, 'max_features': 0.3736371901193819, 'max_depth': 69, 'min_samples_split': 3, 'min_samples_leaf': 3}. Best is trial 25 with value: 0.8793103448275863.
[32m[I 2023-04-26 00:16:33,370][39m Trial 172 finished with value: 0.8672566371681416 and parameters: {'criterion': 'entropy', 'n_estimators': 162, 'max_features': 0.37790576643427604, 'max_depth': 68, 'min_samples_split': 3, 'min_samples_leaf': 3}. Best is trial 25 with value: 0.8793103448275863.
[32m[I 2023-04-26 00:16:33,503][39m Trial 173 finished with value: 0.8571428571428572 and parameters: {'criterion': 'entropy', 'n_estimators': 154, 'max_features': 0.4438301058678472, 'max_depth': 72, 'min_samples_split': 3, 'min_samples_leaf': 3}. Best is trial 25 with value: 0.8793103448275863.
[32m[I 2023-04-26 00:16:33,644][39m Trial 174 finished with value: 0.8672566371681416 and parameters: {'criterion': 'entropy', 'n_estimators': 158, 'max_features': 0.3660662945690739, 'max_depth': 70, 'min_samples_split': 3, 'min_samples_leaf': 3}. Best is trial 25 with value: 0.8793103448275863.
[32m[I 2023-04-26 00:16:33,777][39m Trial 175 finished with value: 0.8672566371681416 and parameters: {'criterion': 'entropy', 'n_estimators': 156, 'max_features': 0.4239771927578645, 'max_depth': 96, 'min_samples_split': 4, 'min_samples_leaf': 3}. Best is trial 25 with value: 0.8793103448275863.
[32m[I 2023-04-26 00:16:33,889][39m Trial 176 finished with value: 0.8648648648648648 and parameters: {'criterion': 'entropy', 'n_estimators': 128, 'max_features': 0.511246507096935, 'max_depth': 64, 'min_samples_split': 2, 'min_samples_leaf': 3}. Best is trial 25 with value: 0.8793103448275863.
[32m[I 2023-04-26 00:16:34,005][39m Trial 177 finished with value: 0.8495575221238938 and parameters: {'criterion': 'entropy', 'n_estimators': 139, 'max_features': 0.3995743148027634, 'max_depth': 23, 'min_samples_split': 3, 'min_samples_leaf': 4}. Best is trial 25 with value: 0.8793103448275863.
[32m[I 2023-04-26 00:16:34,122][39m Trial 178 finished with value: 0.8672566371681416 and parameters: {'criterion': 'entropy', 'n_estimators': 143, 'max_features': 0.24077401639520682, 'max_depth': 67, 'min_samples_split': 2, 'min_samples_leaf': 3}. Best is trial 25 with value: 0.8793103448275863.
[32m[I 2023-04-26 00:16:34,256][39m Trial 179 finished with value: 0.8571428571428572 and parameters: {'criterion': 'entropy', 'n_estimators': 150, 'max_features': 0.34685071787153776, 'max_depth': 73, 'min_samples_split': 3, 'min_samples_leaf': 3}. Best is trial 25 with value: 0.8793103448275863.
[32m[I 2023-04-26 00:16:34,398][39m Trial 180 finished with value: 0.8545454545454546 and parameters: {'criterion': 'entropy', 'n_estimators': 153, 'max_features': 0.5888959488995787, 'max_depth': 69, 'min_samples_split': 8, 'min_samples_leaf': 3}. Best is trial 25 with value: 0.8793103448275863.
[32m[I 2023-04-26 00:16:34,530][39m Trial 181 finished with value: 0.8571428571428572 and parameters: {'criterion': 'entropy', 'n_estimators': 160, 'max_features': 0.370008107802836, 'max_depth': 72, 'min_samples_split': 3, 'min_samples_leaf': 3}. Best is trial 25 with value: 0.8793103448275863.
[32m[I 2023-04-26 00:16:34,658][39m Trial 182 finished with value: 0.8571428571428572 and parameters: {'criterion': 'entropy', 'n_estimators': 154, 'max_features': 0.31799789367547915, 'max_depth': 70, 'min_samples_split': 4, 'min_samples_leaf': 2}. Best is trial 25 with value: 0.8793103448275863.
[32m[I 2023-04-26 00:16:34,787][39m Trial 183 finished with value: 0.8571428571428572 and parameters: {'criterion': 'entropy', 'n_estimators': 157, 'max_features': 0.4038375875907601, 'max_depth': 66, 'min_samples_split': 3, 'min_samples_leaf': 3}. Best is trial 25 with value: 0.8793103448275863.
[32m[I 2023-04-26 00:16:34,926][39m Trial 184 finished with value: 0.8448275862068967 and parameters: {'criterion': 'entropy', 'n_estimators': 162, 'max_features': 0.38378616613114597, 'max_depth': 75, 'min_samples_split': 3, 'min_samples_leaf': 2}. Best is trial 25 with value: 0.8793103448275863.
[32m[I 2023-04-26 00:16:35,061][39m Trial 185 finished with value: 0.8275862068965517 and parameters: {'criterion': 'entropy', 'n_estimators': 168, 'max_features': 0.338605073645594, 'max_depth': 71, 'min_samples_split': 3, 'min_samples_leaf': 10}. Best is trial 25 with value: 0.8793103448275863.
[32m[I 2023-04-26 00:16:35,182][39m Trial 186 finished with value: 0.8717948717948718 and parameters: {'criterion': 'entropy', 'n_estimators': 147, 'max_features': 0.2898956026186908, 'max_depth': 68, 'min_samples_split': 2, 'min_samples_leaf': 2}. Best is trial 25 with value: 0.8793103448275863.
[32m[I 2023-04-26 00:16:35,308][39m Trial 187 finished with value: 0.8672566371681416 and parameters: {'criterion': 'entropy', 'n_estimators': 146, 'max_features': 0.4362994653159843, 'max_depth': 65, 'min_samples_split': 2, 'min_samples_leaf': 3}. Best is trial 25 with value: 0.8793103448275863.
[32m[I 2023-04-26 00:16:35,420][39m Trial 188 finished with value: 0.8495575221238938 and parameters: {'criterion': 'entropy', 'n_estimators': 136, 'max_features': 0.013240331064836852, 'max_depth': 62, 'min_samples_split': 2, 'min_samples_leaf': 4}. Best is trial 25 with value: 0.8793103448275863.
[32m[I 2023-04-26 00:16:35,555][39m Trial 189 finished with value: 0.8545454545454546 and parameters: {'criterion': 'entropy', 'n_estimators': 149, 'max_features': 0.5641281871568383, 'max_depth': 68, 'min_samples_split': 2, 'min_samples_leaf': 3}. Best is trial 25 with value: 0.8793103448275863.
[32m[I 2023-04-26 00:16:35,690][39m Trial 190 finished with value: 0.8771929824561403 and parameters: {'criterion': 'gini', 'n_estimators': 172, 'max_features': 0.27964181904832214, 'max_depth': 64, 'min_samples_split': 2, 'min_samples_leaf': 3}. Best is trial 25 with value: 0.8793103448275863.
[32m[I 2023-04-26 00:16:35,817][39m Trial 191 finished with value: 0.8547008547008546 and parameters: {'criterion': 'gini', 'n_estimators': 155, 'max_features': 0.2574178214615396, 'max_depth': 64, 'min_samples_split': 2, 'min_samples_leaf': 3}. Best is trial 25 with value: 0.8793103448275863.
[32m[I 2023-04-26 00:16:35,962][39m Trial 192 finished with value: 0.8596491228070176 and parameters: {'criterion': 'gini', 'n_estimators': 183, 'max_features': 0.28737915712621376, 'max_depth': 68, 'min_samples_split': 2, 'min_samples_leaf': 3}. Best is trial 25 with value: 0.8793103448275863.
[32m[I 2023-04-26 00:16:36,083][39m Trial 193 finished with value: 0.8771929824561403 and parameters: {'criterion': 'gini', 'n_estimators': 151, 'max_features': 0.30911124993691186, 'max_depth': 66, 'min_samples_split': 2, 'min_samples_leaf': 3}. Best is trial 25 with value: 0.8793103448275863.
[32m[I 2023-04-26 00:16:36,199][39m Trial 194 finished with value: 0.8547008547008546 and parameters: {'criterion': 'gini', 'n_estimators': 142, 'max_features': 0.27790884643101194, 'max_depth': 62, 'min_samples_split': 2, 'min_samples_leaf': 3}. Best is trial 25 with value: 0.8793103448275863.
[32m[I 2023-04-26 00:16:36,338][39m Trial 195 finished with value: 0.8771929824561403 and parameters: {'criterion': 'gini', 'n_estimators': 175, 'max_features': 0.31265177365890107, 'max_depth': 59, 'min_samples_split': 2, 'min_samples_leaf': 3}. Best is trial 25 with value: 0.8793103448275863.
[32m[I 2023-04-26 00:16:36,487][39m Trial 196 finished with value: 0.8672566371681416 and parameters: {'criterion': 'gini', 'n_estimators': 179, 'max_features': 0.3012079539828757, 'max_depth': 60, 'min_samples_split': 2, 'min_samples_leaf': 3}. Best is trial 25 with value: 0.8793103448275863.
[32m[I 2023-04-26 00:16:36,644][39m Trial 197 finished with value: 0.8571428571428572 and parameters: {'criterion': 'gini', 'n_estimators': 175, 'max_features': 0.32001192026561803, 'max_depth': 58, 'min_samples_split': 2, 'min_samples_leaf': 3}. Best is trial 25 with value: 0.8793103448275863.
[32m[I 2023-04-26 00:16:36,766][39m Trial 198 finished with value: 0.8571428571428572 and parameters: {'criterion': 'gini', 'n_estimators': 132, 'max_features': 0.4727850794068285, 'max_depth': 54, 'min_samples_split': 2, 'min_samples_leaf': 3}. Best is trial 25 with value: 0.8793103448275863.
[32m[I 2023-04-26 00:16:36,913][39m Trial 199 finished with value: 0.8672566371681416 and parameters: {'criterion': 'gini', 'n_estimators': 179, 'max_features': 0.2866989093075683, 'max_depth': 66, 'min_samples_split': 2, 'min_samples_leaf': 4}. Best is trial 25 with value: 0.8793103448275863.
[32m[I 2023-04-26 00:16:37,054][39m Trial 200 finished with value: 0.8620689655172413 and parameters: {'criterion': 'gini', 'n_estimators': 171, 'max_features': 0.3093162409198966, 'max_depth': 63, 'min_samples_split': 2, 'min_samples_leaf': 3}. Best is trial 25 with value: 0.8793103448275863.
[32m[I 2023-04-26 00:16:37,198][39m Trial 201 finished with value: 0.8571428571428572 and parameters: {'criterion': 'gini', 'n_estimators': 175, 'max_features': 0.33016575485124816, 'max_depth': 65, 'min_samples_split': 2, 'min_samples_leaf': 3}. Best is trial 25 with value: 0.8793103448275863.
[32m[I 2023-04-26 00:16:37,340][39m Trial 202 finished with value: 0.8672566371681416 and parameters: {'criterion': 'gini', 'n_estimators': 173, 'max_features': 0.3571468993972106, 'max_depth': 60, 'min_samples_split': 2, 'min_samples_leaf': 3}. Best is trial 25 with value: 0.8793103448275863.
[32m[I 2023-04-26 00:16:37,468][39m Trial 203 finished with value: 0.8771929824561403 and parameters: {'criterion': 'gini', 'n_estimators': 165, 'max_features': 0.39350585237405133, 'max_depth': 67, 'min_samples_split': 2, 'min_samples_leaf': 3}. Best is trial 25 with value: 0.8793103448275863.
[32m[I 2023-04-26 00:16:37,617][39m Trial 204 finished with value: 0.8392857142857144 and parameters: {'criterion': 'gini', 'n_estimators': 168, 'max_features': 0.7022879696532509, 'max_depth': 67, 'min_samples_split': 2, 'min_samples_leaf': 3}. Best is trial 25 with value: 0.8793103448275863.
[32m[I 2023-04-26 00:16:37,738][39m Trial 205 finished with value: 0.7833333333333333 and parameters: {'criterion': 'gini', 'n_estimators': 164, 'max_features': 0.4195959252456896, 'max_depth': 1, 'min_samples_split': 2, 'min_samples_leaf': 3}. Best is trial 25 with value: 0.8793103448275863.
[32m[I 2023-04-26 00:16:37,863][39m Trial 206 finished with value: 0.8521739130434783 and parameters: {'criterion': 'gini', 'n_estimators': 151, 'max_features': 0.3899600865703692, 'max_depth': 69, 'min_samples_split': 2, 'min_samples_leaf': 3}. Best is trial 25 with value: 0.8793103448275863.
[32m[I 2023-04-26 00:16:37,986][39m Trial 207 finished with value: 0.8468468468468469 and parameters: {'criterion': 'gini', 'n_estimators': 146, 'max_features': 0.4521203630242197, 'max_depth': 63, 'min_samples_split': 2, 'min_samples_leaf': 3}. Best is trial 25 with value: 0.8793103448275863.
[32m[I 2023-04-26 00:16:38,102][39m Trial 208 finished with value: 0.8571428571428572 and parameters: {'criterion': 'gini', 'n_estimators': 138, 'max_features': 0.4082781112539626, 'max_depth': 56, 'min_samples_split': 2, 'min_samples_leaf': 3}. Best is trial 25 with value: 0.8793103448275863.
[32m[I 2023-04-26 00:16:38,209][39m Trial 209 finished with value: 0.8347826086956522 and parameters: {'criterion': 'gini', 'n_estimators': 129, 'max_features': 0.37346198010442566, 'max_depth': 65, 'min_samples_split': 11, 'min_samples_leaf': 4}. Best is trial 25 with value: 0.8793103448275863.
[32m[I 2023-04-26 00:16:38,315][39m Trial 210 finished with value: 0.8695652173913043 and parameters: {'criterion': 'gini', 'n_estimators': 126, 'max_features': 0.3004219646388353, 'max_depth': 90, 'min_samples_split': 3, 'min_samples_leaf': 3}. Best is trial 25 with value: 0.8793103448275863.
[32m[I 2023-04-26 00:16:38,452][39m Trial 211 finished with value: 0.8347826086956522 and parameters: {'criterion': 'gini', 'n_estimators': 171, 'max_features': 0.3564618105747646, 'max_depth': 71, 'min_samples_split': 3, 'min_samples_leaf': 6}. Best is trial 25 with value: 0.8793103448275863.
[32m[I 2023-04-26 00:16:38,579][39m Trial 212 finished with value: 0.8596491228070176 and parameters: {'criterion': 'gini', 'n_estimators': 157, 'max_features': 0.2643378038142562, 'max_depth': 69, 'min_samples_split': 2, 'min_samples_leaf': 3}. Best is trial 25 with value: 0.8793103448275863.
[32m[I 2023-04-26 00:16:38,705][39m Trial 213 finished with value: 0.8275862068965517 and parameters: {'criterion': 'entropy', 'n_estimators': 151, 'max_features': 0.23237750057666684, 'max_depth': 67, 'min_samples_split': 2, 'min_samples_leaf': 2}. Best is trial 25 with value: 0.8793103448275863.
[32m[I 2023-04-26 00:16:38,842][39m Trial 214 finished with value: 0.8672566371681416 and parameters: {'criterion': 'entropy', 'n_estimators': 160, 'max_features': 0.3904164534088314, 'max_depth': 71, 'min_samples_split': 3, 'min_samples_leaf': 3}. Best is trial 25 with value: 0.8793103448275863.
[32m[I 2023-04-26 00:16:38,975][39m Trial 215 finished with value: 0.8695652173913043 and parameters: {'criterion': 'entropy', 'n_estimators': 164, 'max_features': 0.3221588849680604, 'max_depth': 67, 'min_samples_split': 3, 'min_samples_leaf': 3}. Best is trial 25 with value: 0.8793103448275863.
[32m[I 2023-04-26 00:16:39,098][39m Trial 216 finished with value: 0.8771929824561403 and parameters: {'criterion': 'entropy', 'n_estimators': 148, 'max_features': 0.28130961815911637, 'max_depth': 69, 'min_samples_split': 2, 'min_samples_leaf': 3}. Best is trial 25 with value: 0.8793103448275863.
[32m[I 2023-04-26 00:16:39,225][39m Trial 217 finished with value: 0.8495575221238938 and parameters: {'criterion': 'entropy', 'n_estimators': 148, 'max_features': 0.28085115758569373, 'max_depth': 64, 'min_samples_split': 2, 'min_samples_leaf': 3}. Best is trial 25 with value: 0.8793103448275863.
[32m[I 2023-04-26 00:16:39,360][39m Trial 218 finished with value: 0.8545454545454546 and parameters: {'criterion': 'entropy', 'n_estimators': 145, 'max_features': 0.651035609263197, 'max_depth': 69, 'min_samples_split': 2, 'min_samples_leaf': 3}. Best is trial 25 with value: 0.8793103448275863.
