
[32m[I 2023-04-23 18:39:26,842][39m A new study created in memory with name: no-name-dbecaca3-753c-46f8-8744-2b194f923fbe
[32m[I 2023-04-23 18:39:33,313][39m Trial 0 finished with value: 0.7999999999999999 and parameters: {'objective': 'CrossEntropy', 'colsample_bylevel': 0.014322727214364634, 'depth': 4, 'boosting_type': 'Ordered', 'bootstrap_type': 'MVS'}. Best is trial 0 with value: 0.7999999999999999.
[32m[I 2023-04-23 18:39:35,081][39m Trial 1 finished with value: 0.8099173553719008 and parameters: {'objective': 'CrossEntropy', 'colsample_bylevel': 0.013966099657790594, 'depth': 9, 'boosting_type': 'Plain', 'bootstrap_type': 'Bernoulli', 'subsample': 0.6594305766997315}. Best is trial 1 with value: 0.8099173553719008.
[32m[I 2023-04-23 18:39:36,818][39m Trial 2 finished with value: 0.8135593220338982 and parameters: {'objective': 'Logloss', 'colsample_bylevel': 0.06687958920499079, 'depth': 7, 'boosting_type': 'Plain', 'bootstrap_type': 'Bernoulli', 'subsample': 0.7055091947189467}. Best is trial 2 with value: 0.8135593220338982.
[32m[I 2023-04-23 18:39:38,528][39m Trial 3 finished with value: 0.8421052631578947 and parameters: {'objective': 'Logloss', 'colsample_bylevel': 0.09743168325992746, 'depth': 6, 'boosting_type': 'Plain', 'bootstrap_type': 'Bernoulli', 'subsample': 0.37804810880448125}. Best is trial 3 with value: 0.8421052631578947.
[32m[I 2023-04-23 18:39:45,518][39m Trial 4 finished with value: 0.8166666666666667 and parameters: {'objective': 'Logloss', 'colsample_bylevel': 0.06641714767203068, 'depth': 12, 'boosting_type': 'Ordered', 'bootstrap_type': 'Bernoulli', 'subsample': 0.5473350165884434}. Best is trial 3 with value: 0.8421052631578947.
[32m[I 2023-04-23 18:39:52,178][39m Trial 5 finished with value: 0.8196721311475409 and parameters: {'objective': 'Logloss', 'colsample_bylevel': 0.05431236690451239, 'depth': 4, 'boosting_type': 'Ordered', 'bootstrap_type': 'MVS'}. Best is trial 3 with value: 0.8421052631578947.
[32m[I 2023-04-23 18:39:53,636][39m Trial 6 finished with value: 0.8135593220338982 and parameters: {'objective': 'CrossEntropy', 'colsample_bylevel': 0.0788991051239292, 'depth': 7, 'boosting_type': 'Plain', 'bootstrap_type': 'MVS'}. Best is trial 3 with value: 0.8421052631578947.
[32m[I 2023-04-23 18:39:55,898][39m Trial 7 finished with value: 0.8196721311475409 and parameters: {'objective': 'Logloss', 'colsample_bylevel': 0.06463015973429677, 'depth': 12, 'boosting_type': 'Plain', 'bootstrap_type': 'MVS'}. Best is trial 3 with value: 0.8421052631578947.
[32m[I 2023-04-23 18:40:01,477][39m Trial 8 finished with value: 0.8275862068965517 and parameters: {'objective': 'CrossEntropy', 'colsample_bylevel': 0.09451674090184996, 'depth': 11, 'boosting_type': 'Ordered', 'bootstrap_type': 'MVS'}. Best is trial 3 with value: 0.8421052631578947.
[32m[I 2023-04-23 18:40:07,595][39m Trial 9 finished with value: 0.7874015748031497 and parameters: {'objective': 'Logloss', 'colsample_bylevel': 0.014401991824471907, 'depth': 5, 'boosting_type': 'Ordered', 'bootstrap_type': 'MVS'}. Best is trial 3 with value: 0.8421052631578947.
[32m[I 2023-04-23 18:40:09,354][39m Trial 10 finished with value: 0.8333333333333334 and parameters: {'objective': 'Logloss', 'colsample_bylevel': 0.09883203637344874, 'depth': 1, 'boosting_type': 'Plain', 'bootstrap_type': 'Bayesian', 'bagging_temperature': 5.426170685499481}. Best is trial 3 with value: 0.8421052631578947.
[32m[I 2023-04-23 18:40:11,022][39m Trial 11 finished with value: 0.8376068376068375 and parameters: {'objective': 'Logloss', 'colsample_bylevel': 0.09823471773146329, 'depth': 1, 'boosting_type': 'Plain', 'bootstrap_type': 'Bayesian', 'bagging_temperature': 5.452842354100807}. Best is trial 3 with value: 0.8421052631578947.
[32m[I 2023-04-23 18:40:12,523][39m Trial 12 finished with value: 0.8305084745762712 and parameters: {'objective': 'Logloss', 'colsample_bylevel': 0.08598961807596472, 'depth': 1, 'boosting_type': 'Plain', 'bootstrap_type': 'Bayesian', 'bagging_temperature': 9.269267054952257}. Best is trial 3 with value: 0.8421052631578947.
[32m[I 2023-04-23 18:40:14,124][39m Trial 13 finished with value: 0.8264462809917354 and parameters: {'objective': 'Logloss', 'colsample_bylevel': 0.03763083376506271, 'depth': 3, 'boosting_type': 'Plain', 'bootstrap_type': 'Bayesian', 'bagging_temperature': 0.4265871559555814}. Best is trial 3 with value: 0.8421052631578947.
[32m[I 2023-04-23 18:40:16,037][39m Trial 14 finished with value: 0.8468468468468469 and parameters: {'objective': 'Logloss', 'colsample_bylevel': 0.08366280271798725, 'depth': 9, 'boosting_type': 'Plain', 'bootstrap_type': 'Bayesian', 'bagging_temperature': 4.820586283063395}. Best is trial 14 with value: 0.8468468468468469.
[32m[I 2023-04-23 18:40:18,205][39m Trial 15 finished with value: 0.8376068376068375 and parameters: {'objective': 'Logloss', 'colsample_bylevel': 0.08110026744433002, 'depth': 9, 'boosting_type': 'Plain', 'bootstrap_type': 'Bernoulli', 'subsample': 0.10920891260199184}. Best is trial 14 with value: 0.8468468468468469.
[32m[I 2023-04-23 18:40:20,252][39m Trial 16 finished with value: 0.8305084745762712 and parameters: {'objective': 'Logloss', 'colsample_bylevel': 0.04774833373421497, 'depth': 9, 'boosting_type': 'Plain', 'bootstrap_type': 'Bayesian', 'bagging_temperature': 1.8507298483167118}. Best is trial 14 with value: 0.8468468468468469.
[32m[I 2023-04-23 18:40:21,630][39m Trial 17 finished with value: 0.8495575221238938 and parameters: {'objective': 'Logloss', 'colsample_bylevel': 0.08729998839788922, 'depth': 6, 'boosting_type': 'Plain', 'bootstrap_type': 'Bernoulli', 'subsample': 0.3158123421996786}. Best is trial 17 with value: 0.8495575221238938.
[32m[I 2023-04-23 18:40:23,324][39m Trial 18 finished with value: 0.8205128205128206 and parameters: {'objective': 'CrossEntropy', 'colsample_bylevel': 0.07440972647385237, 'depth': 8, 'boosting_type': 'Plain', 'bootstrap_type': 'Bernoulli', 'subsample': 0.9423590044466055}. Best is trial 17 with value: 0.8495575221238938.
[32m[I 2023-04-23 18:40:25,026][39m Trial 19 finished with value: 0.8571428571428572 and parameters: {'objective': 'Logloss', 'colsample_bylevel': 0.08617397031000064, 'depth': 10, 'boosting_type': 'Plain', 'bootstrap_type': 'Bayesian', 'bagging_temperature': 8.424016485951405}. Best is trial 19 with value: 0.8571428571428572.
[32m[I 2023-04-23 18:40:26,315][39m Trial 20 finished with value: 0.8376068376068375 and parameters: {'objective': 'Logloss', 'colsample_bylevel': 0.03920058217107584, 'depth': 11, 'boosting_type': 'Plain', 'bootstrap_type': 'Bernoulli', 'subsample': 0.19500144485874293}. Best is trial 19 with value: 0.8571428571428572.
[32m[I 2023-04-23 18:40:27,694][39m Trial 21 finished with value: 0.8571428571428572 and parameters: {'objective': 'Logloss', 'colsample_bylevel': 0.08920219522639962, 'depth': 10, 'boosting_type': 'Plain', 'bootstrap_type': 'Bayesian', 'bagging_temperature': 9.101758355062149}. Best is trial 19 with value: 0.8571428571428572.
[32m[I 2023-04-23 18:40:28,941][39m Trial 22 finished with value: 0.8672566371681416 and parameters: {'objective': 'Logloss', 'colsample_bylevel': 0.08935252527199165, 'depth': 10, 'boosting_type': 'Plain', 'bootstrap_type': 'Bayesian', 'bagging_temperature': 9.598777014030722}. Best is trial 22 with value: 0.8672566371681416.
[32m[I 2023-04-23 18:40:30,211][39m Trial 23 finished with value: 0.8596491228070176 and parameters: {'objective': 'Logloss', 'colsample_bylevel': 0.09030358002287349, 'depth': 10, 'boosting_type': 'Plain', 'bootstrap_type': 'Bayesian', 'bagging_temperature': 9.960824013022654}. Best is trial 22 with value: 0.8672566371681416.
[32m[I 2023-04-23 18:40:31,534][39m Trial 24 finished with value: 0.8596491228070176 and parameters: {'objective': 'Logloss', 'colsample_bylevel': 0.07370731866379754, 'depth': 11, 'boosting_type': 'Plain', 'bootstrap_type': 'Bayesian', 'bagging_temperature': 9.7013408350264}. Best is trial 22 with value: 0.8672566371681416.
[32m[I 2023-04-23 18:40:32,931][39m Trial 25 finished with value: 0.8571428571428572 and parameters: {'objective': 'Logloss', 'colsample_bylevel': 0.07811834706419878, 'depth': 11, 'boosting_type': 'Plain', 'bootstrap_type': 'Bayesian', 'bagging_temperature': 9.96786433968753}. Best is trial 22 with value: 0.8672566371681416.
[32m[I 2023-04-23 18:40:39,485][39m Trial 26 finished with value: 0.831858407079646 and parameters: {'objective': 'CrossEntropy', 'colsample_bylevel': 0.07097403822833641, 'depth': 10, 'boosting_type': 'Ordered', 'bootstrap_type': 'Bayesian', 'bagging_temperature': 7.4414322854296175}. Best is trial 22 with value: 0.8672566371681416.
[32m[I 2023-04-23 18:40:41,279][39m Trial 27 finished with value: 0.8421052631578947 and parameters: {'objective': 'Logloss', 'colsample_bylevel': 0.060503720891429275, 'depth': 8, 'boosting_type': 'Plain', 'bootstrap_type': 'Bayesian', 'bagging_temperature': 7.394472500199015}. Best is trial 22 with value: 0.8672566371681416.
[32m[I 2023-04-23 18:40:42,474][39m Trial 28 finished with value: 0.8571428571428572 and parameters: {'objective': 'Logloss', 'colsample_bylevel': 0.0924324408430198, 'depth': 12, 'boosting_type': 'Plain', 'bootstrap_type': 'Bayesian', 'bagging_temperature': 9.930761120780124}. Best is trial 22 with value: 0.8672566371681416.
[32m[I 2023-04-23 18:40:49,289][39m Trial 29 finished with value: 0.8596491228070176 and parameters: {'objective': 'CrossEntropy', 'colsample_bylevel': 0.07174974096583496, 'depth': 8, 'boosting_type': 'Ordered', 'bootstrap_type': 'Bayesian', 'bagging_temperature': 7.665523094261445}. Best is trial 22 with value: 0.8672566371681416.
[32m[I 2023-04-23 18:40:51,930][39m Trial 30 finished with value: 0.8521739130434783 and parameters: {'objective': 'CrossEntropy', 'colsample_bylevel': 0.05654540022560043, 'depth': 8, 'boosting_type': 'Ordered', 'bootstrap_type': 'Bayesian', 'bagging_temperature': 7.627751921036998}. Best is trial 22 with value: 0.8672566371681416.
[32m[I 2023-04-23 18:40:55,938][39m Trial 31 finished with value: 0.8521739130434783 and parameters: {'objective': 'CrossEntropy', 'colsample_bylevel': 0.07364036632306215, 'depth': 10, 'boosting_type': 'Ordered', 'bootstrap_type': 'Bayesian', 'bagging_temperature': 8.689676932043975}. Best is trial 22 with value: 0.8672566371681416.
[32m[I 2023-04-23 18:41:00,205][39m Trial 32 finished with value: 0.8521739130434783 and parameters: {'objective': 'CrossEntropy', 'colsample_bylevel': 0.07724663073659044, 'depth': 11, 'boosting_type': 'Ordered', 'bootstrap_type': 'Bayesian', 'bagging_temperature': 9.959956565147397}. Best is trial 22 with value: 0.8672566371681416.
[32m[I 2023-04-23 18:41:04,326][39m Trial 33 finished with value: 0.8376068376068375 and parameters: {'objective': 'CrossEntropy', 'colsample_bylevel': 0.09210825204219884, 'depth': 8, 'boosting_type': 'Ordered', 'bootstrap_type': 'Bayesian', 'bagging_temperature': 8.134415572779439}. Best is trial 22 with value: 0.8672566371681416.
[32m[I 2023-04-23 18:41:08,234][39m Trial 34 finished with value: 0.8495575221238938 and parameters: {'objective': 'CrossEntropy', 'colsample_bylevel': 0.0702141409185626, 'depth': 10, 'boosting_type': 'Ordered', 'bootstrap_type': 'Bayesian', 'bagging_temperature': 6.258395227896431}. Best is trial 22 with value: 0.8672566371681416.
[32m[I 2023-04-23 18:41:09,117][39m Trial 35 finished with value: 0.8275862068965517 and parameters: {'objective': 'CrossEntropy', 'colsample_bylevel': 0.06383072161420753, 'depth': 9, 'boosting_type': 'Plain', 'bootstrap_type': 'Bayesian', 'bagging_temperature': 6.705389280067217}. Best is trial 22 with value: 0.8672566371681416.
[32m[I 2023-04-23 18:41:13,236][39m Trial 36 finished with value: 0.8421052631578947 and parameters: {'objective': 'Logloss', 'colsample_bylevel': 0.05098302000356776, 'depth': 7, 'boosting_type': 'Ordered', 'bootstrap_type': 'Bayesian', 'bagging_temperature': 9.105675617482209}. Best is trial 22 with value: 0.8672566371681416.
[32m[I 2023-04-23 18:41:14,213][39m Trial 37 finished with value: 0.8521739130434783 and parameters: {'objective': 'Logloss', 'colsample_bylevel': 0.08134120529356184, 'depth': 12, 'boosting_type': 'Plain', 'bootstrap_type': 'Bayesian', 'bagging_temperature': 3.7975960383766507}. Best is trial 22 with value: 0.8672566371681416.
[32m[I 2023-04-23 18:41:19,026][39m Trial 38 finished with value: 0.8596491228070176 and parameters: {'objective': 'CrossEntropy', 'colsample_bylevel': 0.06828969955268832, 'depth': 11, 'boosting_type': 'Ordered', 'bootstrap_type': 'Bayesian', 'bagging_temperature': 8.384393257396063}. Best is trial 22 with value: 0.8672566371681416.
[32m[I 2023-04-23 18:41:22,674][39m Trial 39 finished with value: 0.823529411764706 and parameters: {'objective': 'CrossEntropy', 'colsample_bylevel': 0.05969304649832728, 'depth': 11, 'boosting_type': 'Ordered', 'bootstrap_type': 'MVS'}. Best is trial 22 with value: 0.8672566371681416.
[32m[I 2023-04-23 18:41:23,751][39m Trial 40 finished with value: 0.8672566371681416 and parameters: {'objective': 'Logloss', 'colsample_bylevel': 0.09084915431797333, 'depth': 6, 'boosting_type': 'Plain', 'bootstrap_type': 'Bayesian', 'bagging_temperature': 9.316182197155817}. Best is trial 22 with value: 0.8672566371681416.
[32m[I 2023-04-23 18:41:24,387][39m Trial 41 finished with value: 0.8571428571428572 and parameters: {'objective': 'Logloss', 'colsample_bylevel': 0.09373347457705763, 'depth': 6, 'boosting_type': 'Plain', 'bootstrap_type': 'Bayesian', 'bagging_temperature': 9.342408287004618}. Best is trial 22 with value: 0.8672566371681416.
[32m[I 2023-04-23 18:41:28,883][39m Trial 42 finished with value: 0.8571428571428572 and parameters: {'objective': 'CrossEntropy', 'colsample_bylevel': 0.08801187294027954, 'depth': 5, 'boosting_type': 'Ordered', 'bootstrap_type': 'Bayesian', 'bagging_temperature': 8.26903810136108}. Best is trial 22 with value: 0.8672566371681416.
[32m[I 2023-04-23 18:41:33,165][39m Trial 43 finished with value: 0.8521739130434783 and parameters: {'objective': 'CrossEntropy', 'colsample_bylevel': 0.068013569037714, 'depth': 7, 'boosting_type': 'Ordered', 'bootstrap_type': 'Bayesian', 'bagging_temperature': 8.614055350091547}. Best is trial 22 with value: 0.8672566371681416.
[32m[I 2023-04-23 18:41:37,049][39m Trial 44 finished with value: 0.8305084745762712 and parameters: {'objective': 'CrossEntropy', 'colsample_bylevel': 0.07537793466231932, 'depth': 5, 'boosting_type': 'Ordered', 'bootstrap_type': 'MVS'}. Best is trial 22 with value: 0.8672566371681416.
[32m[I 2023-04-23 18:41:38,261][39m Trial 45 finished with value: 0.8571428571428572 and parameters: {'objective': 'Logloss', 'colsample_bylevel': 0.09625881359678794, 'depth': 12, 'boosting_type': 'Plain', 'bootstrap_type': 'Bayesian', 'bagging_temperature': 9.427661267514193}. Best is trial 22 with value: 0.8672566371681416.
[32m[I 2023-04-23 18:41:44,633][39m Trial 46 finished with value: 0.7863247863247863 and parameters: {'objective': 'CrossEntropy', 'colsample_bylevel': 0.0190889265457529, 'depth': 7, 'boosting_type': 'Ordered', 'bootstrap_type': 'Bayesian', 'bagging_temperature': 7.962845129432542}. Best is trial 22 with value: 0.8672566371681416.
[32m[I 2023-04-23 18:41:49,890][39m Trial 47 finished with value: 0.8205128205128206 and parameters: {'objective': 'CrossEntropy', 'colsample_bylevel': 0.09999560582440224, 'depth': 3, 'boosting_type': 'Ordered', 'bootstrap_type': 'MVS'}. Best is trial 22 with value: 0.8672566371681416.
[32m[I 2023-04-23 18:41:52,136][39m Trial 48 finished with value: 0.8421052631578947 and parameters: {'objective': 'Logloss', 'colsample_bylevel': 0.0819834300511399, 'depth': 9, 'boosting_type': 'Plain', 'bootstrap_type': 'Bayesian', 'bagging_temperature': 9.506085614189866}. Best is trial 22 with value: 0.8672566371681416.
[32m[I 2023-04-23 18:41:58,264][39m Trial 49 finished with value: 0.823529411764706 and parameters: {'objective': 'CrossEntropy', 'colsample_bylevel': 0.09051634325312195, 'depth': 4, 'boosting_type': 'Ordered', 'bootstrap_type': 'Bernoulli', 'subsample': 0.996090266551281}. Best is trial 22 with value: 0.8672566371681416.
[32m[I 2023-04-23 18:41:59,528][39m Trial 50 finished with value: 0.8571428571428572 and parameters: {'objective': 'Logloss', 'colsample_bylevel': 0.08522954939813275, 'depth': 8, 'boosting_type': 'Plain', 'bootstrap_type': 'Bayesian', 'bagging_temperature': 6.763700614310408}. Best is trial 22 with value: 0.8672566371681416.
[32m[I 2023-04-23 18:42:01,077][39m Trial 51 finished with value: 0.8376068376068375 and parameters: {'objective': 'Logloss', 'colsample_bylevel': 0.06378118461196294, 'depth': 11, 'boosting_type': 'Plain', 'bootstrap_type': 'Bayesian', 'bagging_temperature': 8.732212488088408}. Best is trial 22 with value: 0.8672566371681416.
[32m[I 2023-04-23 18:42:02,802][39m Trial 52 finished with value: 0.8495575221238938 and parameters: {'objective': 'Logloss', 'colsample_bylevel': 0.08014279965830352, 'depth': 10, 'boosting_type': 'Plain', 'bootstrap_type': 'Bayesian', 'bagging_temperature': 8.904046710839683}. Best is trial 22 with value: 0.8672566371681416.
[32m[I 2023-04-23 18:42:04,757][39m Trial 53 finished with value: 0.8571428571428572 and parameters: {'objective': 'Logloss', 'colsample_bylevel': 0.07005290985417847, 'depth': 11, 'boosting_type': 'Plain', 'bootstrap_type': 'Bayesian', 'bagging_temperature': 9.588498643627396}. Best is trial 22 with value: 0.8672566371681416.
[32m[I 2023-04-23 18:42:06,695][39m Trial 54 finished with value: 0.8571428571428572 and parameters: {'objective': 'Logloss', 'colsample_bylevel': 0.09578474877122019, 'depth': 12, 'boosting_type': 'Plain', 'bootstrap_type': 'Bayesian', 'bagging_temperature': 9.971219525454275}. Best is trial 22 with value: 0.8672566371681416.
[32m[I 2023-04-23 18:42:08,838][39m Trial 55 finished with value: 0.8571428571428572 and parameters: {'objective': 'Logloss', 'colsample_bylevel': 0.08299639480428826, 'depth': 9, 'boosting_type': 'Plain', 'bootstrap_type': 'Bayesian', 'bagging_temperature': 9.085560935180084}. Best is trial 22 with value: 0.8672566371681416.
[32m[I 2023-04-23 18:42:10,219][39m Trial 56 finished with value: 0.8448275862068967 and parameters: {'objective': 'Logloss', 'colsample_bylevel': 0.07423547688006543, 'depth': 10, 'boosting_type': 'Plain', 'bootstrap_type': 'Bayesian', 'bagging_temperature': 7.927972405218566}. Best is trial 22 with value: 0.8672566371681416.
[32m[I 2023-04-23 18:42:11,367][39m Trial 57 finished with value: 0.8166666666666667 and parameters: {'objective': 'Logloss', 'colsample_bylevel': 0.04480043489966455, 'depth': 6, 'boosting_type': 'Plain', 'bootstrap_type': 'Bernoulli', 'subsample': 0.7883935733591356}. Best is trial 22 with value: 0.8672566371681416.
[32m[I 2023-04-23 18:42:12,726][39m Trial 58 finished with value: 0.8571428571428572 and parameters: {'objective': 'Logloss', 'colsample_bylevel': 0.08938629293391345, 'depth': 11, 'boosting_type': 'Plain', 'bootstrap_type': 'Bayesian', 'bagging_temperature': 8.532027662598457}. Best is trial 22 with value: 0.8672566371681416.
[32m[I 2023-04-23 18:42:19,135][39m Trial 59 finished with value: 0.8166666666666667 and parameters: {'objective': 'Logloss', 'colsample_bylevel': 0.06699961163387706, 'depth': 10, 'boosting_type': 'Ordered', 'bootstrap_type': 'MVS'}. Best is trial 22 with value: 0.8672566371681416.
[32m[I 2023-04-23 18:42:20,616][39m Trial 60 finished with value: 0.8571428571428572 and parameters: {'objective': 'CrossEntropy', 'colsample_bylevel': 0.07865873123501153, 'depth': 9, 'boosting_type': 'Plain', 'bootstrap_type': 'Bayesian', 'bagging_temperature': 4.461471209372867}. Best is trial 22 with value: 0.8672566371681416.
[32m[I 2023-04-23 18:42:21,869][39m Trial 61 finished with value: 0.8571428571428572 and parameters: {'objective': 'Logloss', 'colsample_bylevel': 0.09688532664716443, 'depth': 12, 'boosting_type': 'Plain', 'bootstrap_type': 'Bayesian', 'bagging_temperature': 9.43925559970925}. Best is trial 22 with value: 0.8672566371681416.
[32m[I 2023-04-23 18:42:23,560][39m Trial 62 finished with value: 0.8571428571428572 and parameters: {'objective': 'Logloss', 'colsample_bylevel': 0.09522762711465613, 'depth': 12, 'boosting_type': 'Plain', 'bootstrap_type': 'Bayesian', 'bagging_temperature': 9.431099094342168}. Best is trial 22 with value: 0.8672566371681416.
[32m[I 2023-04-23 18:42:25,200][39m Trial 63 finished with value: 0.8571428571428572 and parameters: {'objective': 'Logloss', 'colsample_bylevel': 0.08500693879308671, 'depth': 7, 'boosting_type': 'Plain', 'bootstrap_type': 'Bayesian', 'bagging_temperature': 6.898159150755129}. Best is trial 22 with value: 0.8672566371681416.
[32m[I 2023-04-23 18:42:26,647][39m Trial 64 finished with value: 0.8571428571428572 and parameters: {'objective': 'Logloss', 'colsample_bylevel': 0.08854583310748355, 'depth': 10, 'boosting_type': 'Plain', 'bootstrap_type': 'Bayesian', 'bagging_temperature': 8.96610732537708}. Best is trial 22 with value: 0.8672566371681416.
[32m[I 2023-04-23 18:42:28,378][39m Trial 65 finished with value: 0.8103448275862069 and parameters: {'objective': 'Logloss', 'colsample_bylevel': 0.09116112656277726, 'depth': 11, 'boosting_type': 'Plain', 'bootstrap_type': 'Bayesian', 'bagging_temperature': 0.5617642564540288}. Best is trial 22 with value: 0.8672566371681416.
[32m[I 2023-04-23 18:42:30,074][39m Trial 66 finished with value: 0.8571428571428572 and parameters: {'objective': 'CrossEntropy', 'colsample_bylevel': 0.07769986589148621, 'depth': 9, 'boosting_type': 'Plain', 'bootstrap_type': 'Bayesian', 'bagging_temperature': 4.5703107611325215}. Best is trial 22 with value: 0.8672566371681416.
