[32m[I 2023-04-23 18:42:37,601][39m Trial 67 finished with value: 0.8596491228070176 and parameters: {'objective': 'Logloss', 'colsample_bylevel': 0.09446454858120841, 'depth': 5, 'boosting_type': 'Ordered', 'bootstrap_type': 'Bayesian', 'bagging_temperature': 9.601712608906501}. Best is trial 22 with value: 0.8672566371681416.
[32m[I 2023-04-23 18:42:45,047][39m Trial 68 finished with value: 0.8305084745762712 and parameters: {'objective': 'Logloss', 'colsample_bylevel': 0.0719046686469369, 'depth': 5, 'boosting_type': 'Ordered', 'bootstrap_type': 'Bernoulli', 'subsample': 0.4834576465248748}. Best is trial 22 with value: 0.8672566371681416.
[32m[I 2023-04-23 18:42:51,848][39m Trial 69 finished with value: 0.8421052631578947 and parameters: {'objective': 'Logloss', 'colsample_bylevel': 0.060143246530410054, 'depth': 3, 'boosting_type': 'Ordered', 'bootstrap_type': 'Bayesian', 'bagging_temperature': 9.73050667853528}. Best is trial 22 with value: 0.8672566371681416.
Number of finished trials: 70
F1 Train:	80.99% (std: 6.13%)
F1 Test:	76.35% (std: 8.65%)
############################################################################################
############       F A S T   F E A T U R E  E N G G    A N D    S E L E C T I O N ! ########
# Be judicious with featurewiz. Don't use it to create too many un-interpretable features! #
############################################################################################
featurewiz has selected 0.7 as the correlation limit. Change this limit to fit your needs...
Skipping feature engineering since no feature_engg input...
Skipping category encoding since no category encoders specified in input...
#### Single_Label Binary_Classification problem ####
    Loaded train data. Shape = (372, 20)
#### Single_Label Binary_Classification problem ####
No test data filename given...
#######################################################################################
######################## C L A S S I F Y I N G  V A R I A B L E S  ####################
#######################################################################################
        No variables were removed since no ID or low-information variables found in data set
#######################################################################################
#####  Searching for Uncorrelated List Of Variables (SULOV) in 17 features ############
#######################################################################################
    there are no null values in dataset...
    Removing (7) highly correlated variables:
    ['Re', 'height', 'liquid_density', 'particle_droplet_diameter_ratio', 'roughness_binary', 'velocity', 'volume_fraction']
    Following (10) vars selected: ['droplet_diameter', 'inclination', 'particle_liquid_density_ratio', 'surface_tension', 'roughness', 'We_Re', 'viscosity', 'We', 'particle_mean_diameter', 'volume_fraction_binary']
Completed SULOV. 10 features selected
Time taken for SULOV method = 0 seconds
Finally 12 vars selected after SULOV
Converting all features to numeric before sending to XGBoost...
    there were no mixed data types or object columns that errored. Data is all numeric...
Shape of train data after adding missing values flags = (372, 13)
#######################################################################################
#####    R E C U R S I V E   X G B O O S T : F E A T U R E   S E L E C T I O N  #######
#######################################################################################
Current number of predictors before recursive XGBoost = 12
Number of booster rounds = 100
            selecting 5 features in this iteration
            selecting 4 features in this iteration
            selecting 3 features in this iteration
            selecting 2 features in this iteration
            selecting 1 features in this iteration
            selecting 1 features in this iteration
    Completed XGBoost feature selection in 0 seconds
#######################################################################################
#####          F E A T U R E   S E L E C T I O N   C O M P L E T E D            #######
#######################################################################################
Selected 6 important features:
['surface_tension', 'roughness', 'particle_mean_diameter', 'inclination', 'viscosity', 'wettability']
Total Time taken for featurewiz selection = 1 seconds
Output contains a list of 6 important features and a train dataframe