[32m[I 2023-04-26 13:59:34,291][39m Trial 68 finished with value: 0.8444444444444446 and parameters: {'objective': 'Logloss', 'colsample_bylevel': 0.08005280874900679, 'depth': 10, 'boosting_type': 'Plain', 'bootstrap_type': 'Bernoulli', 'subsample': 0.9508669894307428}. Best is trial 21 with value: 0.8988764044943819.
[32m[I 2023-04-26 13:59:37,148][39m Trial 69 finished with value: 0.8666666666666666 and parameters: {'objective': 'Logloss', 'colsample_bylevel': 0.09222917889470642, 'depth': 7, 'boosting_type': 'Plain', 'bootstrap_type': 'Bernoulli', 'subsample': 0.5620566384766728}. Best is trial 21 with value: 0.8988764044943819.
[32m[I 2023-04-26 13:59:40,844][39m Trial 70 finished with value: 0.8764044943820225 and parameters: {'objective': 'CrossEntropy', 'colsample_bylevel': 0.08851926547699, 'depth': 9, 'boosting_type': 'Plain', 'bootstrap_type': 'Bernoulli', 'subsample': 0.78600762482655}. Best is trial 21 with value: 0.8988764044943819.
[32m[I 2023-04-26 13:59:42,945][39m Trial 71 finished with value: 0.8478260869565216 and parameters: {'objective': 'Logloss', 'colsample_bylevel': 0.08520518882400706, 'depth': 10, 'boosting_type': 'Plain', 'bootstrap_type': 'Bernoulli', 'subsample': 0.8936779337560654}. Best is trial 21 with value: 0.8988764044943819.
[32m[I 2023-04-26 13:59:45,085][39m Trial 72 finished with value: 0.8478260869565216 and parameters: {'objective': 'Logloss', 'colsample_bylevel': 0.08320132295794105, 'depth': 10, 'boosting_type': 'Plain', 'bootstrap_type': 'Bernoulli', 'subsample': 0.8949102425817751}. Best is trial 21 with value: 0.8988764044943819.
[32m[I 2023-04-26 13:59:47,500][39m Trial 73 finished with value: 0.8636363636363636 and parameters: {'objective': 'Logloss', 'colsample_bylevel': 0.09514190515488932, 'depth': 11, 'boosting_type': 'Plain', 'bootstrap_type': 'Bernoulli', 'subsample': 0.9667165767747737}. Best is trial 21 with value: 0.8988764044943819.
[32m[I 2023-04-26 13:59:50,142][39m Trial 74 finished with value: 0.8666666666666666 and parameters: {'objective': 'Logloss', 'colsample_bylevel': 0.09740647893987651, 'depth': 10, 'boosting_type': 'Plain', 'bootstrap_type': 'Bernoulli', 'subsample': 0.8284511018666951}. Best is trial 21 with value: 0.8988764044943819.
[32m[I 2023-04-26 13:59:54,212][39m Trial 75 finished with value: 0.8988764044943819 and parameters: {'objective': 'Logloss', 'colsample_bylevel': 0.09724842724223086, 'depth': 9, 'boosting_type': 'Plain', 'bootstrap_type': 'Bayesian', 'bagging_temperature': 5.816807286790806}. Best is trial 21 with value: 0.8988764044943819.
[32m[I 2023-04-26 13:59:57,637][39m Trial 76 finished with value: 0.8695652173913043 and parameters: {'objective': 'Logloss', 'colsample_bylevel': 0.09172882027692744, 'depth': 8, 'boosting_type': 'Plain', 'bootstrap_type': 'Bayesian', 'bagging_temperature': 5.3266051111835155}. Best is trial 21 with value: 0.8988764044943819.
[32m[I 2023-04-26 14:00:01,768][39m Trial 77 finished with value: 0.8863636363636364 and parameters: {'objective': 'Logloss', 'colsample_bylevel': 0.09410921378146693, 'depth': 9, 'boosting_type': 'Plain', 'bootstrap_type': 'Bayesian', 'bagging_temperature': 6.295370274374577}. Best is trial 21 with value: 0.8988764044943819.
[32m[I 2023-04-26 14:00:06,547][39m Trial 78 finished with value: 0.8172043010752689 and parameters: {'objective': 'Logloss', 'colsample_bylevel': 0.09412880415239663, 'depth': 9, 'boosting_type': 'Ordered', 'bootstrap_type': 'Bayesian', 'bagging_temperature': 6.270394917860499}. Best is trial 21 with value: 0.8988764044943819.
[32m[I 2023-04-26 14:00:10,282][39m Trial 79 finished with value: 0.8988764044943819 and parameters: {'objective': 'Logloss', 'colsample_bylevel': 0.09794914919946456, 'depth': 8, 'boosting_type': 'Plain', 'bootstrap_type': 'Bayesian', 'bagging_temperature': 8.337695556258701}. Best is trial 21 with value: 0.8988764044943819.
[32m[I 2023-04-26 14:00:13,033][39m Trial 80 finished with value: 0.8478260869565216 and parameters: {'objective': 'Logloss', 'colsample_bylevel': 0.09073980299620926, 'depth': 7, 'boosting_type': 'Plain', 'bootstrap_type': 'Bayesian', 'bagging_temperature': 8.212229093329329}. Best is trial 21 with value: 0.8988764044943819.
[32m[I 2023-04-26 14:00:16,476][39m Trial 81 finished with value: 0.8764044943820225 and parameters: {'objective': 'Logloss', 'colsample_bylevel': 0.09568772219731086, 'depth': 8, 'boosting_type': 'Plain', 'bootstrap_type': 'Bayesian', 'bagging_temperature': 5.587336891982332}. Best is trial 21 with value: 0.8988764044943819.
[32m[I 2023-04-26 14:00:20,850][39m Trial 82 finished with value: 0.888888888888889 and parameters: {'objective': 'Logloss', 'colsample_bylevel': 0.09996027362452037, 'depth': 9, 'boosting_type': 'Plain', 'bootstrap_type': 'Bayesian', 'bagging_temperature': 8.729366497862264}. Best is trial 21 with value: 0.8988764044943819.
[32m[I 2023-04-26 14:00:24,223][39m Trial 83 finished with value: 0.8666666666666666 and parameters: {'objective': 'Logloss', 'colsample_bylevel': 0.09903313550775293, 'depth': 8, 'boosting_type': 'Plain', 'bootstrap_type': 'Bayesian', 'bagging_temperature': 8.627388566070955}. Best is trial 21 with value: 0.8988764044943819.
[32m[I 2023-04-26 14:00:27,171][39m Trial 84 finished with value: 0.888888888888889 and parameters: {'objective': 'Logloss', 'colsample_bylevel': 0.08808197798149942, 'depth': 8, 'boosting_type': 'Plain', 'bootstrap_type': 'Bayesian', 'bagging_temperature': 8.90558968221638}. Best is trial 21 with value: 0.8988764044943819.
[32m[I 2023-04-26 14:00:29,789][39m Trial 85 finished with value: 0.8764044943820225 and parameters: {'objective': 'Logloss', 'colsample_bylevel': 0.08775497843166223, 'depth': 7, 'boosting_type': 'Plain', 'bootstrap_type': 'Bayesian', 'bagging_temperature': 4.356623879963845}. Best is trial 21 with value: 0.8988764044943819.
[32m[I 2023-04-26 14:00:31,823][39m Trial 86 finished with value: 0.860215053763441 and parameters: {'objective': 'CrossEntropy', 'colsample_bylevel': 0.06424610412114413, 'depth': 8, 'boosting_type': 'Plain', 'bootstrap_type': 'Bayesian', 'bagging_temperature': 8.881323963020854}. Best is trial 21 with value: 0.8988764044943819.
[32m[I 2023-04-26 14:00:34,942][39m Trial 87 finished with value: 0.8695652173913043 and parameters: {'objective': 'Logloss', 'colsample_bylevel': 0.09133631304846258, 'depth': 8, 'boosting_type': 'Plain', 'bootstrap_type': 'Bayesian', 'bagging_temperature': 7.2777103848078575}. Best is trial 21 with value: 0.8988764044943819.
[32m[I 2023-04-26 14:00:38,235][39m Trial 88 finished with value: 0.8478260869565216 and parameters: {'objective': 'Logloss', 'colsample_bylevel': 0.0950595793376708, 'depth': 8, 'boosting_type': 'Plain', 'bootstrap_type': 'Bayesian', 'bagging_temperature': 9.937298436617912}. Best is trial 21 with value: 0.8988764044943819.
[32m[I 2023-04-26 14:00:39,830][39m Trial 89 finished with value: 0.8131868131868132 and parameters: {'objective': 'Logloss', 'colsample_bylevel': 0.041031469482723015, 'depth': 9, 'boosting_type': 'Plain', 'bootstrap_type': 'Bayesian', 'bagging_temperature': 8.498674297656724}. Best is trial 21 with value: 0.8988764044943819.
[32m[I 2023-04-26 14:00:44,809][39m Trial 90 finished with value: 0.8297872340425531 and parameters: {'objective': 'Logloss', 'colsample_bylevel': 0.09764396935877671, 'depth': 9, 'boosting_type': 'Ordered', 'bootstrap_type': 'Bayesian', 'bagging_temperature': 9.217288700624145}. Best is trial 21 with value: 0.8988764044943819.
[32m[I 2023-04-26 14:00:49,112][39m Trial 91 finished with value: 0.8764044943820225 and parameters: {'objective': 'Logloss', 'colsample_bylevel': 0.09973987794469705, 'depth': 9, 'boosting_type': 'Plain', 'bootstrap_type': 'Bayesian', 'bagging_temperature': 7.350979573298812}. Best is trial 21 with value: 0.8988764044943819.
[32m[I 2023-04-26 14:00:53,391][39m Trial 92 finished with value: 0.8764044943820225 and parameters: {'objective': 'Logloss', 'colsample_bylevel': 0.09683861166721293, 'depth': 9, 'boosting_type': 'Plain', 'bootstrap_type': 'Bayesian', 'bagging_temperature': 7.911618491268801}. Best is trial 21 with value: 0.8988764044943819.
[32m[I 2023-04-26 14:00:56,149][39m Trial 93 finished with value: 0.8387096774193549 and parameters: {'objective': 'Logloss', 'colsample_bylevel': 0.07626693244657588, 'depth': 8, 'boosting_type': 'Plain', 'bootstrap_type': 'Bayesian', 'bagging_temperature': 7.139153182556641}. Best is trial 21 with value: 0.8988764044943819.
[32m[I 2023-04-26 14:00:59,485][39m Trial 94 finished with value: 0.8666666666666666 and parameters: {'objective': 'Logloss', 'colsample_bylevel': 0.09287607226943591, 'depth': 8, 'boosting_type': 'Plain', 'bootstrap_type': 'Bayesian', 'bagging_temperature': 4.6951512287553685}. Best is trial 21 with value: 0.8988764044943819.
[32m[I 2023-04-26 14:01:01,966][39m Trial 95 finished with value: 0.8571428571428571 and parameters: {'objective': 'Logloss', 'colsample_bylevel': 0.0882970300343282, 'depth': 7, 'boosting_type': 'Plain', 'bootstrap_type': 'Bayesian', 'bagging_temperature': 5.795682895504648}. Best is trial 21 with value: 0.8988764044943819.
[32m[I 2023-04-26 14:01:05,351][39m Trial 96 finished with value: 0.888888888888889 and parameters: {'objective': 'Logloss', 'colsample_bylevel': 0.08432485655499, 'depth': 9, 'boosting_type': 'Plain', 'bootstrap_type': 'Bayesian', 'bagging_temperature': 9.434461820220996}. Best is trial 21 with value: 0.8988764044943819.
[32m[I 2023-04-26 14:01:07,388][39m Trial 97 finished with value: 0.8571428571428571 and parameters: {'objective': 'Logloss', 'colsample_bylevel': 0.08148086416327081, 'depth': 10, 'boosting_type': 'Plain', 'bootstrap_type': 'Bayesian', 'bagging_temperature': 9.453486992465383}. Best is trial 21 with value: 0.8988764044943819.
[32m[I 2023-04-26 14:01:10,665][39m Trial 98 finished with value: 0.8791208791208791 and parameters: {'objective': 'CrossEntropy', 'colsample_bylevel': 0.08440685150198343, 'depth': 9, 'boosting_type': 'Plain', 'bootstrap_type': 'Bayesian', 'bagging_temperature': 9.039816197161938}. Best is trial 21 with value: 0.8988764044943819.
[32m[I 2023-04-26 14:01:12,626][39m Trial 99 finished with value: 0.7956989247311829 and parameters: {'objective': 'Logloss', 'colsample_bylevel': 0.054288156733462746, 'depth': 9, 'boosting_type': 'Plain', 'bootstrap_type': 'Bayesian', 'bagging_temperature': 3.5422642985046946}. Best is trial 21 with value: 0.8988764044943819.
[32m[I 2023-04-26 14:01:15,455][39m Trial 100 finished with value: 0.8387096774193549 and parameters: {'objective': 'Logloss', 'colsample_bylevel': 0.08644888386344865, 'depth': 8, 'boosting_type': 'Plain', 'bootstrap_type': 'Bernoulli', 'subsample': 0.7329089237361894}. Best is trial 21 with value: 0.8988764044943819.
[32m[I 2023-04-26 14:01:18,839][39m Trial 101 finished with value: 0.8571428571428571 and parameters: {'objective': 'Logloss', 'colsample_bylevel': 0.08995548215796365, 'depth': 9, 'boosting_type': 'Plain', 'bootstrap_type': 'Bayesian', 'bagging_temperature': 8.282631608387948}. Best is trial 21 with value: 0.8988764044943819.
[32m[I 2023-04-26 14:01:22,752][39m Trial 102 finished with value: 0.8764044943820225 and parameters: {'objective': 'Logloss', 'colsample_bylevel': 0.09827921784795361, 'depth': 9, 'boosting_type': 'Plain', 'bootstrap_type': 'Bayesian', 'bagging_temperature': 9.688197272493252}. Best is trial 21 with value: 0.8988764044943819.
[32m[I 2023-04-26 14:01:26,067][39m Trial 103 finished with value: 0.8764044943820225 and parameters: {'objective': 'Logloss', 'colsample_bylevel': 0.09622361373372286, 'depth': 8, 'boosting_type': 'Plain', 'bootstrap_type': 'Bayesian', 'bagging_temperature': 7.882890051700682}. Best is trial 21 with value: 0.8988764044943819.
[32m[I 2023-04-26 14:01:28,423][39m Trial 104 finished with value: 0.8666666666666666 and parameters: {'objective': 'Logloss', 'colsample_bylevel': 0.09295438300968294, 'depth': 10, 'boosting_type': 'Plain', 'bootstrap_type': 'Bayesian', 'bagging_temperature': 8.832611404019755}. Best is trial 21 with value: 0.8988764044943819.
[32m[I 2023-04-26 14:01:31,036][39m Trial 105 finished with value: 0.8764044943820225 and parameters: {'objective': 'Logloss', 'colsample_bylevel': 0.09999157163387021, 'depth': 10, 'boosting_type': 'Plain', 'bootstrap_type': 'Bayesian', 'bagging_temperature': 9.268999658810818}. Best is trial 21 with value: 0.8988764044943819.
[32m[I 2023-04-26 14:01:34,413][39m Trial 106 finished with value: 0.8666666666666666 and parameters: {'objective': 'Logloss', 'colsample_bylevel': 0.09058542397338248, 'depth': 9, 'boosting_type': 'Plain', 'bootstrap_type': 'Bernoulli', 'subsample': 0.6849536036506199}. Best is trial 21 with value: 0.8988764044943819.
[32m[I 2023-04-26 14:01:37,416][39m Trial 107 finished with value: 0.8764044943820225 and parameters: {'objective': 'Logloss', 'colsample_bylevel': 0.09486549279726034, 'depth': 7, 'boosting_type': 'Plain', 'bootstrap_type': 'MVS'}. Best is trial 21 with value: 0.8988764044943819.
[32m[I 2023-04-26 14:01:40,057][39m Trial 108 finished with value: 0.8666666666666666 and parameters: {'objective': 'Logloss', 'colsample_bylevel': 0.08378964549979219, 'depth': 8, 'boosting_type': 'Plain', 'bootstrap_type': 'Bernoulli', 'subsample': 0.7704591870694452}. Best is trial 21 with value: 0.8988764044943819.
[32m[I 2023-04-26 14:01:44,549][39m Trial 109 finished with value: 0.8043478260869564 and parameters: {'objective': 'Logloss', 'colsample_bylevel': 0.08843431669267891, 'depth': 9, 'boosting_type': 'Ordered', 'bootstrap_type': 'Bayesian', 'bagging_temperature': 6.970751443600058}. Best is trial 21 with value: 0.8988764044943819.
[32m[I 2023-04-26 14:01:47,341][39m Trial 110 finished with value: 0.8172043010752689 and parameters: {'objective': 'Logloss', 'colsample_bylevel': 0.07252607213168175, 'depth': 9, 'boosting_type': 'Plain', 'bootstrap_type': 'Bernoulli', 'subsample': 0.1712793181991633}. Best is trial 21 with value: 0.8988764044943819.
[32m[I 2023-04-26 14:01:51,322][39m Trial 111 finished with value: 0.8666666666666666 and parameters: {'objective': 'Logloss', 'colsample_bylevel': 0.09350062517061135, 'depth': 9, 'boosting_type': 'Plain', 'bootstrap_type': 'Bayesian', 'bagging_temperature': 6.114410747651474}. Best is trial 21 with value: 0.8988764044943819.
[32m[I 2023-04-26 14:01:54,040][39m Trial 112 finished with value: 0.8735632183908046 and parameters: {'objective': 'Logloss', 'colsample_bylevel': 0.09784414684833392, 'depth': 10, 'boosting_type': 'Plain', 'bootstrap_type': 'Bernoulli', 'subsample': 0.9761546828331392}. Best is trial 21 with value: 0.8988764044943819.
[32m[I 2023-04-26 14:01:57,415][39m Trial 113 finished with value: 0.8666666666666666 and parameters: {'objective': 'Logloss', 'colsample_bylevel': 0.09807810112711157, 'depth': 8, 'boosting_type': 'Plain', 'bootstrap_type': 'Bernoulli', 'subsample': 0.29934648249213236}. Best is trial 21 with value: 0.8988764044943819.
[32m[I 2023-04-26 14:02:01,251][39m Trial 114 finished with value: 0.8791208791208791 and parameters: {'objective': 'Logloss', 'colsample_bylevel': 0.09430859592038551, 'depth': 9, 'boosting_type': 'Plain', 'bootstrap_type': 'Bayesian', 'bagging_temperature': 6.472864822127516}. Best is trial 21 with value: 0.8988764044943819.
[32m[I 2023-04-26 14:02:04,972][39m Trial 115 finished with value: 0.8764044943820225 and parameters: {'objective': 'Logloss', 'colsample_bylevel': 0.09151898058482116, 'depth': 9, 'boosting_type': 'Plain', 'bootstrap_type': 'Bayesian', 'bagging_temperature': 5.463593049479793}. Best is trial 21 with value: 0.8988764044943819.
[32m[I 2023-04-26 14:02:07,425][39m Trial 116 finished with value: 0.8666666666666666 and parameters: {'objective': 'Logloss', 'colsample_bylevel': 0.09612028594295512, 'depth': 10, 'boosting_type': 'Plain', 'bootstrap_type': 'Bayesian', 'bagging_temperature': 4.891084234631761}. Best is trial 21 with value: 0.8988764044943819.
[32m[I 2023-04-26 14:02:10,579][39m Trial 117 finished with value: 0.888888888888889 and parameters: {'objective': 'Logloss', 'colsample_bylevel': 0.09383021058311734, 'depth': 8, 'boosting_type': 'Plain', 'bootstrap_type': 'Bayesian', 'bagging_temperature': 6.063432326709991}. Best is trial 21 with value: 0.8988764044943819.
[32m[I 2023-04-26 14:02:13,053][39m Trial 118 finished with value: 0.8695652173913043 and parameters: {'objective': 'CrossEntropy', 'colsample_bylevel': 0.08032501734742482, 'depth': 8, 'boosting_type': 'Plain', 'bootstrap_type': 'Bayesian', 'bagging_temperature': 7.535867412033949}. Best is trial 21 with value: 0.8988764044943819.
[32m[I 2023-04-26 14:02:14,682][39m Trial 119 finished with value: 0.8260869565217392 and parameters: {'objective': 'Logloss', 'colsample_bylevel': 0.05117090435909079, 'depth': 7, 'boosting_type': 'Plain', 'bootstrap_type': 'Bayesian', 'bagging_temperature': 8.131082922393334}. Best is trial 21 with value: 0.8988764044943819.
[32m[I 2023-04-26 14:02:17,622][39m Trial 120 finished with value: 0.8666666666666666 and parameters: {'objective': 'Logloss', 'colsample_bylevel': 0.0866147227780659, 'depth': 8, 'boosting_type': 'Plain', 'bootstrap_type': 'Bernoulli', 'subsample': 0.8531286575712985}. Best is trial 21 with value: 0.8988764044943819.
[32m[I 2023-04-26 14:02:22,314][39m Trial 121 finished with value: 0.8863636363636364 and parameters: {'objective': 'Logloss', 'colsample_bylevel': 0.0982441180294537, 'depth': 9, 'boosting_type': 'Plain', 'bootstrap_type': 'Bernoulli', 'subsample': 0.9969505159330067}. Best is trial 21 with value: 0.8988764044943819.
[32m[I 2023-04-26 14:02:25,351][39m Trial 122 finished with value: 0.8636363636363636 and parameters: {'objective': 'Logloss', 'colsample_bylevel': 0.09351349912927195, 'depth': 8, 'boosting_type': 'Plain', 'bootstrap_type': 'Bayesian', 'bagging_temperature': 5.252356143863543}. Best is trial 21 with value: 0.8988764044943819.
[32m[I 2023-04-26 14:02:29,602][39m Trial 123 finished with value: 0.888888888888889 and parameters: {'objective': 'Logloss', 'colsample_bylevel': 0.09622013237616642, 'depth': 9, 'boosting_type': 'Plain', 'bootstrap_type': 'Bayesian', 'bagging_temperature': 6.015081744389636}. Best is trial 21 with value: 0.8988764044943819.
[32m[I 2023-04-26 14:02:33,679][39m Trial 124 finished with value: 0.8666666666666666 and parameters: {'objective': 'Logloss', 'colsample_bylevel': 0.0962252816312866, 'depth': 9, 'boosting_type': 'Plain', 'bootstrap_type': 'Bayesian', 'bagging_temperature': 5.904177635690844}. Best is trial 21 with value: 0.8988764044943819.
[32m[I 2023-04-26 14:02:37,033][39m Trial 125 finished with value: 0.8571428571428571 and parameters: {'objective': 'Logloss', 'colsample_bylevel': 0.09169799549493002, 'depth': 8, 'boosting_type': 'Plain', 'bootstrap_type': 'Bayesian', 'bagging_temperature': 1.04360490264177}. Best is trial 21 with value: 0.8988764044943819.
[32m[I 2023-04-26 14:02:40,600][39m Trial 126 finished with value: 0.8571428571428571 and parameters: {'objective': 'Logloss', 'colsample_bylevel': 0.08908832033365052, 'depth': 9, 'boosting_type': 'Plain', 'bootstrap_type': 'Bayesian', 'bagging_temperature': 6.776910720372275}. Best is trial 21 with value: 0.8988764044943819.
[32m[I 2023-04-26 14:02:43,341][39m Trial 127 finished with value: 0.8539325842696629 and parameters: {'objective': 'Logloss', 'colsample_bylevel': 0.09554462299211708, 'depth': 7, 'boosting_type': 'Plain', 'bootstrap_type': 'Bayesian', 'bagging_temperature': 8.702092353847473}. Best is trial 21 with value: 0.8988764044943819.
[32m[I 2023-04-26 14:02:48,374][39m Trial 128 finished with value: 0.7912087912087912 and parameters: {'objective': 'Logloss', 'colsample_bylevel': 0.09993668060251112, 'depth': 9, 'boosting_type': 'Ordered', 'bootstrap_type': 'Bayesian', 'bagging_temperature': 9.548297131777305}. Best is trial 21 with value: 0.8988764044943819.
[32m[I 2023-04-26 14:02:51,560][39m Trial 129 finished with value: 0.8539325842696629 and parameters: {'objective': 'Logloss', 'colsample_bylevel': 0.08997655931988693, 'depth': 8, 'boosting_type': 'Plain', 'bootstrap_type': 'MVS'}. Best is trial 21 with value: 0.8988764044943819.
[32m[I 2023-04-26 14:02:54,108][39m Trial 130 finished with value: 0.860215053763441 and parameters: {'objective': 'Logloss', 'colsample_bylevel': 0.09696468527738163, 'depth': 10, 'boosting_type': 'Plain', 'bootstrap_type': 'Bayesian', 'bagging_temperature': 6.0626511434209664}. Best is trial 21 with value: 0.8988764044943819.
[32m[I 2023-04-26 14:02:57,903][39m Trial 131 finished with value: 0.8539325842696629 and parameters: {'objective': 'Logloss', 'colsample_bylevel': 0.09454462708682837, 'depth': 9, 'boosting_type': 'Plain', 'bootstrap_type': 'Bayesian', 'bagging_temperature': 6.499919347821498}. Best is trial 21 with value: 0.8988764044943819.
[32m[I 2023-04-26 14:03:02,377][39m Trial 132 finished with value: 0.8791208791208791 and parameters: {'objective': 'Logloss', 'colsample_bylevel': 0.09817534376632368, 'depth': 9, 'boosting_type': 'Plain', 'bootstrap_type': 'Bernoulli', 'subsample': 0.989647314947539}. Best is trial 21 with value: 0.8988764044943819.
[32m[I 2023-04-26 14:03:04,454][39m Trial 133 finished with value: 0.8210526315789473 and parameters: {'objective': 'Logloss', 'colsample_bylevel': 0.05740382262797793, 'depth': 9, 'boosting_type': 'Plain', 'bootstrap_type': 'Bernoulli', 'subsample': 0.3763495885862568}. Best is trial 21 with value: 0.8988764044943819.
[32m[I 2023-04-26 14:03:06,887][39m Trial 134 finished with value: 0.8764044943820225 and parameters: {'objective': 'Logloss', 'colsample_bylevel': 0.09269633206383375, 'depth': 10, 'boosting_type': 'Plain', 'bootstrap_type': 'Bayesian', 'bagging_temperature': 5.683354083454153}. Best is trial 21 with value: 0.8988764044943819.
