[32m[I 2023-04-26 14:18:14,340][39m Trial 462 finished with value: 0.8988764044943819 and parameters: {'objective': 'CrossEntropy', 'colsample_bylevel': 0.0957602187316217, 'depth': 11, 'boosting_type': 'Plain', 'bootstrap_type': 'Bayesian', 'bagging_temperature': 9.874149639095128}. Best is trial 240 with value: 0.9195402298850575.
[32m[I 2023-04-26 14:18:17,059][39m Trial 463 finished with value: 0.8965517241379309 and parameters: {'objective': 'CrossEntropy', 'colsample_bylevel': 0.09572774505687791, 'depth': 11, 'boosting_type': 'Plain', 'bootstrap_type': 'Bayesian', 'bagging_temperature': 9.95460077119334}. Best is trial 240 with value: 0.9195402298850575.
[32m[I 2023-04-26 14:18:19,630][39m Trial 464 finished with value: 0.888888888888889 and parameters: {'objective': 'CrossEntropy', 'colsample_bylevel': 0.09060566337866272, 'depth': 11, 'boosting_type': 'Plain', 'bootstrap_type': 'Bayesian', 'bagging_temperature': 8.831194452110005}. Best is trial 240 with value: 0.9195402298850575.
[32m[I 2023-04-26 14:18:22,428][39m Trial 465 finished with value: 0.8988764044943819 and parameters: {'objective': 'CrossEntropy', 'colsample_bylevel': 0.09755556854615678, 'depth': 12, 'boosting_type': 'Plain', 'bootstrap_type': 'Bayesian', 'bagging_temperature': 1.6781941184694746}. Best is trial 240 with value: 0.9195402298850575.
[32m[I 2023-04-26 14:18:24,757][39m Trial 466 finished with value: 0.8764044943820225 and parameters: {'objective': 'CrossEntropy', 'colsample_bylevel': 0.09271907691076597, 'depth': 5, 'boosting_type': 'Plain', 'bootstrap_type': 'Bayesian', 'bagging_temperature': 9.272698685029836}. Best is trial 240 with value: 0.9195402298850575.
[32m[I 2023-04-26 14:18:27,732][39m Trial 467 finished with value: 0.9195402298850575 and parameters: {'objective': 'CrossEntropy', 'colsample_bylevel': 0.09812820524007321, 'depth': 12, 'boosting_type': 'Plain', 'bootstrap_type': 'Bayesian', 'bagging_temperature': 9.680165813752057}. Best is trial 240 with value: 0.9195402298850575.
[32m[I 2023-04-26 14:18:30,659][39m Trial 468 finished with value: 0.888888888888889 and parameters: {'objective': 'CrossEntropy', 'colsample_bylevel': 0.09873148457604455, 'depth': 11, 'boosting_type': 'Plain', 'bootstrap_type': 'Bayesian', 'bagging_temperature': 9.62735312109503}. Best is trial 240 with value: 0.9195402298850575.
[32m[I 2023-04-26 14:18:33,638][39m Trial 469 finished with value: 0.8791208791208791 and parameters: {'objective': 'CrossEntropy', 'colsample_bylevel': 0.09954882280512752, 'depth': 11, 'boosting_type': 'Plain', 'bootstrap_type': 'Bayesian', 'bagging_temperature': 9.479102389090343}. Best is trial 240 with value: 0.9195402298850575.
[32m[I 2023-04-26 14:18:36,474][39m Trial 470 finished with value: 0.8791208791208791 and parameters: {'objective': 'CrossEntropy', 'colsample_bylevel': 0.09997889550440701, 'depth': 11, 'boosting_type': 'Plain', 'bootstrap_type': 'Bayesian', 'bagging_temperature': 9.81375971632029}. Best is trial 240 with value: 0.9195402298850575.
[32m[I 2023-04-26 14:18:42,059][39m Trial 471 finished with value: 0.8131868131868132 and parameters: {'objective': 'CrossEntropy', 'colsample_bylevel': 0.09729832390893695, 'depth': 12, 'boosting_type': 'Ordered', 'bootstrap_type': 'Bayesian', 'bagging_temperature': 8.727116532011461}. Best is trial 240 with value: 0.9195402298850575.
[32m[I 2023-04-26 14:18:44,497][39m Trial 472 finished with value: 0.8666666666666666 and parameters: {'objective': 'CrossEntropy', 'colsample_bylevel': 0.08515989925185878, 'depth': 12, 'boosting_type': 'Plain', 'bootstrap_type': 'Bernoulli', 'subsample': 0.6775920671970794}. Best is trial 240 with value: 0.9195402298850575.
[32m[I 2023-04-26 14:18:47,188][39m Trial 473 finished with value: 0.8863636363636364 and parameters: {'objective': 'CrossEntropy', 'colsample_bylevel': 0.0999741304493469, 'depth': 11, 'boosting_type': 'Plain', 'bootstrap_type': 'Bayesian', 'bagging_temperature': 9.14031798926694}. Best is trial 240 with value: 0.9195402298850575.
[32m[I 2023-04-26 14:18:49,781][39m Trial 474 finished with value: 0.8764044943820225 and parameters: {'objective': 'CrossEntropy', 'colsample_bylevel': 0.09564777693102129, 'depth': 12, 'boosting_type': 'Plain', 'bootstrap_type': 'Bayesian', 'bagging_temperature': 4.0510137908513695}. Best is trial 240 with value: 0.9195402298850575.
[32m[I 2023-04-26 14:18:52,568][39m Trial 475 finished with value: 0.8837209302325582 and parameters: {'objective': 'CrossEntropy', 'colsample_bylevel': 0.09671909720904008, 'depth': 12, 'boosting_type': 'Plain', 'bootstrap_type': 'Bayesian', 'bagging_temperature': 9.862308268989125}. Best is trial 240 with value: 0.9195402298850575.
[32m[I 2023-04-26 14:18:55,363][39m Trial 476 finished with value: 0.8666666666666666 and parameters: {'objective': 'CrossEntropy', 'colsample_bylevel': 0.09827675498758469, 'depth': 11, 'boosting_type': 'Plain', 'bootstrap_type': 'Bayesian', 'bagging_temperature': 8.859589900334152}. Best is trial 240 with value: 0.9195402298850575.
[32m[I 2023-04-26 14:18:57,916][39m Trial 477 finished with value: 0.8764044943820225 and parameters: {'objective': 'CrossEntropy', 'colsample_bylevel': 0.09765282342428064, 'depth': 6, 'boosting_type': 'Plain', 'bootstrap_type': 'Bayesian', 'bagging_temperature': 3.265149462769676}. Best is trial 240 with value: 0.9195402298850575.
[32m[I 2023-04-26 14:19:00,795][39m Trial 478 finished with value: 0.9090909090909092 and parameters: {'objective': 'CrossEntropy', 'colsample_bylevel': 0.09957752796956663, 'depth': 11, 'boosting_type': 'Plain', 'bootstrap_type': 'Bayesian', 'bagging_temperature': 9.297032130706775}. Best is trial 240 with value: 0.9195402298850575.
[32m[I 2023-04-26 14:19:03,533][39m Trial 479 finished with value: 0.8863636363636364 and parameters: {'objective': 'CrossEntropy', 'colsample_bylevel': 0.09827277506338349, 'depth': 11, 'boosting_type': 'Plain', 'bootstrap_type': 'Bayesian', 'bagging_temperature': 9.980672040619815}. Best is trial 240 with value: 0.9195402298850575.
[32m[I 2023-04-26 14:19:05,826][39m Trial 480 finished with value: 0.8387096774193549 and parameters: {'objective': 'CrossEntropy', 'colsample_bylevel': 0.08303396761696641, 'depth': 10, 'boosting_type': 'Plain', 'bootstrap_type': 'Bayesian', 'bagging_temperature': 6.2733237118477465}. Best is trial 240 with value: 0.9195402298850575.
[32m[I 2023-04-26 14:19:08,819][39m Trial 481 finished with value: 0.9090909090909092 and parameters: {'objective': 'CrossEntropy', 'colsample_bylevel': 0.09966933789730427, 'depth': 11, 'boosting_type': 'Plain', 'bootstrap_type': 'Bayesian', 'bagging_temperature': 8.742320022087656}. Best is trial 240 with value: 0.9195402298850575.
[32m[I 2023-04-26 14:19:11,533][39m Trial 482 finished with value: 0.8735632183908046 and parameters: {'objective': 'CrossEntropy', 'colsample_bylevel': 0.09999177831433656, 'depth': 10, 'boosting_type': 'Plain', 'bootstrap_type': 'MVS'}. Best is trial 240 with value: 0.9195402298850575.
[32m[I 2023-04-26 14:19:14,524][39m Trial 483 finished with value: 0.888888888888889 and parameters: {'objective': 'CrossEntropy', 'colsample_bylevel': 0.09862556213922319, 'depth': 11, 'boosting_type': 'Plain', 'bootstrap_type': 'Bayesian', 'bagging_temperature': 8.57349110979266}. Best is trial 240 with value: 0.9195402298850575.
[32m[I 2023-04-26 14:19:17,374][39m Trial 484 finished with value: 0.9069767441860465 and parameters: {'objective': 'CrossEntropy', 'colsample_bylevel': 0.09640239135812151, 'depth': 12, 'boosting_type': 'Plain', 'bootstrap_type': 'Bayesian', 'bagging_temperature': 9.698692153088988}. Best is trial 240 with value: 0.9195402298850575.
[32m[I 2023-04-26 14:19:19,125][39m Trial 485 finished with value: 0.860215053763441 and parameters: {'objective': 'CrossEntropy', 'colsample_bylevel': 0.06374698715000329, 'depth': 12, 'boosting_type': 'Plain', 'bootstrap_type': 'Bayesian', 'bagging_temperature': 9.720582853237337}. Best is trial 240 with value: 0.9195402298850575.
[32m[I 2023-04-26 14:19:21,815][39m Trial 486 finished with value: 0.8764044943820225 and parameters: {'objective': 'CrossEntropy', 'colsample_bylevel': 0.09758499639735521, 'depth': 12, 'boosting_type': 'Plain', 'bootstrap_type': 'Bayesian', 'bagging_temperature': 8.400815593621894}. Best is trial 240 with value: 0.9195402298850575.
[32m[I 2023-04-26 14:19:24,455][39m Trial 487 finished with value: 0.888888888888889 and parameters: {'objective': 'CrossEntropy', 'colsample_bylevel': 0.09467936887320054, 'depth': 12, 'boosting_type': 'Plain', 'bootstrap_type': 'Bayesian', 'bagging_temperature': 9.27750590406399}. Best is trial 240 with value: 0.9195402298850575.
[32m[I 2023-04-26 14:19:27,094][39m Trial 488 finished with value: 0.8988764044943819 and parameters: {'objective': 'CrossEntropy', 'colsample_bylevel': 0.09421894395021194, 'depth': 11, 'boosting_type': 'Plain', 'bootstrap_type': 'Bayesian', 'bagging_temperature': 9.06747191443409}. Best is trial 240 with value: 0.9195402298850575.
[32m[I 2023-04-26 14:19:29,789][39m Trial 489 finished with value: 0.8604651162790697 and parameters: {'objective': 'CrossEntropy', 'colsample_bylevel': 0.09655893457074742, 'depth': 10, 'boosting_type': 'Plain', 'bootstrap_type': 'Bayesian', 'bagging_temperature': 9.694402110192334}. Best is trial 240 with value: 0.9195402298850575.
[32m[I 2023-04-26 14:19:32,407][39m Trial 490 finished with value: 0.888888888888889 and parameters: {'objective': 'CrossEntropy', 'colsample_bylevel': 0.09955743961610328, 'depth': 10, 'boosting_type': 'Plain', 'bootstrap_type': 'Bayesian', 'bagging_temperature': 8.679240197396428}. Best is trial 240 with value: 0.9195402298850575.
[32m[I 2023-04-26 14:19:35,284][39m Trial 491 finished with value: 0.8988764044943819 and parameters: {'objective': 'CrossEntropy', 'colsample_bylevel': 0.09863178569563132, 'depth': 11, 'boosting_type': 'Plain', 'bootstrap_type': 'Bayesian', 'bagging_temperature': 8.78052916385199}. Best is trial 240 with value: 0.9195402298850575.
[32m[I 2023-04-26 14:19:37,455][39m Trial 492 finished with value: 0.8131868131868132 and parameters: {'objective': 'CrossEntropy', 'colsample_bylevel': 0.09652371249970734, 'depth': 4, 'boosting_type': 'Plain', 'bootstrap_type': 'Bayesian', 'bagging_temperature': 9.053756471282558}. Best is trial 240 with value: 0.9195402298850575.
[32m[I 2023-04-26 14:19:43,365][39m Trial 493 finished with value: 0.8043478260869564 and parameters: {'objective': 'CrossEntropy', 'colsample_bylevel': 0.09800007098595959, 'depth': 12, 'boosting_type': 'Ordered', 'bootstrap_type': 'Bayesian', 'bagging_temperature': 4.591637045521877}. Best is trial 240 with value: 0.9195402298850575.
[32m[I 2023-04-26 14:19:46,422][39m Trial 494 finished with value: 0.8988764044943819 and parameters: {'objective': 'CrossEntropy', 'colsample_bylevel': 0.09824949064106701, 'depth': 12, 'boosting_type': 'Plain', 'bootstrap_type': 'Bayesian', 'bagging_temperature': 9.98956131079471}. Best is trial 240 with value: 0.9195402298850575.
[32m[I 2023-04-26 14:19:49,196][39m Trial 495 finished with value: 0.888888888888889 and parameters: {'objective': 'CrossEntropy', 'colsample_bylevel': 0.09421697284305133, 'depth': 12, 'boosting_type': 'Plain', 'bootstrap_type': 'Bayesian', 'bagging_temperature': 9.514794361470948}. Best is trial 240 with value: 0.9195402298850575.
[32m[I 2023-04-26 14:19:52,230][39m Trial 496 finished with value: 0.8791208791208791 and parameters: {'objective': 'CrossEntropy', 'colsample_bylevel': 0.09995056617832057, 'depth': 12, 'boosting_type': 'Plain', 'bootstrap_type': 'Bayesian', 'bagging_temperature': 9.555961230716544}. Best is trial 240 with value: 0.9195402298850575.
[32m[I 2023-04-26 14:19:54,886][39m Trial 497 finished with value: 0.888888888888889 and parameters: {'objective': 'CrossEntropy', 'colsample_bylevel': 0.09224274361480118, 'depth': 11, 'boosting_type': 'Plain', 'bootstrap_type': 'Bayesian', 'bagging_temperature': 9.458858838117557}. Best is trial 240 with value: 0.9195402298850575.
[32m[I 2023-04-26 14:19:57,482][39m Trial 498 finished with value: 0.9090909090909092 and parameters: {'objective': 'CrossEntropy', 'colsample_bylevel': 0.09582406650025335, 'depth': 11, 'boosting_type': 'Plain', 'bootstrap_type': 'Bayesian', 'bagging_temperature': 9.206589151088187}. Best is trial 240 with value: 0.9195402298850575.
[32m[I 2023-04-26 14:20:00,149][39m Trial 499 finished with value: 0.888888888888889 and parameters: {'objective': 'CrossEntropy', 'colsample_bylevel': 0.09717019832263918, 'depth': 10, 'boosting_type': 'Plain', 'bootstrap_type': 'MVS'}. Best is trial 240 with value: 0.9195402298850575.
Number of finished trials: 500