[32m[I 2023-04-26 14:12:21,763][39m Trial 332 finished with value: 0.888888888888889 and parameters: {'objective': 'CrossEntropy', 'colsample_bylevel': 0.09363908869162914, 'depth': 11, 'boosting_type': 'Plain', 'bootstrap_type': 'Bayesian', 'bagging_temperature': 9.638106763499433}. Best is trial 240 with value: 0.9195402298850575.
[32m[I 2023-04-26 14:12:24,365][39m Trial 333 finished with value: 0.8764044943820225 and parameters: {'objective': 'CrossEntropy', 'colsample_bylevel': 0.09406271753622109, 'depth': 11, 'boosting_type': 'Plain', 'bootstrap_type': 'Bayesian', 'bagging_temperature': 8.98691546954761}. Best is trial 240 with value: 0.9195402298850575.
[32m[I 2023-04-26 14:12:29,277][39m Trial 334 finished with value: 0.8172043010752689 and parameters: {'objective': 'CrossEntropy', 'colsample_bylevel': 0.09045526188923697, 'depth': 11, 'boosting_type': 'Ordered', 'bootstrap_type': 'Bayesian', 'bagging_temperature': 9.98360663752082}. Best is trial 240 with value: 0.9195402298850575.
[32m[I 2023-04-26 14:12:31,753][39m Trial 335 finished with value: 0.8837209302325582 and parameters: {'objective': 'CrossEntropy', 'colsample_bylevel': 0.08868440039696156, 'depth': 12, 'boosting_type': 'Plain', 'bootstrap_type': 'MVS'}. Best is trial 240 with value: 0.9195402298850575.
[32m[I 2023-04-26 14:12:34,298][39m Trial 336 finished with value: 0.888888888888889 and parameters: {'objective': 'CrossEntropy', 'colsample_bylevel': 0.09459567484592131, 'depth': 11, 'boosting_type': 'Plain', 'bootstrap_type': 'Bayesian', 'bagging_temperature': 9.310445372765423}. Best is trial 240 with value: 0.9195402298850575.
[32m[I 2023-04-26 14:12:36,669][39m Trial 337 finished with value: 0.8863636363636364 and parameters: {'objective': 'CrossEntropy', 'colsample_bylevel': 0.09178043789569766, 'depth': 10, 'boosting_type': 'Plain', 'bootstrap_type': 'Bernoulli', 'subsample': 0.8051811087120737}. Best is trial 240 with value: 0.9195402298850575.
[32m[I 2023-04-26 14:12:39,420][39m Trial 338 finished with value: 0.8988764044943819 and parameters: {'objective': 'CrossEntropy', 'colsample_bylevel': 0.09630856100998726, 'depth': 12, 'boosting_type': 'Plain', 'bootstrap_type': 'Bayesian', 'bagging_temperature': 9.191594740520035}. Best is trial 240 with value: 0.9195402298850575.
[32m[I 2023-04-26 14:12:41,278][39m Trial 339 finished with value: 0.8131868131868132 and parameters: {'objective': 'CrossEntropy', 'colsample_bylevel': 0.09251410637238779, 'depth': 2, 'boosting_type': 'Plain', 'bootstrap_type': 'Bayesian', 'bagging_temperature': 9.410117225292383}. Best is trial 240 with value: 0.9195402298850575.
[32m[I 2023-04-26 14:12:44,389][39m Trial 340 finished with value: 0.8791208791208791 and parameters: {'objective': 'CrossEntropy', 'colsample_bylevel': 0.0979597174281271, 'depth': 12, 'boosting_type': 'Plain', 'bootstrap_type': 'Bayesian', 'bagging_temperature': 7.210312281866493}. Best is trial 240 with value: 0.9195402298850575.
[32m[I 2023-04-26 14:12:47,047][39m Trial 341 finished with value: 0.888888888888889 and parameters: {'objective': 'CrossEntropy', 'colsample_bylevel': 0.09506285224715498, 'depth': 11, 'boosting_type': 'Plain', 'bootstrap_type': 'Bayesian', 'bagging_temperature': 5.607653257467233}. Best is trial 240 with value: 0.9195402298850575.
[32m[I 2023-04-26 14:12:49,249][39m Trial 342 finished with value: 0.8791208791208791 and parameters: {'objective': 'CrossEntropy', 'colsample_bylevel': 0.09089099732298121, 'depth': 5, 'boosting_type': 'Plain', 'bootstrap_type': 'Bernoulli', 'subsample': 0.7462547007126347}. Best is trial 240 with value: 0.9195402298850575.
[32m[I 2023-04-26 14:12:51,955][39m Trial 343 finished with value: 0.8988764044943819 and parameters: {'objective': 'CrossEntropy', 'colsample_bylevel': 0.0923315849084171, 'depth': 12, 'boosting_type': 'Plain', 'bootstrap_type': 'Bayesian', 'bagging_temperature': 9.817675838989647}. Best is trial 240 with value: 0.9195402298850575.
[32m[I 2023-04-26 14:12:54,554][39m Trial 344 finished with value: 0.8863636363636364 and parameters: {'objective': 'CrossEntropy', 'colsample_bylevel': 0.09630636860175934, 'depth': 11, 'boosting_type': 'Plain', 'bootstrap_type': 'Bayesian', 'bagging_temperature': 9.792896859849519}. Best is trial 240 with value: 0.9195402298850575.
[32m[I 2023-04-26 14:12:57,222][39m Trial 345 finished with value: 0.8965517241379309 and parameters: {'objective': 'CrossEntropy', 'colsample_bylevel': 0.09864668408877494, 'depth': 11, 'boosting_type': 'Plain', 'bootstrap_type': 'Bayesian', 'bagging_temperature': 9.68391263547417}. Best is trial 240 with value: 0.9195402298850575.
[32m[I 2023-04-26 14:12:59,214][39m Trial 346 finished with value: 0.8387096774193549 and parameters: {'objective': 'CrossEntropy', 'colsample_bylevel': 0.07435907238038039, 'depth': 10, 'boosting_type': 'Plain', 'bootstrap_type': 'Bayesian', 'bagging_temperature': 8.518345010994867}. Best is trial 240 with value: 0.9195402298850575.
[32m[I 2023-04-26 14:13:01,932][39m Trial 347 finished with value: 0.8505747126436782 and parameters: {'objective': 'CrossEntropy', 'colsample_bylevel': 0.09548067138820826, 'depth': 11, 'boosting_type': 'Plain', 'bootstrap_type': 'Bayesian', 'bagging_temperature': 8.951671673134}. Best is trial 240 with value: 0.9195402298850575.
[32m[I 2023-04-26 14:13:04,556][39m Trial 348 finished with value: 0.888888888888889 and parameters: {'objective': 'CrossEntropy', 'colsample_bylevel': 0.08830372445176059, 'depth': 12, 'boosting_type': 'Plain', 'bootstrap_type': 'Bayesian', 'bagging_temperature': 9.85353897904313}. Best is trial 240 with value: 0.9195402298850575.
[32m[I 2023-04-26 14:13:07,087][39m Trial 349 finished with value: 0.8863636363636364 and parameters: {'objective': 'CrossEntropy', 'colsample_bylevel': 0.0935341509645418, 'depth': 11, 'boosting_type': 'Plain', 'bootstrap_type': 'Bayesian', 'bagging_temperature': 9.164320710560462}. Best is trial 240 with value: 0.9195402298850575.
[32m[I 2023-04-26 14:13:09,735][39m Trial 350 finished with value: 0.888888888888889 and parameters: {'objective': 'CrossEntropy', 'colsample_bylevel': 0.09390182735399323, 'depth': 11, 'boosting_type': 'Plain', 'bootstrap_type': 'Bayesian', 'bagging_temperature': 9.419696689158455}. Best is trial 240 with value: 0.9195402298850575.
[32m[I 2023-04-26 14:13:12,340][39m Trial 351 finished with value: 0.8695652173913043 and parameters: {'objective': 'CrossEntropy', 'colsample_bylevel': 0.0958829700251365, 'depth': 10, 'boosting_type': 'Plain', 'bootstrap_type': 'Bayesian', 'bagging_temperature': 3.578036847437877}. Best is trial 240 with value: 0.9195402298850575.
[32m[I 2023-04-26 14:13:15,174][39m Trial 352 finished with value: 0.8863636363636364 and parameters: {'objective': 'CrossEntropy', 'colsample_bylevel': 0.09874146554711954, 'depth': 11, 'boosting_type': 'Plain', 'bootstrap_type': 'Bayesian', 'bagging_temperature': 9.62897829868509}. Best is trial 240 with value: 0.9195402298850575.
[32m[I 2023-04-26 14:13:20,448][39m Trial 353 finished with value: 0.8043478260869564 and parameters: {'objective': 'CrossEntropy', 'colsample_bylevel': 0.09421767829792217, 'depth': 12, 'boosting_type': 'Ordered', 'bootstrap_type': 'Bayesian', 'bagging_temperature': 4.689597849154986}. Best is trial 240 with value: 0.9195402298850575.
[32m[I 2023-04-26 14:13:22,102][39m Trial 354 finished with value: 0.8387096774193549 and parameters: {'objective': 'CrossEntropy', 'colsample_bylevel': 0.05055479073563688, 'depth': 12, 'boosting_type': 'Plain', 'bootstrap_type': 'Bayesian', 'bagging_temperature': 9.835980868060892}. Best is trial 240 with value: 0.9195402298850575.
[32m[I 2023-04-26 14:13:24,869][39m Trial 355 finished with value: 0.8764044943820225 and parameters: {'objective': 'CrossEntropy', 'colsample_bylevel': 0.0968164983901688, 'depth': 12, 'boosting_type': 'Plain', 'bootstrap_type': 'Bernoulli', 'subsample': 0.2487552414449825}. Best is trial 240 with value: 0.9195402298850575.
[32m[I 2023-04-26 14:13:27,520][39m Trial 356 finished with value: 0.888888888888889 and parameters: {'objective': 'CrossEntropy', 'colsample_bylevel': 0.09125808189325835, 'depth': 11, 'boosting_type': 'Plain', 'bootstrap_type': 'Bayesian', 'bagging_temperature': 8.785105102040783}. Best is trial 240 with value: 0.9195402298850575.
[32m[I 2023-04-26 14:13:30,099][39m Trial 357 finished with value: 0.8965517241379309 and parameters: {'objective': 'CrossEntropy', 'colsample_bylevel': 0.09633304244992055, 'depth': 10, 'boosting_type': 'Plain', 'bootstrap_type': 'Bayesian', 'bagging_temperature': 8.808608529992997}. Best is trial 240 with value: 0.9195402298850575.
[32m[I 2023-04-26 14:13:32,739][39m Trial 358 finished with value: 0.8666666666666666 and parameters: {'objective': 'Logloss', 'colsample_bylevel': 0.09985428697163296, 'depth': 10, 'boosting_type': 'Plain', 'bootstrap_type': 'Bernoulli', 'subsample': 0.6551945106709438}. Best is trial 240 with value: 0.9195402298850575.
[32m[I 2023-04-26 14:13:35,378][39m Trial 359 finished with value: 0.9090909090909092 and parameters: {'objective': 'CrossEntropy', 'colsample_bylevel': 0.09675021696095945, 'depth': 11, 'boosting_type': 'Plain', 'bootstrap_type': 'Bayesian', 'bagging_temperature': 9.009452072634721}. Best is trial 240 with value: 0.9195402298850575.
[32m[I 2023-04-26 14:13:38,057][39m Trial 360 finished with value: 0.8988764044943819 and parameters: {'objective': 'CrossEntropy', 'colsample_bylevel': 0.09685528425694215, 'depth': 11, 'boosting_type': 'Plain', 'bootstrap_type': 'Bayesian', 'bagging_temperature': 9.111174786664307}. Best is trial 240 with value: 0.9195402298850575.
[32m[I 2023-04-26 14:13:40,709][39m Trial 361 finished with value: 0.9090909090909092 and parameters: {'objective': 'CrossEntropy', 'colsample_bylevel': 0.09533044078626779, 'depth': 11, 'boosting_type': 'Plain', 'bootstrap_type': 'Bayesian', 'bagging_temperature': 9.041500053611019}. Best is trial 240 with value: 0.9195402298850575.
[32m[I 2023-04-26 14:13:43,673][39m Trial 362 finished with value: 0.8988764044943819 and parameters: {'objective': 'CrossEntropy', 'colsample_bylevel': 0.09606559570079537, 'depth': 12, 'boosting_type': 'Plain', 'bootstrap_type': 'Bayesian', 'bagging_temperature': 8.985971836541788}. Best is trial 240 with value: 0.9195402298850575.
[32m[I 2023-04-26 14:13:46,236][39m Trial 363 finished with value: 0.888888888888889 and parameters: {'objective': 'CrossEntropy', 'colsample_bylevel': 0.09486795487650998, 'depth': 10, 'boosting_type': 'Plain', 'bootstrap_type': 'Bayesian', 'bagging_temperature': 8.607120103758438}. Best is trial 240 with value: 0.9195402298850575.
[32m[I 2023-04-26 14:13:48,976][39m Trial 364 finished with value: 0.8863636363636364 and parameters: {'objective': 'CrossEntropy', 'colsample_bylevel': 0.09663068876926853, 'depth': 12, 'boosting_type': 'Plain', 'bootstrap_type': 'Bayesian', 'bagging_temperature': 8.98033859372484}. Best is trial 240 with value: 0.9195402298850575.
[32m[I 2023-04-26 14:13:51,576][39m Trial 365 finished with value: 0.8988764044943819 and parameters: {'objective': 'CrossEntropy', 'colsample_bylevel': 0.09256083689339863, 'depth': 11, 'boosting_type': 'Plain', 'bootstrap_type': 'Bayesian', 'bagging_temperature': 9.404634435223793}. Best is trial 240 with value: 0.9195402298850575.
[32m[I 2023-04-26 14:13:54,189][39m Trial 366 finished with value: 0.8988764044943819 and parameters: {'objective': 'CrossEntropy', 'colsample_bylevel': 0.09214918776729472, 'depth': 11, 'boosting_type': 'Plain', 'bootstrap_type': 'Bayesian', 'bagging_temperature': 9.261151077741031}. Best is trial 240 with value: 0.9195402298850575.
[32m[I 2023-04-26 14:13:56,714][39m Trial 367 finished with value: 0.8988764044943819 and parameters: {'objective': 'CrossEntropy', 'colsample_bylevel': 0.09388872166503068, 'depth': 11, 'boosting_type': 'Plain', 'bootstrap_type': 'Bayesian', 'bagging_temperature': 9.349113761377312}. Best is trial 240 with value: 0.9195402298850575.
[32m[I 2023-04-26 14:13:59,261][39m Trial 368 finished with value: 0.8965517241379309 and parameters: {'objective': 'CrossEntropy', 'colsample_bylevel': 0.09463615447899079, 'depth': 11, 'boosting_type': 'Plain', 'bootstrap_type': 'Bayesian', 'bagging_temperature': 8.731743658364033}. Best is trial 240 with value: 0.9195402298850575.
[32m[I 2023-04-26 14:14:01,616][39m Trial 369 finished with value: 0.8791208791208791 and parameters: {'objective': 'CrossEntropy', 'colsample_bylevel': 0.08633251596785535, 'depth': 11, 'boosting_type': 'Plain', 'bootstrap_type': 'Bayesian', 'bagging_temperature': 9.660867847957954}. Best is trial 240 with value: 0.9195402298850575.
[32m[I 2023-04-26 14:14:04,037][39m Trial 370 finished with value: 0.8791208791208791 and parameters: {'objective': 'CrossEntropy', 'colsample_bylevel': 0.0930273095882414, 'depth': 11, 'boosting_type': 'Plain', 'bootstrap_type': 'Bayesian', 'bagging_temperature': 7.641084871572865}. Best is trial 240 with value: 0.9195402298850575.
[32m[I 2023-04-26 14:14:06,511][39m Trial 371 finished with value: 0.888888888888889 and parameters: {'objective': 'CrossEntropy', 'colsample_bylevel': 0.09166912031682127, 'depth': 11, 'boosting_type': 'Plain', 'bootstrap_type': 'Bayesian', 'bagging_temperature': 9.333235128815836}. Best is trial 240 with value: 0.9195402298850575.
[32m[I 2023-04-26 14:14:07,857][39m Trial 372 finished with value: 0.8000000000000002 and parameters: {'objective': 'CrossEntropy', 'colsample_bylevel': 0.02945830518854195, 'depth': 11, 'boosting_type': 'Plain', 'bootstrap_type': 'Bayesian', 'bagging_temperature': 9.042302726495073}. Best is trial 240 with value: 0.9195402298850575.
[32m[I 2023-04-26 14:14:10,573][39m Trial 373 finished with value: 0.8735632183908046 and parameters: {'objective': 'CrossEntropy', 'colsample_bylevel': 0.09748875780203725, 'depth': 11, 'boosting_type': 'Plain', 'bootstrap_type': 'MVS'}. Best is trial 240 with value: 0.9195402298850575.
[32m[I 2023-04-26 14:14:15,793][39m Trial 374 finished with value: 0.8172043010752689 and parameters: {'objective': 'CrossEntropy', 'colsample_bylevel': 0.08960957999435912, 'depth': 11, 'boosting_type': 'Ordered', 'bootstrap_type': 'Bayesian', 'bagging_temperature': 4.950154014388483}. Best is trial 240 with value: 0.9195402298850575.
[32m[I 2023-04-26 14:14:18,407][39m Trial 375 finished with value: 0.888888888888889 and parameters: {'objective': 'CrossEntropy', 'colsample_bylevel': 0.0914970746159907, 'depth': 12, 'boosting_type': 'Plain', 'bootstrap_type': 'Bayesian', 'bagging_temperature': 9.974149442456843}. Best is trial 240 with value: 0.9195402298850575.
[32m[I 2023-04-26 14:14:20,940][39m Trial 376 finished with value: 0.8863636363636364 and parameters: {'objective': 'CrossEntropy', 'colsample_bylevel': 0.09382440467838413, 'depth': 11, 'boosting_type': 'Plain', 'bootstrap_type': 'Bayesian', 'bagging_temperature': 9.484863323791586}. Best is trial 240 with value: 0.9195402298850575.
[32m[I 2023-04-26 14:14:23,445][39m Trial 377 finished with value: 0.8764044943820225 and parameters: {'objective': 'CrossEntropy', 'colsample_bylevel': 0.09537117102854971, 'depth': 11, 'boosting_type': 'Plain', 'bootstrap_type': 'Bayesian', 'bagging_temperature': 4.267772017860732}. Best is trial 240 with value: 0.9195402298850575.
[32m[I 2023-04-26 14:14:26,333][39m Trial 378 finished with value: 0.8764044943820225 and parameters: {'objective': 'CrossEntropy', 'colsample_bylevel': 0.0997309844243947, 'depth': 12, 'boosting_type': 'Plain', 'bootstrap_type': 'Bayesian', 'bagging_temperature': 9.624025227568396}. Best is trial 240 with value: 0.9195402298850575.
[32m[I 2023-04-26 14:14:29,063][39m Trial 379 finished with value: 0.888888888888889 and parameters: {'objective': 'CrossEntropy', 'colsample_bylevel': 0.09344647321997855, 'depth': 12, 'boosting_type': 'Plain', 'bootstrap_type': 'Bayesian', 'bagging_temperature': 9.746742854398498}. Best is trial 240 with value: 0.9195402298850575.
[32m[I 2023-04-26 14:14:32,078][39m Trial 380 finished with value: 0.8988764044943819 and parameters: {'objective': 'CrossEntropy', 'colsample_bylevel': 0.09780475849187345, 'depth': 12, 'boosting_type': 'Plain', 'bootstrap_type': 'Bayesian', 'bagging_temperature': 9.999211132141806}. Best is trial 240 with value: 0.9195402298850575.
[32m[I 2023-04-26 14:14:35,004][39m Trial 381 finished with value: 0.8863636363636364 and parameters: {'objective': 'CrossEntropy', 'colsample_bylevel': 0.09830557894668517, 'depth': 11, 'boosting_type': 'Plain', 'bootstrap_type': 'Bayesian', 'bagging_temperature': 9.15635258140408}. Best is trial 240 with value: 0.9195402298850575.
[32m[I 2023-04-26 14:14:37,583][39m Trial 382 finished with value: 0.8988764044943819 and parameters: {'objective': 'CrossEntropy', 'colsample_bylevel': 0.09466222459186613, 'depth': 11, 'boosting_type': 'Plain', 'bootstrap_type': 'Bayesian', 'bagging_temperature': 9.539337017978243}. Best is trial 240 with value: 0.9195402298850575.
[32m[I 2023-04-26 14:14:40,069][39m Trial 383 finished with value: 0.888888888888889 and parameters: {'objective': 'CrossEntropy', 'colsample_bylevel': 0.088510875525217, 'depth': 12, 'boosting_type': 'Plain', 'bootstrap_type': 'Bayesian', 'bagging_temperature': 9.316965955002573}. Best is trial 240 with value: 0.9195402298850575.
[32m[I 2023-04-26 14:14:42,786][39m Trial 384 finished with value: 0.888888888888889 and parameters: {'objective': 'CrossEntropy', 'colsample_bylevel': 0.09621722645724694, 'depth': 12, 'boosting_type': 'Plain', 'bootstrap_type': 'Bayesian', 'bagging_temperature': 9.969692858043693}. Best is trial 240 with value: 0.9195402298850575.
[32m[I 2023-04-26 14:14:45,479][39m Trial 385 finished with value: 0.8988764044943819 and parameters: {'objective': 'CrossEntropy', 'colsample_bylevel': 0.09594986478829937, 'depth': 11, 'boosting_type': 'Plain', 'bootstrap_type': 'Bayesian', 'bagging_temperature': 9.163486284095356}. Best is trial 240 with value: 0.9195402298850575.
[32m[I 2023-04-26 14:14:48,332][39m Trial 386 finished with value: 0.8988764044943819 and parameters: {'objective': 'CrossEntropy', 'colsample_bylevel': 0.09992508116051305, 'depth': 11, 'boosting_type': 'Plain', 'bootstrap_type': 'Bayesian', 'bagging_temperature': 8.859458319728384}. Best is trial 240 with value: 0.9195402298850575.
[32m[I 2023-04-26 14:14:50,338][39m Trial 387 finished with value: 0.8260869565217392 and parameters: {'objective': 'CrossEntropy', 'colsample_bylevel': 0.0906180587754126, 'depth': 3, 'boosting_type': 'Plain', 'bootstrap_type': 'Bayesian', 'bagging_temperature': 2.177708488677162}. Best is trial 240 with value: 0.9195402298850575.
[32m[I 2023-04-26 14:14:53,089][39m Trial 388 finished with value: 0.888888888888889 and parameters: {'objective': 'CrossEntropy', 'colsample_bylevel': 0.09994983855081795, 'depth': 11, 'boosting_type': 'Plain', 'bootstrap_type': 'Bayesian', 'bagging_temperature': 9.517315189126368}. Best is trial 240 with value: 0.9195402298850575.
[32m[I 2023-04-26 14:14:55,523][39m Trial 389 finished with value: 0.888888888888889 and parameters: {'objective': 'CrossEntropy', 'colsample_bylevel': 0.08944687111762441, 'depth': 11, 'boosting_type': 'Plain', 'bootstrap_type': 'Bayesian', 'bagging_temperature': 8.92612320785675}. Best is trial 240 with value: 0.9195402298850575.
[32m[I 2023-04-26 14:14:58,241][39m Trial 390 finished with value: 0.8863636363636364 and parameters: {'objective': 'CrossEntropy', 'colsample_bylevel': 0.0981471768379985, 'depth': 11, 'boosting_type': 'Plain', 'bootstrap_type': 'Bayesian', 'bagging_temperature': 9.200034863395288}. Best is trial 240 with value: 0.9195402298850575.
[32m[I 2023-04-26 14:15:00,797][39m Trial 391 finished with value: 0.9090909090909092 and parameters: {'objective': 'CrossEntropy', 'colsample_bylevel': 0.09727588996887636, 'depth': 11, 'boosting_type': 'Plain', 'bootstrap_type': 'Bayesian', 'bagging_temperature': 8.969818131306347}. Best is trial 240 with value: 0.9195402298850575.
[32m[I 2023-04-26 14:15:03,132][39m Trial 392 finished with value: 0.8571428571428571 and parameters: {'objective': 'CrossEntropy', 'colsample_bylevel': 0.08702158638518236, 'depth': 11, 'boosting_type': 'Plain', 'bootstrap_type': 'Bayesian', 'bagging_temperature': 8.721274511070112}. Best is trial 240 with value: 0.9195402298850575.
[32m[I 2023-04-26 14:15:05,811][39m Trial 393 finished with value: 0.8764044943820225 and parameters: {'objective': 'CrossEntropy', 'colsample_bylevel': 0.09794981618648776, 'depth': 11, 'boosting_type': 'Plain', 'bootstrap_type': 'Bayesian', 'bagging_temperature': 8.951293311806745}. Best is trial 240 with value: 0.9195402298850575.
[32m[I 2023-04-26 14:15:11,588][39m Trial 394 finished with value: 0.8297872340425531 and parameters: {'objective': 'CrossEntropy', 'colsample_bylevel': 0.09194345903728879, 'depth': 12, 'boosting_type': 'Ordered', 'bootstrap_type': 'Bayesian', 'bagging_temperature': 8.99801657109515}. Best is trial 240 with value: 0.9195402298850575.
[32m[I 2023-04-26 14:15:14,154][39m Trial 395 finished with value: 0.8604651162790697 and parameters: {'objective': 'CrossEntropy', 'colsample_bylevel': 0.09665807469304419, 'depth': 10, 'boosting_type': 'Plain', 'bootstrap_type': 'Bayesian', 'bagging_temperature': 8.365481286030622}. Best is trial 240 with value: 0.9195402298850575.
[32m[I 2023-04-26 14:15:16,828][39m Trial 396 finished with value: 0.8791208791208791 and parameters: {'objective': 'CrossEntropy', 'colsample_bylevel': 0.09536667681529223, 'depth': 11, 'boosting_type': 'Plain', 'bootstrap_type': 'MVS'}. Best is trial 240 with value: 0.9195402298850575.
