[32m[I 2023-04-26 13:56:14,886][39m A new study created in memory with name: no-name-f4a5b30e-c56c-48cc-83c1-4c1c8db29b57
[32m[I 2023-04-26 13:56:16,133][39m Trial 0 finished with value: 0.7999999999999999 and parameters: {'objective': 'Logloss', 'colsample_bylevel': 0.02012308897177502, 'depth': 6, 'boosting_type': 'Plain', 'bootstrap_type': 'MVS'}. Best is trial 0 with value: 0.7999999999999999.
[32m[I 2023-04-26 13:56:17,199][39m Trial 1 finished with value: 0.7169811320754716 and parameters: {'objective': 'Logloss', 'colsample_bylevel': 0.011380973663056678, 'depth': 4, 'boosting_type': 'Plain', 'bootstrap_type': 'Bayesian', 'bagging_temperature': 0.5027562192823343}. Best is trial 0 with value: 0.7999999999999999.
[32m[I 2023-04-26 13:56:21,344][39m Trial 2 finished with value: 0.8297872340425531 and parameters: {'objective': 'CrossEntropy', 'colsample_bylevel': 0.05407814170333493, 'depth': 5, 'boosting_type': 'Ordered', 'bootstrap_type': 'Bayesian', 'bagging_temperature': 7.727864788040783}. Best is trial 2 with value: 0.8297872340425531.
[32m[I 2023-04-26 13:56:24,763][39m Trial 3 finished with value: 0.7608695652173912 and parameters: {'objective': 'CrossEntropy', 'colsample_bylevel': 0.03832073608340674, 'depth': 5, 'boosting_type': 'Ordered', 'bootstrap_type': 'MVS'}. Best is trial 2 with value: 0.8297872340425531.
[32m[I 2023-04-26 13:56:26,073][39m Trial 4 finished with value: 0.7741935483870966 and parameters: {'objective': 'CrossEntropy', 'colsample_bylevel': 0.04387803109567498, 'depth': 4, 'boosting_type': 'Plain', 'bootstrap_type': 'Bernoulli', 'subsample': 0.28423428923817134}. Best is trial 2 with value: 0.8297872340425531.
[32m[I 2023-04-26 13:56:28,668][39m Trial 5 finished with value: 0.7047619047619048 and parameters: {'objective': 'Logloss', 'colsample_bylevel': 0.049197360729234973, 'depth': 1, 'boosting_type': 'Ordered', 'bootstrap_type': 'MVS'}. Best is trial 2 with value: 0.8297872340425531.
[32m[I 2023-04-26 13:56:30,237][39m Trial 6 finished with value: 0.782608695652174 and parameters: {'objective': 'CrossEntropy', 'colsample_bylevel': 0.049478646727692574, 'depth': 2, 'boosting_type': 'Plain', 'bootstrap_type': 'Bayesian', 'bagging_temperature': 5.3870141258753135}. Best is trial 2 with value: 0.8297872340425531.
[32m[I 2023-04-26 13:56:33,367][39m Trial 7 finished with value: 0.7956989247311829 and parameters: {'objective': 'CrossEntropy', 'colsample_bylevel': 0.052778515080910644, 'depth': 10, 'boosting_type': 'Ordered', 'bootstrap_type': 'Bayesian', 'bagging_temperature': 0.1270443612810468}. Best is trial 2 with value: 0.8297872340425531.
[32m[I 2023-04-26 13:56:36,137][39m Trial 8 finished with value: 0.7592592592592593 and parameters: {'objective': 'CrossEntropy', 'colsample_bylevel': 0.030708758491233216, 'depth': 12, 'boosting_type': 'Ordered', 'bootstrap_type': 'Bayesian', 'bagging_temperature': 9.343571704924313}. Best is trial 2 with value: 0.8297872340425531.
[32m[I 2023-04-26 13:56:37,802][39m Trial 9 finished with value: 0.8421052631578947 and parameters: {'objective': 'Logloss', 'colsample_bylevel': 0.060906372686758685, 'depth': 6, 'boosting_type': 'Plain', 'bootstrap_type': 'MVS'}. Best is trial 9 with value: 0.8421052631578947.
[32m[I 2023-04-26 13:56:40,817][39m Trial 10 finished with value: 0.888888888888889 and parameters: {'objective': 'Logloss', 'colsample_bylevel': 0.08373395517880236, 'depth': 8, 'boosting_type': 'Plain', 'bootstrap_type': 'Bernoulli', 'subsample': 0.9858470177100802}. Best is trial 10 with value: 0.888888888888889.
[32m[I 2023-04-26 13:56:43,499][39m Trial 11 finished with value: 0.8571428571428571 and parameters: {'objective': 'Logloss', 'colsample_bylevel': 0.08345425234106829, 'depth': 8, 'boosting_type': 'Plain', 'bootstrap_type': 'Bernoulli', 'subsample': 0.9056084782632106}. Best is trial 10 with value: 0.888888888888889.
[32m[I 2023-04-26 13:56:47,296][39m Trial 12 finished with value: 0.8791208791208791 and parameters: {'objective': 'Logloss', 'colsample_bylevel': 0.08697088546422328, 'depth': 9, 'boosting_type': 'Plain', 'bootstrap_type': 'Bernoulli', 'subsample': 0.9931744839444818}. Best is trial 10 with value: 0.888888888888889.
[32m[I 2023-04-26 13:56:51,430][39m Trial 13 finished with value: 0.8791208791208791 and parameters: {'objective': 'Logloss', 'colsample_bylevel': 0.09969728535447106, 'depth': 9, 'boosting_type': 'Plain', 'bootstrap_type': 'Bernoulli', 'subsample': 0.9921436749169631}. Best is trial 10 with value: 0.888888888888889.
[32m[I 2023-04-26 13:56:53,376][39m Trial 14 finished with value: 0.8571428571428571 and parameters: {'objective': 'Logloss', 'colsample_bylevel': 0.07730286218647883, 'depth': 11, 'boosting_type': 'Plain', 'bootstrap_type': 'Bernoulli', 'subsample': 0.7425675335563228}. Best is trial 10 with value: 0.888888888888889.
[32m[I 2023-04-26 13:56:56,959][39m Trial 15 finished with value: 0.8571428571428571 and parameters: {'objective': 'Logloss', 'colsample_bylevel': 0.09959348760867347, 'depth': 8, 'boosting_type': 'Plain', 'bootstrap_type': 'Bernoulli', 'subsample': 0.5974045521511439}. Best is trial 10 with value: 0.888888888888889.
[32m[I 2023-04-26 13:56:59,398][39m Trial 16 finished with value: 0.851063829787234 and parameters: {'objective': 'Logloss', 'colsample_bylevel': 0.07642875883827567, 'depth': 8, 'boosting_type': 'Plain', 'bootstrap_type': 'Bernoulli', 'subsample': 0.9205607877013752}. Best is trial 10 with value: 0.888888888888889.
[32m[I 2023-04-26 13:57:01,931][39m Trial 17 finished with value: 0.8764044943820225 and parameters: {'objective': 'Logloss', 'colsample_bylevel': 0.09889015991147779, 'depth': 10, 'boosting_type': 'Plain', 'bootstrap_type': 'Bernoulli', 'subsample': 0.3136324369758065}. Best is trial 10 with value: 0.888888888888889.
[32m[I 2023-04-26 13:57:03,895][39m Trial 18 finished with value: 0.851063829787234 and parameters: {'objective': 'Logloss', 'colsample_bylevel': 0.06743375324041447, 'depth': 7, 'boosting_type': 'Plain', 'bootstrap_type': 'Bernoulli', 'subsample': 0.724213746128426}. Best is trial 10 with value: 0.888888888888889.
[32m[I 2023-04-26 13:57:06,294][39m Trial 19 finished with value: 0.8666666666666666 and parameters: {'objective': 'Logloss', 'colsample_bylevel': 0.09038730891509518, 'depth': 12, 'boosting_type': 'Plain', 'bootstrap_type': 'Bernoulli', 'subsample': 0.7800560512453992}. Best is trial 10 with value: 0.888888888888889.
[32m[I 2023-04-26 13:57:08,071][39m Trial 20 finished with value: 0.8172043010752689 and parameters: {'objective': 'Logloss', 'colsample_bylevel': 0.06900316693663575, 'depth': 10, 'boosting_type': 'Plain', 'bootstrap_type': 'Bernoulli', 'subsample': 0.5005849595504975}. Best is trial 10 with value: 0.888888888888889.
[32m[I 2023-04-26 13:57:11,826][39m Trial 21 finished with value: 0.8988764044943819 and parameters: {'objective': 'Logloss', 'colsample_bylevel': 0.09060259577268577, 'depth': 9, 'boosting_type': 'Plain', 'bootstrap_type': 'Bernoulli', 'subsample': 0.9956073106968286}. Best is trial 21 with value: 0.8988764044943819.
[32m[I 2023-04-26 13:57:15,710][39m Trial 22 finished with value: 0.8764044943820225 and parameters: {'objective': 'Logloss', 'colsample_bylevel': 0.09317340246656694, 'depth': 9, 'boosting_type': 'Plain', 'bootstrap_type': 'Bernoulli', 'subsample': 0.9682481299433884}. Best is trial 21 with value: 0.8988764044943819.
[32m[I 2023-04-26 13:57:18,042][39m Trial 23 finished with value: 0.8387096774193549 and parameters: {'objective': 'Logloss', 'colsample_bylevel': 0.08132844865748588, 'depth': 7, 'boosting_type': 'Plain', 'bootstrap_type': 'Bernoulli', 'subsample': 0.8483493945744879}. Best is trial 21 with value: 0.8988764044943819.
[32m[I 2023-04-26 13:57:21,770][39m Trial 24 finished with value: 0.8636363636363636 and parameters: {'objective': 'Logloss', 'colsample_bylevel': 0.09412639711930064, 'depth': 9, 'boosting_type': 'Plain', 'bootstrap_type': 'Bernoulli', 'subsample': 0.9945241394183624}. Best is trial 21 with value: 0.8988764044943819.
[32m[I 2023-04-26 13:57:23,912][39m Trial 25 finished with value: 0.8478260869565216 and parameters: {'objective': 'Logloss', 'colsample_bylevel': 0.08735139707589228, 'depth': 11, 'boosting_type': 'Plain', 'bootstrap_type': 'Bernoulli', 'subsample': 0.1241445819548263}. Best is trial 21 with value: 0.8988764044943819.
[32m[I 2023-04-26 13:57:27,776][39m Trial 26 finished with value: 0.7956989247311829 and parameters: {'objective': 'Logloss', 'colsample_bylevel': 0.07030341933465775, 'depth': 8, 'boosting_type': 'Ordered', 'bootstrap_type': 'Bernoulli', 'subsample': 0.8353084267284754}. Best is trial 21 with value: 0.8988764044943819.
[32m[I 2023-04-26 13:57:30,147][39m Trial 27 finished with value: 0.8387096774193549 and parameters: {'objective': 'Logloss', 'colsample_bylevel': 0.07858562362728068, 'depth': 11, 'boosting_type': 'Plain', 'bootstrap_type': 'Bernoulli', 'subsample': 0.622694718357639}. Best is trial 21 with value: 0.8988764044943819.
[32m[I 2023-04-26 13:57:34,850][39m Trial 28 finished with value: 0.8988764044943819 and parameters: {'objective': 'Logloss', 'colsample_bylevel': 0.09988675691837005, 'depth': 9, 'boosting_type': 'Plain', 'bootstrap_type': 'Bernoulli', 'subsample': 0.8661602177248121}. Best is trial 21 with value: 0.8988764044943819.
[32m[I 2023-04-26 13:57:36,924][39m Trial 29 finished with value: 0.8260869565217392 and parameters: {'objective': 'Logloss', 'colsample_bylevel': 0.06233186468919995, 'depth': 7, 'boosting_type': 'Plain', 'bootstrap_type': 'MVS'}. Best is trial 21 with value: 0.8988764044943819.
[32m[I 2023-04-26 13:57:39,217][39m Trial 30 finished with value: 0.8791208791208791 and parameters: {'objective': 'Logloss', 'colsample_bylevel': 0.09267535660332116, 'depth': 6, 'boosting_type': 'Plain', 'bootstrap_type': 'MVS'}. Best is trial 21 with value: 0.8988764044943819.
[32m[I 2023-04-26 13:57:41,486][39m Trial 31 finished with value: 0.8666666666666666 and parameters: {'objective': 'Logloss', 'colsample_bylevel': 0.09376982784289595, 'depth': 6, 'boosting_type': 'Plain', 'bootstrap_type': 'MVS'}. Best is trial 21 with value: 0.8988764044943819.
[32m[I 2023-04-26 13:57:43,538][39m Trial 32 finished with value: 0.8351648351648352 and parameters: {'objective': 'Logloss', 'colsample_bylevel': 0.08552102174670151, 'depth': 5, 'boosting_type': 'Plain', 'bootstrap_type': 'MVS'}. Best is trial 21 with value: 0.8988764044943819.
[32m[I 2023-04-26 13:57:46,173][39m Trial 33 finished with value: 0.8666666666666666 and parameters: {'objective': 'Logloss', 'colsample_bylevel': 0.09140714870429802, 'depth': 7, 'boosting_type': 'Plain', 'bootstrap_type': 'MVS'}. Best is trial 21 with value: 0.8988764044943819.
[32m[I 2023-04-26 13:57:47,340][39m Trial 34 finished with value: 0.7387387387387387 and parameters: {'objective': 'Logloss', 'colsample_bylevel': 0.01260254704287534, 'depth': 4, 'boosting_type': 'Plain', 'bootstrap_type': 'MVS'}. Best is trial 21 with value: 0.8988764044943819.
[32m[I 2023-04-26 13:57:51,312][39m Trial 35 finished with value: 0.8172043010752689 and parameters: {'objective': 'CrossEntropy', 'colsample_bylevel': 0.07401566473179552, 'depth': 9, 'boosting_type': 'Ordered', 'bootstrap_type': 'Bernoulli', 'subsample': 0.8687865997596578}. Best is trial 21 with value: 0.8988764044943819.
[32m[I 2023-04-26 13:57:53,536][39m Trial 36 finished with value: 0.8172043010752689 and parameters: {'objective': 'Logloss', 'colsample_bylevel': 0.09561074459146122, 'depth': 5, 'boosting_type': 'Plain', 'bootstrap_type': 'Bayesian', 'bagging_temperature': 3.4173752903532013}. Best is trial 21 with value: 0.8988764044943819.
[32m[I 2023-04-26 13:57:55,520][39m Trial 37 finished with value: 0.851063829787234 and parameters: {'objective': 'CrossEntropy', 'colsample_bylevel': 0.08200557566173124, 'depth': 3, 'boosting_type': 'Plain', 'bootstrap_type': 'MVS'}. Best is trial 21 with value: 0.8988764044943819.
[32m[I 2023-04-26 13:58:00,203][39m Trial 38 finished with value: 0.8043478260869564 and parameters: {'objective': 'Logloss', 'colsample_bylevel': 0.08954295604935454, 'depth': 8, 'boosting_type': 'Ordered', 'bootstrap_type': 'Bayesian', 'bagging_temperature': 4.19885352469583}. Best is trial 21 with value: 0.8988764044943819.
[32m[I 2023-04-26 13:58:03,007][39m Trial 39 finished with value: 0.8735632183908046 and parameters: {'objective': 'CrossEntropy', 'colsample_bylevel': 0.09984423960578208, 'depth': 10, 'boosting_type': 'Plain', 'bootstrap_type': 'Bernoulli', 'subsample': 0.9939677469593011}. Best is trial 21 with value: 0.8988764044943819.
[32m[I 2023-04-26 13:58:07,009][39m Trial 40 finished with value: 0.7755102040816327 and parameters: {'objective': 'Logloss', 'colsample_bylevel': 0.035242798623978326, 'depth': 6, 'boosting_type': 'Ordered', 'bootstrap_type': 'MVS'}. Best is trial 21 with value: 0.8988764044943819.
[32m[I 2023-04-26 13:58:10,593][39m Trial 41 finished with value: 0.8666666666666666 and parameters: {'objective': 'Logloss', 'colsample_bylevel': 0.08666478839569941, 'depth': 9, 'boosting_type': 'Plain', 'bootstrap_type': 'Bernoulli', 'subsample': 0.8887220725849256}. Best is trial 21 with value: 0.8988764044943819.
[32m[I 2023-04-26 13:58:13,791][39m Trial 42 finished with value: 0.8636363636363636 and parameters: {'objective': 'Logloss', 'colsample_bylevel': 0.09545908417169797, 'depth': 8, 'boosting_type': 'Plain', 'bootstrap_type': 'Bernoulli', 'subsample': 0.8078521209588057}. Best is trial 21 with value: 0.8988764044943819.
[32m[I 2023-04-26 13:58:15,969][39m Trial 43 finished with value: 0.8791208791208791 and parameters: {'objective': 'Logloss', 'colsample_bylevel': 0.08549620227282531, 'depth': 10, 'boosting_type': 'Plain', 'bootstrap_type': 'Bernoulli', 'subsample': 0.9281208653110099}. Best is trial 21 with value: 0.8988764044943819.
[32m[I 2023-04-26 13:58:20,955][39m Trial 44 finished with value: 0.8791208791208791 and parameters: {'objective': 'Logloss', 'colsample_bylevel': 0.09718362866691976, 'depth': 9, 'boosting_type': 'Plain', 'bootstrap_type': 'Bayesian', 'bagging_temperature': 6.7604097400011405}. Best is trial 21 with value: 0.8988764044943819.
[32m[I 2023-04-26 13:58:23,958][39m Trial 45 finished with value: 0.8764044943820225 and parameters: {'objective': 'CrossEntropy', 'colsample_bylevel': 0.08996656872783516, 'depth': 7, 'boosting_type': 'Plain', 'bootstrap_type': 'Bayesian', 'bagging_temperature': 6.585093953389636}. Best is trial 21 with value: 0.8988764044943819.
[32m[I 2023-04-26 13:58:26,244][39m Trial 46 finished with value: 0.8478260869565216 and parameters: {'objective': 'Logloss', 'colsample_bylevel': 0.0828969561396107, 'depth': 10, 'boosting_type': 'Plain', 'bootstrap_type': 'Bernoulli', 'subsample': 0.6858780260897321}. Best is trial 21 with value: 0.8988764044943819.
[32m[I 2023-04-26 13:58:27,531][39m Trial 47 finished with value: 0.7843137254901961 and parameters: {'objective': 'Logloss', 'colsample_bylevel': 0.024781505066065863, 'depth': 8, 'boosting_type': 'Plain', 'bootstrap_type': 'Bernoulli', 'subsample': 0.9163781994467034}. Best is trial 21 with value: 0.8988764044943819.
[32m[I 2023-04-26 13:58:30,710][39m Trial 48 finished with value: 0.7741935483870966 and parameters: {'objective': 'Logloss', 'colsample_bylevel': 0.04702032651633367, 'depth': 9, 'boosting_type': 'Ordered', 'bootstrap_type': 'Bayesian', 'bagging_temperature': 9.870119624852906}. Best is trial 21 with value: 0.8988764044943819.
[32m[I 2023-04-26 13:58:33,020][39m Trial 49 finished with value: 0.8260869565217392 and parameters: {'objective': 'Logloss', 'colsample_bylevel': 0.0739221095457378, 'depth': 11, 'boosting_type': 'Plain', 'bootstrap_type': 'Bayesian', 'bagging_temperature': 2.4513750273385404}. Best is trial 21 with value: 0.8988764044943819.
[32m[I 2023-04-26 13:58:35,442][39m Trial 50 finished with value: 0.8478260869565216 and parameters: {'objective': 'CrossEntropy', 'colsample_bylevel': 0.09709885626684228, 'depth': 6, 'boosting_type': 'Plain', 'bootstrap_type': 'Bayesian', 'bagging_temperature': 7.679697543881918}. Best is trial 21 with value: 0.8988764044943819.
[32m[I 2023-04-26 13:58:38,954][39m Trial 51 finished with value: 0.8791208791208791 and parameters: {'objective': 'Logloss', 'colsample_bylevel': 0.08936873133799923, 'depth': 9, 'boosting_type': 'Plain', 'bootstrap_type': 'Bernoulli', 'subsample': 0.9926180836271187}. Best is trial 21 with value: 0.8988764044943819.
[32m[I 2023-04-26 13:58:42,274][39m Trial 52 finished with value: 0.888888888888889 and parameters: {'objective': 'Logloss', 'colsample_bylevel': 0.09096621066981038, 'depth': 8, 'boosting_type': 'Plain', 'bootstrap_type': 'Bernoulli', 'subsample': 0.9938233997351503}. Best is trial 21 with value: 0.8988764044943819.
[32m[I 2023-04-26 13:58:45,398][39m Trial 53 finished with value: 0.8764044943820225 and parameters: {'objective': 'Logloss', 'colsample_bylevel': 0.08991517995998562, 'depth': 8, 'boosting_type': 'Plain', 'bootstrap_type': 'Bernoulli', 'subsample': 0.9367971629175}. Best is trial 21 with value: 0.8988764044943819.
[32m[I 2023-04-26 13:58:47,370][39m Trial 54 finished with value: 0.860215053763441 and parameters: {'objective': 'Logloss', 'colsample_bylevel': 0.07900738093748103, 'depth': 10, 'boosting_type': 'Plain', 'bootstrap_type': 'Bernoulli', 'subsample': 0.9351015799097379}. Best is trial 21 with value: 0.8988764044943819.
[32m[I 2023-04-26 13:58:51,474][39m Trial 55 finished with value: 0.888888888888889 and parameters: {'objective': 'Logloss', 'colsample_bylevel': 0.09720081944044183, 'depth': 9, 'boosting_type': 'Plain', 'bootstrap_type': 'Bayesian', 'bagging_temperature': 6.128720373553964}. Best is trial 21 with value: 0.8988764044943819.
[32m[I 2023-04-26 13:58:55,705][39m Trial 56 finished with value: 0.8863636363636364 and parameters: {'objective': 'Logloss', 'colsample_bylevel': 0.09827922124502068, 'depth': 9, 'boosting_type': 'Plain', 'bootstrap_type': 'Bernoulli', 'subsample': 0.49658475315764045}. Best is trial 21 with value: 0.8988764044943819.
[32m[I 2023-04-26 13:58:59,453][39m Trial 57 finished with value: 0.8764044943820225 and parameters: {'objective': 'Logloss', 'colsample_bylevel': 0.09690611404386444, 'depth': 8, 'boosting_type': 'Plain', 'bootstrap_type': 'Bernoulli', 'subsample': 0.4668129014071109}. Best is trial 21 with value: 0.8988764044943819.
[32m[I 2023-04-26 13:59:01,138][39m Trial 58 finished with value: 0.8043478260869564 and parameters: {'objective': 'Logloss', 'colsample_bylevel': 0.05832191781940343, 'depth': 7, 'boosting_type': 'Plain', 'bootstrap_type': 'Bernoulli', 'subsample': 0.3921229905728781}. Best is trial 21 with value: 0.8988764044943819.
[32m[I 2023-04-26 13:59:02,629][39m Trial 59 finished with value: 0.7628865979381443 and parameters: {'objective': 'Logloss', 'colsample_bylevel': 0.09965533299841, 'depth': 1, 'boosting_type': 'Plain', 'bootstrap_type': 'Bernoulli', 'subsample': 0.41753279929349046}. Best is trial 21 with value: 0.8988764044943819.
[32m[I 2023-04-26 13:59:04,863][39m Trial 60 finished with value: 0.8791208791208791 and parameters: {'objective': 'Logloss', 'colsample_bylevel': 0.0922812346000812, 'depth': 11, 'boosting_type': 'Plain', 'bootstrap_type': 'Bernoulli', 'subsample': 0.6099788238343014}. Best is trial 21 with value: 0.8988764044943819.
[32m[I 2023-04-26 13:59:08,496][39m Trial 61 finished with value: 0.8275862068965518 and parameters: {'objective': 'Logloss', 'colsample_bylevel': 0.09325308280002412, 'depth': 9, 'boosting_type': 'Plain', 'bootstrap_type': 'MVS'}. Best is trial 21 with value: 0.8988764044943819.
[32m[I 2023-04-26 13:59:11,539][39m Trial 62 finished with value: 0.8539325842696629 and parameters: {'objective': 'Logloss', 'colsample_bylevel': 0.08742566519893627, 'depth': 8, 'boosting_type': 'Plain', 'bootstrap_type': 'Bayesian', 'bagging_temperature': 2.0150333758371417}. Best is trial 21 with value: 0.8988764044943819.
[32m[I 2023-04-26 13:59:13,621][39m Trial 63 finished with value: 0.8791208791208791 and parameters: {'objective': 'Logloss', 'colsample_bylevel': 0.08531627660001637, 'depth': 10, 'boosting_type': 'Plain', 'bootstrap_type': 'Bernoulli', 'subsample': 0.8907771301306517}. Best is trial 21 with value: 0.8988764044943819.
[32m[I 2023-04-26 13:59:17,721][39m Trial 64 finished with value: 0.888888888888889 and parameters: {'objective': 'Logloss', 'colsample_bylevel': 0.0998535154909706, 'depth': 9, 'boosting_type': 'Plain', 'bootstrap_type': 'Bernoulli', 'subsample': 0.9565453656669461}. Best is trial 21 with value: 0.8988764044943819.
[32m[I 2023-04-26 13:59:21,749][39m Trial 65 finished with value: 0.8764044943820225 and parameters: {'objective': 'Logloss', 'colsample_bylevel': 0.09485994251423951, 'depth': 9, 'boosting_type': 'Plain', 'bootstrap_type': 'Bernoulli', 'subsample': 0.9526351206250332}. Best is trial 21 with value: 0.8988764044943819.
[32m[I 2023-04-26 13:59:26,952][39m Trial 66 finished with value: 0.8695652173913043 and parameters: {'objective': 'Logloss', 'colsample_bylevel': 0.09693980868239224, 'depth': 9, 'boosting_type': 'Plain', 'bootstrap_type': 'Bernoulli', 'subsample': 0.5176833366081992}. Best is trial 21 with value: 0.8988764044943819.
[32m[I 2023-04-26 13:59:32,072][39m Trial 67 finished with value: 0.8351648351648352 and parameters: {'objective': 'Logloss', 'colsample_bylevel': 0.09992146085039089, 'depth': 8, 'boosting_type': 'Ordered', 'bootstrap_type': 'Bernoulli', 'subsample': 0.8584873938554698}. Best is trial 21 with value: 0.8988764044943819.
