[32m[I 2023-04-26 14:03:09,987][39m Trial 135 finished with value: 0.8666666666666666 and parameters: {'objective': 'Logloss', 'colsample_bylevel': 0.09425047118205573, 'depth': 8, 'boosting_type': 'Plain', 'bootstrap_type': 'Bayesian', 'bagging_temperature': 6.362107808818523}. Best is trial 21 with value: 0.8988764044943819.
[32m[I 2023-04-26 14:03:13,434][39m Trial 136 finished with value: 0.8666666666666666 and parameters: {'objective': 'Logloss', 'colsample_bylevel': 0.09848466976641818, 'depth': 8, 'boosting_type': 'Plain', 'bootstrap_type': 'Bernoulli', 'subsample': 0.652106872458624}. Best is trial 21 with value: 0.8988764044943819.
[32m[I 2023-04-26 14:03:17,519][39m Trial 137 finished with value: 0.8791208791208791 and parameters: {'objective': 'Logloss', 'colsample_bylevel': 0.09630727284048018, 'depth': 9, 'boosting_type': 'Plain', 'bootstrap_type': 'Bernoulli', 'subsample': 0.45035608040317504}. Best is trial 21 with value: 0.8988764044943819.
[32m[I 2023-04-26 14:03:20,361][39m Trial 138 finished with value: 0.8666666666666666 and parameters: {'objective': 'CrossEntropy', 'colsample_bylevel': 0.09993321438609043, 'depth': 9, 'boosting_type': 'Plain', 'bootstrap_type': 'Bernoulli', 'subsample': 0.9301914816925385}. Best is trial 21 with value: 0.8988764044943819.
[32m[I 2023-04-26 14:03:23,776][39m Trial 139 finished with value: 0.8695652173913043 and parameters: {'objective': 'Logloss', 'colsample_bylevel': 0.09152161668814024, 'depth': 8, 'boosting_type': 'Plain', 'bootstrap_type': 'Bernoulli', 'subsample': 0.9993485916124878}. Best is trial 21 with value: 0.8988764044943819.
[32m[I 2023-04-26 14:03:25,645][39m Trial 140 finished with value: 0.8314606741573034 and parameters: {'objective': 'Logloss', 'colsample_bylevel': 0.08609010112372763, 'depth': 4, 'boosting_type': 'Plain', 'bootstrap_type': 'Bayesian', 'bagging_temperature': 6.893995551851952}. Best is trial 21 with value: 0.8988764044943819.
[32m[I 2023-04-26 14:03:29,888][39m Trial 141 finished with value: 0.8666666666666666 and parameters: {'objective': 'Logloss', 'colsample_bylevel': 0.09566158921346528, 'depth': 9, 'boosting_type': 'Plain', 'bootstrap_type': 'Bayesian', 'bagging_temperature': 5.159706825826032}. Best is trial 21 with value: 0.8988764044943819.
[32m[I 2023-04-26 14:03:34,513][39m Trial 142 finished with value: 0.8863636363636364 and parameters: {'objective': 'Logloss', 'colsample_bylevel': 0.09820353532934221, 'depth': 9, 'boosting_type': 'Plain', 'bootstrap_type': 'Bernoulli', 'subsample': 0.9563125526168128}. Best is trial 21 with value: 0.8988764044943819.
[32m[I 2023-04-26 14:03:35,697][39m Trial 143 finished with value: 0.7454545454545455 and parameters: {'objective': 'Logloss', 'colsample_bylevel': 0.01633527771292225, 'depth': 2, 'boosting_type': 'Plain', 'bootstrap_type': 'Bernoulli', 'subsample': 0.957190060685931}. Best is trial 21 with value: 0.8988764044943819.
[32m[I 2023-04-26 14:03:37,184][39m Trial 144 finished with value: 0.7959183673469389 and parameters: {'objective': 'Logloss', 'colsample_bylevel': 0.030254780471107023, 'depth': 9, 'boosting_type': 'Plain', 'bootstrap_type': 'Bernoulli', 'subsample': 0.9187076387770707}. Best is trial 21 with value: 0.8988764044943819.
[32m[I 2023-04-26 14:03:39,720][39m Trial 145 finished with value: 0.8571428571428571 and parameters: {'objective': 'Logloss', 'colsample_bylevel': 0.09383696521808631, 'depth': 10, 'boosting_type': 'Plain', 'bootstrap_type': 'Bayesian', 'bagging_temperature': 3.8638887447413586}. Best is trial 21 with value: 0.8988764044943819.
[32m[I 2023-04-26 14:03:42,584][39m Trial 146 finished with value: 0.8478260869565216 and parameters: {'objective': 'Logloss', 'colsample_bylevel': 0.08837519759702082, 'depth': 8, 'boosting_type': 'Plain', 'bootstrap_type': 'Bayesian', 'bagging_temperature': 8.423150996955247}. Best is trial 21 with value: 0.8988764044943819.
[32m[I 2023-04-26 14:03:46,437][39m Trial 147 finished with value: 0.860215053763441 and parameters: {'objective': 'Logloss', 'colsample_bylevel': 0.0972529972212324, 'depth': 9, 'boosting_type': 'Plain', 'bootstrap_type': 'Bayesian', 'bagging_temperature': 4.904129183940432}. Best is trial 21 with value: 0.8988764044943819.
[32m[I 2023-04-26 14:03:50,749][39m Trial 148 finished with value: 0.8539325842696629 and parameters: {'objective': 'Logloss', 'colsample_bylevel': 0.09862103886889832, 'depth': 9, 'boosting_type': 'Plain', 'bootstrap_type': 'Bernoulli', 'subsample': 0.8762852525237274}. Best is trial 21 with value: 0.8988764044943819.
[32m[I 2023-04-26 14:03:53,995][39m Trial 149 finished with value: 0.8666666666666666 and parameters: {'objective': 'Logloss', 'colsample_bylevel': 0.09242061188984783, 'depth': 8, 'boosting_type': 'Plain', 'bootstrap_type': 'Bayesian', 'bagging_temperature': 4.540596688048357}. Best is trial 21 with value: 0.8988764044943819.
[32m[I 2023-04-26 14:03:58,452][39m Trial 150 finished with value: 0.8210526315789473 and parameters: {'objective': 'Logloss', 'colsample_bylevel': 0.09034547774431625, 'depth': 10, 'boosting_type': 'Ordered', 'bootstrap_type': 'MVS'}. Best is trial 21 with value: 0.8988764044943819.
[32m[I 2023-04-26 14:04:02,422][39m Trial 151 finished with value: 0.8863636363636364 and parameters: {'objective': 'Logloss', 'colsample_bylevel': 0.09569554537197342, 'depth': 9, 'boosting_type': 'Plain', 'bootstrap_type': 'Bernoulli', 'subsample': 0.5447766458455201}. Best is trial 21 with value: 0.8988764044943819.
[32m[I 2023-04-26 14:04:06,657][39m Trial 152 finished with value: 0.8636363636363636 and parameters: {'objective': 'Logloss', 'colsample_bylevel': 0.09776598068338119, 'depth': 9, 'boosting_type': 'Plain', 'bootstrap_type': 'Bernoulli', 'subsample': 0.9682740603258564}. Best is trial 21 with value: 0.8988764044943819.
[32m[I 2023-04-26 14:04:10,705][39m Trial 153 finished with value: 0.8764044943820225 and parameters: {'objective': 'Logloss', 'colsample_bylevel': 0.09436478556750894, 'depth': 9, 'boosting_type': 'Plain', 'bootstrap_type': 'Bernoulli', 'subsample': 0.824160824350555}. Best is trial 21 with value: 0.8988764044943819.
[32m[I 2023-04-26 14:04:15,035][39m Trial 154 finished with value: 0.8764044943820225 and parameters: {'objective': 'Logloss', 'colsample_bylevel': 0.0999743249274679, 'depth': 9, 'boosting_type': 'Plain', 'bootstrap_type': 'Bernoulli', 'subsample': 0.9127513371338078}. Best is trial 21 with value: 0.8988764044943819.
[32m[I 2023-04-26 14:04:18,672][39m Trial 155 finished with value: 0.8791208791208791 and parameters: {'objective': 'Logloss', 'colsample_bylevel': 0.09854814600644612, 'depth': 8, 'boosting_type': 'Plain', 'bootstrap_type': 'Bernoulli', 'subsample': 0.9461591999836662}. Best is trial 21 with value: 0.8988764044943819.
[32m[I 2023-04-26 14:04:22,301][39m Trial 156 finished with value: 0.8539325842696629 and parameters: {'objective': 'Logloss', 'colsample_bylevel': 0.09608241686140635, 'depth': 9, 'boosting_type': 'Plain', 'bootstrap_type': 'Bernoulli', 'subsample': 0.5621728004215347}. Best is trial 21 with value: 0.8988764044943819.
[32m[I 2023-04-26 14:04:25,270][39m Trial 157 finished with value: 0.8764044943820225 and parameters: {'objective': 'Logloss', 'colsample_bylevel': 0.09324070501458251, 'depth': 8, 'boosting_type': 'Plain', 'bootstrap_type': 'Bayesian', 'bagging_temperature': 9.063304821308174}. Best is trial 21 with value: 0.8988764044943819.
[32m[I 2023-04-26 14:04:27,671][39m Trial 158 finished with value: 0.8988764044943819 and parameters: {'objective': 'Logloss', 'colsample_bylevel': 0.09683417819963136, 'depth': 10, 'boosting_type': 'Plain', 'bootstrap_type': 'Bernoulli', 'subsample': 0.9757442551157575}. Best is trial 21 with value: 0.8988764044943819.
[32m[I 2023-04-26 14:04:30,394][39m Trial 159 finished with value: 0.8863636363636364 and parameters: {'objective': 'Logloss', 'colsample_bylevel': 0.09751436796350335, 'depth': 11, 'boosting_type': 'Plain', 'bootstrap_type': 'Bernoulli', 'subsample': 0.9777807604450811}. Best is trial 21 with value: 0.8988764044943819.
[32m[I 2023-04-26 14:04:32,479][39m Trial 160 finished with value: 0.8988764044943819 and parameters: {'objective': 'CrossEntropy', 'colsample_bylevel': 0.08319564024471655, 'depth': 10, 'boosting_type': 'Plain', 'bootstrap_type': 'Bernoulli', 'subsample': 0.9177816297341352}. Best is trial 21 with value: 0.8988764044943819.
[32m[I 2023-04-26 14:04:34,607][39m Trial 161 finished with value: 0.8791208791208791 and parameters: {'objective': 'Logloss', 'colsample_bylevel': 0.08296823289460409, 'depth': 11, 'boosting_type': 'Plain', 'bootstrap_type': 'Bernoulli', 'subsample': 0.9097988507937229}. Best is trial 21 with value: 0.8988764044943819.
[32m[I 2023-04-26 14:04:36,710][39m Trial 162 finished with value: 0.8791208791208791 and parameters: {'objective': 'CrossEntropy', 'colsample_bylevel': 0.07864493120526848, 'depth': 11, 'boosting_type': 'Plain', 'bootstrap_type': 'Bernoulli', 'subsample': 0.9754669321607479}. Best is trial 21 with value: 0.8988764044943819.
[32m[I 2023-04-26 14:04:39,161][39m Trial 163 finished with value: 0.8988764044943819 and parameters: {'objective': 'CrossEntropy', 'colsample_bylevel': 0.08749465989626162, 'depth': 12, 'boosting_type': 'Plain', 'bootstrap_type': 'Bayesian', 'bagging_temperature': 5.564606687104883}. Best is trial 21 with value: 0.8988764044943819.
[32m[I 2023-04-26 14:04:41,444][39m Trial 164 finished with value: 0.8571428571428571 and parameters: {'objective': 'CrossEntropy', 'colsample_bylevel': 0.08591080873076413, 'depth': 12, 'boosting_type': 'Plain', 'bootstrap_type': 'Bayesian', 'bagging_temperature': 9.990002321927241}. Best is trial 21 with value: 0.8988764044943819.
[32m[I 2023-04-26 14:04:43,589][39m Trial 165 finished with value: 0.8444444444444446 and parameters: {'objective': 'CrossEntropy', 'colsample_bylevel': 0.08457934299653155, 'depth': 10, 'boosting_type': 'Plain', 'bootstrap_type': 'Bayesian', 'bagging_temperature': 5.729053741082589}. Best is trial 21 with value: 0.8988764044943819.
[32m[I 2023-04-26 14:04:45,889][39m Trial 166 finished with value: 0.8666666666666666 and parameters: {'objective': 'CrossEntropy', 'colsample_bylevel': 0.08761040952558594, 'depth': 10, 'boosting_type': 'Plain', 'bootstrap_type': 'Bernoulli', 'subsample': 0.8718875698561918}. Best is trial 21 with value: 0.8988764044943819.
[32m[I 2023-04-26 14:04:48,238][39m Trial 167 finished with value: 0.8764044943820225 and parameters: {'objective': 'CrossEntropy', 'colsample_bylevel': 0.08977207027450515, 'depth': 11, 'boosting_type': 'Plain', 'bootstrap_type': 'Bernoulli', 'subsample': 0.9345724332405275}. Best is trial 21 with value: 0.8988764044943819.
[32m[I 2023-04-26 14:04:50,542][39m Trial 168 finished with value: 0.8409090909090909 and parameters: {'objective': 'CrossEntropy', 'colsample_bylevel': 0.08175980433947419, 'depth': 12, 'boosting_type': 'Plain', 'bootstrap_type': 'Bayesian', 'bagging_temperature': 2.4776934626123497}. Best is trial 21 with value: 0.8988764044943819.
[32m[I 2023-04-26 14:04:53,092][39m Trial 169 finished with value: 0.8666666666666666 and parameters: {'objective': 'CrossEntropy', 'colsample_bylevel': 0.09101058756814366, 'depth': 12, 'boosting_type': 'Plain', 'bootstrap_type': 'Bayesian', 'bagging_temperature': 7.488103601957954}. Best is trial 21 with value: 0.8988764044943819.
[32m[I 2023-04-26 14:04:55,665][39m Trial 170 finished with value: 0.8666666666666666 and parameters: {'objective': 'CrossEntropy', 'colsample_bylevel': 0.07647376043360454, 'depth': 8, 'boosting_type': 'Plain', 'bootstrap_type': 'Bernoulli', 'subsample': 0.8949528925082303}. Best is trial 21 with value: 0.8988764044943819.
[32m[I 2023-04-26 14:04:59,562][39m Trial 171 finished with value: 0.8863636363636364 and parameters: {'objective': 'CrossEntropy', 'colsample_bylevel': 0.09528109887107174, 'depth': 9, 'boosting_type': 'Plain', 'bootstrap_type': 'Bernoulli', 'subsample': 0.9500176118145909}. Best is trial 21 with value: 0.8988764044943819.
[32m[I 2023-04-26 14:05:01,431][39m Trial 172 finished with value: 0.8172043010752689 and parameters: {'objective': 'Logloss', 'colsample_bylevel': 0.06558419970690746, 'depth': 7, 'boosting_type': 'Plain', 'bootstrap_type': 'Bayesian', 'bagging_temperature': 6.0093702685730905}. Best is trial 21 with value: 0.8988764044943819.
[32m[I 2023-04-26 14:05:04,072][39m Trial 173 finished with value: 0.8666666666666666 and parameters: {'objective': 'CrossEntropy', 'colsample_bylevel': 0.09993978359862633, 'depth': 10, 'boosting_type': 'Plain', 'bootstrap_type': 'Bernoulli', 'subsample': 0.9908806738139473}. Best is trial 21 with value: 0.8988764044943819.
[32m[I 2023-04-26 14:05:06,677][39m Trial 174 finished with value: 0.8764044943820225 and parameters: {'objective': 'Logloss', 'colsample_bylevel': 0.09739551731624246, 'depth': 11, 'boosting_type': 'Plain', 'bootstrap_type': 'Bernoulli', 'subsample': 0.5022556136782161}. Best is trial 21 with value: 0.8988764044943819.
[32m[I 2023-04-26 14:05:09,312][39m Trial 175 finished with value: 0.8988764044943819 and parameters: {'objective': 'Logloss', 'colsample_bylevel': 0.09667339753259718, 'depth': 12, 'boosting_type': 'Plain', 'bootstrap_type': 'Bernoulli', 'subsample': 0.9952218135170727}. Best is trial 21 with value: 0.8988764044943819.
[32m[I 2023-04-26 14:05:12,084][39m Trial 176 finished with value: 0.8695652173913043 and parameters: {'objective': 'Logloss', 'colsample_bylevel': 0.08363249856186461, 'depth': 8, 'boosting_type': 'Plain', 'bootstrap_type': 'Bernoulli', 'subsample': 0.9252905167416928}. Best is trial 21 with value: 0.8988764044943819.
[32m[I 2023-04-26 14:05:14,660][39m Trial 177 finished with value: 0.8764044943820225 and parameters: {'objective': 'Logloss', 'colsample_bylevel': 0.09245592556572438, 'depth': 12, 'boosting_type': 'Plain', 'bootstrap_type': 'Bernoulli', 'subsample': 0.9684103747020621}. Best is trial 21 with value: 0.8988764044943819.
[32m[I 2023-04-26 14:05:20,181][39m Trial 178 finished with value: 0.8043478260869564 and parameters: {'objective': 'Logloss', 'colsample_bylevel': 0.09633786190345953, 'depth': 12, 'boosting_type': 'Ordered', 'bootstrap_type': 'Bayesian', 'bagging_temperature': 7.840249906117964}. Best is trial 21 with value: 0.8988764044943819.
[32m[I 2023-04-26 14:05:22,595][39m Trial 179 finished with value: 0.8571428571428571 and parameters: {'objective': 'Logloss', 'colsample_bylevel': 0.08733274361562883, 'depth': 12, 'boosting_type': 'Plain', 'bootstrap_type': 'Bernoulli', 'subsample': 0.5289107425747855}. Best is trial 21 with value: 0.8988764044943819.
[32m[I 2023-04-26 14:05:25,242][39m Trial 180 finished with value: 0.8636363636363636 and parameters: {'objective': 'Logloss', 'colsample_bylevel': 0.09453809720835316, 'depth': 12, 'boosting_type': 'Plain', 'bootstrap_type': 'Bayesian', 'bagging_temperature': 4.168290566910653}. Best is trial 21 with value: 0.8988764044943819.
[32m[I 2023-04-26 14:05:29,299][39m Trial 181 finished with value: 0.8636363636363636 and parameters: {'objective': 'Logloss', 'colsample_bylevel': 0.09843872988007175, 'depth': 9, 'boosting_type': 'Plain', 'bootstrap_type': 'Bernoulli', 'subsample': 0.9499041045055306}. Best is trial 21 with value: 0.8988764044943819.
[32m[I 2023-04-26 14:05:31,526][39m Trial 182 finished with value: 0.8863636363636364 and parameters: {'objective': 'Logloss', 'colsample_bylevel': 0.09402217566050086, 'depth': 5, 'boosting_type': 'Plain', 'bootstrap_type': 'Bayesian', 'bagging_temperature': 5.455056847205359}. Best is trial 21 with value: 0.8988764044943819.
[32m[I 2023-04-26 14:05:34,887][39m Trial 183 finished with value: 0.8764044943820225 and parameters: {'objective': 'Logloss', 'colsample_bylevel': 0.0892090641976847, 'depth': 9, 'boosting_type': 'Plain', 'bootstrap_type': 'Bayesian', 'bagging_temperature': 6.24888575463847}. Best is trial 21 with value: 0.8988764044943819.
[32m[I 2023-04-26 14:05:38,964][39m Trial 184 finished with value: 0.8863636363636364 and parameters: {'objective': 'Logloss', 'colsample_bylevel': 0.09586559017167928, 'depth': 9, 'boosting_type': 'Plain', 'bootstrap_type': 'Bayesian', 'bagging_temperature': 6.734154091741777}. Best is trial 21 with value: 0.8988764044943819.
[32m[I 2023-04-26 14:05:42,917][39m Trial 185 finished with value: 0.888888888888889 and parameters: {'objective': 'Logloss', 'colsample_bylevel': 0.09196567604756066, 'depth': 9, 'boosting_type': 'Plain', 'bootstrap_type': 'Bayesian', 'bagging_temperature': 9.67743572994494}. Best is trial 21 with value: 0.8988764044943819.
[32m[I 2023-04-26 14:05:45,380][39m Trial 186 finished with value: 0.8764044943820225 and parameters: {'objective': 'Logloss', 'colsample_bylevel': 0.09145149229672735, 'depth': 10, 'boosting_type': 'Plain', 'bootstrap_type': 'Bayesian', 'bagging_temperature': 9.77163756632638}. Best is trial 21 with value: 0.8988764044943819.
[32m[I 2023-04-26 14:05:47,948][39m Trial 187 finished with value: 0.8988764044943819 and parameters: {'objective': 'Logloss', 'colsample_bylevel': 0.09657909176940187, 'depth': 11, 'boosting_type': 'Plain', 'bootstrap_type': 'Bayesian', 'bagging_temperature': 9.321388943391806}. Best is trial 21 with value: 0.8988764044943819.
[32m[I 2023-04-26 14:05:50,434][39m Trial 188 finished with value: 0.8764044943820225 and parameters: {'objective': 'Logloss', 'colsample_bylevel': 0.09285489011202383, 'depth': 11, 'boosting_type': 'Plain', 'bootstrap_type': 'Bayesian', 'bagging_temperature': 9.337718408943047}. Best is trial 21 with value: 0.8988764044943819.
[32m[I 2023-04-26 14:05:52,858][39m Trial 189 finished with value: 0.8666666666666666 and parameters: {'objective': 'CrossEntropy', 'colsample_bylevel': 0.0881069273101056, 'depth': 12, 'boosting_type': 'Plain', 'bootstrap_type': 'Bayesian', 'bagging_temperature': 8.942262291095975}. Best is trial 21 with value: 0.8988764044943819.
[32m[I 2023-04-26 14:05:55,099][39m Trial 190 finished with value: 0.8863636363636364 and parameters: {'objective': 'Logloss', 'colsample_bylevel': 0.08501863664852939, 'depth': 11, 'boosting_type': 'Plain', 'bootstrap_type': 'Bayesian', 'bagging_temperature': 9.585617627393587}. Best is trial 21 with value: 0.8988764044943819.
[32m[I 2023-04-26 14:05:58,922][39m Trial 191 finished with value: 0.8764044943820225 and parameters: {'objective': 'CrossEntropy', 'colsample_bylevel': 0.09528237137240592, 'depth': 9, 'boosting_type': 'Plain', 'bootstrap_type': 'Bayesian', 'bagging_temperature': 9.238777308638161}. Best is trial 21 with value: 0.8988764044943819.
[32m[I 2023-04-26 14:06:01,661][39m Trial 192 finished with value: 0.8791208791208791 and parameters: {'objective': 'Logloss', 'colsample_bylevel': 0.09714376403834071, 'depth': 11, 'boosting_type': 'Plain', 'bootstrap_type': 'MVS'}. Best is trial 21 with value: 0.8988764044943819.
[32m[I 2023-04-26 14:06:04,462][39m Trial 193 finished with value: 0.8505747126436782 and parameters: {'objective': 'Logloss', 'colsample_bylevel': 0.09980129161584489, 'depth': 12, 'boosting_type': 'Plain', 'bootstrap_type': 'Bayesian', 'bagging_temperature': 8.73313217154175}. Best is trial 21 with value: 0.8988764044943819.
[32m[I 2023-04-26 14:06:07,009][39m Trial 194 finished with value: 0.8988764044943819 and parameters: {'objective': 'CrossEntropy', 'colsample_bylevel': 0.09500338879678312, 'depth': 10, 'boosting_type': 'Plain', 'bootstrap_type': 'Bayesian', 'bagging_temperature': 9.08713591512418}. Best is trial 21 with value: 0.8988764044943819.
[32m[I 2023-04-26 14:06:09,318][39m Trial 195 finished with value: 0.888888888888889 and parameters: {'objective': 'CrossEntropy', 'colsample_bylevel': 0.0910435571569553, 'depth': 10, 'boosting_type': 'Plain', 'bootstrap_type': 'Bayesian', 'bagging_temperature': 8.441401499477761}. Best is trial 21 with value: 0.8988764044943819.
[32m[I 2023-04-26 14:06:11,711][39m Trial 196 finished with value: 0.888888888888889 and parameters: {'objective': 'CrossEntropy', 'colsample_bylevel': 0.0905871866120543, 'depth': 10, 'boosting_type': 'Plain', 'bootstrap_type': 'Bayesian', 'bagging_temperature': 8.544787241914703}. Best is trial 21 with value: 0.8988764044943819.
[32m[I 2023-04-26 14:06:14,021][39m Trial 197 finished with value: 0.8666666666666666 and parameters: {'objective': 'CrossEntropy', 'colsample_bylevel': 0.09072856493952822, 'depth': 10, 'boosting_type': 'Plain', 'bootstrap_type': 'Bayesian', 'bagging_temperature': 8.158260193709342}. Best is trial 21 with value: 0.8988764044943819.
[32m[I 2023-04-26 14:06:16,629][39m Trial 198 finished with value: 0.8863636363636364 and parameters: {'objective': 'CrossEntropy', 'colsample_bylevel': 0.09651859405026143, 'depth': 10, 'boosting_type': 'Plain', 'bootstrap_type': 'Bayesian', 'bagging_temperature': 9.034130161015351}. Best is trial 21 with value: 0.8988764044943819.
[32m[I 2023-04-26 14:06:19,131][39m Trial 199 finished with value: 0.8764044943820225 and parameters: {'objective': 'CrossEntropy', 'colsample_bylevel': 0.09238120901705922, 'depth': 10, 'boosting_type': 'Plain', 'bootstrap_type': 'Bayesian', 'bagging_temperature': 8.49919955455706}. Best is trial 21 with value: 0.8988764044943819.
[32m[I 2023-04-26 14:06:21,615][39m Trial 200 finished with value: 0.8791208791208791 and parameters: {'objective': 'CrossEntropy', 'colsample_bylevel': 0.09400563777320924, 'depth': 10, 'boosting_type': 'Plain', 'bootstrap_type': 'Bayesian', 'bagging_temperature': 8.828168221719919}. Best is trial 21 with value: 0.8988764044943819.
[32m[I 2023-04-26 14:06:23,969][39m Trial 201 finished with value: 0.8791208791208791 and parameters: {'objective': 'CrossEntropy', 'colsample_bylevel': 0.08931469672879082, 'depth': 10, 'boosting_type': 'Plain', 'bootstrap_type': 'Bayesian', 'bagging_temperature': 9.452324977214273}. Best is trial 21 with value: 0.8988764044943819.
