[32m[I 2023-04-26 14:09:28,654][39m Trial 267 finished with value: 0.888888888888889 and parameters: {'objective': 'CrossEntropy', 'colsample_bylevel': 0.09997577581446886, 'depth': 11, 'boosting_type': 'Plain', 'bootstrap_type': 'MVS'}. Best is trial 240 with value: 0.9195402298850575.
[32m[I 2023-04-26 14:09:31,317][39m Trial 268 finished with value: 0.888888888888889 and parameters: {'objective': 'CrossEntropy', 'colsample_bylevel': 0.09286473647120723, 'depth': 12, 'boosting_type': 'Plain', 'bootstrap_type': 'Bayesian', 'bagging_temperature': 8.733577336718996}. Best is trial 240 with value: 0.9195402298850575.
[32m[I 2023-04-26 14:09:34,015][39m Trial 269 finished with value: 0.8863636363636364 and parameters: {'objective': 'CrossEntropy', 'colsample_bylevel': 0.09457827147769904, 'depth': 11, 'boosting_type': 'Plain', 'bootstrap_type': 'Bayesian', 'bagging_temperature': 9.334145294231691}. Best is trial 240 with value: 0.9195402298850575.
[32m[I 2023-04-26 14:09:36,922][39m Trial 270 finished with value: 0.9090909090909092 and parameters: {'objective': 'CrossEntropy', 'colsample_bylevel': 0.09846679399592406, 'depth': 12, 'boosting_type': 'Plain', 'bootstrap_type': 'Bayesian', 'bagging_temperature': 9.71708710537531}. Best is trial 240 with value: 0.9195402298850575.
[32m[I 2023-04-26 14:09:39,838][39m Trial 271 finished with value: 0.8863636363636364 and parameters: {'objective': 'CrossEntropy', 'colsample_bylevel': 0.09840130045843438, 'depth': 12, 'boosting_type': 'Plain', 'bootstrap_type': 'Bayesian', 'bagging_temperature': 2.9899769696271186}. Best is trial 240 with value: 0.9195402298850575.
[32m[I 2023-04-26 14:09:42,790][39m Trial 272 finished with value: 0.8988764044943819 and parameters: {'objective': 'CrossEntropy', 'colsample_bylevel': 0.0982841018040493, 'depth': 12, 'boosting_type': 'Plain', 'bootstrap_type': 'Bayesian', 'bagging_temperature': 9.698570348153567}. Best is trial 240 with value: 0.9195402298850575.
[32m[I 2023-04-26 14:09:45,867][39m Trial 273 finished with value: 0.8705882352941177 and parameters: {'objective': 'CrossEntropy', 'colsample_bylevel': 0.09831013792637881, 'depth': 12, 'boosting_type': 'Plain', 'bootstrap_type': 'Bayesian', 'bagging_temperature': 9.986740600604746}. Best is trial 240 with value: 0.9195402298850575.
[32m[I 2023-04-26 14:09:51,427][39m Trial 274 finished with value: 0.7956989247311829 and parameters: {'objective': 'CrossEntropy', 'colsample_bylevel': 0.09605319266349042, 'depth': 12, 'boosting_type': 'Ordered', 'bootstrap_type': 'Bayesian', 'bagging_temperature': 9.750522132759471}. Best is trial 240 with value: 0.9195402298850575.
[32m[I 2023-04-26 14:09:52,828][39m Trial 275 finished with value: 0.851063829787234 and parameters: {'objective': 'CrossEntropy', 'colsample_bylevel': 0.03618502463365578, 'depth': 12, 'boosting_type': 'Plain', 'bootstrap_type': 'Bayesian', 'bagging_temperature': 9.6812175487814}. Best is trial 240 with value: 0.9195402298850575.
[32m[I 2023-04-26 14:09:55,631][39m Trial 276 finished with value: 0.8863636363636364 and parameters: {'objective': 'CrossEntropy', 'colsample_bylevel': 0.09845715103521652, 'depth': 11, 'boosting_type': 'Plain', 'bootstrap_type': 'Bayesian', 'bagging_temperature': 9.049404900956233}. Best is trial 240 with value: 0.9195402298850575.
[32m[I 2023-04-26 14:09:58,227][39m Trial 277 finished with value: 0.888888888888889 and parameters: {'objective': 'CrossEntropy', 'colsample_bylevel': 0.09315097019491328, 'depth': 11, 'boosting_type': 'Plain', 'bootstrap_type': 'Bayesian', 'bagging_temperature': 9.560081433928469}. Best is trial 240 with value: 0.9195402298850575.
[32m[I 2023-04-26 14:10:01,141][39m Trial 278 finished with value: 0.888888888888889 and parameters: {'objective': 'CrossEntropy', 'colsample_bylevel': 0.09997998399955738, 'depth': 12, 'boosting_type': 'Plain', 'bootstrap_type': 'Bayesian', 'bagging_temperature': 0.8934862998831639}. Best is trial 240 with value: 0.9195402298850575.
[32m[I 2023-04-26 14:10:04,100][39m Trial 279 finished with value: 0.8965517241379309 and parameters: {'objective': 'CrossEntropy', 'colsample_bylevel': 0.09673901142744804, 'depth': 12, 'boosting_type': 'Plain', 'bootstrap_type': 'Bayesian', 'bagging_temperature': 8.89749006074804}. Best is trial 240 with value: 0.9195402298850575.
[32m[I 2023-04-26 14:10:06,673][39m Trial 280 finished with value: 0.8764044943820225 and parameters: {'objective': 'CrossEntropy', 'colsample_bylevel': 0.09520244520513228, 'depth': 11, 'boosting_type': 'Plain', 'bootstrap_type': 'Bayesian', 'bagging_temperature': 9.206325160015323}. Best is trial 240 with value: 0.9195402298850575.
[32m[I 2023-04-26 14:10:09,247][39m Trial 281 finished with value: 0.8988764044943819 and parameters: {'objective': 'CrossEntropy', 'colsample_bylevel': 0.09381395431645917, 'depth': 11, 'boosting_type': 'Plain', 'bootstrap_type': 'Bayesian', 'bagging_temperature': 9.453032800394608}. Best is trial 240 with value: 0.9195402298850575.
[32m[I 2023-04-26 14:10:11,890][39m Trial 282 finished with value: 0.8837209302325582 and parameters: {'objective': 'CrossEntropy', 'colsample_bylevel': 0.09669229724066593, 'depth': 11, 'boosting_type': 'Plain', 'bootstrap_type': 'Bayesian', 'bagging_temperature': 9.316074703963487}. Best is trial 240 with value: 0.9195402298850575.
[32m[I 2023-04-26 14:10:13,742][39m Trial 283 finished with value: 0.851063829787234 and parameters: {'objective': 'CrossEntropy', 'colsample_bylevel': 0.06887127300104279, 'depth': 11, 'boosting_type': 'Plain', 'bootstrap_type': 'Bayesian', 'bagging_temperature': 9.503233992043405}. Best is trial 240 with value: 0.9195402298850575.
[32m[I 2023-04-26 14:10:16,199][39m Trial 284 finished with value: 0.8863636363636364 and parameters: {'objective': 'CrossEntropy', 'colsample_bylevel': 0.09651876985166574, 'depth': 11, 'boosting_type': 'Plain', 'bootstrap_type': 'Bayesian', 'bagging_temperature': 8.976980778486196}. Best is trial 240 with value: 0.9195402298850575.
[32m[I 2023-04-26 14:10:17,477][39m Trial 285 finished with value: 0.7628865979381443 and parameters: {'objective': 'CrossEntropy', 'colsample_bylevel': 0.023460213385753263, 'depth': 12, 'boosting_type': 'Plain', 'bootstrap_type': 'Bernoulli', 'subsample': 0.8414477355715219}. Best is trial 240 with value: 0.9195402298850575.
[32m[I 2023-04-26 14:10:20,312][39m Trial 286 finished with value: 0.8837209302325582 and parameters: {'objective': 'CrossEntropy', 'colsample_bylevel': 0.097667204741292, 'depth': 12, 'boosting_type': 'Plain', 'bootstrap_type': 'Bayesian', 'bagging_temperature': 9.828261215177873}. Best is trial 240 with value: 0.9195402298850575.
[32m[I 2023-04-26 14:10:23,296][39m Trial 287 finished with value: 0.888888888888889 and parameters: {'objective': 'CrossEntropy', 'colsample_bylevel': 0.09928253442938272, 'depth': 12, 'boosting_type': 'Plain', 'bootstrap_type': 'Bayesian', 'bagging_temperature': 5.18101512082446}. Best is trial 240 with value: 0.9195402298850575.
[32m[I 2023-04-26 14:10:26,247][39m Trial 288 finished with value: 0.8764044943820225 and parameters: {'objective': 'CrossEntropy', 'colsample_bylevel': 0.0930029946298041, 'depth': 12, 'boosting_type': 'Plain', 'bootstrap_type': 'MVS'}. Best is trial 240 with value: 0.9195402298850575.
[32m[I 2023-04-26 14:10:29,048][39m Trial 289 finished with value: 0.8764044943820225 and parameters: {'objective': 'CrossEntropy', 'colsample_bylevel': 0.09821830763111843, 'depth': 11, 'boosting_type': 'Plain', 'bootstrap_type': 'Bayesian', 'bagging_temperature': 9.655792563986934}. Best is trial 240 with value: 0.9195402298850575.
[32m[I 2023-04-26 14:10:31,831][39m Trial 290 finished with value: 0.8965517241379309 and parameters: {'objective': 'CrossEntropy', 'colsample_bylevel': 0.09527154338726739, 'depth': 11, 'boosting_type': 'Plain', 'bootstrap_type': 'Bayesian', 'bagging_temperature': 9.392620486770117}. Best is trial 240 with value: 0.9195402298850575.
[32m[I 2023-04-26 14:10:34,307][39m Trial 291 finished with value: 0.9090909090909092 and parameters: {'objective': 'CrossEntropy', 'colsample_bylevel': 0.09232272326150362, 'depth': 11, 'boosting_type': 'Plain', 'bootstrap_type': 'Bayesian', 'bagging_temperature': 9.494524908796741}. Best is trial 240 with value: 0.9195402298850575.
[32m[I 2023-04-26 14:10:36,909][39m Trial 292 finished with value: 0.8988764044943819 and parameters: {'objective': 'CrossEntropy', 'colsample_bylevel': 0.09426162272187423, 'depth': 11, 'boosting_type': 'Plain', 'bootstrap_type': 'Bayesian', 'bagging_temperature': 9.14717558962671}. Best is trial 240 with value: 0.9195402298850575.
[32m[I 2023-04-26 14:10:42,758][39m Trial 293 finished with value: 0.8260869565217392 and parameters: {'objective': 'CrossEntropy', 'colsample_bylevel': 0.09852341022234916, 'depth': 12, 'boosting_type': 'Ordered', 'bootstrap_type': 'Bayesian', 'bagging_temperature': 9.866838764664946}. Best is trial 240 with value: 0.9195402298850575.
[32m[I 2023-04-26 14:10:45,365][39m Trial 294 finished with value: 0.8988764044943819 and parameters: {'objective': 'CrossEntropy', 'colsample_bylevel': 0.09240588752017859, 'depth': 11, 'boosting_type': 'Plain', 'bootstrap_type': 'Bayesian', 'bagging_temperature': 9.228070011419396}. Best is trial 240 with value: 0.9195402298850575.
[32m[I 2023-04-26 14:10:48,087][39m Trial 295 finished with value: 0.8571428571428571 and parameters: {'objective': 'CrossEntropy', 'colsample_bylevel': 0.09254311338423415, 'depth': 6, 'boosting_type': 'Plain', 'bootstrap_type': 'Bayesian', 'bagging_temperature': 9.55528879995807}. Best is trial 240 with value: 0.9195402298850575.
[32m[I 2023-04-26 14:10:50,604][39m Trial 296 finished with value: 0.8764044943820225 and parameters: {'objective': 'CrossEntropy', 'colsample_bylevel': 0.09511445527422505, 'depth': 10, 'boosting_type': 'Plain', 'bootstrap_type': 'Bayesian', 'bagging_temperature': 8.747855827757608}. Best is trial 240 with value: 0.9195402298850575.
[32m[I 2023-04-26 14:10:51,504][39m Trial 297 finished with value: 0.723404255319149 and parameters: {'objective': 'CrossEntropy', 'colsample_bylevel': 0.010140998297579362, 'depth': 12, 'boosting_type': 'Plain', 'bootstrap_type': 'Bayesian', 'bagging_temperature': 9.723516389427614}. Best is trial 240 with value: 0.9195402298850575.
[32m[I 2023-04-26 14:10:54,386][39m Trial 298 finished with value: 0.888888888888889 and parameters: {'objective': 'CrossEntropy', 'colsample_bylevel': 0.09766279244151904, 'depth': 11, 'boosting_type': 'Plain', 'bootstrap_type': 'Bayesian', 'bagging_temperature': 9.138312119095286}. Best is trial 240 with value: 0.9195402298850575.
[32m[I 2023-04-26 14:10:57,061][39m Trial 299 finished with value: 0.8965517241379309 and parameters: {'objective': 'CrossEntropy', 'colsample_bylevel': 0.09482110725431599, 'depth': 10, 'boosting_type': 'Plain', 'bootstrap_type': 'Bayesian', 'bagging_temperature': 9.460822583585886}. Best is trial 240 with value: 0.9195402298850575.
[32m[I 2023-04-26 14:10:59,872][39m Trial 300 finished with value: 0.8791208791208791 and parameters: {'objective': 'CrossEntropy', 'colsample_bylevel': 0.09960264713695947, 'depth': 11, 'boosting_type': 'Plain', 'bootstrap_type': 'Bayesian', 'bagging_temperature': 9.50127191108659}. Best is trial 240 with value: 0.9195402298850575.
[32m[I 2023-04-26 14:11:02,509][39m Trial 301 finished with value: 0.8988764044943819 and parameters: {'objective': 'CrossEntropy', 'colsample_bylevel': 0.09180260327727134, 'depth': 11, 'boosting_type': 'Plain', 'bootstrap_type': 'Bayesian', 'bagging_temperature': 9.35647513580218}. Best is trial 240 with value: 0.9195402298850575.
[32m[I 2023-04-26 14:11:05,292][39m Trial 302 finished with value: 0.8735632183908046 and parameters: {'objective': 'CrossEntropy', 'colsample_bylevel': 0.09687452089157801, 'depth': 12, 'boosting_type': 'Plain', 'bootstrap_type': 'Bayesian', 'bagging_temperature': 9.35307591741304}. Best is trial 240 with value: 0.9195402298850575.
[32m[I 2023-04-26 14:11:07,987][39m Trial 303 finished with value: 0.8988764044943819 and parameters: {'objective': 'CrossEntropy', 'colsample_bylevel': 0.09539980446320026, 'depth': 11, 'boosting_type': 'Plain', 'bootstrap_type': 'Bayesian', 'bagging_temperature': 9.01631013973889}. Best is trial 240 with value: 0.9195402298850575.
[32m[I 2023-04-26 14:11:09,702][39m Trial 304 finished with value: 0.8571428571428571 and parameters: {'objective': 'CrossEntropy', 'colsample_bylevel': 0.06161002885542287, 'depth': 10, 'boosting_type': 'Plain', 'bootstrap_type': 'Bayesian', 'bagging_temperature': 8.659807693458504}. Best is trial 240 with value: 0.9195402298850575.
[32m[I 2023-04-26 14:11:12,010][39m Trial 305 finished with value: 0.8764044943820225 and parameters: {'objective': 'CrossEntropy', 'colsample_bylevel': 0.08977287553908223, 'depth': 12, 'boosting_type': 'Plain', 'bootstrap_type': 'Bernoulli', 'subsample': 0.7609688839726105}. Best is trial 240 with value: 0.9195402298850575.
[32m[I 2023-04-26 14:11:14,294][39m Trial 306 finished with value: 0.8666666666666666 and parameters: {'objective': 'CrossEntropy', 'colsample_bylevel': 0.09140099190527176, 'depth': 11, 'boosting_type': 'Plain', 'bootstrap_type': 'Bayesian', 'bagging_temperature': 1.9246325201584344}. Best is trial 240 with value: 0.9195402298850575.
[32m[I 2023-04-26 14:11:16,938][39m Trial 307 finished with value: 0.8735632183908046 and parameters: {'objective': 'CrossEntropy', 'colsample_bylevel': 0.09683316038943487, 'depth': 10, 'boosting_type': 'Plain', 'bootstrap_type': 'Bayesian', 'bagging_temperature': 9.999379244127915}. Best is trial 240 with value: 0.9195402298850575.
[32m[I 2023-04-26 14:11:19,590][39m Trial 308 finished with value: 0.8863636363636364 and parameters: {'objective': 'CrossEntropy', 'colsample_bylevel': 0.09414604368063352, 'depth': 11, 'boosting_type': 'Plain', 'bootstrap_type': 'Bayesian', 'bagging_temperature': 8.969517650049672}. Best is trial 240 with value: 0.9195402298850575.
[32m[I 2023-04-26 14:11:22,296][39m Trial 309 finished with value: 0.8965517241379309 and parameters: {'objective': 'CrossEntropy', 'colsample_bylevel': 0.0955531334225494, 'depth': 11, 'boosting_type': 'Plain', 'bootstrap_type': 'Bayesian', 'bagging_temperature': 8.810960589494522}. Best is trial 240 with value: 0.9195402298850575.
[32m[I 2023-04-26 14:11:25,100][39m Trial 310 finished with value: 0.888888888888889 and parameters: {'objective': 'CrossEntropy', 'colsample_bylevel': 0.09990057795716792, 'depth': 11, 'boosting_type': 'Plain', 'bootstrap_type': 'Bayesian', 'bagging_temperature': 9.121562040268998}. Best is trial 240 with value: 0.9195402298850575.
[32m[I 2023-04-26 14:11:27,719][39m Trial 311 finished with value: 0.8988764044943819 and parameters: {'objective': 'CrossEntropy', 'colsample_bylevel': 0.09322453660485326, 'depth': 12, 'boosting_type': 'Plain', 'bootstrap_type': 'Bayesian', 'bagging_temperature': 9.715955658178324}. Best is trial 240 with value: 0.9195402298850575.
[32m[I 2023-04-26 14:11:30,342][39m Trial 312 finished with value: 0.888888888888889 and parameters: {'objective': 'CrossEntropy', 'colsample_bylevel': 0.09611008866733861, 'depth': 12, 'boosting_type': 'Plain', 'bootstrap_type': 'Bayesian', 'bagging_temperature': 9.239268865565974}. Best is trial 240 with value: 0.9195402298850575.
[32m[I 2023-04-26 14:11:35,882][39m Trial 313 finished with value: 0.8421052631578947 and parameters: {'objective': 'CrossEntropy', 'colsample_bylevel': 0.09339238197457496, 'depth': 12, 'boosting_type': 'Ordered', 'bootstrap_type': 'MVS'}. Best is trial 240 with value: 0.9195402298850575.
[32m[I 2023-04-26 14:11:38,345][39m Trial 314 finished with value: 0.888888888888889 and parameters: {'objective': 'CrossEntropy', 'colsample_bylevel': 0.09004334926213714, 'depth': 11, 'boosting_type': 'Plain', 'bootstrap_type': 'Bernoulli', 'subsample': 0.8078358794876186}. Best is trial 240 with value: 0.9195402298850575.
[32m[I 2023-04-26 14:11:40,994][39m Trial 315 finished with value: 0.8764044943820225 and parameters: {'objective': 'CrossEntropy', 'colsample_bylevel': 0.09248709743383204, 'depth': 12, 'boosting_type': 'Plain', 'bootstrap_type': 'Bayesian', 'bagging_temperature': 0.037535891438380986}. Best is trial 240 with value: 0.9195402298850575.
[32m[I 2023-04-26 14:11:43,524][39m Trial 316 finished with value: 0.8764044943820225 and parameters: {'objective': 'CrossEntropy', 'colsample_bylevel': 0.09360091670032221, 'depth': 11, 'boosting_type': 'Plain', 'bootstrap_type': 'Bayesian', 'bagging_temperature': 9.56171833272761}. Best is trial 240 with value: 0.9195402298850575.
[32m[I 2023-04-26 14:11:46,299][39m Trial 317 finished with value: 0.8863636363636364 and parameters: {'objective': 'CrossEntropy', 'colsample_bylevel': 0.09827559457178034, 'depth': 11, 'boosting_type': 'Plain', 'bootstrap_type': 'Bayesian', 'bagging_temperature': 9.768622566632406}. Best is trial 240 with value: 0.9195402298850575.
[32m[I 2023-04-26 14:11:49,012][39m Trial 318 finished with value: 0.9090909090909092 and parameters: {'objective': 'CrossEntropy', 'colsample_bylevel': 0.09588856889750864, 'depth': 11, 'boosting_type': 'Plain', 'bootstrap_type': 'Bayesian', 'bagging_temperature': 8.972985470202836}. Best is trial 240 with value: 0.9195402298850575.
[32m[I 2023-04-26 14:11:50,478][39m Trial 319 finished with value: 0.8 and parameters: {'objective': 'CrossEntropy', 'colsample_bylevel': 0.04128968653197976, 'depth': 10, 'boosting_type': 'Plain', 'bootstrap_type': 'Bayesian', 'bagging_temperature': 5.434453789248359}. Best is trial 240 with value: 0.9195402298850575.
[32m[I 2023-04-26 14:11:53,159][39m Trial 320 finished with value: 0.888888888888889 and parameters: {'objective': 'CrossEntropy', 'colsample_bylevel': 0.09854779568028593, 'depth': 11, 'boosting_type': 'Plain', 'bootstrap_type': 'Bayesian', 'bagging_temperature': 9.29474452839901}. Best is trial 240 with value: 0.9195402298850575.
[32m[I 2023-04-26 14:11:55,791][39m Trial 321 finished with value: 0.8764044943820225 and parameters: {'objective': 'CrossEntropy', 'colsample_bylevel': 0.09679744312684851, 'depth': 11, 'boosting_type': 'Plain', 'bootstrap_type': 'Bayesian', 'bagging_temperature': 8.630161606677708}. Best is trial 240 with value: 0.9195402298850575.
[32m[I 2023-04-26 14:11:58,432][39m Trial 322 finished with value: 0.8863636363636364 and parameters: {'objective': 'CrossEntropy', 'colsample_bylevel': 0.09488315708627505, 'depth': 11, 'boosting_type': 'Plain', 'bootstrap_type': 'Bayesian', 'bagging_temperature': 8.882740645648019}. Best is trial 240 with value: 0.9195402298850575.
[32m[I 2023-04-26 14:12:00,881][39m Trial 323 finished with value: 0.8791208791208791 and parameters: {'objective': 'CrossEntropy', 'colsample_bylevel': 0.0908158385424552, 'depth': 12, 'boosting_type': 'Plain', 'bootstrap_type': 'Bernoulli', 'subsample': 0.7078882584502748}. Best is trial 240 with value: 0.9195402298850575.
[32m[I 2023-04-26 14:12:03,447][39m Trial 324 finished with value: 0.888888888888889 and parameters: {'objective': 'CrossEntropy', 'colsample_bylevel': 0.09221286331139618, 'depth': 12, 'boosting_type': 'Plain', 'bootstrap_type': 'Bernoulli', 'subsample': 0.7843518738215758}. Best is trial 240 with value: 0.9195402298850575.
[32m[I 2023-04-26 14:12:06,172][39m Trial 325 finished with value: 0.8791208791208791 and parameters: {'objective': 'CrossEntropy', 'colsample_bylevel': 0.0999277744096936, 'depth': 11, 'boosting_type': 'Plain', 'bootstrap_type': 'Bayesian', 'bagging_temperature': 9.489369939832288}. Best is trial 240 with value: 0.9195402298850575.
[32m[I 2023-04-26 14:12:08,813][39m Trial 326 finished with value: 0.888888888888889 and parameters: {'objective': 'CrossEntropy', 'colsample_bylevel': 0.0978190917234274, 'depth': 11, 'boosting_type': 'Plain', 'bootstrap_type': 'Bayesian', 'bagging_temperature': 9.654078272569375}. Best is trial 240 with value: 0.9195402298850575.
[32m[I 2023-04-26 14:12:10,427][39m Trial 327 finished with value: 0.7272727272727273 and parameters: {'objective': 'CrossEntropy', 'colsample_bylevel': 0.09507325823114725, 'depth': 1, 'boosting_type': 'Plain', 'bootstrap_type': 'Bayesian', 'bagging_temperature': 9.243913199834687}. Best is trial 240 with value: 0.9195402298850575.
[32m[I 2023-04-26 14:12:13,210][39m Trial 328 finished with value: 0.888888888888889 and parameters: {'objective': 'CrossEntropy', 'colsample_bylevel': 0.09760571233375726, 'depth': 11, 'boosting_type': 'Plain', 'bootstrap_type': 'Bayesian', 'bagging_temperature': 9.50981410350499}. Best is trial 240 with value: 0.9195402298850575.
[32m[I 2023-04-26 14:12:15,218][39m Trial 329 finished with value: 0.8695652173913043 and parameters: {'objective': 'CrossEntropy', 'colsample_bylevel': 0.07150537554785, 'depth': 11, 'boosting_type': 'Plain', 'bootstrap_type': 'Bayesian', 'bagging_temperature': 8.278593940384303}. Best is trial 240 with value: 0.9195402298850575.
[32m[I 2023-04-26 14:12:17,650][39m Trial 330 finished with value: 0.8764044943820225 and parameters: {'objective': 'CrossEntropy', 'colsample_bylevel': 0.09214350051632034, 'depth': 11, 'boosting_type': 'Plain', 'bootstrap_type': 'Bayesian', 'bagging_temperature': 9.09112518087506}. Best is trial 240 with value: 0.9195402298850575.
[32m[I 2023-04-26 14:12:19,269][39m Trial 331 finished with value: 0.7912087912087912 and parameters: {'objective': 'CrossEntropy', 'colsample_bylevel': 0.057182038179292044, 'depth': 11, 'boosting_type': 'Plain', 'bootstrap_type': 'Bayesian', 'bagging_temperature': 9.166677891823754}. Best is trial 240 with value: 0.9195402298850575.
