[32m[I 2023-04-26 14:15:19,321][39m Trial 397 finished with value: 0.8764044943820225 and parameters: {'objective': 'CrossEntropy', 'colsample_bylevel': 0.09321175363187933, 'depth': 10, 'boosting_type': 'Plain', 'bootstrap_type': 'Bayesian', 'bagging_temperature': 8.589309783275528}. Best is trial 240 with value: 0.9195402298850575.
[32m[I 2023-04-26 14:15:22,208][39m Trial 398 finished with value: 0.888888888888889 and parameters: {'objective': 'CrossEntropy', 'colsample_bylevel': 0.09734396550247557, 'depth': 12, 'boosting_type': 'Plain', 'bootstrap_type': 'Bayesian', 'bagging_temperature': 9.480597177059893}. Best is trial 240 with value: 0.9195402298850575.
[32m[I 2023-04-26 14:15:24,977][39m Trial 399 finished with value: 0.8863636363636364 and parameters: {'objective': 'CrossEntropy', 'colsample_bylevel': 0.09660880880026078, 'depth': 11, 'boosting_type': 'Plain', 'bootstrap_type': 'Bayesian', 'bagging_temperature': 9.106401684031441}. Best is trial 240 with value: 0.9195402298850575.
[32m[I 2023-04-26 14:15:27,813][39m Trial 400 finished with value: 0.8988764044943819 and parameters: {'objective': 'CrossEntropy', 'colsample_bylevel': 0.09700629036362683, 'depth': 12, 'boosting_type': 'Plain', 'bootstrap_type': 'Bayesian', 'bagging_temperature': 9.188552818248917}. Best is trial 240 with value: 0.9195402298850575.
[32m[I 2023-04-26 14:15:30,610][39m Trial 401 finished with value: 0.888888888888889 and parameters: {'objective': 'CrossEntropy', 'colsample_bylevel': 0.09457518680318638, 'depth': 7, 'boosting_type': 'Plain', 'bootstrap_type': 'Bayesian', 'bagging_temperature': 9.686026383903263}. Best is trial 240 with value: 0.9195402298850575.
[32m[I 2023-04-26 14:15:33,449][39m Trial 402 finished with value: 0.8988764044943819 and parameters: {'objective': 'CrossEntropy', 'colsample_bylevel': 0.09827773377185087, 'depth': 12, 'boosting_type': 'Plain', 'bootstrap_type': 'Bayesian', 'bagging_temperature': 8.829260184344317}. Best is trial 240 with value: 0.9195402298850575.
[32m[I 2023-04-26 14:15:35,615][39m Trial 403 finished with value: 0.8863636363636364 and parameters: {'objective': 'CrossEntropy', 'colsample_bylevel': 0.09246250176115339, 'depth': 6, 'boosting_type': 'Plain', 'bootstrap_type': 'Bayesian', 'bagging_temperature': 9.303117576372435}. Best is trial 240 with value: 0.9195402298850575.
[32m[I 2023-04-26 14:15:38,221][39m Trial 404 finished with value: 0.8965517241379309 and parameters: {'objective': 'CrossEntropy', 'colsample_bylevel': 0.09522785976842367, 'depth': 11, 'boosting_type': 'Plain', 'bootstrap_type': 'Bayesian', 'bagging_temperature': 8.815036181797288}. Best is trial 240 with value: 0.9195402298850575.
[32m[I 2023-04-26 14:15:40,771][39m Trial 405 finished with value: 0.8705882352941177 and parameters: {'objective': 'CrossEntropy', 'colsample_bylevel': 0.09653399413488414, 'depth': 11, 'boosting_type': 'Plain', 'bootstrap_type': 'Bayesian', 'bagging_temperature': 9.134291877211684}. Best is trial 240 with value: 0.9195402298850575.
[32m[I 2023-04-26 14:15:43,393][39m Trial 406 finished with value: 0.8791208791208791 and parameters: {'objective': 'CrossEntropy', 'colsample_bylevel': 0.09324193515262821, 'depth': 12, 'boosting_type': 'Plain', 'bootstrap_type': 'Bayesian', 'bagging_temperature': 9.386971475421463}. Best is trial 240 with value: 0.9195402298850575.
[32m[I 2023-04-26 14:15:45,853][39m Trial 407 finished with value: 0.888888888888889 and parameters: {'objective': 'CrossEntropy', 'colsample_bylevel': 0.09058148774728925, 'depth': 11, 'boosting_type': 'Plain', 'bootstrap_type': 'Bernoulli', 'subsample': 0.712424154605533}. Best is trial 240 with value: 0.9195402298850575.
[32m[I 2023-04-26 14:15:48,591][39m Trial 408 finished with value: 0.888888888888889 and parameters: {'objective': 'CrossEntropy', 'colsample_bylevel': 0.09597529567193586, 'depth': 12, 'boosting_type': 'Plain', 'bootstrap_type': 'Bayesian', 'bagging_temperature': 6.982317367433375}. Best is trial 240 with value: 0.9195402298850575.
[32m[I 2023-04-26 14:15:51,156][39m Trial 409 finished with value: 0.888888888888889 and parameters: {'objective': 'CrossEntropy', 'colsample_bylevel': 0.09355973934651542, 'depth': 11, 'boosting_type': 'Plain', 'bootstrap_type': 'Bayesian', 'bagging_temperature': 9.408753028150755}. Best is trial 240 with value: 0.9195402298850575.
[32m[I 2023-04-26 14:15:54,014][39m Trial 410 finished with value: 0.8604651162790697 and parameters: {'objective': 'CrossEntropy', 'colsample_bylevel': 0.09815935016386095, 'depth': 11, 'boosting_type': 'Plain', 'bootstrap_type': 'Bayesian', 'bagging_temperature': 9.49497846895682}. Best is trial 240 with value: 0.9195402298850575.
[32m[I 2023-04-26 14:15:56,012][39m Trial 411 finished with value: 0.8387096774193549 and parameters: {'objective': 'CrossEntropy', 'colsample_bylevel': 0.06654899819729025, 'depth': 12, 'boosting_type': 'Plain', 'bootstrap_type': 'MVS'}. Best is trial 240 with value: 0.9195402298850575.
[32m[I 2023-04-26 14:16:01,439][39m Trial 412 finished with value: 0.8260869565217392 and parameters: {'objective': 'CrossEntropy', 'colsample_bylevel': 0.09999824876406808, 'depth': 11, 'boosting_type': 'Ordered', 'bootstrap_type': 'Bayesian', 'bagging_temperature': 8.45129787141326}. Best is trial 240 with value: 0.9195402298850575.
[32m[I 2023-04-26 14:16:04,151][39m Trial 413 finished with value: 0.8636363636363636 and parameters: {'objective': 'CrossEntropy', 'colsample_bylevel': 0.09834133070953269, 'depth': 11, 'boosting_type': 'Plain', 'bootstrap_type': 'Bayesian', 'bagging_temperature': 9.57314782090591}. Best is trial 240 with value: 0.9195402298850575.
[32m[I 2023-04-26 14:16:06,659][39m Trial 414 finished with value: 0.8965517241379309 and parameters: {'objective': 'CrossEntropy', 'colsample_bylevel': 0.09545078802787185, 'depth': 10, 'boosting_type': 'Plain', 'bootstrap_type': 'Bayesian', 'bagging_temperature': 9.993535460493046}. Best is trial 240 with value: 0.9195402298850575.
[32m[I 2023-04-26 14:16:09,312][39m Trial 415 finished with value: 0.8863636363636364 and parameters: {'objective': 'CrossEntropy', 'colsample_bylevel': 0.09859788517601, 'depth': 11, 'boosting_type': 'Plain', 'bootstrap_type': 'Bernoulli', 'subsample': 0.34250667333914964}. Best is trial 240 with value: 0.9195402298850575.
[32m[I 2023-04-26 14:16:11,946][39m Trial 416 finished with value: 0.888888888888889 and parameters: {'objective': 'CrossEntropy', 'colsample_bylevel': 0.09158674356798895, 'depth': 11, 'boosting_type': 'Plain', 'bootstrap_type': 'Bayesian', 'bagging_temperature': 9.7737137036414}. Best is trial 240 with value: 0.9195402298850575.
[32m[I 2023-04-26 14:16:14,426][39m Trial 417 finished with value: 0.8764044943820225 and parameters: {'objective': 'CrossEntropy', 'colsample_bylevel': 0.08993692356698268, 'depth': 12, 'boosting_type': 'Plain', 'bootstrap_type': 'Bayesian', 'bagging_temperature': 9.602302287743264}. Best is trial 240 with value: 0.9195402298850575.
[32m[I 2023-04-26 14:16:17,224][39m Trial 418 finished with value: 0.888888888888889 and parameters: {'objective': 'CrossEntropy', 'colsample_bylevel': 0.0973009719883079, 'depth': 12, 'boosting_type': 'Plain', 'bootstrap_type': 'Bayesian', 'bagging_temperature': 9.053478436262882}. Best is trial 240 with value: 0.9195402298850575.
[32m[I 2023-04-26 14:16:19,877][39m Trial 419 finished with value: 0.8666666666666666 and parameters: {'objective': 'CrossEntropy', 'colsample_bylevel': 0.09407150546152314, 'depth': 11, 'boosting_type': 'Plain', 'bootstrap_type': 'Bayesian', 'bagging_temperature': 9.886030625104294}. Best is trial 240 with value: 0.9195402298850575.
[32m[I 2023-04-26 14:16:22,447][39m Trial 420 finished with value: 0.8988764044943819 and parameters: {'objective': 'CrossEntropy', 'colsample_bylevel': 0.09298757364819576, 'depth': 11, 'boosting_type': 'Plain', 'bootstrap_type': 'Bayesian', 'bagging_temperature': 9.314327936339089}. Best is trial 240 with value: 0.9195402298850575.
[32m[I 2023-04-26 14:16:25,174][39m Trial 421 finished with value: 0.8988764044943819 and parameters: {'objective': 'CrossEntropy', 'colsample_bylevel': 0.09434200876367069, 'depth': 12, 'boosting_type': 'Plain', 'bootstrap_type': 'Bayesian', 'bagging_temperature': 9.31118121353894}. Best is trial 240 with value: 0.9195402298850575.
[32m[I 2023-04-26 14:16:26,821][39m Trial 422 finished with value: 0.860215053763441 and parameters: {'objective': 'CrossEntropy', 'colsample_bylevel': 0.05291191543465424, 'depth': 12, 'boosting_type': 'Plain', 'bootstrap_type': 'Bayesian', 'bagging_temperature': 9.803943374315748}. Best is trial 240 with value: 0.9195402298850575.
[32m[I 2023-04-26 14:16:29,456][39m Trial 423 finished with value: 0.8988764044943819 and parameters: {'objective': 'CrossEntropy', 'colsample_bylevel': 0.09617047070834427, 'depth': 10, 'boosting_type': 'Plain', 'bootstrap_type': 'Bernoulli', 'subsample': 0.6540807953401305}. Best is trial 240 with value: 0.9195402298850575.
[32m[I 2023-04-26 14:16:32,111][39m Trial 424 finished with value: 0.8988764044943819 and parameters: {'objective': 'CrossEntropy', 'colsample_bylevel': 0.09504989802087893, 'depth': 11, 'boosting_type': 'Plain', 'bootstrap_type': 'Bayesian', 'bagging_temperature': 9.277465160327612}. Best is trial 240 with value: 0.9195402298850575.
[32m[I 2023-04-26 14:16:34,645][39m Trial 425 finished with value: 0.888888888888889 and parameters: {'objective': 'CrossEntropy', 'colsample_bylevel': 0.09714330473145803, 'depth': 10, 'boosting_type': 'Plain', 'bootstrap_type': 'Bernoulli', 'subsample': 0.2530271853832942}. Best is trial 240 with value: 0.9195402298850575.
[32m[I 2023-04-26 14:16:37,428][39m Trial 426 finished with value: 0.888888888888889 and parameters: {'objective': 'CrossEntropy', 'colsample_bylevel': 0.09806814543503405, 'depth': 11, 'boosting_type': 'Plain', 'bootstrap_type': 'Bayesian', 'bagging_temperature': 8.962876854660458}. Best is trial 240 with value: 0.9195402298850575.
[32m[I 2023-04-26 14:16:40,491][39m Trial 427 finished with value: 0.8988764044943819 and parameters: {'objective': 'CrossEntropy', 'colsample_bylevel': 0.09998872859357567, 'depth': 11, 'boosting_type': 'Plain', 'bootstrap_type': 'Bayesian', 'bagging_temperature': 8.603627355887387}. Best is trial 240 with value: 0.9195402298850575.
[32m[I 2023-04-26 14:16:42,029][39m Trial 428 finished with value: 0.7912087912087912 and parameters: {'objective': 'CrossEntropy', 'colsample_bylevel': 0.04761432127429074, 'depth': 12, 'boosting_type': 'Plain', 'bootstrap_type': 'Bernoulli', 'subsample': 0.5902566220973651}. Best is trial 240 with value: 0.9195402298850575.
[32m[I 2023-04-26 14:16:44,634][39m Trial 429 finished with value: 0.8735632183908046 and parameters: {'objective': 'CrossEntropy', 'colsample_bylevel': 0.09177872769177528, 'depth': 11, 'boosting_type': 'Plain', 'bootstrap_type': 'Bayesian', 'bagging_temperature': 9.246624165506061}. Best is trial 240 with value: 0.9195402298850575.
[32m[I 2023-04-26 14:16:46,954][39m Trial 430 finished with value: 0.888888888888889 and parameters: {'objective': 'CrossEntropy', 'colsample_bylevel': 0.08740933466018647, 'depth': 10, 'boosting_type': 'Plain', 'bootstrap_type': 'Bayesian', 'bagging_temperature': 8.03237226376589}. Best is trial 240 with value: 0.9195402298850575.
[32m[I 2023-04-26 14:16:49,623][39m Trial 431 finished with value: 0.8965517241379309 and parameters: {'objective': 'CrossEntropy', 'colsample_bylevel': 0.09665507814239456, 'depth': 11, 'boosting_type': 'Plain', 'bootstrap_type': 'Bayesian', 'bagging_temperature': 9.007144924120965}. Best is trial 240 with value: 0.9195402298850575.
[32m[I 2023-04-26 14:16:55,099][39m Trial 432 finished with value: 0.8043478260869564 and parameters: {'objective': 'CrossEntropy', 'colsample_bylevel': 0.09433344205227238, 'depth': 11, 'boosting_type': 'Ordered', 'bootstrap_type': 'Bayesian', 'bagging_temperature': 9.504203666920871}. Best is trial 240 with value: 0.9195402298850575.
[32m[I 2023-04-26 14:16:57,669][39m Trial 433 finished with value: 0.8571428571428571 and parameters: {'objective': 'CrossEntropy', 'colsample_bylevel': 0.08972369566822572, 'depth': 12, 'boosting_type': 'Plain', 'bootstrap_type': 'Bayesian', 'bagging_temperature': 8.733410435358884}. Best is trial 240 with value: 0.9195402298850575.
[32m[I 2023-04-26 14:17:00,298][39m Trial 434 finished with value: 0.9090909090909092 and parameters: {'objective': 'CrossEntropy', 'colsample_bylevel': 0.09271040875420185, 'depth': 11, 'boosting_type': 'Plain', 'bootstrap_type': 'Bayesian', 'bagging_temperature': 9.228515215060249}. Best is trial 240 with value: 0.9195402298850575.
[32m[I 2023-04-26 14:17:02,965][39m Trial 435 finished with value: 0.8764044943820225 and parameters: {'objective': 'CrossEntropy', 'colsample_bylevel': 0.09503436104820935, 'depth': 11, 'boosting_type': 'Plain', 'bootstrap_type': 'Bayesian', 'bagging_temperature': 9.076482191520327}. Best is trial 240 with value: 0.9195402298850575.
[32m[I 2023-04-26 14:17:05,574][39m Trial 436 finished with value: 0.888888888888889 and parameters: {'objective': 'CrossEntropy', 'colsample_bylevel': 0.09264935480439214, 'depth': 11, 'boosting_type': 'Plain', 'bootstrap_type': 'Bayesian', 'bagging_temperature': 9.131435525805603}. Best is trial 240 with value: 0.9195402298850575.
[32m[I 2023-04-26 14:17:07,289][39m Trial 437 finished with value: 0.8387096774193549 and parameters: {'objective': 'CrossEntropy', 'colsample_bylevel': 0.059168393842391954, 'depth': 11, 'boosting_type': 'Plain', 'bootstrap_type': 'Bayesian', 'bagging_temperature': 9.386615499431002}. Best is trial 240 with value: 0.9195402298850575.
[32m[I 2023-04-26 14:17:09,994][39m Trial 438 finished with value: 0.8666666666666666 and parameters: {'objective': 'CrossEntropy', 'colsample_bylevel': 0.09587004894609726, 'depth': 11, 'boosting_type': 'Plain', 'bootstrap_type': 'Bayesian', 'bagging_temperature': 9.633442734179416}. Best is trial 240 with value: 0.9195402298850575.
[32m[I 2023-04-26 14:17:12,613][39m Trial 439 finished with value: 0.888888888888889 and parameters: {'objective': 'CrossEntropy', 'colsample_bylevel': 0.09250664632220547, 'depth': 11, 'boosting_type': 'Plain', 'bootstrap_type': 'Bayesian', 'bagging_temperature': 6.549196913450798}. Best is trial 240 with value: 0.9195402298850575.
[32m[I 2023-04-26 14:17:15,221][39m Trial 440 finished with value: 0.8764044943820225 and parameters: {'objective': 'CrossEntropy', 'colsample_bylevel': 0.0967435243222471, 'depth': 12, 'boosting_type': 'Plain', 'bootstrap_type': 'Bernoulli', 'subsample': 0.11332606290497765}. Best is trial 240 with value: 0.9195402298850575.
[32m[I 2023-04-26 14:17:17,912][39m Trial 441 finished with value: 0.8988764044943819 and parameters: {'objective': 'CrossEntropy', 'colsample_bylevel': 0.09352408710602723, 'depth': 11, 'boosting_type': 'Plain', 'bootstrap_type': 'Bayesian', 'bagging_temperature': 8.913609826135996}. Best is trial 240 with value: 0.9195402298850575.
[32m[I 2023-04-26 14:17:20,438][39m Trial 442 finished with value: 0.8539325842696629 and parameters: {'objective': 'CrossEntropy', 'colsample_bylevel': 0.09485003833831938, 'depth': 10, 'boosting_type': 'Plain', 'bootstrap_type': 'MVS'}. Best is trial 240 with value: 0.9195402298850575.
[32m[I 2023-04-26 14:17:23,506][39m Trial 443 finished with value: 0.8863636363636364 and parameters: {'objective': 'CrossEntropy', 'colsample_bylevel': 0.09958660765309878, 'depth': 7, 'boosting_type': 'Plain', 'bootstrap_type': 'Bayesian', 'bagging_temperature': 8.81168947427168}. Best is trial 240 with value: 0.9195402298850575.
[32m[I 2023-04-26 14:17:26,227][39m Trial 444 finished with value: 0.888888888888889 and parameters: {'objective': 'CrossEntropy', 'colsample_bylevel': 0.09979537564950773, 'depth': 10, 'boosting_type': 'Plain', 'bootstrap_type': 'Bayesian', 'bagging_temperature': 8.49353828466772}. Best is trial 240 with value: 0.9195402298850575.
[32m[I 2023-04-26 14:17:28,764][39m Trial 445 finished with value: 0.8735632183908046 and parameters: {'objective': 'CrossEntropy', 'colsample_bylevel': 0.09462301791887684, 'depth': 11, 'boosting_type': 'Plain', 'bootstrap_type': 'Bayesian', 'bagging_temperature': 8.834303141551565}. Best is trial 240 with value: 0.9195402298850575.
[32m[I 2023-04-26 14:17:31,526][39m Trial 446 finished with value: 0.8863636363636364 and parameters: {'objective': 'CrossEntropy', 'colsample_bylevel': 0.09523992550855578, 'depth': 11, 'boosting_type': 'Plain', 'bootstrap_type': 'Bayesian', 'bagging_temperature': 9.595978296888774}. Best is trial 240 with value: 0.9195402298850575.
[32m[I 2023-04-26 14:17:34,039][39m Trial 447 finished with value: 0.8988764044943819 and parameters: {'objective': 'CrossEntropy', 'colsample_bylevel': 0.09108820226225713, 'depth': 11, 'boosting_type': 'Plain', 'bootstrap_type': 'Bayesian', 'bagging_temperature': 9.171165006256807}. Best is trial 240 with value: 0.9195402298850575.
[32m[I 2023-04-26 14:17:36,665][39m Trial 448 finished with value: 0.8863636363636364 and parameters: {'objective': 'CrossEntropy', 'colsample_bylevel': 0.0965778803303312, 'depth': 11, 'boosting_type': 'Plain', 'bootstrap_type': 'Bayesian', 'bagging_temperature': 9.088608278450625}. Best is trial 240 with value: 0.9195402298850575.
[32m[I 2023-04-26 14:17:38,122][39m Trial 449 finished with value: 0.8247422680412371 and parameters: {'objective': 'CrossEntropy', 'colsample_bylevel': 0.03273954095381321, 'depth': 11, 'boosting_type': 'Plain', 'bootstrap_type': 'Bayesian', 'bagging_temperature': 0.5418525662684344}. Best is trial 240 with value: 0.9195402298850575.
[32m[I 2023-04-26 14:17:40,282][39m Trial 450 finished with value: 0.8666666666666666 and parameters: {'objective': 'CrossEntropy', 'colsample_bylevel': 0.07964759940771572, 'depth': 10, 'boosting_type': 'Plain', 'bootstrap_type': 'Bayesian', 'bagging_temperature': 9.320406842358716}. Best is trial 240 with value: 0.9195402298850575.
[32m[I 2023-04-26 14:17:43,089][39m Trial 451 finished with value: 0.8764044943820225 and parameters: {'objective': 'CrossEntropy', 'colsample_bylevel': 0.09273437203660496, 'depth': 12, 'boosting_type': 'Plain', 'bootstrap_type': 'Bayesian', 'bagging_temperature': 9.33144910668786}. Best is trial 240 with value: 0.9195402298850575.
[32m[I 2023-04-26 14:17:45,694][39m Trial 452 finished with value: 0.8791208791208791 and parameters: {'objective': 'CrossEntropy', 'colsample_bylevel': 0.09329000700802605, 'depth': 11, 'boosting_type': 'Plain', 'bootstrap_type': 'Bayesian', 'bagging_temperature': 9.74343329037374}. Best is trial 240 with value: 0.9195402298850575.
[32m[I 2023-04-26 14:17:48,443][39m Trial 453 finished with value: 0.888888888888889 and parameters: {'objective': 'CrossEntropy', 'colsample_bylevel': 0.09721792798118561, 'depth': 12, 'boosting_type': 'Plain', 'bootstrap_type': 'Bayesian', 'bagging_temperature': 9.781537915137562}. Best is trial 240 with value: 0.9195402298850575.
[32m[I 2023-04-26 14:17:53,535][39m Trial 454 finished with value: 0.8172043010752689 and parameters: {'objective': 'CrossEntropy', 'colsample_bylevel': 0.08880468250405633, 'depth': 12, 'boosting_type': 'Ordered', 'bootstrap_type': 'Bayesian', 'bagging_temperature': 8.255988922539748}. Best is trial 240 with value: 0.9195402298850575.
[32m[I 2023-04-26 14:17:56,459][39m Trial 455 finished with value: 0.8863636363636364 and parameters: {'objective': 'CrossEntropy', 'colsample_bylevel': 0.09197942431868374, 'depth': 11, 'boosting_type': 'Plain', 'bootstrap_type': 'Bayesian', 'bagging_temperature': 9.584704014964293}. Best is trial 240 with value: 0.9195402298850575.
[32m[I 2023-04-26 14:17:57,071][39m Trial 456 finished with value: 0.7216494845360826 and parameters: {'objective': 'CrossEntropy', 'colsample_bylevel': 0.015904567589708013, 'depth': 11, 'boosting_type': 'Plain', 'bootstrap_type': 'Bayesian', 'bagging_temperature': 9.501993683004223}. Best is trial 240 with value: 0.9195402298850575.
[32m[I 2023-04-26 14:18:00,331][39m Trial 457 finished with value: 0.8735632183908046 and parameters: {'objective': 'CrossEntropy', 'colsample_bylevel': 0.09803510758269512, 'depth': 11, 'boosting_type': 'Plain', 'bootstrap_type': 'Bayesian', 'bagging_temperature': 9.436059995012831}. Best is trial 240 with value: 0.9195402298850575.
[32m[I 2023-04-26 14:18:03,237][39m Trial 458 finished with value: 0.888888888888889 and parameters: {'objective': 'CrossEntropy', 'colsample_bylevel': 0.0951430270775994, 'depth': 12, 'boosting_type': 'Plain', 'bootstrap_type': 'MVS'}. Best is trial 240 with value: 0.9195402298850575.
[32m[I 2023-04-26 14:18:05,916][39m Trial 459 finished with value: 0.8791208791208791 and parameters: {'objective': 'CrossEntropy', 'colsample_bylevel': 0.09067214616818747, 'depth': 11, 'boosting_type': 'Plain', 'bootstrap_type': 'Bayesian', 'bagging_temperature': 9.176400070096497}. Best is trial 240 with value: 0.9195402298850575.
[32m[I 2023-04-26 14:18:08,915][39m Trial 460 finished with value: 0.8636363636363636 and parameters: {'objective': 'Logloss', 'colsample_bylevel': 0.09820976569086923, 'depth': 10, 'boosting_type': 'Plain', 'bootstrap_type': 'Bayesian', 'bagging_temperature': 8.606933371726882}. Best is trial 240 with value: 0.9195402298850575.
[32m[I 2023-04-26 14:18:11,647][39m Trial 461 finished with value: 0.8791208791208791 and parameters: {'objective': 'CrossEntropy', 'colsample_bylevel': 0.09437704396079452, 'depth': 12, 'boosting_type': 'Plain', 'bootstrap_type': 'Bayesian', 'bagging_temperature': 8.94474878927123}. Best is trial 240 with value: 0.9195402298850575.
