[32m[I 2023-04-26 14:06:26,356][39m Trial 202 finished with value: 0.8764044943820225 and parameters: {'objective': 'CrossEntropy', 'colsample_bylevel': 0.09154323488882946, 'depth': 10, 'boosting_type': 'Plain', 'bootstrap_type': 'Bayesian', 'bagging_temperature': 8.575610809754052}. Best is trial 21 with value: 0.8988764044943819.
[32m[I 2023-04-26 14:06:28,708][39m Trial 203 finished with value: 0.8666666666666666 and parameters: {'objective': 'CrossEntropy', 'colsample_bylevel': 0.08626629913876646, 'depth': 10, 'boosting_type': 'Plain', 'bootstrap_type': 'Bayesian', 'bagging_temperature': 8.305081897657878}. Best is trial 21 with value: 0.8988764044943819.
[32m[I 2023-04-26 14:06:31,089][39m Trial 204 finished with value: 0.8791208791208791 and parameters: {'objective': 'CrossEntropy', 'colsample_bylevel': 0.0885080082805117, 'depth': 10, 'boosting_type': 'Plain', 'bootstrap_type': 'Bayesian', 'bagging_temperature': 8.005739303007353}. Best is trial 21 with value: 0.8988764044943819.
[32m[I 2023-04-26 14:06:33,663][39m Trial 205 finished with value: 0.888888888888889 and parameters: {'objective': 'CrossEntropy', 'colsample_bylevel': 0.09379315348631347, 'depth': 11, 'boosting_type': 'Plain', 'bootstrap_type': 'Bayesian', 'bagging_temperature': 9.175967396944388}. Best is trial 21 with value: 0.8988764044943819.
[32m[I 2023-04-26 14:06:36,299][39m Trial 206 finished with value: 0.888888888888889 and parameters: {'objective': 'CrossEntropy', 'colsample_bylevel': 0.09707065679498474, 'depth': 11, 'boosting_type': 'Plain', 'bootstrap_type': 'Bayesian', 'bagging_temperature': 9.12773722309194}. Best is trial 21 with value: 0.8988764044943819.
[32m[I 2023-04-26 14:06:38,959][39m Trial 207 finished with value: 0.8988764044943819 and parameters: {'objective': 'CrossEntropy', 'colsample_bylevel': 0.09602469865155605, 'depth': 11, 'boosting_type': 'Plain', 'bootstrap_type': 'Bayesian', 'bagging_temperature': 9.17197435452018}. Best is trial 21 with value: 0.8988764044943819.
[32m[I 2023-04-26 14:06:40,509][39m Trial 208 finished with value: 0.8043478260869564 and parameters: {'objective': 'CrossEntropy', 'colsample_bylevel': 0.04570231885824303, 'depth': 11, 'boosting_type': 'Plain', 'bootstrap_type': 'Bayesian', 'bagging_temperature': 9.096444320951985}. Best is trial 21 with value: 0.8988764044943819.
[32m[I 2023-04-26 14:06:43,107][39m Trial 209 finished with value: 0.8764044943820225 and parameters: {'objective': 'CrossEntropy', 'colsample_bylevel': 0.09831811959885549, 'depth': 10, 'boosting_type': 'Plain', 'bootstrap_type': 'Bayesian', 'bagging_temperature': 8.66739535598579}. Best is trial 21 with value: 0.8988764044943819.
[32m[I 2023-04-26 14:06:48,301][39m Trial 210 finished with value: 0.8260869565217392 and parameters: {'objective': 'CrossEntropy', 'colsample_bylevel': 0.09571464900947081, 'depth': 10, 'boosting_type': 'Ordered', 'bootstrap_type': 'Bayesian', 'bagging_temperature': 8.362951368575265}. Best is trial 21 with value: 0.8988764044943819.
[32m[I 2023-04-26 14:06:52,441][39m Trial 211 finished with value: 0.9090909090909092 and parameters: {'objective': 'CrossEntropy', 'colsample_bylevel': 0.09330155582627013, 'depth': 9, 'boosting_type': 'Plain', 'bootstrap_type': 'Bayesian', 'bagging_temperature': 9.67625242349399}. Best is trial 211 with value: 0.9090909090909092.
[32m[I 2023-04-26 14:06:55,048][39m Trial 212 finished with value: 0.8988764044943819 and parameters: {'objective': 'CrossEntropy', 'colsample_bylevel': 0.09388927783998106, 'depth': 11, 'boosting_type': 'Plain', 'bootstrap_type': 'Bayesian', 'bagging_temperature': 9.428171640461436}. Best is trial 211 with value: 0.9090909090909092.
[32m[I 2023-04-26 14:06:57,572][39m Trial 213 finished with value: 0.8764044943820225 and parameters: {'objective': 'CrossEntropy', 'colsample_bylevel': 0.09486980117286384, 'depth': 11, 'boosting_type': 'Plain', 'bootstrap_type': 'Bayesian', 'bagging_temperature': 9.588840488792796}. Best is trial 211 with value: 0.9090909090909092.
[32m[I 2023-04-26 14:07:01,672][39m Trial 214 finished with value: 0.888888888888889 and parameters: {'objective': 'CrossEntropy', 'colsample_bylevel': 0.09692458050513555, 'depth': 9, 'boosting_type': 'Plain', 'bootstrap_type': 'Bayesian', 'bagging_temperature': 9.796863365221173}. Best is trial 211 with value: 0.9090909090909092.
[32m[I 2023-04-26 14:07:04,324][39m Trial 215 finished with value: 0.8988764044943819 and parameters: {'objective': 'CrossEntropy', 'colsample_bylevel': 0.09276050932194864, 'depth': 12, 'boosting_type': 'Plain', 'bootstrap_type': 'Bayesian', 'bagging_temperature': 9.379385647806943}. Best is trial 211 with value: 0.9090909090909092.
[32m[I 2023-04-26 14:07:06,929][39m Trial 216 finished with value: 0.8571428571428571 and parameters: {'objective': 'CrossEntropy', 'colsample_bylevel': 0.09304680758090186, 'depth': 11, 'boosting_type': 'Plain', 'bootstrap_type': 'Bayesian', 'bagging_temperature': 9.83947280294299}. Best is trial 211 with value: 0.9090909090909092.
[32m[I 2023-04-26 14:07:09,502][39m Trial 217 finished with value: 0.8764044943820225 and parameters: {'objective': 'CrossEntropy', 'colsample_bylevel': 0.0905895723587204, 'depth': 12, 'boosting_type': 'Plain', 'bootstrap_type': 'Bayesian', 'bagging_temperature': 9.419476181628998}. Best is trial 211 with value: 0.9090909090909092.
[32m[I 2023-04-26 14:07:12,227][39m Trial 218 finished with value: 0.8791208791208791 and parameters: {'objective': 'CrossEntropy', 'colsample_bylevel': 0.09189304622600061, 'depth': 12, 'boosting_type': 'Plain', 'bootstrap_type': 'Bayesian', 'bagging_temperature': 9.345630910686385}. Best is trial 211 with value: 0.9090909090909092.
[32m[I 2023-04-26 14:07:15,176][39m Trial 219 finished with value: 0.8764044943820225 and parameters: {'objective': 'CrossEntropy', 'colsample_bylevel': 0.09851200565204364, 'depth': 11, 'boosting_type': 'Plain', 'bootstrap_type': 'Bayesian', 'bagging_temperature': 8.890219515831568}. Best is trial 211 with value: 0.9090909090909092.
[32m[I 2023-04-26 14:07:17,713][39m Trial 220 finished with value: 0.9090909090909092 and parameters: {'objective': 'CrossEntropy', 'colsample_bylevel': 0.09394213957856666, 'depth': 11, 'boosting_type': 'Plain', 'bootstrap_type': 'Bayesian', 'bagging_temperature': 9.187844139335384}. Best is trial 211 with value: 0.9090909090909092.
[32m[I 2023-04-26 14:07:20,417][39m Trial 221 finished with value: 0.8604651162790697 and parameters: {'objective': 'CrossEntropy', 'colsample_bylevel': 0.09666920939846585, 'depth': 11, 'boosting_type': 'Plain', 'bootstrap_type': 'Bayesian', 'bagging_temperature': 9.20598376384693}. Best is trial 211 with value: 0.9090909090909092.
[32m[I 2023-04-26 14:07:23,071][39m Trial 222 finished with value: 0.8791208791208791 and parameters: {'objective': 'CrossEntropy', 'colsample_bylevel': 0.09404767948819473, 'depth': 11, 'boosting_type': 'Plain', 'bootstrap_type': 'Bayesian', 'bagging_temperature': 9.829919937004142}. Best is trial 211 with value: 0.9090909090909092.
[32m[I 2023-04-26 14:07:25,733][39m Trial 223 finished with value: 0.8791208791208791 and parameters: {'objective': 'CrossEntropy', 'colsample_bylevel': 0.09380152040182609, 'depth': 12, 'boosting_type': 'Plain', 'bootstrap_type': 'Bayesian', 'bagging_temperature': 9.626367866355443}. Best is trial 211 with value: 0.9090909090909092.
[32m[I 2023-04-26 14:07:28,425][39m Trial 224 finished with value: 0.888888888888889 and parameters: {'objective': 'CrossEntropy', 'colsample_bylevel': 0.0958253354223479, 'depth': 12, 'boosting_type': 'Plain', 'bootstrap_type': 'Bayesian', 'bagging_temperature': 9.95570765401979}. Best is trial 211 with value: 0.9090909090909092.
[32m[I 2023-04-26 14:07:31,295][39m Trial 225 finished with value: 0.8505747126436782 and parameters: {'objective': 'CrossEntropy', 'colsample_bylevel': 0.09605367563936516, 'depth': 12, 'boosting_type': 'Plain', 'bootstrap_type': 'Bayesian', 'bagging_temperature': 5.855549262926212}. Best is trial 211 with value: 0.9090909090909092.
[32m[I 2023-04-26 14:07:33,877][39m Trial 226 finished with value: 0.9090909090909092 and parameters: {'objective': 'CrossEntropy', 'colsample_bylevel': 0.09733963045646216, 'depth': 11, 'boosting_type': 'Plain', 'bootstrap_type': 'Bayesian', 'bagging_temperature': 9.17214598903278}. Best is trial 211 with value: 0.9090909090909092.
[32m[I 2023-04-26 14:07:36,842][39m Trial 227 finished with value: 0.8863636363636364 and parameters: {'objective': 'CrossEntropy', 'colsample_bylevel': 0.0909242549007979, 'depth': 11, 'boosting_type': 'Plain', 'bootstrap_type': 'Bayesian', 'bagging_temperature': 8.962682249002638}. Best is trial 211 with value: 0.9090909090909092.
[32m[I 2023-04-26 14:07:39,706][39m Trial 228 finished with value: 0.888888888888889 and parameters: {'objective': 'CrossEntropy', 'colsample_bylevel': 0.09425138810607392, 'depth': 12, 'boosting_type': 'Plain', 'bootstrap_type': 'Bayesian', 'bagging_temperature': 9.452861204749258}. Best is trial 211 with value: 0.9090909090909092.
[32m[I 2023-04-26 14:07:42,459][39m Trial 229 finished with value: 0.8666666666666666 and parameters: {'objective': 'CrossEntropy', 'colsample_bylevel': 0.0931329138737225, 'depth': 12, 'boosting_type': 'Plain', 'bootstrap_type': 'Bayesian', 'bagging_temperature': 9.48826650949092}. Best is trial 211 with value: 0.9090909090909092.
[32m[I 2023-04-26 14:07:45,368][39m Trial 230 finished with value: 0.8863636363636364 and parameters: {'objective': 'CrossEntropy', 'colsample_bylevel': 0.0999758621710965, 'depth': 11, 'boosting_type': 'Plain', 'bootstrap_type': 'Bayesian', 'bagging_temperature': 8.722156730411694}. Best is trial 211 with value: 0.9090909090909092.
[32m[I 2023-04-26 14:07:47,976][39m Trial 231 finished with value: 0.8863636363636364 and parameters: {'objective': 'CrossEntropy', 'colsample_bylevel': 0.09192623367013324, 'depth': 11, 'boosting_type': 'Plain', 'bootstrap_type': 'Bayesian', 'bagging_temperature': 8.515799544724613}. Best is trial 211 with value: 0.9090909090909092.
[32m[I 2023-04-26 14:07:50,553][39m Trial 232 finished with value: 0.8764044943820225 and parameters: {'objective': 'CrossEntropy', 'colsample_bylevel': 0.08974578711921981, 'depth': 11, 'boosting_type': 'Plain', 'bootstrap_type': 'Bayesian', 'bagging_temperature': 8.960639963273195}. Best is trial 211 with value: 0.9090909090909092.
[32m[I 2023-04-26 14:07:53,258][39m Trial 233 finished with value: 0.8988764044943819 and parameters: {'objective': 'CrossEntropy', 'colsample_bylevel': 0.09745392630752783, 'depth': 11, 'boosting_type': 'Plain', 'bootstrap_type': 'Bayesian', 'bagging_temperature': 9.212976774469716}. Best is trial 211 with value: 0.9090909090909092.
[32m[I 2023-04-26 14:07:56,242][39m Trial 234 finished with value: 0.888888888888889 and parameters: {'objective': 'CrossEntropy', 'colsample_bylevel': 0.09861490753413829, 'depth': 11, 'boosting_type': 'Plain', 'bootstrap_type': 'Bayesian', 'bagging_temperature': 9.180713829328276}. Best is trial 211 with value: 0.9090909090909092.
[32m[I 2023-04-26 14:07:59,011][39m Trial 235 finished with value: 0.888888888888889 and parameters: {'objective': 'CrossEntropy', 'colsample_bylevel': 0.09811556289442198, 'depth': 11, 'boosting_type': 'Plain', 'bootstrap_type': 'Bayesian', 'bagging_temperature': 9.744183353723896}. Best is trial 211 with value: 0.9090909090909092.
[32m[I 2023-04-26 14:08:01,835][39m Trial 236 finished with value: 0.8988764044943819 and parameters: {'objective': 'CrossEntropy', 'colsample_bylevel': 0.09874055963667458, 'depth': 11, 'boosting_type': 'Plain', 'bootstrap_type': 'Bayesian', 'bagging_temperature': 9.321832487292612}. Best is trial 211 with value: 0.9090909090909092.
[32m[I 2023-04-26 14:08:04,524][39m Trial 237 finished with value: 0.8988764044943819 and parameters: {'objective': 'CrossEntropy', 'colsample_bylevel': 0.09433666665303124, 'depth': 11, 'boosting_type': 'Plain', 'bootstrap_type': 'Bayesian', 'bagging_temperature': 9.301653393358125}. Best is trial 211 with value: 0.9090909090909092.
[32m[I 2023-04-26 14:08:07,221][39m Trial 238 finished with value: 0.8735632183908046 and parameters: {'objective': 'CrossEntropy', 'colsample_bylevel': 0.0947904213152656, 'depth': 11, 'boosting_type': 'Plain', 'bootstrap_type': 'Bayesian', 'bagging_temperature': 9.287976117152484}. Best is trial 211 with value: 0.9090909090909092.
[32m[I 2023-04-26 14:08:09,918][39m Trial 239 finished with value: 0.9090909090909092 and parameters: {'objective': 'CrossEntropy', 'colsample_bylevel': 0.09781623552452585, 'depth': 11, 'boosting_type': 'Plain', 'bootstrap_type': 'Bayesian', 'bagging_temperature': 9.920653487515949}. Best is trial 211 with value: 0.9090909090909092.
[32m[I 2023-04-26 14:08:12,714][39m Trial 240 finished with value: 0.9195402298850575 and parameters: {'objective': 'CrossEntropy', 'colsample_bylevel': 0.09726899369149851, 'depth': 11, 'boosting_type': 'Plain', 'bootstrap_type': 'Bayesian', 'bagging_temperature': 9.372926976512401}. Best is trial 240 with value: 0.9195402298850575.
[32m[I 2023-04-26 14:08:15,391][39m Trial 241 finished with value: 0.8988764044943819 and parameters: {'objective': 'CrossEntropy', 'colsample_bylevel': 0.09534406406123706, 'depth': 11, 'boosting_type': 'Plain', 'bootstrap_type': 'Bayesian', 'bagging_temperature': 9.446989648838011}. Best is trial 240 with value: 0.9195402298850575.
[32m[I 2023-04-26 14:08:18,272][39m Trial 242 finished with value: 0.8863636363636364 and parameters: {'objective': 'CrossEntropy', 'colsample_bylevel': 0.0975909181976742, 'depth': 11, 'boosting_type': 'Plain', 'bootstrap_type': 'Bayesian', 'bagging_temperature': 9.710745635500052}. Best is trial 240 with value: 0.9195402298850575.
[32m[I 2023-04-26 14:08:20,968][39m Trial 243 finished with value: 0.8604651162790697 and parameters: {'objective': 'CrossEntropy', 'colsample_bylevel': 0.09684634236820186, 'depth': 11, 'boosting_type': 'Plain', 'bootstrap_type': 'Bayesian', 'bagging_temperature': 9.321668974955891}. Best is trial 240 with value: 0.9195402298850575.
[32m[I 2023-04-26 14:08:23,788][39m Trial 244 finished with value: 0.8988764044943819 and parameters: {'objective': 'CrossEntropy', 'colsample_bylevel': 0.09865910912307206, 'depth': 11, 'boosting_type': 'Plain', 'bootstrap_type': 'Bayesian', 'bagging_temperature': 8.905843109441154}. Best is trial 240 with value: 0.9195402298850575.
[32m[I 2023-04-26 14:08:26,445][39m Trial 245 finished with value: 0.8764044943820225 and parameters: {'objective': 'CrossEntropy', 'colsample_bylevel': 0.0955658496154239, 'depth': 11, 'boosting_type': 'Plain', 'bootstrap_type': 'Bayesian', 'bagging_temperature': 9.173760411670056}. Best is trial 240 with value: 0.9195402298850575.
[32m[I 2023-04-26 14:08:29,095][39m Trial 246 finished with value: 0.888888888888889 and parameters: {'objective': 'CrossEntropy', 'colsample_bylevel': 0.09506619707895382, 'depth': 11, 'boosting_type': 'Plain', 'bootstrap_type': 'Bayesian', 'bagging_temperature': 9.602701117170428}. Best is trial 240 with value: 0.9195402298850575.
[32m[I 2023-04-26 14:08:31,676][39m Trial 247 finished with value: 0.8666666666666666 and parameters: {'objective': 'CrossEntropy', 'colsample_bylevel': 0.09875536780328253, 'depth': 11, 'boosting_type': 'Plain', 'bootstrap_type': 'Bayesian', 'bagging_temperature': 8.864659915198407}. Best is trial 240 with value: 0.9195402298850575.
[32m[I 2023-04-26 14:08:34,435][39m Trial 248 finished with value: 0.8735632183908046 and parameters: {'objective': 'CrossEntropy', 'colsample_bylevel': 0.09681486507980022, 'depth': 11, 'boosting_type': 'Plain', 'bootstrap_type': 'MVS'}. Best is trial 240 with value: 0.9195402298850575.
[32m[I 2023-04-26 14:08:37,210][39m Trial 249 finished with value: 0.8837209302325582 and parameters: {'objective': 'CrossEntropy', 'colsample_bylevel': 0.09807367037080988, 'depth': 11, 'boosting_type': 'Plain', 'bootstrap_type': 'Bayesian', 'bagging_temperature': 9.569820333297919}. Best is trial 240 with value: 0.9195402298850575.
[32m[I 2023-04-26 14:08:40,102][39m Trial 250 finished with value: 0.888888888888889 and parameters: {'objective': 'CrossEntropy', 'colsample_bylevel': 0.09800897572853415, 'depth': 11, 'boosting_type': 'Plain', 'bootstrap_type': 'Bayesian', 'bagging_temperature': 9.349037658182603}. Best is trial 240 with value: 0.9195402298850575.
[32m[I 2023-04-26 14:08:42,749][39m Trial 251 finished with value: 0.8505747126436782 and parameters: {'objective': 'CrossEntropy', 'colsample_bylevel': 0.09552003206203635, 'depth': 12, 'boosting_type': 'Plain', 'bootstrap_type': 'Bayesian', 'bagging_temperature': 9.954645208455743}. Best is trial 240 with value: 0.9195402298850575.
[32m[I 2023-04-26 14:08:45,657][39m Trial 252 finished with value: 0.8863636363636364 and parameters: {'objective': 'CrossEntropy', 'colsample_bylevel': 0.09941933397891344, 'depth': 11, 'boosting_type': 'Plain', 'bootstrap_type': 'Bayesian', 'bagging_temperature': 9.074152264897373}. Best is trial 240 with value: 0.9195402298850575.
[32m[I 2023-04-26 14:08:48,339][39m Trial 253 finished with value: 0.8604651162790697 and parameters: {'objective': 'CrossEntropy', 'colsample_bylevel': 0.09530527904117969, 'depth': 12, 'boosting_type': 'Plain', 'bootstrap_type': 'Bayesian', 'bagging_temperature': 9.955316647480627}. Best is trial 240 with value: 0.9195402298850575.
[32m[I 2023-04-26 14:08:53,885][39m Trial 254 finished with value: 0.8 and parameters: {'objective': 'CrossEntropy', 'colsample_bylevel': 0.09669944151652331, 'depth': 11, 'boosting_type': 'Ordered', 'bootstrap_type': 'Bayesian', 'bagging_temperature': 9.474804827945935}. Best is trial 240 with value: 0.9195402298850575.
[32m[I 2023-04-26 14:08:56,451][39m Trial 255 finished with value: 0.8988764044943819 and parameters: {'objective': 'CrossEntropy', 'colsample_bylevel': 0.09347267671757567, 'depth': 11, 'boosting_type': 'Plain', 'bootstrap_type': 'Bayesian', 'bagging_temperature': 9.712399656855768}. Best is trial 240 with value: 0.9195402298850575.
[32m[I 2023-04-26 14:08:58,967][39m Trial 256 finished with value: 0.8791208791208791 and parameters: {'objective': 'CrossEntropy', 'colsample_bylevel': 0.09368756630471911, 'depth': 11, 'boosting_type': 'Plain', 'bootstrap_type': 'Bayesian', 'bagging_temperature': 9.627847400578077}. Best is trial 240 with value: 0.9195402298850575.
[32m[I 2023-04-26 14:09:01,644][39m Trial 257 finished with value: 0.9090909090909092 and parameters: {'objective': 'CrossEntropy', 'colsample_bylevel': 0.09705274128006773, 'depth': 11, 'boosting_type': 'Plain', 'bootstrap_type': 'Bayesian', 'bagging_temperature': 9.115902040665326}. Best is trial 240 with value: 0.9195402298850575.
[32m[I 2023-04-26 14:09:04,216][39m Trial 258 finished with value: 0.8791208791208791 and parameters: {'objective': 'CrossEntropy', 'colsample_bylevel': 0.09719613605524992, 'depth': 11, 'boosting_type': 'Plain', 'bootstrap_type': 'Bayesian', 'bagging_temperature': 9.304304171621924}. Best is trial 240 with value: 0.9195402298850575.
[32m[I 2023-04-26 14:09:07,176][39m Trial 259 finished with value: 0.888888888888889 and parameters: {'objective': 'CrossEntropy', 'colsample_bylevel': 0.09997522063351072, 'depth': 11, 'boosting_type': 'Plain', 'bootstrap_type': 'Bayesian', 'bagging_temperature': 9.035064900775291}. Best is trial 240 with value: 0.9195402298850575.
[32m[I 2023-04-26 14:09:09,889][39m Trial 260 finished with value: 0.8837209302325582 and parameters: {'objective': 'CrossEntropy', 'colsample_bylevel': 0.09513497706115576, 'depth': 11, 'boosting_type': 'Plain', 'bootstrap_type': 'Bayesian', 'bagging_temperature': 9.423281525324203}. Best is trial 240 with value: 0.9195402298850575.
[32m[I 2023-04-26 14:09:12,543][39m Trial 261 finished with value: 0.8837209302325582 and parameters: {'objective': 'CrossEntropy', 'colsample_bylevel': 0.09310840329060333, 'depth': 11, 'boosting_type': 'Plain', 'bootstrap_type': 'Bayesian', 'bagging_temperature': 8.847719753276987}. Best is trial 240 with value: 0.9195402298850575.
[32m[I 2023-04-26 14:09:15,308][39m Trial 262 finished with value: 0.8604651162790697 and parameters: {'objective': 'CrossEntropy', 'colsample_bylevel': 0.09706060057173632, 'depth': 11, 'boosting_type': 'Plain', 'bootstrap_type': 'Bayesian', 'bagging_temperature': 9.233403968762854}. Best is trial 240 with value: 0.9195402298850575.
[32m[I 2023-04-26 14:09:17,776][39m Trial 263 finished with value: 0.8791208791208791 and parameters: {'objective': 'CrossEntropy', 'colsample_bylevel': 0.09482817003971099, 'depth': 11, 'boosting_type': 'Plain', 'bootstrap_type': 'Bayesian', 'bagging_temperature': 9.748478249139797}. Best is trial 240 with value: 0.9195402298850575.
[32m[I 2023-04-26 14:09:20,501][39m Trial 264 finished with value: 0.8735632183908046 and parameters: {'objective': 'CrossEntropy', 'colsample_bylevel': 0.0980954678430459, 'depth': 11, 'boosting_type': 'Plain', 'bootstrap_type': 'Bayesian', 'bagging_temperature': 9.504857017626424}. Best is trial 240 with value: 0.9195402298850575.
[32m[I 2023-04-26 14:09:23,117][39m Trial 265 finished with value: 0.8988764044943819 and parameters: {'objective': 'CrossEntropy', 'colsample_bylevel': 0.09631429925358129, 'depth': 11, 'boosting_type': 'Plain', 'bootstrap_type': 'Bayesian', 'bagging_temperature': 9.072641512277178}. Best is trial 240 with value: 0.9195402298850575.
[32m[I 2023-04-26 14:09:25,658][39m Trial 266 finished with value: 0.8764044943820225 and parameters: {'objective': 'CrossEntropy', 'colsample_bylevel': 0.09645152374411126, 'depth': 11, 'boosting_type': 'Plain', 'bootstrap_type': 'Bayesian', 'bagging_temperature': 9.08158741211496}. Best is trial 240 with value: 0.9195402298850575.
