[32m[I 2023-04-26 15:01:00,208][39m Trial 146 finished with value: 0.8275862068965518 and parameters: {'criterion': 'entropy', 'n_estimators': 139, 'max_features': 0.8027194528649834, 'max_depth': 26, 'min_samples_split': 7, 'min_samples_leaf': 4}. Best is trial 133 with value: 0.8705882352941177.
[32m[I 2023-04-26 15:01:00,339][39m Trial 147 finished with value: 0.8181818181818182 and parameters: {'criterion': 'gini', 'n_estimators': 115, 'max_features': 0.8484109226716396, 'max_depth': 38, 'min_samples_split': 6, 'min_samples_leaf': 5}. Best is trial 133 with value: 0.8705882352941177.
[32m[I 2023-04-26 15:01:00,491][39m Trial 148 finished with value: 0.8235294117647058 and parameters: {'criterion': 'entropy', 'n_estimators': 113, 'max_features': 0.7609951913301968, 'max_depth': 26, 'min_samples_split': 3, 'min_samples_leaf': 3}. Best is trial 133 with value: 0.8705882352941177.
[32m[I 2023-04-26 15:01:00,655][39m Trial 149 finished with value: 0.7951807228915663 and parameters: {'criterion': 'entropy', 'n_estimators': 118, 'max_features': 0.882139328563099, 'max_depth': 32, 'min_samples_split': 6, 'min_samples_leaf': 3}. Best is trial 133 with value: 0.8705882352941177.
[32m[I 2023-04-26 15:01:00,868][39m Trial 150 finished with value: 0.8292682926829268 and parameters: {'criterion': 'entropy', 'n_estimators': 152, 'max_features': 0.8516608422928457, 'max_depth': 23, 'min_samples_split': 2, 'min_samples_leaf': 2}. Best is trial 133 with value: 0.8705882352941177.
[32m[I 2023-04-26 15:01:01,101][39m Trial 151 finished with value: 0.8095238095238095 and parameters: {'criterion': 'entropy', 'n_estimators': 167, 'max_features': 0.9163369080528295, 'max_depth': 12, 'min_samples_split': 7, 'min_samples_leaf': 3}. Best is trial 133 with value: 0.8705882352941177.
[32m[I 2023-04-26 15:01:01,273][39m Trial 152 finished with value: 0.8 and parameters: {'criterion': 'entropy', 'n_estimators': 126, 'max_features': 0.8255693226944498, 'max_depth': 25, 'min_samples_split': 6, 'min_samples_leaf': 2}. Best is trial 133 with value: 0.8705882352941177.
[32m[I 2023-04-26 15:01:01,485][39m Trial 153 finished with value: 0.8333333333333333 and parameters: {'criterion': 'entropy', 'n_estimators': 156, 'max_features': 0.8511186430076434, 'max_depth': 28, 'min_samples_split': 4, 'min_samples_leaf': 3}. Best is trial 133 with value: 0.8705882352941177.
[32m[I 2023-04-26 15:01:01,663][39m Trial 154 finished with value: 0.8275862068965518 and parameters: {'criterion': 'entropy', 'n_estimators': 128, 'max_features': 0.9029330174288973, 'max_depth': 19, 'min_samples_split': 5, 'min_samples_leaf': 3}. Best is trial 133 with value: 0.8705882352941177.
[32m[I 2023-04-26 15:01:01,807][39m Trial 155 finished with value: 0.8235294117647058 and parameters: {'criterion': 'entropy', 'n_estimators': 110, 'max_features': 0.7921315486464772, 'max_depth': 22, 'min_samples_split': 4, 'min_samples_leaf': 4}. Best is trial 133 with value: 0.8705882352941177.
[32m[I 2023-04-26 15:01:01,951][39m Trial 156 finished with value: 0.8192771084337348 and parameters: {'criterion': 'entropy', 'n_estimators': 135, 'max_features': 0.44394312038351863, 'max_depth': 10, 'min_samples_split': 7, 'min_samples_leaf': 2}. Best is trial 133 with value: 0.8705882352941177.
[32m[I 2023-04-26 15:01:02,134][39m Trial 157 finished with value: 0.7594936708860759 and parameters: {'criterion': 'entropy', 'n_estimators': 124, 'max_features': 0.8756076555323653, 'max_depth': 23, 'min_samples_split': 6, 'min_samples_leaf': 1}. Best is trial 133 with value: 0.8705882352941177.
[32m[I 2023-04-26 15:01:02,316][39m Trial 158 finished with value: 0.8192771084337348 and parameters: {'criterion': 'entropy', 'n_estimators': 130, 'max_features': 0.8339318975452221, 'max_depth': 17, 'min_samples_split': 7, 'min_samples_leaf': 2}. Best is trial 133 with value: 0.8705882352941177.
[32m[I 2023-04-26 15:01:02,477][39m Trial 159 finished with value: 0.8470588235294119 and parameters: {'criterion': 'entropy', 'n_estimators': 116, 'max_features': 0.8666277269104544, 'max_depth': 30, 'min_samples_split': 6, 'min_samples_leaf': 3}. Best is trial 133 with value: 0.8705882352941177.
[32m[I 2023-04-26 15:01:02,632][39m Trial 160 finished with value: 0.8333333333333333 and parameters: {'criterion': 'entropy', 'n_estimators': 105, 'max_features': 0.9828254779348305, 'max_depth': 15, 'min_samples_split': 5, 'min_samples_leaf': 3}. Best is trial 133 with value: 0.8705882352941177.
[32m[I 2023-04-26 15:01:02,799][39m Trial 161 finished with value: 0.8095238095238095 and parameters: {'criterion': 'entropy', 'n_estimators': 122, 'max_features': 0.8870789527277688, 'max_depth': 20, 'min_samples_split': 6, 'min_samples_leaf': 3}. Best is trial 133 with value: 0.8705882352941177.
[32m[I 2023-04-26 15:01:02,976][39m Trial 162 finished with value: 0.8470588235294119 and parameters: {'criterion': 'entropy', 'n_estimators': 126, 'max_features': 0.8766883618996202, 'max_depth': 23, 'min_samples_split': 5, 'min_samples_leaf': 3}. Best is trial 133 with value: 0.8705882352941177.
[32m[I 2023-04-26 15:01:03,131][39m Trial 163 finished with value: 0.8333333333333333 and parameters: {'criterion': 'entropy', 'n_estimators': 109, 'max_features': 0.9276189496742008, 'max_depth': 19, 'min_samples_split': 4, 'min_samples_leaf': 3}. Best is trial 133 with value: 0.8705882352941177.
[32m[I 2023-04-26 15:01:03,306][39m Trial 164 finished with value: 0.8275862068965518 and parameters: {'criterion': 'entropy', 'n_estimators': 133, 'max_features': 0.8131317720558894, 'max_depth': 26, 'min_samples_split': 5, 'min_samples_leaf': 4}. Best is trial 133 with value: 0.8705882352941177.
[32m[I 2023-04-26 15:01:03,424][39m Trial 165 finished with value: 0.7848101265822786 and parameters: {'criterion': 'entropy', 'n_estimators': 131, 'max_features': 0.19100571013975115, 'max_depth': 21, 'min_samples_split': 6, 'min_samples_leaf': 2}. Best is trial 133 with value: 0.8705882352941177.
[32m[I 2023-04-26 15:01:03,599][39m Trial 166 finished with value: 0.8470588235294119 and parameters: {'criterion': 'entropy', 'n_estimators': 120, 'max_features': 0.8897041449362569, 'max_depth': 13, 'min_samples_split': 7, 'min_samples_leaf': 2}. Best is trial 133 with value: 0.8705882352941177.
[32m[I 2023-04-26 15:01:03,779][39m Trial 167 finished with value: 0.8333333333333333 and parameters: {'criterion': 'entropy', 'n_estimators': 127, 'max_features': 0.9127798159469992, 'max_depth': 13, 'min_samples_split': 8, 'min_samples_leaf': 2}. Best is trial 133 with value: 0.8705882352941177.
[32m[I 2023-04-26 15:01:03,926][39m Trial 168 finished with value: 0.7951807228915663 and parameters: {'criterion': 'gini', 'n_estimators': 145, 'max_features': 0.6382860776029367, 'max_depth': 7, 'min_samples_split': 7, 'min_samples_leaf': 2}. Best is trial 133 with value: 0.8705882352941177.
[32m[I 2023-04-26 15:01:04,090][39m Trial 169 finished with value: 0.8095238095238095 and parameters: {'criterion': 'entropy', 'n_estimators': 114, 'max_features': 0.8652719048978853, 'max_depth': 18, 'min_samples_split': 5, 'min_samples_leaf': 3}. Best is trial 133 with value: 0.8705882352941177.
[32m[I 2023-04-26 15:01:04,274][39m Trial 170 finished with value: 0.7954545454545454 and parameters: {'criterion': 'entropy', 'n_estimators': 173, 'max_features': 0.54623660971362, 'max_depth': 31, 'min_samples_split': 3, 'min_samples_leaf': 6}. Best is trial 133 with value: 0.8705882352941177.
[32m[I 2023-04-26 15:01:04,441][39m Trial 171 finished with value: 0.8372093023255814 and parameters: {'criterion': 'entropy', 'n_estimators': 117, 'max_features': 0.899883548141263, 'max_depth': 27, 'min_samples_split': 4, 'min_samples_leaf': 3}. Best is trial 133 with value: 0.8705882352941177.
[32m[I 2023-04-26 15:01:04,600][39m Trial 172 finished with value: 0.8192771084337348 and parameters: {'criterion': 'entropy', 'n_estimators': 111, 'max_features': 0.8413212213267071, 'max_depth': 16, 'min_samples_split': 6, 'min_samples_leaf': 3}. Best is trial 133 with value: 0.8705882352941177.
[32m[I 2023-04-26 15:01:04,771][39m Trial 173 finished with value: 0.8275862068965518 and parameters: {'criterion': 'entropy', 'n_estimators': 124, 'max_features': 0.8676501425421222, 'max_depth': 43, 'min_samples_split': 5, 'min_samples_leaf': 3}. Best is trial 133 with value: 0.8705882352941177.
[32m[I 2023-04-26 15:01:04,919][39m Trial 174 finished with value: 0.7901234567901235 and parameters: {'criterion': 'entropy', 'n_estimators': 101, 'max_features': 0.894339832069844, 'max_depth': 24, 'min_samples_split': 4, 'min_samples_leaf': 3}. Best is trial 133 with value: 0.8705882352941177.
[32m[I 2023-04-26 15:01:05,095][39m Trial 175 finished with value: 0.8333333333333333 and parameters: {'criterion': 'entropy', 'n_estimators': 120, 'max_features': 0.876937376111683, 'max_depth': 20, 'min_samples_split': 7, 'min_samples_leaf': 2}. Best is trial 133 with value: 0.8705882352941177.
[32m[I 2023-04-26 15:01:05,265][39m Trial 176 finished with value: 0.7804878048780488 and parameters: {'criterion': 'entropy', 'n_estimators': 120, 'max_features': 0.8554192745868795, 'max_depth': 18, 'min_samples_split': 7, 'min_samples_leaf': 2}. Best is trial 133 with value: 0.8705882352941177.
[32m[I 2023-04-26 15:01:05,425][39m Trial 177 finished with value: 0.8292682926829268 and parameters: {'criterion': 'entropy', 'n_estimators': 115, 'max_features': 0.8251273117344834, 'max_depth': 30, 'min_samples_split': 6, 'min_samples_leaf': 3}. Best is trial 133 with value: 0.8705882352941177.
[32m[I 2023-04-26 15:01:05,597][39m Trial 178 finished with value: 0.8470588235294119 and parameters: {'criterion': 'entropy', 'n_estimators': 117, 'max_features': 0.9563708421472293, 'max_depth': 14, 'min_samples_split': 6, 'min_samples_leaf': 3}. Best is trial 133 with value: 0.8705882352941177.
[32m[I 2023-04-26 15:01:05,794][39m Trial 179 finished with value: 0.8148148148148149 and parameters: {'criterion': 'entropy', 'n_estimators': 139, 'max_features': 0.922369744334436, 'max_depth': 12, 'min_samples_split': 7, 'min_samples_leaf': 2}. Best is trial 133 with value: 0.8705882352941177.
[32m[I 2023-04-26 15:01:05,953][39m Trial 180 finished with value: 0.8089887640449439 and parameters: {'criterion': 'entropy', 'n_estimators': 111, 'max_features': 0.9838827633016014, 'max_depth': 9, 'min_samples_split': 3, 'min_samples_leaf': 4}. Best is trial 133 with value: 0.8705882352941177.
[32m[I 2023-04-26 15:01:06,149][39m Trial 181 finished with value: 0.8048780487804877 and parameters: {'criterion': 'entropy', 'n_estimators': 126, 'max_features': 0.8572630465701132, 'max_depth': 24, 'min_samples_split': 7, 'min_samples_leaf': 2}. Best is trial 133 with value: 0.8705882352941177.
[32m[I 2023-04-26 15:01:06,341][39m Trial 182 finished with value: 0.8292682926829268 and parameters: {'criterion': 'entropy', 'n_estimators': 129, 'max_features': 0.9524965336341346, 'max_depth': 15, 'min_samples_split': 7, 'min_samples_leaf': 1}. Best is trial 133 with value: 0.8705882352941177.
[32m[I 2023-04-26 15:01:06,506][39m Trial 183 finished with value: 0.8192771084337348 and parameters: {'criterion': 'entropy', 'n_estimators': 122, 'max_features': 0.8393800973276611, 'max_depth': 23, 'min_samples_split': 6, 'min_samples_leaf': 3}. Best is trial 133 with value: 0.8705882352941177.
[32m[I 2023-04-26 15:01:06,681][39m Trial 184 finished with value: 0.8372093023255814 and parameters: {'criterion': 'entropy', 'n_estimators': 117, 'max_features': 0.9551115818544581, 'max_depth': 15, 'min_samples_split': 6, 'min_samples_leaf': 3}. Best is trial 133 with value: 0.8705882352941177.
[32m[I 2023-04-26 15:01:06,844][39m Trial 185 finished with value: 0.8181818181818182 and parameters: {'criterion': 'entropy', 'n_estimators': 125, 'max_features': 0.8905363273936077, 'max_depth': 11, 'min_samples_split': 5, 'min_samples_leaf': 9}. Best is trial 133 with value: 0.8705882352941177.
[32m[I 2023-04-26 15:01:07,007][39m Trial 186 finished with value: 0.8275862068965518 and parameters: {'criterion': 'entropy', 'n_estimators': 117, 'max_features': 0.867679823464872, 'max_depth': 28, 'min_samples_split': 6, 'min_samples_leaf': 3}. Best is trial 133 with value: 0.8705882352941177.
[32m[I 2023-04-26 15:01:07,206][39m Trial 187 finished with value: 0.8470588235294119 and parameters: {'criterion': 'entropy', 'n_estimators': 135, 'max_features': 0.9024241270492269, 'max_depth': 22, 'min_samples_split': 7, 'min_samples_leaf': 2}. Best is trial 133 with value: 0.8705882352941177.
[32m[I 2023-04-26 15:01:07,351][39m Trial 188 finished with value: 0.8571428571428572 and parameters: {'criterion': 'entropy', 'n_estimators': 106, 'max_features': 0.8065795775394249, 'max_depth': 22, 'min_samples_split': 7, 'min_samples_leaf': 2}. Best is trial 133 with value: 0.8705882352941177.
[32m[I 2023-04-26 15:01:07,495][39m Trial 189 finished with value: 0.8409090909090909 and parameters: {'criterion': 'entropy', 'n_estimators': 108, 'max_features': 0.8036810914671614, 'max_depth': 25, 'min_samples_split': 2, 'min_samples_leaf': 4}. Best is trial 133 with value: 0.8705882352941177.
[32m[I 2023-04-26 15:01:07,638][39m Trial 190 finished with value: 0.8250000000000001 and parameters: {'criterion': 'entropy', 'n_estimators': 96, 'max_features': 0.9308645452233061, 'max_depth': 13, 'min_samples_split': 7, 'min_samples_leaf': 2}. Best is trial 133 with value: 0.8705882352941177.
[32m[I 2023-04-26 15:01:07,901][39m Trial 191 finished with value: 0.8235294117647058 and parameters: {'criterion': 'entropy', 'n_estimators': 198, 'max_features': 0.8887147151583704, 'max_depth': 17, 'min_samples_split': 5, 'min_samples_leaf': 3}. Best is trial 133 with value: 0.8705882352941177.
[32m[I 2023-04-26 15:01:08,044][39m Trial 192 finished with value: 0.7948717948717948 and parameters: {'criterion': 'entropy', 'n_estimators': 105, 'max_features': 0.8283822304940006, 'max_depth': 20, 'min_samples_split': 7, 'min_samples_leaf': 2}. Best is trial 133 with value: 0.8705882352941177.
[32m[I 2023-04-26 15:01:08,208][39m Trial 193 finished with value: 0.8292682926829268 and parameters: {'criterion': 'entropy', 'n_estimators': 121, 'max_features': 0.7883294517794268, 'max_depth': 14, 'min_samples_split': 7, 'min_samples_leaf': 2}. Best is trial 133 with value: 0.8705882352941177.
[32m[I 2023-04-26 15:01:08,373][39m Trial 194 finished with value: 0.8181818181818182 and parameters: {'criterion': 'entropy', 'n_estimators': 113, 'max_features': 0.8500026654523416, 'max_depth': 26, 'min_samples_split': 8, 'min_samples_leaf': 3}. Best is trial 133 with value: 0.8705882352941177.
[32m[I 2023-04-26 15:01:08,518][39m Trial 195 finished with value: 0.8470588235294119 and parameters: {'criterion': 'entropy', 'n_estimators': 102, 'max_features': 0.8143799484244193, 'max_depth': 23, 'min_samples_split': 4, 'min_samples_leaf': 3}. Best is trial 133 with value: 0.8705882352941177.
[32m[I 2023-04-26 15:01:08,657][39m Trial 196 finished with value: 0.7901234567901235 and parameters: {'criterion': 'entropy', 'n_estimators': 99, 'max_features': 0.8078721101705025, 'max_depth': 21, 'min_samples_split': 4, 'min_samples_leaf': 2}. Best is trial 133 with value: 0.8705882352941177.
[32m[I 2023-04-26 15:01:08,795][39m Trial 197 finished with value: 0.8139534883720929 and parameters: {'criterion': 'entropy', 'n_estimators': 102, 'max_features': 0.76850133459337, 'max_depth': 17, 'min_samples_split': 4, 'min_samples_leaf': 3}. Best is trial 133 with value: 0.8705882352941177.
[32m[I 2023-04-26 15:01:08,944][39m Trial 198 finished with value: 0.7435897435897435 and parameters: {'criterion': 'gini', 'n_estimators': 127, 'max_features': 0.8787817363954508, 'max_depth': 19, 'min_samples_split': 7, 'min_samples_leaf': 1}. Best is trial 133 with value: 0.8705882352941177.
[32m[I 2023-04-26 15:01:09,109][39m Trial 199 finished with value: 0.8604651162790697 and parameters: {'criterion': 'entropy', 'n_estimators': 110, 'max_features': 0.9987675283198836, 'max_depth': 22, 'min_samples_split': 5, 'min_samples_leaf': 3}. Best is trial 133 with value: 0.8705882352941177.
[32m[I 2023-04-26 15:01:09,267][39m Trial 200 finished with value: 0.8333333333333333 and parameters: {'criterion': 'entropy', 'n_estimators': 110, 'max_features': 0.8394700263499562, 'max_depth': 29, 'min_samples_split': 5, 'min_samples_leaf': 3}. Best is trial 133 with value: 0.8705882352941177.
[32m[I 2023-04-26 15:01:09,425][39m Trial 201 finished with value: 0.8235294117647058 and parameters: {'criterion': 'entropy', 'n_estimators': 107, 'max_features': 0.8682244048146762, 'max_depth': 22, 'min_samples_split': 5, 'min_samples_leaf': 3}. Best is trial 133 with value: 0.8705882352941177.
[32m[I 2023-04-26 15:01:09,615][39m Trial 202 finished with value: 0.7848101265822786 and parameters: {'criterion': 'entropy', 'n_estimators': 132, 'max_features': 0.9189591008039836, 'max_depth': 24, 'min_samples_split': 5, 'min_samples_leaf': 2}. Best is trial 133 with value: 0.8705882352941177.
[32m[I 2023-04-26 15:01:09,811][39m Trial 203 finished with value: 0.8275862068965518 and parameters: {'criterion': 'entropy', 'n_estimators': 136, 'max_features': 0.9945596205360421, 'max_depth': 20, 'min_samples_split': 6, 'min_samples_leaf': 3}. Best is trial 133 with value: 0.8705882352941177.
[32m[I 2023-04-26 15:01:09,970][39m Trial 204 finished with value: 0.8048780487804877 and parameters: {'criterion': 'entropy', 'n_estimators': 112, 'max_features': 0.898653729509428, 'max_depth': 26, 'min_samples_split': 6, 'min_samples_leaf': 3}. Best is trial 133 with value: 0.8705882352941177.
[32m[I 2023-04-26 15:01:10,127][39m Trial 205 finished with value: 0.8048780487804877 and parameters: {'criterion': 'entropy', 'n_estimators': 106, 'max_features': 0.9579832259010371, 'max_depth': 15, 'min_samples_split': 7, 'min_samples_leaf': 2}. Best is trial 133 with value: 0.8705882352941177.
[32m[I 2023-04-26 15:01:10,294][39m Trial 206 finished with value: 0.8372093023255814 and parameters: {'criterion': 'entropy', 'n_estimators': 115, 'max_features': 0.8555825806238032, 'max_depth': 21, 'min_samples_split': 6, 'min_samples_leaf': 3}. Best is trial 133 with value: 0.8705882352941177.
[32m[I 2023-04-26 15:01:10,431][39m Trial 207 finished with value: 0.8314606741573034 and parameters: {'criterion': 'entropy', 'n_estimators': 103, 'max_features': 0.8065552379835944, 'max_depth': 22, 'min_samples_split': 7, 'min_samples_leaf': 5}. Best is trial 133 with value: 0.8705882352941177.
[32m[I 2023-04-26 15:01:10,606][39m Trial 208 finished with value: 0.8181818181818182 and parameters: {'criterion': 'entropy', 'n_estimators': 130, 'max_features': 0.8454595047983142, 'max_depth': 18, 'min_samples_split': 6, 'min_samples_leaf': 4}. Best is trial 133 with value: 0.8705882352941177.
[32m[I 2023-04-26 15:01:10,751][39m Trial 209 finished with value: 0.8470588235294119 and parameters: {'criterion': 'entropy', 'n_estimators': 108, 'max_features': 0.8225072647087285, 'max_depth': 24, 'min_samples_split': 4, 'min_samples_leaf': 3}. Best is trial 133 with value: 0.8705882352941177.
[32m[I 2023-04-26 15:01:10,906][39m Trial 210 finished with value: 0.8470588235294119 and parameters: {'criterion': 'entropy', 'n_estimators': 108, 'max_features': 0.938365001365985, 'max_depth': 25, 'min_samples_split': 4, 'min_samples_leaf': 3}. Best is trial 133 with value: 0.8705882352941177.
[32m[I 2023-04-26 15:01:11,057][39m Trial 211 finished with value: 0.8333333333333333 and parameters: {'criterion': 'entropy', 'n_estimators': 111, 'max_features': 0.8219282805376398, 'max_depth': 23, 'min_samples_split': 4, 'min_samples_leaf': 3}. Best is trial 133 with value: 0.8705882352941177.
[32m[I 2023-04-26 15:01:11,286][39m Trial 212 finished with value: 0.8333333333333333 and parameters: {'criterion': 'entropy', 'n_estimators': 134, 'max_features': 0.9420384358814604, 'max_depth': 21, 'min_samples_split': 7, 'min_samples_leaf': 2}. Best is trial 133 with value: 0.8705882352941177.
[32m[I 2023-04-26 15:01:11,430][39m Trial 213 finished with value: 0.8192771084337348 and parameters: {'criterion': 'entropy', 'n_estimators': 107, 'max_features': 0.7860452000818952, 'max_depth': 19, 'min_samples_split': 4, 'min_samples_leaf': 3}. Best is trial 133 with value: 0.8705882352941177.
[32m[I 2023-04-26 15:01:11,576][39m Trial 214 finished with value: 0.8372093023255814 and parameters: {'criterion': 'entropy', 'n_estimators': 97, 'max_features': 0.9625180247793252, 'max_depth': 11, 'min_samples_split': 7, 'min_samples_leaf': 2}. Best is trial 133 with value: 0.8705882352941177.
[32m[I 2023-04-26 15:01:11,755][39m Trial 215 finished with value: 0.8333333333333333 and parameters: {'criterion': 'entropy', 'n_estimators': 124, 'max_features': 0.8976510102449838, 'max_depth': 23, 'min_samples_split': 7, 'min_samples_leaf': 2}. Best is trial 133 with value: 0.8705882352941177.
[32m[I 2023-04-26 15:01:11,921][39m Trial 216 finished with value: 0.8222222222222222 and parameters: {'criterion': 'entropy', 'n_estimators': 116, 'max_features': 0.9863258851513658, 'max_depth': 8, 'min_samples_split': 5, 'min_samples_leaf': 3}. Best is trial 133 with value: 0.8705882352941177.
[32m[I 2023-04-26 15:01:12,132][39m Trial 217 finished with value: 0.8433734939759037 and parameters: {'criterion': 'entropy', 'n_estimators': 138, 'max_features': 0.9778201259277244, 'max_depth': 14, 'min_samples_split': 7, 'min_samples_leaf': 2}. Best is trial 133 with value: 0.8705882352941177.
[32m[I 2023-04-26 15:01:12,275][39m Trial 218 finished with value: 0.8192771084337348 and parameters: {'criterion': 'entropy', 'n_estimators': 105, 'max_features': 0.828345146538598, 'max_depth': 25, 'min_samples_split': 4, 'min_samples_leaf': 3}. Best is trial 133 with value: 0.8705882352941177.
