[32m[I 2023-04-26 15:00:48,241][39m Trial 73 finished with value: 0.8372093023255814 and parameters: {'criterion': 'entropy', 'n_estimators': 143, 'max_features': 0.9804456757553335, 'max_depth': 11, 'min_samples_split': 6, 'min_samples_leaf': 3}. Best is trial 31 with value: 0.8604651162790697.
[32m[I 2023-04-26 15:00:48,423][39m Trial 74 finished with value: 0.8222222222222222 and parameters: {'criterion': 'entropy', 'n_estimators': 133, 'max_features': 0.9573867504781536, 'max_depth': 7, 'min_samples_split': 6, 'min_samples_leaf': 2}. Best is trial 31 with value: 0.8604651162790697.
[32m[I 2023-04-26 15:00:48,624][39m Trial 75 finished with value: 0.8275862068965518 and parameters: {'criterion': 'entropy', 'n_estimators': 156, 'max_features': 0.8466435459196002, 'max_depth': 15, 'min_samples_split': 7, 'min_samples_leaf': 4}. Best is trial 31 with value: 0.8604651162790697.
[32m[I 2023-04-26 15:00:48,793][39m Trial 76 finished with value: 0.8372093023255814 and parameters: {'criterion': 'entropy', 'n_estimators': 119, 'max_features': 0.9241748216087302, 'max_depth': 18, 'min_samples_split': 5, 'min_samples_leaf': 3}. Best is trial 31 with value: 0.8604651162790697.
[32m[I 2023-04-26 15:00:48,930][39m Trial 77 finished with value: 0.7956989247311829 and parameters: {'criterion': 'entropy', 'n_estimators': 128, 'max_features': 0.7695035181857461, 'max_depth': 4, 'min_samples_split': 7, 'min_samples_leaf': 2}. Best is trial 31 with value: 0.8604651162790697.
[32m[I 2023-04-26 15:00:49,041][39m Trial 78 finished with value: 0.7654320987654322 and parameters: {'criterion': 'entropy', 'n_estimators': 114, 'max_features': 0.2971943526342691, 'max_depth': 8, 'min_samples_split': 8, 'min_samples_leaf': 1}. Best is trial 31 with value: 0.8604651162790697.
[32m[I 2023-04-26 15:00:49,195][39m Trial 79 finished with value: 0.8292682926829268 and parameters: {'criterion': 'entropy', 'n_estimators': 139, 'max_features': 0.4767448259111223, 'max_depth': 30, 'min_samples_split': 6, 'min_samples_leaf': 3}. Best is trial 31 with value: 0.8604651162790697.
[32m[I 2023-04-26 15:00:49,390][39m Trial 80 finished with value: 0.8372093023255814 and parameters: {'criterion': 'entropy', 'n_estimators': 160, 'max_features': 0.6923412434591405, 'max_depth': 24, 'min_samples_split': 4, 'min_samples_leaf': 4}. Best is trial 31 with value: 0.8604651162790697.
[32m[I 2023-04-26 15:00:49,568][39m Trial 81 finished with value: 0.8470588235294119 and parameters: {'criterion': 'entropy', 'n_estimators': 125, 'max_features': 0.888984128345446, 'max_depth': 21, 'min_samples_split': 5, 'min_samples_leaf': 3}. Best is trial 31 with value: 0.8604651162790697.
[32m[I 2023-04-26 15:00:49,719][39m Trial 82 finished with value: 0.8571428571428572 and parameters: {'criterion': 'entropy', 'n_estimators': 108, 'max_features': 0.8611473256150017, 'max_depth': 21, 'min_samples_split': 5, 'min_samples_leaf': 3}. Best is trial 31 with value: 0.8604651162790697.
[32m[I 2023-04-26 15:00:49,870][39m Trial 83 finished with value: 0.8148148148148149 and parameters: {'criterion': 'entropy', 'n_estimators': 97, 'max_features': 0.9726753738211439, 'max_depth': 12, 'min_samples_split': 5, 'min_samples_leaf': 3}. Best is trial 31 with value: 0.8604651162790697.
[32m[I 2023-04-26 15:00:50,058][39m Trial 84 finished with value: 0.8181818181818182 and parameters: {'criterion': 'entropy', 'n_estimators': 134, 'max_features': 0.9020407024802906, 'max_depth': 21, 'min_samples_split': 5, 'min_samples_leaf': 4}. Best is trial 31 with value: 0.8604651162790697.
[32m[I 2023-04-26 15:00:50,211][39m Trial 85 finished with value: 0.8571428571428572 and parameters: {'criterion': 'entropy', 'n_estimators': 108, 'max_features': 0.8566280077163955, 'max_depth': 16, 'min_samples_split': 4, 'min_samples_leaf': 2}. Best is trial 31 with value: 0.8604651162790697.
[32m[I 2023-04-26 15:00:50,358][39m Trial 86 finished with value: 0.7901234567901235 and parameters: {'criterion': 'entropy', 'n_estimators': 107, 'max_features': 0.8168538857388357, 'max_depth': 40, 'min_samples_split': 4, 'min_samples_leaf': 2}. Best is trial 31 with value: 0.8604651162790697.
[32m[I 2023-04-26 15:00:50,493][39m Trial 87 finished with value: 0.7594936708860759 and parameters: {'criterion': 'gini', 'n_estimators': 114, 'max_features': 0.8531249908866201, 'max_depth': 26, 'min_samples_split': 3, 'min_samples_leaf': 2}. Best is trial 31 with value: 0.8604651162790697.
[32m[I 2023-04-26 15:00:50,670][39m Trial 88 finished with value: 0.7692307692307694 and parameters: {'criterion': 'entropy', 'n_estimators': 145, 'max_features': 0.6337988829420456, 'max_depth': 15, 'min_samples_split': 6, 'min_samples_leaf': 1}. Best is trial 31 with value: 0.8604651162790697.
[32m[I 2023-04-26 15:00:50,825][39m Trial 89 finished with value: 0.7500000000000001 and parameters: {'criterion': 'entropy', 'n_estimators': 123, 'max_features': 0.9460442633427852, 'max_depth': 31, 'min_samples_split': 5, 'min_samples_leaf': 11}. Best is trial 31 with value: 0.8604651162790697.
[32m[I 2023-04-26 15:00:50,963][39m Trial 90 finished with value: 0.8048780487804877 and parameters: {'criterion': 'entropy', 'n_estimators': 102, 'max_features': 0.7956038646871921, 'max_depth': 46, 'min_samples_split': 7, 'min_samples_leaf': 2}. Best is trial 31 with value: 0.8604651162790697.
[32m[I 2023-04-26 15:00:51,120][39m Trial 91 finished with value: 0.8372093023255814 and parameters: {'criterion': 'entropy', 'n_estimators': 109, 'max_features': 0.8545875450943541, 'max_depth': 21, 'min_samples_split': 4, 'min_samples_leaf': 3}. Best is trial 31 with value: 0.8604651162790697.
[32m[I 2023-04-26 15:00:51,292][39m Trial 92 finished with value: 0.8095238095238095 and parameters: {'criterion': 'entropy', 'n_estimators': 126, 'max_features': 0.8874144026977231, 'max_depth': 11, 'min_samples_split': 4, 'min_samples_leaf': 3}. Best is trial 31 with value: 0.8604651162790697.
[32m[I 2023-04-26 15:00:51,437][39m Trial 93 finished with value: 0.8148148148148149 and parameters: {'criterion': 'entropy', 'n_estimators': 100, 'max_features': 0.9308568353671446, 'max_depth': 17, 'min_samples_split': 6, 'min_samples_leaf': 2}. Best is trial 31 with value: 0.8604651162790697.
[32m[I 2023-04-26 15:00:51,549][39m Trial 94 finished with value: 0.8045977011494252 and parameters: {'criterion': 'entropy', 'n_estimators': 89, 'max_features': 0.8234894454207369, 'max_depth': 13, 'min_samples_split': 3, 'min_samples_leaf': 8}. Best is trial 31 with value: 0.8604651162790697.
[32m[I 2023-04-26 15:00:51,797][39m Trial 95 finished with value: 0.8048780487804877 and parameters: {'criterion': 'entropy', 'n_estimators': 181, 'max_features': 0.7826639032836926, 'max_depth': 17, 'min_samples_split': 7, 'min_samples_leaf': 2}. Best is trial 31 with value: 0.8604651162790697.
[32m[I 2023-04-26 15:00:51,970][39m Trial 96 finished with value: 0.8409090909090909 and parameters: {'criterion': 'entropy', 'n_estimators': 117, 'max_features': 0.9969165979188686, 'max_depth': 8, 'min_samples_split': 4, 'min_samples_leaf': 3}. Best is trial 31 with value: 0.8604651162790697.
[32m[I 2023-04-26 15:00:52,108][39m Trial 97 finished with value: 0.810126582278481 and parameters: {'criterion': 'entropy', 'n_estimators': 94, 'max_features': 0.8724453533209812, 'max_depth': 21, 'min_samples_split': 5, 'min_samples_leaf': 1}. Best is trial 31 with value: 0.8604651162790697.
[32m[I 2023-04-26 15:00:52,292][39m Trial 98 finished with value: 0.8470588235294119 and parameters: {'criterion': 'entropy', 'n_estimators': 130, 'max_features': 0.914924350154206, 'max_depth': 14, 'min_samples_split': 7, 'min_samples_leaf': 2}. Best is trial 31 with value: 0.8604651162790697.
[32m[I 2023-04-26 15:00:52,470][39m Trial 99 finished with value: 0.8048780487804877 and parameters: {'criterion': 'entropy', 'n_estimators': 128, 'max_features': 0.8369811671208613, 'max_depth': 25, 'min_samples_split': 8, 'min_samples_leaf': 1}. Best is trial 31 with value: 0.8604651162790697.
[32m[I 2023-04-26 15:00:52,652][39m Trial 100 finished with value: 0.8314606741573034 and parameters: {'criterion': 'entropy', 'n_estimators': 137, 'max_features': 0.8895882444376189, 'max_depth': 29, 'min_samples_split': 5, 'min_samples_leaf': 5}. Best is trial 31 with value: 0.8604651162790697.
[32m[I 2023-04-26 15:00:52,821][39m Trial 101 finished with value: 0.8470588235294119 and parameters: {'criterion': 'entropy', 'n_estimators': 120, 'max_features': 0.8685452134388292, 'max_depth': 20, 'min_samples_split': 6, 'min_samples_leaf': 3}. Best is trial 31 with value: 0.8604651162790697.
[32m[I 2023-04-26 15:00:52,989][39m Trial 102 finished with value: 0.8 and parameters: {'criterion': 'entropy', 'n_estimators': 173, 'max_features': 0.38355655902588115, 'max_depth': 23, 'min_samples_split': 4, 'min_samples_leaf': 3}. Best is trial 31 with value: 0.8604651162790697.
[32m[I 2023-04-26 15:00:53,113][39m Trial 103 finished with value: 0.712871287128713 and parameters: {'criterion': 'entropy', 'n_estimators': 113, 'max_features': 0.8129168998195022, 'max_depth': 3, 'min_samples_split': 5, 'min_samples_leaf': 4}. Best is trial 31 with value: 0.8604651162790697.
[32m[I 2023-04-26 15:00:53,262][39m Trial 104 finished with value: 0.8048780487804877 and parameters: {'criterion': 'entropy', 'n_estimators': 104, 'max_features': 0.9125393509252063, 'max_depth': 15, 'min_samples_split': 7, 'min_samples_leaf': 2}. Best is trial 31 with value: 0.8604651162790697.
[32m[I 2023-04-26 15:00:53,383][39m Trial 105 finished with value: 0.8 and parameters: {'criterion': 'gini', 'n_estimators': 108, 'max_features': 0.7595393939436003, 'max_depth': 18, 'min_samples_split': 2, 'min_samples_leaf': 3}. Best is trial 31 with value: 0.8604651162790697.
[32m[I 2023-04-26 15:00:53,558][39m Trial 106 finished with value: 0.8181818181818182 and parameters: {'criterion': 'entropy', 'n_estimators': 125, 'max_features': 0.9711516438432651, 'max_depth': 11, 'min_samples_split': 6, 'min_samples_leaf': 4}. Best is trial 31 with value: 0.8604651162790697.
[32m[I 2023-04-26 15:00:53,705][39m Trial 107 finished with value: 0.8250000000000001 and parameters: {'criterion': 'entropy', 'n_estimators': 129, 'max_features': 0.5066884903254254, 'max_depth': 14, 'min_samples_split': 7, 'min_samples_leaf': 2}. Best is trial 31 with value: 0.8604651162790697.
[32m[I 2023-04-26 15:00:53,865][39m Trial 108 finished with value: 0.8235294117647058 and parameters: {'criterion': 'entropy', 'n_estimators': 116, 'max_features': 0.8369107569007659, 'max_depth': 16, 'min_samples_split': 7, 'min_samples_leaf': 2}. Best is trial 31 with value: 0.8604651162790697.
[32m[I 2023-04-26 15:00:54,041][39m Trial 109 finished with value: 0.8 and parameters: {'criterion': 'entropy', 'n_estimators': 136, 'max_features': 0.9205715660713614, 'max_depth': 6, 'min_samples_split': 7, 'min_samples_leaf': 2}. Best is trial 31 with value: 0.8604651162790697.
[32m[I 2023-04-26 15:00:54,140][39m Trial 110 finished with value: 0.7906976744186047 and parameters: {'criterion': 'entropy', 'n_estimators': 67, 'max_features': 0.859670609027605, 'max_depth': 13, 'min_samples_split': 8, 'min_samples_leaf': 2}. Best is trial 31 with value: 0.8604651162790697.
[32m[I 2023-04-26 15:00:54,339][39m Trial 111 finished with value: 0.8314606741573034 and parameters: {'criterion': 'entropy', 'n_estimators': 142, 'max_features': 0.9380836881989976, 'max_depth': 10, 'min_samples_split': 5, 'min_samples_leaf': 3}. Best is trial 31 with value: 0.8604651162790697.
[32m[I 2023-04-26 15:00:54,500][39m Trial 112 finished with value: 0.8470588235294119 and parameters: {'criterion': 'entropy', 'n_estimators': 118, 'max_features': 0.8683049604772697, 'max_depth': 19, 'min_samples_split': 6, 'min_samples_leaf': 3}. Best is trial 31 with value: 0.8604651162790697.
[32m[I 2023-04-26 15:00:54,664][39m Trial 113 finished with value: 0.8181818181818182 and parameters: {'criterion': 'entropy', 'n_estimators': 119, 'max_features': 0.8938321417509741, 'max_depth': 27, 'min_samples_split': 10, 'min_samples_leaf': 3}. Best is trial 31 with value: 0.8604651162790697.
[32m[I 2023-04-26 15:00:54,820][39m Trial 114 finished with value: 0.8433734939759037 and parameters: {'criterion': 'entropy', 'n_estimators': 122, 'max_features': 0.7257481631174617, 'max_depth': 20, 'min_samples_split': 6, 'min_samples_leaf': 3}. Best is trial 31 with value: 0.8604651162790697.
[32m[I 2023-04-26 15:00:54,967][39m Trial 115 finished with value: 0.8505747126436782 and parameters: {'criterion': 'entropy', 'n_estimators': 111, 'max_features': 0.804199693763875, 'max_depth': 24, 'min_samples_split': 6, 'min_samples_leaf': 4}. Best is trial 31 with value: 0.8604651162790697.
[32m[I 2023-04-26 15:00:55,133][39m Trial 116 finished with value: 0.8314606741573034 and parameters: {'criterion': 'entropy', 'n_estimators': 119, 'max_features': 0.8732143331410874, 'max_depth': 24, 'min_samples_split': 6, 'min_samples_leaf': 4}. Best is trial 31 with value: 0.8604651162790697.
[32m[I 2023-04-26 15:00:55,274][39m Trial 117 finished with value: 0.8275862068965518 and parameters: {'criterion': 'entropy', 'n_estimators': 110, 'max_features': 0.8049090932439723, 'max_depth': 35, 'min_samples_split': 5, 'min_samples_leaf': 5}. Best is trial 31 with value: 0.8604651162790697.
[32m[I 2023-04-26 15:00:55,428][39m Trial 118 finished with value: 0.7848101265822786 and parameters: {'criterion': 'entropy', 'n_estimators': 104, 'max_features': 0.781649801986546, 'max_depth': 23, 'min_samples_split': 4, 'min_samples_leaf': 2}. Best is trial 31 with value: 0.8604651162790697.
[32m[I 2023-04-26 15:00:55,577][39m Trial 119 finished with value: 0.8275862068965518 and parameters: {'criterion': 'gini', 'n_estimators': 132, 'max_features': 0.8388278888773456, 'max_depth': 58, 'min_samples_split': 6, 'min_samples_leaf': 4}. Best is trial 31 with value: 0.8604651162790697.
[32m[I 2023-04-26 15:00:55,683][39m Trial 120 finished with value: 0.7594936708860759 and parameters: {'criterion': 'entropy', 'n_estimators': 131, 'max_features': 0.04856296097629109, 'max_depth': 16, 'min_samples_split': 6, 'min_samples_leaf': 3}. Best is trial 31 with value: 0.8604651162790697.
[32m[I 2023-04-26 15:00:55,842][39m Trial 121 finished with value: 0.8181818181818182 and parameters: {'criterion': 'entropy', 'n_estimators': 113, 'max_features': 0.9116093940384746, 'max_depth': 9, 'min_samples_split': 7, 'min_samples_leaf': 2}. Best is trial 31 with value: 0.8604651162790697.
[32m[I 2023-04-26 15:00:56,011][39m Trial 122 finished with value: 0.8409090909090909 and parameters: {'criterion': 'entropy', 'n_estimators': 125, 'max_features': 0.8864446507486766, 'max_depth': 21, 'min_samples_split': 6, 'min_samples_leaf': 4}. Best is trial 31 with value: 0.8604651162790697.
[32m[I 2023-04-26 15:00:56,195][39m Trial 123 finished with value: 0.8235294117647058 and parameters: {'criterion': 'entropy', 'n_estimators': 122, 'max_features': 0.9603716202261477, 'max_depth': 19, 'min_samples_split': 6, 'min_samples_leaf': 3}. Best is trial 31 with value: 0.8604651162790697.
[32m[I 2023-04-26 15:00:56,355][39m Trial 124 finished with value: 0.8470588235294119 and parameters: {'criterion': 'entropy', 'n_estimators': 117, 'max_features': 0.8561645324281055, 'max_depth': 26, 'min_samples_split': 6, 'min_samples_leaf': 3}. Best is trial 31 with value: 0.8604651162790697.
[32m[I 2023-04-26 15:00:56,485][39m Trial 125 finished with value: 0.8 and parameters: {'criterion': 'entropy', 'n_estimators': 100, 'max_features': 0.865346678123035, 'max_depth': 18, 'min_samples_split': 6, 'min_samples_leaf': 7}. Best is trial 31 with value: 0.8604651162790697.
[32m[I 2023-04-26 15:00:56,648][39m Trial 126 finished with value: 0.8095238095238095 and parameters: {'criterion': 'entropy', 'n_estimators': 107, 'max_features': 0.8258650926186623, 'max_depth': 12, 'min_samples_split': 5, 'min_samples_leaf': 3}. Best is trial 31 with value: 0.8604651162790697.
[32m[I 2023-04-26 15:00:56,915][39m Trial 127 finished with value: 0.7948717948717948 and parameters: {'criterion': 'entropy', 'n_estimators': 188, 'max_features': 0.9386004713085844, 'max_depth': 51, 'min_samples_split': 4, 'min_samples_leaf': 1}. Best is trial 31 with value: 0.8604651162790697.
[32m[I 2023-04-26 15:00:57,068][39m Trial 128 finished with value: 0.8148148148148149 and parameters: {'criterion': 'entropy', 'n_estimators': 113, 'max_features': 0.7962062522452181, 'max_depth': 69, 'min_samples_split': 7, 'min_samples_leaf': 2}. Best is trial 31 with value: 0.8604651162790697.
[32m[I 2023-04-26 15:00:57,277][39m Trial 129 finished with value: 0.8470588235294119 and parameters: {'criterion': 'entropy', 'n_estimators': 147, 'max_features': 0.9078384638711572, 'max_depth': 26, 'min_samples_split': 3, 'min_samples_leaf': 3}. Best is trial 31 with value: 0.8604651162790697.
[32m[I 2023-04-26 15:00:57,479][39m Trial 130 finished with value: 0.8314606741573034 and parameters: {'criterion': 'entropy', 'n_estimators': 147, 'max_features': 0.9030949157695876, 'max_depth': 84, 'min_samples_split': 2, 'min_samples_leaf': 4}. Best is trial 31 with value: 0.8604651162790697.
[32m[I 2023-04-26 15:00:57,659][39m Trial 131 finished with value: 0.8292682926829268 and parameters: {'criterion': 'entropy', 'n_estimators': 129, 'max_features': 0.847327013235092, 'max_depth': 14, 'min_samples_split': 3, 'min_samples_leaf': 2}. Best is trial 31 with value: 0.8604651162790697.
[32m[I 2023-04-26 15:00:57,877][39m Trial 132 finished with value: 0.8235294117647058 and parameters: {'criterion': 'entropy', 'n_estimators': 162, 'max_features': 0.872899398099512, 'max_depth': 18, 'min_samples_split': 3, 'min_samples_leaf': 3}. Best is trial 31 with value: 0.8604651162790697.
[32m[I 2023-04-26 15:00:58,037][39m Trial 133 finished with value: 0.8705882352941177 and parameters: {'criterion': 'entropy', 'n_estimators': 117, 'max_features': 0.8552969928083164, 'max_depth': 22, 'min_samples_split': 6, 'min_samples_leaf': 3}. Best is trial 133 with value: 0.8705882352941177.
[32m[I 2023-04-26 15:00:58,180][39m Trial 134 finished with value: 0.8409090909090909 and parameters: {'criterion': 'entropy', 'n_estimators': 111, 'max_features': 0.7415994307243552, 'max_depth': 22, 'min_samples_split': 5, 'min_samples_leaf': 4}. Best is trial 133 with value: 0.8705882352941177.
[32m[I 2023-04-26 15:00:58,323][39m Trial 135 finished with value: 0.7951807228915663 and parameters: {'criterion': 'entropy', 'n_estimators': 121, 'max_features': 0.5827471146982729, 'max_depth': 16, 'min_samples_split': 7, 'min_samples_leaf': 2}. Best is trial 133 with value: 0.8705882352941177.
[32m[I 2023-04-26 15:00:58,483][39m Trial 136 finished with value: 0.8433734939759037 and parameters: {'criterion': 'entropy', 'n_estimators': 116, 'max_features': 0.8139937659061816, 'max_depth': 25, 'min_samples_split': 6, 'min_samples_leaf': 3}. Best is trial 133 with value: 0.8705882352941177.
[32m[I 2023-04-26 15:00:58,654][39m Trial 137 finished with value: 0.8571428571428572 and parameters: {'criterion': 'entropy', 'n_estimators': 126, 'max_features': 0.8460656618803339, 'max_depth': 28, 'min_samples_split': 3, 'min_samples_leaf': 3}. Best is trial 133 with value: 0.8705882352941177.
[32m[I 2023-04-26 15:00:58,809][39m Trial 138 finished with value: 0.8192771084337348 and parameters: {'criterion': 'entropy', 'n_estimators': 118, 'max_features': 0.7755130789429227, 'max_depth': 33, 'min_samples_split': 2, 'min_samples_leaf': 3}. Best is trial 133 with value: 0.8705882352941177.
[32m[I 2023-04-26 15:00:58,993][39m Trial 139 finished with value: 0.8372093023255814 and parameters: {'criterion': 'entropy', 'n_estimators': 134, 'max_features': 0.8382802016649347, 'max_depth': 20, 'min_samples_split': 6, 'min_samples_leaf': 3}. Best is trial 133 with value: 0.8705882352941177.
[32m[I 2023-04-26 15:00:59,174][39m Trial 140 finished with value: 0.8470588235294119 and parameters: {'criterion': 'entropy', 'n_estimators': 126, 'max_features': 0.8643551282030307, 'max_depth': 23, 'min_samples_split': 7, 'min_samples_leaf': 2}. Best is trial 133 with value: 0.8705882352941177.
[32m[I 2023-04-26 15:00:59,326][39m Trial 141 finished with value: 0.8333333333333333 and parameters: {'criterion': 'entropy', 'n_estimators': 104, 'max_features': 0.920405895706463, 'max_depth': 29, 'min_samples_split': 7, 'min_samples_leaf': 2}. Best is trial 133 with value: 0.8705882352941177.
[32m[I 2023-04-26 15:00:59,499][39m Trial 142 finished with value: 0.8433734939759037 and parameters: {'criterion': 'entropy', 'n_estimators': 123, 'max_features': 0.861868041563653, 'max_depth': 28, 'min_samples_split': 3, 'min_samples_leaf': 3}. Best is trial 133 with value: 0.8705882352941177.
[32m[I 2023-04-26 15:00:59,667][39m Trial 143 finished with value: 0.8235294117647058 and parameters: {'criterion': 'entropy', 'n_estimators': 120, 'max_features': 0.8857282380286045, 'max_depth': 21, 'min_samples_split': 3, 'min_samples_leaf': 3}. Best is trial 133 with value: 0.8705882352941177.
[32m[I 2023-04-26 15:00:59,813][39m Trial 144 finished with value: 0.8192771084337348 and parameters: {'criterion': 'entropy', 'n_estimators': 108, 'max_features': 0.8236545027092481, 'max_depth': 17, 'min_samples_split': 4, 'min_samples_leaf': 3}. Best is trial 133 with value: 0.8705882352941177.
[32m[I 2023-04-26 15:01:00,028][39m Trial 145 finished with value: 0.8292682926829268 and parameters: {'criterion': 'entropy', 'n_estimators': 142, 'max_features': 0.9472857709935715, 'max_depth': 14, 'min_samples_split': 2, 'min_samples_leaf': 2}. Best is trial 133 with value: 0.8705882352941177.
