[32m[I 2023-04-26 15:00:36,937][39m A new study created in memory with name: no-name-752022e0-b8d4-487d-920d-f3b2eec98cc8
[32m[I 2023-04-26 15:00:37,092][39m Trial 0 finished with value: 0.7356321839080461 and parameters: {'criterion': 'gini', 'n_estimators': 197, 'max_features': 0.14435757437019847, 'max_depth': 73, 'min_samples_split': 6, 'min_samples_leaf': 11}. Best is trial 0 with value: 0.7356321839080461.
[32m[I 2023-04-26 15:00:37,161][39m Trial 1 finished with value: 0.746987951807229 and parameters: {'criterion': 'entropy', 'n_estimators': 93, 'max_features': 0.10651671831567344, 'max_depth': 56, 'min_samples_split': 3, 'min_samples_leaf': 5}. Best is trial 1 with value: 0.746987951807229.
[32m[I 2023-04-26 15:00:37,211][39m Trial 2 finished with value: 0.8 and parameters: {'criterion': 'gini', 'n_estimators': 50, 'max_features': 0.47409486995876315, 'max_depth': 86, 'min_samples_split': 8, 'min_samples_leaf': 1}. Best is trial 2 with value: 0.8.
[32m[I 2023-04-26 15:00:37,296][39m Trial 3 finished with value: 0.7727272727272727 and parameters: {'criterion': 'gini', 'n_estimators': 96, 'max_features': 0.4818231686531145, 'max_depth': 75, 'min_samples_split': 4, 'min_samples_leaf': 7}. Best is trial 2 with value: 0.8.
[32m[I 2023-04-26 15:00:37,359][39m Trial 4 finished with value: 0.7500000000000001 and parameters: {'criterion': 'entropy', 'n_estimators': 74, 'max_features': 0.3308159739636851, 'max_depth': 8, 'min_samples_split': 2, 'min_samples_leaf': 10}. Best is trial 2 with value: 0.8.
[32m[I 2023-04-26 15:00:37,417][39m Trial 5 finished with value: 0.7272727272727273 and parameters: {'criterion': 'gini', 'n_estimators': 71, 'max_features': 0.2379354795717371, 'max_depth': 64, 'min_samples_split': 9, 'min_samples_leaf': 11}. Best is trial 2 with value: 0.8.
[32m[I 2023-04-26 15:00:37,541][39m Trial 6 finished with value: 0.7999999999999999 and parameters: {'criterion': 'entropy', 'n_estimators': 145, 'max_features': 0.2803259135555707, 'max_depth': 60, 'min_samples_split': 9, 'min_samples_leaf': 7}. Best is trial 2 with value: 0.8.
[32m[I 2023-04-26 15:00:37,629][39m Trial 7 finished with value: 0.8048780487804877 and parameters: {'criterion': 'entropy', 'n_estimators': 74, 'max_features': 0.6586554974453702, 'max_depth': 32, 'min_samples_split': 6, 'min_samples_leaf': 2}. Best is trial 7 with value: 0.8048780487804877.
[32m[I 2023-04-26 15:00:37,761][39m Trial 8 finished with value: 0.7500000000000001 and parameters: {'criterion': 'entropy', 'n_estimators': 111, 'max_features': 0.9276658803003538, 'max_depth': 33, 'min_samples_split': 11, 'min_samples_leaf': 9}. Best is trial 7 with value: 0.8048780487804877.
[32m[I 2023-04-26 15:00:37,865][39m Trial 9 finished with value: 0.8250000000000001 and parameters: {'criterion': 'entropy', 'n_estimators': 89, 'max_features': 0.6233560692604719, 'max_depth': 76, 'min_samples_split': 3, 'min_samples_leaf': 3}. Best is trial 9 with value: 0.8250000000000001.
[32m[I 2023-04-26 15:00:38,045][39m Trial 10 finished with value: 0.8409090909090909 and parameters: {'criterion': 'entropy', 'n_estimators': 143, 'max_features': 0.7702539432188125, 'max_depth': 40, 'min_samples_split': 4, 'min_samples_leaf': 4}. Best is trial 10 with value: 0.8409090909090909.
[32m[I 2023-04-26 15:00:38,219][39m Trial 11 finished with value: 0.8409090909090909 and parameters: {'criterion': 'entropy', 'n_estimators': 141, 'max_features': 0.7628851674665207, 'max_depth': 96, 'min_samples_split': 4, 'min_samples_leaf': 4}. Best is trial 10 with value: 0.8409090909090909.
[32m[I 2023-04-26 15:00:38,427][39m Trial 12 finished with value: 0.8275862068965518 and parameters: {'criterion': 'entropy', 'n_estimators': 154, 'max_features': 0.9114789606185244, 'max_depth': 100, 'min_samples_split': 5, 'min_samples_leaf': 4}. Best is trial 10 with value: 0.8409090909090909.
[32m[I 2023-04-26 15:00:38,607][39m Trial 13 finished with value: 0.8181818181818182 and parameters: {'criterion': 'entropy', 'n_estimators': 145, 'max_features': 0.7797097040294593, 'max_depth': 37, 'min_samples_split': 4, 'min_samples_leaf': 6}. Best is trial 10 with value: 0.8409090909090909.
[32m[I 2023-04-26 15:00:38,812][39m Trial 14 finished with value: 0.8505747126436782 and parameters: {'criterion': 'entropy', 'n_estimators': 171, 'max_features': 0.7692159079532903, 'max_depth': 14, 'min_samples_split': 2, 'min_samples_leaf': 4}. Best is trial 14 with value: 0.8505747126436782.
[32m[I 2023-04-26 15:00:38,987][39m Trial 15 finished with value: 0.6851851851851852 and parameters: {'criterion': 'entropy', 'n_estimators': 179, 'max_features': 0.9976647547240154, 'max_depth': 2, 'min_samples_split': 2, 'min_samples_leaf': 3}. Best is trial 14 with value: 0.8505747126436782.
[32m[I 2023-04-26 15:00:39,201][39m Trial 16 finished with value: 0.8181818181818182 and parameters: {'criterion': 'entropy', 'n_estimators': 170, 'max_features': 0.7923990616711643, 'max_depth': 19, 'min_samples_split': 2, 'min_samples_leaf': 5}. Best is trial 14 with value: 0.8505747126436782.
[32m[I 2023-04-26 15:00:39,357][39m Trial 17 finished with value: 0.810126582278481 and parameters: {'criterion': 'entropy', 'n_estimators': 123, 'max_features': 0.6272041983950775, 'max_depth': 97, 'min_samples_split': 5, 'min_samples_leaf': 1}. Best is trial 14 with value: 0.8505747126436782.
[32m[I 2023-04-26 15:00:39,530][39m Trial 18 finished with value: 0.7999999999999999 and parameters: {'criterion': 'gini', 'n_estimators': 170, 'max_features': 0.7047843590462064, 'max_depth': 46, 'min_samples_split': 7, 'min_samples_leaf': 6}. Best is trial 14 with value: 0.8505747126436782.
[32m[I 2023-04-26 15:00:39,735][39m Trial 19 finished with value: 0.7906976744186047 and parameters: {'criterion': 'entropy', 'n_estimators': 201, 'max_features': 0.5234204140410177, 'max_depth': 19, 'min_samples_split': 3, 'min_samples_leaf': 8}. Best is trial 14 with value: 0.8505747126436782.
[32m[I 2023-04-26 15:00:39,908][39m Trial 20 finished with value: 0.8433734939759037 and parameters: {'criterion': 'entropy', 'n_estimators': 128, 'max_features': 0.8869373464056484, 'max_depth': 19, 'min_samples_split': 5, 'min_samples_leaf': 3}. Best is trial 14 with value: 0.8505747126436782.
[32m[I 2023-04-26 15:00:40,082][39m Trial 21 finished with value: 0.8470588235294119 and parameters: {'criterion': 'entropy', 'n_estimators': 127, 'max_features': 0.8726474693566333, 'max_depth': 20, 'min_samples_split': 5, 'min_samples_leaf': 3}. Best is trial 14 with value: 0.8505747126436782.
[32m[I 2023-04-26 15:00:40,248][39m Trial 22 finished with value: 0.8470588235294119 and parameters: {'criterion': 'entropy', 'n_estimators': 120, 'max_features': 0.8535655334038524, 'max_depth': 17, 'min_samples_split': 7, 'min_samples_leaf': 2}. Best is trial 14 with value: 0.8505747126436782.
[32m[I 2023-04-26 15:00:40,402][39m Trial 23 finished with value: 0.8470588235294119 and parameters: {'criterion': 'entropy', 'n_estimators': 110, 'max_features': 0.8557490765293355, 'max_depth': 11, 'min_samples_split': 7, 'min_samples_leaf': 2}. Best is trial 14 with value: 0.8505747126436782.
[32m[I 2023-04-26 15:00:40,563][39m Trial 24 finished with value: 0.8372093023255814 and parameters: {'criterion': 'entropy', 'n_estimators': 109, 'max_features': 0.9772957769042171, 'max_depth': 9, 'min_samples_split': 8, 'min_samples_leaf': 2}. Best is trial 14 with value: 0.8505747126436782.
[32m[I 2023-04-26 15:00:40,730][39m Trial 25 finished with value: 0.7951807228915663 and parameters: {'criterion': 'entropy', 'n_estimators': 127, 'max_features': 0.8329048835809503, 'max_depth': 25, 'min_samples_split': 11, 'min_samples_leaf': 1}. Best is trial 14 with value: 0.8505747126436782.
[32m[I 2023-04-26 15:00:40,844][39m Trial 26 finished with value: 0.7999999999999999 and parameters: {'criterion': 'gini', 'n_estimators': 111, 'max_features': 0.5690924505678159, 'max_depth': 9, 'min_samples_split': 7, 'min_samples_leaf': 2}. Best is trial 14 with value: 0.8505747126436782.
[32m[I 2023-04-26 15:00:40,970][39m Trial 27 finished with value: 0.7560975609756099 and parameters: {'criterion': 'entropy', 'n_estimators': 160, 'max_features': 0.0008512078982138016, 'max_depth': 26, 'min_samples_split': 8, 'min_samples_leaf': 2}. Best is trial 14 with value: 0.8505747126436782.
[32m[I 2023-04-26 15:00:41,155][39m Trial 28 finished with value: 0.7474747474747474 and parameters: {'criterion': 'entropy', 'n_estimators': 190, 'max_features': 0.7158870384604925, 'max_depth': 3, 'min_samples_split': 6, 'min_samples_leaf': 5}. Best is trial 14 with value: 0.8505747126436782.
[32m[I 2023-04-26 15:00:41,320][39m Trial 29 finished with value: 0.8292682926829268 and parameters: {'criterion': 'gini', 'n_estimators': 184, 'max_features': 0.39799990562961224, 'max_depth': 47, 'min_samples_split': 9, 'min_samples_leaf': 3}. Best is trial 14 with value: 0.8505747126436782.
[32m[I 2023-04-26 15:00:41,457][39m Trial 30 finished with value: 0.8409090909090909 and parameters: {'criterion': 'entropy', 'n_estimators': 104, 'max_features': 0.8266748746872102, 'max_depth': 12, 'min_samples_split': 10, 'min_samples_leaf': 4}. Best is trial 14 with value: 0.8505747126436782.
[32m[I 2023-04-26 15:00:41,638][39m Trial 31 finished with value: 0.8604651162790697 and parameters: {'criterion': 'entropy', 'n_estimators': 132, 'max_features': 0.864523100247733, 'max_depth': 15, 'min_samples_split': 7, 'min_samples_leaf': 2}. Best is trial 31 with value: 0.8604651162790697.
[32m[I 2023-04-26 15:00:41,784][39m Trial 32 finished with value: 0.7435897435897435 and parameters: {'criterion': 'entropy', 'n_estimators': 117, 'max_features': 0.7044761155879067, 'max_depth': 13, 'min_samples_split': 7, 'min_samples_leaf': 1}. Best is trial 31 with value: 0.8604651162790697.
[32m[I 2023-04-26 15:00:41,982][39m Trial 33 finished with value: 0.8 and parameters: {'criterion': 'entropy', 'n_estimators': 137, 'max_features': 0.9455052504127333, 'max_depth': 28, 'min_samples_split': 6, 'min_samples_leaf': 2}. Best is trial 31 with value: 0.8604651162790697.
[32m[I 2023-04-26 15:00:42,085][39m Trial 34 finished with value: 0.6612903225806451 and parameters: {'criterion': 'entropy', 'n_estimators': 132, 'max_features': 0.929251089528393, 'max_depth': 1, 'min_samples_split': 8, 'min_samples_leaf': 5}. Best is trial 31 with value: 0.8604651162790697.
[32m[I 2023-04-26 15:00:42,202][39m Trial 35 finished with value: 0.7435897435897435 and parameters: {'criterion': 'gini', 'n_estimators': 91, 'max_features': 0.8403144437703102, 'max_depth': 16, 'min_samples_split': 7, 'min_samples_leaf': 1}. Best is trial 31 with value: 0.8604651162790697.
[32m[I 2023-04-26 15:00:42,409][39m Trial 36 finished with value: 0.8333333333333333 and parameters: {'criterion': 'entropy', 'n_estimators': 155, 'max_features': 0.8602310936543389, 'max_depth': 24, 'min_samples_split': 6, 'min_samples_leaf': 2}. Best is trial 31 with value: 0.8604651162790697.
[32m[I 2023-04-26 15:00:42,512][39m Trial 37 finished with value: 0.782608695652174 and parameters: {'criterion': 'entropy', 'n_estimators': 86, 'max_features': 0.7205587137748692, 'max_depth': 6, 'min_samples_split': 8, 'min_samples_leaf': 4}. Best is trial 31 with value: 0.8604651162790697.
[32m[I 2023-04-26 15:00:42,627][39m Trial 38 finished with value: 0.7804878048780488 and parameters: {'criterion': 'gini', 'n_estimators': 98, 'max_features': 0.8827835348077238, 'max_depth': 22, 'min_samples_split': 3, 'min_samples_leaf': 3}. Best is trial 31 with value: 0.8604651162790697.
[32m[I 2023-04-26 15:00:42,691][39m Trial 39 finished with value: 0.8205128205128206 and parameters: {'criterion': 'entropy', 'n_estimators': 53, 'max_features': 0.4402435328979084, 'max_depth': 32, 'min_samples_split': 7, 'min_samples_leaf': 1}. Best is trial 31 with value: 0.8604651162790697.
[32m[I 2023-04-26 15:00:42,882][39m Trial 40 finished with value: 0.8395061728395061 and parameters: {'criterion': 'entropy', 'n_estimators': 169, 'max_features': 0.5885530932705461, 'max_depth': 54, 'min_samples_split': 5, 'min_samples_leaf': 3}. Best is trial 31 with value: 0.8604651162790697.
[32m[I 2023-04-26 15:00:43,055][39m Trial 41 finished with value: 0.8048780487804877 and parameters: {'criterion': 'entropy', 'n_estimators': 121, 'max_features': 0.8032873191308098, 'max_depth': 14, 'min_samples_split': 6, 'min_samples_leaf': 2}. Best is trial 31 with value: 0.8604651162790697.
[32m[I 2023-04-26 15:00:43,219][39m Trial 42 finished with value: 0.8131868131868132 and parameters: {'criterion': 'entropy', 'n_estimators': 117, 'max_features': 0.9534642919672732, 'max_depth': 7, 'min_samples_split': 9, 'min_samples_leaf': 3}. Best is trial 31 with value: 0.8604651162790697.
[32m[I 2023-04-26 15:00:43,361][39m Trial 43 finished with value: 0.8192771084337348 and parameters: {'criterion': 'entropy', 'n_estimators': 100, 'max_features': 0.8732701260399744, 'max_depth': 16, 'min_samples_split': 7, 'min_samples_leaf': 2}. Best is trial 31 with value: 0.8604651162790697.
[32m[I 2023-04-26 15:00:43,530][39m Trial 44 finished with value: 0.8372093023255814 and parameters: {'criterion': 'entropy', 'n_estimators': 137, 'max_features': 0.751369389602567, 'max_depth': 41, 'min_samples_split': 6, 'min_samples_leaf': 4}. Best is trial 31 with value: 0.8604651162790697.
[32m[I 2023-04-26 15:00:43,657][39m Trial 45 finished with value: 0.761904761904762 and parameters: {'criterion': 'entropy', 'n_estimators': 150, 'max_features': 0.16953784694698026, 'max_depth': 30, 'min_samples_split': 8, 'min_samples_leaf': 5}. Best is trial 31 with value: 0.8604651162790697.
[32m[I 2023-04-26 15:00:43,816][39m Trial 46 finished with value: 0.8571428571428572 and parameters: {'criterion': 'entropy', 'n_estimators': 133, 'max_features': 0.6544314790503405, 'max_depth': 22, 'min_samples_split': 4, 'min_samples_leaf': 3}. Best is trial 31 with value: 0.8604651162790697.
[32m[I 2023-04-26 15:00:44,008][39m Trial 47 finished with value: 0.8192771084337348 and parameters: {'criterion': 'entropy', 'n_estimators': 164, 'max_features': 0.6592759450024035, 'max_depth': 63, 'min_samples_split': 4, 'min_samples_leaf': 3}. Best is trial 31 with value: 0.8604651162790697.
[32m[I 2023-04-26 15:00:44,111][39m Trial 48 finished with value: 0.8181818181818182 and parameters: {'criterion': 'entropy', 'n_estimators': 83, 'max_features': 0.669287240009914, 'max_depth': 36, 'min_samples_split': 2, 'min_samples_leaf': 7}. Best is trial 31 with value: 0.8604651162790697.
[32m[I 2023-04-26 15:00:44,229][39m Trial 49 finished with value: 0.8048780487804877 and parameters: {'criterion': 'gini', 'n_estimators': 106, 'max_features': 0.7564505442683058, 'max_depth': 11, 'min_samples_split': 2, 'min_samples_leaf': 2}. Best is trial 31 with value: 0.8604651162790697.
[32m[I 2023-04-26 15:00:44,349][39m Trial 50 finished with value: 0.7777777777777778 and parameters: {'criterion': 'entropy', 'n_estimators': 116, 'max_features': 0.5448761318888004, 'max_depth': 71, 'min_samples_split': 3, 'min_samples_leaf': 10}. Best is trial 31 with value: 0.8604651162790697.
[32m[I 2023-04-26 15:00:44,530][39m Trial 51 finished with value: 0.8235294117647058 and parameters: {'criterion': 'entropy', 'n_estimators': 131, 'max_features': 0.9031290318198159, 'max_depth': 22, 'min_samples_split': 5, 'min_samples_leaf': 3}. Best is trial 31 with value: 0.8604651162790697.
[32m[I 2023-04-26 15:00:44,718][39m Trial 52 finished with value: 0.8139534883720929 and parameters: {'criterion': 'entropy', 'n_estimators': 137, 'max_features': 0.802975710901489, 'max_depth': 19, 'min_samples_split': 4, 'min_samples_leaf': 4}. Best is trial 31 with value: 0.8604651162790697.
[32m[I 2023-04-26 15:00:44,898][39m Trial 53 finished with value: 0.7956989247311829 and parameters: {'criterion': 'entropy', 'n_estimators': 148, 'max_features': 0.8401138102233557, 'max_depth': 5, 'min_samples_split': 5, 'min_samples_leaf': 2}. Best is trial 31 with value: 0.8604651162790697.
[32m[I 2023-04-26 15:00:45,071][39m Trial 54 finished with value: 0.7948717948717948 and parameters: {'criterion': 'entropy', 'n_estimators': 125, 'max_features': 0.7415791323104297, 'max_depth': 16, 'min_samples_split': 4, 'min_samples_leaf': 1}. Best is trial 31 with value: 0.8604651162790697.
[32m[I 2023-04-26 15:00:45,242][39m Trial 55 finished with value: 0.8409090909090909 and parameters: {'criterion': 'entropy', 'n_estimators': 122, 'max_features': 0.9207789008330709, 'max_depth': 22, 'min_samples_split': 7, 'min_samples_leaf': 4}. Best is trial 31 with value: 0.8604651162790697.
[32m[I 2023-04-26 15:00:45,449][39m Trial 56 finished with value: 0.8333333333333333 and parameters: {'criterion': 'entropy', 'n_estimators': 133, 'max_features': 0.9950076721634511, 'max_depth': 88, 'min_samples_split': 6, 'min_samples_leaf': 3}. Best is trial 31 with value: 0.8604651162790697.
[32m[I 2023-04-26 15:00:45,613][39m Trial 57 finished with value: 0.810126582278481 and parameters: {'criterion': 'entropy', 'n_estimators': 114, 'max_features': 0.7931525387006697, 'max_depth': 28, 'min_samples_split': 3, 'min_samples_leaf': 1}. Best is trial 31 with value: 0.8604651162790697.
[32m[I 2023-04-26 15:00:45,811][39m Trial 58 finished with value: 0.8333333333333333 and parameters: {'criterion': 'entropy', 'n_estimators': 140, 'max_features': 0.9602079495059523, 'max_depth': 10, 'min_samples_split': 9, 'min_samples_leaf': 2}. Best is trial 31 with value: 0.8604651162790697.
[32m[I 2023-04-26 15:00:46,024][39m Trial 59 finished with value: 0.8372093023255814 and parameters: {'criterion': 'entropy', 'n_estimators': 178, 'max_features': 0.6206210665158833, 'max_depth': 34, 'min_samples_split': 6, 'min_samples_leaf': 5}. Best is trial 31 with value: 0.8604651162790697.
[32m[I 2023-04-26 15:00:46,142][39m Trial 60 finished with value: 0.8048780487804877 and parameters: {'criterion': 'gini', 'n_estimators': 102, 'max_features': 0.8574180187297427, 'max_depth': 17, 'min_samples_split': 5, 'min_samples_leaf': 3}. Best is trial 31 with value: 0.8604651162790697.
[32m[I 2023-04-26 15:00:46,317][39m Trial 61 finished with value: 0.8192771084337348 and parameters: {'criterion': 'entropy', 'n_estimators': 129, 'max_features': 0.8733376938201403, 'max_depth': 22, 'min_samples_split': 5, 'min_samples_leaf': 3}. Best is trial 31 with value: 0.8604651162790697.
[32m[I 2023-04-26 15:00:46,467][39m Trial 62 finished with value: 0.8470588235294119 and parameters: {'criterion': 'entropy', 'n_estimators': 108, 'max_features': 0.8975275120280708, 'max_depth': 19, 'min_samples_split': 4, 'min_samples_leaf': 3}. Best is trial 31 with value: 0.8604651162790697.
[32m[I 2023-04-26 15:00:46,601][39m Trial 63 finished with value: 0.7956989247311829 and parameters: {'criterion': 'entropy', 'n_estimators': 111, 'max_features': 0.8233162541065685, 'max_depth': 5, 'min_samples_split': 3, 'min_samples_leaf': 2}. Best is trial 31 with value: 0.8604651162790697.
[32m[I 2023-04-26 15:00:46,733][39m Trial 64 finished with value: 0.8409090909090909 and parameters: {'criterion': 'entropy', 'n_estimators': 94, 'max_features': 0.899260949542679, 'max_depth': 27, 'min_samples_split': 4, 'min_samples_leaf': 4}. Best is trial 31 with value: 0.8604651162790697.
[32m[I 2023-04-26 15:00:46,893][39m Trial 65 finished with value: 0.8 and parameters: {'criterion': 'entropy', 'n_estimators': 120, 'max_features': 0.7800444737748762, 'max_depth': 13, 'min_samples_split': 7, 'min_samples_leaf': 2}. Best is trial 31 with value: 0.8604651162790697.
[32m[I 2023-04-26 15:00:46,995][39m Trial 66 finished with value: 0.8372093023255814 and parameters: {'criterion': 'entropy', 'n_estimators': 79, 'max_features': 0.6840425693483914, 'max_depth': 9, 'min_samples_split': 8, 'min_samples_leaf': 3}. Best is trial 31 with value: 0.8604651162790697.
[32m[I 2023-04-26 15:00:47,163][39m Trial 67 finished with value: 0.8148148148148149 and parameters: {'criterion': 'entropy', 'n_estimators': 111, 'max_features': 0.9369288021257687, 'max_depth': 19, 'min_samples_split': 4, 'min_samples_leaf': 2}. Best is trial 31 with value: 0.8604651162790697.
[32m[I 2023-04-26 15:00:47,313][39m Trial 68 finished with value: 0.8051948051948052 and parameters: {'criterion': 'entropy', 'n_estimators': 106, 'max_features': 0.8182508376568802, 'max_depth': 14, 'min_samples_split': 2, 'min_samples_leaf': 1}. Best is trial 31 with value: 0.8604651162790697.
[32m[I 2023-04-26 15:00:47,548][39m Trial 69 finished with value: 0.8314606741573034 and parameters: {'criterion': 'entropy', 'n_estimators': 195, 'max_features': 0.7326797477668839, 'max_depth': 24, 'min_samples_split': 3, 'min_samples_leaf': 4}. Best is trial 31 with value: 0.8604651162790697.
[32m[I 2023-04-26 15:00:47,671][39m Trial 70 finished with value: 0.6612903225806451 and parameters: {'criterion': 'gini', 'n_estimators': 150, 'max_features': 0.9058829155751495, 'max_depth': 1, 'min_samples_split': 7, 'min_samples_leaf': 6}. Best is trial 31 with value: 0.8604651162790697.
[32m[I 2023-04-26 15:00:47,838][39m Trial 71 finished with value: 0.8333333333333333 and parameters: {'criterion': 'entropy', 'n_estimators': 124, 'max_features': 0.8799385880981622, 'max_depth': 19, 'min_samples_split': 5, 'min_samples_leaf': 3}. Best is trial 31 with value: 0.8604651162790697.
[32m[I 2023-04-26 15:00:48,040][39m Trial 72 finished with value: 0.8470588235294119 and parameters: {'criterion': 'entropy', 'n_estimators': 143, 'max_features': 0.9749853531879209, 'max_depth': 11, 'min_samples_split': 6, 'min_samples_leaf': 3}. Best is trial 31 with value: 0.8604651162790697.
