[32m[I 2023-04-26 02:21:35,432][39m A new study created in memory with name: no-name-77789077-a3ff-4b3f-8d93-8674ba1d0d2f
[32m[I 2023-04-26 02:21:35,456][39m Trial 0 finished with value: 0.5344827586206896 and parameters: {'algorithm': 'brute', 'n_neighbors': 27, 'weights': 'uniform', 'metric': 'manhattan'}. Best is trial 0 with value: 0.5344827586206896.
[32m[I 2023-04-26 02:21:35,462][39m Trial 1 finished with value: 0.606060606060606 and parameters: {'algorithm': 'kd_tree', 'n_neighbors': 26, 'weights': 'distance', 'metric': 'manhattan'}. Best is trial 1 with value: 0.606060606060606.
[32m[I 2023-04-26 02:21:35,467][39m Trial 2 finished with value: 0.6122448979591836 and parameters: {'algorithm': 'kd_tree', 'n_neighbors': 22, 'weights': 'distance', 'metric': 'manhattan'}. Best is trial 2 with value: 0.6122448979591836.
[32m[I 2023-04-26 02:21:35,474][39m Trial 3 finished with value: 0.5607476635514018 and parameters: {'algorithm': 'auto', 'n_neighbors': 17, 'weights': 'uniform', 'metric': 'minkowski'}. Best is trial 2 with value: 0.6122448979591836.
[32m[I 2023-04-26 02:21:35,479][39m Trial 4 finished with value: 0.6122448979591836 and parameters: {'algorithm': 'kd_tree', 'n_neighbors': 17, 'weights': 'distance', 'metric': 'minkowski'}. Best is trial 2 with value: 0.6122448979591836.
[32m[I 2023-04-26 02:21:35,483][39m Trial 5 finished with value: 0.5842696629213483 and parameters: {'algorithm': 'ball_tree', 'n_neighbors': 3, 'weights': 'distance', 'metric': 'manhattan'}. Best is trial 2 with value: 0.6122448979591836.
[32m[I 2023-04-26 02:21:35,499][39m Trial 6 finished with value: 0.5176470588235295 and parameters: {'algorithm': 'brute', 'n_neighbors': 6, 'weights': 'uniform', 'metric': 'manhattan'}. Best is trial 2 with value: 0.6122448979591836.
[32m[I 2023-04-26 02:21:35,506][39m Trial 7 finished with value: 0.5225225225225225 and parameters: {'algorithm': 'auto', 'n_neighbors': 26, 'weights': 'uniform', 'metric': 'euclidean'}. Best is trial 2 with value: 0.6122448979591836.
[32m[I 2023-04-26 02:21:35,511][39m Trial 8 finished with value: 0.58 and parameters: {'algorithm': 'auto', 'n_neighbors': 12, 'weights': 'uniform', 'metric': 'euclidean'}. Best is trial 2 with value: 0.6122448979591836.
[32m[I 2023-04-26 02:21:35,515][39m Trial 9 finished with value: 0.6458333333333333 and parameters: {'algorithm': 'kd_tree', 'n_neighbors': 16, 'weights': 'distance', 'metric': 'manhattan'}. Best is trial 9 with value: 0.6458333333333333.
[32m[I 2023-04-26 02:21:35,522][39m Trial 10 finished with value: 0.6122448979591836 and parameters: {'algorithm': 'ball_tree', 'n_neighbors': 10, 'weights': 'distance', 'metric': 'euclidean'}. Best is trial 9 with value: 0.6458333333333333.
[32m[I 2023-04-26 02:21:35,530][39m Trial 11 finished with value: 0.6249999999999999 and parameters: {'algorithm': 'kd_tree', 'n_neighbors': 21, 'weights': 'distance', 'metric': 'manhattan'}. Best is trial 9 with value: 0.6458333333333333.
[32m[I 2023-04-26 02:21:35,536][39m Trial 12 finished with value: 0.6249999999999999 and parameters: {'algorithm': 'kd_tree', 'n_neighbors': 21, 'weights': 'distance', 'metric': 'manhattan'}. Best is trial 9 with value: 0.6458333333333333.
[32m[I 2023-04-26 02:21:35,543][39m Trial 13 finished with value: 0.6526315789473683 and parameters: {'algorithm': 'kd_tree', 'n_neighbors': 13, 'weights': 'distance', 'metric': 'manhattan'}. Best is trial 13 with value: 0.6526315789473683.
[32m[I 2023-04-26 02:21:35,550][39m Trial 14 finished with value: 0.5979381443298969 and parameters: {'algorithm': 'kd_tree', 'n_neighbors': 12, 'weights': 'distance', 'metric': 'minkowski'}. Best is trial 13 with value: 0.6526315789473683.
[32m[I 2023-04-26 02:21:35,557][39m Trial 15 finished with value: 0.6526315789473683 and parameters: {'algorithm': 'kd_tree', 'n_neighbors': 9, 'weights': 'distance', 'metric': 'manhattan'}. Best is trial 13 with value: 0.6526315789473683.
[32m[I 2023-04-26 02:21:35,569][39m Trial 16 finished with value: 0.6153846153846154 and parameters: {'algorithm': 'kd_tree', 'n_neighbors': 8, 'weights': 'distance', 'metric': 'manhattan'}. Best is trial 13 with value: 0.6526315789473683.
[32m[I 2023-04-26 02:21:35,578][39m Trial 17 finished with value: 0.6046511627906976 and parameters: {'algorithm': 'ball_tree', 'n_neighbors': 1, 'weights': 'distance', 'metric': 'manhattan'}. Best is trial 13 with value: 0.6526315789473683.
[32m[I 2023-04-26 02:21:35,620][39m Trial 18 finished with value: 0.5393258426966292 and parameters: {'algorithm': 'brute', 'n_neighbors': 5, 'weights': 'distance', 'metric': 'euclidean'}. Best is trial 13 with value: 0.6526315789473683.
[32m[I 2023-04-26 02:21:35,632][39m Trial 19 finished with value: 0.6041666666666666 and parameters: {'algorithm': 'kd_tree', 'n_neighbors': 13, 'weights': 'distance', 'metric': 'minkowski'}. Best is trial 13 with value: 0.6526315789473683.
[32m[I 2023-04-26 02:21:35,643][39m Trial 20 finished with value: 0.6153846153846154 and parameters: {'algorithm': 'kd_tree', 'n_neighbors': 8, 'weights': 'distance', 'metric': 'manhattan'}. Best is trial 13 with value: 0.6526315789473683.
[32m[I 2023-04-26 02:21:35,655][39m Trial 21 finished with value: 0.6458333333333333 and parameters: {'algorithm': 'kd_tree', 'n_neighbors': 15, 'weights': 'distance', 'metric': 'manhattan'}. Best is trial 13 with value: 0.6526315789473683.
[32m[I 2023-04-26 02:21:35,667][39m Trial 22 finished with value: 0.6458333333333333 and parameters: {'algorithm': 'kd_tree', 'n_neighbors': 14, 'weights': 'distance', 'metric': 'manhattan'}. Best is trial 13 with value: 0.6526315789473683.
[32m[I 2023-04-26 02:21:35,679][39m Trial 23 finished with value: 0.6526315789473683 and parameters: {'algorithm': 'kd_tree', 'n_neighbors': 9, 'weights': 'distance', 'metric': 'manhattan'}. Best is trial 13 with value: 0.6526315789473683.
[32m[I 2023-04-26 02:21:35,691][39m Trial 24 finished with value: 0.6526315789473683 and parameters: {'algorithm': 'kd_tree', 'n_neighbors': 9, 'weights': 'distance', 'metric': 'manhattan'}. Best is trial 13 with value: 0.6526315789473683.
[32m[I 2023-04-26 02:21:35,702][39m Trial 25 finished with value: 0.6222222222222223 and parameters: {'algorithm': 'kd_tree', 'n_neighbors': 5, 'weights': 'distance', 'metric': 'manhattan'}. Best is trial 13 with value: 0.6526315789473683.
[32m[I 2023-04-26 02:21:35,716][39m Trial 26 finished with value: 0.6168224299065421 and parameters: {'algorithm': 'ball_tree', 'n_neighbors': 11, 'weights': 'uniform', 'metric': 'manhattan'}. Best is trial 13 with value: 0.6526315789473683.
[32m[I 2023-04-26 02:21:35,728][39m Trial 27 finished with value: 0.606060606060606 and parameters: {'algorithm': 'auto', 'n_neighbors': 30, 'weights': 'distance', 'metric': 'manhattan'}. Best is trial 13 with value: 0.6526315789473683.
[32m[I 2023-04-26 02:21:35,736][39m Trial 28 finished with value: 0.5684210526315789 and parameters: {'algorithm': 'kd_tree', 'n_neighbors': 19, 'weights': 'distance', 'metric': 'minkowski'}. Best is trial 13 with value: 0.6526315789473683.
[32m[I 2023-04-26 02:21:35,756][39m Trial 29 finished with value: 0.5740740740740741 and parameters: {'algorithm': 'brute', 'n_neighbors': 7, 'weights': 'uniform', 'metric': 'euclidean'}. Best is trial 13 with value: 0.6526315789473683.
[32m[I 2023-04-26 02:21:35,777][39m Trial 30 finished with value: 0.6526315789473683 and parameters: {'algorithm': 'brute', 'n_neighbors': 9, 'weights': 'distance', 'metric': 'manhattan'}. Best is trial 13 with value: 0.6526315789473683.
[32m[I 2023-04-26 02:21:35,791][39m Trial 31 finished with value: 0.6304347826086957 and parameters: {'algorithm': 'kd_tree', 'n_neighbors': 10, 'weights': 'distance', 'metric': 'manhattan'}. Best is trial 13 with value: 0.6526315789473683.
[32m[I 2023-04-26 02:21:35,820][39m Trial 32 finished with value: 0.6526315789473683 and parameters: {'algorithm': 'brute', 'n_neighbors': 9, 'weights': 'distance', 'metric': 'manhattan'}. Best is trial 13 with value: 0.6526315789473683.
[32m[I 2023-04-26 02:21:35,848][39m Trial 33 finished with value: 0.5647058823529411 and parameters: {'algorithm': 'brute', 'n_neighbors': 4, 'weights': 'distance', 'metric': 'manhattan'}. Best is trial 13 with value: 0.6526315789473683.
[32m[I 2023-04-26 02:21:35,875][39m Trial 34 finished with value: 0.6458333333333333 and parameters: {'algorithm': 'brute', 'n_neighbors': 14, 'weights': 'distance', 'metric': 'manhattan'}. Best is trial 13 with value: 0.6526315789473683.
[32m[I 2023-04-26 02:21:35,901][39m Trial 35 finished with value: 0.6046511627906976 and parameters: {'algorithm': 'brute', 'n_neighbors': 1, 'weights': 'distance', 'metric': 'manhattan'}. Best is trial 13 with value: 0.6526315789473683.
[32m[I 2023-04-26 02:21:35,928][39m Trial 36 finished with value: 0.6373626373626374 and parameters: {'algorithm': 'brute', 'n_neighbors': 7, 'weights': 'distance', 'metric': 'manhattan'}. Best is trial 13 with value: 0.6526315789473683.
[32m[I 2023-04-26 02:21:35,950][39m Trial 37 finished with value: 0.5274725274725274 and parameters: {'algorithm': 'brute', 'n_neighbors': 3, 'weights': 'uniform', 'metric': 'minkowski'}. Best is trial 13 with value: 0.6526315789473683.
[32m[I 2023-04-26 02:21:35,961][39m Trial 38 finished with value: 0.6526315789473683 and parameters: {'algorithm': 'auto', 'n_neighbors': 9, 'weights': 'distance', 'metric': 'manhattan'}. Best is trial 13 with value: 0.6526315789473683.
[32m[I 2023-04-26 02:21:35,968][39m Trial 39 finished with value: 0.6526315789473683 and parameters: {'algorithm': 'auto', 'n_neighbors': 11, 'weights': 'distance', 'metric': 'manhattan'}. Best is trial 13 with value: 0.6526315789473683.
[32m[I 2023-04-26 02:21:35,976][39m Trial 40 finished with value: 0.6168224299065421 and parameters: {'algorithm': 'auto', 'n_neighbors': 11, 'weights': 'uniform', 'metric': 'manhattan'}. Best is trial 13 with value: 0.6526315789473683.
[32m[I 2023-04-26 02:21:35,983][39m Trial 41 finished with value: 0.6373626373626374 and parameters: {'algorithm': 'auto', 'n_neighbors': 7, 'weights': 'distance', 'metric': 'manhattan'}. Best is trial 13 with value: 0.6526315789473683.
[32m[I 2023-04-26 02:21:35,990][39m Trial 42 finished with value: 0.6304347826086957 and parameters: {'algorithm': 'auto', 'n_neighbors': 10, 'weights': 'distance', 'metric': 'manhattan'}. Best is trial 13 with value: 0.6526315789473683.
[32m[I 2023-04-26 02:21:35,997][39m Trial 43 finished with value: 0.6153846153846154 and parameters: {'algorithm': 'auto', 'n_neighbors': 6, 'weights': 'distance', 'metric': 'manhattan'}. Best is trial 13 with value: 0.6526315789473683.
[32m[I 2023-04-26 02:21:36,003][39m Trial 44 finished with value: 0.6122448979591836 and parameters: {'algorithm': 'auto', 'n_neighbors': 9, 'weights': 'distance', 'metric': 'euclidean'}. Best is trial 13 with value: 0.6526315789473683.
[32m[I 2023-04-26 02:21:36,010][39m Trial 45 finished with value: 0.6249999999999999 and parameters: {'algorithm': 'auto', 'n_neighbors': 17, 'weights': 'distance', 'metric': 'manhattan'}. Best is trial 13 with value: 0.6526315789473683.
[32m[I 2023-04-26 02:21:36,033][39m Trial 46 finished with value: 0.6526315789473683 and parameters: {'algorithm': 'brute', 'n_neighbors': 13, 'weights': 'distance', 'metric': 'manhattan'}. Best is trial 13 with value: 0.6526315789473683.
[32m[I 2023-04-26 02:21:36,045][39m Trial 47 finished with value: 0.6526315789473683 and parameters: {'algorithm': 'auto', 'n_neighbors': 11, 'weights': 'distance', 'metric': 'manhattan'}. Best is trial 13 with value: 0.6526315789473683.
[32m[I 2023-04-26 02:21:36,071][39m Trial 48 finished with value: 0.5360824742268041 and parameters: {'algorithm': 'brute', 'n_neighbors': 8, 'weights': 'uniform', 'metric': 'minkowski'}. Best is trial 13 with value: 0.6526315789473683.
[32m[I 2023-04-26 02:21:36,079][39m Trial 49 finished with value: 0.6391752577319588 and parameters: {'algorithm': 'ball_tree', 'n_neighbors': 12, 'weights': 'distance', 'metric': 'manhattan'}. Best is trial 13 with value: 0.6526315789473683.
[32m[I 2023-04-26 02:21:36,086][39m Trial 50 finished with value: 0.6249999999999999 and parameters: {'algorithm': 'auto', 'n_neighbors': 16, 'weights': 'distance', 'metric': 'euclidean'}. Best is trial 13 with value: 0.6526315789473683.
[32m[I 2023-04-26 02:21:36,108][39m Trial 51 finished with value: 0.6526315789473683 and parameters: {'algorithm': 'brute', 'n_neighbors': 11, 'weights': 'distance', 'metric': 'manhattan'}. Best is trial 13 with value: 0.6526315789473683.
[32m[I 2023-04-26 02:21:36,137][39m Trial 52 finished with value: 0.6526315789473683 and parameters: {'algorithm': 'brute', 'n_neighbors': 13, 'weights': 'distance', 'metric': 'manhattan'}. Best is trial 13 with value: 0.6526315789473683.
[32m[I 2023-04-26 02:21:36,166][39m Trial 53 finished with value: 0.6526315789473683 and parameters: {'algorithm': 'brute', 'n_neighbors': 9, 'weights': 'distance', 'metric': 'manhattan'}. Best is trial 13 with value: 0.6526315789473683.
[32m[I 2023-04-26 02:21:36,179][39m Trial 54 finished with value: 0.6526315789473683 and parameters: {'algorithm': 'kd_tree', 'n_neighbors': 9, 'weights': 'distance', 'metric': 'manhattan'}. Best is trial 13 with value: 0.6526315789473683.
[32m[I 2023-04-26 02:21:36,208][39m Trial 55 finished with value: 0.6391752577319588 and parameters: {'algorithm': 'brute', 'n_neighbors': 12, 'weights': 'distance', 'metric': 'manhattan'}. Best is trial 13 with value: 0.6526315789473683.
[32m[I 2023-04-26 02:21:36,221][39m Trial 56 finished with value: 0.6458333333333333 and parameters: {'algorithm': 'kd_tree', 'n_neighbors': 14, 'weights': 'distance', 'metric': 'manhattan'}. Best is trial 13 with value: 0.6526315789473683.
[32m[I 2023-04-26 02:21:36,234][39m Trial 57 finished with value: 0.6153846153846154 and parameters: {'algorithm': 'auto', 'n_neighbors': 6, 'weights': 'distance', 'metric': 'manhattan'}. Best is trial 13 with value: 0.6526315789473683.
[32m[I 2023-04-26 02:21:36,246][39m Trial 58 finished with value: 0.5979381443298969 and parameters: {'algorithm': 'kd_tree', 'n_neighbors': 18, 'weights': 'distance', 'metric': 'minkowski'}. Best is trial 13 with value: 0.6526315789473683.
[32m[I 2023-04-26 02:21:36,264][39m Trial 59 finished with value: 0.5818181818181818 and parameters: {'algorithm': 'kd_tree', 'n_neighbors': 15, 'weights': 'uniform', 'metric': 'manhattan'}. Best is trial 13 with value: 0.6526315789473683.
[32m[I 2023-04-26 02:21:36,278][39m Trial 60 finished with value: 0.5777777777777778 and parameters: {'algorithm': 'kd_tree', 'n_neighbors': 3, 'weights': 'distance', 'metric': 'euclidean'}. Best is trial 13 with value: 0.6526315789473683.
[32m[I 2023-04-26 02:21:36,306][39m Trial 61 finished with value: 0.6526315789473683 and parameters: {'algorithm': 'brute', 'n_neighbors': 11, 'weights': 'distance', 'metric': 'manhattan'}. Best is trial 13 with value: 0.6526315789473683.
[32m[I 2023-04-26 02:21:36,333][39m Trial 62 finished with value: 0.6526315789473683 and parameters: {'algorithm': 'brute', 'n_neighbors': 13, 'weights': 'distance', 'metric': 'manhattan'}. Best is trial 13 with value: 0.6526315789473683.
[32m[I 2023-04-26 02:21:36,346][39m Trial 63 finished with value: 0.6304347826086957 and parameters: {'algorithm': 'ball_tree', 'n_neighbors': 10, 'weights': 'distance', 'metric': 'manhattan'}. Best is trial 13 with value: 0.6526315789473683.
[32m[I 2023-04-26 02:21:36,359][39m Trial 64 finished with value: 0.6222222222222223 and parameters: {'algorithm': 'kd_tree', 'n_neighbors': 5, 'weights': 'distance', 'metric': 'manhattan'}. Best is trial 13 with value: 0.6526315789473683.
[32m[I 2023-04-26 02:21:36,373][39m Trial 65 finished with value: 0.6153846153846154 and parameters: {'algorithm': 'auto', 'n_neighbors': 8, 'weights': 'distance', 'metric': 'manhattan'}. Best is trial 13 with value: 0.6526315789473683.
[32m[I 2023-04-26 02:21:36,402][39m Trial 66 finished with value: 0.6373626373626374 and parameters: {'algorithm': 'brute', 'n_neighbors': 7, 'weights': 'distance', 'metric': 'manhattan'}. Best is trial 13 with value: 0.6526315789473683.
[32m[I 2023-04-26 02:21:36,416][39m Trial 67 finished with value: 0.6185567010309277 and parameters: {'algorithm': 'kd_tree', 'n_neighbors': 24, 'weights': 'distance', 'metric': 'manhattan'}. Best is trial 13 with value: 0.6526315789473683.
[32m[I 2023-04-26 02:21:36,430][39m Trial 68 finished with value: 0.6526315789473683 and parameters: {'algorithm': 'kd_tree', 'n_neighbors': 13, 'weights': 'distance', 'metric': 'manhattan'}. Best is trial 13 with value: 0.6526315789473683.
[32m[I 2023-04-26 02:21:36,444][39m Trial 69 finished with value: 0.6122448979591836 and parameters: {'algorithm': 'kd_tree', 'n_neighbors': 10, 'weights': 'distance', 'metric': 'minkowski'}. Best is trial 13 with value: 0.6526315789473683.
[32m[I 2023-04-26 02:21:36,458][39m Trial 70 finished with value: 0.6391752577319588 and parameters: {'algorithm': 'kd_tree', 'n_neighbors': 12, 'weights': 'distance', 'metric': 'manhattan'}. Best is trial 13 with value: 0.6526315789473683.
[32m[I 2023-04-26 02:21:36,485][39m Trial 71 finished with value: 0.6526315789473683 and parameters: {'algorithm': 'brute', 'n_neighbors': 11, 'weights': 'distance', 'metric': 'manhattan'}. Best is trial 13 with value: 0.6526315789473683.
[32m[I 2023-04-26 02:21:36,499][39m Trial 72 finished with value: 0.6526315789473683 and parameters: {'algorithm': 'auto', 'n_neighbors': 11, 'weights': 'distance', 'metric': 'manhattan'}. Best is trial 13 with value: 0.6526315789473683.
[32m[I 2023-04-26 02:21:36,513][39m Trial 73 finished with value: 0.6526315789473683 and parameters: {'algorithm': 'auto', 'n_neighbors': 11, 'weights': 'distance', 'metric': 'manhattan'}. Best is trial 13 with value: 0.6526315789473683.
[32m[I 2023-04-26 02:21:36,527][39m Trial 74 finished with value: 0.6458333333333333 and parameters: {'algorithm': 'auto', 'n_neighbors': 14, 'weights': 'distance', 'metric': 'manhattan'}. Best is trial 13 with value: 0.6526315789473683.
[32m[I 2023-04-26 02:21:36,541][39m Trial 75 finished with value: 0.6526315789473683 and parameters: {'algorithm': 'auto', 'n_neighbors': 13, 'weights': 'distance', 'metric': 'manhattan'}. Best is trial 13 with value: 0.6526315789473683.
[32m[I 2023-04-26 02:21:36,569][39m Trial 76 finished with value: 0.6526315789473683 and parameters: {'algorithm': 'brute', 'n_neighbors': 13, 'weights': 'distance', 'metric': 'manhattan'}. Best is trial 13 with value: 0.6526315789473683.
[32m[I 2023-04-26 02:21:36,587][39m Trial 77 finished with value: 0.5818181818181818 and parameters: {'algorithm': 'auto', 'n_neighbors': 15, 'weights': 'uniform', 'metric': 'manhattan'}. Best is trial 13 with value: 0.6526315789473683.
[32m[I 2023-04-26 02:21:36,615][39m Trial 78 finished with value: 0.6122448979591836 and parameters: {'algorithm': 'brute', 'n_neighbors': 9, 'weights': 'distance', 'metric': 'euclidean'}. Best is trial 13 with value: 0.6526315789473683.
[32m[I 2023-04-26 02:21:36,642][39m Trial 79 finished with value: 0.6153846153846154 and parameters: {'algorithm': 'brute', 'n_neighbors': 8, 'weights': 'distance', 'metric': 'manhattan'}. Best is trial 13 with value: 0.6526315789473683.
[32m[I 2023-04-26 02:21:36,671][39m Trial 80 finished with value: 0.6526315789473683 and parameters: {'algorithm': 'brute', 'n_neighbors': 9, 'weights': 'distance', 'metric': 'manhattan'}. Best is trial 13 with value: 0.6526315789473683.
[32m[I 2023-04-26 02:21:36,698][39m Trial 81 finished with value: 0.6526315789473683 and parameters: {'algorithm': 'brute', 'n_neighbors': 9, 'weights': 'distance', 'metric': 'manhattan'}. Best is trial 13 with value: 0.6526315789473683.
[32m[I 2023-04-26 02:21:36,727][39m Trial 82 finished with value: 0.6391752577319588 and parameters: {'algorithm': 'brute', 'n_neighbors': 12, 'weights': 'distance', 'metric': 'manhattan'}. Best is trial 13 with value: 0.6526315789473683.
[32m[I 2023-04-26 02:21:36,739][39m Trial 83 finished with value: 0.6304347826086957 and parameters: {'algorithm': 'ball_tree', 'n_neighbors': 10, 'weights': 'distance', 'metric': 'manhattan'}. Best is trial 13 with value: 0.6526315789473683.
[32m[I 2023-04-26 02:21:36,768][39m Trial 84 finished with value: 0.6153846153846154 and parameters: {'algorithm': 'brute', 'n_neighbors': 6, 'weights': 'distance', 'metric': 'manhattan'}. Best is trial 13 with value: 0.6526315789473683.
[32m[I 2023-04-26 02:21:36,797][39m Trial 85 finished with value: 0.6153846153846154 and parameters: {'algorithm': 'brute', 'n_neighbors': 8, 'weights': 'distance', 'metric': 'manhattan'}. Best is trial 13 with value: 0.6526315789473683.
[32m[I 2023-04-26 02:21:36,826][39m Trial 86 finished with value: 0.6304347826086957 and parameters: {'algorithm': 'brute', 'n_neighbors': 10, 'weights': 'distance', 'metric': 'manhattan'}. Best is trial 13 with value: 0.6526315789473683.
[32m[I 2023-04-26 02:21:36,844][39m Trial 87 finished with value: 0.6037735849056605 and parameters: {'algorithm': 'kd_tree', 'n_neighbors': 7, 'weights': 'uniform', 'metric': 'manhattan'}. Best is trial 13 with value: 0.6526315789473683.
[32m[I 2023-04-26 02:21:36,873][39m Trial 88 finished with value: 0.6526315789473683 and parameters: {'algorithm': 'brute', 'n_neighbors': 11, 'weights': 'distance', 'metric': 'manhattan'}. Best is trial 13 with value: 0.6526315789473683.
[32m[I 2023-04-26 02:21:36,887][39m Trial 89 finished with value: 0.6391752577319588 and parameters: {'algorithm': 'kd_tree', 'n_neighbors': 12, 'weights': 'distance', 'metric': 'manhattan'}. Best is trial 13 with value: 0.6526315789473683.
