[32m[I 2023-04-26 02:21:36,903][39m Trial 90 finished with value: 0.6041666666666666 and parameters: {'algorithm': 'auto', 'n_neighbors': 13, 'weights': 'distance', 'metric': 'minkowski'}. Best is trial 13 with value: 0.6526315789473683.
[32m[I 2023-04-26 02:21:36,937][39m Trial 91 finished with value: 0.6526315789473683 and parameters: {'algorithm': 'brute', 'n_neighbors': 9, 'weights': 'distance', 'metric': 'manhattan'}. Best is trial 13 with value: 0.6526315789473683.
[32m[I 2023-04-26 02:21:36,968][39m Trial 92 finished with value: 0.6304347826086957 and parameters: {'algorithm': 'brute', 'n_neighbors': 10, 'weights': 'distance', 'metric': 'manhattan'}. Best is trial 13 with value: 0.6526315789473683.
[32m[I 2023-04-26 02:21:36,998][39m Trial 93 finished with value: 0.6458333333333333 and parameters: {'algorithm': 'brute', 'n_neighbors': 14, 'weights': 'distance', 'metric': 'manhattan'}. Best is trial 13 with value: 0.6526315789473683.
[32m[I 2023-04-26 02:21:37,013][39m Trial 94 finished with value: 0.6526315789473683 and parameters: {'algorithm': 'auto', 'n_neighbors': 11, 'weights': 'distance', 'metric': 'manhattan'}. Best is trial 13 with value: 0.6526315789473683.
[32m[I 2023-04-26 02:21:37,045][39m Trial 95 finished with value: 0.6458333333333333 and parameters: {'algorithm': 'brute', 'n_neighbors': 16, 'weights': 'distance', 'metric': 'manhattan'}. Best is trial 13 with value: 0.6526315789473683.
[32m[I 2023-04-26 02:21:37,059][39m Trial 96 finished with value: 0.6185567010309277 and parameters: {'algorithm': 'auto', 'n_neighbors': 11, 'weights': 'distance', 'metric': 'euclidean'}. Best is trial 13 with value: 0.6526315789473683.
[32m[I 2023-04-26 02:21:37,090][39m Trial 97 finished with value: 0.6153846153846154 and parameters: {'algorithm': 'brute', 'n_neighbors': 8, 'weights': 'distance', 'metric': 'manhattan'}. Best is trial 13 with value: 0.6526315789473683.
[32m[I 2023-04-26 02:21:37,104][39m Trial 98 finished with value: 0.6526315789473683 and parameters: {'algorithm': 'kd_tree', 'n_neighbors': 13, 'weights': 'distance', 'metric': 'manhattan'}. Best is trial 13 with value: 0.6526315789473683.
[32m[I 2023-04-26 02:21:37,120][39m Trial 99 finished with value: 0.6391752577319588 and parameters: {'algorithm': 'kd_tree', 'n_neighbors': 12, 'weights': 'distance', 'metric': 'manhattan'}. Best is trial 13 with value: 0.6526315789473683.
[32m[I 2023-04-26 02:21:37,134][39m Trial 100 finished with value: 0.6304347826086957 and parameters: {'algorithm': 'kd_tree', 'n_neighbors': 10, 'weights': 'distance', 'metric': 'manhattan'}. Best is trial 13 with value: 0.6526315789473683.
[32m[I 2023-04-26 02:21:37,150][39m Trial 101 finished with value: 0.6304347826086957 and parameters: {'algorithm': 'ball_tree', 'n_neighbors': 10, 'weights': 'distance', 'metric': 'manhattan'}. Best is trial 13 with value: 0.6526315789473683.
[32m[I 2023-04-26 02:21:37,165][39m Trial 102 finished with value: 0.6526315789473683 and parameters: {'algorithm': 'auto', 'n_neighbors': 11, 'weights': 'distance', 'metric': 'manhattan'}. Best is trial 13 with value: 0.6526315789473683.
[32m[I 2023-04-26 02:21:37,194][39m Trial 103 finished with value: 0.6458333333333333 and parameters: {'algorithm': 'brute', 'n_neighbors': 14, 'weights': 'distance', 'metric': 'manhattan'}. Best is trial 13 with value: 0.6526315789473683.
[32m[I 2023-04-26 02:21:37,209][39m Trial 104 finished with value: 0.6373626373626374 and parameters: {'algorithm': 'auto', 'n_neighbors': 7, 'weights': 'distance', 'metric': 'manhattan'}. Best is trial 13 with value: 0.6526315789473683.
[32m[I 2023-04-26 02:21:37,224][39m Trial 105 finished with value: 0.6391752577319588 and parameters: {'algorithm': 'kd_tree', 'n_neighbors': 12, 'weights': 'distance', 'metric': 'manhattan'}. Best is trial 13 with value: 0.6526315789473683.
[32m[I 2023-04-26 02:21:37,250][39m Trial 106 finished with value: 0.6168224299065421 and parameters: {'algorithm': 'brute', 'n_neighbors': 11, 'weights': 'uniform', 'metric': 'manhattan'}. Best is trial 13 with value: 0.6526315789473683.
[32m[I 2023-04-26 02:21:37,259][39m Trial 107 finished with value: 0.6526315789473683 and parameters: {'algorithm': 'auto', 'n_neighbors': 9, 'weights': 'distance', 'metric': 'manhattan'}. Best is trial 13 with value: 0.6526315789473683.
[32m[I 2023-04-26 02:21:37,287][39m Trial 108 finished with value: 0.6041666666666666 and parameters: {'algorithm': 'brute', 'n_neighbors': 13, 'weights': 'distance', 'metric': 'minkowski'}. Best is trial 13 with value: 0.6526315789473683.
[32m[I 2023-04-26 02:21:37,302][39m Trial 109 finished with value: 0.6122448979591836 and parameters: {'algorithm': 'auto', 'n_neighbors': 29, 'weights': 'distance', 'metric': 'manhattan'}. Best is trial 13 with value: 0.6526315789473683.
[32m[I 2023-04-26 02:21:37,330][39m Trial 110 finished with value: 0.6526315789473683 and parameters: {'algorithm': 'brute', 'n_neighbors': 11, 'weights': 'distance', 'metric': 'manhattan'}. Best is trial 13 with value: 0.6526315789473683.
[32m[I 2023-04-26 02:21:37,345][39m Trial 111 finished with value: 0.6153846153846154 and parameters: {'algorithm': 'kd_tree', 'n_neighbors': 8, 'weights': 'distance', 'metric': 'manhattan'}. Best is trial 13 with value: 0.6526315789473683.
[32m[I 2023-04-26 02:21:37,375][39m Trial 112 finished with value: 0.6526315789473683 and parameters: {'algorithm': 'brute', 'n_neighbors': 9, 'weights': 'distance', 'metric': 'manhattan'}. Best is trial 13 with value: 0.6526315789473683.
[32m[I 2023-04-26 02:21:37,403][39m Trial 113 finished with value: 0.6458333333333333 and parameters: {'algorithm': 'brute', 'n_neighbors': 15, 'weights': 'distance', 'metric': 'manhattan'}. Best is trial 13 with value: 0.6526315789473683.
[32m[I 2023-04-26 02:21:37,433][39m Trial 114 finished with value: 0.6153846153846154 and parameters: {'algorithm': 'brute', 'n_neighbors': 8, 'weights': 'distance', 'metric': 'manhattan'}. Best is trial 13 with value: 0.6526315789473683.
[32m[I 2023-04-26 02:21:37,448][39m Trial 115 finished with value: 0.6391752577319588 and parameters: {'algorithm': 'auto', 'n_neighbors': 12, 'weights': 'distance', 'metric': 'manhattan'}. Best is trial 13 with value: 0.6526315789473683.
[32m[I 2023-04-26 02:21:37,478][39m Trial 116 finished with value: 0.6122448979591836 and parameters: {'algorithm': 'brute', 'n_neighbors': 9, 'weights': 'distance', 'metric': 'euclidean'}. Best is trial 13 with value: 0.6526315789473683.
[32m[I 2023-04-26 02:21:37,493][39m Trial 117 finished with value: 0.6153846153846154 and parameters: {'algorithm': 'ball_tree', 'n_neighbors': 6, 'weights': 'distance', 'metric': 'manhattan'}. Best is trial 13 with value: 0.6526315789473683.
[32m[I 2023-04-26 02:21:37,508][39m Trial 118 finished with value: 0.6304347826086957 and parameters: {'algorithm': 'auto', 'n_neighbors': 10, 'weights': 'distance', 'metric': 'manhattan'}. Best is trial 13 with value: 0.6526315789473683.
[32m[I 2023-04-26 02:21:37,522][39m Trial 119 finished with value: 0.6526315789473683 and parameters: {'algorithm': 'auto', 'n_neighbors': 13, 'weights': 'distance', 'metric': 'manhattan'}. Best is trial 13 with value: 0.6526315789473683.
[32m[I 2023-04-26 02:21:37,538][39m Trial 120 finished with value: 0.6304347826086957 and parameters: {'algorithm': 'auto', 'n_neighbors': 10, 'weights': 'distance', 'metric': 'manhattan'}. Best is trial 13 with value: 0.6526315789473683.
[32m[I 2023-04-26 02:21:37,568][39m Trial 121 finished with value: 0.6526315789473683 and parameters: {'algorithm': 'brute', 'n_neighbors': 9, 'weights': 'distance', 'metric': 'manhattan'}. Best is trial 13 with value: 0.6526315789473683.
[32m[I 2023-04-26 02:21:37,597][39m Trial 122 finished with value: 0.6458333333333333 and parameters: {'algorithm': 'brute', 'n_neighbors': 14, 'weights': 'distance', 'metric': 'manhattan'}. Best is trial 13 with value: 0.6526315789473683.
[32m[I 2023-04-26 02:21:37,611][39m Trial 123 finished with value: 0.6373626373626374 and parameters: {'algorithm': 'kd_tree', 'n_neighbors': 7, 'weights': 'distance', 'metric': 'manhattan'}. Best is trial 13 with value: 0.6526315789473683.
[32m[I 2023-04-26 02:21:37,627][39m Trial 124 finished with value: 0.6526315789473683 and parameters: {'algorithm': 'auto', 'n_neighbors': 9, 'weights': 'distance', 'metric': 'manhattan'}. Best is trial 13 with value: 0.6526315789473683.
[32m[I 2023-04-26 02:21:37,658][39m Trial 125 finished with value: 0.6526315789473683 and parameters: {'algorithm': 'brute', 'n_neighbors': 13, 'weights': 'distance', 'metric': 'manhattan'}. Best is trial 13 with value: 0.6526315789473683.
[32m[I 2023-04-26 02:21:37,684][39m Trial 126 finished with value: 0.6078431372549019 and parameters: {'algorithm': 'brute', 'n_neighbors': 12, 'weights': 'uniform', 'metric': 'manhattan'}. Best is trial 13 with value: 0.6526315789473683.
[32m[I 2023-04-26 02:21:37,705][39m Trial 127 finished with value: 0.6153846153846154 and parameters: {'algorithm': 'brute', 'n_neighbors': 8, 'weights': 'distance', 'metric': 'manhattan'}. Best is trial 13 with value: 0.6526315789473683.
[32m[I 2023-04-26 02:21:37,720][39m Trial 128 finished with value: 0.6526315789473683 and parameters: {'algorithm': 'auto', 'n_neighbors': 11, 'weights': 'distance', 'metric': 'manhattan'}. Best is trial 13 with value: 0.6526315789473683.
[32m[I 2023-04-26 02:21:37,736][39m Trial 129 finished with value: 0.6185567010309277 and parameters: {'algorithm': 'auto', 'n_neighbors': 11, 'weights': 'distance', 'metric': 'minkowski'}. Best is trial 13 with value: 0.6526315789473683.
[32m[I 2023-04-26 02:21:37,766][39m Trial 130 finished with value: 0.6122448979591836 and parameters: {'algorithm': 'brute', 'n_neighbors': 18, 'weights': 'distance', 'metric': 'manhattan'}. Best is trial 13 with value: 0.6526315789473683.
[32m[I 2023-04-26 02:21:37,782][39m Trial 131 finished with value: 0.6526315789473683 and parameters: {'algorithm': 'auto', 'n_neighbors': 11, 'weights': 'distance', 'metric': 'manhattan'}. Best is trial 13 with value: 0.6526315789473683.
[32m[I 2023-04-26 02:21:37,797][39m Trial 132 finished with value: 0.6304347826086957 and parameters: {'algorithm': 'auto', 'n_neighbors': 10, 'weights': 'distance', 'metric': 'manhattan'}. Best is trial 13 with value: 0.6526315789473683.
[32m[I 2023-04-26 02:21:37,813][39m Trial 133 finished with value: 0.6526315789473683 and parameters: {'algorithm': 'kd_tree', 'n_neighbors': 9, 'weights': 'distance', 'metric': 'manhattan'}. Best is trial 13 with value: 0.6526315789473683.
[32m[I 2023-04-26 02:21:37,844][39m Trial 134 finished with value: 0.6526315789473683 and parameters: {'algorithm': 'brute', 'n_neighbors': 9, 'weights': 'distance', 'metric': 'manhattan'}. Best is trial 13 with value: 0.6526315789473683.
[32m[I 2023-04-26 02:21:37,874][39m Trial 135 finished with value: 0.6526315789473683 and parameters: {'algorithm': 'brute', 'n_neighbors': 9, 'weights': 'distance', 'metric': 'manhattan'}. Best is trial 13 with value: 0.6526315789473683.
[32m[I 2023-04-26 02:21:37,889][39m Trial 136 finished with value: 0.6304347826086957 and parameters: {'algorithm': 'auto', 'n_neighbors': 10, 'weights': 'distance', 'metric': 'manhattan'}. Best is trial 13 with value: 0.6526315789473683.
[32m[I 2023-04-26 02:21:37,922][39m Trial 137 finished with value: 0.6391752577319588 and parameters: {'algorithm': 'brute', 'n_neighbors': 12, 'weights': 'distance', 'metric': 'manhattan'}. Best is trial 13 with value: 0.6526315789473683.
[32m[I 2023-04-26 02:21:37,953][39m Trial 138 finished with value: 0.6170212765957447 and parameters: {'algorithm': 'brute', 'n_neighbors': 14, 'weights': 'distance', 'metric': 'euclidean'}. Best is trial 13 with value: 0.6526315789473683.
[32m[I 2023-04-26 02:21:37,983][39m Trial 139 finished with value: 0.6526315789473683 and parameters: {'algorithm': 'brute', 'n_neighbors': 13, 'weights': 'distance', 'metric': 'manhattan'}. Best is trial 13 with value: 0.6526315789473683.
[32m[I 2023-04-26 02:21:38,012][39m Trial 140 finished with value: 0.6458333333333333 and parameters: {'algorithm': 'brute', 'n_neighbors': 15, 'weights': 'distance', 'metric': 'manhattan'}. Best is trial 13 with value: 0.6526315789473683.
[32m[I 2023-04-26 02:21:38,028][39m Trial 141 finished with value: 0.6526315789473683 and parameters: {'algorithm': 'auto', 'n_neighbors': 11, 'weights': 'distance', 'metric': 'manhattan'}. Best is trial 13 with value: 0.6526315789473683.
[32m[I 2023-04-26 02:21:38,044][39m Trial 142 finished with value: 0.6391752577319588 and parameters: {'algorithm': 'auto', 'n_neighbors': 12, 'weights': 'distance', 'metric': 'manhattan'}. Best is trial 13 with value: 0.6526315789473683.
[32m[I 2023-04-26 02:21:38,061][39m Trial 143 finished with value: 0.6526315789473683 and parameters: {'algorithm': 'auto', 'n_neighbors': 11, 'weights': 'distance', 'metric': 'manhattan'}. Best is trial 13 with value: 0.6526315789473683.
[32m[I 2023-04-26 02:21:38,096][39m Trial 144 finished with value: 0.6526315789473683 and parameters: {'algorithm': 'brute', 'n_neighbors': 13, 'weights': 'distance', 'metric': 'manhattan'}. Best is trial 13 with value: 0.6526315789473683.
[32m[I 2023-04-26 02:21:38,127][39m Trial 145 finished with value: 0.6391752577319588 and parameters: {'algorithm': 'brute', 'n_neighbors': 12, 'weights': 'distance', 'metric': 'manhattan'}. Best is trial 13 with value: 0.6526315789473683.
[32m[I 2023-04-26 02:21:38,143][39m Trial 146 finished with value: 0.6526315789473683 and parameters: {'algorithm': 'auto', 'n_neighbors': 11, 'weights': 'distance', 'metric': 'manhattan'}. Best is trial 13 with value: 0.6526315789473683.
[32m[I 2023-04-26 02:21:38,173][39m Trial 147 finished with value: 0.6526315789473683 and parameters: {'algorithm': 'brute', 'n_neighbors': 13, 'weights': 'distance', 'metric': 'manhattan'}. Best is trial 13 with value: 0.6526315789473683.
[32m[I 2023-04-26 02:21:38,200][39m Trial 148 finished with value: 0.5684210526315789 and parameters: {'algorithm': 'brute', 'n_neighbors': 10, 'weights': 'uniform', 'metric': 'manhattan'}. Best is trial 13 with value: 0.6526315789473683.
[32m[I 2023-04-26 02:21:38,208][39m Trial 149 finished with value: 0.6304347826086957 and parameters: {'algorithm': 'auto', 'n_neighbors': 10, 'weights': 'distance', 'metric': 'manhattan'}. Best is trial 13 with value: 0.6526315789473683.
[32m[I 2023-04-26 02:21:38,217][39m Trial 150 finished with value: 0.6153846153846154 and parameters: {'algorithm': 'auto', 'n_neighbors': 8, 'weights': 'distance', 'metric': 'manhattan'}. Best is trial 13 with value: 0.6526315789473683.
[32m[I 2023-04-26 02:21:38,225][39m Trial 151 finished with value: 0.6526315789473683 and parameters: {'algorithm': 'auto', 'n_neighbors': 13, 'weights': 'distance', 'metric': 'manhattan'}. Best is trial 13 with value: 0.6526315789473683.
[32m[I 2023-04-26 02:21:38,234][39m Trial 152 finished with value: 0.6458333333333333 and parameters: {'algorithm': 'kd_tree', 'n_neighbors': 14, 'weights': 'distance', 'metric': 'manhattan'}. Best is trial 13 with value: 0.6526315789473683.
[32m[I 2023-04-26 02:21:38,255][39m Trial 153 finished with value: 0.6391752577319588 and parameters: {'algorithm': 'brute', 'n_neighbors': 12, 'weights': 'distance', 'metric': 'manhattan'}. Best is trial 13 with value: 0.6526315789473683.
[32m[I 2023-04-26 02:21:38,286][39m Trial 154 finished with value: 0.6526315789473683 and parameters: {'algorithm': 'brute', 'n_neighbors': 9, 'weights': 'distance', 'metric': 'manhattan'}. Best is trial 13 with value: 0.6526315789473683.
[32m[I 2023-04-26 02:21:38,320][39m Trial 155 finished with value: 0.6458333333333333 and parameters: {'algorithm': 'brute', 'n_neighbors': 14, 'weights': 'distance', 'metric': 'manhattan'}. Best is trial 13 with value: 0.6526315789473683.
[32m[I 2023-04-26 02:21:38,354][39m Trial 156 finished with value: 0.6458333333333333 and parameters: {'algorithm': 'brute', 'n_neighbors': 16, 'weights': 'distance', 'metric': 'manhattan'}. Best is trial 13 with value: 0.6526315789473683.
[32m[I 2023-04-26 02:21:38,370][39m Trial 157 finished with value: 0.6153846153846154 and parameters: {'algorithm': 'ball_tree', 'n_neighbors': 8, 'weights': 'distance', 'metric': 'manhattan'}. Best is trial 13 with value: 0.6526315789473683.
[32m[I 2023-04-26 02:21:38,403][39m Trial 158 finished with value: 0.5918367346938775 and parameters: {'algorithm': 'brute', 'n_neighbors': 7, 'weights': 'distance', 'metric': 'minkowski'}. Best is trial 13 with value: 0.6526315789473683.
[32m[I 2023-04-26 02:21:38,419][39m Trial 159 finished with value: 0.6526315789473683 and parameters: {'algorithm': 'auto', 'n_neighbors': 9, 'weights': 'distance', 'metric': 'manhattan'}. Best is trial 13 with value: 0.6526315789473683.
[32m[I 2023-04-26 02:21:38,435][39m Trial 160 finished with value: 0.6304347826086957 and parameters: {'algorithm': 'kd_tree', 'n_neighbors': 10, 'weights': 'distance', 'metric': 'manhattan'}. Best is trial 13 with value: 0.6526315789473683.
[32m[I 2023-04-26 02:21:38,452][39m Trial 161 finished with value: 0.6526315789473683 and parameters: {'algorithm': 'auto', 'n_neighbors': 13, 'weights': 'distance', 'metric': 'manhattan'}. Best is trial 13 with value: 0.6526315789473683.
[32m[I 2023-04-26 02:21:38,485][39m Trial 162 finished with value: 0.6526315789473683 and parameters: {'algorithm': 'brute', 'n_neighbors': 11, 'weights': 'distance', 'metric': 'manhattan'}. Best is trial 13 with value: 0.6526315789473683.
[32m[I 2023-04-26 02:21:38,501][39m Trial 163 finished with value: 0.6391752577319588 and parameters: {'algorithm': 'kd_tree', 'n_neighbors': 12, 'weights': 'distance', 'metric': 'manhattan'}. Best is trial 13 with value: 0.6526315789473683.
[32m[I 2023-04-26 02:21:38,519][39m Trial 164 finished with value: 0.6526315789473683 and parameters: {'algorithm': 'auto', 'n_neighbors': 9, 'weights': 'distance', 'metric': 'manhattan'}. Best is trial 13 with value: 0.6526315789473683.
[32m[I 2023-04-26 02:21:38,535][39m Trial 165 finished with value: 0.6526315789473683 and parameters: {'algorithm': 'auto', 'n_neighbors': 11, 'weights': 'distance', 'metric': 'manhattan'}. Best is trial 13 with value: 0.6526315789473683.
[32m[I 2023-04-26 02:21:38,552][39m Trial 166 finished with value: 0.6304347826086957 and parameters: {'algorithm': 'auto', 'n_neighbors': 10, 'weights': 'distance', 'metric': 'manhattan'}. Best is trial 13 with value: 0.6526315789473683.
[32m[I 2023-04-26 02:21:38,568][39m Trial 167 finished with value: 0.6526315789473683 and parameters: {'algorithm': 'auto', 'n_neighbors': 11, 'weights': 'distance', 'metric': 'manhattan'}. Best is trial 13 with value: 0.6526315789473683.
[32m[I 2023-04-26 02:21:38,585][39m Trial 168 finished with value: 0.6526315789473683 and parameters: {'algorithm': 'auto', 'n_neighbors': 9, 'weights': 'distance', 'metric': 'manhattan'}. Best is trial 13 with value: 0.6526315789473683.
[32m[I 2023-04-26 02:21:38,611][39m Trial 169 finished with value: 0.6105263157894738 and parameters: {'algorithm': 'brute', 'n_neighbors': 15, 'weights': 'distance', 'metric': 'euclidean'}. Best is trial 13 with value: 0.6526315789473683.
[32m[I 2023-04-26 02:21:38,628][39m Trial 170 finished with value: 0.6526315789473683 and parameters: {'algorithm': 'auto', 'n_neighbors': 13, 'weights': 'distance', 'metric': 'manhattan'}. Best is trial 13 with value: 0.6526315789473683.
[32m[I 2023-04-26 02:21:38,645][39m Trial 171 finished with value: 0.6526315789473683 and parameters: {'algorithm': 'auto', 'n_neighbors': 13, 'weights': 'distance', 'metric': 'manhattan'}. Best is trial 13 with value: 0.6526315789473683.
[32m[I 2023-04-26 02:21:38,677][39m Trial 172 finished with value: 0.6391752577319588 and parameters: {'algorithm': 'brute', 'n_neighbors': 12, 'weights': 'distance', 'metric': 'manhattan'}. Best is trial 13 with value: 0.6526315789473683.
[32m[I 2023-04-26 02:21:38,694][39m Trial 173 finished with value: 0.6458333333333333 and parameters: {'algorithm': 'kd_tree', 'n_neighbors': 14, 'weights': 'distance', 'metric': 'manhattan'}. Best is trial 13 with value: 0.6526315789473683.
[32m[I 2023-04-26 02:21:38,710][39m Trial 174 finished with value: 0.6526315789473683 and parameters: {'algorithm': 'auto', 'n_neighbors': 11, 'weights': 'distance', 'metric': 'manhattan'}. Best is trial 13 with value: 0.6526315789473683.
[32m[I 2023-04-26 02:21:38,742][39m Trial 175 finished with value: 0.6304347826086957 and parameters: {'algorithm': 'brute', 'n_neighbors': 10, 'weights': 'distance', 'metric': 'manhattan'}. Best is trial 13 with value: 0.6526315789473683.
[32m[I 2023-04-26 02:21:38,759][39m Trial 176 finished with value: 0.6526315789473683 and parameters: {'algorithm': 'kd_tree', 'n_neighbors': 11, 'weights': 'distance', 'metric': 'manhattan'}. Best is trial 13 with value: 0.6526315789473683.
[32m[I 2023-04-26 02:21:38,788][39m Trial 177 finished with value: 0.6078431372549019 and parameters: {'algorithm': 'brute', 'n_neighbors': 12, 'weights': 'uniform', 'metric': 'manhattan'}. Best is trial 13 with value: 0.6526315789473683.
[32m[I 2023-04-26 02:21:38,796][39m Trial 178 finished with value: 0.6304347826086957 and parameters: {'algorithm': 'auto', 'n_neighbors': 10, 'weights': 'distance', 'metric': 'manhattan'}. Best is trial 13 with value: 0.6526315789473683.
[32m[I 2023-04-26 02:21:38,817][39m Trial 179 finished with value: 0.6526315789473683 and parameters: {'algorithm': 'brute', 'n_neighbors': 13, 'weights': 'distance', 'metric': 'manhattan'}. Best is trial 13 with value: 0.6526315789473683.
[32m[I 2023-04-26 02:21:38,850][39m Trial 180 finished with value: 0.6153846153846154 and parameters: {'algorithm': 'brute', 'n_neighbors': 8, 'weights': 'distance', 'metric': 'manhattan'}. Best is trial 13 with value: 0.6526315789473683.
