[32m[I 2023-04-26 02:21:40,942][39m Trial 271 finished with value: 0.6304347826086957 and parameters: {'algorithm': 'auto', 'n_neighbors': 10, 'weights': 'distance', 'metric': 'manhattan'}. Best is trial 13 with value: 0.6526315789473683.
[32m[I 2023-04-26 02:21:40,952][39m Trial 272 finished with value: 0.6153846153846154 and parameters: {'algorithm': 'ball_tree', 'n_neighbors': 8, 'weights': 'distance', 'metric': 'manhattan'}. Best is trial 13 with value: 0.6526315789473683.
[32m[I 2023-04-26 02:21:40,981][39m Trial 273 finished with value: 0.6304347826086957 and parameters: {'algorithm': 'brute', 'n_neighbors': 10, 'weights': 'distance', 'metric': 'manhattan'}. Best is trial 13 with value: 0.6526315789473683.
[32m[I 2023-04-26 02:21:40,999][39m Trial 274 finished with value: 0.6304347826086957 and parameters: {'algorithm': 'ball_tree', 'n_neighbors': 10, 'weights': 'distance', 'metric': 'manhattan'}. Best is trial 13 with value: 0.6526315789473683.
[32m[I 2023-04-26 02:21:41,037][39m Trial 275 finished with value: 0.6526315789473683 and parameters: {'algorithm': 'brute', 'n_neighbors': 13, 'weights': 'distance', 'metric': 'manhattan'}. Best is trial 13 with value: 0.6526315789473683.
[32m[I 2023-04-26 02:21:41,073][39m Trial 276 finished with value: 0.6391752577319588 and parameters: {'algorithm': 'brute', 'n_neighbors': 12, 'weights': 'distance', 'metric': 'manhattan'}. Best is trial 13 with value: 0.6526315789473683.
[32m[I 2023-04-26 02:21:41,093][39m Trial 277 finished with value: 0.6391752577319588 and parameters: {'algorithm': 'auto', 'n_neighbors': 12, 'weights': 'distance', 'metric': 'manhattan'}. Best is trial 13 with value: 0.6526315789473683.
[32m[I 2023-04-26 02:21:41,113][39m Trial 278 finished with value: 0.6526315789473683 and parameters: {'algorithm': 'ball_tree', 'n_neighbors': 9, 'weights': 'distance', 'metric': 'manhattan'}. Best is trial 13 with value: 0.6526315789473683.
[32m[I 2023-04-26 02:21:41,134][39m Trial 279 finished with value: 0.6458333333333333 and parameters: {'algorithm': 'auto', 'n_neighbors': 14, 'weights': 'distance', 'metric': 'manhattan'}. Best is trial 13 with value: 0.6526315789473683.
[32m[I 2023-04-26 02:21:41,154][39m Trial 280 finished with value: 0.6458333333333333 and parameters: {'algorithm': 'auto', 'n_neighbors': 15, 'weights': 'distance', 'metric': 'manhattan'}. Best is trial 13 with value: 0.6526315789473683.
[32m[I 2023-04-26 02:21:41,175][39m Trial 281 finished with value: 0.6458333333333333 and parameters: {'algorithm': 'auto', 'n_neighbors': 14, 'weights': 'distance', 'metric': 'manhattan'}. Best is trial 13 with value: 0.6526315789473683.
[32m[I 2023-04-26 02:21:41,206][39m Trial 282 finished with value: 0.6526315789473683 and parameters: {'algorithm': 'brute', 'n_neighbors': 13, 'weights': 'distance', 'metric': 'manhattan'}. Best is trial 13 with value: 0.6526315789473683.
[32m[I 2023-04-26 02:21:41,225][39m Trial 283 finished with value: 0.6526315789473683 and parameters: {'algorithm': 'auto', 'n_neighbors': 11, 'weights': 'distance', 'metric': 'manhattan'}. Best is trial 13 with value: 0.6526315789473683.
[32m[I 2023-04-26 02:21:41,245][39m Trial 284 finished with value: 0.6391752577319588 and parameters: {'algorithm': 'auto', 'n_neighbors': 12, 'weights': 'distance', 'metric': 'manhattan'}. Best is trial 13 with value: 0.6526315789473683.
[32m[I 2023-04-26 02:21:41,266][39m Trial 285 finished with value: 0.6526315789473683 and parameters: {'algorithm': 'auto', 'n_neighbors': 11, 'weights': 'distance', 'metric': 'manhattan'}. Best is trial 13 with value: 0.6526315789473683.
[32m[I 2023-04-26 02:21:41,287][39m Trial 286 finished with value: 0.6526315789473683 and parameters: {'algorithm': 'kd_tree', 'n_neighbors': 9, 'weights': 'distance', 'metric': 'manhattan'}. Best is trial 13 with value: 0.6526315789473683.
[32m[I 2023-04-26 02:21:41,306][39m Trial 287 finished with value: 0.6041666666666666 and parameters: {'algorithm': 'auto', 'n_neighbors': 13, 'weights': 'distance', 'metric': 'minkowski'}. Best is trial 13 with value: 0.6526315789473683.
[32m[I 2023-04-26 02:21:41,320][39m Trial 288 finished with value: 0.6078431372549019 and parameters: {'algorithm': 'auto', 'n_neighbors': 12, 'weights': 'uniform', 'metric': 'manhattan'}. Best is trial 13 with value: 0.6526315789473683.
[32m[I 2023-04-26 02:21:41,346][39m Trial 289 finished with value: 0.6458333333333333 and parameters: {'algorithm': 'brute', 'n_neighbors': 14, 'weights': 'distance', 'metric': 'manhattan'}. Best is trial 13 with value: 0.6526315789473683.
[32m[I 2023-04-26 02:21:41,382][39m Trial 290 finished with value: 0.6391752577319588 and parameters: {'algorithm': 'brute', 'n_neighbors': 12, 'weights': 'distance', 'metric': 'manhattan'}. Best is trial 13 with value: 0.6526315789473683.
[32m[I 2023-04-26 02:21:41,403][39m Trial 291 finished with value: 0.6249999999999999 and parameters: {'algorithm': 'kd_tree', 'n_neighbors': 16, 'weights': 'distance', 'metric': 'euclidean'}. Best is trial 13 with value: 0.6526315789473683.
[32m[I 2023-04-26 02:21:41,440][39m Trial 292 finished with value: 0.6153846153846154 and parameters: {'algorithm': 'brute', 'n_neighbors': 8, 'weights': 'distance', 'metric': 'manhattan'}. Best is trial 13 with value: 0.6526315789473683.
[32m[I 2023-04-26 02:21:41,461][39m Trial 293 finished with value: 0.6122448979591836 and parameters: {'algorithm': 'auto', 'n_neighbors': 27, 'weights': 'distance', 'metric': 'manhattan'}. Best is trial 13 with value: 0.6526315789473683.
[32m[I 2023-04-26 02:21:41,480][39m Trial 294 finished with value: 0.6304347826086957 and parameters: {'algorithm': 'auto', 'n_neighbors': 10, 'weights': 'distance', 'metric': 'manhattan'}. Best is trial 13 with value: 0.6526315789473683.
[32m[I 2023-04-26 02:21:41,502][39m Trial 295 finished with value: 0.6526315789473683 and parameters: {'algorithm': 'ball_tree', 'n_neighbors': 13, 'weights': 'distance', 'metric': 'manhattan'}. Best is trial 13 with value: 0.6526315789473683.
[32m[I 2023-04-26 02:21:41,523][39m Trial 296 finished with value: 0.6526315789473683 and parameters: {'algorithm': 'auto', 'n_neighbors': 11, 'weights': 'distance', 'metric': 'manhattan'}. Best is trial 13 with value: 0.6526315789473683.
[32m[I 2023-04-26 02:21:41,542][39m Trial 297 finished with value: 0.6526315789473683 and parameters: {'algorithm': 'auto', 'n_neighbors': 11, 'weights': 'distance', 'metric': 'manhattan'}. Best is trial 13 with value: 0.6526315789473683.
[32m[I 2023-04-26 02:21:41,555][39m Trial 298 finished with value: 0.6526315789473683 and parameters: {'algorithm': 'auto', 'n_neighbors': 11, 'weights': 'distance', 'metric': 'manhattan'}. Best is trial 13 with value: 0.6526315789473683.
[32m[I 2023-04-26 02:21:41,573][39m Trial 299 finished with value: 0.6526315789473683 and parameters: {'algorithm': 'ball_tree', 'n_neighbors': 9, 'weights': 'distance', 'metric': 'manhattan'}. Best is trial 13 with value: 0.6526315789473683.
[32m[I 2023-04-26 02:21:41,601][39m Trial 300 finished with value: 0.6153846153846154 and parameters: {'algorithm': 'brute', 'n_neighbors': 8, 'weights': 'distance', 'metric': 'manhattan'}. Best is trial 13 with value: 0.6526315789473683.
[32m[I 2023-04-26 02:21:41,620][39m Trial 301 finished with value: 0.6304347826086957 and parameters: {'algorithm': 'auto', 'n_neighbors': 10, 'weights': 'distance', 'metric': 'manhattan'}. Best is trial 13 with value: 0.6526315789473683.
[32m[I 2023-04-26 02:21:41,641][39m Trial 302 finished with value: 0.6304347826086957 and parameters: {'algorithm': 'auto', 'n_neighbors': 10, 'weights': 'distance', 'metric': 'manhattan'}. Best is trial 13 with value: 0.6526315789473683.
[32m[I 2023-04-26 02:21:41,679][39m Trial 303 finished with value: 0.6526315789473683 and parameters: {'algorithm': 'brute', 'n_neighbors': 9, 'weights': 'distance', 'metric': 'manhattan'}. Best is trial 13 with value: 0.6526315789473683.
[32m[I 2023-04-26 02:21:41,699][39m Trial 304 finished with value: 0.6391752577319588 and parameters: {'algorithm': 'auto', 'n_neighbors': 12, 'weights': 'distance', 'metric': 'manhattan'}. Best is trial 13 with value: 0.6526315789473683.
[32m[I 2023-04-26 02:21:41,736][39m Trial 305 finished with value: 0.6526315789473683 and parameters: {'algorithm': 'brute', 'n_neighbors': 9, 'weights': 'distance', 'metric': 'manhattan'}. Best is trial 13 with value: 0.6526315789473683.
[32m[I 2023-04-26 02:21:41,767][39m Trial 306 finished with value: 0.5684210526315789 and parameters: {'algorithm': 'brute', 'n_neighbors': 10, 'weights': 'uniform', 'metric': 'manhattan'}. Best is trial 13 with value: 0.6526315789473683.
[32m[I 2023-04-26 02:21:41,779][39m Trial 307 finished with value: 0.6391752577319588 and parameters: {'algorithm': 'auto', 'n_neighbors': 12, 'weights': 'distance', 'metric': 'manhattan'}. Best is trial 13 with value: 0.6526315789473683.
[32m[I 2023-04-26 02:21:41,791][39m Trial 308 finished with value: 0.6526315789473683 and parameters: {'algorithm': 'kd_tree', 'n_neighbors': 13, 'weights': 'distance', 'metric': 'manhattan'}. Best is trial 13 with value: 0.6526315789473683.
[32m[I 2023-04-26 02:21:41,802][39m Trial 309 finished with value: 0.6249999999999999 and parameters: {'algorithm': 'auto', 'n_neighbors': 21, 'weights': 'distance', 'metric': 'manhattan'}. Best is trial 13 with value: 0.6526315789473683.
[32m[I 2023-04-26 02:21:41,836][39m Trial 310 finished with value: 0.5918367346938775 and parameters: {'algorithm': 'brute', 'n_neighbors': 7, 'weights': 'distance', 'metric': 'minkowski'}. Best is trial 13 with value: 0.6526315789473683.
[32m[I 2023-04-26 02:21:41,857][39m Trial 311 finished with value: 0.6153846153846154 and parameters: {'algorithm': 'kd_tree', 'n_neighbors': 8, 'weights': 'distance', 'metric': 'manhattan'}. Best is trial 13 with value: 0.6526315789473683.
[32m[I 2023-04-26 02:21:41,878][39m Trial 312 finished with value: 0.6458333333333333 and parameters: {'algorithm': 'kd_tree', 'n_neighbors': 14, 'weights': 'distance', 'metric': 'manhattan'}. Best is trial 13 with value: 0.6526315789473683.
[32m[I 2023-04-26 02:21:41,916][39m Trial 313 finished with value: 0.6526315789473683 and parameters: {'algorithm': 'brute', 'n_neighbors': 13, 'weights': 'distance', 'metric': 'manhattan'}. Best is trial 13 with value: 0.6526315789473683.
[32m[I 2023-04-26 02:21:41,952][39m Trial 314 finished with value: 0.6526315789473683 and parameters: {'algorithm': 'brute', 'n_neighbors': 9, 'weights': 'distance', 'metric': 'manhattan'}. Best is trial 13 with value: 0.6526315789473683.
[32m[I 2023-04-26 02:21:41,988][39m Trial 315 finished with value: 0.6185567010309277 and parameters: {'algorithm': 'brute', 'n_neighbors': 11, 'weights': 'distance', 'metric': 'euclidean'}. Best is trial 13 with value: 0.6526315789473683.
[32m[I 2023-04-26 02:21:42,010][39m Trial 316 finished with value: 0.6526315789473683 and parameters: {'algorithm': 'ball_tree', 'n_neighbors': 9, 'weights': 'distance', 'metric': 'manhattan'}. Best is trial 13 with value: 0.6526315789473683.
[32m[I 2023-04-26 02:21:42,032][39m Trial 317 finished with value: 0.6304347826086957 and parameters: {'algorithm': 'auto', 'n_neighbors': 10, 'weights': 'distance', 'metric': 'manhattan'}. Best is trial 13 with value: 0.6526315789473683.
[32m[I 2023-04-26 02:21:42,084][39m Trial 318 finished with value: 0.6526315789473683 and parameters: {'algorithm': 'brute', 'n_neighbors': 9, 'weights': 'distance', 'metric': 'manhattan'}. Best is trial 13 with value: 0.6526315789473683.
[32m[I 2023-04-26 02:21:42,109][39m Trial 319 finished with value: 0.6304347826086957 and parameters: {'algorithm': 'auto', 'n_neighbors': 10, 'weights': 'distance', 'metric': 'manhattan'}. Best is trial 13 with value: 0.6526315789473683.
[32m[I 2023-04-26 02:21:42,147][39m Trial 320 finished with value: 0.6153846153846154 and parameters: {'algorithm': 'brute', 'n_neighbors': 8, 'weights': 'distance', 'metric': 'manhattan'}. Best is trial 13 with value: 0.6526315789473683.
[32m[I 2023-04-26 02:21:42,169][39m Trial 321 finished with value: 0.6391752577319588 and parameters: {'algorithm': 'auto', 'n_neighbors': 12, 'weights': 'distance', 'metric': 'manhattan'}. Best is trial 13 with value: 0.6526315789473683.
[32m[I 2023-04-26 02:21:42,207][39m Trial 322 finished with value: 0.6526315789473683 and parameters: {'algorithm': 'brute', 'n_neighbors': 9, 'weights': 'distance', 'metric': 'manhattan'}. Best is trial 13 with value: 0.6526315789473683.
[32m[I 2023-04-26 02:21:42,230][39m Trial 323 finished with value: 0.6391752577319588 and parameters: {'algorithm': 'auto', 'n_neighbors': 12, 'weights': 'distance', 'metric': 'manhattan'}. Best is trial 13 with value: 0.6526315789473683.
[32m[I 2023-04-26 02:21:42,251][39m Trial 324 finished with value: 0.6373626373626374 and parameters: {'algorithm': 'ball_tree', 'n_neighbors': 7, 'weights': 'distance', 'metric': 'manhattan'}. Best is trial 13 with value: 0.6526315789473683.
[32m[I 2023-04-26 02:21:42,273][39m Trial 325 finished with value: 0.6526315789473683 and parameters: {'algorithm': 'ball_tree', 'n_neighbors': 11, 'weights': 'distance', 'metric': 'manhattan'}. Best is trial 13 with value: 0.6526315789473683.
[32m[I 2023-04-26 02:21:42,296][39m Trial 326 finished with value: 0.6304347826086957 and parameters: {'algorithm': 'auto', 'n_neighbors': 10, 'weights': 'distance', 'metric': 'manhattan'}. Best is trial 13 with value: 0.6526315789473683.
[32m[I 2023-04-26 02:21:42,314][39m Trial 327 finished with value: 0.6526315789473683 and parameters: {'algorithm': 'kd_tree', 'n_neighbors': 13, 'weights': 'distance', 'metric': 'manhattan'}. Best is trial 13 with value: 0.6526315789473683.
[32m[I 2023-04-26 02:21:42,332][39m Trial 328 finished with value: 0.6153846153846154 and parameters: {'algorithm': 'kd_tree', 'n_neighbors': 8, 'weights': 'distance', 'metric': 'manhattan'}. Best is trial 13 with value: 0.6526315789473683.
[32m[I 2023-04-26 02:21:42,345][39m Trial 329 finished with value: 0.6168224299065421 and parameters: {'algorithm': 'auto', 'n_neighbors': 11, 'weights': 'uniform', 'metric': 'manhattan'}. Best is trial 13 with value: 0.6526315789473683.
[32m[I 2023-04-26 02:21:42,356][39m Trial 330 finished with value: 0.6526315789473683 and parameters: {'algorithm': 'auto', 'n_neighbors': 11, 'weights': 'distance', 'metric': 'manhattan'}. Best is trial 13 with value: 0.6526315789473683.
[32m[I 2023-04-26 02:21:42,367][39m Trial 331 finished with value: 0.6526315789473683 and parameters: {'algorithm': 'auto', 'n_neighbors': 11, 'weights': 'distance', 'metric': 'manhattan'}. Best is trial 13 with value: 0.6526315789473683.
[32m[I 2023-04-26 02:21:42,380][39m Trial 332 finished with value: 0.6391752577319588 and parameters: {'algorithm': 'auto', 'n_neighbors': 12, 'weights': 'distance', 'metric': 'manhattan'}. Best is trial 13 with value: 0.6526315789473683.
[32m[I 2023-04-26 02:21:42,391][39m Trial 333 finished with value: 0.6122448979591836 and parameters: {'algorithm': 'ball_tree', 'n_neighbors': 9, 'weights': 'distance', 'metric': 'minkowski'}. Best is trial 13 with value: 0.6526315789473683.
[32m[I 2023-04-26 02:21:42,402][39m Trial 334 finished with value: 0.6526315789473683 and parameters: {'algorithm': 'ball_tree', 'n_neighbors': 9, 'weights': 'distance', 'metric': 'manhattan'}. Best is trial 13 with value: 0.6526315789473683.
[32m[I 2023-04-26 02:21:42,413][39m Trial 335 finished with value: 0.6526315789473683 and parameters: {'algorithm': 'auto', 'n_neighbors': 11, 'weights': 'distance', 'metric': 'manhattan'}. Best is trial 13 with value: 0.6526315789473683.
[32m[I 2023-04-26 02:21:42,423][39m Trial 336 finished with value: 0.6304347826086957 and parameters: {'algorithm': 'ball_tree', 'n_neighbors': 10, 'weights': 'distance', 'metric': 'manhattan'}. Best is trial 13 with value: 0.6526315789473683.
[32m[I 2023-04-26 02:21:42,453][39m Trial 337 finished with value: 0.6304347826086957 and parameters: {'algorithm': 'brute', 'n_neighbors': 10, 'weights': 'distance', 'metric': 'manhattan'}. Best is trial 13 with value: 0.6526315789473683.
[32m[I 2023-04-26 02:21:42,493][39m Trial 338 finished with value: 0.6105263157894738 and parameters: {'algorithm': 'brute', 'n_neighbors': 15, 'weights': 'distance', 'metric': 'euclidean'}. Best is trial 13 with value: 0.6526315789473683.
[32m[I 2023-04-26 02:21:42,514][39m Trial 339 finished with value: 0.6249999999999999 and parameters: {'algorithm': 'ball_tree', 'n_neighbors': 17, 'weights': 'distance', 'metric': 'manhattan'}. Best is trial 13 with value: 0.6526315789473683.
[32m[I 2023-04-26 02:21:42,536][39m Trial 340 finished with value: 0.606060606060606 and parameters: {'algorithm': 'ball_tree', 'n_neighbors': 30, 'weights': 'distance', 'metric': 'manhattan'}. Best is trial 13 with value: 0.6526315789473683.
[32m[I 2023-04-26 02:21:42,558][39m Trial 341 finished with value: 0.6458333333333333 and parameters: {'algorithm': 'auto', 'n_neighbors': 14, 'weights': 'distance', 'metric': 'manhattan'}. Best is trial 13 with value: 0.6526315789473683.
[32m[I 2023-04-26 02:21:42,581][39m Trial 342 finished with value: 0.6526315789473683 and parameters: {'algorithm': 'auto', 'n_neighbors': 13, 'weights': 'distance', 'metric': 'manhattan'}. Best is trial 13 with value: 0.6526315789473683.
[32m[I 2023-04-26 02:21:42,616][39m Trial 343 finished with value: 0.6526315789473683 and parameters: {'algorithm': 'brute', 'n_neighbors': 13, 'weights': 'distance', 'metric': 'manhattan'}. Best is trial 13 with value: 0.6526315789473683.
[32m[I 2023-04-26 02:21:42,638][39m Trial 344 finished with value: 0.6526315789473683 and parameters: {'algorithm': 'kd_tree', 'n_neighbors': 13, 'weights': 'distance', 'metric': 'manhattan'}. Best is trial 13 with value: 0.6526315789473683.
[32m[I 2023-04-26 02:21:42,675][39m Trial 345 finished with value: 0.6526315789473683 and parameters: {'algorithm': 'brute', 'n_neighbors': 13, 'weights': 'distance', 'metric': 'manhattan'}. Best is trial 13 with value: 0.6526315789473683.
[32m[I 2023-04-26 02:21:42,713][39m Trial 346 finished with value: 0.6153846153846154 and parameters: {'algorithm': 'brute', 'n_neighbors': 8, 'weights': 'distance', 'metric': 'manhattan'}. Best is trial 13 with value: 0.6526315789473683.
[32m[I 2023-04-26 02:21:42,748][39m Trial 347 finished with value: 0.5684210526315789 and parameters: {'algorithm': 'brute', 'n_neighbors': 10, 'weights': 'uniform', 'metric': 'manhattan'}. Best is trial 13 with value: 0.6526315789473683.
[32m[I 2023-04-26 02:21:42,761][39m Trial 348 finished with value: 0.6391752577319588 and parameters: {'algorithm': 'auto', 'n_neighbors': 12, 'weights': 'distance', 'metric': 'manhattan'}. Best is trial 13 with value: 0.6526315789473683.
[32m[I 2023-04-26 02:21:42,786][39m Trial 349 finished with value: 0.6526315789473683 and parameters: {'algorithm': 'brute', 'n_neighbors': 9, 'weights': 'distance', 'metric': 'manhattan'}. Best is trial 13 with value: 0.6526315789473683.
[32m[I 2023-04-26 02:21:42,823][39m Trial 350 finished with value: 0.6391752577319588 and parameters: {'algorithm': 'brute', 'n_neighbors': 12, 'weights': 'distance', 'metric': 'manhattan'}. Best is trial 13 with value: 0.6526315789473683.
[32m[I 2023-04-26 02:21:42,862][39m Trial 351 finished with value: 0.6153846153846154 and parameters: {'algorithm': 'brute', 'n_neighbors': 8, 'weights': 'distance', 'metric': 'manhattan'}. Best is trial 13 with value: 0.6526315789473683.
[32m[I 2023-04-26 02:21:42,899][39m Trial 352 finished with value: 0.6526315789473683 and parameters: {'algorithm': 'brute', 'n_neighbors': 9, 'weights': 'distance', 'metric': 'manhattan'}. Best is trial 13 with value: 0.6526315789473683.
[32m[I 2023-04-26 02:21:42,921][39m Trial 353 finished with value: 0.6526315789473683 and parameters: {'algorithm': 'kd_tree', 'n_neighbors': 11, 'weights': 'distance', 'metric': 'manhattan'}. Best is trial 13 with value: 0.6526315789473683.
[32m[I 2023-04-26 02:21:42,961][39m Trial 354 finished with value: 0.6304347826086957 and parameters: {'algorithm': 'brute', 'n_neighbors': 10, 'weights': 'distance', 'metric': 'manhattan'}. Best is trial 13 with value: 0.6526315789473683.
[32m[I 2023-04-26 02:21:42,983][39m Trial 355 finished with value: 0.6122448979591836 and parameters: {'algorithm': 'auto', 'n_neighbors': 10, 'weights': 'distance', 'metric': 'minkowski'}. Best is trial 13 with value: 0.6526315789473683.
[32m[I 2023-04-26 02:21:43,006][39m Trial 356 finished with value: 0.6373626373626374 and parameters: {'algorithm': 'kd_tree', 'n_neighbors': 7, 'weights': 'distance', 'metric': 'manhattan'}. Best is trial 13 with value: 0.6526315789473683.
[32m[I 2023-04-26 02:21:43,028][39m Trial 357 finished with value: 0.6526315789473683 and parameters: {'algorithm': 'auto', 'n_neighbors': 11, 'weights': 'distance', 'metric': 'manhattan'}. Best is trial 13 with value: 0.6526315789473683.
[32m[I 2023-04-26 02:21:43,067][39m Trial 358 finished with value: 0.6304347826086957 and parameters: {'algorithm': 'brute', 'n_neighbors': 10, 'weights': 'distance', 'metric': 'manhattan'}. Best is trial 13 with value: 0.6526315789473683.
[32m[I 2023-04-26 02:21:43,091][39m Trial 359 finished with value: 0.6526315789473683 and parameters: {'algorithm': 'auto', 'n_neighbors': 11, 'weights': 'distance', 'metric': 'manhattan'}. Best is trial 13 with value: 0.6526315789473683.
[32m[I 2023-04-26 02:21:43,130][39m Trial 360 finished with value: 0.6391752577319588 and parameters: {'algorithm': 'brute', 'n_neighbors': 12, 'weights': 'distance', 'metric': 'manhattan'}. Best is trial 13 with value: 0.6526315789473683.
