[32m[I 2023-04-26 00:21:12,833][39m Trial 182 finished with value: 0.6964285714285714 and parameters: {'algorithm': 'auto', 'n_neighbors': 15, 'weights': 'distance', 'metric': 'minkowski'}. Best is trial 57 with value: 0.7155963302752292.
[32m[I 2023-04-26 00:21:12,841][39m Trial 183 finished with value: 0.7155963302752292 and parameters: {'algorithm': 'auto', 'n_neighbors': 14, 'weights': 'distance', 'metric': 'euclidean'}. Best is trial 57 with value: 0.7155963302752292.
[32m[I 2023-04-26 00:21:12,852][39m Trial 184 finished with value: 0.6666666666666666 and parameters: {'algorithm': 'auto', 'n_neighbors': 13, 'weights': 'uniform', 'metric': 'minkowski'}. Best is trial 57 with value: 0.7155963302752292.
[32m[I 2023-04-26 00:21:12,861][39m Trial 185 finished with value: 0.6964285714285714 and parameters: {'algorithm': 'auto', 'n_neighbors': 15, 'weights': 'distance', 'metric': 'minkowski'}. Best is trial 57 with value: 0.7155963302752292.
[32m[I 2023-04-26 00:21:12,892][39m Trial 186 finished with value: 0.7155963302752292 and parameters: {'algorithm': 'brute', 'n_neighbors': 14, 'weights': 'distance', 'metric': 'euclidean'}. Best is trial 57 with value: 0.7155963302752292.
[32m[I 2023-04-26 00:21:12,908][39m Trial 187 finished with value: 0.6964285714285714 and parameters: {'algorithm': 'auto', 'n_neighbors': 13, 'weights': 'distance', 'metric': 'minkowski'}. Best is trial 57 with value: 0.7155963302752292.
[32m[I 2023-04-26 00:21:12,924][39m Trial 188 finished with value: 0.709090909090909 and parameters: {'algorithm': 'auto', 'n_neighbors': 16, 'weights': 'distance', 'metric': 'euclidean'}. Best is trial 57 with value: 0.7155963302752292.
[32m[I 2023-04-26 00:21:12,941][39m Trial 189 finished with value: 0.6964285714285714 and parameters: {'algorithm': 'auto', 'n_neighbors': 15, 'weights': 'distance', 'metric': 'euclidean'}. Best is trial 57 with value: 0.7155963302752292.
[32m[I 2023-04-26 00:21:12,976][39m Trial 190 finished with value: 0.6964285714285714 and parameters: {'algorithm': 'brute', 'n_neighbors': 13, 'weights': 'distance', 'metric': 'euclidean'}. Best is trial 57 with value: 0.7155963302752292.
[32m[I 2023-04-26 00:21:13,012][39m Trial 191 finished with value: 0.7155963302752292 and parameters: {'algorithm': 'brute', 'n_neighbors': 14, 'weights': 'distance', 'metric': 'euclidean'}. Best is trial 57 with value: 0.7155963302752292.
[32m[I 2023-04-26 00:21:13,048][39m Trial 192 finished with value: 0.7155963302752292 and parameters: {'algorithm': 'brute', 'n_neighbors': 14, 'weights': 'distance', 'metric': 'euclidean'}. Best is trial 57 with value: 0.7155963302752292.
[32m[I 2023-04-26 00:21:13,065][39m Trial 193 finished with value: 0.7155963302752292 and parameters: {'algorithm': 'auto', 'n_neighbors': 14, 'weights': 'distance', 'metric': 'euclidean'}. Best is trial 57 with value: 0.7155963302752292.
[32m[I 2023-04-26 00:21:13,081][39m Trial 194 finished with value: 0.6964285714285714 and parameters: {'algorithm': 'auto', 'n_neighbors': 15, 'weights': 'distance', 'metric': 'euclidean'}. Best is trial 57 with value: 0.7155963302752292.
[32m[I 2023-04-26 00:21:13,115][39m Trial 195 finished with value: 0.7155963302752292 and parameters: {'algorithm': 'brute', 'n_neighbors': 14, 'weights': 'distance', 'metric': 'euclidean'}. Best is trial 57 with value: 0.7155963302752292.
[32m[I 2023-04-26 00:21:13,148][39m Trial 196 finished with value: 0.7155963302752292 and parameters: {'algorithm': 'brute', 'n_neighbors': 14, 'weights': 'distance', 'metric': 'euclidean'}. Best is trial 57 with value: 0.7155963302752292.
[32m[I 2023-04-26 00:21:13,167][39m Trial 197 finished with value: 0.6964285714285714 and parameters: {'algorithm': 'auto', 'n_neighbors': 13, 'weights': 'distance', 'metric': 'minkowski'}. Best is trial 57 with value: 0.7155963302752292.
[32m[I 2023-04-26 00:21:13,185][39m Trial 198 finished with value: 0.7017543859649122 and parameters: {'algorithm': 'auto', 'n_neighbors': 3, 'weights': 'distance', 'metric': 'euclidean'}. Best is trial 57 with value: 0.7155963302752292.
[32m[I 2023-04-26 00:21:13,202][39m Trial 199 finished with value: 0.7027027027027026 and parameters: {'algorithm': 'ball_tree', 'n_neighbors': 12, 'weights': 'distance', 'metric': 'euclidean'}. Best is trial 57 with value: 0.7155963302752292.
[32m[I 2023-04-26 00:21:13,220][39m Trial 200 finished with value: 0.7155963302752292 and parameters: {'algorithm': 'ball_tree', 'n_neighbors': 14, 'weights': 'distance', 'metric': 'minkowski'}. Best is trial 57 with value: 0.7155963302752292.
[32m[I 2023-04-26 00:21:13,238][39m Trial 201 finished with value: 0.6964285714285714 and parameters: {'algorithm': 'auto', 'n_neighbors': 15, 'weights': 'distance', 'metric': 'minkowski'}. Best is trial 57 with value: 0.7155963302752292.
[32m[I 2023-04-26 00:21:13,266][39m Trial 202 finished with value: 0.7155963302752292 and parameters: {'algorithm': 'brute', 'n_neighbors': 14, 'weights': 'distance', 'metric': 'euclidean'}. Best is trial 57 with value: 0.7155963302752292.
[32m[I 2023-04-26 00:21:13,283][39m Trial 203 finished with value: 0.6964285714285714 and parameters: {'algorithm': 'auto', 'n_neighbors': 13, 'weights': 'distance', 'metric': 'minkowski'}. Best is trial 57 with value: 0.7155963302752292.
[32m[I 2023-04-26 00:21:13,301][39m Trial 204 finished with value: 0.6964285714285714 and parameters: {'algorithm': 'auto', 'n_neighbors': 15, 'weights': 'distance', 'metric': 'minkowski'}. Best is trial 57 with value: 0.7155963302752292.
[32m[I 2023-04-26 00:21:13,318][39m Trial 205 finished with value: 0.7155963302752292 and parameters: {'algorithm': 'auto', 'n_neighbors': 14, 'weights': 'distance', 'metric': 'euclidean'}. Best is trial 57 with value: 0.7155963302752292.
[32m[I 2023-04-26 00:21:13,335][39m Trial 206 finished with value: 0.6964285714285714 and parameters: {'algorithm': 'auto', 'n_neighbors': 13, 'weights': 'distance', 'metric': 'minkowski'}. Best is trial 57 with value: 0.7155963302752292.
[32m[I 2023-04-26 00:21:13,354][39m Trial 207 finished with value: 0.7155963302752292 and parameters: {'algorithm': 'auto', 'n_neighbors': 14, 'weights': 'distance', 'metric': 'minkowski'}. Best is trial 57 with value: 0.7155963302752292.
[32m[I 2023-04-26 00:21:13,370][39m Trial 208 finished with value: 0.7155963302752292 and parameters: {'algorithm': 'auto', 'n_neighbors': 14, 'weights': 'distance', 'metric': 'minkowski'}. Best is trial 57 with value: 0.7155963302752292.
[32m[I 2023-04-26 00:21:13,380][39m Trial 209 finished with value: 0.6964285714285714 and parameters: {'algorithm': 'auto', 'n_neighbors': 13, 'weights': 'distance', 'metric': 'minkowski'}. Best is trial 57 with value: 0.7155963302752292.
[32m[I 2023-04-26 00:21:13,390][39m Trial 210 finished with value: 0.6964285714285714 and parameters: {'algorithm': 'auto', 'n_neighbors': 15, 'weights': 'distance', 'metric': 'minkowski'}. Best is trial 57 with value: 0.7155963302752292.
[32m[I 2023-04-26 00:21:13,414][39m Trial 211 finished with value: 0.7155963302752292 and parameters: {'algorithm': 'brute', 'n_neighbors': 14, 'weights': 'distance', 'metric': 'euclidean'}. Best is trial 57 with value: 0.7155963302752292.
[32m[I 2023-04-26 00:21:13,432][39m Trial 212 finished with value: 0.7155963302752292 and parameters: {'algorithm': 'auto', 'n_neighbors': 14, 'weights': 'distance', 'metric': 'minkowski'}. Best is trial 57 with value: 0.7155963302752292.
[32m[I 2023-04-26 00:21:13,466][39m Trial 213 finished with value: 0.7155963302752292 and parameters: {'algorithm': 'brute', 'n_neighbors': 14, 'weights': 'distance', 'metric': 'euclidean'}. Best is trial 57 with value: 0.7155963302752292.
[32m[I 2023-04-26 00:21:13,497][39m Trial 214 finished with value: 0.6964285714285714 and parameters: {'algorithm': 'brute', 'n_neighbors': 15, 'weights': 'distance', 'metric': 'minkowski'}. Best is trial 57 with value: 0.7155963302752292.
[32m[I 2023-04-26 00:21:13,529][39m Trial 215 finished with value: 0.7155963302752292 and parameters: {'algorithm': 'brute', 'n_neighbors': 14, 'weights': 'distance', 'metric': 'euclidean'}. Best is trial 57 with value: 0.7155963302752292.
[32m[I 2023-04-26 00:21:13,562][39m Trial 216 finished with value: 0.7155963302752292 and parameters: {'algorithm': 'brute', 'n_neighbors': 14, 'weights': 'distance', 'metric': 'euclidean'}. Best is trial 57 with value: 0.7155963302752292.
[32m[I 2023-04-26 00:21:13,590][39m Trial 217 finished with value: 0.5882352941176471 and parameters: {'algorithm': 'brute', 'n_neighbors': 16, 'weights': 'uniform', 'metric': 'minkowski'}. Best is trial 57 with value: 0.7155963302752292.
[32m[I 2023-04-26 00:21:13,600][39m Trial 218 finished with value: 0.6964285714285714 and parameters: {'algorithm': 'kd_tree', 'n_neighbors': 13, 'weights': 'distance', 'metric': 'minkowski'}. Best is trial 57 with value: 0.7155963302752292.
[32m[I 2023-04-26 00:21:13,629][39m Trial 219 finished with value: 0.6964285714285714 and parameters: {'algorithm': 'brute', 'n_neighbors': 15, 'weights': 'distance', 'metric': 'euclidean'}. Best is trial 57 with value: 0.7155963302752292.
[32m[I 2023-04-26 00:21:13,664][39m Trial 220 finished with value: 0.6964285714285714 and parameters: {'algorithm': 'brute', 'n_neighbors': 13, 'weights': 'distance', 'metric': 'euclidean'}. Best is trial 57 with value: 0.7155963302752292.
[32m[I 2023-04-26 00:21:13,698][39m Trial 221 finished with value: 0.7155963302752292 and parameters: {'algorithm': 'brute', 'n_neighbors': 14, 'weights': 'distance', 'metric': 'euclidean'}. Best is trial 57 with value: 0.7155963302752292.
[32m[I 2023-04-26 00:21:13,715][39m Trial 222 finished with value: 0.6964285714285714 and parameters: {'algorithm': 'auto', 'n_neighbors': 15, 'weights': 'distance', 'metric': 'minkowski'}. Best is trial 57 with value: 0.7155963302752292.
[32m[I 2023-04-26 00:21:13,749][39m Trial 223 finished with value: 0.6964285714285714 and parameters: {'algorithm': 'brute', 'n_neighbors': 13, 'weights': 'distance', 'metric': 'euclidean'}. Best is trial 57 with value: 0.7155963302752292.
[32m[I 2023-04-26 00:21:13,783][39m Trial 224 finished with value: 0.7155963302752292 and parameters: {'algorithm': 'brute', 'n_neighbors': 14, 'weights': 'distance', 'metric': 'euclidean'}. Best is trial 57 with value: 0.7155963302752292.
[32m[I 2023-04-26 00:21:13,802][39m Trial 225 finished with value: 0.6964285714285714 and parameters: {'algorithm': 'auto', 'n_neighbors': 13, 'weights': 'distance', 'metric': 'minkowski'}. Best is trial 57 with value: 0.7155963302752292.
[32m[I 2023-04-26 00:21:13,835][39m Trial 226 finished with value: 0.7155963302752292 and parameters: {'algorithm': 'brute', 'n_neighbors': 14, 'weights': 'distance', 'metric': 'euclidean'}. Best is trial 57 with value: 0.7155963302752292.
[32m[I 2023-04-26 00:21:13,853][39m Trial 227 finished with value: 0.7027027027027026 and parameters: {'algorithm': 'ball_tree', 'n_neighbors': 12, 'weights': 'distance', 'metric': 'minkowski'}. Best is trial 57 with value: 0.7155963302752292.
[32m[I 2023-04-26 00:21:13,871][39m Trial 228 finished with value: 0.6964285714285714 and parameters: {'algorithm': 'ball_tree', 'n_neighbors': 15, 'weights': 'distance', 'metric': 'minkowski'}. Best is trial 57 with value: 0.7155963302752292.
[32m[I 2023-04-26 00:21:13,890][39m Trial 229 finished with value: 0.7155963302752292 and parameters: {'algorithm': 'auto', 'n_neighbors': 14, 'weights': 'distance', 'metric': 'minkowski'}. Best is trial 57 with value: 0.7155963302752292.
[32m[I 2023-04-26 00:21:13,909][39m Trial 230 finished with value: 0.6964285714285714 and parameters: {'algorithm': 'auto', 'n_neighbors': 15, 'weights': 'distance', 'metric': 'minkowski'}. Best is trial 57 with value: 0.7155963302752292.
[32m[I 2023-04-26 00:21:13,927][39m Trial 231 finished with value: 0.7155963302752292 and parameters: {'algorithm': 'auto', 'n_neighbors': 14, 'weights': 'distance', 'metric': 'minkowski'}. Best is trial 57 with value: 0.7155963302752292.
[32m[I 2023-04-26 00:21:13,939][39m Trial 232 finished with value: 0.7155963302752292 and parameters: {'algorithm': 'ball_tree', 'n_neighbors': 14, 'weights': 'distance', 'metric': 'minkowski'}. Best is trial 57 with value: 0.7155963302752292.
[32m[I 2023-04-26 00:21:13,951][39m Trial 233 finished with value: 0.7155963302752292 and parameters: {'algorithm': 'auto', 'n_neighbors': 14, 'weights': 'distance', 'metric': 'minkowski'}. Best is trial 57 with value: 0.7155963302752292.
[32m[I 2023-04-26 00:21:13,962][39m Trial 234 finished with value: 0.7155963302752292 and parameters: {'algorithm': 'auto', 'n_neighbors': 14, 'weights': 'distance', 'metric': 'minkowski'}. Best is trial 57 with value: 0.7155963302752292.
[32m[I 2023-04-26 00:21:13,971][39m Trial 235 finished with value: 0.6964285714285714 and parameters: {'algorithm': 'auto', 'n_neighbors': 13, 'weights': 'distance', 'metric': 'minkowski'}. Best is trial 57 with value: 0.7155963302752292.
[32m[I 2023-04-26 00:21:14,002][39m Trial 236 finished with value: 0.7155963302752292 and parameters: {'algorithm': 'brute', 'n_neighbors': 14, 'weights': 'distance', 'metric': 'euclidean'}. Best is trial 57 with value: 0.7155963302752292.
[32m[I 2023-04-26 00:21:14,021][39m Trial 237 finished with value: 0.6964285714285714 and parameters: {'algorithm': 'auto', 'n_neighbors': 15, 'weights': 'distance', 'metric': 'euclidean'}. Best is trial 57 with value: 0.7155963302752292.
[32m[I 2023-04-26 00:21:14,055][39m Trial 238 finished with value: 0.7155963302752292 and parameters: {'algorithm': 'brute', 'n_neighbors': 14, 'weights': 'distance', 'metric': 'minkowski'}. Best is trial 57 with value: 0.7155963302752292.
[32m[I 2023-04-26 00:21:14,073][39m Trial 239 finished with value: 0.6964285714285714 and parameters: {'algorithm': 'ball_tree', 'n_neighbors': 13, 'weights': 'distance', 'metric': 'minkowski'}. Best is trial 57 with value: 0.7155963302752292.
[32m[I 2023-04-26 00:21:14,113][39m Trial 240 finished with value: 0.7155963302752292 and parameters: {'algorithm': 'brute', 'n_neighbors': 14, 'weights': 'distance', 'metric': 'euclidean'}. Best is trial 57 with value: 0.7155963302752292.
[32m[I 2023-04-26 00:21:14,153][39m Trial 241 finished with value: 0.7155963302752292 and parameters: {'algorithm': 'brute', 'n_neighbors': 14, 'weights': 'distance', 'metric': 'euclidean'}. Best is trial 57 with value: 0.7155963302752292.
[32m[I 2023-04-26 00:21:14,188][39m Trial 242 finished with value: 0.7155963302752292 and parameters: {'algorithm': 'brute', 'n_neighbors': 14, 'weights': 'distance', 'metric': 'euclidean'}. Best is trial 57 with value: 0.7155963302752292.
[32m[I 2023-04-26 00:21:14,207][39m Trial 243 finished with value: 0.6964285714285714 and parameters: {'algorithm': 'auto', 'n_neighbors': 15, 'weights': 'distance', 'metric': 'euclidean'}. Best is trial 57 with value: 0.7155963302752292.
[32m[I 2023-04-26 00:21:14,242][39m Trial 244 finished with value: 0.6964285714285714 and parameters: {'algorithm': 'brute', 'n_neighbors': 13, 'weights': 'distance', 'metric': 'minkowski'}. Best is trial 57 with value: 0.7155963302752292.
[32m[I 2023-04-26 00:21:14,277][39m Trial 245 finished with value: 0.7155963302752292 and parameters: {'algorithm': 'brute', 'n_neighbors': 14, 'weights': 'distance', 'metric': 'euclidean'}. Best is trial 57 with value: 0.7155963302752292.
[32m[I 2023-04-26 00:21:14,310][39m Trial 246 finished with value: 0.6964285714285714 and parameters: {'algorithm': 'brute', 'n_neighbors': 15, 'weights': 'distance', 'metric': 'euclidean'}. Best is trial 57 with value: 0.7155963302752292.
[32m[I 2023-04-26 00:21:14,345][39m Trial 247 finished with value: 0.6964285714285714 and parameters: {'algorithm': 'brute', 'n_neighbors': 13, 'weights': 'distance', 'metric': 'euclidean'}. Best is trial 57 with value: 0.7155963302752292.
[32m[I 2023-04-26 00:21:14,364][39m Trial 248 finished with value: 0.7027027027027026 and parameters: {'algorithm': 'auto', 'n_neighbors': 15, 'weights': 'distance', 'metric': 'manhattan'}. Best is trial 57 with value: 0.7155963302752292.
[32m[I 2023-04-26 00:21:14,385][39m Trial 249 finished with value: 0.7155963302752292 and parameters: {'algorithm': 'ball_tree', 'n_neighbors': 14, 'weights': 'distance', 'metric': 'euclidean'}. Best is trial 57 with value: 0.7155963302752292.
[32m[I 2023-04-26 00:21:14,408][39m Trial 250 finished with value: 0.6964285714285714 and parameters: {'algorithm': 'auto', 'n_neighbors': 13, 'weights': 'distance', 'metric': 'euclidean'}. Best is trial 57 with value: 0.7155963302752292.
[32m[I 2023-04-26 00:21:14,445][39m Trial 251 finished with value: 0.7155963302752292 and parameters: {'algorithm': 'brute', 'n_neighbors': 14, 'weights': 'distance', 'metric': 'euclidean'}. Best is trial 57 with value: 0.7155963302752292.
[32m[I 2023-04-26 00:21:14,465][39m Trial 252 finished with value: 0.7155963302752292 and parameters: {'algorithm': 'auto', 'n_neighbors': 14, 'weights': 'distance', 'metric': 'euclidean'}. Best is trial 57 with value: 0.7155963302752292.
[32m[I 2023-04-26 00:21:14,485][39m Trial 253 finished with value: 0.6964285714285714 and parameters: {'algorithm': 'auto', 'n_neighbors': 15, 'weights': 'distance', 'metric': 'minkowski'}. Best is trial 57 with value: 0.7155963302752292.
[32m[I 2023-04-26 00:21:14,523][39m Trial 254 finished with value: 0.7155963302752292 and parameters: {'algorithm': 'brute', 'n_neighbors': 14, 'weights': 'distance', 'metric': 'euclidean'}. Best is trial 57 with value: 0.7155963302752292.
[32m[I 2023-04-26 00:21:14,554][39m Trial 255 finished with value: 0.5882352941176471 and parameters: {'algorithm': 'brute', 'n_neighbors': 16, 'weights': 'uniform', 'metric': 'euclidean'}. Best is trial 57 with value: 0.7155963302752292.
[32m[I 2023-04-26 00:21:14,565][39m Trial 256 finished with value: 0.7027027027027026 and parameters: {'algorithm': 'ball_tree', 'n_neighbors': 12, 'weights': 'distance', 'metric': 'minkowski'}. Best is trial 57 with value: 0.7155963302752292.
[32m[I 2023-04-26 00:21:14,575][39m Trial 257 finished with value: 0.6964285714285714 and parameters: {'algorithm': 'auto', 'n_neighbors': 13, 'weights': 'distance', 'metric': 'minkowski'}. Best is trial 57 with value: 0.7155963302752292.
[32m[I 2023-04-26 00:21:14,585][39m Trial 258 finished with value: 0.7155963302752292 and parameters: {'algorithm': 'auto', 'n_neighbors': 14, 'weights': 'distance', 'metric': 'euclidean'}. Best is trial 57 with value: 0.7155963302752292.
[32m[I 2023-04-26 00:21:14,594][39m Trial 259 finished with value: 0.6964285714285714 and parameters: {'algorithm': 'auto', 'n_neighbors': 15, 'weights': 'distance', 'metric': 'euclidean'}. Best is trial 57 with value: 0.7155963302752292.
[32m[I 2023-04-26 00:21:14,610][39m Trial 260 finished with value: 0.6964285714285714 and parameters: {'algorithm': 'kd_tree', 'n_neighbors': 13, 'weights': 'distance', 'metric': 'euclidean'}. Best is trial 57 with value: 0.7155963302752292.
[32m[I 2023-04-26 00:21:14,621][39m Trial 261 finished with value: 0.6964285714285714 and parameters: {'algorithm': 'auto', 'n_neighbors': 15, 'weights': 'distance', 'metric': 'minkowski'}. Best is trial 57 with value: 0.7155963302752292.
[32m[I 2023-04-26 00:21:14,656][39m Trial 262 finished with value: 0.7155963302752292 and parameters: {'algorithm': 'brute', 'n_neighbors': 14, 'weights': 'distance', 'metric': 'minkowski'}. Best is trial 57 with value: 0.7155963302752292.
[32m[I 2023-04-26 00:21:14,676][39m Trial 263 finished with value: 0.6964285714285714 and parameters: {'algorithm': 'auto', 'n_neighbors': 13, 'weights': 'distance', 'metric': 'euclidean'}. Best is trial 57 with value: 0.7155963302752292.
[32m[I 2023-04-26 00:21:14,712][39m Trial 264 finished with value: 0.6964285714285714 and parameters: {'algorithm': 'brute', 'n_neighbors': 15, 'weights': 'distance', 'metric': 'euclidean'}. Best is trial 57 with value: 0.7155963302752292.
[32m[I 2023-04-26 00:21:14,731][39m Trial 265 finished with value: 0.7155963302752292 and parameters: {'algorithm': 'auto', 'n_neighbors': 14, 'weights': 'distance', 'metric': 'minkowski'}. Best is trial 57 with value: 0.7155963302752292.
[32m[I 2023-04-26 00:21:14,751][39m Trial 266 finished with value: 0.709090909090909 and parameters: {'algorithm': 'auto', 'n_neighbors': 16, 'weights': 'distance', 'metric': 'minkowski'}. Best is trial 57 with value: 0.7155963302752292.
[32m[I 2023-04-26 00:21:14,771][39m Trial 267 finished with value: 0.6964285714285714 and parameters: {'algorithm': 'auto', 'n_neighbors': 13, 'weights': 'distance', 'metric': 'minkowski'}. Best is trial 57 with value: 0.7155963302752292.
[32m[I 2023-04-26 00:21:14,807][39m Trial 268 finished with value: 0.7027027027027026 and parameters: {'algorithm': 'brute', 'n_neighbors': 14, 'weights': 'distance', 'metric': 'manhattan'}. Best is trial 57 with value: 0.7155963302752292.
[32m[I 2023-04-26 00:21:14,826][39m Trial 269 finished with value: 0.7155963302752292 and parameters: {'algorithm': 'auto', 'n_neighbors': 14, 'weights': 'distance', 'metric': 'minkowski'}. Best is trial 57 with value: 0.7155963302752292.
[32m[I 2023-04-26 00:21:14,846][39m Trial 270 finished with value: 0.7155963302752292 and parameters: {'algorithm': 'auto', 'n_neighbors': 14, 'weights': 'distance', 'metric': 'euclidean'}. Best is trial 57 with value: 0.7155963302752292.
[32m[I 2023-04-26 00:21:14,882][39m Trial 271 finished with value: 0.7155963302752292 and parameters: {'algorithm': 'brute', 'n_neighbors': 14, 'weights': 'distance', 'metric': 'euclidean'}. Best is trial 57 with value: 0.7155963302752292.
