[32m[I 2023-04-26 00:21:14,918][39m Trial 272 finished with value: 0.7155963302752292 and parameters: {'algorithm': 'brute', 'n_neighbors': 14, 'weights': 'distance', 'metric': 'euclidean'}. Best is trial 57 with value: 0.7155963302752292.
[32m[I 2023-04-26 00:21:14,941][39m Trial 273 finished with value: 0.6486486486486486 and parameters: {'algorithm': 'ball_tree', 'n_neighbors': 15, 'weights': 'uniform', 'metric': 'euclidean'}. Best is trial 57 with value: 0.7155963302752292.
[32m[I 2023-04-26 00:21:14,980][39m Trial 274 finished with value: 0.6964285714285714 and parameters: {'algorithm': 'brute', 'n_neighbors': 13, 'weights': 'distance', 'metric': 'minkowski'}. Best is trial 57 with value: 0.7155963302752292.
[32m[I 2023-04-26 00:21:15,016][39m Trial 275 finished with value: 0.6964285714285714 and parameters: {'algorithm': 'brute', 'n_neighbors': 15, 'weights': 'distance', 'metric': 'euclidean'}. Best is trial 57 with value: 0.7155963302752292.
[32m[I 2023-04-26 00:21:15,050][39m Trial 276 finished with value: 0.7027027027027026 and parameters: {'algorithm': 'brute', 'n_neighbors': 12, 'weights': 'distance', 'metric': 'euclidean'}. Best is trial 57 with value: 0.7155963302752292.
[32m[I 2023-04-26 00:21:15,070][39m Trial 277 finished with value: 0.7027027027027026 and parameters: {'algorithm': 'ball_tree', 'n_neighbors': 12, 'weights': 'distance', 'metric': 'minkowski'}. Best is trial 57 with value: 0.7155963302752292.
[32m[I 2023-04-26 00:21:15,091][39m Trial 278 finished with value: 0.709090909090909 and parameters: {'algorithm': 'auto', 'n_neighbors': 16, 'weights': 'distance', 'metric': 'minkowski'}. Best is trial 57 with value: 0.7155963302752292.
[32m[I 2023-04-26 00:21:15,127][39m Trial 279 finished with value: 0.7155963302752292 and parameters: {'algorithm': 'brute', 'n_neighbors': 14, 'weights': 'distance', 'metric': 'euclidean'}. Best is trial 57 with value: 0.7155963302752292.
[32m[I 2023-04-26 00:21:15,147][39m Trial 280 finished with value: 0.7155963302752292 and parameters: {'algorithm': 'ball_tree', 'n_neighbors': 14, 'weights': 'distance', 'metric': 'euclidean'}. Best is trial 57 with value: 0.7155963302752292.
[32m[I 2023-04-26 00:21:15,167][39m Trial 281 finished with value: 0.6964285714285714 and parameters: {'algorithm': 'ball_tree', 'n_neighbors': 13, 'weights': 'distance', 'metric': 'euclidean'}. Best is trial 57 with value: 0.7155963302752292.
[32m[I 2023-04-26 00:21:15,188][39m Trial 282 finished with value: 0.7155963302752292 and parameters: {'algorithm': 'kd_tree', 'n_neighbors': 14, 'weights': 'distance', 'metric': 'euclidean'}. Best is trial 57 with value: 0.7155963302752292.
[32m[I 2023-04-26 00:21:15,209][39m Trial 283 finished with value: 0.6964285714285714 and parameters: {'algorithm': 'auto', 'n_neighbors': 13, 'weights': 'distance', 'metric': 'euclidean'}. Best is trial 57 with value: 0.7155963302752292.
[32m[I 2023-04-26 00:21:15,229][39m Trial 284 finished with value: 0.7155963302752292 and parameters: {'algorithm': 'auto', 'n_neighbors': 14, 'weights': 'distance', 'metric': 'minkowski'}. Best is trial 57 with value: 0.7155963302752292.
[32m[I 2023-04-26 00:21:15,256][39m Trial 285 finished with value: 0.7155963302752292 and parameters: {'algorithm': 'brute', 'n_neighbors': 14, 'weights': 'distance', 'metric': 'euclidean'}. Best is trial 57 with value: 0.7155963302752292.
[32m[I 2023-04-26 00:21:15,276][39m Trial 286 finished with value: 0.6964285714285714 and parameters: {'algorithm': 'auto', 'n_neighbors': 15, 'weights': 'distance', 'metric': 'minkowski'}. Best is trial 57 with value: 0.7155963302752292.
[32m[I 2023-04-26 00:21:15,297][39m Trial 287 finished with value: 0.6964285714285714 and parameters: {'algorithm': 'auto', 'n_neighbors': 15, 'weights': 'distance', 'metric': 'minkowski'}. Best is trial 57 with value: 0.7155963302752292.
[32m[I 2023-04-26 00:21:15,318][39m Trial 288 finished with value: 0.6964285714285714 and parameters: {'algorithm': 'auto', 'n_neighbors': 13, 'weights': 'distance', 'metric': 'minkowski'}. Best is trial 57 with value: 0.7155963302752292.
[32m[I 2023-04-26 00:21:15,355][39m Trial 289 finished with value: 0.7027027027027026 and parameters: {'algorithm': 'brute', 'n_neighbors': 15, 'weights': 'distance', 'metric': 'manhattan'}. Best is trial 57 with value: 0.7155963302752292.
[32m[I 2023-04-26 00:21:15,386][39m Trial 290 finished with value: 0.6725663716814159 and parameters: {'algorithm': 'brute', 'n_neighbors': 13, 'weights': 'uniform', 'metric': 'euclidean'}. Best is trial 57 with value: 0.7155963302752292.
[32m[I 2023-04-26 00:21:15,397][39m Trial 291 finished with value: 0.7155963302752292 and parameters: {'algorithm': 'auto', 'n_neighbors': 14, 'weights': 'distance', 'metric': 'minkowski'}. Best is trial 57 with value: 0.7155963302752292.
[32m[I 2023-04-26 00:21:15,408][39m Trial 292 finished with value: 0.709090909090909 and parameters: {'algorithm': 'auto', 'n_neighbors': 16, 'weights': 'distance', 'metric': 'minkowski'}. Best is trial 57 with value: 0.7155963302752292.
[32m[I 2023-04-26 00:21:15,421][39m Trial 293 finished with value: 0.6964285714285714 and parameters: {'algorithm': 'auto', 'n_neighbors': 15, 'weights': 'distance', 'metric': 'minkowski'}. Best is trial 57 with value: 0.7155963302752292.
[32m[I 2023-04-26 00:21:15,430][39m Trial 294 finished with value: 0.6964285714285714 and parameters: {'algorithm': 'auto', 'n_neighbors': 13, 'weights': 'distance', 'metric': 'minkowski'}. Best is trial 57 with value: 0.7155963302752292.
[32m[I 2023-04-26 00:21:15,463][39m Trial 295 finished with value: 0.7027027027027026 and parameters: {'algorithm': 'brute', 'n_neighbors': 12, 'weights': 'distance', 'metric': 'euclidean'}. Best is trial 57 with value: 0.7155963302752292.
[32m[I 2023-04-26 00:21:15,503][39m Trial 296 finished with value: 0.6964285714285714 and parameters: {'algorithm': 'brute', 'n_neighbors': 15, 'weights': 'distance', 'metric': 'euclidean'}. Best is trial 57 with value: 0.7155963302752292.
[32m[I 2023-04-26 00:21:15,543][39m Trial 297 finished with value: 0.7155963302752292 and parameters: {'algorithm': 'brute', 'n_neighbors': 14, 'weights': 'distance', 'metric': 'euclidean'}. Best is trial 57 with value: 0.7155963302752292.
[32m[I 2023-04-26 00:21:15,564][39m Trial 298 finished with value: 0.6964285714285714 and parameters: {'algorithm': 'auto', 'n_neighbors': 13, 'weights': 'distance', 'metric': 'minkowski'}. Best is trial 57 with value: 0.7155963302752292.
[32m[I 2023-04-26 00:21:15,587][39m Trial 299 finished with value: 0.7155963302752292 and parameters: {'algorithm': 'auto', 'n_neighbors': 14, 'weights': 'distance', 'metric': 'euclidean'}. Best is trial 57 with value: 0.7155963302752292.
[32m[I 2023-04-26 00:21:15,608][39m Trial 300 finished with value: 0.7155963302752292 and parameters: {'algorithm': 'ball_tree', 'n_neighbors': 14, 'weights': 'distance', 'metric': 'minkowski'}. Best is trial 57 with value: 0.7155963302752292.
[32m[I 2023-04-26 00:21:15,628][39m Trial 301 finished with value: 0.7155963302752292 and parameters: {'algorithm': 'auto', 'n_neighbors': 14, 'weights': 'distance', 'metric': 'euclidean'}. Best is trial 57 with value: 0.7155963302752292.
[32m[I 2023-04-26 00:21:15,649][39m Trial 302 finished with value: 0.6964285714285714 and parameters: {'algorithm': 'ball_tree', 'n_neighbors': 15, 'weights': 'distance', 'metric': 'euclidean'}. Best is trial 57 with value: 0.7155963302752292.
[32m[I 2023-04-26 00:21:15,662][39m Trial 303 finished with value: 0.6964285714285714 and parameters: {'algorithm': 'auto', 'n_neighbors': 13, 'weights': 'distance', 'metric': 'minkowski'}. Best is trial 57 with value: 0.7155963302752292.
[32m[I 2023-04-26 00:21:15,675][39m Trial 304 finished with value: 0.709090909090909 and parameters: {'algorithm': 'auto', 'n_neighbors': 16, 'weights': 'distance', 'metric': 'minkowski'}. Best is trial 57 with value: 0.7155963302752292.
[32m[I 2023-04-26 00:21:15,699][39m Trial 305 finished with value: 0.6964285714285714 and parameters: {'algorithm': 'auto', 'n_neighbors': 15, 'weights': 'distance', 'metric': 'euclidean'}. Best is trial 57 with value: 0.7155963302752292.
[32m[I 2023-04-26 00:21:15,732][39m Trial 306 finished with value: 0.7155963302752292 and parameters: {'algorithm': 'brute', 'n_neighbors': 14, 'weights': 'distance', 'metric': 'euclidean'}. Best is trial 57 with value: 0.7155963302752292.
[32m[I 2023-04-26 00:21:15,768][39m Trial 307 finished with value: 0.7155963302752292 and parameters: {'algorithm': 'brute', 'n_neighbors': 14, 'weights': 'distance', 'metric': 'euclidean'}. Best is trial 57 with value: 0.7155963302752292.
[32m[I 2023-04-26 00:21:15,806][39m Trial 308 finished with value: 0.7155963302752292 and parameters: {'algorithm': 'brute', 'n_neighbors': 14, 'weights': 'distance', 'metric': 'euclidean'}. Best is trial 57 with value: 0.7155963302752292.
[32m[I 2023-04-26 00:21:15,843][39m Trial 309 finished with value: 0.6964285714285714 and parameters: {'algorithm': 'brute', 'n_neighbors': 13, 'weights': 'distance', 'metric': 'euclidean'}. Best is trial 57 with value: 0.7155963302752292.
[32m[I 2023-04-26 00:21:15,864][39m Trial 310 finished with value: 0.7155963302752292 and parameters: {'algorithm': 'kd_tree', 'n_neighbors': 14, 'weights': 'distance', 'metric': 'euclidean'}. Best is trial 57 with value: 0.7155963302752292.
[32m[I 2023-04-26 00:21:15,887][39m Trial 311 finished with value: 0.6964285714285714 and parameters: {'algorithm': 'kd_tree', 'n_neighbors': 15, 'weights': 'distance', 'metric': 'euclidean'}. Best is trial 57 with value: 0.7155963302752292.
[32m[I 2023-04-26 00:21:15,908][39m Trial 312 finished with value: 0.6909090909090909 and parameters: {'algorithm': 'kd_tree', 'n_neighbors': 11, 'weights': 'distance', 'metric': 'minkowski'}. Best is trial 57 with value: 0.7155963302752292.
[32m[I 2023-04-26 00:21:15,946][39m Trial 313 finished with value: 0.6964285714285714 and parameters: {'algorithm': 'brute', 'n_neighbors': 13, 'weights': 'distance', 'metric': 'euclidean'}. Best is trial 57 with value: 0.7155963302752292.
[32m[I 2023-04-26 00:21:15,971][39m Trial 314 finished with value: 0.577319587628866 and parameters: {'algorithm': 'auto', 'n_neighbors': 12, 'weights': 'uniform', 'metric': 'manhattan'}. Best is trial 57 with value: 0.7155963302752292.
[32m[I 2023-04-26 00:21:15,994][39m Trial 315 finished with value: 0.7155963302752292 and parameters: {'algorithm': 'ball_tree', 'n_neighbors': 14, 'weights': 'distance', 'metric': 'minkowski'}. Best is trial 57 with value: 0.7155963302752292.
[32m[I 2023-04-26 00:21:16,016][39m Trial 316 finished with value: 0.7155963302752292 and parameters: {'algorithm': 'ball_tree', 'n_neighbors': 14, 'weights': 'distance', 'metric': 'euclidean'}. Best is trial 57 with value: 0.7155963302752292.
[32m[I 2023-04-26 00:21:16,038][39m Trial 317 finished with value: 0.6964285714285714 and parameters: {'algorithm': 'ball_tree', 'n_neighbors': 15, 'weights': 'distance', 'metric': 'euclidean'}. Best is trial 57 with value: 0.7155963302752292.
[32m[I 2023-04-26 00:21:16,051][39m Trial 318 finished with value: 0.709090909090909 and parameters: {'algorithm': 'ball_tree', 'n_neighbors': 16, 'weights': 'distance', 'metric': 'euclidean'}. Best is trial 57 with value: 0.7155963302752292.
[32m[I 2023-04-26 00:21:16,063][39m Trial 319 finished with value: 0.6964285714285714 and parameters: {'algorithm': 'auto', 'n_neighbors': 13, 'weights': 'distance', 'metric': 'minkowski'}. Best is trial 57 with value: 0.7155963302752292.
[32m[I 2023-04-26 00:21:16,074][39m Trial 320 finished with value: 0.7155963302752292 and parameters: {'algorithm': 'kd_tree', 'n_neighbors': 14, 'weights': 'distance', 'metric': 'euclidean'}. Best is trial 57 with value: 0.7155963302752292.
[32m[I 2023-04-26 00:21:16,084][39m Trial 321 finished with value: 0.6964285714285714 and parameters: {'algorithm': 'kd_tree', 'n_neighbors': 15, 'weights': 'distance', 'metric': 'minkowski'}. Best is trial 57 with value: 0.7155963302752292.
[32m[I 2023-04-26 00:21:16,113][39m Trial 322 finished with value: 0.6964285714285714 and parameters: {'algorithm': 'brute', 'n_neighbors': 13, 'weights': 'distance', 'metric': 'euclidean'}. Best is trial 57 with value: 0.7155963302752292.
[32m[I 2023-04-26 00:21:16,151][39m Trial 323 finished with value: 0.7155963302752292 and parameters: {'algorithm': 'brute', 'n_neighbors': 14, 'weights': 'distance', 'metric': 'euclidean'}. Best is trial 57 with value: 0.7155963302752292.
[32m[I 2023-04-26 00:21:16,190][39m Trial 324 finished with value: 0.7027027027027026 and parameters: {'algorithm': 'brute', 'n_neighbors': 12, 'weights': 'distance', 'metric': 'euclidean'}. Best is trial 57 with value: 0.7155963302752292.
[32m[I 2023-04-26 00:21:16,212][39m Trial 325 finished with value: 0.6964285714285714 and parameters: {'algorithm': 'auto', 'n_neighbors': 15, 'weights': 'distance', 'metric': 'minkowski'}. Best is trial 57 with value: 0.7155963302752292.
[32m[I 2023-04-26 00:21:16,233][39m Trial 326 finished with value: 0.6964285714285714 and parameters: {'algorithm': 'auto', 'n_neighbors': 13, 'weights': 'distance', 'metric': 'minkowski'}. Best is trial 57 with value: 0.7155963302752292.
[32m[I 2023-04-26 00:21:16,255][39m Trial 327 finished with value: 0.7155963302752292 and parameters: {'algorithm': 'kd_tree', 'n_neighbors': 14, 'weights': 'distance', 'metric': 'euclidean'}. Best is trial 57 with value: 0.7155963302752292.
[32m[I 2023-04-26 00:21:16,277][39m Trial 328 finished with value: 0.7155963302752292 and parameters: {'algorithm': 'kd_tree', 'n_neighbors': 14, 'weights': 'distance', 'metric': 'minkowski'}. Best is trial 57 with value: 0.7155963302752292.
[32m[I 2023-04-26 00:21:16,296][39m Trial 329 finished with value: 0.7155963302752292 and parameters: {'algorithm': 'auto', 'n_neighbors': 14, 'weights': 'distance', 'metric': 'minkowski'}. Best is trial 57 with value: 0.7155963302752292.
[32m[I 2023-04-26 00:21:16,308][39m Trial 330 finished with value: 0.6964285714285714 and parameters: {'algorithm': 'auto', 'n_neighbors': 15, 'weights': 'distance', 'metric': 'minkowski'}. Best is trial 57 with value: 0.7155963302752292.
[32m[I 2023-04-26 00:21:16,320][39m Trial 331 finished with value: 0.6964285714285714 and parameters: {'algorithm': 'auto', 'n_neighbors': 13, 'weights': 'distance', 'metric': 'minkowski'}. Best is trial 57 with value: 0.7155963302752292.
[32m[I 2023-04-26 00:21:16,332][39m Trial 332 finished with value: 0.6964285714285714 and parameters: {'algorithm': 'auto', 'n_neighbors': 15, 'weights': 'distance', 'metric': 'minkowski'}. Best is trial 57 with value: 0.7155963302752292.
[32m[I 2023-04-26 00:21:16,344][39m Trial 333 finished with value: 0.5858585858585859 and parameters: {'algorithm': 'auto', 'n_neighbors': 16, 'weights': 'uniform', 'metric': 'minkowski'}. Best is trial 57 with value: 0.7155963302752292.
[32m[I 2023-04-26 00:21:16,354][39m Trial 334 finished with value: 0.6964285714285714 and parameters: {'algorithm': 'auto', 'n_neighbors': 13, 'weights': 'distance', 'metric': 'minkowski'}. Best is trial 57 with value: 0.7155963302752292.
[32m[I 2023-04-26 00:21:16,365][39m Trial 335 finished with value: 0.7155963302752292 and parameters: {'algorithm': 'ball_tree', 'n_neighbors': 14, 'weights': 'distance', 'metric': 'euclidean'}. Best is trial 57 with value: 0.7155963302752292.
[32m[I 2023-04-26 00:21:16,396][39m Trial 336 finished with value: 0.7155963302752292 and parameters: {'algorithm': 'brute', 'n_neighbors': 14, 'weights': 'distance', 'metric': 'euclidean'}. Best is trial 57 with value: 0.7155963302752292.
[32m[I 2023-04-26 00:21:16,438][39m Trial 337 finished with value: 0.6964285714285714 and parameters: {'algorithm': 'brute', 'n_neighbors': 15, 'weights': 'distance', 'metric': 'euclidean'}. Best is trial 57 with value: 0.7155963302752292.
[32m[I 2023-04-26 00:21:16,460][39m Trial 338 finished with value: 0.7155963302752292 and parameters: {'algorithm': 'auto', 'n_neighbors': 14, 'weights': 'distance', 'metric': 'euclidean'}. Best is trial 57 with value: 0.7155963302752292.
[32m[I 2023-04-26 00:21:16,482][39m Trial 339 finished with value: 0.7027027027027026 and parameters: {'algorithm': 'auto', 'n_neighbors': 12, 'weights': 'distance', 'metric': 'euclidean'}. Best is trial 57 with value: 0.7155963302752292.
[32m[I 2023-04-26 00:21:16,504][39m Trial 340 finished with value: 0.6964285714285714 and parameters: {'algorithm': 'kd_tree', 'n_neighbors': 13, 'weights': 'distance', 'metric': 'euclidean'}. Best is trial 57 with value: 0.7155963302752292.
[32m[I 2023-04-26 00:21:16,526][39m Trial 341 finished with value: 0.7155963302752292 and parameters: {'algorithm': 'auto', 'n_neighbors': 14, 'weights': 'distance', 'metric': 'euclidean'}. Best is trial 57 with value: 0.7155963302752292.
[32m[I 2023-04-26 00:21:16,544][39m Trial 342 finished with value: 0.7155963302752292 and parameters: {'algorithm': 'ball_tree', 'n_neighbors': 14, 'weights': 'distance', 'metric': 'euclidean'}. Best is trial 57 with value: 0.7155963302752292.
[32m[I 2023-04-26 00:21:16,575][39m Trial 343 finished with value: 0.6964285714285714 and parameters: {'algorithm': 'brute', 'n_neighbors': 13, 'weights': 'distance', 'metric': 'euclidean'}. Best is trial 57 with value: 0.7155963302752292.
[32m[I 2023-04-26 00:21:16,597][39m Trial 344 finished with value: 0.6964285714285714 and parameters: {'algorithm': 'ball_tree', 'n_neighbors': 15, 'weights': 'distance', 'metric': 'euclidean'}. Best is trial 57 with value: 0.7155963302752292.
[32m[I 2023-04-26 00:21:16,620][39m Trial 345 finished with value: 0.6964285714285714 and parameters: {'algorithm': 'ball_tree', 'n_neighbors': 29, 'weights': 'distance', 'metric': 'euclidean'}. Best is trial 57 with value: 0.7155963302752292.
[32m[I 2023-04-26 00:21:16,642][39m Trial 346 finished with value: 0.7155963302752292 and parameters: {'algorithm': 'ball_tree', 'n_neighbors': 14, 'weights': 'distance', 'metric': 'euclidean'}. Best is trial 57 with value: 0.7155963302752292.
[32m[I 2023-04-26 00:21:16,663][39m Trial 347 finished with value: 0.6964285714285714 and parameters: {'algorithm': 'ball_tree', 'n_neighbors': 15, 'weights': 'distance', 'metric': 'euclidean'}. Best is trial 57 with value: 0.7155963302752292.
[32m[I 2023-04-26 00:21:16,683][39m Trial 348 finished with value: 0.709090909090909 and parameters: {'algorithm': 'ball_tree', 'n_neighbors': 16, 'weights': 'distance', 'metric': 'euclidean'}. Best is trial 57 with value: 0.7155963302752292.
[32m[I 2023-04-26 00:21:16,696][39m Trial 349 finished with value: 0.6964285714285714 and parameters: {'algorithm': 'kd_tree', 'n_neighbors': 17, 'weights': 'distance', 'metric': 'manhattan'}. Best is trial 57 with value: 0.7155963302752292.
[32m[I 2023-04-26 00:21:16,707][39m Trial 350 finished with value: 0.7155963302752292 and parameters: {'algorithm': 'auto', 'n_neighbors': 14, 'weights': 'distance', 'metric': 'euclidean'}. Best is trial 57 with value: 0.7155963302752292.
[32m[I 2023-04-26 00:21:16,718][39m Trial 351 finished with value: 0.7155963302752292 and parameters: {'algorithm': 'kd_tree', 'n_neighbors': 14, 'weights': 'distance', 'metric': 'euclidean'}. Best is trial 57 with value: 0.7155963302752292.
[32m[I 2023-04-26 00:21:16,728][39m Trial 352 finished with value: 0.6964285714285714 and parameters: {'algorithm': 'kd_tree', 'n_neighbors': 13, 'weights': 'distance', 'metric': 'euclidean'}. Best is trial 57 with value: 0.7155963302752292.
[32m[I 2023-04-26 00:21:16,743][39m Trial 353 finished with value: 0.6486486486486486 and parameters: {'algorithm': 'kd_tree', 'n_neighbors': 15, 'weights': 'uniform', 'metric': 'euclidean'}. Best is trial 57 with value: 0.7155963302752292.
[32m[I 2023-04-26 00:21:16,757][39m Trial 354 finished with value: 0.6964285714285714 and parameters: {'algorithm': 'ball_tree', 'n_neighbors': 13, 'weights': 'distance', 'metric': 'euclidean'}. Best is trial 57 with value: 0.7155963302752292.
[32m[I 2023-04-26 00:21:16,772][39m Trial 355 finished with value: 0.6964285714285714 and parameters: {'algorithm': 'kd_tree', 'n_neighbors': 15, 'weights': 'distance', 'metric': 'minkowski'}. Best is trial 57 with value: 0.7155963302752292.
[32m[I 2023-04-26 00:21:16,784][39m Trial 356 finished with value: 0.6964285714285714 and parameters: {'algorithm': 'kd_tree', 'n_neighbors': 13, 'weights': 'distance', 'metric': 'minkowski'}. Best is trial 57 with value: 0.7155963302752292.
[32m[I 2023-04-26 00:21:16,795][39m Trial 357 finished with value: 0.7027027027027026 and parameters: {'algorithm': 'kd_tree', 'n_neighbors': 20, 'weights': 'distance', 'metric': 'minkowski'}. Best is trial 57 with value: 0.7155963302752292.
[32m[I 2023-04-26 00:21:16,805][39m Trial 358 finished with value: 0.7027027027027026 and parameters: {'algorithm': 'auto', 'n_neighbors': 12, 'weights': 'distance', 'metric': 'manhattan'}. Best is trial 57 with value: 0.7155963302752292.
[32m[I 2023-04-26 00:21:16,837][39m Trial 359 finished with value: 0.7155963302752292 and parameters: {'algorithm': 'brute', 'n_neighbors': 14, 'weights': 'distance', 'metric': 'minkowski'}. Best is trial 57 with value: 0.7155963302752292.
[32m[I 2023-04-26 00:21:16,880][39m Trial 360 finished with value: 0.7155963302752292 and parameters: {'algorithm': 'brute', 'n_neighbors': 14, 'weights': 'distance', 'metric': 'euclidean'}. Best is trial 57 with value: 0.7155963302752292.
[32m[I 2023-04-26 00:21:16,921][39m Trial 361 finished with value: 0.6964285714285714 and parameters: {'algorithm': 'brute', 'n_neighbors': 15, 'weights': 'distance', 'metric': 'minkowski'}. Best is trial 57 with value: 0.7155963302752292.
