[32m[I 2023-04-26 15:46:54,352][39m Trial 304 finished with value: 0.7500000000000001 and parameters: {'algorithm': 'auto', 'n_neighbors': 9, 'weights': 'uniform', 'metric': 'manhattan'}. Best is trial 6 with value: 0.8.
[32m[I 2023-04-26 15:46:54,367][39m Trial 305 finished with value: 0.8 and parameters: {'algorithm': 'ball_tree', 'n_neighbors': 4, 'weights': 'distance', 'metric': 'minkowski'}. Best is trial 6 with value: 0.8.
[32m[I 2023-04-26 15:46:54,430][39m Trial 306 finished with value: 0.8 and parameters: {'algorithm': 'brute', 'n_neighbors': 2, 'weights': 'distance', 'metric': 'minkowski'}. Best is trial 6 with value: 0.8.
[32m[I 2023-04-26 15:46:54,508][39m Trial 307 finished with value: 0.8 and parameters: {'algorithm': 'brute', 'n_neighbors': 3, 'weights': 'distance', 'metric': 'minkowski'}. Best is trial 6 with value: 0.8.
[32m[I 2023-04-26 15:46:54,571][39m Trial 308 finished with value: 0.8 and parameters: {'algorithm': 'brute', 'n_neighbors': 3, 'weights': 'distance', 'metric': 'minkowski'}. Best is trial 6 with value: 0.8.
[32m[I 2023-04-26 15:46:54,634][39m Trial 309 finished with value: 0.7901234567901235 and parameters: {'algorithm': 'brute', 'n_neighbors': 5, 'weights': 'distance', 'metric': 'minkowski'}. Best is trial 6 with value: 0.8.
[32m[I 2023-04-26 15:46:54,665][39m Trial 310 finished with value: 0.8 and parameters: {'algorithm': 'kd_tree', 'n_neighbors': 4, 'weights': 'distance', 'metric': 'euclidean'}. Best is trial 6 with value: 0.8.
[32m[I 2023-04-26 15:46:54,681][39m Trial 311 finished with value: 0.8 and parameters: {'algorithm': 'ball_tree', 'n_neighbors': 4, 'weights': 'distance', 'metric': 'minkowski'}. Best is trial 6 with value: 0.8.
[32m[I 2023-04-26 15:46:54,712][39m Trial 312 finished with value: 0.8 and parameters: {'algorithm': 'ball_tree', 'n_neighbors': 2, 'weights': 'distance', 'metric': 'minkowski'}. Best is trial 6 with value: 0.8.
[32m[I 2023-04-26 15:46:54,728][39m Trial 313 finished with value: 0.8 and parameters: {'algorithm': 'ball_tree', 'n_neighbors': 3, 'weights': 'distance', 'metric': 'minkowski'}. Best is trial 6 with value: 0.8.
[32m[I 2023-04-26 15:46:54,759][39m Trial 314 finished with value: 0.7901234567901235 and parameters: {'algorithm': 'kd_tree', 'n_neighbors': 5, 'weights': 'distance', 'metric': 'euclidean'}. Best is trial 6 with value: 0.8.
[32m[I 2023-04-26 15:46:54,791][39m Trial 315 finished with value: 0.7532467532467532 and parameters: {'algorithm': 'kd_tree', 'n_neighbors': 5, 'weights': 'uniform', 'metric': 'euclidean'}. Best is trial 6 with value: 0.8.
[32m[I 2023-04-26 15:46:54,838][39m Trial 316 finished with value: 0.8 and parameters: {'algorithm': 'brute', 'n_neighbors': 1, 'weights': 'uniform', 'metric': 'minkowski'}. Best is trial 6 with value: 0.8.
[32m[I 2023-04-26 15:46:54,870][39m Trial 317 finished with value: 0.8 and parameters: {'algorithm': 'ball_tree', 'n_neighbors': 4, 'weights': 'distance', 'metric': 'euclidean'}. Best is trial 6 with value: 0.8.
[32m[I 2023-04-26 15:46:54,895][39m Trial 318 finished with value: 0.7948717948717948 and parameters: {'algorithm': 'ball_tree', 'n_neighbors': 6, 'weights': 'distance', 'metric': 'euclidean'}. Best is trial 6 with value: 0.8.
[32m[I 2023-04-26 15:46:54,917][39m Trial 319 finished with value: 0.6913580246913581 and parameters: {'algorithm': 'kd_tree', 'n_neighbors': 13, 'weights': 'distance', 'metric': 'euclidean'}. Best is trial 6 with value: 0.8.
[32m[I 2023-04-26 15:46:54,964][39m Trial 320 finished with value: 0.8 and parameters: {'algorithm': 'auto', 'n_neighbors': 1, 'weights': 'distance', 'metric': 'manhattan'}. Best is trial 6 with value: 0.8.
[32m[I 2023-04-26 15:46:55,042][39m Trial 321 finished with value: 0.8 and parameters: {'algorithm': 'brute', 'n_neighbors': 1, 'weights': 'uniform', 'metric': 'manhattan'}. Best is trial 6 with value: 0.8.
[32m[I 2023-04-26 15:46:55,089][39m Trial 322 finished with value: 0.8 and parameters: {'algorithm': 'brute', 'n_neighbors': 1, 'weights': 'uniform', 'metric': 'manhattan'}. Best is trial 6 with value: 0.8.
[32m[I 2023-04-26 15:46:55,152][39m Trial 323 finished with value: 0.8 and parameters: {'algorithm': 'brute', 'n_neighbors': 4, 'weights': 'distance', 'metric': 'euclidean'}. Best is trial 6 with value: 0.8.
[32m[I 2023-04-26 15:46:55,199][39m Trial 324 finished with value: 0.8 and parameters: {'algorithm': 'brute', 'n_neighbors': 4, 'weights': 'distance', 'metric': 'euclidean'}. Best is trial 6 with value: 0.8.
[32m[I 2023-04-26 15:46:55,261][39m Trial 325 finished with value: 0.8 and parameters: {'algorithm': 'brute', 'n_neighbors': 4, 'weights': 'distance', 'metric': 'euclidean'}. Best is trial 6 with value: 0.8.
[32m[I 2023-04-26 15:46:55,324][39m Trial 326 finished with value: 0.7948717948717948 and parameters: {'algorithm': 'brute', 'n_neighbors': 6, 'weights': 'distance', 'metric': 'euclidean'}. Best is trial 6 with value: 0.8.
[32m[I 2023-04-26 15:46:55,386][39m Trial 327 finished with value: 0.7323943661971831 and parameters: {'algorithm': 'brute', 'n_neighbors': 2, 'weights': 'uniform', 'metric': 'minkowski'}. Best is trial 6 with value: 0.8.
[32m[I 2023-04-26 15:46:55,417][39m Trial 328 finished with value: 0.8 and parameters: {'algorithm': 'auto', 'n_neighbors': 1, 'weights': 'uniform', 'metric': 'manhattan'}. Best is trial 6 with value: 0.8.
[32m[I 2023-04-26 15:46:55,449][39m Trial 329 finished with value: 0.8 and parameters: {'algorithm': 'ball_tree', 'n_neighbors': 4, 'weights': 'distance', 'metric': 'minkowski'}. Best is trial 6 with value: 0.8.
[32m[I 2023-04-26 15:46:55,480][39m Trial 330 finished with value: 0.8 and parameters: {'algorithm': 'ball_tree', 'n_neighbors': 4, 'weights': 'distance', 'metric': 'minkowski'}. Best is trial 6 with value: 0.8.
[32m[I 2023-04-26 15:46:55,495][39m Trial 331 finished with value: 0.8 and parameters: {'algorithm': 'ball_tree', 'n_neighbors': 3, 'weights': 'distance', 'metric': 'minkowski'}. Best is trial 6 with value: 0.8.
[32m[I 2023-04-26 15:46:55,527][39m Trial 332 finished with value: 0.7901234567901235 and parameters: {'algorithm': 'ball_tree', 'n_neighbors': 5, 'weights': 'distance', 'metric': 'minkowski'}. Best is trial 6 with value: 0.8.
[32m[I 2023-04-26 15:46:55,574][39m Trial 333 finished with value: 0.8 and parameters: {'algorithm': 'ball_tree', 'n_neighbors': 1, 'weights': 'uniform', 'metric': 'minkowski'}. Best is trial 6 with value: 0.8.
[32m[I 2023-04-26 15:46:55,590][39m Trial 334 finished with value: 0.8 and parameters: {'algorithm': 'ball_tree', 'n_neighbors': 2, 'weights': 'distance', 'metric': 'minkowski'}. Best is trial 6 with value: 0.8.
[32m[I 2023-04-26 15:46:55,628][39m Trial 335 finished with value: 0.8 and parameters: {'algorithm': 'ball_tree', 'n_neighbors': 2, 'weights': 'distance', 'metric': 'minkowski'}. Best is trial 6 with value: 0.8.
[32m[I 2023-04-26 15:46:55,726][39m Trial 336 finished with value: 0.8 and parameters: {'algorithm': 'auto', 'n_neighbors': 2, 'weights': 'distance', 'metric': 'minkowski'}. Best is trial 6 with value: 0.8.
[32m[I 2023-04-26 15:46:55,794][39m Trial 337 finished with value: 0.6930693069306931 and parameters: {'algorithm': 'ball_tree', 'n_neighbors': 20, 'weights': 'uniform', 'metric': 'euclidean'}. Best is trial 6 with value: 0.8.
[32m[I 2023-04-26 15:46:55,826][39m Trial 338 finished with value: 0.8 and parameters: {'algorithm': 'ball_tree', 'n_neighbors': 3, 'weights': 'distance', 'metric': 'minkowski'}. Best is trial 6 with value: 0.8.
[32m[I 2023-04-26 15:46:55,842][39m Trial 339 finished with value: 0.8 and parameters: {'algorithm': 'ball_tree', 'n_neighbors': 3, 'weights': 'distance', 'metric': 'minkowski'}. Best is trial 6 with value: 0.8.
[32m[I 2023-04-26 15:46:55,873][39m Trial 340 finished with value: 0.8 and parameters: {'algorithm': 'ball_tree', 'n_neighbors': 3, 'weights': 'distance', 'metric': 'minkowski'}. Best is trial 6 with value: 0.8.
[32m[I 2023-04-26 15:46:55,904][39m Trial 341 finished with value: 0.8 and parameters: {'algorithm': 'kd_tree', 'n_neighbors': 3, 'weights': 'distance', 'metric': 'euclidean'}. Best is trial 6 with value: 0.8.
[32m[I 2023-04-26 15:46:55,936][39m Trial 342 finished with value: 0.8 and parameters: {'algorithm': 'kd_tree', 'n_neighbors': 2, 'weights': 'distance', 'metric': 'euclidean'}. Best is trial 6 with value: 0.8.
[32m[I 2023-04-26 15:46:55,967][39m Trial 343 finished with value: 0.8 and parameters: {'algorithm': 'kd_tree', 'n_neighbors': 2, 'weights': 'distance', 'metric': 'minkowski'}. Best is trial 6 with value: 0.8.
[32m[I 2023-04-26 15:46:55,983][39m Trial 344 finished with value: 0.8 and parameters: {'algorithm': 'kd_tree', 'n_neighbors': 2, 'weights': 'distance', 'metric': 'minkowski'}. Best is trial 6 with value: 0.8.
[32m[I 2023-04-26 15:46:56,014][39m Trial 345 finished with value: 0.8 and parameters: {'algorithm': 'kd_tree', 'n_neighbors': 2, 'weights': 'distance', 'metric': 'minkowski'}. Best is trial 6 with value: 0.8.
[32m[I 2023-04-26 15:46:56,045][39m Trial 346 finished with value: 0.8 and parameters: {'algorithm': 'kd_tree', 'n_neighbors': 2, 'weights': 'distance', 'metric': 'minkowski'}. Best is trial 6 with value: 0.8.
[32m[I 2023-04-26 15:46:56,061][39m Trial 347 finished with value: 0.8 and parameters: {'algorithm': 'kd_tree', 'n_neighbors': 2, 'weights': 'distance', 'metric': 'minkowski'}. Best is trial 6 with value: 0.8.
[32m[I 2023-04-26 15:46:56,092][39m Trial 348 finished with value: 0.8 and parameters: {'algorithm': 'kd_tree', 'n_neighbors': 1, 'weights': 'distance', 'metric': 'minkowski'}. Best is trial 6 with value: 0.8.
[32m[I 2023-04-26 15:46:56,155][39m Trial 349 finished with value: 0.8 and parameters: {'algorithm': 'brute', 'n_neighbors': 1, 'weights': 'uniform', 'metric': 'manhattan'}. Best is trial 6 with value: 0.8.
[32m[I 2023-04-26 15:46:56,249][39m Trial 350 finished with value: 0.8 and parameters: {'algorithm': 'brute', 'n_neighbors': 1, 'weights': 'uniform', 'metric': 'minkowski'}. Best is trial 6 with value: 0.8.
[32m[I 2023-04-26 15:46:56,295][39m Trial 351 finished with value: 0.7692307692307694 and parameters: {'algorithm': 'brute', 'n_neighbors': 3, 'weights': 'uniform', 'metric': 'manhattan'}. Best is trial 6 with value: 0.8.
[32m[I 2023-04-26 15:46:56,358][39m Trial 352 finished with value: 0.8 and parameters: {'algorithm': 'auto', 'n_neighbors': 1, 'weights': 'uniform', 'metric': 'manhattan'}. Best is trial 6 with value: 0.8.
[32m[I 2023-04-26 15:46:56,420][39m Trial 353 finished with value: 0.7594936708860759 and parameters: {'algorithm': 'brute', 'n_neighbors': 5, 'weights': 'distance', 'metric': 'manhattan'}. Best is trial 6 with value: 0.8.
[32m[I 2023-04-26 15:46:56,499][39m Trial 354 finished with value: 0.8 and parameters: {'algorithm': 'auto', 'n_neighbors': 1, 'weights': 'uniform', 'metric': 'manhattan'}. Best is trial 6 with value: 0.8.
[32m[I 2023-04-26 15:46:56,514][39m Trial 355 finished with value: 0.8 and parameters: {'algorithm': 'kd_tree', 'n_neighbors': 4, 'weights': 'distance', 'metric': 'minkowski'}. Best is trial 6 with value: 0.8.
[32m[I 2023-04-26 15:46:56,561][39m Trial 356 finished with value: 0.7848101265822786 and parameters: {'algorithm': 'brute', 'n_neighbors': 3, 'weights': 'distance', 'metric': 'manhattan'}. Best is trial 6 with value: 0.8.
[32m[I 2023-04-26 15:46:56,624][39m Trial 357 finished with value: 0.8 and parameters: {'algorithm': 'auto', 'n_neighbors': 1, 'weights': 'distance', 'metric': 'manhattan'}. Best is trial 6 with value: 0.8.
[32m[I 2023-04-26 15:46:56,671][39m Trial 358 finished with value: 0.8 and parameters: {'algorithm': 'kd_tree', 'n_neighbors': 4, 'weights': 'distance', 'metric': 'euclidean'}. Best is trial 6 with value: 0.8.
[32m[I 2023-04-26 15:46:56,719][39m Trial 359 finished with value: 0.8 and parameters: {'algorithm': 'auto', 'n_neighbors': 1, 'weights': 'uniform', 'metric': 'manhattan'}. Best is trial 6 with value: 0.8.
[32m[I 2023-04-26 15:46:56,766][39m Trial 360 finished with value: 0.8 and parameters: {'algorithm': 'auto', 'n_neighbors': 1, 'weights': 'uniform', 'metric': 'manhattan'}. Best is trial 6 with value: 0.8.
[32m[I 2023-04-26 15:46:56,838][39m Trial 361 finished with value: 0.8 and parameters: {'algorithm': 'brute', 'n_neighbors': 1, 'weights': 'uniform', 'metric': 'minkowski'}. Best is trial 6 with value: 0.8.
[32m[I 2023-04-26 15:46:56,907][39m Trial 362 finished with value: 0.8 and parameters: {'algorithm': 'brute', 'n_neighbors': 1, 'weights': 'uniform', 'metric': 'euclidean'}. Best is trial 6 with value: 0.8.
[32m[I 2023-04-26 15:46:56,954][39m Trial 363 finished with value: 0.7428571428571429 and parameters: {'algorithm': 'brute', 'n_neighbors': 2, 'weights': 'uniform', 'metric': 'manhattan'}. Best is trial 6 with value: 0.8.
[32m[I 2023-04-26 15:46:57,095][39m Trial 364 finished with value: 0.8 and parameters: {'algorithm': 'auto', 'n_neighbors': 3, 'weights': 'distance', 'metric': 'minkowski'}. Best is trial 6 with value: 0.8.
[32m[I 2023-04-26 15:46:57,142][39m Trial 365 finished with value: 0.8 and parameters: {'algorithm': 'brute', 'n_neighbors': 1, 'weights': 'uniform', 'metric': 'euclidean'}. Best is trial 6 with value: 0.8.
[32m[I 2023-04-26 15:46:57,188][39m Trial 366 finished with value: 0.7532467532467532 and parameters: {'algorithm': 'brute', 'n_neighbors': 5, 'weights': 'uniform', 'metric': 'euclidean'}. Best is trial 6 with value: 0.8.
[32m[I 2023-04-26 15:46:57,282][39m Trial 367 finished with value: 0.8 and parameters: {'algorithm': 'auto', 'n_neighbors': 2, 'weights': 'distance', 'metric': 'minkowski'}. Best is trial 6 with value: 0.8.
[32m[I 2023-04-26 15:46:57,360][39m Trial 368 finished with value: 0.7323943661971831 and parameters: {'algorithm': 'brute', 'n_neighbors': 2, 'weights': 'uniform', 'metric': 'euclidean'}. Best is trial 6 with value: 0.8.
[32m[I 2023-04-26 15:46:57,438][39m Trial 369 finished with value: 0.7901234567901235 and parameters: {'algorithm': 'auto', 'n_neighbors': 5, 'weights': 'distance', 'metric': 'euclidean'}. Best is trial 6 with value: 0.8.
[32m[I 2023-04-26 15:46:57,563][39m Trial 370 finished with value: 0.8 and parameters: {'algorithm': 'auto', 'n_neighbors': 1, 'weights': 'uniform', 'metric': 'manhattan'}. Best is trial 6 with value: 0.8.
[32m[I 2023-04-26 15:46:57,626][39m Trial 371 finished with value: 0.7323943661971831 and parameters: {'algorithm': 'brute', 'n_neighbors': 2, 'weights': 'uniform', 'metric': 'euclidean'}. Best is trial 6 with value: 0.8.
[32m[I 2023-04-26 15:46:57,657][39m Trial 372 finished with value: 0.8 and parameters: {'algorithm': 'ball_tree', 'n_neighbors': 1, 'weights': 'uniform', 'metric': 'minkowski'}. Best is trial 6 with value: 0.8.
[32m[I 2023-04-26 15:46:57,689][39m Trial 373 finished with value: 0.7102803738317758 and parameters: {'algorithm': 'kd_tree', 'n_neighbors': 25, 'weights': 'uniform', 'metric': 'manhattan'}. Best is trial 6 with value: 0.8.
[32m[I 2023-04-26 15:46:57,715][39m Trial 374 finished with value: 0.8 and parameters: {'algorithm': 'kd_tree', 'n_neighbors': 3, 'weights': 'distance', 'metric': 'minkowski'}. Best is trial 6 with value: 0.8.
[32m[I 2023-04-26 15:46:57,736][39m Trial 375 finished with value: 0.8 and parameters: {'algorithm': 'ball_tree', 'n_neighbors': 3, 'weights': 'distance', 'metric': 'minkowski'}. Best is trial 6 with value: 0.8.
[32m[I 2023-04-26 15:46:57,768][39m Trial 376 finished with value: 0.8 and parameters: {'algorithm': 'ball_tree', 'n_neighbors': 3, 'weights': 'distance', 'metric': 'minkowski'}. Best is trial 6 with value: 0.8.
[32m[I 2023-04-26 15:46:57,799][39m Trial 377 finished with value: 0.8 and parameters: {'algorithm': 'kd_tree', 'n_neighbors': 2, 'weights': 'distance', 'metric': 'minkowski'}. Best is trial 6 with value: 0.8.
[32m[I 2023-04-26 15:46:57,846][39m Trial 378 finished with value: 0.8 and parameters: {'algorithm': 'kd_tree', 'n_neighbors': 1, 'weights': 'uniform', 'metric': 'minkowski'}. Best is trial 6 with value: 0.8.
[32m[I 2023-04-26 15:46:57,910][39m Trial 379 finished with value: 0.8 and parameters: {'algorithm': 'auto', 'n_neighbors': 3, 'weights': 'distance', 'metric': 'euclidean'}. Best is trial 6 with value: 0.8.
[32m[I 2023-04-26 15:46:57,973][39m Trial 380 finished with value: 0.8 and parameters: {'algorithm': 'auto', 'n_neighbors': 3, 'weights': 'distance', 'metric': 'euclidean'}. Best is trial 6 with value: 0.8.
[32m[I 2023-04-26 15:46:58,051][39m Trial 381 finished with value: 0.7323943661971831 and parameters: {'algorithm': 'brute', 'n_neighbors': 2, 'weights': 'uniform', 'metric': 'euclidean'}. Best is trial 6 with value: 0.8.
[32m[I 2023-04-26 15:46:58,082][39m Trial 382 finished with value: 0.8 and parameters: {'algorithm': 'kd_tree', 'n_neighbors': 2, 'weights': 'distance', 'metric': 'minkowski'}. Best is trial 6 with value: 0.8.
[32m[I 2023-04-26 15:46:58,145][39m Trial 383 finished with value: 0.8 and parameters: {'algorithm': 'auto', 'n_neighbors': 3, 'weights': 'distance', 'metric': 'minkowski'}. Best is trial 6 with value: 0.8.
[32m[I 2023-04-26 15:46:58,270][39m Trial 384 finished with value: 0.8 and parameters: {'algorithm': 'auto', 'n_neighbors': 2, 'weights': 'distance', 'metric': 'minkowski'}. Best is trial 6 with value: 0.8.
[32m[I 2023-04-26 15:46:58,317][39m Trial 385 finished with value: 0.8 and parameters: {'algorithm': 'brute', 'n_neighbors': 1, 'weights': 'uniform', 'metric': 'euclidean'}. Best is trial 6 with value: 0.8.
[32m[I 2023-04-26 15:46:58,379][39m Trial 386 finished with value: 0.8 and parameters: {'algorithm': 'brute', 'n_neighbors': 1, 'weights': 'uniform', 'metric': 'euclidean'}. Best is trial 6 with value: 0.8.
[32m[I 2023-04-26 15:46:58,426][39m Trial 387 finished with value: 0.8 and parameters: {'algorithm': 'brute', 'n_neighbors': 1, 'weights': 'uniform', 'metric': 'manhattan'}. Best is trial 6 with value: 0.8.
[32m[I 2023-04-26 15:46:58,473][39m Trial 388 finished with value: 0.8 and parameters: {'algorithm': 'brute', 'n_neighbors': 1, 'weights': 'uniform', 'metric': 'manhattan'}. Best is trial 6 with value: 0.8.
[32m[I 2023-04-26 15:46:58,520][39m Trial 389 finished with value: 0.8 and parameters: {'algorithm': 'brute', 'n_neighbors': 1, 'weights': 'uniform', 'metric': 'manhattan'}. Best is trial 6 with value: 0.8.
[32m[I 2023-04-26 15:46:58,583][39m Trial 390 finished with value: 0.7428571428571429 and parameters: {'algorithm': 'brute', 'n_neighbors': 2, 'weights': 'uniform', 'metric': 'manhattan'}. Best is trial 6 with value: 0.8.
[32m[I 2023-04-26 15:46:58,614][39m Trial 391 finished with value: 0.8 and parameters: {'algorithm': 'ball_tree', 'n_neighbors': 4, 'weights': 'distance', 'metric': 'euclidean'}. Best is trial 6 with value: 0.8.
[32m[I 2023-04-26 15:46:58,661][39m Trial 392 finished with value: 0.7428571428571429 and parameters: {'algorithm': 'brute', 'n_neighbors': 2, 'weights': 'uniform', 'metric': 'manhattan'}. Best is trial 6 with value: 0.8.
[32m[I 2023-04-26 15:46:58,692][39m Trial 393 finished with value: 0.8 and parameters: {'algorithm': 'ball_tree', 'n_neighbors': 4, 'weights': 'distance', 'metric': 'euclidean'}. Best is trial 6 with value: 0.8.
[32m[I 2023-04-26 15:46:58,740][39m Trial 394 finished with value: 0.6923076923076923 and parameters: {'algorithm': 'brute', 'n_neighbors': 30, 'weights': 'uniform', 'metric': 'manhattan'}. Best is trial 6 with value: 0.8.
[32m[I 2023-04-26 15:46:58,818][39m Trial 395 finished with value: 0.7323943661971831 and parameters: {'algorithm': 'auto', 'n_neighbors': 2, 'weights': 'uniform', 'metric': 'euclidean'}. Best is trial 6 with value: 0.8.
[32m[I 2023-04-26 15:46:58,907][39m Trial 396 finished with value: 0.8 and parameters: {'algorithm': 'auto', 'n_neighbors': 2, 'weights': 'distance', 'metric': 'euclidean'}. Best is trial 6 with value: 0.8.
[32m[I 2023-04-26 15:46:58,960][39m Trial 397 finished with value: 0.8 and parameters: {'algorithm': 'brute', 'n_neighbors': 1, 'weights': 'uniform', 'metric': 'manhattan'}. Best is trial 6 with value: 0.8.
[32m[I 2023-04-26 15:46:59,007][39m Trial 398 finished with value: 0.8 and parameters: {'algorithm': 'brute', 'n_neighbors': 1, 'weights': 'uniform', 'metric': 'manhattan'}. Best is trial 6 with value: 0.8.
[32m[I 2023-04-26 15:46:59,069][39m Trial 399 finished with value: 0.8 and parameters: {'algorithm': 'brute', 'n_neighbors': 1, 'weights': 'uniform', 'metric': 'manhattan'}. Best is trial 6 with value: 0.8.
[32m[I 2023-04-26 15:46:59,116][39m Trial 400 finished with value: 0.8 and parameters: {'algorithm': 'brute', 'n_neighbors': 1, 'weights': 'uniform', 'metric': 'manhattan'}. Best is trial 6 with value: 0.8.
[32m[I 2023-04-26 15:46:59,179][39m Trial 401 finished with value: 0.8 and parameters: {'algorithm': 'brute', 'n_neighbors': 1, 'weights': 'uniform', 'metric': 'manhattan'}. Best is trial 6 with value: 0.8.
[32m[I 2023-04-26 15:46:59,226][39m Trial 402 finished with value: 0.8 and parameters: {'algorithm': 'brute', 'n_neighbors': 1, 'weights': 'uniform', 'metric': 'manhattan'}. Best is trial 6 with value: 0.8.
[32m[I 2023-04-26 15:46:59,288][39m Trial 403 finished with value: 0.8 and parameters: {'algorithm': 'brute', 'n_neighbors': 1, 'weights': 'uniform', 'metric': 'manhattan'}. Best is trial 6 with value: 0.8.
[32m[I 2023-04-26 15:46:59,414][39m Trial 404 finished with value: 0.8 and parameters: {'algorithm': 'brute', 'n_neighbors': 1, 'weights': 'uniform', 'metric': 'manhattan'}. Best is trial 6 with value: 0.8.
[32m[I 2023-04-26 15:46:59,445][39m Trial 405 finished with value: 0.8 and parameters: {'algorithm': 'brute', 'n_neighbors': 1, 'weights': 'uniform', 'metric': 'manhattan'}. Best is trial 6 with value: 0.8.
