[32m[I 2023-04-26 15:46:49,416][39m Trial 201 finished with value: 0.8 and parameters: {'algorithm': 'brute', 'n_neighbors': 1, 'weights': 'distance', 'metric': 'euclidean'}. Best is trial 6 with value: 0.8.
[32m[I 2023-04-26 15:46:49,463][39m Trial 202 finished with value: 0.8 and parameters: {'algorithm': 'brute', 'n_neighbors': 1, 'weights': 'uniform', 'metric': 'euclidean'}. Best is trial 6 with value: 0.8.
[32m[I 2023-04-26 15:46:49,542][39m Trial 203 finished with value: 0.8 and parameters: {'algorithm': 'auto', 'n_neighbors': 3, 'weights': 'distance', 'metric': 'euclidean'}. Best is trial 6 with value: 0.8.
[32m[I 2023-04-26 15:46:49,615][39m Trial 204 finished with value: 0.8 and parameters: {'algorithm': 'auto', 'n_neighbors': 1, 'weights': 'distance', 'metric': 'minkowski'}. Best is trial 6 with value: 0.8.
[32m[I 2023-04-26 15:46:49,667][39m Trial 205 finished with value: 0.8 and parameters: {'algorithm': 'auto', 'n_neighbors': 3, 'weights': 'distance', 'metric': 'euclidean'}. Best is trial 6 with value: 0.8.
[32m[I 2023-04-26 15:46:49,715][39m Trial 206 finished with value: 0.8 and parameters: {'algorithm': 'auto', 'n_neighbors': 2, 'weights': 'distance', 'metric': 'euclidean'}. Best is trial 6 with value: 0.8.
[32m[I 2023-04-26 15:46:49,746][39m Trial 207 finished with value: 0.75 and parameters: {'algorithm': 'ball_tree', 'n_neighbors': 4, 'weights': 'uniform', 'metric': 'minkowski'}. Best is trial 6 with value: 0.8.
[32m[I 2023-04-26 15:46:49,788][39m Trial 208 finished with value: 0.7532467532467532 and parameters: {'algorithm': 'ball_tree', 'n_neighbors': 5, 'weights': 'uniform', 'metric': 'minkowski'}. Best is trial 6 with value: 0.8.
[32m[I 2023-04-26 15:46:49,825][39m Trial 209 finished with value: 0.8 and parameters: {'algorithm': 'brute', 'n_neighbors': 4, 'weights': 'distance', 'metric': 'minkowski'}. Best is trial 6 with value: 0.8.
[32m[I 2023-04-26 15:46:49,872][39m Trial 210 finished with value: 0.8 and parameters: {'algorithm': 'brute', 'n_neighbors': 1, 'weights': 'uniform', 'metric': 'euclidean'}. Best is trial 6 with value: 0.8.
[32m[I 2023-04-26 15:46:49,903][39m Trial 211 finished with value: 0.8 and parameters: {'algorithm': 'kd_tree', 'n_neighbors': 1, 'weights': 'uniform', 'metric': 'euclidean'}. Best is trial 6 with value: 0.8.
[32m[I 2023-04-26 15:46:49,950][39m Trial 212 finished with value: 0.8 and parameters: {'algorithm': 'auto', 'n_neighbors': 1, 'weights': 'uniform', 'metric': 'euclidean'}. Best is trial 6 with value: 0.8.
[32m[I 2023-04-26 15:46:49,965][39m Trial 213 finished with value: 0.8 and parameters: {'algorithm': 'ball_tree', 'n_neighbors': 3, 'weights': 'distance', 'metric': 'minkowski'}. Best is trial 6 with value: 0.8.
[32m[I 2023-04-26 15:46:49,997][39m Trial 214 finished with value: 0.8 and parameters: {'algorithm': 'ball_tree', 'n_neighbors': 3, 'weights': 'distance', 'metric': 'minkowski'}. Best is trial 6 with value: 0.8.
[32m[I 2023-04-26 15:46:50,028][39m Trial 215 finished with value: 0.7428571428571429 and parameters: {'algorithm': 'kd_tree', 'n_neighbors': 2, 'weights': 'uniform', 'metric': 'manhattan'}. Best is trial 6 with value: 0.8.
[32m[I 2023-04-26 15:46:50,090][39m Trial 216 finished with value: 0.8 and parameters: {'algorithm': 'brute', 'n_neighbors': 3, 'weights': 'distance', 'metric': 'minkowski'}. Best is trial 6 with value: 0.8.
[32m[I 2023-04-26 15:46:50,137][39m Trial 217 finished with value: 0.8 and parameters: {'algorithm': 'kd_tree', 'n_neighbors': 2, 'weights': 'distance', 'metric': 'minkowski'}. Best is trial 6 with value: 0.8.
[32m[I 2023-04-26 15:46:50,169][39m Trial 218 finished with value: 0.8 and parameters: {'algorithm': 'kd_tree', 'n_neighbors': 2, 'weights': 'distance', 'metric': 'minkowski'}. Best is trial 6 with value: 0.8.
[32m[I 2023-04-26 15:46:50,200][39m Trial 219 finished with value: 0.8 and parameters: {'algorithm': 'ball_tree', 'n_neighbors': 4, 'weights': 'distance', 'metric': 'minkowski'}. Best is trial 6 with value: 0.8.
[32m[I 2023-04-26 15:46:50,216][39m Trial 220 finished with value: 0.7901234567901235 and parameters: {'algorithm': 'ball_tree', 'n_neighbors': 5, 'weights': 'distance', 'metric': 'minkowski'}. Best is trial 6 with value: 0.8.
[32m[I 2023-04-26 15:46:50,231][39m Trial 221 finished with value: 0.8 and parameters: {'algorithm': 'ball_tree', 'n_neighbors': 3, 'weights': 'distance', 'metric': 'minkowski'}. Best is trial 6 with value: 0.8.
[32m[I 2023-04-26 15:46:50,262][39m Trial 222 finished with value: 0.8 and parameters: {'algorithm': 'kd_tree', 'n_neighbors': 2, 'weights': 'distance', 'metric': 'euclidean'}. Best is trial 6 with value: 0.8.
[32m[I 2023-04-26 15:46:50,294][39m Trial 223 finished with value: 0.8 and parameters: {'algorithm': 'ball_tree', 'n_neighbors': 2, 'weights': 'distance', 'metric': 'manhattan'}. Best is trial 6 with value: 0.8.
[32m[I 2023-04-26 15:46:50,309][39m Trial 224 finished with value: 0.8 and parameters: {'algorithm': 'ball_tree', 'n_neighbors': 2, 'weights': 'distance', 'metric': 'manhattan'}. Best is trial 6 with value: 0.8.
[32m[I 2023-04-26 15:46:50,325][39m Trial 225 finished with value: 0.8 and parameters: {'algorithm': 'kd_tree', 'n_neighbors': 2, 'weights': 'distance', 'metric': 'minkowski'}. Best is trial 6 with value: 0.8.
[32m[I 2023-04-26 15:46:50,356][39m Trial 226 finished with value: 0.8 and parameters: {'algorithm': 'kd_tree', 'n_neighbors': 3, 'weights': 'distance', 'metric': 'minkowski'}. Best is trial 6 with value: 0.8.
[32m[I 2023-04-26 15:46:50,380][39m Trial 227 finished with value: 0.8 and parameters: {'algorithm': 'kd_tree', 'n_neighbors': 4, 'weights': 'distance', 'metric': 'euclidean'}. Best is trial 6 with value: 0.8.
[32m[I 2023-04-26 15:46:50,388][39m Trial 228 finished with value: 0.8 and parameters: {'algorithm': 'kd_tree', 'n_neighbors': 4, 'weights': 'distance', 'metric': 'euclidean'}. Best is trial 6 with value: 0.8.
[32m[I 2023-04-26 15:46:50,450][39m Trial 229 finished with value: 0.8 and parameters: {'algorithm': 'brute', 'n_neighbors': 3, 'weights': 'distance', 'metric': 'euclidean'}. Best is trial 6 with value: 0.8.
[32m[I 2023-04-26 15:46:50,536][39m Trial 230 finished with value: 0.8 and parameters: {'algorithm': 'brute', 'n_neighbors': 1, 'weights': 'uniform', 'metric': 'euclidean'}. Best is trial 6 with value: 0.8.
[32m[I 2023-04-26 15:46:50,608][39m Trial 231 finished with value: 0.8 and parameters: {'algorithm': 'auto', 'n_neighbors': 3, 'weights': 'distance', 'metric': 'euclidean'}. Best is trial 6 with value: 0.8.
[32m[I 2023-04-26 15:46:50,686][39m Trial 232 finished with value: 0.8 and parameters: {'algorithm': 'auto', 'n_neighbors': 4, 'weights': 'distance', 'metric': 'euclidean'}. Best is trial 6 with value: 0.8.
[32m[I 2023-04-26 15:46:50,728][39m Trial 233 finished with value: 0.8 and parameters: {'algorithm': 'ball_tree', 'n_neighbors': 4, 'weights': 'distance', 'metric': 'minkowski'}. Best is trial 6 with value: 0.8.
[32m[I 2023-04-26 15:46:50,750][39m Trial 234 finished with value: 0.8 and parameters: {'algorithm': 'kd_tree', 'n_neighbors': 4, 'weights': 'distance', 'metric': 'minkowski'}. Best is trial 6 with value: 0.8.
[32m[I 2023-04-26 15:46:50,796][39m Trial 235 finished with value: 0.8 and parameters: {'algorithm': 'auto', 'n_neighbors': 1, 'weights': 'uniform', 'metric': 'minkowski'}. Best is trial 6 with value: 0.8.
[32m[I 2023-04-26 15:46:50,843][39m Trial 236 finished with value: 0.8 and parameters: {'algorithm': 'auto', 'n_neighbors': 1, 'weights': 'uniform', 'metric': 'euclidean'}. Best is trial 6 with value: 0.8.
[32m[I 2023-04-26 15:46:50,906][39m Trial 237 finished with value: 0.8 and parameters: {'algorithm': 'brute', 'n_neighbors': 1, 'weights': 'uniform', 'metric': 'euclidean'}. Best is trial 6 with value: 0.8.
[32m[I 2023-04-26 15:46:51,000][39m Trial 238 finished with value: 0.8 and parameters: {'algorithm': 'brute', 'n_neighbors': 2, 'weights': 'distance', 'metric': 'euclidean'}. Best is trial 6 with value: 0.8.
[32m[I 2023-04-26 15:46:51,063][39m Trial 239 finished with value: 0.8 and parameters: {'algorithm': 'brute', 'n_neighbors': 1, 'weights': 'uniform', 'metric': 'manhattan'}. Best is trial 6 with value: 0.8.
[32m[I 2023-04-26 15:46:51,110][39m Trial 240 finished with value: 0.8 and parameters: {'algorithm': 'brute', 'n_neighbors': 1, 'weights': 'uniform', 'metric': 'manhattan'}. Best is trial 6 with value: 0.8.
[32m[I 2023-04-26 15:46:51,141][39m Trial 241 finished with value: 0.8 and parameters: {'algorithm': 'kd_tree', 'n_neighbors': 2, 'weights': 'distance', 'metric': 'minkowski'}. Best is trial 6 with value: 0.8.
[32m[I 2023-04-26 15:46:51,156][39m Trial 242 finished with value: 0.8 and parameters: {'algorithm': 'kd_tree', 'n_neighbors': 2, 'weights': 'distance', 'metric': 'minkowski'}. Best is trial 6 with value: 0.8.
[32m[I 2023-04-26 15:46:51,172][39m Trial 243 finished with value: 0.8 and parameters: {'algorithm': 'kd_tree', 'n_neighbors': 2, 'weights': 'distance', 'metric': 'minkowski'}. Best is trial 6 with value: 0.8.
[32m[I 2023-04-26 15:46:51,219][39m Trial 244 finished with value: 0.8 and parameters: {'algorithm': 'brute', 'n_neighbors': 1, 'weights': 'uniform', 'metric': 'manhattan'}. Best is trial 6 with value: 0.8.
[32m[I 2023-04-26 15:46:51,281][39m Trial 245 finished with value: 0.8 and parameters: {'algorithm': 'brute', 'n_neighbors': 1, 'weights': 'distance', 'metric': 'minkowski'}. Best is trial 6 with value: 0.8.
[32m[I 2023-04-26 15:46:51,360][39m Trial 246 finished with value: 0.8 and parameters: {'algorithm': 'brute', 'n_neighbors': 1, 'weights': 'uniform', 'metric': 'manhattan'}. Best is trial 6 with value: 0.8.
[32m[I 2023-04-26 15:46:51,406][39m Trial 247 finished with value: 0.8 and parameters: {'algorithm': 'brute', 'n_neighbors': 1, 'weights': 'uniform', 'metric': 'manhattan'}. Best is trial 6 with value: 0.8.
[32m[I 2023-04-26 15:46:51,453][39m Trial 248 finished with value: 0.7428571428571429 and parameters: {'algorithm': 'brute', 'n_neighbors': 2, 'weights': 'uniform', 'metric': 'manhattan'}. Best is trial 6 with value: 0.8.
[32m[I 2023-04-26 15:46:51,605][39m Trial 249 finished with value: 0.8 and parameters: {'algorithm': 'auto', 'n_neighbors': 1, 'weights': 'uniform', 'metric': 'euclidean'}. Best is trial 6 with value: 0.8.
[32m[I 2023-04-26 15:46:51,652][39m Trial 250 finished with value: 0.8 and parameters: {'algorithm': 'brute', 'n_neighbors': 2, 'weights': 'distance', 'metric': 'manhattan'}. Best is trial 6 with value: 0.8.
[32m[I 2023-04-26 15:46:51,705][39m Trial 251 finished with value: 0.7428571428571429 and parameters: {'algorithm': 'brute', 'n_neighbors': 2, 'weights': 'uniform', 'metric': 'manhattan'}. Best is trial 6 with value: 0.8.
[32m[I 2023-04-26 15:46:51,768][39m Trial 252 finished with value: 0.8 and parameters: {'algorithm': 'auto', 'n_neighbors': 3, 'weights': 'distance', 'metric': 'euclidean'}. Best is trial 6 with value: 0.8.
[32m[I 2023-04-26 15:46:51,830][39m Trial 253 finished with value: 0.8 and parameters: {'algorithm': 'kd_tree', 'n_neighbors': 3, 'weights': 'distance', 'metric': 'minkowski'}. Best is trial 6 with value: 0.8.
[32m[I 2023-04-26 15:46:51,862][39m Trial 254 finished with value: 0.7428571428571429 and parameters: {'algorithm': 'kd_tree', 'n_neighbors': 2, 'weights': 'uniform', 'metric': 'minkowski'}. Best is trial 6 with value: 0.8.
[32m[I 2023-04-26 15:46:51,909][39m Trial 255 finished with value: 0.8 and parameters: {'algorithm': 'auto', 'n_neighbors': 3, 'weights': 'distance', 'metric': 'euclidean'}. Best is trial 6 with value: 0.8.
[32m[I 2023-04-26 15:46:51,955][39m Trial 256 finished with value: 0.8 and parameters: {'algorithm': 'brute', 'n_neighbors': 1, 'weights': 'uniform', 'metric': 'manhattan'}. Best is trial 6 with value: 0.8.
[32m[I 2023-04-26 15:46:52,018][39m Trial 257 finished with value: 0.8 and parameters: {'algorithm': 'auto', 'n_neighbors': 1, 'weights': 'uniform', 'metric': 'euclidean'}. Best is trial 6 with value: 0.8.
[32m[I 2023-04-26 15:46:52,080][39m Trial 258 finished with value: 0.8 and parameters: {'algorithm': 'auto', 'n_neighbors': 1, 'weights': 'uniform', 'metric': 'euclidean'}. Best is trial 6 with value: 0.8.
[32m[I 2023-04-26 15:46:52,127][39m Trial 259 finished with value: 0.8 and parameters: {'algorithm': 'brute', 'n_neighbors': 1, 'weights': 'uniform', 'metric': 'manhattan'}. Best is trial 6 with value: 0.8.
[32m[I 2023-04-26 15:46:52,174][39m Trial 260 finished with value: 0.7428571428571429 and parameters: {'algorithm': 'brute', 'n_neighbors': 2, 'weights': 'uniform', 'metric': 'manhattan'}. Best is trial 6 with value: 0.8.
[32m[I 2023-04-26 15:46:52,268][39m Trial 261 finished with value: 0.8 and parameters: {'algorithm': 'auto', 'n_neighbors': 3, 'weights': 'distance', 'metric': 'minkowski'}. Best is trial 6 with value: 0.8.
[32m[I 2023-04-26 15:46:52,331][39m Trial 262 finished with value: 0.7727272727272727 and parameters: {'algorithm': 'brute', 'n_neighbors': 16, 'weights': 'distance', 'metric': 'manhattan'}. Best is trial 6 with value: 0.8.
[32m[I 2023-04-26 15:46:52,362][39m Trial 263 finished with value: 0.8 and parameters: {'algorithm': 'kd_tree', 'n_neighbors': 3, 'weights': 'distance', 'metric': 'minkowski'}. Best is trial 6 with value: 0.8.
[32m[I 2023-04-26 15:46:52,377][39m Trial 264 finished with value: 0.8 and parameters: {'algorithm': 'kd_tree', 'n_neighbors': 2, 'weights': 'distance', 'metric': 'minkowski'}. Best is trial 6 with value: 0.8.
[32m[I 2023-04-26 15:46:52,424][39m Trial 265 finished with value: 0.8 and parameters: {'algorithm': 'auto', 'n_neighbors': 1, 'weights': 'uniform', 'metric': 'manhattan'}. Best is trial 6 with value: 0.8.
[32m[I 2023-04-26 15:46:52,471][39m Trial 266 finished with value: 0.8 and parameters: {'algorithm': 'auto', 'n_neighbors': 1, 'weights': 'uniform', 'metric': 'manhattan'}. Best is trial 6 with value: 0.8.
[32m[I 2023-04-26 15:46:52,534][39m Trial 267 finished with value: 0.8 and parameters: {'algorithm': 'auto', 'n_neighbors': 2, 'weights': 'distance', 'metric': 'manhattan'}. Best is trial 6 with value: 0.8.
[32m[I 2023-04-26 15:46:52,629][39m Trial 268 finished with value: 0.7294117647058823 and parameters: {'algorithm': 'auto', 'n_neighbors': 11, 'weights': 'distance', 'metric': 'manhattan'}. Best is trial 6 with value: 0.8.
[32m[I 2023-04-26 15:46:52,676][39m Trial 269 finished with value: 0.7415730337078651 and parameters: {'algorithm': 'ball_tree', 'n_neighbors': 22, 'weights': 'distance', 'metric': 'minkowski'}. Best is trial 6 with value: 0.8.
[32m[I 2023-04-26 15:46:52,692][39m Trial 270 finished with value: 0.8 and parameters: {'algorithm': 'kd_tree', 'n_neighbors': 3, 'weights': 'distance', 'metric': 'euclidean'}. Best is trial 6 with value: 0.8.
[32m[I 2023-04-26 15:46:52,723][39m Trial 271 finished with value: 0.8 and parameters: {'algorithm': 'kd_tree', 'n_neighbors': 2, 'weights': 'distance', 'metric': 'euclidean'}. Best is trial 6 with value: 0.8.
[32m[I 2023-04-26 15:46:52,739][39m Trial 272 finished with value: 0.8 and parameters: {'algorithm': 'kd_tree', 'n_neighbors': 2, 'weights': 'distance', 'metric': 'euclidean'}. Best is trial 6 with value: 0.8.
[32m[I 2023-04-26 15:46:52,802][39m Trial 273 finished with value: 0.8 and parameters: {'algorithm': 'auto', 'n_neighbors': 2, 'weights': 'distance', 'metric': 'manhattan'}. Best is trial 6 with value: 0.8.
[32m[I 2023-04-26 15:46:52,849][39m Trial 274 finished with value: 0.8 and parameters: {'algorithm': 'auto', 'n_neighbors': 2, 'weights': 'distance', 'metric': 'manhattan'}. Best is trial 6 with value: 0.8.
[32m[I 2023-04-26 15:46:52,896][39m Trial 275 finished with value: 0.8 and parameters: {'algorithm': 'auto', 'n_neighbors': 2, 'weights': 'distance', 'metric': 'manhattan'}. Best is trial 6 with value: 0.8.
[32m[I 2023-04-26 15:46:52,958][39m Trial 276 finished with value: 0.7499999999999999 and parameters: {'algorithm': 'auto', 'n_neighbors': 27, 'weights': 'distance', 'metric': 'manhattan'}. Best is trial 6 with value: 0.8.
[32m[I 2023-04-26 15:46:53,005][39m Trial 277 finished with value: 0.8 and parameters: {'algorithm': 'kd_tree', 'n_neighbors': 2, 'weights': 'distance', 'metric': 'minkowski'}. Best is trial 6 with value: 0.8.
[32m[I 2023-04-26 15:46:53,053][39m Trial 278 finished with value: 0.8 and parameters: {'algorithm': 'auto', 'n_neighbors': 2, 'weights': 'distance', 'metric': 'manhattan'}. Best is trial 6 with value: 0.8.
[32m[I 2023-04-26 15:46:53,099][39m Trial 279 finished with value: 0.7901234567901235 and parameters: {'algorithm': 'auto', 'n_neighbors': 5, 'weights': 'distance', 'metric': 'euclidean'}. Best is trial 6 with value: 0.8.
[32m[I 2023-04-26 15:46:53,146][39m Trial 280 finished with value: 0.8 and parameters: {'algorithm': 'auto', 'n_neighbors': 3, 'weights': 'distance', 'metric': 'euclidean'}. Best is trial 6 with value: 0.8.
[32m[I 2023-04-26 15:46:53,193][39m Trial 281 finished with value: 0.8 and parameters: {'algorithm': 'auto', 'n_neighbors': 1, 'weights': 'distance', 'metric': 'manhattan'}. Best is trial 6 with value: 0.8.
[32m[I 2023-04-26 15:46:53,256][39m Trial 282 finished with value: 0.8 and parameters: {'algorithm': 'auto', 'n_neighbors': 1, 'weights': 'distance', 'metric': 'manhattan'}. Best is trial 6 with value: 0.8.
[32m[I 2023-04-26 15:46:53,303][39m Trial 283 finished with value: 0.8 and parameters: {'algorithm': 'brute', 'n_neighbors': 1, 'weights': 'distance', 'metric': 'manhattan'}. Best is trial 6 with value: 0.8.
[32m[I 2023-04-26 15:46:53,365][39m Trial 284 finished with value: 0.8 and parameters: {'algorithm': 'brute', 'n_neighbors': 2, 'weights': 'distance', 'metric': 'manhattan'}. Best is trial 6 with value: 0.8.
[32m[I 2023-04-26 15:46:53,428][39m Trial 285 finished with value: 0.7428571428571429 and parameters: {'algorithm': 'auto', 'n_neighbors': 2, 'weights': 'uniform', 'metric': 'manhattan'}. Best is trial 6 with value: 0.8.
[32m[I 2023-04-26 15:46:53,443][39m Trial 286 finished with value: 0.8 and parameters: {'algorithm': 'kd_tree', 'n_neighbors': 4, 'weights': 'distance', 'metric': 'minkowski'}. Best is trial 6 with value: 0.8.
[32m[I 2023-04-26 15:46:53,490][39m Trial 287 finished with value: 0.8 and parameters: {'algorithm': 'auto', 'n_neighbors': 1, 'weights': 'uniform', 'metric': 'manhattan'}. Best is trial 6 with value: 0.8.
[32m[I 2023-04-26 15:46:53,553][39m Trial 288 finished with value: 0.8 and parameters: {'algorithm': 'brute', 'n_neighbors': 2, 'weights': 'distance', 'metric': 'euclidean'}. Best is trial 6 with value: 0.8.
[32m[I 2023-04-26 15:46:53,615][39m Trial 289 finished with value: 0.8 and parameters: {'algorithm': 'auto', 'n_neighbors': 1, 'weights': 'distance', 'metric': 'manhattan'}. Best is trial 6 with value: 0.8.
[32m[I 2023-04-26 15:46:53,679][39m Trial 290 finished with value: 0.8 and parameters: {'algorithm': 'auto', 'n_neighbors': 1, 'weights': 'uniform', 'metric': 'manhattan'}. Best is trial 6 with value: 0.8.
[32m[I 2023-04-26 15:46:53,694][39m Trial 291 finished with value: 0.8 and parameters: {'algorithm': 'kd_tree', 'n_neighbors': 4, 'weights': 'distance', 'metric': 'euclidean'}. Best is trial 6 with value: 0.8.
[32m[I 2023-04-26 15:46:53,725][39m Trial 292 finished with value: 0.8 and parameters: {'algorithm': 'kd_tree', 'n_neighbors': 4, 'weights': 'distance', 'metric': 'euclidean'}. Best is trial 6 with value: 0.8.
[32m[I 2023-04-26 15:46:53,783][39m Trial 293 finished with value: 0.8 and parameters: {'algorithm': 'auto', 'n_neighbors': 2, 'weights': 'distance', 'metric': 'manhattan'}. Best is trial 6 with value: 0.8.
[32m[I 2023-04-26 15:46:53,867][39m Trial 294 finished with value: 0.8 and parameters: {'algorithm': 'auto', 'n_neighbors': 3, 'weights': 'distance', 'metric': 'minkowski'}. Best is trial 6 with value: 0.8.
[32m[I 2023-04-26 15:46:53,930][39m Trial 295 finished with value: 0.8 and parameters: {'algorithm': 'auto', 'n_neighbors': 3, 'weights': 'distance', 'metric': 'euclidean'}. Best is trial 6 with value: 0.8.
[32m[I 2023-04-26 15:46:53,992][39m Trial 296 finished with value: 0.8 and parameters: {'algorithm': 'auto', 'n_neighbors': 3, 'weights': 'distance', 'metric': 'euclidean'}. Best is trial 6 with value: 0.8.
[32m[I 2023-04-26 15:46:54,055][39m Trial 297 finished with value: 0.8 and parameters: {'algorithm': 'auto', 'n_neighbors': 3, 'weights': 'distance', 'metric': 'euclidean'}. Best is trial 6 with value: 0.8.
[32m[I 2023-04-26 15:46:54,117][39m Trial 298 finished with value: 0.8 and parameters: {'algorithm': 'auto', 'n_neighbors': 2, 'weights': 'distance', 'metric': 'euclidean'}. Best is trial 6 with value: 0.8.
[32m[I 2023-04-26 15:46:54,133][39m Trial 299 finished with value: 0.8 and parameters: {'algorithm': 'kd_tree', 'n_neighbors': 3, 'weights': 'distance', 'metric': 'minkowski'}. Best is trial 6 with value: 0.8.
[32m[I 2023-04-26 15:46:54,164][39m Trial 300 finished with value: 0.8 and parameters: {'algorithm': 'kd_tree', 'n_neighbors': 3, 'weights': 'distance', 'metric': 'minkowski'}. Best is trial 6 with value: 0.8.
[32m[I 2023-04-26 15:46:54,195][39m Trial 301 finished with value: 0.8 and parameters: {'algorithm': 'kd_tree', 'n_neighbors': 3, 'weights': 'distance', 'metric': 'minkowski'}. Best is trial 6 with value: 0.8.
[32m[I 2023-04-26 15:46:54,211][39m Trial 302 finished with value: 0.8 and parameters: {'algorithm': 'kd_tree', 'n_neighbors': 4, 'weights': 'distance', 'metric': 'minkowski'}. Best is trial 6 with value: 0.8.
[32m[I 2023-04-26 15:46:54,258][39m Trial 303 finished with value: 0.725 and parameters: {'algorithm': 'auto', 'n_neighbors': 8, 'weights': 'distance', 'metric': 'minkowski'}. Best is trial 6 with value: 0.8.
