[32m[I 2023-04-26 15:46:45,453][39m Trial 99 finished with value: 0.7323943661971831 and parameters: {'algorithm': 'auto', 'n_neighbors': 2, 'weights': 'uniform', 'metric': 'euclidean'}. Best is trial 6 with value: 0.8.
[32m[I 2023-04-26 15:46:45,516][39m Trial 100 finished with value: 0.8 and parameters: {'algorithm': 'brute', 'n_neighbors': 1, 'weights': 'uniform', 'metric': 'euclidean'}. Best is trial 6 with value: 0.8.
[32m[I 2023-04-26 15:46:45,547][39m Trial 101 finished with value: 0.8 and parameters: {'algorithm': 'kd_tree', 'n_neighbors': 1, 'weights': 'uniform', 'metric': 'minkowski'}. Best is trial 6 with value: 0.8.
[32m[I 2023-04-26 15:46:45,563][39m Trial 102 finished with value: 0.8 and parameters: {'algorithm': 'ball_tree', 'n_neighbors': 4, 'weights': 'distance', 'metric': 'euclidean'}. Best is trial 6 with value: 0.8.
[32m[I 2023-04-26 15:46:45,579][39m Trial 103 finished with value: 0.7428571428571429 and parameters: {'algorithm': 'kd_tree', 'n_neighbors': 2, 'weights': 'uniform', 'metric': 'minkowski'}. Best is trial 6 with value: 0.8.
[32m[I 2023-04-26 15:46:45,610][39m Trial 104 finished with value: 0.8 and parameters: {'algorithm': 'ball_tree', 'n_neighbors': 3, 'weights': 'distance', 'metric': 'euclidean'}. Best is trial 6 with value: 0.8.
[32m[I 2023-04-26 15:46:45,642][39m Trial 105 finished with value: 0.8 and parameters: {'algorithm': 'kd_tree', 'n_neighbors': 1, 'weights': 'uniform', 'metric': 'minkowski'}. Best is trial 6 with value: 0.8.
[32m[I 2023-04-26 15:46:45,673][39m Trial 106 finished with value: 0.7901234567901235 and parameters: {'algorithm': 'kd_tree', 'n_neighbors': 5, 'weights': 'distance', 'metric': 'minkowski'}. Best is trial 6 with value: 0.8.
[32m[I 2023-04-26 15:46:45,768][39m Trial 107 finished with value: 0.7323943661971831 and parameters: {'algorithm': 'auto', 'n_neighbors': 2, 'weights': 'uniform', 'metric': 'euclidean'}. Best is trial 6 with value: 0.8.
[32m[I 2023-04-26 15:46:45,799][39m Trial 108 finished with value: 0.8 and parameters: {'algorithm': 'kd_tree', 'n_neighbors': 1, 'weights': 'uniform', 'metric': 'minkowski'}. Best is trial 6 with value: 0.8.
[32m[I 2023-04-26 15:46:45,815][39m Trial 109 finished with value: 0.7692307692307694 and parameters: {'algorithm': 'kd_tree', 'n_neighbors': 3, 'weights': 'uniform', 'metric': 'minkowski'}. Best is trial 6 with value: 0.8.
[32m[I 2023-04-26 15:46:45,846][39m Trial 110 finished with value: 0.8 and parameters: {'algorithm': 'ball_tree', 'n_neighbors': 1, 'weights': 'uniform', 'metric': 'euclidean'}. Best is trial 6 with value: 0.8.
[32m[I 2023-04-26 15:46:45,861][39m Trial 111 finished with value: 0.7428571428571429 and parameters: {'algorithm': 'ball_tree', 'n_neighbors': 2, 'weights': 'uniform', 'metric': 'euclidean'}. Best is trial 6 with value: 0.8.
[32m[I 2023-04-26 15:46:45,877][39m Trial 112 finished with value: 0.8 and parameters: {'algorithm': 'kd_tree', 'n_neighbors': 2, 'weights': 'distance', 'metric': 'minkowski'}. Best is trial 6 with value: 0.8.
[32m[I 2023-04-26 15:46:45,908][39m Trial 113 finished with value: 0.8 and parameters: {'algorithm': 'kd_tree', 'n_neighbors': 4, 'weights': 'distance', 'metric': 'minkowski'}. Best is trial 6 with value: 0.8.
[32m[I 2023-04-26 15:46:45,924][39m Trial 114 finished with value: 0.7948717948717948 and parameters: {'algorithm': 'kd_tree', 'n_neighbors': 6, 'weights': 'distance', 'metric': 'minkowski'}. Best is trial 6 with value: 0.8.
[32m[I 2023-04-26 15:46:45,955][39m Trial 115 finished with value: 0.8 and parameters: {'algorithm': 'ball_tree', 'n_neighbors': 4, 'weights': 'distance', 'metric': 'euclidean'}. Best is trial 6 with value: 0.8.
[32m[I 2023-04-26 15:46:45,971][39m Trial 116 finished with value: 0.8 and parameters: {'algorithm': 'ball_tree', 'n_neighbors': 4, 'weights': 'distance', 'metric': 'euclidean'}. Best is trial 6 with value: 0.8.
[32m[I 2023-04-26 15:46:46,064][39m Trial 117 finished with value: 0.7216494845360826 and parameters: {'algorithm': 'brute', 'n_neighbors': 29, 'weights': 'distance', 'metric': 'minkowski'}. Best is trial 6 with value: 0.8.
[32m[I 2023-04-26 15:46:46,096][39m Trial 118 finished with value: 0.7948717948717948 and parameters: {'algorithm': 'kd_tree', 'n_neighbors': 6, 'weights': 'distance', 'metric': 'minkowski'}. Best is trial 6 with value: 0.8.
[32m[I 2023-04-26 15:46:46,143][39m Trial 119 finished with value: 0.7901234567901235 and parameters: {'algorithm': 'ball_tree', 'n_neighbors': 5, 'weights': 'distance', 'metric': 'euclidean'}. Best is trial 6 with value: 0.8.
[32m[I 2023-04-26 15:46:46,163][39m Trial 120 finished with value: 0.8 and parameters: {'algorithm': 'ball_tree', 'n_neighbors': 3, 'weights': 'distance', 'metric': 'euclidean'}. Best is trial 6 with value: 0.8.
[32m[I 2023-04-26 15:46:46,206][39m Trial 121 finished with value: 0.8 and parameters: {'algorithm': 'auto', 'n_neighbors': 3, 'weights': 'distance', 'metric': 'euclidean'}. Best is trial 6 with value: 0.8.
[32m[I 2023-04-26 15:46:46,252][39m Trial 122 finished with value: 0.8 and parameters: {'algorithm': 'auto', 'n_neighbors': 2, 'weights': 'distance', 'metric': 'minkowski'}. Best is trial 6 with value: 0.8.
[32m[I 2023-04-26 15:46:46,315][39m Trial 123 finished with value: 0.8 and parameters: {'algorithm': 'auto', 'n_neighbors': 3, 'weights': 'distance', 'metric': 'euclidean'}. Best is trial 6 with value: 0.8.
[32m[I 2023-04-26 15:46:46,377][39m Trial 124 finished with value: 0.8 and parameters: {'algorithm': 'auto', 'n_neighbors': 1, 'weights': 'distance', 'metric': 'manhattan'}. Best is trial 6 with value: 0.8.
[32m[I 2023-04-26 15:46:46,424][39m Trial 125 finished with value: 0.8 and parameters: {'algorithm': 'brute', 'n_neighbors': 1, 'weights': 'uniform', 'metric': 'manhattan'}. Best is trial 6 with value: 0.8.
[32m[I 2023-04-26 15:46:46,514][39m Trial 126 finished with value: 0.7397260273972602 and parameters: {'algorithm': 'brute', 'n_neighbors': 4, 'weights': 'uniform', 'metric': 'manhattan'}. Best is trial 6 with value: 0.8.
[32m[I 2023-04-26 15:46:46,566][39m Trial 127 finished with value: 0.8 and parameters: {'algorithm': 'brute', 'n_neighbors': 1, 'weights': 'uniform', 'metric': 'euclidean'}. Best is trial 6 with value: 0.8.
[32m[I 2023-04-26 15:46:46,582][39m Trial 128 finished with value: 0.7428571428571429 and parameters: {'algorithm': 'kd_tree', 'n_neighbors': 2, 'weights': 'uniform', 'metric': 'minkowski'}. Best is trial 6 with value: 0.8.
[32m[I 2023-04-26 15:46:46,613][39m Trial 129 finished with value: 0.8 and parameters: {'algorithm': 'kd_tree', 'n_neighbors': 1, 'weights': 'uniform', 'metric': 'minkowski'}. Best is trial 6 with value: 0.8.
[32m[I 2023-04-26 15:46:46,629][39m Trial 130 finished with value: 0.8 and parameters: {'algorithm': 'kd_tree', 'n_neighbors': 3, 'weights': 'distance', 'metric': 'minkowski'}. Best is trial 6 with value: 0.8.
[32m[I 2023-04-26 15:46:46,655][39m Trial 131 finished with value: 0.7428571428571429 and parameters: {'algorithm': 'kd_tree', 'n_neighbors': 2, 'weights': 'uniform', 'metric': 'minkowski'}. Best is trial 6 with value: 0.8.
[32m[I 2023-04-26 15:46:46,677][39m Trial 132 finished with value: 0.8 and parameters: {'algorithm': 'kd_tree', 'n_neighbors': 1, 'weights': 'uniform', 'metric': 'minkowski'}. Best is trial 6 with value: 0.8.
[32m[I 2023-04-26 15:46:46,724][39m Trial 133 finished with value: 0.8 and parameters: {'algorithm': 'auto', 'n_neighbors': 3, 'weights': 'distance', 'metric': 'minkowski'}. Best is trial 6 with value: 0.8.
[32m[I 2023-04-26 15:46:46,755][39m Trial 134 finished with value: 0.8 and parameters: {'algorithm': 'ball_tree', 'n_neighbors': 2, 'weights': 'distance', 'metric': 'euclidean'}. Best is trial 6 with value: 0.8.
[32m[I 2023-04-26 15:46:46,771][39m Trial 135 finished with value: 0.7428571428571429 and parameters: {'algorithm': 'kd_tree', 'n_neighbors': 2, 'weights': 'uniform', 'metric': 'minkowski'}. Best is trial 6 with value: 0.8.
[32m[I 2023-04-26 15:46:46,802][39m Trial 136 finished with value: 0.8 and parameters: {'algorithm': 'kd_tree', 'n_neighbors': 1, 'weights': 'uniform', 'metric': 'minkowski'}. Best is trial 6 with value: 0.8.
[32m[I 2023-04-26 15:46:46,849][39m Trial 137 finished with value: 0.8 and parameters: {'algorithm': 'auto', 'n_neighbors': 4, 'weights': 'distance', 'metric': 'euclidean'}. Best is trial 6 with value: 0.8.
[32m[I 2023-04-26 15:46:46,896][39m Trial 138 finished with value: 0.8 and parameters: {'algorithm': 'auto', 'n_neighbors': 3, 'weights': 'distance', 'metric': 'euclidean'}. Best is trial 6 with value: 0.8.
[32m[I 2023-04-26 15:46:46,943][39m Trial 139 finished with value: 0.7901234567901235 and parameters: {'algorithm': 'auto', 'n_neighbors': 5, 'weights': 'distance', 'metric': 'euclidean'}. Best is trial 6 with value: 0.8.
[32m[I 2023-04-26 15:46:46,974][39m Trial 140 finished with value: 0.8 and parameters: {'algorithm': 'kd_tree', 'n_neighbors': 1, 'weights': 'uniform', 'metric': 'euclidean'}. Best is trial 6 with value: 0.8.
[32m[I 2023-04-26 15:46:47,005][39m Trial 141 finished with value: 0.8 and parameters: {'algorithm': 'brute', 'n_neighbors': 3, 'weights': 'distance', 'metric': 'euclidean'}. Best is trial 6 with value: 0.8.
[32m[I 2023-04-26 15:46:47,052][39m Trial 142 finished with value: 0.8 and parameters: {'algorithm': 'auto', 'n_neighbors': 2, 'weights': 'distance', 'metric': 'euclidean'}. Best is trial 6 with value: 0.8.
[32m[I 2023-04-26 15:46:47,099][39m Trial 143 finished with value: 0.8 and parameters: {'algorithm': 'auto', 'n_neighbors': 3, 'weights': 'distance', 'metric': 'euclidean'}. Best is trial 6 with value: 0.8.
[32m[I 2023-04-26 15:46:47,161][39m Trial 144 finished with value: 0.8 and parameters: {'algorithm': 'auto', 'n_neighbors': 2, 'weights': 'distance', 'metric': 'minkowski'}. Best is trial 6 with value: 0.8.
[32m[I 2023-04-26 15:46:47,193][39m Trial 145 finished with value: 0.75 and parameters: {'algorithm': 'ball_tree', 'n_neighbors': 4, 'weights': 'uniform', 'metric': 'minkowski'}. Best is trial 6 with value: 0.8.
[32m[I 2023-04-26 15:46:47,224][39m Trial 146 finished with value: 0.8 and parameters: {'algorithm': 'kd_tree', 'n_neighbors': 4, 'weights': 'distance', 'metric': 'minkowski'}. Best is trial 6 with value: 0.8.
[32m[I 2023-04-26 15:46:47,239][39m Trial 147 finished with value: 0.8 and parameters: {'algorithm': 'ball_tree', 'n_neighbors': 3, 'weights': 'distance', 'metric': 'euclidean'}. Best is trial 6 with value: 0.8.
[32m[I 2023-04-26 15:46:47,255][39m Trial 148 finished with value: 0.8 and parameters: {'algorithm': 'ball_tree', 'n_neighbors': 4, 'weights': 'distance', 'metric': 'euclidean'}. Best is trial 6 with value: 0.8.
[32m[I 2023-04-26 15:46:47,271][39m Trial 149 finished with value: 0.7901234567901235 and parameters: {'algorithm': 'ball_tree', 'n_neighbors': 5, 'weights': 'distance', 'metric': 'euclidean'}. Best is trial 6 with value: 0.8.
[32m[I 2023-04-26 15:46:47,302][39m Trial 150 finished with value: 0.7948717948717948 and parameters: {'algorithm': 'ball_tree', 'n_neighbors': 6, 'weights': 'distance', 'metric': 'minkowski'}. Best is trial 6 with value: 0.8.
[32m[I 2023-04-26 15:46:47,318][39m Trial 151 finished with value: 0.8 and parameters: {'algorithm': 'kd_tree', 'n_neighbors': 1, 'weights': 'uniform', 'metric': 'minkowski'}. Best is trial 6 with value: 0.8.
[32m[I 2023-04-26 15:46:47,349][39m Trial 152 finished with value: 0.8 and parameters: {'algorithm': 'kd_tree', 'n_neighbors': 2, 'weights': 'distance', 'metric': 'minkowski'}. Best is trial 6 with value: 0.8.
[32m[I 2023-04-26 15:46:47,364][39m Trial 153 finished with value: 0.8 and parameters: {'algorithm': 'kd_tree', 'n_neighbors': 2, 'weights': 'distance', 'metric': 'minkowski'}. Best is trial 6 with value: 0.8.
[32m[I 2023-04-26 15:46:47,380][39m Trial 154 finished with value: 0.8 and parameters: {'algorithm': 'kd_tree', 'n_neighbors': 2, 'weights': 'distance', 'metric': 'minkowski'}. Best is trial 6 with value: 0.8.
[32m[I 2023-04-26 15:46:47,411][39m Trial 155 finished with value: 0.8 and parameters: {'algorithm': 'kd_tree', 'n_neighbors': 1, 'weights': 'uniform', 'metric': 'minkowski'}. Best is trial 6 with value: 0.8.
[32m[I 2023-04-26 15:46:47,443][39m Trial 156 finished with value: 0.8 and parameters: {'algorithm': 'kd_tree', 'n_neighbors': 1, 'weights': 'uniform', 'metric': 'minkowski'}. Best is trial 6 with value: 0.8.
[32m[I 2023-04-26 15:46:47,522][39m Trial 157 finished with value: 0.8 and parameters: {'algorithm': 'auto', 'n_neighbors': 3, 'weights': 'distance', 'metric': 'euclidean'}. Best is trial 6 with value: 0.8.
[32m[I 2023-04-26 15:46:47,569][39m Trial 158 finished with value: 0.8 and parameters: {'algorithm': 'ball_tree', 'n_neighbors': 3, 'weights': 'distance', 'metric': 'euclidean'}. Best is trial 6 with value: 0.8.
[32m[I 2023-04-26 15:46:47,631][39m Trial 159 finished with value: 0.8 and parameters: {'algorithm': 'brute', 'n_neighbors': 1, 'weights': 'uniform', 'metric': 'minkowski'}. Best is trial 6 with value: 0.8.
[32m[I 2023-04-26 15:46:47,663][39m Trial 160 finished with value: 0.7428571428571429 and parameters: {'algorithm': 'kd_tree', 'n_neighbors': 2, 'weights': 'uniform', 'metric': 'minkowski'}. Best is trial 6 with value: 0.8.
[32m[I 2023-04-26 15:46:47,726][39m Trial 161 finished with value: 0.8 and parameters: {'algorithm': 'brute', 'n_neighbors': 4, 'weights': 'distance', 'metric': 'euclidean'}. Best is trial 6 with value: 0.8.
[32m[I 2023-04-26 15:46:47,805][39m Trial 162 finished with value: 0.8 and parameters: {'algorithm': 'auto', 'n_neighbors': 4, 'weights': 'distance', 'metric': 'euclidean'}. Best is trial 6 with value: 0.8.
[32m[I 2023-04-26 15:46:47,867][39m Trial 163 finished with value: 0.7901234567901235 and parameters: {'algorithm': 'auto', 'n_neighbors': 5, 'weights': 'distance', 'metric': 'euclidean'}. Best is trial 6 with value: 0.8.
[32m[I 2023-04-26 15:46:47,883][39m Trial 164 finished with value: 0.8 and parameters: {'algorithm': 'ball_tree', 'n_neighbors': 3, 'weights': 'distance', 'metric': 'minkowski'}. Best is trial 6 with value: 0.8.
[32m[I 2023-04-26 15:46:47,898][39m Trial 165 finished with value: 0.8 and parameters: {'algorithm': 'ball_tree', 'n_neighbors': 3, 'weights': 'distance', 'metric': 'minkowski'}. Best is trial 6 with value: 0.8.
[32m[I 2023-04-26 15:46:47,929][39m Trial 166 finished with value: 0.8 and parameters: {'algorithm': 'ball_tree', 'n_neighbors': 4, 'weights': 'distance', 'metric': 'minkowski'}. Best is trial 6 with value: 0.8.
[32m[I 2023-04-26 15:46:47,945][39m Trial 167 finished with value: 0.6976744186046511 and parameters: {'algorithm': 'ball_tree', 'n_neighbors': 19, 'weights': 'distance', 'metric': 'euclidean'}. Best is trial 6 with value: 0.8.
[32m[I 2023-04-26 15:46:47,961][39m Trial 168 finished with value: 0.8 and parameters: {'algorithm': 'ball_tree', 'n_neighbors': 4, 'weights': 'distance', 'metric': 'euclidean'}. Best is trial 6 with value: 0.8.
[32m[I 2023-04-26 15:46:47,992][39m Trial 169 finished with value: 0.7252747252747254 and parameters: {'algorithm': 'kd_tree', 'n_neighbors': 24, 'weights': 'distance', 'metric': 'minkowski'}. Best is trial 6 with value: 0.8.
[32m[I 2023-04-26 15:46:48,008][39m Trial 170 finished with value: 0.7073170731707317 and parameters: {'algorithm': 'ball_tree', 'n_neighbors': 14, 'weights': 'distance', 'metric': 'euclidean'}. Best is trial 6 with value: 0.8.
[32m[I 2023-04-26 15:46:48,023][39m Trial 171 finished with value: 0.8 and parameters: {'algorithm': 'ball_tree', 'n_neighbors': 1, 'weights': 'distance', 'metric': 'euclidean'}. Best is trial 6 with value: 0.8.
[32m[I 2023-04-26 15:46:48,055][39m Trial 172 finished with value: 0.8 and parameters: {'algorithm': 'kd_tree', 'n_neighbors': 2, 'weights': 'distance', 'metric': 'minkowski'}. Best is trial 6 with value: 0.8.
[32m[I 2023-04-26 15:46:48,086][39m Trial 173 finished with value: 0.8 and parameters: {'algorithm': 'kd_tree', 'n_neighbors': 2, 'weights': 'distance', 'metric': 'euclidean'}. Best is trial 6 with value: 0.8.
[32m[I 2023-04-26 15:46:48,101][39m Trial 174 finished with value: 0.8 and parameters: {'algorithm': 'kd_tree', 'n_neighbors': 1, 'weights': 'uniform', 'metric': 'euclidean'}. Best is trial 6 with value: 0.8.
[32m[I 2023-04-26 15:46:48,148][39m Trial 175 finished with value: 0.8 and parameters: {'algorithm': 'brute', 'n_neighbors': 1, 'weights': 'uniform', 'metric': 'manhattan'}. Best is trial 6 with value: 0.8.
[32m[I 2023-04-26 15:46:48,197][39m Trial 176 finished with value: 0.8 and parameters: {'algorithm': 'brute', 'n_neighbors': 1, 'weights': 'uniform', 'metric': 'manhattan'}. Best is trial 6 with value: 0.8.
[32m[I 2023-04-26 15:46:48,242][39m Trial 177 finished with value: 0.8 and parameters: {'algorithm': 'brute', 'n_neighbors': 1, 'weights': 'uniform', 'metric': 'manhattan'}. Best is trial 6 with value: 0.8.
[32m[I 2023-04-26 15:46:48,305][39m Trial 178 finished with value: 0.8 and parameters: {'algorithm': 'brute', 'n_neighbors': 1, 'weights': 'uniform', 'metric': 'manhattan'}. Best is trial 6 with value: 0.8.
[32m[I 2023-04-26 15:46:48,352][39m Trial 179 finished with value: 0.7848101265822786 and parameters: {'algorithm': 'auto', 'n_neighbors': 3, 'weights': 'distance', 'metric': 'manhattan'}. Best is trial 6 with value: 0.8.
[32m[I 2023-04-26 15:46:48,414][39m Trial 180 finished with value: 0.725 and parameters: {'algorithm': 'auto', 'n_neighbors': 10, 'weights': 'distance', 'metric': 'euclidean'}. Best is trial 6 with value: 0.8.
[32m[I 2023-04-26 15:46:48,461][39m Trial 181 finished with value: 0.7692307692307694 and parameters: {'algorithm': 'ball_tree', 'n_neighbors': 3, 'weights': 'uniform', 'metric': 'euclidean'}. Best is trial 6 with value: 0.8.
[32m[I 2023-04-26 15:46:48,524][39m Trial 182 finished with value: 0.8 and parameters: {'algorithm': 'auto', 'n_neighbors': 2, 'weights': 'distance', 'metric': 'euclidean'}. Best is trial 6 with value: 0.8.
[32m[I 2023-04-26 15:46:48,571][39m Trial 183 finished with value: 0.8 and parameters: {'algorithm': 'auto', 'n_neighbors': 2, 'weights': 'distance', 'metric': 'euclidean'}. Best is trial 6 with value: 0.8.
[32m[I 2023-04-26 15:46:48,618][39m Trial 184 finished with value: 0.8 and parameters: {'algorithm': 'auto', 'n_neighbors': 2, 'weights': 'distance', 'metric': 'euclidean'}. Best is trial 6 with value: 0.8.
[32m[I 2023-04-26 15:46:48,691][39m Trial 185 finished with value: 0.8 and parameters: {'algorithm': 'auto', 'n_neighbors': 1, 'weights': 'uniform', 'metric': 'manhattan'}. Best is trial 6 with value: 0.8.
[32m[I 2023-04-26 15:46:48,728][39m Trial 186 finished with value: 0.8 and parameters: {'algorithm': 'auto', 'n_neighbors': 1, 'weights': 'uniform', 'metric': 'manhattan'}. Best is trial 6 with value: 0.8.
[32m[I 2023-04-26 15:46:48,744][39m Trial 187 finished with value: 0.7428571428571429 and parameters: {'algorithm': 'kd_tree', 'n_neighbors': 2, 'weights': 'uniform', 'metric': 'minkowski'}. Best is trial 6 with value: 0.8.
[32m[I 2023-04-26 15:46:48,775][39m Trial 188 finished with value: 0.8 and parameters: {'algorithm': 'kd_tree', 'n_neighbors': 2, 'weights': 'distance', 'metric': 'minkowski'}. Best is trial 6 with value: 0.8.
[32m[I 2023-04-26 15:46:48,822][39m Trial 189 finished with value: 0.7848101265822786 and parameters: {'algorithm': 'auto', 'n_neighbors': 3, 'weights': 'distance', 'metric': 'manhattan'}. Best is trial 6 with value: 0.8.
[32m[I 2023-04-26 15:46:48,885][39m Trial 190 finished with value: 0.8 and parameters: {'algorithm': 'auto', 'n_neighbors': 4, 'weights': 'distance', 'metric': 'euclidean'}. Best is trial 6 with value: 0.8.
[32m[I 2023-04-26 15:46:48,932][39m Trial 191 finished with value: 0.7848101265822786 and parameters: {'algorithm': 'auto', 'n_neighbors': 3, 'weights': 'distance', 'metric': 'manhattan'}. Best is trial 6 with value: 0.8.
[32m[I 2023-04-26 15:46:48,994][39m Trial 192 finished with value: 0.8 and parameters: {'algorithm': 'auto', 'n_neighbors': 3, 'weights': 'distance', 'metric': 'euclidean'}. Best is trial 6 with value: 0.8.
[32m[I 2023-04-26 15:46:49,057][39m Trial 193 finished with value: 0.8 and parameters: {'algorithm': 'auto', 'n_neighbors': 2, 'weights': 'distance', 'metric': 'manhattan'}. Best is trial 6 with value: 0.8.
[32m[I 2023-04-26 15:46:49,104][39m Trial 194 finished with value: 0.8 and parameters: {'algorithm': 'auto', 'n_neighbors': 3, 'weights': 'distance', 'metric': 'minkowski'}. Best is trial 6 with value: 0.8.
[32m[I 2023-04-26 15:46:49,150][39m Trial 195 finished with value: 0.8 and parameters: {'algorithm': 'kd_tree', 'n_neighbors': 2, 'weights': 'distance', 'metric': 'minkowski'}. Best is trial 6 with value: 0.8.
[32m[I 2023-04-26 15:46:49,166][39m Trial 196 finished with value: 0.8 and parameters: {'algorithm': 'kd_tree', 'n_neighbors': 2, 'weights': 'distance', 'metric': 'minkowski'}. Best is trial 6 with value: 0.8.
[32m[I 2023-04-26 15:46:49,213][39m Trial 197 finished with value: 0.7594936708860759 and parameters: {'algorithm': 'brute', 'n_neighbors': 5, 'weights': 'distance', 'metric': 'manhattan'}. Best is trial 6 with value: 0.8.
[32m[I 2023-04-26 15:46:49,244][39m Trial 198 finished with value: 0.8 and parameters: {'algorithm': 'ball_tree', 'n_neighbors': 2, 'weights': 'distance', 'metric': 'minkowski'}. Best is trial 6 with value: 0.8.
[32m[I 2023-04-26 15:46:49,260][39m Trial 199 finished with value: 0.8 and parameters: {'algorithm': 'ball_tree', 'n_neighbors': 4, 'weights': 'distance', 'metric': 'minkowski'}. Best is trial 6 with value: 0.8.
[32m[I 2023-04-26 15:46:49,291][39m Trial 200 finished with value: 0.8 and parameters: {'algorithm': 'ball_tree', 'n_neighbors': 4, 'weights': 'distance', 'metric': 'minkowski'}. Best is trial 6 with value: 0.8.
