[32m[I 2023-04-26 15:46:42,083][39m A new study created in memory with name: no-name-1431f0e2-dcca-44da-ba37-7120f553199a
[32m[I 2023-04-26 15:46:42,119][39m Trial 0 finished with value: 0.725 and parameters: {'algorithm': 'kd_tree', 'n_neighbors': 10, 'weights': 'distance', 'metric': 'euclidean'}. Best is trial 0 with value: 0.725.
[32m[I 2023-04-26 15:46:42,130][39m Trial 1 finished with value: 0.7317073170731707 and parameters: {'algorithm': 'ball_tree', 'n_neighbors': 8, 'weights': 'distance', 'metric': 'manhattan'}. Best is trial 1 with value: 0.7317073170731707.
[32m[I 2023-04-26 15:46:42,162][39m Trial 2 finished with value: 0.7102803738317758 and parameters: {'algorithm': 'kd_tree', 'n_neighbors': 25, 'weights': 'uniform', 'metric': 'manhattan'}. Best is trial 1 with value: 0.7317073170731707.
[32m[I 2023-04-26 15:46:42,224][39m Trial 3 finished with value: 0.6904761904761904 and parameters: {'algorithm': 'auto', 'n_neighbors': 16, 'weights': 'distance', 'metric': 'minkowski'}. Best is trial 1 with value: 0.7317073170731707.
[32m[I 2023-04-26 15:46:42,255][39m Trial 4 finished with value: 0.7073170731707317 and parameters: {'algorithm': 'kd_tree', 'n_neighbors': 7, 'weights': 'uniform', 'metric': 'minkowski'}. Best is trial 1 with value: 0.7317073170731707.
[32m[I 2023-04-26 15:46:42,287][39m Trial 5 finished with value: 0.7238095238095238 and parameters: {'algorithm': 'ball_tree', 'n_neighbors': 26, 'weights': 'uniform', 'metric': 'manhattan'}. Best is trial 1 with value: 0.7317073170731707.
[32m[I 2023-04-26 15:46:42,302][39m Trial 6 finished with value: 0.8 and parameters: {'algorithm': 'kd_tree', 'n_neighbors': 3, 'weights': 'distance', 'metric': 'minkowski'}. Best is trial 6 with value: 0.8.
[32m[I 2023-04-26 15:46:42,334][39m Trial 7 finished with value: 0.6930693069306931 and parameters: {'algorithm': 'auto', 'n_neighbors': 18, 'weights': 'uniform', 'metric': 'euclidean'}. Best is trial 6 with value: 0.8.
[32m[I 2023-04-26 15:46:42,412][39m Trial 8 finished with value: 0.7948717948717948 and parameters: {'algorithm': 'brute', 'n_neighbors': 6, 'weights': 'distance', 'metric': 'euclidean'}. Best is trial 6 with value: 0.8.
[32m[I 2023-04-26 15:46:42,460][39m Trial 9 finished with value: 0.6444444444444445 and parameters: {'algorithm': 'brute', 'n_neighbors': 12, 'weights': 'uniform', 'metric': 'minkowski'}. Best is trial 6 with value: 0.8.
[32m[I 2023-04-26 15:46:42,476][39m Trial 10 finished with value: 0.8 and parameters: {'algorithm': 'kd_tree', 'n_neighbors': 2, 'weights': 'distance', 'metric': 'minkowski'}. Best is trial 6 with value: 0.8.
[32m[I 2023-04-26 15:46:42,491][39m Trial 11 finished with value: 0.8 and parameters: {'algorithm': 'kd_tree', 'n_neighbors': 1, 'weights': 'distance', 'metric': 'minkowski'}. Best is trial 6 with value: 0.8.
[32m[I 2023-04-26 15:46:42,507][39m Trial 12 finished with value: 0.8 and parameters: {'algorithm': 'kd_tree', 'n_neighbors': 1, 'weights': 'distance', 'metric': 'minkowski'}. Best is trial 6 with value: 0.8.
[32m[I 2023-04-26 15:46:42,523][39m Trial 13 finished with value: 0.8 and parameters: {'algorithm': 'kd_tree', 'n_neighbors': 4, 'weights': 'distance', 'metric': 'minkowski'}. Best is trial 6 with value: 0.8.
[32m[I 2023-04-26 15:46:42,538][39m Trial 14 finished with value: 0.7191011235955055 and parameters: {'algorithm': 'kd_tree', 'n_neighbors': 21, 'weights': 'distance', 'metric': 'minkowski'}. Best is trial 6 with value: 0.8.
[32m[I 2023-04-26 15:46:42,554][39m Trial 15 finished with value: 0.7083333333333334 and parameters: {'algorithm': 'kd_tree', 'n_neighbors': 30, 'weights': 'distance', 'metric': 'minkowski'}. Best is trial 6 with value: 0.8.
[32m[I 2023-04-26 15:46:42,633][39m Trial 16 finished with value: 0.6913580246913581 and parameters: {'algorithm': 'auto', 'n_neighbors': 13, 'weights': 'distance', 'metric': 'minkowski'}. Best is trial 6 with value: 0.8.
[32m[I 2023-04-26 15:46:42,696][39m Trial 17 finished with value: 0.7901234567901235 and parameters: {'algorithm': 'brute', 'n_neighbors': 5, 'weights': 'distance', 'metric': 'minkowski'}. Best is trial 6 with value: 0.8.
[32m[I 2023-04-26 15:46:42,711][39m Trial 18 finished with value: 0.8 and parameters: {'algorithm': 'ball_tree', 'n_neighbors': 4, 'weights': 'distance', 'metric': 'euclidean'}. Best is trial 6 with value: 0.8.
[32m[I 2023-04-26 15:46:42,727][39m Trial 19 finished with value: 0.7088607594936709 and parameters: {'algorithm': 'ball_tree', 'n_neighbors': 11, 'weights': 'distance', 'metric': 'euclidean'}. Best is trial 6 with value: 0.8.
[32m[I 2023-04-26 15:46:42,742][39m Trial 20 finished with value: 0.7317073170731707 and parameters: {'algorithm': 'kd_tree', 'n_neighbors': 9, 'weights': 'distance', 'metric': 'manhattan'}. Best is trial 6 with value: 0.8.
[32m[I 2023-04-26 15:46:42,758][39m Trial 21 finished with value: 0.8 and parameters: {'algorithm': 'ball_tree', 'n_neighbors': 4, 'weights': 'distance', 'metric': 'euclidean'}. Best is trial 6 with value: 0.8.
[32m[I 2023-04-26 15:46:42,774][39m Trial 22 finished with value: 0.8 and parameters: {'algorithm': 'ball_tree', 'n_neighbors': 3, 'weights': 'distance', 'metric': 'euclidean'}. Best is trial 6 with value: 0.8.
[32m[I 2023-04-26 15:46:42,789][39m Trial 23 finished with value: 0.8 and parameters: {'algorithm': 'ball_tree', 'n_neighbors': 1, 'weights': 'distance', 'metric': 'euclidean'}. Best is trial 6 with value: 0.8.
[32m[I 2023-04-26 15:46:42,805][39m Trial 24 finished with value: 0.7901234567901235 and parameters: {'algorithm': 'ball_tree', 'n_neighbors': 5, 'weights': 'distance', 'metric': 'euclidean'}. Best is trial 6 with value: 0.8.
[32m[I 2023-04-26 15:46:42,821][39m Trial 25 finished with value: 0.8 and parameters: {'algorithm': 'ball_tree', 'n_neighbors': 1, 'weights': 'distance', 'metric': 'euclidean'}. Best is trial 6 with value: 0.8.
[32m[I 2023-04-26 15:46:42,852][39m Trial 26 finished with value: 0.8 and parameters: {'algorithm': 'ball_tree', 'n_neighbors': 1, 'weights': 'uniform', 'metric': 'euclidean'}. Best is trial 6 with value: 0.8.
[32m[I 2023-04-26 15:46:42,867][39m Trial 27 finished with value: 0.7073170731707317 and parameters: {'algorithm': 'ball_tree', 'n_neighbors': 14, 'weights': 'distance', 'metric': 'euclidean'}. Best is trial 6 with value: 0.8.
[32m[I 2023-04-26 15:46:42,883][39m Trial 28 finished with value: 0.7407407407407408 and parameters: {'algorithm': 'ball_tree', 'n_neighbors': 7, 'weights': 'distance', 'metric': 'euclidean'}. Best is trial 6 with value: 0.8.
[32m[I 2023-04-26 15:46:42,946][39m Trial 29 finished with value: 0.6666666666666667 and parameters: {'algorithm': 'brute', 'n_neighbors': 10, 'weights': 'uniform', 'metric': 'euclidean'}. Best is trial 6 with value: 0.8.
[32m[I 2023-04-26 15:46:43,039][39m Trial 30 finished with value: 0.8 and parameters: {'algorithm': 'auto', 'n_neighbors': 4, 'weights': 'distance', 'metric': 'euclidean'}. Best is trial 6 with value: 0.8.
[32m[I 2023-04-26 15:46:43,102][39m Trial 31 finished with value: 0.7532467532467532 and parameters: {'algorithm': 'auto', 'n_neighbors': 5, 'weights': 'uniform', 'metric': 'euclidean'}. Best is trial 6 with value: 0.8.
[32m[I 2023-04-26 15:46:43,180][39m Trial 32 finished with value: 0.725 and parameters: {'algorithm': 'auto', 'n_neighbors': 8, 'weights': 'distance', 'metric': 'euclidean'}. Best is trial 6 with value: 0.8.
[32m[I 2023-04-26 15:46:43,242][39m Trial 33 finished with value: 0.7848101265822786 and parameters: {'algorithm': 'auto', 'n_neighbors': 3, 'weights': 'distance', 'metric': 'manhattan'}. Best is trial 6 with value: 0.8.
[32m[I 2023-04-26 15:46:43,289][39m Trial 34 finished with value: 0.7692307692307694 and parameters: {'algorithm': 'ball_tree', 'n_neighbors': 3, 'weights': 'uniform', 'metric': 'euclidean'}. Best is trial 6 with value: 0.8.
[32m[I 2023-04-26 15:46:43,305][39m Trial 35 finished with value: 0.8 and parameters: {'algorithm': 'ball_tree', 'n_neighbors': 1, 'weights': 'uniform', 'metric': 'euclidean'}. Best is trial 6 with value: 0.8.
[32m[I 2023-04-26 15:46:43,336][39m Trial 36 finished with value: 0.7428571428571429 and parameters: {'algorithm': 'ball_tree', 'n_neighbors': 2, 'weights': 'uniform', 'metric': 'euclidean'}. Best is trial 6 with value: 0.8.
[32m[I 2023-04-26 15:46:43,352][39m Trial 37 finished with value: 0.7407407407407408 and parameters: {'algorithm': 'ball_tree', 'n_neighbors': 7, 'weights': 'distance', 'metric': 'euclidean'}. Best is trial 6 with value: 0.8.
[32m[I 2023-04-26 15:46:43,367][39m Trial 38 finished with value: 0.7586206896551724 and parameters: {'algorithm': 'ball_tree', 'n_neighbors': 18, 'weights': 'distance', 'metric': 'manhattan'}. Best is trial 6 with value: 0.8.
[32m[I 2023-04-26 15:46:43,383][39m Trial 39 finished with value: 0.7317073170731707 and parameters: {'algorithm': 'ball_tree', 'n_neighbors': 9, 'weights': 'distance', 'metric': 'manhattan'}. Best is trial 6 with value: 0.8.
[32m[I 2023-04-26 15:46:43,399][39m Trial 40 finished with value: 0.7948717948717948 and parameters: {'algorithm': 'ball_tree', 'n_neighbors': 6, 'weights': 'distance', 'metric': 'euclidean'}. Best is trial 6 with value: 0.8.
[32m[I 2023-04-26 15:46:43,415][39m Trial 41 finished with value: 0.7428571428571429 and parameters: {'algorithm': 'ball_tree', 'n_neighbors': 2, 'weights': 'uniform', 'metric': 'euclidean'}. Best is trial 6 with value: 0.8.
[32m[I 2023-04-26 15:46:43,446][39m Trial 42 finished with value: 0.8 and parameters: {'algorithm': 'ball_tree', 'n_neighbors': 1, 'weights': 'uniform', 'metric': 'euclidean'}. Best is trial 6 with value: 0.8.
[32m[I 2023-04-26 15:46:43,510][39m Trial 43 finished with value: 0.7397260273972602 and parameters: {'algorithm': 'auto', 'n_neighbors': 4, 'weights': 'uniform', 'metric': 'euclidean'}. Best is trial 6 with value: 0.8.
[32m[I 2023-04-26 15:46:43,541][39m Trial 44 finished with value: 0.7692307692307694 and parameters: {'algorithm': 'ball_tree', 'n_neighbors': 3, 'weights': 'uniform', 'metric': 'euclidean'}. Best is trial 6 with value: 0.8.
[32m[I 2023-04-26 15:46:43,557][39m Trial 45 finished with value: 0.8 and parameters: {'algorithm': 'kd_tree', 'n_neighbors': 1, 'weights': 'distance', 'metric': 'minkowski'}. Best is trial 6 with value: 0.8.
[32m[I 2023-04-26 15:46:43,620][39m Trial 46 finished with value: 0.7323943661971831 and parameters: {'algorithm': 'auto', 'n_neighbors': 2, 'weights': 'uniform', 'metric': 'euclidean'}. Best is trial 6 with value: 0.8.
[32m[I 2023-04-26 15:46:43,693][39m Trial 47 finished with value: 0.7948717948717948 and parameters: {'algorithm': 'brute', 'n_neighbors': 6, 'weights': 'distance', 'metric': 'euclidean'}. Best is trial 6 with value: 0.8.
[32m[I 2023-04-26 15:46:43,730][39m Trial 48 finished with value: 0.8 and parameters: {'algorithm': 'kd_tree', 'n_neighbors': 1, 'weights': 'uniform', 'metric': 'minkowski'}. Best is trial 6 with value: 0.8.
[32m[I 2023-04-26 15:46:43,745][39m Trial 49 finished with value: 0.6976744186046511 and parameters: {'algorithm': 'kd_tree', 'n_neighbors': 20, 'weights': 'distance', 'metric': 'minkowski'}. Best is trial 6 with value: 0.8.
[32m[I 2023-04-26 15:46:43,777][39m Trial 50 finished with value: 0.6846846846846847 and parameters: {'algorithm': 'kd_tree', 'n_neighbors': 27, 'weights': 'uniform', 'metric': 'minkowski'}. Best is trial 6 with value: 0.8.
[32m[I 2023-04-26 15:46:43,792][39m Trial 51 finished with value: 0.8 and parameters: {'algorithm': 'kd_tree', 'n_neighbors': 3, 'weights': 'distance', 'metric': 'minkowski'}. Best is trial 6 with value: 0.8.
[32m[I 2023-04-26 15:46:43,808][39m Trial 52 finished with value: 0.8 and parameters: {'algorithm': 'kd_tree', 'n_neighbors': 1, 'weights': 'uniform', 'metric': 'minkowski'}. Best is trial 6 with value: 0.8.
[32m[I 2023-04-26 15:46:43,839][39m Trial 53 finished with value: 0.8 and parameters: {'algorithm': 'kd_tree', 'n_neighbors': 1, 'weights': 'uniform', 'metric': 'minkowski'}. Best is trial 6 with value: 0.8.
[32m[I 2023-04-26 15:46:43,855][39m Trial 54 finished with value: 0.7428571428571429 and parameters: {'algorithm': 'kd_tree', 'n_neighbors': 2, 'weights': 'uniform', 'metric': 'minkowski'}. Best is trial 6 with value: 0.8.
[32m[I 2023-04-26 15:46:43,933][39m Trial 55 finished with value: 0.7594936708860759 and parameters: {'algorithm': 'auto', 'n_neighbors': 5, 'weights': 'distance', 'metric': 'manhattan'}. Best is trial 6 with value: 0.8.
[32m[I 2023-04-26 15:46:43,964][39m Trial 56 finished with value: 0.8 and parameters: {'algorithm': 'ball_tree', 'n_neighbors': 4, 'weights': 'distance', 'metric': 'euclidean'}. Best is trial 6 with value: 0.8.
[32m[I 2023-04-26 15:46:43,995][39m Trial 57 finished with value: 0.8 and parameters: {'algorithm': 'ball_tree', 'n_neighbors': 4, 'weights': 'distance', 'metric': 'euclidean'}. Best is trial 6 with value: 0.8.
[32m[I 2023-04-26 15:46:44,011][39m Trial 58 finished with value: 0.725 and parameters: {'algorithm': 'ball_tree', 'n_neighbors': 8, 'weights': 'distance', 'metric': 'euclidean'}. Best is trial 6 with value: 0.8.
[32m[I 2023-04-26 15:46:44,042][39m Trial 59 finished with value: 0.8 and parameters: {'algorithm': 'ball_tree', 'n_neighbors': 4, 'weights': 'distance', 'metric': 'euclidean'}. Best is trial 6 with value: 0.8.
[32m[I 2023-04-26 15:46:44,074][39m Trial 60 finished with value: 0.7733333333333334 and parameters: {'algorithm': 'brute', 'n_neighbors': 6, 'weights': 'uniform', 'metric': 'euclidean'}. Best is trial 6 with value: 0.8.
[32m[I 2023-04-26 15:46:44,105][39m Trial 61 finished with value: 0.8 and parameters: {'algorithm': 'ball_tree', 'n_neighbors': 3, 'weights': 'distance', 'metric': 'euclidean'}. Best is trial 6 with value: 0.8.
[32m[I 2023-04-26 15:46:44,123][39m Trial 62 finished with value: 0.7428571428571429 and parameters: {'algorithm': 'ball_tree', 'n_neighbors': 2, 'weights': 'uniform', 'metric': 'euclidean'}. Best is trial 6 with value: 0.8.
[32m[I 2023-04-26 15:46:44,137][39m Trial 63 finished with value: 0.7901234567901235 and parameters: {'algorithm': 'ball_tree', 'n_neighbors': 5, 'weights': 'distance', 'metric': 'euclidean'}. Best is trial 6 with value: 0.8.
[32m[I 2023-04-26 15:46:44,153][39m Trial 64 finished with value: 0.7073170731707317 and parameters: {'algorithm': 'ball_tree', 'n_neighbors': 15, 'weights': 'distance', 'metric': 'minkowski'}. Best is trial 6 with value: 0.8.
[32m[I 2023-04-26 15:46:44,184][39m Trial 65 finished with value: 0.8 and parameters: {'algorithm': 'kd_tree', 'n_neighbors': 1, 'weights': 'uniform', 'metric': 'minkowski'}. Best is trial 6 with value: 0.8.
[32m[I 2023-04-26 15:46:44,199][39m Trial 66 finished with value: 0.8 and parameters: {'algorithm': 'kd_tree', 'n_neighbors': 1, 'weights': 'uniform', 'metric': 'minkowski'}. Best is trial 6 with value: 0.8.
[32m[I 2023-04-26 15:46:44,215][39m Trial 67 finished with value: 0.7428571428571429 and parameters: {'algorithm': 'ball_tree', 'n_neighbors': 2, 'weights': 'uniform', 'metric': 'euclidean'}. Best is trial 6 with value: 0.8.
[32m[I 2023-04-26 15:46:44,246][39m Trial 68 finished with value: 0.8 and parameters: {'algorithm': 'kd_tree', 'n_neighbors': 3, 'weights': 'distance', 'metric': 'minkowski'}. Best is trial 6 with value: 0.8.
[32m[I 2023-04-26 15:46:44,418][39m Trial 69 finished with value: 0.8 and parameters: {'algorithm': 'auto', 'n_neighbors': 3, 'weights': 'distance', 'metric': 'euclidean'}. Best is trial 6 with value: 0.8.
[32m[I 2023-04-26 15:46:44,466][39m Trial 70 finished with value: 0.8 and parameters: {'algorithm': 'auto', 'n_neighbors': 1, 'weights': 'distance', 'metric': 'euclidean'}. Best is trial 6 with value: 0.8.
[32m[I 2023-04-26 15:46:44,513][39m Trial 71 finished with value: 0.7323943661971831 and parameters: {'algorithm': 'auto', 'n_neighbors': 2, 'weights': 'uniform', 'metric': 'euclidean'}. Best is trial 6 with value: 0.8.
[32m[I 2023-04-26 15:46:44,528][39m Trial 72 finished with value: 0.8 and parameters: {'algorithm': 'kd_tree', 'n_neighbors': 1, 'weights': 'uniform', 'metric': 'minkowski'}. Best is trial 6 with value: 0.8.
[32m[I 2023-04-26 15:46:44,544][39m Trial 73 finished with value: 0.8 and parameters: {'algorithm': 'ball_tree', 'n_neighbors': 4, 'weights': 'distance', 'metric': 'euclidean'}. Best is trial 6 with value: 0.8.
[32m[I 2023-04-26 15:46:44,560][39m Trial 74 finished with value: 0.8 and parameters: {'algorithm': 'ball_tree', 'n_neighbors': 4, 'weights': 'distance', 'metric': 'euclidean'}. Best is trial 6 with value: 0.8.
[32m[I 2023-04-26 15:46:44,591][39m Trial 75 finished with value: 0.7901234567901235 and parameters: {'algorithm': 'ball_tree', 'n_neighbors': 5, 'weights': 'distance', 'metric': 'euclidean'}. Best is trial 6 with value: 0.8.
[32m[I 2023-04-26 15:46:44,633][39m Trial 76 finished with value: 0.7317073170731707 and parameters: {'algorithm': 'brute', 'n_neighbors': 7, 'weights': 'distance', 'metric': 'manhattan'}. Best is trial 6 with value: 0.8.
[32m[I 2023-04-26 15:46:44,654][39m Trial 77 finished with value: 0.7948717948717948 and parameters: {'algorithm': 'ball_tree', 'n_neighbors': 6, 'weights': 'distance', 'metric': 'euclidean'}. Best is trial 6 with value: 0.8.
[32m[I 2023-04-26 15:46:44,672][39m Trial 78 finished with value: 0.675 and parameters: {'algorithm': 'ball_tree', 'n_neighbors': 12, 'weights': 'distance', 'metric': 'euclidean'}. Best is trial 6 with value: 0.8.
[32m[I 2023-04-26 15:46:44,692][39m Trial 79 finished with value: 0.8 and parameters: {'algorithm': 'ball_tree', 'n_neighbors': 1, 'weights': 'uniform', 'metric': 'euclidean'}. Best is trial 6 with value: 0.8.
[32m[I 2023-04-26 15:46:44,718][39m Trial 80 finished with value: 0.6981132075471698 and parameters: {'algorithm': 'ball_tree', 'n_neighbors': 23, 'weights': 'uniform', 'metric': 'euclidean'}. Best is trial 6 with value: 0.8.
[32m[I 2023-04-26 15:46:44,733][39m Trial 81 finished with value: 0.7428571428571429 and parameters: {'algorithm': 'ball_tree', 'n_neighbors': 2, 'weights': 'uniform', 'metric': 'euclidean'}. Best is trial 6 with value: 0.8.
[32m[I 2023-04-26 15:46:44,749][39m Trial 82 finished with value: 0.8 and parameters: {'algorithm': 'ball_tree', 'n_neighbors': 3, 'weights': 'distance', 'metric': 'euclidean'}. Best is trial 6 with value: 0.8.
[32m[I 2023-04-26 15:46:44,780][39m Trial 83 finished with value: 0.8 and parameters: {'algorithm': 'ball_tree', 'n_neighbors': 3, 'weights': 'distance', 'metric': 'euclidean'}. Best is trial 6 with value: 0.8.
[32m[I 2023-04-26 15:46:44,796][39m Trial 84 finished with value: 0.8 and parameters: {'algorithm': 'ball_tree', 'n_neighbors': 4, 'weights': 'distance', 'metric': 'euclidean'}. Best is trial 6 with value: 0.8.
[32m[I 2023-04-26 15:46:44,811][39m Trial 85 finished with value: 0.8 and parameters: {'algorithm': 'kd_tree', 'n_neighbors': 1, 'weights': 'uniform', 'metric': 'minkowski'}. Best is trial 6 with value: 0.8.
[32m[I 2023-04-26 15:46:44,843][39m Trial 86 finished with value: 0.7428571428571429 and parameters: {'algorithm': 'kd_tree', 'n_neighbors': 2, 'weights': 'uniform', 'metric': 'minkowski'}. Best is trial 6 with value: 0.8.
[32m[I 2023-04-26 15:46:44,858][39m Trial 87 finished with value: 0.7901234567901235 and parameters: {'algorithm': 'ball_tree', 'n_neighbors': 5, 'weights': 'distance', 'metric': 'euclidean'}. Best is trial 6 with value: 0.8.
[32m[I 2023-04-26 15:46:44,936][39m Trial 88 finished with value: 0.7848101265822786 and parameters: {'algorithm': 'auto', 'n_neighbors': 3, 'weights': 'distance', 'metric': 'manhattan'}. Best is trial 6 with value: 0.8.
[32m[I 2023-04-26 15:46:44,999][39m Trial 89 finished with value: 0.8 and parameters: {'algorithm': 'auto', 'n_neighbors': 3, 'weights': 'distance', 'metric': 'euclidean'}. Best is trial 6 with value: 0.8.
[32m[I 2023-04-26 15:46:45,061][39m Trial 90 finished with value: 0.8 and parameters: {'algorithm': 'auto', 'n_neighbors': 2, 'weights': 'distance', 'metric': 'minkowski'}. Best is trial 6 with value: 0.8.
[32m[I 2023-04-26 15:46:45,108][39m Trial 91 finished with value: 0.75 and parameters: {'algorithm': 'kd_tree', 'n_neighbors': 4, 'weights': 'uniform', 'metric': 'minkowski'}. Best is trial 6 with value: 0.8.
[32m[I 2023-04-26 15:46:45,155][39m Trial 92 finished with value: 0.8 and parameters: {'algorithm': 'auto', 'n_neighbors': 1, 'weights': 'uniform', 'metric': 'minkowski'}. Best is trial 6 with value: 0.8.
[32m[I 2023-04-26 15:46:45,218][39m Trial 93 finished with value: 0.7407407407407408 and parameters: {'algorithm': 'auto', 'n_neighbors': 7, 'weights': 'distance', 'metric': 'euclidean'}. Best is trial 6 with value: 0.8.
[32m[I 2023-04-26 15:46:45,249][39m Trial 94 finished with value: 0.8 and parameters: {'algorithm': 'ball_tree', 'n_neighbors': 4, 'weights': 'distance', 'metric': 'euclidean'}. Best is trial 6 with value: 0.8.
[32m[I 2023-04-26 15:46:45,280][39m Trial 95 finished with value: 0.8 and parameters: {'algorithm': 'kd_tree', 'n_neighbors': 3, 'weights': 'distance', 'metric': 'minkowski'}. Best is trial 6 with value: 0.8.
[32m[I 2023-04-26 15:46:45,296][39m Trial 96 finished with value: 0.8 and parameters: {'algorithm': 'kd_tree', 'n_neighbors': 3, 'weights': 'distance', 'metric': 'minkowski'}. Best is trial 6 with value: 0.8.
[32m[I 2023-04-26 15:46:45,327][39m Trial 97 finished with value: 0.7532467532467532 and parameters: {'algorithm': 'kd_tree', 'n_neighbors': 5, 'weights': 'uniform', 'metric': 'minkowski'}. Best is trial 6 with value: 0.8.
[32m[I 2023-04-26 15:46:45,374][39m Trial 98 finished with value: 0.6930693069306931 and parameters: {'algorithm': 'auto', 'n_neighbors': 17, 'weights': 'uniform', 'metric': 'euclidean'}. Best is trial 6 with value: 0.8.
