[32m[I 2023-04-26 00:11:30,524][39m Trial 395 finished with value: 0.8695652173913043 and parameters: {'objective': 'CrossEntropy', 'colsample_bylevel': 0.05099116611142968, 'depth': 4, 'boosting_type': 'Plain', 'bootstrap_type': 'Bayesian', 'bagging_temperature': 8.280144632368579}. Best is trial 126 with value: 0.8771929824561403.
[32m[I 2023-04-26 00:11:32,327][39m Trial 396 finished with value: 0.831858407079646 and parameters: {'objective': 'CrossEntropy', 'colsample_bylevel': 0.050548158002167956, 'depth': 6, 'boosting_type': 'Plain', 'bootstrap_type': 'Bayesian', 'bagging_temperature': 8.366322055425979}. Best is trial 126 with value: 0.8771929824561403.
[32m[I 2023-04-26 00:11:34,133][39m Trial 397 finished with value: 0.8392857142857144 and parameters: {'objective': 'CrossEntropy', 'colsample_bylevel': 0.04837991037949123, 'depth': 6, 'boosting_type': 'Plain', 'bootstrap_type': 'Bayesian', 'bagging_temperature': 8.085002779590534}. Best is trial 126 with value: 0.8771929824561403.
[32m[I 2023-04-26 00:11:36,081][39m Trial 398 finished with value: 0.8571428571428572 and parameters: {'objective': 'CrossEntropy', 'colsample_bylevel': 0.06145201665590291, 'depth': 7, 'boosting_type': 'Plain', 'bootstrap_type': 'Bayesian', 'bagging_temperature': 9.153601578375623}. Best is trial 126 with value: 0.8771929824561403.
[32m[I 2023-04-26 00:11:37,755][39m Trial 399 finished with value: 0.8521739130434783 and parameters: {'objective': 'CrossEntropy', 'colsample_bylevel': 0.0458016222835072, 'depth': 6, 'boosting_type': 'Plain', 'bootstrap_type': 'Bayesian', 'bagging_temperature': 8.530840011478777}. Best is trial 126 with value: 0.8771929824561403.
[32m[I 2023-04-26 00:11:39,417][39m Trial 400 finished with value: 0.8521739130434783 and parameters: {'objective': 'CrossEntropy', 'colsample_bylevel': 0.04707002663484628, 'depth': 6, 'boosting_type': 'Plain', 'bootstrap_type': 'Bayesian', 'bagging_temperature': 8.875653756291934}. Best is trial 126 with value: 0.8771929824561403.
[32m[I 2023-04-26 00:11:41,065][39m Trial 401 finished with value: 0.8421052631578947 and parameters: {'objective': 'CrossEntropy', 'colsample_bylevel': 0.047982662814972314, 'depth': 6, 'boosting_type': 'Plain', 'bootstrap_type': 'Bayesian', 'bagging_temperature': 7.565231169432974}. Best is trial 126 with value: 0.8771929824561403.
[32m[I 2023-04-26 00:11:42,775][39m Trial 402 finished with value: 0.875 and parameters: {'objective': 'CrossEntropy', 'colsample_bylevel': 0.0512908504241765, 'depth': 5, 'boosting_type': 'Plain', 'bootstrap_type': 'Bayesian', 'bagging_temperature': 6.214632407762913}. Best is trial 126 with value: 0.8771929824561403.
[32m[I 2023-04-26 00:11:44,329][39m Trial 403 finished with value: 0.8521739130434783 and parameters: {'objective': 'CrossEntropy', 'colsample_bylevel': 0.04504236815927076, 'depth': 5, 'boosting_type': 'Plain', 'bootstrap_type': 'Bayesian', 'bagging_temperature': 6.019316969615965}. Best is trial 126 with value: 0.8771929824561403.
[32m[I 2023-04-26 00:11:46,057][39m Trial 404 finished with value: 0.8521739130434783 and parameters: {'objective': 'CrossEntropy', 'colsample_bylevel': 0.0527295531770903, 'depth': 5, 'boosting_type': 'Plain', 'bootstrap_type': 'Bayesian', 'bagging_temperature': 7.871167878861946}. Best is trial 126 with value: 0.8771929824561403.
[32m[I 2023-04-26 00:11:47,752][39m Trial 405 finished with value: 0.8596491228070176 and parameters: {'objective': 'CrossEntropy', 'colsample_bylevel': 0.049577915545235676, 'depth': 5, 'boosting_type': 'Plain', 'bootstrap_type': 'Bayesian', 'bagging_temperature': 7.173114154723741}. Best is trial 126 with value: 0.8771929824561403.
[32m[I 2023-04-26 00:11:49,622][39m Trial 406 finished with value: 0.8495575221238938 and parameters: {'objective': 'CrossEntropy', 'colsample_bylevel': 0.05370191181257892, 'depth': 6, 'boosting_type': 'Plain', 'bootstrap_type': 'Bayesian', 'bagging_temperature': 6.296787590165509}. Best is trial 126 with value: 0.8771929824561403.
[32m[I 2023-04-26 00:11:51,330][39m Trial 407 finished with value: 0.8620689655172413 and parameters: {'objective': 'CrossEntropy', 'colsample_bylevel': 0.04306999459232809, 'depth': 7, 'boosting_type': 'Plain', 'bootstrap_type': 'Bayesian', 'bagging_temperature': 6.178577288598893}. Best is trial 126 with value: 0.8771929824561403.
[32m[I 2023-04-26 00:11:52,953][39m Trial 408 finished with value: 0.8596491228070176 and parameters: {'objective': 'CrossEntropy', 'colsample_bylevel': 0.055861699451611756, 'depth': 4, 'boosting_type': 'Plain', 'bootstrap_type': 'Bayesian', 'bagging_temperature': 6.465803683307948}. Best is trial 126 with value: 0.8771929824561403.
[32m[I 2023-04-26 00:11:54,639][39m Trial 409 finished with value: 0.8495575221238938 and parameters: {'objective': 'CrossEntropy', 'colsample_bylevel': 0.05249408287400481, 'depth': 5, 'boosting_type': 'Plain', 'bootstrap_type': 'Bayesian', 'bagging_temperature': 6.582907941371569}. Best is trial 126 with value: 0.8771929824561403.
[32m[I 2023-04-26 00:11:56,323][39m Trial 410 finished with value: 0.8596491228070176 and parameters: {'objective': 'CrossEntropy', 'colsample_bylevel': 0.051590999642775595, 'depth': 5, 'boosting_type': 'Plain', 'bootstrap_type': 'Bayesian', 'bagging_temperature': 8.339635289584198}. Best is trial 126 with value: 0.8771929824561403.
[32m[I 2023-04-26 00:11:57,842][39m Trial 411 finished with value: 0.8347826086956522 and parameters: {'objective': 'CrossEntropy', 'colsample_bylevel': 0.039104022420919864, 'depth': 4, 'boosting_type': 'Plain', 'bootstrap_type': 'MVS'}. Best is trial 126 with value: 0.8771929824561403.
[32m[I 2023-04-26 00:11:59,810][39m Trial 412 finished with value: 0.8495575221238938 and parameters: {'objective': 'CrossEntropy', 'colsample_bylevel': 0.05186488701396993, 'depth': 6, 'boosting_type': 'Plain', 'bootstrap_type': 'Bayesian', 'bagging_temperature': 9.374055660425839}. Best is trial 126 with value: 0.8771929824561403.
[32m[I 2023-04-26 00:12:01,495][39m Trial 413 finished with value: 0.8521739130434783 and parameters: {'objective': 'CrossEntropy', 'colsample_bylevel': 0.04376621786790356, 'depth': 6, 'boosting_type': 'Plain', 'bootstrap_type': 'Bayesian', 'bagging_temperature': 8.668792220880489}. Best is trial 126 with value: 0.8771929824561403.
[32m[I 2023-04-26 00:12:03,208][39m Trial 414 finished with value: 0.8571428571428572 and parameters: {'objective': 'CrossEntropy', 'colsample_bylevel': 0.04920241404931251, 'depth': 5, 'boosting_type': 'Plain', 'bootstrap_type': 'Bayesian', 'bagging_temperature': 7.089204599222401}. Best is trial 126 with value: 0.8771929824561403.
[32m[I 2023-04-26 00:12:04,559][39m Trial 415 finished with value: 0.847457627118644 and parameters: {'objective': 'CrossEntropy', 'colsample_bylevel': 0.02339507706689007, 'depth': 5, 'boosting_type': 'Plain', 'bootstrap_type': 'Bayesian', 'bagging_temperature': 8.071633017842718}. Best is trial 126 with value: 0.8771929824561403.
[32m[I 2023-04-26 00:12:06,528][39m Trial 416 finished with value: 0.8571428571428572 and parameters: {'objective': 'CrossEntropy', 'colsample_bylevel': 0.04618825430729318, 'depth': 8, 'boosting_type': 'Plain', 'bootstrap_type': 'Bayesian', 'bagging_temperature': 5.462581407748166}. Best is trial 126 with value: 0.8771929824561403.
[32m[I 2023-04-26 00:12:08,209][39m Trial 417 finished with value: 0.8392857142857144 and parameters: {'objective': 'CrossEntropy', 'colsample_bylevel': 0.05716942475800816, 'depth': 4, 'boosting_type': 'Plain', 'bootstrap_type': 'Bayesian', 'bagging_temperature': 9.61028058038445}. Best is trial 126 with value: 0.8771929824561403.
[32m[I 2023-04-26 00:12:09,876][39m Trial 418 finished with value: 0.8547008547008546 and parameters: {'objective': 'CrossEntropy', 'colsample_bylevel': 0.054523013706602196, 'depth': 4, 'boosting_type': 'Plain', 'bootstrap_type': 'Bayesian', 'bagging_temperature': 9.087673778684815}. Best is trial 126 with value: 0.8771929824561403.
[32m[I 2023-04-26 00:12:12,225][39m Trial 419 finished with value: 0.8571428571428572 and parameters: {'objective': 'CrossEntropy', 'colsample_bylevel': 0.04815489199489105, 'depth': 9, 'boosting_type': 'Plain', 'bootstrap_type': 'Bayesian', 'bagging_temperature': 8.559825836912434}. Best is trial 126 with value: 0.8771929824561403.
[32m[I 2023-04-26 00:12:14,061][39m Trial 420 finished with value: 0.8596491228070176 and parameters: {'objective': 'CrossEntropy', 'colsample_bylevel': 0.05040035716120248, 'depth': 6, 'boosting_type': 'Plain', 'bootstrap_type': 'Bayesian', 'bagging_temperature': 6.832911098360581}. Best is trial 126 with value: 0.8771929824561403.
[32m[I 2023-04-26 00:12:16,449][39m Trial 421 finished with value: 0.831858407079646 and parameters: {'objective': 'CrossEntropy', 'colsample_bylevel': 0.05794976846669889, 'depth': 8, 'boosting_type': 'Plain', 'bootstrap_type': 'Bayesian', 'bagging_temperature': 5.6914716812832955}. Best is trial 126 with value: 0.8771929824561403.
[32m[I 2023-04-26 00:12:18,157][39m Trial 422 finished with value: 0.8620689655172413 and parameters: {'objective': 'CrossEntropy', 'colsample_bylevel': 0.056039603130048084, 'depth': 4, 'boosting_type': 'Plain', 'bootstrap_type': 'Bayesian', 'bagging_temperature': 8.867853175555428}. Best is trial 126 with value: 0.8771929824561403.
[32m[I 2023-04-26 00:12:19,925][39m Trial 423 finished with value: 0.8347826086956522 and parameters: {'objective': 'CrossEntropy', 'colsample_bylevel': 0.05451898924466926, 'depth': 5, 'boosting_type': 'Plain', 'bootstrap_type': 'Bayesian', 'bagging_temperature': 7.663881102196576}. Best is trial 126 with value: 0.8771929824561403.
[32m[I 2023-04-26 00:12:21,628][39m Trial 424 finished with value: 0.8468468468468469 and parameters: {'objective': 'CrossEntropy', 'colsample_bylevel': 0.04728097770352621, 'depth': 6, 'boosting_type': 'Plain', 'bootstrap_type': 'Bayesian', 'bagging_temperature': 9.180382890320264}. Best is trial 126 with value: 0.8771929824561403.
[32m[I 2023-04-26 00:12:23,281][39m Trial 425 finished with value: 0.8547008547008546 and parameters: {'objective': 'CrossEntropy', 'colsample_bylevel': 0.04124831883322686, 'depth': 7, 'boosting_type': 'Plain', 'bootstrap_type': 'Bayesian', 'bagging_temperature': 9.564584019199676}. Best is trial 126 with value: 0.8771929824561403.
[32m[I 2023-04-26 00:12:25,400][39m Trial 426 finished with value: 0.8468468468468469 and parameters: {'objective': 'CrossEntropy', 'colsample_bylevel': 0.06075833485779496, 'depth': 7, 'boosting_type': 'Plain', 'bootstrap_type': 'Bayesian', 'bagging_temperature': 9.390358562178312}. Best is trial 126 with value: 0.8771929824561403.
[32m[I 2023-04-26 00:12:27,489][39m Trial 427 finished with value: 0.8495575221238938 and parameters: {'objective': 'CrossEntropy', 'colsample_bylevel': 0.059825799214498494, 'depth': 4, 'boosting_type': 'Plain', 'bootstrap_type': 'Bayesian', 'bagging_temperature': 7.394929315467771}. Best is trial 126 with value: 0.8771929824561403.
[32m[I 2023-04-26 00:12:29,127][39m Trial 428 finished with value: 0.8347826086956522 and parameters: {'objective': 'CrossEntropy', 'colsample_bylevel': 0.0452447048840349, 'depth': 3, 'boosting_type': 'Plain', 'bootstrap_type': 'Bayesian', 'bagging_temperature': 8.425563036805556}. Best is trial 126 with value: 0.8771929824561403.
[32m[I 2023-04-26 00:12:30,896][39m Trial 429 finished with value: 0.8521739130434783 and parameters: {'objective': 'CrossEntropy', 'colsample_bylevel': 0.053516987662976204, 'depth': 4, 'boosting_type': 'Plain', 'bootstrap_type': 'Bayesian', 'bagging_temperature': 9.269163894221226}. Best is trial 126 with value: 0.8771929824561403.
[32m[I 2023-04-26 00:12:33,834][39m Trial 430 finished with value: 0.8571428571428572 and parameters: {'objective': 'CrossEntropy', 'colsample_bylevel': 0.06336808512878513, 'depth': 9, 'boosting_type': 'Plain', 'bootstrap_type': 'Bayesian', 'bagging_temperature': 8.802663906856568}. Best is trial 126 with value: 0.8771929824561403.
[32m[I 2023-04-26 00:12:35,817][39m Trial 431 finished with value: 0.8468468468468469 and parameters: {'objective': 'CrossEntropy', 'colsample_bylevel': 0.06609687160322235, 'depth': 6, 'boosting_type': 'Plain', 'bootstrap_type': 'Bayesian', 'bagging_temperature': 8.998653565204245}. Best is trial 126 with value: 0.8771929824561403.
[32m[I 2023-04-26 00:12:37,815][39m Trial 432 finished with value: 0.8620689655172413 and parameters: {'objective': 'CrossEntropy', 'colsample_bylevel': 0.050101092097252976, 'depth': 8, 'boosting_type': 'Plain', 'bootstrap_type': 'Bayesian', 'bagging_temperature': 8.200558111937866}. Best is trial 126 with value: 0.8771929824561403.
[32m[I 2023-04-26 00:12:39,589][39m Trial 433 finished with value: 0.8245614035087718 and parameters: {'objective': 'CrossEntropy', 'colsample_bylevel': 0.05890776878037509, 'depth': 4, 'boosting_type': 'Plain', 'bootstrap_type': 'MVS'}. Best is trial 126 with value: 0.8771929824561403.
[32m[I 2023-04-26 00:12:41,456][39m Trial 434 finished with value: 0.8596491228070176 and parameters: {'objective': 'CrossEntropy', 'colsample_bylevel': 0.051419690530308, 'depth': 6, 'boosting_type': 'Plain', 'bootstrap_type': 'Bayesian', 'bagging_temperature': 8.326328721281067}. Best is trial 126 with value: 0.8771929824561403.
[32m[I 2023-04-26 00:12:43,268][39m Trial 435 finished with value: 0.8596491228070176 and parameters: {'objective': 'CrossEntropy', 'colsample_bylevel': 0.048629151261030124, 'depth': 7, 'boosting_type': 'Plain', 'bootstrap_type': 'Bayesian', 'bagging_temperature': 8.544329924740806}. Best is trial 126 with value: 0.8771929824561403.
[32m[I 2023-04-26 00:12:45,422][39m Trial 436 finished with value: 0.8771929824561403 and parameters: {'objective': 'CrossEntropy', 'colsample_bylevel': 0.05625808140645111, 'depth': 7, 'boosting_type': 'Plain', 'bootstrap_type': 'Bayesian', 'bagging_temperature': 9.492676287744812}. Best is trial 126 with value: 0.8771929824561403.
[32m[I 2023-04-26 00:12:47,507][39m Trial 437 finished with value: 0.8421052631578947 and parameters: {'objective': 'CrossEntropy', 'colsample_bylevel': 0.05259404691738814, 'depth': 7, 'boosting_type': 'Plain', 'bootstrap_type': 'Bayesian', 'bagging_temperature': 8.346745910364787}. Best is trial 126 with value: 0.8771929824561403.
[32m[I 2023-04-26 00:12:49,258][39m Trial 438 finished with value: 0.8495575221238938 and parameters: {'objective': 'CrossEntropy', 'colsample_bylevel': 0.05542312430570553, 'depth': 6, 'boosting_type': 'Plain', 'bootstrap_type': 'Bayesian', 'bagging_temperature': 9.462163046699553}. Best is trial 126 with value: 0.8771929824561403.
[32m[I 2023-04-26 00:12:50,975][39m Trial 439 finished with value: 0.8547008547008546 and parameters: {'objective': 'CrossEntropy', 'colsample_bylevel': 0.04193706937871671, 'depth': 7, 'boosting_type': 'Plain', 'bootstrap_type': 'Bayesian', 'bagging_temperature': 9.847103608917386}. Best is trial 126 with value: 0.8771929824561403.
[32m[I 2023-04-26 00:12:52,750][39m Trial 440 finished with value: 0.8620689655172413 and parameters: {'objective': 'CrossEntropy', 'colsample_bylevel': 0.0571638113380006, 'depth': 4, 'boosting_type': 'Plain', 'bootstrap_type': 'Bayesian', 'bagging_temperature': 9.69309903105095}. Best is trial 126 with value: 0.8771929824561403.
[32m[I 2023-04-26 00:12:54,540][39m Trial 441 finished with value: 0.8347826086956522 and parameters: {'objective': 'CrossEntropy', 'colsample_bylevel': 0.05429332932883756, 'depth': 10, 'boosting_type': 'Plain', 'bootstrap_type': 'Bayesian', 'bagging_temperature': 5.0076438246140835}. Best is trial 126 with value: 0.8771929824561403.
[32m[I 2023-04-26 00:12:56,614][39m Trial 442 finished with value: 0.8571428571428572 and parameters: {'objective': 'CrossEntropy', 'colsample_bylevel': 0.056842557687822884, 'depth': 7, 'boosting_type': 'Plain', 'bootstrap_type': 'Bayesian', 'bagging_temperature': 9.207331084030624}. Best is trial 126 with value: 0.8771929824561403.
[32m[I 2023-04-26 00:12:58,666][39m Trial 443 finished with value: 0.831858407079646 and parameters: {'objective': 'CrossEntropy', 'colsample_bylevel': 0.051034933014865565, 'depth': 7, 'boosting_type': 'Plain', 'bootstrap_type': 'Bayesian', 'bagging_temperature': 8.059853563338681}. Best is trial 126 with value: 0.8771929824561403.
[32m[I 2023-04-26 00:13:00,624][39m Trial 444 finished with value: 0.8495575221238938 and parameters: {'objective': 'CrossEntropy', 'colsample_bylevel': 0.055301021362260866, 'depth': 6, 'boosting_type': 'Plain', 'bootstrap_type': 'Bayesian', 'bagging_temperature': 6.348912884882883}. Best is trial 126 with value: 0.8771929824561403.
[32m[I 2023-04-26 00:13:02,570][39m Trial 445 finished with value: 0.8672566371681416 and parameters: {'objective': 'CrossEntropy', 'colsample_bylevel': 0.05319819528455609, 'depth': 7, 'boosting_type': 'Plain', 'bootstrap_type': 'Bayesian', 'bagging_temperature': 9.357491580185755}. Best is trial 126 with value: 0.8771929824561403.
[32m[I 2023-04-26 00:13:05,106][39m Trial 446 finished with value: 0.8521739130434783 and parameters: {'objective': 'CrossEntropy', 'colsample_bylevel': 0.05949033008509495, 'depth': 8, 'boosting_type': 'Plain', 'bootstrap_type': 'Bayesian', 'bagging_temperature': 8.993165948106183}. Best is trial 126 with value: 0.8771929824561403.
[32m[I 2023-04-26 00:13:06,300][39m Trial 447 finished with value: 0.847457627118644 and parameters: {'objective': 'CrossEntropy', 'colsample_bylevel': 0.02014290024623954, 'depth': 6, 'boosting_type': 'Plain', 'bootstrap_type': 'Bayesian', 'bagging_temperature': 8.74924980879527}. Best is trial 126 with value: 0.8771929824561403.
[32m[I 2023-04-26 00:13:08,047][39m Trial 448 finished with value: 0.8347826086956522 and parameters: {'objective': 'CrossEntropy', 'colsample_bylevel': 0.05293309811057408, 'depth': 5, 'boosting_type': 'Plain', 'bootstrap_type': 'Bayesian', 'bagging_temperature': 7.816702607252254}. Best is trial 126 with value: 0.8771929824561403.
[32m[I 2023-04-26 00:13:09,769][39m Trial 449 finished with value: 0.8596491228070176 and parameters: {'objective': 'CrossEntropy', 'colsample_bylevel': 0.04619039298627762, 'depth': 6, 'boosting_type': 'Plain', 'bootstrap_type': 'Bayesian', 'bagging_temperature': 7.1832708165161305}. Best is trial 126 with value: 0.8771929824561403.
[32m[I 2023-04-26 00:13:11,701][39m Trial 450 finished with value: 0.8672566371681416 and parameters: {'objective': 'CrossEntropy', 'colsample_bylevel': 0.06269873583559783, 'depth': 5, 'boosting_type': 'Plain', 'bootstrap_type': 'Bayesian', 'bagging_temperature': 7.687388344379542}. Best is trial 126 with value: 0.8771929824561403.
[32m[I 2023-04-26 00:13:13,920][39m Trial 451 finished with value: 0.8596491228070176 and parameters: {'objective': 'CrossEntropy', 'colsample_bylevel': 0.05509055920105344, 'depth': 7, 'boosting_type': 'Plain', 'bootstrap_type': 'Bayesian', 'bagging_temperature': 9.528613980136777}. Best is trial 126 with value: 0.8771929824561403.
[32m[I 2023-04-26 00:13:16,035][39m Trial 452 finished with value: 0.8392857142857144 and parameters: {'objective': 'CrossEntropy', 'colsample_bylevel': 0.058191137377650096, 'depth': 7, 'boosting_type': 'Plain', 'bootstrap_type': 'Bayesian', 'bagging_temperature': 3.9267184322132795}. Best is trial 126 with value: 0.8771929824561403.
[32m[I 2023-04-26 00:13:17,224][39m Trial 453 finished with value: 0.8448275862068967 and parameters: {'objective': 'CrossEntropy', 'colsample_bylevel': 0.05173830710248241, 'depth': 6, 'boosting_type': 'Plain', 'bootstrap_type': 'MVS'}. Best is trial 126 with value: 0.8771929824561403.
[32m[I 2023-04-26 00:13:21,633][39m Trial 454 finished with value: 0.8596491228070176 and parameters: {'objective': 'CrossEntropy', 'colsample_bylevel': 0.0614292519047452, 'depth': 9, 'boosting_type': 'Ordered', 'bootstrap_type': 'Bayesian', 'bagging_temperature': 8.58153676643103}. Best is trial 126 with value: 0.8771929824561403.
[32m[I 2023-04-26 00:13:23,496][39m Trial 455 finished with value: 0.831858407079646 and parameters: {'objective': 'CrossEntropy', 'colsample_bylevel': 0.056048926592893476, 'depth': 5, 'boosting_type': 'Plain', 'bootstrap_type': 'Bayesian', 'bagging_temperature': 8.551434589434706}. Best is trial 126 with value: 0.8771929824561403.
[32m[I 2023-04-26 00:13:25,262][39m Trial 456 finished with value: 0.8448275862068967 and parameters: {'objective': 'CrossEntropy', 'colsample_bylevel': 0.04461053373974302, 'depth': 6, 'boosting_type': 'Plain', 'bootstrap_type': 'Bayesian', 'bagging_temperature': 6.644196625498543}. Best is trial 126 with value: 0.8771929824561403.
[32m[I 2023-04-26 00:13:27,105][39m Trial 457 finished with value: 0.8571428571428572 and parameters: {'objective': 'CrossEntropy', 'colsample_bylevel': 0.06027300019652525, 'depth': 5, 'boosting_type': 'Plain', 'bootstrap_type': 'Bayesian', 'bagging_temperature': 7.550664138490469}. Best is trial 126 with value: 0.8771929824561403.
[32m[I 2023-04-26 00:13:28,627][39m Trial 458 finished with value: 0.8521739130434783 and parameters: {'objective': 'CrossEntropy', 'colsample_bylevel': 0.05032705118372109, 'depth': 2, 'boosting_type': 'Plain', 'bootstrap_type': 'Bayesian', 'bagging_temperature': 7.8759240536412385}. Best is trial 126 with value: 0.8771929824561403.
[32m[I 2023-04-26 00:13:30,530][39m Trial 459 finished with value: 0.8672566371681416 and parameters: {'objective': 'CrossEntropy', 'colsample_bylevel': 0.05324165893103095, 'depth': 7, 'boosting_type': 'Plain', 'bootstrap_type': 'Bayesian', 'bagging_temperature': 9.08469523745008}. Best is trial 126 with value: 0.8771929824561403.
