
[32m[I 2023-04-25 23:55:11,129][39m A new study created in memory with name: no-name-ead1aa19-a24f-4a69-82d2-4ed2913409ab
[32m[I 2023-04-25 23:55:14,101][39m Trial 0 finished with value: 0.8403361344537814 and parameters: {'objective': 'CrossEntropy', 'colsample_bylevel': 0.03448143323591197, 'depth': 11, 'boosting_type': 'Ordered', 'bootstrap_type': 'Bayesian', 'bagging_temperature': 9.457944101968538}. Best is trial 0 with value: 0.8403361344537814.
[32m[I 2023-04-25 23:55:17,084][39m Trial 1 finished with value: 0.8264462809917354 and parameters: {'objective': 'Logloss', 'colsample_bylevel': 0.015211082147991016, 'depth': 6, 'boosting_type': 'Ordered', 'bootstrap_type': 'Bernoulli', 'subsample': 0.9061710775049425}. Best is trial 0 with value: 0.8403361344537814.
[32m[I 2023-04-25 23:55:20,200][39m Trial 2 finished with value: 0.8672566371681416 and parameters: {'objective': 'Logloss', 'colsample_bylevel': 0.09422208466782019, 'depth': 9, 'boosting_type': 'Plain', 'bootstrap_type': 'Bernoulli', 'subsample': 0.5048569711586298}. Best is trial 2 with value: 0.8672566371681416.
[32m[I 2023-04-25 23:55:22,699][39m Trial 3 finished with value: 0.8421052631578947 and parameters: {'objective': 'CrossEntropy', 'colsample_bylevel': 0.0896874438492232, 'depth': 7, 'boosting_type': 'Ordered', 'bootstrap_type': 'MVS'}. Best is trial 2 with value: 0.8672566371681416.
[32m[I 2023-04-25 23:55:25,564][39m Trial 4 finished with value: 0.8620689655172413 and parameters: {'objective': 'CrossEntropy', 'colsample_bylevel': 0.03137774976458969, 'depth': 11, 'boosting_type': 'Ordered', 'bootstrap_type': 'Bernoulli', 'subsample': 0.45483589567182703}. Best is trial 2 with value: 0.8672566371681416.
[32m[I 2023-04-25 23:55:26,981][39m Trial 5 finished with value: 0.8448275862068967 and parameters: {'objective': 'CrossEntropy', 'colsample_bylevel': 0.05251912519987001, 'depth': 7, 'boosting_type': 'Plain', 'bootstrap_type': 'Bernoulli', 'subsample': 0.9924201781589396}. Best is trial 2 with value: 0.8672566371681416.
[32m[I 2023-04-25 23:55:28,187][39m Trial 6 finished with value: 0.8547008547008546 and parameters: {'objective': 'Logloss', 'colsample_bylevel': 0.02523816106218157, 'depth': 4, 'boosting_type': 'Plain', 'bootstrap_type': 'Bernoulli', 'subsample': 0.571948283615173}. Best is trial 2 with value: 0.8672566371681416.
[32m[I 2023-04-25 23:55:29,264][39m Trial 7 finished with value: 0.8376068376068375 and parameters: {'objective': 'Logloss', 'colsample_bylevel': 0.01558968487024686, 'depth': 4, 'boosting_type': 'Plain', 'bootstrap_type': 'Bernoulli', 'subsample': 0.6610196143517525}. Best is trial 2 with value: 0.8672566371681416.
[32m[I 2023-04-25 23:55:33,890][39m Trial 8 finished with value: 0.8495575221238938 and parameters: {'objective': 'CrossEntropy', 'colsample_bylevel': 0.08257613697091508, 'depth': 9, 'boosting_type': 'Ordered', 'bootstrap_type': 'Bayesian', 'bagging_temperature': 2.8902788198741627}. Best is trial 2 with value: 0.8672566371681416.
[32m[I 2023-04-25 23:55:36,819][39m Trial 9 finished with value: 0.8333333333333334 and parameters: {'objective': 'Logloss', 'colsample_bylevel': 0.017364185968131406, 'depth': 3, 'boosting_type': 'Ordered', 'bootstrap_type': 'Bernoulli', 'subsample': 0.699268519718331}. Best is trial 2 with value: 0.8672566371681416.
[32m[I 2023-04-25 23:55:38,906][39m Trial 10 finished with value: 0.8245614035087718 and parameters: {'objective': 'Logloss', 'colsample_bylevel': 0.07249314961132125, 'depth': 12, 'boosting_type': 'Plain', 'bootstrap_type': 'MVS'}. Best is trial 2 with value: 0.8672566371681416.
[32m[I 2023-04-25 23:55:40,488][39m Trial 11 finished with value: 0.8596491228070176 and parameters: {'objective': 'CrossEntropy', 'colsample_bylevel': 0.04781744433030596, 'depth': 10, 'boosting_type': 'Plain', 'bootstrap_type': 'Bernoulli', 'subsample': 0.27092429038041943}. Best is trial 2 with value: 0.8672566371681416.
[32m[I 2023-04-25 23:55:45,039][39m Trial 12 finished with value: 0.8392857142857144 and parameters: {'objective': 'CrossEntropy', 'colsample_bylevel': 0.07377042006741266, 'depth': 9, 'boosting_type': 'Ordered', 'bootstrap_type': 'Bernoulli', 'subsample': 0.30277449252087185}. Best is trial 2 with value: 0.8672566371681416.
[32m[I 2023-04-25 23:55:46,607][39m Trial 13 finished with value: 0.8403361344537814 and parameters: {'objective': 'Logloss', 'colsample_bylevel': 0.09863418340321818, 'depth': 1, 'boosting_type': 'Plain', 'bootstrap_type': 'Bayesian', 'bagging_temperature': 1.1495959005723186}. Best is trial 2 with value: 0.8672566371681416.
[32m[I 2023-04-25 23:55:50,087][39m Trial 14 finished with value: 0.8547008547008546 and parameters: {'objective': 'Logloss', 'colsample_bylevel': 0.0387171278953801, 'depth': 12, 'boosting_type': 'Ordered', 'bootstrap_type': 'Bernoulli', 'subsample': 0.4170278551113525}. Best is trial 2 with value: 0.8672566371681416.
[32m[I 2023-04-25 23:55:52,074][39m Trial 15 finished with value: 0.831858407079646 and parameters: {'objective': 'CrossEntropy', 'colsample_bylevel': 0.06222433653601097, 'depth': 9, 'boosting_type': 'Plain', 'bootstrap_type': 'MVS'}. Best is trial 2 with value: 0.8672566371681416.
[32m[I 2023-04-25 23:55:55,282][39m Trial 16 finished with value: 0.8521739130434783 and parameters: {'objective': 'CrossEntropy', 'colsample_bylevel': 0.06300233362320073, 'depth': 10, 'boosting_type': 'Ordered', 'bootstrap_type': 'Bernoulli', 'subsample': 0.46782082722707113}. Best is trial 2 with value: 0.8672566371681416.
[32m[I 2023-04-25 23:55:57,069][39m Trial 17 finished with value: 0.847457627118644 and parameters: {'objective': 'Logloss', 'colsample_bylevel': 0.04155969668875281, 'depth': 8, 'boosting_type': 'Plain', 'bootstrap_type': 'Bernoulli', 'subsample': 0.42467372376268925}. Best is trial 2 with value: 0.8672566371681416.
[32m[I 2023-04-25 23:56:00,527][39m Trial 18 finished with value: 0.847457627118644 and parameters: {'objective': 'CrossEntropy', 'colsample_bylevel': 0.02912773271098008, 'depth': 11, 'boosting_type': 'Ordered', 'bootstrap_type': 'Bayesian', 'bagging_temperature': 8.538434433278269}. Best is trial 2 with value: 0.8672566371681416.
[32m[I 2023-04-25 23:56:02,629][39m Trial 19 finished with value: 0.8421052631578947 and parameters: {'objective': 'Logloss', 'colsample_bylevel': 0.09975861278624922, 'depth': 6, 'boosting_type': 'Plain', 'bootstrap_type': 'MVS'}. Best is trial 2 with value: 0.8672566371681416.
[32m[I 2023-04-25 23:56:04,187][39m Trial 20 finished with value: 0.8256880733944953 and parameters: {'objective': 'CrossEntropy', 'colsample_bylevel': 0.06584864380402722, 'depth': 11, 'boosting_type': 'Plain', 'bootstrap_type': 'Bernoulli', 'subsample': 0.6988021648478064}. Best is trial 2 with value: 0.8672566371681416.
[32m[I 2023-04-25 23:56:05,850][39m Trial 21 finished with value: 0.8421052631578947 and parameters: {'objective': 'CrossEntropy', 'colsample_bylevel': 0.05069406401321422, 'depth': 10, 'boosting_type': 'Plain', 'bootstrap_type': 'Bernoulli', 'subsample': 0.17030004848470265}. Best is trial 2 with value: 0.8672566371681416.
[32m[I 2023-04-25 23:56:07,465][39m Trial 22 finished with value: 0.8448275862068967 and parameters: {'objective': 'CrossEntropy', 'colsample_bylevel': 0.04630695045089525, 'depth': 10, 'boosting_type': 'Plain', 'bootstrap_type': 'Bernoulli', 'subsample': 0.27618395661974676}. Best is trial 2 with value: 0.8672566371681416.
[32m[I 2023-04-25 23:56:08,954][39m Trial 23 finished with value: 0.8521739130434783 and parameters: {'objective': 'CrossEntropy', 'colsample_bylevel': 0.028488496023721232, 'depth': 8, 'boosting_type': 'Plain', 'bootstrap_type': 'Bernoulli', 'subsample': 0.108501048364738}. Best is trial 2 with value: 0.8672566371681416.
[32m[I 2023-04-25 23:56:10,561][39m Trial 24 finished with value: 0.8376068376068375 and parameters: {'objective': 'CrossEntropy', 'colsample_bylevel': 0.04037268428526282, 'depth': 12, 'boosting_type': 'Plain', 'bootstrap_type': 'Bernoulli', 'subsample': 0.30483956384470834}. Best is trial 2 with value: 0.8672566371681416.
[32m[I 2023-04-25 23:56:12,668][39m Trial 25 finished with value: 0.831858407079646 and parameters: {'objective': 'CrossEntropy', 'colsample_bylevel': 0.05766577905389009, 'depth': 8, 'boosting_type': 'Plain', 'bootstrap_type': 'Bernoulli', 'subsample': 0.5208692719095184}. Best is trial 2 with value: 0.8672566371681416.
[32m[I 2023-04-25 23:56:15,954][39m Trial 26 finished with value: 0.847457627118644 and parameters: {'objective': 'Logloss', 'colsample_bylevel': 0.023810005681744923, 'depth': 10, 'boosting_type': 'Ordered', 'bootstrap_type': 'Bernoulli', 'subsample': 0.3514477775793674}. Best is trial 2 with value: 0.8672566371681416.
[32m[I 2023-04-25 23:56:17,586][39m Trial 27 finished with value: 0.8392857142857144 and parameters: {'objective': 'CrossEntropy', 'colsample_bylevel': 0.08368232002992188, 'depth': 11, 'boosting_type': 'Plain', 'bootstrap_type': 'Bernoulli', 'subsample': 0.5782416425635618}. Best is trial 2 with value: 0.8672566371681416.
[32m[I 2023-04-25 23:56:21,453][39m Trial 28 finished with value: 0.847457627118644 and parameters: {'objective': 'Logloss', 'colsample_bylevel': 0.04693557948627492, 'depth': 9, 'boosting_type': 'Ordered', 'bootstrap_type': 'Bayesian', 'bagging_temperature': 5.996498370216168}. Best is trial 2 with value: 0.8672566371681416.
[32m[I 2023-04-25 23:56:24,969][39m Trial 29 finished with value: 0.8448275862068967 and parameters: {'objective': 'CrossEntropy', 'colsample_bylevel': 0.03205093245995603, 'depth': 11, 'boosting_type': 'Ordered', 'bootstrap_type': 'MVS'}. Best is trial 2 with value: 0.8672566371681416.
[32m[I 2023-04-25 23:56:26,518][39m Trial 30 finished with value: 0.8521739130434783 and parameters: {'objective': 'CrossEntropy', 'colsample_bylevel': 0.035418856156757196, 'depth': 12, 'boosting_type': 'Plain', 'bootstrap_type': 'Bayesian', 'bagging_temperature': 5.442163472924183}. Best is trial 2 with value: 0.8672566371681416.
[32m[I 2023-04-25 23:56:30,051][39m Trial 31 finished with value: 0.8547008547008546 and parameters: {'objective': 'Logloss', 'colsample_bylevel': 0.03769341334848069, 'depth': 12, 'boosting_type': 'Ordered', 'bootstrap_type': 'Bernoulli', 'subsample': 0.4116632248433836}. Best is trial 2 with value: 0.8672566371681416.
[32m[I 2023-04-25 23:56:33,266][39m Trial 32 finished with value: 0.8448275862068967 and parameters: {'objective': 'Logloss', 'colsample_bylevel': 0.02163662948945149, 'depth': 11, 'boosting_type': 'Ordered', 'bootstrap_type': 'Bernoulli', 'subsample': 0.22103086993656512}. Best is trial 2 with value: 0.8672566371681416.
[32m[I 2023-04-25 23:56:34,809][39m Trial 33 finished with value: 0.8376068376068375 and parameters: {'objective': 'Logloss', 'colsample_bylevel': 0.04449020577849078, 'depth': 4, 'boosting_type': 'Plain', 'bootstrap_type': 'Bernoulli', 'subsample': 0.5956830132706376}. Best is trial 2 with value: 0.8672566371681416.
[32m[I 2023-04-25 23:56:37,888][39m Trial 34 finished with value: 0.7868852459016394 and parameters: {'objective': 'Logloss', 'colsample_bylevel': 0.010471308196293057, 'depth': 10, 'boosting_type': 'Ordered', 'bootstrap_type': 'Bernoulli', 'subsample': 0.38434146958505183}. Best is trial 2 with value: 0.8672566371681416.
[32m[I 2023-04-25 23:56:39,302][39m Trial 35 finished with value: 0.8521739130434783 and parameters: {'objective': 'Logloss', 'colsample_bylevel': 0.024716782911009098, 'depth': 6, 'boosting_type': 'Plain', 'bootstrap_type': 'Bernoulli', 'subsample': 0.5089344380376565}. Best is trial 2 with value: 0.8672566371681416.
[32m[I 2023-04-25 23:56:43,544][39m Trial 36 finished with value: 0.8521739130434783 and parameters: {'objective': 'Logloss', 'colsample_bylevel': 0.05551355519572213, 'depth': 12, 'boosting_type': 'Ordered', 'bootstrap_type': 'Bernoulli', 'subsample': 0.46161860132996996}. Best is trial 2 with value: 0.8672566371681416.
[32m[I 2023-04-25 23:56:47,570][39m Trial 37 finished with value: 0.8547008547008546 and parameters: {'objective': 'Logloss', 'colsample_bylevel': 0.034480782944962284, 'depth': 11, 'boosting_type': 'Ordered', 'bootstrap_type': 'Bernoulli', 'subsample': 0.23211589979750952}. Best is trial 2 with value: 0.8672566371681416.
[32m[I 2023-04-25 23:56:52,118][39m Trial 38 finished with value: 0.8495575221238938 and parameters: {'objective': 'CrossEntropy', 'colsample_bylevel': 0.051064988766383185, 'depth': 7, 'boosting_type': 'Ordered', 'bootstrap_type': 'Bernoulli', 'subsample': 0.2018451602311076}. Best is trial 2 with value: 0.8672566371681416.
[32m[I 2023-04-25 23:56:56,267][39m Trial 39 finished with value: 0.8421052631578947 and parameters: {'objective': 'Logloss', 'colsample_bylevel': 0.09120043862189123, 'depth': 9, 'boosting_type': 'Ordered', 'bootstrap_type': 'MVS'}. Best is trial 2 with value: 0.8672566371681416.
[32m[I 2023-04-25 23:56:59,540][39m Trial 40 finished with value: 0.8448275862068967 and parameters: {'objective': 'CrossEntropy', 'colsample_bylevel': 0.03430072608469716, 'depth': 8, 'boosting_type': 'Ordered', 'bootstrap_type': 'Bernoulli', 'subsample': 0.12019497926107954}. Best is trial 2 with value: 0.8672566371681416.
[32m[I 2023-04-25 23:57:01,629][39m Trial 41 finished with value: 0.8333333333333334 and parameters: {'objective': 'Logloss', 'colsample_bylevel': 0.01979658208106644, 'depth': 5, 'boosting_type': 'Plain', 'bootstrap_type': 'Bernoulli', 'subsample': 0.6106466865512648}. Best is trial 2 with value: 0.8672566371681416.
[32m[I 2023-04-25 23:57:03,449][39m Trial 42 finished with value: 0.8333333333333334 and parameters: {'objective': 'Logloss', 'colsample_bylevel': 0.027276915925968218, 'depth': 1, 'boosting_type': 'Plain', 'bootstrap_type': 'Bernoulli', 'subsample': 0.7783120955570877}. Best is trial 2 with value: 0.8672566371681416.
[32m[I 2023-04-25 23:57:04,974][39m Trial 43 finished with value: 0.8376068376068375 and parameters: {'objective': 'Logloss', 'colsample_bylevel': 0.03973751483892027, 'depth': 5, 'boosting_type': 'Plain', 'bootstrap_type': 'Bernoulli', 'subsample': 0.5029908725884231}. Best is trial 2 with value: 0.8672566371681416.
[32m[I 2023-04-25 23:57:06,067][39m Trial 44 finished with value: 0.7936507936507937 and parameters: {'objective': 'Logloss', 'colsample_bylevel': 0.01141286512890008, 'depth': 4, 'boosting_type': 'Plain', 'bootstrap_type': 'Bernoulli', 'subsample': 0.35328839288209857}. Best is trial 2 with value: 0.8672566371681416.
[32m[I 2023-04-25 23:57:07,549][39m Trial 45 finished with value: 0.847457627118644 and parameters: {'objective': 'Logloss', 'colsample_bylevel': 0.017477242438320065, 'depth': 3, 'boosting_type': 'Plain', 'bootstrap_type': 'Bayesian', 'bagging_temperature': 0.5605476116054735}. Best is trial 2 with value: 0.8672566371681416.
[32m[I 2023-04-25 23:57:11,658][39m Trial 46 finished with value: 0.8547008547008546 and parameters: {'objective': 'Logloss', 'colsample_bylevel': 0.0323295752183717, 'depth': 12, 'boosting_type': 'Ordered', 'bootstrap_type': 'Bernoulli', 'subsample': 0.23945349719467696}. Best is trial 2 with value: 0.8672566371681416.
[32m[I 2023-04-25 23:57:16,021][39m Trial 47 finished with value: 0.8547008547008546 and parameters: {'objective': 'Logloss', 'colsample_bylevel': 0.03128231176850363, 'depth': 10, 'boosting_type': 'Ordered', 'bootstrap_type': 'Bernoulli', 'subsample': 0.2398478150264026}. Best is trial 2 with value: 0.8672566371681416.
[32m[I 2023-04-25 23:57:19,396][39m Trial 48 finished with value: 0.8421052631578947 and parameters: {'objective': 'CrossEntropy', 'colsample_bylevel': 0.0745677007347025, 'depth': 10, 'boosting_type': 'Ordered', 'bootstrap_type': 'MVS'}. Best is trial 2 with value: 0.8672566371681416.
[32m[I 2023-04-25 23:57:23,446][39m Trial 49 finished with value: 0.8547008547008546 and parameters: {'objective': 'Logloss', 'colsample_bylevel': 0.03679951549030816, 'depth': 12, 'boosting_type': 'Ordered', 'bootstrap_type': 'Bernoulli', 'subsample': 0.33903563827434335}. Best is trial 2 with value: 0.8672566371681416.
[32m[I 2023-04-25 23:57:27,369][39m Trial 50 finished with value: 0.8448275862068967 and parameters: {'objective': 'CrossEntropy', 'colsample_bylevel': 0.04443844290561647, 'depth': 11, 'boosting_type': 'Ordered', 'bootstrap_type': 'Bernoulli', 'subsample': 0.45026113923758426}. Best is trial 2 with value: 0.8672566371681416.
[32m[I 2023-04-25 23:57:31,726][39m Trial 51 finished with value: 0.8448275862068967 and parameters: {'objective': 'Logloss', 'colsample_bylevel': 0.03671033702442916, 'depth': 12, 'boosting_type': 'Ordered', 'bootstrap_type': 'Bernoulli', 'subsample': 0.35226946010134697}. Best is trial 2 with value: 0.8672566371681416.
[32m[I 2023-04-25 23:57:33,528][39m Trial 52 finished with value: 0.8376068376068375 and parameters: {'objective': 'Logloss', 'colsample_bylevel': 0.04928608172617684, 'depth': 2, 'boosting_type': 'Plain', 'bootstrap_type': 'Bernoulli', 'subsample': 0.6462127509119772}. Best is trial 2 with value: 0.8672566371681416.
[32m[I 2023-04-25 23:57:37,331][39m Trial 53 finished with value: 0.8448275862068967 and parameters: {'objective': 'Logloss', 'colsample_bylevel': 0.041855740246278736, 'depth': 12, 'boosting_type': 'Ordered', 'bootstrap_type': 'Bernoulli', 'subsample': 0.39682724130636743}. Best is trial 2 with value: 0.8672566371681416.
[32m[I 2023-04-25 23:57:39,386][39m Trial 54 finished with value: 0.8547008547008546 and parameters: {'objective': 'Logloss', 'colsample_bylevel': 0.030070825423749732, 'depth': 9, 'boosting_type': 'Plain', 'bootstrap_type': 'Bernoulli', 'subsample': 0.30495444270169403}. Best is trial 2 with value: 0.8672566371681416.
[32m[I 2023-04-25 23:57:42,641][39m Trial 55 finished with value: 0.8421052631578947 and parameters: {'objective': 'Logloss', 'colsample_bylevel': 0.05472833805329251, 'depth': 9, 'boosting_type': 'Plain', 'bootstrap_type': 'Bernoulli', 'subsample': 0.2977098606570307}. Best is trial 2 with value: 0.8672566371681416.
[32m[I 2023-04-25 23:57:45,625][39m Trial 56 finished with value: 0.847457627118644 and parameters: {'objective': 'CrossEntropy', 'colsample_bylevel': 0.02398315078645201, 'depth': 11, 'boosting_type': 'Ordered', 'bootstrap_type': 'Bernoulli', 'subsample': 0.5548951207537047}. Best is trial 2 with value: 0.8672566371681416.
[32m[I 2023-04-25 23:57:46,970][39m Trial 57 finished with value: 0.847457627118644 and parameters: {'objective': 'Logloss', 'colsample_bylevel': 0.03031277213869774, 'depth': 10, 'boosting_type': 'Plain', 'bootstrap_type': 'Bayesian', 'bagging_temperature': 3.244668293451122}. Best is trial 2 with value: 0.8672566371681416.
[32m[I 2023-04-25 23:57:49,001][39m Trial 58 finished with value: 0.8448275862068967 and parameters: {'objective': 'Logloss', 'colsample_bylevel': 0.02686099700327179, 'depth': 7, 'boosting_type': 'Plain', 'bootstrap_type': 'Bernoulli', 'subsample': 0.1691482289880012}. Best is trial 2 with value: 0.8672566371681416.
[32m[I 2023-04-25 23:57:52,985][39m Trial 59 finished with value: 0.831858407079646 and parameters: {'objective': 'CrossEntropy', 'colsample_bylevel': 0.05966394791625945, 'depth': 9, 'boosting_type': 'Plain', 'bootstrap_type': 'MVS'}. Best is trial 2 with value: 0.8672566371681416.
[32m[I 2023-04-25 23:57:57,229][39m Trial 60 finished with value: 0.831858407079646 and parameters: {'objective': 'CrossEntropy', 'colsample_bylevel': 0.06974378038937179, 'depth': 11, 'boosting_type': 'Ordered', 'bootstrap_type': 'Bernoulli', 'subsample': 0.4861858117406387}. Best is trial 2 with value: 0.8672566371681416.
[32m[I 2023-04-25 23:58:00,539][39m Trial 61 finished with value: 0.8448275862068967 and parameters: {'objective': 'Logloss', 'colsample_bylevel': 0.03346630097250016, 'depth': 11, 'boosting_type': 'Ordered', 'bootstrap_type': 'Bernoulli', 'subsample': 0.9787841101093564}. Best is trial 2 with value: 0.8672566371681416.
[32m[I 2023-04-25 23:58:05,006][39m Trial 62 finished with value: 0.8547008547008546 and parameters: {'objective': 'Logloss', 'colsample_bylevel': 0.04243620716325868, 'depth': 10, 'boosting_type': 'Ordered', 'bootstrap_type': 'Bernoulli', 'subsample': 0.23244353865304124}. Best is trial 2 with value: 0.8672566371681416.
[32m[I 2023-04-25 23:58:09,178][39m Trial 63 finished with value: 0.8547008547008546 and parameters: {'objective': 'Logloss', 'colsample_bylevel': 0.03025898383790252, 'depth': 10, 'boosting_type': 'Ordered', 'bootstrap_type': 'Bernoulli', 'subsample': 0.27637640220654036}. Best is trial 2 with value: 0.8672566371681416.
[32m[I 2023-04-25 23:58:12,670][39m Trial 64 finished with value: 0.8448275862068967 and parameters: {'objective': 'Logloss', 'colsample_bylevel': 0.037578306484088005, 'depth': 8, 'boosting_type': 'Ordered', 'bootstrap_type': 'Bernoulli', 'subsample': 0.3176124645293833}. Best is trial 2 with value: 0.8672566371681416.
[32m[I 2023-04-25 23:58:17,416][39m Trial 65 finished with value: 0.8547008547008546 and parameters: {'objective': 'Logloss', 'colsample_bylevel': 0.04777348461601234, 'depth': 11, 'boosting_type': 'Ordered', 'bootstrap_type': 'Bernoulli', 'subsample': 0.24791406562334928}. Best is trial 2 with value: 0.8672566371681416.
[32m[I 2023-04-25 23:58:22,194][39m Trial 66 finished with value: 0.8547008547008546 and parameters: {'objective': 'Logloss', 'colsample_bylevel': 0.047480333040717936, 'depth': 10, 'boosting_type': 'Ordered', 'bootstrap_type': 'Bernoulli', 'subsample': 0.27797006877607755}. Best is trial 2 with value: 0.8672566371681416.
[32m[I 2023-04-25 23:58:24,498][39m Trial 67 finished with value: 0.8288288288288289 and parameters: {'objective': 'CrossEntropy', 'colsample_bylevel': 0.09561435512220705, 'depth': 12, 'boosting_type': 'Plain', 'bootstrap_type': 'Bayesian', 'bagging_temperature': 7.379399445346221}. Best is trial 2 with value: 0.8672566371681416.
