[32m[I 2023-04-26 00:04:32,079][39m Trial 200 finished with value: 0.8672566371681416 and parameters: {'objective': 'CrossEntropy', 'colsample_bylevel': 0.07185433746310692, 'depth': 7, 'boosting_type': 'Plain', 'bootstrap_type': 'Bayesian', 'bagging_temperature': 8.183393558078055}. Best is trial 126 with value: 0.8771929824561403.
[32m[I 2023-04-26 00:04:34,783][39m Trial 201 finished with value: 0.875 and parameters: {'objective': 'CrossEntropy', 'colsample_bylevel': 0.05943775985314665, 'depth': 6, 'boosting_type': 'Plain', 'bootstrap_type': 'Bayesian', 'bagging_temperature': 8.292720384194912}. Best is trial 126 with value: 0.8771929824561403.
[32m[I 2023-04-26 00:04:36,534][39m Trial 202 finished with value: 0.8771929824561403 and parameters: {'objective': 'CrossEntropy', 'colsample_bylevel': 0.060115515586869644, 'depth': 6, 'boosting_type': 'Plain', 'bootstrap_type': 'Bayesian', 'bagging_temperature': 8.403942597464864}. Best is trial 126 with value: 0.8771929824561403.
[32m[I 2023-04-26 00:04:38,679][39m Trial 203 finished with value: 0.8596491228070176 and parameters: {'objective': 'CrossEntropy', 'colsample_bylevel': 0.05832724766041335, 'depth': 6, 'boosting_type': 'Plain', 'bootstrap_type': 'Bayesian', 'bagging_temperature': 8.156034547668638}. Best is trial 126 with value: 0.8771929824561403.
[32m[I 2023-04-26 00:04:41,049][39m Trial 204 finished with value: 0.8421052631578947 and parameters: {'objective': 'CrossEntropy', 'colsample_bylevel': 0.06450686318858734, 'depth': 6, 'boosting_type': 'Plain', 'bootstrap_type': 'Bayesian', 'bagging_temperature': 8.418472115296609}. Best is trial 126 with value: 0.8771929824561403.
[32m[I 2023-04-26 00:04:43,323][39m Trial 205 finished with value: 0.8392857142857144 and parameters: {'objective': 'CrossEntropy', 'colsample_bylevel': 0.06763647537004995, 'depth': 5, 'boosting_type': 'Plain', 'bootstrap_type': 'Bayesian', 'bagging_temperature': 8.665771701432154}. Best is trial 126 with value: 0.8771929824561403.
[32m[I 2023-04-26 00:04:45,498][39m Trial 206 finished with value: 0.875 and parameters: {'objective': 'CrossEntropy', 'colsample_bylevel': 0.05884949364325128, 'depth': 6, 'boosting_type': 'Plain', 'bootstrap_type': 'Bayesian', 'bagging_temperature': 7.307958439431326}. Best is trial 126 with value: 0.8771929824561403.
[32m[I 2023-04-26 00:04:48,105][39m Trial 207 finished with value: 0.8648648648648648 and parameters: {'objective': 'CrossEntropy', 'colsample_bylevel': 0.06066386227780369, 'depth': 6, 'boosting_type': 'Plain', 'bootstrap_type': 'Bayesian', 'bagging_temperature': 8.14633884923404}. Best is trial 126 with value: 0.8771929824561403.
[32m[I 2023-04-26 00:04:50,680][39m Trial 208 finished with value: 0.8571428571428572 and parameters: {'objective': 'CrossEntropy', 'colsample_bylevel': 0.06084546566225353, 'depth': 6, 'boosting_type': 'Plain', 'bootstrap_type': 'Bayesian', 'bagging_temperature': 8.128087200047673}. Best is trial 126 with value: 0.8771929824561403.
[32m[I 2023-04-26 00:04:52,796][39m Trial 209 finished with value: 0.8521739130434783 and parameters: {'objective': 'CrossEntropy', 'colsample_bylevel': 0.06191168222056358, 'depth': 6, 'boosting_type': 'Plain', 'bootstrap_type': 'Bayesian', 'bagging_temperature': 7.028851581964428}. Best is trial 126 with value: 0.8771929824561403.
[32m[I 2023-04-26 00:04:55,184][39m Trial 210 finished with value: 0.8571428571428572 and parameters: {'objective': 'CrossEntropy', 'colsample_bylevel': 0.06409931639074279, 'depth': 5, 'boosting_type': 'Plain', 'bootstrap_type': 'Bayesian', 'bagging_temperature': 7.362428999658453}. Best is trial 126 with value: 0.8771929824561403.
[32m[I 2023-04-26 00:04:56,917][39m Trial 211 finished with value: 0.8347826086956522 and parameters: {'objective': 'CrossEntropy', 'colsample_bylevel': 0.05911492849904882, 'depth': 6, 'boosting_type': 'Plain', 'bootstrap_type': 'MVS'}. Best is trial 126 with value: 0.8771929824561403.
[32m[I 2023-04-26 00:04:59,084][39m Trial 212 finished with value: 0.831858407079646 and parameters: {'objective': 'CrossEntropy', 'colsample_bylevel': 0.05473974402628665, 'depth': 6, 'boosting_type': 'Plain', 'bootstrap_type': 'Bayesian', 'bagging_temperature': 6.711238348414018}. Best is trial 126 with value: 0.8771929824561403.
[32m[I 2023-04-26 00:05:01,264][39m Trial 213 finished with value: 0.8571428571428572 and parameters: {'objective': 'CrossEntropy', 'colsample_bylevel': 0.07198975763785767, 'depth': 6, 'boosting_type': 'Plain', 'bootstrap_type': 'Bayesian', 'bagging_temperature': 7.76671057327766}. Best is trial 126 with value: 0.8771929824561403.
[32m[I 2023-04-26 00:05:03,670][39m Trial 214 finished with value: 0.831858407079646 and parameters: {'objective': 'CrossEntropy', 'colsample_bylevel': 0.056418309066627946, 'depth': 6, 'boosting_type': 'Plain', 'bootstrap_type': 'Bayesian', 'bagging_temperature': 8.425456130672206}. Best is trial 126 with value: 0.8771929824561403.
[32m[I 2023-04-26 00:05:06,025][39m Trial 215 finished with value: 0.8596491228070176 and parameters: {'objective': 'CrossEntropy', 'colsample_bylevel': 0.05871048910718076, 'depth': 6, 'boosting_type': 'Plain', 'bootstrap_type': 'Bayesian', 'bagging_temperature': 9.356430206429325}. Best is trial 126 with value: 0.8771929824561403.
[32m[I 2023-04-26 00:05:08,501][39m Trial 216 finished with value: 0.8521739130434783 and parameters: {'objective': 'CrossEntropy', 'colsample_bylevel': 0.06253005944382777, 'depth': 7, 'boosting_type': 'Plain', 'bootstrap_type': 'Bayesian', 'bagging_temperature': 7.92494093012643}. Best is trial 126 with value: 0.8771929824561403.
[32m[I 2023-04-26 00:05:10,755][39m Trial 217 finished with value: 0.8571428571428572 and parameters: {'objective': 'CrossEntropy', 'colsample_bylevel': 0.0765776376485114, 'depth': 6, 'boosting_type': 'Plain', 'bootstrap_type': 'Bayesian', 'bagging_temperature': 8.952241624363417}. Best is trial 126 with value: 0.8771929824561403.
[32m[I 2023-04-26 00:05:13,589][39m Trial 218 finished with value: 0.8468468468468469 and parameters: {'objective': 'CrossEntropy', 'colsample_bylevel': 0.06071254044794588, 'depth': 7, 'boosting_type': 'Plain', 'bootstrap_type': 'Bayesian', 'bagging_temperature': 8.211392962378543}. Best is trial 126 with value: 0.8771929824561403.
[32m[I 2023-04-26 00:05:16,295][39m Trial 219 finished with value: 0.8571428571428572 and parameters: {'objective': 'CrossEntropy', 'colsample_bylevel': 0.05723638379783355, 'depth': 7, 'boosting_type': 'Plain', 'bootstrap_type': 'Bayesian', 'bagging_temperature': 7.7161930857957195}. Best is trial 126 with value: 0.8771929824561403.
[32m[I 2023-04-26 00:05:18,624][39m Trial 220 finished with value: 0.8392857142857144 and parameters: {'objective': 'CrossEntropy', 'colsample_bylevel': 0.060101302606922785, 'depth': 7, 'boosting_type': 'Plain', 'bootstrap_type': 'Bayesian', 'bagging_temperature': 6.646046944465911}. Best is trial 126 with value: 0.8771929824561403.
[32m[I 2023-04-26 00:05:20,794][39m Trial 221 finished with value: 0.8495575221238938 and parameters: {'objective': 'CrossEntropy', 'colsample_bylevel': 0.05036687424030656, 'depth': 6, 'boosting_type': 'Plain', 'bootstrap_type': 'Bayesian', 'bagging_temperature': 7.232878963513009}. Best is trial 126 with value: 0.8771929824561403.
[32m[I 2023-04-26 00:05:22,868][39m Trial 222 finished with value: 0.8571428571428572 and parameters: {'objective': 'CrossEntropy', 'colsample_bylevel': 0.04714622167153385, 'depth': 7, 'boosting_type': 'Plain', 'bootstrap_type': 'Bayesian', 'bagging_temperature': 7.620389374724003}. Best is trial 126 with value: 0.8771929824561403.
[32m[I 2023-04-26 00:05:25,432][39m Trial 223 finished with value: 0.8672566371681416 and parameters: {'objective': 'CrossEntropy', 'colsample_bylevel': 0.054496674029579, 'depth': 7, 'boosting_type': 'Plain', 'bootstrap_type': 'Bayesian', 'bagging_temperature': 8.471432336876529}. Best is trial 126 with value: 0.8771929824561403.
[32m[I 2023-04-26 00:05:27,601][39m Trial 224 finished with value: 0.8648648648648648 and parameters: {'objective': 'CrossEntropy', 'colsample_bylevel': 0.05303647281956145, 'depth': 7, 'boosting_type': 'Plain', 'bootstrap_type': 'Bayesian', 'bagging_temperature': 8.504701958322714}. Best is trial 126 with value: 0.8771929824561403.
[32m[I 2023-04-26 00:05:30,280][39m Trial 225 finished with value: 0.8672566371681416 and parameters: {'objective': 'CrossEntropy', 'colsample_bylevel': 0.05356110911400781, 'depth': 7, 'boosting_type': 'Plain', 'bootstrap_type': 'Bayesian', 'bagging_temperature': 8.384990926358777}. Best is trial 126 with value: 0.8771929824561403.
[32m[I 2023-04-26 00:05:32,819][39m Trial 226 finished with value: 0.8421052631578947 and parameters: {'objective': 'CrossEntropy', 'colsample_bylevel': 0.05310545218416672, 'depth': 7, 'boosting_type': 'Plain', 'bootstrap_type': 'Bayesian', 'bagging_temperature': 8.424297608083387}. Best is trial 126 with value: 0.8771929824561403.
[32m[I 2023-04-26 00:05:34,782][39m Trial 227 finished with value: 0.8771929824561403 and parameters: {'objective': 'CrossEntropy', 'colsample_bylevel': 0.05484323710815215, 'depth': 7, 'boosting_type': 'Plain', 'bootstrap_type': 'Bayesian', 'bagging_temperature': 8.799061822760779}. Best is trial 126 with value: 0.8771929824561403.
[32m[I 2023-04-26 00:05:37,510][39m Trial 228 finished with value: 0.8571428571428572 and parameters: {'objective': 'CrossEntropy', 'colsample_bylevel': 0.055509552348026736, 'depth': 7, 'boosting_type': 'Plain', 'bootstrap_type': 'Bayesian', 'bagging_temperature': 8.84699545148518}. Best is trial 126 with value: 0.8771929824561403.
[32m[I 2023-04-26 00:05:40,182][39m Trial 229 finished with value: 0.8392857142857144 and parameters: {'objective': 'CrossEntropy', 'colsample_bylevel': 0.054709495522239436, 'depth': 7, 'boosting_type': 'Plain', 'bootstrap_type': 'Bayesian', 'bagging_temperature': 9.19778092989904}. Best is trial 126 with value: 0.8771929824561403.
[32m[I 2023-04-26 00:05:42,918][39m Trial 230 finished with value: 0.8521739130434783 and parameters: {'objective': 'CrossEntropy', 'colsample_bylevel': 0.058004553839284476, 'depth': 7, 'boosting_type': 'Plain', 'bootstrap_type': 'Bayesian', 'bagging_temperature': 8.636631173774209}. Best is trial 126 with value: 0.8771929824561403.
[32m[I 2023-04-26 00:05:45,450][39m Trial 231 finished with value: 0.8521739130434783 and parameters: {'objective': 'CrossEntropy', 'colsample_bylevel': 0.0516873124290767, 'depth': 7, 'boosting_type': 'Plain', 'bootstrap_type': 'Bayesian', 'bagging_temperature': 8.334769793954367}. Best is trial 126 with value: 0.8771929824561403.
[32m[I 2023-04-26 00:05:47,957][39m Trial 232 finished with value: 0.8495575221238938 and parameters: {'objective': 'CrossEntropy', 'colsample_bylevel': 0.054547024296183744, 'depth': 7, 'boosting_type': 'Plain', 'bootstrap_type': 'Bayesian', 'bagging_temperature': 6.859947448047748}. Best is trial 126 with value: 0.8771929824561403.
[32m[I 2023-04-26 00:05:50,045][39m Trial 233 finished with value: 0.8771929824561403 and parameters: {'objective': 'CrossEntropy', 'colsample_bylevel': 0.05135975796343674, 'depth': 6, 'boosting_type': 'Plain', 'bootstrap_type': 'Bayesian', 'bagging_temperature': 8.093301647107275}. Best is trial 126 with value: 0.8771929824561403.
[32m[I 2023-04-26 00:05:52,179][39m Trial 234 finished with value: 0.8695652173913043 and parameters: {'objective': 'CrossEntropy', 'colsample_bylevel': 0.05118146303305248, 'depth': 6, 'boosting_type': 'Plain', 'bootstrap_type': 'Bayesian', 'bagging_temperature': 8.594111276601758}. Best is trial 126 with value: 0.8771929824561403.
[32m[I 2023-04-26 00:05:54,360][39m Trial 235 finished with value: 0.831858407079646 and parameters: {'objective': 'CrossEntropy', 'colsample_bylevel': 0.05145384044607614, 'depth': 6, 'boosting_type': 'Plain', 'bootstrap_type': 'Bayesian', 'bagging_temperature': 8.639606527261169}. Best is trial 126 with value: 0.8771929824561403.
[32m[I 2023-04-26 00:05:56,607][39m Trial 236 finished with value: 0.8571428571428572 and parameters: {'objective': 'CrossEntropy', 'colsample_bylevel': 0.052808511550036887, 'depth': 7, 'boosting_type': 'Plain', 'bootstrap_type': 'Bayesian', 'bagging_temperature': 8.525115038593064}. Best is trial 126 with value: 0.8771929824561403.
[32m[I 2023-04-26 00:05:58,622][39m Trial 237 finished with value: 0.8695652173913043 and parameters: {'objective': 'CrossEntropy', 'colsample_bylevel': 0.05128339893896523, 'depth': 5, 'boosting_type': 'Plain', 'bootstrap_type': 'Bayesian', 'bagging_temperature': 8.057794006352056}. Best is trial 126 with value: 0.8771929824561403.
[32m[I 2023-04-26 00:06:00,507][39m Trial 238 finished with value: 0.831858407079646 and parameters: {'objective': 'CrossEntropy', 'colsample_bylevel': 0.05018652968025253, 'depth': 6, 'boosting_type': 'Plain', 'bootstrap_type': 'Bayesian', 'bagging_temperature': 0.011395226872609854}. Best is trial 126 with value: 0.8771929824561403.
[32m[I 2023-04-26 00:06:02,447][39m Trial 239 finished with value: 0.8521739130434783 and parameters: {'objective': 'CrossEntropy', 'colsample_bylevel': 0.05398959867362294, 'depth': 5, 'boosting_type': 'Plain', 'bootstrap_type': 'Bayesian', 'bagging_temperature': 8.013214963971166}. Best is trial 126 with value: 0.8771929824561403.
[32m[I 2023-04-26 00:06:04,668][39m Trial 240 finished with value: 0.8521739130434783 and parameters: {'objective': 'CrossEntropy', 'colsample_bylevel': 0.05587381364218983, 'depth': 4, 'boosting_type': 'Plain', 'bootstrap_type': 'Bayesian', 'bagging_temperature': 8.267130091643974}. Best is trial 126 with value: 0.8771929824561403.
[32m[I 2023-04-26 00:06:06,754][39m Trial 241 finished with value: 0.8421052631578947 and parameters: {'objective': 'CrossEntropy', 'colsample_bylevel': 0.05084254043829487, 'depth': 6, 'boosting_type': 'Plain', 'bootstrap_type': 'Bayesian', 'bagging_temperature': 8.737125334410964}. Best is trial 126 with value: 0.8771929824561403.
[32m[I 2023-04-26 00:06:08,627][39m Trial 242 finished with value: 0.8521739130434783 and parameters: {'objective': 'CrossEntropy', 'colsample_bylevel': 0.05260475572755253, 'depth': 5, 'boosting_type': 'Plain', 'bootstrap_type': 'Bayesian', 'bagging_temperature': 8.255126511093374}. Best is trial 126 with value: 0.8771929824561403.
[32m[I 2023-04-26 00:06:11,043][39m Trial 243 finished with value: 0.8521739130434783 and parameters: {'objective': 'CrossEntropy', 'colsample_bylevel': 0.05747085805995161, 'depth': 6, 'boosting_type': 'Plain', 'bootstrap_type': 'Bayesian', 'bagging_temperature': 8.080041787247435}. Best is trial 126 with value: 0.8771929824561403.
[32m[I 2023-04-26 00:06:13,192][39m Trial 244 finished with value: 0.847457627118644 and parameters: {'objective': 'CrossEntropy', 'colsample_bylevel': 0.04985417390860421, 'depth': 4, 'boosting_type': 'Plain', 'bootstrap_type': 'Bayesian', 'bagging_temperature': 7.099121498806102}. Best is trial 126 with value: 0.8771929824561403.
[32m[I 2023-04-26 00:06:15,457][39m Trial 245 finished with value: 0.8545454545454546 and parameters: {'objective': 'CrossEntropy', 'colsample_bylevel': 0.06000340254363699, 'depth': 6, 'boosting_type': 'Plain', 'bootstrap_type': 'Bayesian', 'bagging_temperature': 7.8454323802974395}. Best is trial 126 with value: 0.8771929824561403.
[32m[I 2023-04-26 00:06:18,004][39m Trial 246 finished with value: 0.8672566371681416 and parameters: {'objective': 'CrossEntropy', 'colsample_bylevel': 0.06346451161588637, 'depth': 6, 'boosting_type': 'Plain', 'bootstrap_type': 'Bayesian', 'bagging_temperature': 7.463534692011336}. Best is trial 126 with value: 0.8771929824561403.
[32m[I 2023-04-26 00:06:20,742][39m Trial 247 finished with value: 0.8288288288288289 and parameters: {'objective': 'CrossEntropy', 'colsample_bylevel': 0.0632173785450054, 'depth': 6, 'boosting_type': 'Plain', 'bootstrap_type': 'Bayesian', 'bagging_temperature': 7.438617492178673}. Best is trial 126 with value: 0.8771929824561403.
[32m[I 2023-04-26 00:06:23,127][39m Trial 248 finished with value: 0.8571428571428572 and parameters: {'objective': 'CrossEntropy', 'colsample_bylevel': 0.06167789204868688, 'depth': 6, 'boosting_type': 'Plain', 'bootstrap_type': 'Bayesian', 'bagging_temperature': 8.069515666713023}. Best is trial 126 with value: 0.8771929824561403.
[32m[I 2023-04-26 00:06:25,855][39m Trial 249 finished with value: 0.8468468468468469 and parameters: {'objective': 'CrossEntropy', 'colsample_bylevel': 0.07035179429128467, 'depth': 5, 'boosting_type': 'Plain', 'bootstrap_type': 'Bayesian', 'bagging_temperature': 7.200839961319646}. Best is trial 126 with value: 0.8771929824561403.
[32m[I 2023-04-26 00:06:28,053][39m Trial 250 finished with value: 0.8421052631578947 and parameters: {'objective': 'CrossEntropy', 'colsample_bylevel': 0.058686087774391604, 'depth': 6, 'boosting_type': 'Plain', 'bootstrap_type': 'Bayesian', 'bagging_temperature': 8.911237009358064}. Best is trial 126 with value: 0.8771929824561403.
[32m[I 2023-04-26 00:06:30,700][39m Trial 251 finished with value: 0.8521739130434783 and parameters: {'objective': 'CrossEntropy', 'colsample_bylevel': 0.054193132970731, 'depth': 7, 'boosting_type': 'Plain', 'bootstrap_type': 'Bayesian', 'bagging_temperature': 8.397921156102615}. Best is trial 126 with value: 0.8771929824561403.
[32m[I 2023-04-26 00:06:32,996][39m Trial 252 finished with value: 0.8468468468468469 and parameters: {'objective': 'CrossEntropy', 'colsample_bylevel': 0.06617938597993307, 'depth': 5, 'boosting_type': 'Plain', 'bootstrap_type': 'Bayesian', 'bagging_temperature': 7.808686547583766}. Best is trial 126 with value: 0.8771929824561403.
[32m[I 2023-04-26 00:06:35,300][39m Trial 253 finished with value: 0.8672566371681416 and parameters: {'objective': 'CrossEntropy', 'colsample_bylevel': 0.04794378518779302, 'depth': 7, 'boosting_type': 'Plain', 'bootstrap_type': 'Bayesian', 'bagging_temperature': 7.394883752050835}. Best is trial 126 with value: 0.8771929824561403.
[32m[I 2023-04-26 00:06:37,481][39m Trial 254 finished with value: 0.8521739130434783 and parameters: {'objective': 'CrossEntropy', 'colsample_bylevel': 0.08987974928089512, 'depth': 2, 'boosting_type': 'Plain', 'bootstrap_type': 'Bayesian', 'bagging_temperature': 7.6398127378035845}. Best is trial 126 with value: 0.8771929824561403.
[32m[I 2023-04-26 00:06:39,382][39m Trial 255 finished with value: 0.8448275862068967 and parameters: {'objective': 'CrossEntropy', 'colsample_bylevel': 0.04815912799499599, 'depth': 7, 'boosting_type': 'Plain', 'bootstrap_type': 'MVS'}. Best is trial 126 with value: 0.8771929824561403.
[32m[I 2023-04-26 00:06:41,529][39m Trial 256 finished with value: 0.8596491228070176 and parameters: {'objective': 'CrossEntropy', 'colsample_bylevel': 0.04591822116436722, 'depth': 7, 'boosting_type': 'Plain', 'bootstrap_type': 'Bayesian', 'bagging_temperature': 7.487347206181475}. Best is trial 126 with value: 0.8771929824561403.
[32m[I 2023-04-26 00:06:43,773][39m Trial 257 finished with value: 0.8521739130434783 and parameters: {'objective': 'CrossEntropy', 'colsample_bylevel': 0.05157893081448412, 'depth': 7, 'boosting_type': 'Plain', 'bootstrap_type': 'Bayesian', 'bagging_temperature': 7.406431213139044}. Best is trial 126 with value: 0.8771929824561403.
[32m[I 2023-04-26 00:06:46,029][39m Trial 258 finished with value: 0.8547008547008546 and parameters: {'objective': 'CrossEntropy', 'colsample_bylevel': 0.04827514806955941, 'depth': 7, 'boosting_type': 'Plain', 'bootstrap_type': 'Bayesian', 'bagging_temperature': 7.956050534769488}. Best is trial 126 with value: 0.8771929824561403.
[32m[I 2023-04-26 00:06:48,132][39m Trial 259 finished with value: 0.8620689655172413 and parameters: {'objective': 'CrossEntropy', 'colsample_bylevel': 0.056383742610560436, 'depth': 7, 'boosting_type': 'Plain', 'bootstrap_type': 'Bayesian', 'bagging_temperature': 8.62128995650419}. Best is trial 126 with value: 0.8771929824561403.
[32m[I 2023-04-26 00:06:50,095][39m Trial 260 finished with value: 0.8571428571428572 and parameters: {'objective': 'CrossEntropy', 'colsample_bylevel': 0.04655083881735539, 'depth': 6, 'boosting_type': 'Plain', 'bootstrap_type': 'Bayesian', 'bagging_temperature': 7.1865815019042625}. Best is trial 126 with value: 0.8771929824561403.
[32m[I 2023-04-26 00:06:52,723][39m Trial 261 finished with value: 0.8495575221238938 and parameters: {'objective': 'CrossEntropy', 'colsample_bylevel': 0.08311282093764435, 'depth': 7, 'boosting_type': 'Plain', 'bootstrap_type': 'Bayesian', 'bagging_temperature': 9.794503509428704}. Best is trial 126 with value: 0.8771929824561403.
[32m[I 2023-04-26 00:06:54,874][39m Trial 262 finished with value: 0.8521739130434783 and parameters: {'objective': 'CrossEntropy', 'colsample_bylevel': 0.05025934565857285, 'depth': 6, 'boosting_type': 'Plain', 'bootstrap_type': 'Bayesian', 'bagging_temperature': 9.148921438225136}. Best is trial 126 with value: 0.8771929824561403.
[32m[I 2023-04-26 00:06:57,407][39m Trial 263 finished with value: 0.8468468468468469 and parameters: {'objective': 'CrossEntropy', 'colsample_bylevel': 0.07994604659798761, 'depth': 7, 'boosting_type': 'Plain', 'bootstrap_type': 'Bayesian', 'bagging_temperature': 8.15439889430386}. Best is trial 126 with value: 0.8771929824561403.
[32m[I 2023-04-26 00:06:59,968][39m Trial 264 finished with value: 0.8672566371681416 and parameters: {'objective': 'CrossEntropy', 'colsample_bylevel': 0.054296799001963506, 'depth': 7, 'boosting_type': 'Plain', 'bootstrap_type': 'Bayesian', 'bagging_temperature': 9.614030196957469}. Best is trial 126 with value: 0.8771929824561403.
