[32m[I 2023-04-26 00:01:59,359][39m Trial 135 finished with value: 0.8620689655172413 and parameters: {'objective': 'CrossEntropy', 'colsample_bylevel': 0.05341667881189255, 'depth': 7, 'boosting_type': 'Plain', 'bootstrap_type': 'Bayesian', 'bagging_temperature': 7.599312422851426}. Best is trial 126 with value: 0.8771929824561403.
[32m[I 2023-04-26 00:02:01,586][39m Trial 136 finished with value: 0.8495575221238938 and parameters: {'objective': 'CrossEntropy', 'colsample_bylevel': 0.056930694682573287, 'depth': 6, 'boosting_type': 'Plain', 'bootstrap_type': 'Bayesian', 'bagging_temperature': 7.840611677478333}. Best is trial 126 with value: 0.8771929824561403.
[32m[I 2023-04-26 00:02:04,002][39m Trial 137 finished with value: 0.8771929824561403 and parameters: {'objective': 'CrossEntropy', 'colsample_bylevel': 0.05268107089957674, 'depth': 7, 'boosting_type': 'Plain', 'bootstrap_type': 'Bayesian', 'bagging_temperature': 6.675544622576102}. Best is trial 126 with value: 0.8771929824561403.
[32m[I 2023-04-26 00:02:07,207][39m Trial 138 finished with value: 0.8672566371681416 and parameters: {'objective': 'CrossEntropy', 'colsample_bylevel': 0.06300707492006327, 'depth': 7, 'boosting_type': 'Plain', 'bootstrap_type': 'Bayesian', 'bagging_temperature': 6.653913606055253}. Best is trial 126 with value: 0.8771929824561403.
[32m[I 2023-04-26 00:02:09,686][39m Trial 139 finished with value: 0.8596491228070176 and parameters: {'objective': 'CrossEntropy', 'colsample_bylevel': 0.05391096141831301, 'depth': 7, 'boosting_type': 'Plain', 'bootstrap_type': 'Bayesian', 'bagging_temperature': 7.050701310969961}. Best is trial 126 with value: 0.8771929824561403.
[32m[I 2023-04-26 00:02:12,439][39m Trial 140 finished with value: 0.8214285714285715 and parameters: {'objective': 'CrossEntropy', 'colsample_bylevel': 0.06248313366240381, 'depth': 6, 'boosting_type': 'Plain', 'bootstrap_type': 'Bayesian', 'bagging_temperature': 6.396813711828067}. Best is trial 126 with value: 0.8771929824561403.
[32m[I 2023-04-26 00:02:15,222][39m Trial 141 finished with value: 0.8468468468468469 and parameters: {'objective': 'CrossEntropy', 'colsample_bylevel': 0.06022566633005352, 'depth': 7, 'boosting_type': 'Plain', 'bootstrap_type': 'Bayesian', 'bagging_temperature': 7.744278651027524}. Best is trial 126 with value: 0.8771929824561403.
[32m[I 2023-04-26 00:02:17,907][39m Trial 142 finished with value: 0.8468468468468469 and parameters: {'objective': 'CrossEntropy', 'colsample_bylevel': 0.08077521336446561, 'depth': 7, 'boosting_type': 'Plain', 'bootstrap_type': 'Bayesian', 'bagging_temperature': 9.06443720634245}. Best is trial 126 with value: 0.8771929824561403.
[32m[I 2023-04-26 00:02:20,239][39m Trial 143 finished with value: 0.8596491228070176 and parameters: {'objective': 'CrossEntropy', 'colsample_bylevel': 0.09362635656541902, 'depth': 7, 'boosting_type': 'Plain', 'bootstrap_type': 'Bayesian', 'bagging_temperature': 8.223864477209695}. Best is trial 126 with value: 0.8771929824561403.
[32m[I 2023-04-26 00:02:22,529][39m Trial 144 finished with value: 0.8495575221238938 and parameters: {'objective': 'CrossEntropy', 'colsample_bylevel': 0.04996512599201392, 'depth': 7, 'boosting_type': 'Plain', 'bootstrap_type': 'Bayesian', 'bagging_temperature': 6.680267915698514}. Best is trial 126 with value: 0.8771929824561403.
[32m[I 2023-04-26 00:02:25,276][39m Trial 145 finished with value: 0.8571428571428572 and parameters: {'objective': 'CrossEntropy', 'colsample_bylevel': 0.0863632223903834, 'depth': 7, 'boosting_type': 'Plain', 'bootstrap_type': 'Bayesian', 'bagging_temperature': 5.550780331012774}. Best is trial 126 with value: 0.8771929824561403.
[32m[I 2023-04-26 00:02:27,968][39m Trial 146 finished with value: 0.831858407079646 and parameters: {'objective': 'CrossEntropy', 'colsample_bylevel': 0.056930604633009946, 'depth': 6, 'boosting_type': 'Plain', 'bootstrap_type': 'Bayesian', 'bagging_temperature': 7.505067793220993}. Best is trial 126 with value: 0.8771929824561403.
[32m[I 2023-04-26 00:02:31,141][39m Trial 147 finished with value: 0.8571428571428572 and parameters: {'objective': 'CrossEntropy', 'colsample_bylevel': 0.06699085163185861, 'depth': 7, 'boosting_type': 'Plain', 'bootstrap_type': 'Bayesian', 'bagging_temperature': 8.77388392894789}. Best is trial 126 with value: 0.8771929824561403.
[32m[I 2023-04-26 00:02:33,116][39m Trial 148 finished with value: 0.8547008547008546 and parameters: {'objective': 'CrossEntropy', 'colsample_bylevel': 0.032735282197236516, 'depth': 8, 'boosting_type': 'Plain', 'bootstrap_type': 'Bayesian', 'bagging_temperature': 9.391075019495727}. Best is trial 126 with value: 0.8771929824561403.
[32m[I 2023-04-26 00:02:36,187][39m Trial 149 finished with value: 0.8363636363636363 and parameters: {'objective': 'CrossEntropy', 'colsample_bylevel': 0.09748026141428447, 'depth': 6, 'boosting_type': 'Plain', 'bootstrap_type': 'Bayesian', 'bagging_temperature': 8.285821739481296}. Best is trial 126 with value: 0.8771929824561403.
[32m[I 2023-04-26 00:02:38,248][39m Trial 150 finished with value: 0.8620689655172413 and parameters: {'objective': 'CrossEntropy', 'colsample_bylevel': 0.04048148200571879, 'depth': 8, 'boosting_type': 'Plain', 'bootstrap_type': 'Bayesian', 'bagging_temperature': 6.016672106782883}. Best is trial 126 with value: 0.8771929824561403.
[32m[I 2023-04-26 00:02:40,504][39m Trial 151 finished with value: 0.8521739130434783 and parameters: {'objective': 'CrossEntropy', 'colsample_bylevel': 0.04088024829855058, 'depth': 8, 'boosting_type': 'Plain', 'bootstrap_type': 'Bayesian', 'bagging_temperature': 5.816834704744097}. Best is trial 126 with value: 0.8771929824561403.
[32m[I 2023-04-26 00:02:42,515][39m Trial 152 finished with value: 0.8547008547008546 and parameters: {'objective': 'CrossEntropy', 'colsample_bylevel': 0.03849643138487787, 'depth': 7, 'boosting_type': 'Plain', 'bootstrap_type': 'Bayesian', 'bagging_temperature': 4.805672042467383}. Best is trial 126 with value: 0.8771929824561403.
[32m[I 2023-04-26 00:02:44,649][39m Trial 153 finished with value: 0.8620689655172413 and parameters: {'objective': 'CrossEntropy', 'colsample_bylevel': 0.04195037040501644, 'depth': 8, 'boosting_type': 'Plain', 'bootstrap_type': 'Bayesian', 'bagging_temperature': 6.661072591266724}. Best is trial 126 with value: 0.8771929824561403.
[32m[I 2023-04-26 00:02:47,083][39m Trial 154 finished with value: 0.8771929824561403 and parameters: {'objective': 'CrossEntropy', 'colsample_bylevel': 0.04561260914668202, 'depth': 8, 'boosting_type': 'Plain', 'bootstrap_type': 'Bayesian', 'bagging_temperature': 7.005740586032787}. Best is trial 126 with value: 0.8771929824561403.
[32m[I 2023-04-26 00:02:49,789][39m Trial 155 finished with value: 0.8363636363636363 and parameters: {'objective': 'CrossEntropy', 'colsample_bylevel': 0.07423375375670449, 'depth': 7, 'boosting_type': 'Plain', 'bootstrap_type': 'Bayesian', 'bagging_temperature': 7.533914028772771}. Best is trial 126 with value: 0.8771929824561403.
[32m[I 2023-04-26 00:02:51,957][39m Trial 156 finished with value: 0.8547008547008546 and parameters: {'objective': 'CrossEntropy', 'colsample_bylevel': 0.04214740332767378, 'depth': 8, 'boosting_type': 'Plain', 'bootstrap_type': 'Bayesian', 'bagging_temperature': 6.766365501195481}. Best is trial 126 with value: 0.8771929824561403.
[32m[I 2023-04-26 00:02:54,373][39m Trial 157 finished with value: 0.8571428571428572 and parameters: {'objective': 'CrossEntropy', 'colsample_bylevel': 0.04562634131649983, 'depth': 8, 'boosting_type': 'Plain', 'bootstrap_type': 'Bayesian', 'bagging_temperature': 6.814342092307404}. Best is trial 126 with value: 0.8771929824561403.
[32m[I 2023-04-26 00:02:56,966][39m Trial 158 finished with value: 0.8288288288288289 and parameters: {'objective': 'CrossEntropy', 'colsample_bylevel': 0.05302554990565695, 'depth': 7, 'boosting_type': 'Plain', 'bootstrap_type': 'Bayesian', 'bagging_temperature': 6.3363193217847495}. Best is trial 126 with value: 0.8771929824561403.
[32m[I 2023-04-26 00:02:59,571][39m Trial 159 finished with value: 0.8495575221238938 and parameters: {'objective': 'CrossEntropy', 'colsample_bylevel': 0.04718693201259717, 'depth': 8, 'boosting_type': 'Plain', 'bootstrap_type': 'Bayesian', 'bagging_temperature': 7.220366135999078}. Best is trial 126 with value: 0.8771929824561403.
[32m[I 2023-04-26 00:03:01,868][39m Trial 160 finished with value: 0.8695652173913043 and parameters: {'objective': 'CrossEntropy', 'colsample_bylevel': 0.04032413201719868, 'depth': 8, 'boosting_type': 'Plain', 'bootstrap_type': 'Bayesian', 'bagging_temperature': 6.134339167092424}. Best is trial 126 with value: 0.8771929824561403.
[32m[I 2023-04-26 00:03:03,948][39m Trial 161 finished with value: 0.8547008547008546 and parameters: {'objective': 'CrossEntropy', 'colsample_bylevel': 0.04017803340601147, 'depth': 8, 'boosting_type': 'Plain', 'bootstrap_type': 'Bayesian', 'bagging_temperature': 5.292498205555548}. Best is trial 126 with value: 0.8771929824561403.
[32m[I 2023-04-26 00:03:06,315][39m Trial 162 finished with value: 0.847457627118644 and parameters: {'objective': 'CrossEntropy', 'colsample_bylevel': 0.03541951825172276, 'depth': 9, 'boosting_type': 'Plain', 'bootstrap_type': 'Bayesian', 'bagging_temperature': 7.188310014286907}. Best is trial 126 with value: 0.8771929824561403.
[32m[I 2023-04-26 00:03:08,267][39m Trial 163 finished with value: 0.8547008547008546 and parameters: {'objective': 'CrossEntropy', 'colsample_bylevel': 0.03758346107482513, 'depth': 8, 'boosting_type': 'Plain', 'bootstrap_type': 'Bayesian', 'bagging_temperature': 6.02999615772136}. Best is trial 126 with value: 0.8771929824561403.
[32m[I 2023-04-26 00:03:10,241][39m Trial 164 finished with value: 0.8547008547008546 and parameters: {'objective': 'CrossEntropy', 'colsample_bylevel': 0.03433399391633632, 'depth': 7, 'boosting_type': 'Plain', 'bootstrap_type': 'Bayesian', 'bagging_temperature': 8.792739401208866}. Best is trial 126 with value: 0.8771929824561403.
[32m[I 2023-04-26 00:03:11,660][39m Trial 165 finished with value: 0.8275862068965517 and parameters: {'objective': 'CrossEntropy', 'colsample_bylevel': 0.02834689294054596, 'depth': 5, 'boosting_type': 'Plain', 'bootstrap_type': 'MVS'}. Best is trial 126 with value: 0.8771929824561403.
[32m[I 2023-04-26 00:03:13,857][39m Trial 166 finished with value: 0.8547008547008546 and parameters: {'objective': 'CrossEntropy', 'colsample_bylevel': 0.042869942811149475, 'depth': 8, 'boosting_type': 'Plain', 'bootstrap_type': 'Bayesian', 'bagging_temperature': 6.102784814904608}. Best is trial 126 with value: 0.8771929824561403.
[32m[I 2023-04-26 00:03:15,985][39m Trial 167 finished with value: 0.8672566371681416 and parameters: {'objective': 'CrossEntropy', 'colsample_bylevel': 0.04563464609358428, 'depth': 7, 'boosting_type': 'Plain', 'bootstrap_type': 'Bayesian', 'bagging_temperature': 7.660941469451546}. Best is trial 126 with value: 0.8771929824561403.
[32m[I 2023-04-26 00:03:18,384][39m Trial 168 finished with value: 0.8620689655172413 and parameters: {'objective': 'CrossEntropy', 'colsample_bylevel': 0.04909399076124188, 'depth': 8, 'boosting_type': 'Plain', 'bootstrap_type': 'Bayesian', 'bagging_temperature': 7.580817227834953}. Best is trial 126 with value: 0.8771929824561403.
[32m[I 2023-04-26 00:03:21,088][39m Trial 169 finished with value: 0.8648648648648648 and parameters: {'objective': 'CrossEntropy', 'colsample_bylevel': 0.050274202068919055, 'depth': 8, 'boosting_type': 'Plain', 'bootstrap_type': 'Bayesian', 'bagging_temperature': 6.873061223114467}. Best is trial 126 with value: 0.8771929824561403.
[32m[I 2023-04-26 00:03:23,836][39m Trial 170 finished with value: 0.8495575221238938 and parameters: {'objective': 'CrossEntropy', 'colsample_bylevel': 0.05124036018748494, 'depth': 7, 'boosting_type': 'Plain', 'bootstrap_type': 'Bayesian', 'bagging_temperature': 6.7919671752703685}. Best is trial 126 with value: 0.8771929824561403.
[32m[I 2023-04-26 00:03:26,430][39m Trial 171 finished with value: 0.8495575221238938 and parameters: {'objective': 'CrossEntropy', 'colsample_bylevel': 0.04562780355067188, 'depth': 8, 'boosting_type': 'Plain', 'bootstrap_type': 'Bayesian', 'bagging_temperature': 6.516499170907974}. Best is trial 126 with value: 0.8771929824561403.
[32m[I 2023-04-26 00:03:30,052][39m Trial 172 finished with value: 0.8596491228070176 and parameters: {'objective': 'CrossEntropy', 'colsample_bylevel': 0.05563815109879825, 'depth': 9, 'boosting_type': 'Plain', 'bootstrap_type': 'Bayesian', 'bagging_temperature': 6.9781711758865335}. Best is trial 126 with value: 0.8771929824561403.
[32m[I 2023-04-26 00:03:32,153][39m Trial 173 finished with value: 0.8620689655172413 and parameters: {'objective': 'CrossEntropy', 'colsample_bylevel': 0.048560691941908415, 'depth': 7, 'boosting_type': 'Plain', 'bootstrap_type': 'Bayesian', 'bagging_temperature': 7.5943188710192295}. Best is trial 126 with value: 0.8771929824561403.
[32m[I 2023-04-26 00:03:34,259][39m Trial 174 finished with value: 0.8495575221238938 and parameters: {'objective': 'CrossEntropy', 'colsample_bylevel': 0.04689677785425281, 'depth': 7, 'boosting_type': 'Plain', 'bootstrap_type': 'Bayesian', 'bagging_temperature': 7.958556085510671}. Best is trial 126 with value: 0.8771929824561403.
[32m[I 2023-04-26 00:03:36,440][39m Trial 175 finished with value: 0.8596491228070176 and parameters: {'objective': 'CrossEntropy', 'colsample_bylevel': 0.05183007465342444, 'depth': 6, 'boosting_type': 'Plain', 'bootstrap_type': 'Bayesian', 'bagging_temperature': 7.3153901247376805}. Best is trial 126 with value: 0.8771929824561403.
[32m[I 2023-04-26 00:03:38,967][39m Trial 176 finished with value: 0.8347826086956522 and parameters: {'objective': 'CrossEntropy', 'colsample_bylevel': 0.044487103544848625, 'depth': 8, 'boosting_type': 'Plain', 'bootstrap_type': 'Bayesian', 'bagging_temperature': 2.276852350818437}. Best is trial 126 with value: 0.8771929824561403.
[32m[I 2023-04-26 00:03:41,825][39m Trial 177 finished with value: 0.8596491228070176 and parameters: {'objective': 'CrossEntropy', 'colsample_bylevel': 0.05052206031200562, 'depth': 9, 'boosting_type': 'Plain', 'bootstrap_type': 'Bayesian', 'bagging_temperature': 8.283815908554033}. Best is trial 126 with value: 0.8771929824561403.
[32m[I 2023-04-26 00:03:44,067][39m Trial 178 finished with value: 0.8620689655172413 and parameters: {'objective': 'CrossEntropy', 'colsample_bylevel': 0.042624982711516074, 'depth': 8, 'boosting_type': 'Plain', 'bootstrap_type': 'Bayesian', 'bagging_temperature': 6.4223359584944}. Best is trial 126 with value: 0.8771929824561403.
[32m[I 2023-04-26 00:03:46,281][39m Trial 179 finished with value: 0.8495575221238938 and parameters: {'objective': 'CrossEntropy', 'colsample_bylevel': 0.043153215109064065, 'depth': 8, 'boosting_type': 'Plain', 'bootstrap_type': 'Bayesian', 'bagging_temperature': 6.245163205261756}. Best is trial 126 with value: 0.8771929824561403.
[32m[I 2023-04-26 00:03:48,536][39m Trial 180 finished with value: 0.8547008547008546 and parameters: {'objective': 'CrossEntropy', 'colsample_bylevel': 0.041200177959482324, 'depth': 8, 'boosting_type': 'Plain', 'bootstrap_type': 'Bayesian', 'bagging_temperature': 5.6316325056276}. Best is trial 126 with value: 0.8771929824561403.
[32m[I 2023-04-26 00:03:50,983][39m Trial 181 finished with value: 0.8672566371681416 and parameters: {'objective': 'CrossEntropy', 'colsample_bylevel': 0.048405323382772494, 'depth': 7, 'boosting_type': 'Plain', 'bootstrap_type': 'Bayesian', 'bagging_temperature': 7.864817541409329}. Best is trial 126 with value: 0.8771929824561403.
[32m[I 2023-04-26 00:03:53,643][39m Trial 182 finished with value: 0.8468468468468469 and parameters: {'objective': 'CrossEntropy', 'colsample_bylevel': 0.04916959121783633, 'depth': 8, 'boosting_type': 'Plain', 'bootstrap_type': 'Bayesian', 'bagging_temperature': 4.629153285060293}. Best is trial 126 with value: 0.8771929824561403.
[32m[I 2023-04-26 00:03:55,840][39m Trial 183 finished with value: 0.8521739130434783 and parameters: {'objective': 'CrossEntropy', 'colsample_bylevel': 0.045173042305324644, 'depth': 8, 'boosting_type': 'Plain', 'bootstrap_type': 'Bayesian', 'bagging_temperature': 6.989262717198785}. Best is trial 126 with value: 0.8771929824561403.
[32m[I 2023-04-26 00:03:58,012][39m Trial 184 finished with value: 0.8620689655172413 and parameters: {'objective': 'CrossEntropy', 'colsample_bylevel': 0.04824340487287438, 'depth': 7, 'boosting_type': 'Plain', 'bootstrap_type': 'Bayesian', 'bagging_temperature': 7.67930867756959}. Best is trial 126 with value: 0.8771929824561403.
[32m[I 2023-04-26 00:03:59,682][39m Trial 185 finished with value: 0.8521739130434783 and parameters: {'objective': 'CrossEntropy', 'colsample_bylevel': 0.03884669719312209, 'depth': 7, 'boosting_type': 'Plain', 'bootstrap_type': 'Bayesian', 'bagging_temperature': 8.015225603007828}. Best is trial 126 with value: 0.8771929824561403.
[32m[I 2023-04-26 00:04:01,795][39m Trial 186 finished with value: 0.8245614035087718 and parameters: {'objective': 'CrossEntropy', 'colsample_bylevel': 0.04676875074040145, 'depth': 7, 'boosting_type': 'Plain', 'bootstrap_type': 'Bayesian', 'bagging_temperature': 8.527129065613236}. Best is trial 126 with value: 0.8771929824561403.
[32m[I 2023-04-26 00:04:04,221][39m Trial 187 finished with value: 0.8495575221238938 and parameters: {'objective': 'CrossEntropy', 'colsample_bylevel': 0.053744461983259176, 'depth': 7, 'boosting_type': 'Plain', 'bootstrap_type': 'Bayesian', 'bagging_temperature': 8.983243021875586}. Best is trial 126 with value: 0.8771929824561403.
[32m[I 2023-04-26 00:04:06,342][39m Trial 188 finished with value: 0.8672566371681416 and parameters: {'objective': 'CrossEntropy', 'colsample_bylevel': 0.047649503316053964, 'depth': 7, 'boosting_type': 'Plain', 'bootstrap_type': 'Bayesian', 'bagging_temperature': 7.444613603686212}. Best is trial 126 with value: 0.8771929824561403.
[32m[I 2023-04-26 00:04:08,346][39m Trial 189 finished with value: 0.8695652173913043 and parameters: {'objective': 'CrossEntropy', 'colsample_bylevel': 0.04563358606963463, 'depth': 6, 'boosting_type': 'Plain', 'bootstrap_type': 'Bayesian', 'bagging_temperature': 9.538094004847066}. Best is trial 126 with value: 0.8771929824561403.
[32m[I 2023-04-26 00:04:10,279][39m Trial 190 finished with value: 0.8596491228070176 and parameters: {'objective': 'CrossEntropy', 'colsample_bylevel': 0.04861038276848743, 'depth': 6, 'boosting_type': 'Plain', 'bootstrap_type': 'Bayesian', 'bagging_temperature': 7.7339166594197035}. Best is trial 126 with value: 0.8771929824561403.
[32m[I 2023-04-26 00:04:12,365][39m Trial 191 finished with value: 0.8620689655172413 and parameters: {'objective': 'CrossEntropy', 'colsample_bylevel': 0.05008715920446547, 'depth': 6, 'boosting_type': 'Plain', 'bootstrap_type': 'Bayesian', 'bagging_temperature': 7.339087084661639}. Best is trial 126 with value: 0.8771929824561403.
[32m[I 2023-04-26 00:04:14,467][39m Trial 192 finished with value: 0.8695652173913043 and parameters: {'objective': 'CrossEntropy', 'colsample_bylevel': 0.050477407707704154, 'depth': 6, 'boosting_type': 'Plain', 'bootstrap_type': 'Bayesian', 'bagging_temperature': 7.495294417309604}. Best is trial 126 with value: 0.8771929824561403.
[32m[I 2023-04-26 00:04:16,150][39m Trial 193 finished with value: 0.8448275862068967 and parameters: {'objective': 'CrossEntropy', 'colsample_bylevel': 0.04616578725711116, 'depth': 5, 'boosting_type': 'Plain', 'bootstrap_type': 'Bayesian', 'bagging_temperature': 9.383178394200604}. Best is trial 126 with value: 0.8771929824561403.
[32m[I 2023-04-26 00:04:18,122][39m Trial 194 finished with value: 0.8347826086956522 and parameters: {'objective': 'CrossEntropy', 'colsample_bylevel': 0.049161270592803265, 'depth': 6, 'boosting_type': 'Plain', 'bootstrap_type': 'Bayesian', 'bagging_temperature': 7.437308047362843}. Best is trial 126 with value: 0.8771929824561403.
[32m[I 2023-04-26 00:04:20,957][39m Trial 195 finished with value: 0.8672566371681416 and parameters: {'objective': 'CrossEntropy', 'colsample_bylevel': 0.05235250927235205, 'depth': 7, 'boosting_type': 'Plain', 'bootstrap_type': 'Bayesian', 'bagging_temperature': 9.877879001237364}. Best is trial 126 with value: 0.8771929824561403.
[32m[I 2023-04-26 00:04:23,662][39m Trial 196 finished with value: 0.8521739130434783 and parameters: {'objective': 'CrossEntropy', 'colsample_bylevel': 0.05578224819498409, 'depth': 7, 'boosting_type': 'Plain', 'bootstrap_type': 'Bayesian', 'bagging_temperature': 9.610663205060307}. Best is trial 126 with value: 0.8771929824561403.
[32m[I 2023-04-26 00:04:25,817][39m Trial 197 finished with value: 0.8521739130434783 and parameters: {'objective': 'CrossEntropy', 'colsample_bylevel': 0.05202688679407972, 'depth': 6, 'boosting_type': 'Plain', 'bootstrap_type': 'Bayesian', 'bagging_temperature': 7.903132996201079}. Best is trial 126 with value: 0.8771929824561403.
[32m[I 2023-04-26 00:04:27,724][39m Trial 198 finished with value: 0.8448275862068967 and parameters: {'objective': 'CrossEntropy', 'colsample_bylevel': 0.052631194285762094, 'depth': 7, 'boosting_type': 'Plain', 'bootstrap_type': 'Bayesian', 'bagging_temperature': 9.913634868798022}. Best is trial 126 with value: 0.8771929824561403.
[32m[I 2023-04-26 00:04:29,684][39m Trial 199 finished with value: 0.8421052631578947 and parameters: {'objective': 'CrossEntropy', 'colsample_bylevel': 0.04796433790965132, 'depth': 6, 'boosting_type': 'Plain', 'bootstrap_type': 'Bayesian', 'bagging_temperature': 9.718664874540186}. Best is trial 126 with value: 0.8771929824561403.
