[32m[I 2023-04-26 10:38:46,713][39m Trial 133 finished with value: 0.8849557522123893 and parameters: {'objective': 'CrossEntropy', 'colsample_bylevel': 0.0662403992859419, 'depth': 3, 'boosting_type': 'Plain', 'bootstrap_type': 'Bayesian', 'bagging_temperature': 8.335996175889164}. Best is trial 13 with value: 0.8928571428571429.
[32m[I 2023-04-26 10:38:48,468][39m Trial 134 finished with value: 0.875 and parameters: {'objective': 'CrossEntropy', 'colsample_bylevel': 0.07285909296920502, 'depth': 3, 'boosting_type': 'Plain', 'bootstrap_type': 'Bayesian', 'bagging_temperature': 2.350141877370897}. Best is trial 13 with value: 0.8928571428571429.
[32m[I 2023-04-26 10:38:50,194][39m Trial 135 finished with value: 0.8695652173913043 and parameters: {'objective': 'CrossEntropy', 'colsample_bylevel': 0.06585191786576026, 'depth': 6, 'boosting_type': 'Plain', 'bootstrap_type': 'Bayesian', 'bagging_temperature': 8.758193344176675}. Best is trial 13 with value: 0.8928571428571429.
[32m[I 2023-04-26 10:38:52,199][39m Trial 136 finished with value: 0.8596491228070176 and parameters: {'objective': 'Logloss', 'colsample_bylevel': 0.05522281809609708, 'depth': 8, 'boosting_type': 'Plain', 'bootstrap_type': 'Bernoulli', 'subsample': 0.7459125252282435}. Best is trial 13 with value: 0.8928571428571429.
[32m[I 2023-04-26 10:38:54,481][39m Trial 137 finished with value: 0.8771929824561403 and parameters: {'objective': 'Logloss', 'colsample_bylevel': 0.058383354178394076, 'depth': 9, 'boosting_type': 'Plain', 'bootstrap_type': 'Bayesian', 'bagging_temperature': 9.890898797108846}. Best is trial 13 with value: 0.8928571428571429.
[32m[I 2023-04-26 10:38:55,758][39m Trial 138 finished with value: 0.8135593220338982 and parameters: {'objective': 'CrossEntropy', 'colsample_bylevel': 0.05688704294489586, 'depth': 1, 'boosting_type': 'Plain', 'bootstrap_type': 'Bayesian', 'bagging_temperature': 8.547341532233956}. Best is trial 13 with value: 0.8928571428571429.
[32m[I 2023-04-26 10:38:57,336][39m Trial 139 finished with value: 0.8596491228070176 and parameters: {'objective': 'CrossEntropy', 'colsample_bylevel': 0.06308642503020159, 'depth': 2, 'boosting_type': 'Plain', 'bootstrap_type': 'MVS'}. Best is trial 13 with value: 0.8928571428571429.
[32m[I 2023-04-26 10:38:58,874][39m Trial 140 finished with value: 0.8771929824561403 and parameters: {'objective': 'CrossEntropy', 'colsample_bylevel': 0.056375657353458515, 'depth': 4, 'boosting_type': 'Plain', 'bootstrap_type': 'Bayesian', 'bagging_temperature': 9.528075210328122}. Best is trial 13 with value: 0.8928571428571429.
[32m[I 2023-04-26 10:39:00,503][39m Trial 141 finished with value: 0.8849557522123893 and parameters: {'objective': 'Logloss', 'colsample_bylevel': 0.0593607044686692, 'depth': 4, 'boosting_type': 'Plain', 'bootstrap_type': 'Bayesian', 'bagging_temperature': 8.162310056434745}. Best is trial 13 with value: 0.8928571428571429.
[32m[I 2023-04-26 10:39:02,157][39m Trial 142 finished with value: 0.8849557522123893 and parameters: {'objective': 'Logloss', 'colsample_bylevel': 0.059603704402397456, 'depth': 4, 'boosting_type': 'Plain', 'bootstrap_type': 'Bayesian', 'bagging_temperature': 9.298791555251281}. Best is trial 13 with value: 0.8928571428571429.
[32m[I 2023-04-26 10:39:03,849][39m Trial 143 finished with value: 0.8771929824561403 and parameters: {'objective': 'Logloss', 'colsample_bylevel': 0.06334233296351634, 'depth': 4, 'boosting_type': 'Plain', 'bootstrap_type': 'Bayesian', 'bagging_temperature': 9.310496246025957}. Best is trial 13 with value: 0.8928571428571429.
[32m[I 2023-04-26 10:39:05,418][39m Trial 144 finished with value: 0.8849557522123893 and parameters: {'objective': 'Logloss', 'colsample_bylevel': 0.06042578322697449, 'depth': 4, 'boosting_type': 'Plain', 'bootstrap_type': 'Bayesian', 'bagging_temperature': 9.009300923352358}. Best is trial 13 with value: 0.8928571428571429.
[32m[I 2023-04-26 10:39:07,062][39m Trial 145 finished with value: 0.875 and parameters: {'objective': 'CrossEntropy', 'colsample_bylevel': 0.05226181845374132, 'depth': 5, 'boosting_type': 'Plain', 'bootstrap_type': 'Bayesian', 'bagging_temperature': 7.780416781263197}. Best is trial 13 with value: 0.8928571428571429.
[32m[I 2023-04-26 10:39:08,715][39m Trial 146 finished with value: 0.8771929824561403 and parameters: {'objective': 'Logloss', 'colsample_bylevel': 0.06851282065672243, 'depth': 4, 'boosting_type': 'Plain', 'bootstrap_type': 'Bayesian', 'bagging_temperature': 8.97816600331724}. Best is trial 13 with value: 0.8928571428571429.
[32m[I 2023-04-26 10:39:10,440][39m Trial 147 finished with value: 0.8849557522123893 and parameters: {'objective': 'Logloss', 'colsample_bylevel': 0.06676531253615535, 'depth': 3, 'boosting_type': 'Plain', 'bootstrap_type': 'Bayesian', 'bagging_temperature': 9.539787032391018}. Best is trial 13 with value: 0.8928571428571429.
[32m[I 2023-04-26 10:39:12,320][39m Trial 148 finished with value: 0.8771929824561403 and parameters: {'objective': 'Logloss', 'colsample_bylevel': 0.0765464438353709, 'depth': 3, 'boosting_type': 'Plain', 'bootstrap_type': 'Bayesian', 'bagging_temperature': 6.28309372811473}. Best is trial 13 with value: 0.8928571428571429.
[32m[I 2023-04-26 10:39:15,767][39m Trial 149 finished with value: 0.8596491228070176 and parameters: {'objective': 'Logloss', 'colsample_bylevel': 0.049164796432372565, 'depth': 3, 'boosting_type': 'Ordered', 'bootstrap_type': 'Bayesian', 'bagging_temperature': 9.516301206871576}. Best is trial 13 with value: 0.8928571428571429.
[32m[I 2023-04-26 10:39:17,436][39m Trial 150 finished with value: 0.8771929824561403 and parameters: {'objective': 'CrossEntropy', 'colsample_bylevel': 0.05512705787076956, 'depth': 5, 'boosting_type': 'Plain', 'bootstrap_type': 'Bayesian', 'bagging_temperature': 8.758507225747683}. Best is trial 13 with value: 0.8928571428571429.
[32m[I 2023-04-26 10:39:19,027][39m Trial 151 finished with value: 0.8695652173913043 and parameters: {'objective': 'CrossEntropy', 'colsample_bylevel': 0.05073376915048008, 'depth': 5, 'boosting_type': 'Plain', 'bootstrap_type': 'Bayesian', 'bagging_temperature': 8.263870572408425}. Best is trial 13 with value: 0.8928571428571429.
[32m[I 2023-04-26 10:39:20,650][39m Trial 152 finished with value: 0.8695652173913043 and parameters: {'objective': 'CrossEntropy', 'colsample_bylevel': 0.06526924072588682, 'depth': 2, 'boosting_type': 'Plain', 'bootstrap_type': 'Bayesian', 'bagging_temperature': 9.997157826098102}. Best is trial 13 with value: 0.8928571428571429.
[32m[I 2023-04-26 10:39:22,284][39m Trial 153 finished with value: 0.8695652173913043 and parameters: {'objective': 'CrossEntropy', 'colsample_bylevel': 0.05829281952844441, 'depth': 4, 'boosting_type': 'Plain', 'bootstrap_type': 'Bayesian', 'bagging_temperature': 7.966402209455621}. Best is trial 13 with value: 0.8928571428571429.
[32m[I 2023-04-26 10:39:24,106][39m Trial 154 finished with value: 0.8828828828828829 and parameters: {'objective': 'Logloss', 'colsample_bylevel': 0.07052949072627912, 'depth': 5, 'boosting_type': 'Plain', 'bootstrap_type': 'Bayesian', 'bagging_temperature': 9.25568653525385}. Best is trial 13 with value: 0.8928571428571429.
[32m[I 2023-04-26 10:39:25,699][39m Trial 155 finished with value: 0.8771929824561403 and parameters: {'objective': 'Logloss', 'colsample_bylevel': 0.06011524508169837, 'depth': 4, 'boosting_type': 'Plain', 'bootstrap_type': 'Bayesian', 'bagging_temperature': 8.983295209123366}. Best is trial 13 with value: 0.8928571428571429.
[32m[I 2023-04-26 10:39:27,356][39m Trial 156 finished with value: 0.8771929824561403 and parameters: {'objective': 'CrossEntropy', 'colsample_bylevel': 0.05996602235370226, 'depth': 4, 'boosting_type': 'Plain', 'bootstrap_type': 'Bayesian', 'bagging_temperature': 8.492814413330064}. Best is trial 13 with value: 0.8928571428571429.
[32m[I 2023-04-26 10:39:29,443][39m Trial 157 finished with value: 0.875 and parameters: {'objective': 'Logloss', 'colsample_bylevel': 0.06416896113070349, 'depth': 8, 'boosting_type': 'Plain', 'bootstrap_type': 'Bayesian', 'bagging_temperature': 7.365449288799402}. Best is trial 13 with value: 0.8928571428571429.
[32m[I 2023-04-26 10:39:30,998][39m Trial 158 finished with value: 0.8849557522123893 and parameters: {'objective': 'CrossEntropy', 'colsample_bylevel': 0.053498630260614535, 'depth': 4, 'boosting_type': 'Plain', 'bootstrap_type': 'Bayesian', 'bagging_temperature': 8.126535131908232}. Best is trial 13 with value: 0.8928571428571429.
[32m[I 2023-04-26 10:39:32,551][39m Trial 159 finished with value: 0.8849557522123893 and parameters: {'objective': 'CrossEntropy', 'colsample_bylevel': 0.05601560124430788, 'depth': 4, 'boosting_type': 'Plain', 'bootstrap_type': 'Bayesian', 'bagging_temperature': 7.690546603781893}. Best is trial 13 with value: 0.8928571428571429.
[32m[I 2023-04-26 10:39:34,086][39m Trial 160 finished with value: 0.8849557522123893 and parameters: {'objective': 'CrossEntropy', 'colsample_bylevel': 0.053312218625343875, 'depth': 4, 'boosting_type': 'Plain', 'bootstrap_type': 'Bayesian', 'bagging_temperature': 8.346633865883446}. Best is trial 13 with value: 0.8928571428571429.
[32m[I 2023-04-26 10:39:35,697][39m Trial 161 finished with value: 0.8672566371681416 and parameters: {'objective': 'Logloss', 'colsample_bylevel': 0.0567132971457202, 'depth': 5, 'boosting_type': 'Plain', 'bootstrap_type': 'Bayesian', 'bagging_temperature': 4.267109355658734}. Best is trial 13 with value: 0.8928571428571429.
[32m[I 2023-04-26 10:39:37,343][39m Trial 162 finished with value: 0.8620689655172413 and parameters: {'objective': 'CrossEntropy', 'colsample_bylevel': 0.06173011285395327, 'depth': 4, 'boosting_type': 'Plain', 'bootstrap_type': 'Bayesian', 'bagging_temperature': 9.129883582939001}. Best is trial 13 with value: 0.8928571428571429.
[32m[I 2023-04-26 10:39:38,915][39m Trial 163 finished with value: 0.8771929824561403 and parameters: {'objective': 'Logloss', 'colsample_bylevel': 0.05849230413601759, 'depth': 3, 'boosting_type': 'Plain', 'bootstrap_type': 'Bayesian', 'bagging_temperature': 9.503263313152337}. Best is trial 13 with value: 0.8928571428571429.
[32m[I 2023-04-26 10:39:40,530][39m Trial 164 finished with value: 0.8771929824561403 and parameters: {'objective': 'Logloss', 'colsample_bylevel': 0.06079785679007451, 'depth': 3, 'boosting_type': 'Plain', 'bootstrap_type': 'Bayesian', 'bagging_temperature': 9.722696351651656}. Best is trial 13 with value: 0.8928571428571429.
[32m[I 2023-04-26 10:39:42,226][39m Trial 165 finished with value: 0.8771929824561403 and parameters: {'objective': 'Logloss', 'colsample_bylevel': 0.0630564101426909, 'depth': 7, 'boosting_type': 'Plain', 'bootstrap_type': 'Bayesian', 'bagging_temperature': 9.281650760888487}. Best is trial 13 with value: 0.8928571428571429.
[32m[I 2023-04-26 10:39:43,926][39m Trial 166 finished with value: 0.8521739130434783 and parameters: {'objective': 'Logloss', 'colsample_bylevel': 0.06505928672945349, 'depth': 4, 'boosting_type': 'Plain', 'bootstrap_type': 'Bernoulli', 'subsample': 0.5446208402852777}. Best is trial 13 with value: 0.8928571428571429.
[32m[I 2023-04-26 10:39:45,581][39m Trial 167 finished with value: 0.8849557522123893 and parameters: {'objective': 'Logloss', 'colsample_bylevel': 0.06711978268884097, 'depth': 3, 'boosting_type': 'Plain', 'bootstrap_type': 'Bayesian', 'bagging_temperature': 8.781921719503844}. Best is trial 13 with value: 0.8928571428571429.
[32m[I 2023-04-26 10:39:47,170][39m Trial 168 finished with value: 0.8596491228070176 and parameters: {'objective': 'CrossEntropy', 'colsample_bylevel': 0.06711266578310018, 'depth': 2, 'boosting_type': 'Plain', 'bootstrap_type': 'MVS'}. Best is trial 13 with value: 0.8928571428571429.
[32m[I 2023-04-26 10:39:49,374][39m Trial 169 finished with value: 0.8771929824561403 and parameters: {'objective': 'Logloss', 'colsample_bylevel': 0.0687452224922127, 'depth': 8, 'boosting_type': 'Plain', 'bootstrap_type': 'Bayesian', 'bagging_temperature': 8.803548204601064}. Best is trial 13 with value: 0.8928571428571429.
[32m[I 2023-04-26 10:39:50,875][39m Trial 170 finished with value: 0.8849557522123893 and parameters: {'objective': 'Logloss', 'colsample_bylevel': 0.04648525766074829, 'depth': 5, 'boosting_type': 'Plain', 'bootstrap_type': 'Bayesian', 'bagging_temperature': 8.592509280180707}. Best is trial 13 with value: 0.8928571428571429.
[32m[I 2023-04-26 10:39:52,480][39m Trial 171 finished with value: 0.8771929824561403 and parameters: {'objective': 'CrossEntropy', 'colsample_bylevel': 0.06628766310719836, 'depth': 3, 'boosting_type': 'Plain', 'bootstrap_type': 'Bayesian', 'bagging_temperature': 9.055093634603132}. Best is trial 13 with value: 0.8928571428571429.
[32m[I 2023-04-26 10:39:53,859][39m Trial 172 finished with value: 0.8545454545454546 and parameters: {'objective': 'Logloss', 'colsample_bylevel': 0.031934555160878994, 'depth': 5, 'boosting_type': 'Plain', 'bootstrap_type': 'Bayesian', 'bagging_temperature': 8.569404653635203}. Best is trial 13 with value: 0.8928571428571429.
[32m[I 2023-04-26 10:39:55,428][39m Trial 173 finished with value: 0.8849557522123893 and parameters: {'objective': 'Logloss', 'colsample_bylevel': 0.05759156360699945, 'depth': 4, 'boosting_type': 'Plain', 'bootstrap_type': 'Bayesian', 'bagging_temperature': 8.173197655026826}. Best is trial 13 with value: 0.8928571428571429.
[32m[I 2023-04-26 10:39:56,966][39m Trial 174 finished with value: 0.875 and parameters: {'objective': 'Logloss', 'colsample_bylevel': 0.051171547435288955, 'depth': 4, 'boosting_type': 'Plain', 'bootstrap_type': 'Bayesian', 'bagging_temperature': 8.161663304987517}. Best is trial 13 with value: 0.8928571428571429.
[32m[I 2023-04-26 10:39:58,582][39m Trial 175 finished with value: 0.8672566371681416 and parameters: {'objective': 'Logloss', 'colsample_bylevel': 0.050229200887615545, 'depth': 4, 'boosting_type': 'Plain', 'bootstrap_type': 'Bayesian', 'bagging_temperature': 7.175995462401613}. Best is trial 13 with value: 0.8928571428571429.
[32m[I 2023-04-26 10:39:59,790][39m Trial 176 finished with value: 0.8376068376068375 and parameters: {'objective': 'Logloss', 'colsample_bylevel': 0.02883402420380929, 'depth': 3, 'boosting_type': 'Plain', 'bootstrap_type': 'Bayesian', 'bagging_temperature': 9.347230038365367}. Best is trial 13 with value: 0.8928571428571429.
[32m[I 2023-04-26 10:40:01,318][39m Trial 177 finished with value: 0.8849557522123893 and parameters: {'objective': 'Logloss', 'colsample_bylevel': 0.05486608521382348, 'depth': 4, 'boosting_type': 'Plain', 'bootstrap_type': 'Bayesian', 'bagging_temperature': 9.480500720205491}. Best is trial 13 with value: 0.8928571428571429.
[32m[I 2023-04-26 10:40:02,850][39m Trial 178 finished with value: 0.8596491228070176 and parameters: {'objective': 'CrossEntropy', 'colsample_bylevel': 0.052832824833228896, 'depth': 4, 'boosting_type': 'Plain', 'bootstrap_type': 'Bayesian', 'bagging_temperature': 7.64390253997533}. Best is trial 13 with value: 0.8928571428571429.
[32m[I 2023-04-26 10:40:06,377][39m Trial 179 finished with value: 0.8828828828828829 and parameters: {'objective': 'Logloss', 'colsample_bylevel': 0.054004724746126914, 'depth': 4, 'boosting_type': 'Ordered', 'bootstrap_type': 'Bayesian', 'bagging_temperature': 6.75940322894658}. Best is trial 13 with value: 0.8928571428571429.
[32m[I 2023-04-26 10:40:07,968][39m Trial 180 finished with value: 0.875 and parameters: {'objective': 'CrossEntropy', 'colsample_bylevel': 0.055747913120539457, 'depth': 4, 'boosting_type': 'Plain', 'bootstrap_type': 'Bayesian', 'bagging_temperature': 7.907319739642366}. Best is trial 13 with value: 0.8928571428571429.
[32m[I 2023-04-26 10:40:10,059][39m Trial 181 finished with value: 0.8771929824561403 and parameters: {'objective': 'CrossEntropy', 'colsample_bylevel': 0.06162475213587149, 'depth': 8, 'boosting_type': 'Plain', 'bootstrap_type': 'Bayesian', 'bagging_temperature': 8.335026282552985}. Best is trial 13 with value: 0.8928571428571429.
[32m[I 2023-04-26 10:40:11,287][39m Trial 182 finished with value: 0.8448275862068967 and parameters: {'objective': 'CrossEntropy', 'colsample_bylevel': 0.022074813562098117, 'depth': 7, 'boosting_type': 'Plain', 'bootstrap_type': 'Bayesian', 'bagging_temperature': 7.542281022499116}. Best is trial 13 with value: 0.8928571428571429.
[32m[I 2023-04-26 10:40:12,720][39m Trial 183 finished with value: 0.8771929824561403 and parameters: {'objective': 'CrossEntropy', 'colsample_bylevel': 0.053507938143622244, 'depth': 3, 'boosting_type': 'Plain', 'bootstrap_type': 'Bayesian', 'bagging_temperature': 8.072040200693229}. Best is trial 13 with value: 0.8928571428571429.
[32m[I 2023-04-26 10:40:14,292][39m Trial 184 finished with value: 0.8928571428571429 and parameters: {'objective': 'CrossEntropy', 'colsample_bylevel': 0.05708553328517453, 'depth': 4, 'boosting_type': 'Plain', 'bootstrap_type': 'Bayesian', 'bagging_temperature': 8.311046859182122}. Best is trial 13 with value: 0.8928571428571429.
[32m[I 2023-04-26 10:40:15,945][39m Trial 185 finished with value: 0.8672566371681416 and parameters: {'objective': 'CrossEntropy', 'colsample_bylevel': 0.06322767290721924, 'depth': 3, 'boosting_type': 'Plain', 'bootstrap_type': 'Bayesian', 'bagging_temperature': 8.389868441509162}. Best is trial 13 with value: 0.8928571428571429.
[32m[I 2023-04-26 10:40:17,523][39m Trial 186 finished with value: 0.8928571428571429 and parameters: {'objective': 'Logloss', 'colsample_bylevel': 0.04887271891916623, 'depth': 4, 'boosting_type': 'Plain', 'bootstrap_type': 'Bayesian', 'bagging_temperature': 9.628464129280056}. Best is trial 13 with value: 0.8928571428571429.
[32m[I 2023-04-26 10:40:19,034][39m Trial 187 finished with value: 0.8771929824561403 and parameters: {'objective': 'Logloss', 'colsample_bylevel': 0.04785891040548768, 'depth': 5, 'boosting_type': 'Plain', 'bootstrap_type': 'Bayesian', 'bagging_temperature': 9.757007297874368}. Best is trial 13 with value: 0.8928571428571429.
[32m[I 2023-04-26 10:40:20,643][39m Trial 188 finished with value: 0.875 and parameters: {'objective': 'Logloss', 'colsample_bylevel': 0.0592095519606696, 'depth': 4, 'boosting_type': 'Plain', 'bootstrap_type': 'Bayesian', 'bagging_temperature': 9.157851678276494}. Best is trial 13 with value: 0.8928571428571429.
[32m[I 2023-04-26 10:40:22,346][39m Trial 189 finished with value: 0.8771929824561403 and parameters: {'objective': 'CrossEntropy', 'colsample_bylevel': 0.0669677636833716, 'depth': 3, 'boosting_type': 'Plain', 'bootstrap_type': 'Bayesian', 'bagging_temperature': 8.88388722023388}. Best is trial 13 with value: 0.8928571428571429.
[32m[I 2023-04-26 10:40:23,824][39m Trial 190 finished with value: 0.8695652173913043 and parameters: {'objective': 'CrossEntropy', 'colsample_bylevel': 0.046541752500403495, 'depth': 4, 'boosting_type': 'Plain', 'bootstrap_type': 'Bayesian', 'bagging_temperature': 8.769823281691696}. Best is trial 13 with value: 0.8928571428571429.
[32m[I 2023-04-26 10:40:25,940][39m Trial 191 finished with value: 0.875 and parameters: {'objective': 'CrossEntropy', 'colsample_bylevel': 0.05194302193072004, 'depth': 8, 'boosting_type': 'Plain', 'bootstrap_type': 'Bayesian', 'bagging_temperature': 7.851074436051887}. Best is trial 13 with value: 0.8928571428571429.
[32m[I 2023-04-26 10:40:27,561][39m Trial 192 finished with value: 0.8849557522123893 and parameters: {'objective': 'CrossEntropy', 'colsample_bylevel': 0.056058594170006346, 'depth': 4, 'boosting_type': 'Plain', 'bootstrap_type': 'Bayesian', 'bagging_temperature': 8.296736227872064}. Best is trial 13 with value: 0.8928571428571429.
[32m[I 2023-04-26 10:40:29,145][39m Trial 193 finished with value: 0.8695652173913043 and parameters: {'objective': 'CrossEntropy', 'colsample_bylevel': 0.05416923408618626, 'depth': 4, 'boosting_type': 'Plain', 'bootstrap_type': 'Bayesian', 'bagging_temperature': 7.747824969745519}. Best is trial 13 with value: 0.8928571428571429.
[32m[I 2023-04-26 10:40:30,652][39m Trial 194 finished with value: 0.8596491228070176 and parameters: {'objective': 'CrossEntropy', 'colsample_bylevel': 0.04966572501497026, 'depth': 6, 'boosting_type': 'Plain', 'bootstrap_type': 'Bayesian', 'bagging_temperature': 8.578436386632397}. Best is trial 13 with value: 0.8928571428571429.
[32m[I 2023-04-26 10:40:32,092][39m Trial 195 finished with value: 0.8771929824561403 and parameters: {'objective': 'CrossEntropy', 'colsample_bylevel': 0.04324505085129855, 'depth': 5, 'boosting_type': 'Plain', 'bootstrap_type': 'Bayesian', 'bagging_temperature': 8.03599247370247}. Best is trial 13 with value: 0.8928571428571429.
[32m[I 2023-04-26 10:40:33,697][39m Trial 196 finished with value: 0.8849557522123893 and parameters: {'objective': 'Logloss', 'colsample_bylevel': 0.059395351210558285, 'depth': 4, 'boosting_type': 'Plain', 'bootstrap_type': 'Bayesian', 'bagging_temperature': 8.647292093491508}. Best is trial 13 with value: 0.8928571428571429.
[32m[I 2023-04-26 10:40:35,374][39m Trial 197 finished with value: 0.8672566371681416 and parameters: {'objective': 'Logloss', 'colsample_bylevel': 0.06148529851646352, 'depth': 5, 'boosting_type': 'Plain', 'bootstrap_type': 'Bayesian', 'bagging_temperature': 9.003782608947725}. Best is trial 13 with value: 0.8928571428571429.
[32m[I 2023-04-26 10:40:36,916][39m Trial 198 finished with value: 0.8771929824561403 and parameters: {'objective': 'Logloss', 'colsample_bylevel': 0.049322031543883024, 'depth': 5, 'boosting_type': 'Plain', 'bootstrap_type': 'Bayesian', 'bagging_temperature': 7.3966200709190115}. Best is trial 13 with value: 0.8928571428571429.
