[32m[I 2023-04-26 10:49:15,713][39m Trial 463 finished with value: 0.8672566371681416 and parameters: {'objective': 'Logloss', 'colsample_bylevel': 0.05533497436247915, 'depth': 4, 'boosting_type': 'Plain', 'bootstrap_type': 'Bayesian', 'bagging_temperature': 8.98528342185444}. Best is trial 293 with value: 0.8947368421052632.
[32m[I 2023-04-26 10:49:17,329][39m Trial 464 finished with value: 0.8571428571428572 and parameters: {'objective': 'CrossEntropy', 'colsample_bylevel': 0.041371426165749826, 'depth': 8, 'boosting_type': 'Plain', 'bootstrap_type': 'Bayesian', 'bagging_temperature': 9.081539066245044}. Best is trial 293 with value: 0.8947368421052632.
[32m[I 2023-04-26 10:49:18,930][39m Trial 465 finished with value: 0.8695652173913043 and parameters: {'objective': 'Logloss', 'colsample_bylevel': 0.05484134380855279, 'depth': 3, 'boosting_type': 'Plain', 'bootstrap_type': 'Bayesian', 'bagging_temperature': 9.74861445746452}. Best is trial 293 with value: 0.8947368421052632.
[32m[I 2023-04-26 10:49:20,575][39m Trial 466 finished with value: 0.8771929824561403 and parameters: {'objective': 'Logloss', 'colsample_bylevel': 0.05683995314898129, 'depth': 4, 'boosting_type': 'Plain', 'bootstrap_type': 'Bayesian', 'bagging_temperature': 9.490547453287109}. Best is trial 293 with value: 0.8947368421052632.
[32m[I 2023-04-26 10:49:21,979][39m Trial 467 finished with value: 0.875 and parameters: {'objective': 'CrossEntropy', 'colsample_bylevel': 0.03400921068751338, 'depth': 4, 'boosting_type': 'Plain', 'bootstrap_type': 'Bayesian', 'bagging_temperature': 9.476120140639004}. Best is trial 293 with value: 0.8947368421052632.
[32m[I 2023-04-26 10:49:24,412][39m Trial 468 finished with value: 0.875 and parameters: {'objective': 'Logloss', 'colsample_bylevel': 0.07254932402438181, 'depth': 8, 'boosting_type': 'Plain', 'bootstrap_type': 'Bayesian', 'bagging_temperature': 9.49212438533515}. Best is trial 293 with value: 0.8947368421052632.
[32m[I 2023-04-26 10:49:26,148][39m Trial 469 finished with value: 0.8771929824561403 and parameters: {'objective': 'Logloss', 'colsample_bylevel': 0.050542341510981116, 'depth': 5, 'boosting_type': 'Plain', 'bootstrap_type': 'Bayesian', 'bagging_temperature': 9.098594410512048}. Best is trial 293 with value: 0.8947368421052632.
[32m[I 2023-04-26 10:49:27,777][39m Trial 470 finished with value: 0.8771929824561403 and parameters: {'objective': 'Logloss', 'colsample_bylevel': 0.052658836150427726, 'depth': 6, 'boosting_type': 'Plain', 'bootstrap_type': 'Bayesian', 'bagging_temperature': 9.937689500544268}. Best is trial 293 with value: 0.8947368421052632.
[32m[I 2023-04-26 10:49:29,450][39m Trial 471 finished with value: 0.8695652173913043 and parameters: {'objective': 'Logloss', 'colsample_bylevel': 0.045909978530246774, 'depth': 5, 'boosting_type': 'Plain', 'bootstrap_type': 'Bayesian', 'bagging_temperature': 3.7465121191551853}. Best is trial 293 with value: 0.8947368421052632.
[32m[I 2023-04-26 10:49:31,725][39m Trial 472 finished with value: 0.8495575221238938 and parameters: {'objective': 'Logloss', 'colsample_bylevel': 0.09044333392335673, 'depth': 5, 'boosting_type': 'Plain', 'bootstrap_type': 'Bernoulli', 'subsample': 0.49992881261422556}. Best is trial 293 with value: 0.8947368421052632.
[32m[I 2023-04-26 10:49:33,408][39m Trial 473 finished with value: 0.8596491228070176 and parameters: {'objective': 'CrossEntropy', 'colsample_bylevel': 0.0579933211366932, 'depth': 3, 'boosting_type': 'Plain', 'bootstrap_type': 'MVS'}. Best is trial 293 with value: 0.8947368421052632.
[32m[I 2023-04-26 10:49:34,995][39m Trial 474 finished with value: 0.8849557522123893 and parameters: {'objective': 'CrossEntropy', 'colsample_bylevel': 0.05359214633251455, 'depth': 4, 'boosting_type': 'Plain', 'bootstrap_type': 'Bayesian', 'bagging_temperature': 9.246210479603452}. Best is trial 293 with value: 0.8947368421052632.
[32m[I 2023-04-26 10:49:36,497][39m Trial 475 finished with value: 0.8672566371681416 and parameters: {'objective': 'Logloss', 'colsample_bylevel': 0.04798308947551044, 'depth': 4, 'boosting_type': 'Plain', 'bootstrap_type': 'Bayesian', 'bagging_temperature': 8.752009444422459}. Best is trial 293 with value: 0.8947368421052632.
[32m[I 2023-04-26 10:49:38,029][39m Trial 476 finished with value: 0.8849557522123893 and parameters: {'objective': 'Logloss', 'colsample_bylevel': 0.04931210064766349, 'depth': 5, 'boosting_type': 'Plain', 'bootstrap_type': 'Bayesian', 'bagging_temperature': 8.478587097327418}. Best is trial 293 with value: 0.8947368421052632.
[32m[I 2023-04-26 10:49:39,929][39m Trial 477 finished with value: 0.8771929824561403 and parameters: {'objective': 'Logloss', 'colsample_bylevel': 0.06373496111154946, 'depth': 12, 'boosting_type': 'Plain', 'bootstrap_type': 'Bayesian', 'bagging_temperature': 8.846036114630135}. Best is trial 293 with value: 0.8947368421052632.
[32m[I 2023-04-26 10:49:41,542][39m Trial 478 finished with value: 0.8571428571428572 and parameters: {'objective': 'Logloss', 'colsample_bylevel': 0.053413695370171564, 'depth': 4, 'boosting_type': 'Plain', 'bootstrap_type': 'Bayesian', 'bagging_temperature': 5.135672556884841}. Best is trial 293 with value: 0.8947368421052632.
[32m[I 2023-04-26 10:49:43,362][39m Trial 479 finished with value: 0.8771929824561403 and parameters: {'objective': 'Logloss', 'colsample_bylevel': 0.06388328215728928, 'depth': 7, 'boosting_type': 'Plain', 'bootstrap_type': 'Bayesian', 'bagging_temperature': 8.974015075187193}. Best is trial 293 with value: 0.8947368421052632.
[32m[I 2023-04-26 10:49:45,051][39m Trial 480 finished with value: 0.8849557522123893 and parameters: {'objective': 'Logloss', 'colsample_bylevel': 0.05868783462097325, 'depth': 4, 'boosting_type': 'Plain', 'bootstrap_type': 'Bayesian', 'bagging_temperature': 9.262436961187515}. Best is trial 293 with value: 0.8947368421052632.
[32m[I 2023-04-26 10:49:46,882][39m Trial 481 finished with value: 0.8672566371681416 and parameters: {'objective': 'Logloss', 'colsample_bylevel': 0.06753702592478905, 'depth': 6, 'boosting_type': 'Plain', 'bootstrap_type': 'Bayesian', 'bagging_temperature': 9.276534779646076}. Best is trial 293 with value: 0.8947368421052632.
[32m[I 2023-04-26 10:49:48,510][39m Trial 482 finished with value: 0.8545454545454546 and parameters: {'objective': 'Logloss', 'colsample_bylevel': 0.05111701557895465, 'depth': 4, 'boosting_type': 'Plain', 'bootstrap_type': 'Bayesian', 'bagging_temperature': 8.815984780218288}. Best is trial 293 with value: 0.8947368421052632.
[32m[I 2023-04-26 10:49:50,140][39m Trial 483 finished with value: 0.8828828828828829 and parameters: {'objective': 'Logloss', 'colsample_bylevel': 0.05660362150180803, 'depth': 3, 'boosting_type': 'Plain', 'bootstrap_type': 'Bayesian', 'bagging_temperature': 9.850170277699048}. Best is trial 293 with value: 0.8947368421052632.
[32m[I 2023-04-26 10:49:51,704][39m Trial 484 finished with value: 0.8571428571428572 and parameters: {'objective': 'Logloss', 'colsample_bylevel': 0.04630664884683609, 'depth': 4, 'boosting_type': 'Plain', 'bootstrap_type': 'Bayesian', 'bagging_temperature': 2.6510633041107488}. Best is trial 293 with value: 0.8947368421052632.
[32m[I 2023-04-26 10:49:53,632][39m Trial 485 finished with value: 0.8771929824561403 and parameters: {'objective': 'Logloss', 'colsample_bylevel': 0.0607131853160857, 'depth': 8, 'boosting_type': 'Plain', 'bootstrap_type': 'Bayesian', 'bagging_temperature': 7.113133856843334}. Best is trial 293 with value: 0.8947368421052632.
[32m[I 2023-04-26 10:49:55,132][39m Trial 486 finished with value: 0.8928571428571429 and parameters: {'objective': 'Logloss', 'colsample_bylevel': 0.04771727556004529, 'depth': 4, 'boosting_type': 'Plain', 'bootstrap_type': 'Bayesian', 'bagging_temperature': 9.663759925375562}. Best is trial 293 with value: 0.8947368421052632.
[32m[I 2023-04-26 10:49:56,699][39m Trial 487 finished with value: 0.8695652173913043 and parameters: {'objective': 'Logloss', 'colsample_bylevel': 0.061042610329448695, 'depth': 4, 'boosting_type': 'Plain', 'bootstrap_type': 'Bayesian', 'bagging_temperature': 9.99176156794577}. Best is trial 293 with value: 0.8947368421052632.
[32m[I 2023-04-26 10:50:00,829][39m Trial 488 finished with value: 0.8620689655172413 and parameters: {'objective': 'Logloss', 'colsample_bylevel': 0.07604724416969195, 'depth': 7, 'boosting_type': 'Ordered', 'bootstrap_type': 'Bayesian', 'bagging_temperature': 9.545946072625421}. Best is trial 293 with value: 0.8947368421052632.
[32m[I 2023-04-26 10:50:02,387][39m Trial 489 finished with value: 0.8828828828828829 and parameters: {'objective': 'Logloss', 'colsample_bylevel': 0.04928422974218963, 'depth': 4, 'boosting_type': 'Plain', 'bootstrap_type': 'Bayesian', 'bagging_temperature': 5.423567843863975}. Best is trial 293 with value: 0.8947368421052632.
[32m[I 2023-04-26 10:50:04,451][39m Trial 490 finished with value: 0.8771929824561403 and parameters: {'objective': 'Logloss', 'colsample_bylevel': 0.0817803039241217, 'depth': 4, 'boosting_type': 'Plain', 'bootstrap_type': 'Bayesian', 'bagging_temperature': 9.66575897511581}. Best is trial 293 with value: 0.8947368421052632.
[32m[I 2023-04-26 10:50:05,710][39m Trial 491 finished with value: 0.8347826086956522 and parameters: {'objective': 'Logloss', 'colsample_bylevel': 0.02365627347157502, 'depth': 4, 'boosting_type': 'Plain', 'bootstrap_type': 'Bayesian', 'bagging_temperature': 9.969168705753939}. Best is trial 293 with value: 0.8947368421052632.
[32m[I 2023-04-26 10:50:09,781][39m Trial 492 finished with value: 0.8771929824561403 and parameters: {'objective': 'Logloss', 'colsample_bylevel': 0.07841551638025931, 'depth': 4, 'boosting_type': 'Ordered', 'bootstrap_type': 'Bayesian', 'bagging_temperature': 9.697717484224507}. Best is trial 293 with value: 0.8947368421052632.
[32m[I 2023-04-26 10:50:11,396][39m Trial 493 finished with value: 0.8695652173913043 and parameters: {'objective': 'CrossEntropy', 'colsample_bylevel': 0.059651574841429016, 'depth': 2, 'boosting_type': 'Plain', 'bootstrap_type': 'Bernoulli', 'subsample': 0.37269036934902755}. Best is trial 293 with value: 0.8947368421052632.
[32m[I 2023-04-26 10:50:13,507][39m Trial 494 finished with value: 0.8672566371681416 and parameters: {'objective': 'Logloss', 'colsample_bylevel': 0.0862862169968477, 'depth': 4, 'boosting_type': 'Plain', 'bootstrap_type': 'Bayesian', 'bagging_temperature': 9.180058772463891}. Best is trial 293 with value: 0.8947368421052632.
[32m[I 2023-04-26 10:50:15,341][39m Trial 495 finished with value: 0.875 and parameters: {'objective': 'Logloss', 'colsample_bylevel': 0.0526191047867334, 'depth': 8, 'boosting_type': 'Plain', 'bootstrap_type': 'Bayesian', 'bagging_temperature': 6.090282936384065}. Best is trial 293 with value: 0.8947368421052632.
[32m[I 2023-04-26 10:50:17,459][39m Trial 496 finished with value: 0.8421052631578947 and parameters: {'objective': 'CrossEntropy', 'colsample_bylevel': 0.07099314321978015, 'depth': 8, 'boosting_type': 'Plain', 'bootstrap_type': 'MVS'}. Best is trial 293 with value: 0.8947368421052632.
[32m[I 2023-04-26 10:50:19,368][39m Trial 497 finished with value: 0.8596491228070176 and parameters: {'objective': 'Logloss', 'colsample_bylevel': 0.04657553034800456, 'depth': 9, 'boosting_type': 'Plain', 'bootstrap_type': 'Bayesian', 'bagging_temperature': 1.4544401501414264}. Best is trial 293 with value: 0.8947368421052632.
[32m[I 2023-04-26 10:50:20,922][39m Trial 498 finished with value: 0.8849557522123893 and parameters: {'objective': 'Logloss', 'colsample_bylevel': 0.05564251663783332, 'depth': 4, 'boosting_type': 'Plain', 'bootstrap_type': 'Bayesian', 'bagging_temperature': 7.358950225232354}. Best is trial 293 with value: 0.8947368421052632.
[32m[I 2023-04-26 10:50:22,354][39m Trial 499 finished with value: 0.8695652173913043 and parameters: {'objective': 'Logloss', 'colsample_bylevel': 0.04234552453479742, 'depth': 4, 'boosting_type': 'Plain', 'bootstrap_type': 'Bayesian', 'bagging_temperature': 9.432593757273628}. Best is trial 293 with value: 0.8947368421052632.
Number of finished trials: 500