[32m[I 2023-04-26 10:47:07,528][39m Trial 397 finished with value: 0.8849557522123893 and parameters: {'objective': 'CrossEntropy', 'colsample_bylevel': 0.053474160571782135, 'depth': 4, 'boosting_type': 'Plain', 'bootstrap_type': 'Bayesian', 'bagging_temperature': 5.060419553192541}. Best is trial 293 with value: 0.8947368421052632.
[32m[I 2023-04-26 10:47:09,167][39m Trial 398 finished with value: 0.8793103448275863 and parameters: {'objective': 'Logloss', 'colsample_bylevel': 0.06141923565381711, 'depth': 4, 'boosting_type': 'Plain', 'bootstrap_type': 'Bayesian', 'bagging_temperature': 8.981928989514774}. Best is trial 293 with value: 0.8947368421052632.
[32m[I 2023-04-26 10:47:10,829][39m Trial 399 finished with value: 0.8672566371681416 and parameters: {'objective': 'Logloss', 'colsample_bylevel': 0.05094997446008653, 'depth': 7, 'boosting_type': 'Plain', 'bootstrap_type': 'Bayesian', 'bagging_temperature': 4.526009717086304}. Best is trial 293 with value: 0.8947368421052632.
[32m[I 2023-04-26 10:47:12,425][39m Trial 400 finished with value: 0.8771929824561403 and parameters: {'objective': 'CrossEntropy', 'colsample_bylevel': 0.04859237575286336, 'depth': 5, 'boosting_type': 'Plain', 'bootstrap_type': 'Bayesian', 'bagging_temperature': 9.280811867761924}. Best is trial 293 with value: 0.8947368421052632.
[32m[I 2023-04-26 10:47:14,047][39m Trial 401 finished with value: 0.8771929824561403 and parameters: {'objective': 'CrossEntropy', 'colsample_bylevel': 0.05479908845926919, 'depth': 7, 'boosting_type': 'Plain', 'bootstrap_type': 'Bayesian', 'bagging_temperature': 6.275190005475973}. Best is trial 293 with value: 0.8947368421052632.
[32m[I 2023-04-26 10:47:15,729][39m Trial 402 finished with value: 0.8521739130434783 and parameters: {'objective': 'CrossEntropy', 'colsample_bylevel': 0.056911773045471896, 'depth': 4, 'boosting_type': 'Plain', 'bootstrap_type': 'Bernoulli', 'subsample': 0.40789464111591356}. Best is trial 293 with value: 0.8947368421052632.
[32m[I 2023-04-26 10:47:17,331][39m Trial 403 finished with value: 0.8869565217391304 and parameters: {'objective': 'Logloss', 'colsample_bylevel': 0.05978067347574017, 'depth': 4, 'boosting_type': 'Plain', 'bootstrap_type': 'Bayesian', 'bagging_temperature': 9.369936353236627}. Best is trial 293 with value: 0.8947368421052632.
[32m[I 2023-04-26 10:47:18,927][39m Trial 404 finished with value: 0.8928571428571429 and parameters: {'objective': 'Logloss', 'colsample_bylevel': 0.06037455591623088, 'depth': 4, 'boosting_type': 'Plain', 'bootstrap_type': 'Bayesian', 'bagging_temperature': 9.18041425917611}. Best is trial 293 with value: 0.8947368421052632.
[32m[I 2023-04-26 10:47:20,605][39m Trial 405 finished with value: 0.8672566371681416 and parameters: {'objective': 'Logloss', 'colsample_bylevel': 0.05195869419868181, 'depth': 6, 'boosting_type': 'Plain', 'bootstrap_type': 'Bayesian', 'bagging_temperature': 7.430102030812329}. Best is trial 293 with value: 0.8947368421052632.
[32m[I 2023-04-26 10:47:22,263][39m Trial 406 finished with value: 0.8672566371681416 and parameters: {'objective': 'Logloss', 'colsample_bylevel': 0.04887868238074981, 'depth': 4, 'boosting_type': 'Plain', 'bootstrap_type': 'MVS'}. Best is trial 293 with value: 0.8947368421052632.
[32m[I 2023-04-26 10:47:23,611][39m Trial 407 finished with value: 0.8392857142857144 and parameters: {'objective': 'Logloss', 'colsample_bylevel': 0.060185796373074696, 'depth': 1, 'boosting_type': 'Plain', 'bootstrap_type': 'Bayesian', 'bagging_temperature': 8.55300517863997}. Best is trial 293 with value: 0.8947368421052632.
[32m[I 2023-04-26 10:47:25,219][39m Trial 408 finished with value: 0.8771929824561403 and parameters: {'objective': 'Logloss', 'colsample_bylevel': 0.05935268637469818, 'depth': 4, 'boosting_type': 'Plain', 'bootstrap_type': 'Bayesian', 'bagging_temperature': 8.93031768354011}. Best is trial 293 with value: 0.8947368421052632.
[32m[I 2023-04-26 10:47:26,805][39m Trial 409 finished with value: 0.8596491228070176 and parameters: {'objective': 'Logloss', 'colsample_bylevel': 0.05835846344881042, 'depth': 4, 'boosting_type': 'Plain', 'bootstrap_type': 'Bayesian', 'bagging_temperature': 9.922961562246416}. Best is trial 293 with value: 0.8947368421052632.
[32m[I 2023-04-26 10:47:28,340][39m Trial 410 finished with value: 0.8695652173913043 and parameters: {'objective': 'CrossEntropy', 'colsample_bylevel': 0.056971403237585254, 'depth': 3, 'boosting_type': 'Plain', 'bootstrap_type': 'Bayesian', 'bagging_temperature': 9.325874075133271}. Best is trial 293 with value: 0.8947368421052632.
[32m[I 2023-04-26 10:47:30,074][39m Trial 411 finished with value: 0.8771929824561403 and parameters: {'objective': 'Logloss', 'colsample_bylevel': 0.061485497308216654, 'depth': 4, 'boosting_type': 'Plain', 'bootstrap_type': 'Bayesian', 'bagging_temperature': 7.935478291340014}. Best is trial 293 with value: 0.8947368421052632.
[32m[I 2023-04-26 10:47:32,216][39m Trial 412 finished with value: 0.8849557522123893 and parameters: {'objective': 'Logloss', 'colsample_bylevel': 0.08483387185008301, 'depth': 5, 'boosting_type': 'Plain', 'bootstrap_type': 'Bayesian', 'bagging_temperature': 9.151117282495735}. Best is trial 293 with value: 0.8947368421052632.
[32m[I 2023-04-26 10:47:36,373][39m Trial 413 finished with value: 0.875 and parameters: {'objective': 'CrossEntropy', 'colsample_bylevel': 0.0840326403788461, 'depth': 4, 'boosting_type': 'Ordered', 'bootstrap_type': 'Bayesian', 'bagging_temperature': 9.128749096104475}. Best is trial 293 with value: 0.8947368421052632.
[32m[I 2023-04-26 10:47:38,371][39m Trial 414 finished with value: 0.8771929824561403 and parameters: {'objective': 'Logloss', 'colsample_bylevel': 0.05008816776705453, 'depth': 9, 'boosting_type': 'Plain', 'bootstrap_type': 'Bayesian', 'bagging_temperature': 8.882830409802434}. Best is trial 293 with value: 0.8947368421052632.
[32m[I 2023-04-26 10:47:39,968][39m Trial 415 finished with value: 0.8695652173913043 and parameters: {'objective': 'Logloss', 'colsample_bylevel': 0.06313075402228348, 'depth': 3, 'boosting_type': 'Plain', 'bootstrap_type': 'Bayesian', 'bagging_temperature': 9.601352480544326}. Best is trial 293 with value: 0.8947368421052632.
[32m[I 2023-04-26 10:47:41,523][39m Trial 416 finished with value: 0.8771929824561403 and parameters: {'objective': 'Logloss', 'colsample_bylevel': 0.05475558014921682, 'depth': 3, 'boosting_type': 'Plain', 'bootstrap_type': 'Bayesian', 'bagging_temperature': 9.375878311636043}. Best is trial 293 with value: 0.8947368421052632.
[32m[I 2023-04-26 10:47:43,513][39m Trial 417 finished with value: 0.8695652173913043 and parameters: {'objective': 'Logloss', 'colsample_bylevel': 0.06223169888208931, 'depth': 8, 'boosting_type': 'Plain', 'bootstrap_type': 'Bayesian', 'bagging_temperature': 9.11897380636435}. Best is trial 293 with value: 0.8947368421052632.
[32m[I 2023-04-26 10:47:45,204][39m Trial 418 finished with value: 0.8947368421052632 and parameters: {'objective': 'Logloss', 'colsample_bylevel': 0.05975334764498087, 'depth': 4, 'boosting_type': 'Plain', 'bootstrap_type': 'Bayesian', 'bagging_temperature': 9.373386482141795}. Best is trial 293 with value: 0.8947368421052632.
[32m[I 2023-04-26 10:47:47,173][39m Trial 419 finished with value: 0.875 and parameters: {'objective': 'Logloss', 'colsample_bylevel': 0.09246808277898441, 'depth': 4, 'boosting_type': 'Plain', 'bootstrap_type': 'Bayesian', 'bagging_temperature': 9.453531757128292}. Best is trial 293 with value: 0.8947368421052632.
[32m[I 2023-04-26 10:47:48,775][39m Trial 420 finished with value: 0.8771929824561403 and parameters: {'objective': 'CrossEntropy', 'colsample_bylevel': 0.05740649650392501, 'depth': 3, 'boosting_type': 'Plain', 'bootstrap_type': 'Bayesian', 'bagging_temperature': 9.359010223142217}. Best is trial 293 with value: 0.8947368421052632.
[32m[I 2023-04-26 10:47:50,471][39m Trial 421 finished with value: 0.8695652173913043 and parameters: {'objective': 'CrossEntropy', 'colsample_bylevel': 0.05947410330194795, 'depth': 4, 'boosting_type': 'Plain', 'bootstrap_type': 'Bayesian', 'bagging_temperature': 7.517984729944222}. Best is trial 293 with value: 0.8947368421052632.
[32m[I 2023-04-26 10:47:54,036][39m Trial 422 finished with value: 0.8571428571428572 and parameters: {'objective': 'Logloss', 'colsample_bylevel': 0.06015163518813266, 'depth': 3, 'boosting_type': 'Ordered', 'bootstrap_type': 'Bayesian', 'bagging_temperature': 9.784197888258879}. Best is trial 293 with value: 0.8947368421052632.
[32m[I 2023-04-26 10:47:55,789][39m Trial 423 finished with value: 0.8869565217391304 and parameters: {'objective': 'Logloss', 'colsample_bylevel': 0.06084756320879524, 'depth': 4, 'boosting_type': 'Plain', 'bootstrap_type': 'Bayesian', 'bagging_temperature': 9.246464426661033}. Best is trial 293 with value: 0.8947368421052632.
[32m[I 2023-04-26 10:47:57,130][39m Trial 424 finished with value: 0.8495575221238938 and parameters: {'objective': 'Logloss', 'colsample_bylevel': 0.027430105900415967, 'depth': 3, 'boosting_type': 'Plain', 'bootstrap_type': 'Bayesian', 'bagging_temperature': 9.503004498953525}. Best is trial 293 with value: 0.8947368421052632.
[32m[I 2023-04-26 10:48:00,762][39m Trial 425 finished with value: 0.8771929824561403 and parameters: {'objective': 'Logloss', 'colsample_bylevel': 0.06225352270141279, 'depth': 4, 'boosting_type': 'Ordered', 'bootstrap_type': 'Bayesian', 'bagging_temperature': 5.552471833926582}. Best is trial 293 with value: 0.8947368421052632.
[32m[I 2023-04-26 10:48:02,464][39m Trial 426 finished with value: 0.8771929824561403 and parameters: {'objective': 'Logloss', 'colsample_bylevel': 0.06083843918119569, 'depth': 3, 'boosting_type': 'Plain', 'bootstrap_type': 'Bayesian', 'bagging_temperature': 9.223505282908334}. Best is trial 293 with value: 0.8947368421052632.
[32m[I 2023-04-26 10:48:04,126][39m Trial 427 finished with value: 0.8521739130434783 and parameters: {'objective': 'CrossEntropy', 'colsample_bylevel': 0.05834403307902937, 'depth': 3, 'boosting_type': 'Plain', 'bootstrap_type': 'Bernoulli', 'subsample': 0.5746525047515975}. Best is trial 293 with value: 0.8947368421052632.
[32m[I 2023-04-26 10:48:05,764][39m Trial 428 finished with value: 0.8695652173913043 and parameters: {'objective': 'Logloss', 'colsample_bylevel': 0.057546258291054794, 'depth': 4, 'boosting_type': 'Plain', 'bootstrap_type': 'Bayesian', 'bagging_temperature': 9.59172716580586}. Best is trial 293 with value: 0.8947368421052632.
[32m[I 2023-04-26 10:48:07,394][39m Trial 429 finished with value: 0.8571428571428572 and parameters: {'objective': 'CrossEntropy', 'colsample_bylevel': 0.0591887450791702, 'depth': 4, 'boosting_type': 'Plain', 'bootstrap_type': 'Bayesian', 'bagging_temperature': 9.853124016599702}. Best is trial 293 with value: 0.8947368421052632.
[32m[I 2023-04-26 10:48:11,038][39m Trial 430 finished with value: 0.8521739130434783 and parameters: {'objective': 'Logloss', 'colsample_bylevel': 0.06020620397397762, 'depth': 4, 'boosting_type': 'Ordered', 'bootstrap_type': 'MVS'}. Best is trial 293 with value: 0.8947368421052632.
[32m[I 2023-04-26 10:48:12,840][39m Trial 431 finished with value: 0.8620689655172413 and parameters: {'objective': 'Logloss', 'colsample_bylevel': 0.06311705775513415, 'depth': 4, 'boosting_type': 'Plain', 'bootstrap_type': 'Bayesian', 'bagging_temperature': 5.0759432092211085}. Best is trial 293 with value: 0.8947368421052632.
[32m[I 2023-04-26 10:48:14,495][39m Trial 432 finished with value: 0.8695652173913043 and parameters: {'objective': 'Logloss', 'colsample_bylevel': 0.06297338862436024, 'depth': 4, 'boosting_type': 'Plain', 'bootstrap_type': 'Bayesian', 'bagging_temperature': 9.387873196912738}. Best is trial 293 with value: 0.8947368421052632.
[32m[I 2023-04-26 10:48:16,138][39m Trial 433 finished with value: 0.8771929824561403 and parameters: {'objective': 'Logloss', 'colsample_bylevel': 0.06059016104535229, 'depth': 3, 'boosting_type': 'Plain', 'bootstrap_type': 'Bayesian', 'bagging_temperature': 9.561483168168358}. Best is trial 293 with value: 0.8947368421052632.
[32m[I 2023-04-26 10:48:19,907][39m Trial 434 finished with value: 0.8771929824561403 and parameters: {'objective': 'Logloss', 'colsample_bylevel': 0.05868131643403375, 'depth': 7, 'boosting_type': 'Ordered', 'bootstrap_type': 'Bayesian', 'bagging_temperature': 9.139135750538978}. Best is trial 293 with value: 0.8947368421052632.
[32m[I 2023-04-26 10:48:21,531][39m Trial 435 finished with value: 0.8695652173913043 and parameters: {'objective': 'Logloss', 'colsample_bylevel': 0.05571645003575224, 'depth': 5, 'boosting_type': 'Plain', 'bootstrap_type': 'Bayesian', 'bagging_temperature': 7.156437581420551}. Best is trial 293 with value: 0.8947368421052632.
[32m[I 2023-04-26 10:48:23,398][39m Trial 436 finished with value: 0.8849557522123893 and parameters: {'objective': 'Logloss', 'colsample_bylevel': 0.0757063068253444, 'depth': 3, 'boosting_type': 'Plain', 'bootstrap_type': 'Bayesian', 'bagging_temperature': 9.80145770530435}. Best is trial 293 with value: 0.8947368421052632.
[32m[I 2023-04-26 10:48:27,202][39m Trial 437 finished with value: 0.8672566371681416 and parameters: {'objective': 'Logloss', 'colsample_bylevel': 0.061641278341177407, 'depth': 4, 'boosting_type': 'Ordered', 'bootstrap_type': 'Bayesian', 'bagging_temperature': 9.027933753086602}. Best is trial 293 with value: 0.8947368421052632.
[32m[I 2023-04-26 10:48:28,700][39m Trial 438 finished with value: 0.8545454545454546 and parameters: {'objective': 'Logloss', 'colsample_bylevel': 0.037269785763755336, 'depth': 4, 'boosting_type': 'Plain', 'bootstrap_type': 'Bayesian', 'bagging_temperature': 8.697169354219898}. Best is trial 293 with value: 0.8947368421052632.
[32m[I 2023-04-26 10:48:30,395][39m Trial 439 finished with value: 0.8849557522123893 and parameters: {'objective': 'Logloss', 'colsample_bylevel': 0.06315650555921605, 'depth': 4, 'boosting_type': 'Plain', 'bootstrap_type': 'Bayesian', 'bagging_temperature': 4.698020360587969}. Best is trial 293 with value: 0.8947368421052632.
[32m[I 2023-04-26 10:48:32,055][39m Trial 440 finished with value: 0.8771929824561403 and parameters: {'objective': 'Logloss', 'colsample_bylevel': 0.0564028094646285, 'depth': 4, 'boosting_type': 'Plain', 'bootstrap_type': 'Bayesian', 'bagging_temperature': 8.884396173046692}. Best is trial 293 with value: 0.8947368421052632.
[32m[I 2023-04-26 10:48:33,682][39m Trial 441 finished with value: 0.8771929824561403 and parameters: {'objective': 'Logloss', 'colsample_bylevel': 0.05396100710046306, 'depth': 4, 'boosting_type': 'Plain', 'bootstrap_type': 'Bayesian', 'bagging_temperature': 5.281804842749334}. Best is trial 293 with value: 0.8947368421052632.
[32m[I 2023-04-26 10:48:36,511][39m Trial 442 finished with value: 0.8771929824561403 and parameters: {'objective': 'Logloss', 'colsample_bylevel': 0.07458588718501587, 'depth': 8, 'boosting_type': 'Plain', 'bootstrap_type': 'Bayesian', 'bagging_temperature': 8.490401634079692}. Best is trial 293 with value: 0.8947368421052632.
[32m[I 2023-04-26 10:48:38,122][39m Trial 443 finished with value: 0.8771929824561403 and parameters: {'objective': 'Logloss', 'colsample_bylevel': 0.06126644830633753, 'depth': 4, 'boosting_type': 'Plain', 'bootstrap_type': 'Bayesian', 'bagging_temperature': 9.170888340888009}. Best is trial 293 with value: 0.8947368421052632.
[32m[I 2023-04-26 10:48:41,844][39m Trial 444 finished with value: 0.875 and parameters: {'objective': 'Logloss', 'colsample_bylevel': 0.06232312831998873, 'depth': 8, 'boosting_type': 'Ordered', 'bootstrap_type': 'Bayesian', 'bagging_temperature': 9.336183708672396}. Best is trial 293 with value: 0.8947368421052632.
[32m[I 2023-04-26 10:48:43,518][39m Trial 445 finished with value: 0.8849557522123893 and parameters: {'objective': 'Logloss', 'colsample_bylevel': 0.05652226957696902, 'depth': 4, 'boosting_type': 'Plain', 'bootstrap_type': 'Bayesian', 'bagging_temperature': 6.552805752658469}. Best is trial 293 with value: 0.8947368421052632.
[32m[I 2023-04-26 10:48:45,123][39m Trial 446 finished with value: 0.8596491228070176 and parameters: {'objective': 'Logloss', 'colsample_bylevel': 0.0590401825770975, 'depth': 2, 'boosting_type': 'Plain', 'bootstrap_type': 'Bayesian', 'bagging_temperature': 9.362153956708466}. Best is trial 293 with value: 0.8947368421052632.
[32m[I 2023-04-26 10:48:46,846][39m Trial 447 finished with value: 0.8672566371681416 and parameters: {'objective': 'Logloss', 'colsample_bylevel': 0.07942797219414498, 'depth': 2, 'boosting_type': 'Plain', 'bootstrap_type': 'Bayesian', 'bagging_temperature': 8.72280246539704}. Best is trial 293 with value: 0.8947368421052632.
[32m[I 2023-04-26 10:48:48,775][39m Trial 448 finished with value: 0.8849557522123893 and parameters: {'objective': 'Logloss', 'colsample_bylevel': 0.059928384980999734, 'depth': 8, 'boosting_type': 'Plain', 'bootstrap_type': 'Bayesian', 'bagging_temperature': 9.671120929976293}. Best is trial 293 with value: 0.8947368421052632.
[32m[I 2023-04-26 10:48:50,383][39m Trial 449 finished with value: 0.8672566371681416 and parameters: {'objective': 'Logloss', 'colsample_bylevel': 0.058678654456866826, 'depth': 4, 'boosting_type': 'Plain', 'bootstrap_type': 'Bayesian', 'bagging_temperature': 8.979599176161203}. Best is trial 293 with value: 0.8947368421052632.
[32m[I 2023-04-26 10:48:51,997][39m Trial 450 finished with value: 0.8849557522123893 and parameters: {'objective': 'Logloss', 'colsample_bylevel': 0.057088314895475216, 'depth': 4, 'boosting_type': 'Plain', 'bootstrap_type': 'Bayesian', 'bagging_temperature': 9.294622348525175}. Best is trial 293 with value: 0.8947368421052632.
[32m[I 2023-04-26 10:48:53,591][39m Trial 451 finished with value: 0.8596491228070176 and parameters: {'objective': 'CrossEntropy', 'colsample_bylevel': 0.05205921489324783, 'depth': 3, 'boosting_type': 'Plain', 'bootstrap_type': 'Bernoulli', 'subsample': 0.882132501212834}. Best is trial 293 with value: 0.8947368421052632.
[32m[I 2023-04-26 10:48:55,086][39m Trial 452 finished with value: 0.8695652173913043 and parameters: {'objective': 'Logloss', 'colsample_bylevel': 0.04774602554661373, 'depth': 5, 'boosting_type': 'Plain', 'bootstrap_type': 'Bayesian', 'bagging_temperature': 9.220183891482355}. Best is trial 293 with value: 0.8947368421052632.
[32m[I 2023-04-26 10:48:56,659][39m Trial 453 finished with value: 0.8695652173913043 and parameters: {'objective': 'Logloss', 'colsample_bylevel': 0.06038779303372724, 'depth': 4, 'boosting_type': 'Plain', 'bootstrap_type': 'Bayesian', 'bagging_temperature': 5.629584742367648}. Best is trial 293 with value: 0.8947368421052632.
[32m[I 2023-04-26 10:48:58,424][39m Trial 454 finished with value: 0.8672566371681416 and parameters: {'objective': 'Logloss', 'colsample_bylevel': 0.06460067538271727, 'depth': 4, 'boosting_type': 'Plain', 'bootstrap_type': 'MVS'}. Best is trial 293 with value: 0.8947368421052632.
[32m[I 2023-04-26 10:49:00,184][39m Trial 455 finished with value: 0.875 and parameters: {'objective': 'Logloss', 'colsample_bylevel': 0.06345814610561344, 'depth': 11, 'boosting_type': 'Plain', 'bootstrap_type': 'Bayesian', 'bagging_temperature': 9.49143737483657}. Best is trial 293 with value: 0.8947368421052632.
[32m[I 2023-04-26 10:49:03,570][39m Trial 456 finished with value: 0.8596491228070176 and parameters: {'objective': 'CrossEntropy', 'colsample_bylevel': 0.04409409616923177, 'depth': 8, 'boosting_type': 'Ordered', 'bootstrap_type': 'Bayesian', 'bagging_temperature': 6.576258397091243}. Best is trial 293 with value: 0.8947368421052632.
[32m[I 2023-04-26 10:49:05,985][39m Trial 457 finished with value: 0.8771929824561403 and parameters: {'objective': 'Logloss', 'colsample_bylevel': 0.059262850042925655, 'depth': 9, 'boosting_type': 'Plain', 'bootstrap_type': 'Bayesian', 'bagging_temperature': 8.896145639198759}. Best is trial 293 with value: 0.8947368421052632.
[32m[I 2023-04-26 10:49:07,590][39m Trial 458 finished with value: 0.8771929824561403 and parameters: {'objective': 'Logloss', 'colsample_bylevel': 0.06183092500188174, 'depth': 4, 'boosting_type': 'Plain', 'bootstrap_type': 'Bayesian', 'bagging_temperature': 8.954907538619457}. Best is trial 293 with value: 0.8947368421052632.
[32m[I 2023-04-26 10:49:09,286][39m Trial 459 finished with value: 0.8849557522123893 and parameters: {'objective': 'CrossEntropy', 'colsample_bylevel': 0.06558917352107903, 'depth': 3, 'boosting_type': 'Plain', 'bootstrap_type': 'Bayesian', 'bagging_temperature': 8.640124570004698}. Best is trial 293 with value: 0.8947368421052632.
[32m[I 2023-04-26 10:49:10,624][39m Trial 460 finished with value: 0.8495575221238938 and parameters: {'objective': 'Logloss', 'colsample_bylevel': 0.033643642934463126, 'depth': 4, 'boosting_type': 'Plain', 'bootstrap_type': 'Bayesian', 'bagging_temperature': 4.8116573521589725}. Best is trial 293 with value: 0.8947368421052632.
[32m[I 2023-04-26 10:49:12,389][39m Trial 461 finished with value: 0.8672566371681416 and parameters: {'objective': 'Logloss', 'colsample_bylevel': 0.05548778512397215, 'depth': 4, 'boosting_type': 'Plain', 'bootstrap_type': 'Bayesian', 'bagging_temperature': 9.678196512224565}. Best is trial 293 with value: 0.8947368421052632.
[32m[I 2023-04-26 10:49:14,047][39m Trial 462 finished with value: 0.8771929824561403 and parameters: {'objective': 'Logloss', 'colsample_bylevel': 0.05735544675332182, 'depth': 4, 'boosting_type': 'Plain', 'bootstrap_type': 'Bayesian', 'bagging_temperature': 8.273426390944003}. Best is trial 293 with value: 0.8947368421052632.
