
[32m[I 2023-04-26 10:34:21,933][39m A new study created in memory with name: no-name-cd4cd1a7-8ad2-4c28-a91f-b80b03a6d190
[32m[I 2023-04-26 10:34:25,828][39m Trial 0 finished with value: 0.8672566371681416 and parameters: {'objective': 'CrossEntropy', 'colsample_bylevel': 0.07401247376817746, 'depth': 11, 'boosting_type': 'Ordered', 'bootstrap_type': 'MVS'}. Best is trial 0 with value: 0.8672566371681416.
[32m[I 2023-04-26 10:34:29,656][39m Trial 1 finished with value: 0.8521739130434783 and parameters: {'objective': 'Logloss', 'colsample_bylevel': 0.04697258909002541, 'depth': 3, 'boosting_type': 'Ordered', 'bootstrap_type': 'Bernoulli', 'subsample': 0.34013027144065244}. Best is trial 0 with value: 0.8672566371681416.
[32m[I 2023-04-26 10:34:33,105][39m Trial 2 finished with value: 0.8376068376068375 and parameters: {'objective': 'CrossEntropy', 'colsample_bylevel': 0.02379072009694124, 'depth': 3, 'boosting_type': 'Ordered', 'bootstrap_type': 'MVS'}. Best is trial 0 with value: 0.8672566371681416.
[32m[I 2023-04-26 10:34:34,612][39m Trial 3 finished with value: 0.8695652173913043 and parameters: {'objective': 'Logloss', 'colsample_bylevel': 0.04196191972937243, 'depth': 10, 'boosting_type': 'Plain', 'bootstrap_type': 'Bernoulli', 'subsample': 0.5503155139059855}. Best is trial 3 with value: 0.8695652173913043.
[32m[I 2023-04-26 10:34:38,899][39m Trial 4 finished with value: 0.8596491228070176 and parameters: {'objective': 'CrossEntropy', 'colsample_bylevel': 0.059080291049911, 'depth': 11, 'boosting_type': 'Ordered', 'bootstrap_type': 'Bernoulli', 'subsample': 0.691359859781208}. Best is trial 3 with value: 0.8695652173913043.
[32m[I 2023-04-26 10:34:42,286][39m Trial 5 finished with value: 0.8275862068965517 and parameters: {'objective': 'CrossEntropy', 'colsample_bylevel': 0.018199097360606237, 'depth': 12, 'boosting_type': 'Ordered', 'bootstrap_type': 'MVS'}. Best is trial 3 with value: 0.8695652173913043.
[32m[I 2023-04-26 10:34:43,851][39m Trial 6 finished with value: 0.8672566371681416 and parameters: {'objective': 'CrossEntropy', 'colsample_bylevel': 0.029932393412615117, 'depth': 5, 'boosting_type': 'Plain', 'bootstrap_type': 'Bayesian', 'bagging_temperature': 9.85706063619563}. Best is trial 3 with value: 0.8695652173913043.
[32m[I 2023-04-26 10:34:46,075][39m Trial 7 finished with value: 0.8596491228070176 and parameters: {'objective': 'Logloss', 'colsample_bylevel': 0.07661425853442727, 'depth': 4, 'boosting_type': 'Plain', 'bootstrap_type': 'MVS'}. Best is trial 3 with value: 0.8695652173913043.
[32m[I 2023-04-26 10:34:47,898][39m Trial 8 finished with value: 0.8771929824561403 and parameters: {'objective': 'CrossEntropy', 'colsample_bylevel': 0.07725412501027375, 'depth': 7, 'boosting_type': 'Plain', 'bootstrap_type': 'Bayesian', 'bagging_temperature': 4.387793426677038}. Best is trial 8 with value: 0.8771929824561403.
[32m[I 2023-04-26 10:34:52,053][39m Trial 9 finished with value: 0.8448275862068967 and parameters: {'objective': 'Logloss', 'colsample_bylevel': 0.08636567621076276, 'depth': 2, 'boosting_type': 'Ordered', 'bootstrap_type': 'Bernoulli', 'subsample': 0.45626844724062543}. Best is trial 8 with value: 0.8771929824561403.
[32m[I 2023-04-26 10:34:54,004][39m Trial 10 finished with value: 0.8672566371681416 and parameters: {'objective': 'CrossEntropy', 'colsample_bylevel': 0.09502644222921615, 'depth': 8, 'boosting_type': 'Plain', 'bootstrap_type': 'Bayesian', 'bagging_temperature': 1.7100094397752903}. Best is trial 8 with value: 0.8771929824561403.
[32m[I 2023-04-26 10:34:55,756][39m Trial 11 finished with value: 0.8771929824561403 and parameters: {'objective': 'Logloss', 'colsample_bylevel': 0.04824776710162077, 'depth': 8, 'boosting_type': 'Plain', 'bootstrap_type': 'Bayesian', 'bagging_temperature': 5.179061500724652}. Best is trial 8 with value: 0.8771929824561403.
[32m[I 2023-04-26 10:34:57,479][39m Trial 12 finished with value: 0.875 and parameters: {'objective': 'Logloss', 'colsample_bylevel': 0.0648171195105546, 'depth': 7, 'boosting_type': 'Plain', 'bootstrap_type': 'Bayesian', 'bagging_temperature': 4.6672386744777175}. Best is trial 8 with value: 0.8771929824561403.
[32m[I 2023-04-26 10:34:59,190][39m Trial 13 finished with value: 0.8928571428571429 and parameters: {'objective': 'Logloss', 'colsample_bylevel': 0.04926501223513201, 'depth': 8, 'boosting_type': 'Plain', 'bootstrap_type': 'Bayesian', 'bagging_temperature': 5.126067507592287}. Best is trial 13 with value: 0.8928571428571429.
[32m[I 2023-04-26 10:35:00,944][39m Trial 14 finished with value: 0.8771929824561403 and parameters: {'objective': 'Logloss', 'colsample_bylevel': 0.06941214666067622, 'depth': 6, 'boosting_type': 'Plain', 'bootstrap_type': 'Bayesian', 'bagging_temperature': 5.145928181322293}. Best is trial 13 with value: 0.8928571428571429.
[32m[I 2023-04-26 10:35:02,500][39m Trial 15 finished with value: 0.8672566371681416 and parameters: {'objective': 'CrossEntropy', 'colsample_bylevel': 0.034012049501700614, 'depth': 9, 'boosting_type': 'Plain', 'bootstrap_type': 'Bayesian', 'bagging_temperature': 3.1293657585862}. Best is trial 13 with value: 0.8928571428571429.
[32m[I 2023-04-26 10:35:04,244][39m Trial 16 finished with value: 0.8672566371681416 and parameters: {'objective': 'CrossEntropy', 'colsample_bylevel': 0.08495762194807824, 'depth': 6, 'boosting_type': 'Plain', 'bootstrap_type': 'Bayesian', 'bagging_temperature': 7.65257329274651}. Best is trial 13 with value: 0.8928571428571429.
[32m[I 2023-04-26 10:35:06,007][39m Trial 17 finished with value: 0.8849557522123893 and parameters: {'objective': 'Logloss', 'colsample_bylevel': 0.05914036922111577, 'depth': 8, 'boosting_type': 'Plain', 'bootstrap_type': 'Bayesian', 'bagging_temperature': 7.265887208827589}. Best is trial 13 with value: 0.8928571428571429.
[32m[I 2023-04-26 10:35:07,261][39m Trial 18 finished with value: 0.6851851851851852 and parameters: {'objective': 'Logloss', 'colsample_bylevel': 0.010316432716520947, 'depth': 9, 'boosting_type': 'Plain', 'bootstrap_type': 'Bayesian', 'bagging_temperature': 7.263260829889773}. Best is trial 13 with value: 0.8928571428571429.
[32m[I 2023-04-26 10:35:08,566][39m Trial 19 finished with value: 0.8103448275862069 and parameters: {'objective': 'Logloss', 'colsample_bylevel': 0.056505925097435454, 'depth': 1, 'boosting_type': 'Plain', 'bootstrap_type': 'Bayesian', 'bagging_temperature': 7.263162370375436}. Best is trial 13 with value: 0.8928571428571429.
[32m[I 2023-04-26 10:35:10,177][39m Trial 20 finished with value: 0.8648648648648648 and parameters: {'objective': 'Logloss', 'colsample_bylevel': 0.03898000685939214, 'depth': 9, 'boosting_type': 'Plain', 'bootstrap_type': 'Bayesian', 'bagging_temperature': 8.809765234191843}. Best is trial 13 with value: 0.8928571428571429.
[32m[I 2023-04-26 10:35:11,821][39m Trial 21 finished with value: 0.8771929824561403 and parameters: {'objective': 'Logloss', 'colsample_bylevel': 0.0633656719164062, 'depth': 6, 'boosting_type': 'Plain', 'bootstrap_type': 'Bayesian', 'bagging_temperature': 5.70080043702068}. Best is trial 13 with value: 0.8928571428571429.
[32m[I 2023-04-26 10:35:13,298][39m Trial 22 finished with value: 0.8771929824561403 and parameters: {'objective': 'Logloss', 'colsample_bylevel': 0.051804952322943736, 'depth': 5, 'boosting_type': 'Plain', 'bootstrap_type': 'Bayesian', 'bagging_temperature': 6.20553556714991}. Best is trial 13 with value: 0.8928571428571429.
[32m[I 2023-04-26 10:35:15,155][39m Trial 23 finished with value: 0.8672566371681416 and parameters: {'objective': 'Logloss', 'colsample_bylevel': 0.04836206882211909, 'depth': 8, 'boosting_type': 'Plain', 'bootstrap_type': 'Bayesian', 'bagging_temperature': 3.15556209929391}. Best is trial 13 with value: 0.8928571428571429.
[32m[I 2023-04-26 10:35:16,641][39m Trial 24 finished with value: 0.875 and parameters: {'objective': 'Logloss', 'colsample_bylevel': 0.0416504543851575, 'depth': 8, 'boosting_type': 'Plain', 'bootstrap_type': 'Bayesian', 'bagging_temperature': 6.435361631584349}. Best is trial 13 with value: 0.8928571428571429.
[32m[I 2023-04-26 10:35:18,168][39m Trial 25 finished with value: 0.8695652173913043 and parameters: {'objective': 'Logloss', 'colsample_bylevel': 0.05252332507525222, 'depth': 5, 'boosting_type': 'Plain', 'bootstrap_type': 'Bayesian', 'bagging_temperature': 6.278842379680501}. Best is trial 13 with value: 0.8928571428571429.
[32m[I 2023-04-26 10:35:19,768][39m Trial 26 finished with value: 0.8596491228070176 and parameters: {'objective': 'Logloss', 'colsample_bylevel': 0.05666369061698387, 'depth': 5, 'boosting_type': 'Plain', 'bootstrap_type': 'Bayesian', 'bagging_temperature': 0.09785684738856393}. Best is trial 13 with value: 0.8928571428571429.
[32m[I 2023-04-26 10:35:21,460][39m Trial 27 finished with value: 0.8771929824561403 and parameters: {'objective': 'Logloss', 'colsample_bylevel': 0.06389586484384654, 'depth': 7, 'boosting_type': 'Plain', 'bootstrap_type': 'Bayesian', 'bagging_temperature': 8.205291682209563}. Best is trial 13 with value: 0.8928571428571429.
[32m[I 2023-04-26 10:35:22,738][39m Trial 28 finished with value: 0.8648648648648648 and parameters: {'objective': 'Logloss', 'colsample_bylevel': 0.030816411912856365, 'depth': 4, 'boosting_type': 'Plain', 'bootstrap_type': 'Bernoulli', 'subsample': 0.9622181833936573}. Best is trial 13 with value: 0.8928571428571429.
[32m[I 2023-04-26 10:35:26,694][39m Trial 29 finished with value: 0.8596491228070176 and parameters: {'objective': 'Logloss', 'colsample_bylevel': 0.07168870912682762, 'depth': 10, 'boosting_type': 'Ordered', 'bootstrap_type': 'MVS'}. Best is trial 13 with value: 0.8928571428571429.
[32m[I 2023-04-26 10:35:28,468][39m Trial 30 finished with value: 0.8421052631578947 and parameters: {'objective': 'Logloss', 'colsample_bylevel': 0.07184357408270156, 'depth': 10, 'boosting_type': 'Plain', 'bootstrap_type': 'MVS'}. Best is trial 13 with value: 0.8928571428571429.
[32m[I 2023-04-26 10:35:30,166][39m Trial 31 finished with value: 0.8771929824561403 and parameters: {'objective': 'Logloss', 'colsample_bylevel': 0.06348497483816821, 'depth': 7, 'boosting_type': 'Plain', 'bootstrap_type': 'Bayesian', 'bagging_temperature': 8.198342725592727}. Best is trial 13 with value: 0.8928571428571429.
[32m[I 2023-04-26 10:35:31,960][39m Trial 32 finished with value: 0.8849557522123893 and parameters: {'objective': 'Logloss', 'colsample_bylevel': 0.06678883457295173, 'depth': 7, 'boosting_type': 'Plain', 'bootstrap_type': 'Bayesian', 'bagging_temperature': 8.75451856650047}. Best is trial 13 with value: 0.8928571428571429.
[32m[I 2023-04-26 10:35:34,059][39m Trial 33 finished with value: 0.8771929824561403 and parameters: {'objective': 'Logloss', 'colsample_bylevel': 0.08111960537610452, 'depth': 7, 'boosting_type': 'Plain', 'bootstrap_type': 'Bayesian', 'bagging_temperature': 9.261037722178683}. Best is trial 13 with value: 0.8928571428571429.
[32m[I 2023-04-26 10:35:38,251][39m Trial 34 finished with value: 0.8771929824561403 and parameters: {'objective': 'Logloss', 'colsample_bylevel': 0.08300245539267043, 'depth': 9, 'boosting_type': 'Ordered', 'bootstrap_type': 'Bayesian', 'bagging_temperature': 9.623312999985666}. Best is trial 13 with value: 0.8928571428571429.
[32m[I 2023-04-26 10:35:40,298][39m Trial 35 finished with value: 0.8771929824561403 and parameters: {'objective': 'Logloss', 'colsample_bylevel': 0.06085310324850277, 'depth': 8, 'boosting_type': 'Plain', 'bootstrap_type': 'Bernoulli', 'subsample': 0.10646537111976484}. Best is trial 13 with value: 0.8928571428571429.
[32m[I 2023-04-26 10:35:45,256][39m Trial 36 finished with value: 0.8672566371681416 and parameters: {'objective': 'Logloss', 'colsample_bylevel': 0.09812445048670336, 'depth': 11, 'boosting_type': 'Ordered', 'bootstrap_type': 'Bayesian', 'bagging_temperature': 9.067117180927566}. Best is trial 13 with value: 0.8928571428571429.
[32m[I 2023-04-26 10:35:47,264][39m Trial 37 finished with value: 0.8771929824561403 and parameters: {'objective': 'Logloss', 'colsample_bylevel': 0.05963257677077217, 'depth': 8, 'boosting_type': 'Plain', 'bootstrap_type': 'Bernoulli', 'subsample': 0.13897553794568943}. Best is trial 13 with value: 0.8928571428571429.
[32m[I 2023-04-26 10:35:48,715][39m Trial 38 finished with value: 0.8672566371681416 and parameters: {'objective': 'Logloss', 'colsample_bylevel': 0.04405207025185843, 'depth': 12, 'boosting_type': 'Plain', 'bootstrap_type': 'Bernoulli', 'subsample': 0.11336315313968429}. Best is trial 13 with value: 0.8928571428571429.
[32m[I 2023-04-26 10:35:53,694][39m Trial 39 finished with value: 0.8521739130434783 and parameters: {'objective': 'Logloss', 'colsample_bylevel': 0.0671976685781687, 'depth': 6, 'boosting_type': 'Ordered', 'bootstrap_type': 'MVS'}. Best is trial 13 with value: 0.8928571428571429.
[32m[I 2023-04-26 10:35:55,214][39m Trial 40 finished with value: 0.8672566371681416 and parameters: {'objective': 'CrossEntropy', 'colsample_bylevel': 0.05209818027214776, 'depth': 7, 'boosting_type': 'Plain', 'bootstrap_type': 'Bayesian', 'bagging_temperature': 8.137495067370182}. Best is trial 13 with value: 0.8928571428571429.
[32m[I 2023-04-26 10:35:56,859][39m Trial 41 finished with value: 0.8849557522123893 and parameters: {'objective': 'Logloss', 'colsample_bylevel': 0.06578692075763615, 'depth': 7, 'boosting_type': 'Plain', 'bootstrap_type': 'Bayesian', 'bagging_temperature': 8.217907120343007}. Best is trial 13 with value: 0.8928571428571429.
[32m[I 2023-04-26 10:35:58,797][39m Trial 42 finished with value: 0.8771929824561403 and parameters: {'objective': 'Logloss', 'colsample_bylevel': 0.07518095977601569, 'depth': 7, 'boosting_type': 'Plain', 'bootstrap_type': 'Bayesian', 'bagging_temperature': 8.477613493652024}. Best is trial 13 with value: 0.8928571428571429.
[32m[I 2023-04-26 10:36:00,633][39m Trial 43 finished with value: 0.8771929824561403 and parameters: {'objective': 'Logloss', 'colsample_bylevel': 0.06784369157148505, 'depth': 6, 'boosting_type': 'Plain', 'bootstrap_type': 'Bayesian', 'bagging_temperature': 6.648220426980528}. Best is trial 13 with value: 0.8928571428571429.
[32m[I 2023-04-26 10:36:02,378][39m Trial 44 finished with value: 0.8771929824561403 and parameters: {'objective': 'Logloss', 'colsample_bylevel': 0.06011053127494643, 'depth': 6, 'boosting_type': 'Plain', 'bootstrap_type': 'Bayesian', 'bagging_temperature': 5.634571801937738}. Best is trial 13 with value: 0.8928571428571429.
[32m[I 2023-04-26 10:36:03,939][39m Trial 45 finished with value: 0.8771929824561403 and parameters: {'objective': 'Logloss', 'colsample_bylevel': 0.0521416220555209, 'depth': 5, 'boosting_type': 'Plain', 'bootstrap_type': 'Bayesian', 'bagging_temperature': 7.048253609155942}. Best is trial 13 with value: 0.8928571428571429.
[32m[I 2023-04-26 10:36:05,355][39m Trial 46 finished with value: 0.8596491228070176 and parameters: {'objective': 'CrossEntropy', 'colsample_bylevel': 0.038074381139143715, 'depth': 4, 'boosting_type': 'Plain', 'bootstrap_type': 'MVS'}. Best is trial 13 with value: 0.8928571428571429.
[32m[I 2023-04-26 10:36:08,679][39m Trial 47 finished with value: 0.875 and parameters: {'objective': 'Logloss', 'colsample_bylevel': 0.04664716595438085, 'depth': 3, 'boosting_type': 'Ordered', 'bootstrap_type': 'Bayesian', 'bagging_temperature': 9.981518342342216}. Best is trial 13 with value: 0.8928571428571429.
[32m[I 2023-04-26 10:36:10,980][39m Trial 48 finished with value: 0.8695652173913043 and parameters: {'objective': 'Logloss', 'colsample_bylevel': 0.08843889609933989, 'depth': 10, 'boosting_type': 'Plain', 'bootstrap_type': 'Bayesian', 'bagging_temperature': 7.962642607568852}. Best is trial 13 with value: 0.8928571428571429.
[32m[I 2023-04-26 10:36:12,301][39m Trial 49 finished with value: 0.8347826086956522 and parameters: {'objective': 'CrossEntropy', 'colsample_bylevel': 0.02531333575157708, 'depth': 8, 'boosting_type': 'Plain', 'bootstrap_type': 'Bayesian', 'bagging_temperature': 3.9201564962000854}. Best is trial 13 with value: 0.8928571428571429.
[32m[I 2023-04-26 10:36:14,254][39m Trial 50 finished with value: 0.8771929824561403 and parameters: {'objective': 'Logloss', 'colsample_bylevel': 0.05509559478823579, 'depth': 9, 'boosting_type': 'Plain', 'bootstrap_type': 'Bayesian', 'bagging_temperature': 5.921417865583727}. Best is trial 13 with value: 0.8928571428571429.
[32m[I 2023-04-26 10:36:15,979][39m Trial 51 finished with value: 0.8596491228070176 and parameters: {'objective': 'Logloss', 'colsample_bylevel': 0.05656155517572365, 'depth': 8, 'boosting_type': 'Plain', 'bootstrap_type': 'Bayesian', 'bagging_temperature': 5.689580415529491}. Best is trial 13 with value: 0.8928571428571429.
[32m[I 2023-04-26 10:36:18,420][39m Trial 52 finished with value: 0.875 and parameters: {'objective': 'Logloss', 'colsample_bylevel': 0.0696160357858997, 'depth': 9, 'boosting_type': 'Plain', 'bootstrap_type': 'Bayesian', 'bagging_temperature': 4.310163770766884}. Best is trial 13 with value: 0.8928571428571429.
[32m[I 2023-04-26 10:36:20,262][39m Trial 53 finished with value: 0.8771929824561403 and parameters: {'objective': 'Logloss', 'colsample_bylevel': 0.06625411059027447, 'depth': 7, 'boosting_type': 'Plain', 'bootstrap_type': 'Bayesian', 'bagging_temperature': 8.820428518967002}. Best is trial 13 with value: 0.8928571428571429.
[32m[I 2023-04-26 10:36:22,424][39m Trial 54 finished with value: 0.8771929824561403 and parameters: {'objective': 'Logloss', 'colsample_bylevel': 0.07938886188766352, 'depth': 7, 'boosting_type': 'Plain', 'bootstrap_type': 'Bayesian', 'bagging_temperature': 9.206831413998762}. Best is trial 13 with value: 0.8928571428571429.
[32m[I 2023-04-26 10:36:24,041][39m Trial 55 finished with value: 0.8928571428571429 and parameters: {'objective': 'Logloss', 'colsample_bylevel': 0.05058027367050068, 'depth': 5, 'boosting_type': 'Plain', 'bootstrap_type': 'Bayesian', 'bagging_temperature': 7.535583741562537}. Best is trial 13 with value: 0.8928571428571429.
[32m[I 2023-04-26 10:36:25,472][39m Trial 56 finished with value: 0.8695652173913043 and parameters: {'objective': 'Logloss', 'colsample_bylevel': 0.04908510141051017, 'depth': 5, 'boosting_type': 'Plain', 'bootstrap_type': 'Bayesian', 'bagging_temperature': 7.569158349546849}. Best is trial 13 with value: 0.8928571428571429.
[32m[I 2023-04-26 10:36:27,651][39m Trial 57 finished with value: 0.8771929824561403 and parameters: {'objective': 'Logloss', 'colsample_bylevel': 0.07469751090713729, 'depth': 6, 'boosting_type': 'Plain', 'bootstrap_type': 'Bayesian', 'bagging_temperature': 8.371193086440407}. Best is trial 13 with value: 0.8928571428571429.
[32m[I 2023-04-26 10:36:29,709][39m Trial 58 finished with value: 0.8849557522123893 and parameters: {'objective': 'CrossEntropy', 'colsample_bylevel': 0.06230969164776463, 'depth': 8, 'boosting_type': 'Plain', 'bootstrap_type': 'Bayesian', 'bagging_temperature': 7.6300227161863985}. Best is trial 13 with value: 0.8928571428571429.
[32m[I 2023-04-26 10:36:31,459][39m Trial 59 finished with value: 0.8771929824561403 and parameters: {'objective': 'CrossEntropy', 'colsample_bylevel': 0.04460625593202064, 'depth': 8, 'boosting_type': 'Plain', 'bootstrap_type': 'Bayesian', 'bagging_temperature': 6.98655585827122}. Best is trial 13 with value: 0.8928571428571429.
[32m[I 2023-04-26 10:36:34,038][39m Trial 60 finished with value: 0.8596491228070176 and parameters: {'objective': 'CrossEntropy', 'colsample_bylevel': 0.05821377677033876, 'depth': 9, 'boosting_type': 'Plain', 'bootstrap_type': 'MVS'}. Best is trial 13 with value: 0.8928571428571429.
[32m[I 2023-04-26 10:36:35,510][39m Trial 61 finished with value: 0.8849557522123893 and parameters: {'objective': 'CrossEntropy', 'colsample_bylevel': 0.05242786682298217, 'depth': 4, 'boosting_type': 'Plain', 'bootstrap_type': 'Bayesian', 'bagging_temperature': 7.664055650930534}. Best is trial 13 with value: 0.8928571428571429.
[32m[I 2023-04-26 10:36:37,067][39m Trial 62 finished with value: 0.8695652173913043 and parameters: {'objective': 'CrossEntropy', 'colsample_bylevel': 0.06161199710091474, 'depth': 4, 'boosting_type': 'Plain', 'bootstrap_type': 'Bayesian', 'bagging_temperature': 7.598636763095852}. Best is trial 13 with value: 0.8928571428571429.
[32m[I 2023-04-26 10:36:38,498][39m Trial 63 finished with value: 0.875 and parameters: {'objective': 'CrossEntropy', 'colsample_bylevel': 0.04971818358520476, 'depth': 3, 'boosting_type': 'Plain', 'bootstrap_type': 'Bayesian', 'bagging_temperature': 7.792586500665979}. Best is trial 13 with value: 0.8928571428571429.
[32m[I 2023-04-26 10:36:39,956][39m Trial 64 finished with value: 0.8672566371681416 and parameters: {'objective': 'CrossEntropy', 'colsample_bylevel': 0.05384393365697753, 'depth': 2, 'boosting_type': 'Plain', 'bootstrap_type': 'Bayesian', 'bagging_temperature': 7.059108620648403}. Best is trial 13 with value: 0.8928571428571429.
[32m[I 2023-04-26 10:36:41,327][39m Trial 65 finished with value: 0.8849557522123893 and parameters: {'objective': 'CrossEntropy', 'colsample_bylevel': 0.03681547171760588, 'depth': 4, 'boosting_type': 'Plain', 'bootstrap_type': 'Bayesian', 'bagging_temperature': 8.516059370623921}. Best is trial 13 with value: 0.8928571428571429.
[32m[I 2023-04-26 10:36:43,224][39m Trial 66 finished with value: 0.8521739130434783 and parameters: {'objective': 'CrossEntropy', 'colsample_bylevel': 0.07210064112725688, 'depth': 3, 'boosting_type': 'Plain', 'bootstrap_type': 'Bernoulli', 'subsample': 0.917079515877532}. Best is trial 13 with value: 0.8928571428571429.
