[32m[I 2023-04-26 01:28:15,498][39m Trial 329 finished with value: 0.8260869565217392 and parameters: {'objective': 'CrossEntropy', 'colsample_bylevel': 0.09631353097766031, 'depth': 2, 'boosting_type': 'Plain', 'bootstrap_type': 'Bayesian', 'bagging_temperature': 9.341988462379726}. Best is trial 129 with value: 0.9195402298850575.
[32m[I 2023-04-26 01:28:19,118][39m Trial 330 finished with value: 0.8636363636363636 and parameters: {'objective': 'CrossEntropy', 'colsample_bylevel': 0.09427419852995503, 'depth': 12, 'boosting_type': 'Plain', 'bootstrap_type': 'MVS'}. Best is trial 129 with value: 0.9195402298850575.
[32m[I 2023-04-26 01:28:21,986][39m Trial 331 finished with value: 0.8791208791208791 and parameters: {'objective': 'Logloss', 'colsample_bylevel': 0.08514242790493623, 'depth': 11, 'boosting_type': 'Plain', 'bootstrap_type': 'Bayesian', 'bagging_temperature': 9.836624845645701}. Best is trial 129 with value: 0.9195402298850575.
[32m[I 2023-04-26 01:28:25,296][39m Trial 332 finished with value: 0.8863636363636364 and parameters: {'objective': 'CrossEntropy', 'colsample_bylevel': 0.08826100998201397, 'depth': 12, 'boosting_type': 'Plain', 'bootstrap_type': 'Bayesian', 'bagging_temperature': 8.60579722994518}. Best is trial 129 with value: 0.9195402298850575.
[32m[I 2023-04-26 01:28:28,827][39m Trial 333 finished with value: 0.8988764044943819 and parameters: {'objective': 'CrossEntropy', 'colsample_bylevel': 0.09525655029774914, 'depth': 12, 'boosting_type': 'Plain', 'bootstrap_type': 'Bayesian', 'bagging_temperature': 9.355549058405309}. Best is trial 129 with value: 0.9195402298850575.
[32m[I 2023-04-26 01:28:31,914][39m Trial 334 finished with value: 0.8764044943820225 and parameters: {'objective': 'CrossEntropy', 'colsample_bylevel': 0.09187541804457844, 'depth': 11, 'boosting_type': 'Plain', 'bootstrap_type': 'Bernoulli', 'subsample': 0.17887674877090942}. Best is trial 129 with value: 0.9195402298850575.
[32m[I 2023-04-26 01:28:34,960][39m Trial 335 finished with value: 0.8666666666666666 and parameters: {'objective': 'CrossEntropy', 'colsample_bylevel': 0.08878216189644914, 'depth': 11, 'boosting_type': 'Plain', 'bootstrap_type': 'Bayesian', 'bagging_temperature': 9.527264164557922}. Best is trial 129 with value: 0.9195402298850575.
[32m[I 2023-04-26 01:28:38,593][39m Trial 336 finished with value: 0.8604651162790697 and parameters: {'objective': 'CrossEntropy', 'colsample_bylevel': 0.0989538475196611, 'depth': 12, 'boosting_type': 'Plain', 'bootstrap_type': 'Bayesian', 'bagging_temperature': 9.20946118149987}. Best is trial 129 with value: 0.9195402298850575.
[32m[I 2023-04-26 01:28:41,753][39m Trial 337 finished with value: 0.8695652173913043 and parameters: {'objective': 'Logloss', 'colsample_bylevel': 0.09199862839623084, 'depth': 10, 'boosting_type': 'Plain', 'bootstrap_type': 'Bayesian', 'bagging_temperature': 8.735524568443308}. Best is trial 129 with value: 0.9195402298850575.
[32m[I 2023-04-26 01:28:43,628][39m Trial 338 finished with value: 0.8089887640449439 and parameters: {'objective': 'CrossEntropy', 'colsample_bylevel': 0.059269480588246624, 'depth': 11, 'boosting_type': 'Plain', 'bootstrap_type': 'Bayesian', 'bagging_temperature': 8.371034143375844}. Best is trial 129 with value: 0.9195402298850575.
[32m[I 2023-04-26 01:28:47,060][39m Trial 339 finished with value: 0.9090909090909092 and parameters: {'objective': 'CrossEntropy', 'colsample_bylevel': 0.09695645031631266, 'depth': 11, 'boosting_type': 'Plain', 'bootstrap_type': 'Bayesian', 'bagging_temperature': 8.82694449846225}. Best is trial 129 with value: 0.9195402298850575.
[32m[I 2023-04-26 01:28:50,405][39m Trial 340 finished with value: 0.8988764044943819 and parameters: {'objective': 'CrossEntropy', 'colsample_bylevel': 0.09478460962792415, 'depth': 12, 'boosting_type': 'Plain', 'bootstrap_type': 'Bayesian', 'bagging_temperature': 8.957977968136998}. Best is trial 129 with value: 0.9195402298850575.
[32m[I 2023-04-26 01:28:53,978][39m Trial 341 finished with value: 0.8863636363636364 and parameters: {'objective': 'CrossEntropy', 'colsample_bylevel': 0.09182187474624424, 'depth': 11, 'boosting_type': 'Plain', 'bootstrap_type': 'Bayesian', 'bagging_temperature': 9.56556215348046}. Best is trial 129 with value: 0.9195402298850575.
[32m[I 2023-04-26 01:28:57,187][39m Trial 342 finished with value: 0.8791208791208791 and parameters: {'objective': 'CrossEntropy', 'colsample_bylevel': 0.09412612331528213, 'depth': 12, 'boosting_type': 'Plain', 'bootstrap_type': 'Bayesian', 'bagging_temperature': 8.808178090403214}. Best is trial 129 with value: 0.9195402298850575.
[32m[I 2023-04-26 01:29:00,805][39m Trial 343 finished with value: 0.8988764044943819 and parameters: {'objective': 'CrossEntropy', 'colsample_bylevel': 0.09380575882609768, 'depth': 12, 'boosting_type': 'Plain', 'bootstrap_type': 'Bayesian', 'bagging_temperature': 9.424181166156487}. Best is trial 129 with value: 0.9195402298850575.
[32m[I 2023-04-26 01:29:07,304][39m Trial 344 finished with value: 0.8172043010752689 and parameters: {'objective': 'CrossEntropy', 'colsample_bylevel': 0.09763825814160815, 'depth': 11, 'boosting_type': 'Ordered', 'bootstrap_type': 'Bayesian', 'bagging_temperature': 9.587323118440914}. Best is trial 129 with value: 0.9195402298850575.
[32m[I 2023-04-26 01:29:11,085][39m Trial 345 finished with value: 0.888888888888889 and parameters: {'objective': 'CrossEntropy', 'colsample_bylevel': 0.09980856292194888, 'depth': 12, 'boosting_type': 'Plain', 'bootstrap_type': 'Bayesian', 'bagging_temperature': 9.0596428714397}. Best is trial 129 with value: 0.9195402298850575.
[32m[I 2023-04-26 01:29:14,621][39m Trial 346 finished with value: 0.8666666666666666 and parameters: {'objective': 'CrossEntropy', 'colsample_bylevel': 0.09665335191439181, 'depth': 12, 'boosting_type': 'Plain', 'bootstrap_type': 'Bayesian', 'bagging_temperature': 8.20963257274761}. Best is trial 129 with value: 0.9195402298850575.
[32m[I 2023-04-26 01:29:16,634][39m Trial 347 finished with value: 0.8478260869565216 and parameters: {'objective': 'CrossEntropy', 'colsample_bylevel': 0.06310837909207945, 'depth': 12, 'boosting_type': 'Plain', 'bootstrap_type': 'Bayesian', 'bagging_temperature': 9.285548999511802}. Best is trial 129 with value: 0.9195402298850575.
[32m[I 2023-04-26 01:29:20,386][39m Trial 348 finished with value: 0.8863636363636364 and parameters: {'objective': 'CrossEntropy', 'colsample_bylevel': 0.09994812597001107, 'depth': 11, 'boosting_type': 'Plain', 'bootstrap_type': 'Bayesian', 'bagging_temperature': 9.133834997924213}. Best is trial 129 with value: 0.9195402298850575.
[32m[I 2023-04-26 01:29:23,567][39m Trial 349 finished with value: 0.8666666666666666 and parameters: {'objective': 'CrossEntropy', 'colsample_bylevel': 0.09040852985967114, 'depth': 11, 'boosting_type': 'Plain', 'bootstrap_type': 'Bayesian', 'bagging_temperature': 8.831869507523674}. Best is trial 129 with value: 0.9195402298850575.
[32m[I 2023-04-26 01:29:27,088][39m Trial 350 finished with value: 0.8863636363636364 and parameters: {'objective': 'CrossEntropy', 'colsample_bylevel': 0.09775681996379981, 'depth': 11, 'boosting_type': 'Plain', 'bootstrap_type': 'Bayesian', 'bagging_temperature': 8.591278692963309}. Best is trial 129 with value: 0.9195402298850575.
[32m[I 2023-04-26 01:29:30,227][39m Trial 351 finished with value: 0.888888888888889 and parameters: {'objective': 'CrossEntropy', 'colsample_bylevel': 0.08971949783495506, 'depth': 11, 'boosting_type': 'Plain', 'bootstrap_type': 'Bayesian', 'bagging_temperature': 9.191055752787408}. Best is trial 129 with value: 0.9195402298850575.
[32m[I 2023-04-26 01:29:33,728][39m Trial 352 finished with value: 0.8863636363636364 and parameters: {'objective': 'CrossEntropy', 'colsample_bylevel': 0.09557311554407125, 'depth': 12, 'boosting_type': 'Plain', 'bootstrap_type': 'Bayesian', 'bagging_temperature': 8.885915796479159}. Best is trial 129 with value: 0.9195402298850575.
[32m[I 2023-04-26 01:29:36,409][39m Trial 353 finished with value: 0.8764044943820225 and parameters: {'objective': 'CrossEntropy', 'colsample_bylevel': 0.08698918692216515, 'depth': 11, 'boosting_type': 'Plain', 'bootstrap_type': 'Bayesian', 'bagging_temperature': 8.432866929366801}. Best is trial 129 with value: 0.9195402298850575.
[32m[I 2023-04-26 01:29:40,125][39m Trial 354 finished with value: 0.8666666666666666 and parameters: {'objective': 'CrossEntropy', 'colsample_bylevel': 0.09701636706917832, 'depth': 12, 'boosting_type': 'Plain', 'bootstrap_type': 'MVS'}. Best is trial 129 with value: 0.9195402298850575.
[32m[I 2023-04-26 01:29:43,987][39m Trial 355 finished with value: 0.8863636363636364 and parameters: {'objective': 'CrossEntropy', 'colsample_bylevel': 0.0988107776022034, 'depth': 12, 'boosting_type': 'Plain', 'bootstrap_type': 'Bayesian', 'bagging_temperature': 9.712798898007707}. Best is trial 129 with value: 0.9195402298850575.
[32m[I 2023-04-26 01:29:47,162][39m Trial 356 finished with value: 0.8666666666666666 and parameters: {'objective': 'CrossEntropy', 'colsample_bylevel': 0.0929331869723484, 'depth': 10, 'boosting_type': 'Plain', 'bootstrap_type': 'Bayesian', 'bagging_temperature': 8.27916867705176}. Best is trial 129 with value: 0.9195402298850575.
[32m[I 2023-04-26 01:29:50,528][39m Trial 357 finished with value: 0.8666666666666666 and parameters: {'objective': 'Logloss', 'colsample_bylevel': 0.09478466467986159, 'depth': 12, 'boosting_type': 'Plain', 'bootstrap_type': 'Bernoulli', 'subsample': 0.3175096975750734}. Best is trial 129 with value: 0.9195402298850575.
[32m[I 2023-04-26 01:29:53,896][39m Trial 358 finished with value: 0.8863636363636364 and parameters: {'objective': 'CrossEntropy', 'colsample_bylevel': 0.09294042568979527, 'depth': 11, 'boosting_type': 'Plain', 'bootstrap_type': 'Bayesian', 'bagging_temperature': 8.587656585879154}. Best is trial 129 with value: 0.9195402298850575.
[32m[I 2023-04-26 01:29:57,217][39m Trial 359 finished with value: 0.8863636363636364 and parameters: {'objective': 'CrossEntropy', 'colsample_bylevel': 0.09092333064380227, 'depth': 12, 'boosting_type': 'Plain', 'bootstrap_type': 'Bayesian', 'bagging_temperature': 9.444885709226797}. Best is trial 129 with value: 0.9195402298850575.
[32m[I 2023-04-26 01:29:58,357][39m Trial 360 finished with value: 0.7578947368421053 and parameters: {'objective': 'CrossEntropy', 'colsample_bylevel': 0.01604554056918847, 'depth': 11, 'boosting_type': 'Plain', 'bootstrap_type': 'Bayesian', 'bagging_temperature': 6.009929526728158}. Best is trial 129 with value: 0.9195402298850575.
[32m[I 2023-04-26 01:30:02,124][39m Trial 361 finished with value: 0.888888888888889 and parameters: {'objective': 'CrossEntropy', 'colsample_bylevel': 0.09574284127829226, 'depth': 12, 'boosting_type': 'Plain', 'bootstrap_type': 'Bayesian', 'bagging_temperature': 9.373388942524445}. Best is trial 129 with value: 0.9195402298850575.
[32m[I 2023-04-26 01:30:08,751][39m Trial 362 finished with value: 0.8131868131868132 and parameters: {'objective': 'CrossEntropy', 'colsample_bylevel': 0.09712288779430503, 'depth': 12, 'boosting_type': 'Ordered', 'bootstrap_type': 'Bayesian', 'bagging_temperature': 9.098829515231403}. Best is trial 129 with value: 0.9195402298850575.
[32m[I 2023-04-26 01:30:12,481][39m Trial 363 finished with value: 0.8735632183908046 and parameters: {'objective': 'CrossEntropy', 'colsample_bylevel': 0.09818676357111593, 'depth': 12, 'boosting_type': 'Plain', 'bootstrap_type': 'Bayesian', 'bagging_temperature': 9.404850425480308}. Best is trial 129 with value: 0.9195402298850575.
[32m[I 2023-04-26 01:30:16,059][39m Trial 364 finished with value: 0.8735632183908046 and parameters: {'objective': 'CrossEntropy', 'colsample_bylevel': 0.09792808512431318, 'depth': 12, 'boosting_type': 'Plain', 'bootstrap_type': 'Bayesian', 'bagging_temperature': 9.745955477053805}. Best is trial 129 with value: 0.9195402298850575.
[32m[I 2023-04-26 01:30:19,624][39m Trial 365 finished with value: 0.8863636363636364 and parameters: {'objective': 'Logloss', 'colsample_bylevel': 0.09987824526667737, 'depth': 11, 'boosting_type': 'Plain', 'bootstrap_type': 'Bayesian', 'bagging_temperature': 8.970721743342361}. Best is trial 129 with value: 0.9195402298850575.
[32m[I 2023-04-26 01:30:21,339][39m Trial 366 finished with value: 0.8260869565217392 and parameters: {'objective': 'CrossEntropy', 'colsample_bylevel': 0.052481221874052755, 'depth': 12, 'boosting_type': 'Plain', 'bootstrap_type': 'Bayesian', 'bagging_temperature': 9.749261179098777}. Best is trial 129 with value: 0.9195402298850575.
[32m[I 2023-04-26 01:30:24,662][39m Trial 367 finished with value: 0.888888888888889 and parameters: {'objective': 'Logloss', 'colsample_bylevel': 0.09543371064909863, 'depth': 11, 'boosting_type': 'Plain', 'bootstrap_type': 'Bayesian', 'bagging_temperature': 9.913371971946997}. Best is trial 129 with value: 0.9195402298850575.
[32m[I 2023-04-26 01:30:28,236][39m Trial 368 finished with value: 0.8705882352941177 and parameters: {'objective': 'CrossEntropy', 'colsample_bylevel': 0.09663047436234763, 'depth': 11, 'boosting_type': 'Plain', 'bootstrap_type': 'Bayesian', 'bagging_temperature': 9.366761322286791}. Best is trial 129 with value: 0.9195402298850575.
[32m[I 2023-04-26 01:30:31,863][39m Trial 369 finished with value: 0.8764044943820225 and parameters: {'objective': 'CrossEntropy', 'colsample_bylevel': 0.09997943512822963, 'depth': 12, 'boosting_type': 'Plain', 'bootstrap_type': 'Bayesian', 'bagging_temperature': 9.213300730283066}. Best is trial 129 with value: 0.9195402298850575.
[32m[I 2023-04-26 01:30:35,118][39m Trial 370 finished with value: 0.8791208791208791 and parameters: {'objective': 'CrossEntropy', 'colsample_bylevel': 0.09304385757402073, 'depth': 12, 'boosting_type': 'Plain', 'bootstrap_type': 'Bayesian', 'bagging_temperature': 8.6781413767975}. Best is trial 129 with value: 0.9195402298850575.
[32m[I 2023-04-26 01:30:38,299][39m Trial 371 finished with value: 0.8863636363636364 and parameters: {'objective': 'CrossEntropy', 'colsample_bylevel': 0.09037011017827266, 'depth': 11, 'boosting_type': 'Plain', 'bootstrap_type': 'Bayesian', 'bagging_temperature': 9.548282409090397}. Best is trial 129 with value: 0.9195402298850575.
[32m[I 2023-04-26 01:30:41,804][39m Trial 372 finished with value: 0.9090909090909092 and parameters: {'objective': 'CrossEntropy', 'colsample_bylevel': 0.09432787957885784, 'depth': 12, 'boosting_type': 'Plain', 'bootstrap_type': 'Bayesian', 'bagging_temperature': 9.619076274851857}. Best is trial 129 with value: 0.9195402298850575.
[32m[I 2023-04-26 01:30:43,508][39m Trial 373 finished with value: 0.8297872340425531 and parameters: {'objective': 'CrossEntropy', 'colsample_bylevel': 0.049852241609409445, 'depth': 10, 'boosting_type': 'Plain', 'bootstrap_type': 'Bayesian', 'bagging_temperature': 8.790668783455637}. Best is trial 129 with value: 0.9195402298850575.
[32m[I 2023-04-26 01:30:46,875][39m Trial 374 finished with value: 0.8863636363636364 and parameters: {'objective': 'CrossEntropy', 'colsample_bylevel': 0.0937471977602212, 'depth': 12, 'boosting_type': 'Plain', 'bootstrap_type': 'Bayesian', 'bagging_temperature': 9.146050782689544}. Best is trial 129 with value: 0.9195402298850575.
[32m[I 2023-04-26 01:30:50,479][39m Trial 375 finished with value: 0.8636363636363636 and parameters: {'objective': 'CrossEntropy', 'colsample_bylevel': 0.0950313465854133, 'depth': 11, 'boosting_type': 'Plain', 'bootstrap_type': 'MVS'}. Best is trial 129 with value: 0.9195402298850575.
[32m[I 2023-04-26 01:30:53,759][39m Trial 376 finished with value: 0.888888888888889 and parameters: {'objective': 'CrossEntropy', 'colsample_bylevel': 0.09213693482811489, 'depth': 12, 'boosting_type': 'Plain', 'bootstrap_type': 'Bayesian', 'bagging_temperature': 9.60559753875834}. Best is trial 129 with value: 0.9195402298850575.
[32m[I 2023-04-26 01:30:57,100][39m Trial 377 finished with value: 0.8863636363636364 and parameters: {'objective': 'CrossEntropy', 'colsample_bylevel': 0.09357489705817804, 'depth': 12, 'boosting_type': 'Plain', 'bootstrap_type': 'Bernoulli', 'subsample': 0.5028760395685167}. Best is trial 129 with value: 0.9195402298850575.
[32m[I 2023-04-26 01:31:00,391][39m Trial 378 finished with value: 0.8988764044943819 and parameters: {'objective': 'CrossEntropy', 'colsample_bylevel': 0.09717540486458869, 'depth': 12, 'boosting_type': 'Plain', 'bootstrap_type': 'Bayesian', 'bagging_temperature': 9.428185414711745}. Best is trial 129 with value: 0.9195402298850575.
[32m[I 2023-04-26 01:31:03,341][39m Trial 379 finished with value: 0.888888888888889 and parameters: {'objective': 'CrossEntropy', 'colsample_bylevel': 0.08834206434933278, 'depth': 11, 'boosting_type': 'Plain', 'bootstrap_type': 'Bayesian', 'bagging_temperature': 8.95044316629482}. Best is trial 129 with value: 0.9195402298850575.
[32m[I 2023-04-26 01:31:07,030][39m Trial 380 finished with value: 0.888888888888889 and parameters: {'objective': 'CrossEntropy', 'colsample_bylevel': 0.09988983235669864, 'depth': 12, 'boosting_type': 'Plain', 'bootstrap_type': 'Bayesian', 'bagging_temperature': 8.740969849466698}. Best is trial 129 with value: 0.9195402298850575.
[32m[I 2023-04-26 01:31:10,301][39m Trial 381 finished with value: 0.8988764044943819 and parameters: {'objective': 'CrossEntropy', 'colsample_bylevel': 0.09529312727905337, 'depth': 11, 'boosting_type': 'Plain', 'bootstrap_type': 'Bayesian', 'bagging_temperature': 9.963014339079994}. Best is trial 129 with value: 0.9195402298850575.
[32m[I 2023-04-26 01:31:14,202][39m Trial 382 finished with value: 0.8705882352941177 and parameters: {'objective': 'CrossEntropy', 'colsample_bylevel': 0.09689508947317627, 'depth': 12, 'boosting_type': 'Plain', 'bootstrap_type': 'Bayesian', 'bagging_temperature': 9.291713067604034}. Best is trial 129 with value: 0.9195402298850575.
[32m[I 2023-04-26 01:31:19,948][39m Trial 383 finished with value: 0.8297872340425531 and parameters: {'objective': 'CrossEntropy', 'colsample_bylevel': 0.09439715583934662, 'depth': 10, 'boosting_type': 'Ordered', 'bootstrap_type': 'Bayesian', 'bagging_temperature': 9.052716529287029}. Best is trial 129 with value: 0.9195402298850575.
[32m[I 2023-04-26 01:31:23,550][39m Trial 384 finished with value: 0.8764044943820225 and parameters: {'objective': 'CrossEntropy', 'colsample_bylevel': 0.09801324087616976, 'depth': 12, 'boosting_type': 'Plain', 'bootstrap_type': 'Bayesian', 'bagging_temperature': 9.277241816688715}. Best is trial 129 with value: 0.9195402298850575.
[32m[I 2023-04-26 01:31:26,404][39m Trial 385 finished with value: 0.888888888888889 and parameters: {'objective': 'CrossEntropy', 'colsample_bylevel': 0.09113829013202877, 'depth': 11, 'boosting_type': 'Plain', 'bootstrap_type': 'Bayesian', 'bagging_temperature': 9.598267524294213}. Best is trial 129 with value: 0.9195402298850575.
[32m[I 2023-04-26 01:31:29,716][39m Trial 386 finished with value: 0.888888888888889 and parameters: {'objective': 'CrossEntropy', 'colsample_bylevel': 0.09287315169009311, 'depth': 11, 'boosting_type': 'Plain', 'bootstrap_type': 'Bayesian', 'bagging_temperature': 9.149739173018732}. Best is trial 129 with value: 0.9195402298850575.
[32m[I 2023-04-26 01:31:33,354][39m Trial 387 finished with value: 0.9090909090909092 and parameters: {'objective': 'CrossEntropy', 'colsample_bylevel': 0.09555295800668515, 'depth': 12, 'boosting_type': 'Plain', 'bootstrap_type': 'Bayesian', 'bagging_temperature': 8.9212996423019}. Best is trial 129 with value: 0.9195402298850575.
[32m[I 2023-04-26 01:31:36,948][39m Trial 388 finished with value: 0.8988764044943819 and parameters: {'objective': 'CrossEntropy', 'colsample_bylevel': 0.09510888819905838, 'depth': 12, 'boosting_type': 'Plain', 'bootstrap_type': 'Bayesian', 'bagging_temperature': 9.016606997628053}. Best is trial 129 with value: 0.9195402298850575.
[32m[I 2023-04-26 01:31:40,444][39m Trial 389 finished with value: 0.9090909090909092 and parameters: {'objective': 'CrossEntropy', 'colsample_bylevel': 0.09537190845469784, 'depth': 12, 'boosting_type': 'Plain', 'bootstrap_type': 'Bayesian', 'bagging_temperature': 8.868567420062169}. Best is trial 129 with value: 0.9195402298850575.
[32m[I 2023-04-26 01:31:41,801][39m Trial 390 finished with value: 0.7708333333333333 and parameters: {'objective': 'CrossEntropy', 'colsample_bylevel': 0.02720757945387635, 'depth': 12, 'boosting_type': 'Plain', 'bootstrap_type': 'Bayesian', 'bagging_temperature': 8.857274433755125}. Best is trial 129 with value: 0.9195402298850575.
[32m[I 2023-04-26 01:31:44,018][39m Trial 391 finished with value: 0.8421052631578947 and parameters: {'objective': 'Logloss', 'colsample_bylevel': 0.06737015687576768, 'depth': 12, 'boosting_type': 'Plain', 'bootstrap_type': 'Bayesian', 'bagging_temperature': 8.502684741664073}. Best is trial 129 with value: 0.9195402298850575.
[32m[I 2023-04-26 01:31:47,520][39m Trial 392 finished with value: 0.8409090909090909 and parameters: {'objective': 'Logloss', 'colsample_bylevel': 0.09582500897017865, 'depth': 12, 'boosting_type': 'Plain', 'bootstrap_type': 'Bayesian', 'bagging_temperature': 9.760163566289444}. Best is trial 129 with value: 0.9195402298850575.
[32m[I 2023-04-26 01:31:50,968][39m Trial 393 finished with value: 0.8965517241379309 and parameters: {'objective': 'CrossEntropy', 'colsample_bylevel': 0.09638504342088886, 'depth': 12, 'boosting_type': 'Plain', 'bootstrap_type': 'Bayesian', 'bagging_temperature': 8.771520486694564}. Best is trial 129 with value: 0.9195402298850575.
