[32m[I 2023-04-26 01:17:02,203][39m Trial 134 finished with value: 0.888888888888889 and parameters: {'objective': 'Logloss', 'colsample_bylevel': 0.09790075323884986, 'depth': 12, 'boosting_type': 'Plain', 'bootstrap_type': 'Bayesian', 'bagging_temperature': 8.822525115949954}. Best is trial 129 with value: 0.9195402298850575.
[32m[I 2023-04-26 01:17:03,762][39m Trial 135 finished with value: 0.7956989247311829 and parameters: {'objective': 'Logloss', 'colsample_bylevel': 0.0426358660695846, 'depth': 12, 'boosting_type': 'Plain', 'bootstrap_type': 'Bayesian', 'bagging_temperature': 8.71200903061362}. Best is trial 129 with value: 0.9195402298850575.
[32m[I 2023-04-26 01:17:07,219][39m Trial 136 finished with value: 0.8705882352941177 and parameters: {'objective': 'CrossEntropy', 'colsample_bylevel': 0.09211702521099745, 'depth': 11, 'boosting_type': 'Plain', 'bootstrap_type': 'Bayesian', 'bagging_temperature': 9.767783541744164}. Best is trial 129 with value: 0.9195402298850575.
[32m[I 2023-04-26 01:17:08,587][39m Trial 137 finished with value: 0.8172043010752689 and parameters: {'objective': 'CrossEntropy', 'colsample_bylevel': 0.031553247070179286, 'depth': 12, 'boosting_type': 'Plain', 'bootstrap_type': 'Bayesian', 'bagging_temperature': 7.593160219670482}. Best is trial 129 with value: 0.9195402298850575.
[32m[I 2023-04-26 01:17:11,936][39m Trial 138 finished with value: 0.8735632183908046 and parameters: {'objective': 'CrossEntropy', 'colsample_bylevel': 0.0951775587133455, 'depth': 11, 'boosting_type': 'Plain', 'bootstrap_type': 'Bayesian', 'bagging_temperature': 2.7136406896764322}. Best is trial 129 with value: 0.9195402298850575.
[32m[I 2023-04-26 01:17:15,162][39m Trial 139 finished with value: 0.8863636363636364 and parameters: {'objective': 'CrossEntropy', 'colsample_bylevel': 0.0902598821772903, 'depth': 12, 'boosting_type': 'Plain', 'bootstrap_type': 'Bayesian', 'bagging_temperature': 9.72271279161251}. Best is trial 129 with value: 0.9195402298850575.
[32m[I 2023-04-26 01:17:18,477][39m Trial 140 finished with value: 0.8988764044943819 and parameters: {'objective': 'CrossEntropy', 'colsample_bylevel': 0.09201299066037404, 'depth': 11, 'boosting_type': 'Plain', 'bootstrap_type': 'Bayesian', 'bagging_temperature': 8.249035819236648}. Best is trial 129 with value: 0.9195402298850575.
[32m[I 2023-04-26 01:17:21,520][39m Trial 141 finished with value: 0.8791208791208791 and parameters: {'objective': 'CrossEntropy', 'colsample_bylevel': 0.09255311972871898, 'depth': 11, 'boosting_type': 'Plain', 'bootstrap_type': 'Bayesian', 'bagging_temperature': 8.323026194206076}. Best is trial 129 with value: 0.9195402298850575.
[32m[I 2023-04-26 01:17:25,154][39m Trial 142 finished with value: 0.8791208791208791 and parameters: {'objective': 'CrossEntropy', 'colsample_bylevel': 0.09999521254171892, 'depth': 12, 'boosting_type': 'Plain', 'bootstrap_type': 'Bayesian', 'bagging_temperature': 9.234376735808414}. Best is trial 129 with value: 0.9195402298850575.
[32m[I 2023-04-26 01:17:28,425][39m Trial 143 finished with value: 0.8863636363636364 and parameters: {'objective': 'CrossEntropy', 'colsample_bylevel': 0.09661503773937882, 'depth': 11, 'boosting_type': 'Plain', 'bootstrap_type': 'Bayesian', 'bagging_temperature': 9.393502360938752}. Best is trial 129 with value: 0.9195402298850575.
[32m[I 2023-04-26 01:17:31,488][39m Trial 144 finished with value: 0.8604651162790697 and parameters: {'objective': 'CrossEntropy', 'colsample_bylevel': 0.0896684767560348, 'depth': 12, 'boosting_type': 'Plain', 'bootstrap_type': 'Bayesian', 'bagging_temperature': 9.678685020235596}. Best is trial 129 with value: 0.9195402298850575.
[32m[I 2023-04-26 01:17:32,926][39m Trial 145 finished with value: 0.7954545454545454 and parameters: {'objective': 'CrossEntropy', 'colsample_bylevel': 0.03809165919534344, 'depth': 11, 'boosting_type': 'Plain', 'bootstrap_type': 'Bayesian', 'bagging_temperature': 9.37349036688875}. Best is trial 129 with value: 0.9195402298850575.
[32m[I 2023-04-26 01:17:38,697][39m Trial 146 finished with value: 0.8260869565217392 and parameters: {'objective': 'CrossEntropy', 'colsample_bylevel': 0.09497272426912598, 'depth': 10, 'boosting_type': 'Ordered', 'bootstrap_type': 'Bayesian', 'bagging_temperature': 6.863931153141261}. Best is trial 129 with value: 0.9195402298850575.
[32m[I 2023-04-26 01:17:41,789][39m Trial 147 finished with value: 0.888888888888889 and parameters: {'objective': 'CrossEntropy', 'colsample_bylevel': 0.09116300076210576, 'depth': 11, 'boosting_type': 'Plain', 'bootstrap_type': 'Bayesian', 'bagging_temperature': 7.910514308426467}. Best is trial 129 with value: 0.9195402298850575.
[32m[I 2023-04-26 01:17:44,644][39m Trial 148 finished with value: 0.888888888888889 and parameters: {'objective': 'CrossEntropy', 'colsample_bylevel': 0.08799120226000454, 'depth': 11, 'boosting_type': 'Plain', 'bootstrap_type': 'Bayesian', 'bagging_temperature': 8.964858533229727}. Best is trial 129 with value: 0.9195402298850575.
[32m[I 2023-04-26 01:17:48,585][39m Trial 149 finished with value: 0.888888888888889 and parameters: {'objective': 'CrossEntropy', 'colsample_bylevel': 0.09827315485151061, 'depth': 12, 'boosting_type': 'Plain', 'bootstrap_type': 'Bayesian', 'bagging_temperature': 9.197281481609242}. Best is trial 129 with value: 0.9195402298850575.
[32m[I 2023-04-26 01:17:52,162][39m Trial 150 finished with value: 0.8863636363636364 and parameters: {'objective': 'Logloss', 'colsample_bylevel': 0.09798518292733832, 'depth': 12, 'boosting_type': 'Plain', 'bootstrap_type': 'Bayesian', 'bagging_temperature': 8.435944614401702}. Best is trial 129 with value: 0.9195402298850575.
[32m[I 2023-04-26 01:17:55,666][39m Trial 151 finished with value: 0.8764044943820225 and parameters: {'objective': 'Logloss', 'colsample_bylevel': 0.09803324330330074, 'depth': 12, 'boosting_type': 'Plain', 'bootstrap_type': 'Bayesian', 'bagging_temperature': 8.775554942656225}. Best is trial 129 with value: 0.9195402298850575.
[32m[I 2023-04-26 01:17:56,926][39m Trial 152 finished with value: 0.7708333333333333 and parameters: {'objective': 'CrossEntropy', 'colsample_bylevel': 0.020138542224212214, 'depth': 10, 'boosting_type': 'Plain', 'bootstrap_type': 'Bayesian', 'bagging_temperature': 9.840525528789573}. Best is trial 129 with value: 0.9195402298850575.
[32m[I 2023-04-26 01:17:59,827][39m Trial 153 finished with value: 0.8695652173913043 and parameters: {'objective': 'CrossEntropy', 'colsample_bylevel': 0.09196024849218735, 'depth': 4, 'boosting_type': 'Plain', 'bootstrap_type': 'Bayesian', 'bagging_temperature': 9.510954385106345}. Best is trial 129 with value: 0.9195402298850575.
[32m[I 2023-04-26 01:18:03,500][39m Trial 154 finished with value: 0.8988764044943819 and parameters: {'objective': 'CrossEntropy', 'colsample_bylevel': 0.093868079871271, 'depth': 11, 'boosting_type': 'Plain', 'bootstrap_type': 'Bayesian', 'bagging_temperature': 9.031363381965809}. Best is trial 129 with value: 0.9195402298850575.
[32m[I 2023-04-26 01:18:06,984][39m Trial 155 finished with value: 0.8791208791208791 and parameters: {'objective': 'CrossEntropy', 'colsample_bylevel': 0.09582917067611514, 'depth': 11, 'boosting_type': 'Plain', 'bootstrap_type': 'Bayesian', 'bagging_temperature': 8.99737796566694}. Best is trial 129 with value: 0.9195402298850575.
[32m[I 2023-04-26 01:18:10,364][39m Trial 156 finished with value: 0.888888888888889 and parameters: {'objective': 'CrossEntropy', 'colsample_bylevel': 0.09373061008675204, 'depth': 12, 'boosting_type': 'Plain', 'bootstrap_type': 'Bayesian', 'bagging_temperature': 9.283204493072937}. Best is trial 129 with value: 0.9195402298850575.
[32m[I 2023-04-26 01:18:14,357][39m Trial 157 finished with value: 0.8791208791208791 and parameters: {'objective': 'Logloss', 'colsample_bylevel': 0.09975696049621169, 'depth': 12, 'boosting_type': 'Plain', 'bootstrap_type': 'Bayesian', 'bagging_temperature': 9.400349405583672}. Best is trial 129 with value: 0.9195402298850575.
[32m[I 2023-04-26 01:18:18,155][39m Trial 158 finished with value: 0.8988764044943819 and parameters: {'objective': 'Logloss', 'colsample_bylevel': 0.09625489561732022, 'depth': 11, 'boosting_type': 'Plain', 'bootstrap_type': 'Bayesian', 'bagging_temperature': 9.86678337319626}. Best is trial 129 with value: 0.9195402298850575.
[32m[I 2023-04-26 01:18:21,630][39m Trial 159 finished with value: 0.8505747126436782 and parameters: {'objective': 'Logloss', 'colsample_bylevel': 0.0960701901826523, 'depth': 11, 'boosting_type': 'Plain', 'bootstrap_type': 'Bayesian', 'bagging_temperature': 9.942818407253347}. Best is trial 129 with value: 0.9195402298850575.
[32m[I 2023-04-26 01:18:24,605][39m Trial 160 finished with value: 0.8478260869565216 and parameters: {'objective': 'Logloss', 'colsample_bylevel': 0.09372961272639249, 'depth': 5, 'boosting_type': 'Plain', 'bootstrap_type': 'Bayesian', 'bagging_temperature': 9.783714295619891}. Best is trial 129 with value: 0.9195402298850575.
[32m[I 2023-04-26 01:18:28,035][39m Trial 161 finished with value: 0.888888888888889 and parameters: {'objective': 'CrossEntropy', 'colsample_bylevel': 0.09695972807225785, 'depth': 11, 'boosting_type': 'Plain', 'bootstrap_type': 'Bayesian', 'bagging_temperature': 8.9957155195107}. Best is trial 129 with value: 0.9195402298850575.
[32m[I 2023-04-26 01:18:31,105][39m Trial 162 finished with value: 0.8666666666666666 and parameters: {'objective': 'CrossEntropy', 'colsample_bylevel': 0.09230870555946653, 'depth': 10, 'boosting_type': 'Plain', 'bootstrap_type': 'Bayesian', 'bagging_temperature': 0.8998549972325998}. Best is trial 129 with value: 0.9195402298850575.
[32m[I 2023-04-26 01:18:34,271][39m Trial 163 finished with value: 0.888888888888889 and parameters: {'objective': 'CrossEntropy', 'colsample_bylevel': 0.09483713310888646, 'depth': 11, 'boosting_type': 'Plain', 'bootstrap_type': 'Bayesian', 'bagging_temperature': 9.530716757244477}. Best is trial 129 with value: 0.9195402298850575.
[32m[I 2023-04-26 01:18:37,822][39m Trial 164 finished with value: 0.888888888888889 and parameters: {'objective': 'Logloss', 'colsample_bylevel': 0.09764982431436837, 'depth': 12, 'boosting_type': 'Plain', 'bootstrap_type': 'Bayesian', 'bagging_temperature': 8.721001956270818}. Best is trial 129 with value: 0.9195402298850575.
[32m[I 2023-04-26 01:18:41,008][39m Trial 165 finished with value: 0.8791208791208791 and parameters: {'objective': 'CrossEntropy', 'colsample_bylevel': 0.09109717856252131, 'depth': 11, 'boosting_type': 'Plain', 'bootstrap_type': 'Bayesian', 'bagging_temperature': 9.820370473147493}. Best is trial 129 with value: 0.9195402298850575.
[32m[I 2023-04-26 01:18:44,542][39m Trial 166 finished with value: 0.8988764044943819 and parameters: {'objective': 'CrossEntropy', 'colsample_bylevel': 0.0947167756294067, 'depth': 12, 'boosting_type': 'Plain', 'bootstrap_type': 'Bayesian', 'bagging_temperature': 9.228006811399522}. Best is trial 129 with value: 0.9195402298850575.
[32m[I 2023-04-26 01:18:47,776][39m Trial 167 finished with value: 0.8764044943820225 and parameters: {'objective': 'CrossEntropy', 'colsample_bylevel': 0.08864994909390206, 'depth': 12, 'boosting_type': 'Plain', 'bootstrap_type': 'Bayesian', 'bagging_temperature': 9.590043426238864}. Best is trial 129 with value: 0.9195402298850575.
[32m[I 2023-04-26 01:18:51,104][39m Trial 168 finished with value: 0.888888888888889 and parameters: {'objective': 'CrossEntropy', 'colsample_bylevel': 0.09352936151720738, 'depth': 12, 'boosting_type': 'Plain', 'bootstrap_type': 'Bayesian', 'bagging_temperature': 9.226965329556117}. Best is trial 129 with value: 0.9195402298850575.
[32m[I 2023-04-26 01:18:57,359][39m Trial 169 finished with value: 0.8260869565217392 and parameters: {'objective': 'Logloss', 'colsample_bylevel': 0.0955270331563354, 'depth': 11, 'boosting_type': 'Ordered', 'bootstrap_type': 'Bayesian', 'bagging_temperature': 5.416918617067699}. Best is trial 129 with value: 0.9195402298850575.
[32m[I 2023-04-26 01:19:00,688][39m Trial 170 finished with value: 0.8988764044943819 and parameters: {'objective': 'CrossEntropy', 'colsample_bylevel': 0.09256862342306542, 'depth': 11, 'boosting_type': 'Plain', 'bootstrap_type': 'Bayesian', 'bagging_temperature': 9.961054671536639}. Best is trial 129 with value: 0.9195402298850575.
[32m[I 2023-04-26 01:19:03,825][39m Trial 171 finished with value: 0.8604651162790697 and parameters: {'objective': 'CrossEntropy', 'colsample_bylevel': 0.09318495931229187, 'depth': 11, 'boosting_type': 'Plain', 'bootstrap_type': 'Bayesian', 'bagging_temperature': 9.911024054936785}. Best is trial 129 with value: 0.9195402298850575.
[32m[I 2023-04-26 01:19:07,367][39m Trial 172 finished with value: 0.9090909090909092 and parameters: {'objective': 'CrossEntropy', 'colsample_bylevel': 0.09597686323908361, 'depth': 11, 'boosting_type': 'Plain', 'bootstrap_type': 'Bayesian', 'bagging_temperature': 9.994196248262227}. Best is trial 129 with value: 0.9195402298850575.
[32m[I 2023-04-26 01:19:10,865][39m Trial 173 finished with value: 0.8988764044943819 and parameters: {'objective': 'CrossEntropy', 'colsample_bylevel': 0.09628381909332737, 'depth': 11, 'boosting_type': 'Plain', 'bootstrap_type': 'Bayesian', 'bagging_temperature': 9.747854504312622}. Best is trial 129 with value: 0.9195402298850575.
[32m[I 2023-04-26 01:19:14,428][39m Trial 174 finished with value: 0.8863636363636364 and parameters: {'objective': 'CrossEntropy', 'colsample_bylevel': 0.09667133223575178, 'depth': 11, 'boosting_type': 'Plain', 'bootstrap_type': 'Bayesian', 'bagging_temperature': 9.990887956960558}. Best is trial 129 with value: 0.9195402298850575.
[32m[I 2023-04-26 01:19:17,536][39m Trial 175 finished with value: 0.8764044943820225 and parameters: {'objective': 'CrossEntropy', 'colsample_bylevel': 0.09430224074694295, 'depth': 11, 'boosting_type': 'Plain', 'bootstrap_type': 'Bayesian', 'bagging_temperature': 9.595419121421239}. Best is trial 129 with value: 0.9195402298850575.
[32m[I 2023-04-26 01:19:21,200][39m Trial 176 finished with value: 0.8764044943820225 and parameters: {'objective': 'CrossEntropy', 'colsample_bylevel': 0.09999633106860654, 'depth': 11, 'boosting_type': 'Plain', 'bootstrap_type': 'Bayesian', 'bagging_temperature': 9.39449938980161}. Best is trial 129 with value: 0.9195402298850575.
[32m[I 2023-04-26 01:19:24,628][39m Trial 177 finished with value: 0.8988764044943819 and parameters: {'objective': 'CrossEntropy', 'colsample_bylevel': 0.09204226996992498, 'depth': 11, 'boosting_type': 'Plain', 'bootstrap_type': 'Bayesian', 'bagging_temperature': 9.03414079426922}. Best is trial 129 with value: 0.9195402298850575.
[32m[I 2023-04-26 01:19:28,010][39m Trial 178 finished with value: 0.9195402298850575 and parameters: {'objective': 'CrossEntropy', 'colsample_bylevel': 0.09181420357040103, 'depth': 11, 'boosting_type': 'Plain', 'bootstrap_type': 'Bayesian', 'bagging_temperature': 8.984965430530004}. Best is trial 129 with value: 0.9195402298850575.
[32m[I 2023-04-26 01:19:30,830][39m Trial 179 finished with value: 0.8791208791208791 and parameters: {'objective': 'CrossEntropy', 'colsample_bylevel': 0.08596174232984502, 'depth': 11, 'boosting_type': 'Plain', 'bootstrap_type': 'Bayesian', 'bagging_temperature': 9.024808453395213}. Best is trial 129 with value: 0.9195402298850575.
[32m[I 2023-04-26 01:19:33,907][39m Trial 180 finished with value: 0.888888888888889 and parameters: {'objective': 'CrossEntropy', 'colsample_bylevel': 0.08951240329826449, 'depth': 11, 'boosting_type': 'Plain', 'bootstrap_type': 'Bayesian', 'bagging_temperature': 8.533462223143081}. Best is trial 129 with value: 0.9195402298850575.
[32m[I 2023-04-26 01:19:37,131][39m Trial 181 finished with value: 0.8604651162790697 and parameters: {'objective': 'CrossEntropy', 'colsample_bylevel': 0.09178159118127252, 'depth': 11, 'boosting_type': 'Plain', 'bootstrap_type': 'Bayesian', 'bagging_temperature': 9.711672066421881}. Best is trial 129 with value: 0.9195402298850575.
[32m[I 2023-04-26 01:19:40,429][39m Trial 182 finished with value: 0.888888888888889 and parameters: {'objective': 'CrossEntropy', 'colsample_bylevel': 0.0928411683534987, 'depth': 11, 'boosting_type': 'Plain', 'bootstrap_type': 'Bayesian', 'bagging_temperature': 9.174841805513006}. Best is trial 129 with value: 0.9195402298850575.
[32m[I 2023-04-26 01:19:43,620][39m Trial 183 finished with value: 0.888888888888889 and parameters: {'objective': 'CrossEntropy', 'colsample_bylevel': 0.09751483561485647, 'depth': 11, 'boosting_type': 'Plain', 'bootstrap_type': 'Bayesian', 'bagging_temperature': 8.886947988130743}. Best is trial 129 with value: 0.9195402298850575.
[32m[I 2023-04-26 01:19:46,762][39m Trial 184 finished with value: 0.8764044943820225 and parameters: {'objective': 'CrossEntropy', 'colsample_bylevel': 0.09072675283421588, 'depth': 11, 'boosting_type': 'Plain', 'bootstrap_type': 'Bayesian', 'bagging_temperature': 9.344835545697066}. Best is trial 129 with value: 0.9195402298850575.
[32m[I 2023-04-26 01:19:49,998][39m Trial 185 finished with value: 0.8988764044943819 and parameters: {'objective': 'CrossEntropy', 'colsample_bylevel': 0.09464168430058348, 'depth': 12, 'boosting_type': 'Plain', 'bootstrap_type': 'Bayesian', 'bagging_temperature': 9.73405085796397}. Best is trial 129 with value: 0.9195402298850575.
[32m[I 2023-04-26 01:19:53,296][39m Trial 186 finished with value: 0.8837209302325582 and parameters: {'objective': 'CrossEntropy', 'colsample_bylevel': 0.09640203435433513, 'depth': 11, 'boosting_type': 'Plain', 'bootstrap_type': 'Bayesian', 'bagging_temperature': 9.752984598013164}. Best is trial 129 with value: 0.9195402298850575.
[32m[I 2023-04-26 01:19:56,250][39m Trial 187 finished with value: 0.8791208791208791 and parameters: {'objective': 'CrossEntropy', 'colsample_bylevel': 0.08802207936825057, 'depth': 12, 'boosting_type': 'Plain', 'bootstrap_type': 'Bayesian', 'bagging_temperature': 9.532150913858711}. Best is trial 129 with value: 0.9195402298850575.
[32m[I 2023-04-26 01:19:57,775][39m Trial 188 finished with value: 0.7474747474747474 and parameters: {'objective': 'CrossEntropy', 'colsample_bylevel': 0.09802489782704665, 'depth': 1, 'boosting_type': 'Plain', 'bootstrap_type': 'Bayesian', 'bagging_temperature': 9.146072375559111}. Best is trial 129 with value: 0.9195402298850575.
[32m[I 2023-04-26 01:20:01,340][39m Trial 189 finished with value: 0.8764044943820225 and parameters: {'objective': 'CrossEntropy', 'colsample_bylevel': 0.09402232977685544, 'depth': 12, 'boosting_type': 'Plain', 'bootstrap_type': 'Bayesian', 'bagging_temperature': 8.30897551254057}. Best is trial 129 with value: 0.9195402298850575.
[32m[I 2023-04-26 01:20:04,648][39m Trial 190 finished with value: 0.8695652173913043 and parameters: {'objective': 'CrossEntropy', 'colsample_bylevel': 0.09484387145694627, 'depth': 12, 'boosting_type': 'Plain', 'bootstrap_type': 'Bayesian', 'bagging_temperature': 9.733959230066306}. Best is trial 129 with value: 0.9195402298850575.
[32m[I 2023-04-26 01:20:07,679][39m Trial 191 finished with value: 0.888888888888889 and parameters: {'objective': 'CrossEntropy', 'colsample_bylevel': 0.09093928955049863, 'depth': 12, 'boosting_type': 'Plain', 'bootstrap_type': 'Bayesian', 'bagging_temperature': 9.49887627131294}. Best is trial 129 with value: 0.9195402298850575.
[32m[I 2023-04-26 01:20:11,280][39m Trial 192 finished with value: 0.8988764044943819 and parameters: {'objective': 'CrossEntropy', 'colsample_bylevel': 0.0924843701733058, 'depth': 11, 'boosting_type': 'Plain', 'bootstrap_type': 'Bayesian', 'bagging_temperature': 9.30650572246193}. Best is trial 129 with value: 0.9195402298850575.
[32m[I 2023-04-26 01:20:14,494][39m Trial 193 finished with value: 0.888888888888889 and parameters: {'objective': 'CrossEntropy', 'colsample_bylevel': 0.09246614761074327, 'depth': 11, 'boosting_type': 'Plain', 'bootstrap_type': 'Bayesian', 'bagging_temperature': 8.904574804579484}. Best is trial 129 with value: 0.9195402298850575.
[32m[I 2023-04-26 01:20:17,776][39m Trial 194 finished with value: 0.8791208791208791 and parameters: {'objective': 'CrossEntropy', 'colsample_bylevel': 0.08938393450828708, 'depth': 12, 'boosting_type': 'Plain', 'bootstrap_type': 'Bayesian', 'bagging_temperature': 9.30321506515733}. Best is trial 129 with value: 0.9195402298850575.
[32m[I 2023-04-26 01:20:21,133][39m Trial 195 finished with value: 0.8372093023255814 and parameters: {'objective': 'CrossEntropy', 'colsample_bylevel': 0.09627327162316712, 'depth': 10, 'boosting_type': 'Plain', 'bootstrap_type': 'Bayesian', 'bagging_temperature': 9.961866013824713}. Best is trial 129 with value: 0.9195402298850575.
[32m[I 2023-04-26 01:20:24,625][39m Trial 196 finished with value: 0.9090909090909092 and parameters: {'objective': 'CrossEntropy', 'colsample_bylevel': 0.09842717378061802, 'depth': 11, 'boosting_type': 'Plain', 'bootstrap_type': 'Bayesian', 'bagging_temperature': 9.646413112787176}. Best is trial 129 with value: 0.9195402298850575.
[32m[I 2023-04-26 01:20:27,934][39m Trial 197 finished with value: 0.8604651162790697 and parameters: {'objective': 'CrossEntropy', 'colsample_bylevel': 0.09236233436338778, 'depth': 11, 'boosting_type': 'Plain', 'bootstrap_type': 'Bayesian', 'bagging_temperature': 8.611797025392535}. Best is trial 129 with value: 0.9195402298850575.
[32m[I 2023-04-26 01:20:31,663][39m Trial 198 finished with value: 0.8988764044943819 and parameters: {'objective': 'CrossEntropy', 'colsample_bylevel': 0.09848617752620575, 'depth': 12, 'boosting_type': 'Plain', 'bootstrap_type': 'Bayesian', 'bagging_temperature': 9.701308079942192}. Best is trial 129 with value: 0.9195402298850575.
