[32m[I 2023-04-26 01:24:25,827][39m Trial 264 finished with value: 0.8735632183908046 and parameters: {'objective': 'CrossEntropy', 'colsample_bylevel': 0.09641944699516988, 'depth': 12, 'boosting_type': 'Plain', 'bootstrap_type': 'Bayesian', 'bagging_temperature': 7.078901777877625}. Best is trial 129 with value: 0.9195402298850575.
[32m[I 2023-04-26 01:24:31,858][39m Trial 265 finished with value: 0.8 and parameters: {'objective': 'CrossEntropy', 'colsample_bylevel': 0.09293141394115101, 'depth': 12, 'boosting_type': 'Ordered', 'bootstrap_type': 'Bayesian', 'bagging_temperature': 9.628424594198881}. Best is trial 129 with value: 0.9195402298850575.
[32m[I 2023-04-26 01:24:35,378][39m Trial 266 finished with value: 0.888888888888889 and parameters: {'objective': 'Logloss', 'colsample_bylevel': 0.09511218434962512, 'depth': 11, 'boosting_type': 'Plain', 'bootstrap_type': 'MVS'}. Best is trial 129 with value: 0.9195402298850575.
[32m[I 2023-04-26 01:24:39,006][39m Trial 267 finished with value: 0.888888888888889 and parameters: {'objective': 'CrossEntropy', 'colsample_bylevel': 0.09992808091049012, 'depth': 12, 'boosting_type': 'Plain', 'bootstrap_type': 'Bayesian', 'bagging_temperature': 8.966232448972788}. Best is trial 129 with value: 0.9195402298850575.
[32m[I 2023-04-26 01:24:42,910][39m Trial 268 finished with value: 0.8791208791208791 and parameters: {'objective': 'CrossEntropy', 'colsample_bylevel': 0.09898647146919659, 'depth': 12, 'boosting_type': 'Plain', 'bootstrap_type': 'Bayesian', 'bagging_temperature': 9.058599432759248}. Best is trial 129 with value: 0.9195402298850575.
[32m[I 2023-04-26 01:24:46,147][39m Trial 269 finished with value: 0.8764044943820225 and parameters: {'objective': 'CrossEntropy', 'colsample_bylevel': 0.09395913867345974, 'depth': 10, 'boosting_type': 'Plain', 'bootstrap_type': 'Bayesian', 'bagging_temperature': 5.688474446265971}. Best is trial 129 with value: 0.9195402298850575.
[32m[I 2023-04-26 01:24:49,584][39m Trial 270 finished with value: 0.8988764044943819 and parameters: {'objective': 'CrossEntropy', 'colsample_bylevel': 0.09726167440247831, 'depth': 12, 'boosting_type': 'Plain', 'bootstrap_type': 'Bayesian', 'bagging_temperature': 9.810093301447035}. Best is trial 129 with value: 0.9195402298850575.
[32m[I 2023-04-26 01:24:50,773][39m Trial 271 finished with value: 0.78 and parameters: {'objective': 'CrossEntropy', 'colsample_bylevel': 0.022135596439340564, 'depth': 11, 'boosting_type': 'Plain', 'bootstrap_type': 'Bayesian', 'bagging_temperature': 9.465937163235063}. Best is trial 129 with value: 0.9195402298850575.
[32m[I 2023-04-26 01:24:54,426][39m Trial 272 finished with value: 0.8604651162790697 and parameters: {'objective': 'CrossEntropy', 'colsample_bylevel': 0.09535781954567304, 'depth': 12, 'boosting_type': 'Plain', 'bootstrap_type': 'Bayesian', 'bagging_temperature': 9.992111947026592}. Best is trial 129 with value: 0.9195402298850575.
[32m[I 2023-04-26 01:24:57,867][39m Trial 273 finished with value: 0.8863636363636364 and parameters: {'objective': 'CrossEntropy', 'colsample_bylevel': 0.09065640133237458, 'depth': 12, 'boosting_type': 'Plain', 'bootstrap_type': 'Bayesian', 'bagging_temperature': 3.0944411818313977}. Best is trial 129 with value: 0.9195402298850575.
[32m[I 2023-04-26 01:25:01,246][39m Trial 274 finished with value: 0.8705882352941177 and parameters: {'objective': 'CrossEntropy', 'colsample_bylevel': 0.09570060774189608, 'depth': 12, 'boosting_type': 'Plain', 'bootstrap_type': 'Bayesian', 'bagging_temperature': 9.620793700956428}. Best is trial 129 with value: 0.9195402298850575.
[32m[I 2023-04-26 01:25:05,104][39m Trial 275 finished with value: 0.8791208791208791 and parameters: {'objective': 'CrossEntropy', 'colsample_bylevel': 0.09997646408704436, 'depth': 12, 'boosting_type': 'Plain', 'bootstrap_type': 'Bayesian', 'bagging_temperature': 9.338962917706798}. Best is trial 129 with value: 0.9195402298850575.
[32m[I 2023-04-26 01:25:08,458][39m Trial 276 finished with value: 0.8863636363636364 and parameters: {'objective': 'Logloss', 'colsample_bylevel': 0.0927202881811172, 'depth': 11, 'boosting_type': 'Plain', 'bootstrap_type': 'Bayesian', 'bagging_temperature': 9.220368073825865}. Best is trial 129 with value: 0.9195402298850575.
[32m[I 2023-04-26 01:25:11,768][39m Trial 277 finished with value: 0.8764044943820225 and parameters: {'objective': 'CrossEntropy', 'colsample_bylevel': 0.08905121260992185, 'depth': 11, 'boosting_type': 'Plain', 'bootstrap_type': 'Bayesian', 'bagging_temperature': 9.565575864383632}. Best is trial 129 with value: 0.9195402298850575.
[32m[I 2023-04-26 01:25:15,641][39m Trial 278 finished with value: 0.8988764044943819 and parameters: {'objective': 'CrossEntropy', 'colsample_bylevel': 0.09749647584508359, 'depth': 12, 'boosting_type': 'Plain', 'bootstrap_type': 'Bayesian', 'bagging_temperature': 9.736403369042971}. Best is trial 129 with value: 0.9195402298850575.
[32m[I 2023-04-26 01:25:19,177][39m Trial 279 finished with value: 0.8863636363636364 and parameters: {'objective': 'Logloss', 'colsample_bylevel': 0.0977980538625002, 'depth': 10, 'boosting_type': 'Plain', 'bootstrap_type': 'Bayesian', 'bagging_temperature': 9.595393917560072}. Best is trial 129 with value: 0.9195402298850575.
[32m[I 2023-04-26 01:25:22,541][39m Trial 280 finished with value: 0.8863636363636364 and parameters: {'objective': 'CrossEntropy', 'colsample_bylevel': 0.0959750570663583, 'depth': 11, 'boosting_type': 'Plain', 'bootstrap_type': 'Bayesian', 'bagging_temperature': 9.860433269425581}. Best is trial 129 with value: 0.9195402298850575.
[32m[I 2023-04-26 01:25:25,604][39m Trial 281 finished with value: 0.8988764044943819 and parameters: {'objective': 'CrossEntropy', 'colsample_bylevel': 0.09019671112680594, 'depth': 11, 'boosting_type': 'Plain', 'bootstrap_type': 'Bayesian', 'bagging_temperature': 9.159292313299707}. Best is trial 129 with value: 0.9195402298850575.
[32m[I 2023-04-26 01:25:28,921][39m Trial 282 finished with value: 0.888888888888889 and parameters: {'objective': 'CrossEntropy', 'colsample_bylevel': 0.09487352465804916, 'depth': 12, 'boosting_type': 'Plain', 'bootstrap_type': 'Bayesian', 'bagging_temperature': 8.991924661655705}. Best is trial 129 with value: 0.9195402298850575.
[32m[I 2023-04-26 01:25:32,073][39m Trial 283 finished with value: 0.8863636363636364 and parameters: {'objective': 'CrossEntropy', 'colsample_bylevel': 0.09314218559426693, 'depth': 11, 'boosting_type': 'Plain', 'bootstrap_type': 'Bayesian', 'bagging_temperature': 6.610909797092747}. Best is trial 129 with value: 0.9195402298850575.
[32m[I 2023-04-26 01:25:35,906][39m Trial 284 finished with value: 0.888888888888889 and parameters: {'objective': 'CrossEntropy', 'colsample_bylevel': 0.0978034626805743, 'depth': 12, 'boosting_type': 'Plain', 'bootstrap_type': 'Bayesian', 'bagging_temperature': 9.37192794673694}. Best is trial 129 with value: 0.9195402298850575.
[32m[I 2023-04-26 01:25:42,446][39m Trial 285 finished with value: 0.7912087912087912 and parameters: {'objective': 'CrossEntropy', 'colsample_bylevel': 0.09605013216602253, 'depth': 12, 'boosting_type': 'Ordered', 'bootstrap_type': 'Bayesian', 'bagging_temperature': 9.629834999462204}. Best is trial 129 with value: 0.9195402298850575.
[32m[I 2023-04-26 01:25:45,843][39m Trial 286 finished with value: 0.8636363636363636 and parameters: {'objective': 'CrossEntropy', 'colsample_bylevel': 0.09344283513805998, 'depth': 11, 'boosting_type': 'Plain', 'bootstrap_type': 'MVS'}. Best is trial 129 with value: 0.9195402298850575.
[32m[I 2023-04-26 01:25:49,655][39m Trial 287 finished with value: 0.8863636363636364 and parameters: {'objective': 'CrossEntropy', 'colsample_bylevel': 0.09951269259234909, 'depth': 12, 'boosting_type': 'Plain', 'bootstrap_type': 'Bayesian', 'bagging_temperature': 8.404880093421493}. Best is trial 129 with value: 0.9195402298850575.
[32m[I 2023-04-26 01:25:52,849][39m Trial 288 finished with value: 0.8791208791208791 and parameters: {'objective': 'CrossEntropy', 'colsample_bylevel': 0.09138269971590714, 'depth': 11, 'boosting_type': 'Plain', 'bootstrap_type': 'Bayesian', 'bagging_temperature': 8.68881489972728}. Best is trial 129 with value: 0.9195402298850575.
[32m[I 2023-04-26 01:25:55,708][39m Trial 289 finished with value: 0.8666666666666666 and parameters: {'objective': 'CrossEntropy', 'colsample_bylevel': 0.091382502612003, 'depth': 5, 'boosting_type': 'Plain', 'bootstrap_type': 'Bayesian', 'bagging_temperature': 9.063230813686591}. Best is trial 129 with value: 0.9195402298850575.
[32m[I 2023-04-26 01:25:57,153][39m Trial 290 finished with value: 0.8421052631578947 and parameters: {'objective': 'CrossEntropy', 'colsample_bylevel': 0.038413816720238796, 'depth': 11, 'boosting_type': 'Plain', 'bootstrap_type': 'Bayesian', 'bagging_temperature': 8.851632688277759}. Best is trial 129 with value: 0.9195402298850575.
[32m[I 2023-04-26 01:26:00,320][39m Trial 291 finished with value: 0.888888888888889 and parameters: {'objective': 'Logloss', 'colsample_bylevel': 0.0871530875025753, 'depth': 11, 'boosting_type': 'Plain', 'bootstrap_type': 'Bayesian', 'bagging_temperature': 9.433275300651138}. Best is trial 129 with value: 0.9195402298850575.
[32m[I 2023-04-26 01:26:03,766][39m Trial 292 finished with value: 0.888888888888889 and parameters: {'objective': 'CrossEntropy', 'colsample_bylevel': 0.09378307156464352, 'depth': 12, 'boosting_type': 'Plain', 'bootstrap_type': 'Bayesian', 'bagging_temperature': 9.85242523137348}. Best is trial 129 with value: 0.9195402298850575.
[32m[I 2023-04-26 01:26:06,648][39m Trial 293 finished with value: 0.8764044943820225 and parameters: {'objective': 'CrossEntropy', 'colsample_bylevel': 0.08856805914680908, 'depth': 11, 'boosting_type': 'Plain', 'bootstrap_type': 'Bayesian', 'bagging_temperature': 9.675504416467254}. Best is trial 129 with value: 0.9195402298850575.
[32m[I 2023-04-26 01:26:10,059][39m Trial 294 finished with value: 0.8764044943820225 and parameters: {'objective': 'CrossEntropy', 'colsample_bylevel': 0.0947021015329031, 'depth': 12, 'boosting_type': 'Plain', 'bootstrap_type': 'Bayesian', 'bagging_temperature': 9.428365073442887}. Best is trial 129 with value: 0.9195402298850575.
[32m[I 2023-04-26 01:26:14,109][39m Trial 295 finished with value: 0.888888888888889 and parameters: {'objective': 'CrossEntropy', 'colsample_bylevel': 0.09738629523985032, 'depth': 12, 'boosting_type': 'Plain', 'bootstrap_type': 'Bayesian', 'bagging_temperature': 7.363214928513852}. Best is trial 129 with value: 0.9195402298850575.
[32m[I 2023-04-26 01:26:17,469][39m Trial 296 finished with value: 0.888888888888889 and parameters: {'objective': 'CrossEntropy', 'colsample_bylevel': 0.09226594248197367, 'depth': 11, 'boosting_type': 'Plain', 'bootstrap_type': 'Bayesian', 'bagging_temperature': 9.013129221204052}. Best is trial 129 with value: 0.9195402298850575.
[32m[I 2023-04-26 01:26:21,078][39m Trial 297 finished with value: 0.8988764044943819 and parameters: {'objective': 'CrossEntropy', 'colsample_bylevel': 0.09814575526746122, 'depth': 11, 'boosting_type': 'Plain', 'bootstrap_type': 'Bayesian', 'bagging_temperature': 9.196234053523876}. Best is trial 129 with value: 0.9195402298850575.
[32m[I 2023-04-26 01:26:24,487][39m Trial 298 finished with value: 0.888888888888889 and parameters: {'objective': 'Logloss', 'colsample_bylevel': 0.0952835432287513, 'depth': 11, 'boosting_type': 'Plain', 'bootstrap_type': 'Bayesian', 'bagging_temperature': 9.191729911205549}. Best is trial 129 with value: 0.9195402298850575.
[32m[I 2023-04-26 01:26:27,696][39m Trial 299 finished with value: 0.8604651162790697 and parameters: {'objective': 'CrossEntropy', 'colsample_bylevel': 0.09390776928754606, 'depth': 12, 'boosting_type': 'Plain', 'bootstrap_type': 'Bayesian', 'bagging_temperature': 8.15020866308676}. Best is trial 129 with value: 0.9195402298850575.
[32m[I 2023-04-26 01:26:31,183][39m Trial 300 finished with value: 0.8764044943820225 and parameters: {'objective': 'CrossEntropy', 'colsample_bylevel': 0.09653831968136316, 'depth': 12, 'boosting_type': 'Plain', 'bootstrap_type': 'Bayesian', 'bagging_temperature': 8.761895282461689}. Best is trial 129 with value: 0.9195402298850575.
[32m[I 2023-04-26 01:26:34,899][39m Trial 301 finished with value: 0.8988764044943819 and parameters: {'objective': 'CrossEntropy', 'colsample_bylevel': 0.09875519172084328, 'depth': 12, 'boosting_type': 'Plain', 'bootstrap_type': 'Bayesian', 'bagging_temperature': 9.393237727859312}. Best is trial 129 with value: 0.9195402298850575.
[32m[I 2023-04-26 01:26:38,120][39m Trial 302 finished with value: 0.8666666666666666 and parameters: {'objective': 'CrossEntropy', 'colsample_bylevel': 0.09801095448723766, 'depth': 6, 'boosting_type': 'Plain', 'bootstrap_type': 'Bayesian', 'bagging_temperature': 9.39474286458668}. Best is trial 129 with value: 0.9195402298850575.
[32m[I 2023-04-26 01:26:44,155][39m Trial 303 finished with value: 0.8172043010752689 and parameters: {'objective': 'CrossEntropy', 'colsample_bylevel': 0.09606443682154435, 'depth': 10, 'boosting_type': 'Ordered', 'bootstrap_type': 'Bayesian', 'bagging_temperature': 9.213700381263832}. Best is trial 129 with value: 0.9195402298850575.
[32m[I 2023-04-26 01:26:47,736][39m Trial 304 finished with value: 0.9090909090909092 and parameters: {'objective': 'CrossEntropy', 'colsample_bylevel': 0.09522259856857324, 'depth': 12, 'boosting_type': 'Plain', 'bootstrap_type': 'Bayesian', 'bagging_temperature': 8.891417323915068}. Best is trial 129 with value: 0.9195402298850575.
[32m[I 2023-04-26 01:26:51,469][39m Trial 305 finished with value: 0.888888888888889 and parameters: {'objective': 'CrossEntropy', 'colsample_bylevel': 0.09973570113787884, 'depth': 12, 'boosting_type': 'Plain', 'bootstrap_type': 'Bayesian', 'bagging_temperature': 8.924176867543189}. Best is trial 129 with value: 0.9195402298850575.
[32m[I 2023-04-26 01:26:54,907][39m Trial 306 finished with value: 0.8988764044943819 and parameters: {'objective': 'CrossEntropy', 'colsample_bylevel': 0.0939961512602852, 'depth': 12, 'boosting_type': 'Plain', 'bootstrap_type': 'Bayesian', 'bagging_temperature': 8.759034640325854}. Best is trial 129 with value: 0.9195402298850575.
[32m[I 2023-04-26 01:26:58,158][39m Trial 307 finished with value: 0.9090909090909092 and parameters: {'objective': 'CrossEntropy', 'colsample_bylevel': 0.0961148394865698, 'depth': 12, 'boosting_type': 'Plain', 'bootstrap_type': 'Bayesian', 'bagging_temperature': 8.640315862541163}. Best is trial 129 with value: 0.9195402298850575.
[32m[I 2023-04-26 01:27:01,727][39m Trial 308 finished with value: 0.8539325842696629 and parameters: {'objective': 'CrossEntropy', 'colsample_bylevel': 0.09634713567773019, 'depth': 12, 'boosting_type': 'Plain', 'bootstrap_type': 'Bayesian', 'bagging_temperature': 8.536561380236673}. Best is trial 129 with value: 0.9195402298850575.
[32m[I 2023-04-26 01:27:05,558][39m Trial 309 finished with value: 0.8764044943820225 and parameters: {'objective': 'Logloss', 'colsample_bylevel': 0.09642666812206035, 'depth': 12, 'boosting_type': 'Plain', 'bootstrap_type': 'Bayesian', 'bagging_temperature': 1.681461434637824}. Best is trial 129 with value: 0.9195402298850575.
[32m[I 2023-04-26 01:27:08,412][39m Trial 310 finished with value: 0.8314606741573034 and parameters: {'objective': 'CrossEntropy', 'colsample_bylevel': 0.0903583283336897, 'depth': 4, 'boosting_type': 'Plain', 'bootstrap_type': 'MVS'}. Best is trial 129 with value: 0.9195402298850575.
[32m[I 2023-04-26 01:27:12,047][39m Trial 311 finished with value: 0.8735632183908046 and parameters: {'objective': 'CrossEntropy', 'colsample_bylevel': 0.09487924196265952, 'depth': 12, 'boosting_type': 'Plain', 'bootstrap_type': 'Bayesian', 'bagging_temperature': 8.491258410895169}. Best is trial 129 with value: 0.9195402298850575.
[32m[I 2023-04-26 01:27:15,173][39m Trial 312 finished with value: 0.8666666666666666 and parameters: {'objective': 'CrossEntropy', 'colsample_bylevel': 0.08958884443420644, 'depth': 12, 'boosting_type': 'Plain', 'bootstrap_type': 'Bayesian', 'bagging_temperature': 9.141041997234712}. Best is trial 129 with value: 0.9195402298850575.
[32m[I 2023-04-26 01:27:18,924][39m Trial 313 finished with value: 0.8965517241379309 and parameters: {'objective': 'CrossEntropy', 'colsample_bylevel': 0.09855607513852647, 'depth': 12, 'boosting_type': 'Plain', 'bootstrap_type': 'Bayesian', 'bagging_temperature': 9.528480564216022}. Best is trial 129 with value: 0.9195402298850575.
[32m[I 2023-04-26 01:27:22,718][39m Trial 314 finished with value: 0.8863636363636364 and parameters: {'objective': 'Logloss', 'colsample_bylevel': 0.09627451215427499, 'depth': 12, 'boosting_type': 'Plain', 'bootstrap_type': 'Bayesian', 'bagging_temperature': 9.992662891553655}. Best is trial 129 with value: 0.9195402298850575.
[32m[I 2023-04-26 01:27:25,896][39m Trial 315 finished with value: 0.888888888888889 and parameters: {'objective': 'CrossEntropy', 'colsample_bylevel': 0.09289607562944527, 'depth': 12, 'boosting_type': 'Plain', 'bootstrap_type': 'Bayesian', 'bagging_temperature': 8.748949378038184}. Best is trial 129 with value: 0.9195402298850575.
[32m[I 2023-04-26 01:27:29,163][39m Trial 316 finished with value: 0.888888888888889 and parameters: {'objective': 'CrossEntropy', 'colsample_bylevel': 0.0946559177161161, 'depth': 12, 'boosting_type': 'Plain', 'bootstrap_type': 'Bayesian', 'bagging_temperature': 8.976329295818518}. Best is trial 129 with value: 0.9195402298850575.
[32m[I 2023-04-26 01:27:32,461][39m Trial 317 finished with value: 0.9090909090909092 and parameters: {'objective': 'CrossEntropy', 'colsample_bylevel': 0.09128958789063596, 'depth': 12, 'boosting_type': 'Plain', 'bootstrap_type': 'Bayesian', 'bagging_temperature': 9.320460019768648}. Best is trial 129 with value: 0.9195402298850575.
[32m[I 2023-04-26 01:27:35,698][39m Trial 318 finished with value: 0.8764044943820225 and parameters: {'objective': 'CrossEntropy', 'colsample_bylevel': 0.0912518977727875, 'depth': 11, 'boosting_type': 'Plain', 'bootstrap_type': 'Bayesian', 'bagging_temperature': 8.89396989083094}. Best is trial 129 with value: 0.9195402298850575.
[32m[I 2023-04-26 01:27:39,075][39m Trial 319 finished with value: 0.8791208791208791 and parameters: {'objective': 'CrossEntropy', 'colsample_bylevel': 0.08991139863806774, 'depth': 12, 'boosting_type': 'Plain', 'bootstrap_type': 'Bayesian', 'bagging_temperature': 9.230527887441866}. Best is trial 129 with value: 0.9195402298850575.
[32m[I 2023-04-26 01:27:42,235][39m Trial 320 finished with value: 0.8791208791208791 and parameters: {'objective': 'CrossEntropy', 'colsample_bylevel': 0.09335711190387931, 'depth': 11, 'boosting_type': 'Plain', 'bootstrap_type': 'Bayesian', 'bagging_temperature': 9.682741410547926}. Best is trial 129 with value: 0.9195402298850575.
[32m[I 2023-04-26 01:27:45,420][39m Trial 321 finished with value: 0.8666666666666666 and parameters: {'objective': 'Logloss', 'colsample_bylevel': 0.09458031890090077, 'depth': 10, 'boosting_type': 'Plain', 'bootstrap_type': 'Bayesian', 'bagging_temperature': 4.862136755517937}. Best is trial 129 with value: 0.9195402298850575.
[32m[I 2023-04-26 01:27:48,352][39m Trial 322 finished with value: 0.888888888888889 and parameters: {'objective': 'CrossEntropy', 'colsample_bylevel': 0.09111725777752192, 'depth': 11, 'boosting_type': 'Plain', 'bootstrap_type': 'Bayesian', 'bagging_temperature': 9.154914541239913}. Best is trial 129 with value: 0.9195402298850575.
[32m[I 2023-04-26 01:27:51,890][39m Trial 323 finished with value: 0.888888888888889 and parameters: {'objective': 'CrossEntropy', 'colsample_bylevel': 0.09693662278806926, 'depth': 12, 'boosting_type': 'Plain', 'bootstrap_type': 'Bayesian', 'bagging_temperature': 9.716138548113568}. Best is trial 129 with value: 0.9195402298850575.
[32m[I 2023-04-26 01:27:57,999][39m Trial 324 finished with value: 0.8 and parameters: {'objective': 'CrossEntropy', 'colsample_bylevel': 0.09333754528574238, 'depth': 12, 'boosting_type': 'Ordered', 'bootstrap_type': 'Bayesian', 'bagging_temperature': 9.038075940713428}. Best is trial 129 with value: 0.9195402298850575.
[32m[I 2023-04-26 01:28:01,621][39m Trial 325 finished with value: 0.8863636363636364 and parameters: {'objective': 'CrossEntropy', 'colsample_bylevel': 0.0920438730372221, 'depth': 12, 'boosting_type': 'Plain', 'bootstrap_type': 'Bayesian', 'bagging_temperature': 8.989512417556412}. Best is trial 129 with value: 0.9195402298850575.
[32m[I 2023-04-26 01:28:05,278][39m Trial 326 finished with value: 0.8988764044943819 and parameters: {'objective': 'CrossEntropy', 'colsample_bylevel': 0.09770304168217075, 'depth': 12, 'boosting_type': 'Plain', 'bootstrap_type': 'Bayesian', 'bagging_temperature': 9.99248694279718}. Best is trial 129 with value: 0.9195402298850575.
[32m[I 2023-04-26 01:28:09,139][39m Trial 327 finished with value: 0.888888888888889 and parameters: {'objective': 'CrossEntropy', 'colsample_bylevel': 0.0983196107704766, 'depth': 12, 'boosting_type': 'Plain', 'bootstrap_type': 'Bayesian', 'bagging_temperature': 9.788498887294509}. Best is trial 129 with value: 0.9195402298850575.
[32m[I 2023-04-26 01:28:13,160][39m Trial 328 finished with value: 0.888888888888889 and parameters: {'objective': 'CrossEntropy', 'colsample_bylevel': 0.09606696000593498, 'depth': 12, 'boosting_type': 'Plain', 'bootstrap_type': 'Bayesian', 'bagging_temperature': 9.518730485711892}. Best is trial 129 with value: 0.9195402298850575.
