[32m[I 2023-04-26 01:20:34,134][39m Trial 199 finished with value: 0.8297872340425531 and parameters: {'objective': 'CrossEntropy', 'colsample_bylevel': 0.09980641928658643, 'depth': 3, 'boosting_type': 'Plain', 'bootstrap_type': 'Bayesian', 'bagging_temperature': 9.997642120272621}. Best is trial 129 with value: 0.9195402298850575.
[32m[I 2023-04-26 01:20:40,444][39m Trial 200 finished with value: 0.8478260869565216 and parameters: {'objective': 'CrossEntropy', 'colsample_bylevel': 0.09846933918366049, 'depth': 10, 'boosting_type': 'Ordered', 'bootstrap_type': 'Bayesian', 'bagging_temperature': 9.571415699118335}. Best is trial 129 with value: 0.9195402298850575.
[32m[I 2023-04-26 01:20:43,747][39m Trial 201 finished with value: 0.8764044943820225 and parameters: {'objective': 'CrossEntropy', 'colsample_bylevel': 0.09592712574780021, 'depth': 11, 'boosting_type': 'Plain', 'bootstrap_type': 'Bayesian', 'bagging_temperature': 9.73754500256649}. Best is trial 129 with value: 0.9195402298850575.
[32m[I 2023-04-26 01:20:47,067][39m Trial 202 finished with value: 0.8735632183908046 and parameters: {'objective': 'CrossEntropy', 'colsample_bylevel': 0.09430073386710769, 'depth': 11, 'boosting_type': 'Plain', 'bootstrap_type': 'Bayesian', 'bagging_temperature': 9.13669124364313}. Best is trial 129 with value: 0.9195402298850575.
[32m[I 2023-04-26 01:20:50,310][39m Trial 203 finished with value: 0.9195402298850575 and parameters: {'objective': 'CrossEntropy', 'colsample_bylevel': 0.09282838302337637, 'depth': 11, 'boosting_type': 'Plain', 'bootstrap_type': 'Bayesian', 'bagging_temperature': 9.350697519396181}. Best is trial 129 with value: 0.9195402298850575.
[32m[I 2023-04-26 01:20:53,704][39m Trial 204 finished with value: 0.888888888888889 and parameters: {'objective': 'CrossEntropy', 'colsample_bylevel': 0.09695861240002938, 'depth': 12, 'boosting_type': 'Plain', 'bootstrap_type': 'Bayesian', 'bagging_temperature': 9.767723284441344}. Best is trial 129 with value: 0.9195402298850575.
[32m[I 2023-04-26 01:20:57,388][39m Trial 205 finished with value: 0.8791208791208791 and parameters: {'objective': 'CrossEntropy', 'colsample_bylevel': 0.0977926051416815, 'depth': 11, 'boosting_type': 'Plain', 'bootstrap_type': 'MVS'}. Best is trial 129 with value: 0.9195402298850575.
[32m[I 2023-04-26 01:21:00,945][39m Trial 206 finished with value: 0.8988764044943819 and parameters: {'objective': 'CrossEntropy', 'colsample_bylevel': 0.09878833504556887, 'depth': 11, 'boosting_type': 'Plain', 'bootstrap_type': 'Bayesian', 'bagging_temperature': 9.457521379689348}. Best is trial 129 with value: 0.9195402298850575.
[32m[I 2023-04-26 01:21:04,169][39m Trial 207 finished with value: 0.8791208791208791 and parameters: {'objective': 'CrossEntropy', 'colsample_bylevel': 0.09466645685207065, 'depth': 12, 'boosting_type': 'Plain', 'bootstrap_type': 'Bayesian', 'bagging_temperature': 9.54855035217322}. Best is trial 129 with value: 0.9195402298850575.
[32m[I 2023-04-26 01:21:08,071][39m Trial 208 finished with value: 0.888888888888889 and parameters: {'objective': 'CrossEntropy', 'colsample_bylevel': 0.09986528211936169, 'depth': 11, 'boosting_type': 'Plain', 'bootstrap_type': 'Bayesian', 'bagging_temperature': 8.869871384874667}. Best is trial 129 with value: 0.9195402298850575.
[32m[I 2023-04-26 01:21:11,415][39m Trial 209 finished with value: 0.9090909090909092 and parameters: {'objective': 'CrossEntropy', 'colsample_bylevel': 0.09337296492953898, 'depth': 12, 'boosting_type': 'Plain', 'bootstrap_type': 'Bayesian', 'bagging_temperature': 9.317703793892184}. Best is trial 129 with value: 0.9195402298850575.
[32m[I 2023-04-26 01:21:14,871][39m Trial 210 finished with value: 0.8988764044943819 and parameters: {'objective': 'CrossEntropy', 'colsample_bylevel': 0.0961733315420638, 'depth': 12, 'boosting_type': 'Plain', 'bootstrap_type': 'Bayesian', 'bagging_temperature': 9.31172161084976}. Best is trial 129 with value: 0.9195402298850575.
[32m[I 2023-04-26 01:21:18,508][39m Trial 211 finished with value: 0.888888888888889 and parameters: {'objective': 'CrossEntropy', 'colsample_bylevel': 0.09716782836540525, 'depth': 12, 'boosting_type': 'Plain', 'bootstrap_type': 'Bayesian', 'bagging_temperature': 9.349715524877563}. Best is trial 129 with value: 0.9195402298850575.
[32m[I 2023-04-26 01:21:21,895][39m Trial 212 finished with value: 0.8666666666666666 and parameters: {'objective': 'CrossEntropy', 'colsample_bylevel': 0.09253315688123082, 'depth': 12, 'boosting_type': 'Plain', 'bootstrap_type': 'Bayesian', 'bagging_temperature': 9.259692554550469}. Best is trial 129 with value: 0.9195402298850575.
[32m[I 2023-04-26 01:21:25,444][39m Trial 213 finished with value: 0.8988764044943819 and parameters: {'objective': 'CrossEntropy', 'colsample_bylevel': 0.09305683491079587, 'depth': 11, 'boosting_type': 'Plain', 'bootstrap_type': 'Bayesian', 'bagging_temperature': 9.061845683684258}. Best is trial 129 with value: 0.9195402298850575.
[32m[I 2023-04-26 01:21:29,185][39m Trial 214 finished with value: 0.9090909090909092 and parameters: {'objective': 'CrossEntropy', 'colsample_bylevel': 0.09551930178610277, 'depth': 12, 'boosting_type': 'Plain', 'bootstrap_type': 'Bayesian', 'bagging_temperature': 9.11410431588891}. Best is trial 129 with value: 0.9195402298850575.
[32m[I 2023-04-26 01:21:32,416][39m Trial 215 finished with value: 0.8764044943820225 and parameters: {'objective': 'CrossEntropy', 'colsample_bylevel': 0.09025819658463215, 'depth': 11, 'boosting_type': 'Plain', 'bootstrap_type': 'Bayesian', 'bagging_temperature': 8.982222525599656}. Best is trial 129 with value: 0.9195402298850575.
[32m[I 2023-04-26 01:21:35,874][39m Trial 216 finished with value: 0.8988764044943819 and parameters: {'objective': 'CrossEntropy', 'colsample_bylevel': 0.09394334198206568, 'depth': 12, 'boosting_type': 'Plain', 'bootstrap_type': 'Bayesian', 'bagging_temperature': 9.802446361583936}. Best is trial 129 with value: 0.9195402298850575.
[32m[I 2023-04-26 01:21:39,253][39m Trial 217 finished with value: 0.8791208791208791 and parameters: {'objective': 'CrossEntropy', 'colsample_bylevel': 0.0940076867641942, 'depth': 12, 'boosting_type': 'Plain', 'bootstrap_type': 'Bayesian', 'bagging_temperature': 9.101226408623251}. Best is trial 129 with value: 0.9195402298850575.
[32m[I 2023-04-26 01:21:42,852][39m Trial 218 finished with value: 0.9090909090909092 and parameters: {'objective': 'CrossEntropy', 'colsample_bylevel': 0.09494274462171529, 'depth': 12, 'boosting_type': 'Plain', 'bootstrap_type': 'Bayesian', 'bagging_temperature': 9.664680136958907}. Best is trial 129 with value: 0.9195402298850575.
[32m[I 2023-04-26 01:21:46,094][39m Trial 219 finished with value: 0.8791208791208791 and parameters: {'objective': 'CrossEntropy', 'colsample_bylevel': 0.09082114604400573, 'depth': 11, 'boosting_type': 'Plain', 'bootstrap_type': 'Bayesian', 'bagging_temperature': 9.58273997927078}. Best is trial 129 with value: 0.9195402298850575.
[32m[I 2023-04-26 01:21:49,182][39m Trial 220 finished with value: 0.8791208791208791 and parameters: {'objective': 'CrossEntropy', 'colsample_bylevel': 0.08792465649787151, 'depth': 10, 'boosting_type': 'Plain', 'bootstrap_type': 'Bayesian', 'bagging_temperature': 8.634842178299603}. Best is trial 129 with value: 0.9195402298850575.
[32m[I 2023-04-26 01:21:53,257][39m Trial 221 finished with value: 0.8988764044943819 and parameters: {'objective': 'CrossEntropy', 'colsample_bylevel': 0.09826638041720148, 'depth': 12, 'boosting_type': 'Plain', 'bootstrap_type': 'Bayesian', 'bagging_temperature': 9.690966267095602}. Best is trial 129 with value: 0.9195402298850575.
[32m[I 2023-04-26 01:21:56,812][39m Trial 222 finished with value: 0.8988764044943819 and parameters: {'objective': 'CrossEntropy', 'colsample_bylevel': 0.09610422177170169, 'depth': 12, 'boosting_type': 'Plain', 'bootstrap_type': 'Bayesian', 'bagging_temperature': 9.80123534335251}. Best is trial 129 with value: 0.9195402298850575.
[32m[I 2023-04-26 01:22:00,155][39m Trial 223 finished with value: 0.888888888888889 and parameters: {'objective': 'CrossEntropy', 'colsample_bylevel': 0.09151108160805561, 'depth': 11, 'boosting_type': 'Plain', 'bootstrap_type': 'Bayesian', 'bagging_temperature': 9.503638830634221}. Best is trial 129 with value: 0.9195402298850575.
[32m[I 2023-04-26 01:22:03,887][39m Trial 224 finished with value: 0.8604651162790697 and parameters: {'objective': 'CrossEntropy', 'colsample_bylevel': 0.09595333182509796, 'depth': 12, 'boosting_type': 'Plain', 'bootstrap_type': 'Bayesian', 'bagging_temperature': 9.997839035646127}. Best is trial 129 with value: 0.9195402298850575.
[32m[I 2023-04-26 01:22:07,402][39m Trial 225 finished with value: 0.9090909090909092 and parameters: {'objective': 'CrossEntropy', 'colsample_bylevel': 0.0948380696204837, 'depth': 12, 'boosting_type': 'Plain', 'bootstrap_type': 'Bayesian', 'bagging_temperature': 9.417284459061365}. Best is trial 129 with value: 0.9195402298850575.
[32m[I 2023-04-26 01:22:11,052][39m Trial 226 finished with value: 0.8539325842696629 and parameters: {'objective': 'CrossEntropy', 'colsample_bylevel': 0.09553275820861006, 'depth': 12, 'boosting_type': 'Plain', 'bootstrap_type': 'Bayesian', 'bagging_temperature': 9.693024192701973}. Best is trial 129 with value: 0.9195402298850575.
[32m[I 2023-04-26 01:22:14,653][39m Trial 227 finished with value: 0.8988764044943819 and parameters: {'objective': 'CrossEntropy', 'colsample_bylevel': 0.09807070652360683, 'depth': 12, 'boosting_type': 'Plain', 'bootstrap_type': 'Bayesian', 'bagging_temperature': 9.367793887376372}. Best is trial 129 with value: 0.9195402298850575.
[32m[I 2023-04-26 01:22:18,000][39m Trial 228 finished with value: 0.888888888888889 and parameters: {'objective': 'CrossEntropy', 'colsample_bylevel': 0.09311519040585545, 'depth': 12, 'boosting_type': 'Plain', 'bootstrap_type': 'Bayesian', 'bagging_temperature': 9.477100112038803}. Best is trial 129 with value: 0.9195402298850575.
[32m[I 2023-04-26 01:22:21,528][39m Trial 229 finished with value: 0.8791208791208791 and parameters: {'objective': 'CrossEntropy', 'colsample_bylevel': 0.0944393690199571, 'depth': 12, 'boosting_type': 'Plain', 'bootstrap_type': 'Bayesian', 'bagging_temperature': 9.269549356843564}. Best is trial 129 with value: 0.9195402298850575.
[32m[I 2023-04-26 01:22:24,712][39m Trial 230 finished with value: 0.8791208791208791 and parameters: {'objective': 'CrossEntropy', 'colsample_bylevel': 0.09123559227547388, 'depth': 11, 'boosting_type': 'Plain', 'bootstrap_type': 'Bayesian', 'bagging_temperature': 9.575508902433187}. Best is trial 129 with value: 0.9195402298850575.
[32m[I 2023-04-26 01:22:28,607][39m Trial 231 finished with value: 0.9090909090909092 and parameters: {'objective': 'CrossEntropy', 'colsample_bylevel': 0.098033040360074, 'depth': 12, 'boosting_type': 'Plain', 'bootstrap_type': 'Bayesian', 'bagging_temperature': 9.10944382462073}. Best is trial 129 with value: 0.9195402298850575.
[32m[I 2023-04-26 01:22:32,216][39m Trial 232 finished with value: 0.8791208791208791 and parameters: {'objective': 'CrossEntropy', 'colsample_bylevel': 0.09447765419400332, 'depth': 12, 'boosting_type': 'Plain', 'bootstrap_type': 'Bayesian', 'bagging_temperature': 9.137447145402826}. Best is trial 129 with value: 0.9195402298850575.
[32m[I 2023-04-26 01:22:36,087][39m Trial 233 finished with value: 0.9090909090909092 and parameters: {'objective': 'CrossEntropy', 'colsample_bylevel': 0.09856306434683779, 'depth': 12, 'boosting_type': 'Plain', 'bootstrap_type': 'Bayesian', 'bagging_temperature': 8.932590677814545}. Best is trial 129 with value: 0.9195402298850575.
[32m[I 2023-04-26 01:22:37,866][39m Trial 234 finished with value: 0.7912087912087912 and parameters: {'objective': 'CrossEntropy', 'colsample_bylevel': 0.04694869646355326, 'depth': 12, 'boosting_type': 'Plain', 'bootstrap_type': 'Bayesian', 'bagging_temperature': 8.771512205966543}. Best is trial 129 with value: 0.9195402298850575.
[32m[I 2023-04-26 01:22:41,956][39m Trial 235 finished with value: 0.888888888888889 and parameters: {'objective': 'CrossEntropy', 'colsample_bylevel': 0.09998549846635603, 'depth': 12, 'boosting_type': 'Plain', 'bootstrap_type': 'Bayesian', 'bagging_temperature': 8.859571674158035}. Best is trial 129 with value: 0.9195402298850575.
[32m[I 2023-04-26 01:22:46,006][39m Trial 236 finished with value: 0.9195402298850575 and parameters: {'objective': 'CrossEntropy', 'colsample_bylevel': 0.09699334068465992, 'depth': 11, 'boosting_type': 'Plain', 'bootstrap_type': 'Bayesian', 'bagging_temperature': 9.377662719535508}. Best is trial 129 with value: 0.9195402298850575.
[32m[I 2023-04-26 01:22:49,604][39m Trial 237 finished with value: 0.8764044943820225 and parameters: {'objective': 'CrossEntropy', 'colsample_bylevel': 0.09654212641219972, 'depth': 12, 'boosting_type': 'Plain', 'bootstrap_type': 'Bayesian', 'bagging_temperature': 9.092258683479697}. Best is trial 129 with value: 0.9195402298850575.
[32m[I 2023-04-26 01:22:53,365][39m Trial 238 finished with value: 0.8988764044943819 and parameters: {'objective': 'CrossEntropy', 'colsample_bylevel': 0.09804398308209852, 'depth': 11, 'boosting_type': 'Plain', 'bootstrap_type': 'Bayesian', 'bagging_temperature': 9.372213083791753}. Best is trial 129 with value: 0.9195402298850575.
[32m[I 2023-04-26 01:23:00,225][39m Trial 239 finished with value: 0.851063829787234 and parameters: {'objective': 'CrossEntropy', 'colsample_bylevel': 0.09678675240322104, 'depth': 12, 'boosting_type': 'Ordered', 'bootstrap_type': 'MVS'}. Best is trial 129 with value: 0.9195402298850575.
[32m[I 2023-04-26 01:23:04,166][39m Trial 240 finished with value: 0.8988764044943819 and parameters: {'objective': 'CrossEntropy', 'colsample_bylevel': 0.09483399902556322, 'depth': 12, 'boosting_type': 'Plain', 'bootstrap_type': 'Bayesian', 'bagging_temperature': 8.958006138130322}. Best is trial 129 with value: 0.9195402298850575.
[32m[I 2023-04-26 01:23:07,916][39m Trial 241 finished with value: 0.888888888888889 and parameters: {'objective': 'CrossEntropy', 'colsample_bylevel': 0.09359857279575923, 'depth': 11, 'boosting_type': 'Plain', 'bootstrap_type': 'Bayesian', 'bagging_temperature': 9.295772256688334}. Best is trial 129 with value: 0.9195402298850575.
[32m[I 2023-04-26 01:23:11,502][39m Trial 242 finished with value: 0.8604651162790697 and parameters: {'objective': 'CrossEntropy', 'colsample_bylevel': 0.09530593756247951, 'depth': 12, 'boosting_type': 'Plain', 'bootstrap_type': 'Bayesian', 'bagging_temperature': 9.833729139682202}. Best is trial 129 with value: 0.9195402298850575.
[32m[I 2023-04-26 01:23:15,108][39m Trial 243 finished with value: 0.8863636363636364 and parameters: {'objective': 'CrossEntropy', 'colsample_bylevel': 0.09718189940290049, 'depth': 12, 'boosting_type': 'Plain', 'bootstrap_type': 'Bayesian', 'bagging_temperature': 9.680432208731522}. Best is trial 129 with value: 0.9195402298850575.
[32m[I 2023-04-26 01:23:18,605][39m Trial 244 finished with value: 0.9090909090909092 and parameters: {'objective': 'CrossEntropy', 'colsample_bylevel': 0.09332850591414446, 'depth': 11, 'boosting_type': 'Plain', 'bootstrap_type': 'Bayesian', 'bagging_temperature': 9.290794874253386}. Best is trial 129 with value: 0.9195402298850575.
[32m[I 2023-04-26 01:23:22,755][39m Trial 245 finished with value: 0.8988764044943819 and parameters: {'objective': 'CrossEntropy', 'colsample_bylevel': 0.09971698855531959, 'depth': 12, 'boosting_type': 'Plain', 'bootstrap_type': 'Bayesian', 'bagging_temperature': 9.388432043284537}. Best is trial 129 with value: 0.9195402298850575.
[32m[I 2023-04-26 01:23:26,299][39m Trial 246 finished with value: 0.8735632183908046 and parameters: {'objective': 'CrossEntropy', 'colsample_bylevel': 0.09815956524688055, 'depth': 12, 'boosting_type': 'Plain', 'bootstrap_type': 'Bayesian', 'bagging_temperature': 9.406968881028673}. Best is trial 129 with value: 0.9195402298850575.
[32m[I 2023-04-26 01:23:29,931][39m Trial 247 finished with value: 0.8695652173913043 and parameters: {'objective': 'CrossEntropy', 'colsample_bylevel': 0.09260915396154125, 'depth': 11, 'boosting_type': 'Plain', 'bootstrap_type': 'Bayesian', 'bagging_temperature': 9.520873996634101}. Best is trial 129 with value: 0.9195402298850575.
[32m[I 2023-04-26 01:23:32,835][39m Trial 248 finished with value: 0.8764044943820225 and parameters: {'objective': 'CrossEntropy', 'colsample_bylevel': 0.08984769485072103, 'depth': 11, 'boosting_type': 'Plain', 'bootstrap_type': 'Bayesian', 'bagging_temperature': 9.055745413460004}. Best is trial 129 with value: 0.9195402298850575.
[32m[I 2023-04-26 01:23:36,817][39m Trial 249 finished with value: 0.8604651162790697 and parameters: {'objective': 'CrossEntropy', 'colsample_bylevel': 0.09648747358965752, 'depth': 12, 'boosting_type': 'Plain', 'bootstrap_type': 'Bayesian', 'bagging_temperature': 9.283411925924508}. Best is trial 129 with value: 0.9195402298850575.
[32m[I 2023-04-26 01:23:40,426][39m Trial 250 finished with value: 0.8863636363636364 and parameters: {'objective': 'CrossEntropy', 'colsample_bylevel': 0.09820321852983602, 'depth': 12, 'boosting_type': 'Plain', 'bootstrap_type': 'Bayesian', 'bagging_temperature': 9.830314398771584}. Best is trial 129 with value: 0.9195402298850575.
[32m[I 2023-04-26 01:23:43,811][39m Trial 251 finished with value: 0.8764044943820225 and parameters: {'objective': 'Logloss', 'colsample_bylevel': 0.09598574925468807, 'depth': 11, 'boosting_type': 'Plain', 'bootstrap_type': 'Bayesian', 'bagging_temperature': 7.727150676279694}. Best is trial 129 with value: 0.9195402298850575.
[32m[I 2023-04-26 01:23:47,213][39m Trial 252 finished with value: 0.8988764044943819 and parameters: {'objective': 'CrossEntropy', 'colsample_bylevel': 0.09223236063541958, 'depth': 11, 'boosting_type': 'Plain', 'bootstrap_type': 'Bayesian', 'bagging_temperature': 9.141662255008907}. Best is trial 129 with value: 0.9195402298850575.
[32m[I 2023-04-26 01:23:50,803][39m Trial 253 finished with value: 0.8863636363636364 and parameters: {'objective': 'CrossEntropy', 'colsample_bylevel': 0.09865535986288267, 'depth': 12, 'boosting_type': 'Plain', 'bootstrap_type': 'Bayesian', 'bagging_temperature': 9.493441036014218}. Best is trial 129 with value: 0.9195402298850575.
[32m[I 2023-04-26 01:23:54,263][39m Trial 254 finished with value: 0.9090909090909092 and parameters: {'objective': 'CrossEntropy', 'colsample_bylevel': 0.09330501280466236, 'depth': 11, 'boosting_type': 'Plain', 'bootstrap_type': 'Bayesian', 'bagging_temperature': 8.915761119795174}. Best is trial 129 with value: 0.9195402298850575.
[32m[I 2023-04-26 01:23:57,471][39m Trial 255 finished with value: 0.8539325842696629 and parameters: {'objective': 'Logloss', 'colsample_bylevel': 0.09446720582704926, 'depth': 11, 'boosting_type': 'Plain', 'bootstrap_type': 'Bayesian', 'bagging_temperature': 4.384002213768497}. Best is trial 129 with value: 0.9195402298850575.
[32m[I 2023-04-26 01:23:59,294][39m Trial 256 finished with value: 0.851063829787234 and parameters: {'objective': 'CrossEntropy', 'colsample_bylevel': 0.05536284369863251, 'depth': 12, 'boosting_type': 'Plain', 'bootstrap_type': 'Bayesian', 'bagging_temperature': 8.845372334471046}. Best is trial 129 with value: 0.9195402298850575.
[32m[I 2023-04-26 01:24:03,006][39m Trial 257 finished with value: 0.8965517241379309 and parameters: {'objective': 'CrossEntropy', 'colsample_bylevel': 0.09788314870857155, 'depth': 12, 'boosting_type': 'Plain', 'bootstrap_type': 'Bayesian', 'bagging_temperature': 9.288270396781195}. Best is trial 129 with value: 0.9195402298850575.
[32m[I 2023-04-26 01:24:04,111][39m Trial 258 finished with value: 0.76 and parameters: {'objective': 'CrossEntropy', 'colsample_bylevel': 0.010977236171499746, 'depth': 11, 'boosting_type': 'Plain', 'bootstrap_type': 'Bayesian', 'bagging_temperature': 8.587991070543966}. Best is trial 129 with value: 0.9195402298850575.
[32m[I 2023-04-26 01:24:07,485][39m Trial 259 finished with value: 0.8988764044943819 and parameters: {'objective': 'CrossEntropy', 'colsample_bylevel': 0.09307232107007732, 'depth': 11, 'boosting_type': 'Plain', 'bootstrap_type': 'Bayesian', 'bagging_temperature': 9.198061181950855}. Best is trial 129 with value: 0.9195402298850575.
[32m[I 2023-04-26 01:24:10,966][39m Trial 260 finished with value: 0.8863636363636364 and parameters: {'objective': 'CrossEntropy', 'colsample_bylevel': 0.09493167170628572, 'depth': 12, 'boosting_type': 'Plain', 'bootstrap_type': 'Bayesian', 'bagging_temperature': 8.899874145313682}. Best is trial 129 with value: 0.9195402298850575.
[32m[I 2023-04-26 01:24:14,941][39m Trial 261 finished with value: 0.8988764044943819 and parameters: {'objective': 'CrossEntropy', 'colsample_bylevel': 0.09882852052665718, 'depth': 12, 'boosting_type': 'Plain', 'bootstrap_type': 'Bayesian', 'bagging_temperature': 9.422151936696533}. Best is trial 129 with value: 0.9195402298850575.
[32m[I 2023-04-26 01:24:18,197][39m Trial 262 finished with value: 0.8666666666666666 and parameters: {'objective': 'CrossEntropy', 'colsample_bylevel': 0.09217219197412523, 'depth': 11, 'boosting_type': 'Plain', 'bootstrap_type': 'Bayesian', 'bagging_temperature': 8.70499063756183}. Best is trial 129 with value: 0.9195402298850575.
[32m[I 2023-04-26 01:24:22,170][39m Trial 263 finished with value: 0.8735632183908046 and parameters: {'objective': 'CrossEntropy', 'colsample_bylevel': 0.09702664662477095, 'depth': 12, 'boosting_type': 'Plain', 'bootstrap_type': 'Bayesian', 'bagging_temperature': 9.22560431866586}. Best is trial 129 with value: 0.9195402298850575.
