[32m[I 2023-04-26 01:13:11,991][39m Trial 68 finished with value: 0.8695652173913043 and parameters: {'objective': 'Logloss', 'colsample_bylevel': 0.08301094614025688, 'depth': 9, 'boosting_type': 'Plain', 'bootstrap_type': 'Bayesian', 'bagging_temperature': 8.626152167722594}. Best is trial 59 with value: 0.8965517241379309.
[32m[I 2023-04-26 01:13:15,989][39m Trial 69 finished with value: 0.7956989247311829 and parameters: {'objective': 'CrossEntropy', 'colsample_bylevel': 0.09083036482015847, 'depth': 2, 'boosting_type': 'Ordered', 'bootstrap_type': 'Bayesian', 'bagging_temperature': 9.57323014546636}. Best is trial 59 with value: 0.8965517241379309.
[32m[I 2023-04-26 01:13:18,766][39m Trial 70 finished with value: 0.8571428571428571 and parameters: {'objective': 'CrossEntropy', 'colsample_bylevel': 0.07863718863413552, 'depth': 10, 'boosting_type': 'Plain', 'bootstrap_type': 'Bayesian', 'bagging_temperature': 7.566148699351285}. Best is trial 59 with value: 0.8965517241379309.
[32m[I 2023-04-26 01:13:21,824][39m Trial 71 finished with value: 0.8764044943820225 and parameters: {'objective': 'CrossEntropy', 'colsample_bylevel': 0.0877106165730074, 'depth': 7, 'boosting_type': 'Plain', 'bootstrap_type': 'Bayesian', 'bagging_temperature': 6.123251629610084}. Best is trial 59 with value: 0.8965517241379309.
[32m[I 2023-04-26 01:13:24,886][39m Trial 72 finished with value: 0.8387096774193549 and parameters: {'objective': 'CrossEntropy', 'colsample_bylevel': 0.06875632599693901, 'depth': 9, 'boosting_type': 'Plain', 'bootstrap_type': 'Bayesian', 'bagging_temperature': 7.908607760850329}. Best is trial 59 with value: 0.8965517241379309.
[32m[I 2023-04-26 01:13:27,822][39m Trial 73 finished with value: 0.8351648351648352 and parameters: {'objective': 'CrossEntropy', 'colsample_bylevel': 0.07449173861561924, 'depth': 8, 'boosting_type': 'Plain', 'bootstrap_type': 'Bernoulli', 'subsample': 0.5254865291759307}. Best is trial 59 with value: 0.8965517241379309.
[32m[I 2023-04-26 01:13:31,801][39m Trial 74 finished with value: 0.8636363636363636 and parameters: {'objective': 'CrossEntropy', 'colsample_bylevel': 0.08346757951054444, 'depth': 9, 'boosting_type': 'Plain', 'bootstrap_type': 'Bayesian', 'bagging_temperature': 9.177652630274558}. Best is trial 59 with value: 0.8965517241379309.
[32m[I 2023-04-26 01:13:34,610][39m Trial 75 finished with value: 0.8666666666666666 and parameters: {'objective': 'CrossEntropy', 'colsample_bylevel': 0.08040364577250858, 'depth': 10, 'boosting_type': 'Plain', 'bootstrap_type': 'Bernoulli', 'subsample': 0.9579549161116787}. Best is trial 59 with value: 0.8965517241379309.
[32m[I 2023-04-26 01:13:37,771][39m Trial 76 finished with value: 0.8791208791208791 and parameters: {'objective': 'CrossEntropy', 'colsample_bylevel': 0.07170177149627846, 'depth': 8, 'boosting_type': 'Plain', 'bootstrap_type': 'MVS'}. Best is trial 59 with value: 0.8965517241379309.
[32m[I 2023-04-26 01:13:41,766][39m Trial 77 finished with value: 0.8735632183908046 and parameters: {'objective': 'CrossEntropy', 'colsample_bylevel': 0.08716760966501719, 'depth': 8, 'boosting_type': 'Plain', 'bootstrap_type': 'MVS'}. Best is trial 59 with value: 0.8965517241379309.
[32m[I 2023-04-26 01:13:44,037][39m Trial 78 finished with value: 0.851063829787234 and parameters: {'objective': 'CrossEntropy', 'colsample_bylevel': 0.06611688498097633, 'depth': 11, 'boosting_type': 'Plain', 'bootstrap_type': 'MVS'}. Best is trial 59 with value: 0.8965517241379309.
[32m[I 2023-04-26 01:13:46,544][39m Trial 79 finished with value: 0.8478260869565216 and parameters: {'objective': 'Logloss', 'colsample_bylevel': 0.07680140124662654, 'depth': 6, 'boosting_type': 'Plain', 'bootstrap_type': 'MVS'}. Best is trial 59 with value: 0.8965517241379309.
[32m[I 2023-04-26 01:13:50,190][39m Trial 80 finished with value: 0.8000000000000002 and parameters: {'objective': 'CrossEntropy', 'colsample_bylevel': 0.05848219781649448, 'depth': 8, 'boosting_type': 'Ordered', 'bootstrap_type': 'MVS'}. Best is trial 59 with value: 0.8965517241379309.
[32m[I 2023-04-26 01:13:54,418][39m Trial 81 finished with value: 0.851063829787234 and parameters: {'objective': 'CrossEntropy', 'colsample_bylevel': 0.07163507904222756, 'depth': 9, 'boosting_type': 'Plain', 'bootstrap_type': 'Bernoulli', 'subsample': 0.7208695680293697}. Best is trial 59 with value: 0.8965517241379309.
[32m[I 2023-04-26 01:13:56,328][39m Trial 82 finished with value: 0.8387096774193549 and parameters: {'objective': 'CrossEntropy', 'colsample_bylevel': 0.05153523927835036, 'depth': 7, 'boosting_type': 'Plain', 'bootstrap_type': 'MVS'}. Best is trial 59 with value: 0.8965517241379309.
[32m[I 2023-04-26 01:13:59,691][39m Trial 83 finished with value: 0.8387096774193549 and parameters: {'objective': 'CrossEntropy', 'colsample_bylevel': 0.07349732426248179, 'depth': 9, 'boosting_type': 'Plain', 'bootstrap_type': 'Bernoulli', 'subsample': 0.8832464043108488}. Best is trial 59 with value: 0.8965517241379309.
[32m[I 2023-04-26 01:14:03,642][39m Trial 84 finished with value: 0.888888888888889 and parameters: {'objective': 'CrossEntropy', 'colsample_bylevel': 0.09105750311721333, 'depth': 8, 'boosting_type': 'Plain', 'bootstrap_type': 'Bayesian', 'bagging_temperature': 8.164184949628535}. Best is trial 59 with value: 0.8965517241379309.
[32m[I 2023-04-26 01:14:07,804][39m Trial 85 finished with value: 0.8764044943820225 and parameters: {'objective': 'CrossEntropy', 'colsample_bylevel': 0.09211787895109774, 'depth': 8, 'boosting_type': 'Plain', 'bootstrap_type': 'Bayesian', 'bagging_temperature': 8.068716755893945}. Best is trial 59 with value: 0.8965517241379309.
[32m[I 2023-04-26 01:14:11,352][39m Trial 86 finished with value: 0.8764044943820225 and parameters: {'objective': 'CrossEntropy', 'colsample_bylevel': 0.09703525221197318, 'depth': 7, 'boosting_type': 'Plain', 'bootstrap_type': 'Bayesian', 'bagging_temperature': 8.228978934710055}. Best is trial 59 with value: 0.8965517241379309.
[32m[I 2023-04-26 01:14:15,671][39m Trial 87 finished with value: 0.8791208791208791 and parameters: {'objective': 'CrossEntropy', 'colsample_bylevel': 0.08955556627313688, 'depth': 9, 'boosting_type': 'Plain', 'bootstrap_type': 'Bayesian', 'bagging_temperature': 9.854192562652825}. Best is trial 59 with value: 0.8965517241379309.
[32m[I 2023-04-26 01:14:18,292][39m Trial 88 finished with value: 0.8297872340425531 and parameters: {'objective': 'CrossEntropy', 'colsample_bylevel': 0.06977199916950909, 'depth': 8, 'boosting_type': 'Plain', 'bootstrap_type': 'Bayesian', 'bagging_temperature': 6.159771836264062}. Best is trial 59 with value: 0.8965517241379309.
[32m[I 2023-04-26 01:14:22,684][39m Trial 89 finished with value: 0.8666666666666666 and parameters: {'objective': 'CrossEntropy', 'colsample_bylevel': 0.09031377643088315, 'depth': 9, 'boosting_type': 'Plain', 'bootstrap_type': 'Bayesian', 'bagging_temperature': 9.999227995572644}. Best is trial 59 with value: 0.8965517241379309.
[32m[I 2023-04-26 01:14:25,455][39m Trial 90 finished with value: 0.8387096774193549 and parameters: {'objective': 'Logloss', 'colsample_bylevel': 0.08424121754760464, 'depth': 10, 'boosting_type': 'Plain', 'bootstrap_type': 'Bernoulli', 'subsample': 0.5657880413521883}. Best is trial 59 with value: 0.8965517241379309.
[32m[I 2023-04-26 01:14:28,821][39m Trial 91 finished with value: 0.8478260869565216 and parameters: {'objective': 'CrossEntropy', 'colsample_bylevel': 0.07692939071753403, 'depth': 8, 'boosting_type': 'Plain', 'bootstrap_type': 'Bernoulli', 'subsample': 0.8485736217398817}. Best is trial 59 with value: 0.8965517241379309.
[32m[I 2023-04-26 01:14:31,446][39m Trial 92 finished with value: 0.8764044943820225 and parameters: {'objective': 'CrossEntropy', 'colsample_bylevel': 0.08154944264976645, 'depth': 10, 'boosting_type': 'Plain', 'bootstrap_type': 'Bernoulli', 'subsample': 0.7648097090543089}. Best is trial 59 with value: 0.8965517241379309.
[32m[I 2023-04-26 01:14:35,717][39m Trial 93 finished with value: 0.8764044943820225 and parameters: {'objective': 'CrossEntropy', 'colsample_bylevel': 0.09442235670154485, 'depth': 9, 'boosting_type': 'Plain', 'bootstrap_type': 'Bayesian', 'bagging_temperature': 9.428577980277616}. Best is trial 59 with value: 0.8965517241379309.
[32m[I 2023-04-26 01:14:39,857][39m Trial 94 finished with value: 0.8791208791208791 and parameters: {'objective': 'CrossEntropy', 'colsample_bylevel': 0.08716289581883492, 'depth': 9, 'boosting_type': 'Plain', 'bootstrap_type': 'Bayesian', 'bagging_temperature': 9.981239588373702}. Best is trial 59 with value: 0.8965517241379309.
[32m[I 2023-04-26 01:14:43,686][39m Trial 95 finished with value: 0.860215053763441 and parameters: {'objective': 'CrossEntropy', 'colsample_bylevel': 0.0864947810649489, 'depth': 9, 'boosting_type': 'Plain', 'bootstrap_type': 'Bayesian', 'bagging_temperature': 8.947621361630723}. Best is trial 59 with value: 0.8965517241379309.
[32m[I 2023-04-26 01:14:47,939][39m Trial 96 finished with value: 0.888888888888889 and parameters: {'objective': 'CrossEntropy', 'colsample_bylevel': 0.08977890630688742, 'depth': 9, 'boosting_type': 'Plain', 'bootstrap_type': 'Bayesian', 'bagging_temperature': 9.641333265077376}. Best is trial 59 with value: 0.8965517241379309.
[32m[I 2023-04-26 01:14:52,601][39m Trial 97 finished with value: 0.8988764044943819 and parameters: {'objective': 'CrossEntropy', 'colsample_bylevel': 0.09778477820085026, 'depth': 9, 'boosting_type': 'Plain', 'bootstrap_type': 'Bayesian', 'bagging_temperature': 9.370040910527758}. Best is trial 97 with value: 0.8988764044943819.
[32m[I 2023-04-26 01:14:58,057][39m Trial 98 finished with value: 0.8 and parameters: {'objective': 'CrossEntropy', 'colsample_bylevel': 0.09694615504679707, 'depth': 8, 'boosting_type': 'Ordered', 'bootstrap_type': 'Bayesian', 'bagging_temperature': 9.301578854239287}. Best is trial 97 with value: 0.8988764044943819.
[32m[I 2023-04-26 01:15:01,344][39m Trial 99 finished with value: 0.8965517241379309 and parameters: {'objective': 'CrossEntropy', 'colsample_bylevel': 0.0951924993178913, 'depth': 10, 'boosting_type': 'Plain', 'bootstrap_type': 'Bayesian', 'bagging_temperature': 9.470707647360687}. Best is trial 97 with value: 0.8988764044943819.
[32m[I 2023-04-26 01:15:04,676][39m Trial 100 finished with value: 0.8764044943820225 and parameters: {'objective': 'CrossEntropy', 'colsample_bylevel': 0.0960011947494478, 'depth': 10, 'boosting_type': 'Plain', 'bootstrap_type': 'Bayesian', 'bagging_temperature': 9.467011563254074}. Best is trial 97 with value: 0.8988764044943819.
[32m[I 2023-04-26 01:15:08,279][39m Trial 101 finished with value: 0.8988764044943819 and parameters: {'objective': 'CrossEntropy', 'colsample_bylevel': 0.09218249137100096, 'depth': 10, 'boosting_type': 'Plain', 'bootstrap_type': 'Bayesian', 'bagging_temperature': 8.388268352800926}. Best is trial 97 with value: 0.8988764044943819.
[32m[I 2023-04-26 01:15:11,926][39m Trial 102 finished with value: 0.8988764044943819 and parameters: {'objective': 'CrossEntropy', 'colsample_bylevel': 0.09893189799605068, 'depth': 11, 'boosting_type': 'Plain', 'bootstrap_type': 'Bayesian', 'bagging_temperature': 9.98164909528867}. Best is trial 97 with value: 0.8988764044943819.
[32m[I 2023-04-26 01:15:15,532][39m Trial 103 finished with value: 0.8791208791208791 and parameters: {'objective': 'CrossEntropy', 'colsample_bylevel': 0.09768145875361439, 'depth': 11, 'boosting_type': 'Plain', 'bootstrap_type': 'Bayesian', 'bagging_temperature': 8.530472209313642}. Best is trial 97 with value: 0.8988764044943819.
[32m[I 2023-04-26 01:15:19,401][39m Trial 104 finished with value: 0.8837209302325582 and parameters: {'objective': 'CrossEntropy', 'colsample_bylevel': 0.09885664701202516, 'depth': 11, 'boosting_type': 'Plain', 'bootstrap_type': 'Bayesian', 'bagging_temperature': 8.805864025554875}. Best is trial 97 with value: 0.8988764044943819.
[32m[I 2023-04-26 01:15:22,938][39m Trial 105 finished with value: 0.888888888888889 and parameters: {'objective': 'CrossEntropy', 'colsample_bylevel': 0.09816865505176899, 'depth': 11, 'boosting_type': 'Plain', 'bootstrap_type': 'Bayesian', 'bagging_temperature': 9.071364529298732}. Best is trial 97 with value: 0.8988764044943819.
[32m[I 2023-04-26 01:15:26,325][39m Trial 106 finished with value: 0.8791208791208791 and parameters: {'objective': 'CrossEntropy', 'colsample_bylevel': 0.09858301551700242, 'depth': 12, 'boosting_type': 'Plain', 'bootstrap_type': 'Bayesian', 'bagging_temperature': 9.11110371826515}. Best is trial 97 with value: 0.8988764044943819.
[32m[I 2023-04-26 01:15:29,737][39m Trial 107 finished with value: 0.8571428571428571 and parameters: {'objective': 'Logloss', 'colsample_bylevel': 0.09457070944779229, 'depth': 12, 'boosting_type': 'Plain', 'bootstrap_type': 'Bayesian', 'bagging_temperature': 9.036732500754647}. Best is trial 97 with value: 0.8988764044943819.
[32m[I 2023-04-26 01:15:32,965][39m Trial 108 finished with value: 0.8863636363636364 and parameters: {'objective': 'CrossEntropy', 'colsample_bylevel': 0.09182076781795415, 'depth': 11, 'boosting_type': 'Plain', 'bootstrap_type': 'Bayesian', 'bagging_temperature': 9.529938208125897}. Best is trial 97 with value: 0.8988764044943819.
[32m[I 2023-04-26 01:15:36,265][39m Trial 109 finished with value: 0.8988764044943819 and parameters: {'objective': 'CrossEntropy', 'colsample_bylevel': 0.09353142691399999, 'depth': 12, 'boosting_type': 'Plain', 'bootstrap_type': 'Bayesian', 'bagging_temperature': 9.60366202758902}. Best is trial 97 with value: 0.8988764044943819.
[32m[I 2023-04-26 01:15:39,745][39m Trial 110 finished with value: 0.8539325842696629 and parameters: {'objective': 'CrossEntropy', 'colsample_bylevel': 0.09326271051726974, 'depth': 12, 'boosting_type': 'Plain', 'bootstrap_type': 'Bayesian', 'bagging_temperature': 0.11595868597979339}. Best is trial 97 with value: 0.8988764044943819.
[32m[I 2023-04-26 01:15:42,739][39m Trial 111 finished with value: 0.8988764044943819 and parameters: {'objective': 'CrossEntropy', 'colsample_bylevel': 0.09152949967275416, 'depth': 11, 'boosting_type': 'Plain', 'bootstrap_type': 'Bayesian', 'bagging_temperature': 9.531310321206332}. Best is trial 97 with value: 0.8988764044943819.
[32m[I 2023-04-26 01:15:45,881][39m Trial 112 finished with value: 0.8666666666666666 and parameters: {'objective': 'CrossEntropy', 'colsample_bylevel': 0.09418478501181801, 'depth': 11, 'boosting_type': 'Plain', 'bootstrap_type': 'Bayesian', 'bagging_temperature': 9.467892339116373}. Best is trial 97 with value: 0.8988764044943819.
[32m[I 2023-04-26 01:15:49,267][39m Trial 113 finished with value: 0.8965517241379309 and parameters: {'objective': 'CrossEntropy', 'colsample_bylevel': 0.09555850633964508, 'depth': 12, 'boosting_type': 'Plain', 'bootstrap_type': 'Bayesian', 'bagging_temperature': 9.89103135906498}. Best is trial 97 with value: 0.8988764044943819.
[32m[I 2023-04-26 01:15:52,525][39m Trial 114 finished with value: 0.8863636363636364 and parameters: {'objective': 'CrossEntropy', 'colsample_bylevel': 0.09534235367046714, 'depth': 12, 'boosting_type': 'Plain', 'bootstrap_type': 'Bayesian', 'bagging_temperature': 9.941761401877953}. Best is trial 97 with value: 0.8988764044943819.
[32m[I 2023-04-26 01:15:56,109][39m Trial 115 finished with value: 0.888888888888889 and parameters: {'objective': 'CrossEntropy', 'colsample_bylevel': 0.09882280504018547, 'depth': 12, 'boosting_type': 'Plain', 'bootstrap_type': 'Bayesian', 'bagging_temperature': 9.195897919535836}. Best is trial 97 with value: 0.8988764044943819.
[32m[I 2023-04-26 01:15:59,222][39m Trial 116 finished with value: 0.8764044943820225 and parameters: {'objective': 'CrossEntropy', 'colsample_bylevel': 0.09136424520279783, 'depth': 12, 'boosting_type': 'Plain', 'bootstrap_type': 'Bayesian', 'bagging_temperature': 0.8731315177272405}. Best is trial 97 with value: 0.8988764044943819.
[32m[I 2023-04-26 01:16:02,986][39m Trial 117 finished with value: 0.8791208791208791 and parameters: {'objective': 'CrossEntropy', 'colsample_bylevel': 0.09961370148333407, 'depth': 12, 'boosting_type': 'Plain', 'bootstrap_type': 'Bayesian', 'bagging_temperature': 9.127159084614433}. Best is trial 97 with value: 0.8988764044943819.
[32m[I 2023-04-26 01:16:06,542][39m Trial 118 finished with value: 0.8764044943820225 and parameters: {'objective': 'Logloss', 'colsample_bylevel': 0.0971465861218143, 'depth': 11, 'boosting_type': 'Plain', 'bootstrap_type': 'Bayesian', 'bagging_temperature': 9.710908943695529}. Best is trial 97 with value: 0.8988764044943819.
[32m[I 2023-04-26 01:16:12,294][39m Trial 119 finished with value: 0.7912087912087912 and parameters: {'objective': 'CrossEntropy', 'colsample_bylevel': 0.09327727640116015, 'depth': 12, 'boosting_type': 'Ordered', 'bootstrap_type': 'Bayesian', 'bagging_temperature': 8.506121748871918}. Best is trial 97 with value: 0.8988764044943819.
[32m[I 2023-04-26 01:16:15,392][39m Trial 120 finished with value: 0.8988764044943819 and parameters: {'objective': 'CrossEntropy', 'colsample_bylevel': 0.08899717199329082, 'depth': 11, 'boosting_type': 'Plain', 'bootstrap_type': 'Bayesian', 'bagging_temperature': 9.660360391089215}. Best is trial 97 with value: 0.8988764044943819.
[32m[I 2023-04-26 01:16:18,724][39m Trial 121 finished with value: 0.8764044943820225 and parameters: {'objective': 'CrossEntropy', 'colsample_bylevel': 0.09555751728598176, 'depth': 12, 'boosting_type': 'Plain', 'bootstrap_type': 'Bayesian', 'bagging_temperature': 4.163668931587557}. Best is trial 97 with value: 0.8988764044943819.
[32m[I 2023-04-26 01:16:21,689][39m Trial 122 finished with value: 0.8636363636363636 and parameters: {'objective': 'CrossEntropy', 'colsample_bylevel': 0.08847630334547638, 'depth': 10, 'boosting_type': 'Plain', 'bootstrap_type': 'Bayesian', 'bagging_temperature': 9.63382241164181}. Best is trial 97 with value: 0.8988764044943819.
[32m[I 2023-04-26 01:16:24,628][39m Trial 123 finished with value: 0.8791208791208791 and parameters: {'objective': 'CrossEntropy', 'colsample_bylevel': 0.08926856358415096, 'depth': 11, 'boosting_type': 'Plain', 'bootstrap_type': 'Bayesian', 'bagging_temperature': 9.637715482024484}. Best is trial 97 with value: 0.8988764044943819.
[32m[I 2023-04-26 01:16:27,779][39m Trial 124 finished with value: 0.8764044943820225 and parameters: {'objective': 'CrossEntropy', 'colsample_bylevel': 0.0908093277108026, 'depth': 11, 'boosting_type': 'Plain', 'bootstrap_type': 'Bayesian', 'bagging_temperature': 9.9884669005911}. Best is trial 97 with value: 0.8988764044943819.
[32m[I 2023-04-26 01:16:31,098][39m Trial 125 finished with value: 0.9090909090909092 and parameters: {'objective': 'CrossEntropy', 'colsample_bylevel': 0.09175263017343442, 'depth': 12, 'boosting_type': 'Plain', 'bootstrap_type': 'Bayesian', 'bagging_temperature': 9.371134183780498}. Best is trial 125 with value: 0.9090909090909092.
[32m[I 2023-04-26 01:16:34,523][39m Trial 126 finished with value: 0.8695652173913043 and parameters: {'objective': 'CrossEntropy', 'colsample_bylevel': 0.09380944837766275, 'depth': 12, 'boosting_type': 'Plain', 'bootstrap_type': 'Bayesian', 'bagging_temperature': 8.787243733164516}. Best is trial 125 with value: 0.9090909090909092.
[32m[I 2023-04-26 01:16:38,157][39m Trial 127 finished with value: 0.8988764044943819 and parameters: {'objective': 'CrossEntropy', 'colsample_bylevel': 0.0986878566174082, 'depth': 12, 'boosting_type': 'Plain', 'bootstrap_type': 'Bayesian', 'bagging_temperature': 9.261326038938492}. Best is trial 125 with value: 0.9090909090909092.
[32m[I 2023-04-26 01:16:41,708][39m Trial 128 finished with value: 0.8988764044943819 and parameters: {'objective': 'CrossEntropy', 'colsample_bylevel': 0.09990666222439466, 'depth': 12, 'boosting_type': 'Plain', 'bootstrap_type': 'Bayesian', 'bagging_temperature': 9.142449361188447}. Best is trial 125 with value: 0.9090909090909092.
[32m[I 2023-04-26 01:16:45,025][39m Trial 129 finished with value: 0.9195402298850575 and parameters: {'objective': 'Logloss', 'colsample_bylevel': 0.09538104293720998, 'depth': 12, 'boosting_type': 'Plain', 'bootstrap_type': 'Bayesian', 'bagging_temperature': 9.418993535060018}. Best is trial 129 with value: 0.9195402298850575.
[32m[I 2023-04-26 01:16:48,466][39m Trial 130 finished with value: 0.888888888888889 and parameters: {'objective': 'Logloss', 'colsample_bylevel': 0.09994139172012653, 'depth': 12, 'boosting_type': 'Plain', 'bootstrap_type': 'Bayesian', 'bagging_temperature': 9.32970304054367}. Best is trial 129 with value: 0.9195402298850575.
[32m[I 2023-04-26 01:16:51,956][39m Trial 131 finished with value: 0.8764044943820225 and parameters: {'objective': 'Logloss', 'colsample_bylevel': 0.09536209055418127, 'depth': 12, 'boosting_type': 'Plain', 'bootstrap_type': 'Bayesian', 'bagging_temperature': 9.637251918962498}. Best is trial 129 with value: 0.9195402298850575.
[32m[I 2023-04-26 01:16:55,382][39m Trial 132 finished with value: 0.8666666666666666 and parameters: {'objective': 'Logloss', 'colsample_bylevel': 0.09665163358216224, 'depth': 11, 'boosting_type': 'Plain', 'bootstrap_type': 'Bayesian', 'bagging_temperature': 9.173592553543857}. Best is trial 129 with value: 0.9195402298850575.
[32m[I 2023-04-26 01:16:58,671][39m Trial 133 finished with value: 0.8863636363636364 and parameters: {'objective': 'Logloss', 'colsample_bylevel': 0.09345601055439624, 'depth': 12, 'boosting_type': 'Plain', 'bootstrap_type': 'Bayesian', 'bagging_temperature': 9.453872340098563}. Best is trial 129 with value: 0.9195402298850575.
