[32m[I 2023-04-26 01:31:54,220][39m Trial 394 finished with value: 0.8764044943820225 and parameters: {'objective': 'CrossEntropy', 'colsample_bylevel': 0.09409384237914051, 'depth': 12, 'boosting_type': 'Plain', 'bootstrap_type': 'Bayesian', 'bagging_temperature': 8.63077459054586}. Best is trial 129 with value: 0.9195402298850575.
[32m[I 2023-04-26 01:31:57,603][39m Trial 395 finished with value: 0.8695652173913043 and parameters: {'objective': 'CrossEntropy', 'colsample_bylevel': 0.09199203390597681, 'depth': 12, 'boosting_type': 'Plain', 'bootstrap_type': 'Bayesian', 'bagging_temperature': 8.936372501713102}. Best is trial 129 with value: 0.9195402298850575.
[32m[I 2023-04-26 01:32:01,154][39m Trial 396 finished with value: 0.8863636363636364 and parameters: {'objective': 'Logloss', 'colsample_bylevel': 0.0947598490150466, 'depth': 12, 'boosting_type': 'Plain', 'bootstrap_type': 'Bayesian', 'bagging_temperature': 9.159916096165775}. Best is trial 129 with value: 0.9195402298850575.
[32m[I 2023-04-26 01:32:04,674][39m Trial 397 finished with value: 0.8604651162790697 and parameters: {'objective': 'CrossEntropy', 'colsample_bylevel': 0.09668067675621236, 'depth': 12, 'boosting_type': 'Plain', 'bootstrap_type': 'Bayesian', 'bagging_temperature': 8.043991312895969}. Best is trial 129 with value: 0.9195402298850575.
[32m[I 2023-04-26 01:32:08,480][39m Trial 398 finished with value: 0.8988764044943819 and parameters: {'objective': 'CrossEntropy', 'colsample_bylevel': 0.09816606775963926, 'depth': 12, 'boosting_type': 'Plain', 'bootstrap_type': 'MVS'}. Best is trial 129 with value: 0.9195402298850575.
[32m[I 2023-04-26 01:32:10,159][39m Trial 399 finished with value: 0.8 and parameters: {'objective': 'CrossEntropy', 'colsample_bylevel': 0.044847170908786566, 'depth': 12, 'boosting_type': 'Plain', 'bootstrap_type': 'Bayesian', 'bagging_temperature': 3.80218394227393}. Best is trial 129 with value: 0.9195402298850575.
[32m[I 2023-04-26 01:32:13,785][39m Trial 400 finished with value: 0.9090909090909092 and parameters: {'objective': 'CrossEntropy', 'colsample_bylevel': 0.09527709173654055, 'depth': 12, 'boosting_type': 'Plain', 'bootstrap_type': 'Bayesian', 'bagging_temperature': 8.948186134888426}. Best is trial 129 with value: 0.9195402298850575.
[32m[I 2023-04-26 01:32:16,939][39m Trial 401 finished with value: 0.8863636363636364 and parameters: {'objective': 'CrossEntropy', 'colsample_bylevel': 0.09296706463012974, 'depth': 11, 'boosting_type': 'Plain', 'bootstrap_type': 'Bernoulli', 'subsample': 0.4735100470046413}. Best is trial 129 with value: 0.9195402298850575.
[32m[I 2023-04-26 01:32:23,360][39m Trial 402 finished with value: 0.8131868131868132 and parameters: {'objective': 'CrossEntropy', 'colsample_bylevel': 0.09605452278996258, 'depth': 12, 'boosting_type': 'Ordered', 'bootstrap_type': 'Bayesian', 'bagging_temperature': 9.475476360685413}. Best is trial 129 with value: 0.9195402298850575.
[32m[I 2023-04-26 01:32:26,809][39m Trial 403 finished with value: 0.8988764044943819 and parameters: {'objective': 'CrossEntropy', 'colsample_bylevel': 0.09385541227374526, 'depth': 11, 'boosting_type': 'Plain', 'bootstrap_type': 'Bayesian', 'bagging_temperature': 8.896387818356855}. Best is trial 129 with value: 0.9195402298850575.
[32m[I 2023-04-26 01:32:30,220][39m Trial 404 finished with value: 0.8764044943820225 and parameters: {'objective': 'CrossEntropy', 'colsample_bylevel': 0.09148217719371084, 'depth': 12, 'boosting_type': 'Plain', 'bootstrap_type': 'Bayesian', 'bagging_temperature': 8.607532628157394}. Best is trial 129 with value: 0.9195402298850575.
[32m[I 2023-04-26 01:32:33,732][39m Trial 405 finished with value: 0.888888888888889 and parameters: {'objective': 'CrossEntropy', 'colsample_bylevel': 0.09795991142520577, 'depth': 12, 'boosting_type': 'Plain', 'bootstrap_type': 'Bayesian', 'bagging_temperature': 9.290145612200885}. Best is trial 129 with value: 0.9195402298850575.
[32m[I 2023-04-26 01:32:37,260][39m Trial 406 finished with value: 0.8791208791208791 and parameters: {'objective': 'CrossEntropy', 'colsample_bylevel': 0.09435670459052058, 'depth': 12, 'boosting_type': 'Plain', 'bootstrap_type': 'Bayesian', 'bagging_temperature': 8.908694414156722}. Best is trial 129 with value: 0.9195402298850575.
[32m[I 2023-04-26 01:32:40,418][39m Trial 407 finished with value: 0.8764044943820225 and parameters: {'objective': 'CrossEntropy', 'colsample_bylevel': 0.08894837598907454, 'depth': 11, 'boosting_type': 'Plain', 'bootstrap_type': 'Bayesian', 'bagging_temperature': 9.034455501647594}. Best is trial 129 with value: 0.9195402298850575.
[32m[I 2023-04-26 01:32:43,357][39m Trial 408 finished with value: 0.8791208791208791 and parameters: {'objective': 'CrossEntropy', 'colsample_bylevel': 0.08651494446386712, 'depth': 12, 'boosting_type': 'Plain', 'bootstrap_type': 'Bayesian', 'bagging_temperature': 9.494346064542196}. Best is trial 129 with value: 0.9195402298850575.
[32m[I 2023-04-26 01:32:46,656][39m Trial 409 finished with value: 0.8863636363636364 and parameters: {'objective': 'CrossEntropy', 'colsample_bylevel': 0.09086874659115392, 'depth': 7, 'boosting_type': 'Plain', 'bootstrap_type': 'Bayesian', 'bagging_temperature': 8.346008690869912}. Best is trial 129 with value: 0.9195402298850575.
[32m[I 2023-04-26 01:32:50,071][39m Trial 410 finished with value: 0.8965517241379309 and parameters: {'objective': 'CrossEntropy', 'colsample_bylevel': 0.09636404236508068, 'depth': 12, 'boosting_type': 'Plain', 'bootstrap_type': 'Bayesian', 'bagging_temperature': 9.3086977640913}. Best is trial 129 with value: 0.9195402298850575.
[32m[I 2023-04-26 01:32:53,488][39m Trial 411 finished with value: 0.8988764044943819 and parameters: {'objective': 'CrossEntropy', 'colsample_bylevel': 0.09303776417884677, 'depth': 12, 'boosting_type': 'Plain', 'bootstrap_type': 'Bayesian', 'bagging_temperature': 8.519559955137675}. Best is trial 129 with value: 0.9195402298850575.
[32m[I 2023-04-26 01:32:56,860][39m Trial 412 finished with value: 0.8764044943820225 and parameters: {'objective': 'CrossEntropy', 'colsample_bylevel': 0.09542486951786411, 'depth': 12, 'boosting_type': 'Plain', 'bootstrap_type': 'Bayesian', 'bagging_temperature': 8.7509313778706}. Best is trial 129 with value: 0.9195402298850575.
[32m[I 2023-04-26 01:33:00,547][39m Trial 413 finished with value: 0.8636363636363636 and parameters: {'objective': 'CrossEntropy', 'colsample_bylevel': 0.09826443353248797, 'depth': 12, 'boosting_type': 'Plain', 'bootstrap_type': 'Bayesian', 'bagging_temperature': 9.092245002751273}. Best is trial 129 with value: 0.9195402298850575.
[32m[I 2023-04-26 01:33:03,099][39m Trial 414 finished with value: 0.8478260869565216 and parameters: {'objective': 'CrossEntropy', 'colsample_bylevel': 0.09069649447402613, 'depth': 5, 'boosting_type': 'Plain', 'bootstrap_type': 'Bayesian', 'bagging_temperature': 9.473213516256116}. Best is trial 129 with value: 0.9195402298850575.
[32m[I 2023-04-26 01:33:06,684][39m Trial 415 finished with value: 0.8863636363636364 and parameters: {'objective': 'CrossEntropy', 'colsample_bylevel': 0.09690099574584515, 'depth': 12, 'boosting_type': 'Plain', 'bootstrap_type': 'Bayesian', 'bagging_temperature': 9.786848855601361}. Best is trial 129 with value: 0.9195402298850575.
[32m[I 2023-04-26 01:33:10,200][39m Trial 416 finished with value: 0.8791208791208791 and parameters: {'objective': 'Logloss', 'colsample_bylevel': 0.09537244508977787, 'depth': 12, 'boosting_type': 'Plain', 'bootstrap_type': 'Bayesian', 'bagging_temperature': 9.838417433595957}. Best is trial 129 with value: 0.9195402298850575.
[32m[I 2023-04-26 01:33:13,719][39m Trial 417 finished with value: 0.8863636363636364 and parameters: {'objective': 'CrossEntropy', 'colsample_bylevel': 0.09380098512649987, 'depth': 12, 'boosting_type': 'Plain', 'bootstrap_type': 'Bayesian', 'bagging_temperature': 8.770166690753022}. Best is trial 129 with value: 0.9195402298850575.
[32m[I 2023-04-26 01:33:16,824][39m Trial 418 finished with value: 0.8764044943820225 and parameters: {'objective': 'CrossEntropy', 'colsample_bylevel': 0.08972120498434821, 'depth': 11, 'boosting_type': 'Plain', 'bootstrap_type': 'Bayesian', 'bagging_temperature': 1.5271347504463817}. Best is trial 129 with value: 0.9195402298850575.
[32m[I 2023-04-26 01:33:20,285][39m Trial 419 finished with value: 0.9090909090909092 and parameters: {'objective': 'CrossEntropy', 'colsample_bylevel': 0.09207618176629129, 'depth': 12, 'boosting_type': 'Plain', 'bootstrap_type': 'Bayesian', 'bagging_temperature': 9.078231215105296}. Best is trial 129 with value: 0.9195402298850575.
[32m[I 2023-04-26 01:33:23,681][39m Trial 420 finished with value: 0.888888888888889 and parameters: {'objective': 'CrossEntropy', 'colsample_bylevel': 0.09321806972498717, 'depth': 12, 'boosting_type': 'Plain', 'bootstrap_type': 'Bayesian', 'bagging_temperature': 9.020558841493246}. Best is trial 129 with value: 0.9195402298850575.
[32m[I 2023-04-26 01:33:27,048][39m Trial 421 finished with value: 0.8666666666666666 and parameters: {'objective': 'CrossEntropy', 'colsample_bylevel': 0.09478409694601626, 'depth': 12, 'boosting_type': 'Plain', 'bootstrap_type': 'MVS'}. Best is trial 129 with value: 0.9195402298850575.
[32m[I 2023-04-26 01:33:32,935][39m Trial 422 finished with value: 0.7777777777777778 and parameters: {'objective': 'Logloss', 'colsample_bylevel': 0.09296589465710273, 'depth': 12, 'boosting_type': 'Ordered', 'bootstrap_type': 'Bayesian', 'bagging_temperature': 9.197629782307287}. Best is trial 129 with value: 0.9195402298850575.
[32m[I 2023-04-26 01:33:35,434][39m Trial 423 finished with value: 0.8478260869565216 and parameters: {'objective': 'CrossEntropy', 'colsample_bylevel': 0.09687946731583016, 'depth': 3, 'boosting_type': 'Plain', 'bootstrap_type': 'Bayesian', 'bagging_temperature': 8.827442111077698}. Best is trial 129 with value: 0.9195402298850575.
[32m[I 2023-04-26 01:33:39,056][39m Trial 424 finished with value: 0.8666666666666666 and parameters: {'objective': 'CrossEntropy', 'colsample_bylevel': 0.09204387756955731, 'depth': 12, 'boosting_type': 'Plain', 'bootstrap_type': 'Bernoulli', 'subsample': 0.18265804577545758}. Best is trial 129 with value: 0.9195402298850575.
[32m[I 2023-04-26 01:33:42,421][39m Trial 425 finished with value: 0.888888888888889 and parameters: {'objective': 'CrossEntropy', 'colsample_bylevel': 0.0952402351637579, 'depth': 12, 'boosting_type': 'Plain', 'bootstrap_type': 'Bayesian', 'bagging_temperature': 9.26028356038517}. Best is trial 129 with value: 0.9195402298850575.
[32m[I 2023-04-26 01:33:45,953][39m Trial 426 finished with value: 0.8705882352941177 and parameters: {'objective': 'CrossEntropy', 'colsample_bylevel': 0.09506323717725536, 'depth': 12, 'boosting_type': 'Plain', 'bootstrap_type': 'Bayesian', 'bagging_temperature': 9.591919290559355}. Best is trial 129 with value: 0.9195402298850575.
[32m[I 2023-04-26 01:33:49,020][39m Trial 427 finished with value: 0.8764044943820225 and parameters: {'objective': 'CrossEntropy', 'colsample_bylevel': 0.087893128588062, 'depth': 12, 'boosting_type': 'Plain', 'bootstrap_type': 'Bayesian', 'bagging_temperature': 9.002514701338253}. Best is trial 129 with value: 0.9195402298850575.
[32m[I 2023-04-26 01:33:52,245][39m Trial 428 finished with value: 0.8988764044943819 and parameters: {'objective': 'CrossEntropy', 'colsample_bylevel': 0.09155357090667737, 'depth': 12, 'boosting_type': 'Plain', 'bootstrap_type': 'Bayesian', 'bagging_temperature': 8.705895396204667}. Best is trial 129 with value: 0.9195402298850575.
[32m[I 2023-04-26 01:33:55,646][39m Trial 429 finished with value: 0.8988764044943819 and parameters: {'objective': 'CrossEntropy', 'colsample_bylevel': 0.09387097818314738, 'depth': 12, 'boosting_type': 'Plain', 'bootstrap_type': 'Bayesian', 'bagging_temperature': 9.278799744060981}. Best is trial 129 with value: 0.9195402298850575.
[32m[I 2023-04-26 01:33:59,188][39m Trial 430 finished with value: 0.9090909090909092 and parameters: {'objective': 'CrossEntropy', 'colsample_bylevel': 0.09564681449418723, 'depth': 12, 'boosting_type': 'Plain', 'bootstrap_type': 'Bayesian', 'bagging_temperature': 9.008267325292847}. Best is trial 129 with value: 0.9195402298850575.
[32m[I 2023-04-26 01:34:02,709][39m Trial 431 finished with value: 0.8695652173913043 and parameters: {'objective': 'CrossEntropy', 'colsample_bylevel': 0.09634547961887716, 'depth': 12, 'boosting_type': 'Plain', 'bootstrap_type': 'Bayesian', 'bagging_temperature': 8.920758768013739}. Best is trial 129 with value: 0.9195402298850575.
[32m[I 2023-04-26 01:34:06,085][39m Trial 432 finished with value: 0.8988764044943819 and parameters: {'objective': 'CrossEntropy', 'colsample_bylevel': 0.09291947174693958, 'depth': 12, 'boosting_type': 'Plain', 'bootstrap_type': 'Bayesian', 'bagging_temperature': 8.568369484954584}. Best is trial 129 with value: 0.9195402298850575.
[32m[I 2023-04-26 01:34:09,102][39m Trial 433 finished with value: 0.8764044943820225 and parameters: {'objective': 'CrossEntropy', 'colsample_bylevel': 0.09000635626722625, 'depth': 12, 'boosting_type': 'Plain', 'bootstrap_type': 'Bayesian', 'bagging_temperature': 9.103623230966761}. Best is trial 129 with value: 0.9195402298850575.
[32m[I 2023-04-26 01:34:12,784][39m Trial 434 finished with value: 0.8666666666666666 and parameters: {'objective': 'CrossEntropy', 'colsample_bylevel': 0.09482199271570492, 'depth': 12, 'boosting_type': 'Plain', 'bootstrap_type': 'Bayesian', 'bagging_temperature': 5.06770519912523}. Best is trial 129 with value: 0.9195402298850575.
[32m[I 2023-04-26 01:34:16,573][39m Trial 435 finished with value: 0.888888888888889 and parameters: {'objective': 'CrossEntropy', 'colsample_bylevel': 0.09200989856673725, 'depth': 12, 'boosting_type': 'Plain', 'bootstrap_type': 'Bayesian', 'bagging_temperature': 6.734895847355718}. Best is trial 129 with value: 0.9195402298850575.
[32m[I 2023-04-26 01:34:20,549][39m Trial 436 finished with value: 0.8965517241379309 and parameters: {'objective': 'CrossEntropy', 'colsample_bylevel': 0.09709005645378319, 'depth': 12, 'boosting_type': 'Plain', 'bootstrap_type': 'Bayesian', 'bagging_temperature': 2.5238494225736616}. Best is trial 129 with value: 0.9195402298850575.
[32m[I 2023-04-26 01:34:24,290][39m Trial 437 finished with value: 0.8863636363636364 and parameters: {'objective': 'CrossEntropy', 'colsample_bylevel': 0.09451137283032125, 'depth': 12, 'boosting_type': 'Plain', 'bootstrap_type': 'Bayesian', 'bagging_temperature': 8.815762509643855}. Best is trial 129 with value: 0.9195402298850575.
[32m[I 2023-04-26 01:34:27,836][39m Trial 438 finished with value: 0.9090909090909092 and parameters: {'objective': 'CrossEntropy', 'colsample_bylevel': 0.09624735624866995, 'depth': 12, 'boosting_type': 'Plain', 'bootstrap_type': 'Bayesian', 'bagging_temperature': 9.013855404279047}. Best is trial 129 with value: 0.9195402298850575.
[32m[I 2023-04-26 01:34:31,429][39m Trial 439 finished with value: 0.8837209302325582 and parameters: {'objective': 'CrossEntropy', 'colsample_bylevel': 0.09810173057734033, 'depth': 12, 'boosting_type': 'Plain', 'bootstrap_type': 'Bayesian', 'bagging_temperature': 9.032094700062038}. Best is trial 129 with value: 0.9195402298850575.
[32m[I 2023-04-26 01:34:34,958][39m Trial 440 finished with value: 0.888888888888889 and parameters: {'objective': 'CrossEntropy', 'colsample_bylevel': 0.09634085215333653, 'depth': 12, 'boosting_type': 'Plain', 'bootstrap_type': 'Bayesian', 'bagging_temperature': 8.661627328712289}. Best is trial 129 with value: 0.9195402298850575.
[32m[I 2023-04-26 01:34:38,864][39m Trial 441 finished with value: 0.8735632183908046 and parameters: {'objective': 'CrossEntropy', 'colsample_bylevel': 0.0976044291522639, 'depth': 12, 'boosting_type': 'Plain', 'bootstrap_type': 'Bayesian', 'bagging_temperature': 0.4688500421037247}. Best is trial 129 with value: 0.9195402298850575.
[32m[I 2023-04-26 01:34:45,416][39m Trial 442 finished with value: 0.8297872340425531 and parameters: {'objective': 'CrossEntropy', 'colsample_bylevel': 0.09314054111606275, 'depth': 12, 'boosting_type': 'Ordered', 'bootstrap_type': 'Bayesian', 'bagging_temperature': 9.291392467808294}. Best is trial 129 with value: 0.9195402298850575.
[32m[I 2023-04-26 01:34:48,639][39m Trial 443 finished with value: 0.8965517241379309 and parameters: {'objective': 'CrossEntropy', 'colsample_bylevel': 0.09120622296592139, 'depth': 12, 'boosting_type': 'Plain', 'bootstrap_type': 'Bayesian', 'bagging_temperature': 9.133916885813928}. Best is trial 129 with value: 0.9195402298850575.
[32m[I 2023-04-26 01:34:51,997][39m Trial 444 finished with value: 0.8863636363636364 and parameters: {'objective': 'CrossEntropy', 'colsample_bylevel': 0.09576733677812836, 'depth': 11, 'boosting_type': 'Plain', 'bootstrap_type': 'Bernoulli', 'subsample': 0.5914228064514611}. Best is trial 129 with value: 0.9195402298850575.
[32m[I 2023-04-26 01:34:55,478][39m Trial 445 finished with value: 0.888888888888889 and parameters: {'objective': 'CrossEntropy', 'colsample_bylevel': 0.09355921644609534, 'depth': 12, 'boosting_type': 'Plain', 'bootstrap_type': 'Bayesian', 'bagging_temperature': 9.399099223863491}. Best is trial 129 with value: 0.9195402298850575.
[32m[I 2023-04-26 01:34:59,019][39m Trial 446 finished with value: 0.888888888888889 and parameters: {'objective': 'CrossEntropy', 'colsample_bylevel': 0.09846392140949146, 'depth': 12, 'boosting_type': 'Plain', 'bootstrap_type': 'MVS'}. Best is trial 129 with value: 0.9195402298850575.
[32m[I 2023-04-26 01:35:02,922][39m Trial 447 finished with value: 0.8735632183908046 and parameters: {'objective': 'CrossEntropy', 'colsample_bylevel': 0.09601534827897062, 'depth': 12, 'boosting_type': 'Plain', 'bootstrap_type': 'Bayesian', 'bagging_temperature': 9.128319702637429}. Best is trial 129 with value: 0.9195402298850575.
[32m[I 2023-04-26 01:35:04,434][39m Trial 448 finished with value: 0.7912087912087912 and parameters: {'objective': 'CrossEntropy', 'colsample_bylevel': 0.03536956123682328, 'depth': 12, 'boosting_type': 'Plain', 'bootstrap_type': 'Bayesian', 'bagging_temperature': 8.405609435243994}. Best is trial 129 with value: 0.9195402298850575.
[32m[I 2023-04-26 01:35:08,059][39m Trial 449 finished with value: 0.8863636363636364 and parameters: {'objective': 'CrossEntropy', 'colsample_bylevel': 0.09680839780763417, 'depth': 11, 'boosting_type': 'Plain', 'bootstrap_type': 'Bayesian', 'bagging_temperature': 8.927805670039433}. Best is trial 129 with value: 0.9195402298850575.
[32m[I 2023-04-26 01:35:11,166][39m Trial 450 finished with value: 0.888888888888889 and parameters: {'objective': 'CrossEntropy', 'colsample_bylevel': 0.08944903163752017, 'depth': 11, 'boosting_type': 'Plain', 'bootstrap_type': 'Bayesian', 'bagging_temperature': 8.729025297127174}. Best is trial 129 with value: 0.9195402298850575.
[32m[I 2023-04-26 01:35:14,223][39m Trial 451 finished with value: 0.8791208791208791 and parameters: {'objective': 'CrossEntropy', 'colsample_bylevel': 0.09192257524973334, 'depth': 12, 'boosting_type': 'Plain', 'bootstrap_type': 'Bayesian', 'bagging_temperature': 8.91031986929122}. Best is trial 129 with value: 0.9195402298850575.
[32m[I 2023-04-26 01:35:17,765][39m Trial 452 finished with value: 0.8791208791208791 and parameters: {'objective': 'CrossEntropy', 'colsample_bylevel': 0.09428450078770428, 'depth': 12, 'boosting_type': 'Plain', 'bootstrap_type': 'Bayesian', 'bagging_temperature': 8.890735999401329}. Best is trial 129 with value: 0.9195402298850575.
[32m[I 2023-04-26 01:35:21,541][39m Trial 453 finished with value: 0.888888888888889 and parameters: {'objective': 'CrossEntropy', 'colsample_bylevel': 0.09808175522003225, 'depth': 11, 'boosting_type': 'Plain', 'bootstrap_type': 'Bayesian', 'bagging_temperature': 8.549336709361741}. Best is trial 129 with value: 0.9195402298850575.
[32m[I 2023-04-26 01:35:24,940][39m Trial 454 finished with value: 0.8988764044943819 and parameters: {'objective': 'CrossEntropy', 'colsample_bylevel': 0.094176769252872, 'depth': 12, 'boosting_type': 'Plain', 'bootstrap_type': 'Bayesian', 'bagging_temperature': 9.512335438122502}. Best is trial 129 with value: 0.9195402298850575.
[32m[I 2023-04-26 01:35:28,723][39m Trial 455 finished with value: 0.888888888888889 and parameters: {'objective': 'CrossEntropy', 'colsample_bylevel': 0.09995424283749528, 'depth': 12, 'boosting_type': 'Plain', 'bootstrap_type': 'Bayesian', 'bagging_temperature': 9.076146975546436}. Best is trial 129 with value: 0.9195402298850575.
[32m[I 2023-04-26 01:35:32,012][39m Trial 456 finished with value: 0.8988764044943819 and parameters: {'objective': 'CrossEntropy', 'colsample_bylevel': 0.09101519266802671, 'depth': 11, 'boosting_type': 'Plain', 'bootstrap_type': 'Bayesian', 'bagging_temperature': 9.3258398612966}. Best is trial 129 with value: 0.9195402298850575.
[32m[I 2023-04-26 01:35:35,504][39m Trial 457 finished with value: 0.8791208791208791 and parameters: {'objective': 'CrossEntropy', 'colsample_bylevel': 0.09263346342742063, 'depth': 12, 'boosting_type': 'Plain', 'bootstrap_type': 'Bayesian', 'bagging_temperature': 9.521944492672462}. Best is trial 129 with value: 0.9195402298850575.
[32m[I 2023-04-26 01:35:39,018][39m Trial 458 finished with value: 0.888888888888889 and parameters: {'objective': 'CrossEntropy', 'colsample_bylevel': 0.09554738578050248, 'depth': 12, 'boosting_type': 'Plain', 'bootstrap_type': 'Bayesian', 'bagging_temperature': 8.73500139961767}. Best is trial 129 with value: 0.9195402298850575.
