[32m[I 2023-04-26 01:35:42,422][39m Trial 459 finished with value: 0.8988764044943819 and parameters: {'objective': 'CrossEntropy', 'colsample_bylevel': 0.09705324040176729, 'depth': 11, 'boosting_type': 'Plain', 'bootstrap_type': 'Bayesian', 'bagging_temperature': 9.278179266157206}. Best is trial 129 with value: 0.9195402298850575.
[32m[I 2023-04-26 01:35:45,818][39m Trial 460 finished with value: 0.8764044943820225 and parameters: {'objective': 'CrossEntropy', 'colsample_bylevel': 0.09485335832363478, 'depth': 12, 'boosting_type': 'Plain', 'bootstrap_type': 'Bayesian', 'bagging_temperature': 9.072593809088175}. Best is trial 129 with value: 0.9195402298850575.
[32m[I 2023-04-26 01:35:51,424][39m Trial 461 finished with value: 0.8043478260869564 and parameters: {'objective': 'CrossEntropy', 'colsample_bylevel': 0.09881936426674996, 'depth': 10, 'boosting_type': 'Ordered', 'bootstrap_type': 'Bayesian', 'bagging_temperature': 8.882678658141694}. Best is trial 129 with value: 0.9195402298850575.
[32m[I 2023-04-26 01:35:55,085][39m Trial 462 finished with value: 0.8965517241379309 and parameters: {'objective': 'CrossEntropy', 'colsample_bylevel': 0.0963603271262455, 'depth': 12, 'boosting_type': 'Plain', 'bootstrap_type': 'Bayesian', 'bagging_temperature': 8.622854550316312}. Best is trial 129 with value: 0.9195402298850575.
[32m[I 2023-04-26 01:35:58,450][39m Trial 463 finished with value: 0.888888888888889 and parameters: {'objective': 'CrossEntropy', 'colsample_bylevel': 0.09333298295655276, 'depth': 11, 'boosting_type': 'Plain', 'bootstrap_type': 'Bayesian', 'bagging_temperature': 9.61638782469232}. Best is trial 129 with value: 0.9195402298850575.
[32m[I 2023-04-26 01:36:01,906][39m Trial 464 finished with value: 0.8988764044943819 and parameters: {'objective': 'CrossEntropy', 'colsample_bylevel': 0.09539884505486138, 'depth': 12, 'boosting_type': 'Plain', 'bootstrap_type': 'Bayesian', 'bagging_temperature': 9.168461269352745}. Best is trial 129 with value: 0.9195402298850575.
[32m[I 2023-04-26 01:36:05,066][39m Trial 465 finished with value: 0.8863636363636364 and parameters: {'objective': 'CrossEntropy', 'colsample_bylevel': 0.08994620495223672, 'depth': 11, 'boosting_type': 'Plain', 'bootstrap_type': 'Bayesian', 'bagging_temperature': 9.392789557798288}. Best is trial 129 with value: 0.9195402298850575.
[32m[I 2023-04-26 01:36:08,373][39m Trial 466 finished with value: 0.8863636363636364 and parameters: {'objective': 'CrossEntropy', 'colsample_bylevel': 0.09752784978567271, 'depth': 12, 'boosting_type': 'Plain', 'bootstrap_type': 'Bayesian', 'bagging_temperature': 8.37604300493851}. Best is trial 129 with value: 0.9195402298850575.
[32m[I 2023-04-26 01:36:10,601][39m Trial 467 finished with value: 0.8297872340425531 and parameters: {'objective': 'CrossEntropy', 'colsample_bylevel': 0.09168241887218552, 'depth': 2, 'boosting_type': 'Plain', 'bootstrap_type': 'MVS'}. Best is trial 129 with value: 0.9195402298850575.
[32m[I 2023-04-26 01:36:13,814][39m Trial 468 finished with value: 0.8571428571428571 and parameters: {'objective': 'CrossEntropy', 'colsample_bylevel': 0.09358080506732563, 'depth': 6, 'boosting_type': 'Plain', 'bootstrap_type': 'Bernoulli', 'subsample': 0.44626145524473526}. Best is trial 129 with value: 0.9195402298850575.
[32m[I 2023-04-26 01:36:16,819][39m Trial 469 finished with value: 0.8666666666666666 and parameters: {'objective': 'CrossEntropy', 'colsample_bylevel': 0.08747056096465151, 'depth': 12, 'boosting_type': 'Plain', 'bootstrap_type': 'Bayesian', 'bagging_temperature': 3.2762132035771536}. Best is trial 129 with value: 0.9195402298850575.
[32m[I 2023-04-26 01:36:20,075][39m Trial 470 finished with value: 0.8764044943820225 and parameters: {'objective': 'CrossEntropy', 'colsample_bylevel': 0.09418266142823972, 'depth': 11, 'boosting_type': 'Plain', 'bootstrap_type': 'Bayesian', 'bagging_temperature': 9.647281318477182}. Best is trial 129 with value: 0.9195402298850575.
[32m[I 2023-04-26 01:36:23,707][39m Trial 471 finished with value: 0.888888888888889 and parameters: {'objective': 'CrossEntropy', 'colsample_bylevel': 0.09612400538923695, 'depth': 12, 'boosting_type': 'Plain', 'bootstrap_type': 'Bayesian', 'bagging_temperature': 8.036637422069662}. Best is trial 129 with value: 0.9195402298850575.
[32m[I 2023-04-26 01:36:27,427][39m Trial 472 finished with value: 0.888888888888889 and parameters: {'objective': 'CrossEntropy', 'colsample_bylevel': 0.09832564999986575, 'depth': 12, 'boosting_type': 'Plain', 'bootstrap_type': 'Bayesian', 'bagging_temperature': 8.993233536957614}. Best is trial 129 with value: 0.9195402298850575.
[32m[I 2023-04-26 01:36:30,752][39m Trial 473 finished with value: 0.888888888888889 and parameters: {'objective': 'CrossEntropy', 'colsample_bylevel': 0.09577816546405536, 'depth': 12, 'boosting_type': 'Plain', 'bootstrap_type': 'Bayesian', 'bagging_temperature': 9.216307349227451}. Best is trial 129 with value: 0.9195402298850575.
[32m[I 2023-04-26 01:36:34,169][39m Trial 474 finished with value: 0.8636363636363636 and parameters: {'objective': 'CrossEntropy', 'colsample_bylevel': 0.09283522678931333, 'depth': 11, 'boosting_type': 'Plain', 'bootstrap_type': 'Bayesian', 'bagging_temperature': 8.87241863543015}. Best is trial 129 with value: 0.9195402298850575.
[32m[I 2023-04-26 01:36:37,808][39m Trial 475 finished with value: 0.9069767441860465 and parameters: {'objective': 'CrossEntropy', 'colsample_bylevel': 0.09808800347094904, 'depth': 12, 'boosting_type': 'Plain', 'bootstrap_type': 'Bayesian', 'bagging_temperature': 9.416088603979647}. Best is trial 129 with value: 0.9195402298850575.
[32m[I 2023-04-26 01:36:41,399][39m Trial 476 finished with value: 0.8791208791208791 and parameters: {'objective': 'CrossEntropy', 'colsample_bylevel': 0.09982117572490655, 'depth': 11, 'boosting_type': 'Plain', 'bootstrap_type': 'Bayesian', 'bagging_temperature': 8.718733440070292}. Best is trial 129 with value: 0.9195402298850575.
[32m[I 2023-04-26 01:36:44,957][39m Trial 477 finished with value: 0.8539325842696629 and parameters: {'objective': 'CrossEntropy', 'colsample_bylevel': 0.09508807574815578, 'depth': 12, 'boosting_type': 'Plain', 'bootstrap_type': 'Bayesian', 'bagging_temperature': 9.18592973595748}. Best is trial 129 with value: 0.9195402298850575.
[32m[I 2023-04-26 01:36:47,951][39m Trial 478 finished with value: 0.8666666666666666 and parameters: {'objective': 'CrossEntropy', 'colsample_bylevel': 0.08943031212711924, 'depth': 12, 'boosting_type': 'Plain', 'bootstrap_type': 'Bayesian', 'bagging_temperature': 9.632997022079342}. Best is trial 129 with value: 0.9195402298850575.
[32m[I 2023-04-26 01:36:51,250][39m Trial 479 finished with value: 0.8791208791208791 and parameters: {'objective': 'CrossEntropy', 'colsample_bylevel': 0.09150731080619781, 'depth': 11, 'boosting_type': 'Plain', 'bootstrap_type': 'Bayesian', 'bagging_temperature': 9.314880031281586}. Best is trial 129 with value: 0.9195402298850575.
[32m[I 2023-04-26 01:36:57,632][39m Trial 480 finished with value: 0.8172043010752689 and parameters: {'objective': 'CrossEntropy', 'colsample_bylevel': 0.09292052277390042, 'depth': 12, 'boosting_type': 'Ordered', 'bootstrap_type': 'Bayesian', 'bagging_temperature': 9.477016732171816}. Best is trial 129 with value: 0.9195402298850575.
[32m[I 2023-04-26 01:37:01,136][39m Trial 481 finished with value: 0.8764044943820225 and parameters: {'objective': 'CrossEntropy', 'colsample_bylevel': 0.09735916045946721, 'depth': 12, 'boosting_type': 'Plain', 'bootstrap_type': 'Bayesian', 'bagging_temperature': 9.79363227290974}. Best is trial 129 with value: 0.9195402298850575.
[32m[I 2023-04-26 01:37:04,618][39m Trial 482 finished with value: 0.8988764044943819 and parameters: {'objective': 'CrossEntropy', 'colsample_bylevel': 0.09517432712437829, 'depth': 12, 'boosting_type': 'Plain', 'bootstrap_type': 'Bayesian', 'bagging_temperature': 9.019159103295422}. Best is trial 129 with value: 0.9195402298850575.
[32m[I 2023-04-26 01:37:07,869][39m Trial 483 finished with value: 0.888888888888889 and parameters: {'objective': 'CrossEntropy', 'colsample_bylevel': 0.09082725853785925, 'depth': 12, 'boosting_type': 'Plain', 'bootstrap_type': 'Bayesian', 'bagging_temperature': 7.433510733038423}. Best is trial 129 with value: 0.9195402298850575.
[32m[I 2023-04-26 01:37:10,941][39m Trial 484 finished with value: 0.888888888888889 and parameters: {'objective': 'CrossEntropy', 'colsample_bylevel': 0.09401600692612935, 'depth': 10, 'boosting_type': 'Plain', 'bootstrap_type': 'Bayesian', 'bagging_temperature': 6.408597730341485}. Best is trial 129 with value: 0.9195402298850575.
[32m[I 2023-04-26 01:37:14,523][39m Trial 485 finished with value: 0.8988764044943819 and parameters: {'objective': 'CrossEntropy', 'colsample_bylevel': 0.09226069181667317, 'depth': 12, 'boosting_type': 'Plain', 'bootstrap_type': 'Bayesian', 'bagging_temperature': 9.281480592802879}. Best is trial 129 with value: 0.9195402298850575.
[32m[I 2023-04-26 01:37:16,436][39m Trial 486 finished with value: 0.8387096774193549 and parameters: {'objective': 'CrossEntropy', 'colsample_bylevel': 0.06132742581072706, 'depth': 11, 'boosting_type': 'Plain', 'bootstrap_type': 'Bayesian', 'bagging_temperature': 9.533063832171852}. Best is trial 129 with value: 0.9195402298850575.
[32m[I 2023-04-26 01:37:20,279][39m Trial 487 finished with value: 0.8505747126436782 and parameters: {'objective': 'CrossEntropy', 'colsample_bylevel': 0.09672092031179841, 'depth': 11, 'boosting_type': 'Plain', 'bootstrap_type': 'Bayesian', 'bagging_temperature': 8.459427615965685}. Best is trial 129 with value: 0.9195402298850575.
[32m[I 2023-04-26 01:37:23,125][39m Trial 488 finished with value: 0.8636363636363636 and parameters: {'objective': 'CrossEntropy', 'colsample_bylevel': 0.07942586610285017, 'depth': 12, 'boosting_type': 'Plain', 'bootstrap_type': 'MVS'}. Best is trial 129 with value: 0.9195402298850575.
[32m[I 2023-04-26 01:37:26,316][39m Trial 489 finished with value: 0.8539325842696629 and parameters: {'objective': 'CrossEntropy', 'colsample_bylevel': 0.08581174685965999, 'depth': 12, 'boosting_type': 'Plain', 'bootstrap_type': 'Bernoulli', 'subsample': 0.2887858865070035}. Best is trial 129 with value: 0.9195402298850575.
[32m[I 2023-04-26 01:37:29,996][39m Trial 490 finished with value: 0.8695652173913043 and parameters: {'objective': 'CrossEntropy', 'colsample_bylevel': 0.09391748780906269, 'depth': 12, 'boosting_type': 'Plain', 'bootstrap_type': 'Bayesian', 'bagging_temperature': 9.117391755204405}. Best is trial 129 with value: 0.9195402298850575.
[32m[I 2023-04-26 01:37:33,733][39m Trial 491 finished with value: 0.8988764044943819 and parameters: {'objective': 'CrossEntropy', 'colsample_bylevel': 0.09851758665679476, 'depth': 12, 'boosting_type': 'Plain', 'bootstrap_type': 'Bayesian', 'bagging_temperature': 9.997789494563424}. Best is trial 129 with value: 0.9195402298850575.
[32m[I 2023-04-26 01:37:36,624][39m Trial 492 finished with value: 0.8478260869565216 and parameters: {'objective': 'CrossEntropy', 'colsample_bylevel': 0.09073892455994279, 'depth': 11, 'boosting_type': 'Plain', 'bootstrap_type': 'Bayesian', 'bagging_temperature': 9.677281614472975}. Best is trial 129 with value: 0.9195402298850575.
[32m[I 2023-04-26 01:37:39,889][39m Trial 493 finished with value: 0.9090909090909092 and parameters: {'objective': 'CrossEntropy', 'colsample_bylevel': 0.09586106405956887, 'depth': 11, 'boosting_type': 'Plain', 'bootstrap_type': 'Bayesian', 'bagging_temperature': 8.862331889685965}. Best is trial 129 with value: 0.9195402298850575.
[32m[I 2023-04-26 01:37:42,785][39m Trial 494 finished with value: 0.8764044943820225 and parameters: {'objective': 'Logloss', 'colsample_bylevel': 0.0887711041992968, 'depth': 11, 'boosting_type': 'Plain', 'bootstrap_type': 'Bayesian', 'bagging_temperature': 4.446774425159277}. Best is trial 129 with value: 0.9195402298850575.
[32m[I 2023-04-26 01:37:46,341][39m Trial 495 finished with value: 0.888888888888889 and parameters: {'objective': 'CrossEntropy', 'colsample_bylevel': 0.09689732031984463, 'depth': 11, 'boosting_type': 'Plain', 'bootstrap_type': 'Bayesian', 'bagging_temperature': 8.785373197051738}. Best is trial 129 with value: 0.9195402298850575.
[32m[I 2023-04-26 01:37:49,662][39m Trial 496 finished with value: 0.8666666666666666 and parameters: {'objective': 'CrossEntropy', 'colsample_bylevel': 0.09528417556625723, 'depth': 10, 'boosting_type': 'Plain', 'bootstrap_type': 'Bayesian', 'bagging_temperature': 8.615421110400629}. Best is trial 129 with value: 0.9195402298850575.
[32m[I 2023-04-26 01:37:53,202][39m Trial 497 finished with value: 0.9090909090909092 and parameters: {'objective': 'CrossEntropy', 'colsample_bylevel': 0.09215510132378536, 'depth': 12, 'boosting_type': 'Plain', 'bootstrap_type': 'Bayesian', 'bagging_temperature': 9.416400861158323}. Best is trial 129 with value: 0.9195402298850575.
[32m[I 2023-04-26 01:37:56,726][39m Trial 498 finished with value: 0.8988764044943819 and parameters: {'objective': 'CrossEntropy', 'colsample_bylevel': 0.09186144592412844, 'depth': 12, 'boosting_type': 'Plain', 'bootstrap_type': 'Bayesian', 'bagging_temperature': 9.084786775574816}. Best is trial 129 with value: 0.9195402298850575.
[32m[I 2023-04-26 01:38:00,436][39m Trial 499 finished with value: 0.8988764044943819 and parameters: {'objective': 'CrossEntropy', 'colsample_bylevel': 0.09279089539593495, 'depth': 12, 'boosting_type': 'Plain', 'bootstrap_type': 'Bayesian', 'bagging_temperature': 9.458986484793963}. Best is trial 129 with value: 0.9195402298850575.
Number of finished trials: 500