
[32m[I 2023-04-26 01:09:29,041][39m A new study created in memory with name: no-name-b6c2f68a-0619-4230-a285-17b341990b09
[32m[I 2023-04-26 01:09:32,319][39m Trial 0 finished with value: 0.7628865979381443 and parameters: {'objective': 'Logloss', 'colsample_bylevel': 0.041555922807726235, 'depth': 4, 'boosting_type': 'Ordered', 'bootstrap_type': 'Bernoulli', 'subsample': 0.12137637819727555}. Best is trial 0 with value: 0.7628865979381443.
[32m[I 2023-04-26 01:09:37,878][39m Trial 1 finished with value: 0.8085106382978724 and parameters: {'objective': 'Logloss', 'colsample_bylevel': 0.0942900100623424, 'depth': 11, 'boosting_type': 'Ordered', 'bootstrap_type': 'MVS'}. Best is trial 1 with value: 0.8085106382978724.
[32m[I 2023-04-26 01:09:39,917][39m Trial 2 finished with value: 0.8125 and parameters: {'objective': 'Logloss', 'colsample_bylevel': 0.048040878595188685, 'depth': 7, 'boosting_type': 'Plain', 'bootstrap_type': 'MVS'}. Best is trial 2 with value: 0.8125.
[32m[I 2023-04-26 01:09:45,153][39m Trial 3 finished with value: 0.7956989247311829 and parameters: {'objective': 'Logloss', 'colsample_bylevel': 0.09328814951259147, 'depth': 7, 'boosting_type': 'Ordered', 'bootstrap_type': 'Bayesian', 'bagging_temperature': 9.780947004701897}. Best is trial 2 with value: 0.8125.
[32m[I 2023-04-26 01:09:47,737][39m Trial 4 finished with value: 0.7878787878787878 and parameters: {'objective': 'CrossEntropy', 'colsample_bylevel': 0.02031390328615365, 'depth': 11, 'boosting_type': 'Ordered', 'bootstrap_type': 'Bernoulli', 'subsample': 0.5543955142468001}. Best is trial 2 with value: 0.8125.
[32m[I 2023-04-26 01:09:51,577][39m Trial 5 finished with value: 0.7037037037037037 and parameters: {'objective': 'Logloss', 'colsample_bylevel': 0.027405020563732833, 'depth': 1, 'boosting_type': 'Ordered', 'bootstrap_type': 'MVS'}. Best is trial 2 with value: 0.8125.
[32m[I 2023-04-26 01:09:55,723][39m Trial 6 finished with value: 0.7872340425531914 and parameters: {'objective': 'Logloss', 'colsample_bylevel': 0.056508445373024796, 'depth': 7, 'boosting_type': 'Ordered', 'bootstrap_type': 'MVS'}. Best is trial 2 with value: 0.8125.
[32m[I 2023-04-26 01:09:58,558][39m Trial 7 finished with value: 0.8172043010752689 and parameters: {'objective': 'CrossEntropy', 'colsample_bylevel': 0.06156693156380818, 'depth': 11, 'boosting_type': 'Plain', 'bootstrap_type': 'Bernoulli', 'subsample': 0.40331773413511873}. Best is trial 7 with value: 0.8172043010752689.
[32m[I 2023-04-26 01:10:00,026][39m Trial 8 finished with value: 0.7835051546391752 and parameters: {'objective': 'CrossEntropy', 'colsample_bylevel': 0.052845087940315005, 'depth': 1, 'boosting_type': 'Plain', 'bootstrap_type': 'MVS'}. Best is trial 7 with value: 0.8172043010752689.
[32m[I 2023-04-26 01:10:03,638][39m Trial 9 finished with value: 0.7789473684210526 and parameters: {'objective': 'CrossEntropy', 'colsample_bylevel': 0.029204605234389495, 'depth': 12, 'boosting_type': 'Ordered', 'bootstrap_type': 'MVS'}. Best is trial 7 with value: 0.8172043010752689.
[32m[I 2023-04-26 01:10:06,977][39m Trial 10 finished with value: 0.860215053763441 and parameters: {'objective': 'CrossEntropy', 'colsample_bylevel': 0.06856004866923779, 'depth': 9, 'boosting_type': 'Plain', 'bootstrap_type': 'Bernoulli', 'subsample': 0.9122589836893689}. Best is trial 10 with value: 0.860215053763441.
[32m[I 2023-04-26 01:10:10,326][39m Trial 11 finished with value: 0.8695652173913043 and parameters: {'objective': 'CrossEntropy', 'colsample_bylevel': 0.07217682766684946, 'depth': 9, 'boosting_type': 'Plain', 'bootstrap_type': 'Bernoulli', 'subsample': 0.968425388408967}. Best is trial 11 with value: 0.8695652173913043.
[32m[I 2023-04-26 01:10:13,297][39m Trial 12 finished with value: 0.8791208791208791 and parameters: {'objective': 'CrossEntropy', 'colsample_bylevel': 0.0726092536590649, 'depth': 8, 'boosting_type': 'Plain', 'bootstrap_type': 'Bernoulli', 'subsample': 0.938649362088745}. Best is trial 12 with value: 0.8791208791208791.
[32m[I 2023-04-26 01:10:16,881][39m Trial 13 finished with value: 0.8764044943820225 and parameters: {'objective': 'CrossEntropy', 'colsample_bylevel': 0.07602433517838121, 'depth': 9, 'boosting_type': 'Plain', 'bootstrap_type': 'Bernoulli', 'subsample': 0.9890357081805702}. Best is trial 12 with value: 0.8791208791208791.
[32m[I 2023-04-26 01:10:19,393][39m Trial 14 finished with value: 0.8478260869565216 and parameters: {'objective': 'CrossEntropy', 'colsample_bylevel': 0.08339550693459649, 'depth': 4, 'boosting_type': 'Plain', 'bootstrap_type': 'Bayesian', 'bagging_temperature': 0.35738939817048987}. Best is trial 12 with value: 0.8791208791208791.
[32m[I 2023-04-26 01:10:22,984][39m Trial 15 finished with value: 0.860215053763441 and parameters: {'objective': 'CrossEntropy', 'colsample_bylevel': 0.07778184158632219, 'depth': 9, 'boosting_type': 'Plain', 'bootstrap_type': 'Bernoulli', 'subsample': 0.7766131645498031}. Best is trial 12 with value: 0.8791208791208791.
[32m[I 2023-04-26 01:10:27,045][39m Trial 16 finished with value: 0.888888888888889 and parameters: {'objective': 'CrossEntropy', 'colsample_bylevel': 0.08503785249303959, 'depth': 9, 'boosting_type': 'Plain', 'bootstrap_type': 'Bernoulli', 'subsample': 0.7451669045457334}. Best is trial 16 with value: 0.888888888888889.
[32m[I 2023-04-26 01:10:29,875][39m Trial 17 finished with value: 0.8571428571428571 and parameters: {'objective': 'CrossEntropy', 'colsample_bylevel': 0.08527558357694554, 'depth': 5, 'boosting_type': 'Plain', 'bootstrap_type': 'Bayesian', 'bagging_temperature': 5.330825711334095}. Best is trial 16 with value: 0.888888888888889.
[32m[I 2023-04-26 01:10:32,781][39m Trial 18 finished with value: 0.8636363636363636 and parameters: {'objective': 'CrossEntropy', 'colsample_bylevel': 0.09661675211083318, 'depth': 5, 'boosting_type': 'Plain', 'bootstrap_type': 'Bernoulli', 'subsample': 0.7060199265634938}. Best is trial 16 with value: 0.888888888888889.
[32m[I 2023-04-26 01:10:35,238][39m Trial 19 finished with value: 0.8571428571428571 and parameters: {'objective': 'CrossEntropy', 'colsample_bylevel': 0.06538344918758045, 'depth': 8, 'boosting_type': 'Plain', 'bootstrap_type': 'Bernoulli', 'subsample': 0.7358448722693769}. Best is trial 16 with value: 0.888888888888889.
[32m[I 2023-04-26 01:10:38,019][39m Trial 20 finished with value: 0.8571428571428571 and parameters: {'objective': 'CrossEntropy', 'colsample_bylevel': 0.08524622811747609, 'depth': 10, 'boosting_type': 'Plain', 'bootstrap_type': 'Bernoulli', 'subsample': 0.554589898518188}. Best is trial 16 with value: 0.888888888888889.
[32m[I 2023-04-26 01:10:41,351][39m Trial 21 finished with value: 0.8791208791208791 and parameters: {'objective': 'CrossEntropy', 'colsample_bylevel': 0.07671565962074262, 'depth': 8, 'boosting_type': 'Plain', 'bootstrap_type': 'Bernoulli', 'subsample': 0.9849469400749628}. Best is trial 16 with value: 0.888888888888889.
[32m[I 2023-04-26 01:10:43,882][39m Trial 22 finished with value: 0.8444444444444446 and parameters: {'objective': 'CrossEntropy', 'colsample_bylevel': 0.08098620344565989, 'depth': 6, 'boosting_type': 'Plain', 'bootstrap_type': 'Bernoulli', 'subsample': 0.8652057439285765}. Best is trial 16 with value: 0.888888888888889.
[32m[I 2023-04-26 01:10:47,890][39m Trial 23 finished with value: 0.8636363636363636 and parameters: {'objective': 'CrossEntropy', 'colsample_bylevel': 0.08876639186552263, 'depth': 8, 'boosting_type': 'Plain', 'bootstrap_type': 'Bernoulli', 'subsample': 0.8145073817098014}. Best is trial 16 with value: 0.888888888888889.
[32m[I 2023-04-26 01:10:52,000][39m Trial 24 finished with value: 0.8636363636363636 and parameters: {'objective': 'CrossEntropy', 'colsample_bylevel': 0.09966919511697231, 'depth': 8, 'boosting_type': 'Plain', 'bootstrap_type': 'Bernoulli', 'subsample': 0.6617696558852919}. Best is trial 16 with value: 0.888888888888889.
[32m[I 2023-04-26 01:10:54,646][39m Trial 25 finished with value: 0.888888888888889 and parameters: {'objective': 'CrossEntropy', 'colsample_bylevel': 0.0748302366529416, 'depth': 10, 'boosting_type': 'Plain', 'bootstrap_type': 'Bayesian', 'bagging_temperature': 0.12535340815730933}. Best is trial 16 with value: 0.888888888888889.
[32m[I 2023-04-26 01:10:56,702][39m Trial 26 finished with value: 0.851063829787234 and parameters: {'objective': 'CrossEntropy', 'colsample_bylevel': 0.06143241576980006, 'depth': 10, 'boosting_type': 'Plain', 'bootstrap_type': 'Bayesian', 'bagging_temperature': 0.4218382170276677}. Best is trial 16 with value: 0.888888888888889.
[32m[I 2023-04-26 01:10:58,261][39m Trial 27 finished with value: 0.8297872340425531 and parameters: {'objective': 'CrossEntropy', 'colsample_bylevel': 0.04385148849786711, 'depth': 12, 'boosting_type': 'Plain', 'bootstrap_type': 'Bayesian', 'bagging_temperature': 3.792099088740748}. Best is trial 16 with value: 0.888888888888889.
[32m[I 2023-04-26 01:11:00,557][39m Trial 28 finished with value: 0.860215053763441 and parameters: {'objective': 'CrossEntropy', 'colsample_bylevel': 0.0691905452257812, 'depth': 10, 'boosting_type': 'Plain', 'bootstrap_type': 'Bayesian', 'bagging_temperature': 3.73123121273277}. Best is trial 16 with value: 0.888888888888889.
[32m[I 2023-04-26 01:11:02,923][39m Trial 29 finished with value: 0.8478260869565216 and parameters: {'objective': 'Logloss', 'colsample_bylevel': 0.07792767125649518, 'depth': 6, 'boosting_type': 'Plain', 'bootstrap_type': 'Bayesian', 'bagging_temperature': 7.048504834469167}. Best is trial 16 with value: 0.888888888888889.
[32m[I 2023-04-26 01:11:05,444][39m Trial 30 finished with value: 0.8131868131868132 and parameters: {'objective': 'CrossEntropy', 'colsample_bylevel': 0.09037828898591177, 'depth': 3, 'boosting_type': 'Plain', 'bootstrap_type': 'Bayesian', 'bagging_temperature': 2.060838961333876}. Best is trial 16 with value: 0.888888888888889.
[32m[I 2023-04-26 01:11:08,444][39m Trial 31 finished with value: 0.860215053763441 and parameters: {'objective': 'CrossEntropy', 'colsample_bylevel': 0.0737379283642723, 'depth': 8, 'boosting_type': 'Plain', 'bootstrap_type': 'Bernoulli', 'subsample': 0.9962863218631983}. Best is trial 16 with value: 0.888888888888889.
[32m[I 2023-04-26 01:11:10,548][39m Trial 32 finished with value: 0.8387096774193549 and parameters: {'objective': 'CrossEntropy', 'colsample_bylevel': 0.06414530477278765, 'depth': 10, 'boosting_type': 'Plain', 'bootstrap_type': 'Bernoulli', 'subsample': 0.8612954866541687}. Best is trial 16 with value: 0.888888888888889.
[32m[I 2023-04-26 01:11:13,389][39m Trial 33 finished with value: 0.8695652173913043 and parameters: {'objective': 'CrossEntropy', 'colsample_bylevel': 0.08091955986473713, 'depth': 11, 'boosting_type': 'Plain', 'bootstrap_type': 'Bernoulli', 'subsample': 0.6464840068540034}. Best is trial 16 with value: 0.888888888888889.
[32m[I 2023-04-26 01:11:17,260][39m Trial 34 finished with value: 0.7741935483870966 and parameters: {'objective': 'Logloss', 'colsample_bylevel': 0.05661508875966841, 'depth': 7, 'boosting_type': 'Ordered', 'bootstrap_type': 'Bernoulli', 'subsample': 0.4013672816564835}. Best is trial 16 with value: 0.888888888888889.
[32m[I 2023-04-26 01:11:22,002][39m Trial 35 finished with value: 0.8478260869565216 and parameters: {'objective': 'CrossEntropy', 'colsample_bylevel': 0.08932766787338972, 'depth': 8, 'boosting_type': 'Plain', 'bootstrap_type': 'Bayesian', 'bagging_temperature': 7.143017616574022}. Best is trial 16 with value: 0.888888888888889.
[32m[I 2023-04-26 01:11:26,251][39m Trial 36 finished with value: 0.8043478260869564 and parameters: {'objective': 'Logloss', 'colsample_bylevel': 0.07237457983715198, 'depth': 9, 'boosting_type': 'Ordered', 'bootstrap_type': 'Bernoulli', 'subsample': 0.8996091708877966}. Best is trial 16 with value: 0.888888888888889.
[32m[I 2023-04-26 01:11:28,236][39m Trial 37 finished with value: 0.8333333333333334 and parameters: {'objective': 'CrossEntropy', 'colsample_bylevel': 0.04930158207935396, 'depth': 6, 'boosting_type': 'Plain', 'bootstrap_type': 'MVS'}. Best is trial 16 with value: 0.888888888888889.
[32m[I 2023-04-26 01:11:33,664][39m Trial 38 finished with value: 0.8131868131868132 and parameters: {'objective': 'Logloss', 'colsample_bylevel': 0.09444161895983036, 'depth': 7, 'boosting_type': 'Ordered', 'bootstrap_type': 'Bernoulli', 'subsample': 0.8182002606712326}. Best is trial 16 with value: 0.888888888888889.
[32m[I 2023-04-26 01:11:34,789][39m Trial 39 finished with value: 0.7047619047619048 and parameters: {'objective': 'CrossEntropy', 'colsample_bylevel': 0.011925427129521451, 'depth': 10, 'boosting_type': 'Plain', 'bootstrap_type': 'Bayesian', 'bagging_temperature': 1.9369079197034482}. Best is trial 16 with value: 0.888888888888889.
[32m[I 2023-04-26 01:11:36,398][39m Trial 40 finished with value: 0.8125 and parameters: {'objective': 'CrossEntropy', 'colsample_bylevel': 0.03337969416261502, 'depth': 11, 'boosting_type': 'Plain', 'bootstrap_type': 'MVS'}. Best is trial 16 with value: 0.888888888888889.
[32m[I 2023-04-26 01:11:39,883][39m Trial 41 finished with value: 0.851063829787234 and parameters: {'objective': 'CrossEntropy', 'colsample_bylevel': 0.07624557630050081, 'depth': 9, 'boosting_type': 'Plain', 'bootstrap_type': 'Bernoulli', 'subsample': 0.9918181661766641}. Best is trial 16 with value: 0.888888888888889.
[32m[I 2023-04-26 01:11:43,118][39m Trial 42 finished with value: 0.851063829787234 and parameters: {'objective': 'CrossEntropy', 'colsample_bylevel': 0.070623938431287, 'depth': 9, 'boosting_type': 'Plain', 'bootstrap_type': 'Bernoulli', 'subsample': 0.9176886859933757}. Best is trial 16 with value: 0.888888888888889.
[32m[I 2023-04-26 01:11:45,544][39m Trial 43 finished with value: 0.8387096774193549 and parameters: {'objective': 'CrossEntropy', 'colsample_bylevel': 0.05988724309090786, 'depth': 8, 'boosting_type': 'Plain', 'bootstrap_type': 'Bernoulli', 'subsample': 0.9399215909737416}. Best is trial 16 with value: 0.888888888888889.
[32m[I 2023-04-26 01:11:48,768][39m Trial 44 finished with value: 0.8387096774193549 and parameters: {'objective': 'CrossEntropy', 'colsample_bylevel': 0.06633463576260978, 'depth': 9, 'boosting_type': 'Plain', 'bootstrap_type': 'Bernoulli', 'subsample': 0.9996118914144033}. Best is trial 16 with value: 0.888888888888889.
[32m[I 2023-04-26 01:11:53,709][39m Trial 45 finished with value: 0.8478260869565216 and parameters: {'objective': 'CrossEntropy', 'colsample_bylevel': 0.0762691836596923, 'depth': 11, 'boosting_type': 'Ordered', 'bootstrap_type': 'Bernoulli', 'subsample': 0.840786654980655}. Best is trial 16 with value: 0.888888888888889.
[32m[I 2023-04-26 01:11:56,771][39m Trial 46 finished with value: 0.8666666666666666 and parameters: {'objective': 'Logloss', 'colsample_bylevel': 0.08080753096669505, 'depth': 7, 'boosting_type': 'Plain', 'bootstrap_type': 'Bernoulli', 'subsample': 0.7619515145949383}. Best is trial 16 with value: 0.888888888888889.
[32m[I 2023-04-26 01:11:59,766][39m Trial 47 finished with value: 0.8666666666666666 and parameters: {'objective': 'CrossEntropy', 'colsample_bylevel': 0.08568957462261433, 'depth': 10, 'boosting_type': 'Plain', 'bootstrap_type': 'MVS'}. Best is trial 16 with value: 0.888888888888889.
[32m[I 2023-04-26 01:12:02,441][39m Trial 48 finished with value: 0.8478260869565216 and parameters: {'objective': 'CrossEntropy', 'colsample_bylevel': 0.07504377268498959, 'depth': 7, 'boosting_type': 'Plain', 'bootstrap_type': 'Bernoulli', 'subsample': 0.9223121626136337}. Best is trial 16 with value: 0.888888888888889.
[32m[I 2023-04-26 01:12:08,124][39m Trial 49 finished with value: 0.8387096774193549 and parameters: {'objective': 'CrossEntropy', 'colsample_bylevel': 0.09315123779558458, 'depth': 8, 'boosting_type': 'Ordered', 'bootstrap_type': 'Bayesian', 'bagging_temperature': 2.313473623580879}. Best is trial 16 with value: 0.888888888888889.
[32m[I 2023-04-26 01:12:11,242][39m Trial 50 finished with value: 0.8478260869565216 and parameters: {'objective': 'CrossEntropy', 'colsample_bylevel': 0.06789433983989872, 'depth': 9, 'boosting_type': 'Plain', 'bootstrap_type': 'Bernoulli', 'subsample': 0.8788763799583843}. Best is trial 16 with value: 0.888888888888889.
[32m[I 2023-04-26 01:12:14,040][39m Trial 51 finished with value: 0.8571428571428571 and parameters: {'objective': 'CrossEntropy', 'colsample_bylevel': 0.08173567414408935, 'depth': 12, 'boosting_type': 'Plain', 'bootstrap_type': 'Bernoulli', 'subsample': 0.6408813679815333}. Best is trial 16 with value: 0.888888888888889.
[32m[I 2023-04-26 01:12:17,583][39m Trial 52 finished with value: 0.851063829787234 and parameters: {'objective': 'CrossEntropy', 'colsample_bylevel': 0.07868839767128359, 'depth': 9, 'boosting_type': 'Plain', 'bootstrap_type': 'Bernoulli', 'subsample': 0.10258202268764754}. Best is trial 16 with value: 0.888888888888889.
[32m[I 2023-04-26 01:12:20,951][39m Trial 53 finished with value: 0.8791208791208791 and parameters: {'objective': 'CrossEntropy', 'colsample_bylevel': 0.07314875376972589, 'depth': 9, 'boosting_type': 'Plain', 'bootstrap_type': 'Bernoulli', 'subsample': 0.9577564882483397}. Best is trial 16 with value: 0.888888888888889.
[32m[I 2023-04-26 01:12:23,984][39m Trial 54 finished with value: 0.8791208791208791 and parameters: {'objective': 'CrossEntropy', 'colsample_bylevel': 0.08675707569503856, 'depth': 10, 'boosting_type': 'Plain', 'bootstrap_type': 'Bernoulli', 'subsample': 0.9360843481170782}. Best is trial 16 with value: 0.888888888888889.
[32m[I 2023-04-26 01:12:26,730][39m Trial 55 finished with value: 0.8478260869565216 and parameters: {'objective': 'CrossEntropy', 'colsample_bylevel': 0.08605109400077258, 'depth': 10, 'boosting_type': 'Plain', 'bootstrap_type': 'Bernoulli', 'subsample': 0.3706381235680513}. Best is trial 16 with value: 0.888888888888889.
[32m[I 2023-04-26 01:12:29,730][39m Trial 56 finished with value: 0.8666666666666666 and parameters: {'objective': 'CrossEntropy', 'colsample_bylevel': 0.08833608631510753, 'depth': 10, 'boosting_type': 'Plain', 'bootstrap_type': 'Bernoulli', 'subsample': 0.24922928422371832}. Best is trial 16 with value: 0.888888888888889.
[32m[I 2023-04-26 01:12:34,078][39m Trial 57 finished with value: 0.8764044943820225 and parameters: {'objective': 'CrossEntropy', 'colsample_bylevel': 0.09251399102734584, 'depth': 8, 'boosting_type': 'Plain', 'bootstrap_type': 'MVS'}. Best is trial 16 with value: 0.888888888888889.
[32m[I 2023-04-26 01:12:36,344][39m Trial 58 finished with value: 0.8571428571428571 and parameters: {'objective': 'CrossEntropy', 'colsample_bylevel': 0.07117276303270596, 'depth': 11, 'boosting_type': 'Plain', 'bootstrap_type': 'Bernoulli', 'subsample': 0.9248006316344293}. Best is trial 16 with value: 0.888888888888889.
[32m[I 2023-04-26 01:12:40,562][39m Trial 59 finished with value: 0.8965517241379309 and parameters: {'objective': 'Logloss', 'colsample_bylevel': 0.08351166401940602, 'depth': 9, 'boosting_type': 'Plain', 'bootstrap_type': 'Bayesian', 'bagging_temperature': 9.381107811660245}. Best is trial 59 with value: 0.8965517241379309.
[32m[I 2023-04-26 01:12:44,969][39m Trial 60 finished with value: 0.8764044943820225 and parameters: {'objective': 'Logloss', 'colsample_bylevel': 0.09998955723524891, 'depth': 8, 'boosting_type': 'Plain', 'bootstrap_type': 'Bayesian', 'bagging_temperature': 8.864075579269159}. Best is trial 59 with value: 0.8965517241379309.
[32m[I 2023-04-26 01:12:49,116][39m Trial 61 finished with value: 0.8636363636363636 and parameters: {'objective': 'Logloss', 'colsample_bylevel': 0.085236702309715, 'depth': 9, 'boosting_type': 'Plain', 'bootstrap_type': 'Bayesian', 'bagging_temperature': 6.41763660679343}. Best is trial 59 with value: 0.8965517241379309.
[32m[I 2023-04-26 01:12:51,835][39m Trial 62 finished with value: 0.860215053763441 and parameters: {'objective': 'Logloss', 'colsample_bylevel': 0.07923747388043796, 'depth': 10, 'boosting_type': 'Plain', 'bootstrap_type': 'Bayesian', 'bagging_temperature': 8.579306766211294}. Best is trial 59 with value: 0.8965517241379309.
[32m[I 2023-04-26 01:12:55,572][39m Trial 63 finished with value: 0.8571428571428571 and parameters: {'objective': 'Logloss', 'colsample_bylevel': 0.08337653611789489, 'depth': 9, 'boosting_type': 'Plain', 'bootstrap_type': 'Bayesian', 'bagging_temperature': 5.011699729281977}. Best is trial 59 with value: 0.8965517241379309.
[32m[I 2023-04-26 01:12:59,128][39m Trial 64 finished with value: 0.8695652173913043 and parameters: {'objective': 'Logloss', 'colsample_bylevel': 0.09624314288550798, 'depth': 10, 'boosting_type': 'Plain', 'bootstrap_type': 'Bayesian', 'bagging_temperature': 3.53761646832654}. Best is trial 59 with value: 0.8965517241379309.
[32m[I 2023-04-26 01:13:01,460][39m Trial 65 finished with value: 0.8695652173913043 and parameters: {'objective': 'CrossEntropy', 'colsample_bylevel': 0.07385495802074002, 'depth': 11, 'boosting_type': 'Plain', 'bootstrap_type': 'Bernoulli', 'subsample': 0.7960273387940522}. Best is trial 59 with value: 0.8965517241379309.
[32m[I 2023-04-26 01:13:04,451][39m Trial 66 finished with value: 0.851063829787234 and parameters: {'objective': 'CrossEntropy', 'colsample_bylevel': 0.06304737215354965, 'depth': 8, 'boosting_type': 'Plain', 'bootstrap_type': 'Bernoulli', 'subsample': 0.9426009074270331}. Best is trial 59 with value: 0.8965517241379309.
[32m[I 2023-04-26 01:13:08,052][39m Trial 67 finished with value: 0.8791208791208791 and parameters: {'objective': 'CrossEntropy', 'colsample_bylevel': 0.08226083178263927, 'depth': 9, 'boosting_type': 'Plain', 'bootstrap_type': 'Bayesian', 'bagging_temperature': 8.10399264129423}. Best is trial 59 with value: 0.8965517241379309.
