[32m[I 2023-04-26 02:15:55,851][39m A new study created in memory with name: no-name-93b66e3c-201f-4e03-a04d-2ce4f766e9f6
[32m[I 2023-04-26 02:15:56,005][39m Trial 0 finished with value: 0.7012987012987012 and parameters: {'criterion': 'gini', 'n_estimators': 184, 'max_features': 0.778529343223975, 'max_depth': 41, 'min_samples_split': 6, 'min_samples_leaf': 1}. Best is trial 0 with value: 0.7012987012987012.
[32m[I 2023-04-26 02:15:56,075][39m Trial 1 finished with value: 0.7142857142857142 and parameters: {'criterion': 'gini', 'n_estimators': 112, 'max_features': 0.3991604311350777, 'max_depth': 1, 'min_samples_split': 10, 'min_samples_leaf': 3}. Best is trial 1 with value: 0.7142857142857142.
[32m[I 2023-04-26 02:15:56,184][39m Trial 2 finished with value: 0.717391304347826 and parameters: {'criterion': 'gini', 'n_estimators': 138, 'max_features': 0.8893500506153251, 'max_depth': 54, 'min_samples_split': 10, 'min_samples_leaf': 9}. Best is trial 2 with value: 0.717391304347826.
[32m[I 2023-04-26 02:15:56,294][39m Trial 3 finished with value: 0.7032967032967035 and parameters: {'criterion': 'gini', 'n_estimators': 159, 'max_features': 0.4819993917737988, 'max_depth': 70, 'min_samples_split': 5, 'min_samples_leaf': 10}. Best is trial 2 with value: 0.717391304347826.
[32m[I 2023-04-26 02:15:56,398][39m Trial 4 finished with value: 0.6753246753246753 and parameters: {'criterion': 'gini', 'n_estimators': 146, 'max_features': 0.2572777773570516, 'max_depth': 29, 'min_samples_split': 5, 'min_samples_leaf': 1}. Best is trial 2 with value: 0.717391304347826.
[32m[I 2023-04-26 02:15:56,551][39m Trial 5 finished with value: 0.7441860465116279 and parameters: {'criterion': 'entropy', 'n_estimators': 185, 'max_features': 0.8363594469378273, 'max_depth': 30, 'min_samples_split': 5, 'min_samples_leaf': 6}. Best is trial 5 with value: 0.7441860465116279.
[32m[I 2023-04-26 02:15:56,636][39m Trial 6 finished with value: 0.7191011235955055 and parameters: {'criterion': 'entropy', 'n_estimators': 112, 'max_features': 0.6918599086836861, 'max_depth': 24, 'min_samples_split': 6, 'min_samples_leaf': 11}. Best is trial 5 with value: 0.7441860465116279.
[32m[I 2023-04-26 02:15:56,747][39m Trial 7 finished with value: 0.717391304347826 and parameters: {'criterion': 'gini', 'n_estimators': 178, 'max_features': 0.033677424985847804, 'max_depth': 3, 'min_samples_split': 10, 'min_samples_leaf': 6}. Best is trial 5 with value: 0.7441860465116279.
[32m[I 2023-04-26 02:15:56,847][39m Trial 8 finished with value: 0.7228915662650603 and parameters: {'criterion': 'gini', 'n_estimators': 144, 'max_features': 0.30642705608830423, 'max_depth': 58, 'min_samples_split': 6, 'min_samples_leaf': 3}. Best is trial 5 with value: 0.7441860465116279.
[32m[I 2023-04-26 02:15:56,976][39m Trial 9 finished with value: 0.7710843373493976 and parameters: {'criterion': 'gini', 'n_estimators': 159, 'max_features': 0.9585779241679936, 'max_depth': 79, 'min_samples_split': 8, 'min_samples_leaf': 3}. Best is trial 9 with value: 0.7710843373493976.
[32m[I 2023-04-26 02:15:57,032][39m Trial 10 finished with value: 0.7529411764705882 and parameters: {'criterion': 'entropy', 'n_estimators': 51, 'max_features': 0.9886528737329932, 'max_depth': 100, 'min_samples_split': 2, 'min_samples_leaf': 4}. Best is trial 9 with value: 0.7710843373493976.
[32m[I 2023-04-26 02:15:57,090][39m Trial 11 finished with value: 0.7906976744186047 and parameters: {'criterion': 'entropy', 'n_estimators': 54, 'max_features': 0.990755046309451, 'max_depth': 99, 'min_samples_split': 2, 'min_samples_leaf': 4}. Best is trial 11 with value: 0.7906976744186047.
[32m[I 2023-04-26 02:15:57,139][39m Trial 12 finished with value: 0.7529411764705882 and parameters: {'criterion': 'entropy', 'n_estimators': 51, 'max_features': 0.6363460103734503, 'max_depth': 100, 'min_samples_split': 2, 'min_samples_leaf': 4}. Best is trial 11 with value: 0.7906976744186047.
[32m[I 2023-04-26 02:15:57,219][39m Trial 13 finished with value: 0.7252747252747254 and parameters: {'criterion': 'entropy', 'n_estimators': 83, 'max_features': 0.997381124384197, 'max_depth': 84, 'min_samples_split': 8, 'min_samples_leaf': 8}. Best is trial 11 with value: 0.7906976744186047.
[32m[I 2023-04-26 02:15:57,297][39m Trial 14 finished with value: 0.7500000000000001 and parameters: {'criterion': 'entropy', 'n_estimators': 88, 'max_features': 0.6103179417810204, 'max_depth': 75, 'min_samples_split': 8, 'min_samples_leaf': 5}. Best is trial 11 with value: 0.7906976744186047.
[32m[I 2023-04-26 02:15:57,448][39m Trial 15 finished with value: 0.761904761904762 and parameters: {'criterion': 'entropy', 'n_estimators': 165, 'max_features': 0.870901621466135, 'max_depth': 86, 'min_samples_split': 8, 'min_samples_leaf': 2}. Best is trial 11 with value: 0.7906976744186047.
[32m[I 2023-04-26 02:15:57,613][39m Trial 16 finished with value: 0.7555555555555555 and parameters: {'criterion': 'gini', 'n_estimators': 198, 'max_features': 0.9955795931084578, 'max_depth': 88, 'min_samples_split': 3, 'min_samples_leaf': 7}. Best is trial 11 with value: 0.7906976744186047.
[32m[I 2023-04-26 02:15:57,691][39m Trial 17 finished with value: 0.761904761904762 and parameters: {'criterion': 'entropy', 'n_estimators': 85, 'max_features': 0.7334070198207441, 'max_depth': 67, 'min_samples_split': 4, 'min_samples_leaf': 4}. Best is trial 11 with value: 0.7906976744186047.
[32m[I 2023-04-26 02:15:57,788][39m Trial 18 finished with value: 0.7380952380952381 and parameters: {'criterion': 'entropy', 'n_estimators': 111, 'max_features': 0.5612814496010221, 'max_depth': 93, 'min_samples_split': 11, 'min_samples_leaf': 2}. Best is trial 11 with value: 0.7906976744186047.
[32m[I 2023-04-26 02:15:57,844][39m Trial 19 finished with value: 0.7356321839080461 and parameters: {'criterion': 'gini', 'n_estimators': 70, 'max_features': 0.031617103892198184, 'max_depth': 75, 'min_samples_split': 7, 'min_samples_leaf': 5}. Best is trial 11 with value: 0.7906976744186047.
[32m[I 2023-04-26 02:15:57,964][39m Trial 20 finished with value: 0.7710843373493976 and parameters: {'criterion': 'entropy', 'n_estimators': 129, 'max_features': 0.8812239321266824, 'max_depth': 81, 'min_samples_split': 9, 'min_samples_leaf': 3}. Best is trial 11 with value: 0.7906976744186047.
[32m[I 2023-04-26 02:15:58,086][39m Trial 21 finished with value: 0.8095238095238095 and parameters: {'criterion': 'entropy', 'n_estimators': 128, 'max_features': 0.9070560457454412, 'max_depth': 80, 'min_samples_split': 9, 'min_samples_leaf': 3}. Best is trial 21 with value: 0.8095238095238095.
[32m[I 2023-04-26 02:15:58,204][39m Trial 22 finished with value: 0.7407407407407408 and parameters: {'criterion': 'entropy', 'n_estimators': 125, 'max_features': 0.8118766674885246, 'max_depth': 63, 'min_samples_split': 9, 'min_samples_leaf': 2}. Best is trial 21 with value: 0.8095238095238095.
[32m[I 2023-04-26 02:15:58,318][39m Trial 23 finished with value: 0.7441860465116279 and parameters: {'criterion': 'entropy', 'n_estimators': 126, 'max_features': 0.88840382784021, 'max_depth': 93, 'min_samples_split': 11, 'min_samples_leaf': 5}. Best is trial 21 with value: 0.8095238095238095.
[32m[I 2023-04-26 02:15:58,410][39m Trial 24 finished with value: 0.7764705882352942 and parameters: {'criterion': 'entropy', 'n_estimators': 98, 'max_features': 0.7454761579923332, 'max_depth': 101, 'min_samples_split': 9, 'min_samples_leaf': 3}. Best is trial 21 with value: 0.8095238095238095.
[32m[I 2023-04-26 02:15:58,476][39m Trial 25 finished with value: 0.7674418604651163 and parameters: {'criterion': 'entropy', 'n_estimators': 68, 'max_features': 0.7178143937030181, 'max_depth': 101, 'min_samples_split': 9, 'min_samples_leaf': 4}. Best is trial 21 with value: 0.8095238095238095.
[32m[I 2023-04-26 02:15:58,565][39m Trial 26 finished with value: 0.7441860465116279 and parameters: {'criterion': 'entropy', 'n_estimators': 100, 'max_features': 0.7736153439854782, 'max_depth': 93, 'min_samples_split': 7, 'min_samples_leaf': 7}. Best is trial 21 with value: 0.8095238095238095.
[32m[I 2023-04-26 02:15:58,637][39m Trial 27 finished with value: 0.7710843373493976 and parameters: {'criterion': 'entropy', 'n_estimators': 68, 'max_features': 0.9353628862744859, 'max_depth': 90, 'min_samples_split': 4, 'min_samples_leaf': 2}. Best is trial 21 with value: 0.8095238095238095.
[32m[I 2023-04-26 02:15:58,735][39m Trial 28 finished with value: 0.7529411764705882 and parameters: {'criterion': 'entropy', 'n_estimators': 99, 'max_features': 0.6631404240538703, 'max_depth': 45, 'min_samples_split': 7, 'min_samples_leaf': 5}. Best is trial 21 with value: 0.8095238095238095.
[32m[I 2023-04-26 02:15:58,832][39m Trial 29 finished with value: 0.7804878048780488 and parameters: {'criterion': 'entropy', 'n_estimators': 100, 'max_features': 0.7635140311876475, 'max_depth': 96, 'min_samples_split': 9, 'min_samples_leaf': 3}. Best is trial 21 with value: 0.8095238095238095.
[32m[I 2023-04-26 02:15:58,900][39m Trial 30 finished with value: 0.725 and parameters: {'criterion': 'entropy', 'n_estimators': 62, 'max_features': 0.8090126923295996, 'max_depth': 75, 'min_samples_split': 3, 'min_samples_leaf': 1}. Best is trial 21 with value: 0.8095238095238095.
[32m[I 2023-04-26 02:15:58,993][39m Trial 31 finished with value: 0.7317073170731707 and parameters: {'criterion': 'entropy', 'n_estimators': 98, 'max_features': 0.7575647586706504, 'max_depth': 97, 'min_samples_split': 9, 'min_samples_leaf': 3}. Best is trial 21 with value: 0.8095238095238095.
[32m[I 2023-04-26 02:15:59,094][39m Trial 32 finished with value: 0.6987951807228916 and parameters: {'criterion': 'entropy', 'n_estimators': 120, 'max_features': 0.5251451788757726, 'max_depth': 94, 'min_samples_split': 10, 'min_samples_leaf': 1}. Best is trial 21 with value: 0.8095238095238095.
[32m[I 2023-04-26 02:15:59,195][39m Trial 33 finished with value: 0.7586206896551724 and parameters: {'criterion': 'entropy', 'n_estimators': 105, 'max_features': 0.8943767777013552, 'max_depth': 85, 'min_samples_split': 11, 'min_samples_leaf': 3}. Best is trial 21 with value: 0.8095238095238095.
[32m[I 2023-04-26 02:15:59,282][39m Trial 34 finished with value: 0.7380952380952381 and parameters: {'criterion': 'entropy', 'n_estimators': 91, 'max_features': 0.8195334320676559, 'max_depth': 101, 'min_samples_split': 10, 'min_samples_leaf': 4}. Best is trial 21 with value: 0.8095238095238095.
[32m[I 2023-04-26 02:15:59,419][39m Trial 35 finished with value: 0.7160493827160495 and parameters: {'criterion': 'entropy', 'n_estimators': 138, 'max_features': 0.9203502860727116, 'max_depth': 88, 'min_samples_split': 8, 'min_samples_leaf': 2}. Best is trial 21 with value: 0.8095238095238095.
[32m[I 2023-04-26 02:15:59,489][39m Trial 36 finished with value: 0.7380952380952381 and parameters: {'criterion': 'entropy', 'n_estimators': 81, 'max_features': 0.439679387589054, 'max_depth': 80, 'min_samples_split': 9, 'min_samples_leaf': 3}. Best is trial 21 with value: 0.8095238095238095.
[32m[I 2023-04-26 02:15:59,590][39m Trial 37 finished with value: 0.7586206896551724 and parameters: {'criterion': 'entropy', 'n_estimators': 119, 'max_features': 0.5917529504181561, 'max_depth': 96, 'min_samples_split': 10, 'min_samples_leaf': 4}. Best is trial 21 with value: 0.8095238095238095.
[32m[I 2023-04-26 02:15:59,665][39m Trial 38 finished with value: 0.7160493827160495 and parameters: {'criterion': 'entropy', 'n_estimators': 76, 'max_features': 0.6882113136787819, 'max_depth': 69, 'min_samples_split': 7, 'min_samples_leaf': 1}. Best is trial 21 with value: 0.8095238095238095.
[32m[I 2023-04-26 02:15:59,785][39m Trial 39 finished with value: 0.7529411764705882 and parameters: {'criterion': 'entropy', 'n_estimators': 133, 'max_features': 0.8576281185512835, 'max_depth': 50, 'min_samples_split': 5, 'min_samples_leaf': 6}. Best is trial 21 with value: 0.8095238095238095.
[32m[I 2023-04-26 02:15:59,911][39m Trial 40 finished with value: 0.7500000000000001 and parameters: {'criterion': 'gini', 'n_estimators': 147, 'max_features': 0.9487981729292566, 'max_depth': 90, 'min_samples_split': 9, 'min_samples_leaf': 5}. Best is trial 21 with value: 0.8095238095238095.
[32m[I 2023-04-26 02:16:00,047][39m Trial 41 finished with value: 0.761904761904762 and parameters: {'criterion': 'gini', 'n_estimators': 157, 'max_features': 0.9454378679147042, 'max_depth': 79, 'min_samples_split': 8, 'min_samples_leaf': 3}. Best is trial 21 with value: 0.8095238095238095.
[32m[I 2023-04-26 02:16:00,153][39m Trial 42 finished with value: 0.7317073170731707 and parameters: {'criterion': 'entropy', 'n_estimators': 111, 'max_features': 0.7893498995607786, 'max_depth': 82, 'min_samples_split': 9, 'min_samples_leaf': 2}. Best is trial 21 with value: 0.8095238095238095.
[32m[I 2023-04-26 02:16:00,251][39m Trial 43 finished with value: 0.7228915662650603 and parameters: {'criterion': 'entropy', 'n_estimators': 124, 'max_features': 0.3437390374309904, 'max_depth': 62, 'min_samples_split': 10, 'min_samples_leaf': 3}. Best is trial 21 with value: 0.8095238095238095.
[32m[I 2023-04-26 02:16:00,324][39m Trial 44 finished with value: 0.7160493827160495 and parameters: {'criterion': 'entropy', 'n_estimators': 66, 'max_features': 0.9396967679233255, 'max_depth': 15, 'min_samples_split': 3, 'min_samples_leaf': 2}. Best is trial 21 with value: 0.8095238095238095.
[32m[I 2023-04-26 02:16:00,423][39m Trial 45 finished with value: 0.7500000000000001 and parameters: {'criterion': 'entropy', 'n_estimators': 132, 'max_features': 0.1168738297791388, 'max_depth': 38, 'min_samples_split': 10, 'min_samples_leaf': 3}. Best is trial 21 with value: 0.8095238095238095.
[32m[I 2023-04-26 02:16:00,485][39m Trial 46 finished with value: 0.6923076923076923 and parameters: {'criterion': 'entropy', 'n_estimators': 54, 'max_features': 0.9098793768441703, 'max_depth': 90, 'min_samples_split': 4, 'min_samples_leaf': 1}. Best is trial 21 with value: 0.8095238095238095.
[32m[I 2023-04-26 02:16:00,558][39m Trial 47 finished with value: 0.7096774193548387 and parameters: {'criterion': 'entropy', 'n_estimators': 77, 'max_features': 0.8508356543736482, 'max_depth': 97, 'min_samples_split': 2, 'min_samples_leaf': 11}. Best is trial 21 with value: 0.8095238095238095.
[32m[I 2023-04-26 02:16:00,681][39m Trial 48 finished with value: 0.7333333333333334 and parameters: {'criterion': 'entropy', 'n_estimators': 151, 'max_features': 0.7248222069418802, 'max_depth': 77, 'min_samples_split': 6, 'min_samples_leaf': 10}. Best is trial 21 with value: 0.8095238095238095.
[32m[I 2023-04-26 02:16:00,836][39m Trial 49 finished with value: 0.7857142857142858 and parameters: {'criterion': 'entropy', 'n_estimators': 171, 'max_features': 0.845524855558282, 'max_depth': 83, 'min_samples_split': 8, 'min_samples_leaf': 4}. Best is trial 21 with value: 0.8095238095238095.
[32m[I 2023-04-26 02:16:00,962][39m Trial 50 finished with value: 0.7500000000000001 and parameters: {'criterion': 'gini', 'n_estimators': 174, 'max_features': 0.20210068250200502, 'max_depth': 85, 'min_samples_split': 8, 'min_samples_leaf': 4}. Best is trial 21 with value: 0.8095238095238095.
[32m[I 2023-04-26 02:16:01,129][39m Trial 51 finished with value: 0.7529411764705882 and parameters: {'criterion': 'entropy', 'n_estimators': 190, 'max_features': 0.8367932445325644, 'max_depth': 97, 'min_samples_split': 9, 'min_samples_leaf': 4}. Best is trial 21 with value: 0.8095238095238095.
[32m[I 2023-04-26 02:16:01,193][39m Trial 52 finished with value: 0.7179487179487181 and parameters: {'criterion': 'entropy', 'n_estimators': 59, 'max_features': 0.9690223004992587, 'max_depth': 91, 'min_samples_split': 4, 'min_samples_leaf': 2}. Best is trial 21 with value: 0.8095238095238095.
[32m[I 2023-04-26 02:16:01,285][39m Trial 53 finished with value: 0.7857142857142858 and parameters: {'criterion': 'entropy', 'n_estimators': 94, 'max_features': 0.8835048915666509, 'max_depth': 73, 'min_samples_split': 8, 'min_samples_leaf': 4}. Best is trial 21 with value: 0.8095238095238095.
[32m[I 2023-04-26 02:16:01,369][39m Trial 54 finished with value: 0.7586206896551724 and parameters: {'criterion': 'entropy', 'n_estimators': 91, 'max_features': 0.7475025488663672, 'max_depth': 74, 'min_samples_split': 8, 'min_samples_leaf': 5}. Best is trial 21 with value: 0.8095238095238095.
[32m[I 2023-04-26 02:16:01,527][39m Trial 55 finished with value: 0.7674418604651163 and parameters: {'criterion': 'entropy', 'n_estimators': 175, 'max_features': 0.7854308330730632, 'max_depth': 70, 'min_samples_split': 6, 'min_samples_leaf': 4}. Best is trial 21 with value: 0.8095238095238095.
[32m[I 2023-04-26 02:16:01,626][39m Trial 56 finished with value: 0.7356321839080461 and parameters: {'criterion': 'entropy', 'n_estimators': 105, 'max_features': 0.9965889678568237, 'max_depth': 84, 'min_samples_split': 8, 'min_samples_leaf': 7}. Best is trial 21 with value: 0.8095238095238095.
[32m[I 2023-04-26 02:16:01,737][39m Trial 57 finished with value: 0.7586206896551724 and parameters: {'criterion': 'entropy', 'n_estimators': 116, 'max_features': 0.8633301121210821, 'max_depth': 56, 'min_samples_split': 7, 'min_samples_leaf': 6}. Best is trial 21 with value: 0.8095238095238095.
[32m[I 2023-04-26 02:16:01,876][39m Trial 58 finished with value: 0.7380952380952381 and parameters: {'criterion': 'entropy', 'n_estimators': 165, 'max_features': 0.6577132483205173, 'max_depth': 71, 'min_samples_split': 9, 'min_samples_leaf': 4}. Best is trial 21 with value: 0.8095238095238095.
[32m[I 2023-04-26 02:16:01,976][39m Trial 59 finished with value: 0.7317073170731707 and parameters: {'criterion': 'gini', 'n_estimators': 106, 'max_features': 0.9053180301957398, 'max_depth': 63, 'min_samples_split': 8, 'min_samples_leaf': 3}. Best is trial 21 with value: 0.8095238095238095.
[32m[I 2023-04-26 02:16:02,061][39m Trial 60 finished with value: 0.7586206896551724 and parameters: {'criterion': 'entropy', 'n_estimators': 93, 'max_features': 0.6934715161130358, 'max_depth': 98, 'min_samples_split': 7, 'min_samples_leaf': 5}. Best is trial 21 with value: 0.8095238095238095.
[32m[I 2023-04-26 02:16:02,140][39m Trial 61 finished with value: 0.7407407407407408 and parameters: {'criterion': 'entropy', 'n_estimators': 76, 'max_features': 0.963177646232935, 'max_depth': 88, 'min_samples_split': 5, 'min_samples_leaf': 2}. Best is trial 21 with value: 0.8095238095238095.
[32m[I 2023-04-26 02:16:02,323][39m Trial 62 finished with value: 0.7674418604651163 and parameters: {'criterion': 'entropy', 'n_estimators': 201, 'max_features': 0.880742033747679, 'max_depth': 82, 'min_samples_split': 9, 'min_samples_leaf': 3}. Best is trial 21 with value: 0.8095238095238095.
[32m[I 2023-04-26 02:16:02,384][39m Trial 63 finished with value: 0.761904761904762 and parameters: {'criterion': 'entropy', 'n_estimators': 56, 'max_features': 0.924761571845965, 'max_depth': 94, 'min_samples_split': 2, 'min_samples_leaf': 4}. Best is trial 21 with value: 0.8095238095238095.
[32m[I 2023-04-26 02:16:02,459][39m Trial 64 finished with value: 0.7407407407407408 and parameters: {'criterion': 'entropy', 'n_estimators': 71, 'max_features': 0.8254665971934141, 'max_depth': 100, 'min_samples_split': 3, 'min_samples_leaf': 2}. Best is trial 21 with value: 0.8095238095238095.
[32m[I 2023-04-26 02:16:02,695][39m Trial 65 finished with value: 0.761904761904762 and parameters: {'criterion': 'entropy', 'n_estimators': 138, 'max_features': 0.7872295791229612, 'max_depth': 82, 'min_samples_split': 9, 'min_samples_leaf': 3}. Best is trial 21 with value: 0.8095238095238095.
[32m[I 2023-04-26 02:16:02,854][39m Trial 66 finished with value: 0.7710843373493976 and parameters: {'criterion': 'entropy', 'n_estimators': 61, 'max_features': 0.9751162526692175, 'max_depth': 91, 'min_samples_split': 4, 'min_samples_leaf': 5}. Best is trial 21 with value: 0.8095238095238095.
[32m[I 2023-04-26 02:16:02,938][39m Trial 67 finished with value: 0.7500000000000001 and parameters: {'criterion': 'entropy', 'n_estimators': 87, 'max_features': 0.920302983899574, 'max_depth': 87, 'min_samples_split': 5, 'min_samples_leaf': 6}. Best is trial 21 with value: 0.8095238095238095.
[32m[I 2023-04-26 02:16:02,994][39m Trial 68 finished with value: 0.7586206896551724 and parameters: {'criterion': 'entropy', 'n_estimators': 61, 'max_features': 0.9679382853664049, 'max_depth': 93, 'min_samples_split': 8, 'min_samples_leaf': 5}. Best is trial 21 with value: 0.8095238095238095.
[32m[I 2023-04-26 02:16:03,075][39m Trial 69 finished with value: 0.7710843373493976 and parameters: {'criterion': 'entropy', 'n_estimators': 95, 'max_features': 0.8633640138977954, 'max_depth': 73, 'min_samples_split': 10, 'min_samples_leaf': 3}. Best is trial 21 with value: 0.8095238095238095.
[32m[I 2023-04-26 02:16:03,124][39m Trial 70 finished with value: 0.7764705882352942 and parameters: {'criterion': 'entropy', 'n_estimators': 50, 'max_features': 0.890216422608799, 'max_depth': 96, 'min_samples_split': 2, 'min_samples_leaf': 2}. Best is trial 21 with value: 0.8095238095238095.
[32m[I 2023-04-26 02:16:03,170][39m Trial 71 finished with value: 0.7529411764705882 and parameters: {'criterion': 'gini', 'n_estimators': 50, 'max_features': 0.8952850091504652, 'max_depth': 77, 'min_samples_split': 2, 'min_samples_leaf': 4}. Best is trial 21 with value: 0.8095238095238095.
[32m[I 2023-04-26 02:16:03,230][39m Trial 72 finished with value: 0.7857142857142858 and parameters: {'criterion': 'entropy', 'n_estimators': 63, 'max_features': 0.9985875338275955, 'max_depth': 95, 'min_samples_split': 3, 'min_samples_leaf': 4}. Best is trial 21 with value: 0.8095238095238095.
