[32m[I 2023-04-26 02:16:55,946][39m Trial 438 finished with value: 0.8048780487804877 and parameters: {'criterion': 'entropy', 'n_estimators': 82, 'max_features': 0.9130907478630927, 'max_depth': 24, 'min_samples_split': 7, 'min_samples_leaf': 3}. Best is trial 21 with value: 0.8095238095238095.
[32m[I 2023-04-26 02:16:56,057][39m Trial 439 finished with value: 0.7560975609756099 and parameters: {'criterion': 'entropy', 'n_estimators': 108, 'max_features': 0.8852594802753223, 'max_depth': 22, 'min_samples_split': 7, 'min_samples_leaf': 3}. Best is trial 21 with value: 0.8095238095238095.
[32m[I 2023-04-26 02:16:56,146][39m Trial 440 finished with value: 0.746987951807229 and parameters: {'criterion': 'entropy', 'n_estimators': 80, 'max_features': 0.8995870694142778, 'max_depth': 24, 'min_samples_split': 7, 'min_samples_leaf': 4}. Best is trial 21 with value: 0.8095238095238095.
[32m[I 2023-04-26 02:16:56,242][39m Trial 441 finished with value: 0.7560975609756099 and parameters: {'criterion': 'entropy', 'n_estimators': 100, 'max_features': 0.4352841245337735, 'max_depth': 74, 'min_samples_split': 8, 'min_samples_leaf': 2}. Best is trial 21 with value: 0.8095238095238095.
[32m[I 2023-04-26 02:16:56,345][39m Trial 442 finished with value: 0.7710843373493976 and parameters: {'criterion': 'entropy', 'n_estimators': 96, 'max_features': 0.9167330718199178, 'max_depth': 26, 'min_samples_split': 8, 'min_samples_leaf': 3}. Best is trial 21 with value: 0.8095238095238095.
[32m[I 2023-04-26 02:16:56,425][39m Trial 443 finished with value: 0.7857142857142858 and parameters: {'criterion': 'entropy', 'n_estimators': 70, 'max_features': 0.9995278537874147, 'max_depth': 68, 'min_samples_split': 8, 'min_samples_leaf': 4}. Best is trial 21 with value: 0.8095238095238095.
[32m[I 2023-04-26 02:16:56,512][39m Trial 444 finished with value: 0.7560975609756099 and parameters: {'criterion': 'entropy', 'n_estimators': 75, 'max_features': 0.8992461598006835, 'max_depth': 18, 'min_samples_split': 6, 'min_samples_leaf': 3}. Best is trial 21 with value: 0.8095238095238095.
[32m[I 2023-04-26 02:16:56,589][39m Trial 445 finished with value: 0.7710843373493976 and parameters: {'criterion': 'entropy', 'n_estimators': 67, 'max_features': 0.8729406003268563, 'max_depth': 24, 'min_samples_split': 8, 'min_samples_leaf': 3}. Best is trial 21 with value: 0.8095238095238095.
[32m[I 2023-04-26 02:16:56,649][39m Trial 446 finished with value: 0.7804878048780488 and parameters: {'criterion': 'gini', 'n_estimators': 50, 'max_features': 0.9263035658311989, 'max_depth': 29, 'min_samples_split': 7, 'min_samples_leaf': 3}. Best is trial 21 with value: 0.8095238095238095.
[32m[I 2023-04-26 02:16:56,750][39m Trial 447 finished with value: 0.7857142857142858 and parameters: {'criterion': 'entropy', 'n_estimators': 90, 'max_features': 0.917765346312073, 'max_depth': 26, 'min_samples_split': 8, 'min_samples_leaf': 3}. Best is trial 21 with value: 0.8095238095238095.
[32m[I 2023-04-26 02:16:56,859][39m Trial 448 finished with value: 0.7674418604651163 and parameters: {'criterion': 'entropy', 'n_estimators': 104, 'max_features': 0.9458662978122893, 'max_depth': 58, 'min_samples_split': 9, 'min_samples_leaf': 4}. Best is trial 21 with value: 0.8095238095238095.
[32m[I 2023-04-26 02:16:57,027][39m Trial 449 finished with value: 0.7804878048780488 and parameters: {'criterion': 'entropy', 'n_estimators': 175, 'max_features': 0.9167315911706698, 'max_depth': 70, 'min_samples_split': 8, 'min_samples_leaf': 3}. Best is trial 21 with value: 0.8095238095238095.
[32m[I 2023-04-26 02:16:57,151][39m Trial 450 finished with value: 0.7710843373493976 and parameters: {'criterion': 'entropy', 'n_estimators': 121, 'max_features': 0.8483075468858667, 'max_depth': 22, 'min_samples_split': 7, 'min_samples_leaf': 3}. Best is trial 21 with value: 0.8095238095238095.
[32m[I 2023-04-26 02:16:57,333][39m Trial 451 finished with value: 0.7560975609756099 and parameters: {'criterion': 'entropy', 'n_estimators': 185, 'max_features': 0.9491501056707254, 'max_depth': 22, 'min_samples_split': 9, 'min_samples_leaf': 2}. Best is trial 21 with value: 0.8095238095238095.
[32m[I 2023-04-26 02:16:57,497][39m Trial 452 finished with value: 0.746987951807229 and parameters: {'criterion': 'entropy', 'n_estimators': 167, 'max_features': 0.8897536019806049, 'max_depth': 71, 'min_samples_split': 8, 'min_samples_leaf': 4}. Best is trial 21 with value: 0.8095238095238095.
[32m[I 2023-04-26 02:16:57,666][39m Trial 453 finished with value: 0.7710843373493976 and parameters: {'criterion': 'entropy', 'n_estimators': 169, 'max_features': 0.9325017923858256, 'max_depth': 81, 'min_samples_split': 8, 'min_samples_leaf': 3}. Best is trial 21 with value: 0.8095238095238095.
[32m[I 2023-04-26 02:16:57,761][39m Trial 454 finished with value: 0.7848101265822786 and parameters: {'criterion': 'entropy', 'n_estimators': 84, 'max_features': 0.9709965693575008, 'max_depth': 69, 'min_samples_split': 8, 'min_samples_leaf': 3}. Best is trial 21 with value: 0.8095238095238095.
[32m[I 2023-04-26 02:16:57,951][39m Trial 455 finished with value: 0.7560975609756099 and parameters: {'criterion': 'entropy', 'n_estimators': 196, 'max_features': 0.946857603425484, 'max_depth': 27, 'min_samples_split': 8, 'min_samples_leaf': 3}. Best is trial 21 with value: 0.8095238095238095.
[32m[I 2023-04-26 02:16:58,070][39m Trial 456 finished with value: 0.7654320987654322 and parameters: {'criterion': 'entropy', 'n_estimators': 113, 'max_features': 0.9545137930854614, 'max_depth': 77, 'min_samples_split': 7, 'min_samples_leaf': 3}. Best is trial 21 with value: 0.8095238095238095.
[32m[I 2023-04-26 02:16:58,224][39m Trial 457 finished with value: 0.7749999999999999 and parameters: {'criterion': 'entropy', 'n_estimators': 155, 'max_features': 0.9018181991302444, 'max_depth': 38, 'min_samples_split': 9, 'min_samples_leaf': 3}. Best is trial 21 with value: 0.8095238095238095.
[32m[I 2023-04-26 02:16:58,384][39m Trial 458 finished with value: 0.7529411764705882 and parameters: {'criterion': 'entropy', 'n_estimators': 165, 'max_features': 0.9366386547109594, 'max_depth': 75, 'min_samples_split': 7, 'min_samples_leaf': 5}. Best is trial 21 with value: 0.8095238095238095.
[32m[I 2023-04-26 02:16:58,567][39m Trial 459 finished with value: 0.7654320987654322 and parameters: {'criterion': 'entropy', 'n_estimators': 184, 'max_features': 0.9753747627287938, 'max_depth': 23, 'min_samples_split': 8, 'min_samples_leaf': 2}. Best is trial 21 with value: 0.8095238095238095.
[32m[I 2023-04-26 02:16:58,718][39m Trial 460 finished with value: 0.761904761904762 and parameters: {'criterion': 'entropy', 'n_estimators': 150, 'max_features': 0.911872863514725, 'max_depth': 72, 'min_samples_split': 8, 'min_samples_leaf': 4}. Best is trial 21 with value: 0.8095238095238095.
[32m[I 2023-04-26 02:16:58,876][39m Trial 461 finished with value: 0.7560975609756099 and parameters: {'criterion': 'entropy', 'n_estimators': 161, 'max_features': 0.8643685025864971, 'max_depth': 18, 'min_samples_split': 6, 'min_samples_leaf': 3}. Best is trial 21 with value: 0.8095238095238095.
[32m[I 2023-04-26 02:16:59,041][39m Trial 462 finished with value: 0.7407407407407408 and parameters: {'criterion': 'entropy', 'n_estimators': 157, 'max_features': 0.9788159935678259, 'max_depth': 20, 'min_samples_split': 8, 'min_samples_leaf': 3}. Best is trial 21 with value: 0.8095238095238095.
[32m[I 2023-04-26 02:16:59,219][39m Trial 463 finished with value: 0.7674418604651163 and parameters: {'criterion': 'entropy', 'n_estimators': 179, 'max_features': 0.9280459154241866, 'max_depth': 35, 'min_samples_split': 8, 'min_samples_leaf': 4}. Best is trial 21 with value: 0.8095238095238095.
[32m[I 2023-04-26 02:16:59,407][39m Trial 464 finished with value: 0.7407407407407408 and parameters: {'criterion': 'entropy', 'n_estimators': 189, 'max_features': 0.9317161910521585, 'max_depth': 31, 'min_samples_split': 8, 'min_samples_leaf': 3}. Best is trial 21 with value: 0.8095238095238095.
[32m[I 2023-04-26 02:16:59,561][39m Trial 465 finished with value: 0.7710843373493976 and parameters: {'criterion': 'gini', 'n_estimators': 169, 'max_features': 0.9650935842241606, 'max_depth': 69, 'min_samples_split': 8, 'min_samples_leaf': 3}. Best is trial 21 with value: 0.8095238095238095.
[32m[I 2023-04-26 02:16:59,703][39m Trial 466 finished with value: 0.761904761904762 and parameters: {'criterion': 'entropy', 'n_estimators': 141, 'max_features': 0.8829349733736249, 'max_depth': 25, 'min_samples_split': 7, 'min_samples_leaf': 2}. Best is trial 21 with value: 0.8095238095238095.
[32m[I 2023-04-26 02:16:59,840][39m Trial 467 finished with value: 0.7142857142857143 and parameters: {'criterion': 'entropy', 'n_estimators': 181, 'max_features': 0.0844749791766295, 'max_depth': 16, 'min_samples_split': 5, 'min_samples_leaf': 3}. Best is trial 21 with value: 0.8095238095238095.
[32m[I 2023-04-26 02:17:00,000][39m Trial 468 finished with value: 0.7228915662650603 and parameters: {'criterion': 'entropy', 'n_estimators': 201, 'max_features': 0.3030577488359063, 'max_depth': 50, 'min_samples_split': 8, 'min_samples_leaf': 3}. Best is trial 21 with value: 0.8095238095238095.
[32m[I 2023-04-26 02:17:00,183][39m Trial 469 finished with value: 0.7710843373493976 and parameters: {'criterion': 'entropy', 'n_estimators': 179, 'max_features': 0.9040157420077336, 'max_depth': 21, 'min_samples_split': 8, 'min_samples_leaf': 3}. Best is trial 21 with value: 0.8095238095238095.
[32m[I 2023-04-26 02:17:00,286][39m Trial 470 finished with value: 0.7529411764705882 and parameters: {'criterion': 'entropy', 'n_estimators': 93, 'max_features': 0.9143956089967501, 'max_depth': 79, 'min_samples_split': 7, 'min_samples_leaf': 4}. Best is trial 21 with value: 0.8095238095238095.
[32m[I 2023-04-26 02:17:00,460][39m Trial 471 finished with value: 0.7804878048780488 and parameters: {'criterion': 'entropy', 'n_estimators': 173, 'max_features': 0.9568493337692672, 'max_depth': 74, 'min_samples_split': 7, 'min_samples_leaf': 3}. Best is trial 21 with value: 0.8095238095238095.
[32m[I 2023-04-26 02:17:00,634][39m Trial 472 finished with value: 0.7654320987654322 and parameters: {'criterion': 'entropy', 'n_estimators': 177, 'max_features': 0.997811177664007, 'max_depth': 62, 'min_samples_split': 9, 'min_samples_leaf': 3}. Best is trial 21 with value: 0.8095238095238095.
[32m[I 2023-04-26 02:17:00,805][39m Trial 473 finished with value: 0.7857142857142858 and parameters: {'criterion': 'entropy', 'n_estimators': 173, 'max_features': 0.9431744459287815, 'max_depth': 66, 'min_samples_split': 8, 'min_samples_leaf': 3}. Best is trial 21 with value: 0.8095238095238095.
[32m[I 2023-04-26 02:17:00,965][39m Trial 474 finished with value: 0.761904761904762 and parameters: {'criterion': 'entropy', 'n_estimators': 163, 'max_features': 0.883391523723288, 'max_depth': 77, 'min_samples_split': 7, 'min_samples_leaf': 4}. Best is trial 21 with value: 0.8095238095238095.
[32m[I 2023-04-26 02:17:01,058][39m Trial 475 finished with value: 0.7594936708860759 and parameters: {'criterion': 'entropy', 'n_estimators': 78, 'max_features': 0.9835326995359794, 'max_depth': 67, 'min_samples_split': 8, 'min_samples_leaf': 2}. Best is trial 21 with value: 0.8095238095238095.
[32m[I 2023-04-26 02:17:01,125][39m Trial 476 finished with value: 0.746987951807229 and parameters: {'criterion': 'entropy', 'n_estimators': 53, 'max_features': 0.9326939222623252, 'max_depth': 40, 'min_samples_split': 8, 'min_samples_leaf': 3}. Best is trial 21 with value: 0.8095238095238095.
[32m[I 2023-04-26 02:17:01,304][39m Trial 477 finished with value: 0.7749999999999999 and parameters: {'criterion': 'entropy', 'n_estimators': 190, 'max_features': 0.8242688494487865, 'max_depth': 33, 'min_samples_split': 7, 'min_samples_leaf': 3}. Best is trial 21 with value: 0.8095238095238095.
[32m[I 2023-04-26 02:17:01,461][39m Trial 478 finished with value: 0.7500000000000001 and parameters: {'criterion': 'entropy', 'n_estimators': 164, 'max_features': 0.9660194652560444, 'max_depth': 74, 'min_samples_split': 8, 'min_samples_leaf': 7}. Best is trial 21 with value: 0.8095238095238095.
[32m[I 2023-04-26 02:17:01,632][39m Trial 479 finished with value: 0.746987951807229 and parameters: {'criterion': 'entropy', 'n_estimators': 174, 'max_features': 0.9979253691174726, 'max_depth': 53, 'min_samples_split': 10, 'min_samples_leaf': 3}. Best is trial 21 with value: 0.8095238095238095.
[32m[I 2023-04-26 02:17:01,790][39m Trial 480 finished with value: 0.7529411764705882 and parameters: {'criterion': 'entropy', 'n_estimators': 159, 'max_features': 0.9188578453523891, 'max_depth': 72, 'min_samples_split': 9, 'min_samples_leaf': 4}. Best is trial 21 with value: 0.8095238095238095.
[32m[I 2023-04-26 02:17:01,883][39m Trial 481 finished with value: 0.7749999999999999 and parameters: {'criterion': 'entropy', 'n_estimators': 82, 'max_features': 0.9520777216677138, 'max_depth': 61, 'min_samples_split': 8, 'min_samples_leaf': 3}. Best is trial 21 with value: 0.8095238095238095.
[32m[I 2023-04-26 02:17:02,070][39m Trial 482 finished with value: 0.7804878048780488 and parameters: {'criterion': 'entropy', 'n_estimators': 192, 'max_features': 0.9387176433805166, 'max_depth': 30, 'min_samples_split': 8, 'min_samples_leaf': 3}. Best is trial 21 with value: 0.8095238095238095.
[32m[I 2023-04-26 02:17:02,240][39m Trial 483 finished with value: 0.7848101265822786 and parameters: {'criterion': 'entropy', 'n_estimators': 167, 'max_features': 0.9810964166667744, 'max_depth': 66, 'min_samples_split': 8, 'min_samples_leaf': 3}. Best is trial 21 with value: 0.8095238095238095.
[32m[I 2023-04-26 02:17:02,317][39m Trial 484 finished with value: 0.7710843373493976 and parameters: {'criterion': 'entropy', 'n_estimators': 64, 'max_features': 0.9720107404550278, 'max_depth': 71, 'min_samples_split': 5, 'min_samples_leaf': 4}. Best is trial 21 with value: 0.8095238095238095.
[32m[I 2023-04-26 02:17:02,481][39m Trial 485 finished with value: 0.761904761904762 and parameters: {'criterion': 'gini', 'n_estimators': 183, 'max_features': 0.7784550467483886, 'max_depth': 36, 'min_samples_split': 8, 'min_samples_leaf': 3}. Best is trial 21 with value: 0.8095238095238095.
[32m[I 2023-04-26 02:17:02,657][39m Trial 486 finished with value: 0.7228915662650603 and parameters: {'criterion': 'entropy', 'n_estimators': 172, 'max_features': 0.9028183744772078, 'max_depth': 69, 'min_samples_split': 9, 'min_samples_leaf': 1}. Best is trial 21 with value: 0.8095238095238095.
[32m[I 2023-04-26 02:17:02,728][39m Trial 487 finished with value: 0.7560975609756099 and parameters: {'criterion': 'entropy', 'n_estimators': 57, 'max_features': 0.9202452312869008, 'max_depth': 15, 'min_samples_split': 7, 'min_samples_leaf': 3}. Best is trial 21 with value: 0.8095238095238095.
[32m[I 2023-04-26 02:17:02,861][39m Trial 488 finished with value: 0.7380952380952381 and parameters: {'criterion': 'entropy', 'n_estimators': 167, 'max_features': 0.2137842011444352, 'max_depth': 76, 'min_samples_split': 8, 'min_samples_leaf': 2}. Best is trial 21 with value: 0.8095238095238095.
[32m[I 2023-04-26 02:17:03,051][39m Trial 489 finished with value: 0.7594936708860759 and parameters: {'criterion': 'entropy', 'n_estimators': 194, 'max_features': 0.963154373748495, 'max_depth': 23, 'min_samples_split': 7, 'min_samples_leaf': 3}. Best is trial 21 with value: 0.8095238095238095.
[32m[I 2023-04-26 02:17:03,209][39m Trial 490 finished with value: 0.7560975609756099 and parameters: {'criterion': 'entropy', 'n_estimators': 161, 'max_features': 0.9384870916938559, 'max_depth': 33, 'min_samples_split': 8, 'min_samples_leaf': 3}. Best is trial 21 with value: 0.8095238095238095.
[32m[I 2023-04-26 02:17:03,376][39m Trial 491 finished with value: 0.7654320987654322 and parameters: {'criterion': 'entropy', 'n_estimators': 166, 'max_features': 0.8777178240490959, 'max_depth': 72, 'min_samples_split': 6, 'min_samples_leaf': 3}. Best is trial 21 with value: 0.8095238095238095.
[32m[I 2023-04-26 02:17:03,561][39m Trial 492 finished with value: 0.7710843373493976 and parameters: {'criterion': 'entropy', 'n_estimators': 188, 'max_features': 0.9586243604493171, 'max_depth': 90, 'min_samples_split': 8, 'min_samples_leaf': 4}. Best is trial 21 with value: 0.8095238095238095.
[32m[I 2023-04-26 02:17:03,709][39m Trial 493 finished with value: 0.7560975609756099 and parameters: {'criterion': 'entropy', 'n_estimators': 172, 'max_features': 0.5668003411889054, 'max_depth': 70, 'min_samples_split': 8, 'min_samples_leaf': 3}. Best is trial 21 with value: 0.8095238095238095.
[32m[I 2023-04-26 02:17:03,854][39m Trial 494 finished with value: 0.7804878048780488 and parameters: {'criterion': 'entropy', 'n_estimators': 135, 'max_features': 0.9993550389080108, 'max_depth': 24, 'min_samples_split': 8, 'min_samples_leaf': 3}. Best is trial 21 with value: 0.8095238095238095.
[32m[I 2023-04-26 02:17:04,039][39m Trial 495 finished with value: 0.7804878048780488 and parameters: {'criterion': 'entropy', 'n_estimators': 186, 'max_features': 0.9505165778489454, 'max_depth': 28, 'min_samples_split': 7, 'min_samples_leaf': 3}. Best is trial 21 with value: 0.8095238095238095.
[32m[I 2023-04-26 02:17:04,160][39m Trial 496 finished with value: 0.7560975609756099 and parameters: {'criterion': 'entropy', 'n_estimators': 116, 'max_features': 0.9805308381583693, 'max_depth': 30, 'min_samples_split': 8, 'min_samples_leaf': 3}. Best is trial 21 with value: 0.8095238095238095.
[32m[I 2023-04-26 02:17:04,348][39m Trial 497 finished with value: 0.761904761904762 and parameters: {'criterion': 'entropy', 'n_estimators': 197, 'max_features': 0.9022483015587274, 'max_depth': 74, 'min_samples_split': 7, 'min_samples_leaf': 4}. Best is trial 21 with value: 0.8095238095238095.
[32m[I 2023-04-26 02:17:04,509][39m Trial 498 finished with value: 0.7710843373493976 and parameters: {'criterion': 'entropy', 'n_estimators': 162, 'max_features': 0.9283330176623494, 'max_depth': 27, 'min_samples_split': 7, 'min_samples_leaf': 3}. Best is trial 21 with value: 0.8095238095238095.
[32m[I 2023-04-26 02:17:04,642][39m Trial 499 finished with value: 0.7674418604651163 and parameters: {'criterion': 'entropy', 'n_estimators': 130, 'max_features': 0.9407305828387044, 'max_depth': 25, 'min_samples_split': 9, 'min_samples_leaf': 5}. Best is trial 21 with value: 0.8095238095238095.
Number of finished trials: 500