[32m[I 2023-04-26 02:16:03,281][39m Trial 73 finished with value: 0.7674418604651163 and parameters: {'criterion': 'entropy', 'n_estimators': 55, 'max_features': 0.8040766477958927, 'max_depth': 101, 'min_samples_split': 2, 'min_samples_leaf': 4}. Best is trial 21 with value: 0.8095238095238095.
[32m[I 2023-04-26 02:16:03,352][39m Trial 74 finished with value: 0.6987951807228916 and parameters: {'criterion': 'entropy', 'n_estimators': 82, 'max_features': 0.8449841972157622, 'max_depth': 95, 'min_samples_split': 3, 'min_samples_leaf': 3}. Best is trial 21 with value: 0.8095238095238095.
[32m[I 2023-04-26 02:16:03,415][39m Trial 75 finished with value: 0.761904761904762 and parameters: {'criterion': 'entropy', 'n_estimators': 73, 'max_features': 0.7534083259004495, 'max_depth': 98, 'min_samples_split': 3, 'min_samples_leaf': 4}. Best is trial 21 with value: 0.8095238095238095.
[32m[I 2023-04-26 02:16:03,477][39m Trial 76 finished with value: 0.7710843373493976 and parameters: {'criterion': 'entropy', 'n_estimators': 65, 'max_features': 0.9982521166326648, 'max_depth': 66, 'min_samples_split': 2, 'min_samples_leaf': 3}. Best is trial 21 with value: 0.8095238095238095.
[32m[I 2023-04-26 02:16:03,528][39m Trial 77 finished with value: 0.7499999999999999 and parameters: {'criterion': 'entropy', 'n_estimators': 50, 'max_features': 0.9432158388666665, 'max_depth': 87, 'min_samples_split': 2, 'min_samples_leaf': 2}. Best is trial 21 with value: 0.8095238095238095.
[32m[I 2023-04-26 02:16:03,616][39m Trial 78 finished with value: 0.7529411764705882 and parameters: {'criterion': 'entropy', 'n_estimators': 102, 'max_features': 0.8832314876696494, 'max_depth': 92, 'min_samples_split': 9, 'min_samples_leaf': 4}. Best is trial 21 with value: 0.8095238095238095.
[32m[I 2023-04-26 02:16:03,706][39m Trial 79 finished with value: 0.7560975609756099 and parameters: {'criterion': 'entropy', 'n_estimators': 109, 'max_features': 0.833090157872743, 'max_depth': 99, 'min_samples_split': 2, 'min_samples_leaf': 3}. Best is trial 21 with value: 0.8095238095238095.
[32m[I 2023-04-26 02:16:03,808][39m Trial 80 finished with value: 0.7499999999999999 and parameters: {'criterion': 'entropy', 'n_estimators': 115, 'max_features': 0.9094424976606569, 'max_depth': 96, 'min_samples_split': 10, 'min_samples_leaf': 2}. Best is trial 21 with value: 0.8095238095238095.
[32m[I 2023-04-26 02:16:03,879][39m Trial 81 finished with value: 0.7272727272727273 and parameters: {'criterion': 'entropy', 'n_estimators': 65, 'max_features': 0.9356959666155014, 'max_depth': 89, 'min_samples_split': 3, 'min_samples_leaf': 1}. Best is trial 21 with value: 0.8095238095238095.
[32m[I 2023-04-26 02:16:03,937][39m Trial 82 finished with value: 0.7816091954022988 and parameters: {'criterion': 'entropy', 'n_estimators': 59, 'max_features': 0.9699521361507458, 'max_depth': 92, 'min_samples_split': 3, 'min_samples_leaf': 5}. Best is trial 21 with value: 0.8095238095238095.
[32m[I 2023-04-26 02:16:03,991][39m Trial 83 finished with value: 0.746987951807229 and parameters: {'criterion': 'entropy', 'n_estimators': 58, 'max_features': 0.9758576537545557, 'max_depth': 95, 'min_samples_split': 2, 'min_samples_leaf': 5}. Best is trial 21 with value: 0.8095238095238095.
[32m[I 2023-04-26 02:16:04,051][39m Trial 84 finished with value: 0.7356321839080461 and parameters: {'criterion': 'entropy', 'n_estimators': 64, 'max_features': 0.8720658500489608, 'max_depth': 101, 'min_samples_split': 3, 'min_samples_leaf': 5}. Best is trial 21 with value: 0.8095238095238095.
[32m[I 2023-04-26 02:16:04,102][39m Trial 85 finished with value: 0.7529411764705882 and parameters: {'criterion': 'entropy', 'n_estimators': 54, 'max_features': 0.7656454201689119, 'max_depth': 78, 'min_samples_split': 8, 'min_samples_leaf': 4}. Best is trial 21 with value: 0.8095238095238095.
[32m[I 2023-04-26 02:16:04,180][39m Trial 86 finished with value: 0.761904761904762 and parameters: {'criterion': 'entropy', 'n_estimators': 86, 'max_features': 0.9592102752137004, 'max_depth': 85, 'min_samples_split': 9, 'min_samples_leaf': 4}. Best is trial 21 with value: 0.8095238095238095.
[32m[I 2023-04-26 02:16:04,342][39m Trial 87 finished with value: 0.7710843373493976 and parameters: {'criterion': 'entropy', 'n_estimators': 191, 'max_features': 0.9997499798609187, 'max_depth': 92, 'min_samples_split': 3, 'min_samples_leaf': 3}. Best is trial 21 with value: 0.8095238095238095.
[32m[I 2023-04-26 02:16:04,404][39m Trial 88 finished with value: 0.7356321839080461 and parameters: {'criterion': 'gini', 'n_estimators': 79, 'max_features': 0.6208049888121199, 'max_depth': 96, 'min_samples_split': 2, 'min_samples_leaf': 4}. Best is trial 21 with value: 0.8095238095238095.
[32m[I 2023-04-26 02:16:04,461][39m Trial 89 finished with value: 0.7356321839080461 and parameters: {'criterion': 'entropy', 'n_estimators': 73, 'max_features': 0.44224452204522646, 'max_depth': 83, 'min_samples_split': 8, 'min_samples_leaf': 5}. Best is trial 21 with value: 0.8095238095238095.
[32m[I 2023-04-26 02:16:04,578][39m Trial 90 finished with value: 0.7674418604651163 and parameters: {'criterion': 'entropy', 'n_estimators': 143, 'max_features': 0.8094264629958322, 'max_depth': 20, 'min_samples_split': 9, 'min_samples_leaf': 6}. Best is trial 21 with value: 0.8095238095238095.
[32m[I 2023-04-26 02:16:04,636][39m Trial 91 finished with value: 0.7764705882352942 and parameters: {'criterion': 'entropy', 'n_estimators': 61, 'max_features': 0.9737785873558618, 'max_depth': 91, 'min_samples_split': 4, 'min_samples_leaf': 5}. Best is trial 21 with value: 0.8095238095238095.
[32m[I 2023-04-26 02:16:04,700][39m Trial 92 finished with value: 0.761904761904762 and parameters: {'criterion': 'entropy', 'n_estimators': 69, 'max_features': 0.9288932705607191, 'max_depth': 89, 'min_samples_split': 4, 'min_samples_leaf': 5}. Best is trial 21 with value: 0.8095238095238095.
[32m[I 2023-04-26 02:16:04,754][39m Trial 93 finished with value: 0.7500000000000001 and parameters: {'criterion': 'entropy', 'n_estimators': 58, 'max_features': 0.8951941205295584, 'max_depth': 99, 'min_samples_split': 3, 'min_samples_leaf': 6}. Best is trial 21 with value: 0.8095238095238095.
[32m[I 2023-04-26 02:16:04,806][39m Trial 94 finished with value: 0.761904761904762 and parameters: {'criterion': 'entropy', 'n_estimators': 55, 'max_features': 0.9778385263491169, 'max_depth': 93, 'min_samples_split': 11, 'min_samples_leaf': 4}. Best is trial 21 with value: 0.8095238095238095.
[32m[I 2023-04-26 02:16:04,860][39m Trial 95 finished with value: 0.7499999999999999 and parameters: {'criterion': 'entropy', 'n_estimators': 52, 'max_features': 0.9520626365101057, 'max_depth': 80, 'min_samples_split': 3, 'min_samples_leaf': 3}. Best is trial 21 with value: 0.8095238095238095.
[32m[I 2023-04-26 02:16:04,918][39m Trial 96 finished with value: 0.7586206896551724 and parameters: {'criterion': 'entropy', 'n_estimators': 60, 'max_features': 0.9122471709173319, 'max_depth': 98, 'min_samples_split': 7, 'min_samples_leaf': 4}. Best is trial 21 with value: 0.8095238095238095.
[32m[I 2023-04-26 02:16:05,001][39m Trial 97 finished with value: 0.7727272727272727 and parameters: {'criterion': 'entropy', 'n_estimators': 96, 'max_features': 0.8499906663285112, 'max_depth': 8, 'min_samples_split': 2, 'min_samples_leaf': 5}. Best is trial 21 with value: 0.8095238095238095.
[32m[I 2023-04-26 02:16:05,091][39m Trial 98 finished with value: 0.7529411764705882 and parameters: {'criterion': 'entropy', 'n_estimators': 101, 'max_features': 0.9506042257242004, 'max_depth': 86, 'min_samples_split': 4, 'min_samples_leaf': 3}. Best is trial 21 with value: 0.8095238095238095.
[32m[I 2023-04-26 02:16:05,208][39m Trial 99 finished with value: 0.7586206896551724 and parameters: {'criterion': 'entropy', 'n_estimators': 163, 'max_features': 0.5340115081616246, 'max_depth': 90, 'min_samples_split': 8, 'min_samples_leaf': 4}. Best is trial 21 with value: 0.8095238095238095.
[32m[I 2023-04-26 02:16:05,307][39m Trial 100 finished with value: 0.761904761904762 and parameters: {'criterion': 'entropy', 'n_estimators': 122, 'max_features': 0.709099346318123, 'max_depth': 39, 'min_samples_split': 10, 'min_samples_leaf': 3}. Best is trial 21 with value: 0.8095238095238095.
[32m[I 2023-04-26 02:16:05,386][39m Trial 101 finished with value: 0.7674418604651163 and parameters: {'criterion': 'entropy', 'n_estimators': 97, 'max_features': 0.8671878072969992, 'max_depth': 52, 'min_samples_split': 2, 'min_samples_leaf': 5}. Best is trial 21 with value: 0.8095238095238095.
[32m[I 2023-04-26 02:16:05,469][39m Trial 102 finished with value: 0.7529411764705882 and parameters: {'criterion': 'entropy', 'n_estimators': 89, 'max_features': 0.8290597810661009, 'max_depth': 43, 'min_samples_split': 2, 'min_samples_leaf': 5}. Best is trial 21 with value: 0.8095238095238095.
[32m[I 2023-04-26 02:16:05,579][39m Trial 103 finished with value: 0.7500000000000001 and parameters: {'criterion': 'entropy', 'n_estimators': 129, 'max_features': 0.8933835706750657, 'max_depth': 9, 'min_samples_split': 3, 'min_samples_leaf': 5}. Best is trial 21 with value: 0.8095238095238095.
[32m[I 2023-04-26 02:16:05,668][39m Trial 104 finished with value: 0.7555555555555555 and parameters: {'criterion': 'entropy', 'n_estimators': 107, 'max_features': 0.8506456873322986, 'max_depth': 33, 'min_samples_split': 2, 'min_samples_leaf': 6}. Best is trial 21 with value: 0.8095238095238095.
[32m[I 2023-04-26 02:16:05,745][39m Trial 105 finished with value: 0.7764705882352942 and parameters: {'criterion': 'entropy', 'n_estimators': 84, 'max_features': 0.982211425358878, 'max_depth': 26, 'min_samples_split': 6, 'min_samples_leaf': 4}. Best is trial 21 with value: 0.8095238095238095.
[32m[I 2023-04-26 02:16:05,818][39m Trial 106 finished with value: 0.7380952380952381 and parameters: {'criterion': 'gini', 'n_estimators': 83, 'max_features': 0.9877577201969328, 'max_depth': 94, 'min_samples_split': 6, 'min_samples_leaf': 4}. Best is trial 21 with value: 0.8095238095238095.
[32m[I 2023-04-26 02:16:05,878][39m Trial 107 finished with value: 0.7560975609756099 and parameters: {'criterion': 'entropy', 'n_estimators': 63, 'max_features': 0.9270564958688915, 'max_depth': 47, 'min_samples_split': 9, 'min_samples_leaf': 2}. Best is trial 21 with value: 0.8095238095238095.
[32m[I 2023-04-26 02:16:05,957][39m Trial 108 finished with value: 0.7415730337078651 and parameters: {'criterion': 'entropy', 'n_estimators': 92, 'max_features': 0.9609909221291896, 'max_depth': 29, 'min_samples_split': 5, 'min_samples_leaf': 9}. Best is trial 21 with value: 0.8095238095238095.
[32m[I 2023-04-26 02:16:06,027][39m Trial 109 finished with value: 0.7499999999999999 and parameters: {'criterion': 'entropy', 'n_estimators': 72, 'max_features': 0.982390570825669, 'max_depth': 25, 'min_samples_split': 7, 'min_samples_leaf': 3}. Best is trial 21 with value: 0.8095238095238095.
[32m[I 2023-04-26 02:16:06,087][39m Trial 110 finished with value: 0.7586206896551724 and parameters: {'criterion': 'entropy', 'n_estimators': 68, 'max_features': 0.9388219788504327, 'max_depth': 95, 'min_samples_split': 4, 'min_samples_leaf': 7}. Best is trial 21 with value: 0.8095238095238095.
[32m[I 2023-04-26 02:16:06,162][39m Trial 111 finished with value: 0.7346938775510203 and parameters: {'criterion': 'entropy', 'n_estimators': 95, 'max_features': 0.737476339497898, 'max_depth': 4, 'min_samples_split': 2, 'min_samples_leaf': 4}. Best is trial 21 with value: 0.8095238095238095.
[32m[I 2023-04-26 02:16:06,226][39m Trial 112 finished with value: 0.7356321839080461 and parameters: {'criterion': 'entropy', 'n_estimators': 103, 'max_features': 0.006266338410993333, 'max_depth': 8, 'min_samples_split': 9, 'min_samples_leaf': 5}. Best is trial 21 with value: 0.8095238095238095.
[32m[I 2023-04-26 02:16:06,276][39m Trial 113 finished with value: 0.6612903225806451 and parameters: {'criterion': 'entropy', 'n_estimators': 57, 'max_features': 0.7998663650571811, 'max_depth': 1, 'min_samples_split': 3, 'min_samples_leaf': 4}. Best is trial 21 with value: 0.8095238095238095.
[32m[I 2023-04-26 02:16:06,364][39m Trial 114 finished with value: 0.7764705882352942 and parameters: {'criterion': 'entropy', 'n_estimators': 97, 'max_features': 0.9140778064209694, 'max_depth': 32, 'min_samples_split': 6, 'min_samples_leaf': 4}. Best is trial 21 with value: 0.8095238095238095.
[32m[I 2023-04-26 02:16:06,461][39m Trial 115 finished with value: 0.7764705882352942 and parameters: {'criterion': 'entropy', 'n_estimators': 114, 'max_features': 0.9080042989428376, 'max_depth': 22, 'min_samples_split': 6, 'min_samples_leaf': 4}. Best is trial 21 with value: 0.8095238095238095.
[32m[I 2023-04-26 02:16:06,556][39m Trial 116 finished with value: 0.7654320987654322 and parameters: {'criterion': 'entropy', 'n_estimators': 114, 'max_features': 0.8760791733627713, 'max_depth': 23, 'min_samples_split': 6, 'min_samples_leaf': 3}. Best is trial 21 with value: 0.8095238095238095.
[32m[I 2023-04-26 02:16:06,651][39m Trial 117 finished with value: 0.7710843373493976 and parameters: {'criterion': 'entropy', 'n_estimators': 111, 'max_features': 0.961784874832765, 'max_depth': 17, 'min_samples_split': 5, 'min_samples_leaf': 4}. Best is trial 21 with value: 0.8095238095238095.
[32m[I 2023-04-26 02:16:06,798][39m Trial 118 finished with value: 0.7407407407407408 and parameters: {'criterion': 'entropy', 'n_estimators': 171, 'max_features': 0.9004740878587553, 'max_depth': 99, 'min_samples_split': 6, 'min_samples_leaf': 2}. Best is trial 21 with value: 0.8095238095238095.
[32m[I 2023-04-26 02:16:06,901][39m Trial 119 finished with value: 0.7710843373493976 and parameters: {'criterion': 'entropy', 'n_estimators': 118, 'max_features': 0.9224173783382541, 'max_depth': 26, 'min_samples_split': 6, 'min_samples_leaf': 4}. Best is trial 21 with value: 0.8095238095238095.
[32m[I 2023-04-26 02:16:06,978][39m Trial 120 finished with value: 0.761904761904762 and parameters: {'criterion': 'gini', 'n_estimators': 98, 'max_features': 0.8789722712679926, 'max_depth': 32, 'min_samples_split': 6, 'min_samples_leaf': 4}. Best is trial 21 with value: 0.8095238095238095.
[32m[I 2023-04-26 02:16:07,130][39m Trial 121 finished with value: 0.7857142857142858 and parameters: {'criterion': 'entropy', 'n_estimators': 182, 'max_features': 0.9103651516607617, 'max_depth': 21, 'min_samples_split': 7, 'min_samples_leaf': 4}. Best is trial 21 with value: 0.8095238095238095.
[32m[I 2023-04-26 02:16:07,210][39m Trial 122 finished with value: 0.7710843373493976 and parameters: {'criterion': 'entropy', 'n_estimators': 88, 'max_features': 0.9119623102613953, 'max_depth': 20, 'min_samples_split': 7, 'min_samples_leaf': 4}. Best is trial 21 with value: 0.8095238095238095.
[32m[I 2023-04-26 02:16:07,372][39m Trial 123 finished with value: 0.7560975609756099 and parameters: {'criterion': 'entropy', 'n_estimators': 189, 'max_features': 0.9466701490065739, 'max_depth': 60, 'min_samples_split': 7, 'min_samples_leaf': 3}. Best is trial 21 with value: 0.8095238095238095.
[32m[I 2023-04-26 02:16:07,477][39m Trial 124 finished with value: 0.7209302325581395 and parameters: {'criterion': 'entropy', 'n_estimators': 153, 'max_features': 0.32748384334410685, 'max_depth': 27, 'min_samples_split': 6, 'min_samples_leaf': 4}. Best is trial 21 with value: 0.8095238095238095.
[32m[I 2023-04-26 02:16:07,569][39m Trial 125 finished with value: 0.7951807228915663 and parameters: {'criterion': 'entropy', 'n_estimators': 102, 'max_features': 0.9958111434274599, 'max_depth': 23, 'min_samples_split': 7, 'min_samples_leaf': 4}. Best is trial 21 with value: 0.8095238095238095.
[32m[I 2023-04-26 02:16:07,719][39m Trial 126 finished with value: 0.7441860465116279 and parameters: {'criterion': 'entropy', 'n_estimators': 180, 'max_features': 0.9995245767403815, 'max_depth': 14, 'min_samples_split': 7, 'min_samples_leaf': 5}. Best is trial 21 with value: 0.8095238095238095.
[32m[I 2023-04-26 02:16:07,876][39m Trial 127 finished with value: 0.7951807228915663 and parameters: {'criterion': 'entropy', 'n_estimators': 180, 'max_features': 0.968986017779434, 'max_depth': 34, 'min_samples_split': 8, 'min_samples_leaf': 3}. Best is trial 21 with value: 0.8095238095238095.
[32m[I 2023-04-26 02:16:08,030][39m Trial 128 finished with value: 0.7857142857142858 and parameters: {'criterion': 'entropy', 'n_estimators': 184, 'max_features': 0.9287877969975228, 'max_depth': 22, 'min_samples_split': 8, 'min_samples_leaf': 4}. Best is trial 21 with value: 0.8095238095238095.
[32m[I 2023-04-26 02:16:08,185][39m Trial 129 finished with value: 0.7857142857142858 and parameters: {'criterion': 'entropy', 'n_estimators': 183, 'max_features': 0.9362411298336725, 'max_depth': 20, 'min_samples_split': 8, 'min_samples_leaf': 3}. Best is trial 21 with value: 0.8095238095238095.
[32m[I 2023-04-26 02:16:08,339][39m Trial 130 finished with value: 0.7435897435897435 and parameters: {'criterion': 'entropy', 'n_estimators': 182, 'max_features': 0.9792724542838132, 'max_depth': 18, 'min_samples_split': 8, 'min_samples_leaf': 3}. Best is trial 21 with value: 0.8095238095238095.
[32m[I 2023-04-26 02:16:08,498][39m Trial 131 finished with value: 0.7901234567901235 and parameters: {'criterion': 'entropy', 'n_estimators': 186, 'max_features': 0.9347251576210991, 'max_depth': 33, 'min_samples_split': 8, 'min_samples_leaf': 3}. Best is trial 21 with value: 0.8095238095238095.
[32m[I 2023-04-26 02:16:08,657][39m Trial 132 finished with value: 0.7317073170731707 and parameters: {'criterion': 'entropy', 'n_estimators': 187, 'max_features': 0.9383670211718363, 'max_depth': 36, 'min_samples_split': 8, 'min_samples_leaf': 3}. Best is trial 21 with value: 0.8095238095238095.
[32m[I 2023-04-26 02:16:08,807][39m Trial 133 finished with value: 0.7764705882352942 and parameters: {'criterion': 'entropy', 'n_estimators': 176, 'max_features': 0.9555440208856357, 'max_depth': 23, 'min_samples_split': 8, 'min_samples_leaf': 3}. Best is trial 21 with value: 0.8095238095238095.
[32m[I 2023-04-26 02:16:08,977][39m Trial 134 finished with value: 0.7560975609756099 and parameters: {'criterion': 'entropy', 'n_estimators': 196, 'max_features': 0.9266616807659714, 'max_depth': 17, 'min_samples_split': 8, 'min_samples_leaf': 3}. Best is trial 21 with value: 0.8095238095238095.
[32m[I 2023-04-26 02:16:09,133][39m Trial 135 finished with value: 0.7529411764705882 and parameters: {'criterion': 'entropy', 'n_estimators': 180, 'max_features': 0.888712155682111, 'max_depth': 20, 'min_samples_split': 8, 'min_samples_leaf': 2}. Best is trial 21 with value: 0.8095238095238095.
[32m[I 2023-04-26 02:16:09,289][39m Trial 136 finished with value: 0.7560975609756099 and parameters: {'criterion': 'entropy', 'n_estimators': 185, 'max_features': 0.9563572764143258, 'max_depth': 13, 'min_samples_split': 8, 'min_samples_leaf': 3}. Best is trial 21 with value: 0.8095238095238095.
[32m[I 2023-04-26 02:16:09,454][39m Trial 137 finished with value: 0.7654320987654322 and parameters: {'criterion': 'entropy', 'n_estimators': 196, 'max_features': 0.9399169219373321, 'max_depth': 29, 'min_samples_split': 8, 'min_samples_leaf': 3}. Best is trial 21 with value: 0.8095238095238095.
[32m[I 2023-04-26 02:16:09,607][39m Trial 138 finished with value: 0.746987951807229 and parameters: {'criterion': 'entropy', 'n_estimators': 183, 'max_features': 0.9093716175773098, 'max_depth': 22, 'min_samples_split': 7, 'min_samples_leaf': 4}. Best is trial 21 with value: 0.8095238095238095.
[32m[I 2023-04-26 02:16:09,751][39m Trial 139 finished with value: 0.7674418604651163 and parameters: {'criterion': 'entropy', 'n_estimators': 173, 'max_features': 0.9998323111531965, 'max_depth': 12, 'min_samples_split': 8, 'min_samples_leaf': 4}. Best is trial 21 with value: 0.8095238095238095.
[32m[I 2023-04-26 02:16:09,907][39m Trial 140 finished with value: 0.7441860465116279 and parameters: {'criterion': 'entropy', 'n_estimators': 193, 'max_features': 0.9706091890825528, 'max_depth': 41, 'min_samples_split': 7, 'min_samples_leaf': 5}. Best is trial 21 with value: 0.8095238095238095.
[32m[I 2023-04-26 02:16:10,053][39m Trial 141 finished with value: 0.7586206896551724 and parameters: {'criterion': 'entropy', 'n_estimators': 169, 'max_features': 0.9821226942165465, 'max_depth': 21, 'min_samples_split': 8, 'min_samples_leaf': 4}. Best is trial 21 with value: 0.8095238095238095.
[32m[I 2023-04-26 02:16:10,178][39m Trial 142 finished with value: 0.7356321839080461 and parameters: {'criterion': 'entropy', 'n_estimators': 187, 'max_features': 0.23937069172399777, 'max_depth': 27, 'min_samples_split': 7, 'min_samples_leaf': 4}. Best is trial 21 with value: 0.8095238095238095.
[32m[I 2023-04-26 02:16:10,326][39m Trial 143 finished with value: 0.761904761904762 and parameters: {'criterion': 'entropy', 'n_estimators': 176, 'max_features': 0.9603524114343316, 'max_depth': 18, 'min_samples_split': 8, 'min_samples_leaf': 3}. Best is trial 21 with value: 0.8095238095238095.
[32m[I 2023-04-26 02:16:10,471][39m Trial 144 finished with value: 0.7710843373493976 and parameters: {'criterion': 'entropy', 'n_estimators': 178, 'max_features': 0.8390530668219627, 'max_depth': 24, 'min_samples_split': 9, 'min_samples_leaf': 3}. Best is trial 21 with value: 0.8095238095238095.
[32m[I 2023-04-26 02:16:10,622][39m Trial 145 finished with value: 0.7999999999999999 and parameters: {'criterion': 'entropy', 'n_estimators': 181, 'max_features': 0.9765018550864151, 'max_depth': 30, 'min_samples_split': 8, 'min_samples_leaf': 4}. Best is trial 21 with value: 0.8095238095238095.
