[32m[I 2023-04-26 02:16:43,847][39m Trial 365 finished with value: 0.7857142857142858 and parameters: {'criterion': 'entropy', 'n_estimators': 178, 'max_features': 0.978318826273863, 'max_depth': 35, 'min_samples_split': 8, 'min_samples_leaf': 3}. Best is trial 21 with value: 0.8095238095238095.
[32m[I 2023-04-26 02:16:44,026][39m Trial 366 finished with value: 0.7499999999999999 and parameters: {'criterion': 'entropy', 'n_estimators': 183, 'max_features': 0.9260078607744857, 'max_depth': 37, 'min_samples_split': 7, 'min_samples_leaf': 3}. Best is trial 21 with value: 0.8095238095238095.
[32m[I 2023-04-26 02:16:44,191][39m Trial 367 finished with value: 0.7710843373493976 and parameters: {'criterion': 'entropy', 'n_estimators': 170, 'max_features': 0.9523456332353137, 'max_depth': 30, 'min_samples_split': 9, 'min_samples_leaf': 3}. Best is trial 21 with value: 0.8095238095238095.
[32m[I 2023-04-26 02:16:44,348][39m Trial 368 finished with value: 0.7560975609756099 and parameters: {'criterion': 'gini', 'n_estimators': 174, 'max_features': 0.9796048645112798, 'max_depth': 24, 'min_samples_split': 8, 'min_samples_leaf': 2}. Best is trial 21 with value: 0.8095238095238095.
[32m[I 2023-04-26 02:16:44,449][39m Trial 369 finished with value: 0.7441860465116279 and parameters: {'criterion': 'entropy', 'n_estimators': 125, 'max_features': 0.10633561883684084, 'max_depth': 68, 'min_samples_split': 7, 'min_samples_leaf': 3}. Best is trial 21 with value: 0.8095238095238095.
[32m[I 2023-04-26 02:16:44,629][39m Trial 370 finished with value: 0.7901234567901235 and parameters: {'criterion': 'entropy', 'n_estimators': 187, 'max_features': 0.964326921241853, 'max_depth': 71, 'min_samples_split': 8, 'min_samples_leaf': 3}. Best is trial 21 with value: 0.8095238095238095.
[32m[I 2023-04-26 02:16:44,821][39m Trial 371 finished with value: 0.761904761904762 and parameters: {'criterion': 'entropy', 'n_estimators': 189, 'max_features': 0.9696010409275093, 'max_depth': 71, 'min_samples_split': 8, 'min_samples_leaf': 3}. Best is trial 21 with value: 0.8095238095238095.
[32m[I 2023-04-26 02:16:45,006][39m Trial 372 finished with value: 0.7951807228915663 and parameters: {'criterion': 'entropy', 'n_estimators': 187, 'max_features': 0.9110458635987965, 'max_depth': 16, 'min_samples_split': 8, 'min_samples_leaf': 3}. Best is trial 21 with value: 0.8095238095238095.
[32m[I 2023-04-26 02:16:45,179][39m Trial 373 finished with value: 0.7594936708860759 and parameters: {'criterion': 'entropy', 'n_estimators': 183, 'max_features': 0.8780173130018628, 'max_depth': 15, 'min_samples_split': 9, 'min_samples_leaf': 3}. Best is trial 21 with value: 0.8095238095238095.
[32m[I 2023-04-26 02:16:45,365][39m Trial 374 finished with value: 0.7160493827160495 and parameters: {'criterion': 'entropy', 'n_estimators': 191, 'max_features': 0.9760704659963916, 'max_depth': 17, 'min_samples_split': 10, 'min_samples_leaf': 2}. Best is trial 21 with value: 0.8095238095238095.
[32m[I 2023-04-26 02:16:45,551][39m Trial 375 finished with value: 0.7848101265822786 and parameters: {'criterion': 'entropy', 'n_estimators': 187, 'max_features': 0.8988836706746051, 'max_depth': 15, 'min_samples_split': 7, 'min_samples_leaf': 3}. Best is trial 21 with value: 0.8095238095238095.
[32m[I 2023-04-26 02:16:45,726][39m Trial 376 finished with value: 0.7710843373493976 and parameters: {'criterion': 'entropy', 'n_estimators': 186, 'max_features': 0.9983321805726884, 'max_depth': 25, 'min_samples_split': 8, 'min_samples_leaf': 3}. Best is trial 21 with value: 0.8095238095238095.
[32m[I 2023-04-26 02:16:45,922][39m Trial 377 finished with value: 0.7654320987654322 and parameters: {'criterion': 'entropy', 'n_estimators': 196, 'max_features': 0.9127289255630712, 'max_depth': 58, 'min_samples_split': 9, 'min_samples_leaf': 3}. Best is trial 21 with value: 0.8095238095238095.
[32m[I 2023-04-26 02:16:46,108][39m Trial 378 finished with value: 0.7499999999999999 and parameters: {'criterion': 'entropy', 'n_estimators': 192, 'max_features': 0.9360176630755661, 'max_depth': 31, 'min_samples_split': 8, 'min_samples_leaf': 3}. Best is trial 21 with value: 0.8095238095238095.
[32m[I 2023-04-26 02:16:46,271][39m Trial 379 finished with value: 0.7252747252747254 and parameters: {'criterion': 'entropy', 'n_estimators': 178, 'max_features': 0.9646609566678355, 'max_depth': 13, 'min_samples_split': 8, 'min_samples_leaf': 10}. Best is trial 21 with value: 0.8095238095238095.
[32m[I 2023-04-26 02:16:46,460][39m Trial 380 finished with value: 0.7088607594936709 and parameters: {'criterion': 'entropy', 'n_estimators': 186, 'max_features': 0.9394173966318188, 'max_depth': 17, 'min_samples_split': 8, 'min_samples_leaf': 1}. Best is trial 21 with value: 0.8095238095238095.
[32m[I 2023-04-26 02:16:46,617][39m Trial 381 finished with value: 0.7951807228915663 and parameters: {'criterion': 'entropy', 'n_estimators': 157, 'max_features': 0.9574647254857855, 'max_depth': 73, 'min_samples_split': 8, 'min_samples_leaf': 3}. Best is trial 21 with value: 0.8095238095238095.
[32m[I 2023-04-26 02:16:46,767][39m Trial 382 finished with value: 0.7407407407407408 and parameters: {'criterion': 'entropy', 'n_estimators': 150, 'max_features': 0.9808979044832733, 'max_depth': 73, 'min_samples_split': 8, 'min_samples_leaf': 3}. Best is trial 21 with value: 0.8095238095238095.
[32m[I 2023-04-26 02:16:46,946][39m Trial 383 finished with value: 0.7294117647058823 and parameters: {'criterion': 'entropy', 'n_estimators': 181, 'max_features': 0.9564567170174809, 'max_depth': 19, 'min_samples_split': 7, 'min_samples_leaf': 2}. Best is trial 21 with value: 0.8095238095238095.
[32m[I 2023-04-26 02:16:47,124][39m Trial 384 finished with value: 0.7901234567901235 and parameters: {'criterion': 'entropy', 'n_estimators': 183, 'max_features': 0.998427874451784, 'max_depth': 63, 'min_samples_split': 8, 'min_samples_leaf': 3}. Best is trial 21 with value: 0.8095238095238095.
[32m[I 2023-04-26 02:16:47,284][39m Trial 385 finished with value: 0.7857142857142858 and parameters: {'criterion': 'entropy', 'n_estimators': 163, 'max_features': 0.9197365893908175, 'max_depth': 65, 'min_samples_split': 8, 'min_samples_leaf': 3}. Best is trial 21 with value: 0.8095238095238095.
[32m[I 2023-04-26 02:16:47,421][39m Trial 386 finished with value: 0.761904761904762 and parameters: {'criterion': 'gini', 'n_estimators': 154, 'max_features': 0.8884116365138783, 'max_depth': 52, 'min_samples_split': 8, 'min_samples_leaf': 3}. Best is trial 21 with value: 0.8095238095238095.
[32m[I 2023-04-26 02:16:47,578][39m Trial 387 finished with value: 0.8048780487804877 and parameters: {'criterion': 'entropy', 'n_estimators': 158, 'max_features': 0.9976351331699771, 'max_depth': 62, 'min_samples_split': 8, 'min_samples_leaf': 3}. Best is trial 21 with value: 0.8095238095238095.
[32m[I 2023-04-26 02:16:47,737][39m Trial 388 finished with value: 0.7804878048780488 and parameters: {'criterion': 'entropy', 'n_estimators': 157, 'max_features': 0.9972099190645964, 'max_depth': 61, 'min_samples_split': 8, 'min_samples_leaf': 3}. Best is trial 21 with value: 0.8095238095238095.
[32m[I 2023-04-26 02:16:47,890][39m Trial 389 finished with value: 0.7529411764705882 and parameters: {'criterion': 'entropy', 'n_estimators': 156, 'max_features': 0.9425059861409789, 'max_depth': 48, 'min_samples_split': 8, 'min_samples_leaf': 3}. Best is trial 21 with value: 0.8095238095238095.
[32m[I 2023-04-26 02:16:48,048][39m Trial 390 finished with value: 0.7764705882352942 and parameters: {'criterion': 'entropy', 'n_estimators': 160, 'max_features': 0.9786709220701119, 'max_depth': 33, 'min_samples_split': 9, 'min_samples_leaf': 3}. Best is trial 21 with value: 0.8095238095238095.
[32m[I 2023-04-26 02:16:48,202][39m Trial 391 finished with value: 0.761904761904762 and parameters: {'criterion': 'entropy', 'n_estimators': 152, 'max_features': 0.998508620433896, 'max_depth': 60, 'min_samples_split': 8, 'min_samples_leaf': 2}. Best is trial 21 with value: 0.8095238095238095.
[32m[I 2023-04-26 02:16:48,360][39m Trial 392 finished with value: 0.7499999999999999 and parameters: {'criterion': 'entropy', 'n_estimators': 158, 'max_features': 0.9996487046242838, 'max_depth': 21, 'min_samples_split': 8, 'min_samples_leaf': 3}. Best is trial 21 with value: 0.8095238095238095.
[32m[I 2023-04-26 02:16:48,534][39m Trial 393 finished with value: 0.7560975609756099 and parameters: {'criterion': 'entropy', 'n_estimators': 180, 'max_features': 0.9030875529774873, 'max_depth': 11, 'min_samples_split': 8, 'min_samples_leaf': 3}. Best is trial 21 with value: 0.8095238095238095.
[32m[I 2023-04-26 02:16:48,716][39m Trial 394 finished with value: 0.7560975609756099 and parameters: {'criterion': 'entropy', 'n_estimators': 188, 'max_features': 0.9796205681728213, 'max_depth': 63, 'min_samples_split': 8, 'min_samples_leaf': 3}. Best is trial 21 with value: 0.8095238095238095.
[32m[I 2023-04-26 02:16:48,850][39m Trial 395 finished with value: 0.7804878048780488 and parameters: {'criterion': 'entropy', 'n_estimators': 132, 'max_features': 0.9517920594324077, 'max_depth': 68, 'min_samples_split': 8, 'min_samples_leaf': 3}. Best is trial 21 with value: 0.8095238095238095.
[32m[I 2023-04-26 02:16:48,992][39m Trial 396 finished with value: 0.7857142857142858 and parameters: {'criterion': 'entropy', 'n_estimators': 138, 'max_features': 0.9528116149286515, 'max_depth': 35, 'min_samples_split': 9, 'min_samples_leaf': 3}. Best is trial 21 with value: 0.8095238095238095.
[32m[I 2023-04-26 02:16:49,174][39m Trial 397 finished with value: 0.7749999999999999 and parameters: {'criterion': 'entropy', 'n_estimators': 184, 'max_features': 0.96187761514277, 'max_depth': 64, 'min_samples_split': 8, 'min_samples_leaf': 3}. Best is trial 21 with value: 0.8095238095238095.
[32m[I 2023-04-26 02:16:49,334][39m Trial 398 finished with value: 0.761904761904762 and parameters: {'criterion': 'entropy', 'n_estimators': 164, 'max_features': 0.9781322801390668, 'max_depth': 70, 'min_samples_split': 8, 'min_samples_leaf': 3}. Best is trial 21 with value: 0.8095238095238095.
[32m[I 2023-04-26 02:16:49,536][39m Trial 399 finished with value: 0.7857142857142858 and parameters: {'criterion': 'entropy', 'n_estimators': 190, 'max_features': 0.9376863124842888, 'max_depth': 44, 'min_samples_split': 8, 'min_samples_leaf': 3}. Best is trial 21 with value: 0.8095238095238095.
[32m[I 2023-04-26 02:16:49,714][39m Trial 400 finished with value: 0.7857142857142858 and parameters: {'criterion': 'entropy', 'n_estimators': 182, 'max_features': 0.966168852454261, 'max_depth': 62, 'min_samples_split': 8, 'min_samples_leaf': 3}. Best is trial 21 with value: 0.8095238095238095.
[32m[I 2023-04-26 02:16:49,887][39m Trial 401 finished with value: 0.761904761904762 and parameters: {'criterion': 'entropy', 'n_estimators': 173, 'max_features': 0.9149540065954415, 'max_depth': 76, 'min_samples_split': 6, 'min_samples_leaf': 3}. Best is trial 21 with value: 0.8095238095238095.
[32m[I 2023-04-26 02:16:50,046][39m Trial 402 finished with value: 0.7294117647058823 and parameters: {'criterion': 'entropy', 'n_estimators': 154, 'max_features': 0.9245841909241669, 'max_depth': 73, 'min_samples_split': 8, 'min_samples_leaf': 2}. Best is trial 21 with value: 0.8095238095238095.
[32m[I 2023-04-26 02:16:50,218][39m Trial 403 finished with value: 0.7654320987654322 and parameters: {'criterion': 'entropy', 'n_estimators': 178, 'max_features': 0.9380133498257084, 'max_depth': 64, 'min_samples_split': 8, 'min_samples_leaf': 3}. Best is trial 21 with value: 0.8095238095238095.
[32m[I 2023-04-26 02:16:50,408][39m Trial 404 finished with value: 0.7560975609756099 and parameters: {'criterion': 'entropy', 'n_estimators': 199, 'max_features': 0.9061942425995605, 'max_depth': 67, 'min_samples_split': 8, 'min_samples_leaf': 3}. Best is trial 21 with value: 0.8095238095238095.
[32m[I 2023-04-26 02:16:50,568][39m Trial 405 finished with value: 0.7252747252747254 and parameters: {'criterion': 'entropy', 'n_estimators': 176, 'max_features': 0.9264194969315709, 'max_depth': 29, 'min_samples_split': 8, 'min_samples_leaf': 9}. Best is trial 21 with value: 0.8095238095238095.
[32m[I 2023-04-26 02:16:50,725][39m Trial 406 finished with value: 0.746987951807229 and parameters: {'criterion': 'entropy', 'n_estimators': 183, 'max_features': 0.4802110844331797, 'max_depth': 26, 'min_samples_split': 9, 'min_samples_leaf': 3}. Best is trial 21 with value: 0.8095238095238095.
[32m[I 2023-04-26 02:16:50,866][39m Trial 407 finished with value: 0.7407407407407408 and parameters: {'criterion': 'entropy', 'n_estimators': 161, 'max_features': 0.6291875563459572, 'max_depth': 66, 'min_samples_split': 8, 'min_samples_leaf': 2}. Best is trial 21 with value: 0.8095238095238095.
[32m[I 2023-04-26 02:16:51,058][39m Trial 408 finished with value: 0.7499999999999999 and parameters: {'criterion': 'entropy', 'n_estimators': 194, 'max_features': 0.9984294727390789, 'max_depth': 75, 'min_samples_split': 8, 'min_samples_leaf': 3}. Best is trial 21 with value: 0.8095238095238095.
[32m[I 2023-04-26 02:16:51,241][39m Trial 409 finished with value: 0.7710843373493976 and parameters: {'criterion': 'entropy', 'n_estimators': 189, 'max_features': 0.9830101842935672, 'max_depth': 69, 'min_samples_split': 8, 'min_samples_leaf': 3}. Best is trial 21 with value: 0.8095238095238095.
[32m[I 2023-04-26 02:16:51,408][39m Trial 410 finished with value: 0.7804878048780488 and parameters: {'criterion': 'gini', 'n_estimators': 186, 'max_features': 0.9542089001731344, 'max_depth': 58, 'min_samples_split': 7, 'min_samples_leaf': 3}. Best is trial 21 with value: 0.8095238095238095.
[32m[I 2023-04-26 02:16:51,558][39m Trial 411 finished with value: 0.7710843373493976 and parameters: {'criterion': 'entropy', 'n_estimators': 158, 'max_features': 0.8425295639996652, 'max_depth': 23, 'min_samples_split': 9, 'min_samples_leaf': 3}. Best is trial 21 with value: 0.8095238095238095.
[32m[I 2023-04-26 02:16:51,704][39m Trial 412 finished with value: 0.7710843373493976 and parameters: {'criterion': 'entropy', 'n_estimators': 144, 'max_features': 0.9664685561743132, 'max_depth': 65, 'min_samples_split': 8, 'min_samples_leaf': 3}. Best is trial 21 with value: 0.8095238095238095.
[32m[I 2023-04-26 02:16:51,862][39m Trial 413 finished with value: 0.761904761904762 and parameters: {'criterion': 'entropy', 'n_estimators': 165, 'max_features': 0.8786173887567099, 'max_depth': 77, 'min_samples_split': 9, 'min_samples_leaf': 2}. Best is trial 21 with value: 0.8095238095238095.
[32m[I 2023-04-26 02:16:52,031][39m Trial 414 finished with value: 0.7654320987654322 and parameters: {'criterion': 'entropy', 'n_estimators': 170, 'max_features': 0.9814822368742391, 'max_depth': 71, 'min_samples_split': 8, 'min_samples_leaf': 3}. Best is trial 21 with value: 0.8095238095238095.
[32m[I 2023-04-26 02:16:52,195][39m Trial 415 finished with value: 0.782608695652174 and parameters: {'criterion': 'entropy', 'n_estimators': 180, 'max_features': 0.9541760959018609, 'max_depth': 6, 'min_samples_split': 7, 'min_samples_leaf': 3}. Best is trial 21 with value: 0.8095238095238095.
[32m[I 2023-04-26 02:16:52,344][39m Trial 416 finished with value: 0.7749999999999999 and parameters: {'criterion': 'entropy', 'n_estimators': 147, 'max_features': 0.9689164694725373, 'max_depth': 16, 'min_samples_split': 7, 'min_samples_leaf': 3}. Best is trial 21 with value: 0.8095238095238095.
[32m[I 2023-04-26 02:16:52,468][39m Trial 417 finished with value: 0.7749999999999999 and parameters: {'criterion': 'entropy', 'n_estimators': 119, 'max_features': 0.979477635607912, 'max_depth': 71, 'min_samples_split': 6, 'min_samples_leaf': 3}. Best is trial 21 with value: 0.8095238095238095.
[32m[I 2023-04-26 02:16:52,642][39m Trial 418 finished with value: 0.7654320987654322 and parameters: {'criterion': 'entropy', 'n_estimators': 176, 'max_features': 0.8921348066252757, 'max_depth': 73, 'min_samples_split': 8, 'min_samples_leaf': 3}. Best is trial 21 with value: 0.8095238095238095.
[32m[I 2023-04-26 02:16:52,811][39m Trial 419 finished with value: 0.7857142857142858 and parameters: {'criterion': 'entropy', 'n_estimators': 173, 'max_features': 0.9190016649903814, 'max_depth': 74, 'min_samples_split': 8, 'min_samples_leaf': 3}. Best is trial 21 with value: 0.8095238095238095.
[32m[I 2023-04-26 02:16:52,997][39m Trial 420 finished with value: 0.7674418604651163 and parameters: {'criterion': 'entropy', 'n_estimators': 188, 'max_features': 0.9534651450457357, 'max_depth': 19, 'min_samples_split': 11, 'min_samples_leaf': 3}. Best is trial 21 with value: 0.8095238095238095.
[32m[I 2023-04-26 02:16:53,154][39m Trial 421 finished with value: 0.761904761904762 and parameters: {'criterion': 'entropy', 'n_estimators': 161, 'max_features': 0.961732109651834, 'max_depth': 75, 'min_samples_split': 8, 'min_samples_leaf': 3}. Best is trial 21 with value: 0.8095238095238095.
[32m[I 2023-04-26 02:16:53,321][39m Trial 422 finished with value: 0.761904761904762 and parameters: {'criterion': 'entropy', 'n_estimators': 167, 'max_features': 0.9858211324295258, 'max_depth': 68, 'min_samples_split': 8, 'min_samples_leaf': 2}. Best is trial 21 with value: 0.8095238095238095.
[32m[I 2023-04-26 02:16:53,506][39m Trial 423 finished with value: 0.7804878048780488 and parameters: {'criterion': 'entropy', 'n_estimators': 192, 'max_features': 0.9953050915989782, 'max_depth': 28, 'min_samples_split': 7, 'min_samples_leaf': 3}. Best is trial 21 with value: 0.8095238095238095.
[32m[I 2023-04-26 02:16:53,674][39m Trial 424 finished with value: 0.7529411764705882 and parameters: {'criterion': 'entropy', 'n_estimators': 170, 'max_features': 0.9420821845965117, 'max_depth': 18, 'min_samples_split': 9, 'min_samples_leaf': 3}. Best is trial 21 with value: 0.8095238095238095.
[32m[I 2023-04-26 02:16:53,855][39m Trial 425 finished with value: 0.7654320987654322 and parameters: {'criterion': 'entropy', 'n_estimators': 184, 'max_features': 0.998758569848199, 'max_depth': 56, 'min_samples_split': 8, 'min_samples_leaf': 3}. Best is trial 21 with value: 0.8095238095238095.
[32m[I 2023-04-26 02:16:54,006][39m Trial 426 finished with value: 0.7586206896551724 and parameters: {'criterion': 'gini', 'n_estimators': 169, 'max_features': 0.9989280226321505, 'max_depth': 66, 'min_samples_split': 8, 'min_samples_leaf': 5}. Best is trial 21 with value: 0.8095238095238095.
[32m[I 2023-04-26 02:16:54,164][39m Trial 427 finished with value: 0.7640449438202247 and parameters: {'criterion': 'entropy', 'n_estimators': 163, 'max_features': 0.9705849617610917, 'max_depth': 78, 'min_samples_split': 7, 'min_samples_leaf': 6}. Best is trial 21 with value: 0.8095238095238095.
[32m[I 2023-04-26 02:16:54,318][39m Trial 428 finished with value: 0.7764705882352942 and parameters: {'criterion': 'entropy', 'n_estimators': 153, 'max_features': 0.9064027459703747, 'max_depth': 32, 'min_samples_split': 10, 'min_samples_leaf': 3}. Best is trial 21 with value: 0.8095238095238095.
[32m[I 2023-04-26 02:16:54,496][39m Trial 429 finished with value: 0.7380952380952381 and parameters: {'criterion': 'entropy', 'n_estimators': 178, 'max_features': 0.9408124563075226, 'max_depth': 21, 'min_samples_split': 9, 'min_samples_leaf': 2}. Best is trial 21 with value: 0.8095238095238095.
[32m[I 2023-04-26 02:16:54,658][39m Trial 430 finished with value: 0.7654320987654322 and parameters: {'criterion': 'entropy', 'n_estimators': 165, 'max_features': 0.9325805814147105, 'max_depth': 72, 'min_samples_split': 8, 'min_samples_leaf': 3}. Best is trial 21 with value: 0.8095238095238095.
[32m[I 2023-04-26 02:16:54,841][39m Trial 431 finished with value: 0.7560975609756099 and parameters: {'criterion': 'entropy', 'n_estimators': 186, 'max_features': 0.9802206410514261, 'max_depth': 26, 'min_samples_split': 8, 'min_samples_leaf': 3}. Best is trial 21 with value: 0.8095238095238095.
[32m[I 2023-04-26 02:16:55,022][39m Trial 432 finished with value: 0.7804878048780488 and parameters: {'criterion': 'entropy', 'n_estimators': 182, 'max_features': 0.9796349868754671, 'max_depth': 76, 'min_samples_split': 8, 'min_samples_leaf': 3}. Best is trial 21 with value: 0.8095238095238095.
[32m[I 2023-04-26 02:16:55,185][39m Trial 433 finished with value: 0.7529411764705882 and parameters: {'criterion': 'entropy', 'n_estimators': 176, 'max_features': 0.705840196149979, 'max_depth': 14, 'min_samples_split': 7, 'min_samples_leaf': 4}. Best is trial 21 with value: 0.8095238095238095.
[32m[I 2023-04-26 02:16:55,347][39m Trial 434 finished with value: 0.7560975609756099 and parameters: {'criterion': 'entropy', 'n_estimators': 159, 'max_features': 0.9557810240471925, 'max_depth': 73, 'min_samples_split': 7, 'min_samples_leaf': 3}. Best is trial 21 with value: 0.8095238095238095.
[32m[I 2023-04-26 02:16:55,511][39m Trial 435 finished with value: 0.7586206896551724 and parameters: {'criterion': 'entropy', 'n_estimators': 172, 'max_features': 0.9656891493275418, 'max_depth': 63, 'min_samples_split': 8, 'min_samples_leaf': 6}. Best is trial 21 with value: 0.8095238095238095.
[32m[I 2023-04-26 02:16:55,685][39m Trial 436 finished with value: 0.7804878048780488 and parameters: {'criterion': 'entropy', 'n_estimators': 181, 'max_features': 0.8641738216097985, 'max_depth': 70, 'min_samples_split': 8, 'min_samples_leaf': 3}. Best is trial 21 with value: 0.8095238095238095.
[32m[I 2023-04-26 02:16:55,851][39m Trial 437 finished with value: 0.7951807228915663 and parameters: {'criterion': 'entropy', 'n_estimators': 166, 'max_features': 0.9171190839559292, 'max_depth': 72, 'min_samples_split': 8, 'min_samples_leaf': 3}. Best is trial 21 with value: 0.8095238095238095.
