[32m[I 2023-04-26 02:16:10,780][39m Trial 146 finished with value: 0.7317073170731707 and parameters: {'criterion': 'entropy', 'n_estimators': 184, 'max_features': 0.9310747397320428, 'max_depth': 35, 'min_samples_split': 8, 'min_samples_leaf': 2}. Best is trial 21 with value: 0.8095238095238095.
[32m[I 2023-04-26 02:16:10,928][39m Trial 147 finished with value: 0.7560975609756099 and parameters: {'criterion': 'entropy', 'n_estimators': 180, 'max_features': 0.8663576978729892, 'max_depth': 34, 'min_samples_split': 9, 'min_samples_leaf': 3}. Best is trial 21 with value: 0.8095238095238095.
[32m[I 2023-04-26 02:16:11,078][39m Trial 148 finished with value: 0.7380952380952381 and parameters: {'criterion': 'gini', 'n_estimators': 193, 'max_features': 0.9457887771163628, 'max_depth': 29, 'min_samples_split': 9, 'min_samples_leaf': 3}. Best is trial 21 with value: 0.8095238095238095.
[32m[I 2023-04-26 02:16:11,237][39m Trial 149 finished with value: 0.761904761904762 and parameters: {'criterion': 'entropy', 'n_estimators': 187, 'max_features': 0.9696005051524961, 'max_depth': 31, 'min_samples_split': 8, 'min_samples_leaf': 4}. Best is trial 21 with value: 0.8095238095238095.
[32m[I 2023-04-26 02:16:11,382][39m Trial 150 finished with value: 0.746987951807229 and parameters: {'criterion': 'entropy', 'n_estimators': 171, 'max_features': 0.9896522137118254, 'max_depth': 101, 'min_samples_split': 9, 'min_samples_leaf': 3}. Best is trial 21 with value: 0.8095238095238095.
[32m[I 2023-04-26 02:16:11,535][39m Trial 151 finished with value: 0.761904761904762 and parameters: {'criterion': 'entropy', 'n_estimators': 182, 'max_features': 0.9809905383131651, 'max_depth': 27, 'min_samples_split': 7, 'min_samples_leaf': 4}. Best is trial 21 with value: 0.8095238095238095.
[32m[I 2023-04-26 02:16:11,621][39m Trial 152 finished with value: 0.7529411764705882 and parameters: {'criterion': 'entropy', 'n_estimators': 104, 'max_features': 0.6584822092135404, 'max_depth': 39, 'min_samples_split': 8, 'min_samples_leaf': 4}. Best is trial 21 with value: 0.8095238095238095.
[32m[I 2023-04-26 02:16:11,716][39m Trial 153 finished with value: 0.7710843373493976 and parameters: {'criterion': 'entropy', 'n_estimators': 108, 'max_features': 0.9015255467339793, 'max_depth': 22, 'min_samples_split': 9, 'min_samples_leaf': 4}. Best is trial 21 with value: 0.8095238095238095.
[32m[I 2023-04-26 02:16:11,766][39m Trial 154 finished with value: 0.7499999999999999 and parameters: {'criterion': 'entropy', 'n_estimators': 52, 'max_features': 0.5890374964932934, 'max_depth': 97, 'min_samples_split': 8, 'min_samples_leaf': 1}. Best is trial 21 with value: 0.8095238095238095.
[32m[I 2023-04-26 02:16:11,916][39m Trial 155 finished with value: 0.761904761904762 and parameters: {'criterion': 'entropy', 'n_estimators': 177, 'max_features': 0.9561771749352713, 'max_depth': 25, 'min_samples_split': 8, 'min_samples_leaf': 3}. Best is trial 21 with value: 0.8095238095238095.
[32m[I 2023-04-26 02:16:12,058][39m Trial 156 finished with value: 0.7901234567901235 and parameters: {'criterion': 'entropy', 'n_estimators': 167, 'max_features': 0.9276178442769704, 'max_depth': 72, 'min_samples_split': 8, 'min_samples_leaf': 3}. Best is trial 21 with value: 0.8095238095238095.
[32m[I 2023-04-26 02:16:12,202][39m Trial 157 finished with value: 0.761904761904762 and parameters: {'criterion': 'entropy', 'n_estimators': 167, 'max_features': 0.921867349022076, 'max_depth': 77, 'min_samples_split': 7, 'min_samples_leaf': 4}. Best is trial 21 with value: 0.8095238095238095.
[32m[I 2023-04-26 02:16:12,339][39m Trial 158 finished with value: 0.7764705882352942 and parameters: {'criterion': 'entropy', 'n_estimators': 160, 'max_features': 0.9259956649009948, 'max_depth': 72, 'min_samples_split': 8, 'min_samples_leaf': 4}. Best is trial 21 with value: 0.8095238095238095.
[32m[I 2023-04-26 02:16:12,490][39m Trial 159 finished with value: 0.7804878048780488 and parameters: {'criterion': 'entropy', 'n_estimators': 173, 'max_features': 0.9462940828386674, 'max_depth': 37, 'min_samples_split': 8, 'min_samples_leaf': 3}. Best is trial 21 with value: 0.8095238095238095.
[32m[I 2023-04-26 02:16:12,638][39m Trial 160 finished with value: 0.7901234567901235 and parameters: {'criterion': 'entropy', 'n_estimators': 172, 'max_features': 0.9390475864686781, 'max_depth': 67, 'min_samples_split': 8, 'min_samples_leaf': 3}. Best is trial 21 with value: 0.8095238095238095.
[32m[I 2023-04-26 02:16:12,786][39m Trial 161 finished with value: 0.7804878048780488 and parameters: {'criterion': 'entropy', 'n_estimators': 173, 'max_features': 0.9451152721361157, 'max_depth': 68, 'min_samples_split': 8, 'min_samples_leaf': 3}. Best is trial 21 with value: 0.8095238095238095.
[32m[I 2023-04-26 02:16:12,928][39m Trial 162 finished with value: 0.746987951807229 and parameters: {'criterion': 'entropy', 'n_estimators': 164, 'max_features': 0.9363455098400593, 'max_depth': 67, 'min_samples_split': 8, 'min_samples_leaf': 3}. Best is trial 21 with value: 0.8095238095238095.
[32m[I 2023-04-26 02:16:13,067][39m Trial 163 finished with value: 0.7901234567901235 and parameters: {'criterion': 'entropy', 'n_estimators': 170, 'max_features': 0.9662293150902719, 'max_depth': 71, 'min_samples_split': 8, 'min_samples_leaf': 3}. Best is trial 21 with value: 0.8095238095238095.
[32m[I 2023-04-26 02:16:13,220][39m Trial 164 finished with value: 0.7901234567901235 and parameters: {'criterion': 'entropy', 'n_estimators': 167, 'max_features': 0.9677751457083409, 'max_depth': 69, 'min_samples_split': 8, 'min_samples_leaf': 3}. Best is trial 21 with value: 0.8095238095238095.
[32m[I 2023-04-26 02:16:13,361][39m Trial 165 finished with value: 0.7407407407407408 and parameters: {'criterion': 'entropy', 'n_estimators': 169, 'max_features': 0.9983846312785617, 'max_depth': 74, 'min_samples_split': 8, 'min_samples_leaf': 3}. Best is trial 21 with value: 0.8095238095238095.
[32m[I 2023-04-26 02:16:13,500][39m Trial 166 finished with value: 0.7804878048780488 and parameters: {'criterion': 'entropy', 'n_estimators': 162, 'max_features': 0.9693876340396245, 'max_depth': 65, 'min_samples_split': 8, 'min_samples_leaf': 3}. Best is trial 21 with value: 0.8095238095238095.
[32m[I 2023-04-26 02:16:13,648][39m Trial 167 finished with value: 0.7407407407407408 and parameters: {'criterion': 'entropy', 'n_estimators': 169, 'max_features': 0.9999978601675554, 'max_depth': 75, 'min_samples_split': 8, 'min_samples_leaf': 3}. Best is trial 21 with value: 0.8095238095238095.
[32m[I 2023-04-26 02:16:13,779][39m Trial 168 finished with value: 0.761904761904762 and parameters: {'criterion': 'entropy', 'n_estimators': 158, 'max_features': 0.969528965706739, 'max_depth': 70, 'min_samples_split': 7, 'min_samples_leaf': 4}. Best is trial 21 with value: 0.8095238095238095.
[32m[I 2023-04-26 02:16:13,929][39m Trial 169 finished with value: 0.746987951807229 and parameters: {'criterion': 'entropy', 'n_estimators': 178, 'max_features': 0.8941262476445574, 'max_depth': 72, 'min_samples_split': 8, 'min_samples_leaf': 2}. Best is trial 21 with value: 0.8095238095238095.
[32m[I 2023-04-26 02:16:14,080][39m Trial 170 finished with value: 0.7901234567901235 and parameters: {'criterion': 'entropy', 'n_estimators': 166, 'max_features': 0.9222347781398652, 'max_depth': 76, 'min_samples_split': 7, 'min_samples_leaf': 3}. Best is trial 21 with value: 0.8095238095238095.
[32m[I 2023-04-26 02:16:14,240][39m Trial 171 finished with value: 0.7710843373493976 and parameters: {'criterion': 'entropy', 'n_estimators': 167, 'max_features': 0.9122791262279271, 'max_depth': 75, 'min_samples_split': 7, 'min_samples_leaf': 3}. Best is trial 21 with value: 0.8095238095238095.
[32m[I 2023-04-26 02:16:14,398][39m Trial 172 finished with value: 0.7407407407407408 and parameters: {'criterion': 'entropy', 'n_estimators': 181, 'max_features': 0.9620068304224502, 'max_depth': 79, 'min_samples_split': 7, 'min_samples_leaf': 3}. Best is trial 21 with value: 0.8095238095238095.
[32m[I 2023-04-26 02:16:14,526][39m Trial 173 finished with value: 0.7906976744186047 and parameters: {'criterion': 'entropy', 'n_estimators': 155, 'max_features': 0.9243996343412363, 'max_depth': 69, 'min_samples_split': 8, 'min_samples_leaf': 3}. Best is trial 21 with value: 0.8095238095238095.
[32m[I 2023-04-26 02:16:14,637][39m Trial 174 finished with value: 0.7294117647058823 and parameters: {'criterion': 'entropy', 'n_estimators': 155, 'max_features': 0.13488566451830564, 'max_depth': 68, 'min_samples_split': 8, 'min_samples_leaf': 3}. Best is trial 21 with value: 0.8095238095238095.
[32m[I 2023-04-26 02:16:14,760][39m Trial 175 finished with value: 0.761904761904762 and parameters: {'criterion': 'entropy', 'n_estimators': 145, 'max_features': 0.8796359336071788, 'max_depth': 65, 'min_samples_split': 8, 'min_samples_leaf': 3}. Best is trial 21 with value: 0.8095238095238095.
[32m[I 2023-04-26 02:16:14,903][39m Trial 176 finished with value: 0.7749999999999999 and parameters: {'criterion': 'entropy', 'n_estimators': 166, 'max_features': 0.9286958449648591, 'max_depth': 70, 'min_samples_split': 7, 'min_samples_leaf': 3}. Best is trial 21 with value: 0.8095238095238095.
[32m[I 2023-04-26 02:16:15,044][39m Trial 177 finished with value: 0.7317073170731707 and parameters: {'criterion': 'entropy', 'n_estimators': 160, 'max_features': 0.9035148136700022, 'max_depth': 72, 'min_samples_split': 8, 'min_samples_leaf': 2}. Best is trial 21 with value: 0.8095238095238095.
[32m[I 2023-04-26 02:16:15,207][39m Trial 178 finished with value: 0.7560975609756099 and parameters: {'criterion': 'entropy', 'n_estimators': 175, 'max_features': 0.9439847990574115, 'max_depth': 62, 'min_samples_split': 8, 'min_samples_leaf': 3}. Best is trial 21 with value: 0.8095238095238095.
[32m[I 2023-04-26 02:16:15,387][39m Trial 179 finished with value: 0.7749999999999999 and parameters: {'criterion': 'entropy', 'n_estimators': 189, 'max_features': 0.9241776836171564, 'max_depth': 77, 'min_samples_split': 7, 'min_samples_leaf': 3}. Best is trial 21 with value: 0.8095238095238095.
[32m[I 2023-04-26 02:16:15,523][39m Trial 180 finished with value: 0.7710843373493976 and parameters: {'criterion': 'gini', 'n_estimators': 148, 'max_features': 0.889055205839333, 'max_depth': 73, 'min_samples_split': 8, 'min_samples_leaf': 3}. Best is trial 21 with value: 0.8095238095238095.
[32m[I 2023-04-26 02:16:15,686][39m Trial 181 finished with value: 0.7586206896551724 and parameters: {'criterion': 'entropy', 'n_estimators': 171, 'max_features': 0.9675179424907914, 'max_depth': 69, 'min_samples_split': 8, 'min_samples_leaf': 4}. Best is trial 21 with value: 0.8095238095238095.
[32m[I 2023-04-26 02:16:15,822][39m Trial 182 finished with value: 0.7529411764705882 and parameters: {'criterion': 'entropy', 'n_estimators': 141, 'max_features': 0.9772537126989985, 'max_depth': 82, 'min_samples_split': 8, 'min_samples_leaf': 4}. Best is trial 21 with value: 0.8095238095238095.
[32m[I 2023-04-26 02:16:15,996][39m Trial 183 finished with value: 0.7710843373493976 and parameters: {'criterion': 'entropy', 'n_estimators': 185, 'max_features': 0.9565915047087353, 'max_depth': 76, 'min_samples_split': 7, 'min_samples_leaf': 4}. Best is trial 21 with value: 0.8095238095238095.
[32m[I 2023-04-26 02:16:16,165][39m Trial 184 finished with value: 0.7749999999999999 and parameters: {'criterion': 'entropy', 'n_estimators': 179, 'max_features': 0.9363682878871888, 'max_depth': 79, 'min_samples_split': 8, 'min_samples_leaf': 3}. Best is trial 21 with value: 0.8095238095238095.
[32m[I 2023-04-26 02:16:16,321][39m Trial 185 finished with value: 0.7674418604651163 and parameters: {'criterion': 'entropy', 'n_estimators': 163, 'max_features': 0.9856348355038547, 'max_depth': 71, 'min_samples_split': 8, 'min_samples_leaf': 4}. Best is trial 21 with value: 0.8095238095238095.
[32m[I 2023-04-26 02:16:16,496][39m Trial 186 finished with value: 0.7654320987654322 and parameters: {'criterion': 'entropy', 'n_estimators': 184, 'max_features': 0.9173317142850484, 'max_depth': 64, 'min_samples_split': 8, 'min_samples_leaf': 3}. Best is trial 21 with value: 0.8095238095238095.
[32m[I 2023-04-26 02:16:16,665][39m Trial 187 finished with value: 0.7560975609756099 and parameters: {'criterion': 'entropy', 'n_estimators': 174, 'max_features': 0.9485106530514337, 'max_depth': 19, 'min_samples_split': 7, 'min_samples_leaf': 2}. Best is trial 21 with value: 0.8095238095238095.
[32m[I 2023-04-26 02:16:16,794][39m Trial 188 finished with value: 0.761904761904762 and parameters: {'criterion': 'entropy', 'n_estimators': 136, 'max_features': 0.8611351832497752, 'max_depth': 16, 'min_samples_split': 8, 'min_samples_leaf': 4}. Best is trial 21 with value: 0.8095238095238095.
[32m[I 2023-04-26 02:16:16,954][39m Trial 189 finished with value: 0.7951807228915663 and parameters: {'criterion': 'entropy', 'n_estimators': 168, 'max_features': 0.9808372201683638, 'max_depth': 74, 'min_samples_split': 8, 'min_samples_leaf': 3}. Best is trial 21 with value: 0.8095238095238095.
[32m[I 2023-04-26 02:16:17,110][39m Trial 190 finished with value: 0.7804878048780488 and parameters: {'criterion': 'entropy', 'n_estimators': 168, 'max_features': 0.9914433009991442, 'max_depth': 73, 'min_samples_split': 8, 'min_samples_leaf': 3}. Best is trial 21 with value: 0.8095238095238095.
[32m[I 2023-04-26 02:16:17,278][39m Trial 191 finished with value: 0.7804878048780488 and parameters: {'criterion': 'entropy', 'n_estimators': 171, 'max_features': 0.9709990777122484, 'max_depth': 75, 'min_samples_split': 8, 'min_samples_leaf': 3}. Best is trial 21 with value: 0.8095238095238095.
[32m[I 2023-04-26 02:16:17,432][39m Trial 192 finished with value: 0.746987951807229 and parameters: {'criterion': 'entropy', 'n_estimators': 164, 'max_features': 0.959001998741926, 'max_depth': 80, 'min_samples_split': 8, 'min_samples_leaf': 3}. Best is trial 21 with value: 0.8095238095238095.
[32m[I 2023-04-26 02:16:17,602][39m Trial 193 finished with value: 0.746987951807229 and parameters: {'criterion': 'entropy', 'n_estimators': 176, 'max_features': 0.9354286607780383, 'max_depth': 57, 'min_samples_split': 8, 'min_samples_leaf': 3}. Best is trial 21 with value: 0.8095238095238095.
[32m[I 2023-04-26 02:16:17,762][39m Trial 194 finished with value: 0.7586206896551724 and parameters: {'criterion': 'entropy', 'n_estimators': 171, 'max_features': 0.9987112167889904, 'max_depth': 70, 'min_samples_split': 8, 'min_samples_leaf': 4}. Best is trial 21 with value: 0.8095238095238095.
[32m[I 2023-04-26 02:16:17,919][39m Trial 195 finished with value: 0.7764705882352942 and parameters: {'criterion': 'entropy', 'n_estimators': 166, 'max_features': 0.9073311359038919, 'max_depth': 67, 'min_samples_split': 9, 'min_samples_leaf': 3}. Best is trial 21 with value: 0.8095238095238095.
[32m[I 2023-04-26 02:16:18,097][39m Trial 196 finished with value: 0.7441860465116279 and parameters: {'criterion': 'entropy', 'n_estimators': 192, 'max_features': 0.9776336332245136, 'max_depth': 74, 'min_samples_split': 7, 'min_samples_leaf': 4}. Best is trial 21 with value: 0.8095238095238095.
[32m[I 2023-04-26 02:16:18,270][39m Trial 197 finished with value: 0.7764705882352942 and parameters: {'criterion': 'entropy', 'n_estimators': 187, 'max_features': 0.9456676852762326, 'max_depth': 77, 'min_samples_split': 8, 'min_samples_leaf': 4}. Best is trial 21 with value: 0.8095238095238095.
[32m[I 2023-04-26 02:16:18,451][39m Trial 198 finished with value: 0.7499999999999999 and parameters: {'criterion': 'entropy', 'n_estimators': 182, 'max_features': 0.9199491558737015, 'max_depth': 71, 'min_samples_split': 7, 'min_samples_leaf': 2}. Best is trial 21 with value: 0.8095238095238095.
[32m[I 2023-04-26 02:16:18,621][39m Trial 199 finished with value: 0.7560975609756099 and parameters: {'criterion': 'entropy', 'n_estimators': 179, 'max_features': 0.9555461646582186, 'max_depth': 68, 'min_samples_split': 8, 'min_samples_leaf': 3}. Best is trial 21 with value: 0.8095238095238095.
[32m[I 2023-04-26 02:16:18,788][39m Trial 200 finished with value: 0.7749999999999999 and parameters: {'criterion': 'entropy', 'n_estimators': 175, 'max_features': 0.8923517594409738, 'max_depth': 60, 'min_samples_split': 8, 'min_samples_leaf': 3}. Best is trial 21 with value: 0.8095238095238095.
[32m[I 2023-04-26 02:16:18,944][39m Trial 201 finished with value: 0.7560975609756099 and parameters: {'criterion': 'entropy', 'n_estimators': 161, 'max_features': 0.9739979883913543, 'max_depth': 64, 'min_samples_split': 8, 'min_samples_leaf': 3}. Best is trial 21 with value: 0.8095238095238095.
[32m[I 2023-04-26 02:16:19,106][39m Trial 202 finished with value: 0.7710843373493976 and parameters: {'criterion': 'entropy', 'n_estimators': 170, 'max_features': 0.9893326931343979, 'max_depth': 75, 'min_samples_split': 8, 'min_samples_leaf': 3}. Best is trial 21 with value: 0.8095238095238095.
[32m[I 2023-04-26 02:16:19,266][39m Trial 203 finished with value: 0.7654320987654322 and parameters: {'criterion': 'entropy', 'n_estimators': 163, 'max_features': 0.9570275003880359, 'max_depth': 47, 'min_samples_split': 8, 'min_samples_leaf': 3}. Best is trial 21 with value: 0.8095238095238095.
[32m[I 2023-04-26 02:16:19,409][39m Trial 204 finished with value: 0.7529411764705882 and parameters: {'criterion': 'entropy', 'n_estimators': 155, 'max_features': 0.9753012362021758, 'max_depth': 65, 'min_samples_split': 8, 'min_samples_leaf': 4}. Best is trial 21 with value: 0.8095238095238095.
[32m[I 2023-04-26 02:16:19,569][39m Trial 205 finished with value: 0.761904761904762 and parameters: {'criterion': 'entropy', 'n_estimators': 161, 'max_features': 0.9313822384635828, 'max_depth': 66, 'min_samples_split': 9, 'min_samples_leaf': 3}. Best is trial 21 with value: 0.8095238095238095.
[32m[I 2023-04-26 02:16:19,739][39m Trial 206 finished with value: 0.7407407407407408 and parameters: {'criterion': 'entropy', 'n_estimators': 173, 'max_features': 0.9394155530972556, 'max_depth': 38, 'min_samples_split': 8, 'min_samples_leaf': 3}. Best is trial 21 with value: 0.8095238095238095.
[32m[I 2023-04-26 02:16:19,899][39m Trial 207 finished with value: 0.7654320987654322 and parameters: {'criterion': 'entropy', 'n_estimators': 166, 'max_features': 0.966296945618901, 'max_depth': 84, 'min_samples_split': 8, 'min_samples_leaf': 3}. Best is trial 21 with value: 0.8095238095238095.
[32m[I 2023-04-26 02:16:20,052][39m Trial 208 finished with value: 0.7529411764705882 and parameters: {'criterion': 'gini', 'n_estimators': 177, 'max_features': 0.905431185357803, 'max_depth': 81, 'min_samples_split': 8, 'min_samples_leaf': 4}. Best is trial 21 with value: 0.8095238095238095.
[32m[I 2023-04-26 02:16:20,219][39m Trial 209 finished with value: 0.7674418604651163 and parameters: {'criterion': 'entropy', 'n_estimators': 185, 'max_features': 0.875844895601139, 'max_depth': 30, 'min_samples_split': 7, 'min_samples_leaf': 4}. Best is trial 21 with value: 0.8095238095238095.
[32m[I 2023-04-26 02:16:20,344][39m Trial 210 finished with value: 0.7710843373493976 and parameters: {'criterion': 'entropy', 'n_estimators': 127, 'max_features': 0.9472772682752859, 'max_depth': 36, 'min_samples_split': 8, 'min_samples_leaf': 3}. Best is trial 21 with value: 0.8095238095238095.
[32m[I 2023-04-26 02:16:20,506][39m Trial 211 finished with value: 0.7951807228915663 and parameters: {'criterion': 'entropy', 'n_estimators': 172, 'max_features': 0.937790682366878, 'max_depth': 69, 'min_samples_split': 8, 'min_samples_leaf': 3}. Best is trial 21 with value: 0.8095238095238095.
[32m[I 2023-04-26 02:16:20,669][39m Trial 212 finished with value: 0.7951807228915663 and parameters: {'criterion': 'entropy', 'n_estimators': 169, 'max_features': 0.9976135291901711, 'max_depth': 73, 'min_samples_split': 8, 'min_samples_leaf': 3}. Best is trial 21 with value: 0.8095238095238095.
[32m[I 2023-04-26 02:16:20,830][39m Trial 213 finished with value: 0.7654320987654322 and parameters: {'criterion': 'entropy', 'n_estimators': 167, 'max_features': 0.9948884672131202, 'max_depth': 72, 'min_samples_split': 8, 'min_samples_leaf': 3}. Best is trial 21 with value: 0.8095238095238095.
[32m[I 2023-04-26 02:16:20,981][39m Trial 214 finished with value: 0.717391304347826 and parameters: {'criterion': 'entropy', 'n_estimators': 170, 'max_features': 0.9231513823036229, 'max_depth': 69, 'min_samples_split': 8, 'min_samples_leaf': 10}. Best is trial 21 with value: 0.8095238095238095.
[32m[I 2023-04-26 02:16:21,154][39m Trial 215 finished with value: 0.7499999999999999 and parameters: {'criterion': 'entropy', 'n_estimators': 182, 'max_features': 0.9807498432377707, 'max_depth': 74, 'min_samples_split': 8, 'min_samples_leaf': 3}. Best is trial 21 with value: 0.8095238095238095.
[32m[I 2023-04-26 02:16:21,316][39m Trial 216 finished with value: 0.7764705882352942 and parameters: {'criterion': 'entropy', 'n_estimators': 172, 'max_features': 0.9580520850070227, 'max_depth': 71, 'min_samples_split': 9, 'min_samples_leaf': 4}. Best is trial 21 with value: 0.8095238095238095.
[32m[I 2023-04-26 02:16:21,487][39m Trial 217 finished with value: 0.7710843373493976 and parameters: {'criterion': 'entropy', 'n_estimators': 178, 'max_features': 0.9193046463195109, 'max_depth': 78, 'min_samples_split': 8, 'min_samples_leaf': 3}. Best is trial 21 with value: 0.8095238095238095.
[32m[I 2023-04-26 02:16:21,552][39m Trial 218 finished with value: 0.7710843373493976 and parameters: {'criterion': 'entropy', 'n_estimators': 57, 'max_features': 0.9403257624390965, 'max_depth': 70, 'min_samples_split': 8, 'min_samples_leaf': 3}. Best is trial 21 with value: 0.8095238095238095.
