[32m[I 2023-04-26 11:29:17,217][39m Trial 132 finished with value: 0.8392857142857144 and parameters: {'objective': 'CrossEntropy', 'colsample_bylevel': 0.08504100460365255, 'depth': 10, 'boosting_type': 'Ordered', 'bootstrap_type': 'Bayesian', 'bagging_temperature': 7.307500144161083}. Best is trial 21 with value: 0.8771929824561403.
[32m[I 2023-04-26 11:29:21,759][39m Trial 133 finished with value: 0.8771929824561403 and parameters: {'objective': 'CrossEntropy', 'colsample_bylevel': 0.062305051048505804, 'depth': 12, 'boosting_type': 'Ordered', 'bootstrap_type': 'Bayesian', 'bagging_temperature': 7.009151787035003}. Best is trial 21 with value: 0.8771929824561403.
[32m[I 2023-04-26 11:29:26,202][39m Trial 134 finished with value: 0.8620689655172413 and parameters: {'objective': 'CrossEntropy', 'colsample_bylevel': 0.053758187874031776, 'depth': 12, 'boosting_type': 'Ordered', 'bootstrap_type': 'Bayesian', 'bagging_temperature': 6.555973538946615}. Best is trial 21 with value: 0.8771929824561403.
[32m[I 2023-04-26 11:29:31,909][39m Trial 135 finished with value: 0.8495575221238938 and parameters: {'objective': 'CrossEntropy', 'colsample_bylevel': 0.06332901402150921, 'depth': 12, 'boosting_type': 'Ordered', 'bootstrap_type': 'Bayesian', 'bagging_temperature': 6.91477414410542}. Best is trial 21 with value: 0.8771929824561403.
[32m[I 2023-04-26 11:29:37,902][39m Trial 136 finished with value: 0.875 and parameters: {'objective': 'CrossEntropy', 'colsample_bylevel': 0.06671823642541384, 'depth': 12, 'boosting_type': 'Ordered', 'bootstrap_type': 'Bayesian', 'bagging_temperature': 8.603750347634726}. Best is trial 21 with value: 0.8771929824561403.
[32m[I 2023-04-26 11:29:43,616][39m Trial 137 finished with value: 0.8596491228070176 and parameters: {'objective': 'CrossEntropy', 'colsample_bylevel': 0.06697558108083279, 'depth': 12, 'boosting_type': 'Ordered', 'bootstrap_type': 'Bayesian', 'bagging_temperature': 8.611221539377715}. Best is trial 21 with value: 0.8771929824561403.
[32m[I 2023-04-26 11:29:48,677][39m Trial 138 finished with value: 0.8596491228070176 and parameters: {'objective': 'CrossEntropy', 'colsample_bylevel': 0.06501388347558817, 'depth': 12, 'boosting_type': 'Ordered', 'bootstrap_type': 'Bayesian', 'bagging_temperature': 9.761932519937897}. Best is trial 21 with value: 0.8771929824561403.
[32m[I 2023-04-26 11:29:58,596][39m Trial 139 finished with value: 0.8771929824561403 and parameters: {'objective': 'CrossEntropy', 'colsample_bylevel': 0.06943887665610717, 'depth': 12, 'boosting_type': 'Ordered', 'bootstrap_type': 'Bayesian', 'bagging_temperature': 7.767877001037709}. Best is trial 21 with value: 0.8771929824561403.
[32m[I 2023-04-26 11:30:11,886][39m Trial 140 finished with value: 0.8571428571428572 and parameters: {'objective': 'CrossEntropy', 'colsample_bylevel': 0.06918161943055375, 'depth': 12, 'boosting_type': 'Ordered', 'bootstrap_type': 'Bayesian', 'bagging_temperature': 7.835338508723492}. Best is trial 21 with value: 0.8771929824561403.
[32m[I 2023-04-26 11:30:30,531][39m Trial 141 finished with value: 0.8495575221238938 and parameters: {'objective': 'CrossEntropy', 'colsample_bylevel': 0.0808836361647565, 'depth': 12, 'boosting_type': 'Ordered', 'bootstrap_type': 'Bayesian', 'bagging_temperature': 8.189138709780083}. Best is trial 21 with value: 0.8771929824561403.
[32m[I 2023-04-26 11:30:42,452][39m Trial 142 finished with value: 0.8695652173913043 and parameters: {'objective': 'CrossEntropy', 'colsample_bylevel': 0.06722925205805, 'depth': 12, 'boosting_type': 'Ordered', 'bootstrap_type': 'Bayesian', 'bagging_temperature': 7.099986193197228}. Best is trial 21 with value: 0.8771929824561403.
[32m[I 2023-04-26 11:30:55,409][39m Trial 143 finished with value: 0.8571428571428572 and parameters: {'objective': 'CrossEntropy', 'colsample_bylevel': 0.07169462712816717, 'depth': 11, 'boosting_type': 'Ordered', 'bootstrap_type': 'Bayesian', 'bagging_temperature': 8.85660875074586}. Best is trial 21 with value: 0.8771929824561403.
[32m[I 2023-04-26 11:31:09,925][39m Trial 144 finished with value: 0.8468468468468469 and parameters: {'objective': 'CrossEntropy', 'colsample_bylevel': 0.07372793577315309, 'depth': 11, 'boosting_type': 'Ordered', 'bootstrap_type': 'Bayesian', 'bagging_temperature': 7.495403498260222}. Best is trial 21 with value: 0.8771929824561403.
[32m[I 2023-04-26 11:31:21,032][39m Trial 145 finished with value: 0.8620689655172413 and parameters: {'objective': 'CrossEntropy', 'colsample_bylevel': 0.06172049598832842, 'depth': 12, 'boosting_type': 'Ordered', 'bootstrap_type': 'Bayesian', 'bagging_temperature': 7.22897364746792}. Best is trial 21 with value: 0.8771929824561403.
[32m[I 2023-04-26 11:31:33,068][39m Trial 146 finished with value: 0.8771929824561403 and parameters: {'objective': 'CrossEntropy', 'colsample_bylevel': 0.06990262926231294, 'depth': 12, 'boosting_type': 'Ordered', 'bootstrap_type': 'Bayesian', 'bagging_temperature': 7.731113774634383}. Best is trial 21 with value: 0.8771929824561403.
[32m[I 2023-04-26 11:31:46,622][39m Trial 147 finished with value: 0.8571428571428572 and parameters: {'objective': 'CrossEntropy', 'colsample_bylevel': 0.07016775610886726, 'depth': 12, 'boosting_type': 'Ordered', 'bootstrap_type': 'Bayesian', 'bagging_temperature': 7.755691355155386}. Best is trial 21 with value: 0.8771929824561403.
[32m[I 2023-04-26 11:31:56,554][39m Trial 148 finished with value: 0.8596491228070176 and parameters: {'objective': 'CrossEntropy', 'colsample_bylevel': 0.05999243004840031, 'depth': 12, 'boosting_type': 'Ordered', 'bootstrap_type': 'Bayesian', 'bagging_temperature': 9.426002840190709}. Best is trial 21 with value: 0.8771929824561403.
[32m[I 2023-04-26 11:32:02,720][39m Trial 149 finished with value: 0.8392857142857144 and parameters: {'objective': 'CrossEntropy', 'colsample_bylevel': 0.07652896237542824, 'depth': 12, 'boosting_type': 'Plain', 'bootstrap_type': 'Bayesian', 'bagging_temperature': 8.336617881385168}. Best is trial 21 with value: 0.8771929824561403.
[32m[I 2023-04-26 11:32:08,836][39m Trial 150 finished with value: 0.8448275862068967 and parameters: {'objective': 'CrossEntropy', 'colsample_bylevel': 0.031113420129880488, 'depth': 12, 'boosting_type': 'Ordered', 'bootstrap_type': 'Bayesian', 'bagging_temperature': 7.629494209643506}. Best is trial 21 with value: 0.8771929824561403.
[32m[I 2023-04-26 11:32:21,887][39m Trial 151 finished with value: 0.8620689655172413 and parameters: {'objective': 'CrossEntropy', 'colsample_bylevel': 0.068107847662141, 'depth': 12, 'boosting_type': 'Ordered', 'bootstrap_type': 'Bayesian', 'bagging_temperature': 7.999756674670088}. Best is trial 21 with value: 0.8771929824561403.
[32m[I 2023-04-26 11:32:27,411][39m Trial 152 finished with value: 0.8205128205128206 and parameters: {'objective': 'CrossEntropy', 'colsample_bylevel': 0.021933450449604965, 'depth': 11, 'boosting_type': 'Ordered', 'bootstrap_type': 'Bayesian', 'bagging_temperature': 7.972095036494711}. Best is trial 21 with value: 0.8771929824561403.
[32m[I 2023-04-26 11:32:38,142][39m Trial 153 finished with value: 0.8521739130434783 and parameters: {'objective': 'CrossEntropy', 'colsample_bylevel': 0.06419807289247154, 'depth': 11, 'boosting_type': 'Ordered', 'bootstrap_type': 'Bayesian', 'bagging_temperature': 4.3377068336655356}. Best is trial 21 with value: 0.8771929824561403.
[32m[I 2023-04-26 11:32:49,484][39m Trial 154 finished with value: 0.8421052631578947 and parameters: {'objective': 'CrossEntropy', 'colsample_bylevel': 0.06536951223041812, 'depth': 12, 'boosting_type': 'Ordered', 'bootstrap_type': 'Bayesian', 'bagging_temperature': 7.490066072982477}. Best is trial 21 with value: 0.8771929824561403.
[32m[I 2023-04-26 11:33:02,260][39m Trial 155 finished with value: 0.875 and parameters: {'objective': 'CrossEntropy', 'colsample_bylevel': 0.07203221370448622, 'depth': 11, 'boosting_type': 'Ordered', 'bootstrap_type': 'Bayesian', 'bagging_temperature': 6.995153604009715}. Best is trial 21 with value: 0.8771929824561403.
[32m[I 2023-04-26 11:33:08,533][39m Trial 156 finished with value: 0.8305084745762712 and parameters: {'objective': 'CrossEntropy', 'colsample_bylevel': 0.07236485371013399, 'depth': 1, 'boosting_type': 'Ordered', 'bootstrap_type': 'Bayesian', 'bagging_temperature': 6.895526637009118}. Best is trial 21 with value: 0.8771929824561403.
[32m[I 2023-04-26 11:33:18,147][39m Trial 157 finished with value: 0.831858407079646 and parameters: {'objective': 'Logloss', 'colsample_bylevel': 0.07002863509456869, 'depth': 11, 'boosting_type': 'Ordered', 'bootstrap_type': 'Bernoulli', 'subsample': 0.8070977461507258}. Best is trial 21 with value: 0.8771929824561403.
[32m[I 2023-04-26 11:33:33,712][39m Trial 158 finished with value: 0.8571428571428572 and parameters: {'objective': 'CrossEntropy', 'colsample_bylevel': 0.0748972183739526, 'depth': 12, 'boosting_type': 'Ordered', 'bootstrap_type': 'Bayesian', 'bagging_temperature': 9.837996383932133}. Best is trial 21 with value: 0.8771929824561403.
[32m[I 2023-04-26 11:33:51,039][39m Trial 159 finished with value: 0.8672566371681416 and parameters: {'objective': 'CrossEntropy', 'colsample_bylevel': 0.09370517615674386, 'depth': 12, 'boosting_type': 'Ordered', 'bootstrap_type': 'Bayesian', 'bagging_temperature': 7.094948588241503}. Best is trial 21 with value: 0.8771929824561403.
[32m[I 2023-04-26 11:33:56,565][39m Trial 160 finished with value: 0.8521739130434783 and parameters: {'objective': 'CrossEntropy', 'colsample_bylevel': 0.05827275956749531, 'depth': 4, 'boosting_type': 'Ordered', 'bootstrap_type': 'MVS'}. Best is trial 21 with value: 0.8771929824561403.
[32m[I 2023-04-26 11:34:08,599][39m Trial 161 finished with value: 0.8695652173913043 and parameters: {'objective': 'CrossEntropy', 'colsample_bylevel': 0.06734950137207515, 'depth': 11, 'boosting_type': 'Ordered', 'bootstrap_type': 'Bayesian', 'bagging_temperature': 6.688848870698436}. Best is trial 21 with value: 0.8771929824561403.
[32m[I 2023-04-26 11:34:19,485][39m Trial 162 finished with value: 0.8521739130434783 and parameters: {'objective': 'CrossEntropy', 'colsample_bylevel': 0.06691702625545361, 'depth': 11, 'boosting_type': 'Ordered', 'bootstrap_type': 'Bayesian', 'bagging_temperature': 6.449812011296894}. Best is trial 21 with value: 0.8771929824561403.
[32m[I 2023-04-26 11:34:32,372][39m Trial 163 finished with value: 0.8468468468468469 and parameters: {'objective': 'CrossEntropy', 'colsample_bylevel': 0.07314564958847329, 'depth': 10, 'boosting_type': 'Ordered', 'bootstrap_type': 'Bayesian', 'bagging_temperature': 8.432130209637348}. Best is trial 21 with value: 0.8771929824561403.
[32m[I 2023-04-26 11:34:44,684][39m Trial 164 finished with value: 0.8648648648648648 and parameters: {'objective': 'CrossEntropy', 'colsample_bylevel': 0.0698623795032893, 'depth': 11, 'boosting_type': 'Ordered', 'bootstrap_type': 'Bayesian', 'bagging_temperature': 5.961522810570747}. Best is trial 21 with value: 0.8771929824561403.
[32m[I 2023-04-26 11:34:58,905][39m Trial 165 finished with value: 0.8495575221238938 and parameters: {'objective': 'CrossEntropy', 'colsample_bylevel': 0.07932280300741854, 'depth': 10, 'boosting_type': 'Ordered', 'bootstrap_type': 'Bayesian', 'bagging_temperature': 9.094354998561023}. Best is trial 21 with value: 0.8771929824561403.
[32m[I 2023-04-26 11:35:10,513][39m Trial 166 finished with value: 0.8495575221238938 and parameters: {'objective': 'CrossEntropy', 'colsample_bylevel': 0.07145200203578025, 'depth': 10, 'boosting_type': 'Ordered', 'bootstrap_type': 'Bayesian', 'bagging_temperature': 7.2735967656893115}. Best is trial 21 with value: 0.8771929824561403.
[32m[I 2023-04-26 11:35:22,561][39m Trial 167 finished with value: 0.8695652173913043 and parameters: {'objective': 'CrossEntropy', 'colsample_bylevel': 0.06853387013854804, 'depth': 10, 'boosting_type': 'Ordered', 'bootstrap_type': 'Bayesian', 'bagging_temperature': 7.787768393405863}. Best is trial 21 with value: 0.8771929824561403.
[32m[I 2023-04-26 11:35:37,617][39m Trial 168 finished with value: 0.8596491228070176 and parameters: {'objective': 'CrossEntropy', 'colsample_bylevel': 0.07488407709315334, 'depth': 12, 'boosting_type': 'Ordered', 'bootstrap_type': 'Bayesian', 'bagging_temperature': 6.991162567671885}. Best is trial 21 with value: 0.8771929824561403.
[32m[I 2023-04-26 11:35:55,705][39m Trial 169 finished with value: 0.8571428571428572 and parameters: {'objective': 'CrossEntropy', 'colsample_bylevel': 0.08347647549410424, 'depth': 12, 'boosting_type': 'Ordered', 'bootstrap_type': 'Bayesian', 'bagging_temperature': 7.758876497786371}. Best is trial 21 with value: 0.8771929824561403.
[32m[I 2023-04-26 11:36:05,763][39m Trial 170 finished with value: 0.8521739130434783 and parameters: {'objective': 'CrossEntropy', 'colsample_bylevel': 0.062208887283007025, 'depth': 12, 'boosting_type': 'Ordered', 'bootstrap_type': 'Bayesian', 'bagging_temperature': 7.08114197233323}. Best is trial 21 with value: 0.8771929824561403.
[32m[I 2023-04-26 11:36:16,794][39m Trial 171 finished with value: 0.8771929824561403 and parameters: {'objective': 'CrossEntropy', 'colsample_bylevel': 0.06635448802927957, 'depth': 11, 'boosting_type': 'Ordered', 'bootstrap_type': 'Bayesian', 'bagging_temperature': 7.422175419787017}. Best is trial 21 with value: 0.8771929824561403.
[32m[I 2023-04-26 11:36:28,528][39m Trial 172 finished with value: 0.8596491228070176 and parameters: {'objective': 'CrossEntropy', 'colsample_bylevel': 0.06724497753939875, 'depth': 11, 'boosting_type': 'Ordered', 'bootstrap_type': 'Bayesian', 'bagging_temperature': 6.743084262995081}. Best is trial 21 with value: 0.8771929824561403.
[32m[I 2023-04-26 11:36:44,318][39m Trial 173 finished with value: 0.8648648648648648 and parameters: {'objective': 'CrossEntropy', 'colsample_bylevel': 0.09120241479151768, 'depth': 8, 'boosting_type': 'Ordered', 'bootstrap_type': 'Bayesian', 'bagging_temperature': 4.900722995014403}. Best is trial 21 with value: 0.8771929824561403.
[32m[I 2023-04-26 11:36:55,241][39m Trial 174 finished with value: 0.8392857142857144 and parameters: {'objective': 'CrossEntropy', 'colsample_bylevel': 0.06570926336214467, 'depth': 12, 'boosting_type': 'Ordered', 'bootstrap_type': 'Bayesian', 'bagging_temperature': 7.423111427105787}. Best is trial 21 with value: 0.8771929824561403.
[32m[I 2023-04-26 11:37:22,356][39m Trial 175 finished with value: 0.8571428571428572 and parameters: {'objective': 'CrossEntropy', 'colsample_bylevel': 0.09729312261702182, 'depth': 12, 'boosting_type': 'Ordered', 'bootstrap_type': 'Bayesian', 'bagging_temperature': 8.251017262234368}. Best is trial 21 with value: 0.8771929824561403.
[32m[I 2023-04-26 11:37:35,818][39m Trial 176 finished with value: 0.8596491228070176 and parameters: {'objective': 'CrossEntropy', 'colsample_bylevel': 0.0719087392856796, 'depth': 12, 'boosting_type': 'Ordered', 'bootstrap_type': 'Bayesian', 'bagging_temperature': 8.084492960970053}. Best is trial 21 with value: 0.8771929824561403.
[32m[I 2023-04-26 11:37:41,695][39m Trial 177 finished with value: 0.8468468468468469 and parameters: {'objective': 'CrossEntropy', 'colsample_bylevel': 0.0949184442830399, 'depth': 11, 'boosting_type': 'Plain', 'bootstrap_type': 'Bayesian', 'bagging_temperature': 8.652250538700818}. Best is trial 21 with value: 0.8771929824561403.
[32m[I 2023-04-26 11:37:53,226][39m Trial 178 finished with value: 0.8495575221238938 and parameters: {'objective': 'CrossEntropy', 'colsample_bylevel': 0.06786214632263168, 'depth': 11, 'boosting_type': 'Ordered', 'bootstrap_type': 'Bayesian', 'bagging_temperature': 6.64003270411995}. Best is trial 21 with value: 0.8771929824561403.
[32m[I 2023-04-26 11:38:13,395][39m Trial 179 finished with value: 0.8672566371681416 and parameters: {'objective': 'CrossEntropy', 'colsample_bylevel': 0.08819194405268863, 'depth': 11, 'boosting_type': 'Ordered', 'bootstrap_type': 'Bayesian', 'bagging_temperature': 9.476791934475262}. Best is trial 21 with value: 0.8771929824561403.
[32m[I 2023-04-26 11:38:27,233][39m Trial 180 finished with value: 0.8596491228070176 and parameters: {'objective': 'CrossEntropy', 'colsample_bylevel': 0.07680839311286045, 'depth': 10, 'boosting_type': 'Ordered', 'bootstrap_type': 'Bayesian', 'bagging_temperature': 7.319054595776526}. Best is trial 21 with value: 0.8771929824561403.
[32m[I 2023-04-26 11:38:38,004][39m Trial 181 finished with value: 0.8596491228070176 and parameters: {'objective': 'CrossEntropy', 'colsample_bylevel': 0.0641230777325378, 'depth': 11, 'boosting_type': 'Ordered', 'bootstrap_type': 'Bayesian', 'bagging_temperature': 6.81995929785449}. Best is trial 21 with value: 0.8771929824561403.
[32m[I 2023-04-26 11:38:50,382][39m Trial 182 finished with value: 0.8571428571428572 and parameters: {'objective': 'CrossEntropy', 'colsample_bylevel': 0.07111039205394784, 'depth': 12, 'boosting_type': 'Ordered', 'bootstrap_type': 'Bayesian', 'bagging_temperature': 7.53034883190823}. Best is trial 21 with value: 0.8771929824561403.
[32m[I 2023-04-26 11:39:00,817][39m Trial 183 finished with value: 0.8620689655172413 and parameters: {'objective': 'CrossEntropy', 'colsample_bylevel': 0.06035407516361986, 'depth': 11, 'boosting_type': 'Ordered', 'bootstrap_type': 'Bayesian', 'bagging_temperature': 5.154880444652903}. Best is trial 21 with value: 0.8771929824561403.
[32m[I 2023-04-26 11:39:12,109][39m Trial 184 finished with value: 0.8771929824561403 and parameters: {'objective': 'CrossEntropy', 'colsample_bylevel': 0.06867196116002837, 'depth': 10, 'boosting_type': 'Ordered', 'bootstrap_type': 'Bayesian', 'bagging_temperature': 7.669294693423611}. Best is trial 21 with value: 0.8771929824561403.
[32m[I 2023-04-26 11:39:19,403][39m Trial 185 finished with value: 0.8596491228070176 and parameters: {'objective': 'CrossEntropy', 'colsample_bylevel': 0.06629117586123943, 'depth': 12, 'boosting_type': 'Ordered', 'bootstrap_type': 'Bayesian', 'bagging_temperature': 7.679633439659958}. Best is trial 21 with value: 0.8771929824561403.
[32m[I 2023-04-26 11:39:24,337][39m Trial 186 finished with value: 0.8571428571428572 and parameters: {'objective': 'Logloss', 'colsample_bylevel': 0.06910271006947323, 'depth': 10, 'boosting_type': 'Ordered', 'bootstrap_type': 'Bayesian', 'bagging_temperature': 7.9175856896401315}. Best is trial 21 with value: 0.8771929824561403.
[32m[I 2023-04-26 11:39:28,898][39m Trial 187 finished with value: 0.8672566371681416 and parameters: {'objective': 'CrossEntropy', 'colsample_bylevel': 0.06316657885734726, 'depth': 10, 'boosting_type': 'Ordered', 'bootstrap_type': 'Bayesian', 'bagging_temperature': 7.309802935353237}. Best is trial 21 with value: 0.8771929824561403.
[32m[I 2023-04-26 11:39:31,651][39m Trial 188 finished with value: 0.831858407079646 and parameters: {'objective': 'CrossEntropy', 'colsample_bylevel': 0.06468710775657889, 'depth': 9, 'boosting_type': 'Ordered', 'bootstrap_type': 'Bernoulli', 'subsample': 0.974230255283735}. Best is trial 21 with value: 0.8771929824561403.
[32m[I 2023-04-26 11:39:37,368][39m Trial 189 finished with value: 0.8672566371681416 and parameters: {'objective': 'CrossEntropy', 'colsample_bylevel': 0.06906585495229468, 'depth': 12, 'boosting_type': 'Ordered', 'bootstrap_type': 'Bayesian', 'bagging_temperature': 9.982309782078115}. Best is trial 21 with value: 0.8771929824561403.
[32m[I 2023-04-26 11:39:41,570][39m Trial 190 finished with value: 0.8421052631578947 and parameters: {'objective': 'CrossEntropy', 'colsample_bylevel': 0.08293512926287366, 'depth': 11, 'boosting_type': 'Ordered', 'bootstrap_type': 'MVS'}. Best is trial 21 with value: 0.8771929824561403.
[32m[I 2023-04-26 11:39:46,801][39m Trial 191 finished with value: 0.8596491228070176 and parameters: {'objective': 'CrossEntropy', 'colsample_bylevel': 0.06907352213980847, 'depth': 10, 'boosting_type': 'Ordered', 'bootstrap_type': 'Bayesian', 'bagging_temperature': 7.805187292446982}. Best is trial 21 with value: 0.8771929824561403.
[32m[I 2023-04-26 11:39:53,788][39m Trial 192 finished with value: 0.8545454545454546 and parameters: {'objective': 'CrossEntropy', 'colsample_bylevel': 0.08627216194776721, 'depth': 9, 'boosting_type': 'Ordered', 'bootstrap_type': 'Bayesian', 'bagging_temperature': 4.494612562823087}. Best is trial 21 with value: 0.8771929824561403.
[32m[I 2023-04-26 11:39:58,970][39m Trial 193 finished with value: 0.8495575221238938 and parameters: {'objective': 'CrossEntropy', 'colsample_bylevel': 0.06668287760382242, 'depth': 12, 'boosting_type': 'Ordered', 'bootstrap_type': 'Bayesian', 'bagging_temperature': 7.018356671791762}. Best is trial 21 with value: 0.8771929824561403.
[32m[I 2023-04-26 11:40:05,312][39m Trial 194 finished with value: 0.8495575221238938 and parameters: {'objective': 'CrossEntropy', 'colsample_bylevel': 0.07372875461138731, 'depth': 10, 'boosting_type': 'Ordered', 'bootstrap_type': 'Bayesian', 'bagging_temperature': 7.499064723647284}. Best is trial 21 with value: 0.8771929824561403.
[32m[I 2023-04-26 11:40:11,966][39m Trial 195 finished with value: 0.8596491228070176 and parameters: {'objective': 'CrossEntropy', 'colsample_bylevel': 0.0710375290397205, 'depth': 6, 'boosting_type': 'Ordered', 'bootstrap_type': 'Bayesian', 'bagging_temperature': 8.087314037234421}. Best is trial 21 with value: 0.8771929824561403.
[32m[I 2023-04-26 11:40:16,599][39m Trial 196 finished with value: 0.8392857142857144 and parameters: {'objective': 'CrossEntropy', 'colsample_bylevel': 0.06181019286217006, 'depth': 9, 'boosting_type': 'Ordered', 'bootstrap_type': 'Bayesian', 'bagging_temperature': 3.784335002520989}. Best is trial 21 with value: 0.8771929824561403.
