[32m[I 2023-04-26 11:57:34,190][39m Trial 392 finished with value: 0.8547008547008546 and parameters: {'objective': 'CrossEntropy', 'colsample_bylevel': 0.03528755060721489, 'depth': 10, 'boosting_type': 'Ordered', 'bootstrap_type': 'Bayesian', 'bagging_temperature': 9.60316566846122}. Best is trial 21 with value: 0.8771929824561403.
[32m[I 2023-04-26 11:57:38,640][39m Trial 393 finished with value: 0.8620689655172413 and parameters: {'objective': 'CrossEntropy', 'colsample_bylevel': 0.05492966829372786, 'depth': 12, 'boosting_type': 'Ordered', 'bootstrap_type': 'Bayesian', 'bagging_temperature': 7.689038778851968}. Best is trial 21 with value: 0.8771929824561403.
[32m[I 2023-04-26 11:57:41,975][39m Trial 394 finished with value: 0.8347826086956522 and parameters: {'objective': 'CrossEntropy', 'colsample_bylevel': 0.06505129177248276, 'depth': 10, 'boosting_type': 'Ordered', 'bootstrap_type': 'Bernoulli', 'subsample': 0.7622599851100702}. Best is trial 21 with value: 0.8771929824561403.
[32m[I 2023-04-26 11:57:47,159][39m Trial 395 finished with value: 0.875 and parameters: {'objective': 'CrossEntropy', 'colsample_bylevel': 0.06702348291391316, 'depth': 10, 'boosting_type': 'Ordered', 'bootstrap_type': 'Bayesian', 'bagging_temperature': 9.243545010382967}. Best is trial 21 with value: 0.8771929824561403.
[32m[I 2023-04-26 11:57:52,615][39m Trial 396 finished with value: 0.875 and parameters: {'objective': 'CrossEntropy', 'colsample_bylevel': 0.06763432261272265, 'depth': 12, 'boosting_type': 'Ordered', 'bootstrap_type': 'Bayesian', 'bagging_temperature': 9.000704160029038}. Best is trial 21 with value: 0.8771929824561403.
[32m[I 2023-04-26 11:58:01,434][39m Trial 397 finished with value: 0.8545454545454546 and parameters: {'objective': 'CrossEntropy', 'colsample_bylevel': 0.09550904057797864, 'depth': 10, 'boosting_type': 'Ordered', 'bootstrap_type': 'Bayesian', 'bagging_temperature': 9.076769455329343}. Best is trial 21 with value: 0.8771929824561403.
[32m[I 2023-04-26 11:58:05,540][39m Trial 398 finished with value: 0.8521739130434783 and parameters: {'objective': 'CrossEntropy', 'colsample_bylevel': 0.08128028159327372, 'depth': 12, 'boosting_type': 'Ordered', 'bootstrap_type': 'MVS'}. Best is trial 21 with value: 0.8771929824561403.
[32m[I 2023-04-26 11:58:10,155][39m Trial 399 finished with value: 0.8620689655172413 and parameters: {'objective': 'CrossEntropy', 'colsample_bylevel': 0.06166736941305347, 'depth': 10, 'boosting_type': 'Ordered', 'bootstrap_type': 'Bayesian', 'bagging_temperature': 9.895227297169702}. Best is trial 21 with value: 0.8771929824561403.
[32m[I 2023-04-26 11:58:15,016][39m Trial 400 finished with value: 0.8695652173913043 and parameters: {'objective': 'CrossEntropy', 'colsample_bylevel': 0.06354058022488297, 'depth': 10, 'boosting_type': 'Ordered', 'bootstrap_type': 'Bayesian', 'bagging_temperature': 9.113755339660145}. Best is trial 21 with value: 0.8771929824561403.
[32m[I 2023-04-26 11:58:19,505][39m Trial 401 finished with value: 0.8771929824561403 and parameters: {'objective': 'CrossEntropy', 'colsample_bylevel': 0.06112793710808403, 'depth': 9, 'boosting_type': 'Ordered', 'bootstrap_type': 'Bayesian', 'bagging_temperature': 9.427128307702356}. Best is trial 21 with value: 0.8771929824561403.
[32m[I 2023-04-26 11:58:23,000][39m Trial 402 finished with value: 0.8363636363636363 and parameters: {'objective': 'CrossEntropy', 'colsample_bylevel': 0.05902451161434746, 'depth': 9, 'boosting_type': 'Plain', 'bootstrap_type': 'Bayesian', 'bagging_temperature': 5.0406238797817355}. Best is trial 21 with value: 0.8771929824561403.
[32m[I 2023-04-26 11:58:27,323][39m Trial 403 finished with value: 0.8521739130434783 and parameters: {'objective': 'Logloss', 'colsample_bylevel': 0.060294693333937006, 'depth': 9, 'boosting_type': 'Ordered', 'bootstrap_type': 'Bayesian', 'bagging_temperature': 9.697482407314755}. Best is trial 21 with value: 0.8771929824561403.
[32m[I 2023-04-26 11:58:31,817][39m Trial 404 finished with value: 0.8695652173913043 and parameters: {'objective': 'CrossEntropy', 'colsample_bylevel': 0.05791119008552142, 'depth': 10, 'boosting_type': 'Ordered', 'bootstrap_type': 'Bayesian', 'bagging_temperature': 7.429051889994122}. Best is trial 21 with value: 0.8771929824561403.
[32m[I 2023-04-26 11:58:36,608][39m Trial 405 finished with value: 0.8695652173913043 and parameters: {'objective': 'CrossEntropy', 'colsample_bylevel': 0.07011364478612085, 'depth': 8, 'boosting_type': 'Ordered', 'bootstrap_type': 'Bayesian', 'bagging_temperature': 9.511726313416963}. Best is trial 21 with value: 0.8771929824561403.
[32m[I 2023-04-26 11:58:41,627][39m Trial 406 finished with value: 0.8468468468468469 and parameters: {'objective': 'CrossEntropy', 'colsample_bylevel': 0.06343588606496679, 'depth': 11, 'boosting_type': 'Ordered', 'bootstrap_type': 'Bayesian', 'bagging_temperature': 7.636544292088558}. Best is trial 21 with value: 0.8771929824561403.
[32m[I 2023-04-26 11:58:47,494][39m Trial 407 finished with value: 0.8571428571428572 and parameters: {'objective': 'CrossEntropy', 'colsample_bylevel': 0.07843710464988267, 'depth': 9, 'boosting_type': 'Ordered', 'bootstrap_type': 'Bayesian', 'bagging_temperature': 9.446531075315718}. Best is trial 21 with value: 0.8771929824561403.
[32m[I 2023-04-26 11:58:51,908][39m Trial 408 finished with value: 0.8620689655172413 and parameters: {'objective': 'CrossEntropy', 'colsample_bylevel': 0.06010910748586333, 'depth': 9, 'boosting_type': 'Ordered', 'bootstrap_type': 'Bayesian', 'bagging_temperature': 9.355797039928616}. Best is trial 21 with value: 0.8771929824561403.
[32m[I 2023-04-26 11:58:56,824][39m Trial 409 finished with value: 0.8392857142857144 and parameters: {'objective': 'CrossEntropy', 'colsample_bylevel': 0.06272396151224871, 'depth': 10, 'boosting_type': 'Ordered', 'bootstrap_type': 'Bayesian', 'bagging_temperature': 7.88362983100091}. Best is trial 21 with value: 0.8771929824561403.
[32m[I 2023-04-26 11:59:01,451][39m Trial 410 finished with value: 0.8620689655172413 and parameters: {'objective': 'CrossEntropy', 'colsample_bylevel': 0.06512675145519543, 'depth': 8, 'boosting_type': 'Ordered', 'bootstrap_type': 'Bayesian', 'bagging_temperature': 9.689604004739698}. Best is trial 21 with value: 0.8771929824561403.
[32m[I 2023-04-26 11:59:06,341][39m Trial 411 finished with value: 0.8521739130434783 and parameters: {'objective': 'CrossEntropy', 'colsample_bylevel': 0.062298989240563554, 'depth': 12, 'boosting_type': 'Ordered', 'bootstrap_type': 'Bayesian', 'bagging_temperature': 9.540907538510234}. Best is trial 21 with value: 0.8771929824561403.
[32m[I 2023-04-26 11:59:11,589][39m Trial 412 finished with value: 0.8596491228070176 and parameters: {'objective': 'CrossEntropy', 'colsample_bylevel': 0.06597321446270295, 'depth': 12, 'boosting_type': 'Ordered', 'bootstrap_type': 'Bayesian', 'bagging_temperature': 7.486988790109442}. Best is trial 21 with value: 0.8771929824561403.
[32m[I 2023-04-26 11:59:17,934][39m Trial 413 finished with value: 0.8571428571428572 and parameters: {'objective': 'CrossEntropy', 'colsample_bylevel': 0.07998109254495385, 'depth': 10, 'boosting_type': 'Ordered', 'bootstrap_type': 'Bayesian', 'bagging_temperature': 8.065563577167598}. Best is trial 21 with value: 0.8771929824561403.
[32m[I 2023-04-26 11:59:20,117][39m Trial 414 finished with value: 0.8571428571428572 and parameters: {'objective': 'Logloss', 'colsample_bylevel': 0.07174369120176816, 'depth': 10, 'boosting_type': 'Plain', 'bootstrap_type': 'Bayesian', 'bagging_temperature': 7.139683083015334}. Best is trial 21 with value: 0.8771929824561403.
[32m[I 2023-04-26 11:59:24,612][39m Trial 415 finished with value: 0.8672566371681416 and parameters: {'objective': 'CrossEntropy', 'colsample_bylevel': 0.05677995382681578, 'depth': 11, 'boosting_type': 'Ordered', 'bootstrap_type': 'Bayesian', 'bagging_temperature': 7.026606189969143}. Best is trial 21 with value: 0.8771929824561403.
[32m[I 2023-04-26 11:59:33,706][39m Trial 416 finished with value: 0.8648648648648648 and parameters: {'objective': 'CrossEntropy', 'colsample_bylevel': 0.08341952463444424, 'depth': 12, 'boosting_type': 'Ordered', 'bootstrap_type': 'Bayesian', 'bagging_temperature': 8.796604310416834}. Best is trial 21 with value: 0.8771929824561403.
[32m[I 2023-04-26 11:59:40,534][39m Trial 417 finished with value: 0.8596491228070176 and parameters: {'objective': 'CrossEntropy', 'colsample_bylevel': 0.07507635529030833, 'depth': 6, 'boosting_type': 'Ordered', 'bootstrap_type': 'Bayesian', 'bagging_temperature': 7.2348029502318925}. Best is trial 21 with value: 0.8771929824561403.
[32m[I 2023-04-26 11:59:45,312][39m Trial 418 finished with value: 0.8468468468468469 and parameters: {'objective': 'CrossEntropy', 'colsample_bylevel': 0.08239967163160473, 'depth': 9, 'boosting_type': 'Ordered', 'bootstrap_type': 'Bernoulli', 'subsample': 0.1894413584647936}. Best is trial 21 with value: 0.8771929824561403.
[32m[I 2023-04-26 11:59:49,980][39m Trial 419 finished with value: 0.8771929824561403 and parameters: {'objective': 'CrossEntropy', 'colsample_bylevel': 0.06657345546591927, 'depth': 9, 'boosting_type': 'Ordered', 'bootstrap_type': 'Bayesian', 'bagging_temperature': 9.211061293649035}. Best is trial 21 with value: 0.8771929824561403.
[32m[I 2023-04-26 11:59:57,178][39m Trial 420 finished with value: 0.8545454545454546 and parameters: {'objective': 'CrossEntropy', 'colsample_bylevel': 0.09444093726188697, 'depth': 9, 'boosting_type': 'Ordered', 'bootstrap_type': 'Bayesian', 'bagging_temperature': 4.573764115376964}. Best is trial 21 with value: 0.8771929824561403.
[32m[I 2023-04-26 12:00:01,439][39m Trial 421 finished with value: 0.8596491228070176 and parameters: {'objective': 'CrossEntropy', 'colsample_bylevel': 0.061143644779792235, 'depth': 9, 'boosting_type': 'Ordered', 'bootstrap_type': 'Bayesian', 'bagging_temperature': 7.404488533489559}. Best is trial 21 with value: 0.8771929824561403.
[32m[I 2023-04-26 12:00:06,069][39m Trial 422 finished with value: 0.831858407079646 and parameters: {'objective': 'CrossEntropy', 'colsample_bylevel': 0.091249146559226, 'depth': 12, 'boosting_type': 'Ordered', 'bootstrap_type': 'MVS'}. Best is trial 21 with value: 0.8771929824561403.
[32m[I 2023-04-26 12:00:10,998][39m Trial 423 finished with value: 0.875 and parameters: {'objective': 'CrossEntropy', 'colsample_bylevel': 0.06887545003162442, 'depth': 11, 'boosting_type': 'Ordered', 'bootstrap_type': 'Bayesian', 'bagging_temperature': 7.599135342224141}. Best is trial 21 with value: 0.8771929824561403.
[32m[I 2023-04-26 12:00:15,979][39m Trial 424 finished with value: 0.8596491228070176 and parameters: {'objective': 'CrossEntropy', 'colsample_bylevel': 0.06428672884547171, 'depth': 10, 'boosting_type': 'Ordered', 'bootstrap_type': 'Bayesian', 'bagging_temperature': 7.893680902473106}. Best is trial 21 with value: 0.8771929824561403.
[32m[I 2023-04-26 12:00:21,360][39m Trial 425 finished with value: 0.8672566371681416 and parameters: {'objective': 'CrossEntropy', 'colsample_bylevel': 0.06881053387284325, 'depth': 11, 'boosting_type': 'Ordered', 'bootstrap_type': 'Bayesian', 'bagging_temperature': 9.402948775314307}. Best is trial 21 with value: 0.8771929824561403.
[32m[I 2023-04-26 12:00:25,493][39m Trial 426 finished with value: 0.8363636363636363 and parameters: {'objective': 'Logloss', 'colsample_bylevel': 0.07070797520112031, 'depth': 9, 'boosting_type': 'Plain', 'bootstrap_type': 'Bayesian', 'bagging_temperature': 9.176527139394011}. Best is trial 21 with value: 0.8771929824561403.
[32m[I 2023-04-26 12:00:29,953][39m Trial 427 finished with value: 0.8521739130434783 and parameters: {'objective': 'CrossEntropy', 'colsample_bylevel': 0.06699746667467027, 'depth': 7, 'boosting_type': 'Ordered', 'bootstrap_type': 'Bayesian', 'bagging_temperature': 9.143248724077678}. Best is trial 21 with value: 0.8771929824561403.
[32m[I 2023-04-26 12:00:35,217][39m Trial 428 finished with value: 0.8596491228070176 and parameters: {'objective': 'CrossEntropy', 'colsample_bylevel': 0.06691578410664047, 'depth': 11, 'boosting_type': 'Ordered', 'bootstrap_type': 'Bayesian', 'bagging_temperature': 8.996850294832328}. Best is trial 21 with value: 0.8771929824561403.
[32m[I 2023-04-26 12:00:40,538][39m Trial 429 finished with value: 0.8521739130434783 and parameters: {'objective': 'CrossEntropy', 'colsample_bylevel': 0.07374640567284042, 'depth': 9, 'boosting_type': 'Ordered', 'bootstrap_type': 'Bayesian', 'bagging_temperature': 9.53005877382542}. Best is trial 21 with value: 0.8771929824561403.
[32m[I 2023-04-26 12:00:47,354][39m Trial 430 finished with value: 0.8648648648648648 and parameters: {'objective': 'CrossEntropy', 'colsample_bylevel': 0.09761005623095982, 'depth': 8, 'boosting_type': 'Ordered', 'bootstrap_type': 'Bayesian', 'bagging_temperature': 6.459849955831897}. Best is trial 21 with value: 0.8771929824561403.
[32m[I 2023-04-26 12:00:52,086][39m Trial 431 finished with value: 0.8849557522123893 and parameters: {'objective': 'CrossEntropy', 'colsample_bylevel': 0.06522607293878985, 'depth': 9, 'boosting_type': 'Ordered', 'bootstrap_type': 'Bayesian', 'bagging_temperature': 8.306947142144294}. Best is trial 431 with value: 0.8849557522123893.
[32m[I 2023-04-26 12:00:56,578][39m Trial 432 finished with value: 0.8771929824561403 and parameters: {'objective': 'CrossEntropy', 'colsample_bylevel': 0.06203623932480695, 'depth': 9, 'boosting_type': 'Ordered', 'bootstrap_type': 'Bayesian', 'bagging_temperature': 9.979639432181852}. Best is trial 431 with value: 0.8849557522123893.
[32m[I 2023-04-26 12:01:00,924][39m Trial 433 finished with value: 0.8495575221238938 and parameters: {'objective': 'CrossEntropy', 'colsample_bylevel': 0.05849418401343333, 'depth': 9, 'boosting_type': 'Ordered', 'bootstrap_type': 'Bayesian', 'bagging_temperature': 9.652907234916766}. Best is trial 431 with value: 0.8849557522123893.
[32m[I 2023-04-26 12:01:05,895][39m Trial 434 finished with value: 0.8771929824561403 and parameters: {'objective': 'CrossEntropy', 'colsample_bylevel': 0.06565613897006312, 'depth': 9, 'boosting_type': 'Ordered', 'bootstrap_type': 'Bayesian', 'bagging_temperature': 9.28428841033457}. Best is trial 431 with value: 0.8849557522123893.
[32m[I 2023-04-26 12:01:10,770][39m Trial 435 finished with value: 0.8849557522123893 and parameters: {'objective': 'CrossEntropy', 'colsample_bylevel': 0.06403467183904178, 'depth': 9, 'boosting_type': 'Ordered', 'bootstrap_type': 'Bayesian', 'bagging_temperature': 9.938092605735221}. Best is trial 431 with value: 0.8849557522123893.
[32m[I 2023-04-26 12:01:15,695][39m Trial 436 finished with value: 0.8672566371681416 and parameters: {'objective': 'CrossEntropy', 'colsample_bylevel': 0.06482640750457529, 'depth': 9, 'boosting_type': 'Ordered', 'bootstrap_type': 'Bayesian', 'bagging_temperature': 9.226471113299171}. Best is trial 431 with value: 0.8849557522123893.
[32m[I 2023-04-26 12:01:20,431][39m Trial 437 finished with value: 0.8571428571428572 and parameters: {'objective': 'CrossEntropy', 'colsample_bylevel': 0.06319722344748063, 'depth': 9, 'boosting_type': 'Ordered', 'bootstrap_type': 'Bayesian', 'bagging_temperature': 9.882460304572591}. Best is trial 431 with value: 0.8849557522123893.
[32m[I 2023-04-26 12:01:25,271][39m Trial 438 finished with value: 0.8495575221238938 and parameters: {'objective': 'CrossEntropy', 'colsample_bylevel': 0.06568837159932468, 'depth': 9, 'boosting_type': 'Ordered', 'bootstrap_type': 'Bayesian', 'bagging_temperature': 8.955487911352837}. Best is trial 431 with value: 0.8849557522123893.
[32m[I 2023-04-26 12:01:29,923][39m Trial 439 finished with value: 0.8771929824561403 and parameters: {'objective': 'CrossEntropy', 'colsample_bylevel': 0.061487461354566196, 'depth': 9, 'boosting_type': 'Ordered', 'bootstrap_type': 'Bayesian', 'bagging_temperature': 9.951491884152995}. Best is trial 431 with value: 0.8849557522123893.
[32m[I 2023-04-26 12:01:33,917][39m Trial 440 finished with value: 0.8672566371681416 and parameters: {'objective': 'CrossEntropy', 'colsample_bylevel': 0.06266211495898934, 'depth': 9, 'boosting_type': 'Plain', 'bootstrap_type': 'Bayesian', 'bagging_temperature': 9.942894524562595}. Best is trial 431 with value: 0.8849557522123893.
[32m[I 2023-04-26 12:01:38,231][39m Trial 441 finished with value: 0.8596491228070176 and parameters: {'objective': 'Logloss', 'colsample_bylevel': 0.06108126077896402, 'depth': 9, 'boosting_type': 'Ordered', 'bootstrap_type': 'Bayesian', 'bagging_temperature': 3.322993855209852}. Best is trial 431 with value: 0.8849557522123893.
[32m[I 2023-04-26 12:01:42,968][39m Trial 442 finished with value: 0.8571428571428572 and parameters: {'objective': 'CrossEntropy', 'colsample_bylevel': 0.06426776433546758, 'depth': 9, 'boosting_type': 'Ordered', 'bootstrap_type': 'Bayesian', 'bagging_temperature': 9.332410949198676}. Best is trial 431 with value: 0.8849557522123893.
[32m[I 2023-04-26 12:01:47,686][39m Trial 443 finished with value: 0.831858407079646 and parameters: {'objective': 'CrossEntropy', 'colsample_bylevel': 0.0660174938479834, 'depth': 9, 'boosting_type': 'Ordered', 'bootstrap_type': 'Bernoulli', 'subsample': 0.510452573041162}. Best is trial 431 with value: 0.8849557522123893.
[32m[I 2023-04-26 12:01:52,290][39m Trial 444 finished with value: 0.8695652173913043 and parameters: {'objective': 'CrossEntropy', 'colsample_bylevel': 0.06016637710949269, 'depth': 9, 'boosting_type': 'Ordered', 'bootstrap_type': 'Bayesian', 'bagging_temperature': 9.851183452886854}. Best is trial 431 with value: 0.8849557522123893.
[32m[I 2023-04-26 12:01:57,052][39m Trial 445 finished with value: 0.8849557522123893 and parameters: {'objective': 'CrossEntropy', 'colsample_bylevel': 0.06217199568887937, 'depth': 9, 'boosting_type': 'Ordered', 'bootstrap_type': 'Bayesian', 'bagging_temperature': 9.940742412065953}. Best is trial 431 with value: 0.8849557522123893.
[32m[I 2023-04-26 12:02:01,734][39m Trial 446 finished with value: 0.8571428571428572 and parameters: {'objective': 'CrossEntropy', 'colsample_bylevel': 0.061864561419496665, 'depth': 9, 'boosting_type': 'Ordered', 'bootstrap_type': 'Bayesian', 'bagging_temperature': 9.998762733403098}. Best is trial 431 with value: 0.8849557522123893.
[32m[I 2023-04-26 12:02:06,263][39m Trial 447 finished with value: 0.8596491228070176 and parameters: {'objective': 'CrossEntropy', 'colsample_bylevel': 0.058356395499508586, 'depth': 9, 'boosting_type': 'Ordered', 'bootstrap_type': 'Bayesian', 'bagging_temperature': 9.961063015609604}. Best is trial 431 with value: 0.8849557522123893.
[32m[I 2023-04-26 12:02:09,191][39m Trial 448 finished with value: 0.831858407079646 and parameters: {'objective': 'CrossEntropy', 'colsample_bylevel': 0.06318146725189253, 'depth': 9, 'boosting_type': 'Ordered', 'bootstrap_type': 'MVS'}. Best is trial 431 with value: 0.8849557522123893.
[32m[I 2023-04-26 12:02:13,839][39m Trial 449 finished with value: 0.8596491228070176 and parameters: {'objective': 'CrossEntropy', 'colsample_bylevel': 0.06161802592603869, 'depth': 9, 'boosting_type': 'Ordered', 'bootstrap_type': 'Bayesian', 'bagging_temperature': 9.764908404899504}. Best is trial 431 with value: 0.8849557522123893.
[32m[I 2023-04-26 12:02:18,388][39m Trial 450 finished with value: 0.8448275862068967 and parameters: {'objective': 'CrossEntropy', 'colsample_bylevel': 0.059849851467723474, 'depth': 9, 'boosting_type': 'Ordered', 'bootstrap_type': 'Bayesian', 'bagging_temperature': 9.32819993989024}. Best is trial 431 with value: 0.8849557522123893.
[32m[I 2023-04-26 12:02:23,068][39m Trial 451 finished with value: 0.8521739130434783 and parameters: {'objective': 'CrossEntropy', 'colsample_bylevel': 0.06533413173159622, 'depth': 9, 'boosting_type': 'Ordered', 'bootstrap_type': 'Bayesian', 'bagging_temperature': 9.053696072093048}. Best is trial 431 with value: 0.8849557522123893.
[32m[I 2023-04-26 12:02:27,332][39m Trial 452 finished with value: 0.8468468468468469 and parameters: {'objective': 'Logloss', 'colsample_bylevel': 0.06310577198588462, 'depth': 9, 'boosting_type': 'Plain', 'bootstrap_type': 'Bayesian', 'bagging_temperature': 9.614398240858435}. Best is trial 431 with value: 0.8849557522123893.
[32m[I 2023-04-26 12:02:31,341][39m Trial 453 finished with value: 0.8695652173913043 and parameters: {'objective': 'CrossEntropy', 'colsample_bylevel': 0.05493500868966621, 'depth': 8, 'boosting_type': 'Ordered', 'bootstrap_type': 'Bayesian', 'bagging_temperature': 9.777378038925095}. Best is trial 431 with value: 0.8849557522123893.
[32m[I 2023-04-26 12:02:36,033][39m Trial 454 finished with value: 0.8695652173913043 and parameters: {'objective': 'CrossEntropy', 'colsample_bylevel': 0.06468440862276109, 'depth': 9, 'boosting_type': 'Ordered', 'bootstrap_type': 'Bayesian', 'bagging_temperature': 9.20894710974485}. Best is trial 431 with value: 0.8849557522123893.
[32m[I 2023-04-26 12:02:40,558][39m Trial 455 finished with value: 0.8695652173913043 and parameters: {'objective': 'CrossEntropy', 'colsample_bylevel': 0.06023713435388486, 'depth': 9, 'boosting_type': 'Ordered', 'bootstrap_type': 'Bayesian', 'bagging_temperature': 9.98602421309345}. Best is trial 431 with value: 0.8849557522123893.
[32m[I 2023-04-26 12:02:45,388][39m Trial 456 finished with value: 0.8521739130434783 and parameters: {'objective': 'CrossEntropy', 'colsample_bylevel': 0.06660634302811372, 'depth': 9, 'boosting_type': 'Ordered', 'bootstrap_type': 'Bayesian', 'bagging_temperature': 9.40463389146397}. Best is trial 431 with value: 0.8849557522123893.
