
[32m[I 2023-04-26 11:17:56,856][39m A new study created in memory with name: no-name-c189fd78-79d3-47ca-b236-8b3df6b7ce2a
[32m[I 2023-04-26 11:17:59,200][39m Trial 0 finished with value: 0.8571428571428572 and parameters: {'objective': 'CrossEntropy', 'colsample_bylevel': 0.0901724760520359, 'depth': 7, 'boosting_type': 'Plain', 'bootstrap_type': 'Bayesian', 'bagging_temperature': 9.541334182421776}. Best is trial 0 with value: 0.8571428571428572.
[32m[I 2023-04-26 11:18:00,239][39m Trial 1 finished with value: 0.831858407079646 and parameters: {'objective': 'CrossEntropy', 'colsample_bylevel': 0.09863494736413875, 'depth': 5, 'boosting_type': 'Plain', 'bootstrap_type': 'Bernoulli', 'subsample': 0.9920205008477605}. Best is trial 0 with value: 0.8571428571428572.
[32m[I 2023-04-26 11:18:01,530][39m Trial 2 finished with value: 0.8376068376068375 and parameters: {'objective': 'Logloss', 'colsample_bylevel': 0.0418080352993393, 'depth': 4, 'boosting_type': 'Plain', 'bootstrap_type': 'Bernoulli', 'subsample': 0.4076941409027127}. Best is trial 0 with value: 0.8571428571428572.
[32m[I 2023-04-26 11:18:04,345][39m Trial 3 finished with value: 0.8521739130434783 and parameters: {'objective': 'CrossEntropy', 'colsample_bylevel': 0.03764584094738944, 'depth': 12, 'boosting_type': 'Ordered', 'bootstrap_type': 'MVS'}. Best is trial 0 with value: 0.8571428571428572.
[32m[I 2023-04-26 11:18:06,498][39m Trial 4 finished with value: 0.831858407079646 and parameters: {'objective': 'Logloss', 'colsample_bylevel': 0.09731565833749548, 'depth': 4, 'boosting_type': 'Plain', 'bootstrap_type': 'MVS'}. Best is trial 0 with value: 0.8571428571428572.
[32m[I 2023-04-26 11:18:07,803][39m Trial 5 finished with value: 0.8547008547008546 and parameters: {'objective': 'Logloss', 'colsample_bylevel': 0.05226775054380917, 'depth': 2, 'boosting_type': 'Plain', 'bootstrap_type': 'Bayesian', 'bagging_temperature': 4.501595961932313}. Best is trial 0 with value: 0.8571428571428572.
[32m[I 2023-04-26 11:18:09,782][39m Trial 6 finished with value: 0.8214285714285715 and parameters: {'objective': 'CrossEntropy', 'colsample_bylevel': 0.09443532109175472, 'depth': 4, 'boosting_type': 'Plain', 'bootstrap_type': 'Bayesian', 'bagging_temperature': 8.565514376610622}. Best is trial 0 with value: 0.8571428571428572.
[32m[I 2023-04-26 11:18:13,013][39m Trial 7 finished with value: 0.8521739130434783 and parameters: {'objective': 'Logloss', 'colsample_bylevel': 0.09977830830899556, 'depth': 2, 'boosting_type': 'Ordered', 'bootstrap_type': 'Bayesian', 'bagging_temperature': 1.985761557981277}. Best is trial 0 with value: 0.8571428571428572.
[32m[I 2023-04-26 11:18:23,834][39m Trial 8 finished with value: 0.8648648648648648 and parameters: {'objective': 'CrossEntropy', 'colsample_bylevel': 0.09367604266577878, 'depth': 12, 'boosting_type': 'Ordered', 'bootstrap_type': 'Bayesian', 'bagging_temperature': 6.538198310495991}. Best is trial 8 with value: 0.8648648648648648.
[32m[I 2023-04-26 11:18:27,693][39m Trial 9 finished with value: 0.8421052631578947 and parameters: {'objective': 'Logloss', 'colsample_bylevel': 0.0893384676944055, 'depth': 4, 'boosting_type': 'Ordered', 'bootstrap_type': 'MVS'}. Best is trial 8 with value: 0.8648648648648648.
[32m[I 2023-04-26 11:18:30,073][39m Trial 10 finished with value: 0.7627118644067795 and parameters: {'objective': 'CrossEntropy', 'colsample_bylevel': 0.010323799759937621, 'depth': 12, 'boosting_type': 'Ordered', 'bootstrap_type': 'Bayesian', 'bagging_temperature': 5.987365558978643}. Best is trial 8 with value: 0.8648648648648648.
[32m[I 2023-04-26 11:18:34,881][39m Trial 11 finished with value: 0.8495575221238938 and parameters: {'objective': 'CrossEntropy', 'colsample_bylevel': 0.07290334276408053, 'depth': 9, 'boosting_type': 'Ordered', 'bootstrap_type': 'Bayesian', 'bagging_temperature': 9.17174004189188}. Best is trial 8 with value: 0.8648648648648648.
[32m[I 2023-04-26 11:18:40,064][39m Trial 12 finished with value: 0.8672566371681416 and parameters: {'objective': 'CrossEntropy', 'colsample_bylevel': 0.07580345200206921, 'depth': 9, 'boosting_type': 'Ordered', 'bootstrap_type': 'Bayesian', 'bagging_temperature': 6.897731938781427}. Best is trial 12 with value: 0.8672566371681416.
[32m[I 2023-04-26 11:18:45,054][39m Trial 13 finished with value: 0.8495575221238938 and parameters: {'objective': 'CrossEntropy', 'colsample_bylevel': 0.07262723202325594, 'depth': 10, 'boosting_type': 'Ordered', 'bootstrap_type': 'Bayesian', 'bagging_temperature': 6.048020814994521}. Best is trial 12 with value: 0.8672566371681416.
[32m[I 2023-04-26 11:18:49,834][39m Trial 14 finished with value: 0.8468468468468469 and parameters: {'objective': 'CrossEntropy', 'colsample_bylevel': 0.07588590192029758, 'depth': 9, 'boosting_type': 'Ordered', 'bootstrap_type': 'Bayesian', 'bagging_temperature': 7.09028465377484}. Best is trial 12 with value: 0.8672566371681416.
[32m[I 2023-04-26 11:18:54,460][39m Trial 15 finished with value: 0.831858407079646 and parameters: {'objective': 'CrossEntropy', 'colsample_bylevel': 0.08024979054709677, 'depth': 10, 'boosting_type': 'Ordered', 'bootstrap_type': 'Bernoulli', 'subsample': 0.10845624889915284}. Best is trial 12 with value: 0.8672566371681416.
[32m[I 2023-04-26 11:18:58,451][39m Trial 16 finished with value: 0.8347826086956522 and parameters: {'objective': 'CrossEntropy', 'colsample_bylevel': 0.06201767718850286, 'depth': 7, 'boosting_type': 'Ordered', 'bootstrap_type': 'Bayesian', 'bagging_temperature': 3.339602775121504}. Best is trial 12 with value: 0.8672566371681416.
[32m[I 2023-04-26 11:19:03,053][39m Trial 17 finished with value: 0.8695652173913043 and parameters: {'objective': 'CrossEntropy', 'colsample_bylevel': 0.06354507507514841, 'depth': 11, 'boosting_type': 'Ordered', 'bootstrap_type': 'Bayesian', 'bagging_temperature': 7.518077638233564}. Best is trial 17 with value: 0.8695652173913043.
[32m[I 2023-04-26 11:19:06,297][39m Trial 18 finished with value: 0.831858407079646 and parameters: {'objective': 'CrossEntropy', 'colsample_bylevel': 0.05971305974161767, 'depth': 10, 'boosting_type': 'Ordered', 'bootstrap_type': 'Bernoulli', 'subsample': 0.881003389304414}. Best is trial 17 with value: 0.8695652173913043.
[32m[I 2023-04-26 11:19:08,950][39m Trial 19 finished with value: 0.8376068376068375 and parameters: {'objective': 'CrossEntropy', 'colsample_bylevel': 0.04820819403785603, 'depth': 8, 'boosting_type': 'Ordered', 'bootstrap_type': 'MVS'}. Best is trial 17 with value: 0.8695652173913043.
[32m[I 2023-04-26 11:19:12,169][39m Trial 20 finished with value: 0.8376068376068375 and parameters: {'objective': 'CrossEntropy', 'colsample_bylevel': 0.027467690654475803, 'depth': 11, 'boosting_type': 'Ordered', 'bootstrap_type': 'Bayesian', 'bagging_temperature': 0.09560789070611175}. Best is trial 17 with value: 0.8695652173913043.
[32m[I 2023-04-26 11:19:20,095][39m Trial 21 finished with value: 0.8771929824561403 and parameters: {'objective': 'CrossEntropy', 'colsample_bylevel': 0.08288577379263969, 'depth': 12, 'boosting_type': 'Ordered', 'bootstrap_type': 'Bayesian', 'bagging_temperature': 7.5570943744856045}. Best is trial 21 with value: 0.8771929824561403.
[32m[I 2023-04-26 11:19:27,103][39m Trial 22 finished with value: 0.8468468468468469 and parameters: {'objective': 'CrossEntropy', 'colsample_bylevel': 0.0825523083892376, 'depth': 11, 'boosting_type': 'Ordered', 'bootstrap_type': 'Bayesian', 'bagging_temperature': 7.745542219649738}. Best is trial 21 with value: 0.8771929824561403.
[32m[I 2023-04-26 11:19:32,065][39m Trial 23 finished with value: 0.8596491228070176 and parameters: {'objective': 'CrossEntropy', 'colsample_bylevel': 0.06600299457526669, 'depth': 11, 'boosting_type': 'Ordered', 'bootstrap_type': 'Bayesian', 'bagging_temperature': 7.6662216505774285}. Best is trial 21 with value: 0.8771929824561403.
[32m[I 2023-04-26 11:19:36,374][39m Trial 24 finished with value: 0.8771929824561403 and parameters: {'objective': 'CrossEntropy', 'colsample_bylevel': 0.06579103992520784, 'depth': 9, 'boosting_type': 'Ordered', 'bootstrap_type': 'Bayesian', 'bagging_temperature': 5.173262515939605}. Best is trial 21 with value: 0.8771929824561403.
[32m[I 2023-04-26 11:19:41,262][39m Trial 25 finished with value: 0.8495575221238938 and parameters: {'objective': 'CrossEntropy', 'colsample_bylevel': 0.06795243958183225, 'depth': 11, 'boosting_type': 'Ordered', 'bootstrap_type': 'Bayesian', 'bagging_temperature': 5.157302788997071}. Best is trial 21 with value: 0.8771929824561403.
[32m[I 2023-04-26 11:19:45,253][39m Trial 26 finished with value: 0.8547008547008546 and parameters: {'objective': 'Logloss', 'colsample_bylevel': 0.05635355000845625, 'depth': 8, 'boosting_type': 'Ordered', 'bootstrap_type': 'Bayesian', 'bagging_temperature': 4.635623131359801}. Best is trial 21 with value: 0.8771929824561403.
[32m[I 2023-04-26 11:19:50,899][39m Trial 27 finished with value: 0.8648648648648648 and parameters: {'objective': 'CrossEntropy', 'colsample_bylevel': 0.08641435761860475, 'depth': 8, 'boosting_type': 'Ordered', 'bootstrap_type': 'Bayesian', 'bagging_temperature': 8.313075600249753}. Best is trial 21 with value: 0.8771929824561403.
[32m[I 2023-04-26 11:19:54,783][39m Trial 28 finished with value: 0.8421052631578947 and parameters: {'objective': 'CrossEntropy', 'colsample_bylevel': 0.06739824132288293, 'depth': 10, 'boosting_type': 'Ordered', 'bootstrap_type': 'Bernoulli', 'subsample': 0.5980822779700375}. Best is trial 21 with value: 0.8771929824561403.
[32m[I 2023-04-26 11:19:56,518][39m Trial 29 finished with value: 0.831858407079646 and parameters: {'objective': 'CrossEntropy', 'colsample_bylevel': 0.04664714588141389, 'depth': 6, 'boosting_type': 'Plain', 'bootstrap_type': 'MVS'}. Best is trial 21 with value: 0.8771929824561403.
[32m[I 2023-04-26 11:19:59,894][39m Trial 30 finished with value: 0.847457627118644 and parameters: {'objective': 'CrossEntropy', 'colsample_bylevel': 0.03428071806795881, 'depth': 12, 'boosting_type': 'Ordered', 'bootstrap_type': 'Bayesian', 'bagging_temperature': 3.492504805686494}. Best is trial 21 with value: 0.8771929824561403.
[32m[I 2023-04-26 11:20:05,718][39m Trial 31 finished with value: 0.8421052631578947 and parameters: {'objective': 'CrossEntropy', 'colsample_bylevel': 0.08045786131894074, 'depth': 9, 'boosting_type': 'Ordered', 'bootstrap_type': 'Bayesian', 'bagging_temperature': 6.880321025073245}. Best is trial 21 with value: 0.8771929824561403.
[32m[I 2023-04-26 11:20:11,237][39m Trial 32 finished with value: 0.8468468468468469 and parameters: {'objective': 'CrossEntropy', 'colsample_bylevel': 0.0761609965154335, 'depth': 9, 'boosting_type': 'Ordered', 'bootstrap_type': 'Bayesian', 'bagging_temperature': 5.492604640074869}. Best is trial 21 with value: 0.8771929824561403.
[32m[I 2023-04-26 11:20:16,627][39m Trial 33 finished with value: 0.8596491228070176 and parameters: {'objective': 'CrossEntropy', 'colsample_bylevel': 0.06170267489292168, 'depth': 6, 'boosting_type': 'Ordered', 'bootstrap_type': 'Bayesian', 'bagging_temperature': 7.498855798148066}. Best is trial 21 with value: 0.8771929824561403.
[32m[I 2023-04-26 11:20:18,140][39m Trial 34 finished with value: 0.8620689655172413 and parameters: {'objective': 'CrossEntropy', 'colsample_bylevel': 0.08538783449922756, 'depth': 7, 'boosting_type': 'Plain', 'bootstrap_type': 'Bernoulli', 'subsample': 0.20658471802422534}. Best is trial 21 with value: 0.8771929824561403.
[32m[I 2023-04-26 11:20:23,174][39m Trial 35 finished with value: 0.8571428571428572 and parameters: {'objective': 'CrossEntropy', 'colsample_bylevel': 0.07021197678343724, 'depth': 11, 'boosting_type': 'Ordered', 'bootstrap_type': 'Bayesian', 'bagging_temperature': 8.353609539255773}. Best is trial 21 with value: 0.8771929824561403.
[32m[I 2023-04-26 11:20:24,945][39m Trial 36 finished with value: 0.8448275862068967 and parameters: {'objective': 'Logloss', 'colsample_bylevel': 0.054130249990627585, 'depth': 12, 'boosting_type': 'Plain', 'bootstrap_type': 'Bayesian', 'bagging_temperature': 6.401722162386781}. Best is trial 21 with value: 0.8771929824561403.
[32m[I 2023-04-26 11:20:28,341][39m Trial 37 finished with value: 0.823529411764706 and parameters: {'objective': 'CrossEntropy', 'colsample_bylevel': 0.0780248056712583, 'depth': 1, 'boosting_type': 'Ordered', 'bootstrap_type': 'MVS'}. Best is trial 21 with value: 0.8771929824561403.
[32m[I 2023-04-26 11:20:30,522][39m Trial 38 finished with value: 0.831858407079646 and parameters: {'objective': 'Logloss', 'colsample_bylevel': 0.06444865358414271, 'depth': 10, 'boosting_type': 'Plain', 'bootstrap_type': 'Bayesian', 'bagging_temperature': 4.120220697909033}. Best is trial 21 with value: 0.8771929824561403.
[32m[I 2023-04-26 11:20:36,419][39m Trial 39 finished with value: 0.8571428571428572 and parameters: {'objective': 'CrossEntropy', 'colsample_bylevel': 0.09040912388664908, 'depth': 8, 'boosting_type': 'Ordered', 'bootstrap_type': 'Bayesian', 'bagging_temperature': 9.961704537299154}. Best is trial 21 with value: 0.8771929824561403.
[32m[I 2023-04-26 11:20:40,581][39m Trial 40 finished with value: 0.8421052631578947 and parameters: {'objective': 'Logloss', 'colsample_bylevel': 0.05771924095407169, 'depth': 9, 'boosting_type': 'Ordered', 'bootstrap_type': 'Bernoulli', 'subsample': 0.691723932346436}. Best is trial 21 with value: 0.8771929824561403.
[32m[I 2023-04-26 11:20:45,055][39m Trial 41 finished with value: 0.8695652173913043 and parameters: {'objective': 'CrossEntropy', 'colsample_bylevel': 0.08544355265384278, 'depth': 8, 'boosting_type': 'Ordered', 'bootstrap_type': 'Bayesian', 'bagging_temperature': 8.447392604502852}. Best is trial 21 with value: 0.8771929824561403.
[32m[I 2023-04-26 11:20:50,691][39m Trial 42 finished with value: 0.8648648648648648 and parameters: {'objective': 'CrossEntropy', 'colsample_bylevel': 0.08357485038818863, 'depth': 8, 'boosting_type': 'Ordered', 'bootstrap_type': 'Bayesian', 'bagging_temperature': 8.640474283513809}. Best is trial 21 with value: 0.8771929824561403.
[32m[I 2023-04-26 11:20:55,772][39m Trial 43 finished with value: 0.8521739130434783 and parameters: {'objective': 'CrossEntropy', 'colsample_bylevel': 0.09259390202898166, 'depth': 5, 'boosting_type': 'Ordered', 'bootstrap_type': 'Bayesian', 'bagging_temperature': 7.471339506928247}. Best is trial 21 with value: 0.8771929824561403.
[32m[I 2023-04-26 11:21:05,209][39m Trial 44 finished with value: 0.8495575221238938 and parameters: {'objective': 'CrossEntropy', 'colsample_bylevel': 0.08793920230580282, 'depth': 12, 'boosting_type': 'Ordered', 'bootstrap_type': 'Bayesian', 'bagging_temperature': 9.35937569199114}. Best is trial 21 with value: 0.8771929824561403.
[32m[I 2023-04-26 11:21:10,272][39m Trial 45 finished with value: 0.8571428571428572 and parameters: {'objective': 'CrossEntropy', 'colsample_bylevel': 0.07253738437464388, 'depth': 9, 'boosting_type': 'Ordered', 'bootstrap_type': 'Bayesian', 'bagging_temperature': 5.705917938108132}. Best is trial 21 with value: 0.8771929824561403.
[32m[I 2023-04-26 11:21:11,779][39m Trial 46 finished with value: 0.831858407079646 and parameters: {'objective': 'CrossEntropy', 'colsample_bylevel': 0.09737111911932117, 'depth': 10, 'boosting_type': 'Plain', 'bootstrap_type': 'MVS'}. Best is trial 21 with value: 0.8771929824561403.
[32m[I 2023-04-26 11:21:16,420][39m Trial 47 finished with value: 0.8468468468468469 and parameters: {'objective': 'CrossEntropy', 'colsample_bylevel': 0.07569118998998466, 'depth': 7, 'boosting_type': 'Ordered', 'bootstrap_type': 'Bayesian', 'bagging_temperature': 7.9808953418523485}. Best is trial 21 with value: 0.8771929824561403.
[32m[I 2023-04-26 11:21:21,664][39m Trial 48 finished with value: 0.8392857142857144 and parameters: {'objective': 'CrossEntropy', 'colsample_bylevel': 0.07116683184087687, 'depth': 11, 'boosting_type': 'Ordered', 'bootstrap_type': 'Bayesian', 'bagging_temperature': 6.887612882928909}. Best is trial 21 with value: 0.8771929824561403.
[32m[I 2023-04-26 11:21:26,896][39m Trial 49 finished with value: 0.8547008547008546 and parameters: {'objective': 'Logloss', 'colsample_bylevel': 0.04827560612506063, 'depth': 6, 'boosting_type': 'Ordered', 'bootstrap_type': 'Bayesian', 'bagging_temperature': 9.183335301859499}. Best is trial 21 with value: 0.8771929824561403.
[32m[I 2023-04-26 11:21:33,109][39m Trial 50 finished with value: 0.8648648648648648 and parameters: {'objective': 'CrossEntropy', 'colsample_bylevel': 0.08035828878686506, 'depth': 10, 'boosting_type': 'Ordered', 'bootstrap_type': 'Bayesian', 'bagging_temperature': 8.831237415200235}. Best is trial 21 with value: 0.8771929824561403.
[32m[I 2023-04-26 11:21:39,348][39m Trial 51 finished with value: 0.8495575221238938 and parameters: {'objective': 'CrossEntropy', 'colsample_bylevel': 0.08056711264269753, 'depth': 10, 'boosting_type': 'Ordered', 'bootstrap_type': 'Bayesian', 'bagging_temperature': 8.765646589098177}. Best is trial 21 with value: 0.8771929824561403.
[32m[I 2023-04-26 11:21:44,745][39m Trial 52 finished with value: 0.8571428571428572 and parameters: {'objective': 'CrossEntropy', 'colsample_bylevel': 0.07713312597251169, 'depth': 9, 'boosting_type': 'Ordered', 'bootstrap_type': 'Bayesian', 'bagging_temperature': 8.130346985361252}. Best is trial 21 with value: 0.8771929824561403.
[32m[I 2023-04-26 11:21:53,538][39m Trial 53 finished with value: 0.875 and parameters: {'objective': 'CrossEntropy', 'colsample_bylevel': 0.09502468761446872, 'depth': 10, 'boosting_type': 'Ordered', 'bootstrap_type': 'Bayesian', 'bagging_temperature': 7.160269322204657}. Best is trial 21 with value: 0.8771929824561403.
[32m[I 2023-04-26 11:22:04,591][39m Trial 54 finished with value: 0.851851851851852 and parameters: {'objective': 'CrossEntropy', 'colsample_bylevel': 0.0996044069423136, 'depth': 11, 'boosting_type': 'Ordered', 'bootstrap_type': 'Bayesian', 'bagging_temperature': 6.458636952120753}. Best is trial 21 with value: 0.8771929824561403.
[32m[I 2023-04-26 11:22:16,034][39m Trial 55 finished with value: 0.8648648648648648 and parameters: {'objective': 'CrossEntropy', 'colsample_bylevel': 0.09440372368252198, 'depth': 12, 'boosting_type': 'Ordered', 'bootstrap_type': 'Bayesian', 'bagging_temperature': 7.244431167649354}. Best is trial 21 with value: 0.8771929824561403.
[32m[I 2023-04-26 11:22:22,067][39m Trial 56 finished with value: 0.8545454545454546 and parameters: {'objective': 'CrossEntropy', 'colsample_bylevel': 0.09060934671611354, 'depth': 9, 'boosting_type': 'Ordered', 'bootstrap_type': 'Bayesian', 'bagging_temperature': 6.070497884721952}. Best is trial 21 with value: 0.8771929824561403.
[32m[I 2023-04-26 11:22:24,948][39m Trial 57 finished with value: 0.8196721311475409 and parameters: {'objective': 'CrossEntropy', 'colsample_bylevel': 0.010938110560052484, 'depth': 8, 'boosting_type': 'Ordered', 'bootstrap_type': 'Bernoulli', 'subsample': 0.3900471367820174}. Best is trial 21 with value: 0.8771929824561403.
[32m[I 2023-04-26 11:22:27,670][39m Trial 58 finished with value: 0.8347826086956522 and parameters: {'objective': 'CrossEntropy', 'colsample_bylevel': 0.08409349444445058, 'depth': 10, 'boosting_type': 'Ordered', 'bootstrap_type': 'MVS'}. Best is trial 21 with value: 0.8771929824561403.
[32m[I 2023-04-26 11:22:29,302][39m Trial 59 finished with value: 0.8571428571428572 and parameters: {'objective': 'CrossEntropy', 'colsample_bylevel': 0.06894326203750513, 'depth': 11, 'boosting_type': 'Plain', 'bootstrap_type': 'Bayesian', 'bagging_temperature': 6.790556881499444}. Best is trial 21 with value: 0.8771929824561403.
[32m[I 2023-04-26 11:22:33,354][39m Trial 60 finished with value: 0.831858407079646 and parameters: {'objective': 'CrossEntropy', 'colsample_bylevel': 0.06399769068613444, 'depth': 11, 'boosting_type': 'Ordered', 'bootstrap_type': 'Bayesian', 'bagging_temperature': 2.6037941758796803}. Best is trial 21 with value: 0.8771929824561403.
[32m[I 2023-04-26 11:22:44,584][39m Trial 61 finished with value: 0.875 and parameters: {'objective': 'CrossEntropy', 'colsample_bylevel': 0.09477690941911121, 'depth': 12, 'boosting_type': 'Ordered', 'bootstrap_type': 'Bayesian', 'bagging_temperature': 6.646188989560695}. Best is trial 21 with value: 0.8771929824561403.
[32m[I 2023-04-26 11:22:56,448][39m Trial 62 finished with value: 0.8571428571428572 and parameters: {'objective': 'CrossEntropy', 'colsample_bylevel': 0.09419926456375384, 'depth': 12, 'boosting_type': 'Ordered', 'bootstrap_type': 'Bayesian', 'bagging_temperature': 7.216539219589816}. Best is trial 21 with value: 0.8771929824561403.
[32m[I 2023-04-26 11:23:03,230][39m Trial 63 finished with value: 0.8521739130434783 and parameters: {'objective': 'CrossEntropy', 'colsample_bylevel': 0.08726968231616845, 'depth': 12, 'boosting_type': 'Ordered', 'bootstrap_type': 'Bayesian', 'bagging_temperature': 7.860129766347687}. Best is trial 21 with value: 0.8771929824561403.
[32m[I 2023-04-26 11:23:11,493][39m Trial 64 finished with value: 0.8648648648648648 and parameters: {'objective': 'CrossEntropy', 'colsample_bylevel': 0.09723341300243991, 'depth': 11, 'boosting_type': 'Ordered', 'bootstrap_type': 'Bayesian', 'bagging_temperature': 6.271480496399203}. Best is trial 21 with value: 0.8771929824561403.
[32m[I 2023-04-26 11:23:18,690][39m Trial 65 finished with value: 0.8545454545454546 and parameters: {'objective': 'CrossEntropy', 'colsample_bylevel': 0.09219411566695197, 'depth': 10, 'boosting_type': 'Ordered', 'bootstrap_type': 'Bayesian', 'bagging_temperature': 5.261288119209741}. Best is trial 21 with value: 0.8771929824561403.
