[32m[I 2023-04-26 14:57:22,750][39m A new study created in memory with name: no-name-9713fe35-d96b-4e40-9ba5-6cc658ad338f
[32m[I 2023-04-26 14:57:22,866][39m Trial 0 finished with value: 0.6605504587155964 and parameters: {'criterion': 'gini', 'n_estimators': 168, 'max_features': 0.5510190385257874, 'max_depth': 1, 'min_samples_split': 7, 'min_samples_leaf': 3}. Best is trial 0 with value: 0.6605504587155964.
[32m[I 2023-04-26 14:57:23,045][39m Trial 1 finished with value: 0.8222222222222222 and parameters: {'criterion': 'entropy', 'n_estimators': 184, 'max_features': 0.8637100897496816, 'max_depth': 33, 'min_samples_split': 5, 'min_samples_leaf': 4}. Best is trial 1 with value: 0.8222222222222222.
[32m[I 2023-04-26 14:57:23,175][39m Trial 2 finished with value: 0.7356321839080461 and parameters: {'criterion': 'gini', 'n_estimators': 158, 'max_features': 0.9062960067468304, 'max_depth': 74, 'min_samples_split': 7, 'min_samples_leaf': 11}. Best is trial 1 with value: 0.8222222222222222.
[32m[I 2023-04-26 14:57:23,305][39m Trial 3 finished with value: 0.761904761904762 and parameters: {'criterion': 'gini', 'n_estimators': 197, 'max_features': 0.000584010226768239, 'max_depth': 63, 'min_samples_split': 8, 'min_samples_leaf': 6}. Best is trial 1 with value: 0.8222222222222222.
[32m[I 2023-04-26 14:57:23,405][39m Trial 4 finished with value: 0.7441860465116279 and parameters: {'criterion': 'entropy', 'n_estimators': 151, 'max_features': 0.12839604171689656, 'max_depth': 41, 'min_samples_split': 3, 'min_samples_leaf': 11}. Best is trial 1 with value: 0.8222222222222222.
[32m[I 2023-04-26 14:57:23,483][39m Trial 5 finished with value: 0.8192771084337348 and parameters: {'criterion': 'gini', 'n_estimators': 88, 'max_features': 0.790837325656556, 'max_depth': 8, 'min_samples_split': 2, 'min_samples_leaf': 1}. Best is trial 1 with value: 0.8222222222222222.
[32m[I 2023-04-26 14:57:23,524][39m Trial 6 finished with value: 0.7529411764705882 and parameters: {'criterion': 'gini', 'n_estimators': 51, 'max_features': 0.36579849971237355, 'max_depth': 31, 'min_samples_split': 7, 'min_samples_leaf': 9}. Best is trial 1 with value: 0.8222222222222222.
[32m[I 2023-04-26 14:57:23,684][39m Trial 7 finished with value: 0.7764705882352942 and parameters: {'criterion': 'gini', 'n_estimators': 195, 'max_features': 0.8368597996026191, 'max_depth': 101, 'min_samples_split': 5, 'min_samples_leaf': 6}. Best is trial 1 with value: 0.8222222222222222.
[32m[I 2023-04-26 14:57:23,791][39m Trial 8 finished with value: 0.7586206896551724 and parameters: {'criterion': 'gini', 'n_estimators': 128, 'max_features': 0.8679693687163028, 'max_depth': 83, 'min_samples_split': 5, 'min_samples_leaf': 11}. Best is trial 1 with value: 0.8222222222222222.
[32m[I 2023-04-26 14:57:23,887][39m Trial 9 finished with value: 0.7500000000000001 and parameters: {'criterion': 'gini', 'n_estimators': 123, 'max_features': 0.6345728946795529, 'max_depth': 13, 'min_samples_split': 4, 'min_samples_leaf': 8}. Best is trial 1 with value: 0.8222222222222222.
[32m[I 2023-04-26 14:57:23,981][39m Trial 10 finished with value: 0.8192771084337348 and parameters: {'criterion': 'entropy', 'n_estimators': 107, 'max_features': 0.3876247002762012, 'max_depth': 30, 'min_samples_split': 11, 'min_samples_leaf': 4}. Best is trial 1 with value: 0.8222222222222222.
[32m[I 2023-04-26 14:57:24,067][39m Trial 11 finished with value: 0.8157894736842105 and parameters: {'criterion': 'entropy', 'n_estimators': 78, 'max_features': 0.9902089686324129, 'max_depth': 18, 'min_samples_split': 2, 'min_samples_leaf': 1}. Best is trial 1 with value: 0.8222222222222222.
[32m[I 2023-04-26 14:57:24,155][39m Trial 12 finished with value: 0.8205128205128206 and parameters: {'criterion': 'entropy', 'n_estimators': 87, 'max_features': 0.6903643653953907, 'max_depth': 49, 'min_samples_split': 2, 'min_samples_leaf': 1}. Best is trial 1 with value: 0.8222222222222222.
[32m[I 2023-04-26 14:57:24,232][39m Trial 13 finished with value: 0.8965517241379309 and parameters: {'criterion': 'entropy', 'n_estimators': 74, 'max_features': 0.6927180409314185, 'max_depth': 53, 'min_samples_split': 5, 'min_samples_leaf': 3}. Best is trial 13 with value: 0.8965517241379309.
[32m[I 2023-04-26 14:57:24,296][39m Trial 14 finished with value: 0.8505747126436782 and parameters: {'criterion': 'entropy', 'n_estimators': 58, 'max_features': 0.7119140392486067, 'max_depth': 56, 'min_samples_split': 9, 'min_samples_leaf': 4}. Best is trial 13 with value: 0.8965517241379309.
[32m[I 2023-04-26 14:57:24,353][39m Trial 15 finished with value: 0.8192771084337348 and parameters: {'criterion': 'entropy', 'n_estimators': 60, 'max_features': 0.4275457487354821, 'max_depth': 60, 'min_samples_split': 10, 'min_samples_leaf': 3}. Best is trial 13 with value: 0.8965517241379309.
[32m[I 2023-04-26 14:57:24,425][39m Trial 16 finished with value: 0.8275862068965518 and parameters: {'criterion': 'entropy', 'n_estimators': 73, 'max_features': 0.677596329443116, 'max_depth': 55, 'min_samples_split': 9, 'min_samples_leaf': 5}. Best is trial 13 with value: 0.8965517241379309.
[32m[I 2023-04-26 14:57:24,509][39m Trial 17 finished with value: 0.8 and parameters: {'criterion': 'entropy', 'n_estimators': 100, 'max_features': 0.2592461352429695, 'max_depth': 72, 'min_samples_split': 9, 'min_samples_leaf': 3}. Best is trial 13 with value: 0.8965517241379309.
[32m[I 2023-04-26 14:57:24,574][39m Trial 18 finished with value: 0.7954545454545454 and parameters: {'criterion': 'entropy', 'n_estimators': 60, 'max_features': 0.7398137181757138, 'max_depth': 87, 'min_samples_split': 6, 'min_samples_leaf': 7}. Best is trial 13 with value: 0.8965517241379309.
[32m[I 2023-04-26 14:57:24,691][39m Trial 19 finished with value: 0.8048780487804877 and parameters: {'criterion': 'entropy', 'n_estimators': 121, 'max_features': 0.5851373195595498, 'max_depth': 47, 'min_samples_split': 11, 'min_samples_leaf': 2}. Best is trial 13 with value: 0.8965517241379309.
[32m[I 2023-04-26 14:57:24,758][39m Trial 20 finished with value: 0.8275862068965518 and parameters: {'criterion': 'entropy', 'n_estimators': 65, 'max_features': 0.48458077649773323, 'max_depth': 69, 'min_samples_split': 9, 'min_samples_leaf': 5}. Best is trial 13 with value: 0.8965517241379309.
[32m[I 2023-04-26 14:57:24,828][39m Trial 21 finished with value: 0.8314606741573034 and parameters: {'criterion': 'entropy', 'n_estimators': 69, 'max_features': 0.4863181407018174, 'max_depth': 65, 'min_samples_split': 9, 'min_samples_leaf': 5}. Best is trial 13 with value: 0.8965517241379309.
[32m[I 2023-04-26 14:57:24,889][39m Trial 22 finished with value: 0.8333333333333333 and parameters: {'criterion': 'entropy', 'n_estimators': 50, 'max_features': 0.5297638425245302, 'max_depth': 43, 'min_samples_split': 8, 'min_samples_leaf': 5}. Best is trial 13 with value: 0.8965517241379309.
[32m[I 2023-04-26 14:57:24,941][39m Trial 23 finished with value: 0.8505747126436782 and parameters: {'criterion': 'entropy', 'n_estimators': 50, 'max_features': 0.5965729737964097, 'max_depth': 43, 'min_samples_split': 8, 'min_samples_leaf': 4}. Best is trial 13 with value: 0.8965517241379309.
[32m[I 2023-04-26 14:57:25,026][39m Trial 24 finished with value: 0.8409090909090909 and parameters: {'criterion': 'entropy', 'n_estimators': 84, 'max_features': 0.7563296961412551, 'max_depth': 55, 'min_samples_split': 6, 'min_samples_leaf': 4}. Best is trial 13 with value: 0.8965517241379309.
[32m[I 2023-04-26 14:57:25,121][39m Trial 25 finished with value: 0.8048780487804877 and parameters: {'criterion': 'entropy', 'n_estimators': 100, 'max_features': 0.6233340383209619, 'max_depth': 25, 'min_samples_split': 8, 'min_samples_leaf': 2}. Best is trial 13 with value: 0.8965517241379309.
[32m[I 2023-04-26 14:57:25,171][39m Trial 26 finished with value: 0.8048780487804877 and parameters: {'criterion': 'entropy', 'n_estimators': 52, 'max_features': 0.2957188530016629, 'max_depth': 39, 'min_samples_split': 10, 'min_samples_leaf': 2}. Best is trial 13 with value: 0.8965517241379309.
[32m[I 2023-04-26 14:57:25,245][39m Trial 27 finished with value: 0.8372093023255814 and parameters: {'criterion': 'entropy', 'n_estimators': 73, 'max_features': 0.7070946291281858, 'max_depth': 55, 'min_samples_split': 8, 'min_samples_leaf': 4}. Best is trial 13 with value: 0.8965517241379309.
[32m[I 2023-04-26 14:57:25,311][39m Trial 28 finished with value: 0.8275862068965518 and parameters: {'criterion': 'entropy', 'n_estimators': 61, 'max_features': 0.9481859640324302, 'max_depth': 38, 'min_samples_split': 4, 'min_samples_leaf': 6}. Best is trial 13 with value: 0.8965517241379309.
[32m[I 2023-04-26 14:57:25,400][39m Trial 29 finished with value: 0.8292682926829268 and parameters: {'criterion': 'entropy', 'n_estimators': 93, 'max_features': 0.5762324949254379, 'max_depth': 80, 'min_samples_split': 6, 'min_samples_leaf': 3}. Best is trial 13 with value: 0.8965517241379309.
[32m[I 2023-04-26 14:57:25,507][39m Trial 30 finished with value: 0.8045977011494252 and parameters: {'criterion': 'entropy', 'n_estimators': 111, 'max_features': 0.8000295167614396, 'max_depth': 48, 'min_samples_split': 10, 'min_samples_leaf': 7}. Best is trial 13 with value: 0.8965517241379309.
[32m[I 2023-04-26 14:57:25,587][39m Trial 31 finished with value: 0.8604651162790697 and parameters: {'criterion': 'entropy', 'n_estimators': 80, 'max_features': 0.7497105641926439, 'max_depth': 55, 'min_samples_split': 6, 'min_samples_leaf': 4}. Best is trial 13 with value: 0.8965517241379309.
[32m[I 2023-04-26 14:57:25,665][39m Trial 32 finished with value: 0.8372093023255814 and parameters: {'criterion': 'entropy', 'n_estimators': 80, 'max_features': 0.6383708458070882, 'max_depth': 59, 'min_samples_split': 7, 'min_samples_leaf': 3}. Best is trial 13 with value: 0.8965517241379309.
[32m[I 2023-04-26 14:57:25,731][39m Trial 33 finished with value: 0.8863636363636364 and parameters: {'criterion': 'entropy', 'n_estimators': 62, 'max_features': 0.754551465629445, 'max_depth': 52, 'min_samples_split': 5, 'min_samples_leaf': 4}. Best is trial 13 with value: 0.8965517241379309.
[32m[I 2023-04-26 14:57:25,805][39m Trial 34 finished with value: 0.8235294117647058 and parameters: {'criterion': 'entropy', 'n_estimators': 68, 'max_features': 0.8070616553399872, 'max_depth': 35, 'min_samples_split': 4, 'min_samples_leaf': 3}. Best is trial 13 with value: 0.8965517241379309.
[32m[I 2023-04-26 14:57:25,891][39m Trial 35 finished with value: 0.8292682926829268 and parameters: {'criterion': 'entropy', 'n_estimators': 78, 'max_features': 0.8742928131729597, 'max_depth': 65, 'min_samples_split': 5, 'min_samples_leaf': 2}. Best is trial 13 with value: 0.8965517241379309.
[32m[I 2023-04-26 14:57:25,985][39m Trial 36 finished with value: 0.8235294117647058 and parameters: {'criterion': 'entropy', 'n_estimators': 94, 'max_features': 0.7483194306584148, 'max_depth': 53, 'min_samples_split': 3, 'min_samples_leaf': 4}. Best is trial 13 with value: 0.8965517241379309.
[32m[I 2023-04-26 14:57:26,129][39m Trial 37 finished with value: 0.7764705882352942 and parameters: {'criterion': 'gini', 'n_estimators': 165, 'max_features': 0.9098897559941324, 'max_depth': 44, 'min_samples_split': 6, 'min_samples_leaf': 7}. Best is trial 13 with value: 0.8965517241379309.
[32m[I 2023-04-26 14:57:26,193][39m Trial 38 finished with value: 0.8470588235294119 and parameters: {'criterion': 'entropy', 'n_estimators': 62, 'max_features': 0.688090263206323, 'max_depth': 78, 'min_samples_split': 5, 'min_samples_leaf': 5}. Best is trial 13 with value: 0.8965517241379309.
[32m[I 2023-04-26 14:57:26,297][39m Trial 39 finished with value: 0.8048780487804877 and parameters: {'criterion': 'gini', 'n_estimators': 113, 'max_features': 0.8391610361434177, 'max_depth': 61, 'min_samples_split': 7, 'min_samples_leaf': 2}. Best is trial 13 with value: 0.8965517241379309.
[32m[I 2023-04-26 14:57:26,418][39m Trial 40 finished with value: 0.7954545454545454 and parameters: {'criterion': 'entropy', 'n_estimators': 138, 'max_features': 0.5370274120807975, 'max_depth': 27, 'min_samples_split': 4, 'min_samples_leaf': 6}. Best is trial 13 with value: 0.8965517241379309.
[32m[I 2023-04-26 14:57:26,479][39m Trial 41 finished with value: 0.8192771084337348 and parameters: {'criterion': 'entropy', 'n_estimators': 57, 'max_features': 0.6218074033928613, 'max_depth': 51, 'min_samples_split': 6, 'min_samples_leaf': 4}. Best is trial 13 with value: 0.8965517241379309.
[32m[I 2023-04-26 14:57:26,534][39m Trial 42 finished with value: 0.7906976744186047 and parameters: {'criterion': 'entropy', 'n_estimators': 50, 'max_features': 0.7643135339980351, 'max_depth': 44, 'min_samples_split': 8, 'min_samples_leaf': 4}. Best is trial 13 with value: 0.8965517241379309.
[32m[I 2023-04-26 14:57:26,607][39m Trial 43 finished with value: 0.8139534883720929 and parameters: {'criterion': 'entropy', 'n_estimators': 71, 'max_features': 0.719554026527867, 'max_depth': 68, 'min_samples_split': 5, 'min_samples_leaf': 4}. Best is trial 13 with value: 0.8965517241379309.
[32m[I 2023-04-26 14:57:26,772][39m Trial 44 finished with value: 0.8095238095238095 and parameters: {'criterion': 'entropy', 'n_estimators': 185, 'max_features': 0.6545810799110038, 'max_depth': 58, 'min_samples_split': 7, 'min_samples_leaf': 5}. Best is trial 13 with value: 0.8965517241379309.
[32m[I 2023-04-26 14:57:26,824][39m Trial 45 finished with value: 0.7640449438202247 and parameters: {'criterion': 'gini', 'n_estimators': 58, 'max_features': 0.03623421139425942, 'max_depth': 35, 'min_samples_split': 3, 'min_samples_leaf': 10}. Best is trial 13 with value: 0.8965517241379309.
[32m[I 2023-04-26 14:57:26,907][39m Trial 46 finished with value: 0.8505747126436782 and parameters: {'criterion': 'entropy', 'n_estimators': 77, 'max_features': 0.7830526181269188, 'max_depth': 51, 'min_samples_split': 4, 'min_samples_leaf': 3}. Best is trial 13 with value: 0.8965517241379309.
[32m[I 2023-04-26 14:57:26,975][39m Trial 47 finished with value: 0.8470588235294119 and parameters: {'criterion': 'entropy', 'n_estimators': 67, 'max_features': 0.5729521368939937, 'max_depth': 92, 'min_samples_split': 7, 'min_samples_leaf': 4}. Best is trial 13 with value: 0.8965517241379309.
[32m[I 2023-04-26 14:57:27,059][39m Trial 48 finished with value: 0.7999999999999999 and parameters: {'criterion': 'gini', 'n_estimators': 85, 'max_features': 0.9021971659711845, 'max_depth': 50, 'min_samples_split': 4, 'min_samples_leaf': 3}. Best is trial 13 with value: 0.8965517241379309.
[32m[I 2023-04-26 14:57:27,209][39m Trial 49 finished with value: 0.8051948051948052 and parameters: {'criterion': 'entropy', 'n_estimators': 148, 'max_features': 0.8275268371420432, 'max_depth': 73, 'min_samples_split': 3, 'min_samples_leaf': 1}. Best is trial 13 with value: 0.8965517241379309.
[32m[I 2023-04-26 14:57:27,293][39m Trial 50 finished with value: 0.8470588235294119 and parameters: {'criterion': 'entropy', 'n_estimators': 76, 'max_features': 0.9731880156167458, 'max_depth': 59, 'min_samples_split': 4, 'min_samples_leaf': 3}. Best is trial 13 with value: 0.8965517241379309.
[32m[I 2023-04-26 14:57:27,357][39m Trial 51 finished with value: 0.8372093023255814 and parameters: {'criterion': 'entropy', 'n_estimators': 57, 'max_features': 0.776229131012649, 'max_depth': 47, 'min_samples_split': 5, 'min_samples_leaf': 3}. Best is trial 13 with value: 0.8965517241379309.
[32m[I 2023-04-26 14:57:27,453][39m Trial 52 finished with value: 0.7749999999999999 and parameters: {'criterion': 'entropy', 'n_estimators': 95, 'max_features': 0.6667139484994631, 'max_depth': 41, 'min_samples_split': 5, 'min_samples_leaf': 2}. Best is trial 13 with value: 0.8965517241379309.
[32m[I 2023-04-26 14:57:27,523][39m Trial 53 finished with value: 0.6909090909090908 and parameters: {'criterion': 'entropy', 'n_estimators': 80, 'max_features': 0.7184770312659164, 'max_depth': 2, 'min_samples_split': 6, 'min_samples_leaf': 5}. Best is trial 13 with value: 0.8965517241379309.
[32m[I 2023-04-26 14:57:27,589][39m Trial 54 finished with value: 0.8192771084337348 and parameters: {'criterion': 'entropy', 'n_estimators': 65, 'max_features': 0.5956804008770981, 'max_depth': 63, 'min_samples_split': 9, 'min_samples_leaf': 4}. Best is trial 13 with value: 0.8965517241379309.
[32m[I 2023-04-26 14:57:27,650][39m Trial 55 finished with value: 0.8275862068965518 and parameters: {'criterion': 'entropy', 'n_estimators': 55, 'max_features': 0.8563308311937251, 'max_depth': 55, 'min_samples_split': 10, 'min_samples_leaf': 6}. Best is trial 13 with value: 0.8965517241379309.
[32m[I 2023-04-26 14:57:27,718][39m Trial 56 finished with value: 0.8192771084337348 and parameters: {'criterion': 'entropy', 'n_estimators': 72, 'max_features': 0.43609649542711176, 'max_depth': 45, 'min_samples_split': 5, 'min_samples_leaf': 3}. Best is trial 13 with value: 0.8965517241379309.
[32m[I 2023-04-26 14:57:27,808][39m Trial 57 finished with value: 0.8275862068965518 and parameters: {'criterion': 'entropy', 'n_estimators': 89, 'max_features': 0.7972620085616159, 'max_depth': 52, 'min_samples_split': 8, 'min_samples_leaf': 4}. Best is trial 13 with value: 0.8965517241379309.
[32m[I 2023-04-26 14:57:27,876][39m Trial 58 finished with value: 0.8372093023255814 and parameters: {'criterion': 'entropy', 'n_estimators': 64, 'max_features': 0.728557256664693, 'max_depth': 68, 'min_samples_split': 3, 'min_samples_leaf': 5}. Best is trial 13 with value: 0.8965517241379309.
[32m[I 2023-04-26 14:57:27,955][39m Trial 59 finished with value: 0.7594936708860759 and parameters: {'criterion': 'gini', 'n_estimators': 84, 'max_features': 0.6800352554082494, 'max_depth': 20, 'min_samples_split': 5, 'min_samples_leaf': 2}. Best is trial 13 with value: 0.8965517241379309.
[32m[I 2023-04-26 14:57:28,029][39m Trial 60 finished with value: 0.8604651162790697 and parameters: {'criterion': 'entropy', 'n_estimators': 75, 'max_features': 0.6098693718321915, 'max_depth': 31, 'min_samples_split': 6, 'min_samples_leaf': 3}. Best is trial 13 with value: 0.8965517241379309.
[32m[I 2023-04-26 14:57:28,104][39m Trial 61 finished with value: 0.8604651162790697 and parameters: {'criterion': 'entropy', 'n_estimators': 76, 'max_features': 0.610219032367192, 'max_depth': 29, 'min_samples_split': 6, 'min_samples_leaf': 3}. Best is trial 13 with value: 0.8965517241379309.
[32m[I 2023-04-26 14:57:28,181][39m Trial 62 finished with value: 0.8372093023255814 and parameters: {'criterion': 'entropy', 'n_estimators': 78, 'max_features': 0.6182203850675957, 'max_depth': 21, 'min_samples_split': 6, 'min_samples_leaf': 3}. Best is trial 13 with value: 0.8965517241379309.
[32m[I 2023-04-26 14:57:28,275][39m Trial 63 finished with value: 0.8192771084337348 and parameters: {'criterion': 'entropy', 'n_estimators': 101, 'max_features': 0.5224024589683546, 'max_depth': 14, 'min_samples_split': 6, 'min_samples_leaf': 3}. Best is trial 13 with value: 0.8965517241379309.
[32m[I 2023-04-26 14:57:28,362][39m Trial 64 finished with value: 0.8395061728395061 and parameters: {'criterion': 'entropy', 'n_estimators': 90, 'max_features': 0.5546770012021417, 'max_depth': 33, 'min_samples_split': 7, 'min_samples_leaf': 2}. Best is trial 13 with value: 0.8965517241379309.
[32m[I 2023-04-26 14:57:28,442][39m Trial 65 finished with value: 0.7692307692307694 and parameters: {'criterion': 'entropy', 'n_estimators': 72, 'max_features': 0.6993628096324294, 'max_depth': 30, 'min_samples_split': 6, 'min_samples_leaf': 1}. Best is trial 13 with value: 0.8965517241379309.
[32m[I 2023-04-26 14:57:28,520][39m Trial 66 finished with value: 0.8433734939759037 and parameters: {'criterion': 'entropy', 'n_estimators': 82, 'max_features': 0.5001124892932275, 'max_depth': 25, 'min_samples_split': 4, 'min_samples_leaf': 3}. Best is trial 13 with value: 0.8965517241379309.
[32m[I 2023-04-26 14:57:28,596][39m Trial 67 finished with value: 0.8235294117647058 and parameters: {'criterion': 'entropy', 'n_estimators': 75, 'max_features': 0.6496874990339299, 'max_depth': 38, 'min_samples_split': 5, 'min_samples_leaf': 4}. Best is trial 13 with value: 0.8965517241379309.
[32m[I 2023-04-26 14:57:28,664][39m Trial 68 finished with value: 0.8192771084337348 and parameters: {'criterion': 'entropy', 'n_estimators': 68, 'max_features': 0.5944373182531284, 'max_depth': 41, 'min_samples_split': 7, 'min_samples_leaf': 2}. Best is trial 13 with value: 0.8965517241379309.
[32m[I 2023-04-26 14:57:28,729][39m Trial 69 finished with value: 0.8333333333333333 and parameters: {'criterion': 'entropy', 'n_estimators': 61, 'max_features': 0.7671347174359407, 'max_depth': 56, 'min_samples_split': 11, 'min_samples_leaf': 3}. Best is trial 13 with value: 0.8965517241379309.
[32m[I 2023-04-26 14:57:28,779][39m Trial 70 finished with value: 0.7951807228915663 and parameters: {'criterion': 'entropy', 'n_estimators': 50, 'max_features': 0.45632533660230856, 'max_depth': 28, 'min_samples_split': 9, 'min_samples_leaf': 5}. Best is trial 13 with value: 0.8965517241379309.
[32m[I 2023-04-26 14:57:28,845][39m Trial 71 finished with value: 0.8235294117647058 and parameters: {'criterion': 'entropy', 'n_estimators': 55, 'max_features': 0.6778238187351344, 'max_depth': 47, 'min_samples_split': 6, 'min_samples_leaf': 4}. Best is trial 13 with value: 0.8965517241379309.
[32m[I 2023-04-26 14:57:28,915][39m Trial 72 finished with value: 0.8764044943820225 and parameters: {'criterion': 'entropy', 'n_estimators': 66, 'max_features': 0.7373828118343067, 'max_depth': 50, 'min_samples_split': 5, 'min_samples_leaf': 4}. Best is trial 13 with value: 0.8965517241379309.
