[32m[I 2023-04-26 14:57:34,979][39m Trial 146 finished with value: 0.8192771084337348 and parameters: {'criterion': 'entropy', 'n_estimators': 71, 'max_features': 0.677233597783514, 'max_depth': 25, 'min_samples_split': 6, 'min_samples_leaf': 4}. Best is trial 13 with value: 0.8965517241379309.
[32m[I 2023-04-26 14:57:35,059][39m Trial 147 finished with value: 0.8235294117647058 and parameters: {'criterion': 'entropy', 'n_estimators': 80, 'max_features': 0.6451499661419606, 'max_depth': 44, 'min_samples_split': 8, 'min_samples_leaf': 4}. Best is trial 13 with value: 0.8965517241379309.
[32m[I 2023-04-26 14:57:35,127][39m Trial 148 finished with value: 0.7951807228915663 and parameters: {'criterion': 'entropy', 'n_estimators': 60, 'max_features': 0.6991191732645148, 'max_depth': 56, 'min_samples_split': 5, 'min_samples_leaf': 5}. Best is trial 13 with value: 0.8965517241379309.
[32m[I 2023-04-26 14:57:35,213][39m Trial 149 finished with value: 0.8372093023255814 and parameters: {'criterion': 'gini', 'n_estimators': 87, 'max_features': 0.6573957511303741, 'max_depth': 53, 'min_samples_split': 7, 'min_samples_leaf': 4}. Best is trial 13 with value: 0.8965517241379309.
[32m[I 2023-04-26 14:57:35,282][39m Trial 150 finished with value: 0.8192771084337348 and parameters: {'criterion': 'entropy', 'n_estimators': 65, 'max_features': 0.6217898637189392, 'max_depth': 47, 'min_samples_split': 10, 'min_samples_leaf': 4}. Best is trial 13 with value: 0.8965517241379309.
[32m[I 2023-04-26 14:57:35,348][39m Trial 151 finished with value: 0.8275862068965518 and parameters: {'criterion': 'entropy', 'n_estimators': 58, 'max_features': 0.7111476249526928, 'max_depth': 61, 'min_samples_split': 10, 'min_samples_leaf': 4}. Best is trial 13 with value: 0.8965517241379309.
[32m[I 2023-04-26 14:57:35,436][39m Trial 152 finished with value: 0.8470588235294119 and parameters: {'criterion': 'entropy', 'n_estimators': 71, 'max_features': 0.7321429401224651, 'max_depth': 35, 'min_samples_split': 11, 'min_samples_leaf': 3}. Best is trial 13 with value: 0.8965517241379309.
[32m[I 2023-04-26 14:57:35,516][39m Trial 153 finished with value: 0.7999999999999999 and parameters: {'criterion': 'entropy', 'n_estimators': 76, 'max_features': 0.5779305757015809, 'max_depth': 44, 'min_samples_split': 7, 'min_samples_leaf': 4}. Best is trial 13 with value: 0.8965517241379309.
[32m[I 2023-04-26 14:57:35,592][39m Trial 154 finished with value: 0.8048780487804877 and parameters: {'criterion': 'entropy', 'n_estimators': 70, 'max_features': 0.6837738549912012, 'max_depth': 32, 'min_samples_split': 11, 'min_samples_leaf': 3}. Best is trial 13 with value: 0.8965517241379309.
[32m[I 2023-04-26 14:57:35,657][39m Trial 155 finished with value: 0.7857142857142858 and parameters: {'criterion': 'entropy', 'n_estimators': 62, 'max_features': 0.5154030851307245, 'max_depth': 58, 'min_samples_split': 9, 'min_samples_leaf': 5}. Best is trial 13 with value: 0.8965517241379309.
[32m[I 2023-04-26 14:57:35,739][39m Trial 156 finished with value: 0.8636363636363636 and parameters: {'criterion': 'entropy', 'n_estimators': 74, 'max_features': 0.7797399290913147, 'max_depth': 37, 'min_samples_split': 11, 'min_samples_leaf': 3}. Best is trial 13 with value: 0.8965517241379309.
[32m[I 2023-04-26 14:57:35,829][39m Trial 157 finished with value: 0.8470588235294119 and parameters: {'criterion': 'entropy', 'n_estimators': 84, 'max_features': 0.7517230339832469, 'max_depth': 40, 'min_samples_split': 5, 'min_samples_leaf': 3}. Best is trial 13 with value: 0.8965517241379309.
[32m[I 2023-04-26 14:57:35,907][39m Trial 158 finished with value: 0.7948717948717948 and parameters: {'criterion': 'entropy', 'n_estimators': 77, 'max_features': 0.6084355610130759, 'max_depth': 51, 'min_samples_split': 6, 'min_samples_leaf': 2}. Best is trial 13 with value: 0.8965517241379309.
[32m[I 2023-04-26 14:57:35,991][39m Trial 159 finished with value: 0.7951807228915663 and parameters: {'criterion': 'entropy', 'n_estimators': 81, 'max_features': 0.652262364476009, 'max_depth': 49, 'min_samples_split': 10, 'min_samples_leaf': 3}. Best is trial 13 with value: 0.8965517241379309.
[32m[I 2023-04-26 14:57:36,057][39m Trial 160 finished with value: 0.7912087912087912 and parameters: {'criterion': 'entropy', 'n_estimators': 67, 'max_features': 0.6900725355012534, 'max_depth': 5, 'min_samples_split': 10, 'min_samples_leaf': 4}. Best is trial 13 with value: 0.8965517241379309.
[32m[I 2023-04-26 14:57:36,129][39m Trial 161 finished with value: 0.8333333333333333 and parameters: {'criterion': 'entropy', 'n_estimators': 65, 'max_features': 0.7128093097580069, 'max_depth': 55, 'min_samples_split': 8, 'min_samples_leaf': 4}. Best is trial 13 with value: 0.8965517241379309.
[32m[I 2023-04-26 14:57:36,209][39m Trial 162 finished with value: 0.8372093023255814 and parameters: {'criterion': 'entropy', 'n_estimators': 73, 'max_features': 0.7940104635192685, 'max_depth': 34, 'min_samples_split': 11, 'min_samples_leaf': 3}. Best is trial 13 with value: 0.8965517241379309.
[32m[I 2023-04-26 14:57:36,268][39m Trial 163 finished with value: 0.7999999999999999 and parameters: {'criterion': 'entropy', 'n_estimators': 55, 'max_features': 0.5905587553838789, 'max_depth': 42, 'min_samples_split': 8, 'min_samples_leaf': 4}. Best is trial 13 with value: 0.8965517241379309.
[32m[I 2023-04-26 14:57:36,349][39m Trial 164 finished with value: 0.7951807228915663 and parameters: {'criterion': 'entropy', 'n_estimators': 77, 'max_features': 0.7690142909837256, 'max_depth': 52, 'min_samples_split': 4, 'min_samples_leaf': 3}. Best is trial 13 with value: 0.8965517241379309.
[32m[I 2023-04-26 14:57:36,431][39m Trial 165 finished with value: 0.8139534883720929 and parameters: {'criterion': 'entropy', 'n_estimators': 73, 'max_features': 0.8167142071848431, 'max_depth': 27, 'min_samples_split': 11, 'min_samples_leaf': 3}. Best is trial 13 with value: 0.8965517241379309.
[32m[I 2023-04-26 14:57:36,515][39m Trial 166 finished with value: 0.8235294117647058 and parameters: {'criterion': 'entropy', 'n_estimators': 80, 'max_features': 0.6403464967303728, 'max_depth': 46, 'min_samples_split': 9, 'min_samples_leaf': 4}. Best is trial 13 with value: 0.8965517241379309.
[32m[I 2023-04-26 14:57:36,597][39m Trial 167 finished with value: 0.7901234567901235 and parameters: {'criterion': 'entropy', 'n_estimators': 75, 'max_features': 0.7404905772122756, 'max_depth': 50, 'min_samples_split': 5, 'min_samples_leaf': 2}. Best is trial 13 with value: 0.8965517241379309.
[32m[I 2023-04-26 14:57:36,677][39m Trial 168 finished with value: 0.8314606741573034 and parameters: {'criterion': 'entropy', 'n_estimators': 70, 'max_features': 0.7891504464656232, 'max_depth': 38, 'min_samples_split': 11, 'min_samples_leaf': 3}. Best is trial 13 with value: 0.8965517241379309.
[32m[I 2023-04-26 14:57:36,765][39m Trial 169 finished with value: 0.8333333333333333 and parameters: {'criterion': 'entropy', 'n_estimators': 84, 'max_features': 0.6671566516720275, 'max_depth': 93, 'min_samples_split': 3, 'min_samples_leaf': 3}. Best is trial 13 with value: 0.8965517241379309.
[32m[I 2023-04-26 14:57:36,840][39m Trial 170 finished with value: 0.8048780487804877 and parameters: {'criterion': 'entropy', 'n_estimators': 53, 'max_features': 0.5417107242629179, 'max_depth': 44, 'min_samples_split': 7, 'min_samples_leaf': 4}. Best is trial 13 with value: 0.8965517241379309.
[32m[I 2023-04-26 14:57:36,926][39m Trial 171 finished with value: 0.8505747126436782 and parameters: {'criterion': 'entropy', 'n_estimators': 78, 'max_features': 0.7238436919324303, 'max_depth': 54, 'min_samples_split': 5, 'min_samples_leaf': 4}. Best is trial 13 with value: 0.8965517241379309.
[32m[I 2023-04-26 14:57:37,002][39m Trial 172 finished with value: 0.8048780487804877 and parameters: {'criterion': 'entropy', 'n_estimators': 69, 'max_features': 0.763748714092804, 'max_depth': 31, 'min_samples_split': 2, 'min_samples_leaf': 3}. Best is trial 13 with value: 0.8965517241379309.
[32m[I 2023-04-26 14:57:37,087][39m Trial 173 finished with value: 0.8333333333333333 and parameters: {'criterion': 'entropy', 'n_estimators': 79, 'max_features': 0.7237654519169886, 'max_depth': 54, 'min_samples_split': 5, 'min_samples_leaf': 4}. Best is trial 13 with value: 0.8965517241379309.
[32m[I 2023-04-26 14:57:37,158][39m Trial 174 finished with value: 0.8045977011494252 and parameters: {'criterion': 'entropy', 'n_estimators': 65, 'max_features': 0.7024106277426605, 'max_depth': 57, 'min_samples_split': 4, 'min_samples_leaf': 4}. Best is trial 13 with value: 0.8965517241379309.
[32m[I 2023-04-26 14:57:37,229][39m Trial 175 finished with value: 0.8604651162790697 and parameters: {'criterion': 'entropy', 'n_estimators': 62, 'max_features': 0.6874059875996419, 'max_depth': 48, 'min_samples_split': 6, 'min_samples_leaf': 4}. Best is trial 13 with value: 0.8965517241379309.
[32m[I 2023-04-26 14:57:37,295][39m Trial 176 finished with value: 0.8235294117647058 and parameters: {'criterion': 'entropy', 'n_estimators': 62, 'max_features': 0.6086176499330459, 'max_depth': 48, 'min_samples_split': 6, 'min_samples_leaf': 5}. Best is trial 13 with value: 0.8965517241379309.
[32m[I 2023-04-26 14:57:37,359][39m Trial 177 finished with value: 0.7906976744186047 and parameters: {'criterion': 'gini', 'n_estimators': 61, 'max_features': 0.6820680096716472, 'max_depth': 52, 'min_samples_split': 6, 'min_samples_leaf': 4}. Best is trial 13 with value: 0.8965517241379309.
[32m[I 2023-04-26 14:57:37,441][39m Trial 178 finished with value: 0.8433734939759037 and parameters: {'criterion': 'entropy', 'n_estimators': 73, 'max_features': 0.7453962368990745, 'max_depth': 39, 'min_samples_split': 11, 'min_samples_leaf': 3}. Best is trial 13 with value: 0.8965517241379309.
[32m[I 2023-04-26 14:57:37,504][39m Trial 179 finished with value: 0.8045977011494252 and parameters: {'criterion': 'entropy', 'n_estimators': 57, 'max_features': 0.6157586146695775, 'max_depth': 47, 'min_samples_split': 6, 'min_samples_leaf': 7}. Best is trial 13 with value: 0.8965517241379309.
[32m[I 2023-04-26 14:57:37,578][39m Trial 180 finished with value: 0.8235294117647058 and parameters: {'criterion': 'entropy', 'n_estimators': 67, 'max_features': 0.6525726942331561, 'max_depth': 50, 'min_samples_split': 6, 'min_samples_leaf': 4}. Best is trial 13 with value: 0.8965517241379309.
[32m[I 2023-04-26 14:57:37,653][39m Trial 181 finished with value: 0.8470588235294119 and parameters: {'criterion': 'entropy', 'n_estimators': 70, 'max_features': 0.6357371920552674, 'max_depth': 45, 'min_samples_split': 7, 'min_samples_leaf': 4}. Best is trial 13 with value: 0.8965517241379309.
[32m[I 2023-04-26 14:57:37,733][39m Trial 182 finished with value: 0.8372093023255814 and parameters: {'criterion': 'entropy', 'n_estimators': 76, 'max_features': 0.7215075668635735, 'max_depth': 54, 'min_samples_split': 5, 'min_samples_leaf': 4}. Best is trial 13 with value: 0.8965517241379309.
[32m[I 2023-04-26 14:57:37,802][39m Trial 183 finished with value: 0.8372093023255814 and parameters: {'criterion': 'entropy', 'n_estimators': 65, 'max_features': 0.6641018666797543, 'max_depth': 37, 'min_samples_split': 10, 'min_samples_leaf': 4}. Best is trial 13 with value: 0.8965517241379309.
[32m[I 2023-04-26 14:57:37,868][39m Trial 184 finished with value: 0.8139534883720929 and parameters: {'criterion': 'entropy', 'n_estimators': 59, 'max_features': 0.6995655415801867, 'max_depth': 59, 'min_samples_split': 5, 'min_samples_leaf': 4}. Best is trial 13 with value: 0.8965517241379309.
[32m[I 2023-04-26 14:57:37,948][39m Trial 185 finished with value: 0.8505747126436782 and parameters: {'criterion': 'entropy', 'n_estimators': 72, 'max_features': 0.7800340606194647, 'max_depth': 48, 'min_samples_split': 11, 'min_samples_leaf': 3}. Best is trial 13 with value: 0.8965517241379309.
[32m[I 2023-04-26 14:57:38,004][39m Trial 186 finished with value: 0.8048780487804877 and parameters: {'criterion': 'entropy', 'n_estimators': 51, 'max_features': 0.5765054693178164, 'max_depth': 42, 'min_samples_split': 10, 'min_samples_leaf': 3}. Best is trial 13 with value: 0.8965517241379309.
[32m[I 2023-04-26 14:57:38,073][39m Trial 187 finished with value: 0.8470588235294119 and parameters: {'criterion': 'entropy', 'n_estimators': 63, 'max_features': 0.7544171635466146, 'max_depth': 48, 'min_samples_split': 9, 'min_samples_leaf': 4}. Best is trial 13 with value: 0.8965517241379309.
[32m[I 2023-04-26 14:57:38,142][39m Trial 188 finished with value: 0.7500000000000001 and parameters: {'criterion': 'entropy', 'n_estimators': 68, 'max_features': 0.6805394498076746, 'max_depth': 10, 'min_samples_split': 11, 'min_samples_leaf': 8}. Best is trial 13 with value: 0.8965517241379309.
[32m[I 2023-04-26 14:57:38,207][39m Trial 189 finished with value: 0.8045977011494252 and parameters: {'criterion': 'entropy', 'n_estimators': 58, 'max_features': 0.6273823659748422, 'max_depth': 56, 'min_samples_split': 9, 'min_samples_leaf': 5}. Best is trial 13 with value: 0.8965517241379309.
[32m[I 2023-04-26 14:57:38,288][39m Trial 190 finished with value: 0.8372093023255814 and parameters: {'criterion': 'entropy', 'n_estimators': 82, 'max_features': 0.5597105436925454, 'max_depth': 45, 'min_samples_split': 6, 'min_samples_leaf': 4}. Best is trial 13 with value: 0.8965517241379309.
[32m[I 2023-04-26 14:57:38,371][39m Trial 191 finished with value: 0.8048780487804877 and parameters: {'criterion': 'entropy', 'n_estimators': 78, 'max_features': 0.7806028043491099, 'max_depth': 51, 'min_samples_split': 5, 'min_samples_leaf': 3}. Best is trial 13 with value: 0.8965517241379309.
[32m[I 2023-04-26 14:57:38,452][39m Trial 192 finished with value: 0.8470588235294119 and parameters: {'criterion': 'entropy', 'n_estimators': 74, 'max_features': 0.7996356708731323, 'max_depth': 49, 'min_samples_split': 6, 'min_samples_leaf': 3}. Best is trial 13 with value: 0.8965517241379309.
[32m[I 2023-04-26 14:57:38,515][39m Trial 193 finished with value: 0.8444444444444446 and parameters: {'criterion': 'entropy', 'n_estimators': 55, 'max_features': 0.7367588919889401, 'max_depth': 21, 'min_samples_split': 8, 'min_samples_leaf': 4}. Best is trial 13 with value: 0.8965517241379309.
[32m[I 2023-04-26 14:57:38,596][39m Trial 194 finished with value: 0.7710843373493976 and parameters: {'criterion': 'entropy', 'n_estimators': 76, 'max_features': 0.7112242539493181, 'max_depth': 53, 'min_samples_split': 5, 'min_samples_leaf': 4}. Best is trial 13 with value: 0.8965517241379309.
[32m[I 2023-04-26 14:57:38,677][39m Trial 195 finished with value: 0.8192771084337348 and parameters: {'criterion': 'entropy', 'n_estimators': 71, 'max_features': 0.8431079391544571, 'max_depth': 41, 'min_samples_split': 7, 'min_samples_leaf': 2}. Best is trial 13 with value: 0.8965517241379309.
[32m[I 2023-04-26 14:57:38,756][39m Trial 196 finished with value: 0.8292682926829268 and parameters: {'criterion': 'entropy', 'n_estimators': 79, 'max_features': 0.6023609421457048, 'max_depth': 51, 'min_samples_split': 4, 'min_samples_leaf': 4}. Best is trial 13 with value: 0.8965517241379309.
[32m[I 2023-04-26 14:57:38,828][39m Trial 197 finished with value: 0.8095238095238095 and parameters: {'criterion': 'entropy', 'n_estimators': 72, 'max_features': 0.4712321022052808, 'max_depth': 36, 'min_samples_split': 11, 'min_samples_leaf': 3}. Best is trial 13 with value: 0.8965517241379309.
[32m[I 2023-04-26 14:57:38,919][39m Trial 198 finished with value: 0.8192771084337348 and parameters: {'criterion': 'entropy', 'n_estimators': 86, 'max_features': 0.6567232522829604, 'max_depth': 53, 'min_samples_split': 5, 'min_samples_leaf': 4}. Best is trial 13 with value: 0.8965517241379309.
[32m[I 2023-04-26 14:57:39,004][39m Trial 199 finished with value: 0.8571428571428572 and parameters: {'criterion': 'entropy', 'n_estimators': 82, 'max_features': 0.6817341651329527, 'max_depth': 46, 'min_samples_split': 6, 'min_samples_leaf': 4}. Best is trial 13 with value: 0.8965517241379309.
[32m[I 2023-04-26 14:57:39,093][39m Trial 200 finished with value: 0.8505747126436782 and parameters: {'criterion': 'entropy', 'n_estimators': 89, 'max_features': 0.6782170722976013, 'max_depth': 46, 'min_samples_split': 6, 'min_samples_leaf': 4}. Best is trial 13 with value: 0.8965517241379309.
[32m[I 2023-04-26 14:57:39,176][39m Trial 201 finished with value: 0.8139534883720929 and parameters: {'criterion': 'entropy', 'n_estimators': 80, 'max_features': 0.7114963729959818, 'max_depth': 48, 'min_samples_split': 6, 'min_samples_leaf': 4}. Best is trial 13 with value: 0.8965517241379309.
[32m[I 2023-04-26 14:57:39,259][39m Trial 202 finished with value: 0.8139534883720929 and parameters: {'criterion': 'entropy', 'n_estimators': 75, 'max_features': 0.762072451808784, 'max_depth': 44, 'min_samples_split': 6, 'min_samples_leaf': 3}. Best is trial 13 with value: 0.8965517241379309.
[32m[I 2023-04-26 14:57:39,349][39m Trial 203 finished with value: 0.8045977011494252 and parameters: {'criterion': 'entropy', 'n_estimators': 83, 'max_features': 0.6946856842192821, 'max_depth': 55, 'min_samples_split': 6, 'min_samples_leaf': 4}. Best is trial 13 with value: 0.8965517241379309.
[32m[I 2023-04-26 14:57:39,430][39m Trial 204 finished with value: 0.8372093023255814 and parameters: {'criterion': 'entropy', 'n_estimators': 72, 'max_features': 0.8142732369073428, 'max_depth': 47, 'min_samples_split': 11, 'min_samples_leaf': 3}. Best is trial 13 with value: 0.8965517241379309.
[32m[I 2023-04-26 14:57:39,505][39m Trial 205 finished with value: 0.8235294117647058 and parameters: {'criterion': 'entropy', 'n_estimators': 68, 'max_features': 0.6362103281364613, 'max_depth': 43, 'min_samples_split': 7, 'min_samples_leaf': 3}. Best is trial 13 with value: 0.8965517241379309.
[32m[I 2023-04-26 14:57:39,586][39m Trial 206 finished with value: 0.8275862068965518 and parameters: {'criterion': 'entropy', 'n_estimators': 77, 'max_features': 0.7363684932231463, 'max_depth': 39, 'min_samples_split': 10, 'min_samples_leaf': 4}. Best is trial 13 with value: 0.8965517241379309.
[32m[I 2023-04-26 14:57:39,675][39m Trial 207 finished with value: 0.8372093023255814 and parameters: {'criterion': 'entropy', 'n_estimators': 85, 'max_features': 0.6679890758121954, 'max_depth': 49, 'min_samples_split': 6, 'min_samples_leaf': 4}. Best is trial 13 with value: 0.8965517241379309.
[32m[I 2023-04-26 14:57:39,752][39m Trial 208 finished with value: 0.8139534883720929 and parameters: {'criterion': 'entropy', 'n_estimators': 65, 'max_features': 0.7828139521999543, 'max_depth': 30, 'min_samples_split': 10, 'min_samples_leaf': 3}. Best is trial 13 with value: 0.8965517241379309.
[32m[I 2023-04-26 14:57:39,832][39m Trial 209 finished with value: 0.8048780487804877 and parameters: {'criterion': 'gini', 'n_estimators': 80, 'max_features': 0.5948180119901589, 'max_depth': 34, 'min_samples_split': 8, 'min_samples_leaf': 4}. Best is trial 13 with value: 0.8965517241379309.
[32m[I 2023-04-26 14:57:39,927][39m Trial 210 finished with value: 0.8235294117647058 and parameters: {'criterion': 'entropy', 'n_estimators': 91, 'max_features': 0.6730512475449401, 'max_depth': 47, 'min_samples_split': 6, 'min_samples_leaf': 4}. Best is trial 13 with value: 0.8965517241379309.
[32m[I 2023-04-26 14:57:40,009][39m Trial 211 finished with value: 0.8505747126436782 and parameters: {'criterion': 'entropy', 'n_estimators': 76, 'max_features': 0.7409141172853161, 'max_depth': 51, 'min_samples_split': 5, 'min_samples_leaf': 4}. Best is trial 13 with value: 0.8965517241379309.
[32m[I 2023-04-26 14:57:40,139][39m Trial 212 finished with value: 0.8505747126436782 and parameters: {'criterion': 'entropy', 'n_estimators': 132, 'max_features': 0.7553735901920078, 'max_depth': 52, 'min_samples_split': 5, 'min_samples_leaf': 4}. Best is trial 13 with value: 0.8965517241379309.
[32m[I 2023-04-26 14:57:40,221][39m Trial 213 finished with value: 0.8470588235294119 and parameters: {'criterion': 'entropy', 'n_estimators': 75, 'max_features': 0.7658771557281363, 'max_depth': 50, 'min_samples_split': 5, 'min_samples_leaf': 3}. Best is trial 13 with value: 0.8965517241379309.
[32m[I 2023-04-26 14:57:40,287][39m Trial 214 finished with value: 0.8372093023255814 and parameters: {'criterion': 'entropy', 'n_estimators': 61, 'max_features': 0.6904828252082937, 'max_depth': 46, 'min_samples_split': 6, 'min_samples_leaf': 4}. Best is trial 13 with value: 0.8965517241379309.
[32m[I 2023-04-26 14:57:40,417][39m Trial 215 finished with value: 0.7999999999999999 and parameters: {'criterion': 'entropy', 'n_estimators': 131, 'max_features': 0.7796373049976326, 'max_depth': 53, 'min_samples_split': 5, 'min_samples_leaf': 4}. Best is trial 13 with value: 0.8965517241379309.
[32m[I 2023-04-26 14:57:40,509][39m Trial 216 finished with value: 0.8539325842696629 and parameters: {'criterion': 'entropy', 'n_estimators': 88, 'max_features': 0.7007599266714226, 'max_depth': 58, 'min_samples_split': 6, 'min_samples_leaf': 4}. Best is trial 13 with value: 0.8965517241379309.
[32m[I 2023-04-26 14:57:40,638][39m Trial 217 finished with value: 0.7951807228915663 and parameters: {'criterion': 'entropy', 'n_estimators': 126, 'max_features': 0.8008956562115231, 'max_depth': 61, 'min_samples_split': 11, 'min_samples_leaf': 1}. Best is trial 13 with value: 0.8965517241379309.
[32m[I 2023-04-26 14:57:40,723][39m Trial 218 finished with value: 0.8372093023255814 and parameters: {'criterion': 'entropy', 'n_estimators': 83, 'max_features': 0.6841431975036717, 'max_depth': 57, 'min_samples_split': 6, 'min_samples_leaf': 5}. Best is trial 13 with value: 0.8965517241379309.
