[32m[I 2023-04-26 12:20:36,392][39m A new study created in memory with name: no-name-b60144a8-e2ef-4632-9783-f110208b20dc
[32m[I 2023-04-26 12:20:36,517][39m Trial 0 finished with value: 0.8521739130434783 and parameters: {'criterion': 'entropy', 'n_estimators': 137, 'max_features': 0.5530923890776587, 'max_depth': 23, 'min_samples_split': 5, 'min_samples_leaf': 5}. Best is trial 0 with value: 0.8521739130434783.
[32m[I 2023-04-26 12:20:36,677][39m Trial 1 finished with value: 0.8363636363636363 and parameters: {'criterion': 'entropy', 'n_estimators': 188, 'max_features': 0.6312768800708916, 'max_depth': 48, 'min_samples_split': 4, 'min_samples_leaf': 2}. Best is trial 0 with value: 0.8521739130434783.
[32m[I 2023-04-26 12:20:36,772][39m Trial 2 finished with value: 0.8108108108108107 and parameters: {'criterion': 'entropy', 'n_estimators': 115, 'max_features': 0.5339011988791024, 'max_depth': 72, 'min_samples_split': 5, 'min_samples_leaf': 1}. Best is trial 0 with value: 0.8521739130434783.
[32m[I 2023-04-26 12:20:36,850][39m Trial 3 finished with value: 0.8495575221238938 and parameters: {'criterion': 'gini', 'n_estimators': 93, 'max_features': 0.8063695810371068, 'max_depth': 69, 'min_samples_split': 7, 'min_samples_leaf': 3}. Best is trial 0 with value: 0.8521739130434783.
[32m[I 2023-04-26 12:20:36,954][39m Trial 4 finished with value: 0.8545454545454546 and parameters: {'criterion': 'entropy', 'n_estimators': 151, 'max_features': 0.16565830895099853, 'max_depth': 32, 'min_samples_split': 8, 'min_samples_leaf': 5}. Best is trial 4 with value: 0.8545454545454546.
[32m[I 2023-04-26 12:20:37,015][39m Trial 5 finished with value: 0.823529411764706 and parameters: {'criterion': 'gini', 'n_estimators': 79, 'max_features': 0.6675396303370884, 'max_depth': 97, 'min_samples_split': 10, 'min_samples_leaf': 6}. Best is trial 4 with value: 0.8545454545454546.
[32m[I 2023-04-26 12:20:37,093][39m Trial 6 finished with value: 0.8245614035087718 and parameters: {'criterion': 'gini', 'n_estimators': 98, 'max_features': 0.7020199631444181, 'max_depth': 77, 'min_samples_split': 10, 'min_samples_leaf': 4}. Best is trial 4 with value: 0.8545454545454546.
[32m[I 2023-04-26 12:20:37,183][39m Trial 7 finished with value: 0.8545454545454546 and parameters: {'criterion': 'entropy', 'n_estimators': 128, 'max_features': 0.027509795818288607, 'max_depth': 93, 'min_samples_split': 8, 'min_samples_leaf': 1}. Best is trial 4 with value: 0.8545454545454546.
[32m[I 2023-04-26 12:20:37,299][39m Trial 8 finished with value: 0.8547008547008546 and parameters: {'criterion': 'entropy', 'n_estimators': 173, 'max_features': 0.6258377796790435, 'max_depth': 63, 'min_samples_split': 3, 'min_samples_leaf': 9}. Best is trial 8 with value: 0.8547008547008546.
[32m[I 2023-04-26 12:20:37,364][39m Trial 9 finished with value: 0.8571428571428572 and parameters: {'criterion': 'gini', 'n_estimators': 111, 'max_features': 0.16510291519629994, 'max_depth': 75, 'min_samples_split': 3, 'min_samples_leaf': 8}. Best is trial 9 with value: 0.8571428571428572.
[32m[I 2023-04-26 12:20:37,419][39m Trial 10 finished with value: 0.8547008547008546 and parameters: {'criterion': 'gini', 'n_estimators': 67, 'max_features': 0.25589266525212523, 'max_depth': 8, 'min_samples_split': 2, 'min_samples_leaf': 9}. Best is trial 9 with value: 0.8571428571428572.
[32m[I 2023-04-26 12:20:37,539][39m Trial 11 finished with value: 0.8333333333333334 and parameters: {'criterion': 'gini', 'n_estimators': 169, 'max_features': 0.9653251590867604, 'max_depth': 55, 'min_samples_split': 2, 'min_samples_leaf': 9}. Best is trial 9 with value: 0.8571428571428572.
[32m[I 2023-04-26 12:20:37,650][39m Trial 12 finished with value: 0.847457627118644 and parameters: {'criterion': 'entropy', 'n_estimators': 188, 'max_features': 0.34084639055678356, 'max_depth': 52, 'min_samples_split': 3, 'min_samples_leaf': 11}. Best is trial 9 with value: 0.8571428571428572.
[32m[I 2023-04-26 12:20:37,752][39m Trial 13 finished with value: 0.8620689655172413 and parameters: {'criterion': 'gini', 'n_estimators': 161, 'max_features': 0.41244260607601135, 'max_depth': 79, 'min_samples_split': 4, 'min_samples_leaf': 8}. Best is trial 13 with value: 0.8620689655172413.
[32m[I 2023-04-26 12:20:37,844][39m Trial 14 finished with value: 0.8672566371681416 and parameters: {'criterion': 'gini', 'n_estimators': 146, 'max_features': 0.38387680795993684, 'max_depth': 84, 'min_samples_split': 5, 'min_samples_leaf': 7}. Best is trial 14 with value: 0.8672566371681416.
[32m[I 2023-04-26 12:20:37,940][39m Trial 15 finished with value: 0.8495575221238938 and parameters: {'criterion': 'gini', 'n_estimators': 154, 'max_features': 0.352016361263482, 'max_depth': 85, 'min_samples_split': 6, 'min_samples_leaf': 7}. Best is trial 14 with value: 0.8672566371681416.
[32m[I 2023-04-26 12:20:38,031][39m Trial 16 finished with value: 0.8620689655172413 and parameters: {'criterion': 'gini', 'n_estimators': 149, 'max_features': 0.40963268587213164, 'max_depth': 86, 'min_samples_split': 5, 'min_samples_leaf': 11}. Best is trial 14 with value: 0.8672566371681416.
[32m[I 2023-04-26 12:20:38,117][39m Trial 17 finished with value: 0.847457627118644 and parameters: {'criterion': 'gini', 'n_estimators': 141, 'max_features': 0.4381443966646499, 'max_depth': 100, 'min_samples_split': 6, 'min_samples_leaf': 11}. Best is trial 14 with value: 0.8672566371681416.
[32m[I 2023-04-26 12:20:38,213][39m Trial 18 finished with value: 0.8648648648648648 and parameters: {'criterion': 'gini', 'n_estimators': 164, 'max_features': 0.22147441510018478, 'max_depth': 88, 'min_samples_split': 4, 'min_samples_leaf': 7}. Best is trial 14 with value: 0.8672566371681416.
[32m[I 2023-04-26 12:20:38,324][39m Trial 19 finished with value: 0.8440366972477066 and parameters: {'criterion': 'gini', 'n_estimators': 196, 'max_features': 0.09143957959737836, 'max_depth': 39, 'min_samples_split': 7, 'min_samples_leaf': 6}. Best is trial 14 with value: 0.8672566371681416.
[32m[I 2023-04-26 12:20:38,437][39m Trial 20 finished with value: 0.8648648648648648 and parameters: {'criterion': 'gini', 'n_estimators': 179, 'max_features': 0.2219093584500938, 'max_depth': 63, 'min_samples_split': 4, 'min_samples_leaf': 7}. Best is trial 14 with value: 0.8672566371681416.
[32m[I 2023-04-26 12:20:38,546][39m Trial 21 finished with value: 0.8571428571428572 and parameters: {'criterion': 'gini', 'n_estimators': 179, 'max_features': 0.2720330718413134, 'max_depth': 64, 'min_samples_split': 4, 'min_samples_leaf': 7}. Best is trial 14 with value: 0.8672566371681416.
[32m[I 2023-04-26 12:20:38,649][39m Trial 22 finished with value: 0.8545454545454546 and parameters: {'criterion': 'gini', 'n_estimators': 172, 'max_features': 0.18884970995956918, 'max_depth': 88, 'min_samples_split': 5, 'min_samples_leaf': 7}. Best is trial 14 with value: 0.8672566371681416.
[32m[I 2023-04-26 12:20:38,746][39m Trial 23 finished with value: 0.875 and parameters: {'criterion': 'gini', 'n_estimators': 161, 'max_features': 0.27536405556222754, 'max_depth': 60, 'min_samples_split': 4, 'min_samples_leaf': 6}. Best is trial 23 with value: 0.875.
[32m[I 2023-04-26 12:20:38,867][39m Trial 24 finished with value: 0.8596491228070176 and parameters: {'criterion': 'gini', 'n_estimators': 198, 'max_features': 0.327052440426458, 'max_depth': 60, 'min_samples_split': 6, 'min_samples_leaf': 5}. Best is trial 23 with value: 0.875.
[32m[I 2023-04-26 12:20:38,945][39m Trial 25 finished with value: 0.875 and parameters: {'criterion': 'gini', 'n_estimators': 133, 'max_features': 0.010781936839355521, 'max_depth': 46, 'min_samples_split': 3, 'min_samples_leaf': 6}. Best is trial 23 with value: 0.875.
[32m[I 2023-04-26 12:20:39,023][39m Trial 26 finished with value: 0.8648648648648648 and parameters: {'criterion': 'gini', 'n_estimators': 129, 'max_features': 0.026227575166396316, 'max_depth': 42, 'min_samples_split': 2, 'min_samples_leaf': 4}. Best is trial 23 with value: 0.875.
[32m[I 2023-04-26 12:20:39,095][39m Trial 27 finished with value: 0.8571428571428572 and parameters: {'criterion': 'gini', 'n_estimators': 119, 'max_features': 0.06560853733764768, 'max_depth': 32, 'min_samples_split': 3, 'min_samples_leaf': 6}. Best is trial 23 with value: 0.875.
[32m[I 2023-04-26 12:20:39,180][39m Trial 28 finished with value: 0.8596491228070176 and parameters: {'criterion': 'gini', 'n_estimators': 140, 'max_features': 0.117520699975247, 'max_depth': 18, 'min_samples_split': 3, 'min_samples_leaf': 4}. Best is trial 23 with value: 0.875.
[32m[I 2023-04-26 12:20:39,221][39m Trial 29 finished with value: 0.8620689655172413 and parameters: {'criterion': 'gini', 'n_estimators': 52, 'max_features': 0.46228289165968445, 'max_depth': 45, 'min_samples_split': 5, 'min_samples_leaf': 5}. Best is trial 23 with value: 0.875.
[32m[I 2023-04-26 12:20:39,309][39m Trial 30 finished with value: 0.8448275862068967 and parameters: {'criterion': 'gini', 'n_estimators': 137, 'max_features': 0.5004126969354811, 'max_depth': 28, 'min_samples_split': 8, 'min_samples_leaf': 8}. Best is trial 23 with value: 0.875.
[32m[I 2023-04-26 12:20:39,402][39m Trial 31 finished with value: 0.8448275862068967 and parameters: {'criterion': 'gini', 'n_estimators': 157, 'max_features': 0.3021907069064148, 'max_depth': 56, 'min_samples_split': 4, 'min_samples_leaf': 8}. Best is trial 23 with value: 0.875.
[32m[I 2023-04-26 12:20:39,508][39m Trial 32 finished with value: 0.8545454545454546 and parameters: {'criterion': 'gini', 'n_estimators': 182, 'max_features': 0.12884986092281286, 'max_depth': 66, 'min_samples_split': 4, 'min_samples_leaf': 6}. Best is trial 23 with value: 0.875.
[32m[I 2023-04-26 12:20:39,604][39m Trial 33 finished with value: 0.8596491228070176 and parameters: {'criterion': 'gini', 'n_estimators': 164, 'max_features': 0.22804437331957605, 'max_depth': 82, 'min_samples_split': 5, 'min_samples_leaf': 6}. Best is trial 23 with value: 0.875.
[32m[I 2023-04-26 12:20:39,683][39m Trial 34 finished with value: 0.8571428571428572 and parameters: {'criterion': 'entropy', 'n_estimators': 130, 'max_features': 0.01183851107962636, 'max_depth': 42, 'min_samples_split': 2, 'min_samples_leaf': 3}. Best is trial 23 with value: 0.875.
[32m[I 2023-04-26 12:20:39,779][39m Trial 35 finished with value: 0.8547008547008546 and parameters: {'criterion': 'gini', 'n_estimators': 146, 'max_features': 0.5715528099362466, 'max_depth': 93, 'min_samples_split': 11, 'min_samples_leaf': 7}. Best is trial 23 with value: 0.875.
[32m[I 2023-04-26 12:20:39,847][39m Trial 36 finished with value: 0.875 and parameters: {'criterion': 'entropy', 'n_estimators': 109, 'max_features': 0.005907354407876809, 'max_depth': 47, 'min_samples_split': 2, 'min_samples_leaf': 4}. Best is trial 23 with value: 0.875.
[32m[I 2023-04-26 12:20:39,909][39m Trial 37 finished with value: 0.8571428571428572 and parameters: {'criterion': 'entropy', 'n_estimators': 95, 'max_features': 0.07568133470347058, 'max_depth': 48, 'min_samples_split': 3, 'min_samples_leaf': 3}. Best is trial 23 with value: 0.875.
[32m[I 2023-04-26 12:20:39,986][39m Trial 38 finished with value: 0.864406779661017 and parameters: {'criterion': 'entropy', 'n_estimators': 105, 'max_features': 0.7670149065402088, 'max_depth': 37, 'min_samples_split': 2, 'min_samples_leaf': 5}. Best is trial 23 with value: 0.875.
[32m[I 2023-04-26 12:20:40,063][39m Trial 39 finished with value: 0.8771929824561403 and parameters: {'criterion': 'entropy', 'n_estimators': 122, 'max_features': 0.00287497647689654, 'max_depth': 72, 'min_samples_split': 7, 'min_samples_leaf': 2}. Best is trial 39 with value: 0.8771929824561403.
[32m[I 2023-04-26 12:20:40,117][39m Trial 40 finished with value: 0.8545454545454546 and parameters: {'criterion': 'entropy', 'n_estimators': 83, 'max_features': 0.1526648435532561, 'max_depth': 72, 'min_samples_split': 9, 'min_samples_leaf': 2}. Best is trial 39 with value: 0.8771929824561403.
[32m[I 2023-04-26 12:20:40,195][39m Trial 41 finished with value: 0.8392857142857144 and parameters: {'criterion': 'entropy', 'n_estimators': 123, 'max_features': 0.050965314501324493, 'max_depth': 69, 'min_samples_split': 7, 'min_samples_leaf': 2}. Best is trial 39 with value: 0.8771929824561403.
[32m[I 2023-04-26 12:20:40,263][39m Trial 42 finished with value: 0.8849557522123893 and parameters: {'criterion': 'entropy', 'n_estimators': 107, 'max_features': 0.0025041197796866555, 'max_depth': 56, 'min_samples_split': 7, 'min_samples_leaf': 4}. Best is trial 42 with value: 0.8849557522123893.
[32m[I 2023-04-26 12:20:40,335][39m Trial 43 finished with value: 0.8440366972477066 and parameters: {'criterion': 'entropy', 'n_estimators': 111, 'max_features': 0.02177364826472978, 'max_depth': 50, 'min_samples_split': 8, 'min_samples_leaf': 1}. Best is trial 42 with value: 0.8849557522123893.
[32m[I 2023-04-26 12:20:40,401][39m Trial 44 finished with value: 0.8672566371681416 and parameters: {'criterion': 'entropy', 'n_estimators': 105, 'max_features': 0.10481014920144194, 'max_depth': 58, 'min_samples_split': 7, 'min_samples_leaf': 4}. Best is trial 42 with value: 0.8849557522123893.
[32m[I 2023-04-26 12:20:40,474][39m Trial 45 finished with value: 0.8672566371681416 and parameters: {'criterion': 'entropy', 'n_estimators': 102, 'max_features': 0.05059029471770978, 'max_depth': 52, 'min_samples_split': 6, 'min_samples_leaf': 2}. Best is trial 42 with value: 0.8849557522123893.
[32m[I 2023-04-26 12:20:40,533][39m Trial 46 finished with value: 0.8571428571428572 and parameters: {'criterion': 'entropy', 'n_estimators': 89, 'max_features': 0.0020113552941093517, 'max_depth': 73, 'min_samples_split': 9, 'min_samples_leaf': 5}. Best is trial 42 with value: 0.8849557522123893.
[32m[I 2023-04-26 12:20:40,606][39m Trial 47 finished with value: 0.8771929824561403 and parameters: {'criterion': 'entropy', 'n_estimators': 115, 'max_features': 0.17515761374110123, 'max_depth': 59, 'min_samples_split': 7, 'min_samples_leaf': 3}. Best is trial 42 with value: 0.8849557522123893.
[32m[I 2023-04-26 12:20:40,675][39m Trial 48 finished with value: 0.8468468468468469 and parameters: {'criterion': 'entropy', 'n_estimators': 112, 'max_features': 0.1512901205183545, 'max_depth': 54, 'min_samples_split': 7, 'min_samples_leaf': 3}. Best is trial 42 with value: 0.8849557522123893.
[32m[I 2023-04-26 12:20:40,750][39m Trial 49 finished with value: 0.8468468468468469 and parameters: {'criterion': 'entropy', 'n_estimators': 120, 'max_features': 0.08873579494744406, 'max_depth': 68, 'min_samples_split': 9, 'min_samples_leaf': 1}. Best is trial 42 with value: 0.8849557522123893.
[32m[I 2023-04-26 12:20:40,812][39m Trial 50 finished with value: 0.8521739130434783 and parameters: {'criterion': 'entropy', 'n_estimators': 73, 'max_features': 0.9889779648737125, 'max_depth': 46, 'min_samples_split': 8, 'min_samples_leaf': 3}. Best is trial 42 with value: 0.8849557522123893.
[32m[I 2023-04-26 12:20:40,894][39m Trial 51 finished with value: 0.8849557522123893 and parameters: {'criterion': 'entropy', 'n_estimators': 132, 'max_features': 0.18632385228267154, 'max_depth': 60, 'min_samples_split': 6, 'min_samples_leaf': 4}. Best is trial 42 with value: 0.8849557522123893.
[32m[I 2023-04-26 12:20:40,967][39m Trial 52 finished with value: 0.8672566371681416 and parameters: {'criterion': 'entropy', 'n_estimators': 115, 'max_features': 0.19086458407558582, 'max_depth': 62, 'min_samples_split': 6, 'min_samples_leaf': 4}. Best is trial 42 with value: 0.8849557522123893.
[32m[I 2023-04-26 12:20:41,062][39m Trial 53 finished with value: 0.8468468468468469 and parameters: {'criterion': 'entropy', 'n_estimators': 134, 'max_features': 0.0034348773297704165, 'max_depth': 79, 'min_samples_split': 7, 'min_samples_leaf': 3}. Best is trial 42 with value: 0.8849557522123893.
[32m[I 2023-04-26 12:20:41,153][39m Trial 54 finished with value: 0.8468468468468469 and parameters: {'criterion': 'entropy', 'n_estimators': 123, 'max_features': 0.05836723939227763, 'max_depth': 57, 'min_samples_split': 8, 'min_samples_leaf': 4}. Best is trial 42 with value: 0.8849557522123893.
[32m[I 2023-04-26 12:20:41,221][39m Trial 55 finished with value: 0.8596491228070176 and parameters: {'criterion': 'entropy', 'n_estimators': 101, 'max_features': 0.2709830455562726, 'max_depth': 69, 'min_samples_split': 7, 'min_samples_leaf': 2}. Best is trial 42 with value: 0.8849557522123893.
[32m[I 2023-04-26 12:20:41,280][39m Trial 56 finished with value: 0.8571428571428572 and parameters: {'criterion': 'entropy', 'n_estimators': 89, 'max_features': 0.13341366257385512, 'max_depth': 50, 'min_samples_split': 6, 'min_samples_leaf': 2}. Best is trial 42 with value: 0.8849557522123893.
[32m[I 2023-04-26 12:20:41,366][39m Trial 57 finished with value: 0.8672566371681416 and parameters: {'criterion': 'entropy', 'n_estimators': 132, 'max_features': 0.18763376689341485, 'max_depth': 60, 'min_samples_split': 6, 'min_samples_leaf': 5}. Best is trial 42 with value: 0.8849557522123893.
[32m[I 2023-04-26 12:20:41,438][39m Trial 58 finished with value: 0.8596491228070176 and parameters: {'criterion': 'entropy', 'n_estimators': 116, 'max_features': 0.046780638360607335, 'max_depth': 40, 'min_samples_split': 7, 'min_samples_leaf': 3}. Best is trial 42 with value: 0.8849557522123893.
[32m[I 2023-04-26 12:20:41,516][39m Trial 59 finished with value: 0.8333333333333334 and parameters: {'criterion': 'entropy', 'n_estimators': 107, 'max_features': 0.8852783886557222, 'max_depth': 76, 'min_samples_split': 8, 'min_samples_leaf': 10}. Best is trial 42 with value: 0.8849557522123893.
[32m[I 2023-04-26 12:20:41,601][39m Trial 60 finished with value: 0.8545454545454546 and parameters: {'criterion': 'entropy', 'n_estimators': 125, 'max_features': 0.0948858095738596, 'max_depth': 33, 'min_samples_split': 9, 'min_samples_leaf': 4}. Best is trial 42 with value: 0.8849557522123893.
[32m[I 2023-04-26 12:20:41,666][39m Trial 61 finished with value: 0.8672566371681416 and parameters: {'criterion': 'entropy', 'n_estimators': 96, 'max_features': 0.24619826964883057, 'max_depth': 54, 'min_samples_split': 3, 'min_samples_leaf': 4}. Best is trial 42 with value: 0.8849557522123893.
[32m[I 2023-04-26 12:20:41,736][39m Trial 62 finished with value: 0.8468468468468469 and parameters: {'criterion': 'entropy', 'n_estimators': 111, 'max_features': 0.12335563259273429, 'max_depth': 65, 'min_samples_split': 2, 'min_samples_leaf': 6}. Best is trial 42 with value: 0.8849557522123893.
[32m[I 2023-04-26 12:20:41,825][39m Trial 63 finished with value: 0.875 and parameters: {'criterion': 'entropy', 'n_estimators': 142, 'max_features': 0.1713289224119851, 'max_depth': 59, 'min_samples_split': 3, 'min_samples_leaf': 5}. Best is trial 42 with value: 0.8849557522123893.
[32m[I 2023-04-26 12:20:41,921][39m Trial 64 finished with value: 0.8771929824561403 and parameters: {'criterion': 'entropy', 'n_estimators': 151, 'max_features': 0.2994314188424039, 'max_depth': 44, 'min_samples_split': 2, 'min_samples_leaf': 3}. Best is trial 42 with value: 0.8849557522123893.
[32m[I 2023-04-26 12:20:42,009][39m Trial 65 finished with value: 0.8849557522123893 and parameters: {'criterion': 'entropy', 'n_estimators': 142, 'max_features': 0.1868586543506515, 'max_depth': 44, 'min_samples_split': 2, 'min_samples_leaf': 3}. Best is trial 42 with value: 0.8849557522123893.
[32m[I 2023-04-26 12:20:42,109][39m Trial 66 finished with value: 0.8869565217391304 and parameters: {'criterion': 'entropy', 'n_estimators': 152, 'max_features': 0.353347999941377, 'max_depth': 23, 'min_samples_split': 2, 'min_samples_leaf': 3}. Best is trial 66 with value: 0.8869565217391304.
[32m[I 2023-04-26 12:20:42,212][39m Trial 67 finished with value: 0.8141592920353982 and parameters: {'criterion': 'entropy', 'n_estimators': 153, 'max_features': 0.35988979361813855, 'max_depth': 16, 'min_samples_split': 2, 'min_samples_leaf': 1}. Best is trial 66 with value: 0.8869565217391304.
[32m[I 2023-04-26 12:20:42,296][39m Trial 68 finished with value: 0.7812500000000001 and parameters: {'criterion': 'entropy', 'n_estimators': 148, 'max_features': 0.3929274619763902, 'max_depth': 1, 'min_samples_split': 2, 'min_samples_leaf': 3}. Best is trial 66 with value: 0.8869565217391304.
[32m[I 2023-04-26 12:20:42,384][39m Trial 69 finished with value: 0.8869565217391304 and parameters: {'criterion': 'entropy', 'n_estimators': 137, 'max_features': 0.3048322778927511, 'max_depth': 24, 'min_samples_split': 7, 'min_samples_leaf': 3}. Best is trial 66 with value: 0.8869565217391304.
[32m[I 2023-04-26 12:20:42,483][39m Trial 70 finished with value: 0.8596491228070176 and parameters: {'criterion': 'entropy', 'n_estimators': 137, 'max_features': 0.3111556094276792, 'max_depth': 26, 'min_samples_split': 8, 'min_samples_leaf': 2}. Best is trial 66 with value: 0.8869565217391304.
[32m[I 2023-04-26 12:20:42,575][39m Trial 71 finished with value: 0.8793103448275863 and parameters: {'criterion': 'entropy', 'n_estimators': 142, 'max_features': 0.22031705471109583, 'max_depth': 20, 'min_samples_split': 7, 'min_samples_leaf': 3}. Best is trial 66 with value: 0.8869565217391304.
[32m[I 2023-04-26 12:20:42,668][39m Trial 72 finished with value: 0.8849557522123893 and parameters: {'criterion': 'entropy', 'n_estimators': 143, 'max_features': 0.21518739729472802, 'max_depth': 17, 'min_samples_split': 6, 'min_samples_leaf': 3}. Best is trial 66 with value: 0.8869565217391304.
[32m[I 2023-04-26 12:20:42,772][39m Trial 73 finished with value: 0.8771929824561403 and parameters: {'criterion': 'entropy', 'n_estimators': 158, 'max_features': 0.2950219403560503, 'max_depth': 19, 'min_samples_split': 6, 'min_samples_leaf': 3}. Best is trial 66 with value: 0.8869565217391304.
