[32m[I 2023-04-26 12:20:51,526][39m Trial 147 finished with value: 0.8545454545454546 and parameters: {'criterion': 'gini', 'n_estimators': 144, 'max_features': 0.0010815561640949434, 'max_depth': 9, 'min_samples_split': 6, 'min_samples_leaf': 4}. Best is trial 66 with value: 0.8869565217391304.
[32m[I 2023-04-26 12:20:51,666][39m Trial 148 finished with value: 0.8672566371681416 and parameters: {'criterion': 'entropy', 'n_estimators': 109, 'max_features': 0.16575971947136764, 'max_depth': 55, 'min_samples_split': 7, 'min_samples_leaf': 3}. Best is trial 66 with value: 0.8869565217391304.
[32m[I 2023-04-26 12:20:51,829][39m Trial 149 finished with value: 0.8695652173913043 and parameters: {'criterion': 'entropy', 'n_estimators': 128, 'max_features': 0.316925406099718, 'max_depth': 51, 'min_samples_split': 10, 'min_samples_leaf': 3}. Best is trial 66 with value: 0.8869565217391304.
[32m[I 2023-04-26 12:20:51,974][39m Trial 150 finished with value: 0.875 and parameters: {'criterion': 'entropy', 'n_estimators': 113, 'max_features': 0.17450675947062375, 'max_depth': 74, 'min_samples_split': 6, 'min_samples_leaf': 4}. Best is trial 66 with value: 0.8869565217391304.
[32m[I 2023-04-26 12:20:52,127][39m Trial 151 finished with value: 0.8495575221238938 and parameters: {'criterion': 'entropy', 'n_estimators': 125, 'max_features': 0.13325916712134983, 'max_depth': 23, 'min_samples_split': 3, 'min_samples_leaf': 4}. Best is trial 66 with value: 0.8869565217391304.
[32m[I 2023-04-26 12:20:52,354][39m Trial 152 finished with value: 0.875 and parameters: {'criterion': 'entropy', 'n_estimators': 190, 'max_features': 0.19305315526693345, 'max_depth': 14, 'min_samples_split': 4, 'min_samples_leaf': 3}. Best is trial 66 with value: 0.8869565217391304.
[32m[I 2023-04-26 12:20:52,551][39m Trial 153 finished with value: 0.8672566371681416 and parameters: {'criterion': 'entropy', 'n_estimators': 165, 'max_features': 0.2195433224187643, 'max_depth': 19, 'min_samples_split': 5, 'min_samples_leaf': 4}. Best is trial 66 with value: 0.8869565217391304.
[32m[I 2023-04-26 12:20:52,719][39m Trial 154 finished with value: 0.8672566371681416 and parameters: {'criterion': 'entropy', 'n_estimators': 134, 'max_features': 0.24194673842521613, 'max_depth': 21, 'min_samples_split': 7, 'min_samples_leaf': 3}. Best is trial 66 with value: 0.8869565217391304.
[32m[I 2023-04-26 12:20:52,890][39m Trial 155 finished with value: 0.8648648648648648 and parameters: {'criterion': 'entropy', 'n_estimators': 138, 'max_features': 0.20632532976969553, 'max_depth': 46, 'min_samples_split': 5, 'min_samples_leaf': 3}. Best is trial 66 with value: 0.8869565217391304.
[32m[I 2023-04-26 12:20:53,052][39m Trial 156 finished with value: 0.8672566371681416 and parameters: {'criterion': 'entropy', 'n_estimators': 132, 'max_features': 0.2503719655884344, 'max_depth': 5, 'min_samples_split': 11, 'min_samples_leaf': 5}. Best is trial 66 with value: 0.8869565217391304.
[32m[I 2023-04-26 12:20:53,193][39m Trial 157 finished with value: 0.8440366972477066 and parameters: {'criterion': 'entropy', 'n_estimators': 117, 'max_features': 0.03449636973133495, 'max_depth': 60, 'min_samples_split': 7, 'min_samples_leaf': 10}. Best is trial 66 with value: 0.8869565217391304.
[32m[I 2023-04-26 12:20:53,358][39m Trial 158 finished with value: 0.8672566371681416 and parameters: {'criterion': 'entropy', 'n_estimators': 131, 'max_features': 0.26523970150178827, 'max_depth': 70, 'min_samples_split': 6, 'min_samples_leaf': 4}. Best is trial 66 with value: 0.8869565217391304.
[32m[I 2023-04-26 12:20:53,554][39m Trial 159 finished with value: 0.8771929824561403 and parameters: {'criterion': 'entropy', 'n_estimators': 159, 'max_features': 0.302032070893839, 'max_depth': 13, 'min_samples_split': 3, 'min_samples_leaf': 4}. Best is trial 66 with value: 0.8869565217391304.
[32m[I 2023-04-26 12:20:53,689][39m Trial 160 finished with value: 0.8672566371681416 and parameters: {'criterion': 'entropy', 'n_estimators': 100, 'max_features': 0.3803013311243257, 'max_depth': 57, 'min_samples_split': 6, 'min_samples_leaf': 3}. Best is trial 66 with value: 0.8869565217391304.
[32m[I 2023-04-26 12:20:53,877][39m Trial 161 finished with value: 0.8571428571428572 and parameters: {'criterion': 'entropy', 'n_estimators': 150, 'max_features': 0.31260237606232144, 'max_depth': 33, 'min_samples_split': 2, 'min_samples_leaf': 3}. Best is trial 66 with value: 0.8869565217391304.
[32m[I 2023-04-26 12:20:54,093][39m Trial 162 finished with value: 0.8672566371681416 and parameters: {'criterion': 'entropy', 'n_estimators': 181, 'max_features': 0.2081709175498458, 'max_depth': 61, 'min_samples_split': 7, 'min_samples_leaf': 3}. Best is trial 66 with value: 0.8869565217391304.
[32m[I 2023-04-26 12:20:54,284][39m Trial 163 finished with value: 0.8849557522123893 and parameters: {'criterion': 'entropy', 'n_estimators': 155, 'max_features': 0.2964531288170919, 'max_depth': 17, 'min_samples_split': 3, 'min_samples_leaf': 4}. Best is trial 66 with value: 0.8869565217391304.
[32m[I 2023-04-26 12:20:54,407][39m Trial 164 finished with value: 0.8849557522123893 and parameters: {'criterion': 'entropy', 'n_estimators': 92, 'max_features': 0.15609150889004078, 'max_depth': 67, 'min_samples_split': 8, 'min_samples_leaf': 4}. Best is trial 66 with value: 0.8869565217391304.
[32m[I 2023-04-26 12:20:54,591][39m Trial 165 finished with value: 0.8648648648648648 and parameters: {'criterion': 'entropy', 'n_estimators': 147, 'max_features': 0.1464992144014494, 'max_depth': 65, 'min_samples_split': 3, 'min_samples_leaf': 4}. Best is trial 66 with value: 0.8869565217391304.
[32m[I 2023-04-26 12:20:54,709][39m Trial 166 finished with value: 0.8672566371681416 and parameters: {'criterion': 'entropy', 'n_estimators': 87, 'max_features': 0.16225556846288366, 'max_depth': 9, 'min_samples_split': 10, 'min_samples_leaf': 4}. Best is trial 66 with value: 0.8869565217391304.
[32m[I 2023-04-26 12:20:54,816][39m Trial 167 finished with value: 0.8947368421052632 and parameters: {'criterion': 'entropy', 'n_estimators': 76, 'max_features': 0.19812087478155269, 'max_depth': 53, 'min_samples_split': 4, 'min_samples_leaf': 4}. Best is trial 167 with value: 0.8947368421052632.
[32m[I 2023-04-26 12:20:54,926][39m Trial 168 finished with value: 0.875 and parameters: {'criterion': 'entropy', 'n_estimators': 73, 'max_features': 0.18324101270774892, 'max_depth': 68, 'min_samples_split': 8, 'min_samples_leaf': 3}. Best is trial 167 with value: 0.8947368421052632.
[32m[I 2023-04-26 12:20:55,016][39m Trial 169 finished with value: 0.8440366972477066 and parameters: {'criterion': 'gini', 'n_estimators': 65, 'max_features': 0.09430430844137809, 'max_depth': 20, 'min_samples_split': 4, 'min_samples_leaf': 5}. Best is trial 167 with value: 0.8947368421052632.
[32m[I 2023-04-26 12:20:55,146][39m Trial 170 finished with value: 0.8869565217391304 and parameters: {'criterion': 'entropy', 'n_estimators': 92, 'max_features': 0.23471502828637542, 'max_depth': 17, 'min_samples_split': 9, 'min_samples_leaf': 4}. Best is trial 167 with value: 0.8947368421052632.
[32m[I 2023-04-26 12:20:55,269][39m Trial 171 finished with value: 0.8869565217391304 and parameters: {'criterion': 'entropy', 'n_estimators': 95, 'max_features': 0.22524141686420698, 'max_depth': 16, 'min_samples_split': 9, 'min_samples_leaf': 3}. Best is trial 167 with value: 0.8947368421052632.
[32m[I 2023-04-26 12:20:55,394][39m Trial 172 finished with value: 0.8672566371681416 and parameters: {'criterion': 'entropy', 'n_estimators': 94, 'max_features': 0.22832908560734283, 'max_depth': 54, 'min_samples_split': 9, 'min_samples_leaf': 4}. Best is trial 167 with value: 0.8947368421052632.
[32m[I 2023-04-26 12:20:55,511][39m Trial 173 finished with value: 0.8771929824561403 and parameters: {'criterion': 'entropy', 'n_estimators': 88, 'max_features': 0.22066081546207522, 'max_depth': 17, 'min_samples_split': 9, 'min_samples_leaf': 3}. Best is trial 167 with value: 0.8947368421052632.
[32m[I 2023-04-26 12:20:55,618][39m Trial 174 finished with value: 0.8571428571428572 and parameters: {'criterion': 'entropy', 'n_estimators': 80, 'max_features': 0.13791478350702094, 'max_depth': 18, 'min_samples_split': 9, 'min_samples_leaf': 4}. Best is trial 167 with value: 0.8947368421052632.
[32m[I 2023-04-26 12:20:55,747][39m Trial 175 finished with value: 0.8648648648648648 and parameters: {'criterion': 'entropy', 'n_estimators': 96, 'max_features': 0.1944330450967511, 'max_depth': 14, 'min_samples_split': 8, 'min_samples_leaf': 4}. Best is trial 167 with value: 0.8947368421052632.
[32m[I 2023-04-26 12:20:55,872][39m Trial 176 finished with value: 0.8648648648648648 and parameters: {'criterion': 'entropy', 'n_estimators': 91, 'max_features': 0.1578944911436278, 'max_depth': 16, 'min_samples_split': 9, 'min_samples_leaf': 5}. Best is trial 167 with value: 0.8947368421052632.
[32m[I 2023-04-26 12:20:55,989][39m Trial 177 finished with value: 0.8495575221238938 and parameters: {'criterion': 'entropy', 'n_estimators': 84, 'max_features': 0.05938034186729811, 'max_depth': 23, 'min_samples_split': 8, 'min_samples_leaf': 2}. Best is trial 167 with value: 0.8947368421052632.
[32m[I 2023-04-26 12:20:56,113][39m Trial 178 finished with value: 0.8596491228070176 and parameters: {'criterion': 'entropy', 'n_estimators': 92, 'max_features': 0.2727941560570232, 'max_depth': 16, 'min_samples_split': 6, 'min_samples_leaf': 3}. Best is trial 167 with value: 0.8947368421052632.
[32m[I 2023-04-26 12:20:56,341][39m Trial 179 finished with value: 0.8849557522123893 and parameters: {'criterion': 'entropy', 'n_estimators': 186, 'max_features': 0.18666437702097338, 'max_depth': 50, 'min_samples_split': 4, 'min_samples_leaf': 3}. Best is trial 167 with value: 0.8947368421052632.
[32m[I 2023-04-26 12:20:56,575][39m Trial 180 finished with value: 0.8695652173913043 and parameters: {'criterion': 'entropy', 'n_estimators': 192, 'max_features': 0.18136506617101186, 'max_depth': 48, 'min_samples_split': 3, 'min_samples_leaf': 3}. Best is trial 167 with value: 0.8947368421052632.
[32m[I 2023-04-26 12:20:56,709][39m Trial 181 finished with value: 0.8771929824561403 and parameters: {'criterion': 'entropy', 'n_estimators': 97, 'max_features': 0.23806586366592958, 'max_depth': 50, 'min_samples_split': 9, 'min_samples_leaf': 3}. Best is trial 167 with value: 0.8947368421052632.
[32m[I 2023-04-26 12:20:56,814][39m Trial 182 finished with value: 0.8869565217391304 and parameters: {'criterion': 'entropy', 'n_estimators': 73, 'max_features': 0.19701157887999995, 'max_depth': 56, 'min_samples_split': 7, 'min_samples_leaf': 3}. Best is trial 167 with value: 0.8947368421052632.
[32m[I 2023-04-26 12:20:56,926][39m Trial 183 finished with value: 0.8849557522123893 and parameters: {'criterion': 'entropy', 'n_estimators': 79, 'max_features': 0.1988854173221032, 'max_depth': 56, 'min_samples_split': 7, 'min_samples_leaf': 3}. Best is trial 167 with value: 0.8947368421052632.
[32m[I 2023-04-26 12:20:57,031][39m Trial 184 finished with value: 0.8571428571428572 and parameters: {'criterion': 'entropy', 'n_estimators': 76, 'max_features': 0.12207840524501197, 'max_depth': 56, 'min_samples_split': 8, 'min_samples_leaf': 3}. Best is trial 167 with value: 0.8947368421052632.
[32m[I 2023-04-26 12:20:57,138][39m Trial 185 finished with value: 0.8695652173913043 and parameters: {'criterion': 'entropy', 'n_estimators': 77, 'max_features': 0.1986976289773613, 'max_depth': 58, 'min_samples_split': 4, 'min_samples_leaf': 3}. Best is trial 167 with value: 0.8947368421052632.
[32m[I 2023-04-26 12:20:57,248][39m Trial 186 finished with value: 0.8648648648648648 and parameters: {'criterion': 'entropy', 'n_estimators': 81, 'max_features': 0.17513598243096246, 'max_depth': 54, 'min_samples_split': 7, 'min_samples_leaf': 4}. Best is trial 167 with value: 0.8947368421052632.
[32m[I 2023-04-26 12:20:57,481][39m Trial 187 finished with value: 0.8648648648648648 and parameters: {'criterion': 'entropy', 'n_estimators': 201, 'max_features': 0.1992062754093253, 'max_depth': 63, 'min_samples_split': 9, 'min_samples_leaf': 4}. Best is trial 167 with value: 0.8947368421052632.
[32m[I 2023-04-26 12:20:57,577][39m Trial 188 finished with value: 0.8695652173913043 and parameters: {'criterion': 'entropy', 'n_estimators': 67, 'max_features': 0.15628557896468212, 'max_depth': 56, 'min_samples_split': 7, 'min_samples_leaf': 3}. Best is trial 167 with value: 0.8947368421052632.
[32m[I 2023-04-26 12:20:57,680][39m Trial 189 finished with value: 0.8672566371681416 and parameters: {'criterion': 'entropy', 'n_estimators': 70, 'max_features': 0.21807436444125827, 'max_depth': 49, 'min_samples_split': 3, 'min_samples_leaf': 3}. Best is trial 167 with value: 0.8947368421052632.
[32m[I 2023-04-26 12:20:57,787][39m Trial 190 finished with value: 0.8672566371681416 and parameters: {'criterion': 'entropy', 'n_estimators': 73, 'max_features': 0.1762388949457691, 'max_depth': 53, 'min_samples_split': 6, 'min_samples_leaf': 3}. Best is trial 167 with value: 0.8947368421052632.
[32m[I 2023-04-26 12:20:57,905][39m Trial 191 finished with value: 0.8849557522123893 and parameters: {'criterion': 'entropy', 'n_estimators': 85, 'max_features': 0.2236988574338024, 'max_depth': 60, 'min_samples_split': 7, 'min_samples_leaf': 3}. Best is trial 167 with value: 0.8947368421052632.
[32m[I 2023-04-26 12:20:58,026][39m Trial 192 finished with value: 0.8672566371681416 and parameters: {'criterion': 'entropy', 'n_estimators': 85, 'max_features': 0.23800287802684358, 'max_depth': 59, 'min_samples_split': 7, 'min_samples_leaf': 3}. Best is trial 167 with value: 0.8947368421052632.
[32m[I 2023-04-26 12:20:58,120][39m Trial 193 finished with value: 0.8771929824561403 and parameters: {'criterion': 'entropy', 'n_estimators': 62, 'max_features': 0.19668797008754813, 'max_depth': 67, 'min_samples_split': 7, 'min_samples_leaf': 3}. Best is trial 167 with value: 0.8947368421052632.
[32m[I 2023-04-26 12:20:58,232][39m Trial 194 finished with value: 0.8771929824561403 and parameters: {'criterion': 'entropy', 'n_estimators': 77, 'max_features': 0.22654763508127662, 'max_depth': 61, 'min_samples_split': 4, 'min_samples_leaf': 3}. Best is trial 167 with value: 0.8947368421052632.
[32m[I 2023-04-26 12:20:58,359][39m Trial 195 finished with value: 0.8596491228070176 and parameters: {'criterion': 'entropy', 'n_estimators': 89, 'max_features': 0.2525003371508599, 'max_depth': 64, 'min_samples_split': 7, 'min_samples_leaf': 4}. Best is trial 167 with value: 0.8947368421052632.
[32m[I 2023-04-26 12:20:58,474][39m Trial 196 finished with value: 0.8648648648648648 and parameters: {'criterion': 'entropy', 'n_estimators': 80, 'max_features': 0.21196014000107458, 'max_depth': 58, 'min_samples_split': 7, 'min_samples_leaf': 3}. Best is trial 167 with value: 0.8947368421052632.
[32m[I 2023-04-26 12:20:58,589][39m Trial 197 finished with value: 0.8648648648648648 and parameters: {'criterion': 'entropy', 'n_estimators': 85, 'max_features': 0.1449875424609814, 'max_depth': 51, 'min_samples_split': 6, 'min_samples_leaf': 4}. Best is trial 167 with value: 0.8947368421052632.
[32m[I 2023-04-26 12:20:58,701][39m Trial 198 finished with value: 0.8545454545454546 and parameters: {'criterion': 'entropy', 'n_estimators': 82, 'max_features': 0.1864128351866115, 'max_depth': 55, 'min_samples_split': 8, 'min_samples_leaf': 2}. Best is trial 167 with value: 0.8947368421052632.
[32m[I 2023-04-26 12:20:58,908][39m Trial 199 finished with value: 0.8771929824561403 and parameters: {'criterion': 'gini', 'n_estimators': 174, 'max_features': 0.2558585918361109, 'max_depth': 62, 'min_samples_split': 2, 'min_samples_leaf': 3}. Best is trial 167 with value: 0.8947368421052632.
[32m[I 2023-04-26 12:20:59,047][39m Trial 200 finished with value: 0.8672566371681416 and parameters: {'criterion': 'entropy', 'n_estimators': 102, 'max_features': 0.22991499850534156, 'max_depth': 12, 'min_samples_split': 7, 'min_samples_leaf': 3}. Best is trial 167 with value: 0.8947368421052632.
[32m[I 2023-04-26 12:20:59,222][39m Trial 201 finished with value: 0.8672566371681416 and parameters: {'criterion': 'entropy', 'n_estimators': 142, 'max_features': 0.2108239565714936, 'max_depth': 19, 'min_samples_split': 7, 'min_samples_leaf': 3}. Best is trial 167 with value: 0.8947368421052632.
[32m[I 2023-04-26 12:20:59,348][39m Trial 202 finished with value: 0.8672566371681416 and parameters: {'criterion': 'entropy', 'n_estimators': 94, 'max_features': 0.16004031554243087, 'max_depth': 20, 'min_samples_split': 7, 'min_samples_leaf': 3}. Best is trial 167 with value: 0.8947368421052632.
[32m[I 2023-04-26 12:20:59,471][39m Trial 203 finished with value: 0.875 and parameters: {'criterion': 'entropy', 'n_estimators': 91, 'max_features': 0.18938067706696216, 'max_depth': 56, 'min_samples_split': 7, 'min_samples_leaf': 3}. Best is trial 167 with value: 0.8947368421052632.
[32m[I 2023-04-26 12:20:59,573][39m Trial 204 finished with value: 0.875 and parameters: {'criterion': 'entropy', 'n_estimators': 70, 'max_features': 0.22886861511429168, 'max_depth': 14, 'min_samples_split': 6, 'min_samples_leaf': 4}. Best is trial 167 with value: 0.8947368421052632.
[32m[I 2023-04-26 12:20:59,745][39m Trial 205 finished with value: 0.875 and parameters: {'criterion': 'entropy', 'n_estimators': 139, 'max_features': 0.17201157772138917, 'max_depth': 59, 'min_samples_split': 6, 'min_samples_leaf': 4}. Best is trial 167 with value: 0.8947368421052632.
[32m[I 2023-04-26 12:20:59,917][39m Trial 206 finished with value: 0.8695652173913043 and parameters: {'criterion': 'entropy', 'n_estimators': 137, 'max_features': 0.2824552440365159, 'max_depth': 22, 'min_samples_split': 7, 'min_samples_leaf': 3}. Best is trial 167 with value: 0.8947368421052632.
[32m[I 2023-04-26 12:21:00,026][39m Trial 207 finished with value: 0.8771929824561403 and parameters: {'criterion': 'entropy', 'n_estimators': 76, 'max_features': 0.20518916107798615, 'max_depth': 52, 'min_samples_split': 6, 'min_samples_leaf': 3}. Best is trial 167 with value: 0.8947368421052632.
[32m[I 2023-04-26 12:21:00,207][39m Trial 208 finished with value: 0.8596491228070176 and parameters: {'criterion': 'entropy', 'n_estimators': 144, 'max_features': 0.25019380981250605, 'max_depth': 15, 'min_samples_split': 7, 'min_samples_leaf': 3}. Best is trial 167 with value: 0.8947368421052632.
[32m[I 2023-04-26 12:21:00,380][39m Trial 209 finished with value: 0.8771929824561403 and parameters: {'criterion': 'entropy', 'n_estimators': 141, 'max_features': 0.21726751645394765, 'max_depth': 17, 'min_samples_split': 8, 'min_samples_leaf': 4}. Best is trial 167 with value: 0.8947368421052632.
[32m[I 2023-04-26 12:21:00,494][39m Trial 210 finished with value: 0.8545454545454546 and parameters: {'criterion': 'entropy', 'n_estimators': 86, 'max_features': 0.13317784387096646, 'max_depth': 24, 'min_samples_split': 2, 'min_samples_leaf': 8}. Best is trial 167 with value: 0.8947368421052632.
[32m[I 2023-04-26 12:21:00,664][39m Trial 211 finished with value: 0.875 and parameters: {'criterion': 'entropy', 'n_estimators': 136, 'max_features': 0.26522071572179573, 'max_depth': 10, 'min_samples_split': 11, 'min_samples_leaf': 4}. Best is trial 167 with value: 0.8947368421052632.
[32m[I 2023-04-26 12:21:00,872][39m Trial 212 finished with value: 0.8545454545454546 and parameters: {'criterion': 'entropy', 'n_estimators': 172, 'max_features': 0.17463980458194805, 'max_depth': 35, 'min_samples_split': 5, 'min_samples_leaf': 4}. Best is trial 167 with value: 0.8947368421052632.
[32m[I 2023-04-26 12:21:01,055][39m Trial 213 finished with value: 0.8596491228070176 and parameters: {'criterion': 'entropy', 'n_estimators': 134, 'max_features': 0.6259525869358566, 'max_depth': 8, 'min_samples_split': 6, 'min_samples_leaf': 3}. Best is trial 167 with value: 0.8947368421052632.
[32m[I 2023-04-26 12:21:01,231][39m Trial 214 finished with value: 0.8672566371681416 and parameters: {'criterion': 'entropy', 'n_estimators': 141, 'max_features': 0.2717293967855929, 'max_depth': 18, 'min_samples_split': 6, 'min_samples_leaf': 3}. Best is trial 167 with value: 0.8947368421052632.
[32m[I 2023-04-26 12:21:01,383][39m Trial 215 finished with value: 0.8695652173913043 and parameters: {'criterion': 'entropy', 'n_estimators': 122, 'max_features': 0.008890003727372475, 'max_depth': 82, 'min_samples_split': 7, 'min_samples_leaf': 2}. Best is trial 167 with value: 0.8947368421052632.
[32m[I 2023-04-26 12:21:01,493][39m Trial 216 finished with value: 0.8672566371681416 and parameters: {'criterion': 'entropy', 'n_estimators': 78, 'max_features': 0.19531664223648595, 'max_depth': 75, 'min_samples_split': 7, 'min_samples_leaf': 2}. Best is trial 167 with value: 0.8947368421052632.
[32m[I 2023-04-26 12:21:01,645][39m Trial 217 finished with value: 0.8869565217391304 and parameters: {'criterion': 'entropy', 'n_estimators': 117, 'max_features': 0.16165695263105315, 'max_depth': 60, 'min_samples_split': 7, 'min_samples_leaf': 3}. Best is trial 167 with value: 0.8947368421052632.
[32m[I 2023-04-26 12:21:01,797][39m Trial 218 finished with value: 0.8695652173913043 and parameters: {'criterion': 'entropy', 'n_estimators': 119, 'max_features': 0.1503258695235506, 'max_depth': 62, 'min_samples_split': 7, 'min_samples_leaf': 3}. Best is trial 167 with value: 0.8947368421052632.
[32m[I 2023-04-26 12:21:01,941][39m Trial 219 finished with value: 0.8495575221238938 and parameters: {'criterion': 'entropy', 'n_estimators': 109, 'max_features': 0.11303939308303063, 'max_depth': 57, 'min_samples_split': 7, 'min_samples_leaf': 3}. Best is trial 167 with value: 0.8947368421052632.
