[32m[I 2023-04-26 12:20:42,869][39m Trial 74 finished with value: 0.8648648648648648 and parameters: {'criterion': 'entropy', 'n_estimators': 157, 'max_features': 0.21495676664271615, 'max_depth': 18, 'min_samples_split': 6, 'min_samples_leaf': 3}. Best is trial 66 with value: 0.8869565217391304.
[32m[I 2023-04-26 12:20:42,964][39m Trial 75 finished with value: 0.8672566371681416 and parameters: {'criterion': 'entropy', 'n_estimators': 143, 'max_features': 0.3594399810720652, 'max_depth': 12, 'min_samples_split': 5, 'min_samples_leaf': 3}. Best is trial 66 with value: 0.8869565217391304.
[32m[I 2023-04-26 12:20:43,064][39m Trial 76 finished with value: 0.8771929824561403 and parameters: {'criterion': 'entropy', 'n_estimators': 152, 'max_features': 0.434605781770833, 'max_depth': 25, 'min_samples_split': 3, 'min_samples_leaf': 4}. Best is trial 66 with value: 0.8869565217391304.
[32m[I 2023-04-26 12:20:43,149][39m Trial 77 finished with value: 0.8672566371681416 and parameters: {'criterion': 'entropy', 'n_estimators': 128, 'max_features': 0.2359642947678824, 'max_depth': 23, 'min_samples_split': 7, 'min_samples_leaf': 2}. Best is trial 66 with value: 0.8869565217391304.
[32m[I 2023-04-26 12:20:43,236][39m Trial 78 finished with value: 0.8672566371681416 and parameters: {'criterion': 'entropy', 'n_estimators': 138, 'max_features': 0.20741340564137997, 'max_depth': 8, 'min_samples_split': 7, 'min_samples_leaf': 2}. Best is trial 66 with value: 0.8869565217391304.
[32m[I 2023-04-26 12:20:43,334][39m Trial 79 finished with value: 0.8495575221238938 and parameters: {'criterion': 'entropy', 'n_estimators': 145, 'max_features': 0.3314543229215427, 'max_depth': 30, 'min_samples_split': 5, 'min_samples_leaf': 2}. Best is trial 66 with value: 0.8869565217391304.
[32m[I 2023-04-26 12:20:43,420][39m Trial 80 finished with value: 0.8771929824561403 and parameters: {'criterion': 'entropy', 'n_estimators': 136, 'max_features': 0.2562250782453888, 'max_depth': 12, 'min_samples_split': 11, 'min_samples_leaf': 4}. Best is trial 66 with value: 0.8869565217391304.
[32m[I 2023-04-26 12:20:43,499][39m Trial 81 finished with value: 0.8849557522123893 and parameters: {'criterion': 'entropy', 'n_estimators': 126, 'max_features': 0.1764866967313058, 'max_depth': 21, 'min_samples_split': 7, 'min_samples_leaf': 3}. Best is trial 66 with value: 0.8869565217391304.
[32m[I 2023-04-26 12:20:43,586][39m Trial 82 finished with value: 0.8771929824561403 and parameters: {'criterion': 'entropy', 'n_estimators': 134, 'max_features': 0.2584700411536416, 'max_depth': 13, 'min_samples_split': 11, 'min_samples_leaf': 4}. Best is trial 66 with value: 0.8869565217391304.
[32m[I 2023-04-26 12:20:43,666][39m Trial 83 finished with value: 0.8571428571428572 and parameters: {'criterion': 'entropy', 'n_estimators': 128, 'max_features': 0.14540246360073592, 'max_depth': 21, 'min_samples_split': 7, 'min_samples_leaf': 3}. Best is trial 66 with value: 0.8869565217391304.
[32m[I 2023-04-26 12:20:43,756][39m Trial 84 finished with value: 0.8869565217391304 and parameters: {'criterion': 'entropy', 'n_estimators': 141, 'max_features': 0.18730155144659216, 'max_depth': 15, 'min_samples_split': 6, 'min_samples_leaf': 3}. Best is trial 66 with value: 0.8869565217391304.
[32m[I 2023-04-26 12:20:43,845][39m Trial 85 finished with value: 0.8571428571428572 and parameters: {'criterion': 'entropy', 'n_estimators': 145, 'max_features': 0.19498164533395168, 'max_depth': 7, 'min_samples_split': 6, 'min_samples_leaf': 3}. Best is trial 66 with value: 0.8869565217391304.
[32m[I 2023-04-26 12:20:43,934][39m Trial 86 finished with value: 0.8869565217391304 and parameters: {'criterion': 'entropy', 'n_estimators': 140, 'max_features': 0.22027332658709864, 'max_depth': 36, 'min_samples_split': 6, 'min_samples_leaf': 3}. Best is trial 66 with value: 0.8869565217391304.
[32m[I 2023-04-26 12:20:44,035][39m Trial 87 finished with value: 0.8771929824561403 and parameters: {'criterion': 'entropy', 'n_estimators': 167, 'max_features': 0.1688434823556199, 'max_depth': 36, 'min_samples_split': 5, 'min_samples_leaf': 4}. Best is trial 66 with value: 0.8869565217391304.
[32m[I 2023-04-26 12:20:44,126][39m Trial 88 finished with value: 0.8771929824561403 and parameters: {'criterion': 'entropy', 'n_estimators': 139, 'max_features': 0.2801703980440998, 'max_depth': 16, 'min_samples_split': 6, 'min_samples_leaf': 3}. Best is trial 66 with value: 0.8869565217391304.
[32m[I 2023-04-26 12:20:44,226][39m Trial 89 finished with value: 0.8596491228070176 and parameters: {'criterion': 'entropy', 'n_estimators': 148, 'max_features': 0.47080793066400045, 'max_depth': 24, 'min_samples_split': 6, 'min_samples_leaf': 4}. Best is trial 66 with value: 0.8869565217391304.
[32m[I 2023-04-26 12:20:44,318][39m Trial 90 finished with value: 0.8288288288288289 and parameters: {'criterion': 'entropy', 'n_estimators': 130, 'max_features': 0.5442034811800605, 'max_depth': 29, 'min_samples_split': 5, 'min_samples_leaf': 2}. Best is trial 66 with value: 0.8869565217391304.
[32m[I 2023-04-26 12:20:44,406][39m Trial 91 finished with value: 0.8672566371681416 and parameters: {'criterion': 'entropy', 'n_estimators': 139, 'max_features': 0.22703003231353944, 'max_depth': 21, 'min_samples_split': 7, 'min_samples_leaf': 3}. Best is trial 66 with value: 0.8869565217391304.
[32m[I 2023-04-26 12:20:44,500][39m Trial 92 finished with value: 0.8571428571428572 and parameters: {'criterion': 'entropy', 'n_estimators': 141, 'max_features': 0.21173426911865784, 'max_depth': 35, 'min_samples_split': 6, 'min_samples_leaf': 3}. Best is trial 66 with value: 0.8869565217391304.
[32m[I 2023-04-26 12:20:44,586][39m Trial 93 finished with value: 0.8771929824561403 and parameters: {'criterion': 'entropy', 'n_estimators': 134, 'max_features': 0.2458249949171925, 'max_depth': 21, 'min_samples_split': 7, 'min_samples_leaf': 3}. Best is trial 66 with value: 0.8869565217391304.
[32m[I 2023-04-26 12:20:44,679][39m Trial 94 finished with value: 0.8392857142857144 and parameters: {'criterion': 'entropy', 'n_estimators': 149, 'max_features': 0.11612537016305158, 'max_depth': 14, 'min_samples_split': 8, 'min_samples_leaf': 2}. Best is trial 66 with value: 0.8869565217391304.
[32m[I 2023-04-26 12:20:44,763][39m Trial 95 finished with value: 0.8771929824561403 and parameters: {'criterion': 'entropy', 'n_estimators': 126, 'max_features': 0.31923322359440304, 'max_depth': 27, 'min_samples_split': 6, 'min_samples_leaf': 4}. Best is trial 66 with value: 0.8869565217391304.
[32m[I 2023-04-26 12:20:44,864][39m Trial 96 finished with value: 0.8288288288288289 and parameters: {'criterion': 'entropy', 'n_estimators': 143, 'max_features': 0.5820642104734806, 'max_depth': 31, 'min_samples_split': 7, 'min_samples_leaf': 3}. Best is trial 66 with value: 0.8869565217391304.
[32m[I 2023-04-26 12:20:44,962][39m Trial 97 finished with value: 0.875 and parameters: {'criterion': 'entropy', 'n_estimators': 156, 'max_features': 0.2847285013604941, 'max_depth': 10, 'min_samples_split': 8, 'min_samples_leaf': 5}. Best is trial 66 with value: 0.8869565217391304.
[32m[I 2023-04-26 12:20:45,059][39m Trial 98 finished with value: 0.8571428571428572 and parameters: {'criterion': 'entropy', 'n_estimators': 162, 'max_features': 0.14327018425707544, 'max_depth': 15, 'min_samples_split': 6, 'min_samples_leaf': 4}. Best is trial 66 with value: 0.8869565217391304.
[32m[I 2023-04-26 12:20:45,143][39m Trial 99 finished with value: 0.8620689655172413 and parameters: {'criterion': 'entropy', 'n_estimators': 132, 'max_features': 0.37995499085906204, 'max_depth': 4, 'min_samples_split': 7, 'min_samples_leaf': 3}. Best is trial 66 with value: 0.8869565217391304.
[32m[I 2023-04-26 12:20:45,223][39m Trial 100 finished with value: 0.8672566371681416 and parameters: {'criterion': 'entropy', 'n_estimators': 119, 'max_features': 0.19167046542117375, 'max_depth': 34, 'min_samples_split': 5, 'min_samples_leaf': 2}. Best is trial 66 with value: 0.8869565217391304.
[32m[I 2023-04-26 12:20:45,300][39m Trial 101 finished with value: 0.8571428571428572 and parameters: {'criterion': 'entropy', 'n_estimators': 122, 'max_features': 0.03185889366966969, 'max_depth': 19, 'min_samples_split': 7, 'min_samples_leaf': 2}. Best is trial 66 with value: 0.8869565217391304.
[32m[I 2023-04-26 12:20:45,404][39m Trial 102 finished with value: 0.8648648648648648 and parameters: {'criterion': 'entropy', 'n_estimators': 169, 'max_features': 0.16553582497735464, 'max_depth': 37, 'min_samples_split': 5, 'min_samples_leaf': 4}. Best is trial 66 with value: 0.8869565217391304.
[32m[I 2023-04-26 12:20:45,476][39m Trial 103 finished with value: 0.8672566371681416 and parameters: {'criterion': 'entropy', 'n_estimators': 114, 'max_features': 0.1788697260917689, 'max_depth': 23, 'min_samples_split': 7, 'min_samples_leaf': 3}. Best is trial 66 with value: 0.8869565217391304.
[32m[I 2023-04-26 12:20:45,558][39m Trial 104 finished with value: 0.8771929824561403 and parameters: {'criterion': 'entropy', 'n_estimators': 126, 'max_features': 0.20427172483430722, 'max_depth': 52, 'min_samples_split': 10, 'min_samples_leaf': 3}. Best is trial 66 with value: 0.8869565217391304.
[32m[I 2023-04-26 12:20:45,635][39m Trial 105 finished with value: 0.8869565217391304 and parameters: {'criterion': 'entropy', 'n_estimators': 119, 'max_features': 0.08203297088781461, 'max_depth': 61, 'min_samples_split': 6, 'min_samples_leaf': 3}. Best is trial 66 with value: 0.8869565217391304.
[32m[I 2023-04-26 12:20:45,719][39m Trial 106 finished with value: 0.8672566371681416 and parameters: {'criterion': 'entropy', 'n_estimators': 136, 'max_features': 0.07872301395953571, 'max_depth': 41, 'min_samples_split': 6, 'min_samples_leaf': 3}. Best is trial 66 with value: 0.8869565217391304.
[32m[I 2023-04-26 12:20:45,808][39m Trial 107 finished with value: 0.8672566371681416 and parameters: {'criterion': 'entropy', 'n_estimators': 146, 'max_features': 0.10383248490239474, 'max_depth': 62, 'min_samples_split': 6, 'min_samples_leaf': 3}. Best is trial 66 with value: 0.8869565217391304.
[32m[I 2023-04-26 12:20:45,889][39m Trial 108 finished with value: 0.8648648648648648 and parameters: {'criterion': 'entropy', 'n_estimators': 131, 'max_features': 0.1512852520398018, 'max_depth': 44, 'min_samples_split': 6, 'min_samples_leaf': 3}. Best is trial 66 with value: 0.8869565217391304.
[32m[I 2023-04-26 12:20:45,969][39m Trial 109 finished with value: 0.8672566371681416 and parameters: {'criterion': 'entropy', 'n_estimators': 119, 'max_features': 0.2372223529302084, 'max_depth': 49, 'min_samples_split': 6, 'min_samples_leaf': 4}. Best is trial 66 with value: 0.8869565217391304.
[32m[I 2023-04-26 12:20:46,072][39m Trial 110 finished with value: 0.8672566371681416 and parameters: {'criterion': 'entropy', 'n_estimators': 151, 'max_features': 0.26270866345210925, 'max_depth': 55, 'min_samples_split': 7, 'min_samples_leaf': 2}. Best is trial 66 with value: 0.8869565217391304.
[32m[I 2023-04-26 12:20:46,159][39m Trial 111 finished with value: 0.8771929824561403 and parameters: {'criterion': 'entropy', 'n_estimators': 133, 'max_features': 0.2544542639329366, 'max_depth': 10, 'min_samples_split': 11, 'min_samples_leaf': 4}. Best is trial 66 with value: 0.8869565217391304.
[32m[I 2023-04-26 12:20:46,251][39m Trial 112 finished with value: 0.8771929824561403 and parameters: {'criterion': 'entropy', 'n_estimators': 141, 'max_features': 0.34284360121517166, 'max_depth': 11, 'min_samples_split': 10, 'min_samples_leaf': 4}. Best is trial 66 with value: 0.8869565217391304.
[32m[I 2023-04-26 12:20:46,339][39m Trial 113 finished with value: 0.8672566371681416 and parameters: {'criterion': 'entropy', 'n_estimators': 142, 'max_features': 0.2212751026319235, 'max_depth': 21, 'min_samples_split': 10, 'min_samples_leaf': 5}. Best is trial 66 with value: 0.8869565217391304.
[32m[I 2023-04-26 12:20:46,432][39m Trial 114 finished with value: 0.8672566371681416 and parameters: {'criterion': 'entropy', 'n_estimators': 139, 'max_features': 0.4068821074270734, 'max_depth': 17, 'min_samples_split': 9, 'min_samples_leaf': 4}. Best is trial 66 with value: 0.8869565217391304.
[32m[I 2023-04-26 12:20:46,534][39m Trial 115 finished with value: 0.8672566371681416 and parameters: {'criterion': 'entropy', 'n_estimators': 154, 'max_features': 0.12669398919273842, 'max_depth': 26, 'min_samples_split': 3, 'min_samples_leaf': 3}. Best is trial 66 with value: 0.8869565217391304.
[32m[I 2023-04-26 12:20:46,630][39m Trial 116 finished with value: 0.8596491228070176 and parameters: {'criterion': 'entropy', 'n_estimators': 151, 'max_features': 0.28531882800647274, 'max_depth': 52, 'min_samples_split': 2, 'min_samples_leaf': 3}. Best is trial 66 with value: 0.8869565217391304.
[32m[I 2023-04-26 12:20:46,717][39m Trial 117 finished with value: 0.8648648648648648 and parameters: {'criterion': 'entropy', 'n_estimators': 136, 'max_features': 0.16019957844014882, 'max_depth': 37, 'min_samples_split': 5, 'min_samples_leaf': 4}. Best is trial 66 with value: 0.8869565217391304.
[32m[I 2023-04-26 12:20:46,810][39m Trial 118 finished with value: 0.8771929824561403 and parameters: {'criterion': 'entropy', 'n_estimators': 144, 'max_features': 0.30436194078097634, 'max_depth': 17, 'min_samples_split': 6, 'min_samples_leaf': 3}. Best is trial 66 with value: 0.8869565217391304.
[32m[I 2023-04-26 12:20:46,901][39m Trial 119 finished with value: 0.8571428571428572 and parameters: {'criterion': 'entropy', 'n_estimators': 147, 'max_features': 0.06336931110687183, 'max_depth': 19, 'min_samples_split': 6, 'min_samples_leaf': 3}. Best is trial 66 with value: 0.8869565217391304.
[32m[I 2023-04-26 12:20:47,046][39m Trial 120 finished with value: 0.8596491228070176 and parameters: {'criterion': 'entropy', 'n_estimators': 161, 'max_features': 0.18354773874625202, 'max_depth': 43, 'min_samples_split': 2, 'min_samples_leaf': 2}. Best is trial 66 with value: 0.8869565217391304.
[32m[I 2023-04-26 12:20:47,199][39m Trial 121 finished with value: 0.8468468468468469 and parameters: {'criterion': 'entropy', 'n_estimators': 123, 'max_features': 0.046409121598640725, 'max_depth': 13, 'min_samples_split': 7, 'min_samples_leaf': 1}. Best is trial 66 with value: 0.8869565217391304.
[32m[I 2023-04-26 12:20:47,335][39m Trial 122 finished with value: 0.8771929824561403 and parameters: {'criterion': 'entropy', 'n_estimators': 107, 'max_features': 0.21379966407660464, 'max_depth': 60, 'min_samples_split': 7, 'min_samples_leaf': 3}. Best is trial 66 with value: 0.8869565217391304.
[32m[I 2023-04-26 12:20:47,471][39m Trial 123 finished with value: 0.8695652173913043 and parameters: {'criterion': 'entropy', 'n_estimators': 104, 'max_features': 0.23349065181552067, 'max_depth': 66, 'min_samples_split': 8, 'min_samples_leaf': 3}. Best is trial 66 with value: 0.8869565217391304.
[32m[I 2023-04-26 12:20:47,664][39m Trial 124 finished with value: 0.8771929824561403 and parameters: {'criterion': 'entropy', 'n_estimators': 159, 'max_features': 0.2965081275465142, 'max_depth': 20, 'min_samples_split': 4, 'min_samples_leaf': 3}. Best is trial 66 with value: 0.8869565217391304.
[32m[I 2023-04-26 12:20:47,819][39m Trial 125 finished with value: 0.875 and parameters: {'criterion': 'entropy', 'n_estimators': 126, 'max_features': 0.20829226388542293, 'max_depth': 57, 'min_samples_split': 2, 'min_samples_leaf': 3}. Best is trial 66 with value: 0.8869565217391304.
[32m[I 2023-04-26 12:20:47,974][39m Trial 126 finished with value: 0.8571428571428572 and parameters: {'criterion': 'entropy', 'n_estimators': 127, 'max_features': 0.026378556267587228, 'max_depth': 26, 'min_samples_split': 6, 'min_samples_leaf': 2}. Best is trial 66 with value: 0.8869565217391304.
[32m[I 2023-04-26 12:20:48,139][39m Trial 127 finished with value: 0.8421052631578947 and parameters: {'criterion': 'entropy', 'n_estimators': 117, 'max_features': 0.6953430236529989, 'max_depth': 27, 'min_samples_split': 7, 'min_samples_leaf': 4}. Best is trial 66 with value: 0.8869565217391304.
[32m[I 2023-04-26 12:20:48,308][39m Trial 128 finished with value: 0.8869565217391304 and parameters: {'criterion': 'entropy', 'n_estimators': 134, 'max_features': 0.2590131565274589, 'max_depth': 9, 'min_samples_split': 6, 'min_samples_leaf': 4}. Best is trial 66 with value: 0.8869565217391304.
[32m[I 2023-04-26 12:20:48,483][39m Trial 129 finished with value: 0.8672566371681416 and parameters: {'criterion': 'entropy', 'n_estimators': 141, 'max_features': 0.3334589908605483, 'max_depth': 6, 'min_samples_split': 6, 'min_samples_leaf': 4}. Best is trial 66 with value: 0.8869565217391304.
[32m[I 2023-04-26 12:20:48,677][39m Trial 130 finished with value: 0.8571428571428572 and parameters: {'criterion': 'entropy', 'n_estimators': 167, 'max_features': 0.11020007967708223, 'max_depth': 24, 'min_samples_split': 5, 'min_samples_leaf': 5}. Best is trial 66 with value: 0.8869565217391304.
[32m[I 2023-04-26 12:20:48,873][39m Trial 131 finished with value: 0.8771929824561403 and parameters: {'criterion': 'entropy', 'n_estimators': 175, 'max_features': 0.20342219876515655, 'max_depth': 53, 'min_samples_split': 4, 'min_samples_leaf': 3}. Best is trial 66 with value: 0.8869565217391304.
[32m[I 2023-04-26 12:20:49,042][39m Trial 132 finished with value: 0.8771929824561403 and parameters: {'criterion': 'entropy', 'n_estimators': 130, 'max_features': 0.26912748123689073, 'max_depth': 15, 'min_samples_split': 6, 'min_samples_leaf': 3}. Best is trial 66 with value: 0.8869565217391304.
[32m[I 2023-04-26 12:20:49,213][39m Trial 133 finished with value: 0.8672566371681416 and parameters: {'criterion': 'entropy', 'n_estimators': 136, 'max_features': 0.34826539627846, 'max_depth': 11, 'min_samples_split': 7, 'min_samples_leaf': 4}. Best is trial 66 with value: 0.8869565217391304.
[32m[I 2023-04-26 12:20:49,375][39m Trial 134 finished with value: 0.8376068376068375 and parameters: {'criterion': 'entropy', 'n_estimators': 135, 'max_features': 0.24444011354445555, 'max_depth': 3, 'min_samples_split': 5, 'min_samples_leaf': 4}. Best is trial 66 with value: 0.8869565217391304.
[32m[I 2023-04-26 12:20:49,555][39m Trial 135 finished with value: 0.8596491228070176 and parameters: {'criterion': 'entropy', 'n_estimators': 138, 'max_features': 0.3196191741754302, 'max_depth': 16, 'min_samples_split': 6, 'min_samples_leaf': 3}. Best is trial 66 with value: 0.8869565217391304.
[32m[I 2023-04-26 12:20:49,639][39m Trial 136 finished with value: 0.8181818181818181 and parameters: {'criterion': 'entropy', 'n_estimators': 52, 'max_features': 0.4307071953863055, 'max_depth': 78, 'min_samples_split': 7, 'min_samples_leaf': 1}. Best is trial 66 with value: 0.8869565217391304.
[32m[I 2023-04-26 12:20:49,772][39m Trial 137 finished with value: 0.8771929824561403 and parameters: {'criterion': 'entropy', 'n_estimators': 99, 'max_features': 0.3736541899451029, 'max_depth': 58, 'min_samples_split': 8, 'min_samples_leaf': 4}. Best is trial 66 with value: 0.8869565217391304.
[32m[I 2023-04-26 12:20:49,966][39m Trial 138 finished with value: 0.8620689655172413 and parameters: {'criterion': 'entropy', 'n_estimators': 152, 'max_features': 0.46865903672357334, 'max_depth': 28, 'min_samples_split': 6, 'min_samples_leaf': 5}. Best is trial 66 with value: 0.8869565217391304.
[32m[I 2023-04-26 12:20:50,133][39m Trial 139 finished with value: 0.8596491228070176 and parameters: {'criterion': 'entropy', 'n_estimators': 132, 'max_features': 0.24891904583851146, 'max_depth': 22, 'min_samples_split': 7, 'min_samples_leaf': 2}. Best is trial 66 with value: 0.8869565217391304.
[32m[I 2023-04-26 12:20:50,322][39m Trial 140 finished with value: 0.8695652173913043 and parameters: {'criterion': 'entropy', 'n_estimators': 148, 'max_features': 0.28831143635874223, 'max_depth': 47, 'min_samples_split': 2, 'min_samples_leaf': 3}. Best is trial 66 with value: 0.8869565217391304.
[32m[I 2023-04-26 12:20:50,478][39m Trial 141 finished with value: 0.8571428571428572 and parameters: {'criterion': 'entropy', 'n_estimators': 121, 'max_features': 0.1848681818109362, 'max_depth': 25, 'min_samples_split': 7, 'min_samples_leaf': 2}. Best is trial 66 with value: 0.8869565217391304.
[32m[I 2023-04-26 12:20:50,644][39m Trial 142 finished with value: 0.8672566371681416 and parameters: {'criterion': 'entropy', 'n_estimators': 129, 'max_features': 0.22913999016018063, 'max_depth': 18, 'min_samples_split': 6, 'min_samples_leaf': 3}. Best is trial 66 with value: 0.8869565217391304.
[32m[I 2023-04-26 12:20:50,802][39m Trial 143 finished with value: 0.8771929824561403 and parameters: {'criterion': 'entropy', 'n_estimators': 125, 'max_features': 0.26606296406791685, 'max_depth': 71, 'min_samples_split': 6, 'min_samples_leaf': 4}. Best is trial 66 with value: 0.8869565217391304.
[32m[I 2023-04-26 12:20:51,004][39m Trial 144 finished with value: 0.8571428571428572 and parameters: {'criterion': 'entropy', 'n_estimators': 157, 'max_features': 0.4948943514938682, 'max_depth': 63, 'min_samples_split': 2, 'min_samples_leaf': 3}. Best is trial 66 with value: 0.8869565217391304.
[32m[I 2023-04-26 12:20:51,181][39m Trial 145 finished with value: 0.8596491228070176 and parameters: {'criterion': 'entropy', 'n_estimators': 145, 'max_features': 0.08249527470510776, 'max_depth': 31, 'min_samples_split': 6, 'min_samples_leaf': 2}. Best is trial 66 with value: 0.8869565217391304.
[32m[I 2023-04-26 12:20:51,356][39m Trial 146 finished with value: 0.8571428571428572 and parameters: {'criterion': 'entropy', 'n_estimators': 140, 'max_features': 0.2767933951762451, 'max_depth': 39, 'min_samples_split': 2, 'min_samples_leaf': 3}. Best is trial 66 with value: 0.8869565217391304.
