[32m[I 2023-04-26 12:21:27,283][39m Trial 439 finished with value: 0.8571428571428572 and parameters: {'criterion': 'entropy', 'n_estimators': 119, 'max_features': 0.14339061794582342, 'max_depth': 56, 'min_samples_split': 9, 'min_samples_leaf': 4}. Best is trial 275 with value: 0.896551724137931.
[32m[I 2023-04-26 12:21:27,388][39m Trial 440 finished with value: 0.8672566371681416 and parameters: {'criterion': 'entropy', 'n_estimators': 158, 'max_features': 0.17259362757437968, 'max_depth': 23, 'min_samples_split': 7, 'min_samples_leaf': 3}. Best is trial 275 with value: 0.896551724137931.
[32m[I 2023-04-26 12:21:27,447][39m Trial 441 finished with value: 0.8545454545454546 and parameters: {'criterion': 'entropy', 'n_estimators': 73, 'max_features': 0.12803589800784687, 'max_depth': 61, 'min_samples_split': 8, 'min_samples_leaf': 3}. Best is trial 275 with value: 0.896551724137931.
[32m[I 2023-04-26 12:21:27,525][39m Trial 442 finished with value: 0.8672566371681416 and parameters: {'criterion': 'entropy', 'n_estimators': 109, 'max_features': 0.2054725451839097, 'max_depth': 48, 'min_samples_split': 6, 'min_samples_leaf': 3}. Best is trial 275 with value: 0.896551724137931.
[32m[I 2023-04-26 12:21:27,603][39m Trial 443 finished with value: 0.8545454545454546 and parameters: {'criterion': 'entropy', 'n_estimators': 117, 'max_features': 0.18466167232407218, 'max_depth': 58, 'min_samples_split': 7, 'min_samples_leaf': 9}. Best is trial 275 with value: 0.896551724137931.
[32m[I 2023-04-26 12:21:27,687][39m Trial 444 finished with value: 0.8571428571428572 and parameters: {'criterion': 'entropy', 'n_estimators': 122, 'max_features': 0.19255738489110727, 'max_depth': 52, 'min_samples_split': 7, 'min_samples_leaf': 3}. Best is trial 275 with value: 0.896551724137931.
[32m[I 2023-04-26 12:21:27,772][39m Trial 445 finished with value: 0.8695652173913043 and parameters: {'criterion': 'entropy', 'n_estimators': 116, 'max_features': 0.3841891875696526, 'max_depth': 30, 'min_samples_split': 5, 'min_samples_leaf': 3}. Best is trial 275 with value: 0.896551724137931.
[32m[I 2023-04-26 12:21:27,900][39m Trial 446 finished with value: 0.8869565217391304 and parameters: {'criterion': 'entropy', 'n_estimators': 200, 'max_features': 0.2021399384827303, 'max_depth': 45, 'min_samples_split': 7, 'min_samples_leaf': 3}. Best is trial 275 with value: 0.896551724137931.
[32m[I 2023-04-26 12:21:28,030][39m Trial 447 finished with value: 0.8672566371681416 and parameters: {'criterion': 'entropy', 'n_estimators': 198, 'max_features': 0.267661856179181, 'max_depth': 44, 'min_samples_split': 6, 'min_samples_leaf': 4}. Best is trial 275 with value: 0.896551724137931.
[32m[I 2023-04-26 12:21:28,172][39m Trial 448 finished with value: 0.8672566371681416 and parameters: {'criterion': 'entropy', 'n_estimators': 194, 'max_features': 0.3054947383331286, 'max_depth': 42, 'min_samples_split': 7, 'min_samples_leaf': 5}. Best is trial 275 with value: 0.896551724137931.
[32m[I 2023-04-26 12:21:28,299][39m Trial 449 finished with value: 0.8672566371681416 and parameters: {'criterion': 'entropy', 'n_estimators': 198, 'max_features': 0.19886611434189888, 'max_depth': 49, 'min_samples_split': 7, 'min_samples_leaf': 4}. Best is trial 275 with value: 0.896551724137931.
[32m[I 2023-04-26 12:21:28,353][39m Trial 450 finished with value: 0.8672566371681416 and parameters: {'criterion': 'entropy', 'n_estimators': 64, 'max_features': 0.17417099909391914, 'max_depth': 55, 'min_samples_split': 7, 'min_samples_leaf': 3}. Best is trial 275 with value: 0.896551724137931.
[32m[I 2023-04-26 12:21:28,482][39m Trial 451 finished with value: 0.8771929824561403 and parameters: {'criterion': 'entropy', 'n_estimators': 200, 'max_features': 0.22134373126634707, 'max_depth': 47, 'min_samples_split': 7, 'min_samples_leaf': 3}. Best is trial 275 with value: 0.896551724137931.
[32m[I 2023-04-26 12:21:28,613][39m Trial 452 finished with value: 0.8771929824561403 and parameters: {'criterion': 'entropy', 'n_estimators': 201, 'max_features': 0.23170069812483127, 'max_depth': 41, 'min_samples_split': 7, 'min_samples_leaf': 2}. Best is trial 275 with value: 0.896551724137931.
[32m[I 2023-04-26 12:21:28,740][39m Trial 453 finished with value: 0.8596491228070176 and parameters: {'criterion': 'entropy', 'n_estimators': 187, 'max_features': 0.354473966768022, 'max_depth': 44, 'min_samples_split': 7, 'min_samples_leaf': 3}. Best is trial 275 with value: 0.896551724137931.
[32m[I 2023-04-26 12:21:28,864][39m Trial 454 finished with value: 0.8672566371681416 and parameters: {'criterion': 'entropy', 'n_estimators': 192, 'max_features': 0.14657870541416754, 'max_depth': 57, 'min_samples_split': 7, 'min_samples_leaf': 4}. Best is trial 275 with value: 0.896551724137931.
[32m[I 2023-04-26 12:21:28,946][39m Trial 455 finished with value: 0.8771929824561403 and parameters: {'criterion': 'entropy', 'n_estimators': 111, 'max_features': 0.25936034768987315, 'max_depth': 51, 'min_samples_split': 8, 'min_samples_leaf': 4}. Best is trial 275 with value: 0.896551724137931.
[32m[I 2023-04-26 12:21:29,005][39m Trial 456 finished with value: 0.8596491228070176 and parameters: {'criterion': 'entropy', 'n_estimators': 76, 'max_features': 0.11390236275718041, 'max_depth': 50, 'min_samples_split': 7, 'min_samples_leaf': 3}. Best is trial 275 with value: 0.896551724137931.
[32m[I 2023-04-26 12:21:29,066][39m Trial 457 finished with value: 0.8672566371681416 and parameters: {'criterion': 'gini', 'n_estimators': 79, 'max_features': 0.28056922895242997, 'max_depth': 20, 'min_samples_split': 9, 'min_samples_leaf': 4}. Best is trial 275 with value: 0.896551724137931.
[32m[I 2023-04-26 12:21:29,171][39m Trial 458 finished with value: 0.8495575221238938 and parameters: {'criterion': 'entropy', 'n_estimators': 125, 'max_features': 0.8725141581065212, 'max_depth': 16, 'min_samples_split': 6, 'min_samples_leaf': 3}. Best is trial 275 with value: 0.896551724137931.
[32m[I 2023-04-26 12:21:29,274][39m Trial 459 finished with value: 0.8695652173913043 and parameters: {'criterion': 'entropy', 'n_estimators': 147, 'max_features': 0.23871990574565494, 'max_depth': 11, 'min_samples_split': 5, 'min_samples_leaf': 3}. Best is trial 275 with value: 0.896551724137931.
[32m[I 2023-04-26 12:21:29,376][39m Trial 460 finished with value: 0.8849557522123893 and parameters: {'criterion': 'entropy', 'n_estimators': 154, 'max_features': 0.1574758460049288, 'max_depth': 54, 'min_samples_split': 8, 'min_samples_leaf': 2}. Best is trial 275 with value: 0.896551724137931.
[32m[I 2023-04-26 12:21:29,507][39m Trial 461 finished with value: 0.8571428571428572 and parameters: {'criterion': 'entropy', 'n_estimators': 201, 'max_features': 0.08105509248400822, 'max_depth': 46, 'min_samples_split': 4, 'min_samples_leaf': 3}. Best is trial 275 with value: 0.896551724137931.
[32m[I 2023-04-26 12:21:29,626][39m Trial 462 finished with value: 0.8771929824561403 and parameters: {'criterion': 'entropy', 'n_estimators': 182, 'max_features': 0.16078403731994112, 'max_depth': 48, 'min_samples_split': 6, 'min_samples_leaf': 3}. Best is trial 275 with value: 0.896551724137931.
[32m[I 2023-04-26 12:21:29,706][39m Trial 463 finished with value: 0.8672566371681416 and parameters: {'criterion': 'entropy', 'n_estimators': 114, 'max_features': 0.19147392105985125, 'max_depth': 52, 'min_samples_split': 7, 'min_samples_leaf': 3}. Best is trial 275 with value: 0.896551724137931.
[32m[I 2023-04-26 12:21:29,819][39m Trial 464 finished with value: 0.8869565217391304 and parameters: {'criterion': 'entropy', 'n_estimators': 172, 'max_features': 0.21092439127119963, 'max_depth': 48, 'min_samples_split': 7, 'min_samples_leaf': 3}. Best is trial 275 with value: 0.896551724137931.
[32m[I 2023-04-26 12:21:29,893][39m Trial 465 finished with value: 0.8771929824561403 and parameters: {'criterion': 'entropy', 'n_estimators': 98, 'max_features': 0.3179026154543377, 'max_depth': 61, 'min_samples_split': 6, 'min_samples_leaf': 4}. Best is trial 275 with value: 0.896551724137931.
[32m[I 2023-04-26 12:21:30,009][39m Trial 466 finished with value: 0.8771929824561403 and parameters: {'criterion': 'entropy', 'n_estimators': 174, 'max_features': 0.1726314894728874, 'max_depth': 50, 'min_samples_split': 7, 'min_samples_leaf': 3}. Best is trial 275 with value: 0.896551724137931.
[32m[I 2023-04-26 12:21:30,125][39m Trial 467 finished with value: 0.8648648648648648 and parameters: {'criterion': 'entropy', 'n_estimators': 176, 'max_features': 0.21008051714795437, 'max_depth': 46, 'min_samples_split': 7, 'min_samples_leaf': 3}. Best is trial 275 with value: 0.896551724137931.
[32m[I 2023-04-26 12:21:30,207][39m Trial 468 finished with value: 0.8596491228070176 and parameters: {'criterion': 'entropy', 'n_estimators': 118, 'max_features': 0.1336285933642289, 'max_depth': 58, 'min_samples_split': 6, 'min_samples_leaf': 3}. Best is trial 275 with value: 0.896551724137931.
[32m[I 2023-04-26 12:21:30,328][39m Trial 469 finished with value: 0.8545454545454546 and parameters: {'criterion': 'entropy', 'n_estimators': 194, 'max_features': 0.16540079599790436, 'max_depth': 6, 'min_samples_split': 8, 'min_samples_leaf': 6}. Best is trial 275 with value: 0.896551724137931.
[32m[I 2023-04-26 12:21:30,425][39m Trial 470 finished with value: 0.8648648648648648 and parameters: {'criterion': 'entropy', 'n_estimators': 143, 'max_features': 0.2971139507664715, 'max_depth': 28, 'min_samples_split': 9, 'min_samples_leaf': 5}. Best is trial 275 with value: 0.896551724137931.
[32m[I 2023-04-26 12:21:30,520][39m Trial 471 finished with value: 0.8288288288288289 and parameters: {'criterion': 'entropy', 'n_estimators': 121, 'max_features': 0.5250182462710326, 'max_depth': 25, 'min_samples_split': 10, 'min_samples_leaf': 2}. Best is trial 275 with value: 0.896551724137931.
[32m[I 2023-04-26 12:21:30,628][39m Trial 472 finished with value: 0.8672566371681416 and parameters: {'criterion': 'entropy', 'n_estimators': 170, 'max_features': 0.09943658126518812, 'max_depth': 48, 'min_samples_split': 7, 'min_samples_leaf': 3}. Best is trial 275 with value: 0.896551724137931.
[32m[I 2023-04-26 12:21:30,756][39m Trial 473 finished with value: 0.8771929824561403 and parameters: {'criterion': 'entropy', 'n_estimators': 196, 'max_features': 0.2221590782919384, 'max_depth': 55, 'min_samples_split': 6, 'min_samples_leaf': 3}. Best is trial 275 with value: 0.896551724137931.
[32m[I 2023-04-26 12:21:30,886][39m Trial 474 finished with value: 0.8849557522123893 and parameters: {'criterion': 'entropy', 'n_estimators': 189, 'max_features': 0.207974938949008, 'max_depth': 53, 'min_samples_split': 6, 'min_samples_leaf': 3}. Best is trial 275 with value: 0.896551724137931.
[32m[I 2023-04-26 12:21:30,944][39m Trial 475 finished with value: 0.8571428571428572 and parameters: {'criterion': 'entropy', 'n_estimators': 70, 'max_features': 0.1900630558413709, 'max_depth': 50, 'min_samples_split': 7, 'min_samples_leaf': 2}. Best is trial 275 with value: 0.896551724137931.
[32m[I 2023-04-26 12:21:31,036][39m Trial 476 finished with value: 0.8849557522123893 and parameters: {'criterion': 'entropy', 'n_estimators': 130, 'max_features': 0.2668265562154275, 'max_depth': 14, 'min_samples_split': 4, 'min_samples_leaf': 4}. Best is trial 275 with value: 0.896551724137931.
[32m[I 2023-04-26 12:21:31,101][39m Trial 477 finished with value: 0.8771929824561403 and parameters: {'criterion': 'gini', 'n_estimators': 83, 'max_features': 0.25715676262123865, 'max_depth': 42, 'min_samples_split': 7, 'min_samples_leaf': 4}. Best is trial 275 with value: 0.896551724137931.
[32m[I 2023-04-26 12:21:31,195][39m Trial 478 finished with value: 0.8849557522123893 and parameters: {'criterion': 'entropy', 'n_estimators': 134, 'max_features': 0.2860165870520197, 'max_depth': 52, 'min_samples_split': 7, 'min_samples_leaf': 3}. Best is trial 275 with value: 0.896551724137931.
[32m[I 2023-04-26 12:21:31,274][39m Trial 479 finished with value: 0.8392857142857144 and parameters: {'criterion': 'entropy', 'n_estimators': 107, 'max_features': 0.14998567996645795, 'max_depth': 59, 'min_samples_split': 7, 'min_samples_leaf': 1}. Best is trial 275 with value: 0.896551724137931.
[32m[I 2023-04-26 12:21:31,359][39m Trial 480 finished with value: 0.8672566371681416 and parameters: {'criterion': 'entropy', 'n_estimators': 115, 'max_features': 0.33825741742009574, 'max_depth': 17, 'min_samples_split': 8, 'min_samples_leaf': 3}. Best is trial 275 with value: 0.896551724137931.
[32m[I 2023-04-26 12:21:31,476][39m Trial 481 finished with value: 0.8672566371681416 and parameters: {'criterion': 'entropy', 'n_estimators': 180, 'max_features': 0.21471555533539435, 'max_depth': 43, 'min_samples_split': 9, 'min_samples_leaf': 3}. Best is trial 275 with value: 0.896551724137931.
[32m[I 2023-04-26 12:21:31,592][39m Trial 482 finished with value: 0.8672566371681416 and parameters: {'criterion': 'entropy', 'n_estimators': 172, 'max_features': 0.19498252545302105, 'max_depth': 45, 'min_samples_split': 6, 'min_samples_leaf': 3}. Best is trial 275 with value: 0.896551724137931.
[32m[I 2023-04-26 12:21:31,638][39m Trial 483 finished with value: 0.8571428571428572 and parameters: {'criterion': 'entropy', 'n_estimators': 50, 'max_features': 0.22666246039654778, 'max_depth': 22, 'min_samples_split': 6, 'min_samples_leaf': 3}. Best is trial 275 with value: 0.896551724137931.
[32m[I 2023-04-26 12:21:31,733][39m Trial 484 finished with value: 0.8771929824561403 and parameters: {'criterion': 'entropy', 'n_estimators': 139, 'max_features': 0.186205906420051, 'max_depth': 55, 'min_samples_split': 7, 'min_samples_leaf': 3}. Best is trial 275 with value: 0.896551724137931.
[32m[I 2023-04-26 12:21:31,793][39m Trial 485 finished with value: 0.8648648648648648 and parameters: {'criterion': 'entropy', 'n_estimators': 73, 'max_features': 0.3144344412870812, 'max_depth': 53, 'min_samples_split': 7, 'min_samples_leaf': 4}. Best is trial 275 with value: 0.896551724137931.
[32m[I 2023-04-26 12:21:31,846][39m Trial 486 finished with value: 0.8648648648648648 and parameters: {'criterion': 'entropy', 'n_estimators': 61, 'max_features': 0.23741968935547378, 'max_depth': 63, 'min_samples_split': 7, 'min_samples_leaf': 4}. Best is trial 275 with value: 0.896551724137931.
[32m[I 2023-04-26 12:21:31,966][39m Trial 487 finished with value: 0.875 and parameters: {'criterion': 'entropy', 'n_estimators': 183, 'max_features': 0.25547608301510344, 'max_depth': 46, 'min_samples_split': 7, 'min_samples_leaf': 5}. Best is trial 275 with value: 0.896551724137931.
[32m[I 2023-04-26 12:21:32,082][39m Trial 488 finished with value: 0.8288288288288289 and parameters: {'criterion': 'entropy', 'n_estimators': 150, 'max_features': 0.6033972636941842, 'max_depth': 48, 'min_samples_split': 7, 'min_samples_leaf': 2}. Best is trial 275 with value: 0.896551724137931.
[32m[I 2023-04-26 12:21:32,193][39m Trial 489 finished with value: 0.8771929824561403 and parameters: {'criterion': 'entropy', 'n_estimators': 163, 'max_features': 0.2436793277626074, 'max_depth': 45, 'min_samples_split': 7, 'min_samples_leaf': 4}. Best is trial 275 with value: 0.896551724137931.
[32m[I 2023-04-26 12:21:32,302][39m Trial 490 finished with value: 0.8596491228070176 and parameters: {'criterion': 'entropy', 'n_estimators': 167, 'max_features': 0.13115024368915748, 'max_depth': 50, 'min_samples_split': 8, 'min_samples_leaf': 3}. Best is trial 275 with value: 0.896551724137931.
[32m[I 2023-04-26 12:21:32,422][39m Trial 491 finished with value: 0.8771929824561403 and parameters: {'criterion': 'entropy', 'n_estimators': 180, 'max_features': 0.2683613630721306, 'max_depth': 47, 'min_samples_split': 6, 'min_samples_leaf': 4}. Best is trial 275 with value: 0.896551724137931.
[32m[I 2023-04-26 12:21:32,540][39m Trial 492 finished with value: 0.8771929824561403 and parameters: {'criterion': 'entropy', 'n_estimators': 178, 'max_features': 0.19736156269651406, 'max_depth': 32, 'min_samples_split': 7, 'min_samples_leaf': 3}. Best is trial 275 with value: 0.896551724137931.
[32m[I 2023-04-26 12:21:32,622][39m Trial 493 finished with value: 0.8672566371681416 and parameters: {'criterion': 'entropy', 'n_estimators': 112, 'max_features': 0.2300210610909501, 'max_depth': 9, 'min_samples_split': 6, 'min_samples_leaf': 3}. Best is trial 275 with value: 0.896551724137931.
[32m[I 2023-04-26 12:21:32,674][39m Trial 494 finished with value: 0.875 and parameters: {'criterion': 'entropy', 'n_estimators': 66, 'max_features': 0.15805685628076546, 'max_depth': 54, 'min_samples_split': 7, 'min_samples_leaf': 8}. Best is trial 275 with value: 0.896551724137931.
[32m[I 2023-04-26 12:21:32,763][39m Trial 495 finished with value: 0.8869565217391304 and parameters: {'criterion': 'entropy', 'n_estimators': 126, 'max_features': 0.16971853357437788, 'max_depth': 20, 'min_samples_split': 7, 'min_samples_leaf': 3}. Best is trial 275 with value: 0.896551724137931.
[32m[I 2023-04-26 12:21:32,889][39m Trial 496 finished with value: 0.8771929824561403 and parameters: {'criterion': 'entropy', 'n_estimators': 185, 'max_features': 0.18155501549998185, 'max_depth': 18, 'min_samples_split': 7, 'min_samples_leaf': 3}. Best is trial 275 with value: 0.896551724137931.
[32m[I 2023-04-26 12:21:32,986][39m Trial 497 finished with value: 0.8468468468468469 and parameters: {'criterion': 'gini', 'n_estimators': 128, 'max_features': 0.15363816580633471, 'max_depth': 23, 'min_samples_split': 5, 'min_samples_leaf': 3}. Best is trial 275 with value: 0.896551724137931.
[32m[I 2023-04-26 12:21:33,095][39m Trial 498 finished with value: 0.8620689655172413 and parameters: {'criterion': 'entropy', 'n_estimators': 161, 'max_features': 0.209923439868707, 'max_depth': 48, 'min_samples_split': 7, 'min_samples_leaf': 2}. Best is trial 275 with value: 0.896551724137931.
[32m[I 2023-04-26 12:21:33,184][39m Trial 499 finished with value: 0.8869565217391304 and parameters: {'criterion': 'entropy', 'n_estimators': 126, 'max_features': 0.16274895913487877, 'max_depth': 57, 'min_samples_split': 8, 'min_samples_leaf': 4}. Best is trial 275 with value: 0.896551724137931.
Number of finished trials: 500