[32m[I 2023-04-20 22:46:19,604][39m Trial 133 finished with value: 0.8539325842696629 and parameters: {'objective': 'Logloss', 'colsample_bylevel': 0.0828888477822124, 'depth': 3, 'boosting_type': 'Plain', 'bootstrap_type': 'Bayesian', 'bagging_temperature': 9.158507378281021}. Best is trial 60 with value: 0.8666666666666666.
[32m[I 2023-04-20 22:46:20,989][39m Trial 134 finished with value: 0.8636363636363636 and parameters: {'objective': 'CrossEntropy', 'colsample_bylevel': 0.08023528147391105, 'depth': 2, 'boosting_type': 'Plain', 'bootstrap_type': 'Bayesian', 'bagging_temperature': 8.588540692594531}. Best is trial 60 with value: 0.8666666666666666.
[32m[I 2023-04-20 22:46:22,019][39m Trial 135 finished with value: 0.8636363636363636 and parameters: {'objective': 'CrossEntropy', 'colsample_bylevel': 0.08011505390484638, 'depth': 2, 'boosting_type': 'Plain', 'bootstrap_type': 'Bayesian', 'bagging_temperature': 9.250182029455157}. Best is trial 60 with value: 0.8666666666666666.
[32m[I 2023-04-20 22:46:22,565][39m Trial 136 finished with value: 0.8505747126436782 and parameters: {'objective': 'CrossEntropy', 'colsample_bylevel': 0.07279062376878537, 'depth': 2, 'boosting_type': 'Plain', 'bootstrap_type': 'Bayesian', 'bagging_temperature': 8.760041262648922}. Best is trial 60 with value: 0.8666666666666666.
[32m[I 2023-04-20 22:46:23,823][39m Trial 137 finished with value: 0.8409090909090909 and parameters: {'objective': 'CrossEntropy', 'colsample_bylevel': 0.07723506611682025, 'depth': 2, 'boosting_type': 'Plain', 'bootstrap_type': 'Bayesian', 'bagging_temperature': 6.300994337803761}. Best is trial 60 with value: 0.8666666666666666.
[32m[I 2023-04-20 22:46:24,466][39m Trial 138 finished with value: 0.8275862068965518 and parameters: {'objective': 'CrossEntropy', 'colsample_bylevel': 0.0792566726606635, 'depth': 2, 'boosting_type': 'Plain', 'bootstrap_type': 'Bayesian', 'bagging_temperature': 8.447006599410004}. Best is trial 60 with value: 0.8666666666666666.
[32m[I 2023-04-20 22:46:25,314][39m Trial 139 finished with value: 0.8275862068965518 and parameters: {'objective': 'CrossEntropy', 'colsample_bylevel': 0.07153704197281888, 'depth': 1, 'boosting_type': 'Plain', 'bootstrap_type': 'Bayesian', 'bagging_temperature': 8.578982344466091}. Best is trial 60 with value: 0.8666666666666666.
[32m[I 2023-04-20 22:46:26,311][39m Trial 140 finished with value: 0.8636363636363636 and parameters: {'objective': 'CrossEntropy', 'colsample_bylevel': 0.09030682751346161, 'depth': 2, 'boosting_type': 'Plain', 'bootstrap_type': 'Bayesian', 'bagging_temperature': 9.1995735295156}. Best is trial 60 with value: 0.8666666666666666.
[32m[I 2023-04-20 22:46:27,191][39m Trial 141 finished with value: 0.8275862068965518 and parameters: {'objective': 'CrossEntropy', 'colsample_bylevel': 0.09041501802380178, 'depth': 2, 'boosting_type': 'Plain', 'bootstrap_type': 'Bayesian', 'bagging_temperature': 9.343762743117958}. Best is trial 60 with value: 0.8666666666666666.
[32m[I 2023-04-20 22:46:28,249][39m Trial 142 finished with value: 0.8539325842696629 and parameters: {'objective': 'CrossEntropy', 'colsample_bylevel': 0.08381279441432342, 'depth': 2, 'boosting_type': 'Plain', 'bootstrap_type': 'Bayesian', 'bagging_temperature': 9.780156942778925}. Best is trial 60 with value: 0.8666666666666666.
[32m[I 2023-04-20 22:46:29,271][39m Trial 143 finished with value: 0.8636363636363636 and parameters: {'objective': 'CrossEntropy', 'colsample_bylevel': 0.08003646694207914, 'depth': 2, 'boosting_type': 'Plain', 'bootstrap_type': 'Bayesian', 'bagging_temperature': 9.006857236761672}. Best is trial 60 with value: 0.8666666666666666.
[32m[I 2023-04-20 22:46:30,214][39m Trial 144 finished with value: 0.8764044943820225 and parameters: {'objective': 'CrossEntropy', 'colsample_bylevel': 0.08604238744246116, 'depth': 2, 'boosting_type': 'Plain', 'bootstrap_type': 'Bayesian', 'bagging_temperature': 9.127720864219574}. Best is trial 144 with value: 0.8764044943820225.
[32m[I 2023-04-20 22:46:31,510][39m Trial 145 finished with value: 0.8372093023255814 and parameters: {'objective': 'CrossEntropy', 'colsample_bylevel': 0.08062382997693314, 'depth': 2, 'boosting_type': 'Plain', 'bootstrap_type': 'Bayesian', 'bagging_temperature': 8.64630298210927}. Best is trial 144 with value: 0.8764044943820225.
[32m[I 2023-04-20 22:46:32,256][39m Trial 146 finished with value: 0.8505747126436782 and parameters: {'objective': 'CrossEntropy', 'colsample_bylevel': 0.0861977468536424, 'depth': 2, 'boosting_type': 'Plain', 'bootstrap_type': 'Bayesian', 'bagging_temperature': 9.206484926708109}. Best is trial 144 with value: 0.8764044943820225.
[32m[I 2023-04-20 22:46:33,099][39m Trial 147 finished with value: 0.8275862068965518 and parameters: {'objective': 'CrossEntropy', 'colsample_bylevel': 0.081930032574251, 'depth': 1, 'boosting_type': 'Plain', 'bootstrap_type': 'Bayesian', 'bagging_temperature': 8.989378093763204}. Best is trial 144 with value: 0.8764044943820225.
[32m[I 2023-04-20 22:46:34,020][39m Trial 148 finished with value: 0.8275862068965518 and parameters: {'objective': 'CrossEntropy', 'colsample_bylevel': 0.08430147118451597, 'depth': 2, 'boosting_type': 'Plain', 'bootstrap_type': 'Bayesian', 'bagging_temperature': 9.654813559060463}. Best is trial 144 with value: 0.8764044943820225.
[32m[I 2023-04-20 22:46:34,854][39m Trial 149 finished with value: 0.8764044943820225 and parameters: {'objective': 'CrossEntropy', 'colsample_bylevel': 0.08730724860267644, 'depth': 2, 'boosting_type': 'Plain', 'bootstrap_type': 'Bayesian', 'bagging_temperature': 9.369380598229224}. Best is trial 144 with value: 0.8764044943820225.
[32m[I 2023-04-20 22:46:35,784][39m Trial 150 finished with value: 0.8 and parameters: {'objective': 'CrossEntropy', 'colsample_bylevel': 0.06916747433723239, 'depth': 1, 'boosting_type': 'Plain', 'bootstrap_type': 'MVS'}. Best is trial 144 with value: 0.8764044943820225.
[32m[I 2023-04-20 22:46:36,626][39m Trial 151 finished with value: 0.8539325842696629 and parameters: {'objective': 'CrossEntropy', 'colsample_bylevel': 0.08676459294156624, 'depth': 2, 'boosting_type': 'Plain', 'bootstrap_type': 'Bayesian', 'bagging_temperature': 8.271543412787828}. Best is trial 144 with value: 0.8764044943820225.
[32m[I 2023-04-20 22:46:37,564][39m Trial 152 finished with value: 0.8636363636363636 and parameters: {'objective': 'CrossEntropy', 'colsample_bylevel': 0.08728443243169065, 'depth': 2, 'boosting_type': 'Plain', 'bootstrap_type': 'Bayesian', 'bagging_temperature': 9.155188287382352}. Best is trial 144 with value: 0.8764044943820225.
[32m[I 2023-04-20 22:46:38,386][39m Trial 153 finished with value: 0.8409090909090909 and parameters: {'objective': 'CrossEntropy', 'colsample_bylevel': 0.07586918712740856, 'depth': 2, 'boosting_type': 'Plain', 'bootstrap_type': 'Bayesian', 'bagging_temperature': 9.347850841184693}. Best is trial 144 with value: 0.8764044943820225.
[32m[I 2023-04-20 22:46:39,238][39m Trial 154 finished with value: 0.8666666666666666 and parameters: {'objective': 'CrossEntropy', 'colsample_bylevel': 0.08510779017893268, 'depth': 3, 'boosting_type': 'Plain', 'bootstrap_type': 'Bayesian', 'bagging_temperature': 9.1014273749483}. Best is trial 144 with value: 0.8764044943820225.
[32m[I 2023-04-20 22:46:40,123][39m Trial 155 finished with value: 0.8539325842696629 and parameters: {'objective': 'CrossEntropy', 'colsample_bylevel': 0.08469334414498948, 'depth': 2, 'boosting_type': 'Plain', 'bootstrap_type': 'Bayesian', 'bagging_temperature': 9.126644758900895}. Best is trial 144 with value: 0.8764044943820225.
[32m[I 2023-04-20 22:46:40,938][39m Trial 156 finished with value: 0.8764044943820225 and parameters: {'objective': 'CrossEntropy', 'colsample_bylevel': 0.08785635456992724, 'depth': 2, 'boosting_type': 'Plain', 'bootstrap_type': 'Bayesian', 'bagging_temperature': 9.457342556834945}. Best is trial 144 with value: 0.8764044943820225.
[32m[I 2023-04-20 22:46:42,245][39m Trial 157 finished with value: 0.8131868131868132 and parameters: {'objective': 'CrossEntropy', 'colsample_bylevel': 0.0864970200745794, 'depth': 1, 'boosting_type': 'Plain', 'bootstrap_type': 'Bernoulli', 'subsample': 0.2857636677851136}. Best is trial 144 with value: 0.8764044943820225.
[32m[I 2023-04-20 22:46:42,894][39m Trial 158 finished with value: 0.8539325842696629 and parameters: {'objective': 'CrossEntropy', 'colsample_bylevel': 0.06171277901606051, 'depth': 3, 'boosting_type': 'Plain', 'bootstrap_type': 'Bayesian', 'bagging_temperature': 9.807606467540817}. Best is trial 144 with value: 0.8764044943820225.
[32m[I 2023-04-20 22:46:44,086][39m Trial 159 finished with value: 0.8666666666666666 and parameters: {'objective': 'CrossEntropy', 'colsample_bylevel': 0.0781413653195509, 'depth': 2, 'boosting_type': 'Plain', 'bootstrap_type': 'Bayesian', 'bagging_temperature': 9.39585825692409}. Best is trial 144 with value: 0.8764044943820225.
[32m[I 2023-04-20 22:46:44,825][39m Trial 160 finished with value: 0.8409090909090909 and parameters: {'objective': 'CrossEntropy', 'colsample_bylevel': 0.07745130081697102, 'depth': 2, 'boosting_type': 'Plain', 'bootstrap_type': 'Bayesian', 'bagging_temperature': 9.386709921410924}. Best is trial 144 with value: 0.8764044943820225.
[32m[I 2023-04-20 22:46:45,967][39m Trial 161 finished with value: 0.8539325842696629 and parameters: {'objective': 'CrossEntropy', 'colsample_bylevel': 0.08203752628183611, 'depth': 2, 'boosting_type': 'Plain', 'bootstrap_type': 'Bayesian', 'bagging_temperature': 8.972954205714393}. Best is trial 144 with value: 0.8764044943820225.
[32m[I 2023-04-20 22:46:47,840][39m Trial 163 finished with value: 0.8539325842696629 and parameters: {'objective': 'CrossEntropy', 'colsample_bylevel': 0.08859040635229738, 'depth': 2, 'boosting_type': 'Plain', 'bootstrap_type': 'Bayesian', 'bagging_temperature': 9.610362438574391}. Best is trial 144 with value: 0.8764044943820225.
[32m[I 2023-04-20 22:46:48,947][39m Trial 164 finished with value: 0.8409090909090909 and parameters: {'objective': 'CrossEntropy', 'colsample_bylevel': 0.0865412544017248, 'depth': 2, 'boosting_type': 'Plain', 'bootstrap_type': 'Bayesian', 'bagging_temperature': 9.39740533286427}. Best is trial 144 with value: 0.8764044943820225.
[32m[I 2023-04-20 22:46:50,155][39m Trial 165 finished with value: 0.7906976744186047 and parameters: {'objective': 'CrossEntropy', 'colsample_bylevel': 0.08496088299440262, 'depth': 1, 'boosting_type': 'Plain', 'bootstrap_type': 'Bayesian', 'bagging_temperature': 9.087217160277534}. Best is trial 144 with value: 0.8764044943820225.
[32m[I 2023-04-20 22:46:51,257][39m Trial 166 finished with value: 0.8539325842696629 and parameters: {'objective': 'CrossEntropy', 'colsample_bylevel': 0.08005691737058371, 'depth': 3, 'boosting_type': 'Plain', 'bootstrap_type': 'Bayesian', 'bagging_temperature': 9.279263163053997}. Best is trial 144 with value: 0.8764044943820225.
[32m[I 2023-04-20 22:46:52,481][39m Trial 167 finished with value: 0.8539325842696629 and parameters: {'objective': 'CrossEntropy', 'colsample_bylevel': 0.09013562454713485, 'depth': 2, 'boosting_type': 'Plain', 'bootstrap_type': 'Bayesian', 'bagging_temperature': 8.788828093424003}. Best is trial 144 with value: 0.8764044943820225.
[32m[I 2023-04-20 22:46:54,123][39m Trial 168 finished with value: 0.8505747126436782 and parameters: {'objective': 'CrossEntropy', 'colsample_bylevel': 0.09138138283202481, 'depth': 1, 'boosting_type': 'Plain', 'bootstrap_type': 'Bayesian', 'bagging_temperature': 9.91137633057795}. Best is trial 144 with value: 0.8764044943820225.
[32m[I 2023-04-20 22:46:56,207][39m Trial 169 finished with value: 0.8666666666666666 and parameters: {'objective': 'CrossEntropy', 'colsample_bylevel': 0.08289067669099645, 'depth': 2, 'boosting_type': 'Plain', 'bootstrap_type': 'Bayesian', 'bagging_temperature': 8.992327910411786}. Best is trial 144 with value: 0.8764044943820225.
[32m[I 2023-04-20 22:46:57,799][39m Trial 170 finished with value: 0.8505747126436782 and parameters: {'objective': 'CrossEntropy', 'colsample_bylevel': 0.08410735074273452, 'depth': 2, 'boosting_type': 'Plain', 'bootstrap_type': 'Bayesian', 'bagging_temperature': 8.935850302098903}. Best is trial 144 with value: 0.8764044943820225.
[32m[I 2023-04-20 22:46:59,209][39m Trial 171 finished with value: 0.8666666666666666 and parameters: {'objective': 'CrossEntropy', 'colsample_bylevel': 0.08218041552073788, 'depth': 2, 'boosting_type': 'Plain', 'bootstrap_type': 'Bayesian', 'bagging_temperature': 9.460149869353916}. Best is trial 144 with value: 0.8764044943820225.
[32m[I 2023-04-20 22:47:00,691][39m Trial 172 finished with value: 0.8539325842696629 and parameters: {'objective': 'CrossEntropy', 'colsample_bylevel': 0.08110385587968534, 'depth': 2, 'boosting_type': 'Plain', 'bootstrap_type': 'Bayesian', 'bagging_temperature': 9.99631600554611}. Best is trial 144 with value: 0.8764044943820225.
[32m[I 2023-04-20 22:47:02,073][39m Trial 173 finished with value: 0.8666666666666666 and parameters: {'objective': 'CrossEntropy', 'colsample_bylevel': 0.07804701215612285, 'depth': 2, 'boosting_type': 'Plain', 'bootstrap_type': 'Bayesian', 'bagging_temperature': 9.491694052776179}. Best is trial 144 with value: 0.8764044943820225.
[32m[I 2023-04-20 22:47:03,541][39m Trial 174 finished with value: 0.8505747126436782 and parameters: {'objective': 'CrossEntropy', 'colsample_bylevel': 0.08280867448770256, 'depth': 2, 'boosting_type': 'Plain', 'bootstrap_type': 'Bayesian', 'bagging_temperature': 9.47975316816831}. Best is trial 144 with value: 0.8764044943820225.
[32m[I 2023-04-20 22:47:04,829][39m Trial 175 finished with value: 0.8666666666666666 and parameters: {'objective': 'CrossEntropy', 'colsample_bylevel': 0.07843023149566024, 'depth': 2, 'boosting_type': 'Plain', 'bootstrap_type': 'Bayesian', 'bagging_temperature': 9.024476369648246}. Best is trial 144 with value: 0.8764044943820225.
[32m[I 2023-04-20 22:47:06,287][39m Trial 176 finished with value: 0.8764044943820225 and parameters: {'objective': 'CrossEntropy', 'colsample_bylevel': 0.07575646640128147, 'depth': 2, 'boosting_type': 'Plain', 'bootstrap_type': 'Bayesian', 'bagging_temperature': 9.690097543811264}. Best is trial 144 with value: 0.8764044943820225.
[32m[I 2023-04-20 22:47:07,557][39m Trial 177 finished with value: 0.8222222222222222 and parameters: {'objective': 'CrossEntropy', 'colsample_bylevel': 0.073470334264026, 'depth': 2, 'boosting_type': 'Plain', 'bootstrap_type': 'Bayesian', 'bagging_temperature': 0.8844546103295556}. Best is trial 144 with value: 0.8764044943820225.
[32m[I 2023-04-20 22:47:08,832][39m Trial 178 finished with value: 0.7710843373493976 and parameters: {'objective': 'CrossEntropy', 'colsample_bylevel': 0.07594274738735535, 'depth': 1, 'boosting_type': 'Plain', 'bootstrap_type': 'Bayesian', 'bagging_temperature': 9.7164753884851}. Best is trial 144 with value: 0.8764044943820225.
[32m[I 2023-04-20 22:47:10,077][39m Trial 179 finished with value: 0.8333333333333333 and parameters: {'objective': 'CrossEntropy', 'colsample_bylevel': 0.04426351952469901, 'depth': 2, 'boosting_type': 'Plain', 'bootstrap_type': 'Bayesian', 'bagging_temperature': 9.403983749780993}. Best is trial 144 with value: 0.8764044943820225.
[32m[I 2023-04-20 22:47:11,619][39m Trial 180 finished with value: 0.8666666666666666 and parameters: {'objective': 'CrossEntropy', 'colsample_bylevel': 0.07807231709697385, 'depth': 2, 'boosting_type': 'Plain', 'bootstrap_type': 'Bayesian', 'bagging_temperature': 9.024106591265012}. Best is trial 144 with value: 0.8764044943820225.
[32m[I 2023-04-20 22:47:13,112][39m Trial 181 finished with value: 0.8764044943820225 and parameters: {'objective': 'CrossEntropy', 'colsample_bylevel': 0.07862372302523345, 'depth': 2, 'boosting_type': 'Plain', 'bootstrap_type': 'Bayesian', 'bagging_temperature': 8.97169495735685}. Best is trial 144 with value: 0.8764044943820225.
[32m[I 2023-04-20 22:47:14,660][39m Trial 182 finished with value: 0.8539325842696629 and parameters: {'objective': 'CrossEntropy', 'colsample_bylevel': 0.0780435854334847, 'depth': 2, 'boosting_type': 'Plain', 'bootstrap_type': 'Bayesian', 'bagging_temperature': 8.8277653211477}. Best is trial 144 with value: 0.8764044943820225.
[32m[I 2023-04-20 22:47:16,116][39m Trial 183 finished with value: 0.8275862068965518 and parameters: {'objective': 'CrossEntropy', 'colsample_bylevel': 0.07497861391972571, 'depth': 2, 'boosting_type': 'Plain', 'bootstrap_type': 'Bayesian', 'bagging_temperature': 9.502299127418581}. Best is trial 144 with value: 0.8764044943820225.
[32m[I 2023-04-20 22:47:17,678][39m Trial 184 finished with value: 0.8666666666666666 and parameters: {'objective': 'CrossEntropy', 'colsample_bylevel': 0.07847595783271498, 'depth': 3, 'boosting_type': 'Plain', 'bootstrap_type': 'Bayesian', 'bagging_temperature': 9.715162460999762}. Best is trial 144 with value: 0.8764044943820225.
[32m[I 2023-04-20 22:47:19,265][39m Trial 185 finished with value: 0.8409090909090909 and parameters: {'objective': 'CrossEntropy', 'colsample_bylevel': 0.07700047433770096, 'depth': 3, 'boosting_type': 'Plain', 'bootstrap_type': 'Bayesian', 'bagging_temperature': 9.700035704030629}. Best is trial 144 with value: 0.8764044943820225.
[32m[I 2023-04-20 22:47:20,692][39m Trial 186 finished with value: 0.8409090909090909 and parameters: {'objective': 'CrossEntropy', 'colsample_bylevel': 0.07749831015773635, 'depth': 3, 'boosting_type': 'Plain', 'bootstrap_type': 'MVS'}. Best is trial 144 with value: 0.8764044943820225.
[32m[I 2023-04-20 22:47:22,060][39m Trial 187 finished with value: 0.8636363636363636 and parameters: {'objective': 'CrossEntropy', 'colsample_bylevel': 0.07852913916638098, 'depth': 3, 'boosting_type': 'Plain', 'bootstrap_type': 'Bayesian', 'bagging_temperature': 9.491214457067258}. Best is trial 144 with value: 0.8764044943820225.
[32m[I 2023-04-20 22:47:23,514][39m Trial 188 finished with value: 0.8636363636363636 and parameters: {'objective': 'CrossEntropy', 'colsample_bylevel': 0.07427409574254008, 'depth': 2, 'boosting_type': 'Plain', 'bootstrap_type': 'Bayesian', 'bagging_temperature': 8.988394824053755}. Best is trial 144 with value: 0.8764044943820225.
[32m[I 2023-04-20 22:47:24,865][39m Trial 189 finished with value: 0.8571428571428571 and parameters: {'objective': 'CrossEntropy', 'colsample_bylevel': 0.07316181105987105, 'depth': 3, 'boosting_type': 'Plain', 'bootstrap_type': 'Bayesian', 'bagging_temperature': 9.742275314458928}. Best is trial 144 with value: 0.8764044943820225.
[32m[I 2023-04-20 22:47:26,287][39m Trial 190 finished with value: 0.8764044943820225 and parameters: {'objective': 'CrossEntropy', 'colsample_bylevel': 0.08259970480210646, 'depth': 2, 'boosting_type': 'Plain', 'bootstrap_type': 'Bayesian', 'bagging_temperature': 9.121112429927821}. Best is trial 144 with value: 0.8764044943820225.
[32m[I 2023-04-20 22:47:27,569][39m Trial 191 finished with value: 0.8275862068965518 and parameters: {'objective': 'CrossEntropy', 'colsample_bylevel': 0.030543679882528593, 'depth': 2, 'boosting_type': 'Plain', 'bootstrap_type': 'Bayesian', 'bagging_temperature': 8.979996482375661}. Best is trial 144 with value: 0.8764044943820225.
[32m[I 2023-04-20 22:47:28,858][39m Trial 192 finished with value: 0.8539325842696629 and parameters: {'objective': 'CrossEntropy', 'colsample_bylevel': 0.07879744549453098, 'depth': 3, 'boosting_type': 'Plain', 'bootstrap_type': 'Bayesian', 'bagging_temperature': 9.500693601780279}. Best is trial 144 with value: 0.8764044943820225.
[32m[I 2023-04-20 22:47:30,242][39m Trial 193 finished with value: 0.8666666666666666 and parameters: {'objective': 'CrossEntropy', 'colsample_bylevel': 0.08202937526350493, 'depth': 2, 'boosting_type': 'Plain', 'bootstrap_type': 'Bayesian', 'bagging_temperature': 9.010051567903858}. Best is trial 144 with value: 0.8764044943820225.
[32m[I 2023-04-20 22:47:31,641][39m Trial 194 finished with value: 0.8409090909090909 and parameters: {'objective': 'CrossEntropy', 'colsample_bylevel': 0.08216194850448946, 'depth': 2, 'boosting_type': 'Plain', 'bootstrap_type': 'Bernoulli', 'subsample': 0.8375204967528456}. Best is trial 144 with value: 0.8764044943820225.
[32m[I 2023-04-20 22:47:33,025][39m Trial 195 finished with value: 0.8275862068965518 and parameters: {'objective': 'CrossEntropy', 'colsample_bylevel': 0.08367797549009331, 'depth': 1, 'boosting_type': 'Plain', 'bootstrap_type': 'Bayesian', 'bagging_temperature': 8.70617552562287}. Best is trial 144 with value: 0.8764044943820225.
[32m[I 2023-04-20 22:47:34,473][39m Trial 196 finished with value: 0.8409090909090909 and parameters: {'objective': 'CrossEntropy', 'colsample_bylevel': 0.08114916648988199, 'depth': 2, 'boosting_type': 'Plain', 'bootstrap_type': 'Bayesian', 'bagging_temperature': 1.7368703461759432}. Best is trial 144 with value: 0.8764044943820225.
[32m[I 2023-04-20 22:47:35,990][39m Trial 197 finished with value: 0.8666666666666666 and parameters: {'objective': 'CrossEntropy', 'colsample_bylevel': 0.07580402603223572, 'depth': 2, 'boosting_type': 'Plain', 'bootstrap_type': 'Bayesian', 'bagging_temperature': 9.29477792543615}. Best is trial 144 with value: 0.8764044943820225.
[32m[I 2023-04-20 22:47:37,576][39m Trial 198 finished with value: 0.8636363636363636 and parameters: {'objective': 'CrossEntropy', 'colsample_bylevel': 0.07520288192117873, 'depth': 2, 'boosting_type': 'Plain', 'bootstrap_type': 'Bayesian', 'bagging_temperature': 9.368536512121619}. Best is trial 144 with value: 0.8764044943820225.
