[32m[I 2023-04-20 22:50:44,456][39m Trial 394 finished with value: 0.8539325842696629 and parameters: {'objective': 'CrossEntropy', 'colsample_bylevel': 0.09439726853331433, 'depth': 3, 'boosting_type': 'Plain', 'bootstrap_type': 'Bayesian', 'bagging_temperature': 8.459448539231609}. Best is trial 209 with value: 0.8791208791208791.
[32m[I 2023-04-20 22:50:45,632][39m Trial 395 finished with value: 0.8275862068965518 and parameters: {'objective': 'CrossEntropy', 'colsample_bylevel': 0.09099027021242592, 'depth': 2, 'boosting_type': 'Plain', 'bootstrap_type': 'MVS'}. Best is trial 209 with value: 0.8791208791208791.
[32m[I 2023-04-20 22:50:46,550][39m Trial 396 finished with value: 0.8409090909090909 and parameters: {'objective': 'CrossEntropy', 'colsample_bylevel': 0.08900795834714575, 'depth': 2, 'boosting_type': 'Plain', 'bootstrap_type': 'Bayesian', 'bagging_temperature': 9.71527243446847}. Best is trial 209 with value: 0.8791208791208791.
[32m[I 2023-04-20 22:50:47,628][39m Trial 397 finished with value: 0.8666666666666666 and parameters: {'objective': 'CrossEntropy', 'colsample_bylevel': 0.09288445092323674, 'depth': 2, 'boosting_type': 'Plain', 'bootstrap_type': 'Bayesian', 'bagging_temperature': 9.694198534191456}. Best is trial 209 with value: 0.8791208791208791.
[32m[I 2023-04-20 22:50:48,679][39m Trial 398 finished with value: 0.8791208791208791 and parameters: {'objective': 'CrossEntropy', 'colsample_bylevel': 0.07400133995691843, 'depth': 3, 'boosting_type': 'Plain', 'bootstrap_type': 'Bayesian', 'bagging_temperature': 8.956424703411942}. Best is trial 209 with value: 0.8791208791208791.
[32m[I 2023-04-20 22:50:49,240][39m Trial 399 finished with value: 0.8791208791208791 and parameters: {'objective': 'CrossEntropy', 'colsample_bylevel': 0.07410141976454021, 'depth': 3, 'boosting_type': 'Plain', 'bootstrap_type': 'Bayesian', 'bagging_temperature': 8.53081496347238}. Best is trial 209 with value: 0.8791208791208791.
[32m[I 2023-04-20 22:50:49,792][39m Trial 400 finished with value: 0.8539325842696629 and parameters: {'objective': 'CrossEntropy', 'colsample_bylevel': 0.07331047792652363, 'depth': 3, 'boosting_type': 'Plain', 'bootstrap_type': 'Bayesian', 'bagging_temperature': 8.90650890426496}. Best is trial 209 with value: 0.8791208791208791.
[32m[I 2023-04-20 22:50:50,511][39m Trial 401 finished with value: 0.8539325842696629 and parameters: {'objective': 'CrossEntropy', 'colsample_bylevel': 0.07416220761826647, 'depth': 3, 'boosting_type': 'Plain', 'bootstrap_type': 'Bayesian', 'bagging_temperature': 8.881412607858636}. Best is trial 209 with value: 0.8791208791208791.
[32m[I 2023-04-20 22:50:51,898][39m Trial 402 finished with value: 0.8139534883720929 and parameters: {'objective': 'CrossEntropy', 'colsample_bylevel': 0.07145273875832606, 'depth': 4, 'boosting_type': 'Plain', 'bootstrap_type': 'Bernoulli', 'subsample': 0.5696753240968166}. Best is trial 209 with value: 0.8791208791208791.
[32m[I 2023-04-20 22:50:53,189][39m Trial 403 finished with value: 0.8539325842696629 and parameters: {'objective': 'CrossEntropy', 'colsample_bylevel': 0.0795263761534933, 'depth': 3, 'boosting_type': 'Plain', 'bootstrap_type': 'Bayesian', 'bagging_temperature': 9.16667175777195}. Best is trial 209 with value: 0.8791208791208791.
[32m[I 2023-04-20 22:50:53,950][39m Trial 404 finished with value: 0.8539325842696629 and parameters: {'objective': 'CrossEntropy', 'colsample_bylevel': 0.07751497923708468, 'depth': 3, 'boosting_type': 'Plain', 'bootstrap_type': 'Bayesian', 'bagging_temperature': 9.386559721906677}. Best is trial 209 with value: 0.8791208791208791.
[32m[I 2023-04-20 22:50:58,380][39m Trial 405 finished with value: 0.8539325842696629 and parameters: {'objective': 'CrossEntropy', 'colsample_bylevel': 0.0695100546201645, 'depth': 3, 'boosting_type': 'Ordered', 'bootstrap_type': 'Bayesian', 'bagging_temperature': 8.640975707474137}. Best is trial 209 with value: 0.8791208791208791.
[32m[I 2023-04-20 22:50:59,701][39m Trial 406 finished with value: 0.8539325842696629 and parameters: {'objective': 'CrossEntropy', 'colsample_bylevel': 0.083101857430986, 'depth': 3, 'boosting_type': 'Plain', 'bootstrap_type': 'Bayesian', 'bagging_temperature': 8.244004176269515}. Best is trial 209 with value: 0.8791208791208791.
[32m[I 2023-04-20 22:51:00,354][39m Trial 407 finished with value: 0.8139534883720929 and parameters: {'objective': 'CrossEntropy', 'colsample_bylevel': 0.09642552918652658, 'depth': 3, 'boosting_type': 'Plain', 'bootstrap_type': 'Bayesian', 'bagging_temperature': 8.528668816582842}. Best is trial 209 with value: 0.8791208791208791.
[32m[I 2023-04-20 22:51:01,333][39m Trial 408 finished with value: 0.8666666666666666 and parameters: {'objective': 'CrossEntropy', 'colsample_bylevel': 0.07625191043699671, 'depth': 3, 'boosting_type': 'Plain', 'bootstrap_type': 'Bayesian', 'bagging_temperature': 9.992123721875508}. Best is trial 209 with value: 0.8791208791208791.
[32m[I 2023-04-20 22:51:02,514][39m Trial 409 finished with value: 0.8539325842696629 and parameters: {'objective': 'CrossEntropy', 'colsample_bylevel': 0.07390435412364664, 'depth': 3, 'boosting_type': 'Plain', 'bootstrap_type': 'Bayesian', 'bagging_temperature': 7.917434021044606}. Best is trial 209 with value: 0.8791208791208791.
[32m[I 2023-04-20 22:51:03,168][39m Trial 410 finished with value: 0.8539325842696629 and parameters: {'objective': 'CrossEntropy', 'colsample_bylevel': 0.07621221882307844, 'depth': 3, 'boosting_type': 'Plain', 'bootstrap_type': 'Bayesian', 'bagging_temperature': 9.276396371357851}. Best is trial 209 with value: 0.8791208791208791.
[32m[I 2023-04-20 22:51:03,861][39m Trial 411 finished with value: 0.8666666666666666 and parameters: {'objective': 'CrossEntropy', 'colsample_bylevel': 0.09105178069952148, 'depth': 3, 'boosting_type': 'Plain', 'bootstrap_type': 'Bayesian', 'bagging_temperature': 8.69419573762461}. Best is trial 209 with value: 0.8791208791208791.
[32m[I 2023-04-20 22:51:05,115][39m Trial 412 finished with value: 0.8666666666666666 and parameters: {'objective': 'CrossEntropy', 'colsample_bylevel': 0.07566536828762668, 'depth': 4, 'boosting_type': 'Plain', 'bootstrap_type': 'Bayesian', 'bagging_temperature': 9.050327085045238}. Best is trial 209 with value: 0.8791208791208791.
[32m[I 2023-04-20 22:51:06,103][39m Trial 413 finished with value: 0.8539325842696629 and parameters: {'objective': 'CrossEntropy', 'colsample_bylevel': 0.09587396833721344, 'depth': 3, 'boosting_type': 'Plain', 'bootstrap_type': 'Bayesian', 'bagging_temperature': 9.782096916347207}. Best is trial 209 with value: 0.8791208791208791.
[32m[I 2023-04-20 22:51:06,720][39m Trial 414 finished with value: 0.8444444444444446 and parameters: {'objective': 'CrossEntropy', 'colsample_bylevel': 0.09910816494429825, 'depth': 3, 'boosting_type': 'Plain', 'bootstrap_type': 'Bayesian', 'bagging_temperature': 9.55708551525267}. Best is trial 209 with value: 0.8791208791208791.
[32m[I 2023-04-20 22:51:07,659][39m Trial 415 finished with value: 0.8275862068965518 and parameters: {'objective': 'CrossEntropy', 'colsample_bylevel': 0.09790860957709287, 'depth': 3, 'boosting_type': 'Plain', 'bootstrap_type': 'Bayesian', 'bagging_temperature': 9.618355247442048}. Best is trial 209 with value: 0.8791208791208791.
[32m[I 2023-04-20 22:51:08,797][39m Trial 416 finished with value: 0.8409090909090909 and parameters: {'objective': 'CrossEntropy', 'colsample_bylevel': 0.07491848954074053, 'depth': 3, 'boosting_type': 'Plain', 'bootstrap_type': 'Bayesian', 'bagging_temperature': 9.446929954255882}. Best is trial 209 with value: 0.8791208791208791.
[32m[I 2023-04-20 22:51:09,413][39m Trial 417 finished with value: 0.8222222222222222 and parameters: {'objective': 'CrossEntropy', 'colsample_bylevel': 0.07111819779300847, 'depth': 2, 'boosting_type': 'Plain', 'bootstrap_type': 'MVS'}. Best is trial 209 with value: 0.8791208791208791.
[32m[I 2023-04-20 22:51:10,342][39m Trial 418 finished with value: 0.7951807228915663 and parameters: {'objective': 'CrossEntropy', 'colsample_bylevel': 0.07703372200573577, 'depth': 1, 'boosting_type': 'Plain', 'bootstrap_type': 'Bayesian', 'bagging_temperature': 9.789710501371593}. Best is trial 209 with value: 0.8791208791208791.
[32m[I 2023-04-20 22:51:11,219][39m Trial 419 finished with value: 0.8764044943820225 and parameters: {'objective': 'CrossEntropy', 'colsample_bylevel': 0.07271333077575899, 'depth': 2, 'boosting_type': 'Plain', 'bootstrap_type': 'Bayesian', 'bagging_temperature': 9.29721864327476}. Best is trial 209 with value: 0.8791208791208791.
[32m[I 2023-04-20 22:51:11,880][39m Trial 420 finished with value: 0.8666666666666666 and parameters: {'objective': 'CrossEntropy', 'colsample_bylevel': 0.07769571178234819, 'depth': 4, 'boosting_type': 'Plain', 'bootstrap_type': 'Bayesian', 'bagging_temperature': 8.9365549729246}. Best is trial 209 with value: 0.8791208791208791.
[32m[I 2023-04-20 22:51:13,226][39m Trial 421 finished with value: 0.8409090909090909 and parameters: {'objective': 'CrossEntropy', 'colsample_bylevel': 0.07286490106484525, 'depth': 2, 'boosting_type': 'Plain', 'bootstrap_type': 'Bayesian', 'bagging_temperature': 8.294148225718837}. Best is trial 209 with value: 0.8791208791208791.
[32m[I 2023-04-20 22:51:14,146][39m Trial 422 finished with value: 0.8539325842696629 and parameters: {'objective': 'CrossEntropy', 'colsample_bylevel': 0.07024518913801364, 'depth': 2, 'boosting_type': 'Plain', 'bootstrap_type': 'Bayesian', 'bagging_temperature': 8.587269539579157}. Best is trial 209 with value: 0.8791208791208791.
[32m[I 2023-04-20 22:51:18,592][39m Trial 423 finished with value: 0.8409090909090909 and parameters: {'objective': 'CrossEntropy', 'colsample_bylevel': 0.07838912832813669, 'depth': 3, 'boosting_type': 'Ordered', 'bootstrap_type': 'Bayesian', 'bagging_temperature': 9.980775249086786}. Best is trial 209 with value: 0.8791208791208791.
[32m[I 2023-04-20 22:51:19,764][39m Trial 424 finished with value: 0.8131868131868132 and parameters: {'objective': 'CrossEntropy', 'colsample_bylevel': 0.08531428185869407, 'depth': 2, 'boosting_type': 'Plain', 'bootstrap_type': 'Bernoulli', 'subsample': 0.4397300592167326}. Best is trial 209 with value: 0.8791208791208791.
[32m[I 2023-04-20 22:51:20,480][39m Trial 425 finished with value: 0.8409090909090909 and parameters: {'objective': 'CrossEntropy', 'colsample_bylevel': 0.09675520986718358, 'depth': 5, 'boosting_type': 'Plain', 'bootstrap_type': 'Bayesian', 'bagging_temperature': 9.019364039729908}. Best is trial 209 with value: 0.8791208791208791.
[32m[I 2023-04-20 22:51:21,157][39m Trial 426 finished with value: 0.8181818181818182 and parameters: {'objective': 'CrossEntropy', 'colsample_bylevel': 0.07541172397014169, 'depth': 1, 'boosting_type': 'Plain', 'bootstrap_type': 'Bayesian', 'bagging_temperature': 8.68864324147472}. Best is trial 209 with value: 0.8791208791208791.
[32m[I 2023-04-20 22:51:22,224][39m Trial 427 finished with value: 0.8139534883720929 and parameters: {'objective': 'CrossEntropy', 'colsample_bylevel': 0.08695461402628454, 'depth': 10, 'boosting_type': 'Plain', 'bootstrap_type': 'Bayesian', 'bagging_temperature': 9.159091408592122}. Best is trial 209 with value: 0.8791208791208791.
[32m[I 2023-04-20 22:51:23,332][39m Trial 428 finished with value: 0.8539325842696629 and parameters: {'objective': 'CrossEntropy', 'colsample_bylevel': 0.0853700569465816, 'depth': 2, 'boosting_type': 'Plain', 'bootstrap_type': 'Bayesian', 'bagging_temperature': 9.059379023548738}. Best is trial 209 with value: 0.8791208791208791.
[32m[I 2023-04-20 22:51:23,863][39m Trial 429 finished with value: 0.7906976744186047 and parameters: {'objective': 'CrossEntropy', 'colsample_bylevel': 0.019154938821701856, 'depth': 3, 'boosting_type': 'Plain', 'bootstrap_type': 'Bayesian', 'bagging_temperature': 8.719073020032242}. Best is trial 209 with value: 0.8791208791208791.
[32m[I 2023-04-20 22:51:24,935][39m Trial 430 finished with value: 0.8539325842696629 and parameters: {'objective': 'CrossEntropy', 'colsample_bylevel': 0.07961769264296506, 'depth': 2, 'boosting_type': 'Plain', 'bootstrap_type': 'Bayesian', 'bagging_temperature': 9.638024469606135}. Best is trial 209 with value: 0.8791208791208791.
[32m[I 2023-04-20 22:51:25,628][39m Trial 431 finished with value: 0.8539325842696629 and parameters: {'objective': 'CrossEntropy', 'colsample_bylevel': 0.08378508194059965, 'depth': 2, 'boosting_type': 'Plain', 'bootstrap_type': 'Bayesian', 'bagging_temperature': 9.321826157172305}. Best is trial 209 with value: 0.8791208791208791.
[32m[I 2023-04-20 22:51:26,401][39m Trial 432 finished with value: 0.8409090909090909 and parameters: {'objective': 'CrossEntropy', 'colsample_bylevel': 0.06472386130859586, 'depth': 2, 'boosting_type': 'Plain', 'bootstrap_type': 'Bayesian', 'bagging_temperature': 9.507558184833318}. Best is trial 209 with value: 0.8791208791208791.
[32m[I 2023-04-20 22:51:27,480][39m Trial 433 finished with value: 0.8505747126436782 and parameters: {'objective': 'CrossEntropy', 'colsample_bylevel': 0.08957628892961404, 'depth': 3, 'boosting_type': 'Plain', 'bootstrap_type': 'Bayesian', 'bagging_temperature': 8.808003816514358}. Best is trial 209 with value: 0.8791208791208791.
[32m[I 2023-04-20 22:51:28,432][39m Trial 434 finished with value: 0.8636363636363636 and parameters: {'objective': 'CrossEntropy', 'colsample_bylevel': 0.07191604123196901, 'depth': 2, 'boosting_type': 'Plain', 'bootstrap_type': 'Bayesian', 'bagging_temperature': 9.168712529719508}. Best is trial 209 with value: 0.8791208791208791.
[32m[I 2023-04-20 22:51:29,070][39m Trial 435 finished with value: 0.8275862068965518 and parameters: {'objective': 'CrossEntropy', 'colsample_bylevel': 0.08791718432170695, 'depth': 3, 'boosting_type': 'Plain', 'bootstrap_type': 'Bayesian', 'bagging_temperature': 8.453146125015715}. Best is trial 209 with value: 0.8791208791208791.
[32m[I 2023-04-20 22:51:29,773][39m Trial 436 finished with value: 0.8222222222222222 and parameters: {'objective': 'CrossEntropy', 'colsample_bylevel': 0.028105572976463752, 'depth': 7, 'boosting_type': 'Plain', 'bootstrap_type': 'Bayesian', 'bagging_temperature': 9.846530281757177}. Best is trial 209 with value: 0.8791208791208791.
[32m[I 2023-04-20 22:51:30,605][39m Trial 437 finished with value: 0.8275862068965518 and parameters: {'objective': 'CrossEntropy', 'colsample_bylevel': 0.08077775382362876, 'depth': 4, 'boosting_type': 'Plain', 'bootstrap_type': 'Bayesian', 'bagging_temperature': 9.672836255080426}. Best is trial 209 with value: 0.8791208791208791.
[32m[I 2023-04-20 22:51:31,372][39m Trial 438 finished with value: 0.8539325842696629 and parameters: {'objective': 'CrossEntropy', 'colsample_bylevel': 0.06738198684504011, 'depth': 2, 'boosting_type': 'Plain', 'bootstrap_type': 'Bayesian', 'bagging_temperature': 8.898233129556807}. Best is trial 209 with value: 0.8791208791208791.
[32m[I 2023-04-20 22:51:32,179][39m Trial 439 finished with value: 0.8764044943820225 and parameters: {'objective': 'CrossEntropy', 'colsample_bylevel': 0.08246250812764032, 'depth': 2, 'boosting_type': 'Plain', 'bootstrap_type': 'Bayesian', 'bagging_temperature': 9.329095786801195}. Best is trial 209 with value: 0.8791208791208791.
[32m[I 2023-04-20 22:51:33,395][39m Trial 440 finished with value: 0.8139534883720929 and parameters: {'objective': 'CrossEntropy', 'colsample_bylevel': 0.08198071165344457, 'depth': 1, 'boosting_type': 'Plain', 'bootstrap_type': 'Bayesian', 'bagging_temperature': 9.349881674524298}. Best is trial 209 with value: 0.8791208791208791.
[32m[I 2023-04-20 22:51:34,493][39m Trial 441 finished with value: 0.8409090909090909 and parameters: {'objective': 'CrossEntropy', 'colsample_bylevel': 0.07570848118651269, 'depth': 11, 'boosting_type': 'Plain', 'bootstrap_type': 'Bayesian', 'bagging_temperature': 9.3325557274573}. Best is trial 209 with value: 0.8791208791208791.
[32m[I 2023-04-20 22:51:35,062][39m Trial 442 finished with value: 0.8539325842696629 and parameters: {'objective': 'CrossEntropy', 'colsample_bylevel': 0.07360541314470899, 'depth': 3, 'boosting_type': 'Plain', 'bootstrap_type': 'Bayesian', 'bagging_temperature': 9.477716706408817}. Best is trial 209 with value: 0.8791208791208791.
[32m[I 2023-04-20 22:51:35,804][39m Trial 443 finished with value: 0.8666666666666666 and parameters: {'objective': 'CrossEntropy', 'colsample_bylevel': 0.0881930898155108, 'depth': 2, 'boosting_type': 'Plain', 'bootstrap_type': 'Bayesian', 'bagging_temperature': 9.531981441817427}. Best is trial 209 with value: 0.8791208791208791.
[32m[I 2023-04-20 22:51:40,712][39m Trial 444 finished with value: 0.8222222222222222 and parameters: {'objective': 'CrossEntropy', 'colsample_bylevel': 0.07887659465838376, 'depth': 2, 'boosting_type': 'Ordered', 'bootstrap_type': 'Bernoulli', 'subsample': 0.705030123010136}. Best is trial 209 with value: 0.8791208791208791.
[32m[I 2023-04-20 22:51:41,880][39m Trial 445 finished with value: 0.8636363636363636 and parameters: {'objective': 'CrossEntropy', 'colsample_bylevel': 0.08406520844578295, 'depth': 2, 'boosting_type': 'Plain', 'bootstrap_type': 'Bayesian', 'bagging_temperature': 8.84633900503444}. Best is trial 209 with value: 0.8791208791208791.
[32m[I 2023-04-20 22:51:42,810][39m Trial 446 finished with value: 0.8409090909090909 and parameters: {'objective': 'CrossEntropy', 'colsample_bylevel': 0.09358090670649456, 'depth': 3, 'boosting_type': 'Plain', 'bootstrap_type': 'MVS'}. Best is trial 209 with value: 0.8791208791208791.
[32m[I 2023-04-20 22:51:43,740][39m Trial 447 finished with value: 0.7317073170731707 and parameters: {'objective': 'CrossEntropy', 'colsample_bylevel': 0.010259558805108933, 'depth': 2, 'boosting_type': 'Plain', 'bootstrap_type': 'Bayesian', 'bagging_temperature': 8.222931724428841}. Best is trial 209 with value: 0.8791208791208791.
[32m[I 2023-04-20 22:51:44,271][39m Trial 448 finished with value: 0.8235294117647058 and parameters: {'objective': 'CrossEntropy', 'colsample_bylevel': 0.08135884265146148, 'depth': 1, 'boosting_type': 'Plain', 'bootstrap_type': 'Bayesian', 'bagging_temperature': 9.033188405355439}. Best is trial 209 with value: 0.8791208791208791.
[32m[I 2023-04-20 22:51:44,903][39m Trial 449 finished with value: 0.8636363636363636 and parameters: {'objective': 'CrossEntropy', 'colsample_bylevel': 0.08026163158611878, 'depth': 2, 'boosting_type': 'Plain', 'bootstrap_type': 'Bayesian', 'bagging_temperature': 7.550221496607222}. Best is trial 209 with value: 0.8791208791208791.
[32m[I 2023-04-20 22:51:45,721][39m Trial 450 finished with value: 0.8409090909090909 and parameters: {'objective': 'CrossEntropy', 'colsample_bylevel': 0.08310732230676895, 'depth': 3, 'boosting_type': 'Plain', 'bootstrap_type': 'Bayesian', 'bagging_temperature': 8.475660579368016}. Best is trial 209 with value: 0.8791208791208791.
[32m[I 2023-04-20 22:51:46,535][39m Trial 451 finished with value: 0.8539325842696629 and parameters: {'objective': 'CrossEntropy', 'colsample_bylevel': 0.08596643050308612, 'depth': 2, 'boosting_type': 'Plain', 'bootstrap_type': 'Bayesian', 'bagging_temperature': 9.801623980861045}. Best is trial 209 with value: 0.8791208791208791.
[32m[I 2023-04-20 22:51:47,830][39m Trial 452 finished with value: 0.8764044943820225 and parameters: {'objective': 'CrossEntropy', 'colsample_bylevel': 0.08483824804062949, 'depth': 2, 'boosting_type': 'Plain', 'bootstrap_type': 'Bayesian', 'bagging_temperature': 9.171533405597915}. Best is trial 209 with value: 0.8791208791208791.
[32m[I 2023-04-20 22:51:49,112][39m Trial 453 finished with value: 0.8539325842696629 and parameters: {'objective': 'CrossEntropy', 'colsample_bylevel': 0.07735949424751579, 'depth': 3, 'boosting_type': 'Plain', 'bootstrap_type': 'Bayesian', 'bagging_temperature': 9.565870250604409}. Best is trial 209 with value: 0.8791208791208791.
[32m[I 2023-04-20 22:51:49,964][39m Trial 454 finished with value: 0.8764044943820225 and parameters: {'objective': 'CrossEntropy', 'colsample_bylevel': 0.08571116392601703, 'depth': 2, 'boosting_type': 'Plain', 'bootstrap_type': 'Bayesian', 'bagging_temperature': 9.176579819500962}. Best is trial 209 with value: 0.8791208791208791.
[32m[I 2023-04-20 22:51:50,585][39m Trial 455 finished with value: 0.8539325842696629 and parameters: {'objective': 'CrossEntropy', 'colsample_bylevel': 0.09023468040338346, 'depth': 4, 'boosting_type': 'Plain', 'bootstrap_type': 'Bayesian', 'bagging_temperature': 9.98383716705755}. Best is trial 209 with value: 0.8791208791208791.
[32m[I 2023-04-20 22:51:51,294][39m Trial 456 finished with value: 0.8409090909090909 and parameters: {'objective': 'CrossEntropy', 'colsample_bylevel': 0.09194110483469746, 'depth': 9, 'boosting_type': 'Plain', 'bootstrap_type': 'Bayesian', 'bagging_temperature': 1.7075429731973886}. Best is trial 209 with value: 0.8791208791208791.
[32m[I 2023-04-20 22:51:52,290][39m Trial 457 finished with value: 0.8409090909090909 and parameters: {'objective': 'CrossEntropy', 'colsample_bylevel': 0.07612682327564722, 'depth': 2, 'boosting_type': 'Plain', 'bootstrap_type': 'Bayesian', 'bagging_temperature': 8.910916110909087}. Best is trial 209 with value: 0.8791208791208791.
[32m[I 2023-04-20 22:51:52,998][39m Trial 458 finished with value: 0.7586206896551724 and parameters: {'objective': 'CrossEntropy', 'colsample_bylevel': 0.07418861786534676, 'depth': 1, 'boosting_type': 'Plain', 'bootstrap_type': 'Bayesian', 'bagging_temperature': 8.701016495469208}. Best is trial 209 with value: 0.8791208791208791.
