[32m[I 2023-04-20 22:51:53,775][39m Trial 459 finished with value: 0.8666666666666666 and parameters: {'objective': 'CrossEntropy', 'colsample_bylevel': 0.07328570759105663, 'depth': 3, 'boosting_type': 'Plain', 'bootstrap_type': 'Bayesian', 'bagging_temperature': 9.27261738279468}. Best is trial 209 with value: 0.8791208791208791.
[32m[I 2023-04-20 22:51:54,957][39m Trial 460 finished with value: 0.8735632183908046 and parameters: {'objective': 'CrossEntropy', 'colsample_bylevel': 0.08210063339735871, 'depth': 2, 'boosting_type': 'Plain', 'bootstrap_type': 'Bayesian', 'bagging_temperature': 9.058668519814375}. Best is trial 209 with value: 0.8791208791208791.
[32m[I 2023-04-20 22:51:59,940][39m Trial 461 finished with value: 0.8444444444444446 and parameters: {'objective': 'CrossEntropy', 'colsample_bylevel': 0.07807516028725844, 'depth': 2, 'boosting_type': 'Ordered', 'bootstrap_type': 'Bayesian', 'bagging_temperature': 6.582197583490899}. Best is trial 209 with value: 0.8791208791208791.
[32m[I 2023-04-20 22:52:01,096][39m Trial 462 finished with value: 0.8666666666666666 and parameters: {'objective': 'CrossEntropy', 'colsample_bylevel': 0.08481052754759681, 'depth': 2, 'boosting_type': 'Plain', 'bootstrap_type': 'Bayesian', 'bagging_temperature': 9.238109081969116}. Best is trial 209 with value: 0.8791208791208791.
[32m[I 2023-04-20 22:52:02,299][39m Trial 463 finished with value: 0.8275862068965518 and parameters: {'objective': 'CrossEntropy', 'colsample_bylevel': 0.08764215211743118, 'depth': 3, 'boosting_type': 'Plain', 'bootstrap_type': 'MVS'}. Best is trial 209 with value: 0.8791208791208791.
[32m[I 2023-04-20 22:52:03,208][39m Trial 464 finished with value: 0.8636363636363636 and parameters: {'objective': 'CrossEntropy', 'colsample_bylevel': 0.08122660786172839, 'depth': 2, 'boosting_type': 'Plain', 'bootstrap_type': 'Bayesian', 'bagging_temperature': 8.527851712854964}. Best is trial 209 with value: 0.8791208791208791.
[32m[I 2023-04-20 22:52:03,786][39m Trial 465 finished with value: 0.8666666666666666 and parameters: {'objective': 'CrossEntropy', 'colsample_bylevel': 0.08713117884097321, 'depth': 3, 'boosting_type': 'Plain', 'bootstrap_type': 'Bayesian', 'bagging_temperature': 8.12719861973395}. Best is trial 209 with value: 0.8791208791208791.
[32m[I 2023-04-20 22:52:04,798][39m Trial 466 finished with value: 0.8666666666666666 and parameters: {'objective': 'CrossEntropy', 'colsample_bylevel': 0.0890136522085643, 'depth': 2, 'boosting_type': 'Plain', 'bootstrap_type': 'Bayesian', 'bagging_temperature': 5.579409311687581}. Best is trial 209 with value: 0.8791208791208791.
[32m[I 2023-04-20 22:52:05,435][39m Trial 467 finished with value: 0.8275862068965518 and parameters: {'objective': 'Logloss', 'colsample_bylevel': 0.08382464867518445, 'depth': 2, 'boosting_type': 'Plain', 'bootstrap_type': 'Bayesian', 'bagging_temperature': 8.704977739646061}. Best is trial 209 with value: 0.8791208791208791.
[32m[I 2023-04-20 22:52:06,190][39m Trial 468 finished with value: 0.8 and parameters: {'objective': 'CrossEntropy', 'colsample_bylevel': 0.08552596040241697, 'depth': 1, 'boosting_type': 'Plain', 'bootstrap_type': 'Bernoulli', 'subsample': 0.9002795562413999}. Best is trial 209 with value: 0.8791208791208791.
[32m[I 2023-04-20 22:52:07,189][39m Trial 469 finished with value: 0.8539325842696629 and parameters: {'objective': 'CrossEntropy', 'colsample_bylevel': 0.07486693201391573, 'depth': 3, 'boosting_type': 'Plain', 'bootstrap_type': 'Bayesian', 'bagging_temperature': 9.681346674806237}. Best is trial 209 with value: 0.8791208791208791.
[32m[I 2023-04-20 22:52:07,834][39m Trial 470 finished with value: 0.8764044943820225 and parameters: {'objective': 'CrossEntropy', 'colsample_bylevel': 0.07182532836526058, 'depth': 2, 'boosting_type': 'Plain', 'bootstrap_type': 'Bayesian', 'bagging_temperature': 9.43518498003128}. Best is trial 209 with value: 0.8791208791208791.
[32m[I 2023-04-20 22:52:08,738][39m Trial 471 finished with value: 0.8666666666666666 and parameters: {'objective': 'CrossEntropy', 'colsample_bylevel': 0.097252133145062, 'depth': 2, 'boosting_type': 'Plain', 'bootstrap_type': 'Bayesian', 'bagging_temperature': 9.427271463588044}. Best is trial 209 with value: 0.8791208791208791.
[32m[I 2023-04-20 22:52:09,905][39m Trial 472 finished with value: 0.8275862068965518 and parameters: {'objective': 'CrossEntropy', 'colsample_bylevel': 0.07204243567841742, 'depth': 2, 'boosting_type': 'Plain', 'bootstrap_type': 'Bayesian', 'bagging_temperature': 8.94088781792159}. Best is trial 209 with value: 0.8791208791208791.
[32m[I 2023-04-20 22:52:10,586][39m Trial 473 finished with value: 0.8636363636363636 and parameters: {'objective': 'CrossEntropy', 'colsample_bylevel': 0.08216707986456462, 'depth': 2, 'boosting_type': 'Plain', 'bootstrap_type': 'Bayesian', 'bagging_temperature': 9.113239199999795}. Best is trial 209 with value: 0.8791208791208791.
[32m[I 2023-04-20 22:52:11,422][39m Trial 474 finished with value: 0.8666666666666666 and parameters: {'objective': 'CrossEntropy', 'colsample_bylevel': 0.09298822541719175, 'depth': 3, 'boosting_type': 'Plain', 'bootstrap_type': 'Bayesian', 'bagging_temperature': 9.812788342011794}. Best is trial 209 with value: 0.8791208791208791.
[32m[I 2023-04-20 22:52:12,263][39m Trial 475 finished with value: 0.8666666666666666 and parameters: {'objective': 'CrossEntropy', 'colsample_bylevel': 0.08404038362190802, 'depth': 2, 'boosting_type': 'Plain', 'bootstrap_type': 'Bayesian', 'bagging_temperature': 9.252810724855365}. Best is trial 209 with value: 0.8791208791208791.
[32m[I 2023-04-20 22:52:13,213][39m Trial 476 finished with value: 0.8666666666666666 and parameters: {'objective': 'CrossEntropy', 'colsample_bylevel': 0.08989980224114963, 'depth': 3, 'boosting_type': 'Plain', 'bootstrap_type': 'Bayesian', 'bagging_temperature': 9.775873674148274}. Best is trial 209 with value: 0.8791208791208791.
[32m[I 2023-04-20 22:52:13,940][39m Trial 477 finished with value: 0.8636363636363636 and parameters: {'objective': 'CrossEntropy', 'colsample_bylevel': 0.07065894726021724, 'depth': 2, 'boosting_type': 'Plain', 'bootstrap_type': 'Bayesian', 'bagging_temperature': 9.56915985485823}. Best is trial 209 with value: 0.8791208791208791.
[32m[I 2023-04-20 22:52:15,070][39m Trial 478 finished with value: 0.8539325842696629 and parameters: {'objective': 'CrossEntropy', 'colsample_bylevel': 0.08669864268006287, 'depth': 4, 'boosting_type': 'Plain', 'bootstrap_type': 'Bayesian', 'bagging_temperature': 9.226816137923912}. Best is trial 209 with value: 0.8791208791208791.
[32m[I 2023-04-20 22:52:16,323][39m Trial 479 finished with value: 0.8235294117647058 and parameters: {'objective': 'CrossEntropy', 'colsample_bylevel': 0.08303647979435465, 'depth': 1, 'boosting_type': 'Plain', 'bootstrap_type': 'Bayesian', 'bagging_temperature': 8.94350646406257}. Best is trial 209 with value: 0.8791208791208791.
[32m[I 2023-04-20 22:52:17,513][39m Trial 480 finished with value: 0.8636363636363636 and parameters: {'objective': 'CrossEntropy', 'colsample_bylevel': 0.07808592981366895, 'depth': 2, 'boosting_type': 'Plain', 'bootstrap_type': 'Bayesian', 'bagging_temperature': 9.273028474626003}. Best is trial 209 with value: 0.8791208791208791.
[32m[I 2023-04-20 22:52:22,037][39m Trial 481 finished with value: 0.8275862068965518 and parameters: {'objective': 'CrossEntropy', 'colsample_bylevel': 0.09144106472746778, 'depth': 3, 'boosting_type': 'Ordered', 'bootstrap_type': 'Bayesian', 'bagging_temperature': 8.292188808886973}. Best is trial 209 with value: 0.8791208791208791.
[32m[I 2023-04-20 22:52:23,321][39m Trial 482 finished with value: 0.8139534883720929 and parameters: {'objective': 'CrossEntropy', 'colsample_bylevel': 0.0859866401888831, 'depth': 6, 'boosting_type': 'Plain', 'bootstrap_type': 'Bayesian', 'bagging_temperature': 8.800821619135725}. Best is trial 209 with value: 0.8791208791208791.
[32m[I 2023-04-20 22:52:23,928][39m Trial 483 finished with value: 0.8636363636363636 and parameters: {'objective': 'CrossEntropy', 'colsample_bylevel': 0.08000059628044799, 'depth': 2, 'boosting_type': 'Plain', 'bootstrap_type': 'Bayesian', 'bagging_temperature': 9.079760318972513}. Best is trial 209 with value: 0.8791208791208791.
[32m[I 2023-04-20 22:52:24,711][39m Trial 484 finished with value: 0.8764044943820225 and parameters: {'objective': 'CrossEntropy', 'colsample_bylevel': 0.08257289798060037, 'depth': 2, 'boosting_type': 'Plain', 'bootstrap_type': 'Bayesian', 'bagging_temperature': 9.137756085450542}. Best is trial 209 with value: 0.8791208791208791.
[32m[I 2023-04-20 22:52:25,724][39m Trial 485 finished with value: 0.8409090909090909 and parameters: {'objective': 'CrossEntropy', 'colsample_bylevel': 0.09564931636747033, 'depth': 3, 'boosting_type': 'Plain', 'bootstrap_type': 'MVS'}. Best is trial 209 with value: 0.8791208791208791.
[32m[I 2023-04-20 22:52:26,548][39m Trial 486 finished with value: 0.8539325842696629 and parameters: {'objective': 'CrossEntropy', 'colsample_bylevel': 0.08710988212673841, 'depth': 2, 'boosting_type': 'Plain', 'bootstrap_type': 'Bayesian', 'bagging_temperature': 9.653484098332449}. Best is trial 209 with value: 0.8791208791208791.
[32m[I 2023-04-20 22:52:27,251][39m Trial 487 finished with value: 0.8666666666666666 and parameters: {'objective': 'Logloss', 'colsample_bylevel': 0.0791003464228646, 'depth': 2, 'boosting_type': 'Plain', 'bootstrap_type': 'Bayesian', 'bagging_temperature': 8.592371085185482}. Best is trial 209 with value: 0.8791208791208791.
[32m[I 2023-04-20 22:52:28,052][39m Trial 488 finished with value: 0.8539325842696629 and parameters: {'objective': 'CrossEntropy', 'colsample_bylevel': 0.07120747256869758, 'depth': 3, 'boosting_type': 'Plain', 'bootstrap_type': 'Bayesian', 'bagging_temperature': 9.008580818321894}. Best is trial 209 with value: 0.8791208791208791.
[32m[I 2023-04-20 22:52:28,877][39m Trial 489 finished with value: 0.8505747126436782 and parameters: {'objective': 'CrossEntropy', 'colsample_bylevel': 0.0988190662495731, 'depth': 2, 'boosting_type': 'Plain', 'bootstrap_type': 'Bayesian', 'bagging_temperature': 8.877304995232022}. Best is trial 209 with value: 0.8791208791208791.
[32m[I 2023-04-20 22:52:29,948][39m Trial 490 finished with value: 0.8539325842696629 and parameters: {'objective': 'CrossEntropy', 'colsample_bylevel': 0.08091427319829442, 'depth': 2, 'boosting_type': 'Plain', 'bootstrap_type': 'Bayesian', 'bagging_temperature': 9.244102108719048}. Best is trial 209 with value: 0.8791208791208791.
[32m[I 2023-04-20 22:52:31,138][39m Trial 491 finished with value: 0.7954545454545454 and parameters: {'objective': 'CrossEntropy', 'colsample_bylevel': 0.08410328639658968, 'depth': 1, 'boosting_type': 'Plain', 'bootstrap_type': 'Bernoulli', 'subsample': 0.18814922741045143}. Best is trial 209 with value: 0.8791208791208791.
[32m[I 2023-04-20 22:52:31,871][39m Trial 492 finished with value: 0.8539325842696629 and parameters: {'objective': 'CrossEntropy', 'colsample_bylevel': 0.09066637332480992, 'depth': 5, 'boosting_type': 'Plain', 'bootstrap_type': 'Bayesian', 'bagging_temperature': 9.816615083007367}. Best is trial 209 with value: 0.8791208791208791.
[32m[I 2023-04-20 22:52:32,618][39m Trial 493 finished with value: 0.8636363636363636 and parameters: {'objective': 'CrossEntropy', 'colsample_bylevel': 0.08521121295916965, 'depth': 2, 'boosting_type': 'Plain', 'bootstrap_type': 'Bayesian', 'bagging_temperature': 9.164411925477468}. Best is trial 209 with value: 0.8791208791208791.
[32m[I 2023-04-20 22:52:33,518][39m Trial 494 finished with value: 0.8666666666666666 and parameters: {'objective': 'CrossEntropy', 'colsample_bylevel': 0.08876332798775749, 'depth': 3, 'boosting_type': 'Plain', 'bootstrap_type': 'Bayesian', 'bagging_temperature': 7.794476303088959}. Best is trial 209 with value: 0.8791208791208791.
[32m[I 2023-04-20 22:52:34,520][39m Trial 495 finished with value: 0.8539325842696629 and parameters: {'objective': 'CrossEntropy', 'colsample_bylevel': 0.08715863010491419, 'depth': 2, 'boosting_type': 'Plain', 'bootstrap_type': 'Bayesian', 'bagging_temperature': 9.368032720610161}. Best is trial 209 with value: 0.8791208791208791.
[32m[I 2023-04-20 22:52:35,168][39m Trial 496 finished with value: 0.8372093023255814 and parameters: {'objective': 'CrossEntropy', 'colsample_bylevel': 0.08609282334378517, 'depth': 1, 'boosting_type': 'Plain', 'bootstrap_type': 'Bayesian', 'bagging_temperature': 8.581382369842233}. Best is trial 209 with value: 0.8791208791208791.
[32m[I 2023-04-20 22:52:36,230][39m Trial 497 finished with value: 0.8666666666666666 and parameters: {'objective': 'CrossEntropy', 'colsample_bylevel': 0.05644310972098596, 'depth': 2, 'boosting_type': 'Plain', 'bootstrap_type': 'Bayesian', 'bagging_temperature': 9.436417495039993}. Best is trial 209 with value: 0.8791208791208791.
[32m[I 2023-04-20 22:52:37,597][39m Trial 498 finished with value: 0.8409090909090909 and parameters: {'objective': 'CrossEntropy', 'colsample_bylevel': 0.08526218162240981, 'depth': 3, 'boosting_type': 'Plain', 'bootstrap_type': 'Bayesian', 'bagging_temperature': 9.013904501344612}. Best is trial 209 with value: 0.8791208791208791.
[32m[I 2023-04-20 22:52:38,182][39m Trial 499 finished with value: 0.8666666666666666 and parameters: {'objective': 'CrossEntropy', 'colsample_bylevel': 0.0826918020722289, 'depth': 2, 'boosting_type': 'Plain', 'bootstrap_type': 'Bayesian', 'bagging_temperature': 8.722844049057777}. Best is trial 209 with value: 0.8791208791208791.
[32m[I 2023-04-20 22:52:42,923][39m Trial 500 finished with value: 0.8222222222222222 and parameters: {'objective': 'CrossEntropy', 'colsample_bylevel': 0.07273480984637296, 'depth': 2, 'boosting_type': 'Ordered', 'bootstrap_type': 'Bayesian', 'bagging_temperature': 9.416063632372255}. Best is trial 209 with value: 0.8791208791208791.
[32m[I 2023-04-20 22:52:44,338][39m Trial 501 finished with value: 0.8275862068965518 and parameters: {'objective': 'CrossEntropy', 'colsample_bylevel': 0.07721608631856329, 'depth': 3, 'boosting_type': 'Plain', 'bootstrap_type': 'Bayesian', 'bagging_temperature': 0.8363415665821341}. Best is trial 209 with value: 0.8791208791208791.
[32m[I 2023-04-20 22:52:45,618][39m Trial 502 finished with value: 0.8539325842696629 and parameters: {'objective': 'CrossEntropy', 'colsample_bylevel': 0.0794598916412698, 'depth': 2, 'boosting_type': 'Plain', 'bootstrap_type': 'Bayesian', 'bagging_temperature': 9.607534851120668}. Best is trial 209 with value: 0.8791208791208791.
[32m[I 2023-04-20 22:52:46,241][39m Trial 503 finished with value: 0.8539325842696629 and parameters: {'objective': 'CrossEntropy', 'colsample_bylevel': 0.08964731558707138, 'depth': 2, 'boosting_type': 'Plain', 'bootstrap_type': 'Bayesian', 'bagging_temperature': 9.46801622934722}. Best is trial 209 with value: 0.8791208791208791.
[32m[I 2023-04-20 22:52:46,855][39m Trial 504 finished with value: 0.8539325842696629 and parameters: {'objective': 'CrossEntropy', 'colsample_bylevel': 0.09384862567180839, 'depth': 3, 'boosting_type': 'Plain', 'bootstrap_type': 'Bayesian', 'bagging_temperature': 9.576092772621136}. Best is trial 209 with value: 0.8791208791208791.
[32m[I 2023-04-20 22:52:47,605][39m Trial 505 finished with value: 0.8275862068965518 and parameters: {'objective': 'CrossEntropy', 'colsample_bylevel': 0.06990328467808407, 'depth': 2, 'boosting_type': 'Plain', 'bootstrap_type': 'Bayesian', 'bagging_temperature': 9.141399270316983}. Best is trial 209 with value: 0.8791208791208791.
[32m[I 2023-04-20 22:52:48,744][39m Trial 506 finished with value: 0.8666666666666666 and parameters: {'objective': 'Logloss', 'colsample_bylevel': 0.08141298413316249, 'depth': 2, 'boosting_type': 'Plain', 'bootstrap_type': 'Bayesian', 'bagging_temperature': 8.814166754385342}. Best is trial 209 with value: 0.8791208791208791.
[32m[I 2023-04-20 22:52:49,373][39m Trial 507 finished with value: 0.7999999999999999 and parameters: {'objective': 'CrossEntropy', 'colsample_bylevel': 0.0744187801869259, 'depth': 1, 'boosting_type': 'Plain', 'bootstrap_type': 'Bayesian', 'bagging_temperature': 9.462826787965414}. Best is trial 209 with value: 0.8791208791208791.
[32m[I 2023-04-20 22:52:50,410][39m Trial 508 finished with value: 0.8275862068965518 and parameters: {'objective': 'CrossEntropy', 'colsample_bylevel': 0.07496067632176645, 'depth': 3, 'boosting_type': 'Plain', 'bootstrap_type': 'MVS'}. Best is trial 209 with value: 0.8791208791208791.
[32m[I 2023-04-20 22:52:51,749][39m Trial 509 finished with value: 0.8409090909090909 and parameters: {'objective': 'CrossEntropy', 'colsample_bylevel': 0.07232036948612702, 'depth': 4, 'boosting_type': 'Plain', 'bootstrap_type': 'Bayesian', 'bagging_temperature': 9.999306213497448}. Best is trial 209 with value: 0.8791208791208791.
[32m[I 2023-04-20 22:52:52,376][39m Trial 510 finished with value: 0.8636363636363636 and parameters: {'objective': 'CrossEntropy', 'colsample_bylevel': 0.09070470889464907, 'depth': 2, 'boosting_type': 'Plain', 'bootstrap_type': 'Bayesian', 'bagging_temperature': 9.287300931047044}. Best is trial 209 with value: 0.8791208791208791.
[32m[I 2023-04-20 22:52:53,050][39m Trial 511 finished with value: 0.8409090909090909 and parameters: {'objective': 'CrossEntropy', 'colsample_bylevel': 0.0695868884028528, 'depth': 2, 'boosting_type': 'Plain', 'bootstrap_type': 'Bayesian', 'bagging_temperature': 9.358187165186802}. Best is trial 209 with value: 0.8791208791208791.
[32m[I 2023-04-20 22:52:54,062][39m Trial 512 finished with value: 0.8666666666666666 and parameters: {'objective': 'CrossEntropy', 'colsample_bylevel': 0.0838552902590383, 'depth': 3, 'boosting_type': 'Plain', 'bootstrap_type': 'Bayesian', 'bagging_temperature': 9.124399439219317}. Best is trial 209 with value: 0.8791208791208791.
[32m[I 2023-04-20 22:52:54,853][39m Trial 513 finished with value: 0.8314606741573034 and parameters: {'objective': 'CrossEntropy', 'colsample_bylevel': 0.08834772787528723, 'depth': 2, 'boosting_type': 'Plain', 'bootstrap_type': 'Bernoulli', 'subsample': 0.3703346112777031}. Best is trial 209 with value: 0.8791208791208791.
[32m[I 2023-04-20 22:52:55,993][39m Trial 514 finished with value: 0.8636363636363636 and parameters: {'objective': 'CrossEntropy', 'colsample_bylevel': 0.08498852524457341, 'depth': 2, 'boosting_type': 'Plain', 'bootstrap_type': 'Bayesian', 'bagging_temperature': 9.997601703389442}. Best is trial 209 with value: 0.8791208791208791.
[32m[I 2023-04-20 22:52:56,699][39m Trial 515 finished with value: 0.8764044943820225 and parameters: {'objective': 'CrossEntropy', 'colsample_bylevel': 0.0814187191588783, 'depth': 2, 'boosting_type': 'Plain', 'bootstrap_type': 'Bayesian', 'bagging_temperature': 8.565031547892044}. Best is trial 209 with value: 0.8791208791208791.
[32m[I 2023-04-20 22:52:57,820][39m Trial 516 finished with value: 0.8275862068965518 and parameters: {'objective': 'CrossEntropy', 'colsample_bylevel': 0.07653275874465842, 'depth': 1, 'boosting_type': 'Plain', 'bootstrap_type': 'Bayesian', 'bagging_temperature': 9.590311836883027}. Best is trial 209 with value: 0.8791208791208791.
[32m[I 2023-04-20 22:52:58,478][39m Trial 517 finished with value: 0.8139534883720929 and parameters: {'objective': 'CrossEntropy', 'colsample_bylevel': 0.052869222286956445, 'depth': 3, 'boosting_type': 'Plain', 'bootstrap_type': 'Bayesian', 'bagging_temperature': 8.398455848762488}. Best is trial 209 with value: 0.8791208791208791.
[32m[I 2023-04-20 22:52:59,451][39m Trial 518 finished with value: 0.8409090909090909 and parameters: {'objective': 'CrossEntropy', 'colsample_bylevel': 0.08046750534830086, 'depth': 2, 'boosting_type': 'Plain', 'bootstrap_type': 'Bayesian', 'bagging_temperature': 8.383075724512636}. Best is trial 209 with value: 0.8791208791208791.
[32m[I 2023-04-20 22:53:04,475][39m Trial 519 finished with value: 0.8409090909090909 and parameters: {'objective': 'CrossEntropy', 'colsample_bylevel': 0.08649542541390287, 'depth': 2, 'boosting_type': 'Ordered', 'bootstrap_type': 'Bayesian', 'bagging_temperature': 9.143380265631931}. Best is trial 209 with value: 0.8791208791208791.
[32m[I 2023-04-20 22:53:05,353][39m Trial 520 finished with value: 0.8539325842696629 and parameters: {'objective': 'CrossEntropy', 'colsample_bylevel': 0.08629575594726689, 'depth': 3, 'boosting_type': 'Plain', 'bootstrap_type': 'Bayesian', 'bagging_temperature': 9.24935559643398}. Best is trial 209 with value: 0.8791208791208791.
[32m[I 2023-04-20 22:53:06,592][39m Trial 521 finished with value: 0.8764044943820225 and parameters: {'objective': 'CrossEntropy', 'colsample_bylevel': 0.07387761801710904, 'depth': 2, 'boosting_type': 'Plain', 'bootstrap_type': 'Bayesian', 'bagging_temperature': 8.923800646165624}. Best is trial 209 with value: 0.8791208791208791.
[32m[I 2023-04-20 22:53:07,351][39m Trial 522 finished with value: 0.8409090909090909 and parameters: {'objective': 'CrossEntropy', 'colsample_bylevel': 0.0926054745223494, 'depth': 3, 'boosting_type': 'Plain', 'bootstrap_type': 'Bayesian', 'bagging_temperature': 8.262691649527603}. Best is trial 209 with value: 0.8791208791208791.
[32m[I 2023-04-20 22:53:07,957][39m Trial 523 finished with value: 0.8666666666666666 and parameters: {'objective': 'CrossEntropy', 'colsample_bylevel': 0.08846662010383803, 'depth': 2, 'boosting_type': 'Plain', 'bootstrap_type': 'Bayesian', 'bagging_temperature': 9.835978928807897}. Best is trial 209 with value: 0.8791208791208791.
