[32m[I 2023-04-20 22:55:33,282][39m Trial 654 finished with value: 0.8409090909090909 and parameters: {'objective': 'CrossEntropy', 'colsample_bylevel': 0.07210264949528834, 'depth': 2, 'boosting_type': 'Ordered', 'bootstrap_type': 'Bayesian', 'bagging_temperature': 9.390567499742309}. Best is trial 209 with value: 0.8791208791208791.
[32m[I 2023-04-20 22:55:34,262][39m Trial 655 finished with value: 0.8409090909090909 and parameters: {'objective': 'CrossEntropy', 'colsample_bylevel': 0.07883711284745026, 'depth': 3, 'boosting_type': 'Plain', 'bootstrap_type': 'Bayesian', 'bagging_temperature': 8.442192205144405}. Best is trial 209 with value: 0.8791208791208791.
[32m[I 2023-04-20 22:55:35,243][39m Trial 656 finished with value: 0.8764044943820225 and parameters: {'objective': 'CrossEntropy', 'colsample_bylevel': 0.08299955041939422, 'depth': 2, 'boosting_type': 'Plain', 'bootstrap_type': 'Bayesian', 'bagging_temperature': 8.940785794283924}. Best is trial 209 with value: 0.8791208791208791.
[32m[I 2023-04-20 22:55:36,135][39m Trial 657 finished with value: 0.8539325842696629 and parameters: {'objective': 'Logloss', 'colsample_bylevel': 0.07756842098393597, 'depth': 3, 'boosting_type': 'Plain', 'bootstrap_type': 'Bayesian', 'bagging_temperature': 8.999747925402561}. Best is trial 209 with value: 0.8791208791208791.
[32m[I 2023-04-20 22:55:37,125][39m Trial 658 finished with value: 0.8764044943820225 and parameters: {'objective': 'CrossEntropy', 'colsample_bylevel': 0.08008164684939749, 'depth': 2, 'boosting_type': 'Plain', 'bootstrap_type': 'Bayesian', 'bagging_temperature': 9.39878987012731}. Best is trial 209 with value: 0.8791208791208791.
[32m[I 2023-04-20 22:55:37,960][39m Trial 659 finished with value: 0.8505747126436782 and parameters: {'objective': 'CrossEntropy', 'colsample_bylevel': 0.08229593944647157, 'depth': 2, 'boosting_type': 'Plain', 'bootstrap_type': 'Bayesian', 'bagging_temperature': 8.772365096806109}. Best is trial 209 with value: 0.8791208791208791.
[32m[I 2023-04-20 22:55:39,029][39m Trial 660 finished with value: 0.7999999999999999 and parameters: {'objective': 'CrossEntropy', 'colsample_bylevel': 0.09683153203370938, 'depth': 1, 'boosting_type': 'Plain', 'bootstrap_type': 'Bayesian', 'bagging_temperature': 9.366207904611267}. Best is trial 209 with value: 0.8791208791208791.
[32m[I 2023-04-20 22:55:40,212][39m Trial 661 finished with value: 0.8791208791208791 and parameters: {'objective': 'CrossEntropy', 'colsample_bylevel': 0.07189685102482805, 'depth': 3, 'boosting_type': 'Plain', 'bootstrap_type': 'Bayesian', 'bagging_temperature': 9.277515235281504}. Best is trial 209 with value: 0.8791208791208791.
[32m[I 2023-04-20 22:55:41,293][39m Trial 662 finished with value: 0.8275862068965518 and parameters: {'objective': 'CrossEntropy', 'colsample_bylevel': 0.06735214245145824, 'depth': 3, 'boosting_type': 'Plain', 'bootstrap_type': 'Bayesian', 'bagging_temperature': 8.642951275450924}. Best is trial 209 with value: 0.8791208791208791.
[32m[I 2023-04-20 22:55:41,994][39m Trial 663 finished with value: 0.8539325842696629 and parameters: {'objective': 'CrossEntropy', 'colsample_bylevel': 0.08960860156542369, 'depth': 3, 'boosting_type': 'Plain', 'bootstrap_type': 'Bayesian', 'bagging_temperature': 9.59781950372663}. Best is trial 209 with value: 0.8791208791208791.
[32m[I 2023-04-20 22:55:42,928][39m Trial 664 finished with value: 0.8275862068965518 and parameters: {'objective': 'CrossEntropy', 'colsample_bylevel': 0.06933980052221783, 'depth': 3, 'boosting_type': 'Plain', 'bootstrap_type': 'MVS'}. Best is trial 209 with value: 0.8791208791208791.
[32m[I 2023-04-20 22:55:43,914][39m Trial 665 finished with value: 0.8666666666666666 and parameters: {'objective': 'CrossEntropy', 'colsample_bylevel': 0.08593486947942296, 'depth': 3, 'boosting_type': 'Plain', 'bootstrap_type': 'Bayesian', 'bagging_temperature': 9.31382528611245}. Best is trial 209 with value: 0.8791208791208791.
[32m[I 2023-04-20 22:55:45,114][39m Trial 666 finished with value: 0.8275862068965518 and parameters: {'objective': 'CrossEntropy', 'colsample_bylevel': 0.08480631374672383, 'depth': 3, 'boosting_type': 'Plain', 'bootstrap_type': 'Bayesian', 'bagging_temperature': 9.45966002230801}. Best is trial 209 with value: 0.8791208791208791.
[33m[W 2023-04-20 22:55:46,203][39m Trial 667 failed because of the following error: KeyboardInterrupt('')
Traceback (most recent call last):
  File "C:\Users\dimaz\AppData\Local\Packages\PythonSoftwareFoundation.Python.3.10_qbz5n2kfra8p0\LocalCache\local-packages\Python310\site-packages\optuna\study\_optimize.py", line 196, in _run_trial
    value_or_values = func(trial)
  File "d:\ФТиАД\vkr_gh\Drop_wall_impact\notebooks\../utils_functionality\models\hyperparams_tuning.py", line 40, in obj
    def obj(trial): return objective_cb(
  File "d:\ФТиАД\vkr_gh\Drop_wall_impact\notebooks\../utils_functionality\models\hyperparams_tuning.py", line 28, in objective_cb
    gbm.fit(train_x, train_y, eval_set=[
  File "C:\Users\dimaz\AppData\Local\Packages\PythonSoftwareFoundation.Python.3.10_qbz5n2kfra8p0\LocalCache\local-packages\Python310\site-packages\catboost\core.py", line 5128, in fit
    self._fit(X, y, cat_features, text_features, embedding_features, None, sample_weight, None, None, None, None, baseline, use_best_model,
  File "C:\Users\dimaz\AppData\Local\Packages\PythonSoftwareFoundation.Python.3.10_qbz5n2kfra8p0\LocalCache\local-packages\Python310\site-packages\catboost\core.py", line 2355, in _fit
    self._train(
  File "C:\Users\dimaz\AppData\Local\Packages\PythonSoftwareFoundation.Python.3.10_qbz5n2kfra8p0\LocalCache\local-packages\Python310\site-packages\catboost\core.py", line 1759, in _train
    self._object._train(train_pool, test_pool, params, allow_clear_pool, init_model._object if init_model else None)
  File "_catboost.pyx", line 4622, in _catboost._CatBoost._train
  File "_catboost.pyx", line 4671, in _catboost._CatBoost._train
KeyboardInterrupt
############################################################################################
############       F A S T   F E A T U R E  E N G G    A N D    S E L E C T I O N ! ########
# Be judicious with featurewiz. Don't use it to create too many un-interpretable features! #
############################################################################################
featurewiz has selected 0.7 as the correlation limit. Change this limit to fit your needs...
Skipping feature engineering since no feature_engg input...
Skipping category encoding since no category encoders specified in input...
#### Single_Label Binary_Classification problem ####
    Loaded train data. Shape = (372, 23)
#### Single_Label Binary_Classification problem ####
No test data filename given...
#######################################################################################
######################## C L A S S I F Y I N G  V A R I A B L E S  ####################
#######################################################################################
        No variables were removed since no ID or low-information variables found in data set
#######################################################################################
#####  Searching for Uncorrelated List Of Variables (SULOV) in 19 features ############
#######################################################################################
    there are no null values in dataset...
    Removing (7) highly correlated variables:
    ['We_Re', 'height', 'particle_droplet_diameter_ratio', 'roughness_binary', 'velocity', 'viscosity', 'volume_fraction_binary']
    Following (12) vars selected: ['droplet_diameter', 'inclination', 'long_impulse_duration', 'particle_liquid_density_ratio', 'surface_tension', 'voltage', 'Re', 'We', 'liquid_density', 'roughness', 'volume_fraction', 'particle_mean_diameter']
Completed SULOV. 12 features selected
Time taken for SULOV method = 0 seconds
Finally 15 vars selected after SULOV
Converting all features to numeric before sending to XGBoost...
    there were no mixed data types or object columns that errored. Data is all numeric...
Shape of train data after adding missing values flags = (372, 16)
#######################################################################################
#####    R E C U R S I V E   X G B O O S T : F E A T U R E   S E L E C T I O N  #######
#######################################################################################
Current number of predictors before recursive XGBoost = 15
Number of booster rounds = 100
            selecting 6 features in this iteration
            selecting 5 features in this iteration
            selecting 4 features in this iteration
            selecting 2 features in this iteration
            selecting 1 features in this iteration
    Completed XGBoost feature selection in 0 seconds
#######################################################################################
#####          F E A T U R E   S E L E C T I O N   C O M P L E T E D            #######
#######################################################################################
Selected 10 important features:
['surface_tension', 'particle_liquid_density_ratio', 'We', 'roughness', 'long_impulse_duration', 'Re', 'long_impulse_dur_binary', 'liquid_density', 'volume_fraction', 'wettability']
Total Time taken for featurewiz selection = 0 seconds
Output contains a list of 10 important features and a train dataframe