[32m[I 2023-04-20 22:40:51,012][39m A new study created in memory with name: no-name-b280dc0f-abca-433f-9545-7124f84e8bda
[32m[I 2023-04-20 22:40:51,510][39m Trial 0 finished with value: 0.8275862068965518 and parameters: {'objective': 'CrossEntropy', 'colsample_bylevel': 0.05329857866215044, 'depth': 12, 'boosting_type': 'Plain', 'bootstrap_type': 'Bayesian', 'bagging_temperature': 6.206695141256392}. Best is trial 0 with value: 0.8275862068965518.
[32m[I 2023-04-20 22:40:51,985][39m Trial 1 finished with value: 0.7865168539325843 and parameters: {'objective': 'Logloss', 'colsample_bylevel': 0.031993742567063936, 'depth': 12, 'boosting_type': 'Plain', 'bootstrap_type': 'MVS'}. Best is trial 0 with value: 0.8275862068965518.
[32m[I 2023-04-20 22:40:54,391][39m Trial 2 finished with value: 0.7674418604651163 and parameters: {'objective': 'CrossEntropy', 'colsample_bylevel': 0.015269892720992335, 'depth': 12, 'boosting_type': 'Ordered', 'bootstrap_type': 'Bayesian', 'bagging_temperature': 6.0177894177412}. Best is trial 0 with value: 0.8275862068965518.
[32m[I 2023-04-20 22:40:57,134][39m Trial 3 finished with value: 0.8314606741573034 and parameters: {'objective': 'Logloss', 'colsample_bylevel': 0.06957718504230812, 'depth': 11, 'boosting_type': 'Ordered', 'bootstrap_type': 'Bayesian', 'bagging_temperature': 2.6800890840816747}. Best is trial 3 with value: 0.8314606741573034.
[32m[I 2023-04-20 22:40:57,760][39m Trial 4 finished with value: 0.8139534883720929 and parameters: {'objective': 'CrossEntropy', 'colsample_bylevel': 0.09803597996631717, 'depth': 8, 'boosting_type': 'Plain', 'bootstrap_type': 'MVS'}. Best is trial 3 with value: 0.8314606741573034.
[32m[I 2023-04-20 22:41:00,644][39m Trial 5 finished with value: 0.8275862068965518 and parameters: {'objective': 'CrossEntropy', 'colsample_bylevel': 0.08143077398662882, 'depth': 7, 'boosting_type': 'Ordered', 'bootstrap_type': 'Bayesian', 'bagging_temperature': 4.548736450926336}. Best is trial 3 with value: 0.8314606741573034.
[32m[I 2023-04-20 22:41:03,534][39m Trial 6 finished with value: 0.8 and parameters: {'objective': 'Logloss', 'colsample_bylevel': 0.03789893053532876, 'depth': 4, 'boosting_type': 'Ordered', 'bootstrap_type': 'MVS'}. Best is trial 3 with value: 0.8314606741573034.
[32m[I 2023-04-20 22:41:04,063][39m Trial 7 finished with value: 0.7252747252747254 and parameters: {'objective': 'Logloss', 'colsample_bylevel': 0.02028393849558132, 'depth': 8, 'boosting_type': 'Plain', 'bootstrap_type': 'Bernoulli', 'subsample': 0.43779044275806966}. Best is trial 3 with value: 0.8314606741573034.
[32m[I 2023-04-20 22:41:04,550][39m Trial 8 finished with value: 0.7674418604651163 and parameters: {'objective': 'CrossEntropy', 'colsample_bylevel': 0.01688865828394267, 'depth': 1, 'boosting_type': 'Plain', 'bootstrap_type': 'Bernoulli', 'subsample': 0.11295175798828495}. Best is trial 3 with value: 0.8314606741573034.
[32m[I 2023-04-20 22:41:05,162][39m Trial 9 finished with value: 0.8139534883720929 and parameters: {'objective': 'Logloss', 'colsample_bylevel': 0.0978207173824467, 'depth': 3, 'boosting_type': 'Plain', 'bootstrap_type': 'MVS'}. Best is trial 3 with value: 0.8314606741573034.
[32m[I 2023-04-20 22:41:08,309][39m Trial 10 finished with value: 0.8351648351648352 and parameters: {'objective': 'Logloss', 'colsample_bylevel': 0.0720205107054523, 'depth': 10, 'boosting_type': 'Ordered', 'bootstrap_type': 'Bayesian', 'bagging_temperature': 0.795199544927645}. Best is trial 10 with value: 0.8351648351648352.
[32m[I 2023-04-20 22:41:11,514][39m Trial 11 finished with value: 0.8089887640449439 and parameters: {'objective': 'Logloss', 'colsample_bylevel': 0.06926229658353865, 'depth': 10, 'boosting_type': 'Ordered', 'bootstrap_type': 'Bayesian', 'bagging_temperature': 0.007618432330269598}. Best is trial 10 with value: 0.8351648351648352.
[32m[I 2023-04-20 22:41:14,733][39m Trial 12 finished with value: 0.8409090909090909 and parameters: {'objective': 'Logloss', 'colsample_bylevel': 0.06861806628858239, 'depth': 9, 'boosting_type': 'Ordered', 'bootstrap_type': 'Bayesian', 'bagging_temperature': 1.232937189191313}. Best is trial 12 with value: 0.8409090909090909.
[32m[I 2023-04-20 22:41:17,966][39m Trial 13 finished with value: 0.8131868131868132 and parameters: {'objective': 'Logloss', 'colsample_bylevel': 0.0643783837959295, 'depth': 9, 'boosting_type': 'Ordered', 'bootstrap_type': 'Bayesian', 'bagging_temperature': 0.3606569650900544}. Best is trial 12 with value: 0.8409090909090909.
[32m[I 2023-04-20 22:41:21,595][39m Trial 14 finished with value: 0.8409090909090909 and parameters: {'objective': 'Logloss', 'colsample_bylevel': 0.08121128522963283, 'depth': 5, 'boosting_type': 'Ordered', 'bootstrap_type': 'Bayesian', 'bagging_temperature': 8.801831566422091}. Best is trial 12 with value: 0.8409090909090909.
[32m[I 2023-04-20 22:41:25,402][39m Trial 15 finished with value: 0.8275862068965518 and parameters: {'objective': 'Logloss', 'colsample_bylevel': 0.0846623966660145, 'depth': 5, 'boosting_type': 'Ordered', 'bootstrap_type': 'Bayesian', 'bagging_temperature': 9.892248421333633}. Best is trial 12 with value: 0.8409090909090909.
[32m[I 2023-04-20 22:41:28,900][39m Trial 16 finished with value: 0.8 and parameters: {'objective': 'Logloss', 'colsample_bylevel': 0.04843494945974808, 'depth': 6, 'boosting_type': 'Ordered', 'bootstrap_type': 'Bernoulli', 'subsample': 0.9946023327626905}. Best is trial 12 with value: 0.8409090909090909.
[32m[I 2023-04-20 22:41:32,385][39m Trial 17 finished with value: 0.8275862068965518 and parameters: {'objective': 'Logloss', 'colsample_bylevel': 0.08467662035447028, 'depth': 2, 'boosting_type': 'Ordered', 'bootstrap_type': 'Bayesian', 'bagging_temperature': 9.410131623870587}. Best is trial 12 with value: 0.8409090909090909.
[32m[I 2023-04-20 22:41:36,164][39m Trial 18 finished with value: 0.8409090909090909 and parameters: {'objective': 'Logloss', 'colsample_bylevel': 0.06253176277542172, 'depth': 6, 'boosting_type': 'Ordered', 'bootstrap_type': 'Bayesian', 'bagging_temperature': 7.594267126552774}. Best is trial 12 with value: 0.8409090909090909.
[32m[I 2023-04-20 22:41:39,680][39m Trial 19 finished with value: 0.8 and parameters: {'objective': 'Logloss', 'colsample_bylevel': 0.05974439779132656, 'depth': 5, 'boosting_type': 'Ordered', 'bootstrap_type': 'Bernoulli', 'subsample': 0.9702963301047058}. Best is trial 12 with value: 0.8409090909090909.
[32m[I 2023-04-20 22:41:43,222][39m Trial 20 finished with value: 0.8539325842696629 and parameters: {'objective': 'Logloss', 'colsample_bylevel': 0.07749642166639319, 'depth': 8, 'boosting_type': 'Ordered', 'bootstrap_type': 'Bayesian', 'bagging_temperature': 3.2017626192135475}. Best is trial 20 with value: 0.8539325842696629.
[32m[I 2023-04-20 22:41:47,268][39m Trial 21 finished with value: 0.8409090909090909 and parameters: {'objective': 'Logloss', 'colsample_bylevel': 0.07785888644205559, 'depth': 6, 'boosting_type': 'Ordered', 'bootstrap_type': 'Bayesian', 'bagging_temperature': 8.17029238661067}. Best is trial 20 with value: 0.8539325842696629.
[32m[I 2023-04-20 22:41:50,700][39m Trial 22 finished with value: 0.8275862068965518 and parameters: {'objective': 'Logloss', 'colsample_bylevel': 0.07661744279807435, 'depth': 7, 'boosting_type': 'Ordered', 'bootstrap_type': 'Bayesian', 'bagging_temperature': 7.715177441143821}. Best is trial 20 with value: 0.8539325842696629.
[32m[I 2023-04-20 22:41:54,217][39m Trial 23 finished with value: 0.8409090909090909 and parameters: {'objective': 'Logloss', 'colsample_bylevel': 0.09159003440957196, 'depth': 4, 'boosting_type': 'Ordered', 'bootstrap_type': 'Bayesian', 'bagging_temperature': 3.8268905326057214}. Best is trial 20 with value: 0.8539325842696629.
[32m[I 2023-04-20 22:41:57,574][39m Trial 24 finished with value: 0.8409090909090909 and parameters: {'objective': 'Logloss', 'colsample_bylevel': 0.08979308386356959, 'depth': 3, 'boosting_type': 'Ordered', 'bootstrap_type': 'Bayesian', 'bagging_temperature': 3.7025416480452926}. Best is trial 20 with value: 0.8539325842696629.
[32m[I 2023-04-20 22:42:00,964][39m Trial 25 finished with value: 0.8275862068965518 and parameters: {'objective': 'Logloss', 'colsample_bylevel': 0.04871193332232196, 'depth': 8, 'boosting_type': 'Ordered', 'bootstrap_type': 'Bayesian', 'bagging_temperature': 1.9315065391004707}. Best is trial 20 with value: 0.8539325842696629.
[32m[I 2023-04-20 22:42:04,558][39m Trial 26 finished with value: 0.8275862068965518 and parameters: {'objective': 'CrossEntropy', 'colsample_bylevel': 0.0921200922860601, 'depth': 9, 'boosting_type': 'Ordered', 'bootstrap_type': 'Bayesian', 'bagging_temperature': 2.7546301185901894}. Best is trial 20 with value: 0.8539325842696629.
[32m[I 2023-04-20 22:42:08,005][39m Trial 27 finished with value: 0.8409090909090909 and parameters: {'objective': 'Logloss', 'colsample_bylevel': 0.09049204917531954, 'depth': 3, 'boosting_type': 'Ordered', 'bootstrap_type': 'Bayesian', 'bagging_temperature': 4.004548687615316}. Best is trial 20 with value: 0.8539325842696629.
[32m[I 2023-04-20 22:42:11,380][39m Trial 28 finished with value: 0.8 and parameters: {'objective': 'Logloss', 'colsample_bylevel': 0.08885807252039987, 'depth': 1, 'boosting_type': 'Ordered', 'bootstrap_type': 'Bernoulli', 'subsample': 0.6147392921520338}. Best is trial 20 with value: 0.8539325842696629.
[32m[I 2023-04-20 22:42:12,087][39m Trial 29 finished with value: 0.8181818181818182 and parameters: {'objective': 'CrossEntropy', 'colsample_bylevel': 0.07638281283644945, 'depth': 4, 'boosting_type': 'Plain', 'bootstrap_type': 'MVS'}. Best is trial 20 with value: 0.8539325842696629.
[32m[I 2023-04-20 22:42:15,511][39m Trial 30 finished with value: 0.8409090909090909 and parameters: {'objective': 'Logloss', 'colsample_bylevel': 0.05399106012461225, 'depth': 5, 'boosting_type': 'Ordered', 'bootstrap_type': 'Bayesian', 'bagging_temperature': 5.944336858073667}. Best is trial 20 with value: 0.8539325842696629.
[32m[I 2023-04-20 22:42:18,900][39m Trial 31 finished with value: 0.8181818181818182 and parameters: {'objective': 'Logloss', 'colsample_bylevel': 0.05068642804763458, 'depth': 3, 'boosting_type': 'Ordered', 'bootstrap_type': 'Bayesian', 'bagging_temperature': 3.5739462762334453}. Best is trial 20 with value: 0.8539325842696629.
[32m[I 2023-04-20 22:42:22,453][39m Trial 32 finished with value: 0.8539325842696629 and parameters: {'objective': 'Logloss', 'colsample_bylevel': 0.09414690863979934, 'depth': 3, 'boosting_type': 'Ordered', 'bootstrap_type': 'Bayesian', 'bagging_temperature': 4.18300278380429}. Best is trial 20 with value: 0.8539325842696629.
[32m[I 2023-04-20 22:42:25,766][39m Trial 33 finished with value: 0.8089887640449439 and parameters: {'objective': 'Logloss', 'colsample_bylevel': 0.03739803445268268, 'depth': 2, 'boosting_type': 'Ordered', 'bootstrap_type': 'Bayesian', 'bagging_temperature': 5.753273188189302}. Best is trial 20 with value: 0.8539325842696629.
[32m[I 2023-04-20 22:42:29,347][39m Trial 34 finished with value: 0.8139534883720929 and parameters: {'objective': 'Logloss', 'colsample_bylevel': 0.09972657986067497, 'depth': 4, 'boosting_type': 'Ordered', 'bootstrap_type': 'Bayesian', 'bagging_temperature': 4.489955663354809}. Best is trial 20 with value: 0.8539325842696629.
[32m[I 2023-04-20 22:42:30,076][39m Trial 35 finished with value: 0.8539325842696629 and parameters: {'objective': 'Logloss', 'colsample_bylevel': 0.09510373534501039, 'depth': 2, 'boosting_type': 'Plain', 'bootstrap_type': 'Bayesian', 'bagging_temperature': 5.318383701626589}. Best is trial 20 with value: 0.8539325842696629.
[32m[I 2023-04-20 22:42:30,707][39m Trial 36 finished with value: 0.8222222222222222 and parameters: {'objective': 'CrossEntropy', 'colsample_bylevel': 0.054737162382861235, 'depth': 2, 'boosting_type': 'Plain', 'bootstrap_type': 'MVS'}. Best is trial 20 with value: 0.8539325842696629.
[32m[I 2023-04-20 22:42:31,432][39m Trial 37 finished with value: 0.8505747126436782 and parameters: {'objective': 'Logloss', 'colsample_bylevel': 0.09586841438049878, 'depth': 7, 'boosting_type': 'Plain', 'bootstrap_type': 'Bayesian', 'bagging_temperature': 7.189957461544953}. Best is trial 20 with value: 0.8539325842696629.
[32m[I 2023-04-20 22:42:32,131][39m Trial 38 finished with value: 0.8505747126436782 and parameters: {'objective': 'CrossEntropy', 'colsample_bylevel': 0.0951917205410063, 'depth': 7, 'boosting_type': 'Plain', 'bootstrap_type': 'Bayesian', 'bagging_temperature': 6.767571429996714}. Best is trial 20 with value: 0.8539325842696629.
[32m[I 2023-04-20 22:42:32,819][39m Trial 39 finished with value: 0.8314606741573034 and parameters: {'objective': 'CrossEntropy', 'colsample_bylevel': 0.08551705374820227, 'depth': 8, 'boosting_type': 'Plain', 'bootstrap_type': 'MVS'}. Best is trial 20 with value: 0.8539325842696629.
[32m[I 2023-04-20 22:42:33,440][39m Trial 40 finished with value: 0.8372093023255814 and parameters: {'objective': 'Logloss', 'colsample_bylevel': 0.09528828362571429, 'depth': 1, 'boosting_type': 'Plain', 'bootstrap_type': 'Bayesian', 'bagging_temperature': 4.909615658619497}. Best is trial 20 with value: 0.8539325842696629.
[32m[I 2023-04-20 22:42:34,128][39m Trial 41 finished with value: 0.8505747126436782 and parameters: {'objective': 'CrossEntropy', 'colsample_bylevel': 0.09505580854923766, 'depth': 7, 'boosting_type': 'Plain', 'bootstrap_type': 'Bayesian', 'bagging_temperature': 6.909064917561814}. Best is trial 20 with value: 0.8539325842696629.
[32m[I 2023-04-20 22:42:34,845][39m Trial 42 finished with value: 0.8505747126436782 and parameters: {'objective': 'CrossEntropy', 'colsample_bylevel': 0.09985672547212313, 'depth': 7, 'boosting_type': 'Plain', 'bootstrap_type': 'Bayesian', 'bagging_temperature': 5.3417534723605895}. Best is trial 20 with value: 0.8539325842696629.
[32m[I 2023-04-20 22:42:35,587][39m Trial 43 finished with value: 0.8505747126436782 and parameters: {'objective': 'CrossEntropy', 'colsample_bylevel': 0.09950970533262167, 'depth': 8, 'boosting_type': 'Plain', 'bootstrap_type': 'Bayesian', 'bagging_temperature': 5.3186828794750145}. Best is trial 20 with value: 0.8539325842696629.
[32m[I 2023-04-20 22:42:36,265][39m Trial 44 finished with value: 0.8539325842696629 and parameters: {'objective': 'CrossEntropy', 'colsample_bylevel': 0.0937644635962857, 'depth': 10, 'boosting_type': 'Plain', 'bootstrap_type': 'Bayesian', 'bagging_temperature': 6.54915237089449}. Best is trial 20 with value: 0.8539325842696629.
[32m[I 2023-04-20 22:42:36,962][39m Trial 45 finished with value: 0.8409090909090909 and parameters: {'objective': 'CrossEntropy', 'colsample_bylevel': 0.08750308530222894, 'depth': 12, 'boosting_type': 'Plain', 'bootstrap_type': 'Bernoulli', 'subsample': 0.12503735400687888}. Best is trial 20 with value: 0.8539325842696629.
[32m[I 2023-04-20 22:42:37,634][39m Trial 46 finished with value: 0.8409090909090909 and parameters: {'objective': 'CrossEntropy', 'colsample_bylevel': 0.0814104401520379, 'depth': 10, 'boosting_type': 'Plain', 'bootstrap_type': 'Bayesian', 'bagging_temperature': 5.391308610676979}. Best is trial 20 with value: 0.8539325842696629.
[32m[I 2023-04-20 22:42:38,292][39m Trial 47 finished with value: 0.8409090909090909 and parameters: {'objective': 'CrossEntropy', 'colsample_bylevel': 0.07395684263935129, 'depth': 10, 'boosting_type': 'Plain', 'bootstrap_type': 'Bayesian', 'bagging_temperature': 6.380038535138381}. Best is trial 20 with value: 0.8539325842696629.
[32m[I 2023-04-20 22:42:38,973][39m Trial 48 finished with value: 0.7906976744186047 and parameters: {'objective': 'CrossEntropy', 'colsample_bylevel': 0.09284708709225661, 'depth': 11, 'boosting_type': 'Plain', 'bootstrap_type': 'MVS'}. Best is trial 20 with value: 0.8539325842696629.
[32m[I 2023-04-20 22:42:39,635][39m Trial 49 finished with value: 0.8505747126436782 and parameters: {'objective': 'CrossEntropy', 'colsample_bylevel': 0.08134194836439046, 'depth': 11, 'boosting_type': 'Plain', 'bootstrap_type': 'Bayesian', 'bagging_temperature': 2.6278010264567944}. Best is trial 20 with value: 0.8539325842696629.
[32m[I 2023-04-20 22:42:40,319][39m Trial 50 finished with value: 0.8372093023255814 and parameters: {'objective': 'CrossEntropy', 'colsample_bylevel': 0.08271706182503577, 'depth': 11, 'boosting_type': 'Plain', 'bootstrap_type': 'Bayesian', 'bagging_temperature': 3.1215096705841994}. Best is trial 20 with value: 0.8539325842696629.
[32m[I 2023-04-20 22:42:41,024][39m Trial 51 finished with value: 0.8275862068965518 and parameters: {'objective': 'CrossEntropy', 'colsample_bylevel': 0.08629144834992802, 'depth': 11, 'boosting_type': 'Plain', 'bootstrap_type': 'Bayesian', 'bagging_temperature': 2.4048359975115914}. Best is trial 20 with value: 0.8539325842696629.
[32m[I 2023-04-20 22:42:41,624][39m Trial 52 finished with value: 0.7529411764705882 and parameters: {'objective': 'CrossEntropy', 'colsample_bylevel': 0.026229620229923707, 'depth': 9, 'boosting_type': 'Plain', 'bootstrap_type': 'Bayesian', 'bagging_temperature': 1.9065432881853983}. Best is trial 20 with value: 0.8539325842696629.
[32m[I 2023-04-20 22:42:42,318][39m Trial 53 finished with value: 0.8505747126436782 and parameters: {'objective': 'Logloss', 'colsample_bylevel': 0.09529467182381102, 'depth': 10, 'boosting_type': 'Plain', 'bootstrap_type': 'Bayesian', 'bagging_temperature': 4.372741300432264}. Best is trial 20 with value: 0.8539325842696629.
[32m[I 2023-04-20 22:42:43,114][39m Trial 54 finished with value: 0.8409090909090909 and parameters: {'objective': 'Logloss', 'colsample_bylevel': 0.09587744612509999, 'depth': 9, 'boosting_type': 'Plain', 'bootstrap_type': 'Bayesian', 'bagging_temperature': 4.535970078735908}. Best is trial 20 with value: 0.8539325842696629.
[32m[I 2023-04-20 22:42:43,816][39m Trial 55 finished with value: 0.8275862068965518 and parameters: {'objective': 'Logloss', 'colsample_bylevel': 0.09324909617903193, 'depth': 10, 'boosting_type': 'Plain', 'bootstrap_type': 'Bayesian', 'bagging_temperature': 6.5516455376294225}. Best is trial 20 with value: 0.8539325842696629.
[32m[I 2023-04-20 22:42:44,468][39m Trial 56 finished with value: 0.8275862068965518 and parameters: {'objective': 'Logloss', 'colsample_bylevel': 0.0807103362276082, 'depth': 12, 'boosting_type': 'Plain', 'bootstrap_type': 'Bernoulli', 'subsample': 0.6624981050024483}. Best is trial 20 with value: 0.8539325842696629.
[32m[I 2023-04-20 22:42:45,189][39m Trial 57 finished with value: 0.8539325842696629 and parameters: {'objective': 'CrossEntropy', 'colsample_bylevel': 0.09816646645092945, 'depth': 8, 'boosting_type': 'Plain', 'bootstrap_type': 'Bayesian', 'bagging_temperature': 5.0634506109586725}. Best is trial 20 with value: 0.8539325842696629.
[32m[I 2023-04-20 22:42:45,911][39m Trial 58 finished with value: 0.8275862068965518 and parameters: {'objective': 'Logloss', 'colsample_bylevel': 0.08855868062885186, 'depth': 8, 'boosting_type': 'Plain', 'bootstrap_type': 'Bayesian', 'bagging_temperature': 7.087229275034499}. Best is trial 20 with value: 0.8539325842696629.
[32m[I 2023-04-20 22:42:46,611][39m Trial 59 finished with value: 0.8275862068965518 and parameters: {'objective': 'Logloss', 'colsample_bylevel': 0.09666272005454479, 'depth': 6, 'boosting_type': 'Plain', 'bootstrap_type': 'Bayesian', 'bagging_temperature': 6.014337085447752}. Best is trial 20 with value: 0.8539325842696629.
[32m[I 2023-04-20 22:42:47,251][39m Trial 60 finished with value: 0.8666666666666666 and parameters: {'objective': 'Logloss', 'colsample_bylevel': 0.09180980047174221, 'depth': 2, 'boosting_type': 'Plain', 'bootstrap_type': 'Bayesian', 'bagging_temperature': 7.300591187589112}. Best is trial 60 with value: 0.8666666666666666.
[32m[I 2023-04-20 22:42:47,925][39m Trial 61 finished with value: 0.8275862068965518 and parameters: {'objective': 'Logloss', 'colsample_bylevel': 0.09141083416350537, 'depth': 2, 'boosting_type': 'Plain', 'bootstrap_type': 'Bayesian', 'bagging_temperature': 4.846212220978624}. Best is trial 60 with value: 0.8666666666666666.
[32m[I 2023-04-20 22:42:48,547][39m Trial 62 finished with value: 0.8275862068965518 and parameters: {'objective': 'CrossEntropy', 'colsample_bylevel': 0.06593443894361574, 'depth': 2, 'boosting_type': 'Plain', 'bootstrap_type': 'Bayesian', 'bagging_temperature': 3.1699337308020503}. Best is trial 60 with value: 0.8666666666666666.
[32m[I 2023-04-20 22:42:49,148][39m Trial 63 finished with value: 0.7906976744186047 and parameters: {'objective': 'CrossEntropy', 'colsample_bylevel': 0.07891739895498309, 'depth': 1, 'boosting_type': 'Plain', 'bootstrap_type': 'Bayesian', 'bagging_temperature': 8.159854195001062}. Best is trial 60 with value: 0.8666666666666666.
[32m[I 2023-04-20 22:42:49,871][39m Trial 64 finished with value: 0.8372093023255814 and parameters: {'objective': 'CrossEntropy', 'colsample_bylevel': 0.08512712795553372, 'depth': 8, 'boosting_type': 'Plain', 'bootstrap_type': 'Bayesian', 'bagging_temperature': 7.209093378810545}. Best is trial 60 with value: 0.8666666666666666.
[32m[I 2023-04-20 22:42:50,561][39m Trial 65 finished with value: 0.8409090909090909 and parameters: {'objective': 'Logloss', 'colsample_bylevel': 0.09793293472974364, 'depth': 7, 'boosting_type': 'Plain', 'bootstrap_type': 'Bayesian', 'bagging_temperature': 7.598530267130889}. Best is trial 60 with value: 0.8666666666666666.
[32m[I 2023-04-20 22:42:51,189][39m Trial 66 finished with value: 0.8314606741573034 and parameters: {'objective': 'CrossEntropy', 'colsample_bylevel': 0.0710125263784914, 'depth': 11, 'boosting_type': 'Plain', 'bootstrap_type': 'Bernoulli', 'subsample': 0.37464678327828993}. Best is trial 60 with value: 0.8666666666666666.
