[32m[I 2023-04-26 12:33:45,104][39m Trial 180 finished with value: 0.7027027027027026 and parameters: {'algorithm': 'auto', 'n_neighbors': 5, 'weights': 'distance', 'metric': 'minkowski'}. Best is trial 21 with value: 0.7207207207207208.
[32m[I 2023-04-26 12:33:45,130][39m Trial 181 finished with value: 0.7207207207207208 and parameters: {'algorithm': 'brute', 'n_neighbors': 3, 'weights': 'distance', 'metric': 'manhattan'}. Best is trial 21 with value: 0.7207207207207208.
[32m[I 2023-04-26 12:33:45,144][39m Trial 182 finished with value: 0.7130434782608696 and parameters: {'algorithm': 'auto', 'n_neighbors': 2, 'weights': 'distance', 'metric': 'manhattan'}. Best is trial 21 with value: 0.7207207207207208.
[32m[I 2023-04-26 12:33:45,175][39m Trial 183 finished with value: 0.709090909090909 and parameters: {'algorithm': 'brute', 'n_neighbors': 8, 'weights': 'distance', 'metric': 'minkowski'}. Best is trial 21 with value: 0.7207207207207208.
[32m[I 2023-04-26 12:33:45,210][39m Trial 184 finished with value: 0.7207207207207208 and parameters: {'algorithm': 'brute', 'n_neighbors': 9, 'weights': 'distance', 'metric': 'minkowski'}. Best is trial 21 with value: 0.7207207207207208.
[32m[I 2023-04-26 12:33:45,225][39m Trial 185 finished with value: 0.7207207207207208 and parameters: {'algorithm': 'kd_tree', 'n_neighbors': 3, 'weights': 'distance', 'metric': 'manhattan'}. Best is trial 21 with value: 0.7207207207207208.
[32m[I 2023-04-26 12:33:45,240][39m Trial 186 finished with value: 0.709090909090909 and parameters: {'algorithm': 'auto', 'n_neighbors': 10, 'weights': 'distance', 'metric': 'minkowski'}. Best is trial 21 with value: 0.7207207207207208.
[32m[I 2023-04-26 12:33:45,254][39m Trial 187 finished with value: 0.7130434782608696 and parameters: {'algorithm': 'kd_tree', 'n_neighbors': 2, 'weights': 'distance', 'metric': 'manhattan'}. Best is trial 21 with value: 0.7207207207207208.
[32m[I 2023-04-26 12:33:45,270][39m Trial 188 finished with value: 0.709090909090909 and parameters: {'algorithm': 'auto', 'n_neighbors': 10, 'weights': 'distance', 'metric': 'minkowski'}. Best is trial 21 with value: 0.7207207207207208.
[32m[I 2023-04-26 12:33:45,288][39m Trial 189 finished with value: 0.6554621848739496 and parameters: {'algorithm': 'ball_tree', 'n_neighbors': 9, 'weights': 'uniform', 'metric': 'minkowski'}. Best is trial 21 with value: 0.7207207207207208.
[32m[I 2023-04-26 12:33:45,303][39m Trial 190 finished with value: 0.709090909090909 and parameters: {'algorithm': 'kd_tree', 'n_neighbors': 8, 'weights': 'distance', 'metric': 'minkowski'}. Best is trial 21 with value: 0.7207207207207208.
[32m[I 2023-04-26 12:33:45,312][39m Trial 191 finished with value: 0.7207207207207208 and parameters: {'algorithm': 'kd_tree', 'n_neighbors': 3, 'weights': 'distance', 'metric': 'manhattan'}. Best is trial 21 with value: 0.7207207207207208.
[32m[I 2023-04-26 12:33:45,320][39m Trial 192 finished with value: 0.7207207207207208 and parameters: {'algorithm': 'kd_tree', 'n_neighbors': 9, 'weights': 'distance', 'metric': 'minkowski'}. Best is trial 21 with value: 0.7207207207207208.
[32m[I 2023-04-26 12:33:45,329][39m Trial 193 finished with value: 0.7079646017699116 and parameters: {'algorithm': 'kd_tree', 'n_neighbors': 4, 'weights': 'distance', 'metric': 'manhattan'}. Best is trial 21 with value: 0.7207207207207208.
[32m[I 2023-04-26 12:33:45,337][39m Trial 194 finished with value: 0.7207207207207208 and parameters: {'algorithm': 'kd_tree', 'n_neighbors': 3, 'weights': 'distance', 'metric': 'manhattan'}. Best is trial 21 with value: 0.7207207207207208.
[32m[I 2023-04-26 12:33:45,344][39m Trial 195 finished with value: 0.6972477064220184 and parameters: {'algorithm': 'auto', 'n_neighbors': 11, 'weights': 'distance', 'metric': 'manhattan'}. Best is trial 21 with value: 0.7207207207207208.
[32m[I 2023-04-26 12:33:45,352][39m Trial 196 finished with value: 0.7207207207207208 and parameters: {'algorithm': 'auto', 'n_neighbors': 3, 'weights': 'distance', 'metric': 'manhattan'}. Best is trial 21 with value: 0.7207207207207208.
[32m[I 2023-04-26 12:33:45,360][39m Trial 197 finished with value: 0.7207207207207208 and parameters: {'algorithm': 'kd_tree', 'n_neighbors': 3, 'weights': 'distance', 'metric': 'manhattan'}. Best is trial 21 with value: 0.7207207207207208.
[32m[I 2023-04-26 12:33:45,368][39m Trial 198 finished with value: 0.6972477064220184 and parameters: {'algorithm': 'kd_tree', 'n_neighbors': 5, 'weights': 'distance', 'metric': 'manhattan'}. Best is trial 21 with value: 0.7207207207207208.
[32m[I 2023-04-26 12:33:45,375][39m Trial 199 finished with value: 0.7207207207207208 and parameters: {'algorithm': 'auto', 'n_neighbors': 3, 'weights': 'distance', 'metric': 'manhattan'}. Best is trial 21 with value: 0.7207207207207208.
[32m[I 2023-04-26 12:33:45,383][39m Trial 200 finished with value: 0.709090909090909 and parameters: {'algorithm': 'ball_tree', 'n_neighbors': 8, 'weights': 'distance', 'metric': 'minkowski'}. Best is trial 21 with value: 0.7207207207207208.
[32m[I 2023-04-26 12:33:45,390][39m Trial 201 finished with value: 0.7130434782608696 and parameters: {'algorithm': 'auto', 'n_neighbors': 2, 'weights': 'distance', 'metric': 'manhattan'}. Best is trial 21 with value: 0.7207207207207208.
[32m[I 2023-04-26 12:33:45,398][39m Trial 202 finished with value: 0.7079646017699116 and parameters: {'algorithm': 'auto', 'n_neighbors': 4, 'weights': 'distance', 'metric': 'manhattan'}. Best is trial 21 with value: 0.7207207207207208.
[32m[I 2023-04-26 12:33:45,406][39m Trial 203 finished with value: 0.7207207207207208 and parameters: {'algorithm': 'auto', 'n_neighbors': 3, 'weights': 'distance', 'metric': 'manhattan'}. Best is trial 21 with value: 0.7207207207207208.
[32m[I 2023-04-26 12:33:45,413][39m Trial 204 finished with value: 0.709090909090909 and parameters: {'algorithm': 'ball_tree', 'n_neighbors': 7, 'weights': 'distance', 'metric': 'euclidean'}. Best is trial 21 with value: 0.7207207207207208.
[32m[I 2023-04-26 12:33:45,439][39m Trial 205 finished with value: 0.7130434782608696 and parameters: {'algorithm': 'brute', 'n_neighbors': 1, 'weights': 'distance', 'metric': 'manhattan'}. Best is trial 21 with value: 0.7207207207207208.
[32m[I 2023-04-26 12:33:45,454][39m Trial 206 finished with value: 0.7207207207207208 and parameters: {'algorithm': 'auto', 'n_neighbors': 9, 'weights': 'distance', 'metric': 'minkowski'}. Best is trial 21 with value: 0.7207207207207208.
[32m[I 2023-04-26 12:33:45,470][39m Trial 207 finished with value: 0.7079646017699116 and parameters: {'algorithm': 'kd_tree', 'n_neighbors': 4, 'weights': 'distance', 'metric': 'manhattan'}. Best is trial 21 with value: 0.7207207207207208.
[32m[I 2023-04-26 12:33:45,485][39m Trial 208 finished with value: 0.709090909090909 and parameters: {'algorithm': 'auto', 'n_neighbors': 10, 'weights': 'distance', 'metric': 'minkowski'}. Best is trial 21 with value: 0.7207207207207208.
[32m[I 2023-04-26 12:33:45,500][39m Trial 209 finished with value: 0.7207207207207208 and parameters: {'algorithm': 'auto', 'n_neighbors': 9, 'weights': 'distance', 'metric': 'minkowski'}. Best is trial 21 with value: 0.7207207207207208.
[32m[I 2023-04-26 12:33:45,515][39m Trial 210 finished with value: 0.7207207207207208 and parameters: {'algorithm': 'auto', 'n_neighbors': 9, 'weights': 'distance', 'metric': 'minkowski'}. Best is trial 21 with value: 0.7207207207207208.
[32m[I 2023-04-26 12:33:45,530][39m Trial 211 finished with value: 0.7207207207207208 and parameters: {'algorithm': 'kd_tree', 'n_neighbors': 3, 'weights': 'distance', 'metric': 'manhattan'}. Best is trial 21 with value: 0.7207207207207208.
[32m[I 2023-04-26 12:33:45,542][39m Trial 212 finished with value: 0.7130434782608696 and parameters: {'algorithm': 'kd_tree', 'n_neighbors': 2, 'weights': 'distance', 'metric': 'manhattan'}. Best is trial 21 with value: 0.7207207207207208.
[32m[I 2023-04-26 12:33:45,550][39m Trial 213 finished with value: 0.7207207207207208 and parameters: {'algorithm': 'ball_tree', 'n_neighbors': 9, 'weights': 'distance', 'metric': 'minkowski'}. Best is trial 21 with value: 0.7207207207207208.
[32m[I 2023-04-26 12:33:45,558][39m Trial 214 finished with value: 0.709090909090909 and parameters: {'algorithm': 'ball_tree', 'n_neighbors': 8, 'weights': 'distance', 'metric': 'minkowski'}. Best is trial 21 with value: 0.7207207207207208.
[32m[I 2023-04-26 12:33:45,565][39m Trial 215 finished with value: 0.709090909090909 and parameters: {'algorithm': 'auto', 'n_neighbors': 10, 'weights': 'distance', 'metric': 'minkowski'}. Best is trial 21 with value: 0.7207207207207208.
[32m[I 2023-04-26 12:33:45,573][39m Trial 216 finished with value: 0.7207207207207208 and parameters: {'algorithm': 'ball_tree', 'n_neighbors': 3, 'weights': 'distance', 'metric': 'manhattan'}. Best is trial 21 with value: 0.7207207207207208.
[32m[I 2023-04-26 12:33:45,581][39m Trial 217 finished with value: 0.7079646017699116 and parameters: {'algorithm': 'ball_tree', 'n_neighbors': 4, 'weights': 'distance', 'metric': 'manhattan'}. Best is trial 21 with value: 0.7207207207207208.
[32m[I 2023-04-26 12:33:45,589][39m Trial 218 finished with value: 0.709090909090909 and parameters: {'algorithm': 'kd_tree', 'n_neighbors': 10, 'weights': 'distance', 'metric': 'minkowski'}. Best is trial 21 with value: 0.7207207207207208.
[32m[I 2023-04-26 12:33:45,596][39m Trial 219 finished with value: 0.709090909090909 and parameters: {'algorithm': 'kd_tree', 'n_neighbors': 8, 'weights': 'distance', 'metric': 'minkowski'}. Best is trial 21 with value: 0.7207207207207208.
[32m[I 2023-04-26 12:33:45,604][39m Trial 220 finished with value: 0.6554621848739496 and parameters: {'algorithm': 'auto', 'n_neighbors': 9, 'weights': 'uniform', 'metric': 'minkowski'}. Best is trial 21 with value: 0.7207207207207208.
[32m[I 2023-04-26 12:33:45,612][39m Trial 221 finished with value: 0.709090909090909 and parameters: {'algorithm': 'auto', 'n_neighbors': 10, 'weights': 'distance', 'metric': 'minkowski'}. Best is trial 21 with value: 0.7207207207207208.
[32m[I 2023-04-26 12:33:45,636][39m Trial 222 finished with value: 0.7207207207207208 and parameters: {'algorithm': 'brute', 'n_neighbors': 3, 'weights': 'distance', 'metric': 'manhattan'}. Best is trial 21 with value: 0.7207207207207208.
[32m[I 2023-04-26 12:33:45,668][39m Trial 223 finished with value: 0.7130434782608696 and parameters: {'algorithm': 'brute', 'n_neighbors': 2, 'weights': 'distance', 'metric': 'manhattan'}. Best is trial 21 with value: 0.7207207207207208.
[32m[I 2023-04-26 12:33:45,701][39m Trial 224 finished with value: 0.7079646017699116 and parameters: {'algorithm': 'brute', 'n_neighbors': 4, 'weights': 'distance', 'metric': 'manhattan'}. Best is trial 21 with value: 0.7207207207207208.
[32m[I 2023-04-26 12:33:45,719][39m Trial 225 finished with value: 0.7207207207207208 and parameters: {'algorithm': 'kd_tree', 'n_neighbors': 9, 'weights': 'distance', 'metric': 'minkowski'}. Best is trial 21 with value: 0.7207207207207208.
[32m[I 2023-04-26 12:33:45,734][39m Trial 226 finished with value: 0.7207207207207208 and parameters: {'algorithm': 'kd_tree', 'n_neighbors': 3, 'weights': 'distance', 'metric': 'manhattan'}. Best is trial 21 with value: 0.7207207207207208.
[32m[I 2023-04-26 12:33:45,751][39m Trial 227 finished with value: 0.7207207207207208 and parameters: {'algorithm': 'ball_tree', 'n_neighbors': 9, 'weights': 'distance', 'metric': 'minkowski'}. Best is trial 21 with value: 0.7207207207207208.
[32m[I 2023-04-26 12:33:45,766][39m Trial 228 finished with value: 0.709090909090909 and parameters: {'algorithm': 'ball_tree', 'n_neighbors': 8, 'weights': 'distance', 'metric': 'minkowski'}. Best is trial 21 with value: 0.7207207207207208.
[32m[I 2023-04-26 12:33:45,782][39m Trial 229 finished with value: 0.7207207207207208 and parameters: {'algorithm': 'kd_tree', 'n_neighbors': 3, 'weights': 'distance', 'metric': 'manhattan'}. Best is trial 21 with value: 0.7207207207207208.
[32m[I 2023-04-26 12:33:45,797][39m Trial 230 finished with value: 0.7207207207207208 and parameters: {'algorithm': 'ball_tree', 'n_neighbors': 9, 'weights': 'distance', 'metric': 'minkowski'}. Best is trial 21 with value: 0.7207207207207208.
[32m[I 2023-04-26 12:33:45,809][39m Trial 231 finished with value: 0.7027027027027026 and parameters: {'algorithm': 'ball_tree', 'n_neighbors': 14, 'weights': 'distance', 'metric': 'minkowski'}. Best is trial 21 with value: 0.7207207207207208.
[32m[I 2023-04-26 12:33:45,818][39m Trial 232 finished with value: 0.7130434782608696 and parameters: {'algorithm': 'auto', 'n_neighbors': 2, 'weights': 'distance', 'metric': 'manhattan'}. Best is trial 21 with value: 0.7207207207207208.
[32m[I 2023-04-26 12:33:45,827][39m Trial 233 finished with value: 0.7207207207207208 and parameters: {'algorithm': 'auto', 'n_neighbors': 9, 'weights': 'distance', 'metric': 'minkowski'}. Best is trial 21 with value: 0.7207207207207208.
[32m[I 2023-04-26 12:33:45,835][39m Trial 234 finished with value: 0.709090909090909 and parameters: {'algorithm': 'ball_tree', 'n_neighbors': 8, 'weights': 'distance', 'metric': 'minkowski'}. Best is trial 21 with value: 0.7207207207207208.
[32m[I 2023-04-26 12:33:45,848][39m Trial 235 finished with value: 0.709090909090909 and parameters: {'algorithm': 'kd_tree', 'n_neighbors': 10, 'weights': 'distance', 'metric': 'minkowski'}. Best is trial 21 with value: 0.7207207207207208.
[32m[I 2023-04-26 12:33:45,862][39m Trial 236 finished with value: 0.7079646017699116 and parameters: {'algorithm': 'ball_tree', 'n_neighbors': 4, 'weights': 'distance', 'metric': 'manhattan'}. Best is trial 21 with value: 0.7207207207207208.
[32m[I 2023-04-26 12:33:45,875][39m Trial 237 finished with value: 0.7207207207207208 and parameters: {'algorithm': 'auto', 'n_neighbors': 3, 'weights': 'distance', 'metric': 'manhattan'}. Best is trial 21 with value: 0.7207207207207208.
[32m[I 2023-04-26 12:33:45,884][39m Trial 238 finished with value: 0.7207207207207208 and parameters: {'algorithm': 'kd_tree', 'n_neighbors': 3, 'weights': 'distance', 'metric': 'manhattan'}. Best is trial 21 with value: 0.7207207207207208.
[32m[I 2023-04-26 12:33:45,892][39m Trial 239 finished with value: 0.7207207207207208 and parameters: {'algorithm': 'kd_tree', 'n_neighbors': 3, 'weights': 'distance', 'metric': 'manhattan'}. Best is trial 21 with value: 0.7207207207207208.
[32m[I 2023-04-26 12:33:45,900][39m Trial 240 finished with value: 0.7207207207207208 and parameters: {'algorithm': 'auto', 'n_neighbors': 3, 'weights': 'distance', 'metric': 'manhattan'}. Best is trial 21 with value: 0.7207207207207208.
[32m[I 2023-04-26 12:33:45,908][39m Trial 241 finished with value: 0.7207207207207208 and parameters: {'algorithm': 'auto', 'n_neighbors': 9, 'weights': 'distance', 'metric': 'minkowski'}. Best is trial 21 with value: 0.7207207207207208.
[32m[I 2023-04-26 12:33:45,916][39m Trial 242 finished with value: 0.7207207207207208 and parameters: {'algorithm': 'auto', 'n_neighbors': 9, 'weights': 'distance', 'metric': 'minkowski'}. Best is trial 21 with value: 0.7207207207207208.
[32m[I 2023-04-26 12:33:45,923][39m Trial 243 finished with value: 0.7207207207207208 and parameters: {'algorithm': 'auto', 'n_neighbors': 9, 'weights': 'distance', 'metric': 'minkowski'}. Best is trial 21 with value: 0.7207207207207208.
[32m[I 2023-04-26 12:33:45,932][39m Trial 244 finished with value: 0.7207207207207208 and parameters: {'algorithm': 'auto', 'n_neighbors': 9, 'weights': 'distance', 'metric': 'minkowski'}. Best is trial 21 with value: 0.7207207207207208.
[32m[I 2023-04-26 12:33:45,940][39m Trial 245 finished with value: 0.7027027027027026 and parameters: {'algorithm': 'auto', 'n_neighbors': 18, 'weights': 'distance', 'metric': 'manhattan'}. Best is trial 21 with value: 0.7207207207207208.
[32m[I 2023-04-26 12:33:45,947][39m Trial 246 finished with value: 0.7130434782608696 and parameters: {'algorithm': 'kd_tree', 'n_neighbors': 2, 'weights': 'distance', 'metric': 'manhattan'}. Best is trial 21 with value: 0.7207207207207208.
[32m[I 2023-04-26 12:33:45,955][39m Trial 247 finished with value: 0.7130434782608696 and parameters: {'algorithm': 'auto', 'n_neighbors': 2, 'weights': 'distance', 'metric': 'manhattan'}. Best is trial 21 with value: 0.7207207207207208.
[32m[I 2023-04-26 12:33:45,963][39m Trial 248 finished with value: 0.6902654867256638 and parameters: {'algorithm': 'auto', 'n_neighbors': 4, 'weights': 'distance', 'metric': 'euclidean'}. Best is trial 21 with value: 0.7207207207207208.
[32m[I 2023-04-26 12:33:45,989][39m Trial 249 finished with value: 0.7207207207207208 and parameters: {'algorithm': 'brute', 'n_neighbors': 3, 'weights': 'distance', 'metric': 'manhattan'}. Best is trial 21 with value: 0.7207207207207208.
[32m[I 2023-04-26 12:33:46,006][39m Trial 250 finished with value: 0.7207207207207208 and parameters: {'algorithm': 'ball_tree', 'n_neighbors': 3, 'weights': 'distance', 'metric': 'manhattan'}. Best is trial 21 with value: 0.7207207207207208.
[32m[I 2023-04-26 12:33:46,022][39m Trial 251 finished with value: 0.7207207207207208 and parameters: {'algorithm': 'kd_tree', 'n_neighbors': 3, 'weights': 'distance', 'metric': 'manhattan'}. Best is trial 21 with value: 0.7207207207207208.
[32m[I 2023-04-26 12:33:46,039][39m Trial 252 finished with value: 0.7207207207207208 and parameters: {'algorithm': 'kd_tree', 'n_neighbors': 3, 'weights': 'distance', 'metric': 'manhattan'}. Best is trial 21 with value: 0.7207207207207208.
[32m[I 2023-04-26 12:33:46,053][39m Trial 253 finished with value: 0.7079646017699116 and parameters: {'algorithm': 'ball_tree', 'n_neighbors': 4, 'weights': 'distance', 'metric': 'manhattan'}. Best is trial 21 with value: 0.7207207207207208.
[32m[I 2023-04-26 12:33:46,071][39m Trial 254 finished with value: 0.7017543859649122 and parameters: {'algorithm': 'kd_tree', 'n_neighbors': 2, 'weights': 'distance', 'metric': 'minkowski'}. Best is trial 21 with value: 0.7207207207207208.
[32m[I 2023-04-26 12:33:46,088][39m Trial 255 finished with value: 0.6739130434782609 and parameters: {'algorithm': 'auto', 'n_neighbors': 2, 'weights': 'uniform', 'metric': 'manhattan'}. Best is trial 21 with value: 0.7207207207207208.
[32m[I 2023-04-26 12:33:46,096][39m Trial 256 finished with value: 0.7027027027027026 and parameters: {'algorithm': 'ball_tree', 'n_neighbors': 22, 'weights': 'distance', 'metric': 'minkowski'}. Best is trial 21 with value: 0.7207207207207208.
[32m[I 2023-04-26 12:33:46,122][39m Trial 257 finished with value: 0.7207207207207208 and parameters: {'algorithm': 'brute', 'n_neighbors': 3, 'weights': 'distance', 'metric': 'manhattan'}. Best is trial 21 with value: 0.7207207207207208.
[32m[I 2023-04-26 12:33:46,139][39m Trial 258 finished with value: 0.7207207207207208 and parameters: {'algorithm': 'kd_tree', 'n_neighbors': 3, 'weights': 'distance', 'metric': 'manhattan'}. Best is trial 21 with value: 0.7207207207207208.
[32m[I 2023-04-26 12:33:46,155][39m Trial 259 finished with value: 0.7207207207207208 and parameters: {'algorithm': 'kd_tree', 'n_neighbors': 3, 'weights': 'distance', 'metric': 'manhattan'}. Best is trial 21 with value: 0.7207207207207208.
[32m[I 2023-04-26 12:33:46,172][39m Trial 260 finished with value: 0.709090909090909 and parameters: {'algorithm': 'auto', 'n_neighbors': 10, 'weights': 'distance', 'metric': 'minkowski'}. Best is trial 21 with value: 0.7207207207207208.
[32m[I 2023-04-26 12:33:46,189][39m Trial 261 finished with value: 0.709090909090909 and parameters: {'algorithm': 'auto', 'n_neighbors': 8, 'weights': 'distance', 'metric': 'minkowski'}. Best is trial 21 with value: 0.7207207207207208.
[32m[I 2023-04-26 12:33:46,204][39m Trial 262 finished with value: 0.7207207207207208 and parameters: {'algorithm': 'auto', 'n_neighbors': 9, 'weights': 'distance', 'metric': 'minkowski'}. Best is trial 21 with value: 0.7207207207207208.
[32m[I 2023-04-26 12:33:46,235][39m Trial 263 finished with value: 0.709090909090909 and parameters: {'algorithm': 'brute', 'n_neighbors': 10, 'weights': 'distance', 'metric': 'minkowski'}. Best is trial 21 with value: 0.7207207207207208.
[32m[I 2023-04-26 12:33:46,252][39m Trial 264 finished with value: 0.7079646017699116 and parameters: {'algorithm': 'kd_tree', 'n_neighbors': 4, 'weights': 'distance', 'metric': 'manhattan'}. Best is trial 21 with value: 0.7207207207207208.
[32m[I 2023-04-26 12:33:46,269][39m Trial 265 finished with value: 0.6902654867256638 and parameters: {'algorithm': 'ball_tree', 'n_neighbors': 13, 'weights': 'distance', 'metric': 'minkowski'}. Best is trial 21 with value: 0.7207207207207208.
[32m[I 2023-04-26 12:33:46,285][39m Trial 266 finished with value: 0.7207207207207208 and parameters: {'algorithm': 'auto', 'n_neighbors': 3, 'weights': 'distance', 'metric': 'manhattan'}. Best is trial 21 with value: 0.7207207207207208.
[32m[I 2023-04-26 12:33:46,301][39m Trial 267 finished with value: 0.7037037037037037 and parameters: {'algorithm': 'ball_tree', 'n_neighbors': 11, 'weights': 'distance', 'metric': 'minkowski'}. Best is trial 21 with value: 0.7207207207207208.
[32m[I 2023-04-26 12:33:46,317][39m Trial 268 finished with value: 0.7079646017699116 and parameters: {'algorithm': 'ball_tree', 'n_neighbors': 4, 'weights': 'distance', 'metric': 'manhattan'}. Best is trial 21 with value: 0.7207207207207208.
[32m[I 2023-04-26 12:33:46,334][39m Trial 269 finished with value: 0.7130434782608696 and parameters: {'algorithm': 'kd_tree', 'n_neighbors': 1, 'weights': 'distance', 'metric': 'manhattan'}. Best is trial 21 with value: 0.7207207207207208.
