[32m[I 2023-04-26 12:33:42,520][39m A new study created in memory with name: no-name-6d548ebd-beeb-4546-9c18-e39eb979475b
[32m[I 2023-04-26 12:33:42,547][39m Trial 0 finished with value: 0.6842105263157895 and parameters: {'algorithm': 'brute', 'n_neighbors': 15, 'weights': 'distance', 'metric': 'minkowski'}. Best is trial 0 with value: 0.6842105263157895.
[32m[I 2023-04-26 12:33:42,558][39m Trial 1 finished with value: 0.6371681415929203 and parameters: {'algorithm': 'kd_tree', 'n_neighbors': 15, 'weights': 'uniform', 'metric': 'euclidean'}. Best is trial 0 with value: 0.6842105263157895.
[32m[I 2023-04-26 12:33:42,569][39m Trial 2 finished with value: 0.6181818181818182 and parameters: {'algorithm': 'kd_tree', 'n_neighbors': 30, 'weights': 'uniform', 'metric': 'manhattan'}. Best is trial 0 with value: 0.6842105263157895.
[32m[I 2023-04-26 12:33:42,576][39m Trial 3 finished with value: 0.709090909090909 and parameters: {'algorithm': 'kd_tree', 'n_neighbors': 10, 'weights': 'distance', 'metric': 'manhattan'}. Best is trial 3 with value: 0.709090909090909.
[32m[I 2023-04-26 12:33:42,587][39m Trial 4 finished with value: 0.6181818181818182 and parameters: {'algorithm': 'kd_tree', 'n_neighbors': 11, 'weights': 'uniform', 'metric': 'minkowski'}. Best is trial 3 with value: 0.709090909090909.
[32m[I 2023-04-26 12:33:42,593][39m Trial 5 finished with value: 0.7027027027027026 and parameters: {'algorithm': 'auto', 'n_neighbors': 14, 'weights': 'distance', 'metric': 'minkowski'}. Best is trial 3 with value: 0.709090909090909.
[32m[I 2023-04-26 12:33:42,600][39m Trial 6 finished with value: 0.6972477064220184 and parameters: {'algorithm': 'auto', 'n_neighbors': 11, 'weights': 'distance', 'metric': 'manhattan'}. Best is trial 3 with value: 0.709090909090909.
[32m[I 2023-04-26 12:33:42,625][39m Trial 7 finished with value: 0.6964285714285714 and parameters: {'algorithm': 'brute', 'n_neighbors': 13, 'weights': 'distance', 'metric': 'manhattan'}. Best is trial 3 with value: 0.709090909090909.
[32m[I 2023-04-26 12:33:42,632][39m Trial 8 finished with value: 0.6846846846846846 and parameters: {'algorithm': 'auto', 'n_neighbors': 28, 'weights': 'distance', 'metric': 'euclidean'}. Best is trial 3 with value: 0.709090909090909.
[32m[I 2023-04-26 12:33:42,643][39m Trial 9 finished with value: 0.574074074074074 and parameters: {'algorithm': 'ball_tree', 'n_neighbors': 25, 'weights': 'uniform', 'metric': 'euclidean'}. Best is trial 3 with value: 0.709090909090909.
[32m[I 2023-04-26 12:33:42,653][39m Trial 10 finished with value: 0.7130434782608696 and parameters: {'algorithm': 'ball_tree', 'n_neighbors': 2, 'weights': 'distance', 'metric': 'manhattan'}. Best is trial 10 with value: 0.7130434782608696.
[32m[I 2023-04-26 12:33:42,666][39m Trial 11 finished with value: 0.7130434782608696 and parameters: {'algorithm': 'ball_tree', 'n_neighbors': 1, 'weights': 'distance', 'metric': 'manhattan'}. Best is trial 10 with value: 0.7130434782608696.
[32m[I 2023-04-26 12:33:42,676][39m Trial 12 finished with value: 0.7130434782608696 and parameters: {'algorithm': 'ball_tree', 'n_neighbors': 1, 'weights': 'distance', 'metric': 'manhattan'}. Best is trial 10 with value: 0.7130434782608696.
[32m[I 2023-04-26 12:33:42,687][39m Trial 13 finished with value: 0.7130434782608696 and parameters: {'algorithm': 'ball_tree', 'n_neighbors': 2, 'weights': 'distance', 'metric': 'manhattan'}. Best is trial 10 with value: 0.7130434782608696.
[32m[I 2023-04-26 12:33:42,698][39m Trial 14 finished with value: 0.6972477064220184 and parameters: {'algorithm': 'ball_tree', 'n_neighbors': 5, 'weights': 'distance', 'metric': 'manhattan'}. Best is trial 10 with value: 0.7130434782608696.
[32m[I 2023-04-26 12:33:42,708][39m Trial 15 finished with value: 0.7079646017699116 and parameters: {'algorithm': 'ball_tree', 'n_neighbors': 6, 'weights': 'distance', 'metric': 'manhattan'}. Best is trial 10 with value: 0.7130434782608696.
[32m[I 2023-04-26 12:33:42,719][39m Trial 16 finished with value: 0.709090909090909 and parameters: {'algorithm': 'ball_tree', 'n_neighbors': 20, 'weights': 'distance', 'metric': 'manhattan'}. Best is trial 10 with value: 0.7130434782608696.
[32m[I 2023-04-26 12:33:42,730][39m Trial 17 finished with value: 0.6972477064220184 and parameters: {'algorithm': 'ball_tree', 'n_neighbors': 5, 'weights': 'distance', 'metric': 'manhattan'}. Best is trial 10 with value: 0.7130434782608696.
[32m[I 2023-04-26 12:33:42,738][39m Trial 18 finished with value: 0.6140350877192983 and parameters: {'algorithm': 'ball_tree', 'n_neighbors': 21, 'weights': 'uniform', 'metric': 'euclidean'}. Best is trial 10 with value: 0.7130434782608696.
[32m[I 2023-04-26 12:33:42,759][39m Trial 19 finished with value: 0.709090909090909 and parameters: {'algorithm': 'brute', 'n_neighbors': 7, 'weights': 'distance', 'metric': 'minkowski'}. Best is trial 10 with value: 0.7130434782608696.
[32m[I 2023-04-26 12:33:42,770][39m Trial 20 finished with value: 0.7130434782608696 and parameters: {'algorithm': 'ball_tree', 'n_neighbors': 1, 'weights': 'distance', 'metric': 'manhattan'}. Best is trial 10 with value: 0.7130434782608696.
[32m[I 2023-04-26 12:33:42,781][39m Trial 21 finished with value: 0.7207207207207208 and parameters: {'algorithm': 'ball_tree', 'n_neighbors': 3, 'weights': 'distance', 'metric': 'manhattan'}. Best is trial 21 with value: 0.7207207207207208.
[32m[I 2023-04-26 12:33:42,792][39m Trial 22 finished with value: 0.7207207207207208 and parameters: {'algorithm': 'ball_tree', 'n_neighbors': 3, 'weights': 'distance', 'metric': 'manhattan'}. Best is trial 21 with value: 0.7207207207207208.
[32m[I 2023-04-26 12:33:42,802][39m Trial 23 finished with value: 0.709090909090909 and parameters: {'algorithm': 'ball_tree', 'n_neighbors': 8, 'weights': 'distance', 'metric': 'manhattan'}. Best is trial 21 with value: 0.7207207207207208.
[32m[I 2023-04-26 12:33:42,813][39m Trial 24 finished with value: 0.7079646017699116 and parameters: {'algorithm': 'ball_tree', 'n_neighbors': 4, 'weights': 'distance', 'metric': 'manhattan'}. Best is trial 21 with value: 0.7207207207207208.
[32m[I 2023-04-26 12:33:42,824][39m Trial 25 finished with value: 0.709090909090909 and parameters: {'algorithm': 'ball_tree', 'n_neighbors': 8, 'weights': 'distance', 'metric': 'manhattan'}. Best is trial 21 with value: 0.7207207207207208.
[32m[I 2023-04-26 12:33:42,839][39m Trial 26 finished with value: 0.6728971962616822 and parameters: {'algorithm': 'ball_tree', 'n_neighbors': 3, 'weights': 'uniform', 'metric': 'manhattan'}. Best is trial 21 with value: 0.7207207207207208.
[32m[I 2023-04-26 12:33:42,850][39m Trial 27 finished with value: 0.7207207207207208 and parameters: {'algorithm': 'auto', 'n_neighbors': 3, 'weights': 'distance', 'metric': 'manhattan'}. Best is trial 21 with value: 0.7207207207207208.
[32m[I 2023-04-26 12:33:42,857][39m Trial 28 finished with value: 0.6964285714285714 and parameters: {'algorithm': 'auto', 'n_neighbors': 18, 'weights': 'distance', 'metric': 'euclidean'}. Best is trial 21 with value: 0.7207207207207208.
[32m[I 2023-04-26 12:33:42,865][39m Trial 29 finished with value: 0.7207207207207208 and parameters: {'algorithm': 'auto', 'n_neighbors': 9, 'weights': 'distance', 'metric': 'minkowski'}. Best is trial 21 with value: 0.7207207207207208.
[32m[I 2023-04-26 12:33:42,887][39m Trial 30 finished with value: 0.7207207207207208 and parameters: {'algorithm': 'brute', 'n_neighbors': 9, 'weights': 'distance', 'metric': 'minkowski'}. Best is trial 21 with value: 0.7207207207207208.
[32m[I 2023-04-26 12:33:42,913][39m Trial 31 finished with value: 0.6902654867256638 and parameters: {'algorithm': 'brute', 'n_neighbors': 4, 'weights': 'distance', 'metric': 'minkowski'}. Best is trial 21 with value: 0.7207207207207208.
[32m[I 2023-04-26 12:33:42,925][39m Trial 32 finished with value: 0.7207207207207208 and parameters: {'algorithm': 'auto', 'n_neighbors': 9, 'weights': 'distance', 'metric': 'minkowski'}. Best is trial 21 with value: 0.7207207207207208.
[32m[I 2023-04-26 12:33:42,937][39m Trial 33 finished with value: 0.709090909090909 and parameters: {'algorithm': 'auto', 'n_neighbors': 10, 'weights': 'distance', 'metric': 'minkowski'}. Best is trial 21 with value: 0.7207207207207208.
[32m[I 2023-04-26 12:33:42,959][39m Trial 34 finished with value: 0.6725663716814159 and parameters: {'algorithm': 'brute', 'n_neighbors': 13, 'weights': 'uniform', 'metric': 'minkowski'}. Best is trial 21 with value: 0.7207207207207208.
[32m[I 2023-04-26 12:33:42,966][39m Trial 35 finished with value: 0.7027027027027026 and parameters: {'algorithm': 'auto', 'n_neighbors': 6, 'weights': 'distance', 'metric': 'minkowski'}. Best is trial 21 with value: 0.7207207207207208.
[32m[I 2023-04-26 12:33:42,988][39m Trial 36 finished with value: 0.5825242718446603 and parameters: {'algorithm': 'brute', 'n_neighbors': 16, 'weights': 'uniform', 'metric': 'minkowski'}. Best is trial 21 with value: 0.7207207207207208.
[32m[I 2023-04-26 12:33:42,996][39m Trial 37 finished with value: 0.7037037037037037 and parameters: {'algorithm': 'kd_tree', 'n_neighbors': 11, 'weights': 'distance', 'metric': 'minkowski'}. Best is trial 21 with value: 0.7207207207207208.
[32m[I 2023-04-26 12:33:43,017][39m Trial 38 finished with value: 0.7207207207207208 and parameters: {'algorithm': 'brute', 'n_neighbors': 3, 'weights': 'distance', 'metric': 'manhattan'}. Best is trial 21 with value: 0.7207207207207208.
[32m[I 2023-04-26 12:33:43,045][39m Trial 39 finished with value: 0.7207207207207208 and parameters: {'algorithm': 'brute', 'n_neighbors': 9, 'weights': 'distance', 'metric': 'minkowski'}. Best is trial 21 with value: 0.7207207207207208.
[32m[I 2023-04-26 12:33:43,068][39m Trial 40 finished with value: 0.6554621848739496 and parameters: {'algorithm': 'brute', 'n_neighbors': 9, 'weights': 'uniform', 'metric': 'minkowski'}. Best is trial 21 with value: 0.7207207207207208.
[32m[I 2023-04-26 12:33:43,090][39m Trial 41 finished with value: 0.7079646017699116 and parameters: {'algorithm': 'brute', 'n_neighbors': 4, 'weights': 'distance', 'metric': 'manhattan'}. Best is trial 21 with value: 0.7207207207207208.
[32m[I 2023-04-26 12:33:43,118][39m Trial 42 finished with value: 0.709090909090909 and parameters: {'algorithm': 'brute', 'n_neighbors': 12, 'weights': 'distance', 'metric': 'minkowski'}. Best is trial 21 with value: 0.7207207207207208.
[32m[I 2023-04-26 12:33:43,131][39m Trial 43 finished with value: 0.709090909090909 and parameters: {'algorithm': 'kd_tree', 'n_neighbors': 7, 'weights': 'distance', 'metric': 'euclidean'}. Best is trial 21 with value: 0.7207207207207208.
[32m[I 2023-04-26 12:33:43,158][39m Trial 44 finished with value: 0.6842105263157895 and parameters: {'algorithm': 'brute', 'n_neighbors': 15, 'weights': 'distance', 'metric': 'minkowski'}. Best is trial 21 with value: 0.7207207207207208.
[32m[I 2023-04-26 12:33:43,170][39m Trial 45 finished with value: 0.7207207207207208 and parameters: {'algorithm': 'kd_tree', 'n_neighbors': 3, 'weights': 'distance', 'metric': 'manhattan'}. Best is trial 21 with value: 0.7207207207207208.
[32m[I 2023-04-26 12:33:43,197][39m Trial 46 finished with value: 0.709090909090909 and parameters: {'algorithm': 'brute', 'n_neighbors': 12, 'weights': 'distance', 'metric': 'minkowski'}. Best is trial 21 with value: 0.7207207207207208.
[32m[I 2023-04-26 12:33:43,209][39m Trial 47 finished with value: 0.7130434782608696 and parameters: {'algorithm': 'kd_tree', 'n_neighbors': 2, 'weights': 'distance', 'metric': 'manhattan'}. Best is trial 21 with value: 0.7207207207207208.
[32m[I 2023-04-26 12:33:43,221][39m Trial 48 finished with value: 0.7027027027027026 and parameters: {'algorithm': 'auto', 'n_neighbors': 6, 'weights': 'distance', 'metric': 'euclidean'}. Best is trial 21 with value: 0.7207207207207208.
[32m[I 2023-04-26 12:33:43,233][39m Trial 49 finished with value: 0.7207207207207208 and parameters: {'algorithm': 'kd_tree', 'n_neighbors': 9, 'weights': 'distance', 'metric': 'minkowski'}. Best is trial 21 with value: 0.7207207207207208.
[32m[I 2023-04-26 12:33:43,245][39m Trial 50 finished with value: 0.7130434782608696 and parameters: {'algorithm': 'kd_tree', 'n_neighbors': 1, 'weights': 'distance', 'metric': 'manhattan'}. Best is trial 21 with value: 0.7207207207207208.
[32m[I 2023-04-26 12:33:43,257][39m Trial 51 finished with value: 0.6972477064220184 and parameters: {'algorithm': 'kd_tree', 'n_neighbors': 5, 'weights': 'distance', 'metric': 'manhattan'}. Best is trial 21 with value: 0.7207207207207208.
[32m[I 2023-04-26 12:33:43,269][39m Trial 52 finished with value: 0.7207207207207208 and parameters: {'algorithm': 'auto', 'n_neighbors': 3, 'weights': 'distance', 'metric': 'manhattan'}. Best is trial 21 with value: 0.7207207207207208.
[32m[I 2023-04-26 12:33:43,295][39m Trial 53 finished with value: 0.709090909090909 and parameters: {'algorithm': 'brute', 'n_neighbors': 7, 'weights': 'distance', 'metric': 'minkowski'}. Best is trial 21 with value: 0.7207207207207208.
[32m[I 2023-04-26 12:33:43,307][39m Trial 54 finished with value: 0.709090909090909 and parameters: {'algorithm': 'auto', 'n_neighbors': 10, 'weights': 'distance', 'metric': 'minkowski'}. Best is trial 21 with value: 0.7207207207207208.
[32m[I 2023-04-26 12:33:43,318][39m Trial 55 finished with value: 0.7207207207207208 and parameters: {'algorithm': 'auto', 'n_neighbors': 3, 'weights': 'distance', 'metric': 'manhattan'}. Best is trial 21 with value: 0.7207207207207208.
[32m[I 2023-04-26 12:33:43,330][39m Trial 56 finished with value: 0.6972477064220184 and parameters: {'algorithm': 'kd_tree', 'n_neighbors': 5, 'weights': 'distance', 'metric': 'manhattan'}. Best is trial 21 with value: 0.7207207207207208.
[32m[I 2023-04-26 12:33:43,346][39m Trial 57 finished with value: 0.6739130434782609 and parameters: {'algorithm': 'auto', 'n_neighbors': 2, 'weights': 'uniform', 'metric': 'manhattan'}. Best is trial 21 with value: 0.7207207207207208.
[32m[I 2023-04-26 12:33:43,371][39m Trial 58 finished with value: 0.7027027027027026 and parameters: {'algorithm': 'brute', 'n_neighbors': 14, 'weights': 'distance', 'metric': 'minkowski'}. Best is trial 21 with value: 0.7207207207207208.
[32m[I 2023-04-26 12:33:43,384][39m Trial 59 finished with value: 0.7207207207207208 and parameters: {'algorithm': 'auto', 'n_neighbors': 9, 'weights': 'distance', 'metric': 'minkowski'}. Best is trial 21 with value: 0.7207207207207208.
[32m[I 2023-04-26 12:33:43,395][39m Trial 60 finished with value: 0.709090909090909 and parameters: {'algorithm': 'kd_tree', 'n_neighbors': 8, 'weights': 'distance', 'metric': 'euclidean'}. Best is trial 21 with value: 0.7207207207207208.
[32m[I 2023-04-26 12:33:43,421][39m Trial 61 finished with value: 0.6846846846846846 and parameters: {'algorithm': 'brute', 'n_neighbors': 26, 'weights': 'distance', 'metric': 'minkowski'}. Best is trial 21 with value: 0.7207207207207208.
[32m[I 2023-04-26 12:33:43,434][39m Trial 62 finished with value: 0.7207207207207208 and parameters: {'algorithm': 'kd_tree', 'n_neighbors': 9, 'weights': 'distance', 'metric': 'minkowski'}. Best is trial 21 with value: 0.7207207207207208.
[32m[I 2023-04-26 12:33:43,446][39m Trial 63 finished with value: 0.709090909090909 and parameters: {'algorithm': 'kd_tree', 'n_neighbors': 12, 'weights': 'distance', 'metric': 'minkowski'}. Best is trial 21 with value: 0.7207207207207208.
[32m[I 2023-04-26 12:33:43,458][39m Trial 64 finished with value: 0.6725663716814159 and parameters: {'algorithm': 'auto', 'n_neighbors': 17, 'weights': 'distance', 'metric': 'minkowski'}. Best is trial 21 with value: 0.7207207207207208.
[32m[I 2023-04-26 12:33:43,470][39m Trial 65 finished with value: 0.7079646017699116 and parameters: {'algorithm': 'ball_tree', 'n_neighbors': 4, 'weights': 'distance', 'metric': 'manhattan'}. Best is trial 21 with value: 0.7207207207207208.
[32m[I 2023-04-26 12:33:43,483][39m Trial 66 finished with value: 0.7027027027027026 and parameters: {'algorithm': 'auto', 'n_neighbors': 6, 'weights': 'distance', 'metric': 'minkowski'}. Best is trial 21 with value: 0.7207207207207208.
[32m[I 2023-04-26 12:33:43,495][39m Trial 67 finished with value: 0.7037037037037037 and parameters: {'algorithm': 'auto', 'n_neighbors': 11, 'weights': 'distance', 'metric': 'minkowski'}. Best is trial 21 with value: 0.7207207207207208.
[32m[I 2023-04-26 12:33:43,510][39m Trial 68 finished with value: 0.6491228070175439 and parameters: {'algorithm': 'auto', 'n_neighbors': 7, 'weights': 'uniform', 'metric': 'minkowski'}. Best is trial 21 with value: 0.7207207207207208.
[32m[I 2023-04-26 12:33:43,522][39m Trial 69 finished with value: 0.7130434782608696 and parameters: {'algorithm': 'kd_tree', 'n_neighbors': 2, 'weights': 'distance', 'metric': 'manhattan'}. Best is trial 21 with value: 0.7207207207207208.
[32m[I 2023-04-26 12:33:43,531][39m Trial 70 finished with value: 0.709090909090909 and parameters: {'algorithm': 'auto', 'n_neighbors': 21, 'weights': 'distance', 'metric': 'manhattan'}. Best is trial 21 with value: 0.7207207207207208.
[32m[I 2023-04-26 12:33:43,553][39m Trial 71 finished with value: 0.709090909090909 and parameters: {'algorithm': 'brute', 'n_neighbors': 10, 'weights': 'distance', 'metric': 'minkowski'}. Best is trial 21 with value: 0.7207207207207208.
[32m[I 2023-04-26 12:33:43,580][39m Trial 72 finished with value: 0.709090909090909 and parameters: {'algorithm': 'brute', 'n_neighbors': 8, 'weights': 'distance', 'metric': 'minkowski'}. Best is trial 21 with value: 0.7207207207207208.
[32m[I 2023-04-26 12:33:43,593][39m Trial 73 finished with value: 0.7079646017699116 and parameters: {'algorithm': 'ball_tree', 'n_neighbors': 4, 'weights': 'distance', 'metric': 'manhattan'}. Best is trial 21 with value: 0.7207207207207208.
[32m[I 2023-04-26 12:33:43,606][39m Trial 74 finished with value: 0.7207207207207208 and parameters: {'algorithm': 'kd_tree', 'n_neighbors': 3, 'weights': 'distance', 'metric': 'manhattan'}. Best is trial 21 with value: 0.7207207207207208.
[32m[I 2023-04-26 12:33:43,633][39m Trial 75 finished with value: 0.7027027027027026 and parameters: {'algorithm': 'brute', 'n_neighbors': 5, 'weights': 'distance', 'metric': 'minkowski'}. Best is trial 21 with value: 0.7207207207207208.
[32m[I 2023-04-26 12:33:43,646][39m Trial 76 finished with value: 0.7130434782608696 and parameters: {'algorithm': 'auto', 'n_neighbors': 1, 'weights': 'distance', 'metric': 'manhattan'}. Best is trial 21 with value: 0.7207207207207208.
[32m[I 2023-04-26 12:33:43,658][39m Trial 77 finished with value: 0.7207207207207208 and parameters: {'algorithm': 'auto', 'n_neighbors': 3, 'weights': 'distance', 'metric': 'manhattan'}. Best is trial 21 with value: 0.7207207207207208.
[32m[I 2023-04-26 12:33:43,671][39m Trial 78 finished with value: 0.7207207207207208 and parameters: {'algorithm': 'kd_tree', 'n_neighbors': 3, 'weights': 'distance', 'metric': 'manhattan'}. Best is trial 21 with value: 0.7207207207207208.
[32m[I 2023-04-26 12:33:43,683][39m Trial 79 finished with value: 0.7079646017699116 and parameters: {'algorithm': 'kd_tree', 'n_neighbors': 6, 'weights': 'distance', 'metric': 'manhattan'}. Best is trial 21 with value: 0.7207207207207208.
[32m[I 2023-04-26 12:33:43,698][39m Trial 80 finished with value: 0.5686274509803921 and parameters: {'algorithm': 'kd_tree', 'n_neighbors': 14, 'weights': 'uniform', 'metric': 'euclidean'}. Best is trial 21 with value: 0.7207207207207208.
[32m[I 2023-04-26 12:33:43,711][39m Trial 81 finished with value: 0.7079646017699116 and parameters: {'algorithm': 'auto', 'n_neighbors': 4, 'weights': 'distance', 'metric': 'manhattan'}. Best is trial 21 with value: 0.7207207207207208.
[32m[I 2023-04-26 12:33:43,723][39m Trial 82 finished with value: 0.7207207207207208 and parameters: {'algorithm': 'ball_tree', 'n_neighbors': 3, 'weights': 'distance', 'metric': 'manhattan'}. Best is trial 21 with value: 0.7207207207207208.
[32m[I 2023-04-26 12:33:43,731][39m Trial 83 finished with value: 0.709090909090909 and parameters: {'algorithm': 'auto', 'n_neighbors': 10, 'weights': 'distance', 'metric': 'minkowski'}. Best is trial 21 with value: 0.7207207207207208.
[32m[I 2023-04-26 12:33:43,738][39m Trial 84 finished with value: 0.7130434782608696 and parameters: {'algorithm': 'auto', 'n_neighbors': 1, 'weights': 'distance', 'metric': 'manhattan'}. Best is trial 21 with value: 0.7207207207207208.
[32m[I 2023-04-26 12:33:43,744][39m Trial 85 finished with value: 0.7130434782608696 and parameters: {'algorithm': 'auto', 'n_neighbors': 2, 'weights': 'distance', 'metric': 'manhattan'}. Best is trial 21 with value: 0.7207207207207208.
[32m[I 2023-04-26 12:33:43,750][39m Trial 86 finished with value: 0.6972477064220184 and parameters: {'algorithm': 'auto', 'n_neighbors': 5, 'weights': 'distance', 'metric': 'manhattan'}. Best is trial 21 with value: 0.7207207207207208.
[32m[I 2023-04-26 12:33:43,758][39m Trial 87 finished with value: 0.6972477064220184 and parameters: {'algorithm': 'ball_tree', 'n_neighbors': 7, 'weights': 'distance', 'metric': 'manhattan'}. Best is trial 21 with value: 0.7207207207207208.
[32m[I 2023-04-26 12:33:43,764][39m Trial 88 finished with value: 0.7207207207207208 and parameters: {'algorithm': 'ball_tree', 'n_neighbors': 3, 'weights': 'distance', 'metric': 'manhattan'}. Best is trial 21 with value: 0.7207207207207208.
[32m[I 2023-04-26 12:33:43,788][39m Trial 89 finished with value: 0.6846846846846846 and parameters: {'algorithm': 'brute', 'n_neighbors': 30, 'weights': 'distance', 'metric': 'euclidean'}. Best is trial 21 with value: 0.7207207207207208.
