[32m[I 2023-04-26 12:33:43,817][39m Trial 90 finished with value: 0.7207207207207208 and parameters: {'algorithm': 'brute', 'n_neighbors': 9, 'weights': 'distance', 'metric': 'minkowski'}. Best is trial 21 with value: 0.7207207207207208.
[32m[I 2023-04-26 12:33:43,843][39m Trial 91 finished with value: 0.709090909090909 and parameters: {'algorithm': 'brute', 'n_neighbors': 8, 'weights': 'distance', 'metric': 'minkowski'}. Best is trial 21 with value: 0.7207207207207208.
[32m[I 2023-04-26 12:33:43,856][39m Trial 92 finished with value: 0.7037037037037037 and parameters: {'algorithm': 'auto', 'n_neighbors': 11, 'weights': 'distance', 'metric': 'minkowski'}. Best is trial 21 with value: 0.7207207207207208.
[32m[I 2023-04-26 12:33:43,869][39m Trial 93 finished with value: 0.6902654867256638 and parameters: {'algorithm': 'auto', 'n_neighbors': 13, 'weights': 'distance', 'metric': 'minkowski'}. Best is trial 21 with value: 0.7207207207207208.
[32m[I 2023-04-26 12:33:43,882][39m Trial 94 finished with value: 0.709090909090909 and parameters: {'algorithm': 'auto', 'n_neighbors': 8, 'weights': 'distance', 'metric': 'minkowski'}. Best is trial 21 with value: 0.7207207207207208.
[32m[I 2023-04-26 12:33:43,894][39m Trial 95 finished with value: 0.7017543859649122 and parameters: {'algorithm': 'auto', 'n_neighbors': 2, 'weights': 'distance', 'metric': 'minkowski'}. Best is trial 21 with value: 0.7207207207207208.
[32m[I 2023-04-26 12:33:43,911][39m Trial 96 finished with value: 0.6728971962616822 and parameters: {'algorithm': 'ball_tree', 'n_neighbors': 3, 'weights': 'uniform', 'metric': 'manhattan'}. Best is trial 21 with value: 0.7207207207207208.
[32m[I 2023-04-26 12:33:43,923][39m Trial 97 finished with value: 0.7079646017699116 and parameters: {'algorithm': 'ball_tree', 'n_neighbors': 4, 'weights': 'distance', 'metric': 'manhattan'}. Best is trial 21 with value: 0.7207207207207208.
[32m[I 2023-04-26 12:33:43,936][39m Trial 98 finished with value: 0.7079646017699116 and parameters: {'algorithm': 'kd_tree', 'n_neighbors': 6, 'weights': 'distance', 'metric': 'manhattan'}. Best is trial 21 with value: 0.7207207207207208.
[32m[I 2023-04-26 12:33:43,947][39m Trial 99 finished with value: 0.7207207207207208 and parameters: {'algorithm': 'kd_tree', 'n_neighbors': 9, 'weights': 'distance', 'metric': 'minkowski'}. Best is trial 21 with value: 0.7207207207207208.
[32m[I 2023-04-26 12:33:43,968][39m Trial 100 finished with value: 0.709090909090909 and parameters: {'algorithm': 'brute', 'n_neighbors': 12, 'weights': 'distance', 'metric': 'minkowski'}. Best is trial 21 with value: 0.7207207207207208.
[32m[I 2023-04-26 12:33:43,981][39m Trial 101 finished with value: 0.7207207207207208 and parameters: {'algorithm': 'auto', 'n_neighbors': 9, 'weights': 'distance', 'metric': 'minkowski'}. Best is trial 21 with value: 0.7207207207207208.
[32m[I 2023-04-26 12:33:44,007][39m Trial 102 finished with value: 0.7130434782608696 and parameters: {'algorithm': 'brute', 'n_neighbors': 2, 'weights': 'distance', 'metric': 'manhattan'}. Best is trial 21 with value: 0.7207207207207208.
[32m[I 2023-04-26 12:33:44,019][39m Trial 103 finished with value: 0.6972477064220184 and parameters: {'algorithm': 'ball_tree', 'n_neighbors': 5, 'weights': 'distance', 'metric': 'manhattan'}. Best is trial 21 with value: 0.7207207207207208.
[32m[I 2023-04-26 12:33:44,032][39m Trial 104 finished with value: 0.7130434782608696 and parameters: {'algorithm': 'kd_tree', 'n_neighbors': 1, 'weights': 'distance', 'metric': 'manhattan'}. Best is trial 21 with value: 0.7207207207207208.
[32m[I 2023-04-26 12:33:44,056][39m Trial 105 finished with value: 0.7079646017699116 and parameters: {'algorithm': 'brute', 'n_neighbors': 6, 'weights': 'distance', 'metric': 'manhattan'}. Best is trial 21 with value: 0.7207207207207208.
[32m[I 2023-04-26 12:33:44,070][39m Trial 106 finished with value: 0.7207207207207208 and parameters: {'algorithm': 'auto', 'n_neighbors': 3, 'weights': 'distance', 'metric': 'manhattan'}. Best is trial 21 with value: 0.7207207207207208.
[32m[I 2023-04-26 12:33:44,083][39m Trial 107 finished with value: 0.7207207207207208 and parameters: {'algorithm': 'auto', 'n_neighbors': 3, 'weights': 'distance', 'metric': 'manhattan'}. Best is trial 21 with value: 0.7207207207207208.
[32m[I 2023-04-26 12:33:44,096][39m Trial 108 finished with value: 0.7079646017699116 and parameters: {'algorithm': 'ball_tree', 'n_neighbors': 4, 'weights': 'distance', 'metric': 'manhattan'}. Best is trial 21 with value: 0.7207207207207208.
[32m[I 2023-04-26 12:33:44,112][39m Trial 109 finished with value: 0.6548672566371682 and parameters: {'algorithm': 'ball_tree', 'n_neighbors': 19, 'weights': 'uniform', 'metric': 'manhattan'}. Best is trial 21 with value: 0.7207207207207208.
[32m[I 2023-04-26 12:33:44,126][39m Trial 110 finished with value: 0.709090909090909 and parameters: {'algorithm': 'kd_tree', 'n_neighbors': 10, 'weights': 'distance', 'metric': 'minkowski'}. Best is trial 21 with value: 0.7207207207207208.
[32m[I 2023-04-26 12:33:44,140][39m Trial 111 finished with value: 0.7130434782608696 and parameters: {'algorithm': 'kd_tree', 'n_neighbors': 2, 'weights': 'distance', 'metric': 'manhattan'}. Best is trial 21 with value: 0.7207207207207208.
[32m[I 2023-04-26 12:33:44,154][39m Trial 112 finished with value: 0.6972477064220184 and parameters: {'algorithm': 'auto', 'n_neighbors': 5, 'weights': 'distance', 'metric': 'manhattan'}. Best is trial 21 with value: 0.7207207207207208.
[32m[I 2023-04-26 12:33:44,166][39m Trial 113 finished with value: 0.7207207207207208 and parameters: {'algorithm': 'kd_tree', 'n_neighbors': 9, 'weights': 'distance', 'metric': 'minkowski'}. Best is trial 21 with value: 0.7207207207207208.
[32m[I 2023-04-26 12:33:44,173][39m Trial 114 finished with value: 0.7207207207207208 and parameters: {'algorithm': 'ball_tree', 'n_neighbors': 9, 'weights': 'distance', 'metric': 'minkowski'}. Best is trial 21 with value: 0.7207207207207208.
[32m[I 2023-04-26 12:33:44,180][39m Trial 115 finished with value: 0.6972477064220184 and parameters: {'algorithm': 'kd_tree', 'n_neighbors': 7, 'weights': 'distance', 'metric': 'manhattan'}. Best is trial 21 with value: 0.7207207207207208.
[32m[I 2023-04-26 12:33:44,187][39m Trial 116 finished with value: 0.7207207207207208 and parameters: {'algorithm': 'kd_tree', 'n_neighbors': 3, 'weights': 'distance', 'metric': 'manhattan'}. Best is trial 21 with value: 0.7207207207207208.
[32m[I 2023-04-26 12:33:44,195][39m Trial 117 finished with value: 0.7017543859649122 and parameters: {'algorithm': 'kd_tree', 'n_neighbors': 1, 'weights': 'distance', 'metric': 'euclidean'}. Best is trial 21 with value: 0.7207207207207208.
[32m[I 2023-04-26 12:33:44,202][39m Trial 118 finished with value: 0.709090909090909 and parameters: {'algorithm': 'kd_tree', 'n_neighbors': 10, 'weights': 'distance', 'metric': 'minkowski'}. Best is trial 21 with value: 0.7207207207207208.
[32m[I 2023-04-26 12:33:44,210][39m Trial 119 finished with value: 0.7027027027027026 and parameters: {'algorithm': 'ball_tree', 'n_neighbors': 24, 'weights': 'distance', 'metric': 'manhattan'}. Best is trial 21 with value: 0.7207207207207208.
[32m[I 2023-04-26 12:33:44,217][39m Trial 120 finished with value: 0.7207207207207208 and parameters: {'algorithm': 'auto', 'n_neighbors': 9, 'weights': 'distance', 'metric': 'minkowski'}. Best is trial 21 with value: 0.7207207207207208.
[32m[I 2023-04-26 12:33:44,241][39m Trial 121 finished with value: 0.7017543859649122 and parameters: {'algorithm': 'brute', 'n_neighbors': 3, 'weights': 'distance', 'metric': 'minkowski'}. Best is trial 21 with value: 0.7207207207207208.
[32m[I 2023-04-26 12:33:44,255][39m Trial 122 finished with value: 0.7079646017699116 and parameters: {'algorithm': 'auto', 'n_neighbors': 4, 'weights': 'distance', 'metric': 'manhattan'}. Best is trial 21 with value: 0.7207207207207208.
[32m[I 2023-04-26 12:33:44,268][39m Trial 123 finished with value: 0.7130434782608696 and parameters: {'algorithm': 'ball_tree', 'n_neighbors': 2, 'weights': 'distance', 'metric': 'manhattan'}. Best is trial 21 with value: 0.7207207207207208.
[32m[I 2023-04-26 12:33:44,295][39m Trial 124 finished with value: 0.6972477064220184 and parameters: {'algorithm': 'brute', 'n_neighbors': 5, 'weights': 'distance', 'metric': 'manhattan'}. Best is trial 21 with value: 0.7207207207207208.
[32m[I 2023-04-26 12:33:44,308][39m Trial 125 finished with value: 0.709090909090909 and parameters: {'algorithm': 'auto', 'n_neighbors': 8, 'weights': 'distance', 'metric': 'minkowski'}. Best is trial 21 with value: 0.7207207207207208.
[32m[I 2023-04-26 12:33:44,334][39m Trial 126 finished with value: 0.7037037037037037 and parameters: {'algorithm': 'brute', 'n_neighbors': 11, 'weights': 'distance', 'metric': 'minkowski'}. Best is trial 21 with value: 0.7207207207207208.
[32m[I 2023-04-26 12:33:44,347][39m Trial 127 finished with value: 0.709090909090909 and parameters: {'algorithm': 'auto', 'n_neighbors': 7, 'weights': 'distance', 'metric': 'minkowski'}. Best is trial 21 with value: 0.7207207207207208.
[32m[I 2023-04-26 12:33:44,374][39m Trial 128 finished with value: 0.709090909090909 and parameters: {'algorithm': 'brute', 'n_neighbors': 10, 'weights': 'distance', 'metric': 'minkowski'}. Best is trial 21 with value: 0.7207207207207208.
[32m[I 2023-04-26 12:33:44,391][39m Trial 129 finished with value: 0.6326530612244898 and parameters: {'algorithm': 'auto', 'n_neighbors': 4, 'weights': 'uniform', 'metric': 'euclidean'}. Best is trial 21 with value: 0.7207207207207208.
[32m[I 2023-04-26 12:33:44,417][39m Trial 130 finished with value: 0.7207207207207208 and parameters: {'algorithm': 'brute', 'n_neighbors': 9, 'weights': 'distance', 'metric': 'minkowski'}. Best is trial 21 with value: 0.7207207207207208.
[32m[I 2023-04-26 12:33:44,431][39m Trial 131 finished with value: 0.7207207207207208 and parameters: {'algorithm': 'kd_tree', 'n_neighbors': 9, 'weights': 'distance', 'metric': 'minkowski'}. Best is trial 21 with value: 0.7207207207207208.
[32m[I 2023-04-26 12:33:44,445][39m Trial 132 finished with value: 0.7207207207207208 and parameters: {'algorithm': 'auto', 'n_neighbors': 9, 'weights': 'distance', 'metric': 'minkowski'}. Best is trial 21 with value: 0.7207207207207208.
[32m[I 2023-04-26 12:33:44,458][39m Trial 133 finished with value: 0.7037037037037037 and parameters: {'algorithm': 'auto', 'n_neighbors': 11, 'weights': 'distance', 'metric': 'minkowski'}. Best is trial 21 with value: 0.7207207207207208.
[32m[I 2023-04-26 12:33:44,485][39m Trial 134 finished with value: 0.6902654867256638 and parameters: {'algorithm': 'brute', 'n_neighbors': 16, 'weights': 'distance', 'metric': 'minkowski'}. Best is trial 21 with value: 0.7207207207207208.
[32m[I 2023-04-26 12:33:44,498][39m Trial 135 finished with value: 0.7207207207207208 and parameters: {'algorithm': 'auto', 'n_neighbors': 3, 'weights': 'distance', 'metric': 'manhattan'}. Best is trial 21 with value: 0.7207207207207208.
[32m[I 2023-04-26 12:33:44,512][39m Trial 136 finished with value: 0.709090909090909 and parameters: {'algorithm': 'kd_tree', 'n_neighbors': 8, 'weights': 'distance', 'metric': 'minkowski'}. Best is trial 21 with value: 0.7207207207207208.
[32m[I 2023-04-26 12:33:44,539][39m Trial 137 finished with value: 0.709090909090909 and parameters: {'algorithm': 'brute', 'n_neighbors': 7, 'weights': 'distance', 'metric': 'minkowski'}. Best is trial 21 with value: 0.7207207207207208.
[32m[I 2023-04-26 12:33:44,552][39m Trial 138 finished with value: 0.7130434782608696 and parameters: {'algorithm': 'ball_tree', 'n_neighbors': 2, 'weights': 'distance', 'metric': 'manhattan'}. Best is trial 21 with value: 0.7207207207207208.
[32m[I 2023-04-26 12:33:44,565][39m Trial 139 finished with value: 0.7207207207207208 and parameters: {'algorithm': 'ball_tree', 'n_neighbors': 3, 'weights': 'distance', 'metric': 'manhattan'}. Best is trial 21 with value: 0.7207207207207208.
[32m[I 2023-04-26 12:33:44,579][39m Trial 140 finished with value: 0.7130434782608696 and parameters: {'algorithm': 'auto', 'n_neighbors': 2, 'weights': 'distance', 'metric': 'manhattan'}. Best is trial 21 with value: 0.7207207207207208.
[32m[I 2023-04-26 12:33:44,592][39m Trial 141 finished with value: 0.7207207207207208 and parameters: {'algorithm': 'ball_tree', 'n_neighbors': 9, 'weights': 'distance', 'metric': 'minkowski'}. Best is trial 21 with value: 0.7207207207207208.
[32m[I 2023-04-26 12:33:44,606][39m Trial 142 finished with value: 0.709090909090909 and parameters: {'algorithm': 'kd_tree', 'n_neighbors': 10, 'weights': 'distance', 'metric': 'minkowski'}. Best is trial 21 with value: 0.7207207207207208.
[32m[I 2023-04-26 12:33:44,620][39m Trial 143 finished with value: 0.7079646017699116 and parameters: {'algorithm': 'ball_tree', 'n_neighbors': 4, 'weights': 'distance', 'metric': 'manhattan'}. Best is trial 21 with value: 0.7207207207207208.
[32m[I 2023-04-26 12:33:44,634][39m Trial 144 finished with value: 0.709090909090909 and parameters: {'algorithm': 'kd_tree', 'n_neighbors': 8, 'weights': 'distance', 'metric': 'minkowski'}. Best is trial 21 with value: 0.7207207207207208.
[32m[I 2023-04-26 12:33:44,641][39m Trial 145 finished with value: 0.7037037037037037 and parameters: {'algorithm': 'auto', 'n_neighbors': 11, 'weights': 'distance', 'metric': 'minkowski'}. Best is trial 21 with value: 0.7207207207207208.
[32m[I 2023-04-26 12:33:44,649][39m Trial 146 finished with value: 0.7079646017699116 and parameters: {'algorithm': 'kd_tree', 'n_neighbors': 6, 'weights': 'distance', 'metric': 'manhattan'}. Best is trial 21 with value: 0.7207207207207208.
[32m[I 2023-04-26 12:33:44,656][39m Trial 147 finished with value: 0.709090909090909 and parameters: {'algorithm': 'kd_tree', 'n_neighbors': 10, 'weights': 'distance', 'metric': 'minkowski'}. Best is trial 21 with value: 0.7207207207207208.
[32m[I 2023-04-26 12:33:44,664][39m Trial 148 finished with value: 0.709090909090909 and parameters: {'algorithm': 'kd_tree', 'n_neighbors': 8, 'weights': 'distance', 'metric': 'minkowski'}. Best is trial 21 with value: 0.7207207207207208.
[32m[I 2023-04-26 12:33:44,672][39m Trial 149 finished with value: 0.709090909090909 and parameters: {'algorithm': 'kd_tree', 'n_neighbors': 12, 'weights': 'distance', 'metric': 'minkowski'}. Best is trial 21 with value: 0.7207207207207208.
[32m[I 2023-04-26 12:33:44,680][39m Trial 150 finished with value: 0.7207207207207208 and parameters: {'algorithm': 'kd_tree', 'n_neighbors': 9, 'weights': 'distance', 'metric': 'minkowski'}. Best is trial 21 with value: 0.7207207207207208.
[32m[I 2023-04-26 12:33:44,687][39m Trial 151 finished with value: 0.7207207207207208 and parameters: {'algorithm': 'kd_tree', 'n_neighbors': 9, 'weights': 'distance', 'metric': 'minkowski'}. Best is trial 21 with value: 0.7207207207207208.
[32m[I 2023-04-26 12:33:44,694][39m Trial 152 finished with value: 0.7207207207207208 and parameters: {'algorithm': 'auto', 'n_neighbors': 9, 'weights': 'distance', 'metric': 'minkowski'}. Best is trial 21 with value: 0.7207207207207208.
[32m[I 2023-04-26 12:33:44,719][39m Trial 153 finished with value: 0.7130434782608696 and parameters: {'algorithm': 'brute', 'n_neighbors': 1, 'weights': 'distance', 'metric': 'manhattan'}. Best is trial 21 with value: 0.7207207207207208.
[32m[I 2023-04-26 12:33:44,751][39m Trial 154 finished with value: 0.709090909090909 and parameters: {'algorithm': 'brute', 'n_neighbors': 8, 'weights': 'distance', 'metric': 'minkowski'}. Best is trial 21 with value: 0.7207207207207208.
[32m[I 2023-04-26 12:33:44,766][39m Trial 155 finished with value: 0.709090909090909 and parameters: {'algorithm': 'auto', 'n_neighbors': 10, 'weights': 'distance', 'metric': 'minkowski'}. Best is trial 21 with value: 0.7207207207207208.
[32m[I 2023-04-26 12:33:44,780][39m Trial 156 finished with value: 0.7207207207207208 and parameters: {'algorithm': 'auto', 'n_neighbors': 3, 'weights': 'distance', 'metric': 'manhattan'}. Best is trial 21 with value: 0.7207207207207208.
[32m[I 2023-04-26 12:33:44,797][39m Trial 157 finished with value: 0.6595744680851064 and parameters: {'algorithm': 'kd_tree', 'n_neighbors': 4, 'weights': 'uniform', 'metric': 'manhattan'}. Best is trial 21 with value: 0.7207207207207208.
[32m[I 2023-04-26 12:33:44,827][39m Trial 158 finished with value: 0.7207207207207208 and parameters: {'algorithm': 'brute', 'n_neighbors': 3, 'weights': 'distance', 'metric': 'manhattan'}. Best is trial 21 with value: 0.7207207207207208.
[32m[I 2023-04-26 12:33:44,841][39m Trial 159 finished with value: 0.7207207207207208 and parameters: {'algorithm': 'kd_tree', 'n_neighbors': 3, 'weights': 'distance', 'metric': 'manhattan'}. Best is trial 21 with value: 0.7207207207207208.
[32m[I 2023-04-26 12:33:44,854][39m Trial 160 finished with value: 0.6972477064220184 and parameters: {'algorithm': 'kd_tree', 'n_neighbors': 5, 'weights': 'distance', 'metric': 'manhattan'}. Best is trial 21 with value: 0.7207207207207208.
[32m[I 2023-04-26 12:33:44,869][39m Trial 161 finished with value: 0.7207207207207208 and parameters: {'algorithm': 'auto', 'n_neighbors': 9, 'weights': 'distance', 'metric': 'minkowski'}. Best is trial 21 with value: 0.7207207207207208.
[32m[I 2023-04-26 12:33:44,883][39m Trial 162 finished with value: 0.7207207207207208 and parameters: {'algorithm': 'auto', 'n_neighbors': 9, 'weights': 'distance', 'metric': 'minkowski'}. Best is trial 21 with value: 0.7207207207207208.
[32m[I 2023-04-26 12:33:44,897][39m Trial 163 finished with value: 0.7207207207207208 and parameters: {'algorithm': 'ball_tree', 'n_neighbors': 9, 'weights': 'distance', 'metric': 'minkowski'}. Best is trial 21 with value: 0.7207207207207208.
[32m[I 2023-04-26 12:33:44,912][39m Trial 164 finished with value: 0.7017543859649122 and parameters: {'algorithm': 'ball_tree', 'n_neighbors': 2, 'weights': 'distance', 'metric': 'minkowski'}. Best is trial 21 with value: 0.7207207207207208.
[32m[I 2023-04-26 12:33:44,943][39m Trial 165 finished with value: 0.6972477064220184 and parameters: {'algorithm': 'brute', 'n_neighbors': 11, 'weights': 'distance', 'metric': 'manhattan'}. Best is trial 21 with value: 0.7207207207207208.
[32m[I 2023-04-26 12:33:44,958][39m Trial 166 finished with value: 0.709090909090909 and parameters: {'algorithm': 'kd_tree', 'n_neighbors': 10, 'weights': 'distance', 'metric': 'minkowski'}. Best is trial 21 with value: 0.7207207207207208.
[32m[I 2023-04-26 12:33:44,972][39m Trial 167 finished with value: 0.709090909090909 and parameters: {'algorithm': 'auto', 'n_neighbors': 8, 'weights': 'distance', 'metric': 'euclidean'}. Best is trial 21 with value: 0.7207207207207208.
[32m[I 2023-04-26 12:33:44,987][39m Trial 168 finished with value: 0.6972477064220184 and parameters: {'algorithm': 'auto', 'n_neighbors': 7, 'weights': 'distance', 'metric': 'manhattan'}. Best is trial 21 with value: 0.7207207207207208.
[32m[I 2023-04-26 12:33:45,000][39m Trial 169 finished with value: 0.7079646017699116 and parameters: {'algorithm': 'ball_tree', 'n_neighbors': 4, 'weights': 'distance', 'metric': 'manhattan'}. Best is trial 21 with value: 0.7207207207207208.
[32m[I 2023-04-26 12:33:45,016][39m Trial 170 finished with value: 0.7207207207207208 and parameters: {'algorithm': 'auto', 'n_neighbors': 9, 'weights': 'distance', 'metric': 'minkowski'}. Best is trial 21 with value: 0.7207207207207208.
[32m[I 2023-04-26 12:33:45,030][39m Trial 171 finished with value: 0.7130434782608696 and parameters: {'algorithm': 'auto', 'n_neighbors': 2, 'weights': 'distance', 'metric': 'manhattan'}. Best is trial 21 with value: 0.7207207207207208.
[32m[I 2023-04-26 12:33:45,043][39m Trial 172 finished with value: 0.7207207207207208 and parameters: {'algorithm': 'auto', 'n_neighbors': 3, 'weights': 'distance', 'metric': 'manhattan'}. Best is trial 21 with value: 0.7207207207207208.
[32m[I 2023-04-26 12:33:45,051][39m Trial 173 finished with value: 0.7207207207207208 and parameters: {'algorithm': 'kd_tree', 'n_neighbors': 3, 'weights': 'distance', 'metric': 'manhattan'}. Best is trial 21 with value: 0.7207207207207208.
[32m[I 2023-04-26 12:33:45,058][39m Trial 174 finished with value: 0.7207207207207208 and parameters: {'algorithm': 'kd_tree', 'n_neighbors': 3, 'weights': 'distance', 'metric': 'manhattan'}. Best is trial 21 with value: 0.7207207207207208.
[32m[I 2023-04-26 12:33:45,066][39m Trial 175 finished with value: 0.7207207207207208 and parameters: {'algorithm': 'kd_tree', 'n_neighbors': 3, 'weights': 'distance', 'metric': 'manhattan'}. Best is trial 21 with value: 0.7207207207207208.
[32m[I 2023-04-26 12:33:45,073][39m Trial 176 finished with value: 0.7079646017699116 and parameters: {'algorithm': 'kd_tree', 'n_neighbors': 4, 'weights': 'distance', 'metric': 'manhattan'}. Best is trial 21 with value: 0.7207207207207208.
[32m[I 2023-04-26 12:33:45,081][39m Trial 177 finished with value: 0.7017543859649122 and parameters: {'algorithm': 'kd_tree', 'n_neighbors': 2, 'weights': 'distance', 'metric': 'minkowski'}. Best is trial 21 with value: 0.7207207207207208.
[32m[I 2023-04-26 12:33:45,089][39m Trial 178 finished with value: 0.7130434782608696 and parameters: {'algorithm': 'kd_tree', 'n_neighbors': 1, 'weights': 'distance', 'metric': 'manhattan'}. Best is trial 21 with value: 0.7207207207207208.
[32m[I 2023-04-26 12:33:45,097][39m Trial 179 finished with value: 0.6902654867256638 and parameters: {'algorithm': 'auto', 'n_neighbors': 4, 'weights': 'distance', 'metric': 'minkowski'}. Best is trial 21 with value: 0.7207207207207208.
