[32m[I 2023-04-26 11:07:08,834][39m Trial 401 finished with value: 0.8305084745762712 and parameters: {'objective': 'CrossEntropy', 'colsample_bylevel': 0.02702153613278055, 'depth': 3, 'boosting_type': 'Plain', 'bootstrap_type': 'Bayesian', 'bagging_temperature': 3.435243964321668}. Best is trial 71 with value: 0.890909090909091.
[32m[I 2023-04-26 11:07:10,438][39m Trial 402 finished with value: 0.8392857142857144 and parameters: {'objective': 'CrossEntropy', 'colsample_bylevel': 0.09640249281801262, 'depth': 6, 'boosting_type': 'Plain', 'bootstrap_type': 'Bayesian', 'bagging_temperature': 8.060653974100077}. Best is trial 71 with value: 0.890909090909091.
[32m[I 2023-04-26 11:07:12,631][39m Trial 403 finished with value: 0.8672566371681416 and parameters: {'objective': 'CrossEntropy', 'colsample_bylevel': 0.09998415101596621, 'depth': 6, 'boosting_type': 'Plain', 'bootstrap_type': 'Bayesian', 'bagging_temperature': 8.344680447996428}. Best is trial 71 with value: 0.890909090909091.
[32m[I 2023-04-26 11:07:15,301][39m Trial 404 finished with value: 0.875 and parameters: {'objective': 'CrossEntropy', 'colsample_bylevel': 0.09541444656905125, 'depth': 5, 'boosting_type': 'Plain', 'bootstrap_type': 'Bayesian', 'bagging_temperature': 8.459449415580776}. Best is trial 71 with value: 0.890909090909091.
[32m[I 2023-04-26 11:07:17,672][39m Trial 405 finished with value: 0.8672566371681416 and parameters: {'objective': 'CrossEntropy', 'colsample_bylevel': 0.09059390068834523, 'depth': 7, 'boosting_type': 'Plain', 'bootstrap_type': 'Bernoulli', 'subsample': 0.26523239947363975}. Best is trial 71 with value: 0.890909090909091.
[32m[I 2023-04-26 11:07:23,349][39m Trial 406 finished with value: 0.8596491228070176 and parameters: {'objective': 'CrossEntropy', 'colsample_bylevel': 0.09269637508816811, 'depth': 9, 'boosting_type': 'Ordered', 'bootstrap_type': 'Bayesian', 'bagging_temperature': 2.825428622638554}. Best is trial 71 with value: 0.890909090909091.
[32m[I 2023-04-26 11:07:25,710][39m Trial 407 finished with value: 0.8672566371681416 and parameters: {'objective': 'CrossEntropy', 'colsample_bylevel': 0.09394524442539327, 'depth': 7, 'boosting_type': 'Plain', 'bootstrap_type': 'Bayesian', 'bagging_temperature': 4.303827009584668}. Best is trial 71 with value: 0.890909090909091.
[32m[I 2023-04-26 11:07:30,942][39m Trial 408 finished with value: 0.875 and parameters: {'objective': 'Logloss', 'colsample_bylevel': 0.08638859336114682, 'depth': 9, 'boosting_type': 'Ordered', 'bootstrap_type': 'Bayesian', 'bagging_temperature': 3.097208773841775}. Best is trial 71 with value: 0.890909090909091.
[32m[I 2023-04-26 11:07:33,058][39m Trial 409 finished with value: 0.875 and parameters: {'objective': 'CrossEntropy', 'colsample_bylevel': 0.09658227320245456, 'depth': 11, 'boosting_type': 'Plain', 'bootstrap_type': 'Bayesian', 'bagging_temperature': 8.521346166692961}. Best is trial 71 with value: 0.890909090909091.
[32m[I 2023-04-26 11:07:35,598][39m Trial 410 finished with value: 0.8672566371681416 and parameters: {'objective': 'CrossEntropy', 'colsample_bylevel': 0.09432175880982155, 'depth': 8, 'boosting_type': 'Plain', 'bootstrap_type': 'Bayesian', 'bagging_temperature': 3.897912610516823}. Best is trial 71 with value: 0.890909090909091.
[32m[I 2023-04-26 11:07:38,133][39m Trial 411 finished with value: 0.8828828828828829 and parameters: {'objective': 'CrossEntropy', 'colsample_bylevel': 0.08881439393528529, 'depth': 5, 'boosting_type': 'Plain', 'bootstrap_type': 'Bayesian', 'bagging_temperature': 3.538175301268189}. Best is trial 71 with value: 0.890909090909091.
[32m[I 2023-04-26 11:07:40,278][39m Trial 412 finished with value: 0.8672566371681416 and parameters: {'objective': 'CrossEntropy', 'colsample_bylevel': 0.0847062402855583, 'depth': 3, 'boosting_type': 'Plain', 'bootstrap_type': 'Bayesian', 'bagging_temperature': 3.218389488042889}. Best is trial 71 with value: 0.890909090909091.
[32m[I 2023-04-26 11:07:42,661][39m Trial 413 finished with value: 0.875 and parameters: {'objective': 'CrossEntropy', 'colsample_bylevel': 0.0923343828807657, 'depth': 8, 'boosting_type': 'Plain', 'bootstrap_type': 'Bayesian', 'bagging_temperature': 0.04898537096570621}. Best is trial 71 with value: 0.890909090909091.
[32m[I 2023-04-26 11:07:45,263][39m Trial 414 finished with value: 0.8672566371681416 and parameters: {'objective': 'CrossEntropy', 'colsample_bylevel': 0.09262592072597736, 'depth': 8, 'boosting_type': 'Plain', 'bootstrap_type': 'Bayesian', 'bagging_temperature': 1.667018334623131}. Best is trial 71 with value: 0.890909090909091.
[32m[I 2023-04-26 11:07:47,548][39m Trial 415 finished with value: 0.8828828828828829 and parameters: {'objective': 'CrossEntropy', 'colsample_bylevel': 0.0915544164836088, 'depth': 7, 'boosting_type': 'Plain', 'bootstrap_type': 'Bayesian', 'bagging_temperature': 2.060113540410631}. Best is trial 71 with value: 0.890909090909091.
[32m[I 2023-04-26 11:07:49,808][39m Trial 416 finished with value: 0.875 and parameters: {'objective': 'CrossEntropy', 'colsample_bylevel': 0.09073700513980454, 'depth': 6, 'boosting_type': 'Plain', 'bootstrap_type': 'Bayesian', 'bagging_temperature': 3.674497512966689}. Best is trial 71 with value: 0.890909090909091.
[32m[I 2023-04-26 11:07:52,368][39m Trial 417 finished with value: 0.8828828828828829 and parameters: {'objective': 'CrossEntropy', 'colsample_bylevel': 0.08885675840153297, 'depth': 8, 'boosting_type': 'Plain', 'bootstrap_type': 'Bayesian', 'bagging_temperature': 3.343955057860165}. Best is trial 71 with value: 0.890909090909091.
[32m[I 2023-04-26 11:07:54,754][39m Trial 418 finished with value: 0.875 and parameters: {'objective': 'CrossEntropy', 'colsample_bylevel': 0.08761659918468334, 'depth': 8, 'boosting_type': 'Plain', 'bootstrap_type': 'Bayesian', 'bagging_temperature': 1.7460203228206481}. Best is trial 71 with value: 0.890909090909091.
[32m[I 2023-04-26 11:07:59,238][39m Trial 419 finished with value: 0.875 and parameters: {'objective': 'Logloss', 'colsample_bylevel': 0.08256729702365939, 'depth': 4, 'boosting_type': 'Ordered', 'bootstrap_type': 'Bayesian', 'bagging_temperature': 3.9808784160785096}. Best is trial 71 with value: 0.890909090909091.
[32m[I 2023-04-26 11:08:02,694][39m Trial 420 finished with value: 0.8545454545454546 and parameters: {'objective': 'CrossEntropy', 'colsample_bylevel': 0.0939638668222254, 'depth': 9, 'boosting_type': 'Plain', 'bootstrap_type': 'Bayesian', 'bagging_temperature': 2.159944780179551}. Best is trial 71 with value: 0.890909090909091.
[32m[I 2023-04-26 11:08:05,312][39m Trial 421 finished with value: 0.875 and parameters: {'objective': 'CrossEntropy', 'colsample_bylevel': 0.08630125445223964, 'depth': 8, 'boosting_type': 'Plain', 'bootstrap_type': 'Bayesian', 'bagging_temperature': 3.4968700585361705}. Best is trial 71 with value: 0.890909090909091.
[32m[I 2023-04-26 11:08:06,937][39m Trial 422 finished with value: 0.8672566371681416 and parameters: {'objective': 'CrossEntropy', 'colsample_bylevel': 0.0969529180695112, 'depth': 11, 'boosting_type': 'Plain', 'bootstrap_type': 'MVS'}. Best is trial 71 with value: 0.890909090909091.
[32m[I 2023-04-26 11:08:09,273][39m Trial 423 finished with value: 0.875 and parameters: {'objective': 'CrossEntropy', 'colsample_bylevel': 0.0934881706021583, 'depth': 9, 'boosting_type': 'Plain', 'bootstrap_type': 'Bayesian', 'bagging_temperature': 3.7881998945893742}. Best is trial 71 with value: 0.890909090909091.
[32m[I 2023-04-26 11:08:10,825][39m Trial 424 finished with value: 0.8403361344537814 and parameters: {'objective': 'CrossEntropy', 'colsample_bylevel': 0.08585312041563234, 'depth': 1, 'boosting_type': 'Plain', 'bootstrap_type': 'Bayesian', 'bagging_temperature': 9.093567081630257}. Best is trial 71 with value: 0.890909090909091.
[32m[I 2023-04-26 11:08:12,744][39m Trial 425 finished with value: 0.8648648648648648 and parameters: {'objective': 'CrossEntropy', 'colsample_bylevel': 0.09399169360839946, 'depth': 2, 'boosting_type': 'Plain', 'bootstrap_type': 'Bayesian', 'bagging_temperature': 6.566644436876478}. Best is trial 71 with value: 0.890909090909091.
[32m[I 2023-04-26 11:08:14,753][39m Trial 426 finished with value: 0.8672566371681416 and parameters: {'objective': 'CrossEntropy', 'colsample_bylevel': 0.09399072964392503, 'depth': 6, 'boosting_type': 'Plain', 'bootstrap_type': 'Bayesian', 'bagging_temperature': 3.512794519699829}. Best is trial 71 with value: 0.890909090909091.
[32m[I 2023-04-26 11:08:18,366][39m Trial 427 finished with value: 0.8672566371681416 and parameters: {'objective': 'CrossEntropy', 'colsample_bylevel': 0.0924741430248111, 'depth': 9, 'boosting_type': 'Plain', 'bootstrap_type': 'Bayesian', 'bagging_temperature': 8.773852216537621}. Best is trial 71 with value: 0.890909090909091.
[32m[I 2023-04-26 11:08:20,422][39m Trial 428 finished with value: 0.875 and parameters: {'objective': 'CrossEntropy', 'colsample_bylevel': 0.09199031956770784, 'depth': 7, 'boosting_type': 'Plain', 'bootstrap_type': 'Bayesian', 'bagging_temperature': 3.066127899683137}. Best is trial 71 with value: 0.890909090909091.
[32m[I 2023-04-26 11:08:22,388][39m Trial 429 finished with value: 0.875 and parameters: {'objective': 'CrossEntropy', 'colsample_bylevel': 0.07194197541258118, 'depth': 7, 'boosting_type': 'Plain', 'bootstrap_type': 'Bayesian', 'bagging_temperature': 2.33144982534257}. Best is trial 71 with value: 0.890909090909091.
[32m[I 2023-04-26 11:08:25,556][39m Trial 430 finished with value: 0.875 and parameters: {'objective': 'Logloss', 'colsample_bylevel': 0.09032957715734653, 'depth': 8, 'boosting_type': 'Plain', 'bootstrap_type': 'Bayesian', 'bagging_temperature': 2.2672300566325805}. Best is trial 71 with value: 0.890909090909091.
[32m[I 2023-04-26 11:08:27,310][39m Trial 431 finished with value: 0.8596491228070176 and parameters: {'objective': 'CrossEntropy', 'colsample_bylevel': 0.09510891875496937, 'depth': 10, 'boosting_type': 'Plain', 'bootstrap_type': 'Bayesian', 'bagging_temperature': 9.662984661936726}. Best is trial 71 with value: 0.890909090909091.
[32m[I 2023-04-26 11:08:30,993][39m Trial 432 finished with value: 0.875 and parameters: {'objective': 'CrossEntropy', 'colsample_bylevel': 0.0871434098535363, 'depth': 9, 'boosting_type': 'Plain', 'bootstrap_type': 'Bayesian', 'bagging_temperature': 2.285629983052364}. Best is trial 71 with value: 0.890909090909091.
[32m[I 2023-04-26 11:08:33,191][39m Trial 433 finished with value: 0.875 and parameters: {'objective': 'CrossEntropy', 'colsample_bylevel': 0.09225189483121435, 'depth': 10, 'boosting_type': 'Plain', 'bootstrap_type': 'Bayesian', 'bagging_temperature': 1.0555964334384877}. Best is trial 71 with value: 0.890909090909091.
[32m[I 2023-04-26 11:08:35,605][39m Trial 434 finished with value: 0.8672566371681416 and parameters: {'objective': 'CrossEntropy', 'colsample_bylevel': 0.09497326153970709, 'depth': 12, 'boosting_type': 'Plain', 'bootstrap_type': 'Bayesian', 'bagging_temperature': 8.77730418363843}. Best is trial 71 with value: 0.890909090909091.
[32m[I 2023-04-26 11:08:37,625][39m Trial 435 finished with value: 0.8672566371681416 and parameters: {'objective': 'CrossEntropy', 'colsample_bylevel': 0.07761981092063712, 'depth': 5, 'boosting_type': 'Plain', 'bootstrap_type': 'Bayesian', 'bagging_temperature': 9.1331626449358}. Best is trial 71 with value: 0.890909090909091.
[32m[I 2023-04-26 11:08:39,823][39m Trial 436 finished with value: 0.8828828828828829 and parameters: {'objective': 'CrossEntropy', 'colsample_bylevel': 0.09720670915850907, 'depth': 10, 'boosting_type': 'Plain', 'bootstrap_type': 'Bayesian', 'bagging_temperature': 8.847325083410162}. Best is trial 71 with value: 0.890909090909091.
[32m[I 2023-04-26 11:08:41,411][39m Trial 437 finished with value: 0.8596491228070176 and parameters: {'objective': 'CrossEntropy', 'colsample_bylevel': 0.09656245893160043, 'depth': 6, 'boosting_type': 'Plain', 'bootstrap_type': 'MVS'}. Best is trial 71 with value: 0.890909090909091.
[32m[I 2023-04-26 11:08:44,850][39m Trial 438 finished with value: 0.8596491228070176 and parameters: {'objective': 'CrossEntropy', 'colsample_bylevel': 0.0816629095703561, 'depth': 9, 'boosting_type': 'Plain', 'bootstrap_type': 'Bayesian', 'bagging_temperature': 8.61691434686878}. Best is trial 71 with value: 0.890909090909091.
[32m[I 2023-04-26 11:08:46,976][39m Trial 439 finished with value: 0.875 and parameters: {'objective': 'CrossEntropy', 'colsample_bylevel': 0.07549974985950603, 'depth': 7, 'boosting_type': 'Plain', 'bootstrap_type': 'Bayesian', 'bagging_temperature': 9.428448058070897}. Best is trial 71 with value: 0.890909090909091.
[32m[I 2023-04-26 11:08:48,917][39m Trial 440 finished with value: 0.875 and parameters: {'objective': 'CrossEntropy', 'colsample_bylevel': 0.06750256311380941, 'depth': 7, 'boosting_type': 'Plain', 'bootstrap_type': 'Bayesian', 'bagging_temperature': 9.060829732232433}. Best is trial 71 with value: 0.890909090909091.
[32m[I 2023-04-26 11:08:51,743][39m Trial 441 finished with value: 0.8672566371681416 and parameters: {'objective': 'CrossEntropy', 'colsample_bylevel': 0.09127098438481808, 'depth': 8, 'boosting_type': 'Plain', 'bootstrap_type': 'Bayesian', 'bagging_temperature': 8.776071365354646}. Best is trial 71 with value: 0.890909090909091.
[32m[I 2023-04-26 11:08:53,661][39m Trial 442 finished with value: 0.8828828828828829 and parameters: {'objective': 'CrossEntropy', 'colsample_bylevel': 0.09870072433740845, 'depth': 7, 'boosting_type': 'Plain', 'bootstrap_type': 'Bayesian', 'bagging_temperature': 9.207364673731377}. Best is trial 71 with value: 0.890909090909091.
[32m[I 2023-04-26 11:08:56,089][39m Trial 443 finished with value: 0.8672566371681416 and parameters: {'objective': 'Logloss', 'colsample_bylevel': 0.09392401484925635, 'depth': 6, 'boosting_type': 'Plain', 'bootstrap_type': 'Bayesian', 'bagging_temperature': 4.0706577746354835}. Best is trial 71 with value: 0.890909090909091.
[32m[I 2023-04-26 11:08:58,810][39m Trial 444 finished with value: 0.8596491228070176 and parameters: {'objective': 'CrossEntropy', 'colsample_bylevel': 0.09766375497546581, 'depth': 8, 'boosting_type': 'Plain', 'bootstrap_type': 'Bayesian', 'bagging_temperature': 3.818447751993088}. Best is trial 71 with value: 0.890909090909091.
[32m[I 2023-04-26 11:09:00,390][39m Trial 445 finished with value: 0.8727272727272727 and parameters: {'objective': 'CrossEntropy', 'colsample_bylevel': 0.09509557911935189, 'depth': 7, 'boosting_type': 'Plain', 'bootstrap_type': 'Bayesian', 'bagging_temperature': 4.417560022846484}. Best is trial 71 with value: 0.890909090909091.
[32m[I 2023-04-26 11:09:02,495][39m Trial 446 finished with value: 0.8672566371681416 and parameters: {'objective': 'CrossEntropy', 'colsample_bylevel': 0.08906159273956146, 'depth': 8, 'boosting_type': 'Plain', 'bootstrap_type': 'Bayesian', 'bagging_temperature': 2.1328458239039767}. Best is trial 71 with value: 0.890909090909091.
[32m[I 2023-04-26 11:09:04,987][39m Trial 447 finished with value: 0.875 and parameters: {'objective': 'CrossEntropy', 'colsample_bylevel': 0.0983365843781627, 'depth': 8, 'boosting_type': 'Plain', 'bootstrap_type': 'Bayesian', 'bagging_temperature': 1.38693648692965}. Best is trial 71 with value: 0.890909090909091.
[32m[I 2023-04-26 11:09:06,872][39m Trial 448 finished with value: 0.875 and parameters: {'objective': 'CrossEntropy', 'colsample_bylevel': 0.09577436935917547, 'depth': 6, 'boosting_type': 'Plain', 'bootstrap_type': 'Bayesian', 'bagging_temperature': 3.7504954884765644}. Best is trial 71 with value: 0.890909090909091.
[32m[I 2023-04-26 11:09:08,859][39m Trial 449 finished with value: 0.8596491228070176 and parameters: {'objective': 'CrossEntropy', 'colsample_bylevel': 0.0809332594290034, 'depth': 4, 'boosting_type': 'Plain', 'bootstrap_type': 'Bayesian', 'bagging_temperature': 9.816393343733315}. Best is trial 71 with value: 0.890909090909091.
[32m[I 2023-04-26 11:09:10,862][39m Trial 450 finished with value: 0.875 and parameters: {'objective': 'CrossEntropy', 'colsample_bylevel': 0.09357313600830859, 'depth': 5, 'boosting_type': 'Plain', 'bootstrap_type': 'Bayesian', 'bagging_temperature': 3.5591444648267427}. Best is trial 71 with value: 0.890909090909091.
[32m[I 2023-04-26 11:09:13,222][39m Trial 451 finished with value: 0.8672566371681416 and parameters: {'objective': 'CrossEntropy', 'colsample_bylevel': 0.0915364536950399, 'depth': 6, 'boosting_type': 'Plain', 'bootstrap_type': 'Bayesian', 'bagging_temperature': 6.141771440118746}. Best is trial 71 with value: 0.890909090909091.
[32m[I 2023-04-26 11:09:15,107][39m Trial 452 finished with value: 0.875 and parameters: {'objective': 'CrossEntropy', 'colsample_bylevel': 0.0899340281008269, 'depth': 7, 'boosting_type': 'Plain', 'bootstrap_type': 'Bayesian', 'bagging_temperature': 1.8757054090528547}. Best is trial 71 with value: 0.890909090909091.
[32m[I 2023-04-26 11:09:18,921][39m Trial 453 finished with value: 0.8672566371681416 and parameters: {'objective': 'CrossEntropy', 'colsample_bylevel': 0.09672328512688508, 'depth': 8, 'boosting_type': 'Ordered', 'bootstrap_type': 'Bayesian', 'bagging_temperature': 1.586629553264556}. Best is trial 71 with value: 0.890909090909091.
[32m[I 2023-04-26 11:09:20,895][39m Trial 454 finished with value: 0.8648648648648648 and parameters: {'objective': 'Logloss', 'colsample_bylevel': 0.048554091892732, 'depth': 8, 'boosting_type': 'Plain', 'bootstrap_type': 'Bayesian', 'bagging_temperature': 4.096387326188196}. Best is trial 71 with value: 0.890909090909091.
[32m[I 2023-04-26 11:09:22,916][39m Trial 455 finished with value: 0.875 and parameters: {'objective': 'CrossEntropy', 'colsample_bylevel': 0.09342253573614007, 'depth': 7, 'boosting_type': 'Plain', 'bootstrap_type': 'Bayesian', 'bagging_temperature': 5.144944732096087}. Best is trial 71 with value: 0.890909090909091.
[32m[I 2023-04-26 11:09:24,687][39m Trial 456 finished with value: 0.8596491228070176 and parameters: {'objective': 'CrossEntropy', 'colsample_bylevel': 0.06300827748746797, 'depth': 7, 'boosting_type': 'Plain', 'bootstrap_type': 'Bayesian', 'bagging_temperature': 3.7845130578391553}. Best is trial 71 with value: 0.890909090909091.
[32m[I 2023-04-26 11:09:27,354][39m Trial 457 finished with value: 0.8672566371681416 and parameters: {'objective': 'CrossEntropy', 'colsample_bylevel': 0.09989257702898548, 'depth': 7, 'boosting_type': 'Plain', 'bootstrap_type': 'Bayesian', 'bagging_temperature': 4.958133471386211}. Best is trial 71 with value: 0.890909090909091.
[32m[I 2023-04-26 11:09:29,953][39m Trial 458 finished with value: 0.8828828828828829 and parameters: {'objective': 'CrossEntropy', 'colsample_bylevel': 0.0952681925823479, 'depth': 8, 'boosting_type': 'Plain', 'bootstrap_type': 'Bayesian', 'bagging_temperature': 3.9602059022970924}. Best is trial 71 with value: 0.890909090909091.
[32m[I 2023-04-26 11:09:31,419][39m Trial 459 finished with value: 0.8596491228070176 and parameters: {'objective': 'CrossEntropy', 'colsample_bylevel': 0.09030398961813345, 'depth': 6, 'boosting_type': 'Plain', 'bootstrap_type': 'Bernoulli', 'subsample': 0.5511436035199359}. Best is trial 71 with value: 0.890909090909091.
[32m[I 2023-04-26 11:09:34,282][39m Trial 460 finished with value: 0.8672566371681416 and parameters: {'objective': 'CrossEntropy', 'colsample_bylevel': 0.09542201855278103, 'depth': 8, 'boosting_type': 'Plain', 'bootstrap_type': 'Bayesian', 'bagging_temperature': 3.601968826528372}. Best is trial 71 with value: 0.890909090909091.
[32m[I 2023-04-26 11:09:36,572][39m Trial 461 finished with value: 0.875 and parameters: {'objective': 'CrossEntropy', 'colsample_bylevel': 0.09803807888104756, 'depth': 8, 'boosting_type': 'Plain', 'bootstrap_type': 'Bayesian', 'bagging_temperature': 2.5607929540173284}. Best is trial 71 with value: 0.890909090909091.
[32m[I 2023-04-26 11:09:41,132][39m Trial 462 finished with value: 0.8596491228070176 and parameters: {'objective': 'CrossEntropy', 'colsample_bylevel': 0.08369144239289845, 'depth': 11, 'boosting_type': 'Ordered', 'bootstrap_type': 'Bayesian', 'bagging_temperature': 4.695312266529617}. Best is trial 71 with value: 0.890909090909091.
[32m[I 2023-04-26 11:09:42,817][39m Trial 463 finished with value: 0.8807339449541284 and parameters: {'objective': 'CrossEntropy', 'colsample_bylevel': 0.053292180576022266, 'depth': 5, 'boosting_type': 'Plain', 'bootstrap_type': 'Bayesian', 'bagging_temperature': 1.97267255516578}. Best is trial 71 with value: 0.890909090909091.
[32m[I 2023-04-26 11:09:47,796][39m Trial 464 finished with value: 0.8596491228070176 and parameters: {'objective': 'CrossEntropy', 'colsample_bylevel': 0.09306194426690043, 'depth': 8, 'boosting_type': 'Ordered', 'bootstrap_type': 'Bayesian', 'bagging_temperature': 8.583536197362035}. Best is trial 71 with value: 0.890909090909091.
[32m[I 2023-04-26 11:09:49,502][39m Trial 465 finished with value: 0.8672566371681416 and parameters: {'objective': 'CrossEntropy', 'colsample_bylevel': 0.0918778214658781, 'depth': 5, 'boosting_type': 'Plain', 'bootstrap_type': 'MVS'}. Best is trial 71 with value: 0.890909090909091.
[32m[I 2023-04-26 11:09:51,553][39m Trial 466 finished with value: 0.8672566371681416 and parameters: {'objective': 'CrossEntropy', 'colsample_bylevel': 0.08884494409702005, 'depth': 6, 'boosting_type': 'Plain', 'bootstrap_type': 'Bayesian', 'bagging_temperature': 8.935842548759316}. Best is trial 71 with value: 0.890909090909091.
[32m[I 2023-04-26 11:09:53,941][39m Trial 467 finished with value: 0.8828828828828829 and parameters: {'objective': 'CrossEntropy', 'colsample_bylevel': 0.09123327130890853, 'depth': 7, 'boosting_type': 'Plain', 'bootstrap_type': 'Bayesian', 'bagging_temperature': 9.35324751063826}. Best is trial 71 with value: 0.890909090909091.
