[32m[I 2023-04-26 10:54:09,320][39m Trial 70 finished with value: 0.8672566371681416 and parameters: {'objective': 'CrossEntropy', 'colsample_bylevel': 0.07777697932071138, 'depth': 5, 'boosting_type': 'Plain', 'bootstrap_type': 'Bayesian', 'bagging_temperature': 2.5028450210120763}. Best is trial 42 with value: 0.8828828828828829.
[32m[I 2023-04-26 10:54:11,269][39m Trial 71 finished with value: 0.890909090909091 and parameters: {'objective': 'CrossEntropy', 'colsample_bylevel': 0.09054793614326469, 'depth': 6, 'boosting_type': 'Plain', 'bootstrap_type': 'Bayesian', 'bagging_temperature': 8.623509252581105}. Best is trial 71 with value: 0.890909090909091.
[32m[I 2023-04-26 10:54:13,425][39m Trial 72 finished with value: 0.875 and parameters: {'objective': 'CrossEntropy', 'colsample_bylevel': 0.09004460120606947, 'depth': 5, 'boosting_type': 'Plain', 'bootstrap_type': 'Bayesian', 'bagging_temperature': 8.665167429515982}. Best is trial 71 with value: 0.890909090909091.
[32m[I 2023-04-26 10:54:15,752][39m Trial 73 finished with value: 0.8672566371681416 and parameters: {'objective': 'CrossEntropy', 'colsample_bylevel': 0.09139525534757709, 'depth': 7, 'boosting_type': 'Plain', 'bootstrap_type': 'Bayesian', 'bagging_temperature': 9.503806378211397}. Best is trial 71 with value: 0.890909090909091.
[32m[I 2023-04-26 10:54:17,703][39m Trial 74 finished with value: 0.8828828828828829 and parameters: {'objective': 'CrossEntropy', 'colsample_bylevel': 0.08414076294302236, 'depth': 6, 'boosting_type': 'Plain', 'bootstrap_type': 'Bayesian', 'bagging_temperature': 1.393711704848469}. Best is trial 71 with value: 0.890909090909091.
[32m[I 2023-04-26 10:54:19,849][39m Trial 75 finished with value: 0.8596491228070176 and parameters: {'objective': 'CrossEntropy', 'colsample_bylevel': 0.09958202038224824, 'depth': 4, 'boosting_type': 'Plain', 'bootstrap_type': 'Bayesian', 'bagging_temperature': 8.857501682958993}. Best is trial 71 with value: 0.890909090909091.
[32m[I 2023-04-26 10:54:21,722][39m Trial 76 finished with value: 0.8596491228070176 and parameters: {'objective': 'CrossEntropy', 'colsample_bylevel': 0.08016214584080356, 'depth': 6, 'boosting_type': 'Plain', 'bootstrap_type': 'Bayesian', 'bagging_temperature': 1.2010821859364484}. Best is trial 71 with value: 0.890909090909091.
[32m[I 2023-04-26 10:54:23,696][39m Trial 77 finished with value: 0.875 and parameters: {'objective': 'CrossEntropy', 'colsample_bylevel': 0.08349376171489527, 'depth': 6, 'boosting_type': 'Plain', 'bootstrap_type': 'Bayesian', 'bagging_temperature': 2.1942682221870258}. Best is trial 71 with value: 0.890909090909091.
[32m[I 2023-04-26 10:54:26,094][39m Trial 78 finished with value: 0.8828828828828829 and parameters: {'objective': 'Logloss', 'colsample_bylevel': 0.09414340799650985, 'depth': 7, 'boosting_type': 'Plain', 'bootstrap_type': 'Bayesian', 'bagging_temperature': 1.6994755609349057}. Best is trial 71 with value: 0.890909090909091.
[32m[I 2023-04-26 10:54:27,925][39m Trial 79 finished with value: 0.8672566371681416 and parameters: {'objective': 'Logloss', 'colsample_bylevel': 0.09440617762354042, 'depth': 7, 'boosting_type': 'Plain', 'bootstrap_type': 'Bayesian', 'bagging_temperature': 0.1993820047333883}. Best is trial 71 with value: 0.890909090909091.
[32m[I 2023-04-26 10:54:30,243][39m Trial 80 finished with value: 0.8672566371681416 and parameters: {'objective': 'Logloss', 'colsample_bylevel': 0.0969735176171702, 'depth': 5, 'boosting_type': 'Plain', 'bootstrap_type': 'Bayesian', 'bagging_temperature': 1.4124895552663}. Best is trial 71 with value: 0.890909090909091.
[32m[I 2023-04-26 10:54:32,238][39m Trial 81 finished with value: 0.8672566371681416 and parameters: {'objective': 'Logloss', 'colsample_bylevel': 0.08457273325557546, 'depth': 6, 'boosting_type': 'Plain', 'bootstrap_type': 'Bayesian', 'bagging_temperature': 1.8225633893391635}. Best is trial 71 with value: 0.890909090909091.
[32m[I 2023-04-26 10:54:34,362][39m Trial 82 finished with value: 0.8672566371681416 and parameters: {'objective': 'Logloss', 'colsample_bylevel': 0.09144157534191534, 'depth': 3, 'boosting_type': 'Plain', 'bootstrap_type': 'Bayesian', 'bagging_temperature': 0.9125381227837339}. Best is trial 71 with value: 0.890909090909091.
[32m[I 2023-04-26 10:54:38,479][39m Trial 83 finished with value: 0.8521739130434783 and parameters: {'objective': 'Logloss', 'colsample_bylevel': 0.07700645992082528, 'depth': 9, 'boosting_type': 'Ordered', 'bootstrap_type': 'Bernoulli', 'subsample': 0.4752303622232629}. Best is trial 71 with value: 0.890909090909091.
[32m[I 2023-04-26 10:54:41,108][39m Trial 84 finished with value: 0.8828828828828829 and parameters: {'objective': 'CrossEntropy', 'colsample_bylevel': 0.07367361182793561, 'depth': 8, 'boosting_type': 'Plain', 'bootstrap_type': 'Bayesian', 'bagging_temperature': 2.1299994391968675}. Best is trial 71 with value: 0.890909090909091.
[32m[I 2023-04-26 10:54:43,164][39m Trial 85 finished with value: 0.8596491228070176 and parameters: {'objective': 'CrossEntropy', 'colsample_bylevel': 0.0809977270488169, 'depth': 8, 'boosting_type': 'Plain', 'bootstrap_type': 'Bayesian', 'bagging_temperature': 0.8920930234734517}. Best is trial 71 with value: 0.890909090909091.
[32m[I 2023-04-26 10:54:47,676][39m Trial 86 finished with value: 0.875 and parameters: {'objective': 'Logloss', 'colsample_bylevel': 0.08683142812367883, 'depth': 8, 'boosting_type': 'Ordered', 'bootstrap_type': 'Bayesian', 'bagging_temperature': 2.344750828413937}. Best is trial 71 with value: 0.890909090909091.
[32m[I 2023-04-26 10:54:50,171][39m Trial 87 finished with value: 0.875 and parameters: {'objective': 'Logloss', 'colsample_bylevel': 0.08795936744530251, 'depth': 7, 'boosting_type': 'Plain', 'bootstrap_type': 'Bayesian', 'bagging_temperature': 2.234424823344965}. Best is trial 71 with value: 0.890909090909091.
[32m[I 2023-04-26 10:54:52,968][39m Trial 88 finished with value: 0.875 and parameters: {'objective': 'Logloss', 'colsample_bylevel': 0.0856662354134685, 'depth': 8, 'boosting_type': 'Plain', 'bootstrap_type': 'Bayesian', 'bagging_temperature': 1.4836242715933339}. Best is trial 71 with value: 0.890909090909091.
[32m[I 2023-04-26 10:54:54,978][39m Trial 89 finished with value: 0.8828828828828829 and parameters: {'objective': 'CrossEntropy', 'colsample_bylevel': 0.09279023704299762, 'depth': 6, 'boosting_type': 'Plain', 'bootstrap_type': 'Bayesian', 'bagging_temperature': 3.69018326292323}. Best is trial 71 with value: 0.890909090909091.
[32m[I 2023-04-26 10:54:56,758][39m Trial 90 finished with value: 0.890909090909091 and parameters: {'objective': 'CrossEntropy', 'colsample_bylevel': 0.09324257523556155, 'depth': 7, 'boosting_type': 'Plain', 'bootstrap_type': 'Bayesian', 'bagging_temperature': 3.2382224746568773}. Best is trial 71 with value: 0.890909090909091.
[32m[I 2023-04-26 10:54:58,827][39m Trial 91 finished with value: 0.8828828828828829 and parameters: {'objective': 'CrossEntropy', 'colsample_bylevel': 0.09379799001994163, 'depth': 7, 'boosting_type': 'Plain', 'bootstrap_type': 'Bayesian', 'bagging_temperature': 3.490822870615962}. Best is trial 71 with value: 0.890909090909091.
[32m[I 2023-04-26 10:55:00,748][39m Trial 92 finished with value: 0.890909090909091 and parameters: {'objective': 'CrossEntropy', 'colsample_bylevel': 0.09284900198338163, 'depth': 7, 'boosting_type': 'Plain', 'bootstrap_type': 'Bayesian', 'bagging_temperature': 3.569885943537129}. Best is trial 71 with value: 0.890909090909091.
[32m[I 2023-04-26 10:55:02,935][39m Trial 93 finished with value: 0.8672566371681416 and parameters: {'objective': 'CrossEntropy', 'colsample_bylevel': 0.08941609054405385, 'depth': 7, 'boosting_type': 'Plain', 'bootstrap_type': 'Bayesian', 'bagging_temperature': 3.3531592949621336}. Best is trial 71 with value: 0.890909090909091.
[32m[I 2023-04-26 10:55:05,225][39m Trial 94 finished with value: 0.8828828828828829 and parameters: {'objective': 'CrossEntropy', 'colsample_bylevel': 0.09523647460083307, 'depth': 7, 'boosting_type': 'Plain', 'bootstrap_type': 'Bayesian', 'bagging_temperature': 4.235526289677812}. Best is trial 71 with value: 0.890909090909091.
[32m[I 2023-04-26 10:55:07,233][39m Trial 95 finished with value: 0.875 and parameters: {'objective': 'CrossEntropy', 'colsample_bylevel': 0.09590629255732483, 'depth': 7, 'boosting_type': 'Plain', 'bootstrap_type': 'Bayesian', 'bagging_temperature': 4.272977092409561}. Best is trial 71 with value: 0.890909090909091.
[32m[I 2023-04-26 10:55:08,944][39m Trial 96 finished with value: 0.875 and parameters: {'objective': 'CrossEntropy', 'colsample_bylevel': 0.09458689494550444, 'depth': 7, 'boosting_type': 'Plain', 'bootstrap_type': 'Bayesian', 'bagging_temperature': 4.119576653620774}. Best is trial 71 with value: 0.890909090909091.
[32m[I 2023-04-26 10:55:10,706][39m Trial 97 finished with value: 0.875 and parameters: {'objective': 'CrossEntropy', 'colsample_bylevel': 0.092130638976212, 'depth': 6, 'boosting_type': 'Plain', 'bootstrap_type': 'Bayesian', 'bagging_temperature': 3.6594113747667016}. Best is trial 71 with value: 0.890909090909091.
[32m[I 2023-04-26 10:55:13,207][39m Trial 98 finished with value: 0.875 and parameters: {'objective': 'CrossEntropy', 'colsample_bylevel': 0.09816216301803964, 'depth': 8, 'boosting_type': 'Plain', 'bootstrap_type': 'Bayesian', 'bagging_temperature': 3.8674347917165743}. Best is trial 71 with value: 0.890909090909091.
[32m[I 2023-04-26 10:55:15,139][39m Trial 99 finished with value: 0.8521739130434783 and parameters: {'objective': 'CrossEntropy', 'colsample_bylevel': 0.08992164498989962, 'depth': 7, 'boosting_type': 'Plain', 'bootstrap_type': 'Bayesian', 'bagging_temperature': 3.1138708142775995}. Best is trial 71 with value: 0.890909090909091.
[32m[I 2023-04-26 10:55:17,138][39m Trial 100 finished with value: 0.8672566371681416 and parameters: {'objective': 'CrossEntropy', 'colsample_bylevel': 0.08327315869301935, 'depth': 6, 'boosting_type': 'Plain', 'bootstrap_type': 'Bayesian', 'bagging_temperature': 2.725982250463635}. Best is trial 71 with value: 0.890909090909091.
[32m[I 2023-04-26 10:55:19,026][39m Trial 101 finished with value: 0.8672566371681416 and parameters: {'objective': 'CrossEntropy', 'colsample_bylevel': 0.09220614810827735, 'depth': 6, 'boosting_type': 'Plain', 'bootstrap_type': 'Bayesian', 'bagging_temperature': 1.933022087371062}. Best is trial 71 with value: 0.890909090909091.
[32m[I 2023-04-26 10:55:20,855][39m Trial 102 finished with value: 0.875 and parameters: {'objective': 'CrossEntropy', 'colsample_bylevel': 0.09313870951709383, 'depth': 6, 'boosting_type': 'Plain', 'bootstrap_type': 'Bayesian', 'bagging_temperature': 3.0728784730318726}. Best is trial 71 with value: 0.890909090909091.
[32m[I 2023-04-26 10:55:24,055][39m Trial 103 finished with value: 0.8672566371681416 and parameters: {'objective': 'CrossEntropy', 'colsample_bylevel': 0.08838097770757794, 'depth': 9, 'boosting_type': 'Plain', 'bootstrap_type': 'Bayesian', 'bagging_temperature': 8.503395668886125}. Best is trial 71 with value: 0.890909090909091.
[32m[I 2023-04-26 10:55:25,664][39m Trial 104 finished with value: 0.8545454545454546 and parameters: {'objective': 'CrossEntropy', 'colsample_bylevel': 0.09042363383663032, 'depth': 7, 'boosting_type': 'Plain', 'bootstrap_type': 'Bayesian', 'bagging_temperature': 4.726475340068461}. Best is trial 71 with value: 0.890909090909091.
[32m[I 2023-04-26 10:55:27,422][39m Trial 105 finished with value: 0.8392857142857144 and parameters: {'objective': 'CrossEntropy', 'colsample_bylevel': 0.09492812856553037, 'depth': 7, 'boosting_type': 'Plain', 'bootstrap_type': 'Bayesian', 'bagging_temperature': 3.529919306741011}. Best is trial 71 with value: 0.890909090909091.
[32m[I 2023-04-26 10:55:29,350][39m Trial 106 finished with value: 0.875 and parameters: {'objective': 'CrossEntropy', 'colsample_bylevel': 0.09729851547518135, 'depth': 6, 'boosting_type': 'Plain', 'bootstrap_type': 'Bayesian', 'bagging_temperature': 4.100538552276649}. Best is trial 71 with value: 0.890909090909091.
[32m[I 2023-04-26 10:55:31,543][39m Trial 107 finished with value: 0.875 and parameters: {'objective': 'CrossEntropy', 'colsample_bylevel': 0.0930233374358938, 'depth': 5, 'boosting_type': 'Plain', 'bootstrap_type': 'Bayesian', 'bagging_temperature': 9.177146084901286}. Best is trial 71 with value: 0.890909090909091.
[32m[I 2023-04-26 10:55:34,166][39m Trial 108 finished with value: 0.875 and parameters: {'objective': 'CrossEntropy', 'colsample_bylevel': 0.08593000886410544, 'depth': 8, 'boosting_type': 'Plain', 'bootstrap_type': 'Bayesian', 'bagging_temperature': 3.2933410732948305}. Best is trial 71 with value: 0.890909090909091.
[32m[I 2023-04-26 10:55:36,417][39m Trial 109 finished with value: 0.875 and parameters: {'objective': 'CrossEntropy', 'colsample_bylevel': 0.09832483941030472, 'depth': 8, 'boosting_type': 'Plain', 'bootstrap_type': 'Bayesian', 'bagging_temperature': 3.7142922232886}. Best is trial 71 with value: 0.890909090909091.
[32m[I 2023-04-26 10:55:38,127][39m Trial 110 finished with value: 0.8672566371681416 and parameters: {'objective': 'CrossEntropy', 'colsample_bylevel': 0.09506568959543918, 'depth': 7, 'boosting_type': 'Plain', 'bootstrap_type': 'Bayesian', 'bagging_temperature': 1.5509236040532246}. Best is trial 71 with value: 0.890909090909091.
[32m[I 2023-04-26 10:55:40,137][39m Trial 111 finished with value: 0.8672566371681416 and parameters: {'objective': 'CrossEntropy', 'colsample_bylevel': 0.08799924659630233, 'depth': 6, 'boosting_type': 'Plain', 'bootstrap_type': 'Bayesian', 'bagging_temperature': 9.73639510115667}. Best is trial 71 with value: 0.890909090909091.
[32m[I 2023-04-26 10:55:42,003][39m Trial 112 finished with value: 0.8828828828828829 and parameters: {'objective': 'CrossEntropy', 'colsample_bylevel': 0.09077899806812477, 'depth': 7, 'boosting_type': 'Plain', 'bootstrap_type': 'Bayesian', 'bagging_temperature': 2.102382913574613}. Best is trial 71 with value: 0.890909090909091.
[32m[I 2023-04-26 10:55:43,960][39m Trial 113 finished with value: 0.8672566371681416 and parameters: {'objective': 'CrossEntropy', 'colsample_bylevel': 0.08978906448063194, 'depth': 7, 'boosting_type': 'Plain', 'bootstrap_type': 'Bayesian', 'bagging_temperature': 7.448352041294466}. Best is trial 71 with value: 0.890909090909091.
[32m[I 2023-04-26 10:55:45,929][39m Trial 114 finished with value: 0.875 and parameters: {'objective': 'CrossEntropy', 'colsample_bylevel': 0.09619176155615833, 'depth': 7, 'boosting_type': 'Plain', 'bootstrap_type': 'Bayesian', 'bagging_temperature': 2.5270360237826734}. Best is trial 71 with value: 0.890909090909091.
[32m[I 2023-04-26 10:55:48,031][39m Trial 115 finished with value: 0.875 and parameters: {'objective': 'CrossEntropy', 'colsample_bylevel': 0.09340451376656023, 'depth': 5, 'boosting_type': 'Plain', 'bootstrap_type': 'Bayesian', 'bagging_temperature': 4.31905706863952}. Best is trial 71 with value: 0.890909090909091.
[32m[I 2023-04-26 10:55:50,125][39m Trial 116 finished with value: 0.8596491228070176 and parameters: {'objective': 'CrossEntropy', 'colsample_bylevel': 0.08193314898215394, 'depth': 6, 'boosting_type': 'Plain', 'bootstrap_type': 'Bayesian', 'bagging_temperature': 8.377321046104722}. Best is trial 71 with value: 0.890909090909091.
[32m[I 2023-04-26 10:55:52,735][39m Trial 117 finished with value: 0.875 and parameters: {'objective': 'CrossEntropy', 'colsample_bylevel': 0.09989781926877848, 'depth': 9, 'boosting_type': 'Plain', 'bootstrap_type': 'Bayesian', 'bagging_temperature': 2.8633932781071465}. Best is trial 71 with value: 0.890909090909091.
[32m[I 2023-04-26 10:55:54,454][39m Trial 118 finished with value: 0.8828828828828829 and parameters: {'objective': 'CrossEntropy', 'colsample_bylevel': 0.09108071612342941, 'depth': 7, 'boosting_type': 'Plain', 'bootstrap_type': 'Bayesian', 'bagging_temperature': 4.809037143126286}. Best is trial 71 with value: 0.890909090909091.
[32m[I 2023-04-26 10:55:56,118][39m Trial 119 finished with value: 0.8545454545454546 and parameters: {'objective': 'CrossEntropy', 'colsample_bylevel': 0.09141243352636629, 'depth': 7, 'boosting_type': 'Plain', 'bootstrap_type': 'Bayesian', 'bagging_temperature': 5.322019560287797}. Best is trial 71 with value: 0.890909090909091.
[32m[I 2023-04-26 10:55:57,849][39m Trial 120 finished with value: 0.875 and parameters: {'objective': 'CrossEntropy', 'colsample_bylevel': 0.07796711134484527, 'depth': 6, 'boosting_type': 'Plain', 'bootstrap_type': 'Bayesian', 'bagging_temperature': 1.6254591052348644}. Best is trial 71 with value: 0.890909090909091.
[32m[I 2023-04-26 10:55:59,909][39m Trial 121 finished with value: 0.8672566371681416 and parameters: {'objective': 'CrossEntropy', 'colsample_bylevel': 0.08418240204859127, 'depth': 7, 'boosting_type': 'Plain', 'bootstrap_type': 'Bayesian', 'bagging_temperature': 3.943286395406174}. Best is trial 71 with value: 0.890909090909091.
[32m[I 2023-04-26 10:56:02,248][39m Trial 122 finished with value: 0.8828828828828829 and parameters: {'objective': 'CrossEntropy', 'colsample_bylevel': 0.08669933796520453, 'depth': 8, 'boosting_type': 'Plain', 'bootstrap_type': 'Bayesian', 'bagging_temperature': 2.0812881289967953}. Best is trial 71 with value: 0.890909090909091.
[32m[I 2023-04-26 10:56:04,085][39m Trial 123 finished with value: 0.8672566371681416 and parameters: {'objective': 'CrossEntropy', 'colsample_bylevel': 0.09347736221753242, 'depth': 6, 'boosting_type': 'Plain', 'bootstrap_type': 'Bayesian', 'bagging_temperature': 2.421288750344387}. Best is trial 71 with value: 0.890909090909091.
[32m[I 2023-04-26 10:56:06,689][39m Trial 124 finished with value: 0.8828828828828829 and parameters: {'objective': 'CrossEntropy', 'colsample_bylevel': 0.08694693589804517, 'depth': 8, 'boosting_type': 'Plain', 'bootstrap_type': 'Bayesian', 'bagging_temperature': 3.2194623063784054}. Best is trial 71 with value: 0.890909090909091.
[32m[I 2023-04-26 10:56:09,360][39m Trial 125 finished with value: 0.875 and parameters: {'objective': 'CrossEntropy', 'colsample_bylevel': 0.08520869464091457, 'depth': 8, 'boosting_type': 'Plain', 'bootstrap_type': 'Bayesian', 'bagging_temperature': 3.111362685446075}. Best is trial 71 with value: 0.890909090909091.
[32m[I 2023-04-26 10:56:11,223][39m Trial 126 finished with value: 0.8672566371681416 and parameters: {'objective': 'CrossEntropy', 'colsample_bylevel': 0.09117241455360785, 'depth': 7, 'boosting_type': 'Plain', 'bootstrap_type': 'Bayesian', 'bagging_temperature': 1.2893928123881868}. Best is trial 71 with value: 0.890909090909091.
[32m[I 2023-04-26 10:56:13,273][39m Trial 127 finished with value: 0.875 and parameters: {'objective': 'CrossEntropy', 'colsample_bylevel': 0.08929042811686558, 'depth': 8, 'boosting_type': 'Plain', 'bootstrap_type': 'Bayesian', 'bagging_temperature': 2.1281107210379813}. Best is trial 71 with value: 0.890909090909091.
[32m[I 2023-04-26 10:56:15,079][39m Trial 128 finished with value: 0.8596491228070176 and parameters: {'objective': 'Logloss', 'colsample_bylevel': 0.07033889960894256, 'depth': 10, 'boosting_type': 'Plain', 'bootstrap_type': 'Bayesian', 'bagging_temperature': 6.674562216122276}. Best is trial 71 with value: 0.890909090909091.
[32m[I 2023-04-26 10:56:17,408][39m Trial 129 finished with value: 0.8596491228070176 and parameters: {'objective': 'CrossEntropy', 'colsample_bylevel': 0.08727705949931698, 'depth': 8, 'boosting_type': 'Plain', 'bootstrap_type': 'Bayesian', 'bagging_temperature': 4.690102322329833}. Best is trial 71 with value: 0.890909090909091.
[32m[I 2023-04-26 10:56:19,228][39m Trial 130 finished with value: 0.875 and parameters: {'objective': 'CrossEntropy', 'colsample_bylevel': 0.09646833491061307, 'depth': 7, 'boosting_type': 'Plain', 'bootstrap_type': 'Bernoulli', 'subsample': 0.32773877946202995}. Best is trial 71 with value: 0.890909090909091.
[32m[I 2023-04-26 10:56:21,061][39m Trial 131 finished with value: 0.8828828828828829 and parameters: {'objective': 'CrossEntropy', 'colsample_bylevel': 0.09426339409354942, 'depth': 6, 'boosting_type': 'Plain', 'bootstrap_type': 'Bayesian', 'bagging_temperature': 3.6623627032984656}. Best is trial 71 with value: 0.890909090909091.
[32m[I 2023-04-26 10:56:22,776][39m Trial 132 finished with value: 0.8828828828828829 and parameters: {'objective': 'CrossEntropy', 'colsample_bylevel': 0.09422610298287307, 'depth': 6, 'boosting_type': 'Plain', 'bootstrap_type': 'Bayesian', 'bagging_temperature': 3.618699880190806}. Best is trial 71 with value: 0.890909090909091.
[32m[I 2023-04-26 10:56:24,978][39m Trial 133 finished with value: 0.875 and parameters: {'objective': 'CrossEntropy', 'colsample_bylevel': 0.09545203210751636, 'depth': 6, 'boosting_type': 'Plain', 'bootstrap_type': 'Bayesian', 'bagging_temperature': 9.094225281444738}. Best is trial 71 with value: 0.890909090909091.
[32m[I 2023-04-26 10:56:27,082][39m Trial 134 finished with value: 0.8828828828828829 and parameters: {'objective': 'CrossEntropy', 'colsample_bylevel': 0.09081524575891985, 'depth': 7, 'boosting_type': 'Plain', 'bootstrap_type': 'Bayesian', 'bagging_temperature': 4.926984546265612}. Best is trial 71 with value: 0.890909090909091.
[32m[I 2023-04-26 10:56:28,575][39m Trial 135 finished with value: 0.875 and parameters: {'objective': 'CrossEntropy', 'colsample_bylevel': 0.05064544228223289, 'depth': 5, 'boosting_type': 'Plain', 'bootstrap_type': 'Bayesian', 'bagging_temperature': 4.418971825233488}. Best is trial 71 with value: 0.890909090909091.
