[32m[I 2023-04-26 10:58:51,861][39m Trial 202 finished with value: 0.890909090909091 and parameters: {'objective': 'CrossEntropy', 'colsample_bylevel': 0.09511587121161412, 'depth': 5, 'boosting_type': 'Plain', 'bootstrap_type': 'Bayesian', 'bagging_temperature': 3.641307163052722}. Best is trial 71 with value: 0.890909090909091.
[32m[I 2023-04-26 10:58:53,624][39m Trial 203 finished with value: 0.875 and parameters: {'objective': 'CrossEntropy', 'colsample_bylevel': 0.09359969427497211, 'depth': 5, 'boosting_type': 'Plain', 'bootstrap_type': 'Bayesian', 'bagging_temperature': 3.662627096866458}. Best is trial 71 with value: 0.890909090909091.
[32m[I 2023-04-26 10:58:55,770][39m Trial 204 finished with value: 0.8672566371681416 and parameters: {'objective': 'CrossEntropy', 'colsample_bylevel': 0.09710637314730569, 'depth': 5, 'boosting_type': 'Plain', 'bootstrap_type': 'Bayesian', 'bagging_temperature': 2.13134409257401}. Best is trial 71 with value: 0.890909090909091.
[32m[I 2023-04-26 10:58:57,931][39m Trial 205 finished with value: 0.8521739130434783 and parameters: {'objective': 'CrossEntropy', 'colsample_bylevel': 0.09883775656476451, 'depth': 4, 'boosting_type': 'Plain', 'bootstrap_type': 'Bayesian', 'bagging_temperature': 3.153465752297385}. Best is trial 71 with value: 0.890909090909091.
[32m[I 2023-04-26 10:58:59,896][39m Trial 206 finished with value: 0.8672566371681416 and parameters: {'objective': 'CrossEntropy', 'colsample_bylevel': 0.08997049881848974, 'depth': 7, 'boosting_type': 'Plain', 'bootstrap_type': 'Bayesian', 'bagging_temperature': 3.330096406421064}. Best is trial 71 with value: 0.890909090909091.
[32m[I 2023-04-26 10:59:02,078][39m Trial 207 finished with value: 0.8828828828828829 and parameters: {'objective': 'CrossEntropy', 'colsample_bylevel': 0.09156678274817392, 'depth': 6, 'boosting_type': 'Plain', 'bootstrap_type': 'Bayesian', 'bagging_temperature': 3.6719862754687367}. Best is trial 71 with value: 0.890909090909091.
[32m[I 2023-04-26 10:59:03,980][39m Trial 208 finished with value: 0.8672566371681416 and parameters: {'objective': 'CrossEntropy', 'colsample_bylevel': 0.09481332832415339, 'depth': 6, 'boosting_type': 'Plain', 'bootstrap_type': 'Bayesian', 'bagging_temperature': 3.7204825164306365}. Best is trial 71 with value: 0.890909090909091.
[32m[I 2023-04-26 10:59:05,724][39m Trial 209 finished with value: 0.8672566371681416 and parameters: {'objective': 'CrossEntropy', 'colsample_bylevel': 0.09998903969113683, 'depth': 5, 'boosting_type': 'Plain', 'bootstrap_type': 'Bayesian', 'bagging_temperature': 3.4550104211318207}. Best is trial 71 with value: 0.890909090909091.
[32m[I 2023-04-26 10:59:07,577][39m Trial 210 finished with value: 0.875 and parameters: {'objective': 'CrossEntropy', 'colsample_bylevel': 0.09661426827222892, 'depth': 7, 'boosting_type': 'Plain', 'bootstrap_type': 'Bernoulli', 'subsample': 0.2821772708944697}. Best is trial 71 with value: 0.890909090909091.
[32m[I 2023-04-26 10:59:09,257][39m Trial 211 finished with value: 0.8672566371681416 and parameters: {'objective': 'CrossEntropy', 'colsample_bylevel': 0.09281485995522967, 'depth': 7, 'boosting_type': 'Plain', 'bootstrap_type': 'Bernoulli', 'subsample': 0.3885513188206915}. Best is trial 71 with value: 0.890909090909091.
[32m[I 2023-04-26 10:59:11,347][39m Trial 212 finished with value: 0.8828828828828829 and parameters: {'objective': 'CrossEntropy', 'colsample_bylevel': 0.09390738278305809, 'depth': 6, 'boosting_type': 'Plain', 'bootstrap_type': 'Bernoulli', 'subsample': 0.20224038369076702}. Best is trial 71 with value: 0.890909090909091.
[32m[I 2023-04-26 10:59:13,041][39m Trial 213 finished with value: 0.8596491228070176 and parameters: {'objective': 'CrossEntropy', 'colsample_bylevel': 0.09173840003267238, 'depth': 6, 'boosting_type': 'Plain', 'bootstrap_type': 'Bernoulli', 'subsample': 0.21430096497209267}. Best is trial 71 with value: 0.890909090909091.
[32m[I 2023-04-26 10:59:14,595][39m Trial 214 finished with value: 0.8596491228070176 and parameters: {'objective': 'CrossEntropy', 'colsample_bylevel': 0.046790658215286905, 'depth': 7, 'boosting_type': 'Plain', 'bootstrap_type': 'MVS'}. Best is trial 71 with value: 0.890909090909091.
[32m[I 2023-04-26 10:59:16,931][39m Trial 215 finished with value: 0.875 and parameters: {'objective': 'CrossEntropy', 'colsample_bylevel': 0.0894721269967447, 'depth': 7, 'boosting_type': 'Plain', 'bootstrap_type': 'Bayesian', 'bagging_temperature': 2.8459277045981177}. Best is trial 71 with value: 0.890909090909091.
[32m[I 2023-04-26 10:59:18,650][39m Trial 216 finished with value: 0.875 and parameters: {'objective': 'CrossEntropy', 'colsample_bylevel': 0.09431101080232866, 'depth': 6, 'boosting_type': 'Plain', 'bootstrap_type': 'Bayesian', 'bagging_temperature': 2.399055394771641}. Best is trial 71 with value: 0.890909090909091.
[32m[I 2023-04-26 10:59:20,153][39m Trial 217 finished with value: 0.8828828828828829 and parameters: {'objective': 'CrossEntropy', 'colsample_bylevel': 0.09600476516774631, 'depth': 10, 'boosting_type': 'Plain', 'bootstrap_type': 'Bernoulli', 'subsample': 0.6582075050631496}. Best is trial 71 with value: 0.890909090909091.
[32m[I 2023-04-26 10:59:25,145][39m Trial 218 finished with value: 0.875 and parameters: {'objective': 'CrossEntropy', 'colsample_bylevel': 0.0961470703727967, 'depth': 10, 'boosting_type': 'Ordered', 'bootstrap_type': 'Bayesian', 'bagging_temperature': 3.9637282616276845}. Best is trial 71 with value: 0.890909090909091.
[32m[I 2023-04-26 10:59:27,609][39m Trial 219 finished with value: 0.8672566371681416 and parameters: {'objective': 'CrossEntropy', 'colsample_bylevel': 0.08694355968334073, 'depth': 10, 'boosting_type': 'Plain', 'bootstrap_type': 'Bayesian', 'bagging_temperature': 4.246810489177988}. Best is trial 71 with value: 0.890909090909091.
[32m[I 2023-04-26 10:59:29,682][39m Trial 220 finished with value: 0.8596491228070176 and parameters: {'objective': 'Logloss', 'colsample_bylevel': 0.08514213378466846, 'depth': 5, 'boosting_type': 'Plain', 'bootstrap_type': 'Bayesian', 'bagging_temperature': 1.4661441020732504}. Best is trial 71 with value: 0.890909090909091.
[32m[I 2023-04-26 10:59:31,717][39m Trial 221 finished with value: 0.8672566371681416 and parameters: {'objective': 'CrossEntropy', 'colsample_bylevel': 0.08367138404498421, 'depth': 6, 'boosting_type': 'Plain', 'bootstrap_type': 'Bayesian', 'bagging_temperature': 1.9695455888265105}. Best is trial 71 with value: 0.890909090909091.
[32m[I 2023-04-26 10:59:33,785][39m Trial 222 finished with value: 0.8672566371681416 and parameters: {'objective': 'CrossEntropy', 'colsample_bylevel': 0.08653959571081207, 'depth': 6, 'boosting_type': 'Plain', 'bootstrap_type': 'Bayesian', 'bagging_temperature': 3.2212349035954366}. Best is trial 71 with value: 0.890909090909091.
[32m[I 2023-04-26 10:59:35,787][39m Trial 223 finished with value: 0.8521739130434783 and parameters: {'objective': 'CrossEntropy', 'colsample_bylevel': 0.08823261739866149, 'depth': 6, 'boosting_type': 'Plain', 'bootstrap_type': 'Bayesian', 'bagging_temperature': 3.428372779109631}. Best is trial 71 with value: 0.890909090909091.
[32m[I 2023-04-26 10:59:37,698][39m Trial 224 finished with value: 0.875 and parameters: {'objective': 'CrossEntropy', 'colsample_bylevel': 0.09149702526496181, 'depth': 7, 'boosting_type': 'Plain', 'bootstrap_type': 'Bayesian', 'bagging_temperature': 2.7107212978090844}. Best is trial 71 with value: 0.890909090909091.
[32m[I 2023-04-26 10:59:39,454][39m Trial 225 finished with value: 0.875 and parameters: {'objective': 'CrossEntropy', 'colsample_bylevel': 0.09281095858106893, 'depth': 6, 'boosting_type': 'Plain', 'bootstrap_type': 'Bayesian', 'bagging_temperature': 3.5914099534630766}. Best is trial 71 with value: 0.890909090909091.
[32m[I 2023-04-26 10:59:41,457][39m Trial 226 finished with value: 0.8828828828828829 and parameters: {'objective': 'CrossEntropy', 'colsample_bylevel': 0.09490689858791763, 'depth': 7, 'boosting_type': 'Plain', 'bootstrap_type': 'Bayesian', 'bagging_temperature': 3.8621942429743457}. Best is trial 71 with value: 0.890909090909091.
[32m[I 2023-04-26 10:59:43,548][39m Trial 227 finished with value: 0.8672566371681416 and parameters: {'objective': 'CrossEntropy', 'colsample_bylevel': 0.09007090932421136, 'depth': 7, 'boosting_type': 'Plain', 'bootstrap_type': 'Bayesian', 'bagging_temperature': 9.296497813046955}. Best is trial 71 with value: 0.890909090909091.
[32m[I 2023-04-26 10:59:45,557][39m Trial 228 finished with value: 0.875 and parameters: {'objective': 'CrossEntropy', 'colsample_bylevel': 0.09167858799794343, 'depth': 7, 'boosting_type': 'Plain', 'bootstrap_type': 'Bayesian', 'bagging_temperature': 2.265749188213177}. Best is trial 71 with value: 0.890909090909091.
[32m[I 2023-04-26 10:59:48,551][39m Trial 229 finished with value: 0.8828828828828829 and parameters: {'objective': 'CrossEntropy', 'colsample_bylevel': 0.08673046247750016, 'depth': 8, 'boosting_type': 'Plain', 'bootstrap_type': 'Bayesian', 'bagging_temperature': 2.5059263296121848}. Best is trial 71 with value: 0.890909090909091.
[32m[I 2023-04-26 10:59:50,152][39m Trial 230 finished with value: 0.875 and parameters: {'objective': 'CrossEntropy', 'colsample_bylevel': 0.09359859050187178, 'depth': 5, 'boosting_type': 'Plain', 'bootstrap_type': 'Bayesian', 'bagging_temperature': 1.1759055192694334}. Best is trial 71 with value: 0.890909090909091.
[32m[I 2023-04-26 10:59:52,300][39m Trial 231 finished with value: 0.875 and parameters: {'objective': 'CrossEntropy', 'colsample_bylevel': 0.09054436861168, 'depth': 7, 'boosting_type': 'Plain', 'bootstrap_type': 'Bayesian', 'bagging_temperature': 3.6606598517279436}. Best is trial 71 with value: 0.890909090909091.
[32m[I 2023-04-26 10:59:55,137][39m Trial 232 finished with value: 0.8672566371681416 and parameters: {'objective': 'CrossEntropy', 'colsample_bylevel': 0.08840802098505834, 'depth': 8, 'boosting_type': 'Plain', 'bootstrap_type': 'Bayesian', 'bagging_temperature': 6.152334601016859}. Best is trial 71 with value: 0.890909090909091.
[32m[I 2023-04-26 10:59:56,839][39m Trial 233 finished with value: 0.875 and parameters: {'objective': 'CrossEntropy', 'colsample_bylevel': 0.08487668436718264, 'depth': 6, 'boosting_type': 'Plain', 'bootstrap_type': 'Bayesian', 'bagging_temperature': 1.6384230601878431}. Best is trial 71 with value: 0.890909090909091.
[32m[I 2023-04-26 10:59:58,767][39m Trial 234 finished with value: 0.875 and parameters: {'objective': 'CrossEntropy', 'colsample_bylevel': 0.07714500624086593, 'depth': 6, 'boosting_type': 'Plain', 'bootstrap_type': 'Bayesian', 'bagging_temperature': 8.809747367655888}. Best is trial 71 with value: 0.890909090909091.
[32m[I 2023-04-26 11:00:01,331][39m Trial 235 finished with value: 0.8672566371681416 and parameters: {'objective': 'CrossEntropy', 'colsample_bylevel': 0.08669052881746976, 'depth': 8, 'boosting_type': 'Plain', 'bootstrap_type': 'Bayesian', 'bagging_temperature': 2.5311921303603904}. Best is trial 71 with value: 0.890909090909091.
[32m[I 2023-04-26 11:00:03,881][39m Trial 236 finished with value: 0.875 and parameters: {'objective': 'CrossEntropy', 'colsample_bylevel': 0.09745409737044565, 'depth': 6, 'boosting_type': 'Plain', 'bootstrap_type': 'Bayesian', 'bagging_temperature': 3.3522071826238387}. Best is trial 71 with value: 0.890909090909091.
[32m[I 2023-04-26 11:00:06,695][39m Trial 237 finished with value: 0.8828828828828829 and parameters: {'objective': 'CrossEntropy', 'colsample_bylevel': 0.08996262355079292, 'depth': 7, 'boosting_type': 'Plain', 'bootstrap_type': 'Bayesian', 'bagging_temperature': 2.9637190557153983}. Best is trial 71 with value: 0.890909090909091.
[32m[I 2023-04-26 11:00:09,239][39m Trial 238 finished with value: 0.8545454545454546 and parameters: {'objective': 'CrossEntropy', 'colsample_bylevel': 0.09227067021463618, 'depth': 7, 'boosting_type': 'Plain', 'bootstrap_type': 'Bayesian', 'bagging_temperature': 3.780240511018361}. Best is trial 71 with value: 0.890909090909091.
[32m[I 2023-04-26 11:00:11,560][39m Trial 239 finished with value: 0.875 and parameters: {'objective': 'CrossEntropy', 'colsample_bylevel': 0.09541936767394205, 'depth': 10, 'boosting_type': 'Plain', 'bootstrap_type': 'Bernoulli', 'subsample': 0.18773116456461691}. Best is trial 71 with value: 0.890909090909091.
[32m[I 2023-04-26 11:00:14,383][39m Trial 240 finished with value: 0.8672566371681416 and parameters: {'objective': 'Logloss', 'colsample_bylevel': 0.09571139931729192, 'depth': 10, 'boosting_type': 'Plain', 'bootstrap_type': 'Bernoulli', 'subsample': 0.6838884603812451}. Best is trial 71 with value: 0.890909090909091.
[32m[I 2023-04-26 11:00:18,584][39m Trial 241 finished with value: 0.875 and parameters: {'objective': 'CrossEntropy', 'colsample_bylevel': 0.09710044865659671, 'depth': 9, 'boosting_type': 'Plain', 'bootstrap_type': 'Bernoulli', 'subsample': 0.3804076837896385}. Best is trial 71 with value: 0.890909090909091.
[32m[I 2023-04-26 11:00:20,638][39m Trial 242 finished with value: 0.8521739130434783 and parameters: {'objective': 'CrossEntropy', 'colsample_bylevel': 0.08873824511184662, 'depth': 7, 'boosting_type': 'Plain', 'bootstrap_type': 'Bayesian', 'bagging_temperature': 5.184325721287888}. Best is trial 71 with value: 0.890909090909091.
[32m[I 2023-04-26 11:00:22,459][39m Trial 243 finished with value: 0.8672566371681416 and parameters: {'objective': 'CrossEntropy', 'colsample_bylevel': 0.0948107750551665, 'depth': 7, 'boosting_type': 'Plain', 'bootstrap_type': 'Bernoulli', 'subsample': 0.6612257693285941}. Best is trial 71 with value: 0.890909090909091.
[32m[I 2023-04-26 11:00:24,370][39m Trial 244 finished with value: 0.8672566371681416 and parameters: {'objective': 'CrossEntropy', 'colsample_bylevel': 0.09352621674411328, 'depth': 7, 'boosting_type': 'Plain', 'bootstrap_type': 'Bernoulli', 'subsample': 0.1726785630471017}. Best is trial 71 with value: 0.890909090909091.
[32m[I 2023-04-26 11:00:26,512][39m Trial 245 finished with value: 0.875 and parameters: {'objective': 'CrossEntropy', 'colsample_bylevel': 0.0815794242299481, 'depth': 7, 'boosting_type': 'Plain', 'bootstrap_type': 'Bayesian', 'bagging_temperature': 2.006797438470864}. Best is trial 71 with value: 0.890909090909091.
[32m[I 2023-04-26 11:00:28,315][39m Trial 246 finished with value: 0.875 and parameters: {'objective': 'CrossEntropy', 'colsample_bylevel': 0.09110565087312898, 'depth': 7, 'boosting_type': 'Plain', 'bootstrap_type': 'Bayesian', 'bagging_temperature': 1.8638055592143967}. Best is trial 71 with value: 0.890909090909091.
[32m[I 2023-04-26 11:00:29,972][39m Trial 247 finished with value: 0.8596491228070176 and parameters: {'objective': 'CrossEntropy', 'colsample_bylevel': 0.09258437937923678, 'depth': 6, 'boosting_type': 'Plain', 'bootstrap_type': 'Bernoulli', 'subsample': 0.4781871858973217}. Best is trial 71 with value: 0.890909090909091.
[32m[I 2023-04-26 11:00:31,971][39m Trial 248 finished with value: 0.8596491228070176 and parameters: {'objective': 'CrossEntropy', 'colsample_bylevel': 0.07972703815312422, 'depth': 6, 'boosting_type': 'Plain', 'bootstrap_type': 'Bayesian', 'bagging_temperature': 3.614982252571013}. Best is trial 71 with value: 0.890909090909091.
[32m[I 2023-04-26 11:00:33,887][39m Trial 249 finished with value: 0.8672566371681416 and parameters: {'objective': 'CrossEntropy', 'colsample_bylevel': 0.07161181910947706, 'depth': 7, 'boosting_type': 'Plain', 'bootstrap_type': 'Bayesian', 'bagging_temperature': 2.162822515953345}. Best is trial 71 with value: 0.890909090909091.
[32m[I 2023-04-26 11:00:36,183][39m Trial 250 finished with value: 0.875 and parameters: {'objective': 'CrossEntropy', 'colsample_bylevel': 0.09175377545889406, 'depth': 7, 'boosting_type': 'Plain', 'bootstrap_type': 'Bayesian', 'bagging_temperature': 2.2849961370316305}. Best is trial 71 with value: 0.890909090909091.
[32m[I 2023-04-26 11:00:37,849][39m Trial 251 finished with value: 0.8495575221238938 and parameters: {'objective': 'CrossEntropy', 'colsample_bylevel': 0.09442752440752848, 'depth': 6, 'boosting_type': 'Plain', 'bootstrap_type': 'MVS'}. Best is trial 71 with value: 0.890909090909091.
[32m[I 2023-04-26 11:00:44,265][39m Trial 252 finished with value: 0.8672566371681416 and parameters: {'objective': 'CrossEntropy', 'colsample_bylevel': 0.09726611306352828, 'depth': 6, 'boosting_type': 'Ordered', 'bootstrap_type': 'Bayesian', 'bagging_temperature': 3.7690306615560667}. Best is trial 71 with value: 0.890909090909091.
[32m[I 2023-04-26 11:00:46,738][39m Trial 253 finished with value: 0.875 and parameters: {'objective': 'CrossEntropy', 'colsample_bylevel': 0.09467829788031097, 'depth': 5, 'boosting_type': 'Plain', 'bootstrap_type': 'Bayesian', 'bagging_temperature': 3.805730823587432}. Best is trial 71 with value: 0.890909090909091.
[32m[I 2023-04-26 11:00:48,663][39m Trial 254 finished with value: 0.8672566371681416 and parameters: {'objective': 'CrossEntropy', 'colsample_bylevel': 0.09605191569786105, 'depth': 10, 'boosting_type': 'Plain', 'bootstrap_type': 'Bernoulli', 'subsample': 0.9032286235710543}. Best is trial 71 with value: 0.890909090909091.
[32m[I 2023-04-26 11:00:50,052][39m Trial 255 finished with value: 0.8347826086956522 and parameters: {'objective': 'CrossEntropy', 'colsample_bylevel': 0.03132982314269823, 'depth': 7, 'boosting_type': 'Plain', 'bootstrap_type': 'Bernoulli', 'subsample': 0.31023265151034507}. Best is trial 71 with value: 0.890909090909091.
[32m[I 2023-04-26 11:00:52,166][39m Trial 256 finished with value: 0.8828828828828829 and parameters: {'objective': 'CrossEntropy', 'colsample_bylevel': 0.09861114524270069, 'depth': 7, 'boosting_type': 'Plain', 'bootstrap_type': 'Bernoulli', 'subsample': 0.3925050906149691}. Best is trial 71 with value: 0.890909090909091.
[32m[I 2023-04-26 11:00:54,587][39m Trial 257 finished with value: 0.8596491228070176 and parameters: {'objective': 'Logloss', 'colsample_bylevel': 0.09364678714030407, 'depth': 11, 'boosting_type': 'Plain', 'bootstrap_type': 'Bernoulli', 'subsample': 0.8173997174892839}. Best is trial 71 with value: 0.890909090909091.
[32m[I 2023-04-26 11:00:56,918][39m Trial 258 finished with value: 0.8596491228070176 and parameters: {'objective': 'CrossEntropy', 'colsample_bylevel': 0.06816890391136353, 'depth': 8, 'boosting_type': 'Plain', 'bootstrap_type': 'Bernoulli', 'subsample': 0.4048091469011206}. Best is trial 71 with value: 0.890909090909091.
[32m[I 2023-04-26 11:00:58,627][39m Trial 259 finished with value: 0.8596491228070176 and parameters: {'objective': 'CrossEntropy', 'colsample_bylevel': 0.08383900447430409, 'depth': 10, 'boosting_type': 'Plain', 'bootstrap_type': 'Bernoulli', 'subsample': 0.6594388870914911}. Best is trial 71 with value: 0.890909090909091.
[32m[I 2023-04-26 11:01:00,838][39m Trial 260 finished with value: 0.875 and parameters: {'objective': 'CrossEntropy', 'colsample_bylevel': 0.09323861380218994, 'depth': 4, 'boosting_type': 'Plain', 'bootstrap_type': 'Bayesian', 'bagging_temperature': 4.002882899550041}. Best is trial 71 with value: 0.890909090909091.
[32m[I 2023-04-26 11:01:02,674][39m Trial 261 finished with value: 0.8672566371681416 and parameters: {'objective': 'CrossEntropy', 'colsample_bylevel': 0.08762611155201261, 'depth': 2, 'boosting_type': 'Plain', 'bootstrap_type': 'Bayesian', 'bagging_temperature': 2.7504472707045453}. Best is trial 71 with value: 0.890909090909091.
[32m[I 2023-04-26 11:01:04,401][39m Trial 262 finished with value: 0.8596491228070176 and parameters: {'objective': 'CrossEntropy', 'colsample_bylevel': 0.09577426401818355, 'depth': 7, 'boosting_type': 'Plain', 'bootstrap_type': 'Bernoulli', 'subsample': 0.5081655460547017}. Best is trial 71 with value: 0.890909090909091.
[32m[I 2023-04-26 11:01:05,927][39m Trial 263 finished with value: 0.8828828828828829 and parameters: {'objective': 'CrossEntropy', 'colsample_bylevel': 0.09973723975624448, 'depth': 7, 'boosting_type': 'Plain', 'bootstrap_type': 'Bayesian', 'bagging_temperature': 2.528362589479638}. Best is trial 71 with value: 0.890909090909091.
[32m[I 2023-04-26 11:01:08,778][39m Trial 264 finished with value: 0.8828828828828829 and parameters: {'objective': 'CrossEntropy', 'colsample_bylevel': 0.09736280364235485, 'depth': 8, 'boosting_type': 'Plain', 'bootstrap_type': 'Bayesian', 'bagging_temperature': 8.179002794293103}. Best is trial 71 with value: 0.890909090909091.
[32m[I 2023-04-26 11:01:10,881][39m Trial 265 finished with value: 0.8672566371681416 and parameters: {'objective': 'CrossEntropy', 'colsample_bylevel': 0.0975375080318632, 'depth': 7, 'boosting_type': 'Plain', 'bootstrap_type': 'Bayesian', 'bagging_temperature': 4.427930943470169}. Best is trial 71 with value: 0.890909090909091.
[32m[I 2023-04-26 11:01:13,116][39m Trial 266 finished with value: 0.8672566371681416 and parameters: {'objective': 'CrossEntropy', 'colsample_bylevel': 0.08997942130917203, 'depth': 6, 'boosting_type': 'Plain', 'bootstrap_type': 'Bayesian', 'bagging_temperature': 1.7539566614830164}. Best is trial 71 with value: 0.890909090909091.
[32m[I 2023-04-26 11:01:15,369][39m Trial 267 finished with value: 0.875 and parameters: {'objective': 'Logloss', 'colsample_bylevel': 0.09177814947186774, 'depth': 5, 'boosting_type': 'Plain', 'bootstrap_type': 'Bayesian', 'bagging_temperature': 4.0409112751594645}. Best is trial 71 with value: 0.890909090909091.
[32m[I 2023-04-26 11:01:17,335][39m Trial 268 finished with value: 0.8672566371681416 and parameters: {'objective': 'CrossEntropy', 'colsample_bylevel': 0.08555009760517544, 'depth': 6, 'boosting_type': 'Plain', 'bootstrap_type': 'Bayesian', 'bagging_temperature': 9.013746908760027}. Best is trial 71 with value: 0.890909090909091.
