[32m[I 2023-04-26 10:56:30,163][39m Trial 136 finished with value: 0.875 and parameters: {'objective': 'CrossEntropy', 'colsample_bylevel': 0.08960938914458078, 'depth': 7, 'boosting_type': 'Plain', 'bootstrap_type': 'Bayesian', 'bagging_temperature': 1.0647359867082749}. Best is trial 71 with value: 0.890909090909091.
[32m[I 2023-04-26 10:56:33,428][39m Trial 137 finished with value: 0.875 and parameters: {'objective': 'Logloss', 'colsample_bylevel': 0.09277799451851684, 'depth': 9, 'boosting_type': 'Plain', 'bootstrap_type': 'Bayesian', 'bagging_temperature': 1.8408147770406007}. Best is trial 71 with value: 0.890909090909091.
[32m[I 2023-04-26 10:56:35,382][39m Trial 138 finished with value: 0.8596491228070176 and parameters: {'objective': 'CrossEntropy', 'colsample_bylevel': 0.08813477475168265, 'depth': 4, 'boosting_type': 'Plain', 'bootstrap_type': 'Bayesian', 'bagging_temperature': 2.6972947604029294}. Best is trial 71 with value: 0.890909090909091.
[32m[I 2023-04-26 10:56:37,647][39m Trial 139 finished with value: 0.8495575221238938 and parameters: {'objective': 'CrossEntropy', 'colsample_bylevel': 0.08086528843052859, 'depth': 8, 'boosting_type': 'Plain', 'bootstrap_type': 'MVS'}. Best is trial 71 with value: 0.890909090909091.
[32m[I 2023-04-26 10:56:38,992][39m Trial 140 finished with value: 0.8571428571428572 and parameters: {'objective': 'CrossEntropy', 'colsample_bylevel': 0.03650405428568365, 'depth': 6, 'boosting_type': 'Plain', 'bootstrap_type': 'Bayesian', 'bagging_temperature': 3.7177698634282574}. Best is trial 71 with value: 0.890909090909091.
[32m[I 2023-04-26 10:56:40,706][39m Trial 141 finished with value: 0.875 and parameters: {'objective': 'CrossEntropy', 'colsample_bylevel': 0.08606001574936176, 'depth': 7, 'boosting_type': 'Plain', 'bootstrap_type': 'Bayesian', 'bagging_temperature': 3.4375748586826673}. Best is trial 71 with value: 0.890909090909091.
[32m[I 2023-04-26 10:56:42,538][39m Trial 142 finished with value: 0.875 and parameters: {'objective': 'CrossEntropy', 'colsample_bylevel': 0.08325082932059281, 'depth': 10, 'boosting_type': 'Plain', 'bootstrap_type': 'Bayesian', 'bagging_temperature': 3.24467599473731}. Best is trial 71 with value: 0.890909090909091.
[32m[I 2023-04-26 10:56:44,913][39m Trial 143 finished with value: 0.8672566371681416 and parameters: {'objective': 'CrossEntropy', 'colsample_bylevel': 0.09746829343014331, 'depth': 7, 'boosting_type': 'Plain', 'bootstrap_type': 'Bayesian', 'bagging_temperature': 1.9495739329280948}. Best is trial 71 with value: 0.890909090909091.
[32m[I 2023-04-26 10:56:46,669][39m Trial 144 finished with value: 0.8672566371681416 and parameters: {'objective': 'CrossEntropy', 'colsample_bylevel': 0.08665102828333059, 'depth': 5, 'boosting_type': 'Plain', 'bootstrap_type': 'Bayesian', 'bagging_temperature': 4.125029378835263}. Best is trial 71 with value: 0.890909090909091.
[32m[I 2023-04-26 10:56:48,832][39m Trial 145 finished with value: 0.8672566371681416 and parameters: {'objective': 'CrossEntropy', 'colsample_bylevel': 0.09122214101347971, 'depth': 6, 'boosting_type': 'Plain', 'bootstrap_type': 'Bayesian', 'bagging_temperature': 5.74455243198917}. Best is trial 71 with value: 0.890909090909091.
[32m[I 2023-04-26 10:56:51,141][39m Trial 146 finished with value: 0.8672566371681416 and parameters: {'objective': 'CrossEntropy', 'colsample_bylevel': 0.0940177318313198, 'depth': 6, 'boosting_type': 'Plain', 'bootstrap_type': 'Bayesian', 'bagging_temperature': 3.571027986724476}. Best is trial 71 with value: 0.890909090909091.
[32m[I 2023-04-26 10:56:52,874][39m Trial 147 finished with value: 0.8468468468468469 and parameters: {'objective': 'CrossEntropy', 'colsample_bylevel': 0.09772794002402983, 'depth': 7, 'boosting_type': 'Plain', 'bootstrap_type': 'Bayesian', 'bagging_temperature': 3.8727046742370543}. Best is trial 71 with value: 0.890909090909091.
[32m[I 2023-04-26 10:56:54,654][39m Trial 148 finished with value: 0.875 and parameters: {'objective': 'CrossEntropy', 'colsample_bylevel': 0.09515072805982892, 'depth': 10, 'boosting_type': 'Plain', 'bootstrap_type': 'Bayesian', 'bagging_temperature': 2.291249223894811}. Best is trial 71 with value: 0.890909090909091.
[32m[I 2023-04-26 10:56:57,164][39m Trial 149 finished with value: 0.875 and parameters: {'objective': 'Logloss', 'colsample_bylevel': 0.09223269459369732, 'depth': 7, 'boosting_type': 'Plain', 'bootstrap_type': 'Bayesian', 'bagging_temperature': 1.68953652488105}. Best is trial 71 with value: 0.890909090909091.
[32m[I 2023-04-26 10:56:58,617][39m Trial 150 finished with value: 0.8376068376068375 and parameters: {'objective': 'CrossEntropy', 'colsample_bylevel': 0.08940780071328418, 'depth': 1, 'boosting_type': 'Plain', 'bootstrap_type': 'Bayesian', 'bagging_temperature': 9.36187015836698}. Best is trial 71 with value: 0.890909090909091.
[32m[I 2023-04-26 10:57:00,604][39m Trial 151 finished with value: 0.875 and parameters: {'objective': 'CrossEntropy', 'colsample_bylevel': 0.08431729573732993, 'depth': 6, 'boosting_type': 'Plain', 'bootstrap_type': 'Bayesian', 'bagging_temperature': 4.958063299743921}. Best is trial 71 with value: 0.890909090909091.
[32m[I 2023-04-26 10:57:02,486][39m Trial 152 finished with value: 0.875 and parameters: {'objective': 'CrossEntropy', 'colsample_bylevel': 0.09033382414651883, 'depth': 7, 'boosting_type': 'Plain', 'bootstrap_type': 'Bayesian', 'bagging_temperature': 2.9352280330534093}. Best is trial 71 with value: 0.890909090909091.
[32m[I 2023-04-26 10:57:04,998][39m Trial 153 finished with value: 0.8828828828828829 and parameters: {'objective': 'CrossEntropy', 'colsample_bylevel': 0.08786712050179188, 'depth': 8, 'boosting_type': 'Plain', 'bootstrap_type': 'Bayesian', 'bagging_temperature': 5.472868449008526}. Best is trial 71 with value: 0.890909090909091.
[32m[I 2023-04-26 10:57:08,075][39m Trial 154 finished with value: 0.8695652173913043 and parameters: {'objective': 'CrossEntropy', 'colsample_bylevel': 0.08578206376577556, 'depth': 9, 'boosting_type': 'Plain', 'bootstrap_type': 'Bayesian', 'bagging_temperature': 8.70209017270385}. Best is trial 71 with value: 0.890909090909091.
[32m[I 2023-04-26 10:57:10,123][39m Trial 155 finished with value: 0.8672566371681416 and parameters: {'objective': 'CrossEntropy', 'colsample_bylevel': 0.09340908210989124, 'depth': 8, 'boosting_type': 'Plain', 'bootstrap_type': 'Bayesian', 'bagging_temperature': 3.811488054319652}. Best is trial 71 with value: 0.890909090909091.
[32m[I 2023-04-26 10:57:12,636][39m Trial 156 finished with value: 0.875 and parameters: {'objective': 'CrossEntropy', 'colsample_bylevel': 0.0877298470929815, 'depth': 8, 'boosting_type': 'Plain', 'bootstrap_type': 'Bayesian', 'bagging_temperature': 5.526324054620555}. Best is trial 71 with value: 0.890909090909091.
[32m[I 2023-04-26 10:57:14,541][39m Trial 157 finished with value: 0.875 and parameters: {'objective': 'CrossEntropy', 'colsample_bylevel': 0.08085723224458884, 'depth': 7, 'boosting_type': 'Plain', 'bootstrap_type': 'Bayesian', 'bagging_temperature': 2.621065173337195}. Best is trial 71 with value: 0.890909090909091.
[32m[I 2023-04-26 10:57:17,380][39m Trial 158 finished with value: 0.7863247863247863 and parameters: {'objective': 'CrossEntropy', 'colsample_bylevel': 0.011727697383573654, 'depth': 7, 'boosting_type': 'Ordered', 'bootstrap_type': 'Bayesian', 'bagging_temperature': 2.079025933291601}. Best is trial 71 with value: 0.890909090909091.
[32m[I 2023-04-26 10:57:19,061][39m Trial 159 finished with value: 0.8596491228070176 and parameters: {'objective': 'CrossEntropy', 'colsample_bylevel': 0.0910938572710842, 'depth': 6, 'boosting_type': 'Plain', 'bootstrap_type': 'Bernoulli', 'subsample': 0.5990617956834683}. Best is trial 71 with value: 0.890909090909091.
[32m[I 2023-04-26 10:57:21,470][39m Trial 160 finished with value: 0.8672566371681416 and parameters: {'objective': 'CrossEntropy', 'colsample_bylevel': 0.06395748619404595, 'depth': 8, 'boosting_type': 'Plain', 'bootstrap_type': 'Bayesian', 'bagging_temperature': 5.931262354843813}. Best is trial 71 with value: 0.890909090909091.
[32m[I 2023-04-26 10:57:23,957][39m Trial 161 finished with value: 0.8596491228070176 and parameters: {'objective': 'CrossEntropy', 'colsample_bylevel': 0.08826155188239636, 'depth': 8, 'boosting_type': 'Plain', 'bootstrap_type': 'Bayesian', 'bagging_temperature': 4.816000342722554}. Best is trial 71 with value: 0.890909090909091.
[32m[I 2023-04-26 10:57:27,203][39m Trial 162 finished with value: 0.8672566371681416 and parameters: {'objective': 'CrossEntropy', 'colsample_bylevel': 0.09161400613959961, 'depth': 9, 'boosting_type': 'Plain', 'bootstrap_type': 'Bayesian', 'bagging_temperature': 4.494824251117924}. Best is trial 71 with value: 0.890909090909091.
[32m[I 2023-04-26 10:57:28,316][39m Trial 163 finished with value: 0.8070175438596492 and parameters: {'objective': 'CrossEntropy', 'colsample_bylevel': 0.015581565699951352, 'depth': 7, 'boosting_type': 'Plain', 'bootstrap_type': 'Bayesian', 'bagging_temperature': 7.788946038566218}. Best is trial 71 with value: 0.890909090909091.
[32m[I 2023-04-26 10:57:29,884][39m Trial 164 finished with value: 0.8648648648648648 and parameters: {'objective': 'CrossEntropy', 'colsample_bylevel': 0.09560472025975629, 'depth': 7, 'boosting_type': 'Plain', 'bootstrap_type': 'Bayesian', 'bagging_temperature': 5.157550829271946}. Best is trial 71 with value: 0.890909090909091.
[32m[I 2023-04-26 10:57:31,862][39m Trial 165 finished with value: 0.8596491228070176 and parameters: {'objective': 'CrossEntropy', 'colsample_bylevel': 0.09414557359738424, 'depth': 6, 'boosting_type': 'Plain', 'bootstrap_type': 'Bayesian', 'bagging_temperature': 1.3453454729739542}. Best is trial 71 with value: 0.890909090909091.
[32m[I 2023-04-26 10:57:34,276][39m Trial 166 finished with value: 0.875 and parameters: {'objective': 'Logloss', 'colsample_bylevel': 0.09844134647540984, 'depth': 6, 'boosting_type': 'Plain', 'bootstrap_type': 'Bayesian', 'bagging_temperature': 4.057113979493629}. Best is trial 71 with value: 0.890909090909091.
[32m[I 2023-04-26 10:57:36,239][39m Trial 167 finished with value: 0.8596491228070176 and parameters: {'objective': 'CrossEntropy', 'colsample_bylevel': 0.08239599090540807, 'depth': 6, 'boosting_type': 'Plain', 'bootstrap_type': 'Bayesian', 'bagging_temperature': 1.5705705336814186}. Best is trial 71 with value: 0.890909090909091.
[32m[I 2023-04-26 10:57:37,720][39m Trial 168 finished with value: 0.8521739130434783 and parameters: {'objective': 'CrossEntropy', 'colsample_bylevel': 0.09310691811431925, 'depth': 5, 'boosting_type': 'Plain', 'bootstrap_type': 'MVS'}. Best is trial 71 with value: 0.890909090909091.
[32m[I 2023-04-26 10:57:39,133][39m Trial 169 finished with value: 0.8596491228070176 and parameters: {'objective': 'CrossEntropy', 'colsample_bylevel': 0.09666295929926912, 'depth': 6, 'boosting_type': 'Plain', 'bootstrap_type': 'Bayesian', 'bagging_temperature': 3.5224749634517285}. Best is trial 71 with value: 0.890909090909091.
[32m[I 2023-04-26 10:57:41,409][39m Trial 170 finished with value: 0.8828828828828829 and parameters: {'objective': 'CrossEntropy', 'colsample_bylevel': 0.09455646371365932, 'depth': 6, 'boosting_type': 'Plain', 'bootstrap_type': 'Bayesian', 'bagging_temperature': 3.2526936499287733}. Best is trial 71 with value: 0.890909090909091.
[32m[I 2023-04-26 10:57:43,401][39m Trial 171 finished with value: 0.8672566371681416 and parameters: {'objective': 'CrossEntropy', 'colsample_bylevel': 0.09288249087893968, 'depth': 7, 'boosting_type': 'Plain', 'bootstrap_type': 'Bayesian', 'bagging_temperature': 3.322614170829729}. Best is trial 71 with value: 0.890909090909091.
[32m[I 2023-04-26 10:57:45,184][39m Trial 172 finished with value: 0.875 and parameters: {'objective': 'CrossEntropy', 'colsample_bylevel': 0.0841338025129441, 'depth': 6, 'boosting_type': 'Plain', 'bootstrap_type': 'Bayesian', 'bagging_temperature': 2.9097385385398744}. Best is trial 71 with value: 0.890909090909091.
[32m[I 2023-04-26 10:57:47,175][39m Trial 173 finished with value: 0.8545454545454546 and parameters: {'objective': 'CrossEntropy', 'colsample_bylevel': 0.09569312721116537, 'depth': 7, 'boosting_type': 'Plain', 'bootstrap_type': 'Bayesian', 'bagging_temperature': 2.104271202612893}. Best is trial 71 with value: 0.890909090909091.
[32m[I 2023-04-26 10:57:48,962][39m Trial 174 finished with value: 0.8672566371681416 and parameters: {'objective': 'CrossEntropy', 'colsample_bylevel': 0.08979736649860393, 'depth': 5, 'boosting_type': 'Plain', 'bootstrap_type': 'Bayesian', 'bagging_temperature': 3.0946690997571844}. Best is trial 71 with value: 0.890909090909091.
[32m[I 2023-04-26 10:57:51,197][39m Trial 175 finished with value: 0.875 and parameters: {'objective': 'CrossEntropy', 'colsample_bylevel': 0.09213156718255648, 'depth': 11, 'boosting_type': 'Plain', 'bootstrap_type': 'Bayesian', 'bagging_temperature': 4.213128102257404}. Best is trial 71 with value: 0.890909090909091.
[32m[I 2023-04-26 10:57:53,209][39m Trial 176 finished with value: 0.8828828828828829 and parameters: {'objective': 'CrossEntropy', 'colsample_bylevel': 0.08935750532869724, 'depth': 7, 'boosting_type': 'Plain', 'bootstrap_type': 'Bayesian', 'bagging_temperature': 3.6336192843498587}. Best is trial 71 with value: 0.890909090909091.
[32m[I 2023-04-26 10:57:54,955][39m Trial 177 finished with value: 0.8828828828828829 and parameters: {'objective': 'CrossEntropy', 'colsample_bylevel': 0.09071533845290675, 'depth': 7, 'boosting_type': 'Plain', 'bootstrap_type': 'Bayesian', 'bagging_temperature': 2.380379993066682}. Best is trial 71 with value: 0.890909090909091.
[32m[I 2023-04-26 10:57:57,206][39m Trial 178 finished with value: 0.8828828828828829 and parameters: {'objective': 'CrossEntropy', 'colsample_bylevel': 0.09096905312557839, 'depth': 7, 'boosting_type': 'Plain', 'bootstrap_type': 'Bayesian', 'bagging_temperature': 3.2275192332585236}. Best is trial 71 with value: 0.890909090909091.
[32m[I 2023-04-26 10:57:58,836][39m Trial 179 finished with value: 0.8828828828828829 and parameters: {'objective': 'CrossEntropy', 'colsample_bylevel': 0.09827549379947159, 'depth': 7, 'boosting_type': 'Plain', 'bootstrap_type': 'Bayesian', 'bagging_temperature': 2.417981457960125}. Best is trial 71 with value: 0.890909090909091.
[32m[I 2023-04-26 10:58:00,435][39m Trial 180 finished with value: 0.8571428571428572 and parameters: {'objective': 'Logloss', 'colsample_bylevel': 0.054477244193213606, 'depth': 6, 'boosting_type': 'Plain', 'bootstrap_type': 'Bayesian', 'bagging_temperature': 3.935864994233823}. Best is trial 71 with value: 0.890909090909091.
[32m[I 2023-04-26 10:58:02,629][39m Trial 181 finished with value: 0.8672566371681416 and parameters: {'objective': 'CrossEntropy', 'colsample_bylevel': 0.08790548497902186, 'depth': 8, 'boosting_type': 'Plain', 'bootstrap_type': 'Bayesian', 'bagging_temperature': 0.6228391319053745}. Best is trial 71 with value: 0.890909090909091.
[32m[I 2023-04-26 10:58:05,088][39m Trial 182 finished with value: 0.875 and parameters: {'objective': 'CrossEntropy', 'colsample_bylevel': 0.08589059002534512, 'depth': 8, 'boosting_type': 'Plain', 'bootstrap_type': 'Bayesian', 'bagging_temperature': 8.954252957956836}. Best is trial 71 with value: 0.890909090909091.
[32m[I 2023-04-26 10:58:06,667][39m Trial 183 finished with value: 0.8672566371681416 and parameters: {'objective': 'CrossEntropy', 'colsample_bylevel': 0.09429972196498809, 'depth': 6, 'boosting_type': 'Plain', 'bootstrap_type': 'Bayesian', 'bagging_temperature': 1.782826659783068}. Best is trial 71 with value: 0.890909090909091.
[32m[I 2023-04-26 10:58:09,338][39m Trial 184 finished with value: 0.8828828828828829 and parameters: {'objective': 'CrossEntropy', 'colsample_bylevel': 0.0892442783710491, 'depth': 8, 'boosting_type': 'Plain', 'bootstrap_type': 'Bayesian', 'bagging_temperature': 2.7405099327390916}. Best is trial 71 with value: 0.890909090909091.
[32m[I 2023-04-26 10:58:11,523][39m Trial 185 finished with value: 0.8672566371681416 and parameters: {'objective': 'CrossEntropy', 'colsample_bylevel': 0.09220391310768558, 'depth': 7, 'boosting_type': 'Plain', 'bootstrap_type': 'Bayesian', 'bagging_temperature': 4.867172119732142}. Best is trial 71 with value: 0.890909090909091.
[32m[I 2023-04-26 10:58:13,446][39m Trial 186 finished with value: 0.8672566371681416 and parameters: {'objective': 'CrossEntropy', 'colsample_bylevel': 0.07449657932506919, 'depth': 7, 'boosting_type': 'Plain', 'bootstrap_type': 'Bayesian', 'bagging_temperature': 1.9374103528315751}. Best is trial 71 with value: 0.890909090909091.
[32m[I 2023-04-26 10:58:15,545][39m Trial 187 finished with value: 0.875 and parameters: {'objective': 'CrossEntropy', 'colsample_bylevel': 0.08732236011829034, 'depth': 8, 'boosting_type': 'Plain', 'bootstrap_type': 'Bayesian', 'bagging_temperature': 3.226327615696139}. Best is trial 71 with value: 0.890909090909091.
[32m[I 2023-04-26 10:58:17,478][39m Trial 188 finished with value: 0.8828828828828829 and parameters: {'objective': 'CrossEntropy', 'colsample_bylevel': 0.0852306101747104, 'depth': 6, 'boosting_type': 'Plain', 'bootstrap_type': 'Bernoulli', 'subsample': 0.12276427350008418}. Best is trial 71 with value: 0.890909090909091.
[32m[I 2023-04-26 10:58:22,651][39m Trial 189 finished with value: 0.8672566371681416 and parameters: {'objective': 'CrossEntropy', 'colsample_bylevel': 0.09619117594990956, 'depth': 10, 'boosting_type': 'Ordered', 'bootstrap_type': 'Bayesian', 'bagging_temperature': 4.514597272807064}. Best is trial 71 with value: 0.890909090909091.
[32m[I 2023-04-26 10:58:24,544][39m Trial 190 finished with value: 0.8672566371681416 and parameters: {'objective': 'CrossEntropy', 'colsample_bylevel': 0.08544522028527751, 'depth': 6, 'boosting_type': 'Plain', 'bootstrap_type': 'Bernoulli', 'subsample': 0.12043508061951183}. Best is trial 71 with value: 0.890909090909091.
[32m[I 2023-04-26 10:58:27,398][39m Trial 191 finished with value: 0.875 and parameters: {'objective': 'CrossEntropy', 'colsample_bylevel': 0.07897867167253375, 'depth': 9, 'boosting_type': 'Plain', 'bootstrap_type': 'Bayesian', 'bagging_temperature': 2.668190824817959}. Best is trial 71 with value: 0.890909090909091.
[32m[I 2023-04-26 10:58:29,433][39m Trial 192 finished with value: 0.8672566371681416 and parameters: {'objective': 'CrossEntropy', 'colsample_bylevel': 0.0834102432708976, 'depth': 6, 'boosting_type': 'Plain', 'bootstrap_type': 'Bayesian', 'bagging_temperature': 3.4831724855940496}. Best is trial 71 with value: 0.890909090909091.
[32m[I 2023-04-26 10:58:31,125][39m Trial 193 finished with value: 0.875 and parameters: {'objective': 'CrossEntropy', 'colsample_bylevel': 0.08888916193666639, 'depth': 7, 'boosting_type': 'Plain', 'bootstrap_type': 'Bayesian', 'bagging_temperature': 2.317184272956385}. Best is trial 71 with value: 0.890909090909091.
[32m[I 2023-04-26 10:58:33,242][39m Trial 194 finished with value: 0.875 and parameters: {'objective': 'CrossEntropy', 'colsample_bylevel': 0.0936014457225586, 'depth': 7, 'boosting_type': 'Plain', 'bootstrap_type': 'Bayesian', 'bagging_temperature': 9.537939578582787}. Best is trial 71 with value: 0.890909090909091.
[32m[I 2023-04-26 10:58:35,700][39m Trial 195 finished with value: 0.8596491228070176 and parameters: {'objective': 'CrossEntropy', 'colsample_bylevel': 0.09471102872081238, 'depth': 7, 'boosting_type': 'Plain', 'bootstrap_type': 'Bayesian', 'bagging_temperature': 8.448338308218775}. Best is trial 71 with value: 0.890909090909091.
[32m[I 2023-04-26 10:58:38,041][39m Trial 196 finished with value: 0.8596491228070176 and parameters: {'objective': 'CrossEntropy', 'colsample_bylevel': 0.09859619433032166, 'depth': 8, 'boosting_type': 'Plain', 'bootstrap_type': 'Bayesian', 'bagging_temperature': 7.066024827918866}. Best is trial 71 with value: 0.890909090909091.
[32m[I 2023-04-26 10:58:40,594][39m Trial 197 finished with value: 0.8672566371681416 and parameters: {'objective': 'CrossEntropy', 'colsample_bylevel': 0.0893590250527402, 'depth': 8, 'boosting_type': 'Plain', 'bootstrap_type': 'Bayesian', 'bagging_temperature': 2.5346212160140973}. Best is trial 71 with value: 0.890909090909091.
[32m[I 2023-04-26 10:58:43,055][39m Trial 198 finished with value: 0.875 and parameters: {'objective': 'CrossEntropy', 'colsample_bylevel': 0.09062519528115193, 'depth': 8, 'boosting_type': 'Plain', 'bootstrap_type': 'Bayesian', 'bagging_temperature': 2.866982796436356}. Best is trial 71 with value: 0.890909090909091.
[32m[I 2023-04-26 10:58:45,866][39m Trial 199 finished with value: 0.875 and parameters: {'objective': 'Logloss', 'colsample_bylevel': 0.08753902285225035, 'depth': 8, 'boosting_type': 'Plain', 'bootstrap_type': 'Bayesian', 'bagging_temperature': 2.405780493834534}. Best is trial 71 with value: 0.890909090909091.
[32m[I 2023-04-26 10:58:47,860][39m Trial 200 finished with value: 0.875 and parameters: {'objective': 'CrossEntropy', 'colsample_bylevel': 0.08179611122509108, 'depth': 7, 'boosting_type': 'Plain', 'bootstrap_type': 'Bayesian', 'bagging_temperature': 6.412227747723986}. Best is trial 71 with value: 0.890909090909091.
[32m[I 2023-04-26 10:58:49,854][39m Trial 201 finished with value: 0.875 and parameters: {'objective': 'CrossEntropy', 'colsample_bylevel': 0.0910115273497902, 'depth': 7, 'boosting_type': 'Plain', 'bootstrap_type': 'Bayesian', 'bagging_temperature': 3.0454201597389954}. Best is trial 71 with value: 0.890909090909091.
