[32m[I 2023-04-26 11:04:16,582][39m Trial 335 finished with value: 0.8596491228070176 and parameters: {'objective': 'CrossEntropy', 'colsample_bylevel': 0.05632805533375412, 'depth': 8, 'boosting_type': 'Plain', 'bootstrap_type': 'Bayesian', 'bagging_temperature': 8.67128992890286}. Best is trial 71 with value: 0.890909090909091.
[32m[I 2023-04-26 11:04:18,726][39m Trial 336 finished with value: 0.875 and parameters: {'objective': 'CrossEntropy', 'colsample_bylevel': 0.09111463114651853, 'depth': 4, 'boosting_type': 'Plain', 'bootstrap_type': 'Bayesian', 'bagging_temperature': 9.281619805953731}. Best is trial 71 with value: 0.890909090909091.
[32m[I 2023-04-26 11:04:21,693][39m Trial 337 finished with value: 0.875 and parameters: {'objective': 'Logloss', 'colsample_bylevel': 0.08563415143776174, 'depth': 8, 'boosting_type': 'Plain', 'bootstrap_type': 'Bayesian', 'bagging_temperature': 7.830420987880495}. Best is trial 71 with value: 0.890909090909091.
[32m[I 2023-04-26 11:04:24,107][39m Trial 338 finished with value: 0.8672566371681416 and parameters: {'objective': 'CrossEntropy', 'colsample_bylevel': 0.08822543338476052, 'depth': 8, 'boosting_type': 'Plain', 'bootstrap_type': 'Bayesian', 'bagging_temperature': 2.0179545339994793}. Best is trial 71 with value: 0.890909090909091.
[32m[I 2023-04-26 11:04:26,541][39m Trial 339 finished with value: 0.875 and parameters: {'objective': 'CrossEntropy', 'colsample_bylevel': 0.07753117281766286, 'depth': 9, 'boosting_type': 'Plain', 'bootstrap_type': 'Bayesian', 'bagging_temperature': 8.308713516712256}. Best is trial 71 with value: 0.890909090909091.
[32m[I 2023-04-26 11:04:30,964][39m Trial 340 finished with value: 0.8596491228070176 and parameters: {'objective': 'CrossEntropy', 'colsample_bylevel': 0.08920202389074036, 'depth': 8, 'boosting_type': 'Ordered', 'bootstrap_type': 'Bayesian', 'bagging_temperature': 2.2099182473327628}. Best is trial 71 with value: 0.890909090909091.
[32m[I 2023-04-26 11:04:32,855][39m Trial 341 finished with value: 0.8672566371681416 and parameters: {'objective': 'CrossEntropy', 'colsample_bylevel': 0.09350435768912013, 'depth': 6, 'boosting_type': 'Plain', 'bootstrap_type': 'Bayesian', 'bagging_temperature': 1.3934990800428062}. Best is trial 71 with value: 0.890909090909091.
[32m[I 2023-04-26 11:04:36,352][39m Trial 342 finished with value: 0.8648648648648648 and parameters: {'objective': 'CrossEntropy', 'colsample_bylevel': 0.09223181657727603, 'depth': 8, 'boosting_type': 'Plain', 'bootstrap_type': 'Bayesian', 'bagging_temperature': 2.096657111219024}. Best is trial 71 with value: 0.890909090909091.
[32m[I 2023-04-26 11:04:37,820][39m Trial 343 finished with value: 0.8596491228070176 and parameters: {'objective': 'CrossEntropy', 'colsample_bylevel': 0.09427167250353405, 'depth': 10, 'boosting_type': 'Plain', 'bootstrap_type': 'MVS'}. Best is trial 71 with value: 0.890909090909091.
[32m[I 2023-04-26 11:04:39,834][39m Trial 344 finished with value: 0.8828828828828829 and parameters: {'objective': 'CrossEntropy', 'colsample_bylevel': 0.08304227545920799, 'depth': 6, 'boosting_type': 'Plain', 'bootstrap_type': 'Bayesian', 'bagging_temperature': 3.1965597899558986}. Best is trial 71 with value: 0.890909090909091.
[32m[I 2023-04-26 11:04:41,932][39m Trial 345 finished with value: 0.875 and parameters: {'objective': 'CrossEntropy', 'colsample_bylevel': 0.08680781280090862, 'depth': 6, 'boosting_type': 'Plain', 'bootstrap_type': 'Bernoulli', 'subsample': 0.24615484590772468}. Best is trial 71 with value: 0.890909090909091.
[32m[I 2023-04-26 11:04:43,834][39m Trial 346 finished with value: 0.8672566371681416 and parameters: {'objective': 'CrossEntropy', 'colsample_bylevel': 0.09979276003383133, 'depth': 7, 'boosting_type': 'Plain', 'bootstrap_type': 'Bayesian', 'bagging_temperature': 6.786127960241054}. Best is trial 71 with value: 0.890909090909091.
[32m[I 2023-04-26 11:04:45,687][39m Trial 347 finished with value: 0.875 and parameters: {'objective': 'CrossEntropy', 'colsample_bylevel': 0.09056149135374297, 'depth': 6, 'boosting_type': 'Plain', 'bootstrap_type': 'Bayesian', 'bagging_temperature': 8.868084748357306}. Best is trial 71 with value: 0.890909090909091.
[32m[I 2023-04-26 11:04:48,468][39m Trial 348 finished with value: 0.875 and parameters: {'objective': 'Logloss', 'colsample_bylevel': 0.08550178814338973, 'depth': 8, 'boosting_type': 'Plain', 'bootstrap_type': 'Bayesian', 'bagging_temperature': 9.969504111544499}. Best is trial 71 with value: 0.890909090909091.
[32m[I 2023-04-26 11:04:50,236][39m Trial 349 finished with value: 0.8672566371681416 and parameters: {'objective': 'CrossEntropy', 'colsample_bylevel': 0.0841999954169552, 'depth': 5, 'boosting_type': 'Plain', 'bootstrap_type': 'Bayesian', 'bagging_temperature': 1.7632114149369578}. Best is trial 71 with value: 0.890909090909091.
[32m[I 2023-04-26 11:04:51,943][39m Trial 350 finished with value: 0.8448275862068967 and parameters: {'objective': 'CrossEntropy', 'colsample_bylevel': 0.08263524963115408, 'depth': 2, 'boosting_type': 'Plain', 'bootstrap_type': 'Bayesian', 'bagging_temperature': 1.1628266718147002}. Best is trial 71 with value: 0.890909090909091.
[32m[I 2023-04-26 11:04:53,217][39m Trial 351 finished with value: 0.8205128205128206 and parameters: {'objective': 'CrossEntropy', 'colsample_bylevel': 0.01999735574555623, 'depth': 5, 'boosting_type': 'Plain', 'bootstrap_type': 'Bayesian', 'bagging_temperature': 1.5562102922286314}. Best is trial 71 with value: 0.890909090909091.
[32m[I 2023-04-26 11:04:55,913][39m Trial 352 finished with value: 0.8495575221238938 and parameters: {'objective': 'CrossEntropy', 'colsample_bylevel': 0.08020166330500876, 'depth': 8, 'boosting_type': 'Plain', 'bootstrap_type': 'Bayesian', 'bagging_temperature': 0.7116936755632868}. Best is trial 71 with value: 0.890909090909091.
[32m[I 2023-04-26 11:04:57,528][39m Trial 353 finished with value: 0.8596491228070176 and parameters: {'objective': 'CrossEntropy', 'colsample_bylevel': 0.038618727309754144, 'depth': 6, 'boosting_type': 'Plain', 'bootstrap_type': 'Bayesian', 'bagging_temperature': 1.2901184765611484}. Best is trial 71 with value: 0.890909090909091.
[32m[I 2023-04-26 11:05:00,223][39m Trial 354 finished with value: 0.8828828828828829 and parameters: {'objective': 'CrossEntropy', 'colsample_bylevel': 0.09535037076316921, 'depth': 9, 'boosting_type': 'Plain', 'bootstrap_type': 'Bayesian', 'bagging_temperature': 1.7536267861411572}. Best is trial 71 with value: 0.890909090909091.
[32m[I 2023-04-26 11:05:02,196][39m Trial 355 finished with value: 0.8695652173913043 and parameters: {'objective': 'CrossEntropy', 'colsample_bylevel': 0.09098468189540398, 'depth': 7, 'boosting_type': 'Plain', 'bootstrap_type': 'Bayesian', 'bagging_temperature': 3.6518384172742167}. Best is trial 71 with value: 0.890909090909091.
[32m[I 2023-04-26 11:05:07,691][39m Trial 356 finished with value: 0.875 and parameters: {'objective': 'CrossEntropy', 'colsample_bylevel': 0.08768998649395157, 'depth': 5, 'boosting_type': 'Ordered', 'bootstrap_type': 'Bayesian', 'bagging_temperature': 2.82187474289196}. Best is trial 71 with value: 0.890909090909091.
[32m[I 2023-04-26 11:05:09,290][39m Trial 357 finished with value: 0.8596491228070176 and parameters: {'objective': 'CrossEntropy', 'colsample_bylevel': 0.09230510269667423, 'depth': 6, 'boosting_type': 'Plain', 'bootstrap_type': 'Bernoulli', 'subsample': 0.7312010450702546}. Best is trial 71 with value: 0.890909090909091.
[32m[I 2023-04-26 11:05:11,428][39m Trial 358 finished with value: 0.8672566371681416 and parameters: {'objective': 'CrossEntropy', 'colsample_bylevel': 0.09578561287621704, 'depth': 10, 'boosting_type': 'Plain', 'bootstrap_type': 'Bernoulli', 'subsample': 0.14579619930585014}. Best is trial 71 with value: 0.890909090909091.
[32m[I 2023-04-26 11:05:14,103][39m Trial 359 finished with value: 0.875 and parameters: {'objective': 'Logloss', 'colsample_bylevel': 0.09645905409464328, 'depth': 7, 'boosting_type': 'Plain', 'bootstrap_type': 'Bayesian', 'bagging_temperature': 1.9478856327416036}. Best is trial 71 with value: 0.890909090909091.
[32m[I 2023-04-26 11:05:15,714][39m Trial 360 finished with value: 0.875 and parameters: {'objective': 'CrossEntropy', 'colsample_bylevel': 0.09463234807633893, 'depth': 6, 'boosting_type': 'Plain', 'bootstrap_type': 'Bernoulli', 'subsample': 0.44774706614367066}. Best is trial 71 with value: 0.890909090909091.
[32m[I 2023-04-26 11:05:18,193][39m Trial 361 finished with value: 0.875 and parameters: {'objective': 'CrossEntropy', 'colsample_bylevel': 0.09829745850948796, 'depth': 8, 'boosting_type': 'Plain', 'bootstrap_type': 'Bayesian', 'bagging_temperature': 2.680648195728959}. Best is trial 71 with value: 0.890909090909091.
[32m[I 2023-04-26 11:05:20,655][39m Trial 362 finished with value: 0.8672566371681416 and parameters: {'objective': 'CrossEntropy', 'colsample_bylevel': 0.09730396215919115, 'depth': 8, 'boosting_type': 'Plain', 'bootstrap_type': 'Bayesian', 'bagging_temperature': 7.290453375409914}. Best is trial 71 with value: 0.890909090909091.
[32m[I 2023-04-26 11:05:22,740][39m Trial 363 finished with value: 0.8672566371681416 and parameters: {'objective': 'CrossEntropy', 'colsample_bylevel': 0.09869656291042461, 'depth': 8, 'boosting_type': 'Plain', 'bootstrap_type': 'Bayesian', 'bagging_temperature': 2.5322961658681207}. Best is trial 71 with value: 0.890909090909091.
[32m[I 2023-04-26 11:05:24,761][39m Trial 364 finished with value: 0.875 and parameters: {'objective': 'CrossEntropy', 'colsample_bylevel': 0.08962626295942595, 'depth': 7, 'boosting_type': 'Plain', 'bootstrap_type': 'Bayesian', 'bagging_temperature': 3.3757140341853904}. Best is trial 71 with value: 0.890909090909091.
[32m[I 2023-04-26 11:05:28,218][39m Trial 365 finished with value: 0.8596491228070176 and parameters: {'objective': 'CrossEntropy', 'colsample_bylevel': 0.09670737592529147, 'depth': 7, 'boosting_type': 'Ordered', 'bootstrap_type': 'MVS'}. Best is trial 71 with value: 0.890909090909091.
[32m[I 2023-04-26 11:05:31,835][39m Trial 366 finished with value: 0.8828828828828829 and parameters: {'objective': 'CrossEntropy', 'colsample_bylevel': 0.0938106559359468, 'depth': 8, 'boosting_type': 'Plain', 'bootstrap_type': 'Bayesian', 'bagging_temperature': 3.5093422106617598}. Best is trial 71 with value: 0.890909090909091.
[32m[I 2023-04-26 11:05:33,756][39m Trial 367 finished with value: 0.8828828828828829 and parameters: {'objective': 'CrossEntropy', 'colsample_bylevel': 0.09254223422129738, 'depth': 8, 'boosting_type': 'Plain', 'bootstrap_type': 'Bayesian', 'bagging_temperature': 3.8710793505369425}. Best is trial 71 with value: 0.890909090909091.
[32m[I 2023-04-26 11:05:35,586][39m Trial 368 finished with value: 0.8596491228070176 and parameters: {'objective': 'CrossEntropy', 'colsample_bylevel': 0.09294779959470889, 'depth': 11, 'boosting_type': 'Plain', 'bootstrap_type': 'Bayesian', 'bagging_temperature': 4.131344434635325}. Best is trial 71 with value: 0.890909090909091.
[32m[I 2023-04-26 11:05:38,493][39m Trial 369 finished with value: 0.8672566371681416 and parameters: {'objective': 'CrossEntropy', 'colsample_bylevel': 0.08953222139609765, 'depth': 9, 'boosting_type': 'Plain', 'bootstrap_type': 'Bayesian', 'bagging_temperature': 1.7515692424770215}. Best is trial 71 with value: 0.890909090909091.
[32m[I 2023-04-26 11:05:40,945][39m Trial 370 finished with value: 0.8672566371681416 and parameters: {'objective': 'CrossEntropy', 'colsample_bylevel': 0.08909596343000495, 'depth': 8, 'boosting_type': 'Plain', 'bootstrap_type': 'Bayesian', 'bagging_temperature': 1.5021205709970957}. Best is trial 71 with value: 0.890909090909091.
[32m[I 2023-04-26 11:05:42,864][39m Trial 371 finished with value: 0.8672566371681416 and parameters: {'objective': 'CrossEntropy', 'colsample_bylevel': 0.0912001442536448, 'depth': 7, 'boosting_type': 'Plain', 'bootstrap_type': 'Bayesian', 'bagging_temperature': 3.051843850334584}. Best is trial 71 with value: 0.890909090909091.
[32m[I 2023-04-26 11:05:44,668][39m Trial 372 finished with value: 0.8828828828828829 and parameters: {'objective': 'CrossEntropy', 'colsample_bylevel': 0.0932865917690641, 'depth': 7, 'boosting_type': 'Plain', 'bootstrap_type': 'Bayesian', 'bagging_temperature': 2.214934424296555}. Best is trial 71 with value: 0.890909090909091.
[32m[I 2023-04-26 11:05:47,153][39m Trial 373 finished with value: 0.875 and parameters: {'objective': 'CrossEntropy', 'colsample_bylevel': 0.09472981701058238, 'depth': 7, 'boosting_type': 'Plain', 'bootstrap_type': 'Bayesian', 'bagging_temperature': 2.9558494945085805}. Best is trial 71 with value: 0.890909090909091.
[32m[I 2023-04-26 11:05:52,359][39m Trial 374 finished with value: 0.8672566371681416 and parameters: {'objective': 'Logloss', 'colsample_bylevel': 0.09985619251537557, 'depth': 10, 'boosting_type': 'Ordered', 'bootstrap_type': 'Bayesian', 'bagging_temperature': 1.5055723862700559}. Best is trial 71 with value: 0.890909090909091.
[32m[I 2023-04-26 11:05:57,071][39m Trial 375 finished with value: 0.875 and parameters: {'objective': 'CrossEntropy', 'colsample_bylevel': 0.09768225089724468, 'depth': 7, 'boosting_type': 'Ordered', 'bootstrap_type': 'Bayesian', 'bagging_temperature': 5.412147689307554}. Best is trial 71 with value: 0.890909090909091.
[32m[I 2023-04-26 11:05:59,403][39m Trial 376 finished with value: 0.8596491228070176 and parameters: {'objective': 'CrossEntropy', 'colsample_bylevel': 0.08981228300015938, 'depth': 6, 'boosting_type': 'Plain', 'bootstrap_type': 'Bayesian', 'bagging_temperature': 3.2437922897065192}. Best is trial 71 with value: 0.890909090909091.
[32m[I 2023-04-26 11:06:01,277][39m Trial 377 finished with value: 0.8448275862068967 and parameters: {'objective': 'CrossEntropy', 'colsample_bylevel': 0.08170383133195726, 'depth': 2, 'boosting_type': 'Plain', 'bootstrap_type': 'Bernoulli', 'subsample': 0.6029398170685085}. Best is trial 71 with value: 0.890909090909091.
[32m[I 2023-04-26 11:06:03,814][39m Trial 378 finished with value: 0.8695652173913043 and parameters: {'objective': 'CrossEntropy', 'colsample_bylevel': 0.0789339450900413, 'depth': 8, 'boosting_type': 'Plain', 'bootstrap_type': 'Bayesian', 'bagging_temperature': 9.057031540020876}. Best is trial 71 with value: 0.890909090909091.
[32m[I 2023-04-26 11:06:06,715][39m Trial 379 finished with value: 0.8828828828828829 and parameters: {'objective': 'CrossEntropy', 'colsample_bylevel': 0.08360915369228615, 'depth': 9, 'boosting_type': 'Plain', 'bootstrap_type': 'Bayesian', 'bagging_temperature': 9.070691825618178}. Best is trial 71 with value: 0.890909090909091.
[32m[I 2023-04-26 11:06:08,718][39m Trial 380 finished with value: 0.8828828828828829 and parameters: {'objective': 'CrossEntropy', 'colsample_bylevel': 0.09993200465840364, 'depth': 7, 'boosting_type': 'Plain', 'bootstrap_type': 'Bayesian', 'bagging_temperature': 2.3231996848590297}. Best is trial 71 with value: 0.890909090909091.
[32m[I 2023-04-26 11:06:10,374][39m Trial 381 finished with value: 0.8648648648648648 and parameters: {'objective': 'CrossEntropy', 'colsample_bylevel': 0.043798663796652995, 'depth': 9, 'boosting_type': 'Plain', 'bootstrap_type': 'Bayesian', 'bagging_temperature': 2.3314025308100392}. Best is trial 71 with value: 0.890909090909091.
[32m[I 2023-04-26 11:06:12,155][39m Trial 382 finished with value: 0.8672566371681416 and parameters: {'objective': 'CrossEntropy', 'colsample_bylevel': 0.09341349259421253, 'depth': 7, 'boosting_type': 'Plain', 'bootstrap_type': 'Bayesian', 'bagging_temperature': 1.8687536620033864}. Best is trial 71 with value: 0.890909090909091.
[32m[I 2023-04-26 11:06:14,859][39m Trial 383 finished with value: 0.8828828828828829 and parameters: {'objective': 'CrossEntropy', 'colsample_bylevel': 0.09782550095104714, 'depth': 8, 'boosting_type': 'Plain', 'bootstrap_type': 'Bayesian', 'bagging_temperature': 8.695469430392393}. Best is trial 71 with value: 0.890909090909091.
[32m[I 2023-04-26 11:06:16,794][39m Trial 384 finished with value: 0.875 and parameters: {'objective': 'Logloss', 'colsample_bylevel': 0.09564553614037827, 'depth': 10, 'boosting_type': 'Plain', 'bootstrap_type': 'Bernoulli', 'subsample': 0.3600728315333776}. Best is trial 71 with value: 0.890909090909091.
[32m[I 2023-04-26 11:06:21,816][39m Trial 385 finished with value: 0.8828828828828829 and parameters: {'objective': 'CrossEntropy', 'colsample_bylevel': 0.09676650564480094, 'depth': 8, 'boosting_type': 'Ordered', 'bootstrap_type': 'Bayesian', 'bagging_temperature': 9.179534019677885}. Best is trial 71 with value: 0.890909090909091.
[32m[I 2023-04-26 11:06:25,959][39m Trial 386 finished with value: 0.8672566371681416 and parameters: {'objective': 'CrossEntropy', 'colsample_bylevel': 0.09240315230707509, 'depth': 3, 'boosting_type': 'Ordered', 'bootstrap_type': 'Bayesian', 'bagging_temperature': 9.358492042972408}. Best is trial 71 with value: 0.890909090909091.
[32m[I 2023-04-26 11:06:30,930][39m Trial 387 finished with value: 0.875 and parameters: {'objective': 'CrossEntropy', 'colsample_bylevel': 0.09832376146290213, 'depth': 7, 'boosting_type': 'Ordered', 'bootstrap_type': 'Bayesian', 'bagging_temperature': 5.696809635372926}. Best is trial 71 with value: 0.890909090909091.
[32m[I 2023-04-26 11:06:33,079][39m Trial 388 finished with value: 0.8495575221238938 and parameters: {'objective': 'CrossEntropy', 'colsample_bylevel': 0.09113225155235172, 'depth': 7, 'boosting_type': 'Plain', 'bootstrap_type': 'Bernoulli', 'subsample': 0.9380056595002872}. Best is trial 71 with value: 0.890909090909091.
[32m[I 2023-04-26 11:06:36,542][39m Trial 389 finished with value: 0.8448275862068967 and parameters: {'objective': 'CrossEntropy', 'colsample_bylevel': 0.08822564904620903, 'depth': 1, 'boosting_type': 'Ordered', 'bootstrap_type': 'Bayesian', 'bagging_temperature': 8.892782934964337}. Best is trial 71 with value: 0.890909090909091.
[32m[I 2023-04-26 11:06:41,363][39m Trial 390 finished with value: 0.8672566371681416 and parameters: {'objective': 'CrossEntropy', 'colsample_bylevel': 0.09069859484698735, 'depth': 7, 'boosting_type': 'Ordered', 'bootstrap_type': 'Bayesian', 'bagging_temperature': 2.6650470576751273}. Best is trial 71 with value: 0.890909090909091.
[32m[I 2023-04-26 11:06:43,351][39m Trial 391 finished with value: 0.8468468468468469 and parameters: {'objective': 'CrossEntropy', 'colsample_bylevel': 0.0952240094274878, 'depth': 12, 'boosting_type': 'Plain', 'bootstrap_type': 'Bayesian', 'bagging_temperature': 3.237202250795925}. Best is trial 71 with value: 0.890909090909091.
[32m[I 2023-04-26 11:06:44,858][39m Trial 392 finished with value: 0.8596491228070176 and parameters: {'objective': 'CrossEntropy', 'colsample_bylevel': 0.08566554499323194, 'depth': 10, 'boosting_type': 'Plain', 'bootstrap_type': 'MVS'}. Best is trial 71 with value: 0.890909090909091.
[32m[I 2023-04-26 11:06:47,550][39m Trial 393 finished with value: 0.8672566371681416 and parameters: {'objective': 'CrossEntropy', 'colsample_bylevel': 0.08650723176682966, 'depth': 9, 'boosting_type': 'Plain', 'bootstrap_type': 'Bernoulli', 'subsample': 0.20369948318308806}. Best is trial 71 with value: 0.890909090909091.
[32m[I 2023-04-26 11:06:49,365][39m Trial 394 finished with value: 0.875 and parameters: {'objective': 'CrossEntropy', 'colsample_bylevel': 0.0929954436579745, 'depth': 7, 'boosting_type': 'Plain', 'bootstrap_type': 'Bayesian', 'bagging_temperature': 1.2774042090324351}. Best is trial 71 with value: 0.890909090909091.
[32m[I 2023-04-26 11:06:51,540][39m Trial 395 finished with value: 0.8672566371681416 and parameters: {'objective': 'Logloss', 'colsample_bylevel': 0.0843505809964986, 'depth': 6, 'boosting_type': 'Plain', 'bootstrap_type': 'Bayesian', 'bagging_temperature': 2.9088428943702462}. Best is trial 71 with value: 0.890909090909091.
[32m[I 2023-04-26 11:06:55,734][39m Trial 396 finished with value: 0.8596491228070176 and parameters: {'objective': 'CrossEntropy', 'colsample_bylevel': 0.09839848813126871, 'depth': 3, 'boosting_type': 'Ordered', 'bootstrap_type': 'Bayesian', 'bagging_temperature': 2.50357881845374}. Best is trial 71 with value: 0.890909090909091.
[32m[I 2023-04-26 11:07:00,076][39m Trial 397 finished with value: 0.8596491228070176 and parameters: {'objective': 'CrossEntropy', 'colsample_bylevel': 0.08091101776424035, 'depth': 7, 'boosting_type': 'Ordered', 'bootstrap_type': 'Bayesian', 'bagging_temperature': 2.730898718638544}. Best is trial 71 with value: 0.890909090909091.
[32m[I 2023-04-26 11:07:02,707][39m Trial 398 finished with value: 0.8672566371681416 and parameters: {'objective': 'CrossEntropy', 'colsample_bylevel': 0.09515870618519848, 'depth': 4, 'boosting_type': 'Plain', 'bootstrap_type': 'Bayesian', 'bagging_temperature': 9.505750185836126}. Best is trial 71 with value: 0.890909090909091.
[32m[I 2023-04-26 11:07:05,161][39m Trial 399 finished with value: 0.875 and parameters: {'objective': 'CrossEntropy', 'colsample_bylevel': 0.09592413683226231, 'depth': 7, 'boosting_type': 'Plain', 'bootstrap_type': 'Bayesian', 'bagging_temperature': 3.1223133095474944}. Best is trial 71 with value: 0.890909090909091.
[32m[I 2023-04-26 11:07:07,485][39m Trial 400 finished with value: 0.8596491228070176 and parameters: {'objective': 'CrossEntropy', 'colsample_bylevel': 0.08928195262936797, 'depth': 7, 'boosting_type': 'Plain', 'bootstrap_type': 'Bernoulli', 'subsample': 0.29210006720852405}. Best is trial 71 with value: 0.890909090909091.
