[32m[I 2023-04-26 11:09:58,964][39m Trial 468 finished with value: 0.8828828828828829 and parameters: {'objective': 'CrossEntropy', 'colsample_bylevel': 0.08734009253821917, 'depth': 10, 'boosting_type': 'Ordered', 'bootstrap_type': 'Bayesian', 'bagging_temperature': 7.638992523299874}. Best is trial 71 with value: 0.890909090909091.
[32m[I 2023-04-26 11:10:04,227][39m Trial 469 finished with value: 0.8596491228070176 and parameters: {'objective': 'CrossEntropy', 'colsample_bylevel': 0.09676456818558943, 'depth': 8, 'boosting_type': 'Ordered', 'bootstrap_type': 'Bayesian', 'bagging_temperature': 7.856502682692277}. Best is trial 71 with value: 0.890909090909091.
[32m[I 2023-04-26 11:10:06,305][39m Trial 470 finished with value: 0.875 and parameters: {'objective': 'CrossEntropy', 'colsample_bylevel': 0.08929830350992857, 'depth': 10, 'boosting_type': 'Plain', 'bootstrap_type': 'Bayesian', 'bagging_temperature': 3.271267581418943}. Best is trial 71 with value: 0.890909090909091.
[32m[I 2023-04-26 11:10:08,828][39m Trial 471 finished with value: 0.8828828828828829 and parameters: {'objective': 'CrossEntropy', 'colsample_bylevel': 0.08799219439674788, 'depth': 11, 'boosting_type': 'Plain', 'bootstrap_type': 'Bayesian', 'bagging_temperature': 8.947043280531068}. Best is trial 71 with value: 0.890909090909091.
[32m[I 2023-04-26 11:10:13,795][39m Trial 472 finished with value: 0.890909090909091 and parameters: {'objective': 'CrossEntropy', 'colsample_bylevel': 0.08779409979445377, 'depth': 11, 'boosting_type': 'Ordered', 'bootstrap_type': 'Bayesian', 'bagging_temperature': 9.01110556817322}. Best is trial 71 with value: 0.890909090909091.
[32m[I 2023-04-26 11:10:19,046][39m Trial 473 finished with value: 0.8828828828828829 and parameters: {'objective': 'Logloss', 'colsample_bylevel': 0.0952522632476648, 'depth': 9, 'boosting_type': 'Ordered', 'bootstrap_type': 'Bayesian', 'bagging_temperature': 9.257335373951898}. Best is trial 71 with value: 0.890909090909091.
[32m[I 2023-04-26 11:10:23,570][39m Trial 474 finished with value: 0.8648648648648648 and parameters: {'objective': 'Logloss', 'colsample_bylevel': 0.08373518112599412, 'depth': 9, 'boosting_type': 'Ordered', 'bootstrap_type': 'Bayesian', 'bagging_temperature': 9.385774692349733}. Best is trial 71 with value: 0.890909090909091.
[32m[I 2023-04-26 11:10:25,261][39m Trial 475 finished with value: 0.8672566371681416 and parameters: {'objective': 'CrossEntropy', 'colsample_bylevel': 0.09145772894217939, 'depth': 6, 'boosting_type': 'Plain', 'bootstrap_type': 'Bayesian', 'bagging_temperature': 7.082635952742054}. Best is trial 71 with value: 0.890909090909091.
[32m[I 2023-04-26 11:10:27,506][39m Trial 476 finished with value: 0.8672566371681416 and parameters: {'objective': 'CrossEntropy', 'colsample_bylevel': 0.09165322343528326, 'depth': 6, 'boosting_type': 'Plain', 'bootstrap_type': 'MVS'}. Best is trial 71 with value: 0.890909090909091.
[32m[I 2023-04-26 11:10:29,670][39m Trial 477 finished with value: 0.8672566371681416 and parameters: {'objective': 'CrossEntropy', 'colsample_bylevel': 0.0999857018047887, 'depth': 11, 'boosting_type': 'Plain', 'bootstrap_type': 'Bayesian', 'bagging_temperature': 3.2750953747316323}. Best is trial 71 with value: 0.890909090909091.
[32m[I 2023-04-26 11:10:31,351][39m Trial 478 finished with value: 0.8468468468468469 and parameters: {'objective': 'CrossEntropy', 'colsample_bylevel': 0.08955690571302789, 'depth': 11, 'boosting_type': 'Plain', 'bootstrap_type': 'Bayesian', 'bagging_temperature': 1.5574794795939448}. Best is trial 71 with value: 0.890909090909091.
[32m[I 2023-04-26 11:10:33,322][39m Trial 479 finished with value: 0.875 and parameters: {'objective': 'CrossEntropy', 'colsample_bylevel': 0.09632150297430679, 'depth': 11, 'boosting_type': 'Plain', 'bootstrap_type': 'Bayesian', 'bagging_temperature': 1.7525837148227161}. Best is trial 71 with value: 0.890909090909091.
[32m[I 2023-04-26 11:10:34,756][39m Trial 480 finished with value: 0.8672566371681416 and parameters: {'objective': 'CrossEntropy', 'colsample_bylevel': 0.03500787541524274, 'depth': 11, 'boosting_type': 'Plain', 'bootstrap_type': 'Bayesian', 'bagging_temperature': 3.4956741360847974}. Best is trial 71 with value: 0.890909090909091.
[32m[I 2023-04-26 11:10:36,921][39m Trial 481 finished with value: 0.8828828828828829 and parameters: {'objective': 'CrossEntropy', 'colsample_bylevel': 0.08797136960295066, 'depth': 11, 'boosting_type': 'Plain', 'bootstrap_type': 'Bayesian', 'bagging_temperature': 1.9529601175733167}. Best is trial 71 with value: 0.890909090909091.
[32m[I 2023-04-26 11:10:39,260][39m Trial 482 finished with value: 0.875 and parameters: {'objective': 'CrossEntropy', 'colsample_bylevel': 0.09258330670667449, 'depth': 12, 'boosting_type': 'Plain', 'bootstrap_type': 'Bernoulli', 'subsample': 0.22809037179608677}. Best is trial 71 with value: 0.890909090909091.
[32m[I 2023-04-26 11:10:44,398][39m Trial 483 finished with value: 0.875 and parameters: {'objective': 'CrossEntropy', 'colsample_bylevel': 0.09356239622743197, 'depth': 8, 'boosting_type': 'Ordered', 'bootstrap_type': 'Bayesian', 'bagging_temperature': 3.4292554487610643}. Best is trial 71 with value: 0.890909090909091.
[32m[I 2023-04-26 11:10:48,874][39m Trial 484 finished with value: 0.875 and parameters: {'objective': 'CrossEntropy', 'colsample_bylevel': 0.0931179129136888, 'depth': 9, 'boosting_type': 'Plain', 'bootstrap_type': 'Bayesian', 'bagging_temperature': 3.0850217393690507}. Best is trial 71 with value: 0.890909090909091.
[32m[I 2023-04-26 11:10:50,422][39m Trial 485 finished with value: 0.8495575221238938 and parameters: {'objective': 'CrossEntropy', 'colsample_bylevel': 0.09550917337261383, 'depth': 10, 'boosting_type': 'Plain', 'bootstrap_type': 'Bayesian', 'bagging_temperature': 2.468792562208018}. Best is trial 71 with value: 0.890909090909091.
[32m[I 2023-04-26 11:10:55,585][39m Trial 486 finished with value: 0.8596491228070176 and parameters: {'objective': 'CrossEntropy', 'colsample_bylevel': 0.08565948416582228, 'depth': 5, 'boosting_type': 'Ordered', 'bootstrap_type': 'Bayesian', 'bagging_temperature': 2.8617509227114883}. Best is trial 71 with value: 0.890909090909091.
[32m[I 2023-04-26 11:10:58,268][39m Trial 487 finished with value: 0.8672566371681416 and parameters: {'objective': 'CrossEntropy', 'colsample_bylevel': 0.09876120208053837, 'depth': 11, 'boosting_type': 'Plain', 'bootstrap_type': 'Bayesian', 'bagging_temperature': 8.153828308701188}. Best is trial 71 with value: 0.890909090909091.
[32m[I 2023-04-26 11:11:00,372][39m Trial 488 finished with value: 0.875 and parameters: {'objective': 'CrossEntropy', 'colsample_bylevel': 0.09808312944501543, 'depth': 6, 'boosting_type': 'Plain', 'bootstrap_type': 'Bayesian', 'bagging_temperature': 8.899636674102606}. Best is trial 71 with value: 0.890909090909091.
[32m[I 2023-04-26 11:11:02,870][39m Trial 489 finished with value: 0.8672566371681416 and parameters: {'objective': 'CrossEntropy', 'colsample_bylevel': 0.09671636996349336, 'depth': 7, 'boosting_type': 'Plain', 'bootstrap_type': 'Bayesian', 'bagging_temperature': 8.358053744189816}. Best is trial 71 with value: 0.890909090909091.
[32m[I 2023-04-26 11:11:04,915][39m Trial 490 finished with value: 0.8596491228070176 and parameters: {'objective': 'Logloss', 'colsample_bylevel': 0.09398360143540939, 'depth': 3, 'boosting_type': 'Plain', 'bootstrap_type': 'Bayesian', 'bagging_temperature': 0.8515918051194046}. Best is trial 71 with value: 0.890909090909091.
[32m[I 2023-04-26 11:11:06,736][39m Trial 491 finished with value: 0.8596491228070176 and parameters: {'objective': 'CrossEntropy', 'colsample_bylevel': 0.09399365416378816, 'depth': 5, 'boosting_type': 'Plain', 'bootstrap_type': 'Bernoulli', 'subsample': 0.778190500678108}. Best is trial 71 with value: 0.890909090909091.
[32m[I 2023-04-26 11:11:08,487][39m Trial 492 finished with value: 0.8672566371681416 and parameters: {'objective': 'CrossEntropy', 'colsample_bylevel': 0.08816308148800331, 'depth': 5, 'boosting_type': 'Plain', 'bootstrap_type': 'Bayesian', 'bagging_temperature': 2.8378195014861056}. Best is trial 71 with value: 0.890909090909091.
[32m[I 2023-04-26 11:11:10,610][39m Trial 493 finished with value: 0.8695652173913043 and parameters: {'objective': 'CrossEntropy', 'colsample_bylevel': 0.08682469242148769, 'depth': 5, 'boosting_type': 'Plain', 'bootstrap_type': 'Bayesian', 'bagging_temperature': 8.921855543628038}. Best is trial 71 with value: 0.890909090909091.
[32m[I 2023-04-26 11:11:13,017][39m Trial 494 finished with value: 0.875 and parameters: {'objective': 'CrossEntropy', 'colsample_bylevel': 0.09882201321551291, 'depth': 7, 'boosting_type': 'Plain', 'bootstrap_type': 'Bayesian', 'bagging_temperature': 2.433428625282928}. Best is trial 71 with value: 0.890909090909091.
[32m[I 2023-04-26 11:11:14,877][39m Trial 495 finished with value: 0.8545454545454546 and parameters: {'objective': 'CrossEntropy', 'colsample_bylevel': 0.09271217147786268, 'depth': 6, 'boosting_type': 'Plain', 'bootstrap_type': 'Bayesian', 'bagging_temperature': 4.170608352043331}. Best is trial 71 with value: 0.890909090909091.
[32m[I 2023-04-26 11:11:17,358][39m Trial 496 finished with value: 0.8468468468468469 and parameters: {'objective': 'CrossEntropy', 'colsample_bylevel': 0.09018934725027629, 'depth': 10, 'boosting_type': 'Plain', 'bootstrap_type': 'Bayesian', 'bagging_temperature': 9.708104694944733}. Best is trial 71 with value: 0.890909090909091.
[32m[I 2023-04-26 11:11:22,201][39m Trial 497 finished with value: 0.8672566371681416 and parameters: {'objective': 'CrossEntropy', 'colsample_bylevel': 0.08746581793612786, 'depth': 11, 'boosting_type': 'Ordered', 'bootstrap_type': 'Bayesian', 'bagging_temperature': 8.500185790334696}. Best is trial 71 with value: 0.890909090909091.
[32m[I 2023-04-26 11:11:23,798][39m Trial 498 finished with value: 0.8571428571428572 and parameters: {'objective': 'CrossEntropy', 'colsample_bylevel': 0.08484095071433558, 'depth': 5, 'boosting_type': 'Plain', 'bootstrap_type': 'Bayesian', 'bagging_temperature': 8.712135121092333}. Best is trial 71 with value: 0.890909090909091.
[32m[I 2023-04-26 11:11:25,933][39m Trial 499 finished with value: 0.875 and parameters: {'objective': 'CrossEntropy', 'colsample_bylevel': 0.08827133533132064, 'depth': 10, 'boosting_type': 'Plain', 'bootstrap_type': 'Bayesian', 'bagging_temperature': 9.189391754774622}. Best is trial 71 with value: 0.890909090909091.
Number of finished trials: 500