
[32m[I 2023-04-26 10:51:21,033][39m A new study created in memory with name: no-name-6d4d490f-b9d3-4bd0-87c7-21bbf420b4c1
[32m[I 2023-04-26 10:51:22,913][39m Trial 0 finished with value: 0.8672566371681416 and parameters: {'objective': 'CrossEntropy', 'colsample_bylevel': 0.03994544918451131, 'depth': 8, 'boosting_type': 'Plain', 'bootstrap_type': 'MVS'}. Best is trial 0 with value: 0.8672566371681416.
[32m[I 2023-04-26 10:51:25,604][39m Trial 1 finished with value: 0.8421052631578947 and parameters: {'objective': 'CrossEntropy', 'colsample_bylevel': 0.030367403381104885, 'depth': 12, 'boosting_type': 'Ordered', 'bootstrap_type': 'MVS'}. Best is trial 0 with value: 0.8672566371681416.
[32m[I 2023-04-26 10:51:28,257][39m Trial 2 finished with value: 0.875 and parameters: {'objective': 'CrossEntropy', 'colsample_bylevel': 0.08910445495921897, 'depth': 8, 'boosting_type': 'Plain', 'bootstrap_type': 'Bayesian', 'bagging_temperature': 7.417594298359777}. Best is trial 2 with value: 0.875.
[32m[I 2023-04-26 10:51:30,243][39m Trial 3 finished with value: 0.8596491228070176 and parameters: {'objective': 'CrossEntropy', 'colsample_bylevel': 0.07004848419418278, 'depth': 8, 'boosting_type': 'Plain', 'bootstrap_type': 'Bayesian', 'bagging_temperature': 1.9686337710565205}. Best is trial 2 with value: 0.875.
[32m[I 2023-04-26 10:51:31,616][39m Trial 4 finished with value: 0.875 and parameters: {'objective': 'CrossEntropy', 'colsample_bylevel': 0.09734039473387902, 'depth': 6, 'boosting_type': 'Plain', 'bootstrap_type': 'MVS'}. Best is trial 2 with value: 0.875.
[32m[I 2023-04-26 10:51:34,799][39m Trial 5 finished with value: 0.8521739130434783 and parameters: {'objective': 'CrossEntropy', 'colsample_bylevel': 0.0792391482545682, 'depth': 4, 'boosting_type': 'Ordered', 'bootstrap_type': 'MVS'}. Best is trial 2 with value: 0.875.
[32m[I 2023-04-26 10:51:35,943][39m Trial 6 finished with value: 0.8205128205128206 and parameters: {'objective': 'CrossEntropy', 'colsample_bylevel': 0.023234903652154314, 'depth': 5, 'boosting_type': 'Plain', 'bootstrap_type': 'Bayesian', 'bagging_temperature': 3.1192024761704182}. Best is trial 2 with value: 0.875.
[32m[I 2023-04-26 10:51:39,510][39m Trial 7 finished with value: 0.8596491228070176 and parameters: {'objective': 'Logloss', 'colsample_bylevel': 0.07896495756913538, 'depth': 3, 'boosting_type': 'Ordered', 'bootstrap_type': 'Bernoulli', 'subsample': 0.757195372799992}. Best is trial 2 with value: 0.875.
[32m[I 2023-04-26 10:51:40,790][39m Trial 8 finished with value: 0.8347826086956522 and parameters: {'objective': 'Logloss', 'colsample_bylevel': 0.07282868382579012, 'depth': 1, 'boosting_type': 'Plain', 'bootstrap_type': 'MVS'}. Best is trial 2 with value: 0.875.
[32m[I 2023-04-26 10:51:43,909][39m Trial 9 finished with value: 0.8035714285714286 and parameters: {'objective': 'Logloss', 'colsample_bylevel': 0.09599906232240037, 'depth': 1, 'boosting_type': 'Ordered', 'bootstrap_type': 'Bayesian', 'bagging_temperature': 8.930500276671228}. Best is trial 2 with value: 0.875.
[32m[I 2023-04-26 10:51:45,430][39m Trial 10 finished with value: 0.8571428571428572 and parameters: {'objective': 'Logloss', 'colsample_bylevel': 0.05183713755252148, 'depth': 11, 'boosting_type': 'Plain', 'bootstrap_type': 'Bernoulli', 'subsample': 0.11182655281347187}. Best is trial 2 with value: 0.875.
[32m[I 2023-04-26 10:51:47,245][39m Trial 11 finished with value: 0.8596491228070176 and parameters: {'objective': 'CrossEntropy', 'colsample_bylevel': 0.09981681405501763, 'depth': 7, 'boosting_type': 'Plain', 'bootstrap_type': 'Bayesian', 'bagging_temperature': 7.943793644537574}. Best is trial 2 with value: 0.875.
[32m[I 2023-04-26 10:51:49,682][39m Trial 12 finished with value: 0.8596491228070176 and parameters: {'objective': 'CrossEntropy', 'colsample_bylevel': 0.09231927843107557, 'depth': 9, 'boosting_type': 'Plain', 'bootstrap_type': 'MVS'}. Best is trial 2 with value: 0.875.
[32m[I 2023-04-26 10:51:51,286][39m Trial 13 finished with value: 0.875 and parameters: {'objective': 'CrossEntropy', 'colsample_bylevel': 0.061512747421763575, 'depth': 6, 'boosting_type': 'Plain', 'bootstrap_type': 'Bayesian', 'bagging_temperature': 5.770467723431776}. Best is trial 2 with value: 0.875.
[32m[I 2023-04-26 10:51:53,279][39m Trial 14 finished with value: 0.8596491228070176 and parameters: {'objective': 'CrossEntropy', 'colsample_bylevel': 0.08891951660374309, 'depth': 10, 'boosting_type': 'Plain', 'bootstrap_type': 'Bernoulli', 'subsample': 0.9984826545624309}. Best is trial 2 with value: 0.875.
[32m[I 2023-04-26 10:51:55,039][39m Trial 15 finished with value: 0.875 and parameters: {'objective': 'CrossEntropy', 'colsample_bylevel': 0.08530505474064412, 'depth': 6, 'boosting_type': 'Plain', 'bootstrap_type': 'Bayesian', 'bagging_temperature': 6.446328757215356}. Best is trial 2 with value: 0.875.
[32m[I 2023-04-26 10:51:56,579][39m Trial 16 finished with value: 0.8392857142857144 and parameters: {'objective': 'CrossEntropy', 'colsample_bylevel': 0.05876423588511565, 'depth': 3, 'boosting_type': 'Plain', 'bootstrap_type': 'MVS'}. Best is trial 2 with value: 0.875.
[32m[I 2023-04-26 10:51:58,262][39m Trial 17 finished with value: 0.8521739130434783 and parameters: {'objective': 'CrossEntropy', 'colsample_bylevel': 0.046394491906381695, 'depth': 9, 'boosting_type': 'Plain', 'bootstrap_type': 'MVS'}. Best is trial 2 with value: 0.875.
[32m[I 2023-04-26 10:52:02,495][39m Trial 18 finished with value: 0.8672566371681416 and parameters: {'objective': 'Logloss', 'colsample_bylevel': 0.0852719836764736, 'depth': 7, 'boosting_type': 'Ordered', 'bootstrap_type': 'Bayesian', 'bagging_temperature': 5.721101776285301}. Best is trial 2 with value: 0.875.
[32m[I 2023-04-26 10:52:04,325][39m Trial 19 finished with value: 0.8672566371681416 and parameters: {'objective': 'CrossEntropy', 'colsample_bylevel': 0.06804989482761208, 'depth': 5, 'boosting_type': 'Plain', 'bootstrap_type': 'Bayesian', 'bagging_temperature': 6.8188066792660615}. Best is trial 2 with value: 0.875.
[32m[I 2023-04-26 10:52:05,476][39m Trial 20 finished with value: 0.8073394495412843 and parameters: {'objective': 'CrossEntropy', 'colsample_bylevel': 0.012500837001151552, 'depth': 10, 'boosting_type': 'Plain', 'bootstrap_type': 'Bayesian', 'bagging_temperature': 3.905938256101569}. Best is trial 2 with value: 0.875.
[32m[I 2023-04-26 10:52:07,512][39m Trial 21 finished with value: 0.875 and parameters: {'objective': 'CrossEntropy', 'colsample_bylevel': 0.08443024580528058, 'depth': 6, 'boosting_type': 'Plain', 'bootstrap_type': 'Bayesian', 'bagging_temperature': 9.781637448291582}. Best is trial 2 with value: 0.875.
[32m[I 2023-04-26 10:52:09,466][39m Trial 22 finished with value: 0.8596491228070176 and parameters: {'objective': 'CrossEntropy', 'colsample_bylevel': 0.07923781844423089, 'depth': 5, 'boosting_type': 'Plain', 'bootstrap_type': 'Bayesian', 'bagging_temperature': 9.987468884982416}. Best is trial 2 with value: 0.875.
[32m[I 2023-04-26 10:52:12,196][39m Trial 23 finished with value: 0.8672566371681416 and parameters: {'objective': 'CrossEntropy', 'colsample_bylevel': 0.0994969399342589, 'depth': 8, 'boosting_type': 'Plain', 'bootstrap_type': 'Bernoulli', 'subsample': 0.2506668371571364}. Best is trial 2 with value: 0.875.
[32m[I 2023-04-26 10:52:14,262][39m Trial 24 finished with value: 0.8448275862068967 and parameters: {'objective': 'CrossEntropy', 'colsample_bylevel': 0.09089305300435284, 'depth': 7, 'boosting_type': 'Plain', 'bootstrap_type': 'Bayesian', 'bagging_temperature': 8.109702490062675}. Best is trial 2 with value: 0.875.
[32m[I 2023-04-26 10:52:15,924][39m Trial 25 finished with value: 0.8596491228070176 and parameters: {'objective': 'CrossEntropy', 'colsample_bylevel': 0.08352187086576379, 'depth': 4, 'boosting_type': 'Plain', 'bootstrap_type': 'MVS'}. Best is trial 2 with value: 0.875.
[32m[I 2023-04-26 10:52:20,548][39m Trial 26 finished with value: 0.8648648648648648 and parameters: {'objective': 'Logloss', 'colsample_bylevel': 0.06502240923417998, 'depth': 6, 'boosting_type': 'Ordered', 'bootstrap_type': 'Bayesian', 'bagging_temperature': 9.939606906936822}. Best is trial 2 with value: 0.875.
[32m[I 2023-04-26 10:52:22,707][39m Trial 27 finished with value: 0.8392857142857144 and parameters: {'objective': 'CrossEntropy', 'colsample_bylevel': 0.06106984415587508, 'depth': 9, 'boosting_type': 'Plain', 'bootstrap_type': 'Bayesian', 'bagging_temperature': 4.524451027652668}. Best is trial 2 with value: 0.875.
[32m[I 2023-04-26 10:52:24,254][39m Trial 28 finished with value: 0.8727272727272727 and parameters: {'objective': 'CrossEntropy', 'colsample_bylevel': 0.050445699442632316, 'depth': 4, 'boosting_type': 'Plain', 'bootstrap_type': 'Bayesian', 'bagging_temperature': 7.305903067388115}. Best is trial 2 with value: 0.875.
[32m[I 2023-04-26 10:52:26,379][39m Trial 29 finished with value: 0.8596491228070176 and parameters: {'objective': 'CrossEntropy', 'colsample_bylevel': 0.07527659991861249, 'depth': 8, 'boosting_type': 'Plain', 'bootstrap_type': 'MVS'}. Best is trial 2 with value: 0.875.
[32m[I 2023-04-26 10:52:28,180][39m Trial 30 finished with value: 0.8672566371681416 and parameters: {'objective': 'CrossEntropy', 'colsample_bylevel': 0.09378161720286615, 'depth': 7, 'boosting_type': 'Plain', 'bootstrap_type': 'Bernoulli', 'subsample': 0.4723356301014733}. Best is trial 2 with value: 0.875.
[32m[I 2023-04-26 10:52:30,213][39m Trial 31 finished with value: 0.875 and parameters: {'objective': 'CrossEntropy', 'colsample_bylevel': 0.08656759124913076, 'depth': 6, 'boosting_type': 'Plain', 'bootstrap_type': 'Bayesian', 'bagging_temperature': 6.350086204107887}. Best is trial 2 with value: 0.875.
[32m[I 2023-04-26 10:52:31,775][39m Trial 32 finished with value: 0.875 and parameters: {'objective': 'CrossEntropy', 'colsample_bylevel': 0.0824657682810125, 'depth': 6, 'boosting_type': 'Plain', 'bootstrap_type': 'Bayesian', 'bagging_temperature': 0.2906867944165965}. Best is trial 2 with value: 0.875.
[32m[I 2023-04-26 10:52:33,197][39m Trial 33 finished with value: 0.8448275862068967 and parameters: {'objective': 'CrossEntropy', 'colsample_bylevel': 0.03728504646919614, 'depth': 5, 'boosting_type': 'Plain', 'bootstrap_type': 'Bayesian', 'bagging_temperature': 0.38926185249187295}. Best is trial 2 with value: 0.875.
[32m[I 2023-04-26 10:52:36,280][39m Trial 34 finished with value: 0.8672566371681416 and parameters: {'objective': 'CrossEntropy', 'colsample_bylevel': 0.08851042169949036, 'depth': 8, 'boosting_type': 'Ordered', 'bootstrap_type': 'MVS'}. Best is trial 2 with value: 0.875.
[32m[I 2023-04-26 10:52:38,376][39m Trial 35 finished with value: 0.8596491228070176 and parameters: {'objective': 'CrossEntropy', 'colsample_bylevel': 0.0952570579669387, 'depth': 3, 'boosting_type': 'Plain', 'bootstrap_type': 'Bayesian', 'bagging_temperature': 1.253801611987773}. Best is trial 2 with value: 0.875.
[32m[I 2023-04-26 10:52:40,677][39m Trial 36 finished with value: 0.8672566371681416 and parameters: {'objective': 'CrossEntropy', 'colsample_bylevel': 0.07563436631555351, 'depth': 7, 'boosting_type': 'Plain', 'bootstrap_type': 'MVS'}. Best is trial 2 with value: 0.875.
[32m[I 2023-04-26 10:52:45,106][39m Trial 37 finished with value: 0.875 and parameters: {'objective': 'CrossEntropy', 'colsample_bylevel': 0.07942492343538075, 'depth': 12, 'boosting_type': 'Ordered', 'bootstrap_type': 'Bayesian', 'bagging_temperature': 5.160645107644071}. Best is trial 2 with value: 0.875.
[32m[I 2023-04-26 10:52:49,401][39m Trial 38 finished with value: 0.8672566371681416 and parameters: {'objective': 'Logloss', 'colsample_bylevel': 0.0691316757138954, 'depth': 12, 'boosting_type': 'Ordered', 'bootstrap_type': 'MVS'}. Best is trial 2 with value: 0.875.
[32m[I 2023-04-26 10:52:51,607][39m Trial 39 finished with value: 0.875 and parameters: {'objective': 'CrossEntropy', 'colsample_bylevel': 0.0967378462259043, 'depth': 5, 'boosting_type': 'Plain', 'bootstrap_type': 'Bayesian', 'bagging_temperature': 2.858509638190424}. Best is trial 2 with value: 0.875.
[32m[I 2023-04-26 10:52:57,653][39m Trial 40 finished with value: 0.8672566371681416 and parameters: {'objective': 'Logloss', 'colsample_bylevel': 0.09895619388571046, 'depth': 12, 'boosting_type': 'Ordered', 'bootstrap_type': 'Bernoulli', 'subsample': 0.5681184080787}. Best is trial 2 with value: 0.875.
[32m[I 2023-04-26 10:53:02,313][39m Trial 41 finished with value: 0.8672566371681416 and parameters: {'objective': 'CrossEntropy', 'colsample_bylevel': 0.08831677229683467, 'depth': 11, 'boosting_type': 'Ordered', 'bootstrap_type': 'Bayesian', 'bagging_temperature': 6.272469371615307}. Best is trial 2 with value: 0.875.
[32m[I 2023-04-26 10:53:04,539][39m Trial 42 finished with value: 0.8828828828828829 and parameters: {'objective': 'CrossEntropy', 'colsample_bylevel': 0.08216224914710532, 'depth': 5, 'boosting_type': 'Plain', 'bootstrap_type': 'Bayesian', 'bagging_temperature': 2.337098793180769}. Best is trial 42 with value: 0.8828828828828829.
[32m[I 2023-04-26 10:53:08,429][39m Trial 43 finished with value: 0.8596491228070176 and parameters: {'objective': 'CrossEntropy', 'colsample_bylevel': 0.07141465825307539, 'depth': 4, 'boosting_type': 'Ordered', 'bootstrap_type': 'Bayesian', 'bagging_temperature': 2.619809056640543}. Best is trial 42 with value: 0.8828828828828829.
[32m[I 2023-04-26 10:53:10,498][39m Trial 44 finished with value: 0.8828828828828829 and parameters: {'objective': 'CrossEntropy', 'colsample_bylevel': 0.08213826506745371, 'depth': 6, 'boosting_type': 'Plain', 'bootstrap_type': 'Bayesian', 'bagging_temperature': 9.1631942258863}. Best is trial 42 with value: 0.8828828828828829.
[32m[I 2023-04-26 10:53:12,439][39m Trial 45 finished with value: 0.8672566371681416 and parameters: {'objective': 'CrossEntropy', 'colsample_bylevel': 0.07585048729985619, 'depth': 6, 'boosting_type': 'Plain', 'bootstrap_type': 'Bayesian', 'bagging_temperature': 5.9770394636161965}. Best is trial 42 with value: 0.8828828828828829.
[32m[I 2023-04-26 10:53:14,258][39m Trial 46 finished with value: 0.8672566371681416 and parameters: {'objective': 'CrossEntropy', 'colsample_bylevel': 0.09193163500550108, 'depth': 2, 'boosting_type': 'Plain', 'bootstrap_type': 'Bayesian', 'bagging_temperature': 9.075081679957183}. Best is trial 42 with value: 0.8828828828828829.
[32m[I 2023-04-26 10:53:19,431][39m Trial 47 finished with value: 0.8596491228070176 and parameters: {'objective': 'CrossEntropy', 'colsample_bylevel': 0.08228308387639247, 'depth': 5, 'boosting_type': 'Ordered', 'bootstrap_type': 'Bayesian', 'bagging_temperature': 5.0329317762631565}. Best is trial 42 with value: 0.8828828828828829.
[32m[I 2023-04-26 10:53:23,434][39m Trial 48 finished with value: 0.8672566371681416 and parameters: {'objective': 'CrossEntropy', 'colsample_bylevel': 0.0793347614612208, 'depth': 4, 'boosting_type': 'Ordered', 'bootstrap_type': 'Bayesian', 'bagging_temperature': 4.5884195360202416}. Best is trial 42 with value: 0.8828828828828829.
[32m[I 2023-04-26 10:53:26,004][39m Trial 49 finished with value: 0.8596491228070176 and parameters: {'objective': 'Logloss', 'colsample_bylevel': 0.0927762702625074, 'depth': 7, 'boosting_type': 'Plain', 'bootstrap_type': 'MVS'}. Best is trial 42 with value: 0.8828828828828829.
[32m[I 2023-04-26 10:53:30,486][39m Trial 50 finished with value: 0.8648648648648648 and parameters: {'objective': 'CrossEntropy', 'colsample_bylevel': 0.07954192728285801, 'depth': 11, 'boosting_type': 'Ordered', 'bootstrap_type': 'Bayesian', 'bagging_temperature': 7.7390136377927305}. Best is trial 42 with value: 0.8828828828828829.
[32m[I 2023-04-26 10:53:32,462][39m Trial 51 finished with value: 0.8828828828828829 and parameters: {'objective': 'CrossEntropy', 'colsample_bylevel': 0.08576580317362575, 'depth': 10, 'boosting_type': 'Plain', 'bootstrap_type': 'Bayesian', 'bagging_temperature': 8.771312579640595}. Best is trial 42 with value: 0.8828828828828829.
[32m[I 2023-04-26 10:53:35,457][39m Trial 52 finished with value: 0.8571428571428572 and parameters: {'objective': 'CrossEntropy', 'colsample_bylevel': 0.08747640576857146, 'depth': 9, 'boosting_type': 'Plain', 'bootstrap_type': 'Bayesian', 'bagging_temperature': 8.809178449106142}. Best is trial 42 with value: 0.8828828828828829.
[32m[I 2023-04-26 10:53:36,913][39m Trial 53 finished with value: 0.8672566371681416 and parameters: {'objective': 'CrossEntropy', 'colsample_bylevel': 0.0833651512947541, 'depth': 6, 'boosting_type': 'Plain', 'bootstrap_type': 'Bayesian', 'bagging_temperature': 0.5813227305691981}. Best is trial 42 with value: 0.8828828828828829.
[32m[I 2023-04-26 10:53:38,938][39m Trial 54 finished with value: 0.875 and parameters: {'objective': 'CrossEntropy', 'colsample_bylevel': 0.09710616539579246, 'depth': 5, 'boosting_type': 'Plain', 'bootstrap_type': 'Bayesian', 'bagging_temperature': 1.758137944607179}. Best is trial 42 with value: 0.8828828828828829.
[32m[I 2023-04-26 10:53:40,935][39m Trial 55 finished with value: 0.8672566371681416 and parameters: {'objective': 'CrossEntropy', 'colsample_bylevel': 0.08538304367210056, 'depth': 6, 'boosting_type': 'Plain', 'bootstrap_type': 'Bayesian', 'bagging_temperature': 9.36267082689497}. Best is trial 42 with value: 0.8828828828828829.
[32m[I 2023-04-26 10:53:42,984][39m Trial 56 finished with value: 0.8672566371681416 and parameters: {'objective': 'CrossEntropy', 'colsample_bylevel': 0.08962365144319079, 'depth': 5, 'boosting_type': 'Plain', 'bootstrap_type': 'Bayesian', 'bagging_temperature': 2.9315633098481184}. Best is trial 42 with value: 0.8828828828828829.
[32m[I 2023-04-26 10:53:44,735][39m Trial 57 finished with value: 0.8828828828828829 and parameters: {'objective': 'CrossEntropy', 'colsample_bylevel': 0.09470684125086194, 'depth': 10, 'boosting_type': 'Plain', 'bootstrap_type': 'Bayesian', 'bagging_temperature': 1.8533394438872537}. Best is trial 42 with value: 0.8828828828828829.
[32m[I 2023-04-26 10:53:46,333][39m Trial 58 finished with value: 0.8596491228070176 and parameters: {'objective': 'CrossEntropy', 'colsample_bylevel': 0.09647049705225358, 'depth': 10, 'boosting_type': 'Plain', 'bootstrap_type': 'Bayesian', 'bagging_temperature': 1.7935895663238777}. Best is trial 42 with value: 0.8828828828828829.
[32m[I 2023-04-26 10:53:50,419][39m Trial 59 finished with value: 0.875 and parameters: {'objective': 'CrossEntropy', 'colsample_bylevel': 0.07354786009175639, 'depth': 10, 'boosting_type': 'Ordered', 'bootstrap_type': 'Bernoulli', 'subsample': 0.9831806422372082}. Best is trial 42 with value: 0.8828828828828829.
[32m[I 2023-04-26 10:53:52,382][39m Trial 60 finished with value: 0.8672566371681416 and parameters: {'objective': 'CrossEntropy', 'colsample_bylevel': 0.07360209550812899, 'depth': 10, 'boosting_type': 'Plain', 'bootstrap_type': 'Bernoulli', 'subsample': 0.9966046612058493}. Best is trial 42 with value: 0.8828828828828829.
[32m[I 2023-04-26 10:53:54,031][39m Trial 61 finished with value: 0.8571428571428572 and parameters: {'objective': 'CrossEntropy', 'colsample_bylevel': 0.04372438674440662, 'depth': 9, 'boosting_type': 'Plain', 'bootstrap_type': 'Bayesian', 'bagging_temperature': 8.21457758146406}. Best is trial 42 with value: 0.8828828828828829.
[32m[I 2023-04-26 10:53:55,970][39m Trial 62 finished with value: 0.8596491228070176 and parameters: {'objective': 'CrossEntropy', 'colsample_bylevel': 0.06671285413663697, 'depth': 10, 'boosting_type': 'Plain', 'bootstrap_type': 'Bernoulli', 'subsample': 0.7596256690289419}. Best is trial 42 with value: 0.8828828828828829.
[32m[I 2023-04-26 10:53:57,524][39m Trial 63 finished with value: 0.875 and parameters: {'objective': 'CrossEntropy', 'colsample_bylevel': 0.08147064442140915, 'depth': 11, 'boosting_type': 'Plain', 'bootstrap_type': 'Bayesian', 'bagging_temperature': 0.8428274790330014}. Best is trial 42 with value: 0.8828828828828829.
[32m[I 2023-04-26 10:53:59,480][39m Trial 64 finished with value: 0.8495575221238938 and parameters: {'objective': 'CrossEntropy', 'colsample_bylevel': 0.08683628343593, 'depth': 10, 'boosting_type': 'Plain', 'bootstrap_type': 'Bernoulli', 'subsample': 0.7851573512817284}. Best is trial 42 with value: 0.8828828828828829.
[32m[I 2023-04-26 10:54:01,606][39m Trial 65 finished with value: 0.8727272727272727 and parameters: {'objective': 'Logloss', 'colsample_bylevel': 0.0619591845157702, 'depth': 8, 'boosting_type': 'Plain', 'bootstrap_type': 'Bayesian', 'bagging_temperature': 3.403849840977342}. Best is trial 42 with value: 0.8828828828828829.
[32m[I 2023-04-26 10:54:03,111][39m Trial 66 finished with value: 0.8648648648648648 and parameters: {'objective': 'CrossEntropy', 'colsample_bylevel': 0.05617703671886821, 'depth': 12, 'boosting_type': 'Plain', 'bootstrap_type': 'Bayesian', 'bagging_temperature': 5.447844432648247}. Best is trial 42 with value: 0.8828828828828829.
[32m[I 2023-04-26 10:54:04,627][39m Trial 67 finished with value: 0.875 and parameters: {'objective': 'CrossEntropy', 'colsample_bylevel': 0.09972877515773623, 'depth': 11, 'boosting_type': 'Plain', 'bootstrap_type': 'MVS'}. Best is trial 42 with value: 0.8828828828828829.
[32m[I 2023-04-26 10:54:06,177][39m Trial 68 finished with value: 0.8596491228070176 and parameters: {'objective': 'CrossEntropy', 'colsample_bylevel': 0.09433880296909138, 'depth': 11, 'boosting_type': 'Plain', 'bootstrap_type': 'MVS'}. Best is trial 42 with value: 0.8828828828828829.
[32m[I 2023-04-26 10:54:07,375][39m Trial 69 finished with value: 0.8275862068965517 and parameters: {'objective': 'CrossEntropy', 'colsample_bylevel': 0.02152138235869261, 'depth': 12, 'boosting_type': 'Plain', 'bootstrap_type': 'MVS'}. Best is trial 42 with value: 0.8828828828828829.
