[32m[I 2023-04-26 11:01:19,830][39m Trial 269 finished with value: 0.875 and parameters: {'objective': 'CrossEntropy', 'colsample_bylevel': 0.09235493275869587, 'depth': 7, 'boosting_type': 'Plain', 'bootstrap_type': 'Bernoulli', 'subsample': 0.17025079518671227}. Best is trial 71 with value: 0.890909090909091.
[32m[I 2023-04-26 11:01:24,148][39m Trial 270 finished with value: 0.8828828828828829 and parameters: {'objective': 'CrossEntropy', 'colsample_bylevel': 0.0891205233955413, 'depth': 8, 'boosting_type': 'Ordered', 'bootstrap_type': 'Bayesian', 'bagging_temperature': 2.0176000257951996}. Best is trial 71 with value: 0.890909090909091.
[32m[I 2023-04-26 11:01:28,869][39m Trial 271 finished with value: 0.875 and parameters: {'objective': 'CrossEntropy', 'colsample_bylevel': 0.08837693697895782, 'depth': 8, 'boosting_type': 'Ordered', 'bootstrap_type': 'Bayesian', 'bagging_temperature': 2.0514126491323186}. Best is trial 71 with value: 0.890909090909091.
[32m[I 2023-04-26 11:01:34,722][39m Trial 272 finished with value: 0.8672566371681416 and parameters: {'objective': 'CrossEntropy', 'colsample_bylevel': 0.08896742587950414, 'depth': 6, 'boosting_type': 'Ordered', 'bootstrap_type': 'MVS'}. Best is trial 71 with value: 0.890909090909091.
[32m[I 2023-04-26 11:01:36,868][39m Trial 273 finished with value: 0.8596491228070176 and parameters: {'objective': 'CrossEntropy', 'colsample_bylevel': 0.08581234308266594, 'depth': 7, 'boosting_type': 'Plain', 'bootstrap_type': 'Bayesian', 'bagging_temperature': 2.8815494505754207}. Best is trial 71 with value: 0.890909090909091.
[32m[I 2023-04-26 11:01:39,003][39m Trial 274 finished with value: 0.8672566371681416 and parameters: {'objective': 'CrossEntropy', 'colsample_bylevel': 0.09511032954125365, 'depth': 7, 'boosting_type': 'Plain', 'bootstrap_type': 'Bayesian', 'bagging_temperature': 3.010949540358778}. Best is trial 71 with value: 0.890909090909091.
[32m[I 2023-04-26 11:01:41,323][39m Trial 275 finished with value: 0.8596491228070176 and parameters: {'objective': 'CrossEntropy', 'colsample_bylevel': 0.08227420848066216, 'depth': 9, 'boosting_type': 'Plain', 'bootstrap_type': 'Bayesian', 'bagging_temperature': 2.6991760619576763}. Best is trial 71 with value: 0.890909090909091.
[32m[I 2023-04-26 11:01:43,355][39m Trial 276 finished with value: 0.875 and parameters: {'objective': 'CrossEntropy', 'colsample_bylevel': 0.08364780508962509, 'depth': 5, 'boosting_type': 'Plain', 'bootstrap_type': 'Bayesian', 'bagging_temperature': 3.0831006498229168}. Best is trial 71 with value: 0.890909090909091.
[32m[I 2023-04-26 11:01:45,407][39m Trial 277 finished with value: 0.8672566371681416 and parameters: {'objective': 'CrossEntropy', 'colsample_bylevel': 0.09315291987168245, 'depth': 6, 'boosting_type': 'Plain', 'bootstrap_type': 'Bayesian', 'bagging_temperature': 3.563316056484462}. Best is trial 71 with value: 0.890909090909091.
[32m[I 2023-04-26 11:01:48,088][39m Trial 278 finished with value: 0.8672566371681416 and parameters: {'objective': 'Logloss', 'colsample_bylevel': 0.0906937305448401, 'depth': 12, 'boosting_type': 'Plain', 'bootstrap_type': 'Bayesian', 'bagging_temperature': 3.505282681970235}. Best is trial 71 with value: 0.890909090909091.
[32m[I 2023-04-26 11:01:50,686][39m Trial 279 finished with value: 0.875 and parameters: {'objective': 'CrossEntropy', 'colsample_bylevel': 0.09422918213757063, 'depth': 7, 'boosting_type': 'Plain', 'bootstrap_type': 'Bayesian', 'bagging_temperature': 3.222003130578935}. Best is trial 71 with value: 0.890909090909091.
[32m[I 2023-04-26 11:01:52,785][39m Trial 280 finished with value: 0.8596491228070176 and parameters: {'objective': 'CrossEntropy', 'colsample_bylevel': 0.059925633527629016, 'depth': 9, 'boosting_type': 'Plain', 'bootstrap_type': 'Bayesian', 'bagging_temperature': 1.432778576311419}. Best is trial 71 with value: 0.890909090909091.
[32m[I 2023-04-26 11:01:54,725][39m Trial 281 finished with value: 0.8596491228070176 and parameters: {'objective': 'CrossEntropy', 'colsample_bylevel': 0.09925425429468356, 'depth': 7, 'boosting_type': 'Plain', 'bootstrap_type': 'Bernoulli', 'subsample': 0.13299310966943842}. Best is trial 71 with value: 0.890909090909091.
[32m[I 2023-04-26 11:01:56,862][39m Trial 282 finished with value: 0.8672566371681416 and parameters: {'objective': 'CrossEntropy', 'colsample_bylevel': 0.09913215557246681, 'depth': 10, 'boosting_type': 'Plain', 'bootstrap_type': 'Bayesian', 'bagging_temperature': 8.80860715745445}. Best is trial 71 with value: 0.890909090909091.
[32m[I 2023-04-26 11:01:58,746][39m Trial 283 finished with value: 0.875 and parameters: {'objective': 'CrossEntropy', 'colsample_bylevel': 0.0903075282622774, 'depth': 7, 'boosting_type': 'Plain', 'bootstrap_type': 'Bayesian', 'bagging_temperature': 2.5276540494755446}. Best is trial 71 with value: 0.890909090909091.
[32m[I 2023-04-26 11:02:03,220][39m Trial 284 finished with value: 0.875 and parameters: {'objective': 'CrossEntropy', 'colsample_bylevel': 0.08698025544165078, 'depth': 8, 'boosting_type': 'Ordered', 'bootstrap_type': 'Bayesian', 'bagging_temperature': 1.6402115283123793}. Best is trial 71 with value: 0.890909090909091.
[32m[I 2023-04-26 11:02:05,711][39m Trial 285 finished with value: 0.8672566371681416 and parameters: {'objective': 'CrossEntropy', 'colsample_bylevel': 0.09552104551767603, 'depth': 6, 'boosting_type': 'Plain', 'bootstrap_type': 'Bernoulli', 'subsample': 0.24621615896182092}. Best is trial 71 with value: 0.890909090909091.
[32m[I 2023-04-26 11:02:08,159][39m Trial 286 finished with value: 0.875 and parameters: {'objective': 'CrossEntropy', 'colsample_bylevel': 0.0996719527163797, 'depth': 7, 'boosting_type': 'Plain', 'bootstrap_type': 'Bayesian', 'bagging_temperature': 4.748420181165031}. Best is trial 71 with value: 0.890909090909091.
[32m[I 2023-04-26 11:02:10,105][39m Trial 287 finished with value: 0.8596491228070176 and parameters: {'objective': 'CrossEntropy', 'colsample_bylevel': 0.09810020516794611, 'depth': 6, 'boosting_type': 'Plain', 'bootstrap_type': 'Bayesian', 'bagging_temperature': 4.274955779895794}. Best is trial 71 with value: 0.890909090909091.
[32m[I 2023-04-26 11:02:12,650][39m Trial 288 finished with value: 0.8849557522123893 and parameters: {'objective': 'CrossEntropy', 'colsample_bylevel': 0.0980034343383575, 'depth': 8, 'boosting_type': 'Plain', 'bootstrap_type': 'Bayesian', 'bagging_temperature': 8.03529519308079}. Best is trial 71 with value: 0.890909090909091.
[32m[I 2023-04-26 11:02:14,616][39m Trial 289 finished with value: 0.875 and parameters: {'objective': 'CrossEntropy', 'colsample_bylevel': 0.09693459671341545, 'depth': 5, 'boosting_type': 'Plain', 'bootstrap_type': 'Bayesian', 'bagging_temperature': 7.902556861461743}. Best is trial 71 with value: 0.890909090909091.
[32m[I 2023-04-26 11:02:17,674][39m Trial 290 finished with value: 0.875 and parameters: {'objective': 'CrossEntropy', 'colsample_bylevel': 0.09245879636443, 'depth': 8, 'boosting_type': 'Plain', 'bootstrap_type': 'Bayesian', 'bagging_temperature': 3.9063143882650495}. Best is trial 71 with value: 0.890909090909091.
[32m[I 2023-04-26 11:02:19,376][39m Trial 291 finished with value: 0.8672566371681416 and parameters: {'objective': 'Logloss', 'colsample_bylevel': 0.09561247232215493, 'depth': 6, 'boosting_type': 'Plain', 'bootstrap_type': 'Bayesian', 'bagging_temperature': 3.362593631107309}. Best is trial 71 with value: 0.890909090909091.
[32m[I 2023-04-26 11:02:22,321][39m Trial 292 finished with value: 0.8828828828828829 and parameters: {'objective': 'CrossEntropy', 'colsample_bylevel': 0.09363014021209953, 'depth': 8, 'boosting_type': 'Plain', 'bootstrap_type': 'Bayesian', 'bagging_temperature': 8.303652068234491}. Best is trial 71 with value: 0.890909090909091.
[32m[I 2023-04-26 11:02:24,422][39m Trial 293 finished with value: 0.8849557522123893 and parameters: {'objective': 'CrossEntropy', 'colsample_bylevel': 0.09410743037636611, 'depth': 11, 'boosting_type': 'Plain', 'bootstrap_type': 'Bayesian', 'bagging_temperature': 8.522144032045304}. Best is trial 71 with value: 0.890909090909091.
[32m[I 2023-04-26 11:02:26,031][39m Trial 294 finished with value: 0.8468468468468469 and parameters: {'objective': 'CrossEntropy', 'colsample_bylevel': 0.09169876490992394, 'depth': 12, 'boosting_type': 'Plain', 'bootstrap_type': 'Bayesian', 'bagging_temperature': 8.600838441209703}. Best is trial 71 with value: 0.890909090909091.
[32m[I 2023-04-26 11:02:29,676][39m Trial 295 finished with value: 0.8672566371681416 and parameters: {'objective': 'CrossEntropy', 'colsample_bylevel': 0.09693405540175475, 'depth': 9, 'boosting_type': 'Plain', 'bootstrap_type': 'Bayesian', 'bagging_temperature': 8.368268637427157}. Best is trial 71 with value: 0.890909090909091.
[32m[I 2023-04-26 11:02:31,550][39m Trial 296 finished with value: 0.8468468468468469 and parameters: {'objective': 'CrossEntropy', 'colsample_bylevel': 0.09508063196986125, 'depth': 11, 'boosting_type': 'Plain', 'bootstrap_type': 'Bayesian', 'bagging_temperature': 8.616110753667432}. Best is trial 71 with value: 0.890909090909091.
[32m[I 2023-04-26 11:02:33,466][39m Trial 297 finished with value: 0.8672566371681416 and parameters: {'objective': 'CrossEntropy', 'colsample_bylevel': 0.09636778767964639, 'depth': 11, 'boosting_type': 'Plain', 'bootstrap_type': 'Bayesian', 'bagging_temperature': 9.247484291590432}. Best is trial 71 with value: 0.890909090909091.
[32m[I 2023-04-26 11:02:35,580][39m Trial 298 finished with value: 0.8672566371681416 and parameters: {'objective': 'CrossEntropy', 'colsample_bylevel': 0.0986787881790984, 'depth': 8, 'boosting_type': 'Plain', 'bootstrap_type': 'MVS'}. Best is trial 71 with value: 0.890909090909091.
[32m[I 2023-04-26 11:02:37,780][39m Trial 299 finished with value: 0.8596491228070176 and parameters: {'objective': 'CrossEntropy', 'colsample_bylevel': 0.09921001166093552, 'depth': 11, 'boosting_type': 'Plain', 'bootstrap_type': 'Bayesian', 'bagging_temperature': 8.274305905064143}. Best is trial 71 with value: 0.890909090909091.
[32m[I 2023-04-26 11:02:41,102][39m Trial 300 finished with value: 0.8596491228070176 and parameters: {'objective': 'CrossEntropy', 'colsample_bylevel': 0.0999364786744671, 'depth': 8, 'boosting_type': 'Ordered', 'bootstrap_type': 'Bernoulli', 'subsample': 0.6041373299144378}. Best is trial 71 with value: 0.890909090909091.
[32m[I 2023-04-26 11:02:44,154][39m Trial 301 finished with value: 0.875 and parameters: {'objective': 'CrossEntropy', 'colsample_bylevel': 0.08871587280365274, 'depth': 8, 'boosting_type': 'Plain', 'bootstrap_type': 'Bayesian', 'bagging_temperature': 3.0543311884640874}. Best is trial 71 with value: 0.890909090909091.
[32m[I 2023-04-26 11:02:48,110][39m Trial 302 finished with value: 0.8672566371681416 and parameters: {'objective': 'CrossEntropy', 'colsample_bylevel': 0.0977657797141806, 'depth': 11, 'boosting_type': 'Ordered', 'bootstrap_type': 'Bernoulli', 'subsample': 0.42326659996026506}. Best is trial 71 with value: 0.890909090909091.
[32m[I 2023-04-26 11:02:53,498][39m Trial 303 finished with value: 0.875 and parameters: {'objective': 'CrossEntropy', 'colsample_bylevel': 0.09657031430360435, 'depth': 10, 'boosting_type': 'Ordered', 'bootstrap_type': 'Bayesian', 'bagging_temperature': 8.220898462098624}. Best is trial 71 with value: 0.890909090909091.
[32m[I 2023-04-26 11:02:56,612][39m Trial 304 finished with value: 0.8771929824561403 and parameters: {'objective': 'Logloss', 'colsample_bylevel': 0.0797196390796037, 'depth': 9, 'boosting_type': 'Plain', 'bootstrap_type': 'Bayesian', 'bagging_temperature': 9.014402526715275}. Best is trial 71 with value: 0.890909090909091.
[32m[I 2023-04-26 11:02:58,825][39m Trial 305 finished with value: 0.8672566371681416 and parameters: {'objective': 'CrossEntropy', 'colsample_bylevel': 0.0847348930625679, 'depth': 5, 'boosting_type': 'Plain', 'bootstrap_type': 'Bayesian', 'bagging_temperature': 7.634017510916555}. Best is trial 71 with value: 0.890909090909091.
[32m[I 2023-04-26 11:03:00,855][39m Trial 306 finished with value: 0.8596491228070176 and parameters: {'objective': 'CrossEntropy', 'colsample_bylevel': 0.0979082915871543, 'depth': 6, 'boosting_type': 'Plain', 'bootstrap_type': 'Bernoulli', 'subsample': 0.5355810074736957}. Best is trial 71 with value: 0.890909090909091.
[32m[I 2023-04-26 11:03:03,161][39m Trial 307 finished with value: 0.8672566371681416 and parameters: {'objective': 'CrossEntropy', 'colsample_bylevel': 0.099979580659706, 'depth': 8, 'boosting_type': 'Plain', 'bootstrap_type': 'Bayesian', 'bagging_temperature': 8.81127329066122}. Best is trial 71 with value: 0.890909090909091.
[32m[I 2023-04-26 11:03:05,218][39m Trial 308 finished with value: 0.875 and parameters: {'objective': 'CrossEntropy', 'colsample_bylevel': 0.09781118438290723, 'depth': 7, 'boosting_type': 'Plain', 'bootstrap_type': 'Bayesian', 'bagging_temperature': 8.603838135322471}. Best is trial 71 with value: 0.890909090909091.
[32m[I 2023-04-26 11:03:07,305][39m Trial 309 finished with value: 0.8672566371681416 and parameters: {'objective': 'CrossEntropy', 'colsample_bylevel': 0.09342524257499071, 'depth': 4, 'boosting_type': 'Plain', 'bootstrap_type': 'Bernoulli', 'subsample': 0.10490828767560818}. Best is trial 71 with value: 0.890909090909091.
[32m[I 2023-04-26 11:03:08,982][39m Trial 310 finished with value: 0.8672566371681416 and parameters: {'objective': 'CrossEntropy', 'colsample_bylevel': 0.09811257397536355, 'depth': 7, 'boosting_type': 'Plain', 'bootstrap_type': 'Bayesian', 'bagging_temperature': 2.358807578411666}. Best is trial 71 with value: 0.890909090909091.
[32m[I 2023-04-26 11:03:11,110][39m Trial 311 finished with value: 0.8545454545454546 and parameters: {'objective': 'CrossEntropy', 'colsample_bylevel': 0.09489910877551337, 'depth': 7, 'boosting_type': 'Plain', 'bootstrap_type': 'Bayesian', 'bagging_temperature': 8.090438030063547}. Best is trial 71 with value: 0.890909090909091.
[32m[I 2023-04-26 11:03:15,781][39m Trial 312 finished with value: 0.8571428571428572 and parameters: {'objective': 'CrossEntropy', 'colsample_bylevel': 0.08621530156802673, 'depth': 8, 'boosting_type': 'Ordered', 'bootstrap_type': 'Bernoulli', 'subsample': 0.3333679496823493}. Best is trial 71 with value: 0.890909090909091.
[32m[I 2023-04-26 11:03:21,406][39m Trial 313 finished with value: 0.8672566371681416 and parameters: {'objective': 'CrossEntropy', 'colsample_bylevel': 0.0959370946143207, 'depth': 5, 'boosting_type': 'Ordered', 'bootstrap_type': 'Bayesian', 'bagging_temperature': 8.487933919361945}. Best is trial 71 with value: 0.890909090909091.
[32m[I 2023-04-26 11:03:23,720][39m Trial 314 finished with value: 0.8672566371681416 and parameters: {'objective': 'CrossEntropy', 'colsample_bylevel': 0.09623427189029567, 'depth': 12, 'boosting_type': 'Plain', 'bootstrap_type': 'Bayesian', 'bagging_temperature': 9.622485473776942}. Best is trial 71 with value: 0.890909090909091.
[32m[I 2023-04-26 11:03:30,585][39m Trial 315 finished with value: 0.875 and parameters: {'objective': 'CrossEntropy', 'colsample_bylevel': 0.09429237094922605, 'depth': 6, 'boosting_type': 'Ordered', 'bootstrap_type': 'Bayesian', 'bagging_temperature': 8.144116684775309}. Best is trial 71 with value: 0.890909090909091.
[32m[I 2023-04-26 11:03:32,911][39m Trial 316 finished with value: 0.875 and parameters: {'objective': 'Logloss', 'colsample_bylevel': 0.09132781066653763, 'depth': 7, 'boosting_type': 'Plain', 'bootstrap_type': 'Bayesian', 'bagging_temperature': 3.376176807216351}. Best is trial 71 with value: 0.890909090909091.
[32m[I 2023-04-26 11:03:35,367][39m Trial 317 finished with value: 0.8828828828828829 and parameters: {'objective': 'CrossEntropy', 'colsample_bylevel': 0.09000190384622477, 'depth': 8, 'boosting_type': 'Plain', 'bootstrap_type': 'Bayesian', 'bagging_temperature': 1.7721016894561314}. Best is trial 71 with value: 0.890909090909091.
[32m[I 2023-04-26 11:03:37,712][39m Trial 318 finished with value: 0.8672566371681416 and parameters: {'objective': 'CrossEntropy', 'colsample_bylevel': 0.08939227852292067, 'depth': 8, 'boosting_type': 'Plain', 'bootstrap_type': 'Bayesian', 'bagging_temperature': 1.8942420034131693}. Best is trial 71 with value: 0.890909090909091.
[32m[I 2023-04-26 11:03:39,305][39m Trial 319 finished with value: 0.8828828828828829 and parameters: {'objective': 'CrossEntropy', 'colsample_bylevel': 0.09767669586900211, 'depth': 7, 'boosting_type': 'Plain', 'bootstrap_type': 'Bayesian', 'bagging_temperature': 2.1731187275302304}. Best is trial 71 with value: 0.890909090909091.
[32m[I 2023-04-26 11:03:41,218][39m Trial 320 finished with value: 0.875 and parameters: {'objective': 'CrossEntropy', 'colsample_bylevel': 0.09197285773608133, 'depth': 7, 'boosting_type': 'Plain', 'bootstrap_type': 'Bayesian', 'bagging_temperature': 2.455319660231931}. Best is trial 71 with value: 0.890909090909091.
[32m[I 2023-04-26 11:03:43,659][39m Trial 321 finished with value: 0.8828828828828829 and parameters: {'objective': 'CrossEntropy', 'colsample_bylevel': 0.08340134783357803, 'depth': 8, 'boosting_type': 'Plain', 'bootstrap_type': 'Bayesian', 'bagging_temperature': 1.554930844918597}. Best is trial 71 with value: 0.890909090909091.
[32m[I 2023-04-26 11:03:45,905][39m Trial 322 finished with value: 0.8828828828828829 and parameters: {'objective': 'CrossEntropy', 'colsample_bylevel': 0.09835691601229643, 'depth': 8, 'boosting_type': 'Plain', 'bootstrap_type': 'Bayesian', 'bagging_temperature': 2.597306291048365}. Best is trial 71 with value: 0.890909090909091.
[32m[I 2023-04-26 11:03:47,981][39m Trial 323 finished with value: 0.8672566371681416 and parameters: {'objective': 'CrossEntropy', 'colsample_bylevel': 0.09817733496147474, 'depth': 9, 'boosting_type': 'Plain', 'bootstrap_type': 'MVS'}. Best is trial 71 with value: 0.890909090909091.
[32m[I 2023-04-26 11:03:50,555][39m Trial 324 finished with value: 0.875 and parameters: {'objective': 'CrossEntropy', 'colsample_bylevel': 0.08796268408166234, 'depth': 8, 'boosting_type': 'Plain', 'bootstrap_type': 'Bayesian', 'bagging_temperature': 8.020563549853463}. Best is trial 71 with value: 0.890909090909091.
[32m[I 2023-04-26 11:03:52,946][39m Trial 325 finished with value: 0.875 and parameters: {'objective': 'Logloss', 'colsample_bylevel': 0.09441082337395014, 'depth': 10, 'boosting_type': 'Plain', 'bootstrap_type': 'Bayesian', 'bagging_temperature': 5.020377763921666}. Best is trial 71 with value: 0.890909090909091.
[32m[I 2023-04-26 11:03:55,315][39m Trial 326 finished with value: 0.8828828828828829 and parameters: {'objective': 'CrossEntropy', 'colsample_bylevel': 0.09290047550732376, 'depth': 7, 'boosting_type': 'Plain', 'bootstrap_type': 'Bayesian', 'bagging_temperature': 2.826422252181788}. Best is trial 71 with value: 0.890909090909091.
[32m[I 2023-04-26 11:03:56,909][39m Trial 327 finished with value: 0.8672566371681416 and parameters: {'objective': 'CrossEntropy', 'colsample_bylevel': 0.09031084661225428, 'depth': 7, 'boosting_type': 'Plain', 'bootstrap_type': 'Bayesian', 'bagging_temperature': 0.9752885304806383}. Best is trial 71 with value: 0.890909090909091.
[32m[I 2023-04-26 11:03:58,767][39m Trial 328 finished with value: 0.8672566371681416 and parameters: {'objective': 'CrossEntropy', 'colsample_bylevel': 0.0964329684246699, 'depth': 11, 'boosting_type': 'Plain', 'bootstrap_type': 'Bayesian', 'bagging_temperature': 4.57868714642217}. Best is trial 71 with value: 0.890909090909091.
[32m[I 2023-04-26 11:04:03,547][39m Trial 329 finished with value: 0.8828828828828829 and parameters: {'objective': 'CrossEntropy', 'colsample_bylevel': 0.09338518511223667, 'depth': 8, 'boosting_type': 'Ordered', 'bootstrap_type': 'Bayesian', 'bagging_temperature': 5.17969784655703}. Best is trial 71 with value: 0.890909090909091.
[32m[I 2023-04-26 11:04:06,131][39m Trial 330 finished with value: 0.8672566371681416 and parameters: {'objective': 'CrossEntropy', 'colsample_bylevel': 0.0813416387305808, 'depth': 8, 'boosting_type': 'Plain', 'bootstrap_type': 'Bernoulli', 'subsample': 0.6998820654146503}. Best is trial 71 with value: 0.890909090909091.
[32m[I 2023-04-26 11:04:08,178][39m Trial 331 finished with value: 0.8672566371681416 and parameters: {'objective': 'CrossEntropy', 'colsample_bylevel': 0.06437008475471358, 'depth': 8, 'boosting_type': 'Plain', 'bootstrap_type': 'Bayesian', 'bagging_temperature': 5.52787462432239}. Best is trial 71 with value: 0.890909090909091.
[32m[I 2023-04-26 11:04:10,858][39m Trial 332 finished with value: 0.8672566371681416 and parameters: {'objective': 'CrossEntropy', 'colsample_bylevel': 0.08719288680426297, 'depth': 9, 'boosting_type': 'Plain', 'bootstrap_type': 'Bayesian', 'bagging_temperature': 8.410274265255376}. Best is trial 71 with value: 0.890909090909091.
[32m[I 2023-04-26 11:04:12,963][39m Trial 333 finished with value: 0.8672566371681416 and parameters: {'objective': 'CrossEntropy', 'colsample_bylevel': 0.07454547729715798, 'depth': 8, 'boosting_type': 'Plain', 'bootstrap_type': 'Bernoulli', 'subsample': 0.8497286239603727}. Best is trial 71 with value: 0.890909090909091.
[32m[I 2023-04-26 11:04:14,895][39m Trial 334 finished with value: 0.8828828828828829 and parameters: {'objective': 'CrossEntropy', 'colsample_bylevel': 0.0924345704906168, 'depth': 3, 'boosting_type': 'Plain', 'bootstrap_type': 'Bayesian', 'bagging_temperature': 9.108165230799537}. Best is trial 71 with value: 0.890909090909091.
