[32m[I 2023-04-26 13:00:39,997][39m Trial 180 finished with value: 0.8596491228070176 and parameters: {'algorithm': 'auto', 'n_neighbors': 11, 'weights': 'distance', 'metric': 'euclidean'}. Best is trial 6 with value: 0.8771929824561403.
[32m[I 2023-04-26 13:00:40,013][39m Trial 181 finished with value: 0.8672566371681416 and parameters: {'algorithm': 'ball_tree', 'n_neighbors': 13, 'weights': 'distance', 'metric': 'euclidean'}. Best is trial 6 with value: 0.8771929824561403.
[32m[I 2023-04-26 13:00:40,040][39m Trial 182 finished with value: 0.8596491228070176 and parameters: {'algorithm': 'auto', 'n_neighbors': 11, 'weights': 'distance', 'metric': 'euclidean'}. Best is trial 6 with value: 0.8771929824561403.
[32m[I 2023-04-26 13:00:40,056][39m Trial 183 finished with value: 0.8771929824561403 and parameters: {'algorithm': 'kd_tree', 'n_neighbors': 12, 'weights': 'distance', 'metric': 'euclidean'}. Best is trial 6 with value: 0.8771929824561403.
[32m[I 2023-04-26 13:00:40,071][39m Trial 184 finished with value: 0.8771929824561403 and parameters: {'algorithm': 'kd_tree', 'n_neighbors': 12, 'weights': 'distance', 'metric': 'euclidean'}. Best is trial 6 with value: 0.8771929824561403.
[32m[I 2023-04-26 13:00:40,087][39m Trial 185 finished with value: 0.8596491228070176 and parameters: {'algorithm': 'kd_tree', 'n_neighbors': 10, 'weights': 'distance', 'metric': 'euclidean'}. Best is trial 6 with value: 0.8771929824561403.
[32m[I 2023-04-26 13:00:40,102][39m Trial 186 finished with value: 0.8672566371681416 and parameters: {'algorithm': 'ball_tree', 'n_neighbors': 13, 'weights': 'distance', 'metric': 'euclidean'}. Best is trial 6 with value: 0.8771929824561403.
[32m[I 2023-04-26 13:00:40,121][39m Trial 187 finished with value: 0.8288288288288289 and parameters: {'algorithm': 'ball_tree', 'n_neighbors': 12, 'weights': 'uniform', 'metric': 'euclidean'}. Best is trial 6 with value: 0.8771929824561403.
[32m[I 2023-04-26 13:00:40,149][39m Trial 188 finished with value: 0.8596491228070176 and parameters: {'algorithm': 'brute', 'n_neighbors': 11, 'weights': 'distance', 'metric': 'euclidean'}. Best is trial 6 with value: 0.8771929824561403.
[32m[I 2023-04-26 13:00:40,178][39m Trial 189 finished with value: 0.8771929824561403 and parameters: {'algorithm': 'auto', 'n_neighbors': 12, 'weights': 'distance', 'metric': 'euclidean'}. Best is trial 6 with value: 0.8771929824561403.
[32m[I 2023-04-26 13:00:40,207][39m Trial 190 finished with value: 0.8468468468468469 and parameters: {'algorithm': 'auto', 'n_neighbors': 14, 'weights': 'distance', 'metric': 'euclidean'}. Best is trial 6 with value: 0.8771929824561403.
[32m[I 2023-04-26 13:00:40,236][39m Trial 191 finished with value: 0.8771929824561403 and parameters: {'algorithm': 'auto', 'n_neighbors': 12, 'weights': 'distance', 'metric': 'euclidean'}. Best is trial 6 with value: 0.8771929824561403.
[32m[I 2023-04-26 13:00:40,251][39m Trial 192 finished with value: 0.8672566371681416 and parameters: {'algorithm': 'ball_tree', 'n_neighbors': 13, 'weights': 'distance', 'metric': 'euclidean'}. Best is trial 6 with value: 0.8771929824561403.
[32m[I 2023-04-26 13:00:40,280][39m Trial 193 finished with value: 0.8771929824561403 and parameters: {'algorithm': 'brute', 'n_neighbors': 12, 'weights': 'distance', 'metric': 'euclidean'}. Best is trial 6 with value: 0.8771929824561403.
[32m[I 2023-04-26 13:00:40,307][39m Trial 194 finished with value: 0.8392857142857144 and parameters: {'algorithm': 'brute', 'n_neighbors': 1, 'weights': 'distance', 'metric': 'euclidean'}. Best is trial 6 with value: 0.8771929824561403.
[32m[I 2023-04-26 13:00:40,324][39m Trial 195 finished with value: 0.8596491228070176 and parameters: {'algorithm': 'ball_tree', 'n_neighbors': 11, 'weights': 'distance', 'metric': 'euclidean'}. Best is trial 6 with value: 0.8771929824561403.
[32m[I 2023-04-26 13:00:40,351][39m Trial 196 finished with value: 0.8672566371681416 and parameters: {'algorithm': 'brute', 'n_neighbors': 13, 'weights': 'distance', 'metric': 'euclidean'}. Best is trial 6 with value: 0.8771929824561403.
[32m[I 2023-04-26 13:00:40,380][39m Trial 197 finished with value: 0.8771929824561403 and parameters: {'algorithm': 'auto', 'n_neighbors': 12, 'weights': 'distance', 'metric': 'euclidean'}. Best is trial 6 with value: 0.8771929824561403.
[32m[I 2023-04-26 13:00:40,409][39m Trial 198 finished with value: 0.8596491228070176 and parameters: {'algorithm': 'auto', 'n_neighbors': 11, 'weights': 'distance', 'metric': 'euclidean'}. Best is trial 6 with value: 0.8771929824561403.
[32m[I 2023-04-26 13:00:40,439][39m Trial 199 finished with value: 0.8596491228070176 and parameters: {'algorithm': 'brute', 'n_neighbors': 10, 'weights': 'distance', 'metric': 'manhattan'}. Best is trial 6 with value: 0.8771929824561403.
[32m[I 2023-04-26 13:00:40,455][39m Trial 200 finished with value: 0.8672566371681416 and parameters: {'algorithm': 'ball_tree', 'n_neighbors': 13, 'weights': 'distance', 'metric': 'euclidean'}. Best is trial 6 with value: 0.8771929824561403.
[32m[I 2023-04-26 13:00:40,470][39m Trial 201 finished with value: 0.8771929824561403 and parameters: {'algorithm': 'ball_tree', 'n_neighbors': 12, 'weights': 'distance', 'metric': 'euclidean'}. Best is trial 6 with value: 0.8771929824561403.
[32m[I 2023-04-26 13:00:40,486][39m Trial 202 finished with value: 0.8771929824561403 and parameters: {'algorithm': 'ball_tree', 'n_neighbors': 12, 'weights': 'distance', 'metric': 'euclidean'}. Best is trial 6 with value: 0.8771929824561403.
[32m[I 2023-04-26 13:00:40,513][39m Trial 203 finished with value: 0.8596491228070176 and parameters: {'algorithm': 'auto', 'n_neighbors': 11, 'weights': 'distance', 'metric': 'euclidean'}. Best is trial 6 with value: 0.8771929824561403.
[32m[I 2023-04-26 13:00:40,545][39m Trial 204 finished with value: 0.8771929824561403 and parameters: {'algorithm': 'brute', 'n_neighbors': 12, 'weights': 'distance', 'metric': 'euclidean'}. Best is trial 6 with value: 0.8771929824561403.
[32m[I 2023-04-26 13:00:40,560][39m Trial 205 finished with value: 0.8596491228070176 and parameters: {'algorithm': 'ball_tree', 'n_neighbors': 11, 'weights': 'distance', 'metric': 'euclidean'}. Best is trial 6 with value: 0.8771929824561403.
[32m[I 2023-04-26 13:00:40,590][39m Trial 206 finished with value: 0.8771929824561403 and parameters: {'algorithm': 'brute', 'n_neighbors': 12, 'weights': 'distance', 'metric': 'euclidean'}. Best is trial 6 with value: 0.8771929824561403.
[32m[I 2023-04-26 13:00:40,618][39m Trial 207 finished with value: 0.8771929824561403 and parameters: {'algorithm': 'brute', 'n_neighbors': 12, 'weights': 'distance', 'metric': 'euclidean'}. Best is trial 6 with value: 0.8771929824561403.
[32m[I 2023-04-26 13:00:40,647][39m Trial 208 finished with value: 0.8468468468468469 and parameters: {'algorithm': 'brute', 'n_neighbors': 14, 'weights': 'distance', 'metric': 'euclidean'}. Best is trial 6 with value: 0.8771929824561403.
[32m[I 2023-04-26 13:00:40,663][39m Trial 209 finished with value: 0.8672566371681416 and parameters: {'algorithm': 'ball_tree', 'n_neighbors': 13, 'weights': 'distance', 'metric': 'euclidean'}. Best is trial 6 with value: 0.8771929824561403.
[32m[I 2023-04-26 13:00:40,680][39m Trial 210 finished with value: 0.8672566371681416 and parameters: {'algorithm': 'ball_tree', 'n_neighbors': 13, 'weights': 'distance', 'metric': 'minkowski'}. Best is trial 6 with value: 0.8771929824561403.
[32m[I 2023-04-26 13:00:40,710][39m Trial 211 finished with value: 0.8771929824561403 and parameters: {'algorithm': 'auto', 'n_neighbors': 12, 'weights': 'distance', 'metric': 'euclidean'}. Best is trial 6 with value: 0.8771929824561403.
[32m[I 2023-04-26 13:00:40,741][39m Trial 212 finished with value: 0.8596491228070176 and parameters: {'algorithm': 'auto', 'n_neighbors': 11, 'weights': 'distance', 'metric': 'euclidean'}. Best is trial 6 with value: 0.8771929824561403.
[32m[I 2023-04-26 13:00:40,771][39m Trial 213 finished with value: 0.8771929824561403 and parameters: {'algorithm': 'brute', 'n_neighbors': 12, 'weights': 'distance', 'metric': 'euclidean'}. Best is trial 6 with value: 0.8771929824561403.
[32m[I 2023-04-26 13:00:40,797][39m Trial 214 finished with value: 0.8771929824561403 and parameters: {'algorithm': 'brute', 'n_neighbors': 12, 'weights': 'distance', 'metric': 'euclidean'}. Best is trial 6 with value: 0.8771929824561403.
[32m[I 2023-04-26 13:00:40,813][39m Trial 215 finished with value: 0.8771929824561403 and parameters: {'algorithm': 'kd_tree', 'n_neighbors': 12, 'weights': 'distance', 'metric': 'euclidean'}. Best is trial 6 with value: 0.8771929824561403.
[32m[I 2023-04-26 13:00:40,830][39m Trial 216 finished with value: 0.8672566371681416 and parameters: {'algorithm': 'kd_tree', 'n_neighbors': 13, 'weights': 'distance', 'metric': 'euclidean'}. Best is trial 6 with value: 0.8771929824561403.
[32m[I 2023-04-26 13:00:40,849][39m Trial 217 finished with value: 0.8288288288288289 and parameters: {'algorithm': 'ball_tree', 'n_neighbors': 11, 'weights': 'uniform', 'metric': 'euclidean'}. Best is trial 6 with value: 0.8771929824561403.
[32m[I 2023-04-26 13:00:40,866][39m Trial 218 finished with value: 0.8771929824561403 and parameters: {'algorithm': 'kd_tree', 'n_neighbors': 12, 'weights': 'distance', 'metric': 'euclidean'}. Best is trial 6 with value: 0.8771929824561403.
[32m[I 2023-04-26 13:00:40,882][39m Trial 219 finished with value: 0.8421052631578947 and parameters: {'algorithm': 'ball_tree', 'n_neighbors': 4, 'weights': 'distance', 'metric': 'euclidean'}. Best is trial 6 with value: 0.8771929824561403.
[32m[I 2023-04-26 13:00:40,898][39m Trial 220 finished with value: 0.8672566371681416 and parameters: {'algorithm': 'kd_tree', 'n_neighbors': 13, 'weights': 'distance', 'metric': 'euclidean'}. Best is trial 6 with value: 0.8771929824561403.
[32m[I 2023-04-26 13:00:40,908][39m Trial 221 finished with value: 0.8771929824561403 and parameters: {'algorithm': 'ball_tree', 'n_neighbors': 12, 'weights': 'distance', 'metric': 'euclidean'}. Best is trial 6 with value: 0.8771929824561403.
[32m[I 2023-04-26 13:00:40,934][39m Trial 222 finished with value: 0.8771929824561403 and parameters: {'algorithm': 'auto', 'n_neighbors': 12, 'weights': 'distance', 'metric': 'euclidean'}. Best is trial 6 with value: 0.8771929824561403.
[32m[I 2023-04-26 13:00:40,963][39m Trial 223 finished with value: 0.8596491228070176 and parameters: {'algorithm': 'auto', 'n_neighbors': 11, 'weights': 'distance', 'metric': 'euclidean'}. Best is trial 6 with value: 0.8771929824561403.
[32m[I 2023-04-26 13:00:40,982][39m Trial 224 finished with value: 0.8771929824561403 and parameters: {'algorithm': 'ball_tree', 'n_neighbors': 12, 'weights': 'distance', 'metric': 'euclidean'}. Best is trial 6 with value: 0.8771929824561403.
[32m[I 2023-04-26 13:00:41,011][39m Trial 225 finished with value: 0.8672566371681416 and parameters: {'algorithm': 'auto', 'n_neighbors': 13, 'weights': 'distance', 'metric': 'euclidean'}. Best is trial 6 with value: 0.8771929824561403.
[32m[I 2023-04-26 13:00:41,028][39m Trial 226 finished with value: 0.8596491228070176 and parameters: {'algorithm': 'ball_tree', 'n_neighbors': 11, 'weights': 'distance', 'metric': 'euclidean'}. Best is trial 6 with value: 0.8771929824561403.
[32m[I 2023-04-26 13:00:41,058][39m Trial 227 finished with value: 0.8771929824561403 and parameters: {'algorithm': 'brute', 'n_neighbors': 12, 'weights': 'distance', 'metric': 'euclidean'}. Best is trial 6 with value: 0.8771929824561403.
[32m[I 2023-04-26 13:00:41,088][39m Trial 228 finished with value: 0.8596491228070176 and parameters: {'algorithm': 'brute', 'n_neighbors': 11, 'weights': 'distance', 'metric': 'euclidean'}. Best is trial 6 with value: 0.8771929824561403.
[32m[I 2023-04-26 13:00:41,105][39m Trial 229 finished with value: 0.8672566371681416 and parameters: {'algorithm': 'kd_tree', 'n_neighbors': 13, 'weights': 'distance', 'metric': 'euclidean'}. Best is trial 6 with value: 0.8771929824561403.
[32m[I 2023-04-26 13:00:41,124][39m Trial 230 finished with value: 0.8771929824561403 and parameters: {'algorithm': 'kd_tree', 'n_neighbors': 12, 'weights': 'distance', 'metric': 'euclidean'}. Best is trial 6 with value: 0.8771929824561403.
[32m[I 2023-04-26 13:00:41,157][39m Trial 231 finished with value: 0.8771929824561403 and parameters: {'algorithm': 'auto', 'n_neighbors': 12, 'weights': 'distance', 'metric': 'euclidean'}. Best is trial 6 with value: 0.8771929824561403.
[32m[I 2023-04-26 13:00:41,187][39m Trial 232 finished with value: 0.8771929824561403 and parameters: {'algorithm': 'auto', 'n_neighbors': 12, 'weights': 'distance', 'metric': 'euclidean'}. Best is trial 6 with value: 0.8771929824561403.
[32m[I 2023-04-26 13:00:41,205][39m Trial 233 finished with value: 0.8596491228070176 and parameters: {'algorithm': 'kd_tree', 'n_neighbors': 11, 'weights': 'distance', 'metric': 'euclidean'}. Best is trial 6 with value: 0.8771929824561403.
[32m[I 2023-04-26 13:00:41,221][39m Trial 234 finished with value: 0.8771929824561403 and parameters: {'algorithm': 'kd_tree', 'n_neighbors': 12, 'weights': 'distance', 'metric': 'euclidean'}. Best is trial 6 with value: 0.8771929824561403.
[32m[I 2023-04-26 13:00:41,251][39m Trial 235 finished with value: 0.8672566371681416 and parameters: {'algorithm': 'auto', 'n_neighbors': 13, 'weights': 'distance', 'metric': 'euclidean'}. Best is trial 6 with value: 0.8771929824561403.
[32m[I 2023-04-26 13:00:41,268][39m Trial 236 finished with value: 0.8495575221238938 and parameters: {'algorithm': 'ball_tree', 'n_neighbors': 12, 'weights': 'distance', 'metric': 'manhattan'}. Best is trial 6 with value: 0.8771929824561403.
[32m[I 2023-04-26 13:00:41,295][39m Trial 237 finished with value: 0.8771929824561403 and parameters: {'algorithm': 'brute', 'n_neighbors': 12, 'weights': 'distance', 'metric': 'euclidean'}. Best is trial 6 with value: 0.8771929824561403.
[32m[I 2023-04-26 13:00:41,326][39m Trial 238 finished with value: 0.8596491228070176 and parameters: {'algorithm': 'brute', 'n_neighbors': 11, 'weights': 'distance', 'metric': 'euclidean'}. Best is trial 6 with value: 0.8771929824561403.
[32m[I 2023-04-26 13:00:41,355][39m Trial 239 finished with value: 0.8672566371681416 and parameters: {'algorithm': 'brute', 'n_neighbors': 21, 'weights': 'distance', 'metric': 'euclidean'}. Best is trial 6 with value: 0.8771929824561403.
[32m[I 2023-04-26 13:00:41,372][39m Trial 240 finished with value: 0.8672566371681416 and parameters: {'algorithm': 'ball_tree', 'n_neighbors': 13, 'weights': 'distance', 'metric': 'euclidean'}. Best is trial 6 with value: 0.8771929824561403.
[32m[I 2023-04-26 13:00:41,401][39m Trial 241 finished with value: 0.8771929824561403 and parameters: {'algorithm': 'auto', 'n_neighbors': 12, 'weights': 'distance', 'metric': 'euclidean'}. Best is trial 6 with value: 0.8771929824561403.
[32m[I 2023-04-26 13:00:41,432][39m Trial 242 finished with value: 0.8771929824561403 and parameters: {'algorithm': 'auto', 'n_neighbors': 12, 'weights': 'distance', 'metric': 'euclidean'}. Best is trial 6 with value: 0.8771929824561403.
[32m[I 2023-04-26 13:00:41,460][39m Trial 243 finished with value: 0.8771929824561403 and parameters: {'algorithm': 'auto', 'n_neighbors': 12, 'weights': 'distance', 'metric': 'euclidean'}. Best is trial 6 with value: 0.8771929824561403.
[32m[I 2023-04-26 13:00:41,489][39m Trial 244 finished with value: 0.8672566371681416 and parameters: {'algorithm': 'auto', 'n_neighbors': 13, 'weights': 'distance', 'metric': 'euclidean'}. Best is trial 6 with value: 0.8771929824561403.
[32m[I 2023-04-26 13:00:41,520][39m Trial 245 finished with value: 0.8771929824561403 and parameters: {'algorithm': 'brute', 'n_neighbors': 12, 'weights': 'distance', 'metric': 'euclidean'}. Best is trial 6 with value: 0.8771929824561403.
[32m[I 2023-04-26 13:00:41,549][39m Trial 246 finished with value: 0.8596491228070176 and parameters: {'algorithm': 'auto', 'n_neighbors': 11, 'weights': 'distance', 'metric': 'euclidean'}. Best is trial 6 with value: 0.8771929824561403.
[32m[I 2023-04-26 13:00:41,579][39m Trial 247 finished with value: 0.8596491228070176 and parameters: {'algorithm': 'brute', 'n_neighbors': 11, 'weights': 'distance', 'metric': 'euclidean'}. Best is trial 6 with value: 0.8771929824561403.
[32m[I 2023-04-26 13:00:41,602][39m Trial 248 finished with value: 0.8771929824561403 and parameters: {'algorithm': 'brute', 'n_neighbors': 12, 'weights': 'distance', 'metric': 'euclidean'}. Best is trial 6 with value: 0.8771929824561403.
[32m[I 2023-04-26 13:00:41,638][39m Trial 249 finished with value: 0.8672566371681416 and parameters: {'algorithm': 'auto', 'n_neighbors': 13, 'weights': 'distance', 'metric': 'euclidean'}. Best is trial 6 with value: 0.8771929824561403.
[32m[I 2023-04-26 13:00:41,655][39m Trial 250 finished with value: 0.8596491228070176 and parameters: {'algorithm': 'kd_tree', 'n_neighbors': 10, 'weights': 'distance', 'metric': 'minkowski'}. Best is trial 6 with value: 0.8771929824561403.
[32m[I 2023-04-26 13:00:41,686][39m Trial 251 finished with value: 0.8571428571428572 and parameters: {'algorithm': 'auto', 'n_neighbors': 24, 'weights': 'distance', 'metric': 'euclidean'}. Best is trial 6 with value: 0.8771929824561403.
[32m[I 2023-04-26 13:00:41,716][39m Trial 252 finished with value: 0.8596491228070176 and parameters: {'algorithm': 'auto', 'n_neighbors': 11, 'weights': 'distance', 'metric': 'euclidean'}. Best is trial 6 with value: 0.8771929824561403.
[32m[I 2023-04-26 13:00:41,746][39m Trial 253 finished with value: 0.8771929824561403 and parameters: {'algorithm': 'brute', 'n_neighbors': 12, 'weights': 'distance', 'metric': 'euclidean'}. Best is trial 6 with value: 0.8771929824561403.
[32m[I 2023-04-26 13:00:41,772][39m Trial 254 finished with value: 0.8141592920353982 and parameters: {'algorithm': 'brute', 'n_neighbors': 13, 'weights': 'uniform', 'metric': 'euclidean'}. Best is trial 6 with value: 0.8771929824561403.
[32m[I 2023-04-26 13:00:41,782][39m Trial 255 finished with value: 0.8771929824561403 and parameters: {'algorithm': 'ball_tree', 'n_neighbors': 12, 'weights': 'distance', 'metric': 'euclidean'}. Best is trial 6 with value: 0.8771929824561403.
[32m[I 2023-04-26 13:00:41,795][39m Trial 256 finished with value: 0.8468468468468469 and parameters: {'algorithm': 'ball_tree', 'n_neighbors': 14, 'weights': 'distance', 'metric': 'euclidean'}. Best is trial 6 with value: 0.8771929824561403.
[32m[I 2023-04-26 13:00:41,805][39m Trial 257 finished with value: 0.8771929824561403 and parameters: {'algorithm': 'ball_tree', 'n_neighbors': 12, 'weights': 'distance', 'metric': 'euclidean'}. Best is trial 6 with value: 0.8771929824561403.
[32m[I 2023-04-26 13:00:41,836][39m Trial 258 finished with value: 0.8672566371681416 and parameters: {'algorithm': 'auto', 'n_neighbors': 13, 'weights': 'distance', 'metric': 'euclidean'}. Best is trial 6 with value: 0.8771929824561403.
[32m[I 2023-04-26 13:00:41,868][39m Trial 259 finished with value: 0.8596491228070176 and parameters: {'algorithm': 'brute', 'n_neighbors': 11, 'weights': 'distance', 'metric': 'euclidean'}. Best is trial 6 with value: 0.8771929824561403.
[32m[I 2023-04-26 13:00:41,899][39m Trial 260 finished with value: 0.8771929824561403 and parameters: {'algorithm': 'auto', 'n_neighbors': 12, 'weights': 'distance', 'metric': 'euclidean'}. Best is trial 6 with value: 0.8771929824561403.
[32m[I 2023-04-26 13:00:41,930][39m Trial 261 finished with value: 0.8771929824561403 and parameters: {'algorithm': 'auto', 'n_neighbors': 12, 'weights': 'distance', 'metric': 'euclidean'}. Best is trial 6 with value: 0.8771929824561403.
[32m[I 2023-04-26 13:00:41,949][39m Trial 262 finished with value: 0.8672566371681416 and parameters: {'algorithm': 'ball_tree', 'n_neighbors': 13, 'weights': 'distance', 'metric': 'euclidean'}. Best is trial 6 with value: 0.8771929824561403.
[32m[I 2023-04-26 13:00:41,966][39m Trial 263 finished with value: 0.8596491228070176 and parameters: {'algorithm': 'kd_tree', 'n_neighbors': 11, 'weights': 'distance', 'metric': 'euclidean'}. Best is trial 6 with value: 0.8771929824561403.
[32m[I 2023-04-26 13:00:41,984][39m Trial 264 finished with value: 0.8771929824561403 and parameters: {'algorithm': 'ball_tree', 'n_neighbors': 12, 'weights': 'distance', 'metric': 'euclidean'}. Best is trial 6 with value: 0.8771929824561403.
[32m[I 2023-04-26 13:00:42,012][39m Trial 265 finished with value: 0.8672566371681416 and parameters: {'algorithm': 'brute', 'n_neighbors': 13, 'weights': 'distance', 'metric': 'euclidean'}. Best is trial 6 with value: 0.8771929824561403.
[32m[I 2023-04-26 13:00:42,043][39m Trial 266 finished with value: 0.8495575221238938 and parameters: {'algorithm': 'auto', 'n_neighbors': 11, 'weights': 'distance', 'metric': 'manhattan'}. Best is trial 6 with value: 0.8771929824561403.
[32m[I 2023-04-26 13:00:42,073][39m Trial 267 finished with value: 0.8468468468468469 and parameters: {'algorithm': 'auto', 'n_neighbors': 14, 'weights': 'distance', 'metric': 'euclidean'}. Best is trial 6 with value: 0.8771929824561403.
[32m[I 2023-04-26 13:00:42,102][39m Trial 268 finished with value: 0.8596491228070176 and parameters: {'algorithm': 'auto', 'n_neighbors': 10, 'weights': 'distance', 'metric': 'euclidean'}. Best is trial 6 with value: 0.8771929824561403.
[32m[I 2023-04-26 13:00:42,120][39m Trial 269 finished with value: 0.8771929824561403 and parameters: {'algorithm': 'ball_tree', 'n_neighbors': 12, 'weights': 'distance', 'metric': 'euclidean'}. Best is trial 6 with value: 0.8771929824561403.
