[32m[I 2023-04-26 13:00:42,149][39m Trial 270 finished with value: 0.8771929824561403 and parameters: {'algorithm': 'auto', 'n_neighbors': 12, 'weights': 'distance', 'metric': 'euclidean'}. Best is trial 6 with value: 0.8771929824561403.
[32m[I 2023-04-26 13:00:42,168][39m Trial 271 finished with value: 0.8672566371681416 and parameters: {'algorithm': 'kd_tree', 'n_neighbors': 13, 'weights': 'distance', 'metric': 'euclidean'}. Best is trial 6 with value: 0.8771929824561403.
[32m[I 2023-04-26 13:00:42,185][39m Trial 272 finished with value: 0.8771929824561403 and parameters: {'algorithm': 'kd_tree', 'n_neighbors': 12, 'weights': 'distance', 'metric': 'euclidean'}. Best is trial 6 with value: 0.8771929824561403.
[32m[I 2023-04-26 13:00:42,210][39m Trial 273 finished with value: 0.8288288288288289 and parameters: {'algorithm': 'brute', 'n_neighbors': 11, 'weights': 'uniform', 'metric': 'euclidean'}. Best is trial 6 with value: 0.8771929824561403.
[32m[I 2023-04-26 13:00:42,221][39m Trial 274 finished with value: 0.8596491228070176 and parameters: {'algorithm': 'kd_tree', 'n_neighbors': 11, 'weights': 'distance', 'metric': 'minkowski'}. Best is trial 6 with value: 0.8771929824561403.
[32m[I 2023-04-26 13:00:42,234][39m Trial 275 finished with value: 0.8771929824561403 and parameters: {'algorithm': 'kd_tree', 'n_neighbors': 12, 'weights': 'distance', 'metric': 'euclidean'}. Best is trial 6 with value: 0.8771929824561403.
[32m[I 2023-04-26 13:00:42,272][39m Trial 276 finished with value: 0.8672566371681416 and parameters: {'algorithm': 'brute', 'n_neighbors': 13, 'weights': 'distance', 'metric': 'euclidean'}. Best is trial 6 with value: 0.8771929824561403.
[32m[I 2023-04-26 13:00:42,290][39m Trial 277 finished with value: 0.8771929824561403 and parameters: {'algorithm': 'kd_tree', 'n_neighbors': 12, 'weights': 'distance', 'metric': 'euclidean'}. Best is trial 6 with value: 0.8771929824561403.
[32m[I 2023-04-26 13:00:42,320][39m Trial 278 finished with value: 0.8596491228070176 and parameters: {'algorithm': 'auto', 'n_neighbors': 10, 'weights': 'distance', 'metric': 'euclidean'}. Best is trial 6 with value: 0.8771929824561403.
[32m[I 2023-04-26 13:00:42,349][39m Trial 279 finished with value: 0.8771929824561403 and parameters: {'algorithm': 'brute', 'n_neighbors': 12, 'weights': 'distance', 'metric': 'euclidean'}. Best is trial 6 with value: 0.8771929824561403.
[32m[I 2023-04-26 13:00:42,380][39m Trial 280 finished with value: 0.8468468468468469 and parameters: {'algorithm': 'brute', 'n_neighbors': 14, 'weights': 'distance', 'metric': 'euclidean'}. Best is trial 6 with value: 0.8771929824561403.
[32m[I 2023-04-26 13:00:42,411][39m Trial 281 finished with value: 0.8596491228070176 and parameters: {'algorithm': 'auto', 'n_neighbors': 11, 'weights': 'distance', 'metric': 'euclidean'}. Best is trial 6 with value: 0.8771929824561403.
[32m[I 2023-04-26 13:00:42,443][39m Trial 282 finished with value: 0.8672566371681416 and parameters: {'algorithm': 'auto', 'n_neighbors': 13, 'weights': 'distance', 'metric': 'euclidean'}. Best is trial 6 with value: 0.8771929824561403.
[32m[I 2023-04-26 13:00:42,474][39m Trial 283 finished with value: 0.8771929824561403 and parameters: {'algorithm': 'brute', 'n_neighbors': 12, 'weights': 'distance', 'metric': 'euclidean'}. Best is trial 6 with value: 0.8771929824561403.
[32m[I 2023-04-26 13:00:42,505][39m Trial 284 finished with value: 0.8672566371681416 and parameters: {'algorithm': 'brute', 'n_neighbors': 13, 'weights': 'distance', 'metric': 'euclidean'}. Best is trial 6 with value: 0.8771929824561403.
[32m[I 2023-04-26 13:00:42,540][39m Trial 285 finished with value: 0.8596491228070176 and parameters: {'algorithm': 'brute', 'n_neighbors': 11, 'weights': 'distance', 'metric': 'euclidean'}. Best is trial 6 with value: 0.8771929824561403.
[32m[I 2023-04-26 13:00:42,573][39m Trial 286 finished with value: 0.8771929824561403 and parameters: {'algorithm': 'auto', 'n_neighbors': 12, 'weights': 'distance', 'metric': 'euclidean'}. Best is trial 6 with value: 0.8771929824561403.
[32m[I 2023-04-26 13:00:42,606][39m Trial 287 finished with value: 0.8771929824561403 and parameters: {'algorithm': 'auto', 'n_neighbors': 12, 'weights': 'distance', 'metric': 'euclidean'}. Best is trial 6 with value: 0.8771929824561403.
[32m[I 2023-04-26 13:00:42,638][39m Trial 288 finished with value: 0.8672566371681416 and parameters: {'algorithm': 'auto', 'n_neighbors': 13, 'weights': 'distance', 'metric': 'euclidean'}. Best is trial 6 with value: 0.8771929824561403.
[32m[I 2023-04-26 13:00:42,668][39m Trial 289 finished with value: 0.8495575221238938 and parameters: {'algorithm': 'brute', 'n_neighbors': 11, 'weights': 'distance', 'metric': 'manhattan'}. Best is trial 6 with value: 0.8771929824561403.
[32m[I 2023-04-26 13:00:42,700][39m Trial 290 finished with value: 0.8596491228070176 and parameters: {'algorithm': 'auto', 'n_neighbors': 10, 'weights': 'distance', 'metric': 'euclidean'}. Best is trial 6 with value: 0.8771929824561403.
[32m[I 2023-04-26 13:00:42,733][39m Trial 291 finished with value: 0.8771929824561403 and parameters: {'algorithm': 'auto', 'n_neighbors': 12, 'weights': 'distance', 'metric': 'euclidean'}. Best is trial 6 with value: 0.8771929824561403.
[32m[I 2023-04-26 13:00:42,751][39m Trial 292 finished with value: 0.8771929824561403 and parameters: {'algorithm': 'kd_tree', 'n_neighbors': 12, 'weights': 'distance', 'metric': 'euclidean'}. Best is trial 6 with value: 0.8771929824561403.
[32m[I 2023-04-26 13:00:42,779][39m Trial 293 finished with value: 0.8141592920353982 and parameters: {'algorithm': 'brute', 'n_neighbors': 13, 'weights': 'uniform', 'metric': 'euclidean'}. Best is trial 6 with value: 0.8771929824561403.
[32m[I 2023-04-26 13:00:42,813][39m Trial 294 finished with value: 0.8596491228070176 and parameters: {'algorithm': 'auto', 'n_neighbors': 11, 'weights': 'distance', 'metric': 'euclidean'}. Best is trial 6 with value: 0.8771929824561403.
[32m[I 2023-04-26 13:00:42,850][39m Trial 295 finished with value: 0.8771929824561403 and parameters: {'algorithm': 'auto', 'n_neighbors': 12, 'weights': 'distance', 'metric': 'euclidean'}. Best is trial 6 with value: 0.8771929824561403.
[32m[I 2023-04-26 13:00:42,868][39m Trial 296 finished with value: 0.8468468468468469 and parameters: {'algorithm': 'kd_tree', 'n_neighbors': 14, 'weights': 'distance', 'metric': 'euclidean'}. Best is trial 6 with value: 0.8771929824561403.
[32m[I 2023-04-26 13:00:42,885][39m Trial 297 finished with value: 0.8672566371681416 and parameters: {'algorithm': 'ball_tree', 'n_neighbors': 13, 'weights': 'distance', 'metric': 'euclidean'}. Best is trial 6 with value: 0.8771929824561403.
[32m[I 2023-04-26 13:00:42,904][39m Trial 298 finished with value: 0.8596491228070176 and parameters: {'algorithm': 'kd_tree', 'n_neighbors': 11, 'weights': 'distance', 'metric': 'minkowski'}. Best is trial 6 with value: 0.8771929824561403.
[32m[I 2023-04-26 13:00:42,936][39m Trial 299 finished with value: 0.8771929824561403 and parameters: {'algorithm': 'auto', 'n_neighbors': 12, 'weights': 'distance', 'metric': 'euclidean'}. Best is trial 6 with value: 0.8771929824561403.
[32m[I 2023-04-26 13:00:42,968][39m Trial 300 finished with value: 0.8596491228070176 and parameters: {'algorithm': 'auto', 'n_neighbors': 10, 'weights': 'distance', 'metric': 'euclidean'}. Best is trial 6 with value: 0.8771929824561403.
[32m[I 2023-04-26 13:00:42,999][39m Trial 301 finished with value: 0.8672566371681416 and parameters: {'algorithm': 'auto', 'n_neighbors': 13, 'weights': 'distance', 'metric': 'euclidean'}. Best is trial 6 with value: 0.8771929824561403.
[32m[I 2023-04-26 13:00:43,018][39m Trial 302 finished with value: 0.8596491228070176 and parameters: {'algorithm': 'ball_tree', 'n_neighbors': 11, 'weights': 'distance', 'metric': 'euclidean'}. Best is trial 6 with value: 0.8771929824561403.
[32m[I 2023-04-26 13:00:43,048][39m Trial 303 finished with value: 0.8771929824561403 and parameters: {'algorithm': 'auto', 'n_neighbors': 12, 'weights': 'distance', 'metric': 'euclidean'}. Best is trial 6 with value: 0.8771929824561403.
[32m[I 2023-04-26 13:00:43,078][39m Trial 304 finished with value: 0.8571428571428572 and parameters: {'algorithm': 'auto', 'n_neighbors': 18, 'weights': 'distance', 'metric': 'euclidean'}. Best is trial 6 with value: 0.8771929824561403.
[32m[I 2023-04-26 13:00:43,097][39m Trial 305 finished with value: 0.8672566371681416 and parameters: {'algorithm': 'ball_tree', 'n_neighbors': 13, 'weights': 'distance', 'metric': 'euclidean'}. Best is trial 6 with value: 0.8771929824561403.
[32m[I 2023-04-26 13:00:43,128][39m Trial 306 finished with value: 0.8468468468468469 and parameters: {'algorithm': 'auto', 'n_neighbors': 14, 'weights': 'distance', 'metric': 'euclidean'}. Best is trial 6 with value: 0.8771929824561403.
[32m[I 2023-04-26 13:00:43,146][39m Trial 307 finished with value: 0.8771929824561403 and parameters: {'algorithm': 'ball_tree', 'n_neighbors': 12, 'weights': 'distance', 'metric': 'euclidean'}. Best is trial 6 with value: 0.8771929824561403.
[32m[I 2023-04-26 13:00:43,178][39m Trial 308 finished with value: 0.8771929824561403 and parameters: {'algorithm': 'brute', 'n_neighbors': 12, 'weights': 'distance', 'metric': 'euclidean'}. Best is trial 6 with value: 0.8771929824561403.
[32m[I 2023-04-26 13:00:43,196][39m Trial 309 finished with value: 0.8771929824561403 and parameters: {'algorithm': 'kd_tree', 'n_neighbors': 12, 'weights': 'distance', 'metric': 'euclidean'}. Best is trial 6 with value: 0.8771929824561403.
[32m[I 2023-04-26 13:00:43,229][39m Trial 310 finished with value: 0.8495575221238938 and parameters: {'algorithm': 'brute', 'n_neighbors': 11, 'weights': 'distance', 'metric': 'manhattan'}. Best is trial 6 with value: 0.8771929824561403.
[32m[I 2023-04-26 13:00:43,263][39m Trial 311 finished with value: 0.8672566371681416 and parameters: {'algorithm': 'auto', 'n_neighbors': 13, 'weights': 'distance', 'metric': 'euclidean'}. Best is trial 6 with value: 0.8771929824561403.
[32m[I 2023-04-26 13:00:43,294][39m Trial 312 finished with value: 0.819047619047619 and parameters: {'algorithm': 'brute', 'n_neighbors': 6, 'weights': 'uniform', 'metric': 'euclidean'}. Best is trial 6 with value: 0.8771929824561403.
[32m[I 2023-04-26 13:00:43,326][39m Trial 313 finished with value: 0.8596491228070176 and parameters: {'algorithm': 'auto', 'n_neighbors': 11, 'weights': 'distance', 'metric': 'euclidean'}. Best is trial 6 with value: 0.8771929824561403.
[32m[I 2023-04-26 13:00:43,345][39m Trial 314 finished with value: 0.8771929824561403 and parameters: {'algorithm': 'ball_tree', 'n_neighbors': 12, 'weights': 'distance', 'metric': 'euclidean'}. Best is trial 6 with value: 0.8771929824561403.
[32m[I 2023-04-26 13:00:43,376][39m Trial 315 finished with value: 0.8672566371681416 and parameters: {'algorithm': 'brute', 'n_neighbors': 13, 'weights': 'distance', 'metric': 'euclidean'}. Best is trial 6 with value: 0.8771929824561403.
[32m[I 2023-04-26 13:00:43,408][39m Trial 316 finished with value: 0.8771929824561403 and parameters: {'algorithm': 'brute', 'n_neighbors': 12, 'weights': 'distance', 'metric': 'euclidean'}. Best is trial 6 with value: 0.8771929824561403.
[32m[I 2023-04-26 13:00:43,426][39m Trial 317 finished with value: 0.8596491228070176 and parameters: {'algorithm': 'ball_tree', 'n_neighbors': 10, 'weights': 'distance', 'metric': 'euclidean'}. Best is trial 6 with value: 0.8771929824561403.
[32m[I 2023-04-26 13:00:43,445][39m Trial 318 finished with value: 0.8571428571428572 and parameters: {'algorithm': 'kd_tree', 'n_neighbors': 30, 'weights': 'distance', 'metric': 'euclidean'}. Best is trial 6 with value: 0.8771929824561403.
[32m[I 2023-04-26 13:00:43,463][39m Trial 319 finished with value: 0.8571428571428572 and parameters: {'algorithm': 'kd_tree', 'n_neighbors': 15, 'weights': 'distance', 'metric': 'euclidean'}. Best is trial 6 with value: 0.8771929824561403.
[32m[I 2023-04-26 13:00:43,483][39m Trial 320 finished with value: 0.8596491228070176 and parameters: {'algorithm': 'kd_tree', 'n_neighbors': 11, 'weights': 'distance', 'metric': 'minkowski'}. Best is trial 6 with value: 0.8771929824561403.
[32m[I 2023-04-26 13:00:43,501][39m Trial 321 finished with value: 0.8672566371681416 and parameters: {'algorithm': 'kd_tree', 'n_neighbors': 13, 'weights': 'distance', 'metric': 'euclidean'}. Best is trial 6 with value: 0.8771929824561403.
[32m[I 2023-04-26 13:00:43,517][39m Trial 322 finished with value: 0.8771929824561403 and parameters: {'algorithm': 'ball_tree', 'n_neighbors': 12, 'weights': 'distance', 'metric': 'euclidean'}. Best is trial 6 with value: 0.8771929824561403.
[32m[I 2023-04-26 13:00:43,541][39m Trial 323 finished with value: 0.8771929824561403 and parameters: {'algorithm': 'auto', 'n_neighbors': 12, 'weights': 'distance', 'metric': 'euclidean'}. Best is trial 6 with value: 0.8771929824561403.
[32m[I 2023-04-26 13:00:43,560][39m Trial 324 finished with value: 0.8596491228070176 and parameters: {'algorithm': 'ball_tree', 'n_neighbors': 11, 'weights': 'distance', 'metric': 'euclidean'}. Best is trial 6 with value: 0.8771929824561403.
[32m[I 2023-04-26 13:00:43,578][39m Trial 325 finished with value: 0.8672566371681416 and parameters: {'algorithm': 'ball_tree', 'n_neighbors': 13, 'weights': 'distance', 'metric': 'euclidean'}. Best is trial 6 with value: 0.8771929824561403.
[32m[I 2023-04-26 13:00:43,610][39m Trial 326 finished with value: 0.8596491228070176 and parameters: {'algorithm': 'auto', 'n_neighbors': 11, 'weights': 'distance', 'metric': 'euclidean'}. Best is trial 6 with value: 0.8771929824561403.
[32m[I 2023-04-26 13:00:43,642][39m Trial 327 finished with value: 0.8468468468468469 and parameters: {'algorithm': 'auto', 'n_neighbors': 14, 'weights': 'distance', 'metric': 'euclidean'}. Best is trial 6 with value: 0.8771929824561403.
[32m[I 2023-04-26 13:00:43,673][39m Trial 328 finished with value: 0.8771929824561403 and parameters: {'algorithm': 'brute', 'n_neighbors': 12, 'weights': 'distance', 'metric': 'euclidean'}. Best is trial 6 with value: 0.8771929824561403.
[32m[I 2023-04-26 13:00:43,705][39m Trial 329 finished with value: 0.8771929824561403 and parameters: {'algorithm': 'brute', 'n_neighbors': 12, 'weights': 'distance', 'metric': 'euclidean'}. Best is trial 6 with value: 0.8771929824561403.
[32m[I 2023-04-26 13:00:43,736][39m Trial 330 finished with value: 0.8596491228070176 and parameters: {'algorithm': 'brute', 'n_neighbors': 10, 'weights': 'distance', 'metric': 'euclidean'}. Best is trial 6 with value: 0.8771929824561403.
[32m[I 2023-04-26 13:00:43,767][39m Trial 331 finished with value: 0.8596491228070176 and parameters: {'algorithm': 'auto', 'n_neighbors': 11, 'weights': 'distance', 'metric': 'euclidean'}. Best is trial 6 with value: 0.8771929824561403.
[32m[I 2023-04-26 13:00:43,800][39m Trial 332 finished with value: 0.8672566371681416 and parameters: {'algorithm': 'auto', 'n_neighbors': 13, 'weights': 'distance', 'metric': 'euclidean'}. Best is trial 6 with value: 0.8771929824561403.
[32m[I 2023-04-26 13:00:43,819][39m Trial 333 finished with value: 0.8771929824561403 and parameters: {'algorithm': 'ball_tree', 'n_neighbors': 12, 'weights': 'distance', 'metric': 'euclidean'}. Best is trial 6 with value: 0.8771929824561403.
[32m[I 2023-04-26 13:00:43,849][39m Trial 334 finished with value: 0.8173913043478261 and parameters: {'algorithm': 'auto', 'n_neighbors': 13, 'weights': 'uniform', 'metric': 'manhattan'}. Best is trial 6 with value: 0.8771929824561403.
[32m[I 2023-04-26 13:00:43,879][39m Trial 335 finished with value: 0.8771929824561403 and parameters: {'algorithm': 'auto', 'n_neighbors': 12, 'weights': 'distance', 'metric': 'euclidean'}. Best is trial 6 with value: 0.8771929824561403.
[32m[I 2023-04-26 13:00:43,913][39m Trial 336 finished with value: 0.8596491228070176 and parameters: {'algorithm': 'auto', 'n_neighbors': 11, 'weights': 'distance', 'metric': 'euclidean'}. Best is trial 6 with value: 0.8771929824561403.
[32m[I 2023-04-26 13:00:43,947][39m Trial 337 finished with value: 0.8771929824561403 and parameters: {'algorithm': 'auto', 'n_neighbors': 12, 'weights': 'distance', 'metric': 'euclidean'}. Best is trial 6 with value: 0.8771929824561403.
[32m[I 2023-04-26 13:00:43,980][39m Trial 338 finished with value: 0.8468468468468469 and parameters: {'algorithm': 'brute', 'n_neighbors': 14, 'weights': 'distance', 'metric': 'euclidean'}. Best is trial 6 with value: 0.8771929824561403.
[32m[I 2023-04-26 13:00:44,013][39m Trial 339 finished with value: 0.8672566371681416 and parameters: {'algorithm': 'auto', 'n_neighbors': 13, 'weights': 'distance', 'metric': 'euclidean'}. Best is trial 6 with value: 0.8771929824561403.
[32m[I 2023-04-26 13:00:44,032][39m Trial 340 finished with value: 0.8596491228070176 and parameters: {'algorithm': 'kd_tree', 'n_neighbors': 19, 'weights': 'distance', 'metric': 'euclidean'}. Best is trial 6 with value: 0.8771929824561403.
[32m[I 2023-04-26 13:00:44,052][39m Trial 341 finished with value: 0.8596491228070176 and parameters: {'algorithm': 'kd_tree', 'n_neighbors': 11, 'weights': 'distance', 'metric': 'euclidean'}. Best is trial 6 with value: 0.8771929824561403.
[32m[I 2023-04-26 13:00:44,073][39m Trial 342 finished with value: 0.8495575221238938 and parameters: {'algorithm': 'ball_tree', 'n_neighbors': 26, 'weights': 'distance', 'metric': 'euclidean'}. Best is trial 6 with value: 0.8771929824561403.
[32m[I 2023-04-26 13:00:44,108][39m Trial 343 finished with value: 0.8771929824561403 and parameters: {'algorithm': 'auto', 'n_neighbors': 12, 'weights': 'distance', 'metric': 'minkowski'}. Best is trial 6 with value: 0.8771929824561403.
[32m[I 2023-04-26 13:00:44,139][39m Trial 344 finished with value: 0.8771929824561403 and parameters: {'algorithm': 'brute', 'n_neighbors': 12, 'weights': 'distance', 'metric': 'euclidean'}. Best is trial 6 with value: 0.8771929824561403.
[32m[I 2023-04-26 13:00:44,172][39m Trial 345 finished with value: 0.8672566371681416 and parameters: {'algorithm': 'brute', 'n_neighbors': 13, 'weights': 'distance', 'metric': 'minkowski'}. Best is trial 6 with value: 0.8771929824561403.
[32m[I 2023-04-26 13:00:44,191][39m Trial 346 finished with value: 0.8596491228070176 and parameters: {'algorithm': 'kd_tree', 'n_neighbors': 10, 'weights': 'distance', 'metric': 'euclidean'}. Best is trial 6 with value: 0.8771929824561403.
[32m[I 2023-04-26 13:00:44,223][39m Trial 347 finished with value: 0.8596491228070176 and parameters: {'algorithm': 'auto', 'n_neighbors': 11, 'weights': 'distance', 'metric': 'euclidean'}. Best is trial 6 with value: 0.8771929824561403.
[32m[I 2023-04-26 13:00:44,255][39m Trial 348 finished with value: 0.8596491228070176 and parameters: {'algorithm': 'auto', 'n_neighbors': 11, 'weights': 'distance', 'metric': 'euclidean'}. Best is trial 6 with value: 0.8771929824561403.
[32m[I 2023-04-26 13:00:44,289][39m Trial 349 finished with value: 0.8771929824561403 and parameters: {'algorithm': 'auto', 'n_neighbors': 12, 'weights': 'distance', 'metric': 'euclidean'}. Best is trial 6 with value: 0.8771929824561403.
[32m[I 2023-04-26 13:00:44,308][39m Trial 350 finished with value: 0.8771929824561403 and parameters: {'algorithm': 'kd_tree', 'n_neighbors': 12, 'weights': 'distance', 'metric': 'euclidean'}. Best is trial 6 with value: 0.8771929824561403.
[32m[I 2023-04-26 13:00:44,340][39m Trial 351 finished with value: 0.8771929824561403 and parameters: {'algorithm': 'brute', 'n_neighbors': 12, 'weights': 'distance', 'metric': 'euclidean'}. Best is trial 6 with value: 0.8771929824561403.
[32m[I 2023-04-26 13:00:44,374][39m Trial 352 finished with value: 0.8672566371681416 and parameters: {'algorithm': 'brute', 'n_neighbors': 13, 'weights': 'distance', 'metric': 'euclidean'}. Best is trial 6 with value: 0.8771929824561403.
[32m[I 2023-04-26 13:00:44,396][39m Trial 353 finished with value: 0.8288288288288289 and parameters: {'algorithm': 'kd_tree', 'n_neighbors': 14, 'weights': 'uniform', 'metric': 'euclidean'}. Best is trial 6 with value: 0.8771929824561403.
[32m[I 2023-04-26 13:00:44,417][39m Trial 354 finished with value: 0.8672566371681416 and parameters: {'algorithm': 'kd_tree', 'n_neighbors': 13, 'weights': 'distance', 'metric': 'euclidean'}. Best is trial 6 with value: 0.8771929824561403.
[32m[I 2023-04-26 13:00:44,449][39m Trial 355 finished with value: 0.8771929824561403 and parameters: {'algorithm': 'brute', 'n_neighbors': 12, 'weights': 'distance', 'metric': 'euclidean'}. Best is trial 6 with value: 0.8771929824561403.
[32m[I 2023-04-26 13:00:44,469][39m Trial 356 finished with value: 0.8596491228070176 and parameters: {'algorithm': 'ball_tree', 'n_neighbors': 11, 'weights': 'distance', 'metric': 'euclidean'}. Best is trial 6 with value: 0.8771929824561403.
[32m[I 2023-04-26 13:00:44,487][39m Trial 357 finished with value: 0.8596491228070176 and parameters: {'algorithm': 'ball_tree', 'n_neighbors': 10, 'weights': 'distance', 'metric': 'manhattan'}. Best is trial 6 with value: 0.8771929824561403.
[32m[I 2023-04-26 13:00:44,506][39m Trial 358 finished with value: 0.8672566371681416 and parameters: {'algorithm': 'ball_tree', 'n_neighbors': 13, 'weights': 'distance', 'metric': 'euclidean'}. Best is trial 6 with value: 0.8771929824561403.
[32m[I 2023-04-26 13:00:44,538][39m Trial 359 finished with value: 0.8596491228070176 and parameters: {'algorithm': 'auto', 'n_neighbors': 11, 'weights': 'distance', 'metric': 'euclidean'}. Best is trial 6 with value: 0.8771929824561403.
[32m[I 2023-04-26 13:00:44,557][39m Trial 360 finished with value: 0.8771929824561403 and parameters: {'algorithm': 'kd_tree', 'n_neighbors': 12, 'weights': 'distance', 'metric': 'euclidean'}. Best is trial 6 with value: 0.8771929824561403.
