[32m[I 2023-04-26 13:00:36,462][39m A new study created in memory with name: no-name-3c0a62a0-958e-4b87-a7cf-10e659adb4e5
[32m[I 2023-04-26 13:00:36,472][39m Trial 0 finished with value: 0.8571428571428572 and parameters: {'algorithm': 'kd_tree', 'n_neighbors': 5, 'weights': 'uniform', 'metric': 'euclidean'}. Best is trial 0 with value: 0.8571428571428572.
[32m[I 2023-04-26 13:00:36,479][39m Trial 1 finished with value: 0.831858407079646 and parameters: {'algorithm': 'ball_tree', 'n_neighbors': 1, 'weights': 'uniform', 'metric': 'minkowski'}. Best is trial 0 with value: 0.8571428571428572.
[32m[I 2023-04-26 13:00:36,485][39m Trial 2 finished with value: 0.8181818181818181 and parameters: {'algorithm': 'ball_tree', 'n_neighbors': 12, 'weights': 'uniform', 'metric': 'manhattan'}. Best is trial 0 with value: 0.8571428571428572.
[32m[I 2023-04-26 13:00:36,490][39m Trial 3 finished with value: 0.8392857142857144 and parameters: {'algorithm': 'ball_tree', 'n_neighbors': 8, 'weights': 'distance', 'metric': 'manhattan'}. Best is trial 0 with value: 0.8571428571428572.
[32m[I 2023-04-26 13:00:36,520][39m Trial 4 finished with value: 0.8571428571428572 and parameters: {'algorithm': 'auto', 'n_neighbors': 30, 'weights': 'distance', 'metric': 'euclidean'}. Best is trial 0 with value: 0.8571428571428572.
[32m[I 2023-04-26 13:00:36,546][39m Trial 5 finished with value: 0.8421052631578947 and parameters: {'algorithm': 'brute', 'n_neighbors': 3, 'weights': 'distance', 'metric': 'minkowski'}. Best is trial 0 with value: 0.8571428571428572.
[32m[I 2023-04-26 13:00:36,571][39m Trial 6 finished with value: 0.8771929824561403 and parameters: {'algorithm': 'brute', 'n_neighbors': 12, 'weights': 'distance', 'metric': 'euclidean'}. Best is trial 6 with value: 0.8771929824561403.
[32m[I 2023-04-26 13:00:36,582][39m Trial 7 finished with value: 0.7826086956521741 and parameters: {'algorithm': 'ball_tree', 'n_neighbors': 25, 'weights': 'uniform', 'metric': 'euclidean'}. Best is trial 6 with value: 0.8771929824561403.
[32m[I 2023-04-26 13:00:36,594][39m Trial 8 finished with value: 0.8411214953271028 and parameters: {'algorithm': 'kd_tree', 'n_neighbors': 8, 'weights': 'uniform', 'metric': 'euclidean'}. Best is trial 6 with value: 0.8771929824561403.
[32m[I 2023-04-26 13:00:36,612][39m Trial 9 finished with value: 0.8073394495412843 and parameters: {'algorithm': 'brute', 'n_neighbors': 4, 'weights': 'uniform', 'metric': 'euclidean'}. Best is trial 6 with value: 0.8771929824561403.
[32m[I 2023-04-26 13:00:36,634][39m Trial 10 finished with value: 0.8596491228070176 and parameters: {'algorithm': 'brute', 'n_neighbors': 18, 'weights': 'distance', 'metric': 'manhattan'}. Best is trial 6 with value: 0.8771929824561403.
[32m[I 2023-04-26 13:00:36,661][39m Trial 11 finished with value: 0.8596491228070176 and parameters: {'algorithm': 'brute', 'n_neighbors': 18, 'weights': 'distance', 'metric': 'manhattan'}. Best is trial 6 with value: 0.8771929824561403.
[32m[I 2023-04-26 13:00:36,686][39m Trial 12 finished with value: 0.8596491228070176 and parameters: {'algorithm': 'brute', 'n_neighbors': 18, 'weights': 'distance', 'metric': 'manhattan'}. Best is trial 6 with value: 0.8771929824561403.
[32m[I 2023-04-26 13:00:36,711][39m Trial 13 finished with value: 0.8596491228070176 and parameters: {'algorithm': 'brute', 'n_neighbors': 14, 'weights': 'distance', 'metric': 'manhattan'}. Best is trial 6 with value: 0.8771929824561403.
[32m[I 2023-04-26 13:00:36,737][39m Trial 14 finished with value: 0.8363636363636363 and parameters: {'algorithm': 'auto', 'n_neighbors': 22, 'weights': 'distance', 'metric': 'minkowski'}. Best is trial 6 with value: 0.8771929824561403.
[32m[I 2023-04-26 13:00:36,762][39m Trial 15 finished with value: 0.8771929824561403 and parameters: {'algorithm': 'brute', 'n_neighbors': 12, 'weights': 'distance', 'metric': 'euclidean'}. Best is trial 6 with value: 0.8771929824561403.
[32m[I 2023-04-26 13:00:36,787][39m Trial 16 finished with value: 0.8596491228070176 and parameters: {'algorithm': 'brute', 'n_neighbors': 11, 'weights': 'distance', 'metric': 'euclidean'}. Best is trial 6 with value: 0.8771929824561403.
[32m[I 2023-04-26 13:00:36,811][39m Trial 17 finished with value: 0.8596491228070176 and parameters: {'algorithm': 'brute', 'n_neighbors': 9, 'weights': 'distance', 'metric': 'euclidean'}. Best is trial 6 with value: 0.8771929824561403.
[32m[I 2023-04-26 13:00:36,837][39m Trial 18 finished with value: 0.8672566371681416 and parameters: {'algorithm': 'auto', 'n_neighbors': 13, 'weights': 'distance', 'metric': 'euclidean'}. Best is trial 6 with value: 0.8771929824561403.
[32m[I 2023-04-26 13:00:36,848][39m Trial 19 finished with value: 0.8571428571428572 and parameters: {'algorithm': 'kd_tree', 'n_neighbors': 16, 'weights': 'distance', 'metric': 'euclidean'}. Best is trial 6 with value: 0.8771929824561403.
[32m[I 2023-04-26 13:00:36,873][39m Trial 20 finished with value: 0.8672566371681416 and parameters: {'algorithm': 'brute', 'n_neighbors': 20, 'weights': 'distance', 'metric': 'euclidean'}. Best is trial 6 with value: 0.8771929824561403.
[32m[I 2023-04-26 13:00:36,897][39m Trial 21 finished with value: 0.8571428571428572 and parameters: {'algorithm': 'brute', 'n_neighbors': 24, 'weights': 'distance', 'metric': 'euclidean'}. Best is trial 6 with value: 0.8771929824561403.
[32m[I 2023-04-26 13:00:36,922][39m Trial 22 finished with value: 0.8468468468468469 and parameters: {'algorithm': 'auto', 'n_neighbors': 14, 'weights': 'distance', 'metric': 'euclidean'}. Best is trial 6 with value: 0.8771929824561403.
[32m[I 2023-04-26 13:00:36,947][39m Trial 23 finished with value: 0.8672566371681416 and parameters: {'algorithm': 'brute', 'n_neighbors': 21, 'weights': 'distance', 'metric': 'euclidean'}. Best is trial 6 with value: 0.8771929824561403.
[32m[I 2023-04-26 13:00:36,973][39m Trial 24 finished with value: 0.8695652173913043 and parameters: {'algorithm': 'brute', 'n_neighbors': 29, 'weights': 'distance', 'metric': 'euclidean'}. Best is trial 6 with value: 0.8771929824561403.
[32m[I 2023-04-26 13:00:36,997][39m Trial 25 finished with value: 0.8695652173913043 and parameters: {'algorithm': 'brute', 'n_neighbors': 29, 'weights': 'distance', 'metric': 'minkowski'}. Best is trial 6 with value: 0.8771929824561403.
[32m[I 2023-04-26 13:00:37,022][39m Trial 26 finished with value: 0.8495575221238938 and parameters: {'algorithm': 'brute', 'n_neighbors': 27, 'weights': 'distance', 'metric': 'minkowski'}. Best is trial 6 with value: 0.8771929824561403.
[32m[I 2023-04-26 13:00:37,047][39m Trial 27 finished with value: 0.8596491228070176 and parameters: {'algorithm': 'brute', 'n_neighbors': 10, 'weights': 'distance', 'metric': 'euclidean'}. Best is trial 6 with value: 0.8771929824561403.
[32m[I 2023-04-26 13:00:37,059][39m Trial 28 finished with value: 0.8392857142857144 and parameters: {'algorithm': 'kd_tree', 'n_neighbors': 6, 'weights': 'distance', 'metric': 'minkowski'}. Best is trial 6 with value: 0.8771929824561403.
[32m[I 2023-04-26 13:00:37,075][39m Trial 29 finished with value: 0.8256880733944953 and parameters: {'algorithm': 'kd_tree', 'n_neighbors': 16, 'weights': 'uniform', 'metric': 'minkowski'}. Best is trial 6 with value: 0.8771929824561403.
[32m[I 2023-04-26 13:00:37,100][39m Trial 30 finished with value: 0.8495575221238938 and parameters: {'algorithm': 'brute', 'n_neighbors': 7, 'weights': 'distance', 'metric': 'minkowski'}. Best is trial 6 with value: 0.8771929824561403.
[32m[I 2023-04-26 13:00:37,124][39m Trial 31 finished with value: 0.8571428571428572 and parameters: {'algorithm': 'brute', 'n_neighbors': 30, 'weights': 'distance', 'metric': 'euclidean'}. Best is trial 6 with value: 0.8771929824561403.
[32m[I 2023-04-26 13:00:37,148][39m Trial 32 finished with value: 0.8495575221238938 and parameters: {'algorithm': 'brute', 'n_neighbors': 28, 'weights': 'distance', 'metric': 'minkowski'}. Best is trial 6 with value: 0.8771929824561403.
[32m[I 2023-04-26 13:00:37,173][39m Trial 33 finished with value: 0.8495575221238938 and parameters: {'algorithm': 'brute', 'n_neighbors': 26, 'weights': 'distance', 'metric': 'euclidean'}. Best is trial 6 with value: 0.8771929824561403.
[32m[I 2023-04-26 13:00:37,190][39m Trial 34 finished with value: 0.7966101694915254 and parameters: {'algorithm': 'ball_tree', 'n_neighbors': 23, 'weights': 'uniform', 'metric': 'minkowski'}. Best is trial 6 with value: 0.8771929824561403.
[32m[I 2023-04-26 13:00:37,213][39m Trial 35 finished with value: 0.8495575221238938 and parameters: {'algorithm': 'brute', 'n_neighbors': 28, 'weights': 'distance', 'metric': 'euclidean'}. Best is trial 6 with value: 0.8771929824561403.
[32m[I 2023-04-26 13:00:37,226][39m Trial 36 finished with value: 0.8771929824561403 and parameters: {'algorithm': 'ball_tree', 'n_neighbors': 12, 'weights': 'distance', 'metric': 'euclidean'}. Best is trial 6 with value: 0.8771929824561403.
[32m[I 2023-04-26 13:00:37,242][39m Trial 37 finished with value: 0.8288288288288289 and parameters: {'algorithm': 'ball_tree', 'n_neighbors': 12, 'weights': 'uniform', 'metric': 'minkowski'}. Best is trial 6 with value: 0.8771929824561403.
[32m[I 2023-04-26 13:00:37,254][39m Trial 38 finished with value: 0.8596491228070176 and parameters: {'algorithm': 'ball_tree', 'n_neighbors': 10, 'weights': 'distance', 'metric': 'euclidean'}. Best is trial 6 with value: 0.8771929824561403.
[32m[I 2023-04-26 13:00:37,267][39m Trial 39 finished with value: 0.8571428571428572 and parameters: {'algorithm': 'ball_tree', 'n_neighbors': 15, 'weights': 'distance', 'metric': 'euclidean'}. Best is trial 6 with value: 0.8771929824561403.
[32m[I 2023-04-26 13:00:37,283][39m Trial 40 finished with value: 0.7924528301886793 and parameters: {'algorithm': 'ball_tree', 'n_neighbors': 2, 'weights': 'uniform', 'metric': 'minkowski'}. Best is trial 6 with value: 0.8771929824561403.
[32m[I 2023-04-26 13:00:37,295][39m Trial 41 finished with value: 0.8771929824561403 and parameters: {'algorithm': 'ball_tree', 'n_neighbors': 12, 'weights': 'distance', 'metric': 'euclidean'}. Best is trial 6 with value: 0.8771929824561403.
[32m[I 2023-04-26 13:00:37,306][39m Trial 42 finished with value: 0.8771929824561403 and parameters: {'algorithm': 'ball_tree', 'n_neighbors': 12, 'weights': 'distance', 'metric': 'euclidean'}. Best is trial 6 with value: 0.8771929824561403.
[32m[I 2023-04-26 13:00:37,319][39m Trial 43 finished with value: 0.8771929824561403 and parameters: {'algorithm': 'ball_tree', 'n_neighbors': 12, 'weights': 'distance', 'metric': 'euclidean'}. Best is trial 6 with value: 0.8771929824561403.
[32m[I 2023-04-26 13:00:37,326][39m Trial 44 finished with value: 0.8596491228070176 and parameters: {'algorithm': 'ball_tree', 'n_neighbors': 10, 'weights': 'distance', 'metric': 'euclidean'}. Best is trial 6 with value: 0.8771929824561403.
[32m[I 2023-04-26 13:00:37,333][39m Trial 45 finished with value: 0.8495575221238938 and parameters: {'algorithm': 'ball_tree', 'n_neighbors': 8, 'weights': 'distance', 'metric': 'euclidean'}. Best is trial 6 with value: 0.8771929824561403.
[32m[I 2023-04-26 13:00:37,340][39m Trial 46 finished with value: 0.8495575221238938 and parameters: {'algorithm': 'ball_tree', 'n_neighbors': 13, 'weights': 'distance', 'metric': 'manhattan'}. Best is trial 6 with value: 0.8771929824561403.
[32m[I 2023-04-26 13:00:37,346][39m Trial 47 finished with value: 0.8421052631578947 and parameters: {'algorithm': 'ball_tree', 'n_neighbors': 5, 'weights': 'distance', 'metric': 'euclidean'}. Best is trial 6 with value: 0.8771929824561403.
[32m[I 2023-04-26 13:00:37,360][39m Trial 48 finished with value: 0.8288288288288289 and parameters: {'algorithm': 'ball_tree', 'n_neighbors': 11, 'weights': 'uniform', 'metric': 'euclidean'}. Best is trial 6 with value: 0.8771929824561403.
[32m[I 2023-04-26 13:00:37,367][39m Trial 49 finished with value: 0.8596491228070176 and parameters: {'algorithm': 'ball_tree', 'n_neighbors': 17, 'weights': 'distance', 'metric': 'euclidean'}. Best is trial 6 with value: 0.8771929824561403.
[32m[I 2023-04-26 13:00:37,374][39m Trial 50 finished with value: 0.8596491228070176 and parameters: {'algorithm': 'ball_tree', 'n_neighbors': 14, 'weights': 'distance', 'metric': 'manhattan'}. Best is trial 6 with value: 0.8771929824561403.
[32m[I 2023-04-26 13:00:37,385][39m Trial 51 finished with value: 0.8672566371681416 and parameters: {'algorithm': 'ball_tree', 'n_neighbors': 13, 'weights': 'distance', 'metric': 'euclidean'}. Best is trial 6 with value: 0.8771929824561403.
[32m[I 2023-04-26 13:00:37,393][39m Trial 52 finished with value: 0.8771929824561403 and parameters: {'algorithm': 'ball_tree', 'n_neighbors': 12, 'weights': 'distance', 'metric': 'euclidean'}. Best is trial 6 with value: 0.8771929824561403.
[32m[I 2023-04-26 13:00:37,418][39m Trial 53 finished with value: 0.8596491228070176 and parameters: {'algorithm': 'auto', 'n_neighbors': 11, 'weights': 'distance', 'metric': 'euclidean'}. Best is trial 6 with value: 0.8771929824561403.
[32m[I 2023-04-26 13:00:37,431][39m Trial 54 finished with value: 0.8596491228070176 and parameters: {'algorithm': 'ball_tree', 'n_neighbors': 9, 'weights': 'distance', 'metric': 'euclidean'}. Best is trial 6 with value: 0.8771929824561403.
[32m[I 2023-04-26 13:00:37,443][39m Trial 55 finished with value: 0.8571428571428572 and parameters: {'algorithm': 'ball_tree', 'n_neighbors': 15, 'weights': 'distance', 'metric': 'euclidean'}. Best is trial 6 with value: 0.8771929824561403.
[32m[I 2023-04-26 13:00:37,456][39m Trial 56 finished with value: 0.8771929824561403 and parameters: {'algorithm': 'ball_tree', 'n_neighbors': 12, 'weights': 'distance', 'metric': 'euclidean'}. Best is trial 6 with value: 0.8771929824561403.
[32m[I 2023-04-26 13:00:37,469][39m Trial 57 finished with value: 0.8596491228070176 and parameters: {'algorithm': 'kd_tree', 'n_neighbors': 9, 'weights': 'distance', 'metric': 'euclidean'}. Best is trial 6 with value: 0.8771929824561403.
[32m[I 2023-04-26 13:00:37,480][39m Trial 58 finished with value: 0.8495575221238938 and parameters: {'algorithm': 'ball_tree', 'n_neighbors': 7, 'weights': 'distance', 'metric': 'euclidean'}. Best is trial 6 with value: 0.8771929824561403.
[32m[I 2023-04-26 13:00:37,494][39m Trial 59 finished with value: 0.8392857142857144 and parameters: {'algorithm': 'ball_tree', 'n_neighbors': 17, 'weights': 'distance', 'metric': 'manhattan'}. Best is trial 6 with value: 0.8771929824561403.
[32m[I 2023-04-26 13:00:37,505][39m Trial 60 finished with value: 0.8468468468468469 and parameters: {'algorithm': 'ball_tree', 'n_neighbors': 14, 'weights': 'distance', 'metric': 'euclidean'}. Best is trial 6 with value: 0.8771929824561403.
[32m[I 2023-04-26 13:00:37,530][39m Trial 61 finished with value: 0.8771929824561403 and parameters: {'algorithm': 'auto', 'n_neighbors': 12, 'weights': 'distance', 'metric': 'euclidean'}. Best is trial 6 with value: 0.8771929824561403.
[32m[I 2023-04-26 13:00:37,557][39m Trial 62 finished with value: 0.8596491228070176 and parameters: {'algorithm': 'auto', 'n_neighbors': 11, 'weights': 'distance', 'metric': 'euclidean'}. Best is trial 6 with value: 0.8771929824561403.
[32m[I 2023-04-26 13:00:37,581][39m Trial 63 finished with value: 0.8672566371681416 and parameters: {'algorithm': 'auto', 'n_neighbors': 13, 'weights': 'distance', 'metric': 'euclidean'}. Best is trial 6 with value: 0.8771929824561403.
[32m[I 2023-04-26 13:00:37,607][39m Trial 64 finished with value: 0.8771929824561403 and parameters: {'algorithm': 'auto', 'n_neighbors': 12, 'weights': 'distance', 'metric': 'euclidean'}. Best is trial 6 with value: 0.8771929824561403.
[32m[I 2023-04-26 13:00:37,633][39m Trial 65 finished with value: 0.8596491228070176 and parameters: {'algorithm': 'auto', 'n_neighbors': 10, 'weights': 'distance', 'metric': 'euclidean'}. Best is trial 6 with value: 0.8771929824561403.
[32m[I 2023-04-26 13:00:37,658][39m Trial 66 finished with value: 0.8571428571428572 and parameters: {'algorithm': 'auto', 'n_neighbors': 15, 'weights': 'distance', 'metric': 'euclidean'}. Best is trial 6 with value: 0.8771929824561403.
[32m[I 2023-04-26 13:00:37,682][39m Trial 67 finished with value: 0.8495575221238938 and parameters: {'algorithm': 'auto', 'n_neighbors': 8, 'weights': 'distance', 'metric': 'euclidean'}. Best is trial 6 with value: 0.8771929824561403.
[32m[I 2023-04-26 13:00:37,703][39m Trial 68 finished with value: 0.8288288288288289 and parameters: {'algorithm': 'auto', 'n_neighbors': 12, 'weights': 'uniform', 'metric': 'euclidean'}. Best is trial 6 with value: 0.8771929824561403.
[32m[I 2023-04-26 13:00:37,712][39m Trial 69 finished with value: 0.8596491228070176 and parameters: {'algorithm': 'ball_tree', 'n_neighbors': 19, 'weights': 'distance', 'metric': 'euclidean'}. Best is trial 6 with value: 0.8771929824561403.
[32m[I 2023-04-26 13:00:37,741][39m Trial 70 finished with value: 0.8672566371681416 and parameters: {'algorithm': 'auto', 'n_neighbors': 13, 'weights': 'distance', 'metric': 'euclidean'}. Best is trial 6 with value: 0.8771929824561403.
[32m[I 2023-04-26 13:00:37,768][39m Trial 71 finished with value: 0.8771929824561403 and parameters: {'algorithm': 'auto', 'n_neighbors': 12, 'weights': 'distance', 'metric': 'euclidean'}. Best is trial 6 with value: 0.8771929824561403.
[32m[I 2023-04-26 13:00:37,794][39m Trial 72 finished with value: 0.8596491228070176 and parameters: {'algorithm': 'auto', 'n_neighbors': 11, 'weights': 'distance', 'metric': 'euclidean'}. Best is trial 6 with value: 0.8771929824561403.
[32m[I 2023-04-26 13:00:37,807][39m Trial 73 finished with value: 0.8771929824561403 and parameters: {'algorithm': 'ball_tree', 'n_neighbors': 12, 'weights': 'distance', 'metric': 'euclidean'}. Best is trial 6 with value: 0.8771929824561403.
[32m[I 2023-04-26 13:00:37,834][39m Trial 74 finished with value: 0.8468468468468469 and parameters: {'algorithm': 'auto', 'n_neighbors': 14, 'weights': 'distance', 'metric': 'euclidean'}. Best is trial 6 with value: 0.8771929824561403.
[32m[I 2023-04-26 13:00:37,847][39m Trial 75 finished with value: 0.8571428571428572 and parameters: {'algorithm': 'kd_tree', 'n_neighbors': 16, 'weights': 'distance', 'metric': 'euclidean'}. Best is trial 6 with value: 0.8771929824561403.
[32m[I 2023-04-26 13:00:37,860][39m Trial 76 finished with value: 0.8596491228070176 and parameters: {'algorithm': 'ball_tree', 'n_neighbors': 10, 'weights': 'distance', 'metric': 'euclidean'}. Best is trial 6 with value: 0.8771929824561403.
[32m[I 2023-04-26 13:00:37,873][39m Trial 77 finished with value: 0.8495575221238938 and parameters: {'algorithm': 'ball_tree', 'n_neighbors': 9, 'weights': 'distance', 'metric': 'manhattan'}. Best is trial 6 with value: 0.8771929824561403.
[32m[I 2023-04-26 13:00:37,897][39m Trial 78 finished with value: 0.8468468468468469 and parameters: {'algorithm': 'auto', 'n_neighbors': 14, 'weights': 'distance', 'metric': 'euclidean'}. Best is trial 6 with value: 0.8771929824561403.
[32m[I 2023-04-26 13:00:37,920][39m Trial 79 finished with value: 0.8141592920353982 and parameters: {'algorithm': 'auto', 'n_neighbors': 13, 'weights': 'uniform', 'metric': 'euclidean'}. Best is trial 6 with value: 0.8771929824561403.
[32m[I 2023-04-26 13:00:37,946][39m Trial 80 finished with value: 0.8596491228070176 and parameters: {'algorithm': 'auto', 'n_neighbors': 11, 'weights': 'distance', 'metric': 'euclidean'}. Best is trial 6 with value: 0.8771929824561403.
[32m[I 2023-04-26 13:00:37,973][39m Trial 81 finished with value: 0.8771929824561403 and parameters: {'algorithm': 'auto', 'n_neighbors': 12, 'weights': 'distance', 'metric': 'euclidean'}. Best is trial 6 with value: 0.8771929824561403.
[32m[I 2023-04-26 13:00:37,987][39m Trial 82 finished with value: 0.8571428571428572 and parameters: {'algorithm': 'ball_tree', 'n_neighbors': 15, 'weights': 'distance', 'metric': 'euclidean'}. Best is trial 6 with value: 0.8771929824561403.
[32m[I 2023-04-26 13:00:37,999][39m Trial 83 finished with value: 0.8771929824561403 and parameters: {'algorithm': 'ball_tree', 'n_neighbors': 12, 'weights': 'distance', 'metric': 'euclidean'}. Best is trial 6 with value: 0.8771929824561403.
[32m[I 2023-04-26 13:00:38,023][39m Trial 84 finished with value: 0.8771929824561403 and parameters: {'algorithm': 'auto', 'n_neighbors': 12, 'weights': 'distance', 'metric': 'euclidean'}. Best is trial 6 with value: 0.8771929824561403.
[32m[I 2023-04-26 13:00:38,049][39m Trial 85 finished with value: 0.8672566371681416 and parameters: {'algorithm': 'auto', 'n_neighbors': 13, 'weights': 'distance', 'metric': 'euclidean'}. Best is trial 6 with value: 0.8771929824561403.
[32m[I 2023-04-26 13:00:38,062][39m Trial 86 finished with value: 0.8495575221238938 and parameters: {'algorithm': 'ball_tree', 'n_neighbors': 8, 'weights': 'distance', 'metric': 'euclidean'}. Best is trial 6 with value: 0.8771929824561403.
[32m[I 2023-04-26 13:00:38,075][39m Trial 87 finished with value: 0.8596491228070176 and parameters: {'algorithm': 'kd_tree', 'n_neighbors': 10, 'weights': 'distance', 'metric': 'euclidean'}. Best is trial 6 with value: 0.8771929824561403.
[32m[I 2023-04-26 13:00:38,089][39m Trial 88 finished with value: 0.8596491228070176 and parameters: {'algorithm': 'ball_tree', 'n_neighbors': 11, 'weights': 'distance', 'metric': 'euclidean'}. Best is trial 6 with value: 0.8771929824561403.
[32m[I 2023-04-26 13:00:38,113][39m Trial 89 finished with value: 0.8495575221238938 and parameters: {'algorithm': 'brute', 'n_neighbors': 9, 'weights': 'distance', 'metric': 'manhattan'}. Best is trial 6 with value: 0.8771929824561403.
