[32m[I 2023-04-26 13:00:38,140][39m Trial 90 finished with value: 0.8771929824561403 and parameters: {'algorithm': 'auto', 'n_neighbors': 12, 'weights': 'distance', 'metric': 'euclidean'}. Best is trial 6 with value: 0.8771929824561403.
[32m[I 2023-04-26 13:00:38,164][39m Trial 91 finished with value: 0.8468468468468469 and parameters: {'algorithm': 'auto', 'n_neighbors': 14, 'weights': 'distance', 'metric': 'euclidean'}. Best is trial 6 with value: 0.8771929824561403.
[32m[I 2023-04-26 13:00:38,190][39m Trial 92 finished with value: 0.8596491228070176 and parameters: {'algorithm': 'brute', 'n_neighbors': 11, 'weights': 'distance', 'metric': 'euclidean'}. Best is trial 6 with value: 0.8771929824561403.
[32m[I 2023-04-26 13:00:38,213][39m Trial 93 finished with value: 0.8672566371681416 and parameters: {'algorithm': 'brute', 'n_neighbors': 13, 'weights': 'distance', 'metric': 'euclidean'}. Best is trial 6 with value: 0.8771929824561403.
[32m[I 2023-04-26 13:00:38,240][39m Trial 94 finished with value: 0.8771929824561403 and parameters: {'algorithm': 'auto', 'n_neighbors': 12, 'weights': 'distance', 'metric': 'euclidean'}. Best is trial 6 with value: 0.8771929824561403.
[32m[I 2023-04-26 13:00:38,253][39m Trial 95 finished with value: 0.8596491228070176 and parameters: {'algorithm': 'ball_tree', 'n_neighbors': 10, 'weights': 'distance', 'metric': 'euclidean'}. Best is trial 6 with value: 0.8771929824561403.
[32m[I 2023-04-26 13:00:38,270][39m Trial 96 finished with value: 0.8288288288288289 and parameters: {'algorithm': 'ball_tree', 'n_neighbors': 14, 'weights': 'uniform', 'metric': 'euclidean'}. Best is trial 6 with value: 0.8771929824561403.
[32m[I 2023-04-26 13:00:38,285][39m Trial 97 finished with value: 0.8596491228070176 and parameters: {'algorithm': 'ball_tree', 'n_neighbors': 17, 'weights': 'distance', 'metric': 'euclidean'}. Best is trial 6 with value: 0.8771929824561403.
[32m[I 2023-04-26 13:00:38,310][39m Trial 98 finished with value: 0.8771929824561403 and parameters: {'algorithm': 'auto', 'n_neighbors': 12, 'weights': 'distance', 'metric': 'euclidean'}. Best is trial 6 with value: 0.8771929824561403.
[32m[I 2023-04-26 13:00:38,323][39m Trial 99 finished with value: 0.8495575221238938 and parameters: {'algorithm': 'ball_tree', 'n_neighbors': 7, 'weights': 'distance', 'metric': 'euclidean'}. Best is trial 6 with value: 0.8771929824561403.
[32m[I 2023-04-26 13:00:38,337][39m Trial 100 finished with value: 0.8571428571428572 and parameters: {'algorithm': 'ball_tree', 'n_neighbors': 15, 'weights': 'distance', 'metric': 'minkowski'}. Best is trial 6 with value: 0.8771929824561403.
[32m[I 2023-04-26 13:00:38,350][39m Trial 101 finished with value: 0.8771929824561403 and parameters: {'algorithm': 'ball_tree', 'n_neighbors': 12, 'weights': 'distance', 'metric': 'euclidean'}. Best is trial 6 with value: 0.8771929824561403.
[32m[I 2023-04-26 13:00:38,363][39m Trial 102 finished with value: 0.8672566371681416 and parameters: {'algorithm': 'ball_tree', 'n_neighbors': 13, 'weights': 'distance', 'metric': 'euclidean'}. Best is trial 6 with value: 0.8771929824561403.
[32m[I 2023-04-26 13:00:38,377][39m Trial 103 finished with value: 0.8596491228070176 and parameters: {'algorithm': 'ball_tree', 'n_neighbors': 11, 'weights': 'distance', 'metric': 'euclidean'}. Best is trial 6 with value: 0.8771929824561403.
[32m[I 2023-04-26 13:00:38,402][39m Trial 104 finished with value: 0.8596491228070176 and parameters: {'algorithm': 'auto', 'n_neighbors': 9, 'weights': 'distance', 'metric': 'euclidean'}. Best is trial 6 with value: 0.8771929824561403.
[32m[I 2023-04-26 13:00:38,428][39m Trial 105 finished with value: 0.8771929824561403 and parameters: {'algorithm': 'auto', 'n_neighbors': 12, 'weights': 'distance', 'metric': 'euclidean'}. Best is trial 6 with value: 0.8771929824561403.
[32m[I 2023-04-26 13:00:38,442][39m Trial 106 finished with value: 0.8596491228070176 and parameters: {'algorithm': 'ball_tree', 'n_neighbors': 10, 'weights': 'distance', 'metric': 'euclidean'}. Best is trial 6 with value: 0.8771929824561403.
[32m[I 2023-04-26 13:00:38,456][39m Trial 107 finished with value: 0.8571428571428572 and parameters: {'algorithm': 'kd_tree', 'n_neighbors': 16, 'weights': 'distance', 'metric': 'euclidean'}. Best is trial 6 with value: 0.8771929824561403.
[32m[I 2023-04-26 13:00:38,483][39m Trial 108 finished with value: 0.8672566371681416 and parameters: {'algorithm': 'auto', 'n_neighbors': 13, 'weights': 'distance', 'metric': 'euclidean'}. Best is trial 6 with value: 0.8771929824561403.
[32m[I 2023-04-26 13:00:38,510][39m Trial 109 finished with value: 0.8596491228070176 and parameters: {'algorithm': 'auto', 'n_neighbors': 11, 'weights': 'distance', 'metric': 'euclidean'}. Best is trial 6 with value: 0.8771929824561403.
[32m[I 2023-04-26 13:00:38,533][39m Trial 110 finished with value: 0.8333333333333334 and parameters: {'algorithm': 'auto', 'n_neighbors': 14, 'weights': 'uniform', 'metric': 'manhattan'}. Best is trial 6 with value: 0.8771929824561403.
[32m[I 2023-04-26 13:00:38,562][39m Trial 111 finished with value: 0.8771929824561403 and parameters: {'algorithm': 'auto', 'n_neighbors': 12, 'weights': 'distance', 'metric': 'euclidean'}. Best is trial 6 with value: 0.8771929824561403.
[32m[I 2023-04-26 13:00:38,589][39m Trial 112 finished with value: 0.8771929824561403 and parameters: {'algorithm': 'auto', 'n_neighbors': 12, 'weights': 'distance', 'metric': 'euclidean'}. Best is trial 6 with value: 0.8771929824561403.
[32m[I 2023-04-26 13:00:38,602][39m Trial 113 finished with value: 0.8672566371681416 and parameters: {'algorithm': 'ball_tree', 'n_neighbors': 13, 'weights': 'distance', 'metric': 'euclidean'}. Best is trial 6 with value: 0.8771929824561403.
[32m[I 2023-04-26 13:00:38,616][39m Trial 114 finished with value: 0.8596491228070176 and parameters: {'algorithm': 'ball_tree', 'n_neighbors': 10, 'weights': 'distance', 'metric': 'euclidean'}. Best is trial 6 with value: 0.8771929824561403.
[32m[I 2023-04-26 13:00:38,642][39m Trial 115 finished with value: 0.8771929824561403 and parameters: {'algorithm': 'auto', 'n_neighbors': 12, 'weights': 'distance', 'metric': 'euclidean'}. Best is trial 6 with value: 0.8771929824561403.
[32m[I 2023-04-26 13:00:38,656][39m Trial 116 finished with value: 0.8596491228070176 and parameters: {'algorithm': 'ball_tree', 'n_neighbors': 11, 'weights': 'distance', 'metric': 'euclidean'}. Best is trial 6 with value: 0.8771929824561403.
[32m[I 2023-04-26 13:00:38,682][39m Trial 117 finished with value: 0.8468468468468469 and parameters: {'algorithm': 'auto', 'n_neighbors': 14, 'weights': 'distance', 'metric': 'euclidean'}. Best is trial 6 with value: 0.8771929824561403.
[32m[I 2023-04-26 13:00:38,696][39m Trial 118 finished with value: 0.8596491228070176 and parameters: {'algorithm': 'ball_tree', 'n_neighbors': 11, 'weights': 'distance', 'metric': 'euclidean'}. Best is trial 6 with value: 0.8771929824561403.
[32m[I 2023-04-26 13:00:38,722][39m Trial 119 finished with value: 0.8672566371681416 and parameters: {'algorithm': 'auto', 'n_neighbors': 13, 'weights': 'distance', 'metric': 'minkowski'}. Best is trial 6 with value: 0.8771929824561403.
[32m[I 2023-04-26 13:00:38,748][39m Trial 120 finished with value: 0.8571428571428572 and parameters: {'algorithm': 'auto', 'n_neighbors': 15, 'weights': 'distance', 'metric': 'euclidean'}. Best is trial 6 with value: 0.8771929824561403.
[32m[I 2023-04-26 13:00:38,762][39m Trial 121 finished with value: 0.8771929824561403 and parameters: {'algorithm': 'ball_tree', 'n_neighbors': 12, 'weights': 'distance', 'metric': 'euclidean'}. Best is trial 6 with value: 0.8771929824561403.
[32m[I 2023-04-26 13:00:38,776][39m Trial 122 finished with value: 0.8771929824561403 and parameters: {'algorithm': 'ball_tree', 'n_neighbors': 12, 'weights': 'distance', 'metric': 'euclidean'}. Best is trial 6 with value: 0.8771929824561403.
[32m[I 2023-04-26 13:00:38,802][39m Trial 123 finished with value: 0.8672566371681416 and parameters: {'algorithm': 'auto', 'n_neighbors': 13, 'weights': 'distance', 'metric': 'euclidean'}. Best is trial 6 with value: 0.8771929824561403.
[32m[I 2023-04-26 13:00:38,817][39m Trial 124 finished with value: 0.8771929824561403 and parameters: {'algorithm': 'ball_tree', 'n_neighbors': 12, 'weights': 'distance', 'metric': 'euclidean'}. Best is trial 6 with value: 0.8771929824561403.
[32m[I 2023-04-26 13:00:38,844][39m Trial 125 finished with value: 0.8596491228070176 and parameters: {'algorithm': 'auto', 'n_neighbors': 10, 'weights': 'distance', 'metric': 'euclidean'}. Best is trial 6 with value: 0.8771929824561403.
[32m[I 2023-04-26 13:00:38,869][39m Trial 126 finished with value: 0.8596491228070176 and parameters: {'algorithm': 'auto', 'n_neighbors': 11, 'weights': 'distance', 'metric': 'euclidean'}. Best is trial 6 with value: 0.8771929824561403.
[32m[I 2023-04-26 13:00:38,884][39m Trial 127 finished with value: 0.8771929824561403 and parameters: {'algorithm': 'ball_tree', 'n_neighbors': 12, 'weights': 'distance', 'metric': 'euclidean'}. Best is trial 6 with value: 0.8771929824561403.
[32m[I 2023-04-26 13:00:38,897][39m Trial 128 finished with value: 0.8468468468468469 and parameters: {'algorithm': 'ball_tree', 'n_neighbors': 14, 'weights': 'distance', 'metric': 'euclidean'}. Best is trial 6 with value: 0.8771929824561403.
[32m[I 2023-04-26 13:00:38,923][39m Trial 129 finished with value: 0.8596491228070176 and parameters: {'algorithm': 'auto', 'n_neighbors': 9, 'weights': 'distance', 'metric': 'euclidean'}. Best is trial 6 with value: 0.8771929824561403.
[32m[I 2023-04-26 13:00:38,946][39m Trial 130 finished with value: 0.8421052631578947 and parameters: {'algorithm': 'auto', 'n_neighbors': 11, 'weights': 'uniform', 'metric': 'manhattan'}. Best is trial 6 with value: 0.8771929824561403.
[32m[I 2023-04-26 13:00:38,974][39m Trial 131 finished with value: 0.8672566371681416 and parameters: {'algorithm': 'auto', 'n_neighbors': 13, 'weights': 'distance', 'metric': 'euclidean'}. Best is trial 6 with value: 0.8771929824561403.
[32m[I 2023-04-26 13:00:39,001][39m Trial 132 finished with value: 0.8771929824561403 and parameters: {'algorithm': 'auto', 'n_neighbors': 12, 'weights': 'distance', 'metric': 'euclidean'}. Best is trial 6 with value: 0.8771929824561403.
[32m[I 2023-04-26 13:00:39,027][39m Trial 133 finished with value: 0.8771929824561403 and parameters: {'algorithm': 'auto', 'n_neighbors': 12, 'weights': 'distance', 'metric': 'euclidean'}. Best is trial 6 with value: 0.8771929824561403.
[32m[I 2023-04-26 13:00:39,053][39m Trial 134 finished with value: 0.8596491228070176 and parameters: {'algorithm': 'auto', 'n_neighbors': 11, 'weights': 'distance', 'metric': 'euclidean'}. Best is trial 6 with value: 0.8771929824561403.
[32m[I 2023-04-26 13:00:39,080][39m Trial 135 finished with value: 0.8596491228070176 and parameters: {'algorithm': 'auto', 'n_neighbors': 10, 'weights': 'distance', 'metric': 'euclidean'}. Best is trial 6 with value: 0.8771929824561403.
[32m[I 2023-04-26 13:00:39,096][39m Trial 136 finished with value: 0.8672566371681416 and parameters: {'algorithm': 'ball_tree', 'n_neighbors': 13, 'weights': 'distance', 'metric': 'euclidean'}. Best is trial 6 with value: 0.8771929824561403.
[32m[I 2023-04-26 13:00:39,110][39m Trial 137 finished with value: 0.8771929824561403 and parameters: {'algorithm': 'ball_tree', 'n_neighbors': 12, 'weights': 'distance', 'metric': 'euclidean'}. Best is trial 6 with value: 0.8771929824561403.
[32m[I 2023-04-26 13:00:39,124][39m Trial 138 finished with value: 0.8468468468468469 and parameters: {'algorithm': 'kd_tree', 'n_neighbors': 14, 'weights': 'distance', 'metric': 'euclidean'}. Best is trial 6 with value: 0.8771929824561403.
[32m[I 2023-04-26 13:00:39,150][39m Trial 139 finished with value: 0.8596491228070176 and parameters: {'algorithm': 'auto', 'n_neighbors': 11, 'weights': 'distance', 'metric': 'euclidean'}. Best is trial 6 with value: 0.8771929824561403.
[32m[I 2023-04-26 13:00:39,165][39m Trial 140 finished with value: 0.8771929824561403 and parameters: {'algorithm': 'ball_tree', 'n_neighbors': 12, 'weights': 'distance', 'metric': 'euclidean'}. Best is trial 6 with value: 0.8771929824561403.
[32m[I 2023-04-26 13:00:39,179][39m Trial 141 finished with value: 0.8672566371681416 and parameters: {'algorithm': 'ball_tree', 'n_neighbors': 13, 'weights': 'distance', 'metric': 'euclidean'}. Best is trial 6 with value: 0.8771929824561403.
[32m[I 2023-04-26 13:00:39,206][39m Trial 142 finished with value: 0.8771929824561403 and parameters: {'algorithm': 'brute', 'n_neighbors': 12, 'weights': 'distance', 'metric': 'euclidean'}. Best is trial 6 with value: 0.8771929824561403.
[32m[I 2023-04-26 13:00:39,234][39m Trial 143 finished with value: 0.8596491228070176 and parameters: {'algorithm': 'auto', 'n_neighbors': 10, 'weights': 'distance', 'metric': 'euclidean'}. Best is trial 6 with value: 0.8771929824561403.
[32m[I 2023-04-26 13:00:39,260][39m Trial 144 finished with value: 0.8771929824561403 and parameters: {'algorithm': 'brute', 'n_neighbors': 12, 'weights': 'distance', 'metric': 'euclidean'}. Best is trial 6 with value: 0.8771929824561403.
[32m[I 2023-04-26 13:00:39,288][39m Trial 145 finished with value: 0.8672566371681416 and parameters: {'algorithm': 'brute', 'n_neighbors': 13, 'weights': 'distance', 'metric': 'euclidean'}. Best is trial 6 with value: 0.8771929824561403.
[32m[I 2023-04-26 13:00:39,315][39m Trial 146 finished with value: 0.8771929824561403 and parameters: {'algorithm': 'auto', 'n_neighbors': 12, 'weights': 'distance', 'metric': 'euclidean'}. Best is trial 6 with value: 0.8771929824561403.
[32m[I 2023-04-26 13:00:39,342][39m Trial 147 finished with value: 0.8596491228070176 and parameters: {'algorithm': 'auto', 'n_neighbors': 11, 'weights': 'distance', 'metric': 'minkowski'}. Best is trial 6 with value: 0.8771929824561403.
[32m[I 2023-04-26 13:00:39,357][39m Trial 148 finished with value: 0.8771929824561403 and parameters: {'algorithm': 'ball_tree', 'n_neighbors': 12, 'weights': 'distance', 'metric': 'euclidean'}. Best is trial 6 with value: 0.8771929824561403.
[32m[I 2023-04-26 13:00:39,371][39m Trial 149 finished with value: 0.8596491228070176 and parameters: {'algorithm': 'ball_tree', 'n_neighbors': 11, 'weights': 'distance', 'metric': 'euclidean'}. Best is trial 6 with value: 0.8771929824561403.
[32m[I 2023-04-26 13:00:39,386][39m Trial 150 finished with value: 0.8468468468468469 and parameters: {'algorithm': 'ball_tree', 'n_neighbors': 14, 'weights': 'distance', 'metric': 'euclidean'}. Best is trial 6 with value: 0.8771929824561403.
[32m[I 2023-04-26 13:00:39,399][39m Trial 151 finished with value: 0.8672566371681416 and parameters: {'algorithm': 'ball_tree', 'n_neighbors': 13, 'weights': 'distance', 'metric': 'euclidean'}. Best is trial 6 with value: 0.8771929824561403.
[32m[I 2023-04-26 13:00:39,427][39m Trial 152 finished with value: 0.8771929824561403 and parameters: {'algorithm': 'auto', 'n_neighbors': 12, 'weights': 'distance', 'metric': 'euclidean'}. Best is trial 6 with value: 0.8771929824561403.
[32m[I 2023-04-26 13:00:39,443][39m Trial 153 finished with value: 0.8771929824561403 and parameters: {'algorithm': 'ball_tree', 'n_neighbors': 12, 'weights': 'distance', 'metric': 'euclidean'}. Best is trial 6 with value: 0.8771929824561403.
[32m[I 2023-04-26 13:00:39,456][39m Trial 154 finished with value: 0.8672566371681416 and parameters: {'algorithm': 'ball_tree', 'n_neighbors': 13, 'weights': 'distance', 'metric': 'euclidean'}. Best is trial 6 with value: 0.8771929824561403.
[32m[I 2023-04-26 13:00:39,471][39m Trial 155 finished with value: 0.8596491228070176 and parameters: {'algorithm': 'ball_tree', 'n_neighbors': 11, 'weights': 'distance', 'metric': 'euclidean'}. Best is trial 6 with value: 0.8771929824561403.
[32m[I 2023-04-26 13:00:39,486][39m Trial 156 finished with value: 0.8468468468468469 and parameters: {'algorithm': 'ball_tree', 'n_neighbors': 14, 'weights': 'distance', 'metric': 'euclidean'}. Best is trial 6 with value: 0.8771929824561403.
[32m[I 2023-04-26 13:00:39,512][39m Trial 157 finished with value: 0.8771929824561403 and parameters: {'algorithm': 'brute', 'n_neighbors': 12, 'weights': 'distance', 'metric': 'euclidean'}. Best is trial 6 with value: 0.8771929824561403.
[32m[I 2023-04-26 13:00:39,537][39m Trial 158 finished with value: 0.8333333333333334 and parameters: {'algorithm': 'brute', 'n_neighbors': 10, 'weights': 'uniform', 'metric': 'euclidean'}. Best is trial 6 with value: 0.8771929824561403.
[32m[I 2023-04-26 13:00:39,563][39m Trial 159 finished with value: 0.8672566371681416 and parameters: {'algorithm': 'auto', 'n_neighbors': 13, 'weights': 'distance', 'metric': 'euclidean'}. Best is trial 6 with value: 0.8771929824561403.
[32m[I 2023-04-26 13:00:39,592][39m Trial 160 finished with value: 0.8495575221238938 and parameters: {'algorithm': 'brute', 'n_neighbors': 12, 'weights': 'distance', 'metric': 'manhattan'}. Best is trial 6 with value: 0.8771929824561403.
[32m[I 2023-04-26 13:00:39,606][39m Trial 161 finished with value: 0.8596491228070176 and parameters: {'algorithm': 'ball_tree', 'n_neighbors': 11, 'weights': 'distance', 'metric': 'euclidean'}. Best is trial 6 with value: 0.8771929824561403.
[32m[I 2023-04-26 13:00:39,621][39m Trial 162 finished with value: 0.8596491228070176 and parameters: {'algorithm': 'ball_tree', 'n_neighbors': 10, 'weights': 'distance', 'metric': 'euclidean'}. Best is trial 6 with value: 0.8771929824561403.
[32m[I 2023-04-26 13:00:39,648][39m Trial 163 finished with value: 0.8771929824561403 and parameters: {'algorithm': 'auto', 'n_neighbors': 12, 'weights': 'distance', 'metric': 'euclidean'}. Best is trial 6 with value: 0.8771929824561403.
[32m[I 2023-04-26 13:00:39,675][39m Trial 164 finished with value: 0.8672566371681416 and parameters: {'algorithm': 'auto', 'n_neighbors': 13, 'weights': 'distance', 'metric': 'euclidean'}. Best is trial 6 with value: 0.8771929824561403.
[32m[I 2023-04-26 13:00:39,702][39m Trial 165 finished with value: 0.8771929824561403 and parameters: {'algorithm': 'brute', 'n_neighbors': 12, 'weights': 'distance', 'metric': 'euclidean'}. Best is trial 6 with value: 0.8771929824561403.
[32m[I 2023-04-26 13:00:39,730][39m Trial 166 finished with value: 0.8596491228070176 and parameters: {'algorithm': 'brute', 'n_neighbors': 11, 'weights': 'distance', 'metric': 'euclidean'}. Best is trial 6 with value: 0.8771929824561403.
[32m[I 2023-04-26 13:00:39,746][39m Trial 167 finished with value: 0.8596491228070176 and parameters: {'algorithm': 'ball_tree', 'n_neighbors': 11, 'weights': 'distance', 'metric': 'euclidean'}. Best is trial 6 with value: 0.8771929824561403.
[32m[I 2023-04-26 13:00:39,760][39m Trial 168 finished with value: 0.8672566371681416 and parameters: {'algorithm': 'ball_tree', 'n_neighbors': 13, 'weights': 'distance', 'metric': 'euclidean'}. Best is trial 6 with value: 0.8771929824561403.
[32m[I 2023-04-26 13:00:39,792][39m Trial 169 finished with value: 0.8596491228070176 and parameters: {'algorithm': 'auto', 'n_neighbors': 9, 'weights': 'distance', 'metric': 'euclidean'}. Best is trial 6 with value: 0.8771929824561403.
[32m[I 2023-04-26 13:00:39,808][39m Trial 170 finished with value: 0.8771929824561403 and parameters: {'algorithm': 'ball_tree', 'n_neighbors': 12, 'weights': 'distance', 'metric': 'euclidean'}. Best is trial 6 with value: 0.8771929824561403.
[32m[I 2023-04-26 13:00:39,823][39m Trial 171 finished with value: 0.8771929824561403 and parameters: {'algorithm': 'ball_tree', 'n_neighbors': 12, 'weights': 'distance', 'metric': 'euclidean'}. Best is trial 6 with value: 0.8771929824561403.
[32m[I 2023-04-26 13:00:39,839][39m Trial 172 finished with value: 0.8771929824561403 and parameters: {'algorithm': 'ball_tree', 'n_neighbors': 12, 'weights': 'distance', 'metric': 'euclidean'}. Best is trial 6 with value: 0.8771929824561403.
[32m[I 2023-04-26 13:00:39,853][39m Trial 173 finished with value: 0.8596491228070176 and parameters: {'algorithm': 'ball_tree', 'n_neighbors': 11, 'weights': 'distance', 'metric': 'euclidean'}. Best is trial 6 with value: 0.8771929824561403.
[32m[I 2023-04-26 13:00:39,868][39m Trial 174 finished with value: 0.8672566371681416 and parameters: {'algorithm': 'ball_tree', 'n_neighbors': 13, 'weights': 'distance', 'metric': 'euclidean'}. Best is trial 6 with value: 0.8771929824561403.
[32m[I 2023-04-26 13:00:39,896][39m Trial 175 finished with value: 0.8771929824561403 and parameters: {'algorithm': 'brute', 'n_neighbors': 12, 'weights': 'distance', 'metric': 'euclidean'}. Best is trial 6 with value: 0.8771929824561403.
[32m[I 2023-04-26 13:00:39,925][39m Trial 176 finished with value: 0.8771929824561403 and parameters: {'algorithm': 'brute', 'n_neighbors': 12, 'weights': 'distance', 'metric': 'euclidean'}. Best is trial 6 with value: 0.8771929824561403.
[32m[I 2023-04-26 13:00:39,940][39m Trial 177 finished with value: 0.8468468468468469 and parameters: {'algorithm': 'ball_tree', 'n_neighbors': 14, 'weights': 'distance', 'metric': 'euclidean'}. Best is trial 6 with value: 0.8771929824561403.
[32m[I 2023-04-26 13:00:39,955][39m Trial 178 finished with value: 0.8771929824561403 and parameters: {'algorithm': 'ball_tree', 'n_neighbors': 12, 'weights': 'distance', 'metric': 'euclidean'}. Best is trial 6 with value: 0.8771929824561403.
[32m[I 2023-04-26 13:00:39,970][39m Trial 179 finished with value: 0.8672566371681416 and parameters: {'algorithm': 'ball_tree', 'n_neighbors': 13, 'weights': 'distance', 'metric': 'minkowski'}. Best is trial 6 with value: 0.8771929824561403.
