[32m[I 2023-04-26 02:18:11,982][39m A new study created in memory with name: no-name-27d2adff-70c9-466f-b913-b834e2f2363d
[32m[I 2023-04-26 02:18:12,055][39m Trial 0 finished with value: 0.8292682926829268 and parameters: {'criterion': 'gini', 'n_estimators': 64, 'max_features': 0.9614889666885761, 'max_depth': 42, 'min_samples_split': 6, 'min_samples_leaf': 1}. Best is trial 0 with value: 0.8292682926829268.
[32m[I 2023-04-26 02:18:12,123][39m Trial 1 finished with value: 0.7906976744186047 and parameters: {'criterion': 'gini', 'n_estimators': 93, 'max_features': 0.23273499882913118, 'max_depth': 51, 'min_samples_split': 9, 'min_samples_leaf': 4}. Best is trial 0 with value: 0.8292682926829268.
[32m[I 2023-04-26 02:18:12,186][39m Trial 2 finished with value: 0.7906976744186047 and parameters: {'criterion': 'gini', 'n_estimators': 82, 'max_features': 0.3684311537203563, 'max_depth': 36, 'min_samples_split': 6, 'min_samples_leaf': 6}. Best is trial 0 with value: 0.8292682926829268.
[32m[I 2023-04-26 02:18:12,248][39m Trial 3 finished with value: 0.8275862068965518 and parameters: {'criterion': 'gini', 'n_estimators': 71, 'max_features': 0.946786105933412, 'max_depth': 36, 'min_samples_split': 11, 'min_samples_leaf': 7}. Best is trial 0 with value: 0.8292682926829268.
[32m[I 2023-04-26 02:18:12,346][39m Trial 4 finished with value: 0.8 and parameters: {'criterion': 'entropy', 'n_estimators': 150, 'max_features': 0.13070837831052584, 'max_depth': 4, 'min_samples_split': 3, 'min_samples_leaf': 6}. Best is trial 0 with value: 0.8292682926829268.
[32m[I 2023-04-26 02:18:12,403][39m Trial 5 finished with value: 0.7654320987654322 and parameters: {'criterion': 'gini', 'n_estimators': 78, 'max_features': 0.06632853584505294, 'max_depth': 57, 'min_samples_split': 10, 'min_samples_leaf': 2}. Best is trial 0 with value: 0.8292682926829268.
[32m[I 2023-04-26 02:18:12,476][39m Trial 6 finished with value: 0.8505747126436782 and parameters: {'criterion': 'gini', 'n_estimators': 86, 'max_features': 0.789926935812686, 'max_depth': 35, 'min_samples_split': 8, 'min_samples_leaf': 2}. Best is trial 6 with value: 0.8505747126436782.
[32m[I 2023-04-26 02:18:12,566][39m Trial 7 finished with value: 0.7951807228915663 and parameters: {'criterion': 'entropy', 'n_estimators': 120, 'max_features': 0.26134334428582007, 'max_depth': 35, 'min_samples_split': 5, 'min_samples_leaf': 2}. Best is trial 6 with value: 0.8505747126436782.
[32m[I 2023-04-26 02:18:12,651][39m Trial 8 finished with value: 0.7804878048780488 and parameters: {'criterion': 'gini', 'n_estimators': 126, 'max_features': 0.035506882262305584, 'max_depth': 20, 'min_samples_split': 8, 'min_samples_leaf': 2}. Best is trial 6 with value: 0.8505747126436782.
[32m[I 2023-04-26 02:18:12,724][39m Trial 9 finished with value: 0.7692307692307692 and parameters: {'criterion': 'entropy', 'n_estimators': 105, 'max_features': 0.28405618663332033, 'max_depth': 33, 'min_samples_split': 3, 'min_samples_leaf': 10}. Best is trial 6 with value: 0.8505747126436782.
[32m[I 2023-04-26 02:18:12,875][39m Trial 10 finished with value: 0.7640449438202247 and parameters: {'criterion': 'gini', 'n_estimators': 190, 'max_features': 0.6653670049755667, 'max_depth': 86, 'min_samples_split': 8, 'min_samples_leaf': 10}. Best is trial 6 with value: 0.8505747126436782.
[32m[I 2023-04-26 02:18:12,934][39m Trial 11 finished with value: 0.810126582278481 and parameters: {'criterion': 'gini', 'n_estimators': 56, 'max_features': 0.9425855296543154, 'max_depth': 67, 'min_samples_split': 5, 'min_samples_leaf': 1}. Best is trial 6 with value: 0.8505747126436782.
[32m[I 2023-04-26 02:18:12,985][39m Trial 12 finished with value: 0.8045977011494252 and parameters: {'criterion': 'gini', 'n_estimators': 50, 'max_features': 0.7320021598823929, 'max_depth': 12, 'min_samples_split': 7, 'min_samples_leaf': 4}. Best is trial 6 with value: 0.8505747126436782.
[32m[I 2023-04-26 02:18:13,111][39m Trial 13 finished with value: 0.8764044943820225 and parameters: {'criterion': 'gini', 'n_estimators': 149, 'max_features': 0.7039235900572407, 'max_depth': 76, 'min_samples_split': 6, 'min_samples_leaf': 4}. Best is trial 13 with value: 0.8764044943820225.
[32m[I 2023-04-26 02:18:13,246][39m Trial 14 finished with value: 0.8275862068965518 and parameters: {'criterion': 'gini', 'n_estimators': 160, 'max_features': 0.673827584150936, 'max_depth': 98, 'min_samples_split': 4, 'min_samples_leaf': 4}. Best is trial 13 with value: 0.8764044943820225.
[32m[I 2023-04-26 02:18:13,366][39m Trial 15 finished with value: 0.7608695652173912 and parameters: {'criterion': 'entropy', 'n_estimators': 146, 'max_features': 0.56065988660593, 'max_depth': 75, 'min_samples_split': 8, 'min_samples_leaf': 8}. Best is trial 13 with value: 0.8764044943820225.
[32m[I 2023-04-26 02:18:13,522][39m Trial 16 finished with value: 0.8139534883720929 and parameters: {'criterion': 'gini', 'n_estimators': 183, 'max_features': 0.8081412911100461, 'max_depth': 77, 'min_samples_split': 2, 'min_samples_leaf': 4}. Best is trial 13 with value: 0.8764044943820225.
[32m[I 2023-04-26 02:18:13,623][39m Trial 17 finished with value: 0.8139534883720929 and parameters: {'criterion': 'gini', 'n_estimators': 123, 'max_features': 0.482788431837612, 'max_depth': 55, 'min_samples_split': 9, 'min_samples_leaf': 3}. Best is trial 13 with value: 0.8764044943820225.
[32m[I 2023-04-26 02:18:13,784][39m Trial 18 finished with value: 0.8181818181818182 and parameters: {'criterion': 'entropy', 'n_estimators': 171, 'max_features': 0.8098968037651024, 'max_depth': 21, 'min_samples_split': 7, 'min_samples_leaf': 5}. Best is trial 13 with value: 0.8764044943820225.
[32m[I 2023-04-26 02:18:13,874][39m Trial 19 finished with value: 0.8444444444444446 and parameters: {'criterion': 'gini', 'n_estimators': 104, 'max_features': 0.5138884913962942, 'max_depth': 94, 'min_samples_split': 5, 'min_samples_leaf': 3}. Best is trial 13 with value: 0.8764044943820225.
[32m[I 2023-04-26 02:18:13,997][39m Trial 20 finished with value: 0.7906976744186047 and parameters: {'criterion': 'gini', 'n_estimators': 142, 'max_features': 0.8436408473398109, 'max_depth': 68, 'min_samples_split': 11, 'min_samples_leaf': 7}. Best is trial 13 with value: 0.8764044943820225.
[32m[I 2023-04-26 02:18:14,084][39m Trial 21 finished with value: 0.8372093023255814 and parameters: {'criterion': 'gini', 'n_estimators': 103, 'max_features': 0.5412141438160532, 'max_depth': 97, 'min_samples_split': 5, 'min_samples_leaf': 3}. Best is trial 13 with value: 0.8764044943820225.
[32m[I 2023-04-26 02:18:14,169][39m Trial 22 finished with value: 0.8409090909090909 and parameters: {'criterion': 'gini', 'n_estimators': 106, 'max_features': 0.45610766400498787, 'max_depth': 87, 'min_samples_split': 6, 'min_samples_leaf': 3}. Best is trial 13 with value: 0.8764044943820225.
[32m[I 2023-04-26 02:18:14,246][39m Trial 23 finished with value: 0.7906976744186047 and parameters: {'criterion': 'gini', 'n_estimators': 89, 'max_features': 0.6243833860557746, 'max_depth': 91, 'min_samples_split': 4, 'min_samples_leaf': 5}. Best is trial 13 with value: 0.8764044943820225.
[32m[I 2023-04-26 02:18:14,349][39m Trial 24 finished with value: 0.8235294117647058 and parameters: {'criterion': 'gini', 'n_estimators': 116, 'max_features': 0.7622352580542667, 'max_depth': 80, 'min_samples_split': 7, 'min_samples_leaf': 1}. Best is trial 13 with value: 0.8764044943820225.
[32m[I 2023-04-26 02:18:14,426][39m Trial 25 finished with value: 0.8 and parameters: {'criterion': 'gini', 'n_estimators': 96, 'max_features': 0.39561750819977165, 'max_depth': 64, 'min_samples_split': 4, 'min_samples_leaf': 5}. Best is trial 13 with value: 0.8764044943820225.
[32m[I 2023-04-26 02:18:14,546][39m Trial 26 finished with value: 0.8571428571428571 and parameters: {'criterion': 'entropy', 'n_estimators': 137, 'max_features': 0.6014052209016107, 'max_depth': 101, 'min_samples_split': 9, 'min_samples_leaf': 3}. Best is trial 13 with value: 0.8764044943820225.
[32m[I 2023-04-26 02:18:14,678][39m Trial 27 finished with value: 0.8863636363636364 and parameters: {'criterion': 'entropy', 'n_estimators': 135, 'max_features': 0.8689820896242048, 'max_depth': 100, 'min_samples_split': 9, 'min_samples_leaf': 2}. Best is trial 27 with value: 0.8863636363636364.
[32m[I 2023-04-26 02:18:14,809][39m Trial 28 finished with value: 0.8571428571428571 and parameters: {'criterion': 'entropy', 'n_estimators': 134, 'max_features': 0.8914224041266333, 'max_depth': 101, 'min_samples_split': 10, 'min_samples_leaf': 3}. Best is trial 27 with value: 0.8863636363636364.
[32m[I 2023-04-26 02:18:14,965][39m Trial 29 finished with value: 0.8505747126436782 and parameters: {'criterion': 'entropy', 'n_estimators': 161, 'max_features': 0.8841729288913975, 'max_depth': 82, 'min_samples_split': 10, 'min_samples_leaf': 1}. Best is trial 27 with value: 0.8863636363636364.
[32m[I 2023-04-26 02:18:15,079][39m Trial 30 finished with value: 0.7608695652173912 and parameters: {'criterion': 'entropy', 'n_estimators': 134, 'max_features': 0.6076083968858156, 'max_depth': 91, 'min_samples_split': 9, 'min_samples_leaf': 11}. Best is trial 27 with value: 0.8863636363636364.
[32m[I 2023-04-26 02:18:15,213][39m Trial 31 finished with value: 0.8444444444444446 and parameters: {'criterion': 'entropy', 'n_estimators': 135, 'max_features': 0.9795521582379254, 'max_depth': 101, 'min_samples_split': 10, 'min_samples_leaf': 3}. Best is trial 27 with value: 0.8863636363636364.
[32m[I 2023-04-26 02:18:15,364][39m Trial 32 finished with value: 0.8505747126436782 and parameters: {'criterion': 'entropy', 'n_estimators': 157, 'max_features': 0.8998899541350256, 'max_depth': 99, 'min_samples_split': 9, 'min_samples_leaf': 2}. Best is trial 27 with value: 0.8863636363636364.
[32m[I 2023-04-26 02:18:15,517][39m Trial 33 finished with value: 0.8444444444444446 and parameters: {'criterion': 'entropy', 'n_estimators': 174, 'max_features': 0.7138483740064465, 'max_depth': 87, 'min_samples_split': 10, 'min_samples_leaf': 4}. Best is trial 27 with value: 0.8863636363636364.
[32m[I 2023-04-26 02:18:15,648][39m Trial 34 finished with value: 0.8089887640449439 and parameters: {'criterion': 'entropy', 'n_estimators': 134, 'max_features': 0.9979493248905462, 'max_depth': 74, 'min_samples_split': 11, 'min_samples_leaf': 5}. Best is trial 27 with value: 0.8863636363636364.
[32m[I 2023-04-26 02:18:15,788][39m Trial 35 finished with value: 0.8275862068965518 and parameters: {'criterion': 'entropy', 'n_estimators': 141, 'max_features': 0.8806166013516105, 'max_depth': 101, 'min_samples_split': 6, 'min_samples_leaf': 3}. Best is trial 27 with value: 0.8863636363636364.
[32m[I 2023-04-26 02:18:15,926][39m Trial 36 finished with value: 0.8235294117647058 and parameters: {'criterion': 'entropy', 'n_estimators': 153, 'max_features': 0.701528657238953, 'max_depth': 93, 'min_samples_split': 9, 'min_samples_leaf': 2}. Best is trial 27 with value: 0.8863636363636364.
[32m[I 2023-04-26 02:18:16,029][39m Trial 37 finished with value: 0.8181818181818182 and parameters: {'criterion': 'entropy', 'n_estimators': 115, 'max_features': 0.6079734152104774, 'max_depth': 46, 'min_samples_split': 11, 'min_samples_leaf': 6}. Best is trial 27 with value: 0.8863636363636364.
[32m[I 2023-04-26 02:18:16,187][39m Trial 38 finished with value: 0.8260869565217392 and parameters: {'criterion': 'entropy', 'n_estimators': 168, 'max_features': 0.9216241835739105, 'max_depth': 83, 'min_samples_split': 10, 'min_samples_leaf': 4}. Best is trial 27 with value: 0.8863636363636364.
[32m[I 2023-04-26 02:18:16,314][39m Trial 39 finished with value: 0.8571428571428572 and parameters: {'criterion': 'entropy', 'n_estimators': 128, 'max_features': 0.8362479351412616, 'max_depth': 72, 'min_samples_split': 8, 'min_samples_leaf': 1}. Best is trial 27 with value: 0.8863636363636364.
[32m[I 2023-04-26 02:18:16,443][39m Trial 40 finished with value: 0.8470588235294119 and parameters: {'criterion': 'entropy', 'n_estimators': 129, 'max_features': 0.8599026609262159, 'max_depth': 71, 'min_samples_split': 7, 'min_samples_leaf': 1}. Best is trial 27 with value: 0.8863636363636364.
[32m[I 2023-04-26 02:18:16,580][39m Trial 41 finished with value: 0.8636363636363636 and parameters: {'criterion': 'entropy', 'n_estimators': 146, 'max_features': 0.7579366681936972, 'max_depth': 57, 'min_samples_split': 9, 'min_samples_leaf': 2}. Best is trial 27 with value: 0.8863636363636364.
[32m[I 2023-04-26 02:18:16,722][39m Trial 42 finished with value: 0.8604651162790697 and parameters: {'criterion': 'entropy', 'n_estimators': 149, 'max_features': 0.7745209235265903, 'max_depth': 58, 'min_samples_split': 8, 'min_samples_leaf': 2}. Best is trial 27 with value: 0.8863636363636364.
[32m[I 2023-04-26 02:18:16,863][39m Trial 43 finished with value: 0.8470588235294119 and parameters: {'criterion': 'entropy', 'n_estimators': 149, 'max_features': 0.7865226228028306, 'max_depth': 61, 'min_samples_split': 8, 'min_samples_leaf': 2}. Best is trial 27 with value: 0.8863636363636364.
[32m[I 2023-04-26 02:18:16,999][39m Trial 44 finished with value: 0.8333333333333333 and parameters: {'criterion': 'entropy', 'n_estimators': 145, 'max_features': 0.7530931722304196, 'max_depth': 55, 'min_samples_split': 8, 'min_samples_leaf': 1}. Best is trial 27 with value: 0.8863636363636364.
[32m[I 2023-04-26 02:18:17,159][39m Trial 45 finished with value: 0.8333333333333333 and parameters: {'criterion': 'entropy', 'n_estimators': 165, 'max_features': 0.8322980331545551, 'max_depth': 42, 'min_samples_split': 8, 'min_samples_leaf': 1}. Best is trial 27 with value: 0.8863636363636364.
[32m[I 2023-04-26 02:18:17,300][39m Trial 46 finished with value: 0.8735632183908046 and parameters: {'criterion': 'entropy', 'n_estimators': 154, 'max_features': 0.6628076053013027, 'max_depth': 61, 'min_samples_split': 7, 'min_samples_leaf': 2}. Best is trial 27 with value: 0.8863636363636364.
[32m[I 2023-04-26 02:18:17,462][39m Trial 47 finished with value: 0.8433734939759037 and parameters: {'criterion': 'entropy', 'n_estimators': 178, 'max_features': 0.6589647371528974, 'max_depth': 50, 'min_samples_split': 7, 'min_samples_leaf': 2}. Best is trial 27 with value: 0.8863636363636364.
[32m[I 2023-04-26 02:18:17,610][39m Trial 48 finished with value: 0.8636363636363636 and parameters: {'criterion': 'entropy', 'n_estimators': 155, 'max_features': 0.7338882700131342, 'max_depth': 62, 'min_samples_split': 7, 'min_samples_leaf': 2}. Best is trial 27 with value: 0.8863636363636364.
[32m[I 2023-04-26 02:18:17,753][39m Trial 49 finished with value: 0.8735632183908046 and parameters: {'criterion': 'entropy', 'n_estimators': 156, 'max_features': 0.6485599854767264, 'max_depth': 63, 'min_samples_split': 6, 'min_samples_leaf': 2}. Best is trial 27 with value: 0.8863636363636364.
[32m[I 2023-04-26 02:18:17,925][39m Trial 50 finished with value: 0.8444444444444446 and parameters: {'criterion': 'entropy', 'n_estimators': 193, 'max_features': 0.6827206651314426, 'max_depth': 64, 'min_samples_split': 6, 'min_samples_leaf': 4}. Best is trial 27 with value: 0.8863636363636364.
[32m[I 2023-04-26 02:18:18,069][39m Trial 51 finished with value: 0.8470588235294119 and parameters: {'criterion': 'entropy', 'n_estimators': 154, 'max_features': 0.7275162182477833, 'max_depth': 60, 'min_samples_split': 6, 'min_samples_leaf': 2}. Best is trial 27 with value: 0.8863636363636364.
[32m[I 2023-04-26 02:18:18,217][39m Trial 52 finished with value: 0.8735632183908046 and parameters: {'criterion': 'entropy', 'n_estimators': 163, 'max_features': 0.6425158298842477, 'max_depth': 51, 'min_samples_split': 5, 'min_samples_leaf': 2}. Best is trial 27 with value: 0.8863636363636364.
[32m[I 2023-04-26 02:18:18,378][39m Trial 53 finished with value: 0.8292682926829268 and parameters: {'criterion': 'entropy', 'n_estimators': 186, 'max_features': 0.5565791474676255, 'max_depth': 50, 'min_samples_split': 5, 'min_samples_leaf': 1}. Best is trial 27 with value: 0.8863636363636364.
[32m[I 2023-04-26 02:18:18,523][39m Trial 54 finished with value: 0.8735632183908046 and parameters: {'criterion': 'entropy', 'n_estimators': 163, 'max_features': 0.621062345279309, 'max_depth': 42, 'min_samples_split': 5, 'min_samples_leaf': 2}. Best is trial 27 with value: 0.8863636363636364.
[32m[I 2023-04-26 02:18:18,664][39m Trial 55 finished with value: 0.7954545454545454 and parameters: {'criterion': 'entropy', 'n_estimators': 161, 'max_features': 0.6447978446935378, 'max_depth': 28, 'min_samples_split': 5, 'min_samples_leaf': 7}. Best is trial 27 with value: 0.8863636363636364.
[32m[I 2023-04-26 02:18:18,834][39m Trial 56 finished with value: 0.8505747126436782 and parameters: {'criterion': 'entropy', 'n_estimators': 201, 'max_features': 0.5667141176503201, 'max_depth': 37, 'min_samples_split': 4, 'min_samples_leaf': 3}. Best is trial 27 with value: 0.8863636363636364.
[32m[I 2023-04-26 02:18:18,954][39m Trial 57 finished with value: 0.7710843373493976 and parameters: {'criterion': 'entropy', 'n_estimators': 176, 'max_features': 0.130442059169168, 'max_depth': 44, 'min_samples_split': 6, 'min_samples_leaf': 8}. Best is trial 27 with value: 0.8863636363636364.
[32m[I 2023-04-26 02:18:19,088][39m Trial 58 finished with value: 0.8235294117647058 and parameters: {'criterion': 'gini', 'n_estimators': 171, 'max_features': 0.4505369206435868, 'max_depth': 68, 'min_samples_split': 3, 'min_samples_leaf': 3}. Best is trial 27 with value: 0.8863636363636364.
[32m[I 2023-04-26 02:18:19,228][39m Trial 59 finished with value: 0.8181818181818182 and parameters: {'criterion': 'entropy', 'n_estimators': 165, 'max_features': 0.5138158940629225, 'max_depth': 41, 'min_samples_split': 5, 'min_samples_leaf': 4}. Best is trial 27 with value: 0.8863636363636364.
[32m[I 2023-04-26 02:18:19,361][39m Trial 60 finished with value: 0.8735632183908046 and parameters: {'criterion': 'gini', 'n_estimators': 162, 'max_features': 0.6376402615832891, 'max_depth': 30, 'min_samples_split': 5, 'min_samples_leaf': 2}. Best is trial 27 with value: 0.8863636363636364.
[32m[I 2023-04-26 02:18:19,481][39m Trial 61 finished with value: 0.8235294117647058 and parameters: {'criterion': 'gini', 'n_estimators': 141, 'max_features': 0.6324604989269935, 'max_depth': 29, 'min_samples_split': 5, 'min_samples_leaf': 2}. Best is trial 27 with value: 0.8863636363636364.
[32m[I 2023-04-26 02:18:19,618][39m Trial 62 finished with value: 0.8048780487804877 and parameters: {'criterion': 'gini', 'n_estimators': 159, 'max_features': 0.6868544514223045, 'max_depth': 20, 'min_samples_split': 6, 'min_samples_leaf': 1}. Best is trial 27 with value: 0.8863636363636364.
[32m[I 2023-04-26 02:18:19,754][39m Trial 63 finished with value: 0.8764044943820225 and parameters: {'criterion': 'gini', 'n_estimators': 164, 'max_features': 0.5818502148913273, 'max_depth': 54, 'min_samples_split': 4, 'min_samples_leaf': 3}. Best is trial 27 with value: 0.8863636363636364.
[32m[I 2023-04-26 02:18:19,903][39m Trial 64 finished with value: 0.7999999999999999 and parameters: {'criterion': 'gini', 'n_estimators': 180, 'max_features': 0.5886868192097617, 'max_depth': 52, 'min_samples_split': 4, 'min_samples_leaf': 3}. Best is trial 27 with value: 0.8863636363636364.
[32m[I 2023-04-26 02:18:20,033][39m Trial 65 finished with value: 0.8372093023255814 and parameters: {'criterion': 'gini', 'n_estimators': 166, 'max_features': 0.4743025585390619, 'max_depth': 39, 'min_samples_split': 4, 'min_samples_leaf': 3}. Best is trial 27 with value: 0.8863636363636364.
[32m[I 2023-04-26 02:18:20,168][39m Trial 66 finished with value: 0.7901234567901235 and parameters: {'criterion': 'gini', 'n_estimators': 171, 'max_features': 0.41437922145391115, 'max_depth': 47, 'min_samples_split': 3, 'min_samples_leaf': 2}. Best is trial 27 with value: 0.8863636363636364.
[32m[I 2023-04-26 02:18:20,292][39m Trial 67 finished with value: 0.8372093023255814 and parameters: {'criterion': 'gini', 'n_estimators': 152, 'max_features': 0.538716402967697, 'max_depth': 33, 'min_samples_split': 6, 'min_samples_leaf': 4}. Best is trial 27 with value: 0.8863636363636364.
[32m[I 2023-04-26 02:18:20,424][39m Trial 68 finished with value: 0.8275862068965518 and parameters: {'criterion': 'gini', 'n_estimators': 161, 'max_features': 0.5882559030609742, 'max_depth': 54, 'min_samples_split': 3, 'min_samples_leaf': 3}. Best is trial 27 with value: 0.8863636363636364.
[32m[I 2023-04-26 02:18:20,518][39m Trial 69 finished with value: 0.7169811320754716 and parameters: {'criterion': 'gini', 'n_estimators': 140, 'max_features': 0.35802475104657827, 'max_depth': 1, 'min_samples_split': 5, 'min_samples_leaf': 2}. Best is trial 27 with value: 0.8863636363636364.
[32m[I 2023-04-26 02:18:20,652][39m Trial 70 finished with value: 0.8433734939759037 and parameters: {'criterion': 'gini', 'n_estimators': 157, 'max_features': 0.6492979124494942, 'max_depth': 10, 'min_samples_split': 4, 'min_samples_leaf': 1}. Best is trial 27 with value: 0.8863636363636364.
[32m[I 2023-04-26 02:18:20,779][39m Trial 71 finished with value: 0.8 and parameters: {'criterion': 'gini', 'n_estimators': 146, 'max_features': 0.6660572799284399, 'max_depth': 47, 'min_samples_split': 5, 'min_samples_leaf': 2}. Best is trial 27 with value: 0.8863636363636364.
[32m[I 2023-04-26 02:18:20,914][39m Trial 72 finished with value: 0.8705882352941177 and parameters: {'criterion': 'gini', 'n_estimators': 163, 'max_features': 0.6212625722746008, 'max_depth': 67, 'min_samples_split': 5, 'min_samples_leaf': 2}. Best is trial 27 with value: 0.8863636363636364.
