[32m[I 2023-04-26 02:18:21,050][39m Trial 73 finished with value: 0.8275862068965518 and parameters: {'criterion': 'entropy', 'n_estimators': 150, 'max_features': 0.7011582848449851, 'max_depth': 28, 'min_samples_split': 6, 'min_samples_leaf': 3}. Best is trial 27 with value: 0.8863636363636364.
[32m[I 2023-04-26 02:18:21,193][39m Trial 74 finished with value: 0.8604651162790697 and parameters: {'criterion': 'gini', 'n_estimators': 171, 'max_features': 0.574306117983302, 'max_depth': 77, 'min_samples_split': 7, 'min_samples_leaf': 2}. Best is trial 27 with value: 0.8863636363636364.
[32m[I 2023-04-26 02:18:21,332][39m Trial 75 finished with value: 0.8433734939759037 and parameters: {'criterion': 'entropy', 'n_estimators': 157, 'max_features': 0.5251004622882615, 'max_depth': 52, 'min_samples_split': 4, 'min_samples_leaf': 1}. Best is trial 27 with value: 0.8863636363636364.
[32m[I 2023-04-26 02:18:21,482][39m Trial 76 finished with value: 0.8409090909090909 and parameters: {'criterion': 'entropy', 'n_estimators': 169, 'max_features': 0.6285184607821229, 'max_depth': 64, 'min_samples_split': 6, 'min_samples_leaf': 3}. Best is trial 27 with value: 0.8863636363636364.
[32m[I 2023-04-26 02:18:21,558][39m Trial 77 finished with value: 0.8292682926829268 and parameters: {'criterion': 'gini', 'n_estimators': 78, 'max_features': 0.8067016209751845, 'max_depth': 58, 'min_samples_split': 5, 'min_samples_leaf': 1}. Best is trial 27 with value: 0.8863636363636364.
[32m[I 2023-04-26 02:18:21,671][39m Trial 78 finished with value: 0.8604651162790697 and parameters: {'criterion': 'entropy', 'n_estimators': 130, 'max_features': 0.48625298554774576, 'max_depth': 34, 'min_samples_split': 5, 'min_samples_leaf': 2}. Best is trial 27 with value: 0.8863636363636364.
[32m[I 2023-04-26 02:18:21,844][39m Trial 79 finished with value: 0.8571428571428571 and parameters: {'criterion': 'entropy', 'n_estimators': 184, 'max_features': 0.7369423485725727, 'max_depth': 22, 'min_samples_split': 6, 'min_samples_leaf': 4}. Best is trial 27 with value: 0.8863636363636364.
[32m[I 2023-04-26 02:18:21,963][39m Trial 80 finished with value: 0.8735632183908046 and parameters: {'criterion': 'gini', 'n_estimators': 137, 'max_features': 0.7040381321367906, 'max_depth': 24, 'min_samples_split': 2, 'min_samples_leaf': 3}. Best is trial 27 with value: 0.8863636363636364.
[32m[I 2023-04-26 02:18:22,073][39m Trial 81 finished with value: 0.8372093023255814 and parameters: {'criterion': 'gini', 'n_estimators': 124, 'max_features': 0.6703881627567214, 'max_depth': 26, 'min_samples_split': 2, 'min_samples_leaf': 3}. Best is trial 27 with value: 0.8863636363636364.
[32m[I 2023-04-26 02:18:22,180][39m Trial 82 finished with value: 0.8604651162790697 and parameters: {'criterion': 'gini', 'n_estimators': 119, 'max_features': 0.6979298101869521, 'max_depth': 15, 'min_samples_split': 2, 'min_samples_leaf': 2}. Best is trial 27 with value: 0.8863636363636364.
[32m[I 2023-04-26 02:18:22,296][39m Trial 83 finished with value: 0.8139534883720929 and parameters: {'criterion': 'gini', 'n_estimators': 138, 'max_features': 0.5917474664080276, 'max_depth': 17, 'min_samples_split': 2, 'min_samples_leaf': 3}. Best is trial 27 with value: 0.8863636363636364.
[32m[I 2023-04-26 02:18:22,432][39m Trial 84 finished with value: 0.8235294117647058 and parameters: {'criterion': 'gini', 'n_estimators': 143, 'max_features': 0.7132702848300049, 'max_depth': 45, 'min_samples_split': 4, 'min_samples_leaf': 3}. Best is trial 27 with value: 0.8863636363636364.
[32m[I 2023-04-26 02:18:22,562][39m Trial 85 finished with value: 0.8571428571428572 and parameters: {'criterion': 'gini', 'n_estimators': 150, 'max_features': 0.6462765660902002, 'max_depth': 24, 'min_samples_split': 7, 'min_samples_leaf': 2}. Best is trial 27 with value: 0.8863636363636364.
[32m[I 2023-04-26 02:18:22,680][39m Trial 86 finished with value: 0.8235294117647058 and parameters: {'criterion': 'entropy', 'n_estimators': 132, 'max_features': 0.6221659271514833, 'max_depth': 54, 'min_samples_split': 6, 'min_samples_leaf': 2}. Best is trial 27 with value: 0.8863636363636364.
[32m[I 2023-04-26 02:18:22,807][39m Trial 87 finished with value: 0.8139534883720929 and parameters: {'criterion': 'entropy', 'n_estimators': 155, 'max_features': 0.5390008488704143, 'max_depth': 71, 'min_samples_split': 3, 'min_samples_leaf': 6}. Best is trial 27 with value: 0.8863636363636364.
[32m[I 2023-04-26 02:18:22,965][39m Trial 88 finished with value: 0.8470588235294119 and parameters: {'criterion': 'gini', 'n_estimators': 174, 'max_features': 0.9549496130926172, 'max_depth': 49, 'min_samples_split': 7, 'min_samples_leaf': 3}. Best is trial 27 with value: 0.8863636363636364.
[32m[I 2023-04-26 02:18:23,116][39m Trial 89 finished with value: 0.8089887640449439 and parameters: {'criterion': 'entropy', 'n_estimators': 164, 'max_features': 0.7880985142786896, 'max_depth': 38, 'min_samples_split': 5, 'min_samples_leaf': 5}. Best is trial 27 with value: 0.8863636363636364.
[32m[I 2023-04-26 02:18:23,252][39m Trial 90 finished with value: 0.8809523809523809 and parameters: {'criterion': 'entropy', 'n_estimators': 137, 'max_features': 0.7524806464968514, 'max_depth': 30, 'min_samples_split': 3, 'min_samples_leaf': 1}. Best is trial 27 with value: 0.8863636363636364.
[32m[I 2023-04-26 02:18:23,396][39m Trial 91 finished with value: 0.8705882352941177 and parameters: {'criterion': 'entropy', 'n_estimators': 148, 'max_features': 0.7468856548542379, 'max_depth': 31, 'min_samples_split': 3, 'min_samples_leaf': 1}. Best is trial 27 with value: 0.8863636363636364.
[32m[I 2023-04-26 02:18:23,530][39m Trial 92 finished with value: 0.8433734939759037 and parameters: {'criterion': 'entropy', 'n_estimators': 143, 'max_features': 0.6786214809766553, 'max_depth': 59, 'min_samples_split': 3, 'min_samples_leaf': 1}. Best is trial 27 with value: 0.8863636363636364.
[32m[I 2023-04-26 02:18:23,661][39m Trial 93 finished with value: 0.8837209302325582 and parameters: {'criterion': 'entropy', 'n_estimators': 137, 'max_features': 0.7143816478807681, 'max_depth': 62, 'min_samples_split': 2, 'min_samples_leaf': 2}. Best is trial 27 with value: 0.8863636363636364.
[32m[I 2023-04-26 02:18:23,800][39m Trial 94 finished with value: 0.8536585365853658 and parameters: {'criterion': 'entropy', 'n_estimators': 136, 'max_features': 0.8584235828784338, 'max_depth': 89, 'min_samples_split': 2, 'min_samples_leaf': 1}. Best is trial 27 with value: 0.8863636363636364.
[32m[I 2023-04-26 02:18:23,950][39m Trial 95 finished with value: 0.8735632183908046 and parameters: {'criterion': 'entropy', 'n_estimators': 159, 'max_features': 0.7635772761281586, 'max_depth': 64, 'min_samples_split': 4, 'min_samples_leaf': 2}. Best is trial 27 with value: 0.8863636363636364.
[32m[I 2023-04-26 02:18:24,059][39m Trial 96 finished with value: 0.8837209302325582 and parameters: {'criterion': 'entropy', 'n_estimators': 110, 'max_features': 0.8175876438646429, 'max_depth': 66, 'min_samples_split': 2, 'min_samples_leaf': 2}. Best is trial 27 with value: 0.8863636363636364.
[32m[I 2023-04-26 02:18:24,165][39m Trial 97 finished with value: 0.8539325842696629 and parameters: {'criterion': 'entropy', 'n_estimators': 113, 'max_features': 0.7165320602120561, 'max_depth': 31, 'min_samples_split': 2, 'min_samples_leaf': 4}. Best is trial 27 with value: 0.8863636363636364.
[32m[I 2023-04-26 02:18:24,266][39m Trial 98 finished with value: 0.8536585365853658 and parameters: {'criterion': 'entropy', 'n_estimators': 100, 'max_features': 0.8169474635664267, 'max_depth': 65, 'min_samples_split': 2, 'min_samples_leaf': 1}. Best is trial 27 with value: 0.8863636363636364.
[32m[I 2023-04-26 02:18:24,391][39m Trial 99 finished with value: 0.8735632183908046 and parameters: {'criterion': 'entropy', 'n_estimators': 119, 'max_features': 0.9274490585544292, 'max_depth': 69, 'min_samples_split': 3, 'min_samples_leaf': 2}. Best is trial 27 with value: 0.8863636363636364.
[32m[I 2023-04-26 02:18:24,495][39m Trial 100 finished with value: 0.8636363636363636 and parameters: {'criterion': 'gini', 'n_estimators': 112, 'max_features': 0.8037701501504484, 'max_depth': 74, 'min_samples_split': 2, 'min_samples_leaf': 3}. Best is trial 27 with value: 0.8863636363636364.
[32m[I 2023-04-26 02:18:24,618][39m Trial 101 finished with value: 0.8604651162790697 and parameters: {'criterion': 'entropy', 'n_estimators': 127, 'max_features': 0.7560845611041291, 'max_depth': 61, 'min_samples_split': 2, 'min_samples_leaf': 2}. Best is trial 27 with value: 0.8863636363636364.
[32m[I 2023-04-26 02:18:24,729][39m Trial 102 finished with value: 0.8705882352941177 and parameters: {'criterion': 'entropy', 'n_estimators': 109, 'max_features': 0.9143869830304756, 'max_depth': 66, 'min_samples_split': 3, 'min_samples_leaf': 2}. Best is trial 27 with value: 0.8863636363636364.
[32m[I 2023-04-26 02:18:24,861][39m Trial 103 finished with value: 0.8837209302325582 and parameters: {'criterion': 'entropy', 'n_estimators': 130, 'max_features': 0.9247323551596329, 'max_depth': 70, 'min_samples_split': 3, 'min_samples_leaf': 2}. Best is trial 27 with value: 0.8863636363636364.
[32m[I 2023-04-26 02:18:24,996][39m Trial 104 finished with value: 0.8433734939759037 and parameters: {'criterion': 'entropy', 'n_estimators': 132, 'max_features': 0.8720315119333164, 'max_depth': 82, 'min_samples_split': 3, 'min_samples_leaf': 1}. Best is trial 27 with value: 0.8863636363636364.
[32m[I 2023-04-26 02:18:25,118][39m Trial 105 finished with value: 0.8809523809523809 and parameters: {'criterion': 'entropy', 'n_estimators': 123, 'max_features': 0.8316730069115725, 'max_depth': 63, 'min_samples_split': 4, 'min_samples_leaf': 2}. Best is trial 27 with value: 0.8863636363636364.
[32m[I 2023-04-26 02:18:25,238][39m Trial 106 finished with value: 0.8505747126436782 and parameters: {'criterion': 'entropy', 'n_estimators': 121, 'max_features': 0.9382627176488282, 'max_depth': 69, 'min_samples_split': 3, 'min_samples_leaf': 3}. Best is trial 27 with value: 0.8863636363636364.
[32m[I 2023-04-26 02:18:25,363][39m Trial 107 finished with value: 0.8372093023255814 and parameters: {'criterion': 'entropy', 'n_estimators': 119, 'max_features': 0.9041587686466352, 'max_depth': 78, 'min_samples_split': 3, 'min_samples_leaf': 2}. Best is trial 27 with value: 0.8863636363636364.
[32m[I 2023-04-26 02:18:25,488][39m Trial 108 finished with value: 0.8181818181818182 and parameters: {'criterion': 'entropy', 'n_estimators': 139, 'max_features': 0.8651600945033258, 'max_depth': 56, 'min_samples_split': 2, 'min_samples_leaf': 5}. Best is trial 27 with value: 0.8863636363636364.
[32m[I 2023-04-26 02:18:25,618][39m Trial 109 finished with value: 0.8705882352941177 and parameters: {'criterion': 'entropy', 'n_estimators': 127, 'max_features': 0.7786431233260928, 'max_depth': 74, 'min_samples_split': 4, 'min_samples_leaf': 2}. Best is trial 27 with value: 0.8863636363636364.
[32m[I 2023-04-26 02:18:25,745][39m Trial 110 finished with value: 0.8674698795180722 and parameters: {'criterion': 'entropy', 'n_estimators': 123, 'max_features': 0.8302116748118573, 'max_depth': 63, 'min_samples_split': 2, 'min_samples_leaf': 1}. Best is trial 27 with value: 0.8863636363636364.
[32m[I 2023-04-26 02:18:25,894][39m Trial 111 finished with value: 0.8705882352941177 and parameters: {'criterion': 'entropy', 'n_estimators': 159, 'max_features': 0.7791669506095807, 'max_depth': 66, 'min_samples_split': 4, 'min_samples_leaf': 2}. Best is trial 27 with value: 0.8863636363636364.
[32m[I 2023-04-26 02:18:26,050][39m Trial 112 finished with value: 0.8705882352941177 and parameters: {'criterion': 'entropy', 'n_estimators': 152, 'max_features': 0.9649304934505958, 'max_depth': 58, 'min_samples_split': 4, 'min_samples_leaf': 2}. Best is trial 27 with value: 0.8863636363636364.
[32m[I 2023-04-26 02:18:26,170][39m Trial 113 finished with value: 0.8666666666666666 and parameters: {'criterion': 'entropy', 'n_estimators': 130, 'max_features': 0.724501905774616, 'max_depth': 96, 'min_samples_split': 2, 'min_samples_leaf': 3}. Best is trial 27 with value: 0.8863636363636364.
[32m[I 2023-04-26 02:18:26,287][39m Trial 114 finished with value: 0.7764705882352942 and parameters: {'criterion': 'gini', 'n_estimators': 137, 'max_features': 0.8487410007555263, 'max_depth': 71, 'min_samples_split': 4, 'min_samples_leaf': 10}. Best is trial 27 with value: 0.8863636363636364.
[32m[I 2023-04-26 02:18:26,425][39m Trial 115 finished with value: 0.8333333333333333 and parameters: {'criterion': 'entropy', 'n_estimators': 134, 'max_features': 0.8200081389525252, 'max_depth': 40, 'min_samples_split': 3, 'min_samples_leaf': 1}. Best is trial 27 with value: 0.8863636363636364.
[32m[I 2023-04-26 02:18:26,554][39m Trial 116 finished with value: 0.8409090909090909 and parameters: {'criterion': 'entropy', 'n_estimators': 144, 'max_features': 0.6873803247454643, 'max_depth': 62, 'min_samples_split': 2, 'min_samples_leaf': 4}. Best is trial 27 with value: 0.8863636363636364.
[32m[I 2023-04-26 02:18:26,659][39m Trial 117 finished with value: 0.8604651162790697 and parameters: {'criterion': 'entropy', 'n_estimators': 108, 'max_features': 0.7670468543147853, 'max_depth': 61, 'min_samples_split': 4, 'min_samples_leaf': 2}. Best is trial 27 with value: 0.8863636363636364.
[32m[I 2023-04-26 02:18:26,773][39m Trial 118 finished with value: 0.7749999999999999 and parameters: {'criterion': 'entropy', 'n_estimators': 148, 'max_features': 0.015042953474604714, 'max_depth': 64, 'min_samples_split': 4, 'min_samples_leaf': 2}. Best is trial 27 with value: 0.8863636363636364.
[32m[I 2023-04-26 02:18:26,878][39m Trial 119 finished with value: 0.7252747252747254 and parameters: {'criterion': 'gini', 'n_estimators': 117, 'max_features': 0.8923028869886416, 'max_depth': 69, 'min_samples_split': 3, 'min_samples_leaf': 11}. Best is trial 27 with value: 0.8863636363636364.
[32m[I 2023-04-26 02:18:26,986][39m Trial 120 finished with value: 0.8372093023255814 and parameters: {'criterion': 'entropy', 'n_estimators': 101, 'max_features': 0.9298025838483314, 'max_depth': 56, 'min_samples_split': 3, 'min_samples_leaf': 2}. Best is trial 27 with value: 0.8863636363636364.
[32m[I 2023-04-26 02:18:27,107][39m Trial 121 finished with value: 0.8470588235294119 and parameters: {'criterion': 'entropy', 'n_estimators': 122, 'max_features': 0.9745773580472663, 'max_depth': 53, 'min_samples_split': 3, 'min_samples_leaf': 2}. Best is trial 27 with value: 0.8863636363636364.
[32m[I 2023-04-26 02:18:27,266][39m Trial 122 finished with value: 0.8409090909090909 and parameters: {'criterion': 'entropy', 'n_estimators': 167, 'max_features': 0.6519095618854204, 'max_depth': 36, 'min_samples_split': 6, 'min_samples_leaf': 3}. Best is trial 27 with value: 0.8863636363636364.
[32m[I 2023-04-26 02:18:27,329][39m Trial 123 finished with value: 0.8089887640449439 and parameters: {'criterion': 'entropy', 'n_estimators': 59, 'max_features': 0.9970264869575691, 'max_depth': 69, 'min_samples_split': 2, 'min_samples_leaf': 9}. Best is trial 27 with value: 0.8863636363636364.
[32m[I 2023-04-26 02:18:27,452][39m Trial 124 finished with value: 0.8571428571428572 and parameters: {'criterion': 'entropy', 'n_estimators': 126, 'max_features': 0.7391597438741405, 'max_depth': 79, 'min_samples_split': 3, 'min_samples_leaf': 2}. Best is trial 27 with value: 0.8863636363636364.
[32m[I 2023-04-26 02:18:27,560][39m Trial 125 finished with value: 0.8505747126436782 and parameters: {'criterion': 'gini', 'n_estimators': 116, 'max_features': 0.8796958575983237, 'max_depth': 30, 'min_samples_split': 5, 'min_samples_leaf': 3}. Best is trial 27 with value: 0.8863636363636364.
[32m[I 2023-04-26 02:18:27,672][39m Trial 126 finished with value: 0.8536585365853658 and parameters: {'criterion': 'gini', 'n_estimators': 131, 'max_features': 0.6029954703699137, 'max_depth': 76, 'min_samples_split': 2, 'min_samples_leaf': 1}. Best is trial 27 with value: 0.8863636363636364.
[32m[I 2023-04-26 02:18:27,829][39m Trial 127 finished with value: 0.8837209302325582 and parameters: {'criterion': 'entropy', 'n_estimators': 161, 'max_features': 0.8394114978273112, 'max_depth': 42, 'min_samples_split': 5, 'min_samples_leaf': 2}. Best is trial 27 with value: 0.8863636363636364.
[32m[I 2023-04-26 02:18:27,959][39m Trial 128 finished with value: 0.8292682926829268 and parameters: {'criterion': 'gini', 'n_estimators': 141, 'max_features': 0.8373674629578124, 'max_depth': 25, 'min_samples_split': 4, 'min_samples_leaf': 2}. Best is trial 27 with value: 0.8863636363636364.
[32m[I 2023-04-26 02:18:28,115][39m Trial 129 finished with value: 0.8837209302325582 and parameters: {'criterion': 'entropy', 'n_estimators': 161, 'max_features': 0.8066076658101371, 'max_depth': 48, 'min_samples_split': 5, 'min_samples_leaf': 2}. Best is trial 27 with value: 0.8863636363636364.
[32m[I 2023-04-26 02:18:28,208][39m Trial 130 finished with value: 0.8735632183908046 and parameters: {'criterion': 'entropy', 'n_estimators': 91, 'max_features': 0.7967146755132123, 'max_depth': 73, 'min_samples_split': 5, 'min_samples_leaf': 2}. Best is trial 27 with value: 0.8863636363636364.
[32m[I 2023-04-26 02:18:28,298][39m Trial 131 finished with value: 0.8735632183908046 and parameters: {'criterion': 'entropy', 'n_estimators': 86, 'max_features': 0.8086228580140803, 'max_depth': 49, 'min_samples_split': 5, 'min_samples_leaf': 2}. Best is trial 27 with value: 0.8863636363636364.
[32m[I 2023-04-26 02:18:28,448][39m Trial 132 finished with value: 0.8705882352941177 and parameters: {'criterion': 'entropy', 'n_estimators': 157, 'max_features': 0.7587495685760794, 'max_depth': 60, 'min_samples_split': 6, 'min_samples_leaf': 1}. Best is trial 27 with value: 0.8863636363636364.
[32m[I 2023-04-26 02:18:28,594][39m Trial 133 finished with value: 0.8539325842696629 and parameters: {'criterion': 'entropy', 'n_estimators': 153, 'max_features': 0.7980250397444244, 'max_depth': 48, 'min_samples_split': 6, 'min_samples_leaf': 3}. Best is trial 27 with value: 0.8863636363636364.
[32m[I 2023-04-26 02:18:28,749][39m Trial 134 finished with value: 0.8837209302325582 and parameters: {'criterion': 'entropy', 'n_estimators': 161, 'max_features': 0.8482079983004501, 'max_depth': 84, 'min_samples_split': 5, 'min_samples_leaf': 2}. Best is trial 27 with value: 0.8863636363636364.
[32m[I 2023-04-26 02:18:28,905][39m Trial 135 finished with value: 0.8571428571428572 and parameters: {'criterion': 'entropy', 'n_estimators': 164, 'max_features': 0.850915541850235, 'max_depth': 42, 'min_samples_split': 5, 'min_samples_leaf': 2}. Best is trial 27 with value: 0.8863636363636364.
[32m[I 2023-04-26 02:18:28,989][39m Trial 136 finished with value: 0.8409090909090909 and parameters: {'criterion': 'entropy', 'n_estimators': 85, 'max_features': 0.8220088230933174, 'max_depth': 84, 'min_samples_split': 5, 'min_samples_leaf': 3}. Best is trial 27 with value: 0.8863636363636364.
[32m[I 2023-04-26 02:18:29,161][39m Trial 137 finished with value: 0.8148148148148149 and parameters: {'criterion': 'entropy', 'n_estimators': 168, 'max_features': 0.9101295929523611, 'max_depth': 43, 'min_samples_split': 5, 'min_samples_leaf': 1}. Best is trial 27 with value: 0.8863636363636364.
[32m[I 2023-04-26 02:18:29,254][39m Trial 138 finished with value: 0.8470588235294119 and parameters: {'criterion': 'entropy', 'n_estimators': 90, 'max_features': 0.7909502523709836, 'max_depth': 85, 'min_samples_split': 5, 'min_samples_leaf': 2}. Best is trial 27 with value: 0.8863636363636364.
[32m[I 2023-04-26 02:18:29,392][39m Trial 139 finished with value: 0.8 and parameters: {'criterion': 'gini', 'n_estimators': 161, 'max_features': 0.7042194009149029, 'max_depth': 81, 'min_samples_split': 6, 'min_samples_leaf': 1}. Best is trial 27 with value: 0.8863636363636364.
[32m[I 2023-04-26 02:18:29,550][39m Trial 140 finished with value: 0.8837209302325582 and parameters: {'criterion': 'entropy', 'n_estimators': 161, 'max_features': 0.8408437914445211, 'max_depth': 93, 'min_samples_split': 4, 'min_samples_leaf': 2}. Best is trial 27 with value: 0.8863636363636364.
[32m[I 2023-04-26 02:18:29,689][39m Trial 141 finished with value: 0.8837209302325582 and parameters: {'criterion': 'entropy', 'n_estimators': 137, 'max_features': 0.8784576888626981, 'max_depth': 94, 'min_samples_split': 4, 'min_samples_leaf': 2}. Best is trial 27 with value: 0.8863636363636364.
[32m[I 2023-04-26 02:18:29,767][39m Trial 142 finished with value: 0.8735632183908046 and parameters: {'criterion': 'entropy', 'n_estimators': 69, 'max_features': 0.8773916225588317, 'max_depth': 92, 'min_samples_split': 4, 'min_samples_leaf': 2}. Best is trial 27 with value: 0.8863636363636364.
[32m[I 2023-04-26 02:18:29,892][39m Trial 143 finished with value: 0.8837209302325582 and parameters: {'criterion': 'entropy', 'n_estimators': 125, 'max_features': 0.8450762760335323, 'max_depth': 95, 'min_samples_split': 4, 'min_samples_leaf': 2}. Best is trial 27 with value: 0.8863636363636364.
[32m[I 2023-04-26 02:18:30,023][39m Trial 144 finished with value: 0.8837209302325582 and parameters: {'criterion': 'entropy', 'n_estimators': 133, 'max_features': 0.8408257906477978, 'max_depth': 97, 'min_samples_split': 4, 'min_samples_leaf': 2}. Best is trial 27 with value: 0.8863636363636364.
[32m[I 2023-04-26 02:18:30,148][39m Trial 145 finished with value: 0.7727272727272727 and parameters: {'criterion': 'entropy', 'n_estimators': 134, 'max_features': 0.8523028199780642, 'max_depth': 96, 'min_samples_split': 4, 'min_samples_leaf': 7}. Best is trial 27 with value: 0.8863636363636364.
