[32m[I 2023-04-26 02:19:08,576][39m Trial 438 finished with value: 0.8674698795180722 and parameters: {'criterion': 'entropy', 'n_estimators': 133, 'max_features': 0.955512852261615, 'max_depth': 87, 'min_samples_split': 2, 'min_samples_leaf': 1}. Best is trial 153 with value: 0.8941176470588236.
[32m[I 2023-04-26 02:19:08,685][39m Trial 439 finished with value: 0.8837209302325582 and parameters: {'criterion': 'entropy', 'n_estimators': 96, 'max_features': 0.9479748650903882, 'max_depth': 87, 'min_samples_split': 2, 'min_samples_leaf': 2}. Best is trial 153 with value: 0.8941176470588236.
[32m[I 2023-04-26 02:19:08,788][39m Trial 440 finished with value: 0.8705882352941177 and parameters: {'criterion': 'entropy', 'n_estimators': 90, 'max_features': 0.9442148550121104, 'max_depth': 86, 'min_samples_split': 2, 'min_samples_leaf': 2}. Best is trial 153 with value: 0.8941176470588236.
[32m[I 2023-04-26 02:19:08,940][39m Trial 441 finished with value: 0.8148148148148149 and parameters: {'criterion': 'gini', 'n_estimators': 165, 'max_features': 0.7807931581953341, 'max_depth': 43, 'min_samples_split': 6, 'min_samples_leaf': 1}. Best is trial 153 with value: 0.8941176470588236.
[32m[I 2023-04-26 02:19:09,075][39m Trial 442 finished with value: 0.8705882352941177 and parameters: {'criterion': 'entropy', 'n_estimators': 127, 'max_features': 0.8600681547369484, 'max_depth': 92, 'min_samples_split': 5, 'min_samples_leaf': 2}. Best is trial 153 with value: 0.8941176470588236.
[32m[I 2023-04-26 02:19:09,250][39m Trial 443 finished with value: 0.8705882352941177 and parameters: {'criterion': 'entropy', 'n_estimators': 172, 'max_features': 0.9194190729677963, 'max_depth': 53, 'min_samples_split': 2, 'min_samples_leaf': 2}. Best is trial 153 with value: 0.8941176470588236.
[32m[I 2023-04-26 02:19:09,364][39m Trial 444 finished with value: 0.8674698795180722 and parameters: {'criterion': 'entropy', 'n_estimators': 104, 'max_features': 0.9014434019593017, 'max_depth': 99, 'min_samples_split': 4, 'min_samples_leaf': 2}. Best is trial 153 with value: 0.8941176470588236.
[32m[I 2023-04-26 02:19:09,490][39m Trial 445 finished with value: 0.8941176470588236 and parameters: {'criterion': 'entropy', 'n_estimators': 119, 'max_features': 0.9243453142828412, 'max_depth': 97, 'min_samples_split': 2, 'min_samples_leaf': 2}. Best is trial 153 with value: 0.8941176470588236.
[32m[I 2023-04-26 02:19:09,624][39m Trial 446 finished with value: 0.8735632183908046 and parameters: {'criterion': 'entropy', 'n_estimators': 119, 'max_features': 0.9168607680909144, 'max_depth': 81, 'min_samples_split': 2, 'min_samples_leaf': 2}. Best is trial 153 with value: 0.8941176470588236.
[32m[I 2023-04-26 02:19:09,748][39m Trial 447 finished with value: 0.8433734939759037 and parameters: {'criterion': 'entropy', 'n_estimators': 116, 'max_features': 0.8015303215216693, 'max_depth': 39, 'min_samples_split': 4, 'min_samples_leaf': 2}. Best is trial 153 with value: 0.8941176470588236.
[32m[I 2023-04-26 02:19:09,841][39m Trial 448 finished with value: 0.8636363636363636 and parameters: {'criterion': 'entropy', 'n_estimators': 78, 'max_features': 0.9678391577208033, 'max_depth': 101, 'min_samples_split': 2, 'min_samples_leaf': 2}. Best is trial 153 with value: 0.8941176470588236.
[32m[I 2023-04-26 02:19:09,961][39m Trial 449 finished with value: 0.8837209302325582 and parameters: {'criterion': 'entropy', 'n_estimators': 110, 'max_features': 0.8941270455957582, 'max_depth': 83, 'min_samples_split': 5, 'min_samples_leaf': 2}. Best is trial 153 with value: 0.8941176470588236.
[32m[I 2023-04-26 02:19:10,087][39m Trial 450 finished with value: 0.8571428571428571 and parameters: {'criterion': 'entropy', 'n_estimators': 120, 'max_features': 0.8988310245122108, 'max_depth': 89, 'min_samples_split': 3, 'min_samples_leaf': 3}. Best is trial 153 with value: 0.8941176470588236.
[32m[I 2023-04-26 02:19:10,208][39m Trial 451 finished with value: 0.8045977011494252 and parameters: {'criterion': 'entropy', 'n_estimators': 115, 'max_features': 0.913368378428291, 'max_depth': 86, 'min_samples_split': 3, 'min_samples_leaf': 7}. Best is trial 153 with value: 0.8941176470588236.
[32m[I 2023-04-26 02:19:10,370][39m Trial 452 finished with value: 0.8735632183908046 and parameters: {'criterion': 'entropy', 'n_estimators': 158, 'max_features': 0.8354039553343121, 'max_depth': 33, 'min_samples_split': 4, 'min_samples_leaf': 2}. Best is trial 153 with value: 0.8941176470588236.
[32m[I 2023-04-26 02:19:10,507][39m Trial 453 finished with value: 0.8571428571428571 and parameters: {'criterion': 'entropy', 'n_estimators': 137, 'max_features': 0.8534943106299001, 'max_depth': 101, 'min_samples_split': 4, 'min_samples_leaf': 4}. Best is trial 153 with value: 0.8941176470588236.
[32m[I 2023-04-26 02:19:10,677][39m Trial 454 finished with value: 0.8433734939759037 and parameters: {'criterion': 'entropy', 'n_estimators': 167, 'max_features': 0.8196525326764705, 'max_depth': 46, 'min_samples_split': 4, 'min_samples_leaf': 1}. Best is trial 153 with value: 0.8941176470588236.
[32m[I 2023-04-26 02:19:10,809][39m Trial 455 finished with value: 0.8470588235294119 and parameters: {'criterion': 'entropy', 'n_estimators': 127, 'max_features': 0.922146070960859, 'max_depth': 96, 'min_samples_split': 3, 'min_samples_leaf': 2}. Best is trial 153 with value: 0.8941176470588236.
[32m[I 2023-04-26 02:19:10,936][39m Trial 456 finished with value: 0.8735632183908046 and parameters: {'criterion': 'entropy', 'n_estimators': 110, 'max_features': 0.9653244893537298, 'max_depth': 95, 'min_samples_split': 2, 'min_samples_leaf': 2}. Best is trial 153 with value: 0.8941176470588236.
[32m[I 2023-04-26 02:19:11,097][39m Trial 457 finished with value: 0.8837209302325582 and parameters: {'criterion': 'entropy', 'n_estimators': 156, 'max_features': 0.8017855540957333, 'max_depth': 44, 'min_samples_split': 3, 'min_samples_leaf': 2}. Best is trial 153 with value: 0.8941176470588236.
[32m[I 2023-04-26 02:19:11,217][39m Trial 458 finished with value: 0.8837209302325582 and parameters: {'criterion': 'entropy', 'n_estimators': 113, 'max_features': 0.815701631096565, 'max_depth': 42, 'min_samples_split': 3, 'min_samples_leaf': 2}. Best is trial 153 with value: 0.8941176470588236.
[32m[I 2023-04-26 02:19:11,330][39m Trial 459 finished with value: 0.8604651162790697 and parameters: {'criterion': 'entropy', 'n_estimators': 108, 'max_features': 0.893306920965791, 'max_depth': 93, 'min_samples_split': 3, 'min_samples_leaf': 2}. Best is trial 153 with value: 0.8941176470588236.
[32m[I 2023-04-26 02:19:11,464][39m Trial 460 finished with value: 0.8539325842696629 and parameters: {'criterion': 'entropy', 'n_estimators': 123, 'max_features': 0.8833681099964088, 'max_depth': 83, 'min_samples_split': 5, 'min_samples_leaf': 3}. Best is trial 153 with value: 0.8941176470588236.
[32m[I 2023-04-26 02:19:11,547][39m Trial 461 finished with value: 0.8536585365853658 and parameters: {'criterion': 'entropy', 'n_estimators': 66, 'max_features': 0.9732367467110953, 'max_depth': 33, 'min_samples_split': 2, 'min_samples_leaf': 1}. Best is trial 153 with value: 0.8941176470588236.
[32m[I 2023-04-26 02:19:11,677][39m Trial 462 finished with value: 0.8705882352941177 and parameters: {'criterion': 'entropy', 'n_estimators': 118, 'max_features': 0.9319140561960592, 'max_depth': 99, 'min_samples_split': 2, 'min_samples_leaf': 2}. Best is trial 153 with value: 0.8941176470588236.
[32m[I 2023-04-26 02:19:11,788][39m Trial 463 finished with value: 0.8470588235294119 and parameters: {'criterion': 'gini', 'n_estimators': 107, 'max_features': 0.996762315635742, 'max_depth': 78, 'min_samples_split': 2, 'min_samples_leaf': 2}. Best is trial 153 with value: 0.8941176470588236.
[32m[I 2023-04-26 02:19:11,917][39m Trial 464 finished with value: 0.8470588235294119 and parameters: {'criterion': 'entropy', 'n_estimators': 120, 'max_features': 0.7492978548696578, 'max_depth': 101, 'min_samples_split': 3, 'min_samples_leaf': 2}. Best is trial 153 with value: 0.8941176470588236.
[32m[I 2023-04-26 02:19:12,032][39m Trial 465 finished with value: 0.8837209302325582 and parameters: {'criterion': 'entropy', 'n_estimators': 101, 'max_features': 0.9680804763814045, 'max_depth': 91, 'min_samples_split': 2, 'min_samples_leaf': 2}. Best is trial 153 with value: 0.8941176470588236.
[32m[I 2023-04-26 02:19:12,153][39m Trial 466 finished with value: 0.8333333333333333 and parameters: {'criterion': 'entropy', 'n_estimators': 113, 'max_features': 0.7580113214856767, 'max_depth': 66, 'min_samples_split': 3, 'min_samples_leaf': 1}. Best is trial 153 with value: 0.8941176470588236.
[32m[I 2023-04-26 02:19:12,261][39m Trial 467 finished with value: 0.8941176470588236 and parameters: {'criterion': 'entropy', 'n_estimators': 109, 'max_features': 0.9066571144278877, 'max_depth': 27, 'min_samples_split': 3, 'min_samples_leaf': 2}. Best is trial 153 with value: 0.8941176470588236.
[32m[I 2023-04-26 02:19:12,427][39m Trial 468 finished with value: 0.8539325842696629 and parameters: {'criterion': 'entropy', 'n_estimators': 146, 'max_features': 0.9587891608803863, 'max_depth': 90, 'min_samples_split': 4, 'min_samples_leaf': 3}. Best is trial 153 with value: 0.8941176470588236.
[32m[I 2023-04-26 02:19:12,533][39m Trial 469 finished with value: 0.8571428571428572 and parameters: {'criterion': 'entropy', 'n_estimators': 97, 'max_features': 0.8322462765044902, 'max_depth': 22, 'min_samples_split': 4, 'min_samples_leaf': 2}. Best is trial 153 with value: 0.8941176470588236.
[32m[I 2023-04-26 02:19:12,656][39m Trial 470 finished with value: 0.8539325842696629 and parameters: {'criterion': 'entropy', 'n_estimators': 112, 'max_features': 0.9335331828002594, 'max_depth': 8, 'min_samples_split': 3, 'min_samples_leaf': 2}. Best is trial 153 with value: 0.8941176470588236.
[32m[I 2023-04-26 02:19:12,768][39m Trial 471 finished with value: 0.8571428571428572 and parameters: {'criterion': 'entropy', 'n_estimators': 105, 'max_features': 0.746391427016834, 'max_depth': 34, 'min_samples_split': 3, 'min_samples_leaf': 1}. Best is trial 153 with value: 0.8941176470588236.
[32m[I 2023-04-26 02:19:12,897][39m Trial 472 finished with value: 0.8837209302325582 and parameters: {'criterion': 'entropy', 'n_estimators': 114, 'max_features': 0.8933936486885279, 'max_depth': 89, 'min_samples_split': 3, 'min_samples_leaf': 2}. Best is trial 153 with value: 0.8941176470588236.
[32m[I 2023-04-26 02:19:13,021][39m Trial 473 finished with value: 0.8705882352941177 and parameters: {'criterion': 'entropy', 'n_estimators': 110, 'max_features': 0.9051572134735854, 'max_depth': 85, 'min_samples_split': 3, 'min_samples_leaf': 2}. Best is trial 153 with value: 0.8941176470588236.
[32m[I 2023-04-26 02:19:13,097][39m Trial 474 finished with value: 0.8674698795180722 and parameters: {'criterion': 'entropy', 'n_estimators': 57, 'max_features': 0.8765891339647978, 'max_depth': 92, 'min_samples_split': 3, 'min_samples_leaf': 1}. Best is trial 153 with value: 0.8941176470588236.
[32m[I 2023-04-26 02:19:13,166][39m Trial 475 finished with value: 0.8470588235294119 and parameters: {'criterion': 'entropy', 'n_estimators': 51, 'max_features': 0.862511996960786, 'max_depth': 16, 'min_samples_split': 2, 'min_samples_leaf': 2}. Best is trial 153 with value: 0.8941176470588236.
[32m[I 2023-04-26 02:19:13,268][39m Trial 476 finished with value: 0.8470588235294119 and parameters: {'criterion': 'entropy', 'n_estimators': 107, 'max_features': 0.4687704610599098, 'max_depth': 93, 'min_samples_split': 2, 'min_samples_leaf': 2}. Best is trial 153 with value: 0.8941176470588236.
[32m[I 2023-04-26 02:19:13,460][39m Trial 477 finished with value: 0.8837209302325582 and parameters: {'criterion': 'entropy', 'n_estimators': 186, 'max_features': 0.8610750522543477, 'max_depth': 47, 'min_samples_split': 5, 'min_samples_leaf': 2}. Best is trial 153 with value: 0.8941176470588236.
[32m[I 2023-04-26 02:19:13,588][39m Trial 478 finished with value: 0.8444444444444446 and parameters: {'criterion': 'entropy', 'n_estimators': 118, 'max_features': 0.9327209373086041, 'max_depth': 30, 'min_samples_split': 2, 'min_samples_leaf': 3}. Best is trial 153 with value: 0.8941176470588236.
[32m[I 2023-04-26 02:19:13,787][39m Trial 479 finished with value: 0.8636363636363636 and parameters: {'criterion': 'entropy', 'n_estimators': 198, 'max_features': 0.8616675888499381, 'max_depth': 19, 'min_samples_split': 6, 'min_samples_leaf': 2}. Best is trial 153 with value: 0.8941176470588236.
[32m[I 2023-04-26 02:19:13,904][39m Trial 480 finished with value: 0.8470588235294119 and parameters: {'criterion': 'gini', 'n_estimators': 116, 'max_features': 0.9112725056058139, 'max_depth': 86, 'min_samples_split': 3, 'min_samples_leaf': 2}. Best is trial 153 with value: 0.8941176470588236.
[32m[I 2023-04-26 02:19:14,005][39m Trial 481 finished with value: 0.8505747126436782 and parameters: {'criterion': 'entropy', 'n_estimators': 114, 'max_features': 0.20571967321144025, 'max_depth': 58, 'min_samples_split': 2, 'min_samples_leaf': 2}. Best is trial 153 with value: 0.8941176470588236.
[32m[I 2023-04-26 02:19:14,199][39m Trial 482 finished with value: 0.8735632183908046 and parameters: {'criterion': 'entropy', 'n_estimators': 196, 'max_features': 0.8435449109801012, 'max_depth': 89, 'min_samples_split': 4, 'min_samples_leaf': 2}. Best is trial 153 with value: 0.8941176470588236.
[32m[I 2023-04-26 02:19:14,321][39m Trial 483 finished with value: 0.8571428571428572 and parameters: {'criterion': 'entropy', 'n_estimators': 109, 'max_features': 0.9169681380752205, 'max_depth': 97, 'min_samples_split': 3, 'min_samples_leaf': 1}. Best is trial 153 with value: 0.8941176470588236.
[32m[I 2023-04-26 02:19:14,428][39m Trial 484 finished with value: 0.7954545454545454 and parameters: {'criterion': 'entropy', 'n_estimators': 103, 'max_features': 0.8706529448787543, 'max_depth': 94, 'min_samples_split': 4, 'min_samples_leaf': 6}. Best is trial 153 with value: 0.8941176470588236.
[32m[I 2023-04-26 02:19:14,577][39m Trial 485 finished with value: 0.8571428571428572 and parameters: {'criterion': 'entropy', 'n_estimators': 137, 'max_features': 0.8748019198092776, 'max_depth': 99, 'min_samples_split': 2, 'min_samples_leaf': 2}. Best is trial 153 with value: 0.8941176470588236.
[32m[I 2023-04-26 02:19:14,684][39m Trial 486 finished with value: 0.8837209302325582 and parameters: {'criterion': 'entropy', 'n_estimators': 98, 'max_features': 0.8520813069124648, 'max_depth': 94, 'min_samples_split': 4, 'min_samples_leaf': 2}. Best is trial 153 with value: 0.8941176470588236.
[32m[I 2023-04-26 02:19:14,809][39m Trial 487 finished with value: 0.8505747126436782 and parameters: {'criterion': 'entropy', 'n_estimators': 115, 'max_features': 0.9029523079821846, 'max_depth': 23, 'min_samples_split': 3, 'min_samples_leaf': 3}. Best is trial 153 with value: 0.8941176470588236.
[32m[I 2023-04-26 02:19:14,930][39m Trial 488 finished with value: 0.810126582278481 and parameters: {'criterion': 'entropy', 'n_estimators': 106, 'max_features': 0.8825535291658032, 'max_depth': 87, 'min_samples_split': 2, 'min_samples_leaf': 1}. Best is trial 153 with value: 0.8941176470588236.
[32m[I 2023-04-26 02:19:15,013][39m Trial 489 finished with value: 0.8735632183908046 and parameters: {'criterion': 'entropy', 'n_estimators': 69, 'max_features': 0.8323968153296907, 'max_depth': 21, 'min_samples_split': 4, 'min_samples_leaf': 2}. Best is trial 153 with value: 0.8941176470588236.
[32m[I 2023-04-26 02:19:15,161][39m Trial 490 finished with value: 0.8604651162790697 and parameters: {'criterion': 'entropy', 'n_estimators': 141, 'max_features': 0.8940235688246133, 'max_depth': 35, 'min_samples_split': 2, 'min_samples_leaf': 2}. Best is trial 153 with value: 0.8941176470588236.
[32m[I 2023-04-26 02:19:15,327][39m Trial 491 finished with value: 0.8735632183908046 and parameters: {'criterion': 'entropy', 'n_estimators': 168, 'max_features': 0.7712543595131476, 'max_depth': 51, 'min_samples_split': 5, 'min_samples_leaf': 2}. Best is trial 153 with value: 0.8941176470588236.
[32m[I 2023-04-26 02:19:15,467][39m Trial 492 finished with value: 0.8409090909090909 and parameters: {'criterion': 'entropy', 'n_estimators': 135, 'max_features': 0.8513432117072018, 'max_depth': 70, 'min_samples_split': 3, 'min_samples_leaf': 3}. Best is trial 153 with value: 0.8941176470588236.
[32m[I 2023-04-26 02:19:15,608][39m Trial 493 finished with value: 0.8674698795180722 and parameters: {'criterion': 'entropy', 'n_estimators': 130, 'max_features': 0.8799450420764857, 'max_depth': 29, 'min_samples_split': 2, 'min_samples_leaf': 1}. Best is trial 153 with value: 0.8941176470588236.
[32m[I 2023-04-26 02:19:15,726][39m Trial 494 finished with value: 0.8735632183908046 and parameters: {'criterion': 'entropy', 'n_estimators': 104, 'max_features': 0.9532826517171777, 'max_depth': 49, 'min_samples_split': 6, 'min_samples_leaf': 2}. Best is trial 153 with value: 0.8941176470588236.
[32m[I 2023-04-26 02:19:15,867][39m Trial 495 finished with value: 0.8636363636363636 and parameters: {'criterion': 'entropy', 'n_estimators': 130, 'max_features': 0.9394959734405349, 'max_depth': 29, 'min_samples_split': 7, 'min_samples_leaf': 2}. Best is trial 153 with value: 0.8941176470588236.
[32m[I 2023-04-26 02:19:15,983][39m Trial 496 finished with value: 0.8604651162790697 and parameters: {'criterion': 'entropy', 'n_estimators': 104, 'max_features': 0.9751477675252117, 'max_depth': 91, 'min_samples_split': 8, 'min_samples_leaf': 2}. Best is trial 153 with value: 0.8941176470588236.
[32m[I 2023-04-26 02:19:16,139][39m Trial 497 finished with value: 0.8192771084337348 and parameters: {'criterion': 'entropy', 'n_estimators': 169, 'max_features': 0.5438792249134836, 'max_depth': 38, 'min_samples_split': 4, 'min_samples_leaf': 2}. Best is trial 153 with value: 0.8941176470588236.
[32m[I 2023-04-26 02:19:16,213][39m Trial 498 finished with value: 0.8837209302325582 and parameters: {'criterion': 'entropy', 'n_estimators': 63, 'max_features': 0.6705117467898635, 'max_depth': 92, 'min_samples_split': 3, 'min_samples_leaf': 2}. Best is trial 153 with value: 0.8941176470588236.
[32m[I 2023-04-26 02:19:16,289][39m Trial 499 finished with value: 0.8 and parameters: {'criterion': 'gini', 'n_estimators': 73, 'max_features': 0.6870279554345701, 'max_depth': 64, 'min_samples_split': 3, 'min_samples_leaf': 1}. Best is trial 153 with value: 0.8941176470588236.
Number of finished trials: 500