[32m[I 2023-04-26 02:18:30,279][39m Trial 146 finished with value: 0.8735632183908046 and parameters: {'criterion': 'entropy', 'n_estimators': 128, 'max_features': 0.8858844718022278, 'max_depth': 99, 'min_samples_split': 4, 'min_samples_leaf': 2}. Best is trial 27 with value: 0.8863636363636364.
[32m[I 2023-04-26 02:18:30,405][39m Trial 147 finished with value: 0.8433734939759037 and parameters: {'criterion': 'entropy', 'n_estimators': 125, 'max_features': 0.8666042593948072, 'max_depth': 89, 'min_samples_split': 4, 'min_samples_leaf': 2}. Best is trial 27 with value: 0.8863636363636364.
[32m[I 2023-04-26 02:18:30,555][39m Trial 148 finished with value: 0.8333333333333333 and parameters: {'criterion': 'entropy', 'n_estimators': 146, 'max_features': 0.895746909859641, 'max_depth': 94, 'min_samples_split': 4, 'min_samples_leaf': 1}. Best is trial 27 with value: 0.8863636363636364.
[32m[I 2023-04-26 02:18:30,688][39m Trial 149 finished with value: 0.8571428571428572 and parameters: {'criterion': 'entropy', 'n_estimators': 134, 'max_features': 0.8324325911948187, 'max_depth': 89, 'min_samples_split': 4, 'min_samples_leaf': 2}. Best is trial 27 with value: 0.8863636363636364.
[32m[I 2023-04-26 02:18:30,824][39m Trial 150 finished with value: 0.8735632183908046 and parameters: {'criterion': 'entropy', 'n_estimators': 139, 'max_features': 0.8510324257592822, 'max_depth': 98, 'min_samples_split': 4, 'min_samples_leaf': 2}. Best is trial 27 with value: 0.8863636363636364.
[32m[I 2023-04-26 02:18:30,977][39m Trial 151 finished with value: 0.8735632183908046 and parameters: {'criterion': 'entropy', 'n_estimators': 159, 'max_features': 0.8270600915814181, 'max_depth': 94, 'min_samples_split': 4, 'min_samples_leaf': 2}. Best is trial 27 with value: 0.8863636363636364.
[32m[I 2023-04-26 02:18:31,106][39m Trial 152 finished with value: 0.8636363636363636 and parameters: {'criterion': 'entropy', 'n_estimators': 132, 'max_features': 0.8403659660683667, 'max_depth': 95, 'min_samples_split': 4, 'min_samples_leaf': 3}. Best is trial 27 with value: 0.8863636363636364.
[32m[I 2023-04-26 02:18:31,225][39m Trial 153 finished with value: 0.8941176470588236 and parameters: {'criterion': 'entropy', 'n_estimators': 113, 'max_features': 0.9317571623534245, 'max_depth': 100, 'min_samples_split': 3, 'min_samples_leaf': 2}. Best is trial 153 with value: 0.8941176470588236.
[32m[I 2023-04-26 02:18:31,343][39m Trial 154 finished with value: 0.8604651162790697 and parameters: {'criterion': 'entropy', 'n_estimators': 112, 'max_features': 0.9382434386402259, 'max_depth': 99, 'min_samples_split': 3, 'min_samples_leaf': 2}. Best is trial 153 with value: 0.8941176470588236.
[32m[I 2023-04-26 02:18:31,476][39m Trial 155 finished with value: 0.8735632183908046 and parameters: {'criterion': 'entropy', 'n_estimators': 129, 'max_features': 0.9017326485831519, 'max_depth': 101, 'min_samples_split': 4, 'min_samples_leaf': 2}. Best is trial 153 with value: 0.8941176470588236.
[32m[I 2023-04-26 02:18:31,587][39m Trial 156 finished with value: 0.8941176470588236 and parameters: {'criterion': 'entropy', 'n_estimators': 106, 'max_features': 0.9509683318438836, 'max_depth': 91, 'min_samples_split': 3, 'min_samples_leaf': 2}. Best is trial 153 with value: 0.8941176470588236.
[32m[I 2023-04-26 02:18:31,699][39m Trial 157 finished with value: 0.8735632183908046 and parameters: {'criterion': 'entropy', 'n_estimators': 105, 'max_features': 0.9444555128150871, 'max_depth': 87, 'min_samples_split': 3, 'min_samples_leaf': 2}. Best is trial 153 with value: 0.8941176470588236.
[32m[I 2023-04-26 02:18:31,805][39m Trial 158 finished with value: 0.8395061728395061 and parameters: {'criterion': 'entropy', 'n_estimators': 100, 'max_features': 0.9129306428253866, 'max_depth': 91, 'min_samples_split': 3, 'min_samples_leaf': 1}. Best is trial 153 with value: 0.8941176470588236.
[32m[I 2023-04-26 02:18:31,927][39m Trial 159 finished with value: 0.8735632183908046 and parameters: {'criterion': 'entropy', 'n_estimators': 114, 'max_features': 0.9583764546653586, 'max_depth': 97, 'min_samples_split': 3, 'min_samples_leaf': 2}. Best is trial 153 with value: 0.8941176470588236.
[32m[I 2023-04-26 02:18:32,047][39m Trial 160 finished with value: 0.8536585365853658 and parameters: {'criterion': 'entropy', 'n_estimators': 107, 'max_features': 0.8744439576347227, 'max_depth': 92, 'min_samples_split': 3, 'min_samples_leaf': 1}. Best is trial 153 with value: 0.8941176470588236.
[32m[I 2023-04-26 02:18:32,149][39m Trial 161 finished with value: 0.8571428571428572 and parameters: {'criterion': 'entropy', 'n_estimators': 96, 'max_features': 0.808771427002217, 'max_depth': 98, 'min_samples_split': 4, 'min_samples_leaf': 2}. Best is trial 153 with value: 0.8941176470588236.
[32m[I 2023-04-26 02:18:32,263][39m Trial 162 finished with value: 0.8735632183908046 and parameters: {'criterion': 'entropy', 'n_estimators': 110, 'max_features': 0.8628524995480118, 'max_depth': 100, 'min_samples_split': 4, 'min_samples_leaf': 2}. Best is trial 153 with value: 0.8941176470588236.
[32m[I 2023-04-26 02:18:32,394][39m Trial 163 finished with value: 0.8837209302325582 and parameters: {'criterion': 'entropy', 'n_estimators': 125, 'max_features': 0.9216726885116648, 'max_depth': 94, 'min_samples_split': 3, 'min_samples_leaf': 2}. Best is trial 153 with value: 0.8941176470588236.
[32m[I 2023-04-26 02:18:32,518][39m Trial 164 finished with value: 0.8604651162790697 and parameters: {'criterion': 'entropy', 'n_estimators': 121, 'max_features': 0.9204977395722409, 'max_depth': 90, 'min_samples_split': 3, 'min_samples_leaf': 2}. Best is trial 153 with value: 0.8941176470588236.
[32m[I 2023-04-26 02:18:32,647][39m Trial 165 finished with value: 0.8837209302325582 and parameters: {'criterion': 'entropy', 'n_estimators': 125, 'max_features': 0.9741241736520543, 'max_depth': 93, 'min_samples_split': 3, 'min_samples_leaf': 2}. Best is trial 153 with value: 0.8941176470588236.
[32m[I 2023-04-26 02:18:32,777][39m Trial 166 finished with value: 0.8735632183908046 and parameters: {'criterion': 'entropy', 'n_estimators': 125, 'max_features': 0.9606804902182408, 'max_depth': 94, 'min_samples_split': 3, 'min_samples_leaf': 2}. Best is trial 153 with value: 0.8941176470588236.
[32m[I 2023-04-26 02:18:32,900][39m Trial 167 finished with value: 0.8705882352941177 and parameters: {'criterion': 'entropy', 'n_estimators': 118, 'max_features': 0.9864243816630375, 'max_depth': 96, 'min_samples_split': 3, 'min_samples_leaf': 2}. Best is trial 153 with value: 0.8941176470588236.
[32m[I 2023-04-26 02:18:33,026][39m Trial 168 finished with value: 0.8837209302325582 and parameters: {'criterion': 'entropy', 'n_estimators': 123, 'max_features': 0.8926831226822837, 'max_depth': 93, 'min_samples_split': 3, 'min_samples_leaf': 2}. Best is trial 153 with value: 0.8941176470588236.
[32m[I 2023-04-26 02:18:33,156][39m Trial 169 finished with value: 0.8735632183908046 and parameters: {'criterion': 'entropy', 'n_estimators': 123, 'max_features': 0.8956834198305633, 'max_depth': 92, 'min_samples_split': 3, 'min_samples_leaf': 2}. Best is trial 153 with value: 0.8941176470588236.
[32m[I 2023-04-26 02:18:33,266][39m Trial 170 finished with value: 0.8571428571428572 and parameters: {'criterion': 'entropy', 'n_estimators': 103, 'max_features': 0.9315810897714646, 'max_depth': 88, 'min_samples_split': 3, 'min_samples_leaf': 2}. Best is trial 153 with value: 0.8941176470588236.
[32m[I 2023-04-26 02:18:33,399][39m Trial 171 finished with value: 0.8735632183908046 and parameters: {'criterion': 'entropy', 'n_estimators': 127, 'max_features': 0.9796664750114672, 'max_depth': 94, 'min_samples_split': 3, 'min_samples_leaf': 2}. Best is trial 153 with value: 0.8941176470588236.
[32m[I 2023-04-26 02:18:33,518][39m Trial 172 finished with value: 0.8505747126436782 and parameters: {'criterion': 'entropy', 'n_estimators': 115, 'max_features': 0.9463319273113414, 'max_depth': 96, 'min_samples_split': 11, 'min_samples_leaf': 2}. Best is trial 153 with value: 0.8941176470588236.
[32m[I 2023-04-26 02:18:33,623][39m Trial 173 finished with value: 0.8048780487804877 and parameters: {'criterion': 'entropy', 'n_estimators': 130, 'max_features': 0.20061970830054937, 'max_depth': 93, 'min_samples_split': 3, 'min_samples_leaf': 2}. Best is trial 153 with value: 0.8941176470588236.
[32m[I 2023-04-26 02:18:33,761][39m Trial 174 finished with value: 0.8735632183908046 and parameters: {'criterion': 'entropy', 'n_estimators': 136, 'max_features': 0.8758360698172485, 'max_depth': 98, 'min_samples_split': 3, 'min_samples_leaf': 2}. Best is trial 153 with value: 0.8941176470588236.
[32m[I 2023-04-26 02:18:33,886][39m Trial 175 finished with value: 0.8735632183908046 and parameters: {'criterion': 'entropy', 'n_estimators': 122, 'max_features': 0.9127130458376232, 'max_depth': 101, 'min_samples_split': 2, 'min_samples_leaf': 2}. Best is trial 153 with value: 0.8941176470588236.
[32m[I 2023-04-26 02:18:34,020][39m Trial 176 finished with value: 0.8571428571428572 and parameters: {'criterion': 'entropy', 'n_estimators': 132, 'max_features': 0.8381487741403879, 'max_depth': 91, 'min_samples_split': 3, 'min_samples_leaf': 1}. Best is trial 153 with value: 0.8941176470588236.
[32m[I 2023-04-26 02:18:34,150][39m Trial 177 finished with value: 0.8837209302325582 and parameters: {'criterion': 'entropy', 'n_estimators': 126, 'max_features': 0.8859542779966532, 'max_depth': 96, 'min_samples_split': 3, 'min_samples_leaf': 2}. Best is trial 153 with value: 0.8941176470588236.
[32m[I 2023-04-26 02:18:34,280][39m Trial 178 finished with value: 0.8837209302325582 and parameters: {'criterion': 'entropy', 'n_estimators': 127, 'max_features': 0.8882559660014426, 'max_depth': 96, 'min_samples_split': 2, 'min_samples_leaf': 2}. Best is trial 153 with value: 0.8941176470588236.
[32m[I 2023-04-26 02:18:34,407][39m Trial 179 finished with value: 0.8735632183908046 and parameters: {'criterion': 'entropy', 'n_estimators': 126, 'max_features': 0.8945196097626992, 'max_depth': 97, 'min_samples_split': 2, 'min_samples_leaf': 2}. Best is trial 153 with value: 0.8941176470588236.
[32m[I 2023-04-26 02:18:34,531][39m Trial 180 finished with value: 0.8941176470588236 and parameters: {'criterion': 'entropy', 'n_estimators': 117, 'max_features': 0.9208015171357113, 'max_depth': 86, 'min_samples_split': 2, 'min_samples_leaf': 2}. Best is trial 153 with value: 0.8941176470588236.
[32m[I 2023-04-26 02:18:34,646][39m Trial 181 finished with value: 0.8837209302325582 and parameters: {'criterion': 'entropy', 'n_estimators': 111, 'max_features': 0.9161367462440919, 'max_depth': 86, 'min_samples_split': 2, 'min_samples_leaf': 2}. Best is trial 153 with value: 0.8941176470588236.
[32m[I 2023-04-26 02:18:34,762][39m Trial 182 finished with value: 0.8809523809523809 and parameters: {'criterion': 'entropy', 'n_estimators': 112, 'max_features': 0.9183873403396977, 'max_depth': 86, 'min_samples_split': 2, 'min_samples_leaf': 2}. Best is trial 153 with value: 0.8941176470588236.
[32m[I 2023-04-26 02:18:34,886][39m Trial 183 finished with value: 0.8735632183908046 and parameters: {'criterion': 'entropy', 'n_estimators': 118, 'max_features': 0.9488079797439913, 'max_depth': 90, 'min_samples_split': 2, 'min_samples_leaf': 2}. Best is trial 153 with value: 0.8941176470588236.
[32m[I 2023-04-26 02:18:35,011][39m Trial 184 finished with value: 0.8735632183908046 and parameters: {'criterion': 'entropy', 'n_estimators': 121, 'max_features': 0.8620327059398913, 'max_depth': 93, 'min_samples_split': 2, 'min_samples_leaf': 2}. Best is trial 153 with value: 0.8941176470588236.
[32m[I 2023-04-26 02:18:35,129][39m Trial 185 finished with value: 0.8941176470588236 and parameters: {'criterion': 'entropy', 'n_estimators': 111, 'max_features': 0.88295954427188, 'max_depth': 86, 'min_samples_split': 2, 'min_samples_leaf': 2}. Best is trial 153 with value: 0.8941176470588236.
[32m[I 2023-04-26 02:18:35,256][39m Trial 186 finished with value: 0.8837209302325582 and parameters: {'criterion': 'entropy', 'n_estimators': 117, 'max_features': 0.8916008156736623, 'max_depth': 95, 'min_samples_split': 2, 'min_samples_leaf': 2}. Best is trial 153 with value: 0.8941176470588236.
[32m[I 2023-04-26 02:18:35,373][39m Trial 187 finished with value: 0.8837209302325582 and parameters: {'criterion': 'entropy', 'n_estimators': 111, 'max_features': 0.9251157475675853, 'max_depth': 84, 'min_samples_split': 2, 'min_samples_leaf': 2}. Best is trial 153 with value: 0.8941176470588236.
[32m[I 2023-04-26 02:18:35,488][39m Trial 188 finished with value: 0.8505747126436782 and parameters: {'criterion': 'entropy', 'n_estimators': 109, 'max_features': 0.9539409689507162, 'max_depth': 87, 'min_samples_split': 2, 'min_samples_leaf': 3}. Best is trial 153 with value: 0.8941176470588236.
[32m[I 2023-04-26 02:18:35,608][39m Trial 189 finished with value: 0.8470588235294119 and parameters: {'criterion': 'entropy', 'n_estimators': 115, 'max_features': 0.9735357101067965, 'max_depth': 84, 'min_samples_split': 2, 'min_samples_leaf': 2}. Best is trial 153 with value: 0.8941176470588236.
[32m[I 2023-04-26 02:18:35,734][39m Trial 190 finished with value: 0.8604651162790697 and parameters: {'criterion': 'entropy', 'n_estimators': 117, 'max_features': 0.9276578970840194, 'max_depth': 83, 'min_samples_split': 2, 'min_samples_leaf': 2}. Best is trial 153 with value: 0.8941176470588236.
[32m[I 2023-04-26 02:18:35,852][39m Trial 191 finished with value: 0.8470588235294119 and parameters: {'criterion': 'entropy', 'n_estimators': 112, 'max_features': 0.9069661822816125, 'max_depth': 88, 'min_samples_split': 2, 'min_samples_leaf': 2}. Best is trial 153 with value: 0.8941176470588236.
[32m[I 2023-04-26 02:18:35,963][39m Trial 192 finished with value: 0.8604651162790697 and parameters: {'criterion': 'entropy', 'n_estimators': 105, 'max_features': 0.9180263963178457, 'max_depth': 99, 'min_samples_split': 2, 'min_samples_leaf': 2}. Best is trial 153 with value: 0.8941176470588236.
[32m[I 2023-04-26 02:18:36,094][39m Trial 193 finished with value: 0.8837209302325582 and parameters: {'criterion': 'entropy', 'n_estimators': 129, 'max_features': 0.8733503788052014, 'max_depth': 95, 'min_samples_split': 3, 'min_samples_leaf': 2}. Best is trial 153 with value: 0.8941176470588236.
[32m[I 2023-04-26 02:18:36,221][39m Trial 194 finished with value: 0.8636363636363636 and parameters: {'criterion': 'entropy', 'n_estimators': 119, 'max_features': 0.8962782223883365, 'max_depth': 91, 'min_samples_split': 3, 'min_samples_leaf': 2}. Best is trial 153 with value: 0.8941176470588236.
[32m[I 2023-04-26 02:18:36,356][39m Trial 195 finished with value: 0.8735632183908046 and parameters: {'criterion': 'entropy', 'n_estimators': 129, 'max_features': 0.861006727330106, 'max_depth': 86, 'min_samples_split': 2, 'min_samples_leaf': 2}. Best is trial 153 with value: 0.8941176470588236.
[32m[I 2023-04-26 02:18:36,482][39m Trial 196 finished with value: 0.8837209302325582 and parameters: {'criterion': 'entropy', 'n_estimators': 124, 'max_features': 0.8497719773638973, 'max_depth': 97, 'min_samples_split': 2, 'min_samples_leaf': 2}. Best is trial 153 with value: 0.8941176470588236.
[32m[I 2023-04-26 02:18:36,608][39m Trial 197 finished with value: 0.8735632183908046 and parameters: {'criterion': 'entropy', 'n_estimators': 123, 'max_features': 0.8425177512794714, 'max_depth': 93, 'min_samples_split': 3, 'min_samples_leaf': 2}. Best is trial 153 with value: 0.8941176470588236.
[32m[I 2023-04-26 02:18:36,726][39m Trial 198 finished with value: 0.8705882352941177 and parameters: {'criterion': 'entropy', 'n_estimators': 115, 'max_features': 0.8857998091057648, 'max_depth': 80, 'min_samples_split': 3, 'min_samples_leaf': 2}. Best is trial 153 with value: 0.8941176470588236.
[32m[I 2023-04-26 02:18:36,839][39m Trial 199 finished with value: 0.8444444444444446 and parameters: {'criterion': 'entropy', 'n_estimators': 107, 'max_features': 0.9944623810944626, 'max_depth': 90, 'min_samples_split': 10, 'min_samples_leaf': 3}. Best is trial 153 with value: 0.8941176470588236.
[32m[I 2023-04-26 02:18:36,965][39m Trial 200 finished with value: 0.8837209302325582 and parameters: {'criterion': 'entropy', 'n_estimators': 120, 'max_features': 0.936464638523963, 'max_depth': 97, 'min_samples_split': 2, 'min_samples_leaf': 2}. Best is trial 153 with value: 0.8941176470588236.
[32m[I 2023-04-26 02:18:37,101][39m Trial 201 finished with value: 0.8837209302325582 and parameters: {'criterion': 'entropy', 'n_estimators': 125, 'max_features': 0.9436047935203544, 'max_depth': 99, 'min_samples_split': 2, 'min_samples_leaf': 2}. Best is trial 153 with value: 0.8941176470588236.
[32m[I 2023-04-26 02:18:37,236][39m Trial 202 finished with value: 0.8470588235294119 and parameters: {'criterion': 'entropy', 'n_estimators': 128, 'max_features': 0.9651580576058187, 'max_depth': 101, 'min_samples_split': 3, 'min_samples_leaf': 2}. Best is trial 153 with value: 0.8941176470588236.
[32m[I 2023-04-26 02:18:37,365][39m Trial 203 finished with value: 0.8433734939759037 and parameters: {'criterion': 'entropy', 'n_estimators': 120, 'max_features': 0.9437841309206552, 'max_depth': 99, 'min_samples_split': 2, 'min_samples_leaf': 2}. Best is trial 153 with value: 0.8941176470588236.
[32m[I 2023-04-26 02:18:37,494][39m Trial 204 finished with value: 0.8470588235294119 and parameters: {'criterion': 'entropy', 'n_estimators': 125, 'max_features': 0.887392365951763, 'max_depth': 95, 'min_samples_split': 2, 'min_samples_leaf': 2}. Best is trial 153 with value: 0.8941176470588236.
[32m[I 2023-04-26 02:18:37,602][39m Trial 205 finished with value: 0.8045977011494252 and parameters: {'criterion': 'entropy', 'n_estimators': 109, 'max_features': 0.8748866189112089, 'max_depth': 92, 'min_samples_split': 2, 'min_samples_leaf': 8}. Best is trial 153 with value: 0.8941176470588236.
[32m[I 2023-04-26 02:18:37,719][39m Trial 206 finished with value: 0.8837209302325582 and parameters: {'criterion': 'entropy', 'n_estimators': 111, 'max_features': 0.9243249536064012, 'max_depth': 82, 'min_samples_split': 2, 'min_samples_leaf': 2}. Best is trial 153 with value: 0.8941176470588236.
[32m[I 2023-04-26 02:18:37,827][39m Trial 207 finished with value: 0.8705882352941177 and parameters: {'criterion': 'entropy', 'n_estimators': 103, 'max_features': 0.9082611551322588, 'max_depth': 86, 'min_samples_split': 2, 'min_samples_leaf': 2}. Best is trial 153 with value: 0.8941176470588236.
[32m[I 2023-04-26 02:18:37,965][39m Trial 208 finished with value: 0.8837209302325582 and parameters: {'criterion': 'entropy', 'n_estimators': 132, 'max_features': 0.9649379352160423, 'max_depth': 89, 'min_samples_split': 3, 'min_samples_leaf': 2}. Best is trial 153 with value: 0.8941176470588236.
[32m[I 2023-04-26 02:18:38,099][39m Trial 209 finished with value: 0.8863636363636364 and parameters: {'criterion': 'entropy', 'n_estimators': 136, 'max_features': 0.8160928948231031, 'max_depth': 88, 'min_samples_split': 3, 'min_samples_leaf': 3}. Best is trial 153 with value: 0.8941176470588236.
[32m[I 2023-04-26 02:18:38,215][39m Trial 210 finished with value: 0.8539325842696629 and parameters: {'criterion': 'entropy', 'n_estimators': 112, 'max_features': 0.9232541758906453, 'max_depth': 82, 'min_samples_split': 2, 'min_samples_leaf': 3}. Best is trial 153 with value: 0.8941176470588236.
[32m[I 2023-04-26 02:18:38,351][39m Trial 211 finished with value: 0.8837209302325582 and parameters: {'criterion': 'entropy', 'n_estimators': 134, 'max_features': 0.8158987979136902, 'max_depth': 96, 'min_samples_split': 2, 'min_samples_leaf': 2}. Best is trial 153 with value: 0.8941176470588236.
[32m[I 2023-04-26 02:18:38,487][39m Trial 212 finished with value: 0.8809523809523809 and parameters: {'criterion': 'entropy', 'n_estimators': 135, 'max_features': 0.8152193372919427, 'max_depth': 96, 'min_samples_split': 2, 'min_samples_leaf': 2}. Best is trial 153 with value: 0.8941176470588236.
[32m[I 2023-04-26 02:18:38,629][39m Trial 213 finished with value: 0.8837209302325582 and parameters: {'criterion': 'entropy', 'n_estimators': 139, 'max_features': 0.8593000224832894, 'max_depth': 94, 'min_samples_split': 3, 'min_samples_leaf': 2}. Best is trial 153 with value: 0.8941176470588236.
[32m[I 2023-04-26 02:18:38,768][39m Trial 214 finished with value: 0.8045977011494252 and parameters: {'criterion': 'entropy', 'n_estimators': 141, 'max_features': 0.8623454570619503, 'max_depth': 88, 'min_samples_split': 3, 'min_samples_leaf': 6}. Best is trial 153 with value: 0.8941176470588236.
[32m[I 2023-04-26 02:18:38,885][39m Trial 215 finished with value: 0.8735632183908046 and parameters: {'criterion': 'entropy', 'n_estimators': 108, 'max_features': 0.8958847562151208, 'max_depth': 91, 'min_samples_split': 2, 'min_samples_leaf': 2}. Best is trial 153 with value: 0.8941176470588236.
[32m[I 2023-04-26 02:18:39,007][39m Trial 216 finished with value: 0.8470588235294119 and parameters: {'criterion': 'entropy', 'n_estimators': 116, 'max_features': 0.8892226247335806, 'max_depth': 96, 'min_samples_split': 2, 'min_samples_leaf': 2}. Best is trial 153 with value: 0.8941176470588236.
[32m[I 2023-04-26 02:18:39,143][39m Trial 217 finished with value: 0.8837209302325582 and parameters: {'criterion': 'entropy', 'n_estimators': 130, 'max_features': 0.8759982545850821, 'max_depth': 95, 'min_samples_split': 2, 'min_samples_leaf': 2}. Best is trial 153 with value: 0.8941176470588236.
[32m[I 2023-04-26 02:18:39,268][39m Trial 218 finished with value: 0.8837209302325582 and parameters: {'criterion': 'entropy', 'n_estimators': 128, 'max_features': 0.8802784524395796, 'max_depth': 85, 'min_samples_split': 2, 'min_samples_leaf': 2}. Best is trial 153 with value: 0.8941176470588236.
