[32m[I 2023-04-26 15:44:26,060][39m Trial 180 finished with value: 0.6526315789473683 and parameters: {'algorithm': 'kd_tree', 'n_neighbors': 9, 'weights': 'distance', 'metric': 'manhattan'}. Best is trial 14 with value: 0.6526315789473683.
[32m[I 2023-04-26 15:44:26,076][39m Trial 181 finished with value: 0.6304347826086957 and parameters: {'algorithm': 'auto', 'n_neighbors': 10, 'weights': 'distance', 'metric': 'manhattan'}. Best is trial 14 with value: 0.6526315789473683.
[32m[I 2023-04-26 15:44:26,091][39m Trial 182 finished with value: 0.6526315789473683 and parameters: {'algorithm': 'auto', 'n_neighbors': 11, 'weights': 'distance', 'metric': 'manhattan'}. Best is trial 14 with value: 0.6526315789473683.
[32m[I 2023-04-26 15:44:26,154][39m Trial 183 finished with value: 0.6526315789473683 and parameters: {'algorithm': 'brute', 'n_neighbors': 11, 'weights': 'distance', 'metric': 'manhattan'}. Best is trial 14 with value: 0.6526315789473683.
[32m[I 2023-04-26 15:44:26,216][39m Trial 184 finished with value: 0.6526315789473683 and parameters: {'algorithm': 'brute', 'n_neighbors': 9, 'weights': 'distance', 'metric': 'manhattan'}. Best is trial 14 with value: 0.6526315789473683.
[32m[I 2023-04-26 15:44:26,248][39m Trial 185 finished with value: 0.6153846153846154 and parameters: {'algorithm': 'kd_tree', 'n_neighbors': 8, 'weights': 'distance', 'metric': 'manhattan'}. Best is trial 14 with value: 0.6526315789473683.
[32m[I 2023-04-26 15:44:26,295][39m Trial 186 finished with value: 0.5979381443298969 and parameters: {'algorithm': 'brute', 'n_neighbors': 12, 'weights': 'distance', 'metric': 'minkowski'}. Best is trial 14 with value: 0.6526315789473683.
[32m[I 2023-04-26 15:44:26,310][39m Trial 187 finished with value: 0.6526315789473683 and parameters: {'algorithm': 'auto', 'n_neighbors': 11, 'weights': 'distance', 'metric': 'manhattan'}. Best is trial 14 with value: 0.6526315789473683.
[32m[I 2023-04-26 15:44:26,326][39m Trial 188 finished with value: 0.6391752577319588 and parameters: {'algorithm': 'kd_tree', 'n_neighbors': 12, 'weights': 'distance', 'metric': 'manhattan'}. Best is trial 14 with value: 0.6526315789473683.
[32m[I 2023-04-26 15:44:26,373][39m Trial 189 finished with value: 0.6037735849056605 and parameters: {'algorithm': 'brute', 'n_neighbors': 7, 'weights': 'uniform', 'metric': 'manhattan'}. Best is trial 14 with value: 0.6526315789473683.
[32m[I 2023-04-26 15:44:26,420][39m Trial 190 finished with value: 0.6304347826086957 and parameters: {'algorithm': 'brute', 'n_neighbors': 10, 'weights': 'distance', 'metric': 'manhattan'}. Best is trial 14 with value: 0.6526315789473683.
[32m[I 2023-04-26 15:44:26,483][39m Trial 191 finished with value: 0.6458333333333333 and parameters: {'algorithm': 'brute', 'n_neighbors': 14, 'weights': 'distance', 'metric': 'manhattan'}. Best is trial 14 with value: 0.6526315789473683.
[32m[I 2023-04-26 15:44:26,561][39m Trial 192 finished with value: 0.6526315789473683 and parameters: {'algorithm': 'brute', 'n_neighbors': 11, 'weights': 'distance', 'metric': 'manhattan'}. Best is trial 14 with value: 0.6526315789473683.
[32m[I 2023-04-26 15:44:26,608][39m Trial 193 finished with value: 0.6249999999999999 and parameters: {'algorithm': 'brute', 'n_neighbors': 20, 'weights': 'distance', 'metric': 'manhattan'}. Best is trial 14 with value: 0.6526315789473683.
[32m[I 2023-04-26 15:44:26,670][39m Trial 194 finished with value: 0.6526315789473683 and parameters: {'algorithm': 'brute', 'n_neighbors': 9, 'weights': 'distance', 'metric': 'manhattan'}. Best is trial 14 with value: 0.6526315789473683.
[32m[I 2023-04-26 15:44:26,733][39m Trial 195 finished with value: 0.6458333333333333 and parameters: {'algorithm': 'brute', 'n_neighbors': 15, 'weights': 'distance', 'metric': 'manhattan'}. Best is trial 14 with value: 0.6526315789473683.
[32m[I 2023-04-26 15:44:26,796][39m Trial 196 finished with value: 0.6526315789473683 and parameters: {'algorithm': 'brute', 'n_neighbors': 13, 'weights': 'distance', 'metric': 'manhattan'}. Best is trial 14 with value: 0.6526315789473683.
[32m[I 2023-04-26 15:44:26,858][39m Trial 197 finished with value: 0.6458333333333333 and parameters: {'algorithm': 'brute', 'n_neighbors': 14, 'weights': 'distance', 'metric': 'manhattan'}. Best is trial 14 with value: 0.6526315789473683.
[32m[I 2023-04-26 15:44:26,921][39m Trial 198 finished with value: 0.6391752577319588 and parameters: {'algorithm': 'brute', 'n_neighbors': 12, 'weights': 'distance', 'metric': 'manhattan'}. Best is trial 14 with value: 0.6526315789473683.
[32m[I 2023-04-26 15:44:26,952][39m Trial 199 finished with value: 0.6526315789473683 and parameters: {'algorithm': 'ball_tree', 'n_neighbors': 9, 'weights': 'distance', 'metric': 'manhattan'}. Best is trial 14 with value: 0.6526315789473683.
[32m[I 2023-04-26 15:44:26,974][39m Trial 200 finished with value: 0.6526315789473683 and parameters: {'algorithm': 'kd_tree', 'n_neighbors': 9, 'weights': 'distance', 'metric': 'manhattan'}. Best is trial 14 with value: 0.6526315789473683.
[32m[I 2023-04-26 15:44:26,984][39m Trial 201 finished with value: 0.6526315789473683 and parameters: {'algorithm': 'kd_tree', 'n_neighbors': 9, 'weights': 'distance', 'metric': 'manhattan'}. Best is trial 14 with value: 0.6526315789473683.
[32m[I 2023-04-26 15:44:27,000][39m Trial 202 finished with value: 0.6526315789473683 and parameters: {'algorithm': 'kd_tree', 'n_neighbors': 9, 'weights': 'distance', 'metric': 'manhattan'}. Best is trial 14 with value: 0.6526315789473683.
[32m[I 2023-04-26 15:44:27,032][39m Trial 203 finished with value: 0.6304347826086957 and parameters: {'algorithm': 'auto', 'n_neighbors': 10, 'weights': 'distance', 'metric': 'manhattan'}. Best is trial 14 with value: 0.6526315789473683.
[32m[I 2023-04-26 15:44:27,048][39m Trial 204 finished with value: 0.6304347826086957 and parameters: {'algorithm': 'auto', 'n_neighbors': 10, 'weights': 'distance', 'metric': 'manhattan'}. Best is trial 14 with value: 0.6526315789473683.
[32m[I 2023-04-26 15:44:27,063][39m Trial 205 finished with value: 0.6526315789473683 and parameters: {'algorithm': 'auto', 'n_neighbors': 13, 'weights': 'distance', 'metric': 'manhattan'}. Best is trial 14 with value: 0.6526315789473683.
[32m[I 2023-04-26 15:44:27,095][39m Trial 206 finished with value: 0.6153846153846154 and parameters: {'algorithm': 'auto', 'n_neighbors': 8, 'weights': 'distance', 'metric': 'manhattan'}. Best is trial 14 with value: 0.6526315789473683.
[32m[I 2023-04-26 15:44:27,126][39m Trial 207 finished with value: 0.6526315789473683 and parameters: {'algorithm': 'ball_tree', 'n_neighbors': 11, 'weights': 'distance', 'metric': 'manhattan'}. Best is trial 14 with value: 0.6526315789473683.
[32m[I 2023-04-26 15:44:27,205][39m Trial 208 finished with value: 0.5979381443298969 and parameters: {'algorithm': 'brute', 'n_neighbors': 12, 'weights': 'distance', 'metric': 'euclidean'}. Best is trial 14 with value: 0.6526315789473683.
[32m[I 2023-04-26 15:44:27,251][39m Trial 209 finished with value: 0.6153846153846154 and parameters: {'algorithm': 'auto', 'n_neighbors': 8, 'weights': 'distance', 'metric': 'manhattan'}. Best is trial 14 with value: 0.6526315789473683.
[32m[I 2023-04-26 15:44:27,330][39m Trial 210 finished with value: 0.6526315789473683 and parameters: {'algorithm': 'brute', 'n_neighbors': 11, 'weights': 'distance', 'metric': 'manhattan'}. Best is trial 14 with value: 0.6526315789473683.
[32m[I 2023-04-26 15:44:27,361][39m Trial 211 finished with value: 0.6526315789473683 and parameters: {'algorithm': 'kd_tree', 'n_neighbors': 13, 'weights': 'distance', 'metric': 'manhattan'}. Best is trial 14 with value: 0.6526315789473683.
[32m[I 2023-04-26 15:44:27,376][39m Trial 212 finished with value: 0.6304347826086957 and parameters: {'algorithm': 'kd_tree', 'n_neighbors': 10, 'weights': 'distance', 'metric': 'manhattan'}. Best is trial 14 with value: 0.6526315789473683.
[32m[I 2023-04-26 15:44:27,408][39m Trial 213 finished with value: 0.6526315789473683 and parameters: {'algorithm': 'auto', 'n_neighbors': 9, 'weights': 'distance', 'metric': 'manhattan'}. Best is trial 14 with value: 0.6526315789473683.
[32m[I 2023-04-26 15:44:27,439][39m Trial 214 finished with value: 0.6391752577319588 and parameters: {'algorithm': 'brute', 'n_neighbors': 12, 'weights': 'distance', 'metric': 'manhattan'}. Best is trial 14 with value: 0.6526315789473683.
[32m[I 2023-04-26 15:44:27,470][39m Trial 215 finished with value: 0.6304347826086957 and parameters: {'algorithm': 'kd_tree', 'n_neighbors': 10, 'weights': 'distance', 'metric': 'manhattan'}. Best is trial 14 with value: 0.6526315789473683.
[32m[I 2023-04-26 15:44:27,486][39m Trial 216 finished with value: 0.6526315789473683 and parameters: {'algorithm': 'kd_tree', 'n_neighbors': 11, 'weights': 'distance', 'metric': 'manhattan'}. Best is trial 14 with value: 0.6526315789473683.
[32m[I 2023-04-26 15:44:27,517][39m Trial 217 finished with value: 0.6304347826086957 and parameters: {'algorithm': 'kd_tree', 'n_neighbors': 10, 'weights': 'distance', 'metric': 'manhattan'}. Best is trial 14 with value: 0.6526315789473683.
[32m[I 2023-04-26 15:44:27,533][39m Trial 218 finished with value: 0.6526315789473683 and parameters: {'algorithm': 'ball_tree', 'n_neighbors': 13, 'weights': 'distance', 'metric': 'manhattan'}. Best is trial 14 with value: 0.6526315789473683.
[32m[I 2023-04-26 15:44:27,548][39m Trial 219 finished with value: 0.6153846153846154 and parameters: {'algorithm': 'ball_tree', 'n_neighbors': 8, 'weights': 'distance', 'metric': 'manhattan'}. Best is trial 14 with value: 0.6526315789473683.
[32m[I 2023-04-26 15:44:27,580][39m Trial 220 finished with value: 0.6526315789473683 and parameters: {'algorithm': 'auto', 'n_neighbors': 11, 'weights': 'distance', 'metric': 'manhattan'}. Best is trial 14 with value: 0.6526315789473683.
[32m[I 2023-04-26 15:44:27,595][39m Trial 221 finished with value: 0.6526315789473683 and parameters: {'algorithm': 'kd_tree', 'n_neighbors': 11, 'weights': 'distance', 'metric': 'manhattan'}. Best is trial 14 with value: 0.6526315789473683.
[32m[I 2023-04-26 15:44:27,611][39m Trial 222 finished with value: 0.6526315789473683 and parameters: {'algorithm': 'kd_tree', 'n_neighbors': 11, 'weights': 'distance', 'metric': 'manhattan'}. Best is trial 14 with value: 0.6526315789473683.
[32m[I 2023-04-26 15:44:27,673][39m Trial 223 finished with value: 0.6391752577319588 and parameters: {'algorithm': 'brute', 'n_neighbors': 12, 'weights': 'distance', 'metric': 'manhattan'}. Best is trial 14 with value: 0.6526315789473683.
[32m[I 2023-04-26 15:44:27,762][39m Trial 224 finished with value: 0.6526315789473683 and parameters: {'algorithm': 'brute', 'n_neighbors': 9, 'weights': 'distance', 'metric': 'manhattan'}. Best is trial 14 with value: 0.6526315789473683.
[32m[I 2023-04-26 15:44:27,831][39m Trial 225 finished with value: 0.6458333333333333 and parameters: {'algorithm': 'brute', 'n_neighbors': 14, 'weights': 'distance', 'metric': 'manhattan'}. Best is trial 14 with value: 0.6526315789473683.
[32m[I 2023-04-26 15:44:27,872][39m Trial 226 finished with value: 0.6304347826086957 and parameters: {'algorithm': 'auto', 'n_neighbors': 10, 'weights': 'distance', 'metric': 'manhattan'}. Best is trial 14 with value: 0.6526315789473683.
[32m[I 2023-04-26 15:44:27,893][39m Trial 227 finished with value: 0.6185567010309277 and parameters: {'algorithm': 'kd_tree', 'n_neighbors': 11, 'weights': 'distance', 'metric': 'minkowski'}. Best is trial 14 with value: 0.6526315789473683.
[32m[I 2023-04-26 15:44:27,909][39m Trial 228 finished with value: 0.6122448979591836 and parameters: {'algorithm': 'kd_tree', 'n_neighbors': 25, 'weights': 'distance', 'metric': 'manhattan'}. Best is trial 14 with value: 0.6526315789473683.
[32m[I 2023-04-26 15:44:27,941][39m Trial 229 finished with value: 0.5684210526315789 and parameters: {'algorithm': 'ball_tree', 'n_neighbors': 10, 'weights': 'uniform', 'metric': 'manhattan'}. Best is trial 14 with value: 0.6526315789473683.
[32m[I 2023-04-26 15:44:27,956][39m Trial 230 finished with value: 0.6526315789473683 and parameters: {'algorithm': 'kd_tree', 'n_neighbors': 11, 'weights': 'distance', 'metric': 'manhattan'}. Best is trial 14 with value: 0.6526315789473683.
[32m[I 2023-04-26 15:44:28,019][39m Trial 231 finished with value: 0.6391752577319588 and parameters: {'algorithm': 'brute', 'n_neighbors': 12, 'weights': 'distance', 'metric': 'manhattan'}. Best is trial 14 with value: 0.6526315789473683.
[32m[I 2023-04-26 15:44:28,106][39m Trial 232 finished with value: 0.6526315789473683 and parameters: {'algorithm': 'brute', 'n_neighbors': 9, 'weights': 'distance', 'metric': 'manhattan'}. Best is trial 14 with value: 0.6526315789473683.
[32m[I 2023-04-26 15:44:28,166][39m Trial 233 finished with value: 0.6153846153846154 and parameters: {'algorithm': 'brute', 'n_neighbors': 8, 'weights': 'distance', 'metric': 'manhattan'}. Best is trial 14 with value: 0.6526315789473683.
[32m[I 2023-04-26 15:44:28,255][39m Trial 234 finished with value: 0.6526315789473683 and parameters: {'algorithm': 'brute', 'n_neighbors': 9, 'weights': 'distance', 'metric': 'manhattan'}. Best is trial 14 with value: 0.6526315789473683.
[32m[I 2023-04-26 15:44:28,302][39m Trial 235 finished with value: 0.6304347826086957 and parameters: {'algorithm': 'brute', 'n_neighbors': 10, 'weights': 'distance', 'metric': 'manhattan'}. Best is trial 14 with value: 0.6526315789473683.
[32m[I 2023-04-26 15:44:28,317][39m Trial 236 finished with value: 0.6526315789473683 and parameters: {'algorithm': 'kd_tree', 'n_neighbors': 9, 'weights': 'distance', 'metric': 'manhattan'}. Best is trial 14 with value: 0.6526315789473683.
[32m[I 2023-04-26 15:44:28,348][39m Trial 237 finished with value: 0.6304347826086957 and parameters: {'algorithm': 'kd_tree', 'n_neighbors': 10, 'weights': 'distance', 'metric': 'manhattan'}. Best is trial 14 with value: 0.6526315789473683.
[32m[I 2023-04-26 15:44:28,364][39m Trial 238 finished with value: 0.6526315789473683 and parameters: {'algorithm': 'ball_tree', 'n_neighbors': 13, 'weights': 'distance', 'metric': 'manhattan'}. Best is trial 14 with value: 0.6526315789473683.
[32m[I 2023-04-26 15:44:28,395][39m Trial 239 finished with value: 0.6526315789473683 and parameters: {'algorithm': 'kd_tree', 'n_neighbors': 13, 'weights': 'distance', 'metric': 'manhattan'}. Best is trial 14 with value: 0.6526315789473683.
[32m[I 2023-04-26 15:44:28,442][39m Trial 240 finished with value: 0.6526315789473683 and parameters: {'algorithm': 'brute', 'n_neighbors': 13, 'weights': 'distance', 'metric': 'manhattan'}. Best is trial 14 with value: 0.6526315789473683.
[32m[I 2023-04-26 15:44:28,458][39m Trial 241 finished with value: 0.6526315789473683 and parameters: {'algorithm': 'kd_tree', 'n_neighbors': 11, 'weights': 'distance', 'metric': 'manhattan'}. Best is trial 14 with value: 0.6526315789473683.
[32m[I 2023-04-26 15:44:28,489][39m Trial 242 finished with value: 0.6526315789473683 and parameters: {'algorithm': 'kd_tree', 'n_neighbors': 11, 'weights': 'distance', 'metric': 'manhattan'}. Best is trial 14 with value: 0.6526315789473683.
[32m[I 2023-04-26 15:44:28,505][39m Trial 243 finished with value: 0.6391752577319588 and parameters: {'algorithm': 'kd_tree', 'n_neighbors': 12, 'weights': 'distance', 'metric': 'manhattan'}. Best is trial 14 with value: 0.6526315789473683.
[32m[I 2023-04-26 15:44:28,536][39m Trial 244 finished with value: 0.6526315789473683 and parameters: {'algorithm': 'ball_tree', 'n_neighbors': 9, 'weights': 'distance', 'metric': 'manhattan'}. Best is trial 14 with value: 0.6526315789473683.
[32m[I 2023-04-26 15:44:28,552][39m Trial 245 finished with value: 0.6526315789473683 and parameters: {'algorithm': 'ball_tree', 'n_neighbors': 9, 'weights': 'distance', 'metric': 'manhattan'}. Best is trial 14 with value: 0.6526315789473683.
[32m[I 2023-04-26 15:44:28,567][39m Trial 246 finished with value: 0.6526315789473683 and parameters: {'algorithm': 'ball_tree', 'n_neighbors': 9, 'weights': 'distance', 'metric': 'manhattan'}. Best is trial 14 with value: 0.6526315789473683.
[32m[I 2023-04-26 15:44:28,598][39m Trial 247 finished with value: 0.6304347826086957 and parameters: {'algorithm': 'ball_tree', 'n_neighbors': 10, 'weights': 'distance', 'metric': 'manhattan'}. Best is trial 14 with value: 0.6526315789473683.
[32m[I 2023-04-26 15:44:28,614][39m Trial 248 finished with value: 0.6153846153846154 and parameters: {'algorithm': 'ball_tree', 'n_neighbors': 8, 'weights': 'distance', 'metric': 'manhattan'}. Best is trial 14 with value: 0.6526315789473683.
[32m[I 2023-04-26 15:44:28,645][39m Trial 249 finished with value: 0.6373626373626374 and parameters: {'algorithm': 'auto', 'n_neighbors': 7, 'weights': 'distance', 'metric': 'manhattan'}. Best is trial 14 with value: 0.6526315789473683.
[32m[I 2023-04-26 15:44:28,661][39m Trial 250 finished with value: 0.6526315789473683 and parameters: {'algorithm': 'ball_tree', 'n_neighbors': 11, 'weights': 'distance', 'metric': 'manhattan'}. Best is trial 14 with value: 0.6526315789473683.
[32m[I 2023-04-26 15:44:28,692][39m Trial 251 finished with value: 0.6526315789473683 and parameters: {'algorithm': 'kd_tree', 'n_neighbors': 13, 'weights': 'distance', 'metric': 'manhattan'}. Best is trial 14 with value: 0.6526315789473683.
[32m[I 2023-04-26 15:44:28,755][39m Trial 252 finished with value: 0.6458333333333333 and parameters: {'algorithm': 'brute', 'n_neighbors': 14, 'weights': 'distance', 'metric': 'manhattan'}. Best is trial 14 with value: 0.6526315789473683.
[32m[I 2023-04-26 15:44:28,850][39m Trial 253 finished with value: 0.6153846153846154 and parameters: {'algorithm': 'brute', 'n_neighbors': 8, 'weights': 'distance', 'metric': 'manhattan'}. Best is trial 14 with value: 0.6526315789473683.
[32m[I 2023-04-26 15:44:28,913][39m Trial 254 finished with value: 0.5979381443298969 and parameters: {'algorithm': 'brute', 'n_neighbors': 12, 'weights': 'distance', 'metric': 'euclidean'}. Best is trial 14 with value: 0.6526315789473683.
[32m[I 2023-04-26 15:44:28,976][39m Trial 255 finished with value: 0.6458333333333333 and parameters: {'algorithm': 'brute', 'n_neighbors': 15, 'weights': 'distance', 'metric': 'manhattan'}. Best is trial 14 with value: 0.6526315789473683.
[32m[I 2023-04-26 15:44:29,023][39m Trial 256 finished with value: 0.6526315789473683 and parameters: {'algorithm': 'auto', 'n_neighbors': 9, 'weights': 'distance', 'metric': 'manhattan'}. Best is trial 14 with value: 0.6526315789473683.
[32m[I 2023-04-26 15:44:29,070][39m Trial 257 finished with value: 0.6458333333333333 and parameters: {'algorithm': 'brute', 'n_neighbors': 14, 'weights': 'distance', 'metric': 'manhattan'}. Best is trial 14 with value: 0.6526315789473683.
[32m[I 2023-04-26 15:44:29,086][39m Trial 258 finished with value: 0.6526315789473683 and parameters: {'algorithm': 'auto', 'n_neighbors': 13, 'weights': 'distance', 'metric': 'manhattan'}. Best is trial 14 with value: 0.6526315789473683.
[32m[I 2023-04-26 15:44:29,117][39m Trial 259 finished with value: 0.6041666666666666 and parameters: {'algorithm': 'kd_tree', 'n_neighbors': 13, 'weights': 'distance', 'metric': 'minkowski'}. Best is trial 14 with value: 0.6526315789473683.
[32m[I 2023-04-26 15:44:29,133][39m Trial 260 finished with value: 0.6526315789473683 and parameters: {'algorithm': 'kd_tree', 'n_neighbors': 11, 'weights': 'distance', 'metric': 'manhattan'}. Best is trial 14 with value: 0.6526315789473683.
[32m[I 2023-04-26 15:44:29,164][39m Trial 261 finished with value: 0.6391752577319588 and parameters: {'algorithm': 'kd_tree', 'n_neighbors': 12, 'weights': 'distance', 'metric': 'manhattan'}. Best is trial 14 with value: 0.6526315789473683.
[32m[I 2023-04-26 15:44:29,196][39m Trial 262 finished with value: 0.5684210526315789 and parameters: {'algorithm': 'ball_tree', 'n_neighbors': 10, 'weights': 'uniform', 'metric': 'manhattan'}. Best is trial 14 with value: 0.6526315789473683.
[32m[I 2023-04-26 15:44:29,243][39m Trial 263 finished with value: 0.6526315789473683 and parameters: {'algorithm': 'brute', 'n_neighbors': 13, 'weights': 'distance', 'metric': 'manhattan'}. Best is trial 14 with value: 0.6526315789473683.
[32m[I 2023-04-26 15:44:29,290][39m Trial 264 finished with value: 0.6046511627906976 and parameters: {'algorithm': 'kd_tree', 'n_neighbors': 1, 'weights': 'distance', 'metric': 'manhattan'}. Best is trial 14 with value: 0.6526315789473683.
[32m[I 2023-04-26 15:44:29,337][39m Trial 265 finished with value: 0.6391752577319588 and parameters: {'algorithm': 'brute', 'n_neighbors': 12, 'weights': 'distance', 'metric': 'manhattan'}. Best is trial 14 with value: 0.6526315789473683.
[32m[I 2023-04-26 15:44:29,352][39m Trial 266 finished with value: 0.6526315789473683 and parameters: {'algorithm': 'kd_tree', 'n_neighbors': 9, 'weights': 'distance', 'metric': 'manhattan'}. Best is trial 14 with value: 0.6526315789473683.
[32m[I 2023-04-26 15:44:29,399][39m Trial 267 finished with value: 0.6304347826086957 and parameters: {'algorithm': 'brute', 'n_neighbors': 10, 'weights': 'distance', 'metric': 'manhattan'}. Best is trial 14 with value: 0.6526315789473683.
[32m[I 2023-04-26 15:44:29,430][39m Trial 268 finished with value: 0.6526315789473683 and parameters: {'algorithm': 'ball_tree', 'n_neighbors': 9, 'weights': 'distance', 'metric': 'manhattan'}. Best is trial 14 with value: 0.6526315789473683.
[32m[I 2023-04-26 15:44:29,446][39m Trial 269 finished with value: 0.6526315789473683 and parameters: {'algorithm': 'ball_tree', 'n_neighbors': 11, 'weights': 'distance', 'metric': 'manhattan'}. Best is trial 14 with value: 0.6526315789473683.
