[32m[I 2023-04-26 15:44:29,477][39m Trial 270 finished with value: 0.6526315789473683 and parameters: {'algorithm': 'ball_tree', 'n_neighbors': 11, 'weights': 'distance', 'metric': 'manhattan'}. Best is trial 14 with value: 0.6526315789473683.
[32m[I 2023-04-26 15:44:29,493][39m Trial 271 finished with value: 0.6153846153846154 and parameters: {'algorithm': 'kd_tree', 'n_neighbors': 8, 'weights': 'distance', 'metric': 'manhattan'}. Best is trial 14 with value: 0.6526315789473683.
[32m[I 2023-04-26 15:44:29,540][39m Trial 272 finished with value: 0.6304347826086957 and parameters: {'algorithm': 'brute', 'n_neighbors': 10, 'weights': 'distance', 'metric': 'manhattan'}. Best is trial 14 with value: 0.6526315789473683.
[32m[I 2023-04-26 15:44:29,571][39m Trial 273 finished with value: 0.6526315789473683 and parameters: {'algorithm': 'ball_tree', 'n_neighbors': 11, 'weights': 'distance', 'metric': 'manhattan'}. Best is trial 14 with value: 0.6526315789473683.
[32m[I 2023-04-26 15:44:29,602][39m Trial 274 finished with value: 0.6185567010309277 and parameters: {'algorithm': 'ball_tree', 'n_neighbors': 11, 'weights': 'distance', 'metric': 'euclidean'}. Best is trial 14 with value: 0.6526315789473683.
[32m[I 2023-04-26 15:44:29,618][39m Trial 275 finished with value: 0.6526315789473683 and parameters: {'algorithm': 'auto', 'n_neighbors': 9, 'weights': 'distance', 'metric': 'manhattan'}. Best is trial 14 with value: 0.6526315789473683.
[32m[I 2023-04-26 15:44:29,649][39m Trial 276 finished with value: 0.6304347826086957 and parameters: {'algorithm': 'auto', 'n_neighbors': 10, 'weights': 'distance', 'metric': 'manhattan'}. Best is trial 14 with value: 0.6526315789473683.
[32m[I 2023-04-26 15:44:29,680][39m Trial 277 finished with value: 0.6526315789473683 and parameters: {'algorithm': 'auto', 'n_neighbors': 11, 'weights': 'distance', 'metric': 'manhattan'}. Best is trial 14 with value: 0.6526315789473683.
[32m[I 2023-04-26 15:44:29,696][39m Trial 278 finished with value: 0.6526315789473683 and parameters: {'algorithm': 'auto', 'n_neighbors': 11, 'weights': 'distance', 'metric': 'manhattan'}. Best is trial 14 with value: 0.6526315789473683.
[32m[I 2023-04-26 15:44:29,727][39m Trial 279 finished with value: 0.6153846153846154 and parameters: {'algorithm': 'kd_tree', 'n_neighbors': 8, 'weights': 'distance', 'metric': 'manhattan'}. Best is trial 14 with value: 0.6526315789473683.
[32m[I 2023-04-26 15:44:29,806][39m Trial 280 finished with value: 0.6391752577319588 and parameters: {'algorithm': 'brute', 'n_neighbors': 12, 'weights': 'distance', 'metric': 'manhattan'}. Best is trial 14 with value: 0.6526315789473683.
[32m[I 2023-04-26 15:44:29,869][39m Trial 281 finished with value: 0.6037735849056605 and parameters: {'algorithm': 'kd_tree', 'n_neighbors': 14, 'weights': 'uniform', 'metric': 'manhattan'}. Best is trial 14 with value: 0.6526315789473683.
[32m[I 2023-04-26 15:44:29,932][39m Trial 282 finished with value: 0.6122448979591836 and parameters: {'algorithm': 'brute', 'n_neighbors': 18, 'weights': 'distance', 'metric': 'manhattan'}. Best is trial 14 with value: 0.6526315789473683.
[32m[I 2023-04-26 15:44:29,979][39m Trial 283 finished with value: 0.6526315789473683 and parameters: {'algorithm': 'kd_tree', 'n_neighbors': 13, 'weights': 'distance', 'metric': 'manhattan'}. Best is trial 14 with value: 0.6526315789473683.
[32m[I 2023-04-26 15:44:29,995][39m Trial 284 finished with value: 0.6122448979591836 and parameters: {'algorithm': 'kd_tree', 'n_neighbors': 9, 'weights': 'distance', 'metric': 'minkowski'}. Best is trial 14 with value: 0.6526315789473683.
[32m[I 2023-04-26 15:44:30,026][39m Trial 285 finished with value: 0.6391752577319588 and parameters: {'algorithm': 'kd_tree', 'n_neighbors': 12, 'weights': 'distance', 'metric': 'manhattan'}. Best is trial 14 with value: 0.6526315789473683.
[32m[I 2023-04-26 15:44:30,042][39m Trial 286 finished with value: 0.6526315789473683 and parameters: {'algorithm': 'ball_tree', 'n_neighbors': 9, 'weights': 'distance', 'metric': 'manhattan'}. Best is trial 14 with value: 0.6526315789473683.
[32m[I 2023-04-26 15:44:30,073][39m Trial 287 finished with value: 0.6304347826086957 and parameters: {'algorithm': 'kd_tree', 'n_neighbors': 10, 'weights': 'distance', 'metric': 'manhattan'}. Best is trial 14 with value: 0.6526315789473683.
[32m[I 2023-04-26 15:44:30,152][39m Trial 288 finished with value: 0.6304347826086957 and parameters: {'algorithm': 'brute', 'n_neighbors': 10, 'weights': 'distance', 'metric': 'manhattan'}. Best is trial 14 with value: 0.6526315789473683.
[32m[I 2023-04-26 15:44:30,230][39m Trial 289 finished with value: 0.6526315789473683 and parameters: {'algorithm': 'brute', 'n_neighbors': 13, 'weights': 'distance', 'metric': 'manhattan'}. Best is trial 14 with value: 0.6526315789473683.
[32m[I 2023-04-26 15:44:30,308][39m Trial 290 finished with value: 0.6526315789473683 and parameters: {'algorithm': 'brute', 'n_neighbors': 13, 'weights': 'distance', 'metric': 'manhattan'}. Best is trial 14 with value: 0.6526315789473683.
[32m[I 2023-04-26 15:44:30,355][39m Trial 291 finished with value: 0.6373626373626374 and parameters: {'algorithm': 'brute', 'n_neighbors': 7, 'weights': 'distance', 'metric': 'manhattan'}. Best is trial 14 with value: 0.6526315789473683.
[32m[I 2023-04-26 15:44:30,402][39m Trial 292 finished with value: 0.6526315789473683 and parameters: {'algorithm': 'brute', 'n_neighbors': 9, 'weights': 'distance', 'metric': 'manhattan'}. Best is trial 14 with value: 0.6526315789473683.
[32m[I 2023-04-26 15:44:30,433][39m Trial 293 finished with value: 0.6153846153846154 and parameters: {'algorithm': 'kd_tree', 'n_neighbors': 8, 'weights': 'distance', 'metric': 'manhattan'}. Best is trial 14 with value: 0.6526315789473683.
[32m[I 2023-04-26 15:44:30,449][39m Trial 294 finished with value: 0.6526315789473683 and parameters: {'algorithm': 'kd_tree', 'n_neighbors': 13, 'weights': 'distance', 'metric': 'manhattan'}. Best is trial 14 with value: 0.6526315789473683.
[32m[I 2023-04-26 15:44:30,480][39m Trial 295 finished with value: 0.6458333333333333 and parameters: {'algorithm': 'kd_tree', 'n_neighbors': 14, 'weights': 'distance', 'metric': 'manhattan'}. Best is trial 14 with value: 0.6526315789473683.
[32m[I 2023-04-26 15:44:30,496][39m Trial 296 finished with value: 0.6526315789473683 and parameters: {'algorithm': 'kd_tree', 'n_neighbors': 9, 'weights': 'distance', 'metric': 'manhattan'}. Best is trial 14 with value: 0.6526315789473683.
[32m[I 2023-04-26 15:44:30,527][39m Trial 297 finished with value: 0.6304347826086957 and parameters: {'algorithm': 'kd_tree', 'n_neighbors': 10, 'weights': 'distance', 'metric': 'manhattan'}. Best is trial 14 with value: 0.6526315789473683.
[32m[I 2023-04-26 15:44:30,590][39m Trial 298 finished with value: 0.6105263157894738 and parameters: {'algorithm': 'brute', 'n_neighbors': 15, 'weights': 'distance', 'metric': 'euclidean'}. Best is trial 14 with value: 0.6526315789473683.
[32m[I 2023-04-26 15:44:30,653][39m Trial 299 finished with value: 0.5319148936170213 and parameters: {'algorithm': 'auto', 'n_neighbors': 8, 'weights': 'uniform', 'metric': 'manhattan'}. Best is trial 14 with value: 0.6526315789473683.
[32m[I 2023-04-26 15:44:30,684][39m Trial 300 finished with value: 0.6526315789473683 and parameters: {'algorithm': 'kd_tree', 'n_neighbors': 11, 'weights': 'distance', 'metric': 'manhattan'}. Best is trial 14 with value: 0.6526315789473683.
[32m[I 2023-04-26 15:44:30,715][39m Trial 301 finished with value: 0.6304347826086957 and parameters: {'algorithm': 'kd_tree', 'n_neighbors': 10, 'weights': 'distance', 'metric': 'manhattan'}. Best is trial 14 with value: 0.6526315789473683.
[32m[I 2023-04-26 15:44:30,762][39m Trial 302 finished with value: 0.6391752577319588 and parameters: {'algorithm': 'brute', 'n_neighbors': 12, 'weights': 'distance', 'metric': 'manhattan'}. Best is trial 14 with value: 0.6526315789473683.
[32m[I 2023-04-26 15:44:30,778][39m Trial 303 finished with value: 0.5842696629213483 and parameters: {'algorithm': 'ball_tree', 'n_neighbors': 3, 'weights': 'distance', 'metric': 'manhattan'}. Best is trial 14 with value: 0.6526315789473683.
[32m[I 2023-04-26 15:44:30,809][39m Trial 304 finished with value: 0.6122448979591836 and parameters: {'algorithm': 'ball_tree', 'n_neighbors': 9, 'weights': 'distance', 'metric': 'minkowski'}. Best is trial 14 with value: 0.6526315789473683.
[32m[I 2023-04-26 15:44:30,856][39m Trial 305 finished with value: 0.6458333333333333 and parameters: {'algorithm': 'brute', 'n_neighbors': 14, 'weights': 'distance', 'metric': 'manhattan'}. Best is trial 14 with value: 0.6526315789473683.
[32m[I 2023-04-26 15:44:30,903][39m Trial 306 finished with value: 0.6304347826086957 and parameters: {'algorithm': 'brute', 'n_neighbors': 10, 'weights': 'distance', 'metric': 'manhattan'}. Best is trial 14 with value: 0.6526315789473683.
[32m[I 2023-04-26 15:44:30,960][39m Trial 307 finished with value: 0.6526315789473683 and parameters: {'algorithm': 'brute', 'n_neighbors': 9, 'weights': 'distance', 'metric': 'manhattan'}. Best is trial 14 with value: 0.6526315789473683.
[32m[I 2023-04-26 15:44:30,993][39m Trial 308 finished with value: 0.6526315789473683 and parameters: {'algorithm': 'kd_tree', 'n_neighbors': 11, 'weights': 'distance', 'metric': 'manhattan'}. Best is trial 14 with value: 0.6526315789473683.
[32m[I 2023-04-26 15:44:31,014][39m Trial 309 finished with value: 0.6304347826086957 and parameters: {'algorithm': 'ball_tree', 'n_neighbors': 10, 'weights': 'distance', 'metric': 'manhattan'}. Best is trial 14 with value: 0.6526315789473683.
[32m[I 2023-04-26 15:44:31,030][39m Trial 310 finished with value: 0.6153846153846154 and parameters: {'algorithm': 'ball_tree', 'n_neighbors': 8, 'weights': 'distance', 'metric': 'manhattan'}. Best is trial 14 with value: 0.6526315789473683.
[32m[I 2023-04-26 15:44:31,061][39m Trial 311 finished with value: 0.6526315789473683 and parameters: {'algorithm': 'auto', 'n_neighbors': 13, 'weights': 'distance', 'metric': 'manhattan'}. Best is trial 14 with value: 0.6526315789473683.
[32m[I 2023-04-26 15:44:31,077][39m Trial 312 finished with value: 0.6526315789473683 and parameters: {'algorithm': 'auto', 'n_neighbors': 11, 'weights': 'distance', 'metric': 'manhattan'}. Best is trial 14 with value: 0.6526315789473683.
[32m[I 2023-04-26 15:44:31,108][39m Trial 313 finished with value: 0.6391752577319588 and parameters: {'algorithm': 'ball_tree', 'n_neighbors': 12, 'weights': 'distance', 'metric': 'manhattan'}. Best is trial 14 with value: 0.6526315789473683.
[32m[I 2023-04-26 15:44:31,124][39m Trial 314 finished with value: 0.6391752577319588 and parameters: {'algorithm': 'auto', 'n_neighbors': 12, 'weights': 'distance', 'metric': 'manhattan'}. Best is trial 14 with value: 0.6526315789473683.
[32m[I 2023-04-26 15:44:31,158][39m Trial 315 finished with value: 0.6526315789473683 and parameters: {'algorithm': 'kd_tree', 'n_neighbors': 9, 'weights': 'distance', 'metric': 'manhattan'}. Best is trial 14 with value: 0.6526315789473683.
[32m[I 2023-04-26 15:44:31,187][39m Trial 316 finished with value: 0.6153846153846154 and parameters: {'algorithm': 'kd_tree', 'n_neighbors': 8, 'weights': 'distance', 'metric': 'manhattan'}. Best is trial 14 with value: 0.6526315789473683.
[32m[I 2023-04-26 15:44:31,234][39m Trial 317 finished with value: 0.6526315789473683 and parameters: {'algorithm': 'kd_tree', 'n_neighbors': 9, 'weights': 'distance', 'metric': 'manhattan'}. Best is trial 14 with value: 0.6526315789473683.
[32m[I 2023-04-26 15:44:31,281][39m Trial 318 finished with value: 0.6037735849056605 and parameters: {'algorithm': 'brute', 'n_neighbors': 7, 'weights': 'uniform', 'metric': 'manhattan'}. Best is trial 14 with value: 0.6526315789473683.
[32m[I 2023-04-26 15:44:31,343][39m Trial 319 finished with value: 0.6526315789473683 and parameters: {'algorithm': 'brute', 'n_neighbors': 11, 'weights': 'distance', 'metric': 'manhattan'}. Best is trial 14 with value: 0.6526315789473683.
[32m[I 2023-04-26 15:44:31,375][39m Trial 320 finished with value: 0.6526315789473683 and parameters: {'algorithm': 'kd_tree', 'n_neighbors': 9, 'weights': 'distance', 'metric': 'manhattan'}. Best is trial 14 with value: 0.6526315789473683.
[32m[I 2023-04-26 15:44:31,437][39m Trial 321 finished with value: 0.6153846153846154 and parameters: {'algorithm': 'brute', 'n_neighbors': 8, 'weights': 'distance', 'metric': 'manhattan'}. Best is trial 14 with value: 0.6526315789473683.
[32m[I 2023-04-26 15:44:31,468][39m Trial 322 finished with value: 0.6041666666666666 and parameters: {'algorithm': 'ball_tree', 'n_neighbors': 8, 'weights': 'distance', 'metric': 'euclidean'}. Best is trial 14 with value: 0.6526315789473683.
[32m[I 2023-04-26 15:44:31,484][39m Trial 323 finished with value: 0.6304347826086957 and parameters: {'algorithm': 'kd_tree', 'n_neighbors': 10, 'weights': 'distance', 'metric': 'manhattan'}. Best is trial 14 with value: 0.6526315789473683.
[32m[I 2023-04-26 15:44:31,516][39m Trial 324 finished with value: 0.6526315789473683 and parameters: {'algorithm': 'auto', 'n_neighbors': 13, 'weights': 'distance', 'metric': 'manhattan'}. Best is trial 14 with value: 0.6526315789473683.
[32m[I 2023-04-26 15:44:31,531][39m Trial 325 finished with value: 0.6526315789473683 and parameters: {'algorithm': 'auto', 'n_neighbors': 11, 'weights': 'distance', 'metric': 'manhattan'}. Best is trial 14 with value: 0.6526315789473683.
[32m[I 2023-04-26 15:44:31,562][39m Trial 326 finished with value: 0.6304347826086957 and parameters: {'algorithm': 'kd_tree', 'n_neighbors': 10, 'weights': 'distance', 'metric': 'manhattan'}. Best is trial 14 with value: 0.6526315789473683.
[32m[I 2023-04-26 15:44:31,578][39m Trial 327 finished with value: 0.6526315789473683 and parameters: {'algorithm': 'ball_tree', 'n_neighbors': 13, 'weights': 'distance', 'metric': 'manhattan'}. Best is trial 14 with value: 0.6526315789473683.
[32m[I 2023-04-26 15:44:31,609][39m Trial 328 finished with value: 0.6391752577319588 and parameters: {'algorithm': 'kd_tree', 'n_neighbors': 12, 'weights': 'distance', 'metric': 'manhattan'}. Best is trial 14 with value: 0.6526315789473683.
[32m[I 2023-04-26 15:44:31,641][39m Trial 329 finished with value: 0.6041666666666666 and parameters: {'algorithm': 'ball_tree', 'n_neighbors': 13, 'weights': 'distance', 'metric': 'minkowski'}. Best is trial 14 with value: 0.6526315789473683.
[32m[I 2023-04-26 15:44:31,750][39m Trial 330 finished with value: 0.6391752577319588 and parameters: {'algorithm': 'brute', 'n_neighbors': 12, 'weights': 'distance', 'metric': 'manhattan'}. Best is trial 14 with value: 0.6526315789473683.
[32m[I 2023-04-26 15:44:31,766][39m Trial 331 finished with value: 0.6526315789473683 and parameters: {'algorithm': 'kd_tree', 'n_neighbors': 11, 'weights': 'distance', 'metric': 'manhattan'}. Best is trial 14 with value: 0.6526315789473683.
[32m[I 2023-04-26 15:44:31,797][39m Trial 332 finished with value: 0.6458333333333333 and parameters: {'algorithm': 'kd_tree', 'n_neighbors': 16, 'weights': 'distance', 'metric': 'manhattan'}. Best is trial 14 with value: 0.6526315789473683.
[32m[I 2023-04-26 15:44:31,813][39m Trial 333 finished with value: 0.6304347826086957 and parameters: {'algorithm': 'ball_tree', 'n_neighbors': 10, 'weights': 'distance', 'metric': 'manhattan'}. Best is trial 14 with value: 0.6526315789473683.
[32m[I 2023-04-26 15:44:31,844][39m Trial 334 finished with value: 0.6458333333333333 and parameters: {'algorithm': 'ball_tree', 'n_neighbors': 14, 'weights': 'distance', 'metric': 'manhattan'}. Best is trial 14 with value: 0.6526315789473683.
[32m[I 2023-04-26 15:44:31,876][39m Trial 335 finished with value: 0.6304347826086957 and parameters: {'algorithm': 'kd_tree', 'n_neighbors': 10, 'weights': 'distance', 'metric': 'manhattan'}. Best is trial 14 with value: 0.6526315789473683.
[32m[I 2023-04-26 15:44:31,939][39m Trial 336 finished with value: 0.6458333333333333 and parameters: {'algorithm': 'brute', 'n_neighbors': 15, 'weights': 'distance', 'metric': 'manhattan'}. Best is trial 14 with value: 0.6526315789473683.
[32m[I 2023-04-26 15:44:32,002][39m Trial 337 finished with value: 0.6304347826086957 and parameters: {'algorithm': 'kd_tree', 'n_neighbors': 10, 'weights': 'distance', 'metric': 'manhattan'}. Best is trial 14 with value: 0.6526315789473683.
[32m[I 2023-04-26 15:44:32,050][39m Trial 338 finished with value: 0.6037735849056605 and parameters: {'algorithm': 'ball_tree', 'n_neighbors': 14, 'weights': 'uniform', 'metric': 'manhattan'}. Best is trial 14 with value: 0.6526315789473683.
[32m[I 2023-04-26 15:44:32,097][39m Trial 339 finished with value: 0.6526315789473683 and parameters: {'algorithm': 'brute', 'n_neighbors': 9, 'weights': 'distance', 'metric': 'manhattan'}. Best is trial 14 with value: 0.6526315789473683.
[32m[I 2023-04-26 15:44:32,163][39m Trial 340 finished with value: 0.6526315789473683 and parameters: {'algorithm': 'kd_tree', 'n_neighbors': 9, 'weights': 'distance', 'metric': 'manhattan'}. Best is trial 14 with value: 0.6526315789473683.
[32m[I 2023-04-26 15:44:32,192][39m Trial 341 finished with value: 0.6526315789473683 and parameters: {'algorithm': 'auto', 'n_neighbors': 9, 'weights': 'distance', 'metric': 'manhattan'}. Best is trial 14 with value: 0.6526315789473683.
[32m[I 2023-04-26 15:44:32,207][39m Trial 342 finished with value: 0.6373626373626374 and parameters: {'algorithm': 'kd_tree', 'n_neighbors': 7, 'weights': 'distance', 'metric': 'manhattan'}. Best is trial 14 with value: 0.6526315789473683.
[32m[I 2023-04-26 15:44:32,238][39m Trial 343 finished with value: 0.6391752577319588 and parameters: {'algorithm': 'kd_tree', 'n_neighbors': 12, 'weights': 'distance', 'metric': 'manhattan'}. Best is trial 14 with value: 0.6526315789473683.
[32m[I 2023-04-26 15:44:32,269][39m Trial 344 finished with value: 0.6185567010309277 and parameters: {'algorithm': 'auto', 'n_neighbors': 11, 'weights': 'distance', 'metric': 'euclidean'}. Best is trial 14 with value: 0.6526315789473683.
[32m[I 2023-04-26 15:44:32,332][39m Trial 345 finished with value: 0.6526315789473683 and parameters: {'algorithm': 'brute', 'n_neighbors': 11, 'weights': 'distance', 'metric': 'manhattan'}. Best is trial 14 with value: 0.6526315789473683.
[32m[I 2023-04-26 15:44:32,379][39m Trial 346 finished with value: 0.6391752577319588 and parameters: {'algorithm': 'auto', 'n_neighbors': 12, 'weights': 'distance', 'metric': 'manhattan'}. Best is trial 14 with value: 0.6526315789473683.
[32m[I 2023-04-26 15:44:32,426][39m Trial 347 finished with value: 0.6458333333333333 and parameters: {'algorithm': 'auto', 'n_neighbors': 14, 'weights': 'distance', 'metric': 'manhattan'}. Best is trial 14 with value: 0.6526315789473683.
[32m[I 2023-04-26 15:44:32,441][39m Trial 348 finished with value: 0.6153846153846154 and parameters: {'algorithm': 'auto', 'n_neighbors': 8, 'weights': 'distance', 'metric': 'manhattan'}. Best is trial 14 with value: 0.6526315789473683.
[32m[I 2023-04-26 15:44:32,473][39m Trial 349 finished with value: 0.6526315789473683 and parameters: {'algorithm': 'auto', 'n_neighbors': 11, 'weights': 'distance', 'metric': 'manhattan'}. Best is trial 14 with value: 0.6526315789473683.
[32m[I 2023-04-26 15:44:32,535][39m Trial 350 finished with value: 0.6041666666666666 and parameters: {'algorithm': 'brute', 'n_neighbors': 13, 'weights': 'distance', 'metric': 'minkowski'}. Best is trial 14 with value: 0.6526315789473683.
[32m[I 2023-04-26 15:44:32,591][39m Trial 351 finished with value: 0.6304347826086957 and parameters: {'algorithm': 'kd_tree', 'n_neighbors': 10, 'weights': 'distance', 'metric': 'manhattan'}. Best is trial 14 with value: 0.6526315789473683.
[32m[I 2023-04-26 15:44:32,612][39m Trial 352 finished with value: 0.6526315789473683 and parameters: {'algorithm': 'auto', 'n_neighbors': 9, 'weights': 'distance', 'metric': 'manhattan'}. Best is trial 14 with value: 0.6526315789473683.
[32m[I 2023-04-26 15:44:32,675][39m Trial 353 finished with value: 0.6391752577319588 and parameters: {'algorithm': 'brute', 'n_neighbors': 12, 'weights': 'distance', 'metric': 'manhattan'}. Best is trial 14 with value: 0.6526315789473683.
[32m[I 2023-04-26 15:44:32,753][39m Trial 354 finished with value: 0.6526315789473683 and parameters: {'algorithm': 'brute', 'n_neighbors': 11, 'weights': 'distance', 'metric': 'manhattan'}. Best is trial 14 with value: 0.6526315789473683.
[32m[I 2023-04-26 15:44:32,816][39m Trial 355 finished with value: 0.6391752577319588 and parameters: {'algorithm': 'brute', 'n_neighbors': 12, 'weights': 'distance', 'metric': 'manhattan'}. Best is trial 14 with value: 0.6526315789473683.
[32m[I 2023-04-26 15:44:32,870][39m Trial 356 finished with value: 0.6153846153846154 and parameters: {'algorithm': 'brute', 'n_neighbors': 6, 'weights': 'distance', 'metric': 'manhattan'}. Best is trial 14 with value: 0.6526315789473683.
[32m[I 2023-04-26 15:44:32,894][39m Trial 357 finished with value: 0.6304347826086957 and parameters: {'algorithm': 'auto', 'n_neighbors': 10, 'weights': 'distance', 'metric': 'manhattan'}. Best is trial 14 with value: 0.6526315789473683.
[32m[I 2023-04-26 15:44:32,926][39m Trial 358 finished with value: 0.5319148936170213 and parameters: {'algorithm': 'ball_tree', 'n_neighbors': 8, 'weights': 'uniform', 'metric': 'manhattan'}. Best is trial 14 with value: 0.6526315789473683.
[32m[I 2023-04-26 15:44:32,958][39m Trial 359 finished with value: 0.6304347826086957 and parameters: {'algorithm': 'kd_tree', 'n_neighbors': 10, 'weights': 'distance', 'metric': 'manhattan'}. Best is trial 14 with value: 0.6526315789473683.
