[32m[I 2023-04-26 15:44:37,112][39m Trial 462 finished with value: 0.6373626373626374 and parameters: {'algorithm': 'auto', 'n_neighbors': 7, 'weights': 'distance', 'metric': 'manhattan'}. Best is trial 14 with value: 0.6526315789473683.
[32m[I 2023-04-26 15:44:37,143][39m Trial 463 finished with value: 0.6105263157894738 and parameters: {'algorithm': 'kd_tree', 'n_neighbors': 15, 'weights': 'distance', 'metric': 'minkowski'}. Best is trial 14 with value: 0.6526315789473683.
[32m[I 2023-04-26 15:44:37,175][39m Trial 464 finished with value: 0.6458333333333333 and parameters: {'algorithm': 'ball_tree', 'n_neighbors': 14, 'weights': 'distance', 'metric': 'manhattan'}. Best is trial 14 with value: 0.6526315789473683.
[32m[I 2023-04-26 15:44:37,190][39m Trial 465 finished with value: 0.6526315789473683 and parameters: {'algorithm': 'auto', 'n_neighbors': 11, 'weights': 'distance', 'metric': 'manhattan'}. Best is trial 14 with value: 0.6526315789473683.
[32m[I 2023-04-26 15:44:37,238][39m Trial 466 finished with value: 0.6391752577319588 and parameters: {'algorithm': 'kd_tree', 'n_neighbors': 12, 'weights': 'distance', 'metric': 'manhattan'}. Best is trial 14 with value: 0.6526315789473683.
[32m[I 2023-04-26 15:44:37,269][39m Trial 467 finished with value: 0.6526315789473683 and parameters: {'algorithm': 'auto', 'n_neighbors': 11, 'weights': 'distance', 'metric': 'manhattan'}. Best is trial 14 with value: 0.6526315789473683.
[32m[I 2023-04-26 15:44:37,316][39m Trial 468 finished with value: 0.6304347826086957 and parameters: {'algorithm': 'auto', 'n_neighbors': 10, 'weights': 'distance', 'metric': 'manhattan'}. Best is trial 14 with value: 0.6526315789473683.
[32m[I 2023-04-26 15:44:37,347][39m Trial 469 finished with value: 0.6526315789473683 and parameters: {'algorithm': 'auto', 'n_neighbors': 9, 'weights': 'distance', 'metric': 'manhattan'}. Best is trial 14 with value: 0.6526315789473683.
[32m[I 2023-04-26 15:44:37,378][39m Trial 470 finished with value: 0.6526315789473683 and parameters: {'algorithm': 'kd_tree', 'n_neighbors': 13, 'weights': 'distance', 'metric': 'manhattan'}. Best is trial 14 with value: 0.6526315789473683.
[32m[I 2023-04-26 15:44:37,410][39m Trial 471 finished with value: 0.6526315789473683 and parameters: {'algorithm': 'auto', 'n_neighbors': 11, 'weights': 'distance', 'metric': 'manhattan'}. Best is trial 14 with value: 0.6526315789473683.
[32m[I 2023-04-26 15:44:37,488][39m Trial 472 finished with value: 0.6153846153846154 and parameters: {'algorithm': 'brute', 'n_neighbors': 8, 'weights': 'distance', 'metric': 'manhattan'}. Best is trial 14 with value: 0.6526315789473683.
[32m[I 2023-04-26 15:44:37,566][39m Trial 473 finished with value: 0.6304347826086957 and parameters: {'algorithm': 'kd_tree', 'n_neighbors': 10, 'weights': 'distance', 'metric': 'manhattan'}. Best is trial 14 with value: 0.6526315789473683.
[32m[I 2023-04-26 15:44:37,597][39m Trial 474 finished with value: 0.6526315789473683 and parameters: {'algorithm': 'auto', 'n_neighbors': 11, 'weights': 'distance', 'metric': 'manhattan'}. Best is trial 14 with value: 0.6526315789473683.
[32m[I 2023-04-26 15:44:37,628][39m Trial 475 finished with value: 0.6526315789473683 and parameters: {'algorithm': 'auto', 'n_neighbors': 11, 'weights': 'distance', 'metric': 'manhattan'}. Best is trial 14 with value: 0.6526315789473683.
[32m[I 2023-04-26 15:44:37,660][39m Trial 476 finished with value: 0.6526315789473683 and parameters: {'algorithm': 'auto', 'n_neighbors': 11, 'weights': 'distance', 'metric': 'manhattan'}. Best is trial 14 with value: 0.6526315789473683.
[32m[I 2023-04-26 15:44:37,691][39m Trial 477 finished with value: 0.5961538461538461 and parameters: {'algorithm': 'ball_tree', 'n_neighbors': 16, 'weights': 'uniform', 'metric': 'manhattan'}. Best is trial 14 with value: 0.6526315789473683.
[32m[I 2023-04-26 15:44:37,722][39m Trial 478 finished with value: 0.6391752577319588 and parameters: {'algorithm': 'ball_tree', 'n_neighbors': 12, 'weights': 'distance', 'metric': 'manhattan'}. Best is trial 14 with value: 0.6526315789473683.
[32m[I 2023-04-26 15:44:37,753][39m Trial 479 finished with value: 0.6391752577319588 and parameters: {'algorithm': 'kd_tree', 'n_neighbors': 12, 'weights': 'distance', 'metric': 'manhattan'}. Best is trial 14 with value: 0.6526315789473683.
[32m[I 2023-04-26 15:44:37,784][39m Trial 480 finished with value: 0.6041666666666666 and parameters: {'algorithm': 'kd_tree', 'n_neighbors': 13, 'weights': 'distance', 'metric': 'euclidean'}. Best is trial 14 with value: 0.6526315789473683.
[32m[I 2023-04-26 15:44:37,816][39m Trial 481 finished with value: 0.6526315789473683 and parameters: {'algorithm': 'ball_tree', 'n_neighbors': 13, 'weights': 'distance', 'metric': 'manhattan'}. Best is trial 14 with value: 0.6526315789473683.
[32m[I 2023-04-26 15:44:37,847][39m Trial 482 finished with value: 0.6458333333333333 and parameters: {'algorithm': 'ball_tree', 'n_neighbors': 14, 'weights': 'distance', 'metric': 'manhattan'}. Best is trial 14 with value: 0.6526315789473683.
[32m[I 2023-04-26 15:44:37,894][39m Trial 483 finished with value: 0.6391752577319588 and parameters: {'algorithm': 'kd_tree', 'n_neighbors': 12, 'weights': 'distance', 'metric': 'manhattan'}. Best is trial 14 with value: 0.6526315789473683.
[32m[I 2023-04-26 15:44:37,925][39m Trial 484 finished with value: 0.6526315789473683 and parameters: {'algorithm': 'kd_tree', 'n_neighbors': 9, 'weights': 'distance', 'metric': 'manhattan'}. Best is trial 14 with value: 0.6526315789473683.
[32m[I 2023-04-26 15:44:37,964][39m Trial 485 finished with value: 0.6373626373626374 and parameters: {'algorithm': 'ball_tree', 'n_neighbors': 7, 'weights': 'distance', 'metric': 'manhattan'}. Best is trial 14 with value: 0.6526315789473683.
[32m[I 2023-04-26 15:44:38,052][39m Trial 486 finished with value: 0.6122448979591836 and parameters: {'algorithm': 'brute', 'n_neighbors': 9, 'weights': 'distance', 'metric': 'minkowski'}. Best is trial 14 with value: 0.6526315789473683.
[32m[I 2023-04-26 15:44:38,115][39m Trial 487 finished with value: 0.6304347826086957 and parameters: {'algorithm': 'kd_tree', 'n_neighbors': 10, 'weights': 'distance', 'metric': 'manhattan'}. Best is trial 14 with value: 0.6526315789473683.
[32m[I 2023-04-26 15:44:38,146][39m Trial 488 finished with value: 0.6153846153846154 and parameters: {'algorithm': 'kd_tree', 'n_neighbors': 8, 'weights': 'distance', 'metric': 'manhattan'}. Best is trial 14 with value: 0.6526315789473683.
[32m[I 2023-04-26 15:44:38,178][39m Trial 489 finished with value: 0.6526315789473683 and parameters: {'algorithm': 'kd_tree', 'n_neighbors': 9, 'weights': 'distance', 'metric': 'manhattan'}. Best is trial 14 with value: 0.6526315789473683.
[32m[I 2023-04-26 15:44:38,209][39m Trial 490 finished with value: 0.6458333333333333 and parameters: {'algorithm': 'ball_tree', 'n_neighbors': 15, 'weights': 'distance', 'metric': 'manhattan'}. Best is trial 14 with value: 0.6526315789473683.
[32m[I 2023-04-26 15:44:38,241][39m Trial 491 finished with value: 0.6391752577319588 and parameters: {'algorithm': 'kd_tree', 'n_neighbors': 12, 'weights': 'distance', 'metric': 'manhattan'}. Best is trial 14 with value: 0.6526315789473683.
[32m[I 2023-04-26 15:44:38,304][39m Trial 492 finished with value: 0.6153846153846154 and parameters: {'algorithm': 'brute', 'n_neighbors': 8, 'weights': 'distance', 'metric': 'manhattan'}. Best is trial 14 with value: 0.6526315789473683.
[32m[I 2023-04-26 15:44:38,398][39m Trial 493 finished with value: 0.6526315789473683 and parameters: {'algorithm': 'brute', 'n_neighbors': 9, 'weights': 'distance', 'metric': 'manhattan'}. Best is trial 14 with value: 0.6526315789473683.
[32m[I 2023-04-26 15:44:38,446][39m Trial 494 finished with value: 0.6458333333333333 and parameters: {'algorithm': 'ball_tree', 'n_neighbors': 14, 'weights': 'distance', 'metric': 'manhattan'}. Best is trial 14 with value: 0.6526315789473683.
[32m[I 2023-04-26 15:44:38,492][39m Trial 495 finished with value: 0.5523809523809524 and parameters: {'algorithm': 'brute', 'n_neighbors': 9, 'weights': 'uniform', 'metric': 'manhattan'}. Best is trial 14 with value: 0.6526315789473683.
[32m[I 2023-04-26 15:44:38,524][39m Trial 496 finished with value: 0.6526315789473683 and parameters: {'algorithm': 'ball_tree', 'n_neighbors': 13, 'weights': 'distance', 'metric': 'manhattan'}. Best is trial 14 with value: 0.6526315789473683.
[32m[I 2023-04-26 15:44:38,555][39m Trial 497 finished with value: 0.6526315789473683 and parameters: {'algorithm': 'kd_tree', 'n_neighbors': 13, 'weights': 'distance', 'metric': 'manhattan'}. Best is trial 14 with value: 0.6526315789473683.
[32m[I 2023-04-26 15:44:38,586][39m Trial 498 finished with value: 0.6526315789473683 and parameters: {'algorithm': 'kd_tree', 'n_neighbors': 13, 'weights': 'distance', 'metric': 'manhattan'}. Best is trial 14 with value: 0.6526315789473683.
[32m[I 2023-04-26 15:44:38,617][39m Trial 499 finished with value: 0.6526315789473683 and parameters: {'algorithm': 'auto', 'n_neighbors': 11, 'weights': 'distance', 'metric': 'manhattan'}. Best is trial 14 with value: 0.6526315789473683.
Number of finished trials: 500