[32m[I 2023-04-26 15:44:22,815][39m Trial 90 finished with value: 0.6304347826086957 and parameters: {'algorithm': 'brute', 'n_neighbors': 10, 'weights': 'distance', 'metric': 'manhattan'}. Best is trial 14 with value: 0.6526315789473683.
[32m[I 2023-04-26 15:44:22,862][39m Trial 91 finished with value: 0.6526315789473683 and parameters: {'algorithm': 'brute', 'n_neighbors': 13, 'weights': 'distance', 'metric': 'manhattan'}. Best is trial 14 with value: 0.6526315789473683.
[32m[I 2023-04-26 15:44:22,957][39m Trial 92 finished with value: 0.6526315789473683 and parameters: {'algorithm': 'brute', 'n_neighbors': 9, 'weights': 'distance', 'metric': 'manhattan'}. Best is trial 14 with value: 0.6526315789473683.
[32m[I 2023-04-26 15:44:22,972][39m Trial 93 finished with value: 0.6526315789473683 and parameters: {'algorithm': 'ball_tree', 'n_neighbors': 9, 'weights': 'distance', 'metric': 'manhattan'}. Best is trial 14 with value: 0.6526315789473683.
[32m[I 2023-04-26 15:44:23,019][39m Trial 94 finished with value: 0.6526315789473683 and parameters: {'algorithm': 'brute', 'n_neighbors': 9, 'weights': 'distance', 'metric': 'manhattan'}. Best is trial 14 with value: 0.6526315789473683.
[32m[I 2023-04-26 15:44:23,067][39m Trial 95 finished with value: 0.6153846153846154 and parameters: {'algorithm': 'brute', 'n_neighbors': 8, 'weights': 'distance', 'metric': 'manhattan'}. Best is trial 14 with value: 0.6526315789473683.
[32m[I 2023-04-26 15:44:23,082][39m Trial 96 finished with value: 0.6526315789473683 and parameters: {'algorithm': 'kd_tree', 'n_neighbors': 11, 'weights': 'distance', 'metric': 'manhattan'}. Best is trial 14 with value: 0.6526315789473683.
[32m[I 2023-04-26 15:44:23,097][39m Trial 97 finished with value: 0.6526315789473683 and parameters: {'algorithm': 'kd_tree', 'n_neighbors': 11, 'weights': 'distance', 'metric': 'manhattan'}. Best is trial 14 with value: 0.6526315789473683.
[32m[I 2023-04-26 15:44:23,128][39m Trial 98 finished with value: 0.6458333333333333 and parameters: {'algorithm': 'kd_tree', 'n_neighbors': 15, 'weights': 'distance', 'metric': 'manhattan'}. Best is trial 14 with value: 0.6526315789473683.
[32m[I 2023-04-26 15:44:23,144][39m Trial 99 finished with value: 0.6041666666666666 and parameters: {'algorithm': 'kd_tree', 'n_neighbors': 13, 'weights': 'distance', 'metric': 'euclidean'}. Best is trial 14 with value: 0.6526315789473683.
[32m[I 2023-04-26 15:44:23,160][39m Trial 100 finished with value: 0.6078431372549019 and parameters: {'algorithm': 'kd_tree', 'n_neighbors': 12, 'weights': 'uniform', 'metric': 'manhattan'}. Best is trial 14 with value: 0.6526315789473683.
[32m[I 2023-04-26 15:44:23,207][39m Trial 101 finished with value: 0.6391752577319588 and parameters: {'algorithm': 'brute', 'n_neighbors': 12, 'weights': 'distance', 'metric': 'manhattan'}. Best is trial 14 with value: 0.6526315789473683.
[32m[I 2023-04-26 15:44:23,239][39m Trial 102 finished with value: 0.6304347826086957 and parameters: {'algorithm': 'auto', 'n_neighbors': 10, 'weights': 'distance', 'metric': 'manhattan'}. Best is trial 14 with value: 0.6526315789473683.
[32m[I 2023-04-26 15:44:23,254][39m Trial 103 finished with value: 0.6458333333333333 and parameters: {'algorithm': 'auto', 'n_neighbors': 14, 'weights': 'distance', 'metric': 'manhattan'}. Best is trial 14 with value: 0.6526315789473683.
[32m[I 2023-04-26 15:44:23,270][39m Trial 104 finished with value: 0.6304347826086957 and parameters: {'algorithm': 'auto', 'n_neighbors': 10, 'weights': 'distance', 'metric': 'manhattan'}. Best is trial 14 with value: 0.6526315789473683.
[32m[I 2023-04-26 15:44:23,285][39m Trial 105 finished with value: 0.6526315789473683 and parameters: {'algorithm': 'auto', 'n_neighbors': 11, 'weights': 'distance', 'metric': 'manhattan'}. Best is trial 14 with value: 0.6526315789473683.
[32m[I 2023-04-26 15:44:23,332][39m Trial 106 finished with value: 0.5918367346938775 and parameters: {'algorithm': 'brute', 'n_neighbors': 7, 'weights': 'distance', 'metric': 'minkowski'}. Best is trial 14 with value: 0.6526315789473683.
[32m[I 2023-04-26 15:44:23,364][39m Trial 107 finished with value: 0.6526315789473683 and parameters: {'algorithm': 'kd_tree', 'n_neighbors': 11, 'weights': 'distance', 'metric': 'manhattan'}. Best is trial 14 with value: 0.6526315789473683.
[32m[I 2023-04-26 15:44:23,395][39m Trial 108 finished with value: 0.6391752577319588 and parameters: {'algorithm': 'brute', 'n_neighbors': 12, 'weights': 'distance', 'metric': 'manhattan'}. Best is trial 14 with value: 0.6526315789473683.
[32m[I 2023-04-26 15:44:23,410][39m Trial 109 finished with value: 0.6249999999999999 and parameters: {'algorithm': 'auto', 'n_neighbors': 17, 'weights': 'distance', 'metric': 'manhattan'}. Best is trial 14 with value: 0.6526315789473683.
[32m[I 2023-04-26 15:44:23,442][39m Trial 110 finished with value: 0.6153846153846154 and parameters: {'algorithm': 'ball_tree', 'n_neighbors': 8, 'weights': 'distance', 'metric': 'manhattan'}. Best is trial 14 with value: 0.6526315789473683.
[32m[I 2023-04-26 15:44:23,473][39m Trial 111 finished with value: 0.6526315789473683 and parameters: {'algorithm': 'brute', 'n_neighbors': 13, 'weights': 'distance', 'metric': 'manhattan'}. Best is trial 14 with value: 0.6526315789473683.
[32m[I 2023-04-26 15:44:23,520][39m Trial 112 finished with value: 0.6526315789473683 and parameters: {'algorithm': 'brute', 'n_neighbors': 9, 'weights': 'distance', 'metric': 'manhattan'}. Best is trial 14 with value: 0.6526315789473683.
[32m[I 2023-04-26 15:44:23,567][39m Trial 113 finished with value: 0.6304347826086957 and parameters: {'algorithm': 'brute', 'n_neighbors': 10, 'weights': 'distance', 'metric': 'manhattan'}. Best is trial 14 with value: 0.6526315789473683.
[32m[I 2023-04-26 15:44:23,598][39m Trial 114 finished with value: 0.6526315789473683 and parameters: {'algorithm': 'kd_tree', 'n_neighbors': 11, 'weights': 'distance', 'metric': 'manhattan'}. Best is trial 14 with value: 0.6526315789473683.
[32m[I 2023-04-26 15:44:23,645][39m Trial 115 finished with value: 0.6526315789473683 and parameters: {'algorithm': 'brute', 'n_neighbors': 9, 'weights': 'distance', 'metric': 'manhattan'}. Best is trial 14 with value: 0.6526315789473683.
[32m[I 2023-04-26 15:44:23,701][39m Trial 116 finished with value: 0.6526315789473683 and parameters: {'algorithm': 'brute', 'n_neighbors': 11, 'weights': 'distance', 'metric': 'manhattan'}. Best is trial 14 with value: 0.6526315789473683.
[32m[I 2023-04-26 15:44:23,755][39m Trial 117 finished with value: 0.6526315789473683 and parameters: {'algorithm': 'brute', 'n_neighbors': 13, 'weights': 'distance', 'metric': 'manhattan'}. Best is trial 14 with value: 0.6526315789473683.
[32m[I 2023-04-26 15:44:23,802][39m Trial 118 finished with value: 0.6037735849056605 and parameters: {'algorithm': 'ball_tree', 'n_neighbors': 14, 'weights': 'uniform', 'metric': 'manhattan'}. Best is trial 14 with value: 0.6526315789473683.
[32m[I 2023-04-26 15:44:23,849][39m Trial 119 finished with value: 0.5979381443298969 and parameters: {'algorithm': 'brute', 'n_neighbors': 12, 'weights': 'distance', 'metric': 'euclidean'}. Best is trial 14 with value: 0.6526315789473683.
[32m[I 2023-04-26 15:44:23,875][39m Trial 120 finished with value: 0.6304347826086957 and parameters: {'algorithm': 'auto', 'n_neighbors': 10, 'weights': 'distance', 'metric': 'manhattan'}. Best is trial 14 with value: 0.6526315789473683.
[32m[I 2023-04-26 15:44:23,881][39m Trial 121 finished with value: 0.6526315789473683 and parameters: {'algorithm': 'ball_tree', 'n_neighbors': 9, 'weights': 'distance', 'metric': 'manhattan'}. Best is trial 14 with value: 0.6526315789473683.
[32m[I 2023-04-26 15:44:23,912][39m Trial 122 finished with value: 0.6373626373626374 and parameters: {'algorithm': 'ball_tree', 'n_neighbors': 7, 'weights': 'distance', 'metric': 'manhattan'}. Best is trial 14 with value: 0.6526315789473683.
[32m[I 2023-04-26 15:44:23,928][39m Trial 123 finished with value: 0.6391752577319588 and parameters: {'algorithm': 'ball_tree', 'n_neighbors': 12, 'weights': 'distance', 'metric': 'manhattan'}. Best is trial 14 with value: 0.6526315789473683.
[32m[I 2023-04-26 15:44:23,943][39m Trial 124 finished with value: 0.6458333333333333 and parameters: {'algorithm': 'ball_tree', 'n_neighbors': 15, 'weights': 'distance', 'metric': 'manhattan'}. Best is trial 14 with value: 0.6526315789473683.
[32m[I 2023-04-26 15:44:23,991][39m Trial 125 finished with value: 0.6526315789473683 and parameters: {'algorithm': 'brute', 'n_neighbors': 13, 'weights': 'distance', 'metric': 'manhattan'}. Best is trial 14 with value: 0.6526315789473683.
[32m[I 2023-04-26 15:44:24,053][39m Trial 126 finished with value: 0.6526315789473683 and parameters: {'algorithm': 'brute', 'n_neighbors': 13, 'weights': 'distance', 'metric': 'manhattan'}. Best is trial 14 with value: 0.6526315789473683.
[32m[I 2023-04-26 15:44:24,100][39m Trial 127 finished with value: 0.6526315789473683 and parameters: {'algorithm': 'brute', 'n_neighbors': 9, 'weights': 'distance', 'metric': 'manhattan'}. Best is trial 14 with value: 0.6526315789473683.
[32m[I 2023-04-26 15:44:24,132][39m Trial 128 finished with value: 0.6041666666666666 and parameters: {'algorithm': 'auto', 'n_neighbors': 8, 'weights': 'distance', 'metric': 'minkowski'}. Best is trial 14 with value: 0.6526315789473683.
[32m[I 2023-04-26 15:44:24,147][39m Trial 129 finished with value: 0.6526315789473683 and parameters: {'algorithm': 'auto', 'n_neighbors': 11, 'weights': 'distance', 'metric': 'manhattan'}. Best is trial 14 with value: 0.6526315789473683.
[32m[I 2023-04-26 15:44:24,168][39m Trial 130 finished with value: 0.6526315789473683 and parameters: {'algorithm': 'kd_tree', 'n_neighbors': 11, 'weights': 'distance', 'metric': 'manhattan'}. Best is trial 14 with value: 0.6526315789473683.
[32m[I 2023-04-26 15:44:24,179][39m Trial 131 finished with value: 0.6526315789473683 and parameters: {'algorithm': 'auto', 'n_neighbors': 9, 'weights': 'distance', 'metric': 'manhattan'}. Best is trial 14 with value: 0.6526315789473683.
[32m[I 2023-04-26 15:44:24,195][39m Trial 132 finished with value: 0.6304347826086957 and parameters: {'algorithm': 'auto', 'n_neighbors': 10, 'weights': 'distance', 'metric': 'manhattan'}. Best is trial 14 with value: 0.6526315789473683.
[32m[I 2023-04-26 15:44:24,242][39m Trial 133 finished with value: 0.6122448979591836 and parameters: {'algorithm': 'brute', 'n_neighbors': 30, 'weights': 'distance', 'metric': 'manhattan'}. Best is trial 14 with value: 0.6526315789473683.
[32m[I 2023-04-26 15:44:24,273][39m Trial 134 finished with value: 0.6391752577319588 and parameters: {'algorithm': 'kd_tree', 'n_neighbors': 12, 'weights': 'distance', 'metric': 'manhattan'}. Best is trial 14 with value: 0.6526315789473683.
[32m[I 2023-04-26 15:44:24,288][39m Trial 135 finished with value: 0.6526315789473683 and parameters: {'algorithm': 'kd_tree', 'n_neighbors': 13, 'weights': 'distance', 'metric': 'manhattan'}. Best is trial 14 with value: 0.6526315789473683.
[32m[I 2023-04-26 15:44:24,304][39m Trial 136 finished with value: 0.6304347826086957 and parameters: {'algorithm': 'kd_tree', 'n_neighbors': 10, 'weights': 'distance', 'metric': 'manhattan'}. Best is trial 14 with value: 0.6526315789473683.
[32m[I 2023-04-26 15:44:24,351][39m Trial 137 finished with value: 0.6458333333333333 and parameters: {'algorithm': 'brute', 'n_neighbors': 15, 'weights': 'distance', 'metric': 'manhattan'}. Best is trial 14 with value: 0.6526315789473683.
[32m[I 2023-04-26 15:44:24,367][39m Trial 138 finished with value: 0.6458333333333333 and parameters: {'algorithm': 'kd_tree', 'n_neighbors': 14, 'weights': 'distance', 'metric': 'manhattan'}. Best is trial 14 with value: 0.6526315789473683.
[32m[I 2023-04-26 15:44:24,398][39m Trial 139 finished with value: 0.6526315789473683 and parameters: {'algorithm': 'kd_tree', 'n_neighbors': 13, 'weights': 'distance', 'metric': 'manhattan'}. Best is trial 14 with value: 0.6526315789473683.
[32m[I 2023-04-26 15:44:24,429][39m Trial 140 finished with value: 0.6078431372549019 and parameters: {'algorithm': 'brute', 'n_neighbors': 12, 'weights': 'uniform', 'metric': 'manhattan'}. Best is trial 14 with value: 0.6526315789473683.
[32m[I 2023-04-26 15:44:24,476][39m Trial 141 finished with value: 0.6526315789473683 and parameters: {'algorithm': 'brute', 'n_neighbors': 11, 'weights': 'distance', 'metric': 'manhattan'}. Best is trial 14 with value: 0.6526315789473683.
[32m[I 2023-04-26 15:44:24,538][39m Trial 142 finished with value: 0.6153846153846154 and parameters: {'algorithm': 'brute', 'n_neighbors': 6, 'weights': 'distance', 'metric': 'manhattan'}. Best is trial 14 with value: 0.6526315789473683.
[32m[I 2023-04-26 15:44:24,601][39m Trial 143 finished with value: 0.6526315789473683 and parameters: {'algorithm': 'brute', 'n_neighbors': 9, 'weights': 'distance', 'metric': 'manhattan'}. Best is trial 14 with value: 0.6526315789473683.
[32m[I 2023-04-26 15:44:24,663][39m Trial 144 finished with value: 0.6153846153846154 and parameters: {'algorithm': 'brute', 'n_neighbors': 8, 'weights': 'distance', 'metric': 'manhattan'}. Best is trial 14 with value: 0.6526315789473683.
[32m[I 2023-04-26 15:44:24,727][39m Trial 145 finished with value: 0.6304347826086957 and parameters: {'algorithm': 'brute', 'n_neighbors': 10, 'weights': 'distance', 'metric': 'manhattan'}. Best is trial 14 with value: 0.6526315789473683.
[32m[I 2023-04-26 15:44:24,758][39m Trial 146 finished with value: 0.6526315789473683 and parameters: {'algorithm': 'kd_tree', 'n_neighbors': 11, 'weights': 'distance', 'metric': 'manhattan'}. Best is trial 14 with value: 0.6526315789473683.
[32m[I 2023-04-26 15:44:24,806][39m Trial 147 finished with value: 0.6041666666666666 and parameters: {'algorithm': 'brute', 'n_neighbors': 8, 'weights': 'distance', 'metric': 'euclidean'}. Best is trial 14 with value: 0.6526315789473683.
[32m[I 2023-04-26 15:44:24,837][39m Trial 148 finished with value: 0.6526315789473683 and parameters: {'algorithm': 'auto', 'n_neighbors': 9, 'weights': 'distance', 'metric': 'manhattan'}. Best is trial 14 with value: 0.6526315789473683.
[32m[I 2023-04-26 15:44:24,852][39m Trial 149 finished with value: 0.6526315789473683 and parameters: {'algorithm': 'kd_tree', 'n_neighbors': 11, 'weights': 'distance', 'metric': 'manhattan'}. Best is trial 14 with value: 0.6526315789473683.
[32m[I 2023-04-26 15:44:24,878][39m Trial 150 finished with value: 0.6526315789473683 and parameters: {'algorithm': 'kd_tree', 'n_neighbors': 11, 'weights': 'distance', 'metric': 'manhattan'}. Best is trial 14 with value: 0.6526315789473683.
[32m[I 2023-04-26 15:44:24,915][39m Trial 151 finished with value: 0.6391752577319588 and parameters: {'algorithm': 'brute', 'n_neighbors': 12, 'weights': 'distance', 'metric': 'manhattan'}. Best is trial 14 with value: 0.6526315789473683.
[32m[I 2023-04-26 15:44:24,962][39m Trial 152 finished with value: 0.6304347826086957 and parameters: {'algorithm': 'brute', 'n_neighbors': 10, 'weights': 'distance', 'metric': 'manhattan'}. Best is trial 14 with value: 0.6526315789473683.
[32m[I 2023-04-26 15:44:25,025][39m Trial 153 finished with value: 0.6526315789473683 and parameters: {'algorithm': 'brute', 'n_neighbors': 9, 'weights': 'distance', 'metric': 'manhattan'}. Best is trial 14 with value: 0.6526315789473683.
[32m[I 2023-04-26 15:44:25,056][39m Trial 154 finished with value: 0.6304347826086957 and parameters: {'algorithm': 'auto', 'n_neighbors': 10, 'weights': 'distance', 'metric': 'manhattan'}. Best is trial 14 with value: 0.6526315789473683.
[32m[I 2023-04-26 15:44:25,119][39m Trial 155 finished with value: 0.6391752577319588 and parameters: {'algorithm': 'brute', 'n_neighbors': 12, 'weights': 'distance', 'metric': 'manhattan'}. Best is trial 14 with value: 0.6526315789473683.
[32m[I 2023-04-26 15:44:25,135][39m Trial 156 finished with value: 0.6185567010309277 and parameters: {'algorithm': 'kd_tree', 'n_neighbors': 11, 'weights': 'distance', 'metric': 'minkowski'}. Best is trial 14 with value: 0.6526315789473683.
[32m[I 2023-04-26 15:44:25,166][39m Trial 157 finished with value: 0.6526315789473683 and parameters: {'algorithm': 'ball_tree', 'n_neighbors': 9, 'weights': 'distance', 'metric': 'manhattan'}. Best is trial 14 with value: 0.6526315789473683.
[32m[I 2023-04-26 15:44:25,182][39m Trial 158 finished with value: 0.6458333333333333 and parameters: {'algorithm': 'ball_tree', 'n_neighbors': 16, 'weights': 'distance', 'metric': 'manhattan'}. Best is trial 14 with value: 0.6526315789473683.
[32m[I 2023-04-26 15:44:25,240][39m Trial 159 finished with value: 0.6526315789473683 and parameters: {'algorithm': 'brute', 'n_neighbors': 13, 'weights': 'distance', 'metric': 'manhattan'}. Best is trial 14 with value: 0.6526315789473683.
[32m[I 2023-04-26 15:44:25,276][39m Trial 160 finished with value: 0.6526315789473683 and parameters: {'algorithm': 'brute', 'n_neighbors': 13, 'weights': 'distance', 'metric': 'manhattan'}. Best is trial 14 with value: 0.6526315789473683.
[32m[I 2023-04-26 15:44:25,323][39m Trial 161 finished with value: 0.6458333333333333 and parameters: {'algorithm': 'brute', 'n_neighbors': 14, 'weights': 'distance', 'metric': 'manhattan'}. Best is trial 14 with value: 0.6526315789473683.
[32m[I 2023-04-26 15:44:25,370][39m Trial 162 finished with value: 0.6153846153846154 and parameters: {'algorithm': 'brute', 'n_neighbors': 8, 'weights': 'distance', 'metric': 'manhattan'}. Best is trial 14 with value: 0.6526315789473683.
[32m[I 2023-04-26 15:44:25,432][39m Trial 163 finished with value: 0.6526315789473683 and parameters: {'algorithm': 'brute', 'n_neighbors': 13, 'weights': 'distance', 'metric': 'manhattan'}. Best is trial 14 with value: 0.6526315789473683.
[32m[I 2023-04-26 15:44:25,463][39m Trial 164 finished with value: 0.6304347826086957 and parameters: {'algorithm': 'auto', 'n_neighbors': 10, 'weights': 'distance', 'metric': 'manhattan'}. Best is trial 14 with value: 0.6526315789473683.
[32m[I 2023-04-26 15:44:25,495][39m Trial 165 finished with value: 0.6526315789473683 and parameters: {'algorithm': 'brute', 'n_neighbors': 9, 'weights': 'distance', 'metric': 'manhattan'}. Best is trial 14 with value: 0.6526315789473683.
[32m[I 2023-04-26 15:44:25,526][39m Trial 166 finished with value: 0.6458333333333333 and parameters: {'algorithm': 'ball_tree', 'n_neighbors': 14, 'weights': 'distance', 'metric': 'manhattan'}. Best is trial 14 with value: 0.6526315789473683.
[32m[I 2023-04-26 15:44:25,542][39m Trial 167 finished with value: 0.611111111111111 and parameters: {'algorithm': 'ball_tree', 'n_neighbors': 13, 'weights': 'uniform', 'metric': 'manhattan'}. Best is trial 14 with value: 0.6526315789473683.
[32m[I 2023-04-26 15:44:25,573][39m Trial 168 finished with value: 0.6526315789473683 and parameters: {'algorithm': 'kd_tree', 'n_neighbors': 11, 'weights': 'distance', 'metric': 'manhattan'}. Best is trial 14 with value: 0.6526315789473683.
[32m[I 2023-04-26 15:44:25,588][39m Trial 169 finished with value: 0.6526315789473683 and parameters: {'algorithm': 'ball_tree', 'n_neighbors': 9, 'weights': 'distance', 'metric': 'manhattan'}. Best is trial 14 with value: 0.6526315789473683.
[32m[I 2023-04-26 15:44:25,604][39m Trial 170 finished with value: 0.6526315789473683 and parameters: {'algorithm': 'kd_tree', 'n_neighbors': 11, 'weights': 'distance', 'metric': 'manhattan'}. Best is trial 14 with value: 0.6526315789473683.
[32m[I 2023-04-26 15:44:25,635][39m Trial 171 finished with value: 0.6153846153846154 and parameters: {'algorithm': 'ball_tree', 'n_neighbors': 8, 'weights': 'distance', 'metric': 'manhattan'}. Best is trial 14 with value: 0.6526315789473683.
[32m[I 2023-04-26 15:44:25,682][39m Trial 172 finished with value: 0.6304347826086957 and parameters: {'algorithm': 'brute', 'n_neighbors': 10, 'weights': 'distance', 'metric': 'manhattan'}. Best is trial 14 with value: 0.6526315789473683.
[32m[I 2023-04-26 15:44:25,761][39m Trial 173 finished with value: 0.6304347826086957 and parameters: {'algorithm': 'brute', 'n_neighbors': 10, 'weights': 'distance', 'metric': 'manhattan'}. Best is trial 14 with value: 0.6526315789473683.
[32m[I 2023-04-26 15:44:25,824][39m Trial 174 finished with value: 0.6391752577319588 and parameters: {'algorithm': 'brute', 'n_neighbors': 12, 'weights': 'distance', 'metric': 'manhattan'}. Best is trial 14 with value: 0.6526315789473683.
[32m[I 2023-04-26 15:44:25,887][39m Trial 175 finished with value: 0.6373626373626374 and parameters: {'algorithm': 'brute', 'n_neighbors': 7, 'weights': 'distance', 'metric': 'manhattan'}. Best is trial 14 with value: 0.6526315789473683.
[32m[I 2023-04-26 15:44:25,950][39m Trial 176 finished with value: 0.6041666666666666 and parameters: {'algorithm': 'brute', 'n_neighbors': 13, 'weights': 'distance', 'metric': 'euclidean'}. Best is trial 14 with value: 0.6526315789473683.
[32m[I 2023-04-26 15:44:25,997][39m Trial 177 finished with value: 0.6391752577319588 and parameters: {'algorithm': 'brute', 'n_neighbors': 12, 'weights': 'distance', 'metric': 'manhattan'}. Best is trial 14 with value: 0.6526315789473683.
[32m[I 2023-04-26 15:44:26,023][39m Trial 178 finished with value: 0.6526315789473683 and parameters: {'algorithm': 'kd_tree', 'n_neighbors': 9, 'weights': 'distance', 'metric': 'manhattan'}. Best is trial 14 with value: 0.6526315789473683.
[32m[I 2023-04-26 15:44:26,029][39m Trial 179 finished with value: 0.6526315789473683 and parameters: {'algorithm': 'kd_tree', 'n_neighbors': 11, 'weights': 'distance', 'metric': 'manhattan'}. Best is trial 14 with value: 0.6526315789473683.
