[32m[I 2023-04-26 02:21:56,464][39m Trial 99 finished with value: 0.6862745098039217 and parameters: {'algorithm': 'auto', 'n_neighbors': 24, 'weights': 'uniform', 'metric': 'minkowski'}. Best is trial 10 with value: 0.8.
[32m[I 2023-04-26 02:21:56,478][39m Trial 100 finished with value: 0.8 and parameters: {'algorithm': 'kd_tree', 'n_neighbors': 2, 'weights': 'distance', 'metric': 'manhattan'}. Best is trial 10 with value: 0.8.
[32m[I 2023-04-26 02:21:56,492][39m Trial 101 finished with value: 0.8 and parameters: {'algorithm': 'kd_tree', 'n_neighbors': 1, 'weights': 'distance', 'metric': 'manhattan'}. Best is trial 10 with value: 0.8.
[32m[I 2023-04-26 02:21:56,501][39m Trial 102 finished with value: 0.8 and parameters: {'algorithm': 'kd_tree', 'n_neighbors': 1, 'weights': 'distance', 'metric': 'manhattan'}. Best is trial 10 with value: 0.8.
[32m[I 2023-04-26 02:21:56,535][39m Trial 103 finished with value: 0.8 and parameters: {'algorithm': 'brute', 'n_neighbors': 4, 'weights': 'distance', 'metric': 'euclidean'}. Best is trial 10 with value: 0.8.
[32m[I 2023-04-26 02:21:56,568][39m Trial 104 finished with value: 0.7848101265822786 and parameters: {'algorithm': 'auto', 'n_neighbors': 3, 'weights': 'distance', 'metric': 'manhattan'}. Best is trial 10 with value: 0.8.
[32m[I 2023-04-26 02:21:56,582][39m Trial 105 finished with value: 0.8 and parameters: {'algorithm': 'kd_tree', 'n_neighbors': 3, 'weights': 'distance', 'metric': 'minkowski'}. Best is trial 10 with value: 0.8.
[32m[I 2023-04-26 02:21:56,597][39m Trial 106 finished with value: 0.7901234567901235 and parameters: {'algorithm': 'kd_tree', 'n_neighbors': 5, 'weights': 'distance', 'metric': 'minkowski'}. Best is trial 10 with value: 0.8.
[32m[I 2023-04-26 02:21:56,613][39m Trial 107 finished with value: 0.7948717948717948 and parameters: {'algorithm': 'kd_tree', 'n_neighbors': 6, 'weights': 'distance', 'metric': 'minkowski'}. Best is trial 10 with value: 0.8.
[32m[I 2023-04-26 02:21:56,631][39m Trial 108 finished with value: 0.7901234567901235 and parameters: {'algorithm': 'kd_tree', 'n_neighbors': 5, 'weights': 'distance', 'metric': 'minkowski'}. Best is trial 10 with value: 0.8.
[32m[I 2023-04-26 02:21:56,647][39m Trial 109 finished with value: 0.8 and parameters: {'algorithm': 'kd_tree', 'n_neighbors': 3, 'weights': 'distance', 'metric': 'minkowski'}. Best is trial 10 with value: 0.8.
[32m[I 2023-04-26 02:21:56,664][39m Trial 110 finished with value: 0.8 and parameters: {'algorithm': 'kd_tree', 'n_neighbors': 3, 'weights': 'distance', 'metric': 'minkowski'}. Best is trial 10 with value: 0.8.
[32m[I 2023-04-26 02:21:56,674][39m Trial 111 finished with value: 0.8 and parameters: {'algorithm': 'ball_tree', 'n_neighbors': 2, 'weights': 'distance', 'metric': 'manhattan'}. Best is trial 10 with value: 0.8.
[32m[I 2023-04-26 02:21:56,697][39m Trial 112 finished with value: 0.8 and parameters: {'algorithm': 'auto', 'n_neighbors': 2, 'weights': 'distance', 'metric': 'manhattan'}. Best is trial 10 with value: 0.8.
[32m[I 2023-04-26 02:21:56,727][39m Trial 113 finished with value: 0.8 and parameters: {'algorithm': 'auto', 'n_neighbors': 3, 'weights': 'distance', 'metric': 'minkowski'}. Best is trial 10 with value: 0.8.
[32m[I 2023-04-26 02:21:56,742][39m Trial 114 finished with value: 0.8 and parameters: {'algorithm': 'kd_tree', 'n_neighbors': 1, 'weights': 'distance', 'metric': 'minkowski'}. Best is trial 10 with value: 0.8.
[32m[I 2023-04-26 02:21:56,772][39m Trial 115 finished with value: 0.8 and parameters: {'algorithm': 'brute', 'n_neighbors': 1, 'weights': 'distance', 'metric': 'manhattan'}. Best is trial 10 with value: 0.8.
[32m[I 2023-04-26 02:21:56,803][39m Trial 116 finished with value: 0.8 and parameters: {'algorithm': 'brute', 'n_neighbors': 2, 'weights': 'distance', 'metric': 'manhattan'}. Best is trial 10 with value: 0.8.
[32m[I 2023-04-26 02:21:56,819][39m Trial 117 finished with value: 0.8 and parameters: {'algorithm': 'kd_tree', 'n_neighbors': 2, 'weights': 'distance', 'metric': 'manhattan'}. Best is trial 10 with value: 0.8.
[32m[I 2023-04-26 02:21:56,834][39m Trial 118 finished with value: 0.8 and parameters: {'algorithm': 'kd_tree', 'n_neighbors': 2, 'weights': 'distance', 'metric': 'manhattan'}. Best is trial 10 with value: 0.8.
[32m[I 2023-04-26 02:21:56,865][39m Trial 119 finished with value: 0.7415730337078651 and parameters: {'algorithm': 'brute', 'n_neighbors': 19, 'weights': 'distance', 'metric': 'manhattan'}. Best is trial 10 with value: 0.8.
[32m[I 2023-04-26 02:21:56,885][39m Trial 120 finished with value: 0.7428571428571429 and parameters: {'algorithm': 'kd_tree', 'n_neighbors': 2, 'weights': 'uniform', 'metric': 'manhattan'}. Best is trial 10 with value: 0.8.
[32m[I 2023-04-26 02:21:56,902][39m Trial 121 finished with value: 0.8 and parameters: {'algorithm': 'kd_tree', 'n_neighbors': 1, 'weights': 'distance', 'metric': 'manhattan'}. Best is trial 10 with value: 0.8.
[32m[I 2023-04-26 02:21:56,936][39m Trial 122 finished with value: 0.7500000000000001 and parameters: {'algorithm': 'brute', 'n_neighbors': 13, 'weights': 'distance', 'metric': 'manhattan'}. Best is trial 10 with value: 0.8.
[32m[I 2023-04-26 02:21:56,968][39m Trial 123 finished with value: 0.8 and parameters: {'algorithm': 'brute', 'n_neighbors': 4, 'weights': 'distance', 'metric': 'euclidean'}. Best is trial 10 with value: 0.8.
[32m[I 2023-04-26 02:21:56,985][39m Trial 124 finished with value: 0.8 and parameters: {'algorithm': 'kd_tree', 'n_neighbors': 4, 'weights': 'distance', 'metric': 'euclidean'}. Best is trial 10 with value: 0.8.
[32m[I 2023-04-26 02:21:57,016][39m Trial 125 finished with value: 0.8 and parameters: {'algorithm': 'auto', 'n_neighbors': 4, 'weights': 'distance', 'metric': 'euclidean'}. Best is trial 10 with value: 0.8.
[32m[I 2023-04-26 02:21:57,032][39m Trial 126 finished with value: 0.8 and parameters: {'algorithm': 'ball_tree', 'n_neighbors': 3, 'weights': 'distance', 'metric': 'minkowski'}. Best is trial 10 with value: 0.8.
[32m[I 2023-04-26 02:21:57,063][39m Trial 127 finished with value: 0.7901234567901235 and parameters: {'algorithm': 'auto', 'n_neighbors': 5, 'weights': 'distance', 'metric': 'euclidean'}. Best is trial 10 with value: 0.8.
[32m[I 2023-04-26 02:21:57,080][39m Trial 128 finished with value: 0.8 and parameters: {'algorithm': 'ball_tree', 'n_neighbors': 2, 'weights': 'distance', 'metric': 'manhattan'}. Best is trial 10 with value: 0.8.
[32m[I 2023-04-26 02:21:57,096][39m Trial 129 finished with value: 0.8 and parameters: {'algorithm': 'ball_tree', 'n_neighbors': 2, 'weights': 'distance', 'metric': 'manhattan'}. Best is trial 10 with value: 0.8.
[32m[I 2023-04-26 02:21:57,127][39m Trial 130 finished with value: 0.8 and parameters: {'algorithm': 'brute', 'n_neighbors': 1, 'weights': 'distance', 'metric': 'manhattan'}. Best is trial 10 with value: 0.8.
[32m[I 2023-04-26 02:21:57,157][39m Trial 131 finished with value: 0.8 and parameters: {'algorithm': 'brute', 'n_neighbors': 3, 'weights': 'distance', 'metric': 'euclidean'}. Best is trial 10 with value: 0.8.
[32m[I 2023-04-26 02:21:57,188][39m Trial 132 finished with value: 0.8 and parameters: {'algorithm': 'brute', 'n_neighbors': 4, 'weights': 'distance', 'metric': 'euclidean'}. Best is trial 10 with value: 0.8.
[32m[I 2023-04-26 02:21:57,219][39m Trial 133 finished with value: 0.8 and parameters: {'algorithm': 'auto', 'n_neighbors': 1, 'weights': 'distance', 'metric': 'minkowski'}. Best is trial 10 with value: 0.8.
[32m[I 2023-04-26 02:21:57,235][39m Trial 134 finished with value: 0.8 and parameters: {'algorithm': 'ball_tree', 'n_neighbors': 2, 'weights': 'distance', 'metric': 'manhattan'}. Best is trial 10 with value: 0.8.
[32m[I 2023-04-26 02:21:57,267][39m Trial 135 finished with value: 0.8 and parameters: {'algorithm': 'brute', 'n_neighbors': 2, 'weights': 'distance', 'metric': 'manhattan'}. Best is trial 10 with value: 0.8.
[32m[I 2023-04-26 02:21:57,298][39m Trial 136 finished with value: 0.8 and parameters: {'algorithm': 'brute', 'n_neighbors': 1, 'weights': 'distance', 'metric': 'manhattan'}. Best is trial 10 with value: 0.8.
[32m[I 2023-04-26 02:21:57,330][39m Trial 137 finished with value: 0.8 and parameters: {'algorithm': 'brute', 'n_neighbors': 2, 'weights': 'distance', 'metric': 'manhattan'}. Best is trial 10 with value: 0.8.
[32m[I 2023-04-26 02:21:57,360][39m Trial 138 finished with value: 0.7848101265822786 and parameters: {'algorithm': 'brute', 'n_neighbors': 3, 'weights': 'distance', 'metric': 'manhattan'}. Best is trial 10 with value: 0.8.
[32m[I 2023-04-26 02:21:57,377][39m Trial 139 finished with value: 0.8 and parameters: {'algorithm': 'ball_tree', 'n_neighbors': 4, 'weights': 'distance', 'metric': 'euclidean'}. Best is trial 10 with value: 0.8.
[32m[I 2023-04-26 02:21:57,399][39m Trial 140 finished with value: 0.7733333333333334 and parameters: {'algorithm': 'ball_tree', 'n_neighbors': 6, 'weights': 'uniform', 'metric': 'euclidean'}. Best is trial 10 with value: 0.8.
[32m[I 2023-04-26 02:21:57,415][39m Trial 141 finished with value: 0.8 and parameters: {'algorithm': 'ball_tree', 'n_neighbors': 4, 'weights': 'distance', 'metric': 'euclidean'}. Best is trial 10 with value: 0.8.
[32m[I 2023-04-26 02:21:57,448][39m Trial 142 finished with value: 0.8 and parameters: {'algorithm': 'brute', 'n_neighbors': 1, 'weights': 'distance', 'metric': 'manhattan'}. Best is trial 10 with value: 0.8.
[32m[I 2023-04-26 02:21:57,479][39m Trial 143 finished with value: 0.8 and parameters: {'algorithm': 'brute', 'n_neighbors': 1, 'weights': 'distance', 'metric': 'manhattan'}. Best is trial 10 with value: 0.8.
[32m[I 2023-04-26 02:21:57,511][39m Trial 144 finished with value: 0.8 and parameters: {'algorithm': 'auto', 'n_neighbors': 1, 'weights': 'distance', 'metric': 'manhattan'}. Best is trial 10 with value: 0.8.
[32m[I 2023-04-26 02:21:57,544][39m Trial 145 finished with value: 0.8 and parameters: {'algorithm': 'auto', 'n_neighbors': 3, 'weights': 'distance', 'metric': 'euclidean'}. Best is trial 10 with value: 0.8.
[32m[I 2023-04-26 02:21:57,577][39m Trial 146 finished with value: 0.7901234567901235 and parameters: {'algorithm': 'auto', 'n_neighbors': 5, 'weights': 'distance', 'metric': 'euclidean'}. Best is trial 10 with value: 0.8.
[32m[I 2023-04-26 02:21:57,594][39m Trial 147 finished with value: 0.8 and parameters: {'algorithm': 'ball_tree', 'n_neighbors': 4, 'weights': 'distance', 'metric': 'euclidean'}. Best is trial 10 with value: 0.8.
[32m[I 2023-04-26 02:21:57,610][39m Trial 148 finished with value: 0.8 and parameters: {'algorithm': 'kd_tree', 'n_neighbors': 1, 'weights': 'distance', 'metric': 'manhattan'}. Best is trial 10 with value: 0.8.
[32m[I 2023-04-26 02:21:57,645][39m Trial 149 finished with value: 0.8 and parameters: {'algorithm': 'brute', 'n_neighbors': 1, 'weights': 'distance', 'metric': 'manhattan'}. Best is trial 10 with value: 0.8.
[32m[I 2023-04-26 02:21:57,661][39m Trial 150 finished with value: 0.7848101265822786 and parameters: {'algorithm': 'kd_tree', 'n_neighbors': 3, 'weights': 'distance', 'metric': 'manhattan'}. Best is trial 10 with value: 0.8.
[32m[I 2023-04-26 02:21:57,678][39m Trial 151 finished with value: 0.8 and parameters: {'algorithm': 'kd_tree', 'n_neighbors': 4, 'weights': 'distance', 'metric': 'euclidean'}. Best is trial 10 with value: 0.8.
[32m[I 2023-04-26 02:21:57,695][39m Trial 152 finished with value: 0.8 and parameters: {'algorithm': 'kd_tree', 'n_neighbors': 4, 'weights': 'distance', 'metric': 'euclidean'}. Best is trial 10 with value: 0.8.
[32m[I 2023-04-26 02:21:57,713][39m Trial 153 finished with value: 0.8 and parameters: {'algorithm': 'kd_tree', 'n_neighbors': 3, 'weights': 'distance', 'metric': 'minkowski'}. Best is trial 10 with value: 0.8.
[32m[I 2023-04-26 02:21:57,731][39m Trial 154 finished with value: 0.8 and parameters: {'algorithm': 'kd_tree', 'n_neighbors': 2, 'weights': 'distance', 'metric': 'minkowski'}. Best is trial 10 with value: 0.8.
[32m[I 2023-04-26 02:21:57,747][39m Trial 155 finished with value: 0.8 and parameters: {'algorithm': 'kd_tree', 'n_neighbors': 2, 'weights': 'distance', 'metric': 'minkowski'}. Best is trial 10 with value: 0.8.
[32m[I 2023-04-26 02:21:57,758][39m Trial 156 finished with value: 0.8 and parameters: {'algorithm': 'kd_tree', 'n_neighbors': 3, 'weights': 'distance', 'metric': 'minkowski'}. Best is trial 10 with value: 0.8.
[32m[I 2023-04-26 02:21:57,767][39m Trial 157 finished with value: 0.8 and parameters: {'algorithm': 'kd_tree', 'n_neighbors': 2, 'weights': 'distance', 'metric': 'manhattan'}. Best is trial 10 with value: 0.8.
[32m[I 2023-04-26 02:21:57,776][39m Trial 158 finished with value: 0.8 and parameters: {'algorithm': 'kd_tree', 'n_neighbors': 3, 'weights': 'distance', 'metric': 'minkowski'}. Best is trial 10 with value: 0.8.
[32m[I 2023-04-26 02:21:57,801][39m Trial 159 finished with value: 0.8 and parameters: {'algorithm': 'auto', 'n_neighbors': 2, 'weights': 'distance', 'metric': 'manhattan'}. Best is trial 10 with value: 0.8.
[32m[I 2023-04-26 02:21:57,837][39m Trial 160 finished with value: 0.8 and parameters: {'algorithm': 'auto', 'n_neighbors': 1, 'weights': 'distance', 'metric': 'manhattan'}. Best is trial 10 with value: 0.8.
[32m[I 2023-04-26 02:21:57,854][39m Trial 161 finished with value: 0.8 and parameters: {'algorithm': 'kd_tree', 'n_neighbors': 3, 'weights': 'distance', 'metric': 'minkowski'}. Best is trial 10 with value: 0.8.
[32m[I 2023-04-26 02:21:57,871][39m Trial 162 finished with value: 0.8 and parameters: {'algorithm': 'kd_tree', 'n_neighbors': 1, 'weights': 'distance', 'metric': 'minkowski'}. Best is trial 10 with value: 0.8.
[32m[I 2023-04-26 02:21:57,890][39m Trial 163 finished with value: 0.8 and parameters: {'algorithm': 'kd_tree', 'n_neighbors': 3, 'weights': 'distance', 'metric': 'minkowski'}. Best is trial 10 with value: 0.8.
[32m[I 2023-04-26 02:21:57,907][39m Trial 164 finished with value: 0.8 and parameters: {'algorithm': 'kd_tree', 'n_neighbors': 2, 'weights': 'distance', 'metric': 'minkowski'}. Best is trial 10 with value: 0.8.
[32m[I 2023-04-26 02:21:57,939][39m Trial 165 finished with value: 0.8 and parameters: {'algorithm': 'brute', 'n_neighbors': 2, 'weights': 'distance', 'metric': 'minkowski'}. Best is trial 10 with value: 0.8.
[32m[I 2023-04-26 02:21:57,972][39m Trial 166 finished with value: 0.8 and parameters: {'algorithm': 'brute', 'n_neighbors': 2, 'weights': 'distance', 'metric': 'minkowski'}. Best is trial 10 with value: 0.8.
[32m[I 2023-04-26 02:21:58,005][39m Trial 167 finished with value: 0.8 and parameters: {'algorithm': 'brute', 'n_neighbors': 2, 'weights': 'distance', 'metric': 'minkowski'}. Best is trial 10 with value: 0.8.
[32m[I 2023-04-26 02:21:58,036][39m Trial 168 finished with value: 0.8 and parameters: {'algorithm': 'brute', 'n_neighbors': 2, 'weights': 'distance', 'metric': 'minkowski'}. Best is trial 10 with value: 0.8.
[32m[I 2023-04-26 02:21:58,058][39m Trial 169 finished with value: 0.7749999999999999 and parameters: {'algorithm': 'kd_tree', 'n_neighbors': 5, 'weights': 'uniform', 'metric': 'manhattan'}. Best is trial 10 with value: 0.8.
[32m[I 2023-04-26 02:21:58,092][39m Trial 170 finished with value: 0.8 and parameters: {'algorithm': 'auto', 'n_neighbors': 3, 'weights': 'distance', 'metric': 'euclidean'}. Best is trial 10 with value: 0.8.
[32m[I 2023-04-26 02:21:58,110][39m Trial 171 finished with value: 0.8 and parameters: {'algorithm': 'kd_tree', 'n_neighbors': 3, 'weights': 'distance', 'metric': 'minkowski'}. Best is trial 10 with value: 0.8.
[32m[I 2023-04-26 02:21:58,128][39m Trial 172 finished with value: 0.8 and parameters: {'algorithm': 'kd_tree', 'n_neighbors': 4, 'weights': 'distance', 'metric': 'minkowski'}. Best is trial 10 with value: 0.8.
[32m[I 2023-04-26 02:21:58,162][39m Trial 173 finished with value: 0.8 and parameters: {'algorithm': 'brute', 'n_neighbors': 1, 'weights': 'distance', 'metric': 'manhattan'}. Best is trial 10 with value: 0.8.
[32m[I 2023-04-26 02:21:58,196][39m Trial 174 finished with value: 0.8 and parameters: {'algorithm': 'auto', 'n_neighbors': 1, 'weights': 'distance', 'metric': 'manhattan'}. Best is trial 10 with value: 0.8.
[32m[I 2023-04-26 02:21:58,214][39m Trial 175 finished with value: 0.8 and parameters: {'algorithm': 'kd_tree', 'n_neighbors': 2, 'weights': 'distance', 'metric': 'minkowski'}. Best is trial 10 with value: 0.8.
[32m[I 2023-04-26 02:21:58,233][39m Trial 176 finished with value: 0.8 and parameters: {'algorithm': 'kd_tree', 'n_neighbors': 3, 'weights': 'distance', 'metric': 'minkowski'}. Best is trial 10 with value: 0.8.
[32m[I 2023-04-26 02:21:58,266][39m Trial 177 finished with value: 0.8 and parameters: {'algorithm': 'auto', 'n_neighbors': 1, 'weights': 'distance', 'metric': 'manhattan'}. Best is trial 10 with value: 0.8.
[32m[I 2023-04-26 02:21:58,284][39m Trial 178 finished with value: 0.8 and parameters: {'algorithm': 'ball_tree', 'n_neighbors': 2, 'weights': 'distance', 'metric': 'manhattan'}. Best is trial 10 with value: 0.8.
[32m[I 2023-04-26 02:21:58,317][39m Trial 179 finished with value: 0.8 and parameters: {'algorithm': 'brute', 'n_neighbors': 2, 'weights': 'distance', 'metric': 'manhattan'}. Best is trial 10 with value: 0.8.
[32m[I 2023-04-26 02:21:58,349][39m Trial 180 finished with value: 0.7848101265822786 and parameters: {'algorithm': 'brute', 'n_neighbors': 4, 'weights': 'distance', 'metric': 'manhattan'}. Best is trial 10 with value: 0.8.
[32m[I 2023-04-26 02:21:58,367][39m Trial 181 finished with value: 0.7901234567901235 and parameters: {'algorithm': 'ball_tree', 'n_neighbors': 5, 'weights': 'distance', 'metric': 'euclidean'}. Best is trial 10 with value: 0.8.
[32m[I 2023-04-26 02:21:58,384][39m Trial 182 finished with value: 0.8 and parameters: {'algorithm': 'ball_tree', 'n_neighbors': 1, 'weights': 'distance', 'metric': 'manhattan'}. Best is trial 10 with value: 0.8.
[32m[I 2023-04-26 02:21:58,420][39m Trial 183 finished with value: 0.7848101265822786 and parameters: {'algorithm': 'auto', 'n_neighbors': 3, 'weights': 'distance', 'metric': 'manhattan'}. Best is trial 10 with value: 0.8.
[32m[I 2023-04-26 02:21:58,440][39m Trial 184 finished with value: 0.8 and parameters: {'algorithm': 'ball_tree', 'n_neighbors': 1, 'weights': 'distance', 'metric': 'manhattan'}. Best is trial 10 with value: 0.8.
[32m[I 2023-04-26 02:21:58,475][39m Trial 185 finished with value: 0.8 and parameters: {'algorithm': 'brute', 'n_neighbors': 1, 'weights': 'distance', 'metric': 'manhattan'}. Best is trial 10 with value: 0.8.
[32m[I 2023-04-26 02:21:58,510][39m Trial 186 finished with value: 0.8 and parameters: {'algorithm': 'auto', 'n_neighbors': 2, 'weights': 'distance', 'metric': 'euclidean'}. Best is trial 10 with value: 0.8.
[32m[I 2023-04-26 02:21:58,544][39m Trial 187 finished with value: 0.8 and parameters: {'algorithm': 'brute', 'n_neighbors': 2, 'weights': 'distance', 'metric': 'manhattan'}. Best is trial 10 with value: 0.8.
[32m[I 2023-04-26 02:21:58,577][39m Trial 188 finished with value: 0.8 and parameters: {'algorithm': 'brute', 'n_neighbors': 2, 'weights': 'distance', 'metric': 'manhattan'}. Best is trial 10 with value: 0.8.
[32m[I 2023-04-26 02:21:58,609][39m Trial 189 finished with value: 0.8 and parameters: {'algorithm': 'brute', 'n_neighbors': 1, 'weights': 'distance', 'metric': 'manhattan'}. Best is trial 10 with value: 0.8.
[32m[I 2023-04-26 02:21:58,642][39m Trial 190 finished with value: 0.8 and parameters: {'algorithm': 'brute', 'n_neighbors': 1, 'weights': 'distance', 'metric': 'manhattan'}. Best is trial 10 with value: 0.8.
[32m[I 2023-04-26 02:21:58,677][39m Trial 191 finished with value: 0.8 and parameters: {'algorithm': 'brute', 'n_neighbors': 2, 'weights': 'distance', 'metric': 'manhattan'}. Best is trial 10 with value: 0.8.
[32m[I 2023-04-26 02:21:58,714][39m Trial 192 finished with value: 0.8 and parameters: {'algorithm': 'brute', 'n_neighbors': 4, 'weights': 'distance', 'metric': 'euclidean'}. Best is trial 10 with value: 0.8.
[32m[I 2023-04-26 02:21:58,748][39m Trial 193 finished with value: 0.8 and parameters: {'algorithm': 'brute', 'n_neighbors': 4, 'weights': 'distance', 'metric': 'euclidean'}. Best is trial 10 with value: 0.8.
[32m[I 2023-04-26 02:21:58,765][39m Trial 194 finished with value: 0.8 and parameters: {'algorithm': 'ball_tree', 'n_neighbors': 4, 'weights': 'distance', 'metric': 'euclidean'}. Best is trial 10 with value: 0.8.
[32m[I 2023-04-26 02:21:58,799][39m Trial 195 finished with value: 0.8 and parameters: {'algorithm': 'brute', 'n_neighbors': 3, 'weights': 'distance', 'metric': 'euclidean'}. Best is trial 10 with value: 0.8.
[32m[I 2023-04-26 02:21:58,832][39m Trial 196 finished with value: 0.8 and parameters: {'algorithm': 'brute', 'n_neighbors': 4, 'weights': 'distance', 'metric': 'euclidean'}. Best is trial 10 with value: 0.8.
[32m[I 2023-04-26 02:21:58,865][39m Trial 197 finished with value: 0.7848101265822786 and parameters: {'algorithm': 'auto', 'n_neighbors': 3, 'weights': 'distance', 'metric': 'manhattan'}. Best is trial 10 with value: 0.8.
[32m[I 2023-04-26 02:21:58,882][39m Trial 198 finished with value: 0.8 and parameters: {'algorithm': 'kd_tree', 'n_neighbors': 1, 'weights': 'distance', 'metric': 'minkowski'}. Best is trial 10 with value: 0.8.
[32m[I 2023-04-26 02:21:58,902][39m Trial 199 finished with value: 0.8 and parameters: {'algorithm': 'kd_tree', 'n_neighbors': 1, 'weights': 'distance', 'metric': 'minkowski'}. Best is trial 10 with value: 0.8.
[32m[I 2023-04-26 02:21:58,926][39m Trial 200 finished with value: 0.8 and parameters: {'algorithm': 'kd_tree', 'n_neighbors': 1, 'weights': 'uniform', 'metric': 'minkowski'}. Best is trial 10 with value: 0.8.
