[32m[I 2023-04-26 02:22:01,715][39m Trial 303 finished with value: 0.8 and parameters: {'algorithm': 'ball_tree', 'n_neighbors': 1, 'weights': 'distance', 'metric': 'euclidean'}. Best is trial 10 with value: 0.8.
[32m[I 2023-04-26 02:22:01,738][39m Trial 304 finished with value: 0.8 and parameters: {'algorithm': 'ball_tree', 'n_neighbors': 1, 'weights': 'distance', 'metric': 'euclidean'}. Best is trial 10 with value: 0.8.
[32m[I 2023-04-26 02:22:01,761][39m Trial 305 finished with value: 0.8 and parameters: {'algorithm': 'ball_tree', 'n_neighbors': 1, 'weights': 'distance', 'metric': 'euclidean'}. Best is trial 10 with value: 0.8.
[32m[I 2023-04-26 02:22:01,783][39m Trial 306 finished with value: 0.8 and parameters: {'algorithm': 'ball_tree', 'n_neighbors': 2, 'weights': 'distance', 'metric': 'euclidean'}. Best is trial 10 with value: 0.8.
[32m[I 2023-04-26 02:22:01,797][39m Trial 307 finished with value: 0.8 and parameters: {'algorithm': 'ball_tree', 'n_neighbors': 2, 'weights': 'distance', 'metric': 'euclidean'}. Best is trial 10 with value: 0.8.
[32m[I 2023-04-26 02:22:01,828][39m Trial 308 finished with value: 0.8 and parameters: {'algorithm': 'brute', 'n_neighbors': 2, 'weights': 'distance', 'metric': 'euclidean'}. Best is trial 10 with value: 0.8.
[32m[I 2023-04-26 02:22:01,867][39m Trial 309 finished with value: 0.8 and parameters: {'algorithm': 'brute', 'n_neighbors': 4, 'weights': 'distance', 'metric': 'euclidean'}. Best is trial 10 with value: 0.8.
[32m[I 2023-04-26 02:22:01,889][39m Trial 310 finished with value: 0.8 and parameters: {'algorithm': 'kd_tree', 'n_neighbors': 2, 'weights': 'distance', 'metric': 'minkowski'}. Best is trial 10 with value: 0.8.
[32m[I 2023-04-26 02:22:01,912][39m Trial 311 finished with value: 0.7191011235955055 and parameters: {'algorithm': 'kd_tree', 'n_neighbors': 21, 'weights': 'distance', 'metric': 'minkowski'}. Best is trial 10 with value: 0.8.
[32m[I 2023-04-26 02:22:01,950][39m Trial 312 finished with value: 0.8 and parameters: {'algorithm': 'brute', 'n_neighbors': 2, 'weights': 'distance', 'metric': 'minkowski'}. Best is trial 10 with value: 0.8.
[32m[I 2023-04-26 02:22:01,977][39m Trial 313 finished with value: 0.7428571428571429 and parameters: {'algorithm': 'kd_tree', 'n_neighbors': 2, 'weights': 'uniform', 'metric': 'euclidean'}. Best is trial 10 with value: 0.8.
[32m[I 2023-04-26 02:22:02,016][39m Trial 314 finished with value: 0.8 and parameters: {'algorithm': 'brute', 'n_neighbors': 2, 'weights': 'distance', 'metric': 'manhattan'}. Best is trial 10 with value: 0.8.
[32m[I 2023-04-26 02:22:02,039][39m Trial 315 finished with value: 0.8 and parameters: {'algorithm': 'kd_tree', 'n_neighbors': 1, 'weights': 'distance', 'metric': 'euclidean'}. Best is trial 10 with value: 0.8.
[32m[I 2023-04-26 02:22:02,061][39m Trial 316 finished with value: 0.8 and parameters: {'algorithm': 'kd_tree', 'n_neighbors': 2, 'weights': 'distance', 'metric': 'euclidean'}. Best is trial 10 with value: 0.8.
[32m[I 2023-04-26 02:22:02,100][39m Trial 317 finished with value: 0.8 and parameters: {'algorithm': 'brute', 'n_neighbors': 2, 'weights': 'distance', 'metric': 'euclidean'}. Best is trial 10 with value: 0.8.
[32m[I 2023-04-26 02:22:02,138][39m Trial 318 finished with value: 0.8 and parameters: {'algorithm': 'auto', 'n_neighbors': 2, 'weights': 'distance', 'metric': 'euclidean'}. Best is trial 10 with value: 0.8.
[32m[I 2023-04-26 02:22:02,175][39m Trial 319 finished with value: 0.8 and parameters: {'algorithm': 'brute', 'n_neighbors': 1, 'weights': 'distance', 'metric': 'manhattan'}. Best is trial 10 with value: 0.8.
[32m[I 2023-04-26 02:22:02,212][39m Trial 320 finished with value: 0.8 and parameters: {'algorithm': 'brute', 'n_neighbors': 1, 'weights': 'distance', 'metric': 'manhattan'}. Best is trial 10 with value: 0.8.
[32m[I 2023-04-26 02:22:02,250][39m Trial 321 finished with value: 0.8 and parameters: {'algorithm': 'brute', 'n_neighbors': 1, 'weights': 'distance', 'metric': 'manhattan'}. Best is trial 10 with value: 0.8.
[32m[I 2023-04-26 02:22:02,289][39m Trial 322 finished with value: 0.8 and parameters: {'algorithm': 'brute', 'n_neighbors': 1, 'weights': 'distance', 'metric': 'euclidean'}. Best is trial 10 with value: 0.8.
[32m[I 2023-04-26 02:22:02,312][39m Trial 323 finished with value: 0.8 and parameters: {'algorithm': 'kd_tree', 'n_neighbors': 4, 'weights': 'distance', 'metric': 'euclidean'}. Best is trial 10 with value: 0.8.
[32m[I 2023-04-26 02:22:02,337][39m Trial 324 finished with value: 0.7901234567901235 and parameters: {'algorithm': 'kd_tree', 'n_neighbors': 5, 'weights': 'distance', 'metric': 'euclidean'}. Best is trial 10 with value: 0.8.
[32m[I 2023-04-26 02:22:02,360][39m Trial 325 finished with value: 0.8 and parameters: {'algorithm': 'kd_tree', 'n_neighbors': 3, 'weights': 'distance', 'metric': 'minkowski'}. Best is trial 10 with value: 0.8.
[32m[I 2023-04-26 02:22:02,383][39m Trial 326 finished with value: 0.7948717948717948 and parameters: {'algorithm': 'kd_tree', 'n_neighbors': 6, 'weights': 'distance', 'metric': 'euclidean'}. Best is trial 10 with value: 0.8.
[32m[I 2023-04-26 02:22:02,398][39m Trial 327 finished with value: 0.8 and parameters: {'algorithm': 'kd_tree', 'n_neighbors': 3, 'weights': 'distance', 'metric': 'minkowski'}. Best is trial 10 with value: 0.8.
[32m[I 2023-04-26 02:22:02,412][39m Trial 328 finished with value: 0.75 and parameters: {'algorithm': 'kd_tree', 'n_neighbors': 4, 'weights': 'uniform', 'metric': 'minkowski'}. Best is trial 10 with value: 0.8.
[32m[I 2023-04-26 02:22:02,440][39m Trial 329 finished with value: 0.8 and parameters: {'algorithm': 'brute', 'n_neighbors': 2, 'weights': 'distance', 'metric': 'manhattan'}. Best is trial 10 with value: 0.8.
[32m[I 2023-04-26 02:22:02,462][39m Trial 330 finished with value: 0.7901234567901235 and parameters: {'algorithm': 'kd_tree', 'n_neighbors': 5, 'weights': 'distance', 'metric': 'minkowski'}. Best is trial 10 with value: 0.8.
[32m[I 2023-04-26 02:22:02,486][39m Trial 331 finished with value: 0.8 and parameters: {'algorithm': 'kd_tree', 'n_neighbors': 3, 'weights': 'distance', 'metric': 'minkowski'}. Best is trial 10 with value: 0.8.
[32m[I 2023-04-26 02:22:02,509][39m Trial 332 finished with value: 0.8 and parameters: {'algorithm': 'kd_tree', 'n_neighbors': 4, 'weights': 'distance', 'metric': 'minkowski'}. Best is trial 10 with value: 0.8.
[32m[I 2023-04-26 02:22:02,533][39m Trial 333 finished with value: 0.8 and parameters: {'algorithm': 'kd_tree', 'n_neighbors': 4, 'weights': 'distance', 'metric': 'minkowski'}. Best is trial 10 with value: 0.8.
[32m[I 2023-04-26 02:22:02,549][39m Trial 334 finished with value: 0.8 and parameters: {'algorithm': 'kd_tree', 'n_neighbors': 3, 'weights': 'distance', 'metric': 'minkowski'}. Best is trial 10 with value: 0.8.
[32m[I 2023-04-26 02:22:02,563][39m Trial 335 finished with value: 0.8 and parameters: {'algorithm': 'kd_tree', 'n_neighbors': 3, 'weights': 'distance', 'metric': 'minkowski'}. Best is trial 10 with value: 0.8.
[32m[I 2023-04-26 02:22:02,576][39m Trial 336 finished with value: 0.8 and parameters: {'algorithm': 'ball_tree', 'n_neighbors': 4, 'weights': 'distance', 'metric': 'euclidean'}. Best is trial 10 with value: 0.8.
[32m[I 2023-04-26 02:22:02,590][39m Trial 337 finished with value: 0.7083333333333334 and parameters: {'algorithm': 'kd_tree', 'n_neighbors': 30, 'weights': 'distance', 'metric': 'minkowski'}. Best is trial 10 with value: 0.8.
[32m[I 2023-04-26 02:22:02,604][39m Trial 338 finished with value: 0.8 and parameters: {'algorithm': 'ball_tree', 'n_neighbors': 1, 'weights': 'uniform', 'metric': 'manhattan'}. Best is trial 10 with value: 0.8.
[32m[I 2023-04-26 02:22:02,639][39m Trial 339 finished with value: 0.7848101265822786 and parameters: {'algorithm': 'brute', 'n_neighbors': 3, 'weights': 'distance', 'metric': 'manhattan'}. Best is trial 10 with value: 0.8.
[32m[I 2023-04-26 02:22:02,686][39m Trial 340 finished with value: 0.7594936708860759 and parameters: {'algorithm': 'brute', 'n_neighbors': 5, 'weights': 'distance', 'metric': 'manhattan'}. Best is trial 10 with value: 0.8.
[32m[I 2023-04-26 02:22:02,723][39m Trial 341 finished with value: 0.8 and parameters: {'algorithm': 'brute', 'n_neighbors': 1, 'weights': 'uniform', 'metric': 'manhattan'}. Best is trial 10 with value: 0.8.
[32m[I 2023-04-26 02:22:02,737][39m Trial 342 finished with value: 0.8 and parameters: {'algorithm': 'kd_tree', 'n_neighbors': 3, 'weights': 'distance', 'metric': 'minkowski'}. Best is trial 10 with value: 0.8.
[32m[I 2023-04-26 02:22:02,750][39m Trial 343 finished with value: 0.8 and parameters: {'algorithm': 'kd_tree', 'n_neighbors': 3, 'weights': 'distance', 'metric': 'minkowski'}. Best is trial 10 with value: 0.8.
[32m[I 2023-04-26 02:22:02,768][39m Trial 344 finished with value: 0.8 and parameters: {'algorithm': 'kd_tree', 'n_neighbors': 3, 'weights': 'distance', 'metric': 'minkowski'}. Best is trial 10 with value: 0.8.
[32m[I 2023-04-26 02:22:02,778][39m Trial 345 finished with value: 0.8 and parameters: {'algorithm': 'kd_tree', 'n_neighbors': 4, 'weights': 'distance', 'metric': 'minkowski'}. Best is trial 10 with value: 0.8.
[32m[I 2023-04-26 02:22:02,790][39m Trial 346 finished with value: 0.8 and parameters: {'algorithm': 'kd_tree', 'n_neighbors': 3, 'weights': 'distance', 'metric': 'minkowski'}. Best is trial 10 with value: 0.8.
[32m[I 2023-04-26 02:22:02,802][39m Trial 347 finished with value: 0.8 and parameters: {'algorithm': 'kd_tree', 'n_neighbors': 2, 'weights': 'distance', 'metric': 'minkowski'}. Best is trial 10 with value: 0.8.
[32m[I 2023-04-26 02:22:02,816][39m Trial 348 finished with value: 0.8 and parameters: {'algorithm': 'kd_tree', 'n_neighbors': 3, 'weights': 'distance', 'metric': 'minkowski'}. Best is trial 10 with value: 0.8.
[32m[I 2023-04-26 02:22:02,828][39m Trial 349 finished with value: 0.8 and parameters: {'algorithm': 'kd_tree', 'n_neighbors': 3, 'weights': 'distance', 'metric': 'minkowski'}. Best is trial 10 with value: 0.8.
[32m[I 2023-04-26 02:22:02,840][39m Trial 350 finished with value: 0.8 and parameters: {'algorithm': 'kd_tree', 'n_neighbors': 3, 'weights': 'distance', 'metric': 'minkowski'}. Best is trial 10 with value: 0.8.
[32m[I 2023-04-26 02:22:02,852][39m Trial 351 finished with value: 0.8 and parameters: {'algorithm': 'kd_tree', 'n_neighbors': 3, 'weights': 'distance', 'metric': 'minkowski'}. Best is trial 10 with value: 0.8.
[32m[I 2023-04-26 02:22:02,865][39m Trial 352 finished with value: 0.8 and parameters: {'algorithm': 'kd_tree', 'n_neighbors': 3, 'weights': 'distance', 'metric': 'minkowski'}. Best is trial 10 with value: 0.8.
[32m[I 2023-04-26 02:22:02,877][39m Trial 353 finished with value: 0.8 and parameters: {'algorithm': 'kd_tree', 'n_neighbors': 3, 'weights': 'distance', 'metric': 'minkowski'}. Best is trial 10 with value: 0.8.
[32m[I 2023-04-26 02:22:02,889][39m Trial 354 finished with value: 0.8 and parameters: {'algorithm': 'kd_tree', 'n_neighbors': 3, 'weights': 'distance', 'metric': 'minkowski'}. Best is trial 10 with value: 0.8.
[32m[I 2023-04-26 02:22:02,900][39m Trial 355 finished with value: 0.8 and parameters: {'algorithm': 'kd_tree', 'n_neighbors': 2, 'weights': 'distance', 'metric': 'minkowski'}. Best is trial 10 with value: 0.8.
[32m[I 2023-04-26 02:22:02,911][39m Trial 356 finished with value: 0.8 and parameters: {'algorithm': 'kd_tree', 'n_neighbors': 2, 'weights': 'distance', 'metric': 'minkowski'}. Best is trial 10 with value: 0.8.
[32m[I 2023-04-26 02:22:02,922][39m Trial 357 finished with value: 0.8 and parameters: {'algorithm': 'kd_tree', 'n_neighbors': 2, 'weights': 'distance', 'metric': 'minkowski'}. Best is trial 10 with value: 0.8.
[32m[I 2023-04-26 02:22:02,961][39m Trial 358 finished with value: 0.8 and parameters: {'algorithm': 'auto', 'n_neighbors': 2, 'weights': 'distance', 'metric': 'minkowski'}. Best is trial 10 with value: 0.8.
[32m[I 2023-04-26 02:22:03,006][39m Trial 359 finished with value: 0.8 and parameters: {'algorithm': 'auto', 'n_neighbors': 2, 'weights': 'distance', 'metric': 'minkowski'}. Best is trial 10 with value: 0.8.
[32m[I 2023-04-26 02:22:03,048][39m Trial 360 finished with value: 0.8 and parameters: {'algorithm': 'auto', 'n_neighbors': 2, 'weights': 'distance', 'metric': 'minkowski'}. Best is trial 10 with value: 0.8.
[32m[I 2023-04-26 02:22:03,076][39m Trial 361 finished with value: 0.8 and parameters: {'algorithm': 'ball_tree', 'n_neighbors': 1, 'weights': 'uniform', 'metric': 'manhattan'}. Best is trial 10 with value: 0.8.
[32m[I 2023-04-26 02:22:03,104][39m Trial 362 finished with value: 0.8 and parameters: {'algorithm': 'ball_tree', 'n_neighbors': 1, 'weights': 'uniform', 'metric': 'manhattan'}. Best is trial 10 with value: 0.8.
[32m[I 2023-04-26 02:22:03,133][39m Trial 363 finished with value: 0.8 and parameters: {'algorithm': 'ball_tree', 'n_neighbors': 1, 'weights': 'uniform', 'metric': 'manhattan'}. Best is trial 10 with value: 0.8.
[32m[I 2023-04-26 02:22:03,155][39m Trial 364 finished with value: 0.8 and parameters: {'algorithm': 'ball_tree', 'n_neighbors': 1, 'weights': 'uniform', 'metric': 'manhattan'}. Best is trial 10 with value: 0.8.
[32m[I 2023-04-26 02:22:03,187][39m Trial 365 finished with value: 0.8 and parameters: {'algorithm': 'auto', 'n_neighbors': 2, 'weights': 'distance', 'metric': 'minkowski'}. Best is trial 10 with value: 0.8.
[32m[I 2023-04-26 02:22:03,227][39m Trial 366 finished with value: 0.8 and parameters: {'algorithm': 'auto', 'n_neighbors': 2, 'weights': 'distance', 'metric': 'minkowski'}. Best is trial 10 with value: 0.8.
[32m[I 2023-04-26 02:22:03,267][39m Trial 367 finished with value: 0.8 and parameters: {'algorithm': 'brute', 'n_neighbors': 4, 'weights': 'distance', 'metric': 'euclidean'}. Best is trial 10 with value: 0.8.
[32m[I 2023-04-26 02:22:03,306][39m Trial 368 finished with value: 0.7948717948717948 and parameters: {'algorithm': 'brute', 'n_neighbors': 6, 'weights': 'distance', 'metric': 'euclidean'}. Best is trial 10 with value: 0.8.
[32m[I 2023-04-26 02:22:03,346][39m Trial 369 finished with value: 0.8 and parameters: {'algorithm': 'brute', 'n_neighbors': 1, 'weights': 'distance', 'metric': 'manhattan'}. Best is trial 10 with value: 0.8.
[32m[I 2023-04-26 02:22:03,385][39m Trial 370 finished with value: 0.8 and parameters: {'algorithm': 'auto', 'n_neighbors': 1, 'weights': 'distance', 'metric': 'minkowski'}. Best is trial 10 with value: 0.8.
[32m[I 2023-04-26 02:22:03,424][39m Trial 371 finished with value: 0.8 and parameters: {'algorithm': 'auto', 'n_neighbors': 1, 'weights': 'distance', 'metric': 'minkowski'}. Best is trial 10 with value: 0.8.
[32m[I 2023-04-26 02:22:03,464][39m Trial 372 finished with value: 0.8 and parameters: {'algorithm': 'auto', 'n_neighbors': 2, 'weights': 'distance', 'metric': 'minkowski'}. Best is trial 10 with value: 0.8.
[32m[I 2023-04-26 02:22:03,505][39m Trial 373 finished with value: 0.725 and parameters: {'algorithm': 'auto', 'n_neighbors': 8, 'weights': 'distance', 'metric': 'minkowski'}. Best is trial 10 with value: 0.8.
[32m[I 2023-04-26 02:22:03,529][39m Trial 374 finished with value: 0.8 and parameters: {'algorithm': 'kd_tree', 'n_neighbors': 2, 'weights': 'distance', 'metric': 'euclidean'}. Best is trial 10 with value: 0.8.
[32m[I 2023-04-26 02:22:03,556][39m Trial 375 finished with value: 0.8 and parameters: {'algorithm': 'kd_tree', 'n_neighbors': 2, 'weights': 'distance', 'metric': 'minkowski'}. Best is trial 10 with value: 0.8.
[32m[I 2023-04-26 02:22:03,599][39m Trial 376 finished with value: 0.8 and parameters: {'algorithm': 'brute', 'n_neighbors': 2, 'weights': 'distance', 'metric': 'minkowski'}. Best is trial 10 with value: 0.8.
[32m[I 2023-04-26 02:22:03,641][39m Trial 377 finished with value: 0.8 and parameters: {'algorithm': 'brute', 'n_neighbors': 2, 'weights': 'distance', 'metric': 'minkowski'}. Best is trial 10 with value: 0.8.
[32m[I 2023-04-26 02:22:03,680][39m Trial 378 finished with value: 0.8 and parameters: {'algorithm': 'brute', 'n_neighbors': 2, 'weights': 'distance', 'metric': 'minkowski'}. Best is trial 10 with value: 0.8.
[32m[I 2023-04-26 02:22:03,707][39m Trial 379 finished with value: 0.6976744186046511 and parameters: {'algorithm': 'kd_tree', 'n_neighbors': 19, 'weights': 'distance', 'metric': 'minkowski'}. Best is trial 10 with value: 0.8.
[32m[I 2023-04-26 02:22:03,733][39m Trial 380 finished with value: 0.8 and parameters: {'algorithm': 'kd_tree', 'n_neighbors': 4, 'weights': 'distance', 'metric': 'minkowski'}. Best is trial 10 with value: 0.8.
[32m[I 2023-04-26 02:22:03,759][39m Trial 381 finished with value: 0.725 and parameters: {'algorithm': 'kd_tree', 'n_neighbors': 10, 'weights': 'distance', 'metric': 'minkowski'}. Best is trial 10 with value: 0.8.
[32m[I 2023-04-26 02:22:03,784][39m Trial 382 finished with value: 0.8 and parameters: {'algorithm': 'kd_tree', 'n_neighbors': 4, 'weights': 'distance', 'metric': 'minkowski'}. Best is trial 10 with value: 0.8.
[32m[I 2023-04-26 02:22:03,802][39m Trial 383 finished with value: 0.8 and parameters: {'algorithm': 'kd_tree', 'n_neighbors': 3, 'weights': 'distance', 'metric': 'minkowski'}. Best is trial 10 with value: 0.8.
[32m[I 2023-04-26 02:22:03,818][39m Trial 384 finished with value: 0.8 and parameters: {'algorithm': 'kd_tree', 'n_neighbors': 3, 'weights': 'distance', 'metric': 'minkowski'}. Best is trial 10 with value: 0.8.
[32m[I 2023-04-26 02:22:03,831][39m Trial 385 finished with value: 0.8 and parameters: {'algorithm': 'kd_tree', 'n_neighbors': 4, 'weights': 'distance', 'metric': 'minkowski'}. Best is trial 10 with value: 0.8.
[32m[I 2023-04-26 02:22:03,844][39m Trial 386 finished with value: 0.7901234567901235 and parameters: {'algorithm': 'kd_tree', 'n_neighbors': 5, 'weights': 'distance', 'metric': 'minkowski'}. Best is trial 10 with value: 0.8.
[32m[I 2023-04-26 02:22:03,876][39m Trial 387 finished with value: 0.7901234567901235 and parameters: {'algorithm': 'brute', 'n_neighbors': 5, 'weights': 'distance', 'metric': 'euclidean'}. Best is trial 10 with value: 0.8.
[32m[I 2023-04-26 02:22:03,920][39m Trial 388 finished with value: 0.8 and parameters: {'algorithm': 'brute', 'n_neighbors': 4, 'weights': 'distance', 'metric': 'euclidean'}. Best is trial 10 with value: 0.8.
[32m[I 2023-04-26 02:22:03,945][39m Trial 389 finished with value: 0.6913580246913581 and parameters: {'algorithm': 'kd_tree', 'n_neighbors': 13, 'weights': 'distance', 'metric': 'minkowski'}. Best is trial 10 with value: 0.8.
[32m[I 2023-04-26 02:22:03,971][39m Trial 390 finished with value: 0.8 and parameters: {'algorithm': 'kd_tree', 'n_neighbors': 3, 'weights': 'distance', 'metric': 'minkowski'}. Best is trial 10 with value: 0.8.
[32m[I 2023-04-26 02:22:03,996][39m Trial 391 finished with value: 0.8 and parameters: {'algorithm': 'kd_tree', 'n_neighbors': 2, 'weights': 'distance', 'metric': 'minkowski'}. Best is trial 10 with value: 0.8.
[32m[I 2023-04-26 02:22:04,024][39m Trial 392 finished with value: 0.8 and parameters: {'algorithm': 'kd_tree', 'n_neighbors': 3, 'weights': 'distance', 'metric': 'minkowski'}. Best is trial 10 with value: 0.8.
[32m[I 2023-04-26 02:22:04,064][39m Trial 393 finished with value: 0.8 and parameters: {'algorithm': 'auto', 'n_neighbors': 2, 'weights': 'distance', 'metric': 'minkowski'}. Best is trial 10 with value: 0.8.
[32m[I 2023-04-26 02:22:04,108][39m Trial 394 finished with value: 0.8 and parameters: {'algorithm': 'auto', 'n_neighbors': 3, 'weights': 'distance', 'metric': 'minkowski'}. Best is trial 10 with value: 0.8.
[32m[I 2023-04-26 02:22:04,132][39m Trial 395 finished with value: 0.8 and parameters: {'algorithm': 'ball_tree', 'n_neighbors': 4, 'weights': 'distance', 'metric': 'euclidean'}. Best is trial 10 with value: 0.8.
[32m[I 2023-04-26 02:22:04,157][39m Trial 396 finished with value: 0.8 and parameters: {'algorithm': 'ball_tree', 'n_neighbors': 4, 'weights': 'distance', 'metric': 'euclidean'}. Best is trial 10 with value: 0.8.
[32m[I 2023-04-26 02:22:04,199][39m Trial 397 finished with value: 0.675 and parameters: {'algorithm': 'auto', 'n_neighbors': 12, 'weights': 'distance', 'metric': 'minkowski'}. Best is trial 10 with value: 0.8.
[32m[I 2023-04-26 02:22:04,242][39m Trial 398 finished with value: 0.8 and parameters: {'algorithm': 'auto', 'n_neighbors': 2, 'weights': 'distance', 'metric': 'minkowski'}. Best is trial 10 with value: 0.8.
[32m[I 2023-04-26 02:22:04,283][39m Trial 399 finished with value: 0.8 and parameters: {'algorithm': 'auto', 'n_neighbors': 2, 'weights': 'distance', 'metric': 'minkowski'}. Best is trial 10 with value: 0.8.
[32m[I 2023-04-26 02:22:04,323][39m Trial 400 finished with value: 0.8 and parameters: {'algorithm': 'auto', 'n_neighbors': 3, 'weights': 'distance', 'metric': 'minkowski'}. Best is trial 10 with value: 0.8.
[32m[I 2023-04-26 02:22:04,365][39m Trial 401 finished with value: 0.8 and parameters: {'algorithm': 'auto', 'n_neighbors': 2, 'weights': 'distance', 'metric': 'minkowski'}. Best is trial 10 with value: 0.8.
[32m[I 2023-04-26 02:22:04,406][39m Trial 402 finished with value: 0.7446808510638298 and parameters: {'algorithm': 'auto', 'n_neighbors': 26, 'weights': 'distance', 'metric': 'minkowski'}. Best is trial 10 with value: 0.8.
[32m[I 2023-04-26 02:22:04,445][39m Trial 403 finished with value: 0.8 and parameters: {'algorithm': 'auto', 'n_neighbors': 1, 'weights': 'uniform', 'metric': 'minkowski'}. Best is trial 10 with value: 0.8.
[32m[I 2023-04-26 02:22:04,460][39m Trial 404 finished with value: 0.7532467532467532 and parameters: {'algorithm': 'ball_tree', 'n_neighbors': 5, 'weights': 'uniform', 'metric': 'euclidean'}. Best is trial 10 with value: 0.8.
