[32m[I 2023-04-26 02:21:58,962][39m Trial 201 finished with value: 0.7901234567901235 and parameters: {'algorithm': 'brute', 'n_neighbors': 5, 'weights': 'distance', 'metric': 'euclidean'}. Best is trial 10 with value: 0.8.
[32m[I 2023-04-26 02:21:58,985][39m Trial 202 finished with value: 0.7428571428571429 and parameters: {'algorithm': 'kd_tree', 'n_neighbors': 2, 'weights': 'uniform', 'metric': 'minkowski'}. Best is trial 10 with value: 0.8.
[32m[I 2023-04-26 02:21:59,019][39m Trial 203 finished with value: 0.8 and parameters: {'algorithm': 'auto', 'n_neighbors': 1, 'weights': 'distance', 'metric': 'manhattan'}. Best is trial 10 with value: 0.8.
[32m[I 2023-04-26 02:21:59,036][39m Trial 204 finished with value: 0.8 and parameters: {'algorithm': 'ball_tree', 'n_neighbors': 1, 'weights': 'distance', 'metric': 'euclidean'}. Best is trial 10 with value: 0.8.
[32m[I 2023-04-26 02:21:59,055][39m Trial 205 finished with value: 0.8 and parameters: {'algorithm': 'ball_tree', 'n_neighbors': 1, 'weights': 'distance', 'metric': 'euclidean'}. Best is trial 10 with value: 0.8.
[32m[I 2023-04-26 02:21:59,073][39m Trial 206 finished with value: 0.8 and parameters: {'algorithm': 'ball_tree', 'n_neighbors': 1, 'weights': 'distance', 'metric': 'manhattan'}. Best is trial 10 with value: 0.8.
[32m[I 2023-04-26 02:21:59,110][39m Trial 207 finished with value: 0.7848101265822786 and parameters: {'algorithm': 'brute', 'n_neighbors': 3, 'weights': 'distance', 'metric': 'manhattan'}. Best is trial 10 with value: 0.8.
[32m[I 2023-04-26 02:21:59,128][39m Trial 208 finished with value: 0.8 and parameters: {'algorithm': 'kd_tree', 'n_neighbors': 3, 'weights': 'distance', 'metric': 'minkowski'}. Best is trial 10 with value: 0.8.
[32m[I 2023-04-26 02:21:59,147][39m Trial 209 finished with value: 0.8 and parameters: {'algorithm': 'kd_tree', 'n_neighbors': 3, 'weights': 'distance', 'metric': 'minkowski'}. Best is trial 10 with value: 0.8.
[32m[I 2023-04-26 02:21:59,166][39m Trial 210 finished with value: 0.8 and parameters: {'algorithm': 'kd_tree', 'n_neighbors': 2, 'weights': 'distance', 'metric': 'minkowski'}. Best is trial 10 with value: 0.8.
[32m[I 2023-04-26 02:21:59,202][39m Trial 211 finished with value: 0.8 and parameters: {'algorithm': 'brute', 'n_neighbors': 4, 'weights': 'distance', 'metric': 'euclidean'}. Best is trial 10 with value: 0.8.
[32m[I 2023-04-26 02:21:59,237][39m Trial 212 finished with value: 0.8 and parameters: {'algorithm': 'brute', 'n_neighbors': 4, 'weights': 'distance', 'metric': 'euclidean'}. Best is trial 10 with value: 0.8.
[32m[I 2023-04-26 02:21:59,256][39m Trial 213 finished with value: 0.8 and parameters: {'algorithm': 'kd_tree', 'n_neighbors': 3, 'weights': 'distance', 'metric': 'minkowski'}. Best is trial 10 with value: 0.8.
[32m[I 2023-04-26 02:21:59,275][39m Trial 214 finished with value: 0.8 and parameters: {'algorithm': 'kd_tree', 'n_neighbors': 3, 'weights': 'distance', 'metric': 'minkowski'}. Best is trial 10 with value: 0.8.
[32m[I 2023-04-26 02:21:59,294][39m Trial 215 finished with value: 0.8 and parameters: {'algorithm': 'kd_tree', 'n_neighbors': 3, 'weights': 'distance', 'metric': 'minkowski'}. Best is trial 10 with value: 0.8.
[32m[I 2023-04-26 02:21:59,315][39m Trial 216 finished with value: 0.8 and parameters: {'algorithm': 'kd_tree', 'n_neighbors': 2, 'weights': 'distance', 'metric': 'minkowski'}. Best is trial 10 with value: 0.8.
[32m[I 2023-04-26 02:21:59,334][39m Trial 217 finished with value: 0.8 and parameters: {'algorithm': 'kd_tree', 'n_neighbors': 2, 'weights': 'distance', 'metric': 'minkowski'}. Best is trial 10 with value: 0.8.
[32m[I 2023-04-26 02:21:59,347][39m Trial 218 finished with value: 0.8 and parameters: {'algorithm': 'kd_tree', 'n_neighbors': 2, 'weights': 'distance', 'metric': 'minkowski'}. Best is trial 10 with value: 0.8.
[32m[I 2023-04-26 02:21:59,358][39m Trial 219 finished with value: 0.7848101265822786 and parameters: {'algorithm': 'kd_tree', 'n_neighbors': 3, 'weights': 'distance', 'metric': 'manhattan'}. Best is trial 10 with value: 0.8.
[32m[I 2023-04-26 02:21:59,368][39m Trial 220 finished with value: 0.8 and parameters: {'algorithm': 'kd_tree', 'n_neighbors': 2, 'weights': 'distance', 'metric': 'minkowski'}. Best is trial 10 with value: 0.8.
[32m[I 2023-04-26 02:21:59,394][39m Trial 221 finished with value: 0.7848101265822786 and parameters: {'algorithm': 'auto', 'n_neighbors': 3, 'weights': 'distance', 'metric': 'manhattan'}. Best is trial 10 with value: 0.8.
[32m[I 2023-04-26 02:21:59,413][39m Trial 222 finished with value: 0.8 and parameters: {'algorithm': 'kd_tree', 'n_neighbors': 2, 'weights': 'distance', 'metric': 'minkowski'}. Best is trial 10 with value: 0.8.
[32m[I 2023-04-26 02:21:59,449][39m Trial 223 finished with value: 0.8 and parameters: {'algorithm': 'auto', 'n_neighbors': 1, 'weights': 'distance', 'metric': 'manhattan'}. Best is trial 10 with value: 0.8.
[32m[I 2023-04-26 02:21:59,483][39m Trial 224 finished with value: 0.8 and parameters: {'algorithm': 'auto', 'n_neighbors': 2, 'weights': 'distance', 'metric': 'manhattan'}. Best is trial 10 with value: 0.8.
[32m[I 2023-04-26 02:21:59,517][39m Trial 225 finished with value: 0.7848101265822786 and parameters: {'algorithm': 'auto', 'n_neighbors': 4, 'weights': 'distance', 'metric': 'manhattan'}. Best is trial 10 with value: 0.8.
[32m[I 2023-04-26 02:21:59,552][39m Trial 226 finished with value: 0.7848101265822786 and parameters: {'algorithm': 'auto', 'n_neighbors': 3, 'weights': 'distance', 'metric': 'manhattan'}. Best is trial 10 with value: 0.8.
[32m[I 2023-04-26 02:21:59,571][39m Trial 227 finished with value: 0.7848101265822786 and parameters: {'algorithm': 'kd_tree', 'n_neighbors': 3, 'weights': 'distance', 'metric': 'manhattan'}. Best is trial 10 with value: 0.8.
[32m[I 2023-04-26 02:21:59,591][39m Trial 228 finished with value: 0.7594936708860759 and parameters: {'algorithm': 'ball_tree', 'n_neighbors': 5, 'weights': 'distance', 'metric': 'manhattan'}. Best is trial 10 with value: 0.8.
[32m[I 2023-04-26 02:21:59,625][39m Trial 229 finished with value: 0.8 and parameters: {'algorithm': 'brute', 'n_neighbors': 2, 'weights': 'distance', 'metric': 'manhattan'}. Best is trial 10 with value: 0.8.
[32m[I 2023-04-26 02:21:59,646][39m Trial 230 finished with value: 0.7073170731707317 and parameters: {'algorithm': 'kd_tree', 'n_neighbors': 15, 'weights': 'distance', 'metric': 'minkowski'}. Best is trial 10 with value: 0.8.
[32m[I 2023-04-26 02:21:59,681][39m Trial 231 finished with value: 0.8 and parameters: {'algorithm': 'brute', 'n_neighbors': 1, 'weights': 'distance', 'metric': 'manhattan'}. Best is trial 10 with value: 0.8.
[32m[I 2023-04-26 02:21:59,701][39m Trial 232 finished with value: 0.8 and parameters: {'algorithm': 'kd_tree', 'n_neighbors': 1, 'weights': 'distance', 'metric': 'minkowski'}. Best is trial 10 with value: 0.8.
[32m[I 2023-04-26 02:21:59,722][39m Trial 233 finished with value: 0.8 and parameters: {'algorithm': 'kd_tree', 'n_neighbors': 4, 'weights': 'distance', 'metric': 'minkowski'}. Best is trial 10 with value: 0.8.
[32m[I 2023-04-26 02:21:59,745][39m Trial 234 finished with value: 0.7500000000000001 and parameters: {'algorithm': 'kd_tree', 'n_neighbors': 23, 'weights': 'distance', 'metric': 'minkowski'}. Best is trial 10 with value: 0.8.
[32m[I 2023-04-26 02:21:59,770][39m Trial 235 finished with value: 0.6304347826086957 and parameters: {'algorithm': 'kd_tree', 'n_neighbors': 11, 'weights': 'uniform', 'metric': 'minkowski'}. Best is trial 10 with value: 0.8.
[32m[I 2023-04-26 02:21:59,805][39m Trial 236 finished with value: 0.8 and parameters: {'algorithm': 'brute', 'n_neighbors': 1, 'weights': 'distance', 'metric': 'euclidean'}. Best is trial 10 with value: 0.8.
[32m[I 2023-04-26 02:21:59,824][39m Trial 237 finished with value: 0.8 and parameters: {'algorithm': 'kd_tree', 'n_neighbors': 2, 'weights': 'distance', 'metric': 'minkowski'}. Best is trial 10 with value: 0.8.
[32m[I 2023-04-26 02:21:59,844][39m Trial 238 finished with value: 0.8 and parameters: {'algorithm': 'kd_tree', 'n_neighbors': 2, 'weights': 'distance', 'metric': 'minkowski'}. Best is trial 10 with value: 0.8.
[32m[I 2023-04-26 02:21:59,864][39m Trial 239 finished with value: 0.7901234567901235 and parameters: {'algorithm': 'ball_tree', 'n_neighbors': 5, 'weights': 'distance', 'metric': 'euclidean'}. Best is trial 10 with value: 0.8.
[32m[I 2023-04-26 02:21:59,885][39m Trial 240 finished with value: 0.8 and parameters: {'algorithm': 'ball_tree', 'n_neighbors': 1, 'weights': 'distance', 'metric': 'euclidean'}. Best is trial 10 with value: 0.8.
[32m[I 2023-04-26 02:21:59,902][39m Trial 241 finished with value: 0.8 and parameters: {'algorithm': 'ball_tree', 'n_neighbors': 1, 'weights': 'distance', 'metric': 'euclidean'}. Best is trial 10 with value: 0.8.
[32m[I 2023-04-26 02:21:59,930][39m Trial 242 finished with value: 0.8 and parameters: {'algorithm': 'brute', 'n_neighbors': 4, 'weights': 'distance', 'metric': 'euclidean'}. Best is trial 10 with value: 0.8.
[32m[I 2023-04-26 02:21:59,950][39m Trial 243 finished with value: 0.8 and parameters: {'algorithm': 'kd_tree', 'n_neighbors': 2, 'weights': 'distance', 'metric': 'minkowski'}. Best is trial 10 with value: 0.8.
[32m[I 2023-04-26 02:21:59,970][39m Trial 244 finished with value: 0.8 and parameters: {'algorithm': 'kd_tree', 'n_neighbors': 2, 'weights': 'distance', 'metric': 'minkowski'}. Best is trial 10 with value: 0.8.
[32m[I 2023-04-26 02:22:00,006][39m Trial 245 finished with value: 0.8 and parameters: {'algorithm': 'brute', 'n_neighbors': 4, 'weights': 'distance', 'metric': 'euclidean'}. Best is trial 10 with value: 0.8.
[32m[I 2023-04-26 02:22:00,041][39m Trial 246 finished with value: 0.7901234567901235 and parameters: {'algorithm': 'brute', 'n_neighbors': 5, 'weights': 'distance', 'metric': 'euclidean'}. Best is trial 10 with value: 0.8.
[32m[I 2023-04-26 02:22:00,061][39m Trial 247 finished with value: 0.8 and parameters: {'algorithm': 'ball_tree', 'n_neighbors': 2, 'weights': 'distance', 'metric': 'manhattan'}. Best is trial 10 with value: 0.8.
[32m[I 2023-04-26 02:22:00,082][39m Trial 248 finished with value: 0.8 and parameters: {'algorithm': 'kd_tree', 'n_neighbors': 3, 'weights': 'distance', 'metric': 'minkowski'}. Best is trial 10 with value: 0.8.
[32m[I 2023-04-26 02:22:00,103][39m Trial 249 finished with value: 0.8 and parameters: {'algorithm': 'kd_tree', 'n_neighbors': 3, 'weights': 'distance', 'metric': 'minkowski'}. Best is trial 10 with value: 0.8.
[32m[I 2023-04-26 02:22:00,124][39m Trial 250 finished with value: 0.8 and parameters: {'algorithm': 'kd_tree', 'n_neighbors': 3, 'weights': 'distance', 'metric': 'minkowski'}. Best is trial 10 with value: 0.8.
[32m[I 2023-04-26 02:22:00,146][39m Trial 251 finished with value: 0.8 and parameters: {'algorithm': 'kd_tree', 'n_neighbors': 3, 'weights': 'distance', 'metric': 'minkowski'}. Best is trial 10 with value: 0.8.
[32m[I 2023-04-26 02:22:00,159][39m Trial 252 finished with value: 0.8 and parameters: {'algorithm': 'kd_tree', 'n_neighbors': 3, 'weights': 'distance', 'metric': 'minkowski'}. Best is trial 10 with value: 0.8.
[32m[I 2023-04-26 02:22:00,170][39m Trial 253 finished with value: 0.8 and parameters: {'algorithm': 'kd_tree', 'n_neighbors': 2, 'weights': 'distance', 'metric': 'minkowski'}. Best is trial 10 with value: 0.8.
[32m[I 2023-04-26 02:22:00,181][39m Trial 254 finished with value: 0.8 and parameters: {'algorithm': 'kd_tree', 'n_neighbors': 3, 'weights': 'distance', 'metric': 'minkowski'}. Best is trial 10 with value: 0.8.
[32m[I 2023-04-26 02:22:00,209][39m Trial 255 finished with value: 0.8 and parameters: {'algorithm': 'brute', 'n_neighbors': 1, 'weights': 'distance', 'metric': 'manhattan'}. Best is trial 10 with value: 0.8.
[32m[I 2023-04-26 02:22:00,251][39m Trial 256 finished with value: 0.7499999999999999 and parameters: {'algorithm': 'brute', 'n_neighbors': 27, 'weights': 'distance', 'metric': 'manhattan'}. Best is trial 10 with value: 0.8.
[32m[I 2023-04-26 02:22:00,287][39m Trial 257 finished with value: 0.8 and parameters: {'algorithm': 'auto', 'n_neighbors': 1, 'weights': 'distance', 'metric': 'manhattan'}. Best is trial 10 with value: 0.8.
[32m[I 2023-04-26 02:22:00,323][39m Trial 258 finished with value: 0.8 and parameters: {'algorithm': 'auto', 'n_neighbors': 2, 'weights': 'distance', 'metric': 'minkowski'}. Best is trial 10 with value: 0.8.
[32m[I 2023-04-26 02:22:00,357][39m Trial 259 finished with value: 0.8 and parameters: {'algorithm': 'auto', 'n_neighbors': 2, 'weights': 'distance', 'metric': 'minkowski'}. Best is trial 10 with value: 0.8.
[32m[I 2023-04-26 02:22:00,392][39m Trial 260 finished with value: 0.8 and parameters: {'algorithm': 'auto', 'n_neighbors': 2, 'weights': 'distance', 'metric': 'minkowski'}. Best is trial 10 with value: 0.8.
[32m[I 2023-04-26 02:22:00,428][39m Trial 261 finished with value: 0.8 and parameters: {'algorithm': 'auto', 'n_neighbors': 2, 'weights': 'distance', 'metric': 'minkowski'}. Best is trial 10 with value: 0.8.
[32m[I 2023-04-26 02:22:00,463][39m Trial 262 finished with value: 0.8 and parameters: {'algorithm': 'auto', 'n_neighbors': 2, 'weights': 'distance', 'metric': 'minkowski'}. Best is trial 10 with value: 0.8.
[32m[I 2023-04-26 02:22:00,501][39m Trial 263 finished with value: 0.8 and parameters: {'algorithm': 'auto', 'n_neighbors': 2, 'weights': 'distance', 'metric': 'minkowski'}. Best is trial 10 with value: 0.8.
[32m[I 2023-04-26 02:22:00,537][39m Trial 264 finished with value: 0.8 and parameters: {'algorithm': 'brute', 'n_neighbors': 1, 'weights': 'distance', 'metric': 'minkowski'}. Best is trial 10 with value: 0.8.
[32m[I 2023-04-26 02:22:00,574][39m Trial 265 finished with value: 0.8 and parameters: {'algorithm': 'auto', 'n_neighbors': 1, 'weights': 'distance', 'metric': 'minkowski'}. Best is trial 10 with value: 0.8.
[32m[I 2023-04-26 02:22:00,610][39m Trial 266 finished with value: 0.8 and parameters: {'algorithm': 'auto', 'n_neighbors': 1, 'weights': 'distance', 'metric': 'minkowski'}. Best is trial 10 with value: 0.8.
[32m[I 2023-04-26 02:22:00,647][39m Trial 267 finished with value: 0.8 and parameters: {'algorithm': 'auto', 'n_neighbors': 1, 'weights': 'distance', 'metric': 'minkowski'}. Best is trial 10 with value: 0.8.
[32m[I 2023-04-26 02:22:00,682][39m Trial 268 finished with value: 0.8 and parameters: {'algorithm': 'auto', 'n_neighbors': 2, 'weights': 'distance', 'metric': 'minkowski'}. Best is trial 10 with value: 0.8.
[32m[I 2023-04-26 02:22:00,719][39m Trial 269 finished with value: 0.8 and parameters: {'algorithm': 'brute', 'n_neighbors': 2, 'weights': 'distance', 'metric': 'minkowski'}. Best is trial 10 with value: 0.8.
[32m[I 2023-04-26 02:22:00,762][39m Trial 270 finished with value: 0.8 and parameters: {'algorithm': 'brute', 'n_neighbors': 1, 'weights': 'distance', 'metric': 'manhattan'}. Best is trial 10 with value: 0.8.
[32m[I 2023-04-26 02:22:00,804][39m Trial 271 finished with value: 0.8 and parameters: {'algorithm': 'brute', 'n_neighbors': 1, 'weights': 'distance', 'metric': 'manhattan'}. Best is trial 10 with value: 0.8.
[32m[I 2023-04-26 02:22:00,838][39m Trial 272 finished with value: 0.8 and parameters: {'algorithm': 'brute', 'n_neighbors': 2, 'weights': 'distance', 'metric': 'minkowski'}. Best is trial 10 with value: 0.8.
[32m[I 2023-04-26 02:22:00,875][39m Trial 273 finished with value: 0.8 and parameters: {'algorithm': 'brute', 'n_neighbors': 1, 'weights': 'distance', 'metric': 'manhattan'}. Best is trial 10 with value: 0.8.
[32m[I 2023-04-26 02:22:00,913][39m Trial 274 finished with value: 0.8 and parameters: {'algorithm': 'brute', 'n_neighbors': 1, 'weights': 'distance', 'metric': 'manhattan'}. Best is trial 10 with value: 0.8.
[32m[I 2023-04-26 02:22:00,949][39m Trial 275 finished with value: 0.8 and parameters: {'algorithm': 'brute', 'n_neighbors': 2, 'weights': 'distance', 'metric': 'manhattan'}. Best is trial 10 with value: 0.8.
[32m[I 2023-04-26 02:22:00,984][39m Trial 276 finished with value: 0.8 and parameters: {'algorithm': 'brute', 'n_neighbors': 2, 'weights': 'distance', 'metric': 'manhattan'}. Best is trial 10 with value: 0.8.
[32m[I 2023-04-26 02:22:01,005][39m Trial 277 finished with value: 0.8 and parameters: {'algorithm': 'kd_tree', 'n_neighbors': 1, 'weights': 'distance', 'metric': 'manhattan'}. Best is trial 10 with value: 0.8.
[32m[I 2023-04-26 02:22:01,027][39m Trial 278 finished with value: 0.7848101265822786 and parameters: {'algorithm': 'kd_tree', 'n_neighbors': 4, 'weights': 'distance', 'metric': 'manhattan'}. Best is trial 10 with value: 0.8.
[32m[I 2023-04-26 02:22:01,053][39m Trial 279 finished with value: 0.8 and parameters: {'algorithm': 'kd_tree', 'n_neighbors': 1, 'weights': 'uniform', 'metric': 'manhattan'}. Best is trial 10 with value: 0.8.
[32m[I 2023-04-26 02:22:01,092][39m Trial 280 finished with value: 0.8 and parameters: {'algorithm': 'brute', 'n_neighbors': 1, 'weights': 'distance', 'metric': 'manhattan'}. Best is trial 10 with value: 0.8.
[32m[I 2023-04-26 02:22:01,117][39m Trial 281 finished with value: 0.7692307692307694 and parameters: {'algorithm': 'kd_tree', 'n_neighbors': 3, 'weights': 'uniform', 'metric': 'euclidean'}. Best is trial 10 with value: 0.8.
[32m[I 2023-04-26 02:22:01,141][39m Trial 282 finished with value: 0.8 and parameters: {'algorithm': 'kd_tree', 'n_neighbors': 4, 'weights': 'distance', 'metric': 'euclidean'}. Best is trial 10 with value: 0.8.
[32m[I 2023-04-26 02:22:01,179][39m Trial 283 finished with value: 0.8 and parameters: {'algorithm': 'brute', 'n_neighbors': 2, 'weights': 'distance', 'metric': 'manhattan'}. Best is trial 10 with value: 0.8.
[32m[I 2023-04-26 02:22:01,213][39m Trial 284 finished with value: 0.7294117647058823 and parameters: {'algorithm': 'brute', 'n_neighbors': 10, 'weights': 'distance', 'metric': 'manhattan'}. Best is trial 10 with value: 0.8.
[32m[I 2023-04-26 02:22:01,236][39m Trial 285 finished with value: 0.7073170731707317 and parameters: {'algorithm': 'kd_tree', 'n_neighbors': 14, 'weights': 'distance', 'metric': 'minkowski'}. Best is trial 10 with value: 0.8.
[32m[I 2023-04-26 02:22:01,259][39m Trial 286 finished with value: 0.8 and parameters: {'algorithm': 'kd_tree', 'n_neighbors': 3, 'weights': 'distance', 'metric': 'minkowski'}. Best is trial 10 with value: 0.8.
[32m[I 2023-04-26 02:22:01,297][39m Trial 287 finished with value: 0.8 and parameters: {'algorithm': 'brute', 'n_neighbors': 1, 'weights': 'distance', 'metric': 'euclidean'}. Best is trial 10 with value: 0.8.
[32m[I 2023-04-26 02:22:01,334][39m Trial 288 finished with value: 0.8 and parameters: {'algorithm': 'brute', 'n_neighbors': 4, 'weights': 'distance', 'metric': 'euclidean'}. Best is trial 10 with value: 0.8.
[32m[I 2023-04-26 02:22:01,371][39m Trial 289 finished with value: 0.8 and parameters: {'algorithm': 'brute', 'n_neighbors': 1, 'weights': 'distance', 'metric': 'euclidean'}. Best is trial 10 with value: 0.8.
[32m[I 2023-04-26 02:22:01,408][39m Trial 290 finished with value: 0.8 and parameters: {'algorithm': 'brute', 'n_neighbors': 1, 'weights': 'distance', 'metric': 'manhattan'}. Best is trial 10 with value: 0.8.
[32m[I 2023-04-26 02:22:01,446][39m Trial 291 finished with value: 0.8 and parameters: {'algorithm': 'brute', 'n_neighbors': 3, 'weights': 'distance', 'metric': 'euclidean'}. Best is trial 10 with value: 0.8.
[32m[I 2023-04-26 02:22:01,482][39m Trial 292 finished with value: 0.8 and parameters: {'algorithm': 'brute', 'n_neighbors': 1, 'weights': 'distance', 'metric': 'manhattan'}. Best is trial 10 with value: 0.8.
[32m[I 2023-04-26 02:22:01,505][39m Trial 293 finished with value: 0.7848101265822786 and parameters: {'algorithm': 'ball_tree', 'n_neighbors': 3, 'weights': 'distance', 'metric': 'manhattan'}. Best is trial 10 with value: 0.8.
[32m[I 2023-04-26 02:22:01,527][39m Trial 294 finished with value: 0.8 and parameters: {'algorithm': 'ball_tree', 'n_neighbors': 1, 'weights': 'distance', 'metric': 'euclidean'}. Best is trial 10 with value: 0.8.
[32m[I 2023-04-26 02:22:01,562][39m Trial 295 finished with value: 0.7157894736842105 and parameters: {'algorithm': 'brute', 'n_neighbors': 17, 'weights': 'uniform', 'metric': 'manhattan'}. Best is trial 10 with value: 0.8.
[32m[I 2023-04-26 02:22:01,575][39m Trial 296 finished with value: 0.8 and parameters: {'algorithm': 'kd_tree', 'n_neighbors': 3, 'weights': 'distance', 'metric': 'minkowski'}. Best is trial 10 with value: 0.8.
[32m[I 2023-04-26 02:22:01,589][39m Trial 297 finished with value: 0.8 and parameters: {'algorithm': 'ball_tree', 'n_neighbors': 1, 'weights': 'uniform', 'metric': 'euclidean'}. Best is trial 10 with value: 0.8.
[32m[I 2023-04-26 02:22:01,610][39m Trial 298 finished with value: 0.8 and parameters: {'algorithm': 'brute', 'n_neighbors': 1, 'weights': 'uniform', 'metric': 'manhattan'}. Best is trial 10 with value: 0.8.
[32m[I 2023-04-26 02:22:01,632][39m Trial 299 finished with value: 0.8 and parameters: {'algorithm': 'brute', 'n_neighbors': 1, 'weights': 'uniform', 'metric': 'manhattan'}. Best is trial 10 with value: 0.8.
[32m[I 2023-04-26 02:22:01,645][39m Trial 300 finished with value: 0.8 and parameters: {'algorithm': 'ball_tree', 'n_neighbors': 1, 'weights': 'uniform', 'metric': 'euclidean'}. Best is trial 10 with value: 0.8.
[32m[I 2023-04-26 02:22:01,656][39m Trial 301 finished with value: 0.7428571428571429 and parameters: {'algorithm': 'kd_tree', 'n_neighbors': 2, 'weights': 'uniform', 'metric': 'minkowski'}. Best is trial 10 with value: 0.8.
[32m[I 2023-04-26 02:22:01,694][39m Trial 302 finished with value: 0.8 and parameters: {'algorithm': 'auto', 'n_neighbors': 3, 'weights': 'distance', 'metric': 'minkowski'}. Best is trial 10 with value: 0.8.
