[32m[I 2023-04-26 02:21:54,852][39m A new study created in memory with name: no-name-6f852eda-04dd-4230-87bb-035ecdaec9f8
[32m[I 2023-04-26 02:21:54,882][39m Trial 0 finished with value: 0.7446808510638298 and parameters: {'algorithm': 'auto', 'n_neighbors': 26, 'weights': 'distance', 'metric': 'minkowski'}. Best is trial 0 with value: 0.7446808510638298.
[32m[I 2023-04-26 02:21:54,901][39m Trial 1 finished with value: 0.6930693069306931 and parameters: {'algorithm': 'brute', 'n_neighbors': 15, 'weights': 'uniform', 'metric': 'minkowski'}. Best is trial 0 with value: 0.7446808510638298.
[32m[I 2023-04-26 02:21:54,908][39m Trial 2 finished with value: 0.7368421052631579 and parameters: {'algorithm': 'kd_tree', 'n_neighbors': 27, 'weights': 'distance', 'metric': 'euclidean'}. Best is trial 0 with value: 0.7446808510638298.
[32m[I 2023-04-26 02:21:54,913][39m Trial 3 finished with value: 0.7692307692307694 and parameters: {'algorithm': 'kd_tree', 'n_neighbors': 6, 'weights': 'distance', 'metric': 'manhattan'}. Best is trial 3 with value: 0.7692307692307694.
[32m[I 2023-04-26 02:21:54,927][39m Trial 4 finished with value: 0.6868686868686867 and parameters: {'algorithm': 'brute', 'n_neighbors': 22, 'weights': 'uniform', 'metric': 'manhattan'}. Best is trial 3 with value: 0.7692307692307694.
[32m[I 2023-04-26 02:21:54,948][39m Trial 5 finished with value: 0.6249999999999999 and parameters: {'algorithm': 'brute', 'n_neighbors': 14, 'weights': 'uniform', 'metric': 'euclidean'}. Best is trial 3 with value: 0.7692307692307694.
[32m[I 2023-04-26 02:21:54,965][39m Trial 6 finished with value: 0.7238095238095238 and parameters: {'algorithm': 'auto', 'n_neighbors': 26, 'weights': 'uniform', 'metric': 'manhattan'}. Best is trial 3 with value: 0.7692307692307694.
[32m[I 2023-04-26 02:21:54,970][39m Trial 7 finished with value: 0.6913580246913581 and parameters: {'algorithm': 'kd_tree', 'n_neighbors': 13, 'weights': 'distance', 'metric': 'minkowski'}. Best is trial 3 with value: 0.7692307692307694.
[32m[I 2023-04-26 02:21:54,994][39m Trial 8 finished with value: 0.7397260273972602 and parameters: {'algorithm': 'brute', 'n_neighbors': 4, 'weights': 'uniform', 'metric': 'euclidean'}. Best is trial 3 with value: 0.7692307692307694.
[32m[I 2023-04-26 02:21:55,000][39m Trial 9 finished with value: 0.7532467532467532 and parameters: {'algorithm': 'kd_tree', 'n_neighbors': 5, 'weights': 'uniform', 'metric': 'minkowski'}. Best is trial 3 with value: 0.7692307692307694.
[32m[I 2023-04-26 02:21:55,008][39m Trial 10 finished with value: 0.8 and parameters: {'algorithm': 'ball_tree', 'n_neighbors': 1, 'weights': 'distance', 'metric': 'manhattan'}. Best is trial 10 with value: 0.8.
[32m[I 2023-04-26 02:21:55,015][39m Trial 11 finished with value: 0.7317073170731707 and parameters: {'algorithm': 'ball_tree', 'n_neighbors': 8, 'weights': 'distance', 'metric': 'manhattan'}. Best is trial 10 with value: 0.8.
[32m[I 2023-04-26 02:21:55,022][39m Trial 12 finished with value: 0.8 and parameters: {'algorithm': 'ball_tree', 'n_neighbors': 1, 'weights': 'distance', 'metric': 'manhattan'}. Best is trial 10 with value: 0.8.
[32m[I 2023-04-26 02:21:55,029][39m Trial 13 finished with value: 0.8 and parameters: {'algorithm': 'ball_tree', 'n_neighbors': 2, 'weights': 'distance', 'metric': 'manhattan'}. Best is trial 10 with value: 0.8.
[32m[I 2023-04-26 02:21:55,036][39m Trial 14 finished with value: 0.8 and parameters: {'algorithm': 'ball_tree', 'n_neighbors': 1, 'weights': 'distance', 'metric': 'manhattan'}. Best is trial 10 with value: 0.8.
[32m[I 2023-04-26 02:21:55,043][39m Trial 15 finished with value: 0.7317073170731707 and parameters: {'algorithm': 'ball_tree', 'n_neighbors': 9, 'weights': 'distance', 'metric': 'manhattan'}. Best is trial 10 with value: 0.8.
[32m[I 2023-04-26 02:21:55,051][39m Trial 16 finished with value: 0.7500000000000001 and parameters: {'algorithm': 'ball_tree', 'n_neighbors': 20, 'weights': 'distance', 'metric': 'manhattan'}. Best is trial 10 with value: 0.8.
[32m[I 2023-04-26 02:21:55,057][39m Trial 17 finished with value: 0.7294117647058823 and parameters: {'algorithm': 'ball_tree', 'n_neighbors': 11, 'weights': 'distance', 'metric': 'manhattan'}. Best is trial 10 with value: 0.8.
[32m[I 2023-04-26 02:21:55,064][39m Trial 18 finished with value: 0.7586206896551724 and parameters: {'algorithm': 'ball_tree', 'n_neighbors': 18, 'weights': 'distance', 'metric': 'manhattan'}. Best is trial 10 with value: 0.8.
[32m[I 2023-04-26 02:21:55,070][39m Trial 19 finished with value: 0.8 and parameters: {'algorithm': 'ball_tree', 'n_neighbors': 3, 'weights': 'distance', 'metric': 'euclidean'}. Best is trial 10 with value: 0.8.
[32m[I 2023-04-26 02:21:55,102][39m Trial 20 finished with value: 0.725 and parameters: {'algorithm': 'auto', 'n_neighbors': 8, 'weights': 'distance', 'metric': 'euclidean'}. Best is trial 10 with value: 0.8.
[32m[I 2023-04-26 02:21:55,116][39m Trial 21 finished with value: 0.8 and parameters: {'algorithm': 'ball_tree', 'n_neighbors': 1, 'weights': 'distance', 'metric': 'manhattan'}. Best is trial 10 with value: 0.8.
[32m[I 2023-04-26 02:21:55,127][39m Trial 22 finished with value: 0.8 and parameters: {'algorithm': 'ball_tree', 'n_neighbors': 3, 'weights': 'distance', 'metric': 'euclidean'}. Best is trial 10 with value: 0.8.
[32m[I 2023-04-26 02:21:55,141][39m Trial 23 finished with value: 0.8 and parameters: {'algorithm': 'ball_tree', 'n_neighbors': 4, 'weights': 'distance', 'metric': 'euclidean'}. Best is trial 10 with value: 0.8.
[32m[I 2023-04-26 02:21:55,155][39m Trial 24 finished with value: 0.7948717948717948 and parameters: {'algorithm': 'ball_tree', 'n_neighbors': 6, 'weights': 'distance', 'metric': 'euclidean'}. Best is trial 10 with value: 0.8.
[32m[I 2023-04-26 02:21:55,170][39m Trial 25 finished with value: 0.7083333333333334 and parameters: {'algorithm': 'ball_tree', 'n_neighbors': 30, 'weights': 'distance', 'metric': 'euclidean'}. Best is trial 10 with value: 0.8.
[32m[I 2023-04-26 02:21:55,184][39m Trial 26 finished with value: 0.7088607594936709 and parameters: {'algorithm': 'ball_tree', 'n_neighbors': 11, 'weights': 'distance', 'metric': 'euclidean'}. Best is trial 10 with value: 0.8.
[32m[I 2023-04-26 02:21:55,200][39m Trial 27 finished with value: 0.8 and parameters: {'algorithm': 'ball_tree', 'n_neighbors': 3, 'weights': 'distance', 'metric': 'euclidean'}. Best is trial 10 with value: 0.8.
[32m[I 2023-04-26 02:21:55,230][39m Trial 28 finished with value: 0.7407407407407408 and parameters: {'algorithm': 'auto', 'n_neighbors': 7, 'weights': 'distance', 'metric': 'euclidean'}. Best is trial 10 with value: 0.8.
[32m[I 2023-04-26 02:21:55,260][39m Trial 29 finished with value: 0.725 and parameters: {'algorithm': 'auto', 'n_neighbors': 10, 'weights': 'distance', 'metric': 'minkowski'}. Best is trial 10 with value: 0.8.
[32m[I 2023-04-26 02:21:55,274][39m Trial 30 finished with value: 0.8 and parameters: {'algorithm': 'ball_tree', 'n_neighbors': 4, 'weights': 'distance', 'metric': 'euclidean'}. Best is trial 10 with value: 0.8.
[32m[I 2023-04-26 02:21:55,288][39m Trial 31 finished with value: 0.8 and parameters: {'algorithm': 'ball_tree', 'n_neighbors': 4, 'weights': 'distance', 'metric': 'euclidean'}. Best is trial 10 with value: 0.8.
[32m[I 2023-04-26 02:21:55,301][39m Trial 32 finished with value: 0.8 and parameters: {'algorithm': 'ball_tree', 'n_neighbors': 4, 'weights': 'distance', 'metric': 'euclidean'}. Best is trial 10 with value: 0.8.
[32m[I 2023-04-26 02:21:55,314][39m Trial 33 finished with value: 0.7901234567901235 and parameters: {'algorithm': 'ball_tree', 'n_neighbors': 5, 'weights': 'distance', 'metric': 'euclidean'}. Best is trial 10 with value: 0.8.
[32m[I 2023-04-26 02:21:55,328][39m Trial 34 finished with value: 0.8 and parameters: {'algorithm': 'ball_tree', 'n_neighbors': 1, 'weights': 'distance', 'metric': 'manhattan'}. Best is trial 10 with value: 0.8.
[32m[I 2023-04-26 02:21:55,352][39m Trial 35 finished with value: 0.7733333333333334 and parameters: {'algorithm': 'brute', 'n_neighbors': 6, 'weights': 'uniform', 'metric': 'euclidean'}. Best is trial 10 with value: 0.8.
[32m[I 2023-04-26 02:21:55,359][39m Trial 36 finished with value: 0.6904761904761904 and parameters: {'algorithm': 'kd_tree', 'n_neighbors': 16, 'weights': 'distance', 'metric': 'euclidean'}. Best is trial 10 with value: 0.8.
[32m[I 2023-04-26 02:21:55,369][39m Trial 37 finished with value: 0.7428571428571429 and parameters: {'algorithm': 'ball_tree', 'n_neighbors': 2, 'weights': 'uniform', 'metric': 'manhattan'}. Best is trial 10 with value: 0.8.
[32m[I 2023-04-26 02:21:55,390][39m Trial 38 finished with value: 0.8 and parameters: {'algorithm': 'brute', 'n_neighbors': 2, 'weights': 'distance', 'metric': 'manhattan'}. Best is trial 10 with value: 0.8.
[32m[I 2023-04-26 02:21:55,405][39m Trial 39 finished with value: 0.675 and parameters: {'algorithm': 'kd_tree', 'n_neighbors': 12, 'weights': 'distance', 'metric': 'minkowski'}. Best is trial 10 with value: 0.8.
[32m[I 2023-04-26 02:21:55,430][39m Trial 40 finished with value: 0.6862745098039217 and parameters: {'algorithm': 'auto', 'n_neighbors': 24, 'weights': 'uniform', 'metric': 'euclidean'}. Best is trial 10 with value: 0.8.
[32m[I 2023-04-26 02:21:55,437][39m Trial 41 finished with value: 0.8 and parameters: {'algorithm': 'ball_tree', 'n_neighbors': 2, 'weights': 'distance', 'metric': 'manhattan'}. Best is trial 10 with value: 0.8.
[32m[I 2023-04-26 02:21:55,444][39m Trial 42 finished with value: 0.7848101265822786 and parameters: {'algorithm': 'ball_tree', 'n_neighbors': 3, 'weights': 'distance', 'metric': 'manhattan'}. Best is trial 10 with value: 0.8.
[32m[I 2023-04-26 02:21:55,451][39m Trial 43 finished with value: 0.8 and parameters: {'algorithm': 'ball_tree', 'n_neighbors': 1, 'weights': 'distance', 'metric': 'manhattan'}. Best is trial 10 with value: 0.8.
[32m[I 2023-04-26 02:21:55,457][39m Trial 44 finished with value: 0.7594936708860759 and parameters: {'algorithm': 'kd_tree', 'n_neighbors': 5, 'weights': 'distance', 'metric': 'manhattan'}. Best is trial 10 with value: 0.8.
[32m[I 2023-04-26 02:21:55,466][39m Trial 45 finished with value: 0.7407407407407408 and parameters: {'algorithm': 'ball_tree', 'n_neighbors': 7, 'weights': 'distance', 'metric': 'minkowski'}. Best is trial 10 with value: 0.8.
[32m[I 2023-04-26 02:21:55,491][39m Trial 46 finished with value: 0.7692307692307694 and parameters: {'algorithm': 'brute', 'n_neighbors': 3, 'weights': 'uniform', 'metric': 'euclidean'}. Best is trial 10 with value: 0.8.
[32m[I 2023-04-26 02:21:55,502][39m Trial 47 finished with value: 0.7948717948717948 and parameters: {'algorithm': 'ball_tree', 'n_neighbors': 6, 'weights': 'distance', 'metric': 'euclidean'}. Best is trial 10 with value: 0.8.
[32m[I 2023-04-26 02:21:55,509][39m Trial 48 finished with value: 0.8 and parameters: {'algorithm': 'ball_tree', 'n_neighbors': 1, 'weights': 'distance', 'metric': 'manhattan'}. Best is trial 10 with value: 0.8.
[32m[I 2023-04-26 02:21:55,515][39m Trial 49 finished with value: 0.8 and parameters: {'algorithm': 'ball_tree', 'n_neighbors': 1, 'weights': 'distance', 'metric': 'manhattan'}. Best is trial 10 with value: 0.8.
[32m[I 2023-04-26 02:21:55,523][39m Trial 50 finished with value: 0.7317073170731707 and parameters: {'algorithm': 'ball_tree', 'n_neighbors': 9, 'weights': 'distance', 'metric': 'manhattan'}. Best is trial 10 with value: 0.8.
[32m[I 2023-04-26 02:21:55,531][39m Trial 51 finished with value: 0.8 and parameters: {'algorithm': 'ball_tree', 'n_neighbors': 4, 'weights': 'distance', 'metric': 'euclidean'}. Best is trial 10 with value: 0.8.
[32m[I 2023-04-26 02:21:55,538][39m Trial 52 finished with value: 0.8 and parameters: {'algorithm': 'ball_tree', 'n_neighbors': 4, 'weights': 'distance', 'metric': 'euclidean'}. Best is trial 10 with value: 0.8.
[32m[I 2023-04-26 02:21:55,545][39m Trial 53 finished with value: 0.8 and parameters: {'algorithm': 'ball_tree', 'n_neighbors': 4, 'weights': 'distance', 'metric': 'euclidean'}. Best is trial 10 with value: 0.8.
[32m[I 2023-04-26 02:21:55,553][39m Trial 54 finished with value: 0.7901234567901235 and parameters: {'algorithm': 'ball_tree', 'n_neighbors': 5, 'weights': 'distance', 'metric': 'euclidean'}. Best is trial 10 with value: 0.8.
[32m[I 2023-04-26 02:21:55,561][39m Trial 55 finished with value: 0.7407407407407408 and parameters: {'algorithm': 'ball_tree', 'n_neighbors': 7, 'weights': 'distance', 'metric': 'euclidean'}. Best is trial 10 with value: 0.8.
[32m[I 2023-04-26 02:21:55,593][39m Trial 56 finished with value: 0.8 and parameters: {'algorithm': 'brute', 'n_neighbors': 3, 'weights': 'distance', 'metric': 'minkowski'}. Best is trial 10 with value: 0.8.
[32m[I 2023-04-26 02:21:55,619][39m Trial 57 finished with value: 0.7323943661971831 and parameters: {'algorithm': 'brute', 'n_neighbors': 2, 'weights': 'uniform', 'metric': 'minkowski'}. Best is trial 10 with value: 0.8.
[32m[I 2023-04-26 02:21:55,644][39m Trial 58 finished with value: 0.8 and parameters: {'algorithm': 'brute', 'n_neighbors': 2, 'weights': 'distance', 'metric': 'manhattan'}. Best is trial 10 with value: 0.8.
[32m[I 2023-04-26 02:21:55,676][39m Trial 59 finished with value: 0.725 and parameters: {'algorithm': 'brute', 'n_neighbors': 8, 'weights': 'distance', 'metric': 'euclidean'}. Best is trial 10 with value: 0.8.
[32m[I 2023-04-26 02:21:55,689][39m Trial 60 finished with value: 0.7948717948717948 and parameters: {'algorithm': 'ball_tree', 'n_neighbors': 6, 'weights': 'distance', 'metric': 'euclidean'}. Best is trial 10 with value: 0.8.
[32m[I 2023-04-26 02:21:55,702][39m Trial 61 finished with value: 0.8 and parameters: {'algorithm': 'ball_tree', 'n_neighbors': 3, 'weights': 'distance', 'metric': 'euclidean'}. Best is trial 10 with value: 0.8.
[32m[I 2023-04-26 02:21:55,716][39m Trial 62 finished with value: 0.8 and parameters: {'algorithm': 'ball_tree', 'n_neighbors': 4, 'weights': 'distance', 'metric': 'euclidean'}. Best is trial 10 with value: 0.8.
[32m[I 2023-04-26 02:21:55,730][39m Trial 63 finished with value: 0.8 and parameters: {'algorithm': 'ball_tree', 'n_neighbors': 4, 'weights': 'distance', 'metric': 'euclidean'}. Best is trial 10 with value: 0.8.
[32m[I 2023-04-26 02:21:55,745][39m Trial 64 finished with value: 0.7901234567901235 and parameters: {'algorithm': 'ball_tree', 'n_neighbors': 5, 'weights': 'distance', 'metric': 'euclidean'}. Best is trial 10 with value: 0.8.
[32m[I 2023-04-26 02:21:55,760][39m Trial 65 finished with value: 0.7073170731707317 and parameters: {'algorithm': 'ball_tree', 'n_neighbors': 15, 'weights': 'distance', 'metric': 'euclidean'}. Best is trial 10 with value: 0.8.
[32m[I 2023-04-26 02:21:55,774][39m Trial 66 finished with value: 0.8 and parameters: {'algorithm': 'ball_tree', 'n_neighbors': 1, 'weights': 'distance', 'metric': 'manhattan'}. Best is trial 10 with value: 0.8.
[32m[I 2023-04-26 02:21:55,799][39m Trial 67 finished with value: 0.8 and parameters: {'algorithm': 'brute', 'n_neighbors': 2, 'weights': 'distance', 'metric': 'manhattan'}. Best is trial 10 with value: 0.8.
[32m[I 2023-04-26 02:21:55,827][39m Trial 68 finished with value: 0.8 and parameters: {'algorithm': 'brute', 'n_neighbors': 2, 'weights': 'distance', 'metric': 'manhattan'}. Best is trial 10 with value: 0.8.
[32m[I 2023-04-26 02:21:55,852][39m Trial 69 finished with value: 0.7749999999999999 and parameters: {'algorithm': 'brute', 'n_neighbors': 5, 'weights': 'uniform', 'metric': 'manhattan'}. Best is trial 10 with value: 0.8.
[32m[I 2023-04-26 02:21:55,880][39m Trial 70 finished with value: 0.8 and parameters: {'algorithm': 'auto', 'n_neighbors': 1, 'weights': 'distance', 'metric': 'manhattan'}. Best is trial 10 with value: 0.8.
[32m[I 2023-04-26 02:21:55,910][39m Trial 71 finished with value: 0.8 and parameters: {'algorithm': 'auto', 'n_neighbors': 1, 'weights': 'distance', 'metric': 'manhattan'}. Best is trial 10 with value: 0.8.
[32m[I 2023-04-26 02:21:55,940][39m Trial 72 finished with value: 0.7848101265822786 and parameters: {'algorithm': 'auto', 'n_neighbors': 3, 'weights': 'distance', 'metric': 'manhattan'}. Best is trial 10 with value: 0.8.
[32m[I 2023-04-26 02:21:55,955][39m Trial 73 finished with value: 0.8 and parameters: {'algorithm': 'kd_tree', 'n_neighbors': 4, 'weights': 'distance', 'metric': 'euclidean'}. Best is trial 10 with value: 0.8.
[32m[I 2023-04-26 02:21:55,970][39m Trial 74 finished with value: 0.8 and parameters: {'algorithm': 'kd_tree', 'n_neighbors': 3, 'weights': 'distance', 'metric': 'minkowski'}. Best is trial 10 with value: 0.8.
[32m[I 2023-04-26 02:21:55,985][39m Trial 75 finished with value: 0.7407407407407408 and parameters: {'algorithm': 'kd_tree', 'n_neighbors': 7, 'weights': 'distance', 'metric': 'minkowski'}. Best is trial 10 with value: 0.8.
[32m[I 2023-04-26 02:21:56,001][39m Trial 76 finished with value: 0.8 and parameters: {'algorithm': 'kd_tree', 'n_neighbors': 3, 'weights': 'distance', 'metric': 'minkowski'}. Best is trial 10 with value: 0.8.
[32m[I 2023-04-26 02:21:56,016][39m Trial 77 finished with value: 0.8 and parameters: {'algorithm': 'ball_tree', 'n_neighbors': 1, 'weights': 'distance', 'metric': 'manhattan'}. Best is trial 10 with value: 0.8.
[32m[I 2023-04-26 02:21:56,030][39m Trial 78 finished with value: 0.8 and parameters: {'algorithm': 'kd_tree', 'n_neighbors': 2, 'weights': 'distance', 'metric': 'manhattan'}. Best is trial 10 with value: 0.8.
[32m[I 2023-04-26 02:21:56,043][39m Trial 79 finished with value: 0.7901234567901235 and parameters: {'algorithm': 'ball_tree', 'n_neighbors': 5, 'weights': 'distance', 'metric': 'euclidean'}. Best is trial 10 with value: 0.8.
[32m[I 2023-04-26 02:21:56,051][39m Trial 80 finished with value: 0.8 and parameters: {'algorithm': 'ball_tree', 'n_neighbors': 4, 'weights': 'distance', 'metric': 'euclidean'}. Best is trial 10 with value: 0.8.
[32m[I 2023-04-26 02:21:56,059][39m Trial 81 finished with value: 0.8 and parameters: {'algorithm': 'ball_tree', 'n_neighbors': 4, 'weights': 'distance', 'metric': 'euclidean'}. Best is trial 10 with value: 0.8.
[32m[I 2023-04-26 02:21:56,066][39m Trial 82 finished with value: 0.7191011235955055 and parameters: {'algorithm': 'ball_tree', 'n_neighbors': 21, 'weights': 'distance', 'metric': 'euclidean'}. Best is trial 10 with value: 0.8.
[32m[I 2023-04-26 02:21:56,074][39m Trial 83 finished with value: 0.7640449438202247 and parameters: {'algorithm': 'ball_tree', 'n_neighbors': 17, 'weights': 'distance', 'metric': 'manhattan'}. Best is trial 10 with value: 0.8.
[32m[I 2023-04-26 02:21:56,086][39m Trial 84 finished with value: 0.7948717948717948 and parameters: {'algorithm': 'ball_tree', 'n_neighbors': 6, 'weights': 'distance', 'metric': 'euclidean'}. Best is trial 10 with value: 0.8.
[32m[I 2023-04-26 02:21:56,094][39m Trial 85 finished with value: 0.8 and parameters: {'algorithm': 'ball_tree', 'n_neighbors': 3, 'weights': 'distance', 'metric': 'euclidean'}. Best is trial 10 with value: 0.8.
[32m[I 2023-04-26 02:21:56,103][39m Trial 86 finished with value: 0.6666666666666667 and parameters: {'algorithm': 'ball_tree', 'n_neighbors': 9, 'weights': 'uniform', 'metric': 'euclidean'}. Best is trial 10 with value: 0.8.
[32m[I 2023-04-26 02:21:56,136][39m Trial 87 finished with value: 0.8 and parameters: {'algorithm': 'brute', 'n_neighbors': 2, 'weights': 'distance', 'metric': 'minkowski'}. Best is trial 10 with value: 0.8.
[32m[I 2023-04-26 02:21:56,154][39m Trial 88 finished with value: 0.8 and parameters: {'algorithm': 'ball_tree', 'n_neighbors': 1, 'weights': 'distance', 'metric': 'manhattan'}. Best is trial 10 with value: 0.8.
[32m[I 2023-04-26 02:21:56,183][39m Trial 89 finished with value: 0.8 and parameters: {'algorithm': 'brute', 'n_neighbors': 2, 'weights': 'distance', 'metric': 'manhattan'}. Best is trial 10 with value: 0.8.
[32m[I 2023-04-26 02:21:56,212][39m Trial 90 finished with value: 0.8 and parameters: {'algorithm': 'brute', 'n_neighbors': 2, 'weights': 'distance', 'metric': 'manhattan'}. Best is trial 10 with value: 0.8.
[32m[I 2023-04-26 02:21:56,238][39m Trial 91 finished with value: 0.8 and parameters: {'algorithm': 'auto', 'n_neighbors': 2, 'weights': 'distance', 'metric': 'manhattan'}. Best is trial 10 with value: 0.8.
[32m[I 2023-04-26 02:21:56,266][39m Trial 92 finished with value: 0.8 and parameters: {'algorithm': 'auto', 'n_neighbors': 1, 'weights': 'distance', 'metric': 'manhattan'}. Best is trial 10 with value: 0.8.
[32m[I 2023-04-26 02:21:56,294][39m Trial 93 finished with value: 0.8 and parameters: {'algorithm': 'brute', 'n_neighbors': 2, 'weights': 'distance', 'metric': 'manhattan'}. Best is trial 10 with value: 0.8.
[32m[I 2023-04-26 02:21:56,322][39m Trial 94 finished with value: 0.7755102040816327 and parameters: {'algorithm': 'brute', 'n_neighbors': 29, 'weights': 'distance', 'metric': 'manhattan'}. Best is trial 10 with value: 0.8.
[32m[I 2023-04-26 02:21:56,351][39m Trial 95 finished with value: 0.8 and parameters: {'algorithm': 'brute', 'n_neighbors': 1, 'weights': 'distance', 'metric': 'manhattan'}. Best is trial 10 with value: 0.8.
[32m[I 2023-04-26 02:21:56,381][39m Trial 96 finished with value: 0.8 and parameters: {'algorithm': 'brute', 'n_neighbors': 1, 'weights': 'distance', 'metric': 'manhattan'}. Best is trial 10 with value: 0.8.
[32m[I 2023-04-26 02:21:56,410][39m Trial 97 finished with value: 0.8 and parameters: {'algorithm': 'brute', 'n_neighbors': 3, 'weights': 'distance', 'metric': 'minkowski'}. Best is trial 10 with value: 0.8.
[32m[I 2023-04-26 02:21:56,438][39m Trial 98 finished with value: 0.7848101265822786 and parameters: {'algorithm': 'auto', 'n_neighbors': 4, 'weights': 'distance', 'metric': 'manhattan'}. Best is trial 10 with value: 0.8.
