[32m[I 2023-04-26 00:20:34,868][39m A new study created in memory with name: no-name-0d241302-4e6b-454b-adf2-28a60865f35e
[32m[I 2023-04-26 00:20:34,875][39m Trial 0 finished with value: 0.8440366972477066 and parameters: {'algorithm': 'ball_tree', 'n_neighbors': 10, 'weights': 'distance', 'metric': 'euclidean'}. Best is trial 0 with value: 0.8440366972477066.
[32m[I 2023-04-26 00:20:34,968][39m Trial 1 finished with value: 0.8571428571428572 and parameters: {'algorithm': 'brute', 'n_neighbors': 6, 'weights': 'distance', 'metric': 'manhattan'}. Best is trial 1 with value: 0.8571428571428572.
[32m[I 2023-04-26 00:20:34,976][39m Trial 2 finished with value: 0.8181818181818181 and parameters: {'algorithm': 'kd_tree', 'n_neighbors': 28, 'weights': 'distance', 'metric': 'manhattan'}. Best is trial 1 with value: 0.8571428571428572.
[32m[I 2023-04-26 00:20:34,994][39m Trial 3 finished with value: 0.8073394495412843 and parameters: {'algorithm': 'brute', 'n_neighbors': 14, 'weights': 'uniform', 'metric': 'minkowski'}. Best is trial 1 with value: 0.8571428571428572.
[32m[I 2023-04-26 00:20:34,999][39m Trial 4 finished with value: 0.8181818181818181 and parameters: {'algorithm': 'auto', 'n_neighbors': 7, 'weights': 'distance', 'metric': 'manhattan'}. Best is trial 1 with value: 0.8571428571428572.
[32m[I 2023-04-26 00:20:35,018][39m Trial 5 finished with value: 0.8288288288288289 and parameters: {'algorithm': 'brute', 'n_neighbors': 17, 'weights': 'distance', 'metric': 'manhattan'}. Best is trial 1 with value: 0.8571428571428572.
[32m[I 2023-04-26 00:20:35,031][39m Trial 6 finished with value: 0.7433628318584072 and parameters: {'algorithm': 'auto', 'n_neighbors': 27, 'weights': 'uniform', 'metric': 'manhattan'}. Best is trial 1 with value: 0.8571428571428572.
[32m[I 2023-04-26 00:20:35,040][39m Trial 7 finished with value: 0.8288288288288289 and parameters: {'algorithm': 'auto', 'n_neighbors': 30, 'weights': 'distance', 'metric': 'minkowski'}. Best is trial 1 with value: 0.8571428571428572.
[32m[I 2023-04-26 00:20:35,065][39m Trial 8 finished with value: 0.8181818181818181 and parameters: {'algorithm': 'brute', 'n_neighbors': 21, 'weights': 'distance', 'metric': 'minkowski'}. Best is trial 1 with value: 0.8571428571428572.
[32m[I 2023-04-26 00:20:35,077][39m Trial 9 finished with value: 0.78 and parameters: {'algorithm': 'auto', 'n_neighbors': 20, 'weights': 'uniform', 'metric': 'manhattan'}. Best is trial 1 with value: 0.8571428571428572.
[32m[I 2023-04-26 00:20:35,088][39m Trial 10 finished with value: 0.8141592920353982 and parameters: {'algorithm': 'kd_tree', 'n_neighbors': 1, 'weights': 'distance', 'metric': 'euclidean'}. Best is trial 1 with value: 0.8571428571428572.
[32m[I 2023-04-26 00:20:35,100][39m Trial 11 finished with value: 0.8468468468468469 and parameters: {'algorithm': 'ball_tree', 'n_neighbors': 8, 'weights': 'distance', 'metric': 'euclidean'}. Best is trial 1 with value: 0.8571428571428572.
[32m[I 2023-04-26 00:20:35,111][39m Trial 12 finished with value: 0.8275862068965517 and parameters: {'algorithm': 'ball_tree', 'n_neighbors': 3, 'weights': 'distance', 'metric': 'euclidean'}. Best is trial 1 with value: 0.8571428571428572.
[32m[I 2023-04-26 00:20:35,123][39m Trial 13 finished with value: 0.8148148148148148 and parameters: {'algorithm': 'ball_tree', 'n_neighbors': 7, 'weights': 'distance', 'metric': 'euclidean'}. Best is trial 1 with value: 0.8571428571428572.
[32m[I 2023-04-26 00:20:35,145][39m Trial 14 finished with value: 0.8108108108108107 and parameters: {'algorithm': 'brute', 'n_neighbors': 12, 'weights': 'uniform', 'metric': 'euclidean'}. Best is trial 1 with value: 0.8571428571428572.
[32m[I 2023-04-26 00:20:35,153][39m Trial 15 finished with value: 0.8545454545454546 and parameters: {'algorithm': 'ball_tree', 'n_neighbors': 6, 'weights': 'distance', 'metric': 'euclidean'}. Best is trial 1 with value: 0.8571428571428572.
[32m[I 2023-04-26 00:20:35,171][39m Trial 16 finished with value: 0.8275862068965517 and parameters: {'algorithm': 'brute', 'n_neighbors': 3, 'weights': 'distance', 'metric': 'manhattan'}. Best is trial 1 with value: 0.8571428571428572.
[32m[I 2023-04-26 00:20:35,182][39m Trial 17 finished with value: 0.8545454545454546 and parameters: {'algorithm': 'ball_tree', 'n_neighbors': 5, 'weights': 'distance', 'metric': 'euclidean'}. Best is trial 1 with value: 0.8571428571428572.
[32m[I 2023-04-26 00:20:35,197][39m Trial 18 finished with value: 0.8214285714285715 and parameters: {'algorithm': 'kd_tree', 'n_neighbors': 11, 'weights': 'uniform', 'metric': 'manhattan'}. Best is trial 1 with value: 0.8571428571428572.
[32m[I 2023-04-26 00:20:35,209][39m Trial 19 finished with value: 0.8181818181818181 and parameters: {'algorithm': 'ball_tree', 'n_neighbors': 17, 'weights': 'distance', 'metric': 'minkowski'}. Best is trial 1 with value: 0.8571428571428572.
[32m[I 2023-04-26 00:20:35,235][39m Trial 20 finished with value: 0.831858407079646 and parameters: {'algorithm': 'brute', 'n_neighbors': 4, 'weights': 'distance', 'metric': 'euclidean'}. Best is trial 1 with value: 0.8571428571428572.
[32m[I 2023-04-26 00:20:35,246][39m Trial 21 finished with value: 0.8545454545454546 and parameters: {'algorithm': 'ball_tree', 'n_neighbors': 5, 'weights': 'distance', 'metric': 'euclidean'}. Best is trial 1 with value: 0.8571428571428572.
[32m[I 2023-04-26 00:20:35,258][39m Trial 22 finished with value: 0.8141592920353982 and parameters: {'algorithm': 'ball_tree', 'n_neighbors': 1, 'weights': 'distance', 'metric': 'euclidean'}. Best is trial 1 with value: 0.8571428571428572.
[32m[I 2023-04-26 00:20:35,269][39m Trial 23 finished with value: 0.8495575221238938 and parameters: {'algorithm': 'ball_tree', 'n_neighbors': 9, 'weights': 'distance', 'metric': 'euclidean'}. Best is trial 1 with value: 0.8571428571428572.
[32m[I 2023-04-26 00:20:35,281][39m Trial 24 finished with value: 0.8545454545454546 and parameters: {'algorithm': 'ball_tree', 'n_neighbors': 5, 'weights': 'distance', 'metric': 'euclidean'}. Best is trial 1 with value: 0.8571428571428572.
[32m[I 2023-04-26 00:20:35,292][39m Trial 25 finished with value: 0.831858407079646 and parameters: {'algorithm': 'ball_tree', 'n_neighbors': 13, 'weights': 'distance', 'metric': 'manhattan'}. Best is trial 1 with value: 0.8571428571428572.
[32m[I 2023-04-26 00:20:35,315][39m Trial 26 finished with value: 0.8545454545454546 and parameters: {'algorithm': 'brute', 'n_neighbors': 5, 'weights': 'uniform', 'metric': 'euclidean'}. Best is trial 1 with value: 0.8571428571428572.
[32m[I 2023-04-26 00:20:35,331][39m Trial 27 finished with value: 0.8421052631578947 and parameters: {'algorithm': 'brute', 'n_neighbors': 9, 'weights': 'uniform', 'metric': 'manhattan'}. Best is trial 1 with value: 0.8571428571428572.
[32m[I 2023-04-26 00:20:35,337][39m Trial 28 finished with value: 0.8275862068965517 and parameters: {'algorithm': 'kd_tree', 'n_neighbors': 3, 'weights': 'distance', 'metric': 'euclidean'}. Best is trial 1 with value: 0.8571428571428572.
[32m[I 2023-04-26 00:20:35,359][39m Trial 29 finished with value: 0.8108108108108107 and parameters: {'algorithm': 'brute', 'n_neighbors': 11, 'weights': 'uniform', 'metric': 'minkowski'}. Best is trial 1 with value: 0.8571428571428572.
[32m[I 2023-04-26 00:20:35,365][39m Trial 30 finished with value: 0.8141592920353982 and parameters: {'algorithm': 'ball_tree', 'n_neighbors': 1, 'weights': 'distance', 'metric': 'euclidean'}. Best is trial 1 with value: 0.8571428571428572.
[32m[I 2023-04-26 00:20:35,389][39m Trial 31 finished with value: 0.8113207547169813 and parameters: {'algorithm': 'brute', 'n_neighbors': 6, 'weights': 'uniform', 'metric': 'euclidean'}. Best is trial 1 with value: 0.8571428571428572.
[32m[I 2023-04-26 00:20:35,416][39m Trial 32 finished with value: 0.8113207547169813 and parameters: {'algorithm': 'brute', 'n_neighbors': 6, 'weights': 'uniform', 'metric': 'euclidean'}. Best is trial 1 with value: 0.8571428571428572.
[32m[I 2023-04-26 00:20:35,440][39m Trial 33 finished with value: 0.7999999999999999 and parameters: {'algorithm': 'brute', 'n_neighbors': 4, 'weights': 'uniform', 'metric': 'euclidean'}. Best is trial 1 with value: 0.8571428571428572.
[32m[I 2023-04-26 00:20:35,447][39m Trial 34 finished with value: 0.8440366972477066 and parameters: {'algorithm': 'ball_tree', 'n_neighbors': 10, 'weights': 'distance', 'metric': 'euclidean'}. Best is trial 1 with value: 0.8571428571428572.
[32m[I 2023-04-26 00:20:35,464][39m Trial 35 finished with value: 0.8214285714285715 and parameters: {'algorithm': 'brute', 'n_neighbors': 14, 'weights': 'uniform', 'metric': 'manhattan'}. Best is trial 1 with value: 0.8571428571428572.
[32m[I 2023-04-26 00:20:35,471][39m Trial 36 finished with value: 0.8468468468468469 and parameters: {'algorithm': 'kd_tree', 'n_neighbors': 8, 'weights': 'distance', 'metric': 'euclidean'}. Best is trial 1 with value: 0.8571428571428572.
[32m[I 2023-04-26 00:20:35,479][39m Trial 37 finished with value: 0.8571428571428572 and parameters: {'algorithm': 'auto', 'n_neighbors': 5, 'weights': 'distance', 'metric': 'manhattan'}. Best is trial 1 with value: 0.8571428571428572.
[32m[I 2023-04-26 00:20:35,486][39m Trial 38 finished with value: 0.75 and parameters: {'algorithm': 'auto', 'n_neighbors': 24, 'weights': 'uniform', 'metric': 'manhattan'}. Best is trial 1 with value: 0.8571428571428572.
[32m[I 2023-04-26 00:20:35,494][39m Trial 39 finished with value: 0.8288288288288289 and parameters: {'algorithm': 'auto', 'n_neighbors': 17, 'weights': 'distance', 'metric': 'manhattan'}. Best is trial 1 with value: 0.8571428571428572.
[32m[I 2023-04-26 00:20:35,502][39m Trial 40 finished with value: 0.7931034482758621 and parameters: {'algorithm': 'auto', 'n_neighbors': 15, 'weights': 'uniform', 'metric': 'manhattan'}. Best is trial 1 with value: 0.8571428571428572.
[32m[I 2023-04-26 00:20:35,508][39m Trial 41 finished with value: 0.8571428571428572 and parameters: {'algorithm': 'auto', 'n_neighbors': 5, 'weights': 'distance', 'metric': 'manhattan'}. Best is trial 1 with value: 0.8571428571428572.
[32m[I 2023-04-26 00:20:35,514][39m Trial 42 finished with value: 0.8173913043478261 and parameters: {'algorithm': 'auto', 'n_neighbors': 2, 'weights': 'distance', 'metric': 'manhattan'}. Best is trial 1 with value: 0.8571428571428572.
[32m[I 2023-04-26 00:20:35,522][39m Trial 43 finished with value: 0.8181818181818181 and parameters: {'algorithm': 'auto', 'n_neighbors': 7, 'weights': 'distance', 'metric': 'manhattan'}. Best is trial 1 with value: 0.8571428571428572.
[32m[I 2023-04-26 00:20:35,529][39m Trial 44 finished with value: 0.8571428571428572 and parameters: {'algorithm': 'auto', 'n_neighbors': 5, 'weights': 'distance', 'metric': 'manhattan'}. Best is trial 1 with value: 0.8571428571428572.
[32m[I 2023-04-26 00:20:35,536][39m Trial 45 finished with value: 0.8571428571428572 and parameters: {'algorithm': 'auto', 'n_neighbors': 8, 'weights': 'distance', 'metric': 'manhattan'}. Best is trial 1 with value: 0.8571428571428572.
[32m[I 2023-04-26 00:20:35,542][39m Trial 46 finished with value: 0.8571428571428572 and parameters: {'algorithm': 'auto', 'n_neighbors': 8, 'weights': 'distance', 'metric': 'manhattan'}. Best is trial 1 with value: 0.8571428571428572.
[32m[I 2023-04-26 00:20:35,549][39m Trial 47 finished with value: 0.8275862068965517 and parameters: {'algorithm': 'auto', 'n_neighbors': 3, 'weights': 'distance', 'metric': 'manhattan'}. Best is trial 1 with value: 0.8571428571428572.
[32m[I 2023-04-26 00:20:35,555][39m Trial 48 finished with value: 0.8392857142857144 and parameters: {'algorithm': 'auto', 'n_neighbors': 10, 'weights': 'distance', 'metric': 'manhattan'}. Best is trial 1 with value: 0.8571428571428572.
[32m[I 2023-04-26 00:20:35,560][39m Trial 49 finished with value: 0.8571428571428572 and parameters: {'algorithm': 'auto', 'n_neighbors': 8, 'weights': 'distance', 'metric': 'manhattan'}. Best is trial 1 with value: 0.8571428571428572.
[32m[I 2023-04-26 00:20:35,567][39m Trial 50 finished with value: 0.8571428571428572 and parameters: {'algorithm': 'auto', 'n_neighbors': 8, 'weights': 'distance', 'metric': 'manhattan'}. Best is trial 1 with value: 0.8571428571428572.
[32m[I 2023-04-26 00:20:35,575][39m Trial 51 finished with value: 0.831858407079646 and parameters: {'algorithm': 'auto', 'n_neighbors': 9, 'weights': 'distance', 'metric': 'manhattan'}. Best is trial 1 with value: 0.8571428571428572.
[32m[I 2023-04-26 00:20:35,581][39m Trial 52 finished with value: 0.8181818181818181 and parameters: {'algorithm': 'auto', 'n_neighbors': 7, 'weights': 'distance', 'metric': 'manhattan'}. Best is trial 1 with value: 0.8571428571428572.
[32m[I 2023-04-26 00:20:35,588][39m Trial 53 finished with value: 0.8571428571428572 and parameters: {'algorithm': 'auto', 'n_neighbors': 8, 'weights': 'distance', 'metric': 'manhattan'}. Best is trial 1 with value: 0.8571428571428572.
[32m[I 2023-04-26 00:20:35,596][39m Trial 54 finished with value: 0.8288288288288289 and parameters: {'algorithm': 'auto', 'n_neighbors': 12, 'weights': 'distance', 'metric': 'manhattan'}. Best is trial 1 with value: 0.8571428571428572.
[32m[I 2023-04-26 00:20:35,603][39m Trial 55 finished with value: 0.8392857142857144 and parameters: {'algorithm': 'auto', 'n_neighbors': 10, 'weights': 'distance', 'metric': 'manhattan'}. Best is trial 1 with value: 0.8571428571428572.
[32m[I 2023-04-26 00:20:35,610][39m Trial 56 finished with value: 0.8148148148148148 and parameters: {'algorithm': 'auto', 'n_neighbors': 7, 'weights': 'distance', 'metric': 'minkowski'}. Best is trial 1 with value: 0.8571428571428572.
[32m[I 2023-04-26 00:20:35,617][39m Trial 57 finished with value: 0.8571428571428572 and parameters: {'algorithm': 'auto', 'n_neighbors': 8, 'weights': 'distance', 'metric': 'manhattan'}. Best is trial 1 with value: 0.8571428571428572.
[32m[I 2023-04-26 00:20:35,625][39m Trial 58 finished with value: 0.831858407079646 and parameters: {'algorithm': 'auto', 'n_neighbors': 4, 'weights': 'distance', 'metric': 'manhattan'}. Best is trial 1 with value: 0.8571428571428572.
[32m[I 2023-04-26 00:20:35,632][39m Trial 59 finished with value: 0.831858407079646 and parameters: {'algorithm': 'auto', 'n_neighbors': 11, 'weights': 'distance', 'metric': 'manhattan'}. Best is trial 1 with value: 0.8571428571428572.
[32m[I 2023-04-26 00:20:35,641][39m Trial 60 finished with value: 0.831858407079646 and parameters: {'algorithm': 'kd_tree', 'n_neighbors': 9, 'weights': 'distance', 'metric': 'manhattan'}. Best is trial 1 with value: 0.8571428571428572.
[32m[I 2023-04-26 00:20:35,657][39m Trial 61 finished with value: 0.8571428571428572 and parameters: {'algorithm': 'auto', 'n_neighbors': 8, 'weights': 'distance', 'metric': 'manhattan'}. Best is trial 1 with value: 0.8571428571428572.
[32m[I 2023-04-26 00:20:35,670][39m Trial 62 finished with value: 0.8571428571428572 and parameters: {'algorithm': 'auto', 'n_neighbors': 5, 'weights': 'distance', 'metric': 'manhattan'}. Best is trial 1 with value: 0.8571428571428572.
[32m[I 2023-04-26 00:20:35,678][39m Trial 63 finished with value: 0.8173913043478261 and parameters: {'algorithm': 'auto', 'n_neighbors': 2, 'weights': 'distance', 'metric': 'manhattan'}. Best is trial 1 with value: 0.8571428571428572.
[32m[I 2023-04-26 00:20:35,685][39m Trial 64 finished with value: 0.8571428571428572 and parameters: {'algorithm': 'auto', 'n_neighbors': 6, 'weights': 'distance', 'metric': 'manhattan'}. Best is trial 1 with value: 0.8571428571428572.
[32m[I 2023-04-26 00:20:35,695][39m Trial 65 finished with value: 0.8571428571428572 and parameters: {'algorithm': 'auto', 'n_neighbors': 6, 'weights': 'distance', 'metric': 'manhattan'}. Best is trial 1 with value: 0.8571428571428572.
[32m[I 2023-04-26 00:20:35,702][39m Trial 66 finished with value: 0.831858407079646 and parameters: {'algorithm': 'auto', 'n_neighbors': 4, 'weights': 'distance', 'metric': 'minkowski'}. Best is trial 1 with value: 0.8571428571428572.
[32m[I 2023-04-26 00:20:35,711][39m Trial 67 finished with value: 0.8181818181818181 and parameters: {'algorithm': 'auto', 'n_neighbors': 7, 'weights': 'distance', 'metric': 'manhattan'}. Best is trial 1 with value: 0.8571428571428572.
[32m[I 2023-04-26 00:20:35,717][39m Trial 68 finished with value: 0.8288288288288289 and parameters: {'algorithm': 'auto', 'n_neighbors': 12, 'weights': 'distance', 'metric': 'manhattan'}. Best is trial 1 with value: 0.8571428571428572.
[32m[I 2023-04-26 00:20:35,725][39m Trial 69 finished with value: 0.8571428571428572 and parameters: {'algorithm': 'kd_tree', 'n_neighbors': 6, 'weights': 'distance', 'metric': 'manhattan'}. Best is trial 1 with value: 0.8571428571428572.
[32m[I 2023-04-26 00:20:35,732][39m Trial 70 finished with value: 0.8571428571428572 and parameters: {'algorithm': 'kd_tree', 'n_neighbors': 5, 'weights': 'distance', 'metric': 'manhattan'}. Best is trial 1 with value: 0.8571428571428572.
[32m[I 2023-04-26 00:20:35,741][39m Trial 71 finished with value: 0.8173913043478261 and parameters: {'algorithm': 'kd_tree', 'n_neighbors': 2, 'weights': 'distance', 'metric': 'manhattan'}. Best is trial 1 with value: 0.8571428571428572.
[32m[I 2023-04-26 00:20:35,747][39m Trial 72 finished with value: 0.8571428571428572 and parameters: {'algorithm': 'auto', 'n_neighbors': 8, 'weights': 'distance', 'metric': 'manhattan'}. Best is trial 1 with value: 0.8571428571428572.
[32m[I 2023-04-26 00:20:35,757][39m Trial 73 finished with value: 0.8181818181818181 and parameters: {'algorithm': 'auto', 'n_neighbors': 20, 'weights': 'distance', 'metric': 'manhattan'}. Best is trial 1 with value: 0.8571428571428572.
[32m[I 2023-04-26 00:20:35,764][39m Trial 74 finished with value: 0.8571428571428572 and parameters: {'algorithm': 'auto', 'n_neighbors': 8, 'weights': 'distance', 'metric': 'manhattan'}. Best is trial 1 with value: 0.8571428571428572.
[32m[I 2023-04-26 00:20:35,772][39m Trial 75 finished with value: 0.8571428571428572 and parameters: {'algorithm': 'kd_tree', 'n_neighbors': 6, 'weights': 'distance', 'metric': 'manhattan'}. Best is trial 1 with value: 0.8571428571428572.
[32m[I 2023-04-26 00:20:35,779][39m Trial 76 finished with value: 0.8440366972477066 and parameters: {'algorithm': 'auto', 'n_neighbors': 10, 'weights': 'distance', 'metric': 'minkowski'}. Best is trial 1 with value: 0.8571428571428572.
[32m[I 2023-04-26 00:20:35,787][39m Trial 77 finished with value: 0.831858407079646 and parameters: {'algorithm': 'kd_tree', 'n_neighbors': 4, 'weights': 'distance', 'metric': 'manhattan'}. Best is trial 1 with value: 0.8571428571428572.
[32m[I 2023-04-26 00:20:35,793][39m Trial 78 finished with value: 0.831858407079646 and parameters: {'algorithm': 'auto', 'n_neighbors': 9, 'weights': 'distance', 'metric': 'manhattan'}. Best is trial 1 with value: 0.8571428571428572.
[32m[I 2023-04-26 00:20:35,801][39m Trial 79 finished with value: 0.8288288288288289 and parameters: {'algorithm': 'auto', 'n_neighbors': 30, 'weights': 'distance', 'metric': 'manhattan'}. Best is trial 1 with value: 0.8571428571428572.
[32m[I 2023-04-26 00:20:35,809][39m Trial 80 finished with value: 0.8275862068965517 and parameters: {'algorithm': 'auto', 'n_neighbors': 3, 'weights': 'distance', 'metric': 'manhattan'}. Best is trial 1 with value: 0.8571428571428572.
[32m[I 2023-04-26 00:20:35,816][39m Trial 81 finished with value: 0.8571428571428572 and parameters: {'algorithm': 'kd_tree', 'n_neighbors': 6, 'weights': 'distance', 'metric': 'manhattan'}. Best is trial 1 with value: 0.8571428571428572.
[32m[I 2023-04-26 00:20:35,824][39m Trial 82 finished with value: 0.8181818181818181 and parameters: {'algorithm': 'auto', 'n_neighbors': 7, 'weights': 'distance', 'metric': 'manhattan'}. Best is trial 1 with value: 0.8571428571428572.
[32m[I 2023-04-26 00:20:35,833][39m Trial 83 finished with value: 0.8571428571428572 and parameters: {'algorithm': 'auto', 'n_neighbors': 5, 'weights': 'distance', 'metric': 'manhattan'}. Best is trial 1 with value: 0.8571428571428572.
[32m[I 2023-04-26 00:20:35,842][39m Trial 84 finished with value: 0.8571428571428572 and parameters: {'algorithm': 'auto', 'n_neighbors': 8, 'weights': 'distance', 'metric': 'manhattan'}. Best is trial 1 with value: 0.8571428571428572.
[32m[I 2023-04-26 00:20:35,851][39m Trial 85 finished with value: 0.831858407079646 and parameters: {'algorithm': 'auto', 'n_neighbors': 11, 'weights': 'distance', 'metric': 'manhattan'}. Best is trial 1 with value: 0.8571428571428572.
[32m[I 2023-04-26 00:20:35,858][39m Trial 86 finished with value: 0.831858407079646 and parameters: {'algorithm': 'auto', 'n_neighbors': 9, 'weights': 'distance', 'metric': 'manhattan'}. Best is trial 1 with value: 0.8571428571428572.
[32m[I 2023-04-26 00:20:35,867][39m Trial 87 finished with value: 0.8571428571428572 and parameters: {'algorithm': 'auto', 'n_neighbors': 5, 'weights': 'distance', 'metric': 'manhattan'}. Best is trial 1 with value: 0.8571428571428572.
[32m[I 2023-04-26 00:20:35,875][39m Trial 88 finished with value: 0.8181818181818181 and parameters: {'algorithm': 'auto', 'n_neighbors': 25, 'weights': 'distance', 'metric': 'minkowski'}. Best is trial 1 with value: 0.8571428571428572.
[32m[I 2023-04-26 00:20:35,882][39m Trial 89 finished with value: 0.8181818181818181 and parameters: {'algorithm': 'auto', 'n_neighbors': 7, 'weights': 'distance', 'metric': 'manhattan'}. Best is trial 1 with value: 0.8571428571428572.
[32m[I 2023-04-26 00:20:35,889][39m Trial 90 finished with value: 0.8392857142857144 and parameters: {'algorithm': 'auto', 'n_neighbors': 10, 'weights': 'distance', 'metric': 'manhattan'}. Best is trial 1 with value: 0.8571428571428572.
