[32m[I 2023-04-26 00:20:38,643][39m Trial 273 finished with value: 0.8545454545454546 and parameters: {'algorithm': 'ball_tree', 'n_neighbors': 5, 'weights': 'uniform', 'metric': 'manhattan'}. Best is trial 1 with value: 0.8571428571428572.
[32m[I 2023-04-26 00:20:38,661][39m Trial 274 finished with value: 0.831858407079646 and parameters: {'algorithm': 'auto', 'n_neighbors': 9, 'weights': 'distance', 'metric': 'manhattan'}. Best is trial 1 with value: 0.8571428571428572.
[32m[I 2023-04-26 00:20:38,679][39m Trial 275 finished with value: 0.8275862068965517 and parameters: {'algorithm': 'kd_tree', 'n_neighbors': 3, 'weights': 'distance', 'metric': 'manhattan'}. Best is trial 1 with value: 0.8571428571428572.
[32m[I 2023-04-26 00:20:38,696][39m Trial 276 finished with value: 0.8571428571428572 and parameters: {'algorithm': 'kd_tree', 'n_neighbors': 5, 'weights': 'distance', 'metric': 'manhattan'}. Best is trial 1 with value: 0.8571428571428572.
[32m[I 2023-04-26 00:20:38,713][39m Trial 277 finished with value: 0.8571428571428572 and parameters: {'algorithm': 'auto', 'n_neighbors': 8, 'weights': 'distance', 'metric': 'manhattan'}. Best is trial 1 with value: 0.8571428571428572.
[32m[I 2023-04-26 00:20:38,729][39m Trial 278 finished with value: 0.8571428571428572 and parameters: {'algorithm': 'auto', 'n_neighbors': 8, 'weights': 'distance', 'metric': 'manhattan'}. Best is trial 1 with value: 0.8571428571428572.
[32m[I 2023-04-26 00:20:38,740][39m Trial 279 finished with value: 0.8571428571428572 and parameters: {'algorithm': 'kd_tree', 'n_neighbors': 8, 'weights': 'distance', 'metric': 'manhattan'}. Best is trial 1 with value: 0.8571428571428572.
[32m[I 2023-04-26 00:20:38,750][39m Trial 280 finished with value: 0.8392857142857144 and parameters: {'algorithm': 'kd_tree', 'n_neighbors': 10, 'weights': 'distance', 'metric': 'manhattan'}. Best is trial 1 with value: 0.8571428571428572.
[32m[I 2023-04-26 00:20:38,760][39m Trial 281 finished with value: 0.8181818181818181 and parameters: {'algorithm': 'kd_tree', 'n_neighbors': 7, 'weights': 'distance', 'metric': 'manhattan'}. Best is trial 1 with value: 0.8571428571428572.
[32m[I 2023-04-26 00:20:38,771][39m Trial 282 finished with value: 0.8181818181818181 and parameters: {'algorithm': 'kd_tree', 'n_neighbors': 7, 'weights': 'distance', 'metric': 'manhattan'}. Best is trial 1 with value: 0.8571428571428572.
[32m[I 2023-04-26 00:20:38,787][39m Trial 283 finished with value: 0.8468468468468469 and parameters: {'algorithm': 'kd_tree', 'n_neighbors': 8, 'weights': 'distance', 'metric': 'minkowski'}. Best is trial 1 with value: 0.8571428571428572.
[32m[I 2023-04-26 00:20:38,798][39m Trial 284 finished with value: 0.8392857142857144 and parameters: {'algorithm': 'kd_tree', 'n_neighbors': 10, 'weights': 'distance', 'metric': 'manhattan'}. Best is trial 1 with value: 0.8571428571428572.
[32m[I 2023-04-26 00:20:38,809][39m Trial 285 finished with value: 0.8181818181818181 and parameters: {'algorithm': 'kd_tree', 'n_neighbors': 14, 'weights': 'distance', 'metric': 'manhattan'}. Best is trial 1 with value: 0.8571428571428572.
[32m[I 2023-04-26 00:20:38,819][39m Trial 286 finished with value: 0.8571428571428572 and parameters: {'algorithm': 'kd_tree', 'n_neighbors': 6, 'weights': 'distance', 'metric': 'manhattan'}. Best is trial 1 with value: 0.8571428571428572.
[32m[I 2023-04-26 00:20:38,830][39m Trial 287 finished with value: 0.8181818181818181 and parameters: {'algorithm': 'kd_tree', 'n_neighbors': 7, 'weights': 'distance', 'metric': 'manhattan'}. Best is trial 1 with value: 0.8571428571428572.
[32m[I 2023-04-26 00:20:38,840][39m Trial 288 finished with value: 0.831858407079646 and parameters: {'algorithm': 'kd_tree', 'n_neighbors': 4, 'weights': 'distance', 'metric': 'manhattan'}. Best is trial 1 with value: 0.8571428571428572.
[32m[I 2023-04-26 00:20:38,849][39m Trial 289 finished with value: 0.8571428571428572 and parameters: {'algorithm': 'kd_tree', 'n_neighbors': 5, 'weights': 'distance', 'metric': 'manhattan'}. Best is trial 1 with value: 0.8571428571428572.
[32m[I 2023-04-26 00:20:38,860][39m Trial 290 finished with value: 0.8545454545454546 and parameters: {'algorithm': 'kd_tree', 'n_neighbors': 6, 'weights': 'distance', 'metric': 'euclidean'}. Best is trial 1 with value: 0.8571428571428572.
[32m[I 2023-04-26 00:20:38,872][39m Trial 291 finished with value: 0.8148148148148148 and parameters: {'algorithm': 'ball_tree', 'n_neighbors': 7, 'weights': 'uniform', 'metric': 'manhattan'}. Best is trial 1 with value: 0.8571428571428572.
[32m[I 2023-04-26 00:20:38,883][39m Trial 292 finished with value: 0.8571428571428572 and parameters: {'algorithm': 'kd_tree', 'n_neighbors': 6, 'weights': 'distance', 'metric': 'manhattan'}. Best is trial 1 with value: 0.8571428571428572.
[32m[I 2023-04-26 00:20:38,892][39m Trial 293 finished with value: 0.8571428571428572 and parameters: {'algorithm': 'kd_tree', 'n_neighbors': 6, 'weights': 'distance', 'metric': 'manhattan'}. Best is trial 1 with value: 0.8571428571428572.
[32m[I 2023-04-26 00:20:38,903][39m Trial 294 finished with value: 0.8571428571428572 and parameters: {'algorithm': 'kd_tree', 'n_neighbors': 6, 'weights': 'distance', 'metric': 'manhattan'}. Best is trial 1 with value: 0.8571428571428572.
[32m[I 2023-04-26 00:20:38,913][39m Trial 295 finished with value: 0.8571428571428572 and parameters: {'algorithm': 'kd_tree', 'n_neighbors': 6, 'weights': 'distance', 'metric': 'manhattan'}. Best is trial 1 with value: 0.8571428571428572.
[32m[I 2023-04-26 00:20:38,923][39m Trial 296 finished with value: 0.8571428571428572 and parameters: {'algorithm': 'kd_tree', 'n_neighbors': 5, 'weights': 'distance', 'metric': 'manhattan'}. Best is trial 1 with value: 0.8571428571428572.
[32m[I 2023-04-26 00:20:38,933][39m Trial 297 finished with value: 0.831858407079646 and parameters: {'algorithm': 'kd_tree', 'n_neighbors': 4, 'weights': 'distance', 'metric': 'manhattan'}. Best is trial 1 with value: 0.8571428571428572.
[32m[I 2023-04-26 00:20:38,942][39m Trial 298 finished with value: 0.8571428571428572 and parameters: {'algorithm': 'kd_tree', 'n_neighbors': 6, 'weights': 'distance', 'metric': 'manhattan'}. Best is trial 1 with value: 0.8571428571428572.
[32m[I 2023-04-26 00:20:38,953][39m Trial 299 finished with value: 0.8571428571428572 and parameters: {'algorithm': 'kd_tree', 'n_neighbors': 6, 'weights': 'distance', 'metric': 'manhattan'}. Best is trial 1 with value: 0.8571428571428572.
[32m[I 2023-04-26 00:20:38,963][39m Trial 300 finished with value: 0.8181818181818181 and parameters: {'algorithm': 'kd_tree', 'n_neighbors': 7, 'weights': 'distance', 'metric': 'manhattan'}. Best is trial 1 with value: 0.8571428571428572.
[32m[I 2023-04-26 00:20:38,973][39m Trial 301 finished with value: 0.8181818181818181 and parameters: {'algorithm': 'auto', 'n_neighbors': 7, 'weights': 'distance', 'metric': 'manhattan'}. Best is trial 1 with value: 0.8571428571428572.
[32m[I 2023-04-26 00:20:38,984][39m Trial 302 finished with value: 0.8181818181818181 and parameters: {'algorithm': 'auto', 'n_neighbors': 7, 'weights': 'distance', 'metric': 'manhattan'}. Best is trial 1 with value: 0.8571428571428572.
[32m[I 2023-04-26 00:20:38,994][39m Trial 303 finished with value: 0.8571428571428572 and parameters: {'algorithm': 'auto', 'n_neighbors': 6, 'weights': 'distance', 'metric': 'manhattan'}. Best is trial 1 with value: 0.8571428571428572.
[32m[I 2023-04-26 00:20:39,004][39m Trial 304 finished with value: 0.8571428571428572 and parameters: {'algorithm': 'kd_tree', 'n_neighbors': 5, 'weights': 'distance', 'metric': 'manhattan'}. Best is trial 1 with value: 0.8571428571428572.
[32m[I 2023-04-26 00:20:39,015][39m Trial 305 finished with value: 0.8571428571428572 and parameters: {'algorithm': 'kd_tree', 'n_neighbors': 8, 'weights': 'distance', 'metric': 'manhattan'}. Best is trial 1 with value: 0.8571428571428572.
[32m[I 2023-04-26 00:20:39,025][39m Trial 306 finished with value: 0.8181818181818181 and parameters: {'algorithm': 'ball_tree', 'n_neighbors': 18, 'weights': 'distance', 'metric': 'manhattan'}. Best is trial 1 with value: 0.8571428571428572.
[32m[I 2023-04-26 00:20:39,036][39m Trial 307 finished with value: 0.8545454545454546 and parameters: {'algorithm': 'ball_tree', 'n_neighbors': 5, 'weights': 'distance', 'metric': 'minkowski'}. Best is trial 1 with value: 0.8571428571428572.
[32m[I 2023-04-26 00:20:39,048][39m Trial 308 finished with value: 0.831858407079646 and parameters: {'algorithm': 'auto', 'n_neighbors': 4, 'weights': 'distance', 'metric': 'manhattan'}. Best is trial 1 with value: 0.8571428571428572.
[32m[I 2023-04-26 00:20:39,060][39m Trial 309 finished with value: 0.8571428571428572 and parameters: {'algorithm': 'auto', 'n_neighbors': 5, 'weights': 'distance', 'metric': 'manhattan'}. Best is trial 1 with value: 0.8571428571428572.
[32m[I 2023-04-26 00:20:39,103][39m Trial 310 finished with value: 0.8571428571428572 and parameters: {'algorithm': 'brute', 'n_neighbors': 6, 'weights': 'distance', 'metric': 'manhattan'}. Best is trial 1 with value: 0.8571428571428572.
[32m[I 2023-04-26 00:20:39,123][39m Trial 311 finished with value: 0.831858407079646 and parameters: {'algorithm': 'auto', 'n_neighbors': 4, 'weights': 'distance', 'metric': 'manhattan'}. Best is trial 1 with value: 0.8571428571428572.
[32m[I 2023-04-26 00:20:39,162][39m Trial 312 finished with value: 0.8545454545454546 and parameters: {'algorithm': 'brute', 'n_neighbors': 5, 'weights': 'distance', 'metric': 'euclidean'}. Best is trial 1 with value: 0.8571428571428572.
[32m[I 2023-04-26 00:20:39,184][39m Trial 313 finished with value: 0.8305084745762712 and parameters: {'algorithm': 'auto', 'n_neighbors': 3, 'weights': 'uniform', 'metric': 'manhattan'}. Best is trial 1 with value: 0.8571428571428572.
[32m[I 2023-04-26 00:20:39,217][39m Trial 314 finished with value: 0.8181818181818181 and parameters: {'algorithm': 'brute', 'n_neighbors': 24, 'weights': 'distance', 'metric': 'manhattan'}. Best is trial 1 with value: 0.8571428571428572.
[32m[I 2023-04-26 00:20:39,235][39m Trial 315 finished with value: 0.8571428571428572 and parameters: {'algorithm': 'ball_tree', 'n_neighbors': 5, 'weights': 'distance', 'metric': 'manhattan'}. Best is trial 1 with value: 0.8571428571428572.
[32m[I 2023-04-26 00:20:39,253][39m Trial 316 finished with value: 0.8275862068965517 and parameters: {'algorithm': 'auto', 'n_neighbors': 3, 'weights': 'distance', 'metric': 'manhattan'}. Best is trial 1 with value: 0.8571428571428572.
[32m[I 2023-04-26 00:20:39,271][39m Trial 317 finished with value: 0.831858407079646 and parameters: {'algorithm': 'kd_tree', 'n_neighbors': 4, 'weights': 'distance', 'metric': 'manhattan'}. Best is trial 1 with value: 0.8571428571428572.
[32m[I 2023-04-26 00:20:39,290][39m Trial 318 finished with value: 0.831858407079646 and parameters: {'algorithm': 'auto', 'n_neighbors': 4, 'weights': 'distance', 'metric': 'manhattan'}. Best is trial 1 with value: 0.8571428571428572.
[32m[I 2023-04-26 00:20:39,322][39m Trial 319 finished with value: 0.8571428571428572 and parameters: {'algorithm': 'brute', 'n_neighbors': 5, 'weights': 'distance', 'metric': 'manhattan'}. Best is trial 1 with value: 0.8571428571428572.
[32m[I 2023-04-26 00:20:39,341][39m Trial 320 finished with value: 0.8571428571428572 and parameters: {'algorithm': 'auto', 'n_neighbors': 5, 'weights': 'distance', 'metric': 'manhattan'}. Best is trial 1 with value: 0.8571428571428572.
[32m[I 2023-04-26 00:20:39,360][39m Trial 321 finished with value: 0.8571428571428572 and parameters: {'algorithm': 'kd_tree', 'n_neighbors': 8, 'weights': 'distance', 'metric': 'manhattan'}. Best is trial 1 with value: 0.8571428571428572.
[32m[I 2023-04-26 00:20:39,380][39m Trial 322 finished with value: 0.8173913043478261 and parameters: {'algorithm': 'kd_tree', 'n_neighbors': 1, 'weights': 'distance', 'metric': 'manhattan'}. Best is trial 1 with value: 0.8571428571428572.
[32m[I 2023-04-26 00:20:39,399][39m Trial 323 finished with value: 0.8571428571428572 and parameters: {'algorithm': 'kd_tree', 'n_neighbors': 6, 'weights': 'distance', 'metric': 'manhattan'}. Best is trial 1 with value: 0.8571428571428572.
[32m[I 2023-04-26 00:20:39,416][39m Trial 324 finished with value: 0.8571428571428572 and parameters: {'algorithm': 'kd_tree', 'n_neighbors': 6, 'weights': 'distance', 'metric': 'manhattan'}. Best is trial 1 with value: 0.8571428571428572.
[32m[I 2023-04-26 00:20:39,426][39m Trial 325 finished with value: 0.8571428571428572 and parameters: {'algorithm': 'kd_tree', 'n_neighbors': 6, 'weights': 'distance', 'metric': 'manhattan'}. Best is trial 1 with value: 0.8571428571428572.
[32m[I 2023-04-26 00:20:39,436][39m Trial 326 finished with value: 0.8571428571428572 and parameters: {'algorithm': 'kd_tree', 'n_neighbors': 5, 'weights': 'distance', 'metric': 'manhattan'}. Best is trial 1 with value: 0.8571428571428572.
[32m[I 2023-04-26 00:20:39,446][39m Trial 327 finished with value: 0.8571428571428572 and parameters: {'algorithm': 'kd_tree', 'n_neighbors': 6, 'weights': 'distance', 'metric': 'manhattan'}. Best is trial 1 with value: 0.8571428571428572.
[32m[I 2023-04-26 00:20:39,455][39m Trial 328 finished with value: 0.8181818181818181 and parameters: {'algorithm': 'kd_tree', 'n_neighbors': 7, 'weights': 'distance', 'metric': 'manhattan'}. Best is trial 1 with value: 0.8571428571428572.
[32m[I 2023-04-26 00:20:39,466][39m Trial 329 finished with value: 0.831858407079646 and parameters: {'algorithm': 'kd_tree', 'n_neighbors': 4, 'weights': 'distance', 'metric': 'minkowski'}. Best is trial 1 with value: 0.8571428571428572.
[32m[I 2023-04-26 00:20:39,476][39m Trial 330 finished with value: 0.8545454545454546 and parameters: {'algorithm': 'ball_tree', 'n_neighbors': 5, 'weights': 'uniform', 'metric': 'manhattan'}. Best is trial 1 with value: 0.8571428571428572.
[32m[I 2023-04-26 00:20:39,485][39m Trial 331 finished with value: 0.8571428571428572 and parameters: {'algorithm': 'auto', 'n_neighbors': 6, 'weights': 'distance', 'metric': 'manhattan'}. Best is trial 1 with value: 0.8571428571428572.
[32m[I 2023-04-26 00:20:39,494][39m Trial 332 finished with value: 0.8571428571428572 and parameters: {'algorithm': 'auto', 'n_neighbors': 6, 'weights': 'distance', 'metric': 'manhattan'}. Best is trial 1 with value: 0.8571428571428572.
[32m[I 2023-04-26 00:20:39,509][39m Trial 333 finished with value: 0.8571428571428572 and parameters: {'algorithm': 'auto', 'n_neighbors': 6, 'weights': 'distance', 'metric': 'manhattan'}. Best is trial 1 with value: 0.8571428571428572.
[32m[I 2023-04-26 00:20:39,530][39m Trial 334 finished with value: 0.8545454545454546 and parameters: {'algorithm': 'auto', 'n_neighbors': 6, 'weights': 'distance', 'metric': 'euclidean'}. Best is trial 1 with value: 0.8571428571428572.
[32m[I 2023-04-26 00:20:39,542][39m Trial 335 finished with value: 0.831858407079646 and parameters: {'algorithm': 'auto', 'n_neighbors': 4, 'weights': 'distance', 'metric': 'manhattan'}. Best is trial 1 with value: 0.8571428571428572.
[32m[I 2023-04-26 00:20:39,575][39m Trial 336 finished with value: 0.8571428571428572 and parameters: {'algorithm': 'brute', 'n_neighbors': 5, 'weights': 'distance', 'metric': 'manhattan'}. Best is trial 1 with value: 0.8571428571428572.
[32m[I 2023-04-26 00:20:39,613][39m Trial 337 finished with value: 0.8571428571428572 and parameters: {'algorithm': 'brute', 'n_neighbors': 5, 'weights': 'distance', 'metric': 'manhattan'}. Best is trial 1 with value: 0.8571428571428572.
[32m[I 2023-04-26 00:20:39,650][39m Trial 338 finished with value: 0.8571428571428572 and parameters: {'algorithm': 'brute', 'n_neighbors': 5, 'weights': 'distance', 'metric': 'manhattan'}. Best is trial 1 with value: 0.8571428571428572.
[32m[I 2023-04-26 00:20:39,669][39m Trial 339 finished with value: 0.8275862068965517 and parameters: {'algorithm': 'kd_tree', 'n_neighbors': 3, 'weights': 'distance', 'metric': 'manhattan'}. Best is trial 1 with value: 0.8571428571428572.
[32m[I 2023-04-26 00:20:39,689][39m Trial 340 finished with value: 0.8181818181818181 and parameters: {'algorithm': 'ball_tree', 'n_neighbors': 7, 'weights': 'distance', 'metric': 'manhattan'}. Best is trial 1 with value: 0.8571428571428572.
[32m[I 2023-04-26 00:20:39,708][39m Trial 341 finished with value: 0.8571428571428572 and parameters: {'algorithm': 'ball_tree', 'n_neighbors': 5, 'weights': 'distance', 'metric': 'manhattan'}. Best is trial 1 with value: 0.8571428571428572.
[32m[I 2023-04-26 00:20:39,727][39m Trial 342 finished with value: 0.8181818181818181 and parameters: {'algorithm': 'kd_tree', 'n_neighbors': 7, 'weights': 'distance', 'metric': 'manhattan'}. Best is trial 1 with value: 0.8571428571428572.
[32m[I 2023-04-26 00:20:39,745][39m Trial 343 finished with value: 0.8173913043478261 and parameters: {'algorithm': 'ball_tree', 'n_neighbors': 2, 'weights': 'distance', 'metric': 'manhattan'}. Best is trial 1 with value: 0.8571428571428572.
[32m[I 2023-04-26 00:20:39,765][39m Trial 344 finished with value: 0.831858407079646 and parameters: {'algorithm': 'ball_tree', 'n_neighbors': 4, 'weights': 'distance', 'metric': 'manhattan'}. Best is trial 1 with value: 0.8571428571428572.
[32m[I 2023-04-26 00:20:39,790][39m Trial 345 finished with value: 0.8571428571428572 and parameters: {'algorithm': 'brute', 'n_neighbors': 8, 'weights': 'distance', 'metric': 'manhattan'}. Best is trial 1 with value: 0.8571428571428572.
[32m[I 2023-04-26 00:20:39,823][39m Trial 346 finished with value: 0.8571428571428572 and parameters: {'algorithm': 'brute', 'n_neighbors': 6, 'weights': 'distance', 'metric': 'manhattan'}. Best is trial 1 with value: 0.8571428571428572.
[32m[I 2023-04-26 00:20:39,857][39m Trial 347 finished with value: 0.8571428571428572 and parameters: {'algorithm': 'brute', 'n_neighbors': 6, 'weights': 'distance', 'metric': 'manhattan'}. Best is trial 1 with value: 0.8571428571428572.
[32m[I 2023-04-26 00:20:39,877][39m Trial 348 finished with value: 0.831858407079646 and parameters: {'algorithm': 'ball_tree', 'n_neighbors': 11, 'weights': 'distance', 'metric': 'manhattan'}. Best is trial 1 with value: 0.8571428571428572.
[32m[I 2023-04-26 00:20:39,896][39m Trial 349 finished with value: 0.8181818181818181 and parameters: {'algorithm': 'ball_tree', 'n_neighbors': 7, 'weights': 'distance', 'metric': 'manhattan'}. Best is trial 1 with value: 0.8571428571428572.
[32m[I 2023-04-26 00:20:39,915][39m Trial 350 finished with value: 0.8181818181818181 and parameters: {'algorithm': 'ball_tree', 'n_neighbors': 7, 'weights': 'distance', 'metric': 'manhattan'}. Best is trial 1 with value: 0.8571428571428572.
[32m[I 2023-04-26 00:20:39,940][39m Trial 351 finished with value: 0.8545454545454546 and parameters: {'algorithm': 'ball_tree', 'n_neighbors': 5, 'weights': 'uniform', 'metric': 'minkowski'}. Best is trial 1 with value: 0.8571428571428572.
[32m[I 2023-04-26 00:20:39,960][39m Trial 352 finished with value: 0.8571428571428572 and parameters: {'algorithm': 'kd_tree', 'n_neighbors': 6, 'weights': 'distance', 'metric': 'manhattan'}. Best is trial 1 with value: 0.8571428571428572.
[32m[I 2023-04-26 00:20:39,974][39m Trial 353 finished with value: 0.8288288288288289 and parameters: {'algorithm': 'kd_tree', 'n_neighbors': 12, 'weights': 'distance', 'metric': 'manhattan'}. Best is trial 1 with value: 0.8571428571428572.
[32m[I 2023-04-26 00:20:39,992][39m Trial 354 finished with value: 0.8571428571428572 and parameters: {'algorithm': 'ball_tree', 'n_neighbors': 5, 'weights': 'distance', 'metric': 'manhattan'}. Best is trial 1 with value: 0.8571428571428572.
[32m[I 2023-04-26 00:20:40,004][39m Trial 355 finished with value: 0.8571428571428572 and parameters: {'algorithm': 'ball_tree', 'n_neighbors': 5, 'weights': 'distance', 'metric': 'manhattan'}. Best is trial 1 with value: 0.8571428571428572.
[32m[I 2023-04-26 00:20:40,015][39m Trial 356 finished with value: 0.831858407079646 and parameters: {'algorithm': 'ball_tree', 'n_neighbors': 4, 'weights': 'distance', 'metric': 'manhattan'}. Best is trial 1 with value: 0.8571428571428572.
[32m[I 2023-04-26 00:20:40,024][39m Trial 357 finished with value: 0.8545454545454546 and parameters: {'algorithm': 'kd_tree', 'n_neighbors': 6, 'weights': 'distance', 'metric': 'euclidean'}. Best is trial 1 with value: 0.8571428571428572.
[32m[I 2023-04-26 00:20:40,035][39m Trial 358 finished with value: 0.8288288288288289 and parameters: {'algorithm': 'auto', 'n_neighbors': 15, 'weights': 'distance', 'metric': 'manhattan'}. Best is trial 1 with value: 0.8571428571428572.
[32m[I 2023-04-26 00:20:40,045][39m Trial 359 finished with value: 0.831858407079646 and parameters: {'algorithm': 'kd_tree', 'n_neighbors': 9, 'weights': 'distance', 'metric': 'manhattan'}. Best is trial 1 with value: 0.8571428571428572.
[32m[I 2023-04-26 00:20:40,054][39m Trial 360 finished with value: 0.8181818181818181 and parameters: {'algorithm': 'kd_tree', 'n_neighbors': 7, 'weights': 'distance', 'metric': 'manhattan'}. Best is trial 1 with value: 0.8571428571428572.
[32m[I 2023-04-26 00:20:40,086][39m Trial 361 finished with value: 0.8181818181818181 and parameters: {'algorithm': 'brute', 'n_neighbors': 7, 'weights': 'distance', 'metric': 'manhattan'}. Best is trial 1 with value: 0.8571428571428572.
[32m[I 2023-04-26 00:20:40,127][39m Trial 362 finished with value: 0.831858407079646 and parameters: {'algorithm': 'brute', 'n_neighbors': 9, 'weights': 'distance', 'metric': 'manhattan'}. Best is trial 1 with value: 0.8571428571428572.
[32m[I 2023-04-26 00:20:40,146][39m Trial 363 finished with value: 0.831858407079646 and parameters: {'algorithm': 'kd_tree', 'n_neighbors': 4, 'weights': 'distance', 'metric': 'manhattan'}. Best is trial 1 with value: 0.8571428571428572.
