[32m[I 2023-04-26 00:20:42,095][39m Trial 455 finished with value: 0.8275862068965517 and parameters: {'algorithm': 'ball_tree', 'n_neighbors': 3, 'weights': 'distance', 'metric': 'manhattan'}. Best is trial 1 with value: 0.8571428571428572.
[32m[I 2023-04-26 00:20:42,111][39m Trial 456 finished with value: 0.8571428571428572 and parameters: {'algorithm': 'kd_tree', 'n_neighbors': 6, 'weights': 'distance', 'metric': 'manhattan'}. Best is trial 1 with value: 0.8571428571428572.
[32m[I 2023-04-26 00:20:42,123][39m Trial 457 finished with value: 0.8571428571428572 and parameters: {'algorithm': 'ball_tree', 'n_neighbors': 5, 'weights': 'distance', 'metric': 'manhattan'}. Best is trial 1 with value: 0.8571428571428572.
[32m[I 2023-04-26 00:20:42,136][39m Trial 458 finished with value: 0.8181818181818181 and parameters: {'algorithm': 'ball_tree', 'n_neighbors': 7, 'weights': 'distance', 'metric': 'manhattan'}. Best is trial 1 with value: 0.8571428571428572.
[32m[I 2023-04-26 00:20:42,148][39m Trial 459 finished with value: 0.8571428571428572 and parameters: {'algorithm': 'kd_tree', 'n_neighbors': 6, 'weights': 'distance', 'metric': 'manhattan'}. Best is trial 1 with value: 0.8571428571428572.
[32m[I 2023-04-26 00:20:42,161][39m Trial 460 finished with value: 0.8571428571428572 and parameters: {'algorithm': 'kd_tree', 'n_neighbors': 6, 'weights': 'distance', 'metric': 'manhattan'}. Best is trial 1 with value: 0.8571428571428572.
[32m[I 2023-04-26 00:20:42,173][39m Trial 461 finished with value: 0.8571428571428572 and parameters: {'algorithm': 'ball_tree', 'n_neighbors': 6, 'weights': 'distance', 'metric': 'manhattan'}. Best is trial 1 with value: 0.8571428571428572.
[32m[I 2023-04-26 00:20:42,185][39m Trial 462 finished with value: 0.8571428571428572 and parameters: {'algorithm': 'ball_tree', 'n_neighbors': 6, 'weights': 'distance', 'metric': 'manhattan'}. Best is trial 1 with value: 0.8571428571428572.
[32m[I 2023-04-26 00:20:42,203][39m Trial 463 finished with value: 0.8181818181818181 and parameters: {'algorithm': 'ball_tree', 'n_neighbors': 7, 'weights': 'distance', 'metric': 'manhattan'}. Best is trial 1 with value: 0.8571428571428572.
[32m[I 2023-04-26 00:20:42,216][39m Trial 464 finished with value: 0.8545454545454546 and parameters: {'algorithm': 'kd_tree', 'n_neighbors': 6, 'weights': 'distance', 'metric': 'minkowski'}. Best is trial 1 with value: 0.8571428571428572.
[32m[I 2023-04-26 00:20:42,227][39m Trial 465 finished with value: 0.8571428571428572 and parameters: {'algorithm': 'auto', 'n_neighbors': 5, 'weights': 'distance', 'metric': 'manhattan'}. Best is trial 1 with value: 0.8571428571428572.
[32m[I 2023-04-26 00:20:42,240][39m Trial 466 finished with value: 0.8181818181818181 and parameters: {'algorithm': 'ball_tree', 'n_neighbors': 7, 'weights': 'distance', 'metric': 'manhattan'}. Best is trial 1 with value: 0.8571428571428572.
[32m[I 2023-04-26 00:20:42,251][39m Trial 467 finished with value: 0.8181818181818181 and parameters: {'algorithm': 'kd_tree', 'n_neighbors': 16, 'weights': 'distance', 'metric': 'manhattan'}. Best is trial 1 with value: 0.8571428571428572.
[32m[I 2023-04-26 00:20:42,267][39m Trial 468 finished with value: 0.8148148148148148 and parameters: {'algorithm': 'kd_tree', 'n_neighbors': 7, 'weights': 'uniform', 'metric': 'manhattan'}. Best is trial 1 with value: 0.8571428571428572.
[32m[I 2023-04-26 00:20:42,290][39m Trial 469 finished with value: 0.8545454545454546 and parameters: {'algorithm': 'kd_tree', 'n_neighbors': 6, 'weights': 'distance', 'metric': 'euclidean'}. Best is trial 1 with value: 0.8571428571428572.
[32m[I 2023-04-26 00:20:42,305][39m Trial 470 finished with value: 0.8571428571428572 and parameters: {'algorithm': 'kd_tree', 'n_neighbors': 8, 'weights': 'distance', 'metric': 'manhattan'}. Best is trial 1 with value: 0.8571428571428572.
[32m[I 2023-04-26 00:20:42,320][39m Trial 471 finished with value: 0.8571428571428572 and parameters: {'algorithm': 'kd_tree', 'n_neighbors': 6, 'weights': 'distance', 'metric': 'manhattan'}. Best is trial 1 with value: 0.8571428571428572.
[32m[I 2023-04-26 00:20:42,332][39m Trial 472 finished with value: 0.8571428571428572 and parameters: {'algorithm': 'kd_tree', 'n_neighbors': 6, 'weights': 'distance', 'metric': 'manhattan'}. Best is trial 1 with value: 0.8571428571428572.
[32m[I 2023-04-26 00:20:42,343][39m Trial 473 finished with value: 0.8571428571428572 and parameters: {'algorithm': 'kd_tree', 'n_neighbors': 5, 'weights': 'distance', 'metric': 'manhattan'}. Best is trial 1 with value: 0.8571428571428572.
[32m[I 2023-04-26 00:20:42,355][39m Trial 474 finished with value: 0.831858407079646 and parameters: {'algorithm': 'kd_tree', 'n_neighbors': 4, 'weights': 'distance', 'metric': 'manhattan'}. Best is trial 1 with value: 0.8571428571428572.
[32m[I 2023-04-26 00:20:42,388][39m Trial 475 finished with value: 0.831858407079646 and parameters: {'algorithm': 'brute', 'n_neighbors': 9, 'weights': 'distance', 'metric': 'manhattan'}. Best is trial 1 with value: 0.8571428571428572.
[32m[I 2023-04-26 00:20:42,433][39m Trial 476 finished with value: 0.8571428571428572 and parameters: {'algorithm': 'brute', 'n_neighbors': 8, 'weights': 'distance', 'metric': 'manhattan'}. Best is trial 1 with value: 0.8571428571428572.
[32m[I 2023-04-26 00:20:42,472][39m Trial 477 finished with value: 0.8571428571428572 and parameters: {'algorithm': 'brute', 'n_neighbors': 5, 'weights': 'distance', 'metric': 'manhattan'}. Best is trial 1 with value: 0.8571428571428572.
[32m[I 2023-04-26 00:20:42,511][39m Trial 478 finished with value: 0.831858407079646 and parameters: {'algorithm': 'brute', 'n_neighbors': 4, 'weights': 'distance', 'metric': 'manhattan'}. Best is trial 1 with value: 0.8571428571428572.
[32m[I 2023-04-26 00:20:42,550][39m Trial 479 finished with value: 0.8571428571428572 and parameters: {'algorithm': 'brute', 'n_neighbors': 5, 'weights': 'distance', 'metric': 'manhattan'}. Best is trial 1 with value: 0.8571428571428572.
[32m[I 2023-04-26 00:20:42,573][39m Trial 480 finished with value: 0.8571428571428572 and parameters: {'algorithm': 'kd_tree', 'n_neighbors': 8, 'weights': 'distance', 'metric': 'manhattan'}. Best is trial 1 with value: 0.8571428571428572.
[32m[I 2023-04-26 00:20:42,597][39m Trial 481 finished with value: 0.8181818181818181 and parameters: {'algorithm': 'kd_tree', 'n_neighbors': 7, 'weights': 'distance', 'metric': 'manhattan'}. Best is trial 1 with value: 0.8571428571428572.
[32m[I 2023-04-26 00:20:42,620][39m Trial 482 finished with value: 0.831858407079646 and parameters: {'algorithm': 'auto', 'n_neighbors': 4, 'weights': 'distance', 'metric': 'manhattan'}. Best is trial 1 with value: 0.8571428571428572.
[32m[I 2023-04-26 00:20:42,644][39m Trial 483 finished with value: 0.831858407079646 and parameters: {'algorithm': 'auto', 'n_neighbors': 4, 'weights': 'distance', 'metric': 'manhattan'}. Best is trial 1 with value: 0.8571428571428572.
[32m[I 2023-04-26 00:20:42,662][39m Trial 484 finished with value: 0.831858407079646 and parameters: {'algorithm': 'auto', 'n_neighbors': 9, 'weights': 'distance', 'metric': 'manhattan'}. Best is trial 1 with value: 0.8571428571428572.
[32m[I 2023-04-26 00:20:42,685][39m Trial 485 finished with value: 0.8275862068965517 and parameters: {'algorithm': 'kd_tree', 'n_neighbors': 3, 'weights': 'distance', 'metric': 'manhattan'}. Best is trial 1 with value: 0.8571428571428572.
[32m[I 2023-04-26 00:20:42,698][39m Trial 486 finished with value: 0.8571428571428572 and parameters: {'algorithm': 'kd_tree', 'n_neighbors': 5, 'weights': 'distance', 'metric': 'manhattan'}. Best is trial 1 with value: 0.8571428571428572.
[32m[I 2023-04-26 00:20:42,729][39m Trial 487 finished with value: 0.8148148148148148 and parameters: {'algorithm': 'brute', 'n_neighbors': 7, 'weights': 'distance', 'metric': 'minkowski'}. Best is trial 1 with value: 0.8571428571428572.
[32m[I 2023-04-26 00:20:42,757][39m Trial 488 finished with value: 0.8545454545454546 and parameters: {'algorithm': 'kd_tree', 'n_neighbors': 5, 'weights': 'uniform', 'metric': 'manhattan'}. Best is trial 1 with value: 0.8571428571428572.
[32m[I 2023-04-26 00:20:42,780][39m Trial 489 finished with value: 0.8392857142857144 and parameters: {'algorithm': 'kd_tree', 'n_neighbors': 10, 'weights': 'distance', 'metric': 'manhattan'}. Best is trial 1 with value: 0.8571428571428572.
[32m[I 2023-04-26 00:20:42,819][39m Trial 490 finished with value: 0.8571428571428572 and parameters: {'algorithm': 'brute', 'n_neighbors': 5, 'weights': 'distance', 'metric': 'manhattan'}. Best is trial 1 with value: 0.8571428571428572.
[32m[I 2023-04-26 00:20:42,856][39m Trial 491 finished with value: 0.8181818181818181 and parameters: {'algorithm': 'brute', 'n_neighbors': 7, 'weights': 'distance', 'metric': 'manhattan'}. Best is trial 1 with value: 0.8571428571428572.
[32m[I 2023-04-26 00:20:42,881][39m Trial 492 finished with value: 0.831858407079646 and parameters: {'algorithm': 'auto', 'n_neighbors': 4, 'weights': 'distance', 'metric': 'euclidean'}. Best is trial 1 with value: 0.8571428571428572.
[32m[I 2023-04-26 00:20:42,919][39m Trial 493 finished with value: 0.8392857142857144 and parameters: {'algorithm': 'brute', 'n_neighbors': 10, 'weights': 'distance', 'metric': 'manhattan'}. Best is trial 1 with value: 0.8571428571428572.
[32m[I 2023-04-26 00:20:42,943][39m Trial 494 finished with value: 0.8571428571428572 and parameters: {'algorithm': 'kd_tree', 'n_neighbors': 6, 'weights': 'distance', 'metric': 'manhattan'}. Best is trial 1 with value: 0.8571428571428572.
[32m[I 2023-04-26 00:20:42,968][39m Trial 495 finished with value: 0.8571428571428572 and parameters: {'algorithm': 'kd_tree', 'n_neighbors': 5, 'weights': 'distance', 'metric': 'manhattan'}. Best is trial 1 with value: 0.8571428571428572.
[32m[I 2023-04-26 00:20:42,992][39m Trial 496 finished with value: 0.8571428571428572 and parameters: {'algorithm': 'auto', 'n_neighbors': 8, 'weights': 'distance', 'metric': 'manhattan'}. Best is trial 1 with value: 0.8571428571428572.
[32m[I 2023-04-26 00:20:43,031][39m Trial 497 finished with value: 0.831858407079646 and parameters: {'algorithm': 'brute', 'n_neighbors': 13, 'weights': 'distance', 'metric': 'manhattan'}. Best is trial 1 with value: 0.8571428571428572.
[32m[I 2023-04-26 00:20:43,056][39m Trial 498 finished with value: 0.8571428571428572 and parameters: {'algorithm': 'ball_tree', 'n_neighbors': 5, 'weights': 'distance', 'metric': 'manhattan'}. Best is trial 1 with value: 0.8571428571428572.
[32m[I 2023-04-26 00:20:43,080][39m Trial 499 finished with value: 0.8571428571428572 and parameters: {'algorithm': 'ball_tree', 'n_neighbors': 6, 'weights': 'distance', 'metric': 'manhattan'}. Best is trial 1 with value: 0.8571428571428572.
Number of finished trials: 500