[32m[I 2023-04-26 00:20:35,896][39m Trial 91 finished with value: 0.8571428571428572 and parameters: {'algorithm': 'auto', 'n_neighbors': 8, 'weights': 'distance', 'metric': 'manhattan'}. Best is trial 1 with value: 0.8571428571428572.
[32m[I 2023-04-26 00:20:35,904][39m Trial 92 finished with value: 0.8571428571428572 and parameters: {'algorithm': 'auto', 'n_neighbors': 8, 'weights': 'distance', 'metric': 'manhattan'}. Best is trial 1 with value: 0.8571428571428572.
[32m[I 2023-04-26 00:20:35,911][39m Trial 93 finished with value: 0.8571428571428572 and parameters: {'algorithm': 'auto', 'n_neighbors': 8, 'weights': 'distance', 'metric': 'manhattan'}. Best is trial 1 with value: 0.8571428571428572.
[32m[I 2023-04-26 00:20:35,919][39m Trial 94 finished with value: 0.831858407079646 and parameters: {'algorithm': 'auto', 'n_neighbors': 9, 'weights': 'distance', 'metric': 'manhattan'}. Best is trial 1 with value: 0.8571428571428572.
[32m[I 2023-04-26 00:20:35,928][39m Trial 95 finished with value: 0.8571428571428572 and parameters: {'algorithm': 'kd_tree', 'n_neighbors': 6, 'weights': 'distance', 'metric': 'manhattan'}. Best is trial 1 with value: 0.8571428571428572.
[32m[I 2023-04-26 00:20:35,934][39m Trial 96 finished with value: 0.8571428571428572 and parameters: {'algorithm': 'kd_tree', 'n_neighbors': 6, 'weights': 'distance', 'metric': 'manhattan'}. Best is trial 1 with value: 0.8571428571428572.
[32m[I 2023-04-26 00:20:35,942][39m Trial 97 finished with value: 0.831858407079646 and parameters: {'algorithm': 'kd_tree', 'n_neighbors': 4, 'weights': 'distance', 'metric': 'manhattan'}. Best is trial 1 with value: 0.8571428571428572.
[32m[I 2023-04-26 00:20:35,952][39m Trial 98 finished with value: 0.8148148148148148 and parameters: {'algorithm': 'auto', 'n_neighbors': 7, 'weights': 'uniform', 'metric': 'manhattan'}. Best is trial 1 with value: 0.8571428571428572.
[32m[I 2023-04-26 00:20:35,959][39m Trial 99 finished with value: 0.831858407079646 and parameters: {'algorithm': 'auto', 'n_neighbors': 11, 'weights': 'distance', 'metric': 'manhattan'}. Best is trial 1 with value: 0.8571428571428572.
[32m[I 2023-04-26 00:20:35,967][39m Trial 100 finished with value: 0.831858407079646 and parameters: {'algorithm': 'auto', 'n_neighbors': 13, 'weights': 'distance', 'metric': 'manhattan'}. Best is trial 1 with value: 0.8571428571428572.
[32m[I 2023-04-26 00:20:35,974][39m Trial 101 finished with value: 0.8571428571428572 and parameters: {'algorithm': 'auto', 'n_neighbors': 5, 'weights': 'distance', 'metric': 'manhattan'}. Best is trial 1 with value: 0.8571428571428572.
[32m[I 2023-04-26 00:20:35,981][39m Trial 102 finished with value: 0.8181818181818181 and parameters: {'algorithm': 'auto', 'n_neighbors': 7, 'weights': 'distance', 'metric': 'manhattan'}. Best is trial 1 with value: 0.8571428571428572.
[32m[I 2023-04-26 00:20:35,989][39m Trial 103 finished with value: 0.8571428571428572 and parameters: {'algorithm': 'kd_tree', 'n_neighbors': 5, 'weights': 'distance', 'metric': 'manhattan'}. Best is trial 1 with value: 0.8571428571428572.
[32m[I 2023-04-26 00:20:35,997][39m Trial 104 finished with value: 0.831858407079646 and parameters: {'algorithm': 'auto', 'n_neighbors': 9, 'weights': 'distance', 'metric': 'manhattan'}. Best is trial 1 with value: 0.8571428571428572.
[32m[I 2023-04-26 00:20:36,005][39m Trial 105 finished with value: 0.8571428571428572 and parameters: {'algorithm': 'kd_tree', 'n_neighbors': 6, 'weights': 'distance', 'metric': 'manhattan'}. Best is trial 1 with value: 0.8571428571428572.
[32m[I 2023-04-26 00:20:36,012][39m Trial 106 finished with value: 0.8571428571428572 and parameters: {'algorithm': 'auto', 'n_neighbors': 8, 'weights': 'distance', 'metric': 'manhattan'}. Best is trial 1 with value: 0.8571428571428572.
[32m[I 2023-04-26 00:20:36,019][39m Trial 107 finished with value: 0.8148148148148148 and parameters: {'algorithm': 'auto', 'n_neighbors': 7, 'weights': 'distance', 'metric': 'minkowski'}. Best is trial 1 with value: 0.8571428571428572.
[32m[I 2023-04-26 00:20:36,027][39m Trial 108 finished with value: 0.8275862068965517 and parameters: {'algorithm': 'kd_tree', 'n_neighbors': 3, 'weights': 'distance', 'metric': 'manhattan'}. Best is trial 1 with value: 0.8571428571428572.
[32m[I 2023-04-26 00:20:36,035][39m Trial 109 finished with value: 0.831858407079646 and parameters: {'algorithm': 'ball_tree', 'n_neighbors': 4, 'weights': 'distance', 'metric': 'manhattan'}. Best is trial 1 with value: 0.8571428571428572.
[32m[I 2023-04-26 00:20:36,043][39m Trial 110 finished with value: 0.8545454545454546 and parameters: {'algorithm': 'kd_tree', 'n_neighbors': 5, 'weights': 'uniform', 'metric': 'manhattan'}. Best is trial 1 with value: 0.8571428571428572.
[32m[I 2023-04-26 00:20:36,050][39m Trial 111 finished with value: 0.8571428571428572 and parameters: {'algorithm': 'auto', 'n_neighbors': 6, 'weights': 'distance', 'metric': 'manhattan'}. Best is trial 1 with value: 0.8571428571428572.
[32m[I 2023-04-26 00:20:36,058][39m Trial 112 finished with value: 0.8571428571428572 and parameters: {'algorithm': 'auto', 'n_neighbors': 6, 'weights': 'distance', 'metric': 'manhattan'}. Best is trial 1 with value: 0.8571428571428572.
[32m[I 2023-04-26 00:20:36,084][39m Trial 113 finished with value: 0.8571428571428572 and parameters: {'algorithm': 'brute', 'n_neighbors': 6, 'weights': 'distance', 'metric': 'manhattan'}. Best is trial 1 with value: 0.8571428571428572.
[32m[I 2023-04-26 00:20:36,117][39m Trial 114 finished with value: 0.831858407079646 and parameters: {'algorithm': 'brute', 'n_neighbors': 4, 'weights': 'distance', 'metric': 'manhattan'}. Best is trial 1 with value: 0.8571428571428572.
[32m[I 2023-04-26 00:20:36,151][39m Trial 115 finished with value: 0.8173913043478261 and parameters: {'algorithm': 'brute', 'n_neighbors': 2, 'weights': 'distance', 'metric': 'manhattan'}. Best is trial 1 with value: 0.8571428571428572.
[32m[I 2023-04-26 00:20:36,165][39m Trial 116 finished with value: 0.8181818181818181 and parameters: {'algorithm': 'kd_tree', 'n_neighbors': 7, 'weights': 'distance', 'metric': 'manhattan'}. Best is trial 1 with value: 0.8571428571428572.
[32m[I 2023-04-26 00:20:36,178][39m Trial 117 finished with value: 0.8275862068965517 and parameters: {'algorithm': 'auto', 'n_neighbors': 3, 'weights': 'distance', 'metric': 'manhattan'}. Best is trial 1 with value: 0.8571428571428572.
[32m[I 2023-04-26 00:20:36,191][39m Trial 118 finished with value: 0.8571428571428572 and parameters: {'algorithm': 'auto', 'n_neighbors': 5, 'weights': 'distance', 'metric': 'manhattan'}. Best is trial 1 with value: 0.8571428571428572.
[32m[I 2023-04-26 00:20:36,205][39m Trial 119 finished with value: 0.8571428571428572 and parameters: {'algorithm': 'kd_tree', 'n_neighbors': 5, 'weights': 'distance', 'metric': 'manhattan'}. Best is trial 1 with value: 0.8571428571428572.
[32m[I 2023-04-26 00:20:36,219][39m Trial 120 finished with value: 0.8571428571428572 and parameters: {'algorithm': 'kd_tree', 'n_neighbors': 5, 'weights': 'distance', 'metric': 'manhattan'}. Best is trial 1 with value: 0.8571428571428572.
[32m[I 2023-04-26 00:20:36,232][39m Trial 121 finished with value: 0.8571428571428572 and parameters: {'algorithm': 'kd_tree', 'n_neighbors': 6, 'weights': 'distance', 'metric': 'manhattan'}. Best is trial 1 with value: 0.8571428571428572.
[32m[I 2023-04-26 00:20:36,247][39m Trial 122 finished with value: 0.8571428571428572 and parameters: {'algorithm': 'kd_tree', 'n_neighbors': 6, 'weights': 'distance', 'metric': 'manhattan'}. Best is trial 1 with value: 0.8571428571428572.
[32m[I 2023-04-26 00:20:36,260][39m Trial 123 finished with value: 0.8571428571428572 and parameters: {'algorithm': 'kd_tree', 'n_neighbors': 8, 'weights': 'distance', 'metric': 'manhattan'}. Best is trial 1 with value: 0.8571428571428572.
[32m[I 2023-04-26 00:20:36,268][39m Trial 124 finished with value: 0.8181818181818181 and parameters: {'algorithm': 'kd_tree', 'n_neighbors': 7, 'weights': 'distance', 'metric': 'manhattan'}. Best is trial 1 with value: 0.8571428571428572.
[32m[I 2023-04-26 00:20:36,278][39m Trial 125 finished with value: 0.8571428571428572 and parameters: {'algorithm': 'kd_tree', 'n_neighbors': 6, 'weights': 'distance', 'metric': 'manhattan'}. Best is trial 1 with value: 0.8571428571428572.
[32m[I 2023-04-26 00:20:36,286][39m Trial 126 finished with value: 0.8571428571428572 and parameters: {'algorithm': 'kd_tree', 'n_neighbors': 8, 'weights': 'distance', 'metric': 'manhattan'}. Best is trial 1 with value: 0.8571428571428572.
[32m[I 2023-04-26 00:20:36,293][39m Trial 127 finished with value: 0.8392857142857144 and parameters: {'algorithm': 'kd_tree', 'n_neighbors': 10, 'weights': 'distance', 'metric': 'manhattan'}. Best is trial 1 with value: 0.8571428571428572.
[32m[I 2023-04-26 00:20:36,301][39m Trial 128 finished with value: 0.831858407079646 and parameters: {'algorithm': 'auto', 'n_neighbors': 4, 'weights': 'distance', 'metric': 'minkowski'}. Best is trial 1 with value: 0.8571428571428572.
[32m[I 2023-04-26 00:20:36,308][39m Trial 129 finished with value: 0.8571428571428572 and parameters: {'algorithm': 'auto', 'n_neighbors': 8, 'weights': 'distance', 'metric': 'manhattan'}. Best is trial 1 with value: 0.8571428571428572.
[32m[I 2023-04-26 00:20:36,317][39m Trial 130 finished with value: 0.8148148148148148 and parameters: {'algorithm': 'ball_tree', 'n_neighbors': 7, 'weights': 'uniform', 'metric': 'manhattan'}. Best is trial 1 with value: 0.8571428571428572.
[32m[I 2023-04-26 00:20:36,329][39m Trial 131 finished with value: 0.8181818181818181 and parameters: {'algorithm': 'auto', 'n_neighbors': 18, 'weights': 'distance', 'metric': 'manhattan'}. Best is trial 1 with value: 0.8571428571428572.
[32m[I 2023-04-26 00:20:36,336][39m Trial 132 finished with value: 0.831858407079646 and parameters: {'algorithm': 'auto', 'n_neighbors': 9, 'weights': 'distance', 'metric': 'manhattan'}. Best is trial 1 with value: 0.8571428571428572.
[32m[I 2023-04-26 00:20:36,344][39m Trial 133 finished with value: 0.8571428571428572 and parameters: {'algorithm': 'kd_tree', 'n_neighbors': 6, 'weights': 'distance', 'metric': 'manhattan'}. Best is trial 1 with value: 0.8571428571428572.
[32m[I 2023-04-26 00:20:36,352][39m Trial 134 finished with value: 0.8181818181818181 and parameters: {'algorithm': 'auto', 'n_neighbors': 7, 'weights': 'distance', 'metric': 'manhattan'}. Best is trial 1 with value: 0.8571428571428572.
[32m[I 2023-04-26 00:20:36,378][39m Trial 135 finished with value: 0.8571428571428572 and parameters: {'algorithm': 'brute', 'n_neighbors': 5, 'weights': 'distance', 'metric': 'manhattan'}. Best is trial 1 with value: 0.8571428571428572.
[32m[I 2023-04-26 00:20:36,412][39m Trial 136 finished with value: 0.8571428571428572 and parameters: {'algorithm': 'brute', 'n_neighbors': 5, 'weights': 'distance', 'metric': 'manhattan'}. Best is trial 1 with value: 0.8571428571428572.
[32m[I 2023-04-26 00:20:36,427][39m Trial 137 finished with value: 0.831858407079646 and parameters: {'algorithm': 'auto', 'n_neighbors': 9, 'weights': 'distance', 'metric': 'manhattan'}. Best is trial 1 with value: 0.8571428571428572.
[32m[I 2023-04-26 00:20:36,459][39m Trial 138 finished with value: 0.8275862068965517 and parameters: {'algorithm': 'brute', 'n_neighbors': 3, 'weights': 'distance', 'metric': 'manhattan'}. Best is trial 1 with value: 0.8571428571428572.
[32m[I 2023-04-26 00:20:36,474][39m Trial 139 finished with value: 0.831858407079646 and parameters: {'algorithm': 'kd_tree', 'n_neighbors': 4, 'weights': 'distance', 'metric': 'euclidean'}. Best is trial 1 with value: 0.8571428571428572.
[32m[I 2023-04-26 00:20:36,489][39m Trial 140 finished with value: 0.8571428571428572 and parameters: {'algorithm': 'kd_tree', 'n_neighbors': 6, 'weights': 'distance', 'metric': 'manhattan'}. Best is trial 1 with value: 0.8571428571428572.
[32m[I 2023-04-26 00:20:36,503][39m Trial 141 finished with value: 0.8571428571428572 and parameters: {'algorithm': 'auto', 'n_neighbors': 8, 'weights': 'distance', 'metric': 'manhattan'}. Best is trial 1 with value: 0.8571428571428572.
[32m[I 2023-04-26 00:20:36,517][39m Trial 142 finished with value: 0.8571428571428572 and parameters: {'algorithm': 'auto', 'n_neighbors': 6, 'weights': 'distance', 'metric': 'manhattan'}. Best is trial 1 with value: 0.8571428571428572.
[32m[I 2023-04-26 00:20:36,531][39m Trial 143 finished with value: 0.831858407079646 and parameters: {'algorithm': 'auto', 'n_neighbors': 4, 'weights': 'distance', 'metric': 'manhattan'}. Best is trial 1 with value: 0.8571428571428572.
[32m[I 2023-04-26 00:20:36,545][39m Trial 144 finished with value: 0.8181818181818181 and parameters: {'algorithm': 'auto', 'n_neighbors': 7, 'weights': 'distance', 'metric': 'manhattan'}. Best is trial 1 with value: 0.8571428571428572.
[32m[I 2023-04-26 00:20:36,558][39m Trial 145 finished with value: 0.8571428571428572 and parameters: {'algorithm': 'auto', 'n_neighbors': 5, 'weights': 'distance', 'metric': 'manhattan'}. Best is trial 1 with value: 0.8571428571428572.
[32m[I 2023-04-26 00:20:36,565][39m Trial 146 finished with value: 0.8571428571428572 and parameters: {'algorithm': 'kd_tree', 'n_neighbors': 6, 'weights': 'distance', 'metric': 'manhattan'}. Best is trial 1 with value: 0.8571428571428572.
[32m[I 2023-04-26 00:20:36,573][39m Trial 147 finished with value: 0.8571428571428572 and parameters: {'algorithm': 'auto', 'n_neighbors': 5, 'weights': 'distance', 'metric': 'manhattan'}. Best is trial 1 with value: 0.8571428571428572.
[32m[I 2023-04-26 00:20:36,581][39m Trial 148 finished with value: 0.8571428571428572 and parameters: {'algorithm': 'auto', 'n_neighbors': 5, 'weights': 'distance', 'metric': 'manhattan'}. Best is trial 1 with value: 0.8571428571428572.
[32m[I 2023-04-26 00:20:36,589][39m Trial 149 finished with value: 0.8392857142857144 and parameters: {'algorithm': 'kd_tree', 'n_neighbors': 10, 'weights': 'distance', 'metric': 'manhattan'}. Best is trial 1 with value: 0.8571428571428572.
[32m[I 2023-04-26 00:20:36,597][39m Trial 150 finished with value: 0.8571428571428572 and parameters: {'algorithm': 'auto', 'n_neighbors': 8, 'weights': 'distance', 'metric': 'manhattan'}. Best is trial 1 with value: 0.8571428571428572.
[32m[I 2023-04-26 00:20:36,605][39m Trial 151 finished with value: 0.8571428571428572 and parameters: {'algorithm': 'kd_tree', 'n_neighbors': 6, 'weights': 'distance', 'metric': 'manhattan'}. Best is trial 1 with value: 0.8571428571428572.
[32m[I 2023-04-26 00:20:36,613][39m Trial 152 finished with value: 0.8571428571428572 and parameters: {'algorithm': 'kd_tree', 'n_neighbors': 8, 'weights': 'distance', 'metric': 'manhattan'}. Best is trial 1 with value: 0.8571428571428572.
[32m[I 2023-04-26 00:20:36,621][39m Trial 153 finished with value: 0.831858407079646 and parameters: {'algorithm': 'auto', 'n_neighbors': 9, 'weights': 'distance', 'metric': 'manhattan'}. Best is trial 1 with value: 0.8571428571428572.
[32m[I 2023-04-26 00:20:36,649][39m Trial 154 finished with value: 0.8571428571428572 and parameters: {'algorithm': 'brute', 'n_neighbors': 6, 'weights': 'distance', 'metric': 'manhattan'}. Best is trial 1 with value: 0.8571428571428572.
[32m[I 2023-04-26 00:20:36,663][39m Trial 155 finished with value: 0.8181818181818181 and parameters: {'algorithm': 'auto', 'n_neighbors': 7, 'weights': 'distance', 'metric': 'manhattan'}. Best is trial 1 with value: 0.8571428571428572.
[32m[I 2023-04-26 00:20:36,678][39m Trial 156 finished with value: 0.8275862068965517 and parameters: {'algorithm': 'kd_tree', 'n_neighbors': 3, 'weights': 'distance', 'metric': 'minkowski'}. Best is trial 1 with value: 0.8571428571428572.
[32m[I 2023-04-26 00:20:36,693][39m Trial 157 finished with value: 0.831858407079646 and parameters: {'algorithm': 'kd_tree', 'n_neighbors': 4, 'weights': 'distance', 'metric': 'manhattan'}. Best is trial 1 with value: 0.8571428571428572.
[32m[I 2023-04-26 00:20:36,707][39m Trial 158 finished with value: 0.8571428571428572 and parameters: {'algorithm': 'kd_tree', 'n_neighbors': 5, 'weights': 'distance', 'metric': 'manhattan'}. Best is trial 1 with value: 0.8571428571428572.
[32m[I 2023-04-26 00:20:36,726][39m Trial 159 finished with value: 0.8148148148148148 and parameters: {'algorithm': 'auto', 'n_neighbors': 7, 'weights': 'uniform', 'metric': 'manhattan'}. Best is trial 1 with value: 0.8571428571428572.
[32m[I 2023-04-26 00:20:36,741][39m Trial 160 finished with value: 0.8571428571428572 and parameters: {'algorithm': 'auto', 'n_neighbors': 8, 'weights': 'distance', 'metric': 'manhattan'}. Best is trial 1 with value: 0.8571428571428572.
[32m[I 2023-04-26 00:20:36,750][39m Trial 161 finished with value: 0.8571428571428572 and parameters: {'algorithm': 'auto', 'n_neighbors': 5, 'weights': 'distance', 'metric': 'manhattan'}. Best is trial 1 with value: 0.8571428571428572.
[32m[I 2023-04-26 00:20:36,759][39m Trial 162 finished with value: 0.831858407079646 and parameters: {'algorithm': 'auto', 'n_neighbors': 4, 'weights': 'distance', 'metric': 'manhattan'}. Best is trial 1 with value: 0.8571428571428572.
[32m[I 2023-04-26 00:20:36,766][39m Trial 163 finished with value: 0.8571428571428572 and parameters: {'algorithm': 'kd_tree', 'n_neighbors': 6, 'weights': 'distance', 'metric': 'manhattan'}. Best is trial 1 with value: 0.8571428571428572.
[32m[I 2023-04-26 00:20:36,776][39m Trial 164 finished with value: 0.8571428571428572 and parameters: {'algorithm': 'kd_tree', 'n_neighbors': 6, 'weights': 'distance', 'metric': 'manhattan'}. Best is trial 1 with value: 0.8571428571428572.
[32m[I 2023-04-26 00:20:36,784][39m Trial 165 finished with value: 0.8181818181818181 and parameters: {'algorithm': 'auto', 'n_neighbors': 7, 'weights': 'distance', 'metric': 'manhattan'}. Best is trial 1 with value: 0.8571428571428572.
[32m[I 2023-04-26 00:20:36,792][39m Trial 166 finished with value: 0.831858407079646 and parameters: {'algorithm': 'auto', 'n_neighbors': 9, 'weights': 'distance', 'metric': 'manhattan'}. Best is trial 1 with value: 0.8571428571428572.
[32m[I 2023-04-26 00:20:36,799][39m Trial 167 finished with value: 0.8571428571428572 and parameters: {'algorithm': 'auto', 'n_neighbors': 5, 'weights': 'distance', 'metric': 'manhattan'}. Best is trial 1 with value: 0.8571428571428572.
[32m[I 2023-04-26 00:20:36,807][39m Trial 168 finished with value: 0.8545454545454546 and parameters: {'algorithm': 'kd_tree', 'n_neighbors': 6, 'weights': 'distance', 'metric': 'euclidean'}. Best is trial 1 with value: 0.8571428571428572.
[32m[I 2023-04-26 00:20:36,815][39m Trial 169 finished with value: 0.8571428571428572 and parameters: {'algorithm': 'auto', 'n_neighbors': 8, 'weights': 'distance', 'metric': 'manhattan'}. Best is trial 1 with value: 0.8571428571428572.
[32m[I 2023-04-26 00:20:36,824][39m Trial 170 finished with value: 0.8571428571428572 and parameters: {'algorithm': 'ball_tree', 'n_neighbors': 5, 'weights': 'distance', 'metric': 'manhattan'}. Best is trial 1 with value: 0.8571428571428572.
[32m[I 2023-04-26 00:20:36,831][39m Trial 171 finished with value: 0.8571428571428572 and parameters: {'algorithm': 'ball_tree', 'n_neighbors': 5, 'weights': 'distance', 'metric': 'manhattan'}. Best is trial 1 with value: 0.8571428571428572.
[32m[I 2023-04-26 00:20:36,840][39m Trial 172 finished with value: 0.831858407079646 and parameters: {'algorithm': 'ball_tree', 'n_neighbors': 4, 'weights': 'distance', 'metric': 'manhattan'}. Best is trial 1 with value: 0.8571428571428572.
[32m[I 2023-04-26 00:20:36,871][39m Trial 173 finished with value: 0.8181818181818181 and parameters: {'algorithm': 'brute', 'n_neighbors': 7, 'weights': 'distance', 'metric': 'manhattan'}. Best is trial 1 with value: 0.8571428571428572.
[32m[I 2023-04-26 00:20:36,908][39m Trial 174 finished with value: 0.8571428571428572 and parameters: {'algorithm': 'brute', 'n_neighbors': 8, 'weights': 'distance', 'metric': 'manhattan'}. Best is trial 1 with value: 0.8571428571428572.
[32m[I 2023-04-26 00:20:36,923][39m Trial 175 finished with value: 0.8571428571428572 and parameters: {'algorithm': 'kd_tree', 'n_neighbors': 5, 'weights': 'distance', 'metric': 'manhattan'}. Best is trial 1 with value: 0.8571428571428572.
[32m[I 2023-04-26 00:20:36,956][39m Trial 176 finished with value: 0.8571428571428572 and parameters: {'algorithm': 'brute', 'n_neighbors': 6, 'weights': 'distance', 'metric': 'manhattan'}. Best is trial 1 with value: 0.8571428571428572.
[32m[I 2023-04-26 00:20:36,988][39m Trial 177 finished with value: 0.8181818181818181 and parameters: {'algorithm': 'brute', 'n_neighbors': 7, 'weights': 'distance', 'metric': 'manhattan'}. Best is trial 1 with value: 0.8571428571428572.
[32m[I 2023-04-26 00:20:37,004][39m Trial 178 finished with value: 0.8571428571428572 and parameters: {'algorithm': 'auto', 'n_neighbors': 6, 'weights': 'distance', 'metric': 'manhattan'}. Best is trial 1 with value: 0.8571428571428572.
[32m[I 2023-04-26 00:20:37,020][39m Trial 179 finished with value: 0.8392857142857144 and parameters: {'algorithm': 'auto', 'n_neighbors': 10, 'weights': 'distance', 'metric': 'manhattan'}. Best is trial 1 with value: 0.8571428571428572.
[32m[I 2023-04-26 00:20:37,035][39m Trial 180 finished with value: 0.831858407079646 and parameters: {'algorithm': 'kd_tree', 'n_neighbors': 9, 'weights': 'distance', 'metric': 'manhattan'}. Best is trial 1 with value: 0.8571428571428572.
[32m[I 2023-04-26 00:20:37,050][39m Trial 181 finished with value: 0.8571428571428572 and parameters: {'algorithm': 'kd_tree', 'n_neighbors': 8, 'weights': 'distance', 'metric': 'manhattan'}. Best is trial 1 with value: 0.8571428571428572.
