[32m[I 2023-04-25 23:52:42,261][39m Trial 463 finished with value: 0.8672566371681416 and parameters: {'objective': 'CrossEntropy', 'colsample_bylevel': 0.09391728055545713, 'depth': 10, 'boosting_type': 'Plain', 'bootstrap_type': 'Bayesian', 'bagging_temperature': 5.545900819003435}. Best is trial 161 with value: 0.8928571428571429.
[32m[I 2023-04-25 23:52:48,179][39m Trial 464 finished with value: 0.8596491228070176 and parameters: {'objective': 'Logloss', 'colsample_bylevel': 0.087846128844776, 'depth': 12, 'boosting_type': 'Ordered', 'bootstrap_type': 'Bayesian', 'bagging_temperature': 2.859330317543599}. Best is trial 161 with value: 0.8928571428571429.
[32m[I 2023-04-25 23:52:52,533][39m Trial 465 finished with value: 0.875 and parameters: {'objective': 'Logloss', 'colsample_bylevel': 0.06898149014761377, 'depth': 4, 'boosting_type': 'Ordered', 'bootstrap_type': 'Bayesian', 'bagging_temperature': 8.163309873703977}. Best is trial 161 with value: 0.8928571428571429.
[32m[I 2023-04-25 23:52:55,658][39m Trial 466 finished with value: 0.875 and parameters: {'objective': 'CrossEntropy', 'colsample_bylevel': 0.07406876586531248, 'depth': 9, 'boosting_type': 'Plain', 'bootstrap_type': 'Bayesian', 'bagging_temperature': 2.7112292694860383}. Best is trial 161 with value: 0.8928571428571429.
[32m[I 2023-04-25 23:52:58,079][39m Trial 467 finished with value: 0.8596491228070176 and parameters: {'objective': 'CrossEntropy', 'colsample_bylevel': 0.07758037559436139, 'depth': 6, 'boosting_type': 'Plain', 'bootstrap_type': 'Bernoulli', 'subsample': 0.46768158460582004}. Best is trial 161 with value: 0.8928571428571429.
[32m[I 2023-04-25 23:53:00,018][39m Trial 468 finished with value: 0.8571428571428572 and parameters: {'objective': 'CrossEntropy', 'colsample_bylevel': 0.08704431744783211, 'depth': 10, 'boosting_type': 'Plain', 'bootstrap_type': 'MVS'}. Best is trial 161 with value: 0.8928571428571429.
[32m[I 2023-04-25 23:53:02,701][39m Trial 469 finished with value: 0.8596491228070176 and parameters: {'objective': 'CrossEntropy', 'colsample_bylevel': 0.08365338324588784, 'depth': 6, 'boosting_type': 'Plain', 'bootstrap_type': 'Bayesian', 'bagging_temperature': 2.2839286095546534}. Best is trial 161 with value: 0.8928571428571429.
[32m[I 2023-04-25 23:53:05,619][39m Trial 470 finished with value: 0.8828828828828829 and parameters: {'objective': 'CrossEntropy', 'colsample_bylevel': 0.09086189532722874, 'depth': 8, 'boosting_type': 'Plain', 'bootstrap_type': 'Bayesian', 'bagging_temperature': 2.892165645375295}. Best is trial 161 with value: 0.8928571428571429.
[32m[I 2023-04-25 23:53:10,696][39m Trial 471 finished with value: 0.8672566371681416 and parameters: {'objective': 'Logloss', 'colsample_bylevel': 0.08932997435879256, 'depth': 8, 'boosting_type': 'Ordered', 'bootstrap_type': 'Bayesian', 'bagging_temperature': 2.4624877523068016}. Best is trial 161 with value: 0.8928571428571429.
[32m[I 2023-04-25 23:53:16,285][39m Trial 472 finished with value: 0.8596491228070176 and parameters: {'objective': 'Logloss', 'colsample_bylevel': 0.09139015055712157, 'depth': 10, 'boosting_type': 'Ordered', 'bootstrap_type': 'Bayesian', 'bagging_temperature': 4.635518720931581}. Best is trial 161 with value: 0.8928571428571429.
[32m[I 2023-04-25 23:53:19,144][39m Trial 473 finished with value: 0.875 and parameters: {'objective': 'CrossEntropy', 'colsample_bylevel': 0.09175372827927032, 'depth': 10, 'boosting_type': 'Plain', 'bootstrap_type': 'Bayesian', 'bagging_temperature': 3.969345248139646}. Best is trial 161 with value: 0.8928571428571429.
[32m[I 2023-04-25 23:53:22,246][39m Trial 474 finished with value: 0.8672566371681416 and parameters: {'objective': 'CrossEntropy', 'colsample_bylevel': 0.09734384410340377, 'depth': 12, 'boosting_type': 'Plain', 'bootstrap_type': 'Bayesian', 'bagging_temperature': 3.628361115009367}. Best is trial 161 with value: 0.8928571428571429.
[32m[I 2023-04-25 23:53:24,735][39m Trial 475 finished with value: 0.8596491228070176 and parameters: {'objective': 'CrossEntropy', 'colsample_bylevel': 0.060585529126843535, 'depth': 9, 'boosting_type': 'Plain', 'bootstrap_type': 'Bayesian', 'bagging_temperature': 3.7628963917574385}. Best is trial 161 with value: 0.8928571428571429.
[32m[I 2023-04-25 23:53:27,623][39m Trial 476 finished with value: 0.8771929824561403 and parameters: {'objective': 'CrossEntropy', 'colsample_bylevel': 0.09048204259280945, 'depth': 8, 'boosting_type': 'Plain', 'bootstrap_type': 'Bayesian', 'bagging_temperature': 3.4819017634471807}. Best is trial 161 with value: 0.8928571428571429.
[32m[I 2023-04-25 23:53:30,643][39m Trial 477 finished with value: 0.8672566371681416 and parameters: {'objective': 'CrossEntropy', 'colsample_bylevel': 0.07499014714759715, 'depth': 9, 'boosting_type': 'Plain', 'bootstrap_type': 'Bayesian', 'bagging_temperature': 0.8585002755973212}. Best is trial 161 with value: 0.8928571428571429.
[32m[I 2023-04-25 23:53:34,942][39m Trial 478 finished with value: 0.8571428571428572 and parameters: {'objective': 'Logloss', 'colsample_bylevel': 0.0768693310760835, 'depth': 9, 'boosting_type': 'Ordered', 'bootstrap_type': 'Bayesian', 'bagging_temperature': 3.666225774379304}. Best is trial 161 with value: 0.8928571428571429.
[32m[I 2023-04-25 23:53:38,554][39m Trial 479 finished with value: 0.8828828828828829 and parameters: {'objective': 'CrossEntropy', 'colsample_bylevel': 0.08156739023566544, 'depth': 9, 'boosting_type': 'Plain', 'bootstrap_type': 'Bayesian', 'bagging_temperature': 3.1638268246337082}. Best is trial 161 with value: 0.8928571428571429.
[32m[I 2023-04-25 23:53:40,966][39m Trial 480 finished with value: 0.8468468468468469 and parameters: {'objective': 'CrossEntropy', 'colsample_bylevel': 0.07916407917544165, 'depth': 7, 'boosting_type': 'Plain', 'bootstrap_type': 'Bayesian', 'bagging_temperature': 6.842802674043792}. Best is trial 161 with value: 0.8928571428571429.
[32m[I 2023-04-25 23:53:43,653][39m Trial 481 finished with value: 0.8672566371681416 and parameters: {'objective': 'CrossEntropy', 'colsample_bylevel': 0.09424311373997998, 'depth': 12, 'boosting_type': 'Plain', 'bootstrap_type': 'Bayesian', 'bagging_temperature': 8.820913747426518}. Best is trial 161 with value: 0.8928571428571429.
[32m[I 2023-04-25 23:53:46,249][39m Trial 482 finished with value: 0.875 and parameters: {'objective': 'CrossEntropy', 'colsample_bylevel': 0.08187907503077779, 'depth': 10, 'boosting_type': 'Plain', 'bootstrap_type': 'Bayesian', 'bagging_temperature': 2.7560033717431223}. Best is trial 161 with value: 0.8928571428571429.
[32m[I 2023-04-25 23:53:49,197][39m Trial 483 finished with value: 0.8828828828828829 and parameters: {'objective': 'CrossEntropy', 'colsample_bylevel': 0.09280709097519767, 'depth': 6, 'boosting_type': 'Plain', 'bootstrap_type': 'Bayesian', 'bagging_temperature': 3.88194965433785}. Best is trial 161 with value: 0.8928571428571429.
[32m[I 2023-04-25 23:53:51,787][39m Trial 484 finished with value: 0.875 and parameters: {'objective': 'CrossEntropy', 'colsample_bylevel': 0.09521474877606433, 'depth': 11, 'boosting_type': 'Plain', 'bootstrap_type': 'Bayesian', 'bagging_temperature': 3.9669395546365673}. Best is trial 161 with value: 0.8928571428571429.
[32m[I 2023-04-25 23:53:54,818][39m Trial 485 finished with value: 0.8571428571428572 and parameters: {'objective': 'CrossEntropy', 'colsample_bylevel': 0.09363382625417015, 'depth': 9, 'boosting_type': 'Plain', 'bootstrap_type': 'Bayesian', 'bagging_temperature': 7.336880406420028}. Best is trial 161 with value: 0.8928571428571429.
[32m[I 2023-04-25 23:53:57,298][39m Trial 486 finished with value: 0.8596491228070176 and parameters: {'objective': 'CrossEntropy', 'colsample_bylevel': 0.09590992759369917, 'depth': 8, 'boosting_type': 'Plain', 'bootstrap_type': 'Bernoulli', 'subsample': 0.6421265294207139}. Best is trial 161 with value: 0.8928571428571429.
[32m[I 2023-04-25 23:53:59,754][39m Trial 487 finished with value: 0.8468468468468469 and parameters: {'objective': 'CrossEntropy', 'colsample_bylevel': 0.08488934046028802, 'depth': 11, 'boosting_type': 'Plain', 'bootstrap_type': 'Bayesian', 'bagging_temperature': 4.268333124504831}. Best is trial 161 with value: 0.8928571428571429.
[32m[I 2023-04-25 23:54:01,821][39m Trial 488 finished with value: 0.8521739130434783 and parameters: {'objective': 'CrossEntropy', 'colsample_bylevel': 0.09739326427967, 'depth': 10, 'boosting_type': 'Plain', 'bootstrap_type': 'Bayesian', 'bagging_temperature': 7.543954120754032}. Best is trial 161 with value: 0.8928571428571429.
[32m[I 2023-04-25 23:54:04,780][39m Trial 489 finished with value: 0.875 and parameters: {'objective': 'CrossEntropy', 'colsample_bylevel': 0.0888198889158032, 'depth': 7, 'boosting_type': 'Plain', 'bootstrap_type': 'Bayesian', 'bagging_temperature': 3.339419573394098}. Best is trial 161 with value: 0.8928571428571429.
[32m[I 2023-04-25 23:54:08,198][39m Trial 490 finished with value: 0.8596491228070176 and parameters: {'objective': 'CrossEntropy', 'colsample_bylevel': 0.07427963184349512, 'depth': 9, 'boosting_type': 'Plain', 'bootstrap_type': 'MVS'}. Best is trial 161 with value: 0.8928571428571429.
[32m[I 2023-04-25 23:54:12,305][39m Trial 491 finished with value: 0.8495575221238938 and parameters: {'objective': 'Logloss', 'colsample_bylevel': 0.04157239904661837, 'depth': 6, 'boosting_type': 'Ordered', 'bootstrap_type': 'Bayesian', 'bagging_temperature': 6.342882621866261}. Best is trial 161 with value: 0.8928571428571429.
[32m[I 2023-04-25 23:54:14,397][39m Trial 492 finished with value: 0.875 and parameters: {'objective': 'CrossEntropy', 'colsample_bylevel': 0.09160190865438486, 'depth': 10, 'boosting_type': 'Plain', 'bootstrap_type': 'Bayesian', 'bagging_temperature': 2.9208245929107184}. Best is trial 161 with value: 0.8928571428571429.
[32m[I 2023-04-25 23:54:16,799][39m Trial 493 finished with value: 0.8828828828828829 and parameters: {'objective': 'CrossEntropy', 'colsample_bylevel': 0.07488064978287538, 'depth': 5, 'boosting_type': 'Plain', 'bootstrap_type': 'Bayesian', 'bagging_temperature': 9.834132945954162}. Best is trial 161 with value: 0.8928571428571429.
[32m[I 2023-04-25 23:54:18,910][39m Trial 494 finished with value: 0.8672566371681416 and parameters: {'objective': 'CrossEntropy', 'colsample_bylevel': 0.09276522109009132, 'depth': 11, 'boosting_type': 'Plain', 'bootstrap_type': 'Bayesian', 'bagging_temperature': 4.782694007826775}. Best is trial 161 with value: 0.8928571428571429.
[32m[I 2023-04-25 23:54:21,470][39m Trial 495 finished with value: 0.8672566371681416 and parameters: {'objective': 'CrossEntropy', 'colsample_bylevel': 0.09927736580314242, 'depth': 7, 'boosting_type': 'Plain', 'bootstrap_type': 'Bayesian', 'bagging_temperature': 2.5585701613558087}. Best is trial 161 with value: 0.8928571428571429.
[32m[I 2023-04-25 23:54:24,348][39m Trial 496 finished with value: 0.875 and parameters: {'objective': 'CrossEntropy', 'colsample_bylevel': 0.09998603750071981, 'depth': 10, 'boosting_type': 'Plain', 'bootstrap_type': 'Bayesian', 'bagging_temperature': 2.8423631487331567}. Best is trial 161 with value: 0.8928571428571429.
[32m[I 2023-04-25 23:54:30,829][39m Trial 497 finished with value: 0.8571428571428572 and parameters: {'objective': 'Logloss', 'colsample_bylevel': 0.08922451479720514, 'depth': 5, 'boosting_type': 'Ordered', 'bootstrap_type': 'Bayesian', 'bagging_temperature': 5.212497327804071}. Best is trial 161 with value: 0.8928571428571429.
[32m[I 2023-04-25 23:54:33,509][39m Trial 498 finished with value: 0.8672566371681416 and parameters: {'objective': 'CrossEntropy', 'colsample_bylevel': 0.09467125118840145, 'depth': 11, 'boosting_type': 'Plain', 'bootstrap_type': 'Bayesian', 'bagging_temperature': 3.1410149026312806}. Best is trial 161 with value: 0.8928571428571429.
[32m[I 2023-04-25 23:54:36,006][39m Trial 499 finished with value: 0.875 and parameters: {'objective': 'CrossEntropy', 'colsample_bylevel': 0.08291994867464748, 'depth': 10, 'boosting_type': 'Plain', 'bootstrap_type': 'Bayesian', 'bagging_temperature': 3.516753960596226}. Best is trial 161 with value: 0.8928571428571429.
Number of finished trials: 500