[32m[I 2023-04-25 23:39:59,388][39m Trial 199 finished with value: 0.875 and parameters: {'objective': 'CrossEntropy', 'colsample_bylevel': 0.09424806817305177, 'depth': 12, 'boosting_type': 'Plain', 'bootstrap_type': 'Bayesian', 'bagging_temperature': 3.4424370063379057}. Best is trial 161 with value: 0.8928571428571429.
[32m[I 2023-04-25 23:40:03,483][39m Trial 200 finished with value: 0.875 and parameters: {'objective': 'Logloss', 'colsample_bylevel': 0.0683589784994571, 'depth': 8, 'boosting_type': 'Ordered', 'bootstrap_type': 'Bayesian', 'bagging_temperature': 3.1529195286860983}. Best is trial 161 with value: 0.8928571428571429.
[32m[I 2023-04-25 23:40:07,021][39m Trial 201 finished with value: 0.8828828828828829 and parameters: {'objective': 'CrossEntropy', 'colsample_bylevel': 0.09316341060518181, 'depth': 7, 'boosting_type': 'Plain', 'bootstrap_type': 'Bayesian', 'bagging_temperature': 3.7057821104654955}. Best is trial 161 with value: 0.8928571428571429.
[32m[I 2023-04-25 23:40:09,435][39m Trial 202 finished with value: 0.8828828828828829 and parameters: {'objective': 'CrossEntropy', 'colsample_bylevel': 0.07173882456651769, 'depth': 7, 'boosting_type': 'Plain', 'bootstrap_type': 'Bayesian', 'bagging_temperature': 3.698304867954663}. Best is trial 161 with value: 0.8928571428571429.
[32m[I 2023-04-25 23:40:11,937][39m Trial 203 finished with value: 0.890909090909091 and parameters: {'objective': 'CrossEntropy', 'colsample_bylevel': 0.07289305811171608, 'depth': 10, 'boosting_type': 'Plain', 'bootstrap_type': 'Bayesian', 'bagging_temperature': 2.98497498578664}. Best is trial 161 with value: 0.8928571428571429.
[32m[I 2023-04-25 23:40:14,388][39m Trial 204 finished with value: 0.8672566371681416 and parameters: {'objective': 'CrossEntropy', 'colsample_bylevel': 0.07580197930379326, 'depth': 10, 'boosting_type': 'Plain', 'bootstrap_type': 'Bayesian', 'bagging_temperature': 2.922229913471414}. Best is trial 161 with value: 0.8928571428571429.
[32m[I 2023-04-25 23:40:17,548][39m Trial 205 finished with value: 0.8596491228070176 and parameters: {'objective': 'CrossEntropy', 'colsample_bylevel': 0.08033945058125921, 'depth': 9, 'boosting_type': 'Plain', 'bootstrap_type': 'Bayesian', 'bagging_temperature': 3.1812406861872713}. Best is trial 161 with value: 0.8928571428571429.
[32m[I 2023-04-25 23:40:20,284][39m Trial 206 finished with value: 0.875 and parameters: {'objective': 'CrossEntropy', 'colsample_bylevel': 0.07258579679307176, 'depth': 7, 'boosting_type': 'Plain', 'bootstrap_type': 'Bayesian', 'bagging_temperature': 3.0501056724446776}. Best is trial 161 with value: 0.8928571428571429.
[32m[I 2023-04-25 23:40:23,117][39m Trial 207 finished with value: 0.8596491228070176 and parameters: {'objective': 'CrossEntropy', 'colsample_bylevel': 0.08620287499049845, 'depth': 7, 'boosting_type': 'Plain', 'bootstrap_type': 'Bayesian', 'bagging_temperature': 3.708668759375329}. Best is trial 161 with value: 0.8928571428571429.
[32m[I 2023-04-25 23:40:25,881][39m Trial 208 finished with value: 0.875 and parameters: {'objective': 'CrossEntropy', 'colsample_bylevel': 0.08499747423166387, 'depth': 6, 'boosting_type': 'Plain', 'bootstrap_type': 'Bayesian', 'bagging_temperature': 3.302247880987248}. Best is trial 161 with value: 0.8928571428571429.
[32m[I 2023-04-25 23:40:27,374][39m Trial 209 finished with value: 0.8648648648648648 and parameters: {'objective': 'CrossEntropy', 'colsample_bylevel': 0.038649715553267294, 'depth': 10, 'boosting_type': 'Plain', 'bootstrap_type': 'Bayesian', 'bagging_temperature': 2.882815940590978}. Best is trial 161 with value: 0.8928571428571429.
[32m[I 2023-04-25 23:40:30,018][39m Trial 210 finished with value: 0.875 and parameters: {'objective': 'CrossEntropy', 'colsample_bylevel': 0.08193832725559977, 'depth': 10, 'boosting_type': 'Plain', 'bootstrap_type': 'Bayesian', 'bagging_temperature': 3.898534026315282}. Best is trial 161 with value: 0.8928571428571429.
[32m[I 2023-04-25 23:40:32,015][39m Trial 211 finished with value: 0.8672566371681416 and parameters: {'objective': 'CrossEntropy', 'colsample_bylevel': 0.0569676455322535, 'depth': 7, 'boosting_type': 'Plain', 'bootstrap_type': 'Bayesian', 'bagging_temperature': 3.553469274055338}. Best is trial 161 with value: 0.8928571428571429.
[32m[I 2023-04-25 23:40:34,520][39m Trial 212 finished with value: 0.8672566371681416 and parameters: {'objective': 'CrossEntropy', 'colsample_bylevel': 0.09304034525455658, 'depth': 10, 'boosting_type': 'Plain', 'bootstrap_type': 'Bayesian', 'bagging_temperature': 2.302359367800271}. Best is trial 161 with value: 0.8928571428571429.
[32m[I 2023-04-25 23:40:36,943][39m Trial 213 finished with value: 0.8672566371681416 and parameters: {'objective': 'CrossEntropy', 'colsample_bylevel': 0.0907389262443037, 'depth': 10, 'boosting_type': 'Plain', 'bootstrap_type': 'Bayesian', 'bagging_temperature': 9.974923279671897}. Best is trial 161 with value: 0.8928571428571429.
[32m[I 2023-04-25 23:40:40,012][39m Trial 214 finished with value: 0.8828828828828829 and parameters: {'objective': 'CrossEntropy', 'colsample_bylevel': 0.0732336799665388, 'depth': 9, 'boosting_type': 'Plain', 'bootstrap_type': 'Bayesian', 'bagging_temperature': 4.060789538952517}. Best is trial 161 with value: 0.8928571428571429.
[32m[I 2023-04-25 23:40:42,410][39m Trial 215 finished with value: 0.8849557522123893 and parameters: {'objective': 'CrossEntropy', 'colsample_bylevel': 0.08827370611529843, 'depth': 6, 'boosting_type': 'Plain', 'bootstrap_type': 'Bayesian', 'bagging_temperature': 3.356999835830088}. Best is trial 161 with value: 0.8928571428571429.
[32m[I 2023-04-25 23:40:44,536][39m Trial 216 finished with value: 0.8672566371681416 and parameters: {'objective': 'CrossEntropy', 'colsample_bylevel': 0.08785979960220341, 'depth': 6, 'boosting_type': 'Plain', 'bootstrap_type': 'Bayesian', 'bagging_temperature': 4.082510646329269}. Best is trial 161 with value: 0.8928571428571429.
[32m[I 2023-04-25 23:40:47,719][39m Trial 217 finished with value: 0.875 and parameters: {'objective': 'CrossEntropy', 'colsample_bylevel': 0.09039087098487536, 'depth': 10, 'boosting_type': 'Plain', 'bootstrap_type': 'Bayesian', 'bagging_temperature': 3.265876559134086}. Best is trial 161 with value: 0.8928571428571429.
[32m[I 2023-04-25 23:40:49,865][39m Trial 218 finished with value: 0.875 and parameters: {'objective': 'CrossEntropy', 'colsample_bylevel': 0.08424102260386436, 'depth': 6, 'boosting_type': 'Plain', 'bootstrap_type': 'Bayesian', 'bagging_temperature': 2.7105006358064445}. Best is trial 161 with value: 0.8928571428571429.
[32m[I 2023-04-25 23:40:54,238][39m Trial 219 finished with value: 0.8596491228070176 and parameters: {'objective': 'Logloss', 'colsample_bylevel': 0.07786773882282778, 'depth': 9, 'boosting_type': 'Ordered', 'bootstrap_type': 'Bayesian', 'bagging_temperature': 3.005962018723455}. Best is trial 161 with value: 0.8928571428571429.
[32m[I 2023-04-25 23:40:58,065][39m Trial 220 finished with value: 0.8828828828828829 and parameters: {'objective': 'CrossEntropy', 'colsample_bylevel': 0.07468156802406009, 'depth': 10, 'boosting_type': 'Plain', 'bootstrap_type': 'Bayesian', 'bagging_temperature': 2.614591880038945}. Best is trial 161 with value: 0.8928571428571429.
[32m[I 2023-04-25 23:41:00,566][39m Trial 221 finished with value: 0.8771929824561403 and parameters: {'objective': 'CrossEntropy', 'colsample_bylevel': 0.07115772541861778, 'depth': 6, 'boosting_type': 'Plain', 'bootstrap_type': 'Bayesian', 'bagging_temperature': 3.888255073759532}. Best is trial 161 with value: 0.8928571428571429.
[32m[I 2023-04-25 23:41:02,956][39m Trial 222 finished with value: 0.8828828828828829 and parameters: {'objective': 'CrossEntropy', 'colsample_bylevel': 0.08846804496805057, 'depth': 7, 'boosting_type': 'Plain', 'bootstrap_type': 'Bayesian', 'bagging_temperature': 3.709716165741175}. Best is trial 161 with value: 0.8928571428571429.
[32m[I 2023-04-25 23:41:05,566][39m Trial 223 finished with value: 0.8828828828828829 and parameters: {'objective': 'CrossEntropy', 'colsample_bylevel': 0.092766490425031, 'depth': 6, 'boosting_type': 'Plain', 'bootstrap_type': 'Bayesian', 'bagging_temperature': 3.423920318821237}. Best is trial 161 with value: 0.8928571428571429.
[32m[I 2023-04-25 23:41:07,507][39m Trial 224 finished with value: 0.875 and parameters: {'objective': 'CrossEntropy', 'colsample_bylevel': 0.09543996102057899, 'depth': 11, 'boosting_type': 'Plain', 'bootstrap_type': 'Bayesian', 'bagging_temperature': 3.3619603001506886}. Best is trial 161 with value: 0.8928571428571429.
[32m[I 2023-04-25 23:41:09,988][39m Trial 225 finished with value: 0.875 and parameters: {'objective': 'CrossEntropy', 'colsample_bylevel': 0.08758357779627665, 'depth': 6, 'boosting_type': 'Plain', 'bootstrap_type': 'Bayesian', 'bagging_temperature': 2.616935193724409}. Best is trial 161 with value: 0.8928571428571429.
[32m[I 2023-04-25 23:41:13,106][39m Trial 226 finished with value: 0.8828828828828829 and parameters: {'objective': 'CrossEntropy', 'colsample_bylevel': 0.09283433497686448, 'depth': 7, 'boosting_type': 'Plain', 'bootstrap_type': 'Bayesian', 'bagging_temperature': 2.9678321744930547}. Best is trial 161 with value: 0.8928571428571429.
[32m[I 2023-04-25 23:41:15,518][39m Trial 227 finished with value: 0.8672566371681416 and parameters: {'objective': 'CrossEntropy', 'colsample_bylevel': 0.0860785676567854, 'depth': 6, 'boosting_type': 'Plain', 'bootstrap_type': 'Bayesian', 'bagging_temperature': 3.5082282734539767}. Best is trial 161 with value: 0.8928571428571429.
[32m[I 2023-04-25 23:41:18,367][39m Trial 228 finished with value: 0.8596491228070176 and parameters: {'objective': 'CrossEntropy', 'colsample_bylevel': 0.06767355854425199, 'depth': 9, 'boosting_type': 'Plain', 'bootstrap_type': 'Bernoulli', 'subsample': 0.5799664035483003}. Best is trial 161 with value: 0.8928571428571429.
[32m[I 2023-04-25 23:41:20,847][39m Trial 229 finished with value: 0.8672566371681416 and parameters: {'objective': 'CrossEntropy', 'colsample_bylevel': 0.07163022687848986, 'depth': 7, 'boosting_type': 'Plain', 'bootstrap_type': 'Bayesian', 'bagging_temperature': 3.720307288707996}. Best is trial 161 with value: 0.8928571428571429.
[32m[I 2023-04-25 23:41:24,069][39m Trial 230 finished with value: 0.8672566371681416 and parameters: {'objective': 'CrossEntropy', 'colsample_bylevel': 0.07601024578768582, 'depth': 8, 'boosting_type': 'Plain', 'bootstrap_type': 'Bayesian', 'bagging_temperature': 4.273121837033121}. Best is trial 161 with value: 0.8928571428571429.
[32m[I 2023-04-25 23:41:27,068][39m Trial 231 finished with value: 0.8648648648648648 and parameters: {'objective': 'CrossEntropy', 'colsample_bylevel': 0.08973445324545065, 'depth': 10, 'boosting_type': 'Plain', 'bootstrap_type': 'Bayesian', 'bagging_temperature': 3.192584186249021}. Best is trial 161 with value: 0.8928571428571429.
[32m[I 2023-04-25 23:41:29,881][39m Trial 232 finished with value: 0.875 and parameters: {'objective': 'CrossEntropy', 'colsample_bylevel': 0.08508945915066958, 'depth': 7, 'boosting_type': 'Plain', 'bootstrap_type': 'Bayesian', 'bagging_temperature': 3.481450549262534}. Best is trial 161 with value: 0.8928571428571429.
[32m[I 2023-04-25 23:41:32,338][39m Trial 233 finished with value: 0.8521739130434783 and parameters: {'objective': 'CrossEntropy', 'colsample_bylevel': 0.07352560456940897, 'depth': 7, 'boosting_type': 'Plain', 'bootstrap_type': 'Bayesian', 'bagging_temperature': 3.615084492753585}. Best is trial 161 with value: 0.8928571428571429.
[32m[I 2023-04-25 23:41:35,065][39m Trial 234 finished with value: 0.875 and parameters: {'objective': 'CrossEntropy', 'colsample_bylevel': 0.07531525868341434, 'depth': 10, 'boosting_type': 'Plain', 'bootstrap_type': 'Bayesian', 'bagging_temperature': 2.807190009847247}. Best is trial 161 with value: 0.8928571428571429.
[32m[I 2023-04-25 23:41:37,587][39m Trial 235 finished with value: 0.8596491228070176 and parameters: {'objective': 'CrossEntropy', 'colsample_bylevel': 0.09770256616616319, 'depth': 10, 'boosting_type': 'Plain', 'bootstrap_type': 'Bayesian', 'bagging_temperature': 3.0936516403545626}. Best is trial 161 with value: 0.8928571428571429.
[32m[I 2023-04-25 23:41:40,336][39m Trial 236 finished with value: 0.8828828828828829 and parameters: {'objective': 'CrossEntropy', 'colsample_bylevel': 0.09541518015402098, 'depth': 11, 'boosting_type': 'Plain', 'bootstrap_type': 'Bayesian', 'bagging_temperature': 3.83001908238044}. Best is trial 161 with value: 0.8928571428571429.
[32m[I 2023-04-25 23:41:42,417][39m Trial 237 finished with value: 0.8672566371681416 and parameters: {'objective': 'CrossEntropy', 'colsample_bylevel': 0.08742897883362591, 'depth': 10, 'boosting_type': 'Plain', 'bootstrap_type': 'MVS'}. Best is trial 161 with value: 0.8928571428571429.
[32m[I 2023-04-25 23:41:45,723][39m Trial 238 finished with value: 0.875 and parameters: {'objective': 'CrossEntropy', 'colsample_bylevel': 0.08875352110303111, 'depth': 9, 'boosting_type': 'Plain', 'bootstrap_type': 'Bayesian', 'bagging_temperature': 3.2376114153891122}. Best is trial 161 with value: 0.8928571428571429.
[32m[I 2023-04-25 23:41:48,758][39m Trial 239 finished with value: 0.8672566371681416 and parameters: {'objective': 'CrossEntropy', 'colsample_bylevel': 0.09410083637815608, 'depth': 11, 'boosting_type': 'Plain', 'bootstrap_type': 'Bayesian', 'bagging_temperature': 4.0446560443051744}. Best is trial 161 with value: 0.8928571428571429.
[32m[I 2023-04-25 23:41:51,585][39m Trial 240 finished with value: 0.875 and parameters: {'objective': 'CrossEntropy', 'colsample_bylevel': 0.07338820702056661, 'depth': 10, 'boosting_type': 'Plain', 'bootstrap_type': 'Bayesian', 'bagging_temperature': 2.3529051559751686}. Best is trial 161 with value: 0.8928571428571429.
[32m[I 2023-04-25 23:41:54,020][39m Trial 241 finished with value: 0.8596491228070176 and parameters: {'objective': 'CrossEntropy', 'colsample_bylevel': 0.09061515151035365, 'depth': 10, 'boosting_type': 'Plain', 'bootstrap_type': 'Bayesian', 'bagging_temperature': 2.9149518887055437}. Best is trial 161 with value: 0.8928571428571429.
[32m[I 2023-04-25 23:41:56,750][39m Trial 242 finished with value: 0.875 and parameters: {'objective': 'CrossEntropy', 'colsample_bylevel': 0.07739008985713752, 'depth': 6, 'boosting_type': 'Plain', 'bootstrap_type': 'Bayesian', 'bagging_temperature': 3.4018567339549968}. Best is trial 161 with value: 0.8928571428571429.
[32m[I 2023-04-25 23:41:59,155][39m Trial 243 finished with value: 0.8828828828828829 and parameters: {'objective': 'CrossEntropy', 'colsample_bylevel': 0.09620533549519539, 'depth': 11, 'boosting_type': 'Plain', 'bootstrap_type': 'Bayesian', 'bagging_temperature': 3.745275698087888}. Best is trial 161 with value: 0.8928571428571429.
[32m[I 2023-04-25 23:42:02,273][39m Trial 244 finished with value: 0.875 and parameters: {'objective': 'CrossEntropy', 'colsample_bylevel': 0.09192173329473069, 'depth': 10, 'boosting_type': 'Plain', 'bootstrap_type': 'Bayesian', 'bagging_temperature': 3.551306993598588}. Best is trial 161 with value: 0.8928571428571429.
[32m[I 2023-04-25 23:42:04,360][39m Trial 245 finished with value: 0.8672566371681416 and parameters: {'objective': 'CrossEntropy', 'colsample_bylevel': 0.09635496085157204, 'depth': 11, 'boosting_type': 'Plain', 'bootstrap_type': 'Bayesian', 'bagging_temperature': 2.5184664488953925}. Best is trial 161 with value: 0.8928571428571429.
[32m[I 2023-04-25 23:42:07,370][39m Trial 246 finished with value: 0.8828828828828829 and parameters: {'objective': 'CrossEntropy', 'colsample_bylevel': 0.0939186675338324, 'depth': 9, 'boosting_type': 'Plain', 'bootstrap_type': 'Bayesian', 'bagging_temperature': 3.1770186891772987}. Best is trial 161 with value: 0.8928571428571429.
[32m[I 2023-04-25 23:42:09,804][39m Trial 247 finished with value: 0.875 and parameters: {'objective': 'CrossEntropy', 'colsample_bylevel': 0.07172762089387164, 'depth': 10, 'boosting_type': 'Plain', 'bootstrap_type': 'Bayesian', 'bagging_temperature': 2.8304465016081997}. Best is trial 161 with value: 0.8928571428571429.
[32m[I 2023-04-25 23:42:12,950][39m Trial 248 finished with value: 0.8771929824561403 and parameters: {'objective': 'CrossEntropy', 'colsample_bylevel': 0.06993552140251978, 'depth': 9, 'boosting_type': 'Plain', 'bootstrap_type': 'Bayesian', 'bagging_temperature': 6.907483399486132}. Best is trial 161 with value: 0.8928571428571429.
[32m[I 2023-04-25 23:42:15,828][39m Trial 249 finished with value: 0.8672566371681416 and parameters: {'objective': 'CrossEntropy', 'colsample_bylevel': 0.08339755340419722, 'depth': 10, 'boosting_type': 'Plain', 'bootstrap_type': 'Bayesian', 'bagging_temperature': 3.2506267089090044}. Best is trial 161 with value: 0.8928571428571429.
[32m[I 2023-04-25 23:42:18,553][39m Trial 250 finished with value: 0.8596491228070176 and parameters: {'objective': 'CrossEntropy', 'colsample_bylevel': 0.07434433346316711, 'depth': 7, 'boosting_type': 'Plain', 'bootstrap_type': 'Bayesian', 'bagging_temperature': 2.976580880639592}. Best is trial 161 with value: 0.8928571428571429.
[32m[I 2023-04-25 23:42:21,342][39m Trial 251 finished with value: 0.8596491228070176 and parameters: {'objective': 'CrossEntropy', 'colsample_bylevel': 0.09217816242739481, 'depth': 7, 'boosting_type': 'Plain', 'bootstrap_type': 'Bayesian', 'bagging_temperature': 3.915177390987049}. Best is trial 161 with value: 0.8928571428571429.
[32m[I 2023-04-25 23:42:23,887][39m Trial 252 finished with value: 0.8495575221238938 and parameters: {'objective': 'CrossEntropy', 'colsample_bylevel': 0.07308286258135337, 'depth': 7, 'boosting_type': 'Plain', 'bootstrap_type': 'Bayesian', 'bagging_temperature': 3.3823980390715107}. Best is trial 161 with value: 0.8928571428571429.
[32m[I 2023-04-25 23:42:26,522][39m Trial 253 finished with value: 0.8596491228070176 and parameters: {'objective': 'CrossEntropy', 'colsample_bylevel': 0.08584422114606254, 'depth': 10, 'boosting_type': 'Plain', 'bootstrap_type': 'Bayesian', 'bagging_temperature': 7.664283728893667}. Best is trial 161 with value: 0.8928571428571429.
[32m[I 2023-04-25 23:42:28,875][39m Trial 254 finished with value: 0.8672566371681416 and parameters: {'objective': 'CrossEntropy', 'colsample_bylevel': 0.08916821462077726, 'depth': 6, 'boosting_type': 'Plain', 'bootstrap_type': 'Bayesian', 'bagging_temperature': 4.154867397625441}. Best is trial 161 with value: 0.8928571428571429.
[32m[I 2023-04-25 23:42:31,553][39m Trial 255 finished with value: 0.875 and parameters: {'objective': 'CrossEntropy', 'colsample_bylevel': 0.07496078200988683, 'depth': 6, 'boosting_type': 'Plain', 'bootstrap_type': 'Bayesian', 'bagging_temperature': 2.686644260342488}. Best is trial 161 with value: 0.8928571428571429.
[32m[I 2023-04-25 23:42:34,202][39m Trial 256 finished with value: 0.8828828828828829 and parameters: {'objective': 'CrossEntropy', 'colsample_bylevel': 0.09426721834318892, 'depth': 10, 'boosting_type': 'Plain', 'bootstrap_type': 'Bayesian', 'bagging_temperature': 3.6501169605869888}. Best is trial 161 with value: 0.8928571428571429.
[32m[I 2023-04-25 23:42:36,604][39m Trial 257 finished with value: 0.875 and parameters: {'objective': 'CrossEntropy', 'colsample_bylevel': 0.05258421768415125, 'depth': 9, 'boosting_type': 'Plain', 'bootstrap_type': 'Bayesian', 'bagging_temperature': 4.864933719909681}. Best is trial 161 with value: 0.8928571428571429.
[32m[I 2023-04-25 23:42:40,280][39m Trial 258 finished with value: 0.8771929824561403 and parameters: {'objective': 'CrossEntropy', 'colsample_bylevel': 0.09111101608944752, 'depth': 8, 'boosting_type': 'Plain', 'bootstrap_type': 'Bayesian', 'bagging_temperature': 5.525627069932167}. Best is trial 161 with value: 0.8928571428571429.
[32m[I 2023-04-25 23:42:43,044][39m Trial 259 finished with value: 0.8828828828828829 and parameters: {'objective': 'CrossEntropy', 'colsample_bylevel': 0.09294452974104438, 'depth': 7, 'boosting_type': 'Plain', 'bootstrap_type': 'Bayesian', 'bagging_temperature': 3.877617380477871}. Best is trial 161 with value: 0.8928571428571429.
[32m[I 2023-04-25 23:42:45,525][39m Trial 260 finished with value: 0.8596491228070176 and parameters: {'objective': 'CrossEntropy', 'colsample_bylevel': 0.08825911290365224, 'depth': 6, 'boosting_type': 'Plain', 'bootstrap_type': 'Bernoulli', 'subsample': 0.26420877473823917}. Best is trial 161 with value: 0.8928571428571429.
[32m[I 2023-04-25 23:42:47,552][39m Trial 261 finished with value: 0.8727272727272727 and parameters: {'objective': 'CrossEntropy', 'colsample_bylevel': 0.092802471176801, 'depth': 7, 'boosting_type': 'Plain', 'bootstrap_type': 'Bayesian', 'bagging_temperature': 3.814180034474974}. Best is trial 161 with value: 0.8928571428571429.
[32m[I 2023-04-25 23:42:49,843][39m Trial 262 finished with value: 0.8672566371681416 and parameters: {'objective': 'CrossEntropy', 'colsample_bylevel': 0.06531300981584058, 'depth': 7, 'boosting_type': 'Plain', 'bootstrap_type': 'Bayesian', 'bagging_temperature': 3.069724124141683}. Best is trial 161 with value: 0.8928571428571429.
[32m[I 2023-04-25 23:42:52,485][39m Trial 263 finished with value: 0.875 and parameters: {'objective': 'CrossEntropy', 'colsample_bylevel': 0.07906319079228198, 'depth': 7, 'boosting_type': 'Plain', 'bootstrap_type': 'Bayesian', 'bagging_temperature': 2.879542595112414}. Best is trial 161 with value: 0.8928571428571429.
[32m[I 2023-04-25 23:42:55,087][39m Trial 264 finished with value: 0.875 and parameters: {'objective': 'CrossEntropy', 'colsample_bylevel': 0.08115054080718709, 'depth': 5, 'boosting_type': 'Plain', 'bootstrap_type': 'Bayesian', 'bagging_temperature': 3.3809725891886564}. Best is trial 161 with value: 0.8928571428571429.
