[32m[I 2023-04-25 23:36:43,864][39m Trial 133 finished with value: 0.8828828828828829 and parameters: {'objective': 'CrossEntropy', 'colsample_bylevel': 0.09407208229813444, 'depth': 10, 'boosting_type': 'Plain', 'bootstrap_type': 'Bayesian', 'bagging_temperature': 3.5563604948606065}. Best is trial 91 with value: 0.890909090909091.
[32m[I 2023-04-25 23:36:47,144][39m Trial 134 finished with value: 0.8828828828828829 and parameters: {'objective': 'CrossEntropy', 'colsample_bylevel': 0.09296274648241186, 'depth': 11, 'boosting_type': 'Plain', 'bootstrap_type': 'Bayesian', 'bagging_temperature': 3.7976003822923428}. Best is trial 91 with value: 0.890909090909091.
[32m[I 2023-04-25 23:36:49,707][39m Trial 135 finished with value: 0.8392857142857144 and parameters: {'objective': 'CrossEntropy', 'colsample_bylevel': 0.09501484160789067, 'depth': 10, 'boosting_type': 'Plain', 'bootstrap_type': 'Bayesian', 'bagging_temperature': 3.564063265457378}. Best is trial 91 with value: 0.890909090909091.
[32m[I 2023-04-25 23:36:52,398][39m Trial 136 finished with value: 0.875 and parameters: {'objective': 'CrossEntropy', 'colsample_bylevel': 0.09338953201657246, 'depth': 12, 'boosting_type': 'Plain', 'bootstrap_type': 'Bayesian', 'bagging_temperature': 3.1498538640919502}. Best is trial 91 with value: 0.890909090909091.
[32m[I 2023-04-25 23:36:54,850][39m Trial 137 finished with value: 0.8672566371681416 and parameters: {'objective': 'CrossEntropy', 'colsample_bylevel': 0.08702539872050463, 'depth': 5, 'boosting_type': 'Plain', 'bootstrap_type': 'MVS'}. Best is trial 91 with value: 0.890909090909091.
[32m[I 2023-04-25 23:36:57,420][39m Trial 138 finished with value: 0.8596491228070176 and parameters: {'objective': 'CrossEntropy', 'colsample_bylevel': 0.07798710850395664, 'depth': 6, 'boosting_type': 'Plain', 'bootstrap_type': 'Bayesian', 'bagging_temperature': 9.165860417232786}. Best is trial 91 with value: 0.890909090909091.
[32m[I 2023-04-25 23:37:01,300][39m Trial 139 finished with value: 0.8672566371681416 and parameters: {'objective': 'CrossEntropy', 'colsample_bylevel': 0.08879734821081267, 'depth': 8, 'boosting_type': 'Plain', 'bootstrap_type': 'Bayesian', 'bagging_temperature': 2.789311580017314}. Best is trial 91 with value: 0.890909090909091.
[32m[I 2023-04-25 23:37:06,300][39m Trial 140 finished with value: 0.8672566371681416 and parameters: {'objective': 'Logloss', 'colsample_bylevel': 0.08408554827088581, 'depth': 9, 'boosting_type': 'Ordered', 'bootstrap_type': 'Bayesian', 'bagging_temperature': 4.305757062899409}. Best is trial 91 with value: 0.890909090909091.
[32m[I 2023-04-25 23:37:09,203][39m Trial 141 finished with value: 0.875 and parameters: {'objective': 'CrossEntropy', 'colsample_bylevel': 0.09106012798989223, 'depth': 10, 'boosting_type': 'Plain', 'bootstrap_type': 'Bayesian', 'bagging_temperature': 3.905641495882673}. Best is trial 91 with value: 0.890909090909091.
[32m[I 2023-04-25 23:37:11,796][39m Trial 142 finished with value: 0.8849557522123893 and parameters: {'objective': 'CrossEntropy', 'colsample_bylevel': 0.09682983221203269, 'depth': 10, 'boosting_type': 'Plain', 'bootstrap_type': 'Bayesian', 'bagging_temperature': 3.370021163061068}. Best is trial 91 with value: 0.890909090909091.
[32m[I 2023-04-25 23:37:14,550][39m Trial 143 finished with value: 0.875 and parameters: {'objective': 'CrossEntropy', 'colsample_bylevel': 0.09684280990389817, 'depth': 11, 'boosting_type': 'Plain', 'bootstrap_type': 'Bayesian', 'bagging_temperature': 3.673359053000663}. Best is trial 91 with value: 0.890909090909091.
[32m[I 2023-04-25 23:37:16,996][39m Trial 144 finished with value: 0.875 and parameters: {'objective': 'CrossEntropy', 'colsample_bylevel': 0.0983762478365008, 'depth': 10, 'boosting_type': 'Plain', 'bootstrap_type': 'Bayesian', 'bagging_temperature': 3.3441603352719387}. Best is trial 91 with value: 0.890909090909091.
[32m[I 2023-04-25 23:37:20,398][39m Trial 145 finished with value: 0.8468468468468469 and parameters: {'objective': 'CrossEntropy', 'colsample_bylevel': 0.09276676424912322, 'depth': 11, 'boosting_type': 'Plain', 'bootstrap_type': 'Bayesian', 'bagging_temperature': 3.7529569579681636}. Best is trial 91 with value: 0.890909090909091.
[32m[I 2023-04-25 23:37:23,640][39m Trial 146 finished with value: 0.8828828828828829 and parameters: {'objective': 'CrossEntropy', 'colsample_bylevel': 0.09503639438468214, 'depth': 11, 'boosting_type': 'Plain', 'bootstrap_type': 'Bayesian', 'bagging_temperature': 4.060916132456149}. Best is trial 91 with value: 0.890909090909091.
[32m[I 2023-04-25 23:37:26,759][39m Trial 147 finished with value: 0.8672566371681416 and parameters: {'objective': 'CrossEntropy', 'colsample_bylevel': 0.09550031635724959, 'depth': 12, 'boosting_type': 'Plain', 'bootstrap_type': 'Bayesian', 'bagging_temperature': 4.081125276130961}. Best is trial 91 with value: 0.890909090909091.
[32m[I 2023-04-25 23:37:29,154][39m Trial 148 finished with value: 0.875 and parameters: {'objective': 'CrossEntropy', 'colsample_bylevel': 0.0946271558963056, 'depth': 11, 'boosting_type': 'Plain', 'bootstrap_type': 'Bayesian', 'bagging_temperature': 3.056798594182394}. Best is trial 91 with value: 0.890909090909091.
[32m[I 2023-04-25 23:37:31,686][39m Trial 149 finished with value: 0.875 and parameters: {'objective': 'CrossEntropy', 'colsample_bylevel': 0.0856419701157912, 'depth': 9, 'boosting_type': 'Plain', 'bootstrap_type': 'Bayesian', 'bagging_temperature': 2.4166643632125377}. Best is trial 91 with value: 0.890909090909091.
[32m[I 2023-04-25 23:37:34,450][39m Trial 150 finished with value: 0.875 and parameters: {'objective': 'CrossEntropy', 'colsample_bylevel': 0.08827864844292888, 'depth': 10, 'boosting_type': 'Plain', 'bootstrap_type': 'Bayesian', 'bagging_temperature': 3.352904844121724}. Best is trial 91 with value: 0.890909090909091.
[32m[I 2023-04-25 23:37:37,430][39m Trial 151 finished with value: 0.875 and parameters: {'objective': 'CrossEntropy', 'colsample_bylevel': 0.09917974609747518, 'depth': 11, 'boosting_type': 'Plain', 'bootstrap_type': 'Bayesian', 'bagging_temperature': 3.931674102318584}. Best is trial 91 with value: 0.890909090909091.
[32m[I 2023-04-25 23:37:40,592][39m Trial 152 finished with value: 0.8828828828828829 and parameters: {'objective': 'CrossEntropy', 'colsample_bylevel': 0.09072076275265577, 'depth': 9, 'boosting_type': 'Plain', 'bootstrap_type': 'Bayesian', 'bagging_temperature': 4.478609066654271}. Best is trial 91 with value: 0.890909090909091.
[32m[I 2023-04-25 23:37:42,439][39m Trial 153 finished with value: 0.8596491228070176 and parameters: {'objective': 'CrossEntropy', 'colsample_bylevel': 0.0916318362410484, 'depth': 10, 'boosting_type': 'Plain', 'bootstrap_type': 'Bayesian', 'bagging_temperature': 4.609444091173972}. Best is trial 91 with value: 0.890909090909091.
[32m[I 2023-04-25 23:37:46,421][39m Trial 154 finished with value: 0.8596491228070176 and parameters: {'objective': 'CrossEntropy', 'colsample_bylevel': 0.09717781745516764, 'depth': 9, 'boosting_type': 'Plain', 'bootstrap_type': 'Bayesian', 'bagging_temperature': 4.481509846756532}. Best is trial 91 with value: 0.890909090909091.
[32m[I 2023-04-25 23:37:51,721][39m Trial 155 finished with value: 0.8672566371681416 and parameters: {'objective': 'Logloss', 'colsample_bylevel': 0.09007366214545727, 'depth': 9, 'boosting_type': 'Ordered', 'bootstrap_type': 'Bayesian', 'bagging_temperature': 4.367684270120236}. Best is trial 91 with value: 0.890909090909091.
[32m[I 2023-04-25 23:37:54,870][39m Trial 156 finished with value: 0.8771929824561403 and parameters: {'objective': 'CrossEntropy', 'colsample_bylevel': 0.09369109191165206, 'depth': 10, 'boosting_type': 'Plain', 'bootstrap_type': 'Bayesian', 'bagging_temperature': 9.696634265850964}. Best is trial 91 with value: 0.890909090909091.
[32m[I 2023-04-25 23:37:57,199][39m Trial 157 finished with value: 0.8828828828828829 and parameters: {'objective': 'CrossEntropy', 'colsample_bylevel': 0.09613204701141946, 'depth': 11, 'boosting_type': 'Plain', 'bootstrap_type': 'Bayesian', 'bagging_temperature': 3.5528254137504462}. Best is trial 91 with value: 0.890909090909091.
[32m[I 2023-04-25 23:37:59,999][39m Trial 158 finished with value: 0.8672566371681416 and parameters: {'objective': 'CrossEntropy', 'colsample_bylevel': 0.08151565929431352, 'depth': 6, 'boosting_type': 'Plain', 'bootstrap_type': 'Bernoulli', 'subsample': 0.4784137943774679}. Best is trial 91 with value: 0.890909090909091.
[32m[I 2023-04-25 23:38:01,256][39m Trial 159 finished with value: 0.8135593220338982 and parameters: {'objective': 'CrossEntropy', 'colsample_bylevel': 0.023133694616948225, 'depth': 11, 'boosting_type': 'Plain', 'bootstrap_type': 'Bayesian', 'bagging_temperature': 3.0488204386980198}. Best is trial 91 with value: 0.890909090909091.
[32m[I 2023-04-25 23:38:04,206][39m Trial 160 finished with value: 0.875 and parameters: {'objective': 'CrossEntropy', 'colsample_bylevel': 0.09482967613245416, 'depth': 12, 'boosting_type': 'Plain', 'bootstrap_type': 'Bayesian', 'bagging_temperature': 3.5709895167632237}. Best is trial 91 with value: 0.890909090909091.
[32m[I 2023-04-25 23:38:06,411][39m Trial 161 finished with value: 0.8928571428571429 and parameters: {'objective': 'CrossEntropy', 'colsample_bylevel': 0.08779270856595417, 'depth': 10, 'boosting_type': 'Plain', 'bootstrap_type': 'Bayesian', 'bagging_temperature': 3.257810169459207}. Best is trial 161 with value: 0.8928571428571429.
[32m[I 2023-04-25 23:38:08,887][39m Trial 162 finished with value: 0.8828828828828829 and parameters: {'objective': 'CrossEntropy', 'colsample_bylevel': 0.08698472261471395, 'depth': 10, 'boosting_type': 'Plain', 'bootstrap_type': 'Bayesian', 'bagging_temperature': 2.8101479398293647}. Best is trial 161 with value: 0.8928571428571429.
[32m[I 2023-04-25 23:38:11,303][39m Trial 163 finished with value: 0.875 and parameters: {'objective': 'CrossEntropy', 'colsample_bylevel': 0.08668326672716511, 'depth': 10, 'boosting_type': 'Plain', 'bootstrap_type': 'Bayesian', 'bagging_temperature': 2.689182727164368}. Best is trial 161 with value: 0.8928571428571429.
[32m[I 2023-04-25 23:38:13,494][39m Trial 164 finished with value: 0.8727272727272727 and parameters: {'objective': 'CrossEntropy', 'colsample_bylevel': 0.08313552999541912, 'depth': 10, 'boosting_type': 'Plain', 'bootstrap_type': 'Bayesian', 'bagging_temperature': 3.7184638696018193}. Best is trial 161 with value: 0.8928571428571429.
[32m[I 2023-04-25 23:38:16,143][39m Trial 165 finished with value: 0.8672566371681416 and parameters: {'objective': 'CrossEntropy', 'colsample_bylevel': 0.09382395916828369, 'depth': 11, 'boosting_type': 'Plain', 'bootstrap_type': 'MVS'}. Best is trial 161 with value: 0.8928571428571429.
[32m[I 2023-04-25 23:38:21,379][39m Trial 166 finished with value: 0.8596491228070176 and parameters: {'objective': 'Logloss', 'colsample_bylevel': 0.09074251611893824, 'depth': 9, 'boosting_type': 'Ordered', 'bootstrap_type': 'Bayesian', 'bagging_temperature': 4.153453820888974}. Best is trial 161 with value: 0.8928571428571429.
[32m[I 2023-04-25 23:38:24,252][39m Trial 167 finished with value: 0.8672566371681416 and parameters: {'objective': 'CrossEntropy', 'colsample_bylevel': 0.08918244168101393, 'depth': 11, 'boosting_type': 'Plain', 'bootstrap_type': 'Bayesian', 'bagging_temperature': 4.944350241708903}. Best is trial 161 with value: 0.8928571428571429.
[32m[I 2023-04-25 23:38:26,695][39m Trial 168 finished with value: 0.875 and parameters: {'objective': 'CrossEntropy', 'colsample_bylevel': 0.09647764905353394, 'depth': 11, 'boosting_type': 'Plain', 'bootstrap_type': 'Bayesian', 'bagging_temperature': 4.2137419643952505}. Best is trial 161 with value: 0.8928571428571429.
[32m[I 2023-04-25 23:38:29,396][39m Trial 169 finished with value: 0.8672566371681416 and parameters: {'objective': 'CrossEntropy', 'colsample_bylevel': 0.08787099361684104, 'depth': 7, 'boosting_type': 'Plain', 'bootstrap_type': 'Bayesian', 'bagging_temperature': 3.158956654243283}. Best is trial 161 with value: 0.8928571428571429.
[32m[I 2023-04-25 23:38:31,820][39m Trial 170 finished with value: 0.8672566371681416 and parameters: {'objective': 'CrossEntropy', 'colsample_bylevel': 0.09160113556887896, 'depth': 10, 'boosting_type': 'Plain', 'bootstrap_type': 'Bayesian', 'bagging_temperature': 1.8542554780059368}. Best is trial 161 with value: 0.8928571428571429.
[32m[I 2023-04-25 23:38:34,683][39m Trial 171 finished with value: 0.8828828828828829 and parameters: {'objective': 'CrossEntropy', 'colsample_bylevel': 0.0920946621581118, 'depth': 10, 'boosting_type': 'Plain', 'bootstrap_type': 'Bayesian', 'bagging_temperature': 2.9105468413827236}. Best is trial 161 with value: 0.8928571428571429.
[32m[I 2023-04-25 23:38:37,483][39m Trial 172 finished with value: 0.875 and parameters: {'objective': 'CrossEntropy', 'colsample_bylevel': 0.09948124158264002, 'depth': 11, 'boosting_type': 'Plain', 'bootstrap_type': 'Bayesian', 'bagging_temperature': 3.300163664192571}. Best is trial 161 with value: 0.8928571428571429.
[32m[I 2023-04-25 23:38:39,870][39m Trial 173 finished with value: 0.875 and parameters: {'objective': 'CrossEntropy', 'colsample_bylevel': 0.08992875830013076, 'depth': 6, 'boosting_type': 'Plain', 'bootstrap_type': 'Bayesian', 'bagging_temperature': 5.190438132010092}. Best is trial 161 with value: 0.8928571428571429.
[32m[I 2023-04-25 23:38:42,196][39m Trial 174 finished with value: 0.8648648648648648 and parameters: {'objective': 'CrossEntropy', 'colsample_bylevel': 0.086380816089372, 'depth': 10, 'boosting_type': 'Plain', 'bootstrap_type': 'Bayesian', 'bagging_temperature': 2.8885757186858054}. Best is trial 161 with value: 0.8928571428571429.
[32m[I 2023-04-25 23:38:46,518][39m Trial 175 finished with value: 0.875 and parameters: {'objective': 'CrossEntropy', 'colsample_bylevel': 0.09608328676548919, 'depth': 9, 'boosting_type': 'Plain', 'bootstrap_type': 'Bayesian', 'bagging_temperature': 3.4725779724524792}. Best is trial 161 with value: 0.8928571428571429.
[32m[I 2023-04-25 23:38:50,623][39m Trial 176 finished with value: 0.8672566371681416 and parameters: {'objective': 'Logloss', 'colsample_bylevel': 0.0895351380198329, 'depth': 3, 'boosting_type': 'Ordered', 'bootstrap_type': 'Bayesian', 'bagging_temperature': 4.057525784431128}. Best is trial 161 with value: 0.8928571428571429.
[32m[I 2023-04-25 23:38:53,746][39m Trial 177 finished with value: 0.8571428571428572 and parameters: {'objective': 'CrossEntropy', 'colsample_bylevel': 0.09394963816799064, 'depth': 2, 'boosting_type': 'Plain', 'bootstrap_type': 'Bayesian', 'bagging_temperature': 3.8586228565701766}. Best is trial 161 with value: 0.8928571428571429.
[32m[I 2023-04-25 23:38:56,709][39m Trial 178 finished with value: 0.875 and parameters: {'objective': 'CrossEntropy', 'colsample_bylevel': 0.09800767626291067, 'depth': 9, 'boosting_type': 'Plain', 'bootstrap_type': 'Bayesian', 'bagging_temperature': 2.5505623598091884}. Best is trial 161 with value: 0.8928571428571429.
[32m[I 2023-04-25 23:38:59,847][39m Trial 179 finished with value: 0.8672566371681416 and parameters: {'objective': 'CrossEntropy', 'colsample_bylevel': 0.08683956885569388, 'depth': 9, 'boosting_type': 'Plain', 'bootstrap_type': 'Bayesian', 'bagging_temperature': 0.592769041127573}. Best is trial 161 with value: 0.8928571428571429.
[32m[I 2023-04-25 23:39:02,627][39m Trial 180 finished with value: 0.8771929824561403 and parameters: {'objective': 'CrossEntropy', 'colsample_bylevel': 0.09298039897941145, 'depth': 10, 'boosting_type': 'Plain', 'bootstrap_type': 'Bayesian', 'bagging_temperature': 8.14227227821467}. Best is trial 161 with value: 0.8928571428571429.
[32m[I 2023-04-25 23:39:05,086][39m Trial 181 finished with value: 0.8828828828828829 and parameters: {'objective': 'CrossEntropy', 'colsample_bylevel': 0.08437860113696034, 'depth': 10, 'boosting_type': 'Plain', 'bootstrap_type': 'Bayesian', 'bagging_temperature': 3.210730827308691}. Best is trial 161 with value: 0.8928571428571429.
[32m[I 2023-04-25 23:39:07,541][39m Trial 182 finished with value: 0.8596491228070176 and parameters: {'objective': 'CrossEntropy', 'colsample_bylevel': 0.09671582236045023, 'depth': 10, 'boosting_type': 'Plain', 'bootstrap_type': 'Bayesian', 'bagging_temperature': 3.289656026619123}. Best is trial 161 with value: 0.8928571428571429.
[32m[I 2023-04-25 23:39:10,218][39m Trial 183 finished with value: 0.8727272727272727 and parameters: {'objective': 'CrossEntropy', 'colsample_bylevel': 0.08484319897188462, 'depth': 10, 'boosting_type': 'Plain', 'bootstrap_type': 'Bayesian', 'bagging_temperature': 2.185386641447095}. Best is trial 161 with value: 0.8928571428571429.
[32m[I 2023-04-25 23:39:12,942][39m Trial 184 finished with value: 0.875 and parameters: {'objective': 'CrossEntropy', 'colsample_bylevel': 0.09180274564402907, 'depth': 6, 'boosting_type': 'Plain', 'bootstrap_type': 'Bayesian', 'bagging_temperature': 3.6883199330393337}. Best is trial 161 with value: 0.8928571428571429.
[32m[I 2023-04-25 23:39:16,133][39m Trial 185 finished with value: 0.8849557522123893 and parameters: {'objective': 'CrossEntropy', 'colsample_bylevel': 0.07289768625234067, 'depth': 8, 'boosting_type': 'Plain', 'bootstrap_type': 'Bayesian', 'bagging_temperature': 2.9852295723412214}. Best is trial 161 with value: 0.8928571428571429.
[32m[I 2023-04-25 23:39:19,556][39m Trial 186 finished with value: 0.8672566371681416 and parameters: {'objective': 'CrossEntropy', 'colsample_bylevel': 0.074168587666969, 'depth': 8, 'boosting_type': 'Plain', 'bootstrap_type': 'Bayesian', 'bagging_temperature': 3.0590411340317076}. Best is trial 161 with value: 0.8928571428571429.
[32m[I 2023-04-25 23:39:22,207][39m Trial 187 finished with value: 0.8672566371681416 and parameters: {'objective': 'CrossEntropy', 'colsample_bylevel': 0.07638401738575147, 'depth': 7, 'boosting_type': 'Plain', 'bootstrap_type': 'Bayesian', 'bagging_temperature': 3.5721830471359306}. Best is trial 161 with value: 0.8928571428571429.
[32m[I 2023-04-25 23:39:26,943][39m Trial 188 finished with value: 0.8672566371681416 and parameters: {'objective': 'Logloss', 'colsample_bylevel': 0.07903665736603425, 'depth': 8, 'boosting_type': 'Ordered', 'bootstrap_type': 'Bayesian', 'bagging_temperature': 4.687190352774773}. Best is trial 161 with value: 0.8928571428571429.
[32m[I 2023-04-25 23:39:30,205][39m Trial 189 finished with value: 0.8672566371681416 and parameters: {'objective': 'CrossEntropy', 'colsample_bylevel': 0.09220206268291062, 'depth': 10, 'boosting_type': 'Plain', 'bootstrap_type': 'Bayesian', 'bagging_temperature': 3.445958429560404}. Best is trial 161 with value: 0.8928571428571429.
[32m[I 2023-04-25 23:39:33,230][39m Trial 190 finished with value: 0.8571428571428572 and parameters: {'objective': 'CrossEntropy', 'colsample_bylevel': 0.0951951187333395, 'depth': 11, 'boosting_type': 'Plain', 'bootstrap_type': 'Bernoulli', 'subsample': 0.8213833332464303}. Best is trial 161 with value: 0.8928571428571429.
[32m[I 2023-04-25 23:39:35,568][39m Trial 191 finished with value: 0.890909090909091 and parameters: {'objective': 'CrossEntropy', 'colsample_bylevel': 0.08831878329136571, 'depth': 10, 'boosting_type': 'Plain', 'bootstrap_type': 'Bayesian', 'bagging_temperature': 2.938941716901481}. Best is trial 161 with value: 0.8928571428571429.
[32m[I 2023-04-25 23:39:38,836][39m Trial 192 finished with value: 0.875 and parameters: {'objective': 'CrossEntropy', 'colsample_bylevel': 0.08814359539797047, 'depth': 10, 'boosting_type': 'Plain', 'bootstrap_type': 'Bayesian', 'bagging_temperature': 2.8263239384522025}. Best is trial 161 with value: 0.8928571428571429.
[32m[I 2023-04-25 23:39:41,263][39m Trial 193 finished with value: 0.875 and parameters: {'objective': 'CrossEntropy', 'colsample_bylevel': 0.08981521265084988, 'depth': 11, 'boosting_type': 'Plain', 'bootstrap_type': 'Bayesian', 'bagging_temperature': 2.467100358264147}. Best is trial 161 with value: 0.8928571428571429.
[32m[I 2023-04-25 23:39:43,451][39m Trial 194 finished with value: 0.8672566371681416 and parameters: {'objective': 'CrossEntropy', 'colsample_bylevel': 0.06980104790629321, 'depth': 10, 'boosting_type': 'Plain', 'bootstrap_type': 'Bayesian', 'bagging_temperature': 2.5749946218984254}. Best is trial 161 with value: 0.8928571428571429.
[32m[I 2023-04-25 23:39:46,144][39m Trial 195 finished with value: 0.8648648648648648 and parameters: {'objective': 'CrossEntropy', 'colsample_bylevel': 0.08322466999895549, 'depth': 11, 'boosting_type': 'Plain', 'bootstrap_type': 'Bayesian', 'bagging_temperature': 3.866121863856015}. Best is trial 161 with value: 0.8928571428571429.
[32m[I 2023-04-25 23:39:49,880][39m Trial 196 finished with value: 0.875 and parameters: {'objective': 'CrossEntropy', 'colsample_bylevel': 0.08896135123973542, 'depth': 8, 'boosting_type': 'Plain', 'bootstrap_type': 'Bayesian', 'bagging_temperature': 4.399596065693485}. Best is trial 161 with value: 0.8928571428571429.
[32m[I 2023-04-25 23:39:52,569][39m Trial 197 finished with value: 0.8521739130434783 and parameters: {'objective': 'CrossEntropy', 'colsample_bylevel': 0.07379291050356249, 'depth': 9, 'boosting_type': 'Plain', 'bootstrap_type': 'MVS'}. Best is trial 161 with value: 0.8928571428571429.
[32m[I 2023-04-25 23:39:56,252][39m Trial 198 finished with value: 0.875 and parameters: {'objective': 'CrossEntropy', 'colsample_bylevel': 0.09140035195628467, 'depth': 9, 'boosting_type': 'Plain', 'bootstrap_type': 'Bayesian', 'bagging_temperature': 2.727137991413061}. Best is trial 161 with value: 0.8928571428571429.
