[32m[I 2023-04-25 23:28:48,494][39m A new study created in memory with name: no-name-19858c03-ff72-4637-87a8-78cb5255608e
[32m[I 2023-04-25 23:28:49,920][39m Trial 0 finished with value: 0.8421052631578947 and parameters: {'objective': 'Logloss', 'colsample_bylevel': 0.02874089019153181, 'depth': 3, 'boosting_type': 'Plain', 'bootstrap_type': 'MVS'}. Best is trial 0 with value: 0.8421052631578947.
[32m[I 2023-04-25 23:28:52,739][39m Trial 1 finished with value: 0.8495575221238938 and parameters: {'objective': 'CrossEntropy', 'colsample_bylevel': 0.02420533385861577, 'depth': 12, 'boosting_type': 'Ordered', 'bootstrap_type': 'Bernoulli', 'subsample': 0.6443597993488396}. Best is trial 1 with value: 0.8495575221238938.
[32m[I 2023-04-25 23:28:57,501][39m Trial 2 finished with value: 0.8596491228070176 and parameters: {'objective': 'Logloss', 'colsample_bylevel': 0.05793351545664194, 'depth': 10, 'boosting_type': 'Ordered', 'bootstrap_type': 'Bayesian', 'bagging_temperature': 1.2633366239571786}. Best is trial 2 with value: 0.8596491228070176.
[32m[I 2023-04-25 23:29:00,368][39m Trial 3 finished with value: 0.8596491228070176 and parameters: {'objective': 'Logloss', 'colsample_bylevel': 0.07900194771399609, 'depth': 7, 'boosting_type': 'Plain', 'bootstrap_type': 'Bernoulli', 'subsample': 0.36081983730167266}. Best is trial 2 with value: 0.8596491228070176.
[32m[I 2023-04-25 23:29:03,105][39m Trial 4 finished with value: 0.8672566371681416 and parameters: {'objective': 'CrossEntropy', 'colsample_bylevel': 0.07388756129722009, 'depth': 11, 'boosting_type': 'Plain', 'bootstrap_type': 'MVS'}. Best is trial 4 with value: 0.8672566371681416.
[32m[I 2023-04-25 23:29:05,201][39m Trial 5 finished with value: 0.8521739130434783 and parameters: {'objective': 'CrossEntropy', 'colsample_bylevel': 0.05629571005630649, 'depth': 4, 'boosting_type': 'Plain', 'bootstrap_type': 'MVS'}. Best is trial 4 with value: 0.8672566371681416.
[32m[I 2023-04-25 23:29:07,867][39m Trial 6 finished with value: 0.8067226890756303 and parameters: {'objective': 'CrossEntropy', 'colsample_bylevel': 0.01526179150528328, 'depth': 6, 'boosting_type': 'Ordered', 'bootstrap_type': 'Bernoulli', 'subsample': 0.6516982329511826}. Best is trial 4 with value: 0.8672566371681416.
[32m[I 2023-04-25 23:29:09,864][39m Trial 7 finished with value: 0.7666666666666667 and parameters: {'objective': 'CrossEntropy', 'colsample_bylevel': 0.010152809102751565, 'depth': 7, 'boosting_type': 'Plain', 'bootstrap_type': 'Bayesian', 'bagging_temperature': 5.349325947015302}. Best is trial 4 with value: 0.8672566371681416.
[32m[I 2023-04-25 23:29:13,651][39m Trial 8 finished with value: 0.8521739130434783 and parameters: {'objective': 'CrossEntropy', 'colsample_bylevel': 0.05217322868379362, 'depth': 7, 'boosting_type': 'Ordered', 'bootstrap_type': 'Bayesian', 'bagging_temperature': 0.2623943566386122}. Best is trial 4 with value: 0.8672566371681416.
[32m[I 2023-04-25 23:29:16,821][39m Trial 9 finished with value: 0.8521739130434783 and parameters: {'objective': 'CrossEntropy', 'colsample_bylevel': 0.0427993972702009, 'depth': 9, 'boosting_type': 'Plain', 'bootstrap_type': 'MVS'}. Best is trial 4 with value: 0.8672566371681416.
[32m[I 2023-04-25 23:29:18,848][39m Trial 10 finished with value: 0.8347826086956522 and parameters: {'objective': 'Logloss', 'colsample_bylevel': 0.09598974104518686, 'depth': 1, 'boosting_type': 'Plain', 'bootstrap_type': 'MVS'}. Best is trial 4 with value: 0.8672566371681416.
[32m[I 2023-04-25 23:29:23,082][39m Trial 11 finished with value: 0.8521739130434783 and parameters: {'objective': 'Logloss', 'colsample_bylevel': 0.07250232359187214, 'depth': 12, 'boosting_type': 'Ordered', 'bootstrap_type': 'Bayesian', 'bagging_temperature': 0.9691987656622959}. Best is trial 4 with value: 0.8672566371681416.
[32m[I 2023-04-25 23:29:28,019][39m Trial 12 finished with value: 0.8648648648648648 and parameters: {'objective': 'Logloss', 'colsample_bylevel': 0.07238053612604045, 'depth': 10, 'boosting_type': 'Ordered', 'bootstrap_type': 'Bayesian', 'bagging_temperature': 9.938797570282425}. Best is trial 4 with value: 0.8672566371681416.
[32m[I 2023-04-25 23:29:33,960][39m Trial 13 finished with value: 0.8596491228070176 and parameters: {'objective': 'Logloss', 'colsample_bylevel': 0.07821641277376977, 'depth': 9, 'boosting_type': 'Ordered', 'bootstrap_type': 'MVS'}. Best is trial 4 with value: 0.8672566371681416.
[32m[I 2023-04-25 23:29:40,138][39m Trial 14 finished with value: 0.875 and parameters: {'objective': 'Logloss', 'colsample_bylevel': 0.09974574037567731, 'depth': 10, 'boosting_type': 'Ordered', 'bootstrap_type': 'Bayesian', 'bagging_temperature': 8.418537497929776}. Best is trial 14 with value: 0.875.
[32m[I 2023-04-25 23:29:42,487][39m Trial 15 finished with value: 0.8596491228070176 and parameters: {'objective': 'CrossEntropy', 'colsample_bylevel': 0.09448762533891374, 'depth': 11, 'boosting_type': 'Plain', 'bootstrap_type': 'MVS'}. Best is trial 14 with value: 0.875.
[32m[I 2023-04-25 23:29:47,687][39m Trial 16 finished with value: 0.8828828828828829 and parameters: {'objective': 'Logloss', 'colsample_bylevel': 0.08691730130011023, 'depth': 9, 'boosting_type': 'Ordered', 'bootstrap_type': 'Bayesian', 'bagging_temperature': 9.056152874307953}. Best is trial 16 with value: 0.8828828828828829.
[32m[I 2023-04-25 23:29:53,946][39m Trial 17 finished with value: 0.8571428571428572 and parameters: {'objective': 'Logloss', 'colsample_bylevel': 0.08744146925312245, 'depth': 9, 'boosting_type': 'Ordered', 'bootstrap_type': 'Bayesian', 'bagging_temperature': 9.407645881588937}. Best is trial 16 with value: 0.8828828828828829.
[32m[I 2023-04-25 23:29:59,935][39m Trial 18 finished with value: 0.8571428571428572 and parameters: {'objective': 'Logloss', 'colsample_bylevel': 0.09960427962826596, 'depth': 8, 'boosting_type': 'Ordered', 'bootstrap_type': 'Bayesian', 'bagging_temperature': 7.16436375533074}. Best is trial 16 with value: 0.8828828828828829.
[32m[I 2023-04-25 23:30:07,112][39m Trial 19 finished with value: 0.875 and parameters: {'objective': 'Logloss', 'colsample_bylevel': 0.08937412725239997, 'depth': 6, 'boosting_type': 'Ordered', 'bootstrap_type': 'Bayesian', 'bagging_temperature': 7.548997294997873}. Best is trial 16 with value: 0.8828828828828829.
[32m[I 2023-04-25 23:30:13,680][39m Trial 20 finished with value: 0.8571428571428572 and parameters: {'objective': 'Logloss', 'colsample_bylevel': 0.08716893171528711, 'depth': 5, 'boosting_type': 'Ordered', 'bootstrap_type': 'Bayesian', 'bagging_temperature': 6.682900777620534}. Best is trial 16 with value: 0.8828828828828829.
[32m[I 2023-04-25 23:30:20,230][39m Trial 21 finished with value: 0.8727272727272727 and parameters: {'objective': 'Logloss', 'colsample_bylevel': 0.08814351090740727, 'depth': 5, 'boosting_type': 'Ordered', 'bootstrap_type': 'Bayesian', 'bagging_temperature': 8.032874599715033}. Best is trial 16 with value: 0.8828828828828829.
[32m[I 2023-04-25 23:30:25,002][39m Trial 22 finished with value: 0.8672566371681416 and parameters: {'objective': 'Logloss', 'colsample_bylevel': 0.08387460656669882, 'depth': 8, 'boosting_type': 'Ordered', 'bootstrap_type': 'Bayesian', 'bagging_temperature': 8.22014224788588}. Best is trial 16 with value: 0.8828828828828829.
[32m[I 2023-04-25 23:30:30,016][39m Trial 23 finished with value: 0.875 and parameters: {'objective': 'Logloss', 'colsample_bylevel': 0.06509806591007876, 'depth': 8, 'boosting_type': 'Ordered', 'bootstrap_type': 'Bayesian', 'bagging_temperature': 8.576712004644511}. Best is trial 16 with value: 0.8828828828828829.
[32m[I 2023-04-25 23:30:35,807][39m Trial 24 finished with value: 0.8648648648648648 and parameters: {'objective': 'Logloss', 'colsample_bylevel': 0.06648815248394371, 'depth': 6, 'boosting_type': 'Ordered', 'bootstrap_type': 'Bayesian', 'bagging_temperature': 5.847494816417413}. Best is trial 16 with value: 0.8828828828828829.
[32m[I 2023-04-25 23:30:41,567][39m Trial 25 finished with value: 0.875 and parameters: {'objective': 'Logloss', 'colsample_bylevel': 0.09375525991672146, 'depth': 10, 'boosting_type': 'Ordered', 'bootstrap_type': 'Bayesian', 'bagging_temperature': 3.3666307825025337}. Best is trial 16 with value: 0.8828828828828829.
[32m[I 2023-04-25 23:30:45,186][39m Trial 26 finished with value: 0.8421052631578947 and parameters: {'objective': 'Logloss', 'colsample_bylevel': 0.04636704763819523, 'depth': 11, 'boosting_type': 'Ordered', 'bootstrap_type': 'Bernoulli', 'subsample': 0.9836896670983035}. Best is trial 16 with value: 0.8828828828828829.
[32m[I 2023-04-25 23:30:49,950][39m Trial 27 finished with value: 0.8571428571428572 and parameters: {'objective': 'Logloss', 'colsample_bylevel': 0.09164033132050078, 'depth': 2, 'boosting_type': 'Ordered', 'bootstrap_type': 'Bayesian', 'bagging_temperature': 7.282197150417231}. Best is trial 16 with value: 0.8828828828828829.
[32m[I 2023-04-25 23:30:55,822][39m Trial 28 finished with value: 0.8672566371681416 and parameters: {'objective': 'Logloss', 'colsample_bylevel': 0.09659277608159134, 'depth': 10, 'boosting_type': 'Ordered', 'bootstrap_type': 'Bayesian', 'bagging_temperature': 3.4066557584254564}. Best is trial 16 with value: 0.8828828828828829.
[32m[I 2023-04-25 23:31:01,962][39m Trial 29 finished with value: 0.8672566371681416 and parameters: {'objective': 'Logloss', 'colsample_bylevel': 0.09968886755081528, 'depth': 10, 'boosting_type': 'Ordered', 'bootstrap_type': 'Bayesian', 'bagging_temperature': 3.6155787635612526}. Best is trial 16 with value: 0.8828828828828829.
[32m[I 2023-04-25 23:31:06,980][39m Trial 30 finished with value: 0.8672566371681416 and parameters: {'objective': 'Logloss', 'colsample_bylevel': 0.08071913061225186, 'depth': 9, 'boosting_type': 'Ordered', 'bootstrap_type': 'Bernoulli', 'subsample': 0.10371221979990569}. Best is trial 16 with value: 0.8828828828828829.
[32m[I 2023-04-25 23:31:11,425][39m Trial 31 finished with value: 0.8596491228070176 and parameters: {'objective': 'Logloss', 'colsample_bylevel': 0.06404877119686672, 'depth': 8, 'boosting_type': 'Ordered', 'bootstrap_type': 'Bayesian', 'bagging_temperature': 3.647691471264018}. Best is trial 16 with value: 0.8828828828828829.
[32m[I 2023-04-25 23:31:15,508][39m Trial 32 finished with value: 0.8035714285714286 and parameters: {'objective': 'Logloss', 'colsample_bylevel': 0.03925397331917386, 'depth': 8, 'boosting_type': 'Ordered', 'bootstrap_type': 'Bayesian', 'bagging_temperature': 9.16006165771831}. Best is trial 16 with value: 0.8828828828828829.
[32m[I 2023-04-25 23:31:20,707][39m Trial 33 finished with value: 0.875 and parameters: {'objective': 'Logloss', 'colsample_bylevel': 0.06525203449907874, 'depth': 5, 'boosting_type': 'Ordered', 'bootstrap_type': 'Bayesian', 'bagging_temperature': 2.312089596517138}. Best is trial 16 with value: 0.8828828828828829.
[32m[I 2023-04-25 23:31:25,187][39m Trial 34 finished with value: 0.822429906542056 and parameters: {'objective': 'Logloss', 'colsample_bylevel': 0.02935755628121714, 'depth': 6, 'boosting_type': 'Ordered', 'bootstrap_type': 'Bayesian', 'bagging_temperature': 9.037160686302684}. Best is trial 16 with value: 0.8828828828828829.
[32m[I 2023-04-25 23:31:29,766][39m Trial 35 finished with value: 0.8672566371681416 and parameters: {'objective': 'Logloss', 'colsample_bylevel': 0.0837468449698037, 'depth': 4, 'boosting_type': 'Ordered', 'bootstrap_type': 'Bayesian', 'bagging_temperature': 2.4092889045194537}. Best is trial 16 with value: 0.8828828828828829.
[32m[I 2023-04-25 23:31:34,697][39m Trial 36 finished with value: 0.8468468468468469 and parameters: {'objective': 'Logloss', 'colsample_bylevel': 0.06338280714284222, 'depth': 12, 'boosting_type': 'Ordered', 'bootstrap_type': 'Bernoulli', 'subsample': 0.9654807369159697}. Best is trial 16 with value: 0.8828828828828829.
[32m[I 2023-04-25 23:31:40,328][39m Trial 37 finished with value: 0.8648648648648648 and parameters: {'objective': 'Logloss', 'colsample_bylevel': 0.07709566586410849, 'depth': 11, 'boosting_type': 'Ordered', 'bootstrap_type': 'Bayesian', 'bagging_temperature': 8.446106573557248}. Best is trial 16 with value: 0.8828828828828829.
[32m[I 2023-04-25 23:31:42,420][39m Trial 38 finished with value: 0.8695652173913043 and parameters: {'objective': 'Logloss', 'colsample_bylevel': 0.06763607948206157, 'depth': 5, 'boosting_type': 'Plain', 'bootstrap_type': 'Bayesian', 'bagging_temperature': 6.505673677560823}. Best is trial 16 with value: 0.8828828828828829.
[32m[I 2023-04-25 23:31:47,526][39m Trial 39 finished with value: 0.8672566371681416 and parameters: {'objective': 'CrossEntropy', 'colsample_bylevel': 0.09342433107099116, 'depth': 4, 'boosting_type': 'Ordered', 'bootstrap_type': 'Bernoulli', 'subsample': 0.11005110262796952}. Best is trial 16 with value: 0.8828828828828829.
[32m[I 2023-04-25 23:31:52,537][39m Trial 40 finished with value: 0.875 and parameters: {'objective': 'Logloss', 'colsample_bylevel': 0.09027656595694199, 'depth': 7, 'boosting_type': 'Ordered', 'bootstrap_type': 'Bayesian', 'bagging_temperature': 4.562429213835685}. Best is trial 16 with value: 0.8828828828828829.
[32m[I 2023-04-25 23:31:56,759][39m Trial 41 finished with value: 0.8672566371681416 and parameters: {'objective': 'Logloss', 'colsample_bylevel': 0.053105084720382466, 'depth': 7, 'boosting_type': 'Ordered', 'bootstrap_type': 'Bayesian', 'bagging_temperature': 5.04927425632691}. Best is trial 16 with value: 0.8828828828828829.
[32m[I 2023-04-25 23:32:02,656][39m Trial 42 finished with value: 0.875 and parameters: {'objective': 'Logloss', 'colsample_bylevel': 0.09028268081395299, 'depth': 8, 'boosting_type': 'Ordered', 'bootstrap_type': 'Bayesian', 'bagging_temperature': 4.329570720136323}. Best is trial 16 with value: 0.8828828828828829.
[32m[I 2023-04-25 23:32:07,966][39m Trial 43 finished with value: 0.8672566371681416 and parameters: {'objective': 'Logloss', 'colsample_bylevel': 0.08289734177819792, 'depth': 7, 'boosting_type': 'Ordered', 'bootstrap_type': 'Bayesian', 'bagging_temperature': 4.302695107561877}. Best is trial 16 with value: 0.8828828828828829.
[32m[I 2023-04-25 23:32:10,603][39m Trial 44 finished with value: 0.875 and parameters: {'objective': 'CrossEntropy', 'colsample_bylevel': 0.0727002123750041, 'depth': 8, 'boosting_type': 'Plain', 'bootstrap_type': 'Bayesian', 'bagging_temperature': 4.527660870743135}. Best is trial 16 with value: 0.8828828828828829.
[32m[I 2023-04-25 23:32:12,619][39m Trial 45 finished with value: 0.8596491228070176 and parameters: {'objective': 'CrossEntropy', 'colsample_bylevel': 0.060095377667530335, 'depth': 10, 'boosting_type': 'Plain', 'bootstrap_type': 'MVS'}. Best is trial 16 with value: 0.8828828828828829.
[32m[I 2023-04-25 23:32:17,952][39m Trial 46 finished with value: 0.8828828828828829 and parameters: {'objective': 'Logloss', 'colsample_bylevel': 0.09067208283743186, 'depth': 9, 'boosting_type': 'Ordered', 'bootstrap_type': 'Bayesian', 'bagging_temperature': 2.6745273036227344}. Best is trial 16 with value: 0.8828828828828829.
[32m[I 2023-04-25 23:32:21,423][39m Trial 47 finished with value: 0.8771929824561403 and parameters: {'objective': 'CrossEntropy', 'colsample_bylevel': 0.07484938157490216, 'depth': 9, 'boosting_type': 'Plain', 'bootstrap_type': 'Bayesian', 'bagging_temperature': 4.46037719473417}. Best is trial 16 with value: 0.8828828828828829.
[32m[I 2023-04-25 23:32:24,792][39m Trial 48 finished with value: 0.8596491228070176 and parameters: {'objective': 'CrossEntropy', 'colsample_bylevel': 0.07394363253428872, 'depth': 9, 'boosting_type': 'Plain', 'bootstrap_type': 'MVS'}. Best is trial 16 with value: 0.8828828828828829.
[32m[I 2023-04-25 23:32:27,244][39m Trial 49 finished with value: 0.8828828828828829 and parameters: {'objective': 'CrossEntropy', 'colsample_bylevel': 0.09707502183067884, 'depth': 10, 'boosting_type': 'Plain', 'bootstrap_type': 'Bayesian', 'bagging_temperature': 2.4400907854757823}. Best is trial 16 with value: 0.8828828828828829.
[32m[I 2023-04-25 23:32:30,351][39m Trial 50 finished with value: 0.875 and parameters: {'objective': 'CrossEntropy', 'colsample_bylevel': 0.09461838635376055, 'depth': 11, 'boosting_type': 'Plain', 'bootstrap_type': 'Bayesian', 'bagging_temperature': 2.1367614028305693}. Best is trial 16 with value: 0.8828828828828829.
[32m[I 2023-04-25 23:32:33,776][39m Trial 51 finished with value: 0.8828828828828829 and parameters: {'objective': 'CrossEntropy', 'colsample_bylevel': 0.07720387127188072, 'depth': 9, 'boosting_type': 'Plain', 'bootstrap_type': 'Bayesian', 'bagging_temperature': 2.9998907437982147}. Best is trial 16 with value: 0.8828828828828829.
[32m[I 2023-04-25 23:32:37,337][39m Trial 52 finished with value: 0.8828828828828829 and parameters: {'objective': 'CrossEntropy', 'colsample_bylevel': 0.07622576134319581, 'depth': 9, 'boosting_type': 'Plain', 'bootstrap_type': 'Bayesian', 'bagging_temperature': 2.9770254437564634}. Best is trial 16 with value: 0.8828828828828829.
[32m[I 2023-04-25 23:32:40,493][39m Trial 53 finished with value: 0.8596491228070176 and parameters: {'objective': 'CrossEntropy', 'colsample_bylevel': 0.07712724288446901, 'depth': 9, 'boosting_type': 'Plain', 'bootstrap_type': 'Bayesian', 'bagging_temperature': 1.7225412171023304}. Best is trial 16 with value: 0.8828828828828829.
[32m[I 2023-04-25 23:32:43,729][39m Trial 54 finished with value: 0.8596491228070176 and parameters: {'objective': 'CrossEntropy', 'colsample_bylevel': 0.08468216697680694, 'depth': 9, 'boosting_type': 'Plain', 'bootstrap_type': 'Bayesian', 'bagging_temperature': 2.8437029579047324}. Best is trial 16 with value: 0.8828828828828829.
[32m[I 2023-04-25 23:32:46,557][39m Trial 55 finished with value: 0.8596491228070176 and parameters: {'objective': 'CrossEntropy', 'colsample_bylevel': 0.07967646078527364, 'depth': 10, 'boosting_type': 'Plain', 'bootstrap_type': 'Bayesian', 'bagging_temperature': 0.9315795812507242}. Best is trial 16 with value: 0.8828828828828829.
[32m[I 2023-04-25 23:32:49,807][39m Trial 56 finished with value: 0.8495575221238938 and parameters: {'objective': 'CrossEntropy', 'colsample_bylevel': 0.08633943822696531, 'depth': 9, 'boosting_type': 'Plain', 'bootstrap_type': 'Bayesian', 'bagging_temperature': 1.287935051959721}. Best is trial 16 with value: 0.8828828828828829.
[32m[I 2023-04-25 23:32:51,820][39m Trial 57 finished with value: 0.8571428571428572 and parameters: {'objective': 'CrossEntropy', 'colsample_bylevel': 0.0702192544106227, 'depth': 11, 'boosting_type': 'Plain', 'bootstrap_type': 'MVS'}. Best is trial 16 with value: 0.8828828828828829.
[32m[I 2023-04-25 23:32:54,585][39m Trial 58 finished with value: 0.8672566371681416 and parameters: {'objective': 'CrossEntropy', 'colsample_bylevel': 0.07587731983313149, 'depth': 10, 'boosting_type': 'Plain', 'bootstrap_type': 'Bernoulli', 'subsample': 0.41069939597724636}. Best is trial 16 with value: 0.8828828828828829.
[32m[I 2023-04-25 23:32:57,441][39m Trial 59 finished with value: 0.875 and parameters: {'objective': 'CrossEntropy', 'colsample_bylevel': 0.08036216813460186, 'depth': 12, 'boosting_type': 'Plain', 'bootstrap_type': 'Bayesian', 'bagging_temperature': 2.8695059943250887}. Best is trial 16 with value: 0.8828828828828829.
[32m[I 2023-04-25 23:33:00,665][39m Trial 60 finished with value: 0.8672566371681416 and parameters: {'objective': 'CrossEntropy', 'colsample_bylevel': 0.09739281451009348, 'depth': 9, 'boosting_type': 'Plain', 'bootstrap_type': 'Bayesian', 'bagging_temperature': 2.9846494967370707}. Best is trial 16 with value: 0.8828828828828829.
[32m[I 2023-04-25 23:33:03,026][39m Trial 61 finished with value: 0.8620689655172413 and parameters: {'objective': 'CrossEntropy', 'colsample_bylevel': 0.09037100894567353, 'depth': 7, 'boosting_type': 'Plain', 'bootstrap_type': 'Bayesian', 'bagging_temperature': 5.570708454947409}. Best is trial 16 with value: 0.8828828828828829.
[32m[I 2023-04-25 23:33:05,450][39m Trial 62 finished with value: 0.8495575221238938 and parameters: {'objective': 'CrossEntropy', 'colsample_bylevel': 0.06937678924940255, 'depth': 3, 'boosting_type': 'Plain', 'bootstrap_type': 'Bayesian', 'bagging_temperature': 2.384647035247794}. Best is trial 16 with value: 0.8828828828828829.
[32m[I 2023-04-25 23:33:09,070][39m Trial 63 finished with value: 0.875 and parameters: {'objective': 'CrossEntropy', 'colsample_bylevel': 0.07472766219873113, 'depth': 9, 'boosting_type': 'Plain', 'bootstrap_type': 'Bayesian', 'bagging_temperature': 1.9279742988082735}. Best is trial 16 with value: 0.8828828828828829.
[32m[I 2023-04-25 23:33:12,793][39m Trial 64 finished with value: 0.8596491228070176 and parameters: {'objective': 'CrossEntropy', 'colsample_bylevel': 0.0806658707334118, 'depth': 9, 'boosting_type': 'Plain', 'bootstrap_type': 'Bayesian', 'bagging_temperature': 0.21906441054605175}. Best is trial 16 with value: 0.8828828828828829.
[32m[I 2023-04-25 23:33:15,334][39m Trial 65 finished with value: 0.8828828828828829 and parameters: {'objective': 'CrossEntropy', 'colsample_bylevel': 0.08728741974700972, 'depth': 6, 'boosting_type': 'Plain', 'bootstrap_type': 'Bayesian', 'bagging_temperature': 9.908966478799357}. Best is trial 16 with value: 0.8828828828828829.
[32m[I 2023-04-25 23:33:18,704][39m Trial 66 finished with value: 0.8596491228070176 and parameters: {'objective': 'CrossEntropy', 'colsample_bylevel': 0.08655590136631136, 'depth': 8, 'boosting_type': 'Plain', 'bootstrap_type': 'Bayesian', 'bagging_temperature': 9.970056243907587}. Best is trial 16 with value: 0.8828828828828829.
