[32m[I 2023-04-25 23:49:14,575][39m Trial 397 finished with value: 0.8672566371681416 and parameters: {'objective': 'CrossEntropy', 'colsample_bylevel': 0.08422835962011707, 'depth': 6, 'boosting_type': 'Plain', 'bootstrap_type': 'Bayesian', 'bagging_temperature': 5.345557382005257}. Best is trial 161 with value: 0.8928571428571429.
[32m[I 2023-04-25 23:49:17,104][39m Trial 398 finished with value: 0.8672566371681416 and parameters: {'objective': 'CrossEntropy', 'colsample_bylevel': 0.08223933355226819, 'depth': 6, 'boosting_type': 'Plain', 'bootstrap_type': 'Bayesian', 'bagging_temperature': 3.4591863194441137}. Best is trial 161 with value: 0.8928571428571429.
[32m[I 2023-04-25 23:49:19,922][39m Trial 399 finished with value: 0.875 and parameters: {'objective': 'Logloss', 'colsample_bylevel': 0.08732112954637704, 'depth': 10, 'boosting_type': 'Plain', 'bootstrap_type': 'Bayesian', 'bagging_temperature': 2.7247701650499794}. Best is trial 161 with value: 0.8928571428571429.
[32m[I 2023-04-25 23:49:25,168][39m Trial 400 finished with value: 0.8672566371681416 and parameters: {'objective': 'CrossEntropy', 'colsample_bylevel': 0.08906320956049364, 'depth': 7, 'boosting_type': 'Ordered', 'bootstrap_type': 'Bayesian', 'bagging_temperature': 2.322190211887742}. Best is trial 161 with value: 0.8928571428571429.
[32m[I 2023-04-25 23:49:27,204][39m Trial 401 finished with value: 0.8596491228070176 and parameters: {'objective': 'CrossEntropy', 'colsample_bylevel': 0.09238041854042822, 'depth': 7, 'boosting_type': 'Plain', 'bootstrap_type': 'MVS'}. Best is trial 161 with value: 0.8928571428571429.
[32m[I 2023-04-25 23:49:30,274][39m Trial 402 finished with value: 0.8596491228070176 and parameters: {'objective': 'CrossEntropy', 'colsample_bylevel': 0.09776586902781151, 'depth': 10, 'boosting_type': 'Plain', 'bootstrap_type': 'Bayesian', 'bagging_temperature': 3.7439407809842185}. Best is trial 161 with value: 0.8928571428571429.
[32m[I 2023-04-25 23:49:32,381][39m Trial 403 finished with value: 0.8521739130434783 and parameters: {'objective': 'CrossEntropy', 'colsample_bylevel': 0.07628328650949284, 'depth': 4, 'boosting_type': 'Plain', 'bootstrap_type': 'Bayesian', 'bagging_temperature': 9.466274956140278}. Best is trial 161 with value: 0.8928571428571429.
[32m[I 2023-04-25 23:49:34,564][39m Trial 404 finished with value: 0.8672566371681416 and parameters: {'objective': 'CrossEntropy', 'colsample_bylevel': 0.09426998809389885, 'depth': 11, 'boosting_type': 'Plain', 'bootstrap_type': 'Bayesian', 'bagging_temperature': 3.771645597690242}. Best is trial 161 with value: 0.8928571428571429.
[32m[I 2023-04-25 23:49:37,118][39m Trial 405 finished with value: 0.8596491228070176 and parameters: {'objective': 'CrossEntropy', 'colsample_bylevel': 0.06551255041346303, 'depth': 8, 'boosting_type': 'Plain', 'bootstrap_type': 'Bayesian', 'bagging_temperature': 3.292523949484735}. Best is trial 161 with value: 0.8928571428571429.
[32m[I 2023-04-25 23:49:39,518][39m Trial 406 finished with value: 0.8828828828828829 and parameters: {'objective': 'CrossEntropy', 'colsample_bylevel': 0.09044642998755158, 'depth': 10, 'boosting_type': 'Plain', 'bootstrap_type': 'Bayesian', 'bagging_temperature': 3.5367600283983087}. Best is trial 161 with value: 0.8928571428571429.
[32m[I 2023-04-25 23:49:41,622][39m Trial 407 finished with value: 0.875 and parameters: {'objective': 'CrossEntropy', 'colsample_bylevel': 0.08632423896628835, 'depth': 10, 'boosting_type': 'Plain', 'bootstrap_type': 'Bayesian', 'bagging_temperature': 4.3967005463814335}. Best is trial 161 with value: 0.8928571428571429.
[32m[I 2023-04-25 23:49:43,777][39m Trial 408 finished with value: 0.875 and parameters: {'objective': 'CrossEntropy', 'colsample_bylevel': 0.09634698757878421, 'depth': 11, 'boosting_type': 'Plain', 'bootstrap_type': 'Bayesian', 'bagging_temperature': 3.2503209632042087}. Best is trial 161 with value: 0.8928571428571429.
[32m[I 2023-04-25 23:49:50,382][39m Trial 409 finished with value: 0.8828828828828829 and parameters: {'objective': 'Logloss', 'colsample_bylevel': 0.08891486114956677, 'depth': 5, 'boosting_type': 'Ordered', 'bootstrap_type': 'Bayesian', 'bagging_temperature': 8.219640631309126}. Best is trial 161 with value: 0.8928571428571429.
[32m[I 2023-04-25 23:49:52,888][39m Trial 410 finished with value: 0.875 and parameters: {'objective': 'CrossEntropy', 'colsample_bylevel': 0.08400105358064527, 'depth': 6, 'boosting_type': 'Plain', 'bootstrap_type': 'Bayesian', 'bagging_temperature': 8.7525121578645}. Best is trial 161 with value: 0.8928571428571429.
[32m[I 2023-04-25 23:49:59,095][39m Trial 411 finished with value: 0.8672566371681416 and parameters: {'objective': 'Logloss', 'colsample_bylevel': 0.08926281275371357, 'depth': 5, 'boosting_type': 'Ordered', 'bootstrap_type': 'Bayesian', 'bagging_temperature': 3.628354147032608}. Best is trial 161 with value: 0.8928571428571429.
[32m[I 2023-04-25 23:50:00,936][39m Trial 412 finished with value: 0.8571428571428572 and parameters: {'objective': 'CrossEntropy', 'colsample_bylevel': 0.04950820598038353, 'depth': 5, 'boosting_type': 'Plain', 'bootstrap_type': 'Bayesian', 'bagging_temperature': 5.101724793556567}. Best is trial 161 with value: 0.8928571428571429.
[32m[I 2023-04-25 23:50:04,224][39m Trial 413 finished with value: 0.8672566371681416 and parameters: {'objective': 'CrossEntropy', 'colsample_bylevel': 0.08027959328957471, 'depth': 9, 'boosting_type': 'Plain', 'bootstrap_type': 'Bayesian', 'bagging_temperature': 2.6252805855237265}. Best is trial 161 with value: 0.8928571428571429.
[32m[I 2023-04-25 23:50:07,067][39m Trial 414 finished with value: 0.8521739130434783 and parameters: {'objective': 'CrossEntropy', 'colsample_bylevel': 0.0983014185724942, 'depth': 4, 'boosting_type': 'Plain', 'bootstrap_type': 'Bayesian', 'bagging_temperature': 8.400057037667674}. Best is trial 161 with value: 0.8928571428571429.
[32m[I 2023-04-25 23:50:09,183][39m Trial 415 finished with value: 0.875 and parameters: {'objective': 'CrossEntropy', 'colsample_bylevel': 0.07116624113718613, 'depth': 10, 'boosting_type': 'Plain', 'bootstrap_type': 'Bayesian', 'bagging_temperature': 3.702095519434544}. Best is trial 161 with value: 0.8928571428571429.
[32m[I 2023-04-25 23:50:11,685][39m Trial 416 finished with value: 0.875 and parameters: {'objective': 'CrossEntropy', 'colsample_bylevel': 0.0931086185820863, 'depth': 12, 'boosting_type': 'Plain', 'bootstrap_type': 'Bayesian', 'bagging_temperature': 2.976657066016697}. Best is trial 161 with value: 0.8928571428571429.
[32m[I 2023-04-25 23:50:14,225][39m Trial 417 finished with value: 0.875 and parameters: {'objective': 'CrossEntropy', 'colsample_bylevel': 0.07715013605695435, 'depth': 7, 'boosting_type': 'Plain', 'bootstrap_type': 'Bayesian', 'bagging_temperature': 2.1552641971017907}. Best is trial 161 with value: 0.8928571428571429.
[32m[I 2023-04-25 23:50:17,559][39m Trial 418 finished with value: 0.875 and parameters: {'objective': 'CrossEntropy', 'colsample_bylevel': 0.07939976767768911, 'depth': 8, 'boosting_type': 'Plain', 'bootstrap_type': 'Bayesian', 'bagging_temperature': 3.397537949123561}. Best is trial 161 with value: 0.8928571428571429.
[32m[I 2023-04-25 23:50:20,216][39m Trial 419 finished with value: 0.8571428571428572 and parameters: {'objective': 'CrossEntropy', 'colsample_bylevel': 0.09133864110365499, 'depth': 7, 'boosting_type': 'Plain', 'bootstrap_type': 'Bernoulli', 'subsample': 0.7321375070061795}. Best is trial 161 with value: 0.8928571428571429.
[32m[I 2023-04-25 23:50:23,021][39m Trial 420 finished with value: 0.8672566371681416 and parameters: {'objective': 'CrossEntropy', 'colsample_bylevel': 0.09000113471656773, 'depth': 9, 'boosting_type': 'Plain', 'bootstrap_type': 'Bayesian', 'bagging_temperature': 4.6155879281608545}. Best is trial 161 with value: 0.8928571428571429.
[32m[I 2023-04-25 23:50:25,792][39m Trial 421 finished with value: 0.8623853211009175 and parameters: {'objective': 'CrossEntropy', 'colsample_bylevel': 0.08561862277594756, 'depth': 10, 'boosting_type': 'Plain', 'bootstrap_type': 'Bayesian', 'bagging_temperature': 3.484278522014904}. Best is trial 161 with value: 0.8928571428571429.
[32m[I 2023-04-25 23:50:29,081][39m Trial 422 finished with value: 0.8672566371681416 and parameters: {'objective': 'CrossEntropy', 'colsample_bylevel': 0.09591850232582004, 'depth': 11, 'boosting_type': 'Plain', 'bootstrap_type': 'Bayesian', 'bagging_temperature': 4.578844176073276}. Best is trial 161 with value: 0.8928571428571429.
[32m[I 2023-04-25 23:50:31,857][39m Trial 423 finished with value: 0.8596491228070176 and parameters: {'objective': 'CrossEntropy', 'colsample_bylevel': 0.06908572932190896, 'depth': 8, 'boosting_type': 'Plain', 'bootstrap_type': 'Bayesian', 'bagging_temperature': 3.4500576971117205}. Best is trial 161 with value: 0.8928571428571429.
[32m[I 2023-04-25 23:50:34,516][39m Trial 424 finished with value: 0.875 and parameters: {'objective': 'CrossEntropy', 'colsample_bylevel': 0.08754451725310919, 'depth': 6, 'boosting_type': 'Plain', 'bootstrap_type': 'Bayesian', 'bagging_temperature': 3.875518700237806}. Best is trial 161 with value: 0.8928571428571429.
[32m[I 2023-04-25 23:50:36,298][39m Trial 425 finished with value: 0.8672566371681416 and parameters: {'objective': 'CrossEntropy', 'colsample_bylevel': 0.07356609089038216, 'depth': 10, 'boosting_type': 'Plain', 'bootstrap_type': 'MVS'}. Best is trial 161 with value: 0.8928571428571429.
[32m[I 2023-04-25 23:50:38,998][39m Trial 426 finished with value: 0.875 and parameters: {'objective': 'CrossEntropy', 'colsample_bylevel': 0.08151788801627839, 'depth': 10, 'boosting_type': 'Plain', 'bootstrap_type': 'Bayesian', 'bagging_temperature': 3.261687150651719}. Best is trial 161 with value: 0.8928571428571429.
[32m[I 2023-04-25 23:50:41,862][39m Trial 427 finished with value: 0.8828828828828829 and parameters: {'objective': 'CrossEntropy', 'colsample_bylevel': 0.08189664013699718, 'depth': 9, 'boosting_type': 'Plain', 'bootstrap_type': 'Bayesian', 'bagging_temperature': 3.124837727469439}. Best is trial 161 with value: 0.8928571428571429.
[32m[I 2023-04-25 23:50:43,644][39m Trial 428 finished with value: 0.8571428571428572 and parameters: {'objective': 'CrossEntropy', 'colsample_bylevel': 0.04489462745429949, 'depth': 10, 'boosting_type': 'Plain', 'bootstrap_type': 'Bayesian', 'bagging_temperature': 3.1072502522261667}. Best is trial 161 with value: 0.8928571428571429.
[32m[I 2023-04-25 23:50:50,906][39m Trial 429 finished with value: 0.875 and parameters: {'objective': 'Logloss', 'colsample_bylevel': 0.08753846394466865, 'depth': 6, 'boosting_type': 'Ordered', 'bootstrap_type': 'Bayesian', 'bagging_temperature': 3.9822429725945088}. Best is trial 161 with value: 0.8928571428571429.
[32m[I 2023-04-25 23:50:53,815][39m Trial 430 finished with value: 0.8596491228070176 and parameters: {'objective': 'CrossEntropy', 'colsample_bylevel': 0.07541215334167196, 'depth': 9, 'boosting_type': 'Plain', 'bootstrap_type': 'Bayesian', 'bagging_temperature': 4.138750075367981}. Best is trial 161 with value: 0.8928571428571429.
[32m[I 2023-04-25 23:50:57,183][39m Trial 431 finished with value: 0.875 and parameters: {'objective': 'CrossEntropy', 'colsample_bylevel': 0.07147497960719457, 'depth': 9, 'boosting_type': 'Plain', 'bootstrap_type': 'Bayesian', 'bagging_temperature': 3.98622552812317}. Best is trial 161 with value: 0.8928571428571429.
[32m[I 2023-04-25 23:50:59,992][39m Trial 432 finished with value: 0.8828828828828829 and parameters: {'objective': 'CrossEntropy', 'colsample_bylevel': 0.08536286959330608, 'depth': 10, 'boosting_type': 'Plain', 'bootstrap_type': 'Bayesian', 'bagging_temperature': 2.709743542014723}. Best is trial 161 with value: 0.8928571428571429.
[32m[I 2023-04-25 23:51:02,622][39m Trial 433 finished with value: 0.8672566371681416 and parameters: {'objective': 'CrossEntropy', 'colsample_bylevel': 0.08535549506439606, 'depth': 6, 'boosting_type': 'Plain', 'bootstrap_type': 'Bayesian', 'bagging_temperature': 4.94478131997778}. Best is trial 161 with value: 0.8928571428571429.
[32m[I 2023-04-25 23:51:05,324][39m Trial 434 finished with value: 0.8596491228070176 and parameters: {'objective': 'CrossEntropy', 'colsample_bylevel': 0.07624404174527243, 'depth': 12, 'boosting_type': 'Plain', 'bootstrap_type': 'Bayesian', 'bagging_temperature': 3.0503732358854574}. Best is trial 161 with value: 0.8928571428571429.
[32m[I 2023-04-25 23:51:09,002][39m Trial 435 finished with value: 0.875 and parameters: {'objective': 'CrossEntropy', 'colsample_bylevel': 0.09431214412572393, 'depth': 9, 'boosting_type': 'Plain', 'bootstrap_type': 'Bayesian', 'bagging_temperature': 3.864654230909225}. Best is trial 161 with value: 0.8928571428571429.
[32m[I 2023-04-25 23:51:10,794][39m Trial 436 finished with value: 0.8495575221238938 and parameters: {'objective': 'CrossEntropy', 'colsample_bylevel': 0.0724389310401718, 'depth': 2, 'boosting_type': 'Plain', 'bootstrap_type': 'Bayesian', 'bagging_temperature': 2.4947026510799453}. Best is trial 161 with value: 0.8928571428571429.
[32m[I 2023-04-25 23:51:13,976][39m Trial 437 finished with value: 0.8468468468468469 and parameters: {'objective': 'CrossEntropy', 'colsample_bylevel': 0.06676482233722301, 'depth': 9, 'boosting_type': 'Plain', 'bootstrap_type': 'Bayesian', 'bagging_temperature': 8.5169734700524}. Best is trial 161 with value: 0.8928571428571429.
[32m[I 2023-04-25 23:51:16,723][39m Trial 438 finished with value: 0.8828828828828829 and parameters: {'objective': 'CrossEntropy', 'colsample_bylevel': 0.09592510113925068, 'depth': 7, 'boosting_type': 'Plain', 'bootstrap_type': 'Bayesian', 'bagging_temperature': 2.875706537549422}. Best is trial 161 with value: 0.8928571428571429.
[32m[I 2023-04-25 23:51:19,221][39m Trial 439 finished with value: 0.875 and parameters: {'objective': 'CrossEntropy', 'colsample_bylevel': 0.09173371173385539, 'depth': 10, 'boosting_type': 'Plain', 'bootstrap_type': 'Bayesian', 'bagging_temperature': 3.5325965105401793}. Best is trial 161 with value: 0.8928571428571429.
[32m[I 2023-04-25 23:51:21,939][39m Trial 440 finished with value: 0.8672566371681416 and parameters: {'objective': 'CrossEntropy', 'colsample_bylevel': 0.09538991206202527, 'depth': 10, 'boosting_type': 'Plain', 'bootstrap_type': 'Bernoulli', 'subsample': 0.9124751308842094}. Best is trial 161 with value: 0.8928571428571429.
[32m[I 2023-04-25 23:51:24,906][39m Trial 441 finished with value: 0.8828828828828829 and parameters: {'objective': 'CrossEntropy', 'colsample_bylevel': 0.0902048692658199, 'depth': 8, 'boosting_type': 'Plain', 'bootstrap_type': 'Bayesian', 'bagging_temperature': 2.763137154051198}. Best is trial 161 with value: 0.8928571428571429.
[32m[I 2023-04-25 23:51:27,817][39m Trial 442 finished with value: 0.8672566371681416 and parameters: {'objective': 'CrossEntropy', 'colsample_bylevel': 0.08736947621680378, 'depth': 10, 'boosting_type': 'Plain', 'bootstrap_type': 'Bayesian', 'bagging_temperature': 4.279835659273725}. Best is trial 161 with value: 0.8928571428571429.
[32m[I 2023-04-25 23:51:29,776][39m Trial 443 finished with value: 0.8672566371681416 and parameters: {'objective': 'CrossEntropy', 'colsample_bylevel': 0.06389532872356053, 'depth': 7, 'boosting_type': 'Plain', 'bootstrap_type': 'Bayesian', 'bagging_temperature': 3.3384684341026096}. Best is trial 161 with value: 0.8928571428571429.
[32m[I 2023-04-25 23:51:32,253][39m Trial 444 finished with value: 0.8727272727272727 and parameters: {'objective': 'CrossEntropy', 'colsample_bylevel': 0.09282532412719964, 'depth': 7, 'boosting_type': 'Plain', 'bootstrap_type': 'Bayesian', 'bagging_temperature': 3.6308544497561996}. Best is trial 161 with value: 0.8928571428571429.
[32m[I 2023-04-25 23:51:34,511][39m Trial 445 finished with value: 0.8521739130434783 and parameters: {'objective': 'CrossEntropy', 'colsample_bylevel': 0.058477663688711365, 'depth': 8, 'boosting_type': 'Plain', 'bootstrap_type': 'MVS'}. Best is trial 161 with value: 0.8928571428571429.
[32m[I 2023-04-25 23:51:37,167][39m Trial 446 finished with value: 0.8672566371681416 and parameters: {'objective': 'CrossEntropy', 'colsample_bylevel': 0.08324215747272874, 'depth': 11, 'boosting_type': 'Plain', 'bootstrap_type': 'Bayesian', 'bagging_temperature': 4.1302484979513165}. Best is trial 161 with value: 0.8928571428571429.
[32m[I 2023-04-25 23:51:42,810][39m Trial 447 finished with value: 0.8596491228070176 and parameters: {'objective': 'Logloss', 'colsample_bylevel': 0.09780611230274193, 'depth': 9, 'boosting_type': 'Ordered', 'bootstrap_type': 'Bayesian', 'bagging_temperature': 3.366128757448223}. Best is trial 161 with value: 0.8928571428571429.
[32m[I 2023-04-25 23:51:45,793][39m Trial 448 finished with value: 0.875 and parameters: {'objective': 'CrossEntropy', 'colsample_bylevel': 0.08969272540277211, 'depth': 11, 'boosting_type': 'Plain', 'bootstrap_type': 'Bayesian', 'bagging_temperature': 4.490304464672115}. Best is trial 161 with value: 0.8928571428571429.
[32m[I 2023-04-25 23:51:48,209][39m Trial 449 finished with value: 0.875 and parameters: {'objective': 'CrossEntropy', 'colsample_bylevel': 0.07353654478693687, 'depth': 10, 'boosting_type': 'Plain', 'bootstrap_type': 'Bayesian', 'bagging_temperature': 2.3932555991277566}. Best is trial 161 with value: 0.8928571428571429.
[32m[I 2023-04-25 23:51:50,700][39m Trial 450 finished with value: 0.8672566371681416 and parameters: {'objective': 'CrossEntropy', 'colsample_bylevel': 0.07104368341835712, 'depth': 7, 'boosting_type': 'Plain', 'bootstrap_type': 'Bayesian', 'bagging_temperature': 3.7340396177113484}. Best is trial 161 with value: 0.8928571428571429.
[32m[I 2023-04-25 23:51:52,149][39m Trial 451 finished with value: 0.8421052631578947 and parameters: {'objective': 'CrossEntropy', 'colsample_bylevel': 0.028637073742362594, 'depth': 7, 'boosting_type': 'Plain', 'bootstrap_type': 'Bayesian', 'bagging_temperature': 3.0209900068046904}. Best is trial 161 with value: 0.8928571428571429.
[32m[I 2023-04-25 23:51:55,527][39m Trial 452 finished with value: 0.875 and parameters: {'objective': 'CrossEntropy', 'colsample_bylevel': 0.09072825067219688, 'depth': 8, 'boosting_type': 'Plain', 'bootstrap_type': 'Bayesian', 'bagging_temperature': 2.8774608392568277}. Best is trial 161 with value: 0.8928571428571429.
[32m[I 2023-04-25 23:51:57,739][39m Trial 453 finished with value: 0.875 and parameters: {'objective': 'CrossEntropy', 'colsample_bylevel': 0.08702481683513263, 'depth': 10, 'boosting_type': 'Plain', 'bootstrap_type': 'Bayesian', 'bagging_temperature': 3.2200842773724117}. Best is trial 161 with value: 0.8928571428571429.
[32m[I 2023-04-25 23:51:59,287][39m Trial 454 finished with value: 0.8648648648648648 and parameters: {'objective': 'CrossEntropy', 'colsample_bylevel': 0.05113231587553071, 'depth': 10, 'boosting_type': 'Plain', 'bootstrap_type': 'Bayesian', 'bagging_temperature': 6.008916483554737}. Best is trial 161 with value: 0.8928571428571429.
[32m[I 2023-04-25 23:52:05,475][39m Trial 455 finished with value: 0.8672566371681416 and parameters: {'objective': 'Logloss', 'colsample_bylevel': 0.09320767968732872, 'depth': 11, 'boosting_type': 'Ordered', 'bootstrap_type': 'Bayesian', 'bagging_temperature': 2.632583130556331}. Best is trial 161 with value: 0.8928571428571429.
[32m[I 2023-04-25 23:52:10,393][39m Trial 456 finished with value: 0.875 and parameters: {'objective': 'Logloss', 'colsample_bylevel': 0.09012433415578844, 'depth': 7, 'boosting_type': 'Ordered', 'bootstrap_type': 'Bayesian', 'bagging_temperature': 3.0076308285073408}. Best is trial 161 with value: 0.8928571428571429.
[32m[I 2023-04-25 23:52:13,785][39m Trial 457 finished with value: 0.8672566371681416 and parameters: {'objective': 'CrossEntropy', 'colsample_bylevel': 0.07926305334396137, 'depth': 9, 'boosting_type': 'Plain', 'bootstrap_type': 'Bayesian', 'bagging_temperature': 3.104865867981429}. Best is trial 161 with value: 0.8928571428571429.
[32m[I 2023-04-25 23:52:18,669][39m Trial 458 finished with value: 0.875 and parameters: {'objective': 'Logloss', 'colsample_bylevel': 0.08916464299768904, 'depth': 7, 'boosting_type': 'Ordered', 'bootstrap_type': 'Bayesian', 'bagging_temperature': 9.23410645910907}. Best is trial 161 with value: 0.8928571428571429.
[32m[I 2023-04-25 23:52:24,195][39m Trial 459 finished with value: 0.8596491228070176 and parameters: {'objective': 'Logloss', 'colsample_bylevel': 0.08789466288068562, 'depth': 4, 'boosting_type': 'Ordered', 'bootstrap_type': 'Bayesian', 'bagging_temperature': 2.1164216672741696}. Best is trial 161 with value: 0.8928571428571429.
[32m[I 2023-04-25 23:52:30,540][39m Trial 460 finished with value: 0.875 and parameters: {'objective': 'Logloss', 'colsample_bylevel': 0.08538216929860572, 'depth': 5, 'boosting_type': 'Ordered', 'bootstrap_type': 'Bayesian', 'bagging_temperature': 8.232327064293237}. Best is trial 161 with value: 0.8928571428571429.
[32m[I 2023-04-25 23:52:36,900][39m Trial 461 finished with value: 0.8596491228070176 and parameters: {'objective': 'Logloss', 'colsample_bylevel': 0.08471645570079164, 'depth': 5, 'boosting_type': 'Ordered', 'bootstrap_type': 'Bayesian', 'bagging_temperature': 2.6451821579588315}. Best is trial 161 with value: 0.8928571428571429.
[32m[I 2023-04-25 23:52:39,462][39m Trial 462 finished with value: 0.875 and parameters: {'objective': 'CrossEntropy', 'colsample_bylevel': 0.09759877035713187, 'depth': 10, 'boosting_type': 'Plain', 'bootstrap_type': 'Bayesian', 'bagging_temperature': 3.2814306814183465}. Best is trial 161 with value: 0.8928571428571429.
