[32m[I 2023-04-23 19:42:15,878][39m A new study created in memory with name: no-name-8d059745-63f8-4709-8eb9-7dcd6f4082ab
[32m[I 2023-04-23 19:42:16,423][39m Trial 0 finished with value: 0.6153846153846153 and parameters: {'objective': 'Logloss', 'colsample_bylevel': 0.026561452270333345, 'depth': 10, 'boosting_type': 'Plain', 'bootstrap_type': 'Bayesian', 'bagging_temperature': 2.2182621685122736}. Best is trial 0 with value: 0.6153846153846153.
[32m[I 2023-04-23 19:42:18,721][39m Trial 1 finished with value: 0.6428571428571429 and parameters: {'objective': 'Logloss', 'colsample_bylevel': 0.045589559764971546, 'depth': 10, 'boosting_type': 'Ordered', 'bootstrap_type': 'MVS'}. Best is trial 1 with value: 0.6428571428571429.
[32m[I 2023-04-23 19:42:20,955][39m Trial 2 finished with value: 0.5714285714285715 and parameters: {'objective': 'CrossEntropy', 'colsample_bylevel': 0.029826962552657613, 'depth': 3, 'boosting_type': 'Ordered', 'bootstrap_type': 'Bayesian', 'bagging_temperature': 3.8554262559524477}. Best is trial 1 with value: 0.6428571428571429.
[32m[I 2023-04-23 19:42:21,512][39m Trial 3 finished with value: 0.45454545454545453 and parameters: {'objective': 'CrossEntropy', 'colsample_bylevel': 0.0799350976951313, 'depth': 3, 'boosting_type': 'Plain', 'bootstrap_type': 'Bernoulli', 'subsample': 0.890260598337649}. Best is trial 1 with value: 0.6428571428571429.
[32m[I 2023-04-23 19:42:24,436][39m Trial 4 finished with value: 0.5217391304347826 and parameters: {'objective': 'CrossEntropy', 'colsample_bylevel': 0.09845419450481173, 'depth': 12, 'boosting_type': 'Ordered', 'bootstrap_type': 'Bernoulli', 'subsample': 0.3807485854650753}. Best is trial 1 with value: 0.6428571428571429.
[32m[I 2023-04-23 19:42:28,595][39m Trial 5 finished with value: 0.5599999999999999 and parameters: {'objective': 'Logloss', 'colsample_bylevel': 0.06963515690015537, 'depth': 11, 'boosting_type': 'Ordered', 'bootstrap_type': 'MVS'}. Best is trial 1 with value: 0.6428571428571429.
[32m[I 2023-04-23 19:42:29,605][39m Trial 6 finished with value: 0.6451612903225806 and parameters: {'objective': 'Logloss', 'colsample_bylevel': 0.0445867725163506, 'depth': 2, 'boosting_type': 'Plain', 'bootstrap_type': 'MVS'}. Best is trial 6 with value: 0.6451612903225806.
[32m[I 2023-04-23 19:42:30,432][39m Trial 7 finished with value: 0.5599999999999999 and parameters: {'objective': 'Logloss', 'colsample_bylevel': 0.0856115507967039, 'depth': 2, 'boosting_type': 'Plain', 'bootstrap_type': 'Bayesian', 'bagging_temperature': 2.4300041973342292}. Best is trial 6 with value: 0.6451612903225806.
[32m[I 2023-04-23 19:42:33,400][39m Trial 8 finished with value: 0.6428571428571429 and parameters: {'objective': 'CrossEntropy', 'colsample_bylevel': 0.035850686758692685, 'depth': 9, 'boosting_type': 'Ordered', 'bootstrap_type': 'MVS'}. Best is trial 6 with value: 0.6451612903225806.
[32m[I 2023-04-23 19:42:36,019][39m Trial 9 finished with value: 0.5599999999999999 and parameters: {'objective': 'CrossEntropy', 'colsample_bylevel': 0.09663426448468829, 'depth': 2, 'boosting_type': 'Ordered', 'bootstrap_type': 'MVS'}. Best is trial 6 with value: 0.6451612903225806.
[32m[I 2023-04-23 19:42:36,534][39m Trial 10 finished with value: 0.5925925925925926 and parameters: {'objective': 'Logloss', 'colsample_bylevel': 0.011874430263808931, 'depth': 6, 'boosting_type': 'Plain', 'bootstrap_type': 'MVS'}. Best is trial 6 with value: 0.6451612903225806.
[32m[I 2023-04-23 19:42:37,400][39m Trial 11 finished with value: 0.6428571428571429 and parameters: {'objective': 'Logloss', 'colsample_bylevel': 0.05167691577870994, 'depth': 7, 'boosting_type': 'Plain', 'bootstrap_type': 'MVS'}. Best is trial 6 with value: 0.6451612903225806.
[32m[I 2023-04-23 19:42:40,207][39m Trial 12 finished with value: 0.5714285714285715 and parameters: {'objective': 'Logloss', 'colsample_bylevel': 0.05389393030789742, 'depth': 6, 'boosting_type': 'Ordered', 'bootstrap_type': 'MVS'}. Best is trial 6 with value: 0.6451612903225806.
[32m[I 2023-04-23 19:42:40,834][39m Trial 13 finished with value: 0.6451612903225806 and parameters: {'objective': 'Logloss', 'colsample_bylevel': 0.042885608058877055, 'depth': 8, 'boosting_type': 'Plain', 'bootstrap_type': 'MVS'}. Best is trial 6 with value: 0.6451612903225806.
[32m[I 2023-04-23 19:42:41,663][39m Trial 14 finished with value: 0.5185185185185186 and parameters: {'objective': 'Logloss', 'colsample_bylevel': 0.07075588353205214, 'depth': 8, 'boosting_type': 'Plain', 'bootstrap_type': 'MVS'}. Best is trial 6 with value: 0.6451612903225806.
[32m[I 2023-04-23 19:42:42,519][39m Trial 15 finished with value: 0.5925925925925926 and parameters: {'objective': 'Logloss', 'colsample_bylevel': 0.041191220314441515, 'depth': 5, 'boosting_type': 'Plain', 'bootstrap_type': 'Bernoulli', 'subsample': 0.1600884564789598}. Best is trial 6 with value: 0.6451612903225806.
[32m[I 2023-04-23 19:42:43,244][39m Trial 16 finished with value: 0.6428571428571429 and parameters: {'objective': 'Logloss', 'colsample_bylevel': 0.0629558888662509, 'depth': 4, 'boosting_type': 'Plain', 'bootstrap_type': 'MVS'}. Best is trial 6 with value: 0.6451612903225806.
[32m[I 2023-04-23 19:42:44,136][39m Trial 17 finished with value: 0.5714285714285715 and parameters: {'objective': 'Logloss', 'colsample_bylevel': 0.01859079765905083, 'depth': 1, 'boosting_type': 'Plain', 'bootstrap_type': 'MVS'}. Best is trial 6 with value: 0.6451612903225806.
[32m[I 2023-04-23 19:42:45,241][39m Trial 18 finished with value: 0.6153846153846153 and parameters: {'objective': 'Logloss', 'colsample_bylevel': 0.059845318919671736, 'depth': 8, 'boosting_type': 'Plain', 'bootstrap_type': 'Bernoulli', 'subsample': 0.9865359786244079}. Best is trial 6 with value: 0.6451612903225806.
[32m[I 2023-04-23 19:42:46,284][39m Trial 19 finished with value: 0.5925925925925926 and parameters: {'objective': 'Logloss', 'colsample_bylevel': 0.04639489901003289, 'depth': 5, 'boosting_type': 'Plain', 'bootstrap_type': 'Bayesian', 'bagging_temperature': 9.452956457393572}. Best is trial 6 with value: 0.6451612903225806.
[32m[I 2023-04-23 19:42:46,945][39m Trial 20 finished with value: 0.5925925925925926 and parameters: {'objective': 'Logloss', 'colsample_bylevel': 0.02831182008081877, 'depth': 7, 'boosting_type': 'Plain', 'bootstrap_type': 'MVS'}. Best is trial 6 with value: 0.6451612903225806.
[32m[I 2023-04-23 19:42:49,345][39m Trial 21 finished with value: 0.6428571428571429 and parameters: {'objective': 'Logloss', 'colsample_bylevel': 0.04671489772865788, 'depth': 10, 'boosting_type': 'Ordered', 'bootstrap_type': 'MVS'}. Best is trial 6 with value: 0.6451612903225806.
[32m[I 2023-04-23 19:42:53,091][39m Trial 22 finished with value: 0.6 and parameters: {'objective': 'Logloss', 'colsample_bylevel': 0.0358368054767034, 'depth': 9, 'boosting_type': 'Ordered', 'bootstrap_type': 'MVS'}. Best is trial 6 with value: 0.6451612903225806.
[32m[I 2023-04-23 19:42:53,697][39m Trial 23 finished with value: 0.64 and parameters: {'objective': 'Logloss', 'colsample_bylevel': 0.05902307616369124, 'depth': 7, 'boosting_type': 'Plain', 'bootstrap_type': 'MVS'}. Best is trial 6 with value: 0.6451612903225806.
[32m[I 2023-04-23 19:42:54,324][39m Trial 24 finished with value: 0.5185185185185186 and parameters: {'objective': 'Logloss', 'colsample_bylevel': 0.05241149938469747, 'depth': 8, 'boosting_type': 'Plain', 'bootstrap_type': 'MVS'}. Best is trial 6 with value: 0.6451612903225806.
[32m[I 2023-04-23 19:42:57,760][39m Trial 25 finished with value: 0.6 and parameters: {'objective': 'Logloss', 'colsample_bylevel': 0.040079311550036134, 'depth': 12, 'boosting_type': 'Ordered', 'bootstrap_type': 'MVS'}. Best is trial 6 with value: 0.6451612903225806.
[32m[I 2023-04-23 19:43:01,607][39m Trial 26 finished with value: 0.6666666666666665 and parameters: {'objective': 'CrossEntropy', 'colsample_bylevel': 0.046370599921742785, 'depth': 10, 'boosting_type': 'Ordered', 'bootstrap_type': 'MVS'}. Best is trial 26 with value: 0.6666666666666665.
[32m[I 2023-04-23 19:43:02,173][39m Trial 27 finished with value: 0.5333333333333333 and parameters: {'objective': 'CrossEntropy', 'colsample_bylevel': 0.021207161371643066, 'depth': 9, 'boosting_type': 'Plain', 'bootstrap_type': 'MVS'}. Best is trial 26 with value: 0.6666666666666665.
[32m[I 2023-04-23 19:43:05,454][39m Trial 28 finished with value: 0.5925925925925926 and parameters: {'objective': 'CrossEntropy', 'colsample_bylevel': 0.036493142737269356, 'depth': 11, 'boosting_type': 'Ordered', 'bootstrap_type': 'Bernoulli', 'subsample': 0.6486336021555107}. Best is trial 26 with value: 0.6666666666666665.
[32m[I 2023-04-23 19:43:06,555][39m Trial 29 finished with value: 0.5 and parameters: {'objective': 'CrossEntropy', 'colsample_bylevel': 0.03171874550735823, 'depth': 11, 'boosting_type': 'Plain', 'bootstrap_type': 'Bayesian', 'bagging_temperature': 8.427049828570548}. Best is trial 26 with value: 0.6666666666666665.
[32m[I 2023-04-23 19:43:07,203][39m Trial 30 finished with value: 0.5599999999999999 and parameters: {'objective': 'CrossEntropy', 'colsample_bylevel': 0.02315134994207053, 'depth': 5, 'boosting_type': 'Plain', 'bootstrap_type': 'Bayesian', 'bagging_temperature': 6.961976572600273}. Best is trial 26 with value: 0.6666666666666665.
[32m[I 2023-04-23 19:43:09,962][39m Trial 31 finished with value: 0.6428571428571429 and parameters: {'objective': 'Logloss', 'colsample_bylevel': 0.04757731165182758, 'depth': 9, 'boosting_type': 'Ordered', 'bootstrap_type': 'MVS'}. Best is trial 26 with value: 0.6666666666666665.
[32m[I 2023-04-23 19:43:13,652][39m Trial 32 finished with value: 0.6666666666666665 and parameters: {'objective': 'CrossEntropy', 'colsample_bylevel': 0.04458859955057496, 'depth': 9, 'boosting_type': 'Ordered', 'bootstrap_type': 'MVS'}. Best is trial 26 with value: 0.6666666666666665.
[32m[I 2023-04-23 19:43:17,446][39m Trial 33 finished with value: 0.6153846153846153 and parameters: {'objective': 'CrossEntropy', 'colsample_bylevel': 0.04152054515136699, 'depth': 10, 'boosting_type': 'Ordered', 'bootstrap_type': 'MVS'}. Best is trial 26 with value: 0.6666666666666665.
[32m[I 2023-04-23 19:43:20,850][39m Trial 34 finished with value: 0.6666666666666665 and parameters: {'objective': 'CrossEntropy', 'colsample_bylevel': 0.06598389622388465, 'depth': 8, 'boosting_type': 'Ordered', 'bootstrap_type': 'MVS'}. Best is trial 26 with value: 0.6666666666666665.
[32m[I 2023-04-23 19:43:24,422][39m Trial 35 finished with value: 0.5599999999999999 and parameters: {'objective': 'CrossEntropy', 'colsample_bylevel': 0.07040995832786667, 'depth': 10, 'boosting_type': 'Ordered', 'bootstrap_type': 'MVS'}. Best is trial 26 with value: 0.6666666666666665.
[32m[I 2023-04-23 19:43:28,699][39m Trial 36 finished with value: 0.6153846153846153 and parameters: {'objective': 'CrossEntropy', 'colsample_bylevel': 0.06305147108686385, 'depth': 11, 'boosting_type': 'Ordered', 'bootstrap_type': 'MVS'}. Best is trial 26 with value: 0.6666666666666665.
[32m[I 2023-04-23 19:43:32,792][39m Trial 37 finished with value: 0.5517241379310345 and parameters: {'objective': 'CrossEntropy', 'colsample_bylevel': 0.07869388920367976, 'depth': 1, 'boosting_type': 'Ordered', 'bootstrap_type': 'Bernoulli', 'subsample': 0.10624431732554113}. Best is trial 26 with value: 0.6666666666666665.
[32m[I 2023-04-23 19:43:37,013][39m Trial 38 finished with value: 0.6666666666666665 and parameters: {'objective': 'CrossEntropy', 'colsample_bylevel': 0.057400483242855044, 'depth': 10, 'boosting_type': 'Ordered', 'bootstrap_type': 'Bayesian', 'bagging_temperature': 0.05343168478919935}. Best is trial 26 with value: 0.6666666666666665.
[32m[I 2023-04-23 19:43:39,852][39m Trial 39 finished with value: 0.5599999999999999 and parameters: {'objective': 'CrossEntropy', 'colsample_bylevel': 0.07887473104378337, 'depth': 12, 'boosting_type': 'Ordered', 'bootstrap_type': 'Bayesian', 'bagging_temperature': 0.12880828439906475}. Best is trial 26 with value: 0.6666666666666665.
[32m[I 2023-04-23 19:43:44,069][39m Trial 40 finished with value: 0.5599999999999999 and parameters: {'objective': 'CrossEntropy', 'colsample_bylevel': 0.057489035073868724, 'depth': 9, 'boosting_type': 'Ordered', 'bootstrap_type': 'Bayesian', 'bagging_temperature': 0.5279608411780836}. Best is trial 26 with value: 0.6666666666666665.
[32m[I 2023-04-23 19:43:49,194][39m Trial 41 finished with value: 0.6666666666666665 and parameters: {'objective': 'CrossEntropy', 'colsample_bylevel': 0.06483687074180768, 'depth': 8, 'boosting_type': 'Ordered', 'bootstrap_type': 'Bayesian', 'bagging_temperature': 5.2139537591406}. Best is trial 26 with value: 0.6666666666666665.
[32m[I 2023-04-23 19:43:54,439][39m Trial 42 finished with value: 0.5833333333333334 and parameters: {'objective': 'CrossEntropy', 'colsample_bylevel': 0.0740569135250045, 'depth': 10, 'boosting_type': 'Ordered', 'bootstrap_type': 'Bayesian', 'bagging_temperature': 5.520837883481078}. Best is trial 26 with value: 0.6666666666666665.
[32m[I 2023-04-23 19:44:04,048][39m Trial 43 finished with value: 0.6153846153846153 and parameters: {'objective': 'CrossEntropy', 'colsample_bylevel': 0.06540858911008016, 'depth': 9, 'boosting_type': 'Ordered', 'bootstrap_type': 'Bayesian', 'bagging_temperature': 5.468812517777923}. Best is trial 26 with value: 0.6666666666666665.
[32m[I 2023-04-23 19:44:09,091][39m Trial 44 finished with value: 0.5384615384615384 and parameters: {'objective': 'CrossEntropy', 'colsample_bylevel': 0.05029562131070478, 'depth': 8, 'boosting_type': 'Ordered', 'bootstrap_type': 'Bayesian', 'bagging_temperature': 3.8076591951031094}. Best is trial 26 with value: 0.6666666666666665.
[32m[I 2023-04-23 19:44:13,815][39m Trial 45 finished with value: 0.5599999999999999 and parameters: {'objective': 'CrossEntropy', 'colsample_bylevel': 0.08790930274921238, 'depth': 10, 'boosting_type': 'Ordered', 'bootstrap_type': 'Bayesian', 'bagging_temperature': 7.059109273509622}. Best is trial 26 with value: 0.6666666666666665.
[32m[I 2023-04-23 19:44:19,538][39m Trial 46 finished with value: 0.5599999999999999 and parameters: {'objective': 'CrossEntropy', 'colsample_bylevel': 0.06644600724112638, 'depth': 11, 'boosting_type': 'Ordered', 'bootstrap_type': 'Bayesian', 'bagging_temperature': 2.74741574655221}. Best is trial 26 with value: 0.6666666666666665.
[32m[I 2023-04-23 19:44:25,095][39m Trial 47 finished with value: 0.5384615384615384 and parameters: {'objective': 'CrossEntropy', 'colsample_bylevel': 0.05563475823987253, 'depth': 7, 'boosting_type': 'Ordered', 'bootstrap_type': 'Bayesian', 'bagging_temperature': 6.626860046622214}. Best is trial 26 with value: 0.6666666666666665.
[32m[I 2023-04-23 19:44:31,742][39m Trial 48 finished with value: 0.6153846153846153 and parameters: {'objective': 'CrossEntropy', 'colsample_bylevel': 0.07345672074210577, 'depth': 6, 'boosting_type': 'Ordered', 'bootstrap_type': 'Bayesian', 'bagging_temperature': 1.3366094595813578}. Best is trial 26 with value: 0.6666666666666665.
[32m[I 2023-04-23 19:44:38,582][39m Trial 49 finished with value: 0.5599999999999999 and parameters: {'objective': 'CrossEntropy', 'colsample_bylevel': 0.06098414478081827, 'depth': 8, 'boosting_type': 'Ordered', 'bootstrap_type': 'Bernoulli', 'subsample': 0.5460593929097769}. Best is trial 26 with value: 0.6666666666666665.
[32m[I 2023-04-23 19:44:43,910][39m Trial 50 finished with value: 0.5185185185185186 and parameters: {'objective': 'CrossEntropy', 'colsample_bylevel': 0.06612264727577472, 'depth': 10, 'boosting_type': 'Ordered', 'bootstrap_type': 'Bayesian', 'bagging_temperature': 4.046723619407933}. Best is trial 26 with value: 0.6666666666666665.
[32m[I 2023-04-23 19:44:49,668][39m Trial 51 finished with value: 0.6666666666666665 and parameters: {'objective': 'CrossEntropy', 'colsample_bylevel': 0.04929975487753575, 'depth': 3, 'boosting_type': 'Ordered', 'bootstrap_type': 'MVS'}. Best is trial 26 with value: 0.6666666666666665.
[32m[I 2023-04-23 19:44:56,999][39m Trial 52 finished with value: 0.6666666666666665 and parameters: {'objective': 'CrossEntropy', 'colsample_bylevel': 0.05005193250830937, 'depth': 9, 'boosting_type': 'Ordered', 'bootstrap_type': 'MVS'}. Best is trial 26 with value: 0.6666666666666665.
[32m[I 2023-04-23 19:45:03,198][39m Trial 53 finished with value: 0.6666666666666665 and parameters: {'objective': 'CrossEntropy', 'colsample_bylevel': 0.054580675388990335, 'depth': 8, 'boosting_type': 'Ordered', 'bootstrap_type': 'MVS'}. Best is trial 26 with value: 0.6666666666666665.
[32m[I 2023-04-23 19:45:09,374][39m Trial 54 finished with value: 0.6666666666666665 and parameters: {'objective': 'CrossEntropy', 'colsample_bylevel': 0.04611428230822616, 'depth': 3, 'boosting_type': 'Ordered', 'bootstrap_type': 'MVS'}. Best is trial 26 with value: 0.6666666666666665.
[32m[I 2023-04-23 19:45:14,851][39m Trial 55 finished with value: 0.6666666666666665 and parameters: {'objective': 'CrossEntropy', 'colsample_bylevel': 0.050201984034664, 'depth': 3, 'boosting_type': 'Ordered', 'bootstrap_type': 'MVS'}. Best is trial 26 with value: 0.6666666666666665.
[32m[I 2023-04-23 19:45:19,924][39m Trial 56 finished with value: 0.6666666666666665 and parameters: {'objective': 'CrossEntropy', 'colsample_bylevel': 0.050437268778519645, 'depth': 3, 'boosting_type': 'Ordered', 'bootstrap_type': 'MVS'}. Best is trial 26 with value: 0.6666666666666665.
[32m[I 2023-04-23 19:45:25,289][39m Trial 57 finished with value: 0.6666666666666665 and parameters: {'objective': 'CrossEntropy', 'colsample_bylevel': 0.05006992001666673, 'depth': 3, 'boosting_type': 'Ordered', 'bootstrap_type': 'MVS'}. Best is trial 26 with value: 0.6666666666666665.
[32m[I 2023-04-23 19:45:31,391][39m Trial 58 finished with value: 0.6666666666666665 and parameters: {'objective': 'CrossEntropy', 'colsample_bylevel': 0.05676035392609281, 'depth': 4, 'boosting_type': 'Ordered', 'bootstrap_type': 'MVS'}. Best is trial 26 with value: 0.6666666666666665.
[32m[I 2023-04-23 19:45:38,328][39m Trial 59 finished with value: 0.5833333333333334 and parameters: {'objective': 'CrossEntropy', 'colsample_bylevel': 0.057601489937468005, 'depth': 4, 'boosting_type': 'Ordered', 'bootstrap_type': 'Bernoulli', 'subsample': 0.7360214781261857}. Best is trial 26 with value: 0.6666666666666665.
[32m[I 2023-04-23 19:45:42,829][39m Trial 60 finished with value: 0.6153846153846153 and parameters: {'objective': 'CrossEntropy', 'colsample_bylevel': 0.03779999569026816, 'depth': 3, 'boosting_type': 'Ordered', 'bootstrap_type': 'MVS'}. Best is trial 26 with value: 0.6666666666666665.
[32m[I 2023-04-23 19:45:48,355][39m Trial 61 finished with value: 0.5714285714285715 and parameters: {'objective': 'CrossEntropy', 'colsample_bylevel': 0.04432089597207743, 'depth': 2, 'boosting_type': 'Ordered', 'bootstrap_type': 'MVS'}. Best is trial 26 with value: 0.6666666666666665.
[32m[I 2023-04-23 19:45:54,072][39m Trial 62 finished with value: 0.6 and parameters: {'objective': 'CrossEntropy', 'colsample_bylevel': 0.03278961507413517, 'depth': 2, 'boosting_type': 'Ordered', 'bootstrap_type': 'MVS'}. Best is trial 26 with value: 0.6666666666666665.
[32m[I 2023-04-23 19:45:59,029][39m Trial 63 finished with value: 0.6 and parameters: {'objective': 'CrossEntropy', 'colsample_bylevel': 0.053414584354661114, 'depth': 4, 'boosting_type': 'Ordered', 'bootstrap_type': 'MVS'}. Best is trial 26 with value: 0.6666666666666665.
[32m[I 2023-04-23 19:46:04,559][39m Trial 64 finished with value: 0.5599999999999999 and parameters: {'objective': 'CrossEntropy', 'colsample_bylevel': 0.06238966234583811, 'depth': 4, 'boosting_type': 'Ordered', 'bootstrap_type': 'MVS'}. Best is trial 26 with value: 0.6666666666666665.
[32m[I 2023-04-23 19:46:09,820][39m Trial 65 finished with value: 0.6666666666666665 and parameters: {'objective': 'CrossEntropy', 'colsample_bylevel': 0.05451252933805659, 'depth': 7, 'boosting_type': 'Ordered', 'bootstrap_type': 'MVS'}. Best is trial 26 with value: 0.6666666666666665.
[32m[I 2023-04-23 19:46:14,100][39m Trial 66 finished with value: 0.6428571428571429 and parameters: {'objective': 'CrossEntropy', 'colsample_bylevel': 0.04359226693777271, 'depth': 3, 'boosting_type': 'Ordered', 'bootstrap_type': 'MVS'}. Best is trial 26 with value: 0.6666666666666665.
[32m[I 2023-04-23 19:46:19,742][39m Trial 67 finished with value: 0.6666666666666665 and parameters: {'objective': 'CrossEntropy', 'colsample_bylevel': 0.04863306267715968, 'depth': 9, 'boosting_type': 'Ordered', 'bootstrap_type': 'MVS'}. Best is trial 26 with value: 0.6666666666666665.
[32m[I 2023-04-23 19:46:24,900][39m Trial 68 finished with value: 0.5 and parameters: {'objective': 'CrossEntropy', 'colsample_bylevel': 0.039708619062915805, 'depth': 9, 'boosting_type': 'Ordered', 'bootstrap_type': 'Bayesian', 'bagging_temperature': 4.951805568028097}. Best is trial 26 with value: 0.6666666666666665.
[32m[I 2023-04-23 19:46:30,123][39m Trial 69 finished with value: 0.6666666666666665 and parameters: {'objective': 'CrossEntropy', 'colsample_bylevel': 0.06025130466167228, 'depth': 8, 'boosting_type': 'Ordered', 'bootstrap_type': 'MVS'}. Best is trial 26 with value: 0.6666666666666665.
Number of finished trials: 70
F1 Train:	79.93% (std: 8.93%)
