[32m[I 2023-04-21 02:38:10,158][39m Trial 3366 finished with value: 0.8409090909090909 and parameters: {'objective': 'CrossEntropy', 'colsample_bylevel': 0.08309923876286544, 'depth': 11, 'boosting_type': 'Plain', 'bootstrap_type': 'Bayesian', 'bagging_temperature': 9.41073800518975}. Best is trial 3065 with value: 0.8863636363636364.
[32m[I 2023-04-21 02:38:11,115][39m Trial 3367 finished with value: 0.8275862068965518 and parameters: {'objective': 'Logloss', 'colsample_bylevel': 0.07220066311553597, 'depth': 10, 'boosting_type': 'Plain', 'bootstrap_type': 'Bayesian', 'bagging_temperature': 9.298884646348618}. Best is trial 3065 with value: 0.8863636363636364.
[32m[I 2023-04-21 02:38:12,261][39m Trial 3368 finished with value: 0.8275862068965518 and parameters: {'objective': 'CrossEntropy', 'colsample_bylevel': 0.07478028739700443, 'depth': 12, 'boosting_type': 'Plain', 'bootstrap_type': 'MVS'}. Best is trial 3065 with value: 0.8863636363636364.
[32m[I 2023-04-21 02:38:13,350][39m Trial 3369 finished with value: 0.8181818181818182 and parameters: {'objective': 'CrossEntropy', 'colsample_bylevel': 0.07191309467790262, 'depth': 4, 'boosting_type': 'Plain', 'bootstrap_type': 'Bernoulli', 'subsample': 0.3824086490497646}. Best is trial 3065 with value: 0.8863636363636364.
[32m[I 2023-04-21 02:38:14,057][39m Trial 3370 finished with value: 0.8505747126436782 and parameters: {'objective': 'Logloss', 'colsample_bylevel': 0.07034018541169694, 'depth': 3, 'boosting_type': 'Plain', 'bootstrap_type': 'Bayesian', 'bagging_temperature': 9.164172831275437}. Best is trial 3065 with value: 0.8863636363636364.
[32m[I 2023-04-21 02:38:14,707][39m Trial 3371 finished with value: 0.8666666666666666 and parameters: {'objective': 'CrossEntropy', 'colsample_bylevel': 0.06937622542203194, 'depth': 12, 'boosting_type': 'Plain', 'bootstrap_type': 'Bayesian', 'bagging_temperature': 9.084306148744165}. Best is trial 3065 with value: 0.8863636363636364.
[32m[I 2023-04-21 02:38:15,671][39m Trial 3372 finished with value: 0.8539325842696629 and parameters: {'objective': 'CrossEntropy', 'colsample_bylevel': 0.07715981633292553, 'depth': 9, 'boosting_type': 'Plain', 'bootstrap_type': 'Bayesian', 'bagging_temperature': 9.201558963403617}. Best is trial 3065 with value: 0.8863636363636364.
[32m[I 2023-04-21 02:38:17,197][39m Trial 3373 finished with value: 0.8409090909090909 and parameters: {'objective': 'CrossEntropy', 'colsample_bylevel': 0.08240378394677877, 'depth': 8, 'boosting_type': 'Plain', 'bootstrap_type': 'Bayesian', 'bagging_temperature': 8.982758536589163}. Best is trial 3065 with value: 0.8863636363636364.
[32m[I 2023-04-21 02:38:18,441][39m Trial 3374 finished with value: 0.8409090909090909 and parameters: {'objective': 'CrossEntropy', 'colsample_bylevel': 0.07551379612868397, 'depth': 9, 'boosting_type': 'Plain', 'bootstrap_type': 'Bayesian', 'bagging_temperature': 9.794712509885475}. Best is trial 3065 with value: 0.8863636363636364.
[32m[I 2023-04-21 02:38:19,407][39m Trial 3375 finished with value: 0.8409090909090909 and parameters: {'objective': 'Logloss', 'colsample_bylevel': 0.07480153281246274, 'depth': 10, 'boosting_type': 'Plain', 'bootstrap_type': 'Bayesian', 'bagging_temperature': 7.7205295198494825}. Best is trial 3065 with value: 0.8863636363636364.
[32m[I 2023-04-21 02:38:20,097][39m Trial 3376 finished with value: 0.8275862068965518 and parameters: {'objective': 'CrossEntropy', 'colsample_bylevel': 0.07558463339050084, 'depth': 11, 'boosting_type': 'Plain', 'bootstrap_type': 'MVS'}. Best is trial 3065 with value: 0.8863636363636364.
[32m[I 2023-04-21 02:38:20,739][39m Trial 3377 finished with value: 0.8139534883720929 and parameters: {'objective': 'CrossEntropy', 'colsample_bylevel': 0.07675554815199091, 'depth': 8, 'boosting_type': 'Plain', 'bootstrap_type': 'Bayesian', 'bagging_temperature': 8.088239881643798}. Best is trial 3065 with value: 0.8863636363636364.
[32m[I 2023-04-21 02:38:21,560][39m Trial 3378 finished with value: 0.8409090909090909 and parameters: {'objective': 'CrossEntropy', 'colsample_bylevel': 0.08195795460822627, 'depth': 10, 'boosting_type': 'Plain', 'bootstrap_type': 'Bayesian', 'bagging_temperature': 9.56512671077025}. Best is trial 3065 with value: 0.8863636363636364.
[32m[I 2023-04-21 02:38:22,455][39m Trial 3379 finished with value: 0.8539325842696629 and parameters: {'objective': 'Logloss', 'colsample_bylevel': 0.07208676717260178, 'depth': 4, 'boosting_type': 'Plain', 'bootstrap_type': 'Bayesian', 'bagging_temperature': 9.996917216247523}. Best is trial 3065 with value: 0.8863636363636364.
[32m[I 2023-04-21 02:38:23,404][39m Trial 3380 finished with value: 0.8666666666666666 and parameters: {'objective': 'CrossEntropy', 'colsample_bylevel': 0.06317630309037485, 'depth': 11, 'boosting_type': 'Plain', 'bootstrap_type': 'Bayesian', 'bagging_temperature': 5.563998366077858}. Best is trial 3065 with value: 0.8863636363636364.
[32m[I 2023-04-21 02:38:24,369][39m Trial 3381 finished with value: 0.8666666666666666 and parameters: {'objective': 'Logloss', 'colsample_bylevel': 0.07137930850624948, 'depth': 10, 'boosting_type': 'Plain', 'bootstrap_type': 'Bayesian', 'bagging_temperature': 9.411993087826866}. Best is trial 3065 with value: 0.8863636363636364.
[32m[I 2023-04-21 02:38:25,571][39m Trial 3382 finished with value: 0.8409090909090909 and parameters: {'objective': 'Logloss', 'colsample_bylevel': 0.07398166125772554, 'depth': 12, 'boosting_type': 'Plain', 'bootstrap_type': 'Bayesian', 'bagging_temperature': 8.03891560421453}. Best is trial 3065 with value: 0.8863636363636364.
[32m[I 2023-04-21 02:38:26,586][39m Trial 3383 finished with value: 0.8791208791208791 and parameters: {'objective': 'CrossEntropy', 'colsample_bylevel': 0.0767957877410889, 'depth': 3, 'boosting_type': 'Plain', 'bootstrap_type': 'MVS'}. Best is trial 3065 with value: 0.8863636363636364.
[32m[I 2023-04-21 02:38:27,569][39m Trial 3384 finished with value: 0.8275862068965518 and parameters: {'objective': 'CrossEntropy', 'colsample_bylevel': 0.07684493165280325, 'depth': 4, 'boosting_type': 'Plain', 'bootstrap_type': 'Bayesian', 'bagging_temperature': 9.583080736889226}. Best is trial 3065 with value: 0.8863636363636364.
[32m[I 2023-04-21 02:38:28,413][39m Trial 3385 finished with value: 0.8539325842696629 and parameters: {'objective': 'Logloss', 'colsample_bylevel': 0.07374771976717867, 'depth': 11, 'boosting_type': 'Plain', 'bootstrap_type': 'Bayesian', 'bagging_temperature': 8.49619773674748}. Best is trial 3065 with value: 0.8863636363636364.
[32m[I 2023-04-21 02:38:32,947][39m Trial 3386 finished with value: 0.8409090909090909 and parameters: {'objective': 'CrossEntropy', 'colsample_bylevel': 0.07818695048360155, 'depth': 10, 'boosting_type': 'Ordered', 'bootstrap_type': 'Bayesian', 'bagging_temperature': 9.768755546725243}. Best is trial 3065 with value: 0.8863636363636364.
[32m[I 2023-04-21 02:38:34,040][39m Trial 3387 finished with value: 0.8636363636363636 and parameters: {'objective': 'CrossEntropy', 'colsample_bylevel': 0.07784379476653006, 'depth': 12, 'boosting_type': 'Plain', 'bootstrap_type': 'Bayesian', 'bagging_temperature': 9.744158808208459}. Best is trial 3065 with value: 0.8863636363636364.
[32m[I 2023-04-21 02:38:35,155][39m Trial 3388 finished with value: 0.8539325842696629 and parameters: {'objective': 'CrossEntropy', 'colsample_bylevel': 0.0678288416068835, 'depth': 8, 'boosting_type': 'Plain', 'bootstrap_type': 'Bayesian', 'bagging_temperature': 9.361918591420032}. Best is trial 3065 with value: 0.8863636363636364.
[32m[I 2023-04-21 02:38:35,887][39m Trial 3389 finished with value: 0.8539325842696629 and parameters: {'objective': 'CrossEntropy', 'colsample_bylevel': 0.07951217190009062, 'depth': 2, 'boosting_type': 'Plain', 'bootstrap_type': 'Bayesian', 'bagging_temperature': 7.807134903054173}. Best is trial 3065 with value: 0.8863636363636364.
[32m[I 2023-04-21 02:38:37,096][39m Trial 3390 finished with value: 0.8409090909090909 and parameters: {'objective': 'CrossEntropy', 'colsample_bylevel': 0.08240261780627857, 'depth': 8, 'boosting_type': 'Plain', 'bootstrap_type': 'Bayesian', 'bagging_temperature': 8.78321876670876}. Best is trial 3065 with value: 0.8863636363636364.
[32m[I 2023-04-21 02:38:38,419][39m Trial 3391 finished with value: 0.8409090909090909 and parameters: {'objective': 'CrossEntropy', 'colsample_bylevel': 0.07604136284726229, 'depth': 11, 'boosting_type': 'Plain', 'bootstrap_type': 'Bayesian', 'bagging_temperature': 9.437158934935729}. Best is trial 3065 with value: 0.8863636363636364.
[32m[I 2023-04-21 02:38:39,503][39m Trial 3392 finished with value: 0.8791208791208791 and parameters: {'objective': 'CrossEntropy', 'colsample_bylevel': 0.08060297235623912, 'depth': 3, 'boosting_type': 'Plain', 'bootstrap_type': 'Bayesian', 'bagging_temperature': 9.197615944496725}. Best is trial 3065 with value: 0.8863636363636364.
[32m[I 2023-04-21 02:38:40,507][39m Trial 3393 finished with value: 0.8791208791208791 and parameters: {'objective': 'CrossEntropy', 'colsample_bylevel': 0.08061519894165405, 'depth': 3, 'boosting_type': 'Plain', 'bootstrap_type': 'Bayesian', 'bagging_temperature': 9.060954122637728}. Best is trial 3065 with value: 0.8863636363636364.
[32m[I 2023-04-21 02:38:41,385][39m Trial 3394 finished with value: 0.8409090909090909 and parameters: {'objective': 'CrossEntropy', 'colsample_bylevel': 0.053144543779399846, 'depth': 2, 'boosting_type': 'Plain', 'bootstrap_type': 'Bayesian', 'bagging_temperature': 9.682179586421064}. Best is trial 3065 with value: 0.8863636363636364.
[32m[I 2023-04-21 02:38:42,213][39m Trial 3395 finished with value: 0.8409090909090909 and parameters: {'objective': 'CrossEntropy', 'colsample_bylevel': 0.0793423743368446, 'depth': 10, 'boosting_type': 'Plain', 'bootstrap_type': 'Bayesian', 'bagging_temperature': 8.634013670291418}. Best is trial 3065 with value: 0.8863636363636364.
[32m[I 2023-04-21 02:38:42,946][39m Trial 3396 finished with value: 0.8409090909090909 and parameters: {'objective': 'Logloss', 'colsample_bylevel': 0.07024482780799203, 'depth': 9, 'boosting_type': 'Plain', 'bootstrap_type': 'Bayesian', 'bagging_temperature': 9.367762811830104}. Best is trial 3065 with value: 0.8863636363636364.
[32m[I 2023-04-21 02:38:43,739][39m Trial 3397 finished with value: 0.8275862068965518 and parameters: {'objective': 'CrossEntropy', 'colsample_bylevel': 0.07663609747232031, 'depth': 11, 'boosting_type': 'Plain', 'bootstrap_type': 'Bayesian', 'bagging_temperature': 9.587402247350111}. Best is trial 3065 with value: 0.8863636363636364.
[32m[I 2023-04-21 02:38:44,530][39m Trial 3398 finished with value: 0.8539325842696629 and parameters: {'objective': 'Logloss', 'colsample_bylevel': 0.09338800643570726, 'depth': 8, 'boosting_type': 'Plain', 'bootstrap_type': 'Bayesian', 'bagging_temperature': 8.211918815461685}. Best is trial 3065 with value: 0.8863636363636364.
[32m[I 2023-04-21 02:38:45,277][39m Trial 3399 finished with value: 0.8275862068965518 and parameters: {'objective': 'Logloss', 'colsample_bylevel': 0.07495386352737682, 'depth': 10, 'boosting_type': 'Plain', 'bootstrap_type': 'Bayesian', 'bagging_temperature': 7.20982092675392}. Best is trial 3065 with value: 0.8863636363636364.
[32m[I 2023-04-21 02:38:46,551][39m Trial 3400 finished with value: 0.8791208791208791 and parameters: {'objective': 'CrossEntropy', 'colsample_bylevel': 0.06599574776213789, 'depth': 9, 'boosting_type': 'Plain', 'bootstrap_type': 'Bayesian', 'bagging_temperature': 9.461214764361143}. Best is trial 3065 with value: 0.8863636363636364.
[32m[I 2023-04-21 02:38:47,558][39m Trial 3401 finished with value: 0.8275862068965518 and parameters: {'objective': 'Logloss', 'colsample_bylevel': 0.06252095780051356, 'depth': 4, 'boosting_type': 'Plain', 'bootstrap_type': 'Bernoulli', 'subsample': 0.9057519898129637}. Best is trial 3065 with value: 0.8863636363636364.
[32m[I 2023-04-21 02:38:48,732][39m Trial 3402 finished with value: 0.8666666666666666 and parameters: {'objective': 'CrossEntropy', 'colsample_bylevel': 0.0839916067689759, 'depth': 2, 'boosting_type': 'Plain', 'bootstrap_type': 'Bayesian', 'bagging_temperature': 9.257814235639856}. Best is trial 3065 with value: 0.8863636363636364.
[32m[I 2023-04-21 02:38:49,744][39m Trial 3403 finished with value: 0.8275862068965518 and parameters: {'objective': 'CrossEntropy', 'colsample_bylevel': 0.07396370931772211, 'depth': 9, 'boosting_type': 'Plain', 'bootstrap_type': 'MVS'}. Best is trial 3065 with value: 0.8863636363636364.
[32m[I 2023-04-21 02:38:54,335][39m Trial 3404 finished with value: 0.8275862068965518 and parameters: {'objective': 'CrossEntropy', 'colsample_bylevel': 0.07345944459034628, 'depth': 11, 'boosting_type': 'Ordered', 'bootstrap_type': 'Bayesian', 'bagging_temperature': 8.58773126405005}. Best is trial 3065 with value: 0.8863636363636364.
[32m[I 2023-04-21 02:38:55,349][39m Trial 3405 finished with value: 0.8409090909090909 and parameters: {'objective': 'CrossEntropy', 'colsample_bylevel': 0.07847487098458346, 'depth': 11, 'boosting_type': 'Plain', 'bootstrap_type': 'Bayesian', 'bagging_temperature': 9.549098963665607}. Best is trial 3065 with value: 0.8863636363636364.
[32m[I 2023-04-21 02:38:56,600][39m Trial 3406 finished with value: 0.8666666666666666 and parameters: {'objective': 'CrossEntropy', 'colsample_bylevel': 0.07547027999764401, 'depth': 9, 'boosting_type': 'Plain', 'bootstrap_type': 'Bayesian', 'bagging_temperature': 9.135187600432895}. Best is trial 3065 with value: 0.8863636363636364.
[32m[I 2023-04-21 02:38:57,619][39m Trial 3407 finished with value: 0.8409090909090909 and parameters: {'objective': 'CrossEntropy', 'colsample_bylevel': 0.06820444530320731, 'depth': 10, 'boosting_type': 'Plain', 'bootstrap_type': 'Bayesian', 'bagging_temperature': 0.8649384989189413}. Best is trial 3065 with value: 0.8863636363636364.
[32m[I 2023-04-21 02:38:58,467][39m Trial 3408 finished with value: 0.8505747126436782 and parameters: {'objective': 'CrossEntropy', 'colsample_bylevel': 0.07151875812582759, 'depth': 10, 'boosting_type': 'Plain', 'bootstrap_type': 'Bayesian', 'bagging_temperature': 8.950172962052989}. Best is trial 3065 with value: 0.8863636363636364.
[32m[I 2023-04-21 02:38:59,383][39m Trial 3409 finished with value: 0.8539325842696629 and parameters: {'objective': 'CrossEntropy', 'colsample_bylevel': 0.07729730907808063, 'depth': 9, 'boosting_type': 'Plain', 'bootstrap_type': 'Bayesian', 'bagging_temperature': 9.690226484039274}. Best is trial 3065 with value: 0.8863636363636364.
[32m[I 2023-04-21 02:39:00,586][39m Trial 3410 finished with value: 0.8505747126436782 and parameters: {'objective': 'CrossEntropy', 'colsample_bylevel': 0.08576920698409829, 'depth': 8, 'boosting_type': 'Plain', 'bootstrap_type': 'Bayesian', 'bagging_temperature': 9.047160387742938}. Best is trial 3065 with value: 0.8863636363636364.
[32m[I 2023-04-21 02:39:01,667][39m Trial 3411 finished with value: 0.8275862068965518 and parameters: {'objective': 'CrossEntropy', 'colsample_bylevel': 0.07015256420601851, 'depth': 7, 'boosting_type': 'Plain', 'bootstrap_type': 'MVS'}. Best is trial 3065 with value: 0.8863636363636364.
[32m[I 2023-04-21 02:39:03,103][39m Trial 3412 finished with value: 0.8409090909090909 and parameters: {'objective': 'CrossEntropy', 'colsample_bylevel': 0.0723433435523527, 'depth': 9, 'boosting_type': 'Plain', 'bootstrap_type': 'Bayesian', 'bagging_temperature': 9.340345213814569}. Best is trial 3065 with value: 0.8863636363636364.
[32m[I 2023-04-21 02:39:03,821][39m Trial 3413 finished with value: 0.8505747126436782 and parameters: {'objective': 'CrossEntropy', 'colsample_bylevel': 0.08757392660638001, 'depth': 11, 'boosting_type': 'Plain', 'bootstrap_type': 'Bayesian', 'bagging_temperature': 9.582166681691508}. Best is trial 3065 with value: 0.8863636363636364.
[32m[I 2023-04-21 02:39:04,498][39m Trial 3414 finished with value: 0.8539325842696629 and parameters: {'objective': 'CrossEntropy', 'colsample_bylevel': 0.07900947723567485, 'depth': 11, 'boosting_type': 'Plain', 'bootstrap_type': 'Bayesian', 'bagging_temperature': 9.98948460460972}. Best is trial 3065 with value: 0.8863636363636364.
[32m[I 2023-04-21 02:39:05,587][39m Trial 3415 finished with value: 0.8636363636363636 and parameters: {'objective': 'CrossEntropy', 'colsample_bylevel': 0.07569746666270394, 'depth': 10, 'boosting_type': 'Plain', 'bootstrap_type': 'Bayesian', 'bagging_temperature': 9.483196835290846}. Best is trial 3065 with value: 0.8863636363636364.
[32m[I 2023-04-21 02:39:06,286][39m Trial 3416 finished with value: 0.8409090909090909 and parameters: {'objective': 'CrossEntropy', 'colsample_bylevel': 0.09150009954387642, 'depth': 12, 'boosting_type': 'Plain', 'bootstrap_type': 'Bayesian', 'bagging_temperature': 8.675329794032612}. Best is trial 3065 with value: 0.8863636363636364.
[32m[I 2023-04-21 02:39:07,637][39m Trial 3417 finished with value: 0.8666666666666666 and parameters: {'objective': 'CrossEntropy', 'colsample_bylevel': 0.09008951444280028, 'depth': 3, 'boosting_type': 'Plain', 'bootstrap_type': 'Bayesian', 'bagging_temperature': 8.317176140570005}. Best is trial 3065 with value: 0.8863636363636364.
[32m[I 2023-04-21 02:39:08,909][39m Trial 3418 finished with value: 0.8409090909090909 and parameters: {'objective': 'CrossEntropy', 'colsample_bylevel': 0.07178197745769531, 'depth': 12, 'boosting_type': 'Plain', 'bootstrap_type': 'Bayesian', 'bagging_temperature': 9.238326145457595}. Best is trial 3065 with value: 0.8863636363636364.
[32m[I 2023-04-21 02:39:09,748][39m Trial 3419 finished with value: 0.8314606741573034 and parameters: {'objective': 'Logloss', 'colsample_bylevel': 0.07317646851171722, 'depth': 10, 'boosting_type': 'Plain', 'bootstrap_type': 'Bayesian', 'bagging_temperature': 7.761577192432808}. Best is trial 3065 with value: 0.8863636363636364.
[32m[I 2023-04-21 02:39:10,386][39m Trial 3420 finished with value: 0.8275862068965518 and parameters: {'objective': 'Logloss', 'colsample_bylevel': 0.07418838906995, 'depth': 10, 'boosting_type': 'Plain', 'bootstrap_type': 'Bayesian', 'bagging_temperature': 9.713055074507462}. Best is trial 3065 with value: 0.8863636363636364.
[32m[I 2023-04-21 02:39:11,494][39m Trial 3421 finished with value: 0.8666666666666666 and parameters: {'objective': 'Logloss', 'colsample_bylevel': 0.07125989552185821, 'depth': 4, 'boosting_type': 'Plain', 'bootstrap_type': 'Bayesian', 'bagging_temperature': 9.871571740491307}. Best is trial 3065 with value: 0.8863636363636364.
[32m[I 2023-04-21 02:39:12,525][39m Trial 3422 finished with value: 0.8409090909090909 and parameters: {'objective': 'Logloss', 'colsample_bylevel': 0.07261733678197722, 'depth': 10, 'boosting_type': 'Plain', 'bootstrap_type': 'Bayesian', 'bagging_temperature': 9.125890170167233}. Best is trial 3065 with value: 0.8863636363636364.
[32m[I 2023-04-21 02:39:13,201][39m Trial 3423 finished with value: 0.8539325842696629 and parameters: {'objective': 'CrossEntropy', 'colsample_bylevel': 0.07572402076615616, 'depth': 10, 'boosting_type': 'Plain', 'bootstrap_type': 'Bayesian', 'bagging_temperature': 8.36617474582186}. Best is trial 3065 with value: 0.8863636363636364.
[32m[I 2023-04-21 02:39:18,335][39m Trial 3424 finished with value: 0.8409090909090909 and parameters: {'objective': 'CrossEntropy', 'colsample_bylevel': 0.09457511461544273, 'depth': 3, 'boosting_type': 'Ordered', 'bootstrap_type': 'Bayesian', 'bagging_temperature': 9.664438733146811}. Best is trial 3065 with value: 0.8863636363636364.
[32m[I 2023-04-21 02:39:19,400][39m Trial 3425 finished with value: 0.8666666666666666 and parameters: {'objective': 'CrossEntropy', 'colsample_bylevel': 0.06656459059836597, 'depth': 12, 'boosting_type': 'Plain', 'bootstrap_type': 'Bayesian', 'bagging_temperature': 9.551321685027546}. Best is trial 3065 with value: 0.8863636363636364.
[32m[I 2023-04-21 02:39:20,201][39m Trial 3426 finished with value: 0.8666666666666666 and parameters: {'objective': 'Logloss', 'colsample_bylevel': 0.07306040375379101, 'depth': 10, 'boosting_type': 'Plain', 'bootstrap_type': 'Bayesian', 'bagging_temperature': 9.376883586340425}. Best is trial 3065 with value: 0.8863636363636364.
[32m[I 2023-04-21 02:39:21,203][39m Trial 3427 finished with value: 0.8791208791208791 and parameters: {'objective': 'CrossEntropy', 'colsample_bylevel': 0.0843220460239048, 'depth': 3, 'boosting_type': 'Plain', 'bootstrap_type': 'Bayesian', 'bagging_temperature': 9.83418840952961}. Best is trial 3065 with value: 0.8863636363636364.
[32m[I 2023-04-21 02:39:22,161][39m Trial 3428 finished with value: 0.8181818181818182 and parameters: {'objective': 'Logloss', 'colsample_bylevel': 0.07217507316103146, 'depth': 4, 'boosting_type': 'Plain', 'bootstrap_type': 'Bernoulli', 'subsample': 0.5736669603454173}. Best is trial 3065 with value: 0.8863636363636364.
[32m[I 2023-04-21 02:39:23,148][39m Trial 3429 finished with value: 0.8539325842696629 and parameters: {'objective': 'CrossEntropy', 'colsample_bylevel': 0.059823247156565874, 'depth': 10, 'boosting_type': 'Plain', 'bootstrap_type': 'Bayesian', 'bagging_temperature': 9.666444103122126}. Best is trial 3065 with value: 0.8863636363636364.
[32m[I 2023-04-21 02:39:23,986][39m Trial 3430 finished with value: 0.8275862068965518 and parameters: {'objective': 'CrossEntropy', 'colsample_bylevel': 0.07983534775555136, 'depth': 10, 'boosting_type': 'Plain', 'bootstrap_type': 'Bayesian', 'bagging_temperature': 9.066123172169812}. Best is trial 3065 with value: 0.8863636363636364.
