[32m[I 2023-04-21 03:08:36,547][39m Trial 4869 finished with value: 0.8666666666666666 and parameters: {'objective': 'Logloss', 'colsample_bylevel': 0.06985376184000174, 'depth': 10, 'boosting_type': 'Plain', 'bootstrap_type': 'Bayesian', 'bagging_temperature': 9.178142627244702}. Best is trial 3065 with value: 0.8863636363636364.
[32m[I 2023-04-21 03:08:37,747][39m Trial 4870 finished with value: 0.8539325842696629 and parameters: {'objective': 'CrossEntropy', 'colsample_bylevel': 0.09022994559301538, 'depth': 3, 'boosting_type': 'Plain', 'bootstrap_type': 'Bayesian', 'bagging_temperature': 5.580287402797618}. Best is trial 3065 with value: 0.8863636363636364.
[32m[I 2023-04-21 03:08:38,634][39m Trial 4871 finished with value: 0.8735632183908046 and parameters: {'objective': 'CrossEntropy', 'colsample_bylevel': 0.08490920739293413, 'depth': 2, 'boosting_type': 'Plain', 'bootstrap_type': 'Bayesian', 'bagging_temperature': 9.633456926811126}. Best is trial 3065 with value: 0.8863636363636364.
[32m[I 2023-04-21 03:08:39,551][39m Trial 4872 finished with value: 0.8409090909090909 and parameters: {'objective': 'CrossEntropy', 'colsample_bylevel': 0.07874205815959508, 'depth': 10, 'boosting_type': 'Plain', 'bootstrap_type': 'Bayesian', 'bagging_temperature': 9.259934969492557}. Best is trial 3065 with value: 0.8863636363636364.
[32m[I 2023-04-21 03:08:40,694][39m Trial 4873 finished with value: 0.8539325842696629 and parameters: {'objective': 'CrossEntropy', 'colsample_bylevel': 0.0720759066999106, 'depth': 4, 'boosting_type': 'Plain', 'bootstrap_type': 'Bayesian', 'bagging_temperature': 8.833886443772025}. Best is trial 3065 with value: 0.8863636363636364.
[32m[I 2023-04-21 03:08:41,709][39m Trial 4874 finished with value: 0.8539325842696629 and parameters: {'objective': 'CrossEntropy', 'colsample_bylevel': 0.07418538103563138, 'depth': 7, 'boosting_type': 'Plain', 'bootstrap_type': 'Bayesian', 'bagging_temperature': 9.02752241866691}. Best is trial 3065 with value: 0.8863636363636364.
[32m[I 2023-04-21 03:08:42,831][39m Trial 4875 finished with value: 0.8089887640449439 and parameters: {'objective': 'CrossEntropy', 'colsample_bylevel': 0.051980473584971675, 'depth': 9, 'boosting_type': 'Plain', 'bootstrap_type': 'MVS'}. Best is trial 3065 with value: 0.8863636363636364.
[32m[I 2023-04-21 03:08:43,760][39m Trial 4876 finished with value: 0.8409090909090909 and parameters: {'objective': 'CrossEntropy', 'colsample_bylevel': 0.09597641018912062, 'depth': 3, 'boosting_type': 'Plain', 'bootstrap_type': 'MVS'}. Best is trial 3065 with value: 0.8863636363636364.
[32m[I 2023-04-21 03:08:44,882][39m Trial 4877 finished with value: 0.8409090909090909 and parameters: {'objective': 'Logloss', 'colsample_bylevel': 0.0739122001582472, 'depth': 6, 'boosting_type': 'Plain', 'bootstrap_type': 'Bernoulli', 'subsample': 0.5406790778369308}. Best is trial 3065 with value: 0.8863636363636364.
[32m[I 2023-04-21 03:08:45,749][39m Trial 4878 finished with value: 0.8275862068965518 and parameters: {'objective': 'Logloss', 'colsample_bylevel': 0.07391294482586745, 'depth': 6, 'boosting_type': 'Plain', 'bootstrap_type': 'Bayesian', 'bagging_temperature': 7.863834752806523}. Best is trial 3065 with value: 0.8863636363636364.
[32m[I 2023-04-21 03:08:46,456][39m Trial 4879 finished with value: 0.8539325842696629 and parameters: {'objective': 'Logloss', 'colsample_bylevel': 0.06922676050322499, 'depth': 10, 'boosting_type': 'Plain', 'bootstrap_type': 'Bayesian', 'bagging_temperature': 9.127067378077246}. Best is trial 3065 with value: 0.8863636363636364.
[32m[I 2023-04-21 03:08:47,681][39m Trial 4880 finished with value: 0.8539325842696629 and parameters: {'objective': 'Logloss', 'colsample_bylevel': 0.08960740277031462, 'depth': 3, 'boosting_type': 'Plain', 'bootstrap_type': 'Bayesian', 'bagging_temperature': 9.650360853811888}. Best is trial 3065 with value: 0.8863636363636364.
[32m[I 2023-04-21 03:08:49,006][39m Trial 4881 finished with value: 0.8666666666666666 and parameters: {'objective': 'CrossEntropy', 'colsample_bylevel': 0.08933434469198519, 'depth': 3, 'boosting_type': 'Plain', 'bootstrap_type': 'Bayesian', 'bagging_temperature': 9.821822754170151}. Best is trial 3065 with value: 0.8863636363636364.
[32m[I 2023-04-21 03:08:49,981][39m Trial 4882 finished with value: 0.8666666666666666 and parameters: {'objective': 'CrossEntropy', 'colsample_bylevel': 0.08446947108732478, 'depth': 3, 'boosting_type': 'Plain', 'bootstrap_type': 'Bayesian', 'bagging_temperature': 9.627043572178922}. Best is trial 3065 with value: 0.8863636363636364.
[32m[I 2023-04-21 03:08:50,747][39m Trial 4883 finished with value: 0.8192771084337348 and parameters: {'objective': 'CrossEntropy', 'colsample_bylevel': 0.08589907055453583, 'depth': 1, 'boosting_type': 'Plain', 'bootstrap_type': 'Bayesian', 'bagging_temperature': 9.030449246442148}. Best is trial 3065 with value: 0.8863636363636364.
[32m[I 2023-04-21 03:08:51,676][39m Trial 4884 finished with value: 0.8539325842696629 and parameters: {'objective': 'CrossEntropy', 'colsample_bylevel': 0.07726812839323105, 'depth': 10, 'boosting_type': 'Plain', 'bootstrap_type': 'Bayesian', 'bagging_temperature': 9.56789229814359}. Best is trial 3065 with value: 0.8863636363636364.
[32m[I 2023-04-21 03:08:52,592][39m Trial 4885 finished with value: 0.8539325842696629 and parameters: {'objective': 'CrossEntropy', 'colsample_bylevel': 0.07466635264829871, 'depth': 8, 'boosting_type': 'Plain', 'bootstrap_type': 'Bayesian', 'bagging_temperature': 9.049828253972283}. Best is trial 3065 with value: 0.8863636363636364.
[32m[I 2023-04-21 03:08:53,290][39m Trial 4886 finished with value: 0.8666666666666666 and parameters: {'objective': 'CrossEntropy', 'colsample_bylevel': 0.08377702428886452, 'depth': 3, 'boosting_type': 'Plain', 'bootstrap_type': 'Bayesian', 'bagging_temperature': 9.242374819875561}. Best is trial 3065 with value: 0.8863636363636364.
[32m[I 2023-04-21 03:08:54,186][39m Trial 4887 finished with value: 0.8539325842696629 and parameters: {'objective': 'CrossEntropy', 'colsample_bylevel': 0.06422327749628708, 'depth': 3, 'boosting_type': 'Plain', 'bootstrap_type': 'Bayesian', 'bagging_temperature': 8.95193309490249}. Best is trial 3065 with value: 0.8863636363636364.
[32m[I 2023-04-21 03:08:55,521][39m Trial 4888 finished with value: 0.8275862068965518 and parameters: {'objective': 'CrossEntropy', 'colsample_bylevel': 0.07983505503260338, 'depth': 3, 'boosting_type': 'Plain', 'bootstrap_type': 'Bayesian', 'bagging_temperature': 5.178337634876518}. Best is trial 3065 with value: 0.8863636363636364.
[32m[I 2023-04-21 03:09:00,184][39m Trial 4889 finished with value: 0.8539325842696629 and parameters: {'objective': 'Logloss', 'colsample_bylevel': 0.07636601269811326, 'depth': 11, 'boosting_type': 'Ordered', 'bootstrap_type': 'Bayesian', 'bagging_temperature': 8.904402191981696}. Best is trial 3065 with value: 0.8863636363636364.
[32m[I 2023-04-21 03:09:01,203][39m Trial 4890 finished with value: 0.8539325842696629 and parameters: {'objective': 'CrossEntropy', 'colsample_bylevel': 0.08123918033501283, 'depth': 3, 'boosting_type': 'Plain', 'bootstrap_type': 'Bayesian', 'bagging_temperature': 6.808357363688876}. Best is trial 3065 with value: 0.8863636363636364.
[32m[I 2023-04-21 03:09:02,521][39m Trial 4891 finished with value: 0.8539325842696629 and parameters: {'objective': 'Logloss', 'colsample_bylevel': 0.08186749250790123, 'depth': 3, 'boosting_type': 'Plain', 'bootstrap_type': 'Bayesian', 'bagging_temperature': 8.699274422809866}. Best is trial 3065 with value: 0.8863636363636364.
[32m[I 2023-04-21 03:09:03,751][39m Trial 4892 finished with value: 0.8409090909090909 and parameters: {'objective': 'CrossEntropy', 'colsample_bylevel': 0.07213449365376007, 'depth': 3, 'boosting_type': 'Plain', 'bootstrap_type': 'Bayesian', 'bagging_temperature': 5.255193533600433}. Best is trial 3065 with value: 0.8863636363636364.
[32m[I 2023-04-21 03:09:04,751][39m Trial 4893 finished with value: 0.8666666666666666 and parameters: {'objective': 'CrossEntropy', 'colsample_bylevel': 0.08454223241597524, 'depth': 3, 'boosting_type': 'Plain', 'bootstrap_type': 'Bayesian', 'bagging_temperature': 9.007750197584325}. Best is trial 3065 with value: 0.8863636363636364.
[32m[I 2023-04-21 03:09:05,654][39m Trial 4894 finished with value: 0.8666666666666666 and parameters: {'objective': 'CrossEntropy', 'colsample_bylevel': 0.07557831632210199, 'depth': 4, 'boosting_type': 'Plain', 'bootstrap_type': 'Bayesian', 'bagging_temperature': 9.992245464588214}. Best is trial 3065 with value: 0.8863636363636364.
[32m[I 2023-04-21 03:09:06,610][39m Trial 4895 finished with value: 0.8351648351648352 and parameters: {'objective': 'CrossEntropy', 'colsample_bylevel': 0.05994799453686726, 'depth': 3, 'boosting_type': 'Plain', 'bootstrap_type': 'MVS'}. Best is trial 3065 with value: 0.8863636363636364.
[32m[I 2023-04-21 03:09:07,372][39m Trial 4896 finished with value: 0.8409090909090909 and parameters: {'objective': 'CrossEntropy', 'colsample_bylevel': 0.08048747971150577, 'depth': 11, 'boosting_type': 'Plain', 'bootstrap_type': 'Bernoulli', 'subsample': 0.45449110841143625}. Best is trial 3065 with value: 0.8863636363636364.
[32m[I 2023-04-21 03:09:08,317][39m Trial 4897 finished with value: 0.8409090909090909 and parameters: {'objective': 'CrossEntropy', 'colsample_bylevel': 0.07486081076710362, 'depth': 10, 'boosting_type': 'Plain', 'bootstrap_type': 'Bayesian', 'bagging_temperature': 8.873664512428526}. Best is trial 3065 with value: 0.8863636363636364.
[32m[I 2023-04-21 03:09:09,597][39m Trial 4898 finished with value: 0.8139534883720929 and parameters: {'objective': 'CrossEntropy', 'colsample_bylevel': 0.07535826727081191, 'depth': 10, 'boosting_type': 'Plain', 'bootstrap_type': 'Bayesian', 'bagging_temperature': 5.419134097396701}. Best is trial 3065 with value: 0.8863636363636364.
[32m[I 2023-04-21 03:09:10,812][39m Trial 4899 finished with value: 0.8666666666666666 and parameters: {'objective': 'Logloss', 'colsample_bylevel': 0.06506085218718548, 'depth': 9, 'boosting_type': 'Plain', 'bootstrap_type': 'Bayesian', 'bagging_temperature': 9.687184311862186}. Best is trial 3065 with value: 0.8863636363636364.
[32m[I 2023-04-21 03:09:11,584][39m Trial 4900 finished with value: 0.8505747126436782 and parameters: {'objective': 'CrossEntropy', 'colsample_bylevel': 0.08998531898006633, 'depth': 11, 'boosting_type': 'Plain', 'bootstrap_type': 'Bayesian', 'bagging_temperature': 9.839096863493173}. Best is trial 3065 with value: 0.8863636363636364.
[32m[I 2023-04-21 03:09:12,872][39m Trial 4901 finished with value: 0.8539325842696629 and parameters: {'objective': 'CrossEntropy', 'colsample_bylevel': 0.07435346516594137, 'depth': 4, 'boosting_type': 'Plain', 'bootstrap_type': 'Bayesian', 'bagging_temperature': 9.754803925552421}. Best is trial 3065 with value: 0.8863636363636364.
[32m[I 2023-04-21 03:09:13,614][39m Trial 4902 finished with value: 0.8539325842696629 and parameters: {'objective': 'CrossEntropy', 'colsample_bylevel': 0.09292933763780546, 'depth': 3, 'boosting_type': 'Plain', 'bootstrap_type': 'Bayesian', 'bagging_temperature': 8.646924668568328}. Best is trial 3065 with value: 0.8863636363636364.
[32m[I 2023-04-21 03:09:18,459][39m Trial 4903 finished with value: 0.8275862068965518 and parameters: {'objective': 'CrossEntropy', 'colsample_bylevel': 0.081550849079563, 'depth': 3, 'boosting_type': 'Ordered', 'bootstrap_type': 'Bayesian', 'bagging_temperature': 9.875039922580907}. Best is trial 3065 with value: 0.8863636363636364.
[32m[I 2023-04-21 03:09:19,744][39m Trial 4904 finished with value: 0.8409090909090909 and parameters: {'objective': 'CrossEntropy', 'colsample_bylevel': 0.08394468887732308, 'depth': 3, 'boosting_type': 'Plain', 'bootstrap_type': 'Bayesian', 'bagging_temperature': 8.520968633311638}. Best is trial 3065 with value: 0.8863636363636364.
[32m[I 2023-04-21 03:09:20,886][39m Trial 4905 finished with value: 0.8409090909090909 and parameters: {'objective': 'Logloss', 'colsample_bylevel': 0.09380512020951244, 'depth': 3, 'boosting_type': 'Plain', 'bootstrap_type': 'Bayesian', 'bagging_temperature': 8.887888668861732}. Best is trial 3065 with value: 0.8863636363636364.
[32m[I 2023-04-21 03:09:22,286][39m Trial 4906 finished with value: 0.8539325842696629 and parameters: {'objective': 'Logloss', 'colsample_bylevel': 0.09530961539355769, 'depth': 3, 'boosting_type': 'Plain', 'bootstrap_type': 'Bayesian', 'bagging_temperature': 8.93059008132875}. Best is trial 3065 with value: 0.8863636363636364.
[32m[I 2023-04-21 03:09:23,442][39m Trial 4907 finished with value: 0.8666666666666666 and parameters: {'objective': 'CrossEntropy', 'colsample_bylevel': 0.07406414709475947, 'depth': 2, 'boosting_type': 'Plain', 'bootstrap_type': 'Bayesian', 'bagging_temperature': 8.766562639244299}. Best is trial 3065 with value: 0.8863636363636364.
[32m[I 2023-04-21 03:09:24,486][39m Trial 4908 finished with value: 0.8409090909090909 and parameters: {'objective': 'CrossEntropy', 'colsample_bylevel': 0.07409226439782043, 'depth': 4, 'boosting_type': 'Plain', 'bootstrap_type': 'Bayesian', 'bagging_temperature': 8.962822338969334}. Best is trial 3065 with value: 0.8863636363636364.
[32m[I 2023-04-21 03:09:25,513][39m Trial 4909 finished with value: 0.8666666666666666 and parameters: {'objective': 'Logloss', 'colsample_bylevel': 0.07334261599957759, 'depth': 12, 'boosting_type': 'Plain', 'bootstrap_type': 'Bayesian', 'bagging_temperature': 8.970615873543188}. Best is trial 3065 with value: 0.8863636363636364.
[32m[I 2023-04-21 03:09:26,266][39m Trial 4910 finished with value: 0.8409090909090909 and parameters: {'objective': 'CrossEntropy', 'colsample_bylevel': 0.07520996636253682, 'depth': 10, 'boosting_type': 'Plain', 'bootstrap_type': 'Bayesian', 'bagging_temperature': 8.893691171505209}. Best is trial 3065 with value: 0.8863636363636364.
[32m[I 2023-04-21 03:09:27,741][39m Trial 4911 finished with value: 0.8666666666666666 and parameters: {'objective': 'CrossEntropy', 'colsample_bylevel': 0.0721919070954526, 'depth': 10, 'boosting_type': 'Plain', 'bootstrap_type': 'Bayesian', 'bagging_temperature': 9.25525044568997}. Best is trial 3065 with value: 0.8863636363636364.
[32m[I 2023-04-21 03:09:28,764][39m Trial 4912 finished with value: 0.8666666666666666 and parameters: {'objective': 'CrossEntropy', 'colsample_bylevel': 0.06661025201990624, 'depth': 12, 'boosting_type': 'Plain', 'bootstrap_type': 'Bayesian', 'bagging_temperature': 8.31126566408268}. Best is trial 3065 with value: 0.8863636363636364.
[32m[I 2023-04-21 03:09:29,660][39m Trial 4913 finished with value: 0.8275862068965518 and parameters: {'objective': 'CrossEntropy', 'colsample_bylevel': 0.0909532109377105, 'depth': 3, 'boosting_type': 'Plain', 'bootstrap_type': 'MVS'}. Best is trial 3065 with value: 0.8863636363636364.
[32m[I 2023-04-21 03:09:30,368][39m Trial 4914 finished with value: 0.8539325842696629 and parameters: {'objective': 'Logloss', 'colsample_bylevel': 0.09118187737404244, 'depth': 3, 'boosting_type': 'Plain', 'bootstrap_type': 'Bayesian', 'bagging_temperature': 9.510303653604158}. Best is trial 3065 with value: 0.8863636363636364.
[32m[I 2023-04-21 03:09:31,301][39m Trial 4915 finished with value: 0.8409090909090909 and parameters: {'objective': 'CrossEntropy', 'colsample_bylevel': 0.08005247368599447, 'depth': 3, 'boosting_type': 'Plain', 'bootstrap_type': 'MVS'}. Best is trial 3065 with value: 0.8863636363636364.
[32m[I 2023-04-21 03:09:32,002][39m Trial 4916 finished with value: 0.8539325842696629 and parameters: {'objective': 'CrossEntropy', 'colsample_bylevel': 0.08729916269603435, 'depth': 3, 'boosting_type': 'Plain', 'bootstrap_type': 'Bayesian', 'bagging_temperature': 9.862352960840301}. Best is trial 3065 with value: 0.8863636363636364.
[32m[I 2023-04-21 03:09:33,209][39m Trial 4917 finished with value: 0.8666666666666666 and parameters: {'objective': 'CrossEntropy', 'colsample_bylevel': 0.07980543886536516, 'depth': 3, 'boosting_type': 'Plain', 'bootstrap_type': 'Bayesian', 'bagging_temperature': 9.801141265394797}. Best is trial 3065 with value: 0.8863636363636364.
[32m[I 2023-04-21 03:09:34,633][39m Trial 4918 finished with value: 0.8539325842696629 and parameters: {'objective': 'CrossEntropy', 'colsample_bylevel': 0.08109695859687062, 'depth': 3, 'boosting_type': 'Plain', 'bootstrap_type': 'Bayesian', 'bagging_temperature': 8.567371613258988}. Best is trial 3065 with value: 0.8863636363636364.
[32m[I 2023-04-21 03:09:35,774][39m Trial 4919 finished with value: 0.8409090909090909 and parameters: {'objective': 'CrossEntropy', 'colsample_bylevel': 0.09140968873878022, 'depth': 2, 'boosting_type': 'Plain', 'bootstrap_type': 'Bayesian', 'bagging_temperature': 8.609038658884867}. Best is trial 3065 with value: 0.8863636363636364.
[32m[I 2023-04-21 03:09:36,710][39m Trial 4920 finished with value: 0.7294117647058823 and parameters: {'objective': 'CrossEntropy', 'colsample_bylevel': 0.015504866136365147, 'depth': 3, 'boosting_type': 'Plain', 'bootstrap_type': 'Bayesian', 'bagging_temperature': 3.545840976762907}. Best is trial 3065 with value: 0.8863636363636364.
[32m[I 2023-04-21 03:09:37,956][39m Trial 4921 finished with value: 0.8636363636363636 and parameters: {'objective': 'CrossEntropy', 'colsample_bylevel': 0.08194056955369526, 'depth': 9, 'boosting_type': 'Plain', 'bootstrap_type': 'Bayesian', 'bagging_temperature': 9.088807914656305}. Best is trial 3065 with value: 0.8863636363636364.
[32m[I 2023-04-21 03:09:38,806][39m Trial 4922 finished with value: 0.8666666666666666 and parameters: {'objective': 'CrossEntropy', 'colsample_bylevel': 0.07915804081198058, 'depth': 3, 'boosting_type': 'Plain', 'bootstrap_type': 'Bayesian', 'bagging_temperature': 9.368948668643267}. Best is trial 3065 with value: 0.8863636363636364.
[32m[I 2023-04-21 03:09:39,716][39m Trial 4923 finished with value: 0.8505747126436782 and parameters: {'objective': 'Logloss', 'colsample_bylevel': 0.08689637592535752, 'depth': 2, 'boosting_type': 'Plain', 'bootstrap_type': 'Bayesian', 'bagging_temperature': 8.448765907208077}. Best is trial 3065 with value: 0.8863636363636364.
[32m[I 2023-04-21 03:09:44,205][39m Trial 4924 finished with value: 0.8539325842696629 and parameters: {'objective': 'CrossEntropy', 'colsample_bylevel': 0.0686838438315168, 'depth': 7, 'boosting_type': 'Ordered', 'bootstrap_type': 'Bayesian', 'bagging_temperature': 9.723964922410707}. Best is trial 3065 with value: 0.8863636363636364.
[32m[I 2023-04-21 03:09:45,317][39m Trial 4925 finished with value: 0.8139534883720929 and parameters: {'objective': 'Logloss', 'colsample_bylevel': 0.08059799694303456, 'depth': 10, 'boosting_type': 'Plain', 'bootstrap_type': 'Bayesian', 'bagging_temperature': 8.793493741309478}. Best is trial 3065 with value: 0.8863636363636364.
[32m[I 2023-04-21 03:09:46,738][39m Trial 4926 finished with value: 0.8539325842696629 and parameters: {'objective': 'CrossEntropy', 'colsample_bylevel': 0.08104397598016397, 'depth': 3, 'boosting_type': 'Plain', 'bootstrap_type': 'Bernoulli', 'subsample': 0.7864294484412786}. Best is trial 3065 with value: 0.8863636363636364.
[32m[I 2023-04-21 03:09:47,431][39m Trial 4927 finished with value: 0.8539325842696629 and parameters: {'objective': 'CrossEntropy', 'colsample_bylevel': 0.08065195326193858, 'depth': 2, 'boosting_type': 'Plain', 'bootstrap_type': 'Bayesian', 'bagging_temperature': 9.566470191531039}. Best is trial 3065 with value: 0.8863636363636364.
[32m[I 2023-04-21 03:09:49,179][39m Trial 4928 finished with value: 0.8372093023255814 and parameters: {'objective': 'CrossEntropy', 'colsample_bylevel': 0.0921434541772498, 'depth': 9, 'boosting_type': 'Plain', 'bootstrap_type': 'Bayesian', 'bagging_temperature': 8.395824373929738}. Best is trial 3065 with value: 0.8863636363636364.
[32m[I 2023-04-21 03:09:50,281][39m Trial 4929 finished with value: 0.8409090909090909 and parameters: {'objective': 'CrossEntropy', 'colsample_bylevel': 0.06755561763549293, 'depth': 8, 'boosting_type': 'Plain', 'bootstrap_type': 'Bayesian', 'bagging_temperature': 9.139158761185074}. Best is trial 3065 with value: 0.8863636363636364.
[32m[I 2023-04-21 03:09:51,307][39m Trial 4930 finished with value: 0.8666666666666666 and parameters: {'objective': 'CrossEntropy', 'colsample_bylevel': 0.07637037492787503, 'depth': 4, 'boosting_type': 'Plain', 'bootstrap_type': 'Bayesian', 'bagging_temperature': 9.985809324814978}. Best is trial 3065 with value: 0.8863636363636364.
[32m[I 2023-04-21 03:09:52,363][39m Trial 4931 finished with value: 0.8666666666666666 and parameters: {'objective': 'CrossEntropy', 'colsample_bylevel': 0.07630527372179792, 'depth': 2, 'boosting_type': 'Plain', 'bootstrap_type': 'Bayesian', 'bagging_temperature': 9.614920778340988}. Best is trial 3065 with value: 0.8863636363636364.
[32m[I 2023-04-21 03:09:53,688][39m Trial 4932 finished with value: 0.8666666666666666 and parameters: {'objective': 'CrossEntropy', 'colsample_bylevel': 0.08089555347370554, 'depth': 3, 'boosting_type': 'Plain', 'bootstrap_type': 'Bayesian', 'bagging_temperature': 9.167300138621247}. Best is trial 3065 with value: 0.8863636363636364.
[32m[I 2023-04-21 03:09:54,397][39m Trial 4933 finished with value: 0.8275862068965518 and parameters: {'objective': 'CrossEntropy', 'colsample_bylevel': 0.07863759806166523, 'depth': 3, 'boosting_type': 'Plain', 'bootstrap_type': 'Bayesian', 'bagging_temperature': 7.0582034067496195}. Best is trial 3065 with value: 0.8863636363636364.
