[32m[I 2023-04-21 03:30:44,950][39m Trial 5916 finished with value: 0.8666666666666666 and parameters: {'objective': 'CrossEntropy', 'colsample_bylevel': 0.07761661042179355, 'depth': 4, 'boosting_type': 'Plain', 'bootstrap_type': 'Bayesian', 'bagging_temperature': 9.706726103563897}. Best is trial 3065 with value: 0.8863636363636364.
[32m[I 2023-04-21 03:30:46,453][39m Trial 5917 finished with value: 0.8636363636363636 and parameters: {'objective': 'CrossEntropy', 'colsample_bylevel': 0.07064479712559898, 'depth': 9, 'boosting_type': 'Plain', 'bootstrap_type': 'Bayesian', 'bagging_temperature': 9.945546994596821}. Best is trial 3065 with value: 0.8863636363636364.
[32m[I 2023-04-21 03:30:47,543][39m Trial 5918 finished with value: 0.8666666666666666 and parameters: {'objective': 'Logloss', 'colsample_bylevel': 0.07227358370575597, 'depth': 10, 'boosting_type': 'Plain', 'bootstrap_type': 'Bayesian', 'bagging_temperature': 8.426235784781097}. Best is trial 3065 with value: 0.8863636363636364.
[32m[I 2023-04-21 03:30:52,494][39m Trial 5919 finished with value: 0.8314606741573034 and parameters: {'objective': 'Logloss', 'colsample_bylevel': 0.0759906377044853, 'depth': 10, 'boosting_type': 'Ordered', 'bootstrap_type': 'MVS'}. Best is trial 3065 with value: 0.8863636363636364.
[32m[I 2023-04-21 03:30:53,883][39m Trial 5920 finished with value: 0.8409090909090909 and parameters: {'objective': 'CrossEntropy', 'colsample_bylevel': 0.0879180953363691, 'depth': 7, 'boosting_type': 'Plain', 'bootstrap_type': 'Bayesian', 'bagging_temperature': 9.320638415732281}. Best is trial 3065 with value: 0.8863636363636364.
[32m[I 2023-04-21 03:30:55,151][39m Trial 5921 finished with value: 0.8791208791208791 and parameters: {'objective': 'CrossEntropy', 'colsample_bylevel': 0.08412703400781174, 'depth': 3, 'boosting_type': 'Plain', 'bootstrap_type': 'Bayesian', 'bagging_temperature': 9.214782540724244}. Best is trial 3065 with value: 0.8863636363636364.
[32m[I 2023-04-21 03:30:56,269][39m Trial 5922 finished with value: 0.8409090909090909 and parameters: {'objective': 'Logloss', 'colsample_bylevel': 0.08342817128698488, 'depth': 6, 'boosting_type': 'Plain', 'bootstrap_type': 'Bayesian', 'bagging_temperature': 8.983755902236485}. Best is trial 3065 with value: 0.8863636363636364.
[32m[I 2023-04-21 03:30:57,644][39m Trial 5923 finished with value: 0.8409090909090909 and parameters: {'objective': 'CrossEntropy', 'colsample_bylevel': 0.08098346235441976, 'depth': 10, 'boosting_type': 'Plain', 'bootstrap_type': 'Bayesian', 'bagging_temperature': 9.532989914187322}. Best is trial 3065 with value: 0.8863636363636364.
[32m[I 2023-04-21 03:30:58,362][39m Trial 5924 finished with value: 0.8539325842696629 and parameters: {'objective': 'CrossEntropy', 'colsample_bylevel': 0.09444954313414164, 'depth': 3, 'boosting_type': 'Plain', 'bootstrap_type': 'Bayesian', 'bagging_temperature': 9.825732157902891}. Best is trial 3065 with value: 0.8863636363636364.
[32m[I 2023-04-21 03:30:59,238][39m Trial 5925 finished with value: 0.8539325842696629 and parameters: {'objective': 'CrossEntropy', 'colsample_bylevel': 0.08167190186072966, 'depth': 10, 'boosting_type': 'Plain', 'bootstrap_type': 'Bayesian', 'bagging_temperature': 9.514194194601782}. Best is trial 3065 with value: 0.8863636363636364.
[32m[I 2023-04-21 03:31:00,439][39m Trial 5926 finished with value: 0.8791208791208791 and parameters: {'objective': 'CrossEntropy', 'colsample_bylevel': 0.07347456489327675, 'depth': 4, 'boosting_type': 'Plain', 'bootstrap_type': 'Bayesian', 'bagging_temperature': 9.462997298319182}. Best is trial 3065 with value: 0.8863636363636364.
[32m[I 2023-04-21 03:31:01,638][39m Trial 5927 finished with value: 0.8539325842696629 and parameters: {'objective': 'CrossEntropy', 'colsample_bylevel': 0.07094113466455965, 'depth': 11, 'boosting_type': 'Plain', 'bootstrap_type': 'Bayesian', 'bagging_temperature': 9.27783796633655}. Best is trial 3065 with value: 0.8863636363636364.
[32m[I 2023-04-21 03:31:03,025][39m Trial 5928 finished with value: 0.8539325842696629 and parameters: {'objective': 'CrossEntropy', 'colsample_bylevel': 0.07447714398888464, 'depth': 10, 'boosting_type': 'Plain', 'bootstrap_type': 'Bayesian', 'bagging_temperature': 9.382381100817788}. Best is trial 3065 with value: 0.8863636363636364.
[32m[I 2023-04-21 03:31:03,965][39m Trial 5929 finished with value: 0.8372093023255814 and parameters: {'objective': 'CrossEntropy', 'colsample_bylevel': 0.07683154622068197, 'depth': 11, 'boosting_type': 'Plain', 'bootstrap_type': 'MVS'}. Best is trial 3065 with value: 0.8863636363636364.
[32m[I 2023-04-21 03:31:04,757][39m Trial 5930 finished with value: 0.8539325842696629 and parameters: {'objective': 'Logloss', 'colsample_bylevel': 0.07198453643234454, 'depth': 11, 'boosting_type': 'Plain', 'bootstrap_type': 'Bayesian', 'bagging_temperature': 6.570365091739911}. Best is trial 3065 with value: 0.8863636363636364.
[32m[I 2023-04-21 03:31:05,652][39m Trial 5931 finished with value: 0.8181818181818182 and parameters: {'objective': 'CrossEntropy', 'colsample_bylevel': 0.0900402147590997, 'depth': 3, 'boosting_type': 'Plain', 'bootstrap_type': 'Bernoulli', 'subsample': 0.9343840143156095}. Best is trial 3065 with value: 0.8863636363636364.
[32m[I 2023-04-21 03:31:06,548][39m Trial 5932 finished with value: 0.8275862068965518 and parameters: {'objective': 'CrossEntropy', 'colsample_bylevel': 0.06340869824348377, 'depth': 9, 'boosting_type': 'Plain', 'bootstrap_type': 'Bayesian', 'bagging_temperature': 9.817053886425661}. Best is trial 3065 with value: 0.8863636363636364.
[32m[I 2023-04-21 03:31:07,860][39m Trial 5933 finished with value: 0.8409090909090909 and parameters: {'objective': 'Logloss', 'colsample_bylevel': 0.07561517115702301, 'depth': 10, 'boosting_type': 'Plain', 'bootstrap_type': 'Bayesian', 'bagging_temperature': 8.913697023125748}. Best is trial 3065 with value: 0.8863636363636364.
[32m[I 2023-04-21 03:31:08,923][39m Trial 5934 finished with value: 0.8666666666666666 and parameters: {'objective': 'Logloss', 'colsample_bylevel': 0.0752493151686687, 'depth': 10, 'boosting_type': 'Plain', 'bootstrap_type': 'Bayesian', 'bagging_temperature': 7.1879092585284905}. Best is trial 3065 with value: 0.8863636363636364.
[32m[I 2023-04-21 03:31:10,121][39m Trial 5935 finished with value: 0.8791208791208791 and parameters: {'objective': 'CrossEntropy', 'colsample_bylevel': 0.08200017708880374, 'depth': 3, 'boosting_type': 'Plain', 'bootstrap_type': 'Bayesian', 'bagging_temperature': 9.308576847604595}. Best is trial 3065 with value: 0.8863636363636364.
[32m[I 2023-04-21 03:31:11,542][39m Trial 5936 finished with value: 0.8539325842696629 and parameters: {'objective': 'CrossEntropy', 'colsample_bylevel': 0.07445504500610163, 'depth': 12, 'boosting_type': 'Plain', 'bootstrap_type': 'Bayesian', 'bagging_temperature': 9.153860698022172}. Best is trial 3065 with value: 0.8863636363636364.
[32m[I 2023-04-21 03:31:15,924][39m Trial 5937 finished with value: 0.8409090909090909 and parameters: {'objective': 'Logloss', 'colsample_bylevel': 0.07827824903951601, 'depth': 10, 'boosting_type': 'Ordered', 'bootstrap_type': 'Bayesian', 'bagging_temperature': 8.08349610737421}. Best is trial 3065 with value: 0.8863636363636364.
[32m[I 2023-04-21 03:31:16,995][39m Trial 5938 finished with value: 0.8409090909090909 and parameters: {'objective': 'Logloss', 'colsample_bylevel': 0.0788829709131914, 'depth': 10, 'boosting_type': 'Plain', 'bootstrap_type': 'Bayesian', 'bagging_temperature': 8.362416912207292}. Best is trial 3065 with value: 0.8863636363636364.
[32m[I 2023-04-21 03:31:18,429][39m Trial 5939 finished with value: 0.8539325842696629 and parameters: {'objective': 'Logloss', 'colsample_bylevel': 0.07913835465509488, 'depth': 10, 'boosting_type': 'Plain', 'bootstrap_type': 'Bayesian', 'bagging_temperature': 8.00922775770441}. Best is trial 3065 with value: 0.8863636363636364.
[32m[I 2023-04-21 03:31:19,538][39m Trial 5940 finished with value: 0.8539325842696629 and parameters: {'objective': 'Logloss', 'colsample_bylevel': 0.07443074571956224, 'depth': 7, 'boosting_type': 'Plain', 'bootstrap_type': 'Bayesian', 'bagging_temperature': 9.210508075691845}. Best is trial 3065 with value: 0.8863636363636364.
[32m[I 2023-04-21 03:31:20,575][39m Trial 5941 finished with value: 0.8636363636363636 and parameters: {'objective': 'CrossEntropy', 'colsample_bylevel': 0.07460060616826461, 'depth': 2, 'boosting_type': 'Plain', 'bootstrap_type': 'Bayesian', 'bagging_temperature': 8.625596120849597}. Best is trial 3065 with value: 0.8863636363636364.
[32m[I 2023-04-21 03:31:21,441][39m Trial 5942 finished with value: 0.8139534883720929 and parameters: {'objective': 'CrossEntropy', 'colsample_bylevel': 0.069415863473108, 'depth': 10, 'boosting_type': 'Plain', 'bootstrap_type': 'Bayesian', 'bagging_temperature': 9.795276559416354}. Best is trial 3065 with value: 0.8863636363636364.
[32m[I 2023-04-21 03:31:22,692][39m Trial 5943 finished with value: 0.8539325842696629 and parameters: {'objective': 'CrossEntropy', 'colsample_bylevel': 0.06378212570389799, 'depth': 8, 'boosting_type': 'Plain', 'bootstrap_type': 'MVS'}. Best is trial 3065 with value: 0.8863636363636364.
[32m[I 2023-04-21 03:31:24,004][39m Trial 5944 finished with value: 0.8505747126436782 and parameters: {'objective': 'Logloss', 'colsample_bylevel': 0.08109568832273195, 'depth': 10, 'boosting_type': 'Plain', 'bootstrap_type': 'Bayesian', 'bagging_temperature': 8.249490099087142}. Best is trial 3065 with value: 0.8863636363636364.
[32m[I 2023-04-21 03:31:25,378][39m Trial 5945 finished with value: 0.8764044943820225 and parameters: {'objective': 'CrossEntropy', 'colsample_bylevel': 0.06258418594703219, 'depth': 9, 'boosting_type': 'Plain', 'bootstrap_type': 'Bayesian', 'bagging_temperature': 9.394783641812163}. Best is trial 3065 with value: 0.8863636363636364.
[32m[I 2023-04-21 03:31:26,653][39m Trial 5946 finished with value: 0.8139534883720929 and parameters: {'objective': 'CrossEntropy', 'colsample_bylevel': 0.07815702417718477, 'depth': 9, 'boosting_type': 'Plain', 'bootstrap_type': 'Bernoulli', 'subsample': 0.6018686817723459}. Best is trial 3065 with value: 0.8863636363636364.
[32m[I 2023-04-21 03:31:27,940][39m Trial 5947 finished with value: 0.8409090909090909 and parameters: {'objective': 'CrossEntropy', 'colsample_bylevel': 0.07650461253835612, 'depth': 9, 'boosting_type': 'Plain', 'bootstrap_type': 'Bayesian', 'bagging_temperature': 9.13777731862635}. Best is trial 3065 with value: 0.8863636363636364.
[32m[I 2023-04-21 03:31:28,917][39m Trial 5948 finished with value: 0.8409090909090909 and parameters: {'objective': 'CrossEntropy', 'colsample_bylevel': 0.07670634937976947, 'depth': 9, 'boosting_type': 'Plain', 'bootstrap_type': 'Bayesian', 'bagging_temperature': 8.457384594302523}. Best is trial 3065 with value: 0.8863636363636364.
[32m[I 2023-04-21 03:31:29,572][39m Trial 5949 finished with value: 0.6913580246913581 and parameters: {'objective': 'CrossEntropy', 'colsample_bylevel': 0.014394102820043192, 'depth': 3, 'boosting_type': 'Plain', 'bootstrap_type': 'MVS'}. Best is trial 3065 with value: 0.8863636363636364.
[32m[I 2023-04-21 03:31:30,592][39m Trial 5950 finished with value: 0.8539325842696629 and parameters: {'objective': 'CrossEntropy', 'colsample_bylevel': 0.08652493084932955, 'depth': 3, 'boosting_type': 'Plain', 'bootstrap_type': 'Bayesian', 'bagging_temperature': 9.45152697415969}. Best is trial 3065 with value: 0.8863636363636364.
[32m[I 2023-04-21 03:31:31,711][39m Trial 5951 finished with value: 0.8444444444444446 and parameters: {'objective': 'Logloss', 'colsample_bylevel': 0.07423122064380198, 'depth': 4, 'boosting_type': 'Plain', 'bootstrap_type': 'MVS'}. Best is trial 3065 with value: 0.8863636363636364.
[32m[I 2023-04-21 03:31:33,093][39m Trial 5952 finished with value: 0.8539325842696629 and parameters: {'objective': 'CrossEntropy', 'colsample_bylevel': 0.07847926847032902, 'depth': 10, 'boosting_type': 'Plain', 'bootstrap_type': 'Bayesian', 'bagging_temperature': 9.71962226219025}. Best is trial 3065 with value: 0.8863636363636364.
[32m[I 2023-04-21 03:31:34,053][39m Trial 5953 finished with value: 0.8275862068965518 and parameters: {'objective': 'CrossEntropy', 'colsample_bylevel': 0.06567867786574481, 'depth': 9, 'boosting_type': 'Plain', 'bootstrap_type': 'Bayesian', 'bagging_temperature': 5.973391794767071}. Best is trial 3065 with value: 0.8863636363636364.
[32m[I 2023-04-21 03:31:38,642][39m Trial 5954 finished with value: 0.8539325842696629 and parameters: {'objective': 'CrossEntropy', 'colsample_bylevel': 0.08978563200927789, 'depth': 3, 'boosting_type': 'Ordered', 'bootstrap_type': 'Bayesian', 'bagging_temperature': 9.776401979366062}. Best is trial 3065 with value: 0.8863636363636364.
[32m[I 2023-04-21 03:31:39,904][39m Trial 5955 finished with value: 0.8791208791208791 and parameters: {'objective': 'Logloss', 'colsample_bylevel': 0.07234942767154653, 'depth': 5, 'boosting_type': 'Plain', 'bootstrap_type': 'Bayesian', 'bagging_temperature': 9.316703453310284}. Best is trial 3065 with value: 0.8863636363636364.
[32m[I 2023-04-21 03:31:40,970][39m Trial 5956 finished with value: 0.8666666666666666 and parameters: {'objective': 'CrossEntropy', 'colsample_bylevel': 0.08393339822976995, 'depth': 3, 'boosting_type': 'Plain', 'bootstrap_type': 'Bayesian', 'bagging_temperature': 8.881953357803216}. Best is trial 3065 with value: 0.8863636363636364.
[32m[I 2023-04-21 03:31:42,250][39m Trial 5957 finished with value: 0.8409090909090909 and parameters: {'objective': 'CrossEntropy', 'colsample_bylevel': 0.08541128725437544, 'depth': 8, 'boosting_type': 'Plain', 'bootstrap_type': 'Bayesian', 'bagging_temperature': 8.881041182269334}. Best is trial 3065 with value: 0.8863636363636364.
[32m[I 2023-04-21 03:31:43,679][39m Trial 5958 finished with value: 0.8539325842696629 and parameters: {'objective': 'CrossEntropy', 'colsample_bylevel': 0.06747396255321506, 'depth': 8, 'boosting_type': 'Plain', 'bootstrap_type': 'Bayesian', 'bagging_temperature': 8.831639430610965}. Best is trial 3065 with value: 0.8863636363636364.
[32m[I 2023-04-21 03:31:44,788][39m Trial 5959 finished with value: 0.8764044943820225 and parameters: {'objective': 'CrossEntropy', 'colsample_bylevel': 0.078456108166234, 'depth': 3, 'boosting_type': 'Plain', 'bootstrap_type': 'Bayesian', 'bagging_temperature': 9.092473330173378}. Best is trial 3065 with value: 0.8863636363636364.
[32m[I 2023-04-21 03:31:45,881][39m Trial 5960 finished with value: 0.8539325842696629 and parameters: {'objective': 'CrossEntropy', 'colsample_bylevel': 0.07883817072006781, 'depth': 3, 'boosting_type': 'Plain', 'bootstrap_type': 'Bayesian', 'bagging_temperature': 4.675576044299248}. Best is trial 3065 with value: 0.8863636363636364.
[32m[I 2023-04-21 03:31:47,152][39m Trial 5961 finished with value: 0.8333333333333333 and parameters: {'objective': 'CrossEntropy', 'colsample_bylevel': 0.04669531783582418, 'depth': 3, 'boosting_type': 'Plain', 'bootstrap_type': 'Bayesian', 'bagging_temperature': 9.348366059723622}. Best is trial 3065 with value: 0.8863636363636364.
[32m[I 2023-04-21 03:31:48,043][39m Trial 5962 finished with value: 0.8275862068965518 and parameters: {'objective': 'CrossEntropy', 'colsample_bylevel': 0.09676426670870591, 'depth': 11, 'boosting_type': 'Plain', 'bootstrap_type': 'Bayesian', 'bagging_temperature': 8.5572286409771}. Best is trial 3065 with value: 0.8863636363636364.
[32m[I 2023-04-21 03:31:48,920][39m Trial 5963 finished with value: 0.8275862068965518 and parameters: {'objective': 'Logloss', 'colsample_bylevel': 0.07590431249943623, 'depth': 10, 'boosting_type': 'Plain', 'bootstrap_type': 'Bayesian', 'bagging_temperature': 8.369321168336661}. Best is trial 3065 with value: 0.8863636363636364.
[32m[I 2023-04-21 03:31:49,630][39m Trial 5964 finished with value: 0.8409090909090909 and parameters: {'objective': 'Logloss', 'colsample_bylevel': 0.07651984844814132, 'depth': 10, 'boosting_type': 'Plain', 'bootstrap_type': 'Bayesian', 'bagging_temperature': 8.538227245347969}. Best is trial 3065 with value: 0.8863636363636364.
[32m[I 2023-04-21 03:31:50,527][39m Trial 5965 finished with value: 0.8505747126436782 and parameters: {'objective': 'CrossEntropy', 'colsample_bylevel': 0.09594938784411311, 'depth': 9, 'boosting_type': 'Plain', 'bootstrap_type': 'Bayesian', 'bagging_temperature': 8.97111105461172}. Best is trial 3065 with value: 0.8863636363636364.
[32m[I 2023-04-21 03:31:51,853][39m Trial 5966 finished with value: 0.8409090909090909 and parameters: {'objective': 'Logloss', 'colsample_bylevel': 0.06684390399290657, 'depth': 7, 'boosting_type': 'Plain', 'bootstrap_type': 'Bayesian', 'bagging_temperature': 5.6820088064673495}. Best is trial 3065 with value: 0.8863636363636364.
[32m[I 2023-04-21 03:31:52,948][39m Trial 5967 finished with value: 0.8409090909090909 and parameters: {'objective': 'CrossEntropy', 'colsample_bylevel': 0.07464278560559659, 'depth': 4, 'boosting_type': 'Plain', 'bootstrap_type': 'Bayesian', 'bagging_temperature': 7.444185596999229}. Best is trial 3065 with value: 0.8863636363636364.
[32m[I 2023-04-21 03:31:54,260][39m Trial 5968 finished with value: 0.8409090909090909 and parameters: {'objective': 'Logloss', 'colsample_bylevel': 0.07581084339796511, 'depth': 11, 'boosting_type': 'Plain', 'bootstrap_type': 'Bayesian', 'bagging_temperature': 9.610768532739122}. Best is trial 3065 with value: 0.8863636363636364.
[32m[I 2023-04-21 03:31:55,096][39m Trial 5969 finished with value: 0.8409090909090909 and parameters: {'objective': 'CrossEntropy', 'colsample_bylevel': 0.06693283251928973, 'depth': 3, 'boosting_type': 'Plain', 'bootstrap_type': 'Bernoulli', 'subsample': 0.2859534752978575}. Best is trial 3065 with value: 0.8863636363636364.
[32m[I 2023-04-21 03:31:55,856][39m Trial 5970 finished with value: 0.8372093023255814 and parameters: {'objective': 'CrossEntropy', 'colsample_bylevel': 0.07671883932877682, 'depth': 11, 'boosting_type': 'Plain', 'bootstrap_type': 'Bayesian', 'bagging_temperature': 9.755285139192498}. Best is trial 3065 with value: 0.8863636363636364.
[32m[I 2023-04-21 03:31:57,206][39m Trial 5971 finished with value: 0.8372093023255814 and parameters: {'objective': 'Logloss', 'colsample_bylevel': 0.08882992497466168, 'depth': 7, 'boosting_type': 'Plain', 'bootstrap_type': 'Bayesian', 'bagging_temperature': 1.9200844205565404}. Best is trial 3065 with value: 0.8863636363636364.
[32m[I 2023-04-21 03:31:58,272][39m Trial 5972 finished with value: 0.8275862068965518 and parameters: {'objective': 'CrossEntropy', 'colsample_bylevel': 0.0805721030969262, 'depth': 3, 'boosting_type': 'Plain', 'bootstrap_type': 'Bayesian', 'bagging_temperature': 9.980194762414794}. Best is trial 3065 with value: 0.8863636363636364.
[32m[I 2023-04-21 03:32:03,199][39m Trial 5973 finished with value: 0.8275862068965518 and parameters: {'objective': 'CrossEntropy', 'colsample_bylevel': 0.09246627433531905, 'depth': 3, 'boosting_type': 'Ordered', 'bootstrap_type': 'Bayesian', 'bagging_temperature': 9.828643535991162}. Best is trial 3065 with value: 0.8863636363636364.
[32m[I 2023-04-21 03:32:04,896][39m Trial 5974 finished with value: 0.8539325842696629 and parameters: {'objective': 'CrossEntropy', 'colsample_bylevel': 0.07033545853957925, 'depth': 3, 'boosting_type': 'Plain', 'bootstrap_type': 'Bayesian', 'bagging_temperature': 9.073373868348613}. Best is trial 3065 with value: 0.8863636363636364.
[32m[I 2023-04-21 03:32:05,969][39m Trial 5975 finished with value: 0.8139534883720929 and parameters: {'objective': 'CrossEntropy', 'colsample_bylevel': 0.07150488536009056, 'depth': 12, 'boosting_type': 'Plain', 'bootstrap_type': 'Bayesian', 'bagging_temperature': 8.336867371306017}. Best is trial 3065 with value: 0.8863636363636364.
[32m[I 2023-04-21 03:32:07,186][39m Trial 5976 finished with value: 0.8666666666666666 and parameters: {'objective': 'Logloss', 'colsample_bylevel': 0.0768689232322619, 'depth': 9, 'boosting_type': 'Plain', 'bootstrap_type': 'Bayesian', 'bagging_temperature': 8.915254415954504}. Best is trial 3065 with value: 0.8863636363636364.
[32m[I 2023-04-21 03:32:08,235][39m Trial 5977 finished with value: 0.8666666666666666 and parameters: {'objective': 'CrossEntropy', 'colsample_bylevel': 0.0815458150278124, 'depth': 2, 'boosting_type': 'Plain', 'bootstrap_type': 'Bayesian', 'bagging_temperature': 9.248605720831113}. Best is trial 3065 with value: 0.8863636363636364.
[32m[I 2023-04-21 03:32:08,966][39m Trial 5978 finished with value: 0.8666666666666666 and parameters: {'objective': 'Logloss', 'colsample_bylevel': 0.0766264612746773, 'depth': 10, 'boosting_type': 'Plain', 'bootstrap_type': 'Bayesian', 'bagging_temperature': 9.995844214292667}. Best is trial 3065 with value: 0.8863636363636364.
[32m[I 2023-04-21 03:32:09,835][39m Trial 5979 finished with value: 0.8539325842696629 and parameters: {'objective': 'CrossEntropy', 'colsample_bylevel': 0.06635257602227877, 'depth': 12, 'boosting_type': 'Plain', 'bootstrap_type': 'MVS'}. Best is trial 3065 with value: 0.8863636363636364.
[32m[I 2023-04-21 03:32:10,849][39m Trial 5980 finished with value: 0.8764044943820225 and parameters: {'objective': 'CrossEntropy', 'colsample_bylevel': 0.08197828839940648, 'depth': 2, 'boosting_type': 'Plain', 'bootstrap_type': 'Bayesian', 'bagging_temperature': 8.710000630066112}. Best is trial 3065 with value: 0.8863636363636364.
[32m[I 2023-04-21 03:32:12,104][39m Trial 5981 finished with value: 0.8666666666666666 and parameters: {'objective': 'CrossEntropy', 'colsample_bylevel': 0.06530365864543587, 'depth': 8, 'boosting_type': 'Plain', 'bootstrap_type': 'Bayesian', 'bagging_temperature': 9.766039390962108}. Best is trial 3065 with value: 0.8863636363636364.
