[32m[I 2023-04-21 01:44:56,769][39m Trial 530 finished with value: 0.8764044943820225 and parameters: {'objective': 'CrossEntropy', 'colsample_bylevel': 0.07869691778235592, 'depth': 2, 'boosting_type': 'Plain', 'bootstrap_type': 'Bayesian', 'bagging_temperature': 8.935120165474709}. Best is trial 98 with value: 0.8791208791208791.
[32m[I 2023-04-21 01:44:57,612][39m Trial 531 finished with value: 0.8539325842696629 and parameters: {'objective': 'CrossEntropy', 'colsample_bylevel': 0.0766748514562615, 'depth': 3, 'boosting_type': 'Plain', 'bootstrap_type': 'Bayesian', 'bagging_temperature': 8.75163676861679}. Best is trial 98 with value: 0.8791208791208791.
[32m[I 2023-04-21 01:44:58,178][39m Trial 532 finished with value: 0.8539325842696629 and parameters: {'objective': 'Logloss', 'colsample_bylevel': 0.08992151853210922, 'depth': 3, 'boosting_type': 'Plain', 'bootstrap_type': 'Bayesian', 'bagging_temperature': 9.011990999991946}. Best is trial 98 with value: 0.8791208791208791.
[32m[I 2023-04-21 01:44:58,733][39m Trial 533 finished with value: 0.8666666666666666 and parameters: {'objective': 'CrossEntropy', 'colsample_bylevel': 0.08027537089925373, 'depth': 3, 'boosting_type': 'Plain', 'bootstrap_type': 'Bayesian', 'bagging_temperature': 8.196613725600745}. Best is trial 98 with value: 0.8791208791208791.
[32m[I 2023-04-21 01:44:59,408][39m Trial 534 finished with value: 0.8539325842696629 and parameters: {'objective': 'CrossEntropy', 'colsample_bylevel': 0.07834109887684625, 'depth': 2, 'boosting_type': 'Plain', 'bootstrap_type': 'Bayesian', 'bagging_temperature': 9.464107865658578}. Best is trial 98 with value: 0.8791208791208791.
[32m[I 2023-04-21 01:45:00,395][39m Trial 535 finished with value: 0.8409090909090909 and parameters: {'objective': 'CrossEntropy', 'colsample_bylevel': 0.09606819609467632, 'depth': 3, 'boosting_type': 'Plain', 'bootstrap_type': 'Bayesian', 'bagging_temperature': 9.973985424030543}. Best is trial 98 with value: 0.8791208791208791.
[32m[I 2023-04-21 01:45:01,258][39m Trial 536 finished with value: 0.8666666666666666 and parameters: {'objective': 'CrossEntropy', 'colsample_bylevel': 0.08443132448315266, 'depth': 3, 'boosting_type': 'Plain', 'bootstrap_type': 'Bayesian', 'bagging_temperature': 6.102173752144614}. Best is trial 98 with value: 0.8791208791208791.
[32m[I 2023-04-21 01:45:02,100][39m Trial 537 finished with value: 0.8409090909090909 and parameters: {'objective': 'CrossEntropy', 'colsample_bylevel': 0.08279762006100715, 'depth': 2, 'boosting_type': 'Plain', 'bootstrap_type': 'Bayesian', 'bagging_temperature': 5.287116641287483}. Best is trial 98 with value: 0.8791208791208791.
[32m[I 2023-04-21 01:45:03,005][39m Trial 538 finished with value: 0.8409090909090909 and parameters: {'objective': 'CrossEntropy', 'colsample_bylevel': 0.09350584239772095, 'depth': 4, 'boosting_type': 'Plain', 'bootstrap_type': 'Bayesian', 'bagging_temperature': 7.46931150932746}. Best is trial 98 with value: 0.8791208791208791.
[32m[I 2023-04-21 01:45:03,835][39m Trial 539 finished with value: 0.8539325842696629 and parameters: {'objective': 'CrossEntropy', 'colsample_bylevel': 0.08082030461291365, 'depth': 3, 'boosting_type': 'Plain', 'bootstrap_type': 'Bayesian', 'bagging_temperature': 9.66397167281955}. Best is trial 98 with value: 0.8791208791208791.
[32m[I 2023-04-21 01:45:04,405][39m Trial 540 finished with value: 0.7096774193548387 and parameters: {'objective': 'CrossEntropy', 'colsample_bylevel': 0.023173704211603592, 'depth': 1, 'boosting_type': 'Plain', 'bootstrap_type': 'Bernoulli', 'subsample': 0.49514989264291337}. Best is trial 98 with value: 0.8791208791208791.
[32m[I 2023-04-21 01:45:04,973][39m Trial 541 finished with value: 0.8764044943820225 and parameters: {'objective': 'CrossEntropy', 'colsample_bylevel': 0.07798384202352329, 'depth': 2, 'boosting_type': 'Plain', 'bootstrap_type': 'Bayesian', 'bagging_temperature': 8.753402620405444}. Best is trial 98 with value: 0.8791208791208791.
[32m[I 2023-04-21 01:45:05,876][39m Trial 542 finished with value: 0.8539325842696629 and parameters: {'objective': 'Logloss', 'colsample_bylevel': 0.08588913710308614, 'depth': 2, 'boosting_type': 'Plain', 'bootstrap_type': 'Bayesian', 'bagging_temperature': 8.505631426739951}. Best is trial 98 with value: 0.8791208791208791.
[32m[I 2023-04-21 01:45:06,773][39m Trial 543 finished with value: 0.8539325842696629 and parameters: {'objective': 'Logloss', 'colsample_bylevel': 0.0906093804322581, 'depth': 3, 'boosting_type': 'Plain', 'bootstrap_type': 'Bayesian', 'bagging_temperature': 9.622274559602294}. Best is trial 98 with value: 0.8791208791208791.
[32m[I 2023-04-21 01:45:11,575][39m Trial 544 finished with value: 0.8409090909090909 and parameters: {'objective': 'CrossEntropy', 'colsample_bylevel': 0.09139137367259673, 'depth': 3, 'boosting_type': 'Ordered', 'bootstrap_type': 'MVS'}. Best is trial 98 with value: 0.8791208791208791.
[32m[I 2023-04-21 01:45:12,769][39m Trial 545 finished with value: 0.8636363636363636 and parameters: {'objective': 'CrossEntropy', 'colsample_bylevel': 0.08277274808569227, 'depth': 2, 'boosting_type': 'Plain', 'bootstrap_type': 'Bayesian', 'bagging_temperature': 8.607504341145079}. Best is trial 98 with value: 0.8791208791208791.
[32m[I 2023-04-21 01:45:13,411][39m Trial 546 finished with value: 0.8764044943820225 and parameters: {'objective': 'CrossEntropy', 'colsample_bylevel': 0.08663183245371886, 'depth': 2, 'boosting_type': 'Plain', 'bootstrap_type': 'Bayesian', 'bagging_temperature': 9.573719028656685}. Best is trial 98 with value: 0.8791208791208791.
[32m[I 2023-04-21 01:45:14,213][39m Trial 547 finished with value: 0.8409090909090909 and parameters: {'objective': 'Logloss', 'colsample_bylevel': 0.08809739250454286, 'depth': 2, 'boosting_type': 'Plain', 'bootstrap_type': 'Bayesian', 'bagging_temperature': 9.301377750981382}. Best is trial 98 with value: 0.8791208791208791.
[32m[I 2023-04-21 01:45:15,244][39m Trial 548 finished with value: 0.8372093023255814 and parameters: {'objective': 'CrossEntropy', 'colsample_bylevel': 0.08007057839806078, 'depth': 1, 'boosting_type': 'Plain', 'bootstrap_type': 'Bayesian', 'bagging_temperature': 9.204654340034688}. Best is trial 98 with value: 0.8791208791208791.
[32m[I 2023-04-21 01:45:15,830][39m Trial 549 finished with value: 0.8409090909090909 and parameters: {'objective': 'CrossEntropy', 'colsample_bylevel': 0.03811535394118592, 'depth': 3, 'boosting_type': 'Plain', 'bootstrap_type': 'Bayesian', 'bagging_temperature': 8.17390305207081}. Best is trial 98 with value: 0.8791208791208791.
[32m[I 2023-04-21 01:45:16,846][39m Trial 550 finished with value: 0.8636363636363636 and parameters: {'objective': 'CrossEntropy', 'colsample_bylevel': 0.08279614542497317, 'depth': 10, 'boosting_type': 'Plain', 'bootstrap_type': 'Bayesian', 'bagging_temperature': 9.422480763816319}. Best is trial 98 with value: 0.8791208791208791.
[32m[I 2023-04-21 01:45:17,663][39m Trial 551 finished with value: 0.8539325842696629 and parameters: {'objective': 'CrossEntropy', 'colsample_bylevel': 0.07463921455759728, 'depth': 2, 'boosting_type': 'Plain', 'bootstrap_type': 'Bayesian', 'bagging_temperature': 7.679752836971899}. Best is trial 98 with value: 0.8791208791208791.
[32m[I 2023-04-21 01:45:18,404][39m Trial 552 finished with value: 0.8539325842696629 and parameters: {'objective': 'CrossEntropy', 'colsample_bylevel': 0.08157201200491762, 'depth': 3, 'boosting_type': 'Plain', 'bootstrap_type': 'Bayesian', 'bagging_temperature': 7.886524617387687}. Best is trial 98 with value: 0.8791208791208791.
[32m[I 2023-04-21 01:45:19,081][39m Trial 553 finished with value: 0.8505747126436782 and parameters: {'objective': 'CrossEntropy', 'colsample_bylevel': 0.08519752503891671, 'depth': 2, 'boosting_type': 'Plain', 'bootstrap_type': 'Bayesian', 'bagging_temperature': 9.021464625990518}. Best is trial 98 with value: 0.8791208791208791.
[32m[I 2023-04-21 01:45:20,335][39m Trial 554 finished with value: 0.8666666666666666 and parameters: {'objective': 'Logloss', 'colsample_bylevel': 0.07237866409763308, 'depth': 5, 'boosting_type': 'Plain', 'bootstrap_type': 'Bayesian', 'bagging_temperature': 9.33718359500808}. Best is trial 98 with value: 0.8791208791208791.
[32m[I 2023-04-21 01:45:21,050][39m Trial 555 finished with value: 0.8409090909090909 and parameters: {'objective': 'Logloss', 'colsample_bylevel': 0.0886222089136779, 'depth': 3, 'boosting_type': 'Plain', 'bootstrap_type': 'Bayesian', 'bagging_temperature': 9.164755229303475}. Best is trial 98 with value: 0.8791208791208791.
[32m[I 2023-04-21 01:45:21,781][39m Trial 556 finished with value: 0.8139534883720929 and parameters: {'objective': 'CrossEntropy', 'colsample_bylevel': 0.08787521278863047, 'depth': 3, 'boosting_type': 'Plain', 'bootstrap_type': 'Bayesian', 'bagging_temperature': 8.85791849295559}. Best is trial 98 with value: 0.8791208791208791.
[32m[I 2023-04-21 01:45:22,697][39m Trial 557 finished with value: 0.8764044943820225 and parameters: {'objective': 'CrossEntropy', 'colsample_bylevel': 0.08293404510849642, 'depth': 2, 'boosting_type': 'Plain', 'bootstrap_type': 'Bayesian', 'bagging_temperature': 8.59732554513154}. Best is trial 98 with value: 0.8791208791208791.
[32m[I 2023-04-21 01:45:23,463][39m Trial 558 finished with value: 0.8636363636363636 and parameters: {'objective': 'CrossEntropy', 'colsample_bylevel': 0.08343031368423026, 'depth': 11, 'boosting_type': 'Plain', 'bootstrap_type': 'Bayesian', 'bagging_temperature': 8.494081790802042}. Best is trial 98 with value: 0.8791208791208791.
[32m[I 2023-04-21 01:45:24,609][39m Trial 559 finished with value: 0.8636363636363636 and parameters: {'objective': 'CrossEntropy', 'colsample_bylevel': 0.08454928998898419, 'depth': 2, 'boosting_type': 'Plain', 'bootstrap_type': 'Bayesian', 'bagging_temperature': 9.079334422811835}. Best is trial 98 with value: 0.8791208791208791.
[32m[I 2023-04-21 01:45:25,284][39m Trial 560 finished with value: 0.8505747126436782 and parameters: {'objective': 'CrossEntropy', 'colsample_bylevel': 0.08435552161924181, 'depth': 2, 'boosting_type': 'Plain', 'bootstrap_type': 'Bayesian', 'bagging_temperature': 8.905438538086349}. Best is trial 98 with value: 0.8791208791208791.
[32m[I 2023-04-21 01:45:26,184][39m Trial 561 finished with value: 0.8275862068965518 and parameters: {'objective': 'CrossEntropy', 'colsample_bylevel': 0.08660200038478365, 'depth': 4, 'boosting_type': 'Plain', 'bootstrap_type': 'Bayesian', 'bagging_temperature': 9.32403314395425}. Best is trial 98 with value: 0.8791208791208791.
[32m[I 2023-04-21 01:45:27,015][39m Trial 562 finished with value: 0.8505747126436782 and parameters: {'objective': 'CrossEntropy', 'colsample_bylevel': 0.08546805471579667, 'depth': 2, 'boosting_type': 'Plain', 'bootstrap_type': 'Bayesian', 'bagging_temperature': 8.95049456282116}. Best is trial 98 with value: 0.8791208791208791.
[32m[I 2023-04-21 01:45:27,789][39m Trial 563 finished with value: 0.8409090909090909 and parameters: {'objective': 'CrossEntropy', 'colsample_bylevel': 0.08701405146050667, 'depth': 3, 'boosting_type': 'Plain', 'bootstrap_type': 'Bayesian', 'bagging_temperature': 8.05078914024776}. Best is trial 98 with value: 0.8791208791208791.
[32m[I 2023-04-21 01:45:28,453][39m Trial 564 finished with value: 0.8275862068965518 and parameters: {'objective': 'Logloss', 'colsample_bylevel': 0.07585866160030685, 'depth': 2, 'boosting_type': 'Plain', 'bootstrap_type': 'Bayesian', 'bagging_temperature': 8.703976793647264}. Best is trial 98 with value: 0.8791208791208791.
[32m[I 2023-04-21 01:45:33,515][39m Trial 565 finished with value: 0.8089887640449439 and parameters: {'objective': 'CrossEntropy', 'colsample_bylevel': 0.07819874569667004, 'depth': 4, 'boosting_type': 'Ordered', 'bootstrap_type': 'MVS'}. Best is trial 98 with value: 0.8791208791208791.
[32m[I 2023-04-21 01:45:34,312][39m Trial 566 finished with value: 0.8139534883720929 and parameters: {'objective': 'Logloss', 'colsample_bylevel': 0.07833220247566855, 'depth': 1, 'boosting_type': 'Plain', 'bootstrap_type': 'Bayesian', 'bagging_temperature': 9.543508224089928}. Best is trial 98 with value: 0.8791208791208791.
[32m[I 2023-04-21 01:45:35,011][39m Trial 567 finished with value: 0.8 and parameters: {'objective': 'CrossEntropy', 'colsample_bylevel': 0.08602662439191254, 'depth': 2, 'boosting_type': 'Plain', 'bootstrap_type': 'Bernoulli', 'subsample': 0.9222336443020351}. Best is trial 98 with value: 0.8791208791208791.
[32m[I 2023-04-21 01:45:35,769][39m Trial 568 finished with value: 0.8539325842696629 and parameters: {'objective': 'CrossEntropy', 'colsample_bylevel': 0.07991171214220989, 'depth': 2, 'boosting_type': 'Plain', 'bootstrap_type': 'Bayesian', 'bagging_temperature': 8.407664177428943}. Best is trial 98 with value: 0.8791208791208791.
[32m[I 2023-04-21 01:45:36,982][39m Trial 569 finished with value: 0.8636363636363636 and parameters: {'objective': 'Logloss', 'colsample_bylevel': 0.07682373067769573, 'depth': 2, 'boosting_type': 'Plain', 'bootstrap_type': 'Bayesian', 'bagging_temperature': 8.734129779621355}. Best is trial 98 with value: 0.8791208791208791.
[32m[I 2023-04-21 01:45:37,746][39m Trial 570 finished with value: 0.8666666666666666 and parameters: {'objective': 'CrossEntropy', 'colsample_bylevel': 0.09000304205463695, 'depth': 3, 'boosting_type': 'Plain', 'bootstrap_type': 'Bayesian', 'bagging_temperature': 9.648016794588289}. Best is trial 98 with value: 0.8791208791208791.
[32m[I 2023-04-21 01:45:38,609][39m Trial 571 finished with value: 0.8764044943820225 and parameters: {'objective': 'Logloss', 'colsample_bylevel': 0.07692938722962295, 'depth': 2, 'boosting_type': 'Plain', 'bootstrap_type': 'Bayesian', 'bagging_temperature': 9.633522110756177}. Best is trial 98 with value: 0.8791208791208791.
[32m[I 2023-04-21 01:45:39,501][39m Trial 572 finished with value: 0.8539325842696629 and parameters: {'objective': 'CrossEntropy', 'colsample_bylevel': 0.08718033387304586, 'depth': 3, 'boosting_type': 'Plain', 'bootstrap_type': 'Bayesian', 'bagging_temperature': 9.279966022183556}. Best is trial 98 with value: 0.8791208791208791.
[32m[I 2023-04-21 01:45:40,351][39m Trial 573 finished with value: 0.8539325842696629 and parameters: {'objective': 'CrossEntropy', 'colsample_bylevel': 0.08138645438305765, 'depth': 2, 'boosting_type': 'Plain', 'bootstrap_type': 'Bayesian', 'bagging_temperature': 8.271051604928012}. Best is trial 98 with value: 0.8791208791208791.
[32m[I 2023-04-21 01:45:41,419][39m Trial 574 finished with value: 0.8275862068965518 and parameters: {'objective': 'Logloss', 'colsample_bylevel': 0.08335634325772444, 'depth': 8, 'boosting_type': 'Plain', 'bootstrap_type': 'Bayesian', 'bagging_temperature': 8.89790087240741}. Best is trial 98 with value: 0.8791208791208791.
[32m[I 2023-04-21 01:45:42,104][39m Trial 575 finished with value: 0.8139534883720929 and parameters: {'objective': 'CrossEntropy', 'colsample_bylevel': 0.08942657281502776, 'depth': 1, 'boosting_type': 'Plain', 'bootstrap_type': 'Bayesian', 'bagging_temperature': 8.843165549909168}. Best is trial 98 with value: 0.8791208791208791.
[32m[I 2023-04-21 01:45:42,693][39m Trial 576 finished with value: 0.8539325842696629 and parameters: {'objective': 'CrossEntropy', 'colsample_bylevel': 0.09722633178777516, 'depth': 2, 'boosting_type': 'Plain', 'bootstrap_type': 'Bayesian', 'bagging_temperature': 9.522531108247438}. Best is trial 98 with value: 0.8791208791208791.
[32m[I 2023-04-21 01:45:43,664][39m Trial 577 finished with value: 0.8764044943820225 and parameters: {'objective': 'CrossEntropy', 'colsample_bylevel': 0.08788239075510616, 'depth': 2, 'boosting_type': 'Plain', 'bootstrap_type': 'Bayesian', 'bagging_temperature': 8.202540447091831}. Best is trial 98 with value: 0.8791208791208791.
[32m[I 2023-04-21 01:45:44,309][39m Trial 578 finished with value: 0.8505747126436782 and parameters: {'objective': 'CrossEntropy', 'colsample_bylevel': 0.06041896620917957, 'depth': 2, 'boosting_type': 'Plain', 'bootstrap_type': 'Bayesian', 'bagging_temperature': 7.884970501555615}. Best is trial 98 with value: 0.8791208791208791.
[32m[I 2023-04-21 01:45:45,071][39m Trial 579 finished with value: 0.8539325842696629 and parameters: {'objective': 'CrossEntropy', 'colsample_bylevel': 0.08159817446866877, 'depth': 2, 'boosting_type': 'Plain', 'bootstrap_type': 'Bayesian', 'bagging_temperature': 9.826199996585746}. Best is trial 98 with value: 0.8791208791208791.
[32m[I 2023-04-21 01:45:46,179][39m Trial 580 finished with value: 0.8636363636363636 and parameters: {'objective': 'CrossEntropy', 'colsample_bylevel': 0.07958530997626782, 'depth': 2, 'boosting_type': 'Plain', 'bootstrap_type': 'Bayesian', 'bagging_temperature': 9.333408999602995}. Best is trial 98 with value: 0.8791208791208791.
[32m[I 2023-04-21 01:45:47,125][39m Trial 581 finished with value: 0.8089887640449439 and parameters: {'objective': 'Logloss', 'colsample_bylevel': 0.054650716137727796, 'depth': 2, 'boosting_type': 'Plain', 'bootstrap_type': 'Bayesian', 'bagging_temperature': 1.6309048116729379}. Best is trial 98 with value: 0.8791208791208791.
[32m[I 2023-04-21 01:45:47,726][39m Trial 582 finished with value: 0.8666666666666666 and parameters: {'objective': 'CrossEntropy', 'colsample_bylevel': 0.07457903283924056, 'depth': 3, 'boosting_type': 'Plain', 'bootstrap_type': 'Bayesian', 'bagging_temperature': 8.773319052420385}. Best is trial 98 with value: 0.8791208791208791.
[32m[I 2023-04-21 01:45:48,763][39m Trial 583 finished with value: 0.8666666666666666 and parameters: {'objective': 'CrossEntropy', 'colsample_bylevel': 0.08124787792132039, 'depth': 3, 'boosting_type': 'Plain', 'bootstrap_type': 'Bayesian', 'bagging_temperature': 9.180613537954619}. Best is trial 98 with value: 0.8791208791208791.
[32m[I 2023-04-21 01:45:53,365][39m Trial 584 finished with value: 0.8045977011494252 and parameters: {'objective': 'Logloss', 'colsample_bylevel': 0.08472236744023255, 'depth': 1, 'boosting_type': 'Ordered', 'bootstrap_type': 'Bernoulli', 'subsample': 0.18808065012957892}. Best is trial 98 with value: 0.8791208791208791.
[32m[I 2023-04-21 01:45:54,616][39m Trial 585 finished with value: 0.8505747126436782 and parameters: {'objective': 'Logloss', 'colsample_bylevel': 0.0834103285176116, 'depth': 2, 'boosting_type': 'Plain', 'bootstrap_type': 'Bayesian', 'bagging_temperature': 9.676175609027073}. Best is trial 98 with value: 0.8791208791208791.
[32m[I 2023-04-21 01:45:55,462][39m Trial 586 finished with value: 0.8505747126436782 and parameters: {'objective': 'Logloss', 'colsample_bylevel': 0.08572951738647229, 'depth': 2, 'boosting_type': 'Plain', 'bootstrap_type': 'Bayesian', 'bagging_temperature': 8.54727056218599}. Best is trial 98 with value: 0.8791208791208791.
[32m[I 2023-04-21 01:45:56,264][39m Trial 587 finished with value: 0.8505747126436782 and parameters: {'objective': 'Logloss', 'colsample_bylevel': 0.08631508043014188, 'depth': 2, 'boosting_type': 'Plain', 'bootstrap_type': 'Bayesian', 'bagging_temperature': 8.362325747456694}. Best is trial 98 with value: 0.8791208791208791.
[32m[I 2023-04-21 01:45:56,838][39m Trial 588 finished with value: 0.8666666666666666 and parameters: {'objective': 'CrossEntropy', 'colsample_bylevel': 0.08338923431984079, 'depth': 3, 'boosting_type': 'Plain', 'bootstrap_type': 'Bayesian', 'bagging_temperature': 9.086846136133262}. Best is trial 98 with value: 0.8791208791208791.
[32m[I 2023-04-21 01:45:57,903][39m Trial 589 finished with value: 0.8666666666666666 and parameters: {'objective': 'CrossEntropy', 'colsample_bylevel': 0.07809905156417195, 'depth': 2, 'boosting_type': 'Plain', 'bootstrap_type': 'Bayesian', 'bagging_temperature': 8.430354782045155}. Best is trial 98 with value: 0.8791208791208791.
[32m[I 2023-04-21 01:45:58,555][39m Trial 590 finished with value: 0.8372093023255814 and parameters: {'objective': 'CrossEntropy', 'colsample_bylevel': 0.08130007049365115, 'depth': 1, 'boosting_type': 'Plain', 'bootstrap_type': 'Bayesian', 'bagging_temperature': 8.061927585791901}. Best is trial 98 with value: 0.8791208791208791.
[32m[I 2023-04-21 01:45:59,397][39m Trial 591 finished with value: 0.8666666666666666 and parameters: {'objective': 'CrossEntropy', 'colsample_bylevel': 0.07533295169772519, 'depth': 3, 'boosting_type': 'Plain', 'bootstrap_type': 'Bayesian', 'bagging_temperature': 9.976678598905837}. Best is trial 98 with value: 0.8791208791208791.
[32m[I 2023-04-21 01:46:00,288][39m Trial 592 finished with value: 0.8222222222222222 and parameters: {'objective': 'CrossEntropy', 'colsample_bylevel': 0.07787212654956342, 'depth': 2, 'boosting_type': 'Plain', 'bootstrap_type': 'MVS'}. Best is trial 98 with value: 0.8791208791208791.
[32m[I 2023-04-21 01:46:01,244][39m Trial 593 finished with value: 0.8539325842696629 and parameters: {'objective': 'Logloss', 'colsample_bylevel': 0.09071808197840527, 'depth': 3, 'boosting_type': 'Plain', 'bootstrap_type': 'Bayesian', 'bagging_temperature': 9.598314579817478}. Best is trial 98 with value: 0.8791208791208791.
[32m[I 2023-04-21 01:46:02,304][39m Trial 594 finished with value: 0.8764044943820225 and parameters: {'objective': 'CrossEntropy', 'colsample_bylevel': 0.08839997621335396, 'depth': 2, 'boosting_type': 'Plain', 'bootstrap_type': 'Bayesian', 'bagging_temperature': 9.386011510108137}. Best is trial 98 with value: 0.8791208791208791.
[32m[I 2023-04-21 01:46:02,951][39m Trial 595 finished with value: 0.8666666666666666 and parameters: {'objective': 'CrossEntropy', 'colsample_bylevel': 0.0992722818107504, 'depth': 2, 'boosting_type': 'Plain', 'bootstrap_type': 'Bayesian', 'bagging_temperature': 8.564952790937893}. Best is trial 98 with value: 0.8791208791208791.
