[32m[I 2023-04-21 01:46:03,876][39m Trial 596 finished with value: 0.8275862068965518 and parameters: {'objective': 'CrossEntropy', 'colsample_bylevel': 0.0790760067827657, 'depth': 9, 'boosting_type': 'Plain', 'bootstrap_type': 'Bayesian', 'bagging_temperature': 9.191858601578506}. Best is trial 98 with value: 0.8791208791208791.
[32m[I 2023-04-21 01:46:04,488][39m Trial 597 finished with value: 0.8636363636363636 and parameters: {'objective': 'Logloss', 'colsample_bylevel': 0.08196153123155958, 'depth': 2, 'boosting_type': 'Plain', 'bootstrap_type': 'Bayesian', 'bagging_temperature': 9.241043330393952}. Best is trial 98 with value: 0.8791208791208791.
[32m[I 2023-04-21 01:46:05,308][39m Trial 598 finished with value: 0.8539325842696629 and parameters: {'objective': 'CrossEntropy', 'colsample_bylevel': 0.08410153830560439, 'depth': 2, 'boosting_type': 'Plain', 'bootstrap_type': 'Bayesian', 'bagging_temperature': 9.497957262416909}. Best is trial 98 with value: 0.8791208791208791.
[32m[I 2023-04-21 01:46:06,120][39m Trial 599 finished with value: 0.8636363636363636 and parameters: {'objective': 'CrossEntropy', 'colsample_bylevel': 0.07887897692835878, 'depth': 2, 'boosting_type': 'Plain', 'bootstrap_type': 'Bayesian', 'bagging_temperature': 8.922422060322383}. Best is trial 98 with value: 0.8791208791208791.
[32m[I 2023-04-21 01:46:07,083][39m Trial 600 finished with value: 0.7999999999999999 and parameters: {'objective': 'CrossEntropy', 'colsample_bylevel': 0.0949099385689303, 'depth': 1, 'boosting_type': 'Plain', 'bootstrap_type': 'Bayesian', 'bagging_temperature': 9.444957046738129}. Best is trial 98 with value: 0.8791208791208791.
[32m[I 2023-04-21 01:46:07,915][39m Trial 601 finished with value: 0.8764044943820225 and parameters: {'objective': 'CrossEntropy', 'colsample_bylevel': 0.08766004950579585, 'depth': 2, 'boosting_type': 'Plain', 'bootstrap_type': 'Bayesian', 'bagging_temperature': 9.76527899672671}. Best is trial 98 with value: 0.8791208791208791.
[32m[I 2023-04-21 01:46:12,094][39m Trial 602 finished with value: 0.8297872340425531 and parameters: {'objective': 'CrossEntropy', 'colsample_bylevel': 0.07687995299361011, 'depth': 2, 'boosting_type': 'Ordered', 'bootstrap_type': 'Bayesian', 'bagging_temperature': 9.77274644027141}. Best is trial 98 with value: 0.8791208791208791.
[32m[I 2023-04-21 01:46:12,976][39m Trial 603 finished with value: 0.8409090909090909 and parameters: {'objective': 'Logloss', 'colsample_bylevel': 0.08207929790089119, 'depth': 2, 'boosting_type': 'Plain', 'bootstrap_type': 'Bayesian', 'bagging_temperature': 9.530329405193688}. Best is trial 98 with value: 0.8791208791208791.
[32m[I 2023-04-21 01:46:13,881][39m Trial 604 finished with value: 0.8764044943820225 and parameters: {'objective': 'CrossEntropy', 'colsample_bylevel': 0.0847891055303822, 'depth': 2, 'boosting_type': 'Plain', 'bootstrap_type': 'Bayesian', 'bagging_temperature': 9.008539713329263}. Best is trial 98 with value: 0.8791208791208791.
[32m[I 2023-04-21 01:46:14,984][39m Trial 605 finished with value: 0.8539325842696629 and parameters: {'objective': 'Logloss', 'colsample_bylevel': 0.08653137095577929, 'depth': 2, 'boosting_type': 'Plain', 'bootstrap_type': 'Bayesian', 'bagging_temperature': 8.849279678807639}. Best is trial 98 with value: 0.8791208791208791.
[32m[I 2023-04-21 01:46:15,921][39m Trial 606 finished with value: 0.8372093023255814 and parameters: {'objective': 'CrossEntropy', 'colsample_bylevel': 0.08574604997327757, 'depth': 1, 'boosting_type': 'Plain', 'bootstrap_type': 'Bayesian', 'bagging_temperature': 8.59346978787444}. Best is trial 98 with value: 0.8791208791208791.
[32m[I 2023-04-21 01:46:16,709][39m Trial 607 finished with value: 0.8409090909090909 and parameters: {'objective': 'Logloss', 'colsample_bylevel': 0.0711117385426973, 'depth': 3, 'boosting_type': 'Plain', 'bootstrap_type': 'Bernoulli', 'subsample': 0.6665749115397277}. Best is trial 98 with value: 0.8791208791208791.
[32m[I 2023-04-21 01:46:17,268][39m Trial 608 finished with value: 0.8372093023255814 and parameters: {'objective': 'CrossEntropy', 'colsample_bylevel': 0.08131447930783767, 'depth': 2, 'boosting_type': 'Plain', 'bootstrap_type': 'Bayesian', 'bagging_temperature': 8.20274758592418}. Best is trial 98 with value: 0.8791208791208791.
[32m[I 2023-04-21 01:46:17,909][39m Trial 609 finished with value: 0.8409090909090909 and parameters: {'objective': 'CrossEntropy', 'colsample_bylevel': 0.08434251178168364, 'depth': 6, 'boosting_type': 'Plain', 'bootstrap_type': 'Bayesian', 'bagging_temperature': 9.813827871686765}. Best is trial 98 with value: 0.8791208791208791.
[32m[I 2023-04-21 01:46:18,926][39m Trial 610 finished with value: 0.8409090909090909 and parameters: {'objective': 'CrossEntropy', 'colsample_bylevel': 0.08749030284837384, 'depth': 4, 'boosting_type': 'Plain', 'bootstrap_type': 'Bayesian', 'bagging_temperature': 9.013295055077442}. Best is trial 98 with value: 0.8791208791208791.
[32m[I 2023-04-21 01:46:19,980][39m Trial 611 finished with value: 0.8666666666666666 and parameters: {'objective': 'CrossEntropy', 'colsample_bylevel': 0.08617124547751438, 'depth': 3, 'boosting_type': 'Plain', 'bootstrap_type': 'Bayesian', 'bagging_temperature': 9.33355430613555}. Best is trial 98 with value: 0.8791208791208791.
[32m[I 2023-04-21 01:46:20,837][39m Trial 612 finished with value: 0.8409090909090909 and parameters: {'objective': 'CrossEntropy', 'colsample_bylevel': 0.08161381844649584, 'depth': 2, 'boosting_type': 'Plain', 'bootstrap_type': 'MVS'}. Best is trial 98 with value: 0.8791208791208791.
[32m[I 2023-04-21 01:46:21,659][39m Trial 613 finished with value: 0.8539325842696629 and parameters: {'objective': 'CrossEntropy', 'colsample_bylevel': 0.07902722391986752, 'depth': 2, 'boosting_type': 'Plain', 'bootstrap_type': 'Bayesian', 'bagging_temperature': 8.686670838443664}. Best is trial 98 with value: 0.8791208791208791.
[32m[I 2023-04-21 01:46:22,488][39m Trial 614 finished with value: 0.8539325842696629 and parameters: {'objective': 'CrossEntropy', 'colsample_bylevel': 0.08475571046547896, 'depth': 2, 'boosting_type': 'Plain', 'bootstrap_type': 'Bayesian', 'bagging_temperature': 9.055048902321326}. Best is trial 98 with value: 0.8791208791208791.
[32m[I 2023-04-21 01:46:23,200][39m Trial 615 finished with value: 0.8409090909090909 and parameters: {'objective': 'Logloss', 'colsample_bylevel': 0.08984481544242222, 'depth': 2, 'boosting_type': 'Plain', 'bootstrap_type': 'Bayesian', 'bagging_temperature': 9.161903194796974}. Best is trial 98 with value: 0.8791208791208791.
[32m[I 2023-04-21 01:46:23,828][39m Trial 616 finished with value: 0.8636363636363636 and parameters: {'objective': 'CrossEntropy', 'colsample_bylevel': 0.0822785905176498, 'depth': 2, 'boosting_type': 'Plain', 'bootstrap_type': 'Bayesian', 'bagging_temperature': 8.718382804036457}. Best is trial 98 with value: 0.8791208791208791.
[32m[I 2023-04-21 01:46:24,749][39m Trial 617 finished with value: 0.8275862068965518 and parameters: {'objective': 'CrossEntropy', 'colsample_bylevel': 0.08782860288140773, 'depth': 3, 'boosting_type': 'Plain', 'bootstrap_type': 'Bayesian', 'bagging_temperature': 4.71894539723327}. Best is trial 98 with value: 0.8791208791208791.
[32m[I 2023-04-21 01:46:25,443][39m Trial 618 finished with value: 0.8539325842696629 and parameters: {'objective': 'CrossEntropy', 'colsample_bylevel': 0.0743508968231034, 'depth': 3, 'boosting_type': 'Plain', 'bootstrap_type': 'Bayesian', 'bagging_temperature': 9.871805098496186}. Best is trial 98 with value: 0.8791208791208791.
[32m[I 2023-04-21 01:46:26,397][39m Trial 619 finished with value: 0.8139534883720929 and parameters: {'objective': 'CrossEntropy', 'colsample_bylevel': 0.07314111624817368, 'depth': 7, 'boosting_type': 'Plain', 'bootstrap_type': 'Bayesian', 'bagging_temperature': 9.932679631778663}. Best is trial 98 with value: 0.8791208791208791.
[32m[I 2023-04-21 01:46:27,290][39m Trial 620 finished with value: 0.8372093023255814 and parameters: {'objective': 'Logloss', 'colsample_bylevel': 0.08436412078139927, 'depth': 12, 'boosting_type': 'Plain', 'bootstrap_type': 'Bayesian', 'bagging_temperature': 4.200772881558171}. Best is trial 98 with value: 0.8791208791208791.
[32m[I 2023-04-21 01:46:28,125][39m Trial 621 finished with value: 0.7951807228915663 and parameters: {'objective': 'CrossEntropy', 'colsample_bylevel': 0.07674609158312465, 'depth': 1, 'boosting_type': 'Plain', 'bootstrap_type': 'Bayesian', 'bagging_temperature': 9.69248636934411}. Best is trial 98 with value: 0.8791208791208791.
[32m[I 2023-04-21 01:46:32,942][39m Trial 622 finished with value: 0.8409090909090909 and parameters: {'objective': 'CrossEntropy', 'colsample_bylevel': 0.09179659433526353, 'depth': 2, 'boosting_type': 'Ordered', 'bootstrap_type': 'Bayesian', 'bagging_temperature': 8.83272706754298}. Best is trial 98 with value: 0.8791208791208791.
[32m[I 2023-04-21 01:46:33,755][39m Trial 623 finished with value: 0.8764044943820225 and parameters: {'objective': 'CrossEntropy', 'colsample_bylevel': 0.062420838226399954, 'depth': 2, 'boosting_type': 'Plain', 'bootstrap_type': 'Bayesian', 'bagging_temperature': 9.830268113400566}. Best is trial 98 with value: 0.8791208791208791.
[32m[I 2023-04-21 01:46:34,783][39m Trial 624 finished with value: 0.8604651162790697 and parameters: {'objective': 'CrossEntropy', 'colsample_bylevel': 0.06599777812224193, 'depth': 2, 'boosting_type': 'Plain', 'bootstrap_type': 'Bayesian', 'bagging_temperature': 9.364899312360121}. Best is trial 98 with value: 0.8791208791208791.
[32m[I 2023-04-21 01:46:35,419][39m Trial 625 finished with value: 0.8571428571428571 and parameters: {'objective': 'Logloss', 'colsample_bylevel': 0.08592215150513038, 'depth': 2, 'boosting_type': 'Plain', 'bootstrap_type': 'Bayesian', 'bagging_temperature': 9.134239674451251}. Best is trial 98 with value: 0.8791208791208791.
[32m[I 2023-04-21 01:46:36,282][39m Trial 626 finished with value: 0.8764044943820225 and parameters: {'objective': 'CrossEntropy', 'colsample_bylevel': 0.08407930101155012, 'depth': 2, 'boosting_type': 'Plain', 'bootstrap_type': 'Bayesian', 'bagging_temperature': 9.108008246677159}. Best is trial 98 with value: 0.8791208791208791.
[32m[I 2023-04-21 01:46:37,066][39m Trial 627 finished with value: 0.8333333333333333 and parameters: {'objective': 'CrossEntropy', 'colsample_bylevel': 0.08867429830397708, 'depth': 1, 'boosting_type': 'Plain', 'bootstrap_type': 'Bayesian', 'bagging_temperature': 8.11787766671586}. Best is trial 98 with value: 0.8791208791208791.
[32m[I 2023-04-21 01:46:37,830][39m Trial 628 finished with value: 0.8409090909090909 and parameters: {'objective': 'CrossEntropy', 'colsample_bylevel': 0.08986203363415005, 'depth': 3, 'boosting_type': 'Plain', 'bootstrap_type': 'Bayesian', 'bagging_temperature': 9.72874144574543}. Best is trial 98 with value: 0.8791208791208791.
[32m[I 2023-04-21 01:46:38,988][39m Trial 629 finished with value: 0.8539325842696629 and parameters: {'objective': 'Logloss', 'colsample_bylevel': 0.08690130700808674, 'depth': 2, 'boosting_type': 'Plain', 'bootstrap_type': 'Bayesian', 'bagging_temperature': 9.159136779393807}. Best is trial 98 with value: 0.8791208791208791.
[32m[I 2023-04-21 01:46:39,673][39m Trial 630 finished with value: 0.8314606741573034 and parameters: {'objective': 'CrossEntropy', 'colsample_bylevel': 0.09104115592289073, 'depth': 3, 'boosting_type': 'Plain', 'bootstrap_type': 'Bernoulli', 'subsample': 0.4593339736906785}. Best is trial 98 with value: 0.8791208791208791.
[32m[I 2023-04-21 01:46:40,802][39m Trial 631 finished with value: 0.8636363636363636 and parameters: {'objective': 'Logloss', 'colsample_bylevel': 0.07512015848645096, 'depth': 2, 'boosting_type': 'Plain', 'bootstrap_type': 'Bayesian', 'bagging_temperature': 9.321941177716793}. Best is trial 98 with value: 0.8791208791208791.
[32m[I 2023-04-21 01:46:41,730][39m Trial 632 finished with value: 0.8539325842696629 and parameters: {'objective': 'CrossEntropy', 'colsample_bylevel': 0.09618433952631729, 'depth': 2, 'boosting_type': 'Plain', 'bootstrap_type': 'Bayesian', 'bagging_temperature': 9.996692913888376}. Best is trial 98 with value: 0.8791208791208791.
[32m[I 2023-04-21 01:46:42,451][39m Trial 633 finished with value: 0.8764044943820225 and parameters: {'objective': 'CrossEntropy', 'colsample_bylevel': 0.08553796969088154, 'depth': 2, 'boosting_type': 'Plain', 'bootstrap_type': 'Bayesian', 'bagging_temperature': 9.258946189530207}. Best is trial 98 with value: 0.8791208791208791.
[32m[I 2023-04-21 01:46:43,115][39m Trial 634 finished with value: 0.8 and parameters: {'objective': 'CrossEntropy', 'colsample_bylevel': 0.08313245269358883, 'depth': 1, 'boosting_type': 'Plain', 'bootstrap_type': 'MVS'}. Best is trial 98 with value: 0.8791208791208791.
[32m[I 2023-04-21 01:46:44,201][39m Trial 635 finished with value: 0.8409090909090909 and parameters: {'objective': 'CrossEntropy', 'colsample_bylevel': 0.09827155757333214, 'depth': 2, 'boosting_type': 'Plain', 'bootstrap_type': 'Bayesian', 'bagging_temperature': 9.504135748261591}. Best is trial 98 with value: 0.8791208791208791.
[32m[I 2023-04-21 01:46:44,915][39m Trial 636 finished with value: 0.8139534883720929 and parameters: {'objective': 'CrossEntropy', 'colsample_bylevel': 0.07726683460605085, 'depth': 4, 'boosting_type': 'Plain', 'bootstrap_type': 'Bayesian', 'bagging_temperature': 9.640108541804697}. Best is trial 98 with value: 0.8791208791208791.
[32m[I 2023-04-21 01:46:45,808][39m Trial 637 finished with value: 0.8275862068965518 and parameters: {'objective': 'CrossEntropy', 'colsample_bylevel': 0.04124129486532512, 'depth': 11, 'boosting_type': 'Plain', 'bootstrap_type': 'Bayesian', 'bagging_temperature': 7.75521846199811}. Best is trial 98 with value: 0.8791208791208791.
[32m[I 2023-04-21 01:46:46,463][39m Trial 638 finished with value: 0.8636363636363636 and parameters: {'objective': 'CrossEntropy', 'colsample_bylevel': 0.08384727009777711, 'depth': 2, 'boosting_type': 'Plain', 'bootstrap_type': 'Bayesian', 'bagging_temperature': 8.95691449818981}. Best is trial 98 with value: 0.8791208791208791.
[32m[I 2023-04-21 01:46:47,262][39m Trial 639 finished with value: 0.8539325842696629 and parameters: {'objective': 'CrossEntropy', 'colsample_bylevel': 0.09335348401968781, 'depth': 2, 'boosting_type': 'Plain', 'bootstrap_type': 'Bayesian', 'bagging_temperature': 8.651565416296338}. Best is trial 98 with value: 0.8791208791208791.
[32m[I 2023-04-21 01:46:48,119][39m Trial 640 finished with value: 0.8409090909090909 and parameters: {'objective': 'CrossEntropy', 'colsample_bylevel': 0.09257673616122065, 'depth': 2, 'boosting_type': 'Plain', 'bootstrap_type': 'Bayesian', 'bagging_temperature': 8.80747407681545}. Best is trial 98 with value: 0.8791208791208791.
[32m[I 2023-04-21 01:46:52,712][39m Trial 641 finished with value: 0.7954545454545454 and parameters: {'objective': 'Logloss', 'colsample_bylevel': 0.07560480330875854, 'depth': 1, 'boosting_type': 'Ordered', 'bootstrap_type': 'Bayesian', 'bagging_temperature': 9.770862719483326}. Best is trial 98 with value: 0.8791208791208791.
[32m[I 2023-04-21 01:46:53,761][39m Trial 642 finished with value: 0.8636363636363636 and parameters: {'objective': 'CrossEntropy', 'colsample_bylevel': 0.08021227119254726, 'depth': 2, 'boosting_type': 'Plain', 'bootstrap_type': 'Bayesian', 'bagging_temperature': 8.983671009575747}. Best is trial 98 with value: 0.8791208791208791.
[32m[I 2023-04-21 01:46:54,495][39m Trial 643 finished with value: 0.8539325842696629 and parameters: {'objective': 'CrossEntropy', 'colsample_bylevel': 0.08123366277274983, 'depth': 2, 'boosting_type': 'Plain', 'bootstrap_type': 'Bayesian', 'bagging_temperature': 9.973376893173137}. Best is trial 98 with value: 0.8791208791208791.
[32m[I 2023-04-21 01:46:55,295][39m Trial 644 finished with value: 0.8539325842696629 and parameters: {'objective': 'Logloss', 'colsample_bylevel': 0.09244699459482432, 'depth': 3, 'boosting_type': 'Plain', 'bootstrap_type': 'Bayesian', 'bagging_temperature': 8.440879601214315}. Best is trial 98 with value: 0.8791208791208791.
[32m[I 2023-04-21 01:46:56,476][39m Trial 645 finished with value: 0.8636363636363636 and parameters: {'objective': 'CrossEntropy', 'colsample_bylevel': 0.08019715909706086, 'depth': 2, 'boosting_type': 'Plain', 'bootstrap_type': 'Bayesian', 'bagging_temperature': 9.122113719837133}. Best is trial 98 with value: 0.8791208791208791.
[32m[I 2023-04-21 01:46:57,131][39m Trial 646 finished with value: 0.8764044943820225 and parameters: {'objective': 'CrossEntropy', 'colsample_bylevel': 0.08502521996694534, 'depth': 2, 'boosting_type': 'Plain', 'bootstrap_type': 'Bayesian', 'bagging_temperature': 9.234363889771478}. Best is trial 98 with value: 0.8791208791208791.
[32m[I 2023-04-21 01:46:58,171][39m Trial 647 finished with value: 0.8636363636363636 and parameters: {'objective': 'CrossEntropy', 'colsample_bylevel': 0.08731307514139953, 'depth': 2, 'boosting_type': 'Plain', 'bootstrap_type': 'Bayesian', 'bagging_temperature': 8.480788011333958}. Best is trial 98 with value: 0.8791208791208791.
[32m[I 2023-04-21 01:46:58,915][39m Trial 648 finished with value: 0.8764044943820225 and parameters: {'objective': 'CrossEntropy', 'colsample_bylevel': 0.08812440516389322, 'depth': 2, 'boosting_type': 'Plain', 'bootstrap_type': 'Bayesian', 'bagging_temperature': 8.236162076112011}. Best is trial 98 with value: 0.8791208791208791.
[32m[I 2023-04-21 01:47:00,129][39m Trial 649 finished with value: 0.8539325842696629 and parameters: {'objective': 'CrossEntropy', 'colsample_bylevel': 0.08933459721821113, 'depth': 3, 'boosting_type': 'Plain', 'bootstrap_type': 'Bayesian', 'bagging_temperature': 8.19761411048952}. Best is trial 98 with value: 0.8791208791208791.
[32m[I 2023-04-21 01:47:00,798][39m Trial 650 finished with value: 0.8045977011494252 and parameters: {'objective': 'CrossEntropy', 'colsample_bylevel': 0.07860005636655355, 'depth': 3, 'boosting_type': 'Plain', 'bootstrap_type': 'Bernoulli', 'subsample': 0.5683750403798203}. Best is trial 98 with value: 0.8791208791208791.
[32m[I 2023-04-21 01:47:01,698][39m Trial 651 finished with value: 0.8539325842696629 and parameters: {'objective': 'CrossEntropy', 'colsample_bylevel': 0.08316326937543304, 'depth': 3, 'boosting_type': 'Plain', 'bootstrap_type': 'Bayesian', 'bagging_temperature': 9.485119752045748}. Best is trial 98 with value: 0.8791208791208791.
[32m[I 2023-04-21 01:47:02,672][39m Trial 652 finished with value: 0.8505747126436782 and parameters: {'objective': 'CrossEntropy', 'colsample_bylevel': 0.08342210540134012, 'depth': 5, 'boosting_type': 'Plain', 'bootstrap_type': 'Bayesian', 'bagging_temperature': 5.641861669781921}. Best is trial 98 with value: 0.8791208791208791.
[32m[I 2023-04-21 01:47:03,324][39m Trial 653 finished with value: 0.8539325842696629 and parameters: {'objective': 'CrossEntropy', 'colsample_bylevel': 0.07761633741730155, 'depth': 3, 'boosting_type': 'Plain', 'bootstrap_type': 'Bayesian', 'bagging_temperature': 8.675694746363115}. Best is trial 98 with value: 0.8791208791208791.
[32m[I 2023-04-21 01:47:04,422][39m Trial 654 finished with value: 0.7999999999999999 and parameters: {'objective': 'CrossEntropy', 'colsample_bylevel': 0.09580884105098794, 'depth': 1, 'boosting_type': 'Plain', 'bootstrap_type': 'Bayesian', 'bagging_temperature': 9.612133878163382}. Best is trial 98 with value: 0.8791208791208791.
[32m[I 2023-04-21 01:47:05,127][39m Trial 655 finished with value: 0.8764044943820225 and parameters: {'objective': 'CrossEntropy', 'colsample_bylevel': 0.0913348824023817, 'depth': 2, 'boosting_type': 'Plain', 'bootstrap_type': 'Bayesian', 'bagging_temperature': 8.895319581021916}. Best is trial 98 with value: 0.8791208791208791.
[32m[I 2023-04-21 01:47:06,068][39m Trial 656 finished with value: 0.8539325842696629 and parameters: {'objective': 'CrossEntropy', 'colsample_bylevel': 0.0869157883254988, 'depth': 2, 'boosting_type': 'Plain', 'bootstrap_type': 'Bayesian', 'bagging_temperature': 8.365555229461151}. Best is trial 98 with value: 0.8791208791208791.
[32m[I 2023-04-21 01:47:06,823][39m Trial 657 finished with value: 0.8181818181818182 and parameters: {'objective': 'CrossEntropy', 'colsample_bylevel': 0.09377287090154089, 'depth': 3, 'boosting_type': 'Plain', 'bootstrap_type': 'MVS'}. Best is trial 98 with value: 0.8791208791208791.
[32m[I 2023-04-21 01:47:07,628][39m Trial 658 finished with value: 0.8666666666666666 and parameters: {'objective': 'Logloss', 'colsample_bylevel': 0.08004875864007978, 'depth': 2, 'boosting_type': 'Plain', 'bootstrap_type': 'Bayesian', 'bagging_temperature': 7.297463276195393}. Best is trial 98 with value: 0.8791208791208791.
[32m[I 2023-04-21 01:47:08,495][39m Trial 659 finished with value: 0.8764044943820225 and parameters: {'objective': 'CrossEntropy', 'colsample_bylevel': 0.0883301367636566, 'depth': 2, 'boosting_type': 'Plain', 'bootstrap_type': 'Bayesian', 'bagging_temperature': 8.646412134831534}. Best is trial 98 with value: 0.8791208791208791.
[32m[I 2023-04-21 01:47:09,255][39m Trial 660 finished with value: 0.8275862068965518 and parameters: {'objective': 'CrossEntropy', 'colsample_bylevel': 0.08906519634132044, 'depth': 4, 'boosting_type': 'Plain', 'bootstrap_type': 'Bayesian', 'bagging_temperature': 8.670541249356992}. Best is trial 98 with value: 0.8791208791208791.
[32m[I 2023-04-21 01:47:14,035][39m Trial 661 finished with value: 0.8181818181818182 and parameters: {'objective': 'CrossEntropy', 'colsample_bylevel': 0.05128855467550785, 'depth': 2, 'boosting_type': 'Ordered', 'bootstrap_type': 'Bayesian', 'bagging_temperature': 8.503880536384013}. Best is trial 98 with value: 0.8791208791208791.
