[32m[I 2023-04-21 02:44:37,234][39m Trial 3693 finished with value: 0.8275862068965518 and parameters: {'objective': 'CrossEntropy', 'colsample_bylevel': 0.05489642730798614, 'depth': 5, 'boosting_type': 'Plain', 'bootstrap_type': 'Bayesian', 'bagging_temperature': 5.875494964280523}. Best is trial 3065 with value: 0.8863636363636364.
[32m[I 2023-04-21 02:44:38,351][39m Trial 3694 finished with value: 0.8539325842696629 and parameters: {'objective': 'Logloss', 'colsample_bylevel': 0.06956414188594956, 'depth': 9, 'boosting_type': 'Plain', 'bootstrap_type': 'Bayesian', 'bagging_temperature': 8.437823838711337}. Best is trial 3065 with value: 0.8863636363636364.
[32m[I 2023-04-21 02:44:39,334][39m Trial 3695 finished with value: 0.8539325842696629 and parameters: {'objective': 'Logloss', 'colsample_bylevel': 0.07459007916697043, 'depth': 11, 'boosting_type': 'Plain', 'bootstrap_type': 'Bayesian', 'bagging_temperature': 9.58710820053551}. Best is trial 3065 with value: 0.8863636363636364.
[32m[I 2023-04-21 02:44:40,287][39m Trial 3696 finished with value: 0.8666666666666666 and parameters: {'objective': 'Logloss', 'colsample_bylevel': 0.07530822078590063, 'depth': 11, 'boosting_type': 'Plain', 'bootstrap_type': 'Bayesian', 'bagging_temperature': 9.582187452855004}. Best is trial 3065 with value: 0.8863636363636364.
[32m[I 2023-04-21 02:44:41,436][39m Trial 3697 finished with value: 0.8409090909090909 and parameters: {'objective': 'CrossEntropy', 'colsample_bylevel': 0.07839511195490785, 'depth': 12, 'boosting_type': 'Plain', 'bootstrap_type': 'Bayesian', 'bagging_temperature': 9.30793125953585}. Best is trial 3065 with value: 0.8863636363636364.
[32m[I 2023-04-21 02:44:42,420][39m Trial 3698 finished with value: 0.8275862068965518 and parameters: {'objective': 'CrossEntropy', 'colsample_bylevel': 0.07348302165200325, 'depth': 10, 'boosting_type': 'Plain', 'bootstrap_type': 'Bernoulli', 'subsample': 0.6707945994686524}. Best is trial 3065 with value: 0.8863636363636364.
[32m[I 2023-04-21 02:44:43,243][39m Trial 3699 finished with value: 0.8539325842696629 and parameters: {'objective': 'CrossEntropy', 'colsample_bylevel': 0.08332574301776455, 'depth': 10, 'boosting_type': 'Plain', 'bootstrap_type': 'Bayesian', 'bagging_temperature': 8.986520716941206}. Best is trial 3065 with value: 0.8863636363636364.
[32m[I 2023-04-21 02:44:44,248][39m Trial 3700 finished with value: 0.8666666666666666 and parameters: {'objective': 'CrossEntropy', 'colsample_bylevel': 0.07236834900086185, 'depth': 3, 'boosting_type': 'Plain', 'bootstrap_type': 'Bayesian', 'bagging_temperature': 9.96309262402818}. Best is trial 3065 with value: 0.8863636363636364.
[32m[I 2023-04-21 02:44:45,204][39m Trial 3701 finished with value: 0.8372093023255814 and parameters: {'objective': 'CrossEntropy', 'colsample_bylevel': 0.06531562696388667, 'depth': 2, 'boosting_type': 'Plain', 'bootstrap_type': 'Bayesian', 'bagging_temperature': 9.854951216924329}. Best is trial 3065 with value: 0.8863636363636364.
[32m[I 2023-04-21 02:44:46,466][39m Trial 3702 finished with value: 0.8275862068965518 and parameters: {'objective': 'CrossEntropy', 'colsample_bylevel': 0.031298181830396836, 'depth': 3, 'boosting_type': 'Plain', 'bootstrap_type': 'Bayesian', 'bagging_temperature': 9.130224558208887}. Best is trial 3065 with value: 0.8863636363636364.
[32m[I 2023-04-21 02:44:47,516][39m Trial 3703 finished with value: 0.8275862068965518 and parameters: {'objective': 'CrossEntropy', 'colsample_bylevel': 0.08702652292456141, 'depth': 4, 'boosting_type': 'Plain', 'bootstrap_type': 'Bayesian', 'bagging_temperature': 9.32240961363723}. Best is trial 3065 with value: 0.8863636363636364.
[32m[I 2023-04-21 02:44:52,224][39m Trial 3704 finished with value: 0.8409090909090909 and parameters: {'objective': 'Logloss', 'colsample_bylevel': 0.07905333147124512, 'depth': 4, 'boosting_type': 'Ordered', 'bootstrap_type': 'Bayesian', 'bagging_temperature': 8.918688655032676}. Best is trial 3065 with value: 0.8863636363636364.
[32m[I 2023-04-21 02:44:53,202][39m Trial 3705 finished with value: 0.8275862068965518 and parameters: {'objective': 'CrossEntropy', 'colsample_bylevel': 0.07330091176152301, 'depth': 10, 'boosting_type': 'Plain', 'bootstrap_type': 'MVS'}. Best is trial 3065 with value: 0.8863636363636364.
[32m[I 2023-04-21 02:44:54,502][39m Trial 3706 finished with value: 0.8275862068965518 and parameters: {'objective': 'Logloss', 'colsample_bylevel': 0.08617780584291855, 'depth': 7, 'boosting_type': 'Plain', 'bootstrap_type': 'Bayesian', 'bagging_temperature': 8.545820557219132}. Best is trial 3065 with value: 0.8863636363636364.
[32m[I 2023-04-21 02:44:55,508][39m Trial 3707 finished with value: 0.8409090909090909 and parameters: {'objective': 'CrossEntropy', 'colsample_bylevel': 0.0764133680173459, 'depth': 10, 'boosting_type': 'Plain', 'bootstrap_type': 'Bayesian', 'bagging_temperature': 9.253855274923005}. Best is trial 3065 with value: 0.8863636363636364.
[32m[I 2023-04-21 02:44:56,383][39m Trial 3708 finished with value: 0.8275862068965518 and parameters: {'objective': 'CrossEntropy', 'colsample_bylevel': 0.07105418657256557, 'depth': 10, 'boosting_type': 'Plain', 'bootstrap_type': 'Bayesian', 'bagging_temperature': 9.162040507488713}. Best is trial 3065 with value: 0.8863636363636364.
[32m[I 2023-04-21 02:44:57,077][39m Trial 3709 finished with value: 0.8409090909090909 and parameters: {'objective': 'CrossEntropy', 'colsample_bylevel': 0.06923176725277919, 'depth': 4, 'boosting_type': 'Plain', 'bootstrap_type': 'Bayesian', 'bagging_temperature': 9.326517356247749}. Best is trial 3065 with value: 0.8863636363636364.
[32m[I 2023-04-21 02:44:57,705][39m Trial 3710 finished with value: 0.8666666666666666 and parameters: {'objective': 'Logloss', 'colsample_bylevel': 0.08222591250449435, 'depth': 3, 'boosting_type': 'Plain', 'bootstrap_type': 'Bayesian', 'bagging_temperature': 8.18302205366814}. Best is trial 3065 with value: 0.8863636363636364.
[32m[I 2023-04-21 02:44:59,015][39m Trial 3711 finished with value: 0.8275862068965518 and parameters: {'objective': 'CrossEntropy', 'colsample_bylevel': 0.08104867569890978, 'depth': 9, 'boosting_type': 'Plain', 'bootstrap_type': 'Bayesian', 'bagging_temperature': 9.355341668573011}. Best is trial 3065 with value: 0.8863636363636364.
[32m[I 2023-04-21 02:45:00,107][39m Trial 3712 finished with value: 0.8539325842696629 and parameters: {'objective': 'CrossEntropy', 'colsample_bylevel': 0.07568535463714166, 'depth': 4, 'boosting_type': 'Plain', 'bootstrap_type': 'Bayesian', 'bagging_temperature': 9.337030977333974}. Best is trial 3065 with value: 0.8863636363636364.
[32m[I 2023-04-21 02:45:01,005][39m Trial 3713 finished with value: 0.8222222222222222 and parameters: {'objective': 'CrossEntropy', 'colsample_bylevel': 0.024594772303939832, 'depth': 11, 'boosting_type': 'Plain', 'bootstrap_type': 'Bayesian', 'bagging_temperature': 9.68148822457028}. Best is trial 3065 with value: 0.8863636363636364.
[32m[I 2023-04-21 02:45:02,006][39m Trial 3714 finished with value: 0.8505747126436782 and parameters: {'objective': 'CrossEntropy', 'colsample_bylevel': 0.09946087599816328, 'depth': 7, 'boosting_type': 'Plain', 'bootstrap_type': 'Bayesian', 'bagging_temperature': 9.781922916866563}. Best is trial 3065 with value: 0.8863636363636364.
[32m[I 2023-04-21 02:45:02,788][39m Trial 3715 finished with value: 0.8666666666666666 and parameters: {'objective': 'Logloss', 'colsample_bylevel': 0.07074924675714322, 'depth': 5, 'boosting_type': 'Plain', 'bootstrap_type': 'Bayesian', 'bagging_temperature': 9.425273278654764}. Best is trial 3065 with value: 0.8863636363636364.
[32m[I 2023-04-21 02:45:03,437][39m Trial 3716 finished with value: 0.8791208791208791 and parameters: {'objective': 'CrossEntropy', 'colsample_bylevel': 0.07489863696252778, 'depth': 10, 'boosting_type': 'Plain', 'bootstrap_type': 'Bayesian', 'bagging_temperature': 9.004686508886094}. Best is trial 3065 with value: 0.8863636363636364.
[32m[I 2023-04-21 02:45:04,658][39m Trial 3717 finished with value: 0.8666666666666666 and parameters: {'objective': 'Logloss', 'colsample_bylevel': 0.06955533140774853, 'depth': 10, 'boosting_type': 'Plain', 'bootstrap_type': 'Bayesian', 'bagging_temperature': 7.937840603187148}. Best is trial 3065 with value: 0.8863636363636364.
[32m[I 2023-04-21 02:45:05,608][39m Trial 3718 finished with value: 0.8539325842696629 and parameters: {'objective': 'Logloss', 'colsample_bylevel': 0.06989295775984344, 'depth': 8, 'boosting_type': 'Plain', 'bootstrap_type': 'Bernoulli', 'subsample': 0.16674254138287053}. Best is trial 3065 with value: 0.8863636363636364.
[32m[I 2023-04-21 02:45:06,553][39m Trial 3719 finished with value: 0.8139534883720929 and parameters: {'objective': 'CrossEntropy', 'colsample_bylevel': 0.072097957044383, 'depth': 5, 'boosting_type': 'Plain', 'bootstrap_type': 'Bayesian', 'bagging_temperature': 9.83897198150733}. Best is trial 3065 with value: 0.8863636363636364.
[32m[I 2023-04-21 02:45:07,551][39m Trial 3720 finished with value: 0.8505747126436782 and parameters: {'objective': 'CrossEntropy', 'colsample_bylevel': 0.07665779254329302, 'depth': 11, 'boosting_type': 'Plain', 'bootstrap_type': 'MVS'}. Best is trial 3065 with value: 0.8863636363636364.
[32m[I 2023-04-21 02:45:08,686][39m Trial 3721 finished with value: 0.8666666666666666 and parameters: {'objective': 'Logloss', 'colsample_bylevel': 0.07929998973603436, 'depth': 5, 'boosting_type': 'Plain', 'bootstrap_type': 'Bayesian', 'bagging_temperature': 9.010901596036677}. Best is trial 3065 with value: 0.8863636363636364.
[32m[I 2023-04-21 02:45:09,436][39m Trial 3722 finished with value: 0.8539325842696629 and parameters: {'objective': 'CrossEntropy', 'colsample_bylevel': 0.09291976762268578, 'depth': 3, 'boosting_type': 'Plain', 'bootstrap_type': 'Bayesian', 'bagging_temperature': 9.984455845569654}. Best is trial 3065 with value: 0.8863636363636364.
[32m[I 2023-04-21 02:45:14,052][39m Trial 3723 finished with value: 0.8409090909090909 and parameters: {'objective': 'Logloss', 'colsample_bylevel': 0.07301477217305322, 'depth': 12, 'boosting_type': 'Ordered', 'bootstrap_type': 'Bayesian', 'bagging_temperature': 8.955310324664685}. Best is trial 3065 with value: 0.8863636363636364.
[32m[I 2023-04-21 02:45:15,157][39m Trial 3724 finished with value: 0.8275862068965518 and parameters: {'objective': 'CrossEntropy', 'colsample_bylevel': 0.0729251694282844, 'depth': 11, 'boosting_type': 'Plain', 'bootstrap_type': 'Bayesian', 'bagging_temperature': 9.411087381659426}. Best is trial 3065 with value: 0.8863636363636364.
[32m[I 2023-04-21 02:45:16,349][39m Trial 3725 finished with value: 0.8666666666666666 and parameters: {'objective': 'Logloss', 'colsample_bylevel': 0.06947493685169356, 'depth': 9, 'boosting_type': 'Plain', 'bootstrap_type': 'Bayesian', 'bagging_temperature': 9.795427166299957}. Best is trial 3065 with value: 0.8863636363636364.
[32m[I 2023-04-21 02:45:17,420][39m Trial 3726 finished with value: 0.8235294117647058 and parameters: {'objective': 'CrossEntropy', 'colsample_bylevel': 0.0887199726480067, 'depth': 9, 'boosting_type': 'Plain', 'bootstrap_type': 'MVS'}. Best is trial 3065 with value: 0.8863636363636364.
[32m[I 2023-04-21 02:45:18,314][39m Trial 3727 finished with value: 0.8666666666666666 and parameters: {'objective': 'CrossEntropy', 'colsample_bylevel': 0.091407014548861, 'depth': 3, 'boosting_type': 'Plain', 'bootstrap_type': 'Bayesian', 'bagging_temperature': 9.68455671784348}. Best is trial 3065 with value: 0.8863636363636364.
[32m[I 2023-04-21 02:45:19,268][39m Trial 3728 finished with value: 0.8539325842696629 and parameters: {'objective': 'CrossEntropy', 'colsample_bylevel': 0.07723099674525022, 'depth': 5, 'boosting_type': 'Plain', 'bootstrap_type': 'Bayesian', 'bagging_temperature': 9.084233283360685}. Best is trial 3065 with value: 0.8863636363636364.
[32m[I 2023-04-21 02:45:20,211][39m Trial 3729 finished with value: 0.8409090909090909 and parameters: {'objective': 'CrossEntropy', 'colsample_bylevel': 0.07216562930571603, 'depth': 10, 'boosting_type': 'Plain', 'bootstrap_type': 'Bayesian', 'bagging_temperature': 9.53575546164153}. Best is trial 3065 with value: 0.8863636363636364.
[32m[I 2023-04-21 02:45:21,457][39m Trial 3730 finished with value: 0.8409090909090909 and parameters: {'objective': 'Logloss', 'colsample_bylevel': 0.07603907117398453, 'depth': 5, 'boosting_type': 'Plain', 'bootstrap_type': 'Bayesian', 'bagging_temperature': 9.023618907028624}. Best is trial 3065 with value: 0.8863636363636364.
[32m[I 2023-04-21 02:45:22,682][39m Trial 3731 finished with value: 0.8666666666666666 and parameters: {'objective': 'Logloss', 'colsample_bylevel': 0.07972872345481437, 'depth': 5, 'boosting_type': 'Plain', 'bootstrap_type': 'Bayesian', 'bagging_temperature': 7.592007213561473}. Best is trial 3065 with value: 0.8863636363636364.
[32m[I 2023-04-21 02:45:23,407][39m Trial 3732 finished with value: 0.8409090909090909 and parameters: {'objective': 'Logloss', 'colsample_bylevel': 0.0732570114933235, 'depth': 8, 'boosting_type': 'Plain', 'bootstrap_type': 'Bayesian', 'bagging_temperature': 9.801135108313309}. Best is trial 3065 with value: 0.8863636363636364.
[32m[I 2023-04-21 02:45:24,250][39m Trial 3733 finished with value: 0.8409090909090909 and parameters: {'objective': 'Logloss', 'colsample_bylevel': 0.06823540739875184, 'depth': 10, 'boosting_type': 'Plain', 'bootstrap_type': 'Bayesian', 'bagging_temperature': 9.132513321027417}. Best is trial 3065 with value: 0.8863636363636364.
[32m[I 2023-04-21 02:45:25,073][39m Trial 3734 finished with value: 0.8539325842696629 and parameters: {'objective': 'CrossEntropy', 'colsample_bylevel': 0.06725716032140758, 'depth': 11, 'boosting_type': 'Plain', 'bootstrap_type': 'Bayesian', 'bagging_temperature': 9.441361426470497}. Best is trial 3065 with value: 0.8863636363636364.
[32m[I 2023-04-21 02:45:25,901][39m Trial 3735 finished with value: 0.8505747126436782 and parameters: {'objective': 'CrossEntropy', 'colsample_bylevel': 0.07804120377011449, 'depth': 10, 'boosting_type': 'Plain', 'bootstrap_type': 'Bayesian', 'bagging_temperature': 9.324093273507573}. Best is trial 3065 with value: 0.8863636363636364.
[32m[I 2023-04-21 02:45:26,912][39m Trial 3736 finished with value: 0.8372093023255814 and parameters: {'objective': 'CrossEntropy', 'colsample_bylevel': 0.08449037200192715, 'depth': 10, 'boosting_type': 'Plain', 'bootstrap_type': 'Bayesian', 'bagging_temperature': 9.27736341283952}. Best is trial 3065 with value: 0.8863636363636364.
[32m[I 2023-04-21 02:45:28,011][39m Trial 3737 finished with value: 0.7906976744186047 and parameters: {'objective': 'CrossEntropy', 'colsample_bylevel': 0.07813245363063123, 'depth': 9, 'boosting_type': 'Plain', 'bootstrap_type': 'MVS'}. Best is trial 3065 with value: 0.8863636363636364.
[32m[I 2023-04-21 02:45:28,991][39m Trial 3738 finished with value: 0.8539325842696629 and parameters: {'objective': 'CrossEntropy', 'colsample_bylevel': 0.09031929186280584, 'depth': 3, 'boosting_type': 'Plain', 'bootstrap_type': 'Bayesian', 'bagging_temperature': 9.997681635769911}. Best is trial 3065 with value: 0.8863636363636364.
[32m[I 2023-04-21 02:45:29,953][39m Trial 3739 finished with value: 0.8666666666666666 and parameters: {'objective': 'CrossEntropy', 'colsample_bylevel': 0.08421706432015358, 'depth': 3, 'boosting_type': 'Plain', 'bootstrap_type': 'Bayesian', 'bagging_temperature': 9.115612328855342}. Best is trial 3065 with value: 0.8863636363636364.
[32m[I 2023-04-21 02:45:31,169][39m Trial 3740 finished with value: 0.8791208791208791 and parameters: {'objective': 'CrossEntropy', 'colsample_bylevel': 0.07837015508491244, 'depth': 10, 'boosting_type': 'Plain', 'bootstrap_type': 'Bayesian', 'bagging_temperature': 9.514676799258654}. Best is trial 3065 with value: 0.8863636363636364.
[32m[I 2023-04-21 02:45:35,614][39m Trial 3741 finished with value: 0.8444444444444446 and parameters: {'objective': 'CrossEntropy', 'colsample_bylevel': 0.09564606143084889, 'depth': 2, 'boosting_type': 'Ordered', 'bootstrap_type': 'Bayesian', 'bagging_temperature': 9.99928668292036}. Best is trial 3065 with value: 0.8863636363636364.
[32m[I 2023-04-21 02:45:36,574][39m Trial 3742 finished with value: 0.8666666666666666 and parameters: {'objective': 'CrossEntropy', 'colsample_bylevel': 0.08286405295825469, 'depth': 3, 'boosting_type': 'Plain', 'bootstrap_type': 'Bayesian', 'bagging_temperature': 9.166145169055538}. Best is trial 3065 with value: 0.8863636363636364.
[32m[I 2023-04-21 02:45:37,526][39m Trial 3743 finished with value: 0.8539325842696629 and parameters: {'objective': 'CrossEntropy', 'colsample_bylevel': 0.07480298492739888, 'depth': 11, 'boosting_type': 'Plain', 'bootstrap_type': 'Bayesian', 'bagging_temperature': 9.821474136097056}. Best is trial 3065 with value: 0.8863636363636364.
[32m[I 2023-04-21 02:45:38,449][39m Trial 3744 finished with value: 0.8539325842696629 and parameters: {'objective': 'CrossEntropy', 'colsample_bylevel': 0.0820518946539251, 'depth': 3, 'boosting_type': 'Plain', 'bootstrap_type': 'Bayesian', 'bagging_temperature': 8.759398136201193}. Best is trial 3065 with value: 0.8863636363636364.
[32m[I 2023-04-21 02:45:39,495][39m Trial 3745 finished with value: 0.8539325842696629 and parameters: {'objective': 'CrossEntropy', 'colsample_bylevel': 0.08565746172519322, 'depth': 10, 'boosting_type': 'Plain', 'bootstrap_type': 'Bayesian', 'bagging_temperature': 9.583336137039133}. Best is trial 3065 with value: 0.8863636363636364.
[32m[I 2023-04-21 02:45:40,188][39m Trial 3746 finished with value: 0.8222222222222222 and parameters: {'objective': 'CrossEntropy', 'colsample_bylevel': 0.07751831167600277, 'depth': 2, 'boosting_type': 'Plain', 'bootstrap_type': 'Bernoulli', 'subsample': 0.7927583982818511}. Best is trial 3065 with value: 0.8863636363636364.
[32m[I 2023-04-21 02:45:41,121][39m Trial 3747 finished with value: 0.8764044943820225 and parameters: {'objective': 'CrossEntropy', 'colsample_bylevel': 0.0808772540502729, 'depth': 2, 'boosting_type': 'Plain', 'bootstrap_type': 'Bayesian', 'bagging_temperature': 9.035076838757202}. Best is trial 3065 with value: 0.8863636363636364.
[32m[I 2023-04-21 02:45:42,560][39m Trial 3748 finished with value: 0.8539325842696629 and parameters: {'objective': 'CrossEntropy', 'colsample_bylevel': 0.0632202396807248, 'depth': 9, 'boosting_type': 'Plain', 'bootstrap_type': 'Bayesian', 'bagging_temperature': 8.923490041412306}. Best is trial 3065 with value: 0.8863636363636364.
[32m[I 2023-04-21 02:45:43,730][39m Trial 3749 finished with value: 0.8666666666666666 and parameters: {'objective': 'CrossEntropy', 'colsample_bylevel': 0.09214523507158241, 'depth': 3, 'boosting_type': 'Plain', 'bootstrap_type': 'Bayesian', 'bagging_temperature': 9.836438457999671}. Best is trial 3065 with value: 0.8863636363636364.
[32m[I 2023-04-21 02:45:44,953][39m Trial 3750 finished with value: 0.8275862068965518 and parameters: {'objective': 'CrossEntropy', 'colsample_bylevel': 0.0851369719181588, 'depth': 4, 'boosting_type': 'Plain', 'bootstrap_type': 'Bayesian', 'bagging_temperature': 9.674195187714128}. Best is trial 3065 with value: 0.8863636363636364.
[32m[I 2023-04-21 02:45:45,706][39m Trial 3751 finished with value: 0.8539325842696629 and parameters: {'objective': 'CrossEntropy', 'colsample_bylevel': 0.07994012679745323, 'depth': 3, 'boosting_type': 'Plain', 'bootstrap_type': 'Bayesian', 'bagging_temperature': 7.3076541128294705}. Best is trial 3065 with value: 0.8863636363636364.
[32m[I 2023-04-21 02:45:46,326][39m Trial 3752 finished with value: 0.8089887640449439 and parameters: {'objective': 'Logloss', 'colsample_bylevel': 0.021706869306608152, 'depth': 10, 'boosting_type': 'Plain', 'bootstrap_type': 'Bayesian', 'bagging_temperature': 9.359677146411238}. Best is trial 3065 with value: 0.8863636363636364.
[32m[I 2023-04-21 02:45:46,968][39m Trial 3753 finished with value: 0.8409090909090909 and parameters: {'objective': 'CrossEntropy', 'colsample_bylevel': 0.0786884903061714, 'depth': 5, 'boosting_type': 'Plain', 'bootstrap_type': 'Bayesian', 'bagging_temperature': 6.425145795926335}. Best is trial 3065 with value: 0.8863636363636364.
[32m[I 2023-04-21 02:45:47,796][39m Trial 3754 finished with value: 0.8539325842696629 and parameters: {'objective': 'Logloss', 'colsample_bylevel': 0.06961136501478704, 'depth': 10, 'boosting_type': 'Plain', 'bootstrap_type': 'Bayesian', 'bagging_temperature': 8.289040477226294}. Best is trial 3065 with value: 0.8863636363636364.
[32m[I 2023-04-21 02:45:48,582][39m Trial 3755 finished with value: 0.8505747126436782 and parameters: {'objective': 'CrossEntropy', 'colsample_bylevel': 0.08059926096643837, 'depth': 10, 'boosting_type': 'Plain', 'bootstrap_type': 'MVS'}. Best is trial 3065 with value: 0.8863636363636364.
[32m[I 2023-04-21 02:45:49,777][39m Trial 3756 finished with value: 0.8539325842696629 and parameters: {'objective': 'CrossEntropy', 'colsample_bylevel': 0.07055531512486679, 'depth': 3, 'boosting_type': 'Plain', 'bootstrap_type': 'Bayesian', 'bagging_temperature': 9.999037340606595}. Best is trial 3065 with value: 0.8863636363636364.
[32m[I 2023-04-21 02:45:51,178][39m Trial 3757 finished with value: 0.8791208791208791 and parameters: {'objective': 'CrossEntropy', 'colsample_bylevel': 0.0872080900915982, 'depth': 3, 'boosting_type': 'Plain', 'bootstrap_type': 'Bayesian', 'bagging_temperature': 9.82128513702177}. Best is trial 3065 with value: 0.8863636363636364.
