[32m[I 2023-04-21 03:05:52,433][39m Trial 4739 finished with value: 0.8409090909090909 and parameters: {'objective': 'CrossEntropy', 'colsample_bylevel': 0.08096502758206119, 'depth': 10, 'boosting_type': 'Plain', 'bootstrap_type': 'Bayesian', 'bagging_temperature': 8.69251054904312}. Best is trial 3065 with value: 0.8863636363636364.
[32m[I 2023-04-21 03:05:53,398][39m Trial 4740 finished with value: 0.8372093023255814 and parameters: {'objective': 'Logloss', 'colsample_bylevel': 0.06443072762529412, 'depth': 6, 'boosting_type': 'Plain', 'bootstrap_type': 'Bayesian', 'bagging_temperature': 9.067092794977583}. Best is trial 3065 with value: 0.8863636363636364.
[32m[I 2023-04-21 03:05:54,523][39m Trial 4741 finished with value: 0.8539325842696629 and parameters: {'objective': 'CrossEntropy', 'colsample_bylevel': 0.07984537820779362, 'depth': 9, 'boosting_type': 'Plain', 'bootstrap_type': 'Bayesian', 'bagging_temperature': 9.400880840457898}. Best is trial 3065 with value: 0.8863636363636364.
[32m[I 2023-04-21 03:05:55,401][39m Trial 4742 finished with value: 0.8666666666666666 and parameters: {'objective': 'CrossEntropy', 'colsample_bylevel': 0.09551334534721759, 'depth': 3, 'boosting_type': 'Plain', 'bootstrap_type': 'Bayesian', 'bagging_temperature': 8.445156357084663}. Best is trial 3065 with value: 0.8863636363636364.
[32m[I 2023-04-21 03:05:57,060][39m Trial 4743 finished with value: 0.8409090909090909 and parameters: {'objective': 'CrossEntropy', 'colsample_bylevel': 0.0698362907438139, 'depth': 10, 'boosting_type': 'Plain', 'bootstrap_type': 'Bayesian', 'bagging_temperature': 9.788736176167065}. Best is trial 3065 with value: 0.8863636363636364.
[32m[I 2023-04-21 03:05:57,734][39m Trial 4744 finished with value: 0.8764044943820225 and parameters: {'objective': 'Logloss', 'colsample_bylevel': 0.07037643401925968, 'depth': 4, 'boosting_type': 'Plain', 'bootstrap_type': 'Bayesian', 'bagging_temperature': 9.746026924317349}. Best is trial 3065 with value: 0.8863636363636364.
[32m[I 2023-04-21 03:05:58,766][39m Trial 4745 finished with value: 0.8539325842696629 and parameters: {'objective': 'Logloss', 'colsample_bylevel': 0.07009730804195789, 'depth': 8, 'boosting_type': 'Plain', 'bootstrap_type': 'Bayesian', 'bagging_temperature': 8.410762556297692}. Best is trial 3065 with value: 0.8863636363636364.
[32m[I 2023-04-21 03:05:59,689][39m Trial 4746 finished with value: 0.8409090909090909 and parameters: {'objective': 'CrossEntropy', 'colsample_bylevel': 0.0855982606483127, 'depth': 3, 'boosting_type': 'Plain', 'bootstrap_type': 'Bayesian', 'bagging_temperature': 9.346550224294765}. Best is trial 3065 with value: 0.8863636363636364.
[32m[I 2023-04-21 03:06:00,644][39m Trial 4747 finished with value: 0.8409090909090909 and parameters: {'objective': 'CrossEntropy', 'colsample_bylevel': 0.07859162252225034, 'depth': 10, 'boosting_type': 'Plain', 'bootstrap_type': 'Bayesian', 'bagging_temperature': 6.522276377865857}. Best is trial 3065 with value: 0.8863636363636364.
[32m[I 2023-04-21 03:06:01,442][39m Trial 4748 finished with value: 0.8539325842696629 and parameters: {'objective': 'CrossEntropy', 'colsample_bylevel': 0.09163170086867953, 'depth': 3, 'boosting_type': 'Plain', 'bootstrap_type': 'Bayesian', 'bagging_temperature': 8.2502514427075}. Best is trial 3065 with value: 0.8863636363636364.
[32m[I 2023-04-21 03:06:02,178][39m Trial 4749 finished with value: 0.8409090909090909 and parameters: {'objective': 'CrossEntropy', 'colsample_bylevel': 0.08464066578060712, 'depth': 2, 'boosting_type': 'Plain', 'bootstrap_type': 'MVS'}. Best is trial 3065 with value: 0.8863636363636364.
[32m[I 2023-04-21 03:06:03,500][39m Trial 4750 finished with value: 0.8409090909090909 and parameters: {'objective': 'Logloss', 'colsample_bylevel': 0.07424619420963402, 'depth': 4, 'boosting_type': 'Plain', 'bootstrap_type': 'Bernoulli', 'subsample': 0.7621176353429885}. Best is trial 3065 with value: 0.8863636363636364.
[32m[I 2023-04-21 03:06:04,721][39m Trial 4751 finished with value: 0.8539325842696629 and parameters: {'objective': 'CrossEntropy', 'colsample_bylevel': 0.0885845342262568, 'depth': 3, 'boosting_type': 'Plain', 'bootstrap_type': 'Bayesian', 'bagging_temperature': 9.800929714250781}. Best is trial 3065 with value: 0.8863636363636364.
[32m[I 2023-04-21 03:06:05,988][39m Trial 4752 finished with value: 0.8275862068965518 and parameters: {'objective': 'CrossEntropy', 'colsample_bylevel': 0.09430320866095668, 'depth': 3, 'boosting_type': 'Plain', 'bootstrap_type': 'MVS'}. Best is trial 3065 with value: 0.8863636363636364.
[32m[I 2023-04-21 03:06:07,005][39m Trial 4753 finished with value: 0.8666666666666666 and parameters: {'objective': 'Logloss', 'colsample_bylevel': 0.07979604706043071, 'depth': 3, 'boosting_type': 'Plain', 'bootstrap_type': 'Bayesian', 'bagging_temperature': 8.714677978605922}. Best is trial 3065 with value: 0.8863636363636364.
[32m[I 2023-04-21 03:06:08,403][39m Trial 4754 finished with value: 0.8539325842696629 and parameters: {'objective': 'Logloss', 'colsample_bylevel': 0.0749050190876919, 'depth': 10, 'boosting_type': 'Plain', 'bootstrap_type': 'Bayesian', 'bagging_temperature': 9.434976218598859}. Best is trial 3065 with value: 0.8863636363636364.
[32m[I 2023-04-21 03:06:09,102][39m Trial 4755 finished with value: 0.8409090909090909 and parameters: {'objective': 'CrossEntropy', 'colsample_bylevel': 0.07695605402264764, 'depth': 10, 'boosting_type': 'Plain', 'bootstrap_type': 'Bayesian', 'bagging_temperature': 9.425068077831845}. Best is trial 3065 with value: 0.8863636363636364.
[32m[I 2023-04-21 03:06:10,150][39m Trial 4756 finished with value: 0.8539325842696629 and parameters: {'objective': 'Logloss', 'colsample_bylevel': 0.07140112935082425, 'depth': 6, 'boosting_type': 'Plain', 'bootstrap_type': 'Bayesian', 'bagging_temperature': 9.255715644518068}. Best is trial 3065 with value: 0.8863636363636364.
[32m[I 2023-04-21 03:06:14,695][39m Trial 4757 finished with value: 0.8409090909090909 and parameters: {'objective': 'CrossEntropy', 'colsample_bylevel': 0.07975364394218837, 'depth': 3, 'boosting_type': 'Ordered', 'bootstrap_type': 'Bayesian', 'bagging_temperature': 9.007602909404268}. Best is trial 3065 with value: 0.8863636363636364.
[32m[I 2023-04-21 03:06:15,817][39m Trial 4758 finished with value: 0.8409090909090909 and parameters: {'objective': 'CrossEntropy', 'colsample_bylevel': 0.0842829445210373, 'depth': 3, 'boosting_type': 'Plain', 'bootstrap_type': 'Bayesian', 'bagging_temperature': 9.282387362216156}. Best is trial 3065 with value: 0.8863636363636364.
[32m[I 2023-04-21 03:06:16,981][39m Trial 4759 finished with value: 0.8409090909090909 and parameters: {'objective': 'CrossEntropy', 'colsample_bylevel': 0.07450203751412969, 'depth': 11, 'boosting_type': 'Plain', 'bootstrap_type': 'Bayesian', 'bagging_temperature': 8.718083329121775}. Best is trial 3065 with value: 0.8863636363636364.
[32m[I 2023-04-21 03:06:18,460][39m Trial 4760 finished with value: 0.8409090909090909 and parameters: {'objective': 'Logloss', 'colsample_bylevel': 0.08645306436516983, 'depth': 12, 'boosting_type': 'Plain', 'bootstrap_type': 'Bayesian', 'bagging_temperature': 8.972800260418651}. Best is trial 3065 with value: 0.8863636363636364.
[32m[I 2023-04-21 03:06:19,491][39m Trial 4761 finished with value: 0.8539325842696629 and parameters: {'objective': 'CrossEntropy', 'colsample_bylevel': 0.09502036127596702, 'depth': 3, 'boosting_type': 'Plain', 'bootstrap_type': 'Bayesian', 'bagging_temperature': 9.9057759951546}. Best is trial 3065 with value: 0.8863636363636364.
[32m[I 2023-04-21 03:06:20,493][39m Trial 4762 finished with value: 0.8409090909090909 and parameters: {'objective': 'CrossEntropy', 'colsample_bylevel': 0.08316926121973663, 'depth': 3, 'boosting_type': 'Plain', 'bootstrap_type': 'MVS'}. Best is trial 3065 with value: 0.8863636363636364.
[32m[I 2023-04-21 03:06:21,472][39m Trial 4763 finished with value: 0.8409090909090909 and parameters: {'objective': 'CrossEntropy', 'colsample_bylevel': 0.092727624607091, 'depth': 3, 'boosting_type': 'Plain', 'bootstrap_type': 'Bayesian', 'bagging_temperature': 8.137662053582119}. Best is trial 3065 with value: 0.8863636363636364.
[32m[I 2023-04-21 03:06:22,634][39m Trial 4764 finished with value: 0.8181818181818182 and parameters: {'objective': 'CrossEntropy', 'colsample_bylevel': 0.07672631736979525, 'depth': 2, 'boosting_type': 'Plain', 'bootstrap_type': 'MVS'}. Best is trial 3065 with value: 0.8863636363636364.
[32m[I 2023-04-21 03:06:23,305][39m Trial 4765 finished with value: 0.8666666666666666 and parameters: {'objective': 'CrossEntropy', 'colsample_bylevel': 0.08591305969536453, 'depth': 3, 'boosting_type': 'Plain', 'bootstrap_type': 'Bernoulli', 'subsample': 0.2573395598723615}. Best is trial 3065 with value: 0.8863636363636364.
[32m[I 2023-04-21 03:06:24,721][39m Trial 4766 finished with value: 0.8409090909090909 and parameters: {'objective': 'CrossEntropy', 'colsample_bylevel': 0.068334740179848, 'depth': 8, 'boosting_type': 'Plain', 'bootstrap_type': 'Bayesian', 'bagging_temperature': 9.683967713293507}. Best is trial 3065 with value: 0.8863636363636364.
[32m[I 2023-04-21 03:06:25,869][39m Trial 4767 finished with value: 0.8409090909090909 and parameters: {'objective': 'CrossEntropy', 'colsample_bylevel': 0.06367952139017129, 'depth': 3, 'boosting_type': 'Plain', 'bootstrap_type': 'Bayesian', 'bagging_temperature': 9.236096563060421}. Best is trial 3065 with value: 0.8863636363636364.
[32m[I 2023-04-21 03:06:26,580][39m Trial 4768 finished with value: 0.8539325842696629 and parameters: {'objective': 'CrossEntropy', 'colsample_bylevel': 0.079300238275774, 'depth': 3, 'boosting_type': 'Plain', 'bootstrap_type': 'Bayesian', 'bagging_temperature': 9.834417636757033}. Best is trial 3065 with value: 0.8863636363636364.
[32m[I 2023-04-21 03:06:27,236][39m Trial 4769 finished with value: 0.8666666666666666 and parameters: {'objective': 'CrossEntropy', 'colsample_bylevel': 0.07819311649740103, 'depth': 3, 'boosting_type': 'Plain', 'bootstrap_type': 'Bayesian', 'bagging_temperature': 9.5762113690378}. Best is trial 3065 with value: 0.8863636363636364.
[32m[I 2023-04-21 03:06:27,880][39m Trial 4770 finished with value: 0.8409090909090909 and parameters: {'objective': 'CrossEntropy', 'colsample_bylevel': 0.05703809961289575, 'depth': 3, 'boosting_type': 'Plain', 'bootstrap_type': 'Bayesian', 'bagging_temperature': 9.529647197246195}. Best is trial 3065 with value: 0.8863636363636364.
[32m[I 2023-04-21 03:06:28,810][39m Trial 4771 finished with value: 0.8409090909090909 and parameters: {'objective': 'CrossEntropy', 'colsample_bylevel': 0.07210766403065343, 'depth': 10, 'boosting_type': 'Plain', 'bootstrap_type': 'Bayesian', 'bagging_temperature': 7.612924533955386}. Best is trial 3065 with value: 0.8863636363636364.
[32m[I 2023-04-21 03:06:29,755][39m Trial 4772 finished with value: 0.8409090909090909 and parameters: {'objective': 'CrossEntropy', 'colsample_bylevel': 0.06466421525387984, 'depth': 12, 'boosting_type': 'Plain', 'bootstrap_type': 'Bayesian', 'bagging_temperature': 9.196418790412508}. Best is trial 3065 with value: 0.8863636363636364.
[32m[I 2023-04-21 03:06:30,800][39m Trial 4773 finished with value: 0.8275862068965518 and parameters: {'objective': 'CrossEntropy', 'colsample_bylevel': 0.08557738241372909, 'depth': 3, 'boosting_type': 'Plain', 'bootstrap_type': 'Bayesian', 'bagging_temperature': 9.701289178855472}. Best is trial 3065 with value: 0.8863636363636364.
[32m[I 2023-04-21 03:06:35,800][39m Trial 4774 finished with value: 0.8409090909090909 and parameters: {'objective': 'CrossEntropy', 'colsample_bylevel': 0.08442372212370537, 'depth': 3, 'boosting_type': 'Ordered', 'bootstrap_type': 'Bayesian', 'bagging_temperature': 9.626602126668963}. Best is trial 3065 with value: 0.8863636363636364.
[32m[I 2023-04-21 03:06:37,048][39m Trial 4775 finished with value: 0.8409090909090909 and parameters: {'objective': 'CrossEntropy', 'colsample_bylevel': 0.06995276391458062, 'depth': 3, 'boosting_type': 'Plain', 'bootstrap_type': 'Bayesian', 'bagging_temperature': 9.374923049049102}. Best is trial 3065 with value: 0.8863636363636364.
[32m[I 2023-04-21 03:06:38,219][39m Trial 4776 finished with value: 0.8539325842696629 and parameters: {'objective': 'CrossEntropy', 'colsample_bylevel': 0.08145421737692846, 'depth': 3, 'boosting_type': 'Plain', 'bootstrap_type': 'Bayesian', 'bagging_temperature': 9.052449291028765}. Best is trial 3065 with value: 0.8863636363636364.
[32m[I 2023-04-21 03:06:39,393][39m Trial 4777 finished with value: 0.8409090909090909 and parameters: {'objective': 'CrossEntropy', 'colsample_bylevel': 0.08661866518577045, 'depth': 2, 'boosting_type': 'Plain', 'bootstrap_type': 'Bayesian', 'bagging_temperature': 9.368144821340085}. Best is trial 3065 with value: 0.8863636363636364.
[32m[I 2023-04-21 03:06:40,796][39m Trial 4778 finished with value: 0.8505747126436782 and parameters: {'objective': 'CrossEntropy', 'colsample_bylevel': 0.0812264924256034, 'depth': 2, 'boosting_type': 'Plain', 'bootstrap_type': 'Bayesian', 'bagging_temperature': 8.803451682864878}. Best is trial 3065 with value: 0.8863636363636364.
[32m[I 2023-04-21 03:06:41,453][39m Trial 4779 finished with value: 0.8764044943820225 and parameters: {'objective': 'CrossEntropy', 'colsample_bylevel': 0.08910922319255286, 'depth': 2, 'boosting_type': 'Plain', 'bootstrap_type': 'Bayesian', 'bagging_temperature': 9.916493185256508}. Best is trial 3065 with value: 0.8863636363636364.
[32m[I 2023-04-21 03:06:42,143][39m Trial 4780 finished with value: 0.8275862068965518 and parameters: {'objective': 'CrossEntropy', 'colsample_bylevel': 0.07182595701121412, 'depth': 8, 'boosting_type': 'Plain', 'bootstrap_type': 'Bayesian', 'bagging_temperature': 2.7092116846368732}. Best is trial 3065 with value: 0.8863636363636364.
[32m[I 2023-04-21 03:06:43,199][39m Trial 4781 finished with value: 0.8539325842696629 and parameters: {'objective': 'CrossEntropy', 'colsample_bylevel': 0.08331102928152506, 'depth': 3, 'boosting_type': 'Plain', 'bootstrap_type': 'Bayesian', 'bagging_temperature': 8.905045280287691}. Best is trial 3065 with value: 0.8863636363636364.
[32m[I 2023-04-21 03:06:44,332][39m Trial 4782 finished with value: 0.8409090909090909 and parameters: {'objective': 'CrossEntropy', 'colsample_bylevel': 0.07716889429147288, 'depth': 3, 'boosting_type': 'Plain', 'bootstrap_type': 'MVS'}. Best is trial 3065 with value: 0.8863636363636364.
[32m[I 2023-04-21 03:06:45,669][39m Trial 4783 finished with value: 0.8539325842696629 and parameters: {'objective': 'CrossEntropy', 'colsample_bylevel': 0.08022950048856613, 'depth': 12, 'boosting_type': 'Plain', 'bootstrap_type': 'Bayesian', 'bagging_temperature': 8.84050634749793}. Best is trial 3065 with value: 0.8863636363636364.
[32m[I 2023-04-21 03:06:46,427][39m Trial 4784 finished with value: 0.8666666666666666 and parameters: {'objective': 'CrossEntropy', 'colsample_bylevel': 0.0874077147252311, 'depth': 3, 'boosting_type': 'Plain', 'bootstrap_type': 'Bayesian', 'bagging_temperature': 9.820872553135896}. Best is trial 3065 with value: 0.8863636363636364.
[32m[I 2023-04-21 03:06:47,504][39m Trial 4785 finished with value: 0.8409090909090909 and parameters: {'objective': 'CrossEntropy', 'colsample_bylevel': 0.061296702753127874, 'depth': 3, 'boosting_type': 'Plain', 'bootstrap_type': 'Bayesian', 'bagging_temperature': 9.814092388116523}. Best is trial 3065 with value: 0.8863636363636364.
[32m[I 2023-04-21 03:06:48,451][39m Trial 4786 finished with value: 0.8539325842696629 and parameters: {'objective': 'CrossEntropy', 'colsample_bylevel': 0.0784031232534352, 'depth': 9, 'boosting_type': 'Plain', 'bootstrap_type': 'Bayesian', 'bagging_temperature': 8.547320575100619}. Best is trial 3065 with value: 0.8863636363636364.
[32m[I 2023-04-21 03:06:49,320][39m Trial 4787 finished with value: 0.8539325842696629 and parameters: {'objective': 'CrossEntropy', 'colsample_bylevel': 0.09676629288639498, 'depth': 3, 'boosting_type': 'Plain', 'bootstrap_type': 'Bayesian', 'bagging_temperature': 8.730902323627033}. Best is trial 3065 with value: 0.8863636363636364.
[32m[I 2023-04-21 03:06:50,732][39m Trial 4788 finished with value: 0.8409090909090909 and parameters: {'objective': 'CrossEntropy', 'colsample_bylevel': 0.08167513240859751, 'depth': 3, 'boosting_type': 'Plain', 'bootstrap_type': 'Bayesian', 'bagging_temperature': 8.755353548847298}. Best is trial 3065 with value: 0.8863636363636364.
[32m[I 2023-04-21 03:06:51,899][39m Trial 4789 finished with value: 0.8409090909090909 and parameters: {'objective': 'CrossEntropy', 'colsample_bylevel': 0.08696844655854163, 'depth': 3, 'boosting_type': 'Plain', 'bootstrap_type': 'Bernoulli', 'subsample': 0.9035432258777203}. Best is trial 3065 with value: 0.8863636363636364.
[32m[I 2023-04-21 03:06:52,672][39m Trial 4790 finished with value: 0.8666666666666666 and parameters: {'objective': 'CrossEntropy', 'colsample_bylevel': 0.08327292484841879, 'depth': 2, 'boosting_type': 'Plain', 'bootstrap_type': 'Bayesian', 'bagging_temperature': 9.7457049777385}. Best is trial 3065 with value: 0.8863636363636364.
[32m[I 2023-04-21 03:06:53,963][39m Trial 4791 finished with value: 0.8505747126436782 and parameters: {'objective': 'CrossEntropy', 'colsample_bylevel': 0.08196723125657705, 'depth': 10, 'boosting_type': 'Plain', 'bootstrap_type': 'Bayesian', 'bagging_temperature': 9.481985791804878}. Best is trial 3065 with value: 0.8863636363636364.
[32m[I 2023-04-21 03:06:58,765][39m Trial 4792 finished with value: 0.8139534883720929 and parameters: {'objective': 'CrossEntropy', 'colsample_bylevel': 0.07725545865571563, 'depth': 10, 'boosting_type': 'Ordered', 'bootstrap_type': 'Bayesian', 'bagging_temperature': 9.680427508558857}. Best is trial 3065 with value: 0.8863636363636364.
[32m[I 2023-04-21 03:06:59,991][39m Trial 4793 finished with value: 0.8539325842696629 and parameters: {'objective': 'Logloss', 'colsample_bylevel': 0.07742534499561655, 'depth': 10, 'boosting_type': 'Plain', 'bootstrap_type': 'Bayesian', 'bagging_temperature': 9.635626139718173}. Best is trial 3065 with value: 0.8863636363636364.
[32m[I 2023-04-21 03:07:01,206][39m Trial 4794 finished with value: 0.8636363636363636 and parameters: {'objective': 'CrossEntropy', 'colsample_bylevel': 0.07399296277167777, 'depth': 11, 'boosting_type': 'Plain', 'bootstrap_type': 'Bayesian', 'bagging_temperature': 9.300829967612193}. Best is trial 3065 with value: 0.8863636363636364.
[32m[I 2023-04-21 03:07:02,729][39m Trial 4795 finished with value: 0.8539325842696629 and parameters: {'objective': 'Logloss', 'colsample_bylevel': 0.06763793401334847, 'depth': 9, 'boosting_type': 'Plain', 'bootstrap_type': 'Bayesian', 'bagging_temperature': 9.548215882337713}. Best is trial 3065 with value: 0.8863636363636364.
[32m[I 2023-04-21 03:07:03,552][39m Trial 4796 finished with value: 0.8139534883720929 and parameters: {'objective': 'CrossEntropy', 'colsample_bylevel': 0.07144331864649026, 'depth': 10, 'boosting_type': 'Plain', 'bootstrap_type': 'Bayesian', 'bagging_temperature': 9.092103290979965}. Best is trial 3065 with value: 0.8863636363636364.
[32m[I 2023-04-21 03:07:04,518][39m Trial 4797 finished with value: 0.8409090909090909 and parameters: {'objective': 'Logloss', 'colsample_bylevel': 0.06692122763565089, 'depth': 8, 'boosting_type': 'Plain', 'bootstrap_type': 'Bayesian', 'bagging_temperature': 4.295307845888648}. Best is trial 3065 with value: 0.8863636363636364.
[32m[I 2023-04-21 03:07:05,368][39m Trial 4798 finished with value: 0.8505747126436782 and parameters: {'objective': 'CrossEntropy', 'colsample_bylevel': 0.08293190218276465, 'depth': 11, 'boosting_type': 'Plain', 'bootstrap_type': 'Bayesian', 'bagging_temperature': 9.353989399596054}. Best is trial 3065 with value: 0.8863636363636364.
[32m[I 2023-04-21 03:07:06,695][39m Trial 4799 finished with value: 0.8539325842696629 and parameters: {'objective': 'CrossEntropy', 'colsample_bylevel': 0.07020556127399187, 'depth': 4, 'boosting_type': 'Plain', 'bootstrap_type': 'Bayesian', 'bagging_temperature': 9.966799992019345}. Best is trial 3065 with value: 0.8863636363636364.
[32m[I 2023-04-21 03:07:07,892][39m Trial 4800 finished with value: 0.8181818181818182 and parameters: {'objective': 'CrossEntropy', 'colsample_bylevel': 0.0781498453237718, 'depth': 3, 'boosting_type': 'Plain', 'bootstrap_type': 'MVS'}. Best is trial 3065 with value: 0.8863636363636364.
[32m[I 2023-04-21 03:07:08,786][39m Trial 4801 finished with value: 0.8666666666666666 and parameters: {'objective': 'Logloss', 'colsample_bylevel': 0.07549245510404065, 'depth': 10, 'boosting_type': 'Plain', 'bootstrap_type': 'Bayesian', 'bagging_temperature': 9.65512672588766}. Best is trial 3065 with value: 0.8863636363636364.
[32m[I 2023-04-21 03:07:09,824][39m Trial 4802 finished with value: 0.8539325842696629 and parameters: {'objective': 'CrossEntropy', 'colsample_bylevel': 0.06945243992402096, 'depth': 7, 'boosting_type': 'Plain', 'bootstrap_type': 'Bayesian', 'bagging_temperature': 9.115685367369828}. Best is trial 3065 with value: 0.8863636363636364.
[32m[I 2023-04-21 03:07:10,806][39m Trial 4803 finished with value: 0.7999999999999999 and parameters: {'objective': 'CrossEntropy', 'colsample_bylevel': 0.08547774003768514, 'depth': 3, 'boosting_type': 'Plain', 'bootstrap_type': 'Bayesian', 'bagging_temperature': 8.596789615931726}. Best is trial 3065 with value: 0.8863636363636364.
