[32m[I 2023-04-21 02:06:29,954][39m Trial 1719 finished with value: 0.8666666666666666 and parameters: {'objective': 'CrossEntropy', 'colsample_bylevel': 0.07993907244815944, 'depth': 3, 'boosting_type': 'Plain', 'bootstrap_type': 'Bayesian', 'bagging_temperature': 9.523958223007883}. Best is trial 98 with value: 0.8791208791208791.
[32m[I 2023-04-21 02:06:30,821][39m Trial 1720 finished with value: 0.8275862068965518 and parameters: {'objective': 'CrossEntropy', 'colsample_bylevel': 0.08133950011476046, 'depth': 7, 'boosting_type': 'Plain', 'bootstrap_type': 'Bernoulli', 'subsample': 0.18571979733596777}. Best is trial 98 with value: 0.8791208791208791.
[32m[I 2023-04-21 02:06:31,657][39m Trial 1721 finished with value: 0.7777777777777778 and parameters: {'objective': 'CrossEntropy', 'colsample_bylevel': 0.024908222160845355, 'depth': 3, 'boosting_type': 'Plain', 'bootstrap_type': 'Bayesian', 'bagging_temperature': 4.743561297462936}. Best is trial 98 with value: 0.8791208791208791.
[32m[I 2023-04-21 02:06:32,887][39m Trial 1722 finished with value: 0.8505747126436782 and parameters: {'objective': 'CrossEntropy', 'colsample_bylevel': 0.08574388388922989, 'depth': 9, 'boosting_type': 'Plain', 'bootstrap_type': 'Bayesian', 'bagging_temperature': 9.49125482983599}. Best is trial 98 with value: 0.8791208791208791.
[32m[I 2023-04-21 02:06:33,575][39m Trial 1723 finished with value: 0.8275862068965518 and parameters: {'objective': 'CrossEntropy', 'colsample_bylevel': 0.0923702339258343, 'depth': 3, 'boosting_type': 'Plain', 'bootstrap_type': 'MVS'}. Best is trial 98 with value: 0.8791208791208791.
[32m[I 2023-04-21 02:06:34,533][39m Trial 1724 finished with value: 0.8409090909090909 and parameters: {'objective': 'Logloss', 'colsample_bylevel': 0.08474304570633362, 'depth': 4, 'boosting_type': 'Plain', 'bootstrap_type': 'Bayesian', 'bagging_temperature': 9.789755868603224}. Best is trial 98 with value: 0.8791208791208791.
[32m[I 2023-04-21 02:06:35,521][39m Trial 1725 finished with value: 0.8666666666666666 and parameters: {'objective': 'CrossEntropy', 'colsample_bylevel': 0.08443836037019004, 'depth': 3, 'boosting_type': 'Plain', 'bootstrap_type': 'Bayesian', 'bagging_temperature': 8.812882707972744}. Best is trial 98 with value: 0.8791208791208791.
[32m[I 2023-04-21 02:06:36,194][39m Trial 1726 finished with value: 0.8539325842696629 and parameters: {'objective': 'Logloss', 'colsample_bylevel': 0.08128981826455764, 'depth': 3, 'boosting_type': 'Plain', 'bootstrap_type': 'Bayesian', 'bagging_temperature': 8.364529023811677}. Best is trial 98 with value: 0.8791208791208791.
[32m[I 2023-04-21 02:06:37,045][39m Trial 1727 finished with value: 0.8275862068965518 and parameters: {'objective': 'CrossEntropy', 'colsample_bylevel': 0.07849740467186618, 'depth': 11, 'boosting_type': 'Plain', 'bootstrap_type': 'Bayesian', 'bagging_temperature': 8.053378318928775}. Best is trial 98 with value: 0.8791208791208791.
[32m[I 2023-04-21 02:06:38,260][39m Trial 1728 finished with value: 0.8409090909090909 and parameters: {'objective': 'CrossEntropy', 'colsample_bylevel': 0.07480969391401254, 'depth': 8, 'boosting_type': 'Plain', 'bootstrap_type': 'Bayesian', 'bagging_temperature': 9.857326748215401}. Best is trial 98 with value: 0.8791208791208791.
[32m[I 2023-04-21 02:06:39,134][39m Trial 1729 finished with value: 0.8139534883720929 and parameters: {'objective': 'CrossEntropy', 'colsample_bylevel': 0.08623633430861362, 'depth': 4, 'boosting_type': 'Plain', 'bootstrap_type': 'Bayesian', 'bagging_temperature': 3.191766881814316}. Best is trial 98 with value: 0.8791208791208791.
[32m[I 2023-04-21 02:06:44,126][39m Trial 1730 finished with value: 0.8275862068965518 and parameters: {'objective': 'Logloss', 'colsample_bylevel': 0.08305533190137235, 'depth': 3, 'boosting_type': 'Ordered', 'bootstrap_type': 'Bayesian', 'bagging_temperature': 9.570104142126684}. Best is trial 98 with value: 0.8791208791208791.
[32m[I 2023-04-21 02:06:45,168][39m Trial 1731 finished with value: 0.8275862068965518 and parameters: {'objective': 'CrossEntropy', 'colsample_bylevel': 0.077155695427894, 'depth': 4, 'boosting_type': 'Plain', 'bootstrap_type': 'MVS'}. Best is trial 98 with value: 0.8791208791208791.
[32m[I 2023-04-21 02:06:46,112][39m Trial 1732 finished with value: 0.8666666666666666 and parameters: {'objective': 'CrossEntropy', 'colsample_bylevel': 0.07426584863603612, 'depth': 4, 'boosting_type': 'Plain', 'bootstrap_type': 'Bayesian', 'bagging_temperature': 9.834676782841415}. Best is trial 98 with value: 0.8791208791208791.
[32m[I 2023-04-21 02:06:47,103][39m Trial 1733 finished with value: 0.8409090909090909 and parameters: {'objective': 'CrossEntropy', 'colsample_bylevel': 0.0913164308452248, 'depth': 3, 'boosting_type': 'Plain', 'bootstrap_type': 'Bayesian', 'bagging_temperature': 8.86224010038945}. Best is trial 98 with value: 0.8791208791208791.
[32m[I 2023-04-21 02:06:47,697][39m Trial 1734 finished with value: 0.8666666666666666 and parameters: {'objective': 'CrossEntropy', 'colsample_bylevel': 0.07144461285289995, 'depth': 3, 'boosting_type': 'Plain', 'bootstrap_type': 'Bayesian', 'bagging_temperature': 9.73969672614602}. Best is trial 98 with value: 0.8791208791208791.
[32m[I 2023-04-21 02:06:49,220][39m Trial 1735 finished with value: 0.8505747126436782 and parameters: {'objective': 'CrossEntropy', 'colsample_bylevel': 0.09422762105480849, 'depth': 9, 'boosting_type': 'Plain', 'bootstrap_type': 'Bayesian', 'bagging_temperature': 9.571635831562384}. Best is trial 98 with value: 0.8791208791208791.
[32m[I 2023-04-21 02:06:50,038][39m Trial 1736 finished with value: 0.8409090909090909 and parameters: {'objective': 'CrossEntropy', 'colsample_bylevel': 0.07742920807069568, 'depth': 5, 'boosting_type': 'Plain', 'bootstrap_type': 'Bayesian', 'bagging_temperature': 9.352072425737326}. Best is trial 98 with value: 0.8791208791208791.
[32m[I 2023-04-21 02:06:50,685][39m Trial 1737 finished with value: 0.8539325842696629 and parameters: {'objective': 'CrossEntropy', 'colsample_bylevel': 0.08772924354709287, 'depth': 5, 'boosting_type': 'Plain', 'bootstrap_type': 'Bayesian', 'bagging_temperature': 9.33789954740957}. Best is trial 98 with value: 0.8791208791208791.
[32m[I 2023-04-21 02:06:51,488][39m Trial 1738 finished with value: 0.8409090909090909 and parameters: {'objective': 'CrossEntropy', 'colsample_bylevel': 0.09615074064248473, 'depth': 3, 'boosting_type': 'Plain', 'bootstrap_type': 'Bayesian', 'bagging_temperature': 9.841639556141368}. Best is trial 98 with value: 0.8791208791208791.
[32m[I 2023-04-21 02:06:52,388][39m Trial 1739 finished with value: 0.8409090909090909 and parameters: {'objective': 'CrossEntropy', 'colsample_bylevel': 0.09303660670074518, 'depth': 3, 'boosting_type': 'Plain', 'bootstrap_type': 'Bayesian', 'bagging_temperature': 9.744890616377704}. Best is trial 98 with value: 0.8791208791208791.
[32m[I 2023-04-21 02:06:53,329][39m Trial 1740 finished with value: 0.8409090909090909 and parameters: {'objective': 'CrossEntropy', 'colsample_bylevel': 0.09010399260109538, 'depth': 3, 'boosting_type': 'Plain', 'bootstrap_type': 'Bayesian', 'bagging_temperature': 9.737970969321127}. Best is trial 98 with value: 0.8791208791208791.
[32m[I 2023-04-21 02:06:54,110][39m Trial 1741 finished with value: 0.8409090909090909 and parameters: {'objective': 'Logloss', 'colsample_bylevel': 0.07618271889194732, 'depth': 11, 'boosting_type': 'Plain', 'bootstrap_type': 'Bayesian', 'bagging_temperature': 9.55518999824314}. Best is trial 98 with value: 0.8791208791208791.
[32m[I 2023-04-21 02:06:55,010][39m Trial 1742 finished with value: 0.8275862068965518 and parameters: {'objective': 'Logloss', 'colsample_bylevel': 0.06888308096126247, 'depth': 10, 'boosting_type': 'Plain', 'bootstrap_type': 'Bayesian', 'bagging_temperature': 8.230878281808131}. Best is trial 98 with value: 0.8791208791208791.
[32m[I 2023-04-21 02:06:55,972][39m Trial 1743 finished with value: 0.7857142857142858 and parameters: {'objective': 'CrossEntropy', 'colsample_bylevel': 0.07957846192744313, 'depth': 4, 'boosting_type': 'Plain', 'bootstrap_type': 'MVS'}. Best is trial 98 with value: 0.8791208791208791.
[32m[I 2023-04-21 02:06:56,593][39m Trial 1744 finished with value: 0.8444444444444446 and parameters: {'objective': 'CrossEntropy', 'colsample_bylevel': 0.0728544818670991, 'depth': 3, 'boosting_type': 'Plain', 'bootstrap_type': 'Bernoulli', 'subsample': 0.4323338383543592}. Best is trial 98 with value: 0.8791208791208791.
[32m[I 2023-04-21 02:06:57,638][39m Trial 1745 finished with value: 0.8181818181818182 and parameters: {'objective': 'CrossEntropy', 'colsample_bylevel': 0.09886893768902617, 'depth': 3, 'boosting_type': 'Plain', 'bootstrap_type': 'Bayesian', 'bagging_temperature': 9.018663144658966}. Best is trial 98 with value: 0.8791208791208791.
[32m[I 2023-04-21 02:06:59,034][39m Trial 1746 finished with value: 0.8372093023255814 and parameters: {'objective': 'CrossEntropy', 'colsample_bylevel': 0.08173744046627837, 'depth': 5, 'boosting_type': 'Plain', 'bootstrap_type': 'Bayesian', 'bagging_temperature': 9.331877846764812}. Best is trial 98 with value: 0.8791208791208791.
[32m[I 2023-04-21 02:07:00,048][39m Trial 1747 finished with value: 0.8539325842696629 and parameters: {'objective': 'Logloss', 'colsample_bylevel': 0.07942197860899769, 'depth': 3, 'boosting_type': 'Plain', 'bootstrap_type': 'Bayesian', 'bagging_temperature': 7.858032298289233}. Best is trial 98 with value: 0.8791208791208791.
[32m[I 2023-04-21 02:07:01,313][39m Trial 1748 finished with value: 0.8275862068965518 and parameters: {'objective': 'CrossEntropy', 'colsample_bylevel': 0.07671936835407063, 'depth': 9, 'boosting_type': 'Plain', 'bootstrap_type': 'Bayesian', 'bagging_temperature': 8.441913052735414}. Best is trial 98 with value: 0.8791208791208791.
[32m[I 2023-04-21 02:07:05,924][39m Trial 1749 finished with value: 0.8666666666666666 and parameters: {'objective': 'CrossEntropy', 'colsample_bylevel': 0.07177089265500611, 'depth': 4, 'boosting_type': 'Ordered', 'bootstrap_type': 'Bayesian', 'bagging_temperature': 9.898306089493417}. Best is trial 98 with value: 0.8791208791208791.
[32m[I 2023-04-21 02:07:06,908][39m Trial 1750 finished with value: 0.8409090909090909 and parameters: {'objective': 'CrossEntropy', 'colsample_bylevel': 0.07823041742634027, 'depth': 3, 'boosting_type': 'Plain', 'bootstrap_type': 'Bayesian', 'bagging_temperature': 8.461909276864734}. Best is trial 98 with value: 0.8791208791208791.
[32m[I 2023-04-21 02:07:07,684][39m Trial 1751 finished with value: 0.8539325842696629 and parameters: {'objective': 'CrossEntropy', 'colsample_bylevel': 0.07242413421276149, 'depth': 4, 'boosting_type': 'Plain', 'bootstrap_type': 'Bayesian', 'bagging_temperature': 9.686690778958145}. Best is trial 98 with value: 0.8791208791208791.
[32m[I 2023-04-21 02:07:08,539][39m Trial 1752 finished with value: 0.8666666666666666 and parameters: {'objective': 'CrossEntropy', 'colsample_bylevel': 0.08484466257739215, 'depth': 3, 'boosting_type': 'Plain', 'bootstrap_type': 'Bayesian', 'bagging_temperature': 4.219531954426725}. Best is trial 98 with value: 0.8791208791208791.
[32m[I 2023-04-21 02:07:09,714][39m Trial 1753 finished with value: 0.8539325842696629 and parameters: {'objective': 'Logloss', 'colsample_bylevel': 0.08370226328214424, 'depth': 10, 'boosting_type': 'Plain', 'bootstrap_type': 'Bayesian', 'bagging_temperature': 9.150638830545967}. Best is trial 98 with value: 0.8791208791208791.
[32m[I 2023-04-21 02:07:10,541][39m Trial 1754 finished with value: 0.8139534883720929 and parameters: {'objective': 'CrossEntropy', 'colsample_bylevel': 0.0966715073386177, 'depth': 3, 'boosting_type': 'Plain', 'bootstrap_type': 'MVS'}. Best is trial 98 with value: 0.8791208791208791.
[32m[I 2023-04-21 02:07:11,308][39m Trial 1755 finished with value: 0.8409090909090909 and parameters: {'objective': 'CrossEntropy', 'colsample_bylevel': 0.08517682392434614, 'depth': 10, 'boosting_type': 'Plain', 'bootstrap_type': 'Bayesian', 'bagging_temperature': 8.15307247378577}. Best is trial 98 with value: 0.8791208791208791.
[32m[I 2023-04-21 02:07:12,280][39m Trial 1756 finished with value: 0.8539325842696629 and parameters: {'objective': 'CrossEntropy', 'colsample_bylevel': 0.06861026459175235, 'depth': 3, 'boosting_type': 'Plain', 'bootstrap_type': 'Bayesian', 'bagging_temperature': 9.467190982167041}. Best is trial 98 with value: 0.8791208791208791.
[32m[I 2023-04-21 02:07:13,704][39m Trial 1757 finished with value: 0.8666666666666666 and parameters: {'objective': 'Logloss', 'colsample_bylevel': 0.07308874139715626, 'depth': 4, 'boosting_type': 'Plain', 'bootstrap_type': 'Bayesian', 'bagging_temperature': 9.679508704591061}. Best is trial 98 with value: 0.8791208791208791.
[32m[I 2023-04-21 02:07:14,732][39m Trial 1758 finished with value: 0.8636363636363636 and parameters: {'objective': 'CrossEntropy', 'colsample_bylevel': 0.07787875386364361, 'depth': 8, 'boosting_type': 'Plain', 'bootstrap_type': 'Bayesian', 'bagging_temperature': 7.718643257416323}. Best is trial 98 with value: 0.8791208791208791.
[32m[I 2023-04-21 02:07:15,761][39m Trial 1759 finished with value: 0.8409090909090909 and parameters: {'objective': 'CrossEntropy', 'colsample_bylevel': 0.07856164706469768, 'depth': 9, 'boosting_type': 'Plain', 'bootstrap_type': 'Bayesian', 'bagging_temperature': 8.54771476700763}. Best is trial 98 with value: 0.8791208791208791.
[32m[I 2023-04-21 02:07:16,400][39m Trial 1760 finished with value: 0.8539325842696629 and parameters: {'objective': 'Logloss', 'colsample_bylevel': 0.08177470553839701, 'depth': 4, 'boosting_type': 'Plain', 'bootstrap_type': 'Bayesian', 'bagging_temperature': 9.015923518245453}. Best is trial 98 with value: 0.8791208791208791.
[32m[I 2023-04-21 02:07:16,870][39m Trial 1761 finished with value: 0.7640449438202247 and parameters: {'objective': 'CrossEntropy', 'colsample_bylevel': 0.010614508471012737, 'depth': 3, 'boosting_type': 'Plain', 'bootstrap_type': 'Bayesian', 'bagging_temperature': 8.743880248392426}. Best is trial 98 with value: 0.8791208791208791.
[32m[I 2023-04-21 02:07:17,471][39m Trial 1762 finished with value: 0.8666666666666666 and parameters: {'objective': 'CrossEntropy', 'colsample_bylevel': 0.08831954340978979, 'depth': 3, 'boosting_type': 'Plain', 'bootstrap_type': 'Bayesian', 'bagging_temperature': 9.028900135786367}. Best is trial 98 with value: 0.8791208791208791.
[32m[I 2023-04-21 02:07:18,702][39m Trial 1763 finished with value: 0.8636363636363636 and parameters: {'objective': 'CrossEntropy', 'colsample_bylevel': 0.09313628717009861, 'depth': 10, 'boosting_type': 'Plain', 'bootstrap_type': 'Bayesian', 'bagging_temperature': 9.942337008086433}. Best is trial 98 with value: 0.8791208791208791.
[32m[I 2023-04-21 02:07:19,582][39m Trial 1764 finished with value: 0.8505747126436782 and parameters: {'objective': 'CrossEntropy', 'colsample_bylevel': 0.0919428579679159, 'depth': 10, 'boosting_type': 'Plain', 'bootstrap_type': 'Bayesian', 'bagging_temperature': 9.934057408630856}. Best is trial 98 with value: 0.8791208791208791.
[32m[I 2023-04-21 02:07:20,706][39m Trial 1765 finished with value: 0.8666666666666666 and parameters: {'objective': 'CrossEntropy', 'colsample_bylevel': 0.07525100938957041, 'depth': 10, 'boosting_type': 'Plain', 'bootstrap_type': 'Bayesian', 'bagging_temperature': 9.293120121284609}. Best is trial 98 with value: 0.8791208791208791.
[32m[I 2023-04-21 02:07:21,893][39m Trial 1766 finished with value: 0.8539325842696629 and parameters: {'objective': 'CrossEntropy', 'colsample_bylevel': 0.09154750391234816, 'depth': 3, 'boosting_type': 'Plain', 'bootstrap_type': 'Bayesian', 'bagging_temperature': 9.949317946758645}. Best is trial 98 with value: 0.8791208791208791.
[32m[I 2023-04-21 02:07:26,499][39m Trial 1767 finished with value: 0.8275862068965518 and parameters: {'objective': 'CrossEntropy', 'colsample_bylevel': 0.07929953931778302, 'depth': 4, 'boosting_type': 'Ordered', 'bootstrap_type': 'Bayesian', 'bagging_temperature': 8.68679082334354}. Best is trial 98 with value: 0.8791208791208791.
[32m[I 2023-04-21 02:07:27,733][39m Trial 1768 finished with value: 0.8314606741573034 and parameters: {'objective': 'CrossEntropy', 'colsample_bylevel': 0.07891240894183392, 'depth': 9, 'boosting_type': 'Plain', 'bootstrap_type': 'Bernoulli', 'subsample': 0.2329215148779687}. Best is trial 98 with value: 0.8791208791208791.
[32m[I 2023-04-21 02:07:28,687][39m Trial 1769 finished with value: 0.8275862068965518 and parameters: {'objective': 'CrossEntropy', 'colsample_bylevel': 0.07479251549772653, 'depth': 12, 'boosting_type': 'Plain', 'bootstrap_type': 'MVS'}. Best is trial 98 with value: 0.8791208791208791.
[32m[I 2023-04-21 02:07:29,735][39m Trial 1770 finished with value: 0.8539325842696629 and parameters: {'objective': 'CrossEntropy', 'colsample_bylevel': 0.07562840095147849, 'depth': 5, 'boosting_type': 'Plain', 'bootstrap_type': 'Bayesian', 'bagging_temperature': 9.66982186645616}. Best is trial 98 with value: 0.8791208791208791.
[32m[I 2023-04-21 02:07:30,359][39m Trial 1771 finished with value: 0.8539325842696629 and parameters: {'objective': 'CrossEntropy', 'colsample_bylevel': 0.08426339291910825, 'depth': 3, 'boosting_type': 'Plain', 'bootstrap_type': 'Bayesian', 'bagging_temperature': 9.001616965809639}. Best is trial 98 with value: 0.8791208791208791.
[32m[I 2023-04-21 02:07:31,089][39m Trial 1772 finished with value: 0.8539325842696629 and parameters: {'objective': 'CrossEntropy', 'colsample_bylevel': 0.07681162789513095, 'depth': 7, 'boosting_type': 'Plain', 'bootstrap_type': 'Bayesian', 'bagging_temperature': 9.82091826824095}. Best is trial 98 with value: 0.8791208791208791.
[32m[I 2023-04-21 02:07:31,961][39m Trial 1773 finished with value: 0.8539325842696629 and parameters: {'objective': 'CrossEntropy', 'colsample_bylevel': 0.09266794317425454, 'depth': 3, 'boosting_type': 'Plain', 'bootstrap_type': 'Bayesian', 'bagging_temperature': 9.995428467811378}. Best is trial 98 with value: 0.8791208791208791.
[32m[I 2023-04-21 02:07:32,868][39m Trial 1774 finished with value: 0.8275862068965518 and parameters: {'objective': 'CrossEntropy', 'colsample_bylevel': 0.08836797196296454, 'depth': 3, 'boosting_type': 'Plain', 'bootstrap_type': 'Bayesian', 'bagging_temperature': 9.631172866546704}. Best is trial 98 with value: 0.8791208791208791.
[32m[I 2023-04-21 02:07:33,824][39m Trial 1775 finished with value: 0.8539325842696629 and parameters: {'objective': 'CrossEntropy', 'colsample_bylevel': 0.07727834352309144, 'depth': 3, 'boosting_type': 'Plain', 'bootstrap_type': 'Bayesian', 'bagging_temperature': 7.789391099075825}. Best is trial 98 with value: 0.8791208791208791.
[32m[I 2023-04-21 02:07:34,528][39m Trial 1776 finished with value: 0.8539325842696629 and parameters: {'objective': 'CrossEntropy', 'colsample_bylevel': 0.08073616674109713, 'depth': 11, 'boosting_type': 'Plain', 'bootstrap_type': 'Bayesian', 'bagging_temperature': 8.936237734342063}. Best is trial 98 with value: 0.8791208791208791.
[32m[I 2023-04-21 02:07:35,579][39m Trial 1777 finished with value: 0.8666666666666666 and parameters: {'objective': 'Logloss', 'colsample_bylevel': 0.07069438106527733, 'depth': 4, 'boosting_type': 'Plain', 'bootstrap_type': 'Bayesian', 'bagging_temperature': 9.84012379177787}. Best is trial 98 with value: 0.8791208791208791.
[32m[I 2023-04-21 02:07:36,482][39m Trial 1778 finished with value: 0.8275862068965518 and parameters: {'objective': 'CrossEntropy', 'colsample_bylevel': 0.09498172751032588, 'depth': 11, 'boosting_type': 'Plain', 'bootstrap_type': 'Bayesian', 'bagging_temperature': 8.61700770135304}. Best is trial 98 with value: 0.8791208791208791.
[32m[I 2023-04-21 02:07:37,286][39m Trial 1779 finished with value: 0.8539325842696629 and parameters: {'objective': 'Logloss', 'colsample_bylevel': 0.07416941512600052, 'depth': 4, 'boosting_type': 'Plain', 'bootstrap_type': 'Bayesian', 'bagging_temperature': 8.52959262688524}. Best is trial 98 with value: 0.8791208791208791.
[32m[I 2023-04-21 02:07:38,346][39m Trial 1780 finished with value: 0.8409090909090909 and parameters: {'objective': 'CrossEntropy', 'colsample_bylevel': 0.07406393195045131, 'depth': 8, 'boosting_type': 'Plain', 'bootstrap_type': 'Bayesian', 'bagging_temperature': 8.128691376470869}. Best is trial 98 with value: 0.8791208791208791.
[32m[I 2023-04-21 02:07:39,296][39m Trial 1781 finished with value: 0.8409090909090909 and parameters: {'objective': 'Logloss', 'colsample_bylevel': 0.07515501189111853, 'depth': 6, 'boosting_type': 'Plain', 'bootstrap_type': 'MVS'}. Best is trial 98 with value: 0.8791208791208791.
[32m[I 2023-04-21 02:07:40,252][39m Trial 1782 finished with value: 0.8539325842696629 and parameters: {'objective': 'CrossEntropy', 'colsample_bylevel': 0.07825160948451526, 'depth': 11, 'boosting_type': 'Plain', 'bootstrap_type': 'Bayesian', 'bagging_temperature': 9.987895840804157}. Best is trial 98 with value: 0.8791208791208791.
[32m[I 2023-04-21 02:07:41,169][39m Trial 1783 finished with value: 0.8409090909090909 and parameters: {'objective': 'CrossEntropy', 'colsample_bylevel': 0.0826798410409634, 'depth': 4, 'boosting_type': 'Plain', 'bootstrap_type': 'Bayesian', 'bagging_temperature': 9.370986228183607}. Best is trial 98 with value: 0.8791208791208791.
[32m[I 2023-04-21 02:07:42,183][39m Trial 1784 finished with value: 0.8275862068965518 and parameters: {'objective': 'Logloss', 'colsample_bylevel': 0.047517928830583284, 'depth': 4, 'boosting_type': 'Plain', 'bootstrap_type': 'Bayesian', 'bagging_temperature': 8.289378924427734}. Best is trial 98 with value: 0.8791208791208791.
