[32m[I 2023-04-21 02:10:15,876][39m Trial 1917 finished with value: 0.8222222222222222 and parameters: {'objective': 'CrossEntropy', 'colsample_bylevel': 0.07577650937242854, 'depth': 3, 'boosting_type': 'Ordered', 'bootstrap_type': 'MVS'}. Best is trial 98 with value: 0.8791208791208791.
[32m[I 2023-04-21 02:10:16,780][39m Trial 1918 finished with value: 0.8666666666666666 and parameters: {'objective': 'Logloss', 'colsample_bylevel': 0.08107462905514914, 'depth': 4, 'boosting_type': 'Plain', 'bootstrap_type': 'Bayesian', 'bagging_temperature': 8.915408667447386}. Best is trial 98 with value: 0.8791208791208791.
[32m[I 2023-04-21 02:10:17,746][39m Trial 1919 finished with value: 0.8409090909090909 and parameters: {'objective': 'Logloss', 'colsample_bylevel': 0.09393110366210605, 'depth': 7, 'boosting_type': 'Plain', 'bootstrap_type': 'Bayesian', 'bagging_temperature': 8.735799159309918}. Best is trial 98 with value: 0.8791208791208791.
[32m[I 2023-04-21 02:10:19,030][39m Trial 1920 finished with value: 0.8409090909090909 and parameters: {'objective': 'Logloss', 'colsample_bylevel': 0.0947803375184399, 'depth': 3, 'boosting_type': 'Plain', 'bootstrap_type': 'Bayesian', 'bagging_temperature': 9.717528358945113}. Best is trial 98 with value: 0.8791208791208791.
[32m[I 2023-04-21 02:10:20,011][39m Trial 1921 finished with value: 0.8409090909090909 and parameters: {'objective': 'Logloss', 'colsample_bylevel': 0.09796282871021415, 'depth': 5, 'boosting_type': 'Plain', 'bootstrap_type': 'Bayesian', 'bagging_temperature': 8.643016860625695}. Best is trial 98 with value: 0.8791208791208791.
[32m[I 2023-04-21 02:10:20,771][39m Trial 1922 finished with value: 0.8409090909090909 and parameters: {'objective': 'Logloss', 'colsample_bylevel': 0.07258801581379246, 'depth': 4, 'boosting_type': 'Plain', 'bootstrap_type': 'Bayesian', 'bagging_temperature': 9.825749785432409}. Best is trial 98 with value: 0.8791208791208791.
[32m[I 2023-04-21 02:10:21,377][39m Trial 1923 finished with value: 0.8409090909090909 and parameters: {'objective': 'CrossEntropy', 'colsample_bylevel': 0.07996558844826403, 'depth': 5, 'boosting_type': 'Plain', 'bootstrap_type': 'Bayesian', 'bagging_temperature': 9.249778148597326}. Best is trial 98 with value: 0.8791208791208791.
[32m[I 2023-04-21 02:10:22,553][39m Trial 1924 finished with value: 0.8539325842696629 and parameters: {'objective': 'CrossEntropy', 'colsample_bylevel': 0.0816511441589064, 'depth': 3, 'boosting_type': 'Plain', 'bootstrap_type': 'Bayesian', 'bagging_temperature': 9.311463752331472}. Best is trial 98 with value: 0.8791208791208791.
[32m[I 2023-04-21 02:10:23,784][39m Trial 1925 finished with value: 0.8666666666666666 and parameters: {'objective': 'CrossEntropy', 'colsample_bylevel': 0.07880551225310507, 'depth': 3, 'boosting_type': 'Plain', 'bootstrap_type': 'Bayesian', 'bagging_temperature': 9.764305554149713}. Best is trial 98 with value: 0.8791208791208791.
[32m[I 2023-04-21 02:10:25,320][39m Trial 1926 finished with value: 0.8505747126436782 and parameters: {'objective': 'CrossEntropy', 'colsample_bylevel': 0.077858325015468, 'depth': 9, 'boosting_type': 'Plain', 'bootstrap_type': 'Bayesian', 'bagging_temperature': 9.989938370495027}. Best is trial 98 with value: 0.8791208791208791.
[32m[I 2023-04-21 02:10:26,002][39m Trial 1927 finished with value: 0.8409090909090909 and parameters: {'objective': 'CrossEntropy', 'colsample_bylevel': 0.08645955576466524, 'depth': 3, 'boosting_type': 'Plain', 'bootstrap_type': 'Bayesian', 'bagging_temperature': 8.900795046368811}. Best is trial 98 with value: 0.8791208791208791.
[32m[I 2023-04-21 02:10:26,600][39m Trial 1928 finished with value: 0.8409090909090909 and parameters: {'objective': 'CrossEntropy', 'colsample_bylevel': 0.07416552515034275, 'depth': 4, 'boosting_type': 'Plain', 'bootstrap_type': 'Bayesian', 'bagging_temperature': 9.817001260500671}. Best is trial 98 with value: 0.8791208791208791.
[32m[I 2023-04-21 02:10:27,231][39m Trial 1929 finished with value: 0.8409090909090909 and parameters: {'objective': 'CrossEntropy', 'colsample_bylevel': 0.07751094901561731, 'depth': 12, 'boosting_type': 'Plain', 'bootstrap_type': 'Bayesian', 'bagging_temperature': 9.939250234517552}. Best is trial 98 with value: 0.8791208791208791.
[32m[I 2023-04-21 02:10:27,973][39m Trial 1930 finished with value: 0.8666666666666666 and parameters: {'objective': 'CrossEntropy', 'colsample_bylevel': 0.0822081730297677, 'depth': 3, 'boosting_type': 'Plain', 'bootstrap_type': 'Bayesian', 'bagging_temperature': 8.949257609731879}. Best is trial 98 with value: 0.8791208791208791.
[32m[I 2023-04-21 02:10:28,875][39m Trial 1931 finished with value: 0.8791208791208791 and parameters: {'objective': 'Logloss', 'colsample_bylevel': 0.07406843745521262, 'depth': 4, 'boosting_type': 'Plain', 'bootstrap_type': 'Bayesian', 'bagging_temperature': 8.347566104615819}. Best is trial 98 with value: 0.8791208791208791.
[32m[I 2023-04-21 02:10:29,820][39m Trial 1932 finished with value: 0.8275862068965518 and parameters: {'objective': 'Logloss', 'colsample_bylevel': 0.06955569014616805, 'depth': 4, 'boosting_type': 'Plain', 'bootstrap_type': 'Bayesian', 'bagging_temperature': 9.501004956049156}. Best is trial 98 with value: 0.8791208791208791.
[32m[I 2023-04-21 02:10:30,942][39m Trial 1933 finished with value: 0.8666666666666666 and parameters: {'objective': 'CrossEntropy', 'colsample_bylevel': 0.08818167269637445, 'depth': 3, 'boosting_type': 'Plain', 'bootstrap_type': 'Bayesian', 'bagging_temperature': 9.260113281646005}. Best is trial 98 with value: 0.8791208791208791.
[32m[I 2023-04-21 02:10:31,959][39m Trial 1934 finished with value: 0.8505747126436782 and parameters: {'objective': 'CrossEntropy', 'colsample_bylevel': 0.08456514990635958, 'depth': 8, 'boosting_type': 'Plain', 'bootstrap_type': 'Bayesian', 'bagging_temperature': 9.260207723656322}. Best is trial 98 with value: 0.8791208791208791.
[32m[I 2023-04-21 02:10:32,866][39m Trial 1935 finished with value: 0.8636363636363636 and parameters: {'objective': 'CrossEntropy', 'colsample_bylevel': 0.07704850624575824, 'depth': 10, 'boosting_type': 'Plain', 'bootstrap_type': 'Bayesian', 'bagging_temperature': 9.124744591968948}. Best is trial 98 with value: 0.8791208791208791.
[32m[I 2023-04-21 02:10:33,789][39m Trial 1936 finished with value: 0.8539325842696629 and parameters: {'objective': 'CrossEntropy', 'colsample_bylevel': 0.0836127320819388, 'depth': 3, 'boosting_type': 'Plain', 'bootstrap_type': 'Bayesian', 'bagging_temperature': 9.091949391051152}. Best is trial 98 with value: 0.8791208791208791.
[32m[I 2023-04-21 02:10:38,367][39m Trial 1937 finished with value: 0.8089887640449439 and parameters: {'objective': 'Logloss', 'colsample_bylevel': 0.07178261606494453, 'depth': 4, 'boosting_type': 'Ordered', 'bootstrap_type': 'MVS'}. Best is trial 98 with value: 0.8791208791208791.
[32m[I 2023-04-21 02:10:39,391][39m Trial 1938 finished with value: 0.8409090909090909 and parameters: {'objective': 'CrossEntropy', 'colsample_bylevel': 0.07565892541338125, 'depth': 4, 'boosting_type': 'Plain', 'bootstrap_type': 'Bayesian', 'bagging_temperature': 9.610125175430435}. Best is trial 98 with value: 0.8791208791208791.
[32m[I 2023-04-21 02:10:40,466][39m Trial 1939 finished with value: 0.8181818181818182 and parameters: {'objective': 'CrossEntropy', 'colsample_bylevel': 0.07311040622548785, 'depth': 5, 'boosting_type': 'Plain', 'bootstrap_type': 'Bernoulli', 'subsample': 0.4149675637792295}. Best is trial 98 with value: 0.8791208791208791.
[32m[I 2023-04-21 02:10:41,510][39m Trial 1940 finished with value: 0.8791208791208791 and parameters: {'objective': 'CrossEntropy', 'colsample_bylevel': 0.0791841727529754, 'depth': 3, 'boosting_type': 'Plain', 'bootstrap_type': 'Bayesian', 'bagging_temperature': 8.873320819012584}. Best is trial 98 with value: 0.8791208791208791.
[32m[I 2023-04-21 02:10:42,358][39m Trial 1941 finished with value: 0.8139534883720929 and parameters: {'objective': 'Logloss', 'colsample_bylevel': 0.07929640408644084, 'depth': 4, 'boosting_type': 'Plain', 'bootstrap_type': 'Bayesian', 'bagging_temperature': 9.047443453232319}. Best is trial 98 with value: 0.8791208791208791.
[32m[I 2023-04-21 02:10:43,171][39m Trial 1942 finished with value: 0.8409090909090909 and parameters: {'objective': 'CrossEntropy', 'colsample_bylevel': 0.08269102227149398, 'depth': 3, 'boosting_type': 'Plain', 'bootstrap_type': 'MVS'}. Best is trial 98 with value: 0.8791208791208791.
[32m[I 2023-04-21 02:10:44,182][39m Trial 1943 finished with value: 0.8539325842696629 and parameters: {'objective': 'CrossEntropy', 'colsample_bylevel': 0.0707706901106956, 'depth': 3, 'boosting_type': 'Plain', 'bootstrap_type': 'Bayesian', 'bagging_temperature': 8.147494517705159}. Best is trial 98 with value: 0.8791208791208791.
[32m[I 2023-04-21 02:10:45,122][39m Trial 1944 finished with value: 0.8604651162790697 and parameters: {'objective': 'CrossEntropy', 'colsample_bylevel': 0.07316640939949841, 'depth': 2, 'boosting_type': 'Plain', 'bootstrap_type': 'Bayesian', 'bagging_temperature': 7.992993054292246}. Best is trial 98 with value: 0.8791208791208791.
[32m[I 2023-04-21 02:10:46,063][39m Trial 1945 finished with value: 0.8539325842696629 and parameters: {'objective': 'CrossEntropy', 'colsample_bylevel': 0.08873519902512357, 'depth': 3, 'boosting_type': 'Plain', 'bootstrap_type': 'Bayesian', 'bagging_temperature': 9.999922958521193}. Best is trial 98 with value: 0.8791208791208791.
[32m[I 2023-04-21 02:10:47,047][39m Trial 1946 finished with value: 0.8539325842696629 and parameters: {'objective': 'CrossEntropy', 'colsample_bylevel': 0.061465601579392584, 'depth': 10, 'boosting_type': 'Plain', 'bootstrap_type': 'Bayesian', 'bagging_temperature': 9.533307440274887}. Best is trial 98 with value: 0.8791208791208791.
[32m[I 2023-04-21 02:10:48,213][39m Trial 1947 finished with value: 0.8409090909090909 and parameters: {'objective': 'Logloss', 'colsample_bylevel': 0.07616252863178045, 'depth': 10, 'boosting_type': 'Plain', 'bootstrap_type': 'Bayesian', 'bagging_temperature': 9.487460872241993}. Best is trial 98 with value: 0.8791208791208791.
[32m[I 2023-04-21 02:10:48,826][39m Trial 1948 finished with value: 0.8666666666666666 and parameters: {'objective': 'Logloss', 'colsample_bylevel': 0.07338959872000078, 'depth': 5, 'boosting_type': 'Plain', 'bootstrap_type': 'Bayesian', 'bagging_temperature': 8.01509431681794}. Best is trial 98 with value: 0.8791208791208791.
[32m[I 2023-04-21 02:10:49,466][39m Trial 1949 finished with value: 0.8409090909090909 and parameters: {'objective': 'Logloss', 'colsample_bylevel': 0.0960484086304357, 'depth': 10, 'boosting_type': 'Plain', 'bootstrap_type': 'Bayesian', 'bagging_temperature': 9.440286761177733}. Best is trial 98 with value: 0.8791208791208791.
[32m[I 2023-04-21 02:10:50,265][39m Trial 1950 finished with value: 0.8791208791208791 and parameters: {'objective': 'CrossEntropy', 'colsample_bylevel': 0.07393731601740754, 'depth': 4, 'boosting_type': 'Plain', 'bootstrap_type': 'Bayesian', 'bagging_temperature': 9.95429954286001}. Best is trial 98 with value: 0.8791208791208791.
[32m[I 2023-04-21 02:10:51,184][39m Trial 1951 finished with value: 0.8666666666666666 and parameters: {'objective': 'CrossEntropy', 'colsample_bylevel': 0.08318707791234516, 'depth': 3, 'boosting_type': 'Plain', 'bootstrap_type': 'Bayesian', 'bagging_temperature': 8.774512284333351}. Best is trial 98 with value: 0.8791208791208791.
[32m[I 2023-04-21 02:10:52,141][39m Trial 1952 finished with value: 0.8539325842696629 and parameters: {'objective': 'CrossEntropy', 'colsample_bylevel': 0.07014707943480301, 'depth': 4, 'boosting_type': 'Plain', 'bootstrap_type': 'Bayesian', 'bagging_temperature': 9.97432836293299}. Best is trial 98 with value: 0.8791208791208791.
[32m[I 2023-04-21 02:10:52,828][39m Trial 1953 finished with value: 0.8539325842696629 and parameters: {'objective': 'CrossEntropy', 'colsample_bylevel': 0.06595006306324654, 'depth': 4, 'boosting_type': 'Plain', 'bootstrap_type': 'Bayesian', 'bagging_temperature': 9.707129821981885}. Best is trial 98 with value: 0.8791208791208791.
[32m[I 2023-04-21 02:10:57,885][39m Trial 1954 finished with value: 0.8043478260869564 and parameters: {'objective': 'Logloss', 'colsample_bylevel': 0.07625375072560041, 'depth': 3, 'boosting_type': 'Ordered', 'bootstrap_type': 'MVS'}. Best is trial 98 with value: 0.8791208791208791.
[32m[I 2023-04-21 02:10:58,903][39m Trial 1955 finished with value: 0.8666666666666666 and parameters: {'objective': 'CrossEntropy', 'colsample_bylevel': 0.07568802943418065, 'depth': 5, 'boosting_type': 'Plain', 'bootstrap_type': 'Bayesian', 'bagging_temperature': 9.31661863231754}. Best is trial 98 with value: 0.8791208791208791.
[32m[I 2023-04-21 02:10:59,968][39m Trial 1956 finished with value: 0.8666666666666666 and parameters: {'objective': 'Logloss', 'colsample_bylevel': 0.07427960706447155, 'depth': 10, 'boosting_type': 'Plain', 'bootstrap_type': 'Bayesian', 'bagging_temperature': 9.576585108806341}. Best is trial 98 with value: 0.8791208791208791.
[32m[I 2023-04-21 02:11:00,800][39m Trial 1957 finished with value: 0.8409090909090909 and parameters: {'objective': 'Logloss', 'colsample_bylevel': 0.06866173996084662, 'depth': 4, 'boosting_type': 'Plain', 'bootstrap_type': 'Bayesian', 'bagging_temperature': 9.813553677213052}. Best is trial 98 with value: 0.8791208791208791.
[32m[I 2023-04-21 02:11:01,843][39m Trial 1958 finished with value: 0.8539325842696629 and parameters: {'objective': 'CrossEntropy', 'colsample_bylevel': 0.0742114792272331, 'depth': 4, 'boosting_type': 'Plain', 'bootstrap_type': 'Bayesian', 'bagging_temperature': 6.079241797083702}. Best is trial 98 with value: 0.8791208791208791.
[32m[I 2023-04-21 02:11:02,566][39m Trial 1959 finished with value: 0.8409090909090909 and parameters: {'objective': 'Logloss', 'colsample_bylevel': 0.086852555572913, 'depth': 4, 'boosting_type': 'Plain', 'bootstrap_type': 'Bayesian', 'bagging_temperature': 8.28573036097974}. Best is trial 98 with value: 0.8791208791208791.
[32m[I 2023-04-21 02:11:03,150][39m Trial 1960 finished with value: 0.8539325842696629 and parameters: {'objective': 'CrossEntropy', 'colsample_bylevel': 0.0756718307112568, 'depth': 4, 'boosting_type': 'Plain', 'bootstrap_type': 'Bayesian', 'bagging_temperature': 9.573564031918092}. Best is trial 98 with value: 0.8791208791208791.
[32m[I 2023-04-21 02:11:03,922][39m Trial 1961 finished with value: 0.8275862068965518 and parameters: {'objective': 'CrossEntropy', 'colsample_bylevel': 0.07722792698530306, 'depth': 9, 'boosting_type': 'Plain', 'bootstrap_type': 'Bernoulli', 'subsample': 0.28034788767927465}. Best is trial 98 with value: 0.8791208791208791.
[32m[I 2023-04-21 02:11:05,083][39m Trial 1962 finished with value: 0.8139534883720929 and parameters: {'objective': 'CrossEntropy', 'colsample_bylevel': 0.07800374858128478, 'depth': 10, 'boosting_type': 'Plain', 'bootstrap_type': 'Bayesian', 'bagging_temperature': 9.166657640641766}. Best is trial 98 with value: 0.8791208791208791.
[32m[I 2023-04-21 02:11:06,138][39m Trial 1963 finished with value: 0.8539325842696629 and parameters: {'objective': 'CrossEntropy', 'colsample_bylevel': 0.07024277198768039, 'depth': 4, 'boosting_type': 'Plain', 'bootstrap_type': 'Bayesian', 'bagging_temperature': 8.915978223812996}. Best is trial 98 with value: 0.8791208791208791.
[32m[I 2023-04-21 02:11:06,832][39m Trial 1964 finished with value: 0.8139534883720929 and parameters: {'objective': 'Logloss', 'colsample_bylevel': 0.07988338305719099, 'depth': 6, 'boosting_type': 'Plain', 'bootstrap_type': 'Bayesian', 'bagging_temperature': 9.020617481204852}. Best is trial 98 with value: 0.8791208791208791.
[32m[I 2023-04-21 02:11:07,697][39m Trial 1965 finished with value: 0.8666666666666666 and parameters: {'objective': 'CrossEntropy', 'colsample_bylevel': 0.05769463200883065, 'depth': 3, 'boosting_type': 'Plain', 'bootstrap_type': 'Bayesian', 'bagging_temperature': 9.545795792767299}. Best is trial 98 with value: 0.8791208791208791.
[32m[I 2023-04-21 02:11:08,515][39m Trial 1966 finished with value: 0.8539325842696629 and parameters: {'objective': 'CrossEntropy', 'colsample_bylevel': 0.08860870039977901, 'depth': 2, 'boosting_type': 'Plain', 'bootstrap_type': 'MVS'}. Best is trial 98 with value: 0.8791208791208791.
[32m[I 2023-04-21 02:11:09,287][39m Trial 1967 finished with value: 0.8666666666666666 and parameters: {'objective': 'Logloss', 'colsample_bylevel': 0.0672744398495122, 'depth': 11, 'boosting_type': 'Plain', 'bootstrap_type': 'Bayesian', 'bagging_temperature': 8.133839403274782}. Best is trial 98 with value: 0.8791208791208791.
[32m[I 2023-04-21 02:11:10,285][39m Trial 1968 finished with value: 0.8409090909090909 and parameters: {'objective': 'Logloss', 'colsample_bylevel': 0.07582248122635828, 'depth': 5, 'boosting_type': 'Plain', 'bootstrap_type': 'Bayesian', 'bagging_temperature': 8.41946321276196}. Best is trial 98 with value: 0.8791208791208791.
[32m[I 2023-04-21 02:11:10,986][39m Trial 1969 finished with value: 0.8666666666666666 and parameters: {'objective': 'Logloss', 'colsample_bylevel': 0.07935498800392572, 'depth': 3, 'boosting_type': 'Plain', 'bootstrap_type': 'Bayesian', 'bagging_temperature': 9.00573749073802}. Best is trial 98 with value: 0.8791208791208791.
[32m[I 2023-04-21 02:11:12,066][39m Trial 1970 finished with value: 0.8505747126436782 and parameters: {'objective': 'CrossEntropy', 'colsample_bylevel': 0.08146979996364843, 'depth': 10, 'boosting_type': 'Plain', 'bootstrap_type': 'Bayesian', 'bagging_temperature': 9.23862344485176}. Best is trial 98 with value: 0.8791208791208791.
[32m[I 2023-04-21 02:11:12,921][39m Trial 1971 finished with value: 0.8636363636363636 and parameters: {'objective': 'CrossEntropy', 'colsample_bylevel': 0.08341482106056163, 'depth': 10, 'boosting_type': 'Plain', 'bootstrap_type': 'Bayesian', 'bagging_temperature': 9.972005673706345}. Best is trial 98 with value: 0.8791208791208791.
[32m[I 2023-04-21 02:11:18,105][39m Trial 1972 finished with value: 0.7999999999999999 and parameters: {'objective': 'CrossEntropy', 'colsample_bylevel': 0.08810688163597785, 'depth': 10, 'boosting_type': 'Ordered', 'bootstrap_type': 'Bayesian', 'bagging_temperature': 9.751807424342223}. Best is trial 98 with value: 0.8791208791208791.
[32m[I 2023-04-21 02:11:19,218][39m Trial 1973 finished with value: 0.8666666666666666 and parameters: {'objective': 'CrossEntropy', 'colsample_bylevel': 0.07682281557843114, 'depth': 2, 'boosting_type': 'Plain', 'bootstrap_type': 'Bayesian', 'bagging_temperature': 8.756527266371265}. Best is trial 98 with value: 0.8791208791208791.
[32m[I 2023-04-21 02:11:20,048][39m Trial 1974 finished with value: 0.8791208791208791 and parameters: {'objective': 'Logloss', 'colsample_bylevel': 0.0722501220552572, 'depth': 5, 'boosting_type': 'Plain', 'bootstrap_type': 'Bayesian', 'bagging_temperature': 9.495272571604449}. Best is trial 98 with value: 0.8791208791208791.
[32m[I 2023-04-21 02:11:21,105][39m Trial 1975 finished with value: 0.8409090909090909 and parameters: {'objective': 'CrossEntropy', 'colsample_bylevel': 0.09422777172115115, 'depth': 3, 'boosting_type': 'Plain', 'bootstrap_type': 'Bayesian', 'bagging_temperature': 9.977576599268833}. Best is trial 98 with value: 0.8791208791208791.
[32m[I 2023-04-21 02:11:22,095][39m Trial 1976 finished with value: 0.8409090909090909 and parameters: {'objective': 'CrossEntropy', 'colsample_bylevel': 0.07162281428404604, 'depth': 7, 'boosting_type': 'Plain', 'bootstrap_type': 'Bayesian', 'bagging_temperature': 9.846013059216716}. Best is trial 98 with value: 0.8791208791208791.
[32m[I 2023-04-21 02:11:22,832][39m Trial 1977 finished with value: 0.8372093023255814 and parameters: {'objective': 'CrossEntropy', 'colsample_bylevel': 0.08484098874432783, 'depth': 10, 'boosting_type': 'Plain', 'bootstrap_type': 'Bayesian', 'bagging_temperature': 9.215328233288668}. Best is trial 98 with value: 0.8791208791208791.
[32m[I 2023-04-21 02:11:23,899][39m Trial 1978 finished with value: 0.8539325842696629 and parameters: {'objective': 'CrossEntropy', 'colsample_bylevel': 0.08459725649898814, 'depth': 9, 'boosting_type': 'Plain', 'bootstrap_type': 'Bayesian', 'bagging_temperature': 9.272344125363585}. Best is trial 98 with value: 0.8791208791208791.
[32m[I 2023-04-21 02:11:24,887][39m Trial 1979 finished with value: 0.8539325842696629 and parameters: {'objective': 'CrossEntropy', 'colsample_bylevel': 0.09333079247207719, 'depth': 3, 'boosting_type': 'Plain', 'bootstrap_type': 'Bayesian', 'bagging_temperature': 8.684376566746344}. Best is trial 98 with value: 0.8791208791208791.
[32m[I 2023-04-21 02:11:25,780][39m Trial 1980 finished with value: 0.8539325842696629 and parameters: {'objective': 'CrossEntropy', 'colsample_bylevel': 0.08166090864942126, 'depth': 3, 'boosting_type': 'Plain', 'bootstrap_type': 'Bayesian', 'bagging_temperature': 9.152916165903616}. Best is trial 98 with value: 0.8791208791208791.
[32m[I 2023-04-21 02:11:26,445][39m Trial 1981 finished with value: 0.8666666666666666 and parameters: {'objective': 'Logloss', 'colsample_bylevel': 0.0806514840435331, 'depth': 4, 'boosting_type': 'Plain', 'bootstrap_type': 'Bayesian', 'bagging_temperature': 9.000045940918492}. Best is trial 98 with value: 0.8791208791208791.
[32m[I 2023-04-21 02:11:27,529][39m Trial 1982 finished with value: 0.8275862068965518 and parameters: {'objective': 'CrossEntropy', 'colsample_bylevel': 0.07842106094431606, 'depth': 7, 'boosting_type': 'Plain', 'bootstrap_type': 'Bayesian', 'bagging_temperature': 9.293362271934205}. Best is trial 98 with value: 0.8791208791208791.
