[32m[I 2023-04-21 02:55:10,833][39m Trial 4217 finished with value: 0.8275862068965518 and parameters: {'objective': 'CrossEntropy', 'colsample_bylevel': 0.09953478703979617, 'depth': 3, 'boosting_type': 'Plain', 'bootstrap_type': 'Bayesian', 'bagging_temperature': 9.808877389869222}. Best is trial 3065 with value: 0.8863636363636364.
[32m[I 2023-04-21 02:55:11,916][39m Trial 4218 finished with value: 0.8791208791208791 and parameters: {'objective': 'CrossEntropy', 'colsample_bylevel': 0.07487509257463534, 'depth': 10, 'boosting_type': 'Plain', 'bootstrap_type': 'Bayesian', 'bagging_temperature': 8.969210622342468}. Best is trial 3065 with value: 0.8863636363636364.
[32m[I 2023-04-21 02:55:13,164][39m Trial 4219 finished with value: 0.8666666666666666 and parameters: {'objective': 'Logloss', 'colsample_bylevel': 0.07568950088666732, 'depth': 5, 'boosting_type': 'Plain', 'bootstrap_type': 'Bayesian', 'bagging_temperature': 9.410529556700096}. Best is trial 3065 with value: 0.8863636363636364.
[32m[I 2023-04-21 02:55:14,199][39m Trial 4220 finished with value: 0.8 and parameters: {'objective': 'CrossEntropy', 'colsample_bylevel': 0.07589323207888152, 'depth': 1, 'boosting_type': 'Plain', 'bootstrap_type': 'MVS'}. Best is trial 3065 with value: 0.8863636363636364.
[32m[I 2023-04-21 02:55:14,849][39m Trial 4221 finished with value: 0.8409090909090909 and parameters: {'objective': 'CrossEntropy', 'colsample_bylevel': 0.055210087017619904, 'depth': 3, 'boosting_type': 'Plain', 'bootstrap_type': 'Bayesian', 'bagging_temperature': 9.897885297178323}. Best is trial 3065 with value: 0.8863636363636364.
[32m[I 2023-04-21 02:55:15,536][39m Trial 4222 finished with value: 0.8735632183908046 and parameters: {'objective': 'CrossEntropy', 'colsample_bylevel': 0.03763867437169122, 'depth': 3, 'boosting_type': 'Plain', 'bootstrap_type': 'Bayesian', 'bagging_temperature': 8.423583373528485}. Best is trial 3065 with value: 0.8863636363636364.
[32m[I 2023-04-21 02:55:16,239][39m Trial 4223 finished with value: 0.8666666666666666 and parameters: {'objective': 'Logloss', 'colsample_bylevel': 0.07349904837544653, 'depth': 10, 'boosting_type': 'Plain', 'bootstrap_type': 'Bayesian', 'bagging_temperature': 9.329591666332728}. Best is trial 3065 with value: 0.8863636363636364.
[32m[I 2023-04-21 02:55:17,417][39m Trial 4224 finished with value: 0.8409090909090909 and parameters: {'objective': 'CrossEntropy', 'colsample_bylevel': 0.07897502456267151, 'depth': 4, 'boosting_type': 'Plain', 'bootstrap_type': 'Bayesian', 'bagging_temperature': 8.362165714700915}. Best is trial 3065 with value: 0.8863636363636364.
[32m[I 2023-04-21 02:55:18,380][39m Trial 4225 finished with value: 0.8666666666666666 and parameters: {'objective': 'CrossEntropy', 'colsample_bylevel': 0.04763622224915322, 'depth': 4, 'boosting_type': 'Plain', 'bootstrap_type': 'Bayesian', 'bagging_temperature': 7.373983589880298}. Best is trial 3065 with value: 0.8863636363636364.
[32m[I 2023-04-21 02:55:19,432][39m Trial 4226 finished with value: 0.8275862068965518 and parameters: {'objective': 'Logloss', 'colsample_bylevel': 0.07273827459926764, 'depth': 11, 'boosting_type': 'Plain', 'bootstrap_type': 'Bayesian', 'bagging_temperature': 9.6091463716509}. Best is trial 3065 with value: 0.8863636363636364.
[32m[I 2023-04-21 02:55:20,568][39m Trial 4227 finished with value: 0.8666666666666666 and parameters: {'objective': 'CrossEntropy', 'colsample_bylevel': 0.0876033866947163, 'depth': 2, 'boosting_type': 'Plain', 'bootstrap_type': 'Bayesian', 'bagging_temperature': 9.22458559853971}. Best is trial 3065 with value: 0.8863636363636364.
[32m[I 2023-04-21 02:55:21,365][39m Trial 4228 finished with value: 0.8539325842696629 and parameters: {'objective': 'CrossEntropy', 'colsample_bylevel': 0.05853559723199754, 'depth': 10, 'boosting_type': 'Plain', 'bootstrap_type': 'MVS'}. Best is trial 3065 with value: 0.8863636363636364.
[32m[I 2023-04-21 02:55:22,407][39m Trial 4229 finished with value: 0.8409090909090909 and parameters: {'objective': 'CrossEntropy', 'colsample_bylevel': 0.07294651304780213, 'depth': 3, 'boosting_type': 'Plain', 'bootstrap_type': 'Bayesian', 'bagging_temperature': 8.709952225173806}. Best is trial 3065 with value: 0.8863636363636364.
[32m[I 2023-04-21 02:55:27,074][39m Trial 4230 finished with value: 0.8275862068965518 and parameters: {'objective': 'Logloss', 'colsample_bylevel': 0.06412886737609114, 'depth': 8, 'boosting_type': 'Ordered', 'bootstrap_type': 'Bayesian', 'bagging_temperature': 8.271957403525304}. Best is trial 3065 with value: 0.8863636363636364.
[32m[I 2023-04-21 02:55:28,179][39m Trial 4231 finished with value: 0.8539325842696629 and parameters: {'objective': 'Logloss', 'colsample_bylevel': 0.07354988707570656, 'depth': 10, 'boosting_type': 'Plain', 'bootstrap_type': 'Bayesian', 'bagging_temperature': 9.985081580436946}. Best is trial 3065 with value: 0.8863636363636364.
[32m[I 2023-04-21 02:55:29,546][39m Trial 4232 finished with value: 0.8539325842696629 and parameters: {'objective': 'CrossEntropy', 'colsample_bylevel': 0.06945541737499458, 'depth': 12, 'boosting_type': 'Plain', 'bootstrap_type': 'Bayesian', 'bagging_temperature': 8.020422895284009}. Best is trial 3065 with value: 0.8863636363636364.
[32m[I 2023-04-21 02:55:30,320][39m Trial 4233 finished with value: 0.8139534883720929 and parameters: {'objective': 'CrossEntropy', 'colsample_bylevel': 0.07636576796181006, 'depth': 4, 'boosting_type': 'Plain', 'bootstrap_type': 'Bayesian', 'bagging_temperature': 8.58155934371761}. Best is trial 3065 with value: 0.8863636363636364.
[32m[I 2023-04-21 02:55:31,363][39m Trial 4234 finished with value: 0.8409090909090909 and parameters: {'objective': 'CrossEntropy', 'colsample_bylevel': 0.08856985837719071, 'depth': 4, 'boosting_type': 'Plain', 'bootstrap_type': 'Bayesian', 'bagging_temperature': 9.593384922169635}. Best is trial 3065 with value: 0.8863636363636364.
[32m[I 2023-04-21 02:55:32,787][39m Trial 4235 finished with value: 0.8409090909090909 and parameters: {'objective': 'Logloss', 'colsample_bylevel': 0.09825192077413204, 'depth': 10, 'boosting_type': 'Plain', 'bootstrap_type': 'Bayesian', 'bagging_temperature': 9.233093042646948}. Best is trial 3065 with value: 0.8863636363636364.
[32m[I 2023-04-21 02:55:33,639][39m Trial 4236 finished with value: 0.8409090909090909 and parameters: {'objective': 'Logloss', 'colsample_bylevel': 0.09487274879594648, 'depth': 10, 'boosting_type': 'Plain', 'bootstrap_type': 'Bayesian', 'bagging_temperature': 9.179756804046116}. Best is trial 3065 with value: 0.8863636363636364.
[32m[I 2023-04-21 02:55:34,885][39m Trial 4237 finished with value: 0.8444444444444446 and parameters: {'objective': 'CrossEntropy', 'colsample_bylevel': 0.0777052135218234, 'depth': 6, 'boosting_type': 'Plain', 'bootstrap_type': 'Bayesian', 'bagging_temperature': 8.81574811708832}. Best is trial 3065 with value: 0.8863636363636364.
[32m[I 2023-04-21 02:55:35,625][39m Trial 4238 finished with value: 0.8539325842696629 and parameters: {'objective': 'CrossEntropy', 'colsample_bylevel': 0.06774146954315492, 'depth': 7, 'boosting_type': 'Plain', 'bootstrap_type': 'Bayesian', 'bagging_temperature': 9.042079495357934}. Best is trial 3065 with value: 0.8863636363636364.
[32m[I 2023-04-21 02:55:36,557][39m Trial 4239 finished with value: 0.8666666666666666 and parameters: {'objective': 'Logloss', 'colsample_bylevel': 0.07543772320778949, 'depth': 10, 'boosting_type': 'Plain', 'bootstrap_type': 'Bayesian', 'bagging_temperature': 9.434708771472973}. Best is trial 3065 with value: 0.8863636363636364.
[32m[I 2023-04-21 02:55:37,802][39m Trial 4240 finished with value: 0.8409090909090909 and parameters: {'objective': 'Logloss', 'colsample_bylevel': 0.093894614617158, 'depth': 6, 'boosting_type': 'Plain', 'bootstrap_type': 'Bayesian', 'bagging_temperature': 8.739263554461319}. Best is trial 3065 with value: 0.8863636363636364.
[32m[I 2023-04-21 02:55:38,500][39m Trial 4241 finished with value: 0.8139534883720929 and parameters: {'objective': 'CrossEntropy', 'colsample_bylevel': 0.09774034373502358, 'depth': 3, 'boosting_type': 'Plain', 'bootstrap_type': 'Bayesian', 'bagging_temperature': 8.525332672621348}. Best is trial 3065 with value: 0.8863636363636364.
[32m[I 2023-04-21 02:55:39,352][39m Trial 4242 finished with value: 0.8275862068965518 and parameters: {'objective': 'CrossEntropy', 'colsample_bylevel': 0.07353255036511205, 'depth': 7, 'boosting_type': 'Plain', 'bootstrap_type': 'Bayesian', 'bagging_temperature': 8.92187562589957}. Best is trial 3065 with value: 0.8863636363636364.
[32m[I 2023-04-21 02:55:40,266][39m Trial 4243 finished with value: 0.8139534883720929 and parameters: {'objective': 'Logloss', 'colsample_bylevel': 0.05225409161874227, 'depth': 8, 'boosting_type': 'Plain', 'bootstrap_type': 'Bayesian', 'bagging_temperature': 9.761063397189776}. Best is trial 3065 with value: 0.8863636363636364.
[32m[I 2023-04-21 02:55:41,427][39m Trial 4244 finished with value: 0.8 and parameters: {'objective': 'CrossEntropy', 'colsample_bylevel': 0.05906814193392489, 'depth': 9, 'boosting_type': 'Plain', 'bootstrap_type': 'MVS'}. Best is trial 3065 with value: 0.8863636363636364.
[32m[I 2023-04-21 02:55:42,509][39m Trial 4245 finished with value: 0.8539325842696629 and parameters: {'objective': 'Logloss', 'colsample_bylevel': 0.08810435308062152, 'depth': 3, 'boosting_type': 'Plain', 'bootstrap_type': 'Bayesian', 'bagging_temperature': 8.919106931599412}. Best is trial 3065 with value: 0.8863636363636364.
[32m[I 2023-04-21 02:55:43,821][39m Trial 4246 finished with value: 0.8666666666666666 and parameters: {'objective': 'Logloss', 'colsample_bylevel': 0.07540557196436969, 'depth': 5, 'boosting_type': 'Plain', 'bootstrap_type': 'Bayesian', 'bagging_temperature': 9.420897188114}. Best is trial 3065 with value: 0.8863636363636364.
[32m[I 2023-04-21 02:55:44,526][39m Trial 4247 finished with value: 0.8539325842696629 and parameters: {'objective': 'CrossEntropy', 'colsample_bylevel': 0.0749473636021951, 'depth': 2, 'boosting_type': 'Plain', 'bootstrap_type': 'Bayesian', 'bagging_temperature': 9.782067304576973}. Best is trial 3065 with value: 0.8863636363636364.
[32m[I 2023-04-21 02:55:45,173][39m Trial 4248 finished with value: 0.8764044943820225 and parameters: {'objective': 'CrossEntropy', 'colsample_bylevel': 0.07631145651338322, 'depth': 2, 'boosting_type': 'Plain', 'bootstrap_type': 'Bayesian', 'bagging_temperature': 9.755480969919244}. Best is trial 3065 with value: 0.8863636363636364.
[32m[I 2023-04-21 02:55:46,440][39m Trial 4249 finished with value: 0.8666666666666666 and parameters: {'objective': 'CrossEntropy', 'colsample_bylevel': 0.07749668775448544, 'depth': 4, 'boosting_type': 'Plain', 'bootstrap_type': 'Bayesian', 'bagging_temperature': 9.117330274592073}. Best is trial 3065 with value: 0.8863636363636364.
[32m[I 2023-04-21 02:55:51,428][39m Trial 4250 finished with value: 0.8409090909090909 and parameters: {'objective': 'Logloss', 'colsample_bylevel': 0.07088652512656793, 'depth': 11, 'boosting_type': 'Ordered', 'bootstrap_type': 'Bayesian', 'bagging_temperature': 9.056704621948263}. Best is trial 3065 with value: 0.8863636363636364.
[32m[I 2023-04-21 02:55:52,409][39m Trial 4251 finished with value: 0.8636363636363636 and parameters: {'objective': 'CrossEntropy', 'colsample_bylevel': 0.07976008007304858, 'depth': 2, 'boosting_type': 'Plain', 'bootstrap_type': 'Bayesian', 'bagging_temperature': 9.732258654971137}. Best is trial 3065 with value: 0.8863636363636364.
[32m[I 2023-04-21 02:55:53,507][39m Trial 4252 finished with value: 0.8275862068965518 and parameters: {'objective': 'CrossEntropy', 'colsample_bylevel': 0.08121742351333487, 'depth': 3, 'boosting_type': 'Plain', 'bootstrap_type': 'Bernoulli', 'subsample': 0.9168780240129704}. Best is trial 3065 with value: 0.8863636363636364.
[32m[I 2023-04-21 02:55:54,538][39m Trial 4253 finished with value: 0.8666666666666666 and parameters: {'objective': 'CrossEntropy', 'colsample_bylevel': 0.07653950547478515, 'depth': 4, 'boosting_type': 'Plain', 'bootstrap_type': 'Bayesian', 'bagging_temperature': 9.246609652605411}. Best is trial 3065 with value: 0.8863636363636364.
[32m[I 2023-04-21 02:55:55,250][39m Trial 4254 finished with value: 0.8539325842696629 and parameters: {'objective': 'CrossEntropy', 'colsample_bylevel': 0.07802581069315352, 'depth': 10, 'boosting_type': 'Plain', 'bootstrap_type': 'Bayesian', 'bagging_temperature': 9.743462936462173}. Best is trial 3065 with value: 0.8863636363636364.
[32m[I 2023-04-21 02:55:56,746][39m Trial 4255 finished with value: 0.8539325842696629 and parameters: {'objective': 'CrossEntropy', 'colsample_bylevel': 0.06982608744911545, 'depth': 8, 'boosting_type': 'Plain', 'bootstrap_type': 'Bayesian', 'bagging_temperature': 8.905539171783174}. Best is trial 3065 with value: 0.8863636363636364.
[32m[I 2023-04-21 02:55:57,765][39m Trial 4256 finished with value: 0.8505747126436782 and parameters: {'objective': 'CrossEntropy', 'colsample_bylevel': 0.07586892203696537, 'depth': 3, 'boosting_type': 'Plain', 'bootstrap_type': 'Bayesian', 'bagging_temperature': 9.652859279220301}. Best is trial 3065 with value: 0.8863636363636364.
[32m[I 2023-04-21 02:55:58,764][39m Trial 4257 finished with value: 0.8539325842696629 and parameters: {'objective': 'CrossEntropy', 'colsample_bylevel': 0.07716987410125188, 'depth': 3, 'boosting_type': 'Plain', 'bootstrap_type': 'Bayesian', 'bagging_temperature': 9.995377657940725}. Best is trial 3065 with value: 0.8863636363636364.
[32m[I 2023-04-21 02:55:59,555][39m Trial 4258 finished with value: 0.8539325842696629 and parameters: {'objective': 'Logloss', 'colsample_bylevel': 0.08340720139780727, 'depth': 3, 'boosting_type': 'Plain', 'bootstrap_type': 'Bayesian', 'bagging_temperature': 9.541941887418039}. Best is trial 3065 with value: 0.8863636363636364.
[32m[I 2023-04-21 02:56:00,787][39m Trial 4259 finished with value: 0.8409090909090909 and parameters: {'objective': 'CrossEntropy', 'colsample_bylevel': 0.07259329654481825, 'depth': 9, 'boosting_type': 'Plain', 'bootstrap_type': 'MVS'}. Best is trial 3065 with value: 0.8863636363636364.
[32m[I 2023-04-21 02:56:01,762][39m Trial 4260 finished with value: 0.8409090909090909 and parameters: {'objective': 'CrossEntropy', 'colsample_bylevel': 0.07503361157705597, 'depth': 11, 'boosting_type': 'Plain', 'bootstrap_type': 'Bayesian', 'bagging_temperature': 9.333052115168593}. Best is trial 3065 with value: 0.8863636363636364.
[32m[I 2023-04-21 02:56:02,771][39m Trial 4261 finished with value: 0.8604651162790697 and parameters: {'objective': 'CrossEntropy', 'colsample_bylevel': 0.09417602046262911, 'depth': 9, 'boosting_type': 'Plain', 'bootstrap_type': 'Bayesian', 'bagging_temperature': 9.996805932065945}. Best is trial 3065 with value: 0.8863636363636364.
[32m[I 2023-04-21 02:56:03,855][39m Trial 4262 finished with value: 0.8409090909090909 and parameters: {'objective': 'CrossEntropy', 'colsample_bylevel': 0.08299940273840346, 'depth': 3, 'boosting_type': 'Plain', 'bootstrap_type': 'MVS'}. Best is trial 3065 with value: 0.8863636363636364.
[32m[I 2023-04-21 02:56:04,763][39m Trial 4263 finished with value: 0.8409090909090909 and parameters: {'objective': 'CrossEntropy', 'colsample_bylevel': 0.0842986883710313, 'depth': 3, 'boosting_type': 'Plain', 'bootstrap_type': 'Bayesian', 'bagging_temperature': 9.566751941885661}. Best is trial 3065 with value: 0.8863636363636364.
[32m[I 2023-04-21 02:56:05,419][39m Trial 4264 finished with value: 0.8275862068965518 and parameters: {'objective': 'Logloss', 'colsample_bylevel': 0.07200917575719087, 'depth': 10, 'boosting_type': 'Plain', 'bootstrap_type': 'Bernoulli', 'subsample': 0.4641515531388909}. Best is trial 3065 with value: 0.8863636363636364.
[32m[I 2023-04-21 02:56:06,618][39m Trial 4265 finished with value: 0.8539325842696629 and parameters: {'objective': 'CrossEntropy', 'colsample_bylevel': 0.089424109233075, 'depth': 3, 'boosting_type': 'Plain', 'bootstrap_type': 'Bayesian', 'bagging_temperature': 8.655366658738743}. Best is trial 3065 with value: 0.8863636363636364.
[32m[I 2023-04-21 02:56:07,608][39m Trial 4266 finished with value: 0.8409090909090909 and parameters: {'objective': 'CrossEntropy', 'colsample_bylevel': 0.0718103692624203, 'depth': 4, 'boosting_type': 'Plain', 'bootstrap_type': 'Bayesian', 'bagging_temperature': 8.446422518937855}. Best is trial 3065 with value: 0.8863636363636364.
[32m[I 2023-04-21 02:56:12,347][39m Trial 4267 finished with value: 0.8409090909090909 and parameters: {'objective': 'CrossEntropy', 'colsample_bylevel': 0.0826603597206088, 'depth': 3, 'boosting_type': 'Ordered', 'bootstrap_type': 'Bayesian', 'bagging_temperature': 9.107451610200764}. Best is trial 3065 with value: 0.8863636363636364.
[32m[I 2023-04-21 02:56:13,512][39m Trial 4268 finished with value: 0.8539325842696629 and parameters: {'objective': 'CrossEntropy', 'colsample_bylevel': 0.08346730608156813, 'depth': 3, 'boosting_type': 'Plain', 'bootstrap_type': 'Bayesian', 'bagging_temperature': 9.121932412120799}. Best is trial 3065 with value: 0.8863636363636364.
[32m[I 2023-04-21 02:56:14,681][39m Trial 4269 finished with value: 0.8636363636363636 and parameters: {'objective': 'CrossEntropy', 'colsample_bylevel': 0.07186397346298413, 'depth': 4, 'boosting_type': 'Plain', 'bootstrap_type': 'Bayesian', 'bagging_temperature': 8.999697422355737}. Best is trial 3065 with value: 0.8863636363636364.
[32m[I 2023-04-21 02:56:15,639][39m Trial 4270 finished with value: 0.8539325842696629 and parameters: {'objective': 'CrossEntropy', 'colsample_bylevel': 0.08666443102493436, 'depth': 3, 'boosting_type': 'Plain', 'bootstrap_type': 'Bayesian', 'bagging_temperature': 9.643252964572012}. Best is trial 3065 with value: 0.8863636363636364.
[32m[I 2023-04-21 02:56:16,572][39m Trial 4271 finished with value: 0.8764044943820225 and parameters: {'objective': 'CrossEntropy', 'colsample_bylevel': 0.05789018308803805, 'depth': 3, 'boosting_type': 'Plain', 'bootstrap_type': 'Bayesian', 'bagging_temperature': 9.447260105803878}. Best is trial 3065 with value: 0.8863636363636364.
[32m[I 2023-04-21 02:56:17,545][39m Trial 4272 finished with value: 0.8791208791208791 and parameters: {'objective': 'CrossEntropy', 'colsample_bylevel': 0.08588934219496615, 'depth': 3, 'boosting_type': 'Plain', 'bootstrap_type': 'Bayesian', 'bagging_temperature': 9.47155941412711}. Best is trial 3065 with value: 0.8863636363636364.
[32m[I 2023-04-21 02:56:18,774][39m Trial 4273 finished with value: 0.8539325842696629 and parameters: {'objective': 'CrossEntropy', 'colsample_bylevel': 0.08996343142487978, 'depth': 3, 'boosting_type': 'Plain', 'bootstrap_type': 'Bayesian', 'bagging_temperature': 8.80860588654413}. Best is trial 3065 with value: 0.8863636363636364.
[32m[I 2023-04-21 02:56:19,479][39m Trial 4274 finished with value: 0.8539325842696629 and parameters: {'objective': 'CrossEntropy', 'colsample_bylevel': 0.07812866763772708, 'depth': 2, 'boosting_type': 'Plain', 'bootstrap_type': 'Bayesian', 'bagging_temperature': 9.7893189436464}. Best is trial 3065 with value: 0.8863636363636364.
[32m[I 2023-04-21 02:56:20,582][39m Trial 4275 finished with value: 0.8539325842696629 and parameters: {'objective': 'Logloss', 'colsample_bylevel': 0.07364910666645436, 'depth': 4, 'boosting_type': 'Plain', 'bootstrap_type': 'Bayesian', 'bagging_temperature': 9.758418325777866}. Best is trial 3065 with value: 0.8863636363636364.
[32m[I 2023-04-21 02:56:21,309][39m Trial 4276 finished with value: 0.8045977011494252 and parameters: {'objective': 'CrossEntropy', 'colsample_bylevel': 0.017177353558690774, 'depth': 3, 'boosting_type': 'Plain', 'bootstrap_type': 'Bayesian', 'bagging_temperature': 8.809838367791288}. Best is trial 3065 with value: 0.8863636363636364.
[32m[I 2023-04-21 02:56:22,434][39m Trial 4277 finished with value: 0.8314606741573034 and parameters: {'objective': 'CrossEntropy', 'colsample_bylevel': 0.05921522398277449, 'depth': 9, 'boosting_type': 'Plain', 'bootstrap_type': 'MVS'}. Best is trial 3065 with value: 0.8863636363636364.
[32m[I 2023-04-21 02:56:23,236][39m Trial 4278 finished with value: 0.8666666666666666 and parameters: {'objective': 'CrossEntropy', 'colsample_bylevel': 0.07190507565288268, 'depth': 10, 'boosting_type': 'Plain', 'bootstrap_type': 'Bayesian', 'bagging_temperature': 6.273354805562679}. Best is trial 3065 with value: 0.8863636363636364.
[32m[I 2023-04-21 02:56:23,875][39m Trial 4279 finished with value: 0.8539325842696629 and parameters: {'objective': 'CrossEntropy', 'colsample_bylevel': 0.06485002826049602, 'depth': 12, 'boosting_type': 'Plain', 'bootstrap_type': 'Bayesian', 'bagging_temperature': 9.521699101821204}. Best is trial 3065 with value: 0.8863636363636364.
[32m[I 2023-04-21 02:56:24,798][39m Trial 4280 finished with value: 0.8666666666666666 and parameters: {'objective': 'CrossEntropy', 'colsample_bylevel': 0.07271573200659694, 'depth': 4, 'boosting_type': 'Plain', 'bootstrap_type': 'Bayesian', 'bagging_temperature': 8.909136948591309}. Best is trial 3065 with value: 0.8863636363636364.
[32m[I 2023-04-21 02:56:25,638][39m Trial 4281 finished with value: 0.8539325842696629 and parameters: {'objective': 'CrossEntropy', 'colsample_bylevel': 0.07328530981518308, 'depth': 4, 'boosting_type': 'Plain', 'bootstrap_type': 'Bayesian', 'bagging_temperature': 9.816375248126294}. Best is trial 3065 with value: 0.8863636363636364.
[32m[I 2023-04-21 02:56:26,821][39m Trial 4282 finished with value: 0.8539325842696629 and parameters: {'objective': 'Logloss', 'colsample_bylevel': 0.06873776983950042, 'depth': 10, 'boosting_type': 'Plain', 'bootstrap_type': 'Bayesian', 'bagging_temperature': 9.134315732335281}. Best is trial 3065 with value: 0.8863636363636364.
