[32m[I 2023-04-21 02:36:51,074][39m Trial 3301 finished with value: 0.8409090909090909 and parameters: {'objective': 'Logloss', 'colsample_bylevel': 0.07940153615877664, 'depth': 6, 'boosting_type': 'Plain', 'bootstrap_type': 'Bayesian', 'bagging_temperature': 9.838500735701247}. Best is trial 3065 with value: 0.8863636363636364.
[32m[I 2023-04-21 02:36:51,705][39m Trial 3302 finished with value: 0.8409090909090909 and parameters: {'objective': 'CrossEntropy', 'colsample_bylevel': 0.07606224051985562, 'depth': 10, 'boosting_type': 'Plain', 'bootstrap_type': 'Bayesian', 'bagging_temperature': 7.967343920454895}. Best is trial 3065 with value: 0.8863636363636364.
[32m[I 2023-04-21 02:36:52,360][39m Trial 3303 finished with value: 0.8539325842696629 and parameters: {'objective': 'CrossEntropy', 'colsample_bylevel': 0.08087781040340103, 'depth': 11, 'boosting_type': 'Plain', 'bootstrap_type': 'Bayesian', 'bagging_temperature': 8.544123419121677}. Best is trial 3065 with value: 0.8863636363636364.
[32m[I 2023-04-21 02:36:53,028][39m Trial 3304 finished with value: 0.8666666666666666 and parameters: {'objective': 'CrossEntropy', 'colsample_bylevel': 0.07565939038488512, 'depth': 3, 'boosting_type': 'Plain', 'bootstrap_type': 'Bayesian', 'bagging_temperature': 9.149243286497548}. Best is trial 3065 with value: 0.8863636363636364.
[32m[I 2023-04-21 02:36:54,268][39m Trial 3305 finished with value: 0.8666666666666666 and parameters: {'objective': 'Logloss', 'colsample_bylevel': 0.08268909371519756, 'depth': 3, 'boosting_type': 'Plain', 'bootstrap_type': 'Bayesian', 'bagging_temperature': 8.549666527896672}. Best is trial 3065 with value: 0.8863636363636364.
[32m[I 2023-04-21 02:36:55,431][39m Trial 3306 finished with value: 0.8275862068965518 and parameters: {'objective': 'Logloss', 'colsample_bylevel': 0.08360955330761584, 'depth': 11, 'boosting_type': 'Plain', 'bootstrap_type': 'Bayesian', 'bagging_temperature': 8.84516084418927}. Best is trial 3065 with value: 0.8863636363636364.
[32m[I 2023-04-21 02:36:56,347][39m Trial 3307 finished with value: 0.8139534883720929 and parameters: {'objective': 'Logloss', 'colsample_bylevel': 0.0724634125042975, 'depth': 10, 'boosting_type': 'Plain', 'bootstrap_type': 'MVS'}. Best is trial 3065 with value: 0.8863636363636364.
[32m[I 2023-04-21 02:36:57,590][39m Trial 3308 finished with value: 0.8409090909090909 and parameters: {'objective': 'CrossEntropy', 'colsample_bylevel': 0.06741798765737056, 'depth': 9, 'boosting_type': 'Plain', 'bootstrap_type': 'Bayesian', 'bagging_temperature': 8.67253464556653}. Best is trial 3065 with value: 0.8863636363636364.
[32m[I 2023-04-21 02:36:58,881][39m Trial 3309 finished with value: 0.8275862068965518 and parameters: {'objective': 'CrossEntropy', 'colsample_bylevel': 0.07037653233430514, 'depth': 9, 'boosting_type': 'Plain', 'bootstrap_type': 'Bayesian', 'bagging_temperature': 9.336271666856112}. Best is trial 3065 with value: 0.8863636363636364.
[32m[I 2023-04-21 02:36:59,585][39m Trial 3310 finished with value: 0.8791208791208791 and parameters: {'objective': 'Logloss', 'colsample_bylevel': 0.07343106881312934, 'depth': 4, 'boosting_type': 'Plain', 'bootstrap_type': 'Bayesian', 'bagging_temperature': 9.622491962172328}. Best is trial 3065 with value: 0.8863636363636364.
[32m[I 2023-04-21 02:37:00,425][39m Trial 3311 finished with value: 0.8666666666666666 and parameters: {'objective': 'CrossEntropy', 'colsample_bylevel': 0.09299489583993693, 'depth': 2, 'boosting_type': 'Plain', 'bootstrap_type': 'Bayesian', 'bagging_temperature': 9.976773625578382}. Best is trial 3065 with value: 0.8863636363636364.
[32m[I 2023-04-21 02:37:05,477][39m Trial 3312 finished with value: 0.8409090909090909 and parameters: {'objective': 'CrossEntropy', 'colsample_bylevel': 0.08807307037615394, 'depth': 4, 'boosting_type': 'Ordered', 'bootstrap_type': 'Bayesian', 'bagging_temperature': 8.189134367070283}. Best is trial 3065 with value: 0.8863636363636364.
[32m[I 2023-04-21 02:37:06,779][39m Trial 3313 finished with value: 0.8181818181818182 and parameters: {'objective': 'Logloss', 'colsample_bylevel': 0.07122585937590838, 'depth': 12, 'boosting_type': 'Plain', 'bootstrap_type': 'MVS'}. Best is trial 3065 with value: 0.8863636363636364.
[32m[I 2023-04-21 02:37:07,959][39m Trial 3314 finished with value: 0.8539325842696629 and parameters: {'objective': 'CrossEntropy', 'colsample_bylevel': 0.08004532334897804, 'depth': 8, 'boosting_type': 'Plain', 'bootstrap_type': 'Bayesian', 'bagging_temperature': 9.97992428235404}. Best is trial 3065 with value: 0.8863636363636364.
[32m[I 2023-04-21 02:37:08,830][39m Trial 3315 finished with value: 0.8409090909090909 and parameters: {'objective': 'Logloss', 'colsample_bylevel': 0.07090988202256103, 'depth': 8, 'boosting_type': 'Plain', 'bootstrap_type': 'Bayesian', 'bagging_temperature': 9.472175435479015}. Best is trial 3065 with value: 0.8863636363636364.
[32m[I 2023-04-21 02:37:09,842][39m Trial 3316 finished with value: 0.8139534883720929 and parameters: {'objective': 'CrossEntropy', 'colsample_bylevel': 0.0697874996053901, 'depth': 10, 'boosting_type': 'Plain', 'bootstrap_type': 'Bayesian', 'bagging_temperature': 8.412411909606195}. Best is trial 3065 with value: 0.8863636363636364.
[32m[I 2023-04-21 02:37:11,079][39m Trial 3317 finished with value: 0.8409090909090909 and parameters: {'objective': 'CrossEntropy', 'colsample_bylevel': 0.07441404824645378, 'depth': 8, 'boosting_type': 'Plain', 'bootstrap_type': 'Bayesian', 'bagging_temperature': 9.37640879973522}. Best is trial 3065 with value: 0.8863636363636364.
[32m[I 2023-04-21 02:37:12,726][39m Trial 3318 finished with value: 0.8409090909090909 and parameters: {'objective': 'Logloss', 'colsample_bylevel': 0.07264320500738178, 'depth': 9, 'boosting_type': 'Plain', 'bootstrap_type': 'Bayesian', 'bagging_temperature': 9.8554370304889}. Best is trial 3065 with value: 0.8863636363636364.
[32m[I 2023-04-21 02:37:13,356][39m Trial 3319 finished with value: 0.8409090909090909 and parameters: {'objective': 'CrossEntropy', 'colsample_bylevel': 0.07917182015950282, 'depth': 3, 'boosting_type': 'Plain', 'bootstrap_type': 'Bernoulli', 'subsample': 0.5176711128273439}. Best is trial 3065 with value: 0.8863636363636364.
[32m[I 2023-04-21 02:37:14,001][39m Trial 3320 finished with value: 0.8666666666666666 and parameters: {'objective': 'Logloss', 'colsample_bylevel': 0.07369886079423307, 'depth': 10, 'boosting_type': 'Plain', 'bootstrap_type': 'Bayesian', 'bagging_temperature': 9.4593896178452}. Best is trial 3065 with value: 0.8863636363636364.
[32m[I 2023-04-21 02:37:15,014][39m Trial 3321 finished with value: 0.8409090909090909 and parameters: {'objective': 'CrossEntropy', 'colsample_bylevel': 0.09673098108919932, 'depth': 3, 'boosting_type': 'Plain', 'bootstrap_type': 'Bayesian', 'bagging_temperature': 9.220416720532668}. Best is trial 3065 with value: 0.8863636363636364.
[32m[I 2023-04-21 02:37:16,066][39m Trial 3322 finished with value: 0.8539325842696629 and parameters: {'objective': 'CrossEntropy', 'colsample_bylevel': 0.0715062057193611, 'depth': 12, 'boosting_type': 'Plain', 'bootstrap_type': 'Bayesian', 'bagging_temperature': 9.341775773080299}. Best is trial 3065 with value: 0.8863636363636364.
[32m[I 2023-04-21 02:37:16,801][39m Trial 3323 finished with value: 0.8409090909090909 and parameters: {'objective': 'Logloss', 'colsample_bylevel': 0.07268394915666926, 'depth': 4, 'boosting_type': 'Plain', 'bootstrap_type': 'Bernoulli', 'subsample': 0.6872463639802315}. Best is trial 3065 with value: 0.8863636363636364.
[32m[I 2023-04-21 02:37:17,593][39m Trial 3324 finished with value: 0.8539325842696629 and parameters: {'objective': 'Logloss', 'colsample_bylevel': 0.07731501648189773, 'depth': 10, 'boosting_type': 'Plain', 'bootstrap_type': 'Bayesian', 'bagging_temperature': 9.481475459527179}. Best is trial 3065 with value: 0.8863636363636364.
[32m[I 2023-04-21 02:37:18,542][39m Trial 3325 finished with value: 0.8666666666666666 and parameters: {'objective': 'CrossEntropy', 'colsample_bylevel': 0.07634625914620775, 'depth': 12, 'boosting_type': 'Plain', 'bootstrap_type': 'Bayesian', 'bagging_temperature': 9.633895326584613}. Best is trial 3065 with value: 0.8863636363636364.
[32m[I 2023-04-21 02:37:19,492][39m Trial 3326 finished with value: 0.8275862068965518 and parameters: {'objective': 'CrossEntropy', 'colsample_bylevel': 0.07350894898066798, 'depth': 10, 'boosting_type': 'Plain', 'bootstrap_type': 'MVS'}. Best is trial 3065 with value: 0.8863636363636364.
[32m[I 2023-04-21 02:37:20,131][39m Trial 3327 finished with value: 0.8275862068965518 and parameters: {'objective': 'CrossEntropy', 'colsample_bylevel': 0.0738888466100446, 'depth': 10, 'boosting_type': 'Plain', 'bootstrap_type': 'Bayesian', 'bagging_temperature': 9.645641226688191}. Best is trial 3065 with value: 0.8863636363636364.
[32m[I 2023-04-21 02:37:25,241][39m Trial 3328 finished with value: 0.8666666666666666 and parameters: {'objective': 'CrossEntropy', 'colsample_bylevel': 0.07063014615882357, 'depth': 12, 'boosting_type': 'Ordered', 'bootstrap_type': 'Bayesian', 'bagging_temperature': 8.890252020519844}. Best is trial 3065 with value: 0.8863636363636364.
[32m[I 2023-04-21 02:37:26,456][39m Trial 3329 finished with value: 0.8275862068965518 and parameters: {'objective': 'CrossEntropy', 'colsample_bylevel': 0.07101520908917443, 'depth': 8, 'boosting_type': 'Plain', 'bootstrap_type': 'Bayesian', 'bagging_temperature': 8.547235715687634}. Best is trial 3065 with value: 0.8863636363636364.
[32m[I 2023-04-21 02:37:27,718][39m Trial 3330 finished with value: 0.8791208791208791 and parameters: {'objective': 'CrossEntropy', 'colsample_bylevel': 0.0748530712245774, 'depth': 10, 'boosting_type': 'Plain', 'bootstrap_type': 'Bayesian', 'bagging_temperature': 9.645734357269884}. Best is trial 3065 with value: 0.8863636363636364.
[32m[I 2023-04-21 02:37:28,687][39m Trial 3331 finished with value: 0.8409090909090909 and parameters: {'objective': 'CrossEntropy', 'colsample_bylevel': 0.08060240183978865, 'depth': 11, 'boosting_type': 'Plain', 'bootstrap_type': 'Bayesian', 'bagging_temperature': 9.502611879161744}. Best is trial 3065 with value: 0.8863636363636364.
[32m[I 2023-04-21 02:37:29,615][39m Trial 3332 finished with value: 0.8409090909090909 and parameters: {'objective': 'CrossEntropy', 'colsample_bylevel': 0.07156700656499163, 'depth': 10, 'boosting_type': 'Plain', 'bootstrap_type': 'Bayesian', 'bagging_temperature': 7.070103370884812}. Best is trial 3065 with value: 0.8863636363636364.
[32m[I 2023-04-21 02:37:30,587][39m Trial 3333 finished with value: 0.8409090909090909 and parameters: {'objective': 'CrossEntropy', 'colsample_bylevel': 0.08135326587563645, 'depth': 3, 'boosting_type': 'Plain', 'bootstrap_type': 'Bayesian', 'bagging_temperature': 8.169417347713182}. Best is trial 3065 with value: 0.8863636363636364.
[32m[I 2023-04-21 02:37:31,240][39m Trial 3334 finished with value: 0.8409090909090909 and parameters: {'objective': 'CrossEntropy', 'colsample_bylevel': 0.07722158610755626, 'depth': 3, 'boosting_type': 'Plain', 'bootstrap_type': 'MVS'}. Best is trial 3065 with value: 0.8863636363636364.
[32m[I 2023-04-21 02:37:31,997][39m Trial 3335 finished with value: 0.8275862068965518 and parameters: {'objective': 'CrossEntropy', 'colsample_bylevel': 0.09781663732484025, 'depth': 4, 'boosting_type': 'Plain', 'bootstrap_type': 'Bayesian', 'bagging_temperature': 9.871340144166258}. Best is trial 3065 with value: 0.8863636363636364.
[32m[I 2023-04-21 02:37:33,512][39m Trial 3336 finished with value: 0.8636363636363636 and parameters: {'objective': 'CrossEntropy', 'colsample_bylevel': 0.07558729335377534, 'depth': 9, 'boosting_type': 'Plain', 'bootstrap_type': 'Bayesian', 'bagging_temperature': 9.290321333708901}. Best is trial 3065 with value: 0.8863636363636364.
[32m[I 2023-04-21 02:37:34,271][39m Trial 3337 finished with value: 0.8666666666666666 and parameters: {'objective': 'CrossEntropy', 'colsample_bylevel': 0.06602844222717934, 'depth': 10, 'boosting_type': 'Plain', 'bootstrap_type': 'Bayesian', 'bagging_temperature': 9.70301480134818}. Best is trial 3065 with value: 0.8863636363636364.
[32m[I 2023-04-21 02:37:35,011][39m Trial 3338 finished with value: 0.8666666666666666 and parameters: {'objective': 'Logloss', 'colsample_bylevel': 0.0736166090887958, 'depth': 9, 'boosting_type': 'Plain', 'bootstrap_type': 'Bayesian', 'bagging_temperature': 7.957128083399051}. Best is trial 3065 with value: 0.8863636363636364.
[32m[I 2023-04-21 02:37:35,688][39m Trial 3339 finished with value: 0.8539325842696629 and parameters: {'objective': 'CrossEntropy', 'colsample_bylevel': 0.09393706963756483, 'depth': 2, 'boosting_type': 'Plain', 'bootstrap_type': 'Bayesian', 'bagging_temperature': 8.957266419523318}. Best is trial 3065 with value: 0.8863636363636364.
[32m[I 2023-04-21 02:37:36,619][39m Trial 3340 finished with value: 0.8409090909090909 and parameters: {'objective': 'CrossEntropy', 'colsample_bylevel': 0.07641528376104643, 'depth': 7, 'boosting_type': 'Plain', 'bootstrap_type': 'Bayesian', 'bagging_temperature': 9.803085552374883}. Best is trial 3065 with value: 0.8863636363636364.
[32m[I 2023-04-21 02:37:37,660][39m Trial 3341 finished with value: 0.8139534883720929 and parameters: {'objective': 'CrossEntropy', 'colsample_bylevel': 0.07632561026832779, 'depth': 12, 'boosting_type': 'Plain', 'bootstrap_type': 'Bayesian', 'bagging_temperature': 9.938503091784373}. Best is trial 3065 with value: 0.8863636363636364.
[32m[I 2023-04-21 02:37:39,048][39m Trial 3342 finished with value: 0.8409090909090909 and parameters: {'objective': 'CrossEntropy', 'colsample_bylevel': 0.08618997194817564, 'depth': 4, 'boosting_type': 'Plain', 'bootstrap_type': 'Bayesian', 'bagging_temperature': 0.5466560786706678}. Best is trial 3065 with value: 0.8863636363636364.
[32m[I 2023-04-21 02:37:39,952][39m Trial 3343 finished with value: 0.8539325842696629 and parameters: {'objective': 'CrossEntropy', 'colsample_bylevel': 0.067973579715571, 'depth': 11, 'boosting_type': 'Plain', 'bootstrap_type': 'Bayesian', 'bagging_temperature': 9.162847398499649}. Best is trial 3065 with value: 0.8863636363636364.
[32m[I 2023-04-21 02:37:40,587][39m Trial 3344 finished with value: 0.8139534883720929 and parameters: {'objective': 'CrossEntropy', 'colsample_bylevel': 0.06940118510452982, 'depth': 11, 'boosting_type': 'Plain', 'bootstrap_type': 'Bayesian', 'bagging_temperature': 5.82623716957737}. Best is trial 3065 with value: 0.8863636363636364.
[32m[I 2023-04-21 02:37:41,703][39m Trial 3345 finished with value: 0.8314606741573034 and parameters: {'objective': 'Logloss', 'colsample_bylevel': 0.0771662971083725, 'depth': 3, 'boosting_type': 'Plain', 'bootstrap_type': 'Bernoulli', 'subsample': 0.7372325800207733}. Best is trial 3065 with value: 0.8863636363636364.
[32m[I 2023-04-21 02:37:42,672][39m Trial 3346 finished with value: 0.8409090909090909 and parameters: {'objective': 'Logloss', 'colsample_bylevel': 0.06886752528791076, 'depth': 12, 'boosting_type': 'Plain', 'bootstrap_type': 'MVS'}. Best is trial 3065 with value: 0.8863636363636364.
[32m[I 2023-04-21 02:37:44,009][39m Trial 3347 finished with value: 0.8505747126436782 and parameters: {'objective': 'CrossEntropy', 'colsample_bylevel': 0.07958915473623812, 'depth': 8, 'boosting_type': 'Plain', 'bootstrap_type': 'Bayesian', 'bagging_temperature': 9.703254394918893}. Best is trial 3065 with value: 0.8863636363636364.
[32m[I 2023-04-21 02:37:48,573][39m Trial 3348 finished with value: 0.8539325842696629 and parameters: {'objective': 'CrossEntropy', 'colsample_bylevel': 0.06771934544055881, 'depth': 12, 'boosting_type': 'Ordered', 'bootstrap_type': 'Bayesian', 'bagging_temperature': 9.279037698269915}. Best is trial 3065 with value: 0.8863636363636364.
[32m[I 2023-04-21 02:37:49,523][39m Trial 3349 finished with value: 0.8409090909090909 and parameters: {'objective': 'Logloss', 'colsample_bylevel': 0.010055059708947156, 'depth': 12, 'boosting_type': 'Plain', 'bootstrap_type': 'Bayesian', 'bagging_temperature': 8.976294765991561}. Best is trial 3065 with value: 0.8863636363636364.
[32m[I 2023-04-21 02:37:50,508][39m Trial 3350 finished with value: 0.8409090909090909 and parameters: {'objective': 'CrossEntropy', 'colsample_bylevel': 0.07875243339007697, 'depth': 4, 'boosting_type': 'Plain', 'bootstrap_type': 'Bayesian', 'bagging_temperature': 9.79993844132929}. Best is trial 3065 with value: 0.8863636363636364.
[32m[I 2023-04-21 02:37:51,523][39m Trial 3351 finished with value: 0.8539325842696629 and parameters: {'objective': 'CrossEntropy', 'colsample_bylevel': 0.07460241400950479, 'depth': 9, 'boosting_type': 'Plain', 'bootstrap_type': 'Bayesian', 'bagging_temperature': 9.695555621201844}. Best is trial 3065 with value: 0.8863636363636364.
[32m[I 2023-04-21 02:37:52,539][39m Trial 3352 finished with value: 0.8539325842696629 and parameters: {'objective': 'Logloss', 'colsample_bylevel': 0.07349240110372718, 'depth': 9, 'boosting_type': 'Plain', 'bootstrap_type': 'Bayesian', 'bagging_temperature': 8.749330409956507}. Best is trial 3065 with value: 0.8863636363636364.
[32m[I 2023-04-21 02:37:53,534][39m Trial 3353 finished with value: 0.8539325842696629 and parameters: {'objective': 'Logloss', 'colsample_bylevel': 0.08595144591364165, 'depth': 5, 'boosting_type': 'Plain', 'bootstrap_type': 'Bayesian', 'bagging_temperature': 9.333923943539858}. Best is trial 3065 with value: 0.8863636363636364.
[32m[I 2023-04-21 02:37:54,431][39m Trial 3354 finished with value: 0.8539325842696629 and parameters: {'objective': 'Logloss', 'colsample_bylevel': 0.07423658187834271, 'depth': 9, 'boosting_type': 'Plain', 'bootstrap_type': 'Bayesian', 'bagging_temperature': 9.422716796591237}. Best is trial 3065 with value: 0.8863636363636364.
[32m[I 2023-04-21 02:37:55,071][39m Trial 3355 finished with value: 0.8409090909090909 and parameters: {'objective': 'CrossEntropy', 'colsample_bylevel': 0.06552591305002087, 'depth': 11, 'boosting_type': 'Plain', 'bootstrap_type': 'Bayesian', 'bagging_temperature': 8.675803334005069}. Best is trial 3065 with value: 0.8863636363636364.
[32m[I 2023-04-21 02:37:56,043][39m Trial 3356 finished with value: 0.8409090909090909 and parameters: {'objective': 'CrossEntropy', 'colsample_bylevel': 0.07222910710426605, 'depth': 12, 'boosting_type': 'Plain', 'bootstrap_type': 'Bayesian', 'bagging_temperature': 9.650341748240017}. Best is trial 3065 with value: 0.8863636363636364.
[32m[I 2023-04-21 02:37:57,026][39m Trial 3357 finished with value: 0.8275862068965518 and parameters: {'objective': 'Logloss', 'colsample_bylevel': 0.08616714078131486, 'depth': 5, 'boosting_type': 'Plain', 'bootstrap_type': 'Bayesian', 'bagging_temperature': 9.305391237161684}. Best is trial 3065 with value: 0.8863636363636364.
[32m[I 2023-04-21 02:37:57,927][39m Trial 3358 finished with value: 0.8764044943820225 and parameters: {'objective': 'CrossEntropy', 'colsample_bylevel': 0.07994760708798862, 'depth': 2, 'boosting_type': 'Plain', 'bootstrap_type': 'Bayesian', 'bagging_temperature': 9.446025442721087}. Best is trial 3065 with value: 0.8863636363636364.
[32m[I 2023-04-21 02:37:58,861][39m Trial 3359 finished with value: 0.8666666666666666 and parameters: {'objective': 'CrossEntropy', 'colsample_bylevel': 0.08411246027231972, 'depth': 3, 'boosting_type': 'Plain', 'bootstrap_type': 'Bayesian', 'bagging_temperature': 9.101691984637213}. Best is trial 3065 with value: 0.8863636363636364.
[32m[I 2023-04-21 02:37:59,766][39m Trial 3360 finished with value: 0.8666666666666666 and parameters: {'objective': 'CrossEntropy', 'colsample_bylevel': 0.08497543416199688, 'depth': 3, 'boosting_type': 'Plain', 'bootstrap_type': 'Bayesian', 'bagging_temperature': 8.939978774369187}. Best is trial 3065 with value: 0.8863636363636364.
[32m[I 2023-04-21 02:38:00,520][39m Trial 3361 finished with value: 0.8666666666666666 and parameters: {'objective': 'CrossEntropy', 'colsample_bylevel': 0.07872397867101787, 'depth': 3, 'boosting_type': 'Plain', 'bootstrap_type': 'Bayesian', 'bagging_temperature': 8.943707203500379}. Best is trial 3065 with value: 0.8863636363636364.
[32m[I 2023-04-21 02:38:01,569][39m Trial 3362 finished with value: 0.8275862068965518 and parameters: {'objective': 'Logloss', 'colsample_bylevel': 0.08704067907427163, 'depth': 12, 'boosting_type': 'Plain', 'bootstrap_type': 'Bayesian', 'bagging_temperature': 8.715135253554502}. Best is trial 3065 with value: 0.8863636363636364.
[32m[I 2023-04-21 02:38:02,823][39m Trial 3363 finished with value: 0.8409090909090909 and parameters: {'objective': 'CrossEntropy', 'colsample_bylevel': 0.09124442736629394, 'depth': 8, 'boosting_type': 'Plain', 'bootstrap_type': 'Bayesian', 'bagging_temperature': 8.390812266015628}. Best is trial 3065 with value: 0.8863636363636364.
[32m[I 2023-04-21 02:38:04,266][39m Trial 3364 finished with value: 0.8791208791208791 and parameters: {'objective': 'CrossEntropy', 'colsample_bylevel': 0.06503896677732422, 'depth': 9, 'boosting_type': 'Plain', 'bootstrap_type': 'Bayesian', 'bagging_temperature': 9.846211976298754}. Best is trial 3065 with value: 0.8863636363636364.
[32m[I 2023-04-21 02:38:08,802][39m Trial 3365 finished with value: 0.8444444444444446 and parameters: {'objective': 'Logloss', 'colsample_bylevel': 0.07802307218047971, 'depth': 4, 'boosting_type': 'Ordered', 'bootstrap_type': 'Bayesian', 'bagging_temperature': 9.551641264095373}. Best is trial 3065 with value: 0.8863636363636364.
