[32m[I 2023-04-21 02:52:29,434][39m Trial 4086 finished with value: 0.8666666666666666 and parameters: {'objective': 'CrossEntropy', 'colsample_bylevel': 0.07143765098494585, 'depth': 4, 'boosting_type': 'Plain', 'bootstrap_type': 'Bayesian', 'bagging_temperature': 9.292032995526167}. Best is trial 3065 with value: 0.8863636363636364.
[32m[I 2023-04-21 02:52:30,865][39m Trial 4087 finished with value: 0.8372093023255814 and parameters: {'objective': 'CrossEntropy', 'colsample_bylevel': 0.08955282817306177, 'depth': 9, 'boosting_type': 'Plain', 'bootstrap_type': 'Bayesian', 'bagging_temperature': 8.622103191055077}. Best is trial 3065 with value: 0.8863636363636364.
[32m[I 2023-04-21 02:52:31,521][39m Trial 4088 finished with value: 0.8539325842696629 and parameters: {'objective': 'CrossEntropy', 'colsample_bylevel': 0.08552059479149228, 'depth': 3, 'boosting_type': 'Plain', 'bootstrap_type': 'Bayesian', 'bagging_temperature': 3.9475744681750564}. Best is trial 3065 with value: 0.8863636363636364.
[32m[I 2023-04-21 02:52:32,268][39m Trial 4089 finished with value: 0.8539325842696629 and parameters: {'objective': 'CrossEntropy', 'colsample_bylevel': 0.07720656808517758, 'depth': 9, 'boosting_type': 'Plain', 'bootstrap_type': 'Bayesian', 'bagging_temperature': 9.657606690287187}. Best is trial 3065 with value: 0.8863636363636364.
[32m[I 2023-04-21 02:52:33,562][39m Trial 4090 finished with value: 0.8275862068965518 and parameters: {'objective': 'CrossEntropy', 'colsample_bylevel': 0.07664277319783401, 'depth': 9, 'boosting_type': 'Plain', 'bootstrap_type': 'Bayesian', 'bagging_temperature': 9.58508804118677}. Best is trial 3065 with value: 0.8863636363636364.
[32m[I 2023-04-21 02:52:34,239][39m Trial 4091 finished with value: 0.8539325842696629 and parameters: {'objective': 'CrossEntropy', 'colsample_bylevel': 0.07911535403719905, 'depth': 3, 'boosting_type': 'Plain', 'bootstrap_type': 'Bernoulli', 'subsample': 0.7797435434007037}. Best is trial 3065 with value: 0.8863636363636364.
[32m[I 2023-04-21 02:52:35,578][39m Trial 4092 finished with value: 0.8791208791208791 and parameters: {'objective': 'CrossEntropy', 'colsample_bylevel': 0.07366688349399331, 'depth': 4, 'boosting_type': 'Plain', 'bootstrap_type': 'Bayesian', 'bagging_temperature': 9.160314715597197}. Best is trial 3065 with value: 0.8863636363636364.
[32m[I 2023-04-21 02:52:36,829][39m Trial 4093 finished with value: 0.8409090909090909 and parameters: {'objective': 'CrossEntropy', 'colsample_bylevel': 0.07968541673123067, 'depth': 10, 'boosting_type': 'Plain', 'bootstrap_type': 'Bayesian', 'bagging_temperature': 8.88132922693669}. Best is trial 3065 with value: 0.8863636363636364.
[32m[I 2023-04-21 02:52:37,930][39m Trial 4094 finished with value: 0.8539325842696629 and parameters: {'objective': 'Logloss', 'colsample_bylevel': 0.07577533572703646, 'depth': 9, 'boosting_type': 'Plain', 'bootstrap_type': 'Bayesian', 'bagging_temperature': 9.973527531789028}. Best is trial 3065 with value: 0.8863636363636364.
[32m[I 2023-04-21 02:52:39,073][39m Trial 4095 finished with value: 0.8505747126436782 and parameters: {'objective': 'CrossEntropy', 'colsample_bylevel': 0.08333982378001085, 'depth': 10, 'boosting_type': 'Plain', 'bootstrap_type': 'Bayesian', 'bagging_temperature': 8.660940682573987}. Best is trial 3065 with value: 0.8863636363636364.
[32m[I 2023-04-21 02:52:40,142][39m Trial 4096 finished with value: 0.8539325842696629 and parameters: {'objective': 'CrossEntropy', 'colsample_bylevel': 0.07984749320926302, 'depth': 9, 'boosting_type': 'Plain', 'bootstrap_type': 'Bayesian', 'bagging_temperature': 9.817835516026209}. Best is trial 3065 with value: 0.8863636363636364.
[32m[I 2023-04-21 02:52:41,427][39m Trial 4097 finished with value: 0.8539325842696629 and parameters: {'objective': 'Logloss', 'colsample_bylevel': 0.07117441854501175, 'depth': 10, 'boosting_type': 'Plain', 'bootstrap_type': 'Bayesian', 'bagging_temperature': 9.219853546284094}. Best is trial 3065 with value: 0.8863636363636364.
[32m[I 2023-04-21 02:52:46,146][39m Trial 4098 finished with value: 0.8666666666666666 and parameters: {'objective': 'Logloss', 'colsample_bylevel': 0.08146618582256607, 'depth': 4, 'boosting_type': 'Ordered', 'bootstrap_type': 'Bayesian', 'bagging_temperature': 9.309414918886393}. Best is trial 3065 with value: 0.8863636363636364.
[32m[I 2023-04-21 02:52:47,109][39m Trial 4099 finished with value: 0.8666666666666666 and parameters: {'objective': 'CrossEntropy', 'colsample_bylevel': 0.06713671811383798, 'depth': 7, 'boosting_type': 'Plain', 'bootstrap_type': 'Bayesian', 'bagging_temperature': 9.989865758634863}. Best is trial 3065 with value: 0.8863636363636364.
[32m[I 2023-04-21 02:52:48,054][39m Trial 4100 finished with value: 0.8666666666666666 and parameters: {'objective': 'CrossEntropy', 'colsample_bylevel': 0.0682202998322196, 'depth': 7, 'boosting_type': 'Plain', 'bootstrap_type': 'Bayesian', 'bagging_temperature': 9.996429351100709}. Best is trial 3065 with value: 0.8863636363636364.
[32m[I 2023-04-21 02:52:49,056][39m Trial 4101 finished with value: 0.8636363636363636 and parameters: {'objective': 'CrossEntropy', 'colsample_bylevel': 0.08004743019163577, 'depth': 10, 'boosting_type': 'Plain', 'bootstrap_type': 'Bayesian', 'bagging_temperature': 9.362516108710802}. Best is trial 3065 with value: 0.8863636363636364.
[32m[I 2023-04-21 02:52:50,317][39m Trial 4102 finished with value: 0.8409090909090909 and parameters: {'objective': 'CrossEntropy', 'colsample_bylevel': 0.0884714933765127, 'depth': 4, 'boosting_type': 'Plain', 'bootstrap_type': 'Bayesian', 'bagging_temperature': 8.684247975045704}. Best is trial 3065 with value: 0.8863636363636364.
[32m[I 2023-04-21 02:52:51,483][39m Trial 4103 finished with value: 0.8409090909090909 and parameters: {'objective': 'CrossEntropy', 'colsample_bylevel': 0.07748541042488602, 'depth': 11, 'boosting_type': 'Plain', 'bootstrap_type': 'Bayesian', 'bagging_temperature': 9.258596171689275}. Best is trial 3065 with value: 0.8863636363636364.
[32m[I 2023-04-21 02:52:52,876][39m Trial 4104 finished with value: 0.8275862068965518 and parameters: {'objective': 'CrossEntropy', 'colsample_bylevel': 0.09526230916758337, 'depth': 8, 'boosting_type': 'Plain', 'bootstrap_type': 'Bayesian', 'bagging_temperature': 9.71884419702127}. Best is trial 3065 with value: 0.8863636363636364.
[32m[I 2023-04-21 02:52:53,784][39m Trial 4105 finished with value: 0.8409090909090909 and parameters: {'objective': 'CrossEntropy', 'colsample_bylevel': 0.0746433752022951, 'depth': 10, 'boosting_type': 'Plain', 'bootstrap_type': 'MVS'}. Best is trial 3065 with value: 0.8863636363636364.
[32m[I 2023-04-21 02:52:54,422][39m Trial 4106 finished with value: 0.8539325842696629 and parameters: {'objective': 'CrossEntropy', 'colsample_bylevel': 0.08384895980741357, 'depth': 3, 'boosting_type': 'Plain', 'bootstrap_type': 'Bernoulli', 'subsample': 0.32546164462574145}. Best is trial 3065 with value: 0.8863636363636364.
[32m[I 2023-04-21 02:52:55,236][39m Trial 4107 finished with value: 0.8409090909090909 and parameters: {'objective': 'Logloss', 'colsample_bylevel': 0.07811353665710234, 'depth': 10, 'boosting_type': 'Plain', 'bootstrap_type': 'Bayesian', 'bagging_temperature': 9.843862367749164}. Best is trial 3065 with value: 0.8863636363636364.
[32m[I 2023-04-21 02:52:56,381][39m Trial 4108 finished with value: 0.8539325842696629 and parameters: {'objective': 'CrossEntropy', 'colsample_bylevel': 0.06850948517350151, 'depth': 4, 'boosting_type': 'Plain', 'bootstrap_type': 'Bayesian', 'bagging_temperature': 9.362978965223924}. Best is trial 3065 with value: 0.8863636363636364.
[32m[I 2023-04-21 02:52:57,643][39m Trial 4109 finished with value: 0.8636363636363636 and parameters: {'objective': 'CrossEntropy', 'colsample_bylevel': 0.08137496129093641, 'depth': 2, 'boosting_type': 'Plain', 'bootstrap_type': 'Bayesian', 'bagging_temperature': 9.54758145571969}. Best is trial 3065 with value: 0.8863636363636364.
[32m[I 2023-04-21 02:52:58,757][39m Trial 4110 finished with value: 0.8275862068965518 and parameters: {'objective': 'CrossEntropy', 'colsample_bylevel': 0.08972848030739387, 'depth': 4, 'boosting_type': 'Plain', 'bootstrap_type': 'Bayesian', 'bagging_temperature': 8.1959048485589}. Best is trial 3065 with value: 0.8863636363636364.
[32m[I 2023-04-21 02:52:59,814][39m Trial 4111 finished with value: 0.8539325842696629 and parameters: {'objective': 'CrossEntropy', 'colsample_bylevel': 0.0820175037808372, 'depth': 3, 'boosting_type': 'Plain', 'bootstrap_type': 'Bayesian', 'bagging_temperature': 0.25132269028197296}. Best is trial 3065 with value: 0.8863636363636364.
[32m[I 2023-04-21 02:53:00,630][39m Trial 4112 finished with value: 0.8666666666666666 and parameters: {'objective': 'Logloss', 'colsample_bylevel': 0.09052955726755767, 'depth': 3, 'boosting_type': 'Plain', 'bootstrap_type': 'Bayesian', 'bagging_temperature': 8.340336960681684}. Best is trial 3065 with value: 0.8863636363636364.
[32m[I 2023-04-21 02:53:01,452][39m Trial 4113 finished with value: 0.8314606741573034 and parameters: {'objective': 'CrossEntropy', 'colsample_bylevel': 0.07356045684673715, 'depth': 4, 'boosting_type': 'Plain', 'bootstrap_type': 'MVS'}. Best is trial 3065 with value: 0.8863636363636364.
[32m[I 2023-04-21 02:53:02,355][39m Trial 4114 finished with value: 0.8505747126436782 and parameters: {'objective': 'CrossEntropy', 'colsample_bylevel': 0.07736883756948988, 'depth': 3, 'boosting_type': 'Plain', 'bootstrap_type': 'Bayesian', 'bagging_temperature': 9.594853725213085}. Best is trial 3065 with value: 0.8863636363636364.
[32m[I 2023-04-21 02:53:03,584][39m Trial 4115 finished with value: 0.8539325842696629 and parameters: {'objective': 'Logloss', 'colsample_bylevel': 0.06560515484732345, 'depth': 10, 'boosting_type': 'Plain', 'bootstrap_type': 'Bayesian', 'bagging_temperature': 9.215745745038644}. Best is trial 3065 with value: 0.8863636363636364.
[32m[I 2023-04-21 02:53:08,121][39m Trial 4116 finished with value: 0.8409090909090909 and parameters: {'objective': 'Logloss', 'colsample_bylevel': 0.07898418756982717, 'depth': 3, 'boosting_type': 'Ordered', 'bootstrap_type': 'Bayesian', 'bagging_temperature': 9.227237553262063}. Best is trial 3065 with value: 0.8863636363636364.
[32m[I 2023-04-21 02:53:09,191][39m Trial 4117 finished with value: 0.8666666666666666 and parameters: {'objective': 'Logloss', 'colsample_bylevel': 0.0790098387473817, 'depth': 3, 'boosting_type': 'Plain', 'bootstrap_type': 'Bayesian', 'bagging_temperature': 9.358937850156627}. Best is trial 3065 with value: 0.8863636363636364.
[32m[I 2023-04-21 02:53:10,529][39m Trial 4118 finished with value: 0.8409090909090909 and parameters: {'objective': 'CrossEntropy', 'colsample_bylevel': 0.08866873991955822, 'depth': 3, 'boosting_type': 'Plain', 'bootstrap_type': 'Bayesian', 'bagging_temperature': 8.444063592482092}. Best is trial 3065 with value: 0.8863636363636364.
[32m[I 2023-04-21 02:53:11,786][39m Trial 4119 finished with value: 0.8409090909090909 and parameters: {'objective': 'Logloss', 'colsample_bylevel': 0.07831730219783802, 'depth': 10, 'boosting_type': 'Plain', 'bootstrap_type': 'Bayesian', 'bagging_temperature': 8.616115154860097}. Best is trial 3065 with value: 0.8863636363636364.
[32m[I 2023-04-21 02:53:13,204][39m Trial 4120 finished with value: 0.8539325842696629 and parameters: {'objective': 'Logloss', 'colsample_bylevel': 0.07766214045806336, 'depth': 3, 'boosting_type': 'Plain', 'bootstrap_type': 'Bayesian', 'bagging_temperature': 9.372304289832709}. Best is trial 3065 with value: 0.8863636363636364.
[32m[I 2023-04-21 02:53:14,213][39m Trial 4121 finished with value: 0.8139534883720929 and parameters: {'objective': 'CrossEntropy', 'colsample_bylevel': 0.08444414305197008, 'depth': 3, 'boosting_type': 'Plain', 'bootstrap_type': 'Bayesian', 'bagging_temperature': 2.477523147933804}. Best is trial 3065 with value: 0.8863636363636364.
[32m[I 2023-04-21 02:53:15,056][39m Trial 4122 finished with value: 0.8505747126436782 and parameters: {'objective': 'Logloss', 'colsample_bylevel': 0.06547463090225136, 'depth': 4, 'boosting_type': 'Plain', 'bootstrap_type': 'Bayesian', 'bagging_temperature': 9.581577058880347}. Best is trial 3065 with value: 0.8863636363636364.
[32m[I 2023-04-21 02:53:15,751][39m Trial 4123 finished with value: 0.8314606741573034 and parameters: {'objective': 'CrossEntropy', 'colsample_bylevel': 0.08431760616666763, 'depth': 2, 'boosting_type': 'Plain', 'bootstrap_type': 'MVS'}. Best is trial 3065 with value: 0.8863636363636364.
[32m[I 2023-04-21 02:53:16,810][39m Trial 4124 finished with value: 0.8539325842696629 and parameters: {'objective': 'Logloss', 'colsample_bylevel': 0.0924907045036578, 'depth': 10, 'boosting_type': 'Plain', 'bootstrap_type': 'Bayesian', 'bagging_temperature': 9.639722901901767}. Best is trial 3065 with value: 0.8863636363636364.
[32m[I 2023-04-21 02:53:18,101][39m Trial 4125 finished with value: 0.8409090909090909 and parameters: {'objective': 'CrossEntropy', 'colsample_bylevel': 0.07929346681164677, 'depth': 3, 'boosting_type': 'Plain', 'bootstrap_type': 'Bayesian', 'bagging_temperature': 4.217231632743}. Best is trial 3065 with value: 0.8863636363636364.
[32m[I 2023-04-21 02:53:18,953][39m Trial 4126 finished with value: 0.8539325842696629 and parameters: {'objective': 'Logloss', 'colsample_bylevel': 0.06598942403120346, 'depth': 3, 'boosting_type': 'Plain', 'bootstrap_type': 'Bayesian', 'bagging_temperature': 8.57473996218511}. Best is trial 3065 with value: 0.8863636363636364.
[32m[I 2023-04-21 02:53:19,608][39m Trial 4127 finished with value: 0.8764044943820225 and parameters: {'objective': 'CrossEntropy', 'colsample_bylevel': 0.07097908596800433, 'depth': 7, 'boosting_type': 'Plain', 'bootstrap_type': 'Bayesian', 'bagging_temperature': 9.108543575264173}. Best is trial 3065 with value: 0.8863636363636364.
[32m[I 2023-04-21 02:53:20,262][39m Trial 4128 finished with value: 0.8539325842696629 and parameters: {'objective': 'CrossEntropy', 'colsample_bylevel': 0.08009849578154918, 'depth': 3, 'boosting_type': 'Plain', 'bootstrap_type': 'Bayesian', 'bagging_temperature': 9.587230815496218}. Best is trial 3065 with value: 0.8863636363636364.
[32m[I 2023-04-21 02:53:21,146][39m Trial 4129 finished with value: 0.8791208791208791 and parameters: {'objective': 'CrossEntropy', 'colsample_bylevel': 0.07591402119193473, 'depth': 10, 'boosting_type': 'Plain', 'bootstrap_type': 'Bayesian', 'bagging_temperature': 9.544480557516518}. Best is trial 3065 with value: 0.8863636363636364.
[32m[I 2023-04-21 02:53:22,702][39m Trial 4130 finished with value: 0.8275862068965518 and parameters: {'objective': 'CrossEntropy', 'colsample_bylevel': 0.0729187928292984, 'depth': 9, 'boosting_type': 'Plain', 'bootstrap_type': 'Bayesian', 'bagging_temperature': 9.941078197942721}. Best is trial 3065 with value: 0.8863636363636364.
[32m[I 2023-04-21 02:53:23,981][39m Trial 4131 finished with value: 0.8409090909090909 and parameters: {'objective': 'CrossEntropy', 'colsample_bylevel': 0.07270047053413435, 'depth': 8, 'boosting_type': 'Plain', 'bootstrap_type': 'Bayesian', 'bagging_temperature': 7.038962957883952}. Best is trial 3065 with value: 0.8863636363636364.
[32m[I 2023-04-21 02:53:24,933][39m Trial 4132 finished with value: 0.8275862068965518 and parameters: {'objective': 'CrossEntropy', 'colsample_bylevel': 0.06346831555093968, 'depth': 7, 'boosting_type': 'Plain', 'bootstrap_type': 'Bernoulli', 'subsample': 0.6549503568454617}. Best is trial 3065 with value: 0.8863636363636364.
[32m[I 2023-04-21 02:53:25,909][39m Trial 4133 finished with value: 0.8791208791208791 and parameters: {'objective': 'Logloss', 'colsample_bylevel': 0.09277630356234592, 'depth': 3, 'boosting_type': 'Plain', 'bootstrap_type': 'Bayesian', 'bagging_temperature': 9.019819621833303}. Best is trial 3065 with value: 0.8863636363636364.
[32m[I 2023-04-21 02:53:27,036][39m Trial 4134 finished with value: 0.8409090909090909 and parameters: {'objective': 'Logloss', 'colsample_bylevel': 0.0765388335193915, 'depth': 3, 'boosting_type': 'Plain', 'bootstrap_type': 'Bayesian', 'bagging_temperature': 9.207516133791982}. Best is trial 3065 with value: 0.8863636363636364.
[32m[I 2023-04-21 02:53:31,484][39m Trial 4135 finished with value: 0.8275862068965518 and parameters: {'objective': 'CrossEntropy', 'colsample_bylevel': 0.0916072397244409, 'depth': 3, 'boosting_type': 'Ordered', 'bootstrap_type': 'Bayesian', 'bagging_temperature': 9.996268645251254}. Best is trial 3065 with value: 0.8863636363636364.
[32m[I 2023-04-21 02:53:32,856][39m Trial 4136 finished with value: 0.8791208791208791 and parameters: {'objective': 'CrossEntropy', 'colsample_bylevel': 0.07228100176116481, 'depth': 4, 'boosting_type': 'Plain', 'bootstrap_type': 'Bayesian', 'bagging_temperature': 8.681574415261215}. Best is trial 3065 with value: 0.8863636363636364.
[32m[I 2023-04-21 02:53:33,884][39m Trial 4137 finished with value: 0.8636363636363636 and parameters: {'objective': 'Logloss', 'colsample_bylevel': 0.0816774596928188, 'depth': 6, 'boosting_type': 'Plain', 'bootstrap_type': 'Bayesian', 'bagging_temperature': 8.826678057044735}. Best is trial 3065 with value: 0.8863636363636364.
[32m[I 2023-04-21 02:53:35,224][39m Trial 4138 finished with value: 0.8666666666666666 and parameters: {'objective': 'Logloss', 'colsample_bylevel': 0.07057503008088398, 'depth': 10, 'boosting_type': 'Plain', 'bootstrap_type': 'Bayesian', 'bagging_temperature': 9.428151432491642}. Best is trial 3065 with value: 0.8863636363636364.
[32m[I 2023-04-21 02:53:36,216][39m Trial 4139 finished with value: 0.8539325842696629 and parameters: {'objective': 'Logloss', 'colsample_bylevel': 0.0724814508573879, 'depth': 10, 'boosting_type': 'Plain', 'bootstrap_type': 'Bayesian', 'bagging_temperature': 8.62539775769102}. Best is trial 3065 with value: 0.8863636363636364.
[32m[I 2023-04-21 02:53:37,256][39m Trial 4140 finished with value: 0.8539325842696629 and parameters: {'objective': 'CrossEntropy', 'colsample_bylevel': 0.0761071000059195, 'depth': 3, 'boosting_type': 'Plain', 'bootstrap_type': 'Bayesian', 'bagging_temperature': 9.81843381541202}. Best is trial 3065 with value: 0.8863636363636364.
[32m[I 2023-04-21 02:53:38,047][39m Trial 4141 finished with value: 0.8409090909090909 and parameters: {'objective': 'CrossEntropy', 'colsample_bylevel': 0.08517397474323136, 'depth': 2, 'boosting_type': 'Plain', 'bootstrap_type': 'Bayesian', 'bagging_temperature': 6.704457000135893}. Best is trial 3065 with value: 0.8863636363636364.
[32m[I 2023-04-21 02:53:38,926][39m Trial 4142 finished with value: 0.8539325842696629 and parameters: {'objective': 'CrossEntropy', 'colsample_bylevel': 0.07439028386916316, 'depth': 10, 'boosting_type': 'Plain', 'bootstrap_type': 'Bayesian', 'bagging_temperature': 9.385979242920236}. Best is trial 3065 with value: 0.8863636363636364.
[32m[I 2023-04-21 02:53:40,188][39m Trial 4143 finished with value: 0.8539325842696629 and parameters: {'objective': 'CrossEntropy', 'colsample_bylevel': 0.08302538770147366, 'depth': 3, 'boosting_type': 'Plain', 'bootstrap_type': 'Bayesian', 'bagging_temperature': 9.069720802659864}. Best is trial 3065 with value: 0.8863636363636364.
[32m[I 2023-04-21 02:53:41,172][39m Trial 4144 finished with value: 0.7999999999999999 and parameters: {'objective': 'CrossEntropy', 'colsample_bylevel': 0.07394004370726567, 'depth': 10, 'boosting_type': 'Plain', 'bootstrap_type': 'MVS'}. Best is trial 3065 with value: 0.8863636363636364.
[32m[I 2023-04-21 02:53:42,217][39m Trial 4145 finished with value: 0.8539325842696629 and parameters: {'objective': 'CrossEntropy', 'colsample_bylevel': 0.060361268267561774, 'depth': 3, 'boosting_type': 'Plain', 'bootstrap_type': 'Bayesian', 'bagging_temperature': 9.780978394729765}. Best is trial 3065 with value: 0.8863636363636364.
[32m[I 2023-04-21 02:53:43,322][39m Trial 4146 finished with value: 0.8666666666666666 and parameters: {'objective': 'Logloss', 'colsample_bylevel': 0.07514051074850932, 'depth': 4, 'boosting_type': 'Plain', 'bootstrap_type': 'Bayesian', 'bagging_temperature': 9.170749249888821}. Best is trial 3065 with value: 0.8863636363636364.
[32m[I 2023-04-21 02:53:44,296][39m Trial 4147 finished with value: 0.8409090909090909 and parameters: {'objective': 'Logloss', 'colsample_bylevel': 0.07573050851255117, 'depth': 5, 'boosting_type': 'Plain', 'bootstrap_type': 'Bayesian', 'bagging_temperature': 9.168359377188594}. Best is trial 3065 with value: 0.8863636363636364.
[32m[I 2023-04-21 02:53:44,923][39m Trial 4148 finished with value: 0.8 and parameters: {'objective': 'CrossEntropy', 'colsample_bylevel': 0.055205022779743894, 'depth': 2, 'boosting_type': 'Plain', 'bootstrap_type': 'MVS'}. Best is trial 3065 with value: 0.8863636363636364.
[32m[I 2023-04-21 02:53:45,574][39m Trial 4149 finished with value: 0.8539325842696629 and parameters: {'objective': 'CrossEntropy', 'colsample_bylevel': 0.07462103047734923, 'depth': 4, 'boosting_type': 'Plain', 'bootstrap_type': 'Bayesian', 'bagging_temperature': 9.797716419636185}. Best is trial 3065 with value: 0.8863636363636364.
[32m[I 2023-04-21 02:53:46,453][39m Trial 4150 finished with value: 0.8539325842696629 and parameters: {'objective': 'CrossEntropy', 'colsample_bylevel': 0.0727369456394493, 'depth': 7, 'boosting_type': 'Plain', 'bootstrap_type': 'Bayesian', 'bagging_temperature': 8.897547064839259}. Best is trial 3065 with value: 0.8863636363636364.
[32m[I 2023-04-21 02:53:47,688][39m Trial 4151 finished with value: 0.8666666666666666 and parameters: {'objective': 'Logloss', 'colsample_bylevel': 0.07751293439634341, 'depth': 10, 'boosting_type': 'Plain', 'bootstrap_type': 'Bayesian', 'bagging_temperature': 9.71684409070142}. Best is trial 3065 with value: 0.8863636363636364.
