[32m[I 2023-04-21 02:45:52,509][39m Trial 3758 finished with value: 0.8409090909090909 and parameters: {'objective': 'CrossEntropy', 'colsample_bylevel': 0.06524790311211465, 'depth': 2, 'boosting_type': 'Plain', 'bootstrap_type': 'Bayesian', 'bagging_temperature': 9.788895058613916}. Best is trial 3065 with value: 0.8863636363636364.
[32m[I 2023-04-21 02:45:53,339][39m Trial 3759 finished with value: 0.8409090909090909 and parameters: {'objective': 'CrossEntropy', 'colsample_bylevel': 0.08299146214674083, 'depth': 3, 'boosting_type': 'Plain', 'bootstrap_type': 'Bayesian', 'bagging_temperature': 7.177966982385389}. Best is trial 3065 with value: 0.8863636363636364.
[32m[I 2023-04-21 02:45:53,984][39m Trial 3760 finished with value: 0.8275862068965518 and parameters: {'objective': 'Logloss', 'colsample_bylevel': 0.07032916434302298, 'depth': 8, 'boosting_type': 'Plain', 'bootstrap_type': 'Bernoulli', 'subsample': 0.27073192096826054}. Best is trial 3065 with value: 0.8863636363636364.
[32m[I 2023-04-21 02:45:54,988][39m Trial 3761 finished with value: 0.8791208791208791 and parameters: {'objective': 'Logloss', 'colsample_bylevel': 0.0930806321969279, 'depth': 3, 'boosting_type': 'Plain', 'bootstrap_type': 'Bayesian', 'bagging_temperature': 9.979998501280598}. Best is trial 3065 with value: 0.8863636363636364.
[32m[I 2023-04-21 02:45:59,811][39m Trial 3762 finished with value: 0.8444444444444446 and parameters: {'objective': 'CrossEntropy', 'colsample_bylevel': 0.07988080833303024, 'depth': 3, 'boosting_type': 'Ordered', 'bootstrap_type': 'Bayesian', 'bagging_temperature': 9.97949484532992}. Best is trial 3065 with value: 0.8863636363636364.
[32m[I 2023-04-21 02:46:00,763][39m Trial 3763 finished with value: 0.8539325842696629 and parameters: {'objective': 'CrossEntropy', 'colsample_bylevel': 0.07497855655952092, 'depth': 3, 'boosting_type': 'Plain', 'bootstrap_type': 'Bayesian', 'bagging_temperature': 9.667642187867735}. Best is trial 3065 with value: 0.8863636363636364.
[32m[I 2023-04-21 02:46:02,096][39m Trial 3764 finished with value: 0.8666666666666666 and parameters: {'objective': 'CrossEntropy', 'colsample_bylevel': 0.0801661572641849, 'depth': 3, 'boosting_type': 'Plain', 'bootstrap_type': 'Bayesian', 'bagging_temperature': 9.554818360738295}. Best is trial 3065 with value: 0.8863636363636364.
[32m[I 2023-04-21 02:46:03,025][39m Trial 3765 finished with value: 0.8666666666666666 and parameters: {'objective': 'Logloss', 'colsample_bylevel': 0.07214664809165987, 'depth': 5, 'boosting_type': 'Plain', 'bootstrap_type': 'Bayesian', 'bagging_temperature': 9.374468351436255}. Best is trial 3065 with value: 0.8863636363636364.
[32m[I 2023-04-21 02:46:03,704][39m Trial 3766 finished with value: 0.8275862068965518 and parameters: {'objective': 'CrossEntropy', 'colsample_bylevel': 0.08346321025953304, 'depth': 3, 'boosting_type': 'Plain', 'bootstrap_type': 'Bayesian', 'bagging_temperature': 9.382953041705541}. Best is trial 3065 with value: 0.8863636363636364.
[32m[I 2023-04-21 02:46:04,796][39m Trial 3767 finished with value: 0.8505747126436782 and parameters: {'objective': 'Logloss', 'colsample_bylevel': 0.0714567825996861, 'depth': 10, 'boosting_type': 'Plain', 'bootstrap_type': 'Bayesian', 'bagging_temperature': 6.803850697857026}. Best is trial 3065 with value: 0.8863636363636364.
[32m[I 2023-04-21 02:46:06,414][39m Trial 3768 finished with value: 0.8539325842696629 and parameters: {'objective': 'CrossEntropy', 'colsample_bylevel': 0.08307740005321466, 'depth': 3, 'boosting_type': 'Plain', 'bootstrap_type': 'Bayesian', 'bagging_temperature': 9.761114593156861}. Best is trial 3065 with value: 0.8863636363636364.
[32m[I 2023-04-21 02:46:07,173][39m Trial 3769 finished with value: 0.8666666666666666 and parameters: {'objective': 'Logloss', 'colsample_bylevel': 0.06954104445561975, 'depth': 4, 'boosting_type': 'Plain', 'bootstrap_type': 'Bayesian', 'bagging_temperature': 8.205957349177524}. Best is trial 3065 with value: 0.8863636363636364.
[32m[I 2023-04-21 02:46:07,877][39m Trial 3770 finished with value: 0.8539325842696629 and parameters: {'objective': 'Logloss', 'colsample_bylevel': 0.06921139651522086, 'depth': 12, 'boosting_type': 'Plain', 'bootstrap_type': 'MVS'}. Best is trial 3065 with value: 0.8863636363636364.
[32m[I 2023-04-21 02:46:08,510][39m Trial 3771 finished with value: 0.8666666666666666 and parameters: {'objective': 'CrossEntropy', 'colsample_bylevel': 0.0741569169168545, 'depth': 10, 'boosting_type': 'Plain', 'bootstrap_type': 'Bayesian', 'bagging_temperature': 9.644709757787654}. Best is trial 3065 with value: 0.8863636363636364.
[32m[I 2023-04-21 02:46:09,789][39m Trial 3772 finished with value: 0.8275862068965518 and parameters: {'objective': 'CrossEntropy', 'colsample_bylevel': 0.07061280284426413, 'depth': 8, 'boosting_type': 'Plain', 'bootstrap_type': 'Bayesian', 'bagging_temperature': 9.083689274114981}. Best is trial 3065 with value: 0.8863636363636364.
[32m[I 2023-04-21 02:46:10,685][39m Trial 3773 finished with value: 0.8409090909090909 and parameters: {'objective': 'CrossEntropy', 'colsample_bylevel': 0.07219551021150503, 'depth': 9, 'boosting_type': 'Plain', 'bootstrap_type': 'MVS'}. Best is trial 3065 with value: 0.8863636363636364.
[32m[I 2023-04-21 02:46:11,701][39m Trial 3774 finished with value: 0.8409090909090909 and parameters: {'objective': 'CrossEntropy', 'colsample_bylevel': 0.06724730210436551, 'depth': 8, 'boosting_type': 'Plain', 'bootstrap_type': 'Bayesian', 'bagging_temperature': 8.74466328650447}. Best is trial 3065 with value: 0.8863636363636364.
[32m[I 2023-04-21 02:46:12,973][39m Trial 3775 finished with value: 0.8791208791208791 and parameters: {'objective': 'CrossEntropy', 'colsample_bylevel': 0.06987581011021955, 'depth': 7, 'boosting_type': 'Plain', 'bootstrap_type': 'Bayesian', 'bagging_temperature': 8.763250931504174}. Best is trial 3065 with value: 0.8863636363636364.
[32m[I 2023-04-21 02:46:13,936][39m Trial 3776 finished with value: 0.8409090909090909 and parameters: {'objective': 'CrossEntropy', 'colsample_bylevel': 0.08442205847880711, 'depth': 3, 'boosting_type': 'Plain', 'bootstrap_type': 'Bayesian', 'bagging_temperature': 9.64580660926828}. Best is trial 3065 with value: 0.8863636363636364.
[32m[I 2023-04-21 02:46:14,577][39m Trial 3777 finished with value: 0.8666666666666666 and parameters: {'objective': 'Logloss', 'colsample_bylevel': 0.07355358810336579, 'depth': 10, 'boosting_type': 'Plain', 'bootstrap_type': 'Bayesian', 'bagging_temperature': 9.31322619048777}. Best is trial 3065 with value: 0.8863636363636364.
[32m[I 2023-04-21 02:46:15,693][39m Trial 3778 finished with value: 0.8666666666666666 and parameters: {'objective': 'CrossEntropy', 'colsample_bylevel': 0.08019255505158251, 'depth': 3, 'boosting_type': 'Plain', 'bootstrap_type': 'Bayesian', 'bagging_temperature': 9.710996007177332}. Best is trial 3065 with value: 0.8863636363636364.
[32m[I 2023-04-21 02:46:16,716][39m Trial 3779 finished with value: 0.8666666666666666 and parameters: {'objective': 'Logloss', 'colsample_bylevel': 0.07431632708064817, 'depth': 6, 'boosting_type': 'Plain', 'bootstrap_type': 'Bayesian', 'bagging_temperature': 8.906961575368735}. Best is trial 3065 with value: 0.8863636363636364.
[32m[I 2023-04-21 02:46:21,454][39m Trial 3780 finished with value: 0.8139534883720929 and parameters: {'objective': 'Logloss', 'colsample_bylevel': 0.07799988213681497, 'depth': 5, 'boosting_type': 'Ordered', 'bootstrap_type': 'Bayesian', 'bagging_temperature': 7.693776127252989}. Best is trial 3065 with value: 0.8863636363636364.
[32m[I 2023-04-21 02:46:22,499][39m Trial 3781 finished with value: 0.8275862068965518 and parameters: {'objective': 'CrossEntropy', 'colsample_bylevel': 0.08056623915108516, 'depth': 3, 'boosting_type': 'Plain', 'bootstrap_type': 'Bayesian', 'bagging_temperature': 9.979400647368221}. Best is trial 3065 with value: 0.8863636363636364.
[32m[I 2023-04-21 02:46:23,502][39m Trial 3782 finished with value: 0.8539325842696629 and parameters: {'objective': 'CrossEntropy', 'colsample_bylevel': 0.0887333248135896, 'depth': 3, 'boosting_type': 'Plain', 'bootstrap_type': 'Bayesian', 'bagging_temperature': 9.211219853337806}. Best is trial 3065 with value: 0.8863636363636364.
[32m[I 2023-04-21 02:46:24,268][39m Trial 3783 finished with value: 0.8764044943820225 and parameters: {'objective': 'CrossEntropy', 'colsample_bylevel': 0.0816651202094862, 'depth': 2, 'boosting_type': 'Plain', 'bootstrap_type': 'Bayesian', 'bagging_temperature': 9.18163295036398}. Best is trial 3065 with value: 0.8863636363636364.
[32m[I 2023-04-21 02:46:25,527][39m Trial 3784 finished with value: 0.8275862068965518 and parameters: {'objective': 'CrossEntropy', 'colsample_bylevel': 0.07723210951775553, 'depth': 11, 'boosting_type': 'Plain', 'bootstrap_type': 'Bayesian', 'bagging_temperature': 9.23768206997969}. Best is trial 3065 with value: 0.8863636363636364.
[32m[I 2023-04-21 02:46:26,834][39m Trial 3785 finished with value: 0.8043478260869564 and parameters: {'objective': 'CrossEntropy', 'colsample_bylevel': 0.04585154765258666, 'depth': 8, 'boosting_type': 'Plain', 'bootstrap_type': 'Bernoulli', 'subsample': 0.5592882573974143}. Best is trial 3065 with value: 0.8863636363636364.
[32m[I 2023-04-21 02:46:27,547][39m Trial 3786 finished with value: 0.8539325842696629 and parameters: {'objective': 'Logloss', 'colsample_bylevel': 0.08810520496228569, 'depth': 3, 'boosting_type': 'Plain', 'bootstrap_type': 'Bayesian', 'bagging_temperature': 9.777531978677214}. Best is trial 3065 with value: 0.8863636363636364.
[32m[I 2023-04-21 02:46:28,508][39m Trial 3787 finished with value: 0.8539325842696629 and parameters: {'objective': 'CrossEntropy', 'colsample_bylevel': 0.09150518011014928, 'depth': 3, 'boosting_type': 'Plain', 'bootstrap_type': 'Bayesian', 'bagging_temperature': 9.786924758146025}. Best is trial 3065 with value: 0.8863636363636364.
[32m[I 2023-04-21 02:46:29,552][39m Trial 3788 finished with value: 0.8409090909090909 and parameters: {'objective': 'CrossEntropy', 'colsample_bylevel': 0.08907567547523058, 'depth': 3, 'boosting_type': 'Plain', 'bootstrap_type': 'Bayesian', 'bagging_temperature': 9.738930971959286}. Best is trial 3065 with value: 0.8863636363636364.
[32m[I 2023-04-21 02:46:30,585][39m Trial 3789 finished with value: 0.8505747126436782 and parameters: {'objective': 'Logloss', 'colsample_bylevel': 0.06534987642593779, 'depth': 6, 'boosting_type': 'Plain', 'bootstrap_type': 'Bayesian', 'bagging_temperature': 8.896299606478225}. Best is trial 3065 with value: 0.8863636363636364.
[32m[I 2023-04-21 02:46:31,385][39m Trial 3790 finished with value: 0.8089887640449439 and parameters: {'objective': 'Logloss', 'colsample_bylevel': 0.053798334560501836, 'depth': 6, 'boosting_type': 'Plain', 'bootstrap_type': 'MVS'}. Best is trial 3065 with value: 0.8863636363636364.
[32m[I 2023-04-21 02:46:32,030][39m Trial 3791 finished with value: 0.8666666666666666 and parameters: {'objective': 'Logloss', 'colsample_bylevel': 0.07643523797187007, 'depth': 11, 'boosting_type': 'Plain', 'bootstrap_type': 'Bayesian', 'bagging_temperature': 9.837017935410085}. Best is trial 3065 with value: 0.8863636363636364.
[32m[I 2023-04-21 02:46:32,833][39m Trial 3792 finished with value: 0.8505747126436782 and parameters: {'objective': 'CrossEntropy', 'colsample_bylevel': 0.07690126035604379, 'depth': 10, 'boosting_type': 'Plain', 'bootstrap_type': 'Bayesian', 'bagging_temperature': 8.080219524374918}. Best is trial 3065 with value: 0.8863636363636364.
[32m[I 2023-04-21 02:46:34,070][39m Trial 3793 finished with value: 0.8539325842696629 and parameters: {'objective': 'CrossEntropy', 'colsample_bylevel': 0.07463714606409488, 'depth': 9, 'boosting_type': 'Plain', 'bootstrap_type': 'Bayesian', 'bagging_temperature': 9.442437227724666}. Best is trial 3065 with value: 0.8863636363636364.
[32m[I 2023-04-21 02:46:35,463][39m Trial 3794 finished with value: 0.8409090909090909 and parameters: {'objective': 'Logloss', 'colsample_bylevel': 0.07891533745199465, 'depth': 9, 'boosting_type': 'Plain', 'bootstrap_type': 'Bayesian', 'bagging_temperature': 9.547547792221476}. Best is trial 3065 with value: 0.8863636363636364.
[32m[I 2023-04-21 02:46:36,095][39m Trial 3795 finished with value: 0.8666666666666666 and parameters: {'objective': 'Logloss', 'colsample_bylevel': 0.0710311474133987, 'depth': 10, 'boosting_type': 'Plain', 'bootstrap_type': 'Bayesian', 'bagging_temperature': 9.293556644434549}. Best is trial 3065 with value: 0.8863636363636364.
[32m[I 2023-04-21 02:46:37,431][39m Trial 3796 finished with value: 0.8666666666666666 and parameters: {'objective': 'CrossEntropy', 'colsample_bylevel': 0.07514250989687983, 'depth': 4, 'boosting_type': 'Plain', 'bootstrap_type': 'Bayesian', 'bagging_temperature': 8.408939145416367}. Best is trial 3065 with value: 0.8863636363636364.
[32m[I 2023-04-21 02:46:38,390][39m Trial 3797 finished with value: 0.8791208791208791 and parameters: {'objective': 'CrossEntropy', 'colsample_bylevel': 0.07670394853201627, 'depth': 3, 'boosting_type': 'Plain', 'bootstrap_type': 'Bayesian', 'bagging_temperature': 9.99651252364438}. Best is trial 3065 with value: 0.8863636363636364.
[32m[I 2023-04-21 02:46:39,459][39m Trial 3798 finished with value: 0.8275862068965518 and parameters: {'objective': 'Logloss', 'colsample_bylevel': 0.07346917631969511, 'depth': 5, 'boosting_type': 'Plain', 'bootstrap_type': 'Bayesian', 'bagging_temperature': 3.071040168752929}. Best is trial 3065 with value: 0.8863636363636364.
[32m[I 2023-04-21 02:46:44,052][39m Trial 3799 finished with value: 0.8089887640449439 and parameters: {'objective': 'CrossEntropy', 'colsample_bylevel': 0.04248178622757731, 'depth': 3, 'boosting_type': 'Ordered', 'bootstrap_type': 'Bayesian', 'bagging_temperature': 8.457370260303772}. Best is trial 3065 with value: 0.8863636363636364.
[32m[I 2023-04-21 02:46:45,194][39m Trial 3800 finished with value: 0.8409090909090909 and parameters: {'objective': 'Logloss', 'colsample_bylevel': 0.0730866550897282, 'depth': 10, 'boosting_type': 'Plain', 'bootstrap_type': 'MVS'}. Best is trial 3065 with value: 0.8863636363636364.
[32m[I 2023-04-21 02:46:46,536][39m Trial 3801 finished with value: 0.8539325842696629 and parameters: {'objective': 'CrossEntropy', 'colsample_bylevel': 0.06749931908497568, 'depth': 8, 'boosting_type': 'Plain', 'bootstrap_type': 'Bayesian', 'bagging_temperature': 8.436203253115034}. Best is trial 3065 with value: 0.8863636363636364.
[32m[I 2023-04-21 02:46:47,194][39m Trial 3802 finished with value: 0.8539325842696629 and parameters: {'objective': 'CrossEntropy', 'colsample_bylevel': 0.06703134714149177, 'depth': 10, 'boosting_type': 'Plain', 'bootstrap_type': 'Bayesian', 'bagging_temperature': 9.846345229378853}. Best is trial 3065 with value: 0.8863636363636364.
[32m[I 2023-04-21 02:46:48,171][39m Trial 3803 finished with value: 0.8764044943820225 and parameters: {'objective': 'CrossEntropy', 'colsample_bylevel': 0.07160208733519215, 'depth': 9, 'boosting_type': 'Plain', 'bootstrap_type': 'Bayesian', 'bagging_temperature': 8.174682823754043}. Best is trial 3065 with value: 0.8863636363636364.
[32m[I 2023-04-21 02:46:49,289][39m Trial 3804 finished with value: 0.8539325842696629 and parameters: {'objective': 'CrossEntropy', 'colsample_bylevel': 0.06791895021456307, 'depth': 9, 'boosting_type': 'Plain', 'bootstrap_type': 'Bernoulli', 'subsample': 0.7162766221915291}. Best is trial 3065 with value: 0.8863636363636364.
[32m[I 2023-04-21 02:46:50,145][39m Trial 3805 finished with value: 0.8139534883720929 and parameters: {'objective': 'CrossEntropy', 'colsample_bylevel': 0.06308362114285798, 'depth': 11, 'boosting_type': 'Plain', 'bootstrap_type': 'MVS'}. Best is trial 3065 with value: 0.8863636363636364.
[32m[I 2023-04-21 02:46:51,078][39m Trial 3806 finished with value: 0.8666666666666666 and parameters: {'objective': 'Logloss', 'colsample_bylevel': 0.07221581952139304, 'depth': 7, 'boosting_type': 'Plain', 'bootstrap_type': 'Bayesian', 'bagging_temperature': 9.758033794371757}. Best is trial 3065 with value: 0.8863636363636364.
[32m[I 2023-04-21 02:46:51,785][39m Trial 3807 finished with value: 0.8539325842696629 and parameters: {'objective': 'CrossEntropy', 'colsample_bylevel': 0.08428014588125107, 'depth': 12, 'boosting_type': 'Plain', 'bootstrap_type': 'Bayesian', 'bagging_temperature': 8.793302249789566}. Best is trial 3065 with value: 0.8863636363636364.
[32m[I 2023-04-21 02:46:52,849][39m Trial 3808 finished with value: 0.8275862068965518 and parameters: {'objective': 'CrossEntropy', 'colsample_bylevel': 0.08257159257296902, 'depth': 11, 'boosting_type': 'Plain', 'bootstrap_type': 'MVS'}. Best is trial 3065 with value: 0.8863636363636364.
[32m[I 2023-04-21 02:46:53,990][39m Trial 3809 finished with value: 0.8539325842696629 and parameters: {'objective': 'CrossEntropy', 'colsample_bylevel': 0.07526229799585904, 'depth': 4, 'boosting_type': 'Plain', 'bootstrap_type': 'Bayesian', 'bagging_temperature': 9.68485932146447}. Best is trial 3065 with value: 0.8863636363636364.
[32m[I 2023-04-21 02:46:55,039][39m Trial 3810 finished with value: 0.8275862068965518 and parameters: {'objective': 'CrossEntropy', 'colsample_bylevel': 0.0907716340340204, 'depth': 3, 'boosting_type': 'Plain', 'bootstrap_type': 'MVS'}. Best is trial 3065 with value: 0.8863636363636364.
[32m[I 2023-04-21 02:46:56,283][39m Trial 3811 finished with value: 0.8275862068965518 and parameters: {'objective': 'CrossEntropy', 'colsample_bylevel': 0.07668338417611983, 'depth': 12, 'boosting_type': 'Plain', 'bootstrap_type': 'Bayesian', 'bagging_temperature': 9.510246553717609}. Best is trial 3065 with value: 0.8863636363636364.
[32m[I 2023-04-21 02:46:56,892][39m Trial 3812 finished with value: 0.8372093023255814 and parameters: {'objective': 'CrossEntropy', 'colsample_bylevel': 0.035958569043633766, 'depth': 2, 'boosting_type': 'Plain', 'bootstrap_type': 'Bayesian', 'bagging_temperature': 4.8739858239580585}. Best is trial 3065 with value: 0.8863636363636364.
[32m[I 2023-04-21 02:46:57,850][39m Trial 3813 finished with value: 0.8539325842696629 and parameters: {'objective': 'CrossEntropy', 'colsample_bylevel': 0.07741258880971254, 'depth': 11, 'boosting_type': 'Plain', 'bootstrap_type': 'Bayesian', 'bagging_temperature': 9.971807167333122}. Best is trial 3065 with value: 0.8863636363636364.
[32m[I 2023-04-21 02:46:58,809][39m Trial 3814 finished with value: 0.8409090909090909 and parameters: {'objective': 'CrossEntropy', 'colsample_bylevel': 0.08947077151219894, 'depth': 2, 'boosting_type': 'Plain', 'bootstrap_type': 'Bayesian', 'bagging_temperature': 9.993940649515398}. Best is trial 3065 with value: 0.8863636363636364.
[32m[I 2023-04-21 02:46:59,886][39m Trial 3815 finished with value: 0.8409090909090909 and parameters: {'objective': 'CrossEntropy', 'colsample_bylevel': 0.08789849258962734, 'depth': 12, 'boosting_type': 'Plain', 'bootstrap_type': 'Bayesian', 'bagging_temperature': 9.99003440716846}. Best is trial 3065 with value: 0.8863636363636364.
[32m[I 2023-04-21 02:47:04,415][39m Trial 3816 finished with value: 0.8409090909090909 and parameters: {'objective': 'CrossEntropy', 'colsample_bylevel': 0.07749317739566565, 'depth': 3, 'boosting_type': 'Ordered', 'bootstrap_type': 'Bayesian', 'bagging_temperature': 6.526784384326105}. Best is trial 3065 with value: 0.8863636363636364.
[32m[I 2023-04-21 02:47:05,677][39m Trial 3817 finished with value: 0.8372093023255814 and parameters: {'objective': 'CrossEntropy', 'colsample_bylevel': 0.07674715975981974, 'depth': 9, 'boosting_type': 'Plain', 'bootstrap_type': 'Bayesian', 'bagging_temperature': 4.407092116630949}. Best is trial 3065 with value: 0.8863636363636364.
[32m[I 2023-04-21 02:47:07,567][39m Trial 3819 finished with value: 0.8372093023255814 and parameters: {'objective': 'CrossEntropy', 'colsample_bylevel': 0.08299336237494205, 'depth': 10, 'boosting_type': 'Plain', 'bootstrap_type': 'Bayesian', 'bagging_temperature': 9.253267512203497}. Best is trial 3065 with value: 0.8863636363636364.
[32m[I 2023-04-21 02:47:08,517][39m Trial 3820 finished with value: 0.8409090909090909 and parameters: {'objective': 'CrossEntropy', 'colsample_bylevel': 0.07531278416887575, 'depth': 10, 'boosting_type': 'Plain', 'bootstrap_type': 'Bayesian', 'bagging_temperature': 8.699770817923152}. Best is trial 3065 with value: 0.8863636363636364.
[32m[I 2023-04-21 02:47:09,286][39m Trial 3821 finished with value: 0.8139534883720929 and parameters: {'objective': 'CrossEntropy', 'colsample_bylevel': 0.09609023493899051, 'depth': 3, 'boosting_type': 'Plain', 'bootstrap_type': 'Bayesian', 'bagging_temperature': 9.98260326817299}. Best is trial 3065 with value: 0.8863636363636364.
[32m[I 2023-04-21 02:47:10,532][39m Trial 3822 finished with value: 0.8409090909090909 and parameters: {'objective': 'CrossEntropy', 'colsample_bylevel': 0.07846555937620911, 'depth': 4, 'boosting_type': 'Plain', 'bootstrap_type': 'Bayesian', 'bagging_temperature': 3.580298286275168}. Best is trial 3065 with value: 0.8863636363636364.
[32m[I 2023-04-21 02:47:11,915][39m Trial 3823 finished with value: 0.8275862068965518 and parameters: {'objective': 'CrossEntropy', 'colsample_bylevel': 0.058368260633714315, 'depth': 9, 'boosting_type': 'Plain', 'bootstrap_type': 'Bayesian', 'bagging_temperature': 9.594317447810875}. Best is trial 3065 with value: 0.8863636363636364.
[32m[I 2023-04-21 02:47:12,637][39m Trial 3824 finished with value: 0.8539325842696629 and parameters: {'objective': 'CrossEntropy', 'colsample_bylevel': 0.07485782424981052, 'depth': 11, 'boosting_type': 'Plain', 'bootstrap_type': 'Bayesian', 'bagging_temperature': 9.998354519625853}. Best is trial 3065 with value: 0.8863636363636364.
