[32m[I 2023-04-21 01:41:31,974][39m Trial 331 finished with value: 0.8181818181818182 and parameters: {'objective': 'CrossEntropy', 'colsample_bylevel': 0.07930658553021372, 'depth': 1, 'boosting_type': 'Plain', 'bootstrap_type': 'Bayesian', 'bagging_temperature': 9.991444579672423}. Best is trial 98 with value: 0.8791208791208791.
[32m[I 2023-04-21 01:41:32,539][39m Trial 332 finished with value: 0.8539325842696629 and parameters: {'objective': 'Logloss', 'colsample_bylevel': 0.08508591537060076, 'depth': 3, 'boosting_type': 'Plain', 'bootstrap_type': 'Bayesian', 'bagging_temperature': 9.665574686298951}. Best is trial 98 with value: 0.8791208791208791.
[32m[I 2023-04-21 01:41:33,106][39m Trial 333 finished with value: 0.8539325842696629 and parameters: {'objective': 'CrossEntropy', 'colsample_bylevel': 0.08731912151577036, 'depth': 3, 'boosting_type': 'Plain', 'bootstrap_type': 'Bayesian', 'bagging_temperature': 8.038962459826791}. Best is trial 98 with value: 0.8791208791208791.
[32m[I 2023-04-21 01:41:33,741][39m Trial 334 finished with value: 0.8539325842696629 and parameters: {'objective': 'CrossEntropy', 'colsample_bylevel': 0.07779768867956201, 'depth': 4, 'boosting_type': 'Plain', 'bootstrap_type': 'Bayesian', 'bagging_temperature': 9.83027437088965}. Best is trial 98 with value: 0.8791208791208791.
[32m[I 2023-04-21 01:41:35,018][39m Trial 335 finished with value: 0.8636363636363636 and parameters: {'objective': 'CrossEntropy', 'colsample_bylevel': 0.08733117808966019, 'depth': 2, 'boosting_type': 'Plain', 'bootstrap_type': 'Bayesian', 'bagging_temperature': 8.517523601232304}. Best is trial 98 with value: 0.8791208791208791.
[32m[I 2023-04-21 01:41:35,945][39m Trial 336 finished with value: 0.8131868131868132 and parameters: {'objective': 'CrossEntropy', 'colsample_bylevel': 0.07598287892665435, 'depth': 2, 'boosting_type': 'Plain', 'bootstrap_type': 'Bernoulli', 'subsample': 0.6987455559172806}. Best is trial 98 with value: 0.8791208791208791.
[32m[I 2023-04-21 01:41:36,502][39m Trial 337 finished with value: 0.8275862068965518 and parameters: {'objective': 'CrossEntropy', 'colsample_bylevel': 0.08932000221311268, 'depth': 2, 'boosting_type': 'Plain', 'bootstrap_type': 'Bayesian', 'bagging_temperature': 9.204960315548243}. Best is trial 98 with value: 0.8791208791208791.
[32m[I 2023-04-21 01:41:37,605][39m Trial 338 finished with value: 0.8539325842696629 and parameters: {'objective': 'CrossEntropy', 'colsample_bylevel': 0.07392808074655437, 'depth': 9, 'boosting_type': 'Plain', 'bootstrap_type': 'Bayesian', 'bagging_temperature': 9.505017871354841}. Best is trial 98 with value: 0.8791208791208791.
[32m[I 2023-04-21 01:41:38,639][39m Trial 339 finished with value: 0.7857142857142858 and parameters: {'objective': 'CrossEntropy', 'colsample_bylevel': 0.08162425961747752, 'depth': 8, 'boosting_type': 'Plain', 'bootstrap_type': 'MVS'}. Best is trial 98 with value: 0.8791208791208791.
[32m[I 2023-04-21 01:41:39,194][39m Trial 340 finished with value: 0.8235294117647058 and parameters: {'objective': 'CrossEntropy', 'colsample_bylevel': 0.09077291250043323, 'depth': 1, 'boosting_type': 'Plain', 'bootstrap_type': 'Bayesian', 'bagging_temperature': 9.398187908088453}. Best is trial 98 with value: 0.8791208791208791.
[32m[I 2023-04-21 01:41:40,062][39m Trial 341 finished with value: 0.8539325842696629 and parameters: {'objective': 'CrossEntropy', 'colsample_bylevel': 0.0842637908366795, 'depth': 3, 'boosting_type': 'Plain', 'bootstrap_type': 'Bayesian', 'bagging_temperature': 9.59534001338517}. Best is trial 98 with value: 0.8791208791208791.
[32m[I 2023-04-21 01:41:40,878][39m Trial 342 finished with value: 0.8409090909090909 and parameters: {'objective': 'CrossEntropy', 'colsample_bylevel': 0.08068946383604113, 'depth': 7, 'boosting_type': 'Plain', 'bootstrap_type': 'Bayesian', 'bagging_temperature': 9.280327725714564}. Best is trial 98 with value: 0.8791208791208791.
[32m[I 2023-04-21 01:41:41,731][39m Trial 343 finished with value: 0.8636363636363636 and parameters: {'objective': 'Logloss', 'colsample_bylevel': 0.08605006899413875, 'depth': 5, 'boosting_type': 'Plain', 'bootstrap_type': 'Bayesian', 'bagging_temperature': 8.917314985996486}. Best is trial 98 with value: 0.8791208791208791.
[32m[I 2023-04-21 01:41:42,729][39m Trial 344 finished with value: 0.8539325842696629 and parameters: {'objective': 'CrossEntropy', 'colsample_bylevel': 0.08092016769509455, 'depth': 2, 'boosting_type': 'Plain', 'bootstrap_type': 'Bayesian', 'bagging_temperature': 9.775405882744039}. Best is trial 98 with value: 0.8791208791208791.
[32m[I 2023-04-21 01:41:43,703][39m Trial 345 finished with value: 0.8409090909090909 and parameters: {'objective': 'CrossEntropy', 'colsample_bylevel': 0.07547981411607346, 'depth': 2, 'boosting_type': 'Plain', 'bootstrap_type': 'Bayesian', 'bagging_temperature': 9.843171293284618}. Best is trial 98 with value: 0.8791208791208791.
[32m[I 2023-04-21 01:41:44,697][39m Trial 346 finished with value: 0.8539325842696629 and parameters: {'objective': 'CrossEntropy', 'colsample_bylevel': 0.09224404968823656, 'depth': 2, 'boosting_type': 'Plain', 'bootstrap_type': 'Bayesian', 'bagging_temperature': 9.144351204355738}. Best is trial 98 with value: 0.8791208791208791.
[32m[I 2023-04-21 01:41:45,632][39m Trial 347 finished with value: 0.8409090909090909 and parameters: {'objective': 'CrossEntropy', 'colsample_bylevel': 0.08293874374582455, 'depth': 3, 'boosting_type': 'Plain', 'bootstrap_type': 'Bayesian', 'bagging_temperature': 5.910149115175384}. Best is trial 98 with value: 0.8791208791208791.
[32m[I 2023-04-21 01:41:46,251][39m Trial 348 finished with value: 0.8539325842696629 and parameters: {'objective': 'CrossEntropy', 'colsample_bylevel': 0.08579939106247352, 'depth': 3, 'boosting_type': 'Plain', 'bootstrap_type': 'Bayesian', 'bagging_temperature': 9.631203333054765}. Best is trial 98 with value: 0.8791208791208791.
[32m[I 2023-04-21 01:41:46,799][39m Trial 349 finished with value: 0.8764044943820225 and parameters: {'objective': 'CrossEntropy', 'colsample_bylevel': 0.08279835782828204, 'depth': 2, 'boosting_type': 'Plain', 'bootstrap_type': 'Bayesian', 'bagging_temperature': 9.832847273495421}. Best is trial 98 with value: 0.8791208791208791.
[32m[I 2023-04-21 01:41:47,371][39m Trial 350 finished with value: 0.8666666666666666 and parameters: {'objective': 'CrossEntropy', 'colsample_bylevel': 0.07929024390720957, 'depth': 2, 'boosting_type': 'Plain', 'bootstrap_type': 'Bayesian', 'bagging_temperature': 9.99608468214035}. Best is trial 98 with value: 0.8791208791208791.
[32m[I 2023-04-21 01:41:48,213][39m Trial 351 finished with value: 0.8409090909090909 and parameters: {'objective': 'CrossEntropy', 'colsample_bylevel': 0.08430633342263302, 'depth': 3, 'boosting_type': 'Plain', 'bootstrap_type': 'Bayesian', 'bagging_temperature': 9.555454781668296}. Best is trial 98 with value: 0.8791208791208791.
[32m[I 2023-04-21 01:41:49,150][39m Trial 352 finished with value: 0.8636363636363636 and parameters: {'objective': 'Logloss', 'colsample_bylevel': 0.08164669173113913, 'depth': 2, 'boosting_type': 'Plain', 'bootstrap_type': 'Bayesian', 'bagging_temperature': 9.823247634457285}. Best is trial 98 with value: 0.8791208791208791.
[32m[I 2023-04-21 01:41:49,946][39m Trial 353 finished with value: 0.8089887640449439 and parameters: {'objective': 'CrossEntropy', 'colsample_bylevel': 0.07781893768931733, 'depth': 1, 'boosting_type': 'Plain', 'bootstrap_type': 'Bayesian', 'bagging_temperature': 9.779136556036946}. Best is trial 98 with value: 0.8791208791208791.
[32m[I 2023-04-21 01:41:54,585][39m Trial 354 finished with value: 0.8409090909090909 and parameters: {'objective': 'CrossEntropy', 'colsample_bylevel': 0.0780671004353189, 'depth': 2, 'boosting_type': 'Ordered', 'bootstrap_type': 'Bayesian', 'bagging_temperature': 9.984139832457181}. Best is trial 98 with value: 0.8791208791208791.
[32m[I 2023-04-21 01:41:55,384][39m Trial 355 finished with value: 0.8409090909090909 and parameters: {'objective': 'CrossEntropy', 'colsample_bylevel': 0.08360645857412498, 'depth': 2, 'boosting_type': 'Plain', 'bootstrap_type': 'Bayesian', 'bagging_temperature': 5.48457681467125}. Best is trial 98 with value: 0.8791208791208791.
[32m[I 2023-04-21 01:41:56,230][39m Trial 356 finished with value: 0.8275862068965518 and parameters: {'objective': 'CrossEntropy', 'colsample_bylevel': 0.0934856188377122, 'depth': 4, 'boosting_type': 'Plain', 'bootstrap_type': 'Bayesian', 'bagging_temperature': 9.428853317178033}. Best is trial 98 with value: 0.8791208791208791.
[32m[I 2023-04-21 01:41:57,048][39m Trial 357 finished with value: 0.8539325842696629 and parameters: {'objective': 'CrossEntropy', 'colsample_bylevel': 0.08932376248321508, 'depth': 2, 'boosting_type': 'Plain', 'bootstrap_type': 'Bayesian', 'bagging_temperature': 9.262231101108494}. Best is trial 98 with value: 0.8791208791208791.
[32m[I 2023-04-21 01:41:57,885][39m Trial 358 finished with value: 0.8409090909090909 and parameters: {'objective': 'CrossEntropy', 'colsample_bylevel': 0.08555903381776936, 'depth': 3, 'boosting_type': 'Plain', 'bootstrap_type': 'Bernoulli', 'subsample': 0.9147831015538233}. Best is trial 98 with value: 0.8791208791208791.
[32m[I 2023-04-21 01:41:58,728][39m Trial 359 finished with value: 0.8764044943820225 and parameters: {'objective': 'CrossEntropy', 'colsample_bylevel': 0.09103221603896393, 'depth': 2, 'boosting_type': 'Plain', 'bootstrap_type': 'Bayesian', 'bagging_temperature': 9.652268553992995}. Best is trial 98 with value: 0.8791208791208791.
[32m[I 2023-04-21 01:41:59,518][39m Trial 360 finished with value: 0.8636363636363636 and parameters: {'objective': 'CrossEntropy', 'colsample_bylevel': 0.08365612257901518, 'depth': 2, 'boosting_type': 'Plain', 'bootstrap_type': 'Bayesian', 'bagging_temperature': 9.056065322073705}. Best is trial 98 with value: 0.8791208791208791.
[32m[I 2023-04-21 01:42:00,262][39m Trial 361 finished with value: 0.8409090909090909 and parameters: {'objective': 'Logloss', 'colsample_bylevel': 0.09122154221630169, 'depth': 2, 'boosting_type': 'Plain', 'bootstrap_type': 'Bayesian', 'bagging_temperature': 9.646559028865966}. Best is trial 98 with value: 0.8791208791208791.
[32m[I 2023-04-21 01:42:00,791][39m Trial 362 finished with value: 0.8539325842696629 and parameters: {'objective': 'CrossEntropy', 'colsample_bylevel': 0.07371499432437638, 'depth': 1, 'boosting_type': 'Plain', 'bootstrap_type': 'Bayesian', 'bagging_temperature': 9.654041731071544}. Best is trial 98 with value: 0.8791208791208791.
[32m[I 2023-04-21 01:42:01,718][39m Trial 363 finished with value: 0.8222222222222222 and parameters: {'objective': 'CrossEntropy', 'colsample_bylevel': 0.0804317684022939, 'depth': 2, 'boosting_type': 'Plain', 'bootstrap_type': 'MVS'}. Best is trial 98 with value: 0.8791208791208791.
[32m[I 2023-04-21 01:42:02,613][39m Trial 364 finished with value: 0.7500000000000001 and parameters: {'objective': 'CrossEntropy', 'colsample_bylevel': 0.026808360187130755, 'depth': 2, 'boosting_type': 'Plain', 'bootstrap_type': 'Bayesian', 'bagging_temperature': 3.4663004588684725}. Best is trial 98 with value: 0.8791208791208791.
[32m[I 2023-04-21 01:42:03,386][39m Trial 365 finished with value: 0.8275862068965518 and parameters: {'objective': 'CrossEntropy', 'colsample_bylevel': 0.08840118815672961, 'depth': 6, 'boosting_type': 'Plain', 'bootstrap_type': 'Bayesian', 'bagging_temperature': 1.5186075678900828}. Best is trial 98 with value: 0.8791208791208791.
[32m[I 2023-04-21 01:42:03,944][39m Trial 366 finished with value: 0.8539325842696629 and parameters: {'objective': 'CrossEntropy', 'colsample_bylevel': 0.08710856541306429, 'depth': 2, 'boosting_type': 'Plain', 'bootstrap_type': 'Bayesian', 'bagging_temperature': 9.767965432928698}. Best is trial 98 with value: 0.8791208791208791.
[32m[I 2023-04-21 01:42:04,836][39m Trial 367 finished with value: 0.8235294117647058 and parameters: {'objective': 'CrossEntropy', 'colsample_bylevel': 0.08211437260261678, 'depth': 1, 'boosting_type': 'Plain', 'bootstrap_type': 'Bayesian', 'bagging_temperature': 9.557460775246966}. Best is trial 98 with value: 0.8791208791208791.
[32m[I 2023-04-21 01:42:05,616][39m Trial 368 finished with value: 0.8539325842696629 and parameters: {'objective': 'CrossEntropy', 'colsample_bylevel': 0.0898917925504268, 'depth': 2, 'boosting_type': 'Plain', 'bootstrap_type': 'Bayesian', 'bagging_temperature': 9.397258742073896}. Best is trial 98 with value: 0.8791208791208791.
[32m[I 2023-04-21 01:42:06,431][39m Trial 369 finished with value: 0.8636363636363636 and parameters: {'objective': 'Logloss', 'colsample_bylevel': 0.08327052045656741, 'depth': 2, 'boosting_type': 'Plain', 'bootstrap_type': 'Bayesian', 'bagging_temperature': 9.789684100578}. Best is trial 98 with value: 0.8791208791208791.
[32m[I 2023-04-21 01:42:07,341][39m Trial 370 finished with value: 0.8636363636363636 and parameters: {'objective': 'CrossEntropy', 'colsample_bylevel': 0.08170385456680254, 'depth': 2, 'boosting_type': 'Plain', 'bootstrap_type': 'Bayesian', 'bagging_temperature': 9.443428581632261}. Best is trial 98 with value: 0.8791208791208791.
[32m[I 2023-04-21 01:42:11,964][39m Trial 371 finished with value: 0.8181818181818182 and parameters: {'objective': 'CrossEntropy', 'colsample_bylevel': 0.07927239723642478, 'depth': 2, 'boosting_type': 'Ordered', 'bootstrap_type': 'Bayesian', 'bagging_temperature': 9.998610672322236}. Best is trial 98 with value: 0.8791208791208791.
[32m[I 2023-04-21 01:42:13,214][39m Trial 372 finished with value: 0.8764044943820225 and parameters: {'objective': 'CrossEntropy', 'colsample_bylevel': 0.08492054292582298, 'depth': 2, 'boosting_type': 'Plain', 'bootstrap_type': 'Bayesian', 'bagging_temperature': 9.805154757890305}. Best is trial 98 with value: 0.8791208791208791.
[32m[I 2023-04-21 01:42:14,174][39m Trial 373 finished with value: 0.8764044943820225 and parameters: {'objective': 'CrossEntropy', 'colsample_bylevel': 0.0856688383094202, 'depth': 2, 'boosting_type': 'Plain', 'bootstrap_type': 'Bayesian', 'bagging_temperature': 9.634861323843808}. Best is trial 98 with value: 0.8791208791208791.
[32m[I 2023-04-21 01:42:14,801][39m Trial 374 finished with value: 0.8764044943820225 and parameters: {'objective': 'CrossEntropy', 'colsample_bylevel': 0.08415491461300625, 'depth': 2, 'boosting_type': 'Plain', 'bootstrap_type': 'Bayesian', 'bagging_temperature': 9.567667639154333}. Best is trial 98 with value: 0.8791208791208791.
[32m[I 2023-04-21 01:42:15,421][39m Trial 375 finished with value: 0.8764044943820225 and parameters: {'objective': 'CrossEntropy', 'colsample_bylevel': 0.08447705339882398, 'depth': 2, 'boosting_type': 'Plain', 'bootstrap_type': 'Bayesian', 'bagging_temperature': 9.632908824525117}. Best is trial 98 with value: 0.8791208791208791.
[32m[I 2023-04-21 01:42:16,494][39m Trial 376 finished with value: 0.8666666666666666 and parameters: {'objective': 'CrossEntropy', 'colsample_bylevel': 0.08761812048565937, 'depth': 2, 'boosting_type': 'Plain', 'bootstrap_type': 'Bayesian', 'bagging_temperature': 9.391691776376021}. Best is trial 98 with value: 0.8791208791208791.
[32m[I 2023-04-21 01:42:17,327][39m Trial 377 finished with value: 0.8045977011494252 and parameters: {'objective': 'CrossEntropy', 'colsample_bylevel': 0.084548057553538, 'depth': 1, 'boosting_type': 'Plain', 'bootstrap_type': 'Bayesian', 'bagging_temperature': 9.573877161004107}. Best is trial 98 with value: 0.8791208791208791.
[32m[I 2023-04-21 01:42:18,248][39m Trial 378 finished with value: 0.8764044943820225 and parameters: {'objective': 'CrossEntropy', 'colsample_bylevel': 0.08631620249207674, 'depth': 2, 'boosting_type': 'Plain', 'bootstrap_type': 'Bayesian', 'bagging_temperature': 9.245637215815558}. Best is trial 98 with value: 0.8791208791208791.
[32m[I 2023-04-21 01:42:19,483][39m Trial 379 finished with value: 0.8539325842696629 and parameters: {'objective': 'Logloss', 'colsample_bylevel': 0.08576012452457098, 'depth': 2, 'boosting_type': 'Plain', 'bootstrap_type': 'Bayesian', 'bagging_temperature': 9.219246600499972}. Best is trial 98 with value: 0.8791208791208791.
[32m[I 2023-04-21 01:42:20,043][39m Trial 380 finished with value: 0.8505747126436782 and parameters: {'objective': 'CrossEntropy', 'colsample_bylevel': 0.08517566114262155, 'depth': 2, 'boosting_type': 'Plain', 'bootstrap_type': 'Bayesian', 'bagging_temperature': 9.256266711801036}. Best is trial 98 with value: 0.8791208791208791.
[32m[I 2023-04-21 01:42:20,701][39m Trial 381 finished with value: 0.8539325842696629 and parameters: {'objective': 'CrossEntropy', 'colsample_bylevel': 0.09360115822844044, 'depth': 2, 'boosting_type': 'Plain', 'bootstrap_type': 'Bayesian', 'bagging_temperature': 9.605727414233677}. Best is trial 98 with value: 0.8791208791208791.
[32m[I 2023-04-21 01:42:21,518][39m Trial 382 finished with value: 0.8539325842696629 and parameters: {'objective': 'CrossEntropy', 'colsample_bylevel': 0.08697242954801038, 'depth': 2, 'boosting_type': 'Plain', 'bootstrap_type': 'Bayesian', 'bagging_temperature': 9.821773678915884}. Best is trial 98 with value: 0.8791208791208791.
[32m[I 2023-04-21 01:42:22,446][39m Trial 383 finished with value: 0.8131868131868132 and parameters: {'objective': 'CrossEntropy', 'colsample_bylevel': 0.083666324659506, 'depth': 1, 'boosting_type': 'Plain', 'bootstrap_type': 'Bernoulli', 'subsample': 0.5359174028697443}. Best is trial 98 with value: 0.8791208791208791.
[32m[I 2023-04-21 01:42:23,137][39m Trial 384 finished with value: 0.8409090909090909 and parameters: {'objective': 'CrossEntropy', 'colsample_bylevel': 0.0866132712887045, 'depth': 2, 'boosting_type': 'Plain', 'bootstrap_type': 'Bayesian', 'bagging_temperature': 9.06754109915404}. Best is trial 98 with value: 0.8791208791208791.
[32m[I 2023-04-21 01:42:23,824][39m Trial 385 finished with value: 0.8666666666666666 and parameters: {'objective': 'CrossEntropy', 'colsample_bylevel': 0.0827050656891817, 'depth': 2, 'boosting_type': 'Plain', 'bootstrap_type': 'Bayesian', 'bagging_temperature': 9.399806685779994}. Best is trial 98 with value: 0.8791208791208791.
[32m[I 2023-04-21 01:42:24,655][39m Trial 386 finished with value: 0.8539325842696629 and parameters: {'objective': 'CrossEntropy', 'colsample_bylevel': 0.08868173626247916, 'depth': 2, 'boosting_type': 'Plain', 'bootstrap_type': 'MVS'}. Best is trial 98 with value: 0.8791208791208791.
[32m[I 2023-04-21 01:42:25,486][39m Trial 387 finished with value: 0.8764044943820225 and parameters: {'objective': 'Logloss', 'colsample_bylevel': 0.08601069978702798, 'depth': 2, 'boosting_type': 'Plain', 'bootstrap_type': 'Bayesian', 'bagging_temperature': 9.339938689139883}. Best is trial 98 with value: 0.8791208791208791.
[32m[I 2023-04-21 01:42:26,338][39m Trial 388 finished with value: 0.8444444444444446 and parameters: {'objective': 'Logloss', 'colsample_bylevel': 0.09142952095780467, 'depth': 1, 'boosting_type': 'Plain', 'bootstrap_type': 'Bayesian', 'bagging_temperature': 9.499073041602523}. Best is trial 98 with value: 0.8791208791208791.
[32m[I 2023-04-21 01:42:27,326][39m Trial 389 finished with value: 0.8539325842696629 and parameters: {'objective': 'CrossEntropy', 'colsample_bylevel': 0.08224917117299732, 'depth': 2, 'boosting_type': 'Plain', 'bootstrap_type': 'Bayesian', 'bagging_temperature': 9.802976031417654}. Best is trial 98 with value: 0.8791208791208791.
[32m[I 2023-04-21 01:42:31,836][39m Trial 390 finished with value: 0.8539325842696629 and parameters: {'objective': 'Logloss', 'colsample_bylevel': 0.08867496952677865, 'depth': 2, 'boosting_type': 'Ordered', 'bootstrap_type': 'Bayesian', 'bagging_temperature': 9.66375676478942}. Best is trial 98 with value: 0.8791208791208791.
[32m[I 2023-04-21 01:42:33,064][39m Trial 391 finished with value: 0.8409090909090909 and parameters: {'objective': 'Logloss', 'colsample_bylevel': 0.08801819084635852, 'depth': 8, 'boosting_type': 'Plain', 'bootstrap_type': 'Bayesian', 'bagging_temperature': 8.926884903174507}. Best is trial 98 with value: 0.8791208791208791.
[32m[I 2023-04-21 01:42:34,150][39m Trial 392 finished with value: 0.8764044943820225 and parameters: {'objective': 'CrossEntropy', 'colsample_bylevel': 0.08448884022249965, 'depth': 2, 'boosting_type': 'Plain', 'bootstrap_type': 'Bayesian', 'bagging_temperature': 9.572400436169115}. Best is trial 98 with value: 0.8791208791208791.
[32m[I 2023-04-21 01:42:35,007][39m Trial 393 finished with value: 0.8764044943820225 and parameters: {'objective': 'CrossEntropy', 'colsample_bylevel': 0.08496611605596908, 'depth': 2, 'boosting_type': 'Plain', 'bootstrap_type': 'Bayesian', 'bagging_temperature': 9.179151061107842}. Best is trial 98 with value: 0.8791208791208791.
[32m[I 2023-04-21 01:42:35,553][39m Trial 394 finished with value: 0.8764044943820225 and parameters: {'objective': 'CrossEntropy', 'colsample_bylevel': 0.08489247214364751, 'depth': 2, 'boosting_type': 'Plain', 'bootstrap_type': 'Bayesian', 'bagging_temperature': 9.417025114412942}. Best is trial 98 with value: 0.8791208791208791.
[32m[I 2023-04-21 01:42:36,644][39m Trial 395 finished with value: 0.8139534883720929 and parameters: {'objective': 'CrossEntropy', 'colsample_bylevel': 0.08680285729263723, 'depth': 1, 'boosting_type': 'Plain', 'bootstrap_type': 'Bayesian', 'bagging_temperature': 9.126597614742558}. Best is trial 98 with value: 0.8791208791208791.
[32m[I 2023-04-21 01:42:37,266][39m Trial 396 finished with value: 0.8735632183908046 and parameters: {'objective': 'CrossEntropy', 'colsample_bylevel': 0.08470618237892145, 'depth': 2, 'boosting_type': 'Plain', 'bootstrap_type': 'Bayesian', 'bagging_temperature': 8.771225441164514}. Best is trial 98 with value: 0.8791208791208791.
