[32m[I 2023-04-21 02:21:28,558][39m Trial 2511 finished with value: 0.8539325842696629 and parameters: {'objective': 'CrossEntropy', 'colsample_bylevel': 0.07621352805315167, 'depth': 4, 'boosting_type': 'Plain', 'bootstrap_type': 'Bayesian', 'bagging_temperature': 8.917139756102054}. Best is trial 98 with value: 0.8791208791208791.
[32m[I 2023-04-21 02:21:29,416][39m Trial 2512 finished with value: 0.8539325842696629 and parameters: {'objective': 'CrossEntropy', 'colsample_bylevel': 0.07386062659379233, 'depth': 4, 'boosting_type': 'Plain', 'bootstrap_type': 'Bayesian', 'bagging_temperature': 9.751406481876634}. Best is trial 98 with value: 0.8791208791208791.
[32m[I 2023-04-21 02:21:30,408][39m Trial 2513 finished with value: 0.8409090909090909 and parameters: {'objective': 'CrossEntropy', 'colsample_bylevel': 0.0831466649005601, 'depth': 3, 'boosting_type': 'Plain', 'bootstrap_type': 'Bayesian', 'bagging_temperature': 9.159604547848723}. Best is trial 98 with value: 0.8791208791208791.
[32m[I 2023-04-21 02:21:31,398][39m Trial 2514 finished with value: 0.8539325842696629 and parameters: {'objective': 'CrossEntropy', 'colsample_bylevel': 0.08230817865341851, 'depth': 10, 'boosting_type': 'Plain', 'bootstrap_type': 'Bayesian', 'bagging_temperature': 9.640510310265151}. Best is trial 98 with value: 0.8791208791208791.
[32m[I 2023-04-21 02:21:32,074][39m Trial 2515 finished with value: 0.8666666666666666 and parameters: {'objective': 'CrossEntropy', 'colsample_bylevel': 0.08499121719719, 'depth': 3, 'boosting_type': 'Plain', 'bootstrap_type': 'Bayesian', 'bagging_temperature': 9.054387984871585}. Best is trial 98 with value: 0.8791208791208791.
[32m[I 2023-04-21 02:21:33,263][39m Trial 2516 finished with value: 0.8409090909090909 and parameters: {'objective': 'CrossEntropy', 'colsample_bylevel': 0.08022583368029332, 'depth': 11, 'boosting_type': 'Plain', 'bootstrap_type': 'Bayesian', 'bagging_temperature': 2.7844358934725526}. Best is trial 98 with value: 0.8791208791208791.
[32m[I 2023-04-21 02:21:34,384][39m Trial 2517 finished with value: 0.8409090909090909 and parameters: {'objective': 'Logloss', 'colsample_bylevel': 0.0744169624692555, 'depth': 4, 'boosting_type': 'Plain', 'bootstrap_type': 'Bernoulli', 'subsample': 0.4957173320261102}. Best is trial 98 with value: 0.8791208791208791.
[32m[I 2023-04-21 02:21:35,287][39m Trial 2518 finished with value: 0.8539325842696629 and parameters: {'objective': 'Logloss', 'colsample_bylevel': 0.07455713650603181, 'depth': 4, 'boosting_type': 'Plain', 'bootstrap_type': 'Bayesian', 'bagging_temperature': 8.36164953528798}. Best is trial 98 with value: 0.8791208791208791.
[32m[I 2023-04-21 02:21:40,113][39m Trial 2519 finished with value: 0.8139534883720929 and parameters: {'objective': 'CrossEntropy', 'colsample_bylevel': 0.08945795021102192, 'depth': 3, 'boosting_type': 'Ordered', 'bootstrap_type': 'Bayesian', 'bagging_temperature': 5.989178415064654}. Best is trial 98 with value: 0.8791208791208791.
[32m[I 2023-04-21 02:21:41,295][39m Trial 2520 finished with value: 0.8409090909090909 and parameters: {'objective': 'CrossEntropy', 'colsample_bylevel': 0.07314554088091757, 'depth': 3, 'boosting_type': 'Plain', 'bootstrap_type': 'Bayesian', 'bagging_temperature': 9.97554337955255}. Best is trial 98 with value: 0.8791208791208791.
[32m[I 2023-04-21 02:21:42,019][39m Trial 2521 finished with value: 0.8539325842696629 and parameters: {'objective': 'CrossEntropy', 'colsample_bylevel': 0.07524890280578946, 'depth': 11, 'boosting_type': 'Plain', 'bootstrap_type': 'Bayesian', 'bagging_temperature': 0.5088112851817446}. Best is trial 98 with value: 0.8791208791208791.
[32m[I 2023-04-21 02:21:43,245][39m Trial 2522 finished with value: 0.8409090909090909 and parameters: {'objective': 'Logloss', 'colsample_bylevel': 0.07552848412734343, 'depth': 4, 'boosting_type': 'Plain', 'bootstrap_type': 'MVS'}. Best is trial 98 with value: 0.8791208791208791.
[32m[I 2023-04-21 02:21:43,983][39m Trial 2523 finished with value: 0.8539325842696629 and parameters: {'objective': 'CrossEntropy', 'colsample_bylevel': 0.09557898052105407, 'depth': 3, 'boosting_type': 'Plain', 'bootstrap_type': 'Bayesian', 'bagging_temperature': 9.363359972546387}. Best is trial 98 with value: 0.8791208791208791.
[32m[I 2023-04-21 02:21:45,068][39m Trial 2524 finished with value: 0.8666666666666666 and parameters: {'objective': 'CrossEntropy', 'colsample_bylevel': 0.07247697906765076, 'depth': 11, 'boosting_type': 'Plain', 'bootstrap_type': 'Bayesian', 'bagging_temperature': 8.986932187006484}. Best is trial 98 with value: 0.8791208791208791.
[32m[I 2023-04-21 02:21:45,911][39m Trial 2525 finished with value: 0.8666666666666666 and parameters: {'objective': 'CrossEntropy', 'colsample_bylevel': 0.09122070054219868, 'depth': 3, 'boosting_type': 'Plain', 'bootstrap_type': 'Bayesian', 'bagging_temperature': 9.994126407827908}. Best is trial 98 with value: 0.8791208791208791.
[32m[I 2023-04-21 02:21:47,052][39m Trial 2526 finished with value: 0.8409090909090909 and parameters: {'objective': 'CrossEntropy', 'colsample_bylevel': 0.0897278503526681, 'depth': 3, 'boosting_type': 'Plain', 'bootstrap_type': 'Bayesian', 'bagging_temperature': 9.24627679357614}. Best is trial 98 with value: 0.8791208791208791.
[32m[I 2023-04-21 02:21:47,913][39m Trial 2527 finished with value: 0.8505747126436782 and parameters: {'objective': 'CrossEntropy', 'colsample_bylevel': 0.08523561845415545, 'depth': 12, 'boosting_type': 'Plain', 'bootstrap_type': 'Bayesian', 'bagging_temperature': 9.446231049913214}. Best is trial 98 with value: 0.8791208791208791.
[32m[I 2023-04-21 02:21:48,947][39m Trial 2528 finished with value: 0.8666666666666666 and parameters: {'objective': 'CrossEntropy', 'colsample_bylevel': 0.07667372827889155, 'depth': 6, 'boosting_type': 'Plain', 'bootstrap_type': 'Bayesian', 'bagging_temperature': 9.24495042233874}. Best is trial 98 with value: 0.8791208791208791.
[32m[I 2023-04-21 02:21:49,774][39m Trial 2529 finished with value: 0.8666666666666666 and parameters: {'objective': 'Logloss', 'colsample_bylevel': 0.07233925881664041, 'depth': 4, 'boosting_type': 'Plain', 'bootstrap_type': 'Bayesian', 'bagging_temperature': 9.39985301674082}. Best is trial 98 with value: 0.8791208791208791.
[32m[I 2023-04-21 02:21:50,641][39m Trial 2530 finished with value: 0.8539325842696629 and parameters: {'objective': 'CrossEntropy', 'colsample_bylevel': 0.07792721004188824, 'depth': 2, 'boosting_type': 'Plain', 'bootstrap_type': 'Bayesian', 'bagging_temperature': 8.449337093314787}. Best is trial 98 with value: 0.8791208791208791.
[32m[I 2023-04-21 02:21:51,535][39m Trial 2531 finished with value: 0.8275862068965518 and parameters: {'objective': 'CrossEntropy', 'colsample_bylevel': 0.07387349992072634, 'depth': 11, 'boosting_type': 'Plain', 'bootstrap_type': 'Bernoulli', 'subsample': 0.47235979249092447}. Best is trial 98 with value: 0.8791208791208791.
[32m[I 2023-04-21 02:21:52,330][39m Trial 2532 finished with value: 0.8539325842696629 and parameters: {'objective': 'Logloss', 'colsample_bylevel': 0.07056056385733062, 'depth': 5, 'boosting_type': 'Plain', 'bootstrap_type': 'Bayesian', 'bagging_temperature': 9.550314530274095}. Best is trial 98 with value: 0.8791208791208791.
[32m[I 2023-04-21 02:21:53,373][39m Trial 2533 finished with value: 0.8539325842696629 and parameters: {'objective': 'CrossEntropy', 'colsample_bylevel': 0.0838754358829123, 'depth': 11, 'boosting_type': 'Plain', 'bootstrap_type': 'Bayesian', 'bagging_temperature': 9.016583926802323}. Best is trial 98 with value: 0.8791208791208791.
[32m[I 2023-04-21 02:21:54,213][39m Trial 2534 finished with value: 0.8409090909090909 and parameters: {'objective': 'CrossEntropy', 'colsample_bylevel': 0.07705030387661219, 'depth': 5, 'boosting_type': 'Plain', 'bootstrap_type': 'Bayesian', 'bagging_temperature': 9.346776977424264}. Best is trial 98 with value: 0.8791208791208791.
[32m[I 2023-04-21 02:21:55,474][39m Trial 2535 finished with value: 0.8275862068965518 and parameters: {'objective': 'CrossEntropy', 'colsample_bylevel': 0.07446893105098534, 'depth': 11, 'boosting_type': 'Plain', 'bootstrap_type': 'MVS'}. Best is trial 98 with value: 0.8791208791208791.
[32m[I 2023-04-21 02:21:56,223][39m Trial 2536 finished with value: 0.8409090909090909 and parameters: {'objective': 'Logloss', 'colsample_bylevel': 0.09359744129194726, 'depth': 10, 'boosting_type': 'Plain', 'bootstrap_type': 'Bayesian', 'bagging_temperature': 8.30991689809133}. Best is trial 98 with value: 0.8791208791208791.
[32m[I 2023-04-21 02:21:57,266][39m Trial 2537 finished with value: 0.8666666666666666 and parameters: {'objective': 'CrossEntropy', 'colsample_bylevel': 0.08694352450710059, 'depth': 3, 'boosting_type': 'Plain', 'bootstrap_type': 'Bayesian', 'bagging_temperature': 7.901829393117786}. Best is trial 98 with value: 0.8791208791208791.
[32m[I 2023-04-21 02:21:58,271][39m Trial 2538 finished with value: 0.8539325842696629 and parameters: {'objective': 'CrossEntropy', 'colsample_bylevel': 0.07595542136498244, 'depth': 9, 'boosting_type': 'Plain', 'bootstrap_type': 'Bayesian', 'bagging_temperature': 9.293066262533923}. Best is trial 98 with value: 0.8791208791208791.
[32m[I 2023-04-21 02:22:03,455][39m Trial 2539 finished with value: 0.8409090909090909 and parameters: {'objective': 'CrossEntropy', 'colsample_bylevel': 0.07679303179072568, 'depth': 11, 'boosting_type': 'Ordered', 'bootstrap_type': 'Bayesian', 'bagging_temperature': 9.545499503017519}. Best is trial 98 with value: 0.8791208791208791.
[32m[I 2023-04-21 02:22:04,481][39m Trial 2540 finished with value: 0.8539325842696629 and parameters: {'objective': 'Logloss', 'colsample_bylevel': 0.07436263872563294, 'depth': 4, 'boosting_type': 'Plain', 'bootstrap_type': 'Bayesian', 'bagging_temperature': 9.429466719602635}. Best is trial 98 with value: 0.8791208791208791.
[32m[I 2023-04-21 02:22:05,396][39m Trial 2541 finished with value: 0.8539325842696629 and parameters: {'objective': 'CrossEntropy', 'colsample_bylevel': 0.07837502176972193, 'depth': 4, 'boosting_type': 'Plain', 'bootstrap_type': 'Bayesian', 'bagging_temperature': 8.723230086181086}. Best is trial 98 with value: 0.8791208791208791.
[32m[I 2023-04-21 02:22:06,125][39m Trial 2542 finished with value: 0.8409090909090909 and parameters: {'objective': 'CrossEntropy', 'colsample_bylevel': 0.08239484032677094, 'depth': 3, 'boosting_type': 'Plain', 'bootstrap_type': 'Bayesian', 'bagging_temperature': 9.398316185815037}. Best is trial 98 with value: 0.8791208791208791.
[32m[I 2023-04-21 02:22:07,134][39m Trial 2543 finished with value: 0.8139534883720929 and parameters: {'objective': 'CrossEntropy', 'colsample_bylevel': 0.08730451177429657, 'depth': 4, 'boosting_type': 'Plain', 'bootstrap_type': 'Bayesian', 'bagging_temperature': 9.726383755710234}. Best is trial 98 with value: 0.8791208791208791.
[32m[I 2023-04-21 02:22:07,951][39m Trial 2544 finished with value: 0.8275862068965518 and parameters: {'objective': 'Logloss', 'colsample_bylevel': 0.07828930193079191, 'depth': 5, 'boosting_type': 'Plain', 'bootstrap_type': 'Bayesian', 'bagging_temperature': 9.37799756883561}. Best is trial 98 with value: 0.8791208791208791.
[32m[I 2023-04-21 02:22:08,937][39m Trial 2545 finished with value: 0.8275862068965518 and parameters: {'objective': 'CrossEntropy', 'colsample_bylevel': 0.09800282393858951, 'depth': 3, 'boosting_type': 'Plain', 'bootstrap_type': 'MVS'}. Best is trial 98 with value: 0.8791208791208791.
[32m[I 2023-04-21 02:22:09,889][39m Trial 2546 finished with value: 0.8539325842696629 and parameters: {'objective': 'CrossEntropy', 'colsample_bylevel': 0.09481479617028031, 'depth': 3, 'boosting_type': 'Plain', 'bootstrap_type': 'Bayesian', 'bagging_temperature': 7.172996749092648}. Best is trial 98 with value: 0.8791208791208791.
[32m[I 2023-04-21 02:22:10,609][39m Trial 2547 finished with value: 0.8764044943820225 and parameters: {'objective': 'CrossEntropy', 'colsample_bylevel': 0.083784308532926, 'depth': 2, 'boosting_type': 'Plain', 'bootstrap_type': 'Bayesian', 'bagging_temperature': 9.04621011281477}. Best is trial 98 with value: 0.8791208791208791.
[32m[I 2023-04-21 02:22:11,885][39m Trial 2548 finished with value: 0.8539325842696629 and parameters: {'objective': 'CrossEntropy', 'colsample_bylevel': 0.07230546054675892, 'depth': 4, 'boosting_type': 'Plain', 'bootstrap_type': 'Bayesian', 'bagging_temperature': 8.58555023958385}. Best is trial 98 with value: 0.8791208791208791.
[32m[I 2023-04-21 02:22:12,676][39m Trial 2549 finished with value: 0.8666666666666666 and parameters: {'objective': 'CrossEntropy', 'colsample_bylevel': 0.0714763399028544, 'depth': 9, 'boosting_type': 'Plain', 'bootstrap_type': 'Bayesian', 'bagging_temperature': 9.581885164536281}. Best is trial 98 with value: 0.8791208791208791.
[32m[I 2023-04-21 02:22:13,764][39m Trial 2550 finished with value: 0.8539325842696629 and parameters: {'objective': 'CrossEntropy', 'colsample_bylevel': 0.0752546735876944, 'depth': 4, 'boosting_type': 'Plain', 'bootstrap_type': 'Bayesian', 'bagging_temperature': 9.831076408479095}. Best is trial 98 with value: 0.8791208791208791.
[32m[I 2023-04-21 02:22:14,569][39m Trial 2551 finished with value: 0.8409090909090909 and parameters: {'objective': 'CrossEntropy', 'colsample_bylevel': 0.07868458817940638, 'depth': 11, 'boosting_type': 'Plain', 'bootstrap_type': 'Bayesian', 'bagging_temperature': 8.871513355717298}. Best is trial 98 with value: 0.8791208791208791.
[32m[I 2023-04-21 02:22:15,780][39m Trial 2552 finished with value: 0.8409090909090909 and parameters: {'objective': 'CrossEntropy', 'colsample_bylevel': 0.08159210523873195, 'depth': 3, 'boosting_type': 'Plain', 'bootstrap_type': 'Bayesian', 'bagging_temperature': 8.909722330361323}. Best is trial 98 with value: 0.8791208791208791.
[32m[I 2023-04-21 02:22:16,760][39m Trial 2553 finished with value: 0.8139534883720929 and parameters: {'objective': 'CrossEntropy', 'colsample_bylevel': 0.0972771366699893, 'depth': 3, 'boosting_type': 'Plain', 'bootstrap_type': 'Bayesian', 'bagging_temperature': 8.713053430676123}. Best is trial 98 with value: 0.8791208791208791.
[32m[I 2023-04-21 02:22:17,446][39m Trial 2554 finished with value: 0.8409090909090909 and parameters: {'objective': 'CrossEntropy', 'colsample_bylevel': 0.0800173843952437, 'depth': 3, 'boosting_type': 'Plain', 'bootstrap_type': 'Bayesian', 'bagging_temperature': 8.417324297120519}. Best is trial 98 with value: 0.8791208791208791.
[32m[I 2023-04-21 02:22:18,247][39m Trial 2555 finished with value: 0.8409090909090909 and parameters: {'objective': 'Logloss', 'colsample_bylevel': 0.0691237478042706, 'depth': 5, 'boosting_type': 'Plain', 'bootstrap_type': 'Bernoulli', 'subsample': 0.20946597251166338}. Best is trial 98 with value: 0.8791208791208791.
[32m[I 2023-04-21 02:22:19,220][39m Trial 2556 finished with value: 0.8275862068965518 and parameters: {'objective': 'Logloss', 'colsample_bylevel': 0.06992025698089688, 'depth': 5, 'boosting_type': 'Plain', 'bootstrap_type': 'Bayesian', 'bagging_temperature': 8.869615139613025}. Best is trial 98 with value: 0.8791208791208791.
[32m[I 2023-04-21 02:22:24,259][39m Trial 2557 finished with value: 0.8275862068965518 and parameters: {'objective': 'CrossEntropy', 'colsample_bylevel': 0.08994807557709503, 'depth': 11, 'boosting_type': 'Ordered', 'bootstrap_type': 'Bayesian', 'bagging_temperature': 5.004709885984354}. Best is trial 98 with value: 0.8791208791208791.
[32m[I 2023-04-21 02:22:25,390][39m Trial 2558 finished with value: 0.8791208791208791 and parameters: {'objective': 'CrossEntropy', 'colsample_bylevel': 0.08071071536851786, 'depth': 3, 'boosting_type': 'Plain', 'bootstrap_type': 'Bayesian', 'bagging_temperature': 9.059939809662431}. Best is trial 98 with value: 0.8791208791208791.
[32m[I 2023-04-21 02:22:26,660][39m Trial 2559 finished with value: 0.8539325842696629 and parameters: {'objective': 'CrossEntropy', 'colsample_bylevel': 0.08485787085573515, 'depth': 10, 'boosting_type': 'Plain', 'bootstrap_type': 'Bayesian', 'bagging_temperature': 9.523841420628571}. Best is trial 98 with value: 0.8791208791208791.
[32m[I 2023-04-21 02:22:27,300][39m Trial 2560 finished with value: 0.8539325842696629 and parameters: {'objective': 'CrossEntropy', 'colsample_bylevel': 0.09387993424924518, 'depth': 3, 'boosting_type': 'Plain', 'bootstrap_type': 'Bayesian', 'bagging_temperature': 9.974093606693478}. Best is trial 98 with value: 0.8791208791208791.
[32m[I 2023-04-21 02:22:28,455][39m Trial 2561 finished with value: 0.8791208791208791 and parameters: {'objective': 'CrossEntropy', 'colsample_bylevel': 0.08016132854087259, 'depth': 3, 'boosting_type': 'Plain', 'bootstrap_type': 'Bayesian', 'bagging_temperature': 9.036678596907759}. Best is trial 98 with value: 0.8791208791208791.
[32m[I 2023-04-21 02:22:29,249][39m Trial 2562 finished with value: 0.8666666666666666 and parameters: {'objective': 'CrossEntropy', 'colsample_bylevel': 0.09408670528357355, 'depth': 3, 'boosting_type': 'Plain', 'bootstrap_type': 'Bayesian', 'bagging_temperature': 8.483943789833438}. Best is trial 98 with value: 0.8791208791208791.
[32m[I 2023-04-21 02:22:30,607][39m Trial 2563 finished with value: 0.8791208791208791 and parameters: {'objective': 'CrossEntropy', 'colsample_bylevel': 0.07536448338731923, 'depth': 10, 'boosting_type': 'Plain', 'bootstrap_type': 'Bayesian', 'bagging_temperature': 9.673822689593603}. Best is trial 98 with value: 0.8791208791208791.
[32m[I 2023-04-21 02:22:31,611][39m Trial 2564 finished with value: 0.8409090909090909 and parameters: {'objective': 'CrossEntropy', 'colsample_bylevel': 0.08560820857095923, 'depth': 10, 'boosting_type': 'Plain', 'bootstrap_type': 'Bayesian', 'bagging_temperature': 9.500115019411993}. Best is trial 98 with value: 0.8791208791208791.
[32m[I 2023-04-21 02:22:32,481][39m Trial 2565 finished with value: 0.8539325842696629 and parameters: {'objective': 'CrossEntropy', 'colsample_bylevel': 0.09549909246365669, 'depth': 2, 'boosting_type': 'Plain', 'bootstrap_type': 'Bayesian', 'bagging_temperature': 8.473228032372361}. Best is trial 98 with value: 0.8791208791208791.
[32m[I 2023-04-21 02:22:33,120][39m Trial 2566 finished with value: 0.8409090909090909 and parameters: {'objective': 'CrossEntropy', 'colsample_bylevel': 0.0795463258725128, 'depth': 10, 'boosting_type': 'Plain', 'bootstrap_type': 'Bayesian', 'bagging_temperature': 9.62901641333844}. Best is trial 98 with value: 0.8791208791208791.
[32m[I 2023-04-21 02:22:34,135][39m Trial 2567 finished with value: 0.8372093023255814 and parameters: {'objective': 'CrossEntropy', 'colsample_bylevel': 0.0763931086867877, 'depth': 12, 'boosting_type': 'Plain', 'bootstrap_type': 'MVS'}. Best is trial 98 with value: 0.8791208791208791.
[32m[I 2023-04-21 02:22:34,942][39m Trial 2568 finished with value: 0.8539325842696629 and parameters: {'objective': 'Logloss', 'colsample_bylevel': 0.08151898756307804, 'depth': 11, 'boosting_type': 'Plain', 'bootstrap_type': 'Bayesian', 'bagging_temperature': 9.192622939807912}. Best is trial 98 with value: 0.8791208791208791.
[32m[I 2023-04-21 02:22:35,875][39m Trial 2569 finished with value: 0.8409090909090909 and parameters: {'objective': 'CrossEntropy', 'colsample_bylevel': 0.07892583660627538, 'depth': 4, 'boosting_type': 'Plain', 'bootstrap_type': 'Bayesian', 'bagging_temperature': 8.879629053101581}. Best is trial 98 with value: 0.8791208791208791.
[32m[I 2023-04-21 02:22:36,737][39m Trial 2570 finished with value: 0.8409090909090909 and parameters: {'objective': 'CrossEntropy', 'colsample_bylevel': 0.08113167447648056, 'depth': 3, 'boosting_type': 'Plain', 'bootstrap_type': 'MVS'}. Best is trial 98 with value: 0.8791208791208791.
[32m[I 2023-04-21 02:22:37,654][39m Trial 2571 finished with value: 0.8666666666666666 and parameters: {'objective': 'CrossEntropy', 'colsample_bylevel': 0.07423087710630186, 'depth': 3, 'boosting_type': 'Plain', 'bootstrap_type': 'Bayesian', 'bagging_temperature': 9.779836650808747}. Best is trial 98 with value: 0.8791208791208791.
[32m[I 2023-04-21 02:22:38,747][39m Trial 2572 finished with value: 0.8139534883720929 and parameters: {'objective': 'Logloss', 'colsample_bylevel': 0.07958583300680352, 'depth': 12, 'boosting_type': 'Plain', 'bootstrap_type': 'Bayesian', 'bagging_temperature': 4.032430619808866}. Best is trial 98 with value: 0.8791208791208791.
[32m[I 2023-04-21 02:22:39,790][39m Trial 2573 finished with value: 0.8372093023255814 and parameters: {'objective': 'CrossEntropy', 'colsample_bylevel': 0.08254467074717266, 'depth': 11, 'boosting_type': 'Plain', 'bootstrap_type': 'Bayesian', 'bagging_temperature': 9.067431014926939}. Best is trial 98 with value: 0.8791208791208791.
[32m[I 2023-04-21 02:22:40,751][39m Trial 2574 finished with value: 0.8791208791208791 and parameters: {'objective': 'CrossEntropy', 'colsample_bylevel': 0.0769955021064153, 'depth': 3, 'boosting_type': 'Plain', 'bootstrap_type': 'Bayesian', 'bagging_temperature': 9.651170091930103}. Best is trial 98 with value: 0.8791208791208791.
[32m[I 2023-04-21 02:22:41,416][39m Trial 2575 finished with value: 0.8409090909090909 and parameters: {'objective': 'CrossEntropy', 'colsample_bylevel': 0.08362548380905829, 'depth': 10, 'boosting_type': 'Plain', 'bootstrap_type': 'Bayesian', 'bagging_temperature': 9.520870523369615}. Best is trial 98 with value: 0.8791208791208791.
[32m[I 2023-04-21 02:22:46,424][39m Trial 2576 finished with value: 0.8275862068965518 and parameters: {'objective': 'CrossEntropy', 'colsample_bylevel': 0.07700180918534177, 'depth': 4, 'boosting_type': 'Ordered', 'bootstrap_type': 'Bernoulli', 'subsample': 0.7951071412820081}. Best is trial 98 with value: 0.8791208791208791.
