[32m[I 2023-04-21 01:50:44,872][39m Trial 860 finished with value: 0.8409090909090909 and parameters: {'objective': 'CrossEntropy', 'colsample_bylevel': 0.08498592763881795, 'depth': 4, 'boosting_type': 'Plain', 'bootstrap_type': 'Bayesian', 'bagging_temperature': 9.188374766286072}. Best is trial 98 with value: 0.8791208791208791.
[32m[I 2023-04-21 01:50:46,303][39m Trial 861 finished with value: 0.8409090909090909 and parameters: {'objective': 'CrossEntropy', 'colsample_bylevel': 0.08394737337690147, 'depth': 9, 'boosting_type': 'Plain', 'bootstrap_type': 'Bayesian', 'bagging_temperature': 9.13855568244636}. Best is trial 98 with value: 0.8791208791208791.
[32m[I 2023-04-21 01:50:47,019][39m Trial 862 finished with value: 0.8539325842696629 and parameters: {'objective': 'CrossEntropy', 'colsample_bylevel': 0.08353052958233283, 'depth': 3, 'boosting_type': 'Plain', 'bootstrap_type': 'Bayesian', 'bagging_temperature': 9.271747865305072}. Best is trial 98 with value: 0.8791208791208791.
[32m[I 2023-04-21 01:50:47,661][39m Trial 863 finished with value: 0.8666666666666666 and parameters: {'objective': 'CrossEntropy', 'colsample_bylevel': 0.09093345077772197, 'depth': 3, 'boosting_type': 'Plain', 'bootstrap_type': 'Bayesian', 'bagging_temperature': 8.635779211645097}. Best is trial 98 with value: 0.8791208791208791.
[32m[I 2023-04-21 01:50:48,905][39m Trial 864 finished with value: 0.8666666666666666 and parameters: {'objective': 'Logloss', 'colsample_bylevel': 0.06489118524524992, 'depth': 3, 'boosting_type': 'Plain', 'bootstrap_type': 'Bayesian', 'bagging_temperature': 9.79527226918489}. Best is trial 98 with value: 0.8791208791208791.
[32m[I 2023-04-21 01:50:49,589][39m Trial 865 finished with value: 0.8539325842696629 and parameters: {'objective': 'CrossEntropy', 'colsample_bylevel': 0.07917212112199003, 'depth': 8, 'boosting_type': 'Plain', 'bootstrap_type': 'Bayesian', 'bagging_temperature': 8.104634701720224}. Best is trial 98 with value: 0.8791208791208791.
[32m[I 2023-04-21 01:50:50,414][39m Trial 866 finished with value: 0.8539325842696629 and parameters: {'objective': 'CrossEntropy', 'colsample_bylevel': 0.08260839619308563, 'depth': 3, 'boosting_type': 'Plain', 'bootstrap_type': 'Bayesian', 'bagging_temperature': 9.848840914654703}. Best is trial 98 with value: 0.8791208791208791.
[32m[I 2023-04-21 01:50:51,318][39m Trial 867 finished with value: 0.8275862068965518 and parameters: {'objective': 'CrossEntropy', 'colsample_bylevel': 0.07953014536574131, 'depth': 7, 'boosting_type': 'Plain', 'bootstrap_type': 'Bayesian', 'bagging_temperature': 9.990391805677454}. Best is trial 98 with value: 0.8791208791208791.
[32m[I 2023-04-21 01:50:52,424][39m Trial 868 finished with value: 0.8275862068965518 and parameters: {'objective': 'CrossEntropy', 'colsample_bylevel': 0.0942307073498319, 'depth': 4, 'boosting_type': 'Plain', 'bootstrap_type': 'Bayesian', 'bagging_temperature': 9.64611007474009}. Best is trial 98 with value: 0.8791208791208791.
[32m[I 2023-04-21 01:50:53,152][39m Trial 869 finished with value: 0.8666666666666666 and parameters: {'objective': 'Logloss', 'colsample_bylevel': 0.06792113076333099, 'depth': 5, 'boosting_type': 'Plain', 'bootstrap_type': 'Bayesian', 'bagging_temperature': 9.551878239812282}. Best is trial 98 with value: 0.8791208791208791.
[32m[I 2023-04-21 01:50:53,903][39m Trial 870 finished with value: 0.8409090909090909 and parameters: {'objective': 'CrossEntropy', 'colsample_bylevel': 0.08975987831896426, 'depth': 3, 'boosting_type': 'Plain', 'bootstrap_type': 'Bayesian', 'bagging_temperature': 8.164396851537855}. Best is trial 98 with value: 0.8791208791208791.
[32m[I 2023-04-21 01:50:58,958][39m Trial 871 finished with value: 0.8409090909090909 and parameters: {'objective': 'CrossEntropy', 'colsample_bylevel': 0.0879039828289133, 'depth': 3, 'boosting_type': 'Ordered', 'bootstrap_type': 'Bayesian', 'bagging_temperature': 9.514316281700442}. Best is trial 98 with value: 0.8791208791208791.
[32m[I 2023-04-21 01:50:59,823][39m Trial 872 finished with value: 0.8539325842696629 and parameters: {'objective': 'CrossEntropy', 'colsample_bylevel': 0.09100505048911328, 'depth': 3, 'boosting_type': 'Plain', 'bootstrap_type': 'Bayesian', 'bagging_temperature': 8.551805994123264}. Best is trial 98 with value: 0.8791208791208791.
[32m[I 2023-04-21 01:51:00,573][39m Trial 873 finished with value: 0.8666666666666666 and parameters: {'objective': 'CrossEntropy', 'colsample_bylevel': 0.08149669532290484, 'depth': 3, 'boosting_type': 'Plain', 'bootstrap_type': 'Bayesian', 'bagging_temperature': 9.960214186067958}. Best is trial 98 with value: 0.8791208791208791.
[32m[I 2023-04-21 01:51:01,378][39m Trial 874 finished with value: 0.8275862068965518 and parameters: {'objective': 'CrossEntropy', 'colsample_bylevel': 0.08608982896287845, 'depth': 3, 'boosting_type': 'Plain', 'bootstrap_type': 'Bernoulli', 'subsample': 0.38145749536230195}. Best is trial 98 with value: 0.8791208791208791.
[32m[I 2023-04-21 01:51:02,308][39m Trial 875 finished with value: 0.8539325842696629 and parameters: {'objective': 'CrossEntropy', 'colsample_bylevel': 0.09471488280891366, 'depth': 4, 'boosting_type': 'Plain', 'bootstrap_type': 'Bayesian', 'bagging_temperature': 9.788981339448723}. Best is trial 98 with value: 0.8791208791208791.
[32m[I 2023-04-21 01:51:03,107][39m Trial 876 finished with value: 0.8666666666666666 and parameters: {'objective': 'Logloss', 'colsample_bylevel': 0.08272251073822097, 'depth': 3, 'boosting_type': 'Plain', 'bootstrap_type': 'Bayesian', 'bagging_temperature': 9.634713381443772}. Best is trial 98 with value: 0.8791208791208791.
[32m[I 2023-04-21 01:51:03,951][39m Trial 877 finished with value: 0.8539325842696629 and parameters: {'objective': 'CrossEntropy', 'colsample_bylevel': 0.0886624043372854, 'depth': 2, 'boosting_type': 'Plain', 'bootstrap_type': 'Bayesian', 'bagging_temperature': 8.932348838354397}. Best is trial 98 with value: 0.8791208791208791.
[32m[I 2023-04-21 01:51:05,293][39m Trial 878 finished with value: 0.8314606741573034 and parameters: {'objective': 'Logloss', 'colsample_bylevel': 0.08438406551264747, 'depth': 9, 'boosting_type': 'Plain', 'bootstrap_type': 'Bayesian', 'bagging_temperature': 0.36624498357755186}. Best is trial 98 with value: 0.8791208791208791.
[32m[I 2023-04-21 01:51:06,217][39m Trial 879 finished with value: 0.8314606741573034 and parameters: {'objective': 'CrossEntropy', 'colsample_bylevel': 0.07967633857421069, 'depth': 3, 'boosting_type': 'Plain', 'bootstrap_type': 'MVS'}. Best is trial 98 with value: 0.8791208791208791.
[32m[I 2023-04-21 01:51:06,806][39m Trial 880 finished with value: 0.8539325842696629 and parameters: {'objective': 'CrossEntropy', 'colsample_bylevel': 0.07759001526046015, 'depth': 3, 'boosting_type': 'Plain', 'bootstrap_type': 'Bayesian', 'bagging_temperature': 9.45433479341637}. Best is trial 98 with value: 0.8791208791208791.
[32m[I 2023-04-21 01:51:07,976][39m Trial 881 finished with value: 0.8791208791208791 and parameters: {'objective': 'CrossEntropy', 'colsample_bylevel': 0.09334667451045656, 'depth': 3, 'boosting_type': 'Plain', 'bootstrap_type': 'Bayesian', 'bagging_temperature': 8.856781970557785}. Best is trial 98 with value: 0.8791208791208791.
[32m[I 2023-04-21 01:51:08,722][39m Trial 882 finished with value: 0.8791208791208791 and parameters: {'objective': 'CrossEntropy', 'colsample_bylevel': 0.09295819712792994, 'depth': 3, 'boosting_type': 'Plain', 'bootstrap_type': 'Bayesian', 'bagging_temperature': 8.659931825084664}. Best is trial 98 with value: 0.8791208791208791.
[32m[I 2023-04-21 01:51:09,767][39m Trial 883 finished with value: 0.8275862068965518 and parameters: {'objective': 'CrossEntropy', 'colsample_bylevel': 0.09383723986092118, 'depth': 3, 'boosting_type': 'Plain', 'bootstrap_type': 'Bayesian', 'bagging_temperature': 8.384609479767288}. Best is trial 98 with value: 0.8791208791208791.
[32m[I 2023-04-21 01:51:10,681][39m Trial 884 finished with value: 0.8539325842696629 and parameters: {'objective': 'Logloss', 'colsample_bylevel': 0.09391417770750002, 'depth': 3, 'boosting_type': 'Plain', 'bootstrap_type': 'Bayesian', 'bagging_temperature': 8.72099124329892}. Best is trial 98 with value: 0.8791208791208791.
[32m[I 2023-04-21 01:51:11,488][39m Trial 885 finished with value: 0.8666666666666666 and parameters: {'objective': 'CrossEntropy', 'colsample_bylevel': 0.09555502924410861, 'depth': 3, 'boosting_type': 'Plain', 'bootstrap_type': 'Bayesian', 'bagging_temperature': 8.841401573028076}. Best is trial 98 with value: 0.8791208791208791.
[32m[I 2023-04-21 01:51:12,515][39m Trial 886 finished with value: 0.8539325842696629 and parameters: {'objective': 'CrossEntropy', 'colsample_bylevel': 0.09378873787432473, 'depth': 3, 'boosting_type': 'Plain', 'bootstrap_type': 'Bayesian', 'bagging_temperature': 8.529090312953073}. Best is trial 98 with value: 0.8791208791208791.
[32m[I 2023-04-21 01:51:13,515][39m Trial 887 finished with value: 0.8539325842696629 and parameters: {'objective': 'CrossEntropy', 'colsample_bylevel': 0.07613773875938211, 'depth': 4, 'boosting_type': 'Plain', 'bootstrap_type': 'Bayesian', 'bagging_temperature': 9.777242075126905}. Best is trial 98 with value: 0.8791208791208791.
[32m[I 2023-04-21 01:51:14,405][39m Trial 888 finished with value: 0.8409090909090909 and parameters: {'objective': 'CrossEntropy', 'colsample_bylevel': 0.043308694876054044, 'depth': 3, 'boosting_type': 'Plain', 'bootstrap_type': 'Bayesian', 'bagging_temperature': 8.577726265770515}. Best is trial 98 with value: 0.8791208791208791.
[32m[I 2023-04-21 01:51:15,009][39m Trial 889 finished with value: 0.8275862068965518 and parameters: {'objective': 'CrossEntropy', 'colsample_bylevel': 0.09259415497137702, 'depth': 4, 'boosting_type': 'Plain', 'bootstrap_type': 'Bayesian', 'bagging_temperature': 8.798510687589268}. Best is trial 98 with value: 0.8791208791208791.
[32m[I 2023-04-21 01:51:16,097][39m Trial 890 finished with value: 0.8444444444444446 and parameters: {'objective': 'CrossEntropy', 'colsample_bylevel': 0.09728579774093636, 'depth': 3, 'boosting_type': 'Plain', 'bootstrap_type': 'Bayesian', 'bagging_temperature': 6.828971251355555}. Best is trial 98 with value: 0.8791208791208791.
[32m[I 2023-04-21 01:51:20,991][39m Trial 891 finished with value: 0.8666666666666666 and parameters: {'objective': 'CrossEntropy', 'colsample_bylevel': 0.09346960553665033, 'depth': 3, 'boosting_type': 'Ordered', 'bootstrap_type': 'Bayesian', 'bagging_temperature': 9.004762336825276}. Best is trial 98 with value: 0.8791208791208791.
[32m[I 2023-04-21 01:51:22,216][39m Trial 892 finished with value: 0.8539325842696629 and parameters: {'objective': 'CrossEntropy', 'colsample_bylevel': 0.0933790928217508, 'depth': 3, 'boosting_type': 'Plain', 'bootstrap_type': 'Bayesian', 'bagging_temperature': 8.924566399919348}. Best is trial 98 with value: 0.8791208791208791.
[32m[I 2023-04-21 01:51:22,938][39m Trial 893 finished with value: 0.8666666666666666 and parameters: {'objective': 'CrossEntropy', 'colsample_bylevel': 0.09261365206358474, 'depth': 3, 'boosting_type': 'Plain', 'bootstrap_type': 'Bayesian', 'bagging_temperature': 8.077106634447695}. Best is trial 98 with value: 0.8791208791208791.
[32m[I 2023-04-21 01:51:23,957][39m Trial 894 finished with value: 0.8275862068965518 and parameters: {'objective': 'CrossEntropy', 'colsample_bylevel': 0.09680780687404089, 'depth': 3, 'boosting_type': 'Plain', 'bootstrap_type': 'Bayesian', 'bagging_temperature': 9.05031014509339}. Best is trial 98 with value: 0.8791208791208791.
[32m[I 2023-04-21 01:51:24,890][39m Trial 895 finished with value: 0.8539325842696629 and parameters: {'objective': 'CrossEntropy', 'colsample_bylevel': 0.08754830734596, 'depth': 4, 'boosting_type': 'Plain', 'bootstrap_type': 'Bayesian', 'bagging_temperature': 8.77106736688167}. Best is trial 98 with value: 0.8791208791208791.
[32m[I 2023-04-21 01:51:25,850][39m Trial 896 finished with value: 0.8275862068965518 and parameters: {'objective': 'CrossEntropy', 'colsample_bylevel': 0.0925354642571086, 'depth': 3, 'boosting_type': 'Plain', 'bootstrap_type': 'Bayesian', 'bagging_temperature': 8.707100683601912}. Best is trial 98 with value: 0.8791208791208791.
[32m[I 2023-04-21 01:51:26,704][39m Trial 897 finished with value: 0.8505747126436782 and parameters: {'objective': 'CrossEntropy', 'colsample_bylevel': 0.09550590824227137, 'depth': 3, 'boosting_type': 'Plain', 'bootstrap_type': 'Bernoulli', 'subsample': 0.747495071734689}. Best is trial 98 with value: 0.8791208791208791.
[32m[I 2023-04-21 01:51:27,581][39m Trial 898 finished with value: 0.8791208791208791 and parameters: {'objective': 'CrossEntropy', 'colsample_bylevel': 0.08031871405558816, 'depth': 3, 'boosting_type': 'Plain', 'bootstrap_type': 'Bayesian', 'bagging_temperature': 9.351017020228534}. Best is trial 98 with value: 0.8791208791208791.
[32m[I 2023-04-21 01:51:28,474][39m Trial 899 finished with value: 0.8666666666666666 and parameters: {'objective': 'CrossEntropy', 'colsample_bylevel': 0.08094095166201563, 'depth': 3, 'boosting_type': 'Plain', 'bootstrap_type': 'Bayesian', 'bagging_temperature': 8.704119222432894}. Best is trial 98 with value: 0.8791208791208791.
[32m[I 2023-04-21 01:51:29,066][39m Trial 900 finished with value: 0.8409090909090909 and parameters: {'objective': 'CrossEntropy', 'colsample_bylevel': 0.09551959913326204, 'depth': 3, 'boosting_type': 'Plain', 'bootstrap_type': 'Bayesian', 'bagging_temperature': 8.478068746060549}. Best is trial 98 with value: 0.8791208791208791.
[32m[I 2023-04-21 01:51:30,036][39m Trial 901 finished with value: 0.8275862068965518 and parameters: {'objective': 'CrossEntropy', 'colsample_bylevel': 0.09123131565170724, 'depth': 3, 'boosting_type': 'Plain', 'bootstrap_type': 'Bayesian', 'bagging_temperature': 9.036652890463026}. Best is trial 98 with value: 0.8791208791208791.
[32m[I 2023-04-21 01:51:30,945][39m Trial 902 finished with value: 0.8409090909090909 and parameters: {'objective': 'CrossEntropy', 'colsample_bylevel': 0.09179161122387804, 'depth': 4, 'boosting_type': 'Plain', 'bootstrap_type': 'Bayesian', 'bagging_temperature': 8.875563172689759}. Best is trial 98 with value: 0.8791208791208791.
[32m[I 2023-04-21 01:51:31,804][39m Trial 903 finished with value: 0.8409090909090909 and parameters: {'objective': 'CrossEntropy', 'colsample_bylevel': 0.09390002013728706, 'depth': 3, 'boosting_type': 'Plain', 'bootstrap_type': 'MVS'}. Best is trial 98 with value: 0.8791208791208791.
[32m[I 2023-04-21 01:51:32,798][39m Trial 904 finished with value: 0.8409090909090909 and parameters: {'objective': 'CrossEntropy', 'colsample_bylevel': 0.09081716189215086, 'depth': 3, 'boosting_type': 'Plain', 'bootstrap_type': 'Bayesian', 'bagging_temperature': 9.098726514733453}. Best is trial 98 with value: 0.8791208791208791.
[32m[I 2023-04-21 01:51:33,571][39m Trial 905 finished with value: 0.8409090909090909 and parameters: {'objective': 'CrossEntropy', 'colsample_bylevel': 0.09241704105848109, 'depth': 3, 'boosting_type': 'Plain', 'bootstrap_type': 'Bayesian', 'bagging_temperature': 9.53704509801844}. Best is trial 98 with value: 0.8791208791208791.
[32m[I 2023-04-21 01:51:34,507][39m Trial 906 finished with value: 0.8181818181818182 and parameters: {'objective': 'CrossEntropy', 'colsample_bylevel': 0.09107966960832581, 'depth': 3, 'boosting_type': 'Plain', 'bootstrap_type': 'Bayesian', 'bagging_temperature': 6.482992056226326}. Best is trial 98 with value: 0.8791208791208791.
[32m[I 2023-04-21 01:51:35,467][39m Trial 907 finished with value: 0.8666666666666666 and parameters: {'objective': 'CrossEntropy', 'colsample_bylevel': 0.09475183010727087, 'depth': 3, 'boosting_type': 'Plain', 'bootstrap_type': 'Bayesian', 'bagging_temperature': 9.755123502276223}. Best is trial 98 with value: 0.8791208791208791.
[32m[I 2023-04-21 01:51:36,432][39m Trial 908 finished with value: 0.8539325842696629 and parameters: {'objective': 'CrossEntropy', 'colsample_bylevel': 0.08984294292741829, 'depth': 3, 'boosting_type': 'Plain', 'bootstrap_type': 'Bayesian', 'bagging_temperature': 8.135796035016698}. Best is trial 98 with value: 0.8791208791208791.
[32m[I 2023-04-21 01:51:37,098][39m Trial 909 finished with value: 0.8539325842696629 and parameters: {'objective': 'CrossEntropy', 'colsample_bylevel': 0.07517571481351595, 'depth': 3, 'boosting_type': 'Plain', 'bootstrap_type': 'Bayesian', 'bagging_temperature': 9.791132224698734}. Best is trial 98 with value: 0.8791208791208791.
[32m[I 2023-04-21 01:51:42,226][39m Trial 910 finished with value: 0.8275862068965518 and parameters: {'objective': 'CrossEntropy', 'colsample_bylevel': 0.0789254788193242, 'depth': 4, 'boosting_type': 'Ordered', 'bootstrap_type': 'Bayesian', 'bagging_temperature': 9.381335469629414}. Best is trial 98 with value: 0.8791208791208791.
[32m[I 2023-04-21 01:51:43,129][39m Trial 911 finished with value: 0.8666666666666666 and parameters: {'objective': 'CrossEntropy', 'colsample_bylevel': 0.07873560076793536, 'depth': 3, 'boosting_type': 'Plain', 'bootstrap_type': 'Bayesian', 'bagging_temperature': 8.50174376507567}. Best is trial 98 with value: 0.8791208791208791.
[32m[I 2023-04-21 01:51:44,054][39m Trial 912 finished with value: 0.8666666666666666 and parameters: {'objective': 'CrossEntropy', 'colsample_bylevel': 0.09134096406673882, 'depth': 3, 'boosting_type': 'Plain', 'bootstrap_type': 'Bayesian', 'bagging_temperature': 9.206868267548149}. Best is trial 98 with value: 0.8791208791208791.
[32m[I 2023-04-21 01:51:44,856][39m Trial 913 finished with value: 0.8409090909090909 and parameters: {'objective': 'CrossEntropy', 'colsample_bylevel': 0.07478809635099097, 'depth': 3, 'boosting_type': 'Plain', 'bootstrap_type': 'Bayesian', 'bagging_temperature': 9.97813123421221}. Best is trial 98 with value: 0.8791208791208791.
[32m[I 2023-04-21 01:51:45,495][39m Trial 914 finished with value: 0.8539325842696629 and parameters: {'objective': 'CrossEntropy', 'colsample_bylevel': 0.09481099350611273, 'depth': 3, 'boosting_type': 'Plain', 'bootstrap_type': 'Bayesian', 'bagging_temperature': 9.344324687300217}. Best is trial 98 with value: 0.8791208791208791.
[32m[I 2023-04-21 01:51:46,538][39m Trial 915 finished with value: 0.8275862068965518 and parameters: {'objective': 'CrossEntropy', 'colsample_bylevel': 0.09690694237378178, 'depth': 4, 'boosting_type': 'Plain', 'bootstrap_type': 'Bayesian', 'bagging_temperature': 9.409431213881668}. Best is trial 98 with value: 0.8791208791208791.
[32m[I 2023-04-21 01:51:47,527][39m Trial 916 finished with value: 0.8139534883720929 and parameters: {'objective': 'CrossEntropy', 'colsample_bylevel': 0.07950688120966519, 'depth': 3, 'boosting_type': 'Plain', 'bootstrap_type': 'Bayesian', 'bagging_temperature': 7.838484018861468}. Best is trial 98 with value: 0.8791208791208791.
[32m[I 2023-04-21 01:51:48,506][39m Trial 917 finished with value: 0.8666666666666666 and parameters: {'objective': 'CrossEntropy', 'colsample_bylevel': 0.09793793437845695, 'depth': 3, 'boosting_type': 'Plain', 'bootstrap_type': 'Bayesian', 'bagging_temperature': 9.719708703505157}. Best is trial 98 with value: 0.8791208791208791.
[32m[I 2023-04-21 01:51:49,204][39m Trial 918 finished with value: 0.8409090909090909 and parameters: {'objective': 'CrossEntropy', 'colsample_bylevel': 0.08887983804259274, 'depth': 3, 'boosting_type': 'Plain', 'bootstrap_type': 'Bayesian', 'bagging_temperature': 9.24602106753586}. Best is trial 98 with value: 0.8791208791208791.
[32m[I 2023-04-21 01:51:49,935][39m Trial 919 finished with value: 0.8409090909090909 and parameters: {'objective': 'CrossEntropy', 'colsample_bylevel': 0.09655482848291548, 'depth': 3, 'boosting_type': 'Plain', 'bootstrap_type': 'Bayesian', 'bagging_temperature': 2.6335507494925974}. Best is trial 98 with value: 0.8791208791208791.
[32m[I 2023-04-21 01:51:50,966][39m Trial 920 finished with value: 0.8409090909090909 and parameters: {'objective': 'CrossEntropy', 'colsample_bylevel': 0.08662894983722612, 'depth': 3, 'boosting_type': 'Plain', 'bootstrap_type': 'Bernoulli', 'subsample': 0.41352643664876154}. Best is trial 98 with value: 0.8791208791208791.
[32m[I 2023-04-21 01:51:51,820][39m Trial 921 finished with value: 0.8505747126436782 and parameters: {'objective': 'CrossEntropy', 'colsample_bylevel': 0.09844956952009953, 'depth': 8, 'boosting_type': 'Plain', 'bootstrap_type': 'Bayesian', 'bagging_temperature': 9.100177560365918}. Best is trial 98 with value: 0.8791208791208791.
[32m[I 2023-04-21 01:51:53,097][39m Trial 922 finished with value: 0.8791208791208791 and parameters: {'objective': 'CrossEntropy', 'colsample_bylevel': 0.07678903812164121, 'depth': 3, 'boosting_type': 'Plain', 'bootstrap_type': 'Bayesian', 'bagging_temperature': 9.972348043943498}. Best is trial 98 with value: 0.8791208791208791.
[32m[I 2023-04-21 01:51:53,706][39m Trial 923 finished with value: 0.7999999999999999 and parameters: {'objective': 'CrossEntropy', 'colsample_bylevel': 0.035209644417031435, 'depth': 4, 'boosting_type': 'Plain', 'bootstrap_type': 'Bayesian', 'bagging_temperature': 9.984011176717804}. Best is trial 98 with value: 0.8791208791208791.
[32m[I 2023-04-21 01:51:54,735][39m Trial 924 finished with value: 0.8539325842696629 and parameters: {'objective': 'CrossEntropy', 'colsample_bylevel': 0.06933521136009142, 'depth': 3, 'boosting_type': 'Plain', 'bootstrap_type': 'Bayesian', 'bagging_temperature': 8.90860569821557}. Best is trial 98 with value: 0.8791208791208791.
[32m[I 2023-04-21 01:51:55,501][39m Trial 925 finished with value: 0.8275862068965518 and parameters: {'objective': 'CrossEntropy', 'colsample_bylevel': 0.0902243607389794, 'depth': 3, 'boosting_type': 'Plain', 'bootstrap_type': 'MVS'}. Best is trial 98 with value: 0.8791208791208791.
