[32m[I 2023-04-21 02:17:42,573][39m Trial 2313 finished with value: 0.8275862068965518 and parameters: {'objective': 'CrossEntropy', 'colsample_bylevel': 0.07714528618190053, 'depth': 3, 'boosting_type': 'Ordered', 'bootstrap_type': 'Bayesian', 'bagging_temperature': 9.299247867703773}. Best is trial 98 with value: 0.8791208791208791.
[32m[I 2023-04-21 02:17:43,630][39m Trial 2314 finished with value: 0.8275862068965518 and parameters: {'objective': 'Logloss', 'colsample_bylevel': 0.07508649090483355, 'depth': 10, 'boosting_type': 'Plain', 'bootstrap_type': 'Bayesian', 'bagging_temperature': 9.359490323583987}. Best is trial 98 with value: 0.8791208791208791.
[32m[I 2023-04-21 02:17:44,761][39m Trial 2315 finished with value: 0.8539325842696629 and parameters: {'objective': 'CrossEntropy', 'colsample_bylevel': 0.07528599355502343, 'depth': 4, 'boosting_type': 'Plain', 'bootstrap_type': 'Bayesian', 'bagging_temperature': 8.799928120788847}. Best is trial 98 with value: 0.8791208791208791.
[32m[I 2023-04-21 02:17:45,496][39m Trial 2316 finished with value: 0.8409090909090909 and parameters: {'objective': 'CrossEntropy', 'colsample_bylevel': 0.08096250834411343, 'depth': 11, 'boosting_type': 'Plain', 'bootstrap_type': 'Bayesian', 'bagging_temperature': 9.250784410814406}. Best is trial 98 with value: 0.8791208791208791.
[32m[I 2023-04-21 02:17:46,352][39m Trial 2317 finished with value: 0.8539325842696629 and parameters: {'objective': 'Logloss', 'colsample_bylevel': 0.08382942015316339, 'depth': 3, 'boosting_type': 'Plain', 'bootstrap_type': 'Bayesian', 'bagging_temperature': 8.332676113538863}. Best is trial 98 with value: 0.8791208791208791.
[32m[I 2023-04-21 02:17:47,246][39m Trial 2318 finished with value: 0.8275862068965518 and parameters: {'objective': 'CrossEntropy', 'colsample_bylevel': 0.04654461064010888, 'depth': 3, 'boosting_type': 'Plain', 'bootstrap_type': 'Bayesian', 'bagging_temperature': 4.5459876723211545}. Best is trial 98 with value: 0.8791208791208791.
[32m[I 2023-04-21 02:17:48,202][39m Trial 2319 finished with value: 0.8409090909090909 and parameters: {'objective': 'CrossEntropy', 'colsample_bylevel': 0.08095632089960372, 'depth': 3, 'boosting_type': 'Plain', 'bootstrap_type': 'Bayesian', 'bagging_temperature': 3.395761930992754}. Best is trial 98 with value: 0.8791208791208791.
[32m[I 2023-04-21 02:17:49,337][39m Trial 2320 finished with value: 0.8666666666666666 and parameters: {'objective': 'Logloss', 'colsample_bylevel': 0.07341216804036604, 'depth': 5, 'boosting_type': 'Plain', 'bootstrap_type': 'Bayesian', 'bagging_temperature': 8.865226530851093}. Best is trial 98 with value: 0.8791208791208791.
[32m[I 2023-04-21 02:17:50,403][39m Trial 2321 finished with value: 0.8539325842696629 and parameters: {'objective': 'CrossEntropy', 'colsample_bylevel': 0.07297875077190935, 'depth': 4, 'boosting_type': 'Plain', 'bootstrap_type': 'Bayesian', 'bagging_temperature': 5.538349867033406}. Best is trial 98 with value: 0.8791208791208791.
[32m[I 2023-04-21 02:17:51,631][39m Trial 2322 finished with value: 0.8372093023255814 and parameters: {'objective': 'CrossEntropy', 'colsample_bylevel': 0.08441493158972796, 'depth': 7, 'boosting_type': 'Plain', 'bootstrap_type': 'Bayesian', 'bagging_temperature': 9.092142905333905}. Best is trial 98 with value: 0.8791208791208791.
[32m[I 2023-04-21 02:17:52,302][39m Trial 2323 finished with value: 0.8539325842696629 and parameters: {'objective': 'CrossEntropy', 'colsample_bylevel': 0.07439800790831534, 'depth': 6, 'boosting_type': 'Plain', 'bootstrap_type': 'Bayesian', 'bagging_temperature': 7.876466511525423}. Best is trial 98 with value: 0.8791208791208791.
[32m[I 2023-04-21 02:17:52,933][39m Trial 2324 finished with value: 0.8372093023255814 and parameters: {'objective': 'CrossEntropy', 'colsample_bylevel': 0.08168845422328982, 'depth': 11, 'boosting_type': 'Plain', 'bootstrap_type': 'Bayesian', 'bagging_temperature': 9.102683444806994}. Best is trial 98 with value: 0.8791208791208791.
[32m[I 2023-04-21 02:17:53,630][39m Trial 2325 finished with value: 0.8636363636363636 and parameters: {'objective': 'CrossEntropy', 'colsample_bylevel': 0.08015594737130796, 'depth': 2, 'boosting_type': 'Plain', 'bootstrap_type': 'Bayesian', 'bagging_temperature': 9.85066541215701}. Best is trial 98 with value: 0.8791208791208791.
[32m[I 2023-04-21 02:17:54,858][39m Trial 2326 finished with value: 0.8275862068965518 and parameters: {'objective': 'CrossEntropy', 'colsample_bylevel': 0.05066092129588502, 'depth': 4, 'boosting_type': 'Plain', 'bootstrap_type': 'Bayesian', 'bagging_temperature': 8.346730653041067}. Best is trial 98 with value: 0.8791208791208791.
[32m[I 2023-04-21 02:17:55,552][39m Trial 2327 finished with value: 0.8275862068965518 and parameters: {'objective': 'CrossEntropy', 'colsample_bylevel': 0.07829630955344656, 'depth': 4, 'boosting_type': 'Plain', 'bootstrap_type': 'MVS'}. Best is trial 98 with value: 0.8791208791208791.
[32m[I 2023-04-21 02:17:56,412][39m Trial 2328 finished with value: 0.8275862068965518 and parameters: {'objective': 'CrossEntropy', 'colsample_bylevel': 0.08548530660987336, 'depth': 3, 'boosting_type': 'Plain', 'bootstrap_type': 'Bayesian', 'bagging_temperature': 9.644532068770326}. Best is trial 98 with value: 0.8791208791208791.
[32m[I 2023-04-21 02:17:57,644][39m Trial 2329 finished with value: 0.8764044943820225 and parameters: {'objective': 'CrossEntropy', 'colsample_bylevel': 0.08997019794343245, 'depth': 3, 'boosting_type': 'Plain', 'bootstrap_type': 'Bayesian', 'bagging_temperature': 9.794315116602}. Best is trial 98 with value: 0.8791208791208791.
[32m[I 2023-04-21 02:18:02,942][39m Trial 2330 finished with value: 0.8131868131868132 and parameters: {'objective': 'Logloss', 'colsample_bylevel': 0.09440077956524251, 'depth': 5, 'boosting_type': 'Ordered', 'bootstrap_type': 'MVS'}. Best is trial 98 with value: 0.8791208791208791.
[32m[I 2023-04-21 02:18:03,845][39m Trial 2331 finished with value: 0.8539325842696629 and parameters: {'objective': 'Logloss', 'colsample_bylevel': 0.06767218022334176, 'depth': 4, 'boosting_type': 'Plain', 'bootstrap_type': 'Bayesian', 'bagging_temperature': 9.967346301684842}. Best is trial 98 with value: 0.8791208791208791.
[32m[I 2023-04-21 02:18:04,844][39m Trial 2332 finished with value: 0.8539325842696629 and parameters: {'objective': 'Logloss', 'colsample_bylevel': 0.07276738942707761, 'depth': 11, 'boosting_type': 'Plain', 'bootstrap_type': 'Bayesian', 'bagging_temperature': 9.978941419012958}. Best is trial 98 with value: 0.8791208791208791.
[32m[I 2023-04-21 02:18:05,926][39m Trial 2333 finished with value: 0.8666666666666666 and parameters: {'objective': 'Logloss', 'colsample_bylevel': 0.07433972521491176, 'depth': 11, 'boosting_type': 'Plain', 'bootstrap_type': 'Bayesian', 'bagging_temperature': 9.851718506238525}. Best is trial 98 with value: 0.8791208791208791.
[32m[I 2023-04-21 02:18:06,604][39m Trial 2334 finished with value: 0.8409090909090909 and parameters: {'objective': 'CrossEntropy', 'colsample_bylevel': 0.07368028363172169, 'depth': 10, 'boosting_type': 'Plain', 'bootstrap_type': 'Bernoulli', 'subsample': 0.8854039426829036}. Best is trial 98 with value: 0.8791208791208791.
[32m[I 2023-04-21 02:18:07,458][39m Trial 2335 finished with value: 0.8539325842696629 and parameters: {'objective': 'CrossEntropy', 'colsample_bylevel': 0.08133876715499343, 'depth': 3, 'boosting_type': 'Plain', 'bootstrap_type': 'Bayesian', 'bagging_temperature': 8.45692484567441}. Best is trial 98 with value: 0.8791208791208791.
[32m[I 2023-04-21 02:18:08,420][39m Trial 2336 finished with value: 0.8275862068965518 and parameters: {'objective': 'CrossEntropy', 'colsample_bylevel': 0.0770422530596811, 'depth': 4, 'boosting_type': 'Plain', 'bootstrap_type': 'Bayesian', 'bagging_temperature': 6.56018128039654}. Best is trial 98 with value: 0.8791208791208791.
[32m[I 2023-04-21 02:18:09,327][39m Trial 2337 finished with value: 0.8666666666666666 and parameters: {'objective': 'CrossEntropy', 'colsample_bylevel': 0.06376424068030194, 'depth': 4, 'boosting_type': 'Plain', 'bootstrap_type': 'Bayesian', 'bagging_temperature': 8.76271026617295}. Best is trial 98 with value: 0.8791208791208791.
[32m[I 2023-04-21 02:18:10,274][39m Trial 2338 finished with value: 0.8539325842696629 and parameters: {'objective': 'CrossEntropy', 'colsample_bylevel': 0.08342414286248008, 'depth': 3, 'boosting_type': 'Plain', 'bootstrap_type': 'Bayesian', 'bagging_temperature': 8.67586040632728}. Best is trial 98 with value: 0.8791208791208791.
[32m[I 2023-04-21 02:18:11,408][39m Trial 2339 finished with value: 0.8636363636363636 and parameters: {'objective': 'CrossEntropy', 'colsample_bylevel': 0.0867903205351205, 'depth': 2, 'boosting_type': 'Plain', 'bootstrap_type': 'Bayesian', 'bagging_temperature': 9.62104434415382}. Best is trial 98 with value: 0.8791208791208791.
[32m[I 2023-04-21 02:18:12,423][39m Trial 2340 finished with value: 0.8409090909090909 and parameters: {'objective': 'Logloss', 'colsample_bylevel': 0.07627665779555011, 'depth': 5, 'boosting_type': 'Plain', 'bootstrap_type': 'Bayesian', 'bagging_temperature': 9.532968423629173}. Best is trial 98 with value: 0.8791208791208791.
[32m[I 2023-04-21 02:18:13,017][39m Trial 2341 finished with value: 0.8539325842696629 and parameters: {'objective': 'Logloss', 'colsample_bylevel': 0.07696261415879488, 'depth': 4, 'boosting_type': 'Plain', 'bootstrap_type': 'Bayesian', 'bagging_temperature': 9.383158651373687}. Best is trial 98 with value: 0.8791208791208791.
[32m[I 2023-04-21 02:18:13,791][39m Trial 2342 finished with value: 0.8666666666666666 and parameters: {'objective': 'CrossEntropy', 'colsample_bylevel': 0.09312264480120208, 'depth': 3, 'boosting_type': 'Plain', 'bootstrap_type': 'Bayesian', 'bagging_temperature': 8.871668022001618}. Best is trial 98 with value: 0.8791208791208791.
[32m[I 2023-04-21 02:18:14,680][39m Trial 2343 finished with value: 0.8372093023255814 and parameters: {'objective': 'CrossEntropy', 'colsample_bylevel': 0.08286372660870661, 'depth': 11, 'boosting_type': 'Plain', 'bootstrap_type': 'Bayesian', 'bagging_temperature': 9.174873359380381}. Best is trial 98 with value: 0.8791208791208791.
[32m[I 2023-04-21 02:18:15,695][39m Trial 2344 finished with value: 0.8275862068965518 and parameters: {'objective': 'CrossEntropy', 'colsample_bylevel': 0.06762066362209941, 'depth': 12, 'boosting_type': 'Plain', 'bootstrap_type': 'MVS'}. Best is trial 98 with value: 0.8791208791208791.
[32m[I 2023-04-21 02:18:17,158][39m Trial 2345 finished with value: 0.8139534883720929 and parameters: {'objective': 'CrossEntropy', 'colsample_bylevel': 0.08213601525098077, 'depth': 9, 'boosting_type': 'Plain', 'bootstrap_type': 'Bayesian', 'bagging_temperature': 7.8462392384852695}. Best is trial 98 with value: 0.8791208791208791.
[32m[I 2023-04-21 02:18:18,366][39m Trial 2346 finished with value: 0.8095238095238095 and parameters: {'objective': 'CrossEntropy', 'colsample_bylevel': 0.0710551527820415, 'depth': 4, 'boosting_type': 'Plain', 'bootstrap_type': 'Bayesian', 'bagging_temperature': 9.472068160111892}. Best is trial 98 with value: 0.8791208791208791.
[32m[I 2023-04-21 02:18:19,012][39m Trial 2347 finished with value: 0.8539325842696629 and parameters: {'objective': 'Logloss', 'colsample_bylevel': 0.08096050706321933, 'depth': 4, 'boosting_type': 'Plain', 'bootstrap_type': 'Bayesian', 'bagging_temperature': 8.89495919044428}. Best is trial 98 with value: 0.8791208791208791.
[32m[I 2023-04-21 02:18:19,775][39m Trial 2348 finished with value: 0.8539325842696629 and parameters: {'objective': 'Logloss', 'colsample_bylevel': 0.071640897448299, 'depth': 11, 'boosting_type': 'Plain', 'bootstrap_type': 'Bayesian', 'bagging_temperature': 9.55543776664229}. Best is trial 98 with value: 0.8791208791208791.
[32m[I 2023-04-21 02:18:20,587][39m Trial 2349 finished with value: 0.8409090909090909 and parameters: {'objective': 'CrossEntropy', 'colsample_bylevel': 0.0988802030631375, 'depth': 3, 'boosting_type': 'Plain', 'bootstrap_type': 'Bayesian', 'bagging_temperature': 8.85106364993671}. Best is trial 98 with value: 0.8791208791208791.
[32m[I 2023-04-21 02:18:25,306][39m Trial 2350 finished with value: 0.8409090909090909 and parameters: {'objective': 'CrossEntropy', 'colsample_bylevel': 0.08302993432073709, 'depth': 3, 'boosting_type': 'Ordered', 'bootstrap_type': 'Bayesian', 'bagging_temperature': 8.718884167764891}. Best is trial 98 with value: 0.8791208791208791.
[32m[I 2023-04-21 02:18:26,247][39m Trial 2351 finished with value: 0.8636363636363636 and parameters: {'objective': 'CrossEntropy', 'colsample_bylevel': 0.08637403475403371, 'depth': 2, 'boosting_type': 'Plain', 'bootstrap_type': 'Bayesian', 'bagging_temperature': 8.486582824971826}. Best is trial 98 with value: 0.8791208791208791.
[32m[I 2023-04-21 02:18:27,225][39m Trial 2352 finished with value: 0.8539325842696629 and parameters: {'objective': 'CrossEntropy', 'colsample_bylevel': 0.07550786982058481, 'depth': 12, 'boosting_type': 'Plain', 'bootstrap_type': 'Bayesian', 'bagging_temperature': 9.656077436223867}. Best is trial 98 with value: 0.8791208791208791.
[32m[I 2023-04-21 02:18:28,150][39m Trial 2353 finished with value: 0.8275862068965518 and parameters: {'objective': 'CrossEntropy', 'colsample_bylevel': 0.08843322755524462, 'depth': 5, 'boosting_type': 'Plain', 'bootstrap_type': 'Bayesian', 'bagging_temperature': 9.360427302902512}. Best is trial 98 with value: 0.8791208791208791.
[32m[I 2023-04-21 02:18:29,288][39m Trial 2354 finished with value: 0.8409090909090909 and parameters: {'objective': 'CrossEntropy', 'colsample_bylevel': 0.09723657223863406, 'depth': 3, 'boosting_type': 'Plain', 'bootstrap_type': 'Bernoulli', 'subsample': 0.5815535815251488}. Best is trial 98 with value: 0.8791208791208791.
[32m[I 2023-04-21 02:18:30,366][39m Trial 2355 finished with value: 0.8409090909090909 and parameters: {'objective': 'CrossEntropy', 'colsample_bylevel': 0.07712855190282732, 'depth': 10, 'boosting_type': 'Plain', 'bootstrap_type': 'Bayesian', 'bagging_temperature': 7.677797714059341}. Best is trial 98 with value: 0.8791208791208791.
[32m[I 2023-04-21 02:18:31,398][39m Trial 2356 finished with value: 0.8791208791208791 and parameters: {'objective': 'CrossEntropy', 'colsample_bylevel': 0.08071687070021769, 'depth': 3, 'boosting_type': 'Plain', 'bootstrap_type': 'Bayesian', 'bagging_temperature': 9.549950504879229}. Best is trial 98 with value: 0.8791208791208791.
[32m[I 2023-04-21 02:18:32,561][39m Trial 2357 finished with value: 0.7999999999999999 and parameters: {'objective': 'CrossEntropy', 'colsample_bylevel': 0.08435303064245152, 'depth': 8, 'boosting_type': 'Plain', 'bootstrap_type': 'MVS'}. Best is trial 98 with value: 0.8791208791208791.
[32m[I 2023-04-21 02:18:33,194][39m Trial 2358 finished with value: 0.8539325842696629 and parameters: {'objective': 'Logloss', 'colsample_bylevel': 0.06954681982025751, 'depth': 11, 'boosting_type': 'Plain', 'bootstrap_type': 'Bayesian', 'bagging_temperature': 0.26591133613271456}. Best is trial 98 with value: 0.8791208791208791.
[32m[I 2023-04-21 02:18:33,849][39m Trial 2359 finished with value: 0.8409090909090909 and parameters: {'objective': 'CrossEntropy', 'colsample_bylevel': 0.08218016571301716, 'depth': 3, 'boosting_type': 'Plain', 'bootstrap_type': 'Bayesian', 'bagging_temperature': 8.670170665161795}. Best is trial 98 with value: 0.8791208791208791.
[32m[I 2023-04-21 02:18:34,686][39m Trial 2360 finished with value: 0.8409090909090909 and parameters: {'objective': 'CrossEntropy', 'colsample_bylevel': 0.0817262369687826, 'depth': 3, 'boosting_type': 'Plain', 'bootstrap_type': 'Bayesian', 'bagging_temperature': 8.915655956015401}. Best is trial 98 with value: 0.8791208791208791.
[32m[I 2023-04-21 02:18:35,479][39m Trial 2361 finished with value: 0.8791208791208791 and parameters: {'objective': 'CrossEntropy', 'colsample_bylevel': 0.07704756379087929, 'depth': 9, 'boosting_type': 'Plain', 'bootstrap_type': 'Bayesian', 'bagging_temperature': 9.643712246643872}. Best is trial 98 with value: 0.8791208791208791.
[32m[I 2023-04-21 02:18:36,728][39m Trial 2362 finished with value: 0.8666666666666666 and parameters: {'objective': 'CrossEntropy', 'colsample_bylevel': 0.07810286123356949, 'depth': 9, 'boosting_type': 'Plain', 'bootstrap_type': 'Bayesian', 'bagging_temperature': 9.308659634599561}. Best is trial 98 with value: 0.8791208791208791.
[32m[I 2023-04-21 02:18:37,776][39m Trial 2363 finished with value: 0.8409090909090909 and parameters: {'objective': 'CrossEntropy', 'colsample_bylevel': 0.05827479724283182, 'depth': 3, 'boosting_type': 'Plain', 'bootstrap_type': 'Bayesian', 'bagging_temperature': 8.604599415602522}. Best is trial 98 with value: 0.8791208791208791.
[32m[I 2023-04-21 02:18:39,064][39m Trial 2364 finished with value: 0.8505747126436782 and parameters: {'objective': 'CrossEntropy', 'colsample_bylevel': 0.09614694779888468, 'depth': 9, 'boosting_type': 'Plain', 'bootstrap_type': 'Bayesian', 'bagging_temperature': 9.033471834424134}. Best is trial 98 with value: 0.8791208791208791.
[32m[I 2023-04-21 02:18:39,648][39m Trial 2365 finished with value: 0.8539325842696629 and parameters: {'objective': 'CrossEntropy', 'colsample_bylevel': 0.06675606483849633, 'depth': 3, 'boosting_type': 'Plain', 'bootstrap_type': 'Bayesian', 'bagging_temperature': 9.443231332657476}. Best is trial 98 with value: 0.8791208791208791.
[32m[I 2023-04-21 02:18:40,254][39m Trial 2366 finished with value: 0.8791208791208791 and parameters: {'objective': 'CrossEntropy', 'colsample_bylevel': 0.07574576339415899, 'depth': 10, 'boosting_type': 'Plain', 'bootstrap_type': 'Bayesian', 'bagging_temperature': 8.385099933077237}. Best is trial 98 with value: 0.8791208791208791.
[32m[I 2023-04-21 02:18:41,366][39m Trial 2367 finished with value: 0.8636363636363636 and parameters: {'objective': 'CrossEntropy', 'colsample_bylevel': 0.0923726143174034, 'depth': 5, 'boosting_type': 'Plain', 'bootstrap_type': 'MVS'}. Best is trial 98 with value: 0.8791208791208791.
[32m[I 2023-04-21 02:18:42,671][39m Trial 2368 finished with value: 0.8539325842696629 and parameters: {'objective': 'CrossEntropy', 'colsample_bylevel': 0.07997644745291609, 'depth': 3, 'boosting_type': 'Plain', 'bootstrap_type': 'Bayesian', 'bagging_temperature': 8.33912989263694}. Best is trial 98 with value: 0.8791208791208791.
[32m[I 2023-04-21 02:18:47,453][39m Trial 2369 finished with value: 0.8666666666666666 and parameters: {'objective': 'CrossEntropy', 'colsample_bylevel': 0.09925616023429776, 'depth': 3, 'boosting_type': 'Ordered', 'bootstrap_type': 'Bayesian', 'bagging_temperature': 9.650048852809135}. Best is trial 98 with value: 0.8791208791208791.
[32m[I 2023-04-21 02:18:48,545][39m Trial 2370 finished with value: 0.8409090909090909 and parameters: {'objective': 'Logloss', 'colsample_bylevel': 0.09236048744666496, 'depth': 5, 'boosting_type': 'Plain', 'bootstrap_type': 'Bayesian', 'bagging_temperature': 9.980869432106788}. Best is trial 98 with value: 0.8791208791208791.
[32m[I 2023-04-21 02:18:49,445][39m Trial 2371 finished with value: 0.8666666666666666 and parameters: {'objective': 'Logloss', 'colsample_bylevel': 0.07238919657644488, 'depth': 4, 'boosting_type': 'Plain', 'bootstrap_type': 'Bayesian', 'bagging_temperature': 9.746561436243653}. Best is trial 98 with value: 0.8791208791208791.
[32m[I 2023-04-21 02:18:50,358][39m Trial 2372 finished with value: 0.8666666666666666 and parameters: {'objective': 'CrossEntropy', 'colsample_bylevel': 0.09170985678964397, 'depth': 3, 'boosting_type': 'Plain', 'bootstrap_type': 'Bayesian', 'bagging_temperature': 9.828300543922676}. Best is trial 98 with value: 0.8791208791208791.
[32m[I 2023-04-21 02:18:51,300][39m Trial 2373 finished with value: 0.8409090909090909 and parameters: {'objective': 'Logloss', 'colsample_bylevel': 0.09279752637865411, 'depth': 5, 'boosting_type': 'Plain', 'bootstrap_type': 'Bayesian', 'bagging_temperature': 9.911796660844011}. Best is trial 98 with value: 0.8791208791208791.
[32m[I 2023-04-21 02:18:52,450][39m Trial 2374 finished with value: 0.8409090909090909 and parameters: {'objective': 'CrossEntropy', 'colsample_bylevel': 0.0788481104756516, 'depth': 9, 'boosting_type': 'Plain', 'bootstrap_type': 'Bayesian', 'bagging_temperature': 9.170626013988445}. Best is trial 98 with value: 0.8791208791208791.
[32m[I 2023-04-21 02:18:53,489][39m Trial 2375 finished with value: 0.8764044943820225 and parameters: {'objective': 'CrossEntropy', 'colsample_bylevel': 0.0686638284438729, 'depth': 3, 'boosting_type': 'Plain', 'bootstrap_type': 'Bayesian', 'bagging_temperature': 9.984513939136722}. Best is trial 98 with value: 0.8791208791208791.
[32m[I 2023-04-21 02:18:54,103][39m Trial 2376 finished with value: 0.8666666666666666 and parameters: {'objective': 'Logloss', 'colsample_bylevel': 0.07025254443924972, 'depth': 4, 'boosting_type': 'Plain', 'bootstrap_type': 'Bayesian', 'bagging_temperature': 9.446931847691028}. Best is trial 98 with value: 0.8791208791208791.
[32m[I 2023-04-21 02:18:54,729][39m Trial 2377 finished with value: 0.8235294117647058 and parameters: {'objective': 'CrossEntropy', 'colsample_bylevel': 0.07787383192983546, 'depth': 6, 'boosting_type': 'Plain', 'bootstrap_type': 'Bayesian', 'bagging_temperature': 9.861593666733773}. Best is trial 98 with value: 0.8791208791208791.
[32m[I 2023-04-21 02:18:55,697][39m Trial 2378 finished with value: 0.8539325842696629 and parameters: {'objective': 'Logloss', 'colsample_bylevel': 0.08569867682882902, 'depth': 3, 'boosting_type': 'Plain', 'bootstrap_type': 'Bayesian', 'bagging_temperature': 9.355520532210402}. Best is trial 98 with value: 0.8791208791208791.
