[32m[I 2023-04-21 03:09:55,084][39m Trial 4934 finished with value: 0.8666666666666666 and parameters: {'objective': 'Logloss', 'colsample_bylevel': 0.07497114917665781, 'depth': 11, 'boosting_type': 'Plain', 'bootstrap_type': 'Bayesian', 'bagging_temperature': 9.371422771570561}. Best is trial 3065 with value: 0.8863636363636364.
[32m[I 2023-04-21 03:09:56,071][39m Trial 4935 finished with value: 0.8539325842696629 and parameters: {'objective': 'CrossEntropy', 'colsample_bylevel': 0.06760834260137119, 'depth': 8, 'boosting_type': 'Plain', 'bootstrap_type': 'Bayesian', 'bagging_temperature': 9.173778954859358}. Best is trial 3065 with value: 0.8863636363636364.
[32m[I 2023-04-21 03:09:57,132][39m Trial 4936 finished with value: 0.8539325842696629 and parameters: {'objective': 'CrossEntropy', 'colsample_bylevel': 0.06630886337309895, 'depth': 9, 'boosting_type': 'Plain', 'bootstrap_type': 'Bayesian', 'bagging_temperature': 9.28110943833938}. Best is trial 3065 with value: 0.8863636363636364.
[32m[I 2023-04-21 03:09:58,239][39m Trial 4937 finished with value: 0.8539325842696629 and parameters: {'objective': 'CrossEntropy', 'colsample_bylevel': 0.07497380001869504, 'depth': 10, 'boosting_type': 'Plain', 'bootstrap_type': 'Bayesian', 'bagging_temperature': 9.038797216154398}. Best is trial 3065 with value: 0.8863636363636364.
[32m[I 2023-04-21 03:09:59,516][39m Trial 4938 finished with value: 0.8666666666666666 and parameters: {'objective': 'CrossEntropy', 'colsample_bylevel': 0.07958412101924102, 'depth': 3, 'boosting_type': 'Plain', 'bootstrap_type': 'Bayesian', 'bagging_temperature': 8.925662154409817}. Best is trial 3065 with value: 0.8863636363636364.
[32m[I 2023-04-21 03:10:00,859][39m Trial 4939 finished with value: 0.8409090909090909 and parameters: {'objective': 'Logloss', 'colsample_bylevel': 0.08551147790731822, 'depth': 8, 'boosting_type': 'Plain', 'bootstrap_type': 'Bayesian', 'bagging_temperature': 9.285511109558598}. Best is trial 3065 with value: 0.8863636363636364.
[32m[I 2023-04-21 03:10:01,553][39m Trial 4940 finished with value: 0.8539325842696629 and parameters: {'objective': 'CrossEntropy', 'colsample_bylevel': 0.09339322567422065, 'depth': 3, 'boosting_type': 'Plain', 'bootstrap_type': 'Bayesian', 'bagging_temperature': 9.992019518591531}. Best is trial 3065 with value: 0.8863636363636364.
[32m[I 2023-04-21 03:10:06,531][39m Trial 4941 finished with value: 0.8139534883720929 and parameters: {'objective': 'CrossEntropy', 'colsample_bylevel': 0.08487817152521998, 'depth': 10, 'boosting_type': 'Ordered', 'bootstrap_type': 'Bayesian', 'bagging_temperature': 9.597805028384832}. Best is trial 3065 with value: 0.8863636363636364.
[32m[I 2023-04-21 03:10:07,587][39m Trial 4942 finished with value: 0.8539325842696629 and parameters: {'objective': 'Logloss', 'colsample_bylevel': 0.07096315644256342, 'depth': 10, 'boosting_type': 'Plain', 'bootstrap_type': 'Bayesian', 'bagging_temperature': 9.33394463847625}. Best is trial 3065 with value: 0.8863636363636364.
[32m[I 2023-04-21 03:10:08,730][39m Trial 4943 finished with value: 0.8409090909090909 and parameters: {'objective': 'Logloss', 'colsample_bylevel': 0.07918769418069288, 'depth': 10, 'boosting_type': 'Plain', 'bootstrap_type': 'Bayesian', 'bagging_temperature': 8.605622017297032}. Best is trial 3065 with value: 0.8863636363636364.
[32m[I 2023-04-21 03:10:10,019][39m Trial 4944 finished with value: 0.8539325842696629 and parameters: {'objective': 'Logloss', 'colsample_bylevel': 0.06891728961887125, 'depth': 3, 'boosting_type': 'Plain', 'bootstrap_type': 'Bayesian', 'bagging_temperature': 9.408203942391127}. Best is trial 3065 with value: 0.8863636363636364.
[32m[I 2023-04-21 03:10:11,153][39m Trial 4945 finished with value: 0.8409090909090909 and parameters: {'objective': 'CrossEntropy', 'colsample_bylevel': 0.06826602681928677, 'depth': 9, 'boosting_type': 'Plain', 'bootstrap_type': 'Bayesian', 'bagging_temperature': 9.237615271168467}. Best is trial 3065 with value: 0.8863636363636364.
[32m[I 2023-04-21 03:10:12,207][39m Trial 4946 finished with value: 0.8666666666666666 and parameters: {'objective': 'CrossEntropy', 'colsample_bylevel': 0.08109526088190136, 'depth': 3, 'boosting_type': 'Plain', 'bootstrap_type': 'Bayesian', 'bagging_temperature': 9.574031398710936}. Best is trial 3065 with value: 0.8863636363636364.
[32m[I 2023-04-21 03:10:12,943][39m Trial 4947 finished with value: 0.8791208791208791 and parameters: {'objective': 'CrossEntropy', 'colsample_bylevel': 0.07936246190697446, 'depth': 10, 'boosting_type': 'Plain', 'bootstrap_type': 'Bayesian', 'bagging_temperature': 8.779412622458073}. Best is trial 3065 with value: 0.8863636363636364.
[32m[I 2023-04-21 03:10:14,447][39m Trial 4948 finished with value: 0.8666666666666666 and parameters: {'objective': 'CrossEntropy', 'colsample_bylevel': 0.09596146153574285, 'depth': 3, 'boosting_type': 'Plain', 'bootstrap_type': 'Bayesian', 'bagging_temperature': 9.882283148901086}. Best is trial 3065 with value: 0.8863636363636364.
[32m[I 2023-04-21 03:10:15,338][39m Trial 4949 finished with value: 0.8539325842696629 and parameters: {'objective': 'CrossEntropy', 'colsample_bylevel': 0.07851000839528983, 'depth': 11, 'boosting_type': 'Plain', 'bootstrap_type': 'Bayesian', 'bagging_temperature': 8.64407338850413}. Best is trial 3065 with value: 0.8863636363636364.
[32m[I 2023-04-21 03:10:16,575][39m Trial 4950 finished with value: 0.8539325842696629 and parameters: {'objective': 'CrossEntropy', 'colsample_bylevel': 0.07625871986992182, 'depth': 10, 'boosting_type': 'Plain', 'bootstrap_type': 'Bayesian', 'bagging_temperature': 9.755417169658735}. Best is trial 3065 with value: 0.8863636363636364.
[32m[I 2023-04-21 03:10:17,722][39m Trial 4951 finished with value: 0.8539325842696629 and parameters: {'objective': 'CrossEntropy', 'colsample_bylevel': 0.08462277295143662, 'depth': 3, 'boosting_type': 'Plain', 'bootstrap_type': 'Bayesian', 'bagging_temperature': 9.375954556044077}. Best is trial 3065 with value: 0.8863636363636364.
[32m[I 2023-04-21 03:10:18,462][39m Trial 4952 finished with value: 0.8409090909090909 and parameters: {'objective': 'Logloss', 'colsample_bylevel': 0.08853324536561837, 'depth': 10, 'boosting_type': 'Plain', 'bootstrap_type': 'Bayesian', 'bagging_temperature': 9.530194386334795}. Best is trial 3065 with value: 0.8863636363636364.
[32m[I 2023-04-21 03:10:19,126][39m Trial 4953 finished with value: 0.8539325842696629 and parameters: {'objective': 'Logloss', 'colsample_bylevel': 0.0730607205406927, 'depth': 11, 'boosting_type': 'Plain', 'bootstrap_type': 'Bayesian', 'bagging_temperature': 9.292782709578281}. Best is trial 3065 with value: 0.8863636363636364.
[32m[I 2023-04-21 03:10:20,323][39m Trial 4954 finished with value: 0.8275862068965518 and parameters: {'objective': 'CrossEntropy', 'colsample_bylevel': 0.08254486732499501, 'depth': 3, 'boosting_type': 'Plain', 'bootstrap_type': 'Bayesian', 'bagging_temperature': 8.725225910595066}. Best is trial 3065 with value: 0.8863636363636364.
[32m[I 2023-04-21 03:10:21,093][39m Trial 4955 finished with value: 0.8275862068965518 and parameters: {'objective': 'Logloss', 'colsample_bylevel': 0.07622309754701481, 'depth': 9, 'boosting_type': 'Plain', 'bootstrap_type': 'MVS'}. Best is trial 3065 with value: 0.8863636363636364.
[32m[I 2023-04-21 03:10:22,340][39m Trial 4956 finished with value: 0.8409090909090909 and parameters: {'objective': 'CrossEntropy', 'colsample_bylevel': 0.07097876380364224, 'depth': 12, 'boosting_type': 'Plain', 'bootstrap_type': 'Bayesian', 'bagging_temperature': 9.656655935924611}. Best is trial 3065 with value: 0.8863636363636364.
[32m[I 2023-04-21 03:10:23,558][39m Trial 4957 finished with value: 0.8539325842696629 and parameters: {'objective': 'Logloss', 'colsample_bylevel': 0.0777625972806797, 'depth': 3, 'boosting_type': 'Plain', 'bootstrap_type': 'Bayesian', 'bagging_temperature': 9.75969128272709}. Best is trial 3065 with value: 0.8863636363636364.
[32m[I 2023-04-21 03:10:24,653][39m Trial 4958 finished with value: 0.8409090909090909 and parameters: {'objective': 'CrossEntropy', 'colsample_bylevel': 0.08674691577125619, 'depth': 10, 'boosting_type': 'Plain', 'bootstrap_type': 'Bayesian', 'bagging_temperature': 9.584485390841056}. Best is trial 3065 with value: 0.8863636363636364.
[32m[I 2023-04-21 03:10:25,405][39m Trial 4959 finished with value: 0.8666666666666666 and parameters: {'objective': 'Logloss', 'colsample_bylevel': 0.07777372779374704, 'depth': 5, 'boosting_type': 'Plain', 'bootstrap_type': 'Bayesian', 'bagging_temperature': 9.648757262351497}. Best is trial 3065 with value: 0.8863636363636364.
[32m[I 2023-04-21 03:10:26,377][39m Trial 4960 finished with value: 0.8539325842696629 and parameters: {'objective': 'CrossEntropy', 'colsample_bylevel': 0.08352543217442635, 'depth': 3, 'boosting_type': 'Plain', 'bootstrap_type': 'Bayesian', 'bagging_temperature': 9.138628542722826}. Best is trial 3065 with value: 0.8863636363636364.
[32m[I 2023-04-21 03:10:31,419][39m Trial 4961 finished with value: 0.8409090909090909 and parameters: {'objective': 'CrossEntropy', 'colsample_bylevel': 0.0778665552186982, 'depth': 10, 'boosting_type': 'Ordered', 'bootstrap_type': 'Bernoulli', 'subsample': 0.387270428595901}. Best is trial 3065 with value: 0.8863636363636364.
[32m[I 2023-04-21 03:10:32,795][39m Trial 4962 finished with value: 0.8539325842696629 and parameters: {'objective': 'CrossEntropy', 'colsample_bylevel': 0.07603553243910077, 'depth': 4, 'boosting_type': 'Plain', 'bootstrap_type': 'Bayesian', 'bagging_temperature': 9.72607909925794}. Best is trial 3065 with value: 0.8863636363636364.
[32m[I 2023-04-21 03:10:33,865][39m Trial 4963 finished with value: 0.7999999999999999 and parameters: {'objective': 'CrossEntropy', 'colsample_bylevel': 0.07737990733105138, 'depth': 10, 'boosting_type': 'Plain', 'bootstrap_type': 'Bayesian', 'bagging_temperature': 3.0671418360859786}. Best is trial 3065 with value: 0.8863636363636364.
[32m[I 2023-04-21 03:10:34,947][39m Trial 4964 finished with value: 0.8409090909090909 and parameters: {'objective': 'CrossEntropy', 'colsample_bylevel': 0.08045955661439852, 'depth': 6, 'boosting_type': 'Plain', 'bootstrap_type': 'Bayesian', 'bagging_temperature': 9.216012159323524}. Best is trial 3065 with value: 0.8863636363636364.
[32m[I 2023-04-21 03:10:35,792][39m Trial 4965 finished with value: 0.8409090909090909 and parameters: {'objective': 'Logloss', 'colsample_bylevel': 0.07348691158626733, 'depth': 9, 'boosting_type': 'Plain', 'bootstrap_type': 'Bayesian', 'bagging_temperature': 9.704012273828427}. Best is trial 3065 with value: 0.8863636363636364.
[32m[I 2023-04-21 03:10:37,058][39m Trial 4966 finished with value: 0.8666666666666666 and parameters: {'objective': 'CrossEntropy', 'colsample_bylevel': 0.08613901707004541, 'depth': 3, 'boosting_type': 'Plain', 'bootstrap_type': 'Bayesian', 'bagging_temperature': 9.168993440606494}. Best is trial 3065 with value: 0.8863636363636364.
[32m[I 2023-04-21 03:10:38,373][39m Trial 4967 finished with value: 0.8409090909090909 and parameters: {'objective': 'Logloss', 'colsample_bylevel': 0.08990758074727691, 'depth': 10, 'boosting_type': 'Plain', 'bootstrap_type': 'Bayesian', 'bagging_temperature': 8.600116419576795}. Best is trial 3065 with value: 0.8863636363636364.
[32m[I 2023-04-21 03:10:39,220][39m Trial 4968 finished with value: 0.8791208791208791 and parameters: {'objective': 'CrossEntropy', 'colsample_bylevel': 0.07628440801314544, 'depth': 9, 'boosting_type': 'Plain', 'bootstrap_type': 'Bayesian', 'bagging_temperature': 9.463016532158623}. Best is trial 3065 with value: 0.8863636363636364.
[32m[I 2023-04-21 03:10:40,435][39m Trial 4969 finished with value: 0.8409090909090909 and parameters: {'objective': 'CrossEntropy', 'colsample_bylevel': 0.0819119921164697, 'depth': 11, 'boosting_type': 'Plain', 'bootstrap_type': 'Bayesian', 'bagging_temperature': 9.54302030044667}. Best is trial 3065 with value: 0.8863636363636364.
[32m[I 2023-04-21 03:10:41,861][39m Trial 4970 finished with value: 0.8409090909090909 and parameters: {'objective': 'CrossEntropy', 'colsample_bylevel': 0.06890830121935042, 'depth': 8, 'boosting_type': 'Plain', 'bootstrap_type': 'MVS'}. Best is trial 3065 with value: 0.8863636363636364.
[32m[I 2023-04-21 03:10:42,587][39m Trial 4971 finished with value: 0.8539325842696629 and parameters: {'objective': 'CrossEntropy', 'colsample_bylevel': 0.08403345758192275, 'depth': 2, 'boosting_type': 'Plain', 'bootstrap_type': 'Bayesian', 'bagging_temperature': 9.37956525210338}. Best is trial 3065 with value: 0.8863636363636364.
[32m[I 2023-04-21 03:10:44,123][39m Trial 4972 finished with value: 0.8666666666666666 and parameters: {'objective': 'CrossEntropy', 'colsample_bylevel': 0.0938554177991841, 'depth': 3, 'boosting_type': 'Plain', 'bootstrap_type': 'Bayesian', 'bagging_temperature': 8.631932892124409}. Best is trial 3065 with value: 0.8863636363636364.
[32m[I 2023-04-21 03:10:45,159][39m Trial 4973 finished with value: 0.8409090909090909 and parameters: {'objective': 'CrossEntropy', 'colsample_bylevel': 0.07661140623437131, 'depth': 3, 'boosting_type': 'Plain', 'bootstrap_type': 'Bernoulli', 'subsample': 0.8227096320922846}. Best is trial 3065 with value: 0.8863636363636364.
[32m[I 2023-04-21 03:10:45,953][39m Trial 4974 finished with value: 0.8409090909090909 and parameters: {'objective': 'Logloss', 'colsample_bylevel': 0.09870804339641061, 'depth': 10, 'boosting_type': 'Plain', 'bootstrap_type': 'Bayesian', 'bagging_temperature': 9.292489423925321}. Best is trial 3065 with value: 0.8863636363636364.
[32m[I 2023-04-21 03:10:46,634][39m Trial 4975 finished with value: 0.8539325842696629 and parameters: {'objective': 'CrossEntropy', 'colsample_bylevel': 0.08354582257986239, 'depth': 3, 'boosting_type': 'Plain', 'bootstrap_type': 'Bayesian', 'bagging_temperature': 9.13914261580339}. Best is trial 3065 with value: 0.8863636363636364.
[32m[I 2023-04-21 03:10:47,789][39m Trial 4976 finished with value: 0.8409090909090909 and parameters: {'objective': 'CrossEntropy', 'colsample_bylevel': 0.0772815362008307, 'depth': 3, 'boosting_type': 'Plain', 'bootstrap_type': 'MVS'}. Best is trial 3065 with value: 0.8863636363636364.
[32m[I 2023-04-21 03:10:48,849][39m Trial 4977 finished with value: 0.8666666666666666 and parameters: {'objective': 'CrossEntropy', 'colsample_bylevel': 0.08641107500482166, 'depth': 3, 'boosting_type': 'Plain', 'bootstrap_type': 'Bayesian', 'bagging_temperature': 9.585126036386233}. Best is trial 3065 with value: 0.8863636363636364.
[32m[I 2023-04-21 03:10:49,896][39m Trial 4978 finished with value: 0.8539325842696629 and parameters: {'objective': 'CrossEntropy', 'colsample_bylevel': 0.07801220053951377, 'depth': 4, 'boosting_type': 'Plain', 'bootstrap_type': 'MVS'}. Best is trial 3065 with value: 0.8863636363636364.
[32m[I 2023-04-21 03:10:54,610][39m Trial 4979 finished with value: 0.8409090909090909 and parameters: {'objective': 'CrossEntropy', 'colsample_bylevel': 0.07880255175284002, 'depth': 9, 'boosting_type': 'Ordered', 'bootstrap_type': 'Bayesian', 'bagging_temperature': 9.140339643454837}. Best is trial 3065 with value: 0.8863636363636364.
[32m[I 2023-04-21 03:10:55,884][39m Trial 4980 finished with value: 0.8333333333333333 and parameters: {'objective': 'Logloss', 'colsample_bylevel': 0.04705739824086493, 'depth': 3, 'boosting_type': 'Plain', 'bootstrap_type': 'Bayesian', 'bagging_temperature': 8.724501188603535}. Best is trial 3065 with value: 0.8863636363636364.
[32m[I 2023-04-21 03:10:57,015][39m Trial 4981 finished with value: 0.8539325842696629 and parameters: {'objective': 'CrossEntropy', 'colsample_bylevel': 0.07706149568174471, 'depth': 10, 'boosting_type': 'Plain', 'bootstrap_type': 'Bayesian', 'bagging_temperature': 9.147778990169499}. Best is trial 3065 with value: 0.8863636363636364.
[32m[I 2023-04-21 03:10:58,515][39m Trial 4982 finished with value: 0.8539325842696629 and parameters: {'objective': 'CrossEntropy', 'colsample_bylevel': 0.07701869325348094, 'depth': 9, 'boosting_type': 'Plain', 'bootstrap_type': 'Bayesian', 'bagging_temperature': 9.974230028910085}. Best is trial 3065 with value: 0.8863636363636364.
[32m[I 2023-04-21 03:10:59,798][39m Trial 4983 finished with value: 0.8372093023255814 and parameters: {'objective': 'CrossEntropy', 'colsample_bylevel': 0.0761565708494482, 'depth': 9, 'boosting_type': 'Plain', 'bootstrap_type': 'Bayesian', 'bagging_temperature': 9.843996072314942}. Best is trial 3065 with value: 0.8863636363636364.
[32m[I 2023-04-21 03:11:00,532][39m Trial 4984 finished with value: 0.8666666666666666 and parameters: {'objective': 'CrossEntropy', 'colsample_bylevel': 0.07349387710089382, 'depth': 4, 'boosting_type': 'Plain', 'bootstrap_type': 'Bayesian', 'bagging_temperature': 9.71015273444676}. Best is trial 3065 with value: 0.8863636363636364.
[32m[I 2023-04-21 03:11:01,253][39m Trial 4985 finished with value: 0.8539325842696629 and parameters: {'objective': 'CrossEntropy', 'colsample_bylevel': 0.08250204570104731, 'depth': 11, 'boosting_type': 'Plain', 'bootstrap_type': 'Bayesian', 'bagging_temperature': 8.981660176822233}. Best is trial 3065 with value: 0.8863636363636364.
[32m[I 2023-04-21 03:11:02,391][39m Trial 4986 finished with value: 0.8409090909090909 and parameters: {'objective': 'CrossEntropy', 'colsample_bylevel': 0.07993043992526744, 'depth': 3, 'boosting_type': 'Plain', 'bootstrap_type': 'Bernoulli', 'subsample': 0.6619523862052341}. Best is trial 3065 with value: 0.8863636363636364.
[32m[I 2023-04-21 03:11:03,172][39m Trial 4987 finished with value: 0.8275862068965518 and parameters: {'objective': 'CrossEntropy', 'colsample_bylevel': 0.07081222356522421, 'depth': 9, 'boosting_type': 'Plain', 'bootstrap_type': 'MVS'}. Best is trial 3065 with value: 0.8863636363636364.
[32m[I 2023-04-21 03:11:04,165][39m Trial 4988 finished with value: 0.8409090909090909 and parameters: {'objective': 'CrossEntropy', 'colsample_bylevel': 0.08471007310938924, 'depth': 3, 'boosting_type': 'Plain', 'bootstrap_type': 'Bayesian', 'bagging_temperature': 9.04076994783499}. Best is trial 3065 with value: 0.8863636363636364.
[32m[I 2023-04-21 03:11:05,373][39m Trial 4989 finished with value: 0.8666666666666666 and parameters: {'objective': 'Logloss', 'colsample_bylevel': 0.07842720623282003, 'depth': 2, 'boosting_type': 'Plain', 'bootstrap_type': 'Bayesian', 'bagging_temperature': 9.810957035119408}. Best is trial 3065 with value: 0.8863636363636364.
[32m[I 2023-04-21 03:11:06,367][39m Trial 4990 finished with value: 0.8275862068965518 and parameters: {'objective': 'Logloss', 'colsample_bylevel': 0.07745179453156782, 'depth': 6, 'boosting_type': 'Plain', 'bootstrap_type': 'Bayesian', 'bagging_temperature': 9.39394459870084}. Best is trial 3065 with value: 0.8863636363636364.
[32m[I 2023-04-21 03:11:07,102][39m Trial 4991 finished with value: 0.8409090909090909 and parameters: {'objective': 'Logloss', 'colsample_bylevel': 0.09157462867230887, 'depth': 4, 'boosting_type': 'Plain', 'bootstrap_type': 'Bayesian', 'bagging_temperature': 7.831302747641729}. Best is trial 3065 with value: 0.8863636363636364.
[32m[I 2023-04-21 03:11:08,512][39m Trial 4992 finished with value: 0.8539325842696629 and parameters: {'objective': 'CrossEntropy', 'colsample_bylevel': 0.07565669141760387, 'depth': 4, 'boosting_type': 'Plain', 'bootstrap_type': 'Bayesian', 'bagging_temperature': 8.842138856683471}. Best is trial 3065 with value: 0.8863636363636364.
[32m[I 2023-04-21 03:11:09,438][39m Trial 4993 finished with value: 0.8409090909090909 and parameters: {'objective': 'CrossEntropy', 'colsample_bylevel': 0.08146553024732092, 'depth': 9, 'boosting_type': 'Plain', 'bootstrap_type': 'Bayesian', 'bagging_temperature': 9.284273346105788}. Best is trial 3065 with value: 0.8863636363636364.
[32m[I 2023-04-21 03:11:10,621][39m Trial 4994 finished with value: 0.8666666666666666 and parameters: {'objective': 'CrossEntropy', 'colsample_bylevel': 0.08648343313113745, 'depth': 3, 'boosting_type': 'Plain', 'bootstrap_type': 'Bayesian', 'bagging_temperature': 9.632268536758632}. Best is trial 3065 with value: 0.8863636363636364.
[32m[I 2023-04-21 03:11:11,924][39m Trial 4995 finished with value: 0.8666666666666666 and parameters: {'objective': 'CrossEntropy', 'colsample_bylevel': 0.07993734634070819, 'depth': 3, 'boosting_type': 'Plain', 'bootstrap_type': 'Bayesian', 'bagging_temperature': 9.60804312644032}. Best is trial 3065 with value: 0.8863636363636364.
[32m[I 2023-04-21 03:11:13,057][39m Trial 4996 finished with value: 0.8539325842696629 and parameters: {'objective': 'CrossEntropy', 'colsample_bylevel': 0.0780724124087731, 'depth': 3, 'boosting_type': 'Plain', 'bootstrap_type': 'Bayesian', 'bagging_temperature': 9.680753700527612}. Best is trial 3065 with value: 0.8863636363636364.
[32m[I 2023-04-21 03:11:14,105][39m Trial 4997 finished with value: 0.8275862068965518 and parameters: {'objective': 'CrossEntropy', 'colsample_bylevel': 0.07512737986925981, 'depth': 3, 'boosting_type': 'Plain', 'bootstrap_type': 'MVS'}. Best is trial 3065 with value: 0.8863636363636364.
[32m[I 2023-04-21 03:11:15,139][39m Trial 4998 finished with value: 0.8666666666666666 and parameters: {'objective': 'CrossEntropy', 'colsample_bylevel': 0.07196265176188281, 'depth': 12, 'boosting_type': 'Plain', 'bootstrap_type': 'Bayesian', 'bagging_temperature': 9.482036139954747}. Best is trial 3065 with value: 0.8863636363636364.
[32m[I 2023-04-21 03:11:19,297][39m Trial 4999 finished with value: 0.8275862068965518 and parameters: {'objective': 'CrossEntropy', 'colsample_bylevel': 0.07403683328440276, 'depth': 10, 'boosting_type': 'Ordered', 'bootstrap_type': 'Bayesian', 'bagging_temperature': 1.658047524878966}. Best is trial 3065 with value: 0.8863636363636364.
