[32m[I 2023-04-21 02:04:01,263][39m Trial 1587 finished with value: 0.8666666666666666 and parameters: {'objective': 'CrossEntropy', 'colsample_bylevel': 0.08366033648343697, 'depth': 3, 'boosting_type': 'Plain', 'bootstrap_type': 'Bayesian', 'bagging_temperature': 9.102786853781314}. Best is trial 98 with value: 0.8791208791208791.
[32m[I 2023-04-21 02:04:02,193][39m Trial 1588 finished with value: 0.8505747126436782 and parameters: {'objective': 'CrossEntropy', 'colsample_bylevel': 0.08245418573399814, 'depth': 10, 'boosting_type': 'Plain', 'bootstrap_type': 'Bayesian', 'bagging_temperature': 9.13275325359131}. Best is trial 98 with value: 0.8791208791208791.
[32m[I 2023-04-21 02:04:03,046][39m Trial 1589 finished with value: 0.8139534883720929 and parameters: {'objective': 'CrossEntropy', 'colsample_bylevel': 0.0748187905982206, 'depth': 5, 'boosting_type': 'Plain', 'bootstrap_type': 'Bayesian', 'bagging_temperature': 9.082089890539297}. Best is trial 98 with value: 0.8791208791208791.
[32m[I 2023-04-21 02:04:03,734][39m Trial 1590 finished with value: 0.8539325842696629 and parameters: {'objective': 'Logloss', 'colsample_bylevel': 0.07341403555362722, 'depth': 10, 'boosting_type': 'Plain', 'bootstrap_type': 'Bayesian', 'bagging_temperature': 9.19413230358747}. Best is trial 98 with value: 0.8791208791208791.
[32m[I 2023-04-21 02:04:04,496][39m Trial 1591 finished with value: 0.8409090909090909 and parameters: {'objective': 'Logloss', 'colsample_bylevel': 0.07569773881831568, 'depth': 6, 'boosting_type': 'Plain', 'bootstrap_type': 'Bayesian', 'bagging_temperature': 9.299594755989894}. Best is trial 98 with value: 0.8791208791208791.
[32m[I 2023-04-21 02:04:05,385][39m Trial 1592 finished with value: 0.8409090909090909 and parameters: {'objective': 'CrossEntropy', 'colsample_bylevel': 0.08268029933815027, 'depth': 11, 'boosting_type': 'Plain', 'bootstrap_type': 'Bayesian', 'bagging_temperature': 9.481974315615767}. Best is trial 98 with value: 0.8791208791208791.
[32m[I 2023-04-21 02:04:06,592][39m Trial 1593 finished with value: 0.8791208791208791 and parameters: {'objective': 'CrossEntropy', 'colsample_bylevel': 0.0771761293869366, 'depth': 9, 'boosting_type': 'Plain', 'bootstrap_type': 'Bayesian', 'bagging_temperature': 9.38073732450276}. Best is trial 98 with value: 0.8791208791208791.
[32m[I 2023-04-21 02:04:07,349][39m Trial 1594 finished with value: 0.8539325842696629 and parameters: {'objective': 'CrossEntropy', 'colsample_bylevel': 0.08080297943233532, 'depth': 10, 'boosting_type': 'Plain', 'bootstrap_type': 'Bayesian', 'bagging_temperature': 9.311099876936334}. Best is trial 98 with value: 0.8791208791208791.
[32m[I 2023-04-21 02:04:08,508][39m Trial 1595 finished with value: 0.8505747126436782 and parameters: {'objective': 'CrossEntropy', 'colsample_bylevel': 0.08495641176627988, 'depth': 11, 'boosting_type': 'Plain', 'bootstrap_type': 'Bayesian', 'bagging_temperature': 9.406820661147659}. Best is trial 98 with value: 0.8791208791208791.
[32m[I 2023-04-21 02:04:09,460][39m Trial 1596 finished with value: 0.8539325842696629 and parameters: {'objective': 'CrossEntropy', 'colsample_bylevel': 0.07772786711312114, 'depth': 7, 'boosting_type': 'Plain', 'bootstrap_type': 'Bayesian', 'bagging_temperature': 9.853899450986477}. Best is trial 98 with value: 0.8791208791208791.
[32m[I 2023-04-21 02:04:14,245][39m Trial 1597 finished with value: 0.8409090909090909 and parameters: {'objective': 'CrossEntropy', 'colsample_bylevel': 0.08068984510221679, 'depth': 3, 'boosting_type': 'Ordered', 'bootstrap_type': 'Bayesian', 'bagging_temperature': 9.56467365480257}. Best is trial 98 with value: 0.8791208791208791.
[32m[I 2023-04-21 02:04:15,521][39m Trial 1598 finished with value: 0.8539325842696629 and parameters: {'objective': 'CrossEntropy', 'colsample_bylevel': 0.058543947971420686, 'depth': 3, 'boosting_type': 'Plain', 'bootstrap_type': 'Bayesian', 'bagging_temperature': 9.705713552520075}. Best is trial 98 with value: 0.8791208791208791.
[32m[I 2023-04-21 02:04:16,634][39m Trial 1599 finished with value: 0.8539325842696629 and parameters: {'objective': 'CrossEntropy', 'colsample_bylevel': 0.08609323267708381, 'depth': 3, 'boosting_type': 'Plain', 'bootstrap_type': 'Bayesian', 'bagging_temperature': 9.159930674257794}. Best is trial 98 with value: 0.8791208791208791.
[32m[I 2023-04-21 02:04:17,252][39m Trial 1600 finished with value: 0.8409090909090909 and parameters: {'objective': 'CrossEntropy', 'colsample_bylevel': 0.07930864274226525, 'depth': 3, 'boosting_type': 'Plain', 'bootstrap_type': 'Bayesian', 'bagging_temperature': 8.96993420460539}. Best is trial 98 with value: 0.8791208791208791.
[32m[I 2023-04-21 02:04:18,151][39m Trial 1601 finished with value: 0.7999999999999999 and parameters: {'objective': 'CrossEntropy', 'colsample_bylevel': 0.06922396257002697, 'depth': 10, 'boosting_type': 'Plain', 'bootstrap_type': 'MVS'}. Best is trial 98 with value: 0.8791208791208791.
[32m[I 2023-04-21 02:04:19,010][39m Trial 1602 finished with value: 0.8666666666666666 and parameters: {'objective': 'CrossEntropy', 'colsample_bylevel': 0.08229315279982576, 'depth': 3, 'boosting_type': 'Plain', 'bootstrap_type': 'Bayesian', 'bagging_temperature': 9.189879938403003}. Best is trial 98 with value: 0.8791208791208791.
[32m[I 2023-04-21 02:04:19,743][39m Trial 1603 finished with value: 0.8275862068965518 and parameters: {'objective': 'CrossEntropy', 'colsample_bylevel': 0.09485743198300352, 'depth': 10, 'boosting_type': 'Plain', 'bootstrap_type': 'Bayesian', 'bagging_temperature': 9.480348737701876}. Best is trial 98 with value: 0.8791208791208791.
[32m[I 2023-04-21 02:04:20,772][39m Trial 1604 finished with value: 0.8539325842696629 and parameters: {'objective': 'CrossEntropy', 'colsample_bylevel': 0.08454928319519166, 'depth': 3, 'boosting_type': 'Plain', 'bootstrap_type': 'Bayesian', 'bagging_temperature': 9.36834413234975}. Best is trial 98 with value: 0.8791208791208791.
[32m[I 2023-04-21 02:04:21,707][39m Trial 1605 finished with value: 0.8275862068965518 and parameters: {'objective': 'Logloss', 'colsample_bylevel': 0.07910793106639996, 'depth': 11, 'boosting_type': 'Plain', 'bootstrap_type': 'Bayesian', 'bagging_temperature': 8.878705039090423}. Best is trial 98 with value: 0.8791208791208791.
[32m[I 2023-04-21 02:04:22,767][39m Trial 1606 finished with value: 0.8409090909090909 and parameters: {'objective': 'CrossEntropy', 'colsample_bylevel': 0.09977780887738923, 'depth': 3, 'boosting_type': 'Plain', 'bootstrap_type': 'MVS'}. Best is trial 98 with value: 0.8791208791208791.
[32m[I 2023-04-21 02:04:23,832][39m Trial 1607 finished with value: 0.8666666666666666 and parameters: {'objective': 'CrossEntropy', 'colsample_bylevel': 0.08294296473576962, 'depth': 3, 'boosting_type': 'Plain', 'bootstrap_type': 'Bayesian', 'bagging_temperature': 8.814098519431175}. Best is trial 98 with value: 0.8791208791208791.
[32m[I 2023-04-21 02:04:24,477][39m Trial 1608 finished with value: 0.8275862068965518 and parameters: {'objective': 'Logloss', 'colsample_bylevel': 0.0817127091586354, 'depth': 4, 'boosting_type': 'Plain', 'bootstrap_type': 'Bernoulli', 'subsample': 0.800476573038537}. Best is trial 98 with value: 0.8791208791208791.
[32m[I 2023-04-21 02:04:25,194][39m Trial 1609 finished with value: 0.8791208791208791 and parameters: {'objective': 'CrossEntropy', 'colsample_bylevel': 0.07594761592860842, 'depth': 11, 'boosting_type': 'Plain', 'bootstrap_type': 'Bayesian', 'bagging_temperature': 9.551056549147013}. Best is trial 98 with value: 0.8791208791208791.
[32m[I 2023-04-21 02:04:26,189][39m Trial 1610 finished with value: 0.8666666666666666 and parameters: {'objective': 'CrossEntropy', 'colsample_bylevel': 0.0552961877060618, 'depth': 11, 'boosting_type': 'Plain', 'bootstrap_type': 'Bayesian', 'bagging_temperature': 9.571148984909748}. Best is trial 98 with value: 0.8791208791208791.
[32m[I 2023-04-21 02:04:26,985][39m Trial 1611 finished with value: 0.8409090909090909 and parameters: {'objective': 'CrossEntropy', 'colsample_bylevel': 0.07133823159938998, 'depth': 11, 'boosting_type': 'Plain', 'bootstrap_type': 'Bayesian', 'bagging_temperature': 9.698386584883549}. Best is trial 98 with value: 0.8791208791208791.
[32m[I 2023-04-21 02:04:27,622][39m Trial 1612 finished with value: 0.8666666666666666 and parameters: {'objective': 'CrossEntropy', 'colsample_bylevel': 0.0803524990190159, 'depth': 4, 'boosting_type': 'Plain', 'bootstrap_type': 'Bayesian', 'bagging_temperature': 9.711348477598262}. Best is trial 98 with value: 0.8791208791208791.
[32m[I 2023-04-21 02:04:28,619][39m Trial 1613 finished with value: 0.8539325842696629 and parameters: {'objective': 'CrossEntropy', 'colsample_bylevel': 0.07821891678008584, 'depth': 10, 'boosting_type': 'Plain', 'bootstrap_type': 'Bayesian', 'bagging_temperature': 9.384663358790567}. Best is trial 98 with value: 0.8791208791208791.
[32m[I 2023-04-21 02:04:29,629][39m Trial 1614 finished with value: 0.8539325842696629 and parameters: {'objective': 'CrossEntropy', 'colsample_bylevel': 0.08108229399191202, 'depth': 6, 'boosting_type': 'Plain', 'bootstrap_type': 'Bayesian', 'bagging_temperature': 9.177453529190606}. Best is trial 98 with value: 0.8791208791208791.
[32m[I 2023-04-21 02:04:34,443][39m Trial 1615 finished with value: 0.8275862068965518 and parameters: {'objective': 'CrossEntropy', 'colsample_bylevel': 0.08335325515772155, 'depth': 10, 'boosting_type': 'Ordered', 'bootstrap_type': 'Bayesian', 'bagging_temperature': 9.090099991112437}. Best is trial 98 with value: 0.8791208791208791.
[32m[I 2023-04-21 02:04:35,679][39m Trial 1616 finished with value: 0.8539325842696629 and parameters: {'objective': 'CrossEntropy', 'colsample_bylevel': 0.08144576102714642, 'depth': 5, 'boosting_type': 'Plain', 'bootstrap_type': 'Bayesian', 'bagging_temperature': 9.048870304278829}. Best is trial 98 with value: 0.8791208791208791.
[32m[I 2023-04-21 02:04:36,653][39m Trial 1617 finished with value: 0.8539325842696629 and parameters: {'objective': 'CrossEntropy', 'colsample_bylevel': 0.08228217450590376, 'depth': 7, 'boosting_type': 'Plain', 'bootstrap_type': 'Bayesian', 'bagging_temperature': 8.307756622555985}. Best is trial 98 with value: 0.8791208791208791.
[32m[I 2023-04-21 02:04:37,485][39m Trial 1618 finished with value: 0.8275862068965518 and parameters: {'objective': 'CrossEntropy', 'colsample_bylevel': 0.08339400826647933, 'depth': 9, 'boosting_type': 'Plain', 'bootstrap_type': 'Bayesian', 'bagging_temperature': 8.442775115118065}. Best is trial 98 with value: 0.8791208791208791.
[32m[I 2023-04-21 02:04:38,290][39m Trial 1619 finished with value: 0.8409090909090909 and parameters: {'objective': 'CrossEntropy', 'colsample_bylevel': 0.07608755757426396, 'depth': 8, 'boosting_type': 'Plain', 'bootstrap_type': 'Bayesian', 'bagging_temperature': 8.568287841407106}. Best is trial 98 with value: 0.8791208791208791.
[32m[I 2023-04-21 02:04:39,133][39m Trial 1620 finished with value: 0.8275862068965518 and parameters: {'objective': 'CrossEntropy', 'colsample_bylevel': 0.07426437193935095, 'depth': 4, 'boosting_type': 'Plain', 'bootstrap_type': 'MVS'}. Best is trial 98 with value: 0.8791208791208791.
[32m[I 2023-04-21 02:04:40,040][39m Trial 1621 finished with value: 0.8372093023255814 and parameters: {'objective': 'CrossEntropy', 'colsample_bylevel': 0.08476520134935106, 'depth': 10, 'boosting_type': 'Plain', 'bootstrap_type': 'Bayesian', 'bagging_temperature': 9.692015753254312}. Best is trial 98 with value: 0.8791208791208791.
[32m[I 2023-04-21 02:04:40,889][39m Trial 1622 finished with value: 0.8539325842696629 and parameters: {'objective': 'CrossEntropy', 'colsample_bylevel': 0.09269485070224336, 'depth': 3, 'boosting_type': 'Plain', 'bootstrap_type': 'Bayesian', 'bagging_temperature': 9.773621111063031}. Best is trial 98 with value: 0.8791208791208791.
[32m[I 2023-04-21 02:04:41,550][39m Trial 1623 finished with value: 0.8539325842696629 and parameters: {'objective': 'CrossEntropy', 'colsample_bylevel': 0.09062113919943156, 'depth': 3, 'boosting_type': 'Plain', 'bootstrap_type': 'Bayesian', 'bagging_temperature': 8.699056333637852}. Best is trial 98 with value: 0.8791208791208791.
[32m[I 2023-04-21 02:04:42,278][39m Trial 1624 finished with value: 0.8791208791208791 and parameters: {'objective': 'CrossEntropy', 'colsample_bylevel': 0.08145203361729747, 'depth': 3, 'boosting_type': 'Plain', 'bootstrap_type': 'Bayesian', 'bagging_temperature': 8.761693015771511}. Best is trial 98 with value: 0.8791208791208791.
[32m[I 2023-04-21 02:04:43,287][39m Trial 1625 finished with value: 0.8666666666666666 and parameters: {'objective': 'CrossEntropy', 'colsample_bylevel': 0.09469963429628918, 'depth': 3, 'boosting_type': 'Plain', 'bootstrap_type': 'Bayesian', 'bagging_temperature': 8.795851664180956}. Best is trial 98 with value: 0.8791208791208791.
[32m[I 2023-04-21 02:04:44,324][39m Trial 1626 finished with value: 0.8409090909090909 and parameters: {'objective': 'CrossEntropy', 'colsample_bylevel': 0.07321499838797063, 'depth': 12, 'boosting_type': 'Plain', 'bootstrap_type': 'Bayesian', 'bagging_temperature': 4.540536286854211}. Best is trial 98 with value: 0.8791208791208791.
[32m[I 2023-04-21 02:04:45,547][39m Trial 1627 finished with value: 0.8505747126436782 and parameters: {'objective': 'CrossEntropy', 'colsample_bylevel': 0.08198334786293254, 'depth': 9, 'boosting_type': 'Plain', 'bootstrap_type': 'Bayesian', 'bagging_temperature': 8.032185584081514}. Best is trial 98 with value: 0.8791208791208791.
[32m[I 2023-04-21 02:04:46,134][39m Trial 1628 finished with value: 0.8666666666666666 and parameters: {'objective': 'Logloss', 'colsample_bylevel': 0.07515375792265643, 'depth': 5, 'boosting_type': 'Plain', 'bootstrap_type': 'Bayesian', 'bagging_temperature': 8.873932311267147}. Best is trial 98 with value: 0.8791208791208791.
[32m[I 2023-04-21 02:04:47,237][39m Trial 1629 finished with value: 0.8275862068965518 and parameters: {'objective': 'CrossEntropy', 'colsample_bylevel': 0.08040251365502965, 'depth': 9, 'boosting_type': 'Plain', 'bootstrap_type': 'Bayesian', 'bagging_temperature': 1.6689375615194413}. Best is trial 98 with value: 0.8791208791208791.
[32m[I 2023-04-21 02:04:47,958][39m Trial 1630 finished with value: 0.8539325842696629 and parameters: {'objective': 'CrossEntropy', 'colsample_bylevel': 0.07718438824457008, 'depth': 12, 'boosting_type': 'Plain', 'bootstrap_type': 'Bayesian', 'bagging_temperature': 9.441563251163727}. Best is trial 98 with value: 0.8791208791208791.
[32m[I 2023-04-21 02:04:49,044][39m Trial 1631 finished with value: 0.8539325842696629 and parameters: {'objective': 'CrossEntropy', 'colsample_bylevel': 0.06272161387286806, 'depth': 3, 'boosting_type': 'Plain', 'bootstrap_type': 'Bayesian', 'bagging_temperature': 9.99049488064522}. Best is trial 98 with value: 0.8791208791208791.
[32m[I 2023-04-21 02:04:50,296][39m Trial 1632 finished with value: 0.8666666666666666 and parameters: {'objective': 'CrossEntropy', 'colsample_bylevel': 0.08680318347777685, 'depth': 3, 'boosting_type': 'Plain', 'bootstrap_type': 'Bayesian', 'bagging_temperature': 9.827960148641964}. Best is trial 98 with value: 0.8791208791208791.
[32m[I 2023-04-21 02:04:51,310][39m Trial 1633 finished with value: 0.8275862068965518 and parameters: {'objective': 'Logloss', 'colsample_bylevel': 0.07603556607749976, 'depth': 7, 'boosting_type': 'Plain', 'bootstrap_type': 'Bernoulli', 'subsample': 0.38846069814846695}. Best is trial 98 with value: 0.8791208791208791.
[32m[I 2023-04-21 02:04:56,088][39m Trial 1634 finished with value: 0.8222222222222222 and parameters: {'objective': 'CrossEntropy', 'colsample_bylevel': 0.07910263860082525, 'depth': 12, 'boosting_type': 'Ordered', 'bootstrap_type': 'MVS'}. Best is trial 98 with value: 0.8791208791208791.
[32m[I 2023-04-21 02:04:57,216][39m Trial 1635 finished with value: 0.8505747126436782 and parameters: {'objective': 'CrossEntropy', 'colsample_bylevel': 0.0857798882387334, 'depth': 11, 'boosting_type': 'Plain', 'bootstrap_type': 'Bayesian', 'bagging_temperature': 9.75600783473795}. Best is trial 98 with value: 0.8791208791208791.
[32m[I 2023-04-21 02:04:57,961][39m Trial 1636 finished with value: 0.8409090909090909 and parameters: {'objective': 'CrossEntropy', 'colsample_bylevel': 0.09282809891544586, 'depth': 11, 'boosting_type': 'Plain', 'bootstrap_type': 'Bayesian', 'bagging_temperature': 9.9656819118494}. Best is trial 98 with value: 0.8791208791208791.
[32m[I 2023-04-21 02:04:58,877][39m Trial 1637 finished with value: 0.8666666666666666 and parameters: {'objective': 'CrossEntropy', 'colsample_bylevel': 0.08290941712763808, 'depth': 3, 'boosting_type': 'Plain', 'bootstrap_type': 'Bayesian', 'bagging_temperature': 9.993882485106996}. Best is trial 98 with value: 0.8791208791208791.
[32m[I 2023-04-21 02:04:59,830][39m Trial 1638 finished with value: 0.8409090909090909 and parameters: {'objective': 'CrossEntropy', 'colsample_bylevel': 0.07816766850382535, 'depth': 5, 'boosting_type': 'Plain', 'bootstrap_type': 'Bayesian', 'bagging_temperature': 9.406022068772709}. Best is trial 98 with value: 0.8791208791208791.
[32m[I 2023-04-21 02:05:00,832][39m Trial 1639 finished with value: 0.8539325842696629 and parameters: {'objective': 'CrossEntropy', 'colsample_bylevel': 0.07861306691082272, 'depth': 9, 'boosting_type': 'Plain', 'bootstrap_type': 'Bayesian', 'bagging_temperature': 9.597607678925653}. Best is trial 98 with value: 0.8791208791208791.
[32m[I 2023-04-21 02:05:01,692][39m Trial 1640 finished with value: 0.8666666666666666 and parameters: {'objective': 'CrossEntropy', 'colsample_bylevel': 0.084803426972689, 'depth': 3, 'boosting_type': 'Plain', 'bootstrap_type': 'Bayesian', 'bagging_temperature': 9.188018806600486}. Best is trial 98 with value: 0.8791208791208791.
[32m[I 2023-04-21 02:05:02,434][39m Trial 1641 finished with value: 0.8444444444444446 and parameters: {'objective': 'CrossEntropy', 'colsample_bylevel': 0.07898233515201857, 'depth': 12, 'boosting_type': 'Plain', 'bootstrap_type': 'Bayesian', 'bagging_temperature': 9.498701083343905}. Best is trial 98 with value: 0.8791208791208791.
[32m[I 2023-04-21 02:05:03,691][39m Trial 1642 finished with value: 0.8409090909090909 and parameters: {'objective': 'Logloss', 'colsample_bylevel': 0.07530950810775115, 'depth': 10, 'boosting_type': 'Plain', 'bootstrap_type': 'MVS'}. Best is trial 98 with value: 0.8791208791208791.
[32m[I 2023-04-21 02:05:04,992][39m Trial 1643 finished with value: 0.8539325842696629 and parameters: {'objective': 'CrossEntropy', 'colsample_bylevel': 0.07822554232045476, 'depth': 8, 'boosting_type': 'Plain', 'bootstrap_type': 'Bayesian', 'bagging_temperature': 8.377645005512777}. Best is trial 98 with value: 0.8791208791208791.
[32m[I 2023-04-21 02:05:05,796][39m Trial 1644 finished with value: 0.8539325842696629 and parameters: {'objective': 'CrossEntropy', 'colsample_bylevel': 0.08104618735851127, 'depth': 5, 'boosting_type': 'Plain', 'bootstrap_type': 'Bayesian', 'bagging_temperature': 9.292151841392034}. Best is trial 98 with value: 0.8791208791208791.
[32m[I 2023-04-21 02:05:06,447][39m Trial 1645 finished with value: 0.8505747126436782 and parameters: {'objective': 'CrossEntropy', 'colsample_bylevel': 0.09516122278008413, 'depth': 12, 'boosting_type': 'Plain', 'bootstrap_type': 'Bayesian', 'bagging_temperature': 8.661647514492945}. Best is trial 98 with value: 0.8791208791208791.
[32m[I 2023-04-21 02:05:07,124][39m Trial 1646 finished with value: 0.8539325842696629 and parameters: {'objective': 'CrossEntropy', 'colsample_bylevel': 0.08004694423096571, 'depth': 8, 'boosting_type': 'Plain', 'bootstrap_type': 'Bayesian', 'bagging_temperature': 9.808996964472795}. Best is trial 98 with value: 0.8791208791208791.
[32m[I 2023-04-21 02:05:08,041][39m Trial 1647 finished with value: 0.8539325842696629 and parameters: {'objective': 'CrossEntropy', 'colsample_bylevel': 0.07657566680605199, 'depth': 10, 'boosting_type': 'Plain', 'bootstrap_type': 'Bayesian', 'bagging_temperature': 9.318369925387112}. Best is trial 98 with value: 0.8791208791208791.
[32m[I 2023-04-21 02:05:08,863][39m Trial 1648 finished with value: 0.8539325842696629 and parameters: {'objective': 'CrossEntropy', 'colsample_bylevel': 0.07677196731077479, 'depth': 4, 'boosting_type': 'Plain', 'bootstrap_type': 'Bayesian', 'bagging_temperature': 9.158362962620084}. Best is trial 98 with value: 0.8791208791208791.
[32m[I 2023-04-21 02:05:09,641][39m Trial 1649 finished with value: 0.8539325842696629 and parameters: {'objective': 'CrossEntropy', 'colsample_bylevel': 0.07777414809150213, 'depth': 4, 'boosting_type': 'Plain', 'bootstrap_type': 'Bayesian', 'bagging_temperature': 9.816633783864887}. Best is trial 98 with value: 0.8791208791208791.
[32m[I 2023-04-21 02:05:10,946][39m Trial 1650 finished with value: 0.8372093023255814 and parameters: {'objective': 'CrossEntropy', 'colsample_bylevel': 0.09042347757134164, 'depth': 8, 'boosting_type': 'Plain', 'bootstrap_type': 'Bayesian', 'bagging_temperature': 8.947503939692952}. Best is trial 98 with value: 0.8791208791208791.
[32m[I 2023-04-21 02:05:12,107][39m Trial 1651 finished with value: 0.8275862068965518 and parameters: {'objective': 'CrossEntropy', 'colsample_bylevel': 0.07672057072466336, 'depth': 9, 'boosting_type': 'Plain', 'bootstrap_type': 'Bernoulli', 'subsample': 0.6378616871777425}. Best is trial 98 with value: 0.8791208791208791.
[32m[I 2023-04-21 02:05:13,128][39m Trial 1652 finished with value: 0.8505747126436782 and parameters: {'objective': 'CrossEntropy', 'colsample_bylevel': 0.0959264508169177, 'depth': 9, 'boosting_type': 'Plain', 'bootstrap_type': 'Bayesian', 'bagging_temperature': 9.255499988588188}. Best is trial 98 with value: 0.8791208791208791.
