[32m[I 2023-04-21 01:57:57,635][39m Trial 1257 finished with value: 0.8539325842696629 and parameters: {'objective': 'Logloss', 'colsample_bylevel': 0.09385363114396883, 'depth': 3, 'boosting_type': 'Plain', 'bootstrap_type': 'Bayesian', 'bagging_temperature': 7.473346031387469}. Best is trial 98 with value: 0.8791208791208791.
[32m[I 2023-04-21 01:57:58,419][39m Trial 1258 finished with value: 0.8666666666666666 and parameters: {'objective': 'CrossEntropy', 'colsample_bylevel': 0.08882708015423534, 'depth': 3, 'boosting_type': 'Plain', 'bootstrap_type': 'Bayesian', 'bagging_temperature': 9.37981984231724}. Best is trial 98 with value: 0.8791208791208791.
[32m[I 2023-04-21 01:57:59,048][39m Trial 1259 finished with value: 0.8409090909090909 and parameters: {'objective': 'CrossEntropy', 'colsample_bylevel': 0.0834870502849444, 'depth': 5, 'boosting_type': 'Plain', 'bootstrap_type': 'Bayesian', 'bagging_temperature': 9.266967442673712}. Best is trial 98 with value: 0.8791208791208791.
[32m[I 2023-04-21 01:58:00,036][39m Trial 1260 finished with value: 0.8539325842696629 and parameters: {'objective': 'CrossEntropy', 'colsample_bylevel': 0.08600706904198432, 'depth': 3, 'boosting_type': 'Plain', 'bootstrap_type': 'Bayesian', 'bagging_temperature': 8.917983669221314}. Best is trial 98 with value: 0.8791208791208791.
[32m[I 2023-04-21 01:58:00,755][39m Trial 1261 finished with value: 0.8791208791208791 and parameters: {'objective': 'CrossEntropy', 'colsample_bylevel': 0.07959099317736075, 'depth': 4, 'boosting_type': 'Plain', 'bootstrap_type': 'Bayesian', 'bagging_temperature': 9.625257085171613}. Best is trial 98 with value: 0.8791208791208791.
[32m[I 2023-04-21 01:58:01,885][39m Trial 1262 finished with value: 0.8409090909090909 and parameters: {'objective': 'CrossEntropy', 'colsample_bylevel': 0.08111641329066893, 'depth': 7, 'boosting_type': 'Plain', 'bootstrap_type': 'Bayesian', 'bagging_temperature': 9.374486007709022}. Best is trial 98 with value: 0.8791208791208791.
[32m[I 2023-04-21 01:58:02,931][39m Trial 1263 finished with value: 0.8666666666666666 and parameters: {'objective': 'CrossEntropy', 'colsample_bylevel': 0.07698595777625195, 'depth': 4, 'boosting_type': 'Plain', 'bootstrap_type': 'Bayesian', 'bagging_temperature': 9.861288683728525}. Best is trial 98 with value: 0.8791208791208791.
[32m[I 2023-04-21 01:58:03,862][39m Trial 1264 finished with value: 0.8539325842696629 and parameters: {'objective': 'CrossEntropy', 'colsample_bylevel': 0.07623479095953846, 'depth': 4, 'boosting_type': 'Plain', 'bootstrap_type': 'Bayesian', 'bagging_temperature': 8.574955172554267}. Best is trial 98 with value: 0.8791208791208791.
[32m[I 2023-04-21 01:58:04,931][39m Trial 1265 finished with value: 0.8222222222222222 and parameters: {'objective': 'Logloss', 'colsample_bylevel': 0.06643235369699883, 'depth': 3, 'boosting_type': 'Plain', 'bootstrap_type': 'MVS'}. Best is trial 98 with value: 0.8791208791208791.
[32m[I 2023-04-21 01:58:05,709][39m Trial 1266 finished with value: 0.8539325842696629 and parameters: {'objective': 'CrossEntropy', 'colsample_bylevel': 0.08351363086332099, 'depth': 4, 'boosting_type': 'Plain', 'bootstrap_type': 'Bayesian', 'bagging_temperature': 9.193508996347319}. Best is trial 98 with value: 0.8791208791208791.
[32m[I 2023-04-21 01:58:06,313][39m Trial 1267 finished with value: 0.8409090909090909 and parameters: {'objective': 'CrossEntropy', 'colsample_bylevel': 0.08209235895335838, 'depth': 3, 'boosting_type': 'Plain', 'bootstrap_type': 'Bayesian', 'bagging_temperature': 9.573924238449775}. Best is trial 98 with value: 0.8791208791208791.
[32m[I 2023-04-21 01:58:07,099][39m Trial 1268 finished with value: 0.8505747126436782 and parameters: {'objective': 'CrossEntropy', 'colsample_bylevel': 0.08422298830190522, 'depth': 3, 'boosting_type': 'Plain', 'bootstrap_type': 'Bayesian', 'bagging_temperature': 9.431434409904988}. Best is trial 98 with value: 0.8791208791208791.
[32m[I 2023-04-21 01:58:07,960][39m Trial 1269 finished with value: 0.8791208791208791 and parameters: {'objective': 'CrossEntropy', 'colsample_bylevel': 0.079280780842706, 'depth': 3, 'boosting_type': 'Plain', 'bootstrap_type': 'Bayesian', 'bagging_temperature': 8.866608288259014}. Best is trial 98 with value: 0.8791208791208791.
[32m[I 2023-04-21 01:58:09,106][39m Trial 1270 finished with value: 0.8539325842696629 and parameters: {'objective': 'CrossEntropy', 'colsample_bylevel': 0.0803763010821014, 'depth': 4, 'boosting_type': 'Plain', 'bootstrap_type': 'Bayesian', 'bagging_temperature': 8.909139518144887}. Best is trial 98 with value: 0.8791208791208791.
[32m[I 2023-04-21 01:58:10,359][39m Trial 1271 finished with value: 0.8666666666666666 and parameters: {'objective': 'CrossEntropy', 'colsample_bylevel': 0.08203653845763621, 'depth': 3, 'boosting_type': 'Plain', 'bootstrap_type': 'Bayesian', 'bagging_temperature': 9.023991534521711}. Best is trial 98 with value: 0.8791208791208791.
[32m[I 2023-04-21 01:58:11,303][39m Trial 1272 finished with value: 0.8764044943820225 and parameters: {'objective': 'CrossEntropy', 'colsample_bylevel': 0.07855870346966083, 'depth': 3, 'boosting_type': 'Plain', 'bootstrap_type': 'Bayesian', 'bagging_temperature': 8.870677718380323}. Best is trial 98 with value: 0.8791208791208791.
[32m[I 2023-04-21 01:58:11,932][39m Trial 1273 finished with value: 0.8666666666666666 and parameters: {'objective': 'CrossEntropy', 'colsample_bylevel': 0.07864474904946095, 'depth': 4, 'boosting_type': 'Plain', 'bootstrap_type': 'Bayesian', 'bagging_temperature': 9.726038007281266}. Best is trial 98 with value: 0.8791208791208791.
[32m[I 2023-04-21 01:58:12,575][39m Trial 1274 finished with value: 0.8764044943820225 and parameters: {'objective': 'CrossEntropy', 'colsample_bylevel': 0.07975216712358943, 'depth': 3, 'boosting_type': 'Plain', 'bootstrap_type': 'Bayesian', 'bagging_temperature': 9.580197724443606}. Best is trial 98 with value: 0.8791208791208791.
[32m[I 2023-04-21 01:58:17,498][39m Trial 1275 finished with value: 0.8539325842696629 and parameters: {'objective': 'CrossEntropy', 'colsample_bylevel': 0.08095634336878123, 'depth': 3, 'boosting_type': 'Ordered', 'bootstrap_type': 'Bayesian', 'bagging_temperature': 8.79823981674068}. Best is trial 98 with value: 0.8791208791208791.
[32m[I 2023-04-21 01:58:18,507][39m Trial 1276 finished with value: 0.8539325842696629 and parameters: {'objective': 'Logloss', 'colsample_bylevel': 0.07853893173949247, 'depth': 4, 'boosting_type': 'Plain', 'bootstrap_type': 'Bayesian', 'bagging_temperature': 8.330173806158184}. Best is trial 98 with value: 0.8791208791208791.
[32m[I 2023-04-21 01:58:19,554][39m Trial 1277 finished with value: 0.8539325842696629 and parameters: {'objective': 'CrossEntropy', 'colsample_bylevel': 0.0827772018014239, 'depth': 3, 'boosting_type': 'Plain', 'bootstrap_type': 'Bayesian', 'bagging_temperature': 9.051446052388597}. Best is trial 98 with value: 0.8791208791208791.
[32m[I 2023-04-21 01:58:20,245][39m Trial 1278 finished with value: 0.8666666666666666 and parameters: {'objective': 'CrossEntropy', 'colsample_bylevel': 0.08233675920616186, 'depth': 3, 'boosting_type': 'Plain', 'bootstrap_type': 'Bernoulli', 'subsample': 0.10495025804762215}. Best is trial 98 with value: 0.8791208791208791.
[32m[I 2023-04-21 01:58:21,131][39m Trial 1279 finished with value: 0.8409090909090909 and parameters: {'objective': 'CrossEntropy', 'colsample_bylevel': 0.09580878184597291, 'depth': 9, 'boosting_type': 'Plain', 'bootstrap_type': 'MVS'}. Best is trial 98 with value: 0.8791208791208791.
[32m[I 2023-04-21 01:58:21,991][39m Trial 1280 finished with value: 0.8275862068965518 and parameters: {'objective': 'CrossEntropy', 'colsample_bylevel': 0.09412768559951765, 'depth': 4, 'boosting_type': 'Plain', 'bootstrap_type': 'Bayesian', 'bagging_temperature': 9.984648628958888}. Best is trial 98 with value: 0.8791208791208791.
[32m[I 2023-04-21 01:58:23,024][39m Trial 1281 finished with value: 0.8275862068965518 and parameters: {'objective': 'CrossEntropy', 'colsample_bylevel': 0.09200593541828303, 'depth': 6, 'boosting_type': 'Plain', 'bootstrap_type': 'Bayesian', 'bagging_temperature': 9.446951515954469}. Best is trial 98 with value: 0.8791208791208791.
[32m[I 2023-04-21 01:58:24,211][39m Trial 1282 finished with value: 0.8791208791208791 and parameters: {'objective': 'Logloss', 'colsample_bylevel': 0.07542578220638066, 'depth': 4, 'boosting_type': 'Plain', 'bootstrap_type': 'Bayesian', 'bagging_temperature': 9.77235672564531}. Best is trial 98 with value: 0.8791208791208791.
[32m[I 2023-04-21 01:58:25,210][39m Trial 1283 finished with value: 0.8539325842696629 and parameters: {'objective': 'Logloss', 'colsample_bylevel': 0.07251639988404811, 'depth': 4, 'boosting_type': 'Plain', 'bootstrap_type': 'Bayesian', 'bagging_temperature': 9.76256109285897}. Best is trial 98 with value: 0.8791208791208791.
[32m[I 2023-04-21 01:58:25,957][39m Trial 1284 finished with value: 0.8539325842696629 and parameters: {'objective': 'CrossEntropy', 'colsample_bylevel': 0.07947802117942758, 'depth': 4, 'boosting_type': 'Plain', 'bootstrap_type': 'Bayesian', 'bagging_temperature': 9.81257210955276}. Best is trial 98 with value: 0.8791208791208791.
[32m[I 2023-04-21 01:58:26,539][39m Trial 1285 finished with value: 0.8409090909090909 and parameters: {'objective': 'CrossEntropy', 'colsample_bylevel': 0.07213285593594375, 'depth': 4, 'boosting_type': 'Plain', 'bootstrap_type': 'Bayesian', 'bagging_temperature': 9.264485160777692}. Best is trial 98 with value: 0.8791208791208791.
[32m[I 2023-04-21 01:58:27,662][39m Trial 1286 finished with value: 0.8539325842696629 and parameters: {'objective': 'Logloss', 'colsample_bylevel': 0.08540371374253819, 'depth': 4, 'boosting_type': 'Plain', 'bootstrap_type': 'Bayesian', 'bagging_temperature': 9.246383975159029}. Best is trial 98 with value: 0.8791208791208791.
[32m[I 2023-04-21 01:58:28,367][39m Trial 1287 finished with value: 0.8409090909090909 and parameters: {'objective': 'CrossEntropy', 'colsample_bylevel': 0.09699209392630022, 'depth': 3, 'boosting_type': 'Plain', 'bootstrap_type': 'Bayesian', 'bagging_temperature': 2.731038443888634}. Best is trial 98 with value: 0.8791208791208791.
[32m[I 2023-04-21 01:58:29,272][39m Trial 1288 finished with value: 0.8539325842696629 and parameters: {'objective': 'Logloss', 'colsample_bylevel': 0.08987576776373213, 'depth': 5, 'boosting_type': 'Plain', 'bootstrap_type': 'Bayesian', 'bagging_temperature': 9.607424188927304}. Best is trial 98 with value: 0.8791208791208791.
[32m[I 2023-04-21 01:58:30,149][39m Trial 1289 finished with value: 0.8409090909090909 and parameters: {'objective': 'CrossEntropy', 'colsample_bylevel': 0.08442971803088703, 'depth': 5, 'boosting_type': 'Plain', 'bootstrap_type': 'Bayesian', 'bagging_temperature': 9.235526778868023}. Best is trial 98 with value: 0.8791208791208791.
[32m[I 2023-04-21 01:58:31,186][39m Trial 1290 finished with value: 0.8539325842696629 and parameters: {'objective': 'CrossEntropy', 'colsample_bylevel': 0.08069475930985999, 'depth': 3, 'boosting_type': 'Plain', 'bootstrap_type': 'Bayesian', 'bagging_temperature': 9.655449570168521}. Best is trial 98 with value: 0.8791208791208791.
[32m[I 2023-04-21 01:58:32,067][39m Trial 1291 finished with value: 0.8275862068965518 and parameters: {'objective': 'CrossEntropy', 'colsample_bylevel': 0.07707684422609971, 'depth': 4, 'boosting_type': 'Plain', 'bootstrap_type': 'MVS'}. Best is trial 98 with value: 0.8791208791208791.
[32m[I 2023-04-21 01:58:32,866][39m Trial 1292 finished with value: 0.8409090909090909 and parameters: {'objective': 'CrossEntropy', 'colsample_bylevel': 0.08773719891478088, 'depth': 3, 'boosting_type': 'Plain', 'bootstrap_type': 'Bayesian', 'bagging_temperature': 9.567030969534901}. Best is trial 98 with value: 0.8791208791208791.
[32m[I 2023-04-21 01:58:33,920][39m Trial 1293 finished with value: 0.8409090909090909 and parameters: {'objective': 'CrossEntropy', 'colsample_bylevel': 0.07947080126282402, 'depth': 4, 'boosting_type': 'Plain', 'bootstrap_type': 'Bayesian', 'bagging_temperature': 9.350163217712112}. Best is trial 98 with value: 0.8791208791208791.
[32m[I 2023-04-21 01:58:38,684][39m Trial 1294 finished with value: 0.8539325842696629 and parameters: {'objective': 'CrossEntropy', 'colsample_bylevel': 0.08000625797500217, 'depth': 4, 'boosting_type': 'Ordered', 'bootstrap_type': 'Bayesian', 'bagging_temperature': 9.464203575156692}. Best is trial 98 with value: 0.8791208791208791.
[32m[I 2023-04-21 01:58:39,994][39m Trial 1295 finished with value: 0.8409090909090909 and parameters: {'objective': 'CrossEntropy', 'colsample_bylevel': 0.09066038412762498, 'depth': 3, 'boosting_type': 'Plain', 'bootstrap_type': 'Bayesian', 'bagging_temperature': 9.959582966148274}. Best is trial 98 with value: 0.8791208791208791.
[32m[I 2023-04-21 01:58:40,708][39m Trial 1296 finished with value: 0.8539325842696629 and parameters: {'objective': 'CrossEntropy', 'colsample_bylevel': 0.07856483423943889, 'depth': 4, 'boosting_type': 'Plain', 'bootstrap_type': 'Bayesian', 'bagging_temperature': 8.784780676608884}. Best is trial 98 with value: 0.8791208791208791.
[32m[I 2023-04-21 01:58:41,689][39m Trial 1297 finished with value: 0.8666666666666666 and parameters: {'objective': 'CrossEntropy', 'colsample_bylevel': 0.088578216231712, 'depth': 3, 'boosting_type': 'Plain', 'bootstrap_type': 'Bayesian', 'bagging_temperature': 7.7459117301565765}. Best is trial 98 with value: 0.8791208791208791.
[32m[I 2023-04-21 01:58:42,387][39m Trial 1298 finished with value: 0.8539325842696629 and parameters: {'objective': 'CrossEntropy', 'colsample_bylevel': 0.07519338476340856, 'depth': 3, 'boosting_type': 'Plain', 'bootstrap_type': 'Bayesian', 'bagging_temperature': 8.528637801635533}. Best is trial 98 with value: 0.8791208791208791.
[32m[I 2023-04-21 01:58:43,236][39m Trial 1299 finished with value: 0.8139534883720929 and parameters: {'objective': 'CrossEntropy', 'colsample_bylevel': 0.08241477480313089, 'depth': 5, 'boosting_type': 'Plain', 'bootstrap_type': 'Bernoulli', 'subsample': 0.4326261351912539}. Best is trial 98 with value: 0.8791208791208791.
[32m[I 2023-04-21 01:58:44,383][39m Trial 1300 finished with value: 0.8666666666666666 and parameters: {'objective': 'CrossEntropy', 'colsample_bylevel': 0.08625101649892027, 'depth': 3, 'boosting_type': 'Plain', 'bootstrap_type': 'Bayesian', 'bagging_temperature': 9.984155955255849}. Best is trial 98 with value: 0.8791208791208791.
[32m[I 2023-04-21 01:58:45,149][39m Trial 1301 finished with value: 0.8666666666666666 and parameters: {'objective': 'CrossEntropy', 'colsample_bylevel': 0.07701919114082549, 'depth': 3, 'boosting_type': 'Plain', 'bootstrap_type': 'Bayesian', 'bagging_temperature': 9.618452790605572}. Best is trial 98 with value: 0.8791208791208791.
[32m[I 2023-04-21 01:58:46,134][39m Trial 1302 finished with value: 0.8539325842696629 and parameters: {'objective': 'CrossEntropy', 'colsample_bylevel': 0.0785290269192621, 'depth': 4, 'boosting_type': 'Plain', 'bootstrap_type': 'Bayesian', 'bagging_temperature': 9.65657224793511}. Best is trial 98 with value: 0.8791208791208791.
[32m[I 2023-04-21 01:58:47,280][39m Trial 1303 finished with value: 0.8666666666666666 and parameters: {'objective': 'CrossEntropy', 'colsample_bylevel': 0.0700635952746375, 'depth': 8, 'boosting_type': 'Plain', 'bootstrap_type': 'Bayesian', 'bagging_temperature': 8.651131252011563}. Best is trial 98 with value: 0.8791208791208791.
[32m[I 2023-04-21 01:58:48,272][39m Trial 1304 finished with value: 0.8666666666666666 and parameters: {'objective': 'CrossEntropy', 'colsample_bylevel': 0.08350975638396552, 'depth': 3, 'boosting_type': 'Plain', 'bootstrap_type': 'Bayesian', 'bagging_temperature': 9.068461295029467}. Best is trial 98 with value: 0.8791208791208791.
[32m[I 2023-04-21 01:58:48,865][39m Trial 1305 finished with value: 0.8409090909090909 and parameters: {'objective': 'CrossEntropy', 'colsample_bylevel': 0.07791865059735574, 'depth': 4, 'boosting_type': 'Plain', 'bootstrap_type': 'MVS'}. Best is trial 98 with value: 0.8791208791208791.
[32m[I 2023-04-21 01:58:49,769][39m Trial 1306 finished with value: 0.8666666666666666 and parameters: {'objective': 'Logloss', 'colsample_bylevel': 0.07456760404929769, 'depth': 4, 'boosting_type': 'Plain', 'bootstrap_type': 'Bayesian', 'bagging_temperature': 9.753153465953647}. Best is trial 98 with value: 0.8791208791208791.
[32m[I 2023-04-21 01:58:50,584][39m Trial 1307 finished with value: 0.8666666666666666 and parameters: {'objective': 'CrossEntropy', 'colsample_bylevel': 0.0839606127677336, 'depth': 3, 'boosting_type': 'Plain', 'bootstrap_type': 'Bayesian', 'bagging_temperature': 9.128552361873265}. Best is trial 98 with value: 0.8791208791208791.
[32m[I 2023-04-21 01:58:51,409][39m Trial 1308 finished with value: 0.8409090909090909 and parameters: {'objective': 'CrossEntropy', 'colsample_bylevel': 0.08003168318535567, 'depth': 5, 'boosting_type': 'Plain', 'bootstrap_type': 'Bayesian', 'bagging_temperature': 9.904369083553721}. Best is trial 98 with value: 0.8791208791208791.
[32m[I 2023-04-21 01:58:52,489][39m Trial 1309 finished with value: 0.8539325842696629 and parameters: {'objective': 'CrossEntropy', 'colsample_bylevel': 0.08131229919584944, 'depth': 3, 'boosting_type': 'Plain', 'bootstrap_type': 'Bayesian', 'bagging_temperature': 8.5551885320296}. Best is trial 98 with value: 0.8791208791208791.
[32m[I 2023-04-21 01:58:53,527][39m Trial 1310 finished with value: 0.8539325842696629 and parameters: {'objective': 'Logloss', 'colsample_bylevel': 0.07375889140414987, 'depth': 4, 'boosting_type': 'Plain', 'bootstrap_type': 'Bayesian', 'bagging_temperature': 9.840147342109253}. Best is trial 98 with value: 0.8791208791208791.
[32m[I 2023-04-21 01:58:54,372][39m Trial 1311 finished with value: 0.8539325842696629 and parameters: {'objective': 'Logloss', 'colsample_bylevel': 0.07075304067354092, 'depth': 4, 'boosting_type': 'Plain', 'bootstrap_type': 'Bayesian', 'bagging_temperature': 9.483255825008506}. Best is trial 98 with value: 0.8791208791208791.
[32m[I 2023-04-21 01:58:54,964][39m Trial 1312 finished with value: 0.8571428571428571 and parameters: {'objective': 'Logloss', 'colsample_bylevel': 0.07558068282396437, 'depth': 4, 'boosting_type': 'Plain', 'bootstrap_type': 'Bayesian', 'bagging_temperature': 8.822789098070546}. Best is trial 98 with value: 0.8791208791208791.
[32m[I 2023-04-21 01:58:59,838][39m Trial 1313 finished with value: 0.8409090909090909 and parameters: {'objective': 'CrossEntropy', 'colsample_bylevel': 0.0714658235887322, 'depth': 4, 'boosting_type': 'Ordered', 'bootstrap_type': 'Bayesian', 'bagging_temperature': 8.025206707819088}. Best is trial 98 with value: 0.8791208791208791.
[32m[I 2023-04-21 01:59:00,935][39m Trial 1314 finished with value: 0.8791208791208791 and parameters: {'objective': 'CrossEntropy', 'colsample_bylevel': 0.07364399749574456, 'depth': 4, 'boosting_type': 'Plain', 'bootstrap_type': 'Bayesian', 'bagging_temperature': 9.476927034541674}. Best is trial 98 with value: 0.8791208791208791.
[32m[I 2023-04-21 01:59:01,983][39m Trial 1315 finished with value: 0.8275862068965518 and parameters: {'objective': 'CrossEntropy', 'colsample_bylevel': 0.07598258275185985, 'depth': 4, 'boosting_type': 'Plain', 'bootstrap_type': 'MVS'}. Best is trial 98 with value: 0.8791208791208791.
[32m[I 2023-04-21 01:59:02,732][39m Trial 1316 finished with value: 0.8539325842696629 and parameters: {'objective': 'CrossEntropy', 'colsample_bylevel': 0.07339725018928123, 'depth': 4, 'boosting_type': 'Plain', 'bootstrap_type': 'Bayesian', 'bagging_temperature': 9.794734765206217}. Best is trial 98 with value: 0.8791208791208791.
[32m[I 2023-04-21 01:59:03,467][39m Trial 1317 finished with value: 0.8791208791208791 and parameters: {'objective': 'CrossEntropy', 'colsample_bylevel': 0.08238763436068568, 'depth': 4, 'boosting_type': 'Plain', 'bootstrap_type': 'Bayesian', 'bagging_temperature': 9.67092935431306}. Best is trial 98 with value: 0.8791208791208791.
[32m[I 2023-04-21 01:59:04,526][39m Trial 1318 finished with value: 0.8539325842696629 and parameters: {'objective': 'Logloss', 'colsample_bylevel': 0.07520685798415852, 'depth': 5, 'boosting_type': 'Plain', 'bootstrap_type': 'Bayesian', 'bagging_temperature': 9.152502687526454}. Best is trial 98 with value: 0.8791208791208791.
[32m[I 2023-04-21 01:59:05,280][39m Trial 1319 finished with value: 0.8275862068965518 and parameters: {'objective': 'Logloss', 'colsample_bylevel': 0.08134334093724795, 'depth': 4, 'boosting_type': 'Plain', 'bootstrap_type': 'Bayesian', 'bagging_temperature': 9.651800315479326}. Best is trial 98 with value: 0.8791208791208791.
[32m[I 2023-04-21 01:59:06,523][39m Trial 1320 finished with value: 0.8275862068965518 and parameters: {'objective': 'CrossEntropy', 'colsample_bylevel': 0.08190620843150896, 'depth': 6, 'boosting_type': 'Plain', 'bootstrap_type': 'Bayesian', 'bagging_temperature': 9.75360690998985}. Best is trial 98 with value: 0.8791208791208791.
[32m[I 2023-04-21 01:59:07,431][39m Trial 1321 finished with value: 0.8791208791208791 and parameters: {'objective': 'CrossEntropy', 'colsample_bylevel': 0.07726290435661069, 'depth': 10, 'boosting_type': 'Plain', 'bootstrap_type': 'Bayesian', 'bagging_temperature': 9.885015068021925}. Best is trial 98 with value: 0.8791208791208791.
[32m[I 2023-04-21 01:59:08,531][39m Trial 1322 finished with value: 0.8372093023255814 and parameters: {'objective': 'CrossEntropy', 'colsample_bylevel': 0.08556971787209365, 'depth': 9, 'boosting_type': 'Plain', 'bootstrap_type': 'Bayesian', 'bagging_temperature': 9.472285431592798}. Best is trial 98 with value: 0.8791208791208791.
