[32m[I 2023-04-21 03:07:11,552][39m Trial 4804 finished with value: 0.8539325842696629 and parameters: {'objective': 'CrossEntropy', 'colsample_bylevel': 0.07783715109598469, 'depth': 4, 'boosting_type': 'Plain', 'bootstrap_type': 'Bayesian', 'bagging_temperature': 9.80596237483978}. Best is trial 3065 with value: 0.8863636363636364.
[32m[I 2023-04-21 03:07:13,280][39m Trial 4805 finished with value: 0.8409090909090909 and parameters: {'objective': 'CrossEntropy', 'colsample_bylevel': 0.07781471350930277, 'depth': 9, 'boosting_type': 'Plain', 'bootstrap_type': 'Bayesian', 'bagging_temperature': 9.867015042344038}. Best is trial 3065 with value: 0.8863636363636364.
[32m[I 2023-04-21 03:07:14,342][39m Trial 4806 finished with value: 0.8409090909090909 and parameters: {'objective': 'CrossEntropy', 'colsample_bylevel': 0.08549533310818362, 'depth': 10, 'boosting_type': 'Plain', 'bootstrap_type': 'Bayesian', 'bagging_temperature': 9.483685237457353}. Best is trial 3065 with value: 0.8863636363636364.
[32m[I 2023-04-21 03:07:15,110][39m Trial 4807 finished with value: 0.8409090909090909 and parameters: {'objective': 'CrossEntropy', 'colsample_bylevel': 0.07646542975961539, 'depth': 10, 'boosting_type': 'Plain', 'bootstrap_type': 'Bernoulli', 'subsample': 0.5694119868995554}. Best is trial 3065 with value: 0.8863636363636364.
[32m[I 2023-04-21 03:07:15,919][39m Trial 4808 finished with value: 0.8139534883720929 and parameters: {'objective': 'CrossEntropy', 'colsample_bylevel': 0.07258861868139119, 'depth': 8, 'boosting_type': 'Plain', 'bootstrap_type': 'Bayesian', 'bagging_temperature': 9.676883079968935}. Best is trial 3065 with value: 0.8863636363636364.
[32m[I 2023-04-21 03:07:16,969][39m Trial 4809 finished with value: 0.8539325842696629 and parameters: {'objective': 'CrossEntropy', 'colsample_bylevel': 0.07568599760989811, 'depth': 4, 'boosting_type': 'Plain', 'bootstrap_type': 'Bayesian', 'bagging_temperature': 9.983633156521321}. Best is trial 3065 with value: 0.8863636363636364.
[32m[I 2023-04-21 03:07:18,244][39m Trial 4810 finished with value: 0.8636363636363636 and parameters: {'objective': 'CrossEntropy', 'colsample_bylevel': 0.09283689905048664, 'depth': 8, 'boosting_type': 'Plain', 'bootstrap_type': 'Bayesian', 'bagging_temperature': 9.984265000689504}. Best is trial 3065 with value: 0.8863636363636364.
[32m[I 2023-04-21 03:07:19,444][39m Trial 4811 finished with value: 0.8409090909090909 and parameters: {'objective': 'Logloss', 'colsample_bylevel': 0.0993031838211692, 'depth': 10, 'boosting_type': 'Plain', 'bootstrap_type': 'Bayesian', 'bagging_temperature': 8.590082246499806}. Best is trial 3065 with value: 0.8863636363636364.
[32m[I 2023-04-21 03:07:20,733][39m Trial 4812 finished with value: 0.8666666666666666 and parameters: {'objective': 'Logloss', 'colsample_bylevel': 0.07068336908818072, 'depth': 5, 'boosting_type': 'Plain', 'bootstrap_type': 'Bayesian', 'bagging_temperature': 9.992743136547489}. Best is trial 3065 with value: 0.8863636363636364.
[32m[I 2023-04-21 03:07:25,099][39m Trial 4813 finished with value: 0.8139534883720929 and parameters: {'objective': 'CrossEntropy', 'colsample_bylevel': 0.07603443816530292, 'depth': 4, 'boosting_type': 'Ordered', 'bootstrap_type': 'Bayesian', 'bagging_temperature': 9.15765437690778}. Best is trial 3065 with value: 0.8863636363636364.
[32m[I 2023-04-21 03:07:26,211][39m Trial 4814 finished with value: 0.8275862068965518 and parameters: {'objective': 'CrossEntropy', 'colsample_bylevel': 0.0745618564399481, 'depth': 8, 'boosting_type': 'Plain', 'bootstrap_type': 'Bayesian', 'bagging_temperature': 8.956928205636867}. Best is trial 3065 with value: 0.8863636363636364.
[32m[I 2023-04-21 03:07:27,589][39m Trial 4815 finished with value: 0.8539325842696629 and parameters: {'objective': 'CrossEntropy', 'colsample_bylevel': 0.08540373729273334, 'depth': 3, 'boosting_type': 'Plain', 'bootstrap_type': 'Bayesian', 'bagging_temperature': 9.26960870351159}. Best is trial 3065 with value: 0.8863636363636364.
[32m[I 2023-04-21 03:07:28,609][39m Trial 4816 finished with value: 0.8539325842696629 and parameters: {'objective': 'CrossEntropy', 'colsample_bylevel': 0.07265631149486078, 'depth': 4, 'boosting_type': 'Plain', 'bootstrap_type': 'Bayesian', 'bagging_temperature': 9.382757586341587}. Best is trial 3065 with value: 0.8863636363636364.
[32m[I 2023-04-21 03:07:29,624][39m Trial 4817 finished with value: 0.8666666666666666 and parameters: {'objective': 'CrossEntropy', 'colsample_bylevel': 0.07177713905922864, 'depth': 4, 'boosting_type': 'Plain', 'bootstrap_type': 'Bayesian', 'bagging_temperature': 9.369070796956752}. Best is trial 3065 with value: 0.8863636363636364.
[32m[I 2023-04-21 03:07:30,620][39m Trial 4818 finished with value: 0.8666666666666666 and parameters: {'objective': 'Logloss', 'colsample_bylevel': 0.07126932858980393, 'depth': 7, 'boosting_type': 'Plain', 'bootstrap_type': 'Bayesian', 'bagging_temperature': 9.974297545401217}. Best is trial 3065 with value: 0.8863636363636364.
[32m[I 2023-04-21 03:07:31,689][39m Trial 4819 finished with value: 0.7999999999999999 and parameters: {'objective': 'CrossEntropy', 'colsample_bylevel': 0.06933455617896137, 'depth': 7, 'boosting_type': 'Plain', 'bootstrap_type': 'Bayesian', 'bagging_temperature': 9.34996620539342}. Best is trial 3065 with value: 0.8863636363636364.
[32m[I 2023-04-21 03:07:33,061][39m Trial 4820 finished with value: 0.8539325842696629 and parameters: {'objective': 'CrossEntropy', 'colsample_bylevel': 0.07929552409595096, 'depth': 3, 'boosting_type': 'Plain', 'bootstrap_type': 'Bayesian', 'bagging_temperature': 9.173801783229688}. Best is trial 3065 with value: 0.8863636363636364.
[32m[I 2023-04-21 03:07:34,137][39m Trial 4821 finished with value: 0.8275862068965518 and parameters: {'objective': 'CrossEntropy', 'colsample_bylevel': 0.0880472182267223, 'depth': 5, 'boosting_type': 'Plain', 'bootstrap_type': 'MVS'}. Best is trial 3065 with value: 0.8863636363636364.
[32m[I 2023-04-21 03:07:35,282][39m Trial 4822 finished with value: 0.8539325842696629 and parameters: {'objective': 'CrossEntropy', 'colsample_bylevel': 0.07589584258595039, 'depth': 10, 'boosting_type': 'Plain', 'bootstrap_type': 'Bayesian', 'bagging_temperature': 9.46210213183101}. Best is trial 3065 with value: 0.8863636363636364.
[32m[I 2023-04-21 03:07:35,999][39m Trial 4823 finished with value: 0.8409090909090909 and parameters: {'objective': 'CrossEntropy', 'colsample_bylevel': 0.07594632736889677, 'depth': 10, 'boosting_type': 'Plain', 'bootstrap_type': 'Bayesian', 'bagging_temperature': 8.366655020963105}. Best is trial 3065 with value: 0.8863636363636364.
[32m[I 2023-04-21 03:07:36,720][39m Trial 4824 finished with value: 0.8409090909090909 and parameters: {'objective': 'CrossEntropy', 'colsample_bylevel': 0.07496617905676327, 'depth': 10, 'boosting_type': 'Plain', 'bootstrap_type': 'Bayesian', 'bagging_temperature': 9.739953115417391}. Best is trial 3065 with value: 0.8863636363636364.
[32m[I 2023-04-21 03:07:37,530][39m Trial 4825 finished with value: 0.8539325842696629 and parameters: {'objective': 'CrossEntropy', 'colsample_bylevel': 0.06739418692998246, 'depth': 9, 'boosting_type': 'Plain', 'bootstrap_type': 'Bayesian', 'bagging_temperature': 9.539053313863512}. Best is trial 3065 with value: 0.8863636363636364.
[32m[I 2023-04-21 03:07:38,852][39m Trial 4826 finished with value: 0.8409090909090909 and parameters: {'objective': 'CrossEntropy', 'colsample_bylevel': 0.07958812770544935, 'depth': 4, 'boosting_type': 'Plain', 'bootstrap_type': 'Bayesian', 'bagging_temperature': 9.511543052298247}. Best is trial 3065 with value: 0.8863636363636364.
[32m[I 2023-04-21 03:07:40,098][39m Trial 4827 finished with value: 0.8409090909090909 and parameters: {'objective': 'CrossEntropy', 'colsample_bylevel': 0.07939018237476445, 'depth': 4, 'boosting_type': 'Plain', 'bootstrap_type': 'Bayesian', 'bagging_temperature': 9.592397084295664}. Best is trial 3065 with value: 0.8863636363636364.
[32m[I 2023-04-21 03:07:44,953][39m Trial 4828 finished with value: 0.8139534883720929 and parameters: {'objective': 'CrossEntropy', 'colsample_bylevel': 0.07738093087105676, 'depth': 3, 'boosting_type': 'Ordered', 'bootstrap_type': 'Bayesian', 'bagging_temperature': 9.983532147706198}. Best is trial 3065 with value: 0.8863636363636364.
[32m[I 2023-04-21 03:07:46,317][39m Trial 4829 finished with value: 0.8539325842696629 and parameters: {'objective': 'Logloss', 'colsample_bylevel': 0.07951437421101974, 'depth': 3, 'boosting_type': 'Plain', 'bootstrap_type': 'Bayesian', 'bagging_temperature': 8.214978308246131}. Best is trial 3065 with value: 0.8863636363636364.
[32m[I 2023-04-21 03:07:47,465][39m Trial 4830 finished with value: 0.8409090909090909 and parameters: {'objective': 'CrossEntropy', 'colsample_bylevel': 0.0919295829325033, 'depth': 8, 'boosting_type': 'Plain', 'bootstrap_type': 'Bayesian', 'bagging_temperature': 8.59735165415582}. Best is trial 3065 with value: 0.8863636363636364.
[32m[I 2023-04-21 03:07:48,656][39m Trial 4831 finished with value: 0.8539325842696629 and parameters: {'objective': 'Logloss', 'colsample_bylevel': 0.07372139382424046, 'depth': 4, 'boosting_type': 'Plain', 'bootstrap_type': 'Bayesian', 'bagging_temperature': 7.263840306455862}. Best is trial 3065 with value: 0.8863636363636364.
[32m[I 2023-04-21 03:07:49,830][39m Trial 4832 finished with value: 0.8505747126436782 and parameters: {'objective': 'CrossEntropy', 'colsample_bylevel': 0.09365648157586491, 'depth': 8, 'boosting_type': 'Plain', 'bootstrap_type': 'Bayesian', 'bagging_temperature': 9.989048482630135}. Best is trial 3065 with value: 0.8863636363636364.
[32m[I 2023-04-21 03:07:50,798][39m Trial 4833 finished with value: 0.8539325842696629 and parameters: {'objective': 'CrossEntropy', 'colsample_bylevel': 0.08434685038596648, 'depth': 2, 'boosting_type': 'Plain', 'bootstrap_type': 'Bayesian', 'bagging_temperature': 9.500340260235777}. Best is trial 3065 with value: 0.8863636363636364.
[32m[I 2023-04-21 03:07:51,614][39m Trial 4834 finished with value: 0.8636363636363636 and parameters: {'objective': 'CrossEntropy', 'colsample_bylevel': 0.09219125667573255, 'depth': 8, 'boosting_type': 'Plain', 'bootstrap_type': 'Bayesian', 'bagging_temperature': 9.991825496999722}. Best is trial 3065 with value: 0.8863636363636364.
[32m[I 2023-04-21 03:07:52,320][39m Trial 4835 finished with value: 0.8539325842696629 and parameters: {'objective': 'Logloss', 'colsample_bylevel': 0.07040984831748348, 'depth': 5, 'boosting_type': 'Plain', 'bootstrap_type': 'Bayesian', 'bagging_temperature': 9.670316235509103}. Best is trial 3065 with value: 0.8863636363636364.
[32m[I 2023-04-21 03:07:53,717][39m Trial 4836 finished with value: 0.8505747126436782 and parameters: {'objective': 'CrossEntropy', 'colsample_bylevel': 0.09328470133623562, 'depth': 8, 'boosting_type': 'Plain', 'bootstrap_type': 'Bayesian', 'bagging_temperature': 8.403036342780345}. Best is trial 3065 with value: 0.8863636363636364.
[32m[I 2023-04-21 03:07:54,766][39m Trial 4837 finished with value: 0.8539325842696629 and parameters: {'objective': 'Logloss', 'colsample_bylevel': 0.07882330044281348, 'depth': 7, 'boosting_type': 'Plain', 'bootstrap_type': 'Bernoulli', 'subsample': 0.4742644764744673}. Best is trial 3065 with value: 0.8863636363636364.
[32m[I 2023-04-21 03:07:56,210][39m Trial 4838 finished with value: 0.8539325842696629 and parameters: {'objective': 'CrossEntropy', 'colsample_bylevel': 0.07909220234649339, 'depth': 9, 'boosting_type': 'Plain', 'bootstrap_type': 'Bayesian', 'bagging_temperature': 9.497144759670391}. Best is trial 3065 with value: 0.8863636363636364.
[32m[I 2023-04-21 03:07:57,109][39m Trial 4839 finished with value: 0.8636363636363636 and parameters: {'objective': 'CrossEntropy', 'colsample_bylevel': 0.09211682246218526, 'depth': 11, 'boosting_type': 'Plain', 'bootstrap_type': 'Bayesian', 'bagging_temperature': 9.704868752814495}. Best is trial 3065 with value: 0.8863636363636364.
[32m[I 2023-04-21 03:07:57,878][39m Trial 4840 finished with value: 0.8409090909090909 and parameters: {'objective': 'CrossEntropy', 'colsample_bylevel': 0.0683550192066976, 'depth': 9, 'boosting_type': 'Plain', 'bootstrap_type': 'Bayesian', 'bagging_temperature': 9.802464567752212}. Best is trial 3065 with value: 0.8863636363636364.
[32m[I 2023-04-21 03:07:58,723][39m Trial 4841 finished with value: 0.8666666666666666 and parameters: {'objective': 'CrossEntropy', 'colsample_bylevel': 0.08271896742891757, 'depth': 3, 'boosting_type': 'Plain', 'bootstrap_type': 'Bayesian', 'bagging_temperature': 9.583503190767136}. Best is trial 3065 with value: 0.8863636363636364.
[32m[I 2023-04-21 03:07:59,762][39m Trial 4842 finished with value: 0.8666666666666666 and parameters: {'objective': 'CrossEntropy', 'colsample_bylevel': 0.08182854661951004, 'depth': 3, 'boosting_type': 'Plain', 'bootstrap_type': 'Bayesian', 'bagging_temperature': 9.78944911323073}. Best is trial 3065 with value: 0.8863636363636364.
[32m[I 2023-04-21 03:08:01,536][39m Trial 4843 finished with value: 0.8505747126436782 and parameters: {'objective': 'CrossEntropy', 'colsample_bylevel': 0.08416110289596017, 'depth': 9, 'boosting_type': 'Plain', 'bootstrap_type': 'Bayesian', 'bagging_temperature': 9.278283089649227}. Best is trial 3065 with value: 0.8863636363636364.
[32m[I 2023-04-21 03:08:02,513][39m Trial 4844 finished with value: 0.8539325842696629 and parameters: {'objective': 'CrossEntropy', 'colsample_bylevel': 0.08991536818023335, 'depth': 3, 'boosting_type': 'Plain', 'bootstrap_type': 'Bayesian', 'bagging_temperature': 9.836574945002054}. Best is trial 3065 with value: 0.8863636363636364.
[32m[I 2023-04-21 03:08:03,622][39m Trial 4845 finished with value: 0.8409090909090909 and parameters: {'objective': 'CrossEntropy', 'colsample_bylevel': 0.09345637806436898, 'depth': 3, 'boosting_type': 'Plain', 'bootstrap_type': 'Bayesian', 'bagging_temperature': 9.857003621457164}. Best is trial 3065 with value: 0.8863636363636364.
[32m[I 2023-04-21 03:08:08,471][39m Trial 4846 finished with value: 0.8409090909090909 and parameters: {'objective': 'CrossEntropy', 'colsample_bylevel': 0.0778703907952969, 'depth': 4, 'boosting_type': 'Ordered', 'bootstrap_type': 'Bayesian', 'bagging_temperature': 9.422227523611095}. Best is trial 3065 with value: 0.8863636363636364.
[32m[I 2023-04-21 03:08:09,525][39m Trial 4847 finished with value: 0.8539325842696629 and parameters: {'objective': 'Logloss', 'colsample_bylevel': 0.07778551026659765, 'depth': 5, 'boosting_type': 'Plain', 'bootstrap_type': 'Bayesian', 'bagging_temperature': 7.514078703183002}. Best is trial 3065 with value: 0.8863636363636364.
[32m[I 2023-04-21 03:08:10,674][39m Trial 4848 finished with value: 0.8409090909090909 and parameters: {'objective': 'CrossEntropy', 'colsample_bylevel': 0.08311919999625637, 'depth': 3, 'boosting_type': 'Plain', 'bootstrap_type': 'MVS'}. Best is trial 3065 with value: 0.8863636363636364.
[32m[I 2023-04-21 03:08:11,688][39m Trial 4849 finished with value: 0.8409090909090909 and parameters: {'objective': 'CrossEntropy', 'colsample_bylevel': 0.0737412516779559, 'depth': 10, 'boosting_type': 'Plain', 'bootstrap_type': 'Bayesian', 'bagging_temperature': 9.023832758867522}. Best is trial 3065 with value: 0.8863636363636364.
[32m[I 2023-04-21 03:08:12,533][39m Trial 4850 finished with value: 0.8505747126436782 and parameters: {'objective': 'CrossEntropy', 'colsample_bylevel': 0.08321776091741516, 'depth': 12, 'boosting_type': 'Plain', 'bootstrap_type': 'Bayesian', 'bagging_temperature': 3.9581132335508395}. Best is trial 3065 with value: 0.8863636363636364.
[32m[I 2023-04-21 03:08:13,385][39m Trial 4851 finished with value: 0.8409090909090909 and parameters: {'objective': 'CrossEntropy', 'colsample_bylevel': 0.05866470528281809, 'depth': 3, 'boosting_type': 'Plain', 'bootstrap_type': 'MVS'}. Best is trial 3065 with value: 0.8863636363636364.
[32m[I 2023-04-21 03:08:14,580][39m Trial 4852 finished with value: 0.8539325842696629 and parameters: {'objective': 'CrossEntropy', 'colsample_bylevel': 0.076463596280075, 'depth': 9, 'boosting_type': 'Plain', 'bootstrap_type': 'Bayesian', 'bagging_temperature': 9.336934179091132}. Best is trial 3065 with value: 0.8863636363636364.
[32m[I 2023-04-21 03:08:15,951][39m Trial 4853 finished with value: 0.8372093023255814 and parameters: {'objective': 'CrossEntropy', 'colsample_bylevel': 0.0844327485535248, 'depth': 9, 'boosting_type': 'Plain', 'bootstrap_type': 'Bayesian', 'bagging_temperature': 9.803585902083297}. Best is trial 3065 with value: 0.8863636363636364.
[32m[I 2023-04-21 03:08:16,977][39m Trial 4854 finished with value: 0.8539325842696629 and parameters: {'objective': 'CrossEntropy', 'colsample_bylevel': 0.08118024843687126, 'depth': 10, 'boosting_type': 'Plain', 'bootstrap_type': 'Bayesian', 'bagging_temperature': 9.44906053189922}. Best is trial 3065 with value: 0.8863636363636364.
[32m[I 2023-04-21 03:08:18,028][39m Trial 4855 finished with value: 0.8314606741573034 and parameters: {'objective': 'CrossEntropy', 'colsample_bylevel': 0.07968762693324774, 'depth': 2, 'boosting_type': 'Plain', 'bootstrap_type': 'Bernoulli', 'subsample': 0.6773129676202462}. Best is trial 3065 with value: 0.8863636363636364.
[32m[I 2023-04-21 03:08:18,698][39m Trial 4856 finished with value: 0.8139534883720929 and parameters: {'objective': 'CrossEntropy', 'colsample_bylevel': 0.09347365858530966, 'depth': 3, 'boosting_type': 'Plain', 'bootstrap_type': 'Bayesian', 'bagging_temperature': 8.125120372501422}. Best is trial 3065 with value: 0.8863636363636364.
[32m[I 2023-04-21 03:08:19,889][39m Trial 4857 finished with value: 0.8539325842696629 and parameters: {'objective': 'CrossEntropy', 'colsample_bylevel': 0.07931511564782036, 'depth': 3, 'boosting_type': 'Plain', 'bootstrap_type': 'Bayesian', 'bagging_temperature': 9.624708341648633}. Best is trial 3065 with value: 0.8863636363636364.
[32m[I 2023-04-21 03:08:20,568][39m Trial 4858 finished with value: 0.8666666666666666 and parameters: {'objective': 'CrossEntropy', 'colsample_bylevel': 0.08220355821792323, 'depth': 3, 'boosting_type': 'Plain', 'bootstrap_type': 'Bayesian', 'bagging_temperature': 9.247705616405385}. Best is trial 3065 with value: 0.8863636363636364.
[32m[I 2023-04-21 03:08:21,933][39m Trial 4859 finished with value: 0.8409090909090909 and parameters: {'objective': 'CrossEntropy', 'colsample_bylevel': 0.08322340900353462, 'depth': 3, 'boosting_type': 'Plain', 'bootstrap_type': 'MVS'}. Best is trial 3065 with value: 0.8863636363636364.
[32m[I 2023-04-21 03:08:23,593][39m Trial 4860 finished with value: 0.8666666666666666 and parameters: {'objective': 'CrossEntropy', 'colsample_bylevel': 0.0896682091941285, 'depth': 3, 'boosting_type': 'Plain', 'bootstrap_type': 'Bayesian', 'bagging_temperature': 9.82057298756202}. Best is trial 3065 with value: 0.8863636363636364.
[32m[I 2023-04-21 03:08:24,321][39m Trial 4861 finished with value: 0.8666666666666666 and parameters: {'objective': 'Logloss', 'colsample_bylevel': 0.07615886449158549, 'depth': 10, 'boosting_type': 'Plain', 'bootstrap_type': 'Bayesian', 'bagging_temperature': 9.551943749658225}. Best is trial 3065 with value: 0.8863636363636364.
[32m[I 2023-04-21 03:08:25,328][39m Trial 4862 finished with value: 0.8505747126436782 and parameters: {'objective': 'CrossEntropy', 'colsample_bylevel': 0.08273838996558225, 'depth': 9, 'boosting_type': 'Plain', 'bootstrap_type': 'Bayesian', 'bagging_temperature': 9.595112888675393}. Best is trial 3065 with value: 0.8863636363636364.
[32m[I 2023-04-21 03:08:26,167][39m Trial 4863 finished with value: 0.8539325842696629 and parameters: {'objective': 'Logloss', 'colsample_bylevel': 0.07307905342626844, 'depth': 4, 'boosting_type': 'Plain', 'bootstrap_type': 'Bayesian', 'bagging_temperature': 8.905371190179801}. Best is trial 3065 with value: 0.8863636363636364.
[32m[I 2023-04-21 03:08:27,113][39m Trial 4864 finished with value: 0.8275862068965518 and parameters: {'objective': 'CrossEntropy', 'colsample_bylevel': 0.07131121819885305, 'depth': 6, 'boosting_type': 'Plain', 'bootstrap_type': 'Bayesian', 'bagging_temperature': 8.79469534640056}. Best is trial 3065 with value: 0.8863636363636364.
[32m[I 2023-04-21 03:08:28,460][39m Trial 4865 finished with value: 0.8666666666666666 and parameters: {'objective': 'CrossEntropy', 'colsample_bylevel': 0.06843191735787285, 'depth': 7, 'boosting_type': 'Plain', 'bootstrap_type': 'Bayesian', 'bagging_temperature': 7.354749639574635}. Best is trial 3065 with value: 0.8863636363636364.
[32m[I 2023-04-21 03:08:33,324][39m Trial 4866 finished with value: 0.8505747126436782 and parameters: {'objective': 'CrossEntropy', 'colsample_bylevel': 0.07717339247926652, 'depth': 10, 'boosting_type': 'Ordered', 'bootstrap_type': 'Bayesian', 'bagging_temperature': 9.825411407179661}. Best is trial 3065 with value: 0.8863636363636364.
[32m[I 2023-04-21 03:08:34,838][39m Trial 4867 finished with value: 0.8275862068965518 and parameters: {'objective': 'CrossEntropy', 'colsample_bylevel': 0.07785074052425385, 'depth': 9, 'boosting_type': 'Plain', 'bootstrap_type': 'Bayesian', 'bagging_temperature': 0.848556573778084}. Best is trial 3065 with value: 0.8863636363636364.
[32m[I 2023-04-21 03:08:35,782][39m Trial 4868 finished with value: 0.8181818181818182 and parameters: {'objective': 'CrossEntropy', 'colsample_bylevel': 0.07693548313093289, 'depth': 2, 'boosting_type': 'Plain', 'bootstrap_type': 'MVS'}. Best is trial 3065 with value: 0.8863636363636364.
