[32m[I 2023-04-21 02:43:15,868][39m Trial 3628 finished with value: 0.8139534883720929 and parameters: {'objective': 'CrossEntropy', 'colsample_bylevel': 0.08088504260821823, 'depth': 6, 'boosting_type': 'Plain', 'bootstrap_type': 'MVS'}. Best is trial 3065 with value: 0.8863636363636364.
[32m[I 2023-04-21 02:43:17,062][39m Trial 3629 finished with value: 0.8505747126436782 and parameters: {'objective': 'CrossEntropy', 'colsample_bylevel': 0.081594937366283, 'depth': 10, 'boosting_type': 'Plain', 'bootstrap_type': 'Bayesian', 'bagging_temperature': 9.372475288205951}. Best is trial 3065 with value: 0.8863636363636364.
[32m[I 2023-04-21 02:43:21,892][39m Trial 3630 finished with value: 0.8539325842696629 and parameters: {'objective': 'CrossEntropy', 'colsample_bylevel': 0.08623156921994989, 'depth': 3, 'boosting_type': 'Ordered', 'bootstrap_type': 'Bayesian', 'bagging_temperature': 9.229765086807351}. Best is trial 3065 with value: 0.8863636363636364.
[32m[I 2023-04-21 02:43:23,310][39m Trial 3631 finished with value: 0.8372093023255814 and parameters: {'objective': 'CrossEntropy', 'colsample_bylevel': 0.09166580470618438, 'depth': 9, 'boosting_type': 'Plain', 'bootstrap_type': 'Bayesian', 'bagging_temperature': 8.990980479285142}. Best is trial 3065 with value: 0.8863636363636364.
[32m[I 2023-04-21 02:43:24,607][39m Trial 3632 finished with value: 0.8539325842696629 and parameters: {'objective': 'CrossEntropy', 'colsample_bylevel': 0.08167152390912444, 'depth': 9, 'boosting_type': 'Plain', 'bootstrap_type': 'Bayesian', 'bagging_temperature': 8.680346291418411}. Best is trial 3065 with value: 0.8863636363636364.
[32m[I 2023-04-21 02:43:25,501][39m Trial 3633 finished with value: 0.8666666666666666 and parameters: {'objective': 'CrossEntropy', 'colsample_bylevel': 0.07179591539503974, 'depth': 8, 'boosting_type': 'Plain', 'bootstrap_type': 'Bayesian', 'bagging_temperature': 9.735880366513777}. Best is trial 3065 with value: 0.8863636363636364.
[32m[I 2023-04-21 02:43:26,446][39m Trial 3634 finished with value: 0.8275862068965518 and parameters: {'objective': 'CrossEntropy', 'colsample_bylevel': 0.07562626156026367, 'depth': 11, 'boosting_type': 'Plain', 'bootstrap_type': 'Bernoulli', 'subsample': 0.8741867541642032}. Best is trial 3065 with value: 0.8863636363636364.
[32m[I 2023-04-21 02:43:27,439][39m Trial 3635 finished with value: 0.8409090909090909 and parameters: {'objective': 'CrossEntropy', 'colsample_bylevel': 0.09223339951646015, 'depth': 12, 'boosting_type': 'Plain', 'bootstrap_type': 'Bayesian', 'bagging_temperature': 9.790142982546353}. Best is trial 3065 with value: 0.8863636363636364.
[32m[I 2023-04-21 02:43:28,360][39m Trial 3636 finished with value: 0.8409090909090909 and parameters: {'objective': 'Logloss', 'colsample_bylevel': 0.08493742482665818, 'depth': 9, 'boosting_type': 'Plain', 'bootstrap_type': 'Bayesian', 'bagging_temperature': 9.253442954718103}. Best is trial 3065 with value: 0.8863636363636364.
[32m[I 2023-04-21 02:43:29,309][39m Trial 3637 finished with value: 0.8409090909090909 and parameters: {'objective': 'Logloss', 'colsample_bylevel': 0.08433102725978821, 'depth': 9, 'boosting_type': 'Plain', 'bootstrap_type': 'Bayesian', 'bagging_temperature': 9.247786699027484}. Best is trial 3065 with value: 0.8863636363636364.
[32m[I 2023-04-21 02:43:30,219][39m Trial 3638 finished with value: 0.8791208791208791 and parameters: {'objective': 'Logloss', 'colsample_bylevel': 0.07387793850145827, 'depth': 10, 'boosting_type': 'Plain', 'bootstrap_type': 'Bayesian', 'bagging_temperature': 8.770179932477058}. Best is trial 3065 with value: 0.8863636363636364.
[32m[I 2023-04-21 02:43:31,170][39m Trial 3639 finished with value: 0.8409090909090909 and parameters: {'objective': 'Logloss', 'colsample_bylevel': 0.06941443703048693, 'depth': 6, 'boosting_type': 'Plain', 'bootstrap_type': 'Bayesian', 'bagging_temperature': 8.862448179582564}. Best is trial 3065 with value: 0.8863636363636364.
[32m[I 2023-04-21 02:43:32,555][39m Trial 3640 finished with value: 0.8409090909090909 and parameters: {'objective': 'Logloss', 'colsample_bylevel': 0.07253753897271559, 'depth': 9, 'boosting_type': 'Plain', 'bootstrap_type': 'Bayesian', 'bagging_temperature': 7.9487126596879465}. Best is trial 3065 with value: 0.8863636363636364.
[32m[I 2023-04-21 02:43:33,449][39m Trial 3641 finished with value: 0.8409090909090909 and parameters: {'objective': 'Logloss', 'colsample_bylevel': 0.08966890033224441, 'depth': 5, 'boosting_type': 'Plain', 'bootstrap_type': 'Bayesian', 'bagging_temperature': 8.157182940122068}. Best is trial 3065 with value: 0.8863636363636364.
[32m[I 2023-04-21 02:43:34,325][39m Trial 3642 finished with value: 0.8539325842696629 and parameters: {'objective': 'CrossEntropy', 'colsample_bylevel': 0.08160471631168843, 'depth': 3, 'boosting_type': 'Plain', 'bootstrap_type': 'Bayesian', 'bagging_temperature': 9.14247867351791}. Best is trial 3065 with value: 0.8863636363636364.
[32m[I 2023-04-21 02:43:35,094][39m Trial 3643 finished with value: 0.8666666666666666 and parameters: {'objective': 'CrossEntropy', 'colsample_bylevel': 0.0816599350378659, 'depth': 3, 'boosting_type': 'Plain', 'bootstrap_type': 'Bayesian', 'bagging_temperature': 9.853508601204068}. Best is trial 3065 with value: 0.8863636363636364.
[32m[I 2023-04-21 02:43:35,703][39m Trial 3644 finished with value: 0.8666666666666666 and parameters: {'objective': 'CrossEntropy', 'colsample_bylevel': 0.0505808329234491, 'depth': 4, 'boosting_type': 'Plain', 'bootstrap_type': 'Bayesian', 'bagging_temperature': 9.786665385582348}. Best is trial 3065 with value: 0.8863636363636364.
[32m[I 2023-04-21 02:43:36,966][39m Trial 3645 finished with value: 0.8409090909090909 and parameters: {'objective': 'CrossEntropy', 'colsample_bylevel': 0.07070272857287568, 'depth': 12, 'boosting_type': 'Plain', 'bootstrap_type': 'Bayesian', 'bagging_temperature': 8.80640712765891}. Best is trial 3065 with value: 0.8863636363636364.
[32m[I 2023-04-21 02:43:38,443][39m Trial 3646 finished with value: 0.8275862068965518 and parameters: {'objective': 'Logloss', 'colsample_bylevel': 0.07916078696313648, 'depth': 8, 'boosting_type': 'Plain', 'bootstrap_type': 'Bayesian', 'bagging_temperature': 9.484644150342294}. Best is trial 3065 with value: 0.8863636363636364.
[32m[I 2023-04-21 02:43:42,919][39m Trial 3647 finished with value: 0.8409090909090909 and parameters: {'objective': 'CrossEntropy', 'colsample_bylevel': 0.08887748475287034, 'depth': 3, 'boosting_type': 'Ordered', 'bootstrap_type': 'Bayesian', 'bagging_temperature': 9.503901944599612}. Best is trial 3065 with value: 0.8863636363636364.
[32m[I 2023-04-21 02:43:44,133][39m Trial 3648 finished with value: 0.8409090909090909 and parameters: {'objective': 'Logloss', 'colsample_bylevel': 0.07973536212196375, 'depth': 4, 'boosting_type': 'Plain', 'bootstrap_type': 'Bayesian', 'bagging_temperature': 9.288561363320616}. Best is trial 3065 with value: 0.8863636363636364.
[32m[I 2023-04-21 02:43:45,358][39m Trial 3649 finished with value: 0.8539325842696629 and parameters: {'objective': 'CrossEntropy', 'colsample_bylevel': 0.07659755768783953, 'depth': 12, 'boosting_type': 'Plain', 'bootstrap_type': 'Bayesian', 'bagging_temperature': 9.446738874516099}. Best is trial 3065 with value: 0.8863636363636364.
[32m[I 2023-04-21 02:43:46,615][39m Trial 3650 finished with value: 0.8235294117647058 and parameters: {'objective': 'CrossEntropy', 'colsample_bylevel': 0.08323454216832973, 'depth': 11, 'boosting_type': 'Plain', 'bootstrap_type': 'Bayesian', 'bagging_temperature': 8.976290557003146}. Best is trial 3065 with value: 0.8863636363636364.
[32m[I 2023-04-21 02:43:47,501][39m Trial 3651 finished with value: 0.8539325842696629 and parameters: {'objective': 'CrossEntropy', 'colsample_bylevel': 0.09267638958656828, 'depth': 3, 'boosting_type': 'Plain', 'bootstrap_type': 'Bayesian', 'bagging_temperature': 8.607134870674036}. Best is trial 3065 with value: 0.8863636363636364.
[32m[I 2023-04-21 02:43:48,396][39m Trial 3652 finished with value: 0.8409090909090909 and parameters: {'objective': 'CrossEntropy', 'colsample_bylevel': 0.07634893075818415, 'depth': 9, 'boosting_type': 'Plain', 'bootstrap_type': 'Bayesian', 'bagging_temperature': 7.384082652898815}. Best is trial 3065 with value: 0.8863636363636364.
[32m[I 2023-04-21 02:43:49,477][39m Trial 3653 finished with value: 0.8666666666666666 and parameters: {'objective': 'CrossEntropy', 'colsample_bylevel': 0.06216613828044057, 'depth': 3, 'boosting_type': 'Plain', 'bootstrap_type': 'Bayesian', 'bagging_temperature': 9.984867510723804}. Best is trial 3065 with value: 0.8863636363636364.
[32m[I 2023-04-21 02:43:50,264][39m Trial 3654 finished with value: 0.8181818181818182 and parameters: {'objective': 'Logloss', 'colsample_bylevel': 0.06639554411156808, 'depth': 11, 'boosting_type': 'Plain', 'bootstrap_type': 'MVS'}. Best is trial 3065 with value: 0.8863636363636364.
[32m[I 2023-04-21 02:43:51,312][39m Trial 3655 finished with value: 0.8666666666666666 and parameters: {'objective': 'Logloss', 'colsample_bylevel': 0.07523742947663026, 'depth': 10, 'boosting_type': 'Plain', 'bootstrap_type': 'Bayesian', 'bagging_temperature': 7.4298943713338454}. Best is trial 3065 with value: 0.8863636363636364.
[32m[I 2023-04-21 02:43:52,556][39m Trial 3656 finished with value: 0.8791208791208791 and parameters: {'objective': 'CrossEntropy', 'colsample_bylevel': 0.07718994577753274, 'depth': 3, 'boosting_type': 'Plain', 'bootstrap_type': 'Bayesian', 'bagging_temperature': 9.653847478871464}. Best is trial 3065 with value: 0.8863636363636364.
[32m[I 2023-04-21 02:43:53,570][39m Trial 3657 finished with value: 0.8275862068965518 and parameters: {'objective': 'CrossEntropy', 'colsample_bylevel': 0.07746765993440516, 'depth': 3, 'boosting_type': 'Plain', 'bootstrap_type': 'Bayesian', 'bagging_temperature': 6.185317403869643}. Best is trial 3065 with value: 0.8863636363636364.
[32m[I 2023-04-21 02:43:54,219][39m Trial 3658 finished with value: 0.8666666666666666 and parameters: {'objective': 'Logloss', 'colsample_bylevel': 0.0653593783100874, 'depth': 8, 'boosting_type': 'Plain', 'bootstrap_type': 'Bayesian', 'bagging_temperature': 8.768647980876164}. Best is trial 3065 with value: 0.8863636363636364.
[32m[I 2023-04-21 02:43:54,887][39m Trial 3659 finished with value: 0.8666666666666666 and parameters: {'objective': 'Logloss', 'colsample_bylevel': 0.08029815218119067, 'depth': 3, 'boosting_type': 'Plain', 'bootstrap_type': 'Bayesian', 'bagging_temperature': 8.909955421579918}. Best is trial 3065 with value: 0.8863636363636364.
[32m[I 2023-04-21 02:43:56,259][39m Trial 3660 finished with value: 0.8275862068965518 and parameters: {'objective': 'CrossEntropy', 'colsample_bylevel': 0.07199913838939821, 'depth': 10, 'boosting_type': 'Plain', 'bootstrap_type': 'Bayesian', 'bagging_temperature': 9.21577851444067}. Best is trial 3065 with value: 0.8863636363636364.
[32m[I 2023-04-21 02:43:57,520][39m Trial 3661 finished with value: 0.8764044943820225 and parameters: {'objective': 'CrossEntropy', 'colsample_bylevel': 0.09442584080034927, 'depth': 2, 'boosting_type': 'Plain', 'bootstrap_type': 'Bayesian', 'bagging_temperature': 9.97812392740587}. Best is trial 3065 with value: 0.8863636363636364.
[32m[I 2023-04-21 02:43:58,925][39m Trial 3662 finished with value: 0.8539325842696629 and parameters: {'objective': 'CrossEntropy', 'colsample_bylevel': 0.06722287759469395, 'depth': 9, 'boosting_type': 'Plain', 'bootstrap_type': 'Bayesian', 'bagging_temperature': 9.253458370768653}. Best is trial 3065 with value: 0.8863636363636364.
[32m[I 2023-04-21 02:43:59,767][39m Trial 3663 finished with value: 0.8636363636363636 and parameters: {'objective': 'CrossEntropy', 'colsample_bylevel': 0.07756344226501312, 'depth': 4, 'boosting_type': 'Plain', 'bootstrap_type': 'Bayesian', 'bagging_temperature': 8.287910245981289}. Best is trial 3065 with value: 0.8863636363636364.
[32m[I 2023-04-21 02:44:00,612][39m Trial 3664 finished with value: 0.8539325842696629 and parameters: {'objective': 'Logloss', 'colsample_bylevel': 0.0848617295448512, 'depth': 4, 'boosting_type': 'Plain', 'bootstrap_type': 'Bayesian', 'bagging_temperature': 9.562553149239497}. Best is trial 3065 with value: 0.8863636363636364.
[32m[I 2023-04-21 02:44:01,622][39m Trial 3665 finished with value: 0.8139534883720929 and parameters: {'objective': 'Logloss', 'colsample_bylevel': 0.07184904861046333, 'depth': 10, 'boosting_type': 'Plain', 'bootstrap_type': 'Bayesian', 'bagging_temperature': 9.035662599875085}. Best is trial 3065 with value: 0.8863636363636364.
[32m[I 2023-04-21 02:44:02,604][39m Trial 3666 finished with value: 0.8470588235294119 and parameters: {'objective': 'CrossEntropy', 'colsample_bylevel': 0.0729020489006238, 'depth': 9, 'boosting_type': 'Plain', 'bootstrap_type': 'Bayesian', 'bagging_temperature': 6.722965261222397}. Best is trial 3065 with value: 0.8863636363636364.
[32m[I 2023-04-21 02:44:03,944][39m Trial 3667 finished with value: 0.8666666666666666 and parameters: {'objective': 'CrossEntropy', 'colsample_bylevel': 0.06902738722486326, 'depth': 4, 'boosting_type': 'Plain', 'bootstrap_type': 'Bayesian', 'bagging_temperature': 9.38142790397189}. Best is trial 3065 with value: 0.8863636363636364.
[32m[I 2023-04-21 02:44:05,123][39m Trial 3668 finished with value: 0.8539325842696629 and parameters: {'objective': 'CrossEntropy', 'colsample_bylevel': 0.07435550931574404, 'depth': 11, 'boosting_type': 'Plain', 'bootstrap_type': 'Bayesian', 'bagging_temperature': 9.203927001978284}. Best is trial 3065 with value: 0.8863636363636364.
[32m[I 2023-04-21 02:44:10,201][39m Trial 3669 finished with value: 0.8409090909090909 and parameters: {'objective': 'Logloss', 'colsample_bylevel': 0.07858123838399625, 'depth': 5, 'boosting_type': 'Ordered', 'bootstrap_type': 'Bayesian', 'bagging_temperature': 8.351003556990596}. Best is trial 3065 with value: 0.8863636363636364.
[32m[I 2023-04-21 02:44:11,158][39m Trial 3670 finished with value: 0.8444444444444446 and parameters: {'objective': 'CrossEntropy', 'colsample_bylevel': 0.08009896419549403, 'depth': 3, 'boosting_type': 'Plain', 'bootstrap_type': 'Bayesian', 'bagging_temperature': 8.52420210491205}. Best is trial 3065 with value: 0.8863636363636364.
[32m[I 2023-04-21 02:44:12,107][39m Trial 3671 finished with value: 0.8636363636363636 and parameters: {'objective': 'Logloss', 'colsample_bylevel': 0.07452210203351045, 'depth': 10, 'boosting_type': 'Plain', 'bootstrap_type': 'Bayesian', 'bagging_temperature': 9.496818258467163}. Best is trial 3065 with value: 0.8863636363636364.
[32m[I 2023-04-21 02:44:13,143][39m Trial 3672 finished with value: 0.8409090909090909 and parameters: {'objective': 'CrossEntropy', 'colsample_bylevel': 0.074179673900689, 'depth': 11, 'boosting_type': 'Plain', 'bootstrap_type': 'Bayesian', 'bagging_temperature': 9.522138929860876}. Best is trial 3065 with value: 0.8863636363636364.
[32m[I 2023-04-21 02:44:14,112][39m Trial 3673 finished with value: 0.8539325842696629 and parameters: {'objective': 'CrossEntropy', 'colsample_bylevel': 0.07075377444486441, 'depth': 8, 'boosting_type': 'Plain', 'bootstrap_type': 'Bernoulli', 'subsample': 0.24866861165853127}. Best is trial 3065 with value: 0.8863636363636364.
[32m[I 2023-04-21 02:44:14,764][39m Trial 3674 finished with value: 0.8666666666666666 and parameters: {'objective': 'Logloss', 'colsample_bylevel': 0.07189974902510624, 'depth': 5, 'boosting_type': 'Plain', 'bootstrap_type': 'Bayesian', 'bagging_temperature': 7.930735337075143}. Best is trial 3065 with value: 0.8863636363636364.
[32m[I 2023-04-21 02:44:15,874][39m Trial 3675 finished with value: 0.8409090909090909 and parameters: {'objective': 'CrossEntropy', 'colsample_bylevel': 0.07797565221466347, 'depth': 6, 'boosting_type': 'Plain', 'bootstrap_type': 'Bayesian', 'bagging_temperature': 9.472687583877898}. Best is trial 3065 with value: 0.8863636363636364.
[32m[I 2023-04-21 02:44:17,380][39m Trial 3676 finished with value: 0.8275862068965518 and parameters: {'objective': 'CrossEntropy', 'colsample_bylevel': 0.07670818394884861, 'depth': 9, 'boosting_type': 'Plain', 'bootstrap_type': 'Bayesian', 'bagging_temperature': 9.658383845025657}. Best is trial 3065 with value: 0.8863636363636364.
[32m[I 2023-04-21 02:44:18,632][39m Trial 3677 finished with value: 0.8666666666666666 and parameters: {'objective': 'CrossEntropy', 'colsample_bylevel': 0.07785298255795434, 'depth': 3, 'boosting_type': 'Plain', 'bootstrap_type': 'Bayesian', 'bagging_temperature': 9.756673116587235}. Best is trial 3065 with value: 0.8863636363636364.
[32m[I 2023-04-21 02:44:19,613][39m Trial 3678 finished with value: 0.8409090909090909 and parameters: {'objective': 'Logloss', 'colsample_bylevel': 0.08400980407054262, 'depth': 4, 'boosting_type': 'Plain', 'bootstrap_type': 'Bayesian', 'bagging_temperature': 9.46977264914087}. Best is trial 3065 with value: 0.8863636363636364.
[32m[I 2023-04-21 02:44:20,275][39m Trial 3679 finished with value: 0.8666666666666666 and parameters: {'objective': 'CrossEntropy', 'colsample_bylevel': 0.08681930602722412, 'depth': 3, 'boosting_type': 'Plain', 'bootstrap_type': 'Bayesian', 'bagging_temperature': 9.97645284554689}. Best is trial 3065 with value: 0.8863636363636364.
[32m[I 2023-04-21 02:44:21,041][39m Trial 3680 finished with value: 0.8791208791208791 and parameters: {'objective': 'CrossEntropy', 'colsample_bylevel': 0.06876841011496768, 'depth': 8, 'boosting_type': 'Plain', 'bootstrap_type': 'Bayesian', 'bagging_temperature': 9.674136287935722}. Best is trial 3065 with value: 0.8863636363636364.
[32m[I 2023-04-21 02:44:21,863][39m Trial 3681 finished with value: 0.8409090909090909 and parameters: {'objective': 'CrossEntropy', 'colsample_bylevel': 0.07774854738411276, 'depth': 7, 'boosting_type': 'Plain', 'bootstrap_type': 'Bayesian', 'bagging_temperature': 9.275990241289072}. Best is trial 3065 with value: 0.8863636363636364.
[32m[I 2023-04-21 02:44:22,528][39m Trial 3682 finished with value: 0.8539325842696629 and parameters: {'objective': 'CrossEntropy', 'colsample_bylevel': 0.07914047091847895, 'depth': 10, 'boosting_type': 'Plain', 'bootstrap_type': 'Bayesian', 'bagging_temperature': 9.516167341948972}. Best is trial 3065 with value: 0.8863636363636364.
[32m[I 2023-04-21 02:44:27,865][39m Trial 3683 finished with value: 0.8539325842696629 and parameters: {'objective': 'CrossEntropy', 'colsample_bylevel': 0.09229847764221193, 'depth': 3, 'boosting_type': 'Ordered', 'bootstrap_type': 'Bayesian', 'bagging_temperature': 8.993510194264351}. Best is trial 3065 with value: 0.8863636363636364.
[32m[I 2023-04-21 02:44:29,010][39m Trial 3684 finished with value: 0.8539325842696629 and parameters: {'objective': 'CrossEntropy', 'colsample_bylevel': 0.06755618784265874, 'depth': 3, 'boosting_type': 'Plain', 'bootstrap_type': 'MVS'}. Best is trial 3065 with value: 0.8863636363636364.
[32m[I 2023-04-21 02:44:30,334][39m Trial 3685 finished with value: 0.8275862068965518 and parameters: {'objective': 'CrossEntropy', 'colsample_bylevel': 0.09148137725993755, 'depth': 2, 'boosting_type': 'Plain', 'bootstrap_type': 'Bayesian', 'bagging_temperature': 9.694277406768409}. Best is trial 3065 with value: 0.8863636363636364.
[32m[I 2023-04-21 02:44:31,671][39m Trial 3686 finished with value: 0.8791208791208791 and parameters: {'objective': 'CrossEntropy', 'colsample_bylevel': 0.07615801959280147, 'depth': 9, 'boosting_type': 'Plain', 'bootstrap_type': 'Bayesian', 'bagging_temperature': 9.819925797891527}. Best is trial 3065 with value: 0.8863636363636364.
[32m[I 2023-04-21 02:44:32,588][39m Trial 3687 finished with value: 0.8409090909090909 and parameters: {'objective': 'Logloss', 'colsample_bylevel': 0.07559819478540815, 'depth': 10, 'boosting_type': 'Plain', 'bootstrap_type': 'MVS'}. Best is trial 3065 with value: 0.8863636363636364.
[32m[I 2023-04-21 02:44:33,488][39m Trial 3688 finished with value: 0.8666666666666666 and parameters: {'objective': 'Logloss', 'colsample_bylevel': 0.0719680169651091, 'depth': 10, 'boosting_type': 'Plain', 'bootstrap_type': 'Bayesian', 'bagging_temperature': 9.249232553854279}. Best is trial 3065 with value: 0.8863636363636364.
[32m[I 2023-04-21 02:44:34,269][39m Trial 3689 finished with value: 0.8409090909090909 and parameters: {'objective': 'Logloss', 'colsample_bylevel': 0.07369373047469334, 'depth': 4, 'boosting_type': 'Plain', 'bootstrap_type': 'Bayesian', 'bagging_temperature': 9.619733414190485}. Best is trial 3065 with value: 0.8863636363636364.
[32m[I 2023-04-21 02:44:35,123][39m Trial 3690 finished with value: 0.8539325842696629 and parameters: {'objective': 'Logloss', 'colsample_bylevel': 0.07119659265188187, 'depth': 10, 'boosting_type': 'Plain', 'bootstrap_type': 'Bayesian', 'bagging_temperature': 8.15150734571096}. Best is trial 3065 with value: 0.8863636363636364.
[32m[I 2023-04-21 02:44:35,921][39m Trial 3691 finished with value: 0.8409090909090909 and parameters: {'objective': 'CrossEntropy', 'colsample_bylevel': 0.05900945168001154, 'depth': 9, 'boosting_type': 'Plain', 'bootstrap_type': 'Bayesian', 'bagging_temperature': 7.077179867870081}. Best is trial 3065 with value: 0.8863636363636364.
[32m[I 2023-04-21 02:44:36,617][39m Trial 3692 finished with value: 0.8275862068965518 and parameters: {'objective': 'CrossEntropy', 'colsample_bylevel': 0.08803828674551989, 'depth': 3, 'boosting_type': 'Plain', 'bootstrap_type': 'Bayesian', 'bagging_temperature': 8.51606274151182}. Best is trial 3065 with value: 0.8863636363636364.
