[32m[I 2023-04-21 03:12:39,827][39m Trial 5065 finished with value: 0.8409090909090909 and parameters: {'objective': 'Logloss', 'colsample_bylevel': 0.07751393350689083, 'depth': 3, 'boosting_type': 'Plain', 'bootstrap_type': 'MVS'}. Best is trial 3065 with value: 0.8863636363636364.
[32m[I 2023-04-21 03:12:40,931][39m Trial 5066 finished with value: 0.8636363636363636 and parameters: {'objective': 'CrossEntropy', 'colsample_bylevel': 0.07977711195985168, 'depth': 10, 'boosting_type': 'Plain', 'bootstrap_type': 'Bayesian', 'bagging_temperature': 9.44701390982847}. Best is trial 3065 with value: 0.8863636363636364.
[32m[I 2023-04-21 03:12:42,585][39m Trial 5067 finished with value: 0.8666666666666666 and parameters: {'objective': 'Logloss', 'colsample_bylevel': 0.06948613070126264, 'depth': 9, 'boosting_type': 'Plain', 'bootstrap_type': 'Bayesian', 'bagging_temperature': 8.215323145382344}. Best is trial 3065 with value: 0.8863636363636364.
[32m[I 2023-04-21 03:12:43,436][39m Trial 5068 finished with value: 0.8409090909090909 and parameters: {'objective': 'Logloss', 'colsample_bylevel': 0.07168209646203849, 'depth': 9, 'boosting_type': 'Plain', 'bootstrap_type': 'Bayesian', 'bagging_temperature': 8.408232796060982}. Best is trial 3065 with value: 0.8863636363636364.
[32m[I 2023-04-21 03:12:44,341][39m Trial 5069 finished with value: 0.8444444444444446 and parameters: {'objective': 'CrossEntropy', 'colsample_bylevel': 0.07482226353736818, 'depth': 3, 'boosting_type': 'Plain', 'bootstrap_type': 'Bernoulli', 'subsample': 0.29832904823276657}. Best is trial 3065 with value: 0.8863636363636364.
[32m[I 2023-04-21 03:12:45,583][39m Trial 5070 finished with value: 0.8409090909090909 and parameters: {'objective': 'CrossEntropy', 'colsample_bylevel': 0.07940777664639395, 'depth': 10, 'boosting_type': 'Plain', 'bootstrap_type': 'Bayesian', 'bagging_temperature': 9.676589178582718}. Best is trial 3065 with value: 0.8863636363636364.
[32m[I 2023-04-21 03:12:47,140][39m Trial 5071 finished with value: 0.8409090909090909 and parameters: {'objective': 'CrossEntropy', 'colsample_bylevel': 0.07656297527632082, 'depth': 4, 'boosting_type': 'Plain', 'bootstrap_type': 'Bayesian', 'bagging_temperature': 9.568757675312812}. Best is trial 3065 with value: 0.8863636363636364.
[32m[I 2023-04-21 03:12:48,219][39m Trial 5072 finished with value: 0.8539325842696629 and parameters: {'objective': 'CrossEntropy', 'colsample_bylevel': 0.07519416179779607, 'depth': 9, 'boosting_type': 'Plain', 'bootstrap_type': 'Bayesian', 'bagging_temperature': 9.641253020740347}. Best is trial 3065 with value: 0.8863636363636364.
[32m[I 2023-04-21 03:12:52,470][39m Trial 5073 finished with value: 0.8139534883720929 and parameters: {'objective': 'CrossEntropy', 'colsample_bylevel': 0.07379764909380497, 'depth': 10, 'boosting_type': 'Ordered', 'bootstrap_type': 'Bayesian', 'bagging_temperature': 9.194471793546013}. Best is trial 3065 with value: 0.8863636363636364.
[32m[I 2023-04-21 03:12:53,736][39m Trial 5074 finished with value: 0.8275862068965518 and parameters: {'objective': 'CrossEntropy', 'colsample_bylevel': 0.0883242151618405, 'depth': 4, 'boosting_type': 'Plain', 'bootstrap_type': 'Bayesian', 'bagging_temperature': 9.570956583696052}. Best is trial 3065 with value: 0.8863636363636364.
[32m[I 2023-04-21 03:12:55,060][39m Trial 5075 finished with value: 0.8666666666666666 and parameters: {'objective': 'CrossEntropy', 'colsample_bylevel': 0.07340661866737662, 'depth': 9, 'boosting_type': 'Plain', 'bootstrap_type': 'Bayesian', 'bagging_temperature': 9.459342657103658}. Best is trial 3065 with value: 0.8863636363636364.
[32m[I 2023-04-21 03:12:56,188][39m Trial 5076 finished with value: 0.8539325842696629 and parameters: {'objective': 'Logloss', 'colsample_bylevel': 0.0716546949224428, 'depth': 9, 'boosting_type': 'Plain', 'bootstrap_type': 'Bayesian', 'bagging_temperature': 9.833961720580675}. Best is trial 3065 with value: 0.8863636363636364.
[32m[I 2023-04-21 03:12:57,425][39m Trial 5077 finished with value: 0.8409090909090909 and parameters: {'objective': 'CrossEntropy', 'colsample_bylevel': 0.08281687111504603, 'depth': 3, 'boosting_type': 'Plain', 'bootstrap_type': 'MVS'}. Best is trial 3065 with value: 0.8863636363636364.
[32m[I 2023-04-21 03:12:58,171][39m Trial 5078 finished with value: 0.8636363636363636 and parameters: {'objective': 'CrossEntropy', 'colsample_bylevel': 0.08718605757924375, 'depth': 10, 'boosting_type': 'Plain', 'bootstrap_type': 'Bayesian', 'bagging_temperature': 9.326764000740592}. Best is trial 3065 with value: 0.8863636363636364.
[32m[I 2023-04-21 03:12:59,128][39m Trial 5079 finished with value: 0.8666666666666666 and parameters: {'objective': 'CrossEntropy', 'colsample_bylevel': 0.0775969152517596, 'depth': 10, 'boosting_type': 'Plain', 'bootstrap_type': 'Bayesian', 'bagging_temperature': 9.678477802245954}. Best is trial 3065 with value: 0.8863636363636364.
[32m[I 2023-04-21 03:13:00,435][39m Trial 5080 finished with value: 0.8275862068965518 and parameters: {'objective': 'CrossEntropy', 'colsample_bylevel': 0.08094522283742273, 'depth': 4, 'boosting_type': 'Plain', 'bootstrap_type': 'Bayesian', 'bagging_temperature': 9.480974597760481}. Best is trial 3065 with value: 0.8863636363636364.
[32m[I 2023-04-21 03:13:01,430][39m Trial 5081 finished with value: 0.8539325842696629 and parameters: {'objective': 'CrossEntropy', 'colsample_bylevel': 0.07733560595807511, 'depth': 4, 'boosting_type': 'Plain', 'bootstrap_type': 'Bayesian', 'bagging_temperature': 9.652040619588742}. Best is trial 3065 with value: 0.8863636363636364.
[32m[I 2023-04-21 03:13:02,429][39m Trial 5082 finished with value: 0.8314606741573034 and parameters: {'objective': 'Logloss', 'colsample_bylevel': 0.07000429447771259, 'depth': 3, 'boosting_type': 'Plain', 'bootstrap_type': 'MVS'}. Best is trial 3065 with value: 0.8863636363636364.
[32m[I 2023-04-21 03:13:03,440][39m Trial 5083 finished with value: 0.8666666666666666 and parameters: {'objective': 'CrossEntropy', 'colsample_bylevel': 0.08219207076025747, 'depth': 3, 'boosting_type': 'Plain', 'bootstrap_type': 'Bayesian', 'bagging_temperature': 9.243691453602873}. Best is trial 3065 with value: 0.8863636363636364.
[32m[I 2023-04-21 03:13:04,369][39m Trial 5084 finished with value: 0.8666666666666666 and parameters: {'objective': 'CrossEntropy', 'colsample_bylevel': 0.06354326208613534, 'depth': 11, 'boosting_type': 'Plain', 'bootstrap_type': 'Bayesian', 'bagging_temperature': 8.838699660432054}. Best is trial 3065 with value: 0.8863636363636364.
[32m[I 2023-04-21 03:13:05,090][39m Trial 5085 finished with value: 0.8409090909090909 and parameters: {'objective': 'Logloss', 'colsample_bylevel': 0.09209116759305656, 'depth': 10, 'boosting_type': 'Plain', 'bootstrap_type': 'Bayesian', 'bagging_temperature': 9.49158904454297}. Best is trial 3065 with value: 0.8863636363636364.
[32m[I 2023-04-21 03:13:05,769][39m Trial 5086 finished with value: 0.8539325842696629 and parameters: {'objective': 'CrossEntropy', 'colsample_bylevel': 0.08181462166700358, 'depth': 3, 'boosting_type': 'Plain', 'bootstrap_type': 'Bayesian', 'bagging_temperature': 9.281881228911374}. Best is trial 3065 with value: 0.8863636363636364.
[32m[I 2023-04-21 03:13:06,833][39m Trial 5087 finished with value: 0.8409090909090909 and parameters: {'objective': 'CrossEntropy', 'colsample_bylevel': 0.0816959295513883, 'depth': 10, 'boosting_type': 'Plain', 'bootstrap_type': 'Bayesian', 'bagging_temperature': 8.927798028812031}. Best is trial 3065 with value: 0.8863636363636364.
[32m[I 2023-04-21 03:13:08,031][39m Trial 5088 finished with value: 0.8539325842696629 and parameters: {'objective': 'CrossEntropy', 'colsample_bylevel': 0.09136274119979658, 'depth': 2, 'boosting_type': 'Plain', 'bootstrap_type': 'Bayesian', 'bagging_temperature': 8.427690082966382}. Best is trial 3065 with value: 0.8863636363636364.
[32m[I 2023-04-21 03:13:09,130][39m Trial 5089 finished with value: 0.8539325842696629 and parameters: {'objective': 'CrossEntropy', 'colsample_bylevel': 0.07468348545120079, 'depth': 10, 'boosting_type': 'Plain', 'bootstrap_type': 'Bayesian', 'bagging_temperature': 9.608030785691707}. Best is trial 3065 with value: 0.8863636363636364.
[32m[I 2023-04-21 03:13:10,281][39m Trial 5090 finished with value: 0.8235294117647058 and parameters: {'objective': 'CrossEntropy', 'colsample_bylevel': 0.07655111568070155, 'depth': 1, 'boosting_type': 'Plain', 'bootstrap_type': 'Bayesian', 'bagging_temperature': 9.841866949572937}. Best is trial 3065 with value: 0.8863636363636364.
[32m[I 2023-04-21 03:13:11,271][39m Trial 5091 finished with value: 0.8539325842696629 and parameters: {'objective': 'CrossEntropy', 'colsample_bylevel': 0.08291176842912425, 'depth': 3, 'boosting_type': 'Plain', 'bootstrap_type': 'Bernoulli', 'subsample': 0.22798519904958103}. Best is trial 3065 with value: 0.8863636363636364.
[32m[I 2023-04-21 03:13:15,700][39m Trial 5092 finished with value: 0.8275862068965518 and parameters: {'objective': 'Logloss', 'colsample_bylevel': 0.07672408982165649, 'depth': 10, 'boosting_type': 'Ordered', 'bootstrap_type': 'Bayesian', 'bagging_temperature': 9.84009407946162}. Best is trial 3065 with value: 0.8863636363636364.
[32m[I 2023-04-21 03:13:16,949][39m Trial 5093 finished with value: 0.8539325842696629 and parameters: {'objective': 'CrossEntropy', 'colsample_bylevel': 0.07661155614698033, 'depth': 10, 'boosting_type': 'Plain', 'bootstrap_type': 'Bayesian', 'bagging_temperature': 9.820494364596005}. Best is trial 3065 with value: 0.8863636363636364.
[32m[I 2023-04-21 03:13:18,035][39m Trial 5094 finished with value: 0.8666666666666666 and parameters: {'objective': 'CrossEntropy', 'colsample_bylevel': 0.08644549406006598, 'depth': 3, 'boosting_type': 'Plain', 'bootstrap_type': 'Bayesian', 'bagging_temperature': 9.823914205701834}. Best is trial 3065 with value: 0.8863636363636364.
[32m[I 2023-04-21 03:13:19,588][39m Trial 5095 finished with value: 0.8409090909090909 and parameters: {'objective': 'CrossEntropy', 'colsample_bylevel': 0.08027210228289598, 'depth': 9, 'boosting_type': 'Plain', 'bootstrap_type': 'Bayesian', 'bagging_temperature': 9.147716032635437}. Best is trial 3065 with value: 0.8863636363636364.
[32m[I 2023-04-21 03:13:20,461][39m Trial 5096 finished with value: 0.8409090909090909 and parameters: {'objective': 'CrossEntropy', 'colsample_bylevel': 0.09220976458091111, 'depth': 3, 'boosting_type': 'Plain', 'bootstrap_type': 'Bayesian', 'bagging_temperature': 9.856590342359}. Best is trial 3065 with value: 0.8863636363636364.
[32m[I 2023-04-21 03:13:21,121][39m Trial 5097 finished with value: 0.8089887640449439 and parameters: {'objective': 'Logloss', 'colsample_bylevel': 0.07457709798553835, 'depth': 2, 'boosting_type': 'Plain', 'bootstrap_type': 'MVS'}. Best is trial 3065 with value: 0.8863636363636364.
[32m[I 2023-04-21 03:13:21,997][39m Trial 5098 finished with value: 0.8539325842696629 and parameters: {'objective': 'CrossEntropy', 'colsample_bylevel': 0.07816422922535211, 'depth': 9, 'boosting_type': 'Plain', 'bootstrap_type': 'Bayesian', 'bagging_temperature': 9.80721042852917}. Best is trial 3065 with value: 0.8863636363636364.
[32m[I 2023-04-21 03:13:23,339][39m Trial 5099 finished with value: 0.8409090909090909 and parameters: {'objective': 'CrossEntropy', 'colsample_bylevel': 0.08038382529367619, 'depth': 7, 'boosting_type': 'Plain', 'bootstrap_type': 'Bayesian', 'bagging_temperature': 8.672362303205304}. Best is trial 3065 with value: 0.8863636363636364.
[32m[I 2023-04-21 03:13:24,409][39m Trial 5100 finished with value: 0.8539325842696629 and parameters: {'objective': 'Logloss', 'colsample_bylevel': 0.0800057261403262, 'depth': 6, 'boosting_type': 'Plain', 'bootstrap_type': 'Bayesian', 'bagging_temperature': 9.450634036460544}. Best is trial 3065 with value: 0.8863636363636364.
[32m[I 2023-04-21 03:13:25,773][39m Trial 5101 finished with value: 0.8275862068965518 and parameters: {'objective': 'CrossEntropy', 'colsample_bylevel': 0.07510171904048049, 'depth': 10, 'boosting_type': 'Plain', 'bootstrap_type': 'Bayesian', 'bagging_temperature': 9.403261355943265}. Best is trial 3065 with value: 0.8863636363636364.
[32m[I 2023-04-21 03:13:26,654][39m Trial 5102 finished with value: 0.8539325842696629 and parameters: {'objective': 'CrossEntropy', 'colsample_bylevel': 0.08131074470265938, 'depth': 3, 'boosting_type': 'Plain', 'bootstrap_type': 'Bayesian', 'bagging_temperature': 8.621158935378169}. Best is trial 3065 with value: 0.8863636363636364.
[32m[I 2023-04-21 03:13:27,319][39m Trial 5103 finished with value: 0.8666666666666666 and parameters: {'objective': 'CrossEntropy', 'colsample_bylevel': 0.08201123996302957, 'depth': 3, 'boosting_type': 'Plain', 'bootstrap_type': 'Bayesian', 'bagging_temperature': 9.3825088190159}. Best is trial 3065 with value: 0.8863636363636364.
[32m[I 2023-04-21 03:13:28,187][39m Trial 5104 finished with value: 0.8409090909090909 and parameters: {'objective': 'CrossEntropy', 'colsample_bylevel': 0.08160576632441599, 'depth': 3, 'boosting_type': 'Plain', 'bootstrap_type': 'Bayesian', 'bagging_temperature': 4.73105766064964}. Best is trial 3065 with value: 0.8863636363636364.
[32m[I 2023-04-21 03:13:29,312][39m Trial 5105 finished with value: 0.8666666666666666 and parameters: {'objective': 'Logloss', 'colsample_bylevel': 0.06960631318595115, 'depth': 7, 'boosting_type': 'Plain', 'bootstrap_type': 'Bayesian', 'bagging_temperature': 9.796283420852415}. Best is trial 3065 with value: 0.8863636363636364.
[32m[I 2023-04-21 03:13:30,182][39m Trial 5106 finished with value: 0.8666666666666666 and parameters: {'objective': 'Logloss', 'colsample_bylevel': 0.08168822173094319, 'depth': 3, 'boosting_type': 'Plain', 'bootstrap_type': 'Bayesian', 'bagging_temperature': 9.115095034981135}. Best is trial 3065 with value: 0.8863636363636364.
[32m[I 2023-04-21 03:13:31,303][39m Trial 5107 finished with value: 0.8636363636363636 and parameters: {'objective': 'CrossEntropy', 'colsample_bylevel': 0.07540417089234892, 'depth': 10, 'boosting_type': 'Plain', 'bootstrap_type': 'Bayesian', 'bagging_temperature': 9.191028781160137}. Best is trial 3065 with value: 0.8863636363636364.
[32m[I 2023-04-21 03:13:32,310][39m Trial 5108 finished with value: 0.8666666666666666 and parameters: {'objective': 'CrossEntropy', 'colsample_bylevel': 0.07977862863257718, 'depth': 3, 'boosting_type': 'Plain', 'bootstrap_type': 'Bayesian', 'bagging_temperature': 8.602160449877967}. Best is trial 3065 with value: 0.8863636363636364.
[32m[I 2023-04-21 03:13:33,601][39m Trial 5109 finished with value: 0.8539325842696629 and parameters: {'objective': 'CrossEntropy', 'colsample_bylevel': 0.082039475679039, 'depth': 3, 'boosting_type': 'Plain', 'bootstrap_type': 'MVS'}. Best is trial 3065 with value: 0.8863636363636364.
[32m[I 2023-04-21 03:13:38,338][39m Trial 5110 finished with value: 0.8409090909090909 and parameters: {'objective': 'CrossEntropy', 'colsample_bylevel': 0.0772759339294833, 'depth': 10, 'boosting_type': 'Ordered', 'bootstrap_type': 'Bayesian', 'bagging_temperature': 8.352746759510339}. Best is trial 3065 with value: 0.8863636363636364.
[32m[I 2023-04-21 03:13:39,412][39m Trial 5111 finished with value: 0.8409090909090909 and parameters: {'objective': 'Logloss', 'colsample_bylevel': 0.0840781393321709, 'depth': 4, 'boosting_type': 'Plain', 'bootstrap_type': 'Bayesian', 'bagging_temperature': 9.29990522080636}. Best is trial 3065 with value: 0.8863636363636364.
[32m[I 2023-04-21 03:13:40,751][39m Trial 5112 finished with value: 0.8539325842696629 and parameters: {'objective': 'CrossEntropy', 'colsample_bylevel': 0.08058598503828142, 'depth': 4, 'boosting_type': 'Plain', 'bootstrap_type': 'Bayesian', 'bagging_temperature': 8.893289465706971}. Best is trial 3065 with value: 0.8863636363636364.
[32m[I 2023-04-21 03:13:41,590][39m Trial 5113 finished with value: 0.8539325842696629 and parameters: {'objective': 'CrossEntropy', 'colsample_bylevel': 0.07914665245279161, 'depth': 9, 'boosting_type': 'Plain', 'bootstrap_type': 'Bayesian', 'bagging_temperature': 9.539174726827206}. Best is trial 3065 with value: 0.8863636363636364.
[32m[I 2023-04-21 03:13:42,550][39m Trial 5114 finished with value: 0.8372093023255814 and parameters: {'objective': 'CrossEntropy', 'colsample_bylevel': 0.07619276878756542, 'depth': 10, 'boosting_type': 'Plain', 'bootstrap_type': 'Bayesian', 'bagging_temperature': 9.85131103980153}. Best is trial 3065 with value: 0.8863636363636364.
[32m[I 2023-04-21 03:13:43,574][39m Trial 5115 finished with value: 0.8275862068965518 and parameters: {'objective': 'CrossEntropy', 'colsample_bylevel': 0.0720683509145098, 'depth': 12, 'boosting_type': 'Plain', 'bootstrap_type': 'Bernoulli', 'subsample': 0.1445439417808176}. Best is trial 3065 with value: 0.8863636363636364.
[32m[I 2023-04-21 03:13:44,565][39m Trial 5116 finished with value: 0.8539325842696629 and parameters: {'objective': 'CrossEntropy', 'colsample_bylevel': 0.0855651363200691, 'depth': 3, 'boosting_type': 'Plain', 'bootstrap_type': 'Bayesian', 'bagging_temperature': 9.38057021847714}. Best is trial 3065 with value: 0.8863636363636364.
[32m[I 2023-04-21 03:13:45,699][39m Trial 5117 finished with value: 0.8222222222222222 and parameters: {'objective': 'Logloss', 'colsample_bylevel': 0.0709358128643635, 'depth': 2, 'boosting_type': 'Plain', 'bootstrap_type': 'MVS'}. Best is trial 3065 with value: 0.8863636363636364.
[32m[I 2023-04-21 03:13:47,101][39m Trial 5118 finished with value: 0.8139534883720929 and parameters: {'objective': 'CrossEntropy', 'colsample_bylevel': 0.03943956072484435, 'depth': 7, 'boosting_type': 'Plain', 'bootstrap_type': 'Bayesian', 'bagging_temperature': 9.20760646573282}. Best is trial 3065 with value: 0.8863636363636364.
[32m[I 2023-04-21 03:13:47,824][39m Trial 5119 finished with value: 0.8275862068965518 and parameters: {'objective': 'CrossEntropy', 'colsample_bylevel': 0.09717365864196685, 'depth': 3, 'boosting_type': 'Plain', 'bootstrap_type': 'Bayesian', 'bagging_temperature': 8.904805716208507}. Best is trial 3065 with value: 0.8863636363636364.
[32m[I 2023-04-21 03:13:48,837][39m Trial 5120 finished with value: 0.8791208791208791 and parameters: {'objective': 'Logloss', 'colsample_bylevel': 0.08909038290630582, 'depth': 3, 'boosting_type': 'Plain', 'bootstrap_type': 'Bayesian', 'bagging_temperature': 9.666633236272064}. Best is trial 3065 with value: 0.8863636363636364.
[32m[I 2023-04-21 03:13:49,663][39m Trial 5121 finished with value: 0.8539325842696629 and parameters: {'objective': 'Logloss', 'colsample_bylevel': 0.0750783811526476, 'depth': 10, 'boosting_type': 'Plain', 'bootstrap_type': 'Bayesian', 'bagging_temperature': 9.981849133997535}. Best is trial 3065 with value: 0.8863636363636364.
[32m[I 2023-04-21 03:13:50,658][39m Trial 5122 finished with value: 0.8666666666666666 and parameters: {'objective': 'CrossEntropy', 'colsample_bylevel': 0.08601930076450878, 'depth': 3, 'boosting_type': 'Plain', 'bootstrap_type': 'Bayesian', 'bagging_temperature': 9.968371008070013}. Best is trial 3065 with value: 0.8863636363636364.
[32m[I 2023-04-21 03:13:51,950][39m Trial 5123 finished with value: 0.8666666666666666 and parameters: {'objective': 'CrossEntropy', 'colsample_bylevel': 0.06641503586200354, 'depth': 9, 'boosting_type': 'Plain', 'bootstrap_type': 'Bayesian', 'bagging_temperature': 9.196223842488104}. Best is trial 3065 with value: 0.8863636363636364.
[32m[I 2023-04-21 03:13:53,247][39m Trial 5124 finished with value: 0.8666666666666666 and parameters: {'objective': 'CrossEntropy', 'colsample_bylevel': 0.06588737503603148, 'depth': 9, 'boosting_type': 'Plain', 'bootstrap_type': 'Bayesian', 'bagging_temperature': 9.17276532628409}. Best is trial 3065 with value: 0.8863636363636364.
[32m[I 2023-04-21 03:13:54,111][39m Trial 5125 finished with value: 0.8539325842696629 and parameters: {'objective': 'CrossEntropy', 'colsample_bylevel': 0.07967234553727581, 'depth': 10, 'boosting_type': 'Plain', 'bootstrap_type': 'Bayesian', 'bagging_temperature': 8.74293961918085}. Best is trial 3065 with value: 0.8863636363636364.
[32m[I 2023-04-21 03:13:55,407][39m Trial 5126 finished with value: 0.8539325842696629 and parameters: {'objective': 'CrossEntropy', 'colsample_bylevel': 0.09224206857971641, 'depth': 3, 'boosting_type': 'Plain', 'bootstrap_type': 'Bayesian', 'bagging_temperature': 8.518696571364984}. Best is trial 3065 with value: 0.8863636363636364.
[32m[I 2023-04-21 03:13:56,110][39m Trial 5127 finished with value: 0.8372093023255814 and parameters: {'objective': 'CrossEntropy', 'colsample_bylevel': 0.09980135420098502, 'depth': 10, 'boosting_type': 'Plain', 'bootstrap_type': 'Bayesian', 'bagging_temperature': 9.226718467640058}. Best is trial 3065 with value: 0.8863636363636364.
[32m[I 2023-04-21 03:14:01,287][39m Trial 5128 finished with value: 0.8539325842696629 and parameters: {'objective': 'CrossEntropy', 'colsample_bylevel': 0.09313244910873333, 'depth': 2, 'boosting_type': 'Ordered', 'bootstrap_type': 'Bayesian', 'bagging_temperature': 9.985300907121198}. Best is trial 3065 with value: 0.8863636363636364.
[32m[I 2023-04-21 03:14:02,477][39m Trial 5129 finished with value: 0.8409090909090909 and parameters: {'objective': 'CrossEntropy', 'colsample_bylevel': 0.0883684944384288, 'depth': 3, 'boosting_type': 'Plain', 'bootstrap_type': 'Bayesian', 'bagging_temperature': 6.7239252008121175}. Best is trial 3065 with value: 0.8863636363636364.
[32m[I 2023-04-21 03:14:03,522][39m Trial 5130 finished with value: 0.8636363636363636 and parameters: {'objective': 'CrossEntropy', 'colsample_bylevel': 0.08914395192075299, 'depth': 3, 'boosting_type': 'Plain', 'bootstrap_type': 'Bayesian', 'bagging_temperature': 9.15403374733678}. Best is trial 3065 with value: 0.8863636363636364.
