[32m[I 2023-04-21 02:59:09,042][39m Trial 4414 finished with value: 0.8539325842696629 and parameters: {'objective': 'Logloss', 'colsample_bylevel': 0.08089380994980805, 'depth': 4, 'boosting_type': 'Plain', 'bootstrap_type': 'Bernoulli', 'subsample': 0.23330187521042878}. Best is trial 3065 with value: 0.8863636363636364.
[32m[I 2023-04-21 02:59:10,272][39m Trial 4415 finished with value: 0.8409090909090909 and parameters: {'objective': 'CrossEntropy', 'colsample_bylevel': 0.07938695322133443, 'depth': 2, 'boosting_type': 'Plain', 'bootstrap_type': 'Bayesian', 'bagging_temperature': 9.640438591439743}. Best is trial 3065 with value: 0.8863636363636364.
[32m[I 2023-04-21 02:59:10,954][39m Trial 4416 finished with value: 0.8409090909090909 and parameters: {'objective': 'CrossEntropy', 'colsample_bylevel': 0.08111285363954836, 'depth': 7, 'boosting_type': 'Plain', 'bootstrap_type': 'Bayesian', 'bagging_temperature': 9.047697421669037}. Best is trial 3065 with value: 0.8863636363636364.
[32m[I 2023-04-21 02:59:12,087][39m Trial 4417 finished with value: 0.8409090909090909 and parameters: {'objective': 'Logloss', 'colsample_bylevel': 0.07658917234239075, 'depth': 11, 'boosting_type': 'Plain', 'bootstrap_type': 'Bayesian', 'bagging_temperature': 7.914107648335863}. Best is trial 3065 with value: 0.8863636363636364.
[32m[I 2023-04-21 02:59:16,879][39m Trial 4418 finished with value: 0.8409090909090909 and parameters: {'objective': 'CrossEntropy', 'colsample_bylevel': 0.07203434606860944, 'depth': 10, 'boosting_type': 'Ordered', 'bootstrap_type': 'Bayesian', 'bagging_temperature': 9.32605929208232}. Best is trial 3065 with value: 0.8863636363636364.
[32m[I 2023-04-21 02:59:18,101][39m Trial 4419 finished with value: 0.8539325842696629 and parameters: {'objective': 'Logloss', 'colsample_bylevel': 0.08347787134830267, 'depth': 3, 'boosting_type': 'Plain', 'bootstrap_type': 'Bayesian', 'bagging_temperature': 9.492806470989827}. Best is trial 3065 with value: 0.8863636363636364.
[32m[I 2023-04-21 02:59:19,184][39m Trial 4420 finished with value: 0.8666666666666666 and parameters: {'objective': 'CrossEntropy', 'colsample_bylevel': 0.09300574150873087, 'depth': 2, 'boosting_type': 'Plain', 'bootstrap_type': 'Bayesian', 'bagging_temperature': 9.360507496182707}. Best is trial 3065 with value: 0.8863636363636364.
[32m[I 2023-04-21 02:59:20,182][39m Trial 4421 finished with value: 0.8539325842696629 and parameters: {'objective': 'CrossEntropy', 'colsample_bylevel': 0.07840505017832618, 'depth': 3, 'boosting_type': 'Plain', 'bootstrap_type': 'Bayesian', 'bagging_temperature': 9.991148736824826}. Best is trial 3065 with value: 0.8863636363636364.
[32m[I 2023-04-21 02:59:21,477][39m Trial 4422 finished with value: 0.8409090909090909 and parameters: {'objective': 'CrossEntropy', 'colsample_bylevel': 0.08437866802628875, 'depth': 5, 'boosting_type': 'Plain', 'bootstrap_type': 'Bayesian', 'bagging_temperature': 8.983860620946718}. Best is trial 3065 with value: 0.8863636363636364.
[32m[I 2023-04-21 02:59:22,766][39m Trial 4423 finished with value: 0.8539325842696629 and parameters: {'objective': 'CrossEntropy', 'colsample_bylevel': 0.07085704514884734, 'depth': 4, 'boosting_type': 'Plain', 'bootstrap_type': 'Bayesian', 'bagging_temperature': 8.526518384967948}. Best is trial 3065 with value: 0.8863636363636364.
[32m[I 2023-04-21 02:59:23,653][39m Trial 4424 finished with value: 0.8666666666666666 and parameters: {'objective': 'CrossEntropy', 'colsample_bylevel': 0.0663746384403666, 'depth': 11, 'boosting_type': 'Plain', 'bootstrap_type': 'Bayesian', 'bagging_temperature': 8.591869010362414}. Best is trial 3065 with value: 0.8863636363636364.
[32m[I 2023-04-21 02:59:24,326][39m Trial 4425 finished with value: 0.8666666666666666 and parameters: {'objective': 'CrossEntropy', 'colsample_bylevel': 0.0777608783409379, 'depth': 11, 'boosting_type': 'Plain', 'bootstrap_type': 'Bayesian', 'bagging_temperature': 9.361843140111024}. Best is trial 3065 with value: 0.8863636363636364.
[32m[I 2023-04-21 02:59:25,576][39m Trial 4426 finished with value: 0.8275862068965518 and parameters: {'objective': 'CrossEntropy', 'colsample_bylevel': 0.08623184409093226, 'depth': 10, 'boosting_type': 'Plain', 'bootstrap_type': 'Bayesian', 'bagging_temperature': 9.700820693251625}. Best is trial 3065 with value: 0.8863636363636364.
[32m[I 2023-04-21 02:59:26,826][39m Trial 4427 finished with value: 0.8275862068965518 and parameters: {'objective': 'Logloss', 'colsample_bylevel': 0.0703545705543795, 'depth': 9, 'boosting_type': 'Plain', 'bootstrap_type': 'MVS'}. Best is trial 3065 with value: 0.8863636363636364.
[32m[I 2023-04-21 02:59:27,502][39m Trial 4428 finished with value: 0.8409090909090909 and parameters: {'objective': 'CrossEntropy', 'colsample_bylevel': 0.09363318781060749, 'depth': 3, 'boosting_type': 'Plain', 'bootstrap_type': 'Bayesian', 'bagging_temperature': 8.778741003892314}. Best is trial 3065 with value: 0.8863636363636364.
[32m[I 2023-04-21 02:59:28,441][39m Trial 4429 finished with value: 0.8409090909090909 and parameters: {'objective': 'CrossEntropy', 'colsample_bylevel': 0.049678083123938836, 'depth': 10, 'boosting_type': 'Plain', 'bootstrap_type': 'Bayesian', 'bagging_temperature': 9.171394126663264}. Best is trial 3065 with value: 0.8863636363636364.
[32m[I 2023-04-21 02:59:29,263][39m Trial 4430 finished with value: 0.8539325842696629 and parameters: {'objective': 'CrossEntropy', 'colsample_bylevel': 0.07631213565868526, 'depth': 10, 'boosting_type': 'Plain', 'bootstrap_type': 'Bayesian', 'bagging_temperature': 9.276351062144798}. Best is trial 3065 with value: 0.8863636363636364.
[32m[I 2023-04-21 02:59:30,052][39m Trial 4431 finished with value: 0.8636363636363636 and parameters: {'objective': 'CrossEntropy', 'colsample_bylevel': 0.08408295348254695, 'depth': 8, 'boosting_type': 'Plain', 'bootstrap_type': 'Bayesian', 'bagging_temperature': 8.874687308952787}. Best is trial 3065 with value: 0.8863636363636364.
[32m[I 2023-04-21 02:59:31,076][39m Trial 4432 finished with value: 0.8409090909090909 and parameters: {'objective': 'CrossEntropy', 'colsample_bylevel': 0.07924561114913353, 'depth': 4, 'boosting_type': 'Plain', 'bootstrap_type': 'Bayesian', 'bagging_temperature': 9.147341598559576}. Best is trial 3065 with value: 0.8863636363636364.
[32m[I 2023-04-21 02:59:32,121][39m Trial 4433 finished with value: 0.8791208791208791 and parameters: {'objective': 'CrossEntropy', 'colsample_bylevel': 0.08089043178972773, 'depth': 3, 'boosting_type': 'Plain', 'bootstrap_type': 'Bayesian', 'bagging_temperature': 8.93016646602685}. Best is trial 3065 with value: 0.8863636363636364.
[32m[I 2023-04-21 02:59:33,306][39m Trial 4434 finished with value: 0.8539325842696629 and parameters: {'objective': 'CrossEntropy', 'colsample_bylevel': 0.0818637207949242, 'depth': 3, 'boosting_type': 'Plain', 'bootstrap_type': 'Bayesian', 'bagging_temperature': 8.923863741944327}. Best is trial 3065 with value: 0.8863636363636364.
[32m[I 2023-04-21 02:59:34,713][39m Trial 4435 finished with value: 0.8275862068965518 and parameters: {'objective': 'CrossEntropy', 'colsample_bylevel': 0.0767184683172059, 'depth': 9, 'boosting_type': 'Plain', 'bootstrap_type': 'MVS'}. Best is trial 3065 with value: 0.8863636363636364.
[32m[I 2023-04-21 02:59:35,874][39m Trial 4436 finished with value: 0.8409090909090909 and parameters: {'objective': 'CrossEntropy', 'colsample_bylevel': 0.07739325467611478, 'depth': 10, 'boosting_type': 'Plain', 'bootstrap_type': 'Bayesian', 'bagging_temperature': 8.356145168329386}. Best is trial 3065 with value: 0.8863636363636364.
[32m[I 2023-04-21 02:59:40,289][39m Trial 4437 finished with value: 0.8539325842696629 and parameters: {'objective': 'CrossEntropy', 'colsample_bylevel': 0.08701742708725672, 'depth': 4, 'boosting_type': 'Ordered', 'bootstrap_type': 'Bayesian', 'bagging_temperature': 9.98163806882793}. Best is trial 3065 with value: 0.8863636363636364.
[32m[I 2023-04-21 02:59:41,529][39m Trial 4438 finished with value: 0.8409090909090909 and parameters: {'objective': 'CrossEntropy', 'colsample_bylevel': 0.0919409911377144, 'depth': 3, 'boosting_type': 'Plain', 'bootstrap_type': 'Bayesian', 'bagging_temperature': 8.705287173188813}. Best is trial 3065 with value: 0.8863636363636364.
[32m[I 2023-04-21 02:59:42,684][39m Trial 4439 finished with value: 0.8409090909090909 and parameters: {'objective': 'Logloss', 'colsample_bylevel': 0.07543949334235925, 'depth': 6, 'boosting_type': 'Plain', 'bootstrap_type': 'Bayesian', 'bagging_temperature': 9.673074465323447}. Best is trial 3065 with value: 0.8863636363636364.
[32m[I 2023-04-21 02:59:43,733][39m Trial 4440 finished with value: 0.8539325842696629 and parameters: {'objective': 'CrossEntropy', 'colsample_bylevel': 0.08694794876914112, 'depth': 11, 'boosting_type': 'Plain', 'bootstrap_type': 'Bayesian', 'bagging_temperature': 9.45968762831752}. Best is trial 3065 with value: 0.8863636363636364.
[32m[I 2023-04-21 02:59:44,591][39m Trial 4441 finished with value: 0.8139534883720929 and parameters: {'objective': 'CrossEntropy', 'colsample_bylevel': 0.07852290911490195, 'depth': 6, 'boosting_type': 'Plain', 'bootstrap_type': 'Bayesian', 'bagging_temperature': 8.821474345880898}. Best is trial 3065 with value: 0.8863636363636364.
[32m[I 2023-04-21 02:59:45,863][39m Trial 4442 finished with value: 0.8539325842696629 and parameters: {'objective': 'CrossEntropy', 'colsample_bylevel': 0.08723876194023268, 'depth': 3, 'boosting_type': 'Plain', 'bootstrap_type': 'Bayesian', 'bagging_temperature': 9.50049185843015}. Best is trial 3065 with value: 0.8863636363636364.
[32m[I 2023-04-21 02:59:46,908][39m Trial 4443 finished with value: 0.8409090909090909 and parameters: {'objective': 'CrossEntropy', 'colsample_bylevel': 0.09294174464177103, 'depth': 3, 'boosting_type': 'Plain', 'bootstrap_type': 'Bayesian', 'bagging_temperature': 9.973248982877134}. Best is trial 3065 with value: 0.8863636363636364.
[32m[I 2023-04-21 02:59:48,017][39m Trial 4444 finished with value: 0.8139534883720929 and parameters: {'objective': 'CrossEntropy', 'colsample_bylevel': 0.07411768544161376, 'depth': 11, 'boosting_type': 'Plain', 'bootstrap_type': 'Bernoulli', 'subsample': 0.11412915946385976}. Best is trial 3065 with value: 0.8863636363636364.
[32m[I 2023-04-21 02:59:49,422][39m Trial 4445 finished with value: 0.8275862068965518 and parameters: {'objective': 'CrossEntropy', 'colsample_bylevel': 0.08538119965942637, 'depth': 3, 'boosting_type': 'Plain', 'bootstrap_type': 'Bayesian', 'bagging_temperature': 9.086042095597486}. Best is trial 3065 with value: 0.8863636363636364.
[32m[I 2023-04-21 02:59:50,685][39m Trial 4446 finished with value: 0.8666666666666666 and parameters: {'objective': 'CrossEntropy', 'colsample_bylevel': 0.08478717423047466, 'depth': 3, 'boosting_type': 'Plain', 'bootstrap_type': 'Bayesian', 'bagging_temperature': 9.064127722776755}. Best is trial 3065 with value: 0.8863636363636364.
[32m[I 2023-04-21 02:59:51,395][39m Trial 4447 finished with value: 0.8666666666666666 and parameters: {'objective': 'CrossEntropy', 'colsample_bylevel': 0.07169738908751269, 'depth': 3, 'boosting_type': 'Plain', 'bootstrap_type': 'Bayesian', 'bagging_temperature': 9.12282056708697}. Best is trial 3065 with value: 0.8863636363636364.
[32m[I 2023-04-21 02:59:52,198][39m Trial 4448 finished with value: 0.8666666666666666 and parameters: {'objective': 'CrossEntropy', 'colsample_bylevel': 0.06895384599373801, 'depth': 2, 'boosting_type': 'Plain', 'bootstrap_type': 'Bayesian', 'bagging_temperature': 9.185372410757692}. Best is trial 3065 with value: 0.8863636363636364.
[32m[I 2023-04-21 02:59:52,999][39m Trial 4449 finished with value: 0.8275862068965518 and parameters: {'objective': 'CrossEntropy', 'colsample_bylevel': 0.06837109274062372, 'depth': 8, 'boosting_type': 'Plain', 'bootstrap_type': 'Bayesian', 'bagging_temperature': 9.603686858995161}. Best is trial 3065 with value: 0.8863636363636364.
[32m[I 2023-04-21 02:59:53,803][39m Trial 4450 finished with value: 0.8505747126436782 and parameters: {'objective': 'CrossEntropy', 'colsample_bylevel': 0.08391123904051707, 'depth': 9, 'boosting_type': 'Plain', 'bootstrap_type': 'Bayesian', 'bagging_temperature': 9.100336426548877}. Best is trial 3065 with value: 0.8863636363636364.
[32m[I 2023-04-21 02:59:54,478][39m Trial 4451 finished with value: 0.8275862068965518 and parameters: {'objective': 'CrossEntropy', 'colsample_bylevel': 0.09480207735749341, 'depth': 3, 'boosting_type': 'Plain', 'bootstrap_type': 'Bayesian', 'bagging_temperature': 4.724877583667023}. Best is trial 3065 with value: 0.8863636363636364.
[32m[I 2023-04-21 02:59:55,720][39m Trial 4452 finished with value: 0.8764044943820225 and parameters: {'objective': 'CrossEntropy', 'colsample_bylevel': 0.08813267067834502, 'depth': 2, 'boosting_type': 'Plain', 'bootstrap_type': 'Bayesian', 'bagging_temperature': 8.502293307877268}. Best is trial 3065 with value: 0.8863636363636364.
[32m[I 2023-04-21 02:59:56,961][39m Trial 4453 finished with value: 0.8539325842696629 and parameters: {'objective': 'CrossEntropy', 'colsample_bylevel': 0.07850610367675481, 'depth': 10, 'boosting_type': 'Plain', 'bootstrap_type': 'Bayesian', 'bagging_temperature': 9.585406531984258}. Best is trial 3065 with value: 0.8863636363636364.
[32m[I 2023-04-21 02:59:57,963][39m Trial 4454 finished with value: 0.8539325842696629 and parameters: {'objective': 'CrossEntropy', 'colsample_bylevel': 0.07955923814862653, 'depth': 10, 'boosting_type': 'Plain', 'bootstrap_type': 'Bayesian', 'bagging_temperature': 8.782002247565039}. Best is trial 3065 with value: 0.8863636363636364.
[32m[I 2023-04-21 03:00:02,866][39m Trial 4455 finished with value: 0.8409090909090909 and parameters: {'objective': 'CrossEntropy', 'colsample_bylevel': 0.07596685174846368, 'depth': 10, 'boosting_type': 'Ordered', 'bootstrap_type': 'Bayesian', 'bagging_temperature': 9.228056697141966}. Best is trial 3065 with value: 0.8863636363636364.
[32m[I 2023-04-21 03:00:04,120][39m Trial 4456 finished with value: 0.8409090909090909 and parameters: {'objective': 'CrossEntropy', 'colsample_bylevel': 0.0953942987349431, 'depth': 3, 'boosting_type': 'Plain', 'bootstrap_type': 'Bayesian', 'bagging_temperature': 8.467023598178889}. Best is trial 3065 with value: 0.8863636363636364.
[32m[I 2023-04-21 03:00:05,067][39m Trial 4457 finished with value: 0.8275862068965518 and parameters: {'objective': 'CrossEntropy', 'colsample_bylevel': 0.08657200423612141, 'depth': 3, 'boosting_type': 'Plain', 'bootstrap_type': 'MVS'}. Best is trial 3065 with value: 0.8863636363636364.
[32m[I 2023-04-21 03:00:06,120][39m Trial 4458 finished with value: 0.8409090909090909 and parameters: {'objective': 'CrossEntropy', 'colsample_bylevel': 0.08610888709355895, 'depth': 3, 'boosting_type': 'Plain', 'bootstrap_type': 'Bayesian', 'bagging_temperature': 0.4289809641495985}. Best is trial 3065 with value: 0.8863636363636364.
[32m[I 2023-04-21 03:00:07,356][39m Trial 4459 finished with value: 0.8666666666666666 and parameters: {'objective': 'CrossEntropy', 'colsample_bylevel': 0.06662398358314306, 'depth': 11, 'boosting_type': 'Plain', 'bootstrap_type': 'Bayesian', 'bagging_temperature': 8.897619928831705}. Best is trial 3065 with value: 0.8863636363636364.
[32m[I 2023-04-21 03:00:08,023][39m Trial 4460 finished with value: 0.8372093023255814 and parameters: {'objective': 'CrossEntropy', 'colsample_bylevel': 0.07070119994863447, 'depth': 7, 'boosting_type': 'Plain', 'bootstrap_type': 'Bayesian', 'bagging_temperature': 9.616383408381093}. Best is trial 3065 with value: 0.8863636363636364.
[32m[I 2023-04-21 03:00:08,672][39m Trial 4461 finished with value: 0.7999999999999999 and parameters: {'objective': 'Logloss', 'colsample_bylevel': 0.03223242935953751, 'depth': 3, 'boosting_type': 'Plain', 'bootstrap_type': 'Bayesian', 'bagging_temperature': 9.307513490658568}. Best is trial 3065 with value: 0.8863636363636364.
[32m[I 2023-04-21 03:00:09,424][39m Trial 4462 finished with value: 0.8666666666666666 and parameters: {'objective': 'Logloss', 'colsample_bylevel': 0.08361994715487767, 'depth': 4, 'boosting_type': 'Plain', 'bootstrap_type': 'Bernoulli', 'subsample': 0.7324388817317415}. Best is trial 3065 with value: 0.8863636363636364.
[32m[I 2023-04-21 03:00:10,691][39m Trial 4463 finished with value: 0.8539325842696629 and parameters: {'objective': 'Logloss', 'colsample_bylevel': 0.0760686992163257, 'depth': 4, 'boosting_type': 'Plain', 'bootstrap_type': 'Bayesian', 'bagging_temperature': 8.160765931017485}. Best is trial 3065 with value: 0.8863636363636364.
[32m[I 2023-04-21 03:00:11,701][39m Trial 4464 finished with value: 0.8539325842696629 and parameters: {'objective': 'CrossEntropy', 'colsample_bylevel': 0.06757564646200648, 'depth': 2, 'boosting_type': 'Plain', 'bootstrap_type': 'Bayesian', 'bagging_temperature': 9.386828283437435}. Best is trial 3065 with value: 0.8863636363636364.
[32m[I 2023-04-21 03:00:12,948][39m Trial 4465 finished with value: 0.8539325842696629 and parameters: {'objective': 'CrossEntropy', 'colsample_bylevel': 0.07723258484892796, 'depth': 5, 'boosting_type': 'Plain', 'bootstrap_type': 'Bayesian', 'bagging_temperature': 8.455739214638678}. Best is trial 3065 with value: 0.8863636363636364.
[32m[I 2023-04-21 03:00:13,802][39m Trial 4466 finished with value: 0.8181818181818182 and parameters: {'objective': 'CrossEntropy', 'colsample_bylevel': 0.07908824124308846, 'depth': 10, 'boosting_type': 'Plain', 'bootstrap_type': 'MVS'}. Best is trial 3065 with value: 0.8863636363636364.
[32m[I 2023-04-21 03:00:14,737][39m Trial 4467 finished with value: 0.8409090909090909 and parameters: {'objective': 'Logloss', 'colsample_bylevel': 0.08652116662003032, 'depth': 9, 'boosting_type': 'Plain', 'bootstrap_type': 'Bayesian', 'bagging_temperature': 9.449887129670223}. Best is trial 3065 with value: 0.8863636363636364.
[32m[I 2023-04-21 03:00:15,420][39m Trial 4468 finished with value: 0.8409090909090909 and parameters: {'objective': 'Logloss', 'colsample_bylevel': 0.07312427834953653, 'depth': 5, 'boosting_type': 'Plain', 'bootstrap_type': 'Bayesian', 'bagging_temperature': 8.765295358531558}. Best is trial 3065 with value: 0.8863636363636364.
[32m[I 2023-04-21 03:00:16,561][39m Trial 4469 finished with value: 0.8539325842696629 and parameters: {'objective': 'CrossEntropy', 'colsample_bylevel': 0.08032405358276791, 'depth': 9, 'boosting_type': 'Plain', 'bootstrap_type': 'Bayesian', 'bagging_temperature': 9.47622334012191}. Best is trial 3065 with value: 0.8863636363636364.
[32m[I 2023-04-21 03:00:17,610][39m Trial 4470 finished with value: 0.8539325842696629 and parameters: {'objective': 'CrossEntropy', 'colsample_bylevel': 0.0772611051331803, 'depth': 3, 'boosting_type': 'Plain', 'bootstrap_type': 'Bayesian', 'bagging_temperature': 8.089253765250708}. Best is trial 3065 with value: 0.8863636363636364.
[32m[I 2023-04-21 03:00:18,880][39m Trial 4471 finished with value: 0.8275862068965518 and parameters: {'objective': 'CrossEntropy', 'colsample_bylevel': 0.06648184260243926, 'depth': 3, 'boosting_type': 'Plain', 'bootstrap_type': 'Bayesian', 'bagging_temperature': 6.347650906333371}. Best is trial 3065 with value: 0.8863636363636364.
[32m[I 2023-04-21 03:00:19,613][39m Trial 4472 finished with value: 0.8409090909090909 and parameters: {'objective': 'CrossEntropy', 'colsample_bylevel': 0.07796821503752206, 'depth': 5, 'boosting_type': 'Plain', 'bootstrap_type': 'Bayesian', 'bagging_temperature': 9.403335074673498}. Best is trial 3065 with value: 0.8863636363636364.
[32m[I 2023-04-21 03:00:20,761][39m Trial 4473 finished with value: 0.8505747126436782 and parameters: {'objective': 'CrossEntropy', 'colsample_bylevel': 0.09625455367852744, 'depth': 10, 'boosting_type': 'Plain', 'bootstrap_type': 'Bayesian', 'bagging_temperature': 9.042906082919977}. Best is trial 3065 with value: 0.8863636363636364.
[32m[I 2023-04-21 03:00:21,821][39m Trial 4474 finished with value: 0.8539325842696629 and parameters: {'objective': 'CrossEntropy', 'colsample_bylevel': 0.07489721047554444, 'depth': 3, 'boosting_type': 'Plain', 'bootstrap_type': 'Bayesian', 'bagging_temperature': 8.707407678410522}. Best is trial 3065 with value: 0.8863636363636364.
[32m[I 2023-04-21 03:00:26,710][39m Trial 4475 finished with value: 0.8275862068965518 and parameters: {'objective': 'CrossEntropy', 'colsample_bylevel': 0.06740096056061495, 'depth': 10, 'boosting_type': 'Ordered', 'bootstrap_type': 'Bayesian', 'bagging_temperature': 9.664926221743947}. Best is trial 3065 with value: 0.8863636363636364.
[32m[I 2023-04-21 03:00:27,877][39m Trial 4476 finished with value: 0.8372093023255814 and parameters: {'objective': 'CrossEntropy', 'colsample_bylevel': 0.08276983338910561, 'depth': 11, 'boosting_type': 'Plain', 'bootstrap_type': 'Bayesian', 'bagging_temperature': 8.95505793097353}. Best is trial 3065 with value: 0.8863636363636364.
[32m[I 2023-04-21 03:00:29,065][39m Trial 4477 finished with value: 0.8539325842696629 and parameters: {'objective': 'CrossEntropy', 'colsample_bylevel': 0.06751953265841938, 'depth': 8, 'boosting_type': 'Plain', 'bootstrap_type': 'Bayesian', 'bagging_temperature': 8.617568657838593}. Best is trial 3065 with value: 0.8863636363636364.
[32m[I 2023-04-21 03:00:30,370][39m Trial 4478 finished with value: 0.8539325842696629 and parameters: {'objective': 'Logloss', 'colsample_bylevel': 0.07426781184354295, 'depth': 10, 'boosting_type': 'Plain', 'bootstrap_type': 'Bayesian', 'bagging_temperature': 9.092577658590097}. Best is trial 3065 with value: 0.8863636363636364.
