[32m[I 2023-04-21 02:29:07,928][39m Trial 2908 finished with value: 0.8409090909090909 and parameters: {'objective': 'CrossEntropy', 'colsample_bylevel': 0.07814256149307305, 'depth': 3, 'boosting_type': 'Plain', 'bootstrap_type': 'Bayesian', 'bagging_temperature': 9.980919185045915}. Best is trial 98 with value: 0.8791208791208791.
[32m[I 2023-04-21 02:29:08,557][39m Trial 2909 finished with value: 0.8666666666666666 and parameters: {'objective': 'CrossEntropy', 'colsample_bylevel': 0.078151839054402, 'depth': 2, 'boosting_type': 'Plain', 'bootstrap_type': 'Bayesian', 'bagging_temperature': 9.818660811492688}. Best is trial 98 with value: 0.8791208791208791.
[32m[I 2023-04-21 02:29:09,921][39m Trial 2910 finished with value: 0.8409090909090909 and parameters: {'objective': 'CrossEntropy', 'colsample_bylevel': 0.0893425206690216, 'depth': 9, 'boosting_type': 'Plain', 'bootstrap_type': 'MVS'}. Best is trial 98 with value: 0.8791208791208791.
[32m[I 2023-04-21 02:29:10,600][39m Trial 2911 finished with value: 0.8666666666666666 and parameters: {'objective': 'CrossEntropy', 'colsample_bylevel': 0.08281552707453708, 'depth': 3, 'boosting_type': 'Plain', 'bootstrap_type': 'Bayesian', 'bagging_temperature': 9.627645689734226}. Best is trial 98 with value: 0.8791208791208791.
[32m[I 2023-04-21 02:29:12,047][39m Trial 2912 finished with value: 0.8505747126436782 and parameters: {'objective': 'CrossEntropy', 'colsample_bylevel': 0.09657298187060862, 'depth': 9, 'boosting_type': 'Plain', 'bootstrap_type': 'Bayesian', 'bagging_temperature': 8.309422132679515}. Best is trial 98 with value: 0.8791208791208791.
[32m[I 2023-04-21 02:29:13,004][39m Trial 2913 finished with value: 0.8666666666666666 and parameters: {'objective': 'Logloss', 'colsample_bylevel': 0.07102979368567858, 'depth': 5, 'boosting_type': 'Plain', 'bootstrap_type': 'Bayesian', 'bagging_temperature': 9.33413928246372}. Best is trial 98 with value: 0.8791208791208791.
[32m[I 2023-04-21 02:29:14,246][39m Trial 2914 finished with value: 0.8505747126436782 and parameters: {'objective': 'CrossEntropy', 'colsample_bylevel': 0.08577419749826981, 'depth': 9, 'boosting_type': 'Plain', 'bootstrap_type': 'Bayesian', 'bagging_temperature': 9.222672501198142}. Best is trial 98 with value: 0.8791208791208791.
[32m[I 2023-04-21 02:29:15,111][39m Trial 2915 finished with value: 0.8275862068965518 and parameters: {'objective': 'CrossEntropy', 'colsample_bylevel': 0.07672144191835636, 'depth': 9, 'boosting_type': 'Plain', 'bootstrap_type': 'Bayesian', 'bagging_temperature': 8.9444288672662}. Best is trial 98 with value: 0.8791208791208791.
[32m[I 2023-04-21 02:29:15,764][39m Trial 2916 finished with value: 0.8505747126436782 and parameters: {'objective': 'CrossEntropy', 'colsample_bylevel': 0.08089305896483386, 'depth': 11, 'boosting_type': 'Plain', 'bootstrap_type': 'Bayesian', 'bagging_temperature': 9.054120850696057}. Best is trial 98 with value: 0.8791208791208791.
[32m[I 2023-04-21 02:29:16,734][39m Trial 2917 finished with value: 0.8372093023255814 and parameters: {'objective': 'CrossEntropy', 'colsample_bylevel': 0.07293273673620741, 'depth': 10, 'boosting_type': 'Plain', 'bootstrap_type': 'Bayesian', 'bagging_temperature': 9.50705927668813}. Best is trial 98 with value: 0.8791208791208791.
[32m[I 2023-04-21 02:29:21,972][39m Trial 2918 finished with value: 0.8539325842696629 and parameters: {'objective': 'CrossEntropy', 'colsample_bylevel': 0.08594813024580125, 'depth': 3, 'boosting_type': 'Ordered', 'bootstrap_type': 'Bayesian', 'bagging_temperature': 9.625108469060002}. Best is trial 98 with value: 0.8791208791208791.
[32m[I 2023-04-21 02:29:22,943][39m Trial 2919 finished with value: 0.8539325842696629 and parameters: {'objective': 'CrossEntropy', 'colsample_bylevel': 0.06761322289942884, 'depth': 11, 'boosting_type': 'Plain', 'bootstrap_type': 'Bayesian', 'bagging_temperature': 8.734766322154984}. Best is trial 98 with value: 0.8791208791208791.
[32m[I 2023-04-21 02:29:24,081][39m Trial 2920 finished with value: 0.8275862068965518 and parameters: {'objective': 'CrossEntropy', 'colsample_bylevel': 0.07342720602630289, 'depth': 9, 'boosting_type': 'Plain', 'bootstrap_type': 'Bayesian', 'bagging_temperature': 9.00122265569341}. Best is trial 98 with value: 0.8791208791208791.
[32m[I 2023-04-21 02:29:24,760][39m Trial 2921 finished with value: 0.8222222222222222 and parameters: {'objective': 'Logloss', 'colsample_bylevel': 0.08027068919528593, 'depth': 3, 'boosting_type': 'Plain', 'bootstrap_type': 'MVS'}. Best is trial 98 with value: 0.8791208791208791.
[32m[I 2023-04-21 02:29:26,263][39m Trial 2922 finished with value: 0.8791208791208791 and parameters: {'objective': 'CrossEntropy', 'colsample_bylevel': 0.07782147704192736, 'depth': 9, 'boosting_type': 'Plain', 'bootstrap_type': 'Bayesian', 'bagging_temperature': 9.451054953399222}. Best is trial 98 with value: 0.8791208791208791.
[32m[I 2023-04-21 02:29:27,474][39m Trial 2923 finished with value: 0.8409090909090909 and parameters: {'objective': 'Logloss', 'colsample_bylevel': 0.07631042783653409, 'depth': 9, 'boosting_type': 'Plain', 'bootstrap_type': 'Bayesian', 'bagging_temperature': 9.785637088044485}. Best is trial 98 with value: 0.8791208791208791.
[32m[I 2023-04-21 02:29:28,340][39m Trial 2924 finished with value: 0.8539325842696629 and parameters: {'objective': 'CrossEntropy', 'colsample_bylevel': 0.08283473580777286, 'depth': 4, 'boosting_type': 'Plain', 'bootstrap_type': 'Bayesian', 'bagging_temperature': 7.360177723336326}. Best is trial 98 with value: 0.8791208791208791.
[32m[I 2023-04-21 02:29:28,962][39m Trial 2925 finished with value: 0.8409090909090909 and parameters: {'objective': 'CrossEntropy', 'colsample_bylevel': 0.0745762304742982, 'depth': 10, 'boosting_type': 'Plain', 'bootstrap_type': 'Bayesian', 'bagging_temperature': 9.386602392272582}. Best is trial 98 with value: 0.8791208791208791.
[32m[I 2023-04-21 02:29:29,598][39m Trial 2926 finished with value: 0.8666666666666666 and parameters: {'objective': 'CrossEntropy', 'colsample_bylevel': 0.09345203296441429, 'depth': 2, 'boosting_type': 'Plain', 'bootstrap_type': 'Bayesian', 'bagging_temperature': 8.642012569309909}. Best is trial 98 with value: 0.8791208791208791.
[32m[I 2023-04-21 02:29:30,563][39m Trial 2927 finished with value: 0.8505747126436782 and parameters: {'objective': 'CrossEntropy', 'colsample_bylevel': 0.09996628109200609, 'depth': 11, 'boosting_type': 'Plain', 'bootstrap_type': 'Bayesian', 'bagging_temperature': 9.979142017322037}. Best is trial 98 with value: 0.8791208791208791.
[32m[I 2023-04-21 02:29:31,462][39m Trial 2928 finished with value: 0.8539325842696629 and parameters: {'objective': 'CrossEntropy', 'colsample_bylevel': 0.06893258696097204, 'depth': 11, 'boosting_type': 'Plain', 'bootstrap_type': 'Bayesian', 'bagging_temperature': 9.993385596736532}. Best is trial 98 with value: 0.8791208791208791.
[32m[I 2023-04-21 02:29:32,373][39m Trial 2929 finished with value: 0.8539325842696629 and parameters: {'objective': 'Logloss', 'colsample_bylevel': 0.07364861906125847, 'depth': 7, 'boosting_type': 'Plain', 'bootstrap_type': 'Bayesian', 'bagging_temperature': 8.60090658525991}. Best is trial 98 with value: 0.8791208791208791.
[32m[I 2023-04-21 02:29:33,437][39m Trial 2930 finished with value: 0.8539325842696629 and parameters: {'objective': 'Logloss', 'colsample_bylevel': 0.07959720936011976, 'depth': 5, 'boosting_type': 'Plain', 'bootstrap_type': 'Bayesian', 'bagging_temperature': 9.5584854781057}. Best is trial 98 with value: 0.8791208791208791.
[32m[I 2023-04-21 02:29:34,131][39m Trial 2931 finished with value: 0.8275862068965518 and parameters: {'objective': 'CrossEntropy', 'colsample_bylevel': 0.08812092406235661, 'depth': 4, 'boosting_type': 'Plain', 'bootstrap_type': 'Bayesian', 'bagging_temperature': 9.764226158423318}. Best is trial 98 with value: 0.8791208791208791.
[32m[I 2023-04-21 02:29:35,317][39m Trial 2932 finished with value: 0.8791208791208791 and parameters: {'objective': 'CrossEntropy', 'colsample_bylevel': 0.07794208115563495, 'depth': 10, 'boosting_type': 'Plain', 'bootstrap_type': 'Bayesian', 'bagging_temperature': 9.996972642098083}. Best is trial 98 with value: 0.8791208791208791.
[32m[I 2023-04-21 02:29:36,400][39m Trial 2933 finished with value: 0.8139534883720929 and parameters: {'objective': 'CrossEntropy', 'colsample_bylevel': 0.07794407154853739, 'depth': 3, 'boosting_type': 'Plain', 'bootstrap_type': 'Bernoulli', 'subsample': 0.2922632803358367}. Best is trial 98 with value: 0.8791208791208791.
[32m[I 2023-04-21 02:29:37,505][39m Trial 2934 finished with value: 0.8409090909090909 and parameters: {'objective': 'CrossEntropy', 'colsample_bylevel': 0.07848699845665702, 'depth': 10, 'boosting_type': 'Plain', 'bootstrap_type': 'Bayesian', 'bagging_temperature': 8.997782516508604}. Best is trial 98 with value: 0.8791208791208791.
[32m[I 2023-04-21 02:29:42,226][39m Trial 2935 finished with value: 0.8409090909090909 and parameters: {'objective': 'CrossEntropy', 'colsample_bylevel': 0.09509378095539364, 'depth': 3, 'boosting_type': 'Ordered', 'bootstrap_type': 'Bayesian', 'bagging_temperature': 8.707380915403167}. Best is trial 98 with value: 0.8791208791208791.
[32m[I 2023-04-21 02:29:43,258][39m Trial 2936 finished with value: 0.8539325842696629 and parameters: {'objective': 'CrossEntropy', 'colsample_bylevel': 0.09506025398451033, 'depth': 3, 'boosting_type': 'Plain', 'bootstrap_type': 'Bayesian', 'bagging_temperature': 8.85517240095382}. Best is trial 98 with value: 0.8791208791208791.
[32m[I 2023-04-21 02:29:44,346][39m Trial 2937 finished with value: 0.8539325842696629 and parameters: {'objective': 'CrossEntropy', 'colsample_bylevel': 0.09131422730833444, 'depth': 2, 'boosting_type': 'Plain', 'bootstrap_type': 'MVS'}. Best is trial 98 with value: 0.8791208791208791.
[32m[I 2023-04-21 02:29:45,200][39m Trial 2938 finished with value: 0.8139534883720929 and parameters: {'objective': 'CrossEntropy', 'colsample_bylevel': 0.07616990619353958, 'depth': 10, 'boosting_type': 'Plain', 'bootstrap_type': 'Bayesian', 'bagging_temperature': 9.647152643005185}. Best is trial 98 with value: 0.8791208791208791.
[32m[I 2023-04-21 02:29:46,175][39m Trial 2939 finished with value: 0.8539325842696629 and parameters: {'objective': 'Logloss', 'colsample_bylevel': 0.07829762647360727, 'depth': 5, 'boosting_type': 'Plain', 'bootstrap_type': 'Bayesian', 'bagging_temperature': 9.862800719329336}. Best is trial 98 with value: 0.8791208791208791.
[32m[I 2023-04-21 02:29:47,520][39m Trial 2940 finished with value: 0.8791208791208791 and parameters: {'objective': 'CrossEntropy', 'colsample_bylevel': 0.07600302483364216, 'depth': 9, 'boosting_type': 'Plain', 'bootstrap_type': 'Bayesian', 'bagging_temperature': 9.48115156509897}. Best is trial 98 with value: 0.8791208791208791.
[32m[I 2023-04-21 02:29:48,235][39m Trial 2941 finished with value: 0.8666666666666666 and parameters: {'objective': 'CrossEntropy', 'colsample_bylevel': 0.0825123656268594, 'depth': 3, 'boosting_type': 'Plain', 'bootstrap_type': 'Bayesian', 'bagging_temperature': 9.47752019891807}. Best is trial 98 with value: 0.8791208791208791.
[32m[I 2023-04-21 02:29:49,095][39m Trial 2942 finished with value: 0.8666666666666666 and parameters: {'objective': 'Logloss', 'colsample_bylevel': 0.07370314326224416, 'depth': 5, 'boosting_type': 'Plain', 'bootstrap_type': 'Bayesian', 'bagging_temperature': 9.781145350425467}. Best is trial 98 with value: 0.8791208791208791.
[32m[I 2023-04-21 02:29:50,121][39m Trial 2943 finished with value: 0.8409090909090909 and parameters: {'objective': 'Logloss', 'colsample_bylevel': 0.08067840783709837, 'depth': 3, 'boosting_type': 'Plain', 'bootstrap_type': 'Bayesian', 'bagging_temperature': 9.651591658898147}. Best is trial 98 with value: 0.8791208791208791.
[32m[I 2023-04-21 02:29:51,189][39m Trial 2944 finished with value: 0.8539325842696629 and parameters: {'objective': 'CrossEntropy', 'colsample_bylevel': 0.07975589810056596, 'depth': 4, 'boosting_type': 'Plain', 'bootstrap_type': 'Bayesian', 'bagging_temperature': 9.118364318371286}. Best is trial 98 with value: 0.8791208791208791.
[32m[I 2023-04-21 02:29:52,242][39m Trial 2945 finished with value: 0.8666666666666666 and parameters: {'objective': 'CrossEntropy', 'colsample_bylevel': 0.06395652286486461, 'depth': 10, 'boosting_type': 'Plain', 'bootstrap_type': 'Bayesian', 'bagging_temperature': 9.650761476582701}. Best is trial 98 with value: 0.8791208791208791.
[32m[I 2023-04-21 02:29:53,299][39m Trial 2946 finished with value: 0.8666666666666666 and parameters: {'objective': 'CrossEntropy', 'colsample_bylevel': 0.08163145958499983, 'depth': 3, 'boosting_type': 'Plain', 'bootstrap_type': 'Bayesian', 'bagging_temperature': 7.63442222523354}. Best is trial 98 with value: 0.8791208791208791.
[32m[I 2023-04-21 02:29:53,918][39m Trial 2947 finished with value: 0.8275862068965518 and parameters: {'objective': 'Logloss', 'colsample_bylevel': 0.0702292121178529, 'depth': 10, 'boosting_type': 'Plain', 'bootstrap_type': 'Bayesian', 'bagging_temperature': 9.511348274700378}. Best is trial 98 with value: 0.8791208791208791.
[32m[I 2023-04-21 02:29:54,557][39m Trial 2948 finished with value: 0.8666666666666666 and parameters: {'objective': 'CrossEntropy', 'colsample_bylevel': 0.08367119420353859, 'depth': 3, 'boosting_type': 'Plain', 'bootstrap_type': 'Bayesian', 'bagging_temperature': 9.075406634053474}. Best is trial 98 with value: 0.8791208791208791.
[32m[I 2023-04-21 02:29:55,808][39m Trial 2949 finished with value: 0.8275862068965518 and parameters: {'objective': 'CrossEntropy', 'colsample_bylevel': 0.0767820221042535, 'depth': 8, 'boosting_type': 'Plain', 'bootstrap_type': 'MVS'}. Best is trial 98 with value: 0.8791208791208791.
[32m[I 2023-04-21 02:29:56,948][39m Trial 2950 finished with value: 0.8539325842696629 and parameters: {'objective': 'CrossEntropy', 'colsample_bylevel': 0.08103118108474253, 'depth': 3, 'boosting_type': 'Plain', 'bootstrap_type': 'Bayesian', 'bagging_temperature': 6.787668343334036}. Best is trial 98 with value: 0.8791208791208791.
[32m[I 2023-04-21 02:29:58,575][39m Trial 2951 finished with value: 0.8539325842696629 and parameters: {'objective': 'CrossEntropy', 'colsample_bylevel': 0.07518019332687416, 'depth': 9, 'boosting_type': 'Plain', 'bootstrap_type': 'Bernoulli', 'subsample': 0.3315935442816182}. Best is trial 98 with value: 0.8791208791208791.
[32m[I 2023-04-21 02:29:59,448][39m Trial 2952 finished with value: 0.8666666666666666 and parameters: {'objective': 'CrossEntropy', 'colsample_bylevel': 0.08040521156142524, 'depth': 3, 'boosting_type': 'Plain', 'bootstrap_type': 'Bayesian', 'bagging_temperature': 8.750631277826248}. Best is trial 98 with value: 0.8791208791208791.
[32m[I 2023-04-21 02:30:00,244][39m Trial 2953 finished with value: 0.8666666666666666 and parameters: {'objective': 'CrossEntropy', 'colsample_bylevel': 0.08067045761186278, 'depth': 3, 'boosting_type': 'Plain', 'bootstrap_type': 'Bayesian', 'bagging_temperature': 9.148115708086308}. Best is trial 98 with value: 0.8791208791208791.
[32m[I 2023-04-21 02:30:05,084][39m Trial 2954 finished with value: 0.8539325842696629 and parameters: {'objective': 'CrossEntropy', 'colsample_bylevel': 0.0868439867918355, 'depth': 12, 'boosting_type': 'Ordered', 'bootstrap_type': 'Bayesian', 'bagging_temperature': 9.364683373959284}. Best is trial 98 with value: 0.8791208791208791.
[32m[I 2023-04-21 02:30:06,249][39m Trial 2955 finished with value: 0.8636363636363636 and parameters: {'objective': 'CrossEntropy', 'colsample_bylevel': 0.08054583404223467, 'depth': 7, 'boosting_type': 'Plain', 'bootstrap_type': 'Bayesian', 'bagging_temperature': 9.822860085030706}. Best is trial 98 with value: 0.8791208791208791.
[32m[I 2023-04-21 02:30:07,305][39m Trial 2956 finished with value: 0.8275862068965518 and parameters: {'objective': 'CrossEntropy', 'colsample_bylevel': 0.08057568769988198, 'depth': 3, 'boosting_type': 'Plain', 'bootstrap_type': 'Bayesian', 'bagging_temperature': 9.986648363156501}. Best is trial 98 with value: 0.8791208791208791.
[32m[I 2023-04-21 02:30:08,234][39m Trial 2957 finished with value: 0.8409090909090909 and parameters: {'objective': 'CrossEntropy', 'colsample_bylevel': 0.0410879590565932, 'depth': 10, 'boosting_type': 'Plain', 'bootstrap_type': 'Bayesian', 'bagging_temperature': 9.370900734256248}. Best is trial 98 with value: 0.8791208791208791.
[32m[I 2023-04-21 02:30:09,122][39m Trial 2958 finished with value: 0.8275862068965518 and parameters: {'objective': 'CrossEntropy', 'colsample_bylevel': 0.0749530153546215, 'depth': 9, 'boosting_type': 'Plain', 'bootstrap_type': 'MVS'}. Best is trial 98 with value: 0.8791208791208791.
[32m[I 2023-04-21 02:30:09,750][39m Trial 2959 finished with value: 0.8409090909090909 and parameters: {'objective': 'CrossEntropy', 'colsample_bylevel': 0.07691863505911677, 'depth': 10, 'boosting_type': 'Plain', 'bootstrap_type': 'Bayesian', 'bagging_temperature': 9.243921630164605}. Best is trial 98 with value: 0.8791208791208791.
[32m[I 2023-04-21 02:30:10,702][39m Trial 2960 finished with value: 0.8539325842696629 and parameters: {'objective': 'CrossEntropy', 'colsample_bylevel': 0.07960301135582828, 'depth': 3, 'boosting_type': 'Plain', 'bootstrap_type': 'Bayesian', 'bagging_temperature': 8.965530950415964}. Best is trial 98 with value: 0.8791208791208791.
[32m[I 2023-04-21 02:30:11,970][39m Trial 2961 finished with value: 0.8539325842696629 and parameters: {'objective': 'CrossEntropy', 'colsample_bylevel': 0.08238066331102985, 'depth': 3, 'boosting_type': 'Plain', 'bootstrap_type': 'Bayesian', 'bagging_temperature': 8.587738603049937}. Best is trial 98 with value: 0.8791208791208791.
[32m[I 2023-04-21 02:30:13,275][39m Trial 2962 finished with value: 0.8409090909090909 and parameters: {'objective': 'Logloss', 'colsample_bylevel': 0.07402312598034012, 'depth': 5, 'boosting_type': 'Plain', 'bootstrap_type': 'Bayesian', 'bagging_temperature': 9.349893702186918}. Best is trial 98 with value: 0.8791208791208791.
[32m[I 2023-04-21 02:30:14,386][39m Trial 2963 finished with value: 0.8505747126436782 and parameters: {'objective': 'CrossEntropy', 'colsample_bylevel': 0.09356584958364823, 'depth': 10, 'boosting_type': 'Plain', 'bootstrap_type': 'Bayesian', 'bagging_temperature': 8.489934886655972}. Best is trial 98 with value: 0.8791208791208791.
[32m[I 2023-04-21 02:30:15,087][39m Trial 2964 finished with value: 0.8275862068965518 and parameters: {'objective': 'CrossEntropy', 'colsample_bylevel': 0.08429850199403112, 'depth': 12, 'boosting_type': 'Plain', 'bootstrap_type': 'Bayesian', 'bagging_temperature': 9.376372623263016}. Best is trial 98 with value: 0.8791208791208791.
[32m[I 2023-04-21 02:30:15,697][39m Trial 2965 finished with value: 0.8666666666666666 and parameters: {'objective': 'Logloss', 'colsample_bylevel': 0.07341936249254231, 'depth': 10, 'boosting_type': 'Plain', 'bootstrap_type': 'Bayesian', 'bagging_temperature': 9.774807697372934}. Best is trial 98 with value: 0.8791208791208791.
[32m[I 2023-04-21 02:30:16,395][39m Trial 2966 finished with value: 0.8275862068965518 and parameters: {'objective': 'CrossEntropy', 'colsample_bylevel': 0.07635786403876307, 'depth': 4, 'boosting_type': 'Plain', 'bootstrap_type': 'Bayesian', 'bagging_temperature': 9.780182587153263}. Best is trial 98 with value: 0.8791208791208791.
[32m[I 2023-04-21 02:30:17,519][39m Trial 2967 finished with value: 0.8275862068965518 and parameters: {'objective': 'CrossEntropy', 'colsample_bylevel': 0.0774421433731876, 'depth': 4, 'boosting_type': 'Plain', 'bootstrap_type': 'Bayesian', 'bagging_temperature': 9.75751757687626}. Best is trial 98 with value: 0.8791208791208791.
[32m[I 2023-04-21 02:30:18,876][39m Trial 2968 finished with value: 0.8409090909090909 and parameters: {'objective': 'CrossEntropy', 'colsample_bylevel': 0.0789028932802318, 'depth': 8, 'boosting_type': 'Plain', 'bootstrap_type': 'Bayesian', 'bagging_temperature': 8.579528664763597}. Best is trial 98 with value: 0.8791208791208791.
[32m[I 2023-04-21 02:30:20,520][39m Trial 2969 finished with value: 0.8666666666666666 and parameters: {'objective': 'CrossEntropy', 'colsample_bylevel': 0.07658545698066833, 'depth': 9, 'boosting_type': 'Plain', 'bootstrap_type': 'Bayesian', 'bagging_temperature': 9.264979882849651}. Best is trial 98 with value: 0.8791208791208791.
[32m[I 2023-04-21 02:30:21,179][39m Trial 2970 finished with value: 0.8539325842696629 and parameters: {'objective': 'CrossEntropy', 'colsample_bylevel': 0.0875247175614916, 'depth': 10, 'boosting_type': 'Plain', 'bootstrap_type': 'Bayesian', 'bagging_temperature': 9.432387064152634}. Best is trial 98 with value: 0.8791208791208791.
[32m[I 2023-04-21 02:30:22,176][39m Trial 2971 finished with value: 0.8409090909090909 and parameters: {'objective': 'CrossEntropy', 'colsample_bylevel': 0.07562277175660248, 'depth': 11, 'boosting_type': 'Plain', 'bootstrap_type': 'Bernoulli', 'subsample': 0.8906940290607055}. Best is trial 98 with value: 0.8791208791208791.
[32m[I 2023-04-21 02:30:26,820][39m Trial 2972 finished with value: 0.8172043010752689 and parameters: {'objective': 'CrossEntropy', 'colsample_bylevel': 0.09165084714558881, 'depth': 3, 'boosting_type': 'Ordered', 'bootstrap_type': 'MVS'}. Best is trial 98 with value: 0.8791208791208791.
[32m[I 2023-04-21 02:30:27,794][39m Trial 2973 finished with value: 0.8666666666666666 and parameters: {'objective': 'CrossEntropy', 'colsample_bylevel': 0.08180826481201603, 'depth': 3, 'boosting_type': 'Plain', 'bootstrap_type': 'Bayesian', 'bagging_temperature': 9.560707688836736}. Best is trial 98 with value: 0.8791208791208791.
