[32m[I 2023-04-21 02:49:50,276][39m Trial 3955 finished with value: 0.8539325842696629 and parameters: {'objective': 'CrossEntropy', 'colsample_bylevel': 0.06756203139731538, 'depth': 8, 'boosting_type': 'Plain', 'bootstrap_type': 'Bayesian', 'bagging_temperature': 9.728623608904254}. Best is trial 3065 with value: 0.8863636363636364.
[32m[I 2023-04-21 02:49:51,231][39m Trial 3956 finished with value: 0.8539325842696629 and parameters: {'objective': 'CrossEntropy', 'colsample_bylevel': 0.08186937431232194, 'depth': 3, 'boosting_type': 'Plain', 'bootstrap_type': 'Bayesian', 'bagging_temperature': 9.656839123867329}. Best is trial 3065 with value: 0.8863636363636364.
[32m[I 2023-04-21 02:49:51,874][39m Trial 3957 finished with value: 0.8764044943820225 and parameters: {'objective': 'CrossEntropy', 'colsample_bylevel': 0.08321441414984442, 'depth': 2, 'boosting_type': 'Plain', 'bootstrap_type': 'Bayesian', 'bagging_temperature': 8.85196221235139}. Best is trial 3065 with value: 0.8863636363636364.
[32m[I 2023-04-21 02:49:52,986][39m Trial 3958 finished with value: 0.8409090909090909 and parameters: {'objective': 'CrossEntropy', 'colsample_bylevel': 0.08482185267172071, 'depth': 3, 'boosting_type': 'Plain', 'bootstrap_type': 'MVS'}. Best is trial 3065 with value: 0.8863636363636364.
[32m[I 2023-04-21 02:49:54,012][39m Trial 3959 finished with value: 0.8409090909090909 and parameters: {'objective': 'CrossEntropy', 'colsample_bylevel': 0.07694062639252845, 'depth': 11, 'boosting_type': 'Plain', 'bootstrap_type': 'Bayesian', 'bagging_temperature': 9.407742525269454}. Best is trial 3065 with value: 0.8863636363636364.
[32m[I 2023-04-21 02:49:54,923][39m Trial 3960 finished with value: 0.8275862068965518 and parameters: {'objective': 'CrossEntropy', 'colsample_bylevel': 0.07504896399679294, 'depth': 1, 'boosting_type': 'Plain', 'bootstrap_type': 'Bayesian', 'bagging_temperature': 9.421163992108708}. Best is trial 3065 with value: 0.8863636363636364.
[32m[I 2023-04-21 02:49:55,935][39m Trial 3961 finished with value: 0.8539325842696629 and parameters: {'objective': 'Logloss', 'colsample_bylevel': 0.07396893060459973, 'depth': 10, 'boosting_type': 'Plain', 'bootstrap_type': 'Bayesian', 'bagging_temperature': 7.7016284246388516}. Best is trial 3065 with value: 0.8863636363636364.
[32m[I 2023-04-21 02:49:56,732][39m Trial 3962 finished with value: 0.8139534883720929 and parameters: {'objective': 'CrossEntropy', 'colsample_bylevel': 0.09609259499766432, 'depth': 3, 'boosting_type': 'Plain', 'bootstrap_type': 'Bayesian', 'bagging_temperature': 3.3479017622265568}. Best is trial 3065 with value: 0.8863636363636364.
[32m[I 2023-04-21 02:49:57,606][39m Trial 3963 finished with value: 0.8666666666666666 and parameters: {'objective': 'CrossEntropy', 'colsample_bylevel': 0.07343540116539998, 'depth': 4, 'boosting_type': 'Plain', 'bootstrap_type': 'Bayesian', 'bagging_temperature': 8.462093641144875}. Best is trial 3065 with value: 0.8863636363636364.
[32m[I 2023-04-21 02:49:58,285][39m Trial 3964 finished with value: 0.8275862068965518 and parameters: {'objective': 'Logloss', 'colsample_bylevel': 0.08207510820103525, 'depth': 10, 'boosting_type': 'Plain', 'bootstrap_type': 'Bayesian', 'bagging_temperature': 9.23798669182137}. Best is trial 3065 with value: 0.8863636363636364.
[32m[I 2023-04-21 02:49:59,395][39m Trial 3965 finished with value: 0.8539325842696629 and parameters: {'objective': 'CrossEntropy', 'colsample_bylevel': 0.07086125648903395, 'depth': 7, 'boosting_type': 'Plain', 'bootstrap_type': 'Bayesian', 'bagging_temperature': 9.270465920023911}. Best is trial 3065 with value: 0.8863636363636364.
[32m[I 2023-04-21 02:50:00,860][39m Trial 3966 finished with value: 0.8409090909090909 and parameters: {'objective': 'CrossEntropy', 'colsample_bylevel': 0.07883870512203585, 'depth': 9, 'boosting_type': 'Plain', 'bootstrap_type': 'Bayesian', 'bagging_temperature': 9.499281971043699}. Best is trial 3065 with value: 0.8863636363636364.
[32m[I 2023-04-21 02:50:02,253][39m Trial 3967 finished with value: 0.8539325842696629 and parameters: {'objective': 'Logloss', 'colsample_bylevel': 0.07053504120118927, 'depth': 8, 'boosting_type': 'Plain', 'bootstrap_type': 'Bayesian', 'bagging_temperature': 8.681537503950794}. Best is trial 3065 with value: 0.8863636363636364.
[32m[I 2023-04-21 02:50:06,777][39m Trial 3968 finished with value: 0.8409090909090909 and parameters: {'objective': 'Logloss', 'colsample_bylevel': 0.07365192607838396, 'depth': 11, 'boosting_type': 'Ordered', 'bootstrap_type': 'Bayesian', 'bagging_temperature': 9.039419811132017}. Best is trial 3065 with value: 0.8863636363636364.
[32m[I 2023-04-21 02:50:07,800][39m Trial 3969 finished with value: 0.8666666666666666 and parameters: {'objective': 'CrossEntropy', 'colsample_bylevel': 0.08083777066450426, 'depth': 3, 'boosting_type': 'Plain', 'bootstrap_type': 'Bayesian', 'bagging_temperature': 9.52618096604641}. Best is trial 3065 with value: 0.8863636363636364.
[32m[I 2023-04-21 02:50:08,791][39m Trial 3970 finished with value: 0.8666666666666666 and parameters: {'objective': 'Logloss', 'colsample_bylevel': 0.0733135641062068, 'depth': 7, 'boosting_type': 'Plain', 'bootstrap_type': 'Bayesian', 'bagging_temperature': 9.674362816193934}. Best is trial 3065 with value: 0.8863636363636364.
[32m[I 2023-04-21 02:50:10,061][39m Trial 3971 finished with value: 0.8275862068965518 and parameters: {'objective': 'Logloss', 'colsample_bylevel': 0.07262427638999959, 'depth': 8, 'boosting_type': 'Plain', 'bootstrap_type': 'Bayesian', 'bagging_temperature': 5.0738190088786075}. Best is trial 3065 with value: 0.8863636363636364.
[32m[I 2023-04-21 02:50:11,026][39m Trial 3972 finished with value: 0.8409090909090909 and parameters: {'objective': 'CrossEntropy', 'colsample_bylevel': 0.07510006901818639, 'depth': 11, 'boosting_type': 'Plain', 'bootstrap_type': 'Bayesian', 'bagging_temperature': 9.659486201853497}. Best is trial 3065 with value: 0.8863636363636364.
[32m[I 2023-04-21 02:50:11,927][39m Trial 3973 finished with value: 0.8275862068965518 and parameters: {'objective': 'CrossEntropy', 'colsample_bylevel': 0.07505946212353087, 'depth': 9, 'boosting_type': 'Plain', 'bootstrap_type': 'Bernoulli', 'subsample': 0.28787070013730287}. Best is trial 3065 with value: 0.8863636363636364.
[32m[I 2023-04-21 02:50:12,579][39m Trial 3974 finished with value: 0.8409090909090909 and parameters: {'objective': 'CrossEntropy', 'colsample_bylevel': 0.0710498093463418, 'depth': 10, 'boosting_type': 'Plain', 'bootstrap_type': 'Bayesian', 'bagging_temperature': 9.821201428908473}. Best is trial 3065 with value: 0.8863636363636364.
[32m[I 2023-04-21 02:50:13,768][39m Trial 3975 finished with value: 0.8539325842696629 and parameters: {'objective': 'CrossEntropy', 'colsample_bylevel': 0.07846562476151142, 'depth': 3, 'boosting_type': 'Plain', 'bootstrap_type': 'Bayesian', 'bagging_temperature': 9.80493290634396}. Best is trial 3065 with value: 0.8863636363636364.
[32m[I 2023-04-21 02:50:15,025][39m Trial 3976 finished with value: 0.8539325842696629 and parameters: {'objective': 'Logloss', 'colsample_bylevel': 0.07637376330214278, 'depth': 8, 'boosting_type': 'Plain', 'bootstrap_type': 'Bayesian', 'bagging_temperature': 9.91506837967713}. Best is trial 3065 with value: 0.8863636363636364.
[32m[I 2023-04-21 02:50:15,980][39m Trial 3977 finished with value: 0.8275862068965518 and parameters: {'objective': 'CrossEntropy', 'colsample_bylevel': 0.08133746997130095, 'depth': 4, 'boosting_type': 'Plain', 'bootstrap_type': 'Bayesian', 'bagging_temperature': 8.88261983483602}. Best is trial 3065 with value: 0.8863636363636364.
[32m[I 2023-04-21 02:50:16,889][39m Trial 3978 finished with value: 0.8275862068965518 and parameters: {'objective': 'CrossEntropy', 'colsample_bylevel': 0.09131027909718084, 'depth': 4, 'boosting_type': 'Plain', 'bootstrap_type': 'Bayesian', 'bagging_temperature': 9.987627634093842}. Best is trial 3065 with value: 0.8863636363636364.
[32m[I 2023-04-21 02:50:17,557][39m Trial 3979 finished with value: 0.8505747126436782 and parameters: {'objective': 'CrossEntropy', 'colsample_bylevel': 0.08933255564281756, 'depth': 10, 'boosting_type': 'Plain', 'bootstrap_type': 'Bayesian', 'bagging_temperature': 8.529072458881508}. Best is trial 3065 with value: 0.8863636363636364.
[32m[I 2023-04-21 02:50:18,369][39m Trial 3980 finished with value: 0.8275862068965518 and parameters: {'objective': 'Logloss', 'colsample_bylevel': 0.07455343619883738, 'depth': 10, 'boosting_type': 'Plain', 'bootstrap_type': 'Bayesian', 'bagging_temperature': 8.208210649704865}. Best is trial 3065 with value: 0.8863636363636364.
[32m[I 2023-04-21 02:50:19,401][39m Trial 3981 finished with value: 0.8409090909090909 and parameters: {'objective': 'CrossEntropy', 'colsample_bylevel': 0.09287240536322562, 'depth': 2, 'boosting_type': 'Plain', 'bootstrap_type': 'Bayesian', 'bagging_temperature': 9.837653743748138}. Best is trial 3065 with value: 0.8863636363636364.
[32m[I 2023-04-21 02:50:20,555][39m Trial 3982 finished with value: 0.8409090909090909 and parameters: {'objective': 'Logloss', 'colsample_bylevel': 0.06723812242212476, 'depth': 10, 'boosting_type': 'Plain', 'bootstrap_type': 'Bayesian', 'bagging_temperature': 9.528782085255594}. Best is trial 3065 with value: 0.8863636363636364.
[32m[I 2023-04-21 02:50:21,689][39m Trial 3983 finished with value: 0.8139534883720929 and parameters: {'objective': 'Logloss', 'colsample_bylevel': 0.07970955486515079, 'depth': 6, 'boosting_type': 'Plain', 'bootstrap_type': 'MVS'}. Best is trial 3065 with value: 0.8863636363636364.
[32m[I 2023-04-21 02:50:26,610][39m Trial 3984 finished with value: 0.8409090909090909 and parameters: {'objective': 'CrossEntropy', 'colsample_bylevel': 0.0957703527908328, 'depth': 3, 'boosting_type': 'Ordered', 'bootstrap_type': 'Bernoulli', 'subsample': 0.8278992405003234}. Best is trial 3065 with value: 0.8863636363636364.
[32m[I 2023-04-21 02:50:27,563][39m Trial 3985 finished with value: 0.8666666666666666 and parameters: {'objective': 'Logloss', 'colsample_bylevel': 0.06831192391909229, 'depth': 10, 'boosting_type': 'Plain', 'bootstrap_type': 'Bayesian', 'bagging_temperature': 9.615248321506732}. Best is trial 3065 with value: 0.8863636363636364.
[32m[I 2023-04-21 02:50:28,528][39m Trial 3986 finished with value: 0.8666666666666666 and parameters: {'objective': 'Logloss', 'colsample_bylevel': 0.06922057962554574, 'depth': 12, 'boosting_type': 'Plain', 'bootstrap_type': 'Bayesian', 'bagging_temperature': 8.150284413029834}. Best is trial 3065 with value: 0.8863636363636364.
[32m[I 2023-04-21 02:50:29,874][39m Trial 3987 finished with value: 0.8666666666666666 and parameters: {'objective': 'CrossEntropy', 'colsample_bylevel': 0.07629898166445788, 'depth': 9, 'boosting_type': 'Plain', 'bootstrap_type': 'Bayesian', 'bagging_temperature': 9.800157966134169}. Best is trial 3065 with value: 0.8863636363636364.
[32m[I 2023-04-21 02:50:31,302][39m Trial 3988 finished with value: 0.8409090909090909 and parameters: {'objective': 'CrossEntropy', 'colsample_bylevel': 0.07697421823484923, 'depth': 8, 'boosting_type': 'Plain', 'bootstrap_type': 'Bayesian', 'bagging_temperature': 9.637235997065208}. Best is trial 3065 with value: 0.8863636363636364.
[32m[I 2023-04-21 02:50:31,977][39m Trial 3989 finished with value: 0.8505747126436782 and parameters: {'objective': 'CrossEntropy', 'colsample_bylevel': 0.08486617598758243, 'depth': 12, 'boosting_type': 'Plain', 'bootstrap_type': 'Bayesian', 'bagging_temperature': 9.114034608391242}. Best is trial 3065 with value: 0.8863636363636364.
[32m[I 2023-04-21 02:50:32,668][39m Trial 3990 finished with value: 0.8409090909090909 and parameters: {'objective': 'CrossEntropy', 'colsample_bylevel': 0.08149275592015656, 'depth': 10, 'boosting_type': 'Plain', 'bootstrap_type': 'Bayesian', 'bagging_temperature': 9.096370522277114}. Best is trial 3065 with value: 0.8863636363636364.
[32m[I 2023-04-21 02:50:33,885][39m Trial 3991 finished with value: 0.8409090909090909 and parameters: {'objective': 'CrossEntropy', 'colsample_bylevel': 0.07763984378823367, 'depth': 2, 'boosting_type': 'Plain', 'bootstrap_type': 'Bayesian', 'bagging_temperature': 6.966529323393872}. Best is trial 3065 with value: 0.8863636363636364.
[32m[I 2023-04-21 02:50:34,740][39m Trial 3992 finished with value: 0.8409090909090909 and parameters: {'objective': 'CrossEntropy', 'colsample_bylevel': 0.08015757237846341, 'depth': 10, 'boosting_type': 'Plain', 'bootstrap_type': 'Bayesian', 'bagging_temperature': 9.191471612835562}. Best is trial 3065 with value: 0.8863636363636364.
[32m[I 2023-04-21 02:50:35,670][39m Trial 3993 finished with value: 0.8181818181818182 and parameters: {'objective': 'CrossEntropy', 'colsample_bylevel': 0.060951482592922435, 'depth': 6, 'boosting_type': 'Plain', 'bootstrap_type': 'MVS'}. Best is trial 3065 with value: 0.8863636363636364.
[32m[I 2023-04-21 02:50:36,649][39m Trial 3994 finished with value: 0.8666666666666666 and parameters: {'objective': 'CrossEntropy', 'colsample_bylevel': 0.07085927446289686, 'depth': 10, 'boosting_type': 'Plain', 'bootstrap_type': 'Bayesian', 'bagging_temperature': 9.34265002992665}. Best is trial 3065 with value: 0.8863636363636364.
[32m[I 2023-04-21 02:50:37,449][39m Trial 3995 finished with value: 0.8275862068965518 and parameters: {'objective': 'CrossEntropy', 'colsample_bylevel': 0.07437758535198269, 'depth': 8, 'boosting_type': 'Plain', 'bootstrap_type': 'Bayesian', 'bagging_temperature': 5.273436625323576}. Best is trial 3065 with value: 0.8863636363636364.
[32m[I 2023-04-21 02:50:38,224][39m Trial 3996 finished with value: 0.8539325842696629 and parameters: {'objective': 'CrossEntropy', 'colsample_bylevel': 0.06443524215253718, 'depth': 9, 'boosting_type': 'Plain', 'bootstrap_type': 'Bayesian', 'bagging_temperature': 9.988740162155116}. Best is trial 3065 with value: 0.8863636363636364.
[32m[I 2023-04-21 02:50:39,381][39m Trial 3997 finished with value: 0.8409090909090909 and parameters: {'objective': 'CrossEntropy', 'colsample_bylevel': 0.07382465939676763, 'depth': 8, 'boosting_type': 'Plain', 'bootstrap_type': 'Bayesian', 'bagging_temperature': 9.778749067125231}. Best is trial 3065 with value: 0.8863636363636364.
[32m[I 2023-04-21 02:50:40,109][39m Trial 3998 finished with value: 0.8275862068965518 and parameters: {'objective': 'Logloss', 'colsample_bylevel': 0.07153762825328351, 'depth': 5, 'boosting_type': 'Plain', 'bootstrap_type': 'MVS'}. Best is trial 3065 with value: 0.8863636363636364.
[32m[I 2023-04-21 02:50:41,225][39m Trial 3999 finished with value: 0.8666666666666666 and parameters: {'objective': 'CrossEntropy', 'colsample_bylevel': 0.0790711479440478, 'depth': 3, 'boosting_type': 'Plain', 'bootstrap_type': 'Bayesian', 'bagging_temperature': 9.497881983260356}. Best is trial 3065 with value: 0.8863636363636364.
[32m[I 2023-04-21 02:50:42,721][39m Trial 4000 finished with value: 0.8275862068965518 and parameters: {'objective': 'CrossEntropy', 'colsample_bylevel': 0.08296493373236614, 'depth': 4, 'boosting_type': 'Plain', 'bootstrap_type': 'Bayesian', 'bagging_temperature': 8.556005633109258}. Best is trial 3065 with value: 0.8863636363636364.
[32m[I 2023-04-21 02:50:43,908][39m Trial 4001 finished with value: 0.8666666666666666 and parameters: {'objective': 'CrossEntropy', 'colsample_bylevel': 0.07785046185385144, 'depth': 3, 'boosting_type': 'Plain', 'bootstrap_type': 'Bayesian', 'bagging_temperature': 9.84738252858471}. Best is trial 3065 with value: 0.8863636363636364.
[32m[I 2023-04-21 02:50:44,885][39m Trial 4002 finished with value: 0.8539325842696629 and parameters: {'objective': 'CrossEntropy', 'colsample_bylevel': 0.0735297049174314, 'depth': 8, 'boosting_type': 'Plain', 'bootstrap_type': 'Bayesian', 'bagging_temperature': 9.697311452015816}. Best is trial 3065 with value: 0.8863636363636364.
[32m[I 2023-04-21 02:50:45,651][39m Trial 4003 finished with value: 0.8539325842696629 and parameters: {'objective': 'CrossEntropy', 'colsample_bylevel': 0.07854516668645327, 'depth': 10, 'boosting_type': 'Plain', 'bootstrap_type': 'Bayesian', 'bagging_temperature': 9.823862457835164}. Best is trial 3065 with value: 0.8863636363636364.
[32m[I 2023-04-21 02:50:46,335][39m Trial 4004 finished with value: 0.8666666666666666 and parameters: {'objective': 'CrossEntropy', 'colsample_bylevel': 0.08719033379668112, 'depth': 3, 'boosting_type': 'Plain', 'bootstrap_type': 'Bayesian', 'bagging_temperature': 9.412776584702794}. Best is trial 3065 with value: 0.8863636363636364.
[32m[I 2023-04-21 02:50:46,972][39m Trial 4005 finished with value: 0.8409090909090909 and parameters: {'objective': 'Logloss', 'colsample_bylevel': 0.06642200868968752, 'depth': 5, 'boosting_type': 'Plain', 'bootstrap_type': 'MVS'}. Best is trial 3065 with value: 0.8863636363636364.
[32m[I 2023-04-21 02:50:52,128][39m Trial 4006 finished with value: 0.8139534883720929 and parameters: {'objective': 'CrossEntropy', 'colsample_bylevel': 0.08098926236062887, 'depth': 3, 'boosting_type': 'Ordered', 'bootstrap_type': 'Bayesian', 'bagging_temperature': 8.441015127036911}. Best is trial 3065 with value: 0.8863636363636364.
[32m[I 2023-04-21 02:50:53,534][39m Trial 4007 finished with value: 0.8275862068965518 and parameters: {'objective': 'CrossEntropy', 'colsample_bylevel': 0.07628407660428678, 'depth': 8, 'boosting_type': 'Plain', 'bootstrap_type': 'Bayesian', 'bagging_temperature': 9.032619607263573}. Best is trial 3065 with value: 0.8863636363636364.
[32m[I 2023-04-21 02:50:54,210][39m Trial 4008 finished with value: 0.8666666666666666 and parameters: {'objective': 'Logloss', 'colsample_bylevel': 0.0775562892512136, 'depth': 5, 'boosting_type': 'Plain', 'bootstrap_type': 'Bernoulli', 'subsample': 0.9800873770559845}. Best is trial 3065 with value: 0.8863636363636364.
[32m[I 2023-04-21 02:50:55,596][39m Trial 4009 finished with value: 0.8539325842696629 and parameters: {'objective': 'CrossEntropy', 'colsample_bylevel': 0.0741627685479481, 'depth': 7, 'boosting_type': 'Plain', 'bootstrap_type': 'Bayesian', 'bagging_temperature': 9.779567232533827}. Best is trial 3065 with value: 0.8863636363636364.
[32m[I 2023-04-21 02:50:57,056][39m Trial 4010 finished with value: 0.8409090909090909 and parameters: {'objective': 'CrossEntropy', 'colsample_bylevel': 0.07488787636312842, 'depth': 9, 'boosting_type': 'Plain', 'bootstrap_type': 'Bayesian', 'bagging_temperature': 9.384572924809017}. Best is trial 3065 with value: 0.8863636363636364.
[32m[I 2023-04-21 02:50:58,593][39m Trial 4011 finished with value: 0.8409090909090909 and parameters: {'objective': 'CrossEntropy', 'colsample_bylevel': 0.07979398587205853, 'depth': 9, 'boosting_type': 'Plain', 'bootstrap_type': 'Bayesian', 'bagging_temperature': 9.639526214941233}. Best is trial 3065 with value: 0.8863636363636364.
[32m[I 2023-04-21 02:50:59,254][39m Trial 4012 finished with value: 0.8409090909090909 and parameters: {'objective': 'CrossEntropy', 'colsample_bylevel': 0.07514427109165477, 'depth': 10, 'boosting_type': 'Plain', 'bootstrap_type': 'Bayesian', 'bagging_temperature': 8.603561169397002}. Best is trial 3065 with value: 0.8863636363636364.
[32m[I 2023-04-21 02:51:00,222][39m Trial 4013 finished with value: 0.8409090909090909 and parameters: {'objective': 'CrossEntropy', 'colsample_bylevel': 0.07608650619047937, 'depth': 11, 'boosting_type': 'Plain', 'bootstrap_type': 'Bayesian', 'bagging_temperature': 9.624392674470322}. Best is trial 3065 with value: 0.8863636363636364.
[32m[I 2023-04-21 02:51:01,139][39m Trial 4014 finished with value: 0.8764044943820225 and parameters: {'objective': 'CrossEntropy', 'colsample_bylevel': 0.07997077890325643, 'depth': 2, 'boosting_type': 'Plain', 'bootstrap_type': 'Bayesian', 'bagging_temperature': 9.244439523352357}. Best is trial 3065 with value: 0.8863636363636364.
[32m[I 2023-04-21 02:51:01,801][39m Trial 4015 finished with value: 0.8539325842696629 and parameters: {'objective': 'CrossEntropy', 'colsample_bylevel': 0.08309437456601552, 'depth': 3, 'boosting_type': 'Plain', 'bootstrap_type': 'Bayesian', 'bagging_temperature': 8.95531590432954}. Best is trial 3065 with value: 0.8863636363636364.
[32m[I 2023-04-21 02:51:02,473][39m Trial 4016 finished with value: 0.8409090909090909 and parameters: {'objective': 'CrossEntropy', 'colsample_bylevel': 0.08805760712373512, 'depth': 6, 'boosting_type': 'Plain', 'bootstrap_type': 'Bayesian', 'bagging_temperature': 9.829926197174732}. Best is trial 3065 with value: 0.8863636363636364.
[32m[I 2023-04-21 02:51:03,745][39m Trial 4017 finished with value: 0.8539325842696629 and parameters: {'objective': 'CrossEntropy', 'colsample_bylevel': 0.07221236874045303, 'depth': 10, 'boosting_type': 'Plain', 'bootstrap_type': 'Bayesian', 'bagging_temperature': 9.372562937315587}. Best is trial 3065 with value: 0.8863636363636364.
[32m[I 2023-04-21 02:51:05,116][39m Trial 4018 finished with value: 0.8409090909090909 and parameters: {'objective': 'CrossEntropy', 'colsample_bylevel': 0.07568323536856968, 'depth': 9, 'boosting_type': 'Plain', 'bootstrap_type': 'Bayesian', 'bagging_temperature': 9.536647688476322}. Best is trial 3065 with value: 0.8863636363636364.
[32m[I 2023-04-21 02:51:06,084][39m Trial 4019 finished with value: 0.8539325842696629 and parameters: {'objective': 'CrossEntropy', 'colsample_bylevel': 0.07918845633276725, 'depth': 3, 'boosting_type': 'Plain', 'bootstrap_type': 'Bayesian', 'bagging_temperature': 9.98577418334667}. Best is trial 3065 with value: 0.8863636363636364.
