[32m[I 2023-04-21 03:15:26,485][39m Trial 5196 finished with value: 0.8764044943820225 and parameters: {'objective': 'CrossEntropy', 'colsample_bylevel': 0.08237279457070938, 'depth': 3, 'boosting_type': 'Plain', 'bootstrap_type': 'Bayesian', 'bagging_temperature': 9.287870635507787}. Best is trial 3065 with value: 0.8863636363636364.
[32m[I 2023-04-21 03:15:27,358][39m Trial 5197 finished with value: 0.8539325842696629 and parameters: {'objective': 'CrossEntropy', 'colsample_bylevel': 0.0766422632022954, 'depth': 3, 'boosting_type': 'Plain', 'bootstrap_type': 'Bayesian', 'bagging_temperature': 9.80123642757051}. Best is trial 3065 with value: 0.8863636363636364.
[32m[I 2023-04-21 03:15:28,613][39m Trial 5198 finished with value: 0.8409090909090909 and parameters: {'objective': 'Logloss', 'colsample_bylevel': 0.07850985711884652, 'depth': 10, 'boosting_type': 'Plain', 'bootstrap_type': 'Bayesian', 'bagging_temperature': 8.999564120176757}. Best is trial 3065 with value: 0.8863636363636364.
[32m[I 2023-04-21 03:15:29,705][39m Trial 5199 finished with value: 0.8539325842696629 and parameters: {'objective': 'CrossEntropy', 'colsample_bylevel': 0.07516412489430394, 'depth': 10, 'boosting_type': 'Plain', 'bootstrap_type': 'Bayesian', 'bagging_temperature': 9.771613619221055}. Best is trial 3065 with value: 0.8863636363636364.
[32m[I 2023-04-21 03:15:31,160][39m Trial 5200 finished with value: 0.8275862068965518 and parameters: {'objective': 'CrossEntropy', 'colsample_bylevel': 0.06917307417811382, 'depth': 8, 'boosting_type': 'Plain', 'bootstrap_type': 'Bernoulli', 'subsample': 0.7491886473681866}. Best is trial 3065 with value: 0.8863636363636364.
[32m[I 2023-04-21 03:15:32,074][39m Trial 5201 finished with value: 0.8539325842696629 and parameters: {'objective': 'CrossEntropy', 'colsample_bylevel': 0.07134434260887282, 'depth': 10, 'boosting_type': 'Plain', 'bootstrap_type': 'Bayesian', 'bagging_temperature': 9.99976705151019}. Best is trial 3065 with value: 0.8863636363636364.
[32m[I 2023-04-21 03:15:32,752][39m Trial 5202 finished with value: 0.8505747126436782 and parameters: {'objective': 'CrossEntropy', 'colsample_bylevel': 0.07375685536878239, 'depth': 12, 'boosting_type': 'Plain', 'bootstrap_type': 'Bayesian', 'bagging_temperature': 9.931780726659014}. Best is trial 3065 with value: 0.8863636363636364.
[32m[I 2023-04-21 03:15:33,451][39m Trial 5203 finished with value: 0.8666666666666666 and parameters: {'objective': 'CrossEntropy', 'colsample_bylevel': 0.06712933030669024, 'depth': 10, 'boosting_type': 'Plain', 'bootstrap_type': 'Bayesian', 'bagging_temperature': 9.680748899339855}. Best is trial 3065 with value: 0.8863636363636364.
[32m[I 2023-04-21 03:15:38,757][39m Trial 5204 finished with value: 0.8409090909090909 and parameters: {'objective': 'Logloss', 'colsample_bylevel': 0.07006889777043132, 'depth': 7, 'boosting_type': 'Ordered', 'bootstrap_type': 'Bayesian', 'bagging_temperature': 9.807726719948729}. Best is trial 3065 with value: 0.8863636363636364.
[32m[I 2023-04-21 03:15:40,044][39m Trial 5205 finished with value: 0.8275862068965518 and parameters: {'objective': 'Logloss', 'colsample_bylevel': 0.09449261259293747, 'depth': 3, 'boosting_type': 'Plain', 'bootstrap_type': 'Bayesian', 'bagging_temperature': 5.391444949332695}. Best is trial 3065 with value: 0.8863636363636364.
[32m[I 2023-04-21 03:15:40,961][39m Trial 5206 finished with value: 0.8539325842696629 and parameters: {'objective': 'CrossEntropy', 'colsample_bylevel': 0.08180305492120427, 'depth': 3, 'boosting_type': 'Plain', 'bootstrap_type': 'Bayesian', 'bagging_temperature': 9.225479517509424}. Best is trial 3065 with value: 0.8863636363636364.
[32m[I 2023-04-21 03:15:41,739][39m Trial 5207 finished with value: 0.8409090909090909 and parameters: {'objective': 'CrossEntropy', 'colsample_bylevel': 0.06939672540022848, 'depth': 6, 'boosting_type': 'Plain', 'bootstrap_type': 'Bayesian', 'bagging_temperature': 9.269714734139281}. Best is trial 3065 with value: 0.8863636363636364.
[32m[I 2023-04-21 03:15:43,155][39m Trial 5208 finished with value: 0.8539325842696629 and parameters: {'objective': 'CrossEntropy', 'colsample_bylevel': 0.07678930573758827, 'depth': 10, 'boosting_type': 'Plain', 'bootstrap_type': 'Bayesian', 'bagging_temperature': 9.83502318609071}. Best is trial 3065 with value: 0.8863636363636364.
[32m[I 2023-04-21 03:15:44,617][39m Trial 5209 finished with value: 0.8666666666666666 and parameters: {'objective': 'CrossEntropy', 'colsample_bylevel': 0.06826093849754752, 'depth': 10, 'boosting_type': 'Plain', 'bootstrap_type': 'Bayesian', 'bagging_temperature': 8.77957586737155}. Best is trial 3065 with value: 0.8863636363636364.
[32m[I 2023-04-21 03:15:45,704][39m Trial 5210 finished with value: 0.8409090909090909 and parameters: {'objective': 'CrossEntropy', 'colsample_bylevel': 0.08609493053441236, 'depth': 9, 'boosting_type': 'Plain', 'bootstrap_type': 'Bayesian', 'bagging_temperature': 9.296365667713006}. Best is trial 3065 with value: 0.8863636363636364.
[32m[I 2023-04-21 03:15:46,595][39m Trial 5211 finished with value: 0.8275862068965518 and parameters: {'objective': 'CrossEntropy', 'colsample_bylevel': 0.08334300112358323, 'depth': 3, 'boosting_type': 'Plain', 'bootstrap_type': 'MVS'}. Best is trial 3065 with value: 0.8863636363636364.
[32m[I 2023-04-21 03:15:47,258][39m Trial 5212 finished with value: 0.8409090909090909 and parameters: {'objective': 'CrossEntropy', 'colsample_bylevel': 0.03365463668128692, 'depth': 10, 'boosting_type': 'Plain', 'bootstrap_type': 'Bayesian', 'bagging_temperature': 9.455813391943932}. Best is trial 3065 with value: 0.8863636363636364.
[32m[I 2023-04-21 03:15:47,978][39m Trial 5213 finished with value: 0.8636363636363636 and parameters: {'objective': 'CrossEntropy', 'colsample_bylevel': 0.0849172537363729, 'depth': 2, 'boosting_type': 'Plain', 'bootstrap_type': 'Bayesian', 'bagging_temperature': 9.498674610306573}. Best is trial 3065 with value: 0.8863636363636364.
[32m[I 2023-04-21 03:15:49,346][39m Trial 5214 finished with value: 0.8539325842696629 and parameters: {'objective': 'Logloss', 'colsample_bylevel': 0.08464379604510748, 'depth': 3, 'boosting_type': 'Plain', 'bootstrap_type': 'Bayesian', 'bagging_temperature': 9.587239657864039}. Best is trial 3065 with value: 0.8863636363636364.
[32m[I 2023-04-21 03:15:50,593][39m Trial 5215 finished with value: 0.8539325842696629 and parameters: {'objective': 'CrossEntropy', 'colsample_bylevel': 0.0744215443363769, 'depth': 10, 'boosting_type': 'Plain', 'bootstrap_type': 'Bayesian', 'bagging_temperature': 9.484866170252893}. Best is trial 3065 with value: 0.8863636363636364.
[32m[I 2023-04-21 03:15:51,509][39m Trial 5216 finished with value: 0.8539325842696629 and parameters: {'objective': 'CrossEntropy', 'colsample_bylevel': 0.07646454388652867, 'depth': 10, 'boosting_type': 'Plain', 'bootstrap_type': 'Bayesian', 'bagging_temperature': 9.426968510443789}. Best is trial 3065 with value: 0.8863636363636364.
[32m[I 2023-04-21 03:15:52,585][39m Trial 5217 finished with value: 0.7816091954022988 and parameters: {'objective': 'CrossEntropy', 'colsample_bylevel': 0.019477081922056633, 'depth': 11, 'boosting_type': 'Plain', 'bootstrap_type': 'Bayesian', 'bagging_temperature': 9.062748352268457}. Best is trial 3065 with value: 0.8863636363636364.
[32m[I 2023-04-21 03:15:53,891][39m Trial 5218 finished with value: 0.8539325842696629 and parameters: {'objective': 'CrossEntropy', 'colsample_bylevel': 0.06920103309612928, 'depth': 9, 'boosting_type': 'Plain', 'bootstrap_type': 'Bayesian', 'bagging_temperature': 9.799336084275735}. Best is trial 3065 with value: 0.8863636363636364.
[32m[I 2023-04-21 03:15:54,540][39m Trial 5219 finished with value: 0.7954545454545454 and parameters: {'objective': 'CrossEntropy', 'colsample_bylevel': 0.02363073249032331, 'depth': 9, 'boosting_type': 'Plain', 'bootstrap_type': 'Bayesian', 'bagging_temperature': 9.816083925066701}. Best is trial 3065 with value: 0.8863636363636364.
[32m[I 2023-04-21 03:15:55,293][39m Trial 5220 finished with value: 0.8409090909090909 and parameters: {'objective': 'CrossEntropy', 'colsample_bylevel': 0.0904327643939889, 'depth': 8, 'boosting_type': 'Plain', 'bootstrap_type': 'Bayesian', 'bagging_temperature': 9.670140145904961}. Best is trial 3065 with value: 0.8863636363636364.
[32m[I 2023-04-21 03:15:56,732][39m Trial 5221 finished with value: 0.8409090909090909 and parameters: {'objective': 'CrossEntropy', 'colsample_bylevel': 0.0960951636000414, 'depth': 3, 'boosting_type': 'Plain', 'bootstrap_type': 'MVS'}. Best is trial 3065 with value: 0.8863636363636364.
[32m[I 2023-04-21 03:16:01,723][39m Trial 5222 finished with value: 0.8666666666666666 and parameters: {'objective': 'CrossEntropy', 'colsample_bylevel': 0.09396280768448632, 'depth': 3, 'boosting_type': 'Ordered', 'bootstrap_type': 'Bayesian', 'bagging_temperature': 9.994825017123645}. Best is trial 3065 with value: 0.8863636363636364.
[32m[I 2023-04-21 03:16:02,706][39m Trial 5223 finished with value: 0.8275862068965518 and parameters: {'objective': 'CrossEntropy', 'colsample_bylevel': 0.0731095400482067, 'depth': 11, 'boosting_type': 'Plain', 'bootstrap_type': 'Bernoulli', 'subsample': 0.9748619701566936}. Best is trial 3065 with value: 0.8863636363636364.
[32m[I 2023-04-21 03:16:03,963][39m Trial 5224 finished with value: 0.8539325842696629 and parameters: {'objective': 'CrossEntropy', 'colsample_bylevel': 0.07987764473947367, 'depth': 3, 'boosting_type': 'Plain', 'bootstrap_type': 'Bayesian', 'bagging_temperature': 8.504698020813596}. Best is trial 3065 with value: 0.8863636363636364.
[32m[I 2023-04-21 03:16:05,067][39m Trial 5225 finished with value: 0.8666666666666666 and parameters: {'objective': 'CrossEntropy', 'colsample_bylevel': 0.09079249937819232, 'depth': 3, 'boosting_type': 'Plain', 'bootstrap_type': 'Bayesian', 'bagging_temperature': 8.708964273346261}. Best is trial 3065 with value: 0.8863636363636364.
[32m[I 2023-04-21 03:16:05,809][39m Trial 5226 finished with value: 0.8275862068965518 and parameters: {'objective': 'CrossEntropy', 'colsample_bylevel': 0.0780166575989808, 'depth': 4, 'boosting_type': 'Plain', 'bootstrap_type': 'Bayesian', 'bagging_temperature': 4.639603329624467}. Best is trial 3065 with value: 0.8863636363636364.
[32m[I 2023-04-21 03:16:07,017][39m Trial 5227 finished with value: 0.8275862068965518 and parameters: {'objective': 'CrossEntropy', 'colsample_bylevel': 0.07905943432649906, 'depth': 3, 'boosting_type': 'Plain', 'bootstrap_type': 'Bayesian', 'bagging_temperature': 9.063821167491342}. Best is trial 3065 with value: 0.8863636363636364.
[32m[I 2023-04-21 03:16:08,374][39m Trial 5228 finished with value: 0.8372093023255814 and parameters: {'objective': 'Logloss', 'colsample_bylevel': 0.08336605992804495, 'depth': 9, 'boosting_type': 'Plain', 'bootstrap_type': 'Bayesian', 'bagging_temperature': 9.602005670527632}. Best is trial 3065 with value: 0.8863636363636364.
[32m[I 2023-04-21 03:16:09,320][39m Trial 5229 finished with value: 0.8666666666666666 and parameters: {'objective': 'Logloss', 'colsample_bylevel': 0.08830847587059275, 'depth': 3, 'boosting_type': 'Plain', 'bootstrap_type': 'Bayesian', 'bagging_temperature': 9.776671200813714}. Best is trial 3065 with value: 0.8863636363636364.
[32m[I 2023-04-21 03:16:10,287][39m Trial 5230 finished with value: 0.8409090909090909 and parameters: {'objective': 'CrossEntropy', 'colsample_bylevel': 0.08206151479093644, 'depth': 10, 'boosting_type': 'Plain', 'bootstrap_type': 'Bayesian', 'bagging_temperature': 8.871113248210602}. Best is trial 3065 with value: 0.8863636363636364.
[32m[I 2023-04-21 03:16:11,757][39m Trial 5231 finished with value: 0.8636363636363636 and parameters: {'objective': 'CrossEntropy', 'colsample_bylevel': 0.08074354142056257, 'depth': 9, 'boosting_type': 'Plain', 'bootstrap_type': 'Bayesian', 'bagging_temperature': 9.388313241212478}. Best is trial 3065 with value: 0.8863636363636364.
[32m[I 2023-04-21 03:16:12,580][39m Trial 5232 finished with value: 0.8409090909090909 and parameters: {'objective': 'CrossEntropy', 'colsample_bylevel': 0.08063456160366081, 'depth': 10, 'boosting_type': 'Plain', 'bootstrap_type': 'Bayesian', 'bagging_temperature': 8.962205264334186}. Best is trial 3065 with value: 0.8863636363636364.
[32m[I 2023-04-21 03:16:13,584][39m Trial 5233 finished with value: 0.8275862068965518 and parameters: {'objective': 'CrossEntropy', 'colsample_bylevel': 0.08010913676209905, 'depth': 11, 'boosting_type': 'Plain', 'bootstrap_type': 'Bayesian', 'bagging_temperature': 9.090345832539153}. Best is trial 3065 with value: 0.8863636363636364.
[32m[I 2023-04-21 03:16:14,732][39m Trial 5234 finished with value: 0.8666666666666666 and parameters: {'objective': 'CrossEntropy', 'colsample_bylevel': 0.08812814233044682, 'depth': 3, 'boosting_type': 'Plain', 'bootstrap_type': 'Bayesian', 'bagging_temperature': 8.724328051137645}. Best is trial 3065 with value: 0.8863636363636364.
[32m[I 2023-04-21 03:16:15,874][39m Trial 5235 finished with value: 0.8505747126436782 and parameters: {'objective': 'CrossEntropy', 'colsample_bylevel': 0.08325173437551717, 'depth': 10, 'boosting_type': 'Plain', 'bootstrap_type': 'Bayesian', 'bagging_temperature': 9.169922986149816}. Best is trial 3065 with value: 0.8863636363636364.
[32m[I 2023-04-21 03:16:17,244][39m Trial 5236 finished with value: 0.8666666666666666 and parameters: {'objective': 'CrossEntropy', 'colsample_bylevel': 0.04864721281653441, 'depth': 7, 'boosting_type': 'Plain', 'bootstrap_type': 'Bayesian', 'bagging_temperature': 6.299630559199847}. Best is trial 3065 with value: 0.8863636363636364.
[32m[I 2023-04-21 03:16:18,611][39m Trial 5237 finished with value: 0.8260869565217392 and parameters: {'objective': 'Logloss', 'colsample_bylevel': 0.062411375261658145, 'depth': 4, 'boosting_type': 'Plain', 'bootstrap_type': 'MVS'}. Best is trial 3065 with value: 0.8863636363636364.
[32m[I 2023-04-21 03:16:19,326][39m Trial 5238 finished with value: 0.8409090909090909 and parameters: {'objective': 'CrossEntropy', 'colsample_bylevel': 0.08581461762192208, 'depth': 4, 'boosting_type': 'Plain', 'bootstrap_type': 'Bayesian', 'bagging_temperature': 9.570589767644814}. Best is trial 3065 with value: 0.8863636363636364.
[32m[I 2023-04-21 03:16:20,015][39m Trial 5239 finished with value: 0.8764044943820225 and parameters: {'objective': 'CrossEntropy', 'colsample_bylevel': 0.09043829373986331, 'depth': 2, 'boosting_type': 'Plain', 'bootstrap_type': 'Bayesian', 'bagging_temperature': 9.772321903623439}. Best is trial 3065 with value: 0.8863636363636364.
[32m[I 2023-04-21 03:16:21,166][39m Trial 5240 finished with value: 0.8666666666666666 and parameters: {'objective': 'CrossEntropy', 'colsample_bylevel': 0.06933985316134467, 'depth': 12, 'boosting_type': 'Plain', 'bootstrap_type': 'Bayesian', 'bagging_temperature': 8.938974387005356}. Best is trial 3065 with value: 0.8863636363636364.
[32m[I 2023-04-21 03:16:22,366][39m Trial 5241 finished with value: 0.8505747126436782 and parameters: {'objective': 'CrossEntropy', 'colsample_bylevel': 0.09818022281583322, 'depth': 11, 'boosting_type': 'Plain', 'bootstrap_type': 'Bayesian', 'bagging_temperature': 9.467096154213218}. Best is trial 3065 with value: 0.8863636363636364.
[32m[I 2023-04-21 03:16:27,228][39m Trial 5242 finished with value: 0.8139534883720929 and parameters: {'objective': 'CrossEntropy', 'colsample_bylevel': 0.08407364402507018, 'depth': 9, 'boosting_type': 'Ordered', 'bootstrap_type': 'Bayesian', 'bagging_temperature': 9.488269602285039}. Best is trial 3065 with value: 0.8863636363636364.
[32m[I 2023-04-21 03:16:28,724][39m Trial 5243 finished with value: 0.8095238095238095 and parameters: {'objective': 'CrossEntropy', 'colsample_bylevel': 0.07706756272742793, 'depth': 10, 'boosting_type': 'Plain', 'bootstrap_type': 'MVS'}. Best is trial 3065 with value: 0.8863636363636364.
[32m[I 2023-04-21 03:16:29,964][39m Trial 5244 finished with value: 0.8666666666666666 and parameters: {'objective': 'Logloss', 'colsample_bylevel': 0.07585512651397065, 'depth': 9, 'boosting_type': 'Plain', 'bootstrap_type': 'Bayesian', 'bagging_temperature': 9.418131482915589}. Best is trial 3065 with value: 0.8863636363636364.
[32m[I 2023-04-21 03:16:31,155][39m Trial 5245 finished with value: 0.8539325842696629 and parameters: {'objective': 'CrossEntropy', 'colsample_bylevel': 0.08312521083228215, 'depth': 3, 'boosting_type': 'Plain', 'bootstrap_type': 'Bayesian', 'bagging_temperature': 9.03037392424359}. Best is trial 3065 with value: 0.8863636363636364.
[32m[I 2023-04-21 03:16:32,597][39m Trial 5246 finished with value: 0.8139534883720929 and parameters: {'objective': 'Logloss', 'colsample_bylevel': 0.09030792235760308, 'depth': 3, 'boosting_type': 'Plain', 'bootstrap_type': 'Bernoulli', 'subsample': 0.6955257825348674}. Best is trial 3065 with value: 0.8863636363636364.
[32m[I 2023-04-21 03:16:33,279][39m Trial 5247 finished with value: 0.8539325842696629 and parameters: {'objective': 'Logloss', 'colsample_bylevel': 0.07205453201126592, 'depth': 3, 'boosting_type': 'Plain', 'bootstrap_type': 'Bayesian', 'bagging_temperature': 8.219893181682194}. Best is trial 3065 with value: 0.8863636363636364.
[32m[I 2023-04-21 03:16:33,953][39m Trial 5248 finished with value: 0.8666666666666666 and parameters: {'objective': 'CrossEntropy', 'colsample_bylevel': 0.07390112320111547, 'depth': 11, 'boosting_type': 'Plain', 'bootstrap_type': 'Bayesian', 'bagging_temperature': 8.788216919526864}. Best is trial 3065 with value: 0.8863636363636364.
[32m[I 2023-04-21 03:16:34,628][39m Trial 5249 finished with value: 0.8791208791208791 and parameters: {'objective': 'CrossEntropy', 'colsample_bylevel': 0.07799314998555856, 'depth': 10, 'boosting_type': 'Plain', 'bootstrap_type': 'Bayesian', 'bagging_temperature': 9.659149670980396}. Best is trial 3065 with value: 0.8863636363636364.
[32m[I 2023-04-21 03:16:35,987][39m Trial 5250 finished with value: 0.8539325842696629 and parameters: {'objective': 'Logloss', 'colsample_bylevel': 0.08214565762179267, 'depth': 10, 'boosting_type': 'Plain', 'bootstrap_type': 'Bayesian', 'bagging_temperature': 9.051405506532776}. Best is trial 3065 with value: 0.8863636363636364.
[32m[I 2023-04-21 03:16:37,205][39m Trial 5251 finished with value: 0.8636363636363636 and parameters: {'objective': 'CrossEntropy', 'colsample_bylevel': 0.08050549081538198, 'depth': 2, 'boosting_type': 'Plain', 'bootstrap_type': 'Bayesian', 'bagging_temperature': 8.907661275987152}. Best is trial 3065 with value: 0.8863636363636364.
[32m[I 2023-04-21 03:16:38,393][39m Trial 5252 finished with value: 0.8666666666666666 and parameters: {'objective': 'CrossEntropy', 'colsample_bylevel': 0.08210043866903632, 'depth': 3, 'boosting_type': 'Plain', 'bootstrap_type': 'Bayesian', 'bagging_temperature': 8.979502480849673}. Best is trial 3065 with value: 0.8863636363636364.
[32m[I 2023-04-21 03:16:39,696][39m Trial 5253 finished with value: 0.8539325842696629 and parameters: {'objective': 'CrossEntropy', 'colsample_bylevel': 0.07362065166504678, 'depth': 11, 'boosting_type': 'Plain', 'bootstrap_type': 'Bayesian', 'bagging_temperature': 8.497869948003629}. Best is trial 3065 with value: 0.8863636363636364.
[32m[I 2023-04-21 03:16:40,445][39m Trial 5254 finished with value: 0.8636363636363636 and parameters: {'objective': 'CrossEntropy', 'colsample_bylevel': 0.0811144653895278, 'depth': 2, 'boosting_type': 'Plain', 'bootstrap_type': 'Bayesian', 'bagging_temperature': 8.866013894221014}. Best is trial 3065 with value: 0.8863636363636364.
[32m[I 2023-04-21 03:16:41,125][39m Trial 5255 finished with value: 0.8539325842696629 and parameters: {'objective': 'CrossEntropy', 'colsample_bylevel': 0.0867561873058772, 'depth': 2, 'boosting_type': 'Plain', 'bootstrap_type': 'Bayesian', 'bagging_temperature': 9.386420078492563}. Best is trial 3065 with value: 0.8863636363636364.
[32m[I 2023-04-21 03:16:42,182][39m Trial 5256 finished with value: 0.8539325842696629 and parameters: {'objective': 'CrossEntropy', 'colsample_bylevel': 0.08901038737355761, 'depth': 3, 'boosting_type': 'Plain', 'bootstrap_type': 'MVS'}. Best is trial 3065 with value: 0.8863636363636364.
[32m[I 2023-04-21 03:16:43,621][39m Trial 5257 finished with value: 0.8539325842696629 and parameters: {'objective': 'Logloss', 'colsample_bylevel': 0.08051555450211327, 'depth': 3, 'boosting_type': 'Plain', 'bootstrap_type': 'Bayesian', 'bagging_temperature': 5.772929306289811}. Best is trial 3065 with value: 0.8863636363636364.
[32m[I 2023-04-21 03:16:44,925][39m Trial 5258 finished with value: 0.8539325842696629 and parameters: {'objective': 'CrossEntropy', 'colsample_bylevel': 0.07838997123081179, 'depth': 9, 'boosting_type': 'Plain', 'bootstrap_type': 'Bayesian', 'bagging_temperature': 9.703749589249}. Best is trial 3065 with value: 0.8863636363636364.
[32m[I 2023-04-21 03:16:46,296][39m Trial 5259 finished with value: 0.8505747126436782 and parameters: {'objective': 'CrossEntropy', 'colsample_bylevel': 0.07834512330753349, 'depth': 4, 'boosting_type': 'Plain', 'bootstrap_type': 'Bayesian', 'bagging_temperature': 8.779683887988837}. Best is trial 3065 with value: 0.8863636363636364.
[32m[I 2023-04-21 03:16:47,131][39m Trial 5260 finished with value: 0.8275862068965518 and parameters: {'objective': 'CrossEntropy', 'colsample_bylevel': 0.0885454955994209, 'depth': 1, 'boosting_type': 'Plain', 'bootstrap_type': 'Bayesian', 'bagging_temperature': 3.7568180412537555}. Best is trial 3065 with value: 0.8863636363636364.
