[32m[I 2023-04-21 03:26:35,402][39m Trial 5720 finished with value: 0.8139534883720929 and parameters: {'objective': 'CrossEntropy', 'colsample_bylevel': 0.07281867281597754, 'depth': 10, 'boosting_type': 'Plain', 'bootstrap_type': 'Bayesian', 'bagging_temperature': 9.382263427655115}. Best is trial 3065 with value: 0.8863636363636364.
[32m[I 2023-04-21 03:26:36,228][39m Trial 5721 finished with value: 0.8539325842696629 and parameters: {'objective': 'CrossEntropy', 'colsample_bylevel': 0.08004468474930646, 'depth': 9, 'boosting_type': 'Plain', 'bootstrap_type': 'MVS'}. Best is trial 3065 with value: 0.8863636363636364.
[32m[I 2023-04-21 03:26:37,105][39m Trial 5722 finished with value: 0.8764044943820225 and parameters: {'objective': 'Logloss', 'colsample_bylevel': 0.06130553216038975, 'depth': 6, 'boosting_type': 'Plain', 'bootstrap_type': 'Bayesian', 'bagging_temperature': 9.298515422824812}. Best is trial 3065 with value: 0.8863636363636364.
[32m[I 2023-04-21 03:26:37,796][39m Trial 5723 finished with value: 0.8275862068965518 and parameters: {'objective': 'CrossEntropy', 'colsample_bylevel': 0.06866051460388455, 'depth': 12, 'boosting_type': 'Plain', 'bootstrap_type': 'Bayesian', 'bagging_temperature': 9.855599147196767}. Best is trial 3065 with value: 0.8863636363636364.
[32m[I 2023-04-21 03:26:39,262][39m Trial 5724 finished with value: 0.8791208791208791 and parameters: {'objective': 'CrossEntropy', 'colsample_bylevel': 0.0765234521667802, 'depth': 9, 'boosting_type': 'Plain', 'bootstrap_type': 'Bayesian', 'bagging_temperature': 8.51153031875444}. Best is trial 3065 with value: 0.8863636363636364.
[32m[I 2023-04-21 03:26:40,600][39m Trial 5725 finished with value: 0.8275862068965518 and parameters: {'objective': 'CrossEntropy', 'colsample_bylevel': 0.07536181818820882, 'depth': 4, 'boosting_type': 'Plain', 'bootstrap_type': 'Bayesian', 'bagging_temperature': 8.518737014275851}. Best is trial 3065 with value: 0.8863636363636364.
[32m[I 2023-04-21 03:26:41,877][39m Trial 5726 finished with value: 0.8539325842696629 and parameters: {'objective': 'CrossEntropy', 'colsample_bylevel': 0.0632571217131327, 'depth': 9, 'boosting_type': 'Plain', 'bootstrap_type': 'Bayesian', 'bagging_temperature': 9.589501083564732}. Best is trial 3065 with value: 0.8863636363636364.
[32m[I 2023-04-21 03:26:42,974][39m Trial 5727 finished with value: 0.8409090909090909 and parameters: {'objective': 'Logloss', 'colsample_bylevel': 0.07277899991524486, 'depth': 11, 'boosting_type': 'Plain', 'bootstrap_type': 'Bayesian', 'bagging_temperature': 9.560087083551572}. Best is trial 3065 with value: 0.8863636363636364.
[32m[I 2023-04-21 03:26:43,919][39m Trial 5728 finished with value: 0.8539325842696629 and parameters: {'objective': 'Logloss', 'colsample_bylevel': 0.07040712038844024, 'depth': 12, 'boosting_type': 'Plain', 'bootstrap_type': 'Bayesian', 'bagging_temperature': 9.267050701935736}. Best is trial 3065 with value: 0.8863636363636364.
[32m[I 2023-04-21 03:26:44,620][39m Trial 5729 finished with value: 0.8275862068965518 and parameters: {'objective': 'CrossEntropy', 'colsample_bylevel': 0.08893915726503046, 'depth': 3, 'boosting_type': 'Plain', 'bootstrap_type': 'Bayesian', 'bagging_temperature': 9.997214541985135}. Best is trial 3065 with value: 0.8863636363636364.
[32m[I 2023-04-21 03:26:49,811][39m Trial 5730 finished with value: 0.8275862068965518 and parameters: {'objective': 'CrossEntropy', 'colsample_bylevel': 0.07836630062423827, 'depth': 5, 'boosting_type': 'Ordered', 'bootstrap_type': 'Bayesian', 'bagging_temperature': 8.337470521692737}. Best is trial 3065 with value: 0.8863636363636364.
[32m[I 2023-04-21 03:26:50,912][39m Trial 5731 finished with value: 0.8409090909090909 and parameters: {'objective': 'Logloss', 'colsample_bylevel': 0.09054326492674092, 'depth': 10, 'boosting_type': 'Plain', 'bootstrap_type': 'Bayesian', 'bagging_temperature': 8.516469933751555}. Best is trial 3065 with value: 0.8863636363636364.
[32m[I 2023-04-21 03:26:52,016][39m Trial 5732 finished with value: 0.8539325842696629 and parameters: {'objective': 'Logloss', 'colsample_bylevel': 0.0735893824210379, 'depth': 5, 'boosting_type': 'Plain', 'bootstrap_type': 'Bayesian', 'bagging_temperature': 9.69686165230032}. Best is trial 3065 with value: 0.8863636363636364.
[32m[I 2023-04-21 03:26:53,308][39m Trial 5733 finished with value: 0.8275862068965518 and parameters: {'objective': 'CrossEntropy', 'colsample_bylevel': 0.07121081746156431, 'depth': 11, 'boosting_type': 'Plain', 'bootstrap_type': 'Bayesian', 'bagging_temperature': 7.751027412803823}. Best is trial 3065 with value: 0.8863636363636364.
[32m[I 2023-04-21 03:26:54,376][39m Trial 5734 finished with value: 0.8181818181818182 and parameters: {'objective': 'CrossEntropy', 'colsample_bylevel': 0.08571192508369871, 'depth': 3, 'boosting_type': 'Plain', 'bootstrap_type': 'Bernoulli', 'subsample': 0.31115970149653194}. Best is trial 3065 with value: 0.8863636363636364.
[32m[I 2023-04-21 03:26:55,655][39m Trial 5735 finished with value: 0.8791208791208791 and parameters: {'objective': 'CrossEntropy', 'colsample_bylevel': 0.06538090385619146, 'depth': 9, 'boosting_type': 'Plain', 'bootstrap_type': 'Bayesian', 'bagging_temperature': 9.797138247860007}. Best is trial 3065 with value: 0.8863636363636364.
[32m[I 2023-04-21 03:26:56,863][39m Trial 5736 finished with value: 0.8666666666666666 and parameters: {'objective': 'CrossEntropy', 'colsample_bylevel': 0.09375674119931647, 'depth': 3, 'boosting_type': 'Plain', 'bootstrap_type': 'Bayesian', 'bagging_temperature': 9.42974387249545}. Best is trial 3065 with value: 0.8863636363636364.
[32m[I 2023-04-21 03:26:57,786][39m Trial 5737 finished with value: 0.8539325842696629 and parameters: {'objective': 'Logloss', 'colsample_bylevel': 0.07615507634379912, 'depth': 8, 'boosting_type': 'Plain', 'bootstrap_type': 'Bayesian', 'bagging_temperature': 9.474823479485375}. Best is trial 3065 with value: 0.8863636363636364.
[32m[I 2023-04-21 03:26:58,594][39m Trial 5738 finished with value: 0.8409090909090909 and parameters: {'objective': 'CrossEntropy', 'colsample_bylevel': 0.07696774786623561, 'depth': 4, 'boosting_type': 'Plain', 'bootstrap_type': 'Bayesian', 'bagging_temperature': 9.492942349947096}. Best is trial 3065 with value: 0.8863636363636364.
[32m[I 2023-04-21 03:26:59,680][39m Trial 5739 finished with value: 0.8275862068965518 and parameters: {'objective': 'Logloss', 'colsample_bylevel': 0.07820048205772867, 'depth': 12, 'boosting_type': 'Plain', 'bootstrap_type': 'MVS'}. Best is trial 3065 with value: 0.8863636363636364.
[32m[I 2023-04-21 03:27:00,430][39m Trial 5740 finished with value: 0.8764044943820225 and parameters: {'objective': 'CrossEntropy', 'colsample_bylevel': 0.08644479443708729, 'depth': 2, 'boosting_type': 'Plain', 'bootstrap_type': 'Bayesian', 'bagging_temperature': 9.636805258881628}. Best is trial 3065 with value: 0.8863636363636364.
[32m[I 2023-04-21 03:27:01,554][39m Trial 5741 finished with value: 0.8666666666666666 and parameters: {'objective': 'CrossEntropy', 'colsample_bylevel': 0.07208956306696611, 'depth': 12, 'boosting_type': 'Plain', 'bootstrap_type': 'Bayesian', 'bagging_temperature': 9.541738379689502}. Best is trial 3065 with value: 0.8863636363636364.
[32m[I 2023-04-21 03:27:02,488][39m Trial 5742 finished with value: 0.8666666666666666 and parameters: {'objective': 'Logloss', 'colsample_bylevel': 0.09118970491601985, 'depth': 3, 'boosting_type': 'Plain', 'bootstrap_type': 'Bayesian', 'bagging_temperature': 9.708212713767423}. Best is trial 3065 with value: 0.8863636363636364.
[32m[I 2023-04-21 03:27:03,731][39m Trial 5743 finished with value: 0.8539325842696629 and parameters: {'objective': 'Logloss', 'colsample_bylevel': 0.0694354949378475, 'depth': 7, 'boosting_type': 'Plain', 'bootstrap_type': 'Bayesian', 'bagging_temperature': 7.640541604703782}. Best is trial 3065 with value: 0.8863636363636364.
[32m[I 2023-04-21 03:27:04,864][39m Trial 5744 finished with value: 0.8666666666666666 and parameters: {'objective': 'CrossEntropy', 'colsample_bylevel': 0.08922953253556656, 'depth': 3, 'boosting_type': 'Plain', 'bootstrap_type': 'Bayesian', 'bagging_temperature': 8.184354567939188}. Best is trial 3065 with value: 0.8863636363636364.
[32m[I 2023-04-21 03:27:06,041][39m Trial 5745 finished with value: 0.8470588235294119 and parameters: {'objective': 'CrossEntropy', 'colsample_bylevel': 0.04387914347505028, 'depth': 2, 'boosting_type': 'Plain', 'bootstrap_type': 'Bayesian', 'bagging_temperature': 5.722562270998765}. Best is trial 3065 with value: 0.8863636363636364.
[32m[I 2023-04-21 03:27:07,267][39m Trial 5746 finished with value: 0.8539325842696629 and parameters: {'objective': 'CrossEntropy', 'colsample_bylevel': 0.07938305696029722, 'depth': 10, 'boosting_type': 'Plain', 'bootstrap_type': 'Bayesian', 'bagging_temperature': 8.418173297541458}. Best is trial 3065 with value: 0.8863636363636364.
[32m[I 2023-04-21 03:27:08,638][39m Trial 5747 finished with value: 0.8666666666666666 and parameters: {'objective': 'CrossEntropy', 'colsample_bylevel': 0.06740605021341933, 'depth': 10, 'boosting_type': 'Plain', 'bootstrap_type': 'Bayesian', 'bagging_temperature': 9.542257727583696}. Best is trial 3065 with value: 0.8863636363636364.
[32m[I 2023-04-21 03:27:09,684][39m Trial 5748 finished with value: 0.8666666666666666 and parameters: {'objective': 'CrossEntropy', 'colsample_bylevel': 0.08790499124373774, 'depth': 3, 'boosting_type': 'Plain', 'bootstrap_type': 'Bayesian', 'bagging_temperature': 9.812762084888847}. Best is trial 3065 with value: 0.8863636363636364.
[32m[I 2023-04-21 03:27:14,188][39m Trial 5749 finished with value: 0.8409090909090909 and parameters: {'objective': 'CrossEntropy', 'colsample_bylevel': 0.07436529167066316, 'depth': 11, 'boosting_type': 'Ordered', 'bootstrap_type': 'Bayesian', 'bagging_temperature': 9.391360927789043}. Best is trial 3065 with value: 0.8863636363636364.
[32m[I 2023-04-21 03:27:15,695][39m Trial 5750 finished with value: 0.8764044943820225 and parameters: {'objective': 'CrossEntropy', 'colsample_bylevel': 0.0802249083465913, 'depth': 2, 'boosting_type': 'Plain', 'bootstrap_type': 'Bayesian', 'bagging_temperature': 9.555748840385125}. Best is trial 3065 with value: 0.8863636363636364.
[32m[I 2023-04-21 03:27:16,743][39m Trial 5751 finished with value: 0.8275862068965518 and parameters: {'objective': 'CrossEntropy', 'colsample_bylevel': 0.07945476076124579, 'depth': 3, 'boosting_type': 'Plain', 'bootstrap_type': 'Bayesian', 'bagging_temperature': 0.9412989910243725}. Best is trial 3065 with value: 0.8863636363636364.
[32m[I 2023-04-21 03:27:17,568][39m Trial 5752 finished with value: 0.8666666666666666 and parameters: {'objective': 'Logloss', 'colsample_bylevel': 0.06899187124925206, 'depth': 10, 'boosting_type': 'Plain', 'bootstrap_type': 'Bayesian', 'bagging_temperature': 9.342613685035273}. Best is trial 3065 with value: 0.8863636363636364.
[32m[I 2023-04-21 03:27:18,423][39m Trial 5753 finished with value: 0.8666666666666666 and parameters: {'objective': 'CrossEntropy', 'colsample_bylevel': 0.06865477303228375, 'depth': 7, 'boosting_type': 'Plain', 'bootstrap_type': 'Bayesian', 'bagging_temperature': 9.011830693582642}. Best is trial 3065 with value: 0.8863636363636364.
[32m[I 2023-04-21 03:27:19,426][39m Trial 5754 finished with value: 0.8470588235294119 and parameters: {'objective': 'CrossEntropy', 'colsample_bylevel': 0.07716761587366204, 'depth': 12, 'boosting_type': 'Plain', 'bootstrap_type': 'MVS'}. Best is trial 3065 with value: 0.8863636363636364.
[32m[I 2023-04-21 03:27:20,903][39m Trial 5755 finished with value: 0.8666666666666666 and parameters: {'objective': 'CrossEntropy', 'colsample_bylevel': 0.08939823286055561, 'depth': 2, 'boosting_type': 'Plain', 'bootstrap_type': 'Bayesian', 'bagging_temperature': 9.655345468884057}. Best is trial 3065 with value: 0.8863636363636364.
[32m[I 2023-04-21 03:27:22,215][39m Trial 5756 finished with value: 0.8666666666666666 and parameters: {'objective': 'CrossEntropy', 'colsample_bylevel': 0.07621115782048431, 'depth': 10, 'boosting_type': 'Plain', 'bootstrap_type': 'Bayesian', 'bagging_temperature': 9.709399285524992}. Best is trial 3065 with value: 0.8863636363636364.
[32m[I 2023-04-21 03:27:23,316][39m Trial 5757 finished with value: 0.8275862068965518 and parameters: {'objective': 'Logloss', 'colsample_bylevel': 0.0855379429218756, 'depth': 11, 'boosting_type': 'Plain', 'bootstrap_type': 'Bayesian', 'bagging_temperature': 9.632257799346538}. Best is trial 3065 with value: 0.8863636363636364.
[32m[I 2023-04-21 03:27:24,404][39m Trial 5758 finished with value: 0.8409090909090909 and parameters: {'objective': 'Logloss', 'colsample_bylevel': 0.07611872620528681, 'depth': 10, 'boosting_type': 'Plain', 'bootstrap_type': 'Bayesian', 'bagging_temperature': 8.284532714362227}. Best is trial 3065 with value: 0.8863636363636364.
[32m[I 2023-04-21 03:27:25,135][39m Trial 5759 finished with value: 0.8539325842696629 and parameters: {'objective': 'CrossEntropy', 'colsample_bylevel': 0.08671064775521055, 'depth': 3, 'boosting_type': 'Plain', 'bootstrap_type': 'Bayesian', 'bagging_temperature': 8.17380450793973}. Best is trial 3065 with value: 0.8863636363636364.
[32m[I 2023-04-21 03:27:25,929][39m Trial 5760 finished with value: 0.8409090909090909 and parameters: {'objective': 'CrossEntropy', 'colsample_bylevel': 0.07390443001657496, 'depth': 8, 'boosting_type': 'Plain', 'bootstrap_type': 'Bayesian', 'bagging_temperature': 9.980991150443666}. Best is trial 3065 with value: 0.8863636363636364.
[32m[I 2023-04-21 03:27:26,802][39m Trial 5761 finished with value: 0.8139534883720929 and parameters: {'objective': 'CrossEntropy', 'colsample_bylevel': 0.0729091298327443, 'depth': 12, 'boosting_type': 'Plain', 'bootstrap_type': 'Bayesian', 'bagging_temperature': 9.34313928893052}. Best is trial 3065 with value: 0.8863636363636364.
[32m[I 2023-04-21 03:27:27,473][39m Trial 5762 finished with value: 0.8409090909090909 and parameters: {'objective': 'CrossEntropy', 'colsample_bylevel': 0.0778497808431952, 'depth': 3, 'boosting_type': 'Plain', 'bootstrap_type': 'MVS'}. Best is trial 3065 with value: 0.8863636363636364.
[32m[I 2023-04-21 03:27:28,499][39m Trial 5763 finished with value: 0.8409090909090909 and parameters: {'objective': 'CrossEntropy', 'colsample_bylevel': 0.07511676468344239, 'depth': 10, 'boosting_type': 'Plain', 'bootstrap_type': 'Bayesian', 'bagging_temperature': 8.424675924771071}. Best is trial 3065 with value: 0.8863636363636364.
[32m[I 2023-04-21 03:27:30,011][39m Trial 5764 finished with value: 0.8666666666666666 and parameters: {'objective': 'CrossEntropy', 'colsample_bylevel': 0.07799309719881226, 'depth': 10, 'boosting_type': 'Plain', 'bootstrap_type': 'Bayesian', 'bagging_temperature': 9.301044629287567}. Best is trial 3065 with value: 0.8863636363636364.
[32m[I 2023-04-21 03:27:31,055][39m Trial 5765 finished with value: 0.8139534883720929 and parameters: {'objective': 'Logloss', 'colsample_bylevel': 0.08060130742270638, 'depth': 10, 'boosting_type': 'Plain', 'bootstrap_type': 'Bayesian', 'bagging_temperature': 9.177233648584835}. Best is trial 3065 with value: 0.8863636363636364.
[32m[I 2023-04-21 03:27:32,165][39m Trial 5766 finished with value: 0.8666666666666666 and parameters: {'objective': 'Logloss', 'colsample_bylevel': 0.07502970301734727, 'depth': 4, 'boosting_type': 'Plain', 'bootstrap_type': 'Bayesian', 'bagging_temperature': 8.929769724786679}. Best is trial 3065 with value: 0.8863636363636364.
[32m[I 2023-04-21 03:27:33,082][39m Trial 5767 finished with value: 0.8666666666666666 and parameters: {'objective': 'CrossEntropy', 'colsample_bylevel': 0.08284410044729959, 'depth': 3, 'boosting_type': 'Plain', 'bootstrap_type': 'Bayesian', 'bagging_temperature': 9.163964041463917}. Best is trial 3065 with value: 0.8863636363636364.
[32m[I 2023-04-21 03:27:37,886][39m Trial 5768 finished with value: 0.8409090909090909 and parameters: {'objective': 'CrossEntropy', 'colsample_bylevel': 0.07615789662304688, 'depth': 4, 'boosting_type': 'Ordered', 'bootstrap_type': 'Bayesian', 'bagging_temperature': 9.173699772513134}. Best is trial 3065 with value: 0.8863636363636364.
[32m[I 2023-04-21 03:27:39,230][39m Trial 5769 finished with value: 0.8409090909090909 and parameters: {'objective': 'Logloss', 'colsample_bylevel': 0.06628432717807158, 'depth': 7, 'boosting_type': 'Plain', 'bootstrap_type': 'Bayesian', 'bagging_temperature': 9.270903122560906}. Best is trial 3065 with value: 0.8863636363636364.
[32m[I 2023-04-21 03:27:40,270][39m Trial 5770 finished with value: 0.8409090909090909 and parameters: {'objective': 'CrossEntropy', 'colsample_bylevel': 0.07096265749875198, 'depth': 8, 'boosting_type': 'Plain', 'bootstrap_type': 'Bayesian', 'bagging_temperature': 9.13902166192541}. Best is trial 3065 with value: 0.8863636363636364.
[32m[I 2023-04-21 03:27:41,014][39m Trial 5771 finished with value: 0.8409090909090909 and parameters: {'objective': 'CrossEntropy', 'colsample_bylevel': 0.06794603137446709, 'depth': 10, 'boosting_type': 'Plain', 'bootstrap_type': 'Bayesian', 'bagging_temperature': 9.231242585221581}. Best is trial 3065 with value: 0.8863636363636364.
[32m[I 2023-04-21 03:27:41,895][39m Trial 5772 finished with value: 0.8409090909090909 and parameters: {'objective': 'CrossEntropy', 'colsample_bylevel': 0.09063708084402256, 'depth': 3, 'boosting_type': 'Plain', 'bootstrap_type': 'Bayesian', 'bagging_temperature': 9.756572972348964}. Best is trial 3065 with value: 0.8863636363636364.
[32m[I 2023-04-21 03:27:42,813][39m Trial 5773 finished with value: 0.8666666666666666 and parameters: {'objective': 'Logloss', 'colsample_bylevel': 0.07651578690033972, 'depth': 11, 'boosting_type': 'Plain', 'bootstrap_type': 'Bayesian', 'bagging_temperature': 9.775224407186458}. Best is trial 3065 with value: 0.8863636363636364.
[32m[I 2023-04-21 03:27:43,849][39m Trial 5774 finished with value: 0.8409090909090909 and parameters: {'objective': 'CrossEntropy', 'colsample_bylevel': 0.07962711816731396, 'depth': 4, 'boosting_type': 'Plain', 'bootstrap_type': 'Bayesian', 'bagging_temperature': 8.632257624204804}. Best is trial 3065 with value: 0.8863636363636364.
[32m[I 2023-04-21 03:27:45,297][39m Trial 5775 finished with value: 0.8505747126436782 and parameters: {'objective': 'CrossEntropy', 'colsample_bylevel': 0.08345831327175025, 'depth': 12, 'boosting_type': 'Plain', 'bootstrap_type': 'Bayesian', 'bagging_temperature': 8.846605397608851}. Best is trial 3065 with value: 0.8863636363636364.
[32m[I 2023-04-21 03:27:46,309][39m Trial 5776 finished with value: 0.8666666666666666 and parameters: {'objective': 'CrossEntropy', 'colsample_bylevel': 0.0686838403622471, 'depth': 12, 'boosting_type': 'Plain', 'bootstrap_type': 'Bayesian', 'bagging_temperature': 9.626618156749142}. Best is trial 3065 with value: 0.8863636363636364.
[32m[I 2023-04-21 03:27:47,402][39m Trial 5777 finished with value: 0.8409090909090909 and parameters: {'objective': 'CrossEntropy', 'colsample_bylevel': 0.07970137422250771, 'depth': 3, 'boosting_type': 'Plain', 'bootstrap_type': 'MVS'}. Best is trial 3065 with value: 0.8863636363636364.
[32m[I 2023-04-21 03:27:48,480][39m Trial 5778 finished with value: 0.8275862068965518 and parameters: {'objective': 'CrossEntropy', 'colsample_bylevel': 0.09134419243142257, 'depth': 3, 'boosting_type': 'Plain', 'bootstrap_type': 'Bayesian', 'bagging_temperature': 9.812652210060163}. Best is trial 3065 with value: 0.8863636363636364.
[32m[I 2023-04-21 03:27:49,232][39m Trial 5779 finished with value: 0.8666666666666666 and parameters: {'objective': 'Logloss', 'colsample_bylevel': 0.09210856862423722, 'depth': 3, 'boosting_type': 'Plain', 'bootstrap_type': 'Bayesian', 'bagging_temperature': 8.302931257785856}. Best is trial 3065 with value: 0.8863636363636364.
[32m[I 2023-04-21 03:27:50,356][39m Trial 5780 finished with value: 0.8666666666666666 and parameters: {'objective': 'Logloss', 'colsample_bylevel': 0.09181550057815853, 'depth': 3, 'boosting_type': 'Plain', 'bootstrap_type': 'Bayesian', 'bagging_temperature': 8.597812712310736}. Best is trial 3065 with value: 0.8863636363636364.
[32m[I 2023-04-21 03:27:51,656][39m Trial 5781 finished with value: 0.8764044943820225 and parameters: {'objective': 'CrossEntropy', 'colsample_bylevel': 0.07987026726221556, 'depth': 2, 'boosting_type': 'Plain', 'bootstrap_type': 'Bayesian', 'bagging_temperature': 9.577272424194625}. Best is trial 3065 with value: 0.8863636363636364.
[32m[I 2023-04-21 03:27:52,871][39m Trial 5782 finished with value: 0.8666666666666666 and parameters: {'objective': 'CrossEntropy', 'colsample_bylevel': 0.07839698786691668, 'depth': 3, 'boosting_type': 'Plain', 'bootstrap_type': 'Bayesian', 'bagging_temperature': 9.42867839525642}. Best is trial 3065 with value: 0.8863636363636364.
[32m[I 2023-04-21 03:27:53,947][39m Trial 5783 finished with value: 0.8275862068965518 and parameters: {'objective': 'CrossEntropy', 'colsample_bylevel': 0.08724631112316875, 'depth': 3, 'boosting_type': 'Plain', 'bootstrap_type': 'Bayesian', 'bagging_temperature': 4.073357284825203}. Best is trial 3065 with value: 0.8863636363636364.
[32m[I 2023-04-21 03:27:58,799][39m Trial 5784 finished with value: 0.8539325842696629 and parameters: {'objective': 'Logloss', 'colsample_bylevel': 0.07679540546784244, 'depth': 5, 'boosting_type': 'Ordered', 'bootstrap_type': 'Bayesian', 'bagging_temperature': 9.311847984001322}. Best is trial 3065 with value: 0.8863636363636364.
