[32m[I 2023-04-21 03:25:12,307][39m Trial 5653 finished with value: 0.8409090909090909 and parameters: {'objective': 'CrossEntropy', 'colsample_bylevel': 0.08319365110351447, 'depth': 3, 'boosting_type': 'Ordered', 'bootstrap_type': 'MVS'}. Best is trial 3065 with value: 0.8863636363636364.
[32m[I 2023-04-21 03:25:13,605][39m Trial 5654 finished with value: 0.8275862068965518 and parameters: {'objective': 'CrossEntropy', 'colsample_bylevel': 0.0933208863562971, 'depth': 3, 'boosting_type': 'Plain', 'bootstrap_type': 'Bayesian', 'bagging_temperature': 9.96789609404837}. Best is trial 3065 with value: 0.8863636363636364.
[32m[I 2023-04-21 03:25:14,785][39m Trial 5655 finished with value: 0.8666666666666666 and parameters: {'objective': 'CrossEntropy', 'colsample_bylevel': 0.07581820032114726, 'depth': 10, 'boosting_type': 'Plain', 'bootstrap_type': 'Bayesian', 'bagging_temperature': 9.096913201974402}. Best is trial 3065 with value: 0.8863636363636364.
[32m[I 2023-04-21 03:25:15,961][39m Trial 5656 finished with value: 0.8409090909090909 and parameters: {'objective': 'CrossEntropy', 'colsample_bylevel': 0.08308056060395208, 'depth': 3, 'boosting_type': 'Plain', 'bootstrap_type': 'MVS'}. Best is trial 3065 with value: 0.8863636363636364.
[32m[I 2023-04-21 03:25:16,923][39m Trial 5657 finished with value: 0.8409090909090909 and parameters: {'objective': 'Logloss', 'colsample_bylevel': 0.07236040099502813, 'depth': 6, 'boosting_type': 'Plain', 'bootstrap_type': 'Bayesian', 'bagging_temperature': 9.998640252297994}. Best is trial 3065 with value: 0.8863636363636364.
[32m[I 2023-04-21 03:25:17,641][39m Trial 5658 finished with value: 0.8409090909090909 and parameters: {'objective': 'CrossEntropy', 'colsample_bylevel': 0.07575951686286138, 'depth': 11, 'boosting_type': 'Plain', 'bootstrap_type': 'Bayesian', 'bagging_temperature': 8.972489124697958}. Best is trial 3065 with value: 0.8863636363636364.
[32m[I 2023-04-21 03:25:18,324][39m Trial 5659 finished with value: 0.8539325842696629 and parameters: {'objective': 'Logloss', 'colsample_bylevel': 0.08079636580931523, 'depth': 3, 'boosting_type': 'Plain', 'bootstrap_type': 'Bayesian', 'bagging_temperature': 8.334901821980896}. Best is trial 3065 with value: 0.8863636363636364.
[32m[I 2023-04-21 03:25:19,881][39m Trial 5660 finished with value: 0.8275862068965518 and parameters: {'objective': 'CrossEntropy', 'colsample_bylevel': 0.07560667163430876, 'depth': 9, 'boosting_type': 'Plain', 'bootstrap_type': 'MVS'}. Best is trial 3065 with value: 0.8863636363636364.
[32m[I 2023-04-21 03:25:21,222][39m Trial 5661 finished with value: 0.8409090909090909 and parameters: {'objective': 'CrossEntropy', 'colsample_bylevel': 0.08459344765539213, 'depth': 6, 'boosting_type': 'Plain', 'bootstrap_type': 'Bayesian', 'bagging_temperature': 9.102520203248798}. Best is trial 3065 with value: 0.8863636363636364.
[32m[I 2023-04-21 03:25:22,266][39m Trial 5662 finished with value: 0.8539325842696629 and parameters: {'objective': 'Logloss', 'colsample_bylevel': 0.07193648843089098, 'depth': 11, 'boosting_type': 'Plain', 'bootstrap_type': 'Bayesian', 'bagging_temperature': 9.220935501460346}. Best is trial 3065 with value: 0.8863636363636364.
[32m[I 2023-04-21 03:25:23,344][39m Trial 5663 finished with value: 0.8139534883720929 and parameters: {'objective': 'CrossEntropy', 'colsample_bylevel': 0.09220562802667448, 'depth': 3, 'boosting_type': 'Plain', 'bootstrap_type': 'Bernoulli', 'subsample': 0.49126543002995066}. Best is trial 3065 with value: 0.8863636363636364.
[32m[I 2023-04-21 03:25:24,062][39m Trial 5664 finished with value: 0.8409090909090909 and parameters: {'objective': 'CrossEntropy', 'colsample_bylevel': 0.09447826182932573, 'depth': 7, 'boosting_type': 'Plain', 'bootstrap_type': 'Bayesian', 'bagging_temperature': 9.428060144874967}. Best is trial 3065 with value: 0.8863636363636364.
[32m[I 2023-04-21 03:25:24,741][39m Trial 5665 finished with value: 0.8539325842696629 and parameters: {'objective': 'CrossEntropy', 'colsample_bylevel': 0.07241967095581409, 'depth': 10, 'boosting_type': 'Plain', 'bootstrap_type': 'MVS'}. Best is trial 3065 with value: 0.8863636363636364.
[32m[I 2023-04-21 03:25:25,922][39m Trial 5666 finished with value: 0.8539325842696629 and parameters: {'objective': 'Logloss', 'colsample_bylevel': 0.08754740395078274, 'depth': 10, 'boosting_type': 'Plain', 'bootstrap_type': 'Bayesian', 'bagging_temperature': 9.588576290450339}. Best is trial 3065 with value: 0.8863636363636364.
[32m[I 2023-04-21 03:25:27,206][39m Trial 5667 finished with value: 0.8409090909090909 and parameters: {'objective': 'Logloss', 'colsample_bylevel': 0.08627421110464395, 'depth': 10, 'boosting_type': 'Plain', 'bootstrap_type': 'Bayesian', 'bagging_temperature': 9.629488793033344}. Best is trial 3065 with value: 0.8863636363636364.
[32m[I 2023-04-21 03:25:28,240][39m Trial 5668 finished with value: 0.8409090909090909 and parameters: {'objective': 'Logloss', 'colsample_bylevel': 0.06916807760750342, 'depth': 11, 'boosting_type': 'Plain', 'bootstrap_type': 'Bayesian', 'bagging_temperature': 1.1202044797567279}. Best is trial 3065 with value: 0.8863636363636364.
[32m[I 2023-04-21 03:25:29,592][39m Trial 5669 finished with value: 0.8539325842696629 and parameters: {'objective': 'CrossEntropy', 'colsample_bylevel': 0.07773769237640728, 'depth': 2, 'boosting_type': 'Plain', 'bootstrap_type': 'Bernoulli', 'subsample': 0.12759857277720382}. Best is trial 3065 with value: 0.8863636363636364.
[32m[I 2023-04-21 03:25:30,792][39m Trial 5670 finished with value: 0.8275862068965518 and parameters: {'objective': 'CrossEntropy', 'colsample_bylevel': 0.07190331680004873, 'depth': 9, 'boosting_type': 'Plain', 'bootstrap_type': 'Bayesian', 'bagging_temperature': 8.737606328089953}. Best is trial 3065 with value: 0.8863636363636364.
[32m[I 2023-04-21 03:25:31,501][39m Trial 5671 finished with value: 0.8539325842696629 and parameters: {'objective': 'Logloss', 'colsample_bylevel': 0.06805212494086185, 'depth': 10, 'boosting_type': 'Plain', 'bootstrap_type': 'Bayesian', 'bagging_temperature': 9.39355224389699}. Best is trial 3065 with value: 0.8863636363636364.
[32m[I 2023-04-21 03:25:36,332][39m Trial 5672 finished with value: 0.8409090909090909 and parameters: {'objective': 'Logloss', 'colsample_bylevel': 0.07469483085732727, 'depth': 5, 'boosting_type': 'Ordered', 'bootstrap_type': 'Bayesian', 'bagging_temperature': 8.990688587613676}. Best is trial 3065 with value: 0.8863636363636364.
[32m[I 2023-04-21 03:25:37,505][39m Trial 5673 finished with value: 0.8409090909090909 and parameters: {'objective': 'CrossEntropy', 'colsample_bylevel': 0.07996658656076255, 'depth': 10, 'boosting_type': 'Plain', 'bootstrap_type': 'Bayesian', 'bagging_temperature': 9.003160245173788}. Best is trial 3065 with value: 0.8863636363636364.
[32m[I 2023-04-21 03:25:38,804][39m Trial 5674 finished with value: 0.8314606741573034 and parameters: {'objective': 'CrossEntropy', 'colsample_bylevel': 0.08962230136013842, 'depth': 3, 'boosting_type': 'Plain', 'bootstrap_type': 'MVS'}. Best is trial 3065 with value: 0.8863636363636364.
[32m[I 2023-04-21 03:25:39,611][39m Trial 5675 finished with value: 0.8666666666666666 and parameters: {'objective': 'CrossEntropy', 'colsample_bylevel': 0.0742387905480122, 'depth': 9, 'boosting_type': 'Plain', 'bootstrap_type': 'Bayesian', 'bagging_temperature': 8.23886310050343}. Best is trial 3065 with value: 0.8863636363636364.
[32m[I 2023-04-21 03:25:40,961][39m Trial 5676 finished with value: 0.8139534883720929 and parameters: {'objective': 'CrossEntropy', 'colsample_bylevel': 0.07144651117060974, 'depth': 9, 'boosting_type': 'Plain', 'bootstrap_type': 'Bayesian', 'bagging_temperature': 3.583963124221676}. Best is trial 3065 with value: 0.8863636363636364.
[32m[I 2023-04-21 03:25:42,302][39m Trial 5677 finished with value: 0.8409090909090909 and parameters: {'objective': 'CrossEntropy', 'colsample_bylevel': 0.07487469203881285, 'depth': 10, 'boosting_type': 'Plain', 'bootstrap_type': 'Bayesian', 'bagging_temperature': 9.498610097627138}. Best is trial 3065 with value: 0.8863636363636364.
[32m[I 2023-04-21 03:25:43,236][39m Trial 5678 finished with value: 0.8539325842696629 and parameters: {'objective': 'CrossEntropy', 'colsample_bylevel': 0.08638173794750732, 'depth': 3, 'boosting_type': 'Plain', 'bootstrap_type': 'Bayesian', 'bagging_temperature': 9.766356538226045}. Best is trial 3065 with value: 0.8863636363636364.
[32m[I 2023-04-21 03:25:44,045][39m Trial 5679 finished with value: 0.8666666666666666 and parameters: {'objective': 'CrossEntropy', 'colsample_bylevel': 0.08510582317167036, 'depth': 3, 'boosting_type': 'Plain', 'bootstrap_type': 'Bayesian', 'bagging_temperature': 9.808576692754654}. Best is trial 3065 with value: 0.8863636363636364.
[32m[I 2023-04-21 03:25:45,412][39m Trial 5680 finished with value: 0.8372093023255814 and parameters: {'objective': 'CrossEntropy', 'colsample_bylevel': 0.08972156496448036, 'depth': 12, 'boosting_type': 'Plain', 'bootstrap_type': 'Bayesian', 'bagging_temperature': 8.933753311746571}. Best is trial 3065 with value: 0.8863636363636364.
[32m[I 2023-04-21 03:25:46,282][39m Trial 5681 finished with value: 0.8139534883720929 and parameters: {'objective': 'CrossEntropy', 'colsample_bylevel': 0.08535862237947747, 'depth': 3, 'boosting_type': 'Plain', 'bootstrap_type': 'Bayesian', 'bagging_temperature': 7.912424401015}. Best is trial 3065 with value: 0.8863636363636364.
[32m[I 2023-04-21 03:25:46,986][39m Trial 5682 finished with value: 0.8539325842696629 and parameters: {'objective': 'CrossEntropy', 'colsample_bylevel': 0.08233311375219901, 'depth': 3, 'boosting_type': 'Plain', 'bootstrap_type': 'Bayesian', 'bagging_temperature': 9.49133254133864}. Best is trial 3065 with value: 0.8863636363636364.
[32m[I 2023-04-21 03:25:47,889][39m Trial 5683 finished with value: 0.8636363636363636 and parameters: {'objective': 'Logloss', 'colsample_bylevel': 0.07070198327229024, 'depth': 2, 'boosting_type': 'Plain', 'bootstrap_type': 'Bayesian', 'bagging_temperature': 9.04751593886392}. Best is trial 3065 with value: 0.8863636363636364.
[32m[I 2023-04-21 03:25:48,623][39m Trial 5684 finished with value: 0.8372093023255814 and parameters: {'objective': 'CrossEntropy', 'colsample_bylevel': 0.08408408106827564, 'depth': 7, 'boosting_type': 'Plain', 'bootstrap_type': 'Bayesian', 'bagging_temperature': 9.528182372289809}. Best is trial 3065 with value: 0.8863636363636364.
[32m[I 2023-04-21 03:25:49,903][39m Trial 5685 finished with value: 0.8539325842696629 and parameters: {'objective': 'CrossEntropy', 'colsample_bylevel': 0.07915593421353799, 'depth': 10, 'boosting_type': 'Plain', 'bootstrap_type': 'Bayesian', 'bagging_temperature': 9.448777170204139}. Best is trial 3065 with value: 0.8863636363636364.
[32m[I 2023-04-21 03:25:51,413][39m Trial 5686 finished with value: 0.8791208791208791 and parameters: {'objective': 'CrossEntropy', 'colsample_bylevel': 0.07000884648444687, 'depth': 8, 'boosting_type': 'Plain', 'bootstrap_type': 'Bayesian', 'bagging_temperature': 9.944797964742378}. Best is trial 3065 with value: 0.8863636363636364.
[32m[I 2023-04-21 03:25:52,330][39m Trial 5687 finished with value: 0.8314606741573034 and parameters: {'objective': 'CrossEntropy', 'colsample_bylevel': 0.06564237006268044, 'depth': 8, 'boosting_type': 'Plain', 'bootstrap_type': 'Bernoulli', 'subsample': 0.24011153732432705}. Best is trial 3065 with value: 0.8863636363636364.
[32m[I 2023-04-21 03:25:53,193][39m Trial 5688 finished with value: 0.8409090909090909 and parameters: {'objective': 'CrossEntropy', 'colsample_bylevel': 0.06733347957583949, 'depth': 8, 'boosting_type': 'Plain', 'bootstrap_type': 'MVS'}. Best is trial 3065 with value: 0.8863636363636364.
[32m[I 2023-04-21 03:25:53,900][39m Trial 5689 finished with value: 0.8791208791208791 and parameters: {'objective': 'CrossEntropy', 'colsample_bylevel': 0.07502776937456226, 'depth': 11, 'boosting_type': 'Plain', 'bootstrap_type': 'Bayesian', 'bagging_temperature': 9.641080426014383}. Best is trial 3065 with value: 0.8863636363636364.
[32m[I 2023-04-21 03:25:54,925][39m Trial 5690 finished with value: 0.8666666666666666 and parameters: {'objective': 'CrossEntropy', 'colsample_bylevel': 0.06413934018951781, 'depth': 9, 'boosting_type': 'Plain', 'bootstrap_type': 'Bayesian', 'bagging_temperature': 9.763481564871563}. Best is trial 3065 with value: 0.8863636363636364.
[32m[I 2023-04-21 03:25:56,246][39m Trial 5691 finished with value: 0.8791208791208791 and parameters: {'objective': 'CrossEntropy', 'colsample_bylevel': 0.06729938616186212, 'depth': 12, 'boosting_type': 'Plain', 'bootstrap_type': 'Bayesian', 'bagging_temperature': 9.777878406288277}. Best is trial 3065 with value: 0.8863636363636364.
[32m[I 2023-04-21 03:25:57,188][39m Trial 5692 finished with value: 0.8181818181818182 and parameters: {'objective': 'Logloss', 'colsample_bylevel': 0.020870037905282385, 'depth': 6, 'boosting_type': 'Plain', 'bootstrap_type': 'Bayesian', 'bagging_temperature': 9.083966903083553}. Best is trial 3065 with value: 0.8863636363636364.
[32m[I 2023-04-21 03:26:01,966][39m Trial 5693 finished with value: 0.8539325842696629 and parameters: {'objective': 'CrossEntropy', 'colsample_bylevel': 0.07543575102672859, 'depth': 4, 'boosting_type': 'Ordered', 'bootstrap_type': 'Bayesian', 'bagging_temperature': 9.787615248930804}. Best is trial 3065 with value: 0.8863636363636364.
[32m[I 2023-04-21 03:26:03,443][39m Trial 5694 finished with value: 0.8505747126436782 and parameters: {'objective': 'CrossEntropy', 'colsample_bylevel': 0.09513924110691882, 'depth': 10, 'boosting_type': 'Plain', 'bootstrap_type': 'Bayesian', 'bagging_temperature': 9.990466092221977}. Best is trial 3065 with value: 0.8863636363636364.
[32m[I 2023-04-21 03:26:04,531][39m Trial 5695 finished with value: 0.8539325842696629 and parameters: {'objective': 'CrossEntropy', 'colsample_bylevel': 0.08210602171338684, 'depth': 4, 'boosting_type': 'Plain', 'bootstrap_type': 'Bayesian', 'bagging_temperature': 8.968592573960898}. Best is trial 3065 with value: 0.8863636363636364.
[32m[I 2023-04-21 03:26:05,765][39m Trial 5696 finished with value: 0.8791208791208791 and parameters: {'objective': 'CrossEntropy', 'colsample_bylevel': 0.07844974132386516, 'depth': 3, 'boosting_type': 'Plain', 'bootstrap_type': 'Bayesian', 'bagging_temperature': 9.818750187265193}. Best is trial 3065 with value: 0.8863636363636364.
[32m[I 2023-04-21 03:26:06,812][39m Trial 5697 finished with value: 0.8539325842696629 and parameters: {'objective': 'CrossEntropy', 'colsample_bylevel': 0.07688394345604718, 'depth': 3, 'boosting_type': 'Plain', 'bootstrap_type': 'Bayesian', 'bagging_temperature': 9.799109323745144}. Best is trial 3065 with value: 0.8863636363636364.
[32m[I 2023-04-21 03:26:07,519][39m Trial 5698 finished with value: 0.8666666666666666 and parameters: {'objective': 'CrossEntropy', 'colsample_bylevel': 0.08066507574955493, 'depth': 3, 'boosting_type': 'Plain', 'bootstrap_type': 'Bayesian', 'bagging_temperature': 9.133256283299266}. Best is trial 3065 with value: 0.8863636363636364.
[32m[I 2023-04-21 03:26:08,439][39m Trial 5699 finished with value: 0.8409090909090909 and parameters: {'objective': 'CrossEntropy', 'colsample_bylevel': 0.07751046231551231, 'depth': 10, 'boosting_type': 'Plain', 'bootstrap_type': 'Bayesian', 'bagging_temperature': 9.683118885340015}. Best is trial 3065 with value: 0.8863636363636364.
[32m[I 2023-04-21 03:26:09,593][39m Trial 5700 finished with value: 0.8505747126436782 and parameters: {'objective': 'CrossEntropy', 'colsample_bylevel': 0.08788099615566076, 'depth': 10, 'boosting_type': 'Plain', 'bootstrap_type': 'Bayesian', 'bagging_temperature': 3.001599782741325}. Best is trial 3065 with value: 0.8863636363636364.
[32m[I 2023-04-21 03:26:10,651][39m Trial 5701 finished with value: 0.8314606741573034 and parameters: {'objective': 'CrossEntropy', 'colsample_bylevel': 0.0796671281425466, 'depth': 3, 'boosting_type': 'Plain', 'bootstrap_type': 'MVS'}. Best is trial 3065 with value: 0.8863636363636364.
[32m[I 2023-04-21 03:26:12,479][39m Trial 5702 finished with value: 0.8409090909090909 and parameters: {'objective': 'CrossEntropy', 'colsample_bylevel': 0.07490553448417595, 'depth': 9, 'boosting_type': 'Plain', 'bootstrap_type': 'Bayesian', 'bagging_temperature': 8.125207593390178}. Best is trial 3065 with value: 0.8863636363636364.
[32m[I 2023-04-21 03:26:13,205][39m Trial 5703 finished with value: 0.8539325842696629 and parameters: {'objective': 'CrossEntropy', 'colsample_bylevel': 0.07965659381279419, 'depth': 10, 'boosting_type': 'Plain', 'bootstrap_type': 'Bayesian', 'bagging_temperature': 9.383457558931118}. Best is trial 3065 with value: 0.8863636363636364.
[32m[I 2023-04-21 03:26:13,930][39m Trial 5704 finished with value: 0.8409090909090909 and parameters: {'objective': 'CrossEntropy', 'colsample_bylevel': 0.076940754905773, 'depth': 10, 'boosting_type': 'Plain', 'bootstrap_type': 'Bayesian', 'bagging_temperature': 9.074212814995027}. Best is trial 3065 with value: 0.8863636363636364.
[32m[I 2023-04-21 03:26:15,174][39m Trial 5705 finished with value: 0.8409090909090909 and parameters: {'objective': 'CrossEntropy', 'colsample_bylevel': 0.07146693387951258, 'depth': 10, 'boosting_type': 'Plain', 'bootstrap_type': 'Bayesian', 'bagging_temperature': 9.228213138703053}. Best is trial 3065 with value: 0.8863636363636364.
[32m[I 2023-04-21 03:26:15,969][39m Trial 5706 finished with value: 0.8409090909090909 and parameters: {'objective': 'Logloss', 'colsample_bylevel': 0.09305936493516095, 'depth': 4, 'boosting_type': 'Plain', 'bootstrap_type': 'Bernoulli', 'subsample': 0.20871477682730882}. Best is trial 3065 with value: 0.8863636363636364.
[32m[I 2023-04-21 03:26:16,850][39m Trial 5707 finished with value: 0.8275862068965518 and parameters: {'objective': 'CrossEntropy', 'colsample_bylevel': 0.08245611246448287, 'depth': 4, 'boosting_type': 'Plain', 'bootstrap_type': 'Bayesian', 'bagging_temperature': 9.771245572848615}. Best is trial 3065 with value: 0.8863636363636364.
[32m[I 2023-04-21 03:26:18,228][39m Trial 5708 finished with value: 0.8275862068965518 and parameters: {'objective': 'Logloss', 'colsample_bylevel': 0.08253517067976603, 'depth': 8, 'boosting_type': 'Plain', 'bootstrap_type': 'Bayesian', 'bagging_temperature': 8.99077071236314}. Best is trial 3065 with value: 0.8863636363636364.
[32m[I 2023-04-21 03:26:19,726][39m Trial 5709 finished with value: 0.8666666666666666 and parameters: {'objective': 'CrossEntropy', 'colsample_bylevel': 0.06725209810909269, 'depth': 9, 'boosting_type': 'Plain', 'bootstrap_type': 'Bayesian', 'bagging_temperature': 9.973246626206041}. Best is trial 3065 with value: 0.8863636363636364.
[32m[I 2023-04-21 03:26:20,662][39m Trial 5710 finished with value: 0.8791208791208791 and parameters: {'objective': 'CrossEntropy', 'colsample_bylevel': 0.07657293743234776, 'depth': 10, 'boosting_type': 'Plain', 'bootstrap_type': 'Bayesian', 'bagging_temperature': 8.744146343942733}. Best is trial 3065 with value: 0.8863636363636364.
[32m[I 2023-04-21 03:26:27,024][39m Trial 5712 finished with value: 0.8275862068965518 and parameters: {'objective': 'Logloss', 'colsample_bylevel': 0.07006771216255386, 'depth': 6, 'boosting_type': 'Ordered', 'bootstrap_type': 'Bayesian', 'bagging_temperature': 8.541594038946908}. Best is trial 3065 with value: 0.8863636363636364.
[32m[I 2023-04-21 03:26:28,128][39m Trial 5713 finished with value: 0.8409090909090909 and parameters: {'objective': 'Logloss', 'colsample_bylevel': 0.07138024591894643, 'depth': 12, 'boosting_type': 'Plain', 'bootstrap_type': 'Bayesian', 'bagging_temperature': 8.834153905619326}. Best is trial 3065 with value: 0.8863636363636364.
[32m[I 2023-04-21 03:26:29,215][39m Trial 5714 finished with value: 0.8275862068965518 and parameters: {'objective': 'CrossEntropy', 'colsample_bylevel': 0.07658280256945045, 'depth': 10, 'boosting_type': 'Plain', 'bootstrap_type': 'Bayesian', 'bagging_temperature': 9.245645299832113}. Best is trial 3065 with value: 0.8863636363636364.
[32m[I 2023-04-21 03:26:29,903][39m Trial 5715 finished with value: 0.8275862068965518 and parameters: {'objective': 'CrossEntropy', 'colsample_bylevel': 0.07860509444973535, 'depth': 10, 'boosting_type': 'Plain', 'bootstrap_type': 'MVS'}. Best is trial 3065 with value: 0.8863636363636364.
[32m[I 2023-04-21 03:26:31,221][39m Trial 5716 finished with value: 0.8539325842696629 and parameters: {'objective': 'Logloss', 'colsample_bylevel': 0.09655375350749866, 'depth': 3, 'boosting_type': 'Plain', 'bootstrap_type': 'Bayesian', 'bagging_temperature': 8.561426100494238}. Best is trial 3065 with value: 0.8863636363636364.
[32m[I 2023-04-21 03:26:32,228][39m Trial 5717 finished with value: 0.8791208791208791 and parameters: {'objective': 'CrossEntropy', 'colsample_bylevel': 0.07916367916979239, 'depth': 3, 'boosting_type': 'Plain', 'bootstrap_type': 'Bayesian', 'bagging_temperature': 8.856955066610794}. Best is trial 3065 with value: 0.8863636363636364.
[32m[I 2023-04-21 03:26:33,271][39m Trial 5718 finished with value: 0.8666666666666666 and parameters: {'objective': 'CrossEntropy', 'colsample_bylevel': 0.0754339770428906, 'depth': 4, 'boosting_type': 'Plain', 'bootstrap_type': 'Bayesian', 'bagging_temperature': 8.496836399669858}. Best is trial 3065 with value: 0.8863636363636364.
[32m[I 2023-04-21 03:26:34,572][39m Trial 5719 finished with value: 0.8505747126436782 and parameters: {'objective': 'CrossEntropy', 'colsample_bylevel': 0.07884441965072583, 'depth': 2, 'boosting_type': 'Plain', 'bootstrap_type': 'Bayesian', 'bagging_temperature': 9.016704441554237}. Best is trial 3065 with value: 0.8863636363636364.
