[32m[I 2023-04-21 02:56:27,966][39m Trial 4283 finished with value: 0.8409090909090909 and parameters: {'objective': 'CrossEntropy', 'colsample_bylevel': 0.07972678634679402, 'depth': 10, 'boosting_type': 'Plain', 'bootstrap_type': 'Bayesian', 'bagging_temperature': 9.594182367643207}. Best is trial 3065 with value: 0.8863636363636364.
[32m[I 2023-04-21 02:56:28,671][39m Trial 4284 finished with value: 0.8539325842696629 and parameters: {'objective': 'CrossEntropy', 'colsample_bylevel': 0.09394178509363962, 'depth': 2, 'boosting_type': 'Plain', 'bootstrap_type': 'Bayesian', 'bagging_temperature': 8.509416159945703}. Best is trial 3065 with value: 0.8863636363636364.
[32m[I 2023-04-21 02:56:29,763][39m Trial 4285 finished with value: 0.8666666666666666 and parameters: {'objective': 'CrossEntropy', 'colsample_bylevel': 0.09377924411317, 'depth': 3, 'boosting_type': 'Plain', 'bootstrap_type': 'Bayesian', 'bagging_temperature': 8.536478717072024}. Best is trial 3065 with value: 0.8863636363636364.
[32m[I 2023-04-21 02:56:31,338][39m Trial 4286 finished with value: 0.8666666666666666 and parameters: {'objective': 'CrossEntropy', 'colsample_bylevel': 0.08064830454972603, 'depth': 3, 'boosting_type': 'Plain', 'bootstrap_type': 'Bayesian', 'bagging_temperature': 9.119561106203545}. Best is trial 3065 with value: 0.8863636363636364.
[32m[I 2023-04-21 02:56:32,304][39m Trial 4287 finished with value: 0.8539325842696629 and parameters: {'objective': 'CrossEntropy', 'colsample_bylevel': 0.08654553143690465, 'depth': 4, 'boosting_type': 'Plain', 'bootstrap_type': 'Bayesian', 'bagging_temperature': 9.554542864758755}. Best is trial 3065 with value: 0.8863636363636364.
[32m[I 2023-04-21 02:56:33,572][39m Trial 4288 finished with value: 0.8139534883720929 and parameters: {'objective': 'CrossEntropy', 'colsample_bylevel': 0.07782481566188823, 'depth': 9, 'boosting_type': 'Plain', 'bootstrap_type': 'Bernoulli', 'subsample': 0.8822791371521921}. Best is trial 3065 with value: 0.8863636363636364.
[32m[I 2023-04-21 02:56:39,022][39m Trial 4289 finished with value: 0.8139534883720929 and parameters: {'objective': 'CrossEntropy', 'colsample_bylevel': 0.08037304959638032, 'depth': 6, 'boosting_type': 'Ordered', 'bootstrap_type': 'Bayesian', 'bagging_temperature': 9.051036478220695}. Best is trial 3065 with value: 0.8863636363636364.
[32m[I 2023-04-21 02:56:40,271][39m Trial 4290 finished with value: 0.8409090909090909 and parameters: {'objective': 'CrossEntropy', 'colsample_bylevel': 0.07326258619759747, 'depth': 9, 'boosting_type': 'Plain', 'bootstrap_type': 'Bayesian', 'bagging_temperature': 9.761310705809274}. Best is trial 3065 with value: 0.8863636363636364.
[32m[I 2023-04-21 02:56:41,057][39m Trial 4291 finished with value: 0.8666666666666666 and parameters: {'objective': 'CrossEntropy', 'colsample_bylevel': 0.07616217008420997, 'depth': 9, 'boosting_type': 'Plain', 'bootstrap_type': 'Bayesian', 'bagging_temperature': 9.465827358619968}. Best is trial 3065 with value: 0.8863636363636364.
[32m[I 2023-04-21 02:56:41,993][39m Trial 4292 finished with value: 0.8666666666666666 and parameters: {'objective': 'CrossEntropy', 'colsample_bylevel': 0.07946236074507636, 'depth': 3, 'boosting_type': 'Plain', 'bootstrap_type': 'Bayesian', 'bagging_temperature': 8.85866627523924}. Best is trial 3065 with value: 0.8863636363636364.
[32m[I 2023-04-21 02:56:42,955][39m Trial 4293 finished with value: 0.8666666666666666 and parameters: {'objective': 'CrossEntropy', 'colsample_bylevel': 0.06970532646185332, 'depth': 10, 'boosting_type': 'Plain', 'bootstrap_type': 'Bayesian', 'bagging_temperature': 9.076200446855243}. Best is trial 3065 with value: 0.8863636363636364.
[32m[I 2023-04-21 02:56:43,879][39m Trial 4294 finished with value: 0.8275862068965518 and parameters: {'objective': 'Logloss', 'colsample_bylevel': 0.07377298534073938, 'depth': 11, 'boosting_type': 'Plain', 'bootstrap_type': 'MVS'}. Best is trial 3065 with value: 0.8863636363636364.
[32m[I 2023-04-21 02:56:45,014][39m Trial 4295 finished with value: 0.8444444444444446 and parameters: {'objective': 'CrossEntropy', 'colsample_bylevel': 0.07449562280635795, 'depth': 11, 'boosting_type': 'Plain', 'bootstrap_type': 'Bayesian', 'bagging_temperature': 9.5714799813458}. Best is trial 3065 with value: 0.8863636363636364.
[32m[I 2023-04-21 02:56:46,276][39m Trial 4296 finished with value: 0.8539325842696629 and parameters: {'objective': 'CrossEntropy', 'colsample_bylevel': 0.06132283162996125, 'depth': 10, 'boosting_type': 'Plain', 'bootstrap_type': 'MVS'}. Best is trial 3065 with value: 0.8863636363636364.
[32m[I 2023-04-21 02:56:47,137][39m Trial 4297 finished with value: 0.8539325842696629 and parameters: {'objective': 'Logloss', 'colsample_bylevel': 0.08661926323133816, 'depth': 4, 'boosting_type': 'Plain', 'bootstrap_type': 'Bayesian', 'bagging_temperature': 9.027288802248837}. Best is trial 3065 with value: 0.8863636363636364.
[32m[I 2023-04-21 02:56:48,273][39m Trial 4298 finished with value: 0.8764044943820225 and parameters: {'objective': 'Logloss', 'colsample_bylevel': 0.0844705728406364, 'depth': 2, 'boosting_type': 'Plain', 'bootstrap_type': 'Bayesian', 'bagging_temperature': 9.986357351728838}. Best is trial 3065 with value: 0.8863636363636364.
[32m[I 2023-04-21 02:56:48,978][39m Trial 4299 finished with value: 0.8666666666666666 and parameters: {'objective': 'CrossEntropy', 'colsample_bylevel': 0.0765250373408129, 'depth': 4, 'boosting_type': 'Plain', 'bootstrap_type': 'Bayesian', 'bagging_temperature': 9.832875237567013}. Best is trial 3065 with value: 0.8863636363636364.
[32m[I 2023-04-21 02:56:49,917][39m Trial 4300 finished with value: 0.8539325842696629 and parameters: {'objective': 'CrossEntropy', 'colsample_bylevel': 0.08370510031151289, 'depth': 2, 'boosting_type': 'Plain', 'bootstrap_type': 'Bayesian', 'bagging_temperature': 9.089634603353161}. Best is trial 3065 with value: 0.8863636363636364.
[32m[I 2023-04-21 02:56:50,849][39m Trial 4301 finished with value: 0.8505747126436782 and parameters: {'objective': 'CrossEntropy', 'colsample_bylevel': 0.06560261395209706, 'depth': 2, 'boosting_type': 'Plain', 'bootstrap_type': 'Bayesian', 'bagging_temperature': 9.264803055416007}. Best is trial 3065 with value: 0.8863636363636364.
[32m[I 2023-04-21 02:56:51,572][39m Trial 4302 finished with value: 0.8666666666666666 and parameters: {'objective': 'Logloss', 'colsample_bylevel': 0.07825155137231136, 'depth': 4, 'boosting_type': 'Plain', 'bootstrap_type': 'Bayesian', 'bagging_temperature': 8.817133404561165}. Best is trial 3065 with value: 0.8863636363636364.
[32m[I 2023-04-21 02:56:52,676][39m Trial 4303 finished with value: 0.8539325842696629 and parameters: {'objective': 'CrossEntropy', 'colsample_bylevel': 0.08514440661813845, 'depth': 3, 'boosting_type': 'Plain', 'bootstrap_type': 'Bayesian', 'bagging_temperature': 9.508402774802693}. Best is trial 3065 with value: 0.8863636363636364.
[32m[I 2023-04-21 02:56:53,684][39m Trial 4304 finished with value: 0.8666666666666666 and parameters: {'objective': 'CrossEntropy', 'colsample_bylevel': 0.09487340510898587, 'depth': 3, 'boosting_type': 'Plain', 'bootstrap_type': 'Bayesian', 'bagging_temperature': 8.414385461075591}. Best is trial 3065 with value: 0.8863636363636364.
[32m[I 2023-04-21 02:56:54,758][39m Trial 4305 finished with value: 0.8539325842696629 and parameters: {'objective': 'CrossEntropy', 'colsample_bylevel': 0.0854253791281808, 'depth': 3, 'boosting_type': 'Plain', 'bootstrap_type': 'Bayesian', 'bagging_temperature': 8.372164899917204}. Best is trial 3065 with value: 0.8863636363636364.
[32m[I 2023-04-21 02:56:55,598][39m Trial 4306 finished with value: 0.8666666666666666 and parameters: {'objective': 'CrossEntropy', 'colsample_bylevel': 0.0682977927316918, 'depth': 8, 'boosting_type': 'Plain', 'bootstrap_type': 'Bayesian', 'bagging_temperature': 9.142408587911886}. Best is trial 3065 with value: 0.8863636363636364.
[32m[I 2023-04-21 02:57:00,395][39m Trial 4307 finished with value: 0.8275862068965518 and parameters: {'objective': 'CrossEntropy', 'colsample_bylevel': 0.08108221963185398, 'depth': 9, 'boosting_type': 'Ordered', 'bootstrap_type': 'Bayesian', 'bagging_temperature': 9.788745502572473}. Best is trial 3065 with value: 0.8863636363636364.
[32m[I 2023-04-21 02:57:01,359][39m Trial 4308 finished with value: 0.8666666666666666 and parameters: {'objective': 'Logloss', 'colsample_bylevel': 0.07254227719460467, 'depth': 12, 'boosting_type': 'Plain', 'bootstrap_type': 'Bayesian', 'bagging_temperature': 9.654709990588378}. Best is trial 3065 with value: 0.8863636363636364.
[32m[I 2023-04-21 02:57:02,527][39m Trial 4309 finished with value: 0.8539325842696629 and parameters: {'objective': 'CrossEntropy', 'colsample_bylevel': 0.08702569961513829, 'depth': 3, 'boosting_type': 'Plain', 'bootstrap_type': 'Bayesian', 'bagging_temperature': 9.99666236704459}. Best is trial 3065 with value: 0.8863636363636364.
[32m[I 2023-04-21 02:57:03,803][39m Trial 4310 finished with value: 0.7999999999999999 and parameters: {'objective': 'CrossEntropy', 'colsample_bylevel': 0.07161993599372643, 'depth': 1, 'boosting_type': 'Plain', 'bootstrap_type': 'Bayesian', 'bagging_temperature': 8.785039369761106}. Best is trial 3065 with value: 0.8863636363636364.
[32m[I 2023-04-21 02:57:04,783][39m Trial 4311 finished with value: 0.8409090909090909 and parameters: {'objective': 'CrossEntropy', 'colsample_bylevel': 0.07666578124367442, 'depth': 11, 'boosting_type': 'Plain', 'bootstrap_type': 'Bayesian', 'bagging_temperature': 8.606545395781783}. Best is trial 3065 with value: 0.8863636363636364.
[32m[I 2023-04-21 02:57:05,476][39m Trial 4312 finished with value: 0.8314606741573034 and parameters: {'objective': 'Logloss', 'colsample_bylevel': 0.09299908234369733, 'depth': 3, 'boosting_type': 'Plain', 'bootstrap_type': 'Bayesian', 'bagging_temperature': 8.934328759380309}. Best is trial 3065 with value: 0.8863636363636364.
[32m[I 2023-04-21 02:57:06,524][39m Trial 4313 finished with value: 0.8409090909090909 and parameters: {'objective': 'CrossEntropy', 'colsample_bylevel': 0.07411527457842537, 'depth': 4, 'boosting_type': 'Plain', 'bootstrap_type': 'Bernoulli', 'subsample': 0.43726393749540443}. Best is trial 3065 with value: 0.8863636363636364.
[32m[I 2023-04-21 02:57:07,576][39m Trial 4314 finished with value: 0.8539325842696629 and parameters: {'objective': 'CrossEntropy', 'colsample_bylevel': 0.09142402731884151, 'depth': 3, 'boosting_type': 'Plain', 'bootstrap_type': 'Bayesian', 'bagging_temperature': 8.728963343421212}. Best is trial 3065 with value: 0.8863636363636364.
[32m[I 2023-04-21 02:57:08,746][39m Trial 4315 finished with value: 0.8409090909090909 and parameters: {'objective': 'CrossEntropy', 'colsample_bylevel': 0.07161202589328906, 'depth': 9, 'boosting_type': 'Plain', 'bootstrap_type': 'Bayesian', 'bagging_temperature': 9.780425434329455}. Best is trial 3065 with value: 0.8863636363636364.
[32m[I 2023-04-21 02:57:09,422][39m Trial 4316 finished with value: 0.8539325842696629 and parameters: {'objective': 'Logloss', 'colsample_bylevel': 0.08075499014376185, 'depth': 3, 'boosting_type': 'Plain', 'bootstrap_type': 'Bayesian', 'bagging_temperature': 9.291029198503448}. Best is trial 3065 with value: 0.8863636363636364.
[32m[I 2023-04-21 02:57:10,665][39m Trial 4317 finished with value: 0.8666666666666666 and parameters: {'objective': 'CrossEntropy', 'colsample_bylevel': 0.08966426336010351, 'depth': 3, 'boosting_type': 'Plain', 'bootstrap_type': 'Bayesian', 'bagging_temperature': 9.880273173275224}. Best is trial 3065 with value: 0.8863636363636364.
[32m[I 2023-04-21 02:57:11,338][39m Trial 4318 finished with value: 0.8539325842696629 and parameters: {'objective': 'CrossEntropy', 'colsample_bylevel': 0.07783834979449893, 'depth': 3, 'boosting_type': 'Plain', 'bootstrap_type': 'Bayesian', 'bagging_temperature': 9.805926212677493}. Best is trial 3065 with value: 0.8863636363636364.
[32m[I 2023-04-21 02:57:12,155][39m Trial 4319 finished with value: 0.8505747126436782 and parameters: {'objective': 'CrossEntropy', 'colsample_bylevel': 0.09010724940831133, 'depth': 10, 'boosting_type': 'Plain', 'bootstrap_type': 'Bayesian', 'bagging_temperature': 8.86256316169662}. Best is trial 3065 with value: 0.8863636363636364.
[32m[I 2023-04-21 02:57:13,101][39m Trial 4320 finished with value: 0.8409090909090909 and parameters: {'objective': 'CrossEntropy', 'colsample_bylevel': 0.07815291218644138, 'depth': 3, 'boosting_type': 'Plain', 'bootstrap_type': 'Bayesian', 'bagging_temperature': 9.980317129801414}. Best is trial 3065 with value: 0.8863636363636364.
[32m[I 2023-04-21 02:57:14,055][39m Trial 4321 finished with value: 0.8275862068965518 and parameters: {'objective': 'CrossEntropy', 'colsample_bylevel': 0.08664333692979148, 'depth': 3, 'boosting_type': 'Plain', 'bootstrap_type': 'MVS'}. Best is trial 3065 with value: 0.8863636363636364.
[32m[I 2023-04-21 02:57:19,125][39m Trial 4322 finished with value: 0.8666666666666666 and parameters: {'objective': 'Logloss', 'colsample_bylevel': 0.07604905360423952, 'depth': 4, 'boosting_type': 'Ordered', 'bootstrap_type': 'Bayesian', 'bagging_temperature': 9.472230291204509}. Best is trial 3065 with value: 0.8863636363636364.
[32m[I 2023-04-21 02:57:20,154][39m Trial 4323 finished with value: 0.8539325842696629 and parameters: {'objective': 'Logloss', 'colsample_bylevel': 0.07244823230028419, 'depth': 10, 'boosting_type': 'Plain', 'bootstrap_type': 'Bayesian', 'bagging_temperature': 8.801532717650586}. Best is trial 3065 with value: 0.8863636363636364.
[32m[I 2023-04-21 02:57:21,428][39m Trial 4324 finished with value: 0.8791208791208791 and parameters: {'objective': 'Logloss', 'colsample_bylevel': 0.0717498682865242, 'depth': 10, 'boosting_type': 'Plain', 'bootstrap_type': 'Bayesian', 'bagging_temperature': 8.748081605246366}. Best is trial 3065 with value: 0.8863636363636364.
[32m[I 2023-04-21 02:57:22,727][39m Trial 4325 finished with value: 0.8409090909090909 and parameters: {'objective': 'CrossEntropy', 'colsample_bylevel': 0.09235554424025838, 'depth': 3, 'boosting_type': 'Plain', 'bootstrap_type': 'Bayesian', 'bagging_temperature': 8.718970181998877}. Best is trial 3065 with value: 0.8863636363636364.
[32m[I 2023-04-21 02:57:23,791][39m Trial 4326 finished with value: 0.8409090909090909 and parameters: {'objective': 'CrossEntropy', 'colsample_bylevel': 0.06849195248976929, 'depth': 4, 'boosting_type': 'Plain', 'bootstrap_type': 'Bayesian', 'bagging_temperature': 8.764589308632168}. Best is trial 3065 with value: 0.8863636363636364.
[32m[I 2023-04-21 02:57:24,534][39m Trial 4327 finished with value: 0.8539325842696629 and parameters: {'objective': 'Logloss', 'colsample_bylevel': 0.07480204052248689, 'depth': 11, 'boosting_type': 'Plain', 'bootstrap_type': 'Bayesian', 'bagging_temperature': 7.221942041592623}. Best is trial 3065 with value: 0.8863636363636364.
[32m[I 2023-04-21 02:57:25,206][39m Trial 4328 finished with value: 0.8539325842696629 and parameters: {'objective': 'CrossEntropy', 'colsample_bylevel': 0.06661454450667866, 'depth': 10, 'boosting_type': 'Plain', 'bootstrap_type': 'Bayesian', 'bagging_temperature': 9.546457861010566}. Best is trial 3065 with value: 0.8863636363636364.
[32m[I 2023-04-21 02:57:26,053][39m Trial 4329 finished with value: 0.8409090909090909 and parameters: {'objective': 'Logloss', 'colsample_bylevel': 0.07106588351049077, 'depth': 4, 'boosting_type': 'Plain', 'bootstrap_type': 'Bayesian', 'bagging_temperature': 8.375085113715281}. Best is trial 3065 with value: 0.8863636363636364.
[32m[I 2023-04-21 02:57:27,224][39m Trial 4330 finished with value: 0.8275862068965518 and parameters: {'objective': 'CrossEntropy', 'colsample_bylevel': 0.07947710947496278, 'depth': 9, 'boosting_type': 'Plain', 'bootstrap_type': 'MVS'}. Best is trial 3065 with value: 0.8863636363636364.
[32m[I 2023-04-21 02:57:28,421][39m Trial 4331 finished with value: 0.8409090909090909 and parameters: {'objective': 'CrossEntropy', 'colsample_bylevel': 0.08625715696322758, 'depth': 3, 'boosting_type': 'Plain', 'bootstrap_type': 'Bayesian', 'bagging_temperature': 9.424782003501665}. Best is trial 3065 with value: 0.8863636363636364.
[32m[I 2023-04-21 02:57:29,111][39m Trial 4332 finished with value: 0.8539325842696629 and parameters: {'objective': 'Logloss', 'colsample_bylevel': 0.06942635887470187, 'depth': 12, 'boosting_type': 'Plain', 'bootstrap_type': 'Bayesian', 'bagging_temperature': 9.35650929295064}. Best is trial 3065 with value: 0.8863636363636364.
[32m[I 2023-04-21 02:57:30,313][39m Trial 4333 finished with value: 0.8539325842696629 and parameters: {'objective': 'CrossEntropy', 'colsample_bylevel': 0.07544842915902077, 'depth': 10, 'boosting_type': 'Plain', 'bootstrap_type': 'Bayesian', 'bagging_temperature': 9.533729878284095}. Best is trial 3065 with value: 0.8863636363636364.
[32m[I 2023-04-21 02:57:31,011][39m Trial 4334 finished with value: 0.8735632183908046 and parameters: {'objective': 'Logloss', 'colsample_bylevel': 0.07457122139233711, 'depth': 10, 'boosting_type': 'Plain', 'bootstrap_type': 'Bayesian', 'bagging_temperature': 9.984237939940616}. Best is trial 3065 with value: 0.8863636363636364.
[32m[I 2023-04-21 02:57:32,064][39m Trial 4335 finished with value: 0.8539325842696629 and parameters: {'objective': 'CrossEntropy', 'colsample_bylevel': 0.086474344365518, 'depth': 10, 'boosting_type': 'Plain', 'bootstrap_type': 'Bayesian', 'bagging_temperature': 9.17166591307686}. Best is trial 3065 with value: 0.8863636363636364.
[32m[I 2023-04-21 02:57:33,105][39m Trial 4336 finished with value: 0.8539325842696629 and parameters: {'objective': 'CrossEntropy', 'colsample_bylevel': 0.07538005068203091, 'depth': 12, 'boosting_type': 'Plain', 'bootstrap_type': 'Bayesian', 'bagging_temperature': 8.613178645839925}. Best is trial 3065 with value: 0.8863636363636364.
[32m[I 2023-04-21 02:57:34,383][39m Trial 4337 finished with value: 0.8139534883720929 and parameters: {'objective': 'CrossEntropy', 'colsample_bylevel': 0.0769396358755551, 'depth': 11, 'boosting_type': 'Plain', 'bootstrap_type': 'Bernoulli', 'subsample': 0.35412338533881726}. Best is trial 3065 with value: 0.8863636363636364.
[32m[I 2023-04-21 02:57:35,072][39m Trial 4338 finished with value: 0.8539325842696629 and parameters: {'objective': 'CrossEntropy', 'colsample_bylevel': 0.07516164585125484, 'depth': 10, 'boosting_type': 'Plain', 'bootstrap_type': 'Bayesian', 'bagging_temperature': 9.593100909655156}. Best is trial 3065 with value: 0.8863636363636364.
[32m[I 2023-04-21 02:57:36,448][39m Trial 4339 finished with value: 0.8539325842696629 and parameters: {'objective': 'CrossEntropy', 'colsample_bylevel': 0.06162275411433189, 'depth': 11, 'boosting_type': 'Plain', 'bootstrap_type': 'MVS'}. Best is trial 3065 with value: 0.8863636363636364.
[32m[I 2023-04-21 02:57:37,500][39m Trial 4340 finished with value: 0.8372093023255814 and parameters: {'objective': 'CrossEntropy', 'colsample_bylevel': 0.09868859859525525, 'depth': 11, 'boosting_type': 'Plain', 'bootstrap_type': 'Bayesian', 'bagging_temperature': 9.032676386691877}. Best is trial 3065 with value: 0.8863636363636364.
[32m[I 2023-04-21 02:57:38,659][39m Trial 4341 finished with value: 0.8275862068965518 and parameters: {'objective': 'Logloss', 'colsample_bylevel': 0.08763956498895649, 'depth': 10, 'boosting_type': 'Plain', 'bootstrap_type': 'Bayesian', 'bagging_temperature': 9.27258343080923}. Best is trial 3065 with value: 0.8863636363636364.
[32m[I 2023-04-21 02:57:39,496][39m Trial 4342 finished with value: 0.8539325842696629 and parameters: {'objective': 'CrossEntropy', 'colsample_bylevel': 0.06873393165220229, 'depth': 4, 'boosting_type': 'Plain', 'bootstrap_type': 'Bayesian', 'bagging_temperature': 8.81229048231807}. Best is trial 3065 with value: 0.8863636363636364.
[32m[I 2023-04-21 02:57:40,500][39m Trial 4343 finished with value: 0.8539325842696629 and parameters: {'objective': 'CrossEntropy', 'colsample_bylevel': 0.07468625216818922, 'depth': 4, 'boosting_type': 'Plain', 'bootstrap_type': 'Bayesian', 'bagging_temperature': 9.059787491957602}. Best is trial 3065 with value: 0.8863636363636364.
[32m[I 2023-04-21 02:57:45,434][39m Trial 4344 finished with value: 0.8409090909090909 and parameters: {'objective': 'CrossEntropy', 'colsample_bylevel': 0.07412246558991999, 'depth': 4, 'boosting_type': 'Ordered', 'bootstrap_type': 'Bayesian', 'bagging_temperature': 9.651185666344048}. Best is trial 3065 with value: 0.8863636363636364.
[32m[I 2023-04-21 02:57:46,560][39m Trial 4345 finished with value: 0.8666666666666666 and parameters: {'objective': 'CrossEntropy', 'colsample_bylevel': 0.06552180836446504, 'depth': 6, 'boosting_type': 'Plain', 'bootstrap_type': 'Bayesian', 'bagging_temperature': 9.21562832895309}. Best is trial 3065 with value: 0.8863636363636364.
[32m[I 2023-04-21 02:57:47,356][39m Trial 4346 finished with value: 0.8666666666666666 and parameters: {'objective': 'Logloss', 'colsample_bylevel': 0.08809144467712614, 'depth': 3, 'boosting_type': 'Plain', 'bootstrap_type': 'Bayesian', 'bagging_temperature': 9.468296173017015}. Best is trial 3065 with value: 0.8863636363636364.
[32m[I 2023-04-21 02:57:48,612][39m Trial 4347 finished with value: 0.8275862068965518 and parameters: {'objective': 'CrossEntropy', 'colsample_bylevel': 0.045186097852269576, 'depth': 6, 'boosting_type': 'Plain', 'bootstrap_type': 'Bayesian', 'bagging_temperature': 6.90536668201185}. Best is trial 3065 with value: 0.8863636363636364.
