[32m[I 2023-04-21 01:42:37,959][39m Trial 397 finished with value: 0.7764705882352942 and parameters: {'objective': 'CrossEntropy', 'colsample_bylevel': 0.03069890402215715, 'depth': 2, 'boosting_type': 'Plain', 'bootstrap_type': 'Bayesian', 'bagging_temperature': 9.83468605716674}. Best is trial 98 with value: 0.8791208791208791.
[32m[I 2023-04-21 01:42:38,765][39m Trial 398 finished with value: 0.8539325842696629 and parameters: {'objective': 'CrossEntropy', 'colsample_bylevel': 0.0814255120925565, 'depth': 2, 'boosting_type': 'Plain', 'bootstrap_type': 'Bayesian', 'bagging_temperature': 9.45563307245853}. Best is trial 98 with value: 0.8791208791208791.
[32m[I 2023-04-21 01:42:39,797][39m Trial 399 finished with value: 0.8764044943820225 and parameters: {'objective': 'CrossEntropy', 'colsample_bylevel': 0.08394960318313432, 'depth': 2, 'boosting_type': 'Plain', 'bootstrap_type': 'Bayesian', 'bagging_temperature': 9.080143940735347}. Best is trial 98 with value: 0.8791208791208791.
[32m[I 2023-04-21 01:42:40,713][39m Trial 400 finished with value: 0.8275862068965518 and parameters: {'objective': 'CrossEntropy', 'colsample_bylevel': 0.09089493699885232, 'depth': 3, 'boosting_type': 'Plain', 'bootstrap_type': 'Bayesian', 'bagging_temperature': 9.001004875627366}. Best is trial 98 with value: 0.8791208791208791.
[32m[I 2023-04-21 01:42:41,735][39m Trial 401 finished with value: 0.8539325842696629 and parameters: {'objective': 'CrossEntropy', 'colsample_bylevel': 0.08356908281134337, 'depth': 2, 'boosting_type': 'Plain', 'bootstrap_type': 'Bayesian', 'bagging_temperature': 9.632751443455515}. Best is trial 98 with value: 0.8791208791208791.
[32m[I 2023-04-21 01:42:42,351][39m Trial 402 finished with value: 0.8539325842696629 and parameters: {'objective': 'CrossEntropy', 'colsample_bylevel': 0.08044293667373087, 'depth': 2, 'boosting_type': 'Plain', 'bootstrap_type': 'Bayesian', 'bagging_temperature': 9.721586900308928}. Best is trial 98 with value: 0.8791208791208791.
[32m[I 2023-04-21 01:42:42,887][39m Trial 403 finished with value: 0.8604651162790697 and parameters: {'objective': 'CrossEntropy', 'colsample_bylevel': 0.07960176997634194, 'depth': 1, 'boosting_type': 'Plain', 'bootstrap_type': 'Bayesian', 'bagging_temperature': 9.842264176701628}. Best is trial 98 with value: 0.8791208791208791.
[32m[I 2023-04-21 01:42:43,657][39m Trial 404 finished with value: 0.8735632183908046 and parameters: {'objective': 'CrossEntropy', 'colsample_bylevel': 0.0635710315312996, 'depth': 2, 'boosting_type': 'Plain', 'bootstrap_type': 'Bayesian', 'bagging_temperature': 9.228183353969866}. Best is trial 98 with value: 0.8791208791208791.
[32m[I 2023-04-21 01:42:44,428][39m Trial 405 finished with value: 0.8409090909090909 and parameters: {'objective': 'CrossEntropy', 'colsample_bylevel': 0.09001395312062029, 'depth': 3, 'boosting_type': 'Plain', 'bootstrap_type': 'Bernoulli', 'subsample': 0.7521084355044718}. Best is trial 98 with value: 0.8791208791208791.
[32m[I 2023-04-21 01:42:45,274][39m Trial 406 finished with value: 0.8409090909090909 and parameters: {'objective': 'CrossEntropy', 'colsample_bylevel': 0.08665097420508101, 'depth': 2, 'boosting_type': 'Plain', 'bootstrap_type': 'Bayesian', 'bagging_temperature': 9.266678086924166}. Best is trial 98 with value: 0.8791208791208791.
[32m[I 2023-04-21 01:42:46,323][39m Trial 407 finished with value: 0.8764044943820225 and parameters: {'objective': 'CrossEntropy', 'colsample_bylevel': 0.09736115561240223, 'depth': 2, 'boosting_type': 'Plain', 'bootstrap_type': 'Bayesian', 'bagging_temperature': 9.683235773993946}. Best is trial 98 with value: 0.8791208791208791.
[32m[I 2023-04-21 01:42:47,353][39m Trial 408 finished with value: 0.8409090909090909 and parameters: {'objective': 'CrossEntropy', 'colsample_bylevel': 0.09875069920031533, 'depth': 3, 'boosting_type': 'Plain', 'bootstrap_type': 'MVS'}. Best is trial 98 with value: 0.8791208791208791.
[32m[I 2023-04-21 01:42:48,302][39m Trial 409 finished with value: 0.8636363636363636 and parameters: {'objective': 'CrossEntropy', 'colsample_bylevel': 0.08596322159533512, 'depth': 7, 'boosting_type': 'Plain', 'bootstrap_type': 'Bayesian', 'bagging_temperature': 9.30123125281402}. Best is trial 98 with value: 0.8791208791208791.
[32m[I 2023-04-21 01:42:52,875][39m Trial 410 finished with value: 0.8275862068965518 and parameters: {'objective': 'CrossEntropy', 'colsample_bylevel': 0.08141955365805151, 'depth': 5, 'boosting_type': 'Ordered', 'bootstrap_type': 'Bayesian', 'bagging_temperature': 9.98548188911548}. Best is trial 98 with value: 0.8791208791208791.
[32m[I 2023-04-21 01:42:53,802][39m Trial 411 finished with value: 0.8505747126436782 and parameters: {'objective': 'CrossEntropy', 'colsample_bylevel': 0.08549541069374718, 'depth': 2, 'boosting_type': 'Plain', 'bootstrap_type': 'Bayesian', 'bagging_temperature': 8.909303478813573}. Best is trial 98 with value: 0.8791208791208791.
[32m[I 2023-04-21 01:42:54,812][39m Trial 412 finished with value: 0.8409090909090909 and parameters: {'objective': 'Logloss', 'colsample_bylevel': 0.087622122815752, 'depth': 2, 'boosting_type': 'Plain', 'bootstrap_type': 'Bayesian', 'bagging_temperature': 9.361778128657951}. Best is trial 98 with value: 0.8791208791208791.
[32m[I 2023-04-21 01:42:55,721][39m Trial 413 finished with value: 0.8372093023255814 and parameters: {'objective': 'CrossEntropy', 'colsample_bylevel': 0.08270567802175256, 'depth': 8, 'boosting_type': 'Plain', 'bootstrap_type': 'Bayesian', 'bagging_temperature': 9.55829657753819}. Best is trial 98 with value: 0.8791208791208791.
[32m[I 2023-04-21 01:42:56,417][39m Trial 414 finished with value: 0.8275862068965518 and parameters: {'objective': 'Logloss', 'colsample_bylevel': 0.07693716978632231, 'depth': 2, 'boosting_type': 'Plain', 'bootstrap_type': 'Bayesian', 'bagging_temperature': 7.301545015109593}. Best is trial 98 with value: 0.8791208791208791.
[32m[I 2023-04-21 01:42:56,948][39m Trial 415 finished with value: 0.8409090909090909 and parameters: {'objective': 'CrossEntropy', 'colsample_bylevel': 0.08524098846764344, 'depth': 1, 'boosting_type': 'Plain', 'bootstrap_type': 'Bayesian', 'bagging_temperature': 9.085403844526818}. Best is trial 98 with value: 0.8791208791208791.
[32m[I 2023-04-21 01:42:57,793][39m Trial 416 finished with value: 0.8636363636363636 and parameters: {'objective': 'CrossEntropy', 'colsample_bylevel': 0.08519149562643366, 'depth': 2, 'boosting_type': 'Plain', 'bootstrap_type': 'Bayesian', 'bagging_temperature': 9.284737844407793}. Best is trial 98 with value: 0.8791208791208791.
[32m[I 2023-04-21 01:42:58,491][39m Trial 417 finished with value: 0.8539325842696629 and parameters: {'objective': 'Logloss', 'colsample_bylevel': 0.0846005240347318, 'depth': 3, 'boosting_type': 'Plain', 'bootstrap_type': 'Bayesian', 'bagging_temperature': 9.400221109200874}. Best is trial 98 with value: 0.8791208791208791.
[32m[I 2023-04-21 01:42:59,235][39m Trial 418 finished with value: 0.8505747126436782 and parameters: {'objective': 'Logloss', 'colsample_bylevel': 0.08380237190701119, 'depth': 2, 'boosting_type': 'Plain', 'bootstrap_type': 'Bayesian', 'bagging_temperature': 9.44573100986033}. Best is trial 98 with value: 0.8791208791208791.
[32m[I 2023-04-21 01:43:00,377][39m Trial 419 finished with value: 0.8666666666666666 and parameters: {'objective': 'CrossEntropy', 'colsample_bylevel': 0.08854522830960163, 'depth': 3, 'boosting_type': 'Plain', 'bootstrap_type': 'Bayesian', 'bagging_temperature': 9.611399566977035}. Best is trial 98 with value: 0.8791208791208791.
[32m[I 2023-04-21 01:43:01,366][39m Trial 420 finished with value: 0.8409090909090909 and parameters: {'objective': 'CrossEntropy', 'colsample_bylevel': 0.09009061481490388, 'depth': 2, 'boosting_type': 'Plain', 'bootstrap_type': 'Bayesian', 'bagging_temperature': 0.0009877100719037912}. Best is trial 98 with value: 0.8791208791208791.
[32m[I 2023-04-21 01:43:02,446][39m Trial 421 finished with value: 0.8539325842696629 and parameters: {'objective': 'Logloss', 'colsample_bylevel': 0.08040170795449722, 'depth': 2, 'boosting_type': 'Plain', 'bootstrap_type': 'Bayesian', 'bagging_temperature': 9.125269849147088}. Best is trial 98 with value: 0.8791208791208791.
[32m[I 2023-04-21 01:43:03,047][39m Trial 422 finished with value: 0.8539325842696629 and parameters: {'objective': 'CrossEntropy', 'colsample_bylevel': 0.0979051879162548, 'depth': 4, 'boosting_type': 'Plain', 'bootstrap_type': 'Bayesian', 'bagging_temperature': 9.807958462440558}. Best is trial 98 with value: 0.8791208791208791.
[32m[I 2023-04-21 01:43:03,734][39m Trial 423 finished with value: 0.8409090909090909 and parameters: {'objective': 'CrossEntropy', 'colsample_bylevel': 0.09247562654633146, 'depth': 3, 'boosting_type': 'Plain', 'bootstrap_type': 'Bayesian', 'bagging_temperature': 9.973706400162058}. Best is trial 98 with value: 0.8791208791208791.
[32m[I 2023-04-21 01:43:04,459][39m Trial 424 finished with value: 0.7764705882352942 and parameters: {'objective': 'Logloss', 'colsample_bylevel': 0.08722556714292018, 'depth': 1, 'boosting_type': 'Plain', 'bootstrap_type': 'Bayesian', 'bagging_temperature': 3.8493401769123428}. Best is trial 98 with value: 0.8791208791208791.
[32m[I 2023-04-21 01:43:05,277][39m Trial 425 finished with value: 0.8409090909090909 and parameters: {'objective': 'CrossEntropy', 'colsample_bylevel': 0.09514588390081556, 'depth': 2, 'boosting_type': 'Plain', 'bootstrap_type': 'Bernoulli', 'subsample': 0.6290781865855811}. Best is trial 98 with value: 0.8791208791208791.
[32m[I 2023-04-21 01:43:06,093][39m Trial 426 finished with value: 0.8539325842696629 and parameters: {'objective': 'CrossEntropy', 'colsample_bylevel': 0.09947977824325006, 'depth': 2, 'boosting_type': 'Plain', 'bootstrap_type': 'Bayesian', 'bagging_temperature': 8.674246050387026}. Best is trial 98 with value: 0.8791208791208791.
[32m[I 2023-04-21 01:43:07,087][39m Trial 427 finished with value: 0.8666666666666666 and parameters: {'objective': 'CrossEntropy', 'colsample_bylevel': 0.07828113388908797, 'depth': 2, 'boosting_type': 'Plain', 'bootstrap_type': 'Bayesian', 'bagging_temperature': 9.819331927062265}. Best is trial 98 with value: 0.8791208791208791.
[32m[I 2023-04-21 01:43:11,817][39m Trial 428 finished with value: 0.8314606741573034 and parameters: {'objective': 'CrossEntropy', 'colsample_bylevel': 0.07735507496477968, 'depth': 2, 'boosting_type': 'Ordered', 'bootstrap_type': 'Bayesian', 'bagging_temperature': 9.857234782559013}. Best is trial 98 with value: 0.8791208791208791.
[32m[I 2023-04-21 01:43:12,651][39m Trial 429 finished with value: 0.8539325842696629 and parameters: {'objective': 'CrossEntropy', 'colsample_bylevel': 0.08337621728502372, 'depth': 2, 'boosting_type': 'Plain', 'bootstrap_type': 'Bayesian', 'bagging_temperature': 9.184813831911134}. Best is trial 98 with value: 0.8791208791208791.
[32m[I 2023-04-21 01:43:13,722][39m Trial 430 finished with value: 0.8666666666666666 and parameters: {'objective': 'Logloss', 'colsample_bylevel': 0.08694867828278502, 'depth': 3, 'boosting_type': 'Plain', 'bootstrap_type': 'Bayesian', 'bagging_temperature': 9.52470191821563}. Best is trial 98 with value: 0.8791208791208791.
[32m[I 2023-04-21 01:43:14,541][39m Trial 431 finished with value: 0.8735632183908046 and parameters: {'objective': 'CrossEntropy', 'colsample_bylevel': 0.09482840235670754, 'depth': 1, 'boosting_type': 'Plain', 'bootstrap_type': 'Bayesian', 'bagging_temperature': 9.71104248512982}. Best is trial 98 with value: 0.8791208791208791.
[32m[I 2023-04-21 01:43:15,174][39m Trial 432 finished with value: 0.8139534883720929 and parameters: {'objective': 'CrossEntropy', 'colsample_bylevel': 0.09786904720166978, 'depth': 3, 'boosting_type': 'Plain', 'bootstrap_type': 'MVS'}. Best is trial 98 with value: 0.8791208791208791.
[32m[I 2023-04-21 01:43:15,966][39m Trial 433 finished with value: 0.8764044943820225 and parameters: {'objective': 'Logloss', 'colsample_bylevel': 0.08551932416670453, 'depth': 2, 'boosting_type': 'Plain', 'bootstrap_type': 'Bayesian', 'bagging_temperature': 9.12283459018082}. Best is trial 98 with value: 0.8791208791208791.
[32m[I 2023-04-21 01:43:16,801][39m Trial 434 finished with value: 0.8539325842696629 and parameters: {'objective': 'CrossEntropy', 'colsample_bylevel': 0.08943734980088945, 'depth': 2, 'boosting_type': 'Plain', 'bootstrap_type': 'Bayesian', 'bagging_temperature': 8.874189653255586}. Best is trial 98 with value: 0.8791208791208791.
[32m[I 2023-04-21 01:43:17,730][39m Trial 435 finished with value: 0.8539325842696629 and parameters: {'objective': 'CrossEntropy', 'colsample_bylevel': 0.09653172008648181, 'depth': 2, 'boosting_type': 'Plain', 'bootstrap_type': 'Bayesian', 'bagging_temperature': 8.558585615236515}. Best is trial 98 with value: 0.8791208791208791.
[32m[I 2023-04-21 01:43:18,363][39m Trial 436 finished with value: 0.8275862068965518 and parameters: {'objective': 'CrossEntropy', 'colsample_bylevel': 0.0934622633991621, 'depth': 3, 'boosting_type': 'Plain', 'bootstrap_type': 'Bayesian', 'bagging_temperature': 9.680882691199184}. Best is trial 98 with value: 0.8791208791208791.
[32m[I 2023-04-21 01:43:19,123][39m Trial 437 finished with value: 0.8045977011494252 and parameters: {'objective': 'CrossEntropy', 'colsample_bylevel': 0.08182641198095367, 'depth': 1, 'boosting_type': 'Plain', 'bootstrap_type': 'Bayesian', 'bagging_temperature': 9.988491084170782}. Best is trial 98 with value: 0.8791208791208791.
[32m[I 2023-04-21 01:43:20,065][39m Trial 438 finished with value: 0.8636363636363636 and parameters: {'objective': 'Logloss', 'colsample_bylevel': 0.08394966658847897, 'depth': 2, 'boosting_type': 'Plain', 'bootstrap_type': 'Bayesian', 'bagging_temperature': 9.051791804675423}. Best is trial 98 with value: 0.8791208791208791.
[32m[I 2023-04-21 01:43:21,025][39m Trial 439 finished with value: 0.8764044943820225 and parameters: {'objective': 'Logloss', 'colsample_bylevel': 0.08279359371512664, 'depth': 2, 'boosting_type': 'Plain', 'bootstrap_type': 'Bayesian', 'bagging_temperature': 9.571925195367275}. Best is trial 98 with value: 0.8791208791208791.
[32m[I 2023-04-21 01:43:21,812][39m Trial 440 finished with value: 0.8636363636363636 and parameters: {'objective': 'Logloss', 'colsample_bylevel': 0.0809041830270009, 'depth': 2, 'boosting_type': 'Plain', 'bootstrap_type': 'Bayesian', 'bagging_temperature': 9.570804715112244}. Best is trial 98 with value: 0.8791208791208791.
[32m[I 2023-04-21 01:43:22,409][39m Trial 441 finished with value: 0.8666666666666666 and parameters: {'objective': 'CrossEntropy', 'colsample_bylevel': 0.08016306058738712, 'depth': 3, 'boosting_type': 'Plain', 'bootstrap_type': 'Bayesian', 'bagging_temperature': 9.996472135635075}. Best is trial 98 with value: 0.8791208791208791.
[32m[I 2023-04-21 01:43:23,256][39m Trial 442 finished with value: 0.8372093023255814 and parameters: {'objective': 'Logloss', 'colsample_bylevel': 0.0817608167831879, 'depth': 2, 'boosting_type': 'Plain', 'bootstrap_type': 'Bayesian', 'bagging_temperature': 9.37539404384514}. Best is trial 98 with value: 0.8791208791208791.
[32m[I 2023-04-21 01:43:24,064][39m Trial 443 finished with value: 0.8764044943820225 and parameters: {'objective': 'CrossEntropy', 'colsample_bylevel': 0.08296885859746053, 'depth': 2, 'boosting_type': 'Plain', 'bootstrap_type': 'Bayesian', 'bagging_temperature': 8.748202972050676}. Best is trial 98 with value: 0.8791208791208791.
[32m[I 2023-04-21 01:43:25,061][39m Trial 444 finished with value: 0.8666666666666666 and parameters: {'objective': 'CrossEntropy', 'colsample_bylevel': 0.0770885511607162, 'depth': 3, 'boosting_type': 'Plain', 'bootstrap_type': 'Bayesian', 'bagging_temperature': 9.828339930085663}. Best is trial 98 with value: 0.8791208791208791.
[32m[I 2023-04-21 01:43:26,148][39m Trial 445 finished with value: 0.8539325842696629 and parameters: {'objective': 'Logloss', 'colsample_bylevel': 0.0798380969956497, 'depth': 2, 'boosting_type': 'Plain', 'bootstrap_type': 'Bayesian', 'bagging_temperature': 9.680384826664746}. Best is trial 98 with value: 0.8791208791208791.
[32m[I 2023-04-21 01:43:26,722][39m Trial 446 finished with value: 0.8764044943820225 and parameters: {'objective': 'CrossEntropy', 'colsample_bylevel': 0.08493522208076226, 'depth': 2, 'boosting_type': 'Plain', 'bootstrap_type': 'Bayesian', 'bagging_temperature': 9.453139456259903}. Best is trial 98 with value: 0.8791208791208791.
[32m[I 2023-04-21 01:43:27,911][39m Trial 447 finished with value: 0.8539325842696629 and parameters: {'objective': 'CrossEntropy', 'colsample_bylevel': 0.08301518370974077, 'depth': 2, 'boosting_type': 'Plain', 'bootstrap_type': 'Bayesian', 'bagging_temperature': 9.344918795441908}. Best is trial 98 with value: 0.8791208791208791.
[32m[I 2023-04-21 01:43:32,512][39m Trial 448 finished with value: 0.8409090909090909 and parameters: {'objective': 'CrossEntropy', 'colsample_bylevel': 0.08490300893621072, 'depth': 2, 'boosting_type': 'Ordered', 'bootstrap_type': 'Bayesian', 'bagging_temperature': 9.41434499604884}. Best is trial 98 with value: 0.8791208791208791.
[32m[I 2023-04-21 01:43:33,353][39m Trial 449 finished with value: 0.8275862068965518 and parameters: {'objective': 'CrossEntropy', 'colsample_bylevel': 0.08651323299212207, 'depth': 1, 'boosting_type': 'Plain', 'bootstrap_type': 'Bayesian', 'bagging_temperature': 9.252619946915683}. Best is trial 98 with value: 0.8791208791208791.
[32m[I 2023-04-21 01:43:34,146][39m Trial 450 finished with value: 0.8275862068965518 and parameters: {'objective': 'Logloss', 'colsample_bylevel': 0.07052774813584897, 'depth': 4, 'boosting_type': 'Plain', 'bootstrap_type': 'Bernoulli', 'subsample': 0.7835043240724819}. Best is trial 98 with value: 0.8791208791208791.
[32m[I 2023-04-21 01:43:35,123][39m Trial 451 finished with value: 0.8539325842696629 and parameters: {'objective': 'CrossEntropy', 'colsample_bylevel': 0.09088603887824079, 'depth': 3, 'boosting_type': 'Plain', 'bootstrap_type': 'Bayesian', 'bagging_temperature': 9.030731649777161}. Best is trial 98 with value: 0.8791208791208791.
[32m[I 2023-04-21 01:43:36,175][39m Trial 452 finished with value: 0.8409090909090909 and parameters: {'objective': 'CrossEntropy', 'colsample_bylevel': 0.08774310308545845, 'depth': 11, 'boosting_type': 'Plain', 'bootstrap_type': 'Bayesian', 'bagging_temperature': 9.50044957938311}. Best is trial 98 with value: 0.8791208791208791.
[32m[I 2023-04-21 01:43:36,768][39m Trial 453 finished with value: 0.8764044943820225 and parameters: {'objective': 'CrossEntropy', 'colsample_bylevel': 0.08358673579595347, 'depth': 2, 'boosting_type': 'Plain', 'bootstrap_type': 'Bayesian', 'bagging_temperature': 9.253333886877035}. Best is trial 98 with value: 0.8791208791208791.
[32m[I 2023-04-21 01:43:37,790][39m Trial 454 finished with value: 0.8636363636363636 and parameters: {'objective': 'CrossEntropy', 'colsample_bylevel': 0.08578486203559138, 'depth': 2, 'boosting_type': 'Plain', 'bootstrap_type': 'Bayesian', 'bagging_temperature': 9.177476302772241}. Best is trial 98 with value: 0.8791208791208791.
[32m[I 2023-04-21 01:43:38,421][39m Trial 455 finished with value: 0.8666666666666666 and parameters: {'objective': 'CrossEntropy', 'colsample_bylevel': 0.08367784181271853, 'depth': 2, 'boosting_type': 'Plain', 'bootstrap_type': 'Bayesian', 'bagging_temperature': 9.995967821176217}. Best is trial 98 with value: 0.8791208791208791.
[32m[I 2023-04-21 01:43:39,344][39m Trial 456 finished with value: 0.8539325842696629 and parameters: {'objective': 'CrossEntropy', 'colsample_bylevel': 0.08662105478368697, 'depth': 2, 'boosting_type': 'Plain', 'bootstrap_type': 'MVS'}. Best is trial 98 with value: 0.8791208791208791.
[32m[I 2023-04-21 01:43:40,293][39m Trial 457 finished with value: 0.8409090909090909 and parameters: {'objective': 'CrossEntropy', 'colsample_bylevel': 0.08870699457439346, 'depth': 3, 'boosting_type': 'Plain', 'bootstrap_type': 'Bayesian', 'bagging_temperature': 8.869098699997236}. Best is trial 98 with value: 0.8791208791208791.
[32m[I 2023-04-21 01:43:41,348][39m Trial 458 finished with value: 0.8666666666666666 and parameters: {'objective': 'CrossEntropy', 'colsample_bylevel': 0.08778938540037563, 'depth': 2, 'boosting_type': 'Plain', 'bootstrap_type': 'Bayesian', 'bagging_temperature': 8.955756574686067}. Best is trial 98 with value: 0.8791208791208791.
[32m[I 2023-04-21 01:43:42,264][39m Trial 459 finished with value: 0.8636363636363636 and parameters: {'objective': 'CrossEntropy', 'colsample_bylevel': 0.09260024873350373, 'depth': 1, 'boosting_type': 'Plain', 'bootstrap_type': 'Bayesian', 'bagging_temperature': 9.79474787872941}. Best is trial 98 with value: 0.8791208791208791.
[32m[I 2023-04-21 01:43:42,782][39m Trial 460 finished with value: 0.7906976744186047 and parameters: {'objective': 'Logloss', 'colsample_bylevel': 0.01611388516960005, 'depth': 2, 'boosting_type': 'Plain', 'bootstrap_type': 'Bayesian', 'bagging_temperature': 9.542523398743276}. Best is trial 98 with value: 0.8791208791208791.
[32m[I 2023-04-21 01:43:43,373][39m Trial 461 finished with value: 0.8505747126436782 and parameters: {'objective': 'CrossEntropy', 'colsample_bylevel': 0.09988430725992484, 'depth': 2, 'boosting_type': 'Plain', 'bootstrap_type': 'Bayesian', 'bagging_temperature': 9.326940044592833}. Best is trial 98 with value: 0.8791208791208791.
[32m[I 2023-04-21 01:43:45,172][39m Trial 463 finished with value: 0.8539325842696629 and parameters: {'objective': 'Logloss', 'colsample_bylevel': 0.08130817528649592, 'depth': 2, 'boosting_type': 'Plain', 'bootstrap_type': 'Bayesian', 'bagging_temperature': 9.14444690945596}. Best is trial 98 with value: 0.8791208791208791.
