[32m[I 2023-04-21 02:48:29,181][39m Trial 3890 finished with value: 0.8539325842696629 and parameters: {'objective': 'CrossEntropy', 'colsample_bylevel': 0.08364562142758414, 'depth': 3, 'boosting_type': 'Plain', 'bootstrap_type': 'Bayesian', 'bagging_temperature': 8.999343972504574}. Best is trial 3065 with value: 0.8863636363636364.
[32m[I 2023-04-21 02:48:33,815][39m Trial 3891 finished with value: 0.8139534883720929 and parameters: {'objective': 'CrossEntropy', 'colsample_bylevel': 0.07229308559958142, 'depth': 8, 'boosting_type': 'Ordered', 'bootstrap_type': 'Bayesian', 'bagging_temperature': 9.680059148896623}. Best is trial 3065 with value: 0.8863636363636364.
[32m[I 2023-04-21 02:48:34,775][39m Trial 3892 finished with value: 0.8409090909090909 and parameters: {'objective': 'CrossEntropy', 'colsample_bylevel': 0.08831620618785865, 'depth': 4, 'boosting_type': 'Plain', 'bootstrap_type': 'Bernoulli', 'subsample': 0.1956302996817582}. Best is trial 3065 with value: 0.8863636363636364.
[32m[I 2023-04-21 02:48:35,703][39m Trial 3893 finished with value: 0.8735632183908046 and parameters: {'objective': 'CrossEntropy', 'colsample_bylevel': 0.06947336178259875, 'depth': 2, 'boosting_type': 'Plain', 'bootstrap_type': 'Bayesian', 'bagging_temperature': 8.916066632200755}. Best is trial 3065 with value: 0.8863636363636364.
[32m[I 2023-04-21 02:48:37,052][39m Trial 3894 finished with value: 0.8275862068965518 and parameters: {'objective': 'CrossEntropy', 'colsample_bylevel': 0.07137828139560809, 'depth': 8, 'boosting_type': 'Plain', 'bootstrap_type': 'Bayesian', 'bagging_temperature': 9.225777880464058}. Best is trial 3065 with value: 0.8863636363636364.
[32m[I 2023-04-21 02:48:38,220][39m Trial 3895 finished with value: 0.8409090909090909 and parameters: {'objective': 'CrossEntropy', 'colsample_bylevel': 0.08967924242176031, 'depth': 10, 'boosting_type': 'Plain', 'bootstrap_type': 'Bayesian', 'bagging_temperature': 9.614430838007241}. Best is trial 3065 with value: 0.8863636363636364.
[32m[I 2023-04-21 02:48:39,134][39m Trial 3896 finished with value: 0.8409090909090909 and parameters: {'objective': 'Logloss', 'colsample_bylevel': 0.07438645676841345, 'depth': 5, 'boosting_type': 'Plain', 'bootstrap_type': 'Bernoulli', 'subsample': 0.752067060911715}. Best is trial 3065 with value: 0.8863636363636364.
[32m[I 2023-04-21 02:48:39,830][39m Trial 3897 finished with value: 0.8409090909090909 and parameters: {'objective': 'CrossEntropy', 'colsample_bylevel': 0.06634977302478601, 'depth': 8, 'boosting_type': 'Plain', 'bootstrap_type': 'Bayesian', 'bagging_temperature': 8.771739671562054}. Best is trial 3065 with value: 0.8863636363636364.
[32m[I 2023-04-21 02:48:40,524][39m Trial 3898 finished with value: 0.8539325842696629 and parameters: {'objective': 'CrossEntropy', 'colsample_bylevel': 0.06907913878395638, 'depth': 8, 'boosting_type': 'Plain', 'bootstrap_type': 'Bayesian', 'bagging_temperature': 8.828570313105484}. Best is trial 3065 with value: 0.8863636363636364.
[32m[I 2023-04-21 02:48:41,971][39m Trial 3899 finished with value: 0.8409090909090909 and parameters: {'objective': 'Logloss', 'colsample_bylevel': 0.07453459143925488, 'depth': 11, 'boosting_type': 'Plain', 'bootstrap_type': 'Bayesian', 'bagging_temperature': 9.345949106442095}. Best is trial 3065 with value: 0.8863636363636364.
[32m[I 2023-04-21 02:48:42,655][39m Trial 3900 finished with value: 0.8539325842696629 and parameters: {'objective': 'CrossEntropy', 'colsample_bylevel': 0.07944000924571162, 'depth': 3, 'boosting_type': 'Plain', 'bootstrap_type': 'Bayesian', 'bagging_temperature': 9.768470736696887}. Best is trial 3065 with value: 0.8863636363636364.
[32m[I 2023-04-21 02:48:43,588][39m Trial 3901 finished with value: 0.8666666666666666 and parameters: {'objective': 'Logloss', 'colsample_bylevel': 0.07332116059138517, 'depth': 3, 'boosting_type': 'Plain', 'bootstrap_type': 'Bayesian', 'bagging_temperature': 8.705633612916495}. Best is trial 3065 with value: 0.8863636363636364.
[32m[I 2023-04-21 02:48:44,521][39m Trial 3902 finished with value: 0.8409090909090909 and parameters: {'objective': 'Logloss', 'colsample_bylevel': 0.07298559901060397, 'depth': 11, 'boosting_type': 'Plain', 'bootstrap_type': 'Bayesian', 'bagging_temperature': 9.637543263386185}. Best is trial 3065 with value: 0.8863636363636364.
[32m[I 2023-04-21 02:48:45,453][39m Trial 3903 finished with value: 0.8409090909090909 and parameters: {'objective': 'CrossEntropy', 'colsample_bylevel': 0.06650901290960598, 'depth': 3, 'boosting_type': 'Plain', 'bootstrap_type': 'Bayesian', 'bagging_temperature': 9.823707449270575}. Best is trial 3065 with value: 0.8863636363636364.
[32m[I 2023-04-21 02:48:46,486][39m Trial 3904 finished with value: 0.8539325842696629 and parameters: {'objective': 'CrossEntropy', 'colsample_bylevel': 0.06846515167597426, 'depth': 9, 'boosting_type': 'Plain', 'bootstrap_type': 'Bayesian', 'bagging_temperature': 9.825778597432901}. Best is trial 3065 with value: 0.8863636363636364.
[32m[I 2023-04-21 02:48:47,328][39m Trial 3905 finished with value: 0.8409090909090909 and parameters: {'objective': 'Logloss', 'colsample_bylevel': 0.07098098352553771, 'depth': 5, 'boosting_type': 'Plain', 'bootstrap_type': 'Bayesian', 'bagging_temperature': 6.21408319088786}. Best is trial 3065 with value: 0.8863636363636364.
[32m[I 2023-04-21 02:48:48,027][39m Trial 3906 finished with value: 0.7999999999999999 and parameters: {'objective': 'CrossEntropy', 'colsample_bylevel': 0.08096988594609911, 'depth': 12, 'boosting_type': 'Plain', 'bootstrap_type': 'MVS'}. Best is trial 3065 with value: 0.8863636363636364.
[32m[I 2023-04-21 02:48:49,170][39m Trial 3907 finished with value: 0.8275862068965518 and parameters: {'objective': 'CrossEntropy', 'colsample_bylevel': 0.09345259687505905, 'depth': 3, 'boosting_type': 'Plain', 'bootstrap_type': 'Bayesian', 'bagging_temperature': 9.675274177464038}. Best is trial 3065 with value: 0.8863636363636364.
[32m[I 2023-04-21 02:48:50,437][39m Trial 3908 finished with value: 0.8409090909090909 and parameters: {'objective': 'Logloss', 'colsample_bylevel': 0.08807062100931017, 'depth': 3, 'boosting_type': 'Plain', 'bootstrap_type': 'Bayesian', 'bagging_temperature': 9.999670579545748}. Best is trial 3065 with value: 0.8863636363636364.
[32m[I 2023-04-21 02:48:51,421][39m Trial 3909 finished with value: 0.8539325842696629 and parameters: {'objective': 'Logloss', 'colsample_bylevel': 0.06830063477868654, 'depth': 10, 'boosting_type': 'Plain', 'bootstrap_type': 'Bayesian', 'bagging_temperature': 9.328236962972134}. Best is trial 3065 with value: 0.8863636363636364.
[32m[I 2023-04-21 02:48:56,147][39m Trial 3910 finished with value: 0.8275862068965518 and parameters: {'objective': 'CrossEntropy', 'colsample_bylevel': 0.08995314697924037, 'depth': 3, 'boosting_type': 'Ordered', 'bootstrap_type': 'Bayesian', 'bagging_temperature': 9.633362186545424}. Best is trial 3065 with value: 0.8863636363636364.
[32m[I 2023-04-21 02:48:57,464][39m Trial 3911 finished with value: 0.8409090909090909 and parameters: {'objective': 'CrossEntropy', 'colsample_bylevel': 0.0849504069232609, 'depth': 9, 'boosting_type': 'Plain', 'bootstrap_type': 'Bayesian', 'bagging_temperature': 9.303991674114453}. Best is trial 3065 with value: 0.8863636363636364.
[32m[I 2023-04-21 02:48:58,763][39m Trial 3912 finished with value: 0.8409090909090909 and parameters: {'objective': 'CrossEntropy', 'colsample_bylevel': 0.07954005078451382, 'depth': 12, 'boosting_type': 'Plain', 'bootstrap_type': 'Bayesian', 'bagging_temperature': 9.761343508659916}. Best is trial 3065 with value: 0.8863636363636364.
[32m[I 2023-04-21 02:48:59,987][39m Trial 3913 finished with value: 0.8539325842696629 and parameters: {'objective': 'CrossEntropy', 'colsample_bylevel': 0.07877459165490364, 'depth': 12, 'boosting_type': 'Plain', 'bootstrap_type': 'Bayesian', 'bagging_temperature': 9.9823791313652}. Best is trial 3065 with value: 0.8863636363636364.
[32m[I 2023-04-21 02:49:01,099][39m Trial 3914 finished with value: 0.8539325842696629 and parameters: {'objective': 'CrossEntropy', 'colsample_bylevel': 0.07889481003192442, 'depth': 9, 'boosting_type': 'Plain', 'bootstrap_type': 'Bayesian', 'bagging_temperature': 9.51093832810165}. Best is trial 3065 with value: 0.8863636363636364.
[32m[I 2023-04-21 02:49:01,805][39m Trial 3915 finished with value: 0.8791208791208791 and parameters: {'objective': 'CrossEntropy', 'colsample_bylevel': 0.08038761705569084, 'depth': 3, 'boosting_type': 'Plain', 'bootstrap_type': 'Bayesian', 'bagging_temperature': 9.1094182259733}. Best is trial 3065 with value: 0.8863636363636364.
[32m[I 2023-04-21 02:49:02,373][39m Trial 3916 finished with value: 0.7674418604651163 and parameters: {'objective': 'Logloss', 'colsample_bylevel': 0.019190637107383966, 'depth': 6, 'boosting_type': 'Plain', 'bootstrap_type': 'Bayesian', 'bagging_temperature': 8.019200014500127}. Best is trial 3065 with value: 0.8863636363636364.
[32m[I 2023-04-21 02:49:03,176][39m Trial 3917 finished with value: 0.8539325842696629 and parameters: {'objective': 'CrossEntropy', 'colsample_bylevel': 0.08715631587696926, 'depth': 2, 'boosting_type': 'Plain', 'bootstrap_type': 'Bayesian', 'bagging_temperature': 9.563054213069787}. Best is trial 3065 with value: 0.8863636363636364.
[32m[I 2023-04-21 02:49:04,297][39m Trial 3918 finished with value: 0.8539325842696629 and parameters: {'objective': 'CrossEntropy', 'colsample_bylevel': 0.07314620414929231, 'depth': 4, 'boosting_type': 'Plain', 'bootstrap_type': 'Bayesian', 'bagging_temperature': 5.507567472509464}. Best is trial 3065 with value: 0.8863636363636364.
[32m[I 2023-04-21 02:49:05,661][39m Trial 3919 finished with value: 0.8505747126436782 and parameters: {'objective': 'CrossEntropy', 'colsample_bylevel': 0.0822826298585317, 'depth': 9, 'boosting_type': 'Plain', 'bootstrap_type': 'Bayesian', 'bagging_temperature': 9.99841002748461}. Best is trial 3065 with value: 0.8863636363636364.
[32m[I 2023-04-21 02:49:06,744][39m Trial 3920 finished with value: 0.8666666666666666 and parameters: {'objective': 'CrossEntropy', 'colsample_bylevel': 0.0762751926765403, 'depth': 9, 'boosting_type': 'Plain', 'bootstrap_type': 'Bayesian', 'bagging_temperature': 9.985175101324211}. Best is trial 3065 with value: 0.8863636363636364.
[32m[I 2023-04-21 02:49:07,481][39m Trial 3921 finished with value: 0.8539325842696629 and parameters: {'objective': 'CrossEntropy', 'colsample_bylevel': 0.07818844033385375, 'depth': 10, 'boosting_type': 'Plain', 'bootstrap_type': 'Bayesian', 'bagging_temperature': 9.664014208683987}. Best is trial 3065 with value: 0.8863636363636364.
[32m[I 2023-04-21 02:49:08,290][39m Trial 3922 finished with value: 0.8409090909090909 and parameters: {'objective': 'CrossEntropy', 'colsample_bylevel': 0.07275611680245951, 'depth': 11, 'boosting_type': 'Plain', 'bootstrap_type': 'Bayesian', 'bagging_temperature': 9.657204536442926}. Best is trial 3065 with value: 0.8863636363636364.
[32m[I 2023-04-21 02:49:09,571][39m Trial 3923 finished with value: 0.8505747126436782 and parameters: {'objective': 'Logloss', 'colsample_bylevel': 0.08166676785674089, 'depth': 10, 'boosting_type': 'Plain', 'bootstrap_type': 'Bayesian', 'bagging_temperature': 9.03639879208999}. Best is trial 3065 with value: 0.8863636363636364.
[32m[I 2023-04-21 02:49:10,677][39m Trial 3924 finished with value: 0.8764044943820225 and parameters: {'objective': 'CrossEntropy', 'colsample_bylevel': 0.07620472249499348, 'depth': 2, 'boosting_type': 'Plain', 'bootstrap_type': 'Bayesian', 'bagging_temperature': 9.78221121816502}. Best is trial 3065 with value: 0.8863636363636364.
[32m[I 2023-04-21 02:49:12,303][39m Trial 3925 finished with value: 0.8275862068965518 and parameters: {'objective': 'Logloss', 'colsample_bylevel': 0.07651368588393306, 'depth': 9, 'boosting_type': 'Plain', 'bootstrap_type': 'MVS'}. Best is trial 3065 with value: 0.8863636363636364.
[32m[I 2023-04-21 02:49:13,247][39m Trial 3926 finished with value: 0.7999999999999999 and parameters: {'objective': 'CrossEntropy', 'colsample_bylevel': 0.07280878834704499, 'depth': 9, 'boosting_type': 'Plain', 'bootstrap_type': 'Bayesian', 'bagging_temperature': 9.480827381374658}. Best is trial 3065 with value: 0.8863636363636364.
[32m[I 2023-04-21 02:49:14,094][39m Trial 3927 finished with value: 0.8292682926829268 and parameters: {'objective': 'Logloss', 'colsample_bylevel': 0.014064499054311404, 'depth': 3, 'boosting_type': 'Plain', 'bootstrap_type': 'Bayesian', 'bagging_temperature': 9.452064443836399}. Best is trial 3065 with value: 0.8863636363636364.
[32m[I 2023-04-21 02:49:15,219][39m Trial 3928 finished with value: 0.8636363636363636 and parameters: {'objective': 'CrossEntropy', 'colsample_bylevel': 0.08697223588040309, 'depth': 10, 'boosting_type': 'Plain', 'bootstrap_type': 'Bayesian', 'bagging_temperature': 9.380817704491424}. Best is trial 3065 with value: 0.8863636363636364.
[32m[I 2023-04-21 02:49:19,534][39m Trial 3929 finished with value: 0.8045977011494252 and parameters: {'objective': 'CrossEntropy', 'colsample_bylevel': 0.08438933640089798, 'depth': 3, 'boosting_type': 'Ordered', 'bootstrap_type': 'Bayesian', 'bagging_temperature': 9.3894197392747}. Best is trial 3065 with value: 0.8863636363636364.
[32m[I 2023-04-21 02:49:20,702][39m Trial 3930 finished with value: 0.8275862068965518 and parameters: {'objective': 'CrossEntropy', 'colsample_bylevel': 0.0722397796181498, 'depth': 7, 'boosting_type': 'Plain', 'bootstrap_type': 'MVS'}. Best is trial 3065 with value: 0.8863636363636364.
[32m[I 2023-04-21 02:49:22,109][39m Trial 3931 finished with value: 0.8604651162790697 and parameters: {'objective': 'CrossEntropy', 'colsample_bylevel': 0.03961612541329043, 'depth': 10, 'boosting_type': 'Plain', 'bootstrap_type': 'Bayesian', 'bagging_temperature': 9.79955651000911}. Best is trial 3065 with value: 0.8863636363636364.
[32m[I 2023-04-21 02:49:22,968][39m Trial 3932 finished with value: 0.8666666666666666 and parameters: {'objective': 'CrossEntropy', 'colsample_bylevel': 0.0671376261369272, 'depth': 12, 'boosting_type': 'Plain', 'bootstrap_type': 'Bayesian', 'bagging_temperature': 9.15669908969014}. Best is trial 3065 with value: 0.8863636363636364.
[32m[I 2023-04-21 02:49:23,645][39m Trial 3933 finished with value: 0.8409090909090909 and parameters: {'objective': 'CrossEntropy', 'colsample_bylevel': 0.08282350268699012, 'depth': 10, 'boosting_type': 'Plain', 'bootstrap_type': 'Bayesian', 'bagging_temperature': 9.765965490885646}. Best is trial 3065 with value: 0.8863636363636364.
[32m[I 2023-04-21 02:49:24,650][39m Trial 3934 finished with value: 0.8666666666666666 and parameters: {'objective': 'CrossEntropy', 'colsample_bylevel': 0.07792066552029708, 'depth': 3, 'boosting_type': 'Plain', 'bootstrap_type': 'Bayesian', 'bagging_temperature': 8.700551433178266}. Best is trial 3065 with value: 0.8863636363636364.
[32m[I 2023-04-21 02:49:25,833][39m Trial 3935 finished with value: 0.8275862068965518 and parameters: {'objective': 'CrossEntropy', 'colsample_bylevel': 0.07933515028958357, 'depth': 10, 'boosting_type': 'Plain', 'bootstrap_type': 'Bayesian', 'bagging_temperature': 9.326979344573756}. Best is trial 3065 with value: 0.8863636363636364.
[32m[I 2023-04-21 02:49:27,106][39m Trial 3936 finished with value: 0.7999999999999999 and parameters: {'objective': 'Logloss', 'colsample_bylevel': 0.07552794644180688, 'depth': 10, 'boosting_type': 'Plain', 'bootstrap_type': 'Bernoulli', 'subsample': 0.9657209548990995}. Best is trial 3065 with value: 0.8863636363636364.
[32m[I 2023-04-21 02:49:28,277][39m Trial 3937 finished with value: 0.8666666666666666 and parameters: {'objective': 'CrossEntropy', 'colsample_bylevel': 0.08059839239755934, 'depth': 3, 'boosting_type': 'Plain', 'bootstrap_type': 'Bayesian', 'bagging_temperature': 8.929707882210469}. Best is trial 3065 with value: 0.8863636363636364.
[32m[I 2023-04-21 02:49:29,437][39m Trial 3938 finished with value: 0.8666666666666666 and parameters: {'objective': 'Logloss', 'colsample_bylevel': 0.073461535710957, 'depth': 10, 'boosting_type': 'Plain', 'bootstrap_type': 'Bayesian', 'bagging_temperature': 9.331273315671416}. Best is trial 3065 with value: 0.8863636363636364.
[32m[I 2023-04-21 02:49:30,301][39m Trial 3939 finished with value: 0.8666666666666666 and parameters: {'objective': 'CrossEntropy', 'colsample_bylevel': 0.07701044428475338, 'depth': 4, 'boosting_type': 'Plain', 'bootstrap_type': 'Bayesian', 'bagging_temperature': 9.996801374169758}. Best is trial 3065 with value: 0.8863636363636364.
[32m[I 2023-04-21 02:49:31,110][39m Trial 3940 finished with value: 0.8791208791208791 and parameters: {'objective': 'CrossEntropy', 'colsample_bylevel': 0.0784985874957547, 'depth': 10, 'boosting_type': 'Plain', 'bootstrap_type': 'Bayesian', 'bagging_temperature': 9.360001239647877}. Best is trial 3065 with value: 0.8863636363636364.
[32m[I 2023-04-21 02:49:31,774][39m Trial 3941 finished with value: 0.8409090909090909 and parameters: {'objective': 'CrossEntropy', 'colsample_bylevel': 0.08310393881895435, 'depth': 6, 'boosting_type': 'Plain', 'bootstrap_type': 'Bayesian', 'bagging_temperature': 9.225120152394561}. Best is trial 3065 with value: 0.8863636363636364.
[32m[I 2023-04-21 02:49:32,439][39m Trial 3942 finished with value: 0.8409090909090909 and parameters: {'objective': 'CrossEntropy', 'colsample_bylevel': 0.0751011170384348, 'depth': 12, 'boosting_type': 'Plain', 'bootstrap_type': 'Bayesian', 'bagging_temperature': 8.998995651007492}. Best is trial 3065 with value: 0.8863636363636364.
[32m[I 2023-04-21 02:49:33,680][39m Trial 3943 finished with value: 0.8539325842696629 and parameters: {'objective': 'Logloss', 'colsample_bylevel': 0.0712782941154878, 'depth': 8, 'boosting_type': 'Plain', 'bootstrap_type': 'Bayesian', 'bagging_temperature': 9.249665716226257}. Best is trial 3065 with value: 0.8863636363636364.
[32m[I 2023-04-21 02:49:34,710][39m Trial 3944 finished with value: 0.7906976744186047 and parameters: {'objective': 'Logloss', 'colsample_bylevel': 0.08715710636786052, 'depth': 1, 'boosting_type': 'Plain', 'bootstrap_type': 'Bayesian', 'bagging_temperature': 8.564552092451956}. Best is trial 3065 with value: 0.8863636363636364.
[32m[I 2023-04-21 02:49:36,063][39m Trial 3945 finished with value: 0.8314606741573034 and parameters: {'objective': 'CrossEntropy', 'colsample_bylevel': 0.06521771298399459, 'depth': 4, 'boosting_type': 'Plain', 'bootstrap_type': 'MVS'}. Best is trial 3065 with value: 0.8863636363636364.
[32m[I 2023-04-21 02:49:37,056][39m Trial 3946 finished with value: 0.8539325842696629 and parameters: {'objective': 'CrossEntropy', 'colsample_bylevel': 0.0744440829833168, 'depth': 4, 'boosting_type': 'Plain', 'bootstrap_type': 'Bayesian', 'bagging_temperature': 9.635019499978615}. Best is trial 3065 with value: 0.8863636363636364.
[32m[I 2023-04-21 02:49:37,718][39m Trial 3947 finished with value: 0.8409090909090909 and parameters: {'objective': 'Logloss', 'colsample_bylevel': 0.07139801299361671, 'depth': 8, 'boosting_type': 'Plain', 'bootstrap_type': 'Bayesian', 'bagging_temperature': 8.727853888022782}. Best is trial 3065 with value: 0.8863636363636364.
[32m[I 2023-04-21 02:49:39,249][39m Trial 3948 finished with value: 0.8409090909090909 and parameters: {'objective': 'CrossEntropy', 'colsample_bylevel': 0.07567781347749288, 'depth': 9, 'boosting_type': 'Plain', 'bootstrap_type': 'Bayesian', 'bagging_temperature': 9.684541206848374}. Best is trial 3065 with value: 0.8863636363636364.
[32m[I 2023-04-21 02:49:40,194][39m Trial 3949 finished with value: 0.8222222222222222 and parameters: {'objective': 'CrossEntropy', 'colsample_bylevel': 0.05031118405289927, 'depth': 3, 'boosting_type': 'Plain', 'bootstrap_type': 'MVS'}. Best is trial 3065 with value: 0.8863636363636364.
[32m[I 2023-04-21 02:49:44,898][39m Trial 3950 finished with value: 0.8409090909090909 and parameters: {'objective': 'CrossEntropy', 'colsample_bylevel': 0.07539051161736042, 'depth': 10, 'boosting_type': 'Ordered', 'bootstrap_type': 'Bayesian', 'bagging_temperature': 9.614423655788464}. Best is trial 3065 with value: 0.8863636363636364.
[32m[I 2023-04-21 02:49:46,193][39m Trial 3951 finished with value: 0.8409090909090909 and parameters: {'objective': 'CrossEntropy', 'colsample_bylevel': 0.08507107848304038, 'depth': 8, 'boosting_type': 'Plain', 'bootstrap_type': 'Bayesian', 'bagging_temperature': 9.511700791958447}. Best is trial 3065 with value: 0.8863636363636364.
[32m[I 2023-04-21 02:49:47,395][39m Trial 3952 finished with value: 0.8539325842696629 and parameters: {'objective': 'CrossEntropy', 'colsample_bylevel': 0.07263826718724738, 'depth': 8, 'boosting_type': 'Plain', 'bootstrap_type': 'Bayesian', 'bagging_temperature': 9.512049980289053}. Best is trial 3065 with value: 0.8863636363636364.
[32m[I 2023-04-21 02:49:48,340][39m Trial 3953 finished with value: 0.8791208791208791 and parameters: {'objective': 'CrossEntropy', 'colsample_bylevel': 0.07345654331833382, 'depth': 4, 'boosting_type': 'Plain', 'bootstrap_type': 'Bayesian', 'bagging_temperature': 9.563155872659838}. Best is trial 3065 with value: 0.8863636363636364.
[32m[I 2023-04-21 02:49:49,223][39m Trial 3954 finished with value: 0.8409090909090909 and parameters: {'objective': 'Logloss', 'colsample_bylevel': 0.0912573416587805, 'depth': 4, 'boosting_type': 'Plain', 'bootstrap_type': 'Bayesian', 'bagging_temperature': 9.819093281094961}. Best is trial 3065 with value: 0.8863636363636364.
