[32m[I 2023-04-21 03:04:30,508][39m Trial 4674 finished with value: 0.8539325842696629 and parameters: {'objective': 'CrossEntropy', 'colsample_bylevel': 0.06641395002465446, 'depth': 10, 'boosting_type': 'Plain', 'bootstrap_type': 'MVS'}. Best is trial 3065 with value: 0.8863636363636364.
[32m[I 2023-04-21 03:04:31,241][39m Trial 4675 finished with value: 0.8409090909090909 and parameters: {'objective': 'Logloss', 'colsample_bylevel': 0.08219934777852832, 'depth': 10, 'boosting_type': 'Plain', 'bootstrap_type': 'Bayesian', 'bagging_temperature': 9.471632360106678}. Best is trial 3065 with value: 0.8863636363636364.
[32m[I 2023-04-21 03:04:32,596][39m Trial 4676 finished with value: 0.8735632183908046 and parameters: {'objective': 'Logloss', 'colsample_bylevel': 0.06994590502288299, 'depth': 10, 'boosting_type': 'Plain', 'bootstrap_type': 'Bayesian', 'bagging_temperature': 9.386080506172718}. Best is trial 3065 with value: 0.8863636363636364.
[32m[I 2023-04-21 03:04:33,839][39m Trial 4677 finished with value: 0.8666666666666666 and parameters: {'objective': 'Logloss', 'colsample_bylevel': 0.06523816254008794, 'depth': 9, 'boosting_type': 'Plain', 'bootstrap_type': 'Bayesian', 'bagging_temperature': 9.188241032180823}. Best is trial 3065 with value: 0.8863636363636364.
[32m[I 2023-04-21 03:04:34,547][39m Trial 4678 finished with value: 0.8764044943820225 and parameters: {'objective': 'CrossEntropy', 'colsample_bylevel': 0.08186445430118086, 'depth': 2, 'boosting_type': 'Plain', 'bootstrap_type': 'Bayesian', 'bagging_temperature': 9.444872928511534}. Best is trial 3065 with value: 0.8863636363636364.
[32m[I 2023-04-21 03:04:35,826][39m Trial 4679 finished with value: 0.8539325842696629 and parameters: {'objective': 'CrossEntropy', 'colsample_bylevel': 0.07881207340019222, 'depth': 10, 'boosting_type': 'Plain', 'bootstrap_type': 'Bayesian', 'bagging_temperature': 9.261393758717897}. Best is trial 3065 with value: 0.8863636363636364.
[32m[I 2023-04-21 03:04:36,941][39m Trial 4680 finished with value: 0.8764044943820225 and parameters: {'objective': 'CrossEntropy', 'colsample_bylevel': 0.08337381821150543, 'depth': 2, 'boosting_type': 'Plain', 'bootstrap_type': 'Bayesian', 'bagging_temperature': 9.760150436967987}. Best is trial 3065 with value: 0.8863636363636364.
[32m[I 2023-04-21 03:04:41,299][39m Trial 4681 finished with value: 0.8275862068965518 and parameters: {'objective': 'CrossEntropy', 'colsample_bylevel': 0.08834979384697025, 'depth': 10, 'boosting_type': 'Ordered', 'bootstrap_type': 'Bernoulli', 'subsample': 0.17879404011351752}. Best is trial 3065 with value: 0.8863636363636364.
[32m[I 2023-04-21 03:04:42,689][39m Trial 4682 finished with value: 0.8409090909090909 and parameters: {'objective': 'CrossEntropy', 'colsample_bylevel': 0.08021551689821224, 'depth': 9, 'boosting_type': 'Plain', 'bootstrap_type': 'Bayesian', 'bagging_temperature': 8.779257919686223}. Best is trial 3065 with value: 0.8863636363636364.
[32m[I 2023-04-21 03:04:44,017][39m Trial 4683 finished with value: 0.8539325842696629 and parameters: {'objective': 'CrossEntropy', 'colsample_bylevel': 0.07541920055531462, 'depth': 10, 'boosting_type': 'Plain', 'bootstrap_type': 'Bayesian', 'bagging_temperature': 9.995292033099627}. Best is trial 3065 with value: 0.8863636363636364.
[32m[I 2023-04-21 03:04:44,930][39m Trial 4684 finished with value: 0.8139534883720929 and parameters: {'objective': 'CrossEntropy', 'colsample_bylevel': 0.07047569917986551, 'depth': 12, 'boosting_type': 'Plain', 'bootstrap_type': 'Bayesian', 'bagging_temperature': 8.327339720237758}. Best is trial 3065 with value: 0.8863636363636364.
[32m[I 2023-04-21 03:04:45,637][39m Trial 4685 finished with value: 0.8409090909090909 and parameters: {'objective': 'CrossEntropy', 'colsample_bylevel': 0.08027531736992102, 'depth': 8, 'boosting_type': 'Plain', 'bootstrap_type': 'Bayesian', 'bagging_temperature': 9.347237147192395}. Best is trial 3065 with value: 0.8863636363636364.
[32m[I 2023-04-21 03:04:47,029][39m Trial 4686 finished with value: 0.8539325842696629 and parameters: {'objective': 'CrossEntropy', 'colsample_bylevel': 0.08242456889509131, 'depth': 3, 'boosting_type': 'Plain', 'bootstrap_type': 'Bayesian', 'bagging_temperature': 9.004530951494132}. Best is trial 3065 with value: 0.8863636363636364.
[32m[I 2023-04-21 03:04:48,193][39m Trial 4687 finished with value: 0.8666666666666666 and parameters: {'objective': 'Logloss', 'colsample_bylevel': 0.07961072591888987, 'depth': 3, 'boosting_type': 'Plain', 'bootstrap_type': 'Bayesian', 'bagging_temperature': 9.795753082305184}. Best is trial 3065 with value: 0.8863636363636364.
[32m[I 2023-04-21 03:04:49,131][39m Trial 4688 finished with value: 0.8666666666666666 and parameters: {'objective': 'Logloss', 'colsample_bylevel': 0.07487088757780765, 'depth': 12, 'boosting_type': 'Plain', 'bootstrap_type': 'Bayesian', 'bagging_temperature': 9.205186897073531}. Best is trial 3065 with value: 0.8863636363636364.
[32m[I 2023-04-21 03:04:50,173][39m Trial 4689 finished with value: 0.8409090909090909 and parameters: {'objective': 'CrossEntropy', 'colsample_bylevel': 0.08415297158848485, 'depth': 3, 'boosting_type': 'Plain', 'bootstrap_type': 'Bayesian', 'bagging_temperature': 9.560099646915384}. Best is trial 3065 with value: 0.8863636363636364.
[32m[I 2023-04-21 03:04:51,181][39m Trial 4690 finished with value: 0.8409090909090909 and parameters: {'objective': 'CrossEntropy', 'colsample_bylevel': 0.06867424788426396, 'depth': 10, 'boosting_type': 'Plain', 'bootstrap_type': 'MVS'}. Best is trial 3065 with value: 0.8863636363636364.
[32m[I 2023-04-21 03:04:51,864][39m Trial 4691 finished with value: 0.8139534883720929 and parameters: {'objective': 'CrossEntropy', 'colsample_bylevel': 0.08753589759642781, 'depth': 11, 'boosting_type': 'Plain', 'bootstrap_type': 'Bayesian', 'bagging_temperature': 9.586704123081695}. Best is trial 3065 with value: 0.8863636363636364.
[32m[I 2023-04-21 03:04:52,509][39m Trial 4692 finished with value: 0.8409090909090909 and parameters: {'objective': 'CrossEntropy', 'colsample_bylevel': 0.06736715553393013, 'depth': 11, 'boosting_type': 'Plain', 'bootstrap_type': 'Bayesian', 'bagging_temperature': 9.31717514131484}. Best is trial 3065 with value: 0.8863636363636364.
[32m[I 2023-04-21 03:04:53,675][39m Trial 4693 finished with value: 0.8666666666666666 and parameters: {'objective': 'CrossEntropy', 'colsample_bylevel': 0.08093776735763253, 'depth': 3, 'boosting_type': 'Plain', 'bootstrap_type': 'Bayesian', 'bagging_temperature': 9.073467315540128}. Best is trial 3065 with value: 0.8863636363636364.
[32m[I 2023-04-21 03:04:54,578][39m Trial 4694 finished with value: 0.8275862068965518 and parameters: {'objective': 'CrossEntropy', 'colsample_bylevel': 0.07188835375883143, 'depth': 4, 'boosting_type': 'Plain', 'bootstrap_type': 'Bayesian', 'bagging_temperature': 8.026419461052996}. Best is trial 3065 with value: 0.8863636363636364.
[32m[I 2023-04-21 03:04:55,628][39m Trial 4695 finished with value: 0.8539325842696629 and parameters: {'objective': 'Logloss', 'colsample_bylevel': 0.06876080919583866, 'depth': 4, 'boosting_type': 'Plain', 'bootstrap_type': 'Bayesian', 'bagging_temperature': 9.189285316733203}. Best is trial 3065 with value: 0.8863636363636364.
[32m[I 2023-04-21 03:04:56,734][39m Trial 4696 finished with value: 0.8666666666666666 and parameters: {'objective': 'Logloss', 'colsample_bylevel': 0.07506588920163722, 'depth': 10, 'boosting_type': 'Plain', 'bootstrap_type': 'Bayesian', 'bagging_temperature': 9.689991736338811}. Best is trial 3065 with value: 0.8863636363636364.
[32m[I 2023-04-21 03:04:58,087][39m Trial 4697 finished with value: 0.8409090909090909 and parameters: {'objective': 'CrossEntropy', 'colsample_bylevel': 0.09540212390090821, 'depth': 7, 'boosting_type': 'Plain', 'bootstrap_type': 'Bayesian', 'bagging_temperature': 7.053629136166336}. Best is trial 3065 with value: 0.8863636363636364.
[32m[I 2023-04-21 03:04:59,023][39m Trial 4698 finished with value: 0.8666666666666666 and parameters: {'objective': 'Logloss', 'colsample_bylevel': 0.0862700306101594, 'depth': 3, 'boosting_type': 'Plain', 'bootstrap_type': 'Bayesian', 'bagging_temperature': 8.030987826152712}. Best is trial 3065 with value: 0.8863636363636364.
[32m[I 2023-04-21 03:05:03,297][39m Trial 4699 finished with value: 0.8139534883720929 and parameters: {'objective': 'Logloss', 'colsample_bylevel': 0.06999609669643177, 'depth': 10, 'boosting_type': 'Ordered', 'bootstrap_type': 'Bayesian', 'bagging_temperature': 9.013156318865313}. Best is trial 3065 with value: 0.8863636363636364.
[32m[I 2023-04-21 03:05:04,326][39m Trial 4700 finished with value: 0.8139534883720929 and parameters: {'objective': 'CrossEntropy', 'colsample_bylevel': 0.07475319486829572, 'depth': 10, 'boosting_type': 'Plain', 'bootstrap_type': 'Bayesian', 'bagging_temperature': 5.99210405433271}. Best is trial 3065 with value: 0.8863636363636364.
[32m[I 2023-04-21 03:05:05,597][39m Trial 4701 finished with value: 0.8666666666666666 and parameters: {'objective': 'CrossEntropy', 'colsample_bylevel': 0.08467304925527545, 'depth': 2, 'boosting_type': 'Plain', 'bootstrap_type': 'Bayesian', 'bagging_temperature': 9.727697076802247}. Best is trial 3065 with value: 0.8863636363636364.
[32m[I 2023-04-21 03:05:06,657][39m Trial 4702 finished with value: 0.8409090909090909 and parameters: {'objective': 'CrossEntropy', 'colsample_bylevel': 0.07984007063885512, 'depth': 10, 'boosting_type': 'Plain', 'bootstrap_type': 'Bayesian', 'bagging_temperature': 8.940392107032952}. Best is trial 3065 with value: 0.8863636363636364.
[32m[I 2023-04-21 03:05:07,930][39m Trial 4703 finished with value: 0.8539325842696629 and parameters: {'objective': 'Logloss', 'colsample_bylevel': 0.06310305527416726, 'depth': 5, 'boosting_type': 'Plain', 'bootstrap_type': 'MVS'}. Best is trial 3065 with value: 0.8863636363636364.
[32m[I 2023-04-21 03:05:08,854][39m Trial 4704 finished with value: 0.8636363636363636 and parameters: {'objective': 'CrossEntropy', 'colsample_bylevel': 0.08847584146426976, 'depth': 11, 'boosting_type': 'Plain', 'bootstrap_type': 'Bayesian', 'bagging_temperature': 9.45493250718028}. Best is trial 3065 with value: 0.8863636363636364.
[32m[I 2023-04-21 03:05:10,051][39m Trial 4705 finished with value: 0.8636363636363636 and parameters: {'objective': 'CrossEntropy', 'colsample_bylevel': 0.08884537046905315, 'depth': 11, 'boosting_type': 'Plain', 'bootstrap_type': 'Bayesian', 'bagging_temperature': 9.432026378395745}. Best is trial 3065 with value: 0.8863636363636364.
[32m[I 2023-04-21 03:05:11,127][39m Trial 4706 finished with value: 0.8539325842696629 and parameters: {'objective': 'CrossEntropy', 'colsample_bylevel': 0.08866738101843685, 'depth': 11, 'boosting_type': 'Plain', 'bootstrap_type': 'Bayesian', 'bagging_temperature': 9.593822054611683}. Best is trial 3065 with value: 0.8863636363636364.
[32m[I 2023-04-21 03:05:12,112][39m Trial 4707 finished with value: 0.8539325842696629 and parameters: {'objective': 'CrossEntropy', 'colsample_bylevel': 0.07400796205380701, 'depth': 12, 'boosting_type': 'Plain', 'bootstrap_type': 'Bayesian', 'bagging_temperature': 8.658957639344594}. Best is trial 3065 with value: 0.8863636363636364.
[32m[I 2023-04-21 03:05:13,308][39m Trial 4708 finished with value: 0.8409090909090909 and parameters: {'objective': 'CrossEntropy', 'colsample_bylevel': 0.07717680847254552, 'depth': 4, 'boosting_type': 'Plain', 'bootstrap_type': 'Bernoulli', 'subsample': 0.937302128060056}. Best is trial 3065 with value: 0.8863636363636364.
[32m[I 2023-04-21 03:05:14,047][39m Trial 4709 finished with value: 0.8539325842696629 and parameters: {'objective': 'CrossEntropy', 'colsample_bylevel': 0.0946995147677967, 'depth': 4, 'boosting_type': 'Plain', 'bootstrap_type': 'Bayesian', 'bagging_temperature': 9.289925489094818}. Best is trial 3065 with value: 0.8863636363636364.
[32m[I 2023-04-21 03:05:14,715][39m Trial 4710 finished with value: 0.8275862068965518 and parameters: {'objective': 'Logloss', 'colsample_bylevel': 0.08282338931234268, 'depth': 5, 'boosting_type': 'Plain', 'bootstrap_type': 'Bayesian', 'bagging_temperature': 9.454292676192678}. Best is trial 3065 with value: 0.8863636363636364.
[32m[I 2023-04-21 03:05:15,561][39m Trial 4711 finished with value: 0.8539325842696629 and parameters: {'objective': 'Logloss', 'colsample_bylevel': 0.07498202935152541, 'depth': 10, 'boosting_type': 'Plain', 'bootstrap_type': 'Bayesian', 'bagging_temperature': 9.438226635933374}. Best is trial 3065 with value: 0.8863636363636364.
[32m[I 2023-04-21 03:05:16,256][39m Trial 4712 finished with value: 0.8275862068965518 and parameters: {'objective': 'Logloss', 'colsample_bylevel': 0.08220039782887466, 'depth': 5, 'boosting_type': 'Plain', 'bootstrap_type': 'Bayesian', 'bagging_temperature': 9.41767312439392}. Best is trial 3065 with value: 0.8863636363636364.
[32m[I 2023-04-21 03:05:17,297][39m Trial 4713 finished with value: 0.8505747126436782 and parameters: {'objective': 'CrossEntropy', 'colsample_bylevel': 0.0736246669729868, 'depth': 11, 'boosting_type': 'Plain', 'bootstrap_type': 'Bayesian', 'bagging_temperature': 9.52044821901476}. Best is trial 3065 with value: 0.8863636363636364.
[32m[I 2023-04-21 03:05:18,392][39m Trial 4714 finished with value: 0.8275862068965518 and parameters: {'objective': 'CrossEntropy', 'colsample_bylevel': 0.08030763375685483, 'depth': 6, 'boosting_type': 'Plain', 'bootstrap_type': 'Bayesian', 'bagging_temperature': 8.966283511650008}. Best is trial 3065 with value: 0.8863636363636364.
[32m[I 2023-04-21 03:05:19,862][39m Trial 4715 finished with value: 0.8372093023255814 and parameters: {'objective': 'CrossEntropy', 'colsample_bylevel': 0.0839742446262142, 'depth': 3, 'boosting_type': 'Plain', 'bootstrap_type': 'Bayesian', 'bagging_temperature': 9.428738710335953}. Best is trial 3065 with value: 0.8863636363636364.
[32m[I 2023-04-21 03:05:20,922][39m Trial 4716 finished with value: 0.8539325842696629 and parameters: {'objective': 'CrossEntropy', 'colsample_bylevel': 0.07202876511932284, 'depth': 4, 'boosting_type': 'Plain', 'bootstrap_type': 'Bayesian', 'bagging_temperature': 9.249518888287867}. Best is trial 3065 with value: 0.8863636363636364.
[32m[I 2023-04-21 03:05:26,186][39m Trial 4717 finished with value: 0.8409090909090909 and parameters: {'objective': 'Logloss', 'colsample_bylevel': 0.07842050676120832, 'depth': 5, 'boosting_type': 'Ordered', 'bootstrap_type': 'Bayesian', 'bagging_temperature': 8.92912011598532}. Best is trial 3065 with value: 0.8863636363636364.
[32m[I 2023-04-21 03:05:27,515][39m Trial 4718 finished with value: 0.8539325842696629 and parameters: {'objective': 'Logloss', 'colsample_bylevel': 0.06837740809288617, 'depth': 6, 'boosting_type': 'Plain', 'bootstrap_type': 'Bayesian', 'bagging_temperature': 9.388688958035512}. Best is trial 3065 with value: 0.8863636363636364.
[32m[I 2023-04-21 03:05:28,528][39m Trial 4719 finished with value: 0.8539325842696629 and parameters: {'objective': 'Logloss', 'colsample_bylevel': 0.06962689202719949, 'depth': 4, 'boosting_type': 'Plain', 'bootstrap_type': 'Bayesian', 'bagging_temperature': 9.176743168845482}. Best is trial 3065 with value: 0.8863636363636364.
[32m[I 2023-04-21 03:05:29,482][39m Trial 4720 finished with value: 0.8666666666666666 and parameters: {'objective': 'CrossEntropy', 'colsample_bylevel': 0.08228521736865496, 'depth': 3, 'boosting_type': 'Plain', 'bootstrap_type': 'Bayesian', 'bagging_temperature': 9.16859691825863}. Best is trial 3065 with value: 0.8863636363636364.
[32m[I 2023-04-21 03:05:30,165][39m Trial 4721 finished with value: 0.8409090909090909 and parameters: {'objective': 'Logloss', 'colsample_bylevel': 0.07515196934346303, 'depth': 4, 'boosting_type': 'Plain', 'bootstrap_type': 'MVS'}. Best is trial 3065 with value: 0.8863636363636364.
[32m[I 2023-04-21 03:05:30,992][39m Trial 4722 finished with value: 0.8666666666666666 and parameters: {'objective': 'CrossEntropy', 'colsample_bylevel': 0.08169387036091179, 'depth': 3, 'boosting_type': 'Plain', 'bootstrap_type': 'Bernoulli', 'subsample': 0.2806244401472836}. Best is trial 3065 with value: 0.8863636363636364.
[32m[I 2023-04-21 03:05:31,778][39m Trial 4723 finished with value: 0.8275862068965518 and parameters: {'objective': 'CrossEntropy', 'colsample_bylevel': 0.07311093687359833, 'depth': 10, 'boosting_type': 'Plain', 'bootstrap_type': 'Bayesian', 'bagging_temperature': 9.122688480741923}. Best is trial 3065 with value: 0.8863636363636364.
[32m[I 2023-04-21 03:05:33,027][39m Trial 4724 finished with value: 0.8275862068965518 and parameters: {'objective': 'Logloss', 'colsample_bylevel': 0.08338464665113779, 'depth': 11, 'boosting_type': 'Plain', 'bootstrap_type': 'Bayesian', 'bagging_temperature': 8.883385713578063}. Best is trial 3065 with value: 0.8863636363636364.
[32m[I 2023-04-21 03:05:34,081][39m Trial 4725 finished with value: 0.8275862068965518 and parameters: {'objective': 'Logloss', 'colsample_bylevel': 0.08366711032735104, 'depth': 10, 'boosting_type': 'Plain', 'bootstrap_type': 'Bayesian', 'bagging_temperature': 8.753271918088403}. Best is trial 3065 with value: 0.8863636363636364.
[32m[I 2023-04-21 03:05:35,290][39m Trial 4726 finished with value: 0.8666666666666666 and parameters: {'objective': 'CrossEntropy', 'colsample_bylevel': 0.0809946912562408, 'depth': 3, 'boosting_type': 'Plain', 'bootstrap_type': 'Bayesian', 'bagging_temperature': 9.248419997371673}. Best is trial 3065 with value: 0.8863636363636364.
[32m[I 2023-04-21 03:05:36,272][39m Trial 4727 finished with value: 0.8 and parameters: {'objective': 'CrossEntropy', 'colsample_bylevel': 0.08294104608636188, 'depth': 1, 'boosting_type': 'Plain', 'bootstrap_type': 'MVS'}. Best is trial 3065 with value: 0.8863636363636364.
[32m[I 2023-04-21 03:05:37,291][39m Trial 4728 finished with value: 0.8235294117647058 and parameters: {'objective': 'CrossEntropy', 'colsample_bylevel': 0.085822943311806, 'depth': 9, 'boosting_type': 'Plain', 'bootstrap_type': 'Bayesian', 'bagging_temperature': 9.654756752263456}. Best is trial 3065 with value: 0.8863636363636364.
[32m[I 2023-04-21 03:05:38,186][39m Trial 4729 finished with value: 0.8666666666666666 and parameters: {'objective': 'CrossEntropy', 'colsample_bylevel': 0.09170189197542351, 'depth': 3, 'boosting_type': 'Plain', 'bootstrap_type': 'Bayesian', 'bagging_temperature': 8.647147568910135}. Best is trial 3065 with value: 0.8863636363636364.
[32m[I 2023-04-21 03:05:39,104][39m Trial 4730 finished with value: 0.8636363636363636 and parameters: {'objective': 'CrossEntropy', 'colsample_bylevel': 0.08689518226096031, 'depth': 2, 'boosting_type': 'Plain', 'bootstrap_type': 'Bayesian', 'bagging_temperature': 9.65850363311926}. Best is trial 3065 with value: 0.8863636363636364.
[32m[I 2023-04-21 03:05:40,246][39m Trial 4731 finished with value: 0.8235294117647058 and parameters: {'objective': 'CrossEntropy', 'colsample_bylevel': 0.07666853971945072, 'depth': 10, 'boosting_type': 'Plain', 'bootstrap_type': 'Bayesian', 'bagging_temperature': 9.204785839525107}. Best is trial 3065 with value: 0.8863636363636364.
[32m[I 2023-04-21 03:05:41,525][39m Trial 4732 finished with value: 0.7954545454545454 and parameters: {'objective': 'CrossEntropy', 'colsample_bylevel': 0.011702866406184044, 'depth': 7, 'boosting_type': 'Plain', 'bootstrap_type': 'Bayesian', 'bagging_temperature': 9.275525812567118}. Best is trial 3065 with value: 0.8863636363636364.
[32m[I 2023-04-21 03:05:42,686][39m Trial 4733 finished with value: 0.8139534883720929 and parameters: {'objective': 'Logloss', 'colsample_bylevel': 0.0765601865882996, 'depth': 10, 'boosting_type': 'Plain', 'bootstrap_type': 'Bayesian', 'bagging_temperature': 2.034611082676018}. Best is trial 3065 with value: 0.8863636363636364.
[32m[I 2023-04-21 03:05:43,393][39m Trial 4734 finished with value: 0.8666666666666666 and parameters: {'objective': 'Logloss', 'colsample_bylevel': 0.07372369722177596, 'depth': 4, 'boosting_type': 'Plain', 'bootstrap_type': 'Bayesian', 'bagging_temperature': 8.646973269407448}. Best is trial 3065 with value: 0.8863636363636364.
[32m[I 2023-04-21 03:05:44,563][39m Trial 4735 finished with value: 0.8409090909090909 and parameters: {'objective': 'Logloss', 'colsample_bylevel': 0.07272053560525739, 'depth': 11, 'boosting_type': 'Plain', 'bootstrap_type': 'Bayesian', 'bagging_temperature': 9.042160243500973}. Best is trial 3065 with value: 0.8863636363636364.
[32m[I 2023-04-21 03:05:49,057][39m Trial 4736 finished with value: 0.8275862068965518 and parameters: {'objective': 'CrossEntropy', 'colsample_bylevel': 0.08449057751814223, 'depth': 10, 'boosting_type': 'Ordered', 'bootstrap_type': 'Bayesian', 'bagging_temperature': 9.505744239857025}. Best is trial 3065 with value: 0.8863636363636364.
[32m[I 2023-04-21 03:05:50,067][39m Trial 4737 finished with value: 0.8764044943820225 and parameters: {'objective': 'Logloss', 'colsample_bylevel': 0.07336173910638451, 'depth': 10, 'boosting_type': 'Plain', 'bootstrap_type': 'Bayesian', 'bagging_temperature': 7.9659152869270775}. Best is trial 3065 with value: 0.8863636363636364.
[32m[I 2023-04-21 03:05:51,043][39m Trial 4738 finished with value: 0.8409090909090909 and parameters: {'objective': 'CrossEntropy', 'colsample_bylevel': 0.07308190583377158, 'depth': 11, 'boosting_type': 'Plain', 'bootstrap_type': 'Bayesian', 'bagging_temperature': 9.546481280802944}. Best is trial 3065 with value: 0.8863636363636364.
