[32m[I 2023-04-21 03:14:04,440][39m Trial 5131 finished with value: 0.8539325842696629 and parameters: {'objective': 'CrossEntropy', 'colsample_bylevel': 0.08362138095449129, 'depth': 3, 'boosting_type': 'Plain', 'bootstrap_type': 'Bayesian', 'bagging_temperature': 9.136509206093006}. Best is trial 3065 with value: 0.8863636363636364.
[32m[I 2023-04-21 03:14:05,331][39m Trial 5132 finished with value: 0.8409090909090909 and parameters: {'objective': 'Logloss', 'colsample_bylevel': 0.07916517048372329, 'depth': 10, 'boosting_type': 'Plain', 'bootstrap_type': 'Bayesian', 'bagging_temperature': 9.366613817974304}. Best is trial 3065 with value: 0.8863636363636364.
[32m[I 2023-04-21 03:14:06,384][39m Trial 5133 finished with value: 0.8666666666666666 and parameters: {'objective': 'CrossEntropy', 'colsample_bylevel': 0.07883819879713773, 'depth': 3, 'boosting_type': 'Plain', 'bootstrap_type': 'Bayesian', 'bagging_temperature': 9.091002561483664}. Best is trial 3065 with value: 0.8863636363636364.
[32m[I 2023-04-21 03:14:07,775][39m Trial 5134 finished with value: 0.8181818181818182 and parameters: {'objective': 'Logloss', 'colsample_bylevel': 0.07287440475596775, 'depth': 5, 'boosting_type': 'Plain', 'bootstrap_type': 'MVS'}. Best is trial 3065 with value: 0.8863636363636364.
[32m[I 2023-04-21 03:14:09,022][39m Trial 5135 finished with value: 0.8666666666666666 and parameters: {'objective': 'CrossEntropy', 'colsample_bylevel': 0.08451563672898882, 'depth': 3, 'boosting_type': 'Plain', 'bootstrap_type': 'Bayesian', 'bagging_temperature': 9.639715054697959}. Best is trial 3065 with value: 0.8863636363636364.
[32m[I 2023-04-21 03:14:10,120][39m Trial 5136 finished with value: 0.8409090909090909 and parameters: {'objective': 'Logloss', 'colsample_bylevel': 0.07380289062648715, 'depth': 4, 'boosting_type': 'Plain', 'bootstrap_type': 'Bayesian', 'bagging_temperature': 9.753937622267676}. Best is trial 3065 with value: 0.8863636363636364.
[32m[I 2023-04-21 03:14:11,076][39m Trial 5137 finished with value: 0.8139534883720929 and parameters: {'objective': 'CrossEntropy', 'colsample_bylevel': 0.07208421960086886, 'depth': 9, 'boosting_type': 'Plain', 'bootstrap_type': 'Bernoulli', 'subsample': 0.6323437159801273}. Best is trial 3065 with value: 0.8863636363636364.
[32m[I 2023-04-21 03:14:11,854][39m Trial 5138 finished with value: 0.8636363636363636 and parameters: {'objective': 'CrossEntropy', 'colsample_bylevel': 0.08736574611115057, 'depth': 7, 'boosting_type': 'Plain', 'bootstrap_type': 'Bayesian', 'bagging_temperature': 9.402923146952642}. Best is trial 3065 with value: 0.8863636363636364.
[32m[I 2023-04-21 03:14:13,059][39m Trial 5139 finished with value: 0.8409090909090909 and parameters: {'objective': 'CrossEntropy', 'colsample_bylevel': 0.07057507700470651, 'depth': 9, 'boosting_type': 'Plain', 'bootstrap_type': 'Bayesian', 'bagging_temperature': 9.760532614491972}. Best is trial 3065 with value: 0.8863636363636364.
[32m[I 2023-04-21 03:14:13,994][39m Trial 5140 finished with value: 0.8666666666666666 and parameters: {'objective': 'CrossEntropy', 'colsample_bylevel': 0.0736173404809972, 'depth': 9, 'boosting_type': 'Plain', 'bootstrap_type': 'Bayesian', 'bagging_temperature': 9.538324110117602}. Best is trial 3065 with value: 0.8863636363636364.
[32m[I 2023-04-21 03:14:15,363][39m Trial 5141 finished with value: 0.8539325842696629 and parameters: {'objective': 'Logloss', 'colsample_bylevel': 0.07078819708796819, 'depth': 5, 'boosting_type': 'Plain', 'bootstrap_type': 'Bayesian', 'bagging_temperature': 6.4918062363411515}. Best is trial 3065 with value: 0.8863636363636364.
[32m[I 2023-04-21 03:14:16,454][39m Trial 5142 finished with value: 0.8539325842696629 and parameters: {'objective': 'CrossEntropy', 'colsample_bylevel': 0.09138789442228193, 'depth': 3, 'boosting_type': 'Plain', 'bootstrap_type': 'Bayesian', 'bagging_temperature': 9.46197168374911}. Best is trial 3065 with value: 0.8863636363636364.
[32m[I 2023-04-21 03:14:17,558][39m Trial 5143 finished with value: 0.8139534883720929 and parameters: {'objective': 'CrossEntropy', 'colsample_bylevel': 0.08843905288729136, 'depth': 1, 'boosting_type': 'Plain', 'bootstrap_type': 'Bayesian', 'bagging_temperature': 9.76116925739416}. Best is trial 3065 with value: 0.8863636363636364.
[32m[I 2023-04-21 03:14:18,621][39m Trial 5144 finished with value: 0.8275862068965518 and parameters: {'objective': 'CrossEntropy', 'colsample_bylevel': 0.07297991039982242, 'depth': 9, 'boosting_type': 'Plain', 'bootstrap_type': 'Bayesian', 'bagging_temperature': 9.704613542690353}. Best is trial 3065 with value: 0.8863636363636364.
[32m[I 2023-04-21 03:14:19,317][39m Trial 5145 finished with value: 0.8409090909090909 and parameters: {'objective': 'CrossEntropy', 'colsample_bylevel': 0.08314635948280169, 'depth': 4, 'boosting_type': 'Plain', 'bootstrap_type': 'Bayesian', 'bagging_temperature': 9.624754437314516}. Best is trial 3065 with value: 0.8863636363636364.
[32m[I 2023-04-21 03:14:19,986][39m Trial 5146 finished with value: 0.8539325842696629 and parameters: {'objective': 'Logloss', 'colsample_bylevel': 0.06480011280455643, 'depth': 10, 'boosting_type': 'Plain', 'bootstrap_type': 'Bayesian', 'bagging_temperature': 9.346787654679835}. Best is trial 3065 with value: 0.8863636363636364.
[32m[I 2023-04-21 03:14:21,193][39m Trial 5147 finished with value: 0.8505747126436782 and parameters: {'objective': 'Logloss', 'colsample_bylevel': 0.07647583296956992, 'depth': 4, 'boosting_type': 'Plain', 'bootstrap_type': 'Bayesian', 'bagging_temperature': 5.768272802483138}. Best is trial 3065 with value: 0.8863636363636364.
[32m[I 2023-04-21 03:14:22,548][39m Trial 5148 finished with value: 0.8666666666666666 and parameters: {'objective': 'Logloss', 'colsample_bylevel': 0.0766019615400327, 'depth': 4, 'boosting_type': 'Plain', 'bootstrap_type': 'Bayesian', 'bagging_temperature': 8.475697477761626}. Best is trial 3065 with value: 0.8863636363636364.
[32m[I 2023-04-21 03:14:23,650][39m Trial 5149 finished with value: 0.8539325842696629 and parameters: {'objective': 'CrossEntropy', 'colsample_bylevel': 0.08535257808758982, 'depth': 2, 'boosting_type': 'Plain', 'bootstrap_type': 'Bayesian', 'bagging_temperature': 8.48785529729768}. Best is trial 3065 with value: 0.8863636363636364.
[32m[I 2023-04-21 03:14:25,458][39m Trial 5150 finished with value: 0.8409090909090909 and parameters: {'objective': 'CrossEntropy', 'colsample_bylevel': 0.07521567079671328, 'depth': 9, 'boosting_type': 'Plain', 'bootstrap_type': 'Bayesian', 'bagging_temperature': 9.755905248728787}. Best is trial 3065 with value: 0.8863636363636364.
[32m[I 2023-04-21 03:14:29,930][39m Trial 5151 finished with value: 0.8139534883720929 and parameters: {'objective': 'CrossEntropy', 'colsample_bylevel': 0.0756898150826013, 'depth': 11, 'boosting_type': 'Ordered', 'bootstrap_type': 'Bayesian', 'bagging_temperature': 8.932047917840519}. Best is trial 3065 with value: 0.8863636363636364.
[32m[I 2023-04-21 03:14:31,020][39m Trial 5152 finished with value: 0.8539325842696629 and parameters: {'objective': 'CrossEntropy', 'colsample_bylevel': 0.05859389410471013, 'depth': 6, 'boosting_type': 'Plain', 'bootstrap_type': 'MVS'}. Best is trial 3065 with value: 0.8863636363636364.
[32m[I 2023-04-21 03:14:32,346][39m Trial 5153 finished with value: 0.8539325842696629 and parameters: {'objective': 'CrossEntropy', 'colsample_bylevel': 0.06791636926443885, 'depth': 7, 'boosting_type': 'Plain', 'bootstrap_type': 'Bayesian', 'bagging_temperature': 9.806623102701874}. Best is trial 3065 with value: 0.8863636363636364.
[32m[I 2023-04-21 03:14:33,299][39m Trial 5154 finished with value: 0.8539325842696629 and parameters: {'objective': 'Logloss', 'colsample_bylevel': 0.09294298682015396, 'depth': 2, 'boosting_type': 'Plain', 'bootstrap_type': 'Bayesian', 'bagging_temperature': 5.087754759910405}. Best is trial 3065 with value: 0.8863636363636364.
[32m[I 2023-04-21 03:14:33,970][39m Trial 5155 finished with value: 0.8409090909090909 and parameters: {'objective': 'CrossEntropy', 'colsample_bylevel': 0.08419468713636037, 'depth': 3, 'boosting_type': 'Plain', 'bootstrap_type': 'Bayesian', 'bagging_temperature': 9.502834507685822}. Best is trial 3065 with value: 0.8863636363636364.
[32m[I 2023-04-21 03:14:34,710][39m Trial 5156 finished with value: 0.8539325842696629 and parameters: {'objective': 'CrossEntropy', 'colsample_bylevel': 0.08415826771463825, 'depth': 3, 'boosting_type': 'Plain', 'bootstrap_type': 'Bayesian', 'bagging_temperature': 8.893229483151751}. Best is trial 3065 with value: 0.8863636363636364.
[32m[I 2023-04-21 03:14:35,680][39m Trial 5157 finished with value: 0.8764044943820225 and parameters: {'objective': 'CrossEntropy', 'colsample_bylevel': 0.052609209940598575, 'depth': 3, 'boosting_type': 'Plain', 'bootstrap_type': 'Bayesian', 'bagging_temperature': 9.614447023353023}. Best is trial 3065 with value: 0.8863636363636364.
[32m[I 2023-04-21 03:14:36,709][39m Trial 5158 finished with value: 0.8045977011494252 and parameters: {'objective': 'CrossEntropy', 'colsample_bylevel': 0.06813443024308685, 'depth': 8, 'boosting_type': 'Plain', 'bootstrap_type': 'Bernoulli', 'subsample': 0.591507111450135}. Best is trial 3065 with value: 0.8863636363636364.
[32m[I 2023-04-21 03:14:37,883][39m Trial 5159 finished with value: 0.8409090909090909 and parameters: {'objective': 'CrossEntropy', 'colsample_bylevel': 0.06802940987895137, 'depth': 7, 'boosting_type': 'Plain', 'bootstrap_type': 'Bayesian', 'bagging_temperature': 8.976349952713838}. Best is trial 3065 with value: 0.8863636363636364.
[32m[I 2023-04-21 03:14:39,121][39m Trial 5160 finished with value: 0.8275862068965518 and parameters: {'objective': 'CrossEntropy', 'colsample_bylevel': 0.0853948637767683, 'depth': 3, 'boosting_type': 'Plain', 'bootstrap_type': 'Bayesian', 'bagging_temperature': 9.129625195503243}. Best is trial 3065 with value: 0.8863636363636364.
[32m[I 2023-04-21 03:14:40,404][39m Trial 5161 finished with value: 0.8539325842696629 and parameters: {'objective': 'Logloss', 'colsample_bylevel': 0.07154126960028133, 'depth': 11, 'boosting_type': 'Plain', 'bootstrap_type': 'Bayesian', 'bagging_temperature': 9.618263864336965}. Best is trial 3065 with value: 0.8863636363636364.
[32m[I 2023-04-21 03:14:41,137][39m Trial 5162 finished with value: 0.8666666666666666 and parameters: {'objective': 'CrossEntropy', 'colsample_bylevel': 0.08326320985341519, 'depth': 3, 'boosting_type': 'Plain', 'bootstrap_type': 'Bayesian', 'bagging_temperature': 4.463529164923539}. Best is trial 3065 with value: 0.8863636363636364.
[32m[I 2023-04-21 03:14:42,009][39m Trial 5163 finished with value: 0.8539325842696629 and parameters: {'objective': 'Logloss', 'colsample_bylevel': 0.07437947328345755, 'depth': 10, 'boosting_type': 'Plain', 'bootstrap_type': 'Bayesian', 'bagging_temperature': 6.042929129301646}. Best is trial 3065 with value: 0.8863636363636364.
[32m[I 2023-04-21 03:14:42,960][39m Trial 5164 finished with value: 0.8409090909090909 and parameters: {'objective': 'CrossEntropy', 'colsample_bylevel': 0.0760082080048945, 'depth': 10, 'boosting_type': 'Plain', 'bootstrap_type': 'Bayesian', 'bagging_temperature': 4.852349913043452}. Best is trial 3065 with value: 0.8863636363636364.
[32m[I 2023-04-21 03:14:44,216][39m Trial 5165 finished with value: 0.8539325842696629 and parameters: {'objective': 'Logloss', 'colsample_bylevel': 0.07541708514755716, 'depth': 10, 'boosting_type': 'Plain', 'bootstrap_type': 'Bayesian', 'bagging_temperature': 8.442264506297084}. Best is trial 3065 with value: 0.8863636363636364.
[32m[I 2023-04-21 03:14:45,590][39m Trial 5166 finished with value: 0.8275862068965518 and parameters: {'objective': 'CrossEntropy', 'colsample_bylevel': 0.07836411078465769, 'depth': 11, 'boosting_type': 'Plain', 'bootstrap_type': 'Bayesian', 'bagging_temperature': 9.168553108667146}. Best is trial 3065 with value: 0.8863636363636364.
[32m[I 2023-04-21 03:14:50,336][39m Trial 5167 finished with value: 0.8666666666666666 and parameters: {'objective': 'CrossEntropy', 'colsample_bylevel': 0.09709200153783829, 'depth': 8, 'boosting_type': 'Ordered', 'bootstrap_type': 'MVS'}. Best is trial 3065 with value: 0.8863636363636364.
[32m[I 2023-04-21 03:14:51,506][39m Trial 5168 finished with value: 0.8666666666666666 and parameters: {'objective': 'Logloss', 'colsample_bylevel': 0.07335140744049123, 'depth': 10, 'boosting_type': 'Plain', 'bootstrap_type': 'Bayesian', 'bagging_temperature': 9.766751631505281}. Best is trial 3065 with value: 0.8863636363636364.
[32m[I 2023-04-21 03:14:53,011][39m Trial 5169 finished with value: 0.8791208791208791 and parameters: {'objective': 'CrossEntropy', 'colsample_bylevel': 0.06726167353173632, 'depth': 9, 'boosting_type': 'Plain', 'bootstrap_type': 'Bayesian', 'bagging_temperature': 9.80773236632065}. Best is trial 3065 with value: 0.8863636363636364.
[32m[I 2023-04-21 03:14:54,422][39m Trial 5170 finished with value: 0.8666666666666666 and parameters: {'objective': 'CrossEntropy', 'colsample_bylevel': 0.06416457989431927, 'depth': 9, 'boosting_type': 'Plain', 'bootstrap_type': 'Bayesian', 'bagging_temperature': 9.989482466283738}. Best is trial 3065 with value: 0.8863636363636364.
[32m[I 2023-04-21 03:14:55,370][39m Trial 5171 finished with value: 0.8409090909090909 and parameters: {'objective': 'CrossEntropy', 'colsample_bylevel': 0.08851031505713806, 'depth': 9, 'boosting_type': 'Plain', 'bootstrap_type': 'Bayesian', 'bagging_temperature': 2.5020604783716642}. Best is trial 3065 with value: 0.8863636363636364.
[32m[I 2023-04-21 03:14:56,045][39m Trial 5172 finished with value: 0.8666666666666666 and parameters: {'objective': 'CrossEntropy', 'colsample_bylevel': 0.07973044447969334, 'depth': 2, 'boosting_type': 'Plain', 'bootstrap_type': 'Bayesian', 'bagging_temperature': 7.97178026069731}. Best is trial 3065 with value: 0.8863636363636364.
[32m[I 2023-04-21 03:14:57,240][39m Trial 5173 finished with value: 0.8275862068965518 and parameters: {'objective': 'Logloss', 'colsample_bylevel': 0.07034589149418462, 'depth': 11, 'boosting_type': 'Plain', 'bootstrap_type': 'Bayesian', 'bagging_temperature': 9.16328458768213}. Best is trial 3065 with value: 0.8863636363636364.
[32m[I 2023-04-21 03:14:58,530][39m Trial 5174 finished with value: 0.8666666666666666 and parameters: {'objective': 'CrossEntropy', 'colsample_bylevel': 0.07220873175768913, 'depth': 11, 'boosting_type': 'Plain', 'bootstrap_type': 'Bayesian', 'bagging_temperature': 9.562679914615979}. Best is trial 3065 with value: 0.8863636363636364.
[32m[I 2023-04-21 03:14:59,989][39m Trial 5175 finished with value: 0.8409090909090909 and parameters: {'objective': 'CrossEntropy', 'colsample_bylevel': 0.08008592523824491, 'depth': 8, 'boosting_type': 'Plain', 'bootstrap_type': 'Bayesian', 'bagging_temperature': 8.97545687569478}. Best is trial 3065 with value: 0.8863636363636364.
[32m[I 2023-04-21 03:15:01,204][39m Trial 5176 finished with value: 0.8275862068965518 and parameters: {'objective': 'CrossEntropy', 'colsample_bylevel': 0.0873996390796184, 'depth': 1, 'boosting_type': 'Plain', 'bootstrap_type': 'Bayesian', 'bagging_temperature': 3.783870161605619}. Best is trial 3065 with value: 0.8863636363636364.
[32m[I 2023-04-21 03:15:01,927][39m Trial 5177 finished with value: 0.8764044943820225 and parameters: {'objective': 'CrossEntropy', 'colsample_bylevel': 0.07567109284885738, 'depth': 11, 'boosting_type': 'Plain', 'bootstrap_type': 'Bayesian', 'bagging_temperature': 9.591710963547946}. Best is trial 3065 with value: 0.8863636363636364.
[32m[I 2023-04-21 03:15:02,595][39m Trial 5178 finished with value: 0.8505747126436782 and parameters: {'objective': 'CrossEntropy', 'colsample_bylevel': 0.0559578387746145, 'depth': 4, 'boosting_type': 'Plain', 'bootstrap_type': 'Bayesian', 'bagging_temperature': 9.4692048952712}. Best is trial 3065 with value: 0.8863636363636364.
[32m[I 2023-04-21 03:15:04,019][39m Trial 5179 finished with value: 0.8666666666666666 and parameters: {'objective': 'CrossEntropy', 'colsample_bylevel': 0.08509543067070145, 'depth': 3, 'boosting_type': 'Plain', 'bootstrap_type': 'Bayesian', 'bagging_temperature': 9.397598518965559}. Best is trial 3065 with value: 0.8863636363636364.
[32m[I 2023-04-21 03:15:05,279][39m Trial 5180 finished with value: 0.8539325842696629 and parameters: {'objective': 'CrossEntropy', 'colsample_bylevel': 0.07550004398510758, 'depth': 11, 'boosting_type': 'Plain', 'bootstrap_type': 'Bayesian', 'bagging_temperature': 9.993439035576767}. Best is trial 3065 with value: 0.8863636363636364.
[32m[I 2023-04-21 03:15:06,494][39m Trial 5181 finished with value: 0.8409090909090909 and parameters: {'objective': 'CrossEntropy', 'colsample_bylevel': 0.07702940305358487, 'depth': 9, 'boosting_type': 'Plain', 'bootstrap_type': 'Bayesian', 'bagging_temperature': 9.577982605648543}. Best is trial 3065 with value: 0.8863636363636364.
[32m[I 2023-04-21 03:15:07,848][39m Trial 5182 finished with value: 0.8539325842696629 and parameters: {'objective': 'Logloss', 'colsample_bylevel': 0.07302789482741776, 'depth': 10, 'boosting_type': 'Plain', 'bootstrap_type': 'Bayesian', 'bagging_temperature': 9.987371015235611}. Best is trial 3065 with value: 0.8863636363636364.
[32m[I 2023-04-21 03:15:09,189][39m Trial 5183 finished with value: 0.8409090909090909 and parameters: {'objective': 'CrossEntropy', 'colsample_bylevel': 0.07532000412574727, 'depth': 9, 'boosting_type': 'Plain', 'bootstrap_type': 'Bayesian', 'bagging_temperature': 9.689070871197252}. Best is trial 3065 with value: 0.8863636363636364.
[32m[I 2023-04-21 03:15:09,894][39m Trial 5184 finished with value: 0.8409090909090909 and parameters: {'objective': 'CrossEntropy', 'colsample_bylevel': 0.08117516458921517, 'depth': 10, 'boosting_type': 'Plain', 'bootstrap_type': 'Bayesian', 'bagging_temperature': 9.357038663900603}. Best is trial 3065 with value: 0.8863636363636364.
[32m[I 2023-04-21 03:15:14,850][39m Trial 5185 finished with value: 0.8131868131868132 and parameters: {'objective': 'CrossEntropy', 'colsample_bylevel': 0.08182162266329615, 'depth': 3, 'boosting_type': 'Ordered', 'bootstrap_type': 'MVS'}. Best is trial 3065 with value: 0.8863636363636364.
[32m[I 2023-04-21 03:15:15,982][39m Trial 5186 finished with value: 0.8539325842696629 and parameters: {'objective': 'CrossEntropy', 'colsample_bylevel': 0.08331481660436256, 'depth': 3, 'boosting_type': 'Plain', 'bootstrap_type': 'Bayesian', 'bagging_temperature': 9.556776123509072}. Best is trial 3065 with value: 0.8863636363636364.
[32m[I 2023-04-21 03:15:17,056][39m Trial 5187 finished with value: 0.8139534883720929 and parameters: {'objective': 'CrossEntropy', 'colsample_bylevel': 0.061006287436727105, 'depth': 3, 'boosting_type': 'Plain', 'bootstrap_type': 'Bernoulli', 'subsample': 0.3479316887532662}. Best is trial 3065 with value: 0.8863636363636364.
[32m[I 2023-04-21 03:15:18,483][39m Trial 5188 finished with value: 0.8409090909090909 and parameters: {'objective': 'Logloss', 'colsample_bylevel': 0.09043972624644778, 'depth': 10, 'boosting_type': 'Plain', 'bootstrap_type': 'Bayesian', 'bagging_temperature': 9.717964503386032}. Best is trial 3065 with value: 0.8863636363636364.
[32m[I 2023-04-21 03:15:19,489][39m Trial 5189 finished with value: 0.8444444444444446 and parameters: {'objective': 'Logloss', 'colsample_bylevel': 0.0743724913508705, 'depth': 4, 'boosting_type': 'Plain', 'bootstrap_type': 'MVS'}. Best is trial 3065 with value: 0.8863636363636364.
[32m[I 2023-04-21 03:15:20,565][39m Trial 5190 finished with value: 0.8539325842696629 and parameters: {'objective': 'Logloss', 'colsample_bylevel': 0.07383789247731419, 'depth': 4, 'boosting_type': 'Plain', 'bootstrap_type': 'Bayesian', 'bagging_temperature': 6.230093781601205}. Best is trial 3065 with value: 0.8863636363636364.
[32m[I 2023-04-21 03:15:21,704][39m Trial 5191 finished with value: 0.8539325842696629 and parameters: {'objective': 'Logloss', 'colsample_bylevel': 0.08954183198229149, 'depth': 3, 'boosting_type': 'Plain', 'bootstrap_type': 'Bayesian', 'bagging_temperature': 9.560053313064827}. Best is trial 3065 with value: 0.8863636363636364.
[32m[I 2023-04-21 03:15:23,008][39m Trial 5192 finished with value: 0.8791208791208791 and parameters: {'objective': 'CrossEntropy', 'colsample_bylevel': 0.08520452471349099, 'depth': 3, 'boosting_type': 'Plain', 'bootstrap_type': 'Bayesian', 'bagging_temperature': 9.313271108333229}. Best is trial 3065 with value: 0.8863636363636364.
[32m[I 2023-04-21 03:15:24,209][39m Trial 5193 finished with value: 0.8539325842696629 and parameters: {'objective': 'Logloss', 'colsample_bylevel': 0.07545388795600198, 'depth': 6, 'boosting_type': 'Plain', 'bootstrap_type': 'Bayesian', 'bagging_temperature': 9.782482133670415}. Best is trial 3065 with value: 0.8863636363636364.
[32m[I 2023-04-21 03:15:24,909][39m Trial 5194 finished with value: 0.8791208791208791 and parameters: {'objective': 'CrossEntropy', 'colsample_bylevel': 0.08706269305407419, 'depth': 3, 'boosting_type': 'Plain', 'bootstrap_type': 'Bayesian', 'bagging_temperature': 9.816748128499132}. Best is trial 3065 with value: 0.8863636363636364.
[32m[I 2023-04-21 03:15:25,785][39m Trial 5195 finished with value: 0.8666666666666666 and parameters: {'objective': 'CrossEntropy', 'colsample_bylevel': 0.08585810330534434, 'depth': 3, 'boosting_type': 'Plain', 'bootstrap_type': 'Bayesian', 'bagging_temperature': 9.070071421940122}. Best is trial 3065 with value: 0.8863636363636364.
