[32m[I 2023-04-21 02:08:59,320][39m Trial 1851 finished with value: 0.8666666666666666 and parameters: {'objective': 'CrossEntropy', 'colsample_bylevel': 0.07159043140744321, 'depth': 3, 'boosting_type': 'Plain', 'bootstrap_type': 'Bayesian', 'bagging_temperature': 8.807202735431662}. Best is trial 98 with value: 0.8791208791208791.
[32m[I 2023-04-21 02:09:00,076][39m Trial 1852 finished with value: 0.8539325842696629 and parameters: {'objective': 'CrossEntropy', 'colsample_bylevel': 0.07669810584362705, 'depth': 3, 'boosting_type': 'Plain', 'bootstrap_type': 'Bayesian', 'bagging_temperature': 8.831157446491417}. Best is trial 98 with value: 0.8791208791208791.
[32m[I 2023-04-21 02:09:01,056][39m Trial 1853 finished with value: 0.8666666666666666 and parameters: {'objective': 'Logloss', 'colsample_bylevel': 0.08814446032422837, 'depth': 3, 'boosting_type': 'Plain', 'bootstrap_type': 'Bayesian', 'bagging_temperature': 8.188930573800002}. Best is trial 98 with value: 0.8791208791208791.
[32m[I 2023-04-21 02:09:01,840][39m Trial 1854 finished with value: 0.8409090909090909 and parameters: {'objective': 'CrossEntropy', 'colsample_bylevel': 0.07857434863004263, 'depth': 3, 'boosting_type': 'Plain', 'bootstrap_type': 'MVS'}. Best is trial 98 with value: 0.8791208791208791.
[32m[I 2023-04-21 02:09:02,804][39m Trial 1855 finished with value: 0.8666666666666666 and parameters: {'objective': 'CrossEntropy', 'colsample_bylevel': 0.0779692972682629, 'depth': 3, 'boosting_type': 'Plain', 'bootstrap_type': 'Bayesian', 'bagging_temperature': 8.57540162019377}. Best is trial 98 with value: 0.8791208791208791.
[32m[I 2023-04-21 02:09:03,724][39m Trial 1856 finished with value: 0.8275862068965518 and parameters: {'objective': 'CrossEntropy', 'colsample_bylevel': 0.08320668634580056, 'depth': 10, 'boosting_type': 'Plain', 'bootstrap_type': 'Bayesian', 'bagging_temperature': 9.385856287450567}. Best is trial 98 with value: 0.8791208791208791.
[32m[I 2023-04-21 02:09:04,466][39m Trial 1857 finished with value: 0.8409090909090909 and parameters: {'objective': 'CrossEntropy', 'colsample_bylevel': 0.08100706327780392, 'depth': 12, 'boosting_type': 'Plain', 'bootstrap_type': 'Bayesian', 'bagging_temperature': 9.07441153478086}. Best is trial 98 with value: 0.8791208791208791.
[32m[I 2023-04-21 02:09:05,636][39m Trial 1858 finished with value: 0.8666666666666666 and parameters: {'objective': 'CrossEntropy', 'colsample_bylevel': 0.08083340612325486, 'depth': 3, 'boosting_type': 'Plain', 'bootstrap_type': 'Bayesian', 'bagging_temperature': 9.551580832974738}. Best is trial 98 with value: 0.8791208791208791.
[32m[I 2023-04-21 02:09:06,412][39m Trial 1859 finished with value: 0.8275862068965518 and parameters: {'objective': 'Logloss', 'colsample_bylevel': 0.08059966871355223, 'depth': 6, 'boosting_type': 'Plain', 'bootstrap_type': 'Bayesian', 'bagging_temperature': 9.05749456588489}. Best is trial 98 with value: 0.8791208791208791.
[32m[I 2023-04-21 02:09:11,575][39m Trial 1860 finished with value: 0.8409090909090909 and parameters: {'objective': 'CrossEntropy', 'colsample_bylevel': 0.08404743628848613, 'depth': 4, 'boosting_type': 'Ordered', 'bootstrap_type': 'Bayesian', 'bagging_temperature': 9.28207203366696}. Best is trial 98 with value: 0.8791208791208791.
[32m[I 2023-04-21 02:09:12,979][39m Trial 1861 finished with value: 0.8666666666666666 and parameters: {'objective': 'Logloss', 'colsample_bylevel': 0.07269894581246933, 'depth': 4, 'boosting_type': 'Plain', 'bootstrap_type': 'Bayesian', 'bagging_temperature': 8.124031558831877}. Best is trial 98 with value: 0.8791208791208791.
[32m[I 2023-04-21 02:09:14,088][39m Trial 1862 finished with value: 0.8409090909090909 and parameters: {'objective': 'CrossEntropy', 'colsample_bylevel': 0.077101960485762, 'depth': 9, 'boosting_type': 'Plain', 'bootstrap_type': 'Bayesian', 'bagging_temperature': 9.183835108550458}. Best is trial 98 with value: 0.8791208791208791.
[32m[I 2023-04-21 02:09:14,708][39m Trial 1863 finished with value: 0.8409090909090909 and parameters: {'objective': 'CrossEntropy', 'colsample_bylevel': 0.08584023055966741, 'depth': 3, 'boosting_type': 'Plain', 'bootstrap_type': 'Bayesian', 'bagging_temperature': 8.995150250058208}. Best is trial 98 with value: 0.8791208791208791.
[32m[I 2023-04-21 02:09:15,462][39m Trial 1864 finished with value: 0.8666666666666666 and parameters: {'objective': 'CrossEntropy', 'colsample_bylevel': 0.08686611196533948, 'depth': 3, 'boosting_type': 'Plain', 'bootstrap_type': 'Bayesian', 'bagging_temperature': 9.778369477123496}. Best is trial 98 with value: 0.8791208791208791.
[32m[I 2023-04-21 02:09:16,310][39m Trial 1865 finished with value: 0.8666666666666666 and parameters: {'objective': 'CrossEntropy', 'colsample_bylevel': 0.0713213236298284, 'depth': 4, 'boosting_type': 'Plain', 'bootstrap_type': 'Bayesian', 'bagging_temperature': 9.468788229622355}. Best is trial 98 with value: 0.8791208791208791.
[32m[I 2023-04-21 02:09:17,151][39m Trial 1866 finished with value: 0.8409090909090909 and parameters: {'objective': 'CrossEntropy', 'colsample_bylevel': 0.07667604271304072, 'depth': 3, 'boosting_type': 'Plain', 'bootstrap_type': 'MVS'}. Best is trial 98 with value: 0.8791208791208791.
[32m[I 2023-04-21 02:09:17,982][39m Trial 1867 finished with value: 0.8409090909090909 and parameters: {'objective': 'CrossEntropy', 'colsample_bylevel': 0.07139928940167034, 'depth': 10, 'boosting_type': 'Plain', 'bootstrap_type': 'Bayesian', 'bagging_temperature': 9.733880190432282}. Best is trial 98 with value: 0.8791208791208791.
[32m[I 2023-04-21 02:09:18,799][39m Trial 1868 finished with value: 0.8409090909090909 and parameters: {'objective': 'CrossEntropy', 'colsample_bylevel': 0.07302987685314623, 'depth': 11, 'boosting_type': 'Plain', 'bootstrap_type': 'Bayesian', 'bagging_temperature': 9.698449476790522}. Best is trial 98 with value: 0.8791208791208791.
[32m[I 2023-04-21 02:09:20,166][39m Trial 1869 finished with value: 0.8505747126436782 and parameters: {'objective': 'CrossEntropy', 'colsample_bylevel': 0.09098481297176954, 'depth': 10, 'boosting_type': 'Plain', 'bootstrap_type': 'Bayesian', 'bagging_temperature': 9.874404545023443}. Best is trial 98 with value: 0.8791208791208791.
[32m[I 2023-04-21 02:09:21,434][39m Trial 1870 finished with value: 0.8539325842696629 and parameters: {'objective': 'CrossEntropy', 'colsample_bylevel': 0.0801565204061454, 'depth': 9, 'boosting_type': 'Plain', 'bootstrap_type': 'Bayesian', 'bagging_temperature': 9.273125301030763}. Best is trial 98 with value: 0.8791208791208791.
[32m[I 2023-04-21 02:09:22,017][39m Trial 1871 finished with value: 0.8139534883720929 and parameters: {'objective': 'CrossEntropy', 'colsample_bylevel': 0.07433913938305019, 'depth': 4, 'boosting_type': 'Plain', 'bootstrap_type': 'Bernoulli', 'subsample': 0.33953796788193746}. Best is trial 98 with value: 0.8791208791208791.
[32m[I 2023-04-21 02:09:22,746][39m Trial 1872 finished with value: 0.8409090909090909 and parameters: {'objective': 'Logloss', 'colsample_bylevel': 0.07784222272061352, 'depth': 10, 'boosting_type': 'Plain', 'bootstrap_type': 'Bayesian', 'bagging_temperature': 9.393083733600706}. Best is trial 98 with value: 0.8791208791208791.
[32m[I 2023-04-21 02:09:23,567][39m Trial 1873 finished with value: 0.8539325842696629 and parameters: {'objective': 'CrossEntropy', 'colsample_bylevel': 0.08025709410505107, 'depth': 10, 'boosting_type': 'Plain', 'bootstrap_type': 'Bayesian', 'bagging_temperature': 9.962426528154642}. Best is trial 98 with value: 0.8791208791208791.
[32m[I 2023-04-21 02:09:24,429][39m Trial 1874 finished with value: 0.8409090909090909 and parameters: {'objective': 'Logloss', 'colsample_bylevel': 0.08215605832895562, 'depth': 4, 'boosting_type': 'Plain', 'bootstrap_type': 'Bayesian', 'bagging_temperature': 9.141831903455197}. Best is trial 98 with value: 0.8791208791208791.
[32m[I 2023-04-21 02:09:25,331][39m Trial 1875 finished with value: 0.8409090909090909 and parameters: {'objective': 'CrossEntropy', 'colsample_bylevel': 0.07928508070601317, 'depth': 11, 'boosting_type': 'Plain', 'bootstrap_type': 'Bayesian', 'bagging_temperature': 9.568072058821235}. Best is trial 98 with value: 0.8791208791208791.
[32m[I 2023-04-21 02:09:26,304][39m Trial 1876 finished with value: 0.8636363636363636 and parameters: {'objective': 'CrossEntropy', 'colsample_bylevel': 0.0682533888239562, 'depth': 4, 'boosting_type': 'Plain', 'bootstrap_type': 'Bayesian', 'bagging_temperature': 9.51629855894545}. Best is trial 98 with value: 0.8791208791208791.
[32m[I 2023-04-21 02:09:27,849][39m Trial 1877 finished with value: 0.8539325842696629 and parameters: {'objective': 'Logloss', 'colsample_bylevel': 0.07521779999238935, 'depth': 10, 'boosting_type': 'Plain', 'bootstrap_type': 'Bayesian', 'bagging_temperature': 9.99676438612435}. Best is trial 98 with value: 0.8791208791208791.
[32m[I 2023-04-21 02:09:28,532][39m Trial 1878 finished with value: 0.8275862068965518 and parameters: {'objective': 'CrossEntropy', 'colsample_bylevel': 0.08192032670149423, 'depth': 3, 'boosting_type': 'Plain', 'bootstrap_type': 'MVS'}. Best is trial 98 with value: 0.8791208791208791.
[32m[I 2023-04-21 02:09:33,319][39m Trial 1879 finished with value: 0.8409090909090909 and parameters: {'objective': 'CrossEntropy', 'colsample_bylevel': 0.08148856657353509, 'depth': 3, 'boosting_type': 'Ordered', 'bootstrap_type': 'Bayesian', 'bagging_temperature': 6.389578635831679}. Best is trial 98 with value: 0.8791208791208791.
[32m[I 2023-04-21 02:09:34,515][39m Trial 1880 finished with value: 0.8505747126436782 and parameters: {'objective': 'CrossEntropy', 'colsample_bylevel': 0.0912393961464698, 'depth': 10, 'boosting_type': 'Plain', 'bootstrap_type': 'Bayesian', 'bagging_temperature': 9.60182979022099}. Best is trial 98 with value: 0.8791208791208791.
[32m[I 2023-04-21 02:09:35,550][39m Trial 1881 finished with value: 0.8539325842696629 and parameters: {'objective': 'CrossEntropy', 'colsample_bylevel': 0.07983628407668306, 'depth': 3, 'boosting_type': 'Plain', 'bootstrap_type': 'Bayesian', 'bagging_temperature': 8.730897410010732}. Best is trial 98 with value: 0.8791208791208791.
[32m[I 2023-04-21 02:09:36,210][39m Trial 1882 finished with value: 0.8409090909090909 and parameters: {'objective': 'CrossEntropy', 'colsample_bylevel': 0.07769258355880378, 'depth': 3, 'boosting_type': 'Plain', 'bootstrap_type': 'Bayesian', 'bagging_temperature': 8.946225011650842}. Best is trial 98 with value: 0.8791208791208791.
[32m[I 2023-04-21 02:09:37,209][39m Trial 1883 finished with value: 0.8791208791208791 and parameters: {'objective': 'CrossEntropy', 'colsample_bylevel': 0.0739914408324543, 'depth': 4, 'boosting_type': 'Plain', 'bootstrap_type': 'Bayesian', 'bagging_temperature': 9.966439431651478}. Best is trial 98 with value: 0.8791208791208791.
[32m[I 2023-04-21 02:09:37,971][39m Trial 1884 finished with value: 0.8666666666666666 and parameters: {'objective': 'CrossEntropy', 'colsample_bylevel': 0.09240107230275775, 'depth': 3, 'boosting_type': 'Plain', 'bootstrap_type': 'Bayesian', 'bagging_temperature': 8.691561242068436}. Best is trial 98 with value: 0.8791208791208791.
[32m[I 2023-04-21 02:09:39,043][39m Trial 1885 finished with value: 0.8791208791208791 and parameters: {'objective': 'CrossEntropy', 'colsample_bylevel': 0.07946544529722731, 'depth': 3, 'boosting_type': 'Plain', 'bootstrap_type': 'Bayesian', 'bagging_temperature': 9.000015731417657}. Best is trial 98 with value: 0.8791208791208791.
[32m[I 2023-04-21 02:09:39,831][39m Trial 1886 finished with value: 0.8539325842696629 and parameters: {'objective': 'CrossEntropy', 'colsample_bylevel': 0.08029449495366048, 'depth': 3, 'boosting_type': 'Plain', 'bootstrap_type': 'Bayesian', 'bagging_temperature': 8.826367350607574}. Best is trial 98 with value: 0.8791208791208791.
[32m[I 2023-04-21 02:09:40,696][39m Trial 1887 finished with value: 0.8444444444444446 and parameters: {'objective': 'CrossEntropy', 'colsample_bylevel': 0.07768278181785748, 'depth': 6, 'boosting_type': 'Plain', 'bootstrap_type': 'Bayesian', 'bagging_temperature': 8.45818824719172}. Best is trial 98 with value: 0.8791208791208791.
[32m[I 2023-04-21 02:09:41,613][39m Trial 1888 finished with value: 0.8539325842696629 and parameters: {'objective': 'CrossEntropy', 'colsample_bylevel': 0.08230777245433081, 'depth': 3, 'boosting_type': 'Plain', 'bootstrap_type': 'Bayesian', 'bagging_temperature': 8.896945684687585}. Best is trial 98 with value: 0.8791208791208791.
[32m[I 2023-04-21 02:09:42,747][39m Trial 1889 finished with value: 0.8275862068965518 and parameters: {'objective': 'Logloss', 'colsample_bylevel': 0.0856543432109938, 'depth': 11, 'boosting_type': 'Plain', 'bootstrap_type': 'Bayesian', 'bagging_temperature': 9.47329181731953}. Best is trial 98 with value: 0.8791208791208791.
[32m[I 2023-04-21 02:09:43,388][39m Trial 1890 finished with value: 0.8539325842696629 and parameters: {'objective': 'CrossEntropy', 'colsample_bylevel': 0.07622690944736261, 'depth': 11, 'boosting_type': 'Plain', 'bootstrap_type': 'Bayesian', 'bagging_temperature': 8.79839242023223}. Best is trial 98 with value: 0.8791208791208791.
[32m[I 2023-04-21 02:09:44,187][39m Trial 1891 finished with value: 0.8539325842696629 and parameters: {'objective': 'Logloss', 'colsample_bylevel': 0.07550697807201621, 'depth': 10, 'boosting_type': 'Plain', 'bootstrap_type': 'Bayesian', 'bagging_temperature': 8.237094143585661}. Best is trial 98 with value: 0.8791208791208791.
[32m[I 2023-04-21 02:09:45,143][39m Trial 1892 finished with value: 0.8409090909090909 and parameters: {'objective': 'Logloss', 'colsample_bylevel': 0.07952325160846085, 'depth': 11, 'boosting_type': 'Plain', 'bootstrap_type': 'Bayesian', 'bagging_temperature': 9.588188139016944}. Best is trial 98 with value: 0.8791208791208791.
[32m[I 2023-04-21 02:09:45,951][39m Trial 1893 finished with value: 0.8666666666666666 and parameters: {'objective': 'CrossEntropy', 'colsample_bylevel': 0.08289785275814389, 'depth': 3, 'boosting_type': 'Plain', 'bootstrap_type': 'Bayesian', 'bagging_temperature': 9.568613863499928}. Best is trial 98 with value: 0.8791208791208791.
[32m[I 2023-04-21 02:09:46,716][39m Trial 1894 finished with value: 0.8372093023255814 and parameters: {'objective': 'Logloss', 'colsample_bylevel': 0.040284833803095034, 'depth': 10, 'boosting_type': 'Plain', 'bootstrap_type': 'Bayesian', 'bagging_temperature': 8.96755862079567}. Best is trial 98 with value: 0.8791208791208791.
[32m[I 2023-04-21 02:09:47,918][39m Trial 1895 finished with value: 0.6739130434782609 and parameters: {'objective': 'Logloss', 'colsample_bylevel': 0.017618373289552923, 'depth': 3, 'boosting_type': 'Plain', 'bootstrap_type': 'Bayesian', 'bagging_temperature': 9.404506713186315}. Best is trial 98 with value: 0.8791208791208791.
[32m[I 2023-04-21 02:09:48,751][39m Trial 1896 finished with value: 0.7586206896551724 and parameters: {'objective': 'CrossEntropy', 'colsample_bylevel': 0.02103859258422379, 'depth': 3, 'boosting_type': 'Plain', 'bootstrap_type': 'MVS'}. Best is trial 98 with value: 0.8791208791208791.
[32m[I 2023-04-21 02:09:49,380][39m Trial 1897 finished with value: 0.8666666666666666 and parameters: {'objective': 'CrossEntropy', 'colsample_bylevel': 0.08574338704626851, 'depth': 3, 'boosting_type': 'Plain', 'bootstrap_type': 'Bayesian', 'bagging_temperature': 9.34575135684132}. Best is trial 98 with value: 0.8791208791208791.
[32m[I 2023-04-21 02:09:54,421][39m Trial 1898 finished with value: 0.8275862068965518 and parameters: {'objective': 'CrossEntropy', 'colsample_bylevel': 0.0867165528892731, 'depth': 3, 'boosting_type': 'Ordered', 'bootstrap_type': 'Bayesian', 'bagging_temperature': 9.985499051463849}. Best is trial 98 with value: 0.8791208791208791.
[32m[I 2023-04-21 02:09:55,626][39m Trial 1899 finished with value: 0.8409090909090909 and parameters: {'objective': 'CrossEntropy', 'colsample_bylevel': 0.08318162402524651, 'depth': 5, 'boosting_type': 'Plain', 'bootstrap_type': 'Bayesian', 'bagging_temperature': 9.393777556858174}. Best is trial 98 with value: 0.8791208791208791.
[32m[I 2023-04-21 02:09:56,792][39m Trial 1900 finished with value: 0.8666666666666666 and parameters: {'objective': 'CrossEntropy', 'colsample_bylevel': 0.08216818495047902, 'depth': 3, 'boosting_type': 'Plain', 'bootstrap_type': 'Bayesian', 'bagging_temperature': 8.623030347362095}. Best is trial 98 with value: 0.8791208791208791.
[32m[I 2023-04-21 02:09:57,452][39m Trial 1901 finished with value: 0.8409090909090909 and parameters: {'objective': 'CrossEntropy', 'colsample_bylevel': 0.07763669751086646, 'depth': 5, 'boosting_type': 'Plain', 'bootstrap_type': 'Bayesian', 'bagging_temperature': 9.187647976954743}. Best is trial 98 with value: 0.8791208791208791.
[32m[I 2023-04-21 02:09:58,194][39m Trial 1902 finished with value: 0.8666666666666666 and parameters: {'objective': 'CrossEntropy', 'colsample_bylevel': 0.0836437235310688, 'depth': 3, 'boosting_type': 'Plain', 'bootstrap_type': 'Bayesian', 'bagging_temperature': 9.617870729162682}. Best is trial 98 with value: 0.8791208791208791.
[32m[I 2023-04-21 02:09:59,056][39m Trial 1903 finished with value: 0.8666666666666666 and parameters: {'objective': 'CrossEntropy', 'colsample_bylevel': 0.08109376111426461, 'depth': 3, 'boosting_type': 'Plain', 'bootstrap_type': 'Bayesian', 'bagging_temperature': 9.200749450899105}. Best is trial 98 with value: 0.8791208791208791.
[32m[I 2023-04-21 02:10:00,092][39m Trial 1904 finished with value: 0.8275862068965518 and parameters: {'objective': 'Logloss', 'colsample_bylevel': 0.08520260828060143, 'depth': 11, 'boosting_type': 'Plain', 'bootstrap_type': 'Bayesian', 'bagging_temperature': 9.413469114273148}. Best is trial 98 with value: 0.8791208791208791.
[32m[I 2023-04-21 02:10:01,039][39m Trial 1905 finished with value: 0.8409090909090909 and parameters: {'objective': 'CrossEntropy', 'colsample_bylevel': 0.08279569808592083, 'depth': 3, 'boosting_type': 'Plain', 'bootstrap_type': 'MVS'}. Best is trial 98 with value: 0.8791208791208791.
[32m[I 2023-04-21 02:10:01,947][39m Trial 1906 finished with value: 0.8275862068965518 and parameters: {'objective': 'CrossEntropy', 'colsample_bylevel': 0.0791696925821191, 'depth': 3, 'boosting_type': 'Plain', 'bootstrap_type': 'Bernoulli', 'subsample': 0.1438085825998071}. Best is trial 98 with value: 0.8791208791208791.
[32m[I 2023-04-21 02:10:03,113][39m Trial 1907 finished with value: 0.8275862068965518 and parameters: {'objective': 'CrossEntropy', 'colsample_bylevel': 0.08419530717029211, 'depth': 4, 'boosting_type': 'Plain', 'bootstrap_type': 'Bayesian', 'bagging_temperature': 9.424771514770356}. Best is trial 98 with value: 0.8791208791208791.
[32m[I 2023-04-21 02:10:03,724][39m Trial 1908 finished with value: 0.8666666666666666 and parameters: {'objective': 'Logloss', 'colsample_bylevel': 0.08821160411588547, 'depth': 3, 'boosting_type': 'Plain', 'bootstrap_type': 'Bayesian', 'bagging_temperature': 8.475175464788867}. Best is trial 98 with value: 0.8791208791208791.
[32m[I 2023-04-21 02:10:04,590][39m Trial 1909 finished with value: 0.8666666666666666 and parameters: {'objective': 'CrossEntropy', 'colsample_bylevel': 0.07186731977131279, 'depth': 9, 'boosting_type': 'Plain', 'bootstrap_type': 'Bayesian', 'bagging_temperature': 7.7256166969145905}. Best is trial 98 with value: 0.8791208791208791.
[32m[I 2023-04-21 02:10:05,967][39m Trial 1910 finished with value: 0.8666666666666666 and parameters: {'objective': 'CrossEntropy', 'colsample_bylevel': 0.07407300974313646, 'depth': 3, 'boosting_type': 'Plain', 'bootstrap_type': 'Bayesian', 'bagging_temperature': 9.69781657670556}. Best is trial 98 with value: 0.8791208791208791.
[32m[I 2023-04-21 02:10:06,711][39m Trial 1911 finished with value: 0.8409090909090909 and parameters: {'objective': 'CrossEntropy', 'colsample_bylevel': 0.07180590055372782, 'depth': 9, 'boosting_type': 'Plain', 'bootstrap_type': 'Bayesian', 'bagging_temperature': 7.697292348842989}. Best is trial 98 with value: 0.8791208791208791.
[32m[I 2023-04-21 02:10:07,650][39m Trial 1912 finished with value: 0.8666666666666666 and parameters: {'objective': 'CrossEntropy', 'colsample_bylevel': 0.0813476759739417, 'depth': 3, 'boosting_type': 'Plain', 'bootstrap_type': 'Bayesian', 'bagging_temperature': 9.77885587974206}. Best is trial 98 with value: 0.8791208791208791.
[32m[I 2023-04-21 02:10:08,563][39m Trial 1913 finished with value: 0.8275862068965518 and parameters: {'objective': 'CrossEntropy', 'colsample_bylevel': 0.08442793644818321, 'depth': 10, 'boosting_type': 'Plain', 'bootstrap_type': 'Bayesian', 'bagging_temperature': 9.492811547039912}. Best is trial 98 with value: 0.8791208791208791.
[32m[I 2023-04-21 02:10:09,812][39m Trial 1914 finished with value: 0.8539325842696629 and parameters: {'objective': 'CrossEntropy', 'colsample_bylevel': 0.07890199900079156, 'depth': 3, 'boosting_type': 'Plain', 'bootstrap_type': 'Bayesian', 'bagging_temperature': 9.809313501892776}. Best is trial 98 with value: 0.8791208791208791.
[32m[I 2023-04-21 02:10:10,739][39m Trial 1915 finished with value: 0.8181818181818182 and parameters: {'objective': 'CrossEntropy', 'colsample_bylevel': 0.07658443257475549, 'depth': 4, 'boosting_type': 'Plain', 'bootstrap_type': 'Bernoulli', 'subsample': 0.4800446896433106}. Best is trial 98 with value: 0.8791208791208791.
[32m[I 2023-04-21 02:10:11,455][39m Trial 1916 finished with value: 0.8539325842696629 and parameters: {'objective': 'CrossEntropy', 'colsample_bylevel': 0.07563969718424353, 'depth': 4, 'boosting_type': 'Plain', 'bootstrap_type': 'Bayesian', 'bagging_temperature': 9.700856842201969}. Best is trial 98 with value: 0.8791208791208791.
