[32m[I 2023-04-21 02:41:59,730][39m Trial 3562 finished with value: 0.8539325842696629 and parameters: {'objective': 'CrossEntropy', 'colsample_bylevel': 0.057218143250268236, 'depth': 5, 'boosting_type': 'Plain', 'bootstrap_type': 'Bayesian', 'bagging_temperature': 9.569748830643832}. Best is trial 3065 with value: 0.8863636363636364.
[32m[I 2023-04-21 02:42:00,682][39m Trial 3563 finished with value: 0.8539325842696629 and parameters: {'objective': 'Logloss', 'colsample_bylevel': 0.08835081698263123, 'depth': 4, 'boosting_type': 'Plain', 'bootstrap_type': 'Bernoulli', 'subsample': 0.8533224581419836}. Best is trial 3065 with value: 0.8863636363636364.
[32m[I 2023-04-21 02:42:01,647][39m Trial 3564 finished with value: 0.8409090909090909 and parameters: {'objective': 'Logloss', 'colsample_bylevel': 0.07845341444142223, 'depth': 5, 'boosting_type': 'Plain', 'bootstrap_type': 'Bayesian', 'bagging_temperature': 9.653513778755439}. Best is trial 3065 with value: 0.8863636363636364.
[32m[I 2023-04-21 02:42:02,516][39m Trial 3565 finished with value: 0.8539325842696629 and parameters: {'objective': 'CrossEntropy', 'colsample_bylevel': 0.06933286480420271, 'depth': 9, 'boosting_type': 'Plain', 'bootstrap_type': 'Bayesian', 'bagging_temperature': 9.567567803312002}. Best is trial 3065 with value: 0.8863636363636364.
[32m[I 2023-04-21 02:42:03,521][39m Trial 3566 finished with value: 0.8505747126436782 and parameters: {'objective': 'CrossEntropy', 'colsample_bylevel': 0.07269286623014994, 'depth': 10, 'boosting_type': 'Plain', 'bootstrap_type': 'Bayesian', 'bagging_temperature': 9.504235973966459}. Best is trial 3065 with value: 0.8863636363636364.
[32m[I 2023-04-21 02:42:04,438][39m Trial 3567 finished with value: 0.8539325842696629 and parameters: {'objective': 'Logloss', 'colsample_bylevel': 0.08052655757678351, 'depth': 3, 'boosting_type': 'Plain', 'bootstrap_type': 'Bayesian', 'bagging_temperature': 9.039183908283169}. Best is trial 3065 with value: 0.8863636363636364.
[32m[I 2023-04-21 02:42:05,187][39m Trial 3568 finished with value: 0.8539325842696629 and parameters: {'objective': 'CrossEntropy', 'colsample_bylevel': 0.08246836040098829, 'depth': 3, 'boosting_type': 'Plain', 'bootstrap_type': 'Bayesian', 'bagging_temperature': 8.777727184727015}. Best is trial 3065 with value: 0.8863636363636364.
[32m[I 2023-04-21 02:42:06,172][39m Trial 3569 finished with value: 0.8275862068965518 and parameters: {'objective': 'CrossEntropy', 'colsample_bylevel': 0.05606772406815531, 'depth': 3, 'boosting_type': 'Plain', 'bootstrap_type': 'Bayesian', 'bagging_temperature': 8.677242943992063}. Best is trial 3065 with value: 0.8863636363636364.
[32m[I 2023-04-21 02:42:07,277][39m Trial 3570 finished with value: 0.8539325842696629 and parameters: {'objective': 'CrossEntropy', 'colsample_bylevel': 0.08305176942480672, 'depth': 2, 'boosting_type': 'Plain', 'bootstrap_type': 'Bayesian', 'bagging_temperature': 8.665181568894774}. Best is trial 3065 with value: 0.8863636363636364.
[32m[I 2023-04-21 02:42:08,729][39m Trial 3571 finished with value: 0.8539325842696629 and parameters: {'objective': 'CrossEntropy', 'colsample_bylevel': 0.06352094537901543, 'depth': 8, 'boosting_type': 'Plain', 'bootstrap_type': 'Bayesian', 'bagging_temperature': 8.597631293386474}. Best is trial 3065 with value: 0.8863636363636364.
[32m[I 2023-04-21 02:42:09,867][39m Trial 3572 finished with value: 0.8409090909090909 and parameters: {'objective': 'CrossEntropy', 'colsample_bylevel': 0.06706173949143297, 'depth': 8, 'boosting_type': 'Plain', 'bootstrap_type': 'Bayesian', 'bagging_temperature': 8.568840674319155}. Best is trial 3065 with value: 0.8863636363636364.
[32m[I 2023-04-21 02:42:14,292][39m Trial 3573 finished with value: 0.8089887640449439 and parameters: {'objective': 'Logloss', 'colsample_bylevel': 0.07283984166464867, 'depth': 4, 'boosting_type': 'Ordered', 'bootstrap_type': 'MVS'}. Best is trial 3065 with value: 0.8863636363636364.
[32m[I 2023-04-21 02:42:15,436][39m Trial 3574 finished with value: 0.8539325842696629 and parameters: {'objective': 'Logloss', 'colsample_bylevel': 0.07733556865496895, 'depth': 5, 'boosting_type': 'Plain', 'bootstrap_type': 'Bayesian', 'bagging_temperature': 9.47600877695023}. Best is trial 3065 with value: 0.8863636363636364.
[32m[I 2023-04-21 02:42:16,866][39m Trial 3575 finished with value: 0.8666666666666666 and parameters: {'objective': 'Logloss', 'colsample_bylevel': 0.0703406454932211, 'depth': 9, 'boosting_type': 'Plain', 'bootstrap_type': 'Bayesian', 'bagging_temperature': 9.10895692755106}. Best is trial 3065 with value: 0.8863636363636364.
[32m[I 2023-04-21 02:42:17,838][39m Trial 3576 finished with value: 0.8666666666666666 and parameters: {'objective': 'CrossEntropy', 'colsample_bylevel': 0.0875260261795563, 'depth': 3, 'boosting_type': 'Plain', 'bootstrap_type': 'Bayesian', 'bagging_temperature': 9.992978691626762}. Best is trial 3065 with value: 0.8863636363636364.
[32m[I 2023-04-21 02:42:18,576][39m Trial 3577 finished with value: 0.8764044943820225 and parameters: {'objective': 'CrossEntropy', 'colsample_bylevel': 0.07699744773926254, 'depth': 2, 'boosting_type': 'Plain', 'bootstrap_type': 'Bayesian', 'bagging_temperature': 9.649933782486107}. Best is trial 3065 with value: 0.8863636363636364.
[32m[I 2023-04-21 02:42:19,275][39m Trial 3578 finished with value: 0.8539325842696629 and parameters: {'objective': 'Logloss', 'colsample_bylevel': 0.07806629727133813, 'depth': 5, 'boosting_type': 'Plain', 'bootstrap_type': 'Bayesian', 'bagging_temperature': 9.333045547404941}. Best is trial 3065 with value: 0.8863636363636364.
[32m[I 2023-04-21 02:42:20,495][39m Trial 3579 finished with value: 0.8409090909090909 and parameters: {'objective': 'Logloss', 'colsample_bylevel': 0.07394163303843558, 'depth': 5, 'boosting_type': 'Plain', 'bootstrap_type': 'Bayesian', 'bagging_temperature': 9.548266190658227}. Best is trial 3065 with value: 0.8863636363636364.
[32m[I 2023-04-21 02:42:21,434][39m Trial 3580 finished with value: 0.8539325842696629 and parameters: {'objective': 'CrossEntropy', 'colsample_bylevel': 0.07638281838729408, 'depth': 10, 'boosting_type': 'Plain', 'bootstrap_type': 'Bayesian', 'bagging_temperature': 9.771835357911367}. Best is trial 3065 with value: 0.8863636363636364.
[32m[I 2023-04-21 02:42:22,438][39m Trial 3581 finished with value: 0.8314606741573034 and parameters: {'objective': 'CrossEntropy', 'colsample_bylevel': 0.07208425228736626, 'depth': 3, 'boosting_type': 'Plain', 'bootstrap_type': 'MVS'}. Best is trial 3065 with value: 0.8863636363636364.
[32m[I 2023-04-21 02:42:23,684][39m Trial 3582 finished with value: 0.8539325842696629 and parameters: {'objective': 'CrossEntropy', 'colsample_bylevel': 0.060251797608623175, 'depth': 11, 'boosting_type': 'Plain', 'bootstrap_type': 'Bayesian', 'bagging_temperature': 9.78640142858014}. Best is trial 3065 with value: 0.8863636363636364.
[32m[I 2023-04-21 02:42:24,542][39m Trial 3583 finished with value: 0.8539325842696629 and parameters: {'objective': 'CrossEntropy', 'colsample_bylevel': 0.07826020124605379, 'depth': 10, 'boosting_type': 'Plain', 'bootstrap_type': 'Bayesian', 'bagging_temperature': 9.395987280295094}. Best is trial 3065 with value: 0.8863636363636364.
[32m[I 2023-04-21 02:42:25,332][39m Trial 3584 finished with value: 0.8666666666666666 and parameters: {'objective': 'Logloss', 'colsample_bylevel': 0.07319804083942752, 'depth': 4, 'boosting_type': 'Plain', 'bootstrap_type': 'Bayesian', 'bagging_temperature': 9.48450739560153}. Best is trial 3065 with value: 0.8863636363636364.
[32m[I 2023-04-21 02:42:26,000][39m Trial 3585 finished with value: 0.8539325842696629 and parameters: {'objective': 'CrossEntropy', 'colsample_bylevel': 0.07966442494036019, 'depth': 3, 'boosting_type': 'Plain', 'bootstrap_type': 'Bayesian', 'bagging_temperature': 8.467285546304964}. Best is trial 3065 with value: 0.8863636363636364.
[32m[I 2023-04-21 02:42:26,668][39m Trial 3586 finished with value: 0.8275862068965518 and parameters: {'objective': 'CrossEntropy', 'colsample_bylevel': 0.08444728144082501, 'depth': 11, 'boosting_type': 'Plain', 'bootstrap_type': 'Bayesian', 'bagging_temperature': 8.841996534176378}. Best is trial 3065 with value: 0.8863636363636364.
[32m[I 2023-04-21 02:42:27,386][39m Trial 3587 finished with value: 0.8539325842696629 and parameters: {'objective': 'CrossEntropy', 'colsample_bylevel': 0.08072993483518036, 'depth': 3, 'boosting_type': 'Plain', 'bootstrap_type': 'Bayesian', 'bagging_temperature': 9.673044698625901}. Best is trial 3065 with value: 0.8863636363636364.
[32m[I 2023-04-21 02:42:28,660][39m Trial 3588 finished with value: 0.8666666666666666 and parameters: {'objective': 'CrossEntropy', 'colsample_bylevel': 0.063628850719735, 'depth': 9, 'boosting_type': 'Plain', 'bootstrap_type': 'Bayesian', 'bagging_temperature': 8.84804244357224}. Best is trial 3065 with value: 0.8863636363636364.
[32m[I 2023-04-21 02:42:29,642][39m Trial 3589 finished with value: 0.8409090909090909 and parameters: {'objective': 'CrossEntropy', 'colsample_bylevel': 0.07485390719275727, 'depth': 10, 'boosting_type': 'Plain', 'bootstrap_type': 'Bayesian', 'bagging_temperature': 9.633703746221169}. Best is trial 3065 with value: 0.8863636363636364.
[32m[I 2023-04-21 02:42:30,563][39m Trial 3590 finished with value: 0.8666666666666666 and parameters: {'objective': 'CrossEntropy', 'colsample_bylevel': 0.06657134582181898, 'depth': 3, 'boosting_type': 'Plain', 'bootstrap_type': 'Bayesian', 'bagging_temperature': 9.800757926320891}. Best is trial 3065 with value: 0.8863636363636364.
[32m[I 2023-04-21 02:42:31,827][39m Trial 3591 finished with value: 0.8275862068965518 and parameters: {'objective': 'CrossEntropy', 'colsample_bylevel': 0.07938426789184409, 'depth': 9, 'boosting_type': 'Plain', 'bootstrap_type': 'Bernoulli', 'subsample': 0.9332616561679592}. Best is trial 3065 with value: 0.8863636363636364.
[32m[I 2023-04-21 02:42:32,849][39m Trial 3592 finished with value: 0.8139534883720929 and parameters: {'objective': 'CrossEntropy', 'colsample_bylevel': 0.08994782467842075, 'depth': 8, 'boosting_type': 'Plain', 'bootstrap_type': 'MVS'}. Best is trial 3065 with value: 0.8863636363636364.
[32m[I 2023-04-21 02:42:33,500][39m Trial 3593 finished with value: 0.8409090909090909 and parameters: {'objective': 'CrossEntropy', 'colsample_bylevel': 0.09070410514864197, 'depth': 3, 'boosting_type': 'Plain', 'bootstrap_type': 'Bayesian', 'bagging_temperature': 4.126965892478475}. Best is trial 3065 with value: 0.8863636363636364.
[32m[I 2023-04-21 02:42:38,333][39m Trial 3594 finished with value: 0.8275862068965518 and parameters: {'objective': 'CrossEntropy', 'colsample_bylevel': 0.07813147029780386, 'depth': 12, 'boosting_type': 'Ordered', 'bootstrap_type': 'Bayesian', 'bagging_temperature': 8.852073338768102}. Best is trial 3065 with value: 0.8863636363636364.
[32m[I 2023-04-21 02:42:39,461][39m Trial 3595 finished with value: 0.8139534883720929 and parameters: {'objective': 'Logloss', 'colsample_bylevel': 0.06257669033324371, 'depth': 3, 'boosting_type': 'Plain', 'bootstrap_type': 'Bayesian', 'bagging_temperature': 8.751478549337293}. Best is trial 3065 with value: 0.8863636363636364.
[32m[I 2023-04-21 02:42:40,640][39m Trial 3596 finished with value: 0.8409090909090909 and parameters: {'objective': 'CrossEntropy', 'colsample_bylevel': 0.0850418701447865, 'depth': 3, 'boosting_type': 'Plain', 'bootstrap_type': 'Bayesian', 'bagging_temperature': 8.896255569959001}. Best is trial 3065 with value: 0.8863636363636364.
[32m[I 2023-04-21 02:42:41,302][39m Trial 3597 finished with value: 0.8666666666666666 and parameters: {'objective': 'CrossEntropy', 'colsample_bylevel': 0.08315165435419714, 'depth': 3, 'boosting_type': 'Plain', 'bootstrap_type': 'Bayesian', 'bagging_temperature': 9.366448899490278}. Best is trial 3065 with value: 0.8863636363636364.
[32m[I 2023-04-21 02:42:42,262][39m Trial 3598 finished with value: 0.8539325842696629 and parameters: {'objective': 'CrossEntropy', 'colsample_bylevel': 0.08680557386466443, 'depth': 3, 'boosting_type': 'Plain', 'bootstrap_type': 'Bayesian', 'bagging_temperature': 8.785375433890861}. Best is trial 3065 with value: 0.8863636363636364.
[32m[I 2023-04-21 02:42:43,544][39m Trial 3599 finished with value: 0.8666666666666666 and parameters: {'objective': 'CrossEntropy', 'colsample_bylevel': 0.07089491773661703, 'depth': 8, 'boosting_type': 'Plain', 'bootstrap_type': 'Bayesian', 'bagging_temperature': 9.78047745785703}. Best is trial 3065 with value: 0.8863636363636364.
[32m[I 2023-04-21 02:42:44,663][39m Trial 3600 finished with value: 0.8666666666666666 and parameters: {'objective': 'Logloss', 'colsample_bylevel': 0.08574326590496305, 'depth': 3, 'boosting_type': 'Plain', 'bootstrap_type': 'Bayesian', 'bagging_temperature': 8.280157364803237}. Best is trial 3065 with value: 0.8863636363636364.
[32m[I 2023-04-21 02:42:45,607][39m Trial 3601 finished with value: 0.8409090909090909 and parameters: {'objective': 'Logloss', 'colsample_bylevel': 0.08183122915270713, 'depth': 6, 'boosting_type': 'Plain', 'bootstrap_type': 'Bayesian', 'bagging_temperature': 6.611123588886262}. Best is trial 3065 with value: 0.8863636363636364.
[32m[I 2023-04-21 02:42:46,569][39m Trial 3602 finished with value: 0.8666666666666666 and parameters: {'objective': 'CrossEntropy', 'colsample_bylevel': 0.09493246304445785, 'depth': 3, 'boosting_type': 'Plain', 'bootstrap_type': 'Bayesian', 'bagging_temperature': 9.989018331469143}. Best is trial 3065 with value: 0.8863636363636364.
[32m[I 2023-04-21 02:42:47,303][39m Trial 3603 finished with value: 0.8539325842696629 and parameters: {'objective': 'CrossEntropy', 'colsample_bylevel': 0.06794897392761674, 'depth': 10, 'boosting_type': 'Plain', 'bootstrap_type': 'Bayesian', 'bagging_temperature': 9.9813829579575}. Best is trial 3065 with value: 0.8863636363636364.
[32m[I 2023-04-21 02:42:48,229][39m Trial 3604 finished with value: 0.8764044943820225 and parameters: {'objective': 'CrossEntropy', 'colsample_bylevel': 0.08456395119207068, 'depth': 2, 'boosting_type': 'Plain', 'bootstrap_type': 'Bayesian', 'bagging_temperature': 8.534682195677185}. Best is trial 3065 with value: 0.8863636363636364.
[32m[I 2023-04-21 02:42:48,940][39m Trial 3605 finished with value: 0.8791208791208791 and parameters: {'objective': 'CrossEntropy', 'colsample_bylevel': 0.06988147870076755, 'depth': 10, 'boosting_type': 'Plain', 'bootstrap_type': 'Bayesian', 'bagging_temperature': 8.970234636632386}. Best is trial 3065 with value: 0.8863636363636364.
[32m[I 2023-04-21 02:42:49,601][39m Trial 3606 finished with value: 0.8539325842696629 and parameters: {'objective': 'CrossEntropy', 'colsample_bylevel': 0.08149195500514783, 'depth': 2, 'boosting_type': 'Plain', 'bootstrap_type': 'Bayesian', 'bagging_temperature': 9.095126910650333}. Best is trial 3065 with value: 0.8863636363636364.
[32m[I 2023-04-21 02:42:50,810][39m Trial 3607 finished with value: 0.8372093023255814 and parameters: {'objective': 'CrossEntropy', 'colsample_bylevel': 0.08325503308729851, 'depth': 7, 'boosting_type': 'Plain', 'bootstrap_type': 'Bayesian', 'bagging_temperature': 9.450597077768712}. Best is trial 3065 with value: 0.8863636363636364.
[32m[I 2023-04-21 02:42:52,093][39m Trial 3608 finished with value: 0.8539325842696629 and parameters: {'objective': 'CrossEntropy', 'colsample_bylevel': 0.07593890577840552, 'depth': 3, 'boosting_type': 'Plain', 'bootstrap_type': 'Bernoulli', 'subsample': 0.6430631732809746}. Best is trial 3065 with value: 0.8863636363636364.
[32m[I 2023-04-21 02:42:53,038][39m Trial 3609 finished with value: 0.8372093023255814 and parameters: {'objective': 'CrossEntropy', 'colsample_bylevel': 0.0787818552719391, 'depth': 2, 'boosting_type': 'Plain', 'bootstrap_type': 'Bayesian', 'bagging_temperature': 8.692363959240081}. Best is trial 3065 with value: 0.8863636363636364.
[32m[I 2023-04-21 02:42:53,970][39m Trial 3610 finished with value: 0.8666666666666666 and parameters: {'objective': 'CrossEntropy', 'colsample_bylevel': 0.07764663552413159, 'depth': 3, 'boosting_type': 'Plain', 'bootstrap_type': 'Bayesian', 'bagging_temperature': 9.69922561440833}. Best is trial 3065 with value: 0.8863636363636364.
[32m[I 2023-04-21 02:42:54,598][39m Trial 3611 finished with value: 0.8409090909090909 and parameters: {'objective': 'CrossEntropy', 'colsample_bylevel': 0.08126989164994557, 'depth': 3, 'boosting_type': 'Plain', 'bootstrap_type': 'MVS'}. Best is trial 3065 with value: 0.8863636363636364.
[32m[I 2023-04-21 02:42:59,503][39m Trial 3612 finished with value: 0.8275862068965518 and parameters: {'objective': 'CrossEntropy', 'colsample_bylevel': 0.07565377936158686, 'depth': 10, 'boosting_type': 'Ordered', 'bootstrap_type': 'Bayesian', 'bagging_temperature': 9.55908055644518}. Best is trial 3065 with value: 0.8863636363636364.
[32m[I 2023-04-21 02:43:00,489][39m Trial 3613 finished with value: 0.8539325842696629 and parameters: {'objective': 'CrossEntropy', 'colsample_bylevel': 0.0958076695069539, 'depth': 3, 'boosting_type': 'Plain', 'bootstrap_type': 'Bayesian', 'bagging_temperature': 8.93018515334068}. Best is trial 3065 with value: 0.8863636363636364.
[32m[I 2023-04-21 02:43:01,439][39m Trial 3614 finished with value: 0.8409090909090909 and parameters: {'objective': 'CrossEntropy', 'colsample_bylevel': 0.08133427890006391, 'depth': 3, 'boosting_type': 'Plain', 'bootstrap_type': 'MVS'}. Best is trial 3065 with value: 0.8863636363636364.
[32m[I 2023-04-21 02:43:02,356][39m Trial 3615 finished with value: 0.8539325842696629 and parameters: {'objective': 'Logloss', 'colsample_bylevel': 0.07460532152549458, 'depth': 12, 'boosting_type': 'Plain', 'bootstrap_type': 'Bayesian', 'bagging_temperature': 9.816487495115771}. Best is trial 3065 with value: 0.8863636363636364.
[32m[I 2023-04-21 02:43:03,420][39m Trial 3616 finished with value: 0.7857142857142858 and parameters: {'objective': 'CrossEntropy', 'colsample_bylevel': 0.07732083997413622, 'depth': 10, 'boosting_type': 'Plain', 'bootstrap_type': 'MVS'}. Best is trial 3065 with value: 0.8863636363636364.
[32m[I 2023-04-21 02:43:04,471][39m Trial 3617 finished with value: 0.8539325842696629 and parameters: {'objective': 'Logloss', 'colsample_bylevel': 0.07971927569489506, 'depth': 4, 'boosting_type': 'Plain', 'bootstrap_type': 'Bayesian', 'bagging_temperature': 9.201125987684213}. Best is trial 3065 with value: 0.8863636363636364.
[32m[I 2023-04-21 02:43:05,695][39m Trial 3618 finished with value: 0.8409090909090909 and parameters: {'objective': 'CrossEntropy', 'colsample_bylevel': 0.0717171834468395, 'depth': 10, 'boosting_type': 'Plain', 'bootstrap_type': 'Bayesian', 'bagging_temperature': 9.803311550819586}. Best is trial 3065 with value: 0.8863636363636364.
[32m[I 2023-04-21 02:43:06,934][39m Trial 3619 finished with value: 0.8409090909090909 and parameters: {'objective': 'Logloss', 'colsample_bylevel': 0.07062920295959882, 'depth': 9, 'boosting_type': 'Plain', 'bootstrap_type': 'Bayesian', 'bagging_temperature': 9.19868544338807}. Best is trial 3065 with value: 0.8863636363636364.
[32m[I 2023-04-21 02:43:07,766][39m Trial 3620 finished with value: 0.8539325842696629 and parameters: {'objective': 'CrossEntropy', 'colsample_bylevel': 0.0649050948245732, 'depth': 9, 'boosting_type': 'Plain', 'bootstrap_type': 'Bayesian', 'bagging_temperature': 5.412179187544215}. Best is trial 3065 with value: 0.8863636363636364.
[32m[I 2023-04-21 02:43:08,603][39m Trial 3621 finished with value: 0.8409090909090909 and parameters: {'objective': 'CrossEntropy', 'colsample_bylevel': 0.0890872776429713, 'depth': 7, 'boosting_type': 'Plain', 'bootstrap_type': 'Bayesian', 'bagging_temperature': 9.063564112305633}. Best is trial 3065 with value: 0.8863636363636364.
[32m[I 2023-04-21 02:43:09,310][39m Trial 3622 finished with value: 0.8275862068965518 and parameters: {'objective': 'CrossEntropy', 'colsample_bylevel': 0.07147115764856911, 'depth': 9, 'boosting_type': 'Plain', 'bootstrap_type': 'Bayesian', 'bagging_temperature': 3.84007914247918}. Best is trial 3065 with value: 0.8863636363636364.
[32m[I 2023-04-21 02:43:10,805][39m Trial 3623 finished with value: 0.8505747126436782 and parameters: {'objective': 'CrossEntropy', 'colsample_bylevel': 0.09571638552135621, 'depth': 9, 'boosting_type': 'Plain', 'bootstrap_type': 'Bayesian', 'bagging_temperature': 9.111649756069998}. Best is trial 3065 with value: 0.8863636363636364.
[32m[I 2023-04-21 02:43:12,107][39m Trial 3624 finished with value: 0.7999999999999999 and parameters: {'objective': 'CrossEntropy', 'colsample_bylevel': 0.07571074949296774, 'depth': 9, 'boosting_type': 'Plain', 'bootstrap_type': 'Bayesian', 'bagging_temperature': 9.650973548802073}. Best is trial 3065 with value: 0.8863636363636364.
[32m[I 2023-04-21 02:43:13,226][39m Trial 3625 finished with value: 0.8235294117647058 and parameters: {'objective': 'CrossEntropy', 'colsample_bylevel': 0.08262211948086978, 'depth': 9, 'boosting_type': 'Plain', 'bootstrap_type': 'Bayesian', 'bagging_temperature': 9.449144622095309}. Best is trial 3065 with value: 0.8863636363636364.
[32m[I 2023-04-21 02:43:13,911][39m Trial 3626 finished with value: 0.8409090909090909 and parameters: {'objective': 'CrossEntropy', 'colsample_bylevel': 0.09255635905621847, 'depth': 4, 'boosting_type': 'Plain', 'bootstrap_type': 'Bernoulli', 'subsample': 0.43334267654615233}. Best is trial 3065 with value: 0.8863636363636364.
[32m[I 2023-04-21 02:43:14,715][39m Trial 3627 finished with value: 0.8409090909090909 and parameters: {'objective': 'CrossEntropy', 'colsample_bylevel': 0.08068172756098395, 'depth': 6, 'boosting_type': 'Plain', 'bootstrap_type': 'MVS'}. Best is trial 3065 with value: 0.8863636363636364.
