[32m[I 2023-04-21 02:05:13,998][39m Trial 1653 finished with value: 0.8666666666666666 and parameters: {'objective': 'CrossEntropy', 'colsample_bylevel': 0.06619919542663676, 'depth': 9, 'boosting_type': 'Plain', 'bootstrap_type': 'Bayesian', 'bagging_temperature': 9.358428072178203}. Best is trial 98 with value: 0.8791208791208791.
[32m[I 2023-04-21 02:05:14,670][39m Trial 1654 finished with value: 0.8409090909090909 and parameters: {'objective': 'CrossEntropy', 'colsample_bylevel': 0.08060453161364799, 'depth': 4, 'boosting_type': 'Plain', 'bootstrap_type': 'Bayesian', 'bagging_temperature': 8.866612133120952}. Best is trial 98 with value: 0.8791208791208791.
[32m[I 2023-04-21 02:05:19,719][39m Trial 1655 finished with value: 0.8275862068965518 and parameters: {'objective': 'CrossEntropy', 'colsample_bylevel': 0.07550863503278227, 'depth': 11, 'boosting_type': 'Ordered', 'bootstrap_type': 'MVS'}. Best is trial 98 with value: 0.8791208791208791.
[32m[I 2023-04-21 02:05:20,726][39m Trial 1656 finished with value: 0.8539325842696629 and parameters: {'objective': 'CrossEntropy', 'colsample_bylevel': 0.09371719263063552, 'depth': 3, 'boosting_type': 'Plain', 'bootstrap_type': 'Bayesian', 'bagging_temperature': 8.413960641281871}. Best is trial 98 with value: 0.8791208791208791.
[32m[I 2023-04-21 02:05:21,452][39m Trial 1657 finished with value: 0.8409090909090909 and parameters: {'objective': 'CrossEntropy', 'colsample_bylevel': 0.07934577209151501, 'depth': 12, 'boosting_type': 'Plain', 'bootstrap_type': 'Bayesian', 'bagging_temperature': 8.174154240311973}. Best is trial 98 with value: 0.8791208791208791.
[32m[I 2023-04-21 02:05:22,621][39m Trial 1658 finished with value: 0.8539325842696629 and parameters: {'objective': 'CrossEntropy', 'colsample_bylevel': 0.08280868291961063, 'depth': 3, 'boosting_type': 'Plain', 'bootstrap_type': 'Bayesian', 'bagging_temperature': 8.712681370203958}. Best is trial 98 with value: 0.8791208791208791.
[32m[I 2023-04-21 02:05:23,449][39m Trial 1659 finished with value: 0.8409090909090909 and parameters: {'objective': 'CrossEntropy', 'colsample_bylevel': 0.09839799089056285, 'depth': 3, 'boosting_type': 'Plain', 'bootstrap_type': 'Bayesian', 'bagging_temperature': 9.087579240990989}. Best is trial 98 with value: 0.8791208791208791.
[32m[I 2023-04-21 02:05:24,417][39m Trial 1660 finished with value: 0.8666666666666666 and parameters: {'objective': 'CrossEntropy', 'colsample_bylevel': 0.08341672504683395, 'depth': 3, 'boosting_type': 'Plain', 'bootstrap_type': 'Bayesian', 'bagging_temperature': 9.145940836677843}. Best is trial 98 with value: 0.8791208791208791.
[32m[I 2023-04-21 02:05:25,555][39m Trial 1661 finished with value: 0.8539325842696629 and parameters: {'objective': 'CrossEntropy', 'colsample_bylevel': 0.05272012960073902, 'depth': 9, 'boosting_type': 'Plain', 'bootstrap_type': 'Bayesian', 'bagging_temperature': 8.934503788893615}. Best is trial 98 with value: 0.8791208791208791.
[32m[I 2023-04-21 02:05:26,392][39m Trial 1662 finished with value: 0.8275862068965518 and parameters: {'objective': 'CrossEntropy', 'colsample_bylevel': 0.07360842512303453, 'depth': 9, 'boosting_type': 'Plain', 'bootstrap_type': 'Bayesian', 'bagging_temperature': 8.957721428653768}. Best is trial 98 with value: 0.8791208791208791.
[32m[I 2023-04-21 02:05:27,028][39m Trial 1663 finished with value: 0.8666666666666666 and parameters: {'objective': 'CrossEntropy', 'colsample_bylevel': 0.08592432802886654, 'depth': 3, 'boosting_type': 'Plain', 'bootstrap_type': 'Bayesian', 'bagging_temperature': 8.981351251735044}. Best is trial 98 with value: 0.8791208791208791.
[32m[I 2023-04-21 02:05:28,013][39m Trial 1664 finished with value: 0.8409090909090909 and parameters: {'objective': 'CrossEntropy', 'colsample_bylevel': 0.07002290176375128, 'depth': 11, 'boosting_type': 'Plain', 'bootstrap_type': 'Bayesian', 'bagging_temperature': 7.919459329002916}. Best is trial 98 with value: 0.8791208791208791.
[32m[I 2023-04-21 02:05:28,714][39m Trial 1665 finished with value: 0.8539325842696629 and parameters: {'objective': 'CrossEntropy', 'colsample_bylevel': 0.07620702479642918, 'depth': 11, 'boosting_type': 'Plain', 'bootstrap_type': 'Bayesian', 'bagging_temperature': 9.86967704342332}. Best is trial 98 with value: 0.8791208791208791.
[32m[I 2023-04-21 02:05:29,563][39m Trial 1666 finished with value: 0.8275862068965518 and parameters: {'objective': 'CrossEntropy', 'colsample_bylevel': 0.08108020027410709, 'depth': 11, 'boosting_type': 'Plain', 'bootstrap_type': 'Bayesian', 'bagging_temperature': 9.513386901989419}. Best is trial 98 with value: 0.8791208791208791.
[32m[I 2023-04-21 02:05:30,568][39m Trial 1667 finished with value: 0.8409090909090909 and parameters: {'objective': 'CrossEntropy', 'colsample_bylevel': 0.08035419625302284, 'depth': 3, 'boosting_type': 'Plain', 'bootstrap_type': 'MVS'}. Best is trial 98 with value: 0.8791208791208791.
[32m[I 2023-04-21 02:05:31,536][39m Trial 1668 finished with value: 0.8539325842696629 and parameters: {'objective': 'CrossEntropy', 'colsample_bylevel': 0.08432078649253631, 'depth': 3, 'boosting_type': 'Plain', 'bootstrap_type': 'Bayesian', 'bagging_temperature': 9.145872174379587}. Best is trial 98 with value: 0.8791208791208791.
[32m[I 2023-04-21 02:05:32,469][39m Trial 1669 finished with value: 0.8666666666666666 and parameters: {'objective': 'Logloss', 'colsample_bylevel': 0.07852788427711341, 'depth': 9, 'boosting_type': 'Plain', 'bootstrap_type': 'Bayesian', 'bagging_temperature': 8.08062255313178}. Best is trial 98 with value: 0.8791208791208791.
[32m[I 2023-04-21 02:05:33,300][39m Trial 1670 finished with value: 0.8791208791208791 and parameters: {'objective': 'CrossEntropy', 'colsample_bylevel': 0.07445009370658409, 'depth': 4, 'boosting_type': 'Plain', 'bootstrap_type': 'Bayesian', 'bagging_temperature': 9.771572365487504}. Best is trial 98 with value: 0.8791208791208791.
[32m[I 2023-04-21 02:05:38,246][39m Trial 1671 finished with value: 0.8539325842696629 and parameters: {'objective': 'CrossEntropy', 'colsample_bylevel': 0.07238256767897851, 'depth': 8, 'boosting_type': 'Ordered', 'bootstrap_type': 'Bayesian', 'bagging_temperature': 8.804730646760152}. Best is trial 98 with value: 0.8791208791208791.
[32m[I 2023-04-21 02:05:39,171][39m Trial 1672 finished with value: 0.8539325842696629 and parameters: {'objective': 'Logloss', 'colsample_bylevel': 0.07522152763328342, 'depth': 3, 'boosting_type': 'Plain', 'bootstrap_type': 'Bayesian', 'bagging_temperature': 9.455452274178326}. Best is trial 98 with value: 0.8791208791208791.
[32m[I 2023-04-21 02:05:40,270][39m Trial 1673 finished with value: 0.8409090909090909 and parameters: {'objective': 'CrossEntropy', 'colsample_bylevel': 0.07692184025036476, 'depth': 12, 'boosting_type': 'Plain', 'bootstrap_type': 'Bayesian', 'bagging_temperature': 9.599111590527603}. Best is trial 98 with value: 0.8791208791208791.
[32m[I 2023-04-21 02:05:40,931][39m Trial 1674 finished with value: 0.8409090909090909 and parameters: {'objective': 'CrossEntropy', 'colsample_bylevel': 0.07795697087510649, 'depth': 11, 'boosting_type': 'Plain', 'bootstrap_type': 'Bayesian', 'bagging_temperature': 8.858373453450566}. Best is trial 98 with value: 0.8791208791208791.
[32m[I 2023-04-21 02:05:42,069][39m Trial 1675 finished with value: 0.8409090909090909 and parameters: {'objective': 'CrossEntropy', 'colsample_bylevel': 0.08632576069925198, 'depth': 3, 'boosting_type': 'Plain', 'bootstrap_type': 'Bernoulli', 'subsample': 0.2979674173457845}. Best is trial 98 with value: 0.8791208791208791.
[32m[I 2023-04-21 02:05:42,853][39m Trial 1676 finished with value: 0.8409090909090909 and parameters: {'objective': 'CrossEntropy', 'colsample_bylevel': 0.08493324571349348, 'depth': 3, 'boosting_type': 'Plain', 'bootstrap_type': 'Bayesian', 'bagging_temperature': 9.613402242339072}. Best is trial 98 with value: 0.8791208791208791.
[32m[I 2023-04-21 02:05:43,699][39m Trial 1677 finished with value: 0.8636363636363636 and parameters: {'objective': 'CrossEntropy', 'colsample_bylevel': 0.07560627457743933, 'depth': 12, 'boosting_type': 'Plain', 'bootstrap_type': 'Bayesian', 'bagging_temperature': 9.985081087376162}. Best is trial 98 with value: 0.8791208791208791.
[32m[I 2023-04-21 02:05:44,566][39m Trial 1678 finished with value: 0.8539325842696629 and parameters: {'objective': 'Logloss', 'colsample_bylevel': 0.08374173717331433, 'depth': 10, 'boosting_type': 'Plain', 'bootstrap_type': 'Bayesian', 'bagging_temperature': 9.372628766711692}. Best is trial 98 with value: 0.8791208791208791.
[32m[I 2023-04-21 02:05:45,381][39m Trial 1679 finished with value: 0.8539325842696629 and parameters: {'objective': 'Logloss', 'colsample_bylevel': 0.07068003547084677, 'depth': 4, 'boosting_type': 'Plain', 'bootstrap_type': 'Bayesian', 'bagging_temperature': 9.984458242551936}. Best is trial 98 with value: 0.8791208791208791.
[32m[I 2023-04-21 02:05:46,450][39m Trial 1680 finished with value: 0.8275862068965518 and parameters: {'objective': 'CrossEntropy', 'colsample_bylevel': 0.0725735558553777, 'depth': 4, 'boosting_type': 'Plain', 'bootstrap_type': 'MVS'}. Best is trial 98 with value: 0.8791208791208791.
[32m[I 2023-04-21 02:05:47,227][39m Trial 1681 finished with value: 0.8409090909090909 and parameters: {'objective': 'CrossEntropy', 'colsample_bylevel': 0.08272297043226257, 'depth': 4, 'boosting_type': 'Plain', 'bootstrap_type': 'Bayesian', 'bagging_temperature': 9.666073885326917}. Best is trial 98 with value: 0.8791208791208791.
[32m[I 2023-04-21 02:05:48,468][39m Trial 1682 finished with value: 0.8791208791208791 and parameters: {'objective': 'CrossEntropy', 'colsample_bylevel': 0.08209108086310953, 'depth': 3, 'boosting_type': 'Plain', 'bootstrap_type': 'Bayesian', 'bagging_temperature': 9.753269615347827}. Best is trial 98 with value: 0.8791208791208791.
[32m[I 2023-04-21 02:05:49,340][39m Trial 1683 finished with value: 0.8409090909090909 and parameters: {'objective': 'CrossEntropy', 'colsample_bylevel': 0.0812839749817956, 'depth': 7, 'boosting_type': 'Plain', 'bootstrap_type': 'Bayesian', 'bagging_temperature': 9.340504710670315}. Best is trial 98 with value: 0.8791208791208791.
[32m[I 2023-04-21 02:05:50,590][39m Trial 1684 finished with value: 0.8666666666666666 and parameters: {'objective': 'CrossEntropy', 'colsample_bylevel': 0.07385302732154538, 'depth': 4, 'boosting_type': 'Plain', 'bootstrap_type': 'Bayesian', 'bagging_temperature': 8.551061139808795}. Best is trial 98 with value: 0.8791208791208791.
[32m[I 2023-04-21 02:05:51,226][39m Trial 1685 finished with value: 0.8666666666666666 and parameters: {'objective': 'CrossEntropy', 'colsample_bylevel': 0.0810468614750817, 'depth': 3, 'boosting_type': 'Plain', 'bootstrap_type': 'Bayesian', 'bagging_temperature': 8.699378917649762}. Best is trial 98 with value: 0.8791208791208791.
[32m[I 2023-04-21 02:05:52,128][39m Trial 1686 finished with value: 0.8539325842696629 and parameters: {'objective': 'CrossEntropy', 'colsample_bylevel': 0.08926823023613162, 'depth': 10, 'boosting_type': 'Plain', 'bootstrap_type': 'Bayesian', 'bagging_temperature': 8.565350851361032}. Best is trial 98 with value: 0.8791208791208791.
[32m[I 2023-04-21 02:05:53,056][39m Trial 1687 finished with value: 0.8275862068965518 and parameters: {'objective': 'CrossEntropy', 'colsample_bylevel': 0.07891791626789338, 'depth': 3, 'boosting_type': 'Plain', 'bootstrap_type': 'Bayesian', 'bagging_temperature': 9.540407913610785}. Best is trial 98 with value: 0.8791208791208791.
[32m[I 2023-04-21 02:05:53,933][39m Trial 1688 finished with value: 0.8539325842696629 and parameters: {'objective': 'CrossEntropy', 'colsample_bylevel': 0.08321210508551284, 'depth': 3, 'boosting_type': 'Plain', 'bootstrap_type': 'Bayesian', 'bagging_temperature': 9.478472585938896}. Best is trial 98 with value: 0.8791208791208791.
[32m[I 2023-04-21 02:05:54,752][39m Trial 1689 finished with value: 0.8372093023255814 and parameters: {'objective': 'CrossEntropy', 'colsample_bylevel': 0.07300223654753221, 'depth': 10, 'boosting_type': 'Plain', 'bootstrap_type': 'Bayesian', 'bagging_temperature': 9.42263939538169}. Best is trial 98 with value: 0.8791208791208791.
[32m[I 2023-04-21 02:05:59,539][39m Trial 1690 finished with value: 0.8275862068965518 and parameters: {'objective': 'CrossEntropy', 'colsample_bylevel': 0.08364344788822115, 'depth': 8, 'boosting_type': 'Ordered', 'bootstrap_type': 'Bayesian', 'bagging_temperature': 9.79258067803413}. Best is trial 98 with value: 0.8791208791208791.
[32m[I 2023-04-21 02:06:00,604][39m Trial 1691 finished with value: 0.8275862068965518 and parameters: {'objective': 'CrossEntropy', 'colsample_bylevel': 0.08549138041603296, 'depth': 3, 'boosting_type': 'Plain', 'bootstrap_type': 'Bayesian', 'bagging_temperature': 9.672000712069085}. Best is trial 98 with value: 0.8791208791208791.
[32m[I 2023-04-21 02:06:01,344][39m Trial 1692 finished with value: 0.8409090909090909 and parameters: {'objective': 'CrossEntropy', 'colsample_bylevel': 0.0755408941816606, 'depth': 10, 'boosting_type': 'Plain', 'bootstrap_type': 'MVS'}. Best is trial 98 with value: 0.8791208791208791.
[32m[I 2023-04-21 02:06:02,466][39m Trial 1693 finished with value: 0.8539325842696629 and parameters: {'objective': 'CrossEntropy', 'colsample_bylevel': 0.0791722726413867, 'depth': 9, 'boosting_type': 'Plain', 'bootstrap_type': 'Bayesian', 'bagging_temperature': 9.08992309282255}. Best is trial 98 with value: 0.8791208791208791.
[32m[I 2023-04-21 02:06:03,285][39m Trial 1694 finished with value: 0.8539325842696629 and parameters: {'objective': 'CrossEntropy', 'colsample_bylevel': 0.09704366000315506, 'depth': 10, 'boosting_type': 'Plain', 'bootstrap_type': 'Bayesian', 'bagging_temperature': 8.652863704987803}. Best is trial 98 with value: 0.8791208791208791.
[32m[I 2023-04-21 02:06:04,109][39m Trial 1695 finished with value: 0.8666666666666666 and parameters: {'objective': 'Logloss', 'colsample_bylevel': 0.07425720213703371, 'depth': 4, 'boosting_type': 'Plain', 'bootstrap_type': 'Bayesian', 'bagging_temperature': 9.775417840252677}. Best is trial 98 with value: 0.8791208791208791.
[32m[I 2023-04-21 02:06:05,045][39m Trial 1696 finished with value: 0.8139534883720929 and parameters: {'objective': 'Logloss', 'colsample_bylevel': 0.07370969810751701, 'depth': 4, 'boosting_type': 'Plain', 'bootstrap_type': 'Bernoulli', 'subsample': 0.7674118880142233}. Best is trial 98 with value: 0.8791208791208791.
[32m[I 2023-04-21 02:06:06,150][39m Trial 1697 finished with value: 0.8275862068965518 and parameters: {'objective': 'CrossEntropy', 'colsample_bylevel': 0.08210350622346066, 'depth': 4, 'boosting_type': 'Plain', 'bootstrap_type': 'Bayesian', 'bagging_temperature': 9.665777514103514}. Best is trial 98 with value: 0.8791208791208791.
[32m[I 2023-04-21 02:06:07,030][39m Trial 1698 finished with value: 0.8539325842696629 and parameters: {'objective': 'CrossEntropy', 'colsample_bylevel': 0.07990343924021136, 'depth': 3, 'boosting_type': 'Plain', 'bootstrap_type': 'Bayesian', 'bagging_temperature': 9.20755013899153}. Best is trial 98 with value: 0.8791208791208791.
[32m[I 2023-04-21 02:06:07,648][39m Trial 1699 finished with value: 0.8139534883720929 and parameters: {'objective': 'CrossEntropy', 'colsample_bylevel': 0.0764408745455339, 'depth': 4, 'boosting_type': 'Plain', 'bootstrap_type': 'Bayesian', 'bagging_temperature': 9.528502766063369}. Best is trial 98 with value: 0.8791208791208791.
[32m[I 2023-04-21 02:06:08,658][39m Trial 1700 finished with value: 0.8539325842696629 and parameters: {'objective': 'CrossEntropy', 'colsample_bylevel': 0.07036427493642317, 'depth': 12, 'boosting_type': 'Plain', 'bootstrap_type': 'Bayesian', 'bagging_temperature': 9.974333532997482}. Best is trial 98 with value: 0.8791208791208791.
[32m[I 2023-04-21 02:06:09,425][39m Trial 1701 finished with value: 0.8539325842696629 and parameters: {'objective': 'CrossEntropy', 'colsample_bylevel': 0.08268114802990519, 'depth': 11, 'boosting_type': 'Plain', 'bootstrap_type': 'Bayesian', 'bagging_temperature': 9.519273413457991}. Best is trial 98 with value: 0.8791208791208791.
[32m[I 2023-04-21 02:06:10,344][39m Trial 1702 finished with value: 0.8275862068965518 and parameters: {'objective': 'CrossEntropy', 'colsample_bylevel': 0.08207461318329444, 'depth': 10, 'boosting_type': 'Plain', 'bootstrap_type': 'Bayesian', 'bagging_temperature': 9.285517477358418}. Best is trial 98 with value: 0.8791208791208791.
[32m[I 2023-04-21 02:06:11,581][39m Trial 1703 finished with value: 0.8409090909090909 and parameters: {'objective': 'CrossEntropy', 'colsample_bylevel': 0.0762769468679513, 'depth': 9, 'boosting_type': 'Plain', 'bootstrap_type': 'Bayesian', 'bagging_temperature': 9.313892988149767}. Best is trial 98 with value: 0.8791208791208791.
[32m[I 2023-04-21 02:06:12,334][39m Trial 1704 finished with value: 0.8571428571428571 and parameters: {'objective': 'Logloss', 'colsample_bylevel': 0.07780889192200033, 'depth': 11, 'boosting_type': 'Plain', 'bootstrap_type': 'Bayesian', 'bagging_temperature': 9.573955320830592}. Best is trial 98 with value: 0.8791208791208791.
[32m[I 2023-04-21 02:06:13,037][39m Trial 1705 finished with value: 0.8275862068965518 and parameters: {'objective': 'CrossEntropy', 'colsample_bylevel': 0.0717420476288554, 'depth': 4, 'boosting_type': 'Plain', 'bootstrap_type': 'Bayesian', 'bagging_temperature': 6.78334866641909}. Best is trial 98 with value: 0.8791208791208791.
[32m[I 2023-04-21 02:06:14,227][39m Trial 1706 finished with value: 0.8539325842696629 and parameters: {'objective': 'CrossEntropy', 'colsample_bylevel': 0.09069196073291609, 'depth': 3, 'boosting_type': 'Plain', 'bootstrap_type': 'Bayesian', 'bagging_temperature': 9.075997488545084}. Best is trial 98 with value: 0.8791208791208791.
[32m[I 2023-04-21 02:06:15,421][39m Trial 1707 finished with value: 0.8275862068965518 and parameters: {'objective': 'CrossEntropy', 'colsample_bylevel': 0.0748761902124558, 'depth': 11, 'boosting_type': 'Plain', 'bootstrap_type': 'MVS'}. Best is trial 98 with value: 0.8791208791208791.
[32m[I 2023-04-21 02:06:16,178][39m Trial 1708 finished with value: 0.8275862068965518 and parameters: {'objective': 'CrossEntropy', 'colsample_bylevel': 0.0808237285513277, 'depth': 6, 'boosting_type': 'Plain', 'bootstrap_type': 'Bayesian', 'bagging_temperature': 9.098442303463084}. Best is trial 98 with value: 0.8791208791208791.
[32m[I 2023-04-21 02:06:17,087][39m Trial 1709 finished with value: 0.8539325842696629 and parameters: {'objective': 'CrossEntropy', 'colsample_bylevel': 0.07730190046470163, 'depth': 6, 'boosting_type': 'Plain', 'bootstrap_type': 'Bayesian', 'bagging_temperature': 9.237769385418249}. Best is trial 98 with value: 0.8791208791208791.
[32m[I 2023-04-21 02:06:18,178][39m Trial 1710 finished with value: 0.8505747126436782 and parameters: {'objective': 'CrossEntropy', 'colsample_bylevel': 0.07481593369937921, 'depth': 5, 'boosting_type': 'Plain', 'bootstrap_type': 'Bayesian', 'bagging_temperature': 9.02116075414012}. Best is trial 98 with value: 0.8791208791208791.
[32m[I 2023-04-21 02:06:22,937][39m Trial 1711 finished with value: 0.8275862068965518 and parameters: {'objective': 'CrossEntropy', 'colsample_bylevel': 0.08718810248409424, 'depth': 8, 'boosting_type': 'Ordered', 'bootstrap_type': 'Bayesian', 'bagging_temperature': 2.473875012972706}. Best is trial 98 with value: 0.8791208791208791.
[32m[I 2023-04-21 02:06:24,032][39m Trial 1712 finished with value: 0.8372093023255814 and parameters: {'objective': 'Logloss', 'colsample_bylevel': 0.028601074439622273, 'depth': 4, 'boosting_type': 'Plain', 'bootstrap_type': 'Bayesian', 'bagging_temperature': 9.817668787846365}. Best is trial 98 with value: 0.8791208791208791.
[32m[I 2023-04-21 02:06:24,774][39m Trial 1713 finished with value: 0.8539325842696629 and parameters: {'objective': 'CrossEntropy', 'colsample_bylevel': 0.07998552877927288, 'depth': 3, 'boosting_type': 'Plain', 'bootstrap_type': 'Bayesian', 'bagging_temperature': 8.342490595102745}. Best is trial 98 with value: 0.8791208791208791.
[32m[I 2023-04-21 02:06:25,758][39m Trial 1714 finished with value: 0.8505747126436782 and parameters: {'objective': 'CrossEntropy', 'colsample_bylevel': 0.08696632806901074, 'depth': 4, 'boosting_type': 'Plain', 'bootstrap_type': 'Bayesian', 'bagging_temperature': 8.660584591032212}. Best is trial 98 with value: 0.8791208791208791.
[32m[I 2023-04-21 02:06:26,557][39m Trial 1715 finished with value: 0.8045977011494252 and parameters: {'objective': 'CrossEntropy', 'colsample_bylevel': 0.08775538800585544, 'depth': 4, 'boosting_type': 'Plain', 'bootstrap_type': 'Bayesian', 'bagging_temperature': 3.7510840929512472}. Best is trial 98 with value: 0.8791208791208791.
[32m[I 2023-04-21 02:06:27,348][39m Trial 1716 finished with value: 0.8409090909090909 and parameters: {'objective': 'CrossEntropy', 'colsample_bylevel': 0.07723582649942888, 'depth': 11, 'boosting_type': 'Plain', 'bootstrap_type': 'Bayesian', 'bagging_temperature': 9.632901897402359}. Best is trial 98 with value: 0.8791208791208791.
[32m[I 2023-04-21 02:06:28,282][39m Trial 1717 finished with value: 0.8409090909090909 and parameters: {'objective': 'CrossEntropy', 'colsample_bylevel': 0.09703717488310568, 'depth': 3, 'boosting_type': 'Plain', 'bootstrap_type': 'Bayesian', 'bagging_temperature': 9.246477978919012}. Best is trial 98 with value: 0.8791208791208791.
[32m[I 2023-04-21 02:06:29,263][39m Trial 1718 finished with value: 0.8539325842696629 and parameters: {'objective': 'CrossEntropy', 'colsample_bylevel': 0.09413095454965038, 'depth': 3, 'boosting_type': 'Plain', 'bootstrap_type': 'Bayesian', 'bagging_temperature': 9.382709436115178}. Best is trial 98 with value: 0.8791208791208791.
