[32m[I 2023-04-21 02:20:14,994][39m Trial 2445 finished with value: 0.8409090909090909 and parameters: {'objective': 'CrossEntropy', 'colsample_bylevel': 0.08448640556314525, 'depth': 4, 'boosting_type': 'Plain', 'bootstrap_type': 'Bayesian', 'bagging_temperature': 7.657727093275753}. Best is trial 98 with value: 0.8791208791208791.
[32m[I 2023-04-21 02:20:16,020][39m Trial 2446 finished with value: 0.8409090909090909 and parameters: {'objective': 'CrossEntropy', 'colsample_bylevel': 0.08331456372615945, 'depth': 4, 'boosting_type': 'Plain', 'bootstrap_type': 'Bayesian', 'bagging_temperature': 7.671213688020124}. Best is trial 98 with value: 0.8791208791208791.
[32m[I 2023-04-21 02:20:17,010][39m Trial 2447 finished with value: 0.8539325842696629 and parameters: {'objective': 'Logloss', 'colsample_bylevel': 0.08017623611555125, 'depth': 4, 'boosting_type': 'Plain', 'bootstrap_type': 'Bayesian', 'bagging_temperature': 8.60725002524241}. Best is trial 98 with value: 0.8791208791208791.
[32m[I 2023-04-21 02:20:18,079][39m Trial 2448 finished with value: 0.8409090909090909 and parameters: {'objective': 'CrossEntropy', 'colsample_bylevel': 0.07794998295046407, 'depth': 2, 'boosting_type': 'Plain', 'bootstrap_type': 'Bayesian', 'bagging_temperature': 9.235764470051464}. Best is trial 98 with value: 0.8791208791208791.
[32m[I 2023-04-21 02:20:18,878][39m Trial 2449 finished with value: 0.8275862068965518 and parameters: {'objective': 'CrossEntropy', 'colsample_bylevel': 0.07822464723640145, 'depth': 11, 'boosting_type': 'Plain', 'bootstrap_type': 'Bernoulli', 'subsample': 0.6157866637431382}. Best is trial 98 with value: 0.8791208791208791.
[32m[I 2023-04-21 02:20:19,501][39m Trial 2450 finished with value: 0.8539325842696629 and parameters: {'objective': 'CrossEntropy', 'colsample_bylevel': 0.08155500793092238, 'depth': 4, 'boosting_type': 'Plain', 'bootstrap_type': 'Bayesian', 'bagging_temperature': 7.586756976665569}. Best is trial 98 with value: 0.8791208791208791.
[32m[I 2023-04-21 02:20:20,836][39m Trial 2451 finished with value: 0.8409090909090909 and parameters: {'objective': 'Logloss', 'colsample_bylevel': 0.07937641944321774, 'depth': 5, 'boosting_type': 'Plain', 'bootstrap_type': 'Bayesian', 'bagging_temperature': 8.746494625406825}. Best is trial 98 with value: 0.8791208791208791.
[32m[I 2023-04-21 02:20:21,848][39m Trial 2452 finished with value: 0.8539325842696629 and parameters: {'objective': 'CrossEntropy', 'colsample_bylevel': 0.07991561337827932, 'depth': 3, 'boosting_type': 'Plain', 'bootstrap_type': 'Bayesian', 'bagging_temperature': 9.024042114544732}. Best is trial 98 with value: 0.8791208791208791.
[32m[I 2023-04-21 02:20:23,061][39m Trial 2453 finished with value: 0.8409090909090909 and parameters: {'objective': 'CrossEntropy', 'colsample_bylevel': 0.08009662174078748, 'depth': 10, 'boosting_type': 'Plain', 'bootstrap_type': 'Bayesian', 'bagging_temperature': 8.122317579504314}. Best is trial 98 with value: 0.8791208791208791.
[32m[I 2023-04-21 02:20:23,957][39m Trial 2454 finished with value: 0.8409090909090909 and parameters: {'objective': 'CrossEntropy', 'colsample_bylevel': 0.05401016154086432, 'depth': 3, 'boosting_type': 'Plain', 'bootstrap_type': 'Bayesian', 'bagging_temperature': 9.371143915045673}. Best is trial 98 with value: 0.8791208791208791.
[32m[I 2023-04-21 02:20:24,602][39m Trial 2455 finished with value: 0.8791208791208791 and parameters: {'objective': 'CrossEntropy', 'colsample_bylevel': 0.08297840686518888, 'depth': 3, 'boosting_type': 'Plain', 'bootstrap_type': 'Bayesian', 'bagging_temperature': 9.60820534968495}. Best is trial 98 with value: 0.8791208791208791.
[32m[I 2023-04-21 02:20:25,243][39m Trial 2456 finished with value: 0.8139534883720929 and parameters: {'objective': 'CrossEntropy', 'colsample_bylevel': 0.09640147767809146, 'depth': 3, 'boosting_type': 'Plain', 'bootstrap_type': 'Bayesian', 'bagging_temperature': 8.870378561896507}. Best is trial 98 with value: 0.8791208791208791.
[32m[I 2023-04-21 02:20:26,075][39m Trial 2457 finished with value: 0.8666666666666666 and parameters: {'objective': 'CrossEntropy', 'colsample_bylevel': 0.0732255527232833, 'depth': 4, 'boosting_type': 'Plain', 'bootstrap_type': 'Bayesian', 'bagging_temperature': 9.378773553284043}. Best is trial 98 with value: 0.8791208791208791.
[32m[I 2023-04-21 02:20:27,070][39m Trial 2458 finished with value: 0.8275862068965518 and parameters: {'objective': 'CrossEntropy', 'colsample_bylevel': 0.07508543054452409, 'depth': 12, 'boosting_type': 'Plain', 'bootstrap_type': 'MVS'}. Best is trial 98 with value: 0.8791208791208791.
[32m[I 2023-04-21 02:20:28,254][39m Trial 2459 finished with value: 0.8314606741573034 and parameters: {'objective': 'CrossEntropy', 'colsample_bylevel': 0.07382614953393374, 'depth': 4, 'boosting_type': 'Plain', 'bootstrap_type': 'MVS'}. Best is trial 98 with value: 0.8791208791208791.
[32m[I 2023-04-21 02:20:29,064][39m Trial 2460 finished with value: 0.8275862068965518 and parameters: {'objective': 'CrossEntropy', 'colsample_bylevel': 0.031150298802847125, 'depth': 11, 'boosting_type': 'Plain', 'bootstrap_type': 'Bayesian', 'bagging_temperature': 9.785249432157997}. Best is trial 98 with value: 0.8791208791208791.
[32m[I 2023-04-21 02:20:29,714][39m Trial 2461 finished with value: 0.8666666666666666 and parameters: {'objective': 'Logloss', 'colsample_bylevel': 0.0729567470433968, 'depth': 4, 'boosting_type': 'Plain', 'bootstrap_type': 'Bayesian', 'bagging_temperature': 9.01818367533456}. Best is trial 98 with value: 0.8791208791208791.
[32m[I 2023-04-21 02:20:30,942][39m Trial 2462 finished with value: 0.8791208791208791 and parameters: {'objective': 'CrossEntropy', 'colsample_bylevel': 0.08048993011779644, 'depth': 3, 'boosting_type': 'Plain', 'bootstrap_type': 'Bayesian', 'bagging_temperature': 8.860394156424222}. Best is trial 98 with value: 0.8791208791208791.
[32m[I 2023-04-21 02:20:32,022][39m Trial 2463 finished with value: 0.8409090909090909 and parameters: {'objective': 'CrossEntropy', 'colsample_bylevel': 0.08104093233478965, 'depth': 10, 'boosting_type': 'Plain', 'bootstrap_type': 'Bayesian', 'bagging_temperature': 9.234216262247472}. Best is trial 98 with value: 0.8791208791208791.
[32m[I 2023-04-21 02:20:32,597][39m Trial 2464 finished with value: 0.725 and parameters: {'objective': 'CrossEntropy', 'colsample_bylevel': 0.01646650348271679, 'depth': 2, 'boosting_type': 'Plain', 'bootstrap_type': 'Bayesian', 'bagging_temperature': 9.069626441143857}. Best is trial 98 with value: 0.8791208791208791.
[32m[I 2023-04-21 02:20:33,344][39m Trial 2465 finished with value: 0.8409090909090909 and parameters: {'objective': 'CrossEntropy', 'colsample_bylevel': 0.07780992914166719, 'depth': 4, 'boosting_type': 'Plain', 'bootstrap_type': 'Bayesian', 'bagging_temperature': 5.857351073684752}. Best is trial 98 with value: 0.8791208791208791.
[32m[I 2023-04-21 02:20:38,491][39m Trial 2466 finished with value: 0.8314606741573034 and parameters: {'objective': 'CrossEntropy', 'colsample_bylevel': 0.07734407420069464, 'depth': 11, 'boosting_type': 'Ordered', 'bootstrap_type': 'Bernoulli', 'subsample': 0.7379733210967674}. Best is trial 98 with value: 0.8791208791208791.
[32m[I 2023-04-21 02:20:39,393][39m Trial 2467 finished with value: 0.8409090909090909 and parameters: {'objective': 'CrossEntropy', 'colsample_bylevel': 0.09695066592189697, 'depth': 4, 'boosting_type': 'Plain', 'bootstrap_type': 'Bayesian', 'bagging_temperature': 9.805239460639376}. Best is trial 98 with value: 0.8791208791208791.
[32m[I 2023-04-21 02:20:40,276][39m Trial 2468 finished with value: 0.8539325842696629 and parameters: {'objective': 'Logloss', 'colsample_bylevel': 0.0776524484835352, 'depth': 10, 'boosting_type': 'Plain', 'bootstrap_type': 'Bayesian', 'bagging_temperature': 9.520914233115409}. Best is trial 98 with value: 0.8791208791208791.
[32m[I 2023-04-21 02:20:41,215][39m Trial 2469 finished with value: 0.8181818181818182 and parameters: {'objective': 'CrossEntropy', 'colsample_bylevel': 0.07171451890557806, 'depth': 11, 'boosting_type': 'Plain', 'bootstrap_type': 'MVS'}. Best is trial 98 with value: 0.8791208791208791.
[32m[I 2023-04-21 02:20:42,165][39m Trial 2470 finished with value: 0.8666666666666666 and parameters: {'objective': 'CrossEntropy', 'colsample_bylevel': 0.06002808839124822, 'depth': 11, 'boosting_type': 'Plain', 'bootstrap_type': 'Bayesian', 'bagging_temperature': 9.398939594552504}. Best is trial 98 with value: 0.8791208791208791.
[32m[I 2023-04-21 02:20:43,242][39m Trial 2471 finished with value: 0.8539325842696629 and parameters: {'objective': 'CrossEntropy', 'colsample_bylevel': 0.07774458213589384, 'depth': 8, 'boosting_type': 'Plain', 'bootstrap_type': 'Bayesian', 'bagging_temperature': 9.804125181730095}. Best is trial 98 with value: 0.8791208791208791.
[32m[I 2023-04-21 02:20:43,948][39m Trial 2472 finished with value: 0.8409090909090909 and parameters: {'objective': 'CrossEntropy', 'colsample_bylevel': 0.07870440071323447, 'depth': 12, 'boosting_type': 'Plain', 'bootstrap_type': 'Bayesian', 'bagging_temperature': 9.638665940703849}. Best is trial 98 with value: 0.8791208791208791.
[32m[I 2023-04-21 02:20:44,939][39m Trial 2473 finished with value: 0.8539325842696629 and parameters: {'objective': 'CrossEntropy', 'colsample_bylevel': 0.08642941205707098, 'depth': 3, 'boosting_type': 'Plain', 'bootstrap_type': 'Bayesian', 'bagging_temperature': 8.750506542676083}. Best is trial 98 with value: 0.8791208791208791.
[32m[I 2023-04-21 02:20:45,848][39m Trial 2474 finished with value: 0.8539325842696629 and parameters: {'objective': 'CrossEntropy', 'colsample_bylevel': 0.0794378799255715, 'depth': 4, 'boosting_type': 'Plain', 'bootstrap_type': 'Bayesian', 'bagging_temperature': 9.98518043872225}. Best is trial 98 with value: 0.8791208791208791.
[32m[I 2023-04-21 02:20:46,601][39m Trial 2475 finished with value: 0.8409090909090909 and parameters: {'objective': 'CrossEntropy', 'colsample_bylevel': 0.07969106212679895, 'depth': 3, 'boosting_type': 'Plain', 'bootstrap_type': 'Bayesian', 'bagging_temperature': 2.2455813276074994}. Best is trial 98 with value: 0.8791208791208791.
[32m[I 2023-04-21 02:20:47,250][39m Trial 2476 finished with value: 0.8275862068965518 and parameters: {'objective': 'CrossEntropy', 'colsample_bylevel': 0.07959452892107297, 'depth': 3, 'boosting_type': 'Plain', 'bootstrap_type': 'Bayesian', 'bagging_temperature': 0.7305882885574837}. Best is trial 98 with value: 0.8791208791208791.
[32m[I 2023-04-21 02:20:48,605][39m Trial 2477 finished with value: 0.8636363636363636 and parameters: {'objective': 'CrossEntropy', 'colsample_bylevel': 0.09290586528761005, 'depth': 9, 'boosting_type': 'Plain', 'bootstrap_type': 'Bayesian', 'bagging_temperature': 9.78568155623947}. Best is trial 98 with value: 0.8791208791208791.
[32m[I 2023-04-21 02:20:49,409][39m Trial 2478 finished with value: 0.8539325842696629 and parameters: {'objective': 'CrossEntropy', 'colsample_bylevel': 0.07803486862938905, 'depth': 4, 'boosting_type': 'Plain', 'bootstrap_type': 'Bayesian', 'bagging_temperature': 9.66379038203376}. Best is trial 98 with value: 0.8791208791208791.
[32m[I 2023-04-21 02:20:50,315][39m Trial 2479 finished with value: 0.8666666666666666 and parameters: {'objective': 'CrossEntropy', 'colsample_bylevel': 0.07701834946072372, 'depth': 4, 'boosting_type': 'Plain', 'bootstrap_type': 'Bayesian', 'bagging_temperature': 9.863567523675862}. Best is trial 98 with value: 0.8791208791208791.
[32m[I 2023-04-21 02:20:51,047][39m Trial 2480 finished with value: 0.8666666666666666 and parameters: {'objective': 'CrossEntropy', 'colsample_bylevel': 0.09552250072514444, 'depth': 3, 'boosting_type': 'Plain', 'bootstrap_type': 'Bayesian', 'bagging_temperature': 8.798777333340993}. Best is trial 98 with value: 0.8791208791208791.
[32m[I 2023-04-21 02:20:52,348][39m Trial 2481 finished with value: 0.8409090909090909 and parameters: {'objective': 'CrossEntropy', 'colsample_bylevel': 0.08170642560247143, 'depth': 4, 'boosting_type': 'Plain', 'bootstrap_type': 'MVS'}. Best is trial 98 with value: 0.8791208791208791.
[32m[I 2023-04-21 02:20:57,133][39m Trial 2482 finished with value: 0.8139534883720929 and parameters: {'objective': 'Logloss', 'colsample_bylevel': 0.07429983908348392, 'depth': 10, 'boosting_type': 'Ordered', 'bootstrap_type': 'Bayesian', 'bagging_temperature': 8.051841049384077}. Best is trial 98 with value: 0.8791208791208791.
[32m[I 2023-04-21 02:20:58,306][39m Trial 2483 finished with value: 0.8372093023255814 and parameters: {'objective': 'CrossEntropy', 'colsample_bylevel': 0.08320519213263078, 'depth': 6, 'boosting_type': 'Plain', 'bootstrap_type': 'Bayesian', 'bagging_temperature': 9.296915529561149}. Best is trial 98 with value: 0.8791208791208791.
[32m[I 2023-04-21 02:20:59,069][39m Trial 2484 finished with value: 0.8539325842696629 and parameters: {'objective': 'CrossEntropy', 'colsample_bylevel': 0.0786638428851468, 'depth': 7, 'boosting_type': 'Plain', 'bootstrap_type': 'Bayesian', 'bagging_temperature': 9.224785307714965}. Best is trial 98 with value: 0.8791208791208791.
[32m[I 2023-04-21 02:21:00,194][39m Trial 2485 finished with value: 0.8409090909090909 and parameters: {'objective': 'CrossEntropy', 'colsample_bylevel': 0.07606914379596849, 'depth': 10, 'boosting_type': 'Plain', 'bootstrap_type': 'Bayesian', 'bagging_temperature': 9.874142070694823}. Best is trial 98 with value: 0.8791208791208791.
[32m[I 2023-04-21 02:21:01,011][39m Trial 2486 finished with value: 0.8539325842696629 and parameters: {'objective': 'CrossEntropy', 'colsample_bylevel': 0.07258430681133532, 'depth': 9, 'boosting_type': 'Plain', 'bootstrap_type': 'Bayesian', 'bagging_temperature': 7.678106689975556}. Best is trial 98 with value: 0.8791208791208791.
[32m[I 2023-04-21 02:21:02,043][39m Trial 2487 finished with value: 0.8666666666666666 and parameters: {'objective': 'Logloss', 'colsample_bylevel': 0.07748725270394641, 'depth': 10, 'boosting_type': 'Plain', 'bootstrap_type': 'Bayesian', 'bagging_temperature': 8.672741242685197}. Best is trial 98 with value: 0.8791208791208791.
[32m[I 2023-04-21 02:21:02,925][39m Trial 2488 finished with value: 0.8539325842696629 and parameters: {'objective': 'Logloss', 'colsample_bylevel': 0.07837210255757526, 'depth': 10, 'boosting_type': 'Plain', 'bootstrap_type': 'Bayesian', 'bagging_temperature': 8.159792581195513}. Best is trial 98 with value: 0.8791208791208791.
[32m[I 2023-04-21 02:21:03,728][39m Trial 2489 finished with value: 0.8409090909090909 and parameters: {'objective': 'CrossEntropy', 'colsample_bylevel': 0.07740082358340904, 'depth': 2, 'boosting_type': 'Plain', 'bootstrap_type': 'Bernoulli', 'subsample': 0.316190382228195}. Best is trial 98 with value: 0.8791208791208791.
[32m[I 2023-04-21 02:21:04,815][39m Trial 2490 finished with value: 0.8666666666666666 and parameters: {'objective': 'CrossEntropy', 'colsample_bylevel': 0.07168447831809427, 'depth': 11, 'boosting_type': 'Plain', 'bootstrap_type': 'Bayesian', 'bagging_temperature': 9.595368565406595}. Best is trial 98 with value: 0.8791208791208791.
[32m[I 2023-04-21 02:21:05,692][39m Trial 2491 finished with value: 0.8539325842696629 and parameters: {'objective': 'CrossEntropy', 'colsample_bylevel': 0.07878984228118194, 'depth': 11, 'boosting_type': 'Plain', 'bootstrap_type': 'Bayesian', 'bagging_temperature': 9.78632713192303}. Best is trial 98 with value: 0.8791208791208791.
[32m[I 2023-04-21 02:21:06,653][39m Trial 2492 finished with value: 0.8539325842696629 and parameters: {'objective': 'CrossEntropy', 'colsample_bylevel': 0.08150580900160459, 'depth': 3, 'boosting_type': 'Plain', 'bootstrap_type': 'Bayesian', 'bagging_temperature': 8.950113956975317}. Best is trial 98 with value: 0.8791208791208791.
[32m[I 2023-04-21 02:21:07,428][39m Trial 2493 finished with value: 0.8539325842696629 and parameters: {'objective': 'CrossEntropy', 'colsample_bylevel': 0.09222919811138035, 'depth': 3, 'boosting_type': 'Plain', 'bootstrap_type': 'Bayesian', 'bagging_temperature': 9.971900336238294}. Best is trial 98 with value: 0.8791208791208791.
[32m[I 2023-04-21 02:21:08,716][39m Trial 2494 finished with value: 0.8409090909090909 and parameters: {'objective': 'CrossEntropy', 'colsample_bylevel': 0.07727448545667875, 'depth': 2, 'boosting_type': 'Plain', 'bootstrap_type': 'MVS'}. Best is trial 98 with value: 0.8791208791208791.
[32m[I 2023-04-21 02:21:09,405][39m Trial 2495 finished with value: 0.8409090909090909 and parameters: {'objective': 'CrossEntropy', 'colsample_bylevel': 0.07579813335043464, 'depth': 11, 'boosting_type': 'Plain', 'bootstrap_type': 'Bayesian', 'bagging_temperature': 8.231086978366518}. Best is trial 98 with value: 0.8791208791208791.
[32m[I 2023-04-21 02:21:10,520][39m Trial 2496 finished with value: 0.8539325842696629 and parameters: {'objective': 'CrossEntropy', 'colsample_bylevel': 0.06966115282395609, 'depth': 11, 'boosting_type': 'Plain', 'bootstrap_type': 'Bayesian', 'bagging_temperature': 7.868281149790964}. Best is trial 98 with value: 0.8791208791208791.
[32m[I 2023-04-21 02:21:11,548][39m Trial 2497 finished with value: 0.8539325842696629 and parameters: {'objective': 'CrossEntropy', 'colsample_bylevel': 0.08356629382524176, 'depth': 3, 'boosting_type': 'Plain', 'bootstrap_type': 'Bayesian', 'bagging_temperature': 8.584329463936436}. Best is trial 98 with value: 0.8791208791208791.
[32m[I 2023-04-21 02:21:12,772][39m Trial 2498 finished with value: 0.8409090909090909 and parameters: {'objective': 'CrossEntropy', 'colsample_bylevel': 0.07103626702967622, 'depth': 10, 'boosting_type': 'Plain', 'bootstrap_type': 'Bayesian', 'bagging_temperature': 9.22895935192082}. Best is trial 98 with value: 0.8791208791208791.
[32m[I 2023-04-21 02:21:13,424][39m Trial 2499 finished with value: 0.8409090909090909 and parameters: {'objective': 'CrossEntropy', 'colsample_bylevel': 0.08214932588768561, 'depth': 3, 'boosting_type': 'Plain', 'bootstrap_type': 'Bayesian', 'bagging_temperature': 8.651386178521065}. Best is trial 98 with value: 0.8791208791208791.
[32m[I 2023-04-21 02:21:18,230][39m Trial 2500 finished with value: 0.8409090909090909 and parameters: {'objective': 'CrossEntropy', 'colsample_bylevel': 0.08668911911981662, 'depth': 3, 'boosting_type': 'Ordered', 'bootstrap_type': 'Bayesian', 'bagging_temperature': 9.932283753889667}. Best is trial 98 with value: 0.8791208791208791.
[32m[I 2023-04-21 02:21:19,244][39m Trial 2501 finished with value: 0.8539325842696629 and parameters: {'objective': 'CrossEntropy', 'colsample_bylevel': 0.042300340549647694, 'depth': 10, 'boosting_type': 'Plain', 'bootstrap_type': 'Bayesian', 'bagging_temperature': 9.532739159218345}. Best is trial 98 with value: 0.8791208791208791.
[32m[I 2023-04-21 02:21:20,677][39m Trial 2502 finished with value: 0.8539325842696629 and parameters: {'objective': 'CrossEntropy', 'colsample_bylevel': 0.08098105677052451, 'depth': 9, 'boosting_type': 'Plain', 'bootstrap_type': 'Bayesian', 'bagging_temperature': 9.233912631670337}. Best is trial 98 with value: 0.8791208791208791.
[32m[I 2023-04-21 02:21:21,356][39m Trial 2503 finished with value: 0.8539325842696629 and parameters: {'objective': 'CrossEntropy', 'colsample_bylevel': 0.0720107677204889, 'depth': 11, 'boosting_type': 'Plain', 'bootstrap_type': 'Bayesian', 'bagging_temperature': 9.146529416190806}. Best is trial 98 with value: 0.8791208791208791.
[32m[I 2023-04-21 02:21:22,230][39m Trial 2504 finished with value: 0.8539325842696629 and parameters: {'objective': 'CrossEntropy', 'colsample_bylevel': 0.07725766006244301, 'depth': 8, 'boosting_type': 'Plain', 'bootstrap_type': 'Bayesian', 'bagging_temperature': 8.91397972513528}. Best is trial 98 with value: 0.8791208791208791.
[32m[I 2023-04-21 02:21:23,184][39m Trial 2505 finished with value: 0.8409090909090909 and parameters: {'objective': 'CrossEntropy', 'colsample_bylevel': 0.07941922982768858, 'depth': 3, 'boosting_type': 'Plain', 'bootstrap_type': 'Bayesian', 'bagging_temperature': 9.173140354094656}. Best is trial 98 with value: 0.8791208791208791.
[32m[I 2023-04-21 02:21:23,959][39m Trial 2506 finished with value: 0.8409090909090909 and parameters: {'objective': 'CrossEntropy', 'colsample_bylevel': 0.07078918085863323, 'depth': 11, 'boosting_type': 'Plain', 'bootstrap_type': 'Bayesian', 'bagging_temperature': 8.499816818845519}. Best is trial 98 with value: 0.8791208791208791.
[32m[I 2023-04-21 02:21:25,159][39m Trial 2507 finished with value: 0.8666666666666666 and parameters: {'objective': 'CrossEntropy', 'colsample_bylevel': 0.0824223986428817, 'depth': 3, 'boosting_type': 'Plain', 'bootstrap_type': 'Bayesian', 'bagging_temperature': 8.062242570916789}. Best is trial 98 with value: 0.8791208791208791.
[32m[I 2023-04-21 02:21:26,336][39m Trial 2508 finished with value: 0.8275862068965518 and parameters: {'objective': 'CrossEntropy', 'colsample_bylevel': 0.09542565033012235, 'depth': 3, 'boosting_type': 'Plain', 'bootstrap_type': 'MVS'}. Best is trial 98 with value: 0.8791208791208791.
[32m[I 2023-04-21 02:21:27,175][39m Trial 2509 finished with value: 0.8505747126436782 and parameters: {'objective': 'CrossEntropy', 'colsample_bylevel': 0.08003421067276095, 'depth': 7, 'boosting_type': 'Plain', 'bootstrap_type': 'Bayesian', 'bagging_temperature': 7.618062777701335}. Best is trial 98 with value: 0.8791208791208791.
[32m[I 2023-04-21 02:21:27,830][39m Trial 2510 finished with value: 0.8409090909090909 and parameters: {'objective': 'CrossEntropy', 'colsample_bylevel': 0.08121612572708542, 'depth': 6, 'boosting_type': 'Plain', 'bootstrap_type': 'Bayesian', 'bagging_temperature': 9.060150104073832}. Best is trial 98 with value: 0.8791208791208791.
