[32m[I 2023-04-21 02:40:44,549][39m Trial 3497 finished with value: 0.8409090909090909 and parameters: {'objective': 'CrossEntropy', 'colsample_bylevel': 0.09434656298481159, 'depth': 10, 'boosting_type': 'Plain', 'bootstrap_type': 'Bayesian', 'bagging_temperature': 8.301364507622765}. Best is trial 3065 with value: 0.8863636363636364.
[32m[I 2023-04-21 02:40:45,561][39m Trial 3498 finished with value: 0.8539325842696629 and parameters: {'objective': 'CrossEntropy', 'colsample_bylevel': 0.06855691414156612, 'depth': 11, 'boosting_type': 'Plain', 'bootstrap_type': 'Bayesian', 'bagging_temperature': 9.23589969853174}. Best is trial 3065 with value: 0.8863636363636364.
[32m[I 2023-04-21 02:40:46,895][39m Trial 3499 finished with value: 0.8505747126436782 and parameters: {'objective': 'CrossEntropy', 'colsample_bylevel': 0.09061829176627685, 'depth': 8, 'boosting_type': 'Plain', 'bootstrap_type': 'Bayesian', 'bagging_temperature': 9.84841121408431}. Best is trial 3065 with value: 0.8863636363636364.
[32m[I 2023-04-21 02:40:47,917][39m Trial 3500 finished with value: 0.8539325842696629 and parameters: {'objective': 'CrossEntropy', 'colsample_bylevel': 0.07240906626225056, 'depth': 10, 'boosting_type': 'Plain', 'bootstrap_type': 'Bayesian', 'bagging_temperature': 9.654394131738714}. Best is trial 3065 with value: 0.8863636363636364.
[32m[I 2023-04-21 02:40:48,837][39m Trial 3501 finished with value: 0.8409090909090909 and parameters: {'objective': 'CrossEntropy', 'colsample_bylevel': 0.05709283193829068, 'depth': 3, 'boosting_type': 'Plain', 'bootstrap_type': 'Bayesian', 'bagging_temperature': 8.545596352863749}. Best is trial 3065 with value: 0.8863636363636364.
[32m[I 2023-04-21 02:40:49,817][39m Trial 3502 finished with value: 0.8409090909090909 and parameters: {'objective': 'CrossEntropy', 'colsample_bylevel': 0.07601259126250796, 'depth': 2, 'boosting_type': 'Plain', 'bootstrap_type': 'MVS'}. Best is trial 3065 with value: 0.8863636363636364.
[32m[I 2023-04-21 02:40:51,016][39m Trial 3503 finished with value: 0.8539325842696629 and parameters: {'objective': 'CrossEntropy', 'colsample_bylevel': 0.08189541238774456, 'depth': 3, 'boosting_type': 'Plain', 'bootstrap_type': 'Bayesian', 'bagging_temperature': 8.422171986507456}. Best is trial 3065 with value: 0.8863636363636364.
[32m[I 2023-04-21 02:40:51,788][39m Trial 3504 finished with value: 0.8409090909090909 and parameters: {'objective': 'CrossEntropy', 'colsample_bylevel': 0.0780746319944393, 'depth': 4, 'boosting_type': 'Plain', 'bootstrap_type': 'Bayesian', 'bagging_temperature': 8.601793364443898}. Best is trial 3065 with value: 0.8863636363636364.
[32m[I 2023-04-21 02:40:52,421][39m Trial 3505 finished with value: 0.8409090909090909 and parameters: {'objective': 'CrossEntropy', 'colsample_bylevel': 0.08268629060706707, 'depth': 4, 'boosting_type': 'Plain', 'bootstrap_type': 'Bernoulli', 'subsample': 0.6000682264498415}. Best is trial 3065 with value: 0.8863636363636364.
[32m[I 2023-04-21 02:40:53,145][39m Trial 3506 finished with value: 0.8636363636363636 and parameters: {'objective': 'CrossEntropy', 'colsample_bylevel': 0.08232593463700529, 'depth': 9, 'boosting_type': 'Plain', 'bootstrap_type': 'Bayesian', 'bagging_temperature': 9.399930788405086}. Best is trial 3065 with value: 0.8863636363636364.
[32m[I 2023-04-21 02:40:54,219][39m Trial 3507 finished with value: 0.8409090909090909 and parameters: {'objective': 'CrossEntropy', 'colsample_bylevel': 0.07863177974391593, 'depth': 9, 'boosting_type': 'Plain', 'bootstrap_type': 'Bayesian', 'bagging_temperature': 9.263082347736278}. Best is trial 3065 with value: 0.8863636363636364.
[32m[I 2023-04-21 02:40:55,170][39m Trial 3508 finished with value: 0.8372093023255814 and parameters: {'objective': 'CrossEntropy', 'colsample_bylevel': 0.07673586194071823, 'depth': 9, 'boosting_type': 'Plain', 'bootstrap_type': 'Bayesian', 'bagging_temperature': 9.213992864442629}. Best is trial 3065 with value: 0.8863636363636364.
[32m[I 2023-04-21 02:40:56,231][39m Trial 3509 finished with value: 0.8275862068965518 and parameters: {'objective': 'CrossEntropy', 'colsample_bylevel': 0.08795949728756101, 'depth': 10, 'boosting_type': 'Plain', 'bootstrap_type': 'Bayesian', 'bagging_temperature': 9.989361893393742}. Best is trial 3065 with value: 0.8863636363636364.
[32m[I 2023-04-21 02:40:57,726][39m Trial 3510 finished with value: 0.8764044943820225 and parameters: {'objective': 'CrossEntropy', 'colsample_bylevel': 0.08622608439366454, 'depth': 2, 'boosting_type': 'Plain', 'bootstrap_type': 'Bayesian', 'bagging_temperature': 9.259239507955892}. Best is trial 3065 with value: 0.8863636363636364.
[32m[I 2023-04-21 02:40:58,398][39m Trial 3511 finished with value: 0.8275862068965518 and parameters: {'objective': 'CrossEntropy', 'colsample_bylevel': 0.06831427044329809, 'depth': 12, 'boosting_type': 'Plain', 'bootstrap_type': 'Bayesian', 'bagging_temperature': 6.872170921778681}. Best is trial 3065 with value: 0.8863636363636364.
[32m[I 2023-04-21 02:40:59,262][39m Trial 3512 finished with value: 0.8636363636363636 and parameters: {'objective': 'CrossEntropy', 'colsample_bylevel': 0.08535404729764642, 'depth': 8, 'boosting_type': 'Plain', 'bootstrap_type': 'Bayesian', 'bagging_temperature': 9.432822206595871}. Best is trial 3065 with value: 0.8863636363636364.
[32m[I 2023-04-21 02:41:00,078][39m Trial 3513 finished with value: 0.8539325842696629 and parameters: {'objective': 'Logloss', 'colsample_bylevel': 0.08067831323954515, 'depth': 3, 'boosting_type': 'Plain', 'bootstrap_type': 'Bayesian', 'bagging_temperature': 9.360880180459969}. Best is trial 3065 with value: 0.8863636363636364.
[32m[I 2023-04-21 02:41:01,029][39m Trial 3514 finished with value: 0.8666666666666666 and parameters: {'objective': 'CrossEntropy', 'colsample_bylevel': 0.07910464551783135, 'depth': 2, 'boosting_type': 'Plain', 'bootstrap_type': 'Bayesian', 'bagging_temperature': 9.86496000887605}. Best is trial 3065 with value: 0.8863636363636364.
[32m[I 2023-04-21 02:41:06,124][39m Trial 3515 finished with value: 0.8409090909090909 and parameters: {'objective': 'CrossEntropy', 'colsample_bylevel': 0.07658925722657436, 'depth': 9, 'boosting_type': 'Ordered', 'bootstrap_type': 'Bayesian', 'bagging_temperature': 9.800063256526736}. Best is trial 3065 with value: 0.8863636363636364.
[32m[I 2023-04-21 02:41:07,282][39m Trial 3516 finished with value: 0.8139534883720929 and parameters: {'objective': 'CrossEntropy', 'colsample_bylevel': 0.07957505759290132, 'depth': 4, 'boosting_type': 'Plain', 'bootstrap_type': 'Bayesian', 'bagging_temperature': 4.954627996358358}. Best is trial 3065 with value: 0.8863636363636364.
[32m[I 2023-04-21 02:41:08,294][39m Trial 3517 finished with value: 0.8409090909090909 and parameters: {'objective': 'CrossEntropy', 'colsample_bylevel': 0.07695059190403508, 'depth': 10, 'boosting_type': 'Plain', 'bootstrap_type': 'Bayesian', 'bagging_temperature': 8.02029018175853}. Best is trial 3065 with value: 0.8863636363636364.
[32m[I 2023-04-21 02:41:09,124][39m Trial 3518 finished with value: 0.8409090909090909 and parameters: {'objective': 'CrossEntropy', 'colsample_bylevel': 0.06749455546086047, 'depth': 9, 'boosting_type': 'Plain', 'bootstrap_type': 'MVS'}. Best is trial 3065 with value: 0.8863636363636364.
[32m[I 2023-04-21 02:41:09,745][39m Trial 3519 finished with value: 0.8275862068965518 and parameters: {'objective': 'CrossEntropy', 'colsample_bylevel': 0.06180642540757476, 'depth': 3, 'boosting_type': 'Plain', 'bootstrap_type': 'Bernoulli', 'subsample': 0.11861181695921791}. Best is trial 3065 with value: 0.8863636363636364.
[32m[I 2023-04-21 02:41:10,942][39m Trial 3520 finished with value: 0.8275862068965518 and parameters: {'objective': 'CrossEntropy', 'colsample_bylevel': 0.08402577777029427, 'depth': 10, 'boosting_type': 'Plain', 'bootstrap_type': 'Bayesian', 'bagging_temperature': 9.462085329895993}. Best is trial 3065 with value: 0.8863636363636364.
[32m[I 2023-04-21 02:41:12,024][39m Trial 3521 finished with value: 0.8539325842696629 and parameters: {'objective': 'CrossEntropy', 'colsample_bylevel': 0.07874451280387718, 'depth': 12, 'boosting_type': 'Plain', 'bootstrap_type': 'Bayesian', 'bagging_temperature': 6.375707944957118}. Best is trial 3065 with value: 0.8863636363636364.
[32m[I 2023-04-21 02:41:13,148][39m Trial 3522 finished with value: 0.7999999999999999 and parameters: {'objective': 'Logloss', 'colsample_bylevel': 0.06788466727994204, 'depth': 1, 'boosting_type': 'Plain', 'bootstrap_type': 'Bayesian', 'bagging_temperature': 8.244822823336866}. Best is trial 3065 with value: 0.8863636363636364.
[32m[I 2023-04-21 02:41:13,828][39m Trial 3523 finished with value: 0.8539325842696629 and parameters: {'objective': 'CrossEntropy', 'colsample_bylevel': 0.08998472751899421, 'depth': 4, 'boosting_type': 'Plain', 'bootstrap_type': 'Bayesian', 'bagging_temperature': 9.78997615128519}. Best is trial 3065 with value: 0.8863636363636364.
[32m[I 2023-04-21 02:41:14,804][39m Trial 3524 finished with value: 0.8409090909090909 and parameters: {'objective': 'CrossEntropy', 'colsample_bylevel': 0.07456437660019348, 'depth': 8, 'boosting_type': 'Plain', 'bootstrap_type': 'Bayesian', 'bagging_temperature': 9.853996050047794}. Best is trial 3065 with value: 0.8863636363636364.
[32m[I 2023-04-21 02:41:15,936][39m Trial 3525 finished with value: 0.8275862068965518 and parameters: {'objective': 'Logloss', 'colsample_bylevel': 0.06467416544312997, 'depth': 4, 'boosting_type': 'Plain', 'bootstrap_type': 'Bayesian', 'bagging_temperature': 9.957604481790376}. Best is trial 3065 with value: 0.8863636363636364.
[32m[I 2023-04-21 02:41:16,631][39m Trial 3526 finished with value: 0.8666666666666666 and parameters: {'objective': 'CrossEntropy', 'colsample_bylevel': 0.0860079459642864, 'depth': 3, 'boosting_type': 'Plain', 'bootstrap_type': 'Bayesian', 'bagging_temperature': 9.801371168154967}. Best is trial 3065 with value: 0.8863636363636364.
[32m[I 2023-04-21 02:41:17,841][39m Trial 3527 finished with value: 0.8539325842696629 and parameters: {'objective': 'CrossEntropy', 'colsample_bylevel': 0.07564272312017942, 'depth': 11, 'boosting_type': 'Plain', 'bootstrap_type': 'Bayesian', 'bagging_temperature': 8.06147008295964}. Best is trial 3065 with value: 0.8863636363636364.
[32m[I 2023-04-21 02:41:18,781][39m Trial 3528 finished with value: 0.8139534883720929 and parameters: {'objective': 'Logloss', 'colsample_bylevel': 0.07704669915860832, 'depth': 10, 'boosting_type': 'Plain', 'bootstrap_type': 'Bayesian', 'bagging_temperature': 7.825374854906852}. Best is trial 3065 with value: 0.8863636363636364.
[32m[I 2023-04-21 02:41:19,732][39m Trial 3529 finished with value: 0.8409090909090909 and parameters: {'objective': 'CrossEntropy', 'colsample_bylevel': 0.07929519722594439, 'depth': 6, 'boosting_type': 'Plain', 'bootstrap_type': 'Bayesian', 'bagging_temperature': 9.54665558835853}. Best is trial 3065 with value: 0.8863636363636364.
[32m[I 2023-04-21 02:41:20,779][39m Trial 3530 finished with value: 0.8275862068965518 and parameters: {'objective': 'CrossEntropy', 'colsample_bylevel': 0.08037168161372694, 'depth': 10, 'boosting_type': 'Plain', 'bootstrap_type': 'Bayesian', 'bagging_temperature': 9.078962012826318}. Best is trial 3065 with value: 0.8863636363636364.
[32m[I 2023-04-21 02:41:21,777][39m Trial 3531 finished with value: 0.8409090909090909 and parameters: {'objective': 'CrossEntropy', 'colsample_bylevel': 0.07453634224984168, 'depth': 12, 'boosting_type': 'Plain', 'bootstrap_type': 'Bayesian', 'bagging_temperature': 8.15763747727664}. Best is trial 3065 with value: 0.8863636363636364.
[32m[I 2023-04-21 02:41:22,690][39m Trial 3532 finished with value: 0.8409090909090909 and parameters: {'objective': 'CrossEntropy', 'colsample_bylevel': 0.0782871969529423, 'depth': 3, 'boosting_type': 'Plain', 'bootstrap_type': 'MVS'}. Best is trial 3065 with value: 0.8863636363636364.
[32m[I 2023-04-21 02:41:23,608][39m Trial 3533 finished with value: 0.8539325842696629 and parameters: {'objective': 'CrossEntropy', 'colsample_bylevel': 0.05915307979406733, 'depth': 11, 'boosting_type': 'Plain', 'bootstrap_type': 'Bayesian', 'bagging_temperature': 8.875177380969001}. Best is trial 3065 with value: 0.8863636363636364.
[32m[I 2023-04-21 02:41:24,286][39m Trial 3534 finished with value: 0.8539325842696629 and parameters: {'objective': 'CrossEntropy', 'colsample_bylevel': 0.07837160004803964, 'depth': 10, 'boosting_type': 'Plain', 'bootstrap_type': 'Bayesian', 'bagging_temperature': 9.613546873242736}. Best is trial 3065 with value: 0.8863636363636364.
[32m[I 2023-04-21 02:41:29,369][39m Trial 3535 finished with value: 0.8409090909090909 and parameters: {'objective': 'Logloss', 'colsample_bylevel': 0.07406984271774182, 'depth': 9, 'boosting_type': 'Ordered', 'bootstrap_type': 'Bayesian', 'bagging_temperature': 9.665850718641229}. Best is trial 3065 with value: 0.8863636363636364.
[32m[I 2023-04-21 02:41:30,322][39m Trial 3536 finished with value: 0.8666666666666666 and parameters: {'objective': 'CrossEntropy', 'colsample_bylevel': 0.0671752220564226, 'depth': 7, 'boosting_type': 'Plain', 'bootstrap_type': 'Bayesian', 'bagging_temperature': 8.515064771872591}. Best is trial 3065 with value: 0.8863636363636364.
[32m[I 2023-04-21 02:41:31,724][39m Trial 3537 finished with value: 0.8505747126436782 and parameters: {'objective': 'CrossEntropy', 'colsample_bylevel': 0.09317351791260749, 'depth': 8, 'boosting_type': 'Plain', 'bootstrap_type': 'Bayesian', 'bagging_temperature': 9.995526216347061}. Best is trial 3065 with value: 0.8863636363636364.
[32m[I 2023-04-21 02:41:32,680][39m Trial 3538 finished with value: 0.8409090909090909 and parameters: {'objective': 'CrossEntropy', 'colsample_bylevel': 0.07545272140446925, 'depth': 12, 'boosting_type': 'Plain', 'bootstrap_type': 'MVS'}. Best is trial 3065 with value: 0.8863636363636364.
[32m[I 2023-04-21 02:41:33,522][39m Trial 3539 finished with value: 0.8372093023255814 and parameters: {'objective': 'CrossEntropy', 'colsample_bylevel': 0.07380705741430765, 'depth': 1, 'boosting_type': 'Plain', 'bootstrap_type': 'Bayesian', 'bagging_temperature': 9.221817618613231}. Best is trial 3065 with value: 0.8863636363636364.
[32m[I 2023-04-21 02:41:34,162][39m Trial 3540 finished with value: 0.8666666666666666 and parameters: {'objective': 'CrossEntropy', 'colsample_bylevel': 0.07100448613754964, 'depth': 4, 'boosting_type': 'Plain', 'bootstrap_type': 'Bayesian', 'bagging_temperature': 9.136714673238284}. Best is trial 3065 with value: 0.8863636363636364.
[32m[I 2023-04-21 02:41:35,046][39m Trial 3541 finished with value: 0.8666666666666666 and parameters: {'objective': 'CrossEntropy', 'colsample_bylevel': 0.08340802989218851, 'depth': 3, 'boosting_type': 'Plain', 'bootstrap_type': 'Bayesian', 'bagging_temperature': 9.072020649137299}. Best is trial 3065 with value: 0.8863636363636364.
[32m[I 2023-04-21 02:41:36,430][39m Trial 3542 finished with value: 0.8505747126436782 and parameters: {'objective': 'CrossEntropy', 'colsample_bylevel': 0.07667672472350089, 'depth': 10, 'boosting_type': 'Plain', 'bootstrap_type': 'Bayesian', 'bagging_temperature': 8.806264278915243}. Best is trial 3065 with value: 0.8863636363636364.
[32m[I 2023-04-21 02:41:37,488][39m Trial 3543 finished with value: 0.8666666666666666 and parameters: {'objective': 'CrossEntropy', 'colsample_bylevel': 0.09785111878318474, 'depth': 3, 'boosting_type': 'Plain', 'bootstrap_type': 'Bayesian', 'bagging_temperature': 9.082705010855}. Best is trial 3065 with value: 0.8863636363636364.
[32m[I 2023-04-21 02:41:38,488][39m Trial 3544 finished with value: 0.8666666666666666 and parameters: {'objective': 'CrossEntropy', 'colsample_bylevel': 0.08296587872702327, 'depth': 3, 'boosting_type': 'Plain', 'bootstrap_type': 'Bayesian', 'bagging_temperature': 8.909294990858696}. Best is trial 3065 with value: 0.8863636363636364.
[32m[I 2023-04-21 02:41:39,447][39m Trial 3545 finished with value: 0.8539325842696629 and parameters: {'objective': 'Logloss', 'colsample_bylevel': 0.07275417569896653, 'depth': 7, 'boosting_type': 'Plain', 'bootstrap_type': 'Bayesian', 'bagging_temperature': 7.957354612456266}. Best is trial 3065 with value: 0.8863636363636364.
[32m[I 2023-04-21 02:41:40,306][39m Trial 3546 finished with value: 0.8539325842696629 and parameters: {'objective': 'Logloss', 'colsample_bylevel': 0.07123041307689235, 'depth': 10, 'boosting_type': 'Plain', 'bootstrap_type': 'Bayesian', 'bagging_temperature': 8.073191435825581}. Best is trial 3065 with value: 0.8863636363636364.
[32m[I 2023-04-21 02:41:40,941][39m Trial 3547 finished with value: 0.8409090909090909 and parameters: {'objective': 'Logloss', 'colsample_bylevel': 0.06864968840318289, 'depth': 5, 'boosting_type': 'Plain', 'bootstrap_type': 'Bernoulli', 'subsample': 0.22197986341157638}. Best is trial 3065 with value: 0.8863636363636364.
[32m[I 2023-04-21 02:41:42,088][39m Trial 3548 finished with value: 0.8181818181818182 and parameters: {'objective': 'CrossEntropy', 'colsample_bylevel': 0.08114154383142184, 'depth': 9, 'boosting_type': 'Plain', 'bootstrap_type': 'MVS'}. Best is trial 3065 with value: 0.8863636363636364.
[32m[I 2023-04-21 02:41:43,254][39m Trial 3549 finished with value: 0.8539325842696629 and parameters: {'objective': 'CrossEntropy', 'colsample_bylevel': 0.0744663709939691, 'depth': 4, 'boosting_type': 'Plain', 'bootstrap_type': 'Bayesian', 'bagging_temperature': 9.914088498978254}. Best is trial 3065 with value: 0.8863636363636364.
[32m[I 2023-04-21 02:41:44,113][39m Trial 3550 finished with value: 0.8275862068965518 and parameters: {'objective': 'CrossEntropy', 'colsample_bylevel': 0.06713351723397791, 'depth': 2, 'boosting_type': 'Plain', 'bootstrap_type': 'Bayesian', 'bagging_temperature': 9.959655709669791}. Best is trial 3065 with value: 0.8863636363636364.
[32m[I 2023-04-21 02:41:44,803][39m Trial 3551 finished with value: 0.8666666666666666 and parameters: {'objective': 'CrossEntropy', 'colsample_bylevel': 0.06686845672325517, 'depth': 3, 'boosting_type': 'Plain', 'bootstrap_type': 'Bayesian', 'bagging_temperature': 9.792219118341238}. Best is trial 3065 with value: 0.8863636363636364.
[32m[I 2023-04-21 02:41:45,810][39m Trial 3552 finished with value: 0.8539325842696629 and parameters: {'objective': 'Logloss', 'colsample_bylevel': 0.07506376160254641, 'depth': 10, 'boosting_type': 'Plain', 'bootstrap_type': 'Bayesian', 'bagging_temperature': 8.05504174000131}. Best is trial 3065 with value: 0.8863636363636364.
[32m[I 2023-04-21 02:41:46,793][39m Trial 3553 finished with value: 0.8539325842696629 and parameters: {'objective': 'CrossEntropy', 'colsample_bylevel': 0.06930885220177038, 'depth': 7, 'boosting_type': 'Plain', 'bootstrap_type': 'Bayesian', 'bagging_temperature': 9.99980274737597}. Best is trial 3065 with value: 0.8863636363636364.
[32m[I 2023-04-21 02:41:47,927][39m Trial 3554 finished with value: 0.8539325842696629 and parameters: {'objective': 'CrossEntropy', 'colsample_bylevel': 0.06939535367887847, 'depth': 8, 'boosting_type': 'Plain', 'bootstrap_type': 'Bayesian', 'bagging_temperature': 9.99387381431938}. Best is trial 3065 with value: 0.8863636363636364.
[32m[I 2023-04-21 02:41:48,623][39m Trial 3555 finished with value: 0.8275862068965518 and parameters: {'objective': 'CrossEntropy', 'colsample_bylevel': 0.07541555127998328, 'depth': 10, 'boosting_type': 'Plain', 'bootstrap_type': 'Bayesian', 'bagging_temperature': 8.054400382693805}. Best is trial 3065 with value: 0.8863636363636364.
[32m[I 2023-04-21 02:41:49,626][39m Trial 3556 finished with value: 0.8666666666666666 and parameters: {'objective': 'CrossEntropy', 'colsample_bylevel': 0.0702672428863089, 'depth': 5, 'boosting_type': 'Plain', 'bootstrap_type': 'Bayesian', 'bagging_temperature': 7.78312568850531}. Best is trial 3065 with value: 0.8863636363636364.
[32m[I 2023-04-21 02:41:54,443][39m Trial 3557 finished with value: 0.8181818181818182 and parameters: {'objective': 'CrossEntropy', 'colsample_bylevel': 0.07503049871837782, 'depth': 10, 'boosting_type': 'Ordered', 'bootstrap_type': 'Bayesian', 'bagging_temperature': 9.856547397497259}. Best is trial 3065 with value: 0.8863636363636364.
[32m[I 2023-04-21 02:41:55,649][39m Trial 3558 finished with value: 0.8539325842696629 and parameters: {'objective': 'Logloss', 'colsample_bylevel': 0.08046639208288067, 'depth': 3, 'boosting_type': 'Plain', 'bootstrap_type': 'Bayesian', 'bagging_temperature': 9.156645979081448}. Best is trial 3065 with value: 0.8863636363636364.
[32m[I 2023-04-21 02:41:56,690][39m Trial 3559 finished with value: 0.8409090909090909 and parameters: {'objective': 'CrossEntropy', 'colsample_bylevel': 0.07567644049210803, 'depth': 11, 'boosting_type': 'Plain', 'bootstrap_type': 'Bayesian', 'bagging_temperature': 9.380939390295833}. Best is trial 3065 with value: 0.8863636363636364.
[32m[I 2023-04-21 02:41:57,869][39m Trial 3560 finished with value: 0.8409090909090909 and parameters: {'objective': 'CrossEntropy', 'colsample_bylevel': 0.08267649675939767, 'depth': 10, 'boosting_type': 'Plain', 'bootstrap_type': 'Bayesian', 'bagging_temperature': 8.40779229269104}. Best is trial 3065 with value: 0.8863636363636364.
[32m[I 2023-04-21 02:41:58,563][39m Trial 3561 finished with value: 0.8666666666666666 and parameters: {'objective': 'CrossEntropy', 'colsample_bylevel': 0.07523895367649752, 'depth': 12, 'boosting_type': 'Plain', 'bootstrap_type': 'Bayesian', 'bagging_temperature': 9.753976893109055}. Best is trial 3065 with value: 0.8863636363636364.
