[32m[I 2023-04-21 02:15:07,643][39m Trial 2181 finished with value: 0.8409090909090909 and parameters: {'objective': 'CrossEntropy', 'colsample_bylevel': 0.07602509389130842, 'depth': 11, 'boosting_type': 'Plain', 'bootstrap_type': 'Bayesian', 'bagging_temperature': 9.633869776702909}. Best is trial 98 with value: 0.8791208791208791.
[32m[I 2023-04-21 02:15:12,406][39m Trial 2182 finished with value: 0.8089887640449439 and parameters: {'objective': 'CrossEntropy', 'colsample_bylevel': 0.08208103278403227, 'depth': 4, 'boosting_type': 'Ordered', 'bootstrap_type': 'MVS'}. Best is trial 98 with value: 0.8791208791208791.
[32m[I 2023-04-21 02:15:13,435][39m Trial 2183 finished with value: 0.8372093023255814 and parameters: {'objective': 'CrossEntropy', 'colsample_bylevel': 0.06994384605357164, 'depth': 11, 'boosting_type': 'Plain', 'bootstrap_type': 'Bayesian', 'bagging_temperature': 8.888808423790746}. Best is trial 98 with value: 0.8791208791208791.
[32m[I 2023-04-21 02:15:14,438][39m Trial 2184 finished with value: 0.8666666666666666 and parameters: {'objective': 'CrossEntropy', 'colsample_bylevel': 0.08414191699036712, 'depth': 2, 'boosting_type': 'Plain', 'bootstrap_type': 'Bayesian', 'bagging_temperature': 9.154153820667894}. Best is trial 98 with value: 0.8791208791208791.
[32m[I 2023-04-21 02:15:15,113][39m Trial 2185 finished with value: 0.8539325842696629 and parameters: {'objective': 'CrossEntropy', 'colsample_bylevel': 0.09233407172779352, 'depth': 3, 'boosting_type': 'Plain', 'bootstrap_type': 'Bayesian', 'bagging_temperature': 9.99532901389956}. Best is trial 98 with value: 0.8791208791208791.
[32m[I 2023-04-21 02:15:16,375][39m Trial 2186 finished with value: 0.8409090909090909 and parameters: {'objective': 'CrossEntropy', 'colsample_bylevel': 0.09515787296657639, 'depth': 3, 'boosting_type': 'Plain', 'bootstrap_type': 'Bayesian', 'bagging_temperature': 9.997288740414895}. Best is trial 98 with value: 0.8791208791208791.
[32m[I 2023-04-21 02:15:17,202][39m Trial 2187 finished with value: 0.8409090909090909 and parameters: {'objective': 'CrossEntropy', 'colsample_bylevel': 0.07912737807334941, 'depth': 4, 'boosting_type': 'Plain', 'bootstrap_type': 'Bayesian', 'bagging_temperature': 5.222316822100854}. Best is trial 98 with value: 0.8791208791208791.
[32m[I 2023-04-21 02:15:18,065][39m Trial 2188 finished with value: 0.8666666666666666 and parameters: {'objective': 'CrossEntropy', 'colsample_bylevel': 0.0785559966048861, 'depth': 4, 'boosting_type': 'Plain', 'bootstrap_type': 'Bayesian', 'bagging_temperature': 8.872720176337262}. Best is trial 98 with value: 0.8791208791208791.
[32m[I 2023-04-21 02:15:18,906][39m Trial 2189 finished with value: 0.8275862068965518 and parameters: {'objective': 'Logloss', 'colsample_bylevel': 0.06835348447530275, 'depth': 4, 'boosting_type': 'Plain', 'bootstrap_type': 'Bayesian', 'bagging_temperature': 7.139877479091722}. Best is trial 98 with value: 0.8791208791208791.
[32m[I 2023-04-21 02:15:20,052][39m Trial 2190 finished with value: 0.8409090909090909 and parameters: {'objective': 'CrossEntropy', 'colsample_bylevel': 0.07694937706723179, 'depth': 8, 'boosting_type': 'Plain', 'bootstrap_type': 'Bayesian', 'bagging_temperature': 9.30328777680194}. Best is trial 98 with value: 0.8791208791208791.
[32m[I 2023-04-21 02:15:21,034][39m Trial 2191 finished with value: 0.8409090909090909 and parameters: {'objective': 'CrossEntropy', 'colsample_bylevel': 0.07432316320712436, 'depth': 4, 'boosting_type': 'Plain', 'bootstrap_type': 'Bayesian', 'bagging_temperature': 8.79745459851742}. Best is trial 98 with value: 0.8791208791208791.
[32m[I 2023-04-21 02:15:22,056][39m Trial 2192 finished with value: 0.8539325842696629 and parameters: {'objective': 'CrossEntropy', 'colsample_bylevel': 0.0739266707619692, 'depth': 4, 'boosting_type': 'Plain', 'bootstrap_type': 'Bayesian', 'bagging_temperature': 8.72942202728327}. Best is trial 98 with value: 0.8791208791208791.
[32m[I 2023-04-21 02:15:22,698][39m Trial 2193 finished with value: 0.8539325842696629 and parameters: {'objective': 'Logloss', 'colsample_bylevel': 0.08490684042675317, 'depth': 3, 'boosting_type': 'Plain', 'bootstrap_type': 'Bayesian', 'bagging_temperature': 8.50605607068674}. Best is trial 98 with value: 0.8791208791208791.
[32m[I 2023-04-21 02:15:23,492][39m Trial 2194 finished with value: 0.8539325842696629 and parameters: {'objective': 'Logloss', 'colsample_bylevel': 0.08583181756499036, 'depth': 3, 'boosting_type': 'Plain', 'bootstrap_type': 'Bayesian', 'bagging_temperature': 7.94639224197399}. Best is trial 98 with value: 0.8791208791208791.
[32m[I 2023-04-21 02:15:24,367][39m Trial 2195 finished with value: 0.8666666666666666 and parameters: {'objective': 'Logloss', 'colsample_bylevel': 0.08410397554237083, 'depth': 3, 'boosting_type': 'Plain', 'bootstrap_type': 'Bayesian', 'bagging_temperature': 7.991033059977909}. Best is trial 98 with value: 0.8791208791208791.
[32m[I 2023-04-21 02:15:25,274][39m Trial 2196 finished with value: 0.8666666666666666 and parameters: {'objective': 'Logloss', 'colsample_bylevel': 0.08264102968390911, 'depth': 3, 'boosting_type': 'Plain', 'bootstrap_type': 'Bayesian', 'bagging_temperature': 8.53150856554898}. Best is trial 98 with value: 0.8791208791208791.
[32m[I 2023-04-21 02:15:26,196][39m Trial 2197 finished with value: 0.8409090909090909 and parameters: {'objective': 'CrossEntropy', 'colsample_bylevel': 0.07194944844309287, 'depth': 11, 'boosting_type': 'Plain', 'bootstrap_type': 'MVS'}. Best is trial 98 with value: 0.8791208791208791.
[32m[I 2023-04-21 02:15:31,543][39m Trial 2198 finished with value: 0.8139534883720929 and parameters: {'objective': 'CrossEntropy', 'colsample_bylevel': 0.08597198286813944, 'depth': 6, 'boosting_type': 'Ordered', 'bootstrap_type': 'Bayesian', 'bagging_temperature': 9.241249706362789}. Best is trial 98 with value: 0.8791208791208791.
[32m[I 2023-04-21 02:15:32,719][39m Trial 2199 finished with value: 0.8409090909090909 and parameters: {'objective': 'Logloss', 'colsample_bylevel': 0.07326282496958786, 'depth': 5, 'boosting_type': 'Plain', 'bootstrap_type': 'Bayesian', 'bagging_temperature': 6.665288529708722}. Best is trial 98 with value: 0.8791208791208791.
[32m[I 2023-04-21 02:15:33,648][39m Trial 2200 finished with value: 0.8666666666666666 and parameters: {'objective': 'CrossEntropy', 'colsample_bylevel': 0.07097769850796648, 'depth': 12, 'boosting_type': 'Plain', 'bootstrap_type': 'Bayesian', 'bagging_temperature': 9.764371786537268}. Best is trial 98 with value: 0.8791208791208791.
[32m[I 2023-04-21 02:15:34,567][39m Trial 2201 finished with value: 0.8409090909090909 and parameters: {'objective': 'Logloss', 'colsample_bylevel': 0.07931749316338407, 'depth': 5, 'boosting_type': 'Plain', 'bootstrap_type': 'Bernoulli', 'subsample': 0.9450219096703067}. Best is trial 98 with value: 0.8791208791208791.
[32m[I 2023-04-21 02:15:35,520][39m Trial 2202 finished with value: 0.8409090909090909 and parameters: {'objective': 'CrossEntropy', 'colsample_bylevel': 0.05193144956127647, 'depth': 11, 'boosting_type': 'Plain', 'bootstrap_type': 'Bayesian', 'bagging_temperature': 7.407346795219624}. Best is trial 98 with value: 0.8791208791208791.
[32m[I 2023-04-21 02:15:36,266][39m Trial 2203 finished with value: 0.8409090909090909 and parameters: {'objective': 'Logloss', 'colsample_bylevel': 0.060864160595918114, 'depth': 4, 'boosting_type': 'Plain', 'bootstrap_type': 'Bayesian', 'bagging_temperature': 9.023353936547023}. Best is trial 98 with value: 0.8791208791208791.
[32m[I 2023-04-21 02:15:36,882][39m Trial 2204 finished with value: 0.8275862068965518 and parameters: {'objective': 'CrossEntropy', 'colsample_bylevel': 0.0810104962374786, 'depth': 11, 'boosting_type': 'Plain', 'bootstrap_type': 'Bayesian', 'bagging_temperature': 8.996128632662733}. Best is trial 98 with value: 0.8791208791208791.
[32m[I 2023-04-21 02:15:38,002][39m Trial 2205 finished with value: 0.8409090909090909 and parameters: {'objective': 'Logloss', 'colsample_bylevel': 0.06700227984237002, 'depth': 5, 'boosting_type': 'Plain', 'bootstrap_type': 'Bayesian', 'bagging_temperature': 7.957918789722234}. Best is trial 98 with value: 0.8791208791208791.
[32m[I 2023-04-21 02:15:38,683][39m Trial 2206 finished with value: 0.8409090909090909 and parameters: {'objective': 'CrossEntropy', 'colsample_bylevel': 0.06279106699094439, 'depth': 3, 'boosting_type': 'Plain', 'bootstrap_type': 'Bayesian', 'bagging_temperature': 8.991974309217422}. Best is trial 98 with value: 0.8791208791208791.
[32m[I 2023-04-21 02:15:39,899][39m Trial 2207 finished with value: 0.8505747126436782 and parameters: {'objective': 'CrossEntropy', 'colsample_bylevel': 0.08370114825527228, 'depth': 2, 'boosting_type': 'Plain', 'bootstrap_type': 'Bayesian', 'bagging_temperature': 9.013517472812211}. Best is trial 98 with value: 0.8791208791208791.
[32m[I 2023-04-21 02:15:41,061][39m Trial 2208 finished with value: 0.8666666666666666 and parameters: {'objective': 'CrossEntropy', 'colsample_bylevel': 0.09285463896055084, 'depth': 3, 'boosting_type': 'Plain', 'bootstrap_type': 'Bayesian', 'bagging_temperature': 9.82392328286189}. Best is trial 98 with value: 0.8791208791208791.
[32m[I 2023-04-21 02:15:42,145][39m Trial 2209 finished with value: 0.8539325842696629 and parameters: {'objective': 'CrossEntropy', 'colsample_bylevel': 0.09143806700225686, 'depth': 3, 'boosting_type': 'Plain', 'bootstrap_type': 'Bayesian', 'bagging_temperature': 6.821167402855404}. Best is trial 98 with value: 0.8791208791208791.
[32m[I 2023-04-21 02:15:42,827][39m Trial 2210 finished with value: 0.8314606741573034 and parameters: {'objective': 'CrossEntropy', 'colsample_bylevel': 0.0786348856588087, 'depth': 2, 'boosting_type': 'Plain', 'bootstrap_type': 'MVS'}. Best is trial 98 with value: 0.8791208791208791.
[32m[I 2023-04-21 02:15:44,141][39m Trial 2211 finished with value: 0.8409090909090909 and parameters: {'objective': 'CrossEntropy', 'colsample_bylevel': 0.07816887062238818, 'depth': 11, 'boosting_type': 'Plain', 'bootstrap_type': 'Bayesian', 'bagging_temperature': 8.482031162907035}. Best is trial 98 with value: 0.8791208791208791.
[32m[I 2023-04-21 02:15:44,978][39m Trial 2212 finished with value: 0.8764044943820225 and parameters: {'objective': 'CrossEntropy', 'colsample_bylevel': 0.08386264099446285, 'depth': 2, 'boosting_type': 'Plain', 'bootstrap_type': 'Bayesian', 'bagging_temperature': 9.13023061970391}. Best is trial 98 with value: 0.8791208791208791.
[32m[I 2023-04-21 02:15:46,287][39m Trial 2213 finished with value: 0.8666666666666666 and parameters: {'objective': 'CrossEntropy', 'colsample_bylevel': 0.07656567054374107, 'depth': 3, 'boosting_type': 'Plain', 'bootstrap_type': 'Bayesian', 'bagging_temperature': 9.463262547644296}. Best is trial 98 with value: 0.8791208791208791.
[32m[I 2023-04-21 02:15:46,921][39m Trial 2214 finished with value: 0.8764044943820225 and parameters: {'objective': 'CrossEntropy', 'colsample_bylevel': 0.08673678075079001, 'depth': 2, 'boosting_type': 'Plain', 'bootstrap_type': 'Bayesian', 'bagging_temperature': 9.64029415488648}. Best is trial 98 with value: 0.8791208791208791.
[32m[I 2023-04-21 02:15:47,899][39m Trial 2215 finished with value: 0.8666666666666666 and parameters: {'objective': 'CrossEntropy', 'colsample_bylevel': 0.08278453573751053, 'depth': 3, 'boosting_type': 'Plain', 'bootstrap_type': 'Bayesian', 'bagging_temperature': 9.674303930611707}. Best is trial 98 with value: 0.8791208791208791.
[32m[I 2023-04-21 02:15:48,884][39m Trial 2216 finished with value: 0.8409090909090909 and parameters: {'objective': 'CrossEntropy', 'colsample_bylevel': 0.08169841493963433, 'depth': 3, 'boosting_type': 'Plain', 'bootstrap_type': 'Bayesian', 'bagging_temperature': 8.618018438319693}. Best is trial 98 with value: 0.8791208791208791.
[32m[I 2023-04-21 02:15:49,923][39m Trial 2217 finished with value: 0.8539325842696629 and parameters: {'objective': 'CrossEntropy', 'colsample_bylevel': 0.07623430172635888, 'depth': 7, 'boosting_type': 'Plain', 'bootstrap_type': 'Bayesian', 'bagging_temperature': 9.245099813515925}. Best is trial 98 with value: 0.8791208791208791.
[32m[I 2023-04-21 02:15:55,153][39m Trial 2218 finished with value: 0.8 and parameters: {'objective': 'Logloss', 'colsample_bylevel': 0.08005771685544813, 'depth': 5, 'boosting_type': 'Ordered', 'bootstrap_type': 'MVS'}. Best is trial 98 with value: 0.8791208791208791.
[32m[I 2023-04-21 02:15:56,079][39m Trial 2219 finished with value: 0.8409090909090909 and parameters: {'objective': 'CrossEntropy', 'colsample_bylevel': 0.06887709791534642, 'depth': 5, 'boosting_type': 'Plain', 'bootstrap_type': 'Bayesian', 'bagging_temperature': 9.44514153791804}. Best is trial 98 with value: 0.8791208791208791.
[32m[I 2023-04-21 02:15:57,067][39m Trial 2220 finished with value: 0.8409090909090909 and parameters: {'objective': 'CrossEntropy', 'colsample_bylevel': 0.07841207899767126, 'depth': 10, 'boosting_type': 'Plain', 'bootstrap_type': 'Bayesian', 'bagging_temperature': 8.485076688049096}. Best is trial 98 with value: 0.8791208791208791.
[32m[I 2023-04-21 02:15:58,128][39m Trial 2221 finished with value: 0.8275862068965518 and parameters: {'objective': 'CrossEntropy', 'colsample_bylevel': 0.08132406465485281, 'depth': 4, 'boosting_type': 'Plain', 'bootstrap_type': 'Bayesian', 'bagging_temperature': 6.142588484258464}. Best is trial 98 with value: 0.8791208791208791.
[32m[I 2023-04-21 02:15:58,863][39m Trial 2222 finished with value: 0.8666666666666666 and parameters: {'objective': 'CrossEntropy', 'colsample_bylevel': 0.08190268652874498, 'depth': 3, 'boosting_type': 'Plain', 'bootstrap_type': 'Bayesian', 'bagging_temperature': 9.584563802114818}. Best is trial 98 with value: 0.8791208791208791.
[32m[I 2023-04-21 02:15:59,670][39m Trial 2223 finished with value: 0.8409090909090909 and parameters: {'objective': 'CrossEntropy', 'colsample_bylevel': 0.08116424028859703, 'depth': 3, 'boosting_type': 'Plain', 'bootstrap_type': 'Bernoulli', 'subsample': 0.4442268947915452}. Best is trial 98 with value: 0.8791208791208791.
[32m[I 2023-04-21 02:16:00,571][39m Trial 2224 finished with value: 0.8539325842696629 and parameters: {'objective': 'CrossEntropy', 'colsample_bylevel': 0.08054033661649061, 'depth': 4, 'boosting_type': 'Plain', 'bootstrap_type': 'Bayesian', 'bagging_temperature': 9.090735271740192}. Best is trial 98 with value: 0.8791208791208791.
[32m[I 2023-04-21 02:16:01,660][39m Trial 2225 finished with value: 0.8139534883720929 and parameters: {'objective': 'CrossEntropy', 'colsample_bylevel': 0.07099570467869974, 'depth': 11, 'boosting_type': 'Plain', 'bootstrap_type': 'Bayesian', 'bagging_temperature': 9.37558956441973}. Best is trial 98 with value: 0.8791208791208791.
[32m[I 2023-04-21 02:16:02,571][39m Trial 2226 finished with value: 0.8275862068965518 and parameters: {'objective': 'CrossEntropy', 'colsample_bylevel': 0.09543888947466109, 'depth': 3, 'boosting_type': 'Plain', 'bootstrap_type': 'MVS'}. Best is trial 98 with value: 0.8791208791208791.
[32m[I 2023-04-21 02:16:03,450][39m Trial 2227 finished with value: 0.8636363636363636 and parameters: {'objective': 'CrossEntropy', 'colsample_bylevel': 0.08692573983585017, 'depth': 2, 'boosting_type': 'Plain', 'bootstrap_type': 'Bayesian', 'bagging_temperature': 8.62060994022748}. Best is trial 98 with value: 0.8791208791208791.
[32m[I 2023-04-21 02:16:04,460][39m Trial 2228 finished with value: 0.8539325842696629 and parameters: {'objective': 'CrossEntropy', 'colsample_bylevel': 0.07975688470308336, 'depth': 10, 'boosting_type': 'Plain', 'bootstrap_type': 'Bayesian', 'bagging_temperature': 9.527249588021247}. Best is trial 98 with value: 0.8791208791208791.
[32m[I 2023-04-21 02:16:05,129][39m Trial 2229 finished with value: 0.8791208791208791 and parameters: {'objective': 'CrossEntropy', 'colsample_bylevel': 0.07442369767690067, 'depth': 11, 'boosting_type': 'Plain', 'bootstrap_type': 'Bayesian', 'bagging_temperature': 9.623637613421602}. Best is trial 98 with value: 0.8791208791208791.
[32m[I 2023-04-21 02:16:06,134][39m Trial 2230 finished with value: 0.8505747126436782 and parameters: {'objective': 'CrossEntropy', 'colsample_bylevel': 0.08380425243891605, 'depth': 6, 'boosting_type': 'Plain', 'bootstrap_type': 'Bayesian', 'bagging_temperature': 9.19638573991663}. Best is trial 98 with value: 0.8791208791208791.
[32m[I 2023-04-21 02:16:07,060][39m Trial 2231 finished with value: 0.8409090909090909 and parameters: {'objective': 'CrossEntropy', 'colsample_bylevel': 0.07640703741168292, 'depth': 8, 'boosting_type': 'Plain', 'bootstrap_type': 'Bayesian', 'bagging_temperature': 8.359558769574988}. Best is trial 98 with value: 0.8791208791208791.
[32m[I 2023-04-21 02:16:07,985][39m Trial 2232 finished with value: 0.8275862068965518 and parameters: {'objective': 'CrossEntropy', 'colsample_bylevel': 0.09040229918892004, 'depth': 11, 'boosting_type': 'Plain', 'bootstrap_type': 'Bayesian', 'bagging_temperature': 9.40113418342821}. Best is trial 98 with value: 0.8791208791208791.
[32m[I 2023-04-21 02:16:08,870][39m Trial 2233 finished with value: 0.8045977011494252 and parameters: {'objective': 'CrossEntropy', 'colsample_bylevel': 0.08046668079054735, 'depth': 3, 'boosting_type': 'Plain', 'bootstrap_type': 'Bayesian', 'bagging_temperature': 3.0755799054025657}. Best is trial 98 with value: 0.8791208791208791.
[32m[I 2023-04-21 02:16:09,948][39m Trial 2234 finished with value: 0.8539325842696629 and parameters: {'objective': 'Logloss', 'colsample_bylevel': 0.07161961652978002, 'depth': 4, 'boosting_type': 'Plain', 'bootstrap_type': 'Bayesian', 'bagging_temperature': 9.35973550739669}. Best is trial 98 with value: 0.8791208791208791.
[32m[I 2023-04-21 02:16:11,117][39m Trial 2235 finished with value: 0.8275862068965518 and parameters: {'objective': 'CrossEntropy', 'colsample_bylevel': 0.07854728276527916, 'depth': 9, 'boosting_type': 'Plain', 'bootstrap_type': 'Bayesian', 'bagging_temperature': 8.906046451209859}. Best is trial 98 with value: 0.8791208791208791.
[32m[I 2023-04-21 02:16:12,077][39m Trial 2236 finished with value: 0.8666666666666666 and parameters: {'objective': 'Logloss', 'colsample_bylevel': 0.06940043845721425, 'depth': 12, 'boosting_type': 'Plain', 'bootstrap_type': 'Bayesian', 'bagging_temperature': 8.987903982507891}. Best is trial 98 with value: 0.8791208791208791.
[32m[I 2023-04-21 02:16:16,836][39m Trial 2237 finished with value: 0.8372093023255814 and parameters: {'objective': 'CrossEntropy', 'colsample_bylevel': 0.0765137138472717, 'depth': 11, 'boosting_type': 'Ordered', 'bootstrap_type': 'Bayesian', 'bagging_temperature': 9.551007929029389}. Best is trial 98 with value: 0.8791208791208791.
[32m[I 2023-04-21 02:16:17,954][39m Trial 2238 finished with value: 0.8275862068965518 and parameters: {'objective': 'CrossEntropy', 'colsample_bylevel': 0.08358699215052993, 'depth': 7, 'boosting_type': 'Plain', 'bootstrap_type': 'Bayesian', 'bagging_temperature': 8.212041635431866}. Best is trial 98 with value: 0.8791208791208791.
[32m[I 2023-04-21 02:16:19,128][39m Trial 2239 finished with value: 0.8791208791208791 and parameters: {'objective': 'CrossEntropy', 'colsample_bylevel': 0.07415543247398733, 'depth': 10, 'boosting_type': 'Plain', 'bootstrap_type': 'Bayesian', 'bagging_temperature': 9.321905222267402}. Best is trial 98 with value: 0.8791208791208791.
[32m[I 2023-04-21 02:16:19,956][39m Trial 2240 finished with value: 0.8409090909090909 and parameters: {'objective': 'CrossEntropy', 'colsample_bylevel': 0.07969905878494135, 'depth': 9, 'boosting_type': 'Plain', 'bootstrap_type': 'Bayesian', 'bagging_temperature': 9.211296409233388}. Best is trial 98 with value: 0.8791208791208791.
[32m[I 2023-04-21 02:16:20,985][39m Trial 2241 finished with value: 0.8409090909090909 and parameters: {'objective': 'Logloss', 'colsample_bylevel': 0.0721634411042675, 'depth': 5, 'boosting_type': 'Plain', 'bootstrap_type': 'MVS'}. Best is trial 98 with value: 0.8791208791208791.
[32m[I 2023-04-21 02:16:21,993][39m Trial 2242 finished with value: 0.8539325842696629 and parameters: {'objective': 'CrossEntropy', 'colsample_bylevel': 0.07461956182519032, 'depth': 4, 'boosting_type': 'Plain', 'bootstrap_type': 'Bayesian', 'bagging_temperature': 9.717399104966518}. Best is trial 98 with value: 0.8791208791208791.
[32m[I 2023-04-21 02:16:22,925][39m Trial 2243 finished with value: 0.8409090909090909 and parameters: {'objective': 'CrossEntropy', 'colsample_bylevel': 0.07729184024800981, 'depth': 12, 'boosting_type': 'Plain', 'bootstrap_type': 'Bayesian', 'bagging_temperature': 9.105496801245641}. Best is trial 98 with value: 0.8791208791208791.
[32m[I 2023-04-21 02:16:23,997][39m Trial 2244 finished with value: 0.8275862068965518 and parameters: {'objective': 'CrossEntropy', 'colsample_bylevel': 0.08699704303588794, 'depth': 4, 'boosting_type': 'Plain', 'bootstrap_type': 'Bayesian', 'bagging_temperature': 8.178664324945775}. Best is trial 98 with value: 0.8791208791208791.
[32m[I 2023-04-21 02:16:25,125][39m Trial 2245 finished with value: 0.8539325842696629 and parameters: {'objective': 'CrossEntropy', 'colsample_bylevel': 0.08258099104403227, 'depth': 9, 'boosting_type': 'Plain', 'bootstrap_type': 'Bayesian', 'bagging_temperature': 8.72808001855208}. Best is trial 98 with value: 0.8791208791208791.
[32m[I 2023-04-21 02:16:26,263][39m Trial 2246 finished with value: 0.8539325842696629 and parameters: {'objective': 'CrossEntropy', 'colsample_bylevel': 0.07583452981403611, 'depth': 11, 'boosting_type': 'Plain', 'bootstrap_type': 'Bernoulli', 'subsample': 0.9115037638021908}. Best is trial 98 with value: 0.8791208791208791.
