[32m[I 2023-04-21 01:55:34,681][39m Trial 1125 finished with value: 0.8666666666666666 and parameters: {'objective': 'CrossEntropy', 'colsample_bylevel': 0.08035515794602982, 'depth': 3, 'boosting_type': 'Plain', 'bootstrap_type': 'Bayesian', 'bagging_temperature': 8.77282264745231}. Best is trial 98 with value: 0.8791208791208791.
[32m[I 2023-04-21 01:55:35,343][39m Trial 1126 finished with value: 0.8409090909090909 and parameters: {'objective': 'CrossEntropy', 'colsample_bylevel': 0.09613456124922135, 'depth': 3, 'boosting_type': 'Plain', 'bootstrap_type': 'MVS'}. Best is trial 98 with value: 0.8791208791208791.
[32m[I 2023-04-21 01:55:36,246][39m Trial 1127 finished with value: 0.8539325842696629 and parameters: {'objective': 'CrossEntropy', 'colsample_bylevel': 0.07712935717644233, 'depth': 3, 'boosting_type': 'Plain', 'bootstrap_type': 'Bayesian', 'bagging_temperature': 9.548329104759205}. Best is trial 98 with value: 0.8791208791208791.
[32m[I 2023-04-21 01:55:37,105][39m Trial 1128 finished with value: 0.8539325842696629 and parameters: {'objective': 'Logloss', 'colsample_bylevel': 0.07550624457806279, 'depth': 3, 'boosting_type': 'Plain', 'bootstrap_type': 'Bayesian', 'bagging_temperature': 9.351757496995603}. Best is trial 98 with value: 0.8791208791208791.
[32m[I 2023-04-21 01:55:37,812][39m Trial 1129 finished with value: 0.8539325842696629 and parameters: {'objective': 'CrossEntropy', 'colsample_bylevel': 0.08113157537258316, 'depth': 3, 'boosting_type': 'Plain', 'bootstrap_type': 'Bayesian', 'bagging_temperature': 8.319474781508259}. Best is trial 98 with value: 0.8791208791208791.
[32m[I 2023-04-21 01:55:38,628][39m Trial 1130 finished with value: 0.8275862068965518 and parameters: {'objective': 'CrossEntropy', 'colsample_bylevel': 0.0783011199692523, 'depth': 6, 'boosting_type': 'Plain', 'bootstrap_type': 'Bayesian', 'bagging_temperature': 8.89549662554345}. Best is trial 98 with value: 0.8791208791208791.
[32m[I 2023-04-21 01:55:39,510][39m Trial 1131 finished with value: 0.8539325842696629 and parameters: {'objective': 'CrossEntropy', 'colsample_bylevel': 0.07302206330483312, 'depth': 3, 'boosting_type': 'Plain', 'bootstrap_type': 'Bayesian', 'bagging_temperature': 9.085340607165794}. Best is trial 98 with value: 0.8791208791208791.
[32m[I 2023-04-21 01:55:40,443][39m Trial 1132 finished with value: 0.8409090909090909 and parameters: {'objective': 'CrossEntropy', 'colsample_bylevel': 0.07645503723875628, 'depth': 3, 'boosting_type': 'Plain', 'bootstrap_type': 'Bayesian', 'bagging_temperature': 9.556135291529399}. Best is trial 98 with value: 0.8791208791208791.
[32m[I 2023-04-21 01:55:41,462][39m Trial 1133 finished with value: 0.8539325842696629 and parameters: {'objective': 'CrossEntropy', 'colsample_bylevel': 0.0797493165658457, 'depth': 3, 'boosting_type': 'Plain', 'bootstrap_type': 'Bayesian', 'bagging_temperature': 8.56651715556272}. Best is trial 98 with value: 0.8791208791208791.
[32m[I 2023-04-21 01:55:42,088][39m Trial 1134 finished with value: 0.8275862068965518 and parameters: {'objective': 'CrossEntropy', 'colsample_bylevel': 0.08210374923160572, 'depth': 3, 'boosting_type': 'Plain', 'bootstrap_type': 'Bayesian', 'bagging_temperature': 9.363921833554873}. Best is trial 98 with value: 0.8791208791208791.
[32m[I 2023-04-21 01:55:43,149][39m Trial 1135 finished with value: 0.8181818181818182 and parameters: {'objective': 'CrossEntropy', 'colsample_bylevel': 0.07918595818047935, 'depth': 4, 'boosting_type': 'Plain', 'bootstrap_type': 'Bayesian', 'bagging_temperature': 7.111250648933616}. Best is trial 98 with value: 0.8791208791208791.
[32m[I 2023-04-21 01:55:43,909][39m Trial 1136 finished with value: 0.8539325842696629 and parameters: {'objective': 'Logloss', 'colsample_bylevel': 0.0713039906511291, 'depth': 3, 'boosting_type': 'Plain', 'bootstrap_type': 'Bayesian', 'bagging_temperature': 9.161016268854567}. Best is trial 98 with value: 0.8791208791208791.
[32m[I 2023-04-21 01:55:44,680][39m Trial 1137 finished with value: 0.8539325842696629 and parameters: {'objective': 'CrossEntropy', 'colsample_bylevel': 0.0773046908442151, 'depth': 3, 'boosting_type': 'Plain', 'bootstrap_type': 'Bayesian', 'bagging_temperature': 9.728969968436392}. Best is trial 98 with value: 0.8791208791208791.
[32m[I 2023-04-21 01:55:45,525][39m Trial 1138 finished with value: 0.8275862068965518 and parameters: {'objective': 'CrossEntropy', 'colsample_bylevel': 0.0951062048895779, 'depth': 3, 'boosting_type': 'Plain', 'bootstrap_type': 'MVS'}. Best is trial 98 with value: 0.8791208791208791.
[32m[I 2023-04-21 01:55:46,534][39m Trial 1139 finished with value: 0.8275862068965518 and parameters: {'objective': 'CrossEntropy', 'colsample_bylevel': 0.08128871826844927, 'depth': 6, 'boosting_type': 'Plain', 'bootstrap_type': 'Bayesian', 'bagging_temperature': 9.500011505827567}. Best is trial 98 with value: 0.8791208791208791.
[32m[I 2023-04-21 01:55:47,382][39m Trial 1140 finished with value: 0.8409090909090909 and parameters: {'objective': 'CrossEntropy', 'colsample_bylevel': 0.07446994894931554, 'depth': 3, 'boosting_type': 'Plain', 'bootstrap_type': 'Bayesian', 'bagging_temperature': 8.796289304661178}. Best is trial 98 with value: 0.8791208791208791.
[32m[I 2023-04-21 01:55:52,332][39m Trial 1141 finished with value: 0.8666666666666666 and parameters: {'objective': 'CrossEntropy', 'colsample_bylevel': 0.07872406831227732, 'depth': 3, 'boosting_type': 'Ordered', 'bootstrap_type': 'Bayesian', 'bagging_temperature': 9.76562240524671}. Best is trial 98 with value: 0.8791208791208791.
[32m[I 2023-04-21 01:55:53,213][39m Trial 1142 finished with value: 0.8275862068965518 and parameters: {'objective': 'CrossEntropy', 'colsample_bylevel': 0.0803133203951293, 'depth': 4, 'boosting_type': 'Plain', 'bootstrap_type': 'Bayesian', 'bagging_temperature': 9.254313882220151}. Best is trial 98 with value: 0.8791208791208791.
[32m[I 2023-04-21 01:55:53,999][39m Trial 1143 finished with value: 0.8539325842696629 and parameters: {'objective': 'Logloss', 'colsample_bylevel': 0.08243095326343348, 'depth': 3, 'boosting_type': 'Plain', 'bootstrap_type': 'Bayesian', 'bagging_temperature': 8.029560745126474}. Best is trial 98 with value: 0.8791208791208791.
[32m[I 2023-04-21 01:55:54,774][39m Trial 1144 finished with value: 0.8666666666666666 and parameters: {'objective': 'CrossEntropy', 'colsample_bylevel': 0.07735082926563173, 'depth': 3, 'boosting_type': 'Plain', 'bootstrap_type': 'Bayesian', 'bagging_temperature': 8.611524219038982}. Best is trial 98 with value: 0.8791208791208791.
[32m[I 2023-04-21 01:55:55,757][39m Trial 1145 finished with value: 0.8409090909090909 and parameters: {'objective': 'CrossEntropy', 'colsample_bylevel': 0.07595336101457474, 'depth': 4, 'boosting_type': 'Plain', 'bootstrap_type': 'Bayesian', 'bagging_temperature': 9.494413406354068}. Best is trial 98 with value: 0.8791208791208791.
[32m[I 2023-04-21 01:55:56,432][39m Trial 1146 finished with value: 0.8275862068965518 and parameters: {'objective': 'CrossEntropy', 'colsample_bylevel': 0.08057550730542815, 'depth': 3, 'boosting_type': 'Plain', 'bootstrap_type': 'Bernoulli', 'subsample': 0.5592529929088894}. Best is trial 98 with value: 0.8791208791208791.
[32m[I 2023-04-21 01:55:57,302][39m Trial 1147 finished with value: 0.8539325842696629 and parameters: {'objective': 'CrossEntropy', 'colsample_bylevel': 0.09395122937036933, 'depth': 3, 'boosting_type': 'Plain', 'bootstrap_type': 'Bayesian', 'bagging_temperature': 8.977438930257213}. Best is trial 98 with value: 0.8791208791208791.
[32m[I 2023-04-21 01:55:58,166][39m Trial 1148 finished with value: 0.8409090909090909 and parameters: {'objective': 'CrossEntropy', 'colsample_bylevel': 0.07875286530772406, 'depth': 3, 'boosting_type': 'Plain', 'bootstrap_type': 'Bayesian', 'bagging_temperature': 8.388908197682564}. Best is trial 98 with value: 0.8791208791208791.
[32m[I 2023-04-21 01:55:58,997][39m Trial 1149 finished with value: 0.8539325842696629 and parameters: {'objective': 'CrossEntropy', 'colsample_bylevel': 0.07458720668801086, 'depth': 3, 'boosting_type': 'Plain', 'bootstrap_type': 'Bayesian', 'bagging_temperature': 9.642603246447822}. Best is trial 98 with value: 0.8791208791208791.
[32m[I 2023-04-21 01:55:59,864][39m Trial 1150 finished with value: 0.8409090909090909 and parameters: {'objective': 'CrossEntropy', 'colsample_bylevel': 0.08302717235000755, 'depth': 8, 'boosting_type': 'Plain', 'bootstrap_type': 'Bayesian', 'bagging_temperature': 9.845629232718666}. Best is trial 98 with value: 0.8791208791208791.
[32m[I 2023-04-21 01:56:00,578][39m Trial 1151 finished with value: 0.8275862068965518 and parameters: {'objective': 'Logloss', 'colsample_bylevel': 0.09307657999317438, 'depth': 4, 'boosting_type': 'Plain', 'bootstrap_type': 'MVS'}. Best is trial 98 with value: 0.8791208791208791.
[32m[I 2023-04-21 01:56:01,784][39m Trial 1152 finished with value: 0.8539325842696629 and parameters: {'objective': 'CrossEntropy', 'colsample_bylevel': 0.08140578877052429, 'depth': 3, 'boosting_type': 'Plain', 'bootstrap_type': 'Bayesian', 'bagging_temperature': 9.3739569426892}. Best is trial 98 with value: 0.8791208791208791.
[32m[I 2023-04-21 01:56:02,495][39m Trial 1153 finished with value: 0.8409090909090909 and parameters: {'objective': 'CrossEntropy', 'colsample_bylevel': 0.09628785558353015, 'depth': 5, 'boosting_type': 'Plain', 'bootstrap_type': 'Bayesian', 'bagging_temperature': 9.11710137573424}. Best is trial 98 with value: 0.8791208791208791.
[32m[I 2023-04-21 01:56:03,324][39m Trial 1154 finished with value: 0.8409090909090909 and parameters: {'objective': 'CrossEntropy', 'colsample_bylevel': 0.07663433727809191, 'depth': 3, 'boosting_type': 'Plain', 'bootstrap_type': 'Bayesian', 'bagging_temperature': 8.201252469356858}. Best is trial 98 with value: 0.8791208791208791.
[32m[I 2023-04-21 01:56:04,150][39m Trial 1155 finished with value: 0.8409090909090909 and parameters: {'objective': 'CrossEntropy', 'colsample_bylevel': 0.0792265106304625, 'depth': 3, 'boosting_type': 'Plain', 'bootstrap_type': 'Bayesian', 'bagging_temperature': 3.650479477678641}. Best is trial 98 with value: 0.8791208791208791.
[32m[I 2023-04-21 01:56:05,007][39m Trial 1156 finished with value: 0.8791208791208791 and parameters: {'objective': 'CrossEntropy', 'colsample_bylevel': 0.0821090860576945, 'depth': 3, 'boosting_type': 'Plain', 'bootstrap_type': 'Bayesian', 'bagging_temperature': 8.809160952282474}. Best is trial 98 with value: 0.8791208791208791.
[32m[I 2023-04-21 01:56:05,819][39m Trial 1157 finished with value: 0.8666666666666666 and parameters: {'objective': 'CrossEntropy', 'colsample_bylevel': 0.08314617410332735, 'depth': 3, 'boosting_type': 'Plain', 'bootstrap_type': 'Bayesian', 'bagging_temperature': 8.980300387781634}. Best is trial 98 with value: 0.8791208791208791.
[32m[I 2023-04-21 01:56:06,519][39m Trial 1158 finished with value: 0.8539325842696629 and parameters: {'objective': 'CrossEntropy', 'colsample_bylevel': 0.08077667961939865, 'depth': 4, 'boosting_type': 'Plain', 'bootstrap_type': 'Bayesian', 'bagging_temperature': 8.76280035813674}. Best is trial 98 with value: 0.8791208791208791.
[32m[I 2023-04-21 01:56:07,521][39m Trial 1159 finished with value: 0.8666666666666666 and parameters: {'objective': 'CrossEntropy', 'colsample_bylevel': 0.08314737210390893, 'depth': 3, 'boosting_type': 'Plain', 'bootstrap_type': 'Bayesian', 'bagging_temperature': 8.709764273492304}. Best is trial 98 with value: 0.8791208791208791.
[32m[I 2023-04-21 01:56:12,285][39m Trial 1160 finished with value: 0.8539325842696629 and parameters: {'objective': 'Logloss', 'colsample_bylevel': 0.07834768587586838, 'depth': 10, 'boosting_type': 'Ordered', 'bootstrap_type': 'Bayesian', 'bagging_temperature': 8.53708868076661}. Best is trial 98 with value: 0.8791208791208791.
[32m[I 2023-04-21 01:56:13,162][39m Trial 1161 finished with value: 0.8666666666666666 and parameters: {'objective': 'CrossEntropy', 'colsample_bylevel': 0.08269512284822492, 'depth': 3, 'boosting_type': 'Plain', 'bootstrap_type': 'Bayesian', 'bagging_temperature': 9.15129839798175}. Best is trial 98 with value: 0.8791208791208791.
[32m[I 2023-04-21 01:56:14,089][39m Trial 1162 finished with value: 0.8539325842696629 and parameters: {'objective': 'CrossEntropy', 'colsample_bylevel': 0.08073239249626017, 'depth': 3, 'boosting_type': 'Plain', 'bootstrap_type': 'Bayesian', 'bagging_temperature': 8.81677357283953}. Best is trial 98 with value: 0.8791208791208791.
[32m[I 2023-04-21 01:56:14,874][39m Trial 1163 finished with value: 0.8409090909090909 and parameters: {'objective': 'CrossEntropy', 'colsample_bylevel': 0.0813023147191884, 'depth': 3, 'boosting_type': 'Plain', 'bootstrap_type': 'MVS'}. Best is trial 98 with value: 0.8791208791208791.
[32m[I 2023-04-21 01:56:15,706][39m Trial 1164 finished with value: 0.8666666666666666 and parameters: {'objective': 'CrossEntropy', 'colsample_bylevel': 0.07303932672988793, 'depth': 4, 'boosting_type': 'Plain', 'bootstrap_type': 'Bayesian', 'bagging_temperature': 9.372519336466178}. Best is trial 98 with value: 0.8791208791208791.
[32m[I 2023-04-21 01:56:16,960][39m Trial 1165 finished with value: 0.8505747126436782 and parameters: {'objective': 'CrossEntropy', 'colsample_bylevel': 0.09505207617932475, 'depth': 6, 'boosting_type': 'Plain', 'bootstrap_type': 'Bayesian', 'bagging_temperature': 8.488690097288044}. Best is trial 98 with value: 0.8791208791208791.
[32m[I 2023-04-21 01:56:17,632][39m Trial 1166 finished with value: 0.8505747126436782 and parameters: {'objective': 'CrossEntropy', 'colsample_bylevel': 0.07598108532754877, 'depth': 3, 'boosting_type': 'Plain', 'bootstrap_type': 'Bayesian', 'bagging_temperature': 8.608821629685332}. Best is trial 98 with value: 0.8791208791208791.
[32m[I 2023-04-21 01:56:18,454][39m Trial 1167 finished with value: 0.8275862068965518 and parameters: {'objective': 'CrossEntropy', 'colsample_bylevel': 0.09216449819277787, 'depth': 3, 'boosting_type': 'Plain', 'bootstrap_type': 'Bernoulli', 'subsample': 0.9962762778440928}. Best is trial 98 with value: 0.8791208791208791.
[32m[I 2023-04-21 01:56:19,263][39m Trial 1168 finished with value: 0.8666666666666666 and parameters: {'objective': 'Logloss', 'colsample_bylevel': 0.08275584855224054, 'depth': 3, 'boosting_type': 'Plain', 'bootstrap_type': 'Bayesian', 'bagging_temperature': 8.917889768882882}. Best is trial 98 with value: 0.8791208791208791.
[32m[I 2023-04-21 01:56:20,109][39m Trial 1169 finished with value: 0.8791208791208791 and parameters: {'objective': 'CrossEntropy', 'colsample_bylevel': 0.08165815310724746, 'depth': 3, 'boosting_type': 'Plain', 'bootstrap_type': 'Bayesian', 'bagging_temperature': 9.215878546311874}. Best is trial 98 with value: 0.8791208791208791.
[32m[I 2023-04-21 01:56:20,923][39m Trial 1170 finished with value: 0.8666666666666666 and parameters: {'objective': 'CrossEntropy', 'colsample_bylevel': 0.08374468107845628, 'depth': 3, 'boosting_type': 'Plain', 'bootstrap_type': 'Bayesian', 'bagging_temperature': 8.237852179488234}. Best is trial 98 with value: 0.8791208791208791.
[32m[I 2023-04-21 01:56:21,837][39m Trial 1171 finished with value: 0.8409090909090909 and parameters: {'objective': 'CrossEntropy', 'colsample_bylevel': 0.07712438241419818, 'depth': 4, 'boosting_type': 'Plain', 'bootstrap_type': 'Bayesian', 'bagging_temperature': 9.822847707385806}. Best is trial 98 with value: 0.8791208791208791.
[32m[I 2023-04-21 01:56:22,823][39m Trial 1172 finished with value: 0.8539325842696629 and parameters: {'objective': 'CrossEntropy', 'colsample_bylevel': 0.07992468055616775, 'depth': 3, 'boosting_type': 'Plain', 'bootstrap_type': 'Bayesian', 'bagging_temperature': 9.246117679926375}. Best is trial 98 with value: 0.8791208791208791.
[32m[I 2023-04-21 01:56:23,793][39m Trial 1173 finished with value: 0.8539325842696629 and parameters: {'objective': 'CrossEntropy', 'colsample_bylevel': 0.09332205637681797, 'depth': 5, 'boosting_type': 'Plain', 'bootstrap_type': 'Bayesian', 'bagging_temperature': 9.612755628341567}. Best is trial 98 with value: 0.8791208791208791.
[32m[I 2023-04-21 01:56:24,530][39m Trial 1174 finished with value: 0.8666666666666666 and parameters: {'objective': 'CrossEntropy', 'colsample_bylevel': 0.08358739590973828, 'depth': 3, 'boosting_type': 'Plain', 'bootstrap_type': 'Bayesian', 'bagging_temperature': 8.905591365913097}. Best is trial 98 with value: 0.8791208791208791.
[32m[I 2023-04-21 01:56:25,286][39m Trial 1175 finished with value: 0.8275862068965518 and parameters: {'objective': 'CrossEntropy', 'colsample_bylevel': 0.08178876771186773, 'depth': 12, 'boosting_type': 'Plain', 'bootstrap_type': 'Bayesian', 'bagging_temperature': 9.067669423640547}. Best is trial 98 with value: 0.8791208791208791.
[32m[I 2023-04-21 01:56:26,260][39m Trial 1176 finished with value: 0.8222222222222222 and parameters: {'objective': 'Logloss', 'colsample_bylevel': 0.0789466093173089, 'depth': 3, 'boosting_type': 'Plain', 'bootstrap_type': 'MVS'}. Best is trial 98 with value: 0.8791208791208791.
[32m[I 2023-04-21 01:56:27,131][39m Trial 1177 finished with value: 0.8275862068965518 and parameters: {'objective': 'CrossEntropy', 'colsample_bylevel': 0.08007393798554491, 'depth': 4, 'boosting_type': 'Plain', 'bootstrap_type': 'Bayesian', 'bagging_temperature': 9.221315794821821}. Best is trial 98 with value: 0.8791208791208791.
[32m[I 2023-04-21 01:56:28,024][39m Trial 1178 finished with value: 0.8409090909090909 and parameters: {'objective': 'CrossEntropy', 'colsample_bylevel': 0.07803253105912156, 'depth': 3, 'boosting_type': 'Plain', 'bootstrap_type': 'Bayesian', 'bagging_temperature': 6.648003571903833}. Best is trial 98 with value: 0.8791208791208791.
[32m[I 2023-04-21 01:56:32,832][39m Trial 1179 finished with value: 0.8666666666666666 and parameters: {'objective': 'CrossEntropy', 'colsample_bylevel': 0.0960891024217797, 'depth': 3, 'boosting_type': 'Ordered', 'bootstrap_type': 'Bayesian', 'bagging_temperature': 9.819234115827822}. Best is trial 98 with value: 0.8791208791208791.
[32m[I 2023-04-21 01:56:33,838][39m Trial 1180 finished with value: 0.8275862068965518 and parameters: {'objective': 'CrossEntropy', 'colsample_bylevel': 0.08230060529387268, 'depth': 7, 'boosting_type': 'Plain', 'bootstrap_type': 'Bayesian', 'bagging_temperature': 9.02265603424427}. Best is trial 98 with value: 0.8791208791208791.
[32m[I 2023-04-21 01:56:34,740][39m Trial 1181 finished with value: 0.8409090909090909 and parameters: {'objective': 'CrossEntropy', 'colsample_bylevel': 0.09202386080154384, 'depth': 9, 'boosting_type': 'Plain', 'bootstrap_type': 'Bayesian', 'bagging_temperature': 8.742905957826572}. Best is trial 98 with value: 0.8791208791208791.
[32m[I 2023-04-21 01:56:35,408][39m Trial 1182 finished with value: 0.8409090909090909 and parameters: {'objective': 'CrossEntropy', 'colsample_bylevel': 0.07996030349459668, 'depth': 3, 'boosting_type': 'Plain', 'bootstrap_type': 'Bayesian', 'bagging_temperature': 9.34136448595997}. Best is trial 98 with value: 0.8791208791208791.
[32m[I 2023-04-21 01:56:36,534][39m Trial 1183 finished with value: 0.8666666666666666 and parameters: {'objective': 'CrossEntropy', 'colsample_bylevel': 0.04937688297357893, 'depth': 3, 'boosting_type': 'Plain', 'bootstrap_type': 'Bayesian', 'bagging_temperature': 9.549575391620136}. Best is trial 98 with value: 0.8791208791208791.
[32m[I 2023-04-21 01:56:37,783][39m Trial 1184 finished with value: 0.8666666666666666 and parameters: {'objective': 'Logloss', 'colsample_bylevel': 0.07557676156916647, 'depth': 4, 'boosting_type': 'Plain', 'bootstrap_type': 'Bayesian', 'bagging_temperature': 8.37319456912113}. Best is trial 98 with value: 0.8791208791208791.
[32m[I 2023-04-21 01:56:38,595][39m Trial 1185 finished with value: 0.8275862068965518 and parameters: {'objective': 'CrossEntropy', 'colsample_bylevel': 0.08168578094742848, 'depth': 3, 'boosting_type': 'Plain', 'bootstrap_type': 'Bayesian', 'bagging_temperature': 9.38117703952493}. Best is trial 98 with value: 0.8791208791208791.
[32m[I 2023-04-21 01:56:39,175][39m Trial 1186 finished with value: 0.8666666666666666 and parameters: {'objective': 'CrossEntropy', 'colsample_bylevel': 0.08372843674441834, 'depth': 3, 'boosting_type': 'Plain', 'bootstrap_type': 'Bayesian', 'bagging_temperature': 9.993145204705174}. Best is trial 98 with value: 0.8791208791208791.
[32m[I 2023-04-21 01:56:40,066][39m Trial 1187 finished with value: 0.8409090909090909 and parameters: {'objective': 'CrossEntropy', 'colsample_bylevel': 0.08175898724396755, 'depth': 3, 'boosting_type': 'Plain', 'bootstrap_type': 'Bayesian', 'bagging_temperature': 9.156951810448621}. Best is trial 98 with value: 0.8791208791208791.
[32m[I 2023-04-21 01:56:40,897][39m Trial 1188 finished with value: 0.8314606741573034 and parameters: {'objective': 'CrossEntropy', 'colsample_bylevel': 0.0837924585733612, 'depth': 3, 'boosting_type': 'Plain', 'bootstrap_type': 'Bernoulli', 'subsample': 0.7861910434263586}. Best is trial 98 with value: 0.8791208791208791.
[32m[I 2023-04-21 01:56:41,802][39m Trial 1189 finished with value: 0.8409090909090909 and parameters: {'objective': 'CrossEntropy', 'colsample_bylevel': 0.07066345689718848, 'depth': 5, 'boosting_type': 'Plain', 'bootstrap_type': 'MVS'}. Best is trial 98 with value: 0.8791208791208791.
[32m[I 2023-04-21 01:56:42,801][39m Trial 1190 finished with value: 0.8409090909090909 and parameters: {'objective': 'CrossEntropy', 'colsample_bylevel': 0.09421145512326612, 'depth': 4, 'boosting_type': 'Plain', 'bootstrap_type': 'Bayesian', 'bagging_temperature': 9.680214410580602}. Best is trial 98 with value: 0.8791208791208791.
