[32m[I 2023-04-21 02:22:47,686][39m Trial 2577 finished with value: 0.8409090909090909 and parameters: {'objective': 'CrossEntropy', 'colsample_bylevel': 0.03449231251527025, 'depth': 9, 'boosting_type': 'Plain', 'bootstrap_type': 'Bayesian', 'bagging_temperature': 9.149978234394782}. Best is trial 98 with value: 0.8791208791208791.
[32m[I 2023-04-21 02:22:48,670][39m Trial 2578 finished with value: 0.8275862068965518 and parameters: {'objective': 'Logloss', 'colsample_bylevel': 0.09792526578900697, 'depth': 4, 'boosting_type': 'Plain', 'bootstrap_type': 'Bayesian', 'bagging_temperature': 9.38150557679363}. Best is trial 98 with value: 0.8791208791208791.
[32m[I 2023-04-21 02:22:49,278][39m Trial 2579 finished with value: 0.8409090909090909 and parameters: {'objective': 'CrossEntropy', 'colsample_bylevel': 0.07237942811007687, 'depth': 4, 'boosting_type': 'Plain', 'bootstrap_type': 'Bayesian', 'bagging_temperature': 2.581917311093024}. Best is trial 98 with value: 0.8791208791208791.
[32m[I 2023-04-21 02:22:50,368][39m Trial 2580 finished with value: 0.7999999999999999 and parameters: {'objective': 'CrossEntropy', 'colsample_bylevel': 0.02560516971584224, 'depth': 2, 'boosting_type': 'Plain', 'bootstrap_type': 'Bayesian', 'bagging_temperature': 9.249251928045048}. Best is trial 98 with value: 0.8791208791208791.
[32m[I 2023-04-21 02:22:51,102][39m Trial 2581 finished with value: 0.8409090909090909 and parameters: {'objective': 'CrossEntropy', 'colsample_bylevel': 0.07791414561065718, 'depth': 3, 'boosting_type': 'Plain', 'bootstrap_type': 'Bayesian', 'bagging_temperature': 8.151687913738701}. Best is trial 98 with value: 0.8791208791208791.
[32m[I 2023-04-21 02:22:51,764][39m Trial 2582 finished with value: 0.8275862068965518 and parameters: {'objective': 'Logloss', 'colsample_bylevel': 0.08356525570954264, 'depth': 12, 'boosting_type': 'Plain', 'bootstrap_type': 'MVS'}. Best is trial 98 with value: 0.8791208791208791.
[32m[I 2023-04-21 02:22:52,914][39m Trial 2583 finished with value: 0.8539325842696629 and parameters: {'objective': 'CrossEntropy', 'colsample_bylevel': 0.0838295809959197, 'depth': 3, 'boosting_type': 'Plain', 'bootstrap_type': 'Bayesian', 'bagging_temperature': 9.664762450218037}. Best is trial 98 with value: 0.8791208791208791.
[32m[I 2023-04-21 02:22:53,873][39m Trial 2584 finished with value: 0.8666666666666666 and parameters: {'objective': 'CrossEntropy', 'colsample_bylevel': 0.0806709245245505, 'depth': 3, 'boosting_type': 'Plain', 'bootstrap_type': 'Bayesian', 'bagging_temperature': 9.760743334849156}. Best is trial 98 with value: 0.8791208791208791.
[32m[I 2023-04-21 02:22:54,822][39m Trial 2585 finished with value: 0.8409090909090909 and parameters: {'objective': 'Logloss', 'colsample_bylevel': 0.07717743127010647, 'depth': 6, 'boosting_type': 'Plain', 'bootstrap_type': 'Bayesian', 'bagging_temperature': 8.77577311769682}. Best is trial 98 with value: 0.8791208791208791.
[32m[I 2023-04-21 02:22:55,457][39m Trial 2586 finished with value: 0.8636363636363636 and parameters: {'objective': 'CrossEntropy', 'colsample_bylevel': 0.08329381798483045, 'depth': 10, 'boosting_type': 'Plain', 'bootstrap_type': 'Bayesian', 'bagging_temperature': 9.33355712124386}. Best is trial 98 with value: 0.8791208791208791.
[32m[I 2023-04-21 02:22:56,213][39m Trial 2587 finished with value: 0.8666666666666666 and parameters: {'objective': 'CrossEntropy', 'colsample_bylevel': 0.0850181989534261, 'depth': 3, 'boosting_type': 'Plain', 'bootstrap_type': 'Bayesian', 'bagging_temperature': 8.950165169763098}. Best is trial 98 with value: 0.8791208791208791.
[32m[I 2023-04-21 02:22:57,287][39m Trial 2588 finished with value: 0.8539325842696629 and parameters: {'objective': 'Logloss', 'colsample_bylevel': 0.081046679815744, 'depth': 10, 'boosting_type': 'Plain', 'bootstrap_type': 'Bayesian', 'bagging_temperature': 8.511040220783158}. Best is trial 98 with value: 0.8791208791208791.
[32m[I 2023-04-21 02:22:58,411][39m Trial 2589 finished with value: 0.7435897435897435 and parameters: {'objective': 'CrossEntropy', 'colsample_bylevel': 0.023416687088548986, 'depth': 3, 'boosting_type': 'Plain', 'bootstrap_type': 'Bayesian', 'bagging_temperature': 9.435039666321824}. Best is trial 98 with value: 0.8791208791208791.
[32m[I 2023-04-21 02:22:59,305][39m Trial 2590 finished with value: 0.8636363636363636 and parameters: {'objective': 'CrossEntropy', 'colsample_bylevel': 0.08928503503426952, 'depth': 2, 'boosting_type': 'Plain', 'bootstrap_type': 'Bayesian', 'bagging_temperature': 9.097857636850158}. Best is trial 98 with value: 0.8791208791208791.
[32m[I 2023-04-21 02:23:00,254][39m Trial 2591 finished with value: 0.8539325842696629 and parameters: {'objective': 'CrossEntropy', 'colsample_bylevel': 0.08215797853211579, 'depth': 3, 'boosting_type': 'Plain', 'bootstrap_type': 'Bayesian', 'bagging_temperature': 9.153261630765856}. Best is trial 98 with value: 0.8791208791208791.
[32m[I 2023-04-21 02:23:01,154][39m Trial 2592 finished with value: 0.8539325842696629 and parameters: {'objective': 'CrossEntropy', 'colsample_bylevel': 0.08072646882311263, 'depth': 10, 'boosting_type': 'Plain', 'bootstrap_type': 'Bayesian', 'bagging_temperature': 9.462439913192346}. Best is trial 98 with value: 0.8791208791208791.
[32m[I 2023-04-21 02:23:01,749][39m Trial 2593 finished with value: 0.8539325842696629 and parameters: {'objective': 'CrossEntropy', 'colsample_bylevel': 0.0712776279989075, 'depth': 10, 'boosting_type': 'Plain', 'bootstrap_type': 'Bayesian', 'bagging_temperature': 9.432336896298343}. Best is trial 98 with value: 0.8791208791208791.
[32m[I 2023-04-21 02:23:02,601][39m Trial 2594 finished with value: 0.8409090909090909 and parameters: {'objective': 'CrossEntropy', 'colsample_bylevel': 0.0754163150387986, 'depth': 11, 'boosting_type': 'Plain', 'bootstrap_type': 'MVS'}. Best is trial 98 with value: 0.8791208791208791.
[32m[I 2023-04-21 02:23:07,542][39m Trial 2595 finished with value: 0.8409090909090909 and parameters: {'objective': 'CrossEntropy', 'colsample_bylevel': 0.08297148368649254, 'depth': 3, 'boosting_type': 'Ordered', 'bootstrap_type': 'Bayesian', 'bagging_temperature': 8.833087559374697}. Best is trial 98 with value: 0.8791208791208791.
[32m[I 2023-04-21 02:23:08,572][39m Trial 2596 finished with value: 0.8539325842696629 and parameters: {'objective': 'CrossEntropy', 'colsample_bylevel': 0.08220886311844712, 'depth': 3, 'boosting_type': 'Plain', 'bootstrap_type': 'Bayesian', 'bagging_temperature': 8.640263603254411}. Best is trial 98 with value: 0.8791208791208791.
[32m[I 2023-04-21 02:23:09,985][39m Trial 2597 finished with value: 0.8409090909090909 and parameters: {'objective': 'CrossEntropy', 'colsample_bylevel': 0.07898149561878262, 'depth': 9, 'boosting_type': 'Plain', 'bootstrap_type': 'Bayesian', 'bagging_temperature': 5.393808947872464}. Best is trial 98 with value: 0.8791208791208791.
[32m[I 2023-04-21 02:23:10,793][39m Trial 2598 finished with value: 0.8539325842696629 and parameters: {'objective': 'CrossEntropy', 'colsample_bylevel': 0.08028718939634179, 'depth': 4, 'boosting_type': 'Plain', 'bootstrap_type': 'Bayesian', 'bagging_temperature': 8.994065315076679}. Best is trial 98 with value: 0.8791208791208791.
[32m[I 2023-04-21 02:23:11,825][39m Trial 2599 finished with value: 0.8275862068965518 and parameters: {'objective': 'CrossEntropy', 'colsample_bylevel': 0.08422238627329266, 'depth': 10, 'boosting_type': 'Plain', 'bootstrap_type': 'Bayesian', 'bagging_temperature': 9.2729554841964}. Best is trial 98 with value: 0.8791208791208791.
[32m[I 2023-04-21 02:23:12,973][39m Trial 2600 finished with value: 0.8539325842696629 and parameters: {'objective': 'CrossEntropy', 'colsample_bylevel': 0.0759738800220941, 'depth': 3, 'boosting_type': 'Plain', 'bootstrap_type': 'Bayesian', 'bagging_temperature': 9.839246939900017}. Best is trial 98 with value: 0.8791208791208791.
[32m[I 2023-04-21 02:23:13,760][39m Trial 2601 finished with value: 0.8666666666666666 and parameters: {'objective': 'Logloss', 'colsample_bylevel': 0.07836867723002772, 'depth': 8, 'boosting_type': 'Plain', 'bootstrap_type': 'Bayesian', 'bagging_temperature': 8.286214552137514}. Best is trial 98 with value: 0.8791208791208791.
[32m[I 2023-04-21 02:23:14,559][39m Trial 2602 finished with value: 0.8539325842696629 and parameters: {'objective': 'CrossEntropy', 'colsample_bylevel': 0.07016682125344822, 'depth': 3, 'boosting_type': 'Plain', 'bootstrap_type': 'Bayesian', 'bagging_temperature': 9.76456287553147}. Best is trial 98 with value: 0.8791208791208791.
[32m[I 2023-04-21 02:23:15,397][39m Trial 2603 finished with value: 0.8275862068965518 and parameters: {'objective': 'CrossEntropy', 'colsample_bylevel': 0.07567673057880754, 'depth': 11, 'boosting_type': 'Plain', 'bootstrap_type': 'Bayesian', 'bagging_temperature': 9.198595546437451}. Best is trial 98 with value: 0.8791208791208791.
[32m[I 2023-04-21 02:23:16,145][39m Trial 2604 finished with value: 0.8539325842696629 and parameters: {'objective': 'CrossEntropy', 'colsample_bylevel': 0.07609818879703685, 'depth': 11, 'boosting_type': 'Plain', 'bootstrap_type': 'Bayesian', 'bagging_temperature': 9.303860912411544}. Best is trial 98 with value: 0.8791208791208791.
[32m[I 2023-04-21 02:23:17,295][39m Trial 2605 finished with value: 0.8444444444444446 and parameters: {'objective': 'CrossEntropy', 'colsample_bylevel': 0.07270872803008332, 'depth': 11, 'boosting_type': 'Plain', 'bootstrap_type': 'Bernoulli', 'subsample': 0.9280536444234977}. Best is trial 98 with value: 0.8791208791208791.
[32m[I 2023-04-21 02:23:18,405][39m Trial 2606 finished with value: 0.8539325842696629 and parameters: {'objective': 'CrossEntropy', 'colsample_bylevel': 0.07701535556980033, 'depth': 11, 'boosting_type': 'Plain', 'bootstrap_type': 'Bayesian', 'bagging_temperature': 8.491081256030334}. Best is trial 98 with value: 0.8791208791208791.
[32m[I 2023-04-21 02:23:19,360][39m Trial 2607 finished with value: 0.8666666666666666 and parameters: {'objective': 'CrossEntropy', 'colsample_bylevel': 0.09169490423628701, 'depth': 3, 'boosting_type': 'Plain', 'bootstrap_type': 'Bayesian', 'bagging_temperature': 9.826310331617819}. Best is trial 98 with value: 0.8791208791208791.
[32m[I 2023-04-21 02:23:20,000][39m Trial 2608 finished with value: 0.8409090909090909 and parameters: {'objective': 'CrossEntropy', 'colsample_bylevel': 0.07917683610385305, 'depth': 6, 'boosting_type': 'Plain', 'bootstrap_type': 'Bayesian', 'bagging_temperature': 8.758764978214213}. Best is trial 98 with value: 0.8791208791208791.
[32m[I 2023-04-21 02:23:20,788][39m Trial 2609 finished with value: 0.8409090909090909 and parameters: {'objective': 'CrossEntropy', 'colsample_bylevel': 0.08025663567370137, 'depth': 3, 'boosting_type': 'Plain', 'bootstrap_type': 'MVS'}. Best is trial 98 with value: 0.8791208791208791.
[32m[I 2023-04-21 02:23:21,659][39m Trial 2610 finished with value: 0.8409090909090909 and parameters: {'objective': 'CrossEntropy', 'colsample_bylevel': 0.08155530676473761, 'depth': 8, 'boosting_type': 'Plain', 'bootstrap_type': 'Bayesian', 'bagging_temperature': 9.105117326881233}. Best is trial 98 with value: 0.8791208791208791.
[32m[I 2023-04-21 02:23:22,678][39m Trial 2611 finished with value: 0.8314606741573034 and parameters: {'objective': 'CrossEntropy', 'colsample_bylevel': 0.08436770737546069, 'depth': 10, 'boosting_type': 'Plain', 'bootstrap_type': 'Bayesian', 'bagging_temperature': 9.578310418288966}. Best is trial 98 with value: 0.8791208791208791.
[32m[I 2023-04-21 02:23:23,661][39m Trial 2612 finished with value: 0.8505747126436782 and parameters: {'objective': 'CrossEntropy', 'colsample_bylevel': 0.07847825454056415, 'depth': 11, 'boosting_type': 'Plain', 'bootstrap_type': 'Bayesian', 'bagging_temperature': 9.366380459761354}. Best is trial 98 with value: 0.8791208791208791.
[32m[I 2023-04-21 02:23:24,854][39m Trial 2613 finished with value: 0.8275862068965518 and parameters: {'objective': 'CrossEntropy', 'colsample_bylevel': 0.07076016176794508, 'depth': 8, 'boosting_type': 'Plain', 'bootstrap_type': 'Bayesian', 'bagging_temperature': 7.978433064844346}. Best is trial 98 with value: 0.8791208791208791.
[32m[I 2023-04-21 02:23:29,793][39m Trial 2614 finished with value: 0.8539325842696629 and parameters: {'objective': 'CrossEntropy', 'colsample_bylevel': 0.07727489325812788, 'depth': 3, 'boosting_type': 'Ordered', 'bootstrap_type': 'Bayesian', 'bagging_temperature': 9.642310356816463}. Best is trial 98 with value: 0.8791208791208791.
[32m[I 2023-04-21 02:23:30,854][39m Trial 2615 finished with value: 0.8539325842696629 and parameters: {'objective': 'CrossEntropy', 'colsample_bylevel': 0.07468738196837228, 'depth': 4, 'boosting_type': 'Plain', 'bootstrap_type': 'Bayesian', 'bagging_temperature': 9.78132681441425}. Best is trial 98 with value: 0.8791208791208791.
[32m[I 2023-04-21 02:23:31,995][39m Trial 2616 finished with value: 0.8409090909090909 and parameters: {'objective': 'CrossEntropy', 'colsample_bylevel': 0.07563229169643279, 'depth': 4, 'boosting_type': 'Plain', 'bootstrap_type': 'Bayesian', 'bagging_temperature': 9.695389183748887}. Best is trial 98 with value: 0.8791208791208791.
[32m[I 2023-04-21 02:23:32,891][39m Trial 2617 finished with value: 0.8539325842696629 and parameters: {'objective': 'CrossEntropy', 'colsample_bylevel': 0.062051419848482385, 'depth': 3, 'boosting_type': 'Plain', 'bootstrap_type': 'Bernoulli', 'subsample': 0.10049763478606982}. Best is trial 98 with value: 0.8791208791208791.
[32m[I 2023-04-21 02:23:33,579][39m Trial 2618 finished with value: 0.8505747126436782 and parameters: {'objective': 'CrossEntropy', 'colsample_bylevel': 0.09384861220599139, 'depth': 11, 'boosting_type': 'Plain', 'bootstrap_type': 'Bayesian', 'bagging_temperature': 9.995740339053416}. Best is trial 98 with value: 0.8791208791208791.
[32m[I 2023-04-21 02:23:34,383][39m Trial 2619 finished with value: 0.8666666666666666 and parameters: {'objective': 'CrossEntropy', 'colsample_bylevel': 0.0870883324535284, 'depth': 2, 'boosting_type': 'Plain', 'bootstrap_type': 'Bayesian', 'bagging_temperature': 9.569783308297426}. Best is trial 98 with value: 0.8791208791208791.
[32m[I 2023-04-21 02:23:35,220][39m Trial 2620 finished with value: 0.8666666666666666 and parameters: {'objective': 'CrossEntropy', 'colsample_bylevel': 0.07861024451342356, 'depth': 2, 'boosting_type': 'Plain', 'bootstrap_type': 'Bayesian', 'bagging_temperature': 9.989241925371685}. Best is trial 98 with value: 0.8791208791208791.
[32m[I 2023-04-21 02:23:36,185][39m Trial 2621 finished with value: 0.8666666666666666 and parameters: {'objective': 'CrossEntropy', 'colsample_bylevel': 0.07818780028150714, 'depth': 4, 'boosting_type': 'Plain', 'bootstrap_type': 'Bayesian', 'bagging_temperature': 9.82094086223876}. Best is trial 98 with value: 0.8791208791208791.
[32m[I 2023-04-21 02:23:37,233][39m Trial 2622 finished with value: 0.8409090909090909 and parameters: {'objective': 'CrossEntropy', 'colsample_bylevel': 0.0778158305599222, 'depth': 3, 'boosting_type': 'Plain', 'bootstrap_type': 'Bayesian', 'bagging_temperature': 9.65643898919944}. Best is trial 98 with value: 0.8791208791208791.
[32m[I 2023-04-21 02:23:38,540][39m Trial 2623 finished with value: 0.8539325842696629 and parameters: {'objective': 'Logloss', 'colsample_bylevel': 0.08974473327420718, 'depth': 3, 'boosting_type': 'Plain', 'bootstrap_type': 'Bayesian', 'bagging_temperature': 8.673150021814223}. Best is trial 98 with value: 0.8791208791208791.
[32m[I 2023-04-21 02:23:39,872][39m Trial 2624 finished with value: 0.8409090909090909 and parameters: {'objective': 'Logloss', 'colsample_bylevel': 0.0839586816514582, 'depth': 5, 'boosting_type': 'Plain', 'bootstrap_type': 'Bayesian', 'bagging_temperature': 8.712280747390105}. Best is trial 98 with value: 0.8791208791208791.
[32m[I 2023-04-21 02:23:40,571][39m Trial 2625 finished with value: 0.8539325842696629 and parameters: {'objective': 'CrossEntropy', 'colsample_bylevel': 0.09126150010534641, 'depth': 7, 'boosting_type': 'Plain', 'bootstrap_type': 'Bayesian', 'bagging_temperature': 9.41470908159194}. Best is trial 98 with value: 0.8791208791208791.
[32m[I 2023-04-21 02:23:41,184][39m Trial 2626 finished with value: 0.8666666666666666 and parameters: {'objective': 'CrossEntropy', 'colsample_bylevel': 0.07800009420336226, 'depth': 4, 'boosting_type': 'Plain', 'bootstrap_type': 'Bayesian', 'bagging_temperature': 8.558450095330922}. Best is trial 98 with value: 0.8791208791208791.
[32m[I 2023-04-21 02:23:41,439][39m Trial 2627 finished with value: 0.7500000000000001 and parameters: {'objective': 'CrossEntropy', 'colsample_bylevel': 0.01266632622107284, 'depth': 2, 'boosting_type': 'Plain', 'bootstrap_type': 'Bayesian', 'bagging_temperature': 7.168202775677063}. Best is trial 98 with value: 0.8791208791208791.
[32m[I 2023-04-21 02:23:42,509][39m Trial 2628 finished with value: 0.8372093023255814 and parameters: {'objective': 'CrossEntropy', 'colsample_bylevel': 0.08477838791729193, 'depth': 10, 'boosting_type': 'Plain', 'bootstrap_type': 'Bayesian', 'bagging_temperature': 9.257448065125878}. Best is trial 98 with value: 0.8791208791208791.
[32m[I 2023-04-21 02:23:43,439][39m Trial 2629 finished with value: 0.8539325842696629 and parameters: {'objective': 'CrossEntropy', 'colsample_bylevel': 0.07523799592066062, 'depth': 11, 'boosting_type': 'Plain', 'bootstrap_type': 'Bayesian', 'bagging_temperature': 9.261021087682728}. Best is trial 98 with value: 0.8791208791208791.
[32m[I 2023-04-21 02:23:44,489][39m Trial 2630 finished with value: 0.8505747126436782 and parameters: {'objective': 'CrossEntropy', 'colsample_bylevel': 0.09381584827791313, 'depth': 10, 'boosting_type': 'Plain', 'bootstrap_type': 'Bayesian', 'bagging_temperature': 9.770568911404572}. Best is trial 98 with value: 0.8791208791208791.
[32m[I 2023-04-21 02:23:45,402][39m Trial 2631 finished with value: 0.8139534883720929 and parameters: {'objective': 'CrossEntropy', 'colsample_bylevel': 0.0791291902459097, 'depth': 3, 'boosting_type': 'Plain', 'bootstrap_type': 'MVS'}. Best is trial 98 with value: 0.8791208791208791.
[32m[I 2023-04-21 02:23:46,364][39m Trial 2632 finished with value: 0.8275862068965518 and parameters: {'objective': 'CrossEntropy', 'colsample_bylevel': 0.080834466972865, 'depth': 10, 'boosting_type': 'Plain', 'bootstrap_type': 'MVS'}. Best is trial 98 with value: 0.8791208791208791.
[32m[I 2023-04-21 02:23:47,319][39m Trial 2633 finished with value: 0.8409090909090909 and parameters: {'objective': 'CrossEntropy', 'colsample_bylevel': 0.08014475619539758, 'depth': 9, 'boosting_type': 'Plain', 'bootstrap_type': 'Bayesian', 'bagging_temperature': 8.972216322854976}. Best is trial 98 with value: 0.8791208791208791.
[32m[I 2023-04-21 02:23:48,079][39m Trial 2634 finished with value: 0.8539325842696629 and parameters: {'objective': 'CrossEntropy', 'colsample_bylevel': 0.07374319403895138, 'depth': 3, 'boosting_type': 'Plain', 'bootstrap_type': 'Bayesian', 'bagging_temperature': 9.487115841766855}. Best is trial 98 with value: 0.8791208791208791.
[32m[I 2023-04-21 02:23:52,951][39m Trial 2635 finished with value: 0.8275862068965518 and parameters: {'objective': 'CrossEntropy', 'colsample_bylevel': 0.07310445773699248, 'depth': 3, 'boosting_type': 'Ordered', 'bootstrap_type': 'Bayesian', 'bagging_temperature': 9.764514679938824}. Best is trial 98 with value: 0.8791208791208791.
[32m[I 2023-04-21 02:23:53,926][39m Trial 2636 finished with value: 0.8139534883720929 and parameters: {'objective': 'CrossEntropy', 'colsample_bylevel': 0.09667368365778661, 'depth': 3, 'boosting_type': 'Plain', 'bootstrap_type': 'Bayesian', 'bagging_temperature': 9.796696986035947}. Best is trial 98 with value: 0.8791208791208791.
[32m[I 2023-04-21 02:23:54,941][39m Trial 2637 finished with value: 0.8666666666666666 and parameters: {'objective': 'CrossEntropy', 'colsample_bylevel': 0.08016621495270021, 'depth': 3, 'boosting_type': 'Plain', 'bootstrap_type': 'Bayesian', 'bagging_temperature': 9.69415688873035}. Best is trial 98 with value: 0.8791208791208791.
[32m[I 2023-04-21 02:23:55,748][39m Trial 2638 finished with value: 0.8539325842696629 and parameters: {'objective': 'CrossEntropy', 'colsample_bylevel': 0.07788843927190847, 'depth': 9, 'boosting_type': 'Plain', 'bootstrap_type': 'Bayesian', 'bagging_temperature': 8.387776826548063}. Best is trial 98 with value: 0.8791208791208791.
[32m[I 2023-04-21 02:23:56,892][39m Trial 2639 finished with value: 0.8539325842696629 and parameters: {'objective': 'Logloss', 'colsample_bylevel': 0.08093504944110602, 'depth': 4, 'boosting_type': 'Plain', 'bootstrap_type': 'Bayesian', 'bagging_temperature': 9.301215705320939}. Best is trial 98 with value: 0.8791208791208791.
[32m[I 2023-04-21 02:23:58,096][39m Trial 2640 finished with value: 0.8539325842696629 and parameters: {'objective': 'CrossEntropy', 'colsample_bylevel': 0.08145339265204443, 'depth': 3, 'boosting_type': 'Plain', 'bootstrap_type': 'Bayesian', 'bagging_temperature': 9.033662723420875}. Best is trial 98 with value: 0.8791208791208791.
[32m[I 2023-04-21 02:23:59,055][39m Trial 2641 finished with value: 0.8505747126436782 and parameters: {'objective': 'CrossEntropy', 'colsample_bylevel': 0.08553607938308334, 'depth': 7, 'boosting_type': 'Plain', 'bootstrap_type': 'Bayesian', 'bagging_temperature': 7.582328907417145}. Best is trial 98 with value: 0.8791208791208791.
[32m[I 2023-04-21 02:24:00,168][39m Trial 2642 finished with value: 0.8275862068965518 and parameters: {'objective': 'CrossEntropy', 'colsample_bylevel': 0.0764024321128509, 'depth': 10, 'boosting_type': 'Plain', 'bootstrap_type': 'Bayesian', 'bagging_temperature': 6.339354387907483}. Best is trial 98 with value: 0.8791208791208791.
