[32m[I 2023-04-21 02:31:44,964][39m Trial 3040 finished with value: 0.8275862068965518 and parameters: {'objective': 'CrossEntropy', 'colsample_bylevel': 0.07610081024830602, 'depth': 2, 'boosting_type': 'Plain', 'bootstrap_type': 'Bernoulli', 'subsample': 0.9688962500597358}. Best is trial 98 with value: 0.8791208791208791.
[32m[I 2023-04-21 02:31:45,767][39m Trial 3041 finished with value: 0.8539325842696629 and parameters: {'objective': 'CrossEntropy', 'colsample_bylevel': 0.07795996048296219, 'depth': 3, 'boosting_type': 'Plain', 'bootstrap_type': 'Bayesian', 'bagging_temperature': 9.993954129225628}. Best is trial 98 with value: 0.8791208791208791.
[32m[I 2023-04-21 02:31:46,666][39m Trial 3042 finished with value: 0.8409090909090909 and parameters: {'objective': 'CrossEntropy', 'colsample_bylevel': 0.07322536977263062, 'depth': 11, 'boosting_type': 'Plain', 'bootstrap_type': 'Bayesian', 'bagging_temperature': 9.60229169040796}. Best is trial 98 with value: 0.8791208791208791.
[32m[I 2023-04-21 02:31:47,981][39m Trial 3043 finished with value: 0.8275862068965518 and parameters: {'objective': 'CrossEntropy', 'colsample_bylevel': 0.08363731844545003, 'depth': 9, 'boosting_type': 'Plain', 'bootstrap_type': 'Bayesian', 'bagging_temperature': 9.59114654731885}. Best is trial 98 with value: 0.8791208791208791.
[32m[I 2023-04-21 02:31:49,070][39m Trial 3044 finished with value: 0.8131868131868132 and parameters: {'objective': 'CrossEntropy', 'colsample_bylevel': 0.03332173717336103, 'depth': 3, 'boosting_type': 'Plain', 'bootstrap_type': 'MVS'}. Best is trial 98 with value: 0.8791208791208791.
[32m[I 2023-04-21 02:31:49,832][39m Trial 3045 finished with value: 0.8539325842696629 and parameters: {'objective': 'Logloss', 'colsample_bylevel': 0.06880349936277885, 'depth': 9, 'boosting_type': 'Plain', 'bootstrap_type': 'Bayesian', 'bagging_temperature': 9.063501189101773}. Best is trial 98 with value: 0.8791208791208791.
[32m[I 2023-04-21 02:31:50,741][39m Trial 3046 finished with value: 0.8222222222222222 and parameters: {'objective': 'Logloss', 'colsample_bylevel': 0.03903206965336333, 'depth': 4, 'boosting_type': 'Plain', 'bootstrap_type': 'Bayesian', 'bagging_temperature': 9.710646926727746}. Best is trial 98 with value: 0.8791208791208791.
[32m[I 2023-04-21 02:31:51,651][39m Trial 3047 finished with value: 0.8275862068965518 and parameters: {'objective': 'CrossEntropy', 'colsample_bylevel': 0.07714072327367892, 'depth': 9, 'boosting_type': 'Plain', 'bootstrap_type': 'Bayesian', 'bagging_temperature': 9.779434644761588}. Best is trial 98 with value: 0.8791208791208791.
[32m[I 2023-04-21 02:31:56,563][39m Trial 3048 finished with value: 0.8275862068965518 and parameters: {'objective': 'Logloss', 'colsample_bylevel': 0.08159747100850716, 'depth': 4, 'boosting_type': 'Ordered', 'bootstrap_type': 'Bayesian', 'bagging_temperature': 8.912691943112744}. Best is trial 98 with value: 0.8791208791208791.
[32m[I 2023-04-21 02:31:57,949][39m Trial 3049 finished with value: 0.8409090909090909 and parameters: {'objective': 'Logloss', 'colsample_bylevel': 0.07754958906671054, 'depth': 9, 'boosting_type': 'Plain', 'bootstrap_type': 'Bayesian', 'bagging_temperature': 9.328889981899605}. Best is trial 98 with value: 0.8791208791208791.
[32m[I 2023-04-21 02:31:59,041][39m Trial 3050 finished with value: 0.8275862068965518 and parameters: {'objective': 'CrossEntropy', 'colsample_bylevel': 0.08731515023709499, 'depth': 10, 'boosting_type': 'Plain', 'bootstrap_type': 'Bayesian', 'bagging_temperature': 8.359571427219874}. Best is trial 98 with value: 0.8791208791208791.
[32m[I 2023-04-21 02:31:59,871][39m Trial 3051 finished with value: 0.8539325842696629 and parameters: {'objective': 'CrossEntropy', 'colsample_bylevel': 0.07456280327152538, 'depth': 9, 'boosting_type': 'Plain', 'bootstrap_type': 'Bayesian', 'bagging_temperature': 7.808837985453421}. Best is trial 98 with value: 0.8791208791208791.
[32m[I 2023-04-21 02:32:00,698][39m Trial 3052 finished with value: 0.8409090909090909 and parameters: {'objective': 'Logloss', 'colsample_bylevel': 0.0720520374906687, 'depth': 10, 'boosting_type': 'Plain', 'bootstrap_type': 'Bayesian', 'bagging_temperature': 8.464978293421884}. Best is trial 98 with value: 0.8791208791208791.
[32m[I 2023-04-21 02:32:01,690][39m Trial 3053 finished with value: 0.8409090909090909 and parameters: {'objective': 'CrossEntropy', 'colsample_bylevel': 0.07908245721111015, 'depth': 10, 'boosting_type': 'Plain', 'bootstrap_type': 'Bayesian', 'bagging_temperature': 9.801487904350934}. Best is trial 98 with value: 0.8791208791208791.
[32m[I 2023-04-21 02:32:02,766][39m Trial 3054 finished with value: 0.8275862068965518 and parameters: {'objective': 'CrossEntropy', 'colsample_bylevel': 0.09724786163426057, 'depth': 4, 'boosting_type': 'Plain', 'bootstrap_type': 'Bayesian', 'bagging_temperature': 9.981855416579673}. Best is trial 98 with value: 0.8791208791208791.
[32m[I 2023-04-21 02:32:03,750][39m Trial 3055 finished with value: 0.8666666666666666 and parameters: {'objective': 'CrossEntropy', 'colsample_bylevel': 0.07961253076240707, 'depth': 3, 'boosting_type': 'Plain', 'bootstrap_type': 'Bayesian', 'bagging_temperature': 8.659826969102966}. Best is trial 98 with value: 0.8791208791208791.
[32m[I 2023-04-21 02:32:04,389][39m Trial 3056 finished with value: 0.8539325842696629 and parameters: {'objective': 'CrossEntropy', 'colsample_bylevel': 0.08111124223518605, 'depth': 3, 'boosting_type': 'Plain', 'bootstrap_type': 'Bayesian', 'bagging_temperature': 9.430525602064698}. Best is trial 98 with value: 0.8791208791208791.
[32m[I 2023-04-21 02:32:05,306][39m Trial 3057 finished with value: 0.8636363636363636 and parameters: {'objective': 'CrossEntropy', 'colsample_bylevel': 0.08514329598957492, 'depth': 2, 'boosting_type': 'Plain', 'bootstrap_type': 'Bayesian', 'bagging_temperature': 9.212884707478857}. Best is trial 98 with value: 0.8791208791208791.
[32m[I 2023-04-21 02:32:06,487][39m Trial 3058 finished with value: 0.8539325842696629 and parameters: {'objective': 'CrossEntropy', 'colsample_bylevel': 0.07325802329595384, 'depth': 10, 'boosting_type': 'Plain', 'bootstrap_type': 'Bayesian', 'bagging_temperature': 9.6675347474598}. Best is trial 98 with value: 0.8791208791208791.
[32m[I 2023-04-21 02:32:07,616][39m Trial 3059 finished with value: 0.8505747126436782 and parameters: {'objective': 'CrossEntropy', 'colsample_bylevel': 0.07644913933377094, 'depth': 8, 'boosting_type': 'Plain', 'bootstrap_type': 'Bayesian', 'bagging_temperature': 9.792763102078933}. Best is trial 98 with value: 0.8791208791208791.
[32m[I 2023-04-21 02:32:08,507][39m Trial 3060 finished with value: 0.8409090909090909 and parameters: {'objective': 'CrossEntropy', 'colsample_bylevel': 0.08719972957748837, 'depth': 9, 'boosting_type': 'Plain', 'bootstrap_type': 'Bayesian', 'bagging_temperature': 9.978602600368955}. Best is trial 98 with value: 0.8791208791208791.
[32m[I 2023-04-21 02:32:09,117][39m Trial 3061 finished with value: 0.8333333333333333 and parameters: {'objective': 'CrossEntropy', 'colsample_bylevel': 0.07160850647078525, 'depth': 4, 'boosting_type': 'Plain', 'bootstrap_type': 'Bayesian', 'bagging_temperature': 4.1753818770108}. Best is trial 98 with value: 0.8791208791208791.
[32m[I 2023-04-21 02:32:10,253][39m Trial 3062 finished with value: 0.8539325842696629 and parameters: {'objective': 'CrossEntropy', 'colsample_bylevel': 0.0775780629296892, 'depth': 11, 'boosting_type': 'Plain', 'bootstrap_type': 'Bayesian', 'bagging_temperature': 9.637028089236066}. Best is trial 98 with value: 0.8791208791208791.
[32m[I 2023-04-21 02:32:11,623][39m Trial 3063 finished with value: 0.8539325842696629 and parameters: {'objective': 'CrossEntropy', 'colsample_bylevel': 0.07685748805959274, 'depth': 8, 'boosting_type': 'Plain', 'bootstrap_type': 'Bayesian', 'bagging_temperature': 8.72510212982304}. Best is trial 98 with value: 0.8791208791208791.
[32m[I 2023-04-21 02:32:12,569][39m Trial 3064 finished with value: 0.8275862068965518 and parameters: {'objective': 'CrossEntropy', 'colsample_bylevel': 0.08093511887428334, 'depth': 10, 'boosting_type': 'Plain', 'bootstrap_type': 'Bayesian', 'bagging_temperature': 8.954407584061409}. Best is trial 98 with value: 0.8791208791208791.
[32m[I 2023-04-21 02:32:13,454][39m Trial 3065 finished with value: 0.8863636363636364 and parameters: {'objective': 'Logloss', 'colsample_bylevel': 0.07198428351142502, 'depth': 10, 'boosting_type': 'Plain', 'bootstrap_type': 'Bayesian', 'bagging_temperature': 9.572172324231827}. Best is trial 3065 with value: 0.8863636363636364.
[32m[I 2023-04-21 02:32:14,170][39m Trial 3066 finished with value: 0.8666666666666666 and parameters: {'objective': 'Logloss', 'colsample_bylevel': 0.07519017582180057, 'depth': 10, 'boosting_type': 'Plain', 'bootstrap_type': 'Bayesian', 'bagging_temperature': 9.655711373955842}. Best is trial 3065 with value: 0.8863636363636364.
[32m[I 2023-04-21 02:32:18,676][39m Trial 3067 finished with value: 0.8181818181818182 and parameters: {'objective': 'CrossEntropy', 'colsample_bylevel': 0.05205681401492242, 'depth': 10, 'boosting_type': 'Ordered', 'bootstrap_type': 'Bayesian', 'bagging_temperature': 9.468130782951704}. Best is trial 3065 with value: 0.8863636363636364.
[32m[I 2023-04-21 02:32:19,701][39m Trial 3068 finished with value: 0.8409090909090909 and parameters: {'objective': 'Logloss', 'colsample_bylevel': 0.07775015066535203, 'depth': 10, 'boosting_type': 'Plain', 'bootstrap_type': 'Bayesian', 'bagging_temperature': 9.650098887504965}. Best is trial 3065 with value: 0.8863636363636364.
[32m[I 2023-04-21 02:32:20,885][39m Trial 3069 finished with value: 0.8275862068965518 and parameters: {'objective': 'Logloss', 'colsample_bylevel': 0.09436068854464016, 'depth': 4, 'boosting_type': 'Plain', 'bootstrap_type': 'Bayesian', 'bagging_temperature': 8.542160915880498}. Best is trial 3065 with value: 0.8863636363636364.
[32m[I 2023-04-21 02:32:21,901][39m Trial 3070 finished with value: 0.8539325842696629 and parameters: {'objective': 'CrossEntropy', 'colsample_bylevel': 0.07923065373314803, 'depth': 4, 'boosting_type': 'Plain', 'bootstrap_type': 'Bayesian', 'bagging_temperature': 9.445904399648004}. Best is trial 3065 with value: 0.8863636363636364.
[32m[I 2023-04-21 02:32:22,816][39m Trial 3071 finished with value: 0.8409090909090909 and parameters: {'objective': 'Logloss', 'colsample_bylevel': 0.06798062215971738, 'depth': 10, 'boosting_type': 'Plain', 'bootstrap_type': 'Bayesian', 'bagging_temperature': 8.030412786825172}. Best is trial 3065 with value: 0.8863636363636364.
[32m[I 2023-04-21 02:32:23,526][39m Trial 3072 finished with value: 0.8505747126436782 and parameters: {'objective': 'CrossEntropy', 'colsample_bylevel': 0.09212373592155466, 'depth': 10, 'boosting_type': 'Plain', 'bootstrap_type': 'Bayesian', 'bagging_temperature': 8.640853912455054}. Best is trial 3065 with value: 0.8863636363636364.
[32m[I 2023-04-21 02:32:24,482][39m Trial 3073 finished with value: 0.8666666666666666 and parameters: {'objective': 'Logloss', 'colsample_bylevel': 0.07142765208361354, 'depth': 5, 'boosting_type': 'Plain', 'bootstrap_type': 'Bernoulli', 'subsample': 0.1557895157430399}. Best is trial 3065 with value: 0.8863636363636364.
[32m[I 2023-04-21 02:32:25,419][39m Trial 3074 finished with value: 0.8409090909090909 and parameters: {'objective': 'CrossEntropy', 'colsample_bylevel': 0.07686370159981314, 'depth': 10, 'boosting_type': 'Plain', 'bootstrap_type': 'Bayesian', 'bagging_temperature': 9.47220709486164}. Best is trial 3065 with value: 0.8863636363636364.
[32m[I 2023-04-21 02:32:26,447][39m Trial 3075 finished with value: 0.8505747126436782 and parameters: {'objective': 'CrossEntropy', 'colsample_bylevel': 0.07221435452265046, 'depth': 4, 'boosting_type': 'Plain', 'bootstrap_type': 'Bayesian', 'bagging_temperature': 8.685861238813056}. Best is trial 3065 with value: 0.8863636363636364.
[32m[I 2023-04-21 02:32:27,809][39m Trial 3076 finished with value: 0.8139534883720929 and parameters: {'objective': 'CrossEntropy', 'colsample_bylevel': 0.0745039348679972, 'depth': 11, 'boosting_type': 'Plain', 'bootstrap_type': 'Bayesian', 'bagging_temperature': 5.294708218436679}. Best is trial 3065 with value: 0.8863636363636364.
[32m[I 2023-04-21 02:32:28,692][39m Trial 3077 finished with value: 0.8409090909090909 and parameters: {'objective': 'CrossEntropy', 'colsample_bylevel': 0.07348720524129915, 'depth': 9, 'boosting_type': 'Plain', 'bootstrap_type': 'Bayesian', 'bagging_temperature': 9.481721928307445}. Best is trial 3065 with value: 0.8863636363636364.
[32m[I 2023-04-21 02:32:29,579][39m Trial 3078 finished with value: 0.7857142857142858 and parameters: {'objective': 'CrossEntropy', 'colsample_bylevel': 0.09348273831769394, 'depth': 9, 'boosting_type': 'Plain', 'bootstrap_type': 'MVS'}. Best is trial 3065 with value: 0.8863636363636364.
[32m[I 2023-04-21 02:32:30,189][39m Trial 3079 finished with value: 0.8539325842696629 and parameters: {'objective': 'CrossEntropy', 'colsample_bylevel': 0.06899838832409057, 'depth': 11, 'boosting_type': 'Plain', 'bootstrap_type': 'Bayesian', 'bagging_temperature': 9.597151946320313}. Best is trial 3065 with value: 0.8863636363636364.
[32m[I 2023-04-21 02:32:30,864][39m Trial 3080 finished with value: 0.8409090909090909 and parameters: {'objective': 'CrossEntropy', 'colsample_bylevel': 0.06620669688537167, 'depth': 10, 'boosting_type': 'Plain', 'bootstrap_type': 'Bayesian', 'bagging_temperature': 9.828918807904714}. Best is trial 3065 with value: 0.8863636363636364.
[32m[I 2023-04-21 02:32:32,107][39m Trial 3081 finished with value: 0.8539325842696629 and parameters: {'objective': 'CrossEntropy', 'colsample_bylevel': 0.07095319079879257, 'depth': 10, 'boosting_type': 'Plain', 'bootstrap_type': 'Bayesian', 'bagging_temperature': 9.645553060126513}. Best is trial 3065 with value: 0.8863636363636364.
[32m[I 2023-04-21 02:32:33,073][39m Trial 3082 finished with value: 0.8666666666666666 and parameters: {'objective': 'Logloss', 'colsample_bylevel': 0.0701509329822441, 'depth': 9, 'boosting_type': 'Plain', 'bootstrap_type': 'Bayesian', 'bagging_temperature': 8.141377079284318}. Best is trial 3065 with value: 0.8863636363636364.
[32m[I 2023-04-21 02:32:34,197][39m Trial 3083 finished with value: 0.8539325842696629 and parameters: {'objective': 'Logloss', 'colsample_bylevel': 0.06719815623349565, 'depth': 10, 'boosting_type': 'Plain', 'bootstrap_type': 'Bayesian', 'bagging_temperature': 9.05580311770243}. Best is trial 3065 with value: 0.8863636363636364.
[32m[I 2023-04-21 02:32:34,877][39m Trial 3084 finished with value: 0.8409090909090909 and parameters: {'objective': 'Logloss', 'colsample_bylevel': 0.07950351251992319, 'depth': 6, 'boosting_type': 'Plain', 'bootstrap_type': 'Bayesian', 'bagging_temperature': 9.064480242687736}. Best is trial 3065 with value: 0.8863636363636364.
[32m[I 2023-04-21 02:32:36,146][39m Trial 3085 finished with value: 0.8409090909090909 and parameters: {'objective': 'CrossEntropy', 'colsample_bylevel': 0.07216041529581801, 'depth': 10, 'boosting_type': 'Plain', 'bootstrap_type': 'Bayesian', 'bagging_temperature': 9.48210808271308}. Best is trial 3065 with value: 0.8863636363636364.
[32m[I 2023-04-21 02:32:40,963][39m Trial 3086 finished with value: 0.8139534883720929 and parameters: {'objective': 'CrossEntropy', 'colsample_bylevel': 0.07579226267078287, 'depth': 11, 'boosting_type': 'Ordered', 'bootstrap_type': 'Bayesian', 'bagging_temperature': 3.1827878042978206}. Best is trial 3065 with value: 0.8863636363636364.
[32m[I 2023-04-21 02:32:41,983][39m Trial 3087 finished with value: 0.8409090909090909 and parameters: {'objective': 'CrossEntropy', 'colsample_bylevel': 0.0912755601641454, 'depth': 3, 'boosting_type': 'Plain', 'bootstrap_type': 'Bernoulli', 'subsample': 0.3980530553833109}. Best is trial 3065 with value: 0.8863636363636364.
[32m[I 2023-04-21 02:32:43,076][39m Trial 3088 finished with value: 0.8505747126436782 and parameters: {'objective': 'CrossEntropy', 'colsample_bylevel': 0.0976164913746547, 'depth': 10, 'boosting_type': 'Plain', 'bootstrap_type': 'Bayesian', 'bagging_temperature': 9.479739674630585}. Best is trial 3065 with value: 0.8863636363636364.
[32m[I 2023-04-21 02:32:43,829][39m Trial 3089 finished with value: 0.8409090909090909 and parameters: {'objective': 'CrossEntropy', 'colsample_bylevel': 0.07765766063152504, 'depth': 10, 'boosting_type': 'Plain', 'bootstrap_type': 'Bayesian', 'bagging_temperature': 6.482928653210062}. Best is trial 3065 with value: 0.8863636363636364.
[32m[I 2023-04-21 02:32:44,651][39m Trial 3090 finished with value: 0.7692307692307692 and parameters: {'objective': 'CrossEntropy', 'colsample_bylevel': 0.020745107951601546, 'depth': 10, 'boosting_type': 'Plain', 'bootstrap_type': 'MVS'}. Best is trial 3065 with value: 0.8863636363636364.
[32m[I 2023-04-21 02:32:45,666][39m Trial 3091 finished with value: 0.8505747126436782 and parameters: {'objective': 'CrossEntropy', 'colsample_bylevel': 0.08437955451223476, 'depth': 6, 'boosting_type': 'Plain', 'bootstrap_type': 'Bayesian', 'bagging_temperature': 9.091697927250088}. Best is trial 3065 with value: 0.8863636363636364.
[32m[I 2023-04-21 02:32:46,731][39m Trial 3092 finished with value: 0.8275862068965518 and parameters: {'objective': 'CrossEntropy', 'colsample_bylevel': 0.07227568090045423, 'depth': 10, 'boosting_type': 'Plain', 'bootstrap_type': 'Bayesian', 'bagging_temperature': 9.532465343746711}. Best is trial 3065 with value: 0.8863636363636364.
[32m[I 2023-04-21 02:32:47,704][39m Trial 3093 finished with value: 0.8539325842696629 and parameters: {'objective': 'CrossEntropy', 'colsample_bylevel': 0.07343903381970718, 'depth': 10, 'boosting_type': 'Plain', 'bootstrap_type': 'Bayesian', 'bagging_temperature': 9.25978569632379}. Best is trial 3065 with value: 0.8863636363636364.
[32m[I 2023-04-21 02:32:48,540][39m Trial 3094 finished with value: 0.8181818181818182 and parameters: {'objective': 'CrossEntropy', 'colsample_bylevel': 0.08086884089054895, 'depth': 3, 'boosting_type': 'Plain', 'bootstrap_type': 'MVS'}. Best is trial 3065 with value: 0.8863636363636364.
[32m[I 2023-04-21 02:32:49,169][39m Trial 3095 finished with value: 0.8409090909090909 and parameters: {'objective': 'CrossEntropy', 'colsample_bylevel': 0.09011285519973818, 'depth': 3, 'boosting_type': 'Plain', 'bootstrap_type': 'MVS'}. Best is trial 3065 with value: 0.8863636363636364.
[32m[I 2023-04-21 02:32:50,435][39m Trial 3096 finished with value: 0.8666666666666666 and parameters: {'objective': 'Logloss', 'colsample_bylevel': 0.07958558123053684, 'depth': 3, 'boosting_type': 'Plain', 'bootstrap_type': 'Bayesian', 'bagging_temperature': 9.64808554185482}. Best is trial 3065 with value: 0.8863636363636364.
[32m[I 2023-04-21 02:32:51,139][39m Trial 3097 finished with value: 0.8409090909090909 and parameters: {'objective': 'Logloss', 'colsample_bylevel': 0.08403404533459517, 'depth': 10, 'boosting_type': 'Plain', 'bootstrap_type': 'Bayesian', 'bagging_temperature': 9.136939144600149}. Best is trial 3065 with value: 0.8863636363636364.
[32m[I 2023-04-21 02:32:52,074][39m Trial 3098 finished with value: 0.8539325842696629 and parameters: {'objective': 'CrossEntropy', 'colsample_bylevel': 0.06295585548059719, 'depth': 3, 'boosting_type': 'Plain', 'bootstrap_type': 'Bayesian', 'bagging_temperature': 9.581689525496177}. Best is trial 3065 with value: 0.8863636363636364.
[32m[I 2023-04-21 02:32:53,031][39m Trial 3099 finished with value: 0.8409090909090909 and parameters: {'objective': 'Logloss', 'colsample_bylevel': 0.07452130954116538, 'depth': 10, 'boosting_type': 'Plain', 'bootstrap_type': 'Bayesian', 'bagging_temperature': 9.254929603964781}. Best is trial 3065 with value: 0.8863636363636364.
[32m[I 2023-04-21 02:32:54,222][39m Trial 3100 finished with value: 0.8539325842696629 and parameters: {'objective': 'CrossEntropy', 'colsample_bylevel': 0.07799152638400217, 'depth': 7, 'boosting_type': 'Plain', 'bootstrap_type': 'Bayesian', 'bagging_temperature': 9.836129633372812}. Best is trial 3065 with value: 0.8863636363636364.
[32m[I 2023-04-21 02:32:55,425][39m Trial 3101 finished with value: 0.8539325842696629 and parameters: {'objective': 'CrossEntropy', 'colsample_bylevel': 0.08241538542867782, 'depth': 3, 'boosting_type': 'Plain', 'bootstrap_type': 'Bayesian', 'bagging_temperature': 9.37542023704271}. Best is trial 3065 with value: 0.8863636363636364.
[32m[I 2023-04-21 02:32:56,384][39m Trial 3102 finished with value: 0.8666666666666666 and parameters: {'objective': 'CrossEntropy', 'colsample_bylevel': 0.08585996914628706, 'depth': 3, 'boosting_type': 'Plain', 'bootstrap_type': 'Bayesian', 'bagging_temperature': 9.407272165791955}. Best is trial 3065 with value: 0.8863636363636364.
[32m[I 2023-04-21 02:32:57,068][39m Trial 3103 finished with value: 0.8791208791208791 and parameters: {'objective': 'CrossEntropy', 'colsample_bylevel': 0.07612981483699746, 'depth': 10, 'boosting_type': 'Plain', 'bootstrap_type': 'Bayesian', 'bagging_temperature': 9.56567211731835}. Best is trial 3065 with value: 0.8863636363636364.
[32m[I 2023-04-21 02:33:02,014][39m Trial 3104 finished with value: 0.8409090909090909 and parameters: {'objective': 'Logloss', 'colsample_bylevel': 0.08297275344498262, 'depth': 4, 'boosting_type': 'Ordered', 'bootstrap_type': 'Bayesian', 'bagging_temperature': 9.303312909251815}. Best is trial 3065 with value: 0.8863636363636364.
[32m[I 2023-04-21 02:33:02,942][39m Trial 3105 finished with value: 0.8539325842696629 and parameters: {'objective': 'CrossEntropy', 'colsample_bylevel': 0.07366896934094334, 'depth': 10, 'boosting_type': 'Plain', 'bootstrap_type': 'Bayesian', 'bagging_temperature': 9.371000868500188}. Best is trial 3065 with value: 0.8863636363636364.
