[32m[I 2023-04-21 01:33:45,026][39m A new study created in memory with name: no-name-69cf6a00-7ad7-4714-8e30-dfa527dfe36d
[32m[I 2023-04-21 01:33:45,522][39m Trial 0 finished with value: 0.8045977011494252 and parameters: {'objective': 'CrossEntropy', 'colsample_bylevel': 0.045101550269518696, 'depth': 1, 'boosting_type': 'Plain', 'bootstrap_type': 'Bayesian', 'bagging_temperature': 5.7289883700935444}. Best is trial 0 with value: 0.8045977011494252.
[32m[I 2023-04-21 01:33:48,129][39m Trial 1 finished with value: 0.8181818181818182 and parameters: {'objective': 'CrossEntropy', 'colsample_bylevel': 0.03490107905143559, 'depth': 12, 'boosting_type': 'Ordered', 'bootstrap_type': 'Bayesian', 'bagging_temperature': 5.16461757592678}. Best is trial 1 with value: 0.8181818181818182.
[32m[I 2023-04-21 01:33:48,689][39m Trial 2 finished with value: 0.8314606741573034 and parameters: {'objective': 'Logloss', 'colsample_bylevel': 0.07142010902538116, 'depth': 10, 'boosting_type': 'Plain', 'bootstrap_type': 'Bernoulli', 'subsample': 0.6729742008334854}. Best is trial 2 with value: 0.8314606741573034.
[32m[I 2023-04-21 01:33:49,246][39m Trial 3 finished with value: 0.8409090909090909 and parameters: {'objective': 'Logloss', 'colsample_bylevel': 0.06237588674301182, 'depth': 11, 'boosting_type': 'Plain', 'bootstrap_type': 'Bernoulli', 'subsample': 0.29948398955360767}. Best is trial 3 with value: 0.8409090909090909.
[32m[I 2023-04-21 01:33:49,761][39m Trial 4 finished with value: 0.8222222222222222 and parameters: {'objective': 'Logloss', 'colsample_bylevel': 0.03440178606569993, 'depth': 2, 'boosting_type': 'Plain', 'bootstrap_type': 'Bayesian', 'bagging_temperature': 5.092665924685842}. Best is trial 3 with value: 0.8409090909090909.
[32m[I 2023-04-21 01:33:53,215][39m Trial 5 finished with value: 0.8222222222222222 and parameters: {'objective': 'CrossEntropy', 'colsample_bylevel': 0.05505203471256309, 'depth': 10, 'boosting_type': 'Ordered', 'bootstrap_type': 'MVS'}. Best is trial 3 with value: 0.8409090909090909.
[32m[I 2023-04-21 01:33:54,409][39m Trial 6 finished with value: 0.8095238095238095 and parameters: {'objective': 'Logloss', 'colsample_bylevel': 0.02210696917141907, 'depth': 1, 'boosting_type': 'Plain', 'bootstrap_type': 'Bayesian', 'bagging_temperature': 8.034463975448597}. Best is trial 3 with value: 0.8409090909090909.
[32m[I 2023-04-21 01:33:55,484][39m Trial 7 finished with value: 0.8636363636363636 and parameters: {'objective': 'CrossEntropy', 'colsample_bylevel': 0.09434796994595143, 'depth': 12, 'boosting_type': 'Plain', 'bootstrap_type': 'Bayesian', 'bagging_temperature': 8.672152910879767}. Best is trial 7 with value: 0.8636363636363636.
[32m[I 2023-04-21 01:34:00,233][39m Trial 8 finished with value: 0.8409090909090909 and parameters: {'objective': 'CrossEntropy', 'colsample_bylevel': 0.0749058967719651, 'depth': 12, 'boosting_type': 'Ordered', 'bootstrap_type': 'MVS'}. Best is trial 7 with value: 0.8636363636363636.
[32m[I 2023-04-21 01:34:05,178][39m Trial 9 finished with value: 0.8181818181818182 and parameters: {'objective': 'Logloss', 'colsample_bylevel': 0.0518686127818436, 'depth': 5, 'boosting_type': 'Ordered', 'bootstrap_type': 'Bayesian', 'bagging_temperature': 6.0140218018230325}. Best is trial 7 with value: 0.8636363636363636.
[32m[I 2023-04-21 01:34:06,095][39m Trial 10 finished with value: 0.7857142857142858 and parameters: {'objective': 'CrossEntropy', 'colsample_bylevel': 0.09633065435165417, 'depth': 8, 'boosting_type': 'Plain', 'bootstrap_type': 'Bernoulli', 'subsample': 0.9982268268652292}. Best is trial 7 with value: 0.8636363636363636.
[32m[I 2023-04-21 01:34:07,040][39m Trial 11 finished with value: 0.8275862068965518 and parameters: {'objective': 'Logloss', 'colsample_bylevel': 0.09699289116359369, 'depth': 9, 'boosting_type': 'Plain', 'bootstrap_type': 'Bernoulli', 'subsample': 0.19221079032952193}. Best is trial 7 with value: 0.8636363636363636.
[32m[I 2023-04-21 01:34:08,073][39m Trial 12 finished with value: 0.8275862068965518 and parameters: {'objective': 'Logloss', 'colsample_bylevel': 0.07222101276059129, 'depth': 6, 'boosting_type': 'Plain', 'bootstrap_type': 'Bernoulli', 'subsample': 0.14780973530626018}. Best is trial 7 with value: 0.8636363636363636.
[32m[I 2023-04-21 01:34:09,114][39m Trial 13 finished with value: 0.8275862068965518 and parameters: {'objective': 'CrossEntropy', 'colsample_bylevel': 0.08333890899754871, 'depth': 12, 'boosting_type': 'Plain', 'bootstrap_type': 'Bernoulli', 'subsample': 0.4539678603164915}. Best is trial 7 with value: 0.8636363636363636.
[32m[I 2023-04-21 01:34:09,705][39m Trial 14 finished with value: 0.8314606741573034 and parameters: {'objective': 'Logloss', 'colsample_bylevel': 0.06102671796716763, 'depth': 8, 'boosting_type': 'Plain', 'bootstrap_type': 'MVS'}. Best is trial 7 with value: 0.8636363636363636.
[32m[I 2023-04-21 01:34:10,483][39m Trial 15 finished with value: 0.8372093023255814 and parameters: {'objective': 'CrossEntropy', 'colsample_bylevel': 0.08445628029410625, 'depth': 10, 'boosting_type': 'Plain', 'bootstrap_type': 'Bayesian', 'bagging_temperature': 0.5642558202179622}. Best is trial 7 with value: 0.8636363636363636.
[32m[I 2023-04-21 01:34:11,224][39m Trial 16 finished with value: 0.7272727272727273 and parameters: {'objective': 'Logloss', 'colsample_bylevel': 0.012672808186797412, 'depth': 5, 'boosting_type': 'Plain', 'bootstrap_type': 'Bernoulli', 'subsample': 0.49428715062328804}. Best is trial 7 with value: 0.8636363636363636.
[32m[I 2023-04-21 01:34:16,402][39m Trial 17 finished with value: 0.8409090909090909 and parameters: {'objective': 'CrossEntropy', 'colsample_bylevel': 0.0851526951054842, 'depth': 12, 'boosting_type': 'Ordered', 'bootstrap_type': 'MVS'}. Best is trial 7 with value: 0.8636363636363636.
[32m[I 2023-04-21 01:34:21,543][39m Trial 18 finished with value: 0.8089887640449439 and parameters: {'objective': 'CrossEntropy', 'colsample_bylevel': 0.07446203861223341, 'depth': 8, 'boosting_type': 'Ordered', 'bootstrap_type': 'MVS'}. Best is trial 7 with value: 0.8636363636363636.
[32m[I 2023-04-21 01:34:22,420][39m Trial 19 finished with value: 0.8409090909090909 and parameters: {'objective': 'Logloss', 'colsample_bylevel': 0.06562092335544642, 'depth': 11, 'boosting_type': 'Plain', 'bootstrap_type': 'Bernoulli', 'subsample': 0.357773199317576}. Best is trial 7 with value: 0.8636363636363636.
[32m[I 2023-04-21 01:34:23,265][39m Trial 20 finished with value: 0.8275862068965518 and parameters: {'objective': 'CrossEntropy', 'colsample_bylevel': 0.09263974177498004, 'depth': 3, 'boosting_type': 'Plain', 'bootstrap_type': 'Bayesian', 'bagging_temperature': 9.969357958268615}. Best is trial 7 with value: 0.8636363636363636.
[32m[I 2023-04-21 01:34:28,139][39m Trial 21 finished with value: 0.8043478260869564 and parameters: {'objective': 'CrossEntropy', 'colsample_bylevel': 0.0772234550593022, 'depth': 11, 'boosting_type': 'Ordered', 'bootstrap_type': 'MVS'}. Best is trial 7 with value: 0.8636363636363636.
[32m[I 2023-04-21 01:34:33,186][39m Trial 22 finished with value: 0.8275862068965518 and parameters: {'objective': 'CrossEntropy', 'colsample_bylevel': 0.08769461001055144, 'depth': 12, 'boosting_type': 'Ordered', 'bootstrap_type': 'MVS'}. Best is trial 7 with value: 0.8636363636363636.
[32m[I 2023-04-21 01:34:33,962][39m Trial 23 finished with value: 0.8409090909090909 and parameters: {'objective': 'Logloss', 'colsample_bylevel': 0.06363551204610135, 'depth': 11, 'boosting_type': 'Plain', 'bootstrap_type': 'Bernoulli', 'subsample': 0.32948522643160494}. Best is trial 7 with value: 0.8636363636363636.
[32m[I 2023-04-21 01:34:34,743][39m Trial 24 finished with value: 0.8409090909090909 and parameters: {'objective': 'Logloss', 'colsample_bylevel': 0.044637584076449494, 'depth': 9, 'boosting_type': 'Plain', 'bootstrap_type': 'Bernoulli', 'subsample': 0.2852634707987915}. Best is trial 7 with value: 0.8636363636363636.
[32m[I 2023-04-21 01:34:35,508][39m Trial 25 finished with value: 0.8089887640449439 and parameters: {'objective': 'Logloss', 'colsample_bylevel': 0.04492709826767833, 'depth': 9, 'boosting_type': 'Plain', 'bootstrap_type': 'Bernoulli', 'subsample': 0.675799683574116}. Best is trial 7 with value: 0.8636363636363636.
[32m[I 2023-04-21 01:34:40,797][39m Trial 26 finished with value: 0.8275862068965518 and parameters: {'objective': 'CrossEntropy', 'colsample_bylevel': 0.08917604015350956, 'depth': 11, 'boosting_type': 'Ordered', 'bootstrap_type': 'MVS'}. Best is trial 7 with value: 0.8636363636363636.
[32m[I 2023-04-21 01:34:41,980][39m Trial 27 finished with value: 0.8387096774193549 and parameters: {'objective': 'Logloss', 'colsample_bylevel': 0.039488839412247206, 'depth': 9, 'boosting_type': 'Plain', 'bootstrap_type': 'Bernoulli', 'subsample': 0.31780375689746115}. Best is trial 7 with value: 0.8636363636363636.
[32m[I 2023-04-21 01:34:42,830][39m Trial 28 finished with value: 0.7777777777777778 and parameters: {'objective': 'Logloss', 'colsample_bylevel': 0.025449296497844654, 'depth': 7, 'boosting_type': 'Plain', 'bootstrap_type': 'Bernoulli', 'subsample': 0.13632397398414728}. Best is trial 7 with value: 0.8636363636363636.
[32m[I 2023-04-21 01:34:43,379][39m Trial 29 finished with value: 0.8222222222222222 and parameters: {'objective': 'Logloss', 'colsample_bylevel': 0.05224199919570077, 'depth': 10, 'boosting_type': 'Plain', 'bootstrap_type': 'Bayesian', 'bagging_temperature': 1.6606100012406784}. Best is trial 7 with value: 0.8636363636363636.
[32m[I 2023-04-21 01:34:48,276][39m Trial 30 finished with value: 0.8 and parameters: {'objective': 'CrossEntropy', 'colsample_bylevel': 0.0695901132555996, 'depth': 12, 'boosting_type': 'Ordered', 'bootstrap_type': 'MVS'}. Best is trial 7 with value: 0.8636363636363636.
[32m[I 2023-04-21 01:34:49,179][39m Trial 31 finished with value: 0.8372093023255814 and parameters: {'objective': 'CrossEntropy', 'colsample_bylevel': 0.09979399367303081, 'depth': 11, 'boosting_type': 'Plain', 'bootstrap_type': 'Bayesian', 'bagging_temperature': 9.896101991599041}. Best is trial 7 with value: 0.8636363636363636.
[32m[I 2023-04-21 01:34:49,960][39m Trial 32 finished with value: 0.8409090909090909 and parameters: {'objective': 'Logloss', 'colsample_bylevel': 0.05983068944789559, 'depth': 11, 'boosting_type': 'Plain', 'bootstrap_type': 'Bernoulli', 'subsample': 0.28903104567987553}. Best is trial 7 with value: 0.8636363636363636.
[32m[I 2023-04-21 01:34:50,822][39m Trial 33 finished with value: 0.8539325842696629 and parameters: {'objective': 'Logloss', 'colsample_bylevel': 0.04598734473261222, 'depth': 10, 'boosting_type': 'Plain', 'bootstrap_type': 'Bernoulli', 'subsample': 0.27375837062186703}. Best is trial 7 with value: 0.8636363636363636.
[32m[I 2023-04-21 01:34:51,434][39m Trial 34 finished with value: 0.8222222222222222 and parameters: {'objective': 'Logloss', 'colsample_bylevel': 0.04270328442916731, 'depth': 9, 'boosting_type': 'Plain', 'bootstrap_type': 'Bernoulli', 'subsample': 0.40198342292852673}. Best is trial 7 with value: 0.8636363636363636.
[32m[I 2023-04-21 01:34:56,544][39m Trial 35 finished with value: 0.8139534883720929 and parameters: {'objective': 'CrossEntropy', 'colsample_bylevel': 0.0824337811818403, 'depth': 12, 'boosting_type': 'Ordered', 'bootstrap_type': 'Bayesian', 'bagging_temperature': 2.915141219536019}. Best is trial 7 with value: 0.8636363636363636.
[32m[I 2023-04-21 01:35:01,473][39m Trial 36 finished with value: 0.8409090909090909 and parameters: {'objective': 'CrossEntropy', 'colsample_bylevel': 0.0801545411000219, 'depth': 10, 'boosting_type': 'Ordered', 'bootstrap_type': 'MVS'}. Best is trial 7 with value: 0.8636363636363636.
[32m[I 2023-04-21 01:35:06,114][39m Trial 37 finished with value: 0.7816091954022988 and parameters: {'objective': 'CrossEntropy', 'colsample_bylevel': 0.032199070791413605, 'depth': 10, 'boosting_type': 'Ordered', 'bootstrap_type': 'Bayesian', 'bagging_temperature': 7.6786964239570095}. Best is trial 7 with value: 0.8636363636363636.
[32m[I 2023-04-21 01:35:07,200][39m Trial 38 finished with value: 0.8275862068965518 and parameters: {'objective': 'Logloss', 'colsample_bylevel': 0.058639719254509795, 'depth': 11, 'boosting_type': 'Plain', 'bootstrap_type': 'Bernoulli', 'subsample': 0.5974329516548426}. Best is trial 7 with value: 0.8636363636363636.
[32m[I 2023-04-21 01:35:08,314][39m Trial 39 finished with value: 0.8275862068965518 and parameters: {'objective': 'Logloss', 'colsample_bylevel': 0.06519680414290445, 'depth': 11, 'boosting_type': 'Plain', 'bootstrap_type': 'Bernoulli', 'subsample': 0.392982643007172}. Best is trial 7 with value: 0.8636363636363636.
[32m[I 2023-04-21 01:35:12,874][39m Trial 40 finished with value: 0.8539325842696629 and parameters: {'objective': 'CrossEntropy', 'colsample_bylevel': 0.04976027186104056, 'depth': 10, 'boosting_type': 'Ordered', 'bootstrap_type': 'Bayesian', 'bagging_temperature': 7.7131390726653635}. Best is trial 7 with value: 0.8636363636363636.
[32m[I 2023-04-21 01:35:17,687][39m Trial 41 finished with value: 0.8314606741573034 and parameters: {'objective': 'CrossEntropy', 'colsample_bylevel': 0.05324853199354715, 'depth': 12, 'boosting_type': 'Ordered', 'bootstrap_type': 'Bayesian', 'bagging_temperature': 7.8082350259527935}. Best is trial 7 with value: 0.8636363636363636.
[32m[I 2023-04-21 01:35:22,757][39m Trial 42 finished with value: 0.8275862068965518 and parameters: {'objective': 'CrossEntropy', 'colsample_bylevel': 0.09165528572155102, 'depth': 10, 'boosting_type': 'Ordered', 'bootstrap_type': 'Bayesian', 'bagging_temperature': 8.752761946428224}. Best is trial 7 with value: 0.8636363636363636.
[32m[I 2023-04-21 01:35:27,475][39m Trial 43 finished with value: 0.8181818181818182 and parameters: {'objective': 'CrossEntropy', 'colsample_bylevel': 0.0395784506915178, 'depth': 12, 'boosting_type': 'Ordered', 'bootstrap_type': 'Bayesian', 'bagging_temperature': 6.9398114603962355}. Best is trial 7 with value: 0.8636363636363636.
[32m[I 2023-04-21 01:35:32,159][39m Trial 44 finished with value: 0.8539325842696629 and parameters: {'objective': 'CrossEntropy', 'colsample_bylevel': 0.04867034379704631, 'depth': 9, 'boosting_type': 'Ordered', 'bootstrap_type': 'Bayesian', 'bagging_temperature': 3.6014631519701323}. Best is trial 7 with value: 0.8636363636363636.
[32m[I 2023-04-21 01:35:36,987][39m Trial 45 finished with value: 0.8409090909090909 and parameters: {'objective': 'CrossEntropy', 'colsample_bylevel': 0.04948577124645449, 'depth': 8, 'boosting_type': 'Ordered', 'bootstrap_type': 'Bayesian', 'bagging_temperature': 3.140953582860068}. Best is trial 7 with value: 0.8636363636363636.
[32m[I 2023-04-21 01:35:41,709][39m Trial 46 finished with value: 0.8409090909090909 and parameters: {'objective': 'CrossEntropy', 'colsample_bylevel': 0.04929153171851242, 'depth': 7, 'boosting_type': 'Ordered', 'bootstrap_type': 'Bayesian', 'bagging_temperature': 3.1074074025178966}. Best is trial 7 with value: 0.8636363636363636.
[32m[I 2023-04-21 01:35:42,424][39m Trial 47 finished with value: 0.8275862068965518 and parameters: {'objective': 'CrossEntropy', 'colsample_bylevel': 0.03746088498917534, 'depth': 10, 'boosting_type': 'Plain', 'bootstrap_type': 'Bayesian', 'bagging_temperature': 4.0565891688924935}. Best is trial 7 with value: 0.8636363636363636.
[32m[I 2023-04-21 01:35:43,277][39m Trial 48 finished with value: 0.7954545454545454 and parameters: {'objective': 'Logloss', 'colsample_bylevel': 0.03131953180470476, 'depth': 9, 'boosting_type': 'Plain', 'bootstrap_type': 'Bayesian', 'bagging_temperature': 6.6234197645201585}. Best is trial 7 with value: 0.8636363636363636.
[32m[I 2023-04-21 01:35:48,357][39m Trial 49 finished with value: 0.8409090909090909 and parameters: {'objective': 'CrossEntropy', 'colsample_bylevel': 0.05693069672180573, 'depth': 6, 'boosting_type': 'Ordered', 'bootstrap_type': 'Bayesian', 'bagging_temperature': 8.843441063323985}. Best is trial 7 with value: 0.8636363636363636.
[32m[I 2023-04-21 01:35:49,198][39m Trial 50 finished with value: 0.8275862068965518 and parameters: {'objective': 'Logloss', 'colsample_bylevel': 0.04708612719585877, 'depth': 8, 'boosting_type': 'Plain', 'bootstrap_type': 'Bayesian', 'bagging_temperature': 4.390973759555525}. Best is trial 7 with value: 0.8636363636363636.
[32m[I 2023-04-21 01:35:54,015][39m Trial 51 finished with value: 0.8409090909090909 and parameters: {'objective': 'CrossEntropy', 'colsample_bylevel': 0.0593523404542107, 'depth': 6, 'boosting_type': 'Ordered', 'bootstrap_type': 'Bayesian', 'bagging_temperature': 8.964748932094736}. Best is trial 7 with value: 0.8636363636363636.
[32m[I 2023-04-21 01:35:58,845][39m Trial 52 finished with value: 0.8409090909090909 and parameters: {'objective': 'CrossEntropy', 'colsample_bylevel': 0.06731432981445551, 'depth': 5, 'boosting_type': 'Ordered', 'bootstrap_type': 'Bayesian', 'bagging_temperature': 8.93949629075694}. Best is trial 7 with value: 0.8636363636363636.
[32m[I 2023-04-21 01:35:59,841][39m Trial 53 finished with value: 0.8139534883720929 and parameters: {'objective': 'Logloss', 'colsample_bylevel': 0.045024876210808744, 'depth': 9, 'boosting_type': 'Plain', 'bootstrap_type': 'Bernoulli', 'subsample': 0.21027842447412948}. Best is trial 7 with value: 0.8636363636363636.
[32m[I 2023-04-21 01:36:04,303][39m Trial 54 finished with value: 0.7999999999999999 and parameters: {'objective': 'CrossEntropy', 'colsample_bylevel': 0.049193372338997336, 'depth': 7, 'boosting_type': 'Ordered', 'bootstrap_type': 'Bayesian', 'bagging_temperature': 3.0923360174859336}. Best is trial 7 with value: 0.8636363636363636.
[32m[I 2023-04-21 01:36:09,001][39m Trial 55 finished with value: 0.7816091954022988 and parameters: {'objective': 'CrossEntropy', 'colsample_bylevel': 0.055091585208191796, 'depth': 8, 'boosting_type': 'Ordered', 'bootstrap_type': 'Bayesian', 'bagging_temperature': 2.0898120978435637}. Best is trial 7 with value: 0.8636363636363636.
[32m[I 2023-04-21 01:36:13,787][39m Trial 56 finished with value: 0.8409090909090909 and parameters: {'objective': 'CrossEntropy', 'colsample_bylevel': 0.05005209821629444, 'depth': 10, 'boosting_type': 'Ordered', 'bootstrap_type': 'Bayesian', 'bagging_temperature': 3.9947574168573308}. Best is trial 7 with value: 0.8636363636363636.
[32m[I 2023-04-21 01:36:18,421][39m Trial 57 finished with value: 0.8 and parameters: {'objective': 'CrossEntropy', 'colsample_bylevel': 0.042174402238087, 'depth': 10, 'boosting_type': 'Ordered', 'bootstrap_type': 'MVS'}. Best is trial 7 with value: 0.8636363636363636.
[32m[I 2023-04-21 01:36:19,602][39m Trial 58 finished with value: 0.8275862068965518 and parameters: {'objective': 'CrossEntropy', 'colsample_bylevel': 0.0353274510645487, 'depth': 7, 'boosting_type': 'Plain', 'bootstrap_type': 'Bayesian', 'bagging_temperature': 2.0416400326250876}. Best is trial 7 with value: 0.8636363636363636.
[32m[I 2023-04-21 01:36:20,986][39m Trial 59 finished with value: 0.8275862068965518 and parameters: {'objective': 'Logloss', 'colsample_bylevel': 0.09706906219923651, 'depth': 11, 'boosting_type': 'Plain', 'bootstrap_type': 'MVS'}. Best is trial 7 with value: 0.8636363636363636.
[32m[I 2023-04-21 01:36:25,008][39m Trial 60 finished with value: 0.8 and parameters: {'objective': 'CrossEntropy', 'colsample_bylevel': 0.05451878483585393, 'depth': 8, 'boosting_type': 'Ordered', 'bootstrap_type': 'Bernoulli', 'subsample': 0.5837016478650134}. Best is trial 7 with value: 0.8636363636363636.
[32m[I 2023-04-21 01:36:29,890][39m Trial 61 finished with value: 0.8131868131868132 and parameters: {'objective': 'CrossEntropy', 'colsample_bylevel': 0.06207413641999999, 'depth': 4, 'boosting_type': 'Ordered', 'bootstrap_type': 'MVS'}. Best is trial 7 with value: 0.8636363636363636.
[32m[I 2023-04-21 01:36:34,660][39m Trial 62 finished with value: 0.8409090909090909 and parameters: {'objective': 'CrossEntropy', 'colsample_bylevel': 0.04837946788472177, 'depth': 9, 'boosting_type': 'Ordered', 'bootstrap_type': 'Bayesian', 'bagging_temperature': 3.1522840214605887}. Best is trial 7 with value: 0.8636363636363636.
[32m[I 2023-04-21 01:36:39,364][39m Trial 63 finished with value: 0.8387096774193549 and parameters: {'objective': 'CrossEntropy', 'colsample_bylevel': 0.04351099200183356, 'depth': 9, 'boosting_type': 'Ordered', 'bootstrap_type': 'Bernoulli', 'subsample': 0.8601992364539526}. Best is trial 7 with value: 0.8636363636363636.
[32m[I 2023-04-21 01:36:43,950][39m Trial 64 finished with value: 0.7441860465116279 and parameters: {'objective': 'CrossEntropy', 'colsample_bylevel': 0.027605134572730436, 'depth': 1, 'boosting_type': 'Ordered', 'bootstrap_type': 'MVS'}. Best is trial 7 with value: 0.8636363636363636.
[32m[I 2023-04-21 01:36:48,875][39m Trial 65 finished with value: 0.8409090909090909 and parameters: {'objective': 'CrossEntropy', 'colsample_bylevel': 0.06841611735819642, 'depth': 5, 'boosting_type': 'Ordered', 'bootstrap_type': 'Bayesian', 'bagging_temperature': 8.496892411431686}. Best is trial 7 with value: 0.8636363636363636.
[32m[I 2023-04-21 01:36:49,607][39m Trial 66 finished with value: 0.7415730337078651 and parameters: {'objective': 'Logloss', 'colsample_bylevel': 0.018543544523197307, 'depth': 11, 'boosting_type': 'Plain', 'bootstrap_type': 'Bernoulli', 'subsample': 0.27300667543408}. Best is trial 7 with value: 0.8636363636363636.
[32m[I 2023-04-21 01:36:54,940][39m Trial 67 finished with value: 0.8409090909090909 and parameters: {'objective': 'CrossEntropy', 'colsample_bylevel': 0.05638088327300242, 'depth': 6, 'boosting_type': 'Ordered', 'bootstrap_type': 'Bayesian', 'bagging_temperature': 3.442468672824872}. Best is trial 7 with value: 0.8636363636363636.
