[32m[I 2023-04-21 02:18:56,887][39m Trial 2379 finished with value: 0.8409090909090909 and parameters: {'objective': 'Logloss', 'colsample_bylevel': 0.07816742417103574, 'depth': 10, 'boosting_type': 'Plain', 'bootstrap_type': 'Bayesian', 'bagging_temperature': 9.633678284174138}. Best is trial 98 with value: 0.8791208791208791.
[32m[I 2023-04-21 02:18:57,930][39m Trial 2380 finished with value: 0.8275862068965518 and parameters: {'objective': 'Logloss', 'colsample_bylevel': 0.07657053900056503, 'depth': 10, 'boosting_type': 'Plain', 'bootstrap_type': 'Bernoulli', 'subsample': 0.7144775516824916}. Best is trial 98 with value: 0.8791208791208791.
[32m[I 2023-04-21 02:18:58,644][39m Trial 2381 finished with value: 0.8539325842696629 and parameters: {'objective': 'Logloss', 'colsample_bylevel': 0.07562253628065799, 'depth': 4, 'boosting_type': 'Plain', 'bootstrap_type': 'Bayesian', 'bagging_temperature': 8.24926534722198}. Best is trial 98 with value: 0.8791208791208791.
[32m[I 2023-04-21 02:18:59,392][39m Trial 2382 finished with value: 0.8275862068965518 and parameters: {'objective': 'Logloss', 'colsample_bylevel': 0.07953780110959194, 'depth': 11, 'boosting_type': 'Plain', 'bootstrap_type': 'MVS'}. Best is trial 98 with value: 0.8791208791208791.
[32m[I 2023-04-21 02:19:00,329][39m Trial 2383 finished with value: 0.8409090909090909 and parameters: {'objective': 'CrossEntropy', 'colsample_bylevel': 0.07909328177159351, 'depth': 3, 'boosting_type': 'Plain', 'bootstrap_type': 'Bayesian', 'bagging_temperature': 7.307670271317882}. Best is trial 98 with value: 0.8791208791208791.
[32m[I 2023-04-21 02:19:01,401][39m Trial 2384 finished with value: 0.8539325842696629 and parameters: {'objective': 'CrossEntropy', 'colsample_bylevel': 0.07872100426787633, 'depth': 3, 'boosting_type': 'Plain', 'bootstrap_type': 'Bayesian', 'bagging_temperature': 8.433316160915389}. Best is trial 98 with value: 0.8791208791208791.
[32m[I 2023-04-21 02:19:02,642][39m Trial 2385 finished with value: 0.8539325842696629 and parameters: {'objective': 'CrossEntropy', 'colsample_bylevel': 0.07163135327630922, 'depth': 10, 'boosting_type': 'Plain', 'bootstrap_type': 'Bayesian', 'bagging_temperature': 8.413272863533964}. Best is trial 98 with value: 0.8791208791208791.
[32m[I 2023-04-21 02:19:03,663][39m Trial 2386 finished with value: 0.8636363636363636 and parameters: {'objective': 'CrossEntropy', 'colsample_bylevel': 0.08015029339858644, 'depth': 2, 'boosting_type': 'Plain', 'bootstrap_type': 'Bayesian', 'bagging_temperature': 8.938466961771567}. Best is trial 98 with value: 0.8791208791208791.
[32m[I 2023-04-21 02:19:08,733][39m Trial 2387 finished with value: 0.8139534883720929 and parameters: {'objective': 'CrossEntropy', 'colsample_bylevel': 0.09776981158321044, 'depth': 3, 'boosting_type': 'Ordered', 'bootstrap_type': 'Bayesian', 'bagging_temperature': 8.714859822250087}. Best is trial 98 with value: 0.8791208791208791.
[32m[I 2023-04-21 02:19:09,668][39m Trial 2388 finished with value: 0.8539325842696629 and parameters: {'objective': 'CrossEntropy', 'colsample_bylevel': 0.0801392614437432, 'depth': 3, 'boosting_type': 'Plain', 'bootstrap_type': 'Bayesian', 'bagging_temperature': 9.482740855726933}. Best is trial 98 with value: 0.8791208791208791.
[32m[I 2023-04-21 02:19:10,630][39m Trial 2389 finished with value: 0.8539325842696629 and parameters: {'objective': 'Logloss', 'colsample_bylevel': 0.08416283976767251, 'depth': 4, 'boosting_type': 'Plain', 'bootstrap_type': 'Bayesian', 'bagging_temperature': 8.947172638214525}. Best is trial 98 with value: 0.8791208791208791.
[32m[I 2023-04-21 02:19:11,255][39m Trial 2390 finished with value: 0.8666666666666666 and parameters: {'objective': 'Logloss', 'colsample_bylevel': 0.08469408273495317, 'depth': 4, 'boosting_type': 'Plain', 'bootstrap_type': 'Bayesian', 'bagging_temperature': 9.124790607911372}. Best is trial 98 with value: 0.8791208791208791.
[32m[I 2023-04-21 02:19:12,433][39m Trial 2391 finished with value: 0.8409090909090909 and parameters: {'objective': 'Logloss', 'colsample_bylevel': 0.08255908711836181, 'depth': 5, 'boosting_type': 'Plain', 'bootstrap_type': 'Bayesian', 'bagging_temperature': 9.259302898071246}. Best is trial 98 with value: 0.8791208791208791.
[32m[I 2023-04-21 02:19:13,273][39m Trial 2392 finished with value: 0.8409090909090909 and parameters: {'objective': 'CrossEntropy', 'colsample_bylevel': 0.07601992911631249, 'depth': 5, 'boosting_type': 'Plain', 'bootstrap_type': 'MVS'}. Best is trial 98 with value: 0.8791208791208791.
[32m[I 2023-04-21 02:19:14,549][39m Trial 2393 finished with value: 0.8539325842696629 and parameters: {'objective': 'CrossEntropy', 'colsample_bylevel': 0.07550354970110634, 'depth': 5, 'boosting_type': 'Plain', 'bootstrap_type': 'Bayesian', 'bagging_temperature': 9.578488238227202}. Best is trial 98 with value: 0.8791208791208791.
[32m[I 2023-04-21 02:19:15,659][39m Trial 2394 finished with value: 0.8764044943820225 and parameters: {'objective': 'CrossEntropy', 'colsample_bylevel': 0.09135231531023337, 'depth': 2, 'boosting_type': 'Plain', 'bootstrap_type': 'Bayesian', 'bagging_temperature': 9.95968198852928}. Best is trial 98 with value: 0.8791208791208791.
[32m[I 2023-04-21 02:19:16,303][39m Trial 2395 finished with value: 0.8539325842696629 and parameters: {'objective': 'CrossEntropy', 'colsample_bylevel': 0.0926517877581574, 'depth': 3, 'boosting_type': 'Plain', 'bootstrap_type': 'Bayesian', 'bagging_temperature': 6.998751589574786}. Best is trial 98 with value: 0.8791208791208791.
[32m[I 2023-04-21 02:19:17,525][39m Trial 2396 finished with value: 0.8539325842696629 and parameters: {'objective': 'Logloss', 'colsample_bylevel': 0.07491695016235486, 'depth': 11, 'boosting_type': 'Plain', 'bootstrap_type': 'Bayesian', 'bagging_temperature': 9.771532821932722}. Best is trial 98 with value: 0.8791208791208791.
[32m[I 2023-04-21 02:19:18,167][39m Trial 2397 finished with value: 0.8539325842696629 and parameters: {'objective': 'Logloss', 'colsample_bylevel': 0.07354113199516786, 'depth': 11, 'boosting_type': 'Plain', 'bootstrap_type': 'Bayesian', 'bagging_temperature': 9.66445188534026}. Best is trial 98 with value: 0.8791208791208791.
[32m[I 2023-04-21 02:19:19,027][39m Trial 2398 finished with value: 0.8275862068965518 and parameters: {'objective': 'CrossEntropy', 'colsample_bylevel': 0.08308454578721373, 'depth': 12, 'boosting_type': 'Plain', 'bootstrap_type': 'Bayesian', 'bagging_temperature': 9.780303680605224}. Best is trial 98 with value: 0.8791208791208791.
[32m[I 2023-04-21 02:19:19,869][39m Trial 2399 finished with value: 0.8666666666666666 and parameters: {'objective': 'CrossEntropy', 'colsample_bylevel': 0.08170460082701717, 'depth': 3, 'boosting_type': 'Plain', 'bootstrap_type': 'Bayesian', 'bagging_temperature': 9.061266906072952}. Best is trial 98 with value: 0.8791208791208791.
[32m[I 2023-04-21 02:19:20,755][39m Trial 2400 finished with value: 0.8409090909090909 and parameters: {'objective': 'Logloss', 'colsample_bylevel': 0.08395020828583202, 'depth': 4, 'boosting_type': 'Plain', 'bootstrap_type': 'Bernoulli', 'subsample': 0.8067148385694276}. Best is trial 98 with value: 0.8791208791208791.
[32m[I 2023-04-21 02:19:21,945][39m Trial 2401 finished with value: 0.8139534883720929 and parameters: {'objective': 'CrossEntropy', 'colsample_bylevel': 0.0777261474019122, 'depth': 5, 'boosting_type': 'Plain', 'bootstrap_type': 'Bayesian', 'bagging_temperature': 7.808405151813804}. Best is trial 98 with value: 0.8791208791208791.
[32m[I 2023-04-21 02:19:23,028][39m Trial 2402 finished with value: 0.8275862068965518 and parameters: {'objective': 'Logloss', 'colsample_bylevel': 0.09324381739973216, 'depth': 5, 'boosting_type': 'Plain', 'bootstrap_type': 'Bayesian', 'bagging_temperature': 8.639086896706551}. Best is trial 98 with value: 0.8791208791208791.
[32m[I 2023-04-21 02:19:23,980][39m Trial 2403 finished with value: 0.8409090909090909 and parameters: {'objective': 'CrossEntropy', 'colsample_bylevel': 0.07611633698056021, 'depth': 9, 'boosting_type': 'Plain', 'bootstrap_type': 'Bayesian', 'bagging_temperature': 9.630941922911413}. Best is trial 98 with value: 0.8791208791208791.
[32m[I 2023-04-21 02:19:24,742][39m Trial 2404 finished with value: 0.8791208791208791 and parameters: {'objective': 'CrossEntropy', 'colsample_bylevel': 0.07645168806650818, 'depth': 11, 'boosting_type': 'Plain', 'bootstrap_type': 'Bayesian', 'bagging_temperature': 9.596810433033761}. Best is trial 98 with value: 0.8791208791208791.
[32m[I 2023-04-21 02:19:25,592][39m Trial 2405 finished with value: 0.8505747126436782 and parameters: {'objective': 'CrossEntropy', 'colsample_bylevel': 0.09538402260478562, 'depth': 11, 'boosting_type': 'Plain', 'bootstrap_type': 'Bayesian', 'bagging_temperature': 4.319649302207022}. Best is trial 98 with value: 0.8791208791208791.
[32m[I 2023-04-21 02:19:30,897][39m Trial 2406 finished with value: 0.8043478260869564 and parameters: {'objective': 'CrossEntropy', 'colsample_bylevel': 0.08761100485470776, 'depth': 2, 'boosting_type': 'Ordered', 'bootstrap_type': 'MVS'}. Best is trial 98 with value: 0.8791208791208791.
[32m[I 2023-04-21 02:19:31,879][39m Trial 2407 finished with value: 0.8666666666666666 and parameters: {'objective': 'CrossEntropy', 'colsample_bylevel': 0.07777623475015588, 'depth': 10, 'boosting_type': 'Plain', 'bootstrap_type': 'Bayesian', 'bagging_temperature': 8.021869221864947}. Best is trial 98 with value: 0.8791208791208791.
[32m[I 2023-04-21 02:19:32,773][39m Trial 2408 finished with value: 0.8636363636363636 and parameters: {'objective': 'Logloss', 'colsample_bylevel': 0.07458729664838498, 'depth': 11, 'boosting_type': 'Plain', 'bootstrap_type': 'Bayesian', 'bagging_temperature': 9.501647618930573}. Best is trial 98 with value: 0.8791208791208791.
[32m[I 2023-04-21 02:19:33,384][39m Trial 2409 finished with value: 0.8666666666666666 and parameters: {'objective': 'CrossEntropy', 'colsample_bylevel': 0.06625354953723853, 'depth': 4, 'boosting_type': 'Plain', 'bootstrap_type': 'Bayesian', 'bagging_temperature': 9.993614549474552}. Best is trial 98 with value: 0.8791208791208791.
[32m[I 2023-04-21 02:19:34,568][39m Trial 2410 finished with value: 0.8539325842696629 and parameters: {'objective': 'CrossEntropy', 'colsample_bylevel': 0.0746050225419902, 'depth': 9, 'boosting_type': 'Plain', 'bootstrap_type': 'Bayesian', 'bagging_temperature': 7.913025566219391}. Best is trial 98 with value: 0.8791208791208791.
[32m[I 2023-04-21 02:19:35,336][39m Trial 2411 finished with value: 0.8275862068965518 and parameters: {'objective': 'CrossEntropy', 'colsample_bylevel': 0.07296467786847921, 'depth': 10, 'boosting_type': 'Plain', 'bootstrap_type': 'Bayesian', 'bagging_temperature': 9.37110904324516}. Best is trial 98 with value: 0.8791208791208791.
[32m[I 2023-04-21 02:19:36,397][39m Trial 2412 finished with value: 0.8409090909090909 and parameters: {'objective': 'CrossEntropy', 'colsample_bylevel': 0.07654438056669986, 'depth': 9, 'boosting_type': 'Plain', 'bootstrap_type': 'Bayesian', 'bagging_temperature': 8.914715314894096}. Best is trial 98 with value: 0.8791208791208791.
[32m[I 2023-04-21 02:19:37,573][39m Trial 2413 finished with value: 0.8539325842696629 and parameters: {'objective': 'CrossEntropy', 'colsample_bylevel': 0.0802839045449674, 'depth': 3, 'boosting_type': 'Plain', 'bootstrap_type': 'Bayesian', 'bagging_temperature': 9.994850568724026}. Best is trial 98 with value: 0.8791208791208791.
[32m[I 2023-04-21 02:19:38,554][39m Trial 2414 finished with value: 0.8666666666666666 and parameters: {'objective': 'CrossEntropy', 'colsample_bylevel': 0.07927214005683568, 'depth': 3, 'boosting_type': 'Plain', 'bootstrap_type': 'Bayesian', 'bagging_temperature': 9.286898751939324}. Best is trial 98 with value: 0.8791208791208791.
[32m[I 2023-04-21 02:19:39,270][39m Trial 2415 finished with value: 0.8666666666666666 and parameters: {'objective': 'CrossEntropy', 'colsample_bylevel': 0.07374964160029003, 'depth': 6, 'boosting_type': 'Plain', 'bootstrap_type': 'Bayesian', 'bagging_temperature': 9.857874950027332}. Best is trial 98 with value: 0.8791208791208791.
[32m[I 2023-04-21 02:19:39,958][39m Trial 2416 finished with value: 0.8539325842696629 and parameters: {'objective': 'CrossEntropy', 'colsample_bylevel': 0.07686849157043152, 'depth': 12, 'boosting_type': 'Plain', 'bootstrap_type': 'Bayesian', 'bagging_temperature': 9.988081636493133}. Best is trial 98 with value: 0.8791208791208791.
[32m[I 2023-04-21 02:19:40,863][39m Trial 2417 finished with value: 0.8791208791208791 and parameters: {'objective': 'CrossEntropy', 'colsample_bylevel': 0.07433159489999208, 'depth': 4, 'boosting_type': 'Plain', 'bootstrap_type': 'Bayesian', 'bagging_temperature': 9.17318549818587}. Best is trial 98 with value: 0.8791208791208791.
[32m[I 2023-04-21 02:19:41,803][39m Trial 2418 finished with value: 0.8666666666666666 and parameters: {'objective': 'CrossEntropy', 'colsample_bylevel': 0.07486993348251297, 'depth': 9, 'boosting_type': 'Plain', 'bootstrap_type': 'Bayesian', 'bagging_temperature': 9.85537468105525}. Best is trial 98 with value: 0.8791208791208791.
[32m[I 2023-04-21 02:19:42,970][39m Trial 2419 finished with value: 0.8539325842696629 and parameters: {'objective': 'CrossEntropy', 'colsample_bylevel': 0.07673890014711841, 'depth': 3, 'boosting_type': 'Plain', 'bootstrap_type': 'Bayesian', 'bagging_temperature': 9.50330754423287}. Best is trial 98 with value: 0.8791208791208791.
[32m[I 2023-04-21 02:19:44,253][39m Trial 2420 finished with value: 0.8275862068965518 and parameters: {'objective': 'CrossEntropy', 'colsample_bylevel': 0.0383728640912918, 'depth': 4, 'boosting_type': 'Plain', 'bootstrap_type': 'Bayesian', 'bagging_temperature': 8.978781284433023}. Best is trial 98 with value: 0.8791208791208791.
[32m[I 2023-04-21 02:19:45,098][39m Trial 2421 finished with value: 0.8539325842696629 and parameters: {'objective': 'CrossEntropy', 'colsample_bylevel': 0.07851727219727961, 'depth': 3, 'boosting_type': 'Plain', 'bootstrap_type': 'MVS'}. Best is trial 98 with value: 0.8791208791208791.
[32m[I 2023-04-21 02:19:45,699][39m Trial 2422 finished with value: 0.8764044943820225 and parameters: {'objective': 'CrossEntropy', 'colsample_bylevel': 0.09166944364624628, 'depth': 2, 'boosting_type': 'Plain', 'bootstrap_type': 'Bayesian', 'bagging_temperature': 9.842511114173071}. Best is trial 98 with value: 0.8791208791208791.
[32m[I 2023-04-21 02:19:50,473][39m Trial 2423 finished with value: 0.8089887640449439 and parameters: {'objective': 'CrossEntropy', 'colsample_bylevel': 0.08037518918801419, 'depth': 4, 'boosting_type': 'Ordered', 'bootstrap_type': 'Bernoulli', 'subsample': 0.6537684117245186}. Best is trial 98 with value: 0.8791208791208791.
[32m[I 2023-04-21 02:19:51,423][39m Trial 2424 finished with value: 0.8372093023255814 and parameters: {'objective': 'CrossEntropy', 'colsample_bylevel': 0.08574242796334408, 'depth': 3, 'boosting_type': 'Plain', 'bootstrap_type': 'Bayesian', 'bagging_temperature': 8.480516859054772}. Best is trial 98 with value: 0.8791208791208791.
[32m[I 2023-04-21 02:19:52,348][39m Trial 2425 finished with value: 0.8409090909090909 and parameters: {'objective': 'CrossEntropy', 'colsample_bylevel': 0.07496119080100255, 'depth': 11, 'boosting_type': 'Plain', 'bootstrap_type': 'Bayesian', 'bagging_temperature': 9.41302606610709}. Best is trial 98 with value: 0.8791208791208791.
[32m[I 2023-04-21 02:19:53,277][39m Trial 2426 finished with value: 0.8539325842696629 and parameters: {'objective': 'Logloss', 'colsample_bylevel': 0.09007325128318085, 'depth': 3, 'boosting_type': 'Plain', 'bootstrap_type': 'Bayesian', 'bagging_temperature': 9.768982341053055}. Best is trial 98 with value: 0.8791208791208791.
[32m[I 2023-04-21 02:19:53,913][39m Trial 2427 finished with value: 0.8275862068965518 and parameters: {'objective': 'CrossEntropy', 'colsample_bylevel': 0.08245187204039461, 'depth': 4, 'boosting_type': 'Plain', 'bootstrap_type': 'Bayesian', 'bagging_temperature': 8.826380348867763}. Best is trial 98 with value: 0.8791208791208791.
[32m[I 2023-04-21 02:19:55,252][39m Trial 2428 finished with value: 0.8539325842696629 and parameters: {'objective': 'Logloss', 'colsample_bylevel': 0.07511303344298613, 'depth': 8, 'boosting_type': 'Plain', 'bootstrap_type': 'Bayesian', 'bagging_temperature': 8.533912000591828}. Best is trial 98 with value: 0.8791208791208791.
[32m[I 2023-04-21 02:19:56,044][39m Trial 2429 finished with value: 0.8539325842696629 and parameters: {'objective': 'CrossEntropy', 'colsample_bylevel': 0.0828887214112888, 'depth': 3, 'boosting_type': 'Plain', 'bootstrap_type': 'Bayesian', 'bagging_temperature': 6.82947093451188}. Best is trial 98 with value: 0.8791208791208791.
[32m[I 2023-04-21 02:19:56,929][39m Trial 2430 finished with value: 0.8275862068965518 and parameters: {'objective': 'CrossEntropy', 'colsample_bylevel': 0.08337739120816322, 'depth': 4, 'boosting_type': 'Plain', 'bootstrap_type': 'Bayesian', 'bagging_temperature': 9.479515093424055}. Best is trial 98 with value: 0.8791208791208791.
[32m[I 2023-04-21 02:19:58,333][39m Trial 2431 finished with value: 0.8505747126436782 and parameters: {'objective': 'CrossEntropy', 'colsample_bylevel': 0.08941024361365707, 'depth': 9, 'boosting_type': 'Plain', 'bootstrap_type': 'Bayesian', 'bagging_temperature': 9.145487867491976}. Best is trial 98 with value: 0.8791208791208791.
[32m[I 2023-04-21 02:19:59,279][39m Trial 2432 finished with value: 0.8139534883720929 and parameters: {'objective': 'Logloss', 'colsample_bylevel': 0.07661258674178517, 'depth': 10, 'boosting_type': 'Plain', 'bootstrap_type': 'Bayesian', 'bagging_temperature': 9.798342431699274}. Best is trial 98 with value: 0.8791208791208791.
[32m[I 2023-04-21 02:19:59,905][39m Trial 2433 finished with value: 0.7999999999999999 and parameters: {'objective': 'CrossEntropy', 'colsample_bylevel': 0.08928941069669027, 'depth': 12, 'boosting_type': 'Plain', 'bootstrap_type': 'MVS'}. Best is trial 98 with value: 0.8791208791208791.
[32m[I 2023-04-21 02:20:00,815][39m Trial 2434 finished with value: 0.8636363636363636 and parameters: {'objective': 'CrossEntropy', 'colsample_bylevel': 0.08503877112301096, 'depth': 11, 'boosting_type': 'Plain', 'bootstrap_type': 'Bayesian', 'bagging_temperature': 8.784522357023803}. Best is trial 98 with value: 0.8791208791208791.
[32m[I 2023-04-21 02:20:01,701][39m Trial 2435 finished with value: 0.8666666666666666 and parameters: {'objective': 'CrossEntropy', 'colsample_bylevel': 0.07336775893934203, 'depth': 9, 'boosting_type': 'Plain', 'bootstrap_type': 'Bayesian', 'bagging_temperature': 9.67309337514781}. Best is trial 98 with value: 0.8791208791208791.
[32m[I 2023-04-21 02:20:02,628][39m Trial 2436 finished with value: 0.8505747126436782 and parameters: {'objective': 'CrossEntropy', 'colsample_bylevel': 0.09228142550968686, 'depth': 10, 'boosting_type': 'Plain', 'bootstrap_type': 'Bayesian', 'bagging_temperature': 9.63448619097405}. Best is trial 98 with value: 0.8791208791208791.
[32m[I 2023-04-21 02:20:03,783][39m Trial 2437 finished with value: 0.8539325842696629 and parameters: {'objective': 'CrossEntropy', 'colsample_bylevel': 0.08137168729565589, 'depth': 9, 'boosting_type': 'Plain', 'bootstrap_type': 'Bayesian', 'bagging_temperature': 8.652679585713468}. Best is trial 98 with value: 0.8791208791208791.
[32m[I 2023-04-21 02:20:04,679][39m Trial 2438 finished with value: 0.8505747126436782 and parameters: {'objective': 'CrossEntropy', 'colsample_bylevel': 0.08280483245821108, 'depth': 11, 'boosting_type': 'Plain', 'bootstrap_type': 'Bayesian', 'bagging_temperature': 9.49920985509989}. Best is trial 98 with value: 0.8791208791208791.
[32m[I 2023-04-21 02:20:05,624][39m Trial 2439 finished with value: 0.8409090909090909 and parameters: {'objective': 'CrossEntropy', 'colsample_bylevel': 0.07588667475049092, 'depth': 9, 'boosting_type': 'Plain', 'bootstrap_type': 'Bayesian', 'bagging_temperature': 8.315383916563166}. Best is trial 98 with value: 0.8791208791208791.
[32m[I 2023-04-21 02:20:06,556][39m Trial 2440 finished with value: 0.8275862068965518 and parameters: {'objective': 'CrossEntropy', 'colsample_bylevel': 0.0813687647316698, 'depth': 4, 'boosting_type': 'Plain', 'bootstrap_type': 'Bayesian', 'bagging_temperature': 9.608112798243189}. Best is trial 98 with value: 0.8791208791208791.
[32m[I 2023-04-21 02:20:07,606][39m Trial 2441 finished with value: 0.8505747126436782 and parameters: {'objective': 'CrossEntropy', 'colsample_bylevel': 0.0813251318051135, 'depth': 11, 'boosting_type': 'Plain', 'bootstrap_type': 'Bayesian', 'bagging_temperature': 8.8472945536612}. Best is trial 98 with value: 0.8791208791208791.
[32m[I 2023-04-21 02:20:08,267][39m Trial 2442 finished with value: 0.8409090909090909 and parameters: {'objective': 'CrossEntropy', 'colsample_bylevel': 0.07495123459739889, 'depth': 11, 'boosting_type': 'Plain', 'bootstrap_type': 'Bayesian', 'bagging_temperature': 9.768751110015774}. Best is trial 98 with value: 0.8791208791208791.
[32m[I 2023-04-21 02:20:09,201][39m Trial 2443 finished with value: 0.8275862068965518 and parameters: {'objective': 'CrossEntropy', 'colsample_bylevel': 0.09945170699141859, 'depth': 4, 'boosting_type': 'Plain', 'bootstrap_type': 'Bayesian', 'bagging_temperature': 8.625160069411846}. Best is trial 98 with value: 0.8791208791208791.
[32m[I 2023-04-21 02:20:14,084][39m Trial 2444 finished with value: 0.8409090909090909 and parameters: {'objective': 'Logloss', 'colsample_bylevel': 0.07394871446971352, 'depth': 4, 'boosting_type': 'Ordered', 'bootstrap_type': 'Bayesian', 'bagging_temperature': 9.696830213922496}. Best is trial 98 with value: 0.8791208791208791.
