[32m[I 2023-04-21 02:12:43,115][39m Trial 2049 finished with value: 0.8539325842696629 and parameters: {'objective': 'CrossEntropy', 'colsample_bylevel': 0.08313007665520251, 'depth': 3, 'boosting_type': 'Plain', 'bootstrap_type': 'Bayesian', 'bagging_temperature': 9.391528586606968}. Best is trial 98 with value: 0.8791208791208791.
[32m[I 2023-04-21 02:12:44,369][39m Trial 2050 finished with value: 0.8666666666666666 and parameters: {'objective': 'CrossEntropy', 'colsample_bylevel': 0.08986188223383934, 'depth': 2, 'boosting_type': 'Plain', 'bootstrap_type': 'Bayesian', 'bagging_temperature': 9.590819558413774}. Best is trial 98 with value: 0.8791208791208791.
[32m[I 2023-04-21 02:12:45,106][39m Trial 2051 finished with value: 0.8666666666666666 and parameters: {'objective': 'CrossEntropy', 'colsample_bylevel': 0.0938449495542873, 'depth': 3, 'boosting_type': 'Plain', 'bootstrap_type': 'Bayesian', 'bagging_temperature': 9.784298906300677}. Best is trial 98 with value: 0.8791208791208791.
[32m[I 2023-04-21 02:12:45,999][39m Trial 2052 finished with value: 0.8275862068965518 and parameters: {'objective': 'CrossEntropy', 'colsample_bylevel': 0.09404867092098781, 'depth': 3, 'boosting_type': 'Plain', 'bootstrap_type': 'MVS'}. Best is trial 98 with value: 0.8791208791208791.
[32m[I 2023-04-21 02:12:46,738][39m Trial 2053 finished with value: 0.8409090909090909 and parameters: {'objective': 'Logloss', 'colsample_bylevel': 0.07422945307135337, 'depth': 5, 'boosting_type': 'Plain', 'bootstrap_type': 'Bayesian', 'bagging_temperature': 9.639610861862092}. Best is trial 98 with value: 0.8791208791208791.
[32m[I 2023-04-21 02:12:47,542][39m Trial 2054 finished with value: 0.8539325842696629 and parameters: {'objective': 'Logloss', 'colsample_bylevel': 0.070809278770635, 'depth': 5, 'boosting_type': 'Plain', 'bootstrap_type': 'Bayesian', 'bagging_temperature': 9.256931099957882}. Best is trial 98 with value: 0.8791208791208791.
[32m[I 2023-04-21 02:12:48,420][39m Trial 2055 finished with value: 0.8666666666666666 and parameters: {'objective': 'Logloss', 'colsample_bylevel': 0.07371275189909436, 'depth': 5, 'boosting_type': 'Plain', 'bootstrap_type': 'Bayesian', 'bagging_temperature': 9.219339003032337}. Best is trial 98 with value: 0.8791208791208791.
[32m[I 2023-04-21 02:12:49,435][39m Trial 2056 finished with value: 0.8666666666666666 and parameters: {'objective': 'Logloss', 'colsample_bylevel': 0.07082403239248702, 'depth': 5, 'boosting_type': 'Plain', 'bootstrap_type': 'Bayesian', 'bagging_temperature': 9.467355842558257}. Best is trial 98 with value: 0.8791208791208791.
[32m[I 2023-04-21 02:12:50,132][39m Trial 2057 finished with value: 0.8409090909090909 and parameters: {'objective': 'Logloss', 'colsample_bylevel': 0.06893117505204413, 'depth': 5, 'boosting_type': 'Plain', 'bootstrap_type': 'Bayesian', 'bagging_temperature': 9.456086552042086}. Best is trial 98 with value: 0.8791208791208791.
[32m[I 2023-04-21 02:12:51,067][39m Trial 2058 finished with value: 0.8539325842696629 and parameters: {'objective': 'Logloss', 'colsample_bylevel': 0.07284268861580007, 'depth': 6, 'boosting_type': 'Plain', 'bootstrap_type': 'Bayesian', 'bagging_temperature': 8.601024955813473}. Best is trial 98 with value: 0.8791208791208791.
[32m[I 2023-04-21 02:12:51,830][39m Trial 2059 finished with value: 0.8539325842696629 and parameters: {'objective': 'Logloss', 'colsample_bylevel': 0.07866977764985741, 'depth': 4, 'boosting_type': 'Plain', 'bootstrap_type': 'Bayesian', 'bagging_temperature': 9.059333875137776}. Best is trial 98 with value: 0.8791208791208791.
[32m[I 2023-04-21 02:12:52,705][39m Trial 2060 finished with value: 0.8275862068965518 and parameters: {'objective': 'Logloss', 'colsample_bylevel': 0.07784303848218758, 'depth': 6, 'boosting_type': 'Plain', 'bootstrap_type': 'Bayesian', 'bagging_temperature': 8.29231341687458}. Best is trial 98 with value: 0.8791208791208791.
[32m[I 2023-04-21 02:12:53,626][39m Trial 2061 finished with value: 0.8409090909090909 and parameters: {'objective': 'CrossEntropy', 'colsample_bylevel': 0.07606894815219821, 'depth': 12, 'boosting_type': 'Plain', 'bootstrap_type': 'Bayesian', 'bagging_temperature': 9.121857059024428}. Best is trial 98 with value: 0.8791208791208791.
[32m[I 2023-04-21 02:12:54,370][39m Trial 2062 finished with value: 0.8666666666666666 and parameters: {'objective': 'Logloss', 'colsample_bylevel': 0.07218655450010564, 'depth': 5, 'boosting_type': 'Plain', 'bootstrap_type': 'Bayesian', 'bagging_temperature': 9.47337179144085}. Best is trial 98 with value: 0.8791208791208791.
[32m[I 2023-04-21 02:12:55,302][39m Trial 2063 finished with value: 0.8275862068965518 and parameters: {'objective': 'CrossEntropy', 'colsample_bylevel': 0.09176726084226396, 'depth': 4, 'boosting_type': 'Plain', 'bootstrap_type': 'Bayesian', 'bagging_temperature': 8.442881500660924}. Best is trial 98 with value: 0.8791208791208791.
[32m[I 2023-04-21 02:12:56,361][39m Trial 2064 finished with value: 0.8275862068965518 and parameters: {'objective': 'CrossEntropy', 'colsample_bylevel': 0.08114419399603519, 'depth': 4, 'boosting_type': 'Plain', 'bootstrap_type': 'Bayesian', 'bagging_temperature': 8.925922407124586}. Best is trial 98 with value: 0.8791208791208791.
[32m[I 2023-04-21 02:12:57,365][39m Trial 2065 finished with value: 0.8791208791208791 and parameters: {'objective': 'CrossEntropy', 'colsample_bylevel': 0.07419126455998426, 'depth': 4, 'boosting_type': 'Plain', 'bootstrap_type': 'Bayesian', 'bagging_temperature': 7.283321173205061}. Best is trial 98 with value: 0.8791208791208791.
[32m[I 2023-04-21 02:12:58,593][39m Trial 2066 finished with value: 0.8409090909090909 and parameters: {'objective': 'CrossEntropy', 'colsample_bylevel': 0.07310590377146758, 'depth': 4, 'boosting_type': 'Plain', 'bootstrap_type': 'Bayesian', 'bagging_temperature': 9.54054401206875}. Best is trial 98 with value: 0.8791208791208791.
[32m[I 2023-04-21 02:12:59,211][39m Trial 2067 finished with value: 0.8539325842696629 and parameters: {'objective': 'CrossEntropy', 'colsample_bylevel': 0.06987015506666695, 'depth': 11, 'boosting_type': 'Plain', 'bootstrap_type': 'Bayesian', 'bagging_temperature': 9.339893220825372}. Best is trial 98 with value: 0.8791208791208791.
[32m[I 2023-04-21 02:12:59,927][39m Trial 2068 finished with value: 0.8539325842696629 and parameters: {'objective': 'CrossEntropy', 'colsample_bylevel': 0.07265515102754921, 'depth': 4, 'boosting_type': 'Plain', 'bootstrap_type': 'Bayesian', 'bagging_temperature': 9.6593602204809}. Best is trial 98 with value: 0.8791208791208791.
[32m[I 2023-04-21 02:13:04,824][39m Trial 2069 finished with value: 0.7954545454545454 and parameters: {'objective': 'Logloss', 'colsample_bylevel': 0.07140379412316278, 'depth': 4, 'boosting_type': 'Ordered', 'bootstrap_type': 'MVS'}. Best is trial 98 with value: 0.8791208791208791.
[32m[I 2023-04-21 02:13:05,787][39m Trial 2070 finished with value: 0.8539325842696629 and parameters: {'objective': 'CrossEntropy', 'colsample_bylevel': 0.09640307361766227, 'depth': 2, 'boosting_type': 'Plain', 'bootstrap_type': 'Bayesian', 'bagging_temperature': 8.85936504570574}. Best is trial 98 with value: 0.8791208791208791.
[32m[I 2023-04-21 02:13:06,684][39m Trial 2071 finished with value: 0.8275862068965518 and parameters: {'objective': 'Logloss', 'colsample_bylevel': 0.0866383596653618, 'depth': 5, 'boosting_type': 'Plain', 'bootstrap_type': 'Bernoulli', 'subsample': 0.1677425697479517}. Best is trial 98 with value: 0.8791208791208791.
[32m[I 2023-04-21 02:13:07,709][39m Trial 2072 finished with value: 0.8409090909090909 and parameters: {'objective': 'CrossEntropy', 'colsample_bylevel': 0.07613316240230401, 'depth': 11, 'boosting_type': 'Plain', 'bootstrap_type': 'Bayesian', 'bagging_temperature': 9.6361369376305}. Best is trial 98 with value: 0.8791208791208791.
[32m[I 2023-04-21 02:13:08,412][39m Trial 2073 finished with value: 0.8409090909090909 and parameters: {'objective': 'CrossEntropy', 'colsample_bylevel': 0.08942884389132458, 'depth': 3, 'boosting_type': 'Plain', 'bootstrap_type': 'Bayesian', 'bagging_temperature': 8.594095387906776}. Best is trial 98 with value: 0.8791208791208791.
[32m[I 2023-04-21 02:13:09,334][39m Trial 2074 finished with value: 0.8539325842696629 and parameters: {'objective': 'CrossEntropy', 'colsample_bylevel': 0.0740999043411727, 'depth': 6, 'boosting_type': 'Plain', 'bootstrap_type': 'Bayesian', 'bagging_temperature': 9.78304091758944}. Best is trial 98 with value: 0.8791208791208791.
[32m[I 2023-04-21 02:13:10,369][39m Trial 2075 finished with value: 0.8275862068965518 and parameters: {'objective': 'CrossEntropy', 'colsample_bylevel': 0.07702180498378486, 'depth': 7, 'boosting_type': 'Plain', 'bootstrap_type': 'Bayesian', 'bagging_temperature': 9.512639496596563}. Best is trial 98 with value: 0.8791208791208791.
[32m[I 2023-04-21 02:13:11,358][39m Trial 2076 finished with value: 0.8666666666666666 and parameters: {'objective': 'CrossEntropy', 'colsample_bylevel': 0.0876474716768785, 'depth': 3, 'boosting_type': 'Plain', 'bootstrap_type': 'Bayesian', 'bagging_temperature': 8.384233740043996}. Best is trial 98 with value: 0.8791208791208791.
[32m[I 2023-04-21 02:13:12,274][39m Trial 2077 finished with value: 0.8666666666666666 and parameters: {'objective': 'Logloss', 'colsample_bylevel': 0.07814254455458687, 'depth': 5, 'boosting_type': 'Plain', 'bootstrap_type': 'Bayesian', 'bagging_temperature': 8.305379920261641}. Best is trial 98 with value: 0.8791208791208791.
[32m[I 2023-04-21 02:13:13,198][39m Trial 2078 finished with value: 0.8409090909090909 and parameters: {'objective': 'Logloss', 'colsample_bylevel': 0.07884362835234793, 'depth': 4, 'boosting_type': 'Plain', 'bootstrap_type': 'Bayesian', 'bagging_temperature': 8.643839424022522}. Best is trial 98 with value: 0.8791208791208791.
[32m[I 2023-04-21 02:13:13,859][39m Trial 2079 finished with value: 0.8409090909090909 and parameters: {'objective': 'CrossEntropy', 'colsample_bylevel': 0.07491937498552442, 'depth': 8, 'boosting_type': 'Plain', 'bootstrap_type': 'Bayesian', 'bagging_temperature': 9.489849238357907}. Best is trial 98 with value: 0.8791208791208791.
[32m[I 2023-04-21 02:13:14,600][39m Trial 2080 finished with value: 0.8409090909090909 and parameters: {'objective': 'CrossEntropy', 'colsample_bylevel': 0.07605065613105531, 'depth': 9, 'boosting_type': 'Plain', 'bootstrap_type': 'Bayesian', 'bagging_temperature': 9.64549108537728}. Best is trial 98 with value: 0.8791208791208791.
[32m[I 2023-04-21 02:13:15,306][39m Trial 2081 finished with value: 0.8409090909090909 and parameters: {'objective': 'CrossEntropy', 'colsample_bylevel': 0.048810977634034476, 'depth': 3, 'boosting_type': 'Plain', 'bootstrap_type': 'Bayesian', 'bagging_temperature': 9.788612043578691}. Best is trial 98 with value: 0.8791208791208791.
[32m[I 2023-04-21 02:13:16,199][39m Trial 2082 finished with value: 0.8275862068965518 and parameters: {'objective': 'CrossEntropy', 'colsample_bylevel': 0.08184866184439069, 'depth': 6, 'boosting_type': 'Plain', 'bootstrap_type': 'MVS'}. Best is trial 98 with value: 0.8791208791208791.
[32m[I 2023-04-21 02:13:17,134][39m Trial 2083 finished with value: 0.8409090909090909 and parameters: {'objective': 'CrossEntropy', 'colsample_bylevel': 0.0775767729280934, 'depth': 4, 'boosting_type': 'Plain', 'bootstrap_type': 'Bayesian', 'bagging_temperature': 8.785725456245121}. Best is trial 98 with value: 0.8791208791208791.
[32m[I 2023-04-21 02:13:18,052][39m Trial 2084 finished with value: 0.8539325842696629 and parameters: {'objective': 'Logloss', 'colsample_bylevel': 0.0856024690921697, 'depth': 3, 'boosting_type': 'Plain', 'bootstrap_type': 'Bayesian', 'bagging_temperature': 7.80655093569703}. Best is trial 98 with value: 0.8791208791208791.
[32m[I 2023-04-21 02:13:18,962][39m Trial 2085 finished with value: 0.8666666666666666 and parameters: {'objective': 'Logloss', 'colsample_bylevel': 0.07247767925655615, 'depth': 6, 'boosting_type': 'Plain', 'bootstrap_type': 'Bayesian', 'bagging_temperature': 9.129957395158115}. Best is trial 98 with value: 0.8791208791208791.
[32m[I 2023-04-21 02:13:24,039][39m Trial 2086 finished with value: 0.8275862068965518 and parameters: {'objective': 'Logloss', 'colsample_bylevel': 0.06948786249159776, 'depth': 5, 'boosting_type': 'Ordered', 'bootstrap_type': 'Bayesian', 'bagging_temperature': 8.806547536042443}. Best is trial 98 with value: 0.8791208791208791.
[32m[I 2023-04-21 02:13:25,431][39m Trial 2087 finished with value: 0.8539325842696629 and parameters: {'objective': 'CrossEntropy', 'colsample_bylevel': 0.07915548979515714, 'depth': 3, 'boosting_type': 'Plain', 'bootstrap_type': 'Bayesian', 'bagging_temperature': 7.417160757164375}. Best is trial 98 with value: 0.8791208791208791.
[32m[I 2023-04-21 02:13:26,291][39m Trial 2088 finished with value: 0.8314606741573034 and parameters: {'objective': 'CrossEntropy', 'colsample_bylevel': 0.07427582937198847, 'depth': 3, 'boosting_type': 'Plain', 'bootstrap_type': 'Bernoulli', 'subsample': 0.5147809740343}. Best is trial 98 with value: 0.8791208791208791.
[32m[I 2023-04-21 02:13:27,214][39m Trial 2089 finished with value: 0.8539325842696629 and parameters: {'objective': 'CrossEntropy', 'colsample_bylevel': 0.0731662507264803, 'depth': 4, 'boosting_type': 'Plain', 'bootstrap_type': 'Bayesian', 'bagging_temperature': 9.757608611568305}. Best is trial 98 with value: 0.8791208791208791.
[32m[I 2023-04-21 02:13:27,801][39m Trial 2090 finished with value: 0.8539325842696629 and parameters: {'objective': 'Logloss', 'colsample_bylevel': 0.07476531928180508, 'depth': 5, 'boosting_type': 'Plain', 'bootstrap_type': 'Bayesian', 'bagging_temperature': 8.355722631861802}. Best is trial 98 with value: 0.8791208791208791.
[32m[I 2023-04-21 02:13:28,435][39m Trial 2091 finished with value: 0.8539325842696629 and parameters: {'objective': 'CrossEntropy', 'colsample_bylevel': 0.08353867340662975, 'depth': 3, 'boosting_type': 'Plain', 'bootstrap_type': 'Bayesian', 'bagging_temperature': 9.118731151415577}. Best is trial 98 with value: 0.8791208791208791.
[32m[I 2023-04-21 02:13:29,136][39m Trial 2092 finished with value: 0.8409090909090909 and parameters: {'objective': 'CrossEntropy', 'colsample_bylevel': 0.07751168402603081, 'depth': 6, 'boosting_type': 'Plain', 'bootstrap_type': 'MVS'}. Best is trial 98 with value: 0.8791208791208791.
[32m[I 2023-04-21 02:13:29,959][39m Trial 2093 finished with value: 0.8505747126436782 and parameters: {'objective': 'CrossEntropy', 'colsample_bylevel': 0.07607152128536764, 'depth': 6, 'boosting_type': 'Plain', 'bootstrap_type': 'Bayesian', 'bagging_temperature': 3.546817657428127}. Best is trial 98 with value: 0.8791208791208791.
[32m[I 2023-04-21 02:13:31,027][39m Trial 2094 finished with value: 0.8791208791208791 and parameters: {'objective': 'CrossEntropy', 'colsample_bylevel': 0.0804149156813784, 'depth': 3, 'boosting_type': 'Plain', 'bootstrap_type': 'Bayesian', 'bagging_temperature': 8.711864927044266}. Best is trial 98 with value: 0.8791208791208791.
[32m[I 2023-04-21 02:13:31,907][39m Trial 2095 finished with value: 0.8409090909090909 and parameters: {'objective': 'Logloss', 'colsample_bylevel': 0.06685181364879327, 'depth': 4, 'boosting_type': 'Plain', 'bootstrap_type': 'Bayesian', 'bagging_temperature': 9.581492709828812}. Best is trial 98 with value: 0.8791208791208791.
[32m[I 2023-04-21 02:13:33,108][39m Trial 2096 finished with value: 0.8539325842696629 and parameters: {'objective': 'CrossEntropy', 'colsample_bylevel': 0.07941671581525767, 'depth': 2, 'boosting_type': 'Plain', 'bootstrap_type': 'Bayesian', 'bagging_temperature': 9.019049012665587}. Best is trial 98 with value: 0.8791208791208791.
[32m[I 2023-04-21 02:13:33,834][39m Trial 2097 finished with value: 0.8409090909090909 and parameters: {'objective': 'CrossEntropy', 'colsample_bylevel': 0.07790959520320082, 'depth': 10, 'boosting_type': 'Plain', 'bootstrap_type': 'Bayesian', 'bagging_temperature': 9.39535021920914}. Best is trial 98 with value: 0.8791208791208791.
[32m[I 2023-04-21 02:13:34,520][39m Trial 2098 finished with value: 0.8666666666666666 and parameters: {'objective': 'CrossEntropy', 'colsample_bylevel': 0.08035806172497571, 'depth': 3, 'boosting_type': 'Plain', 'bootstrap_type': 'Bayesian', 'bagging_temperature': 8.759425967907543}. Best is trial 98 with value: 0.8791208791208791.
[32m[I 2023-04-21 02:13:35,360][39m Trial 2099 finished with value: 0.8409090909090909 and parameters: {'objective': 'CrossEntropy', 'colsample_bylevel': 0.07565827440692753, 'depth': 10, 'boosting_type': 'Plain', 'bootstrap_type': 'Bayesian', 'bagging_temperature': 9.794045766579211}. Best is trial 98 with value: 0.8791208791208791.
[32m[I 2023-04-21 02:13:36,276][39m Trial 2100 finished with value: 0.8539325842696629 and parameters: {'objective': 'CrossEntropy', 'colsample_bylevel': 0.08298332283056893, 'depth': 3, 'boosting_type': 'Plain', 'bootstrap_type': 'Bayesian', 'bagging_temperature': 8.282653994601707}. Best is trial 98 with value: 0.8791208791208791.
[32m[I 2023-04-21 02:13:37,121][39m Trial 2101 finished with value: 0.8539325842696629 and parameters: {'objective': 'Logloss', 'colsample_bylevel': 0.08063042641802509, 'depth': 5, 'boosting_type': 'Plain', 'bootstrap_type': 'Bayesian', 'bagging_temperature': 9.34329716400902}. Best is trial 98 with value: 0.8791208791208791.
[32m[I 2023-04-21 02:13:38,458][39m Trial 2102 finished with value: 0.8409090909090909 and parameters: {'objective': 'Logloss', 'colsample_bylevel': 0.08029096161827125, 'depth': 3, 'boosting_type': 'Plain', 'bootstrap_type': 'Bayesian', 'bagging_temperature': 4.850638173304056}. Best is trial 98 with value: 0.8791208791208791.
[32m[I 2023-04-21 02:13:39,319][39m Trial 2103 finished with value: 0.8409090909090909 and parameters: {'objective': 'CrossEntropy', 'colsample_bylevel': 0.07524998486760436, 'depth': 3, 'boosting_type': 'Plain', 'bootstrap_type': 'Bayesian', 'bagging_temperature': 9.785774398632032}. Best is trial 98 with value: 0.8791208791208791.
[32m[I 2023-04-21 02:13:43,822][39m Trial 2104 finished with value: 0.8539325842696629 and parameters: {'objective': 'CrossEntropy', 'colsample_bylevel': 0.09149957518625529, 'depth': 3, 'boosting_type': 'Ordered', 'bootstrap_type': 'Bayesian', 'bagging_temperature': 9.763115065211778}. Best is trial 98 with value: 0.8791208791208791.
[32m[I 2023-04-21 02:13:44,937][39m Trial 2105 finished with value: 0.8666666666666666 and parameters: {'objective': 'Logloss', 'colsample_bylevel': 0.07296035306111329, 'depth': 4, 'boosting_type': 'Plain', 'bootstrap_type': 'Bayesian', 'bagging_temperature': 9.128169079186451}. Best is trial 98 with value: 0.8791208791208791.
[32m[I 2023-04-21 02:13:46,126][39m Trial 2106 finished with value: 0.8181818181818182 and parameters: {'objective': 'CrossEntropy', 'colsample_bylevel': 0.08415774921699884, 'depth': 3, 'boosting_type': 'Plain', 'bootstrap_type': 'Bayesian', 'bagging_temperature': 1.7900736067116911}. Best is trial 98 with value: 0.8791208791208791.
[32m[I 2023-04-21 02:13:47,150][39m Trial 2107 finished with value: 0.8181818181818182 and parameters: {'objective': 'CrossEntropy', 'colsample_bylevel': 0.0719503334452751, 'depth': 4, 'boosting_type': 'Plain', 'bootstrap_type': 'MVS'}. Best is trial 98 with value: 0.8791208791208791.
[32m[I 2023-04-21 02:13:48,037][39m Trial 2108 finished with value: 0.8539325842696629 and parameters: {'objective': 'CrossEntropy', 'colsample_bylevel': 0.07926298184523335, 'depth': 3, 'boosting_type': 'Plain', 'bootstrap_type': 'Bayesian', 'bagging_temperature': 9.932706255197534}. Best is trial 98 with value: 0.8791208791208791.
[32m[I 2023-04-21 02:13:48,655][39m Trial 2109 finished with value: 0.8539325842696629 and parameters: {'objective': 'Logloss', 'colsample_bylevel': 0.07703231189417815, 'depth': 5, 'boosting_type': 'Plain', 'bootstrap_type': 'Bayesian', 'bagging_temperature': 9.98427872115317}. Best is trial 98 with value: 0.8791208791208791.
[32m[I 2023-04-21 02:13:49,443][39m Trial 2110 finished with value: 0.8505747126436782 and parameters: {'objective': 'CrossEntropy', 'colsample_bylevel': 0.09080460877115848, 'depth': 9, 'boosting_type': 'Plain', 'bootstrap_type': 'Bayesian', 'bagging_temperature': 7.295644617110274}. Best is trial 98 with value: 0.8791208791208791.
[32m[I 2023-04-21 02:13:50,448][39m Trial 2111 finished with value: 0.8539325842696629 and parameters: {'objective': 'CrossEntropy', 'colsample_bylevel': 0.07164499637809953, 'depth': 4, 'boosting_type': 'Plain', 'bootstrap_type': 'Bayesian', 'bagging_temperature': 9.835528106492763}. Best is trial 98 with value: 0.8791208791208791.
[32m[I 2023-04-21 02:13:51,334][39m Trial 2112 finished with value: 0.8275862068965518 and parameters: {'objective': 'CrossEntropy', 'colsample_bylevel': 0.07672237197872206, 'depth': 6, 'boosting_type': 'Plain', 'bootstrap_type': 'Bayesian', 'bagging_temperature': 9.982808558376908}. Best is trial 98 with value: 0.8791208791208791.
[32m[I 2023-04-21 02:13:52,326][39m Trial 2113 finished with value: 0.8505747126436782 and parameters: {'objective': 'CrossEntropy', 'colsample_bylevel': 0.07442726736058784, 'depth': 10, 'boosting_type': 'Plain', 'bootstrap_type': 'Bayesian', 'bagging_temperature': 7.00256431436492}. Best is trial 98 with value: 0.8791208791208791.
[32m[I 2023-04-21 02:13:53,410][39m Trial 2114 finished with value: 0.8181818181818182 and parameters: {'objective': 'CrossEntropy', 'colsample_bylevel': 0.09858446665877849, 'depth': 3, 'boosting_type': 'Plain', 'bootstrap_type': 'Bernoulli', 'subsample': 0.9812578658993938}. Best is trial 98 with value: 0.8791208791208791.
