[32m[I 2023-04-21 03:29:22,128][39m Trial 5850 finished with value: 0.8372093023255814 and parameters: {'objective': 'CrossEntropy', 'colsample_bylevel': 0.08473691345596816, 'depth': 8, 'boosting_type': 'Plain', 'bootstrap_type': 'Bernoulli', 'subsample': 0.7093231292084478}. Best is trial 3065 with value: 0.8863636363636364.
[32m[I 2023-04-21 03:29:22,778][39m Trial 5851 finished with value: 0.8139534883720929 and parameters: {'objective': 'Logloss', 'colsample_bylevel': 0.01762844277830898, 'depth': 2, 'boosting_type': 'Plain', 'bootstrap_type': 'Bayesian', 'bagging_temperature': 9.317325726077797}. Best is trial 3065 with value: 0.8863636363636364.
[32m[I 2023-04-21 03:29:23,643][39m Trial 5852 finished with value: 0.8539325842696629 and parameters: {'objective': 'CrossEntropy', 'colsample_bylevel': 0.062106532105143185, 'depth': 8, 'boosting_type': 'Plain', 'bootstrap_type': 'MVS'}. Best is trial 3065 with value: 0.8863636363636364.
[32m[I 2023-04-21 03:29:24,335][39m Trial 5853 finished with value: 0.8275862068965518 and parameters: {'objective': 'CrossEntropy', 'colsample_bylevel': 0.06978569442439929, 'depth': 10, 'boosting_type': 'Plain', 'bootstrap_type': 'Bayesian', 'bagging_temperature': 9.821986787962249}. Best is trial 3065 with value: 0.8863636363636364.
[32m[I 2023-04-21 03:29:25,106][39m Trial 5854 finished with value: 0.8539325842696629 and parameters: {'objective': 'CrossEntropy', 'colsample_bylevel': 0.06243471298530793, 'depth': 9, 'boosting_type': 'Plain', 'bootstrap_type': 'Bayesian', 'bagging_temperature': 9.902235664259182}. Best is trial 3065 with value: 0.8863636363636364.
[32m[I 2023-04-21 03:29:26,457][39m Trial 5855 finished with value: 0.8372093023255814 and parameters: {'objective': 'CrossEntropy', 'colsample_bylevel': 0.08506178228225175, 'depth': 10, 'boosting_type': 'Plain', 'bootstrap_type': 'Bayesian', 'bagging_temperature': 8.99807759744095}. Best is trial 3065 with value: 0.8863636363636364.
[32m[I 2023-04-21 03:29:27,741][39m Trial 5856 finished with value: 0.8275862068965518 and parameters: {'objective': 'CrossEntropy', 'colsample_bylevel': 0.06440319221542942, 'depth': 9, 'boosting_type': 'Plain', 'bootstrap_type': 'Bayesian', 'bagging_temperature': 8.418953441906076}. Best is trial 3065 with value: 0.8863636363636364.
[32m[I 2023-04-21 03:29:29,020][39m Trial 5857 finished with value: 0.8409090909090909 and parameters: {'objective': 'Logloss', 'colsample_bylevel': 0.07468215989561887, 'depth': 9, 'boosting_type': 'Plain', 'bootstrap_type': 'Bayesian', 'bagging_temperature': 8.348540118197208}. Best is trial 3065 with value: 0.8863636363636364.
[32m[I 2023-04-21 03:29:29,940][39m Trial 5858 finished with value: 0.8666666666666666 and parameters: {'objective': 'Logloss', 'colsample_bylevel': 0.07610482886348377, 'depth': 10, 'boosting_type': 'Plain', 'bootstrap_type': 'Bayesian', 'bagging_temperature': 9.693971422105774}. Best is trial 3065 with value: 0.8863636363636364.
[32m[I 2023-04-21 03:29:31,090][39m Trial 5859 finished with value: 0.8139534883720929 and parameters: {'objective': 'CrossEntropy', 'colsample_bylevel': 0.0690752849495764, 'depth': 11, 'boosting_type': 'Plain', 'bootstrap_type': 'Bernoulli', 'subsample': 0.6443522482680475}. Best is trial 3065 with value: 0.8863636363636364.
[32m[I 2023-04-21 03:29:36,037][39m Trial 5860 finished with value: 0.8 and parameters: {'objective': 'CrossEntropy', 'colsample_bylevel': 0.053854098211294596, 'depth': 5, 'boosting_type': 'Ordered', 'bootstrap_type': 'MVS'}. Best is trial 3065 with value: 0.8863636363636364.
[32m[I 2023-04-21 03:29:37,495][39m Trial 5861 finished with value: 0.8539325842696629 and parameters: {'objective': 'Logloss', 'colsample_bylevel': 0.09298433798547222, 'depth': 10, 'boosting_type': 'Plain', 'bootstrap_type': 'Bayesian', 'bagging_temperature': 9.986893194825381}. Best is trial 3065 with value: 0.8863636363636364.
[32m[I 2023-04-21 03:29:38,625][39m Trial 5862 finished with value: 0.8666666666666666 and parameters: {'objective': 'CrossEntropy', 'colsample_bylevel': 0.06751339781752065, 'depth': 11, 'boosting_type': 'Plain', 'bootstrap_type': 'Bayesian', 'bagging_temperature': 8.759211317582738}. Best is trial 3065 with value: 0.8863636363636364.
[32m[I 2023-04-21 03:29:39,651][39m Trial 5863 finished with value: 0.8636363636363636 and parameters: {'objective': 'CrossEntropy', 'colsample_bylevel': 0.07566496351663268, 'depth': 10, 'boosting_type': 'Plain', 'bootstrap_type': 'Bayesian', 'bagging_temperature': 9.508826612191264}. Best is trial 3065 with value: 0.8863636363636364.
[32m[I 2023-04-21 03:29:40,367][39m Trial 5864 finished with value: 0.8539325842696629 and parameters: {'objective': 'CrossEntropy', 'colsample_bylevel': 0.08102742407003272, 'depth': 3, 'boosting_type': 'Plain', 'bootstrap_type': 'Bayesian', 'bagging_temperature': 8.642039885693755}. Best is trial 3065 with value: 0.8863636363636364.
[32m[I 2023-04-21 03:29:41,097][39m Trial 5865 finished with value: 0.8666666666666666 and parameters: {'objective': 'CrossEntropy', 'colsample_bylevel': 0.07721478351188307, 'depth': 10, 'boosting_type': 'Plain', 'bootstrap_type': 'Bayesian', 'bagging_temperature': 9.962113634137086}. Best is trial 3065 with value: 0.8863636363636364.
[32m[I 2023-04-21 03:29:42,581][39m Trial 5866 finished with value: 0.8666666666666666 and parameters: {'objective': 'CrossEntropy', 'colsample_bylevel': 0.06530374178770024, 'depth': 9, 'boosting_type': 'Plain', 'bootstrap_type': 'Bayesian', 'bagging_temperature': 9.72515244248913}. Best is trial 3065 with value: 0.8863636363636364.
[32m[I 2023-04-21 03:29:43,733][39m Trial 5867 finished with value: 0.8666666666666666 and parameters: {'objective': 'Logloss', 'colsample_bylevel': 0.0737890810658229, 'depth': 5, 'boosting_type': 'Plain', 'bootstrap_type': 'Bayesian', 'bagging_temperature': 9.626525196055992}. Best is trial 3065 with value: 0.8863636363636364.
[32m[I 2023-04-21 03:29:44,947][39m Trial 5868 finished with value: 0.8636363636363636 and parameters: {'objective': 'CrossEntropy', 'colsample_bylevel': 0.07798610419916416, 'depth': 2, 'boosting_type': 'Plain', 'bootstrap_type': 'Bayesian', 'bagging_temperature': 9.98101832346416}. Best is trial 3065 with value: 0.8863636363636364.
[32m[I 2023-04-21 03:29:46,393][39m Trial 5869 finished with value: 0.8666666666666666 and parameters: {'objective': 'Logloss', 'colsample_bylevel': 0.0711170827142742, 'depth': 9, 'boosting_type': 'Plain', 'bootstrap_type': 'Bayesian', 'bagging_temperature': 8.050186712924079}. Best is trial 3065 with value: 0.8863636363636364.
[32m[I 2023-04-21 03:29:47,038][39m Trial 5870 finished with value: 0.8 and parameters: {'objective': 'CrossEntropy', 'colsample_bylevel': 0.08180652850942165, 'depth': 1, 'boosting_type': 'Plain', 'bootstrap_type': 'MVS'}. Best is trial 3065 with value: 0.8863636363636364.
[32m[I 2023-04-21 03:29:47,928][39m Trial 5871 finished with value: 0.8409090909090909 and parameters: {'objective': 'CrossEntropy', 'colsample_bylevel': 0.0866586265846906, 'depth': 3, 'boosting_type': 'Plain', 'bootstrap_type': 'Bayesian', 'bagging_temperature': 9.295033379937484}. Best is trial 3065 with value: 0.8863636363636364.
[32m[I 2023-04-21 03:29:49,184][39m Trial 5872 finished with value: 0.8409090909090909 and parameters: {'objective': 'CrossEntropy', 'colsample_bylevel': 0.07918647554668425, 'depth': 9, 'boosting_type': 'Plain', 'bootstrap_type': 'MVS'}. Best is trial 3065 with value: 0.8863636363636364.
[32m[I 2023-04-21 03:29:50,407][39m Trial 5873 finished with value: 0.8666666666666666 and parameters: {'objective': 'CrossEntropy', 'colsample_bylevel': 0.08141382541391526, 'depth': 2, 'boosting_type': 'Plain', 'bootstrap_type': 'Bayesian', 'bagging_temperature': 9.20292804452469}. Best is trial 3065 with value: 0.8863636363636364.
[32m[I 2023-04-21 03:29:51,909][39m Trial 5874 finished with value: 0.8666666666666666 and parameters: {'objective': 'CrossEntropy', 'colsample_bylevel': 0.08514128276113424, 'depth': 3, 'boosting_type': 'Plain', 'bootstrap_type': 'Bayesian', 'bagging_temperature': 9.09956053198875}. Best is trial 3065 with value: 0.8863636363636364.
[32m[I 2023-04-21 03:29:52,823][39m Trial 5875 finished with value: 0.8505747126436782 and parameters: {'objective': 'Logloss', 'colsample_bylevel': 0.09266294109022635, 'depth': 10, 'boosting_type': 'Plain', 'bootstrap_type': 'Bayesian', 'bagging_temperature': 6.017662190349387}. Best is trial 3065 with value: 0.8863636363636364.
[32m[I 2023-04-21 03:29:53,572][39m Trial 5876 finished with value: 0.8505747126436782 and parameters: {'objective': 'CrossEntropy', 'colsample_bylevel': 0.08092298465244416, 'depth': 10, 'boosting_type': 'Plain', 'bootstrap_type': 'Bayesian', 'bagging_temperature': 6.959444597810064}. Best is trial 3065 with value: 0.8863636363636364.
[32m[I 2023-04-21 03:29:54,681][39m Trial 5877 finished with value: 0.8539325842696629 and parameters: {'objective': 'CrossEntropy', 'colsample_bylevel': 0.08573994098985045, 'depth': 3, 'boosting_type': 'Plain', 'bootstrap_type': 'Bayesian', 'bagging_temperature': 9.388424945037444}. Best is trial 3065 with value: 0.8863636363636364.
[32m[I 2023-04-21 03:29:55,567][39m Trial 5878 finished with value: 0.8139534883720929 and parameters: {'objective': 'CrossEntropy', 'colsample_bylevel': 0.07187899083430996, 'depth': 10, 'boosting_type': 'Plain', 'bootstrap_type': 'Bayesian', 'bagging_temperature': 9.659698800706419}. Best is trial 3065 with value: 0.8863636363636364.
[32m[I 2023-04-21 03:30:00,440][39m Trial 5879 finished with value: 0.8444444444444446 and parameters: {'objective': 'CrossEntropy', 'colsample_bylevel': 0.08061479449831349, 'depth': 2, 'boosting_type': 'Ordered', 'bootstrap_type': 'Bayesian', 'bagging_temperature': 3.589508740353231}. Best is trial 3065 with value: 0.8863636363636364.
[32m[I 2023-04-21 03:30:01,831][39m Trial 5880 finished with value: 0.8139534883720929 and parameters: {'objective': 'CrossEntropy', 'colsample_bylevel': 0.07865719071035505, 'depth': 12, 'boosting_type': 'Plain', 'bootstrap_type': 'Bayesian', 'bagging_temperature': 5.347447694281723}. Best is trial 3065 with value: 0.8863636363636364.
[32m[I 2023-04-21 03:30:03,149][39m Trial 5881 finished with value: 0.8409090909090909 and parameters: {'objective': 'CrossEntropy', 'colsample_bylevel': 0.08823582225368008, 'depth': 12, 'boosting_type': 'Plain', 'bootstrap_type': 'Bayesian', 'bagging_temperature': 8.025242680297644}. Best is trial 3065 with value: 0.8863636363636364.
[32m[I 2023-04-21 03:30:04,503][39m Trial 5882 finished with value: 0.8539325842696629 and parameters: {'objective': 'CrossEntropy', 'colsample_bylevel': 0.06710588792856832, 'depth': 11, 'boosting_type': 'Plain', 'bootstrap_type': 'Bayesian', 'bagging_temperature': 9.839909267892928}. Best is trial 3065 with value: 0.8863636363636364.
[32m[I 2023-04-21 03:30:05,785][39m Trial 5883 finished with value: 0.8539325842696629 and parameters: {'objective': 'Logloss', 'colsample_bylevel': 0.07099055570530705, 'depth': 6, 'boosting_type': 'Plain', 'bootstrap_type': 'Bayesian', 'bagging_temperature': 8.562620899227621}. Best is trial 3065 with value: 0.8863636363636364.
[32m[I 2023-04-21 03:30:06,742][39m Trial 5884 finished with value: 0.8275862068965518 and parameters: {'objective': 'Logloss', 'colsample_bylevel': 0.06921828196705271, 'depth': 6, 'boosting_type': 'Plain', 'bootstrap_type': 'Bayesian', 'bagging_temperature': 8.460608988557631}. Best is trial 3065 with value: 0.8863636363636364.
[32m[I 2023-04-21 03:30:07,636][39m Trial 5885 finished with value: 0.8409090909090909 and parameters: {'objective': 'CrossEntropy', 'colsample_bylevel': 0.07866697719455815, 'depth': 4, 'boosting_type': 'Plain', 'bootstrap_type': 'Bernoulli', 'subsample': 0.5490921334054871}. Best is trial 3065 with value: 0.8863636363636364.
[32m[I 2023-04-21 03:30:08,722][39m Trial 5886 finished with value: 0.8505747126436782 and parameters: {'objective': 'CrossEntropy', 'colsample_bylevel': 0.072682689146492, 'depth': 5, 'boosting_type': 'Plain', 'bootstrap_type': 'Bayesian', 'bagging_temperature': 9.88364187717572}. Best is trial 3065 with value: 0.8863636363636364.
[32m[I 2023-04-21 03:30:09,458][39m Trial 5887 finished with value: 0.8791208791208791 and parameters: {'objective': 'Logloss', 'colsample_bylevel': 0.07582580265255404, 'depth': 10, 'boosting_type': 'Plain', 'bootstrap_type': 'Bayesian', 'bagging_temperature': 8.179537520758974}. Best is trial 3065 with value: 0.8863636363636364.
[32m[I 2023-04-21 03:30:10,772][39m Trial 5888 finished with value: 0.8409090909090909 and parameters: {'objective': 'Logloss', 'colsample_bylevel': 0.08283400349617263, 'depth': 4, 'boosting_type': 'Plain', 'bootstrap_type': 'Bayesian', 'bagging_temperature': 6.41723857913659}. Best is trial 3065 with value: 0.8863636363636364.
[32m[I 2023-04-21 03:30:11,987][39m Trial 5889 finished with value: 0.8409090909090909 and parameters: {'objective': 'Logloss', 'colsample_bylevel': 0.09358693132922033, 'depth': 10, 'boosting_type': 'Plain', 'bootstrap_type': 'Bayesian', 'bagging_temperature': 9.682379670162684}. Best is trial 3065 with value: 0.8863636363636364.
[32m[I 2023-04-21 03:30:13,077][39m Trial 5890 finished with value: 0.8539325842696629 and parameters: {'objective': 'Logloss', 'colsample_bylevel': 0.07256828192341809, 'depth': 10, 'boosting_type': 'Plain', 'bootstrap_type': 'Bayesian', 'bagging_temperature': 9.209114573484946}. Best is trial 3065 with value: 0.8863636363636364.
[32m[I 2023-04-21 03:30:13,881][39m Trial 5891 finished with value: 0.8539325842696629 and parameters: {'objective': 'CrossEntropy', 'colsample_bylevel': 0.06911466024282689, 'depth': 8, 'boosting_type': 'Plain', 'bootstrap_type': 'Bayesian', 'bagging_temperature': 9.285374736250704}. Best is trial 3065 with value: 0.8863636363636364.
[32m[I 2023-04-21 03:30:14,600][39m Trial 5892 finished with value: 0.8409090909090909 and parameters: {'objective': 'CrossEntropy', 'colsample_bylevel': 0.0750444575642187, 'depth': 6, 'boosting_type': 'Plain', 'bootstrap_type': 'Bayesian', 'bagging_temperature': 9.669229714911447}. Best is trial 3065 with value: 0.8863636363636364.
[32m[I 2023-04-21 03:30:15,979][39m Trial 5893 finished with value: 0.8275862068965518 and parameters: {'objective': 'CrossEntropy', 'colsample_bylevel': 0.08386894012876503, 'depth': 8, 'boosting_type': 'Plain', 'bootstrap_type': 'Bayesian', 'bagging_temperature': 9.537630317532974}. Best is trial 3065 with value: 0.8863636363636364.
[32m[I 2023-04-21 03:30:17,125][39m Trial 5894 finished with value: 0.8666666666666666 and parameters: {'objective': 'Logloss', 'colsample_bylevel': 0.07017142604911657, 'depth': 10, 'boosting_type': 'Plain', 'bootstrap_type': 'Bayesian', 'bagging_temperature': 9.849972179885057}. Best is trial 3065 with value: 0.8863636363636364.
[32m[I 2023-04-21 03:30:18,227][39m Trial 5895 finished with value: 0.8666666666666666 and parameters: {'objective': 'CrossEntropy', 'colsample_bylevel': 0.06850306066329802, 'depth': 12, 'boosting_type': 'Plain', 'bootstrap_type': 'Bayesian', 'bagging_temperature': 8.373992596414228}. Best is trial 3065 with value: 0.8863636363636364.
[32m[I 2023-04-21 03:30:19,764][39m Trial 5896 finished with value: 0.8409090909090909 and parameters: {'objective': 'Logloss', 'colsample_bylevel': 0.07471702159644254, 'depth': 10, 'boosting_type': 'Plain', 'bootstrap_type': 'Bayesian', 'bagging_temperature': 7.559574591895238}. Best is trial 3065 with value: 0.8863636363636364.
[32m[I 2023-04-21 03:30:21,138][39m Trial 5897 finished with value: 0.8139534883720929 and parameters: {'objective': 'CrossEntropy', 'colsample_bylevel': 0.07312061482892154, 'depth': 9, 'boosting_type': 'Plain', 'bootstrap_type': 'Bayesian', 'bagging_temperature': 9.356514921268301}. Best is trial 3065 with value: 0.8863636363636364.
[32m[I 2023-04-21 03:30:22,037][39m Trial 5898 finished with value: 0.8181818181818182 and parameters: {'objective': 'CrossEntropy', 'colsample_bylevel': 0.07931366160893827, 'depth': 3, 'boosting_type': 'Plain', 'bootstrap_type': 'Bayesian', 'bagging_temperature': 1.7518504970335274}. Best is trial 3065 with value: 0.8863636363636364.
[32m[I 2023-04-21 03:30:26,305][39m Trial 5899 finished with value: 0.8539325842696629 and parameters: {'objective': 'CrossEntropy', 'colsample_bylevel': 0.0709686422057672, 'depth': 12, 'boosting_type': 'Ordered', 'bootstrap_type': 'Bayesian', 'bagging_temperature': 9.956182088827243}. Best is trial 3065 with value: 0.8863636363636364.
[32m[I 2023-04-21 03:30:27,520][39m Trial 5900 finished with value: 0.8666666666666666 and parameters: {'objective': 'CrossEntropy', 'colsample_bylevel': 0.08641983328081373, 'depth': 3, 'boosting_type': 'Plain', 'bootstrap_type': 'Bayesian', 'bagging_temperature': 9.63406465450631}. Best is trial 3065 with value: 0.8863636363636364.
[32m[I 2023-04-21 03:30:28,913][39m Trial 5901 finished with value: 0.8409090909090909 and parameters: {'objective': 'CrossEntropy', 'colsample_bylevel': 0.08283244804154252, 'depth': 3, 'boosting_type': 'Plain', 'bootstrap_type': 'Bayesian', 'bagging_temperature': 8.837033914757686}. Best is trial 3065 with value: 0.8863636363636364.
[32m[I 2023-04-21 03:30:30,282][39m Trial 5902 finished with value: 0.7857142857142858 and parameters: {'objective': 'Logloss', 'colsample_bylevel': 0.07029596471474782, 'depth': 1, 'boosting_type': 'Plain', 'bootstrap_type': 'Bayesian', 'bagging_temperature': 7.0844558804347475}. Best is trial 3065 with value: 0.8863636363636364.
[32m[I 2023-04-21 03:30:30,996][39m Trial 5903 finished with value: 0.8539325842696629 and parameters: {'objective': 'CrossEntropy', 'colsample_bylevel': 0.08169212100300738, 'depth': 3, 'boosting_type': 'Plain', 'bootstrap_type': 'Bayesian', 'bagging_temperature': 9.082646111243037}. Best is trial 3065 with value: 0.8863636363636364.
[32m[I 2023-04-21 03:30:32,395][39m Trial 5904 finished with value: 0.8666666666666666 and parameters: {'objective': 'CrossEntropy', 'colsample_bylevel': 0.08229411627095785, 'depth': 3, 'boosting_type': 'Plain', 'bootstrap_type': 'Bayesian', 'bagging_temperature': 8.814933069186202}. Best is trial 3065 with value: 0.8863636363636364.
[32m[I 2023-04-21 03:30:33,762][39m Trial 5905 finished with value: 0.8314606741573034 and parameters: {'objective': 'CrossEntropy', 'colsample_bylevel': 0.06271811214363936, 'depth': 9, 'boosting_type': 'Plain', 'bootstrap_type': 'MVS'}. Best is trial 3065 with value: 0.8863636363636364.
[32m[I 2023-04-21 03:30:35,369][39m Trial 5906 finished with value: 0.8666666666666666 and parameters: {'objective': 'CrossEntropy', 'colsample_bylevel': 0.07959516918912078, 'depth': 4, 'boosting_type': 'Plain', 'bootstrap_type': 'Bayesian', 'bagging_temperature': 8.51297357668124}. Best is trial 3065 with value: 0.8863636363636364.
[32m[I 2023-04-21 03:30:36,140][39m Trial 5907 finished with value: 0.8539325842696629 and parameters: {'objective': 'CrossEntropy', 'colsample_bylevel': 0.06509927043028288, 'depth': 9, 'boosting_type': 'Plain', 'bootstrap_type': 'Bernoulli', 'subsample': 0.33387626570745144}. Best is trial 3065 with value: 0.8863636363636364.
[32m[I 2023-04-21 03:30:36,834][39m Trial 5908 finished with value: 0.8666666666666666 and parameters: {'objective': 'CrossEntropy', 'colsample_bylevel': 0.08302919024171483, 'depth': 3, 'boosting_type': 'Plain', 'bootstrap_type': 'Bayesian', 'bagging_temperature': 8.843474958396152}. Best is trial 3065 with value: 0.8863636363636364.
[32m[I 2023-04-21 03:30:37,728][39m Trial 5909 finished with value: 0.8539325842696629 and parameters: {'objective': 'Logloss', 'colsample_bylevel': 0.07312138169584698, 'depth': 8, 'boosting_type': 'Plain', 'bootstrap_type': 'Bayesian', 'bagging_temperature': 9.999260409723739}. Best is trial 3065 with value: 0.8863636363636364.
[32m[I 2023-04-21 03:30:38,598][39m Trial 5910 finished with value: 0.8139534883720929 and parameters: {'objective': 'Logloss', 'colsample_bylevel': 0.08607405457249999, 'depth': 5, 'boosting_type': 'Plain', 'bootstrap_type': 'Bayesian', 'bagging_temperature': 9.089291162961034}. Best is trial 3065 with value: 0.8863636363636364.
[32m[I 2023-04-21 03:30:39,691][39m Trial 5911 finished with value: 0.8409090909090909 and parameters: {'objective': 'CrossEntropy', 'colsample_bylevel': 0.06888459258568118, 'depth': 12, 'boosting_type': 'Plain', 'bootstrap_type': 'Bayesian', 'bagging_temperature': 9.835309690751478}. Best is trial 3065 with value: 0.8863636363636364.
[32m[I 2023-04-21 03:30:41,253][39m Trial 5912 finished with value: 0.8275862068965518 and parameters: {'objective': 'CrossEntropy', 'colsample_bylevel': 0.06723523569331664, 'depth': 9, 'boosting_type': 'Plain', 'bootstrap_type': 'Bayesian', 'bagging_temperature': 6.047514991994724}. Best is trial 3065 with value: 0.8863636363636364.
[32m[I 2023-04-21 03:30:42,311][39m Trial 5913 finished with value: 0.8539325842696629 and parameters: {'objective': 'Logloss', 'colsample_bylevel': 0.07051661925760715, 'depth': 12, 'boosting_type': 'Plain', 'bootstrap_type': 'Bayesian', 'bagging_temperature': 8.190448959296763}. Best is trial 3065 with value: 0.8863636363636364.
[32m[I 2023-04-21 03:30:43,518][39m Trial 5914 finished with value: 0.8539325842696629 and parameters: {'objective': 'CrossEntropy', 'colsample_bylevel': 0.07938073731495086, 'depth': 2, 'boosting_type': 'Plain', 'bootstrap_type': 'Bayesian', 'bagging_temperature': 8.209132751009973}. Best is trial 3065 with value: 0.8863636363636364.
[32m[I 2023-04-21 03:30:44,246][39m Trial 5915 finished with value: 0.8275862068965518 and parameters: {'objective': 'CrossEntropy', 'colsample_bylevel': 0.0854078779381135, 'depth': 3, 'boosting_type': 'Plain', 'bootstrap_type': 'Bayesian', 'bagging_temperature': 8.684044203369588}. Best is trial 3065 with value: 0.8863636363636364.
