[32m[I 2023-04-21 01:40:37,474][39m Trial 265 finished with value: 0.8372093023255814 and parameters: {'objective': 'CrossEntropy', 'colsample_bylevel': 0.08547335501369083, 'depth': 1, 'boosting_type': 'Plain', 'bootstrap_type': 'Bayesian', 'bagging_temperature': 9.464971418983223}. Best is trial 98 with value: 0.8791208791208791.
[32m[I 2023-04-21 01:40:38,160][39m Trial 266 finished with value: 0.8372093023255814 and parameters: {'objective': 'CrossEntropy', 'colsample_bylevel': 0.07361165485679003, 'depth': 2, 'boosting_type': 'Plain', 'bootstrap_type': 'Bayesian', 'bagging_temperature': 7.813534076659798}. Best is trial 98 with value: 0.8791208791208791.
[32m[I 2023-04-21 01:40:39,289][39m Trial 267 finished with value: 0.8409090909090909 and parameters: {'objective': 'CrossEntropy', 'colsample_bylevel': 0.08707268876310084, 'depth': 3, 'boosting_type': 'Plain', 'bootstrap_type': 'Bayesian', 'bagging_temperature': 9.369612969236842}. Best is trial 98 with value: 0.8791208791208791.
[32m[I 2023-04-21 01:40:39,979][39m Trial 268 finished with value: 0.8539325842696629 and parameters: {'objective': 'CrossEntropy', 'colsample_bylevel': 0.07732542576676317, 'depth': 2, 'boosting_type': 'Plain', 'bootstrap_type': 'Bayesian', 'bagging_temperature': 9.787213800255264}. Best is trial 98 with value: 0.8791208791208791.
[32m[I 2023-04-21 01:40:40,726][39m Trial 269 finished with value: 0.8409090909090909 and parameters: {'objective': 'CrossEntropy', 'colsample_bylevel': 0.0805612004351556, 'depth': 2, 'boosting_type': 'Plain', 'bootstrap_type': 'MVS'}. Best is trial 98 with value: 0.8791208791208791.
[32m[I 2023-04-21 01:40:41,779][39m Trial 270 finished with value: 0.8275862068965518 and parameters: {'objective': 'CrossEntropy', 'colsample_bylevel': 0.08098650561642287, 'depth': 2, 'boosting_type': 'Plain', 'bootstrap_type': 'Bernoulli', 'subsample': 0.7593408588244998}. Best is trial 98 with value: 0.8791208791208791.
[32m[I 2023-04-21 01:40:42,524][39m Trial 271 finished with value: 0.8764044943820225 and parameters: {'objective': 'CrossEntropy', 'colsample_bylevel': 0.08954906069614992, 'depth': 3, 'boosting_type': 'Plain', 'bootstrap_type': 'Bayesian', 'bagging_temperature': 9.548040142250263}. Best is trial 98 with value: 0.8791208791208791.
[32m[I 2023-04-21 01:40:43,540][39m Trial 272 finished with value: 0.8409090909090909 and parameters: {'objective': 'CrossEntropy', 'colsample_bylevel': 0.0827314908431498, 'depth': 2, 'boosting_type': 'Plain', 'bootstrap_type': 'Bayesian', 'bagging_temperature': 9.547496342440768}. Best is trial 98 with value: 0.8791208791208791.
[32m[I 2023-04-21 01:40:44,241][39m Trial 273 finished with value: 0.8505747126436782 and parameters: {'objective': 'CrossEntropy', 'colsample_bylevel': 0.08920394225704631, 'depth': 7, 'boosting_type': 'Plain', 'bootstrap_type': 'Bayesian', 'bagging_temperature': 8.21013664609878}. Best is trial 98 with value: 0.8791208791208791.
[32m[I 2023-04-21 01:40:45,083][39m Trial 274 finished with value: 0.8275862068965518 and parameters: {'objective': 'CrossEntropy', 'colsample_bylevel': 0.08551153150997379, 'depth': 3, 'boosting_type': 'Plain', 'bootstrap_type': 'Bayesian', 'bagging_temperature': 9.125158207857478}. Best is trial 98 with value: 0.8791208791208791.
[32m[I 2023-04-21 01:40:46,031][39m Trial 275 finished with value: 0.8372093023255814 and parameters: {'objective': 'Logloss', 'colsample_bylevel': 0.0897123088532867, 'depth': 1, 'boosting_type': 'Plain', 'bootstrap_type': 'Bayesian', 'bagging_temperature': 9.416215843578113}. Best is trial 98 with value: 0.8791208791208791.
[32m[I 2023-04-21 01:40:46,672][39m Trial 276 finished with value: 0.8539325842696629 and parameters: {'objective': 'CrossEntropy', 'colsample_bylevel': 0.07115134801280038, 'depth': 2, 'boosting_type': 'Plain', 'bootstrap_type': 'Bayesian', 'bagging_temperature': 9.735927131230868}. Best is trial 98 with value: 0.8791208791208791.
[32m[I 2023-04-21 01:40:47,738][39m Trial 277 finished with value: 0.8666666666666666 and parameters: {'objective': 'CrossEntropy', 'colsample_bylevel': 0.08265765141850498, 'depth': 2, 'boosting_type': 'Plain', 'bootstrap_type': 'Bayesian', 'bagging_temperature': 9.999828588652381}. Best is trial 98 with value: 0.8791208791208791.
[32m[I 2023-04-21 01:40:48,466][39m Trial 278 finished with value: 0.8409090909090909 and parameters: {'objective': 'CrossEntropy', 'colsample_bylevel': 0.08376596527656356, 'depth': 5, 'boosting_type': 'Plain', 'bootstrap_type': 'Bayesian', 'bagging_temperature': 9.60813607080518}. Best is trial 98 with value: 0.8791208791208791.
[32m[I 2023-04-21 01:40:49,584][39m Trial 279 finished with value: 0.8636363636363636 and parameters: {'objective': 'CrossEntropy', 'colsample_bylevel': 0.08159576730176922, 'depth': 2, 'boosting_type': 'Plain', 'bootstrap_type': 'Bayesian', 'bagging_temperature': 9.997123102440414}. Best is trial 98 with value: 0.8791208791208791.
[32m[I 2023-04-21 01:40:50,286][39m Trial 280 finished with value: 0.8505747126436782 and parameters: {'objective': 'CrossEntropy', 'colsample_bylevel': 0.09574245117067322, 'depth': 2, 'boosting_type': 'Plain', 'bootstrap_type': 'Bayesian', 'bagging_temperature': 9.678239377019759}. Best is trial 98 with value: 0.8791208791208791.
[32m[I 2023-04-21 01:40:51,141][39m Trial 281 finished with value: 0.8539325842696629 and parameters: {'objective': 'CrossEntropy', 'colsample_bylevel': 0.0749510125827338, 'depth': 2, 'boosting_type': 'Plain', 'bootstrap_type': 'Bayesian', 'bagging_temperature': 9.745416257853456}. Best is trial 98 with value: 0.8791208791208791.
[32m[I 2023-04-21 01:40:51,901][39m Trial 282 finished with value: 0.8666666666666666 and parameters: {'objective': 'CrossEntropy', 'colsample_bylevel': 0.08001853892531205, 'depth': 2, 'boosting_type': 'Plain', 'bootstrap_type': 'Bayesian', 'bagging_temperature': 9.306468610102316}. Best is trial 98 with value: 0.8791208791208791.
[32m[I 2023-04-21 01:40:52,625][39m Trial 283 finished with value: 0.8666666666666666 and parameters: {'objective': 'CrossEntropy', 'colsample_bylevel': 0.0846004943554031, 'depth': 3, 'boosting_type': 'Plain', 'bootstrap_type': 'Bayesian', 'bagging_temperature': 9.145525496242264}. Best is trial 98 with value: 0.8791208791208791.
[32m[I 2023-04-21 01:40:53,754][39m Trial 284 finished with value: 0.8372093023255814 and parameters: {'objective': 'CrossEntropy', 'colsample_bylevel': 0.08004213936286267, 'depth': 1, 'boosting_type': 'Plain', 'bootstrap_type': 'Bayesian', 'bagging_temperature': 9.234312385326598}. Best is trial 98 with value: 0.8791208791208791.
[32m[I 2023-04-21 01:40:54,322][39m Trial 285 finished with value: 0.7415730337078651 and parameters: {'objective': 'CrossEntropy', 'colsample_bylevel': 0.01842819717248554, 'depth': 2, 'boosting_type': 'Plain', 'bootstrap_type': 'Bayesian', 'bagging_temperature': 8.977511477644398}. Best is trial 98 with value: 0.8791208791208791.
[32m[I 2023-04-21 01:40:55,108][39m Trial 286 finished with value: 0.8539325842696629 and parameters: {'objective': 'CrossEntropy', 'colsample_bylevel': 0.08679924689512923, 'depth': 3, 'boosting_type': 'Plain', 'bootstrap_type': 'Bayesian', 'bagging_temperature': 8.679372034163404}. Best is trial 98 with value: 0.8791208791208791.
[32m[I 2023-04-21 01:40:55,881][39m Trial 287 finished with value: 0.8764044943820225 and parameters: {'objective': 'CrossEntropy', 'colsample_bylevel': 0.07910752348710899, 'depth': 2, 'boosting_type': 'Plain', 'bootstrap_type': 'Bayesian', 'bagging_temperature': 9.801538234252376}. Best is trial 98 with value: 0.8791208791208791.
[32m[I 2023-04-21 01:40:56,568][39m Trial 288 finished with value: 0.8539325842696629 and parameters: {'objective': 'CrossEntropy', 'colsample_bylevel': 0.08105419759911138, 'depth': 3, 'boosting_type': 'Plain', 'bootstrap_type': 'Bayesian', 'bagging_temperature': 7.555910627057697}. Best is trial 98 with value: 0.8791208791208791.
[32m[I 2023-04-21 01:40:57,467][39m Trial 289 finished with value: 0.8409090909090909 and parameters: {'objective': 'CrossEntropy', 'colsample_bylevel': 0.07723254523710157, 'depth': 2, 'boosting_type': 'Plain', 'bootstrap_type': 'Bayesian', 'bagging_temperature': 9.82039970311162}. Best is trial 98 with value: 0.8791208791208791.
[32m[I 2023-04-21 01:40:58,158][39m Trial 290 finished with value: 0.8235294117647058 and parameters: {'objective': 'CrossEntropy', 'colsample_bylevel': 0.07564407541052169, 'depth': 1, 'boosting_type': 'Plain', 'bootstrap_type': 'Bayesian', 'bagging_temperature': 9.581494925260166}. Best is trial 98 with value: 0.8791208791208791.
[32m[I 2023-04-21 01:40:58,897][39m Trial 291 finished with value: 0.7999999999999999 and parameters: {'objective': 'CrossEntropy', 'colsample_bylevel': 0.09158839255433937, 'depth': 4, 'boosting_type': 'Plain', 'bootstrap_type': 'Bernoulli', 'subsample': 0.990690079699762}. Best is trial 98 with value: 0.8791208791208791.
[32m[I 2023-04-21 01:40:59,831][39m Trial 292 finished with value: 0.8539325842696629 and parameters: {'objective': 'CrossEntropy', 'colsample_bylevel': 0.08458663677490046, 'depth': 2, 'boosting_type': 'Plain', 'bootstrap_type': 'Bayesian', 'bagging_temperature': 4.229750512857466}. Best is trial 98 with value: 0.8791208791208791.
[32m[I 2023-04-21 01:41:00,472][39m Trial 293 finished with value: 0.8505747126436782 and parameters: {'objective': 'Logloss', 'colsample_bylevel': 0.0672236883538244, 'depth': 2, 'boosting_type': 'Plain', 'bootstrap_type': 'Bayesian', 'bagging_temperature': 9.235646675944212}. Best is trial 98 with value: 0.8791208791208791.
[32m[I 2023-04-21 01:41:01,329][39m Trial 294 finished with value: 0.8409090909090909 and parameters: {'objective': 'CrossEntropy', 'colsample_bylevel': 0.0583977991826848, 'depth': 2, 'boosting_type': 'Plain', 'bootstrap_type': 'Bayesian', 'bagging_temperature': 9.445543625513151}. Best is trial 98 with value: 0.8791208791208791.
[32m[I 2023-04-21 01:41:02,170][39m Trial 295 finished with value: 0.8409090909090909 and parameters: {'objective': 'CrossEntropy', 'colsample_bylevel': 0.0825754510864882, 'depth': 2, 'boosting_type': 'Plain', 'bootstrap_type': 'MVS'}. Best is trial 98 with value: 0.8791208791208791.
[32m[I 2023-04-21 01:41:03,043][39m Trial 296 finished with value: 0.8666666666666666 and parameters: {'objective': 'CrossEntropy', 'colsample_bylevel': 0.09434627047560104, 'depth': 3, 'boosting_type': 'Plain', 'bootstrap_type': 'Bayesian', 'bagging_temperature': 9.519476122402203}. Best is trial 98 with value: 0.8791208791208791.
[32m[I 2023-04-21 01:41:03,845][39m Trial 297 finished with value: 0.8409090909090909 and parameters: {'objective': 'CrossEntropy', 'colsample_bylevel': 0.08374356602253077, 'depth': 2, 'boosting_type': 'Plain', 'bootstrap_type': 'Bayesian', 'bagging_temperature': 9.793005586146313}. Best is trial 98 with value: 0.8791208791208791.
[32m[I 2023-04-21 01:41:04,470][39m Trial 298 finished with value: 0.8666666666666666 and parameters: {'objective': 'CrossEntropy', 'colsample_bylevel': 0.07811398470475951, 'depth': 2, 'boosting_type': 'Plain', 'bootstrap_type': 'Bayesian', 'bagging_temperature': 9.831904401714494}. Best is trial 98 with value: 0.8791208791208791.
[32m[I 2023-04-21 01:41:05,113][39m Trial 299 finished with value: 0.8666666666666666 and parameters: {'objective': 'CrossEntropy', 'colsample_bylevel': 0.0783287199123868, 'depth': 2, 'boosting_type': 'Plain', 'bootstrap_type': 'Bayesian', 'bagging_temperature': 9.969492228283853}. Best is trial 98 with value: 0.8791208791208791.
[32m[I 2023-04-21 01:41:05,868][39m Trial 300 finished with value: 0.8235294117647058 and parameters: {'objective': 'CrossEntropy', 'colsample_bylevel': 0.08151169305297347, 'depth': 1, 'boosting_type': 'Plain', 'bootstrap_type': 'Bayesian', 'bagging_temperature': 7.2483588656413875}. Best is trial 98 with value: 0.8791208791208791.
[32m[I 2023-04-21 01:41:06,727][39m Trial 301 finished with value: 0.8409090909090909 and parameters: {'objective': 'CrossEntropy', 'colsample_bylevel': 0.07933097698209865, 'depth': 6, 'boosting_type': 'Plain', 'bootstrap_type': 'Bayesian', 'bagging_temperature': 9.541436673950837}. Best is trial 98 with value: 0.8791208791208791.
[32m[I 2023-04-21 01:41:07,543][39m Trial 302 finished with value: 0.8539325842696629 and parameters: {'objective': 'CrossEntropy', 'colsample_bylevel': 0.08729178016352632, 'depth': 2, 'boosting_type': 'Plain', 'bootstrap_type': 'Bayesian', 'bagging_temperature': 8.833584395595702}. Best is trial 98 with value: 0.8791208791208791.
[32m[I 2023-04-21 01:41:08,410][39m Trial 303 finished with value: 0.8764044943820225 and parameters: {'objective': 'CrossEntropy', 'colsample_bylevel': 0.08562782040295386, 'depth': 2, 'boosting_type': 'Plain', 'bootstrap_type': 'Bayesian', 'bagging_temperature': 9.722719413398478}. Best is trial 98 with value: 0.8791208791208791.
[32m[I 2023-04-21 01:41:09,354][39m Trial 304 finished with value: 0.8409090909090909 and parameters: {'objective': 'CrossEntropy', 'colsample_bylevel': 0.0852599789998762, 'depth': 2, 'boosting_type': 'Plain', 'bootstrap_type': 'Bayesian', 'bagging_temperature': 2.3829246346243433}. Best is trial 98 with value: 0.8791208791208791.
[32m[I 2023-04-21 01:41:10,300][39m Trial 305 finished with value: 0.8409090909090909 and parameters: {'objective': 'CrossEntropy', 'colsample_bylevel': 0.07610255546237653, 'depth': 2, 'boosting_type': 'Plain', 'bootstrap_type': 'Bayesian', 'bagging_temperature': 9.716656973978333}. Best is trial 98 with value: 0.8791208791208791.
[32m[I 2023-04-21 01:41:10,881][39m Trial 306 finished with value: 0.8539325842696629 and parameters: {'objective': 'CrossEntropy', 'colsample_bylevel': 0.0844096395216493, 'depth': 2, 'boosting_type': 'Plain', 'bootstrap_type': 'Bayesian', 'bagging_temperature': 6.390055194679999}. Best is trial 98 with value: 0.8791208791208791.
[32m[I 2023-04-21 01:41:11,510][39m Trial 307 finished with value: 0.8666666666666666 and parameters: {'objective': 'CrossEntropy', 'colsample_bylevel': 0.08904213776046253, 'depth': 3, 'boosting_type': 'Plain', 'bootstrap_type': 'Bayesian', 'bagging_temperature': 9.349786757192412}. Best is trial 98 with value: 0.8791208791208791.
[32m[I 2023-04-21 01:41:12,305][39m Trial 308 finished with value: 0.8372093023255814 and parameters: {'objective': 'CrossEntropy', 'colsample_bylevel': 0.08616947268658749, 'depth': 1, 'boosting_type': 'Plain', 'bootstrap_type': 'Bayesian', 'bagging_temperature': 9.64004734044661}. Best is trial 98 with value: 0.8791208791208791.
[32m[I 2023-04-21 01:41:13,033][39m Trial 309 finished with value: 0.8666666666666666 and parameters: {'objective': 'CrossEntropy', 'colsample_bylevel': 0.08245137480408596, 'depth': 2, 'boosting_type': 'Plain', 'bootstrap_type': 'Bayesian', 'bagging_temperature': 9.998428470189912}. Best is trial 98 with value: 0.8791208791208791.
[32m[I 2023-04-21 01:41:14,109][39m Trial 310 finished with value: 0.8636363636363636 and parameters: {'objective': 'CrossEntropy', 'colsample_bylevel': 0.0891303047749371, 'depth': 2, 'boosting_type': 'Plain', 'bootstrap_type': 'Bayesian', 'bagging_temperature': 9.497989439337482}. Best is trial 98 with value: 0.8791208791208791.
[32m[I 2023-04-21 01:41:15,107][39m Trial 311 finished with value: 0.8539325842696629 and parameters: {'objective': 'CrossEntropy', 'colsample_bylevel': 0.08683285529031276, 'depth': 2, 'boosting_type': 'Plain', 'bootstrap_type': 'Bayesian', 'bagging_temperature': 9.393784976527233}. Best is trial 98 with value: 0.8791208791208791.
[32m[I 2023-04-21 01:41:16,458][39m Trial 312 finished with value: 0.8764044943820225 and parameters: {'objective': 'Logloss', 'colsample_bylevel': 0.07723111760613414, 'depth': 2, 'boosting_type': 'Plain', 'bootstrap_type': 'Bayesian', 'bagging_temperature': 9.788448141120854}. Best is trial 98 with value: 0.8791208791208791.
[32m[I 2023-04-21 01:41:17,036][39m Trial 313 finished with value: 0.8131868131868132 and parameters: {'objective': 'Logloss', 'colsample_bylevel': 0.07631529274452117, 'depth': 2, 'boosting_type': 'Plain', 'bootstrap_type': 'Bernoulli', 'subsample': 0.8662595117801388}. Best is trial 98 with value: 0.8791208791208791.
[32m[I 2023-04-21 01:41:17,655][39m Trial 314 finished with value: 0.8275862068965518 and parameters: {'objective': 'Logloss', 'colsample_bylevel': 0.08006602912099473, 'depth': 2, 'boosting_type': 'Plain', 'bootstrap_type': 'Bayesian', 'bagging_temperature': 4.614268773472505}. Best is trial 98 with value: 0.8791208791208791.
[32m[I 2023-04-21 01:41:18,227][39m Trial 315 finished with value: 0.8539325842696629 and parameters: {'objective': 'Logloss', 'colsample_bylevel': 0.08479508445252588, 'depth': 3, 'boosting_type': 'Plain', 'bootstrap_type': 'Bayesian', 'bagging_temperature': 9.755257789432527}. Best is trial 98 with value: 0.8791208791208791.
[32m[I 2023-04-21 01:41:19,215][39m Trial 316 finished with value: 0.8089887640449439 and parameters: {'objective': 'Logloss', 'colsample_bylevel': 0.08168869229964033, 'depth': 2, 'boosting_type': 'Plain', 'bootstrap_type': 'MVS'}. Best is trial 98 with value: 0.8791208791208791.
[32m[I 2023-04-21 01:41:19,857][39m Trial 317 finished with value: 0.8764044943820225 and parameters: {'objective': 'Logloss', 'colsample_bylevel': 0.08313816733773392, 'depth': 2, 'boosting_type': 'Plain', 'bootstrap_type': 'Bayesian', 'bagging_temperature': 9.805605638190494}. Best is trial 98 with value: 0.8791208791208791.
[32m[I 2023-04-21 01:41:20,725][39m Trial 318 finished with value: 0.8372093023255814 and parameters: {'objective': 'Logloss', 'colsample_bylevel': 0.09084092397709082, 'depth': 1, 'boosting_type': 'Plain', 'bootstrap_type': 'Bayesian', 'bagging_temperature': 9.670002419357779}. Best is trial 98 with value: 0.8791208791208791.
[32m[I 2023-04-21 01:41:21,750][39m Trial 319 finished with value: 0.8539325842696629 and parameters: {'objective': 'Logloss', 'colsample_bylevel': 0.0834277081727177, 'depth': 2, 'boosting_type': 'Plain', 'bootstrap_type': 'Bayesian', 'bagging_temperature': 9.802742117945494}. Best is trial 98 with value: 0.8791208791208791.
[32m[I 2023-04-21 01:41:22,565][39m Trial 320 finished with value: 0.8539325842696629 and parameters: {'objective': 'Logloss', 'colsample_bylevel': 0.08153021829130665, 'depth': 2, 'boosting_type': 'Plain', 'bootstrap_type': 'Bayesian', 'bagging_temperature': 9.49114967326293}. Best is trial 98 with value: 0.8791208791208791.
[32m[I 2023-04-21 01:41:23,458][39m Trial 321 finished with value: 0.8539325842696629 and parameters: {'objective': 'Logloss', 'colsample_bylevel': 0.07937385918277386, 'depth': 2, 'boosting_type': 'Plain', 'bootstrap_type': 'Bayesian', 'bagging_temperature': 9.79210271799556}. Best is trial 98 with value: 0.8791208791208791.
[32m[I 2023-04-21 01:41:24,184][39m Trial 322 finished with value: 0.7857142857142858 and parameters: {'objective': 'Logloss', 'colsample_bylevel': 0.07252736975116587, 'depth': 1, 'boosting_type': 'Plain', 'bootstrap_type': 'Bayesian', 'bagging_temperature': 6.840750778154283}. Best is trial 98 with value: 0.8791208791208791.
[32m[I 2023-04-21 01:41:24,829][39m Trial 323 finished with value: 0.8539325842696629 and parameters: {'objective': 'Logloss', 'colsample_bylevel': 0.08279096444923595, 'depth': 2, 'boosting_type': 'Plain', 'bootstrap_type': 'Bayesian', 'bagging_temperature': 9.612505947518216}. Best is trial 98 with value: 0.8791208791208791.
[32m[I 2023-04-21 01:41:25,375][39m Trial 324 finished with value: 0.8409090909090909 and parameters: {'objective': 'Logloss', 'colsample_bylevel': 0.07942231914216265, 'depth': 2, 'boosting_type': 'Plain', 'bootstrap_type': 'Bayesian', 'bagging_temperature': 9.990571314918945}. Best is trial 98 with value: 0.8791208791208791.
[32m[I 2023-04-21 01:41:26,312][39m Trial 325 finished with value: 0.8636363636363636 and parameters: {'objective': 'Logloss', 'colsample_bylevel': 0.08804637319825225, 'depth': 2, 'boosting_type': 'Plain', 'bootstrap_type': 'Bayesian', 'bagging_temperature': 9.019702564183989}. Best is trial 98 with value: 0.8791208791208791.
[32m[I 2023-04-21 01:41:27,020][39m Trial 326 finished with value: 0.8636363636363636 and parameters: {'objective': 'Logloss', 'colsample_bylevel': 0.08025069040530823, 'depth': 2, 'boosting_type': 'Plain', 'bootstrap_type': 'Bayesian', 'bagging_temperature': 9.817957917888462}. Best is trial 98 with value: 0.8791208791208791.
[32m[I 2023-04-21 01:41:27,905][39m Trial 327 finished with value: 0.8539325842696629 and parameters: {'objective': 'CrossEntropy', 'colsample_bylevel': 0.08593474041545583, 'depth': 2, 'boosting_type': 'Plain', 'bootstrap_type': 'Bayesian', 'bagging_temperature': 9.483765822357169}. Best is trial 98 with value: 0.8791208791208791.
[32m[I 2023-04-21 01:41:28,916][39m Trial 328 finished with value: 0.8539325842696629 and parameters: {'objective': 'CrossEntropy', 'colsample_bylevel': 0.07736455303750298, 'depth': 2, 'boosting_type': 'Plain', 'bootstrap_type': 'Bayesian', 'bagging_temperature': 9.352494374408664}. Best is trial 98 with value: 0.8791208791208791.
[32m[I 2023-04-21 01:41:29,996][39m Trial 329 finished with value: 0.8539325842696629 and parameters: {'objective': 'CrossEntropy', 'colsample_bylevel': 0.08231924360418783, 'depth': 2, 'boosting_type': 'Plain', 'bootstrap_type': 'Bayesian', 'bagging_temperature': 9.83568391441634}. Best is trial 98 with value: 0.8791208791208791.
[32m[I 2023-04-21 01:41:31,005][39m Trial 330 finished with value: 0.8539325842696629 and parameters: {'objective': 'CrossEntropy', 'colsample_bylevel': 0.08357678727790918, 'depth': 2, 'boosting_type': 'Plain', 'bootstrap_type': 'Bayesian', 'bagging_temperature': 9.643217543839262}. Best is trial 98 with value: 0.8791208791208791.
