[32m[I 2023-04-21 02:02:51,503][39m Trial 1521 finished with value: 0.8275862068965518 and parameters: {'objective': 'CrossEntropy', 'colsample_bylevel': 0.0814928378752299, 'depth': 3, 'boosting_type': 'Ordered', 'bootstrap_type': 'Bayesian', 'bagging_temperature': 7.33111474064699}. Best is trial 98 with value: 0.8791208791208791.
[32m[I 2023-04-21 02:02:52,751][39m Trial 1522 finished with value: 0.8409090909090909 and parameters: {'objective': 'CrossEntropy', 'colsample_bylevel': 0.09325368694422205, 'depth': 4, 'boosting_type': 'Plain', 'bootstrap_type': 'Bayesian', 'bagging_temperature': 9.8193631731608}. Best is trial 98 with value: 0.8791208791208791.
[32m[I 2023-04-21 02:02:53,450][39m Trial 1523 finished with value: 0.8666666666666666 and parameters: {'objective': 'CrossEntropy', 'colsample_bylevel': 0.0867739966217762, 'depth': 3, 'boosting_type': 'Plain', 'bootstrap_type': 'Bernoulli', 'subsample': 0.31944125898530784}. Best is trial 98 with value: 0.8791208791208791.
[32m[I 2023-04-21 02:02:54,313][39m Trial 1524 finished with value: 0.8139534883720929 and parameters: {'objective': 'CrossEntropy', 'colsample_bylevel': 0.07879642178403445, 'depth': 9, 'boosting_type': 'Plain', 'bootstrap_type': 'Bayesian', 'bagging_temperature': 9.800542487794662}. Best is trial 98 with value: 0.8791208791208791.
[32m[I 2023-04-21 02:02:55,134][39m Trial 1525 finished with value: 0.8409090909090909 and parameters: {'objective': 'CrossEntropy', 'colsample_bylevel': 0.08729360862454005, 'depth': 3, 'boosting_type': 'Plain', 'bootstrap_type': 'Bayesian', 'bagging_temperature': 9.14145331605412}. Best is trial 98 with value: 0.8791208791208791.
[32m[I 2023-04-21 02:02:55,965][39m Trial 1526 finished with value: 0.8666666666666666 and parameters: {'objective': 'Logloss', 'colsample_bylevel': 0.08787909164389864, 'depth': 3, 'boosting_type': 'Plain', 'bootstrap_type': 'Bayesian', 'bagging_temperature': 8.878123751500587}. Best is trial 98 with value: 0.8791208791208791.
[32m[I 2023-04-21 02:02:57,092][39m Trial 1527 finished with value: 0.8666666666666666 and parameters: {'objective': 'CrossEntropy', 'colsample_bylevel': 0.09205680263740275, 'depth': 3, 'boosting_type': 'Plain', 'bootstrap_type': 'Bayesian', 'bagging_temperature': 8.801256689585927}. Best is trial 98 with value: 0.8791208791208791.
[32m[I 2023-04-21 02:02:57,970][39m Trial 1528 finished with value: 0.8089887640449439 and parameters: {'objective': 'CrossEntropy', 'colsample_bylevel': 0.03228563224006269, 'depth': 10, 'boosting_type': 'Plain', 'bootstrap_type': 'MVS'}. Best is trial 98 with value: 0.8791208791208791.
[32m[I 2023-04-21 02:02:59,065][39m Trial 1529 finished with value: 0.8409090909090909 and parameters: {'objective': 'CrossEntropy', 'colsample_bylevel': 0.0752931633890413, 'depth': 9, 'boosting_type': 'Plain', 'bootstrap_type': 'Bayesian', 'bagging_temperature': 9.236985274792172}. Best is trial 98 with value: 0.8791208791208791.
[32m[I 2023-04-21 02:02:59,697][39m Trial 1530 finished with value: 0.8539325842696629 and parameters: {'objective': 'CrossEntropy', 'colsample_bylevel': 0.08821883091162452, 'depth': 3, 'boosting_type': 'Plain', 'bootstrap_type': 'Bayesian', 'bagging_temperature': 8.958949533225335}. Best is trial 98 with value: 0.8791208791208791.
[32m[I 2023-04-21 02:03:00,402][39m Trial 1531 finished with value: 0.8666666666666666 and parameters: {'objective': 'CrossEntropy', 'colsample_bylevel': 0.09436194513661583, 'depth': 3, 'boosting_type': 'Plain', 'bootstrap_type': 'Bayesian', 'bagging_temperature': 8.9692027164261}. Best is trial 98 with value: 0.8791208791208791.
[32m[I 2023-04-21 02:03:01,231][39m Trial 1532 finished with value: 0.8666666666666666 and parameters: {'objective': 'Logloss', 'colsample_bylevel': 0.07460594376800085, 'depth': 4, 'boosting_type': 'Plain', 'bootstrap_type': 'Bayesian', 'bagging_temperature': 9.519751867669655}. Best is trial 98 with value: 0.8791208791208791.
[32m[I 2023-04-21 02:03:02,017][39m Trial 1533 finished with value: 0.8666666666666666 and parameters: {'objective': 'CrossEntropy', 'colsample_bylevel': 0.09018126258713027, 'depth': 3, 'boosting_type': 'Plain', 'bootstrap_type': 'Bayesian', 'bagging_temperature': 8.286840490808332}. Best is trial 98 with value: 0.8791208791208791.
[32m[I 2023-04-21 02:03:03,114][39m Trial 1534 finished with value: 0.8539325842696629 and parameters: {'objective': 'CrossEntropy', 'colsample_bylevel': 0.08597124614322792, 'depth': 3, 'boosting_type': 'Plain', 'bootstrap_type': 'Bayesian', 'bagging_temperature': 8.703497060009276}. Best is trial 98 with value: 0.8791208791208791.
[32m[I 2023-04-21 02:03:04,123][39m Trial 1535 finished with value: 0.8636363636363636 and parameters: {'objective': 'CrossEntropy', 'colsample_bylevel': 0.07646851205555465, 'depth': 3, 'boosting_type': 'Plain', 'bootstrap_type': 'Bayesian', 'bagging_temperature': 9.70348203155458}. Best is trial 98 with value: 0.8791208791208791.
[32m[I 2023-04-21 02:03:05,108][39m Trial 1536 finished with value: 0.8791208791208791 and parameters: {'objective': 'CrossEntropy', 'colsample_bylevel': 0.08036766437997686, 'depth': 3, 'boosting_type': 'Plain', 'bootstrap_type': 'Bayesian', 'bagging_temperature': 9.304674413089774}. Best is trial 98 with value: 0.8791208791208791.
[32m[I 2023-04-21 02:03:05,758][39m Trial 1537 finished with value: 0.8275862068965518 and parameters: {'objective': 'CrossEntropy', 'colsample_bylevel': 0.09097177205153674, 'depth': 3, 'boosting_type': 'Plain', 'bootstrap_type': 'Bayesian', 'bagging_temperature': 9.982714567287037}. Best is trial 98 with value: 0.8791208791208791.
[32m[I 2023-04-21 02:03:06,499][39m Trial 1538 finished with value: 0.8666666666666666 and parameters: {'objective': 'CrossEntropy', 'colsample_bylevel': 0.0784779422280468, 'depth': 3, 'boosting_type': 'Plain', 'bootstrap_type': 'Bayesian', 'bagging_temperature': 9.299302164966548}. Best is trial 98 with value: 0.8791208791208791.
[32m[I 2023-04-21 02:03:11,464][39m Trial 1539 finished with value: 0.8139534883720929 and parameters: {'objective': 'CrossEntropy', 'colsample_bylevel': 0.0826422519556272, 'depth': 4, 'boosting_type': 'Ordered', 'bootstrap_type': 'Bayesian', 'bagging_temperature': 9.361965539401066}. Best is trial 98 with value: 0.8791208791208791.
[32m[I 2023-04-21 02:03:12,434][39m Trial 1540 finished with value: 0.8539325842696629 and parameters: {'objective': 'CrossEntropy', 'colsample_bylevel': 0.07849751843319915, 'depth': 3, 'boosting_type': 'Plain', 'bootstrap_type': 'MVS'}. Best is trial 98 with value: 0.8791208791208791.
[32m[I 2023-04-21 02:03:13,382][39m Trial 1541 finished with value: 0.8139534883720929 and parameters: {'objective': 'CrossEntropy', 'colsample_bylevel': 0.07151843392985877, 'depth': 8, 'boosting_type': 'Plain', 'bootstrap_type': 'Bayesian', 'bagging_temperature': 9.53813779753282}. Best is trial 98 with value: 0.8791208791208791.
[32m[I 2023-04-21 02:03:13,999][39m Trial 1542 finished with value: 0.8409090909090909 and parameters: {'objective': 'CrossEntropy', 'colsample_bylevel': 0.08768649850504331, 'depth': 4, 'boosting_type': 'Plain', 'bootstrap_type': 'Bayesian', 'bagging_temperature': 9.644608127398376}. Best is trial 98 with value: 0.8791208791208791.
[32m[I 2023-04-21 02:03:14,933][39m Trial 1543 finished with value: 0.8409090909090909 and parameters: {'objective': 'CrossEntropy', 'colsample_bylevel': 0.07782326586722273, 'depth': 10, 'boosting_type': 'Plain', 'bootstrap_type': 'Bayesian', 'bagging_temperature': 8.690584778848416}. Best is trial 98 with value: 0.8791208791208791.
[32m[I 2023-04-21 02:03:15,694][39m Trial 1544 finished with value: 0.8666666666666666 and parameters: {'objective': 'CrossEntropy', 'colsample_bylevel': 0.07739496333573413, 'depth': 10, 'boosting_type': 'Plain', 'bootstrap_type': 'Bayesian', 'bagging_temperature': 8.931749331138644}. Best is trial 98 with value: 0.8791208791208791.
[32m[I 2023-04-21 02:03:16,553][39m Trial 1545 finished with value: 0.8409090909090909 and parameters: {'objective': 'Logloss', 'colsample_bylevel': 0.0940935184726842, 'depth': 10, 'boosting_type': 'Plain', 'bootstrap_type': 'Bayesian', 'bagging_temperature': 9.789738232475232}. Best is trial 98 with value: 0.8791208791208791.
[32m[I 2023-04-21 02:03:17,674][39m Trial 1546 finished with value: 0.8409090909090909 and parameters: {'objective': 'CrossEntropy', 'colsample_bylevel': 0.08381175057717775, 'depth': 3, 'boosting_type': 'Plain', 'bootstrap_type': 'Bernoulli', 'subsample': 0.8530123350901697}. Best is trial 98 with value: 0.8791208791208791.
[32m[I 2023-04-21 02:03:18,544][39m Trial 1547 finished with value: 0.8409090909090909 and parameters: {'objective': 'CrossEntropy', 'colsample_bylevel': 0.07546841313171951, 'depth': 6, 'boosting_type': 'Plain', 'bootstrap_type': 'Bayesian', 'bagging_temperature': 8.573481130729453}. Best is trial 98 with value: 0.8791208791208791.
[32m[I 2023-04-21 02:03:19,796][39m Trial 1548 finished with value: 0.8539325842696629 and parameters: {'objective': 'CrossEntropy', 'colsample_bylevel': 0.07545379025491455, 'depth': 11, 'boosting_type': 'Plain', 'bootstrap_type': 'Bayesian', 'bagging_temperature': 9.65336297061781}. Best is trial 98 with value: 0.8791208791208791.
[32m[I 2023-04-21 02:03:20,385][39m Trial 1549 finished with value: 0.8539325842696629 and parameters: {'objective': 'Logloss', 'colsample_bylevel': 0.07998283228132454, 'depth': 3, 'boosting_type': 'Plain', 'bootstrap_type': 'Bayesian', 'bagging_temperature': 9.269589117296483}. Best is trial 98 with value: 0.8791208791208791.
[32m[I 2023-04-21 02:03:21,447][39m Trial 1550 finished with value: 0.8409090909090909 and parameters: {'objective': 'CrossEntropy', 'colsample_bylevel': 0.07448605627161389, 'depth': 3, 'boosting_type': 'Plain', 'bootstrap_type': 'Bayesian', 'bagging_temperature': 5.540099740221425}. Best is trial 98 with value: 0.8791208791208791.
[32m[I 2023-04-21 02:03:22,112][39m Trial 1551 finished with value: 0.8791208791208791 and parameters: {'objective': 'CrossEntropy', 'colsample_bylevel': 0.07608819685982679, 'depth': 10, 'boosting_type': 'Plain', 'bootstrap_type': 'Bayesian', 'bagging_temperature': 9.535090143097264}. Best is trial 98 with value: 0.8791208791208791.
[32m[I 2023-04-21 02:03:22,848][39m Trial 1552 finished with value: 0.8409090909090909 and parameters: {'objective': 'Logloss', 'colsample_bylevel': 0.0727676907318406, 'depth': 10, 'boosting_type': 'Plain', 'bootstrap_type': 'Bayesian', 'bagging_temperature': 9.121020415475742}. Best is trial 98 with value: 0.8791208791208791.
[32m[I 2023-04-21 02:03:23,705][39m Trial 1553 finished with value: 0.8539325842696629 and parameters: {'objective': 'CrossEntropy', 'colsample_bylevel': 0.07728464615151553, 'depth': 10, 'boosting_type': 'Plain', 'bootstrap_type': 'Bayesian', 'bagging_temperature': 9.56110853936226}. Best is trial 98 with value: 0.8791208791208791.
[32m[I 2023-04-21 02:03:24,594][39m Trial 1554 finished with value: 0.8275862068965518 and parameters: {'objective': 'CrossEntropy', 'colsample_bylevel': 0.07945467701295846, 'depth': 10, 'boosting_type': 'Plain', 'bootstrap_type': 'MVS'}. Best is trial 98 with value: 0.8791208791208791.
[32m[I 2023-04-21 02:03:25,554][39m Trial 1555 finished with value: 0.8666666666666666 and parameters: {'objective': 'CrossEntropy', 'colsample_bylevel': 0.0808467953075627, 'depth': 3, 'boosting_type': 'Plain', 'bootstrap_type': 'Bayesian', 'bagging_temperature': 7.975592843912936}. Best is trial 98 with value: 0.8791208791208791.
[32m[I 2023-04-21 02:03:26,198][39m Trial 1556 finished with value: 0.8539325842696629 and parameters: {'objective': 'CrossEntropy', 'colsample_bylevel': 0.07871739103455687, 'depth': 3, 'boosting_type': 'Plain', 'bootstrap_type': 'Bayesian', 'bagging_temperature': 9.167675223063089}. Best is trial 98 with value: 0.8791208791208791.
[32m[I 2023-04-21 02:03:27,039][39m Trial 1557 finished with value: 0.8505747126436782 and parameters: {'objective': 'Logloss', 'colsample_bylevel': 0.09280694357923386, 'depth': 5, 'boosting_type': 'Plain', 'bootstrap_type': 'Bayesian', 'bagging_temperature': 6.962031745158303}. Best is trial 98 with value: 0.8791208791208791.
[32m[I 2023-04-21 02:03:31,993][39m Trial 1558 finished with value: 0.8539325842696629 and parameters: {'objective': 'CrossEntropy', 'colsample_bylevel': 0.07387884134315328, 'depth': 5, 'boosting_type': 'Ordered', 'bootstrap_type': 'Bayesian', 'bagging_temperature': 9.336454815592154}. Best is trial 98 with value: 0.8791208791208791.
[32m[I 2023-04-21 02:03:33,033][39m Trial 1559 finished with value: 0.8666666666666666 and parameters: {'objective': 'CrossEntropy', 'colsample_bylevel': 0.08021217311213358, 'depth': 3, 'boosting_type': 'Plain', 'bootstrap_type': 'Bayesian', 'bagging_temperature': 9.424521185928327}. Best is trial 98 with value: 0.8791208791208791.
[32m[I 2023-04-21 02:03:33,967][39m Trial 1560 finished with value: 0.8539325842696629 and parameters: {'objective': 'CrossEntropy', 'colsample_bylevel': 0.07846087596629227, 'depth': 4, 'boosting_type': 'Plain', 'bootstrap_type': 'Bayesian', 'bagging_temperature': 9.651136247773506}. Best is trial 98 with value: 0.8791208791208791.
[32m[I 2023-04-21 02:03:34,919][39m Trial 1561 finished with value: 0.7999999999999999 and parameters: {'objective': 'CrossEntropy', 'colsample_bylevel': 0.0770505749072617, 'depth': 10, 'boosting_type': 'Plain', 'bootstrap_type': 'Bayesian', 'bagging_temperature': 0.3520143228911472}. Best is trial 98 with value: 0.8791208791208791.
[32m[I 2023-04-21 02:03:35,513][39m Trial 1562 finished with value: 0.8764044943820225 and parameters: {'objective': 'CrossEntropy', 'colsample_bylevel': 0.07962762419844116, 'depth': 3, 'boosting_type': 'Plain', 'bootstrap_type': 'Bayesian', 'bagging_temperature': 9.554532985759007}. Best is trial 98 with value: 0.8791208791208791.
[32m[I 2023-04-21 02:03:36,389][39m Trial 1563 finished with value: 0.8409090909090909 and parameters: {'objective': 'CrossEntropy', 'colsample_bylevel': 0.08046165984834737, 'depth': 3, 'boosting_type': 'Plain', 'bootstrap_type': 'Bayesian', 'bagging_temperature': 8.594408277321108}. Best is trial 98 with value: 0.8791208791208791.
[32m[I 2023-04-21 02:03:37,351][39m Trial 1564 finished with value: 0.8539325842696629 and parameters: {'objective': 'Logloss', 'colsample_bylevel': 0.09675831099193899, 'depth': 3, 'boosting_type': 'Plain', 'bootstrap_type': 'Bayesian', 'bagging_temperature': 9.677389051525093}. Best is trial 98 with value: 0.8791208791208791.
[32m[I 2023-04-21 02:03:38,357][39m Trial 1565 finished with value: 0.8409090909090909 and parameters: {'objective': 'CrossEntropy', 'colsample_bylevel': 0.08651160831878, 'depth': 10, 'boosting_type': 'Plain', 'bootstrap_type': 'Bernoulli', 'subsample': 0.681660370558225}. Best is trial 98 with value: 0.8791208791208791.
[32m[I 2023-04-21 02:03:39,186][39m Trial 1566 finished with value: 0.8666666666666666 and parameters: {'objective': 'CrossEntropy', 'colsample_bylevel': 0.08875737080214627, 'depth': 3, 'boosting_type': 'Plain', 'bootstrap_type': 'Bayesian', 'bagging_temperature': 9.094145149016532}. Best is trial 98 with value: 0.8791208791208791.
[32m[I 2023-04-21 02:03:40,050][39m Trial 1567 finished with value: 0.8275862068965518 and parameters: {'objective': 'Logloss', 'colsample_bylevel': 0.08638968935878573, 'depth': 4, 'boosting_type': 'Plain', 'bootstrap_type': 'Bayesian', 'bagging_temperature': 9.780341810438557}. Best is trial 98 with value: 0.8791208791208791.
[32m[I 2023-04-21 02:03:41,065][39m Trial 1568 finished with value: 0.8409090909090909 and parameters: {'objective': 'CrossEntropy', 'colsample_bylevel': 0.05011937669556956, 'depth': 8, 'boosting_type': 'Plain', 'bootstrap_type': 'MVS'}. Best is trial 98 with value: 0.8791208791208791.
[32m[I 2023-04-21 02:03:42,001][39m Trial 1569 finished with value: 0.8791208791208791 and parameters: {'objective': 'CrossEntropy', 'colsample_bylevel': 0.0820267421165664, 'depth': 3, 'boosting_type': 'Plain', 'bootstrap_type': 'Bayesian', 'bagging_temperature': 9.101060004918068}. Best is trial 98 with value: 0.8791208791208791.
[32m[I 2023-04-21 02:03:42,871][39m Trial 1570 finished with value: 0.8409090909090909 and parameters: {'objective': 'CrossEntropy', 'colsample_bylevel': 0.08260113136471892, 'depth': 4, 'boosting_type': 'Plain', 'bootstrap_type': 'Bayesian', 'bagging_temperature': 9.22142173196323}. Best is trial 98 with value: 0.8791208791208791.
[32m[I 2023-04-21 02:03:43,502][39m Trial 1571 finished with value: 0.8666666666666666 and parameters: {'objective': 'CrossEntropy', 'colsample_bylevel': 0.08892520801661737, 'depth': 3, 'boosting_type': 'Plain', 'bootstrap_type': 'Bayesian', 'bagging_temperature': 9.341074862939053}. Best is trial 98 with value: 0.8791208791208791.
[32m[I 2023-04-21 02:03:44,099][39m Trial 1572 finished with value: 0.8409090909090909 and parameters: {'objective': 'CrossEntropy', 'colsample_bylevel': 0.08120151040722881, 'depth': 10, 'boosting_type': 'Plain', 'bootstrap_type': 'Bayesian', 'bagging_temperature': 8.962768546358983}. Best is trial 98 with value: 0.8791208791208791.
[32m[I 2023-04-21 02:03:45,289][39m Trial 1573 finished with value: 0.8409090909090909 and parameters: {'objective': 'CrossEntropy', 'colsample_bylevel': 0.08261955058633735, 'depth': 10, 'boosting_type': 'Plain', 'bootstrap_type': 'Bayesian', 'bagging_temperature': 8.959398488638563}. Best is trial 98 with value: 0.8791208791208791.
[32m[I 2023-04-21 02:03:46,166][39m Trial 1574 finished with value: 0.8539325842696629 and parameters: {'objective': 'CrossEntropy', 'colsample_bylevel': 0.08440028520198287, 'depth': 4, 'boosting_type': 'Plain', 'bootstrap_type': 'Bayesian', 'bagging_temperature': 9.220505426501964}. Best is trial 98 with value: 0.8791208791208791.
[32m[I 2023-04-21 02:03:47,032][39m Trial 1575 finished with value: 0.8539325842696629 and parameters: {'objective': 'Logloss', 'colsample_bylevel': 0.07642697503792494, 'depth': 3, 'boosting_type': 'Plain', 'bootstrap_type': 'Bayesian', 'bagging_temperature': 7.673848128386199}. Best is trial 98 with value: 0.8791208791208791.
[32m[I 2023-04-21 02:03:47,952][39m Trial 1576 finished with value: 0.8409090909090909 and parameters: {'objective': 'CrossEntropy', 'colsample_bylevel': 0.09561420870530052, 'depth': 3, 'boosting_type': 'Plain', 'bootstrap_type': 'Bayesian', 'bagging_temperature': 8.798769195314065}. Best is trial 98 with value: 0.8791208791208791.
[32m[I 2023-04-21 02:03:48,865][39m Trial 1577 finished with value: 0.8409090909090909 and parameters: {'objective': 'CrossEntropy', 'colsample_bylevel': 0.08385792703740737, 'depth': 3, 'boosting_type': 'Plain', 'bootstrap_type': 'Bayesian', 'bagging_temperature': 9.402232862538282}. Best is trial 98 with value: 0.8791208791208791.
[32m[I 2023-04-21 02:03:53,374][39m Trial 1578 finished with value: 0.8095238095238095 and parameters: {'objective': 'CrossEntropy', 'colsample_bylevel': 0.08046930336767798, 'depth': 4, 'boosting_type': 'Ordered', 'bootstrap_type': 'Bayesian', 'bagging_temperature': 9.488627795334377}. Best is trial 98 with value: 0.8791208791208791.
[32m[I 2023-04-21 02:03:54,367][39m Trial 1579 finished with value: 0.7999999999999999 and parameters: {'objective': 'Logloss', 'colsample_bylevel': 0.09727324720126233, 'depth': 12, 'boosting_type': 'Plain', 'bootstrap_type': 'MVS'}. Best is trial 98 with value: 0.8791208791208791.
[32m[I 2023-04-21 02:03:55,302][39m Trial 1580 finished with value: 0.8666666666666666 and parameters: {'objective': 'Logloss', 'colsample_bylevel': 0.07183922313834017, 'depth': 4, 'boosting_type': 'Plain', 'bootstrap_type': 'Bayesian', 'bagging_temperature': 9.29277829428231}. Best is trial 98 with value: 0.8791208791208791.
[32m[I 2023-04-21 02:03:56,376][39m Trial 1581 finished with value: 0.8275862068965518 and parameters: {'objective': 'CrossEntropy', 'colsample_bylevel': 0.04212550273238832, 'depth': 10, 'boosting_type': 'Plain', 'bootstrap_type': 'Bayesian', 'bagging_temperature': 2.876550871440033}. Best is trial 98 with value: 0.8791208791208791.
[32m[I 2023-04-21 02:03:57,279][39m Trial 1582 finished with value: 0.8539325842696629 and parameters: {'objective': 'CrossEntropy', 'colsample_bylevel': 0.07180290168318151, 'depth': 10, 'boosting_type': 'Plain', 'bootstrap_type': 'Bayesian', 'bagging_temperature': 9.496971086012122}. Best is trial 98 with value: 0.8791208791208791.
[32m[I 2023-04-21 02:03:57,875][39m Trial 1583 finished with value: 0.8539325842696629 and parameters: {'objective': 'CrossEntropy', 'colsample_bylevel': 0.08438251600548494, 'depth': 4, 'boosting_type': 'Plain', 'bootstrap_type': 'Bayesian', 'bagging_temperature': 9.45769605267877}. Best is trial 98 with value: 0.8791208791208791.
[32m[I 2023-04-21 02:03:58,545][39m Trial 1584 finished with value: 0.8409090909090909 and parameters: {'objective': 'CrossEntropy', 'colsample_bylevel': 0.06832846370067698, 'depth': 10, 'boosting_type': 'Plain', 'bootstrap_type': 'Bayesian', 'bagging_temperature': 9.6357922490317}. Best is trial 98 with value: 0.8791208791208791.
[32m[I 2023-04-21 02:03:59,428][39m Trial 1585 finished with value: 0.8539325842696629 and parameters: {'objective': 'CrossEntropy', 'colsample_bylevel': 0.0739454008913488, 'depth': 4, 'boosting_type': 'Plain', 'bootstrap_type': 'Bayesian', 'bagging_temperature': 9.678992917081462}. Best is trial 98 with value: 0.8791208791208791.
[32m[I 2023-04-21 02:04:00,585][39m Trial 1586 finished with value: 0.8275862068965518 and parameters: {'objective': 'CrossEntropy', 'colsample_bylevel': 0.08824383359367693, 'depth': 9, 'boosting_type': 'Plain', 'bootstrap_type': 'Bernoulli', 'subsample': 0.5797504415262623}. Best is trial 98 with value: 0.8791208791208791.
