[32m[I 2023-04-21 01:43:45,808][39m Trial 464 finished with value: 0.8539325842696629 and parameters: {'objective': 'CrossEntropy', 'colsample_bylevel': 0.09730078383105345, 'depth': 2, 'boosting_type': 'Plain', 'bootstrap_type': 'Bayesian', 'bagging_temperature': 9.085339617268403}. Best is trial 98 with value: 0.8791208791208791.
[32m[I 2023-04-21 01:43:46,674][39m Trial 465 finished with value: 0.8539325842696629 and parameters: {'objective': 'CrossEntropy', 'colsample_bylevel': 0.07921126048375883, 'depth': 3, 'boosting_type': 'Plain', 'bootstrap_type': 'Bayesian', 'bagging_temperature': 9.434205839833332}. Best is trial 98 with value: 0.8791208791208791.
[32m[I 2023-04-21 01:43:47,506][39m Trial 466 finished with value: 0.8764044943820225 and parameters: {'objective': 'CrossEntropy', 'colsample_bylevel': 0.08547230467790343, 'depth': 2, 'boosting_type': 'Plain', 'bootstrap_type': 'Bayesian', 'bagging_temperature': 8.742922442656935}. Best is trial 98 with value: 0.8791208791208791.
[32m[I 2023-04-21 01:43:52,218][39m Trial 467 finished with value: 0.8409090909090909 and parameters: {'objective': 'CrossEntropy', 'colsample_bylevel': 0.07598947150664678, 'depth': 3, 'boosting_type': 'Ordered', 'bootstrap_type': 'Bayesian', 'bagging_temperature': 2.9246401505117747}. Best is trial 98 with value: 0.8791208791208791.
[32m[I 2023-04-21 01:43:53,087][39m Trial 468 finished with value: 0.8764044943820225 and parameters: {'objective': 'CrossEntropy', 'colsample_bylevel': 0.08416259157105595, 'depth': 2, 'boosting_type': 'Plain', 'bootstrap_type': 'Bayesian', 'bagging_temperature': 9.575989157359546}. Best is trial 98 with value: 0.8791208791208791.
[32m[I 2023-04-21 01:43:53,970][39m Trial 469 finished with value: 0.8372093023255814 and parameters: {'objective': 'CrossEntropy', 'colsample_bylevel': 0.06787797921983048, 'depth': 1, 'boosting_type': 'Plain', 'bootstrap_type': 'Bayesian', 'bagging_temperature': 4.947641070748549}. Best is trial 98 with value: 0.8791208791208791.
[32m[I 2023-04-21 01:43:54,787][39m Trial 470 finished with value: 0.8539325842696629 and parameters: {'objective': 'Logloss', 'colsample_bylevel': 0.08263157972851583, 'depth': 12, 'boosting_type': 'Plain', 'bootstrap_type': 'Bayesian', 'bagging_temperature': 8.781203808165253}. Best is trial 98 with value: 0.8791208791208791.
[32m[I 2023-04-21 01:43:55,624][39m Trial 471 finished with value: 0.8666666666666666 and parameters: {'objective': 'CrossEntropy', 'colsample_bylevel': 0.0866616032819876, 'depth': 2, 'boosting_type': 'Plain', 'bootstrap_type': 'Bayesian', 'bagging_temperature': 9.603659210393156}. Best is trial 98 with value: 0.8791208791208791.
[32m[I 2023-04-21 01:43:56,476][39m Trial 472 finished with value: 0.8409090909090909 and parameters: {'objective': 'CrossEntropy', 'colsample_bylevel': 0.0856448636932663, 'depth': 6, 'boosting_type': 'Plain', 'bootstrap_type': 'Bayesian', 'bagging_temperature': 9.663799376149912}. Best is trial 98 with value: 0.8791208791208791.
[32m[I 2023-04-21 01:43:57,054][39m Trial 473 finished with value: 0.8089887640449439 and parameters: {'objective': 'Logloss', 'colsample_bylevel': 0.08472317603655231, 'depth': 2, 'boosting_type': 'Plain', 'bootstrap_type': 'Bernoulli', 'subsample': 0.971679420599366}. Best is trial 98 with value: 0.8791208791208791.
[32m[I 2023-04-21 01:43:57,693][39m Trial 474 finished with value: 0.8666666666666666 and parameters: {'objective': 'CrossEntropy', 'colsample_bylevel': 0.0885530609099528, 'depth': 2, 'boosting_type': 'Plain', 'bootstrap_type': 'Bayesian', 'bagging_temperature': 9.52123305906349}. Best is trial 98 with value: 0.8791208791208791.
[32m[I 2023-04-21 01:43:58,543][39m Trial 475 finished with value: 0.8539325842696629 and parameters: {'objective': 'CrossEntropy', 'colsample_bylevel': 0.07497315009056538, 'depth': 3, 'boosting_type': 'Plain', 'bootstrap_type': 'Bayesian', 'bagging_temperature': 9.769361319080513}. Best is trial 98 with value: 0.8791208791208791.
[32m[I 2023-04-21 01:43:59,614][39m Trial 476 finished with value: 0.8192771084337348 and parameters: {'objective': 'CrossEntropy', 'colsample_bylevel': 0.09563742809883582, 'depth': 1, 'boosting_type': 'Plain', 'bootstrap_type': 'Bayesian', 'bagging_temperature': 9.260951458915047}. Best is trial 98 with value: 0.8791208791208791.
[32m[I 2023-04-21 01:44:00,317][39m Trial 477 finished with value: 0.8409090909090909 and parameters: {'objective': 'Logloss', 'colsample_bylevel': 0.08431619587227153, 'depth': 2, 'boosting_type': 'Plain', 'bootstrap_type': 'MVS'}. Best is trial 98 with value: 0.8791208791208791.
[32m[I 2023-04-21 01:44:01,506][39m Trial 478 finished with value: 0.8666666666666666 and parameters: {'objective': 'CrossEntropy', 'colsample_bylevel': 0.08694586830660724, 'depth': 2, 'boosting_type': 'Plain', 'bootstrap_type': 'Bayesian', 'bagging_temperature': 9.323454055465488}. Best is trial 98 with value: 0.8791208791208791.
[32m[I 2023-04-21 01:44:02,572][39m Trial 479 finished with value: 0.8539325842696629 and parameters: {'objective': 'CrossEntropy', 'colsample_bylevel': 0.0823511561257326, 'depth': 4, 'boosting_type': 'Plain', 'bootstrap_type': 'Bayesian', 'bagging_temperature': 8.003827309978742}. Best is trial 98 with value: 0.8791208791208791.
[32m[I 2023-04-21 01:44:03,173][39m Trial 480 finished with value: 0.8539325842696629 and parameters: {'objective': 'CrossEntropy', 'colsample_bylevel': 0.08278459774986967, 'depth': 3, 'boosting_type': 'Plain', 'bootstrap_type': 'Bayesian', 'bagging_temperature': 8.449791954815003}. Best is trial 98 with value: 0.8791208791208791.
[32m[I 2023-04-21 01:44:04,247][39m Trial 481 finished with value: 0.8539325842696629 and parameters: {'objective': 'CrossEntropy', 'colsample_bylevel': 0.08426730425157111, 'depth': 2, 'boosting_type': 'Plain', 'bootstrap_type': 'Bayesian', 'bagging_temperature': 9.498185429799246}. Best is trial 98 with value: 0.8791208791208791.
[32m[I 2023-04-21 01:44:04,911][39m Trial 482 finished with value: 0.8636363636363636 and parameters: {'objective': 'CrossEntropy', 'colsample_bylevel': 0.0852146372791544, 'depth': 2, 'boosting_type': 'Plain', 'bootstrap_type': 'Bayesian', 'bagging_temperature': 9.160443518357585}. Best is trial 98 with value: 0.8791208791208791.
[32m[I 2023-04-21 01:44:05,809][39m Trial 483 finished with value: 0.8666666666666666 and parameters: {'objective': 'CrossEntropy', 'colsample_bylevel': 0.08919559179118847, 'depth': 3, 'boosting_type': 'Plain', 'bootstrap_type': 'Bayesian', 'bagging_temperature': 9.626954695937448}. Best is trial 98 with value: 0.8791208791208791.
[32m[I 2023-04-21 01:44:06,814][39m Trial 484 finished with value: 0.8181818181818182 and parameters: {'objective': 'CrossEntropy', 'colsample_bylevel': 0.07862483855972392, 'depth': 1, 'boosting_type': 'Plain', 'bootstrap_type': 'Bayesian', 'bagging_temperature': 9.985430944638713}. Best is trial 98 with value: 0.8791208791208791.
[32m[I 2023-04-21 01:44:07,855][39m Trial 485 finished with value: 0.8764044943820225 and parameters: {'objective': 'CrossEntropy', 'colsample_bylevel': 0.07934789451318458, 'depth': 2, 'boosting_type': 'Plain', 'bootstrap_type': 'Bayesian', 'bagging_temperature': 8.736245087096798}. Best is trial 98 with value: 0.8791208791208791.
[32m[I 2023-04-21 01:44:12,337][39m Trial 486 finished with value: 0.8409090909090909 and parameters: {'objective': 'CrossEntropy', 'colsample_bylevel': 0.09103554484649536, 'depth': 2, 'boosting_type': 'Ordered', 'bootstrap_type': 'Bayesian', 'bagging_temperature': 9.799607643023139}. Best is trial 98 with value: 0.8791208791208791.
[32m[I 2023-04-21 01:44:13,372][39m Trial 487 finished with value: 0.8539325842696629 and parameters: {'objective': 'Logloss', 'colsample_bylevel': 0.08036527925690412, 'depth': 5, 'boosting_type': 'Plain', 'bootstrap_type': 'Bayesian', 'bagging_temperature': 8.68627872163675}. Best is trial 98 with value: 0.8791208791208791.
[32m[I 2023-04-21 01:44:14,855][39m Trial 488 finished with value: 0.8139534883720929 and parameters: {'objective': 'CrossEntropy', 'colsample_bylevel': 0.08227152968141448, 'depth': 9, 'boosting_type': 'Plain', 'bootstrap_type': 'Bayesian', 'bagging_temperature': 8.911536504670908}. Best is trial 98 with value: 0.8791208791208791.
[32m[I 2023-04-21 01:44:15,407][39m Trial 489 finished with value: 0.8539325842696629 and parameters: {'objective': 'CrossEntropy', 'colsample_bylevel': 0.082994584384573, 'depth': 2, 'boosting_type': 'Plain', 'bootstrap_type': 'Bayesian', 'bagging_temperature': 6.586026028161831}. Best is trial 98 with value: 0.8791208791208791.
[32m[I 2023-04-21 01:44:16,449][39m Trial 490 finished with value: 0.8539325842696629 and parameters: {'objective': 'Logloss', 'colsample_bylevel': 0.08768850582154145, 'depth': 2, 'boosting_type': 'Plain', 'bootstrap_type': 'Bayesian', 'bagging_temperature': 9.230744522557824}. Best is trial 98 with value: 0.8791208791208791.
[32m[I 2023-04-21 01:44:17,162][39m Trial 491 finished with value: 0.8636363636363636 and parameters: {'objective': 'CrossEntropy', 'colsample_bylevel': 0.08597560977297768, 'depth': 2, 'boosting_type': 'Plain', 'bootstrap_type': 'Bayesian', 'bagging_temperature': 9.337225874476017}. Best is trial 98 with value: 0.8791208791208791.
[32m[I 2023-04-21 01:44:17,862][39m Trial 492 finished with value: 0.8666666666666666 and parameters: {'objective': 'CrossEntropy', 'colsample_bylevel': 0.08896133297501209, 'depth': 3, 'boosting_type': 'Plain', 'bootstrap_type': 'Bayesian', 'bagging_temperature': 9.014295135279436}. Best is trial 98 with value: 0.8791208791208791.
[32m[I 2023-04-21 01:44:18,727][39m Trial 493 finished with value: 0.8409090909090909 and parameters: {'objective': 'CrossEntropy', 'colsample_bylevel': 0.07748150474508356, 'depth': 2, 'boosting_type': 'Plain', 'bootstrap_type': 'Bayesian', 'bagging_temperature': 6.964530352939028}. Best is trial 98 with value: 0.8791208791208791.
[32m[I 2023-04-21 01:44:19,783][39m Trial 494 finished with value: 0.8764044943820225 and parameters: {'objective': 'Logloss', 'colsample_bylevel': 0.08630088604228707, 'depth': 2, 'boosting_type': 'Plain', 'bootstrap_type': 'Bayesian', 'bagging_temperature': 9.353083531574695}. Best is trial 98 with value: 0.8791208791208791.
[32m[I 2023-04-21 01:44:20,666][39m Trial 495 finished with value: 0.8539325842696629 and parameters: {'objective': 'Logloss', 'colsample_bylevel': 0.08385955446127147, 'depth': 2, 'boosting_type': 'Plain', 'bootstrap_type': 'Bernoulli', 'subsample': 0.10110804220191166}. Best is trial 98 with value: 0.8791208791208791.
[32m[I 2023-04-21 01:44:21,526][39m Trial 496 finished with value: 0.8539325842696629 and parameters: {'objective': 'CrossEntropy', 'colsample_bylevel': 0.08395349372870478, 'depth': 2, 'boosting_type': 'Plain', 'bootstrap_type': 'Bayesian', 'bagging_temperature': 7.845047013692515}. Best is trial 98 with value: 0.8791208791208791.
[32m[I 2023-04-21 01:44:22,534][39m Trial 497 finished with value: 0.8666666666666666 and parameters: {'objective': 'Logloss', 'colsample_bylevel': 0.08690231075282541, 'depth': 3, 'boosting_type': 'Plain', 'bootstrap_type': 'Bayesian', 'bagging_temperature': 8.901172607113722}. Best is trial 98 with value: 0.8791208791208791.
[32m[I 2023-04-21 01:44:23,231][39m Trial 498 finished with value: 0.8409090909090909 and parameters: {'objective': 'CrossEntropy', 'colsample_bylevel': 0.08109701542373304, 'depth': 10, 'boosting_type': 'Plain', 'bootstrap_type': 'Bayesian', 'bagging_temperature': 0.6757653233258623}. Best is trial 98 with value: 0.8791208791208791.
[32m[I 2023-04-21 01:44:23,769][39m Trial 499 finished with value: 0.8 and parameters: {'objective': 'CrossEntropy', 'colsample_bylevel': 0.08200653020224105, 'depth': 1, 'boosting_type': 'Plain', 'bootstrap_type': 'MVS'}. Best is trial 98 with value: 0.8791208791208791.
[32m[I 2023-04-21 01:44:24,532][39m Trial 500 finished with value: 0.8539325842696629 and parameters: {'objective': 'CrossEntropy', 'colsample_bylevel': 0.09424574280001735, 'depth': 2, 'boosting_type': 'Plain', 'bootstrap_type': 'Bayesian', 'bagging_temperature': 8.562764601604762}. Best is trial 98 with value: 0.8791208791208791.
[32m[I 2023-04-21 01:44:25,305][39m Trial 501 finished with value: 0.8764044943820225 and parameters: {'objective': 'CrossEntropy', 'colsample_bylevel': 0.08273718783811324, 'depth': 2, 'boosting_type': 'Plain', 'bootstrap_type': 'Bayesian', 'bagging_temperature': 8.116262429271998}. Best is trial 98 with value: 0.8791208791208791.
[32m[I 2023-04-21 01:44:26,106][39m Trial 502 finished with value: 0.8636363636363636 and parameters: {'objective': 'Logloss', 'colsample_bylevel': 0.09544308442372818, 'depth': 2, 'boosting_type': 'Plain', 'bootstrap_type': 'Bayesian', 'bagging_temperature': 9.083234131099953}. Best is trial 98 with value: 0.8791208791208791.
[32m[I 2023-04-21 01:44:27,168][39m Trial 503 finished with value: 0.8539325842696629 and parameters: {'objective': 'CrossEntropy', 'colsample_bylevel': 0.08595048698864789, 'depth': 4, 'boosting_type': 'Plain', 'bootstrap_type': 'Bayesian', 'bagging_temperature': 9.705772005382515}. Best is trial 98 with value: 0.8791208791208791.
[32m[I 2023-04-21 01:44:27,986][39m Trial 504 finished with value: 0.8636363636363636 and parameters: {'objective': 'CrossEntropy', 'colsample_bylevel': 0.08450091630916497, 'depth': 2, 'boosting_type': 'Plain', 'bootstrap_type': 'Bayesian', 'bagging_temperature': 9.128644214666009}. Best is trial 98 with value: 0.8791208791208791.
[32m[I 2023-04-21 01:44:28,848][39m Trial 505 finished with value: 0.8666666666666666 and parameters: {'objective': 'CrossEntropy', 'colsample_bylevel': 0.07339975801344994, 'depth': 3, 'boosting_type': 'Plain', 'bootstrap_type': 'Bayesian', 'bagging_temperature': 9.449713225610308}. Best is trial 98 with value: 0.8791208791208791.
[32m[I 2023-04-21 01:44:29,452][39m Trial 506 finished with value: 0.8409090909090909 and parameters: {'objective': 'CrossEntropy', 'colsample_bylevel': 0.0805130402631565, 'depth': 3, 'boosting_type': 'Plain', 'bootstrap_type': 'Bayesian', 'bagging_temperature': 9.800948952792995}. Best is trial 98 with value: 0.8791208791208791.
[32m[I 2023-04-21 01:44:34,107][39m Trial 507 finished with value: 0.8089887640449439 and parameters: {'objective': 'CrossEntropy', 'colsample_bylevel': 0.08342119156380005, 'depth': 1, 'boosting_type': 'Ordered', 'bootstrap_type': 'Bayesian', 'bagging_temperature': 9.485085127005247}. Best is trial 98 with value: 0.8791208791208791.
[32m[I 2023-04-21 01:44:35,040][39m Trial 508 finished with value: 0.8666666666666666 and parameters: {'objective': 'CrossEntropy', 'colsample_bylevel': 0.07802935598978579, 'depth': 2, 'boosting_type': 'Plain', 'bootstrap_type': 'Bayesian', 'bagging_temperature': 9.983369533823256}. Best is trial 98 with value: 0.8791208791208791.
[32m[I 2023-04-21 01:44:35,847][39m Trial 509 finished with value: 0.8409090909090909 and parameters: {'objective': 'CrossEntropy', 'colsample_bylevel': 0.08953121207951266, 'depth': 2, 'boosting_type': 'Plain', 'bootstrap_type': 'Bayesian', 'bagging_temperature': 8.352838939203773}. Best is trial 98 with value: 0.8791208791208791.
[32m[I 2023-04-21 01:44:36,669][39m Trial 510 finished with value: 0.8791208791208791 and parameters: {'objective': 'CrossEntropy', 'colsample_bylevel': 0.07998729220714332, 'depth': 3, 'boosting_type': 'Plain', 'bootstrap_type': 'Bayesian', 'bagging_temperature': 8.708162234706412}. Best is trial 98 with value: 0.8791208791208791.
[32m[I 2023-04-21 01:44:37,381][39m Trial 511 finished with value: 0.8764044943820225 and parameters: {'objective': 'CrossEntropy', 'colsample_bylevel': 0.0813017115816248, 'depth': 2, 'boosting_type': 'Plain', 'bootstrap_type': 'Bayesian', 'bagging_temperature': 9.810808408667983}. Best is trial 98 with value: 0.8791208791208791.
[32m[I 2023-04-21 01:44:37,998][39m Trial 512 finished with value: 0.8409090909090909 and parameters: {'objective': 'CrossEntropy', 'colsample_bylevel': 0.08017158919251306, 'depth': 7, 'boosting_type': 'Plain', 'bootstrap_type': 'Bayesian', 'bagging_temperature': 9.820752674584895}. Best is trial 98 with value: 0.8791208791208791.
[32m[I 2023-04-21 01:44:38,845][39m Trial 513 finished with value: 0.8181818181818182 and parameters: {'objective': 'CrossEntropy', 'colsample_bylevel': 0.034125040598737666, 'depth': 3, 'boosting_type': 'Plain', 'bootstrap_type': 'Bayesian', 'bagging_temperature': 8.253611166936187}. Best is trial 98 with value: 0.8791208791208791.
[32m[I 2023-04-21 01:44:39,734][39m Trial 514 finished with value: 0.8539325842696629 and parameters: {'objective': 'CrossEntropy', 'colsample_bylevel': 0.08849131540594143, 'depth': 3, 'boosting_type': 'Plain', 'bootstrap_type': 'Bayesian', 'bagging_temperature': 8.50828348182075}. Best is trial 98 with value: 0.8791208791208791.
[32m[I 2023-04-21 01:44:40,566][39m Trial 515 finished with value: 0.8764044943820225 and parameters: {'objective': 'CrossEntropy', 'colsample_bylevel': 0.08537455570347552, 'depth': 2, 'boosting_type': 'Plain', 'bootstrap_type': 'Bayesian', 'bagging_temperature': 8.71496572387274}. Best is trial 98 with value: 0.8791208791208791.
[32m[I 2023-04-21 01:44:41,386][39m Trial 516 finished with value: 0.8636363636363636 and parameters: {'objective': 'CrossEntropy', 'colsample_bylevel': 0.08315869560897655, 'depth': 2, 'boosting_type': 'Plain', 'bootstrap_type': 'Bayesian', 'bagging_temperature': 8.583528089390818}. Best is trial 98 with value: 0.8791208791208791.
[32m[I 2023-04-21 01:44:42,347][39m Trial 517 finished with value: 0.8 and parameters: {'objective': 'CrossEntropy', 'colsample_bylevel': 0.09291615931265806, 'depth': 1, 'boosting_type': 'Plain', 'bootstrap_type': 'Bernoulli', 'subsample': 0.8267553943573188}. Best is trial 98 with value: 0.8791208791208791.
[32m[I 2023-04-21 01:44:43,222][39m Trial 518 finished with value: 0.8666666666666666 and parameters: {'objective': 'Logloss', 'colsample_bylevel': 0.07595367980067087, 'depth': 3, 'boosting_type': 'Plain', 'bootstrap_type': 'Bayesian', 'bagging_temperature': 9.63464873058457}. Best is trial 98 with value: 0.8791208791208791.
[32m[I 2023-04-21 01:44:43,873][39m Trial 519 finished with value: 0.8636363636363636 and parameters: {'objective': 'CrossEntropy', 'colsample_bylevel': 0.09180977961400906, 'depth': 2, 'boosting_type': 'Plain', 'bootstrap_type': 'Bayesian', 'bagging_temperature': 8.710662215265103}. Best is trial 98 with value: 0.8791208791208791.
[32m[I 2023-04-21 01:44:44,466][39m Trial 520 finished with value: 0.8539325842696629 and parameters: {'objective': 'CrossEntropy', 'colsample_bylevel': 0.09730578325180146, 'depth': 3, 'boosting_type': 'Plain', 'bootstrap_type': 'MVS'}. Best is trial 98 with value: 0.8791208791208791.
[32m[I 2023-04-21 01:44:45,081][39m Trial 521 finished with value: 0.8409090909090909 and parameters: {'objective': 'Logloss', 'colsample_bylevel': 0.07888270827513029, 'depth': 6, 'boosting_type': 'Plain', 'bootstrap_type': 'Bayesian', 'bagging_temperature': 9.271631209758558}. Best is trial 98 with value: 0.8791208791208791.
[32m[I 2023-04-21 01:44:45,868][39m Trial 522 finished with value: 0.8539325842696629 and parameters: {'objective': 'Logloss', 'colsample_bylevel': 0.08737887321701124, 'depth': 2, 'boosting_type': 'Plain', 'bootstrap_type': 'Bayesian', 'bagging_temperature': 8.378197953916219}. Best is trial 98 with value: 0.8791208791208791.
[32m[I 2023-04-21 01:44:46,791][39m Trial 523 finished with value: 0.8539325842696629 and parameters: {'objective': 'CrossEntropy', 'colsample_bylevel': 0.07949073976945775, 'depth': 2, 'boosting_type': 'Plain', 'bootstrap_type': 'Bayesian', 'bagging_temperature': 2.5291037935796625}. Best is trial 98 with value: 0.8791208791208791.
[32m[I 2023-04-21 01:44:47,607][39m Trial 524 finished with value: 0.8636363636363636 and parameters: {'objective': 'CrossEntropy', 'colsample_bylevel': 0.08049920992782675, 'depth': 2, 'boosting_type': 'Plain', 'bootstrap_type': 'Bayesian', 'bagging_temperature': 8.031764400318792}. Best is trial 98 with value: 0.8791208791208791.
[32m[I 2023-04-21 01:44:48,440][39m Trial 525 finished with value: 0.8735632183908046 and parameters: {'objective': 'CrossEntropy', 'colsample_bylevel': 0.08466297705111996, 'depth': 2, 'boosting_type': 'Plain', 'bootstrap_type': 'Bayesian', 'bagging_temperature': 8.810323282935459}. Best is trial 98 with value: 0.8791208791208791.
[32m[I 2023-04-21 01:44:53,121][39m Trial 526 finished with value: 0.8314606741573034 and parameters: {'objective': 'Logloss', 'colsample_bylevel': 0.08224042882491601, 'depth': 2, 'boosting_type': 'Ordered', 'bootstrap_type': 'Bayesian', 'bagging_temperature': 8.883838650244288}. Best is trial 98 with value: 0.8791208791208791.
[32m[I 2023-04-21 01:44:54,080][39m Trial 527 finished with value: 0.8539325842696629 and parameters: {'objective': 'CrossEntropy', 'colsample_bylevel': 0.08072907692332734, 'depth': 4, 'boosting_type': 'Plain', 'bootstrap_type': 'Bayesian', 'bagging_temperature': 8.301782881166993}. Best is trial 98 with value: 0.8791208791208791.
[32m[I 2023-04-21 01:44:54,828][39m Trial 528 finished with value: 0.8139534883720929 and parameters: {'objective': 'Logloss', 'colsample_bylevel': 0.08226313708772352, 'depth': 1, 'boosting_type': 'Plain', 'bootstrap_type': 'Bayesian', 'bagging_temperature': 9.083198383915365}. Best is trial 98 with value: 0.8791208791208791.
[32m[I 2023-04-21 01:44:55,684][39m Trial 529 finished with value: 0.8409090909090909 and parameters: {'objective': 'CrossEntropy', 'colsample_bylevel': 0.08629661121504585, 'depth': 3, 'boosting_type': 'Plain', 'bootstrap_type': 'Bayesian', 'bagging_temperature': 9.407600246287876}. Best is trial 98 with value: 0.8791208791208791.
