[32m[I 2023-04-21 03:23:47,527][39m Trial 5588 finished with value: 0.8666666666666666 and parameters: {'objective': 'Logloss', 'colsample_bylevel': 0.07181762218044155, 'depth': 7, 'boosting_type': 'Plain', 'bootstrap_type': 'Bayesian', 'bagging_temperature': 9.745190407241301}. Best is trial 3065 with value: 0.8863636363636364.
[32m[I 2023-04-21 03:23:48,995][39m Trial 5589 finished with value: 0.8666666666666666 and parameters: {'objective': 'CrossEntropy', 'colsample_bylevel': 0.07649872451010498, 'depth': 9, 'boosting_type': 'Plain', 'bootstrap_type': 'Bayesian', 'bagging_temperature': 9.665570814494039}. Best is trial 3065 with value: 0.8863636363636364.
[32m[I 2023-04-21 03:23:49,902][39m Trial 5590 finished with value: 0.8275862068965518 and parameters: {'objective': 'CrossEntropy', 'colsample_bylevel': 0.0853236925870146, 'depth': 3, 'boosting_type': 'Plain', 'bootstrap_type': 'Bayesian', 'bagging_temperature': 5.524768865323961}. Best is trial 3065 with value: 0.8863636363636364.
[32m[I 2023-04-21 03:23:50,612][39m Trial 5591 finished with value: 0.8539325842696629 and parameters: {'objective': 'CrossEntropy', 'colsample_bylevel': 0.08655711359856512, 'depth': 3, 'boosting_type': 'Plain', 'bootstrap_type': 'Bayesian', 'bagging_temperature': 9.812662431178628}. Best is trial 3065 with value: 0.8863636363636364.
[32m[I 2023-04-21 03:23:51,474][39m Trial 5592 finished with value: 0.8666666666666666 and parameters: {'objective': 'CrossEntropy', 'colsample_bylevel': 0.0763062580892048, 'depth': 10, 'boosting_type': 'Plain', 'bootstrap_type': 'Bayesian', 'bagging_temperature': 9.986831484308329}. Best is trial 3065 with value: 0.8863636363636364.
[32m[I 2023-04-21 03:23:52,724][39m Trial 5593 finished with value: 0.8409090909090909 and parameters: {'objective': 'Logloss', 'colsample_bylevel': 0.0730429182434429, 'depth': 5, 'boosting_type': 'Plain', 'bootstrap_type': 'Bayesian', 'bagging_temperature': 9.68722996439503}. Best is trial 3065 with value: 0.8863636363636364.
[32m[I 2023-04-21 03:23:53,430][39m Trial 5594 finished with value: 0.8409090909090909 and parameters: {'objective': 'CrossEntropy', 'colsample_bylevel': 0.07120842734727661, 'depth': 10, 'boosting_type': 'Plain', 'bootstrap_type': 'Bayesian', 'bagging_temperature': 9.050412440315727}. Best is trial 3065 with value: 0.8863636363636364.
[32m[I 2023-04-21 03:23:58,468][39m Trial 5595 finished with value: 0.8409090909090909 and parameters: {'objective': 'CrossEntropy', 'colsample_bylevel': 0.07780910295138553, 'depth': 11, 'boosting_type': 'Ordered', 'bootstrap_type': 'Bayesian', 'bagging_temperature': 9.9989948157756}. Best is trial 3065 with value: 0.8863636363636364.
[32m[I 2023-04-21 03:23:59,544][39m Trial 5596 finished with value: 0.8409090909090909 and parameters: {'objective': 'CrossEntropy', 'colsample_bylevel': 0.0787205115711467, 'depth': 11, 'boosting_type': 'Plain', 'bootstrap_type': 'Bayesian', 'bagging_temperature': 9.833777246038842}. Best is trial 3065 with value: 0.8863636363636364.
[32m[I 2023-04-21 03:24:00,844][39m Trial 5597 finished with value: 0.8539325842696629 and parameters: {'objective': 'CrossEntropy', 'colsample_bylevel': 0.07076169167809099, 'depth': 11, 'boosting_type': 'Plain', 'bootstrap_type': 'Bayesian', 'bagging_temperature': 8.663014180025666}. Best is trial 3065 with value: 0.8863636363636364.
[32m[I 2023-04-21 03:24:01,935][39m Trial 5598 finished with value: 0.8539325842696629 and parameters: {'objective': 'CrossEntropy', 'colsample_bylevel': 0.07075814443191651, 'depth': 11, 'boosting_type': 'Plain', 'bootstrap_type': 'Bayesian', 'bagging_temperature': 8.65435549556514}. Best is trial 3065 with value: 0.8863636363636364.
[32m[I 2023-04-21 03:24:03,104][39m Trial 5599 finished with value: 0.8539325842696629 and parameters: {'objective': 'CrossEntropy', 'colsample_bylevel': 0.07781937635703867, 'depth': 6, 'boosting_type': 'Plain', 'bootstrap_type': 'Bernoulli', 'subsample': 0.5246408070747087}. Best is trial 3065 with value: 0.8863636363636364.
[32m[I 2023-04-21 03:24:04,458][39m Trial 5600 finished with value: 0.8666666666666666 and parameters: {'objective': 'Logloss', 'colsample_bylevel': 0.073826060857584, 'depth': 10, 'boosting_type': 'Plain', 'bootstrap_type': 'Bayesian', 'bagging_temperature': 8.543813223667737}. Best is trial 3065 with value: 0.8863636363636364.
[32m[I 2023-04-21 03:24:05,598][39m Trial 5601 finished with value: 0.8636363636363636 and parameters: {'objective': 'CrossEntropy', 'colsample_bylevel': 0.0927086270472922, 'depth': 9, 'boosting_type': 'Plain', 'bootstrap_type': 'Bayesian', 'bagging_temperature': 8.883999415132884}. Best is trial 3065 with value: 0.8863636363636364.
[32m[I 2023-04-21 03:24:06,467][39m Trial 5602 finished with value: 0.8275862068965518 and parameters: {'objective': 'CrossEntropy', 'colsample_bylevel': 0.09039334756307307, 'depth': 3, 'boosting_type': 'Plain', 'bootstrap_type': 'Bayesian', 'bagging_temperature': 4.203239401336464}. Best is trial 3065 with value: 0.8863636363636364.
[32m[I 2023-04-21 03:24:07,460][39m Trial 5603 finished with value: 0.8539325842696629 and parameters: {'objective': 'Logloss', 'colsample_bylevel': 0.07622276416556086, 'depth': 4, 'boosting_type': 'Plain', 'bootstrap_type': 'Bayesian', 'bagging_temperature': 9.710399705448108}. Best is trial 3065 with value: 0.8863636363636364.
[32m[I 2023-04-21 03:24:08,435][39m Trial 5604 finished with value: 0.8409090909090909 and parameters: {'objective': 'CrossEntropy', 'colsample_bylevel': 0.08896557399018235, 'depth': 4, 'boosting_type': 'Plain', 'bootstrap_type': 'Bayesian', 'bagging_temperature': 8.589883187087379}. Best is trial 3065 with value: 0.8863636363636364.
[32m[I 2023-04-21 03:24:09,704][39m Trial 5605 finished with value: 0.8539325842696629 and parameters: {'objective': 'Logloss', 'colsample_bylevel': 0.09352834331584693, 'depth': 3, 'boosting_type': 'Plain', 'bootstrap_type': 'MVS'}. Best is trial 3065 with value: 0.8863636363636364.
[32m[I 2023-04-21 03:24:11,096][39m Trial 5606 finished with value: 0.8539325842696629 and parameters: {'objective': 'Logloss', 'colsample_bylevel': 0.08311685705753409, 'depth': 4, 'boosting_type': 'Plain', 'bootstrap_type': 'Bayesian', 'bagging_temperature': 8.198197215546635}. Best is trial 3065 with value: 0.8863636363636364.
[32m[I 2023-04-21 03:24:12,185][39m Trial 5607 finished with value: 0.8409090909090909 and parameters: {'objective': 'CrossEntropy', 'colsample_bylevel': 0.06700323818038452, 'depth': 11, 'boosting_type': 'Plain', 'bootstrap_type': 'MVS'}. Best is trial 3065 with value: 0.8863636363636364.
[32m[I 2023-04-21 03:24:12,912][39m Trial 5608 finished with value: 0.8275862068965518 and parameters: {'objective': 'CrossEntropy', 'colsample_bylevel': 0.07358441041983203, 'depth': 8, 'boosting_type': 'Plain', 'bootstrap_type': 'MVS'}. Best is trial 3065 with value: 0.8863636363636364.
[32m[I 2023-04-21 03:24:13,884][39m Trial 5609 finished with value: 0.8666666666666666 and parameters: {'objective': 'CrossEntropy', 'colsample_bylevel': 0.07313990562334684, 'depth': 4, 'boosting_type': 'Plain', 'bootstrap_type': 'Bayesian', 'bagging_temperature': 9.127432926372075}. Best is trial 3065 with value: 0.8863636363636364.
[32m[I 2023-04-21 03:24:14,946][39m Trial 5610 finished with value: 0.8539325842696629 and parameters: {'objective': 'CrossEntropy', 'colsample_bylevel': 0.07394105640440234, 'depth': 6, 'boosting_type': 'Plain', 'bootstrap_type': 'Bayesian', 'bagging_temperature': 9.589260191762966}. Best is trial 3065 with value: 0.8863636363636364.
[32m[I 2023-04-21 03:24:16,459][39m Trial 5611 finished with value: 0.8666666666666666 and parameters: {'objective': 'CrossEntropy', 'colsample_bylevel': 0.08484716447064454, 'depth': 2, 'boosting_type': 'Plain', 'bootstrap_type': 'Bayesian', 'bagging_temperature': 9.693204139412277}. Best is trial 3065 with value: 0.8863636363636364.
[32m[I 2023-04-21 03:24:17,584][39m Trial 5612 finished with value: 0.8275862068965518 and parameters: {'objective': 'CrossEntropy', 'colsample_bylevel': 0.08575689245383175, 'depth': 10, 'boosting_type': 'Plain', 'bootstrap_type': 'Bayesian', 'bagging_temperature': 3.513919355843167}. Best is trial 3065 with value: 0.8863636363636364.
[32m[I 2023-04-21 03:24:18,379][39m Trial 5613 finished with value: 0.8372093023255814 and parameters: {'objective': 'CrossEntropy', 'colsample_bylevel': 0.07306979131182124, 'depth': 2, 'boosting_type': 'Plain', 'bootstrap_type': 'Bayesian', 'bagging_temperature': 9.217832786468291}. Best is trial 3065 with value: 0.8863636363636364.
[32m[I 2023-04-21 03:24:19,482][39m Trial 5614 finished with value: 0.8139534883720929 and parameters: {'objective': 'CrossEntropy', 'colsample_bylevel': 0.06541304054009132, 'depth': 7, 'boosting_type': 'Plain', 'bootstrap_type': 'Bayesian', 'bagging_temperature': 9.900008463014405}. Best is trial 3065 with value: 0.8863636363636364.
[32m[I 2023-04-21 03:24:20,600][39m Trial 5615 finished with value: 0.8275862068965518 and parameters: {'objective': 'Logloss', 'colsample_bylevel': 0.07801227423383256, 'depth': 11, 'boosting_type': 'Plain', 'bootstrap_type': 'Bayesian', 'bagging_temperature': 7.486602248666141}. Best is trial 3065 with value: 0.8863636363636364.
[32m[I 2023-04-21 03:24:21,405][39m Trial 5616 finished with value: 0.8409090909090909 and parameters: {'objective': 'CrossEntropy', 'colsample_bylevel': 0.041541626872740496, 'depth': 8, 'boosting_type': 'Plain', 'bootstrap_type': 'Bayesian', 'bagging_temperature': 9.991466188382335}. Best is trial 3065 with value: 0.8863636363636364.
[32m[I 2023-04-21 03:24:25,700][39m Trial 5617 finished with value: 0.7999999999999999 and parameters: {'objective': 'CrossEntropy', 'colsample_bylevel': 0.08814847603207772, 'depth': 3, 'boosting_type': 'Ordered', 'bootstrap_type': 'Bayesian', 'bagging_temperature': 9.696061158757114}. Best is trial 3065 with value: 0.8863636363636364.
[32m[I 2023-04-21 03:24:27,078][39m Trial 5618 finished with value: 0.8275862068965518 and parameters: {'objective': 'CrossEntropy', 'colsample_bylevel': 0.07626211602147076, 'depth': 12, 'boosting_type': 'Plain', 'bootstrap_type': 'Bayesian', 'bagging_temperature': 9.370790790329918}. Best is trial 3065 with value: 0.8863636363636364.
[32m[I 2023-04-21 03:24:28,170][39m Trial 5619 finished with value: 0.8666666666666666 and parameters: {'objective': 'Logloss', 'colsample_bylevel': 0.07836416667756264, 'depth': 10, 'boosting_type': 'Plain', 'bootstrap_type': 'Bayesian', 'bagging_temperature': 9.416855298583382}. Best is trial 3065 with value: 0.8863636363636364.
[32m[I 2023-04-21 03:24:29,320][39m Trial 5620 finished with value: 0.8409090909090909 and parameters: {'objective': 'CrossEntropy', 'colsample_bylevel': 0.09223617190274565, 'depth': 3, 'boosting_type': 'Plain', 'bootstrap_type': 'Bayesian', 'bagging_temperature': 6.595884328851589}. Best is trial 3065 with value: 0.8863636363636364.
[32m[I 2023-04-21 03:24:30,621][39m Trial 5621 finished with value: 0.8409090909090909 and parameters: {'objective': 'Logloss', 'colsample_bylevel': 0.07400151161979701, 'depth': 11, 'boosting_type': 'Plain', 'bootstrap_type': 'Bayesian', 'bagging_temperature': 9.268510254261695}. Best is trial 3065 with value: 0.8863636363636364.
[32m[I 2023-04-21 03:24:32,015][39m Trial 5622 finished with value: 0.8505747126436782 and parameters: {'objective': 'CrossEntropy', 'colsample_bylevel': 0.08417814081357397, 'depth': 7, 'boosting_type': 'Plain', 'bootstrap_type': 'Bayesian', 'bagging_temperature': 9.543728702781193}. Best is trial 3065 with value: 0.8863636363636364.
[32m[I 2023-04-21 03:24:33,047][39m Trial 5623 finished with value: 0.8409090909090909 and parameters: {'objective': 'CrossEntropy', 'colsample_bylevel': 0.07168446972195787, 'depth': 10, 'boosting_type': 'Plain', 'bootstrap_type': 'Bayesian', 'bagging_temperature': 6.537295379524179}. Best is trial 3065 with value: 0.8863636363636364.
[32m[I 2023-04-21 03:24:34,001][39m Trial 5624 finished with value: 0.8539325842696629 and parameters: {'objective': 'CrossEntropy', 'colsample_bylevel': 0.07467718055078827, 'depth': 4, 'boosting_type': 'Plain', 'bootstrap_type': 'Bayesian', 'bagging_temperature': 9.665004669990592}. Best is trial 3065 with value: 0.8863636363636364.
[32m[I 2023-04-21 03:24:35,114][39m Trial 5625 finished with value: 0.8505747126436782 and parameters: {'objective': 'CrossEntropy', 'colsample_bylevel': 0.08288843098259763, 'depth': 11, 'boosting_type': 'Plain', 'bootstrap_type': 'Bayesian', 'bagging_temperature': 9.840104249493251}. Best is trial 3065 with value: 0.8863636363636364.
[32m[I 2023-04-21 03:24:36,144][39m Trial 5626 finished with value: 0.8275862068965518 and parameters: {'objective': 'CrossEntropy', 'colsample_bylevel': 0.08249347810250926, 'depth': 11, 'boosting_type': 'Plain', 'bootstrap_type': 'Bayesian', 'bagging_temperature': 9.703145825940384}. Best is trial 3065 with value: 0.8863636363636364.
[32m[I 2023-04-21 03:24:36,855][39m Trial 5627 finished with value: 0.8505747126436782 and parameters: {'objective': 'CrossEntropy', 'colsample_bylevel': 0.08185345221985267, 'depth': 10, 'boosting_type': 'Plain', 'bootstrap_type': 'Bayesian', 'bagging_temperature': 2.487308721843095}. Best is trial 3065 with value: 0.8863636363636364.
[32m[I 2023-04-21 03:24:37,530][39m Trial 5628 finished with value: 0.8539325842696629 and parameters: {'objective': 'Logloss', 'colsample_bylevel': 0.07022982828944938, 'depth': 10, 'boosting_type': 'Plain', 'bootstrap_type': 'Bayesian', 'bagging_temperature': 8.573167114391318}. Best is trial 3065 with value: 0.8863636363636364.
[32m[I 2023-04-21 03:24:38,416][39m Trial 5629 finished with value: 0.8539325842696629 and parameters: {'objective': 'CrossEntropy', 'colsample_bylevel': 0.09544212868720911, 'depth': 3, 'boosting_type': 'Plain', 'bootstrap_type': 'Bayesian', 'bagging_temperature': 9.833473194236786}. Best is trial 3065 with value: 0.8863636363636364.
[32m[I 2023-04-21 03:24:39,686][39m Trial 5630 finished with value: 0.8139534883720929 and parameters: {'objective': 'CrossEntropy', 'colsample_bylevel': 0.0718324543141204, 'depth': 9, 'boosting_type': 'Plain', 'bootstrap_type': 'Bayesian', 'bagging_temperature': 6.761501402146255}. Best is trial 3065 with value: 0.8863636363636364.
[32m[I 2023-04-21 03:24:40,750][39m Trial 5631 finished with value: 0.8409090909090909 and parameters: {'objective': 'CrossEntropy', 'colsample_bylevel': 0.07693375091435392, 'depth': 8, 'boosting_type': 'Plain', 'bootstrap_type': 'Bayesian', 'bagging_temperature': 9.991832866795946}. Best is trial 3065 with value: 0.8863636363636364.
[32m[I 2023-04-21 03:24:42,098][39m Trial 5632 finished with value: 0.8505747126436782 and parameters: {'objective': 'Logloss', 'colsample_bylevel': 0.09393408565488336, 'depth': 11, 'boosting_type': 'Plain', 'bootstrap_type': 'Bayesian', 'bagging_temperature': 9.835937478069365}. Best is trial 3065 with value: 0.8863636363636364.
[32m[I 2023-04-21 03:24:42,971][39m Trial 5633 finished with value: 0.8372093023255814 and parameters: {'objective': 'Logloss', 'colsample_bylevel': 0.08561014929697117, 'depth': 5, 'boosting_type': 'Plain', 'bootstrap_type': 'Bayesian', 'bagging_temperature': 8.87793511071962}. Best is trial 3065 with value: 0.8863636363636364.
[32m[I 2023-04-21 03:24:43,648][39m Trial 5634 finished with value: 0.8539325842696629 and parameters: {'objective': 'CrossEntropy', 'colsample_bylevel': 0.07307065924892443, 'depth': 4, 'boosting_type': 'Plain', 'bootstrap_type': 'Bayesian', 'bagging_temperature': 9.770210379965826}. Best is trial 3065 with value: 0.8863636363636364.
[32m[I 2023-04-21 03:24:48,825][39m Trial 5635 finished with value: 0.8131868131868132 and parameters: {'objective': 'Logloss', 'colsample_bylevel': 0.08454759709932501, 'depth': 10, 'boosting_type': 'Ordered', 'bootstrap_type': 'MVS'}. Best is trial 3065 with value: 0.8863636363636364.
[32m[I 2023-04-21 03:24:50,040][39m Trial 5636 finished with value: 0.8409090909090909 and parameters: {'objective': 'Logloss', 'colsample_bylevel': 0.09501251414022789, 'depth': 3, 'boosting_type': 'Plain', 'bootstrap_type': 'Bayesian', 'bagging_temperature': 9.57983473051435}. Best is trial 3065 with value: 0.8863636363636364.
[32m[I 2023-04-21 03:24:51,264][39m Trial 5637 finished with value: 0.8666666666666666 and parameters: {'objective': 'CrossEntropy', 'colsample_bylevel': 0.06846253891654941, 'depth': 9, 'boosting_type': 'Plain', 'bootstrap_type': 'Bayesian', 'bagging_temperature': 9.98498520508149}. Best is trial 3065 with value: 0.8863636363636364.
[32m[I 2023-04-21 03:24:52,430][39m Trial 5638 finished with value: 0.8539325842696629 and parameters: {'objective': 'CrossEntropy', 'colsample_bylevel': 0.06782237820143246, 'depth': 9, 'boosting_type': 'Plain', 'bootstrap_type': 'Bayesian', 'bagging_temperature': 8.95144728854387}. Best is trial 3065 with value: 0.8863636363636364.
[32m[I 2023-04-21 03:24:53,615][39m Trial 5639 finished with value: 0.8539325842696629 and parameters: {'objective': 'CrossEntropy', 'colsample_bylevel': 0.08089651023162472, 'depth': 4, 'boosting_type': 'Plain', 'bootstrap_type': 'Bayesian', 'bagging_temperature': 9.995575358027283}. Best is trial 3065 with value: 0.8863636363636364.
[32m[I 2023-04-21 03:24:55,043][39m Trial 5640 finished with value: 0.8314606741573034 and parameters: {'objective': 'Logloss', 'colsample_bylevel': 0.07347303012429574, 'depth': 4, 'boosting_type': 'Plain', 'bootstrap_type': 'Bernoulli', 'subsample': 0.574774791341806}. Best is trial 3065 with value: 0.8863636363636364.
[32m[I 2023-04-21 03:24:56,088][39m Trial 5641 finished with value: 0.8409090909090909 and parameters: {'objective': 'CrossEntropy', 'colsample_bylevel': 0.08164543472952288, 'depth': 4, 'boosting_type': 'Plain', 'bootstrap_type': 'Bayesian', 'bagging_temperature': 8.870867785985194}. Best is trial 3065 with value: 0.8863636363636364.
[32m[I 2023-04-21 03:24:57,170][39m Trial 5642 finished with value: 0.8275862068965518 and parameters: {'objective': 'CrossEntropy', 'colsample_bylevel': 0.07739711032842798, 'depth': 11, 'boosting_type': 'Plain', 'bootstrap_type': 'Bernoulli', 'subsample': 0.44751189626869414}. Best is trial 3065 with value: 0.8863636363636364.
[32m[I 2023-04-21 03:24:58,051][39m Trial 5643 finished with value: 0.8666666666666666 and parameters: {'objective': 'Logloss', 'colsample_bylevel': 0.09205757369968993, 'depth': 3, 'boosting_type': 'Plain', 'bootstrap_type': 'Bayesian', 'bagging_temperature': 9.988135273870189}. Best is trial 3065 with value: 0.8863636363636364.
[32m[I 2023-04-21 03:24:58,741][39m Trial 5644 finished with value: 0.8666666666666666 and parameters: {'objective': 'Logloss', 'colsample_bylevel': 0.08133389290690754, 'depth': 3, 'boosting_type': 'Plain', 'bootstrap_type': 'Bayesian', 'bagging_temperature': 9.423461348124826}. Best is trial 3065 with value: 0.8863636363636364.
[32m[I 2023-04-21 03:25:00,115][39m Trial 5645 finished with value: 0.8539325842696629 and parameters: {'objective': 'Logloss', 'colsample_bylevel': 0.0695081143630185, 'depth': 8, 'boosting_type': 'Plain', 'bootstrap_type': 'Bayesian', 'bagging_temperature': 8.225685016080769}. Best is trial 3065 with value: 0.8863636363636364.
[32m[I 2023-04-21 03:25:01,297][39m Trial 5646 finished with value: 0.8409090909090909 and parameters: {'objective': 'CrossEntropy', 'colsample_bylevel': 0.05092260576041552, 'depth': 4, 'boosting_type': 'Plain', 'bootstrap_type': 'Bayesian', 'bagging_temperature': 9.852695223014305}. Best is trial 3065 with value: 0.8863636363636364.
[32m[I 2023-04-21 03:25:02,320][39m Trial 5647 finished with value: 0.8791208791208791 and parameters: {'objective': 'CrossEntropy', 'colsample_bylevel': 0.08701477821260856, 'depth': 3, 'boosting_type': 'Plain', 'bootstrap_type': 'Bayesian', 'bagging_temperature': 9.695553732193888}. Best is trial 3065 with value: 0.8863636363636364.
[32m[I 2023-04-21 03:25:03,054][39m Trial 5648 finished with value: 0.8666666666666666 and parameters: {'objective': 'Logloss', 'colsample_bylevel': 0.0870567978802453, 'depth': 3, 'boosting_type': 'Plain', 'bootstrap_type': 'Bayesian', 'bagging_temperature': 9.62942390649555}. Best is trial 3065 with value: 0.8863636363636364.
[32m[I 2023-04-21 03:25:03,947][39m Trial 5649 finished with value: 0.8791208791208791 and parameters: {'objective': 'CrossEntropy', 'colsample_bylevel': 0.08695739741579323, 'depth': 3, 'boosting_type': 'Plain', 'bootstrap_type': 'Bayesian', 'bagging_temperature': 9.520323494711171}. Best is trial 3065 with value: 0.8863636363636364.
[32m[I 2023-04-21 03:25:05,350][39m Trial 5650 finished with value: 0.8666666666666666 and parameters: {'objective': 'CrossEntropy', 'colsample_bylevel': 0.08249437290597957, 'depth': 3, 'boosting_type': 'Plain', 'bootstrap_type': 'Bayesian', 'bagging_temperature': 9.377706550835901}. Best is trial 3065 with value: 0.8863636363636364.
[32m[I 2023-04-21 03:25:06,854][39m Trial 5651 finished with value: 0.8275862068965518 and parameters: {'objective': 'CrossEntropy', 'colsample_bylevel': 0.08758952382687757, 'depth': 8, 'boosting_type': 'Plain', 'bootstrap_type': 'Bayesian', 'bagging_temperature': 5.122928039959515}. Best is trial 3065 with value: 0.8863636363636364.
[32m[I 2023-04-21 03:25:07,749][39m Trial 5652 finished with value: 0.8539325842696629 and parameters: {'objective': 'Logloss', 'colsample_bylevel': 0.09702817105832888, 'depth': 6, 'boosting_type': 'Plain', 'bootstrap_type': 'Bayesian', 'bagging_temperature': 8.788672896464428}. Best is trial 3065 with value: 0.8863636363636364.
