[32m[I 2023-04-21 01:39:44,209][39m Trial 200 finished with value: 0.8409090909090909 and parameters: {'objective': 'CrossEntropy', 'colsample_bylevel': 0.09356295413597107, 'depth': 2, 'boosting_type': 'Plain', 'bootstrap_type': 'Bayesian', 'bagging_temperature': 5.414752004293886}. Best is trial 98 with value: 0.8791208791208791.
[32m[I 2023-04-21 01:39:44,856][39m Trial 201 finished with value: 0.8409090909090909 and parameters: {'objective': 'CrossEntropy', 'colsample_bylevel': 0.07316578504967015, 'depth': 2, 'boosting_type': 'Plain', 'bootstrap_type': 'Bayesian', 'bagging_temperature': 9.314374410986355}. Best is trial 98 with value: 0.8791208791208791.
[32m[I 2023-04-21 01:39:45,429][39m Trial 202 finished with value: 0.8666666666666666 and parameters: {'objective': 'CrossEntropy', 'colsample_bylevel': 0.0790896327856074, 'depth': 2, 'boosting_type': 'Plain', 'bootstrap_type': 'Bayesian', 'bagging_temperature': 9.994319529976615}. Best is trial 98 with value: 0.8791208791208791.
[32m[I 2023-04-21 01:39:46,204][39m Trial 203 finished with value: 0.8666666666666666 and parameters: {'objective': 'CrossEntropy', 'colsample_bylevel': 0.08302000505255007, 'depth': 3, 'boosting_type': 'Plain', 'bootstrap_type': 'Bayesian', 'bagging_temperature': 9.993675802053883}. Best is trial 98 with value: 0.8791208791208791.
[32m[I 2023-04-21 01:39:47,192][39m Trial 204 finished with value: 0.8666666666666666 and parameters: {'objective': 'CrossEntropy', 'colsample_bylevel': 0.08181130343374368, 'depth': 3, 'boosting_type': 'Plain', 'bootstrap_type': 'Bayesian', 'bagging_temperature': 9.601978469109504}. Best is trial 98 with value: 0.8791208791208791.
[32m[I 2023-04-21 01:39:47,838][39m Trial 205 finished with value: 0.8372093023255814 and parameters: {'objective': 'CrossEntropy', 'colsample_bylevel': 0.07492114761401342, 'depth': 2, 'boosting_type': 'Plain', 'bootstrap_type': 'Bayesian', 'bagging_temperature': 9.80321836121851}. Best is trial 98 with value: 0.8791208791208791.
[32m[I 2023-04-21 01:39:48,583][39m Trial 206 finished with value: 0.8666666666666666 and parameters: {'objective': 'CrossEntropy', 'colsample_bylevel': 0.08619244971315251, 'depth': 3, 'boosting_type': 'Plain', 'bootstrap_type': 'Bayesian', 'bagging_temperature': 9.331107775622995}. Best is trial 98 with value: 0.8791208791208791.
[32m[I 2023-04-21 01:39:49,542][39m Trial 207 finished with value: 0.8275862068965518 and parameters: {'objective': 'CrossEntropy', 'colsample_bylevel': 0.09133909878170618, 'depth': 3, 'boosting_type': 'Plain', 'bootstrap_type': 'Bayesian', 'bagging_temperature': 9.377312122451537}. Best is trial 98 with value: 0.8791208791208791.
[32m[I 2023-04-21 01:39:50,370][39m Trial 208 finished with value: 0.8314606741573034 and parameters: {'objective': 'CrossEntropy', 'colsample_bylevel': 0.07847205660319673, 'depth': 2, 'boosting_type': 'Plain', 'bootstrap_type': 'MVS'}. Best is trial 98 with value: 0.8791208791208791.
[32m[I 2023-04-21 01:39:51,055][39m Trial 209 finished with value: 0.8539325842696629 and parameters: {'objective': 'CrossEntropy', 'colsample_bylevel': 0.08012161279762496, 'depth': 4, 'boosting_type': 'Plain', 'bootstrap_type': 'Bayesian', 'bagging_temperature': 8.406933151257737}. Best is trial 98 with value: 0.8791208791208791.
[32m[I 2023-04-21 01:39:51,963][39m Trial 210 finished with value: 0.8539325842696629 and parameters: {'objective': 'CrossEntropy', 'colsample_bylevel': 0.08387316578063712, 'depth': 3, 'boosting_type': 'Plain', 'bootstrap_type': 'Bayesian', 'bagging_temperature': 9.62796980613721}. Best is trial 98 with value: 0.8791208791208791.
[32m[I 2023-04-21 01:39:52,809][39m Trial 211 finished with value: 0.8666666666666666 and parameters: {'objective': 'CrossEntropy', 'colsample_bylevel': 0.07577619788789453, 'depth': 2, 'boosting_type': 'Plain', 'bootstrap_type': 'Bayesian', 'bagging_temperature': 9.08684596242772}. Best is trial 98 with value: 0.8791208791208791.
[32m[I 2023-04-21 01:39:53,706][39m Trial 212 finished with value: 0.8139534883720929 and parameters: {'objective': 'CrossEntropy', 'colsample_bylevel': 0.08858736241376518, 'depth': 3, 'boosting_type': 'Plain', 'bootstrap_type': 'Bayesian', 'bagging_temperature': 9.653882084718223}. Best is trial 98 with value: 0.8791208791208791.
[32m[I 2023-04-21 01:39:54,497][39m Trial 213 finished with value: 0.8636363636363636 and parameters: {'objective': 'CrossEntropy', 'colsample_bylevel': 0.07422095198716695, 'depth': 2, 'boosting_type': 'Plain', 'bootstrap_type': 'Bayesian', 'bagging_temperature': 9.027163183226971}. Best is trial 98 with value: 0.8791208791208791.
[32m[I 2023-04-21 01:39:55,107][39m Trial 214 finished with value: 0.8539325842696629 and parameters: {'objective': 'CrossEntropy', 'colsample_bylevel': 0.08840632350966175, 'depth': 2, 'boosting_type': 'Plain', 'bootstrap_type': 'Bayesian', 'bagging_temperature': 8.770918266687188}. Best is trial 98 with value: 0.8791208791208791.
[32m[I 2023-04-21 01:39:55,798][39m Trial 215 finished with value: 0.8666666666666666 and parameters: {'objective': 'CrossEntropy', 'colsample_bylevel': 0.08604849427462029, 'depth': 2, 'boosting_type': 'Plain', 'bootstrap_type': 'Bayesian', 'bagging_temperature': 9.8030903365469}. Best is trial 98 with value: 0.8791208791208791.
[32m[I 2023-04-21 01:39:56,711][39m Trial 216 finished with value: 0.8333333333333333 and parameters: {'objective': 'CrossEntropy', 'colsample_bylevel': 0.08766296605880626, 'depth': 1, 'boosting_type': 'Plain', 'bootstrap_type': 'Bayesian', 'bagging_temperature': 8.87489900046289}. Best is trial 98 with value: 0.8791208791208791.
[32m[I 2023-04-21 01:39:57,587][39m Trial 217 finished with value: 0.8089887640449439 and parameters: {'objective': 'CrossEntropy', 'colsample_bylevel': 0.07712429359931312, 'depth': 2, 'boosting_type': 'Plain', 'bootstrap_type': 'Bayesian', 'bagging_temperature': 1.024695282344244}. Best is trial 98 with value: 0.8791208791208791.
[32m[I 2023-04-21 01:39:58,650][39m Trial 218 finished with value: 0.7578947368421053 and parameters: {'objective': 'CrossEntropy', 'colsample_bylevel': 0.011313944610930916, 'depth': 3, 'boosting_type': 'Plain', 'bootstrap_type': 'Bayesian', 'bagging_temperature': 8.386259626222051}. Best is trial 98 with value: 0.8791208791208791.
[32m[I 2023-04-21 01:39:59,336][39m Trial 219 finished with value: 0.8539325842696629 and parameters: {'objective': 'CrossEntropy', 'colsample_bylevel': 0.08355396271544165, 'depth': 2, 'boosting_type': 'Plain', 'bootstrap_type': 'Bayesian', 'bagging_temperature': 8.0657274721988}. Best is trial 98 with value: 0.8791208791208791.
[32m[I 2023-04-21 01:39:59,965][39m Trial 220 finished with value: 0.8181818181818182 and parameters: {'objective': 'CrossEntropy', 'colsample_bylevel': 0.09033863583211738, 'depth': 1, 'boosting_type': 'Plain', 'bootstrap_type': 'Bayesian', 'bagging_temperature': 9.753469843296397}. Best is trial 98 with value: 0.8791208791208791.
[32m[I 2023-04-21 01:40:00,917][39m Trial 221 finished with value: 0.8636363636363636 and parameters: {'objective': 'CrossEntropy', 'colsample_bylevel': 0.07838392214224366, 'depth': 2, 'boosting_type': 'Plain', 'bootstrap_type': 'Bayesian', 'bagging_temperature': 8.320752134195585}. Best is trial 98 with value: 0.8791208791208791.
[32m[I 2023-04-21 01:40:01,916][39m Trial 222 finished with value: 0.8666666666666666 and parameters: {'objective': 'CrossEntropy', 'colsample_bylevel': 0.08790377144674938, 'depth': 3, 'boosting_type': 'Plain', 'bootstrap_type': 'Bayesian', 'bagging_temperature': 9.238723919003673}. Best is trial 98 with value: 0.8791208791208791.
[32m[I 2023-04-21 01:40:02,483][39m Trial 223 finished with value: 0.8539325842696629 and parameters: {'objective': 'CrossEntropy', 'colsample_bylevel': 0.07890139753723327, 'depth': 2, 'boosting_type': 'Plain', 'bootstrap_type': 'Bayesian', 'bagging_temperature': 9.86568062098953}. Best is trial 98 with value: 0.8791208791208791.
[32m[I 2023-04-21 01:40:03,239][39m Trial 224 finished with value: 0.8636363636363636 and parameters: {'objective': 'CrossEntropy', 'colsample_bylevel': 0.07846844489899242, 'depth': 2, 'boosting_type': 'Plain', 'bootstrap_type': 'Bayesian', 'bagging_temperature': 7.682175632250942}. Best is trial 98 with value: 0.8791208791208791.
[32m[I 2023-04-21 01:40:04,092][39m Trial 225 finished with value: 0.8791208791208791 and parameters: {'objective': 'CrossEntropy', 'colsample_bylevel': 0.09393847515277777, 'depth': 3, 'boosting_type': 'Plain', 'bootstrap_type': 'Bayesian', 'bagging_temperature': 9.411518329868462}. Best is trial 98 with value: 0.8791208791208791.
[32m[I 2023-04-21 01:40:04,957][39m Trial 226 finished with value: 0.8409090909090909 and parameters: {'objective': 'CrossEntropy', 'colsample_bylevel': 0.0928339538007676, 'depth': 3, 'boosting_type': 'Plain', 'bootstrap_type': 'Bayesian', 'bagging_temperature': 9.482823779225631}. Best is trial 98 with value: 0.8791208791208791.
[32m[I 2023-04-21 01:40:05,623][39m Trial 227 finished with value: 0.8539325842696629 and parameters: {'objective': 'CrossEntropy', 'colsample_bylevel': 0.0849887141545052, 'depth': 3, 'boosting_type': 'Plain', 'bootstrap_type': 'Bayesian', 'bagging_temperature': 9.455323685425777}. Best is trial 98 with value: 0.8791208791208791.
[32m[I 2023-04-21 01:40:06,592][39m Trial 228 finished with value: 0.8764044943820225 and parameters: {'objective': 'CrossEntropy', 'colsample_bylevel': 0.09073233340885013, 'depth': 2, 'boosting_type': 'Plain', 'bootstrap_type': 'Bayesian', 'bagging_temperature': 9.7681128402175}. Best is trial 98 with value: 0.8791208791208791.
[32m[I 2023-04-21 01:40:07,676][39m Trial 229 finished with value: 0.8636363636363636 and parameters: {'objective': 'CrossEntropy', 'colsample_bylevel': 0.08245580672259849, 'depth': 2, 'boosting_type': 'Plain', 'bootstrap_type': 'Bayesian', 'bagging_temperature': 9.512470540771329}. Best is trial 98 with value: 0.8791208791208791.
[32m[I 2023-04-21 01:40:08,718][39m Trial 230 finished with value: 0.8539325842696629 and parameters: {'objective': 'CrossEntropy', 'colsample_bylevel': 0.08951197996723054, 'depth': 2, 'boosting_type': 'Plain', 'bootstrap_type': 'Bayesian', 'bagging_temperature': 8.52499093588663}. Best is trial 98 with value: 0.8791208791208791.
[32m[I 2023-04-21 01:40:09,412][39m Trial 231 finished with value: 0.8539325842696629 and parameters: {'objective': 'CrossEntropy', 'colsample_bylevel': 0.08419286207828655, 'depth': 2, 'boosting_type': 'Plain', 'bootstrap_type': 'Bayesian', 'bagging_temperature': 9.28189663651378}. Best is trial 98 with value: 0.8791208791208791.
[32m[I 2023-04-21 01:40:10,036][39m Trial 232 finished with value: 0.8409090909090909 and parameters: {'objective': 'CrossEntropy', 'colsample_bylevel': 0.09616695563978982, 'depth': 3, 'boosting_type': 'Plain', 'bootstrap_type': 'Bayesian', 'bagging_temperature': 9.74568494923233}. Best is trial 98 with value: 0.8791208791208791.
[32m[I 2023-04-21 01:40:10,864][39m Trial 233 finished with value: 0.8764044943820225 and parameters: {'objective': 'CrossEntropy', 'colsample_bylevel': 0.08520110067489313, 'depth': 2, 'boosting_type': 'Plain', 'bootstrap_type': 'Bayesian', 'bagging_temperature': 9.950003401796822}. Best is trial 98 with value: 0.8791208791208791.
[32m[I 2023-04-21 01:40:11,690][39m Trial 234 finished with value: 0.8409090909090909 and parameters: {'objective': 'CrossEntropy', 'colsample_bylevel': 0.08055560342974076, 'depth': 2, 'boosting_type': 'Plain', 'bootstrap_type': 'Bayesian', 'bagging_temperature': 9.961291980102063}. Best is trial 98 with value: 0.8791208791208791.
[32m[I 2023-04-21 01:40:12,689][39m Trial 235 finished with value: 0.8539325842696629 and parameters: {'objective': 'CrossEntropy', 'colsample_bylevel': 0.08485496465159395, 'depth': 2, 'boosting_type': 'Plain', 'bootstrap_type': 'Bayesian', 'bagging_temperature': 9.546645480758857}. Best is trial 98 with value: 0.8791208791208791.
[32m[I 2023-04-21 01:40:13,368][39m Trial 236 finished with value: 0.8333333333333333 and parameters: {'objective': 'CrossEntropy', 'colsample_bylevel': 0.09469688524568262, 'depth': 1, 'boosting_type': 'Plain', 'bootstrap_type': 'Bayesian', 'bagging_temperature': 9.77157468676301}. Best is trial 98 with value: 0.8791208791208791.
[32m[I 2023-04-21 01:40:14,009][39m Trial 237 finished with value: 0.8764044943820225 and parameters: {'objective': 'CrossEntropy', 'colsample_bylevel': 0.08218669502616009, 'depth': 2, 'boosting_type': 'Plain', 'bootstrap_type': 'Bayesian', 'bagging_temperature': 9.985918922736701}. Best is trial 98 with value: 0.8791208791208791.
[32m[I 2023-04-21 01:40:15,161][39m Trial 238 finished with value: 0.8539325842696629 and parameters: {'objective': 'CrossEntropy', 'colsample_bylevel': 0.09201838707682282, 'depth': 2, 'boosting_type': 'Plain', 'bootstrap_type': 'Bayesian', 'bagging_temperature': 9.152945200757749}. Best is trial 98 with value: 0.8791208791208791.
[32m[I 2023-04-21 01:40:16,298][39m Trial 239 finished with value: 0.8275862068965518 and parameters: {'objective': 'CrossEntropy', 'colsample_bylevel': 0.08666365832223775, 'depth': 3, 'boosting_type': 'Plain', 'bootstrap_type': 'Bayesian', 'bagging_temperature': 9.489900308422708}. Best is trial 98 with value: 0.8791208791208791.
[32m[I 2023-04-21 01:40:16,912][39m Trial 240 finished with value: 0.8791208791208791 and parameters: {'objective': 'CrossEntropy', 'colsample_bylevel': 0.08197002546572663, 'depth': 3, 'boosting_type': 'Plain', 'bootstrap_type': 'Bayesian', 'bagging_temperature': 9.278407672505566}. Best is trial 98 with value: 0.8791208791208791.
[32m[I 2023-04-21 01:40:17,709][39m Trial 241 finished with value: 0.8764044943820225 and parameters: {'objective': 'CrossEntropy', 'colsample_bylevel': 0.07546823016471685, 'depth': 2, 'boosting_type': 'Plain', 'bootstrap_type': 'Bayesian', 'bagging_temperature': 9.94968369858031}. Best is trial 98 with value: 0.8791208791208791.
[32m[I 2023-04-21 01:40:18,602][39m Trial 242 finished with value: 0.8666666666666666 and parameters: {'objective': 'CrossEntropy', 'colsample_bylevel': 0.07607439962441359, 'depth': 2, 'boosting_type': 'Plain', 'bootstrap_type': 'Bayesian', 'bagging_temperature': 9.966314932150217}. Best is trial 98 with value: 0.8791208791208791.
[32m[I 2023-04-21 01:40:19,609][39m Trial 243 finished with value: 0.8636363636363636 and parameters: {'objective': 'CrossEntropy', 'colsample_bylevel': 0.0906053367706124, 'depth': 2, 'boosting_type': 'Plain', 'bootstrap_type': 'Bayesian', 'bagging_temperature': 9.687473117526801}. Best is trial 98 with value: 0.8791208791208791.
[32m[I 2023-04-21 01:40:20,287][39m Trial 244 finished with value: 0.8539325842696629 and parameters: {'objective': 'CrossEntropy', 'colsample_bylevel': 0.09356281489472865, 'depth': 3, 'boosting_type': 'Plain', 'bootstrap_type': 'Bayesian', 'bagging_temperature': 9.56287556854471}. Best is trial 98 with value: 0.8791208791208791.
[32m[I 2023-04-21 01:40:21,176][39m Trial 245 finished with value: 0.8666666666666666 and parameters: {'objective': 'CrossEntropy', 'colsample_bylevel': 0.08282426063226458, 'depth': 2, 'boosting_type': 'Plain', 'bootstrap_type': 'Bayesian', 'bagging_temperature': 9.883439732879449}. Best is trial 98 with value: 0.8791208791208791.
[32m[I 2023-04-21 01:40:21,999][39m Trial 246 finished with value: 0.8666666666666666 and parameters: {'objective': 'CrossEntropy', 'colsample_bylevel': 0.08218173574414059, 'depth': 2, 'boosting_type': 'Plain', 'bootstrap_type': 'Bayesian', 'bagging_temperature': 9.371474224672443}. Best is trial 98 with value: 0.8791208791208791.
[32m[I 2023-04-21 01:40:22,906][39m Trial 247 finished with value: 0.8275862068965518 and parameters: {'objective': 'CrossEntropy', 'colsample_bylevel': 0.09704341578986196, 'depth': 3, 'boosting_type': 'Plain', 'bootstrap_type': 'Bayesian', 'bagging_temperature': 9.598705477212464}. Best is trial 98 with value: 0.8791208791208791.
[32m[I 2023-04-21 01:40:23,578][39m Trial 248 finished with value: 0.8539325842696629 and parameters: {'objective': 'CrossEntropy', 'colsample_bylevel': 0.08776280357506905, 'depth': 2, 'boosting_type': 'Plain', 'bootstrap_type': 'MVS'}. Best is trial 98 with value: 0.8791208791208791.
[32m[I 2023-04-21 01:40:24,319][39m Trial 249 finished with value: 0.8636363636363636 and parameters: {'objective': 'CrossEntropy', 'colsample_bylevel': 0.08122174370314234, 'depth': 2, 'boosting_type': 'Plain', 'bootstrap_type': 'Bayesian', 'bagging_temperature': 9.23187326624964}. Best is trial 98 with value: 0.8791208791208791.
[32m[I 2023-04-21 01:40:25,316][39m Trial 250 finished with value: 0.8539325842696629 and parameters: {'objective': 'CrossEntropy', 'colsample_bylevel': 0.07714437178753696, 'depth': 2, 'boosting_type': 'Plain', 'bootstrap_type': 'Bayesian', 'bagging_temperature': 9.909105012666311}. Best is trial 98 with value: 0.8791208791208791.
[32m[I 2023-04-21 01:40:26,020][39m Trial 251 finished with value: 0.8764044943820225 and parameters: {'objective': 'CrossEntropy', 'colsample_bylevel': 0.08441351301886274, 'depth': 2, 'boosting_type': 'Plain', 'bootstrap_type': 'Bayesian', 'bagging_temperature': 9.817358980397707}. Best is trial 98 with value: 0.8791208791208791.
[32m[I 2023-04-21 01:40:27,065][39m Trial 252 finished with value: 0.8372093023255814 and parameters: {'objective': 'CrossEntropy', 'colsample_bylevel': 0.08446033723876692, 'depth': 1, 'boosting_type': 'Plain', 'bootstrap_type': 'Bayesian', 'bagging_temperature': 9.994457370529737}. Best is trial 98 with value: 0.8791208791208791.
[32m[I 2023-04-21 01:40:27,808][39m Trial 253 finished with value: 0.8764044943820225 and parameters: {'objective': 'CrossEntropy', 'colsample_bylevel': 0.08135462583479731, 'depth': 2, 'boosting_type': 'Plain', 'bootstrap_type': 'Bayesian', 'bagging_temperature': 9.763622416117482}. Best is trial 98 with value: 0.8791208791208791.
[32m[I 2023-04-21 01:40:28,772][39m Trial 254 finished with value: 0.8275862068965518 and parameters: {'objective': 'CrossEntropy', 'colsample_bylevel': 0.08077197555311398, 'depth': 4, 'boosting_type': 'Plain', 'bootstrap_type': 'Bayesian', 'bagging_temperature': 9.647269219908512}. Best is trial 98 with value: 0.8791208791208791.
[32m[I 2023-04-21 01:40:29,605][39m Trial 255 finished with value: 0.8666666666666666 and parameters: {'objective': 'CrossEntropy', 'colsample_bylevel': 0.08274125678729978, 'depth': 2, 'boosting_type': 'Plain', 'bootstrap_type': 'Bayesian', 'bagging_temperature': 9.85716591668669}. Best is trial 98 with value: 0.8791208791208791.
[32m[I 2023-04-21 01:40:30,482][39m Trial 256 finished with value: 0.8666666666666666 and parameters: {'objective': 'CrossEntropy', 'colsample_bylevel': 0.09095625352704605, 'depth': 3, 'boosting_type': 'Plain', 'bootstrap_type': 'Bayesian', 'bagging_temperature': 9.688339228025225}. Best is trial 98 with value: 0.8791208791208791.
[32m[I 2023-04-21 01:40:31,082][39m Trial 257 finished with value: 0.8409090909090909 and parameters: {'objective': 'CrossEntropy', 'colsample_bylevel': 0.08644466307156927, 'depth': 3, 'boosting_type': 'Plain', 'bootstrap_type': 'Bayesian', 'bagging_temperature': 9.341038834163957}. Best is trial 98 with value: 0.8791208791208791.
[32m[I 2023-04-21 01:40:31,961][39m Trial 258 finished with value: 0.8636363636363636 and parameters: {'objective': 'CrossEntropy', 'colsample_bylevel': 0.08739277221948723, 'depth': 2, 'boosting_type': 'Plain', 'bootstrap_type': 'Bayesian', 'bagging_temperature': 9.775859278480409}. Best is trial 98 with value: 0.8791208791208791.
[32m[I 2023-04-21 01:40:32,750][39m Trial 259 finished with value: 0.8409090909090909 and parameters: {'objective': 'CrossEntropy', 'colsample_bylevel': 0.08517754033248154, 'depth': 3, 'boosting_type': 'Plain', 'bootstrap_type': 'Bayesian', 'bagging_temperature': 9.574675022664746}. Best is trial 98 with value: 0.8791208791208791.
[32m[I 2023-04-21 01:40:33,534][39m Trial 260 finished with value: 0.8666666666666666 and parameters: {'objective': 'CrossEntropy', 'colsample_bylevel': 0.07916429526756895, 'depth': 2, 'boosting_type': 'Plain', 'bootstrap_type': 'Bayesian', 'bagging_temperature': 9.939279013231179}. Best is trial 98 with value: 0.8791208791208791.
[32m[I 2023-04-21 01:40:34,150][39m Trial 261 finished with value: 0.8139534883720929 and parameters: {'objective': 'CrossEntropy', 'colsample_bylevel': 0.07881975016059631, 'depth': 2, 'boosting_type': 'Plain', 'bootstrap_type': 'Bayesian', 'bagging_temperature': 9.968808526016241}. Best is trial 98 with value: 0.8791208791208791.
[32m[I 2023-04-21 01:40:35,149][39m Trial 262 finished with value: 0.8409090909090909 and parameters: {'objective': 'CrossEntropy', 'colsample_bylevel': 0.08403110022254623, 'depth': 4, 'boosting_type': 'Plain', 'bootstrap_type': 'Bayesian', 'bagging_temperature': 9.739020967927216}. Best is trial 98 with value: 0.8791208791208791.
[32m[I 2023-04-21 01:40:35,816][39m Trial 263 finished with value: 0.8666666666666666 and parameters: {'objective': 'CrossEntropy', 'colsample_bylevel': 0.07924135237637393, 'depth': 2, 'boosting_type': 'Plain', 'bootstrap_type': 'Bayesian', 'bagging_temperature': 9.994558777375392}. Best is trial 98 with value: 0.8791208791208791.
[32m[I 2023-04-21 01:40:36,673][39m Trial 264 finished with value: 0.8539325842696629 and parameters: {'objective': 'CrossEntropy', 'colsample_bylevel': 0.08264860142565914, 'depth': 3, 'boosting_type': 'Plain', 'bootstrap_type': 'Bayesian', 'bagging_temperature': 9.017435575741926}. Best is trial 98 with value: 0.8791208791208791.
