[32m[I 2023-04-21 02:30:28,739][39m Trial 2974 finished with value: 0.8539325842696629 and parameters: {'objective': 'CrossEntropy', 'colsample_bylevel': 0.07862378602471515, 'depth': 10, 'boosting_type': 'Plain', 'bootstrap_type': 'Bayesian', 'bagging_temperature': 9.567704213174984}. Best is trial 98 with value: 0.8791208791208791.
[32m[I 2023-04-21 02:30:29,871][39m Trial 2975 finished with value: 0.8505747126436782 and parameters: {'objective': 'CrossEntropy', 'colsample_bylevel': 0.08334793760297059, 'depth': 9, 'boosting_type': 'Plain', 'bootstrap_type': 'Bayesian', 'bagging_temperature': 9.621971789207317}. Best is trial 98 with value: 0.8791208791208791.
[32m[I 2023-04-21 02:30:30,516][39m Trial 2976 finished with value: 0.8666666666666666 and parameters: {'objective': 'CrossEntropy', 'colsample_bylevel': 0.08391336496345021, 'depth': 3, 'boosting_type': 'Plain', 'bootstrap_type': 'Bayesian', 'bagging_temperature': 9.234692943933467}. Best is trial 98 with value: 0.8791208791208791.
[32m[I 2023-04-21 02:30:31,416][39m Trial 2977 finished with value: 0.8539325842696629 and parameters: {'objective': 'CrossEntropy', 'colsample_bylevel': 0.08461681269719935, 'depth': 3, 'boosting_type': 'Plain', 'bootstrap_type': 'Bayesian', 'bagging_temperature': 9.248625917278034}. Best is trial 98 with value: 0.8791208791208791.
[32m[I 2023-04-21 02:30:32,478][39m Trial 2978 finished with value: 0.8409090909090909 and parameters: {'objective': 'CrossEntropy', 'colsample_bylevel': 0.09007446459279693, 'depth': 4, 'boosting_type': 'Plain', 'bootstrap_type': 'Bayesian', 'bagging_temperature': 8.646870830642973}. Best is trial 98 with value: 0.8791208791208791.
[32m[I 2023-04-21 02:30:33,739][39m Trial 2979 finished with value: 0.8409090909090909 and parameters: {'objective': 'CrossEntropy', 'colsample_bylevel': 0.07911243095312408, 'depth': 10, 'boosting_type': 'Plain', 'bootstrap_type': 'Bayesian', 'bagging_temperature': 9.997856909160724}. Best is trial 98 with value: 0.8791208791208791.
[32m[I 2023-04-21 02:30:34,804][39m Trial 2980 finished with value: 0.8791208791208791 and parameters: {'objective': 'CrossEntropy', 'colsample_bylevel': 0.08043292895412626, 'depth': 3, 'boosting_type': 'Plain', 'bootstrap_type': 'Bayesian', 'bagging_temperature': 8.542217278592727}. Best is trial 98 with value: 0.8791208791208791.
[32m[I 2023-04-21 02:30:35,485][39m Trial 2981 finished with value: 0.8636363636363636 and parameters: {'objective': 'CrossEntropy', 'colsample_bylevel': 0.09148840743281156, 'depth': 4, 'boosting_type': 'Plain', 'bootstrap_type': 'Bayesian', 'bagging_temperature': 8.472201237073039}. Best is trial 98 with value: 0.8791208791208791.
[32m[I 2023-04-21 02:30:36,769][39m Trial 2982 finished with value: 0.8409090909090909 and parameters: {'objective': 'Logloss', 'colsample_bylevel': 0.07788805021156435, 'depth': 9, 'boosting_type': 'Plain', 'bootstrap_type': 'Bayesian', 'bagging_temperature': 8.32287804812068}. Best is trial 98 with value: 0.8791208791208791.
[32m[I 2023-04-21 02:30:37,774][39m Trial 2983 finished with value: 0.8275862068965518 and parameters: {'objective': 'CrossEntropy', 'colsample_bylevel': 0.08395609621072136, 'depth': 3, 'boosting_type': 'Plain', 'bootstrap_type': 'MVS'}. Best is trial 98 with value: 0.8791208791208791.
[32m[I 2023-04-21 02:30:38,570][39m Trial 2984 finished with value: 0.8409090909090909 and parameters: {'objective': 'Logloss', 'colsample_bylevel': 0.08191973743089802, 'depth': 4, 'boosting_type': 'Plain', 'bootstrap_type': 'Bayesian', 'bagging_temperature': 9.833469556907867}. Best is trial 98 with value: 0.8791208791208791.
[32m[I 2023-04-21 02:30:39,282][39m Trial 2985 finished with value: 0.8539325842696629 and parameters: {'objective': 'CrossEntropy', 'colsample_bylevel': 0.07090345855504818, 'depth': 9, 'boosting_type': 'Plain', 'bootstrap_type': 'Bayesian', 'bagging_temperature': 9.45949190067855}. Best is trial 98 with value: 0.8791208791208791.
[32m[I 2023-04-21 02:30:40,221][39m Trial 2986 finished with value: 0.8666666666666666 and parameters: {'objective': 'CrossEntropy', 'colsample_bylevel': 0.08314726051253987, 'depth': 3, 'boosting_type': 'Plain', 'bootstrap_type': 'Bayesian', 'bagging_temperature': 9.08569723306572}. Best is trial 98 with value: 0.8791208791208791.
[32m[I 2023-04-21 02:30:41,137][39m Trial 2987 finished with value: 0.8539325842696629 and parameters: {'objective': 'Logloss', 'colsample_bylevel': 0.07930985428435323, 'depth': 5, 'boosting_type': 'Plain', 'bootstrap_type': 'Bayesian', 'bagging_temperature': 9.223784030813066}. Best is trial 98 with value: 0.8791208791208791.
[32m[I 2023-04-21 02:30:42,185][39m Trial 2988 finished with value: 0.8409090909090909 and parameters: {'objective': 'CrossEntropy', 'colsample_bylevel': 0.08220722385590011, 'depth': 3, 'boosting_type': 'Plain', 'bootstrap_type': 'Bayesian', 'bagging_temperature': 9.783965566027495}. Best is trial 98 with value: 0.8791208791208791.
[32m[I 2023-04-21 02:30:43,089][39m Trial 2989 finished with value: 0.8764044943820225 and parameters: {'objective': 'Logloss', 'colsample_bylevel': 0.0842179161252659, 'depth': 2, 'boosting_type': 'Plain', 'bootstrap_type': 'Bayesian', 'bagging_temperature': 8.767795411962103}. Best is trial 98 with value: 0.8791208791208791.
[32m[I 2023-04-21 02:30:47,819][39m Trial 2990 finished with value: 0.8131868131868132 and parameters: {'objective': 'CrossEntropy', 'colsample_bylevel': 0.07563886603833975, 'depth': 11, 'boosting_type': 'Ordered', 'bootstrap_type': 'Bernoulli', 'subsample': 0.8176803885366135}. Best is trial 98 with value: 0.8791208791208791.
[32m[I 2023-04-21 02:30:48,822][39m Trial 2991 finished with value: 0.8764044943820225 and parameters: {'objective': 'CrossEntropy', 'colsample_bylevel': 0.07846002377639061, 'depth': 2, 'boosting_type': 'Plain', 'bootstrap_type': 'Bayesian', 'bagging_temperature': 9.718971710874461}. Best is trial 98 with value: 0.8791208791208791.
[32m[I 2023-04-21 02:30:50,012][39m Trial 2992 finished with value: 0.8505747126436782 and parameters: {'objective': 'CrossEntropy', 'colsample_bylevel': 0.08246264925973777, 'depth': 8, 'boosting_type': 'Plain', 'bootstrap_type': 'Bayesian', 'bagging_temperature': 9.074261769342556}. Best is trial 98 with value: 0.8791208791208791.
[32m[I 2023-04-21 02:30:50,695][39m Trial 2993 finished with value: 0.8409090909090909 and parameters: {'objective': 'CrossEntropy', 'colsample_bylevel': 0.08120412710827697, 'depth': 3, 'boosting_type': 'Plain', 'bootstrap_type': 'Bayesian', 'bagging_temperature': 8.780912311214648}. Best is trial 98 with value: 0.8791208791208791.
[32m[I 2023-04-21 02:30:51,975][39m Trial 2994 finished with value: 0.8764044943820225 and parameters: {'objective': 'CrossEntropy', 'colsample_bylevel': 0.08455083470310343, 'depth': 2, 'boosting_type': 'Plain', 'bootstrap_type': 'Bayesian', 'bagging_temperature': 9.620867256503123}. Best is trial 98 with value: 0.8791208791208791.
[32m[I 2023-04-21 02:30:52,670][39m Trial 2995 finished with value: 0.8666666666666666 and parameters: {'objective': 'Logloss', 'colsample_bylevel': 0.07659278113886417, 'depth': 4, 'boosting_type': 'Plain', 'bootstrap_type': 'Bayesian', 'bagging_temperature': 9.976463669617898}. Best is trial 98 with value: 0.8791208791208791.
[32m[I 2023-04-21 02:30:53,714][39m Trial 2996 finished with value: 0.8409090909090909 and parameters: {'objective': 'CrossEntropy', 'colsample_bylevel': 0.07820823128888983, 'depth': 3, 'boosting_type': 'Plain', 'bootstrap_type': 'MVS'}. Best is trial 98 with value: 0.8791208791208791.
[32m[I 2023-04-21 02:30:54,621][39m Trial 2997 finished with value: 0.8409090909090909 and parameters: {'objective': 'CrossEntropy', 'colsample_bylevel': 0.08098242975357899, 'depth': 10, 'boosting_type': 'Plain', 'bootstrap_type': 'Bayesian', 'bagging_temperature': 9.322706765921215}. Best is trial 98 with value: 0.8791208791208791.
[32m[I 2023-04-21 02:30:55,570][39m Trial 2998 finished with value: 0.8666666666666666 and parameters: {'objective': 'CrossEntropy', 'colsample_bylevel': 0.08013580003526799, 'depth': 4, 'boosting_type': 'Plain', 'bootstrap_type': 'Bayesian', 'bagging_temperature': 9.984890023925741}. Best is trial 98 with value: 0.8791208791208791.
[32m[I 2023-04-21 02:30:56,610][39m Trial 2999 finished with value: 0.8666666666666666 and parameters: {'objective': 'Logloss', 'colsample_bylevel': 0.07359252377760203, 'depth': 10, 'boosting_type': 'Plain', 'bootstrap_type': 'Bayesian', 'bagging_temperature': 8.812633027913648}. Best is trial 98 with value: 0.8791208791208791.
[32m[I 2023-04-21 02:30:57,533][39m Trial 3000 finished with value: 0.8539325842696629 and parameters: {'objective': 'CrossEntropy', 'colsample_bylevel': 0.07488850586196324, 'depth': 10, 'boosting_type': 'Plain', 'bootstrap_type': 'Bayesian', 'bagging_temperature': 9.286467541638013}. Best is trial 98 with value: 0.8791208791208791.
[32m[I 2023-04-21 02:30:58,344][39m Trial 3001 finished with value: 0.8372093023255814 and parameters: {'objective': 'CrossEntropy', 'colsample_bylevel': 0.07611516215528405, 'depth': 10, 'boosting_type': 'Plain', 'bootstrap_type': 'Bayesian', 'bagging_temperature': 9.841510182660953}. Best is trial 98 with value: 0.8791208791208791.
[32m[I 2023-04-21 02:30:58,998][39m Trial 3002 finished with value: 0.8539325842696629 and parameters: {'objective': 'Logloss', 'colsample_bylevel': 0.08243826667900941, 'depth': 4, 'boosting_type': 'Plain', 'bootstrap_type': 'Bayesian', 'bagging_temperature': 8.19193567360585}. Best is trial 98 with value: 0.8791208791208791.
[32m[I 2023-04-21 02:31:00,502][39m Trial 3003 finished with value: 0.8139534883720929 and parameters: {'objective': 'Logloss', 'colsample_bylevel': 0.08172428956638166, 'depth': 10, 'boosting_type': 'Plain', 'bootstrap_type': 'Bayesian', 'bagging_temperature': 9.250198649477555}. Best is trial 98 with value: 0.8791208791208791.
[32m[I 2023-04-21 02:31:01,146][39m Trial 3004 finished with value: 0.8409090909090909 and parameters: {'objective': 'CrossEntropy', 'colsample_bylevel': 0.07439242739328424, 'depth': 10, 'boosting_type': 'Plain', 'bootstrap_type': 'Bayesian', 'bagging_temperature': 7.599472920382465}. Best is trial 98 with value: 0.8791208791208791.
[32m[I 2023-04-21 02:31:02,646][39m Trial 3005 finished with value: 0.8539325842696629 and parameters: {'objective': 'CrossEntropy', 'colsample_bylevel': 0.07183946407372277, 'depth': 11, 'boosting_type': 'Plain', 'bootstrap_type': 'Bayesian', 'bagging_temperature': 9.115887934732756}. Best is trial 98 with value: 0.8791208791208791.
[32m[I 2023-04-21 02:31:03,835][39m Trial 3006 finished with value: 0.8539325842696629 and parameters: {'objective': 'CrossEntropy', 'colsample_bylevel': 0.07814062855175283, 'depth': 9, 'boosting_type': 'Plain', 'bootstrap_type': 'Bayesian', 'bagging_temperature': 8.889031300348554}. Best is trial 98 with value: 0.8791208791208791.
[32m[I 2023-04-21 02:31:04,702][39m Trial 3007 finished with value: 0.8539325842696629 and parameters: {'objective': 'Logloss', 'colsample_bylevel': 0.0831302738574593, 'depth': 3, 'boosting_type': 'Plain', 'bootstrap_type': 'Bayesian', 'bagging_temperature': 9.231246643342466}. Best is trial 98 with value: 0.8791208791208791.
[32m[I 2023-04-21 02:31:05,344][39m Trial 3008 finished with value: 0.8791208791208791 and parameters: {'objective': 'CrossEntropy', 'colsample_bylevel': 0.07535798822549276, 'depth': 10, 'boosting_type': 'Plain', 'bootstrap_type': 'Bayesian', 'bagging_temperature': 8.948848592853402}. Best is trial 98 with value: 0.8791208791208791.
[32m[I 2023-04-21 02:31:06,454][39m Trial 3009 finished with value: 0.8275862068965518 and parameters: {'objective': 'CrossEntropy', 'colsample_bylevel': 0.07535679741687978, 'depth': 3, 'boosting_type': 'Plain', 'bootstrap_type': 'MVS'}. Best is trial 98 with value: 0.8791208791208791.
[32m[I 2023-04-21 02:31:07,290][39m Trial 3010 finished with value: 0.8539325842696629 and parameters: {'objective': 'CrossEntropy', 'colsample_bylevel': 0.07744653192341357, 'depth': 9, 'boosting_type': 'Plain', 'bootstrap_type': 'Bayesian', 'bagging_temperature': 9.40139773267772}. Best is trial 98 with value: 0.8791208791208791.
[32m[I 2023-04-21 02:31:12,361][39m Trial 3011 finished with value: 0.8539325842696629 and parameters: {'objective': 'CrossEntropy', 'colsample_bylevel': 0.08308376070198893, 'depth': 3, 'boosting_type': 'Ordered', 'bootstrap_type': 'Bayesian', 'bagging_temperature': 8.807865866954437}. Best is trial 98 with value: 0.8791208791208791.
[32m[I 2023-04-21 02:31:13,333][39m Trial 3012 finished with value: 0.8275862068965518 and parameters: {'objective': 'CrossEntropy', 'colsample_bylevel': 0.08324978115617829, 'depth': 3, 'boosting_type': 'Plain', 'bootstrap_type': 'Bayesian', 'bagging_temperature': 1.3951709079418961}. Best is trial 98 with value: 0.8791208791208791.
[32m[I 2023-04-21 02:31:14,294][39m Trial 3013 finished with value: 0.8539325842696629 and parameters: {'objective': 'CrossEntropy', 'colsample_bylevel': 0.09273764136771961, 'depth': 3, 'boosting_type': 'Plain', 'bootstrap_type': 'Bayesian', 'bagging_temperature': 9.997392938075238}. Best is trial 98 with value: 0.8791208791208791.
[32m[I 2023-04-21 02:31:15,283][39m Trial 3014 finished with value: 0.8539325842696629 and parameters: {'objective': 'Logloss', 'colsample_bylevel': 0.07213941270744309, 'depth': 10, 'boosting_type': 'Plain', 'bootstrap_type': 'Bayesian', 'bagging_temperature': 5.143107606209158}. Best is trial 98 with value: 0.8791208791208791.
[32m[I 2023-04-21 02:31:16,224][39m Trial 3015 finished with value: 0.8666666666666666 and parameters: {'objective': 'CrossEntropy', 'colsample_bylevel': 0.07870750743090207, 'depth': 2, 'boosting_type': 'Plain', 'bootstrap_type': 'Bayesian', 'bagging_temperature': 9.629541240411733}. Best is trial 98 with value: 0.8791208791208791.
[32m[I 2023-04-21 02:31:17,470][39m Trial 3016 finished with value: 0.8139534883720929 and parameters: {'objective': 'Logloss', 'colsample_bylevel': 0.0788568646062319, 'depth': 9, 'boosting_type': 'Plain', 'bootstrap_type': 'Bayesian', 'bagging_temperature': 9.250638319636831}. Best is trial 98 with value: 0.8791208791208791.
[32m[I 2023-04-21 02:31:18,419][39m Trial 3017 finished with value: 0.8636363636363636 and parameters: {'objective': 'CrossEntropy', 'colsample_bylevel': 0.07993622429570396, 'depth': 2, 'boosting_type': 'Plain', 'bootstrap_type': 'Bayesian', 'bagging_temperature': 8.493708467890977}. Best is trial 98 with value: 0.8791208791208791.
[32m[I 2023-04-21 02:31:19,086][39m Trial 3018 finished with value: 0.8539325842696629 and parameters: {'objective': 'CrossEntropy', 'colsample_bylevel': 0.08073803199910173, 'depth': 10, 'boosting_type': 'Plain', 'bootstrap_type': 'Bayesian', 'bagging_temperature': 9.462889352333514}. Best is trial 98 with value: 0.8791208791208791.
[32m[I 2023-04-21 02:31:19,948][39m Trial 3019 finished with value: 0.8666666666666666 and parameters: {'objective': 'Logloss', 'colsample_bylevel': 0.07526439186537581, 'depth': 9, 'boosting_type': 'Plain', 'bootstrap_type': 'Bayesian', 'bagging_temperature': 9.502468868824435}. Best is trial 98 with value: 0.8791208791208791.
[32m[I 2023-04-21 02:31:20,583][39m Trial 3020 finished with value: 0.8409090909090909 and parameters: {'objective': 'CrossEntropy', 'colsample_bylevel': 0.09465324957844584, 'depth': 3, 'boosting_type': 'Plain', 'bootstrap_type': 'Bayesian', 'bagging_temperature': 8.473830796369601}. Best is trial 98 with value: 0.8791208791208791.
[32m[I 2023-04-21 02:31:21,628][39m Trial 3021 finished with value: 0.8666666666666666 and parameters: {'objective': 'CrossEntropy', 'colsample_bylevel': 0.07659956834088986, 'depth': 8, 'boosting_type': 'Plain', 'bootstrap_type': 'Bayesian', 'bagging_temperature': 8.27797116508488}. Best is trial 98 with value: 0.8791208791208791.
[32m[I 2023-04-21 02:31:22,575][39m Trial 3022 finished with value: 0.7999999999999999 and parameters: {'objective': 'CrossEntropy', 'colsample_bylevel': 0.07388311695267623, 'depth': 4, 'boosting_type': 'Plain', 'bootstrap_type': 'Bayesian', 'bagging_temperature': 9.02656957324138}. Best is trial 98 with value: 0.8791208791208791.
[32m[I 2023-04-21 02:31:23,570][39m Trial 3023 finished with value: 0.8409090909090909 and parameters: {'objective': 'CrossEntropy', 'colsample_bylevel': 0.07643763462540944, 'depth': 7, 'boosting_type': 'Plain', 'bootstrap_type': 'Bayesian', 'bagging_temperature': 9.789616177387723}. Best is trial 98 with value: 0.8791208791208791.
[32m[I 2023-04-21 02:31:24,548][39m Trial 3024 finished with value: 0.8539325842696629 and parameters: {'objective': 'CrossEntropy', 'colsample_bylevel': 0.07749468933746846, 'depth': 6, 'boosting_type': 'Plain', 'bootstrap_type': 'Bayesian', 'bagging_temperature': 9.305151583141123}. Best is trial 98 with value: 0.8791208791208791.
[32m[I 2023-04-21 02:31:25,571][39m Trial 3025 finished with value: 0.8539325842696629 and parameters: {'objective': 'CrossEntropy', 'colsample_bylevel': 0.0799921612291031, 'depth': 9, 'boosting_type': 'Plain', 'bootstrap_type': 'Bayesian', 'bagging_temperature': 9.994324661969014}. Best is trial 98 with value: 0.8791208791208791.
[32m[I 2023-04-21 02:31:26,456][39m Trial 3026 finished with value: 0.8275862068965518 and parameters: {'objective': 'CrossEntropy', 'colsample_bylevel': 0.09385311178772257, 'depth': 3, 'boosting_type': 'Plain', 'bootstrap_type': 'Bayesian', 'bagging_temperature': 9.596596009234997}. Best is trial 98 with value: 0.8791208791208791.
[32m[I 2023-04-21 02:31:27,815][39m Trial 3027 finished with value: 0.8275862068965518 and parameters: {'objective': 'Logloss', 'colsample_bylevel': 0.07296408403749598, 'depth': 9, 'boosting_type': 'Plain', 'bootstrap_type': 'Bernoulli', 'subsample': 0.4505400207209682}. Best is trial 98 with value: 0.8791208791208791.
[32m[I 2023-04-21 02:31:28,475][39m Trial 3028 finished with value: 0.8139534883720929 and parameters: {'objective': 'CrossEntropy', 'colsample_bylevel': 0.07398143777133447, 'depth': 10, 'boosting_type': 'Plain', 'bootstrap_type': 'Bayesian', 'bagging_temperature': 8.459878759009056}. Best is trial 98 with value: 0.8791208791208791.
[32m[I 2023-04-21 02:31:33,695][39m Trial 3029 finished with value: 0.8 and parameters: {'objective': 'CrossEntropy', 'colsample_bylevel': 0.08630961196275094, 'depth': 4, 'boosting_type': 'Ordered', 'bootstrap_type': 'MVS'}. Best is trial 98 with value: 0.8791208791208791.
[32m[I 2023-04-21 02:31:35,007][39m Trial 3030 finished with value: 0.8372093023255814 and parameters: {'objective': 'CrossEntropy', 'colsample_bylevel': 0.09393745398205817, 'depth': 9, 'boosting_type': 'Plain', 'bootstrap_type': 'Bayesian', 'bagging_temperature': 9.971242642303928}. Best is trial 98 with value: 0.8791208791208791.
[32m[I 2023-04-21 02:31:35,814][39m Trial 3031 finished with value: 0.8409090909090909 and parameters: {'objective': 'Logloss', 'colsample_bylevel': 0.08551849543120696, 'depth': 12, 'boosting_type': 'Plain', 'bootstrap_type': 'Bayesian', 'bagging_temperature': 9.46398976940905}. Best is trial 98 with value: 0.8791208791208791.
[32m[I 2023-04-21 02:31:36,782][39m Trial 3032 finished with value: 0.8409090909090909 and parameters: {'objective': 'CrossEntropy', 'colsample_bylevel': 0.08384287884375909, 'depth': 4, 'boosting_type': 'Plain', 'bootstrap_type': 'Bayesian', 'bagging_temperature': 9.42330594466175}. Best is trial 98 with value: 0.8791208791208791.
[32m[I 2023-04-21 02:31:38,068][39m Trial 3033 finished with value: 0.8139534883720929 and parameters: {'objective': 'Logloss', 'colsample_bylevel': 0.0806371703914157, 'depth': 10, 'boosting_type': 'Plain', 'bootstrap_type': 'Bayesian', 'bagging_temperature': 9.201244991659706}. Best is trial 98 with value: 0.8791208791208791.
[32m[I 2023-04-21 02:31:39,274][39m Trial 3034 finished with value: 0.8505747126436782 and parameters: {'objective': 'CrossEntropy', 'colsample_bylevel': 0.07602498693828935, 'depth': 10, 'boosting_type': 'Plain', 'bootstrap_type': 'MVS'}. Best is trial 98 with value: 0.8791208791208791.
[32m[I 2023-04-21 02:31:40,137][39m Trial 3035 finished with value: 0.8791208791208791 and parameters: {'objective': 'CrossEntropy', 'colsample_bylevel': 0.07561242683167203, 'depth': 11, 'boosting_type': 'Plain', 'bootstrap_type': 'Bayesian', 'bagging_temperature': 9.715766153297766}. Best is trial 98 with value: 0.8791208791208791.
[32m[I 2023-04-21 02:31:40,777][39m Trial 3036 finished with value: 0.8409090909090909 and parameters: {'objective': 'CrossEntropy', 'colsample_bylevel': 0.08229433372368924, 'depth': 3, 'boosting_type': 'Plain', 'bootstrap_type': 'Bayesian', 'bagging_temperature': 4.424792202449366}. Best is trial 98 with value: 0.8791208791208791.
[32m[I 2023-04-21 02:31:41,984][39m Trial 3037 finished with value: 0.8409090909090909 and parameters: {'objective': 'CrossEntropy', 'colsample_bylevel': 0.07453195663885036, 'depth': 10, 'boosting_type': 'Plain', 'bootstrap_type': 'Bayesian', 'bagging_temperature': 9.561219337078503}. Best is trial 98 with value: 0.8791208791208791.
[32m[I 2023-04-21 02:31:42,619][39m Trial 3038 finished with value: 0.8409090909090909 and parameters: {'objective': 'CrossEntropy', 'colsample_bylevel': 0.058961566466953524, 'depth': 3, 'boosting_type': 'Plain', 'bootstrap_type': 'Bayesian', 'bagging_temperature': 1.6863434260961139}. Best is trial 98 with value: 0.8791208791208791.
[32m[I 2023-04-21 02:31:43,793][39m Trial 3039 finished with value: 0.8409090909090909 and parameters: {'objective': 'CrossEntropy', 'colsample_bylevel': 0.0791528508244001, 'depth': 9, 'boosting_type': 'Plain', 'bootstrap_type': 'Bayesian', 'bagging_temperature': 9.807874846747445}. Best is trial 98 with value: 0.8791208791208791.
