[32m[I 2023-04-21 01:36:55,884][39m Trial 68 finished with value: 0.8275862068965518 and parameters: {'objective': 'Logloss', 'colsample_bylevel': 0.07912015985615242, 'depth': 10, 'boosting_type': 'Plain', 'bootstrap_type': 'Bernoulli', 'subsample': 0.2379734139521468}. Best is trial 7 with value: 0.8636363636363636.
[32m[I 2023-04-21 01:37:00,520][39m Trial 69 finished with value: 0.8409090909090909 and parameters: {'objective': 'CrossEntropy', 'colsample_bylevel': 0.07232263288703275, 'depth': 8, 'boosting_type': 'Ordered', 'bootstrap_type': 'Bayesian', 'bagging_temperature': 3.6371145873187394}. Best is trial 7 with value: 0.8636363636363636.
[32m[I 2023-04-21 01:37:05,352][39m Trial 70 finished with value: 0.8275862068965518 and parameters: {'objective': 'CrossEntropy', 'colsample_bylevel': 0.0815454004786282, 'depth': 8, 'boosting_type': 'Ordered', 'bootstrap_type': 'Bayesian', 'bagging_temperature': 4.5284201905947485}. Best is trial 7 with value: 0.8636363636363636.
[32m[I 2023-04-21 01:37:10,353][39m Trial 71 finished with value: 0.8314606741573034 and parameters: {'objective': 'CrossEntropy', 'colsample_bylevel': 0.07402278065843904, 'depth': 10, 'boosting_type': 'Ordered', 'bootstrap_type': 'Bayesian', 'bagging_temperature': 3.8145362401348875}. Best is trial 7 with value: 0.8636363636363636.
[32m[I 2023-04-21 01:37:11,827][39m Trial 72 finished with value: 0.8409090909090909 and parameters: {'objective': 'Logloss', 'colsample_bylevel': 0.06595013812353301, 'depth': 4, 'boosting_type': 'Plain', 'bootstrap_type': 'Bernoulli', 'subsample': 0.3668708519423844}. Best is trial 7 with value: 0.8636363636363636.
[32m[I 2023-04-21 01:37:12,776][39m Trial 73 finished with value: 0.8089887640449439 and parameters: {'objective': 'Logloss', 'colsample_bylevel': 0.05138787628350826, 'depth': 9, 'boosting_type': 'Plain', 'bootstrap_type': 'Bernoulli', 'subsample': 0.49566019288394164}. Best is trial 7 with value: 0.8636363636363636.
[32m[I 2023-04-21 01:37:13,302][39m Trial 74 finished with value: 0.8222222222222222 and parameters: {'objective': 'Logloss', 'colsample_bylevel': 0.056962114519163484, 'depth': 11, 'boosting_type': 'Plain', 'bootstrap_type': 'Bernoulli', 'subsample': 0.29048628090256146}. Best is trial 7 with value: 0.8636363636363636.
[32m[I 2023-04-21 01:37:17,929][39m Trial 75 finished with value: 0.8 and parameters: {'objective': 'CrossEntropy', 'colsample_bylevel': 0.03983717372663578, 'depth': 10, 'boosting_type': 'Ordered', 'bootstrap_type': 'MVS'}. Best is trial 7 with value: 0.8636363636363636.
[32m[I 2023-04-21 01:37:18,760][39m Trial 76 finished with value: 0.8314606741573034 and parameters: {'objective': 'Logloss', 'colsample_bylevel': 0.046291518439131825, 'depth': 11, 'boosting_type': 'Plain', 'bootstrap_type': 'Bernoulli', 'subsample': 0.42903495678439973}. Best is trial 7 with value: 0.8636363636363636.
[32m[I 2023-04-21 01:37:23,147][39m Trial 77 finished with value: 0.8409090909090909 and parameters: {'objective': 'CrossEntropy', 'colsample_bylevel': 0.050956359403905686, 'depth': 7, 'boosting_type': 'Ordered', 'bootstrap_type': 'Bayesian', 'bagging_temperature': 5.747086630262129}. Best is trial 7 with value: 0.8636363636363636.
[32m[I 2023-04-21 01:37:27,949][39m Trial 78 finished with value: 0.8409090909090909 and parameters: {'objective': 'CrossEntropy', 'colsample_bylevel': 0.04146816482569517, 'depth': 12, 'boosting_type': 'Ordered', 'bootstrap_type': 'Bayesian', 'bagging_temperature': 4.868672357138387}. Best is trial 7 with value: 0.8636363636363636.
[32m[I 2023-04-21 01:37:32,869][39m Trial 79 finished with value: 0.8409090909090909 and parameters: {'objective': 'CrossEntropy', 'colsample_bylevel': 0.05280608855993297, 'depth': 11, 'boosting_type': 'Ordered', 'bootstrap_type': 'Bayesian', 'bagging_temperature': 5.729127742152327}. Best is trial 7 with value: 0.8636363636363636.
[32m[I 2023-04-21 01:37:34,012][39m Trial 80 finished with value: 0.8409090909090909 and parameters: {'objective': 'Logloss', 'colsample_bylevel': 0.06114677992547398, 'depth': 5, 'boosting_type': 'Plain', 'bootstrap_type': 'Bernoulli', 'subsample': 0.12815869455545578}. Best is trial 7 with value: 0.8636363636363636.
[32m[I 2023-04-21 01:37:38,605][39m Trial 81 finished with value: 0.8089887640449439 and parameters: {'objective': 'CrossEntropy', 'colsample_bylevel': 0.04768212848424798, 'depth': 12, 'boosting_type': 'Ordered', 'bootstrap_type': 'Bayesian', 'bagging_temperature': 2.7750935603784477}. Best is trial 7 with value: 0.8636363636363636.
[32m[I 2023-04-21 01:37:39,625][39m Trial 82 finished with value: 0.8275862068965518 and parameters: {'objective': 'Logloss', 'colsample_bylevel': 0.06461066474729768, 'depth': 11, 'boosting_type': 'Plain', 'bootstrap_type': 'Bernoulli', 'subsample': 0.3412371450031326}. Best is trial 7 with value: 0.8636363636363636.
[32m[I 2023-04-21 01:37:40,545][39m Trial 83 finished with value: 0.8409090909090909 and parameters: {'objective': 'CrossEntropy', 'colsample_bylevel': 0.044681631661112074, 'depth': 9, 'boosting_type': 'Plain', 'bootstrap_type': 'Bayesian', 'bagging_temperature': 9.401293409942383}. Best is trial 7 with value: 0.8636363636363636.
[32m[I 2023-04-21 01:37:41,368][39m Trial 84 finished with value: 0.8409090909090909 and parameters: {'objective': 'Logloss', 'colsample_bylevel': 0.08653244420439529, 'depth': 9, 'boosting_type': 'Plain', 'bootstrap_type': 'MVS'}. Best is trial 7 with value: 0.8636363636363636.
[32m[I 2023-04-21 01:37:46,174][39m Trial 85 finished with value: 0.8539325842696629 and parameters: {'objective': 'CrossEntropy', 'colsample_bylevel': 0.06927514834402469, 'depth': 9, 'boosting_type': 'Ordered', 'bootstrap_type': 'Bayesian', 'bagging_temperature': 7.253617119388346}. Best is trial 7 with value: 0.8636363636363636.
[32m[I 2023-04-21 01:37:47,076][39m Trial 86 finished with value: 0.8139534883720929 and parameters: {'objective': 'Logloss', 'colsample_bylevel': 0.03742850689506589, 'depth': 9, 'boosting_type': 'Plain', 'bootstrap_type': 'Bayesian', 'bagging_temperature': 7.071548155011095}. Best is trial 7 with value: 0.8636363636363636.
[32m[I 2023-04-21 01:37:51,685][39m Trial 87 finished with value: 0.8139534883720929 and parameters: {'objective': 'CrossEntropy', 'colsample_bylevel': 0.04147192202594001, 'depth': 12, 'boosting_type': 'Ordered', 'bootstrap_type': 'Bayesian', 'bagging_temperature': 5.041064453947754}. Best is trial 7 with value: 0.8636363636363636.
[32m[I 2023-04-21 01:37:52,499][39m Trial 88 finished with value: 0.8539325842696629 and parameters: {'objective': 'CrossEntropy', 'colsample_bylevel': 0.05289239546959131, 'depth': 12, 'boosting_type': 'Plain', 'bootstrap_type': 'Bayesian', 'bagging_temperature': 6.039087209264034}. Best is trial 7 with value: 0.8636363636363636.
[32m[I 2023-04-21 01:37:57,461][39m Trial 89 finished with value: 0.8409090909090909 and parameters: {'objective': 'CrossEntropy', 'colsample_bylevel': 0.0511607132651258, 'depth': 6, 'boosting_type': 'Ordered', 'bootstrap_type': 'Bayesian', 'bagging_temperature': 6.239397009702194}. Best is trial 7 with value: 0.8636363636363636.
[32m[I 2023-04-21 01:38:02,430][39m Trial 90 finished with value: 0.8275862068965518 and parameters: {'objective': 'CrossEntropy', 'colsample_bylevel': 0.09083069056705508, 'depth': 8, 'boosting_type': 'Ordered', 'bootstrap_type': 'Bayesian', 'bagging_temperature': 7.4616413477243135}. Best is trial 7 with value: 0.8636363636363636.
[32m[I 2023-04-21 01:38:07,081][39m Trial 91 finished with value: 0.8314606741573034 and parameters: {'objective': 'CrossEntropy', 'colsample_bylevel': 0.05409204476947575, 'depth': 5, 'boosting_type': 'Ordered', 'bootstrap_type': 'Bayesian', 'bagging_temperature': 8.432353643958887}. Best is trial 7 with value: 0.8636363636363636.
[32m[I 2023-04-21 01:38:08,139][39m Trial 92 finished with value: 0.8539325842696629 and parameters: {'objective': 'CrossEntropy', 'colsample_bylevel': 0.048548484260824594, 'depth': 10, 'boosting_type': 'Plain', 'bootstrap_type': 'Bayesian', 'bagging_temperature': 8.108419594432641}. Best is trial 7 with value: 0.8636363636363636.
[32m[I 2023-04-21 01:38:13,274][39m Trial 93 finished with value: 0.8139534883720929 and parameters: {'objective': 'CrossEntropy', 'colsample_bylevel': 0.09460615905624993, 'depth': 10, 'boosting_type': 'Ordered', 'bootstrap_type': 'Bayesian', 'bagging_temperature': 8.188266700334193}. Best is trial 7 with value: 0.8636363636363636.
[32m[I 2023-04-21 01:38:14,209][39m Trial 94 finished with value: 0.8666666666666666 and parameters: {'objective': 'CrossEntropy', 'colsample_bylevel': 0.058702404811859475, 'depth': 10, 'boosting_type': 'Plain', 'bootstrap_type': 'Bayesian', 'bagging_temperature': 9.326460349621252}. Best is trial 94 with value: 0.8666666666666666.
[32m[I 2023-04-21 01:38:15,061][39m Trial 95 finished with value: 0.8409090909090909 and parameters: {'objective': 'CrossEntropy', 'colsample_bylevel': 0.04658200966827045, 'depth': 10, 'boosting_type': 'Plain', 'bootstrap_type': 'Bayesian', 'bagging_temperature': 7.252036498575029}. Best is trial 94 with value: 0.8666666666666666.
[32m[I 2023-04-21 01:38:16,081][39m Trial 96 finished with value: 0.7999999999999999 and parameters: {'objective': 'CrossEntropy', 'colsample_bylevel': 0.07135558559967739, 'depth': 10, 'boosting_type': 'Plain', 'bootstrap_type': 'Bayesian', 'bagging_temperature': 9.366660640708988}. Best is trial 94 with value: 0.8666666666666666.
[32m[I 2023-04-21 01:38:17,170][39m Trial 97 finished with value: 0.8539325842696629 and parameters: {'objective': 'CrossEntropy', 'colsample_bylevel': 0.07764821673034587, 'depth': 4, 'boosting_type': 'Plain', 'bootstrap_type': 'Bayesian', 'bagging_temperature': 7.949148015880123}. Best is trial 94 with value: 0.8666666666666666.
[32m[I 2023-04-21 01:38:17,872][39m Trial 98 finished with value: 0.8791208791208791 and parameters: {'objective': 'CrossEntropy', 'colsample_bylevel': 0.07683282260478715, 'depth': 9, 'boosting_type': 'Plain', 'bootstrap_type': 'Bayesian', 'bagging_temperature': 8.102316416781532}. Best is trial 98 with value: 0.8791208791208791.
[32m[I 2023-04-21 01:38:18,415][39m Trial 99 finished with value: 0.8636363636363636 and parameters: {'objective': 'CrossEntropy', 'colsample_bylevel': 0.07682131093893656, 'depth': 2, 'boosting_type': 'Plain', 'bootstrap_type': 'Bayesian', 'bagging_temperature': 7.843404616206237}. Best is trial 98 with value: 0.8791208791208791.
[32m[I 2023-04-21 01:38:19,263][39m Trial 100 finished with value: 0.8539325842696629 and parameters: {'objective': 'CrossEntropy', 'colsample_bylevel': 0.07727461072126474, 'depth': 2, 'boosting_type': 'Plain', 'bootstrap_type': 'Bayesian', 'bagging_temperature': 7.962533193683909}. Best is trial 98 with value: 0.8791208791208791.
[32m[I 2023-04-21 01:38:20,287][39m Trial 101 finished with value: 0.8539325842696629 and parameters: {'objective': 'CrossEntropy', 'colsample_bylevel': 0.08511196029904294, 'depth': 2, 'boosting_type': 'Plain', 'bootstrap_type': 'Bayesian', 'bagging_temperature': 7.929762636426474}. Best is trial 98 with value: 0.8791208791208791.
[32m[I 2023-04-21 01:38:21,171][39m Trial 102 finished with value: 0.8275862068965518 and parameters: {'objective': 'CrossEntropy', 'colsample_bylevel': 0.07824169086323783, 'depth': 2, 'boosting_type': 'Plain', 'bootstrap_type': 'Bayesian', 'bagging_temperature': 7.903003556178178}. Best is trial 98 with value: 0.8791208791208791.
[32m[I 2023-04-21 01:38:21,777][39m Trial 103 finished with value: 0.8539325842696629 and parameters: {'objective': 'CrossEntropy', 'colsample_bylevel': 0.08110719378399209, 'depth': 3, 'boosting_type': 'Plain', 'bootstrap_type': 'Bayesian', 'bagging_temperature': 6.76268105629727}. Best is trial 98 with value: 0.8791208791208791.
[32m[I 2023-04-21 01:38:22,751][39m Trial 104 finished with value: 0.7999999999999999 and parameters: {'objective': 'CrossEntropy', 'colsample_bylevel': 0.08381122735732574, 'depth': 1, 'boosting_type': 'Plain', 'bootstrap_type': 'Bayesian', 'bagging_temperature': 6.546527110352197}. Best is trial 98 with value: 0.8791208791208791.
[32m[I 2023-04-21 01:38:23,389][39m Trial 105 finished with value: 0.8409090909090909 and parameters: {'objective': 'CrossEntropy', 'colsample_bylevel': 0.07631478738886194, 'depth': 3, 'boosting_type': 'Plain', 'bootstrap_type': 'Bayesian', 'bagging_temperature': 8.551439724128882}. Best is trial 98 with value: 0.8791208791208791.
[32m[I 2023-04-21 01:38:24,288][39m Trial 106 finished with value: 0.8666666666666666 and parameters: {'objective': 'CrossEntropy', 'colsample_bylevel': 0.0749012217178736, 'depth': 2, 'boosting_type': 'Plain', 'bootstrap_type': 'Bayesian', 'bagging_temperature': 7.5997889452478}. Best is trial 98 with value: 0.8791208791208791.
[32m[I 2023-04-21 01:38:25,050][39m Trial 107 finished with value: 0.8636363636363636 and parameters: {'objective': 'CrossEntropy', 'colsample_bylevel': 0.07494839182736125, 'depth': 2, 'boosting_type': 'Plain', 'bootstrap_type': 'Bayesian', 'bagging_temperature': 9.424206945002409}. Best is trial 98 with value: 0.8791208791208791.
[32m[I 2023-04-21 01:38:25,737][39m Trial 108 finished with value: 0.8666666666666666 and parameters: {'objective': 'CrossEntropy', 'colsample_bylevel': 0.08085923725073836, 'depth': 3, 'boosting_type': 'Plain', 'bootstrap_type': 'Bayesian', 'bagging_temperature': 9.7545541099579}. Best is trial 98 with value: 0.8791208791208791.
[32m[I 2023-04-21 01:38:26,593][39m Trial 109 finished with value: 0.8764044943820225 and parameters: {'objective': 'CrossEntropy', 'colsample_bylevel': 0.08552074076088965, 'depth': 2, 'boosting_type': 'Plain', 'bootstrap_type': 'Bayesian', 'bagging_temperature': 9.56780030069757}. Best is trial 98 with value: 0.8791208791208791.
[32m[I 2023-04-21 01:38:27,405][39m Trial 110 finished with value: 0.8666666666666666 and parameters: {'objective': 'CrossEntropy', 'colsample_bylevel': 0.08900190343422736, 'depth': 3, 'boosting_type': 'Plain', 'bootstrap_type': 'Bayesian', 'bagging_temperature': 9.419579922583234}. Best is trial 98 with value: 0.8791208791208791.
[32m[I 2023-04-21 01:38:28,215][39m Trial 111 finished with value: 0.8314606741573034 and parameters: {'objective': 'CrossEntropy', 'colsample_bylevel': 0.08771011415528138, 'depth': 2, 'boosting_type': 'Plain', 'bootstrap_type': 'Bayesian', 'bagging_temperature': 9.621471253881847}. Best is trial 98 with value: 0.8791208791208791.
[32m[I 2023-04-21 01:38:29,269][39m Trial 112 finished with value: 0.8666666666666666 and parameters: {'objective': 'CrossEntropy', 'colsample_bylevel': 0.0750394215394939, 'depth': 2, 'boosting_type': 'Plain', 'bootstrap_type': 'Bayesian', 'bagging_temperature': 9.853678049332402}. Best is trial 98 with value: 0.8791208791208791.
[32m[I 2023-04-21 01:38:31,205][39m Trial 114 finished with value: 0.8139534883720929 and parameters: {'objective': 'CrossEntropy', 'colsample_bylevel': 0.07475590858591616, 'depth': 3, 'boosting_type': 'Plain', 'bootstrap_type': 'Bayesian', 'bagging_temperature': 9.942431661360342}. Best is trial 98 with value: 0.8791208791208791.
[32m[I 2023-04-21 01:38:31,770][39m Trial 115 finished with value: 0.8764044943820225 and parameters: {'objective': 'CrossEntropy', 'colsample_bylevel': 0.08500490400384882, 'depth': 2, 'boosting_type': 'Plain', 'bootstrap_type': 'Bayesian', 'bagging_temperature': 8.985658280042005}. Best is trial 98 with value: 0.8791208791208791.
[32m[I 2023-04-21 01:38:32,373][39m Trial 116 finished with value: 0.8539325842696629 and parameters: {'objective': 'CrossEntropy', 'colsample_bylevel': 0.09367358398475303, 'depth': 2, 'boosting_type': 'Plain', 'bootstrap_type': 'Bayesian', 'bagging_temperature': 9.187896265689005}. Best is trial 98 with value: 0.8791208791208791.
[32m[I 2023-04-21 01:38:33,155][39m Trial 117 finished with value: 0.8666666666666666 and parameters: {'objective': 'CrossEntropy', 'colsample_bylevel': 0.0895265602001218, 'depth': 2, 'boosting_type': 'Plain', 'bootstrap_type': 'Bayesian', 'bagging_temperature': 9.169482068706104}. Best is trial 98 with value: 0.8791208791208791.
[32m[I 2023-04-21 01:38:33,964][39m Trial 118 finished with value: 0.8636363636363636 and parameters: {'objective': 'CrossEntropy', 'colsample_bylevel': 0.08975203839792859, 'depth': 2, 'boosting_type': 'Plain', 'bootstrap_type': 'Bayesian', 'bagging_temperature': 9.142814046927683}. Best is trial 98 with value: 0.8791208791208791.
[32m[I 2023-04-21 01:38:34,771][39m Trial 119 finished with value: 0.8275862068965518 and parameters: {'objective': 'CrossEntropy', 'colsample_bylevel': 0.09040408865896925, 'depth': 1, 'boosting_type': 'Plain', 'bootstrap_type': 'Bayesian', 'bagging_temperature': 9.073264078852455}. Best is trial 98 with value: 0.8791208791208791.
[32m[I 2023-04-21 01:38:35,504][39m Trial 120 finished with value: 0.8333333333333333 and parameters: {'objective': 'CrossEntropy', 'colsample_bylevel': 0.08299930194806707, 'depth': 1, 'boosting_type': 'Plain', 'bootstrap_type': 'Bayesian', 'bagging_temperature': 9.579607450882941}. Best is trial 98 with value: 0.8791208791208791.
[32m[I 2023-04-21 01:38:36,298][39m Trial 121 finished with value: 0.8666666666666666 and parameters: {'objective': 'CrossEntropy', 'colsample_bylevel': 0.0877433748548847, 'depth': 2, 'boosting_type': 'Plain', 'bootstrap_type': 'Bayesian', 'bagging_temperature': 8.779727431845973}. Best is trial 98 with value: 0.8791208791208791.
[32m[I 2023-04-21 01:38:37,124][39m Trial 122 finished with value: 0.8539325842696629 and parameters: {'objective': 'CrossEntropy', 'colsample_bylevel': 0.0871397875769733, 'depth': 2, 'boosting_type': 'Plain', 'bootstrap_type': 'Bayesian', 'bagging_temperature': 9.256455087337763}. Best is trial 98 with value: 0.8791208791208791.
[32m[I 2023-04-21 01:38:37,943][39m Trial 123 finished with value: 0.8666666666666666 and parameters: {'objective': 'CrossEntropy', 'colsample_bylevel': 0.08873958298879515, 'depth': 3, 'boosting_type': 'Plain', 'bootstrap_type': 'Bayesian', 'bagging_temperature': 8.807631476673958}. Best is trial 98 with value: 0.8791208791208791.
[32m[I 2023-04-21 01:38:38,870][39m Trial 124 finished with value: 0.8539325842696629 and parameters: {'objective': 'CrossEntropy', 'colsample_bylevel': 0.0891777799254595, 'depth': 2, 'boosting_type': 'Plain', 'bootstrap_type': 'Bayesian', 'bagging_temperature': 8.817253838417269}. Best is trial 98 with value: 0.8791208791208791.
[32m[I 2023-04-21 01:38:39,728][39m Trial 125 finished with value: 0.8791208791208791 and parameters: {'objective': 'CrossEntropy', 'colsample_bylevel': 0.08616265638639248, 'depth': 3, 'boosting_type': 'Plain', 'bootstrap_type': 'Bayesian', 'bagging_temperature': 9.663899816247842}. Best is trial 98 with value: 0.8791208791208791.
[32m[I 2023-04-21 01:38:40,667][39m Trial 126 finished with value: 0.8666666666666666 and parameters: {'objective': 'CrossEntropy', 'colsample_bylevel': 0.08580658196869875, 'depth': 3, 'boosting_type': 'Plain', 'bootstrap_type': 'Bayesian', 'bagging_temperature': 9.695197043244912}. Best is trial 98 with value: 0.8791208791208791.
[32m[I 2023-04-21 01:38:41,704][39m Trial 127 finished with value: 0.8666666666666666 and parameters: {'objective': 'CrossEntropy', 'colsample_bylevel': 0.09254481369980284, 'depth': 3, 'boosting_type': 'Plain', 'bootstrap_type': 'Bayesian', 'bagging_temperature': 9.708943062330865}. Best is trial 98 with value: 0.8791208791208791.
[32m[I 2023-04-21 01:38:42,623][39m Trial 128 finished with value: 0.8275862068965518 and parameters: {'objective': 'CrossEntropy', 'colsample_bylevel': 0.09841742231121453, 'depth': 4, 'boosting_type': 'Plain', 'bootstrap_type': 'Bayesian', 'bagging_temperature': 9.645323688336463}. Best is trial 98 with value: 0.8791208791208791.
[32m[I 2023-04-21 01:38:43,513][39m Trial 129 finished with value: 0.8666666666666666 and parameters: {'objective': 'CrossEntropy', 'colsample_bylevel': 0.08598936436839692, 'depth': 3, 'boosting_type': 'Plain', 'bootstrap_type': 'Bayesian', 'bagging_temperature': 9.746680189045964}. Best is trial 98 with value: 0.8791208791208791.
[32m[I 2023-04-21 01:38:44,421][39m Trial 130 finished with value: 0.8409090909090909 and parameters: {'objective': 'CrossEntropy', 'colsample_bylevel': 0.08612859461873333, 'depth': 3, 'boosting_type': 'Plain', 'bootstrap_type': 'Bayesian', 'bagging_temperature': 8.774135471467556}. Best is trial 98 with value: 0.8791208791208791.
[32m[I 2023-04-21 01:38:45,538][39m Trial 131 finished with value: 0.8666666666666666 and parameters: {'objective': 'CrossEntropy', 'colsample_bylevel': 0.08020976457006555, 'depth': 3, 'boosting_type': 'Plain', 'bootstrap_type': 'Bayesian', 'bagging_temperature': 9.984048647834598}. Best is trial 98 with value: 0.8791208791208791.
[32m[I 2023-04-21 01:38:46,117][39m Trial 132 finished with value: 0.8666666666666666 and parameters: {'objective': 'CrossEntropy', 'colsample_bylevel': 0.09219520056477025, 'depth': 3, 'boosting_type': 'Plain', 'bootstrap_type': 'Bayesian', 'bagging_temperature': 9.71996054842819}. Best is trial 98 with value: 0.8791208791208791.
[32m[I 2023-04-21 01:38:46,729][39m Trial 133 finished with value: 0.8539325842696629 and parameters: {'objective': 'CrossEntropy', 'colsample_bylevel': 0.08006951672131518, 'depth': 3, 'boosting_type': 'Plain', 'bootstrap_type': 'Bayesian', 'bagging_temperature': 9.90501161982231}. Best is trial 98 with value: 0.8791208791208791.
[32m[I 2023-04-21 01:38:47,641][39m Trial 134 finished with value: 0.8409090909090909 and parameters: {'objective': 'CrossEntropy', 'colsample_bylevel': 0.08479761654941048, 'depth': 3, 'boosting_type': 'Plain', 'bootstrap_type': 'Bayesian', 'bagging_temperature': 9.603021980310315}. Best is trial 98 with value: 0.8791208791208791.
