[32m[I 2023-04-21 02:47:13,724][39m Trial 3825 finished with value: 0.8409090909090909 and parameters: {'objective': 'CrossEntropy', 'colsample_bylevel': 0.09439497383572423, 'depth': 12, 'boosting_type': 'Plain', 'bootstrap_type': 'Bayesian', 'bagging_temperature': 9.995376639675403}. Best is trial 3065 with value: 0.8863636363636364.
[32m[I 2023-04-21 02:47:15,152][39m Trial 3826 finished with value: 0.8409090909090909 and parameters: {'objective': 'CrossEntropy', 'colsample_bylevel': 0.07597582280678723, 'depth': 9, 'boosting_type': 'Plain', 'bootstrap_type': 'Bayesian', 'bagging_temperature': 9.701620982348137}. Best is trial 3065 with value: 0.8863636363636364.
[32m[I 2023-04-21 02:47:16,013][39m Trial 3827 finished with value: 0.8791208791208791 and parameters: {'objective': 'CrossEntropy', 'colsample_bylevel': 0.07428317981032877, 'depth': 9, 'boosting_type': 'Plain', 'bootstrap_type': 'Bayesian', 'bagging_temperature': 9.702399993155714}. Best is trial 3065 with value: 0.8863636363636364.
[32m[I 2023-04-21 02:47:16,818][39m Trial 3828 finished with value: 0.8275862068965518 and parameters: {'objective': 'CrossEntropy', 'colsample_bylevel': 0.08861389822216362, 'depth': 9, 'boosting_type': 'Plain', 'bootstrap_type': 'Bernoulli', 'subsample': 0.30604239484128226}. Best is trial 3065 with value: 0.8863636363636364.
[32m[I 2023-04-21 02:47:17,634][39m Trial 3829 finished with value: 0.8139534883720929 and parameters: {'objective': 'CrossEntropy', 'colsample_bylevel': 0.07611366633044626, 'depth': 10, 'boosting_type': 'Plain', 'bootstrap_type': 'Bayesian', 'bagging_temperature': 9.623053581342067}. Best is trial 3065 with value: 0.8863636363636364.
[32m[I 2023-04-21 02:47:18,286][39m Trial 3830 finished with value: 0.8409090909090909 and parameters: {'objective': 'CrossEntropy', 'colsample_bylevel': 0.06986736355830367, 'depth': 3, 'boosting_type': 'Plain', 'bootstrap_type': 'MVS'}. Best is trial 3065 with value: 0.8863636363636364.
[32m[I 2023-04-21 02:47:19,313][39m Trial 3831 finished with value: 0.8275862068965518 and parameters: {'objective': 'CrossEntropy', 'colsample_bylevel': 0.06919550965538672, 'depth': 3, 'boosting_type': 'Plain', 'bootstrap_type': 'Bayesian', 'bagging_temperature': 8.854795433625423}. Best is trial 3065 with value: 0.8863636363636364.
[32m[I 2023-04-21 02:47:20,389][39m Trial 3832 finished with value: 0.8666666666666666 and parameters: {'objective': 'CrossEntropy', 'colsample_bylevel': 0.07640482974238223, 'depth': 10, 'boosting_type': 'Plain', 'bootstrap_type': 'Bayesian', 'bagging_temperature': 9.986420176806911}. Best is trial 3065 with value: 0.8863636363636364.
[32m[I 2023-04-21 02:47:21,448][39m Trial 3833 finished with value: 0.8409090909090909 and parameters: {'objective': 'CrossEntropy', 'colsample_bylevel': 0.06980697918289301, 'depth': 3, 'boosting_type': 'Plain', 'bootstrap_type': 'Bayesian', 'bagging_temperature': 8.882188228369781}. Best is trial 3065 with value: 0.8863636363636364.
[32m[I 2023-04-21 02:47:22,575][39m Trial 3834 finished with value: 0.8409090909090909 and parameters: {'objective': 'CrossEntropy', 'colsample_bylevel': 0.08217688565973649, 'depth': 10, 'boosting_type': 'Plain', 'bootstrap_type': 'Bayesian', 'bagging_temperature': 9.34608367506845}. Best is trial 3065 with value: 0.8863636363636364.
[32m[I 2023-04-21 02:47:23,246][39m Trial 3835 finished with value: 0.8409090909090909 and parameters: {'objective': 'Logloss', 'colsample_bylevel': 0.07318169605007396, 'depth': 4, 'boosting_type': 'Plain', 'bootstrap_type': 'Bayesian', 'bagging_temperature': 2.187735118647885}. Best is trial 3065 with value: 0.8863636363636364.
[32m[I 2023-04-21 02:47:24,629][39m Trial 3836 finished with value: 0.8539325842696629 and parameters: {'objective': 'CrossEntropy', 'colsample_bylevel': 0.07597114189409661, 'depth': 10, 'boosting_type': 'Plain', 'bootstrap_type': 'Bayesian', 'bagging_temperature': 9.307457900577818}. Best is trial 3065 with value: 0.8863636363636364.
[32m[I 2023-04-21 02:47:29,749][39m Trial 3837 finished with value: 0.8045977011494252 and parameters: {'objective': 'Logloss', 'colsample_bylevel': 0.07026855138104136, 'depth': 3, 'boosting_type': 'Ordered', 'bootstrap_type': 'Bayesian', 'bagging_temperature': 9.59927579482979}. Best is trial 3065 with value: 0.8863636363636364.
[32m[I 2023-04-21 02:47:30,730][39m Trial 3838 finished with value: 0.8409090909090909 and parameters: {'objective': 'Logloss', 'colsample_bylevel': 0.06912155554569221, 'depth': 10, 'boosting_type': 'Plain', 'bootstrap_type': 'Bayesian', 'bagging_temperature': 7.088681005072847}. Best is trial 3065 with value: 0.8863636363636364.
[32m[I 2023-04-21 02:47:31,878][39m Trial 3839 finished with value: 0.8539325842696629 and parameters: {'objective': 'Logloss', 'colsample_bylevel': 0.07468018174140081, 'depth': 6, 'boosting_type': 'Plain', 'bootstrap_type': 'Bayesian', 'bagging_temperature': 9.623237045280417}. Best is trial 3065 with value: 0.8863636363636364.
[32m[I 2023-04-21 02:47:32,539][39m Trial 3840 finished with value: 0.8372093023255814 and parameters: {'objective': 'Logloss', 'colsample_bylevel': 0.0751447386389926, 'depth': 10, 'boosting_type': 'Plain', 'bootstrap_type': 'Bayesian', 'bagging_temperature': 9.52653492638783}. Best is trial 3065 with value: 0.8863636363636364.
[32m[I 2023-04-21 02:47:33,601][39m Trial 3841 finished with value: 0.8539325842696629 and parameters: {'objective': 'CrossEntropy', 'colsample_bylevel': 0.060296296994022766, 'depth': 11, 'boosting_type': 'Plain', 'bootstrap_type': 'Bayesian', 'bagging_temperature': 9.66065742668841}. Best is trial 3065 with value: 0.8863636363636364.
[32m[I 2023-04-21 02:47:34,647][39m Trial 3842 finished with value: 0.8409090909090909 and parameters: {'objective': 'CrossEntropy', 'colsample_bylevel': 0.0820103967819605, 'depth': 7, 'boosting_type': 'Plain', 'bootstrap_type': 'Bayesian', 'bagging_temperature': 9.229152723239956}. Best is trial 3065 with value: 0.8863636363636364.
[32m[I 2023-04-21 02:47:35,899][39m Trial 3843 finished with value: 0.8409090909090909 and parameters: {'objective': 'Logloss', 'colsample_bylevel': 0.07704500130210881, 'depth': 6, 'boosting_type': 'Plain', 'bootstrap_type': 'Bayesian', 'bagging_temperature': 9.527951634257715}. Best is trial 3065 with value: 0.8863636363636364.
[32m[I 2023-04-21 02:47:36,830][39m Trial 3844 finished with value: 0.8539325842696629 and parameters: {'objective': 'Logloss', 'colsample_bylevel': 0.07730245485426761, 'depth': 6, 'boosting_type': 'Plain', 'bootstrap_type': 'Bayesian', 'bagging_temperature': 9.481341516363061}. Best is trial 3065 with value: 0.8863636363636364.
[32m[I 2023-04-21 02:47:37,483][39m Trial 3845 finished with value: 0.8505747126436782 and parameters: {'objective': 'CrossEntropy', 'colsample_bylevel': 0.07810701127064486, 'depth': 10, 'boosting_type': 'Plain', 'bootstrap_type': 'Bayesian', 'bagging_temperature': 9.04647040982583}. Best is trial 3065 with value: 0.8863636363636364.
[32m[I 2023-04-21 02:47:38,457][39m Trial 3846 finished with value: 0.8539325842696629 and parameters: {'objective': 'Logloss', 'colsample_bylevel': 0.07591752931568445, 'depth': 5, 'boosting_type': 'Plain', 'bootstrap_type': 'Bayesian', 'bagging_temperature': 9.473724346570693}. Best is trial 3065 with value: 0.8863636363636364.
[32m[I 2023-04-21 02:47:39,172][39m Trial 3847 finished with value: 0.8409090909090909 and parameters: {'objective': 'Logloss', 'colsample_bylevel': 0.07126675373033392, 'depth': 10, 'boosting_type': 'Plain', 'bootstrap_type': 'Bayesian', 'bagging_temperature': 9.484924600080022}. Best is trial 3065 with value: 0.8863636363636364.
[32m[I 2023-04-21 02:47:40,339][39m Trial 3848 finished with value: 0.8791208791208791 and parameters: {'objective': 'Logloss', 'colsample_bylevel': 0.07191052415609375, 'depth': 10, 'boosting_type': 'Plain', 'bootstrap_type': 'Bayesian', 'bagging_temperature': 9.451662800044167}. Best is trial 3065 with value: 0.8863636363636364.
[32m[I 2023-04-21 02:47:41,098][39m Trial 3849 finished with value: 0.8666666666666666 and parameters: {'objective': 'Logloss', 'colsample_bylevel': 0.06851060478988019, 'depth': 12, 'boosting_type': 'Plain', 'bootstrap_type': 'Bayesian', 'bagging_temperature': 9.274355516164057}. Best is trial 3065 with value: 0.8863636363636364.
[32m[I 2023-04-21 02:47:41,801][39m Trial 3850 finished with value: 0.8539325842696629 and parameters: {'objective': 'Logloss', 'colsample_bylevel': 0.07004729467085141, 'depth': 6, 'boosting_type': 'Plain', 'bootstrap_type': 'Bayesian', 'bagging_temperature': 9.392432900299951}. Best is trial 3065 with value: 0.8863636363636364.
[32m[I 2023-04-21 02:47:43,104][39m Trial 3851 finished with value: 0.8275862068965518 and parameters: {'objective': 'CrossEntropy', 'colsample_bylevel': 0.07171530493795157, 'depth': 8, 'boosting_type': 'Plain', 'bootstrap_type': 'Bayesian', 'bagging_temperature': 8.680890432843638}. Best is trial 3065 with value: 0.8863636363636364.
[32m[I 2023-04-21 02:47:44,494][39m Trial 3852 finished with value: 0.8409090909090909 and parameters: {'objective': 'CrossEntropy', 'colsample_bylevel': 0.08606632404105803, 'depth': 10, 'boosting_type': 'Plain', 'bootstrap_type': 'Bayesian', 'bagging_temperature': 9.806939663612887}. Best is trial 3065 with value: 0.8863636363636364.
[32m[I 2023-04-21 02:47:45,714][39m Trial 3853 finished with value: 0.8539325842696629 and parameters: {'objective': 'CrossEntropy', 'colsample_bylevel': 0.09422742625727025, 'depth': 2, 'boosting_type': 'Plain', 'bootstrap_type': 'Bayesian', 'bagging_temperature': 9.49475630371827}. Best is trial 3065 with value: 0.8863636363636364.
[32m[I 2023-04-21 02:47:50,244][39m Trial 3854 finished with value: 0.8409090909090909 and parameters: {'objective': 'CrossEntropy', 'colsample_bylevel': 0.08658268102909132, 'depth': 3, 'boosting_type': 'Ordered', 'bootstrap_type': 'Bayesian', 'bagging_temperature': 9.002548082339592}. Best is trial 3065 with value: 0.8863636363636364.
[32m[I 2023-04-21 02:47:51,411][39m Trial 3855 finished with value: 0.8791208791208791 and parameters: {'objective': 'CrossEntropy', 'colsample_bylevel': 0.07005593348269902, 'depth': 10, 'boosting_type': 'Plain', 'bootstrap_type': 'Bayesian', 'bagging_temperature': 9.17098365275212}. Best is trial 3065 with value: 0.8863636363636364.
[32m[I 2023-04-21 02:47:52,619][39m Trial 3856 finished with value: 0.8539325842696629 and parameters: {'objective': 'CrossEntropy', 'colsample_bylevel': 0.08089100448684818, 'depth': 10, 'boosting_type': 'Plain', 'bootstrap_type': 'Bayesian', 'bagging_temperature': 9.101130298307597}. Best is trial 3065 with value: 0.8863636363636364.
[32m[I 2023-04-21 02:47:53,513][39m Trial 3857 finished with value: 0.8539325842696629 and parameters: {'objective': 'CrossEntropy', 'colsample_bylevel': 0.08424235135226872, 'depth': 3, 'boosting_type': 'Plain', 'bootstrap_type': 'Bayesian', 'bagging_temperature': 9.07001891519614}. Best is trial 3065 with value: 0.8863636363636364.
[32m[I 2023-04-21 02:47:54,406][39m Trial 3858 finished with value: 0.8666666666666666 and parameters: {'objective': 'CrossEntropy', 'colsample_bylevel': 0.0851254427063038, 'depth': 3, 'boosting_type': 'Plain', 'bootstrap_type': 'Bayesian', 'bagging_temperature': 9.837964313439338}. Best is trial 3065 with value: 0.8863636363636364.
[32m[I 2023-04-21 02:47:55,273][39m Trial 3859 finished with value: 0.8539325842696629 and parameters: {'objective': 'CrossEntropy', 'colsample_bylevel': 0.07947905704165646, 'depth': 3, 'boosting_type': 'Plain', 'bootstrap_type': 'Bayesian', 'bagging_temperature': 9.104554401386283}. Best is trial 3065 with value: 0.8863636363636364.
[32m[I 2023-04-21 02:47:56,171][39m Trial 3860 finished with value: 0.8275862068965518 and parameters: {'objective': 'CrossEntropy', 'colsample_bylevel': 0.09026619620319835, 'depth': 9, 'boosting_type': 'Plain', 'bootstrap_type': 'Bernoulli', 'subsample': 0.15430103895585878}. Best is trial 3065 with value: 0.8863636363636364.
[32m[I 2023-04-21 02:47:57,444][39m Trial 3861 finished with value: 0.8505747126436782 and parameters: {'objective': 'Logloss', 'colsample_bylevel': 0.04816740662701386, 'depth': 10, 'boosting_type': 'Plain', 'bootstrap_type': 'Bayesian', 'bagging_temperature': 9.821914645149821}. Best is trial 3065 with value: 0.8863636363636364.
[32m[I 2023-04-21 02:47:58,752][39m Trial 3862 finished with value: 0.8275862068965518 and parameters: {'objective': 'CrossEntropy', 'colsample_bylevel': 0.08221564486834346, 'depth': 7, 'boosting_type': 'Plain', 'bootstrap_type': 'Bayesian', 'bagging_temperature': 1.3002199077255878}. Best is trial 3065 with value: 0.8863636363636364.
[32m[I 2023-04-21 02:47:59,684][39m Trial 3863 finished with value: 0.8275862068965518 and parameters: {'objective': 'Logloss', 'colsample_bylevel': 0.08220982473418205, 'depth': 4, 'boosting_type': 'Plain', 'bootstrap_type': 'Bayesian', 'bagging_temperature': 9.212625352382164}. Best is trial 3065 with value: 0.8863636363636364.
[32m[I 2023-04-21 02:48:00,439][39m Trial 3864 finished with value: 0.8409090909090909 and parameters: {'objective': 'Logloss', 'colsample_bylevel': 0.0839815804463366, 'depth': 4, 'boosting_type': 'Plain', 'bootstrap_type': 'Bayesian', 'bagging_temperature': 9.24996888112874}. Best is trial 3065 with value: 0.8863636363636364.
[32m[I 2023-04-21 02:48:01,097][39m Trial 3865 finished with value: 0.8409090909090909 and parameters: {'objective': 'CrossEntropy', 'colsample_bylevel': 0.08081084059434725, 'depth': 10, 'boosting_type': 'Plain', 'bootstrap_type': 'Bayesian', 'bagging_temperature': 8.975378981478848}. Best is trial 3065 with value: 0.8863636363636364.
[32m[I 2023-04-21 02:48:01,928][39m Trial 3866 finished with value: 0.8666666666666666 and parameters: {'objective': 'Logloss', 'colsample_bylevel': 0.0789934602173667, 'depth': 3, 'boosting_type': 'Plain', 'bootstrap_type': 'Bayesian', 'bagging_temperature': 9.635949580183487}. Best is trial 3065 with value: 0.8863636363636364.
[32m[I 2023-04-21 02:48:02,929][39m Trial 3867 finished with value: 0.8539325842696629 and parameters: {'objective': 'CrossEntropy', 'colsample_bylevel': 0.06724866496856871, 'depth': 8, 'boosting_type': 'Plain', 'bootstrap_type': 'Bayesian', 'bagging_temperature': 8.950544832946026}. Best is trial 3065 with value: 0.8863636363636364.
[32m[I 2023-04-21 02:48:04,357][39m Trial 3868 finished with value: 0.8409090909090909 and parameters: {'objective': 'CrossEntropy', 'colsample_bylevel': 0.07451281787255262, 'depth': 9, 'boosting_type': 'Plain', 'bootstrap_type': 'Bayesian', 'bagging_temperature': 1.5878378675897995}. Best is trial 3065 with value: 0.8863636363636364.
[32m[I 2023-04-21 02:48:05,672][39m Trial 3869 finished with value: 0.8089887640449439 and parameters: {'objective': 'Logloss', 'colsample_bylevel': 0.07352262938196313, 'depth': 2, 'boosting_type': 'Plain', 'bootstrap_type': 'MVS'}. Best is trial 3065 with value: 0.8863636363636364.
[32m[I 2023-04-21 02:48:06,523][39m Trial 3870 finished with value: 0.8275862068965518 and parameters: {'objective': 'CrossEntropy', 'colsample_bylevel': 0.06587524952631266, 'depth': 3, 'boosting_type': 'Plain', 'bootstrap_type': 'MVS'}. Best is trial 3065 with value: 0.8863636363636364.
[32m[I 2023-04-21 02:48:07,324][39m Trial 3871 finished with value: 0.8275862068965518 and parameters: {'objective': 'CrossEntropy', 'colsample_bylevel': 0.08611372403044236, 'depth': 3, 'boosting_type': 'Plain', 'bootstrap_type': 'Bernoulli', 'subsample': 0.34247680905662947}. Best is trial 3065 with value: 0.8863636363636364.
[32m[I 2023-04-21 02:48:07,963][39m Trial 3872 finished with value: 0.8666666666666666 and parameters: {'objective': 'CrossEntropy', 'colsample_bylevel': 0.08718991376166067, 'depth': 3, 'boosting_type': 'Plain', 'bootstrap_type': 'Bayesian', 'bagging_temperature': 9.415933789372163}. Best is trial 3065 with value: 0.8863636363636364.
[32m[I 2023-04-21 02:48:08,967][39m Trial 3873 finished with value: 0.8409090909090909 and parameters: {'objective': 'Logloss', 'colsample_bylevel': 0.09068292983830221, 'depth': 12, 'boosting_type': 'Plain', 'bootstrap_type': 'Bayesian', 'bagging_temperature': 9.838869964237686}. Best is trial 3065 with value: 0.8863636363636364.
[32m[I 2023-04-21 02:48:09,889][39m Trial 3874 finished with value: 0.8539325842696629 and parameters: {'objective': 'CrossEntropy', 'colsample_bylevel': 0.06629834919735049, 'depth': 12, 'boosting_type': 'Plain', 'bootstrap_type': 'Bayesian', 'bagging_temperature': 9.519468087964533}. Best is trial 3065 with value: 0.8863636363636364.
[32m[I 2023-04-21 02:48:14,688][39m Trial 3875 finished with value: 0.8409090909090909 and parameters: {'objective': 'CrossEntropy', 'colsample_bylevel': 0.07908253867222223, 'depth': 7, 'boosting_type': 'Ordered', 'bootstrap_type': 'Bayesian', 'bagging_temperature': 9.966050411817934}. Best is trial 3065 with value: 0.8863636363636364.
[32m[I 2023-04-21 02:48:15,878][39m Trial 3876 finished with value: 0.8539325842696629 and parameters: {'objective': 'CrossEntropy', 'colsample_bylevel': 0.08063740584446037, 'depth': 10, 'boosting_type': 'Plain', 'bootstrap_type': 'Bayesian', 'bagging_temperature': 9.451380884346335}. Best is trial 3065 with value: 0.8863636363636364.
[32m[I 2023-04-21 02:48:16,684][39m Trial 3877 finished with value: 0.8505747126436782 and parameters: {'objective': 'CrossEntropy', 'colsample_bylevel': 0.0734598789241151, 'depth': 12, 'boosting_type': 'Plain', 'bootstrap_type': 'Bayesian', 'bagging_temperature': 9.524033300863003}. Best is trial 3065 with value: 0.8863636363636364.
[32m[I 2023-04-21 02:48:17,383][39m Trial 3878 finished with value: 0.8539325842696629 and parameters: {'objective': 'Logloss', 'colsample_bylevel': 0.08514264934216244, 'depth': 3, 'boosting_type': 'Plain', 'bootstrap_type': 'Bayesian', 'bagging_temperature': 9.416951163745267}. Best is trial 3065 with value: 0.8863636363636364.
[32m[I 2023-04-21 02:48:18,375][39m Trial 3879 finished with value: 0.8636363636363636 and parameters: {'objective': 'CrossEntropy', 'colsample_bylevel': 0.07813375017671564, 'depth': 10, 'boosting_type': 'Plain', 'bootstrap_type': 'Bayesian', 'bagging_temperature': 9.670534683595701}. Best is trial 3065 with value: 0.8863636363636364.
[32m[I 2023-04-21 02:48:19,618][39m Trial 3880 finished with value: 0.8539325842696629 and parameters: {'objective': 'CrossEntropy', 'colsample_bylevel': 0.06836225906287434, 'depth': 7, 'boosting_type': 'Plain', 'bootstrap_type': 'Bayesian', 'bagging_temperature': 8.388372472843411}. Best is trial 3065 with value: 0.8863636363636364.
[32m[I 2023-04-21 02:48:20,934][39m Trial 3881 finished with value: 0.8409090909090909 and parameters: {'objective': 'CrossEntropy', 'colsample_bylevel': 0.07753896620160435, 'depth': 3, 'boosting_type': 'Plain', 'bootstrap_type': 'Bayesian', 'bagging_temperature': 9.984588406115959}. Best is trial 3065 with value: 0.8863636363636364.
[32m[I 2023-04-21 02:48:21,727][39m Trial 3882 finished with value: 0.8539325842696629 and parameters: {'objective': 'CrossEntropy', 'colsample_bylevel': 0.06258614925564153, 'depth': 3, 'boosting_type': 'Plain', 'bootstrap_type': 'Bayesian', 'bagging_temperature': 9.774388201216226}. Best is trial 3065 with value: 0.8863636363636364.
[32m[I 2023-04-21 02:48:22,500][39m Trial 3883 finished with value: 0.8539325842696629 and parameters: {'objective': 'CrossEntropy', 'colsample_bylevel': 0.08588128028248938, 'depth': 9, 'boosting_type': 'Plain', 'bootstrap_type': 'Bayesian', 'bagging_temperature': 9.758909903320522}. Best is trial 3065 with value: 0.8863636363636364.
[32m[I 2023-04-21 02:48:23,459][39m Trial 3884 finished with value: 0.8275862068965518 and parameters: {'objective': 'CrossEntropy', 'colsample_bylevel': 0.072381152561297, 'depth': 11, 'boosting_type': 'Plain', 'bootstrap_type': 'Bayesian', 'bagging_temperature': 9.163562249398147}. Best is trial 3065 with value: 0.8863636363636364.
[32m[I 2023-04-21 02:48:24,676][39m Trial 3885 finished with value: 0.8666666666666666 and parameters: {'objective': 'Logloss', 'colsample_bylevel': 0.07984912441289785, 'depth': 3, 'boosting_type': 'Plain', 'bootstrap_type': 'Bayesian', 'bagging_temperature': 8.256689185119479}. Best is trial 3065 with value: 0.8863636363636364.
[32m[I 2023-04-21 02:48:25,436][39m Trial 3886 finished with value: 0.8409090909090909 and parameters: {'objective': 'CrossEntropy', 'colsample_bylevel': 0.07193181224096815, 'depth': 9, 'boosting_type': 'Plain', 'bootstrap_type': 'Bayesian', 'bagging_temperature': 8.689214472997785}. Best is trial 3065 with value: 0.8863636363636364.
[32m[I 2023-04-21 02:48:26,069][39m Trial 3887 finished with value: 0.8539325842696629 and parameters: {'objective': 'Logloss', 'colsample_bylevel': 0.08218466927536992, 'depth': 3, 'boosting_type': 'Plain', 'bootstrap_type': 'MVS'}. Best is trial 3065 with value: 0.8863636363636364.
[32m[I 2023-04-21 02:48:27,014][39m Trial 3888 finished with value: 0.8275862068965518 and parameters: {'objective': 'CrossEntropy', 'colsample_bylevel': 0.07083029424394616, 'depth': 8, 'boosting_type': 'Plain', 'bootstrap_type': 'Bayesian', 'bagging_temperature': 8.928886889788897}. Best is trial 3065 with value: 0.8863636363636364.
[32m[I 2023-04-21 02:48:28,226][39m Trial 3889 finished with value: 0.8372093023255814 and parameters: {'objective': 'CrossEntropy', 'colsample_bylevel': 0.07358746481286513, 'depth': 10, 'boosting_type': 'Plain', 'bootstrap_type': 'Bayesian', 'bagging_temperature': 1.1134243755378987}. Best is trial 3065 with value: 0.8863636363636364.
