[32m[I 2023-04-21 03:00:31,649][39m Trial 4479 finished with value: 0.8636363636363636 and parameters: {'objective': 'CrossEntropy', 'colsample_bylevel': 0.08045195918305212, 'depth': 10, 'boosting_type': 'Plain', 'bootstrap_type': 'Bayesian', 'bagging_temperature': 9.434898427942963}. Best is trial 3065 with value: 0.8863636363636364.
[32m[I 2023-04-21 03:00:32,608][39m Trial 4480 finished with value: 0.8539325842696629 and parameters: {'objective': 'CrossEntropy', 'colsample_bylevel': 0.07583178587713518, 'depth': 10, 'boosting_type': 'Plain', 'bootstrap_type': 'Bayesian', 'bagging_temperature': 9.476959630619454}. Best is trial 3065 with value: 0.8863636363636364.
[32m[I 2023-04-21 03:00:33,383][39m Trial 4481 finished with value: 0.8181818181818182 and parameters: {'objective': 'CrossEntropy', 'colsample_bylevel': 0.07486191490311105, 'depth': 4, 'boosting_type': 'Plain', 'bootstrap_type': 'MVS'}. Best is trial 3065 with value: 0.8863636363636364.
[32m[I 2023-04-21 03:00:34,203][39m Trial 4482 finished with value: 0.8539325842696629 and parameters: {'objective': 'Logloss', 'colsample_bylevel': 0.07142582778057349, 'depth': 5, 'boosting_type': 'Plain', 'bootstrap_type': 'Bayesian', 'bagging_temperature': 9.501500027445934}. Best is trial 3065 with value: 0.8863636363636364.
[32m[I 2023-04-21 03:00:35,117][39m Trial 4483 finished with value: 0.8539325842696629 and parameters: {'objective': 'CrossEntropy', 'colsample_bylevel': 0.06865230807078179, 'depth': 9, 'boosting_type': 'Plain', 'bootstrap_type': 'Bayesian', 'bagging_temperature': 9.841441103886623}. Best is trial 3065 with value: 0.8863636363636364.
[32m[I 2023-04-21 03:00:36,572][39m Trial 4484 finished with value: 0.8409090909090909 and parameters: {'objective': 'CrossEntropy', 'colsample_bylevel': 0.08388330790147738, 'depth': 9, 'boosting_type': 'Plain', 'bootstrap_type': 'Bernoulli', 'subsample': 0.998875036993985}. Best is trial 3065 with value: 0.8863636363636364.
[32m[I 2023-04-21 03:00:37,429][39m Trial 4485 finished with value: 0.8409090909090909 and parameters: {'objective': 'CrossEntropy', 'colsample_bylevel': 0.08226941747515083, 'depth': 3, 'boosting_type': 'Plain', 'bootstrap_type': 'Bayesian', 'bagging_temperature': 0.020678328965352044}. Best is trial 3065 with value: 0.8863636363636364.
[32m[I 2023-04-21 03:00:38,630][39m Trial 4486 finished with value: 0.8539325842696629 and parameters: {'objective': 'CrossEntropy', 'colsample_bylevel': 0.09553935986248112, 'depth': 12, 'boosting_type': 'Plain', 'bootstrap_type': 'Bayesian', 'bagging_temperature': 7.836807384423976}. Best is trial 3065 with value: 0.8863636363636364.
[32m[I 2023-04-21 03:00:39,467][39m Trial 4487 finished with value: 0.8409090909090909 and parameters: {'objective': 'CrossEntropy', 'colsample_bylevel': 0.08441067557784913, 'depth': 3, 'boosting_type': 'Plain', 'bootstrap_type': 'Bayesian', 'bagging_temperature': 9.232633744089027}. Best is trial 3065 with value: 0.8863636363636364.
[32m[I 2023-04-21 03:00:40,490][39m Trial 4488 finished with value: 0.8444444444444446 and parameters: {'objective': 'CrossEntropy', 'colsample_bylevel': 0.08928951358908276, 'depth': 3, 'boosting_type': 'Plain', 'bootstrap_type': 'Bayesian', 'bagging_temperature': 9.98862238056686}. Best is trial 3065 with value: 0.8863636363636364.
[32m[I 2023-04-21 03:00:41,782][39m Trial 4489 finished with value: 0.8409090909090909 and parameters: {'objective': 'CrossEntropy', 'colsample_bylevel': 0.07976480243725836, 'depth': 4, 'boosting_type': 'Plain', 'bootstrap_type': 'MVS'}. Best is trial 3065 with value: 0.8863636363636364.
[32m[I 2023-04-21 03:00:43,046][39m Trial 4490 finished with value: 0.8636363636363636 and parameters: {'objective': 'CrossEntropy', 'colsample_bylevel': 0.08246062513410907, 'depth': 10, 'boosting_type': 'Plain', 'bootstrap_type': 'Bayesian', 'bagging_temperature': 8.883810203781069}. Best is trial 3065 with value: 0.8863636363636364.
[32m[I 2023-04-21 03:00:47,763][39m Trial 4491 finished with value: 0.8409090909090909 and parameters: {'objective': 'CrossEntropy', 'colsample_bylevel': 0.08602253563668205, 'depth': 12, 'boosting_type': 'Ordered', 'bootstrap_type': 'Bayesian', 'bagging_temperature': 9.229379541478187}. Best is trial 3065 with value: 0.8863636363636364.
[32m[I 2023-04-21 03:00:49,161][39m Trial 4492 finished with value: 0.8275862068965518 and parameters: {'objective': 'CrossEntropy', 'colsample_bylevel': 0.08128033585938838, 'depth': 4, 'boosting_type': 'Plain', 'bootstrap_type': 'Bayesian', 'bagging_temperature': 6.1461818392031535}. Best is trial 3065 with value: 0.8863636363636364.
[32m[I 2023-04-21 03:00:50,431][39m Trial 4493 finished with value: 0.8539325842696629 and parameters: {'objective': 'CrossEntropy', 'colsample_bylevel': 0.08136476984663295, 'depth': 3, 'boosting_type': 'Plain', 'bootstrap_type': 'Bayesian', 'bagging_temperature': 9.397563525563587}. Best is trial 3065 with value: 0.8863636363636364.
[32m[I 2023-04-21 03:00:51,290][39m Trial 4494 finished with value: 0.8409090909090909 and parameters: {'objective': 'CrossEntropy', 'colsample_bylevel': 0.0865089906496059, 'depth': 3, 'boosting_type': 'Plain', 'bootstrap_type': 'Bayesian', 'bagging_temperature': 9.327963190275955}. Best is trial 3065 with value: 0.8863636363636364.
[32m[I 2023-04-21 03:00:52,159][39m Trial 4495 finished with value: 0.8409090909090909 and parameters: {'objective': 'CrossEntropy', 'colsample_bylevel': 0.07966669216905804, 'depth': 9, 'boosting_type': 'Plain', 'bootstrap_type': 'Bayesian', 'bagging_temperature': 9.614826002158859}. Best is trial 3065 with value: 0.8863636363636364.
[32m[I 2023-04-21 03:00:53,303][39m Trial 4496 finished with value: 0.8666666666666666 and parameters: {'objective': 'Logloss', 'colsample_bylevel': 0.07635374592645991, 'depth': 4, 'boosting_type': 'Plain', 'bootstrap_type': 'Bayesian', 'bagging_temperature': 9.620103796440626}. Best is trial 3065 with value: 0.8863636363636364.
[32m[I 2023-04-21 03:00:54,132][39m Trial 4497 finished with value: 0.8539325842696629 and parameters: {'objective': 'CrossEntropy', 'colsample_bylevel': 0.08068656407520515, 'depth': 10, 'boosting_type': 'Plain', 'bootstrap_type': 'Bayesian', 'bagging_temperature': 9.653230527258652}. Best is trial 3065 with value: 0.8863636363636364.
[32m[I 2023-04-21 03:00:55,365][39m Trial 4498 finished with value: 0.8409090909090909 and parameters: {'objective': 'CrossEntropy', 'colsample_bylevel': 0.08328655371197063, 'depth': 10, 'boosting_type': 'Plain', 'bootstrap_type': 'Bayesian', 'bagging_temperature': 9.684461708006493}. Best is trial 3065 with value: 0.8863636363636364.
[32m[I 2023-04-21 03:00:56,351][39m Trial 4499 finished with value: 0.8666666666666666 and parameters: {'objective': 'CrossEntropy', 'colsample_bylevel': 0.0881856136753426, 'depth': 3, 'boosting_type': 'Plain', 'bootstrap_type': 'Bayesian', 'bagging_temperature': 9.571484089396172}. Best is trial 3065 with value: 0.8863636363636364.
[32m[I 2023-04-21 03:00:57,455][39m Trial 4500 finished with value: 0.8409090909090909 and parameters: {'objective': 'CrossEntropy', 'colsample_bylevel': 0.08178614363523559, 'depth': 11, 'boosting_type': 'Plain', 'bootstrap_type': 'Bayesian', 'bagging_temperature': 9.317738678584206}. Best is trial 3065 with value: 0.8863636363636364.
[32m[I 2023-04-21 03:00:58,142][39m Trial 4501 finished with value: 0.8505747126436782 and parameters: {'objective': 'Logloss', 'colsample_bylevel': 0.02285995212946311, 'depth': 9, 'boosting_type': 'Plain', 'bootstrap_type': 'Bayesian', 'bagging_temperature': 7.619245441624179}. Best is trial 3065 with value: 0.8863636363636364.
[32m[I 2023-04-21 03:00:59,211][39m Trial 4502 finished with value: 0.8539325842696629 and parameters: {'objective': 'Logloss', 'colsample_bylevel': 0.07313872965507508, 'depth': 10, 'boosting_type': 'Plain', 'bootstrap_type': 'Bayesian', 'bagging_temperature': 9.527277709684546}. Best is trial 3065 with value: 0.8863636363636364.
[32m[I 2023-04-21 03:01:00,016][39m Trial 4503 finished with value: 0.8275862068965518 and parameters: {'objective': 'CrossEntropy', 'colsample_bylevel': 0.08833426485736683, 'depth': 8, 'boosting_type': 'Plain', 'bootstrap_type': 'Bayesian', 'bagging_temperature': 9.7626715663862}. Best is trial 3065 with value: 0.8863636363636364.
[32m[I 2023-04-21 03:01:01,172][39m Trial 4504 finished with value: 0.8764044943820225 and parameters: {'objective': 'Logloss', 'colsample_bylevel': 0.09737295723640335, 'depth': 2, 'boosting_type': 'Plain', 'bootstrap_type': 'Bayesian', 'bagging_temperature': 8.071183749620532}. Best is trial 3065 with value: 0.8863636363636364.
[32m[I 2023-04-21 03:01:02,201][39m Trial 4505 finished with value: 0.8409090909090909 and parameters: {'objective': 'Logloss', 'colsample_bylevel': 0.09549537150163234, 'depth': 11, 'boosting_type': 'Plain', 'bootstrap_type': 'Bayesian', 'bagging_temperature': 9.006403817016908}. Best is trial 3065 with value: 0.8863636363636364.
[32m[I 2023-04-21 03:01:03,177][39m Trial 4506 finished with value: 0.8666666666666666 and parameters: {'objective': 'Logloss', 'colsample_bylevel': 0.09743881805289037, 'depth': 3, 'boosting_type': 'Plain', 'bootstrap_type': 'Bayesian', 'bagging_temperature': 8.7509350041339}. Best is trial 3065 with value: 0.8863636363636364.
[32m[I 2023-04-21 03:01:04,440][39m Trial 4507 finished with value: 0.8539325842696629 and parameters: {'objective': 'CrossEntropy', 'colsample_bylevel': 0.06139701042171738, 'depth': 9, 'boosting_type': 'Plain', 'bootstrap_type': 'MVS'}. Best is trial 3065 with value: 0.8863636363636364.
[32m[I 2023-04-21 03:01:05,555][39m Trial 4508 finished with value: 0.8275862068965518 and parameters: {'objective': 'CrossEntropy', 'colsample_bylevel': 0.08172214218546515, 'depth': 3, 'boosting_type': 'Plain', 'bootstrap_type': 'Bayesian', 'bagging_temperature': 9.198596479949774}. Best is trial 3065 with value: 0.8863636363636364.
[32m[I 2023-04-21 03:01:10,825][39m Trial 4509 finished with value: 0.8275862068965518 and parameters: {'objective': 'CrossEntropy', 'colsample_bylevel': 0.08687409611171715, 'depth': 5, 'boosting_type': 'Ordered', 'bootstrap_type': 'Bayesian', 'bagging_temperature': 9.53418513141276}. Best is trial 3065 with value: 0.8863636363636364.
[32m[I 2023-04-21 03:01:12,027][39m Trial 4510 finished with value: 0.8666666666666666 and parameters: {'objective': 'CrossEntropy', 'colsample_bylevel': 0.08069758733575973, 'depth': 3, 'boosting_type': 'Plain', 'bootstrap_type': 'Bayesian', 'bagging_temperature': 9.725358963504773}. Best is trial 3065 with value: 0.8863636363636364.
[32m[I 2023-04-21 03:01:12,997][39m Trial 4511 finished with value: 0.8666666666666666 and parameters: {'objective': 'Logloss', 'colsample_bylevel': 0.07031004845924832, 'depth': 4, 'boosting_type': 'Plain', 'bootstrap_type': 'Bayesian', 'bagging_temperature': 9.404439945310584}. Best is trial 3065 with value: 0.8863636363636364.
[32m[I 2023-04-21 03:01:13,842][39m Trial 4512 finished with value: 0.8351648351648352 and parameters: {'objective': 'CrossEntropy', 'colsample_bylevel': 0.08026404269577511, 'depth': 2, 'boosting_type': 'Plain', 'bootstrap_type': 'Bernoulli', 'subsample': 0.20658960045721358}. Best is trial 3065 with value: 0.8863636363636364.
[32m[I 2023-04-21 03:01:14,869][39m Trial 4513 finished with value: 0.8666666666666666 and parameters: {'objective': 'Logloss', 'colsample_bylevel': 0.06832495258588184, 'depth': 7, 'boosting_type': 'Plain', 'bootstrap_type': 'Bayesian', 'bagging_temperature': 5.018859689431173}. Best is trial 3065 with value: 0.8863636363636364.
[32m[I 2023-04-21 03:01:15,719][39m Trial 4514 finished with value: 0.8666666666666666 and parameters: {'objective': 'Logloss', 'colsample_bylevel': 0.06876075280700068, 'depth': 11, 'boosting_type': 'Plain', 'bootstrap_type': 'Bayesian', 'bagging_temperature': 9.812360456067147}. Best is trial 3065 with value: 0.8863636363636364.
[32m[I 2023-04-21 03:01:16,570][39m Trial 4515 finished with value: 0.8409090909090909 and parameters: {'objective': 'CrossEntropy', 'colsample_bylevel': 0.07237598462018513, 'depth': 10, 'boosting_type': 'Plain', 'bootstrap_type': 'Bayesian', 'bagging_temperature': 9.720422502062128}. Best is trial 3065 with value: 0.8863636363636364.
[32m[I 2023-04-21 03:01:17,503][39m Trial 4516 finished with value: 0.8409090909090909 and parameters: {'objective': 'CrossEntropy', 'colsample_bylevel': 0.07553091738026557, 'depth': 10, 'boosting_type': 'Plain', 'bootstrap_type': 'Bayesian', 'bagging_temperature': 9.722613852489985}. Best is trial 3065 with value: 0.8863636363636364.
[32m[I 2023-04-21 03:01:18,495][39m Trial 4517 finished with value: 0.8409090909090909 and parameters: {'objective': 'CrossEntropy', 'colsample_bylevel': 0.0758137302583936, 'depth': 11, 'boosting_type': 'Plain', 'bootstrap_type': 'Bayesian', 'bagging_temperature': 9.173596472129665}. Best is trial 3065 with value: 0.8863636363636364.
[32m[I 2023-04-21 03:01:19,429][39m Trial 4518 finished with value: 0.8222222222222222 and parameters: {'objective': 'CrossEntropy', 'colsample_bylevel': 0.054842679591796034, 'depth': 4, 'boosting_type': 'Plain', 'bootstrap_type': 'MVS'}. Best is trial 3065 with value: 0.8863636363636364.
[32m[I 2023-04-21 03:01:20,616][39m Trial 4519 finished with value: 0.8275862068965518 and parameters: {'objective': 'CrossEntropy', 'colsample_bylevel': 0.07291967380457907, 'depth': 10, 'boosting_type': 'Plain', 'bootstrap_type': 'Bayesian', 'bagging_temperature': 9.213669807382164}. Best is trial 3065 with value: 0.8863636363636364.
[32m[I 2023-04-21 03:01:21,711][39m Trial 4520 finished with value: 0.8372093023255814 and parameters: {'objective': 'CrossEntropy', 'colsample_bylevel': 0.07888263595785386, 'depth': 10, 'boosting_type': 'Plain', 'bootstrap_type': 'Bayesian', 'bagging_temperature': 3.7452880801698596}. Best is trial 3065 with value: 0.8863636363636364.
[32m[I 2023-04-21 03:01:22,402][39m Trial 4521 finished with value: 0.8764044943820225 and parameters: {'objective': 'CrossEntropy', 'colsample_bylevel': 0.07777369396613311, 'depth': 2, 'boosting_type': 'Plain', 'bootstrap_type': 'Bayesian', 'bagging_temperature': 9.537218468579812}. Best is trial 3065 with value: 0.8863636363636364.
[32m[I 2023-04-21 03:01:23,437][39m Trial 4522 finished with value: 0.7857142857142858 and parameters: {'objective': 'CrossEntropy', 'colsample_bylevel': 0.07662345520271718, 'depth': 12, 'boosting_type': 'Plain', 'bootstrap_type': 'MVS'}. Best is trial 3065 with value: 0.8863636363636364.
[32m[I 2023-04-21 03:01:24,686][39m Trial 4523 finished with value: 0.8409090909090909 and parameters: {'objective': 'Logloss', 'colsample_bylevel': 0.06105043176923877, 'depth': 4, 'boosting_type': 'Plain', 'bootstrap_type': 'Bayesian', 'bagging_temperature': 9.787328364041004}. Best is trial 3065 with value: 0.8863636363636364.
[32m[I 2023-04-21 03:01:25,867][39m Trial 4524 finished with value: 0.8314606741573034 and parameters: {'objective': 'CrossEntropy', 'colsample_bylevel': 0.08762650065722026, 'depth': 3, 'boosting_type': 'Plain', 'bootstrap_type': 'Bernoulli', 'subsample': 0.4156097781176845}. Best is trial 3065 with value: 0.8863636363636364.
[32m[I 2023-04-21 03:01:26,900][39m Trial 4525 finished with value: 0.8666666666666666 and parameters: {'objective': 'CrossEntropy', 'colsample_bylevel': 0.06392163835579244, 'depth': 8, 'boosting_type': 'Plain', 'bootstrap_type': 'Bayesian', 'bagging_temperature': 9.180171979574133}. Best is trial 3065 with value: 0.8863636363636364.
[32m[I 2023-04-21 03:01:27,867][39m Trial 4526 finished with value: 0.8539325842696629 and parameters: {'objective': 'CrossEntropy', 'colsample_bylevel': 0.0770412628450546, 'depth': 9, 'boosting_type': 'Plain', 'bootstrap_type': 'Bayesian', 'bagging_temperature': 9.445976544590943}. Best is trial 3065 with value: 0.8863636363636364.
[32m[I 2023-04-21 03:01:28,564][39m Trial 4527 finished with value: 0.8666666666666666 and parameters: {'objective': 'CrossEntropy', 'colsample_bylevel': 0.09431415695893268, 'depth': 3, 'boosting_type': 'Plain', 'bootstrap_type': 'Bayesian', 'bagging_temperature': 9.24397438022484}. Best is trial 3065 with value: 0.8863636363636364.
[32m[I 2023-04-21 03:01:29,820][39m Trial 4528 finished with value: 0.8409090909090909 and parameters: {'objective': 'CrossEntropy', 'colsample_bylevel': 0.07082882385819662, 'depth': 6, 'boosting_type': 'Plain', 'bootstrap_type': 'Bayesian', 'bagging_temperature': 8.561701215646991}. Best is trial 3065 with value: 0.8863636363636364.
[32m[I 2023-04-21 03:01:30,542][39m Trial 4529 finished with value: 0.8505747126436782 and parameters: {'objective': 'CrossEntropy', 'colsample_bylevel': 0.09563279010531979, 'depth': 7, 'boosting_type': 'Plain', 'bootstrap_type': 'Bayesian', 'bagging_temperature': 9.098862312993953}. Best is trial 3065 with value: 0.8863636363636364.
[32m[I 2023-04-21 03:01:31,700][39m Trial 4530 finished with value: 0.8539325842696629 and parameters: {'objective': 'CrossEntropy', 'colsample_bylevel': 0.054120714100769164, 'depth': 2, 'boosting_type': 'Plain', 'bootstrap_type': 'Bayesian', 'bagging_temperature': 9.777615395542488}. Best is trial 3065 with value: 0.8863636363636364.
[32m[I 2023-04-21 03:01:36,630][39m Trial 4531 finished with value: 0.8275862068965518 and parameters: {'objective': 'Logloss', 'colsample_bylevel': 0.09895093812286619, 'depth': 3, 'boosting_type': 'Ordered', 'bootstrap_type': 'Bayesian', 'bagging_temperature': 9.998305862228795}. Best is trial 3065 with value: 0.8863636363636364.
[32m[I 2023-04-21 03:01:37,738][39m Trial 4532 finished with value: 0.8791208791208791 and parameters: {'objective': 'CrossEntropy', 'colsample_bylevel': 0.07798248645084842, 'depth': 10, 'boosting_type': 'Plain', 'bootstrap_type': 'Bayesian', 'bagging_temperature': 9.125503847624264}. Best is trial 3065 with value: 0.8863636363636364.
[32m[I 2023-04-21 03:01:38,760][39m Trial 4533 finished with value: 0.8409090909090909 and parameters: {'objective': 'CrossEntropy', 'colsample_bylevel': 0.09375251508626134, 'depth': 10, 'boosting_type': 'Plain', 'bootstrap_type': 'Bayesian', 'bagging_temperature': 8.330894400271946}. Best is trial 3065 with value: 0.8863636363636364.
[32m[I 2023-04-21 03:01:40,056][39m Trial 4534 finished with value: 0.8275862068965518 and parameters: {'objective': 'Logloss', 'colsample_bylevel': 0.07069347314699742, 'depth': 7, 'boosting_type': 'Plain', 'bootstrap_type': 'Bayesian', 'bagging_temperature': 9.319905093215167}. Best is trial 3065 with value: 0.8863636363636364.
[32m[I 2023-04-21 03:01:41,393][39m Trial 4535 finished with value: 0.7857142857142858 and parameters: {'objective': 'CrossEntropy', 'colsample_bylevel': 0.034907428005678406, 'depth': 11, 'boosting_type': 'Plain', 'bootstrap_type': 'Bayesian', 'bagging_temperature': 9.519386125239624}. Best is trial 3065 with value: 0.8863636363636364.
[32m[I 2023-04-21 03:01:42,280][39m Trial 4536 finished with value: 0.8539325842696629 and parameters: {'objective': 'CrossEntropy', 'colsample_bylevel': 0.07572056759390056, 'depth': 10, 'boosting_type': 'Plain', 'bootstrap_type': 'Bayesian', 'bagging_temperature': 8.879763557176338}. Best is trial 3065 with value: 0.8863636363636364.
[32m[I 2023-04-21 03:01:43,134][39m Trial 4537 finished with value: 0.8666666666666666 and parameters: {'objective': 'Logloss', 'colsample_bylevel': 0.0726971677281196, 'depth': 4, 'boosting_type': 'Plain', 'bootstrap_type': 'Bayesian', 'bagging_temperature': 8.657911278977862}. Best is trial 3065 with value: 0.8863636363636364.
[32m[I 2023-04-21 03:01:44,170][39m Trial 4538 finished with value: 0.8409090909090909 and parameters: {'objective': 'CrossEntropy', 'colsample_bylevel': 0.07166987670389804, 'depth': 10, 'boosting_type': 'Plain', 'bootstrap_type': 'Bayesian', 'bagging_temperature': 9.825957494759985}. Best is trial 3065 with value: 0.8863636363636364.
[32m[I 2023-04-21 03:01:44,883][39m Trial 4539 finished with value: 0.8409090909090909 and parameters: {'objective': 'CrossEntropy', 'colsample_bylevel': 0.07045417412685731, 'depth': 10, 'boosting_type': 'Plain', 'bootstrap_type': 'Bayesian', 'bagging_temperature': 9.293963144466463}. Best is trial 3065 with value: 0.8863636363636364.
[32m[I 2023-04-21 03:01:45,921][39m Trial 4540 finished with value: 0.8139534883720929 and parameters: {'objective': 'CrossEntropy', 'colsample_bylevel': 0.08367116174104272, 'depth': 6, 'boosting_type': 'Plain', 'bootstrap_type': 'Bayesian', 'bagging_temperature': 8.675181844748355}. Best is trial 3065 with value: 0.8863636363636364.
[32m[I 2023-04-21 03:01:47,175][39m Trial 4541 finished with value: 0.8666666666666666 and parameters: {'objective': 'Logloss', 'colsample_bylevel': 0.0695114541002932, 'depth': 10, 'boosting_type': 'Plain', 'bootstrap_type': 'Bayesian', 'bagging_temperature': 5.595884619574122}. Best is trial 3065 with value: 0.8863636363636364.
[32m[I 2023-04-21 03:01:48,257][39m Trial 4542 finished with value: 0.8409090909090909 and parameters: {'objective': 'CrossEntropy', 'colsample_bylevel': 0.08476622694990886, 'depth': 3, 'boosting_type': 'Plain', 'bootstrap_type': 'MVS'}. Best is trial 3065 with value: 0.8863636363636364.
[32m[I 2023-04-21 03:01:48,979][39m Trial 4543 finished with value: 0.8666666666666666 and parameters: {'objective': 'Logloss', 'colsample_bylevel': 0.07410298285852418, 'depth': 4, 'boosting_type': 'Plain', 'bootstrap_type': 'Bayesian', 'bagging_temperature': 9.524806039024304}. Best is trial 3065 with value: 0.8863636363636364.
