[32m[I 2023-04-21 01:56:43,375][39m Trial 1191 finished with value: 0.8539325842696629 and parameters: {'objective': 'CrossEntropy', 'colsample_bylevel': 0.07701110206219558, 'depth': 3, 'boosting_type': 'Plain', 'bootstrap_type': 'Bayesian', 'bagging_temperature': 8.664715777472715}. Best is trial 98 with value: 0.8791208791208791.
[32m[I 2023-04-21 01:56:44,172][39m Trial 1192 finished with value: 0.7407407407407408 and parameters: {'objective': 'Logloss', 'colsample_bylevel': 0.013229187651839107, 'depth': 3, 'boosting_type': 'Plain', 'bootstrap_type': 'Bayesian', 'bagging_temperature': 9.547964929173768}. Best is trial 98 with value: 0.8791208791208791.
[32m[I 2023-04-21 01:56:44,915][39m Trial 1193 finished with value: 0.8275862068965518 and parameters: {'objective': 'CrossEntropy', 'colsample_bylevel': 0.0970694374589543, 'depth': 4, 'boosting_type': 'Plain', 'bootstrap_type': 'Bayesian', 'bagging_temperature': 8.891647065023182}. Best is trial 98 with value: 0.8791208791208791.
[32m[I 2023-04-21 01:56:45,713][39m Trial 1194 finished with value: 0.8409090909090909 and parameters: {'objective': 'CrossEntropy', 'colsample_bylevel': 0.07846241772323419, 'depth': 6, 'boosting_type': 'Plain', 'bootstrap_type': 'Bayesian', 'bagging_temperature': 9.811142066068701}. Best is trial 98 with value: 0.8791208791208791.
[32m[I 2023-04-21 01:56:46,565][39m Trial 1195 finished with value: 0.8409090909090909 and parameters: {'objective': 'CrossEntropy', 'colsample_bylevel': 0.07378456372398134, 'depth': 3, 'boosting_type': 'Plain', 'bootstrap_type': 'Bayesian', 'bagging_temperature': 8.46372793496151}. Best is trial 98 with value: 0.8791208791208791.
[32m[I 2023-04-21 01:56:47,661][39m Trial 1196 finished with value: 0.8409090909090909 and parameters: {'objective': 'CrossEntropy', 'colsample_bylevel': 0.07463178906010523, 'depth': 3, 'boosting_type': 'Plain', 'bootstrap_type': 'Bayesian', 'bagging_temperature': 8.617499515658114}. Best is trial 98 with value: 0.8791208791208791.
[32m[I 2023-04-21 01:56:48,578][39m Trial 1197 finished with value: 0.8666666666666666 and parameters: {'objective': 'CrossEntropy', 'colsample_bylevel': 0.08080160897802594, 'depth': 3, 'boosting_type': 'Plain', 'bootstrap_type': 'Bayesian', 'bagging_temperature': 9.179402101334995}. Best is trial 98 with value: 0.8791208791208791.
[32m[I 2023-04-21 01:56:49,183][39m Trial 1198 finished with value: 0.8539325842696629 and parameters: {'objective': 'CrossEntropy', 'colsample_bylevel': 0.07861301823815207, 'depth': 3, 'boosting_type': 'Plain', 'bootstrap_type': 'Bayesian', 'bagging_temperature': 9.991876508925047}. Best is trial 98 with value: 0.8791208791208791.
[32m[I 2023-04-21 01:56:50,012][39m Trial 1199 finished with value: 0.8409090909090909 and parameters: {'objective': 'CrossEntropy', 'colsample_bylevel': 0.08232053200882393, 'depth': 3, 'boosting_type': 'Plain', 'bootstrap_type': 'Bayesian', 'bagging_temperature': 8.14352429029666}. Best is trial 98 with value: 0.8791208791208791.
[32m[I 2023-04-21 01:56:55,096][39m Trial 1200 finished with value: 0.8409090909090909 and parameters: {'objective': 'Logloss', 'colsample_bylevel': 0.0815850391660886, 'depth': 3, 'boosting_type': 'Ordered', 'bootstrap_type': 'Bayesian', 'bagging_temperature': 9.502404785702403}. Best is trial 98 with value: 0.8791208791208791.
[32m[I 2023-04-21 01:56:56,017][39m Trial 1201 finished with value: 0.8275862068965518 and parameters: {'objective': 'CrossEntropy', 'colsample_bylevel': 0.09202469296385092, 'depth': 4, 'boosting_type': 'Plain', 'bootstrap_type': 'MVS'}. Best is trial 98 with value: 0.8791208791208791.
[32m[I 2023-04-21 01:56:56,910][39m Trial 1202 finished with value: 0.8409090909090909 and parameters: {'objective': 'CrossEntropy', 'colsample_bylevel': 0.08402583404991179, 'depth': 3, 'boosting_type': 'Plain', 'bootstrap_type': 'Bayesian', 'bagging_temperature': 9.051698075945538}. Best is trial 98 with value: 0.8791208791208791.
[32m[I 2023-04-21 01:56:57,573][39m Trial 1203 finished with value: 0.8275862068965518 and parameters: {'objective': 'CrossEntropy', 'colsample_bylevel': 0.07978303725620908, 'depth': 4, 'boosting_type': 'Plain', 'bootstrap_type': 'Bayesian', 'bagging_temperature': 9.233572903059407}. Best is trial 98 with value: 0.8791208791208791.
[32m[I 2023-04-21 01:56:58,514][39m Trial 1204 finished with value: 0.8666666666666666 and parameters: {'objective': 'CrossEntropy', 'colsample_bylevel': 0.08389360515022963, 'depth': 3, 'boosting_type': 'Plain', 'bootstrap_type': 'Bayesian', 'bagging_temperature': 8.890079499057784}. Best is trial 98 with value: 0.8791208791208791.
[32m[I 2023-04-21 01:56:59,594][39m Trial 1205 finished with value: 0.7816091954022988 and parameters: {'objective': 'CrossEntropy', 'colsample_bylevel': 0.01943441664604155, 'depth': 3, 'boosting_type': 'Plain', 'bootstrap_type': 'Bayesian', 'bagging_temperature': 9.041661263414827}. Best is trial 98 with value: 0.8791208791208791.
[32m[I 2023-04-21 01:57:00,349][39m Trial 1206 finished with value: 0.8539325842696629 and parameters: {'objective': 'CrossEntropy', 'colsample_bylevel': 0.07940894220988054, 'depth': 3, 'boosting_type': 'Plain', 'bootstrap_type': 'Bayesian', 'bagging_temperature': 5.796605858585452}. Best is trial 98 with value: 0.8791208791208791.
[32m[I 2023-04-21 01:57:01,034][39m Trial 1207 finished with value: 0.8409090909090909 and parameters: {'objective': 'CrossEntropy', 'colsample_bylevel': 0.08028541482014183, 'depth': 7, 'boosting_type': 'Plain', 'bootstrap_type': 'Bayesian', 'bagging_temperature': 9.332453824613419}. Best is trial 98 with value: 0.8791208791208791.
[32m[I 2023-04-21 01:57:01,920][39m Trial 1208 finished with value: 0.8409090909090909 and parameters: {'objective': 'CrossEntropy', 'colsample_bylevel': 0.07733037957779224, 'depth': 5, 'boosting_type': 'Plain', 'bootstrap_type': 'Bayesian', 'bagging_temperature': 8.798055485973615}. Best is trial 98 with value: 0.8791208791208791.
[32m[I 2023-04-21 01:57:02,787][39m Trial 1209 finished with value: 0.8666666666666666 and parameters: {'objective': 'Logloss', 'colsample_bylevel': 0.07569554184449404, 'depth': 3, 'boosting_type': 'Plain', 'bootstrap_type': 'Bayesian', 'bagging_temperature': 8.37865680875119}. Best is trial 98 with value: 0.8791208791208791.
[32m[I 2023-04-21 01:57:03,418][39m Trial 1210 finished with value: 0.8275862068965518 and parameters: {'objective': 'CrossEntropy', 'colsample_bylevel': 0.04013566716160343, 'depth': 3, 'boosting_type': 'Plain', 'bootstrap_type': 'Bernoulli', 'subsample': 0.12727196058019785}. Best is trial 98 with value: 0.8791208791208791.
[32m[I 2023-04-21 01:57:04,278][39m Trial 1211 finished with value: 0.8791208791208791 and parameters: {'objective': 'CrossEntropy', 'colsample_bylevel': 0.08201822150852008, 'depth': 3, 'boosting_type': 'Plain', 'bootstrap_type': 'Bayesian', 'bagging_temperature': 9.601236689831948}. Best is trial 98 with value: 0.8791208791208791.
[32m[I 2023-04-21 01:57:05,165][39m Trial 1212 finished with value: 0.8666666666666666 and parameters: {'objective': 'CrossEntropy', 'colsample_bylevel': 0.08283143490474834, 'depth': 3, 'boosting_type': 'Plain', 'bootstrap_type': 'Bayesian', 'bagging_temperature': 9.464390984223622}. Best is trial 98 with value: 0.8791208791208791.
[32m[I 2023-04-21 01:57:06,072][39m Trial 1213 finished with value: 0.8505747126436782 and parameters: {'objective': 'CrossEntropy', 'colsample_bylevel': 0.08207978906419913, 'depth': 3, 'boosting_type': 'Plain', 'bootstrap_type': 'Bayesian', 'bagging_temperature': 9.329900900675536}. Best is trial 98 with value: 0.8791208791208791.
[32m[I 2023-04-21 01:57:06,760][39m Trial 1214 finished with value: 0.8275862068965518 and parameters: {'objective': 'CrossEntropy', 'colsample_bylevel': 0.08362582086615515, 'depth': 10, 'boosting_type': 'Plain', 'bootstrap_type': 'Bayesian', 'bagging_temperature': 9.645154077049323}. Best is trial 98 with value: 0.8791208791208791.
[32m[I 2023-04-21 01:57:07,660][39m Trial 1215 finished with value: 0.8539325842696629 and parameters: {'objective': 'CrossEntropy', 'colsample_bylevel': 0.09467826719928175, 'depth': 3, 'boosting_type': 'Plain', 'bootstrap_type': 'Bayesian', 'bagging_temperature': 9.03538417431835}. Best is trial 98 with value: 0.8791208791208791.
[32m[I 2023-04-21 01:57:08,542][39m Trial 1216 finished with value: 0.8539325842696629 and parameters: {'objective': 'CrossEntropy', 'colsample_bylevel': 0.05996130780346459, 'depth': 4, 'boosting_type': 'Plain', 'bootstrap_type': 'MVS'}. Best is trial 98 with value: 0.8791208791208791.
[32m[I 2023-04-21 01:57:13,457][39m Trial 1217 finished with value: 0.8409090909090909 and parameters: {'objective': 'Logloss', 'colsample_bylevel': 0.0908051978447355, 'depth': 3, 'boosting_type': 'Ordered', 'bootstrap_type': 'Bayesian', 'bagging_temperature': 9.81955109491026}. Best is trial 98 with value: 0.8791208791208791.
[32m[I 2023-04-21 01:57:14,642][39m Trial 1218 finished with value: 0.8409090909090909 and parameters: {'objective': 'CrossEntropy', 'colsample_bylevel': 0.07775051074374192, 'depth': 3, 'boosting_type': 'Plain', 'bootstrap_type': 'Bayesian', 'bagging_temperature': 9.59377359706239}. Best is trial 98 with value: 0.8791208791208791.
[32m[I 2023-04-21 01:57:15,514][39m Trial 1219 finished with value: 0.8666666666666666 and parameters: {'objective': 'CrossEntropy', 'colsample_bylevel': 0.0798829063718034, 'depth': 3, 'boosting_type': 'Plain', 'bootstrap_type': 'Bayesian', 'bagging_temperature': 9.743801670410104}. Best is trial 98 with value: 0.8791208791208791.
[32m[I 2023-04-21 01:57:16,412][39m Trial 1220 finished with value: 0.8275862068965518 and parameters: {'objective': 'CrossEntropy', 'colsample_bylevel': 0.09275011741107189, 'depth': 4, 'boosting_type': 'Plain', 'bootstrap_type': 'Bayesian', 'bagging_temperature': 9.43981397585121}. Best is trial 98 with value: 0.8791208791208791.
[32m[I 2023-04-21 01:57:17,284][39m Trial 1221 finished with value: 0.8666666666666666 and parameters: {'objective': 'CrossEntropy', 'colsample_bylevel': 0.07799571209076787, 'depth': 3, 'boosting_type': 'Plain', 'bootstrap_type': 'Bayesian', 'bagging_temperature': 8.92932068337023}. Best is trial 98 with value: 0.8791208791208791.
[32m[I 2023-04-21 01:57:17,879][39m Trial 1222 finished with value: 0.8791208791208791 and parameters: {'objective': 'CrossEntropy', 'colsample_bylevel': 0.08397938053000062, 'depth': 3, 'boosting_type': 'Plain', 'bootstrap_type': 'Bayesian', 'bagging_temperature': 9.294268846862975}. Best is trial 98 with value: 0.8791208791208791.
[32m[I 2023-04-21 01:57:18,670][39m Trial 1223 finished with value: 0.8275862068965518 and parameters: {'objective': 'CrossEntropy', 'colsample_bylevel': 0.09693213285787457, 'depth': 4, 'boosting_type': 'Plain', 'bootstrap_type': 'Bayesian', 'bagging_temperature': 9.82768527937609}. Best is trial 98 with value: 0.8791208791208791.
[32m[I 2023-04-21 01:57:19,483][39m Trial 1224 finished with value: 0.8409090909090909 and parameters: {'objective': 'CrossEntropy', 'colsample_bylevel': 0.07272638267894248, 'depth': 3, 'boosting_type': 'Plain', 'bootstrap_type': 'Bayesian', 'bagging_temperature': 7.931824004505897}. Best is trial 98 with value: 0.8791208791208791.
[32m[I 2023-04-21 01:57:20,383][39m Trial 1225 finished with value: 0.8139534883720929 and parameters: {'objective': 'Logloss', 'colsample_bylevel': 0.08539626263444182, 'depth': 5, 'boosting_type': 'Plain', 'bootstrap_type': 'Bayesian', 'bagging_temperature': 8.682731047887433}. Best is trial 98 with value: 0.8791208791208791.
[32m[I 2023-04-21 01:57:21,051][39m Trial 1226 finished with value: 0.8409090909090909 and parameters: {'objective': 'CrossEntropy', 'colsample_bylevel': 0.08431656092183354, 'depth': 3, 'boosting_type': 'Plain', 'bootstrap_type': 'MVS'}. Best is trial 98 with value: 0.8791208791208791.
[32m[I 2023-04-21 01:57:22,025][39m Trial 1227 finished with value: 0.8409090909090909 and parameters: {'objective': 'CrossEntropy', 'colsample_bylevel': 0.08468261982077026, 'depth': 3, 'boosting_type': 'Plain', 'bootstrap_type': 'Bayesian', 'bagging_temperature': 9.232074160087683}. Best is trial 98 with value: 0.8791208791208791.
[32m[I 2023-04-21 01:57:22,962][39m Trial 1228 finished with value: 0.8275862068965518 and parameters: {'objective': 'CrossEntropy', 'colsample_bylevel': 0.07553486570299711, 'depth': 4, 'boosting_type': 'Plain', 'bootstrap_type': 'Bayesian', 'bagging_temperature': 9.26497589232341}. Best is trial 98 with value: 0.8791208791208791.
[32m[I 2023-04-21 01:57:23,695][39m Trial 1229 finished with value: 0.8666666666666666 and parameters: {'objective': 'CrossEntropy', 'colsample_bylevel': 0.08491759773386391, 'depth': 3, 'boosting_type': 'Plain', 'bootstrap_type': 'Bayesian', 'bagging_temperature': 9.813108609271255}. Best is trial 98 with value: 0.8791208791208791.
[32m[I 2023-04-21 01:57:24,467][39m Trial 1230 finished with value: 0.8539325842696629 and parameters: {'objective': 'CrossEntropy', 'colsample_bylevel': 0.08195544717069918, 'depth': 3, 'boosting_type': 'Plain', 'bootstrap_type': 'Bayesian', 'bagging_temperature': 9.642918853148982}. Best is trial 98 with value: 0.8791208791208791.
[32m[I 2023-04-21 01:57:25,625][39m Trial 1231 finished with value: 0.8409090909090909 and parameters: {'objective': 'CrossEntropy', 'colsample_bylevel': 0.08162122783582873, 'depth': 11, 'boosting_type': 'Plain', 'bootstrap_type': 'Bayesian', 'bagging_temperature': 9.996291614515526}. Best is trial 98 with value: 0.8791208791208791.
[32m[I 2023-04-21 01:57:26,866][39m Trial 1232 finished with value: 0.8666666666666666 and parameters: {'objective': 'CrossEntropy', 'colsample_bylevel': 0.07734441509815417, 'depth': 3, 'boosting_type': 'Plain', 'bootstrap_type': 'Bayesian', 'bagging_temperature': 8.287336201003935}. Best is trial 98 with value: 0.8791208791208791.
[32m[I 2023-04-21 01:57:27,893][39m Trial 1233 finished with value: 0.8409090909090909 and parameters: {'objective': 'Logloss', 'colsample_bylevel': 0.07872842384363266, 'depth': 6, 'boosting_type': 'Plain', 'bootstrap_type': 'Bayesian', 'bagging_temperature': 0.9914220043820992}. Best is trial 98 with value: 0.8791208791208791.
[32m[I 2023-04-21 01:57:28,767][39m Trial 1234 finished with value: 0.8275862068965518 and parameters: {'objective': 'CrossEntropy', 'colsample_bylevel': 0.08313625313474594, 'depth': 3, 'boosting_type': 'Plain', 'bootstrap_type': 'Bernoulli', 'subsample': 0.5285761683499302}. Best is trial 98 with value: 0.8791208791208791.
[32m[I 2023-04-21 01:57:29,756][39m Trial 1235 finished with value: 0.8409090909090909 and parameters: {'objective': 'CrossEntropy', 'colsample_bylevel': 0.07439914314184551, 'depth': 6, 'boosting_type': 'Plain', 'bootstrap_type': 'Bayesian', 'bagging_temperature': 8.495387320634338}. Best is trial 98 with value: 0.8791208791208791.
[32m[I 2023-04-21 01:57:34,222][39m Trial 1236 finished with value: 0.8539325842696629 and parameters: {'objective': 'CrossEntropy', 'colsample_bylevel': 0.08006269309390521, 'depth': 3, 'boosting_type': 'Ordered', 'bootstrap_type': 'Bayesian', 'bagging_temperature': 6.1908037831134735}. Best is trial 98 with value: 0.8791208791208791.
[32m[I 2023-04-21 01:57:35,309][39m Trial 1237 finished with value: 0.8539325842696629 and parameters: {'objective': 'CrossEntropy', 'colsample_bylevel': 0.0847661738413869, 'depth': 3, 'boosting_type': 'Plain', 'bootstrap_type': 'Bayesian', 'bagging_temperature': 9.078535516156705}. Best is trial 98 with value: 0.8791208791208791.
[32m[I 2023-04-21 01:57:36,197][39m Trial 1238 finished with value: 0.8409090909090909 and parameters: {'objective': 'CrossEntropy', 'colsample_bylevel': 0.05171847353115975, 'depth': 3, 'boosting_type': 'Plain', 'bootstrap_type': 'Bayesian', 'bagging_temperature': 8.924515698338706}. Best is trial 98 with value: 0.8791208791208791.
[32m[I 2023-04-21 01:57:37,132][39m Trial 1239 finished with value: 0.8275862068965518 and parameters: {'objective': 'CrossEntropy', 'colsample_bylevel': 0.0822813119076965, 'depth': 4, 'boosting_type': 'Plain', 'bootstrap_type': 'Bayesian', 'bagging_temperature': 3.294269297240784}. Best is trial 98 with value: 0.8791208791208791.
[32m[I 2023-04-21 01:57:37,746][39m Trial 1240 finished with value: 0.8409090909090909 and parameters: {'objective': 'CrossEntropy', 'colsample_bylevel': 0.08143741753349473, 'depth': 3, 'boosting_type': 'Plain', 'bootstrap_type': 'MVS'}. Best is trial 98 with value: 0.8791208791208791.
[32m[I 2023-04-21 01:57:38,583][39m Trial 1241 finished with value: 0.8666666666666666 and parameters: {'objective': 'Logloss', 'colsample_bylevel': 0.09479956337356527, 'depth': 5, 'boosting_type': 'Plain', 'bootstrap_type': 'Bayesian', 'bagging_temperature': 9.555198896809689}. Best is trial 98 with value: 0.8791208791208791.
[32m[I 2023-04-21 01:57:39,891][39m Trial 1242 finished with value: 0.8539325842696629 and parameters: {'objective': 'CrossEntropy', 'colsample_bylevel': 0.07984919790914219, 'depth': 3, 'boosting_type': 'Plain', 'bootstrap_type': 'Bayesian', 'bagging_temperature': 8.696694404314696}. Best is trial 98 with value: 0.8791208791208791.
[32m[I 2023-04-21 01:57:40,771][39m Trial 1243 finished with value: 0.8505747126436782 and parameters: {'objective': 'CrossEntropy', 'colsample_bylevel': 0.09159645685866, 'depth': 4, 'boosting_type': 'Plain', 'bootstrap_type': 'Bayesian', 'bagging_temperature': 9.67815388369402}. Best is trial 98 with value: 0.8791208791208791.
[32m[I 2023-04-21 01:57:41,912][39m Trial 1244 finished with value: 0.8275862068965518 and parameters: {'objective': 'CrossEntropy', 'colsample_bylevel': 0.08550096038712843, 'depth': 3, 'boosting_type': 'Plain', 'bootstrap_type': 'Bayesian', 'bagging_temperature': 9.080220474844474}. Best is trial 98 with value: 0.8791208791208791.
[32m[I 2023-04-21 01:57:42,862][39m Trial 1245 finished with value: 0.8539325842696629 and parameters: {'objective': 'CrossEntropy', 'colsample_bylevel': 0.08676043093594614, 'depth': 3, 'boosting_type': 'Plain', 'bootstrap_type': 'Bayesian', 'bagging_temperature': 8.018364009837686}. Best is trial 98 with value: 0.8791208791208791.
[32m[I 2023-04-21 01:57:43,750][39m Trial 1246 finished with value: 0.8666666666666666 and parameters: {'objective': 'CrossEntropy', 'colsample_bylevel': 0.08308716890024148, 'depth': 3, 'boosting_type': 'Plain', 'bootstrap_type': 'Bayesian', 'bagging_temperature': 9.182659322461125}. Best is trial 98 with value: 0.8791208791208791.
[32m[I 2023-04-21 01:57:44,394][39m Trial 1247 finished with value: 0.8539325842696629 and parameters: {'objective': 'CrossEntropy', 'colsample_bylevel': 0.09034912853626634, 'depth': 4, 'boosting_type': 'Plain', 'bootstrap_type': 'Bayesian', 'bagging_temperature': 8.471603306792266}. Best is trial 98 with value: 0.8791208791208791.
[32m[I 2023-04-21 01:57:45,079][39m Trial 1248 finished with value: 0.8139534883720929 and parameters: {'objective': 'CrossEntropy', 'colsample_bylevel': 0.08033075404934059, 'depth': 8, 'boosting_type': 'Plain', 'bootstrap_type': 'Bayesian', 'bagging_temperature': 9.460453702520343}. Best is trial 98 with value: 0.8791208791208791.
[32m[I 2023-04-21 01:57:45,914][39m Trial 1249 finished with value: 0.8636363636363636 and parameters: {'objective': 'CrossEntropy', 'colsample_bylevel': 0.08171580150676458, 'depth': 9, 'boosting_type': 'Plain', 'bootstrap_type': 'Bayesian', 'bagging_temperature': 9.824382242627394}. Best is trial 98 with value: 0.8791208791208791.
[32m[I 2023-04-21 01:57:46,614][39m Trial 1250 finished with value: 0.8539325842696629 and parameters: {'objective': 'Logloss', 'colsample_bylevel': 0.08090884230728129, 'depth': 3, 'boosting_type': 'Plain', 'bootstrap_type': 'Bayesian', 'bagging_temperature': 9.419219802766307}. Best is trial 98 with value: 0.8791208791208791.
[32m[I 2023-04-21 01:57:47,777][39m Trial 1251 finished with value: 0.8275862068965518 and parameters: {'objective': 'CrossEntropy', 'colsample_bylevel': 0.08400948439743439, 'depth': 3, 'boosting_type': 'Plain', 'bootstrap_type': 'MVS'}. Best is trial 98 with value: 0.8791208791208791.
[32m[I 2023-04-21 01:57:48,785][39m Trial 1252 finished with value: 0.8539325842696629 and parameters: {'objective': 'CrossEntropy', 'colsample_bylevel': 0.08365491826277976, 'depth': 3, 'boosting_type': 'Plain', 'bootstrap_type': 'Bayesian', 'bagging_temperature': 9.536086795636958}. Best is trial 98 with value: 0.8791208791208791.
[32m[I 2023-04-21 01:57:49,945][39m Trial 1253 finished with value: 0.8666666666666666 and parameters: {'objective': 'CrossEntropy', 'colsample_bylevel': 0.08183098302303049, 'depth': 3, 'boosting_type': 'Plain', 'bootstrap_type': 'Bayesian', 'bagging_temperature': 8.739299937976224}. Best is trial 98 with value: 0.8791208791208791.
[32m[I 2023-04-21 01:57:51,044][39m Trial 1254 finished with value: 0.8275862068965518 and parameters: {'objective': 'CrossEntropy', 'colsample_bylevel': 0.09309094995533246, 'depth': 4, 'boosting_type': 'Plain', 'bootstrap_type': 'Bayesian', 'bagging_temperature': 8.217465924707959}. Best is trial 98 with value: 0.8791208791208791.
[32m[I 2023-04-21 01:57:55,559][39m Trial 1255 finished with value: 0.8409090909090909 and parameters: {'objective': 'CrossEntropy', 'colsample_bylevel': 0.09073643845501723, 'depth': 3, 'boosting_type': 'Ordered', 'bootstrap_type': 'Bayesian', 'bagging_temperature': 9.793157635853717}. Best is trial 98 with value: 0.8791208791208791.
[32m[I 2023-04-21 01:57:56,702][39m Trial 1256 finished with value: 0.7391304347826086 and parameters: {'objective': 'CrossEntropy', 'colsample_bylevel': 0.016390256924967615, 'depth': 3, 'boosting_type': 'Plain', 'bootstrap_type': 'Bernoulli', 'subsample': 0.5984860671418942}. Best is trial 98 with value: 0.8791208791208791.
