[32m[I 2023-04-21 02:34:17,322][39m Trial 3171 finished with value: 0.8275862068965518 and parameters: {'objective': 'CrossEntropy', 'colsample_bylevel': 0.08186848809547381, 'depth': 11, 'boosting_type': 'Plain', 'bootstrap_type': 'Bayesian', 'bagging_temperature': 8.780482523371257}. Best is trial 3065 with value: 0.8863636363636364.
[32m[I 2023-04-21 02:34:18,322][39m Trial 3172 finished with value: 0.8275862068965518 and parameters: {'objective': 'CrossEntropy', 'colsample_bylevel': 0.08175331904017023, 'depth': 3, 'boosting_type': 'Plain', 'bootstrap_type': 'Bayesian', 'bagging_temperature': 8.408151056406785}. Best is trial 3065 with value: 0.8863636363636364.
[32m[I 2023-04-21 02:34:19,273][39m Trial 3173 finished with value: 0.8539325842696629 and parameters: {'objective': 'Logloss', 'colsample_bylevel': 0.07209163433115903, 'depth': 12, 'boosting_type': 'Plain', 'bootstrap_type': 'Bayesian', 'bagging_temperature': 9.489154229736059}. Best is trial 3065 with value: 0.8863636363636364.
[32m[I 2023-04-21 02:34:20,483][39m Trial 3174 finished with value: 0.8275862068965518 and parameters: {'objective': 'Logloss', 'colsample_bylevel': 0.08099211845076956, 'depth': 10, 'boosting_type': 'Plain', 'bootstrap_type': 'Bayesian', 'bagging_temperature': 2.4071112332305638}. Best is trial 3065 with value: 0.8863636363636364.
[32m[I 2023-04-21 02:34:21,350][39m Trial 3175 finished with value: 0.8409090909090909 and parameters: {'objective': 'Logloss', 'colsample_bylevel': 0.04418206919687479, 'depth': 10, 'boosting_type': 'Plain', 'bootstrap_type': 'Bayesian', 'bagging_temperature': 3.4132579704671637}. Best is trial 3065 with value: 0.8863636363636364.
[32m[I 2023-04-21 02:34:22,214][39m Trial 3176 finished with value: 0.8636363636363636 and parameters: {'objective': 'CrossEntropy', 'colsample_bylevel': 0.08020417857264721, 'depth': 9, 'boosting_type': 'Plain', 'bootstrap_type': 'Bayesian', 'bagging_temperature': 9.751528296666061}. Best is trial 3065 with value: 0.8863636363636364.
[32m[I 2023-04-21 02:34:23,199][39m Trial 3177 finished with value: 0.8314606741573034 and parameters: {'objective': 'Logloss', 'colsample_bylevel': 0.07162039308634338, 'depth': 10, 'boosting_type': 'Plain', 'bootstrap_type': 'MVS'}. Best is trial 3065 with value: 0.8863636363636364.
[32m[I 2023-04-21 02:34:23,843][39m Trial 3178 finished with value: 0.8539325842696629 and parameters: {'objective': 'CrossEntropy', 'colsample_bylevel': 0.06153987059776293, 'depth': 10, 'boosting_type': 'Plain', 'bootstrap_type': 'Bayesian', 'bagging_temperature': 9.15932414533579}. Best is trial 3065 with value: 0.8863636363636364.
[32m[I 2023-04-21 02:34:28,770][39m Trial 3179 finished with value: 0.8539325842696629 and parameters: {'objective': 'CrossEntropy', 'colsample_bylevel': 0.08546057807459731, 'depth': 3, 'boosting_type': 'Ordered', 'bootstrap_type': 'Bayesian', 'bagging_temperature': 9.661168879986526}. Best is trial 3065 with value: 0.8863636363636364.
[32m[I 2023-04-21 02:34:29,976][39m Trial 3180 finished with value: 0.8666666666666666 and parameters: {'objective': 'CrossEntropy', 'colsample_bylevel': 0.06849680668467509, 'depth': 10, 'boosting_type': 'Plain', 'bootstrap_type': 'Bayesian', 'bagging_temperature': 9.970129424331178}. Best is trial 3065 with value: 0.8863636363636364.
[32m[I 2023-04-21 02:34:31,158][39m Trial 3181 finished with value: 0.8539325842696629 and parameters: {'objective': 'CrossEntropy', 'colsample_bylevel': 0.0757317293784963, 'depth': 10, 'boosting_type': 'Plain', 'bootstrap_type': 'Bayesian', 'bagging_temperature': 9.127335332184504}. Best is trial 3065 with value: 0.8863636363636364.
[32m[I 2023-04-21 02:34:31,999][39m Trial 3182 finished with value: 0.8539325842696629 and parameters: {'objective': 'CrossEntropy', 'colsample_bylevel': 0.08089279548055009, 'depth': 2, 'boosting_type': 'Plain', 'bootstrap_type': 'Bayesian', 'bagging_temperature': 9.273108768012985}. Best is trial 3065 with value: 0.8863636363636364.
[32m[I 2023-04-21 02:34:33,107][39m Trial 3183 finished with value: 0.8275862068965518 and parameters: {'objective': 'CrossEntropy', 'colsample_bylevel': 0.07416240341653264, 'depth': 9, 'boosting_type': 'Plain', 'bootstrap_type': 'Bayesian', 'bagging_temperature': 9.619829122313783}. Best is trial 3065 with value: 0.8863636363636364.
[32m[I 2023-04-21 02:34:34,080][39m Trial 3184 finished with value: 0.8275862068965518 and parameters: {'objective': 'CrossEntropy', 'colsample_bylevel': 0.08181961438281672, 'depth': 12, 'boosting_type': 'Plain', 'bootstrap_type': 'MVS'}. Best is trial 3065 with value: 0.8863636363636364.
[32m[I 2023-04-21 02:34:35,144][39m Trial 3185 finished with value: 0.8409090909090909 and parameters: {'objective': 'CrossEntropy', 'colsample_bylevel': 0.07232141724455741, 'depth': 10, 'boosting_type': 'Plain', 'bootstrap_type': 'Bayesian', 'bagging_temperature': 7.862990392035434}. Best is trial 3065 with value: 0.8863636363636364.
[32m[I 2023-04-21 02:34:35,875][39m Trial 3186 finished with value: 0.8275862068965518 and parameters: {'objective': 'CrossEntropy', 'colsample_bylevel': 0.08313967790966144, 'depth': 3, 'boosting_type': 'Plain', 'bootstrap_type': 'Bayesian', 'bagging_temperature': 9.211326499498362}. Best is trial 3065 with value: 0.8863636363636364.
[32m[I 2023-04-21 02:34:36,523][39m Trial 3187 finished with value: 0.8539325842696629 and parameters: {'objective': 'Logloss', 'colsample_bylevel': 0.07438435955016183, 'depth': 12, 'boosting_type': 'Plain', 'bootstrap_type': 'Bayesian', 'bagging_temperature': 9.347993488353142}. Best is trial 3065 with value: 0.8863636363636364.
[32m[I 2023-04-21 02:34:37,838][39m Trial 3188 finished with value: 0.8275862068965518 and parameters: {'objective': 'CrossEntropy', 'colsample_bylevel': 0.07529589508693874, 'depth': 11, 'boosting_type': 'Plain', 'bootstrap_type': 'Bayesian', 'bagging_temperature': 8.121591496995308}. Best is trial 3065 with value: 0.8863636363636364.
[32m[I 2023-04-21 02:34:38,942][39m Trial 3189 finished with value: 0.8539325842696629 and parameters: {'objective': 'Logloss', 'colsample_bylevel': 0.07124518139304986, 'depth': 10, 'boosting_type': 'Plain', 'bootstrap_type': 'Bayesian', 'bagging_temperature': 9.33719867125256}. Best is trial 3065 with value: 0.8863636363636364.
[32m[I 2023-04-21 02:34:39,791][39m Trial 3190 finished with value: 0.8131868131868132 and parameters: {'objective': 'CrossEntropy', 'colsample_bylevel': 0.0774893208383783, 'depth': 2, 'boosting_type': 'Plain', 'bootstrap_type': 'Bernoulli', 'subsample': 0.36468957499979415}. Best is trial 3065 with value: 0.8863636363636364.
[32m[I 2023-04-21 02:34:40,421][39m Trial 3191 finished with value: 0.8275862068965518 and parameters: {'objective': 'CrossEntropy', 'colsample_bylevel': 0.08690639861820962, 'depth': 3, 'boosting_type': 'Plain', 'bootstrap_type': 'Bayesian', 'bagging_temperature': 9.04169849538772}. Best is trial 3065 with value: 0.8863636363636364.
[32m[I 2023-04-21 02:34:41,604][39m Trial 3192 finished with value: 0.8636363636363636 and parameters: {'objective': 'CrossEntropy', 'colsample_bylevel': 0.0754929283949488, 'depth': 8, 'boosting_type': 'Plain', 'bootstrap_type': 'Bayesian', 'bagging_temperature': 9.667902230779154}. Best is trial 3065 with value: 0.8863636363636364.
[32m[I 2023-04-21 02:34:42,271][39m Trial 3193 finished with value: 0.8666666666666666 and parameters: {'objective': 'CrossEntropy', 'colsample_bylevel': 0.07947992638232068, 'depth': 2, 'boosting_type': 'Plain', 'bootstrap_type': 'Bayesian', 'bagging_temperature': 8.971805962322067}. Best is trial 3065 with value: 0.8863636363636364.
[32m[I 2023-04-21 02:34:43,521][39m Trial 3194 finished with value: 0.8666666666666666 and parameters: {'objective': 'CrossEntropy', 'colsample_bylevel': 0.07979407686012109, 'depth': 3, 'boosting_type': 'Plain', 'bootstrap_type': 'Bayesian', 'bagging_temperature': 8.494271469439637}. Best is trial 3065 with value: 0.8863636363636364.
[32m[I 2023-04-21 02:34:44,784][39m Trial 3195 finished with value: 0.8666666666666666 and parameters: {'objective': 'CrossEntropy', 'colsample_bylevel': 0.07757316097594397, 'depth': 10, 'boosting_type': 'Plain', 'bootstrap_type': 'Bayesian', 'bagging_temperature': 9.992295484666187}. Best is trial 3065 with value: 0.8863636363636364.
[32m[I 2023-04-21 02:34:45,818][39m Trial 3196 finished with value: 0.8275862068965518 and parameters: {'objective': 'CrossEntropy', 'colsample_bylevel': 0.075044419895432, 'depth': 7, 'boosting_type': 'Plain', 'bootstrap_type': 'MVS'}. Best is trial 3065 with value: 0.8863636363636364.
[32m[I 2023-04-21 02:34:46,474][39m Trial 3197 finished with value: 0.8539325842696629 and parameters: {'objective': 'CrossEntropy', 'colsample_bylevel': 0.0765770233614025, 'depth': 7, 'boosting_type': 'Plain', 'bootstrap_type': 'Bayesian', 'bagging_temperature': 8.615912590737361}. Best is trial 3065 with value: 0.8863636363636364.
[32m[I 2023-04-21 02:34:47,395][39m Trial 3198 finished with value: 0.8409090909090909 and parameters: {'objective': 'CrossEntropy', 'colsample_bylevel': 0.07464149427526859, 'depth': 11, 'boosting_type': 'Plain', 'bootstrap_type': 'Bayesian', 'bagging_temperature': 9.665813576811463}. Best is trial 3065 with value: 0.8863636363636364.
[32m[I 2023-04-21 02:34:48,300][39m Trial 3199 finished with value: 0.8409090909090909 and parameters: {'objective': 'CrossEntropy', 'colsample_bylevel': 0.06134330954163408, 'depth': 6, 'boosting_type': 'Plain', 'bootstrap_type': 'Bayesian', 'bagging_temperature': 8.693369045734945}. Best is trial 3065 with value: 0.8863636363636364.
[32m[I 2023-04-21 02:34:53,221][39m Trial 3200 finished with value: 0.8275862068965518 and parameters: {'objective': 'CrossEntropy', 'colsample_bylevel': 0.08311160881103412, 'depth': 4, 'boosting_type': 'Ordered', 'bootstrap_type': 'Bayesian', 'bagging_temperature': 9.514437295708559}. Best is trial 3065 with value: 0.8863636363636364.
[32m[I 2023-04-21 02:34:54,315][39m Trial 3201 finished with value: 0.8666666666666666 and parameters: {'objective': 'Logloss', 'colsample_bylevel': 0.07163761188049554, 'depth': 10, 'boosting_type': 'Plain', 'bootstrap_type': 'Bayesian', 'bagging_temperature': 9.188939947695236}. Best is trial 3065 with value: 0.8863636363636364.
[32m[I 2023-04-21 02:34:55,492][39m Trial 3202 finished with value: 0.8539325842696629 and parameters: {'objective': 'CrossEntropy', 'colsample_bylevel': 0.07850030653270793, 'depth': 3, 'boosting_type': 'Plain', 'bootstrap_type': 'Bayesian', 'bagging_temperature': 9.054187388874965}. Best is trial 3065 with value: 0.8863636363636364.
[32m[I 2023-04-21 02:34:56,346][39m Trial 3203 finished with value: 0.8409090909090909 and parameters: {'objective': 'CrossEntropy', 'colsample_bylevel': 0.07915097368738999, 'depth': 9, 'boosting_type': 'Plain', 'bootstrap_type': 'Bayesian', 'bagging_temperature': 8.354043903470126}. Best is trial 3065 with value: 0.8863636363636364.
[32m[I 2023-04-21 02:34:57,223][39m Trial 3204 finished with value: 0.8666666666666666 and parameters: {'objective': 'Logloss', 'colsample_bylevel': 0.07478112989828564, 'depth': 11, 'boosting_type': 'Plain', 'bootstrap_type': 'Bayesian', 'bagging_temperature': 9.606674308521065}. Best is trial 3065 with value: 0.8863636363636364.
[32m[I 2023-04-21 02:34:58,153][39m Trial 3205 finished with value: 0.8235294117647058 and parameters: {'objective': 'CrossEntropy', 'colsample_bylevel': 0.07816959693478212, 'depth': 3, 'boosting_type': 'Plain', 'bootstrap_type': 'Bayesian', 'bagging_temperature': 8.300658294070239}. Best is trial 3065 with value: 0.8863636363636364.
[32m[I 2023-04-21 02:34:59,120][39m Trial 3206 finished with value: 0.8539325842696629 and parameters: {'objective': 'Logloss', 'colsample_bylevel': 0.08437196469550712, 'depth': 3, 'boosting_type': 'Plain', 'bootstrap_type': 'Bayesian', 'bagging_temperature': 8.937921359496622}. Best is trial 3065 with value: 0.8863636363636364.
[32m[I 2023-04-21 02:34:59,986][39m Trial 3207 finished with value: 0.8409090909090909 and parameters: {'objective': 'CrossEntropy', 'colsample_bylevel': 0.07109088570211661, 'depth': 8, 'boosting_type': 'Plain', 'bootstrap_type': 'Bayesian', 'bagging_temperature': 9.492798192651982}. Best is trial 3065 with value: 0.8863636363636364.
[32m[I 2023-04-21 02:35:00,604][39m Trial 3208 finished with value: 0.8539325842696629 and parameters: {'objective': 'Logloss', 'colsample_bylevel': 0.067378558252942, 'depth': 4, 'boosting_type': 'Plain', 'bootstrap_type': 'Bayesian', 'bagging_temperature': 8.281742141970904}. Best is trial 3065 with value: 0.8863636363636364.
[32m[I 2023-04-21 02:35:01,735][39m Trial 3209 finished with value: 0.8139534883720929 and parameters: {'objective': 'CrossEntropy', 'colsample_bylevel': 0.08563310139074137, 'depth': 10, 'boosting_type': 'Plain', 'bootstrap_type': 'Bayesian', 'bagging_temperature': 9.35421088308147}. Best is trial 3065 with value: 0.8863636363636364.
[32m[I 2023-04-21 02:35:03,223][39m Trial 3210 finished with value: 0.8409090909090909 and parameters: {'objective': 'CrossEntropy', 'colsample_bylevel': 0.07182689883511369, 'depth': 12, 'boosting_type': 'Plain', 'bootstrap_type': 'MVS'}. Best is trial 3065 with value: 0.8863636363636364.
[32m[I 2023-04-21 02:35:03,992][39m Trial 3211 finished with value: 0.8666666666666666 and parameters: {'objective': 'Logloss', 'colsample_bylevel': 0.06923577251471508, 'depth': 12, 'boosting_type': 'Plain', 'bootstrap_type': 'Bayesian', 'bagging_temperature': 9.40544399035247}. Best is trial 3065 with value: 0.8863636363636364.
[32m[I 2023-04-21 02:35:05,011][39m Trial 3212 finished with value: 0.8791208791208791 and parameters: {'objective': 'CrossEntropy', 'colsample_bylevel': 0.0713171108321304, 'depth': 8, 'boosting_type': 'Plain', 'bootstrap_type': 'Bayesian', 'bagging_temperature': 8.895698372332205}. Best is trial 3065 with value: 0.8863636363636364.
[32m[I 2023-04-21 02:35:06,037][39m Trial 3213 finished with value: 0.8539325842696629 and parameters: {'objective': 'CrossEntropy', 'colsample_bylevel': 0.0847723330366341, 'depth': 4, 'boosting_type': 'Plain', 'bootstrap_type': 'Bayesian', 'bagging_temperature': 9.619637125067994}. Best is trial 3065 with value: 0.8863636363636364.
[32m[I 2023-04-21 02:35:06,776][39m Trial 3214 finished with value: 0.8409090909090909 and parameters: {'objective': 'CrossEntropy', 'colsample_bylevel': 0.06759243764121015, 'depth': 8, 'boosting_type': 'Plain', 'bootstrap_type': 'Bayesian', 'bagging_temperature': 9.248259802974173}. Best is trial 3065 with value: 0.8863636363636364.
[32m[I 2023-04-21 02:35:07,784][39m Trial 3215 finished with value: 0.8791208791208791 and parameters: {'objective': 'CrossEntropy', 'colsample_bylevel': 0.07366857408824896, 'depth': 9, 'boosting_type': 'Plain', 'bootstrap_type': 'Bayesian', 'bagging_temperature': 9.243265958537252}. Best is trial 3065 with value: 0.8863636363636364.
[32m[I 2023-04-21 02:35:09,283][39m Trial 3216 finished with value: 0.8539325842696629 and parameters: {'objective': 'Logloss', 'colsample_bylevel': 0.06956169190714481, 'depth': 9, 'boosting_type': 'Plain', 'bootstrap_type': 'Bayesian', 'bagging_temperature': 9.085118936027738}. Best is trial 3065 with value: 0.8863636363636364.
[32m[I 2023-04-21 02:35:13,951][39m Trial 3217 finished with value: 0.8409090909090909 and parameters: {'objective': 'Logloss', 'colsample_bylevel': 0.0661071385282757, 'depth': 7, 'boosting_type': 'Ordered', 'bootstrap_type': 'Bayesian', 'bagging_temperature': 8.69391898707483}. Best is trial 3065 with value: 0.8863636363636364.
[32m[I 2023-04-21 02:35:14,902][39m Trial 3218 finished with value: 0.8666666666666666 and parameters: {'objective': 'Logloss', 'colsample_bylevel': 0.09534919730338018, 'depth': 3, 'boosting_type': 'Plain', 'bootstrap_type': 'Bayesian', 'bagging_temperature': 8.312402407738265}. Best is trial 3065 with value: 0.8863636363636364.
[32m[I 2023-04-21 02:35:15,703][39m Trial 3219 finished with value: 0.8636363636363636 and parameters: {'objective': 'CrossEntropy', 'colsample_bylevel': 0.0729520321058055, 'depth': 9, 'boosting_type': 'Plain', 'bootstrap_type': 'Bayesian', 'bagging_temperature': 9.554071478383182}. Best is trial 3065 with value: 0.8863636363636364.
[32m[I 2023-04-21 02:35:16,598][39m Trial 3220 finished with value: 0.8539325842696629 and parameters: {'objective': 'CrossEntropy', 'colsample_bylevel': 0.08190715749160006, 'depth': 3, 'boosting_type': 'Plain', 'bootstrap_type': 'Bayesian', 'bagging_temperature': 9.694925469988736}. Best is trial 3065 with value: 0.8863636363636364.
[32m[I 2023-04-21 02:35:17,452][39m Trial 3221 finished with value: 0.8666666666666666 and parameters: {'objective': 'Logloss', 'colsample_bylevel': 0.08469290536846555, 'depth': 3, 'boosting_type': 'Plain', 'bootstrap_type': 'Bayesian', 'bagging_temperature': 9.62758246296419}. Best is trial 3065 with value: 0.8863636363636364.
[32m[I 2023-04-21 02:35:18,480][39m Trial 3222 finished with value: 0.8505747126436782 and parameters: {'objective': 'CrossEntropy', 'colsample_bylevel': 0.0756187532266887, 'depth': 9, 'boosting_type': 'Plain', 'bootstrap_type': 'Bayesian', 'bagging_temperature': 9.569456752157409}. Best is trial 3065 with value: 0.8863636363636364.
[32m[I 2023-04-21 02:35:19,524][39m Trial 3223 finished with value: 0.8666666666666666 and parameters: {'objective': 'Logloss', 'colsample_bylevel': 0.06918778471569904, 'depth': 10, 'boosting_type': 'Plain', 'bootstrap_type': 'Bayesian', 'bagging_temperature': 9.08776180415297}. Best is trial 3065 with value: 0.8863636363636364.
[32m[I 2023-04-21 02:35:20,688][39m Trial 3224 finished with value: 0.8666666666666666 and parameters: {'objective': 'Logloss', 'colsample_bylevel': 0.06765378090039317, 'depth': 7, 'boosting_type': 'Plain', 'bootstrap_type': 'Bayesian', 'bagging_temperature': 9.387400533905062}. Best is trial 3065 with value: 0.8863636363636364.
[32m[I 2023-04-21 02:35:21,845][39m Trial 3225 finished with value: 0.8409090909090909 and parameters: {'objective': 'CrossEntropy', 'colsample_bylevel': 0.07688002533212913, 'depth': 9, 'boosting_type': 'Plain', 'bootstrap_type': 'Bayesian', 'bagging_temperature': 9.495282499235254}. Best is trial 3065 with value: 0.8863636363636364.
[32m[I 2023-04-21 02:35:22,942][39m Trial 3226 finished with value: 0.8666666666666666 and parameters: {'objective': 'Logloss', 'colsample_bylevel': 0.06592962969179916, 'depth': 12, 'boosting_type': 'Plain', 'bootstrap_type': 'Bayesian', 'bagging_temperature': 8.540196349221281}. Best is trial 3065 with value: 0.8863636363636364.
[32m[I 2023-04-21 02:35:23,870][39m Trial 3227 finished with value: 0.8372093023255814 and parameters: {'objective': 'CrossEntropy', 'colsample_bylevel': 0.07669191931419103, 'depth': 10, 'boosting_type': 'Plain', 'bootstrap_type': 'Bayesian', 'bagging_temperature': 9.7436495430066}. Best is trial 3065 with value: 0.8863636363636364.
[32m[I 2023-04-21 02:35:24,494][39m Trial 3228 finished with value: 0.8791208791208791 and parameters: {'objective': 'CrossEntropy', 'colsample_bylevel': 0.07541063677136962, 'depth': 12, 'boosting_type': 'Plain', 'bootstrap_type': 'Bayesian', 'bagging_temperature': 9.803014771283246}. Best is trial 3065 with value: 0.8863636363636364.
[32m[I 2023-04-21 02:35:25,112][39m Trial 3229 finished with value: 0.8666666666666666 and parameters: {'objective': 'Logloss', 'colsample_bylevel': 0.07344107037019412, 'depth': 5, 'boosting_type': 'Plain', 'bootstrap_type': 'Bayesian', 'bagging_temperature': 9.277772297999043}. Best is trial 3065 with value: 0.8863636363636364.
[32m[I 2023-04-21 02:35:26,285][39m Trial 3230 finished with value: 0.8139534883720929 and parameters: {'objective': 'CrossEntropy', 'colsample_bylevel': 0.07613784273903788, 'depth': 11, 'boosting_type': 'Plain', 'bootstrap_type': 'Bayesian', 'bagging_temperature': 2.1010247794577612}. Best is trial 3065 with value: 0.8863636363636364.
[32m[I 2023-04-21 02:35:27,588][39m Trial 3231 finished with value: 0.8539325842696629 and parameters: {'objective': 'CrossEntropy', 'colsample_bylevel': 0.06894481534667389, 'depth': 8, 'boosting_type': 'Plain', 'bootstrap_type': 'Bayesian', 'bagging_temperature': 9.085548112357001}. Best is trial 3065 with value: 0.8863636363636364.
[32m[I 2023-04-21 02:35:28,257][39m Trial 3232 finished with value: 0.8505747126436782 and parameters: {'objective': 'CrossEntropy', 'colsample_bylevel': 0.09578209661781438, 'depth': 10, 'boosting_type': 'Plain', 'bootstrap_type': 'Bayesian', 'bagging_temperature': 9.730798239174074}. Best is trial 3065 with value: 0.8863636363636364.
[32m[I 2023-04-21 02:35:29,156][39m Trial 3233 finished with value: 0.8275862068965518 and parameters: {'objective': 'CrossEntropy', 'colsample_bylevel': 0.06420206788420318, 'depth': 11, 'boosting_type': 'Plain', 'bootstrap_type': 'MVS'}. Best is trial 3065 with value: 0.8863636363636364.
[32m[I 2023-04-21 02:35:30,323][39m Trial 3234 finished with value: 0.8409090909090909 and parameters: {'objective': 'CrossEntropy', 'colsample_bylevel': 0.08307634203387208, 'depth': 3, 'boosting_type': 'Plain', 'bootstrap_type': 'Bernoulli', 'subsample': 0.9490213841272226}. Best is trial 3065 with value: 0.8863636363636364.
[32m[I 2023-04-21 02:35:35,072][39m Trial 3235 finished with value: 0.8139534883720929 and parameters: {'objective': 'Logloss', 'colsample_bylevel': 0.07367862447422659, 'depth': 10, 'boosting_type': 'Ordered', 'bootstrap_type': 'Bayesian', 'bagging_temperature': 7.283963562830885}. Best is trial 3065 with value: 0.8863636363636364.
