[32m[I 2023-04-21 02:13:54,179][39m Trial 2115 finished with value: 0.8539325842696629 and parameters: {'objective': 'CrossEntropy', 'colsample_bylevel': 0.09053450269452154, 'depth': 3, 'boosting_type': 'Plain', 'bootstrap_type': 'Bayesian', 'bagging_temperature': 9.571390426944728}. Best is trial 98 with value: 0.8791208791208791.
[32m[I 2023-04-21 02:13:54,778][39m Trial 2116 finished with value: 0.8666666666666666 and parameters: {'objective': 'CrossEntropy', 'colsample_bylevel': 0.08781789662852235, 'depth': 2, 'boosting_type': 'Plain', 'bootstrap_type': 'Bayesian', 'bagging_temperature': 9.21676390633158}. Best is trial 98 with value: 0.8791208791208791.
[32m[I 2023-04-21 02:13:55,964][39m Trial 2117 finished with value: 0.8505747126436782 and parameters: {'objective': 'CrossEntropy', 'colsample_bylevel': 0.07591316438267284, 'depth': 11, 'boosting_type': 'Plain', 'bootstrap_type': 'Bayesian', 'bagging_temperature': 9.97865602803203}. Best is trial 98 with value: 0.8791208791208791.
[32m[I 2023-04-21 02:13:56,666][39m Trial 2118 finished with value: 0.8539325842696629 and parameters: {'objective': 'CrossEntropy', 'colsample_bylevel': 0.07380322369824743, 'depth': 4, 'boosting_type': 'Plain', 'bootstrap_type': 'Bayesian', 'bagging_temperature': 7.623909023765532}. Best is trial 98 with value: 0.8791208791208791.
[32m[I 2023-04-21 02:13:57,928][39m Trial 2119 finished with value: 0.8409090909090909 and parameters: {'objective': 'CrossEntropy', 'colsample_bylevel': 0.07494976700219691, 'depth': 8, 'boosting_type': 'Plain', 'bootstrap_type': 'MVS'}. Best is trial 98 with value: 0.8791208791208791.
[32m[I 2023-04-21 02:13:58,851][39m Trial 2120 finished with value: 0.8666666666666666 and parameters: {'objective': 'Logloss', 'colsample_bylevel': 0.07796930855195978, 'depth': 4, 'boosting_type': 'Plain', 'bootstrap_type': 'Bayesian', 'bagging_temperature': 9.994604816171798}. Best is trial 98 with value: 0.8791208791208791.
[32m[I 2023-04-21 02:13:59,743][39m Trial 2121 finished with value: 0.8539325842696629 and parameters: {'objective': 'CrossEntropy', 'colsample_bylevel': 0.08157602859198115, 'depth': 3, 'boosting_type': 'Plain', 'bootstrap_type': 'Bayesian', 'bagging_temperature': 9.404356175784075}. Best is trial 98 with value: 0.8791208791208791.
[32m[I 2023-04-21 02:14:00,599][39m Trial 2122 finished with value: 0.8539325842696629 and parameters: {'objective': 'CrossEntropy', 'colsample_bylevel': 0.07747935397292115, 'depth': 4, 'boosting_type': 'Plain', 'bootstrap_type': 'Bayesian', 'bagging_temperature': 9.963174054541017}. Best is trial 98 with value: 0.8791208791208791.
[32m[I 2023-04-21 02:14:01,472][39m Trial 2123 finished with value: 0.8275862068965518 and parameters: {'objective': 'CrossEntropy', 'colsample_bylevel': 0.07317256931954357, 'depth': 4, 'boosting_type': 'Plain', 'bootstrap_type': 'Bayesian', 'bagging_temperature': 1.2528097783052612}. Best is trial 98 with value: 0.8791208791208791.
[32m[I 2023-04-21 02:14:02,274][39m Trial 2124 finished with value: 0.8275862068965518 and parameters: {'objective': 'CrossEntropy', 'colsample_bylevel': 0.08209258374903335, 'depth': 4, 'boosting_type': 'Plain', 'bootstrap_type': 'Bayesian', 'bagging_temperature': 9.738497355561085}. Best is trial 98 with value: 0.8791208791208791.
[32m[I 2023-04-21 02:14:06,923][39m Trial 2125 finished with value: 0.8409090909090909 and parameters: {'objective': 'CrossEntropy', 'colsample_bylevel': 0.0760753496774101, 'depth': 4, 'boosting_type': 'Ordered', 'bootstrap_type': 'Bayesian', 'bagging_temperature': 9.685688495177356}. Best is trial 98 with value: 0.8791208791208791.
[32m[I 2023-04-21 02:14:07,888][39m Trial 2126 finished with value: 0.8666666666666666 and parameters: {'objective': 'Logloss', 'colsample_bylevel': 0.07164349067112841, 'depth': 4, 'boosting_type': 'Plain', 'bootstrap_type': 'Bayesian', 'bagging_temperature': 7.600318568033947}. Best is trial 98 with value: 0.8791208791208791.
[32m[I 2023-04-21 02:14:08,713][39m Trial 2127 finished with value: 0.8275862068965518 and parameters: {'objective': 'CrossEntropy', 'colsample_bylevel': 0.08824614303121552, 'depth': 10, 'boosting_type': 'Plain', 'bootstrap_type': 'Bayesian', 'bagging_temperature': 9.600527911960546}. Best is trial 98 with value: 0.8791208791208791.
[32m[I 2023-04-21 02:14:09,678][39m Trial 2128 finished with value: 0.8275862068965518 and parameters: {'objective': 'CrossEntropy', 'colsample_bylevel': 0.07677006717448183, 'depth': 10, 'boosting_type': 'Plain', 'bootstrap_type': 'Bayesian', 'bagging_temperature': 8.206845373686468}. Best is trial 98 with value: 0.8791208791208791.
[32m[I 2023-04-21 02:14:10,463][39m Trial 2129 finished with value: 0.8636363636363636 and parameters: {'objective': 'CrossEntropy', 'colsample_bylevel': 0.08248489864701598, 'depth': 5, 'boosting_type': 'Plain', 'bootstrap_type': 'Bayesian', 'bagging_temperature': 6.461059771195337}. Best is trial 98 with value: 0.8791208791208791.
[32m[I 2023-04-21 02:14:11,315][39m Trial 2130 finished with value: 0.8409090909090909 and parameters: {'objective': 'CrossEntropy', 'colsample_bylevel': 0.0749217332217505, 'depth': 10, 'boosting_type': 'Plain', 'bootstrap_type': 'Bayesian', 'bagging_temperature': 6.913489326416025}. Best is trial 98 with value: 0.8791208791208791.
[32m[I 2023-04-21 02:14:12,391][39m Trial 2131 finished with value: 0.8409090909090909 and parameters: {'objective': 'CrossEntropy', 'colsample_bylevel': 0.07856543081375156, 'depth': 3, 'boosting_type': 'Plain', 'bootstrap_type': 'MVS'}. Best is trial 98 with value: 0.8791208791208791.
[32m[I 2023-04-21 02:14:13,587][39m Trial 2132 finished with value: 0.8539325842696629 and parameters: {'objective': 'CrossEntropy', 'colsample_bylevel': 0.08122012745077337, 'depth': 3, 'boosting_type': 'Plain', 'bootstrap_type': 'Bayesian', 'bagging_temperature': 9.309358087814868}. Best is trial 98 with value: 0.8791208791208791.
[32m[I 2023-04-21 02:14:14,684][39m Trial 2133 finished with value: 0.8764044943820225 and parameters: {'objective': 'CrossEntropy', 'colsample_bylevel': 0.08590822368778323, 'depth': 2, 'boosting_type': 'Plain', 'bootstrap_type': 'Bayesian', 'bagging_temperature': 8.712914863494571}. Best is trial 98 with value: 0.8791208791208791.
[32m[I 2023-04-21 02:14:15,342][39m Trial 2134 finished with value: 0.8666666666666666 and parameters: {'objective': 'CrossEntropy', 'colsample_bylevel': 0.0812526653734186, 'depth': 3, 'boosting_type': 'Plain', 'bootstrap_type': 'Bayesian', 'bagging_temperature': 8.752394790568374}. Best is trial 98 with value: 0.8791208791208791.
[32m[I 2023-04-21 02:14:16,507][39m Trial 2135 finished with value: 0.8539325842696629 and parameters: {'objective': 'CrossEntropy', 'colsample_bylevel': 0.07843569321303082, 'depth': 9, 'boosting_type': 'Plain', 'bootstrap_type': 'Bayesian', 'bagging_temperature': 9.611981320734104}. Best is trial 98 with value: 0.8791208791208791.
[32m[I 2023-04-21 02:14:17,205][39m Trial 2136 finished with value: 0.8139534883720929 and parameters: {'objective': 'CrossEntropy', 'colsample_bylevel': 0.07578607154196437, 'depth': 11, 'boosting_type': 'Plain', 'bootstrap_type': 'Bayesian', 'bagging_temperature': 9.360033416472527}. Best is trial 98 with value: 0.8791208791208791.
[32m[I 2023-04-21 02:14:18,058][39m Trial 2137 finished with value: 0.8409090909090909 and parameters: {'objective': 'CrossEntropy', 'colsample_bylevel': 0.09345103452977323, 'depth': 3, 'boosting_type': 'Plain', 'bootstrap_type': 'Bernoulli', 'subsample': 0.12284634645542986}. Best is trial 98 with value: 0.8791208791208791.
[32m[I 2023-04-21 02:14:18,934][39m Trial 2138 finished with value: 0.8409090909090909 and parameters: {'objective': 'CrossEntropy', 'colsample_bylevel': 0.07767298426053625, 'depth': 7, 'boosting_type': 'Plain', 'bootstrap_type': 'Bayesian', 'bagging_temperature': 9.29130621049285}. Best is trial 98 with value: 0.8791208791208791.
[32m[I 2023-04-21 02:14:19,812][39m Trial 2139 finished with value: 0.8666666666666666 and parameters: {'objective': 'CrossEntropy', 'colsample_bylevel': 0.07705696751798638, 'depth': 5, 'boosting_type': 'Plain', 'bootstrap_type': 'Bayesian', 'bagging_temperature': 7.247834268699497}. Best is trial 98 with value: 0.8791208791208791.
[32m[I 2023-04-21 02:14:20,689][39m Trial 2140 finished with value: 0.8409090909090909 and parameters: {'objective': 'CrossEntropy', 'colsample_bylevel': 0.09351628251919937, 'depth': 3, 'boosting_type': 'Plain', 'bootstrap_type': 'MVS'}. Best is trial 98 with value: 0.8791208791208791.
[32m[I 2023-04-21 02:14:21,557][39m Trial 2141 finished with value: 0.8636363636363636 and parameters: {'objective': 'Logloss', 'colsample_bylevel': 0.083469814115651, 'depth': 3, 'boosting_type': 'Plain', 'bootstrap_type': 'Bayesian', 'bagging_temperature': 9.254426341380361}. Best is trial 98 with value: 0.8791208791208791.
[32m[I 2023-04-21 02:14:22,582][39m Trial 2142 finished with value: 0.8409090909090909 and parameters: {'objective': 'CrossEntropy', 'colsample_bylevel': 0.09023394689653634, 'depth': 2, 'boosting_type': 'Plain', 'bootstrap_type': 'Bayesian', 'bagging_temperature': 9.531255734202706}. Best is trial 98 with value: 0.8791208791208791.
[32m[I 2023-04-21 02:14:27,618][39m Trial 2143 finished with value: 0.8275862068965518 and parameters: {'objective': 'CrossEntropy', 'colsample_bylevel': 0.07940913314475441, 'depth': 3, 'boosting_type': 'Ordered', 'bootstrap_type': 'Bayesian', 'bagging_temperature': 8.000814223022239}. Best is trial 98 with value: 0.8791208791208791.
[32m[I 2023-04-21 02:14:28,710][39m Trial 2144 finished with value: 0.8409090909090909 and parameters: {'objective': 'CrossEntropy', 'colsample_bylevel': 0.08546018875115113, 'depth': 12, 'boosting_type': 'Plain', 'bootstrap_type': 'Bayesian', 'bagging_temperature': 9.53362875554684}. Best is trial 98 with value: 0.8791208791208791.
[32m[I 2023-04-21 02:14:29,733][39m Trial 2145 finished with value: 0.8539325842696629 and parameters: {'objective': 'Logloss', 'colsample_bylevel': 0.073272580346439, 'depth': 11, 'boosting_type': 'Plain', 'bootstrap_type': 'Bayesian', 'bagging_temperature': 7.896172919089436}. Best is trial 98 with value: 0.8791208791208791.
[32m[I 2023-04-21 02:14:30,820][39m Trial 2146 finished with value: 0.8791208791208791 and parameters: {'objective': 'CrossEntropy', 'colsample_bylevel': 0.07020494447102847, 'depth': 11, 'boosting_type': 'Plain', 'bootstrap_type': 'Bayesian', 'bagging_temperature': 9.47808681519911}. Best is trial 98 with value: 0.8791208791208791.
[32m[I 2023-04-21 02:14:31,468][39m Trial 2147 finished with value: 0.8539325842696629 and parameters: {'objective': 'Logloss', 'colsample_bylevel': 0.07459338130242037, 'depth': 4, 'boosting_type': 'Plain', 'bootstrap_type': 'Bayesian', 'bagging_temperature': 7.467564300183653}. Best is trial 98 with value: 0.8791208791208791.
[32m[I 2023-04-21 02:14:32,246][39m Trial 2148 finished with value: 0.8764044943820225 and parameters: {'objective': 'CrossEntropy', 'colsample_bylevel': 0.0803785640795432, 'depth': 2, 'boosting_type': 'Plain', 'bootstrap_type': 'Bayesian', 'bagging_temperature': 7.720517986829655}. Best is trial 98 with value: 0.8791208791208791.
[32m[I 2023-04-21 02:14:33,367][39m Trial 2149 finished with value: 0.8409090909090909 and parameters: {'objective': 'CrossEntropy', 'colsample_bylevel': 0.08110047465232476, 'depth': 4, 'boosting_type': 'Plain', 'bootstrap_type': 'Bayesian', 'bagging_temperature': 8.945919477453902}. Best is trial 98 with value: 0.8791208791208791.
[32m[I 2023-04-21 02:14:34,316][39m Trial 2150 finished with value: 0.8666666666666666 and parameters: {'objective': 'CrossEntropy', 'colsample_bylevel': 0.07280501090851271, 'depth': 5, 'boosting_type': 'Plain', 'bootstrap_type': 'Bayesian', 'bagging_temperature': 9.421434968704908}. Best is trial 98 with value: 0.8791208791208791.
[32m[I 2023-04-21 02:14:35,289][39m Trial 2151 finished with value: 0.8409090909090909 and parameters: {'objective': 'CrossEntropy', 'colsample_bylevel': 0.08293131406259145, 'depth': 4, 'boosting_type': 'Plain', 'bootstrap_type': 'Bayesian', 'bagging_temperature': 9.025968020196526}. Best is trial 98 with value: 0.8791208791208791.
[32m[I 2023-04-21 02:14:36,342][39m Trial 2152 finished with value: 0.8539325842696629 and parameters: {'objective': 'CrossEntropy', 'colsample_bylevel': 0.07545322706325218, 'depth': 3, 'boosting_type': 'Plain', 'bootstrap_type': 'Bayesian', 'bagging_temperature': 8.36886554163111}. Best is trial 98 with value: 0.8791208791208791.
[32m[I 2023-04-21 02:14:37,114][39m Trial 2153 finished with value: 0.8666666666666666 and parameters: {'objective': 'Logloss', 'colsample_bylevel': 0.07485763258378939, 'depth': 4, 'boosting_type': 'Plain', 'bootstrap_type': 'Bayesian', 'bagging_temperature': 8.371005538591916}. Best is trial 98 with value: 0.8791208791208791.
[32m[I 2023-04-21 02:14:37,765][39m Trial 2154 finished with value: 0.8409090909090909 and parameters: {'objective': 'Logloss', 'colsample_bylevel': 0.08480415425964086, 'depth': 5, 'boosting_type': 'Plain', 'bootstrap_type': 'Bayesian', 'bagging_temperature': 9.155434903893426}. Best is trial 98 with value: 0.8791208791208791.
[32m[I 2023-04-21 02:14:38,570][39m Trial 2155 finished with value: 0.8409090909090909 and parameters: {'objective': 'CrossEntropy', 'colsample_bylevel': 0.08090268703252694, 'depth': 3, 'boosting_type': 'Plain', 'bootstrap_type': 'MVS'}. Best is trial 98 with value: 0.8791208791208791.
[32m[I 2023-04-21 02:14:39,750][39m Trial 2156 finished with value: 0.8372093023255814 and parameters: {'objective': 'CrossEntropy', 'colsample_bylevel': 0.0761368172456408, 'depth': 9, 'boosting_type': 'Plain', 'bootstrap_type': 'Bayesian', 'bagging_temperature': 8.262638083870705}. Best is trial 98 with value: 0.8791208791208791.
[32m[I 2023-04-21 02:14:40,512][39m Trial 2157 finished with value: 0.8409090909090909 and parameters: {'objective': 'CrossEntropy', 'colsample_bylevel': 0.06892836016199339, 'depth': 3, 'boosting_type': 'Plain', 'bootstrap_type': 'Bernoulli', 'subsample': 0.2552435191113351}. Best is trial 98 with value: 0.8791208791208791.
[32m[I 2023-04-21 02:14:41,525][39m Trial 2158 finished with value: 0.8505747126436782 and parameters: {'objective': 'CrossEntropy', 'colsample_bylevel': 0.07302319777383115, 'depth': 5, 'boosting_type': 'Plain', 'bootstrap_type': 'Bayesian', 'bagging_temperature': 5.731153618499386}. Best is trial 98 with value: 0.8791208791208791.
[32m[I 2023-04-21 02:14:42,594][39m Trial 2159 finished with value: 0.8539325842696629 and parameters: {'objective': 'CrossEntropy', 'colsample_bylevel': 0.07396812209829655, 'depth': 4, 'boosting_type': 'Plain', 'bootstrap_type': 'Bayesian', 'bagging_temperature': 9.259293975380926}. Best is trial 98 with value: 0.8791208791208791.
[32m[I 2023-04-21 02:14:43,454][39m Trial 2160 finished with value: 0.8539325842696629 and parameters: {'objective': 'CrossEntropy', 'colsample_bylevel': 0.08176530986037286, 'depth': 3, 'boosting_type': 'Plain', 'bootstrap_type': 'Bayesian', 'bagging_temperature': 9.319652149127275}. Best is trial 98 with value: 0.8791208791208791.
[32m[I 2023-04-21 02:14:44,322][39m Trial 2161 finished with value: 0.8539325842696629 and parameters: {'objective': 'CrossEntropy', 'colsample_bylevel': 0.0783233856715347, 'depth': 3, 'boosting_type': 'Plain', 'bootstrap_type': 'Bayesian', 'bagging_temperature': 9.02775013342708}. Best is trial 98 with value: 0.8791208791208791.
[32m[I 2023-04-21 02:14:49,353][39m Trial 2162 finished with value: 0.8139534883720929 and parameters: {'objective': 'CrossEntropy', 'colsample_bylevel': 0.07979228539730843, 'depth': 4, 'boosting_type': 'Ordered', 'bootstrap_type': 'Bayesian', 'bagging_temperature': 9.434146653019148}. Best is trial 98 with value: 0.8791208791208791.
[32m[I 2023-04-21 02:14:50,397][39m Trial 2163 finished with value: 0.8666666666666666 and parameters: {'objective': 'CrossEntropy', 'colsample_bylevel': 0.06479783936399028, 'depth': 5, 'boosting_type': 'Plain', 'bootstrap_type': 'Bayesian', 'bagging_temperature': 9.413290239617195}. Best is trial 98 with value: 0.8791208791208791.
[32m[I 2023-04-21 02:14:51,246][39m Trial 2164 finished with value: 0.8275862068965518 and parameters: {'objective': 'CrossEntropy', 'colsample_bylevel': 0.0765973253467531, 'depth': 6, 'boosting_type': 'Plain', 'bootstrap_type': 'Bayesian', 'bagging_temperature': 9.591200428821795}. Best is trial 98 with value: 0.8791208791208791.
[32m[I 2023-04-21 02:14:52,069][39m Trial 2165 finished with value: 0.8539325842696629 and parameters: {'objective': 'CrossEntropy', 'colsample_bylevel': 0.09484514831757165, 'depth': 3, 'boosting_type': 'Plain', 'bootstrap_type': 'Bayesian', 'bagging_temperature': 8.810149488992822}. Best is trial 98 with value: 0.8791208791208791.
[32m[I 2023-04-21 02:14:53,098][39m Trial 2166 finished with value: 0.8539325842696629 and parameters: {'objective': 'CrossEntropy', 'colsample_bylevel': 0.079344490573209, 'depth': 3, 'boosting_type': 'Plain', 'bootstrap_type': 'Bayesian', 'bagging_temperature': 9.721309772738715}. Best is trial 98 with value: 0.8791208791208791.
[32m[I 2023-04-21 02:14:54,090][39m Trial 2167 finished with value: 0.8409090909090909 and parameters: {'objective': 'Logloss', 'colsample_bylevel': 0.07453793534129857, 'depth': 10, 'boosting_type': 'Plain', 'bootstrap_type': 'Bayesian', 'bagging_temperature': 9.265084803965173}. Best is trial 98 with value: 0.8791208791208791.
[32m[I 2023-04-21 02:14:54,774][39m Trial 2168 finished with value: 0.8539325842696629 and parameters: {'objective': 'Logloss', 'colsample_bylevel': 0.07990275023873969, 'depth': 4, 'boosting_type': 'Plain', 'bootstrap_type': 'Bayesian', 'bagging_temperature': 7.461997532167693}. Best is trial 98 with value: 0.8791208791208791.
[32m[I 2023-04-21 02:14:55,730][39m Trial 2169 finished with value: 0.8539325842696629 and parameters: {'objective': 'CrossEntropy', 'colsample_bylevel': 0.0800557549524539, 'depth': 3, 'boosting_type': 'Plain', 'bootstrap_type': 'Bayesian', 'bagging_temperature': 7.003027544069656}. Best is trial 98 with value: 0.8791208791208791.
[32m[I 2023-04-21 02:14:56,683][39m Trial 2170 finished with value: 0.8539325842696629 and parameters: {'objective': 'Logloss', 'colsample_bylevel': 0.07075671711060176, 'depth': 4, 'boosting_type': 'Plain', 'bootstrap_type': 'MVS'}. Best is trial 98 with value: 0.8791208791208791.
[32m[I 2023-04-21 02:14:57,540][39m Trial 2171 finished with value: 0.8409090909090909 and parameters: {'objective': 'Logloss', 'colsample_bylevel': 0.07761475864623145, 'depth': 10, 'boosting_type': 'Plain', 'bootstrap_type': 'Bayesian', 'bagging_temperature': 9.230256004430201}. Best is trial 98 with value: 0.8791208791208791.
[32m[I 2023-04-21 02:14:58,656][39m Trial 2172 finished with value: 0.8275862068965518 and parameters: {'objective': 'CrossEntropy', 'colsample_bylevel': 0.07904459686834941, 'depth': 7, 'boosting_type': 'Plain', 'bootstrap_type': 'Bayesian', 'bagging_temperature': 8.730642259963666}. Best is trial 98 with value: 0.8791208791208791.
[32m[I 2023-04-21 02:14:59,863][39m Trial 2173 finished with value: 0.8539325842696629 and parameters: {'objective': 'CrossEntropy', 'colsample_bylevel': 0.07347102542118658, 'depth': 10, 'boosting_type': 'Plain', 'bootstrap_type': 'Bayesian', 'bagging_temperature': 9.74015701192842}. Best is trial 98 with value: 0.8791208791208791.
[32m[I 2023-04-21 02:15:00,822][39m Trial 2174 finished with value: 0.8666666666666666 and parameters: {'objective': 'CrossEntropy', 'colsample_bylevel': 0.07551154998081619, 'depth': 4, 'boosting_type': 'Plain', 'bootstrap_type': 'Bayesian', 'bagging_temperature': 9.286456600763538}. Best is trial 98 with value: 0.8791208791208791.
[32m[I 2023-04-21 02:15:01,973][39m Trial 2175 finished with value: 0.8409090909090909 and parameters: {'objective': 'Logloss', 'colsample_bylevel': 0.06877933810120382, 'depth': 11, 'boosting_type': 'Plain', 'bootstrap_type': 'Bayesian', 'bagging_temperature': 9.982969426902471}. Best is trial 98 with value: 0.8791208791208791.
[32m[I 2023-04-21 02:15:02,698][39m Trial 2176 finished with value: 0.8666666666666666 and parameters: {'objective': 'CrossEntropy', 'colsample_bylevel': 0.08317013418621284, 'depth': 3, 'boosting_type': 'Plain', 'bootstrap_type': 'Bayesian', 'bagging_temperature': 9.08226417939446}. Best is trial 98 with value: 0.8791208791208791.
[32m[I 2023-04-21 02:15:03,437][39m Trial 2177 finished with value: 0.8666666666666666 and parameters: {'objective': 'Logloss', 'colsample_bylevel': 0.07249238177068038, 'depth': 10, 'boosting_type': 'Plain', 'bootstrap_type': 'Bayesian', 'bagging_temperature': 9.562899839723666}. Best is trial 98 with value: 0.8791208791208791.
[32m[I 2023-04-21 02:15:04,621][39m Trial 2178 finished with value: 0.8409090909090909 and parameters: {'objective': 'CrossEntropy', 'colsample_bylevel': 0.0853259881740492, 'depth': 5, 'boosting_type': 'Plain', 'bootstrap_type': 'Bayesian', 'bagging_temperature': 9.443560423370164}. Best is trial 98 with value: 0.8791208791208791.
[32m[I 2023-04-21 02:15:05,691][39m Trial 2179 finished with value: 0.8666666666666666 and parameters: {'objective': 'CrossEntropy', 'colsample_bylevel': 0.07139476055193975, 'depth': 3, 'boosting_type': 'Plain', 'bootstrap_type': 'Bayesian', 'bagging_temperature': 9.434480783151296}. Best is trial 98 with value: 0.8791208791208791.
[32m[I 2023-04-21 02:15:06,623][39m Trial 2180 finished with value: 0.8409090909090909 and parameters: {'objective': 'CrossEntropy', 'colsample_bylevel': 0.06987638413604773, 'depth': 11, 'boosting_type': 'Plain', 'bootstrap_type': 'Bernoulli', 'subsample': 0.8314196658622994}. Best is trial 98 with value: 0.8791208791208791.
