[32m[I 2023-04-21 01:48:21,780][39m Trial 728 finished with value: 0.8666666666666666 and parameters: {'objective': 'Logloss', 'colsample_bylevel': 0.0819424753122936, 'depth': 3, 'boosting_type': 'Plain', 'bootstrap_type': 'Bayesian', 'bagging_temperature': 9.553874956993743}. Best is trial 98 with value: 0.8791208791208791.
[32m[I 2023-04-21 01:48:22,851][39m Trial 729 finished with value: 0.8275862068965518 and parameters: {'objective': 'CrossEntropy', 'colsample_bylevel': 0.07845363319711189, 'depth': 3, 'boosting_type': 'Plain', 'bootstrap_type': 'Bayesian', 'bagging_temperature': 1.9523536803421342}. Best is trial 98 with value: 0.8791208791208791.
[32m[I 2023-04-21 01:48:23,499][39m Trial 730 finished with value: 0.8095238095238095 and parameters: {'objective': 'CrossEntropy', 'colsample_bylevel': 0.07322125963166877, 'depth': 1, 'boosting_type': 'Plain', 'bootstrap_type': 'Bayesian', 'bagging_temperature': 9.999281564861008}. Best is trial 98 with value: 0.8791208791208791.
[32m[I 2023-04-21 01:48:24,448][39m Trial 731 finished with value: 0.8666666666666666 and parameters: {'objective': 'CrossEntropy', 'colsample_bylevel': 0.07504493401602301, 'depth': 2, 'boosting_type': 'Plain', 'bootstrap_type': 'Bayesian', 'bagging_temperature': 8.39233004412569}. Best is trial 98 with value: 0.8791208791208791.
[32m[I 2023-04-21 01:48:25,435][39m Trial 732 finished with value: 0.8409090909090909 and parameters: {'objective': 'CrossEntropy', 'colsample_bylevel': 0.0866523106098204, 'depth': 6, 'boosting_type': 'Plain', 'bootstrap_type': 'Bayesian', 'bagging_temperature': 9.576868655988747}. Best is trial 98 with value: 0.8791208791208791.
[32m[I 2023-04-21 01:48:26,216][39m Trial 733 finished with value: 0.8539325842696629 and parameters: {'objective': 'CrossEntropy', 'colsample_bylevel': 0.09245190010234233, 'depth': 2, 'boosting_type': 'Plain', 'bootstrap_type': 'Bayesian', 'bagging_temperature': 8.504826533464064}. Best is trial 98 with value: 0.8791208791208791.
[32m[I 2023-04-21 01:48:27,129][39m Trial 734 finished with value: 0.8409090909090909 and parameters: {'objective': 'CrossEntropy', 'colsample_bylevel': 0.08368073269509513, 'depth': 3, 'boosting_type': 'Plain', 'bootstrap_type': 'Bayesian', 'bagging_temperature': 9.694654160549398}. Best is trial 98 with value: 0.8791208791208791.
[32m[I 2023-04-21 01:48:32,091][39m Trial 735 finished with value: 0.8275862068965518 and parameters: {'objective': 'Logloss', 'colsample_bylevel': 0.09595011717387882, 'depth': 2, 'boosting_type': 'Ordered', 'bootstrap_type': 'Bayesian', 'bagging_temperature': 9.284968802661634}. Best is trial 98 with value: 0.8791208791208791.
[32m[I 2023-04-21 01:48:33,304][39m Trial 736 finished with value: 0.8636363636363636 and parameters: {'objective': 'CrossEntropy', 'colsample_bylevel': 0.08223539067064446, 'depth': 2, 'boosting_type': 'Plain', 'bootstrap_type': 'Bayesian', 'bagging_temperature': 9.696394004953977}. Best is trial 98 with value: 0.8791208791208791.
[32m[I 2023-04-21 01:48:33,979][39m Trial 737 finished with value: 0.8666666666666666 and parameters: {'objective': 'CrossEntropy', 'colsample_bylevel': 0.08455133272391425, 'depth': 3, 'boosting_type': 'Plain', 'bootstrap_type': 'Bayesian', 'bagging_temperature': 9.157302660793993}. Best is trial 98 with value: 0.8791208791208791.
[32m[I 2023-04-21 01:48:35,211][39m Trial 738 finished with value: 0.8275862068965518 and parameters: {'objective': 'CrossEntropy', 'colsample_bylevel': 0.08976138481040973, 'depth': 4, 'boosting_type': 'Plain', 'bootstrap_type': 'Bayesian', 'bagging_temperature': 9.34224405572981}. Best is trial 98 with value: 0.8791208791208791.
[32m[I 2023-04-21 01:48:35,881][39m Trial 739 finished with value: 0.8539325842696629 and parameters: {'objective': 'CrossEntropy', 'colsample_bylevel': 0.08774415273251585, 'depth': 3, 'boosting_type': 'Plain', 'bootstrap_type': 'Bayesian', 'bagging_temperature': 9.04342174215909}. Best is trial 98 with value: 0.8791208791208791.
[32m[I 2023-04-21 01:48:37,106][39m Trial 740 finished with value: 0.8409090909090909 and parameters: {'objective': 'CrossEntropy', 'colsample_bylevel': 0.08660015144860062, 'depth': 2, 'boosting_type': 'Plain', 'bootstrap_type': 'Bayesian', 'bagging_temperature': 9.26881771480191}. Best is trial 98 with value: 0.8791208791208791.
[32m[I 2023-04-21 01:48:37,774][39m Trial 741 finished with value: 0.8409090909090909 and parameters: {'objective': 'CrossEntropy', 'colsample_bylevel': 0.09065775621486229, 'depth': 2, 'boosting_type': 'Plain', 'bootstrap_type': 'Bernoulli', 'subsample': 0.6146895919885788}. Best is trial 98 with value: 0.8791208791208791.
[32m[I 2023-04-21 01:48:38,547][39m Trial 742 finished with value: 0.8235294117647058 and parameters: {'objective': 'CrossEntropy', 'colsample_bylevel': 0.08592487497969253, 'depth': 1, 'boosting_type': 'Plain', 'bootstrap_type': 'Bayesian', 'bagging_temperature': 9.479714191500554}. Best is trial 98 with value: 0.8791208791208791.
[32m[I 2023-04-21 01:48:39,346][39m Trial 743 finished with value: 0.8666666666666666 and parameters: {'objective': 'CrossEntropy', 'colsample_bylevel': 0.07650052005901417, 'depth': 3, 'boosting_type': 'Plain', 'bootstrap_type': 'Bayesian', 'bagging_temperature': 9.537742625964526}. Best is trial 98 with value: 0.8791208791208791.
[32m[I 2023-04-21 01:48:40,092][39m Trial 744 finished with value: 0.8791208791208791 and parameters: {'objective': 'CrossEntropy', 'colsample_bylevel': 0.07976397482359297, 'depth': 3, 'boosting_type': 'Plain', 'bootstrap_type': 'Bayesian', 'bagging_temperature': 9.727764773566138}. Best is trial 98 with value: 0.8791208791208791.
[32m[I 2023-04-21 01:48:41,228][39m Trial 745 finished with value: 0.8275862068965518 and parameters: {'objective': 'CrossEntropy', 'colsample_bylevel': 0.0820244333707986, 'depth': 4, 'boosting_type': 'Plain', 'bootstrap_type': 'MVS'}. Best is trial 98 with value: 0.8791208791208791.
[32m[I 2023-04-21 01:48:42,001][39m Trial 746 finished with value: 0.8791208791208791 and parameters: {'objective': 'CrossEntropy', 'colsample_bylevel': 0.08407367949208047, 'depth': 3, 'boosting_type': 'Plain', 'bootstrap_type': 'Bayesian', 'bagging_temperature': 9.263462841654565}. Best is trial 98 with value: 0.8791208791208791.
[32m[I 2023-04-21 01:48:42,919][39m Trial 747 finished with value: 0.8409090909090909 and parameters: {'objective': 'CrossEntropy', 'colsample_bylevel': 0.08115812900160425, 'depth': 3, 'boosting_type': 'Plain', 'bootstrap_type': 'Bayesian', 'bagging_temperature': 9.840811001767559}. Best is trial 98 with value: 0.8791208791208791.
[32m[I 2023-04-21 01:48:43,931][39m Trial 748 finished with value: 0.8666666666666666 and parameters: {'objective': 'CrossEntropy', 'colsample_bylevel': 0.07767265562527009, 'depth': 3, 'boosting_type': 'Plain', 'bootstrap_type': 'Bayesian', 'bagging_temperature': 9.727025178702641}. Best is trial 98 with value: 0.8791208791208791.
[32m[I 2023-04-21 01:48:44,664][39m Trial 749 finished with value: 0.8539325842696629 and parameters: {'objective': 'CrossEntropy', 'colsample_bylevel': 0.08314591735483597, 'depth': 3, 'boosting_type': 'Plain', 'bootstrap_type': 'Bayesian', 'bagging_temperature': 9.143202990036185}. Best is trial 98 with value: 0.8791208791208791.
[32m[I 2023-04-21 01:48:45,381][39m Trial 750 finished with value: 0.8409090909090909 and parameters: {'objective': 'CrossEntropy', 'colsample_bylevel': 0.0978894275137331, 'depth': 3, 'boosting_type': 'Plain', 'bootstrap_type': 'Bayesian', 'bagging_temperature': 9.462140247252623}. Best is trial 98 with value: 0.8791208791208791.
[32m[I 2023-04-21 01:48:46,620][39m Trial 751 finished with value: 0.8539325842696629 and parameters: {'objective': 'CrossEntropy', 'colsample_bylevel': 0.07919988882170025, 'depth': 3, 'boosting_type': 'Plain', 'bootstrap_type': 'Bayesian', 'bagging_temperature': 9.986710191730145}. Best is trial 98 with value: 0.8791208791208791.
[32m[I 2023-04-21 01:48:47,450][39m Trial 752 finished with value: 0.8666666666666666 and parameters: {'objective': 'CrossEntropy', 'colsample_bylevel': 0.08882967282433497, 'depth': 3, 'boosting_type': 'Plain', 'bootstrap_type': 'Bayesian', 'bagging_temperature': 9.352559541595056}. Best is trial 98 with value: 0.8791208791208791.
[32m[I 2023-04-21 01:48:48,102][39m Trial 753 finished with value: 0.8275862068965518 and parameters: {'objective': 'CrossEntropy', 'colsample_bylevel': 0.07869487860554371, 'depth': 4, 'boosting_type': 'Plain', 'bootstrap_type': 'Bayesian', 'bagging_temperature': 8.063147143952321}. Best is trial 98 with value: 0.8791208791208791.
[32m[I 2023-04-21 01:48:53,044][39m Trial 754 finished with value: 0.8409090909090909 and parameters: {'objective': 'CrossEntropy', 'colsample_bylevel': 0.08301756069449479, 'depth': 3, 'boosting_type': 'Ordered', 'bootstrap_type': 'Bayesian', 'bagging_temperature': 9.262001798127027}. Best is trial 98 with value: 0.8791208791208791.
[32m[I 2023-04-21 01:48:53,922][39m Trial 755 finished with value: 0.8409090909090909 and parameters: {'objective': 'CrossEntropy', 'colsample_bylevel': 0.06378480409971803, 'depth': 3, 'boosting_type': 'Plain', 'bootstrap_type': 'Bayesian', 'bagging_temperature': 5.152666559269572}. Best is trial 98 with value: 0.8791208791208791.
[32m[I 2023-04-21 01:48:54,794][39m Trial 756 finished with value: 0.8791208791208791 and parameters: {'objective': 'CrossEntropy', 'colsample_bylevel': 0.07996913134393523, 'depth': 3, 'boosting_type': 'Plain', 'bootstrap_type': 'Bayesian', 'bagging_temperature': 9.6522827125584}. Best is trial 98 with value: 0.8791208791208791.
[32m[I 2023-04-21 01:48:55,598][39m Trial 757 finished with value: 0.8666666666666666 and parameters: {'objective': 'CrossEntropy', 'colsample_bylevel': 0.08062449974411567, 'depth': 3, 'boosting_type': 'Plain', 'bootstrap_type': 'Bayesian', 'bagging_temperature': 9.717878233574623}. Best is trial 98 with value: 0.8791208791208791.
[32m[I 2023-04-21 01:48:56,209][39m Trial 758 finished with value: 0.8666666666666666 and parameters: {'objective': 'CrossEntropy', 'colsample_bylevel': 0.08427828795309754, 'depth': 3, 'boosting_type': 'Plain', 'bootstrap_type': 'Bayesian', 'bagging_temperature': 9.089262121742244}. Best is trial 98 with value: 0.8791208791208791.
[32m[I 2023-04-21 01:48:56,947][39m Trial 759 finished with value: 0.8505747126436782 and parameters: {'objective': 'CrossEntropy', 'colsample_bylevel': 0.048624157273345556, 'depth': 4, 'boosting_type': 'Plain', 'bootstrap_type': 'Bayesian', 'bagging_temperature': 9.453416216884264}. Best is trial 98 with value: 0.8791208791208791.
[32m[I 2023-04-21 01:48:57,813][39m Trial 760 finished with value: 0.8666666666666666 and parameters: {'objective': 'CrossEntropy', 'colsample_bylevel': 0.08086353406769578, 'depth': 3, 'boosting_type': 'Plain', 'bootstrap_type': 'Bayesian', 'bagging_temperature': 8.90066777435815}. Best is trial 98 with value: 0.8791208791208791.
[32m[I 2023-04-21 01:48:58,803][39m Trial 761 finished with value: 0.8539325842696629 and parameters: {'objective': 'CrossEntropy', 'colsample_bylevel': 0.09155124441761534, 'depth': 3, 'boosting_type': 'Plain', 'bootstrap_type': 'Bayesian', 'bagging_temperature': 8.263671294863915}. Best is trial 98 with value: 0.8791208791208791.
[32m[I 2023-04-21 01:48:59,461][39m Trial 762 finished with value: 0.8791208791208791 and parameters: {'objective': 'CrossEntropy', 'colsample_bylevel': 0.09059637351178323, 'depth': 3, 'boosting_type': 'Plain', 'bootstrap_type': 'Bayesian', 'bagging_temperature': 8.475718334275056}. Best is trial 98 with value: 0.8791208791208791.
[32m[I 2023-04-21 01:49:00,425][39m Trial 763 finished with value: 0.8275862068965518 and parameters: {'objective': 'CrossEntropy', 'colsample_bylevel': 0.08892539448010671, 'depth': 4, 'boosting_type': 'Plain', 'bootstrap_type': 'Bayesian', 'bagging_temperature': 9.429017872259944}. Best is trial 98 with value: 0.8791208791208791.
[32m[I 2023-04-21 01:49:01,414][39m Trial 764 finished with value: 0.8636363636363636 and parameters: {'objective': 'CrossEntropy', 'colsample_bylevel': 0.08065875252295712, 'depth': 3, 'boosting_type': 'Plain', 'bootstrap_type': 'Bayesian', 'bagging_temperature': 8.531105476318622}. Best is trial 98 with value: 0.8791208791208791.
[32m[I 2023-04-21 01:49:02,222][39m Trial 765 finished with value: 0.8666666666666666 and parameters: {'objective': 'CrossEntropy', 'colsample_bylevel': 0.09412188637958502, 'depth': 3, 'boosting_type': 'Plain', 'bootstrap_type': 'Bayesian', 'bagging_temperature': 9.643690438155952}. Best is trial 98 with value: 0.8791208791208791.
[32m[I 2023-04-21 01:49:02,814][39m Trial 766 finished with value: 0.8409090909090909 and parameters: {'objective': 'CrossEntropy', 'colsample_bylevel': 0.07874406668309272, 'depth': 3, 'boosting_type': 'Plain', 'bootstrap_type': 'Bernoulli', 'subsample': 0.8138890551369737}. Best is trial 98 with value: 0.8791208791208791.
[32m[I 2023-04-21 01:49:03,593][39m Trial 767 finished with value: 0.8666666666666666 and parameters: {'objective': 'CrossEntropy', 'colsample_bylevel': 0.07852065337309963, 'depth': 3, 'boosting_type': 'Plain', 'bootstrap_type': 'Bayesian', 'bagging_temperature': 9.742489503004784}. Best is trial 98 with value: 0.8791208791208791.
[32m[I 2023-04-21 01:49:04,864][39m Trial 768 finished with value: 0.8791208791208791 and parameters: {'objective': 'CrossEntropy', 'colsample_bylevel': 0.07979303698767264, 'depth': 3, 'boosting_type': 'Plain', 'bootstrap_type': 'Bayesian', 'bagging_temperature': 9.996844963195958}. Best is trial 98 with value: 0.8791208791208791.
[32m[I 2023-04-21 01:49:05,494][39m Trial 769 finished with value: 0.8666666666666666 and parameters: {'objective': 'CrossEntropy', 'colsample_bylevel': 0.0763163758668379, 'depth': 3, 'boosting_type': 'Plain', 'bootstrap_type': 'Bayesian', 'bagging_temperature': 8.517515977359597}. Best is trial 98 with value: 0.8791208791208791.
[32m[I 2023-04-21 01:49:06,520][39m Trial 770 finished with value: 0.8409090909090909 and parameters: {'objective': 'CrossEntropy', 'colsample_bylevel': 0.07345633933686205, 'depth': 3, 'boosting_type': 'Plain', 'bootstrap_type': 'MVS'}. Best is trial 98 with value: 0.8791208791208791.
[32m[I 2023-04-21 01:49:07,550][39m Trial 771 finished with value: 0.8539325842696629 and parameters: {'objective': 'CrossEntropy', 'colsample_bylevel': 0.07696480991320336, 'depth': 3, 'boosting_type': 'Plain', 'bootstrap_type': 'Bayesian', 'bagging_temperature': 8.362359200701412}. Best is trial 98 with value: 0.8791208791208791.
[32m[I 2023-04-21 01:49:08,258][39m Trial 772 finished with value: 0.8314606741573034 and parameters: {'objective': 'CrossEntropy', 'colsample_bylevel': 0.030132146954548706, 'depth': 4, 'boosting_type': 'Plain', 'bootstrap_type': 'Bayesian', 'bagging_temperature': 8.278968253428575}. Best is trial 98 with value: 0.8791208791208791.
[32m[I 2023-04-21 01:49:08,904][39m Trial 773 finished with value: 0.8409090909090909 and parameters: {'objective': 'CrossEntropy', 'colsample_bylevel': 0.08012937604090027, 'depth': 3, 'boosting_type': 'Plain', 'bootstrap_type': 'Bayesian', 'bagging_temperature': 9.921501699050534}. Best is trial 98 with value: 0.8791208791208791.
[32m[I 2023-04-21 01:49:09,901][39m Trial 774 finished with value: 0.8666666666666666 and parameters: {'objective': 'CrossEntropy', 'colsample_bylevel': 0.08173020675993187, 'depth': 3, 'boosting_type': 'Plain', 'bootstrap_type': 'Bayesian', 'bagging_temperature': 9.83857031209389}. Best is trial 98 with value: 0.8791208791208791.
[32m[I 2023-04-21 01:49:14,647][39m Trial 775 finished with value: 0.8409090909090909 and parameters: {'objective': 'Logloss', 'colsample_bylevel': 0.08329383121350657, 'depth': 3, 'boosting_type': 'Ordered', 'bootstrap_type': 'Bayesian', 'bagging_temperature': 9.15448814502595}. Best is trial 98 with value: 0.8791208791208791.
[32m[I 2023-04-21 01:49:15,754][39m Trial 776 finished with value: 0.8409090909090909 and parameters: {'objective': 'CrossEntropy', 'colsample_bylevel': 0.0758884624108146, 'depth': 4, 'boosting_type': 'Plain', 'bootstrap_type': 'Bayesian', 'bagging_temperature': 9.969353583897522}. Best is trial 98 with value: 0.8791208791208791.
[32m[I 2023-04-21 01:49:16,468][39m Trial 777 finished with value: 0.8539325842696629 and parameters: {'objective': 'CrossEntropy', 'colsample_bylevel': 0.07728660406784896, 'depth': 3, 'boosting_type': 'Plain', 'bootstrap_type': 'Bayesian', 'bagging_temperature': 8.73058835678653}. Best is trial 98 with value: 0.8791208791208791.
[32m[I 2023-04-21 01:49:17,247][39m Trial 778 finished with value: 0.8275862068965518 and parameters: {'objective': 'CrossEntropy', 'colsample_bylevel': 0.08044631112599399, 'depth': 3, 'boosting_type': 'Plain', 'bootstrap_type': 'Bayesian', 'bagging_temperature': 7.8741936099426715}. Best is trial 98 with value: 0.8791208791208791.
[32m[I 2023-04-21 01:49:18,165][39m Trial 779 finished with value: 0.8539325842696629 and parameters: {'objective': 'CrossEntropy', 'colsample_bylevel': 0.08978404192484958, 'depth': 3, 'boosting_type': 'Plain', 'bootstrap_type': 'Bayesian', 'bagging_temperature': 9.659812175763056}. Best is trial 98 with value: 0.8791208791208791.
[32m[I 2023-04-21 01:49:19,084][39m Trial 780 finished with value: 0.8666666666666666 and parameters: {'objective': 'CrossEntropy', 'colsample_bylevel': 0.07999018540550197, 'depth': 3, 'boosting_type': 'Plain', 'bootstrap_type': 'Bayesian', 'bagging_temperature': 9.496883963173987}. Best is trial 98 with value: 0.8791208791208791.
[32m[I 2023-04-21 01:49:19,733][39m Trial 781 finished with value: 0.8409090909090909 and parameters: {'objective': 'CrossEntropy', 'colsample_bylevel': 0.09078551481786326, 'depth': 3, 'boosting_type': 'Plain', 'bootstrap_type': 'Bayesian', 'bagging_temperature': 9.9995572899204}. Best is trial 98 with value: 0.8791208791208791.
[32m[I 2023-04-21 01:49:20,617][39m Trial 782 finished with value: 0.8791208791208791 and parameters: {'objective': 'CrossEntropy', 'colsample_bylevel': 0.09283932192844065, 'depth': 3, 'boosting_type': 'Plain', 'bootstrap_type': 'Bayesian', 'bagging_temperature': 8.577507127649207}. Best is trial 98 with value: 0.8791208791208791.
[32m[I 2023-04-21 01:49:21,496][39m Trial 783 finished with value: 0.8539325842696629 and parameters: {'objective': 'CrossEntropy', 'colsample_bylevel': 0.09226902524670089, 'depth': 3, 'boosting_type': 'Plain', 'bootstrap_type': 'Bayesian', 'bagging_temperature': 9.83269736458946}. Best is trial 98 with value: 0.8791208791208791.
[32m[I 2023-04-21 01:49:22,409][39m Trial 784 finished with value: 0.8666666666666666 and parameters: {'objective': 'CrossEntropy', 'colsample_bylevel': 0.07439670819102039, 'depth': 4, 'boosting_type': 'Plain', 'bootstrap_type': 'Bayesian', 'bagging_temperature': 8.378415240456551}. Best is trial 98 with value: 0.8791208791208791.
[32m[I 2023-04-21 01:49:23,033][39m Trial 785 finished with value: 0.8539325842696629 and parameters: {'objective': 'CrossEntropy', 'colsample_bylevel': 0.07857881445350483, 'depth': 3, 'boosting_type': 'Plain', 'bootstrap_type': 'Bayesian', 'bagging_temperature': 8.69910043944177}. Best is trial 98 with value: 0.8791208791208791.
[32m[I 2023-04-21 01:49:24,273][39m Trial 786 finished with value: 0.8139534883720929 and parameters: {'objective': 'CrossEntropy', 'colsample_bylevel': 0.07779166876067803, 'depth': 3, 'boosting_type': 'Plain', 'bootstrap_type': 'Bernoulli', 'subsample': 0.22961347020084066}. Best is trial 98 with value: 0.8791208791208791.
[32m[I 2023-04-21 01:49:24,973][39m Trial 787 finished with value: 0.8666666666666666 and parameters: {'objective': 'CrossEntropy', 'colsample_bylevel': 0.0795641417206467, 'depth': 3, 'boosting_type': 'Plain', 'bootstrap_type': 'Bayesian', 'bagging_temperature': 9.75567969622666}. Best is trial 98 with value: 0.8791208791208791.
[32m[I 2023-04-21 01:49:26,020][39m Trial 788 finished with value: 0.8539325842696629 and parameters: {'objective': 'CrossEntropy', 'colsample_bylevel': 0.08232880177967518, 'depth': 3, 'boosting_type': 'Plain', 'bootstrap_type': 'Bayesian', 'bagging_temperature': 8.539721542902825}. Best is trial 98 with value: 0.8791208791208791.
[32m[I 2023-04-21 01:49:26,889][39m Trial 789 finished with value: 0.8470588235294119 and parameters: {'objective': 'CrossEntropy', 'colsample_bylevel': 0.04712413065490345, 'depth': 3, 'boosting_type': 'Plain', 'bootstrap_type': 'Bayesian', 'bagging_temperature': 8.984550153159196}. Best is trial 98 with value: 0.8791208791208791.
[32m[I 2023-04-21 01:49:27,780][39m Trial 790 finished with value: 0.8275862068965518 and parameters: {'objective': 'CrossEntropy', 'colsample_bylevel': 0.08563966873068449, 'depth': 4, 'boosting_type': 'Plain', 'bootstrap_type': 'Bayesian', 'bagging_temperature': 9.580252876615367}. Best is trial 98 with value: 0.8791208791208791.
[32m[I 2023-04-21 01:49:28,875][39m Trial 791 finished with value: 0.8409090909090909 and parameters: {'objective': 'CrossEntropy', 'colsample_bylevel': 0.07845154287518735, 'depth': 3, 'boosting_type': 'Plain', 'bootstrap_type': 'MVS'}. Best is trial 98 with value: 0.8791208791208791.
[32m[I 2023-04-21 01:49:29,620][39m Trial 792 finished with value: 0.8539325842696629 and parameters: {'objective': 'CrossEntropy', 'colsample_bylevel': 0.09396818145505205, 'depth': 3, 'boosting_type': 'Plain', 'bootstrap_type': 'Bayesian', 'bagging_temperature': 6.7552096847972525}. Best is trial 98 with value: 0.8791208791208791.
[32m[I 2023-04-21 01:49:30,395][39m Trial 793 finished with value: 0.8139534883720929 and parameters: {'objective': 'CrossEntropy', 'colsample_bylevel': 0.08032092877741424, 'depth': 3, 'boosting_type': 'Plain', 'bootstrap_type': 'Bayesian', 'bagging_temperature': 7.585339356446186}. Best is trial 98 with value: 0.8791208791208791.
