[32m[I 2023-04-21 01:47:14,880][39m Trial 662 finished with value: 0.8539325842696629 and parameters: {'objective': 'CrossEntropy', 'colsample_bylevel': 0.08459096290254366, 'depth': 2, 'boosting_type': 'Plain', 'bootstrap_type': 'Bayesian', 'bagging_temperature': 9.475666698810846}. Best is trial 98 with value: 0.8791208791208791.
[32m[I 2023-04-21 01:47:15,651][39m Trial 663 finished with value: 0.8470588235294119 and parameters: {'objective': 'Logloss', 'colsample_bylevel': 0.08314225746732389, 'depth': 1, 'boosting_type': 'Plain', 'bootstrap_type': 'Bayesian', 'bagging_temperature': 7.652874177663337}. Best is trial 98 with value: 0.8791208791208791.
[32m[I 2023-04-21 01:47:16,797][39m Trial 664 finished with value: 0.8409090909090909 and parameters: {'objective': 'CrossEntropy', 'colsample_bylevel': 0.08826004137461183, 'depth': 9, 'boosting_type': 'Plain', 'bootstrap_type': 'Bayesian', 'bagging_temperature': 8.311657659007857}. Best is trial 98 with value: 0.8791208791208791.
[32m[I 2023-04-21 01:47:17,466][39m Trial 665 finished with value: 0.8409090909090909 and parameters: {'objective': 'CrossEntropy', 'colsample_bylevel': 0.08750616242357503, 'depth': 10, 'boosting_type': 'Plain', 'bootstrap_type': 'Bayesian', 'bagging_temperature': 9.596518998602543}. Best is trial 98 with value: 0.8791208791208791.
[32m[I 2023-04-21 01:47:18,448][39m Trial 666 finished with value: 0.8275862068965518 and parameters: {'objective': 'CrossEntropy', 'colsample_bylevel': 0.0999595353199815, 'depth': 3, 'boosting_type': 'Plain', 'bootstrap_type': 'Bayesian', 'bagging_temperature': 8.080449474467716}. Best is trial 98 with value: 0.8791208791208791.
[32m[I 2023-04-21 01:47:19,298][39m Trial 667 finished with value: 0.8409090909090909 and parameters: {'objective': 'CrossEntropy', 'colsample_bylevel': 0.08295940524121881, 'depth': 2, 'boosting_type': 'Plain', 'bootstrap_type': 'Bayesian', 'bagging_temperature': 3.3064443529425356}. Best is trial 98 with value: 0.8791208791208791.
[32m[I 2023-04-21 01:47:20,510][39m Trial 668 finished with value: 0.8409090909090909 and parameters: {'objective': 'CrossEntropy', 'colsample_bylevel': 0.08933164097829567, 'depth': 3, 'boosting_type': 'Plain', 'bootstrap_type': 'Bayesian', 'bagging_temperature': 9.420021796362843}. Best is trial 98 with value: 0.8791208791208791.
[32m[I 2023-04-21 01:47:21,213][39m Trial 669 finished with value: 0.8372093023255814 and parameters: {'objective': 'CrossEntropy', 'colsample_bylevel': 0.09042559825654184, 'depth': 7, 'boosting_type': 'Plain', 'bootstrap_type': 'Bayesian', 'bagging_temperature': 9.45082871561211}. Best is trial 98 with value: 0.8791208791208791.
[32m[I 2023-04-21 01:47:22,060][39m Trial 670 finished with value: 0.8604651162790697 and parameters: {'objective': 'Logloss', 'colsample_bylevel': 0.06602763837829426, 'depth': 8, 'boosting_type': 'Plain', 'bootstrap_type': 'Bayesian', 'bagging_temperature': 9.854845200358469}. Best is trial 98 with value: 0.8791208791208791.
[32m[I 2023-04-21 01:47:22,965][39m Trial 671 finished with value: 0.8539325842696629 and parameters: {'objective': 'CrossEntropy', 'colsample_bylevel': 0.08065187897525383, 'depth': 2, 'boosting_type': 'Plain', 'bootstrap_type': 'Bayesian', 'bagging_temperature': 9.357701256237428}. Best is trial 98 with value: 0.8791208791208791.
[32m[I 2023-04-21 01:47:23,618][39m Trial 672 finished with value: 0.8409090909090909 and parameters: {'objective': 'CrossEntropy', 'colsample_bylevel': 0.08627262874720273, 'depth': 2, 'boosting_type': 'Plain', 'bootstrap_type': 'Bayesian', 'bagging_temperature': 9.996754882416889}. Best is trial 98 with value: 0.8791208791208791.
[32m[I 2023-04-21 01:47:24,619][39m Trial 673 finished with value: 0.8666666666666666 and parameters: {'objective': 'CrossEntropy', 'colsample_bylevel': 0.061891159359677914, 'depth': 3, 'boosting_type': 'Plain', 'bootstrap_type': 'Bayesian', 'bagging_temperature': 8.574407762257241}. Best is trial 98 with value: 0.8791208791208791.
[32m[I 2023-04-21 01:47:25,459][39m Trial 674 finished with value: 0.8089887640449439 and parameters: {'objective': 'CrossEntropy', 'colsample_bylevel': 0.057178380895811995, 'depth': 2, 'boosting_type': 'Plain', 'bootstrap_type': 'Bernoulli', 'subsample': 0.7007952545445412}. Best is trial 98 with value: 0.8791208791208791.
[32m[I 2023-04-21 01:47:26,169][39m Trial 675 finished with value: 0.8666666666666666 and parameters: {'objective': 'CrossEntropy', 'colsample_bylevel': 0.08496566991216134, 'depth': 3, 'boosting_type': 'Plain', 'bootstrap_type': 'Bayesian', 'bagging_temperature': 9.269699468457858}. Best is trial 98 with value: 0.8791208791208791.
[32m[I 2023-04-21 01:47:26,998][39m Trial 676 finished with value: 0.8666666666666666 and parameters: {'objective': 'CrossEntropy', 'colsample_bylevel': 0.08564503113782906, 'depth': 2, 'boosting_type': 'Plain', 'bootstrap_type': 'Bayesian', 'bagging_temperature': 9.59603823132884}. Best is trial 98 with value: 0.8791208791208791.
[32m[I 2023-04-21 01:47:27,975][39m Trial 677 finished with value: 0.8539325842696629 and parameters: {'objective': 'Logloss', 'colsample_bylevel': 0.082253724440139, 'depth': 2, 'boosting_type': 'Plain', 'bootstrap_type': 'Bayesian', 'bagging_temperature': 7.955992701710139}. Best is trial 98 with value: 0.8791208791208791.
[32m[I 2023-04-21 01:47:28,776][39m Trial 678 finished with value: 0.8 and parameters: {'objective': 'Logloss', 'colsample_bylevel': 0.0920885604356986, 'depth': 1, 'boosting_type': 'Plain', 'bootstrap_type': 'MVS'}. Best is trial 98 with value: 0.8791208791208791.
[32m[I 2023-04-21 01:47:33,564][39m Trial 679 finished with value: 0.8139534883720929 and parameters: {'objective': 'CrossEntropy', 'colsample_bylevel': 0.07694361703572762, 'depth': 4, 'boosting_type': 'Ordered', 'bootstrap_type': 'Bayesian', 'bagging_temperature': 7.887232359601596}. Best is trial 98 with value: 0.8791208791208791.
[32m[I 2023-04-21 01:47:34,444][39m Trial 680 finished with value: 0.8666666666666666 and parameters: {'objective': 'CrossEntropy', 'colsample_bylevel': 0.08582500038743092, 'depth': 3, 'boosting_type': 'Plain', 'bootstrap_type': 'Bayesian', 'bagging_temperature': 8.83327513856662}. Best is trial 98 with value: 0.8791208791208791.
[32m[I 2023-04-21 01:47:35,351][39m Trial 681 finished with value: 0.8539325842696629 and parameters: {'objective': 'CrossEntropy', 'colsample_bylevel': 0.09492301929006529, 'depth': 2, 'boosting_type': 'Plain', 'bootstrap_type': 'Bayesian', 'bagging_temperature': 9.078630926308843}. Best is trial 98 with value: 0.8791208791208791.
[32m[I 2023-04-21 01:47:36,211][39m Trial 682 finished with value: 0.8409090909090909 and parameters: {'objective': 'CrossEntropy', 'colsample_bylevel': 0.09376331722872722, 'depth': 2, 'boosting_type': 'Plain', 'bootstrap_type': 'Bayesian', 'bagging_temperature': 9.024073888067326}. Best is trial 98 with value: 0.8791208791208791.
[32m[I 2023-04-21 01:47:37,019][39m Trial 683 finished with value: 0.8275862068965518 and parameters: {'objective': 'CrossEntropy', 'colsample_bylevel': 0.06270986005912234, 'depth': 3, 'boosting_type': 'Plain', 'bootstrap_type': 'Bayesian', 'bagging_temperature': 9.554458563508534}. Best is trial 98 with value: 0.8791208791208791.
[32m[I 2023-04-21 01:47:37,573][39m Trial 684 finished with value: 0.8539325842696629 and parameters: {'objective': 'CrossEntropy', 'colsample_bylevel': 0.08187829912028516, 'depth': 2, 'boosting_type': 'Plain', 'bootstrap_type': 'Bayesian', 'bagging_temperature': 8.196242287814934}. Best is trial 98 with value: 0.8791208791208791.
[32m[I 2023-04-21 01:47:38,352][39m Trial 685 finished with value: 0.8409090909090909 and parameters: {'objective': 'CrossEntropy', 'colsample_bylevel': 0.08430505560536145, 'depth': 2, 'boosting_type': 'Plain', 'bootstrap_type': 'Bayesian', 'bagging_temperature': 9.722918848062646}. Best is trial 98 with value: 0.8791208791208791.
[32m[I 2023-04-21 01:47:39,189][39m Trial 686 finished with value: 0.8666666666666666 and parameters: {'objective': 'CrossEntropy', 'colsample_bylevel': 0.0879660183521201, 'depth': 2, 'boosting_type': 'Plain', 'bootstrap_type': 'Bayesian', 'bagging_temperature': 9.393724834089841}. Best is trial 98 with value: 0.8791208791208791.
[32m[I 2023-04-21 01:47:40,190][39m Trial 687 finished with value: 0.7999999999999999 and parameters: {'objective': 'Logloss', 'colsample_bylevel': 0.08413652665077674, 'depth': 1, 'boosting_type': 'Plain', 'bootstrap_type': 'Bayesian', 'bagging_temperature': 9.16160630010293}. Best is trial 98 with value: 0.8791208791208791.
[32m[I 2023-04-21 01:47:40,799][39m Trial 688 finished with value: 0.8505747126436782 and parameters: {'objective': 'Logloss', 'colsample_bylevel': 0.08531939195159657, 'depth': 2, 'boosting_type': 'Plain', 'bootstrap_type': 'Bayesian', 'bagging_temperature': 9.176945336468107}. Best is trial 98 with value: 0.8791208791208791.
[32m[I 2023-04-21 01:47:41,922][39m Trial 689 finished with value: 0.8764044943820225 and parameters: {'objective': 'CrossEntropy', 'colsample_bylevel': 0.08833139878307372, 'depth': 2, 'boosting_type': 'Plain', 'bootstrap_type': 'Bayesian', 'bagging_temperature': 8.601759905400261}. Best is trial 98 with value: 0.8791208791208791.
[32m[I 2023-04-21 01:47:42,769][39m Trial 690 finished with value: 0.8275862068965518 and parameters: {'objective': 'CrossEntropy', 'colsample_bylevel': 0.08765134080978663, 'depth': 2, 'boosting_type': 'Plain', 'bootstrap_type': 'Bayesian', 'bagging_temperature': 8.86538840865327}. Best is trial 98 with value: 0.8791208791208791.
[32m[I 2023-04-21 01:47:43,467][39m Trial 691 finished with value: 0.8666666666666666 and parameters: {'objective': 'CrossEntropy', 'colsample_bylevel': 0.09116004184924932, 'depth': 3, 'boosting_type': 'Plain', 'bootstrap_type': 'Bayesian', 'bagging_temperature': 8.783733867474933}. Best is trial 98 with value: 0.8791208791208791.
[32m[I 2023-04-21 01:47:44,193][39m Trial 692 finished with value: 0.8372093023255814 and parameters: {'objective': 'CrossEntropy', 'colsample_bylevel': 0.07625337501606075, 'depth': 5, 'boosting_type': 'Plain', 'bootstrap_type': 'Bayesian', 'bagging_temperature': 9.788026396393379}. Best is trial 98 with value: 0.8791208791208791.
[32m[I 2023-04-21 01:47:45,034][39m Trial 693 finished with value: 0.8636363636363636 and parameters: {'objective': 'CrossEntropy', 'colsample_bylevel': 0.08665451531168719, 'depth': 1, 'boosting_type': 'Plain', 'bootstrap_type': 'Bayesian', 'bagging_temperature': 9.597675408357095}. Best is trial 98 with value: 0.8791208791208791.
[32m[I 2023-04-21 01:47:45,947][39m Trial 694 finished with value: 0.8372093023255814 and parameters: {'objective': 'CrossEntropy', 'colsample_bylevel': 0.08050433129479244, 'depth': 2, 'boosting_type': 'Plain', 'bootstrap_type': 'Bayesian', 'bagging_temperature': 8.71585691860266}. Best is trial 98 with value: 0.8791208791208791.
[32m[I 2023-04-21 01:47:46,581][39m Trial 695 finished with value: 0.8409090909090909 and parameters: {'objective': 'CrossEntropy', 'colsample_bylevel': 0.09017643719966925, 'depth': 2, 'boosting_type': 'Plain', 'bootstrap_type': 'Bernoulli', 'subsample': 0.5262483866506257}. Best is trial 98 with value: 0.8791208791208791.
[32m[I 2023-04-21 01:47:47,380][39m Trial 696 finished with value: 0.8666666666666666 and parameters: {'objective': 'CrossEntropy', 'colsample_bylevel': 0.08827140267909467, 'depth': 2, 'boosting_type': 'Plain', 'bootstrap_type': 'Bayesian', 'bagging_temperature': 8.871107664019991}. Best is trial 98 with value: 0.8791208791208791.
[32m[I 2023-04-21 01:47:48,159][39m Trial 697 finished with value: 0.8539325842696629 and parameters: {'objective': 'CrossEntropy', 'colsample_bylevel': 0.07944289881794142, 'depth': 2, 'boosting_type': 'Plain', 'bootstrap_type': 'Bayesian', 'bagging_temperature': 8.903993150557254}. Best is trial 98 with value: 0.8791208791208791.
[32m[I 2023-04-21 01:47:53,045][39m Trial 698 finished with value: 0.8539325842696629 and parameters: {'objective': 'CrossEntropy', 'colsample_bylevel': 0.07970898671765998, 'depth': 3, 'boosting_type': 'Ordered', 'bootstrap_type': 'Bayesian', 'bagging_temperature': 9.403845801397773}. Best is trial 98 with value: 0.8791208791208791.
[32m[I 2023-04-21 01:47:53,955][39m Trial 699 finished with value: 0.8636363636363636 and parameters: {'objective': 'CrossEntropy', 'colsample_bylevel': 0.08146017121270677, 'depth': 2, 'boosting_type': 'Plain', 'bootstrap_type': 'Bayesian', 'bagging_temperature': 8.604392724700114}. Best is trial 98 with value: 0.8791208791208791.
[32m[I 2023-04-21 01:47:54,692][39m Trial 700 finished with value: 0.8222222222222222 and parameters: {'objective': 'Logloss', 'colsample_bylevel': 0.0834518532431139, 'depth': 1, 'boosting_type': 'Plain', 'bootstrap_type': 'Bayesian', 'bagging_temperature': 9.038799418588763}. Best is trial 98 with value: 0.8791208791208791.
[32m[I 2023-04-21 01:47:55,516][39m Trial 701 finished with value: 0.8275862068965518 and parameters: {'objective': 'Logloss', 'colsample_bylevel': 0.08601141053046968, 'depth': 2, 'boosting_type': 'Plain', 'bootstrap_type': 'MVS'}. Best is trial 98 with value: 0.8791208791208791.
[32m[I 2023-04-21 01:47:56,488][39m Trial 702 finished with value: 0.8764044943820225 and parameters: {'objective': 'CrossEntropy', 'colsample_bylevel': 0.08746981826541282, 'depth': 2, 'boosting_type': 'Plain', 'bootstrap_type': 'Bayesian', 'bagging_temperature': 9.256144266967988}. Best is trial 98 with value: 0.8791208791208791.
[32m[I 2023-04-21 01:47:57,382][39m Trial 703 finished with value: 0.8539325842696629 and parameters: {'objective': 'CrossEntropy', 'colsample_bylevel': 0.09016147478041615, 'depth': 3, 'boosting_type': 'Plain', 'bootstrap_type': 'Bayesian', 'bagging_temperature': 9.390695936079647}. Best is trial 98 with value: 0.8791208791208791.
[32m[I 2023-04-21 01:47:57,947][39m Trial 704 finished with value: 0.8139534883720929 and parameters: {'objective': 'CrossEntropy', 'colsample_bylevel': 0.04528034723701873, 'depth': 2, 'boosting_type': 'Plain', 'bootstrap_type': 'Bayesian', 'bagging_temperature': 9.05766288655145}. Best is trial 98 with value: 0.8791208791208791.
[32m[I 2023-04-21 01:47:58,763][39m Trial 705 finished with value: 0.8539325842696629 and parameters: {'objective': 'CrossEntropy', 'colsample_bylevel': 0.08474357173410661, 'depth': 2, 'boosting_type': 'Plain', 'bootstrap_type': 'Bayesian', 'bagging_temperature': 6.308772727521}. Best is trial 98 with value: 0.8791208791208791.
[32m[I 2023-04-21 01:47:59,569][39m Trial 706 finished with value: 0.8636363636363636 and parameters: {'objective': 'CrossEntropy', 'colsample_bylevel': 0.07214984214791136, 'depth': 2, 'boosting_type': 'Plain', 'bootstrap_type': 'Bayesian', 'bagging_temperature': 9.056708252783991}. Best is trial 98 with value: 0.8791208791208791.
[32m[I 2023-04-21 01:48:00,578][39m Trial 707 finished with value: 0.8666666666666666 and parameters: {'objective': 'CrossEntropy', 'colsample_bylevel': 0.07943119957206987, 'depth': 3, 'boosting_type': 'Plain', 'bootstrap_type': 'Bayesian', 'bagging_temperature': 9.42703469083915}. Best is trial 98 with value: 0.8791208791208791.
[32m[I 2023-04-21 01:48:01,349][39m Trial 708 finished with value: 0.8666666666666666 and parameters: {'objective': 'CrossEntropy', 'colsample_bylevel': 0.08094858062326439, 'depth': 3, 'boosting_type': 'Plain', 'bootstrap_type': 'Bayesian', 'bagging_temperature': 9.251199859625528}. Best is trial 98 with value: 0.8791208791208791.
[32m[I 2023-04-21 01:48:02,204][39m Trial 709 finished with value: 0.8275862068965518 and parameters: {'objective': 'Logloss', 'colsample_bylevel': 0.07045063368368165, 'depth': 2, 'boosting_type': 'Plain', 'bootstrap_type': 'Bayesian', 'bagging_temperature': 9.822718404857113}. Best is trial 98 with value: 0.8791208791208791.
[32m[I 2023-04-21 01:48:03,011][39m Trial 710 finished with value: 0.8539325842696629 and parameters: {'objective': 'CrossEntropy', 'colsample_bylevel': 0.09410373441194798, 'depth': 2, 'boosting_type': 'Plain', 'bootstrap_type': 'Bayesian', 'bagging_temperature': 9.640006107998575}. Best is trial 98 with value: 0.8791208791208791.
[32m[I 2023-04-21 01:48:03,849][39m Trial 711 finished with value: 0.8636363636363636 and parameters: {'objective': 'CrossEntropy', 'colsample_bylevel': 0.0877215517533764, 'depth': 2, 'boosting_type': 'Plain', 'bootstrap_type': 'Bayesian', 'bagging_temperature': 9.11886900385469}. Best is trial 98 with value: 0.8791208791208791.
[32m[I 2023-04-21 01:48:04,613][39m Trial 712 finished with value: 0.8275862068965518 and parameters: {'objective': 'Logloss', 'colsample_bylevel': 0.05665828147373862, 'depth': 8, 'boosting_type': 'Plain', 'bootstrap_type': 'Bayesian', 'bagging_temperature': 8.98045102383043}. Best is trial 98 with value: 0.8791208791208791.
[32m[I 2023-04-21 01:48:05,773][39m Trial 713 finished with value: 0.8539325842696629 and parameters: {'objective': 'CrossEntropy', 'colsample_bylevel': 0.08588820025373918, 'depth': 2, 'boosting_type': 'Plain', 'bootstrap_type': 'Bayesian', 'bagging_temperature': 9.740723713676841}. Best is trial 98 with value: 0.8791208791208791.
[32m[I 2023-04-21 01:48:06,746][39m Trial 714 finished with value: 0.8539325842696629 and parameters: {'objective': 'CrossEntropy', 'colsample_bylevel': 0.08516153820574135, 'depth': 1, 'boosting_type': 'Plain', 'bootstrap_type': 'Bayesian', 'bagging_temperature': 9.248701880714432}. Best is trial 98 with value: 0.8791208791208791.
[32m[I 2023-04-21 01:48:07,308][39m Trial 715 finished with value: 0.7674418604651163 and parameters: {'objective': 'Logloss', 'colsample_bylevel': 0.010052081101764802, 'depth': 2, 'boosting_type': 'Plain', 'bootstrap_type': 'Bayesian', 'bagging_temperature': 9.275976671059254}. Best is trial 98 with value: 0.8791208791208791.
[32m[I 2023-04-21 01:48:08,071][39m Trial 716 finished with value: 0.8409090909090909 and parameters: {'objective': 'Logloss', 'colsample_bylevel': 0.08841148347114372, 'depth': 2, 'boosting_type': 'Plain', 'bootstrap_type': 'Bayesian', 'bagging_temperature': 8.962955096522974}. Best is trial 98 with value: 0.8791208791208791.
[32m[I 2023-04-21 01:48:08,861][39m Trial 717 finished with value: 0.8409090909090909 and parameters: {'objective': 'CrossEntropy', 'colsample_bylevel': 0.09756152105604496, 'depth': 3, 'boosting_type': 'Plain', 'bootstrap_type': 'Bayesian', 'bagging_temperature': 9.248498234448556}. Best is trial 98 with value: 0.8791208791208791.
[32m[I 2023-04-21 01:48:13,623][39m Trial 718 finished with value: 0.8409090909090909 and parameters: {'objective': 'CrossEntropy', 'colsample_bylevel': 0.06814176185024473, 'depth': 4, 'boosting_type': 'Ordered', 'bootstrap_type': 'Bayesian', 'bagging_temperature': 9.865664349992226}. Best is trial 98 with value: 0.8791208791208791.
[32m[I 2023-04-21 01:48:14,470][39m Trial 719 finished with value: 0.8505747126436782 and parameters: {'objective': 'CrossEntropy', 'colsample_bylevel': 0.0895167797379562, 'depth': 2, 'boosting_type': 'Plain', 'bootstrap_type': 'Bayesian', 'bagging_temperature': 1.2334533367306646}. Best is trial 98 with value: 0.8791208791208791.
[32m[I 2023-04-21 01:48:15,208][39m Trial 720 finished with value: 0.8275862068965518 and parameters: {'objective': 'Logloss', 'colsample_bylevel': 0.05861919547664562, 'depth': 2, 'boosting_type': 'Plain', 'bootstrap_type': 'Bernoulli', 'subsample': 0.17050337141540683}. Best is trial 98 with value: 0.8791208791208791.
[32m[I 2023-04-21 01:48:15,962][39m Trial 721 finished with value: 0.8192771084337348 and parameters: {'objective': 'CrossEntropy', 'colsample_bylevel': 0.0923753298949566, 'depth': 1, 'boosting_type': 'Plain', 'bootstrap_type': 'Bayesian', 'bagging_temperature': 9.560305425204431}. Best is trial 98 with value: 0.8791208791208791.
[32m[I 2023-04-21 01:48:16,682][39m Trial 722 finished with value: 0.761904761904762 and parameters: {'objective': 'CrossEntropy', 'colsample_bylevel': 0.014418147715559222, 'depth': 9, 'boosting_type': 'Plain', 'bootstrap_type': 'Bayesian', 'bagging_temperature': 8.835229559772287}. Best is trial 98 with value: 0.8791208791208791.
[32m[I 2023-04-21 01:48:17,636][39m Trial 723 finished with value: 0.8275862068965518 and parameters: {'objective': 'CrossEntropy', 'colsample_bylevel': 0.07939535659697175, 'depth': 2, 'boosting_type': 'Plain', 'bootstrap_type': 'MVS'}. Best is trial 98 with value: 0.8791208791208791.
[32m[I 2023-04-21 01:48:18,359][39m Trial 724 finished with value: 0.8539325842696629 and parameters: {'objective': 'CrossEntropy', 'colsample_bylevel': 0.08295719428497941, 'depth': 2, 'boosting_type': 'Plain', 'bootstrap_type': 'Bayesian', 'bagging_temperature': 9.779420711542084}. Best is trial 98 with value: 0.8791208791208791.
[32m[I 2023-04-21 01:48:19,347][39m Trial 725 finished with value: 0.8666666666666666 and parameters: {'objective': 'CrossEntropy', 'colsample_bylevel': 0.09127032043366051, 'depth': 3, 'boosting_type': 'Plain', 'bootstrap_type': 'Bayesian', 'bagging_temperature': 9.47096870372888}. Best is trial 98 with value: 0.8791208791208791.
[32m[I 2023-04-21 01:48:20,315][39m Trial 726 finished with value: 0.8409090909090909 and parameters: {'objective': 'CrossEntropy', 'colsample_bylevel': 0.08870293892019013, 'depth': 2, 'boosting_type': 'Plain', 'bootstrap_type': 'Bayesian', 'bagging_temperature': 9.938457568038782}. Best is trial 98 with value: 0.8791208791208791.
[32m[I 2023-04-21 01:48:21,199][39m Trial 727 finished with value: 0.8636363636363636 and parameters: {'objective': 'Logloss', 'colsample_bylevel': 0.0847317910128359, 'depth': 2, 'boosting_type': 'Plain', 'bootstrap_type': 'Bayesian', 'bagging_temperature': 8.768324560084016}. Best is trial 98 with value: 0.8791208791208791.
