[32m[I 2023-04-21 03:27:59,909][39m Trial 5785 finished with value: 0.8505747126436782 and parameters: {'objective': 'CrossEntropy', 'colsample_bylevel': 0.0730674714418377, 'depth': 11, 'boosting_type': 'Plain', 'bootstrap_type': 'Bayesian', 'bagging_temperature': 9.61830666004742}. Best is trial 3065 with value: 0.8863636363636364.
[32m[I 2023-04-21 03:28:01,332][39m Trial 5786 finished with value: 0.8409090909090909 and parameters: {'objective': 'CrossEntropy', 'colsample_bylevel': 0.0888482547361505, 'depth': 6, 'boosting_type': 'Plain', 'bootstrap_type': 'Bayesian', 'bagging_temperature': 9.256793286396894}. Best is trial 3065 with value: 0.8863636363636364.
[32m[I 2023-04-21 03:28:02,500][39m Trial 5787 finished with value: 0.8444444444444446 and parameters: {'objective': 'CrossEntropy', 'colsample_bylevel': 0.07075558796396549, 'depth': 10, 'boosting_type': 'Plain', 'bootstrap_type': 'Bernoulli', 'subsample': 0.18197282013148486}. Best is trial 3065 with value: 0.8863636363636364.
[32m[I 2023-04-21 03:28:03,350][39m Trial 5788 finished with value: 0.8409090909090909 and parameters: {'objective': 'Logloss', 'colsample_bylevel': 0.07255318521648829, 'depth': 10, 'boosting_type': 'Plain', 'bootstrap_type': 'Bernoulli', 'subsample': 0.3624834054099736}. Best is trial 3065 with value: 0.8863636363636364.
[32m[I 2023-04-21 03:28:04,225][39m Trial 5789 finished with value: 0.8791208791208791 and parameters: {'objective': 'CrossEntropy', 'colsample_bylevel': 0.07930920431107658, 'depth': 10, 'boosting_type': 'Plain', 'bootstrap_type': 'Bayesian', 'bagging_temperature': 8.289249847856807}. Best is trial 3065 with value: 0.8863636363636364.
[32m[I 2023-04-21 03:28:05,029][39m Trial 5790 finished with value: 0.8666666666666666 and parameters: {'objective': 'CrossEntropy', 'colsample_bylevel': 0.08804676216452241, 'depth': 3, 'boosting_type': 'Plain', 'bootstrap_type': 'Bayesian', 'bagging_temperature': 9.627728752668208}. Best is trial 3065 with value: 0.8863636363636364.
[32m[I 2023-04-21 03:28:06,253][39m Trial 5791 finished with value: 0.8539325842696629 and parameters: {'objective': 'CrossEntropy', 'colsample_bylevel': 0.06463759857117453, 'depth': 9, 'boosting_type': 'Plain', 'bootstrap_type': 'MVS'}. Best is trial 3065 with value: 0.8863636363636364.
[32m[I 2023-04-21 03:28:07,708][39m Trial 5792 finished with value: 0.8539325842696629 and parameters: {'objective': 'CrossEntropy', 'colsample_bylevel': 0.08206430829235002, 'depth': 3, 'boosting_type': 'Plain', 'bootstrap_type': 'Bayesian', 'bagging_temperature': 9.004734325675875}. Best is trial 3065 with value: 0.8863636363636364.
[32m[I 2023-04-21 03:28:08,504][39m Trial 5793 finished with value: 0.8791208791208791 and parameters: {'objective': 'CrossEntropy', 'colsample_bylevel': 0.08420795932203075, 'depth': 3, 'boosting_type': 'Plain', 'bootstrap_type': 'Bayesian', 'bagging_temperature': 9.143837644597467}. Best is trial 3065 with value: 0.8863636363636364.
[32m[I 2023-04-21 03:28:09,331][39m Trial 5794 finished with value: 0.8409090909090909 and parameters: {'objective': 'CrossEntropy', 'colsample_bylevel': 0.08715624682495667, 'depth': 9, 'boosting_type': 'Plain', 'bootstrap_type': 'Bayesian', 'bagging_temperature': 9.38578318501908}. Best is trial 3065 with value: 0.8863636363636364.
[32m[I 2023-04-21 03:28:10,340][39m Trial 5795 finished with value: 0.8666666666666666 and parameters: {'objective': 'CrossEntropy', 'colsample_bylevel': 0.05869071489287519, 'depth': 9, 'boosting_type': 'Plain', 'bootstrap_type': 'Bayesian', 'bagging_temperature': 8.996627489452514}. Best is trial 3065 with value: 0.8863636363636364.
[32m[I 2023-04-21 03:28:11,461][39m Trial 5796 finished with value: 0.8539325842696629 and parameters: {'objective': 'CrossEntropy', 'colsample_bylevel': 0.06457261830393897, 'depth': 9, 'boosting_type': 'Plain', 'bootstrap_type': 'Bayesian', 'bagging_temperature': 9.811703583725505}. Best is trial 3065 with value: 0.8863636363636364.
[32m[I 2023-04-21 03:28:12,612][39m Trial 5797 finished with value: 0.8444444444444446 and parameters: {'objective': 'CrossEntropy', 'colsample_bylevel': 0.09169978626654722, 'depth': 2, 'boosting_type': 'Plain', 'bootstrap_type': 'MVS'}. Best is trial 3065 with value: 0.8863636363636364.
[32m[I 2023-04-21 03:28:14,031][39m Trial 5798 finished with value: 0.8539325842696629 and parameters: {'objective': 'CrossEntropy', 'colsample_bylevel': 0.08743373539226117, 'depth': 3, 'boosting_type': 'Plain', 'bootstrap_type': 'Bayesian', 'bagging_temperature': 9.800089500893508}. Best is trial 3065 with value: 0.8863636363636364.
[32m[I 2023-04-21 03:28:14,798][39m Trial 5799 finished with value: 0.8275862068965518 and parameters: {'objective': 'Logloss', 'colsample_bylevel': 0.09058042464399328, 'depth': 10, 'boosting_type': 'Plain', 'bootstrap_type': 'Bayesian', 'bagging_temperature': 3.3138900431663236}. Best is trial 3065 with value: 0.8863636363636364.
[32m[I 2023-04-21 03:28:15,751][39m Trial 5800 finished with value: 0.8539325842696629 and parameters: {'objective': 'CrossEntropy', 'colsample_bylevel': 0.08375299791526754, 'depth': 3, 'boosting_type': 'Plain', 'bootstrap_type': 'Bayesian', 'bagging_temperature': 9.190186820183401}. Best is trial 3065 with value: 0.8863636363636364.
[32m[I 2023-04-21 03:28:17,176][39m Trial 5801 finished with value: 0.8372093023255814 and parameters: {'objective': 'CrossEntropy', 'colsample_bylevel': 0.08717824582237559, 'depth': 12, 'boosting_type': 'Plain', 'bootstrap_type': 'Bayesian', 'bagging_temperature': 9.6548198148497}. Best is trial 3065 with value: 0.8863636363636364.
[32m[I 2023-04-21 03:28:22,106][39m Trial 5802 finished with value: 0.8314606741573034 and parameters: {'objective': 'CrossEntropy', 'colsample_bylevel': 0.0945773114878755, 'depth': 3, 'boosting_type': 'Ordered', 'bootstrap_type': 'MVS'}. Best is trial 3065 with value: 0.8863636363636364.
[32m[I 2023-04-21 03:28:23,412][39m Trial 5803 finished with value: 0.8275862068965518 and parameters: {'objective': 'Logloss', 'colsample_bylevel': 0.0733607240686889, 'depth': 3, 'boosting_type': 'Plain', 'bootstrap_type': 'Bayesian', 'bagging_temperature': 8.63378407792971}. Best is trial 3065 with value: 0.8863636363636364.
[32m[I 2023-04-21 03:28:24,376][39m Trial 5804 finished with value: 0.8666666666666666 and parameters: {'objective': 'CrossEntropy', 'colsample_bylevel': 0.08483421390929201, 'depth': 3, 'boosting_type': 'Plain', 'bootstrap_type': 'Bayesian', 'bagging_temperature': 9.262679989433254}. Best is trial 3065 with value: 0.8863636363636364.
[32m[I 2023-04-21 03:28:25,083][39m Trial 5805 finished with value: 0.8666666666666666 and parameters: {'objective': 'CrossEntropy', 'colsample_bylevel': 0.07388197133073887, 'depth': 10, 'boosting_type': 'Plain', 'bootstrap_type': 'Bayesian', 'bagging_temperature': 9.578495361062647}. Best is trial 3065 with value: 0.8863636363636364.
[32m[I 2023-04-21 03:28:26,326][39m Trial 5806 finished with value: 0.8314606741573034 and parameters: {'objective': 'CrossEntropy', 'colsample_bylevel': 0.06678253558609311, 'depth': 9, 'boosting_type': 'Plain', 'bootstrap_type': 'Bernoulli', 'subsample': 0.3998771216667274}. Best is trial 3065 with value: 0.8863636363636364.
[32m[I 2023-04-21 03:28:27,484][39m Trial 5807 finished with value: 0.8409090909090909 and parameters: {'objective': 'Logloss', 'colsample_bylevel': 0.099071122581644, 'depth': 12, 'boosting_type': 'Plain', 'bootstrap_type': 'Bayesian', 'bagging_temperature': 9.740639031909845}. Best is trial 3065 with value: 0.8863636363636364.
[32m[I 2023-04-21 03:28:28,512][39m Trial 5808 finished with value: 0.8539325842696629 and parameters: {'objective': 'CrossEntropy', 'colsample_bylevel': 0.07008892968313163, 'depth': 2, 'boosting_type': 'Plain', 'bootstrap_type': 'Bayesian', 'bagging_temperature': 9.996996846733376}. Best is trial 3065 with value: 0.8863636363636364.
[32m[I 2023-04-21 03:28:29,372][39m Trial 5809 finished with value: 0.8314606741573034 and parameters: {'objective': 'CrossEntropy', 'colsample_bylevel': 0.09395244856243833, 'depth': 3, 'boosting_type': 'Plain', 'bootstrap_type': 'Bayesian', 'bagging_temperature': 9.86343144821947}. Best is trial 3065 with value: 0.8863636363636364.
[32m[I 2023-04-21 03:28:30,412][39m Trial 5810 finished with value: 0.8275862068965518 and parameters: {'objective': 'CrossEntropy', 'colsample_bylevel': 0.08680224852342616, 'depth': 1, 'boosting_type': 'Plain', 'bootstrap_type': 'Bayesian', 'bagging_temperature': 8.762161012512852}. Best is trial 3065 with value: 0.8863636363636364.
[32m[I 2023-04-21 03:28:32,052][39m Trial 5811 finished with value: 0.8505747126436782 and parameters: {'objective': 'CrossEntropy', 'colsample_bylevel': 0.0751239229132758, 'depth': 9, 'boosting_type': 'Plain', 'bootstrap_type': 'Bayesian', 'bagging_temperature': 9.84703375835712}. Best is trial 3065 with value: 0.8863636363636364.
[32m[I 2023-04-21 03:28:33,074][39m Trial 5812 finished with value: 0.8409090909090909 and parameters: {'objective': 'Logloss', 'colsample_bylevel': 0.07227907561184345, 'depth': 5, 'boosting_type': 'Plain', 'bootstrap_type': 'Bayesian', 'bagging_temperature': 6.012728945447471}. Best is trial 3065 with value: 0.8863636363636364.
[32m[I 2023-04-21 03:28:33,820][39m Trial 5813 finished with value: 0.8539325842696629 and parameters: {'objective': 'CrossEntropy', 'colsample_bylevel': 0.06722440071214156, 'depth': 11, 'boosting_type': 'Plain', 'bootstrap_type': 'Bayesian', 'bagging_temperature': 9.80975574863427}. Best is trial 3065 with value: 0.8863636363636364.
[32m[I 2023-04-21 03:28:34,654][39m Trial 5814 finished with value: 0.8222222222222222 and parameters: {'objective': 'CrossEntropy', 'colsample_bylevel': 0.0571188267198166, 'depth': 3, 'boosting_type': 'Plain', 'bootstrap_type': 'Bernoulli', 'subsample': 0.9848772881468432}. Best is trial 3065 with value: 0.8863636363636364.
[32m[I 2023-04-21 03:28:36,013][39m Trial 5815 finished with value: 0.8636363636363636 and parameters: {'objective': 'CrossEntropy', 'colsample_bylevel': 0.08895431611895024, 'depth': 11, 'boosting_type': 'Plain', 'bootstrap_type': 'Bayesian', 'bagging_temperature': 9.433751772469911}. Best is trial 3065 with value: 0.8863636363636364.
[32m[I 2023-04-21 03:28:37,093][39m Trial 5816 finished with value: 0.8666666666666666 and parameters: {'objective': 'Logloss', 'colsample_bylevel': 0.09161758440531531, 'depth': 3, 'boosting_type': 'Plain', 'bootstrap_type': 'Bayesian', 'bagging_temperature': 9.794216155620372}. Best is trial 3065 with value: 0.8863636363636364.
[32m[I 2023-04-21 03:28:38,503][39m Trial 5817 finished with value: 0.8666666666666666 and parameters: {'objective': 'CrossEntropy', 'colsample_bylevel': 0.08145149620275026, 'depth': 3, 'boosting_type': 'Plain', 'bootstrap_type': 'Bayesian', 'bagging_temperature': 6.307029795701955}. Best is trial 3065 with value: 0.8863636363636364.
[32m[I 2023-04-21 03:28:39,313][39m Trial 5818 finished with value: 0.8791208791208791 and parameters: {'objective': 'Logloss', 'colsample_bylevel': 0.07046672297811268, 'depth': 7, 'boosting_type': 'Plain', 'bootstrap_type': 'Bayesian', 'bagging_temperature': 9.40689463654596}. Best is trial 3065 with value: 0.8863636363636364.
[32m[I 2023-04-21 03:28:40,067][39m Trial 5819 finished with value: 0.8409090909090909 and parameters: {'objective': 'Logloss', 'colsample_bylevel': 0.08287190252884664, 'depth': 3, 'boosting_type': 'Plain', 'bootstrap_type': 'Bayesian', 'bagging_temperature': 8.756253498796255}. Best is trial 3065 with value: 0.8863636363636364.
[32m[I 2023-04-21 03:28:41,199][39m Trial 5820 finished with value: 0.8275862068965518 and parameters: {'objective': 'CrossEntropy', 'colsample_bylevel': 0.036698058474208275, 'depth': 12, 'boosting_type': 'Plain', 'bootstrap_type': 'Bayesian', 'bagging_temperature': 3.8188909936698243}. Best is trial 3065 with value: 0.8863636363636364.
[32m[I 2023-04-21 03:28:42,457][39m Trial 5821 finished with value: 0.8275862068965518 and parameters: {'objective': 'CrossEntropy', 'colsample_bylevel': 0.0790324020309482, 'depth': 3, 'boosting_type': 'Plain', 'bootstrap_type': 'Bayesian', 'bagging_temperature': 9.710628473418549}. Best is trial 3065 with value: 0.8863636363636364.
[32m[I 2023-04-21 03:28:43,257][39m Trial 5822 finished with value: 0.8409090909090909 and parameters: {'objective': 'CrossEntropy', 'colsample_bylevel': 0.07706041752777315, 'depth': 3, 'boosting_type': 'Plain', 'bootstrap_type': 'MVS'}. Best is trial 3065 with value: 0.8863636363636364.
[32m[I 2023-04-21 03:28:44,379][39m Trial 5823 finished with value: 0.8275862068965518 and parameters: {'objective': 'CrossEntropy', 'colsample_bylevel': 0.07901080882481215, 'depth': 3, 'boosting_type': 'Plain', 'bootstrap_type': 'Bayesian', 'bagging_temperature': 4.917966317088449}. Best is trial 3065 with value: 0.8863636363636364.
[32m[I 2023-04-21 03:28:45,412][39m Trial 5824 finished with value: 0.8735632183908046 and parameters: {'objective': 'CrossEntropy', 'colsample_bylevel': 0.06577165113988528, 'depth': 2, 'boosting_type': 'Plain', 'bootstrap_type': 'Bayesian', 'bagging_temperature': 9.518504078200595}. Best is trial 3065 with value: 0.8863636363636364.
[32m[I 2023-04-21 03:28:50,411][39m Trial 5825 finished with value: 0.8409090909090909 and parameters: {'objective': 'CrossEntropy', 'colsample_bylevel': 0.07417528818048244, 'depth': 8, 'boosting_type': 'Ordered', 'bootstrap_type': 'Bayesian', 'bagging_temperature': 8.726440925618503}. Best is trial 3065 with value: 0.8863636363636364.
[32m[I 2023-04-21 03:28:51,544][39m Trial 5826 finished with value: 0.8539325842696629 and parameters: {'objective': 'CrossEntropy', 'colsample_bylevel': 0.06944458875523755, 'depth': 8, 'boosting_type': 'Plain', 'bootstrap_type': 'Bayesian', 'bagging_temperature': 8.783527358206227}. Best is trial 3065 with value: 0.8863636363636364.
[32m[I 2023-04-21 03:28:52,717][39m Trial 5827 finished with value: 0.8409090909090909 and parameters: {'objective': 'Logloss', 'colsample_bylevel': 0.07716175139955984, 'depth': 10, 'boosting_type': 'Plain', 'bootstrap_type': 'Bayesian', 'bagging_temperature': 9.519896607464464}. Best is trial 3065 with value: 0.8863636363636364.
[32m[I 2023-04-21 03:28:53,748][39m Trial 5828 finished with value: 0.8409090909090909 and parameters: {'objective': 'CrossEntropy', 'colsample_bylevel': 0.07788589305306018, 'depth': 10, 'boosting_type': 'Plain', 'bootstrap_type': 'Bayesian', 'bagging_temperature': 8.993801493732656}. Best is trial 3065 with value: 0.8863636363636364.
[32m[I 2023-04-21 03:28:54,670][39m Trial 5829 finished with value: 0.8539325842696629 and parameters: {'objective': 'CrossEntropy', 'colsample_bylevel': 0.0838115127664432, 'depth': 3, 'boosting_type': 'Plain', 'bootstrap_type': 'Bayesian', 'bagging_temperature': 9.637199521675907}. Best is trial 3065 with value: 0.8863636363636364.
[32m[I 2023-04-21 03:28:55,720][39m Trial 5830 finished with value: 0.8539325842696629 and parameters: {'objective': 'CrossEntropy', 'colsample_bylevel': 0.08564761980399048, 'depth': 3, 'boosting_type': 'Plain', 'bootstrap_type': 'Bayesian', 'bagging_temperature': 9.435263214489003}. Best is trial 3065 with value: 0.8863636363636364.
[32m[I 2023-04-21 03:28:57,135][39m Trial 5831 finished with value: 0.8539325842696629 and parameters: {'objective': 'CrossEntropy', 'colsample_bylevel': 0.08446688074054344, 'depth': 3, 'boosting_type': 'Plain', 'bootstrap_type': 'Bayesian', 'bagging_temperature': 9.526743941429919}. Best is trial 3065 with value: 0.8863636363636364.
[32m[I 2023-04-21 03:28:57,840][39m Trial 5832 finished with value: 0.8791208791208791 and parameters: {'objective': 'CrossEntropy', 'colsample_bylevel': 0.08287268414161827, 'depth': 3, 'boosting_type': 'Plain', 'bootstrap_type': 'Bayesian', 'bagging_temperature': 9.585954162288896}. Best is trial 3065 with value: 0.8863636363636364.
[32m[I 2023-04-21 03:28:58,993][39m Trial 5833 finished with value: 0.8666666666666666 and parameters: {'objective': 'Logloss', 'colsample_bylevel': 0.07438211389267974, 'depth': 4, 'boosting_type': 'Plain', 'bootstrap_type': 'Bayesian', 'bagging_temperature': 9.620237816293184}. Best is trial 3065 with value: 0.8863636363636364.
[32m[I 2023-04-21 03:29:00,059][39m Trial 5834 finished with value: 0.8539325842696629 and parameters: {'objective': 'CrossEntropy', 'colsample_bylevel': 0.07198051672332413, 'depth': 11, 'boosting_type': 'Plain', 'bootstrap_type': 'Bayesian', 'bagging_temperature': 9.977070262955008}. Best is trial 3065 with value: 0.8863636363636364.
[32m[I 2023-04-21 03:29:01,394][39m Trial 5835 finished with value: 0.8275862068965518 and parameters: {'objective': 'CrossEntropy', 'colsample_bylevel': 0.08024032836684808, 'depth': 9, 'boosting_type': 'Plain', 'bootstrap_type': 'Bayesian', 'bagging_temperature': 8.636168967603577}. Best is trial 3065 with value: 0.8863636363636364.
[32m[I 2023-04-21 03:29:02,368][39m Trial 5836 finished with value: 0.8666666666666666 and parameters: {'objective': 'CrossEntropy', 'colsample_bylevel': 0.08929133625141286, 'depth': 3, 'boosting_type': 'Plain', 'bootstrap_type': 'Bayesian', 'bagging_temperature': 9.581746942652684}. Best is trial 3065 with value: 0.8863636363636364.
[32m[I 2023-04-21 03:29:03,518][39m Trial 5837 finished with value: 0.8539325842696629 and parameters: {'objective': 'Logloss', 'colsample_bylevel': 0.0716103813864622, 'depth': 9, 'boosting_type': 'Plain', 'bootstrap_type': 'Bayesian', 'bagging_temperature': 8.882003540592416}. Best is trial 3065 with value: 0.8863636363636364.
[32m[I 2023-04-21 03:29:04,442][39m Trial 5838 finished with value: 0.8666666666666666 and parameters: {'objective': 'Logloss', 'colsample_bylevel': 0.07067284114889336, 'depth': 9, 'boosting_type': 'Plain', 'bootstrap_type': 'Bayesian', 'bagging_temperature': 9.435470374258559}. Best is trial 3065 with value: 0.8863636363636364.
[32m[I 2023-04-21 03:29:05,838][39m Trial 5839 finished with value: 0.8275862068965518 and parameters: {'objective': 'Logloss', 'colsample_bylevel': 0.07267856364748435, 'depth': 8, 'boosting_type': 'Plain', 'bootstrap_type': 'Bayesian', 'bagging_temperature': 9.500159165870686}. Best is trial 3065 with value: 0.8863636363636364.
[32m[I 2023-04-21 03:29:06,535][39m Trial 5840 finished with value: 0.8505747126436782 and parameters: {'objective': 'CrossEntropy', 'colsample_bylevel': 0.07595850703555916, 'depth': 10, 'boosting_type': 'Plain', 'bootstrap_type': 'MVS'}. Best is trial 3065 with value: 0.8863636363636364.
[32m[I 2023-04-21 03:29:11,387][39m Trial 5841 finished with value: 0.8139534883720929 and parameters: {'objective': 'CrossEntropy', 'colsample_bylevel': 0.07578655021416296, 'depth': 11, 'boosting_type': 'Ordered', 'bootstrap_type': 'Bayesian', 'bagging_temperature': 9.594873512322764}. Best is trial 3065 with value: 0.8863636363636364.
[32m[I 2023-04-21 03:29:12,746][39m Trial 5842 finished with value: 0.8505747126436782 and parameters: {'objective': 'CrossEntropy', 'colsample_bylevel': 0.08847520041526516, 'depth': 11, 'boosting_type': 'Plain', 'bootstrap_type': 'Bayesian', 'bagging_temperature': 9.611961838684305}. Best is trial 3065 with value: 0.8863636363636364.
[32m[I 2023-04-21 03:29:13,868][39m Trial 5843 finished with value: 0.8666666666666666 and parameters: {'objective': 'Logloss', 'colsample_bylevel': 0.07420642320670826, 'depth': 4, 'boosting_type': 'Plain', 'bootstrap_type': 'Bayesian', 'bagging_temperature': 8.853930105501854}. Best is trial 3065 with value: 0.8863636363636364.
[32m[I 2023-04-21 03:29:15,114][39m Trial 5844 finished with value: 0.8539325842696629 and parameters: {'objective': 'Logloss', 'colsample_bylevel': 0.07071824816518492, 'depth': 7, 'boosting_type': 'Plain', 'bootstrap_type': 'Bayesian', 'bagging_temperature': 9.079628247914156}. Best is trial 3065 with value: 0.8863636363636364.
[32m[I 2023-04-21 03:29:16,361][39m Trial 5845 finished with value: 0.8275862068965518 and parameters: {'objective': 'Logloss', 'colsample_bylevel': 0.07032173567195085, 'depth': 9, 'boosting_type': 'Plain', 'bootstrap_type': 'Bayesian', 'bagging_temperature': 9.535128536129399}. Best is trial 3065 with value: 0.8863636363636364.
[32m[I 2023-04-21 03:29:17,552][39m Trial 5846 finished with value: 0.8139534883720929 and parameters: {'objective': 'CrossEntropy', 'colsample_bylevel': 0.08460762666542632, 'depth': 11, 'boosting_type': 'Plain', 'bootstrap_type': 'Bayesian', 'bagging_temperature': 9.442633129766344}. Best is trial 3065 with value: 0.8863636363636364.
[32m[I 2023-04-21 03:29:19,047][39m Trial 5847 finished with value: 0.8666666666666666 and parameters: {'objective': 'CrossEntropy', 'colsample_bylevel': 0.09281322687293284, 'depth': 3, 'boosting_type': 'Plain', 'bootstrap_type': 'Bayesian', 'bagging_temperature': 9.916085248730626}. Best is trial 3065 with value: 0.8863636363636364.
[32m[I 2023-04-21 03:29:20,013][39m Trial 5848 finished with value: 0.8666666666666666 and parameters: {'objective': 'CrossEntropy', 'colsample_bylevel': 0.07790796900305356, 'depth': 9, 'boosting_type': 'Plain', 'bootstrap_type': 'Bayesian', 'bagging_temperature': 9.563584763961957}. Best is trial 3065 with value: 0.8863636363636364.
[32m[I 2023-04-21 03:29:20,860][39m Trial 5849 finished with value: 0.8409090909090909 and parameters: {'objective': 'CrossEntropy', 'colsample_bylevel': 0.07299618048542157, 'depth': 10, 'boosting_type': 'Plain', 'bootstrap_type': 'Bayesian', 'bagging_temperature': 8.756605389058766}. Best is trial 3065 with value: 0.8863636363636364.
