[32m[I 2023-04-21 01:38:48,652][39m Trial 135 finished with value: 0.8409090909090909 and parameters: {'objective': 'CrossEntropy', 'colsample_bylevel': 0.0927529409233548, 'depth': 4, 'boosting_type': 'Plain', 'bootstrap_type': 'Bayesian', 'bagging_temperature': 9.994937722611448}. Best is trial 98 with value: 0.8791208791208791.
[32m[I 2023-04-21 01:38:49,419][39m Trial 136 finished with value: 0.8333333333333333 and parameters: {'objective': 'CrossEntropy', 'colsample_bylevel': 0.09592490115765538, 'depth': 1, 'boosting_type': 'Plain', 'bootstrap_type': 'Bayesian', 'bagging_temperature': 8.348381170067801}. Best is trial 98 with value: 0.8791208791208791.
[32m[I 2023-04-21 01:38:50,048][39m Trial 137 finished with value: 0.8666666666666666 and parameters: {'objective': 'CrossEntropy', 'colsample_bylevel': 0.08824807012172696, 'depth': 3, 'boosting_type': 'Plain', 'bootstrap_type': 'Bayesian', 'bagging_temperature': 9.457134789532342}. Best is trial 98 with value: 0.8791208791208791.
[32m[I 2023-04-21 01:38:50,986][39m Trial 138 finished with value: 0.8409090909090909 and parameters: {'objective': 'CrossEntropy', 'colsample_bylevel': 0.08283390879536152, 'depth': 2, 'boosting_type': 'Plain', 'bootstrap_type': 'Bayesian', 'bagging_temperature': 9.031111612851568}. Best is trial 98 with value: 0.8791208791208791.
[32m[I 2023-04-21 01:38:51,701][39m Trial 139 finished with value: 0.8666666666666666 and parameters: {'objective': 'CrossEntropy', 'colsample_bylevel': 0.08863006285364648, 'depth': 2, 'boosting_type': 'Plain', 'bootstrap_type': 'Bayesian', 'bagging_temperature': 8.691886475388205}. Best is trial 98 with value: 0.8791208791208791.
[32m[I 2023-04-21 01:38:52,404][39m Trial 140 finished with value: 0.8275862068965518 and parameters: {'objective': 'CrossEntropy', 'colsample_bylevel': 0.09118380767930982, 'depth': 1, 'boosting_type': 'Plain', 'bootstrap_type': 'Bayesian', 'bagging_temperature': 8.569300863605113}. Best is trial 98 with value: 0.8791208791208791.
[32m[I 2023-04-21 01:38:53,641][39m Trial 141 finished with value: 0.8791208791208791 and parameters: {'objective': 'CrossEntropy', 'colsample_bylevel': 0.08585978065423679, 'depth': 3, 'boosting_type': 'Plain', 'bootstrap_type': 'Bayesian', 'bagging_temperature': 9.47610810773734}. Best is trial 98 with value: 0.8791208791208791.
[32m[I 2023-04-21 01:38:54,350][39m Trial 142 finished with value: 0.8666666666666666 and parameters: {'objective': 'CrossEntropy', 'colsample_bylevel': 0.0879308061434543, 'depth': 3, 'boosting_type': 'Plain', 'bootstrap_type': 'Bayesian', 'bagging_temperature': 9.547046369468479}. Best is trial 98 with value: 0.8791208791208791.
[32m[I 2023-04-21 01:38:55,623][39m Trial 143 finished with value: 0.8666666666666666 and parameters: {'objective': 'CrossEntropy', 'colsample_bylevel': 0.09520084965143735, 'depth': 3, 'boosting_type': 'Plain', 'bootstrap_type': 'Bayesian', 'bagging_temperature': 9.644248559877763}. Best is trial 98 with value: 0.8791208791208791.
[32m[I 2023-04-21 01:38:56,318][39m Trial 144 finished with value: 0.8275862068965518 and parameters: {'objective': 'CrossEntropy', 'colsample_bylevel': 0.0850502924741935, 'depth': 4, 'boosting_type': 'Plain', 'bootstrap_type': 'Bayesian', 'bagging_temperature': 8.942672046472905}. Best is trial 98 with value: 0.8791208791208791.
[32m[I 2023-04-21 01:38:57,505][39m Trial 145 finished with value: 0.8666666666666666 and parameters: {'objective': 'CrossEntropy', 'colsample_bylevel': 0.08117472858651632, 'depth': 3, 'boosting_type': 'Plain', 'bootstrap_type': 'Bayesian', 'bagging_temperature': 9.212955347223758}. Best is trial 98 with value: 0.8791208791208791.
[32m[I 2023-04-21 01:38:58,443][39m Trial 146 finished with value: 0.8505747126436782 and parameters: {'objective': 'CrossEntropy', 'colsample_bylevel': 0.08319058130334747, 'depth': 2, 'boosting_type': 'Plain', 'bootstrap_type': 'Bayesian', 'bagging_temperature': 9.353272507790178}. Best is trial 98 with value: 0.8791208791208791.
[32m[I 2023-04-21 01:38:59,326][39m Trial 147 finished with value: 0.8275862068965518 and parameters: {'objective': 'CrossEntropy', 'colsample_bylevel': 0.09497104247101533, 'depth': 4, 'boosting_type': 'Plain', 'bootstrap_type': 'Bayesian', 'bagging_temperature': 9.532478203159041}. Best is trial 98 with value: 0.8791208791208791.
[32m[I 2023-04-21 01:38:59,956][39m Trial 148 finished with value: 0.8539325842696629 and parameters: {'objective': 'CrossEntropy', 'colsample_bylevel': 0.0922693894190675, 'depth': 3, 'boosting_type': 'Plain', 'bootstrap_type': 'Bayesian', 'bagging_temperature': 9.799041219125435}. Best is trial 98 with value: 0.8791208791208791.
[32m[I 2023-04-21 01:39:00,602][39m Trial 149 finished with value: 0.8409090909090909 and parameters: {'objective': 'CrossEntropy', 'colsample_bylevel': 0.0862028388942048, 'depth': 3, 'boosting_type': 'Plain', 'bootstrap_type': 'Bayesian', 'bagging_temperature': 8.979919961453513}. Best is trial 98 with value: 0.8791208791208791.
[32m[I 2023-04-21 01:39:01,427][39m Trial 150 finished with value: 0.8539325842696629 and parameters: {'objective': 'CrossEntropy', 'colsample_bylevel': 0.09258884328607703, 'depth': 2, 'boosting_type': 'Plain', 'bootstrap_type': 'Bayesian', 'bagging_temperature': 8.719104756563933}. Best is trial 98 with value: 0.8791208791208791.
[32m[I 2023-04-21 01:39:02,419][39m Trial 151 finished with value: 0.8539325842696629 and parameters: {'objective': 'CrossEntropy', 'colsample_bylevel': 0.08840574920292323, 'depth': 3, 'boosting_type': 'Plain', 'bootstrap_type': 'Bayesian', 'bagging_temperature': 9.389729672703739}. Best is trial 98 with value: 0.8791208791208791.
[32m[I 2023-04-21 01:39:03,485][39m Trial 152 finished with value: 0.8275862068965518 and parameters: {'objective': 'CrossEntropy', 'colsample_bylevel': 0.09753971411244639, 'depth': 3, 'boosting_type': 'Plain', 'bootstrap_type': 'Bayesian', 'bagging_temperature': 9.741299930155167}. Best is trial 98 with value: 0.8791208791208791.
[32m[I 2023-04-21 01:39:04,558][39m Trial 153 finished with value: 0.8764044943820225 and parameters: {'objective': 'CrossEntropy', 'colsample_bylevel': 0.07954878607724132, 'depth': 2, 'boosting_type': 'Plain', 'bootstrap_type': 'Bayesian', 'bagging_temperature': 9.978773553041483}. Best is trial 98 with value: 0.8791208791208791.
[32m[I 2023-04-21 01:39:05,427][39m Trial 154 finished with value: 0.8666666666666666 and parameters: {'objective': 'CrossEntropy', 'colsample_bylevel': 0.08597330924786938, 'depth': 3, 'boosting_type': 'Plain', 'bootstrap_type': 'Bayesian', 'bagging_temperature': 9.194360645918065}. Best is trial 98 with value: 0.8791208791208791.
[32m[I 2023-04-21 01:39:06,085][39m Trial 155 finished with value: 0.8 and parameters: {'objective': 'CrossEntropy', 'colsample_bylevel': 0.08422896657102534, 'depth': 2, 'boosting_type': 'Plain', 'bootstrap_type': 'Bayesian', 'bagging_temperature': 0.18539110364374167}. Best is trial 98 with value: 0.8791208791208791.
[32m[I 2023-04-21 01:39:06,748][39m Trial 156 finished with value: 0.8636363636363636 and parameters: {'objective': 'CrossEntropy', 'colsample_bylevel': 0.08203205456465079, 'depth': 2, 'boosting_type': 'Plain', 'bootstrap_type': 'Bayesian', 'bagging_temperature': 9.27548889087834}. Best is trial 98 with value: 0.8791208791208791.
[32m[I 2023-04-21 01:39:07,585][39m Trial 157 finished with value: 0.8764044943820225 and parameters: {'objective': 'CrossEntropy', 'colsample_bylevel': 0.07934315869453469, 'depth': 2, 'boosting_type': 'Plain', 'bootstrap_type': 'Bayesian', 'bagging_temperature': 9.745829968289152}. Best is trial 98 with value: 0.8791208791208791.
[32m[I 2023-04-21 01:39:08,346][39m Trial 158 finished with value: 0.8666666666666666 and parameters: {'objective': 'CrossEntropy', 'colsample_bylevel': 0.07821907491230584, 'depth': 2, 'boosting_type': 'Plain', 'bootstrap_type': 'Bayesian', 'bagging_temperature': 9.977338936515837}. Best is trial 98 with value: 0.8791208791208791.
[32m[I 2023-04-21 01:39:09,367][39m Trial 159 finished with value: 0.8764044943820225 and parameters: {'objective': 'CrossEntropy', 'colsample_bylevel': 0.0811193315161688, 'depth': 2, 'boosting_type': 'Plain', 'bootstrap_type': 'Bayesian', 'bagging_temperature': 9.695508736156238}. Best is trial 98 with value: 0.8791208791208791.
[32m[I 2023-04-21 01:39:10,120][39m Trial 160 finished with value: 0.8409090909090909 and parameters: {'objective': 'CrossEntropy', 'colsample_bylevel': 0.0793359405734259, 'depth': 4, 'boosting_type': 'Plain', 'bootstrap_type': 'Bayesian', 'bagging_temperature': 9.930369044756711}. Best is trial 98 with value: 0.8791208791208791.
[32m[I 2023-04-21 01:39:10,889][39m Trial 161 finished with value: 0.8666666666666666 and parameters: {'objective': 'CrossEntropy', 'colsample_bylevel': 0.09023803429917594, 'depth': 2, 'boosting_type': 'Plain', 'bootstrap_type': 'Bayesian', 'bagging_temperature': 9.731295099632602}. Best is trial 98 with value: 0.8791208791208791.
[32m[I 2023-04-21 01:39:11,910][39m Trial 162 finished with value: 0.8409090909090909 and parameters: {'objective': 'CrossEntropy', 'colsample_bylevel': 0.08145494284567747, 'depth': 3, 'boosting_type': 'Plain', 'bootstrap_type': 'Bayesian', 'bagging_temperature': 9.74843602126984}. Best is trial 98 with value: 0.8791208791208791.
[32m[I 2023-04-21 01:39:12,661][39m Trial 163 finished with value: 0.8539325842696629 and parameters: {'objective': 'CrossEntropy', 'colsample_bylevel': 0.0845040692967529, 'depth': 3, 'boosting_type': 'Plain', 'bootstrap_type': 'Bayesian', 'bagging_temperature': 9.196624908170433}. Best is trial 98 with value: 0.8791208791208791.
[32m[I 2023-04-21 01:39:13,659][39m Trial 164 finished with value: 0.8571428571428572 and parameters: {'objective': 'CrossEntropy', 'colsample_bylevel': 0.0725691742656062, 'depth': 1, 'boosting_type': 'Plain', 'bootstrap_type': 'Bayesian', 'bagging_temperature': 9.514881370500344}. Best is trial 98 with value: 0.8791208791208791.
[32m[I 2023-04-21 01:39:14,342][39m Trial 165 finished with value: 0.8275862068965518 and parameters: {'objective': 'CrossEntropy', 'colsample_bylevel': 0.09375063302960915, 'depth': 3, 'boosting_type': 'Plain', 'bootstrap_type': 'Bayesian', 'bagging_temperature': 9.488364834211763}. Best is trial 98 with value: 0.8791208791208791.
[32m[I 2023-04-21 01:39:15,188][39m Trial 166 finished with value: 0.8636363636363636 and parameters: {'objective': 'CrossEntropy', 'colsample_bylevel': 0.07977740752231267, 'depth': 2, 'boosting_type': 'Plain', 'bootstrap_type': 'Bayesian', 'bagging_temperature': 9.493834047532708}. Best is trial 98 with value: 0.8791208791208791.
[32m[I 2023-04-21 01:39:16,062][39m Trial 167 finished with value: 0.8539325842696629 and parameters: {'objective': 'CrossEntropy', 'colsample_bylevel': 0.08793461138725117, 'depth': 3, 'boosting_type': 'Plain', 'bootstrap_type': 'Bayesian', 'bagging_temperature': 8.223561493507026}. Best is trial 98 with value: 0.8791208791208791.
[32m[I 2023-04-21 01:39:16,769][39m Trial 168 finished with value: 0.8666666666666666 and parameters: {'objective': 'CrossEntropy', 'colsample_bylevel': 0.07618745288867007, 'depth': 2, 'boosting_type': 'Plain', 'bootstrap_type': 'Bayesian', 'bagging_temperature': 9.798512023320878}. Best is trial 98 with value: 0.8791208791208791.
[32m[I 2023-04-21 01:39:17,620][39m Trial 169 finished with value: 0.8409090909090909 and parameters: {'objective': 'CrossEntropy', 'colsample_bylevel': 0.08308902885056549, 'depth': 2, 'boosting_type': 'Plain', 'bootstrap_type': 'Bayesian', 'bagging_temperature': 9.372318772989521}. Best is trial 98 with value: 0.8791208791208791.
[32m[I 2023-04-21 01:39:18,888][39m Trial 170 finished with value: 0.8089887640449439 and parameters: {'objective': 'CrossEntropy', 'colsample_bylevel': 0.08939818287566002, 'depth': 1, 'boosting_type': 'Plain', 'bootstrap_type': 'Bayesian', 'bagging_temperature': 8.692210253205674}. Best is trial 98 with value: 0.8791208791208791.
[32m[I 2023-04-21 01:39:19,445][39m Trial 171 finished with value: 0.8666666666666666 and parameters: {'objective': 'CrossEntropy', 'colsample_bylevel': 0.07852524383584265, 'depth': 2, 'boosting_type': 'Plain', 'bootstrap_type': 'Bayesian', 'bagging_temperature': 9.986211781476976}. Best is trial 98 with value: 0.8791208791208791.
[32m[I 2023-04-21 01:39:20,248][39m Trial 172 finished with value: 0.8539325842696629 and parameters: {'objective': 'CrossEntropy', 'colsample_bylevel': 0.0804982440860098, 'depth': 3, 'boosting_type': 'Plain', 'bootstrap_type': 'Bayesian', 'bagging_temperature': 9.987024897602817}. Best is trial 98 with value: 0.8791208791208791.
[32m[I 2023-04-21 01:39:21,127][39m Trial 173 finished with value: 0.8636363636363636 and parameters: {'objective': 'CrossEntropy', 'colsample_bylevel': 0.08239348984369957, 'depth': 2, 'boosting_type': 'Plain', 'bootstrap_type': 'Bayesian', 'bagging_temperature': 9.128454283406025}. Best is trial 98 with value: 0.8791208791208791.
[32m[I 2023-04-21 01:39:21,797][39m Trial 174 finished with value: 0.8539325842696629 and parameters: {'objective': 'CrossEntropy', 'colsample_bylevel': 0.07112198818433435, 'depth': 2, 'boosting_type': 'Plain', 'bootstrap_type': 'Bayesian', 'bagging_temperature': 9.266647205656156}. Best is trial 98 with value: 0.8791208791208791.
[32m[I 2023-04-21 01:39:22,831][39m Trial 175 finished with value: 0.8409090909090909 and parameters: {'objective': 'CrossEntropy', 'colsample_bylevel': 0.08627549175606655, 'depth': 4, 'boosting_type': 'Plain', 'bootstrap_type': 'Bayesian', 'bagging_temperature': 9.01460930073178}. Best is trial 98 with value: 0.8791208791208791.
[32m[I 2023-04-21 01:39:23,734][39m Trial 176 finished with value: 0.8636363636363636 and parameters: {'objective': 'CrossEntropy', 'colsample_bylevel': 0.08975608133944614, 'depth': 2, 'boosting_type': 'Plain', 'bootstrap_type': 'Bayesian', 'bagging_temperature': 8.911434585067747}. Best is trial 98 with value: 0.8791208791208791.
[32m[I 2023-04-21 01:39:24,410][39m Trial 177 finished with value: 0.8275862068965518 and parameters: {'objective': 'CrossEntropy', 'colsample_bylevel': 0.08771720251930852, 'depth': 3, 'boosting_type': 'Plain', 'bootstrap_type': 'MVS'}. Best is trial 98 with value: 0.8791208791208791.
[32m[I 2023-04-21 01:39:25,257][39m Trial 178 finished with value: 0.8409090909090909 and parameters: {'objective': 'CrossEntropy', 'colsample_bylevel': 0.09010911298408807, 'depth': 2, 'boosting_type': 'Plain', 'bootstrap_type': 'Bayesian', 'bagging_temperature': 9.594213956259145}. Best is trial 98 with value: 0.8791208791208791.
[32m[I 2023-04-21 01:39:26,197][39m Trial 179 finished with value: 0.8314606741573034 and parameters: {'objective': 'CrossEntropy', 'colsample_bylevel': 0.09523779107010896, 'depth': 3, 'boosting_type': 'Plain', 'bootstrap_type': 'Bayesian', 'bagging_temperature': 9.60941200039271}. Best is trial 98 with value: 0.8791208791208791.
[32m[I 2023-04-21 01:39:26,876][39m Trial 180 finished with value: 0.8666666666666666 and parameters: {'objective': 'CrossEntropy', 'colsample_bylevel': 0.08476171372184557, 'depth': 2, 'boosting_type': 'Plain', 'bootstrap_type': 'Bayesian', 'bagging_temperature': 9.810833048568387}. Best is trial 98 with value: 0.8791208791208791.
[32m[I 2023-04-21 01:39:27,653][39m Trial 181 finished with value: 0.8539325842696629 and parameters: {'objective': 'CrossEntropy', 'colsample_bylevel': 0.08421069224928568, 'depth': 2, 'boosting_type': 'Plain', 'bootstrap_type': 'Bayesian', 'bagging_temperature': 9.807359541932213}. Best is trial 98 with value: 0.8791208791208791.
[32m[I 2023-04-21 01:39:28,696][39m Trial 182 finished with value: 0.8666666666666666 and parameters: {'objective': 'CrossEntropy', 'colsample_bylevel': 0.08587247956873706, 'depth': 3, 'boosting_type': 'Plain', 'bootstrap_type': 'Bayesian', 'bagging_temperature': 9.33699345915916}. Best is trial 98 with value: 0.8791208791208791.
[32m[I 2023-04-21 01:39:29,710][39m Trial 183 finished with value: 0.8409090909090909 and parameters: {'objective': 'CrossEntropy', 'colsample_bylevel': 0.08600299388058702, 'depth': 3, 'boosting_type': 'Plain', 'bootstrap_type': 'Bayesian', 'bagging_temperature': 9.544365715067766}. Best is trial 98 with value: 0.8791208791208791.
[32m[I 2023-04-21 01:39:30,406][39m Trial 184 finished with value: 0.8666666666666666 and parameters: {'objective': 'CrossEntropy', 'colsample_bylevel': 0.0871630128541672, 'depth': 3, 'boosting_type': 'Plain', 'bootstrap_type': 'Bayesian', 'bagging_temperature': 9.41784412499154}. Best is trial 98 with value: 0.8791208791208791.
[32m[I 2023-04-21 01:39:31,013][39m Trial 185 finished with value: 0.8139534883720929 and parameters: {'objective': 'CrossEntropy', 'colsample_bylevel': 0.09132822066908372, 'depth': 1, 'boosting_type': 'Plain', 'bootstrap_type': 'Bayesian', 'bagging_temperature': 8.528790451084033}. Best is trial 98 with value: 0.8791208791208791.
[32m[I 2023-04-21 01:39:32,244][39m Trial 186 finished with value: 0.8539325842696629 and parameters: {'objective': 'CrossEntropy', 'colsample_bylevel': 0.07682791629361792, 'depth': 2, 'boosting_type': 'Plain', 'bootstrap_type': 'Bayesian', 'bagging_temperature': 7.4855781385806}. Best is trial 98 with value: 0.8791208791208791.
[32m[I 2023-04-21 01:39:33,351][39m Trial 187 finished with value: 0.8666666666666666 and parameters: {'objective': 'CrossEntropy', 'colsample_bylevel': 0.07865841299124184, 'depth': 2, 'boosting_type': 'Plain', 'bootstrap_type': 'Bayesian', 'bagging_temperature': 9.990891263587116}. Best is trial 98 with value: 0.8791208791208791.
[32m[I 2023-04-21 01:39:33,940][39m Trial 188 finished with value: 0.8666666666666666 and parameters: {'objective': 'CrossEntropy', 'colsample_bylevel': 0.07817316582925853, 'depth': 2, 'boosting_type': 'Plain', 'bootstrap_type': 'Bayesian', 'bagging_temperature': 9.973426669128589}. Best is trial 98 with value: 0.8791208791208791.
[32m[I 2023-04-21 01:39:34,646][39m Trial 189 finished with value: 0.8139534883720929 and parameters: {'objective': 'CrossEntropy', 'colsample_bylevel': 0.08344725998995782, 'depth': 1, 'boosting_type': 'Plain', 'bootstrap_type': 'Bayesian', 'bagging_temperature': 8.925701393531764}. Best is trial 98 with value: 0.8791208791208791.
[32m[I 2023-04-21 01:39:35,801][39m Trial 190 finished with value: 0.8666666666666666 and parameters: {'objective': 'CrossEntropy', 'colsample_bylevel': 0.08116284796205918, 'depth': 2, 'boosting_type': 'Plain', 'bootstrap_type': 'Bayesian', 'bagging_temperature': 9.16728354602525}. Best is trial 98 with value: 0.8791208791208791.
[32m[I 2023-04-21 01:39:36,639][39m Trial 191 finished with value: 0.8539325842696629 and parameters: {'objective': 'CrossEntropy', 'colsample_bylevel': 0.09193871949252391, 'depth': 3, 'boosting_type': 'Plain', 'bootstrap_type': 'Bayesian', 'bagging_temperature': 9.133311080180567}. Best is trial 98 with value: 0.8791208791208791.
[32m[I 2023-04-21 01:39:37,229][39m Trial 192 finished with value: 0.8539325842696629 and parameters: {'objective': 'CrossEntropy', 'colsample_bylevel': 0.08937176799208857, 'depth': 3, 'boosting_type': 'Plain', 'bootstrap_type': 'Bayesian', 'bagging_temperature': 8.684290933940817}. Best is trial 98 with value: 0.8791208791208791.
[32m[I 2023-04-21 01:39:38,144][39m Trial 193 finished with value: 0.8539325842696629 and parameters: {'objective': 'CrossEntropy', 'colsample_bylevel': 0.08157311810223299, 'depth': 4, 'boosting_type': 'Plain', 'bootstrap_type': 'Bayesian', 'bagging_temperature': 9.692349661143982}. Best is trial 98 with value: 0.8791208791208791.
[32m[I 2023-04-21 01:39:39,064][39m Trial 194 finished with value: 0.8636363636363636 and parameters: {'objective': 'CrossEntropy', 'colsample_bylevel': 0.0804104037067743, 'depth': 2, 'boosting_type': 'Plain', 'bootstrap_type': 'Bayesian', 'bagging_temperature': 9.436052170019572}. Best is trial 98 with value: 0.8791208791208791.
[32m[I 2023-04-21 01:39:40,083][39m Trial 195 finished with value: 0.8539325842696629 and parameters: {'objective': 'CrossEntropy', 'colsample_bylevel': 0.08631929862584774, 'depth': 3, 'boosting_type': 'Plain', 'bootstrap_type': 'Bayesian', 'bagging_temperature': 9.644552326648837}. Best is trial 98 with value: 0.8791208791208791.
[32m[I 2023-04-21 01:39:40,757][39m Trial 196 finished with value: 0.8275862068965518 and parameters: {'objective': 'CrossEntropy', 'colsample_bylevel': 0.09932879300272994, 'depth': 3, 'boosting_type': 'Plain', 'bootstrap_type': 'Bayesian', 'bagging_temperature': 9.704995918590221}. Best is trial 98 with value: 0.8791208791208791.
[32m[I 2023-04-21 01:39:41,431][39m Trial 197 finished with value: 0.8636363636363636 and parameters: {'objective': 'CrossEntropy', 'colsample_bylevel': 0.07692956759981566, 'depth': 2, 'boosting_type': 'Plain', 'bootstrap_type': 'Bayesian', 'bagging_temperature': 9.823820820047617}. Best is trial 98 with value: 0.8791208791208791.
[32m[I 2023-04-21 01:39:42,390][39m Trial 198 finished with value: 0.8764044943820225 and parameters: {'objective': 'CrossEntropy', 'colsample_bylevel': 0.08851150884568619, 'depth': 2, 'boosting_type': 'Plain', 'bootstrap_type': 'Bayesian', 'bagging_temperature': 8.285646740057201}. Best is trial 98 with value: 0.8791208791208791.
[32m[I 2023-04-21 01:39:43,384][39m Trial 199 finished with value: 0.8666666666666666 and parameters: {'objective': 'CrossEntropy', 'colsample_bylevel': 0.0878667326682615, 'depth': 3, 'boosting_type': 'Plain', 'bootstrap_type': 'Bayesian', 'bagging_temperature': 8.27672556944066}. Best is trial 98 with value: 0.8791208791208791.
