[32m[I 2023-04-21 02:57:50,027][39m Trial 4348 finished with value: 0.8539325842696629 and parameters: {'objective': 'CrossEntropy', 'colsample_bylevel': 0.07404008354408562, 'depth': 9, 'boosting_type': 'Plain', 'bootstrap_type': 'Bayesian', 'bagging_temperature': 9.56397062932836}. Best is trial 3065 with value: 0.8863636363636364.
[32m[I 2023-04-21 02:57:50,858][39m Trial 4349 finished with value: 0.8539325842696629 and parameters: {'objective': 'CrossEntropy', 'colsample_bylevel': 0.07504774963930898, 'depth': 6, 'boosting_type': 'Plain', 'bootstrap_type': 'Bayesian', 'bagging_temperature': 9.993745429346134}. Best is trial 3065 with value: 0.8863636363636364.
[32m[I 2023-04-21 02:57:51,516][39m Trial 4350 finished with value: 0.8539325842696629 and parameters: {'objective': 'CrossEntropy', 'colsample_bylevel': 0.0763559184350619, 'depth': 7, 'boosting_type': 'Plain', 'bootstrap_type': 'Bayesian', 'bagging_temperature': 9.610320491989464}. Best is trial 3065 with value: 0.8863636363636364.
[32m[I 2023-04-21 02:57:52,441][39m Trial 4351 finished with value: 0.8314606741573034 and parameters: {'objective': 'Logloss', 'colsample_bylevel': 0.07228542364314258, 'depth': 4, 'boosting_type': 'Plain', 'bootstrap_type': 'Bernoulli', 'subsample': 0.49130202948375856}. Best is trial 3065 with value: 0.8863636363636364.
[32m[I 2023-04-21 02:57:53,136][39m Trial 4352 finished with value: 0.8275862068965518 and parameters: {'objective': 'CrossEntropy', 'colsample_bylevel': 0.07604454820304635, 'depth': 4, 'boosting_type': 'Plain', 'bootstrap_type': 'MVS'}. Best is trial 3065 with value: 0.8863636363636364.
[32m[I 2023-04-21 02:57:54,243][39m Trial 4353 finished with value: 0.8409090909090909 and parameters: {'objective': 'CrossEntropy', 'colsample_bylevel': 0.07910316270640703, 'depth': 10, 'boosting_type': 'Plain', 'bootstrap_type': 'Bayesian', 'bagging_temperature': 8.970415077462848}. Best is trial 3065 with value: 0.8863636363636364.
[32m[I 2023-04-21 02:57:55,357][39m Trial 4354 finished with value: 0.8539325842696629 and parameters: {'objective': 'Logloss', 'colsample_bylevel': 0.07427820824749966, 'depth': 6, 'boosting_type': 'Plain', 'bootstrap_type': 'Bayesian', 'bagging_temperature': 8.85674791959907}. Best is trial 3065 with value: 0.8863636363636364.
[32m[I 2023-04-21 02:57:56,832][39m Trial 4355 finished with value: 0.8409090909090909 and parameters: {'objective': 'CrossEntropy', 'colsample_bylevel': 0.07791661168650378, 'depth': 11, 'boosting_type': 'Plain', 'bootstrap_type': 'Bayesian', 'bagging_temperature': 9.341456476873942}. Best is trial 3065 with value: 0.8863636363636364.
[32m[I 2023-04-21 02:57:57,555][39m Trial 4356 finished with value: 0.8666666666666666 and parameters: {'objective': 'Logloss', 'colsample_bylevel': 0.07039200190182128, 'depth': 4, 'boosting_type': 'Plain', 'bootstrap_type': 'Bayesian', 'bagging_temperature': 9.78660121506955}. Best is trial 3065 with value: 0.8863636363636364.
[32m[I 2023-04-21 02:57:58,836][39m Trial 4357 finished with value: 0.8505747126436782 and parameters: {'objective': 'CrossEntropy', 'colsample_bylevel': 0.08505388620569404, 'depth': 9, 'boosting_type': 'Plain', 'bootstrap_type': 'Bayesian', 'bagging_temperature': 9.281145267971151}. Best is trial 3065 with value: 0.8863636363636364.
[32m[I 2023-04-21 02:57:59,488][39m Trial 4358 finished with value: 0.8539325842696629 and parameters: {'objective': 'CrossEntropy', 'colsample_bylevel': 0.07516681663135302, 'depth': 10, 'boosting_type': 'Plain', 'bootstrap_type': 'Bayesian', 'bagging_temperature': 9.80454570163328}. Best is trial 3065 with value: 0.8863636363636364.
[32m[I 2023-04-21 02:58:00,404][39m Trial 4359 finished with value: 0.8666666666666666 and parameters: {'objective': 'CrossEntropy', 'colsample_bylevel': 0.0806341690833272, 'depth': 3, 'boosting_type': 'Plain', 'bootstrap_type': 'Bayesian', 'bagging_temperature': 9.296316887852452}. Best is trial 3065 with value: 0.8863636363636364.
[32m[I 2023-04-21 02:58:01,669][39m Trial 4360 finished with value: 0.8791208791208791 and parameters: {'objective': 'CrossEntropy', 'colsample_bylevel': 0.07951054842714331, 'depth': 10, 'boosting_type': 'Plain', 'bootstrap_type': 'Bayesian', 'bagging_temperature': 9.391418650147127}. Best is trial 3065 with value: 0.8863636363636364.
[32m[I 2023-04-21 02:58:02,800][39m Trial 4361 finished with value: 0.8539325842696629 and parameters: {'objective': 'CrossEntropy', 'colsample_bylevel': 0.07197780432455823, 'depth': 9, 'boosting_type': 'Plain', 'bootstrap_type': 'Bayesian', 'bagging_temperature': 8.146476094932526}. Best is trial 3065 with value: 0.8863636363636364.
[32m[I 2023-04-21 02:58:07,566][39m Trial 4362 finished with value: 0.8275862068965518 and parameters: {'objective': 'Logloss', 'colsample_bylevel': 0.07250163829533021, 'depth': 4, 'boosting_type': 'Ordered', 'bootstrap_type': 'Bayesian', 'bagging_temperature': 9.974835434235883}. Best is trial 3065 with value: 0.8863636363636364.
[32m[I 2023-04-21 02:58:08,562][39m Trial 4363 finished with value: 0.8409090909090909 and parameters: {'objective': 'CrossEntropy', 'colsample_bylevel': 0.08317742525958804, 'depth': 4, 'boosting_type': 'Plain', 'bootstrap_type': 'Bayesian', 'bagging_temperature': 9.218166103208373}. Best is trial 3065 with value: 0.8863636363636364.
[32m[I 2023-04-21 02:58:09,745][39m Trial 4364 finished with value: 0.8666666666666666 and parameters: {'objective': 'Logloss', 'colsample_bylevel': 0.07241850181773248, 'depth': 4, 'boosting_type': 'Plain', 'bootstrap_type': 'Bayesian', 'bagging_temperature': 9.79033296301669}. Best is trial 3065 with value: 0.8863636363636364.
[32m[I 2023-04-21 02:58:10,961][39m Trial 4365 finished with value: 0.8409090909090909 and parameters: {'objective': 'Logloss', 'colsample_bylevel': 0.08918713747594115, 'depth': 10, 'boosting_type': 'Plain', 'bootstrap_type': 'Bayesian', 'bagging_temperature': 8.273868405723531}. Best is trial 3065 with value: 0.8863636363636364.
[32m[I 2023-04-21 02:58:11,790][39m Trial 4366 finished with value: 0.8409090909090909 and parameters: {'objective': 'CrossEntropy', 'colsample_bylevel': 0.06359612843553916, 'depth': 9, 'boosting_type': 'Plain', 'bootstrap_type': 'Bayesian', 'bagging_temperature': 9.16200554585402}. Best is trial 3065 with value: 0.8863636363636364.
[32m[I 2023-04-21 02:58:13,098][39m Trial 4367 finished with value: 0.8275862068965518 and parameters: {'objective': 'CrossEntropy', 'colsample_bylevel': 0.07128642908980959, 'depth': 10, 'boosting_type': 'Plain', 'bootstrap_type': 'Bayesian', 'bagging_temperature': 9.118191716638055}. Best is trial 3065 with value: 0.8863636363636364.
[32m[I 2023-04-21 02:58:13,925][39m Trial 4368 finished with value: 0.8505747126436782 and parameters: {'objective': 'CrossEntropy', 'colsample_bylevel': 0.07999221999537924, 'depth': 4, 'boosting_type': 'Plain', 'bootstrap_type': 'Bayesian', 'bagging_temperature': 9.753387002976456}. Best is trial 3065 with value: 0.8863636363636364.
[32m[I 2023-04-21 02:58:15,142][39m Trial 4369 finished with value: 0.8409090909090909 and parameters: {'objective': 'CrossEntropy', 'colsample_bylevel': 0.07258532040543114, 'depth': 9, 'boosting_type': 'Plain', 'bootstrap_type': 'MVS'}. Best is trial 3065 with value: 0.8863636363636364.
[32m[I 2023-04-21 02:58:16,439][39m Trial 4370 finished with value: 0.7999999999999999 and parameters: {'objective': 'Logloss', 'colsample_bylevel': 0.07220694216309224, 'depth': 4, 'boosting_type': 'Plain', 'bootstrap_type': 'Bernoulli', 'subsample': 0.849106474628568}. Best is trial 3065 with value: 0.8863636363636364.
[32m[I 2023-04-21 02:58:17,441][39m Trial 4371 finished with value: 0.8409090909090909 and parameters: {'objective': 'Logloss', 'colsample_bylevel': 0.07384524741413057, 'depth': 7, 'boosting_type': 'Plain', 'bootstrap_type': 'Bayesian', 'bagging_temperature': 9.664504136135044}. Best is trial 3065 with value: 0.8863636363636364.
[32m[I 2023-04-21 02:58:18,268][39m Trial 4372 finished with value: 0.8791208791208791 and parameters: {'objective': 'CrossEntropy', 'colsample_bylevel': 0.08101158919254735, 'depth': 3, 'boosting_type': 'Plain', 'bootstrap_type': 'Bayesian', 'bagging_temperature': 8.927129395884382}. Best is trial 3065 with value: 0.8863636363636364.
[32m[I 2023-04-21 02:58:18,904][39m Trial 4373 finished with value: 0.8539325842696629 and parameters: {'objective': 'Logloss', 'colsample_bylevel': 0.07012634567968684, 'depth': 4, 'boosting_type': 'Plain', 'bootstrap_type': 'Bayesian', 'bagging_temperature': 9.869093189308538}. Best is trial 3065 with value: 0.8863636363636364.
[32m[I 2023-04-21 02:58:19,989][39m Trial 4374 finished with value: 0.8636363636363636 and parameters: {'objective': 'CrossEntropy', 'colsample_bylevel': 0.07896441209826595, 'depth': 2, 'boosting_type': 'Plain', 'bootstrap_type': 'Bayesian', 'bagging_temperature': 9.641749610831129}. Best is trial 3065 with value: 0.8863636363636364.
[32m[I 2023-04-21 02:58:20,792][39m Trial 4375 finished with value: 0.8539325842696629 and parameters: {'objective': 'CrossEntropy', 'colsample_bylevel': 0.07936099224356338, 'depth': 3, 'boosting_type': 'Plain', 'bootstrap_type': 'Bayesian', 'bagging_temperature': 9.783629259467908}. Best is trial 3065 with value: 0.8863636363636364.
[32m[I 2023-04-21 02:58:21,946][39m Trial 4376 finished with value: 0.8275862068965518 and parameters: {'objective': 'CrossEntropy', 'colsample_bylevel': 0.08541521032251055, 'depth': 3, 'boosting_type': 'Plain', 'bootstrap_type': 'Bayesian', 'bagging_temperature': 9.304495637596148}. Best is trial 3065 with value: 0.8863636363636364.
[32m[I 2023-04-21 02:58:23,162][39m Trial 4377 finished with value: 0.8139534883720929 and parameters: {'objective': 'CrossEntropy', 'colsample_bylevel': 0.07391981698489454, 'depth': 11, 'boosting_type': 'Plain', 'bootstrap_type': 'Bayesian', 'bagging_temperature': 8.676120754298058}. Best is trial 3065 with value: 0.8863636363636364.
[32m[I 2023-04-21 02:58:24,457][39m Trial 4378 finished with value: 0.8409090909090909 and parameters: {'objective': 'CrossEntropy', 'colsample_bylevel': 0.08210466147620052, 'depth': 8, 'boosting_type': 'Plain', 'bootstrap_type': 'Bayesian', 'bagging_temperature': 9.334174990568737}. Best is trial 3065 with value: 0.8863636363636364.
[32m[I 2023-04-21 02:58:25,465][39m Trial 4379 finished with value: 0.8409090909090909 and parameters: {'objective': 'Logloss', 'colsample_bylevel': 0.07314593661106078, 'depth': 11, 'boosting_type': 'Plain', 'bootstrap_type': 'Bayesian', 'bagging_temperature': 8.46590794034708}. Best is trial 3065 with value: 0.8863636363636364.
[32m[I 2023-04-21 02:58:26,332][39m Trial 4380 finished with value: 0.8666666666666666 and parameters: {'objective': 'CrossEntropy', 'colsample_bylevel': 0.0816887047708756, 'depth': 2, 'boosting_type': 'Plain', 'bootstrap_type': 'Bayesian', 'bagging_temperature': 8.795150161270142}. Best is trial 3065 with value: 0.8863636363636364.
[32m[I 2023-04-21 02:58:31,092][39m Trial 4381 finished with value: 0.8275862068965518 and parameters: {'objective': 'CrossEntropy', 'colsample_bylevel': 0.0851588399858669, 'depth': 9, 'boosting_type': 'Ordered', 'bootstrap_type': 'Bayesian', 'bagging_temperature': 9.44536980204974}. Best is trial 3065 with value: 0.8863636363636364.
[32m[I 2023-04-21 02:58:32,229][39m Trial 4382 finished with value: 0.8275862068965518 and parameters: {'objective': 'CrossEntropy', 'colsample_bylevel': 0.09626419549228775, 'depth': 3, 'boosting_type': 'Plain', 'bootstrap_type': 'Bayesian', 'bagging_temperature': 9.786791891718796}. Best is trial 3065 with value: 0.8863636363636364.
[32m[I 2023-04-21 02:58:33,548][39m Trial 4383 finished with value: 0.8181818181818182 and parameters: {'objective': 'CrossEntropy', 'colsample_bylevel': 0.07901268317153395, 'depth': 10, 'boosting_type': 'Plain', 'bootstrap_type': 'MVS'}. Best is trial 3065 with value: 0.8863636363636364.
[32m[I 2023-04-21 02:58:34,439][39m Trial 4384 finished with value: 0.8409090909090909 and parameters: {'objective': 'CrossEntropy', 'colsample_bylevel': 0.09142211863932667, 'depth': 4, 'boosting_type': 'Plain', 'bootstrap_type': 'Bayesian', 'bagging_temperature': 8.93307627595242}. Best is trial 3065 with value: 0.8863636363636364.
[32m[I 2023-04-21 02:58:35,562][39m Trial 4385 finished with value: 0.8409090909090909 and parameters: {'objective': 'CrossEntropy', 'colsample_bylevel': 0.07223649387482663, 'depth': 4, 'boosting_type': 'Plain', 'bootstrap_type': 'Bayesian', 'bagging_temperature': 8.527708053087048}. Best is trial 3065 with value: 0.8863636363636364.
[32m[I 2023-04-21 02:58:36,267][39m Trial 4386 finished with value: 0.8666666666666666 and parameters: {'objective': 'CrossEntropy', 'colsample_bylevel': 0.07088599132458316, 'depth': 4, 'boosting_type': 'Plain', 'bootstrap_type': 'Bayesian', 'bagging_temperature': 8.716964308982213}. Best is trial 3065 with value: 0.8863636363636364.
[32m[I 2023-04-21 02:58:37,162][39m Trial 4387 finished with value: 0.8409090909090909 and parameters: {'objective': 'CrossEntropy', 'colsample_bylevel': 0.06616135816662162, 'depth': 3, 'boosting_type': 'Plain', 'bootstrap_type': 'Bayesian', 'bagging_temperature': 7.789521910129165}. Best is trial 3065 with value: 0.8863636363636364.
[32m[I 2023-04-21 02:58:38,704][39m Trial 4388 finished with value: 0.8539325842696629 and parameters: {'objective': 'CrossEntropy', 'colsample_bylevel': 0.08223225379627278, 'depth': 3, 'boosting_type': 'Plain', 'bootstrap_type': 'Bayesian', 'bagging_temperature': 8.995294026415067}. Best is trial 3065 with value: 0.8863636363636364.
[32m[I 2023-04-21 02:58:39,744][39m Trial 4389 finished with value: 0.8791208791208791 and parameters: {'objective': 'Logloss', 'colsample_bylevel': 0.07363357993104647, 'depth': 5, 'boosting_type': 'Plain', 'bootstrap_type': 'Bayesian', 'bagging_temperature': 9.254964355291325}. Best is trial 3065 with value: 0.8863636363636364.
[32m[I 2023-04-21 02:58:40,721][39m Trial 4390 finished with value: 0.8139534883720929 and parameters: {'objective': 'CrossEntropy', 'colsample_bylevel': 0.07384513459465228, 'depth': 4, 'boosting_type': 'Plain', 'bootstrap_type': 'Bayesian', 'bagging_temperature': 9.15490044066508}. Best is trial 3065 with value: 0.8863636363636364.
[32m[I 2023-04-21 02:58:41,898][39m Trial 4391 finished with value: 0.8275862068965518 and parameters: {'objective': 'CrossEntropy', 'colsample_bylevel': 0.06936333487671587, 'depth': 10, 'boosting_type': 'Plain', 'bootstrap_type': 'Bayesian', 'bagging_temperature': 9.382283481028777}. Best is trial 3065 with value: 0.8863636363636364.
[32m[I 2023-04-21 02:58:42,543][39m Trial 4392 finished with value: 0.8539325842696629 and parameters: {'objective': 'CrossEntropy', 'colsample_bylevel': 0.07019729962178174, 'depth': 11, 'boosting_type': 'Plain', 'bootstrap_type': 'Bayesian', 'bagging_temperature': 9.80531001309477}. Best is trial 3065 with value: 0.8863636363636364.
[32m[I 2023-04-21 02:58:43,211][39m Trial 4393 finished with value: 0.8666666666666666 and parameters: {'objective': 'CrossEntropy', 'colsample_bylevel': 0.08176141676716082, 'depth': 3, 'boosting_type': 'Plain', 'bootstrap_type': 'Bayesian', 'bagging_temperature': 9.265887217097818}. Best is trial 3065 with value: 0.8863636363636364.
[32m[I 2023-04-21 02:58:44,255][39m Trial 4394 finished with value: 0.8539325842696629 and parameters: {'objective': 'CrossEntropy', 'colsample_bylevel': 0.07107667266497973, 'depth': 10, 'boosting_type': 'Plain', 'bootstrap_type': 'Bayesian', 'bagging_temperature': 8.947800109520033}. Best is trial 3065 with value: 0.8863636363636364.
[32m[I 2023-04-21 02:58:45,485][39m Trial 4395 finished with value: 0.8275862068965518 and parameters: {'objective': 'CrossEntropy', 'colsample_bylevel': 0.09822250374320633, 'depth': 3, 'boosting_type': 'Plain', 'bootstrap_type': 'Bayesian', 'bagging_temperature': 9.149151037897811}. Best is trial 3065 with value: 0.8863636363636364.
[32m[I 2023-04-21 02:58:46,442][39m Trial 4396 finished with value: 0.8275862068965518 and parameters: {'objective': 'CrossEntropy', 'colsample_bylevel': 0.08274934638430456, 'depth': 6, 'boosting_type': 'Plain', 'bootstrap_type': 'Bernoulli', 'subsample': 0.6325175457470891}. Best is trial 3065 with value: 0.8863636363636364.
[32m[I 2023-04-21 02:58:47,377][39m Trial 4397 finished with value: 0.8409090909090909 and parameters: {'objective': 'CrossEntropy', 'colsample_bylevel': 0.08117642306695079, 'depth': 3, 'boosting_type': 'Plain', 'bootstrap_type': 'MVS'}. Best is trial 3065 with value: 0.8863636363636364.
[32m[I 2023-04-21 02:58:48,473][39m Trial 4398 finished with value: 0.8444444444444446 and parameters: {'objective': 'CrossEntropy', 'colsample_bylevel': 0.06572316016252144, 'depth': 8, 'boosting_type': 'Plain', 'bootstrap_type': 'MVS'}. Best is trial 3065 with value: 0.8863636363636364.
[32m[I 2023-04-21 02:58:53,315][39m Trial 4399 finished with value: 0.8666666666666666 and parameters: {'objective': 'Logloss', 'colsample_bylevel': 0.09361926877855553, 'depth': 3, 'boosting_type': 'Ordered', 'bootstrap_type': 'Bayesian', 'bagging_temperature': 8.727288235195346}. Best is trial 3065 with value: 0.8863636363636364.
[32m[I 2023-04-21 02:58:54,348][39m Trial 4400 finished with value: 0.7857142857142858 and parameters: {'objective': 'CrossEntropy', 'colsample_bylevel': 0.08744425072327408, 'depth': 4, 'boosting_type': 'Plain', 'bootstrap_type': 'MVS'}. Best is trial 3065 with value: 0.8863636363636364.
[32m[I 2023-04-21 02:58:55,425][39m Trial 4401 finished with value: 0.8539325842696629 and parameters: {'objective': 'CrossEntropy', 'colsample_bylevel': 0.08300568642389547, 'depth': 3, 'boosting_type': 'Plain', 'bootstrap_type': 'Bayesian', 'bagging_temperature': 9.38676706641073}. Best is trial 3065 with value: 0.8863636363636364.
[32m[I 2023-04-21 02:58:56,456][39m Trial 4402 finished with value: 0.8505747126436782 and parameters: {'objective': 'Logloss', 'colsample_bylevel': 0.06851020605524238, 'depth': 10, 'boosting_type': 'Plain', 'bootstrap_type': 'Bayesian', 'bagging_temperature': 8.770908115366801}. Best is trial 3065 with value: 0.8863636363636364.
[32m[I 2023-04-21 02:58:57,627][39m Trial 4403 finished with value: 0.8539325842696629 and parameters: {'objective': 'CrossEntropy', 'colsample_bylevel': 0.0995416507933595, 'depth': 3, 'boosting_type': 'Plain', 'bootstrap_type': 'Bayesian', 'bagging_temperature': 8.521287764626248}. Best is trial 3065 with value: 0.8863636363636364.
[32m[I 2023-04-21 02:58:58,801][39m Trial 4404 finished with value: 0.8409090909090909 and parameters: {'objective': 'CrossEntropy', 'colsample_bylevel': 0.07841273802938349, 'depth': 10, 'boosting_type': 'Plain', 'bootstrap_type': 'Bayesian', 'bagging_temperature': 8.922998590799066}. Best is trial 3065 with value: 0.8863636363636364.
[32m[I 2023-04-21 02:59:00,224][39m Trial 4405 finished with value: 0.8409090909090909 and parameters: {'objective': 'Logloss', 'colsample_bylevel': 0.07370121179564627, 'depth': 6, 'boosting_type': 'Plain', 'bootstrap_type': 'Bayesian', 'bagging_temperature': 9.38356511327951}. Best is trial 3065 with value: 0.8863636363636364.
[32m[I 2023-04-21 02:59:01,461][39m Trial 4406 finished with value: 0.8539325842696629 and parameters: {'objective': 'Logloss', 'colsample_bylevel': 0.07262087129191529, 'depth': 7, 'boosting_type': 'Plain', 'bootstrap_type': 'Bayesian', 'bagging_temperature': 8.617237078337578}. Best is trial 3065 with value: 0.8863636363636364.
[32m[I 2023-04-21 02:59:02,619][39m Trial 4407 finished with value: 0.8666666666666666 and parameters: {'objective': 'Logloss', 'colsample_bylevel': 0.07087493907682127, 'depth': 4, 'boosting_type': 'Plain', 'bootstrap_type': 'Bayesian', 'bagging_temperature': 9.219582232145534}. Best is trial 3065 with value: 0.8863636363636364.
[32m[I 2023-04-21 02:59:03,346][39m Trial 4408 finished with value: 0.8275862068965518 and parameters: {'objective': 'CrossEntropy', 'colsample_bylevel': 0.0898124008906304, 'depth': 10, 'boosting_type': 'Plain', 'bootstrap_type': 'Bayesian', 'bagging_temperature': 9.825253341220224}. Best is trial 3065 with value: 0.8863636363636364.
[32m[I 2023-04-21 02:59:04,072][39m Trial 4409 finished with value: 0.8409090909090909 and parameters: {'objective': 'CrossEntropy', 'colsample_bylevel': 0.09052085033759222, 'depth': 11, 'boosting_type': 'Plain', 'bootstrap_type': 'Bayesian', 'bagging_temperature': 8.622530315493051}. Best is trial 3065 with value: 0.8863636363636364.
[32m[I 2023-04-21 02:59:04,804][39m Trial 4410 finished with value: 0.8539325842696629 and parameters: {'objective': 'Logloss', 'colsample_bylevel': 0.09056499804138313, 'depth': 10, 'boosting_type': 'Plain', 'bootstrap_type': 'Bayesian', 'bagging_temperature': 8.825715690616319}. Best is trial 3065 with value: 0.8863636363636364.
[32m[I 2023-04-21 02:59:06,073][39m Trial 4411 finished with value: 0.8666666666666666 and parameters: {'objective': 'CrossEntropy', 'colsample_bylevel': 0.07167747233382472, 'depth': 4, 'boosting_type': 'Plain', 'bootstrap_type': 'Bayesian', 'bagging_temperature': 8.346337632088128}. Best is trial 3065 with value: 0.8863636363636364.
[32m[I 2023-04-21 02:59:07,076][39m Trial 4412 finished with value: 0.8666666666666666 and parameters: {'objective': 'Logloss', 'colsample_bylevel': 0.09245586745268917, 'depth': 3, 'boosting_type': 'Plain', 'bootstrap_type': 'Bayesian', 'bagging_temperature': 9.878129428608396}. Best is trial 3065 with value: 0.8863636363636364.
[32m[I 2023-04-21 02:59:08,087][39m Trial 4413 finished with value: 0.8275862068965518 and parameters: {'objective': 'CrossEntropy', 'colsample_bylevel': 0.08515487354580863, 'depth': 11, 'boosting_type': 'Plain', 'bootstrap_type': 'Bayesian', 'bagging_temperature': 9.528954238882877}. Best is trial 3065 with value: 0.8863636363636364.
