[32m[I 2023-04-21 03:19:38,170][39m Trial 5391 finished with value: 0.7727272727272727 and parameters: {'objective': 'CrossEntropy', 'colsample_bylevel': 0.012799324298278021, 'depth': 10, 'boosting_type': 'Ordered', 'bootstrap_type': 'Bayesian', 'bagging_temperature': 9.983803920016248}. Best is trial 3065 with value: 0.8863636363636364.
[32m[I 2023-04-21 03:19:39,187][39m Trial 5392 finished with value: 0.7857142857142858 and parameters: {'objective': 'CrossEntropy', 'colsample_bylevel': 0.07805592924890882, 'depth': 10, 'boosting_type': 'Plain', 'bootstrap_type': 'MVS'}. Best is trial 3065 with value: 0.8863636363636364.
[32m[I 2023-04-21 03:19:40,554][39m Trial 5393 finished with value: 0.8409090909090909 and parameters: {'objective': 'CrossEntropy', 'colsample_bylevel': 0.08022455912144648, 'depth': 10, 'boosting_type': 'Plain', 'bootstrap_type': 'Bayesian', 'bagging_temperature': 5.614584905875775}. Best is trial 3065 with value: 0.8863636363636364.
[32m[I 2023-04-21 03:19:41,544][39m Trial 5394 finished with value: 0.8666666666666666 and parameters: {'objective': 'Logloss', 'colsample_bylevel': 0.08825775146735641, 'depth': 3, 'boosting_type': 'Plain', 'bootstrap_type': 'Bayesian', 'bagging_temperature': 9.416376408879266}. Best is trial 3065 with value: 0.8863636363636364.
[32m[I 2023-04-21 03:19:42,519][39m Trial 5395 finished with value: 0.8539325842696629 and parameters: {'objective': 'Logloss', 'colsample_bylevel': 0.0704431221825232, 'depth': 8, 'boosting_type': 'Plain', 'bootstrap_type': 'Bayesian', 'bagging_temperature': 7.162964010584202}. Best is trial 3065 with value: 0.8863636363636364.
[32m[I 2023-04-21 03:19:43,822][39m Trial 5396 finished with value: 0.8409090909090909 and parameters: {'objective': 'CrossEntropy', 'colsample_bylevel': 0.09801014329267968, 'depth': 8, 'boosting_type': 'Plain', 'bootstrap_type': 'Bayesian', 'bagging_temperature': 9.200983289742009}. Best is trial 3065 with value: 0.8863636363636364.
[32m[I 2023-04-21 03:19:44,839][39m Trial 5397 finished with value: 0.8666666666666666 and parameters: {'objective': 'Logloss', 'colsample_bylevel': 0.07221732554817666, 'depth': 9, 'boosting_type': 'Plain', 'bootstrap_type': 'Bayesian', 'bagging_temperature': 9.515658342828639}. Best is trial 3065 with value: 0.8863636363636364.
[32m[I 2023-04-21 03:19:45,987][39m Trial 5398 finished with value: 0.8409090909090909 and parameters: {'objective': 'CrossEntropy', 'colsample_bylevel': 0.0736116642230258, 'depth': 11, 'boosting_type': 'Plain', 'bootstrap_type': 'Bayesian', 'bagging_temperature': 9.69066950204639}. Best is trial 3065 with value: 0.8863636363636364.
[32m[I 2023-04-21 03:19:47,652][39m Trial 5399 finished with value: 0.8409090909090909 and parameters: {'objective': 'CrossEntropy', 'colsample_bylevel': 0.07451697549263517, 'depth': 9, 'boosting_type': 'Plain', 'bootstrap_type': 'Bayesian', 'bagging_temperature': 9.619251969778013}. Best is trial 3065 with value: 0.8863636363636364.
[32m[I 2023-04-21 03:19:48,354][39m Trial 5400 finished with value: 0.8539325842696629 and parameters: {'objective': 'Logloss', 'colsample_bylevel': 0.07528201783317458, 'depth': 10, 'boosting_type': 'Plain', 'bootstrap_type': 'Bayesian', 'bagging_temperature': 9.994309579226432}. Best is trial 3065 with value: 0.8863636363636364.
[32m[I 2023-04-21 03:19:49,152][39m Trial 5401 finished with value: 0.8275862068965518 and parameters: {'objective': 'CrossEntropy', 'colsample_bylevel': 0.08120636255001748, 'depth': 8, 'boosting_type': 'Plain', 'bootstrap_type': 'Bayesian', 'bagging_temperature': 9.025533500007965}. Best is trial 3065 with value: 0.8863636363636364.
[32m[I 2023-04-21 03:19:50,661][39m Trial 5402 finished with value: 0.8539325842696629 and parameters: {'objective': 'CrossEntropy', 'colsample_bylevel': 0.07343795605947322, 'depth': 11, 'boosting_type': 'Plain', 'bootstrap_type': 'Bayesian', 'bagging_temperature': 9.262448258726504}. Best is trial 3065 with value: 0.8863636363636364.
[32m[I 2023-04-21 03:19:51,408][39m Trial 5403 finished with value: 0.8372093023255814 and parameters: {'objective': 'CrossEntropy', 'colsample_bylevel': 0.08408390287178936, 'depth': 8, 'boosting_type': 'Plain', 'bootstrap_type': 'Bayesian', 'bagging_temperature': 8.922860269956253}. Best is trial 3065 with value: 0.8863636363636364.
[32m[I 2023-04-21 03:19:52,103][39m Trial 5404 finished with value: 0.8666666666666666 and parameters: {'objective': 'CrossEntropy', 'colsample_bylevel': 0.07981651095026532, 'depth': 3, 'boosting_type': 'Plain', 'bootstrap_type': 'Bayesian', 'bagging_temperature': 8.412749641102982}. Best is trial 3065 with value: 0.8863636363636364.
[32m[I 2023-04-21 03:19:53,244][39m Trial 5405 finished with value: 0.8089887640449439 and parameters: {'objective': 'Logloss', 'colsample_bylevel': 0.07686791211055795, 'depth': 2, 'boosting_type': 'Plain', 'bootstrap_type': 'MVS'}. Best is trial 3065 with value: 0.8863636363636364.
[32m[I 2023-04-21 03:19:54,635][39m Trial 5406 finished with value: 0.8791208791208791 and parameters: {'objective': 'CrossEntropy', 'colsample_bylevel': 0.07631865136269841, 'depth': 10, 'boosting_type': 'Plain', 'bootstrap_type': 'Bayesian', 'bagging_temperature': 9.507562184302548}. Best is trial 3065 with value: 0.8863636363636364.
[32m[I 2023-04-21 03:19:55,679][39m Trial 5407 finished with value: 0.8314606741573034 and parameters: {'objective': 'CrossEntropy', 'colsample_bylevel': 0.06927748558259479, 'depth': 12, 'boosting_type': 'Plain', 'bootstrap_type': 'Bernoulli', 'subsample': 0.19479919738701612}. Best is trial 3065 with value: 0.8863636363636364.
[32m[I 2023-04-21 03:19:56,708][39m Trial 5408 finished with value: 0.8275862068965518 and parameters: {'objective': 'CrossEntropy', 'colsample_bylevel': 0.0782378888179638, 'depth': 9, 'boosting_type': 'Plain', 'bootstrap_type': 'MVS'}. Best is trial 3065 with value: 0.8863636363636364.
[32m[I 2023-04-21 03:20:01,173][39m Trial 5409 finished with value: 0.8131868131868132 and parameters: {'objective': 'CrossEntropy', 'colsample_bylevel': 0.07094898536200385, 'depth': 3, 'boosting_type': 'Ordered', 'bootstrap_type': 'Bernoulli', 'subsample': 0.870347893699402}. Best is trial 3065 with value: 0.8863636363636364.
[32m[I 2023-04-21 03:20:02,409][39m Trial 5410 finished with value: 0.8409090909090909 and parameters: {'objective': 'CrossEntropy', 'colsample_bylevel': 0.0590110724895641, 'depth': 3, 'boosting_type': 'Plain', 'bootstrap_type': 'Bayesian', 'bagging_temperature': 9.281738540413508}. Best is trial 3065 with value: 0.8863636363636364.
[32m[I 2023-04-21 03:20:03,744][39m Trial 5411 finished with value: 0.8275862068965518 and parameters: {'objective': 'CrossEntropy', 'colsample_bylevel': 0.08732701145798687, 'depth': 5, 'boosting_type': 'Plain', 'bootstrap_type': 'Bayesian', 'bagging_temperature': 9.85207048671146}. Best is trial 3065 with value: 0.8863636363636364.
[32m[I 2023-04-21 03:20:04,787][39m Trial 5412 finished with value: 0.8539325842696629 and parameters: {'objective': 'CrossEntropy', 'colsample_bylevel': 0.07635034316403969, 'depth': 4, 'boosting_type': 'Plain', 'bootstrap_type': 'Bayesian', 'bagging_temperature': 9.551638073299186}. Best is trial 3065 with value: 0.8863636363636364.
[32m[I 2023-04-21 03:20:06,017][39m Trial 5413 finished with value: 0.8275862068965518 and parameters: {'objective': 'CrossEntropy', 'colsample_bylevel': 0.07219216655032533, 'depth': 9, 'boosting_type': 'Plain', 'bootstrap_type': 'Bayesian', 'bagging_temperature': 9.282069070709902}. Best is trial 3065 with value: 0.8863636363636364.
[32m[I 2023-04-21 03:20:06,907][39m Trial 5414 finished with value: 0.8666666666666666 and parameters: {'objective': 'Logloss', 'colsample_bylevel': 0.0778189926376458, 'depth': 4, 'boosting_type': 'Plain', 'bootstrap_type': 'Bayesian', 'bagging_temperature': 9.552579311476624}. Best is trial 3065 with value: 0.8863636363636364.
[32m[I 2023-04-21 03:20:07,998][39m Trial 5415 finished with value: 0.8666666666666666 and parameters: {'objective': 'CrossEntropy', 'colsample_bylevel': 0.08831560363830604, 'depth': 3, 'boosting_type': 'Plain', 'bootstrap_type': 'Bayesian', 'bagging_temperature': 9.803729859909131}. Best is trial 3065 with value: 0.8863636363636364.
[32m[I 2023-04-21 03:20:09,247][39m Trial 5416 finished with value: 0.8791208791208791 and parameters: {'objective': 'Logloss', 'colsample_bylevel': 0.0758445610849123, 'depth': 10, 'boosting_type': 'Plain', 'bootstrap_type': 'Bayesian', 'bagging_temperature': 9.515931189338538}. Best is trial 3065 with value: 0.8863636363636364.
[32m[I 2023-04-21 03:20:10,453][39m Trial 5417 finished with value: 0.8409090909090909 and parameters: {'objective': 'CrossEntropy', 'colsample_bylevel': 0.07889219034089576, 'depth': 9, 'boosting_type': 'Plain', 'bootstrap_type': 'Bayesian', 'bagging_temperature': 9.58393736738631}. Best is trial 3065 with value: 0.8863636363636364.
[32m[I 2023-04-21 03:20:11,362][39m Trial 5418 finished with value: 0.8666666666666666 and parameters: {'objective': 'CrossEntropy', 'colsample_bylevel': 0.08322098579852279, 'depth': 3, 'boosting_type': 'Plain', 'bootstrap_type': 'Bayesian', 'bagging_temperature': 9.04230099597292}. Best is trial 3065 with value: 0.8863636363636364.
[32m[I 2023-04-21 03:20:12,376][39m Trial 5419 finished with value: 0.8409090909090909 and parameters: {'objective': 'Logloss', 'colsample_bylevel': 0.08999555384662886, 'depth': 4, 'boosting_type': 'Plain', 'bootstrap_type': 'Bayesian', 'bagging_temperature': 6.1455275724212}. Best is trial 3065 with value: 0.8863636363636364.
[32m[I 2023-04-21 03:20:13,243][39m Trial 5420 finished with value: 0.8539325842696629 and parameters: {'objective': 'CrossEntropy', 'colsample_bylevel': 0.07701413940487623, 'depth': 3, 'boosting_type': 'Plain', 'bootstrap_type': 'Bernoulli', 'subsample': 0.8074232274719496}. Best is trial 3065 with value: 0.8863636363636364.
[32m[I 2023-04-21 03:20:13,941][39m Trial 5421 finished with value: 0.8666666666666666 and parameters: {'objective': 'CrossEntropy', 'colsample_bylevel': 0.08216409339968128, 'depth': 3, 'boosting_type': 'Plain', 'bootstrap_type': 'Bayesian', 'bagging_temperature': 9.413681790927972}. Best is trial 3065 with value: 0.8863636363636364.
[32m[I 2023-04-21 03:20:14,943][39m Trial 5422 finished with value: 0.8539325842696629 and parameters: {'objective': 'CrossEntropy', 'colsample_bylevel': 0.08211707387140411, 'depth': 2, 'boosting_type': 'Plain', 'bootstrap_type': 'Bayesian', 'bagging_temperature': 9.22278780213545}. Best is trial 3065 with value: 0.8863636363636364.
[32m[I 2023-04-21 03:20:16,473][39m Trial 5423 finished with value: 0.8666666666666666 and parameters: {'objective': 'Logloss', 'colsample_bylevel': 0.07396691856617135, 'depth': 10, 'boosting_type': 'Plain', 'bootstrap_type': 'Bayesian', 'bagging_temperature': 9.205643530874232}. Best is trial 3065 with value: 0.8863636363636364.
[32m[I 2023-04-21 03:20:17,514][39m Trial 5424 finished with value: 0.8539325842696629 and parameters: {'objective': 'CrossEntropy', 'colsample_bylevel': 0.09403816873325395, 'depth': 3, 'boosting_type': 'Plain', 'bootstrap_type': 'Bayesian', 'bagging_temperature': 8.585847134200879}. Best is trial 3065 with value: 0.8863636363636364.
[32m[I 2023-04-21 03:20:18,857][39m Trial 5425 finished with value: 0.8181818181818182 and parameters: {'objective': 'CrossEntropy', 'colsample_bylevel': 0.08337226646465655, 'depth': 6, 'boosting_type': 'Plain', 'bootstrap_type': 'Bayesian', 'bagging_temperature': 4.852992764814491}. Best is trial 3065 with value: 0.8863636363636364.
[32m[I 2023-04-21 03:20:19,685][39m Trial 5426 finished with value: 0.8539325842696629 and parameters: {'objective': 'CrossEntropy', 'colsample_bylevel': 0.08291790158222677, 'depth': 3, 'boosting_type': 'Plain', 'bootstrap_type': 'Bayesian', 'bagging_temperature': 8.315962544915495}. Best is trial 3065 with value: 0.8863636363636364.
[32m[I 2023-04-21 03:20:20,698][39m Trial 5427 finished with value: 0.8409090909090909 and parameters: {'objective': 'CrossEntropy', 'colsample_bylevel': 0.07583389168389819, 'depth': 8, 'boosting_type': 'Plain', 'bootstrap_type': 'Bayesian', 'bagging_temperature': 8.950564456487092}. Best is trial 3065 with value: 0.8863636363636364.
[32m[I 2023-04-21 03:20:22,116][39m Trial 5428 finished with value: 0.8275862068965518 and parameters: {'objective': 'CrossEntropy', 'colsample_bylevel': 0.09704817911306177, 'depth': 3, 'boosting_type': 'Plain', 'bootstrap_type': 'Bayesian', 'bagging_temperature': 9.340450711192167}. Best is trial 3065 with value: 0.8863636363636364.
[32m[I 2023-04-21 03:20:26,827][39m Trial 5429 finished with value: 0.8409090909090909 and parameters: {'objective': 'Logloss', 'colsample_bylevel': 0.09074711599298473, 'depth': 3, 'boosting_type': 'Ordered', 'bootstrap_type': 'Bayesian', 'bagging_temperature': 9.824156467933314}. Best is trial 3065 with value: 0.8863636363636364.
[32m[I 2023-04-21 03:20:27,885][39m Trial 5430 finished with value: 0.8275862068965518 and parameters: {'objective': 'CrossEntropy', 'colsample_bylevel': 0.08176927281091463, 'depth': 3, 'boosting_type': 'Plain', 'bootstrap_type': 'Bayesian', 'bagging_temperature': 9.336046467831155}. Best is trial 3065 with value: 0.8863636363636364.
[32m[I 2023-04-21 03:20:29,272][39m Trial 5431 finished with value: 0.8539325842696629 and parameters: {'objective': 'CrossEntropy', 'colsample_bylevel': 0.0806275478360878, 'depth': 4, 'boosting_type': 'Plain', 'bootstrap_type': 'Bayesian', 'bagging_temperature': 9.33276886801089}. Best is trial 3065 with value: 0.8863636363636364.
[32m[I 2023-04-21 03:20:30,299][39m Trial 5432 finished with value: 0.8409090909090909 and parameters: {'objective': 'CrossEntropy', 'colsample_bylevel': 0.07501252996592388, 'depth': 12, 'boosting_type': 'Plain', 'bootstrap_type': 'Bayesian', 'bagging_temperature': 8.08006469271641}. Best is trial 3065 with value: 0.8863636363636364.
[32m[I 2023-04-21 03:20:31,345][39m Trial 5433 finished with value: 0.8409090909090909 and parameters: {'objective': 'CrossEntropy', 'colsample_bylevel': 0.0874466266813557, 'depth': 2, 'boosting_type': 'Plain', 'bootstrap_type': 'Bayesian', 'bagging_temperature': 2.6991081247902513}. Best is trial 3065 with value: 0.8863636363636364.
[32m[I 2023-04-21 03:20:32,714][39m Trial 5434 finished with value: 0.8505747126436782 and parameters: {'objective': 'CrossEntropy', 'colsample_bylevel': 0.09785060598646353, 'depth': 10, 'boosting_type': 'Plain', 'bootstrap_type': 'Bayesian', 'bagging_temperature': 9.813755558217201}. Best is trial 3065 with value: 0.8863636363636364.
[32m[I 2023-04-21 03:20:33,709][39m Trial 5435 finished with value: 0.8275862068965518 and parameters: {'objective': 'CrossEntropy', 'colsample_bylevel': 0.08396161936018796, 'depth': 3, 'boosting_type': 'Plain', 'bootstrap_type': 'Bayesian', 'bagging_temperature': 8.350455199935828}. Best is trial 3065 with value: 0.8863636363636364.
[32m[I 2023-04-21 03:20:34,394][39m Trial 5436 finished with value: 0.8539325842696629 and parameters: {'objective': 'CrossEntropy', 'colsample_bylevel': 0.08068412717737683, 'depth': 3, 'boosting_type': 'Plain', 'bootstrap_type': 'Bayesian', 'bagging_temperature': 9.60528101493226}. Best is trial 3065 with value: 0.8863636363636364.
[32m[I 2023-04-21 03:20:35,782][39m Trial 5437 finished with value: 0.8539325842696629 and parameters: {'objective': 'CrossEntropy', 'colsample_bylevel': 0.07535583941316948, 'depth': 8, 'boosting_type': 'Plain', 'bootstrap_type': 'MVS'}. Best is trial 3065 with value: 0.8863636363636364.
[32m[I 2023-04-21 03:20:36,801][39m Trial 5438 finished with value: 0.8539325842696629 and parameters: {'objective': 'CrossEntropy', 'colsample_bylevel': 0.07475521874704248, 'depth': 8, 'boosting_type': 'Plain', 'bootstrap_type': 'Bayesian', 'bagging_temperature': 9.060875136526457}. Best is trial 3065 with value: 0.8863636363636364.
[32m[I 2023-04-21 03:20:37,532][39m Trial 5439 finished with value: 0.8409090909090909 and parameters: {'objective': 'CrossEntropy', 'colsample_bylevel': 0.07514163488661177, 'depth': 12, 'boosting_type': 'Plain', 'bootstrap_type': 'Bayesian', 'bagging_temperature': 7.74172342706634}. Best is trial 3065 with value: 0.8863636363636364.
[32m[I 2023-04-21 03:20:38,747][39m Trial 5440 finished with value: 0.8409090909090909 and parameters: {'objective': 'Logloss', 'colsample_bylevel': 0.07622891165020812, 'depth': 10, 'boosting_type': 'Plain', 'bootstrap_type': 'Bayesian', 'bagging_temperature': 9.829712448114408}. Best is trial 3065 with value: 0.8863636363636364.
[32m[I 2023-04-21 03:20:39,461][39m Trial 5441 finished with value: 0.8666666666666666 and parameters: {'objective': 'Logloss', 'colsample_bylevel': 0.09777012678125371, 'depth': 3, 'boosting_type': 'Plain', 'bootstrap_type': 'Bayesian', 'bagging_temperature': 8.736517526232598}. Best is trial 3065 with value: 0.8863636363636364.
[32m[I 2023-04-21 03:20:40,760][39m Trial 5442 finished with value: 0.8539325842696629 and parameters: {'objective': 'Logloss', 'colsample_bylevel': 0.07724725891390354, 'depth': 10, 'boosting_type': 'Plain', 'bootstrap_type': 'Bayesian', 'bagging_temperature': 9.260899548269249}. Best is trial 3065 with value: 0.8863636363636364.
[32m[I 2023-04-21 03:20:41,634][39m Trial 5443 finished with value: 0.8409090909090909 and parameters: {'objective': 'CrossEntropy', 'colsample_bylevel': 0.07802043147331246, 'depth': 10, 'boosting_type': 'Plain', 'bootstrap_type': 'Bayesian', 'bagging_temperature': 9.4386441727713}. Best is trial 3065 with value: 0.8863636363636364.
[32m[I 2023-04-21 03:20:43,067][39m Trial 5444 finished with value: 0.8139534883720929 and parameters: {'objective': 'CrossEntropy', 'colsample_bylevel': 0.09189707500660178, 'depth': 4, 'boosting_type': 'Plain', 'bootstrap_type': 'Bayesian', 'bagging_temperature': 1.8842546907295192}. Best is trial 3065 with value: 0.8863636363636364.
[32m[I 2023-04-21 03:20:44,089][39m Trial 5445 finished with value: 0.8666666666666666 and parameters: {'objective': 'CrossEntropy', 'colsample_bylevel': 0.07761503558339926, 'depth': 11, 'boosting_type': 'Plain', 'bootstrap_type': 'Bayesian', 'bagging_temperature': 9.441844053015013}. Best is trial 3065 with value: 0.8863636363636364.
[32m[I 2023-04-21 03:20:45,164][39m Trial 5446 finished with value: 0.8409090909090909 and parameters: {'objective': 'CrossEntropy', 'colsample_bylevel': 0.07424821595127393, 'depth': 12, 'boosting_type': 'Plain', 'bootstrap_type': 'Bayesian', 'bagging_temperature': 8.911113231804064}. Best is trial 3065 with value: 0.8863636363636364.
[32m[I 2023-04-21 03:20:49,508][39m Trial 5447 finished with value: 0.8275862068965518 and parameters: {'objective': 'CrossEntropy', 'colsample_bylevel': 0.0786705499032515, 'depth': 10, 'boosting_type': 'Ordered', 'bootstrap_type': 'MVS'}. Best is trial 3065 with value: 0.8863636363636364.
[32m[I 2023-04-21 03:20:50,533][39m Trial 5448 finished with value: 0.8539325842696629 and parameters: {'objective': 'CrossEntropy', 'colsample_bylevel': 0.06975513397794113, 'depth': 10, 'boosting_type': 'Plain', 'bootstrap_type': 'Bayesian', 'bagging_temperature': 9.101522194609291}. Best is trial 3065 with value: 0.8863636363636364.
[32m[I 2023-04-21 03:20:51,896][39m Trial 5449 finished with value: 0.8409090909090909 and parameters: {'objective': 'Logloss', 'colsample_bylevel': 0.07749135066520439, 'depth': 3, 'boosting_type': 'Plain', 'bootstrap_type': 'Bernoulli', 'subsample': 0.2647589480125718}. Best is trial 3065 with value: 0.8863636363636364.
[32m[I 2023-04-21 03:20:52,902][39m Trial 5450 finished with value: 0.8666666666666666 and parameters: {'objective': 'CrossEntropy', 'colsample_bylevel': 0.06454126489732787, 'depth': 11, 'boosting_type': 'Plain', 'bootstrap_type': 'Bayesian', 'bagging_temperature': 9.463919758975582}. Best is trial 3065 with value: 0.8863636363636364.
[32m[I 2023-04-21 03:20:54,046][39m Trial 5451 finished with value: 0.8222222222222222 and parameters: {'objective': 'CrossEntropy', 'colsample_bylevel': 0.05657844950442003, 'depth': 3, 'boosting_type': 'Plain', 'bootstrap_type': 'MVS'}. Best is trial 3065 with value: 0.8863636363636364.
[32m[I 2023-04-21 03:20:55,150][39m Trial 5452 finished with value: 0.8409090909090909 and parameters: {'objective': 'CrossEntropy', 'colsample_bylevel': 0.07872811864861713, 'depth': 3, 'boosting_type': 'Plain', 'bootstrap_type': 'Bayesian', 'bagging_temperature': 9.660628839942937}. Best is trial 3065 with value: 0.8863636363636364.
[32m[I 2023-04-21 03:20:56,215][39m Trial 5453 finished with value: 0.8791208791208791 and parameters: {'objective': 'CrossEntropy', 'colsample_bylevel': 0.07256961549648591, 'depth': 9, 'boosting_type': 'Plain', 'bootstrap_type': 'Bayesian', 'bagging_temperature': 9.400332339736524}. Best is trial 3065 with value: 0.8863636363636364.
[32m[I 2023-04-21 03:20:57,622][39m Trial 5454 finished with value: 0.8666666666666666 and parameters: {'objective': 'Logloss', 'colsample_bylevel': 0.07238743151653071, 'depth': 5, 'boosting_type': 'Plain', 'bootstrap_type': 'Bayesian', 'bagging_temperature': 9.214815062157914}. Best is trial 3065 with value: 0.8863636363636364.
[32m[I 2023-04-21 03:20:59,046][39m Trial 5455 finished with value: 0.8764044943820225 and parameters: {'objective': 'CrossEntropy', 'colsample_bylevel': 0.06433842446295941, 'depth': 3, 'boosting_type': 'Plain', 'bootstrap_type': 'Bayesian', 'bagging_temperature': 9.028362098518187}. Best is trial 3065 with value: 0.8863636363636364.
[32m[I 2023-04-21 03:20:59,838][39m Trial 5456 finished with value: 0.8636363636363636 and parameters: {'objective': 'CrossEntropy', 'colsample_bylevel': 0.09118938375507102, 'depth': 2, 'boosting_type': 'Plain', 'bootstrap_type': 'Bayesian', 'bagging_temperature': 8.385720156920689}. Best is trial 3065 with value: 0.8863636363636364.
