[32m[I 2023-04-21 03:16:51,468][39m Trial 5261 finished with value: 0.8275862068965518 and parameters: {'objective': 'Logloss', 'colsample_bylevel': 0.07761579965361515, 'depth': 9, 'boosting_type': 'Ordered', 'bootstrap_type': 'Bayesian', 'bagging_temperature': 9.330760222486727}. Best is trial 3065 with value: 0.8863636363636364.
[32m[I 2023-04-21 03:16:53,168][39m Trial 5262 finished with value: 0.8409090909090909 and parameters: {'objective': 'CrossEntropy', 'colsample_bylevel': 0.08815599595464171, 'depth': 9, 'boosting_type': 'Plain', 'bootstrap_type': 'Bayesian', 'bagging_temperature': 9.635076586345829}. Best is trial 3065 with value: 0.8863636363636364.
[32m[I 2023-04-21 03:16:54,249][39m Trial 5263 finished with value: 0.8636363636363636 and parameters: {'objective': 'CrossEntropy', 'colsample_bylevel': 0.07871993412294417, 'depth': 10, 'boosting_type': 'Plain', 'bootstrap_type': 'Bayesian', 'bagging_temperature': 8.74730825960144}. Best is trial 3065 with value: 0.8863636363636364.
[32m[I 2023-04-21 03:16:55,328][39m Trial 5264 finished with value: 0.8539325842696629 and parameters: {'objective': 'Logloss', 'colsample_bylevel': 0.07004076941589554, 'depth': 11, 'boosting_type': 'Plain', 'bootstrap_type': 'Bayesian', 'bagging_temperature': 8.796731911005095}. Best is trial 3065 with value: 0.8863636363636364.
[32m[I 2023-04-21 03:16:56,212][39m Trial 5265 finished with value: 0.8505747126436782 and parameters: {'objective': 'CrossEntropy', 'colsample_bylevel': 0.08267515807653555, 'depth': 10, 'boosting_type': 'Plain', 'bootstrap_type': 'Bayesian', 'bagging_temperature': 9.1546136566029}. Best is trial 3065 with value: 0.8863636363636364.
[32m[I 2023-04-21 03:16:56,940][39m Trial 5266 finished with value: 0.8409090909090909 and parameters: {'objective': 'Logloss', 'colsample_bylevel': 0.07292654940200216, 'depth': 9, 'boosting_type': 'Plain', 'bootstrap_type': 'Bayesian', 'bagging_temperature': 9.031770049292069}. Best is trial 3065 with value: 0.8863636363636364.
[32m[I 2023-04-21 03:16:58,046][39m Trial 5267 finished with value: 0.8409090909090909 and parameters: {'objective': 'Logloss', 'colsample_bylevel': 0.08527380068546618, 'depth': 10, 'boosting_type': 'Plain', 'bootstrap_type': 'Bayesian', 'bagging_temperature': 8.035367945147124}. Best is trial 3065 with value: 0.8863636363636364.
[32m[I 2023-04-21 03:16:59,217][39m Trial 5268 finished with value: 0.8666666666666666 and parameters: {'objective': 'CrossEntropy', 'colsample_bylevel': 0.0689090201137826, 'depth': 2, 'boosting_type': 'Plain', 'bootstrap_type': 'Bayesian', 'bagging_temperature': 9.359768222765798}. Best is trial 3065 with value: 0.8863636363636364.
[32m[I 2023-04-21 03:17:00,768][39m Trial 5269 finished with value: 0.8539325842696629 and parameters: {'objective': 'CrossEntropy', 'colsample_bylevel': 0.08163594688770966, 'depth': 3, 'boosting_type': 'Plain', 'bootstrap_type': 'Bayesian', 'bagging_temperature': 9.456324272734626}. Best is trial 3065 with value: 0.8863636363636364.
[32m[I 2023-04-21 03:17:01,592][39m Trial 5270 finished with value: 0.8666666666666666 and parameters: {'objective': 'CrossEntropy', 'colsample_bylevel': 0.09523299493077474, 'depth': 3, 'boosting_type': 'Plain', 'bootstrap_type': 'Bayesian', 'bagging_temperature': 9.334057468251336}. Best is trial 3065 with value: 0.8863636363636364.
[32m[I 2023-04-21 03:17:02,358][39m Trial 5271 finished with value: 0.8235294117647058 and parameters: {'objective': 'CrossEntropy', 'colsample_bylevel': 0.07581641416848102, 'depth': 9, 'boosting_type': 'Plain', 'bootstrap_type': 'Bayesian', 'bagging_temperature': 9.978546933139969}. Best is trial 3065 with value: 0.8863636363636364.
[32m[I 2023-04-21 03:17:03,206][39m Trial 5272 finished with value: 0.8666666666666666 and parameters: {'objective': 'CrossEntropy', 'colsample_bylevel': 0.07963191162448643, 'depth': 3, 'boosting_type': 'Plain', 'bootstrap_type': 'Bayesian', 'bagging_temperature': 9.279294634653459}. Best is trial 3065 with value: 0.8863636363636364.
[32m[I 2023-04-21 03:17:03,916][39m Trial 5273 finished with value: 0.8666666666666666 and parameters: {'objective': 'CrossEntropy', 'colsample_bylevel': 0.08427019012077526, 'depth': 3, 'boosting_type': 'Plain', 'bootstrap_type': 'Bayesian', 'bagging_temperature': 9.804699468801285}. Best is trial 3065 with value: 0.8863636363636364.
[32m[I 2023-04-21 03:17:05,000][39m Trial 5274 finished with value: 0.8666666666666666 and parameters: {'objective': 'CrossEntropy', 'colsample_bylevel': 0.07160396951131139, 'depth': 12, 'boosting_type': 'Plain', 'bootstrap_type': 'Bayesian', 'bagging_temperature': 5.123247001578436}. Best is trial 3065 with value: 0.8863636363636364.
[32m[I 2023-04-21 03:17:06,437][39m Trial 5275 finished with value: 0.8539325842696629 and parameters: {'objective': 'Logloss', 'colsample_bylevel': 0.07090362776554268, 'depth': 4, 'boosting_type': 'Plain', 'bootstrap_type': 'Bayesian', 'bagging_temperature': 9.23627693578344}. Best is trial 3065 with value: 0.8863636363636364.
[32m[I 2023-04-21 03:17:07,498][39m Trial 5276 finished with value: 0.8539325842696629 and parameters: {'objective': 'Logloss', 'colsample_bylevel': 0.0734365476600437, 'depth': 10, 'boosting_type': 'Plain', 'bootstrap_type': 'Bayesian', 'bagging_temperature': 4.485362959242371}. Best is trial 3065 with value: 0.8863636363636364.
[32m[I 2023-04-21 03:17:08,884][39m Trial 5277 finished with value: 0.8409090909090909 and parameters: {'objective': 'CrossEntropy', 'colsample_bylevel': 0.08032689192455829, 'depth': 10, 'boosting_type': 'Plain', 'bootstrap_type': 'Bayesian', 'bagging_temperature': 8.759875554006008}. Best is trial 3065 with value: 0.8863636363636364.
[32m[I 2023-04-21 03:17:09,880][39m Trial 5278 finished with value: 0.8314606741573034 and parameters: {'objective': 'CrossEntropy', 'colsample_bylevel': 0.09108726304776128, 'depth': 3, 'boosting_type': 'Plain', 'bootstrap_type': 'MVS'}. Best is trial 3065 with value: 0.8863636363636364.
[32m[I 2023-04-21 03:17:14,484][39m Trial 5279 finished with value: 0.8409090909090909 and parameters: {'objective': 'CrossEntropy', 'colsample_bylevel': 0.07035712907724287, 'depth': 8, 'boosting_type': 'Ordered', 'bootstrap_type': 'Bayesian', 'bagging_temperature': 9.667315877621137}. Best is trial 3065 with value: 0.8863636363636364.
[32m[I 2023-04-21 03:17:15,673][39m Trial 5280 finished with value: 0.8539325842696629 and parameters: {'objective': 'CrossEntropy', 'colsample_bylevel': 0.08219460477134093, 'depth': 11, 'boosting_type': 'Plain', 'bootstrap_type': 'Bayesian', 'bagging_temperature': 8.578578981334111}. Best is trial 3065 with value: 0.8863636363636364.
[32m[I 2023-04-21 03:17:16,784][39m Trial 5281 finished with value: 0.8409090909090909 and parameters: {'objective': 'CrossEntropy', 'colsample_bylevel': 0.07428604313902604, 'depth': 12, 'boosting_type': 'Plain', 'bootstrap_type': 'Bayesian', 'bagging_temperature': 8.090912755312928}. Best is trial 3065 with value: 0.8863636363636364.
[32m[I 2023-04-21 03:17:17,757][39m Trial 5282 finished with value: 0.8372093023255814 and parameters: {'objective': 'CrossEntropy', 'colsample_bylevel': 0.08465165769476024, 'depth': 9, 'boosting_type': 'Plain', 'bootstrap_type': 'Bayesian', 'bagging_temperature': 9.350638993805461}. Best is trial 3065 with value: 0.8863636363636364.
[32m[I 2023-04-21 03:17:18,674][39m Trial 5283 finished with value: 0.8275862068965518 and parameters: {'objective': 'CrossEntropy', 'colsample_bylevel': 0.08123539372133216, 'depth': 5, 'boosting_type': 'Plain', 'bootstrap_type': 'Bayesian', 'bagging_temperature': 2.1786843008942043}. Best is trial 3065 with value: 0.8863636363636364.
[32m[I 2023-04-21 03:17:20,034][39m Trial 5284 finished with value: 0.8409090909090909 and parameters: {'objective': 'Logloss', 'colsample_bylevel': 0.07714599365942558, 'depth': 11, 'boosting_type': 'Plain', 'bootstrap_type': 'MVS'}. Best is trial 3065 with value: 0.8863636363636364.
[32m[I 2023-04-21 03:17:21,102][39m Trial 5285 finished with value: 0.8275862068965518 and parameters: {'objective': 'CrossEntropy', 'colsample_bylevel': 0.09007962864435047, 'depth': 4, 'boosting_type': 'Plain', 'bootstrap_type': 'Bernoulli', 'subsample': 0.9226350236930141}. Best is trial 3065 with value: 0.8863636363636364.
[32m[I 2023-04-21 03:17:22,574][39m Trial 5286 finished with value: 0.8409090909090909 and parameters: {'objective': 'CrossEntropy', 'colsample_bylevel': 0.07770047833733024, 'depth': 9, 'boosting_type': 'Plain', 'bootstrap_type': 'Bayesian', 'bagging_temperature': 9.976156314912377}. Best is trial 3065 with value: 0.8863636363636364.
[32m[I 2023-04-21 03:17:23,856][39m Trial 5287 finished with value: 0.8666666666666666 and parameters: {'objective': 'Logloss', 'colsample_bylevel': 0.09575232320563368, 'depth': 3, 'boosting_type': 'Plain', 'bootstrap_type': 'Bayesian', 'bagging_temperature': 9.79400074329074}. Best is trial 3065 with value: 0.8863636363636364.
[32m[I 2023-04-21 03:17:24,530][39m Trial 5288 finished with value: 0.8666666666666666 and parameters: {'objective': 'Logloss', 'colsample_bylevel': 0.07142428751397947, 'depth': 5, 'boosting_type': 'Plain', 'bootstrap_type': 'Bayesian', 'bagging_temperature': 9.232191620508527}. Best is trial 3065 with value: 0.8863636363636364.
[32m[I 2023-04-21 03:17:25,349][39m Trial 5289 finished with value: 0.8539325842696629 and parameters: {'objective': 'CrossEntropy', 'colsample_bylevel': 0.0725424733936333, 'depth': 8, 'boosting_type': 'Plain', 'bootstrap_type': 'Bayesian', 'bagging_temperature': 9.626145411728169}. Best is trial 3065 with value: 0.8863636363636364.
[32m[I 2023-04-21 03:17:26,182][39m Trial 5290 finished with value: 0.8505747126436782 and parameters: {'objective': 'Logloss', 'colsample_bylevel': 0.06765923163943013, 'depth': 3, 'boosting_type': 'Plain', 'bootstrap_type': 'Bayesian', 'bagging_temperature': 5.360016555422616}. Best is trial 3065 with value: 0.8863636363636364.
[32m[I 2023-04-21 03:17:26,906][39m Trial 5291 finished with value: 0.8409090909090909 and parameters: {'objective': 'Logloss', 'colsample_bylevel': 0.07085033994180337, 'depth': 4, 'boosting_type': 'Plain', 'bootstrap_type': 'Bayesian', 'bagging_temperature': 9.30463137491518}. Best is trial 3065 with value: 0.8863636363636364.
[32m[I 2023-04-21 03:17:27,850][39m Trial 5292 finished with value: 0.8409090909090909 and parameters: {'objective': 'CrossEntropy', 'colsample_bylevel': 0.077919141508842, 'depth': 2, 'boosting_type': 'Plain', 'bootstrap_type': 'MVS'}. Best is trial 3065 with value: 0.8863636363636364.
[32m[I 2023-04-21 03:17:29,173][39m Trial 5293 finished with value: 0.8505747126436782 and parameters: {'objective': 'CrossEntropy', 'colsample_bylevel': 0.09094073013548368, 'depth': 10, 'boosting_type': 'Plain', 'bootstrap_type': 'Bayesian', 'bagging_temperature': 9.789952941586387}. Best is trial 3065 with value: 0.8863636363636364.
[32m[I 2023-04-21 03:17:30,351][39m Trial 5294 finished with value: 0.8275862068965518 and parameters: {'objective': 'CrossEntropy', 'colsample_bylevel': 0.04276575390503768, 'depth': 9, 'boosting_type': 'Plain', 'bootstrap_type': 'Bayesian', 'bagging_temperature': 5.574697280922776}. Best is trial 3065 with value: 0.8863636363636364.
[32m[I 2023-04-21 03:17:31,402][39m Trial 5295 finished with value: 0.8539325842696629 and parameters: {'objective': 'CrossEntropy', 'colsample_bylevel': 0.0669136832534356, 'depth': 7, 'boosting_type': 'Plain', 'bootstrap_type': 'Bayesian', 'bagging_temperature': 9.376354526843299}. Best is trial 3065 with value: 0.8863636363636364.
[32m[I 2023-04-21 03:17:35,941][39m Trial 5296 finished with value: 0.8275862068965518 and parameters: {'objective': 'CrossEntropy', 'colsample_bylevel': 0.06906630626222061, 'depth': 7, 'boosting_type': 'Ordered', 'bootstrap_type': 'Bayesian', 'bagging_temperature': 9.328539767856197}. Best is trial 3065 with value: 0.8863636363636364.
[32m[I 2023-04-21 03:17:37,274][39m Trial 5297 finished with value: 0.8636363636363636 and parameters: {'objective': 'CrossEntropy', 'colsample_bylevel': 0.0771280565478683, 'depth': 9, 'boosting_type': 'Plain', 'bootstrap_type': 'Bayesian', 'bagging_temperature': 9.768710471683171}. Best is trial 3065 with value: 0.8863636363636364.
[32m[I 2023-04-21 03:17:38,310][39m Trial 5298 finished with value: 0.8314606741573034 and parameters: {'objective': 'CrossEntropy', 'colsample_bylevel': 0.08060045898185872, 'depth': 3, 'boosting_type': 'Plain', 'bootstrap_type': 'Bernoulli', 'subsample': 0.8960361990787211}. Best is trial 3065 with value: 0.8863636363636364.
[32m[I 2023-04-21 03:17:39,957][39m Trial 5299 finished with value: 0.8666666666666666 and parameters: {'objective': 'CrossEntropy', 'colsample_bylevel': 0.0809483099547026, 'depth': 3, 'boosting_type': 'Plain', 'bootstrap_type': 'Bayesian', 'bagging_temperature': 8.865448215841756}. Best is trial 3065 with value: 0.8863636363636364.
[32m[I 2023-04-21 03:17:40,657][39m Trial 5300 finished with value: 0.8539325842696629 and parameters: {'objective': 'CrossEntropy', 'colsample_bylevel': 0.07903541884489158, 'depth': 3, 'boosting_type': 'Plain', 'bootstrap_type': 'Bayesian', 'bagging_temperature': 9.802615111539119}. Best is trial 3065 with value: 0.8863636363636364.
[32m[I 2023-04-21 03:17:41,518][39m Trial 5301 finished with value: 0.8539325842696629 and parameters: {'objective': 'CrossEntropy', 'colsample_bylevel': 0.06858576171056073, 'depth': 4, 'boosting_type': 'Plain', 'bootstrap_type': 'Bayesian', 'bagging_temperature': 8.657275239405227}. Best is trial 3065 with value: 0.8863636363636364.
[32m[I 2023-04-21 03:17:42,894][39m Trial 5302 finished with value: 0.8539325842696629 and parameters: {'objective': 'CrossEntropy', 'colsample_bylevel': 0.09225801578052693, 'depth': 3, 'boosting_type': 'Plain', 'bootstrap_type': 'Bayesian', 'bagging_temperature': 9.99451193997512}. Best is trial 3065 with value: 0.8863636363636364.
[32m[I 2023-04-21 03:17:44,029][39m Trial 5303 finished with value: 0.8409090909090909 and parameters: {'objective': 'CrossEntropy', 'colsample_bylevel': 0.08173411526513752, 'depth': 10, 'boosting_type': 'Plain', 'bootstrap_type': 'Bayesian', 'bagging_temperature': 8.744917486158634}. Best is trial 3065 with value: 0.8863636363636364.
[32m[I 2023-04-21 03:17:45,187][39m Trial 5304 finished with value: 0.8666666666666666 and parameters: {'objective': 'CrossEntropy', 'colsample_bylevel': 0.07686729203769349, 'depth': 5, 'boosting_type': 'Plain', 'bootstrap_type': 'Bayesian', 'bagging_temperature': 9.997643485271501}. Best is trial 3065 with value: 0.8863636363636364.
[32m[I 2023-04-21 03:17:46,441][39m Trial 5305 finished with value: 0.8505747126436782 and parameters: {'objective': 'CrossEntropy', 'colsample_bylevel': 0.07898108299083764, 'depth': 10, 'boosting_type': 'Plain', 'bootstrap_type': 'Bayesian', 'bagging_temperature': 9.655487268043046}. Best is trial 3065 with value: 0.8863636363636364.
[32m[I 2023-04-21 03:17:47,279][39m Trial 5306 finished with value: 0.8604651162790697 and parameters: {'objective': 'CrossEntropy', 'colsample_bylevel': 0.0759511925911582, 'depth': 9, 'boosting_type': 'Plain', 'bootstrap_type': 'MVS'}. Best is trial 3065 with value: 0.8863636363636364.
[32m[I 2023-04-21 03:17:48,150][39m Trial 5307 finished with value: 0.8275862068965518 and parameters: {'objective': 'CrossEntropy', 'colsample_bylevel': 0.07749868892411434, 'depth': 8, 'boosting_type': 'Plain', 'bootstrap_type': 'Bayesian', 'bagging_temperature': 2.6222200296671367}. Best is trial 3065 with value: 0.8863636363636364.
[32m[I 2023-04-21 03:17:48,955][39m Trial 5308 finished with value: 0.8539325842696629 and parameters: {'objective': 'CrossEntropy', 'colsample_bylevel': 0.08024521799308901, 'depth': 8, 'boosting_type': 'Plain', 'bootstrap_type': 'Bayesian', 'bagging_temperature': 9.608766635940635}. Best is trial 3065 with value: 0.8863636363636364.
[32m[I 2023-04-21 03:17:49,931][39m Trial 5309 finished with value: 0.8666666666666666 and parameters: {'objective': 'CrossEntropy', 'colsample_bylevel': 0.0791855883739343, 'depth': 11, 'boosting_type': 'Plain', 'bootstrap_type': 'Bayesian', 'bagging_temperature': 9.963302337682114}. Best is trial 3065 with value: 0.8863636363636364.
[32m[I 2023-04-21 03:17:50,952][39m Trial 5310 finished with value: 0.8444444444444446 and parameters: {'objective': 'CrossEntropy', 'colsample_bylevel': 0.06540018342027384, 'depth': 3, 'boosting_type': 'Plain', 'bootstrap_type': 'Bernoulli', 'subsample': 0.1645738466329511}. Best is trial 3065 with value: 0.8863636363636364.
[32m[I 2023-04-21 03:17:52,263][39m Trial 5311 finished with value: 0.8409090909090909 and parameters: {'objective': 'CrossEntropy', 'colsample_bylevel': 0.07449308494453873, 'depth': 10, 'boosting_type': 'Plain', 'bootstrap_type': 'Bayesian', 'bagging_temperature': 9.502573038257081}. Best is trial 3065 with value: 0.8863636363636364.
[32m[I 2023-04-21 03:17:53,926][39m Trial 5312 finished with value: 0.8666666666666666 and parameters: {'objective': 'Logloss', 'colsample_bylevel': 0.071242916785789, 'depth': 9, 'boosting_type': 'Plain', 'bootstrap_type': 'Bayesian', 'bagging_temperature': 9.51553297294106}. Best is trial 3065 with value: 0.8863636363636364.
[32m[I 2023-04-21 03:17:54,743][39m Trial 5313 finished with value: 0.8409090909090909 and parameters: {'objective': 'CrossEntropy', 'colsample_bylevel': 0.07290064372402455, 'depth': 3, 'boosting_type': 'Plain', 'bootstrap_type': 'Bayesian', 'bagging_temperature': 9.616178603738033}. Best is trial 3065 with value: 0.8863636363636364.
[32m[I 2023-04-21 03:17:55,544][39m Trial 5314 finished with value: 0.8409090909090909 and parameters: {'objective': 'Logloss', 'colsample_bylevel': 0.070901348320448, 'depth': 11, 'boosting_type': 'Plain', 'bootstrap_type': 'Bayesian', 'bagging_temperature': 2.8739237199620735}. Best is trial 3065 with value: 0.8863636363636364.
[32m[I 2023-04-21 03:17:57,079][39m Trial 5315 finished with value: 0.8409090909090909 and parameters: {'objective': 'CrossEntropy', 'colsample_bylevel': 0.09076517640687294, 'depth': 3, 'boosting_type': 'Plain', 'bootstrap_type': 'Bayesian', 'bagging_temperature': 9.108938865272636}. Best is trial 3065 with value: 0.8863636363636364.
[32m[I 2023-04-21 03:18:01,945][39m Trial 5316 finished with value: 0.8539325842696629 and parameters: {'objective': 'CrossEntropy', 'colsample_bylevel': 0.07940229632034458, 'depth': 4, 'boosting_type': 'Ordered', 'bootstrap_type': 'Bayesian', 'bagging_temperature': 8.6701505500475}. Best is trial 3065 with value: 0.8863636363636364.
[32m[I 2023-04-21 03:18:03,256][39m Trial 5317 finished with value: 0.8409090909090909 and parameters: {'objective': 'Logloss', 'colsample_bylevel': 0.0686820624472272, 'depth': 9, 'boosting_type': 'Plain', 'bootstrap_type': 'Bayesian', 'bagging_temperature': 9.989488559879527}. Best is trial 3065 with value: 0.8863636363636364.
[32m[I 2023-04-21 03:18:04,611][39m Trial 5318 finished with value: 0.8409090909090909 and parameters: {'objective': 'CrossEntropy', 'colsample_bylevel': 0.08640755540940948, 'depth': 3, 'boosting_type': 'Plain', 'bootstrap_type': 'Bayesian', 'bagging_temperature': 4.260753288357428}. Best is trial 3065 with value: 0.8863636363636364.
[32m[I 2023-04-21 03:18:05,614][39m Trial 5319 finished with value: 0.8409090909090909 and parameters: {'objective': 'CrossEntropy', 'colsample_bylevel': 0.0742228506255181, 'depth': 3, 'boosting_type': 'Plain', 'bootstrap_type': 'Bayesian', 'bagging_temperature': 9.020953853739766}. Best is trial 3065 with value: 0.8863636363636364.
[32m[I 2023-04-21 03:18:06,526][39m Trial 5320 finished with value: 0.8666666666666666 and parameters: {'objective': 'CrossEntropy', 'colsample_bylevel': 0.06436352307228531, 'depth': 9, 'boosting_type': 'Plain', 'bootstrap_type': 'Bayesian', 'bagging_temperature': 9.63885825152012}. Best is trial 3065 with value: 0.8863636363636364.
[32m[I 2023-04-21 03:18:07,861][39m Trial 5321 finished with value: 0.8539325842696629 and parameters: {'objective': 'Logloss', 'colsample_bylevel': 0.07466534693657613, 'depth': 5, 'boosting_type': 'Plain', 'bootstrap_type': 'Bayesian', 'bagging_temperature': 8.379196216271117}. Best is trial 3065 with value: 0.8863636363636364.
[32m[I 2023-04-21 03:18:08,829][39m Trial 5322 finished with value: 0.8666666666666666 and parameters: {'objective': 'CrossEntropy', 'colsample_bylevel': 0.07096947673698953, 'depth': 10, 'boosting_type': 'Plain', 'bootstrap_type': 'Bayesian', 'bagging_temperature': 8.807617353835608}. Best is trial 3065 with value: 0.8863636363636364.
[32m[I 2023-04-21 03:18:09,543][39m Trial 5323 finished with value: 0.8666666666666666 and parameters: {'objective': 'Logloss', 'colsample_bylevel': 0.08913559226596279, 'depth': 3, 'boosting_type': 'Plain', 'bootstrap_type': 'Bayesian', 'bagging_temperature': 8.26619864038729}. Best is trial 3065 with value: 0.8863636363636364.
[32m[I 2023-04-21 03:18:10,850][39m Trial 5324 finished with value: 0.8409090909090909 and parameters: {'objective': 'CrossEntropy', 'colsample_bylevel': 0.08756657710223867, 'depth': 2, 'boosting_type': 'Plain', 'bootstrap_type': 'Bayesian', 'bagging_temperature': 9.635331053496916}. Best is trial 3065 with value: 0.8863636363636364.
[32m[I 2023-04-21 03:18:11,902][39m Trial 5325 finished with value: 0.8539325842696629 and parameters: {'objective': 'CrossEntropy', 'colsample_bylevel': 0.07145360261846458, 'depth': 11, 'boosting_type': 'Plain', 'bootstrap_type': 'Bayesian', 'bagging_temperature': 9.1384826767228}. Best is trial 3065 with value: 0.8863636363636364.
