[32m[I 2023-04-21 02:27:50,994][39m Trial 2841 finished with value: 0.8409090909090909 and parameters: {'objective': 'Logloss', 'colsample_bylevel': 0.07366485320093583, 'depth': 10, 'boosting_type': 'Plain', 'bootstrap_type': 'Bayesian', 'bagging_temperature': 9.143697509809643}. Best is trial 98 with value: 0.8791208791208791.
[32m[I 2023-04-21 02:27:52,341][39m Trial 2842 finished with value: 0.8539325842696629 and parameters: {'objective': 'CrossEntropy', 'colsample_bylevel': 0.09463075900054553, 'depth': 9, 'boosting_type': 'Plain', 'bootstrap_type': 'Bayesian', 'bagging_temperature': 8.240307986410357}. Best is trial 98 with value: 0.8791208791208791.
[32m[I 2023-04-21 02:27:53,127][39m Trial 2843 finished with value: 0.8666666666666666 and parameters: {'objective': 'CrossEntropy', 'colsample_bylevel': 0.05951466811397278, 'depth': 8, 'boosting_type': 'Plain', 'bootstrap_type': 'Bayesian', 'bagging_temperature': 8.577323960241051}. Best is trial 98 with value: 0.8791208791208791.
[32m[I 2023-04-21 02:27:53,755][39m Trial 2844 finished with value: 0.8666666666666666 and parameters: {'objective': 'CrossEntropy', 'colsample_bylevel': 0.08088890314063091, 'depth': 3, 'boosting_type': 'Plain', 'bootstrap_type': 'Bayesian', 'bagging_temperature': 9.622021492958627}. Best is trial 98 with value: 0.8791208791208791.
[32m[I 2023-04-21 02:27:54,776][39m Trial 2845 finished with value: 0.8539325842696629 and parameters: {'objective': 'CrossEntropy', 'colsample_bylevel': 0.07924065763835579, 'depth': 3, 'boosting_type': 'Plain', 'bootstrap_type': 'Bayesian', 'bagging_temperature': 9.867265074204106}. Best is trial 98 with value: 0.8791208791208791.
[32m[I 2023-04-21 02:27:55,921][39m Trial 2846 finished with value: 0.8539325842696629 and parameters: {'objective': 'CrossEntropy', 'colsample_bylevel': 0.07820671322323472, 'depth': 7, 'boosting_type': 'Plain', 'bootstrap_type': 'Bayesian', 'bagging_temperature': 9.991565778109907}. Best is trial 98 with value: 0.8791208791208791.
[32m[I 2023-04-21 02:27:56,902][39m Trial 2847 finished with value: 0.8791208791208791 and parameters: {'objective': 'CrossEntropy', 'colsample_bylevel': 0.08210238241417435, 'depth': 3, 'boosting_type': 'Plain', 'bootstrap_type': 'Bayesian', 'bagging_temperature': 8.815809922352194}. Best is trial 98 with value: 0.8791208791208791.
[32m[I 2023-04-21 02:27:57,836][39m Trial 2848 finished with value: 0.8539325842696629 and parameters: {'objective': 'CrossEntropy', 'colsample_bylevel': 0.07155024992442796, 'depth': 4, 'boosting_type': 'Plain', 'bootstrap_type': 'Bayesian', 'bagging_temperature': 9.982348224457004}. Best is trial 98 with value: 0.8791208791208791.
[32m[I 2023-04-21 02:27:58,876][39m Trial 2849 finished with value: 0.8314606741573034 and parameters: {'objective': 'CrossEntropy', 'colsample_bylevel': 0.07968015619635532, 'depth': 10, 'boosting_type': 'Plain', 'bootstrap_type': 'Bayesian', 'bagging_temperature': 9.535444188430482}. Best is trial 98 with value: 0.8791208791208791.
[32m[I 2023-04-21 02:27:59,833][39m Trial 2850 finished with value: 0.8275862068965518 and parameters: {'objective': 'CrossEntropy', 'colsample_bylevel': 0.08127396091343421, 'depth': 11, 'boosting_type': 'Plain', 'bootstrap_type': 'Bayesian', 'bagging_temperature': 9.612602826158147}. Best is trial 98 with value: 0.8791208791208791.
[32m[I 2023-04-21 02:28:00,443][39m Trial 2851 finished with value: 0.8791208791208791 and parameters: {'objective': 'CrossEntropy', 'colsample_bylevel': 0.08071356535399944, 'depth': 3, 'boosting_type': 'Plain', 'bootstrap_type': 'Bayesian', 'bagging_temperature': 9.347186005389151}. Best is trial 98 with value: 0.8791208791208791.
[32m[I 2023-04-21 02:28:01,059][39m Trial 2852 finished with value: 0.8539325842696629 and parameters: {'objective': 'CrossEntropy', 'colsample_bylevel': 0.07101017302852684, 'depth': 4, 'boosting_type': 'Plain', 'bootstrap_type': 'Bayesian', 'bagging_temperature': 9.161011381529532}. Best is trial 98 with value: 0.8791208791208791.
[32m[I 2023-04-21 02:28:03,600][39m Trial 2854 finished with value: 0.8409090909090909 and parameters: {'objective': 'CrossEntropy', 'colsample_bylevel': 0.07495920945306164, 'depth': 9, 'boosting_type': 'Plain', 'bootstrap_type': 'Bayesian', 'bagging_temperature': 8.122658703830856}. Best is trial 98 with value: 0.8791208791208791.
[32m[I 2023-04-21 02:28:04,601][39m Trial 2855 finished with value: 0.8666666666666666 and parameters: {'objective': 'CrossEntropy', 'colsample_bylevel': 0.07938377106761989, 'depth': 3, 'boosting_type': 'Plain', 'bootstrap_type': 'Bayesian', 'bagging_temperature': 6.141215515241384}. Best is trial 98 with value: 0.8791208791208791.
[32m[I 2023-04-21 02:28:05,712][39m Trial 2856 finished with value: 0.8539325842696629 and parameters: {'objective': 'Logloss', 'colsample_bylevel': 0.07476613216622595, 'depth': 9, 'boosting_type': 'Plain', 'bootstrap_type': 'Bayesian', 'bagging_temperature': 7.953743566361217}. Best is trial 98 with value: 0.8791208791208791.
[32m[I 2023-04-21 02:28:06,359][39m Trial 2857 finished with value: 0.8666666666666666 and parameters: {'objective': 'CrossEntropy', 'colsample_bylevel': 0.07730300657147895, 'depth': 2, 'boosting_type': 'Plain', 'bootstrap_type': 'Bayesian', 'bagging_temperature': 9.081571743056577}. Best is trial 98 with value: 0.8791208791208791.
[32m[I 2023-04-21 02:28:07,523][39m Trial 2858 finished with value: 0.8791208791208791 and parameters: {'objective': 'CrossEntropy', 'colsample_bylevel': 0.08167783968535798, 'depth': 3, 'boosting_type': 'Plain', 'bootstrap_type': 'Bayesian', 'bagging_temperature': 9.180498687355437}. Best is trial 98 with value: 0.8791208791208791.
[32m[I 2023-04-21 02:28:08,292][39m Trial 2859 finished with value: 0.8539325842696629 and parameters: {'objective': 'CrossEntropy', 'colsample_bylevel': 0.08388393901483136, 'depth': 9, 'boosting_type': 'Plain', 'bootstrap_type': 'Bayesian', 'bagging_temperature': 9.407641294931144}. Best is trial 98 with value: 0.8791208791208791.
[32m[I 2023-04-21 02:28:13,578][39m Trial 2860 finished with value: 0.8275862068965518 and parameters: {'objective': 'CrossEntropy', 'colsample_bylevel': 0.08333547930854154, 'depth': 10, 'boosting_type': 'Ordered', 'bootstrap_type': 'Bayesian', 'bagging_temperature': 9.704686469548585}. Best is trial 98 with value: 0.8791208791208791.
[32m[I 2023-04-21 02:28:14,936][39m Trial 2861 finished with value: 0.8636363636363636 and parameters: {'objective': 'CrossEntropy', 'colsample_bylevel': 0.08448931895022956, 'depth': 9, 'boosting_type': 'Plain', 'bootstrap_type': 'Bayesian', 'bagging_temperature': 8.852116901425777}. Best is trial 98 with value: 0.8791208791208791.
[32m[I 2023-04-21 02:28:15,761][39m Trial 2862 finished with value: 0.8791208791208791 and parameters: {'objective': 'CrossEntropy', 'colsample_bylevel': 0.07641715267629702, 'depth': 10, 'boosting_type': 'Plain', 'bootstrap_type': 'Bayesian', 'bagging_temperature': 9.495582415844655}. Best is trial 98 with value: 0.8791208791208791.
[32m[I 2023-04-21 02:28:16,699][39m Trial 2863 finished with value: 0.8409090909090909 and parameters: {'objective': 'CrossEntropy', 'colsample_bylevel': 0.07736837675155535, 'depth': 3, 'boosting_type': 'Plain', 'bootstrap_type': 'Bernoulli', 'subsample': 0.8391543268931567}. Best is trial 98 with value: 0.8791208791208791.
[32m[I 2023-04-21 02:28:18,104][39m Trial 2864 finished with value: 0.8539325842696629 and parameters: {'objective': 'Logloss', 'colsample_bylevel': 0.07855591140073408, 'depth': 9, 'boosting_type': 'Plain', 'bootstrap_type': 'Bayesian', 'bagging_temperature': 8.922918106698532}. Best is trial 98 with value: 0.8791208791208791.
[32m[I 2023-04-21 02:28:19,100][39m Trial 2865 finished with value: 0.8409090909090909 and parameters: {'objective': 'CrossEntropy', 'colsample_bylevel': 0.07638981736692378, 'depth': 4, 'boosting_type': 'Plain', 'bootstrap_type': 'Bayesian', 'bagging_temperature': 9.988887497741016}. Best is trial 98 with value: 0.8791208791208791.
[32m[I 2023-04-21 02:28:19,865][39m Trial 2866 finished with value: 0.8275862068965518 and parameters: {'objective': 'CrossEntropy', 'colsample_bylevel': 0.07298559844965356, 'depth': 4, 'boosting_type': 'Plain', 'bootstrap_type': 'MVS'}. Best is trial 98 with value: 0.8791208791208791.
[32m[I 2023-04-21 02:28:20,558][39m Trial 2867 finished with value: 0.8636363636363636 and parameters: {'objective': 'CrossEntropy', 'colsample_bylevel': 0.07251563056963062, 'depth': 9, 'boosting_type': 'Plain', 'bootstrap_type': 'Bernoulli', 'subsample': 0.5955227410510117}. Best is trial 98 with value: 0.8791208791208791.
[32m[I 2023-04-21 02:28:21,346][39m Trial 2868 finished with value: 0.8539325842696629 and parameters: {'objective': 'CrossEntropy', 'colsample_bylevel': 0.08851290618020025, 'depth': 3, 'boosting_type': 'Plain', 'bootstrap_type': 'Bayesian', 'bagging_temperature': 8.996119198574569}. Best is trial 98 with value: 0.8791208791208791.
[32m[I 2023-04-21 02:28:22,212][39m Trial 2869 finished with value: 0.8409090909090909 and parameters: {'objective': 'CrossEntropy', 'colsample_bylevel': 0.08535719902354715, 'depth': 2, 'boosting_type': 'Plain', 'bootstrap_type': 'MVS'}. Best is trial 98 with value: 0.8791208791208791.
[32m[I 2023-04-21 02:28:23,010][39m Trial 2870 finished with value: 0.8409090909090909 and parameters: {'objective': 'CrossEntropy', 'colsample_bylevel': 0.09138349778793435, 'depth': 3, 'boosting_type': 'Plain', 'bootstrap_type': 'Bayesian', 'bagging_temperature': 2.9559341419111003}. Best is trial 98 with value: 0.8791208791208791.
[32m[I 2023-04-21 02:28:23,837][39m Trial 2871 finished with value: 0.8275862068965518 and parameters: {'objective': 'Logloss', 'colsample_bylevel': 0.07336333014263229, 'depth': 10, 'boosting_type': 'Plain', 'bootstrap_type': 'MVS'}. Best is trial 98 with value: 0.8791208791208791.
[32m[I 2023-04-21 02:28:25,025][39m Trial 2872 finished with value: 0.8666666666666666 and parameters: {'objective': 'CrossEntropy', 'colsample_bylevel': 0.07554804348758092, 'depth': 9, 'boosting_type': 'Plain', 'bootstrap_type': 'Bayesian', 'bagging_temperature': 9.1733311208597}. Best is trial 98 with value: 0.8791208791208791.
[32m[I 2023-04-21 02:28:25,908][39m Trial 2873 finished with value: 0.8666666666666666 and parameters: {'objective': 'CrossEntropy', 'colsample_bylevel': 0.08156402703649146, 'depth': 3, 'boosting_type': 'Plain', 'bootstrap_type': 'Bayesian', 'bagging_temperature': 9.729900423940755}. Best is trial 98 with value: 0.8791208791208791.
[32m[I 2023-04-21 02:28:26,785][39m Trial 2874 finished with value: 0.8139534883720929 and parameters: {'objective': 'CrossEntropy', 'colsample_bylevel': 0.07844752225451739, 'depth': 1, 'boosting_type': 'Plain', 'bootstrap_type': 'Bayesian', 'bagging_temperature': 9.684790177666482}. Best is trial 98 with value: 0.8791208791208791.
[32m[I 2023-04-21 02:28:27,440][39m Trial 2875 finished with value: 0.8666666666666666 and parameters: {'objective': 'CrossEntropy', 'colsample_bylevel': 0.08157082554967822, 'depth': 3, 'boosting_type': 'Plain', 'bootstrap_type': 'Bayesian', 'bagging_temperature': 9.179644540696136}. Best is trial 98 with value: 0.8791208791208791.
[32m[I 2023-04-21 02:28:28,502][39m Trial 2876 finished with value: 0.8095238095238095 and parameters: {'objective': 'CrossEntropy', 'colsample_bylevel': 0.04889692815616141, 'depth': 2, 'boosting_type': 'Plain', 'bootstrap_type': 'Bayesian', 'bagging_temperature': 9.772186276115974}. Best is trial 98 with value: 0.8791208791208791.
[32m[I 2023-04-21 02:28:29,529][39m Trial 2877 finished with value: 0.8275862068965518 and parameters: {'objective': 'CrossEntropy', 'colsample_bylevel': 0.0831739546424295, 'depth': 12, 'boosting_type': 'Plain', 'bootstrap_type': 'Bayesian', 'bagging_temperature': 9.543242094924052}. Best is trial 98 with value: 0.8791208791208791.
[32m[I 2023-04-21 02:28:30,540][39m Trial 2878 finished with value: 0.8409090909090909 and parameters: {'objective': 'CrossEntropy', 'colsample_bylevel': 0.07938437148154273, 'depth': 3, 'boosting_type': 'Plain', 'bootstrap_type': 'Bayesian', 'bagging_temperature': 9.781611428942488}. Best is trial 98 with value: 0.8791208791208791.
[32m[I 2023-04-21 02:28:35,353][39m Trial 2879 finished with value: 0.8666666666666666 and parameters: {'objective': 'CrossEntropy', 'colsample_bylevel': 0.08841286006065704, 'depth': 2, 'boosting_type': 'Ordered', 'bootstrap_type': 'Bayesian', 'bagging_temperature': 9.014398163492354}. Best is trial 98 with value: 0.8791208791208791.
[32m[I 2023-04-21 02:28:36,273][39m Trial 2880 finished with value: 0.8275862068965518 and parameters: {'objective': 'CrossEntropy', 'colsample_bylevel': 0.09689811738074225, 'depth': 3, 'boosting_type': 'Plain', 'bootstrap_type': 'Bayesian', 'bagging_temperature': 9.428815399051928}. Best is trial 98 with value: 0.8791208791208791.
[32m[I 2023-04-21 02:28:37,233][39m Trial 2881 finished with value: 0.8275862068965518 and parameters: {'objective': 'CrossEntropy', 'colsample_bylevel': 0.0786667680468403, 'depth': 4, 'boosting_type': 'Plain', 'bootstrap_type': 'Bernoulli', 'subsample': 0.5488076120235238}. Best is trial 98 with value: 0.8791208791208791.
[32m[I 2023-04-21 02:28:37,957][39m Trial 2882 finished with value: 0.8539325842696629 and parameters: {'objective': 'CrossEntropy', 'colsample_bylevel': 0.08198396794868185, 'depth': 3, 'boosting_type': 'Plain', 'bootstrap_type': 'Bayesian', 'bagging_temperature': 8.979483772883915}. Best is trial 98 with value: 0.8791208791208791.
[32m[I 2023-04-21 02:28:39,197][39m Trial 2883 finished with value: 0.8409090909090909 and parameters: {'objective': 'CrossEntropy', 'colsample_bylevel': 0.07935412803647757, 'depth': 3, 'boosting_type': 'Plain', 'bootstrap_type': 'Bayesian', 'bagging_temperature': 9.994908983048274}. Best is trial 98 with value: 0.8791208791208791.
[32m[I 2023-04-21 02:28:40,116][39m Trial 2884 finished with value: 0.8666666666666666 and parameters: {'objective': 'CrossEntropy', 'colsample_bylevel': 0.0960657068686366, 'depth': 3, 'boosting_type': 'Plain', 'bootstrap_type': 'Bayesian', 'bagging_temperature': 9.076370337063393}. Best is trial 98 with value: 0.8791208791208791.
[32m[I 2023-04-21 02:28:41,560][39m Trial 2885 finished with value: 0.8409090909090909 and parameters: {'objective': 'CrossEntropy', 'colsample_bylevel': 0.07673295256924617, 'depth': 9, 'boosting_type': 'Plain', 'bootstrap_type': 'Bayesian', 'bagging_temperature': 9.79373096035613}. Best is trial 98 with value: 0.8791208791208791.
[32m[I 2023-04-21 02:28:42,211][39m Trial 2886 finished with value: 0.8539325842696629 and parameters: {'objective': 'CrossEntropy', 'colsample_bylevel': 0.07700542541704222, 'depth': 3, 'boosting_type': 'Plain', 'bootstrap_type': 'Bayesian', 'bagging_temperature': 9.340796433486426}. Best is trial 98 with value: 0.8791208791208791.
[32m[I 2023-04-21 02:28:43,559][39m Trial 2887 finished with value: 0.7999999999999999 and parameters: {'objective': 'CrossEntropy', 'colsample_bylevel': 0.07801127168823976, 'depth': 8, 'boosting_type': 'Plain', 'bootstrap_type': 'MVS'}. Best is trial 98 with value: 0.8791208791208791.
[32m[I 2023-04-21 02:28:44,289][39m Trial 2888 finished with value: 0.8139534883720929 and parameters: {'objective': 'Logloss', 'colsample_bylevel': 0.07113159306153165, 'depth': 4, 'boosting_type': 'Plain', 'bootstrap_type': 'Bayesian', 'bagging_temperature': 8.077481443146725}. Best is trial 98 with value: 0.8791208791208791.
[32m[I 2023-04-21 02:28:45,261][39m Trial 2889 finished with value: 0.8539325842696629 and parameters: {'objective': 'Logloss', 'colsample_bylevel': 0.07541485608696318, 'depth': 11, 'boosting_type': 'Plain', 'bootstrap_type': 'Bayesian', 'bagging_temperature': 8.651394925408248}. Best is trial 98 with value: 0.8791208791208791.
[32m[I 2023-04-21 02:28:46,046][39m Trial 2890 finished with value: 0.8666666666666666 and parameters: {'objective': 'CrossEntropy', 'colsample_bylevel': 0.08364477969700612, 'depth': 3, 'boosting_type': 'Plain', 'bootstrap_type': 'Bayesian', 'bagging_temperature': 8.829194042712537}. Best is trial 98 with value: 0.8791208791208791.
[32m[I 2023-04-21 02:28:47,214][39m Trial 2891 finished with value: 0.8409090909090909 and parameters: {'objective': 'CrossEntropy', 'colsample_bylevel': 0.07566558626016892, 'depth': 10, 'boosting_type': 'Plain', 'bootstrap_type': 'Bayesian', 'bagging_temperature': 9.656689520914256}. Best is trial 98 with value: 0.8791208791208791.
[32m[I 2023-04-21 02:28:48,469][39m Trial 2892 finished with value: 0.8539325842696629 and parameters: {'objective': 'CrossEntropy', 'colsample_bylevel': 0.08505715150135454, 'depth': 3, 'boosting_type': 'Plain', 'bootstrap_type': 'Bayesian', 'bagging_temperature': 9.748350556552676}. Best is trial 98 with value: 0.8791208791208791.
[32m[I 2023-04-21 02:28:49,582][39m Trial 2893 finished with value: 0.8539325842696629 and parameters: {'objective': 'CrossEntropy', 'colsample_bylevel': 0.07463938810072501, 'depth': 2, 'boosting_type': 'Plain', 'bootstrap_type': 'Bayesian', 'bagging_temperature': 9.787736064493394}. Best is trial 98 with value: 0.8791208791208791.
[32m[I 2023-04-21 02:28:50,265][39m Trial 2894 finished with value: 0.8409090909090909 and parameters: {'objective': 'CrossEntropy', 'colsample_bylevel': 0.07536783464328196, 'depth': 4, 'boosting_type': 'Plain', 'bootstrap_type': 'Bayesian', 'bagging_temperature': 9.670759279340398}. Best is trial 98 with value: 0.8791208791208791.
[32m[I 2023-04-21 02:28:51,609][39m Trial 2895 finished with value: 0.8275862068965518 and parameters: {'objective': 'CrossEntropy', 'colsample_bylevel': 0.07903587039056888, 'depth': 11, 'boosting_type': 'Plain', 'bootstrap_type': 'Bayesian', 'bagging_temperature': 3.787311703184355}. Best is trial 98 with value: 0.8791208791208791.
[32m[I 2023-04-21 02:28:52,299][39m Trial 2896 finished with value: 0.8275862068965518 and parameters: {'objective': 'Logloss', 'colsample_bylevel': 0.08057747746543366, 'depth': 7, 'boosting_type': 'Plain', 'bootstrap_type': 'Bayesian', 'bagging_temperature': 8.840262642825024}. Best is trial 98 with value: 0.8791208791208791.
[32m[I 2023-04-21 02:28:53,401][39m Trial 2897 finished with value: 0.8181818181818182 and parameters: {'objective': 'CrossEntropy', 'colsample_bylevel': 0.08227939923193237, 'depth': 3, 'boosting_type': 'Plain', 'bootstrap_type': 'MVS'}. Best is trial 98 with value: 0.8791208791208791.
[32m[I 2023-04-21 02:28:58,225][39m Trial 2898 finished with value: 0.8409090909090909 and parameters: {'objective': 'Logloss', 'colsample_bylevel': 0.08156336521311584, 'depth': 10, 'boosting_type': 'Ordered', 'bootstrap_type': 'Bayesian', 'bagging_temperature': 8.797214834799158}. Best is trial 98 with value: 0.8791208791208791.
[32m[I 2023-04-21 02:28:59,439][39m Trial 2899 finished with value: 0.8666666666666666 and parameters: {'objective': 'CrossEntropy', 'colsample_bylevel': 0.07961922722970367, 'depth': 3, 'boosting_type': 'Plain', 'bootstrap_type': 'Bayesian', 'bagging_temperature': 9.972680860972392}. Best is trial 98 with value: 0.8791208791208791.
[32m[I 2023-04-21 02:29:00,153][39m Trial 2900 finished with value: 0.8539325842696629 and parameters: {'objective': 'Logloss', 'colsample_bylevel': 0.0861301221756717, 'depth': 10, 'boosting_type': 'Plain', 'bootstrap_type': 'Bayesian', 'bagging_temperature': 9.825035031610492}. Best is trial 98 with value: 0.8791208791208791.
[32m[I 2023-04-21 02:29:00,883][39m Trial 2901 finished with value: 0.8539325842696629 and parameters: {'objective': 'CrossEntropy', 'colsample_bylevel': 0.029563345574754842, 'depth': 3, 'boosting_type': 'Plain', 'bootstrap_type': 'Bayesian', 'bagging_temperature': 9.803395137845627}. Best is trial 98 with value: 0.8791208791208791.
[32m[I 2023-04-21 02:29:01,979][39m Trial 2902 finished with value: 0.8636363636363636 and parameters: {'objective': 'Logloss', 'colsample_bylevel': 0.07220153395534284, 'depth': 10, 'boosting_type': 'Plain', 'bootstrap_type': 'Bayesian', 'bagging_temperature': 9.847961024960654}. Best is trial 98 with value: 0.8791208791208791.
[32m[I 2023-04-21 02:29:03,116][39m Trial 2903 finished with value: 0.8275862068965518 and parameters: {'objective': 'Logloss', 'colsample_bylevel': 0.07833723084999938, 'depth': 10, 'boosting_type': 'Plain', 'bootstrap_type': 'Bayesian', 'bagging_temperature': 8.978595793781434}. Best is trial 98 with value: 0.8791208791208791.
[32m[I 2023-04-21 02:29:04,189][39m Trial 2904 finished with value: 0.8539325842696629 and parameters: {'objective': 'CrossEntropy', 'colsample_bylevel': 0.08007344761391495, 'depth': 9, 'boosting_type': 'Plain', 'bootstrap_type': 'Bayesian', 'bagging_temperature': 9.441838634352345}. Best is trial 98 with value: 0.8791208791208791.
[32m[I 2023-04-21 02:29:04,894][39m Trial 2905 finished with value: 0.8409090909090909 and parameters: {'objective': 'CrossEntropy', 'colsample_bylevel': 0.03641127525729167, 'depth': 9, 'boosting_type': 'Plain', 'bootstrap_type': 'Bernoulli', 'subsample': 0.24099512783053645}. Best is trial 98 with value: 0.8791208791208791.
[32m[I 2023-04-21 02:29:05,921][39m Trial 2906 finished with value: 0.8275862068965518 and parameters: {'objective': 'CrossEntropy', 'colsample_bylevel': 0.098556255905292, 'depth': 3, 'boosting_type': 'Plain', 'bootstrap_type': 'Bayesian', 'bagging_temperature': 9.25296833167997}. Best is trial 98 with value: 0.8791208791208791.
[32m[I 2023-04-21 02:29:06,989][39m Trial 2907 finished with value: 0.8409090909090909 and parameters: {'objective': 'CrossEntropy', 'colsample_bylevel': 0.06868039491564712, 'depth': 9, 'boosting_type': 'Plain', 'bootstrap_type': 'Bayesian', 'bagging_temperature': 9.100391524065197}. Best is trial 98 with value: 0.8791208791208791.
