[32m[I 2023-04-21 02:16:27,251][39m Trial 2247 finished with value: 0.8539325842696629 and parameters: {'objective': 'CrossEntropy', 'colsample_bylevel': 0.07781231916989746, 'depth': 4, 'boosting_type': 'Plain', 'bootstrap_type': 'Bayesian', 'bagging_temperature': 7.30085986444709}. Best is trial 98 with value: 0.8791208791208791.
[32m[I 2023-04-21 02:16:27,860][39m Trial 2248 finished with value: 0.8275862068965518 and parameters: {'objective': 'CrossEntropy', 'colsample_bylevel': 0.08200122896126659, 'depth': 4, 'boosting_type': 'Plain', 'bootstrap_type': 'Bayesian', 'bagging_temperature': 7.721465396749853}. Best is trial 98 with value: 0.8791208791208791.
[32m[I 2023-04-21 02:16:28,799][39m Trial 2249 finished with value: 0.8539325842696629 and parameters: {'objective': 'CrossEntropy', 'colsample_bylevel': 0.0795634001714312, 'depth': 3, 'boosting_type': 'Plain', 'bootstrap_type': 'Bayesian', 'bagging_temperature': 6.342827744950038}. Best is trial 98 with value: 0.8791208791208791.
[32m[I 2023-04-21 02:16:29,831][39m Trial 2250 finished with value: 0.8409090909090909 and parameters: {'objective': 'CrossEntropy', 'colsample_bylevel': 0.07235954020947562, 'depth': 3, 'boosting_type': 'Plain', 'bootstrap_type': 'Bayesian', 'bagging_temperature': 7.505179272634088}. Best is trial 98 with value: 0.8791208791208791.
[32m[I 2023-04-21 02:16:30,993][39m Trial 2251 finished with value: 0.8539325842696629 and parameters: {'objective': 'CrossEntropy', 'colsample_bylevel': 0.0785251830349868, 'depth': 3, 'boosting_type': 'Plain', 'bootstrap_type': 'Bayesian', 'bagging_temperature': 8.916310986284838}. Best is trial 98 with value: 0.8791208791208791.
[32m[I 2023-04-21 02:16:31,904][39m Trial 2252 finished with value: 0.8409090909090909 and parameters: {'objective': 'CrossEntropy', 'colsample_bylevel': 0.08001707982209841, 'depth': 6, 'boosting_type': 'Plain', 'bootstrap_type': 'Bayesian', 'bagging_temperature': 8.70305515438524}. Best is trial 98 with value: 0.8791208791208791.
[32m[I 2023-04-21 02:16:32,566][39m Trial 2253 finished with value: 0.8791208791208791 and parameters: {'objective': 'Logloss', 'colsample_bylevel': 0.08250259609639862, 'depth': 4, 'boosting_type': 'Plain', 'bootstrap_type': 'Bayesian', 'bagging_temperature': 8.807719985537945}. Best is trial 98 with value: 0.8791208791208791.
[32m[I 2023-04-21 02:16:33,195][39m Trial 2254 finished with value: 0.8539325842696629 and parameters: {'objective': 'CrossEntropy', 'colsample_bylevel': 0.08146185975015824, 'depth': 3, 'boosting_type': 'Plain', 'bootstrap_type': 'Bayesian', 'bagging_temperature': 9.099383799733586}. Best is trial 98 with value: 0.8791208791208791.
[32m[I 2023-04-21 02:16:34,081][39m Trial 2255 finished with value: 0.8539325842696629 and parameters: {'objective': 'Logloss', 'colsample_bylevel': 0.06995278615978553, 'depth': 4, 'boosting_type': 'Plain', 'bootstrap_type': 'Bayesian', 'bagging_temperature': 9.764168284207377}. Best is trial 98 with value: 0.8791208791208791.
[32m[I 2023-04-21 02:16:39,158][39m Trial 2256 finished with value: 0.8275862068965518 and parameters: {'objective': 'CrossEntropy', 'colsample_bylevel': 0.0853572004644267, 'depth': 3, 'boosting_type': 'Ordered', 'bootstrap_type': 'Bayesian', 'bagging_temperature': 9.801686491234518}. Best is trial 98 with value: 0.8791208791208791.
[32m[I 2023-04-21 02:16:40,111][39m Trial 2257 finished with value: 0.8636363636363636 and parameters: {'objective': 'CrossEntropy', 'colsample_bylevel': 0.07567727376782296, 'depth': 11, 'boosting_type': 'Plain', 'bootstrap_type': 'Bayesian', 'bagging_temperature': 8.826361665631218}. Best is trial 98 with value: 0.8791208791208791.
[32m[I 2023-04-21 02:16:41,060][39m Trial 2258 finished with value: 0.8666666666666666 and parameters: {'objective': 'CrossEntropy', 'colsample_bylevel': 0.08850091821969717, 'depth': 3, 'boosting_type': 'Plain', 'bootstrap_type': 'Bayesian', 'bagging_temperature': 9.808406961524296}. Best is trial 98 with value: 0.8791208791208791.
[32m[I 2023-04-21 02:16:41,787][39m Trial 2259 finished with value: 0.8409090909090909 and parameters: {'objective': 'CrossEntropy', 'colsample_bylevel': 0.08766561796303735, 'depth': 3, 'boosting_type': 'Plain', 'bootstrap_type': 'Bayesian', 'bagging_temperature': 9.7421666474075}. Best is trial 98 with value: 0.8791208791208791.
[32m[I 2023-04-21 02:16:42,824][39m Trial 2260 finished with value: 0.8275862068965518 and parameters: {'objective': 'CrossEntropy', 'colsample_bylevel': 0.07710450965440815, 'depth': 4, 'boosting_type': 'Plain', 'bootstrap_type': 'MVS'}. Best is trial 98 with value: 0.8791208791208791.
[32m[I 2023-04-21 02:16:43,948][39m Trial 2261 finished with value: 0.8409090909090909 and parameters: {'objective': 'Logloss', 'colsample_bylevel': 0.07051527613656824, 'depth': 4, 'boosting_type': 'Plain', 'bootstrap_type': 'Bayesian', 'bagging_temperature': 8.5896516764002}. Best is trial 98 with value: 0.8791208791208791.
[32m[I 2023-04-21 02:16:44,741][39m Trial 2262 finished with value: 0.8666666666666666 and parameters: {'objective': 'Logloss', 'colsample_bylevel': 0.07227359301809363, 'depth': 12, 'boosting_type': 'Plain', 'bootstrap_type': 'Bayesian', 'bagging_temperature': 9.221228260272786}. Best is trial 98 with value: 0.8791208791208791.
[32m[I 2023-04-21 02:16:45,434][39m Trial 2263 finished with value: 0.8275862068965518 and parameters: {'objective': 'CrossEntropy', 'colsample_bylevel': 0.0851470264013729, 'depth': 3, 'boosting_type': 'Plain', 'bootstrap_type': 'Bayesian', 'bagging_temperature': 9.536568441431}. Best is trial 98 with value: 0.8791208791208791.
[32m[I 2023-04-21 02:16:46,465][39m Trial 2264 finished with value: 0.8539325842696629 and parameters: {'objective': 'CrossEntropy', 'colsample_bylevel': 0.07406163809898417, 'depth': 11, 'boosting_type': 'Plain', 'bootstrap_type': 'Bayesian', 'bagging_temperature': 9.996857406613286}. Best is trial 98 with value: 0.8791208791208791.
[32m[I 2023-04-21 02:16:47,159][39m Trial 2265 finished with value: 0.8666666666666666 and parameters: {'objective': 'Logloss', 'colsample_bylevel': 0.07222711088782537, 'depth': 10, 'boosting_type': 'Plain', 'bootstrap_type': 'Bayesian', 'bagging_temperature': 9.628044673363277}. Best is trial 98 with value: 0.8791208791208791.
[32m[I 2023-04-21 02:16:48,350][39m Trial 2266 finished with value: 0.8235294117647058 and parameters: {'objective': 'CrossEntropy', 'colsample_bylevel': 0.08376806025888014, 'depth': 11, 'boosting_type': 'Plain', 'bootstrap_type': 'Bayesian', 'bagging_temperature': 9.057868117786843}. Best is trial 98 with value: 0.8791208791208791.
[32m[I 2023-04-21 02:16:49,088][39m Trial 2267 finished with value: 0.8539325842696629 and parameters: {'objective': 'CrossEntropy', 'colsample_bylevel': 0.07396994666395358, 'depth': 10, 'boosting_type': 'Plain', 'bootstrap_type': 'Bayesian', 'bagging_temperature': 8.566902108224358}. Best is trial 98 with value: 0.8791208791208791.
[32m[I 2023-04-21 02:16:49,940][39m Trial 2268 finished with value: 0.8409090909090909 and parameters: {'objective': 'Logloss', 'colsample_bylevel': 0.08391551215132445, 'depth': 6, 'boosting_type': 'Plain', 'bootstrap_type': 'Bayesian', 'bagging_temperature': 9.071834739632338}. Best is trial 98 with value: 0.8791208791208791.
[32m[I 2023-04-21 02:16:50,739][39m Trial 2269 finished with value: 0.8275862068965518 and parameters: {'objective': 'Logloss', 'colsample_bylevel': 0.07046496492611753, 'depth': 10, 'boosting_type': 'Plain', 'bootstrap_type': 'MVS'}. Best is trial 98 with value: 0.8791208791208791.
[32m[I 2023-04-21 02:16:51,587][39m Trial 2270 finished with value: 0.8409090909090909 and parameters: {'objective': 'CrossEntropy', 'colsample_bylevel': 0.08256780409524528, 'depth': 3, 'boosting_type': 'Plain', 'bootstrap_type': 'Bayesian', 'bagging_temperature': 8.80245222878136}. Best is trial 98 with value: 0.8791208791208791.
[32m[I 2023-04-21 02:16:52,503][39m Trial 2271 finished with value: 0.8791208791208791 and parameters: {'objective': 'CrossEntropy', 'colsample_bylevel': 0.08188761641600285, 'depth': 3, 'boosting_type': 'Plain', 'bootstrap_type': 'Bayesian', 'bagging_temperature': 8.883245404224592}. Best is trial 98 with value: 0.8791208791208791.
[32m[I 2023-04-21 02:16:53,277][39m Trial 2272 finished with value: 0.8636363636363636 and parameters: {'objective': 'CrossEntropy', 'colsample_bylevel': 0.08732941399557191, 'depth': 10, 'boosting_type': 'Plain', 'bootstrap_type': 'Bayesian', 'bagging_temperature': 9.672325712143227}. Best is trial 98 with value: 0.8791208791208791.
[32m[I 2023-04-21 02:16:54,458][39m Trial 2273 finished with value: 0.8666666666666666 and parameters: {'objective': 'CrossEntropy', 'colsample_bylevel': 0.08455113108444073, 'depth': 3, 'boosting_type': 'Plain', 'bootstrap_type': 'Bayesian', 'bagging_temperature': 8.964702548363128}. Best is trial 98 with value: 0.8791208791208791.
[32m[I 2023-04-21 02:16:55,493][39m Trial 2274 finished with value: 0.8409090909090909 and parameters: {'objective': 'CrossEntropy', 'colsample_bylevel': 0.08030084732365227, 'depth': 6, 'boosting_type': 'Plain', 'bootstrap_type': 'Bayesian', 'bagging_temperature': 9.192109238199254}. Best is trial 98 with value: 0.8791208791208791.
[32m[I 2023-04-21 02:17:00,396][39m Trial 2275 finished with value: 0.8666666666666666 and parameters: {'objective': 'CrossEntropy', 'colsample_bylevel': 0.08500414484916106, 'depth': 3, 'boosting_type': 'Ordered', 'bootstrap_type': 'Bayesian', 'bagging_temperature': 9.366566596788408}. Best is trial 98 with value: 0.8791208791208791.
[32m[I 2023-04-21 02:17:01,491][39m Trial 2276 finished with value: 0.8409090909090909 and parameters: {'objective': 'CrossEntropy', 'colsample_bylevel': 0.05651985085309685, 'depth': 3, 'boosting_type': 'Plain', 'bootstrap_type': 'Bayesian', 'bagging_temperature': 8.784698823619694}. Best is trial 98 with value: 0.8791208791208791.
[32m[I 2023-04-21 02:17:02,159][39m Trial 2277 finished with value: 0.8636363636363636 and parameters: {'objective': 'CrossEntropy', 'colsample_bylevel': 0.07980102070606857, 'depth': 2, 'boosting_type': 'Plain', 'bootstrap_type': 'Bayesian', 'bagging_temperature': 9.207806940998337}. Best is trial 98 with value: 0.8791208791208791.
[32m[I 2023-04-21 02:17:03,030][39m Trial 2278 finished with value: 0.8539325842696629 and parameters: {'objective': 'Logloss', 'colsample_bylevel': 0.07367607376800457, 'depth': 11, 'boosting_type': 'Plain', 'bootstrap_type': 'Bayesian', 'bagging_temperature': 9.358527297385448}. Best is trial 98 with value: 0.8791208791208791.
[32m[I 2023-04-21 02:17:04,031][39m Trial 2279 finished with value: 0.8275862068965518 and parameters: {'objective': 'CrossEntropy', 'colsample_bylevel': 0.07818143243733938, 'depth': 7, 'boosting_type': 'Plain', 'bootstrap_type': 'Bayesian', 'bagging_temperature': 9.461720974770422}. Best is trial 98 with value: 0.8791208791208791.
[32m[I 2023-04-21 02:17:04,919][39m Trial 2280 finished with value: 0.8409090909090909 and parameters: {'objective': 'CrossEntropy', 'colsample_bylevel': 0.07313702204604526, 'depth': 10, 'boosting_type': 'Plain', 'bootstrap_type': 'Bernoulli', 'subsample': 0.7761628673328594}. Best is trial 98 with value: 0.8791208791208791.
[32m[I 2023-04-21 02:17:05,579][39m Trial 2281 finished with value: 0.8275862068965518 and parameters: {'objective': 'CrossEntropy', 'colsample_bylevel': 0.07986050485440183, 'depth': 8, 'boosting_type': 'Plain', 'bootstrap_type': 'MVS'}. Best is trial 98 with value: 0.8791208791208791.
[32m[I 2023-04-21 02:17:06,597][39m Trial 2282 finished with value: 0.8539325842696629 and parameters: {'objective': 'CrossEntropy', 'colsample_bylevel': 0.07506364936099441, 'depth': 11, 'boosting_type': 'Plain', 'bootstrap_type': 'Bayesian', 'bagging_temperature': 9.817809789930209}. Best is trial 98 with value: 0.8791208791208791.
[32m[I 2023-04-21 02:17:07,761][39m Trial 2283 finished with value: 0.8539325842696629 and parameters: {'objective': 'CrossEntropy', 'colsample_bylevel': 0.07844081877624967, 'depth': 2, 'boosting_type': 'Plain', 'bootstrap_type': 'Bayesian', 'bagging_temperature': 8.57020966280161}. Best is trial 98 with value: 0.8791208791208791.
[32m[I 2023-04-21 02:17:08,699][39m Trial 2284 finished with value: 0.8539325842696629 and parameters: {'objective': 'Logloss', 'colsample_bylevel': 0.08841185039748736, 'depth': 3, 'boosting_type': 'Plain', 'bootstrap_type': 'Bayesian', 'bagging_temperature': 9.125433396318043}. Best is trial 98 with value: 0.8791208791208791.
[32m[I 2023-04-21 02:17:09,578][39m Trial 2285 finished with value: 0.8539325842696629 and parameters: {'objective': 'Logloss', 'colsample_bylevel': 0.06832264833223488, 'depth': 11, 'boosting_type': 'Plain', 'bootstrap_type': 'Bayesian', 'bagging_temperature': 8.188668967990047}. Best is trial 98 with value: 0.8791208791208791.
[32m[I 2023-04-21 02:17:10,277][39m Trial 2286 finished with value: 0.8539325842696629 and parameters: {'objective': 'Logloss', 'colsample_bylevel': 0.08244600011897128, 'depth': 3, 'boosting_type': 'Plain', 'bootstrap_type': 'Bayesian', 'bagging_temperature': 8.630922948283914}. Best is trial 98 with value: 0.8791208791208791.
[32m[I 2023-04-21 02:17:10,891][39m Trial 2287 finished with value: 0.8539325842696629 and parameters: {'objective': 'CrossEntropy', 'colsample_bylevel': 0.08637138756449433, 'depth': 2, 'boosting_type': 'Plain', 'bootstrap_type': 'Bayesian', 'bagging_temperature': 8.96729616475043}. Best is trial 98 with value: 0.8791208791208791.
[32m[I 2023-04-21 02:17:12,131][39m Trial 2288 finished with value: 0.8409090909090909 and parameters: {'objective': 'CrossEntropy', 'colsample_bylevel': 0.08267175164979129, 'depth': 5, 'boosting_type': 'Plain', 'bootstrap_type': 'Bayesian', 'bagging_temperature': 9.493453234351657}. Best is trial 98 with value: 0.8791208791208791.
[32m[I 2023-04-21 02:17:13,127][39m Trial 2289 finished with value: 0.8539325842696629 and parameters: {'objective': 'CrossEntropy', 'colsample_bylevel': 0.07877347656126503, 'depth': 3, 'boosting_type': 'Plain', 'bootstrap_type': 'Bayesian', 'bagging_temperature': 9.301306404116117}. Best is trial 98 with value: 0.8791208791208791.
[32m[I 2023-04-21 02:17:13,788][39m Trial 2290 finished with value: 0.8666666666666666 and parameters: {'objective': 'Logloss', 'colsample_bylevel': 0.07971591478269818, 'depth': 3, 'boosting_type': 'Plain', 'bootstrap_type': 'Bayesian', 'bagging_temperature': 8.602807359049029}. Best is trial 98 with value: 0.8791208791208791.
[32m[I 2023-04-21 02:17:15,182][39m Trial 2291 finished with value: 0.8666666666666666 and parameters: {'objective': 'CrossEntropy', 'colsample_bylevel': 0.08237594026177279, 'depth': 3, 'boosting_type': 'Plain', 'bootstrap_type': 'Bayesian', 'bagging_temperature': 9.43326076062985}. Best is trial 98 with value: 0.8791208791208791.
[32m[I 2023-04-21 02:17:20,011][39m Trial 2292 finished with value: 0.8172043010752689 and parameters: {'objective': 'CrossEntropy', 'colsample_bylevel': 0.08800966664929669, 'depth': 3, 'boosting_type': 'Ordered', 'bootstrap_type': 'MVS'}. Best is trial 98 with value: 0.8791208791208791.
[32m[I 2023-04-21 02:17:20,958][39m Trial 2293 finished with value: 0.8409090909090909 and parameters: {'objective': 'CrossEntropy', 'colsample_bylevel': 0.07420356795649102, 'depth': 11, 'boosting_type': 'Plain', 'bootstrap_type': 'Bayesian', 'bagging_temperature': 9.502946985873667}. Best is trial 98 with value: 0.8791208791208791.
[32m[I 2023-04-21 02:17:21,842][39m Trial 2294 finished with value: 0.7674418604651163 and parameters: {'objective': 'CrossEntropy', 'colsample_bylevel': 0.02763559792586129, 'depth': 8, 'boosting_type': 'Plain', 'bootstrap_type': 'Bayesian', 'bagging_temperature': 8.924202324350896}. Best is trial 98 with value: 0.8791208791208791.
[32m[I 2023-04-21 02:17:22,747][39m Trial 2295 finished with value: 0.8539325842696629 and parameters: {'objective': 'CrossEntropy', 'colsample_bylevel': 0.07226858741752867, 'depth': 3, 'boosting_type': 'Plain', 'bootstrap_type': 'Bayesian', 'bagging_temperature': 7.517210409384613}. Best is trial 98 with value: 0.8791208791208791.
[32m[I 2023-04-21 02:17:23,684][39m Trial 2296 finished with value: 0.8409090909090909 and parameters: {'objective': 'CrossEntropy', 'colsample_bylevel': 0.0852371773041239, 'depth': 3, 'boosting_type': 'Plain', 'bootstrap_type': 'Bayesian', 'bagging_temperature': 9.710382151728123}. Best is trial 98 with value: 0.8791208791208791.
[32m[I 2023-04-21 02:17:24,498][39m Trial 2297 finished with value: 0.8666666666666666 and parameters: {'objective': 'Logloss', 'colsample_bylevel': 0.07487164978924729, 'depth': 11, 'boosting_type': 'Plain', 'bootstrap_type': 'Bayesian', 'bagging_temperature': 9.748779215491137}. Best is trial 98 with value: 0.8791208791208791.
[32m[I 2023-04-21 02:17:25,167][39m Trial 2298 finished with value: 0.8409090909090909 and parameters: {'objective': 'CrossEntropy', 'colsample_bylevel': 0.07844892286335424, 'depth': 10, 'boosting_type': 'Plain', 'bootstrap_type': 'Bayesian', 'bagging_temperature': 8.513538393359447}. Best is trial 98 with value: 0.8791208791208791.
[32m[I 2023-04-21 02:17:26,598][39m Trial 2299 finished with value: 0.8505747126436782 and parameters: {'objective': 'CrossEntropy', 'colsample_bylevel': 0.09470086516724192, 'depth': 8, 'boosting_type': 'Plain', 'bootstrap_type': 'Bayesian', 'bagging_temperature': 7.439350510871503}. Best is trial 98 with value: 0.8791208791208791.
[32m[I 2023-04-21 02:17:27,476][39m Trial 2300 finished with value: 0.8275862068965518 and parameters: {'objective': 'Logloss', 'colsample_bylevel': 0.07567361051803395, 'depth': 11, 'boosting_type': 'Plain', 'bootstrap_type': 'Bernoulli', 'subsample': 0.40440105560016903}. Best is trial 98 with value: 0.8791208791208791.
[32m[I 2023-04-21 02:17:28,477][39m Trial 2301 finished with value: 0.8539325842696629 and parameters: {'objective': 'Logloss', 'colsample_bylevel': 0.07831917416938813, 'depth': 4, 'boosting_type': 'Plain', 'bootstrap_type': 'Bayesian', 'bagging_temperature': 8.142229110677702}. Best is trial 98 with value: 0.8791208791208791.
[32m[I 2023-04-21 02:17:29,098][39m Trial 2302 finished with value: 0.8505747126436782 and parameters: {'objective': 'CrossEntropy', 'colsample_bylevel': 0.07268883245236132, 'depth': 10, 'boosting_type': 'Plain', 'bootstrap_type': 'Bayesian', 'bagging_temperature': 9.4876150031992}. Best is trial 98 with value: 0.8791208791208791.
[32m[I 2023-04-21 02:17:30,051][39m Trial 2303 finished with value: 0.8539325842696629 and parameters: {'objective': 'CrossEntropy', 'colsample_bylevel': 0.09564823642917755, 'depth': 4, 'boosting_type': 'Plain', 'bootstrap_type': 'Bayesian', 'bagging_temperature': 8.115163387977937}. Best is trial 98 with value: 0.8791208791208791.
[32m[I 2023-04-21 02:17:30,738][39m Trial 2304 finished with value: 0.8666666666666666 and parameters: {'objective': 'CrossEntropy', 'colsample_bylevel': 0.07091086828122306, 'depth': 4, 'boosting_type': 'Plain', 'bootstrap_type': 'Bayesian', 'bagging_temperature': 7.75759181335599}. Best is trial 98 with value: 0.8791208791208791.
[32m[I 2023-04-21 02:17:31,460][39m Trial 2305 finished with value: 0.8409090909090909 and parameters: {'objective': 'CrossEntropy', 'colsample_bylevel': 0.08030509017096571, 'depth': 5, 'boosting_type': 'Plain', 'bootstrap_type': 'Bayesian', 'bagging_temperature': 9.30844098886806}. Best is trial 98 with value: 0.8791208791208791.
[32m[I 2023-04-21 02:17:32,350][39m Trial 2306 finished with value: 0.8539325842696629 and parameters: {'objective': 'CrossEntropy', 'colsample_bylevel': 0.09108071271319024, 'depth': 4, 'boosting_type': 'Plain', 'bootstrap_type': 'Bayesian', 'bagging_temperature': 8.211407907923194}. Best is trial 98 with value: 0.8791208791208791.
[32m[I 2023-04-21 02:17:33,487][39m Trial 2307 finished with value: 0.8505747126436782 and parameters: {'objective': 'CrossEntropy', 'colsample_bylevel': 0.07643329629115758, 'depth': 10, 'boosting_type': 'Plain', 'bootstrap_type': 'Bayesian', 'bagging_temperature': 9.68049603887357}. Best is trial 98 with value: 0.8791208791208791.
[32m[I 2023-04-21 02:17:34,558][39m Trial 2308 finished with value: 0.8539325842696629 and parameters: {'objective': 'CrossEntropy', 'colsample_bylevel': 0.04393459531122022, 'depth': 12, 'boosting_type': 'Plain', 'bootstrap_type': 'Bayesian', 'bagging_temperature': 9.162986085417744}. Best is trial 98 with value: 0.8791208791208791.
[32m[I 2023-04-21 02:17:35,466][39m Trial 2309 finished with value: 0.8275862068965518 and parameters: {'objective': 'CrossEntropy', 'colsample_bylevel': 0.07320826596632482, 'depth': 11, 'boosting_type': 'Plain', 'bootstrap_type': 'Bayesian', 'bagging_temperature': 7.814837320321754}. Best is trial 98 with value: 0.8791208791208791.
[32m[I 2023-04-21 02:17:36,335][39m Trial 2310 finished with value: 0.8275862068965518 and parameters: {'objective': 'Logloss', 'colsample_bylevel': 0.07019359290785646, 'depth': 4, 'boosting_type': 'Plain', 'bootstrap_type': 'Bayesian', 'bagging_temperature': 7.170061614881858}. Best is trial 98 with value: 0.8791208791208791.
[32m[I 2023-04-21 02:17:37,235][39m Trial 2311 finished with value: 0.8275862068965518 and parameters: {'objective': 'CrossEntropy', 'colsample_bylevel': 0.07569238349558458, 'depth': 4, 'boosting_type': 'Plain', 'bootstrap_type': 'MVS'}. Best is trial 98 with value: 0.8791208791208791.
[32m[I 2023-04-21 02:17:38,125][39m Trial 2312 finished with value: 0.8139534883720929 and parameters: {'objective': 'CrossEntropy', 'colsample_bylevel': 0.0711553729721145, 'depth': 4, 'boosting_type': 'Plain', 'bootstrap_type': 'Bernoulli', 'subsample': 0.5606525331044323}. Best is trial 98 with value: 0.8791208791208791.
