[32m[I 2023-04-21 03:22:22,035][39m Trial 5523 finished with value: 0.8409090909090909 and parameters: {'objective': 'CrossEntropy', 'colsample_bylevel': 0.07240771416997262, 'depth': 11, 'boosting_type': 'Plain', 'bootstrap_type': 'Bayesian', 'bagging_temperature': 6.810727389308748}. Best is trial 3065 with value: 0.8863636363636364.
[32m[I 2023-04-21 03:22:26,854][39m Trial 5524 finished with value: 0.8139534883720929 and parameters: {'objective': 'CrossEntropy', 'colsample_bylevel': 0.08102868923530016, 'depth': 4, 'boosting_type': 'Ordered', 'bootstrap_type': 'Bayesian', 'bagging_temperature': 9.103815856387948}. Best is trial 3065 with value: 0.8863636363636364.
[32m[I 2023-04-21 03:22:27,934][39m Trial 5525 finished with value: 0.8539325842696629 and parameters: {'objective': 'Logloss', 'colsample_bylevel': 0.07128363920623246, 'depth': 10, 'boosting_type': 'Plain', 'bootstrap_type': 'Bayesian', 'bagging_temperature': 8.563414673261391}. Best is trial 3065 with value: 0.8863636363636364.
[32m[I 2023-04-21 03:22:29,292][39m Trial 5526 finished with value: 0.8275862068965518 and parameters: {'objective': 'CrossEntropy', 'colsample_bylevel': 0.07450094335928227, 'depth': 12, 'boosting_type': 'Plain', 'bootstrap_type': 'Bayesian', 'bagging_temperature': 9.253067263824953}. Best is trial 3065 with value: 0.8863636363636364.
[32m[I 2023-04-21 03:22:30,660][39m Trial 5527 finished with value: 0.8539325842696629 and parameters: {'objective': 'CrossEntropy', 'colsample_bylevel': 0.07831473251452326, 'depth': 10, 'boosting_type': 'Plain', 'bootstrap_type': 'Bayesian', 'bagging_temperature': 9.707623234065196}. Best is trial 3065 with value: 0.8863636363636364.
[32m[I 2023-04-21 03:22:31,622][39m Trial 5528 finished with value: 0.8666666666666666 and parameters: {'objective': 'Logloss', 'colsample_bylevel': 0.08884433501524443, 'depth': 2, 'boosting_type': 'Plain', 'bootstrap_type': 'Bayesian', 'bagging_temperature': 9.821234701709386}. Best is trial 3065 with value: 0.8863636363636364.
[32m[I 2023-04-21 03:22:32,808][39m Trial 5529 finished with value: 0.8409090909090909 and parameters: {'objective': 'CrossEntropy', 'colsample_bylevel': 0.08551515541380444, 'depth': 8, 'boosting_type': 'Plain', 'bootstrap_type': 'Bayesian', 'bagging_temperature': 9.858057851338904}. Best is trial 3065 with value: 0.8863636363636364.
[32m[I 2023-04-21 03:22:33,851][39m Trial 5530 finished with value: 0.8444444444444446 and parameters: {'objective': 'CrossEntropy', 'colsample_bylevel': 0.08074178664311371, 'depth': 11, 'boosting_type': 'Plain', 'bootstrap_type': 'Bayesian', 'bagging_temperature': 9.1783942484329}. Best is trial 3065 with value: 0.8863636363636364.
[32m[I 2023-04-21 03:22:34,864][39m Trial 5531 finished with value: 0.8539325842696629 and parameters: {'objective': 'Logloss', 'colsample_bylevel': 0.07460315585062484, 'depth': 5, 'boosting_type': 'Plain', 'bootstrap_type': 'Bayesian', 'bagging_temperature': 9.0865327837329}. Best is trial 3065 with value: 0.8863636363636364.
[32m[I 2023-04-21 03:22:35,520][39m Trial 5532 finished with value: 0.8235294117647058 and parameters: {'objective': 'CrossEntropy', 'colsample_bylevel': 0.04960270482016469, 'depth': 4, 'boosting_type': 'Plain', 'bootstrap_type': 'Bayesian', 'bagging_temperature': 9.733580259770452}. Best is trial 3065 with value: 0.8863636363636364.
[32m[I 2023-04-21 03:22:36,281][39m Trial 5533 finished with value: 0.8666666666666666 and parameters: {'objective': 'CrossEntropy', 'colsample_bylevel': 0.08087029566297357, 'depth': 3, 'boosting_type': 'Plain', 'bootstrap_type': 'Bayesian', 'bagging_temperature': 9.613750643698001}. Best is trial 3065 with value: 0.8863636363636364.
[32m[I 2023-04-21 03:22:37,619][39m Trial 5534 finished with value: 0.8505747126436782 and parameters: {'objective': 'CrossEntropy', 'colsample_bylevel': 0.08639665811421518, 'depth': 7, 'boosting_type': 'Plain', 'bootstrap_type': 'Bayesian', 'bagging_temperature': 4.058211949769166}. Best is trial 3065 with value: 0.8863636363636364.
[32m[I 2023-04-21 03:22:38,587][39m Trial 5535 finished with value: 0.8666666666666666 and parameters: {'objective': 'CrossEntropy', 'colsample_bylevel': 0.0831826548913198, 'depth': 3, 'boosting_type': 'Plain', 'bootstrap_type': 'Bayesian', 'bagging_temperature': 9.227364727693644}. Best is trial 3065 with value: 0.8863636363636364.
[32m[I 2023-04-21 03:22:39,503][39m Trial 5536 finished with value: 0.8372093023255814 and parameters: {'objective': 'CrossEntropy', 'colsample_bylevel': 0.08489648831106435, 'depth': 11, 'boosting_type': 'Plain', 'bootstrap_type': 'Bayesian', 'bagging_temperature': 9.194390254386283}. Best is trial 3065 with value: 0.8863636363636364.
[32m[I 2023-04-21 03:22:40,664][39m Trial 5537 finished with value: 0.8409090909090909 and parameters: {'objective': 'CrossEntropy', 'colsample_bylevel': 0.09589542058171074, 'depth': 3, 'boosting_type': 'Plain', 'bootstrap_type': 'Bayesian', 'bagging_temperature': 9.023987106359243}. Best is trial 3065 with value: 0.8863636363636364.
[32m[I 2023-04-21 03:22:41,591][39m Trial 5538 finished with value: 0.8539325842696629 and parameters: {'objective': 'CrossEntropy', 'colsample_bylevel': 0.07951975591261429, 'depth': 10, 'boosting_type': 'Plain', 'bootstrap_type': 'Bayesian', 'bagging_temperature': 9.497716133946286}. Best is trial 3065 with value: 0.8863636363636364.
[32m[I 2023-04-21 03:22:42,756][39m Trial 5539 finished with value: 0.8791208791208791 and parameters: {'objective': 'CrossEntropy', 'colsample_bylevel': 0.08722592804343757, 'depth': 3, 'boosting_type': 'Plain', 'bootstrap_type': 'Bayesian', 'bagging_temperature': 9.836945981002915}. Best is trial 3065 with value: 0.8863636363636364.
[32m[I 2023-04-21 03:22:44,095][39m Trial 5540 finished with value: 0.8409090909090909 and parameters: {'objective': 'CrossEntropy', 'colsample_bylevel': 0.07923258110398362, 'depth': 2, 'boosting_type': 'Plain', 'bootstrap_type': 'MVS'}. Best is trial 3065 with value: 0.8863636363636364.
[32m[I 2023-04-21 03:22:48,875][39m Trial 5541 finished with value: 0.8409090909090909 and parameters: {'objective': 'CrossEntropy', 'colsample_bylevel': 0.07761386805188507, 'depth': 4, 'boosting_type': 'Ordered', 'bootstrap_type': 'Bayesian', 'bagging_temperature': 9.601087228725268}. Best is trial 3065 with value: 0.8863636363636364.
[32m[I 2023-04-21 03:22:50,061][39m Trial 5542 finished with value: 0.8275862068965518 and parameters: {'objective': 'Logloss', 'colsample_bylevel': 0.09379186101628456, 'depth': 5, 'boosting_type': 'Plain', 'bootstrap_type': 'Bayesian', 'bagging_temperature': 8.744756528746963}. Best is trial 3065 with value: 0.8863636363636364.
[32m[I 2023-04-21 03:22:51,373][39m Trial 5543 finished with value: 0.8666666666666666 and parameters: {'objective': 'CrossEntropy', 'colsample_bylevel': 0.08451945063287315, 'depth': 3, 'boosting_type': 'Plain', 'bootstrap_type': 'Bayesian', 'bagging_temperature': 8.624611684846299}. Best is trial 3065 with value: 0.8863636363636364.
[32m[I 2023-04-21 03:22:52,342][39m Trial 5544 finished with value: 0.8409090909090909 and parameters: {'objective': 'CrossEntropy', 'colsample_bylevel': 0.0616030625716332, 'depth': 3, 'boosting_type': 'Plain', 'bootstrap_type': 'MVS'}. Best is trial 3065 with value: 0.8863636363636364.
[32m[I 2023-04-21 03:22:53,180][39m Trial 5545 finished with value: 0.8636363636363636 and parameters: {'objective': 'CrossEntropy', 'colsample_bylevel': 0.08376198371213366, 'depth': 11, 'boosting_type': 'Plain', 'bootstrap_type': 'Bayesian', 'bagging_temperature': 9.453645372161716}. Best is trial 3065 with value: 0.8863636363636364.
[32m[I 2023-04-21 03:22:54,506][39m Trial 5546 finished with value: 0.8666666666666666 and parameters: {'objective': 'CrossEntropy', 'colsample_bylevel': 0.07592688898787293, 'depth': 10, 'boosting_type': 'Plain', 'bootstrap_type': 'Bayesian', 'bagging_temperature': 9.347595270247302}. Best is trial 3065 with value: 0.8863636363636364.
[32m[I 2023-04-21 03:22:55,236][39m Trial 5547 finished with value: 0.8539325842696629 and parameters: {'objective': 'CrossEntropy', 'colsample_bylevel': 0.0769020795937317, 'depth': 12, 'boosting_type': 'Plain', 'bootstrap_type': 'Bayesian', 'bagging_temperature': 8.60146649621979}. Best is trial 3065 with value: 0.8863636363636364.
[32m[I 2023-04-21 03:22:56,428][39m Trial 5548 finished with value: 0.8666666666666666 and parameters: {'objective': 'Logloss', 'colsample_bylevel': 0.07003143390437581, 'depth': 10, 'boosting_type': 'Plain', 'bootstrap_type': 'Bayesian', 'bagging_temperature': 9.594364783430786}. Best is trial 3065 with value: 0.8863636363636364.
[32m[I 2023-04-21 03:22:57,742][39m Trial 5549 finished with value: 0.8409090909090909 and parameters: {'objective': 'CrossEntropy', 'colsample_bylevel': 0.08473804503304266, 'depth': 4, 'boosting_type': 'Plain', 'bootstrap_type': 'Bayesian', 'bagging_temperature': 9.581966329316554}. Best is trial 3065 with value: 0.8863636363636364.
[32m[I 2023-04-21 03:22:58,443][39m Trial 5550 finished with value: 0.8409090909090909 and parameters: {'objective': 'CrossEntropy', 'colsample_bylevel': 0.0843228768714197, 'depth': 6, 'boosting_type': 'Plain', 'bootstrap_type': 'Bernoulli', 'subsample': 0.7727664131307832}. Best is trial 3065 with value: 0.8863636363636364.
[32m[I 2023-04-21 03:22:59,364][39m Trial 5551 finished with value: 0.8409090909090909 and parameters: {'objective': 'Logloss', 'colsample_bylevel': 0.08030033051673066, 'depth': 10, 'boosting_type': 'Plain', 'bootstrap_type': 'Bayesian', 'bagging_temperature': 1.5248268278001382}. Best is trial 3065 with value: 0.8863636363636364.
[32m[I 2023-04-21 03:23:00,897][39m Trial 5552 finished with value: 0.8539325842696629 and parameters: {'objective': 'CrossEntropy', 'colsample_bylevel': 0.06866907684302555, 'depth': 10, 'boosting_type': 'Plain', 'bootstrap_type': 'Bayesian', 'bagging_temperature': 9.424423826199881}. Best is trial 3065 with value: 0.8863636363636364.
[32m[I 2023-04-21 03:23:01,625][39m Trial 5553 finished with value: 0.8791208791208791 and parameters: {'objective': 'CrossEntropy', 'colsample_bylevel': 0.09074289728611014, 'depth': 3, 'boosting_type': 'Plain', 'bootstrap_type': 'Bayesian', 'bagging_temperature': 9.758492118134582}. Best is trial 3065 with value: 0.8863636363636364.
[32m[I 2023-04-21 03:23:02,908][39m Trial 5554 finished with value: 0.8539325842696629 and parameters: {'objective': 'CrossEntropy', 'colsample_bylevel': 0.07835383826967951, 'depth': 10, 'boosting_type': 'Plain', 'bootstrap_type': 'Bayesian', 'bagging_temperature': 9.608166087459752}. Best is trial 3065 with value: 0.8863636363636364.
[32m[I 2023-04-21 03:23:04,070][39m Trial 5555 finished with value: 0.8409090909090909 and parameters: {'objective': 'CrossEntropy', 'colsample_bylevel': 0.08788128669929297, 'depth': 3, 'boosting_type': 'Plain', 'bootstrap_type': 'Bayesian', 'bagging_temperature': 9.444057253563972}. Best is trial 3065 with value: 0.8863636363636364.
[32m[I 2023-04-21 03:23:05,038][39m Trial 5556 finished with value: 0.8409090909090909 and parameters: {'objective': 'CrossEntropy', 'colsample_bylevel': 0.0739913516601156, 'depth': 12, 'boosting_type': 'Plain', 'bootstrap_type': 'Bayesian', 'bagging_temperature': 9.540889853030993}. Best is trial 3065 with value: 0.8863636363636364.
[32m[I 2023-04-21 03:23:06,085][39m Trial 5557 finished with value: 0.8372093023255814 and parameters: {'objective': 'CrossEntropy', 'colsample_bylevel': 0.07521838152957369, 'depth': 10, 'boosting_type': 'Plain', 'bootstrap_type': 'Bayesian', 'bagging_temperature': 8.310497589658915}. Best is trial 3065 with value: 0.8863636363636364.
[32m[I 2023-04-21 03:23:07,177][39m Trial 5558 finished with value: 0.8409090909090909 and parameters: {'objective': 'CrossEntropy', 'colsample_bylevel': 0.07494502918527768, 'depth': 10, 'boosting_type': 'Plain', 'bootstrap_type': 'Bayesian', 'bagging_temperature': 9.361214568100868}. Best is trial 3065 with value: 0.8863636363636364.
[32m[I 2023-04-21 03:23:08,235][39m Trial 5559 finished with value: 0.8409090909090909 and parameters: {'objective': 'CrossEntropy', 'colsample_bylevel': 0.07880384868526935, 'depth': 10, 'boosting_type': 'Plain', 'bootstrap_type': 'Bayesian', 'bagging_temperature': 9.501492102950367}. Best is trial 3065 with value: 0.8863636363636364.
[32m[I 2023-04-21 03:23:09,346][39m Trial 5560 finished with value: 0.8539325842696629 and parameters: {'objective': 'CrossEntropy', 'colsample_bylevel': 0.07896514401741545, 'depth': 10, 'boosting_type': 'Plain', 'bootstrap_type': 'Bayesian', 'bagging_temperature': 9.445746542637377}. Best is trial 3065 with value: 0.8863636363636364.
[32m[I 2023-04-21 03:23:13,960][39m Trial 5561 finished with value: 0.8139534883720929 and parameters: {'objective': 'CrossEntropy', 'colsample_bylevel': 0.08140700855486789, 'depth': 4, 'boosting_type': 'Ordered', 'bootstrap_type': 'Bayesian', 'bagging_temperature': 9.594714498064175}. Best is trial 3065 with value: 0.8863636363636364.
[32m[I 2023-04-21 03:23:15,062][39m Trial 5562 finished with value: 0.8539325842696629 and parameters: {'objective': 'CrossEntropy', 'colsample_bylevel': 0.08028945269169435, 'depth': 3, 'boosting_type': 'Plain', 'bootstrap_type': 'Bayesian', 'bagging_temperature': 8.760655518178115}. Best is trial 3065 with value: 0.8863636363636364.
[32m[I 2023-04-21 03:23:16,413][39m Trial 5563 finished with value: 0.8539325842696629 and parameters: {'objective': 'CrossEntropy', 'colsample_bylevel': 0.08629857298689725, 'depth': 2, 'boosting_type': 'Plain', 'bootstrap_type': 'Bayesian', 'bagging_temperature': 8.960513448284772}. Best is trial 3065 with value: 0.8863636363636364.
[32m[I 2023-04-21 03:23:17,489][39m Trial 5564 finished with value: 0.8636363636363636 and parameters: {'objective': 'CrossEntropy', 'colsample_bylevel': 0.08592586092561683, 'depth': 2, 'boosting_type': 'Plain', 'bootstrap_type': 'Bayesian', 'bagging_temperature': 9.232526469737701}. Best is trial 3065 with value: 0.8863636363636364.
[32m[I 2023-04-21 03:23:18,759][39m Trial 5565 finished with value: 0.8505747126436782 and parameters: {'objective': 'Logloss', 'colsample_bylevel': 0.07586258537466332, 'depth': 3, 'boosting_type': 'Plain', 'bootstrap_type': 'Bayesian', 'bagging_temperature': 9.385425963686252}. Best is trial 3065 with value: 0.8863636363636364.
[32m[I 2023-04-21 03:23:20,086][39m Trial 5566 finished with value: 0.8275862068965518 and parameters: {'objective': 'Logloss', 'colsample_bylevel': 0.09714775813006292, 'depth': 10, 'boosting_type': 'Plain', 'bootstrap_type': 'Bayesian', 'bagging_temperature': 8.73108429431705}. Best is trial 3065 with value: 0.8863636363636364.
[32m[I 2023-04-21 03:23:21,138][39m Trial 5567 finished with value: 0.8505747126436782 and parameters: {'objective': 'CrossEntropy', 'colsample_bylevel': 0.08456855468394682, 'depth': 10, 'boosting_type': 'Plain', 'bootstrap_type': 'Bayesian', 'bagging_temperature': 3.2082670290436255}. Best is trial 3065 with value: 0.8863636363636364.
[32m[I 2023-04-21 03:23:21,895][39m Trial 5568 finished with value: 0.8666666666666666 and parameters: {'objective': 'Logloss', 'colsample_bylevel': 0.07255390661582065, 'depth': 5, 'boosting_type': 'Plain', 'bootstrap_type': 'Bayesian', 'bagging_temperature': 9.613518613064713}. Best is trial 3065 with value: 0.8863636363636364.
[32m[I 2023-04-21 03:23:23,244][39m Trial 5569 finished with value: 0.8409090909090909 and parameters: {'objective': 'CrossEntropy', 'colsample_bylevel': 0.07374817136776382, 'depth': 9, 'boosting_type': 'Plain', 'bootstrap_type': 'Bayesian', 'bagging_temperature': 9.395842788839012}. Best is trial 3065 with value: 0.8863636363636364.
[32m[I 2023-04-21 03:23:23,956][39m Trial 5570 finished with value: 0.8505747126436782 and parameters: {'objective': 'CrossEntropy', 'colsample_bylevel': 0.08538874590729627, 'depth': 10, 'boosting_type': 'Plain', 'bootstrap_type': 'Bayesian', 'bagging_temperature': 9.43439689289964}. Best is trial 3065 with value: 0.8863636363636364.
[32m[I 2023-04-21 03:23:25,206][39m Trial 5571 finished with value: 0.8666666666666666 and parameters: {'objective': 'Logloss', 'colsample_bylevel': 0.09270999104497339, 'depth': 3, 'boosting_type': 'Plain', 'bootstrap_type': 'Bayesian', 'bagging_temperature': 9.980998667424258}. Best is trial 3065 with value: 0.8863636363636364.
[32m[I 2023-04-21 03:23:26,253][39m Trial 5572 finished with value: 0.8409090909090909 and parameters: {'objective': 'CrossEntropy', 'colsample_bylevel': 0.07554858414101415, 'depth': 12, 'boosting_type': 'Plain', 'bootstrap_type': 'Bernoulli', 'subsample': 0.43188146859688925}. Best is trial 3065 with value: 0.8863636363636364.
[32m[I 2023-04-21 03:23:27,251][39m Trial 5573 finished with value: 0.8539325842696629 and parameters: {'objective': 'CrossEntropy', 'colsample_bylevel': 0.08796156319756214, 'depth': 3, 'boosting_type': 'Plain', 'bootstrap_type': 'Bayesian', 'bagging_temperature': 9.304378958150169}. Best is trial 3065 with value: 0.8863636363636364.
[32m[I 2023-04-21 03:23:28,048][39m Trial 5574 finished with value: 0.8791208791208791 and parameters: {'objective': 'CrossEntropy', 'colsample_bylevel': 0.07360589472337704, 'depth': 9, 'boosting_type': 'Plain', 'bootstrap_type': 'Bayesian', 'bagging_temperature': 9.466470837215848}. Best is trial 3065 with value: 0.8863636363636364.
[32m[I 2023-04-21 03:23:29,447][39m Trial 5575 finished with value: 0.8139534883720929 and parameters: {'objective': 'CrossEntropy', 'colsample_bylevel': 0.07681857233783469, 'depth': 9, 'boosting_type': 'Plain', 'bootstrap_type': 'Bayesian', 'bagging_temperature': 9.164127288880866}. Best is trial 3065 with value: 0.8863636363636364.
[32m[I 2023-04-21 03:23:30,851][39m Trial 5576 finished with value: 0.8539325842696629 and parameters: {'objective': 'CrossEntropy', 'colsample_bylevel': 0.06987845963266585, 'depth': 9, 'boosting_type': 'Plain', 'bootstrap_type': 'Bayesian', 'bagging_temperature': 3.938821250076206}. Best is trial 3065 with value: 0.8863636363636364.
[32m[I 2023-04-21 03:23:32,122][39m Trial 5577 finished with value: 0.8409090909090909 and parameters: {'objective': 'Logloss', 'colsample_bylevel': 0.07383307842405677, 'depth': 10, 'boosting_type': 'Plain', 'bootstrap_type': 'Bayesian', 'bagging_temperature': 8.292626098554452}. Best is trial 3065 with value: 0.8863636363636364.
[32m[I 2023-04-21 03:23:33,170][39m Trial 5578 finished with value: 0.8666666666666666 and parameters: {'objective': 'CrossEntropy', 'colsample_bylevel': 0.07606050436743478, 'depth': 3, 'boosting_type': 'Plain', 'bootstrap_type': 'Bayesian', 'bagging_temperature': 9.655509532762752}. Best is trial 3065 with value: 0.8863636363636364.
[32m[I 2023-04-21 03:23:37,173][39m Trial 5579 finished with value: 0.8089887640449439 and parameters: {'objective': 'CrossEntropy', 'colsample_bylevel': 0.08701051384576078, 'depth': 1, 'boosting_type': 'Ordered', 'bootstrap_type': 'Bayesian', 'bagging_temperature': 8.822093850550514}. Best is trial 3065 with value: 0.8863636363636364.
[32m[I 2023-04-21 03:23:38,537][39m Trial 5580 finished with value: 0.8409090909090909 and parameters: {'objective': 'CrossEntropy', 'colsample_bylevel': 0.07589967687835632, 'depth': 10, 'boosting_type': 'Plain', 'bootstrap_type': 'Bayesian', 'bagging_temperature': 9.795066706936801}. Best is trial 3065 with value: 0.8863636363636364.
[32m[I 2023-04-21 03:23:39,622][39m Trial 5581 finished with value: 0.8505747126436782 and parameters: {'objective': 'CrossEntropy', 'colsample_bylevel': 0.08798227566829633, 'depth': 11, 'boosting_type': 'Plain', 'bootstrap_type': 'Bayesian', 'bagging_temperature': 9.02570054323327}. Best is trial 3065 with value: 0.8863636363636364.
[32m[I 2023-04-21 03:23:40,782][39m Trial 5582 finished with value: 0.8539325842696629 and parameters: {'objective': 'CrossEntropy', 'colsample_bylevel': 0.07932953316219396, 'depth': 11, 'boosting_type': 'Plain', 'bootstrap_type': 'Bayesian', 'bagging_temperature': 8.84811327592007}. Best is trial 3065 with value: 0.8863636363636364.
[32m[I 2023-04-21 03:23:42,172][39m Trial 5583 finished with value: 0.8791208791208791 and parameters: {'objective': 'Logloss', 'colsample_bylevel': 0.07330582500305885, 'depth': 6, 'boosting_type': 'Plain', 'bootstrap_type': 'Bayesian', 'bagging_temperature': 9.745794082643412}. Best is trial 3065 with value: 0.8863636363636364.
[32m[I 2023-04-21 03:23:43,086][39m Trial 5584 finished with value: 0.8444444444444446 and parameters: {'objective': 'CrossEntropy', 'colsample_bylevel': 0.06576921481962739, 'depth': 8, 'boosting_type': 'Plain', 'bootstrap_type': 'MVS'}. Best is trial 3065 with value: 0.8863636363636364.
[32m[I 2023-04-21 03:23:44,301][39m Trial 5585 finished with value: 0.8791208791208791 and parameters: {'objective': 'CrossEntropy', 'colsample_bylevel': 0.07137148329467126, 'depth': 10, 'boosting_type': 'Plain', 'bootstrap_type': 'Bayesian', 'bagging_temperature': 8.54386480346204}. Best is trial 3065 with value: 0.8863636363636364.
[32m[I 2023-04-21 03:23:45,621][39m Trial 5586 finished with value: 0.8409090909090909 and parameters: {'objective': 'CrossEntropy', 'colsample_bylevel': 0.0717369684908115, 'depth': 11, 'boosting_type': 'Plain', 'bootstrap_type': 'Bayesian', 'bagging_temperature': 8.695715658315223}. Best is trial 3065 with value: 0.8863636363636364.
[32m[I 2023-04-21 03:23:46,794][39m Trial 5587 finished with value: 0.8539325842696629 and parameters: {'objective': 'CrossEntropy', 'colsample_bylevel': 0.07342677290311085, 'depth': 10, 'boosting_type': 'Plain', 'bootstrap_type': 'Bayesian', 'bagging_temperature': 9.26855153174078}. Best is trial 3065 with value: 0.8863636363636364.
