[32m[I 2023-04-21 03:18:12,949][39m Trial 5326 finished with value: 0.8409090909090909 and parameters: {'objective': 'CrossEntropy', 'colsample_bylevel': 0.09550153140812259, 'depth': 3, 'boosting_type': 'Plain', 'bootstrap_type': 'Bayesian', 'bagging_temperature': 3.309527811231358}. Best is trial 3065 with value: 0.8863636363636364.
[32m[I 2023-04-21 03:18:14,291][39m Trial 5327 finished with value: 0.8409090909090909 and parameters: {'objective': 'CrossEntropy', 'colsample_bylevel': 0.0854881981436482, 'depth': 3, 'boosting_type': 'Plain', 'bootstrap_type': 'MVS'}. Best is trial 3065 with value: 0.8863636363636364.
[32m[I 2023-04-21 03:18:15,169][39m Trial 5328 finished with value: 0.8275862068965518 and parameters: {'objective': 'CrossEntropy', 'colsample_bylevel': 0.09100902748606372, 'depth': 3, 'boosting_type': 'Plain', 'bootstrap_type': 'Bayesian', 'bagging_temperature': 9.99752819890858}. Best is trial 3065 with value: 0.8863636363636364.
[32m[I 2023-04-21 03:18:15,915][39m Trial 5329 finished with value: 0.8666666666666666 and parameters: {'objective': 'CrossEntropy', 'colsample_bylevel': 0.06861096010611047, 'depth': 8, 'boosting_type': 'Plain', 'bootstrap_type': 'Bayesian', 'bagging_temperature': 9.18554265679628}. Best is trial 3065 with value: 0.8863636363636364.
[32m[I 2023-04-21 03:18:16,787][39m Trial 5330 finished with value: 0.8539325842696629 and parameters: {'objective': 'CrossEntropy', 'colsample_bylevel': 0.08200810351468141, 'depth': 3, 'boosting_type': 'Plain', 'bootstrap_type': 'MVS'}. Best is trial 3065 with value: 0.8863636363636364.
[32m[I 2023-04-21 03:18:18,234][39m Trial 5331 finished with value: 0.7674418604651163 and parameters: {'objective': 'Logloss', 'colsample_bylevel': 0.027369007100630116, 'depth': 5, 'boosting_type': 'Plain', 'bootstrap_type': 'Bayesian', 'bagging_temperature': 9.755463238202752}. Best is trial 3065 with value: 0.8863636363636364.
[32m[I 2023-04-21 03:18:19,255][39m Trial 5332 finished with value: 0.8275862068965518 and parameters: {'objective': 'CrossEntropy', 'colsample_bylevel': 0.07198660149503788, 'depth': 12, 'boosting_type': 'Plain', 'bootstrap_type': 'Bayesian', 'bagging_temperature': 7.797204229215189}. Best is trial 3065 with value: 0.8863636363636364.
[32m[I 2023-04-21 03:18:20,564][39m Trial 5333 finished with value: 0.8539325842696629 and parameters: {'objective': 'CrossEntropy', 'colsample_bylevel': 0.06819137804971218, 'depth': 12, 'boosting_type': 'Plain', 'bootstrap_type': 'Bayesian', 'bagging_temperature': 9.244634518982124}. Best is trial 3065 with value: 0.8863636363636364.
[32m[I 2023-04-21 03:18:21,353][39m Trial 5334 finished with value: 0.8539325842696629 and parameters: {'objective': 'CrossEntropy', 'colsample_bylevel': 0.08751705953514897, 'depth': 2, 'boosting_type': 'Plain', 'bootstrap_type': 'Bayesian', 'bagging_temperature': 9.405872238738022}. Best is trial 3065 with value: 0.8863636363636364.
[32m[I 2023-04-21 03:18:22,215][39m Trial 5335 finished with value: 0.8409090909090909 and parameters: {'objective': 'CrossEntropy', 'colsample_bylevel': 0.07921413106156847, 'depth': 6, 'boosting_type': 'Plain', 'bootstrap_type': 'Bayesian', 'bagging_temperature': 9.504813486890926}. Best is trial 3065 with value: 0.8863636363636364.
[32m[I 2023-04-21 03:18:27,207][39m Trial 5336 finished with value: 0.8275862068965518 and parameters: {'objective': 'Logloss', 'colsample_bylevel': 0.08982758483532556, 'depth': 11, 'boosting_type': 'Ordered', 'bootstrap_type': 'Bayesian', 'bagging_temperature': 9.398236670749723}. Best is trial 3065 with value: 0.8863636363636364.
[32m[I 2023-04-21 03:18:28,258][39m Trial 5337 finished with value: 0.8275862068965518 and parameters: {'objective': 'CrossEntropy', 'colsample_bylevel': 0.07755590387057335, 'depth': 10, 'boosting_type': 'Plain', 'bootstrap_type': 'Bayesian', 'bagging_temperature': 9.585832153870818}. Best is trial 3065 with value: 0.8863636363636364.
[32m[I 2023-04-21 03:18:29,515][39m Trial 5338 finished with value: 0.8409090909090909 and parameters: {'objective': 'CrossEntropy', 'colsample_bylevel': 0.06766280344870355, 'depth': 9, 'boosting_type': 'Plain', 'bootstrap_type': 'Bayesian', 'bagging_temperature': 9.107283739056676}. Best is trial 3065 with value: 0.8863636363636364.
[32m[I 2023-04-21 03:18:31,240][39m Trial 5339 finished with value: 0.8139534883720929 and parameters: {'objective': 'CrossEntropy', 'colsample_bylevel': 0.08908080460048066, 'depth': 9, 'boosting_type': 'Plain', 'bootstrap_type': 'Bayesian', 'bagging_temperature': 9.678847743074481}. Best is trial 3065 with value: 0.8863636363636364.
[32m[I 2023-04-21 03:18:32,210][39m Trial 5340 finished with value: 0.8539325842696629 and parameters: {'objective': 'CrossEntropy', 'colsample_bylevel': 0.0789560436252766, 'depth': 10, 'boosting_type': 'Plain', 'bootstrap_type': 'Bayesian', 'bagging_temperature': 9.411845363790555}. Best is trial 3065 with value: 0.8863636363636364.
[32m[I 2023-04-21 03:18:33,187][39m Trial 5341 finished with value: 0.8539325842696629 and parameters: {'objective': 'CrossEntropy', 'colsample_bylevel': 0.0782207643239849, 'depth': 9, 'boosting_type': 'Plain', 'bootstrap_type': 'Bayesian', 'bagging_temperature': 9.703001459454448}. Best is trial 3065 with value: 0.8863636363636364.
[32m[I 2023-04-21 03:18:34,592][39m Trial 5342 finished with value: 0.8539325842696629 and parameters: {'objective': 'Logloss', 'colsample_bylevel': 0.07929855141202638, 'depth': 9, 'boosting_type': 'Plain', 'bootstrap_type': 'Bernoulli', 'subsample': 0.41389926819302414}. Best is trial 3065 with value: 0.8863636363636364.
[32m[I 2023-04-21 03:18:35,434][39m Trial 5343 finished with value: 0.8409090909090909 and parameters: {'objective': 'CrossEntropy', 'colsample_bylevel': 0.04563702541004613, 'depth': 3, 'boosting_type': 'Plain', 'bootstrap_type': 'Bayesian', 'bagging_temperature': 8.803799186236859}. Best is trial 3065 with value: 0.8863636363636364.
[32m[I 2023-04-21 03:18:36,112][39m Trial 5344 finished with value: 0.8666666666666666 and parameters: {'objective': 'CrossEntropy', 'colsample_bylevel': 0.0659065790203793, 'depth': 4, 'boosting_type': 'Plain', 'bootstrap_type': 'Bayesian', 'bagging_temperature': 9.527965799587255}. Best is trial 3065 with value: 0.8863636363636364.
[32m[I 2023-04-21 03:18:37,329][39m Trial 5345 finished with value: 0.8666666666666666 and parameters: {'objective': 'Logloss', 'colsample_bylevel': 0.07524606399366425, 'depth': 5, 'boosting_type': 'Plain', 'bootstrap_type': 'Bayesian', 'bagging_temperature': 8.4172960385955}. Best is trial 3065 with value: 0.8863636363636364.
[32m[I 2023-04-21 03:18:38,007][39m Trial 5346 finished with value: 0.8539325842696629 and parameters: {'objective': 'Logloss', 'colsample_bylevel': 0.07559307545499255, 'depth': 5, 'boosting_type': 'Plain', 'bootstrap_type': 'Bayesian', 'bagging_temperature': 9.69766571277969}. Best is trial 3065 with value: 0.8863636363636364.
[32m[I 2023-04-21 03:18:39,326][39m Trial 5347 finished with value: 0.8666666666666666 and parameters: {'objective': 'Logloss', 'colsample_bylevel': 0.08269020867681694, 'depth': 4, 'boosting_type': 'Plain', 'bootstrap_type': 'Bayesian', 'bagging_temperature': 9.243848379953251}. Best is trial 3065 with value: 0.8863636363636364.
[32m[I 2023-04-21 03:18:40,475][39m Trial 5348 finished with value: 0.8275862068965518 and parameters: {'objective': 'Logloss', 'colsample_bylevel': 0.07506058072954386, 'depth': 10, 'boosting_type': 'Plain', 'bootstrap_type': 'Bayesian', 'bagging_temperature': 9.997095702184735}. Best is trial 3065 with value: 0.8863636363636364.
[32m[I 2023-04-21 03:18:41,600][39m Trial 5349 finished with value: 0.8666666666666666 and parameters: {'objective': 'CrossEntropy', 'colsample_bylevel': 0.07964095154431018, 'depth': 3, 'boosting_type': 'Plain', 'bootstrap_type': 'Bayesian', 'bagging_temperature': 9.989539096961948}. Best is trial 3065 with value: 0.8863636363636364.
[32m[I 2023-04-21 03:18:42,661][39m Trial 5350 finished with value: 0.8409090909090909 and parameters: {'objective': 'CrossEntropy', 'colsample_bylevel': 0.07281405639434828, 'depth': 4, 'boosting_type': 'Plain', 'bootstrap_type': 'Bayesian', 'bagging_temperature': 9.673153004132798}. Best is trial 3065 with value: 0.8863636363636364.
[32m[I 2023-04-21 03:18:44,027][39m Trial 5351 finished with value: 0.8505747126436782 and parameters: {'objective': 'CrossEntropy', 'colsample_bylevel': 0.08793307834352744, 'depth': 9, 'boosting_type': 'Plain', 'bootstrap_type': 'Bayesian', 'bagging_temperature': 9.77932433470433}. Best is trial 3065 with value: 0.8863636363636364.
[32m[I 2023-04-21 03:18:44,831][39m Trial 5352 finished with value: 0.8409090909090909 and parameters: {'objective': 'Logloss', 'colsample_bylevel': 0.0668257836360741, 'depth': 4, 'boosting_type': 'Plain', 'bootstrap_type': 'MVS'}. Best is trial 3065 with value: 0.8863636363636364.
[32m[I 2023-04-21 03:18:45,841][39m Trial 5353 finished with value: 0.8666666666666666 and parameters: {'objective': 'CrossEntropy', 'colsample_bylevel': 0.08226134785103245, 'depth': 3, 'boosting_type': 'Plain', 'bootstrap_type': 'Bayesian', 'bagging_temperature': 9.280691998020496}. Best is trial 3065 with value: 0.8863636363636364.
[32m[I 2023-04-21 03:18:51,009][39m Trial 5354 finished with value: 0.8275862068965518 and parameters: {'objective': 'CrossEntropy', 'colsample_bylevel': 0.08279034352888114, 'depth': 5, 'boosting_type': 'Ordered', 'bootstrap_type': 'Bayesian', 'bagging_temperature': 9.395952354291529}. Best is trial 3065 with value: 0.8863636363636364.
[32m[I 2023-04-21 03:18:52,200][39m Trial 5355 finished with value: 0.8539325842696629 and parameters: {'objective': 'CrossEntropy', 'colsample_bylevel': 0.08238280501433567, 'depth': 3, 'boosting_type': 'Plain', 'bootstrap_type': 'Bernoulli', 'subsample': 0.10492043035052995}. Best is trial 3065 with value: 0.8863636363636364.
[32m[I 2023-04-21 03:18:53,409][39m Trial 5356 finished with value: 0.8409090909090909 and parameters: {'objective': 'CrossEntropy', 'colsample_bylevel': 0.08286722745265973, 'depth': 3, 'boosting_type': 'Plain', 'bootstrap_type': 'MVS'}. Best is trial 3065 with value: 0.8863636363636364.
[32m[I 2023-04-21 03:18:54,384][39m Trial 5357 finished with value: 0.8275862068965518 and parameters: {'objective': 'CrossEntropy', 'colsample_bylevel': 0.07387495408390508, 'depth': 9, 'boosting_type': 'Plain', 'bootstrap_type': 'Bayesian', 'bagging_temperature': 9.664211348932662}. Best is trial 3065 with value: 0.8863636363636364.
[32m[I 2023-04-21 03:18:55,523][39m Trial 5358 finished with value: 0.8409090909090909 and parameters: {'objective': 'CrossEntropy', 'colsample_bylevel': 0.08201708831684824, 'depth': 3, 'boosting_type': 'Plain', 'bootstrap_type': 'Bayesian', 'bagging_temperature': 0.31419756576931057}. Best is trial 3065 with value: 0.8863636363636364.
[32m[I 2023-04-21 03:18:57,294][39m Trial 5359 finished with value: 0.8539325842696629 and parameters: {'objective': 'CrossEntropy', 'colsample_bylevel': 0.0753588931749266, 'depth': 9, 'boosting_type': 'Plain', 'bootstrap_type': 'Bayesian', 'bagging_temperature': 9.992720111961336}. Best is trial 3065 with value: 0.8863636363636364.
[32m[I 2023-04-21 03:18:58,227][39m Trial 5360 finished with value: 0.8539325842696629 and parameters: {'objective': 'CrossEntropy', 'colsample_bylevel': 0.08150297397762397, 'depth': 3, 'boosting_type': 'Plain', 'bootstrap_type': 'Bayesian', 'bagging_temperature': 9.046127117095091}. Best is trial 3065 with value: 0.8863636363636364.
[32m[I 2023-04-21 03:18:58,989][39m Trial 5361 finished with value: 0.8539325842696629 and parameters: {'objective': 'CrossEntropy', 'colsample_bylevel': 0.07211654503116194, 'depth': 8, 'boosting_type': 'Plain', 'bootstrap_type': 'Bayesian', 'bagging_temperature': 9.088205548486451}. Best is trial 3065 with value: 0.8863636363636364.
[32m[I 2023-04-21 03:18:59,666][39m Trial 5362 finished with value: 0.8409090909090909 and parameters: {'objective': 'CrossEntropy', 'colsample_bylevel': 0.07614099650850387, 'depth': 10, 'boosting_type': 'Plain', 'bootstrap_type': 'Bayesian', 'bagging_temperature': 4.809947705879574}. Best is trial 3065 with value: 0.8863636363636364.
[32m[I 2023-04-21 03:19:00,941][39m Trial 5363 finished with value: 0.8539325842696629 and parameters: {'objective': 'Logloss', 'colsample_bylevel': 0.0810939937643187, 'depth': 5, 'boosting_type': 'Plain', 'bootstrap_type': 'Bayesian', 'bagging_temperature': 9.221514629155543}. Best is trial 3065 with value: 0.8863636363636364.
[32m[I 2023-04-21 03:19:02,376][39m Trial 5364 finished with value: 0.8275862068965518 and parameters: {'objective': 'CrossEntropy', 'colsample_bylevel': 0.07179673748307729, 'depth': 9, 'boosting_type': 'Plain', 'bootstrap_type': 'Bayesian', 'bagging_temperature': 8.962171101201703}. Best is trial 3065 with value: 0.8863636363636364.
[32m[I 2023-04-21 03:19:03,369][39m Trial 5365 finished with value: 0.8372093023255814 and parameters: {'objective': 'CrossEntropy', 'colsample_bylevel': 0.07231685899777068, 'depth': 6, 'boosting_type': 'Plain', 'bootstrap_type': 'Bayesian', 'bagging_temperature': 8.823621785389713}. Best is trial 3065 with value: 0.8863636363636364.
[32m[I 2023-04-21 03:19:04,356][39m Trial 5366 finished with value: 0.8539325842696629 and parameters: {'objective': 'CrossEntropy', 'colsample_bylevel': 0.07069315231776557, 'depth': 8, 'boosting_type': 'Plain', 'bootstrap_type': 'Bayesian', 'bagging_temperature': 8.940549215769588}. Best is trial 3065 with value: 0.8863636363636364.
[32m[I 2023-04-21 03:19:05,040][39m Trial 5367 finished with value: 0.8666666666666666 and parameters: {'objective': 'CrossEntropy', 'colsample_bylevel': 0.08662749081201994, 'depth': 3, 'boosting_type': 'Plain', 'bootstrap_type': 'Bayesian', 'bagging_temperature': 9.574866147015092}. Best is trial 3065 with value: 0.8863636363636364.
[32m[I 2023-04-21 03:19:05,742][39m Trial 5368 finished with value: 0.8539325842696629 and parameters: {'objective': 'CrossEntropy', 'colsample_bylevel': 0.06909659325393362, 'depth': 10, 'boosting_type': 'Plain', 'bootstrap_type': 'Bayesian', 'bagging_temperature': 8.59567519777061}. Best is trial 3065 with value: 0.8863636363636364.
[32m[I 2023-04-21 03:19:07,151][39m Trial 5369 finished with value: 0.8139534883720929 and parameters: {'objective': 'CrossEntropy', 'colsample_bylevel': 0.09719823748339279, 'depth': 3, 'boosting_type': 'Plain', 'bootstrap_type': 'Bayesian', 'bagging_temperature': 8.628760642819866}. Best is trial 3065 with value: 0.8863636363636364.
[32m[I 2023-04-21 03:19:08,211][39m Trial 5370 finished with value: 0.8409090909090909 and parameters: {'objective': 'Logloss', 'colsample_bylevel': 0.07895043982365993, 'depth': 6, 'boosting_type': 'Plain', 'bootstrap_type': 'Bayesian', 'bagging_temperature': 9.46982096138575}. Best is trial 3065 with value: 0.8863636363636364.
[32m[I 2023-04-21 03:19:09,612][39m Trial 5371 finished with value: 0.8409090909090909 and parameters: {'objective': 'CrossEntropy', 'colsample_bylevel': 0.07764953348908317, 'depth': 6, 'boosting_type': 'Plain', 'bootstrap_type': 'Bayesian', 'bagging_temperature': 9.294025498330658}. Best is trial 3065 with value: 0.8863636363636364.
[32m[I 2023-04-21 03:19:10,603][39m Trial 5372 finished with value: 0.8409090909090909 and parameters: {'objective': 'CrossEntropy', 'colsample_bylevel': 0.07760873154188104, 'depth': 7, 'boosting_type': 'Plain', 'bootstrap_type': 'Bayesian', 'bagging_temperature': 9.347123689561666}. Best is trial 3065 with value: 0.8863636363636364.
[32m[I 2023-04-21 03:19:15,244][39m Trial 5373 finished with value: 0.8409090909090909 and parameters: {'objective': 'CrossEntropy', 'colsample_bylevel': 0.0798857957704912, 'depth': 3, 'boosting_type': 'Ordered', 'bootstrap_type': 'Bayesian', 'bagging_temperature': 9.175515362322182}. Best is trial 3065 with value: 0.8863636363636364.
[32m[I 2023-04-21 03:19:16,364][39m Trial 5374 finished with value: 0.8666666666666666 and parameters: {'objective': 'Logloss', 'colsample_bylevel': 0.07651795728377754, 'depth': 10, 'boosting_type': 'Plain', 'bootstrap_type': 'Bayesian', 'bagging_temperature': 9.74103749860394}. Best is trial 3065 with value: 0.8863636363636364.
[32m[I 2023-04-21 03:19:17,596][39m Trial 5375 finished with value: 0.8539325842696629 and parameters: {'objective': 'CrossEntropy', 'colsample_bylevel': 0.07848860067344757, 'depth': 7, 'boosting_type': 'Plain', 'bootstrap_type': 'Bayesian', 'bagging_temperature': 9.805674520734941}. Best is trial 3065 with value: 0.8863636363636364.
[32m[I 2023-04-21 03:19:18,724][39m Trial 5376 finished with value: 0.8764044943820225 and parameters: {'objective': 'CrossEntropy', 'colsample_bylevel': 0.09103545216100871, 'depth': 2, 'boosting_type': 'Plain', 'bootstrap_type': 'Bayesian', 'bagging_temperature': 9.795623896175744}. Best is trial 3065 with value: 0.8863636363636364.
[32m[I 2023-04-21 03:19:19,544][39m Trial 5377 finished with value: 0.8372093023255814 and parameters: {'objective': 'CrossEntropy', 'colsample_bylevel': 0.07417213228333981, 'depth': 5, 'boosting_type': 'Plain', 'bootstrap_type': 'Bayesian', 'bagging_temperature': 6.658115585832204}. Best is trial 3065 with value: 0.8863636363636364.
[32m[I 2023-04-21 03:19:20,560][39m Trial 5378 finished with value: 0.8275862068965518 and parameters: {'objective': 'CrossEntropy', 'colsample_bylevel': 0.07878872893093822, 'depth': 9, 'boosting_type': 'Plain', 'bootstrap_type': 'Bayesian', 'bagging_temperature': 9.602415710236675}. Best is trial 3065 with value: 0.8863636363636364.
[32m[I 2023-04-21 03:19:21,538][39m Trial 5379 finished with value: 0.8791208791208791 and parameters: {'objective': 'CrossEntropy', 'colsample_bylevel': 0.08409737984241705, 'depth': 3, 'boosting_type': 'Plain', 'bootstrap_type': 'Bayesian', 'bagging_temperature': 9.24865806228529}. Best is trial 3065 with value: 0.8863636363636364.
[32m[I 2023-04-21 03:19:22,631][39m Trial 5380 finished with value: 0.8505747126436782 and parameters: {'objective': 'CrossEntropy', 'colsample_bylevel': 0.08612778990948237, 'depth': 12, 'boosting_type': 'Plain', 'bootstrap_type': 'Bayesian', 'bagging_temperature': 9.233787352777718}. Best is trial 3065 with value: 0.8863636363636364.
[32m[I 2023-04-21 03:19:23,948][39m Trial 5381 finished with value: 0.8181818181818182 and parameters: {'objective': 'Logloss', 'colsample_bylevel': 0.08504755087204952, 'depth': 4, 'boosting_type': 'Plain', 'bootstrap_type': 'MVS'}. Best is trial 3065 with value: 0.8863636363636364.
[32m[I 2023-04-21 03:19:25,167][39m Trial 5382 finished with value: 0.8764044943820225 and parameters: {'objective': 'CrossEntropy', 'colsample_bylevel': 0.08322457992542648, 'depth': 2, 'boosting_type': 'Plain', 'bootstrap_type': 'Bayesian', 'bagging_temperature': 9.07841473052001}. Best is trial 3065 with value: 0.8863636363636364.
[32m[I 2023-04-21 03:19:26,018][39m Trial 5383 finished with value: 0.8372093023255814 and parameters: {'objective': 'CrossEntropy', 'colsample_bylevel': 0.07627366334986148, 'depth': 9, 'boosting_type': 'Plain', 'bootstrap_type': 'Bayesian', 'bagging_temperature': 9.836085514918658}. Best is trial 3065 with value: 0.8863636363636364.
[32m[I 2023-04-21 03:19:26,869][39m Trial 5384 finished with value: 0.8791208791208791 and parameters: {'objective': 'Logloss', 'colsample_bylevel': 0.08424842450720567, 'depth': 3, 'boosting_type': 'Plain', 'bootstrap_type': 'Bayesian', 'bagging_temperature': 9.700001045597283}. Best is trial 3065 with value: 0.8863636363636364.
[32m[I 2023-04-21 03:19:28,032][39m Trial 5385 finished with value: 0.8539325842696629 and parameters: {'objective': 'Logloss', 'colsample_bylevel': 0.0840139993473737, 'depth': 3, 'boosting_type': 'Plain', 'bootstrap_type': 'Bayesian', 'bagging_temperature': 8.52731715823224}. Best is trial 3065 with value: 0.8863636363636364.
[32m[I 2023-04-21 03:19:29,089][39m Trial 5386 finished with value: 0.8539325842696629 and parameters: {'objective': 'CrossEntropy', 'colsample_bylevel': 0.07271943020392728, 'depth': 5, 'boosting_type': 'Plain', 'bootstrap_type': 'Bayesian', 'bagging_temperature': 9.060660396074924}. Best is trial 3065 with value: 0.8863636363636364.
[32m[I 2023-04-21 03:19:30,385][39m Trial 5387 finished with value: 0.8409090909090909 and parameters: {'objective': 'CrossEntropy', 'colsample_bylevel': 0.06284004831907207, 'depth': 6, 'boosting_type': 'Plain', 'bootstrap_type': 'MVS'}. Best is trial 3065 with value: 0.8863636363636364.
[32m[I 2023-04-21 03:19:31,368][39m Trial 5388 finished with value: 0.8409090909090909 and parameters: {'objective': 'Logloss', 'colsample_bylevel': 0.08167748889169386, 'depth': 5, 'boosting_type': 'Plain', 'bootstrap_type': 'Bayesian', 'bagging_temperature': 8.479594235731795}. Best is trial 3065 with value: 0.8863636363636364.
[32m[I 2023-04-21 03:19:32,092][39m Trial 5389 finished with value: 0.8539325842696629 and parameters: {'objective': 'CrossEntropy', 'colsample_bylevel': 0.07469994784666571, 'depth': 10, 'boosting_type': 'Plain', 'bootstrap_type': 'Bayesian', 'bagging_temperature': 9.667291896630635}. Best is trial 3065 with value: 0.8863636363636364.
[32m[I 2023-04-21 03:19:33,339][39m Trial 5390 finished with value: 0.8139534883720929 and parameters: {'objective': 'CrossEntropy', 'colsample_bylevel': 0.09611617248129255, 'depth': 3, 'boosting_type': 'Plain', 'bootstrap_type': 'Bayesian', 'bagging_temperature': 5.80176090957839}. Best is trial 3065 with value: 0.8863636363636364.
