[32m[I 2023-04-21 02:00:20,045][39m Trial 1389 finished with value: 0.8275862068965518 and parameters: {'objective': 'CrossEntropy', 'colsample_bylevel': 0.08163399070763601, 'depth': 6, 'boosting_type': 'Plain', 'bootstrap_type': 'Bayesian', 'bagging_temperature': 9.394339556394383}. Best is trial 98 with value: 0.8791208791208791.
[32m[I 2023-04-21 02:00:24,888][39m Trial 1390 finished with value: 0.7912087912087912 and parameters: {'objective': 'Logloss', 'colsample_bylevel': 0.07784313294392407, 'depth': 4, 'boosting_type': 'Ordered', 'bootstrap_type': 'MVS'}. Best is trial 98 with value: 0.8791208791208791.
[32m[I 2023-04-21 02:00:25,970][39m Trial 1391 finished with value: 0.8666666666666666 and parameters: {'objective': 'Logloss', 'colsample_bylevel': 0.07593452941412944, 'depth': 6, 'boosting_type': 'Plain', 'bootstrap_type': 'Bayesian', 'bagging_temperature': 8.018981722450755}. Best is trial 98 with value: 0.8791208791208791.
[32m[I 2023-04-21 02:00:26,828][39m Trial 1392 finished with value: 0.8275862068965518 and parameters: {'objective': 'CrossEntropy', 'colsample_bylevel': 0.07303594092958339, 'depth': 9, 'boosting_type': 'Plain', 'bootstrap_type': 'Bayesian', 'bagging_temperature': 9.863093481102934}. Best is trial 98 with value: 0.8791208791208791.
[32m[I 2023-04-21 02:00:27,667][39m Trial 1393 finished with value: 0.8539325842696629 and parameters: {'objective': 'CrossEntropy', 'colsample_bylevel': 0.07898167422749149, 'depth': 3, 'boosting_type': 'Plain', 'bootstrap_type': 'Bayesian', 'bagging_temperature': 9.990469129910943}. Best is trial 98 with value: 0.8791208791208791.
[32m[I 2023-04-21 02:00:28,476][39m Trial 1394 finished with value: 0.8275862068965518 and parameters: {'objective': 'CrossEntropy', 'colsample_bylevel': 0.07539519422011827, 'depth': 4, 'boosting_type': 'Plain', 'bootstrap_type': 'Bayesian', 'bagging_temperature': 9.561655338253283}. Best is trial 98 with value: 0.8791208791208791.
[32m[I 2023-04-21 02:00:29,427][39m Trial 1395 finished with value: 0.8409090909090909 and parameters: {'objective': 'Logloss', 'colsample_bylevel': 0.09445480633914946, 'depth': 5, 'boosting_type': 'Plain', 'bootstrap_type': 'Bayesian', 'bagging_temperature': 8.683849517444022}. Best is trial 98 with value: 0.8791208791208791.
[32m[I 2023-04-21 02:00:30,310][39m Trial 1396 finished with value: 0.8539325842696629 and parameters: {'objective': 'CrossEntropy', 'colsample_bylevel': 0.07288709526972573, 'depth': 4, 'boosting_type': 'Plain', 'bootstrap_type': 'Bayesian', 'bagging_temperature': 9.660347003868516}. Best is trial 98 with value: 0.8791208791208791.
[32m[I 2023-04-21 02:00:31,277][39m Trial 1397 finished with value: 0.8275862068965518 and parameters: {'objective': 'CrossEntropy', 'colsample_bylevel': 0.0775222984129897, 'depth': 4, 'boosting_type': 'Plain', 'bootstrap_type': 'Bayesian', 'bagging_temperature': 9.986746128534511}. Best is trial 98 with value: 0.8791208791208791.
[32m[I 2023-04-21 02:00:31,854][39m Trial 1398 finished with value: 0.8764044943820225 and parameters: {'objective': 'CrossEntropy', 'colsample_bylevel': 0.07777463797028945, 'depth': 3, 'boosting_type': 'Plain', 'bootstrap_type': 'Bayesian', 'bagging_temperature': 9.99587623288685}. Best is trial 98 with value: 0.8791208791208791.
[32m[I 2023-04-21 02:00:32,829][39m Trial 1399 finished with value: 0.8666666666666666 and parameters: {'objective': 'Logloss', 'colsample_bylevel': 0.08054552362477527, 'depth': 3, 'boosting_type': 'Plain', 'bootstrap_type': 'Bayesian', 'bagging_temperature': 8.653910508927433}. Best is trial 98 with value: 0.8791208791208791.
[32m[I 2023-04-21 02:00:34,018][39m Trial 1400 finished with value: 0.8131868131868132 and parameters: {'objective': 'CrossEntropy', 'colsample_bylevel': 0.022042041951859652, 'depth': 3, 'boosting_type': 'Plain', 'bootstrap_type': 'Bayesian', 'bagging_temperature': 7.608356871749162}. Best is trial 98 with value: 0.8791208791208791.
[32m[I 2023-04-21 02:00:34,690][39m Trial 1401 finished with value: 0.8636363636363636 and parameters: {'objective': 'Logloss', 'colsample_bylevel': 0.0787015208433855, 'depth': 5, 'boosting_type': 'Plain', 'bootstrap_type': 'Bayesian', 'bagging_temperature': 9.265295731385276}. Best is trial 98 with value: 0.8791208791208791.
[32m[I 2023-04-21 02:00:35,357][39m Trial 1402 finished with value: 0.8539325842696629 and parameters: {'objective': 'Logloss', 'colsample_bylevel': 0.08099971585916152, 'depth': 4, 'boosting_type': 'Plain', 'bootstrap_type': 'Bayesian', 'bagging_temperature': 9.339037149237386}. Best is trial 98 with value: 0.8791208791208791.
[32m[I 2023-04-21 02:00:36,298][39m Trial 1403 finished with value: 0.8181818181818182 and parameters: {'objective': 'CrossEntropy', 'colsample_bylevel': 0.0789032443384887, 'depth': 11, 'boosting_type': 'Plain', 'bootstrap_type': 'MVS'}. Best is trial 98 with value: 0.8791208791208791.
[32m[I 2023-04-21 02:00:37,383][39m Trial 1404 finished with value: 0.8539325842696629 and parameters: {'objective': 'CrossEntropy', 'colsample_bylevel': 0.08220842506045076, 'depth': 3, 'boosting_type': 'Plain', 'bootstrap_type': 'Bayesian', 'bagging_temperature': 4.420647136349579}. Best is trial 98 with value: 0.8791208791208791.
[32m[I 2023-04-21 02:00:38,028][39m Trial 1405 finished with value: 0.8666666666666666 and parameters: {'objective': 'CrossEntropy', 'colsample_bylevel': 0.08742198005962779, 'depth': 3, 'boosting_type': 'Plain', 'bootstrap_type': 'Bayesian', 'bagging_temperature': 9.599001182858439}. Best is trial 98 with value: 0.8791208791208791.
[32m[I 2023-04-21 02:00:38,956][39m Trial 1406 finished with value: 0.8666666666666666 and parameters: {'objective': 'Logloss', 'colsample_bylevel': 0.08078288218820458, 'depth': 5, 'boosting_type': 'Plain', 'bootstrap_type': 'Bayesian', 'bagging_temperature': 8.176714827994903}. Best is trial 98 with value: 0.8791208791208791.
[32m[I 2023-04-21 02:00:44,113][39m Trial 1407 finished with value: 0.8539325842696629 and parameters: {'objective': 'CrossEntropy', 'colsample_bylevel': 0.0794798280683674, 'depth': 4, 'boosting_type': 'Ordered', 'bootstrap_type': 'Bayesian', 'bagging_temperature': 9.52960413851874}. Best is trial 98 with value: 0.8791208791208791.
[32m[I 2023-04-21 02:00:45,035][39m Trial 1408 finished with value: 0.8409090909090909 and parameters: {'objective': 'CrossEntropy', 'colsample_bylevel': 0.07831284678812674, 'depth': 4, 'boosting_type': 'Plain', 'bootstrap_type': 'Bayesian', 'bagging_temperature': 9.768088214273403}. Best is trial 98 with value: 0.8791208791208791.
[32m[I 2023-04-21 02:00:45,805][39m Trial 1409 finished with value: 0.8275862068965518 and parameters: {'objective': 'CrossEntropy', 'colsample_bylevel': 0.08040466212466832, 'depth': 11, 'boosting_type': 'Plain', 'bootstrap_type': 'Bayesian', 'bagging_temperature': 9.154144454443696}. Best is trial 98 with value: 0.8791208791208791.
[32m[I 2023-04-21 02:00:46,525][39m Trial 1410 finished with value: 0.8089887640449439 and parameters: {'objective': 'CrossEntropy', 'colsample_bylevel': 0.036794833726949534, 'depth': 3, 'boosting_type': 'Plain', 'bootstrap_type': 'Bernoulli', 'subsample': 0.6543789957097839}. Best is trial 98 with value: 0.8791208791208791.
[32m[I 2023-04-21 02:00:47,572][39m Trial 1411 finished with value: 0.8666666666666666 and parameters: {'objective': 'CrossEntropy', 'colsample_bylevel': 0.08380238864118181, 'depth': 3, 'boosting_type': 'Plain', 'bootstrap_type': 'Bayesian', 'bagging_temperature': 9.336687558045904}. Best is trial 98 with value: 0.8791208791208791.
[32m[I 2023-04-21 02:00:48,521][39m Trial 1412 finished with value: 0.8539325842696629 and parameters: {'objective': 'CrossEntropy', 'colsample_bylevel': 0.08674865372025499, 'depth': 10, 'boosting_type': 'Plain', 'bootstrap_type': 'Bayesian', 'bagging_temperature': 9.59859505750909}. Best is trial 98 with value: 0.8791208791208791.
[32m[I 2023-04-21 02:00:49,149][39m Trial 1413 finished with value: 0.8409090909090909 and parameters: {'objective': 'CrossEntropy', 'colsample_bylevel': 0.04572950263980378, 'depth': 3, 'boosting_type': 'Plain', 'bootstrap_type': 'Bayesian', 'bagging_temperature': 9.503571447176455}. Best is trial 98 with value: 0.8791208791208791.
[32m[I 2023-04-21 02:00:49,902][39m Trial 1414 finished with value: 0.8275862068965518 and parameters: {'objective': 'CrossEntropy', 'colsample_bylevel': 0.07686741170465658, 'depth': 6, 'boosting_type': 'Plain', 'bootstrap_type': 'Bayesian', 'bagging_temperature': 9.856060535790558}. Best is trial 98 with value: 0.8791208791208791.
[32m[I 2023-04-21 02:00:50,848][39m Trial 1415 finished with value: 0.8409090909090909 and parameters: {'objective': 'CrossEntropy', 'colsample_bylevel': 0.09124370900041075, 'depth': 10, 'boosting_type': 'Plain', 'bootstrap_type': 'Bayesian', 'bagging_temperature': 8.299696953487645}. Best is trial 98 with value: 0.8791208791208791.
[32m[I 2023-04-21 02:00:51,724][39m Trial 1416 finished with value: 0.8539325842696629 and parameters: {'objective': 'CrossEntropy', 'colsample_bylevel': 0.07787016063462851, 'depth': 4, 'boosting_type': 'Plain', 'bootstrap_type': 'Bayesian', 'bagging_temperature': 9.804094991574438}. Best is trial 98 with value: 0.8791208791208791.
[32m[I 2023-04-21 02:00:52,360][39m Trial 1417 finished with value: 0.8409090909090909 and parameters: {'objective': 'CrossEntropy', 'colsample_bylevel': 0.09262667042548534, 'depth': 3, 'boosting_type': 'Plain', 'bootstrap_type': 'MVS'}. Best is trial 98 with value: 0.8791208791208791.
[32m[I 2023-04-21 02:00:53,625][39m Trial 1418 finished with value: 0.8409090909090909 and parameters: {'objective': 'CrossEntropy', 'colsample_bylevel': 0.07657850666461839, 'depth': 10, 'boosting_type': 'Plain', 'bootstrap_type': 'Bayesian', 'bagging_temperature': 8.668727338923294}. Best is trial 98 with value: 0.8791208791208791.
[32m[I 2023-04-21 02:00:54,651][39m Trial 1419 finished with value: 0.8372093023255814 and parameters: {'objective': 'Logloss', 'colsample_bylevel': 0.08137441196847134, 'depth': 10, 'boosting_type': 'Plain', 'bootstrap_type': 'Bayesian', 'bagging_temperature': 9.454656037345924}. Best is trial 98 with value: 0.8791208791208791.
[32m[I 2023-04-21 02:00:55,307][39m Trial 1420 finished with value: 0.8409090909090909 and parameters: {'objective': 'CrossEntropy', 'colsample_bylevel': 0.0958528615341075, 'depth': 10, 'boosting_type': 'Plain', 'bootstrap_type': 'Bayesian', 'bagging_temperature': 9.804543588408789}. Best is trial 98 with value: 0.8791208791208791.
[32m[I 2023-04-21 02:00:56,288][39m Trial 1421 finished with value: 0.8409090909090909 and parameters: {'objective': 'CrossEntropy', 'colsample_bylevel': 0.08513493079237087, 'depth': 5, 'boosting_type': 'Plain', 'bootstrap_type': 'Bayesian', 'bagging_temperature': 9.697671016581472}. Best is trial 98 with value: 0.8791208791208791.
[32m[I 2023-04-21 02:00:57,226][39m Trial 1422 finished with value: 0.8409090909090909 and parameters: {'objective': 'CrossEntropy', 'colsample_bylevel': 0.08502485651682917, 'depth': 4, 'boosting_type': 'Plain', 'bootstrap_type': 'Bayesian', 'bagging_temperature': 9.640537823748573}. Best is trial 98 with value: 0.8791208791208791.
[32m[I 2023-04-21 02:00:58,130][39m Trial 1423 finished with value: 0.8275862068965518 and parameters: {'objective': 'Logloss', 'colsample_bylevel': 0.08494072398573782, 'depth': 10, 'boosting_type': 'Plain', 'bootstrap_type': 'Bayesian', 'bagging_temperature': 9.82756653286735}. Best is trial 98 with value: 0.8791208791208791.
[32m[I 2023-04-21 02:00:59,068][39m Trial 1424 finished with value: 0.8539325842696629 and parameters: {'objective': 'CrossEntropy', 'colsample_bylevel': 0.08273391405809212, 'depth': 7, 'boosting_type': 'Plain', 'bootstrap_type': 'Bayesian', 'bagging_temperature': 8.919060755843349}. Best is trial 98 with value: 0.8791208791208791.
[32m[I 2023-04-21 02:01:03,877][39m Trial 1425 finished with value: 0.8409090909090909 and parameters: {'objective': 'CrossEntropy', 'colsample_bylevel': 0.09360494150156234, 'depth': 3, 'boosting_type': 'Ordered', 'bootstrap_type': 'Bayesian', 'bagging_temperature': 9.032952266008053}. Best is trial 98 with value: 0.8791208791208791.
[32m[I 2023-04-21 02:01:04,863][39m Trial 1426 finished with value: 0.8409090909090909 and parameters: {'objective': 'CrossEntropy', 'colsample_bylevel': 0.08003877321092434, 'depth': 4, 'boosting_type': 'Plain', 'bootstrap_type': 'Bayesian', 'bagging_temperature': 9.118385694128357}. Best is trial 98 with value: 0.8791208791208791.
[32m[I 2023-04-21 02:01:05,848][39m Trial 1427 finished with value: 0.8409090909090909 and parameters: {'objective': 'CrossEntropy', 'colsample_bylevel': 0.07507653791871281, 'depth': 10, 'boosting_type': 'Plain', 'bootstrap_type': 'Bayesian', 'bagging_temperature': 8.173191459394529}. Best is trial 98 with value: 0.8791208791208791.
[32m[I 2023-04-21 02:01:06,894][39m Trial 1428 finished with value: 0.8409090909090909 and parameters: {'objective': 'Logloss', 'colsample_bylevel': 0.07199939365414436, 'depth': 10, 'boosting_type': 'Plain', 'bootstrap_type': 'Bayesian', 'bagging_temperature': 9.6681282608613}. Best is trial 98 with value: 0.8791208791208791.
[32m[I 2023-04-21 02:01:07,537][39m Trial 1429 finished with value: 0.8275862068965518 and parameters: {'objective': 'Logloss', 'colsample_bylevel': 0.07572652741540328, 'depth': 10, 'boosting_type': 'Plain', 'bootstrap_type': 'Bayesian', 'bagging_temperature': 7.882013773453994}. Best is trial 98 with value: 0.8791208791208791.
[32m[I 2023-04-21 02:01:08,545][39m Trial 1430 finished with value: 0.8539325842696629 and parameters: {'objective': 'Logloss', 'colsample_bylevel': 0.07508586525374729, 'depth': 10, 'boosting_type': 'Plain', 'bootstrap_type': 'Bayesian', 'bagging_temperature': 9.984882066016468}. Best is trial 98 with value: 0.8791208791208791.
[32m[I 2023-04-21 02:01:09,487][39m Trial 1431 finished with value: 0.8409090909090909 and parameters: {'objective': 'CrossEntropy', 'colsample_bylevel': 0.08132977639076873, 'depth': 3, 'boosting_type': 'Plain', 'bootstrap_type': 'MVS'}. Best is trial 98 with value: 0.8791208791208791.
[32m[I 2023-04-21 02:01:10,475][39m Trial 1432 finished with value: 0.8275862068965518 and parameters: {'objective': 'Logloss', 'colsample_bylevel': 0.07407024716163628, 'depth': 10, 'boosting_type': 'Plain', 'bootstrap_type': 'Bernoulli', 'subsample': 0.47413454221776147}. Best is trial 98 with value: 0.8791208791208791.
[32m[I 2023-04-21 02:01:11,791][39m Trial 1433 finished with value: 0.8409090909090909 and parameters: {'objective': 'CrossEntropy', 'colsample_bylevel': 0.07767916334245957, 'depth': 5, 'boosting_type': 'Plain', 'bootstrap_type': 'Bayesian', 'bagging_temperature': 9.493546501962369}. Best is trial 98 with value: 0.8791208791208791.
[32m[I 2023-04-21 02:01:12,434][39m Trial 1434 finished with value: 0.8539325842696629 and parameters: {'objective': 'CrossEntropy', 'colsample_bylevel': 0.09080864146592026, 'depth': 3, 'boosting_type': 'Plain', 'bootstrap_type': 'Bayesian', 'bagging_temperature': 8.964030060963163}. Best is trial 98 with value: 0.8791208791208791.
[32m[I 2023-04-21 02:01:13,156][39m Trial 1435 finished with value: 0.8409090909090909 and parameters: {'objective': 'CrossEntropy', 'colsample_bylevel': 0.08936106277433258, 'depth': 3, 'boosting_type': 'Plain', 'bootstrap_type': 'Bayesian', 'bagging_temperature': 0.07476042420522333}. Best is trial 98 with value: 0.8791208791208791.
[32m[I 2023-04-21 02:01:14,187][39m Trial 1436 finished with value: 0.8666666666666666 and parameters: {'objective': 'CrossEntropy', 'colsample_bylevel': 0.08076920207404104, 'depth': 3, 'boosting_type': 'Plain', 'bootstrap_type': 'Bayesian', 'bagging_temperature': 8.71118138770893}. Best is trial 98 with value: 0.8791208791208791.
[32m[I 2023-04-21 02:01:14,950][39m Trial 1437 finished with value: 0.8409090909090909 and parameters: {'objective': 'CrossEntropy', 'colsample_bylevel': 0.07699783488603512, 'depth': 9, 'boosting_type': 'Plain', 'bootstrap_type': 'Bayesian', 'bagging_temperature': 7.756387297236473}. Best is trial 98 with value: 0.8791208791208791.
[32m[I 2023-04-21 02:01:15,965][39m Trial 1438 finished with value: 0.8539325842696629 and parameters: {'objective': 'CrossEntropy', 'colsample_bylevel': 0.08316970027286533, 'depth': 3, 'boosting_type': 'Plain', 'bootstrap_type': 'Bayesian', 'bagging_temperature': 9.307844831209522}. Best is trial 98 with value: 0.8791208791208791.
[32m[I 2023-04-21 02:01:16,739][39m Trial 1439 finished with value: 0.8636363636363636 and parameters: {'objective': 'CrossEntropy', 'colsample_bylevel': 0.07649419311312461, 'depth': 8, 'boosting_type': 'Plain', 'bootstrap_type': 'Bayesian', 'bagging_temperature': 9.976736638570515}. Best is trial 98 with value: 0.8791208791208791.
[32m[I 2023-04-21 02:01:17,846][39m Trial 1440 finished with value: 0.8139534883720929 and parameters: {'objective': 'CrossEntropy', 'colsample_bylevel': 0.0735055852097141, 'depth': 10, 'boosting_type': 'Plain', 'bootstrap_type': 'Bayesian', 'bagging_temperature': 8.205446806543858}. Best is trial 98 with value: 0.8791208791208791.
[32m[I 2023-04-21 02:01:19,099][39m Trial 1441 finished with value: 0.8409090909090909 and parameters: {'objective': 'CrossEntropy', 'colsample_bylevel': 0.0981259929882254, 'depth': 3, 'boosting_type': 'Plain', 'bootstrap_type': 'Bayesian', 'bagging_temperature': 8.71271555854999}. Best is trial 98 with value: 0.8791208791208791.
[32m[I 2023-04-21 02:01:20,299][39m Trial 1442 finished with value: 0.8409090909090909 and parameters: {'objective': 'Logloss', 'colsample_bylevel': 0.07913531127711383, 'depth': 10, 'boosting_type': 'Plain', 'bootstrap_type': 'MVS'}. Best is trial 98 with value: 0.8791208791208791.
[32m[I 2023-04-21 02:01:21,505][39m Trial 1443 finished with value: 0.8539325842696629 and parameters: {'objective': 'CrossEntropy', 'colsample_bylevel': 0.07935680122792005, 'depth': 9, 'boosting_type': 'Plain', 'bootstrap_type': 'Bayesian', 'bagging_temperature': 8.47882294424212}. Best is trial 98 with value: 0.8791208791208791.
[32m[I 2023-04-21 02:01:22,115][39m Trial 1444 finished with value: 0.8314606741573034 and parameters: {'objective': 'CrossEntropy', 'colsample_bylevel': 0.09028215868640323, 'depth': 3, 'boosting_type': 'Plain', 'bootstrap_type': 'Bayesian', 'bagging_temperature': 8.53834401864322}. Best is trial 98 with value: 0.8791208791208791.
[32m[I 2023-04-21 02:01:26,943][39m Trial 1445 finished with value: 0.8314606741573034 and parameters: {'objective': 'CrossEntropy', 'colsample_bylevel': 0.0931955821906307, 'depth': 3, 'boosting_type': 'Ordered', 'bootstrap_type': 'Bayesian', 'bagging_temperature': 9.749466630828818}. Best is trial 98 with value: 0.8791208791208791.
[32m[I 2023-04-21 02:01:28,150][39m Trial 1446 finished with value: 0.8539325842696629 and parameters: {'objective': 'CrossEntropy', 'colsample_bylevel': 0.0785365864077279, 'depth': 3, 'boosting_type': 'Plain', 'bootstrap_type': 'Bayesian', 'bagging_temperature': 9.99614765847018}. Best is trial 98 with value: 0.8791208791208791.
[32m[I 2023-04-21 02:01:28,819][39m Trial 1447 finished with value: 0.8409090909090909 and parameters: {'objective': 'Logloss', 'colsample_bylevel': 0.07196447021759841, 'depth': 10, 'boosting_type': 'Plain', 'bootstrap_type': 'Bayesian', 'bagging_temperature': 7.981405531243426}. Best is trial 98 with value: 0.8791208791208791.
[32m[I 2023-04-21 02:01:29,670][39m Trial 1448 finished with value: 0.8666666666666666 and parameters: {'objective': 'CrossEntropy', 'colsample_bylevel': 0.07567641423822154, 'depth': 4, 'boosting_type': 'Plain', 'bootstrap_type': 'Bayesian', 'bagging_temperature': 6.284166777288654}. Best is trial 98 with value: 0.8791208791208791.
[32m[I 2023-04-21 02:01:30,477][39m Trial 1449 finished with value: 0.8505747126436782 and parameters: {'objective': 'CrossEntropy', 'colsample_bylevel': 0.07718015077725203, 'depth': 10, 'boosting_type': 'Plain', 'bootstrap_type': 'Bayesian', 'bagging_temperature': 8.369011086811318}. Best is trial 98 with value: 0.8791208791208791.
[32m[I 2023-04-21 02:01:31,226][39m Trial 1450 finished with value: 0.8539325842696629 and parameters: {'objective': 'Logloss', 'colsample_bylevel': 0.07436282674054699, 'depth': 10, 'boosting_type': 'Plain', 'bootstrap_type': 'Bayesian', 'bagging_temperature': 9.870455949840482}. Best is trial 98 with value: 0.8791208791208791.
[32m[I 2023-04-21 02:01:32,222][39m Trial 1451 finished with value: 0.8666666666666666 and parameters: {'objective': 'Logloss', 'colsample_bylevel': 0.06791650521185637, 'depth': 4, 'boosting_type': 'Plain', 'bootstrap_type': 'Bayesian', 'bagging_temperature': 8.253886152651555}. Best is trial 98 with value: 0.8791208791208791.
[32m[I 2023-04-21 02:01:33,400][39m Trial 1452 finished with value: 0.8666666666666666 and parameters: {'objective': 'CrossEntropy', 'colsample_bylevel': 0.07961118202815422, 'depth': 3, 'boosting_type': 'Plain', 'bootstrap_type': 'Bayesian', 'bagging_temperature': 8.997762942331748}. Best is trial 98 with value: 0.8791208791208791.
[32m[I 2023-04-21 02:01:34,328][39m Trial 1453 finished with value: 0.8409090909090909 and parameters: {'objective': 'Logloss', 'colsample_bylevel': 0.0949740857533454, 'depth': 10, 'boosting_type': 'Plain', 'bootstrap_type': 'Bernoulli', 'subsample': 0.5093871196443602}. Best is trial 98 with value: 0.8791208791208791.
[32m[I 2023-04-21 02:01:35,343][39m Trial 1454 finished with value: 0.8409090909090909 and parameters: {'objective': 'CrossEntropy', 'colsample_bylevel': 0.08243449122474884, 'depth': 10, 'boosting_type': 'Plain', 'bootstrap_type': 'MVS'}. Best is trial 98 with value: 0.8791208791208791.
