[32m[I 2023-04-21 03:21:00,541][39m Trial 5457 finished with value: 0.8409090909090909 and parameters: {'objective': 'Logloss', 'colsample_bylevel': 0.07324949766460886, 'depth': 10, 'boosting_type': 'Plain', 'bootstrap_type': 'Bayesian', 'bagging_temperature': 9.356514139237047}. Best is trial 3065 with value: 0.8863636363636364.
[32m[I 2023-04-21 03:21:01,407][39m Trial 5458 finished with value: 0.8791208791208791 and parameters: {'objective': 'CrossEntropy', 'colsample_bylevel': 0.07081282898126286, 'depth': 10, 'boosting_type': 'Plain', 'bootstrap_type': 'Bayesian', 'bagging_temperature': 9.982191836505915}. Best is trial 3065 with value: 0.8863636363636364.
[32m[I 2023-04-21 03:21:02,147][39m Trial 5459 finished with value: 0.8791208791208791 and parameters: {'objective': 'CrossEntropy', 'colsample_bylevel': 0.07644356238945124, 'depth': 11, 'boosting_type': 'Plain', 'bootstrap_type': 'Bayesian', 'bagging_temperature': 9.473664574576398}. Best is trial 3065 with value: 0.8863636363636364.
[32m[I 2023-04-21 03:21:03,217][39m Trial 5460 finished with value: 0.8409090909090909 and parameters: {'objective': 'CrossEntropy', 'colsample_bylevel': 0.0708591010513485, 'depth': 7, 'boosting_type': 'Plain', 'bootstrap_type': 'Bayesian', 'bagging_temperature': 9.047793828981234}. Best is trial 3065 with value: 0.8863636363636364.
[32m[I 2023-04-21 03:21:04,608][39m Trial 5461 finished with value: 0.8764044943820225 and parameters: {'objective': 'CrossEntropy', 'colsample_bylevel': 0.079890129221174, 'depth': 3, 'boosting_type': 'Plain', 'bootstrap_type': 'Bayesian', 'bagging_temperature': 9.432619800735587}. Best is trial 3065 with value: 0.8863636363636364.
[32m[I 2023-04-21 03:21:05,911][39m Trial 5462 finished with value: 0.8409090909090909 and parameters: {'objective': 'CrossEntropy', 'colsample_bylevel': 0.0867024314638999, 'depth': 9, 'boosting_type': 'Plain', 'bootstrap_type': 'Bayesian', 'bagging_temperature': 9.845172307602837}. Best is trial 3065 with value: 0.8863636363636364.
[32m[I 2023-04-21 03:21:06,750][39m Trial 5463 finished with value: 0.8139534883720929 and parameters: {'objective': 'Logloss', 'colsample_bylevel': 0.06967018389670075, 'depth': 10, 'boosting_type': 'Plain', 'bootstrap_type': 'Bayesian', 'bagging_temperature': 1.3282569609888144}. Best is trial 3065 with value: 0.8863636363636364.
[32m[I 2023-04-21 03:21:07,742][39m Trial 5464 finished with value: 0.8314606741573034 and parameters: {'objective': 'CrossEntropy', 'colsample_bylevel': 0.06556959959658978, 'depth': 3, 'boosting_type': 'Plain', 'bootstrap_type': 'MVS'}. Best is trial 3065 with value: 0.8863636363636364.
[32m[I 2023-04-21 03:21:08,975][39m Trial 5465 finished with value: 0.8539325842696629 and parameters: {'objective': 'Logloss', 'colsample_bylevel': 0.06878991851692536, 'depth': 6, 'boosting_type': 'Plain', 'bootstrap_type': 'Bayesian', 'bagging_temperature': 9.019414060234837}. Best is trial 3065 with value: 0.8863636363636364.
[32m[I 2023-04-21 03:21:13,486][39m Trial 5466 finished with value: 0.8139534883720929 and parameters: {'objective': 'CrossEntropy', 'colsample_bylevel': 0.0852619695145444, 'depth': 3, 'boosting_type': 'Ordered', 'bootstrap_type': 'Bernoulli', 'subsample': 0.6126933978562226}. Best is trial 3065 with value: 0.8863636363636364.
[32m[I 2023-04-21 03:21:14,843][39m Trial 5467 finished with value: 0.8636363636363636 and parameters: {'objective': 'CrossEntropy', 'colsample_bylevel': 0.08697084754792793, 'depth': 10, 'boosting_type': 'Plain', 'bootstrap_type': 'Bayesian', 'bagging_temperature': 9.412194499294662}. Best is trial 3065 with value: 0.8863636363636364.
[32m[I 2023-04-21 03:21:15,719][39m Trial 5468 finished with value: 0.8409090909090909 and parameters: {'objective': 'Logloss', 'colsample_bylevel': 0.07960627684517035, 'depth': 2, 'boosting_type': 'Plain', 'bootstrap_type': 'Bayesian', 'bagging_temperature': 8.153617407433515}. Best is trial 3065 with value: 0.8863636363636364.
[32m[I 2023-04-21 03:21:16,610][39m Trial 5469 finished with value: 0.8539325842696629 and parameters: {'objective': 'Logloss', 'colsample_bylevel': 0.07013997847815265, 'depth': 10, 'boosting_type': 'Plain', 'bootstrap_type': 'Bayesian', 'bagging_temperature': 9.420608328885766}. Best is trial 3065 with value: 0.8863636363636364.
[32m[I 2023-04-21 03:21:17,676][39m Trial 5470 finished with value: 0.8444444444444446 and parameters: {'objective': 'CrossEntropy', 'colsample_bylevel': 0.07380176024756198, 'depth': 10, 'boosting_type': 'Plain', 'bootstrap_type': 'Bayesian', 'bagging_temperature': 9.592513248091564}. Best is trial 3065 with value: 0.8863636363636364.
[32m[I 2023-04-21 03:21:18,964][39m Trial 5471 finished with value: 0.8539325842696629 and parameters: {'objective': 'CrossEntropy', 'colsample_bylevel': 0.09450834495265388, 'depth': 2, 'boosting_type': 'Plain', 'bootstrap_type': 'Bayesian', 'bagging_temperature': 9.775450750561868}. Best is trial 3065 with value: 0.8863636363636364.
[32m[I 2023-04-21 03:21:20,333][39m Trial 5472 finished with value: 0.8139534883720929 and parameters: {'objective': 'CrossEntropy', 'colsample_bylevel': 0.08858433366009512, 'depth': 3, 'boosting_type': 'Plain', 'bootstrap_type': 'Bayesian', 'bagging_temperature': 9.647636951205047}. Best is trial 3065 with value: 0.8863636363636364.
[32m[I 2023-04-21 03:21:21,280][39m Trial 5473 finished with value: 0.8275862068965518 and parameters: {'objective': 'CrossEntropy', 'colsample_bylevel': 0.06747609459477065, 'depth': 8, 'boosting_type': 'Plain', 'bootstrap_type': 'Bayesian', 'bagging_temperature': 9.027790727384943}. Best is trial 3065 with value: 0.8863636363636364.
[32m[I 2023-04-21 03:21:22,424][39m Trial 5474 finished with value: 0.8666666666666666 and parameters: {'objective': 'Logloss', 'colsample_bylevel': 0.07004073892411002, 'depth': 10, 'boosting_type': 'Plain', 'bootstrap_type': 'Bayesian', 'bagging_temperature': 9.815560600076008}. Best is trial 3065 with value: 0.8863636363636364.
[32m[I 2023-04-21 03:21:23,325][39m Trial 5475 finished with value: 0.8666666666666666 and parameters: {'objective': 'CrossEntropy', 'colsample_bylevel': 0.07120604320156149, 'depth': 4, 'boosting_type': 'Plain', 'bootstrap_type': 'Bayesian', 'bagging_temperature': 8.950612258101954}. Best is trial 3065 with value: 0.8863636363636364.
[32m[I 2023-04-21 03:21:24,033][39m Trial 5476 finished with value: 0.8539325842696629 and parameters: {'objective': 'CrossEntropy', 'colsample_bylevel': 0.08089168927986412, 'depth': 8, 'boosting_type': 'Plain', 'bootstrap_type': 'Bayesian', 'bagging_temperature': 9.14083129603496}. Best is trial 3065 with value: 0.8863636363636364.
[32m[I 2023-04-21 03:21:24,717][39m Trial 5477 finished with value: 0.8666666666666666 and parameters: {'objective': 'CrossEntropy', 'colsample_bylevel': 0.06606296390689709, 'depth': 7, 'boosting_type': 'Plain', 'bootstrap_type': 'Bayesian', 'bagging_temperature': 9.498771923024227}. Best is trial 3065 with value: 0.8863636363636364.
[32m[I 2023-04-21 03:21:26,041][39m Trial 5478 finished with value: 0.8666666666666666 and parameters: {'objective': 'Logloss', 'colsample_bylevel': 0.0721086263057434, 'depth': 5, 'boosting_type': 'Plain', 'bootstrap_type': 'Bayesian', 'bagging_temperature': 9.237452402747067}. Best is trial 3065 with value: 0.8863636363636364.
[32m[I 2023-04-21 03:21:26,916][39m Trial 5479 finished with value: 0.8409090909090909 and parameters: {'objective': 'CrossEntropy', 'colsample_bylevel': 0.0791337157900967, 'depth': 10, 'boosting_type': 'Plain', 'bootstrap_type': 'Bayesian', 'bagging_temperature': 0.5800189894421601}. Best is trial 3065 with value: 0.8863636363636364.
[32m[I 2023-04-21 03:21:27,637][39m Trial 5480 finished with value: 0.8666666666666666 and parameters: {'objective': 'Logloss', 'colsample_bylevel': 0.07311193977587989, 'depth': 12, 'boosting_type': 'Plain', 'bootstrap_type': 'Bayesian', 'bagging_temperature': 9.373387738882847}. Best is trial 3065 with value: 0.8863636363636364.
[32m[I 2023-04-21 03:21:28,915][39m Trial 5481 finished with value: 0.8275862068965518 and parameters: {'objective': 'CrossEntropy', 'colsample_bylevel': 0.07071477757893915, 'depth': 10, 'boosting_type': 'Plain', 'bootstrap_type': 'MVS'}. Best is trial 3065 with value: 0.8863636363636364.
[32m[I 2023-04-21 03:21:29,942][39m Trial 5482 finished with value: 0.8666666666666666 and parameters: {'objective': 'Logloss', 'colsample_bylevel': 0.07376799393296654, 'depth': 4, 'boosting_type': 'Plain', 'bootstrap_type': 'Bayesian', 'bagging_temperature': 9.99594551557228}. Best is trial 3065 with value: 0.8863636363636364.
[32m[I 2023-04-21 03:21:30,957][39m Trial 5483 finished with value: 0.8636363636363636 and parameters: {'objective': 'Logloss', 'colsample_bylevel': 0.06743506105021654, 'depth': 4, 'boosting_type': 'Plain', 'bootstrap_type': 'Bayesian', 'bagging_temperature': 9.812648665910206}. Best is trial 3065 with value: 0.8863636363636364.
[32m[I 2023-04-21 03:21:32,147][39m Trial 5484 finished with value: 0.8409090909090909 and parameters: {'objective': 'CrossEntropy', 'colsample_bylevel': 0.07681677473830338, 'depth': 10, 'boosting_type': 'Plain', 'bootstrap_type': 'Bayesian', 'bagging_temperature': 9.547193663984176}. Best is trial 3065 with value: 0.8863636363636364.
[32m[I 2023-04-21 03:21:33,061][39m Trial 5485 finished with value: 0.8666666666666666 and parameters: {'objective': 'CrossEntropy', 'colsample_bylevel': 0.08580667977279306, 'depth': 3, 'boosting_type': 'Plain', 'bootstrap_type': 'Bayesian', 'bagging_temperature': 9.101309158287807}. Best is trial 3065 with value: 0.8863636363636364.
[32m[I 2023-04-21 03:21:37,817][39m Trial 5486 finished with value: 0.8314606741573034 and parameters: {'objective': 'CrossEntropy', 'colsample_bylevel': 0.05312037661849916, 'depth': 3, 'boosting_type': 'Ordered', 'bootstrap_type': 'Bayesian', 'bagging_temperature': 9.704577994749592}. Best is trial 3065 with value: 0.8863636363636364.
[32m[I 2023-04-21 03:21:39,174][39m Trial 5487 finished with value: 0.8666666666666666 and parameters: {'objective': 'Logloss', 'colsample_bylevel': 0.0894520028933217, 'depth': 3, 'boosting_type': 'Plain', 'bootstrap_type': 'Bayesian', 'bagging_temperature': 9.877092307882931}. Best is trial 3065 with value: 0.8863636363636364.
[32m[I 2023-04-21 03:21:40,176][39m Trial 5488 finished with value: 0.8539325842696629 and parameters: {'objective': 'Logloss', 'colsample_bylevel': 0.07113185554478853, 'depth': 10, 'boosting_type': 'Plain', 'bootstrap_type': 'Bayesian', 'bagging_temperature': 9.215016118879957}. Best is trial 3065 with value: 0.8863636363636364.
[32m[I 2023-04-21 03:21:41,292][39m Trial 5489 finished with value: 0.8409090909090909 and parameters: {'objective': 'Logloss', 'colsample_bylevel': 0.08439818990813136, 'depth': 3, 'boosting_type': 'Plain', 'bootstrap_type': 'Bayesian', 'bagging_temperature': 9.525730586446365}. Best is trial 3065 with value: 0.8863636363636364.
[32m[I 2023-04-21 03:21:42,207][39m Trial 5490 finished with value: 0.8089887640449439 and parameters: {'objective': 'CrossEntropy', 'colsample_bylevel': 0.03812267854554488, 'depth': 4, 'boosting_type': 'Plain', 'bootstrap_type': 'MVS'}. Best is trial 3065 with value: 0.8863636363636364.
[32m[I 2023-04-21 03:21:42,893][39m Trial 5491 finished with value: 0.8409090909090909 and parameters: {'objective': 'CrossEntropy', 'colsample_bylevel': 0.07755568292791044, 'depth': 10, 'boosting_type': 'Plain', 'bootstrap_type': 'Bayesian', 'bagging_temperature': 9.488261636884433}. Best is trial 3065 with value: 0.8863636363636364.
[32m[I 2023-04-21 03:21:44,295][39m Trial 5492 finished with value: 0.8791208791208791 and parameters: {'objective': 'CrossEntropy', 'colsample_bylevel': 0.08272985651946645, 'depth': 3, 'boosting_type': 'Plain', 'bootstrap_type': 'Bayesian', 'bagging_temperature': 9.210592601281762}. Best is trial 3065 with value: 0.8863636363636364.
[32m[I 2023-04-21 03:21:45,638][39m Trial 5493 finished with value: 0.8539325842696629 and parameters: {'objective': 'CrossEntropy', 'colsample_bylevel': 0.07504326430006679, 'depth': 11, 'boosting_type': 'Plain', 'bootstrap_type': 'Bayesian', 'bagging_temperature': 9.100950956428756}. Best is trial 3065 with value: 0.8863636363636364.
[32m[I 2023-04-21 03:21:46,578][39m Trial 5494 finished with value: 0.8666666666666666 and parameters: {'objective': 'Logloss', 'colsample_bylevel': 0.06960094636114868, 'depth': 10, 'boosting_type': 'Plain', 'bootstrap_type': 'Bayesian', 'bagging_temperature': 9.624147352703641}. Best is trial 3065 with value: 0.8863636363636364.
[32m[I 2023-04-21 03:21:47,338][39m Trial 5495 finished with value: 0.8539325842696629 and parameters: {'objective': 'CrossEntropy', 'colsample_bylevel': 0.08283485756709819, 'depth': 3, 'boosting_type': 'Plain', 'bootstrap_type': 'Bayesian', 'bagging_temperature': 5.194728725018244}. Best is trial 3065 with value: 0.8863636363636364.
[32m[I 2023-04-21 03:21:48,665][39m Trial 5496 finished with value: 0.8409090909090909 and parameters: {'objective': 'CrossEntropy', 'colsample_bylevel': 0.08295910802899675, 'depth': 9, 'boosting_type': 'Plain', 'bootstrap_type': 'Bayesian', 'bagging_temperature': 4.903397465803925}. Best is trial 3065 with value: 0.8863636363636364.
[32m[I 2023-04-21 03:21:49,655][39m Trial 5497 finished with value: 0.8372093023255814 and parameters: {'objective': 'CrossEntropy', 'colsample_bylevel': 0.08326246530801579, 'depth': 11, 'boosting_type': 'Plain', 'bootstrap_type': 'Bayesian', 'bagging_temperature': 9.489933799655171}. Best is trial 3065 with value: 0.8863636363636364.
[32m[I 2023-04-21 03:21:50,579][39m Trial 5498 finished with value: 0.8275862068965518 and parameters: {'objective': 'CrossEntropy', 'colsample_bylevel': 0.05554022349985946, 'depth': 9, 'boosting_type': 'Plain', 'bootstrap_type': 'MVS'}. Best is trial 3065 with value: 0.8863636363636364.
[32m[I 2023-04-21 03:21:51,559][39m Trial 5499 finished with value: 0.8539325842696629 and parameters: {'objective': 'Logloss', 'colsample_bylevel': 0.0679048146347567, 'depth': 9, 'boosting_type': 'Plain', 'bootstrap_type': 'MVS'}. Best is trial 3065 with value: 0.8863636363636364.
[32m[I 2023-04-21 03:21:52,577][39m Trial 5500 finished with value: 0.8409090909090909 and parameters: {'objective': 'CrossEntropy', 'colsample_bylevel': 0.08415260942074838, 'depth': 11, 'boosting_type': 'Plain', 'bootstrap_type': 'Bayesian', 'bagging_temperature': 9.489034903642871}. Best is trial 3065 with value: 0.8863636363636364.
[32m[I 2023-04-21 03:21:53,851][39m Trial 5501 finished with value: 0.8636363636363636 and parameters: {'objective': 'CrossEntropy', 'colsample_bylevel': 0.083264920641413, 'depth': 11, 'boosting_type': 'Plain', 'bootstrap_type': 'Bayesian', 'bagging_temperature': 9.345406828670683}. Best is trial 3065 with value: 0.8863636363636364.
[32m[I 2023-04-21 03:21:58,866][39m Trial 5502 finished with value: 0.8409090909090909 and parameters: {'objective': 'CrossEntropy', 'colsample_bylevel': 0.08038808584993297, 'depth': 2, 'boosting_type': 'Ordered', 'bootstrap_type': 'Bayesian', 'bagging_temperature': 4.354558587645808}. Best is trial 3065 with value: 0.8863636363636364.
[32m[I 2023-04-21 03:22:00,091][39m Trial 5503 finished with value: 0.8275862068965518 and parameters: {'objective': 'CrossEntropy', 'colsample_bylevel': 0.07766951397236194, 'depth': 10, 'boosting_type': 'Plain', 'bootstrap_type': 'Bernoulli', 'subsample': 0.3747454092561772}. Best is trial 3065 with value: 0.8863636363636364.
[32m[I 2023-04-21 03:22:01,276][39m Trial 5504 finished with value: 0.8539325842696629 and parameters: {'objective': 'CrossEntropy', 'colsample_bylevel': 0.08054040484822303, 'depth': 3, 'boosting_type': 'Plain', 'bootstrap_type': 'Bayesian', 'bagging_temperature': 9.414911283728307}. Best is trial 3065 with value: 0.8863636363636364.
[32m[I 2023-04-21 03:22:02,656][39m Trial 5505 finished with value: 0.8409090909090909 and parameters: {'objective': 'CrossEntropy', 'colsample_bylevel': 0.06246346904294982, 'depth': 9, 'boosting_type': 'Plain', 'bootstrap_type': 'MVS'}. Best is trial 3065 with value: 0.8863636363636364.
[32m[I 2023-04-21 03:22:03,361][39m Trial 5506 finished with value: 0.8275862068965518 and parameters: {'objective': 'CrossEntropy', 'colsample_bylevel': 0.09387535272209188, 'depth': 3, 'boosting_type': 'Plain', 'bootstrap_type': 'Bayesian', 'bagging_temperature': 8.267938843214306}. Best is trial 3065 with value: 0.8863636363636364.
[32m[I 2023-04-21 03:22:04,453][39m Trial 5507 finished with value: 0.7999999999999999 and parameters: {'objective': 'Logloss', 'colsample_bylevel': 0.07220557127943984, 'depth': 11, 'boosting_type': 'Plain', 'bootstrap_type': 'Bayesian', 'bagging_temperature': 3.9309872995970956}. Best is trial 3065 with value: 0.8863636363636364.
[32m[I 2023-04-21 03:22:05,694][39m Trial 5508 finished with value: 0.8275862068965518 and parameters: {'objective': 'Logloss', 'colsample_bylevel': 0.07012911330224769, 'depth': 7, 'boosting_type': 'Plain', 'bootstrap_type': 'Bayesian', 'bagging_temperature': 9.232200907823394}. Best is trial 3065 with value: 0.8863636363636364.
[32m[I 2023-04-21 03:22:06,443][39m Trial 5509 finished with value: 0.8539325842696629 and parameters: {'objective': 'CrossEntropy', 'colsample_bylevel': 0.08542990974033104, 'depth': 3, 'boosting_type': 'Plain', 'bootstrap_type': 'Bayesian', 'bagging_temperature': 9.26074046761817}. Best is trial 3065 with value: 0.8863636363636364.
[32m[I 2023-04-21 03:22:07,578][39m Trial 5510 finished with value: 0.8539325842696629 and parameters: {'objective': 'CrossEntropy', 'colsample_bylevel': 0.08263370807021511, 'depth': 3, 'boosting_type': 'Plain', 'bootstrap_type': 'Bayesian', 'bagging_temperature': 8.805846351437646}. Best is trial 3065 with value: 0.8863636363636364.
[32m[I 2023-04-21 03:22:08,892][39m Trial 5511 finished with value: 0.8275862068965518 and parameters: {'objective': 'Logloss', 'colsample_bylevel': 0.0775536641854712, 'depth': 6, 'boosting_type': 'Plain', 'bootstrap_type': 'Bayesian', 'bagging_temperature': 8.724285023294318}. Best is trial 3065 with value: 0.8863636363636364.
[32m[I 2023-04-21 03:22:10,072][39m Trial 5512 finished with value: 0.8539325842696629 and parameters: {'objective': 'Logloss', 'colsample_bylevel': 0.07553925002628757, 'depth': 9, 'boosting_type': 'Plain', 'bootstrap_type': 'Bayesian', 'bagging_temperature': 9.630275474956568}. Best is trial 3065 with value: 0.8863636363636364.
[32m[I 2023-04-21 03:22:11,200][39m Trial 5513 finished with value: 0.8275862068965518 and parameters: {'objective': 'CrossEntropy', 'colsample_bylevel': 0.07608009945611455, 'depth': 9, 'boosting_type': 'Plain', 'bootstrap_type': 'Bayesian', 'bagging_temperature': 9.368078386495265}. Best is trial 3065 with value: 0.8863636363636364.
[32m[I 2023-04-21 03:22:12,214][39m Trial 5514 finished with value: 0.8666666666666666 and parameters: {'objective': 'CrossEntropy', 'colsample_bylevel': 0.08168571747391426, 'depth': 3, 'boosting_type': 'Plain', 'bootstrap_type': 'Bayesian', 'bagging_temperature': 9.067143625594271}. Best is trial 3065 with value: 0.8863636363636364.
[32m[I 2023-04-21 03:22:12,992][39m Trial 5515 finished with value: 0.8275862068965518 and parameters: {'objective': 'Logloss', 'colsample_bylevel': 0.08965969528970708, 'depth': 11, 'boosting_type': 'Plain', 'bootstrap_type': 'Bernoulli', 'subsample': 0.8376494230148726}. Best is trial 3065 with value: 0.8863636363636364.
[32m[I 2023-04-21 03:22:14,236][39m Trial 5516 finished with value: 0.8409090909090909 and parameters: {'objective': 'CrossEntropy', 'colsample_bylevel': 0.09833223502017877, 'depth': 3, 'boosting_type': 'Plain', 'bootstrap_type': 'Bayesian', 'bagging_temperature': 8.737655266931794}. Best is trial 3065 with value: 0.8863636363636364.
[32m[I 2023-04-21 03:22:15,806][39m Trial 5517 finished with value: 0.8409090909090909 and parameters: {'objective': 'CrossEntropy', 'colsample_bylevel': 0.08045346322890812, 'depth': 9, 'boosting_type': 'Plain', 'bootstrap_type': 'Bayesian', 'bagging_temperature': 9.273312795501203}. Best is trial 3065 with value: 0.8863636363636364.
[32m[I 2023-04-21 03:22:16,994][39m Trial 5518 finished with value: 0.8275862068965518 and parameters: {'objective': 'CrossEntropy', 'colsample_bylevel': 0.07919254603602585, 'depth': 9, 'boosting_type': 'Plain', 'bootstrap_type': 'Bayesian', 'bagging_temperature': 9.266771078978152}. Best is trial 3065 with value: 0.8863636363636364.
[32m[I 2023-04-21 03:22:17,714][39m Trial 5519 finished with value: 0.8409090909090909 and parameters: {'objective': 'Logloss', 'colsample_bylevel': 0.0888360889968209, 'depth': 6, 'boosting_type': 'Plain', 'bootstrap_type': 'Bayesian', 'bagging_temperature': 4.598290398419113}. Best is trial 3065 with value: 0.8863636363636364.
[32m[I 2023-04-21 03:22:19,156][39m Trial 5520 finished with value: 0.8409090909090909 and parameters: {'objective': 'CrossEntropy', 'colsample_bylevel': 0.07812251481330253, 'depth': 9, 'boosting_type': 'Plain', 'bootstrap_type': 'Bayesian', 'bagging_temperature': 9.987239987554505}. Best is trial 3065 with value: 0.8863636363636364.
[32m[I 2023-04-21 03:22:20,106][39m Trial 5521 finished with value: 0.8235294117647058 and parameters: {'objective': 'CrossEntropy', 'colsample_bylevel': 0.0906179604175374, 'depth': 6, 'boosting_type': 'Plain', 'bootstrap_type': 'Bayesian', 'bagging_temperature': 6.2018423004750405}. Best is trial 3065 with value: 0.8863636363636364.
[32m[I 2023-04-21 03:22:20,800][39m Trial 5522 finished with value: 0.8764044943820225 and parameters: {'objective': 'CrossEntropy', 'colsample_bylevel': 0.0810592822647415, 'depth': 2, 'boosting_type': 'Plain', 'bootstrap_type': 'Bayesian', 'bagging_temperature': 8.864640044726043}. Best is trial 3065 with value: 0.8863636363636364.
