[32m[I 2023-04-21 02:26:32,761][39m Trial 2775 finished with value: 0.8409090909090909 and parameters: {'objective': 'CrossEntropy', 'colsample_bylevel': 0.08078014310415466, 'depth': 6, 'boosting_type': 'Plain', 'bootstrap_type': 'Bayesian', 'bagging_temperature': 8.986849127144623}. Best is trial 98 with value: 0.8791208791208791.
[32m[I 2023-04-21 02:26:33,795][39m Trial 2776 finished with value: 0.8409090909090909 and parameters: {'objective': 'CrossEntropy', 'colsample_bylevel': 0.07328887733021913, 'depth': 10, 'boosting_type': 'Plain', 'bootstrap_type': 'Bayesian', 'bagging_temperature': 9.504811236196163}. Best is trial 98 with value: 0.8791208791208791.
[32m[I 2023-04-21 02:26:34,768][39m Trial 2777 finished with value: 0.8409090909090909 and parameters: {'objective': 'CrossEntropy', 'colsample_bylevel': 0.08345057679320096, 'depth': 4, 'boosting_type': 'Plain', 'bootstrap_type': 'Bayesian', 'bagging_temperature': 9.594381713820251}. Best is trial 98 with value: 0.8791208791208791.
[32m[I 2023-04-21 02:26:35,378][39m Trial 2778 finished with value: 0.8666666666666666 and parameters: {'objective': 'CrossEntropy', 'colsample_bylevel': 0.0772612720283378, 'depth': 11, 'boosting_type': 'Plain', 'bootstrap_type': 'Bayesian', 'bagging_temperature': 9.847745744546417}. Best is trial 98 with value: 0.8791208791208791.
[32m[I 2023-04-21 02:26:36,002][39m Trial 2779 finished with value: 0.8539325842696629 and parameters: {'objective': 'CrossEntropy', 'colsample_bylevel': 0.0793605029266792, 'depth': 6, 'boosting_type': 'Plain', 'bootstrap_type': 'Bayesian', 'bagging_temperature': 9.64890007224919}. Best is trial 98 with value: 0.8791208791208791.
[32m[I 2023-04-21 02:26:36,750][39m Trial 2780 finished with value: 0.8409090909090909 and parameters: {'objective': 'CrossEntropy', 'colsample_bylevel': 0.09979841075119662, 'depth': 3, 'boosting_type': 'Plain', 'bootstrap_type': 'MVS'}. Best is trial 98 with value: 0.8791208791208791.
[32m[I 2023-04-21 02:26:37,783][39m Trial 2781 finished with value: 0.8409090909090909 and parameters: {'objective': 'CrossEntropy', 'colsample_bylevel': 0.08265549516318818, 'depth': 12, 'boosting_type': 'Plain', 'bootstrap_type': 'Bayesian', 'bagging_temperature': 9.446727422492591}. Best is trial 98 with value: 0.8791208791208791.
[32m[I 2023-04-21 02:26:38,747][39m Trial 2782 finished with value: 0.8636363636363636 and parameters: {'objective': 'CrossEntropy', 'colsample_bylevel': 0.0773392310837489, 'depth': 5, 'boosting_type': 'Plain', 'bootstrap_type': 'Bayesian', 'bagging_temperature': 9.32457721817873}. Best is trial 98 with value: 0.8791208791208791.
[32m[I 2023-04-21 02:26:39,973][39m Trial 2783 finished with value: 0.8275862068965518 and parameters: {'objective': 'CrossEntropy', 'colsample_bylevel': 0.07471755449878996, 'depth': 12, 'boosting_type': 'Plain', 'bootstrap_type': 'Bernoulli', 'subsample': 0.6702983997038026}. Best is trial 98 with value: 0.8791208791208791.
[32m[I 2023-04-21 02:26:45,844][39m Trial 2784 finished with value: 0.8275862068965518 and parameters: {'objective': 'Logloss', 'colsample_bylevel': 0.09516568278027612, 'depth': 6, 'boosting_type': 'Ordered', 'bootstrap_type': 'Bayesian', 'bagging_temperature': 4.870511208330474}. Best is trial 98 with value: 0.8791208791208791.
[32m[I 2023-04-21 02:26:46,810][39m Trial 2785 finished with value: 0.8539325842696629 and parameters: {'objective': 'CrossEntropy', 'colsample_bylevel': 0.0869070167917219, 'depth': 10, 'boosting_type': 'Plain', 'bootstrap_type': 'Bayesian', 'bagging_temperature': 9.457122702816193}. Best is trial 98 with value: 0.8791208791208791.
[32m[I 2023-04-21 02:26:47,423][39m Trial 2786 finished with value: 0.8275862068965518 and parameters: {'objective': 'CrossEntropy', 'colsample_bylevel': 0.07655659322333237, 'depth': 4, 'boosting_type': 'Plain', 'bootstrap_type': 'Bayesian', 'bagging_temperature': 8.268352999124884}. Best is trial 98 with value: 0.8791208791208791.
[32m[I 2023-04-21 02:26:48,279][39m Trial 2787 finished with value: 0.8275862068965518 and parameters: {'objective': 'CrossEntropy', 'colsample_bylevel': 0.07857818183558032, 'depth': 10, 'boosting_type': 'Plain', 'bootstrap_type': 'MVS'}. Best is trial 98 with value: 0.8791208791208791.
[32m[I 2023-04-21 02:26:49,245][39m Trial 2788 finished with value: 0.8409090909090909 and parameters: {'objective': 'CrossEntropy', 'colsample_bylevel': 0.07501525315251158, 'depth': 10, 'boosting_type': 'Plain', 'bootstrap_type': 'Bayesian', 'bagging_temperature': 9.269178016443842}. Best is trial 98 with value: 0.8791208791208791.
[32m[I 2023-04-21 02:26:50,060][39m Trial 2789 finished with value: 0.8505747126436782 and parameters: {'objective': 'CrossEntropy', 'colsample_bylevel': 0.0788459240861959, 'depth': 11, 'boosting_type': 'Plain', 'bootstrap_type': 'Bayesian', 'bagging_temperature': 4.637729273882703}. Best is trial 98 with value: 0.8791208791208791.
[32m[I 2023-04-21 02:26:50,660][39m Trial 2790 finished with value: 0.8539325842696629 and parameters: {'objective': 'Logloss', 'colsample_bylevel': 0.07487762261426946, 'depth': 5, 'boosting_type': 'Plain', 'bootstrap_type': 'Bayesian', 'bagging_temperature': 9.190010163313548}. Best is trial 98 with value: 0.8791208791208791.
[32m[I 2023-04-21 02:26:51,490][39m Trial 2791 finished with value: 0.8666666666666666 and parameters: {'objective': 'CrossEntropy', 'colsample_bylevel': 0.07058097189738796, 'depth': 5, 'boosting_type': 'Plain', 'bootstrap_type': 'Bayesian', 'bagging_temperature': 9.257891365331565}. Best is trial 98 with value: 0.8791208791208791.
[32m[I 2023-04-21 02:26:53,019][39m Trial 2792 finished with value: 0.8409090909090909 and parameters: {'objective': 'CrossEntropy', 'colsample_bylevel': 0.08739194078274336, 'depth': 9, 'boosting_type': 'Plain', 'bootstrap_type': 'Bayesian', 'bagging_temperature': 9.280363030587393}. Best is trial 98 with value: 0.8791208791208791.
[32m[I 2023-04-21 02:26:54,008][39m Trial 2793 finished with value: 0.8666666666666666 and parameters: {'objective': 'CrossEntropy', 'colsample_bylevel': 0.08096816795758563, 'depth': 3, 'boosting_type': 'Plain', 'bootstrap_type': 'Bayesian', 'bagging_temperature': 8.857320768266833}. Best is trial 98 with value: 0.8791208791208791.
[32m[I 2023-04-21 02:26:55,069][39m Trial 2794 finished with value: 0.8666666666666666 and parameters: {'objective': 'CrossEntropy', 'colsample_bylevel': 0.07924389860801033, 'depth': 3, 'boosting_type': 'Plain', 'bootstrap_type': 'Bayesian', 'bagging_temperature': 9.053154597083202}. Best is trial 98 with value: 0.8791208791208791.
[32m[I 2023-04-21 02:26:56,079][39m Trial 2795 finished with value: 0.8409090909090909 and parameters: {'objective': 'CrossEntropy', 'colsample_bylevel': 0.0756879619142406, 'depth': 10, 'boosting_type': 'Plain', 'bootstrap_type': 'Bernoulli', 'subsample': 0.6365950804103394}. Best is trial 98 with value: 0.8791208791208791.
[32m[I 2023-04-21 02:26:56,702][39m Trial 2796 finished with value: 0.8539325842696629 and parameters: {'objective': 'CrossEntropy', 'colsample_bylevel': 0.0771146158837407, 'depth': 3, 'boosting_type': 'Plain', 'bootstrap_type': 'Bayesian', 'bagging_temperature': 6.6627193816859815}. Best is trial 98 with value: 0.8791208791208791.
[32m[I 2023-04-21 02:26:57,477][39m Trial 2797 finished with value: 0.8791208791208791 and parameters: {'objective': 'CrossEntropy', 'colsample_bylevel': 0.0783576856794925, 'depth': 9, 'boosting_type': 'Plain', 'bootstrap_type': 'Bayesian', 'bagging_temperature': 9.986657247966159}. Best is trial 98 with value: 0.8791208791208791.
[32m[I 2023-04-21 02:26:58,470][39m Trial 2798 finished with value: 0.8409090909090909 and parameters: {'objective': 'CrossEntropy', 'colsample_bylevel': 0.08191722106999338, 'depth': 9, 'boosting_type': 'Plain', 'bootstrap_type': 'Bayesian', 'bagging_temperature': 9.239159223504744}. Best is trial 98 with value: 0.8791208791208791.
[32m[I 2023-04-21 02:26:59,885][39m Trial 2799 finished with value: 0.8539325842696629 and parameters: {'objective': 'CrossEntropy', 'colsample_bylevel': 0.08031686725332488, 'depth': 9, 'boosting_type': 'Plain', 'bootstrap_type': 'Bayesian', 'bagging_temperature': 9.830953513626392}. Best is trial 98 with value: 0.8791208791208791.
[32m[I 2023-04-21 02:27:00,944][39m Trial 2800 finished with value: 0.8666666666666666 and parameters: {'objective': 'CrossEntropy', 'colsample_bylevel': 0.08028520007978897, 'depth': 3, 'boosting_type': 'Plain', 'bootstrap_type': 'Bayesian', 'bagging_temperature': 9.595800924438617}. Best is trial 98 with value: 0.8791208791208791.
[32m[I 2023-04-21 02:27:01,706][39m Trial 2801 finished with value: 0.8275862068965518 and parameters: {'objective': 'CrossEntropy', 'colsample_bylevel': 0.0840759368771046, 'depth': 3, 'boosting_type': 'Plain', 'bootstrap_type': 'MVS'}. Best is trial 98 with value: 0.8791208791208791.
[32m[I 2023-04-21 02:27:02,676][39m Trial 2802 finished with value: 0.8139534883720929 and parameters: {'objective': 'CrossEntropy', 'colsample_bylevel': 0.07600931118620403, 'depth': 10, 'boosting_type': 'Plain', 'bootstrap_type': 'Bayesian', 'bagging_temperature': 9.645169855266053}. Best is trial 98 with value: 0.8791208791208791.
[32m[I 2023-04-21 02:27:06,944][39m Trial 2803 finished with value: 0.7727272727272727 and parameters: {'objective': 'CrossEntropy', 'colsample_bylevel': 0.018565962196916384, 'depth': 2, 'boosting_type': 'Ordered', 'bootstrap_type': 'Bayesian', 'bagging_temperature': 9.809842066774134}. Best is trial 98 with value: 0.8791208791208791.
[32m[I 2023-04-21 02:27:07,862][39m Trial 2804 finished with value: 0.8275862068965518 and parameters: {'objective': 'CrossEntropy', 'colsample_bylevel': 0.07723621467977144, 'depth': 10, 'boosting_type': 'Plain', 'bootstrap_type': 'Bayesian', 'bagging_temperature': 8.405744201612764}. Best is trial 98 with value: 0.8791208791208791.
[32m[I 2023-04-21 02:27:08,762][39m Trial 2805 finished with value: 0.8275862068965518 and parameters: {'objective': 'Logloss', 'colsample_bylevel': 0.07693695450144994, 'depth': 6, 'boosting_type': 'Plain', 'bootstrap_type': 'Bayesian', 'bagging_temperature': 9.463133926055802}. Best is trial 98 with value: 0.8791208791208791.
[32m[I 2023-04-21 02:27:09,619][39m Trial 2806 finished with value: 0.8409090909090909 and parameters: {'objective': 'CrossEntropy', 'colsample_bylevel': 0.07626059807654167, 'depth': 6, 'boosting_type': 'Plain', 'bootstrap_type': 'MVS'}. Best is trial 98 with value: 0.8791208791208791.
[32m[I 2023-04-21 02:27:10,413][39m Trial 2807 finished with value: 0.8666666666666666 and parameters: {'objective': 'Logloss', 'colsample_bylevel': 0.07321773505195997, 'depth': 11, 'boosting_type': 'Plain', 'bootstrap_type': 'Bayesian', 'bagging_temperature': 9.581877750150742}. Best is trial 98 with value: 0.8791208791208791.
[32m[I 2023-04-21 02:27:11,172][39m Trial 2808 finished with value: 0.8372093023255814 and parameters: {'objective': 'CrossEntropy', 'colsample_bylevel': 0.07657622796407781, 'depth': 9, 'boosting_type': 'Plain', 'bootstrap_type': 'Bayesian', 'bagging_temperature': 9.355567114909437}. Best is trial 98 with value: 0.8791208791208791.
[32m[I 2023-04-21 02:27:12,399][39m Trial 2809 finished with value: 0.8275862068965518 and parameters: {'objective': 'CrossEntropy', 'colsample_bylevel': 0.09092957531272307, 'depth': 3, 'boosting_type': 'Plain', 'bootstrap_type': 'Bayesian', 'bagging_temperature': 9.995170962456442}. Best is trial 98 with value: 0.8791208791208791.
[32m[I 2023-04-21 02:27:13,667][39m Trial 2810 finished with value: 0.8666666666666666 and parameters: {'objective': 'CrossEntropy', 'colsample_bylevel': 0.07638481925925036, 'depth': 9, 'boosting_type': 'Plain', 'bootstrap_type': 'Bayesian', 'bagging_temperature': 9.692761957109289}. Best is trial 98 with value: 0.8791208791208791.
[32m[I 2023-04-21 02:27:14,629][39m Trial 2811 finished with value: 0.8409090909090909 and parameters: {'objective': 'CrossEntropy', 'colsample_bylevel': 0.08513698704557954, 'depth': 3, 'boosting_type': 'Plain', 'bootstrap_type': 'Bayesian', 'bagging_temperature': 9.022644774122378}. Best is trial 98 with value: 0.8791208791208791.
[32m[I 2023-04-21 02:27:15,519][39m Trial 2812 finished with value: 0.8409090909090909 and parameters: {'objective': 'CrossEntropy', 'colsample_bylevel': 0.07498971241111092, 'depth': 3, 'boosting_type': 'Plain', 'bootstrap_type': 'Bayesian', 'bagging_temperature': 9.451740110416827}. Best is trial 98 with value: 0.8791208791208791.
[32m[I 2023-04-21 02:27:16,508][39m Trial 2813 finished with value: 0.8409090909090909 and parameters: {'objective': 'Logloss', 'colsample_bylevel': 0.07454799024573709, 'depth': 10, 'boosting_type': 'Plain', 'bootstrap_type': 'Bayesian', 'bagging_temperature': 0.033933876073131586}. Best is trial 98 with value: 0.8791208791208791.
[32m[I 2023-04-21 02:27:17,113][39m Trial 2814 finished with value: 0.8539325842696629 and parameters: {'objective': 'CrossEntropy', 'colsample_bylevel': 0.07088033980352391, 'depth': 11, 'boosting_type': 'Plain', 'bootstrap_type': 'Bayesian', 'bagging_temperature': 9.392132639796548}. Best is trial 98 with value: 0.8791208791208791.
[32m[I 2023-04-21 02:27:17,793][39m Trial 2815 finished with value: 0.8666666666666666 and parameters: {'objective': 'Logloss', 'colsample_bylevel': 0.07943395054720988, 'depth': 3, 'boosting_type': 'Plain', 'bootstrap_type': 'Bayesian', 'bagging_temperature': 9.750422371461248}. Best is trial 98 with value: 0.8791208791208791.
[32m[I 2023-04-21 02:27:18,494][39m Trial 2816 finished with value: 0.8275862068965518 and parameters: {'objective': 'Logloss', 'colsample_bylevel': 0.08140730395152874, 'depth': 3, 'boosting_type': 'Plain', 'bootstrap_type': 'Bayesian', 'bagging_temperature': 9.30504799401492}. Best is trial 98 with value: 0.8791208791208791.
[32m[I 2023-04-21 02:27:19,721][39m Trial 2817 finished with value: 0.8275862068965518 and parameters: {'objective': 'CrossEntropy', 'colsample_bylevel': 0.08014278806966008, 'depth': 7, 'boosting_type': 'Plain', 'bootstrap_type': 'Bayesian', 'bagging_temperature': 8.945433306139837}. Best is trial 98 with value: 0.8791208791208791.
[32m[I 2023-04-21 02:27:20,649][39m Trial 2818 finished with value: 0.8409090909090909 and parameters: {'objective': 'Logloss', 'colsample_bylevel': 0.0829815164113333, 'depth': 5, 'boosting_type': 'Plain', 'bootstrap_type': 'Bayesian', 'bagging_temperature': 9.998720069851473}. Best is trial 98 with value: 0.8791208791208791.
[32m[I 2023-04-21 02:27:21,718][39m Trial 2819 finished with value: 0.8222222222222222 and parameters: {'objective': 'CrossEntropy', 'colsample_bylevel': 0.08435985064190854, 'depth': 2, 'boosting_type': 'Plain', 'bootstrap_type': 'Bernoulli', 'subsample': 0.9970124729093681}. Best is trial 98 with value: 0.8791208791208791.
[32m[I 2023-04-21 02:27:22,680][39m Trial 2820 finished with value: 0.8409090909090909 and parameters: {'objective': 'CrossEntropy', 'colsample_bylevel': 0.08213603302584632, 'depth': 10, 'boosting_type': 'Plain', 'bootstrap_type': 'Bayesian', 'bagging_temperature': 8.054793629395514}. Best is trial 98 with value: 0.8791208791208791.
[32m[I 2023-04-21 02:27:26,996][39m Trial 2821 finished with value: 0.8409090909090909 and parameters: {'objective': 'CrossEntropy', 'colsample_bylevel': 0.08765117425400111, 'depth': 3, 'boosting_type': 'Ordered', 'bootstrap_type': 'Bayesian', 'bagging_temperature': 8.694662127295723}. Best is trial 98 with value: 0.8791208791208791.
[32m[I 2023-04-21 02:27:28,022][39m Trial 2822 finished with value: 0.8275862068965518 and parameters: {'objective': 'CrossEntropy', 'colsample_bylevel': 0.08539243460094637, 'depth': 11, 'boosting_type': 'Plain', 'bootstrap_type': 'Bayesian', 'bagging_temperature': 9.361063989315051}. Best is trial 98 with value: 0.8791208791208791.
[32m[I 2023-04-21 02:27:29,124][39m Trial 2823 finished with value: 0.8275862068965518 and parameters: {'objective': 'CrossEntropy', 'colsample_bylevel': 0.07457663329744459, 'depth': 10, 'boosting_type': 'Plain', 'bootstrap_type': 'MVS'}. Best is trial 98 with value: 0.8791208791208791.
[32m[I 2023-04-21 02:27:30,071][39m Trial 2824 finished with value: 0.8409090909090909 and parameters: {'objective': 'CrossEntropy', 'colsample_bylevel': 0.07817966953718851, 'depth': 11, 'boosting_type': 'Plain', 'bootstrap_type': 'Bayesian', 'bagging_temperature': 9.461816082174394}. Best is trial 98 with value: 0.8791208791208791.
[32m[I 2023-04-21 02:27:31,273][39m Trial 2825 finished with value: 0.8505747126436782 and parameters: {'objective': 'CrossEntropy', 'colsample_bylevel': 0.0814361107325488, 'depth': 10, 'boosting_type': 'Plain', 'bootstrap_type': 'Bayesian', 'bagging_temperature': 9.187952479769914}. Best is trial 98 with value: 0.8791208791208791.
[32m[I 2023-04-21 02:27:32,162][39m Trial 2826 finished with value: 0.8275862068965518 and parameters: {'objective': 'CrossEntropy', 'colsample_bylevel': 0.07278740421088424, 'depth': 9, 'boosting_type': 'Plain', 'bootstrap_type': 'Bayesian', 'bagging_temperature': 7.963977028975908}. Best is trial 98 with value: 0.8791208791208791.
[32m[I 2023-04-21 02:27:32,928][39m Trial 2827 finished with value: 0.8275862068965518 and parameters: {'objective': 'CrossEntropy', 'colsample_bylevel': 0.07989448264599495, 'depth': 6, 'boosting_type': 'Plain', 'bootstrap_type': 'Bayesian', 'bagging_temperature': 8.835790168777438}. Best is trial 98 with value: 0.8791208791208791.
[32m[I 2023-04-21 02:27:34,023][39m Trial 2828 finished with value: 0.8235294117647058 and parameters: {'objective': 'CrossEntropy', 'colsample_bylevel': 0.08264264466098033, 'depth': 11, 'boosting_type': 'Plain', 'bootstrap_type': 'Bayesian', 'bagging_temperature': 9.578324602075378}. Best is trial 98 with value: 0.8791208791208791.
[32m[I 2023-04-21 02:27:35,144][39m Trial 2829 finished with value: 0.8505747126436782 and parameters: {'objective': 'CrossEntropy', 'colsample_bylevel': 0.04563035123117195, 'depth': 9, 'boosting_type': 'Plain', 'bootstrap_type': 'Bayesian', 'bagging_temperature': 9.812350222778687}. Best is trial 98 with value: 0.8791208791208791.
[32m[I 2023-04-21 02:27:35,845][39m Trial 2830 finished with value: 0.8666666666666666 and parameters: {'objective': 'CrossEntropy', 'colsample_bylevel': 0.07744222410486976, 'depth': 11, 'boosting_type': 'Plain', 'bootstrap_type': 'Bayesian', 'bagging_temperature': 8.400495946718662}. Best is trial 98 with value: 0.8791208791208791.
[32m[I 2023-04-21 02:27:36,978][39m Trial 2831 finished with value: 0.8095238095238095 and parameters: {'objective': 'CrossEntropy', 'colsample_bylevel': 0.07538959441169382, 'depth': 1, 'boosting_type': 'Plain', 'bootstrap_type': 'Bayesian', 'bagging_temperature': 9.773654113618788}. Best is trial 98 with value: 0.8791208791208791.
[32m[I 2023-04-21 02:27:37,946][39m Trial 2832 finished with value: 0.8666666666666666 and parameters: {'objective': 'CrossEntropy', 'colsample_bylevel': 0.0919169373774678, 'depth': 3, 'boosting_type': 'Plain', 'bootstrap_type': 'Bayesian', 'bagging_temperature': 8.62343585121228}. Best is trial 98 with value: 0.8791208791208791.
[32m[I 2023-04-21 02:27:38,726][39m Trial 2833 finished with value: 0.8666666666666666 and parameters: {'objective': 'Logloss', 'colsample_bylevel': 0.07256069755970163, 'depth': 9, 'boosting_type': 'Plain', 'bootstrap_type': 'Bayesian', 'bagging_temperature': 9.804481442332612}. Best is trial 98 with value: 0.8791208791208791.
[32m[I 2023-04-21 02:27:39,670][39m Trial 2834 finished with value: 0.8505747126436782 and parameters: {'objective': 'Logloss', 'colsample_bylevel': 0.07422137435041914, 'depth': 9, 'boosting_type': 'Plain', 'bootstrap_type': 'Bayesian', 'bagging_temperature': 8.524310679522216}. Best is trial 98 with value: 0.8791208791208791.
[32m[I 2023-04-21 02:27:40,921][39m Trial 2835 finished with value: 0.8666666666666666 and parameters: {'objective': 'Logloss', 'colsample_bylevel': 0.06992389031896346, 'depth': 4, 'boosting_type': 'Plain', 'bootstrap_type': 'Bayesian', 'bagging_temperature': 9.455299627222454}. Best is trial 98 with value: 0.8791208791208791.
[32m[I 2023-04-21 02:27:41,790][39m Trial 2836 finished with value: 0.8409090909090909 and parameters: {'objective': 'CrossEntropy', 'colsample_bylevel': 0.09373186661326599, 'depth': 9, 'boosting_type': 'Plain', 'bootstrap_type': 'Bayesian', 'bagging_temperature': 8.377744129011758}. Best is trial 98 with value: 0.8791208791208791.
[32m[I 2023-04-21 02:27:43,439][39m Trial 2837 finished with value: 0.8505747126436782 and parameters: {'objective': 'CrossEntropy', 'colsample_bylevel': 0.09021577361205615, 'depth': 9, 'boosting_type': 'Plain', 'bootstrap_type': 'Bayesian', 'bagging_temperature': 9.63449591957454}. Best is trial 98 with value: 0.8791208791208791.
[32m[I 2023-04-21 02:27:44,459][39m Trial 2838 finished with value: 0.8409090909090909 and parameters: {'objective': 'CrossEntropy', 'colsample_bylevel': 0.07856398795426335, 'depth': 10, 'boosting_type': 'Plain', 'bootstrap_type': 'Bayesian', 'bagging_temperature': 8.479143116329357}. Best is trial 98 with value: 0.8791208791208791.
[32m[I 2023-04-21 02:27:48,946][39m Trial 2839 finished with value: 0.8409090909090909 and parameters: {'objective': 'CrossEntropy', 'colsample_bylevel': 0.08699486097772577, 'depth': 3, 'boosting_type': 'Ordered', 'bootstrap_type': 'Bayesian', 'bagging_temperature': 9.552091385351893}. Best is trial 98 with value: 0.8791208791208791.
[32m[I 2023-04-21 02:27:50,061][39m Trial 2840 finished with value: 0.8505747126436782 and parameters: {'objective': 'CrossEntropy', 'colsample_bylevel': 0.07686871558405448, 'depth': 8, 'boosting_type': 'Plain', 'bootstrap_type': 'Bayesian', 'bagging_temperature': 8.0700927599538}. Best is trial 98 with value: 0.8791208791208791.
