[32m[I 2023-04-21 01:54:19,973][39m Trial 1059 finished with value: 0.8409090909090909 and parameters: {'objective': 'CrossEntropy', 'colsample_bylevel': 0.0706062713667725, 'depth': 3, 'boosting_type': 'Plain', 'bootstrap_type': 'Bayesian', 'bagging_temperature': 8.633926306567096}. Best is trial 98 with value: 0.8791208791208791.
[32m[I 2023-04-21 01:54:20,900][39m Trial 1060 finished with value: 0.8539325842696629 and parameters: {'objective': 'CrossEntropy', 'colsample_bylevel': 0.07897062970663503, 'depth': 3, 'boosting_type': 'Plain', 'bootstrap_type': 'Bayesian', 'bagging_temperature': 8.496999823275837}. Best is trial 98 with value: 0.8791208791208791.
[32m[I 2023-04-21 01:54:21,635][39m Trial 1061 finished with value: 0.8539325842696629 and parameters: {'objective': 'Logloss', 'colsample_bylevel': 0.0828431640453161, 'depth': 3, 'boosting_type': 'Plain', 'bootstrap_type': 'Bayesian', 'bagging_temperature': 9.165026506868204}. Best is trial 98 with value: 0.8791208791208791.
[32m[I 2023-04-21 01:54:22,504][39m Trial 1062 finished with value: 0.8539325842696629 and parameters: {'objective': 'CrossEntropy', 'colsample_bylevel': 0.08235289500107784, 'depth': 3, 'boosting_type': 'Plain', 'bootstrap_type': 'Bayesian', 'bagging_temperature': 9.031183643853257}. Best is trial 98 with value: 0.8791208791208791.
[32m[I 2023-04-21 01:54:23,387][39m Trial 1063 finished with value: 0.8666666666666666 and parameters: {'objective': 'CrossEntropy', 'colsample_bylevel': 0.07215449504981997, 'depth': 3, 'boosting_type': 'Plain', 'bootstrap_type': 'Bayesian', 'bagging_temperature': 9.602610504306945}. Best is trial 98 with value: 0.8791208791208791.
[32m[I 2023-04-21 01:54:28,370][39m Trial 1064 finished with value: 0.7912087912087912 and parameters: {'objective': 'CrossEntropy', 'colsample_bylevel': 0.07550884049455078, 'depth': 4, 'boosting_type': 'Ordered', 'bootstrap_type': 'MVS'}. Best is trial 98 with value: 0.8791208791208791.
[32m[I 2023-04-21 01:54:29,472][39m Trial 1065 finished with value: 0.8666666666666666 and parameters: {'objective': 'CrossEntropy', 'colsample_bylevel': 0.08966534541566744, 'depth': 3, 'boosting_type': 'Plain', 'bootstrap_type': 'Bayesian', 'bagging_temperature': 9.75894054960751}. Best is trial 98 with value: 0.8791208791208791.
[32m[I 2023-04-21 01:54:30,699][39m Trial 1066 finished with value: 0.8372093023255814 and parameters: {'objective': 'Logloss', 'colsample_bylevel': 0.05375720600060598, 'depth': 3, 'boosting_type': 'Plain', 'bootstrap_type': 'Bayesian', 'bagging_temperature': 9.822891843161804}. Best is trial 98 with value: 0.8791208791208791.
[32m[I 2023-04-21 01:54:31,468][39m Trial 1067 finished with value: 0.8539325842696629 and parameters: {'objective': 'CrossEntropy', 'colsample_bylevel': 0.07711146193368733, 'depth': 8, 'boosting_type': 'Plain', 'bootstrap_type': 'Bayesian', 'bagging_temperature': 9.608565836261068}. Best is trial 98 with value: 0.8791208791208791.
[32m[I 2023-04-21 01:54:32,051][39m Trial 1068 finished with value: 0.8666666666666666 and parameters: {'objective': 'Logloss', 'colsample_bylevel': 0.07649837956002814, 'depth': 4, 'boosting_type': 'Plain', 'bootstrap_type': 'Bayesian', 'bagging_temperature': 9.82778480866338}. Best is trial 98 with value: 0.8791208791208791.
[32m[I 2023-04-21 01:54:32,969][39m Trial 1069 finished with value: 0.8791208791208791 and parameters: {'objective': 'Logloss', 'colsample_bylevel': 0.08110736401575586, 'depth': 5, 'boosting_type': 'Plain', 'bootstrap_type': 'Bayesian', 'bagging_temperature': 9.36267217866231}. Best is trial 98 with value: 0.8791208791208791.
[32m[I 2023-04-21 01:54:33,716][39m Trial 1070 finished with value: 0.8666666666666666 and parameters: {'objective': 'Logloss', 'colsample_bylevel': 0.08089199736921533, 'depth': 5, 'boosting_type': 'Plain', 'bootstrap_type': 'Bayesian', 'bagging_temperature': 8.88900450247287}. Best is trial 98 with value: 0.8791208791208791.
[32m[I 2023-04-21 01:54:34,692][39m Trial 1071 finished with value: 0.8275862068965518 and parameters: {'objective': 'CrossEntropy', 'colsample_bylevel': 0.07813543170725723, 'depth': 5, 'boosting_type': 'Plain', 'bootstrap_type': 'Bayesian', 'bagging_temperature': 9.429410736793816}. Best is trial 98 with value: 0.8791208791208791.
[32m[I 2023-04-21 01:54:35,463][39m Trial 1072 finished with value: 0.8539325842696629 and parameters: {'objective': 'CrossEntropy', 'colsample_bylevel': 0.07988829123929676, 'depth': 5, 'boosting_type': 'Plain', 'bootstrap_type': 'Bayesian', 'bagging_temperature': 8.923602686463544}. Best is trial 98 with value: 0.8791208791208791.
[32m[I 2023-04-21 01:54:36,211][39m Trial 1073 finished with value: 0.8314606741573034 and parameters: {'objective': 'Logloss', 'colsample_bylevel': 0.08096449207356742, 'depth': 5, 'boosting_type': 'Plain', 'bootstrap_type': 'Bayesian', 'bagging_temperature': 1.8992069692801854}. Best is trial 98 with value: 0.8791208791208791.
[32m[I 2023-04-21 01:54:37,280][39m Trial 1074 finished with value: 0.8372093023255814 and parameters: {'objective': 'CrossEntropy', 'colsample_bylevel': 0.09938975947102943, 'depth': 4, 'boosting_type': 'Plain', 'bootstrap_type': 'Bayesian', 'bagging_temperature': 9.232103509413419}. Best is trial 98 with value: 0.8791208791208791.
[32m[I 2023-04-21 01:54:38,084][39m Trial 1075 finished with value: 0.8275862068965518 and parameters: {'objective': 'Logloss', 'colsample_bylevel': 0.09690737895092687, 'depth': 6, 'boosting_type': 'Plain', 'bootstrap_type': 'MVS'}. Best is trial 98 with value: 0.8791208791208791.
[32m[I 2023-04-21 01:54:39,249][39m Trial 1076 finished with value: 0.8539325842696629 and parameters: {'objective': 'CrossEntropy', 'colsample_bylevel': 0.07966766152257175, 'depth': 6, 'boosting_type': 'Plain', 'bootstrap_type': 'Bayesian', 'bagging_temperature': 9.63042377215202}. Best is trial 98 with value: 0.8791208791208791.
[32m[I 2023-04-21 01:54:39,991][39m Trial 1077 finished with value: 0.8275862068965518 and parameters: {'objective': 'CrossEntropy', 'colsample_bylevel': 0.07810430859512144, 'depth': 5, 'boosting_type': 'Plain', 'bootstrap_type': 'Bernoulli', 'subsample': 0.8881017774369879}. Best is trial 98 with value: 0.8791208791208791.
[32m[I 2023-04-21 01:54:40,941][39m Trial 1078 finished with value: 0.8275862068965518 and parameters: {'objective': 'CrossEntropy', 'colsample_bylevel': 0.08024929263908538, 'depth': 4, 'boosting_type': 'Plain', 'bootstrap_type': 'Bayesian', 'bagging_temperature': 8.181353551639539}. Best is trial 98 with value: 0.8791208791208791.
[32m[I 2023-04-21 01:54:41,734][39m Trial 1079 finished with value: 0.8275862068965518 and parameters: {'objective': 'CrossEntropy', 'colsample_bylevel': 0.0820793255703385, 'depth': 4, 'boosting_type': 'Plain', 'bootstrap_type': 'Bayesian', 'bagging_temperature': 8.497493948346698}. Best is trial 98 with value: 0.8791208791208791.
[32m[I 2023-04-21 01:54:42,566][39m Trial 1080 finished with value: 0.8409090909090909 and parameters: {'objective': 'CrossEntropy', 'colsample_bylevel': 0.09505199381936713, 'depth': 4, 'boosting_type': 'Plain', 'bootstrap_type': 'Bayesian', 'bagging_temperature': 9.994540720760257}. Best is trial 98 with value: 0.8791208791208791.
[32m[I 2023-04-21 01:54:43,402][39m Trial 1081 finished with value: 0.8409090909090909 and parameters: {'objective': 'CrossEntropy', 'colsample_bylevel': 0.07268652456751959, 'depth': 5, 'boosting_type': 'Plain', 'bootstrap_type': 'Bayesian', 'bagging_temperature': 9.512299732669106}. Best is trial 98 with value: 0.8791208791208791.
[32m[I 2023-04-21 01:54:44,294][39m Trial 1082 finished with value: 0.8275862068965518 and parameters: {'objective': 'CrossEntropy', 'colsample_bylevel': 0.09188584742712981, 'depth': 4, 'boosting_type': 'Plain', 'bootstrap_type': 'Bayesian', 'bagging_temperature': 8.78061332012524}. Best is trial 98 with value: 0.8791208791208791.
[32m[I 2023-04-21 01:54:45,666][39m Trial 1083 finished with value: 0.8539325842696629 and parameters: {'objective': 'CrossEntropy', 'colsample_bylevel': 0.07870266930082043, 'depth': 4, 'boosting_type': 'Plain', 'bootstrap_type': 'Bayesian', 'bagging_temperature': 9.320958967787153}. Best is trial 98 with value: 0.8791208791208791.
[32m[I 2023-04-21 01:54:50,198][39m Trial 1084 finished with value: 0.8539325842696629 and parameters: {'objective': 'CrossEntropy', 'colsample_bylevel': 0.07531332359577382, 'depth': 3, 'boosting_type': 'Ordered', 'bootstrap_type': 'Bayesian', 'bagging_temperature': 8.618450837203598}. Best is trial 98 with value: 0.8791208791208791.
[32m[I 2023-04-21 01:54:51,114][39m Trial 1085 finished with value: 0.8409090909090909 and parameters: {'objective': 'CrossEntropy', 'colsample_bylevel': 0.08196091178528528, 'depth': 3, 'boosting_type': 'Plain', 'bootstrap_type': 'Bayesian', 'bagging_temperature': 9.132991039610165}. Best is trial 98 with value: 0.8791208791208791.
[32m[I 2023-04-21 01:54:51,947][39m Trial 1086 finished with value: 0.8409090909090909 and parameters: {'objective': 'CrossEntropy', 'colsample_bylevel': 0.09904102703356732, 'depth': 3, 'boosting_type': 'Plain', 'bootstrap_type': 'Bayesian', 'bagging_temperature': 9.185970037747479}. Best is trial 98 with value: 0.8791208791208791.
[32m[I 2023-04-21 01:54:52,761][39m Trial 1087 finished with value: 0.8275862068965518 and parameters: {'objective': 'CrossEntropy', 'colsample_bylevel': 0.07605902373076441, 'depth': 4, 'boosting_type': 'Plain', 'bootstrap_type': 'MVS'}. Best is trial 98 with value: 0.8791208791208791.
[32m[I 2023-04-21 01:54:53,687][39m Trial 1088 finished with value: 0.8539325842696629 and parameters: {'objective': 'CrossEntropy', 'colsample_bylevel': 0.08005328206493006, 'depth': 3, 'boosting_type': 'Plain', 'bootstrap_type': 'Bayesian', 'bagging_temperature': 9.369864347362473}. Best is trial 98 with value: 0.8791208791208791.
[32m[I 2023-04-21 01:54:54,480][39m Trial 1089 finished with value: 0.8275862068965518 and parameters: {'objective': 'CrossEntropy', 'colsample_bylevel': 0.09182031823606387, 'depth': 3, 'boosting_type': 'Plain', 'bootstrap_type': 'Bayesian', 'bagging_temperature': 3.0483872919769657}. Best is trial 98 with value: 0.8791208791208791.
[32m[I 2023-04-21 01:54:55,642][39m Trial 1090 finished with value: 0.8409090909090909 and parameters: {'objective': 'Logloss', 'colsample_bylevel': 0.08193786788454412, 'depth': 5, 'boosting_type': 'Plain', 'bootstrap_type': 'Bayesian', 'bagging_temperature': 7.725836966675012}. Best is trial 98 with value: 0.8791208791208791.
[32m[I 2023-04-21 01:54:56,391][39m Trial 1091 finished with value: 0.8791208791208791 and parameters: {'objective': 'CrossEntropy', 'colsample_bylevel': 0.07697309677285749, 'depth': 6, 'boosting_type': 'Plain', 'bootstrap_type': 'Bayesian', 'bagging_temperature': 8.886293655705796}. Best is trial 98 with value: 0.8791208791208791.
[32m[I 2023-04-21 01:54:57,417][39m Trial 1092 finished with value: 0.8275862068965518 and parameters: {'objective': 'CrossEntropy', 'colsample_bylevel': 0.07558304290484792, 'depth': 7, 'boosting_type': 'Plain', 'bootstrap_type': 'Bayesian', 'bagging_temperature': 8.955428298423968}. Best is trial 98 with value: 0.8791208791208791.
[32m[I 2023-04-21 01:54:58,262][39m Trial 1093 finished with value: 0.8539325842696629 and parameters: {'objective': 'CrossEntropy', 'colsample_bylevel': 0.07392222011383415, 'depth': 6, 'boosting_type': 'Plain', 'bootstrap_type': 'Bayesian', 'bagging_temperature': 8.792669474033913}. Best is trial 98 with value: 0.8791208791208791.
[32m[I 2023-04-21 01:54:59,362][39m Trial 1094 finished with value: 0.8372093023255814 and parameters: {'objective': 'CrossEntropy', 'colsample_bylevel': 0.07769611618428877, 'depth': 5, 'boosting_type': 'Plain', 'bootstrap_type': 'Bayesian', 'bagging_temperature': 8.998055369788128}. Best is trial 98 with value: 0.8791208791208791.
[32m[I 2023-04-21 01:55:00,121][39m Trial 1095 finished with value: 0.8539325842696629 and parameters: {'objective': 'CrossEntropy', 'colsample_bylevel': 0.07687684693645867, 'depth': 6, 'boosting_type': 'Plain', 'bootstrap_type': 'Bayesian', 'bagging_temperature': 9.432061608462165}. Best is trial 98 with value: 0.8791208791208791.
[32m[I 2023-04-21 01:55:01,034][39m Trial 1096 finished with value: 0.8539325842696629 and parameters: {'objective': 'CrossEntropy', 'colsample_bylevel': 0.07446013752980254, 'depth': 5, 'boosting_type': 'Plain', 'bootstrap_type': 'Bayesian', 'bagging_temperature': 8.656733678689415}. Best is trial 98 with value: 0.8791208791208791.
[32m[I 2023-04-21 01:55:01,927][39m Trial 1097 finished with value: 0.8539325842696629 and parameters: {'objective': 'CrossEntropy', 'colsample_bylevel': 0.07851826625995376, 'depth': 5, 'boosting_type': 'Plain', 'bootstrap_type': 'Bayesian', 'bagging_temperature': 9.174005838885869}. Best is trial 98 with value: 0.8791208791208791.
[32m[I 2023-04-21 01:55:02,636][39m Trial 1098 finished with value: 0.8409090909090909 and parameters: {'objective': 'CrossEntropy', 'colsample_bylevel': 0.07693706084543903, 'depth': 6, 'boosting_type': 'Plain', 'bootstrap_type': 'Bayesian', 'bagging_temperature': 9.647640869565269}. Best is trial 98 with value: 0.8791208791208791.
[32m[I 2023-04-21 01:55:03,770][39m Trial 1099 finished with value: 0.8181818181818182 and parameters: {'objective': 'CrossEntropy', 'colsample_bylevel': 0.07819994574913301, 'depth': 6, 'boosting_type': 'Plain', 'bootstrap_type': 'Bernoulli', 'subsample': 0.8288126613292272}. Best is trial 98 with value: 0.8791208791208791.
[32m[I 2023-04-21 01:55:04,502][39m Trial 1100 finished with value: 0.8539325842696629 and parameters: {'objective': 'CrossEntropy', 'colsample_bylevel': 0.07600189368860716, 'depth': 5, 'boosting_type': 'Plain', 'bootstrap_type': 'Bayesian', 'bagging_temperature': 8.952328558878692}. Best is trial 98 with value: 0.8791208791208791.
[32m[I 2023-04-21 01:55:05,710][39m Trial 1101 finished with value: 0.8409090909090909 and parameters: {'objective': 'CrossEntropy', 'colsample_bylevel': 0.07210868267820296, 'depth': 6, 'boosting_type': 'Plain', 'bootstrap_type': 'MVS'}. Best is trial 98 with value: 0.8791208791208791.
[32m[I 2023-04-21 01:55:06,429][39m Trial 1102 finished with value: 0.8409090909090909 and parameters: {'objective': 'CrossEntropy', 'colsample_bylevel': 0.07925988910968389, 'depth': 7, 'boosting_type': 'Plain', 'bootstrap_type': 'Bayesian', 'bagging_temperature': 1.2833377657032923}. Best is trial 98 with value: 0.8791208791208791.
[32m[I 2023-04-21 01:55:07,597][39m Trial 1103 finished with value: 0.8409090909090909 and parameters: {'objective': 'Logloss', 'colsample_bylevel': 0.09418973132414565, 'depth': 6, 'boosting_type': 'Plain', 'bootstrap_type': 'Bayesian', 'bagging_temperature': 9.462526071643575}. Best is trial 98 with value: 0.8791208791208791.
[32m[I 2023-04-21 01:55:12,634][39m Trial 1104 finished with value: 0.8409090909090909 and parameters: {'objective': 'Logloss', 'colsample_bylevel': 0.07375238650311355, 'depth': 5, 'boosting_type': 'Ordered', 'bootstrap_type': 'Bayesian', 'bagging_temperature': 9.749490645340462}. Best is trial 98 with value: 0.8791208791208791.
[32m[I 2023-04-21 01:55:13,522][39m Trial 1105 finished with value: 0.8571428571428571 and parameters: {'objective': 'Logloss', 'colsample_bylevel': 0.07462917697661775, 'depth': 4, 'boosting_type': 'Plain', 'bootstrap_type': 'Bayesian', 'bagging_temperature': 9.311456664785863}. Best is trial 98 with value: 0.8791208791208791.
[32m[I 2023-04-21 01:55:14,352][39m Trial 1106 finished with value: 0.8275862068965518 and parameters: {'objective': 'CrossEntropy', 'colsample_bylevel': 0.076087885689173, 'depth': 6, 'boosting_type': 'Plain', 'bootstrap_type': 'Bayesian', 'bagging_temperature': 8.374998419116585}. Best is trial 98 with value: 0.8791208791208791.
[32m[I 2023-04-21 01:55:15,090][39m Trial 1107 finished with value: 0.8539325842696629 and parameters: {'objective': 'CrossEntropy', 'colsample_bylevel': 0.08000894561208552, 'depth': 4, 'boosting_type': 'Plain', 'bootstrap_type': 'Bayesian', 'bagging_temperature': 9.138399855413502}. Best is trial 98 with value: 0.8791208791208791.
[32m[I 2023-04-21 01:55:15,975][39m Trial 1108 finished with value: 0.8666666666666666 and parameters: {'objective': 'CrossEntropy', 'colsample_bylevel': 0.0775853177394863, 'depth': 7, 'boosting_type': 'Plain', 'bootstrap_type': 'Bayesian', 'bagging_temperature': 8.789361990866722}. Best is trial 98 with value: 0.8791208791208791.
[32m[I 2023-04-21 01:55:17,014][39m Trial 1109 finished with value: 0.8139534883720929 and parameters: {'objective': 'CrossEntropy', 'colsample_bylevel': 0.07994363556729502, 'depth': 4, 'boosting_type': 'Plain', 'bootstrap_type': 'Bayesian', 'bagging_temperature': 8.642752109489363}. Best is trial 98 with value: 0.8791208791208791.
[32m[I 2023-04-21 01:55:17,714][39m Trial 1110 finished with value: 0.8539325842696629 and parameters: {'objective': 'CrossEntropy', 'colsample_bylevel': 0.09405022224990393, 'depth': 3, 'boosting_type': 'Plain', 'bootstrap_type': 'Bayesian', 'bagging_temperature': 8.46622498731421}. Best is trial 98 with value: 0.8791208791208791.
[32m[I 2023-04-21 01:55:18,676][39m Trial 1111 finished with value: 0.8539325842696629 and parameters: {'objective': 'CrossEntropy', 'colsample_bylevel': 0.07813004228167235, 'depth': 5, 'boosting_type': 'Plain', 'bootstrap_type': 'Bayesian', 'bagging_temperature': 9.561310979677584}. Best is trial 98 with value: 0.8791208791208791.
[32m[I 2023-04-21 01:55:19,607][39m Trial 1112 finished with value: 0.8791208791208791 and parameters: {'objective': 'CrossEntropy', 'colsample_bylevel': 0.08034153180317599, 'depth': 3, 'boosting_type': 'Plain', 'bootstrap_type': 'Bayesian', 'bagging_temperature': 9.313974137584362}. Best is trial 98 with value: 0.8791208791208791.
[32m[I 2023-04-21 01:55:20,388][39m Trial 1113 finished with value: 0.8181818181818182 and parameters: {'objective': 'CrossEntropy', 'colsample_bylevel': 0.0787556302212297, 'depth': 11, 'boosting_type': 'Plain', 'bootstrap_type': 'MVS'}. Best is trial 98 with value: 0.8791208791208791.
[32m[I 2023-04-21 01:55:21,033][39m Trial 1114 finished with value: 0.8539325842696629 and parameters: {'objective': 'CrossEntropy', 'colsample_bylevel': 0.08006870364290314, 'depth': 3, 'boosting_type': 'Plain', 'bootstrap_type': 'Bayesian', 'bagging_temperature': 9.035696801417615}. Best is trial 98 with value: 0.8791208791208791.
[32m[I 2023-04-21 01:55:22,012][39m Trial 1115 finished with value: 0.8666666666666666 and parameters: {'objective': 'CrossEntropy', 'colsample_bylevel': 0.07680824947910377, 'depth': 3, 'boosting_type': 'Plain', 'bootstrap_type': 'Bayesian', 'bagging_temperature': 9.221969524092863}. Best is trial 98 with value: 0.8791208791208791.
[32m[I 2023-04-21 01:55:22,875][39m Trial 1116 finished with value: 0.8539325842696629 and parameters: {'objective': 'CrossEntropy', 'colsample_bylevel': 0.07857303182707832, 'depth': 3, 'boosting_type': 'Plain', 'bootstrap_type': 'Bayesian', 'bagging_temperature': 8.97345276113928}. Best is trial 98 with value: 0.8791208791208791.
[32m[I 2023-04-21 01:55:23,651][39m Trial 1117 finished with value: 0.8409090909090909 and parameters: {'objective': 'CrossEntropy', 'colsample_bylevel': 0.07569682808441129, 'depth': 3, 'boosting_type': 'Plain', 'bootstrap_type': 'Bayesian', 'bagging_temperature': 8.82296388557949}. Best is trial 98 with value: 0.8791208791208791.
[32m[I 2023-04-21 01:55:24,185][39m Trial 1118 finished with value: 0.7857142857142858 and parameters: {'objective': 'CrossEntropy', 'colsample_bylevel': 0.02623734716792677, 'depth': 3, 'boosting_type': 'Plain', 'bootstrap_type': 'Bayesian', 'bagging_temperature': 9.255732133076332}. Best is trial 98 with value: 0.8791208791208791.
[32m[I 2023-04-21 01:55:25,030][39m Trial 1119 finished with value: 0.8539325842696629 and parameters: {'objective': 'CrossEntropy', 'colsample_bylevel': 0.07956630980207466, 'depth': 3, 'boosting_type': 'Plain', 'bootstrap_type': 'Bayesian', 'bagging_temperature': 9.084603487648938}. Best is trial 98 with value: 0.8791208791208791.
[32m[I 2023-04-21 01:55:25,956][39m Trial 1120 finished with value: 0.8539325842696629 and parameters: {'objective': 'CrossEntropy', 'colsample_bylevel': 0.07753728734547306, 'depth': 3, 'boosting_type': 'Plain', 'bootstrap_type': 'Bayesian', 'bagging_temperature': 9.374045059222471}. Best is trial 98 with value: 0.8791208791208791.
[32m[I 2023-04-21 01:55:26,952][39m Trial 1121 finished with value: 0.8666666666666666 and parameters: {'objective': 'CrossEntropy', 'colsample_bylevel': 0.08120358919360773, 'depth': 3, 'boosting_type': 'Plain', 'bootstrap_type': 'Bayesian', 'bagging_temperature': 9.118841843510038}. Best is trial 98 with value: 0.8791208791208791.
[32m[I 2023-04-21 01:55:31,629][39m Trial 1122 finished with value: 0.8666666666666666 and parameters: {'objective': 'CrossEntropy', 'colsample_bylevel': 0.0811578620826822, 'depth': 3, 'boosting_type': 'Ordered', 'bootstrap_type': 'Bernoulli', 'subsample': 0.15690875655048436}. Best is trial 98 with value: 0.8791208791208791.
[32m[I 2023-04-21 01:55:32,865][39m Trial 1123 finished with value: 0.8539325842696629 and parameters: {'objective': 'CrossEntropy', 'colsample_bylevel': 0.07867566510066483, 'depth': 7, 'boosting_type': 'Plain', 'bootstrap_type': 'Bayesian', 'bagging_temperature': 8.910417423667278}. Best is trial 98 with value: 0.8791208791208791.
[32m[I 2023-04-21 01:55:33,883][39m Trial 1124 finished with value: 0.8764044943820225 and parameters: {'objective': 'CrossEntropy', 'colsample_bylevel': 0.07450334273533364, 'depth': 3, 'boosting_type': 'Plain', 'bootstrap_type': 'Bayesian', 'bagging_temperature': 9.32609805781768}. Best is trial 98 with value: 0.8791208791208791.
