[32m[I 2023-04-21 03:32:13,479][39m Trial 5982 finished with value: 0.8539325842696629 and parameters: {'objective': 'CrossEntropy', 'colsample_bylevel': 0.061167942965904935, 'depth': 10, 'boosting_type': 'Plain', 'bootstrap_type': 'Bayesian', 'bagging_temperature': 9.153935889647203}. Best is trial 3065 with value: 0.8863636363636364.
[32m[I 2023-04-21 03:32:14,689][39m Trial 5983 finished with value: 0.8539325842696629 and parameters: {'objective': 'CrossEntropy', 'colsample_bylevel': 0.07686163977278605, 'depth': 9, 'boosting_type': 'Plain', 'bootstrap_type': 'Bayesian', 'bagging_temperature': 8.760902194665109}. Best is trial 3065 with value: 0.8863636363636364.
[32m[I 2023-04-21 03:32:15,642][39m Trial 5984 finished with value: 0.8666666666666666 and parameters: {'objective': 'CrossEntropy', 'colsample_bylevel': 0.07696461726227508, 'depth': 9, 'boosting_type': 'Plain', 'bootstrap_type': 'Bayesian', 'bagging_temperature': 8.647389765847992}. Best is trial 3065 with value: 0.8863636363636364.
[32m[I 2023-04-21 03:32:16,335][39m Trial 5985 finished with value: 0.8505747126436782 and parameters: {'objective': 'CrossEntropy', 'colsample_bylevel': 0.07779135395279602, 'depth': 12, 'boosting_type': 'Plain', 'bootstrap_type': 'MVS'}. Best is trial 3065 with value: 0.8863636363636364.
[32m[I 2023-04-21 03:32:17,064][39m Trial 5986 finished with value: 0.8372093023255814 and parameters: {'objective': 'CrossEntropy', 'colsample_bylevel': 0.07700140168715897, 'depth': 12, 'boosting_type': 'Plain', 'bootstrap_type': 'Bayesian', 'bagging_temperature': 9.317434032782828}. Best is trial 3065 with value: 0.8863636363636364.
[32m[I 2023-04-21 03:32:18,421][39m Trial 5987 finished with value: 0.8666666666666666 and parameters: {'objective': 'CrossEntropy', 'colsample_bylevel': 0.06462920191424681, 'depth': 7, 'boosting_type': 'Plain', 'bootstrap_type': 'Bayesian', 'bagging_temperature': 9.804029943899872}. Best is trial 3065 with value: 0.8863636363636364.
[32m[I 2023-04-21 03:32:19,906][39m Trial 5988 finished with value: 0.8409090909090909 and parameters: {'objective': 'CrossEntropy', 'colsample_bylevel': 0.07303079462449706, 'depth': 9, 'boosting_type': 'Plain', 'bootstrap_type': 'Bayesian', 'bagging_temperature': 9.492878609332077}. Best is trial 3065 with value: 0.8863636363636364.
[32m[I 2023-04-21 03:32:21,049][39m Trial 5989 finished with value: 0.8409090909090909 and parameters: {'objective': 'CrossEntropy', 'colsample_bylevel': 0.06775447932986906, 'depth': 8, 'boosting_type': 'Plain', 'bootstrap_type': 'Bayesian', 'bagging_temperature': 8.965226626136358}. Best is trial 3065 with value: 0.8863636363636364.
[32m[I 2023-04-21 03:32:22,280][39m Trial 5990 finished with value: 0.8409090909090909 and parameters: {'objective': 'CrossEntropy', 'colsample_bylevel': 0.06751142965927671, 'depth': 12, 'boosting_type': 'Plain', 'bootstrap_type': 'Bayesian', 'bagging_temperature': 9.139332252783724}. Best is trial 3065 with value: 0.8863636363636364.
[32m[I 2023-04-21 03:32:23,011][39m Trial 5991 finished with value: 0.8666666666666666 and parameters: {'objective': 'CrossEntropy', 'colsample_bylevel': 0.0674533192947431, 'depth': 10, 'boosting_type': 'Plain', 'bootstrap_type': 'Bayesian', 'bagging_temperature': 9.586200751302647}. Best is trial 3065 with value: 0.8863636363636364.
[32m[I 2023-04-21 03:32:23,911][39m Trial 5992 finished with value: 0.8275862068965518 and parameters: {'objective': 'CrossEntropy', 'colsample_bylevel': 0.08010166491348432, 'depth': 10, 'boosting_type': 'Plain', 'bootstrap_type': 'Bayesian', 'bagging_temperature': 9.346209314597472}. Best is trial 3065 with value: 0.8863636363636364.
[32m[I 2023-04-21 03:32:28,512][39m Trial 5993 finished with value: 0.7999999999999999 and parameters: {'objective': 'CrossEntropy', 'colsample_bylevel': 0.05828549331774663, 'depth': 3, 'boosting_type': 'Ordered', 'bootstrap_type': 'Bayesian', 'bagging_temperature': 9.469576272041975}. Best is trial 3065 with value: 0.8863636363636364.
[32m[I 2023-04-21 03:32:29,649][39m Trial 5994 finished with value: 0.8539325842696629 and parameters: {'objective': 'Logloss', 'colsample_bylevel': 0.07189274697437756, 'depth': 10, 'boosting_type': 'Plain', 'bootstrap_type': 'Bayesian', 'bagging_temperature': 9.378937281651531}. Best is trial 3065 with value: 0.8863636363636364.
[32m[I 2023-04-21 03:32:30,928][39m Trial 5995 finished with value: 0.8539325842696629 and parameters: {'objective': 'CrossEntropy', 'colsample_bylevel': 0.0833348237796795, 'depth': 3, 'boosting_type': 'Plain', 'bootstrap_type': 'Bayesian', 'bagging_temperature': 8.51622976411551}. Best is trial 3065 with value: 0.8863636363636364.
[32m[I 2023-04-21 03:32:31,977][39m Trial 5996 finished with value: 0.8666666666666666 and parameters: {'objective': 'CrossEntropy', 'colsample_bylevel': 0.08887802700120176, 'depth': 3, 'boosting_type': 'Plain', 'bootstrap_type': 'Bayesian', 'bagging_temperature': 8.287818449531578}. Best is trial 3065 with value: 0.8863636363636364.
[32m[I 2023-04-21 03:32:33,025][39m Trial 5997 finished with value: 0.8539325842696629 and parameters: {'objective': 'CrossEntropy', 'colsample_bylevel': 0.09360951703494541, 'depth': 3, 'boosting_type': 'Plain', 'bootstrap_type': 'Bayesian', 'bagging_temperature': 9.940985528222708}. Best is trial 3065 with value: 0.8863636363636364.
[32m[I 2023-04-21 03:32:34,406][39m Trial 5998 finished with value: 0.8764044943820225 and parameters: {'objective': 'CrossEntropy', 'colsample_bylevel': 0.0848353363433198, 'depth': 2, 'boosting_type': 'Plain', 'bootstrap_type': 'Bayesian', 'bagging_temperature': 8.662425894731514}. Best is trial 3065 with value: 0.8863636363636364.
[32m[I 2023-04-21 03:32:35,464][39m Trial 5999 finished with value: 0.8 and parameters: {'objective': 'CrossEntropy', 'colsample_bylevel': 0.07523221953953085, 'depth': 1, 'boosting_type': 'Plain', 'bootstrap_type': 'MVS'}. Best is trial 3065 with value: 0.8863636363636364.
[32m[I 2023-04-21 03:32:36,650][39m Trial 6000 finished with value: 0.8275862068965518 and parameters: {'objective': 'CrossEntropy', 'colsample_bylevel': 0.04829763554741652, 'depth': 10, 'boosting_type': 'Plain', 'bootstrap_type': 'Bayesian', 'bagging_temperature': 8.877856190591357}. Best is trial 3065 with value: 0.8863636363636364.
[32m[I 2023-04-21 03:32:37,400][39m Trial 6001 finished with value: 0.8539325842696629 and parameters: {'objective': 'CrossEntropy', 'colsample_bylevel': 0.0701111134328442, 'depth': 4, 'boosting_type': 'Plain', 'bootstrap_type': 'Bayesian', 'bagging_temperature': 9.981584299687352}. Best is trial 3065 with value: 0.8863636363636364.
[32m[I 2023-04-21 03:32:38,407][39m Trial 6002 finished with value: 0.8539325842696629 and parameters: {'objective': 'Logloss', 'colsample_bylevel': 0.09217158146979654, 'depth': 2, 'boosting_type': 'Plain', 'bootstrap_type': 'Bayesian', 'bagging_temperature': 9.7823108206753}. Best is trial 3065 with value: 0.8863636363636364.
[32m[I 2023-04-21 03:32:39,455][39m Trial 6003 finished with value: 0.8539325842696629 and parameters: {'objective': 'CrossEntropy', 'colsample_bylevel': 0.07268621887315287, 'depth': 9, 'boosting_type': 'Plain', 'bootstrap_type': 'Bernoulli', 'subsample': 0.6688748535919664}. Best is trial 3065 with value: 0.8863636363636364.
[32m[I 2023-04-21 03:32:40,308][39m Trial 6004 finished with value: 0.8275862068965518 and parameters: {'objective': 'Logloss', 'colsample_bylevel': 0.07813694199841292, 'depth': 9, 'boosting_type': 'Plain', 'bootstrap_type': 'Bayesian', 'bagging_temperature': 9.538658086505647}. Best is trial 3065 with value: 0.8863636363636364.
[32m[I 2023-04-21 03:32:41,444][39m Trial 6005 finished with value: 0.8139534883720929 and parameters: {'objective': 'Logloss', 'colsample_bylevel': 0.08763593016199576, 'depth': 5, 'boosting_type': 'Plain', 'bootstrap_type': 'Bayesian', 'bagging_temperature': 9.603553943171894}. Best is trial 3065 with value: 0.8863636363636364.
[32m[I 2023-04-21 03:32:42,922][39m Trial 6006 finished with value: 0.8470588235294119 and parameters: {'objective': 'CrossEntropy', 'colsample_bylevel': 0.0840210345744452, 'depth': 7, 'boosting_type': 'Plain', 'bootstrap_type': 'Bayesian', 'bagging_temperature': 9.063436189440267}. Best is trial 3065 with value: 0.8863636363636364.
[32m[I 2023-04-21 03:32:44,095][39m Trial 6007 finished with value: 0.8539325842696629 and parameters: {'objective': 'Logloss', 'colsample_bylevel': 0.06930357056874765, 'depth': 4, 'boosting_type': 'Plain', 'bootstrap_type': 'Bayesian', 'bagging_temperature': 9.130850885480575}. Best is trial 3065 with value: 0.8863636363636364.
[32m[I 2023-04-21 03:32:45,267][39m Trial 6008 finished with value: 0.8539325842696629 and parameters: {'objective': 'CrossEntropy', 'colsample_bylevel': 0.08534949508653351, 'depth': 3, 'boosting_type': 'Plain', 'bootstrap_type': 'Bayesian', 'bagging_temperature': 9.440465740738745}. Best is trial 3065 with value: 0.8863636363636364.
[32m[I 2023-04-21 03:32:49,598][39m Trial 6009 finished with value: 0.8314606741573034 and parameters: {'objective': 'Logloss', 'colsample_bylevel': 0.07198421585367472, 'depth': 4, 'boosting_type': 'Ordered', 'bootstrap_type': 'Bayesian', 'bagging_temperature': 9.326064850641925}. Best is trial 3065 with value: 0.8863636363636364.
[32m[I 2023-04-21 03:32:51,095][39m Trial 6010 finished with value: 0.8275862068965518 and parameters: {'objective': 'CrossEntropy', 'colsample_bylevel': 0.061156631383387366, 'depth': 3, 'boosting_type': 'Plain', 'bootstrap_type': 'Bernoulli', 'subsample': 0.8925068033447792}. Best is trial 3065 with value: 0.8863636363636364.
[32m[I 2023-04-21 03:32:52,439][39m Trial 6011 finished with value: 0.8539325842696629 and parameters: {'objective': 'CrossEntropy', 'colsample_bylevel': 0.08951870791109992, 'depth': 3, 'boosting_type': 'Plain', 'bootstrap_type': 'Bayesian', 'bagging_temperature': 9.992467315965207}. Best is trial 3065 with value: 0.8863636363636364.
[32m[I 2023-04-21 03:32:53,506][39m Trial 6012 finished with value: 0.8409090909090909 and parameters: {'objective': 'CrossEntropy', 'colsample_bylevel': 0.08111815017262504, 'depth': 3, 'boosting_type': 'Plain', 'bootstrap_type': 'Bayesian', 'bagging_temperature': 8.664748797767212}. Best is trial 3065 with value: 0.8863636363636364.
[32m[I 2023-04-21 03:32:54,463][39m Trial 6013 finished with value: 0.8666666666666666 and parameters: {'objective': 'CrossEntropy', 'colsample_bylevel': 0.06558172761958203, 'depth': 12, 'boosting_type': 'Plain', 'bootstrap_type': 'Bayesian', 'bagging_temperature': 9.524958773871948}. Best is trial 3065 with value: 0.8863636363636364.
[32m[I 2023-04-21 03:32:55,605][39m Trial 6014 finished with value: 0.8791208791208791 and parameters: {'objective': 'CrossEntropy', 'colsample_bylevel': 0.0744645161894675, 'depth': 4, 'boosting_type': 'Plain', 'bootstrap_type': 'Bayesian', 'bagging_temperature': 9.102173377613589}. Best is trial 3065 with value: 0.8863636363636364.
[32m[I 2023-04-21 03:32:57,201][39m Trial 6015 finished with value: 0.8539325842696629 and parameters: {'objective': 'CrossEntropy', 'colsample_bylevel': 0.07753282214456575, 'depth': 9, 'boosting_type': 'Plain', 'bootstrap_type': 'Bayesian', 'bagging_temperature': 8.841292791535015}. Best is trial 3065 with value: 0.8863636363636364.
