[32m[I 2023-04-21 02:25:18,869][39m Trial 2709 finished with value: 0.8505747126436782 and parameters: {'objective': 'CrossEntropy', 'colsample_bylevel': 0.07574743066349182, 'depth': 10, 'boosting_type': 'Plain', 'bootstrap_type': 'Bayesian', 'bagging_temperature': 9.543667386621125}. Best is trial 98 with value: 0.8791208791208791.
[32m[I 2023-04-21 02:25:20,056][39m Trial 2710 finished with value: 0.8539325842696629 and parameters: {'objective': 'CrossEntropy', 'colsample_bylevel': 0.07673488755653388, 'depth': 3, 'boosting_type': 'Plain', 'bootstrap_type': 'Bayesian', 'bagging_temperature': 9.180782972795832}. Best is trial 98 with value: 0.8791208791208791.
[32m[I 2023-04-21 02:25:20,752][39m Trial 2711 finished with value: 0.8791208791208791 and parameters: {'objective': 'CrossEntropy', 'colsample_bylevel': 0.07496011616603794, 'depth': 9, 'boosting_type': 'Plain', 'bootstrap_type': 'Bayesian', 'bagging_temperature': 9.649624763055137}. Best is trial 98 with value: 0.8791208791208791.
[32m[I 2023-04-21 02:25:21,568][39m Trial 2712 finished with value: 0.8275862068965518 and parameters: {'objective': 'Logloss', 'colsample_bylevel': 0.07805391787246856, 'depth': 8, 'boosting_type': 'Plain', 'bootstrap_type': 'Bernoulli', 'subsample': 0.27097806923519047}. Best is trial 98 with value: 0.8791208791208791.
[32m[I 2023-04-21 02:25:22,536][39m Trial 2713 finished with value: 0.8539325842696629 and parameters: {'objective': 'CrossEntropy', 'colsample_bylevel': 0.08143619017041667, 'depth': 3, 'boosting_type': 'Plain', 'bootstrap_type': 'Bayesian', 'bagging_temperature': 9.218929668203467}. Best is trial 98 with value: 0.8791208791208791.
[32m[I 2023-04-21 02:25:23,788][39m Trial 2714 finished with value: 0.8409090909090909 and parameters: {'objective': 'CrossEntropy', 'colsample_bylevel': 0.07175325162089476, 'depth': 11, 'boosting_type': 'Plain', 'bootstrap_type': 'Bayesian', 'bagging_temperature': 8.690292399845744}. Best is trial 98 with value: 0.8791208791208791.
[32m[I 2023-04-21 02:25:24,482][39m Trial 2715 finished with value: 0.8791208791208791 and parameters: {'objective': 'CrossEntropy', 'colsample_bylevel': 0.08134935460649848, 'depth': 3, 'boosting_type': 'Plain', 'bootstrap_type': 'Bayesian', 'bagging_temperature': 9.240489202053363}. Best is trial 98 with value: 0.8791208791208791.
[32m[I 2023-04-21 02:25:25,449][39m Trial 2716 finished with value: 0.8666666666666666 and parameters: {'objective': 'CrossEntropy', 'colsample_bylevel': 0.09176598862202212, 'depth': 3, 'boosting_type': 'Plain', 'bootstrap_type': 'Bayesian', 'bagging_temperature': 8.452531942097869}. Best is trial 98 with value: 0.8791208791208791.
[32m[I 2023-04-21 02:25:26,306][39m Trial 2717 finished with value: 0.8275862068965518 and parameters: {'objective': 'CrossEntropy', 'colsample_bylevel': 0.079253442570294, 'depth': 4, 'boosting_type': 'Plain', 'bootstrap_type': 'MVS'}. Best is trial 98 with value: 0.8791208791208791.
[32m[I 2023-04-21 02:25:27,127][39m Trial 2718 finished with value: 0.8666666666666666 and parameters: {'objective': 'CrossEntropy', 'colsample_bylevel': 0.08932969331496377, 'depth': 2, 'boosting_type': 'Plain', 'bootstrap_type': 'Bayesian', 'bagging_temperature': 9.670376658667669}. Best is trial 98 with value: 0.8791208791208791.
[32m[I 2023-04-21 02:25:28,417][39m Trial 2719 finished with value: 0.8791208791208791 and parameters: {'objective': 'CrossEntropy', 'colsample_bylevel': 0.07635339588319531, 'depth': 10, 'boosting_type': 'Plain', 'bootstrap_type': 'Bayesian', 'bagging_temperature': 9.504684221402957}. Best is trial 98 with value: 0.8791208791208791.
[32m[I 2023-04-21 02:25:29,402][39m Trial 2720 finished with value: 0.8539325842696629 and parameters: {'objective': 'CrossEntropy', 'colsample_bylevel': 0.07479101136582754, 'depth': 10, 'boosting_type': 'Plain', 'bootstrap_type': 'Bayesian', 'bagging_temperature': 9.662536924208341}. Best is trial 98 with value: 0.8791208791208791.
[32m[I 2023-04-21 02:25:30,376][39m Trial 2721 finished with value: 0.8505747126436782 and parameters: {'objective': 'CrossEntropy', 'colsample_bylevel': 0.08891130842498939, 'depth': 10, 'boosting_type': 'Plain', 'bootstrap_type': 'Bayesian', 'bagging_temperature': 9.471188282257941}. Best is trial 98 with value: 0.8791208791208791.
[32m[I 2023-04-21 02:25:31,020][39m Trial 2722 finished with value: 0.8409090909090909 and parameters: {'objective': 'CrossEntropy', 'colsample_bylevel': 0.08447712476973909, 'depth': 3, 'boosting_type': 'Plain', 'bootstrap_type': 'MVS'}. Best is trial 98 with value: 0.8791208791208791.
[32m[I 2023-04-21 02:25:32,165][39m Trial 2723 finished with value: 0.8409090909090909 and parameters: {'objective': 'CrossEntropy', 'colsample_bylevel': 0.07961876241351966, 'depth': 3, 'boosting_type': 'Plain', 'bootstrap_type': 'Bayesian', 'bagging_temperature': 8.271837467781664}. Best is trial 98 with value: 0.8791208791208791.
[32m[I 2023-04-21 02:25:33,285][39m Trial 2724 finished with value: 0.8539325842696629 and parameters: {'objective': 'CrossEntropy', 'colsample_bylevel': 0.07690190587321556, 'depth': 10, 'boosting_type': 'Plain', 'bootstrap_type': 'Bayesian', 'bagging_temperature': 9.793031764719544}. Best is trial 98 with value: 0.8791208791208791.
[32m[I 2023-04-21 02:25:34,432][39m Trial 2725 finished with value: 0.8275862068965518 and parameters: {'objective': 'CrossEntropy', 'colsample_bylevel': 0.07284597165918935, 'depth': 10, 'boosting_type': 'Plain', 'bootstrap_type': 'Bayesian', 'bagging_temperature': 9.815151788787594}. Best is trial 98 with value: 0.8791208791208791.
[32m[I 2023-04-21 02:25:35,136][39m Trial 2726 finished with value: 0.8666666666666666 and parameters: {'objective': 'CrossEntropy', 'colsample_bylevel': 0.07005487358049925, 'depth': 11, 'boosting_type': 'Plain', 'bootstrap_type': 'Bayesian', 'bagging_temperature': 9.87849325211804}. Best is trial 98 with value: 0.8791208791208791.
[32m[I 2023-04-21 02:25:36,080][39m Trial 2727 finished with value: 0.8666666666666666 and parameters: {'objective': 'Logloss', 'colsample_bylevel': 0.0777892479369402, 'depth': 10, 'boosting_type': 'Plain', 'bootstrap_type': 'Bayesian', 'bagging_temperature': 8.998925109499352}. Best is trial 98 with value: 0.8791208791208791.
[32m[I 2023-04-21 02:25:40,705][39m Trial 2728 finished with value: 0.8539325842696629 and parameters: {'objective': 'Logloss', 'colsample_bylevel': 0.0801857053801256, 'depth': 3, 'boosting_type': 'Ordered', 'bootstrap_type': 'Bayesian', 'bagging_temperature': 8.227478442685415}. Best is trial 98 with value: 0.8791208791208791.
[32m[I 2023-04-21 02:25:42,085][39m Trial 2729 finished with value: 0.8539325842696629 and parameters: {'objective': 'CrossEntropy', 'colsample_bylevel': 0.07618922987416984, 'depth': 2, 'boosting_type': 'Plain', 'bootstrap_type': 'Bayesian', 'bagging_temperature': 9.37399273027692}. Best is trial 98 with value: 0.8791208791208791.
[32m[I 2023-04-21 02:25:42,995][39m Trial 2730 finished with value: 0.8275862068965518 and parameters: {'objective': 'Logloss', 'colsample_bylevel': 0.08309502267725487, 'depth': 12, 'boosting_type': 'Plain', 'bootstrap_type': 'Bayesian', 'bagging_temperature': 8.852043180101973}. Best is trial 98 with value: 0.8791208791208791.
[32m[I 2023-04-21 02:25:43,920][39m Trial 2731 finished with value: 0.8539325842696629 and parameters: {'objective': 'Logloss', 'colsample_bylevel': 0.07005929234786364, 'depth': 3, 'boosting_type': 'Plain', 'bootstrap_type': 'Bayesian', 'bagging_temperature': 9.509105184137336}. Best is trial 98 with value: 0.8791208791208791.
[32m[I 2023-04-21 02:25:44,813][39m Trial 2732 finished with value: 0.8666666666666666 and parameters: {'objective': 'CrossEntropy', 'colsample_bylevel': 0.08138127660154129, 'depth': 3, 'boosting_type': 'Plain', 'bootstrap_type': 'Bayesian', 'bagging_temperature': 9.994275093295547}. Best is trial 98 with value: 0.8791208791208791.
[32m[I 2023-04-21 02:25:45,511][39m Trial 2733 finished with value: 0.8275862068965518 and parameters: {'objective': 'CrossEntropy', 'colsample_bylevel': 0.07835032164563707, 'depth': 10, 'boosting_type': 'Plain', 'bootstrap_type': 'Bayesian', 'bagging_temperature': 9.245435332951944}. Best is trial 98 with value: 0.8791208791208791.
[32m[I 2023-04-21 02:25:46,547][39m Trial 2734 finished with value: 0.8666666666666666 and parameters: {'objective': 'Logloss', 'colsample_bylevel': 0.07936910445504117, 'depth': 3, 'boosting_type': 'Plain', 'bootstrap_type': 'Bayesian', 'bagging_temperature': 9.983981006599905}. Best is trial 98 with value: 0.8791208791208791.
[32m[I 2023-04-21 02:25:47,453][39m Trial 2735 finished with value: 0.8539325842696629 and parameters: {'objective': 'CrossEntropy', 'colsample_bylevel': 0.07349584727540237, 'depth': 11, 'boosting_type': 'Plain', 'bootstrap_type': 'Bayesian', 'bagging_temperature': 9.425359378020952}. Best is trial 98 with value: 0.8791208791208791.
[32m[I 2023-04-21 02:25:48,748][39m Trial 2736 finished with value: 0.8275862068965518 and parameters: {'objective': 'CrossEntropy', 'colsample_bylevel': 0.07570622162223144, 'depth': 9, 'boosting_type': 'Plain', 'bootstrap_type': 'MVS'}. Best is trial 98 with value: 0.8791208791208791.
[32m[I 2023-04-21 02:25:49,530][39m Trial 2737 finished with value: 0.8505747126436782 and parameters: {'objective': 'CrossEntropy', 'colsample_bylevel': 0.07806335857538632, 'depth': 9, 'boosting_type': 'Plain', 'bootstrap_type': 'Bayesian', 'bagging_temperature': 9.499653841451913}. Best is trial 98 with value: 0.8791208791208791.
[32m[I 2023-04-21 02:25:50,489][39m Trial 2738 finished with value: 0.8045977011494252 and parameters: {'objective': 'CrossEntropy', 'colsample_bylevel': 0.07449380148807157, 'depth': 4, 'boosting_type': 'Plain', 'bootstrap_type': 'Bernoulli', 'subsample': 0.8669671261043579}. Best is trial 98 with value: 0.8791208791208791.
[32m[I 2023-04-21 02:25:51,181][39m Trial 2739 finished with value: 0.8409090909090909 and parameters: {'objective': 'CrossEntropy', 'colsample_bylevel': 0.07648047268561564, 'depth': 9, 'boosting_type': 'Plain', 'bootstrap_type': 'Bayesian', 'bagging_temperature': 9.297077219042961}. Best is trial 98 with value: 0.8791208791208791.
[32m[I 2023-04-21 02:25:51,953][39m Trial 2740 finished with value: 0.8539325842696629 and parameters: {'objective': 'CrossEntropy', 'colsample_bylevel': 0.07888068410672965, 'depth': 3, 'boosting_type': 'Plain', 'bootstrap_type': 'Bayesian', 'bagging_temperature': 9.224963513312222}. Best is trial 98 with value: 0.8791208791208791.
[32m[I 2023-04-21 02:25:52,658][39m Trial 2741 finished with value: 0.8275862068965518 and parameters: {'objective': 'CrossEntropy', 'colsample_bylevel': 0.08027379268496122, 'depth': 6, 'boosting_type': 'Plain', 'bootstrap_type': 'Bayesian', 'bagging_temperature': 9.083245965415687}. Best is trial 98 with value: 0.8791208791208791.
[32m[I 2023-04-21 02:25:53,864][39m Trial 2742 finished with value: 0.8409090909090909 and parameters: {'objective': 'CrossEntropy', 'colsample_bylevel': 0.07645464515514104, 'depth': 7, 'boosting_type': 'Plain', 'bootstrap_type': 'Bayesian', 'bagging_temperature': 9.022932463284778}. Best is trial 98 with value: 0.8791208791208791.
[32m[I 2023-04-21 02:25:54,855][39m Trial 2743 finished with value: 0.8539325842696629 and parameters: {'objective': 'CrossEntropy', 'colsample_bylevel': 0.07326011253386265, 'depth': 10, 'boosting_type': 'Plain', 'bootstrap_type': 'Bayesian', 'bagging_temperature': 9.570650344101189}. Best is trial 98 with value: 0.8791208791208791.
[32m[I 2023-04-21 02:25:59,488][39m Trial 2744 finished with value: 0.8 and parameters: {'objective': 'Logloss', 'colsample_bylevel': 0.07406959014995769, 'depth': 4, 'boosting_type': 'Ordered', 'bootstrap_type': 'MVS'}. Best is trial 98 with value: 0.8791208791208791.
[32m[I 2023-04-21 02:26:00,475][39m Trial 2745 finished with value: 0.8275862068965518 and parameters: {'objective': 'CrossEntropy', 'colsample_bylevel': 0.08166452377645843, 'depth': 10, 'boosting_type': 'Plain', 'bootstrap_type': 'Bayesian', 'bagging_temperature': 9.309258515175788}. Best is trial 98 with value: 0.8791208791208791.
[32m[I 2023-04-21 02:26:01,443][39m Trial 2746 finished with value: 0.8409090909090909 and parameters: {'objective': 'Logloss', 'colsample_bylevel': 0.07243979633495293, 'depth': 10, 'boosting_type': 'Plain', 'bootstrap_type': 'Bayesian', 'bagging_temperature': 8.917860026701138}. Best is trial 98 with value: 0.8791208791208791.
[32m[I 2023-04-21 02:26:02,454][39m Trial 2747 finished with value: 0.8539325842696629 and parameters: {'objective': 'CrossEntropy', 'colsample_bylevel': 0.06864827376715976, 'depth': 4, 'boosting_type': 'Plain', 'bootstrap_type': 'Bayesian', 'bagging_temperature': 9.649067648605142}. Best is trial 98 with value: 0.8791208791208791.
[32m[I 2023-04-21 02:26:03,391][39m Trial 2748 finished with value: 0.8666666666666666 and parameters: {'objective': 'Logloss', 'colsample_bylevel': 0.07150938285660727, 'depth': 4, 'boosting_type': 'Plain', 'bootstrap_type': 'Bayesian', 'bagging_temperature': 9.45130303099089}. Best is trial 98 with value: 0.8791208791208791.
[32m[I 2023-04-21 02:26:04,334][39m Trial 2749 finished with value: 0.8409090909090909 and parameters: {'objective': 'Logloss', 'colsample_bylevel': 0.07982032583036637, 'depth': 5, 'boosting_type': 'Plain', 'bootstrap_type': 'Bayesian', 'bagging_temperature': 9.030591566415529}. Best is trial 98 with value: 0.8791208791208791.
[32m[I 2023-04-21 02:26:05,068][39m Trial 2750 finished with value: 0.8666666666666666 and parameters: {'objective': 'CrossEntropy', 'colsample_bylevel': 0.07814503193054687, 'depth': 4, 'boosting_type': 'Plain', 'bootstrap_type': 'Bayesian', 'bagging_temperature': 9.699882943734995}. Best is trial 98 with value: 0.8791208791208791.
[32m[I 2023-04-21 02:26:05,698][39m Trial 2751 finished with value: 0.8666666666666666 and parameters: {'objective': 'CrossEntropy', 'colsample_bylevel': 0.08107850044571858, 'depth': 3, 'boosting_type': 'Plain', 'bootstrap_type': 'Bayesian', 'bagging_temperature': 9.430568644168117}. Best is trial 98 with value: 0.8791208791208791.
[32m[I 2023-04-21 02:26:06,702][39m Trial 2752 finished with value: 0.8275862068965518 and parameters: {'objective': 'Logloss', 'colsample_bylevel': 0.07322393417498768, 'depth': 10, 'boosting_type': 'Plain', 'bootstrap_type': 'Bayesian', 'bagging_temperature': 9.414105268532492}. Best is trial 98 with value: 0.8791208791208791.
[32m[I 2023-04-21 02:26:07,972][39m Trial 2753 finished with value: 0.8791208791208791 and parameters: {'objective': 'CrossEntropy', 'colsample_bylevel': 0.07541976586637418, 'depth': 10, 'boosting_type': 'Plain', 'bootstrap_type': 'Bayesian', 'bagging_temperature': 9.635998170635823}. Best is trial 98 with value: 0.8791208791208791.
[32m[I 2023-04-21 02:26:08,865][39m Trial 2754 finished with value: 0.8409090909090909 and parameters: {'objective': 'CrossEntropy', 'colsample_bylevel': 0.0880876535308897, 'depth': 2, 'boosting_type': 'Plain', 'bootstrap_type': 'MVS'}. Best is trial 98 with value: 0.8791208791208791.
[32m[I 2023-04-21 02:26:09,922][39m Trial 2755 finished with value: 0.8539325842696629 and parameters: {'objective': 'Logloss', 'colsample_bylevel': 0.07437400766371273, 'depth': 10, 'boosting_type': 'Plain', 'bootstrap_type': 'Bayesian', 'bagging_temperature': 9.134232253813568}. Best is trial 98 with value: 0.8791208791208791.
[32m[I 2023-04-21 02:26:10,923][39m Trial 2756 finished with value: 0.8409090909090909 and parameters: {'objective': 'Logloss', 'colsample_bylevel': 0.07104503919198464, 'depth': 3, 'boosting_type': 'Plain', 'bootstrap_type': 'Bayesian', 'bagging_temperature': 8.854009132166798}. Best is trial 98 with value: 0.8791208791208791.
[32m[I 2023-04-21 02:26:11,541][39m Trial 2757 finished with value: 0.8539325842696629 and parameters: {'objective': 'CrossEntropy', 'colsample_bylevel': 0.08025380126012285, 'depth': 3, 'boosting_type': 'Plain', 'bootstrap_type': 'Bayesian', 'bagging_temperature': 9.706542124173506}. Best is trial 98 with value: 0.8791208791208791.
[32m[I 2023-04-21 02:26:12,161][39m Trial 2758 finished with value: 0.8791208791208791 and parameters: {'objective': 'CrossEntropy', 'colsample_bylevel': 0.0807390868265819, 'depth': 3, 'boosting_type': 'Plain', 'bootstrap_type': 'Bayesian', 'bagging_temperature': 8.734826480834313}. Best is trial 98 with value: 0.8791208791208791.
[32m[I 2023-04-21 02:26:12,832][39m Trial 2759 finished with value: 0.8666666666666666 and parameters: {'objective': 'CrossEntropy', 'colsample_bylevel': 0.08748641363085763, 'depth': 3, 'boosting_type': 'Plain', 'bootstrap_type': 'Bayesian', 'bagging_temperature': 8.701387321719848}. Best is trial 98 with value: 0.8791208791208791.
[32m[I 2023-04-21 02:26:14,104][39m Trial 2760 finished with value: 0.8539325842696629 and parameters: {'objective': 'CrossEntropy', 'colsample_bylevel': 0.09032428268223934, 'depth': 2, 'boosting_type': 'Plain', 'bootstrap_type': 'Bayesian', 'bagging_temperature': 8.69215932583547}. Best is trial 98 with value: 0.8791208791208791.
[32m[I 2023-04-21 02:26:15,132][39m Trial 2761 finished with value: 0.8409090909090909 and parameters: {'objective': 'CrossEntropy', 'colsample_bylevel': 0.07779063953195797, 'depth': 8, 'boosting_type': 'Plain', 'bootstrap_type': 'Bayesian', 'bagging_temperature': 9.21061858246891}. Best is trial 98 with value: 0.8791208791208791.
[32m[I 2023-04-21 02:26:16,151][39m Trial 2762 finished with value: 0.8409090909090909 and parameters: {'objective': 'CrossEntropy', 'colsample_bylevel': 0.0776244933387861, 'depth': 12, 'boosting_type': 'Plain', 'bootstrap_type': 'Bayesian', 'bagging_temperature': 9.705783303307554}. Best is trial 98 with value: 0.8791208791208791.
[32m[I 2023-04-21 02:26:17,099][39m Trial 2763 finished with value: 0.8275862068965518 and parameters: {'objective': 'CrossEntropy', 'colsample_bylevel': 0.08283518197352994, 'depth': 10, 'boosting_type': 'Plain', 'bootstrap_type': 'Bayesian', 'bagging_temperature': 9.521502833575502}. Best is trial 98 with value: 0.8791208791208791.
[32m[I 2023-04-21 02:26:18,182][39m Trial 2764 finished with value: 0.8539325842696629 and parameters: {'objective': 'CrossEntropy', 'colsample_bylevel': 0.0768942215967993, 'depth': 10, 'boosting_type': 'Plain', 'bootstrap_type': 'Bayesian', 'bagging_temperature': 9.337321296646254}. Best is trial 98 with value: 0.8791208791208791.
[32m[I 2023-04-21 02:26:19,246][39m Trial 2765 finished with value: 0.8409090909090909 and parameters: {'objective': 'CrossEntropy', 'colsample_bylevel': 0.07332674233386106, 'depth': 11, 'boosting_type': 'Plain', 'bootstrap_type': 'Bernoulli', 'subsample': 0.7040145217693559}. Best is trial 98 with value: 0.8791208791208791.
[32m[I 2023-04-21 02:26:19,896][39m Trial 2766 finished with value: 0.8275862068965518 and parameters: {'objective': 'CrossEntropy', 'colsample_bylevel': 0.08169218318644675, 'depth': 10, 'boosting_type': 'Plain', 'bootstrap_type': 'Bayesian', 'bagging_temperature': 9.339136673670321}. Best is trial 98 with value: 0.8791208791208791.
[32m[I 2023-04-21 02:26:24,665][39m Trial 2767 finished with value: 0.8409090909090909 and parameters: {'objective': 'CrossEntropy', 'colsample_bylevel': 0.0752223364024824, 'depth': 10, 'boosting_type': 'Ordered', 'bootstrap_type': 'Bayesian', 'bagging_temperature': 9.66275331665845}. Best is trial 98 with value: 0.8791208791208791.
[32m[I 2023-04-21 02:26:26,280][39m Trial 2768 finished with value: 0.8409090909090909 and parameters: {'objective': 'CrossEntropy', 'colsample_bylevel': 0.07522078590730884, 'depth': 8, 'boosting_type': 'Plain', 'bootstrap_type': 'Bayesian', 'bagging_temperature': 9.755847574139036}. Best is trial 98 with value: 0.8791208791208791.
[32m[I 2023-04-21 02:26:27,188][39m Trial 2769 finished with value: 0.8666666666666666 and parameters: {'objective': 'CrossEntropy', 'colsample_bylevel': 0.0772810622725337, 'depth': 3, 'boosting_type': 'Plain', 'bootstrap_type': 'Bayesian', 'bagging_temperature': 9.851364561927712}. Best is trial 98 with value: 0.8791208791208791.
[32m[I 2023-04-21 02:26:28,072][39m Trial 2770 finished with value: 0.8409090909090909 and parameters: {'objective': 'CrossEntropy', 'colsample_bylevel': 0.07593782115052958, 'depth': 2, 'boosting_type': 'Plain', 'bootstrap_type': 'Bayesian', 'bagging_temperature': 9.180144389952957}. Best is trial 98 with value: 0.8791208791208791.
[32m[I 2023-04-21 02:26:28,761][39m Trial 2771 finished with value: 0.8539325842696629 and parameters: {'objective': 'Logloss', 'colsample_bylevel': 0.07901406772614958, 'depth': 5, 'boosting_type': 'Plain', 'bootstrap_type': 'Bayesian', 'bagging_temperature': 9.369339942579138}. Best is trial 98 with value: 0.8791208791208791.
[32m[I 2023-04-21 02:26:29,370][39m Trial 2772 finished with value: 0.8666666666666666 and parameters: {'objective': 'CrossEntropy', 'colsample_bylevel': 0.07153401818743185, 'depth': 3, 'boosting_type': 'Plain', 'bootstrap_type': 'Bayesian', 'bagging_temperature': 8.43024429690989}. Best is trial 98 with value: 0.8791208791208791.
[32m[I 2023-04-21 02:26:30,300][39m Trial 2773 finished with value: 0.8139534883720929 and parameters: {'objective': 'Logloss', 'colsample_bylevel': 0.0795628458541149, 'depth': 10, 'boosting_type': 'Plain', 'bootstrap_type': 'Bayesian', 'bagging_temperature': 9.996468606095643}. Best is trial 98 with value: 0.8791208791208791.
[32m[I 2023-04-21 02:26:31,534][39m Trial 2774 finished with value: 0.8409090909090909 and parameters: {'objective': 'CrossEntropy', 'colsample_bylevel': 0.07305906934543856, 'depth': 10, 'boosting_type': 'Plain', 'bootstrap_type': 'Bayesian', 'bagging_temperature': 9.514229166751653}. Best is trial 98 with value: 0.8791208791208791.
