[32m[I 2023-04-21 03:03:11,946][39m Trial 4609 finished with value: 0.8539325842696629 and parameters: {'objective': 'CrossEntropy', 'colsample_bylevel': 0.07815700945368935, 'depth': 12, 'boosting_type': 'Plain', 'bootstrap_type': 'Bayesian', 'bagging_temperature': 9.786183261538916}. Best is trial 3065 with value: 0.8863636363636364.
[32m[I 2023-04-21 03:03:12,746][39m Trial 4610 finished with value: 0.8791208791208791 and parameters: {'objective': 'CrossEntropy', 'colsample_bylevel': 0.06973822131892049, 'depth': 9, 'boosting_type': 'Plain', 'bootstrap_type': 'Bayesian', 'bagging_temperature': 9.99110853119308}. Best is trial 3065 with value: 0.8863636363636364.
[32m[I 2023-04-21 03:03:13,578][39m Trial 4611 finished with value: 0.8539325842696629 and parameters: {'objective': 'CrossEntropy', 'colsample_bylevel': 0.08398252351387268, 'depth': 4, 'boosting_type': 'Plain', 'bootstrap_type': 'Bayesian', 'bagging_temperature': 9.779930727232758}. Best is trial 3065 with value: 0.8863636363636364.
[32m[I 2023-04-21 03:03:14,391][39m Trial 4612 finished with value: 0.8275862068965518 and parameters: {'objective': 'Logloss', 'colsample_bylevel': 0.0718020931984349, 'depth': 5, 'boosting_type': 'Plain', 'bootstrap_type': 'MVS'}. Best is trial 3065 with value: 0.8863636363636364.
[32m[I 2023-04-21 03:03:15,547][39m Trial 4613 finished with value: 0.8539325842696629 and parameters: {'objective': 'CrossEntropy', 'colsample_bylevel': 0.09235381113339954, 'depth': 3, 'boosting_type': 'Plain', 'bootstrap_type': 'Bayesian', 'bagging_temperature': 8.248567592322155}. Best is trial 3065 with value: 0.8863636363636364.
[32m[I 2023-04-21 03:03:16,881][39m Trial 4614 finished with value: 0.8275862068965518 and parameters: {'objective': 'CrossEntropy', 'colsample_bylevel': 0.0784440183680632, 'depth': 9, 'boosting_type': 'Plain', 'bootstrap_type': 'Bernoulli', 'subsample': 0.9563351157640738}. Best is trial 3065 with value: 0.8863636363636364.
[32m[I 2023-04-21 03:03:18,196][39m Trial 4615 finished with value: 0.8666666666666666 and parameters: {'objective': 'Logloss', 'colsample_bylevel': 0.08192388407883626, 'depth': 3, 'boosting_type': 'Plain', 'bootstrap_type': 'Bayesian', 'bagging_temperature': 9.14683353922466}. Best is trial 3065 with value: 0.8863636363636364.
[32m[I 2023-04-21 03:03:18,895][39m Trial 4616 finished with value: 0.8409090909090909 and parameters: {'objective': 'CrossEntropy', 'colsample_bylevel': 0.09063116566571681, 'depth': 3, 'boosting_type': 'Plain', 'bootstrap_type': 'Bayesian', 'bagging_temperature': 9.83563852369898}. Best is trial 3065 with value: 0.8863636363636364.
[32m[I 2023-04-21 03:03:19,555][39m Trial 4617 finished with value: 0.8539325842696629 and parameters: {'objective': 'Logloss', 'colsample_bylevel': 0.07584062270236976, 'depth': 10, 'boosting_type': 'Plain', 'bootstrap_type': 'Bayesian', 'bagging_temperature': 8.775434862562069}. Best is trial 3065 with value: 0.8863636363636364.
[32m[I 2023-04-21 03:03:20,224][39m Trial 4618 finished with value: 0.8275862068965518 and parameters: {'objective': 'CrossEntropy', 'colsample_bylevel': 0.08010505743080668, 'depth': 5, 'boosting_type': 'Plain', 'bootstrap_type': 'Bayesian', 'bagging_temperature': 8.247051105130963}. Best is trial 3065 with value: 0.8863636363636364.
[32m[I 2023-04-21 03:03:21,874][39m Trial 4619 finished with value: 0.8539325842696629 and parameters: {'objective': 'CrossEntropy', 'colsample_bylevel': 0.04155634205661435, 'depth': 10, 'boosting_type': 'Plain', 'bootstrap_type': 'Bayesian', 'bagging_temperature': 9.137076959165347}. Best is trial 3065 with value: 0.8863636363636364.
[32m[I 2023-04-21 03:03:22,836][39m Trial 4620 finished with value: 0.8505747126436782 and parameters: {'objective': 'CrossEntropy', 'colsample_bylevel': 0.07305298884030448, 'depth': 10, 'boosting_type': 'Plain', 'bootstrap_type': 'Bayesian', 'bagging_temperature': 9.025116321060557}. Best is trial 3065 with value: 0.8863636363636364.
[32m[I 2023-04-21 03:03:23,850][39m Trial 4621 finished with value: 0.8539325842696629 and parameters: {'objective': 'CrossEntropy', 'colsample_bylevel': 0.0813948984826712, 'depth': 12, 'boosting_type': 'Plain', 'bootstrap_type': 'Bayesian', 'bagging_temperature': 8.983107063009225}. Best is trial 3065 with value: 0.8863636363636364.
[32m[I 2023-04-21 03:03:25,084][39m Trial 4622 finished with value: 0.8409090909090909 and parameters: {'objective': 'CrossEntropy', 'colsample_bylevel': 0.07985088069199306, 'depth': 10, 'boosting_type': 'Plain', 'bootstrap_type': 'Bayesian', 'bagging_temperature': 8.917473944166971}. Best is trial 3065 with value: 0.8863636363636364.
[32m[I 2023-04-21 03:03:30,438][39m Trial 4623 finished with value: 0.8409090909090909 and parameters: {'objective': 'Logloss', 'colsample_bylevel': 0.08537346761882873, 'depth': 5, 'boosting_type': 'Ordered', 'bootstrap_type': 'Bayesian', 'bagging_temperature': 9.335032887039933}. Best is trial 3065 with value: 0.8863636363636364.
[32m[I 2023-04-21 03:03:31,494][39m Trial 4624 finished with value: 0.8409090909090909 and parameters: {'objective': 'Logloss', 'colsample_bylevel': 0.08450936209064042, 'depth': 5, 'boosting_type': 'Plain', 'bootstrap_type': 'Bayesian', 'bagging_temperature': 9.322436067115735}. Best is trial 3065 with value: 0.8863636363636364.
[32m[I 2023-04-21 03:03:32,742][39m Trial 4625 finished with value: 0.8409090909090909 and parameters: {'objective': 'CrossEntropy', 'colsample_bylevel': 0.08213182617917238, 'depth': 10, 'boosting_type': 'Plain', 'bootstrap_type': 'Bayesian', 'bagging_temperature': 9.491814852995356}. Best is trial 3065 with value: 0.8863636363636364.
[32m[I 2023-04-21 03:03:33,781][39m Trial 4626 finished with value: 0.8181818181818182 and parameters: {'objective': 'CrossEntropy', 'colsample_bylevel': 0.06622139607733803, 'depth': 3, 'boosting_type': 'Plain', 'bootstrap_type': 'MVS'}. Best is trial 3065 with value: 0.8863636363636364.
[32m[I 2023-04-21 03:03:34,491][39m Trial 4627 finished with value: 0.8275862068965518 and parameters: {'objective': 'CrossEntropy', 'colsample_bylevel': 0.07674949312137508, 'depth': 10, 'boosting_type': 'Plain', 'bootstrap_type': 'Bayesian', 'bagging_temperature': 9.58554913523109}. Best is trial 3065 with value: 0.8863636363636364.
[32m[I 2023-04-21 03:03:35,222][39m Trial 4628 finished with value: 0.8539325842696629 and parameters: {'objective': 'CrossEntropy', 'colsample_bylevel': 0.08262052238735969, 'depth': 3, 'boosting_type': 'Plain', 'bootstrap_type': 'Bayesian', 'bagging_temperature': 9.093058896675823}. Best is trial 3065 with value: 0.8863636363636364.
[32m[I 2023-04-21 03:03:36,199][39m Trial 4629 finished with value: 0.8275862068965518 and parameters: {'objective': 'CrossEntropy', 'colsample_bylevel': 0.0756791363463509, 'depth': 4, 'boosting_type': 'Plain', 'bootstrap_type': 'Bayesian', 'bagging_temperature': 9.36284204837447}. Best is trial 3065 with value: 0.8863636363636364.
[32m[I 2023-04-21 03:03:37,832][39m Trial 4630 finished with value: 0.8409090909090909 and parameters: {'objective': 'CrossEntropy', 'colsample_bylevel': 0.07091673806498942, 'depth': 10, 'boosting_type': 'Plain', 'bootstrap_type': 'Bayesian', 'bagging_temperature': 9.159629086448588}. Best is trial 3065 with value: 0.8863636363636364.
[32m[I 2023-04-21 03:03:38,872][39m Trial 4631 finished with value: 0.8409090909090909 and parameters: {'objective': 'CrossEntropy', 'colsample_bylevel': 0.09063134677185218, 'depth': 3, 'boosting_type': 'Plain', 'bootstrap_type': 'Bayesian', 'bagging_temperature': 9.978306761958937}. Best is trial 3065 with value: 0.8863636363636364.
[32m[I 2023-04-21 03:03:39,924][39m Trial 4632 finished with value: 0.8539325842696629 and parameters: {'objective': 'CrossEntropy', 'colsample_bylevel': 0.08996126257359578, 'depth': 3, 'boosting_type': 'Plain', 'bootstrap_type': 'Bayesian', 'bagging_temperature': 9.984177817747886}. Best is trial 3065 with value: 0.8863636363636364.
[32m[I 2023-04-21 03:03:41,075][39m Trial 4633 finished with value: 0.8666666666666666 and parameters: {'objective': 'Logloss', 'colsample_bylevel': 0.09350106121468428, 'depth': 4, 'boosting_type': 'Plain', 'bootstrap_type': 'Bayesian', 'bagging_temperature': 9.583451043690687}. Best is trial 3065 with value: 0.8863636363636364.
[32m[I 2023-04-21 03:03:41,793][39m Trial 4634 finished with value: 0.8539325842696629 and parameters: {'objective': 'Logloss', 'colsample_bylevel': 0.07270375041051935, 'depth': 5, 'boosting_type': 'Plain', 'bootstrap_type': 'Bayesian', 'bagging_temperature': 8.857510095162606}. Best is trial 3065 with value: 0.8863636363636364.
[32m[I 2023-04-21 03:03:42,472][39m Trial 4635 finished with value: 0.8409090909090909 and parameters: {'objective': 'CrossEntropy', 'colsample_bylevel': 0.06722897481266309, 'depth': 10, 'boosting_type': 'Plain', 'bootstrap_type': 'Bernoulli', 'subsample': 0.6881442361881517}. Best is trial 3065 with value: 0.8863636363636364.
[32m[I 2023-04-21 03:03:43,489][39m Trial 4636 finished with value: 0.8666666666666666 and parameters: {'objective': 'CrossEntropy', 'colsample_bylevel': 0.07305783087183397, 'depth': 4, 'boosting_type': 'Plain', 'bootstrap_type': 'Bayesian', 'bagging_temperature': 9.982236070144289}. Best is trial 3065 with value: 0.8863636363636364.
[32m[I 2023-04-21 03:03:44,788][39m Trial 4637 finished with value: 0.8372093023255814 and parameters: {'objective': 'CrossEntropy', 'colsample_bylevel': 0.08337923428488016, 'depth': 10, 'boosting_type': 'Plain', 'bootstrap_type': 'Bayesian', 'bagging_temperature': 9.025548927720715}. Best is trial 3065 with value: 0.8863636363636364.
[32m[I 2023-04-21 03:03:45,998][39m Trial 4638 finished with value: 0.8409090909090909 and parameters: {'objective': 'Logloss', 'colsample_bylevel': 0.0831534812598082, 'depth': 5, 'boosting_type': 'Plain', 'bootstrap_type': 'Bayesian', 'bagging_temperature': 9.14460744937966}. Best is trial 3065 with value: 0.8863636363636364.
[32m[I 2023-04-21 03:03:46,717][39m Trial 4639 finished with value: 0.8539325842696629 and parameters: {'objective': 'Logloss', 'colsample_bylevel': 0.07325828082944656, 'depth': 5, 'boosting_type': 'Plain', 'bootstrap_type': 'Bayesian', 'bagging_temperature': 9.222237524175785}. Best is trial 3065 with value: 0.8863636363636364.
[32m[I 2023-04-21 03:03:47,862][39m Trial 4640 finished with value: 0.8539325842696629 and parameters: {'objective': 'Logloss', 'colsample_bylevel': 0.07298232947280703, 'depth': 5, 'boosting_type': 'Plain', 'bootstrap_type': 'Bayesian', 'bagging_temperature': 9.244331753947254}. Best is trial 3065 with value: 0.8863636363636364.
[32m[I 2023-04-21 03:03:48,572][39m Trial 4641 finished with value: 0.8275862068965518 and parameters: {'objective': 'CrossEntropy', 'colsample_bylevel': 0.08128134332349728, 'depth': 4, 'boosting_type': 'Plain', 'bootstrap_type': 'Bayesian', 'bagging_temperature': 8.90956432384625}. Best is trial 3065 with value: 0.8863636363636364.
[32m[I 2023-04-21 03:03:49,522][39m Trial 4642 finished with value: 0.8275862068965518 and parameters: {'objective': 'Logloss', 'colsample_bylevel': 0.07804627786878515, 'depth': 10, 'boosting_type': 'Plain', 'bootstrap_type': 'Bayesian', 'bagging_temperature': 9.494107002616591}. Best is trial 3065 with value: 0.8863636363636364.
[32m[I 2023-04-21 03:03:54,225][39m Trial 4643 finished with value: 0.8131868131868132 and parameters: {'objective': 'CrossEntropy', 'colsample_bylevel': 0.0641655197542721, 'depth': 10, 'boosting_type': 'Ordered', 'bootstrap_type': 'MVS'}. Best is trial 3065 with value: 0.8863636363636364.
[32m[I 2023-04-21 03:03:55,575][39m Trial 4644 finished with value: 0.8275862068965518 and parameters: {'objective': 'CrossEntropy', 'colsample_bylevel': 0.0755725882003978, 'depth': 10, 'boosting_type': 'Plain', 'bootstrap_type': 'Bayesian', 'bagging_temperature': 7.910277736301587}. Best is trial 3065 with value: 0.8863636363636364.
[32m[I 2023-04-21 03:03:56,628][39m Trial 4645 finished with value: 0.7999999999999999 and parameters: {'objective': 'CrossEntropy', 'colsample_bylevel': 0.025731107657344914, 'depth': 4, 'boosting_type': 'Plain', 'bootstrap_type': 'Bayesian', 'bagging_temperature': 8.704134498042466}. Best is trial 3065 with value: 0.8863636363636364.
[32m[I 2023-04-21 03:03:57,671][39m Trial 4646 finished with value: 0.8666666666666666 and parameters: {'objective': 'CrossEntropy', 'colsample_bylevel': 0.08296781648190628, 'depth': 3, 'boosting_type': 'Plain', 'bootstrap_type': 'Bayesian', 'bagging_temperature': 8.897495628114989}. Best is trial 3065 with value: 0.8863636363636364.
[32m[I 2023-04-21 03:03:58,649][39m Trial 4647 finished with value: 0.8666666666666666 and parameters: {'objective': 'CrossEntropy', 'colsample_bylevel': 0.07547314963444385, 'depth': 10, 'boosting_type': 'Plain', 'bootstrap_type': 'Bayesian', 'bagging_temperature': 9.498305336311233}. Best is trial 3065 with value: 0.8863636363636364.
[32m[I 2023-04-21 03:03:59,903][39m Trial 4648 finished with value: 0.8275862068965518 and parameters: {'objective': 'CrossEntropy', 'colsample_bylevel': 0.07746739820684326, 'depth': 10, 'boosting_type': 'Plain', 'bootstrap_type': 'Bayesian', 'bagging_temperature': 9.534239079912437}. Best is trial 3065 with value: 0.8863636363636364.
[32m[I 2023-04-21 03:04:00,775][39m Trial 4649 finished with value: 0.8409090909090909 and parameters: {'objective': 'Logloss', 'colsample_bylevel': 0.07657253940461757, 'depth': 6, 'boosting_type': 'Plain', 'bootstrap_type': 'MVS'}. Best is trial 3065 with value: 0.8863636363636364.
[32m[I 2023-04-21 03:04:01,814][39m Trial 4650 finished with value: 0.8409090909090909 and parameters: {'objective': 'CrossEntropy', 'colsample_bylevel': 0.06476656284216216, 'depth': 3, 'boosting_type': 'Plain', 'bootstrap_type': 'Bayesian', 'bagging_temperature': 9.559247900834526}. Best is trial 3065 with value: 0.8863636363636364.
[32m[I 2023-04-21 03:04:02,895][39m Trial 4651 finished with value: 0.8539325842696629 and parameters: {'objective': 'CrossEntropy', 'colsample_bylevel': 0.07443828179750106, 'depth': 9, 'boosting_type': 'Plain', 'bootstrap_type': 'Bayesian', 'bagging_temperature': 9.72840255256225}. Best is trial 3065 with value: 0.8863636363636364.
[32m[I 2023-04-21 03:04:03,804][39m Trial 4652 finished with value: 0.8539325842696629 and parameters: {'objective': 'CrossEntropy', 'colsample_bylevel': 0.06636694488215253, 'depth': 4, 'boosting_type': 'Plain', 'bootstrap_type': 'Bayesian', 'bagging_temperature': 6.135735296198545}. Best is trial 3065 with value: 0.8863636363636364.
[32m[I 2023-04-21 03:04:04,575][39m Trial 4653 finished with value: 0.8275862068965518 and parameters: {'objective': 'Logloss', 'colsample_bylevel': 0.08412593603948004, 'depth': 5, 'boosting_type': 'Plain', 'bootstrap_type': 'Bayesian', 'bagging_temperature': 8.989813699051291}. Best is trial 3065 with value: 0.8863636363636364.
[32m[I 2023-04-21 03:04:05,615][39m Trial 4654 finished with value: 0.8539325842696629 and parameters: {'objective': 'CrossEntropy', 'colsample_bylevel': 0.07829654516716815, 'depth': 10, 'boosting_type': 'Plain', 'bootstrap_type': 'Bayesian', 'bagging_temperature': 9.465613525716702}. Best is trial 3065 with value: 0.8863636363636364.
[32m[I 2023-04-21 03:04:06,628][39m Trial 4655 finished with value: 0.8666666666666666 and parameters: {'objective': 'CrossEntropy', 'colsample_bylevel': 0.07967681977488501, 'depth': 3, 'boosting_type': 'Plain', 'bootstrap_type': 'Bayesian', 'bagging_temperature': 9.293903966475218}. Best is trial 3065 with value: 0.8863636363636364.
[32m[I 2023-04-21 03:04:07,617][39m Trial 4656 finished with value: 0.8139534883720929 and parameters: {'objective': 'CrossEntropy', 'colsample_bylevel': 0.07467849330252135, 'depth': 3, 'boosting_type': 'Plain', 'bootstrap_type': 'Bernoulli', 'subsample': 0.5052273093198211}. Best is trial 3065 with value: 0.8863636363636364.
[32m[I 2023-04-21 03:04:08,431][39m Trial 4657 finished with value: 0.8636363636363636 and parameters: {'objective': 'CrossEntropy', 'colsample_bylevel': 0.0756930811652721, 'depth': 10, 'boosting_type': 'Plain', 'bootstrap_type': 'Bayesian', 'bagging_temperature': 9.518883800427355}. Best is trial 3065 with value: 0.8863636363636364.
[32m[I 2023-04-21 03:04:09,501][39m Trial 4658 finished with value: 0.8539325842696629 and parameters: {'objective': 'CrossEntropy', 'colsample_bylevel': 0.07751536953804566, 'depth': 2, 'boosting_type': 'Plain', 'bootstrap_type': 'Bayesian', 'bagging_temperature': 9.80573246003843}. Best is trial 3065 with value: 0.8863636363636364.
[32m[I 2023-04-21 03:04:11,011][39m Trial 4659 finished with value: 0.8539325842696629 and parameters: {'objective': 'CrossEntropy', 'colsample_bylevel': 0.08125542440695115, 'depth': 10, 'boosting_type': 'Plain', 'bootstrap_type': 'Bayesian', 'bagging_temperature': 9.18525136828096}. Best is trial 3065 with value: 0.8863636363636364.
[32m[I 2023-04-21 03:04:12,033][39m Trial 4660 finished with value: 0.8791208791208791 and parameters: {'objective': 'CrossEntropy', 'colsample_bylevel': 0.0916283981364316, 'depth': 3, 'boosting_type': 'Plain', 'bootstrap_type': 'Bayesian', 'bagging_temperature': 9.987843509643023}. Best is trial 3065 with value: 0.8863636363636364.
[32m[I 2023-04-21 03:04:17,122][39m Trial 4661 finished with value: 0.8539325842696629 and parameters: {'objective': 'CrossEntropy', 'colsample_bylevel': 0.08066553985170308, 'depth': 4, 'boosting_type': 'Ordered', 'bootstrap_type': 'Bayesian', 'bagging_temperature': 9.648234879795723}. Best is trial 3065 with value: 0.8863636363636364.
[32m[I 2023-04-21 03:04:18,413][39m Trial 4662 finished with value: 0.8275862068965518 and parameters: {'objective': 'CrossEntropy', 'colsample_bylevel': 0.0784103366745255, 'depth': 11, 'boosting_type': 'Plain', 'bootstrap_type': 'Bayesian', 'bagging_temperature': 8.89732613919514}. Best is trial 3065 with value: 0.8863636363636364.
[32m[I 2023-04-21 03:04:19,495][39m Trial 4663 finished with value: 0.8636363636363636 and parameters: {'objective': 'CrossEntropy', 'colsample_bylevel': 0.044127449393443166, 'depth': 4, 'boosting_type': 'Plain', 'bootstrap_type': 'Bayesian', 'bagging_temperature': 9.411525360733242}. Best is trial 3065 with value: 0.8863636363636364.
[32m[I 2023-04-21 03:04:20,223][39m Trial 4664 finished with value: 0.8275862068965518 and parameters: {'objective': 'CrossEntropy', 'colsample_bylevel': 0.08551294830284348, 'depth': 3, 'boosting_type': 'Plain', 'bootstrap_type': 'Bayesian', 'bagging_temperature': 9.083538351963407}. Best is trial 3065 with value: 0.8863636363636364.
[32m[I 2023-04-21 03:04:21,662][39m Trial 4665 finished with value: 0.8539325842696629 and parameters: {'objective': 'CrossEntropy', 'colsample_bylevel': 0.077812232267468, 'depth': 10, 'boosting_type': 'Plain', 'bootstrap_type': 'Bayesian', 'bagging_temperature': 9.414291562660376}. Best is trial 3065 with value: 0.8863636363636364.
[32m[I 2023-04-21 03:04:22,371][39m Trial 4666 finished with value: 0.8409090909090909 and parameters: {'objective': 'CrossEntropy', 'colsample_bylevel': 0.0786867309755381, 'depth': 3, 'boosting_type': 'Plain', 'bootstrap_type': 'MVS'}. Best is trial 3065 with value: 0.8863636363636364.
[32m[I 2023-04-21 03:04:23,031][39m Trial 4667 finished with value: 0.8666666666666666 and parameters: {'objective': 'CrossEntropy', 'colsample_bylevel': 0.08181150011613932, 'depth': 2, 'boosting_type': 'Plain', 'bootstrap_type': 'Bayesian', 'bagging_temperature': 9.2209313695737}. Best is trial 3065 with value: 0.8863636363636364.
[32m[I 2023-04-21 03:04:24,261][39m Trial 4668 finished with value: 0.8409090909090909 and parameters: {'objective': 'CrossEntropy', 'colsample_bylevel': 0.07554676639962145, 'depth': 10, 'boosting_type': 'Plain', 'bootstrap_type': 'Bayesian', 'bagging_temperature': 9.99960090385649}. Best is trial 3065 with value: 0.8863636363636364.
[32m[I 2023-04-21 03:04:25,499][39m Trial 4669 finished with value: 0.8539325842696629 and parameters: {'objective': 'CrossEntropy', 'colsample_bylevel': 0.08724282225003308, 'depth': 3, 'boosting_type': 'Plain', 'bootstrap_type': 'Bayesian', 'bagging_temperature': 9.868054270825866}. Best is trial 3065 with value: 0.8863636363636364.
[32m[I 2023-04-21 03:04:26,784][39m Trial 4670 finished with value: 0.8539325842696629 and parameters: {'objective': 'CrossEntropy', 'colsample_bylevel': 0.08837822677832002, 'depth': 3, 'boosting_type': 'Plain', 'bootstrap_type': 'Bayesian', 'bagging_temperature': 9.775409903949189}. Best is trial 3065 with value: 0.8863636363636364.
[32m[I 2023-04-21 03:04:27,611][39m Trial 4671 finished with value: 0.8666666666666666 and parameters: {'objective': 'CrossEntropy', 'colsample_bylevel': 0.08296695978331707, 'depth': 3, 'boosting_type': 'Plain', 'bootstrap_type': 'Bayesian', 'bagging_temperature': 8.893061218782162}. Best is trial 3065 with value: 0.8863636363636364.
[32m[I 2023-04-21 03:04:28,494][39m Trial 4672 finished with value: 0.8666666666666666 and parameters: {'objective': 'CrossEntropy', 'colsample_bylevel': 0.0710513458074518, 'depth': 11, 'boosting_type': 'Plain', 'bootstrap_type': 'Bayesian', 'bagging_temperature': 9.678708172939269}. Best is trial 3065 with value: 0.8863636363636364.
[32m[I 2023-04-21 03:04:29,479][39m Trial 4673 finished with value: 0.8539325842696629 and parameters: {'objective': 'Logloss', 'colsample_bylevel': 0.0692352851937293, 'depth': 10, 'boosting_type': 'Plain', 'bootstrap_type': 'Bayesian', 'bagging_temperature': 8.994158183484515}. Best is trial 3065 with value: 0.8863636363636364.
