[32m[I 2023-04-21 02:01:36,244][39m Trial 1455 finished with value: 0.8409090909090909 and parameters: {'objective': 'CrossEntropy', 'colsample_bylevel': 0.08365345222217234, 'depth': 9, 'boosting_type': 'Plain', 'bootstrap_type': 'Bayesian', 'bagging_temperature': 9.324145698722365}. Best is trial 98 with value: 0.8791208791208791.
[32m[I 2023-04-21 02:01:36,887][39m Trial 1456 finished with value: 0.8505747126436782 and parameters: {'objective': 'CrossEntropy', 'colsample_bylevel': 0.09415831843888608, 'depth': 8, 'boosting_type': 'Plain', 'bootstrap_type': 'Bayesian', 'bagging_temperature': 2.2874373089149502}. Best is trial 98 with value: 0.8791208791208791.
[32m[I 2023-04-21 02:01:37,631][39m Trial 1457 finished with value: 0.8409090909090909 and parameters: {'objective': 'CrossEntropy', 'colsample_bylevel': 0.08229897484374442, 'depth': 11, 'boosting_type': 'Plain', 'bootstrap_type': 'Bayesian', 'bagging_temperature': 9.251788238944782}. Best is trial 98 with value: 0.8791208791208791.
[32m[I 2023-04-21 02:01:38,573][39m Trial 1458 finished with value: 0.8409090909090909 and parameters: {'objective': 'CrossEntropy', 'colsample_bylevel': 0.08285087778633073, 'depth': 5, 'boosting_type': 'Plain', 'bootstrap_type': 'Bayesian', 'bagging_temperature': 9.204010243519724}. Best is trial 98 with value: 0.8791208791208791.
[32m[I 2023-04-21 02:01:39,270][39m Trial 1459 finished with value: 0.8409090909090909 and parameters: {'objective': 'CrossEntropy', 'colsample_bylevel': 0.07851100066553143, 'depth': 10, 'boosting_type': 'Plain', 'bootstrap_type': 'Bayesian', 'bagging_temperature': 9.993987936151587}. Best is trial 98 with value: 0.8791208791208791.
[32m[I 2023-04-21 02:01:40,452][39m Trial 1460 finished with value: 0.8539325842696629 and parameters: {'objective': 'CrossEntropy', 'colsample_bylevel': 0.07659426686720615, 'depth': 3, 'boosting_type': 'Plain', 'bootstrap_type': 'Bayesian', 'bagging_temperature': 9.846022774147087}. Best is trial 98 with value: 0.8791208791208791.
[32m[I 2023-04-21 02:01:41,303][39m Trial 1461 finished with value: 0.8666666666666666 and parameters: {'objective': 'CrossEntropy', 'colsample_bylevel': 0.07861790760483907, 'depth': 3, 'boosting_type': 'Plain', 'bootstrap_type': 'Bayesian', 'bagging_temperature': 9.736650621135434}. Best is trial 98 with value: 0.8791208791208791.
[32m[I 2023-04-21 02:01:42,530][39m Trial 1462 finished with value: 0.8314606741573034 and parameters: {'objective': 'CrossEntropy', 'colsample_bylevel': 0.08114247072258632, 'depth': 7, 'boosting_type': 'Plain', 'bootstrap_type': 'Bayesian', 'bagging_temperature': 8.759694756746043}. Best is trial 98 with value: 0.8791208791208791.
[32m[I 2023-04-21 02:01:43,222][39m Trial 1463 finished with value: 0.8409090909090909 and parameters: {'objective': 'CrossEntropy', 'colsample_bylevel': 0.08014096465468903, 'depth': 3, 'boosting_type': 'Plain', 'bootstrap_type': 'Bayesian', 'bagging_temperature': 5.9570961782343606}. Best is trial 98 with value: 0.8791208791208791.
[32m[I 2023-04-21 02:01:47,859][39m Trial 1464 finished with value: 0.8539325842696629 and parameters: {'objective': 'CrossEntropy', 'colsample_bylevel': 0.08944145551146909, 'depth': 3, 'boosting_type': 'Ordered', 'bootstrap_type': 'Bayesian', 'bagging_temperature': 8.449343434557006}. Best is trial 98 with value: 0.8791208791208791.
[32m[I 2023-04-21 02:01:48,999][39m Trial 1465 finished with value: 0.8181818181818182 and parameters: {'objective': 'CrossEntropy', 'colsample_bylevel': 0.09221606140228251, 'depth': 3, 'boosting_type': 'Plain', 'bootstrap_type': 'MVS'}. Best is trial 98 with value: 0.8791208791208791.
[32m[I 2023-04-21 02:01:49,864][39m Trial 1466 finished with value: 0.8539325842696629 and parameters: {'objective': 'CrossEntropy', 'colsample_bylevel': 0.07776960656903606, 'depth': 3, 'boosting_type': 'Plain', 'bootstrap_type': 'Bayesian', 'bagging_temperature': 9.41369979201471}. Best is trial 98 with value: 0.8791208791208791.
[32m[I 2023-04-21 02:01:50,778][39m Trial 1467 finished with value: 0.8539325842696629 and parameters: {'objective': 'CrossEntropy', 'colsample_bylevel': 0.07725480485945983, 'depth': 4, 'boosting_type': 'Plain', 'bootstrap_type': 'Bayesian', 'bagging_temperature': 8.962266909465395}. Best is trial 98 with value: 0.8791208791208791.
[32m[I 2023-04-21 02:01:51,437][39m Trial 1468 finished with value: 0.8539325842696629 and parameters: {'objective': 'CrossEntropy', 'colsample_bylevel': 0.07485955337832106, 'depth': 4, 'boosting_type': 'Plain', 'bootstrap_type': 'Bayesian', 'bagging_temperature': 8.65979787166961}. Best is trial 98 with value: 0.8791208791208791.
[32m[I 2023-04-21 02:01:52,289][39m Trial 1469 finished with value: 0.8539325842696629 and parameters: {'objective': 'CrossEntropy', 'colsample_bylevel': 0.08602169318695889, 'depth': 11, 'boosting_type': 'Plain', 'bootstrap_type': 'Bayesian', 'bagging_temperature': 9.114025588736924}. Best is trial 98 with value: 0.8791208791208791.
[32m[I 2023-04-21 02:01:53,184][39m Trial 1470 finished with value: 0.8505747126436782 and parameters: {'objective': 'CrossEntropy', 'colsample_bylevel': 0.0792565273147707, 'depth': 5, 'boosting_type': 'Plain', 'bootstrap_type': 'Bayesian', 'bagging_temperature': 8.356873466799104}. Best is trial 98 with value: 0.8791208791208791.
[32m[I 2023-04-21 02:01:53,964][39m Trial 1471 finished with value: 0.8666666666666666 and parameters: {'objective': 'CrossEntropy', 'colsample_bylevel': 0.07957494333817654, 'depth': 3, 'boosting_type': 'Plain', 'bootstrap_type': 'Bayesian', 'bagging_temperature': 9.520729459890376}. Best is trial 98 with value: 0.8791208791208791.
[32m[I 2023-04-21 02:01:55,049][39m Trial 1472 finished with value: 0.8275862068965518 and parameters: {'objective': 'CrossEntropy', 'colsample_bylevel': 0.09227776141766465, 'depth': 3, 'boosting_type': 'Plain', 'bootstrap_type': 'Bayesian', 'bagging_temperature': 8.425315952508234}. Best is trial 98 with value: 0.8791208791208791.
[32m[I 2023-04-21 02:01:56,069][39m Trial 1473 finished with value: 0.8409090909090909 and parameters: {'objective': 'CrossEntropy', 'colsample_bylevel': 0.08205255710593451, 'depth': 4, 'boosting_type': 'Plain', 'bootstrap_type': 'Bayesian', 'bagging_temperature': 9.08024908424906}. Best is trial 98 with value: 0.8791208791208791.
[32m[I 2023-04-21 02:01:57,018][39m Trial 1474 finished with value: 0.8539325842696629 and parameters: {'objective': 'CrossEntropy', 'colsample_bylevel': 0.08471604448892293, 'depth': 3, 'boosting_type': 'Plain', 'bootstrap_type': 'Bernoulli', 'subsample': 0.3599987778193169}. Best is trial 98 with value: 0.8791208791208791.
[32m[I 2023-04-21 02:01:57,637][39m Trial 1475 finished with value: 0.8409090909090909 and parameters: {'objective': 'Logloss', 'colsample_bylevel': 0.08894013984674629, 'depth': 4, 'boosting_type': 'Plain', 'bootstrap_type': 'Bayesian', 'bagging_temperature': 9.645477145341363}. Best is trial 98 with value: 0.8791208791208791.
[32m[I 2023-04-21 02:01:58,323][39m Trial 1476 finished with value: 0.8409090909090909 and parameters: {'objective': 'CrossEntropy', 'colsample_bylevel': 0.08488870699116713, 'depth': 5, 'boosting_type': 'Plain', 'bootstrap_type': 'Bayesian', 'bagging_temperature': 9.589068553532957}. Best is trial 98 with value: 0.8791208791208791.
[32m[I 2023-04-21 02:01:59,259][39m Trial 1477 finished with value: 0.8539325842696629 and parameters: {'objective': 'Logloss', 'colsample_bylevel': 0.074682493629831, 'depth': 4, 'boosting_type': 'Plain', 'bootstrap_type': 'Bayesian', 'bagging_temperature': 6.536409028875875}. Best is trial 98 with value: 0.8791208791208791.
[32m[I 2023-04-21 02:02:00,241][39m Trial 1478 finished with value: 0.8275862068965518 and parameters: {'objective': 'CrossEntropy', 'colsample_bylevel': 0.07654884004270127, 'depth': 11, 'boosting_type': 'Plain', 'bootstrap_type': 'Bayesian', 'bagging_temperature': 8.65166867476391}. Best is trial 98 with value: 0.8791208791208791.
[32m[I 2023-04-21 02:02:01,310][39m Trial 1479 finished with value: 0.8791208791208791 and parameters: {'objective': 'CrossEntropy', 'colsample_bylevel': 0.07738131442603323, 'depth': 10, 'boosting_type': 'Plain', 'bootstrap_type': 'Bayesian', 'bagging_temperature': 9.66342451585343}. Best is trial 98 with value: 0.8791208791208791.
[32m[I 2023-04-21 02:02:01,936][39m Trial 1480 finished with value: 0.7764705882352942 and parameters: {'objective': 'CrossEntropy', 'colsample_bylevel': 0.08281729334167827, 'depth': 12, 'boosting_type': 'Plain', 'bootstrap_type': 'MVS'}. Best is trial 98 with value: 0.8791208791208791.
[32m[I 2023-04-21 02:02:03,223][39m Trial 1481 finished with value: 0.8275862068965518 and parameters: {'objective': 'Logloss', 'colsample_bylevel': 0.07577904066638497, 'depth': 10, 'boosting_type': 'Plain', 'bootstrap_type': 'Bayesian', 'bagging_temperature': 7.875755537038357}. Best is trial 98 with value: 0.8791208791208791.
[32m[I 2023-04-21 02:02:08,485][39m Trial 1482 finished with value: 0.8275862068965518 and parameters: {'objective': 'CrossEntropy', 'colsample_bylevel': 0.0803080693057997, 'depth': 6, 'boosting_type': 'Ordered', 'bootstrap_type': 'Bayesian', 'bagging_temperature': 9.292701914430815}. Best is trial 98 with value: 0.8791208791208791.
[32m[I 2023-04-21 02:02:09,768][39m Trial 1483 finished with value: 0.8539325842696629 and parameters: {'objective': 'CrossEntropy', 'colsample_bylevel': 0.08058637321091448, 'depth': 3, 'boosting_type': 'Plain', 'bootstrap_type': 'Bayesian', 'bagging_temperature': 9.366377655623378}. Best is trial 98 with value: 0.8791208791208791.
[32m[I 2023-04-21 02:02:10,504][39m Trial 1484 finished with value: 0.8409090909090909 and parameters: {'objective': 'CrossEntropy', 'colsample_bylevel': 0.07769532738325426, 'depth': 10, 'boosting_type': 'Plain', 'bootstrap_type': 'Bayesian', 'bagging_temperature': 9.152038288619}. Best is trial 98 with value: 0.8791208791208791.
[32m[I 2023-04-21 02:02:11,080][39m Trial 1485 finished with value: 0.8791208791208791 and parameters: {'objective': 'CrossEntropy', 'colsample_bylevel': 0.08414352090356719, 'depth': 3, 'boosting_type': 'Plain', 'bootstrap_type': 'Bayesian', 'bagging_temperature': 9.1597382096783}. Best is trial 98 with value: 0.8791208791208791.
[32m[I 2023-04-21 02:02:12,032][39m Trial 1486 finished with value: 0.8539325842696629 and parameters: {'objective': 'CrossEntropy', 'colsample_bylevel': 0.09070795920159122, 'depth': 3, 'boosting_type': 'Plain', 'bootstrap_type': 'Bayesian', 'bagging_temperature': 9.823617036728544}. Best is trial 98 with value: 0.8791208791208791.
[32m[I 2023-04-21 02:02:12,822][39m Trial 1487 finished with value: 0.8505747126436782 and parameters: {'objective': 'CrossEntropy', 'colsample_bylevel': 0.07893665669553553, 'depth': 9, 'boosting_type': 'Plain', 'bootstrap_type': 'Bayesian', 'bagging_temperature': 9.41960859389131}. Best is trial 98 with value: 0.8791208791208791.
[32m[I 2023-04-21 02:02:14,017][39m Trial 1488 finished with value: 0.8409090909090909 and parameters: {'objective': 'Logloss', 'colsample_bylevel': 0.0812036684319787, 'depth': 9, 'boosting_type': 'Plain', 'bootstrap_type': 'Bayesian', 'bagging_temperature': 9.707072815092037}. Best is trial 98 with value: 0.8791208791208791.
[32m[I 2023-04-21 02:02:15,416][39m Trial 1489 finished with value: 0.8275862068965518 and parameters: {'objective': 'CrossEntropy', 'colsample_bylevel': 0.08131945052081174, 'depth': 3, 'boosting_type': 'Plain', 'bootstrap_type': 'Bayesian', 'bagging_temperature': 9.465152651477089}. Best is trial 98 with value: 0.8791208791208791.
[32m[I 2023-04-21 02:02:16,021][39m Trial 1490 finished with value: 0.8409090909090909 and parameters: {'objective': 'CrossEntropy', 'colsample_bylevel': 0.08521091207542227, 'depth': 4, 'boosting_type': 'Plain', 'bootstrap_type': 'MVS'}. Best is trial 98 with value: 0.8791208791208791.
[32m[I 2023-04-21 02:02:16,865][39m Trial 1491 finished with value: 0.8666666666666666 and parameters: {'objective': 'CrossEntropy', 'colsample_bylevel': 0.08159682182395724, 'depth': 3, 'boosting_type': 'Plain', 'bootstrap_type': 'Bayesian', 'bagging_temperature': 9.980104093926748}. Best is trial 98 with value: 0.8791208791208791.
[32m[I 2023-04-21 02:02:17,793][39m Trial 1492 finished with value: 0.8666666666666666 and parameters: {'objective': 'Logloss', 'colsample_bylevel': 0.08739683357178527, 'depth': 3, 'boosting_type': 'Plain', 'bootstrap_type': 'Bayesian', 'bagging_temperature': 8.18164304559369}. Best is trial 98 with value: 0.8791208791208791.
[32m[I 2023-04-21 02:02:18,680][39m Trial 1493 finished with value: 0.8314606741573034 and parameters: {'objective': 'CrossEntropy', 'colsample_bylevel': 0.0991618061974334, 'depth': 3, 'boosting_type': 'Plain', 'bootstrap_type': 'Bayesian', 'bagging_temperature': 8.926747306627398}. Best is trial 98 with value: 0.8791208791208791.
[32m[I 2023-04-21 02:02:19,467][39m Trial 1494 finished with value: 0.8409090909090909 and parameters: {'objective': 'CrossEntropy', 'colsample_bylevel': 0.04422309197860652, 'depth': 4, 'boosting_type': 'Plain', 'bootstrap_type': 'Bayesian', 'bagging_temperature': 8.502636205165182}. Best is trial 98 with value: 0.8791208791208791.
[32m[I 2023-04-21 02:02:20,073][39m Trial 1495 finished with value: 0.8409090909090909 and parameters: {'objective': 'CrossEntropy', 'colsample_bylevel': 0.07967950930133466, 'depth': 4, 'boosting_type': 'Plain', 'bootstrap_type': 'Bayesian', 'bagging_temperature': 9.391066149156776}. Best is trial 98 with value: 0.8791208791208791.
[32m[I 2023-04-21 02:02:20,971][39m Trial 1496 finished with value: 0.8539325842696629 and parameters: {'objective': 'CrossEntropy', 'colsample_bylevel': 0.07917243410501343, 'depth': 4, 'boosting_type': 'Plain', 'bootstrap_type': 'Bayesian', 'bagging_temperature': 9.379708828737488}. Best is trial 98 with value: 0.8791208791208791.
[32m[I 2023-04-21 02:02:21,926][39m Trial 1497 finished with value: 0.8314606741573034 and parameters: {'objective': 'Logloss', 'colsample_bylevel': 0.06981034407882722, 'depth': 4, 'boosting_type': 'Plain', 'bootstrap_type': 'Bernoulli', 'subsample': 0.9499839553558771}. Best is trial 98 with value: 0.8791208791208791.
[32m[I 2023-04-21 02:02:22,831][39m Trial 1498 finished with value: 0.8666666666666666 and parameters: {'objective': 'CrossEntropy', 'colsample_bylevel': 0.07917606282526317, 'depth': 3, 'boosting_type': 'Plain', 'bootstrap_type': 'Bayesian', 'bagging_temperature': 8.558060980106262}. Best is trial 98 with value: 0.8791208791208791.
[32m[I 2023-04-21 02:02:23,927][39m Trial 1499 finished with value: 0.8539325842696629 and parameters: {'objective': 'CrossEntropy', 'colsample_bylevel': 0.07697951078326704, 'depth': 10, 'boosting_type': 'Plain', 'bootstrap_type': 'Bayesian', 'bagging_temperature': 9.670169882479877}. Best is trial 98 with value: 0.8791208791208791.
[32m[I 2023-04-21 02:02:24,733][39m Trial 1500 finished with value: 0.8275862068965518 and parameters: {'objective': 'CrossEntropy', 'colsample_bylevel': 0.08216696203637824, 'depth': 4, 'boosting_type': 'Plain', 'bootstrap_type': 'Bayesian', 'bagging_temperature': 9.523105376024706}. Best is trial 98 with value: 0.8791208791208791.
[32m[I 2023-04-21 02:02:25,331][39m Trial 1501 finished with value: 0.8539325842696629 and parameters: {'objective': 'CrossEntropy', 'colsample_bylevel': 0.08293069420469629, 'depth': 3, 'boosting_type': 'Plain', 'bootstrap_type': 'Bayesian', 'bagging_temperature': 9.061168737887852}. Best is trial 98 with value: 0.8791208791208791.
[32m[I 2023-04-21 02:02:30,321][39m Trial 1502 finished with value: 0.8409090909090909 and parameters: {'objective': 'Logloss', 'colsample_bylevel': 0.07465025490855827, 'depth': 3, 'boosting_type': 'Ordered', 'bootstrap_type': 'Bayesian', 'bagging_temperature': 7.436752255883955}. Best is trial 98 with value: 0.8791208791208791.
[32m[I 2023-04-21 02:02:31,351][39m Trial 1503 finished with value: 0.8539325842696629 and parameters: {'objective': 'Logloss', 'colsample_bylevel': 0.0722581382115665, 'depth': 6, 'boosting_type': 'Plain', 'bootstrap_type': 'Bayesian', 'bagging_temperature': 7.598906441092759}. Best is trial 98 with value: 0.8791208791208791.
[32m[I 2023-04-21 02:02:32,215][39m Trial 1504 finished with value: 0.8666666666666666 and parameters: {'objective': 'CrossEntropy', 'colsample_bylevel': 0.07905466919457559, 'depth': 3, 'boosting_type': 'Plain', 'bootstrap_type': 'Bayesian', 'bagging_temperature': 9.509729171364002}. Best is trial 98 with value: 0.8791208791208791.
[32m[I 2023-04-21 02:02:32,906][39m Trial 1505 finished with value: 0.8539325842696629 and parameters: {'objective': 'CrossEntropy', 'colsample_bylevel': 0.09671045028296289, 'depth': 3, 'boosting_type': 'Plain', 'bootstrap_type': 'MVS'}. Best is trial 98 with value: 0.8791208791208791.
[32m[I 2023-04-21 02:02:33,663][39m Trial 1506 finished with value: 0.8275862068965518 and parameters: {'objective': 'CrossEntropy', 'colsample_bylevel': 0.08569545071299497, 'depth': 3, 'boosting_type': 'Plain', 'bootstrap_type': 'Bayesian', 'bagging_temperature': 9.644372266128189}. Best is trial 98 with value: 0.8791208791208791.
[32m[I 2023-04-21 02:02:34,573][39m Trial 1507 finished with value: 0.8275862068965518 and parameters: {'objective': 'CrossEntropy', 'colsample_bylevel': 0.08418891701663377, 'depth': 10, 'boosting_type': 'Plain', 'bootstrap_type': 'Bayesian', 'bagging_temperature': 9.742166191827792}. Best is trial 98 with value: 0.8791208791208791.
[32m[I 2023-04-21 02:02:35,639][39m Trial 1508 finished with value: 0.8409090909090909 and parameters: {'objective': 'CrossEntropy', 'colsample_bylevel': 0.07639007405714353, 'depth': 5, 'boosting_type': 'Plain', 'bootstrap_type': 'Bayesian', 'bagging_temperature': 9.991596480107134}. Best is trial 98 with value: 0.8791208791208791.
[32m[I 2023-04-21 02:02:36,762][39m Trial 1509 finished with value: 0.8275862068965518 and parameters: {'objective': 'CrossEntropy', 'colsample_bylevel': 0.07745456325391137, 'depth': 5, 'boosting_type': 'Plain', 'bootstrap_type': 'Bayesian', 'bagging_temperature': 8.221555311405385}. Best is trial 98 with value: 0.8791208791208791.
[32m[I 2023-04-21 02:02:37,969][39m Trial 1510 finished with value: 0.8409090909090909 and parameters: {'objective': 'CrossEntropy', 'colsample_bylevel': 0.07742762649425317, 'depth': 10, 'boosting_type': 'Plain', 'bootstrap_type': 'Bayesian', 'bagging_temperature': 9.803176713862234}. Best is trial 98 with value: 0.8791208791208791.
[32m[I 2023-04-21 02:02:38,914][39m Trial 1511 finished with value: 0.8505747126436782 and parameters: {'objective': 'CrossEntropy', 'colsample_bylevel': 0.08281413470067488, 'depth': 7, 'boosting_type': 'Plain', 'bootstrap_type': 'Bayesian', 'bagging_temperature': 9.427829897433876}. Best is trial 98 with value: 0.8791208791208791.
[32m[I 2023-04-21 02:02:39,530][39m Trial 1512 finished with value: 0.8409090909090909 and parameters: {'objective': 'Logloss', 'colsample_bylevel': 0.07079374487742929, 'depth': 4, 'boosting_type': 'Plain', 'bootstrap_type': 'Bayesian', 'bagging_temperature': 8.426944657112738}. Best is trial 98 with value: 0.8791208791208791.
[32m[I 2023-04-21 02:02:40,113][39m Trial 1513 finished with value: 0.8409090909090909 and parameters: {'objective': 'CrossEntropy', 'colsample_bylevel': 0.08494439335135501, 'depth': 3, 'boosting_type': 'Plain', 'bootstrap_type': 'Bayesian', 'bagging_temperature': 8.813790194098038}. Best is trial 98 with value: 0.8791208791208791.
[32m[I 2023-04-21 02:02:40,799][39m Trial 1514 finished with value: 0.8409090909090909 and parameters: {'objective': 'Logloss', 'colsample_bylevel': 0.08068064627818661, 'depth': 10, 'boosting_type': 'Plain', 'bootstrap_type': 'Bayesian', 'bagging_temperature': 7.152274665662499}. Best is trial 98 with value: 0.8791208791208791.
[32m[I 2023-04-21 02:02:41,849][39m Trial 1515 finished with value: 0.8372093023255814 and parameters: {'objective': 'CrossEntropy', 'colsample_bylevel': 0.09568318461967781, 'depth': 11, 'boosting_type': 'Plain', 'bootstrap_type': 'Bayesian', 'bagging_temperature': 8.822213647706718}. Best is trial 98 with value: 0.8791208791208791.
[32m[I 2023-04-21 02:02:42,898][39m Trial 1516 finished with value: 0.7857142857142858 and parameters: {'objective': 'CrossEntropy', 'colsample_bylevel': 0.08394130252343603, 'depth': 6, 'boosting_type': 'Plain', 'bootstrap_type': 'MVS'}. Best is trial 98 with value: 0.8791208791208791.
[32m[I 2023-04-21 02:02:43,550][39m Trial 1517 finished with value: 0.8539325842696629 and parameters: {'objective': 'CrossEntropy', 'colsample_bylevel': 0.08435584832842122, 'depth': 3, 'boosting_type': 'Plain', 'bootstrap_type': 'Bayesian', 'bagging_temperature': 9.138729140226216}. Best is trial 98 with value: 0.8791208791208791.
[32m[I 2023-04-21 02:02:44,556][39m Trial 1518 finished with value: 0.8275862068965518 and parameters: {'objective': 'CrossEntropy', 'colsample_bylevel': 0.09098279803391296, 'depth': 3, 'boosting_type': 'Plain', 'bootstrap_type': 'Bayesian', 'bagging_temperature': 9.838461625608556}. Best is trial 98 with value: 0.8791208791208791.
[32m[I 2023-04-21 02:02:45,756][39m Trial 1519 finished with value: 0.8275862068965518 and parameters: {'objective': 'CrossEntropy', 'colsample_bylevel': 0.07307198991487322, 'depth': 10, 'boosting_type': 'Plain', 'bootstrap_type': 'Bayesian', 'bagging_temperature': 9.988300415838825}. Best is trial 98 with value: 0.8791208791208791.
[32m[I 2023-04-21 02:02:46,789][39m Trial 1520 finished with value: 0.8666666666666666 and parameters: {'objective': 'Logloss', 'colsample_bylevel': 0.0734640527871722, 'depth': 4, 'boosting_type': 'Plain', 'bootstrap_type': 'Bayesian', 'bagging_temperature': 8.041199072920225}. Best is trial 98 with value: 0.8791208791208791.
