[32m[I 2023-04-21 02:39:24,697][39m Trial 3431 finished with value: 0.8275862068965518 and parameters: {'objective': 'CrossEntropy', 'colsample_bylevel': 0.07471432448937979, 'depth': 9, 'boosting_type': 'Plain', 'bootstrap_type': 'MVS'}. Best is trial 3065 with value: 0.8863636363636364.
[32m[I 2023-04-21 02:39:25,666][39m Trial 3432 finished with value: 0.8275862068965518 and parameters: {'objective': 'CrossEntropy', 'colsample_bylevel': 0.0643304852535716, 'depth': 7, 'boosting_type': 'Plain', 'bootstrap_type': 'Bernoulli', 'subsample': 0.312872469840423}. Best is trial 3065 with value: 0.8863636363636364.
[32m[I 2023-04-21 02:39:27,002][39m Trial 3433 finished with value: 0.8409090909090909 and parameters: {'objective': 'Logloss', 'colsample_bylevel': 0.07424086386700056, 'depth': 9, 'boosting_type': 'Plain', 'bootstrap_type': 'MVS'}. Best is trial 3065 with value: 0.8863636363636364.
[32m[I 2023-04-21 02:39:27,650][39m Trial 3434 finished with value: 0.8539325842696629 and parameters: {'objective': 'Logloss', 'colsample_bylevel': 0.07661182346168872, 'depth': 10, 'boosting_type': 'Plain', 'bootstrap_type': 'Bayesian', 'bagging_temperature': 9.733037162602285}. Best is trial 3065 with value: 0.8863636363636364.
[32m[I 2023-04-21 02:39:28,702][39m Trial 3435 finished with value: 0.8048780487804877 and parameters: {'objective': 'Logloss', 'colsample_bylevel': 0.02712740306517502, 'depth': 10, 'boosting_type': 'Plain', 'bootstrap_type': 'Bayesian', 'bagging_temperature': 9.667479609830576}. Best is trial 3065 with value: 0.8863636363636364.
[32m[I 2023-04-21 02:39:29,463][39m Trial 3436 finished with value: 0.8409090909090909 and parameters: {'objective': 'CrossEntropy', 'colsample_bylevel': 0.07763849550196654, 'depth': 6, 'boosting_type': 'Plain', 'bootstrap_type': 'Bayesian', 'bagging_temperature': 9.842321365580949}. Best is trial 3065 with value: 0.8863636363636364.
[32m[I 2023-04-21 02:39:30,538][39m Trial 3437 finished with value: 0.8409090909090909 and parameters: {'objective': 'CrossEntropy', 'colsample_bylevel': 0.08136606905555434, 'depth': 3, 'boosting_type': 'Plain', 'bootstrap_type': 'Bayesian', 'bagging_temperature': 8.816208667802853}. Best is trial 3065 with value: 0.8863636363636364.
[32m[I 2023-04-21 02:39:31,530][39m Trial 3438 finished with value: 0.8409090909090909 and parameters: {'objective': 'CrossEntropy', 'colsample_bylevel': 0.08139018823807569, 'depth': 3, 'boosting_type': 'Plain', 'bootstrap_type': 'Bayesian', 'bagging_temperature': 8.754715333954353}. Best is trial 3065 with value: 0.8863636363636364.
[32m[I 2023-04-21 02:39:32,983][39m Trial 3439 finished with value: 0.8539325842696629 and parameters: {'objective': 'CrossEntropy', 'colsample_bylevel': 0.07364594254726868, 'depth': 9, 'boosting_type': 'Plain', 'bootstrap_type': 'Bayesian', 'bagging_temperature': 7.869174462314287}. Best is trial 3065 with value: 0.8863636363636364.
[32m[I 2023-04-21 02:39:37,698][39m Trial 3440 finished with value: 0.8409090909090909 and parameters: {'objective': 'CrossEntropy', 'colsample_bylevel': 0.08798266862213025, 'depth': 3, 'boosting_type': 'Ordered', 'bootstrap_type': 'Bayesian', 'bagging_temperature': 8.804753049112955}. Best is trial 3065 with value: 0.8863636363636364.
[32m[I 2023-04-21 02:39:38,727][39m Trial 3441 finished with value: 0.8539325842696629 and parameters: {'objective': 'CrossEntropy', 'colsample_bylevel': 0.07873544302964186, 'depth': 3, 'boosting_type': 'Plain', 'bootstrap_type': 'MVS'}. Best is trial 3065 with value: 0.8863636363636364.
[32m[I 2023-04-21 02:39:39,675][39m Trial 3442 finished with value: 0.8666666666666666 and parameters: {'objective': 'CrossEntropy', 'colsample_bylevel': 0.06467682766131949, 'depth': 10, 'boosting_type': 'Plain', 'bootstrap_type': 'Bayesian', 'bagging_temperature': 9.375431554754734}. Best is trial 3065 with value: 0.8863636363636364.
[32m[I 2023-04-21 02:39:40,846][39m Trial 3443 finished with value: 0.8409090909090909 and parameters: {'objective': 'CrossEntropy', 'colsample_bylevel': 0.08295350844792891, 'depth': 8, 'boosting_type': 'Plain', 'bootstrap_type': 'Bayesian', 'bagging_temperature': 7.50383795635687}. Best is trial 3065 with value: 0.8863636363636364.
[32m[I 2023-04-21 02:39:41,824][39m Trial 3444 finished with value: 0.8539325842696629 and parameters: {'objective': 'Logloss', 'colsample_bylevel': 0.06804199820542159, 'depth': 9, 'boosting_type': 'Plain', 'bootstrap_type': 'Bayesian', 'bagging_temperature': 8.943228966201495}. Best is trial 3065 with value: 0.8863636363636364.
[32m[I 2023-04-21 02:39:42,669][39m Trial 3445 finished with value: 0.8539325842696629 and parameters: {'objective': 'CrossEntropy', 'colsample_bylevel': 0.08071390738380242, 'depth': 3, 'boosting_type': 'Plain', 'bootstrap_type': 'Bayesian', 'bagging_temperature': 8.228284725015671}. Best is trial 3065 with value: 0.8863636363636364.
[32m[I 2023-04-21 02:39:43,580][39m Trial 3446 finished with value: 0.8409090909090909 and parameters: {'objective': 'CrossEntropy', 'colsample_bylevel': 0.08578696041578644, 'depth': 4, 'boosting_type': 'Plain', 'bootstrap_type': 'Bayesian', 'bagging_temperature': 7.7444837300194695}. Best is trial 3065 with value: 0.8863636363636364.
[32m[I 2023-04-21 02:39:44,400][39m Trial 3447 finished with value: 0.8275862068965518 and parameters: {'objective': 'CrossEntropy', 'colsample_bylevel': 0.05704328849101712, 'depth': 10, 'boosting_type': 'Plain', 'bootstrap_type': 'Bayesian', 'bagging_temperature': 9.380946278286256}. Best is trial 3065 with value: 0.8863636363636364.
[32m[I 2023-04-21 02:39:45,195][39m Trial 3448 finished with value: 0.8409090909090909 and parameters: {'objective': 'CrossEntropy', 'colsample_bylevel': 0.06780174802938656, 'depth': 9, 'boosting_type': 'Plain', 'bootstrap_type': 'Bayesian', 'bagging_temperature': 9.0710200910136}. Best is trial 3065 with value: 0.8863636363636364.
[32m[I 2023-04-21 02:39:46,184][39m Trial 3449 finished with value: 0.8539325842696629 and parameters: {'objective': 'CrossEntropy', 'colsample_bylevel': 0.0869492627502126, 'depth': 3, 'boosting_type': 'Plain', 'bootstrap_type': 'Bayesian', 'bagging_temperature': 8.844853694651198}. Best is trial 3065 with value: 0.8863636363636364.
[32m[I 2023-04-21 02:39:47,226][39m Trial 3450 finished with value: 0.8409090909090909 and parameters: {'objective': 'CrossEntropy', 'colsample_bylevel': 0.068762321772182, 'depth': 4, 'boosting_type': 'Plain', 'bootstrap_type': 'Bayesian', 'bagging_temperature': 9.81676588097658}. Best is trial 3065 with value: 0.8863636363636364.
[32m[I 2023-04-21 02:39:48,363][39m Trial 3451 finished with value: 0.8409090909090909 and parameters: {'objective': 'CrossEntropy', 'colsample_bylevel': 0.0847657973929494, 'depth': 3, 'boosting_type': 'Plain', 'bootstrap_type': 'Bayesian', 'bagging_temperature': 8.458147666966212}. Best is trial 3065 with value: 0.8863636363636364.
[32m[I 2023-04-21 02:39:49,032][39m Trial 3452 finished with value: 0.8275862068965518 and parameters: {'objective': 'CrossEntropy', 'colsample_bylevel': 0.07886129589339887, 'depth': 4, 'boosting_type': 'Plain', 'bootstrap_type': 'Bayesian', 'bagging_temperature': 8.476882084902387}. Best is trial 3065 with value: 0.8863636363636364.
[32m[I 2023-04-21 02:39:50,351][39m Trial 3453 finished with value: 0.8139534883720929 and parameters: {'objective': 'CrossEntropy', 'colsample_bylevel': 0.0758276467557783, 'depth': 8, 'boosting_type': 'Plain', 'bootstrap_type': 'MVS'}. Best is trial 3065 with value: 0.8863636363636364.
[32m[I 2023-04-21 02:39:50,991][39m Trial 3454 finished with value: 0.8791208791208791 and parameters: {'objective': 'CrossEntropy', 'colsample_bylevel': 0.08839875695042866, 'depth': 3, 'boosting_type': 'Plain', 'bootstrap_type': 'Bayesian', 'bagging_temperature': 9.806419906877196}. Best is trial 3065 with value: 0.8863636363636364.
[32m[I 2023-04-21 02:39:51,833][39m Trial 3455 finished with value: 0.8505747126436782 and parameters: {'objective': 'CrossEntropy', 'colsample_bylevel': 0.07787258523548057, 'depth': 11, 'boosting_type': 'Plain', 'bootstrap_type': 'Bayesian', 'bagging_temperature': 9.44729948382818}. Best is trial 3065 with value: 0.8863636363636364.
[32m[I 2023-04-21 02:39:52,838][39m Trial 3456 finished with value: 0.8505747126436782 and parameters: {'objective': 'CrossEntropy', 'colsample_bylevel': 0.06604595311710837, 'depth': 3, 'boosting_type': 'Plain', 'bootstrap_type': 'Bayesian', 'bagging_temperature': 9.02946115700484}. Best is trial 3065 with value: 0.8863636363636364.
[32m[I 2023-04-21 02:39:54,008][39m Trial 3457 finished with value: 0.8539325842696629 and parameters: {'objective': 'CrossEntropy', 'colsample_bylevel': 0.07211593467845717, 'depth': 10, 'boosting_type': 'Plain', 'bootstrap_type': 'Bayesian', 'bagging_temperature': 9.897706017082896}. Best is trial 3065 with value: 0.8863636363636364.
[32m[I 2023-04-21 02:39:54,992][39m Trial 3458 finished with value: 0.8539325842696629 and parameters: {'objective': 'Logloss', 'colsample_bylevel': 0.06431725325219434, 'depth': 12, 'boosting_type': 'Plain', 'bootstrap_type': 'Bayesian', 'bagging_temperature': 9.54646242983813}. Best is trial 3065 with value: 0.8863636363636364.
[32m[I 2023-04-21 02:39:56,398][39m Trial 3459 finished with value: 0.8409090909090909 and parameters: {'objective': 'CrossEntropy', 'colsample_bylevel': 0.08427313990226017, 'depth': 3, 'boosting_type': 'Plain', 'bootstrap_type': 'Bayesian', 'bagging_temperature': 9.1867935145424}. Best is trial 3065 with value: 0.8863636363636364.
[32m[I 2023-04-21 02:40:00,785][39m Trial 3460 finished with value: 0.8139534883720929 and parameters: {'objective': 'CrossEntropy', 'colsample_bylevel': 0.07518419651840456, 'depth': 10, 'boosting_type': 'Ordered', 'bootstrap_type': 'Bernoulli', 'subsample': 0.4989120915269544}. Best is trial 3065 with value: 0.8863636363636364.
[32m[I 2023-04-21 02:40:01,915][39m Trial 3461 finished with value: 0.8764044943820225 and parameters: {'objective': 'CrossEntropy', 'colsample_bylevel': 0.08554312974170371, 'depth': 2, 'boosting_type': 'Plain', 'bootstrap_type': 'Bayesian', 'bagging_temperature': 9.854902392844165}. Best is trial 3065 with value: 0.8863636363636364.
[32m[I 2023-04-21 02:40:02,804][39m Trial 3462 finished with value: 0.8409090909090909 and parameters: {'objective': 'Logloss', 'colsample_bylevel': 0.08349708957496961, 'depth': 6, 'boosting_type': 'Plain', 'bootstrap_type': 'Bayesian', 'bagging_temperature': 9.052376922388444}. Best is trial 3065 with value: 0.8863636363636364.
[32m[I 2023-04-21 02:40:03,855][39m Trial 3463 finished with value: 0.8139534883720929 and parameters: {'objective': 'CrossEntropy', 'colsample_bylevel': 0.0981804387900807, 'depth': 3, 'boosting_type': 'Plain', 'bootstrap_type': 'MVS'}. Best is trial 3065 with value: 0.8863636363636364.
[32m[I 2023-04-21 02:40:04,839][39m Trial 3464 finished with value: 0.8275862068965518 and parameters: {'objective': 'Logloss', 'colsample_bylevel': 0.07977662176898273, 'depth': 6, 'boosting_type': 'Plain', 'bootstrap_type': 'Bayesian', 'bagging_temperature': 8.882647040937083}. Best is trial 3065 with value: 0.8863636363636364.
[32m[I 2023-04-21 02:40:05,799][39m Trial 3465 finished with value: 0.8666666666666666 and parameters: {'objective': 'CrossEntropy', 'colsample_bylevel': 0.08379118426945341, 'depth': 3, 'boosting_type': 'Plain', 'bootstrap_type': 'Bayesian', 'bagging_temperature': 8.86454290338482}. Best is trial 3065 with value: 0.8863636363636364.
[32m[I 2023-04-21 02:40:07,348][39m Trial 3466 finished with value: 0.8372093023255814 and parameters: {'objective': 'CrossEntropy', 'colsample_bylevel': 0.09813079176823822, 'depth': 9, 'boosting_type': 'Plain', 'bootstrap_type': 'Bayesian', 'bagging_temperature': 4.693779891219175}. Best is trial 3065 with value: 0.8863636363636364.
[32m[I 2023-04-21 02:40:08,307][39m Trial 3467 finished with value: 0.8666666666666666 and parameters: {'objective': 'CrossEntropy', 'colsample_bylevel': 0.08122194097244179, 'depth': 3, 'boosting_type': 'Plain', 'bootstrap_type': 'Bayesian', 'bagging_temperature': 9.212355152960154}. Best is trial 3065 with value: 0.8863636363636364.
[32m[I 2023-04-21 02:40:09,373][39m Trial 3468 finished with value: 0.8409090909090909 and parameters: {'objective': 'CrossEntropy', 'colsample_bylevel': 0.07724376657113342, 'depth': 10, 'boosting_type': 'Plain', 'bootstrap_type': 'Bayesian', 'bagging_temperature': 9.448731662561885}. Best is trial 3065 with value: 0.8863636363636364.
[32m[I 2023-04-21 02:40:10,602][39m Trial 3469 finished with value: 0.8275862068965518 and parameters: {'objective': 'CrossEntropy', 'colsample_bylevel': 0.07757088265883702, 'depth': 10, 'boosting_type': 'Plain', 'bootstrap_type': 'Bayesian', 'bagging_temperature': 9.57700334481759}. Best is trial 3065 with value: 0.8863636363636364.
[32m[I 2023-04-21 02:40:11,337][39m Trial 3470 finished with value: 0.8539325842696629 and parameters: {'objective': 'CrossEntropy', 'colsample_bylevel': 0.06865854871085844, 'depth': 9, 'boosting_type': 'Plain', 'bootstrap_type': 'Bayesian', 'bagging_temperature': 9.249122156887838}. Best is trial 3065 with value: 0.8863636363636364.
[32m[I 2023-04-21 02:40:11,976][39m Trial 3471 finished with value: 0.8409090909090909 and parameters: {'objective': 'CrossEntropy', 'colsample_bylevel': 0.09980428527159231, 'depth': 3, 'boosting_type': 'Plain', 'bootstrap_type': 'Bayesian', 'bagging_temperature': 8.675827719774011}. Best is trial 3065 with value: 0.8863636363636364.
[32m[I 2023-04-21 02:40:12,763][39m Trial 3472 finished with value: 0.8505747126436782 and parameters: {'objective': 'CrossEntropy', 'colsample_bylevel': 0.07661082458392376, 'depth': 9, 'boosting_type': 'Plain', 'bootstrap_type': 'Bayesian', 'bagging_temperature': 9.651218096778996}. Best is trial 3065 with value: 0.8863636363636364.
[32m[I 2023-04-21 02:40:13,744][39m Trial 3473 finished with value: 0.8275862068965518 and parameters: {'objective': 'CrossEntropy', 'colsample_bylevel': 0.07264729016433336, 'depth': 10, 'boosting_type': 'Plain', 'bootstrap_type': 'Bayesian', 'bagging_temperature': 9.569516860081393}. Best is trial 3065 with value: 0.8863636363636364.
[32m[I 2023-04-21 02:40:14,386][39m Trial 3474 finished with value: 0.8139534883720929 and parameters: {'objective': 'CrossEntropy', 'colsample_bylevel': 0.07994348868551568, 'depth': 6, 'boosting_type': 'Plain', 'bootstrap_type': 'Bayesian', 'bagging_temperature': 9.045927884150263}. Best is trial 3065 with value: 0.8863636363636364.
[32m[I 2023-04-21 02:40:15,576][39m Trial 3475 finished with value: 0.8636363636363636 and parameters: {'objective': 'CrossEntropy', 'colsample_bylevel': 0.07849282321410152, 'depth': 2, 'boosting_type': 'Plain', 'bootstrap_type': 'Bayesian', 'bagging_temperature': 9.335802432839401}. Best is trial 3065 with value: 0.8863636363636364.
[32m[I 2023-04-21 02:40:16,703][39m Trial 3476 finished with value: 0.8409090909090909 and parameters: {'objective': 'CrossEntropy', 'colsample_bylevel': 0.07917493429230867, 'depth': 3, 'boosting_type': 'Plain', 'bootstrap_type': 'Bayesian', 'bagging_temperature': 8.631231270116713}. Best is trial 3065 with value: 0.8863636363636364.
[32m[I 2023-04-21 02:40:17,455][39m Trial 3477 finished with value: 0.8409090909090909 and parameters: {'objective': 'CrossEntropy', 'colsample_bylevel': 0.07372523139827959, 'depth': 4, 'boosting_type': 'Plain', 'bootstrap_type': 'Bernoulli', 'subsample': 0.46127722952689}. Best is trial 3065 with value: 0.8863636363636364.
[32m[I 2023-04-21 02:40:18,304][39m Trial 3478 finished with value: 0.8275862068965518 and parameters: {'objective': 'Logloss', 'colsample_bylevel': 0.06329190955355456, 'depth': 4, 'boosting_type': 'Plain', 'bootstrap_type': 'MVS'}. Best is trial 3065 with value: 0.8863636363636364.
[32m[I 2023-04-21 02:40:23,258][39m Trial 3479 finished with value: 0.8275862068965518 and parameters: {'objective': 'CrossEntropy', 'colsample_bylevel': 0.08871272304302093, 'depth': 3, 'boosting_type': 'Ordered', 'bootstrap_type': 'Bayesian', 'bagging_temperature': 9.628128498304896}. Best is trial 3065 with value: 0.8863636363636364.
[32m[I 2023-04-21 02:40:24,377][39m Trial 3480 finished with value: 0.8139534883720929 and parameters: {'objective': 'CrossEntropy', 'colsample_bylevel': 0.07568151236793358, 'depth': 10, 'boosting_type': 'Plain', 'bootstrap_type': 'Bayesian', 'bagging_temperature': 9.925805451997624}. Best is trial 3065 with value: 0.8863636363636364.
[32m[I 2023-04-21 02:40:25,547][39m Trial 3481 finished with value: 0.8539325842696629 and parameters: {'objective': 'CrossEntropy', 'colsample_bylevel': 0.0704922044521217, 'depth': 11, 'boosting_type': 'Plain', 'bootstrap_type': 'Bayesian', 'bagging_temperature': 9.646746297940206}. Best is trial 3065 with value: 0.8863636363636364.
[32m[I 2023-04-21 02:40:26,555][39m Trial 3482 finished with value: 0.8409090909090909 and parameters: {'objective': 'CrossEntropy', 'colsample_bylevel': 0.07657907940267743, 'depth': 10, 'boosting_type': 'Plain', 'bootstrap_type': 'Bayesian', 'bagging_temperature': 9.571387857800845}. Best is trial 3065 with value: 0.8863636363636364.
[32m[I 2023-04-21 02:40:27,797][39m Trial 3483 finished with value: 0.8409090909090909 and parameters: {'objective': 'CrossEntropy', 'colsample_bylevel': 0.07754163160951584, 'depth': 10, 'boosting_type': 'Plain', 'bootstrap_type': 'Bayesian', 'bagging_temperature': 9.490854103225516}. Best is trial 3065 with value: 0.8863636363636364.
[32m[I 2023-04-21 02:40:28,535][39m Trial 3484 finished with value: 0.8275862068965518 and parameters: {'objective': 'CrossEntropy', 'colsample_bylevel': 0.07322224400815813, 'depth': 1, 'boosting_type': 'Plain', 'bootstrap_type': 'Bayesian', 'bagging_temperature': 9.339305530766916}. Best is trial 3065 with value: 0.8863636363636364.
[32m[I 2023-04-21 02:40:29,386][39m Trial 3485 finished with value: 0.8275862068965518 and parameters: {'objective': 'CrossEntropy', 'colsample_bylevel': 0.08634517244044929, 'depth': 3, 'boosting_type': 'Plain', 'bootstrap_type': 'Bayesian', 'bagging_temperature': 9.414486642347708}. Best is trial 3065 with value: 0.8863636363636364.
[32m[I 2023-04-21 02:40:30,505][39m Trial 3486 finished with value: 0.8409090909090909 and parameters: {'objective': 'CrossEntropy', 'colsample_bylevel': 0.07084491416974771, 'depth': 3, 'boosting_type': 'Plain', 'bootstrap_type': 'Bayesian', 'bagging_temperature': 9.300897019988978}. Best is trial 3065 with value: 0.8863636363636364.
[32m[I 2023-04-21 02:40:31,469][39m Trial 3487 finished with value: 0.8444444444444446 and parameters: {'objective': 'CrossEntropy', 'colsample_bylevel': 0.0741654578904344, 'depth': 9, 'boosting_type': 'Plain', 'bootstrap_type': 'Bayesian', 'bagging_temperature': 8.61768565804525}. Best is trial 3065 with value: 0.8863636363636364.
[32m[I 2023-04-21 02:40:32,169][39m Trial 3488 finished with value: 0.8275862068965518 and parameters: {'objective': 'CrossEntropy', 'colsample_bylevel': 0.0743632819667086, 'depth': 9, 'boosting_type': 'Plain', 'bootstrap_type': 'Bayesian', 'bagging_temperature': 8.515768039308048}. Best is trial 3065 with value: 0.8863636363636364.
[32m[I 2023-04-21 02:40:33,124][39m Trial 3489 finished with value: 0.8275862068965518 and parameters: {'objective': 'CrossEntropy', 'colsample_bylevel': 0.09454132568306957, 'depth': 3, 'boosting_type': 'Plain', 'bootstrap_type': 'Bayesian', 'bagging_temperature': 9.901623048947714}. Best is trial 3065 with value: 0.8863636363636364.
[32m[I 2023-04-21 02:40:34,033][39m Trial 3490 finished with value: 0.8666666666666666 and parameters: {'objective': 'CrossEntropy', 'colsample_bylevel': 0.08113520134701556, 'depth': 3, 'boosting_type': 'Plain', 'bootstrap_type': 'Bayesian', 'bagging_temperature': 9.190625766197599}. Best is trial 3065 with value: 0.8863636363636364.
[32m[I 2023-04-21 02:40:35,270][39m Trial 3491 finished with value: 0.8666666666666666 and parameters: {'objective': 'CrossEntropy', 'colsample_bylevel': 0.07259189181957523, 'depth': 11, 'boosting_type': 'Plain', 'bootstrap_type': 'MVS'}. Best is trial 3065 with value: 0.8863636363636364.
[32m[I 2023-04-21 02:40:36,262][39m Trial 3492 finished with value: 0.8539325842696629 and parameters: {'objective': 'CrossEntropy', 'colsample_bylevel': 0.0789828577903949, 'depth': 3, 'boosting_type': 'Plain', 'bootstrap_type': 'Bayesian', 'bagging_temperature': 8.226515103822836}. Best is trial 3065 with value: 0.8863636363636364.
[32m[I 2023-04-21 02:40:37,410][39m Trial 3493 finished with value: 0.8275862068965518 and parameters: {'objective': 'CrossEntropy', 'colsample_bylevel': 0.06821896350140724, 'depth': 9, 'boosting_type': 'Plain', 'bootstrap_type': 'Bayesian', 'bagging_temperature': 2.699644440234385}. Best is trial 3065 with value: 0.8863636363636364.
[32m[I 2023-04-21 02:40:38,111][39m Trial 3494 finished with value: 0.8409090909090909 and parameters: {'objective': 'CrossEntropy', 'colsample_bylevel': 0.0699365146766682, 'depth': 9, 'boosting_type': 'Plain', 'bootstrap_type': 'Bayesian', 'bagging_temperature': 9.52954351415885}. Best is trial 3065 with value: 0.8863636363636364.
[32m[I 2023-04-21 02:40:38,924][39m Trial 3495 finished with value: 0.8666666666666666 and parameters: {'objective': 'CrossEntropy', 'colsample_bylevel': 0.07648803060139053, 'depth': 10, 'boosting_type': 'Plain', 'bootstrap_type': 'Bayesian', 'bagging_temperature': 9.604693179532324}. Best is trial 3065 with value: 0.8863636363636364.
[32m[I 2023-04-21 02:40:43,557][39m Trial 3496 finished with value: 0.8409090909090909 and parameters: {'objective': 'Logloss', 'colsample_bylevel': 0.06542288201425682, 'depth': 7, 'boosting_type': 'Ordered', 'bootstrap_type': 'Bayesian', 'bagging_temperature': 8.394444362892079}. Best is trial 3065 with value: 0.8863636363636364.
