[32m[I 2023-04-21 03:11:20,378][39m Trial 5000 finished with value: 0.8409090909090909 and parameters: {'objective': 'CrossEntropy', 'colsample_bylevel': 0.07508022874875514, 'depth': 11, 'boosting_type': 'Plain', 'bootstrap_type': 'Bayesian', 'bagging_temperature': 9.865904941638469}. Best is trial 3065 with value: 0.8863636363636364.
[32m[I 2023-04-21 03:11:21,758][39m Trial 5001 finished with value: 0.8539325842696629 and parameters: {'objective': 'Logloss', 'colsample_bylevel': 0.07212356100089759, 'depth': 3, 'boosting_type': 'Plain', 'bootstrap_type': 'Bayesian', 'bagging_temperature': 8.942455551786638}. Best is trial 3065 with value: 0.8863636363636364.
[32m[I 2023-04-21 03:11:22,925][39m Trial 5002 finished with value: 0.8666666666666666 and parameters: {'objective': 'CrossEntropy', 'colsample_bylevel': 0.0722186892456613, 'depth': 3, 'boosting_type': 'Plain', 'bootstrap_type': 'Bayesian', 'bagging_temperature': 9.050345400150414}. Best is trial 3065 with value: 0.8863636363636364.
[32m[I 2023-04-21 03:11:23,827][39m Trial 5003 finished with value: 0.8666666666666666 and parameters: {'objective': 'CrossEntropy', 'colsample_bylevel': 0.08302686201961056, 'depth': 2, 'boosting_type': 'Plain', 'bootstrap_type': 'Bayesian', 'bagging_temperature': 8.563255719654203}. Best is trial 3065 with value: 0.8863636363636364.
[32m[I 2023-04-21 03:11:24,692][39m Trial 5004 finished with value: 0.8539325842696629 and parameters: {'objective': 'Logloss', 'colsample_bylevel': 0.09087451340651082, 'depth': 2, 'boosting_type': 'Plain', 'bootstrap_type': 'Bayesian', 'bagging_temperature': 9.978764302505473}. Best is trial 3065 with value: 0.8863636363636364.
[32m[I 2023-04-21 03:11:25,667][39m Trial 5005 finished with value: 0.8539325842696629 and parameters: {'objective': 'CrossEntropy', 'colsample_bylevel': 0.07245394148766536, 'depth': 2, 'boosting_type': 'Plain', 'bootstrap_type': 'Bayesian', 'bagging_temperature': 8.96987645837664}. Best is trial 3065 with value: 0.8863636363636364.
[32m[I 2023-04-21 03:11:26,764][39m Trial 5006 finished with value: 0.8409090909090909 and parameters: {'objective': 'CrossEntropy', 'colsample_bylevel': 0.0780822781716269, 'depth': 3, 'boosting_type': 'Plain', 'bootstrap_type': 'Bayesian', 'bagging_temperature': 8.176900896388345}. Best is trial 3065 with value: 0.8863636363636364.
[32m[I 2023-04-21 03:11:28,109][39m Trial 5007 finished with value: 0.8636363636363636 and parameters: {'objective': 'Logloss', 'colsample_bylevel': 0.07776485741726441, 'depth': 3, 'boosting_type': 'Plain', 'bootstrap_type': 'Bayesian', 'bagging_temperature': 8.355634373102637}. Best is trial 3065 with value: 0.8863636363636364.
[32m[I 2023-04-21 03:11:29,362][39m Trial 5008 finished with value: 0.8409090909090909 and parameters: {'objective': 'CrossEntropy', 'colsample_bylevel': 0.08705376207528058, 'depth': 9, 'boosting_type': 'Plain', 'bootstrap_type': 'Bernoulli', 'subsample': 0.8595235045383507}. Best is trial 3065 with value: 0.8863636363636364.
[32m[I 2023-04-21 03:11:30,121][39m Trial 5009 finished with value: 0.8539325842696629 and parameters: {'objective': 'CrossEntropy', 'colsample_bylevel': 0.07687948990104794, 'depth': 3, 'boosting_type': 'Plain', 'bootstrap_type': 'Bayesian', 'bagging_temperature': 9.845472576049197}. Best is trial 3065 with value: 0.8863636363636364.
[32m[I 2023-04-21 03:11:30,955][39m Trial 5010 finished with value: 0.8275862068965518 and parameters: {'objective': 'CrossEntropy', 'colsample_bylevel': 0.08563176413713325, 'depth': 3, 'boosting_type': 'Plain', 'bootstrap_type': 'MVS'}. Best is trial 3065 with value: 0.8863636363636364.
[32m[I 2023-04-21 03:11:31,603][39m Trial 5011 finished with value: 0.8275862068965518 and parameters: {'objective': 'CrossEntropy', 'colsample_bylevel': 0.06428503581096945, 'depth': 2, 'boosting_type': 'Plain', 'bootstrap_type': 'Bayesian', 'bagging_temperature': 9.577621008107556}. Best is trial 3065 with value: 0.8863636363636364.
[32m[I 2023-04-21 03:11:33,102][39m Trial 5012 finished with value: 0.8539325842696629 and parameters: {'objective': 'CrossEntropy', 'colsample_bylevel': 0.07763344915212252, 'depth': 10, 'boosting_type': 'Plain', 'bootstrap_type': 'Bayesian', 'bagging_temperature': 6.9123628456072}. Best is trial 3065 with value: 0.8863636363636364.
[32m[I 2023-04-21 03:11:34,378][39m Trial 5013 finished with value: 0.8666666666666666 and parameters: {'objective': 'Logloss', 'colsample_bylevel': 0.0729532842050034, 'depth': 4, 'boosting_type': 'Plain', 'bootstrap_type': 'Bayesian', 'bagging_temperature': 9.208874029228472}. Best is trial 3065 with value: 0.8863636363636364.
[32m[I 2023-04-21 03:11:35,399][39m Trial 5014 finished with value: 0.7857142857142858 and parameters: {'objective': 'CrossEntropy', 'colsample_bylevel': 0.0897284156292742, 'depth': 4, 'boosting_type': 'Plain', 'bootstrap_type': 'MVS'}. Best is trial 3065 with value: 0.8863636363636364.
[32m[I 2023-04-21 03:11:36,178][39m Trial 5015 finished with value: 0.8409090909090909 and parameters: {'objective': 'CrossEntropy', 'colsample_bylevel': 0.07982319241735543, 'depth': 3, 'boosting_type': 'Plain', 'bootstrap_type': 'MVS'}. Best is trial 3065 with value: 0.8863636363636364.
[32m[I 2023-04-21 03:11:36,982][39m Trial 5016 finished with value: 0.8539325842696629 and parameters: {'objective': 'CrossEntropy', 'colsample_bylevel': 0.07806850802671544, 'depth': 10, 'boosting_type': 'Plain', 'bootstrap_type': 'Bayesian', 'bagging_temperature': 9.232714133185963}. Best is trial 3065 with value: 0.8863636363636364.
[32m[I 2023-04-21 03:11:42,050][39m Trial 5017 finished with value: 0.8275862068965518 and parameters: {'objective': 'CrossEntropy', 'colsample_bylevel': 0.07918425194129165, 'depth': 5, 'boosting_type': 'Ordered', 'bootstrap_type': 'Bayesian', 'bagging_temperature': 9.458766314987693}. Best is trial 3065 with value: 0.8863636363636364.
[32m[I 2023-04-21 03:11:43,071][39m Trial 5018 finished with value: 0.8666666666666666 and parameters: {'objective': 'CrossEntropy', 'colsample_bylevel': 0.08262520778067536, 'depth': 3, 'boosting_type': 'Plain', 'bootstrap_type': 'Bayesian', 'bagging_temperature': 9.40274704199416}. Best is trial 3065 with value: 0.8863636363636364.
[32m[I 2023-04-21 03:11:44,473][39m Trial 5019 finished with value: 0.8409090909090909 and parameters: {'objective': 'CrossEntropy', 'colsample_bylevel': 0.07619295413780566, 'depth': 11, 'boosting_type': 'Plain', 'bootstrap_type': 'Bayesian', 'bagging_temperature': 8.658431351220976}. Best is trial 3065 with value: 0.8863636363636364.
[32m[I 2023-04-21 03:11:45,848][39m Trial 5020 finished with value: 0.8636363636363636 and parameters: {'objective': 'CrossEntropy', 'colsample_bylevel': 0.0789003063397488, 'depth': 9, 'boosting_type': 'Plain', 'bootstrap_type': 'Bayesian', 'bagging_temperature': 9.437696532144749}. Best is trial 3065 with value: 0.8863636363636364.
[32m[I 2023-04-21 03:11:46,891][39m Trial 5021 finished with value: 0.8275862068965518 and parameters: {'objective': 'Logloss', 'colsample_bylevel': 0.07394188125024716, 'depth': 10, 'boosting_type': 'Plain', 'bootstrap_type': 'MVS'}. Best is trial 3065 with value: 0.8863636363636364.
[32m[I 2023-04-21 03:11:48,030][39m Trial 5022 finished with value: 0.7951807228915663 and parameters: {'objective': 'Logloss', 'colsample_bylevel': 0.030616879372024425, 'depth': 10, 'boosting_type': 'Plain', 'bootstrap_type': 'Bayesian', 'bagging_temperature': 9.430167308790843}. Best is trial 3065 with value: 0.8863636363636364.
[32m[I 2023-04-21 03:11:48,891][39m Trial 5023 finished with value: 0.8539325842696629 and parameters: {'objective': 'CrossEntropy', 'colsample_bylevel': 0.08088954145448633, 'depth': 3, 'boosting_type': 'Plain', 'bootstrap_type': 'Bayesian', 'bagging_temperature': 9.435177167958134}. Best is trial 3065 with value: 0.8863636363636364.
[32m[I 2023-04-21 03:11:49,849][39m Trial 5024 finished with value: 0.8539325842696629 and parameters: {'objective': 'CrossEntropy', 'colsample_bylevel': 0.08018984814564578, 'depth': 3, 'boosting_type': 'Plain', 'bootstrap_type': 'Bayesian', 'bagging_temperature': 9.841852335000828}. Best is trial 3065 with value: 0.8863636363636364.
[32m[I 2023-04-21 03:11:50,578][39m Trial 5025 finished with value: 0.8539325842696629 and parameters: {'objective': 'CrossEntropy', 'colsample_bylevel': 0.07877138730370413, 'depth': 10, 'boosting_type': 'Plain', 'bootstrap_type': 'Bayesian', 'bagging_temperature': 9.744468417292772}. Best is trial 3065 with value: 0.8863636363636364.
[32m[I 2023-04-21 03:11:51,461][39m Trial 5026 finished with value: 0.8275862068965518 and parameters: {'objective': 'CrossEntropy', 'colsample_bylevel': 0.08797649399491385, 'depth': 12, 'boosting_type': 'Plain', 'bootstrap_type': 'Bayesian', 'bagging_temperature': 1.224034141793449}. Best is trial 3065 with value: 0.8863636363636364.
[32m[I 2023-04-21 03:11:52,233][39m Trial 5027 finished with value: 0.8409090909090909 and parameters: {'objective': 'CrossEntropy', 'colsample_bylevel': 0.08158411491519332, 'depth': 3, 'boosting_type': 'Plain', 'bootstrap_type': 'Bayesian', 'bagging_temperature': 9.340231081935435}. Best is trial 3065 with value: 0.8863636363636364.
[32m[I 2023-04-21 03:11:53,412][39m Trial 5028 finished with value: 0.8539325842696629 and parameters: {'objective': 'CrossEntropy', 'colsample_bylevel': 0.08105467901606679, 'depth': 2, 'boosting_type': 'Plain', 'bootstrap_type': 'Bayesian', 'bagging_temperature': 9.460101310552476}. Best is trial 3065 with value: 0.8863636363636364.
[32m[I 2023-04-21 03:11:54,813][39m Trial 5029 finished with value: 0.8539325842696629 and parameters: {'objective': 'CrossEntropy', 'colsample_bylevel': 0.07530035175713774, 'depth': 3, 'boosting_type': 'Plain', 'bootstrap_type': 'Bayesian', 'bagging_temperature': 9.513716092645932}. Best is trial 3065 with value: 0.8863636363636364.
[32m[I 2023-04-21 03:11:55,976][39m Trial 5030 finished with value: 0.8666666666666666 and parameters: {'objective': 'CrossEntropy', 'colsample_bylevel': 0.07933008247752389, 'depth': 4, 'boosting_type': 'Plain', 'bootstrap_type': 'Bayesian', 'bagging_temperature': 8.853896613331132}. Best is trial 3065 with value: 0.8863636363636364.
[32m[I 2023-04-21 03:11:57,144][39m Trial 5031 finished with value: 0.8505747126436782 and parameters: {'objective': 'Logloss', 'colsample_bylevel': 0.08168134176249756, 'depth': 11, 'boosting_type': 'Plain', 'bootstrap_type': 'Bayesian', 'bagging_temperature': 9.060352319403265}. Best is trial 3065 with value: 0.8863636363636364.
[32m[I 2023-04-21 03:11:58,014][39m Trial 5032 finished with value: 0.8666666666666666 and parameters: {'objective': 'Logloss', 'colsample_bylevel': 0.08222458662054935, 'depth': 3, 'boosting_type': 'Plain', 'bootstrap_type': 'Bayesian', 'bagging_temperature': 8.662884315151736}. Best is trial 3065 with value: 0.8863636363636364.
[32m[I 2023-04-21 03:11:58,683][39m Trial 5033 finished with value: 0.8666666666666666 and parameters: {'objective': 'Logloss', 'colsample_bylevel': 0.08904516482273021, 'depth': 3, 'boosting_type': 'Plain', 'bootstrap_type': 'Bayesian', 'bagging_temperature': 9.994082143798039}. Best is trial 3065 with value: 0.8863636363636364.
[32m[I 2023-04-21 03:12:03,355][39m Trial 5034 finished with value: 0.8539325842696629 and parameters: {'objective': 'CrossEntropy', 'colsample_bylevel': 0.06694875507206681, 'depth': 7, 'boosting_type': 'Ordered', 'bootstrap_type': 'Bernoulli', 'subsample': 0.3252968620076564}. Best is trial 3065 with value: 0.8863636363636364.
[32m[I 2023-04-21 03:12:04,914][39m Trial 5035 finished with value: 0.8139534883720929 and parameters: {'objective': 'CrossEntropy', 'colsample_bylevel': 0.07245235204054348, 'depth': 9, 'boosting_type': 'Plain', 'bootstrap_type': 'Bayesian', 'bagging_temperature': 8.843546293822081}. Best is trial 3065 with value: 0.8863636363636364.
[32m[I 2023-04-21 03:12:06,344][39m Trial 5036 finished with value: 0.8409090909090909 and parameters: {'objective': 'CrossEntropy', 'colsample_bylevel': 0.08873836117511591, 'depth': 8, 'boosting_type': 'Plain', 'bootstrap_type': 'Bayesian', 'bagging_temperature': 9.970665755330323}. Best is trial 3065 with value: 0.8863636363636364.
[32m[I 2023-04-21 03:12:07,019][39m Trial 5037 finished with value: 0.8409090909090909 and parameters: {'objective': 'CrossEntropy', 'colsample_bylevel': 0.0866845495917676, 'depth': 3, 'boosting_type': 'Plain', 'bootstrap_type': 'Bayesian', 'bagging_temperature': 8.848344810291067}. Best is trial 3065 with value: 0.8863636363636364.
[32m[I 2023-04-21 03:12:07,908][39m Trial 5038 finished with value: 0.8409090909090909 and parameters: {'objective': 'CrossEntropy', 'colsample_bylevel': 0.08998083284182347, 'depth': 3, 'boosting_type': 'Plain', 'bootstrap_type': 'Bayesian', 'bagging_temperature': 8.86541332265037}. Best is trial 3065 with value: 0.8863636363636364.
[32m[I 2023-04-21 03:12:09,245][39m Trial 5039 finished with value: 0.8539325842696629 and parameters: {'objective': 'CrossEntropy', 'colsample_bylevel': 0.07447270663945392, 'depth': 10, 'boosting_type': 'Plain', 'bootstrap_type': 'Bayesian', 'bagging_temperature': 9.629489512410041}. Best is trial 3065 with value: 0.8863636363636364.
[32m[I 2023-04-21 03:12:10,385][39m Trial 5040 finished with value: 0.8505747126436782 and parameters: {'objective': 'CrossEntropy', 'colsample_bylevel': 0.09446989056672953, 'depth': 12, 'boosting_type': 'Plain', 'bootstrap_type': 'Bayesian', 'bagging_temperature': 9.06033489808297}. Best is trial 3065 with value: 0.8863636363636364.
[32m[I 2023-04-21 03:12:11,445][39m Trial 5041 finished with value: 0.8764044943820225 and parameters: {'objective': 'CrossEntropy', 'colsample_bylevel': 0.09495416760420117, 'depth': 2, 'boosting_type': 'Plain', 'bootstrap_type': 'Bayesian', 'bagging_temperature': 9.20785239213041}. Best is trial 3065 with value: 0.8863636363636364.
[32m[I 2023-04-21 03:12:12,724][39m Trial 5042 finished with value: 0.8666666666666666 and parameters: {'objective': 'Logloss', 'colsample_bylevel': 0.07492999999812468, 'depth': 10, 'boosting_type': 'Plain', 'bootstrap_type': 'Bayesian', 'bagging_temperature': 8.136394602262385}. Best is trial 3065 with value: 0.8863636363636364.
[32m[I 2023-04-21 03:12:13,397][39m Trial 5043 finished with value: 0.8409090909090909 and parameters: {'objective': 'CrossEntropy', 'colsample_bylevel': 0.08182374636874815, 'depth': 3, 'boosting_type': 'Plain', 'bootstrap_type': 'Bayesian', 'bagging_temperature': 9.36402209197161}. Best is trial 3065 with value: 0.8863636363636364.
[32m[I 2023-04-21 03:12:14,073][39m Trial 5044 finished with value: 0.8409090909090909 and parameters: {'objective': 'Logloss', 'colsample_bylevel': 0.08338157998627987, 'depth': 4, 'boosting_type': 'Plain', 'bootstrap_type': 'Bayesian', 'bagging_temperature': 9.514758106654334}. Best is trial 3065 with value: 0.8863636363636364.
[32m[I 2023-04-21 03:12:15,062][39m Trial 5045 finished with value: 0.8409090909090909 and parameters: {'objective': 'CrossEntropy', 'colsample_bylevel': 0.074045457256784, 'depth': 9, 'boosting_type': 'Plain', 'bootstrap_type': 'Bayesian', 'bagging_temperature': 7.91938954369903}. Best is trial 3065 with value: 0.8863636363636364.
[32m[I 2023-04-21 03:12:15,960][39m Trial 5046 finished with value: 0.8791208791208791 and parameters: {'objective': 'Logloss', 'colsample_bylevel': 0.0900593923196707, 'depth': 3, 'boosting_type': 'Plain', 'bootstrap_type': 'Bayesian', 'bagging_temperature': 5.666566968501417}. Best is trial 3065 with value: 0.8863636363636364.
[32m[I 2023-04-21 03:12:17,169][39m Trial 5047 finished with value: 0.8539325842696629 and parameters: {'objective': 'CrossEntropy', 'colsample_bylevel': 0.09495089355362302, 'depth': 3, 'boosting_type': 'Plain', 'bootstrap_type': 'Bayesian', 'bagging_temperature': 4.426389033404606}. Best is trial 3065 with value: 0.8863636363636364.
[32m[I 2023-04-21 03:12:18,342][39m Trial 5048 finished with value: 0.8409090909090909 and parameters: {'objective': 'CrossEntropy', 'colsample_bylevel': 0.07879114494308434, 'depth': 10, 'boosting_type': 'Plain', 'bootstrap_type': 'Bayesian', 'bagging_temperature': 9.49187828526139}. Best is trial 3065 with value: 0.8863636363636364.
[32m[I 2023-04-21 03:12:19,518][39m Trial 5049 finished with value: 0.8275862068965518 and parameters: {'objective': 'CrossEntropy', 'colsample_bylevel': 0.07800892221339764, 'depth': 10, 'boosting_type': 'Plain', 'bootstrap_type': 'Bayesian', 'bagging_temperature': 8.526268553656156}. Best is trial 3065 with value: 0.8863636363636364.
[32m[I 2023-04-21 03:12:20,576][39m Trial 5050 finished with value: 0.8409090909090909 and parameters: {'objective': 'CrossEntropy', 'colsample_bylevel': 0.07725637494712917, 'depth': 10, 'boosting_type': 'Plain', 'bootstrap_type': 'Bayesian', 'bagging_temperature': 9.65586720506199}. Best is trial 3065 with value: 0.8863636363636364.
[32m[I 2023-04-21 03:12:21,417][39m Trial 5051 finished with value: 0.8791208791208791 and parameters: {'objective': 'CrossEntropy', 'colsample_bylevel': 0.07835965012770209, 'depth': 10, 'boosting_type': 'Plain', 'bootstrap_type': 'Bayesian', 'bagging_temperature': 8.428902275212177}. Best is trial 3065 with value: 0.8863636363636364.
[32m[I 2023-04-21 03:12:22,460][39m Trial 5052 finished with value: 0.8539325842696629 and parameters: {'objective': 'Logloss', 'colsample_bylevel': 0.0726103382804381, 'depth': 10, 'boosting_type': 'Plain', 'bootstrap_type': 'Bayesian', 'bagging_temperature': 8.80804542332732}. Best is trial 3065 with value: 0.8863636363636364.
[32m[I 2023-04-21 03:12:23,211][39m Trial 5053 finished with value: 0.8275862068965518 and parameters: {'objective': 'CrossEntropy', 'colsample_bylevel': 0.08032857358415971, 'depth': 10, 'boosting_type': 'Plain', 'bootstrap_type': 'Bayesian', 'bagging_temperature': 9.545857933788406}. Best is trial 3065 with value: 0.8863636363636364.
[32m[I 2023-04-21 03:12:24,103][39m Trial 5054 finished with value: 0.8539325842696629 and parameters: {'objective': 'CrossEntropy', 'colsample_bylevel': 0.06670882830726121, 'depth': 6, 'boosting_type': 'Plain', 'bootstrap_type': 'Bayesian', 'bagging_temperature': 9.36258094977}. Best is trial 3065 with value: 0.8863636363636364.
[32m[I 2023-04-21 03:12:29,166][39m Trial 5055 finished with value: 0.8409090909090909 and parameters: {'objective': 'CrossEntropy', 'colsample_bylevel': 0.07810241998725123, 'depth': 10, 'boosting_type': 'Ordered', 'bootstrap_type': 'Bernoulli', 'subsample': 0.7218419372356164}. Best is trial 3065 with value: 0.8863636363636364.
[32m[I 2023-04-21 03:12:30,199][39m Trial 5056 finished with value: 0.8636363636363636 and parameters: {'objective': 'CrossEntropy', 'colsample_bylevel': 0.07354486831673233, 'depth': 10, 'boosting_type': 'Plain', 'bootstrap_type': 'Bayesian', 'bagging_temperature': 9.641750313501817}. Best is trial 3065 with value: 0.8863636363636364.
[32m[I 2023-04-21 03:12:31,418][39m Trial 5057 finished with value: 0.8275862068965518 and parameters: {'objective': 'CrossEntropy', 'colsample_bylevel': 0.07989659571707315, 'depth': 11, 'boosting_type': 'Plain', 'bootstrap_type': 'Bayesian', 'bagging_temperature': 9.022460745301927}. Best is trial 3065 with value: 0.8863636363636364.
[32m[I 2023-04-21 03:12:33,148][39m Trial 5058 finished with value: 0.8409090909090909 and parameters: {'objective': 'Logloss', 'colsample_bylevel': 0.08091905771010388, 'depth': 9, 'boosting_type': 'Plain', 'bootstrap_type': 'Bayesian', 'bagging_temperature': 8.75537230898009}. Best is trial 3065 with value: 0.8863636363636364.
[32m[I 2023-04-21 03:12:34,311][39m Trial 5059 finished with value: 0.8539325842696629 and parameters: {'objective': 'CrossEntropy', 'colsample_bylevel': 0.07924035470336063, 'depth': 11, 'boosting_type': 'Plain', 'bootstrap_type': 'Bayesian', 'bagging_temperature': 9.345220439859617}. Best is trial 3065 with value: 0.8863636363636364.
[32m[I 2023-04-21 03:12:35,186][39m Trial 5060 finished with value: 0.8444444444444446 and parameters: {'objective': 'CrossEntropy', 'colsample_bylevel': 0.07695066601499441, 'depth': 11, 'boosting_type': 'Plain', 'bootstrap_type': 'Bayesian', 'bagging_temperature': 9.345925198534813}. Best is trial 3065 with value: 0.8863636363636364.
[32m[I 2023-04-21 03:12:36,246][39m Trial 5061 finished with value: 0.8666666666666666 and parameters: {'objective': 'CrossEntropy', 'colsample_bylevel': 0.08451089459112018, 'depth': 3, 'boosting_type': 'Plain', 'bootstrap_type': 'Bayesian', 'bagging_temperature': 9.483222919732988}. Best is trial 3065 with value: 0.8863636363636364.
[32m[I 2023-04-21 03:12:37,253][39m Trial 5062 finished with value: 0.8409090909090909 and parameters: {'objective': 'CrossEntropy', 'colsample_bylevel': 0.08055781456763429, 'depth': 9, 'boosting_type': 'Plain', 'bootstrap_type': 'Bayesian', 'bagging_temperature': 9.985176123230968}. Best is trial 3065 with value: 0.8863636363636364.
[32m[I 2023-04-21 03:12:37,967][39m Trial 5063 finished with value: 0.8275862068965518 and parameters: {'objective': 'Logloss', 'colsample_bylevel': 0.0651566040616549, 'depth': 5, 'boosting_type': 'Plain', 'bootstrap_type': 'Bayesian', 'bagging_temperature': 9.179200945056616}. Best is trial 3065 with value: 0.8863636363636364.
[32m[I 2023-04-21 03:12:39,129][39m Trial 5064 finished with value: 0.8444444444444446 and parameters: {'objective': 'CrossEntropy', 'colsample_bylevel': 0.09522407301585475, 'depth': 2, 'boosting_type': 'Plain', 'bootstrap_type': 'Bayesian', 'bagging_temperature': 8.42830377415875}. Best is trial 3065 with value: 0.8863636363636364.
