[32m[I 2023-04-21 03:01:49,605][39m Trial 4544 finished with value: 0.761904761904762 and parameters: {'objective': 'CrossEntropy', 'colsample_bylevel': 0.06263656576880287, 'depth': 1, 'boosting_type': 'Plain', 'bootstrap_type': 'Bayesian', 'bagging_temperature': 9.315112808102171}. Best is trial 3065 with value: 0.8863636363636364.
[32m[I 2023-04-21 03:01:50,821][39m Trial 4545 finished with value: 0.8275862068965518 and parameters: {'objective': 'Logloss', 'colsample_bylevel': 0.08393216788956412, 'depth': 10, 'boosting_type': 'Plain', 'bootstrap_type': 'Bayesian', 'bagging_temperature': 9.527294456266478}. Best is trial 3065 with value: 0.8863636363636364.
[32m[I 2023-04-21 03:01:51,873][39m Trial 4546 finished with value: 0.8539325842696629 and parameters: {'objective': 'CrossEntropy', 'colsample_bylevel': 0.07338352054779022, 'depth': 4, 'boosting_type': 'Plain', 'bootstrap_type': 'Bayesian', 'bagging_temperature': 9.786395208262173}. Best is trial 3065 with value: 0.8863636363636364.
[32m[I 2023-04-21 03:01:53,156][39m Trial 4547 finished with value: 0.8139534883720929 and parameters: {'objective': 'CrossEntropy', 'colsample_bylevel': 0.0724435344372145, 'depth': 10, 'boosting_type': 'Plain', 'bootstrap_type': 'Bayesian', 'bagging_temperature': 9.765553967144456}. Best is trial 3065 with value: 0.8863636363636364.
[32m[I 2023-04-21 03:01:57,974][39m Trial 4548 finished with value: 0.8222222222222222 and parameters: {'objective': 'CrossEntropy', 'colsample_bylevel': 0.06699728112802955, 'depth': 7, 'boosting_type': 'Ordered', 'bootstrap_type': 'Bernoulli', 'subsample': 0.5538536234015559}. Best is trial 3065 with value: 0.8863636363636364.
[32m[I 2023-04-21 03:01:59,232][39m Trial 4549 finished with value: 0.8539325842696629 and parameters: {'objective': 'CrossEntropy', 'colsample_bylevel': 0.07883596734306449, 'depth': 10, 'boosting_type': 'Plain', 'bootstrap_type': 'Bayesian', 'bagging_temperature': 9.543811529593722}. Best is trial 3065 with value: 0.8863636363636364.
[32m[I 2023-04-21 03:02:00,476][39m Trial 4550 finished with value: 0.8539325842696629 and parameters: {'objective': 'Logloss', 'colsample_bylevel': 0.06846899737145924, 'depth': 8, 'boosting_type': 'Plain', 'bootstrap_type': 'Bayesian', 'bagging_temperature': 8.977137357254504}. Best is trial 3065 with value: 0.8863636363636364.
[32m[I 2023-04-21 03:02:01,572][39m Trial 4551 finished with value: 0.8409090909090909 and parameters: {'objective': 'CrossEntropy', 'colsample_bylevel': 0.0924899267477343, 'depth': 10, 'boosting_type': 'Plain', 'bootstrap_type': 'Bayesian', 'bagging_temperature': 9.656835093453642}. Best is trial 3065 with value: 0.8863636363636364.
[32m[I 2023-04-21 03:02:02,685][39m Trial 4552 finished with value: 0.8409090909090909 and parameters: {'objective': 'CrossEntropy', 'colsample_bylevel': 0.06478539675685083, 'depth': 3, 'boosting_type': 'Plain', 'bootstrap_type': 'MVS'}. Best is trial 3065 with value: 0.8863636363636364.
[32m[I 2023-04-21 03:02:03,393][39m Trial 4553 finished with value: 0.8791208791208791 and parameters: {'objective': 'CrossEntropy', 'colsample_bylevel': 0.08287616682211223, 'depth': 3, 'boosting_type': 'Plain', 'bootstrap_type': 'Bayesian', 'bagging_temperature': 9.53589003626266}. Best is trial 3065 with value: 0.8863636363636364.
[32m[I 2023-04-21 03:02:04,164][39m Trial 4554 finished with value: 0.8275862068965518 and parameters: {'objective': 'CrossEntropy', 'colsample_bylevel': 0.08494254785174686, 'depth': 8, 'boosting_type': 'Plain', 'bootstrap_type': 'Bayesian', 'bagging_temperature': 9.083104482403474}. Best is trial 3065 with value: 0.8863636363636364.
[32m[I 2023-04-21 03:02:05,410][39m Trial 4555 finished with value: 0.8409090909090909 and parameters: {'objective': 'CrossEntropy', 'colsample_bylevel': 0.07433446774095684, 'depth': 5, 'boosting_type': 'Plain', 'bootstrap_type': 'Bayesian', 'bagging_temperature': 9.283603514426929}. Best is trial 3065 with value: 0.8863636363636364.
[32m[I 2023-04-21 03:02:06,672][39m Trial 4556 finished with value: 0.8539325842696629 and parameters: {'objective': 'CrossEntropy', 'colsample_bylevel': 0.07436868012002017, 'depth': 10, 'boosting_type': 'Plain', 'bootstrap_type': 'Bayesian', 'bagging_temperature': 9.670141361498816}. Best is trial 3065 with value: 0.8863636363636364.
[32m[I 2023-04-21 03:02:07,790][39m Trial 4557 finished with value: 0.8275862068965518 and parameters: {'objective': 'CrossEntropy', 'colsample_bylevel': 0.07239320270689577, 'depth': 10, 'boosting_type': 'Plain', 'bootstrap_type': 'Bayesian', 'bagging_temperature': 9.581510954624605}. Best is trial 3065 with value: 0.8863636363636364.
[32m[I 2023-04-21 03:02:08,773][39m Trial 4558 finished with value: 0.7380952380952381 and parameters: {'objective': 'Logloss', 'colsample_bylevel': 0.02829830019245765, 'depth': 3, 'boosting_type': 'Plain', 'bootstrap_type': 'Bayesian', 'bagging_temperature': 9.797039774873646}. Best is trial 3065 with value: 0.8863636363636364.
[32m[I 2023-04-21 03:02:09,598][39m Trial 4559 finished with value: 0.8314606741573034 and parameters: {'objective': 'CrossEntropy', 'colsample_bylevel': 0.07711231072866984, 'depth': 2, 'boosting_type': 'Plain', 'bootstrap_type': 'Bayesian', 'bagging_temperature': 3.2627783792979237}. Best is trial 3065 with value: 0.8863636363636364.
[32m[I 2023-04-21 03:02:10,264][39m Trial 4560 finished with value: 0.8275862068965518 and parameters: {'objective': 'CrossEntropy', 'colsample_bylevel': 0.07431440761667983, 'depth': 11, 'boosting_type': 'Plain', 'bootstrap_type': 'Bayesian', 'bagging_temperature': 0.7112915948084906}. Best is trial 3065 with value: 0.8863636363636364.
[32m[I 2023-04-21 03:02:11,079][39m Trial 4561 finished with value: 0.8666666666666666 and parameters: {'objective': 'CrossEntropy', 'colsample_bylevel': 0.07342495867246278, 'depth': 11, 'boosting_type': 'Plain', 'bootstrap_type': 'Bayesian', 'bagging_temperature': 9.695224500523405}. Best is trial 3065 with value: 0.8863636363636364.
[32m[I 2023-04-21 03:02:12,244][39m Trial 4562 finished with value: 0.8275862068965518 and parameters: {'objective': 'CrossEntropy', 'colsample_bylevel': 0.08601897220973583, 'depth': 8, 'boosting_type': 'Plain', 'bootstrap_type': 'Bayesian', 'bagging_temperature': 8.976001006576144}. Best is trial 3065 with value: 0.8863636363636364.
[32m[I 2023-04-21 03:02:13,632][39m Trial 4563 finished with value: 0.8275862068965518 and parameters: {'objective': 'CrossEntropy', 'colsample_bylevel': 0.07908548636699234, 'depth': 10, 'boosting_type': 'Plain', 'bootstrap_type': 'Bayesian', 'bagging_temperature': 9.329399077293743}. Best is trial 3065 with value: 0.8863636363636364.
[32m[I 2023-04-21 03:02:14,604][39m Trial 4564 finished with value: 0.8539325842696629 and parameters: {'objective': 'CrossEntropy', 'colsample_bylevel': 0.06910718677434573, 'depth': 10, 'boosting_type': 'Plain', 'bootstrap_type': 'Bayesian', 'bagging_temperature': 9.086960038222248}. Best is trial 3065 with value: 0.8863636363636364.
[32m[I 2023-04-21 03:02:15,609][39m Trial 4565 finished with value: 0.8666666666666666 and parameters: {'objective': 'Logloss', 'colsample_bylevel': 0.08160082361058306, 'depth': 3, 'boosting_type': 'Plain', 'bootstrap_type': 'Bayesian', 'bagging_temperature': 9.838743791948637}. Best is trial 3065 with value: 0.8863636363636364.
[32m[I 2023-04-21 03:02:16,630][39m Trial 4566 finished with value: 0.8409090909090909 and parameters: {'objective': 'Logloss', 'colsample_bylevel': 0.07483181542569495, 'depth': 10, 'boosting_type': 'Plain', 'bootstrap_type': 'MVS'}. Best is trial 3065 with value: 0.8863636363636364.
[32m[I 2023-04-21 03:02:17,627][39m Trial 4567 finished with value: 0.8409090909090909 and parameters: {'objective': 'CrossEntropy', 'colsample_bylevel': 0.07816600401736679, 'depth': 4, 'boosting_type': 'Plain', 'bootstrap_type': 'Bayesian', 'bagging_temperature': 9.576975440681757}. Best is trial 3065 with value: 0.8863636363636364.
[32m[I 2023-04-21 03:02:22,266][39m Trial 4568 finished with value: 0.7999999999999999 and parameters: {'objective': 'CrossEntropy', 'colsample_bylevel': 0.07835989671654071, 'depth': 4, 'boosting_type': 'Ordered', 'bootstrap_type': 'Bayesian', 'bagging_temperature': 9.825203736840962}. Best is trial 3065 with value: 0.8863636363636364.
[32m[I 2023-04-21 03:02:23,407][39m Trial 4569 finished with value: 0.8275862068965518 and parameters: {'objective': 'CrossEntropy', 'colsample_bylevel': 0.09752521299177544, 'depth': 3, 'boosting_type': 'Plain', 'bootstrap_type': 'Bayesian', 'bagging_temperature': 6.535091108328745}. Best is trial 3065 with value: 0.8863636363636364.
[32m[I 2023-04-21 03:02:24,510][39m Trial 4570 finished with value: 0.8409090909090909 and parameters: {'objective': 'Logloss', 'colsample_bylevel': 0.06968964398908559, 'depth': 12, 'boosting_type': 'Plain', 'bootstrap_type': 'MVS'}. Best is trial 3065 with value: 0.8863636363636364.
[32m[I 2023-04-21 03:02:25,884][39m Trial 4571 finished with value: 0.8409090909090909 and parameters: {'objective': 'Logloss', 'colsample_bylevel': 0.07103724153939575, 'depth': 11, 'boosting_type': 'Plain', 'bootstrap_type': 'Bernoulli', 'subsample': 0.6113684813994447}. Best is trial 3065 with value: 0.8863636363636364.
[32m[I 2023-04-21 03:02:26,570][39m Trial 4572 finished with value: 0.8666666666666666 and parameters: {'objective': 'Logloss', 'colsample_bylevel': 0.07099395251059193, 'depth': 11, 'boosting_type': 'Plain', 'bootstrap_type': 'Bayesian', 'bagging_temperature': 8.331399456919282}. Best is trial 3065 with value: 0.8863636363636364.
[32m[I 2023-04-21 03:02:27,471][39m Trial 4573 finished with value: 0.8539325842696629 and parameters: {'objective': 'Logloss', 'colsample_bylevel': 0.07330270970428562, 'depth': 11, 'boosting_type': 'Plain', 'bootstrap_type': 'Bayesian', 'bagging_temperature': 7.7379352790530165}. Best is trial 3065 with value: 0.8863636363636364.
[32m[I 2023-04-21 03:02:28,917][39m Trial 4574 finished with value: 0.8409090909090909 and parameters: {'objective': 'CrossEntropy', 'colsample_bylevel': 0.09440544050920706, 'depth': 8, 'boosting_type': 'Plain', 'bootstrap_type': 'Bayesian', 'bagging_temperature': 8.895228840130553}. Best is trial 3065 with value: 0.8863636363636364.
[32m[I 2023-04-21 03:02:29,900][39m Trial 4575 finished with value: 0.8539325842696629 and parameters: {'objective': 'CrossEntropy', 'colsample_bylevel': 0.08224182109054248, 'depth': 3, 'boosting_type': 'Plain', 'bootstrap_type': 'Bayesian', 'bagging_temperature': 9.682109084200341}. Best is trial 3065 with value: 0.8863636363636364.
[32m[I 2023-04-21 03:02:30,930][39m Trial 4576 finished with value: 0.8409090909090909 and parameters: {'objective': 'CrossEntropy', 'colsample_bylevel': 0.07740747986749026, 'depth': 4, 'boosting_type': 'Plain', 'bootstrap_type': 'Bayesian', 'bagging_temperature': 9.07204393055145}. Best is trial 3065 with value: 0.8863636363636364.
[32m[I 2023-04-21 03:02:32,008][39m Trial 4577 finished with value: 0.8275862068965518 and parameters: {'objective': 'CrossEntropy', 'colsample_bylevel': 0.08556109920409972, 'depth': 3, 'boosting_type': 'Plain', 'bootstrap_type': 'Bayesian', 'bagging_temperature': 9.649279555659097}. Best is trial 3065 with value: 0.8863636363636364.
[32m[I 2023-04-21 03:02:32,866][39m Trial 4578 finished with value: 0.8409090909090909 and parameters: {'objective': 'Logloss', 'colsample_bylevel': 0.0757112471523987, 'depth': 10, 'boosting_type': 'Plain', 'bootstrap_type': 'Bayesian', 'bagging_temperature': 8.55010669135453}. Best is trial 3065 with value: 0.8863636363636364.
[32m[I 2023-04-21 03:02:33,542][39m Trial 4579 finished with value: 0.8409090909090909 and parameters: {'objective': 'CrossEntropy', 'colsample_bylevel': 0.09568345055939892, 'depth': 4, 'boosting_type': 'Plain', 'bootstrap_type': 'Bayesian', 'bagging_temperature': 9.971557069727677}. Best is trial 3065 with value: 0.8863636363636364.
[32m[I 2023-04-21 03:02:34,381][39m Trial 4580 finished with value: 0.8409090909090909 and parameters: {'objective': 'CrossEntropy', 'colsample_bylevel': 0.09772564581209511, 'depth': 4, 'boosting_type': 'Plain', 'bootstrap_type': 'Bayesian', 'bagging_temperature': 9.981785701935465}. Best is trial 3065 with value: 0.8863636363636364.
[32m[I 2023-04-21 03:02:35,335][39m Trial 4581 finished with value: 0.8409090909090909 and parameters: {'objective': 'Logloss', 'colsample_bylevel': 0.07961280423346477, 'depth': 3, 'boosting_type': 'Plain', 'bootstrap_type': 'Bayesian', 'bagging_temperature': 8.921200617659522}. Best is trial 3065 with value: 0.8863636363636364.
[32m[I 2023-04-21 03:02:36,469][39m Trial 4582 finished with value: 0.8139534883720929 and parameters: {'objective': 'CrossEntropy', 'colsample_bylevel': 0.07388043003904532, 'depth': 1, 'boosting_type': 'Plain', 'bootstrap_type': 'Bayesian', 'bagging_temperature': 9.831807497521211}. Best is trial 3065 with value: 0.8863636363636364.
[32m[I 2023-04-21 03:02:37,598][39m Trial 4583 finished with value: 0.8666666666666666 and parameters: {'objective': 'CrossEntropy', 'colsample_bylevel': 0.05950612484912386, 'depth': 3, 'boosting_type': 'Plain', 'bootstrap_type': 'Bayesian', 'bagging_temperature': 9.994617188489778}. Best is trial 3065 with value: 0.8863636363636364.
[32m[I 2023-04-21 03:02:38,632][39m Trial 4584 finished with value: 0.8666666666666666 and parameters: {'objective': 'CrossEntropy', 'colsample_bylevel': 0.08068171867162625, 'depth': 3, 'boosting_type': 'Plain', 'bootstrap_type': 'Bayesian', 'bagging_temperature': 9.106652863540399}. Best is trial 3065 with value: 0.8863636363636364.
[32m[I 2023-04-21 03:02:39,482][39m Trial 4585 finished with value: 0.8636363636363636 and parameters: {'objective': 'CrossEntropy', 'colsample_bylevel': 0.07997148914143201, 'depth': 10, 'boosting_type': 'Plain', 'bootstrap_type': 'Bayesian', 'bagging_temperature': 9.371318371293539}. Best is trial 3065 with value: 0.8863636363636364.
[32m[I 2023-04-21 03:02:40,335][39m Trial 4586 finished with value: 0.8539325842696629 and parameters: {'objective': 'CrossEntropy', 'colsample_bylevel': 0.06924532529923033, 'depth': 4, 'boosting_type': 'Plain', 'bootstrap_type': 'Bayesian', 'bagging_temperature': 8.869911882070912}. Best is trial 3065 with value: 0.8863636363636364.
[32m[I 2023-04-21 03:02:40,995][39m Trial 4587 finished with value: 0.8409090909090909 and parameters: {'objective': 'CrossEntropy', 'colsample_bylevel': 0.08049242161253398, 'depth': 2, 'boosting_type': 'Plain', 'bootstrap_type': 'MVS'}. Best is trial 3065 with value: 0.8863636363636364.
[32m[I 2023-04-21 03:02:42,263][39m Trial 4588 finished with value: 0.8409090909090909 and parameters: {'objective': 'CrossEntropy', 'colsample_bylevel': 0.08471864755826795, 'depth': 11, 'boosting_type': 'Plain', 'bootstrap_type': 'Bayesian', 'bagging_temperature': 9.813731558878608}. Best is trial 3065 with value: 0.8863636363636364.
[32m[I 2023-04-21 03:02:47,282][39m Trial 4589 finished with value: 0.8409090909090909 and parameters: {'objective': 'CrossEntropy', 'colsample_bylevel': 0.06816090433107991, 'depth': 12, 'boosting_type': 'Ordered', 'bootstrap_type': 'Bayesian', 'bagging_temperature': 8.957419065539359}. Best is trial 3065 with value: 0.8863636363636364.
[32m[I 2023-04-21 03:02:48,618][39m Trial 4590 finished with value: 0.8636363636363636 and parameters: {'objective': 'CrossEntropy', 'colsample_bylevel': 0.08704100392794704, 'depth': 11, 'boosting_type': 'Plain', 'bootstrap_type': 'Bayesian', 'bagging_temperature': 9.350717392695048}. Best is trial 3065 with value: 0.8863636363636364.
[32m[I 2023-04-21 03:02:49,672][39m Trial 4591 finished with value: 0.8275862068965518 and parameters: {'objective': 'CrossEntropy', 'colsample_bylevel': 0.06300515321045624, 'depth': 10, 'boosting_type': 'Plain', 'bootstrap_type': 'Bayesian', 'bagging_temperature': 8.665836804297838}. Best is trial 3065 with value: 0.8863636363636364.
[32m[I 2023-04-21 03:02:50,701][39m Trial 4592 finished with value: 0.8314606741573034 and parameters: {'objective': 'CrossEntropy', 'colsample_bylevel': 0.08150199656287724, 'depth': 3, 'boosting_type': 'Plain', 'bootstrap_type': 'Bayesian', 'bagging_temperature': 1.4672932452510237}. Best is trial 3065 with value: 0.8863636363636364.
[32m[I 2023-04-21 03:02:52,016][39m Trial 4593 finished with value: 0.8666666666666666 and parameters: {'objective': 'CrossEntropy', 'colsample_bylevel': 0.07065218855393463, 'depth': 8, 'boosting_type': 'Plain', 'bootstrap_type': 'Bayesian', 'bagging_temperature': 9.138946622945067}. Best is trial 3065 with value: 0.8863636363636364.
[32m[I 2023-04-21 03:02:53,009][39m Trial 4594 finished with value: 0.8275862068965518 and parameters: {'objective': 'CrossEntropy', 'colsample_bylevel': 0.07712925890451225, 'depth': 4, 'boosting_type': 'Plain', 'bootstrap_type': 'Bernoulli', 'subsample': 0.5180745328623314}. Best is trial 3065 with value: 0.8863636363636364.
[32m[I 2023-04-21 03:02:53,978][39m Trial 4595 finished with value: 0.8372093023255814 and parameters: {'objective': 'CrossEntropy', 'colsample_bylevel': 0.0832934747310455, 'depth': 12, 'boosting_type': 'Plain', 'bootstrap_type': 'Bayesian', 'bagging_temperature': 9.10902459781497}. Best is trial 3065 with value: 0.8863636363636364.
[32m[I 2023-04-21 03:02:54,639][39m Trial 4596 finished with value: 0.8539325842696629 and parameters: {'objective': 'CrossEntropy', 'colsample_bylevel': 0.07304365751463522, 'depth': 4, 'boosting_type': 'Plain', 'bootstrap_type': 'Bayesian', 'bagging_temperature': 9.750744035981553}. Best is trial 3065 with value: 0.8863636363636364.
[32m[I 2023-04-21 03:02:55,491][39m Trial 4597 finished with value: 0.8539325842696629 and parameters: {'objective': 'Logloss', 'colsample_bylevel': 0.08027930027567397, 'depth': 4, 'boosting_type': 'Plain', 'bootstrap_type': 'Bayesian', 'bagging_temperature': 8.847139565797075}. Best is trial 3065 with value: 0.8863636363636364.
[32m[I 2023-04-21 03:02:56,458][39m Trial 4598 finished with value: 0.8409090909090909 and parameters: {'objective': 'Logloss', 'colsample_bylevel': 0.07410690612450291, 'depth': 10, 'boosting_type': 'Plain', 'bootstrap_type': 'Bayesian', 'bagging_temperature': 9.276552292974172}. Best is trial 3065 with value: 0.8863636363636364.
[32m[I 2023-04-21 03:02:57,500][39m Trial 4599 finished with value: 0.8275862068965518 and parameters: {'objective': 'CrossEntropy', 'colsample_bylevel': 0.07550544012156438, 'depth': 5, 'boosting_type': 'Plain', 'bootstrap_type': 'MVS'}. Best is trial 3065 with value: 0.8863636363636364.
[32m[I 2023-04-21 03:02:58,413][39m Trial 4600 finished with value: 0.8409090909090909 and parameters: {'objective': 'CrossEntropy', 'colsample_bylevel': 0.08806239222022959, 'depth': 2, 'boosting_type': 'Plain', 'bootstrap_type': 'Bayesian', 'bagging_temperature': 8.1368383981969}. Best is trial 3065 with value: 0.8863636363636364.
[32m[I 2023-04-21 03:02:59,435][39m Trial 4601 finished with value: 0.8409090909090909 and parameters: {'objective': 'CrossEntropy', 'colsample_bylevel': 0.07909329515742175, 'depth': 3, 'boosting_type': 'Plain', 'bootstrap_type': 'Bayesian', 'bagging_temperature': 8.65838889479676}. Best is trial 3065 with value: 0.8863636363636364.
[32m[I 2023-04-21 03:03:00,465][39m Trial 4602 finished with value: 0.8539325842696629 and parameters: {'objective': 'CrossEntropy', 'colsample_bylevel': 0.08945620393773682, 'depth': 3, 'boosting_type': 'Plain', 'bootstrap_type': 'Bayesian', 'bagging_temperature': 9.969317942611625}. Best is trial 3065 with value: 0.8863636363636364.
[32m[I 2023-04-21 03:03:05,387][39m Trial 4603 finished with value: 0.8275862068965518 and parameters: {'objective': 'CrossEntropy', 'colsample_bylevel': 0.0763348332549458, 'depth': 9, 'boosting_type': 'Ordered', 'bootstrap_type': 'Bayesian', 'bagging_temperature': 2.382839633999918}. Best is trial 3065 with value: 0.8863636363636364.
[32m[I 2023-04-21 03:03:06,560][39m Trial 4604 finished with value: 0.8275862068965518 and parameters: {'objective': 'CrossEntropy', 'colsample_bylevel': 0.07644608473871088, 'depth': 10, 'boosting_type': 'Plain', 'bootstrap_type': 'Bayesian', 'bagging_temperature': 9.346568803252914}. Best is trial 3065 with value: 0.8863636363636364.
[32m[I 2023-04-21 03:03:07,561][39m Trial 4605 finished with value: 0.8539325842696629 and parameters: {'objective': 'Logloss', 'colsample_bylevel': 0.08101244582073208, 'depth': 3, 'boosting_type': 'Plain', 'bootstrap_type': 'Bayesian', 'bagging_temperature': 9.051680516083891}. Best is trial 3065 with value: 0.8863636363636364.
[32m[I 2023-04-21 03:03:08,623][39m Trial 4606 finished with value: 0.8409090909090909 and parameters: {'objective': 'CrossEntropy', 'colsample_bylevel': 0.09195705848216514, 'depth': 3, 'boosting_type': 'Plain', 'bootstrap_type': 'Bayesian', 'bagging_temperature': 8.382282063217469}. Best is trial 3065 with value: 0.8863636363636364.
[32m[I 2023-04-21 03:03:09,915][39m Trial 4607 finished with value: 0.8409090909090909 and parameters: {'objective': 'CrossEntropy', 'colsample_bylevel': 0.07678005845555035, 'depth': 10, 'boosting_type': 'Plain', 'bootstrap_type': 'Bayesian', 'bagging_temperature': 9.982704956150423}. Best is trial 3065 with value: 0.8863636363636364.
[32m[I 2023-04-21 03:03:10,930][39m Trial 4608 finished with value: 0.8409090909090909 and parameters: {'objective': 'CrossEntropy', 'colsample_bylevel': 0.06608206923774569, 'depth': 8, 'boosting_type': 'Plain', 'bootstrap_type': 'Bayesian', 'bagging_temperature': 8.901574461204277}. Best is trial 3065 with value: 0.8863636363636364.
