[32m[I 2023-04-21 01:49:31,249][39m Trial 794 finished with value: 0.8666666666666666 and parameters: {'objective': 'CrossEntropy', 'colsample_bylevel': 0.0951470863646118, 'depth': 3, 'boosting_type': 'Plain', 'bootstrap_type': 'Bayesian', 'bagging_temperature': 9.287730072597654}. Best is trial 98 with value: 0.8791208791208791.
[32m[I 2023-04-21 01:49:36,360][39m Trial 795 finished with value: 0.8275862068965518 and parameters: {'objective': 'CrossEntropy', 'colsample_bylevel': 0.09303326339680526, 'depth': 4, 'boosting_type': 'Ordered', 'bootstrap_type': 'Bayesian', 'bagging_temperature': 8.396723909436284}. Best is trial 98 with value: 0.8791208791208791.
[32m[I 2023-04-21 01:49:37,285][39m Trial 796 finished with value: 0.8539325842696629 and parameters: {'objective': 'CrossEntropy', 'colsample_bylevel': 0.0828899952112445, 'depth': 3, 'boosting_type': 'Plain', 'bootstrap_type': 'Bayesian', 'bagging_temperature': 9.997507410662571}. Best is trial 98 with value: 0.8791208791208791.
[32m[I 2023-04-21 01:49:38,280][39m Trial 797 finished with value: 0.8139534883720929 and parameters: {'objective': 'CrossEntropy', 'colsample_bylevel': 0.08784662772550796, 'depth': 3, 'boosting_type': 'Plain', 'bootstrap_type': 'Bayesian', 'bagging_temperature': 8.823734388515136}. Best is trial 98 with value: 0.8791208791208791.
[32m[I 2023-04-21 01:49:38,913][39m Trial 798 finished with value: 0.8539325842696629 and parameters: {'objective': 'CrossEntropy', 'colsample_bylevel': 0.09007214575697925, 'depth': 3, 'boosting_type': 'Plain', 'bootstrap_type': 'Bayesian', 'bagging_temperature': 8.594128183029843}. Best is trial 98 with value: 0.8791208791208791.
[32m[I 2023-04-21 01:49:39,880][39m Trial 799 finished with value: 0.8539325842696629 and parameters: {'objective': 'CrossEntropy', 'colsample_bylevel': 0.09323189215612672, 'depth': 3, 'boosting_type': 'Plain', 'bootstrap_type': 'Bayesian', 'bagging_temperature': 8.015057383555236}. Best is trial 98 with value: 0.8791208791208791.
[32m[I 2023-04-21 01:49:40,696][39m Trial 800 finished with value: 0.8791208791208791 and parameters: {'objective': 'CrossEntropy', 'colsample_bylevel': 0.09200919785240418, 'depth': 3, 'boosting_type': 'Plain', 'bootstrap_type': 'Bayesian', 'bagging_temperature': 9.986204303233196}. Best is trial 98 with value: 0.8791208791208791.
[32m[I 2023-04-21 01:49:41,521][39m Trial 801 finished with value: 0.8409090909090909 and parameters: {'objective': 'CrossEntropy', 'colsample_bylevel': 0.0952978466652059, 'depth': 3, 'boosting_type': 'Plain', 'bootstrap_type': 'Bayesian', 'bagging_temperature': 9.716808878210001}. Best is trial 98 with value: 0.8791208791208791.
[32m[I 2023-04-21 01:49:42,494][39m Trial 802 finished with value: 0.8539325842696629 and parameters: {'objective': 'CrossEntropy', 'colsample_bylevel': 0.0925721569439664, 'depth': 3, 'boosting_type': 'Plain', 'bootstrap_type': 'Bayesian', 'bagging_temperature': 9.977396478352844}. Best is trial 98 with value: 0.8791208791208791.
[32m[I 2023-04-21 01:49:43,351][39m Trial 803 finished with value: 0.8666666666666666 and parameters: {'objective': 'CrossEntropy', 'colsample_bylevel': 0.0906558480697895, 'depth': 4, 'boosting_type': 'Plain', 'bootstrap_type': 'Bayesian', 'bagging_temperature': 8.415424983816436}. Best is trial 98 with value: 0.8791208791208791.
[32m[I 2023-04-21 01:49:43,993][39m Trial 804 finished with value: 0.8409090909090909 and parameters: {'objective': 'CrossEntropy', 'colsample_bylevel': 0.09225982698126646, 'depth': 3, 'boosting_type': 'Plain', 'bootstrap_type': 'Bayesian', 'bagging_temperature': 8.17258064672372}. Best is trial 98 with value: 0.8791208791208791.
[32m[I 2023-04-21 01:49:44,798][39m Trial 805 finished with value: 0.8539325842696629 and parameters: {'objective': 'CrossEntropy', 'colsample_bylevel': 0.09393157614626386, 'depth': 3, 'boosting_type': 'Plain', 'bootstrap_type': 'Bayesian', 'bagging_temperature': 9.88834889314519}. Best is trial 98 with value: 0.8791208791208791.
[32m[I 2023-04-21 01:49:45,635][39m Trial 806 finished with value: 0.8409090909090909 and parameters: {'objective': 'CrossEntropy', 'colsample_bylevel': 0.08220408221913293, 'depth': 3, 'boosting_type': 'Plain', 'bootstrap_type': 'Bayesian', 'bagging_temperature': 9.511665708741507}. Best is trial 98 with value: 0.8791208791208791.
[32m[I 2023-04-21 01:49:46,637][39m Trial 807 finished with value: 0.8275862068965518 and parameters: {'objective': 'CrossEntropy', 'colsample_bylevel': 0.09695649503785934, 'depth': 3, 'boosting_type': 'Plain', 'bootstrap_type': 'Bayesian', 'bagging_temperature': 9.793273836914617}. Best is trial 98 with value: 0.8791208791208791.
[32m[I 2023-04-21 01:49:47,300][39m Trial 808 finished with value: 0.8409090909090909 and parameters: {'objective': 'CrossEntropy', 'colsample_bylevel': 0.0843615669976482, 'depth': 3, 'boosting_type': 'Plain', 'bootstrap_type': 'Bernoulli', 'subsample': 0.9292237863853396}. Best is trial 98 with value: 0.8791208791208791.
[32m[I 2023-04-21 01:49:48,259][39m Trial 809 finished with value: 0.8409090909090909 and parameters: {'objective': 'CrossEntropy', 'colsample_bylevel': 0.08759799289476113, 'depth': 11, 'boosting_type': 'Plain', 'bootstrap_type': 'Bayesian', 'bagging_temperature': 8.850927673476336}. Best is trial 98 with value: 0.8791208791208791.
[32m[I 2023-04-21 01:49:49,155][39m Trial 810 finished with value: 0.8539325842696629 and parameters: {'objective': 'CrossEntropy', 'colsample_bylevel': 0.08939032555587623, 'depth': 3, 'boosting_type': 'Plain', 'bootstrap_type': 'Bayesian', 'bagging_temperature': 8.938871146668104}. Best is trial 98 with value: 0.8791208791208791.
[32m[I 2023-04-21 01:49:50,197][39m Trial 811 finished with value: 0.8314606741573034 and parameters: {'objective': 'CrossEntropy', 'colsample_bylevel': 0.08330071573311716, 'depth': 4, 'boosting_type': 'Plain', 'bootstrap_type': 'Bayesian', 'bagging_temperature': 9.954711622615264}. Best is trial 98 with value: 0.8791208791208791.
[32m[I 2023-04-21 01:49:51,362][39m Trial 812 finished with value: 0.8139534883720929 and parameters: {'objective': 'CrossEntropy', 'colsample_bylevel': 0.09623173552222833, 'depth': 3, 'boosting_type': 'Plain', 'bootstrap_type': 'Bayesian', 'bagging_temperature': 9.978595401174584}. Best is trial 98 with value: 0.8791208791208791.
[32m[I 2023-04-21 01:49:52,478][39m Trial 813 finished with value: 0.8275862068965518 and parameters: {'objective': 'CrossEntropy', 'colsample_bylevel': 0.0959920428911235, 'depth': 3, 'boosting_type': 'Plain', 'bootstrap_type': 'Bayesian', 'bagging_temperature': 9.734762712315955}. Best is trial 98 with value: 0.8791208791208791.
[32m[I 2023-04-21 01:49:53,227][39m Trial 814 finished with value: 0.8372093023255814 and parameters: {'objective': 'CrossEntropy', 'colsample_bylevel': 0.09886097672168387, 'depth': 3, 'boosting_type': 'Plain', 'bootstrap_type': 'Bayesian', 'bagging_temperature': 9.697694611983977}. Best is trial 98 with value: 0.8791208791208791.
[32m[I 2023-04-21 01:49:53,898][39m Trial 815 finished with value: 0.8275862068965518 and parameters: {'objective': 'CrossEntropy', 'colsample_bylevel': 0.09166109157430422, 'depth': 3, 'boosting_type': 'Plain', 'bootstrap_type': 'MVS'}. Best is trial 98 with value: 0.8791208791208791.
[32m[I 2023-04-21 01:49:58,714][39m Trial 816 finished with value: 0.8139534883720929 and parameters: {'objective': 'CrossEntropy', 'colsample_bylevel': 0.08374207811680415, 'depth': 4, 'boosting_type': 'Ordered', 'bootstrap_type': 'Bayesian', 'bagging_temperature': 9.044891104719861}. Best is trial 98 with value: 0.8791208791208791.
[32m[I 2023-04-21 01:49:59,543][39m Trial 817 finished with value: 0.8275862068965518 and parameters: {'objective': 'CrossEntropy', 'colsample_bylevel': 0.09173109016731179, 'depth': 3, 'boosting_type': 'Plain', 'bootstrap_type': 'Bayesian', 'bagging_temperature': 9.664624128882101}. Best is trial 98 with value: 0.8791208791208791.
[32m[I 2023-04-21 01:50:00,490][39m Trial 818 finished with value: 0.8539325842696629 and parameters: {'objective': 'Logloss', 'colsample_bylevel': 0.07562262027909343, 'depth': 3, 'boosting_type': 'Plain', 'bootstrap_type': 'Bayesian', 'bagging_temperature': 9.97864377865951}. Best is trial 98 with value: 0.8791208791208791.
[32m[I 2023-04-21 01:50:01,190][39m Trial 819 finished with value: 0.8539325842696629 and parameters: {'objective': 'CrossEntropy', 'colsample_bylevel': 0.09342592107289507, 'depth': 3, 'boosting_type': 'Plain', 'bootstrap_type': 'Bayesian', 'bagging_temperature': 8.642909905280103}. Best is trial 98 with value: 0.8791208791208791.
[32m[I 2023-04-21 01:50:02,021][39m Trial 820 finished with value: 0.8139534883720929 and parameters: {'objective': 'CrossEntropy', 'colsample_bylevel': 0.09210891890009099, 'depth': 7, 'boosting_type': 'Plain', 'bootstrap_type': 'Bayesian', 'bagging_temperature': 3.8586811022289877}. Best is trial 98 with value: 0.8791208791208791.
[32m[I 2023-04-21 01:50:03,230][39m Trial 821 finished with value: 0.8539325842696629 and parameters: {'objective': 'CrossEntropy', 'colsample_bylevel': 0.09152049029206841, 'depth': 12, 'boosting_type': 'Plain', 'bootstrap_type': 'Bayesian', 'bagging_temperature': 8.62582866994769}. Best is trial 98 with value: 0.8791208791208791.
[32m[I 2023-04-21 01:50:03,959][39m Trial 822 finished with value: 0.8409090909090909 and parameters: {'objective': 'CrossEntropy', 'colsample_bylevel': 0.08115870059056439, 'depth': 3, 'boosting_type': 'Plain', 'bootstrap_type': 'Bayesian', 'bagging_temperature': 8.434001122265137}. Best is trial 98 with value: 0.8791208791208791.
[32m[I 2023-04-21 01:50:04,859][39m Trial 823 finished with value: 0.8409090909090909 and parameters: {'objective': 'CrossEntropy', 'colsample_bylevel': 0.07666211627539238, 'depth': 3, 'boosting_type': 'Plain', 'bootstrap_type': 'Bayesian', 'bagging_temperature': 8.58831337243312}. Best is trial 98 with value: 0.8791208791208791.
[32m[I 2023-04-21 01:50:05,786][39m Trial 824 finished with value: 0.8666666666666666 and parameters: {'objective': 'CrossEntropy', 'colsample_bylevel': 0.08547211161632227, 'depth': 3, 'boosting_type': 'Plain', 'bootstrap_type': 'Bayesian', 'bagging_temperature': 9.765560791817041}. Best is trial 98 with value: 0.8791208791208791.
[32m[I 2023-04-21 01:50:06,752][39m Trial 825 finished with value: 0.8409090909090909 and parameters: {'objective': 'CrossEntropy', 'colsample_bylevel': 0.08713248530498416, 'depth': 10, 'boosting_type': 'Plain', 'bootstrap_type': 'Bayesian', 'bagging_temperature': 4.431288741104453}. Best is trial 98 with value: 0.8791208791208791.
[32m[I 2023-04-21 01:50:07,380][39m Trial 826 finished with value: 0.8666666666666666 and parameters: {'objective': 'CrossEntropy', 'colsample_bylevel': 0.08958535979487325, 'depth': 3, 'boosting_type': 'Plain', 'bootstrap_type': 'Bayesian', 'bagging_temperature': 9.579293683908643}. Best is trial 98 with value: 0.8791208791208791.
[32m[I 2023-04-21 01:50:08,060][39m Trial 827 finished with value: 0.8666666666666666 and parameters: {'objective': 'CrossEntropy', 'colsample_bylevel': 0.07930844595521754, 'depth': 3, 'boosting_type': 'Plain', 'bootstrap_type': 'Bayesian', 'bagging_temperature': 9.413878458829483}. Best is trial 98 with value: 0.8791208791208791.
[32m[I 2023-04-21 01:50:09,134][39m Trial 828 finished with value: 0.8139534883720929 and parameters: {'objective': 'CrossEntropy', 'colsample_bylevel': 0.08257397534744666, 'depth': 4, 'boosting_type': 'Plain', 'bootstrap_type': 'Bayesian', 'bagging_temperature': 9.506112348827978}. Best is trial 98 with value: 0.8791208791208791.
[32m[I 2023-04-21 01:50:09,936][39m Trial 829 finished with value: 0.8505747126436782 and parameters: {'objective': 'CrossEntropy', 'colsample_bylevel': 0.0817050019045173, 'depth': 5, 'boosting_type': 'Plain', 'bootstrap_type': 'Bayesian', 'bagging_temperature': 9.56095702503414}. Best is trial 98 with value: 0.8791208791208791.
[32m[I 2023-04-21 01:50:10,882][39m Trial 830 finished with value: 0.8539325842696629 and parameters: {'objective': 'CrossEntropy', 'colsample_bylevel': 0.08735497542360043, 'depth': 3, 'boosting_type': 'Plain', 'bootstrap_type': 'Bayesian', 'bagging_temperature': 9.247948435088695}. Best is trial 98 with value: 0.8791208791208791.
[32m[I 2023-04-21 01:50:11,571][39m Trial 831 finished with value: 0.8444444444444446 and parameters: {'objective': 'CrossEntropy', 'colsample_bylevel': 0.07421325995117903, 'depth': 3, 'boosting_type': 'Plain', 'bootstrap_type': 'Bernoulli', 'subsample': 0.45737388442026333}. Best is trial 98 with value: 0.8791208791208791.
[32m[I 2023-04-21 01:50:12,499][39m Trial 832 finished with value: 0.8539325842696629 and parameters: {'objective': 'CrossEntropy', 'colsample_bylevel': 0.09392834187543044, 'depth': 3, 'boosting_type': 'Plain', 'bootstrap_type': 'Bayesian', 'bagging_temperature': 9.770707944688569}. Best is trial 98 with value: 0.8791208791208791.
[32m[I 2023-04-21 01:50:17,337][39m Trial 833 finished with value: 0.8314606741573034 and parameters: {'objective': 'Logloss', 'colsample_bylevel': 0.0716726803577803, 'depth': 3, 'boosting_type': 'Ordered', 'bootstrap_type': 'Bayesian', 'bagging_temperature': 9.841175594558601}. Best is trial 98 with value: 0.8791208791208791.
[32m[I 2023-04-21 01:50:18,570][39m Trial 834 finished with value: 0.8181818181818182 and parameters: {'objective': 'CrossEntropy', 'colsample_bylevel': 0.08068484715900913, 'depth': 4, 'boosting_type': 'Plain', 'bootstrap_type': 'MVS'}. Best is trial 98 with value: 0.8791208791208791.
[32m[I 2023-04-21 01:50:19,617][39m Trial 835 finished with value: 0.8275862068965518 and parameters: {'objective': 'CrossEntropy', 'colsample_bylevel': 0.084989833298498, 'depth': 3, 'boosting_type': 'Plain', 'bootstrap_type': 'Bayesian', 'bagging_temperature': 8.72533450656469}. Best is trial 98 with value: 0.8791208791208791.
[32m[I 2023-04-21 01:50:20,522][39m Trial 836 finished with value: 0.8409090909090909 and parameters: {'objective': 'CrossEntropy', 'colsample_bylevel': 0.0967353533184831, 'depth': 3, 'boosting_type': 'Plain', 'bootstrap_type': 'Bayesian', 'bagging_temperature': 9.42584995871259}. Best is trial 98 with value: 0.8791208791208791.
[32m[I 2023-04-21 01:50:21,321][39m Trial 837 finished with value: 0.8139534883720929 and parameters: {'objective': 'CrossEntropy', 'colsample_bylevel': 0.08203161826062373, 'depth': 4, 'boosting_type': 'Plain', 'bootstrap_type': 'Bayesian', 'bagging_temperature': 9.711540157222137}. Best is trial 98 with value: 0.8791208791208791.
[32m[I 2023-04-21 01:50:21,890][39m Trial 838 finished with value: 0.8636363636363636 and parameters: {'objective': 'CrossEntropy', 'colsample_bylevel': 0.07715716515184894, 'depth': 3, 'boosting_type': 'Plain', 'bootstrap_type': 'Bayesian', 'bagging_temperature': 8.804700294718982}. Best is trial 98 with value: 0.8791208791208791.
[32m[I 2023-04-21 01:50:22,641][39m Trial 839 finished with value: 0.7954545454545454 and parameters: {'objective': 'CrossEntropy', 'colsample_bylevel': 0.023792562103683017, 'depth': 3, 'boosting_type': 'Plain', 'bootstrap_type': 'Bayesian', 'bagging_temperature': 0.6412359020563638}. Best is trial 98 with value: 0.8791208791208791.
[32m[I 2023-04-21 01:50:23,441][39m Trial 840 finished with value: 0.8539325842696629 and parameters: {'objective': 'CrossEntropy', 'colsample_bylevel': 0.07758849448820877, 'depth': 3, 'boosting_type': 'Plain', 'bootstrap_type': 'Bayesian', 'bagging_temperature': 8.368638162996154}. Best is trial 98 with value: 0.8791208791208791.
[32m[I 2023-04-21 01:50:24,070][39m Trial 841 finished with value: 0.8505747126436782 and parameters: {'objective': 'CrossEntropy', 'colsample_bylevel': 0.053510064369447476, 'depth': 3, 'boosting_type': 'Plain', 'bootstrap_type': 'Bayesian', 'bagging_temperature': 9.999158256436276}. Best is trial 98 with value: 0.8791208791208791.
[32m[I 2023-04-21 01:50:24,914][39m Trial 842 finished with value: 0.7555555555555555 and parameters: {'objective': 'CrossEntropy', 'colsample_bylevel': 0.01995688445961495, 'depth': 3, 'boosting_type': 'Plain', 'bootstrap_type': 'Bayesian', 'bagging_temperature': 9.448826226938124}. Best is trial 98 with value: 0.8791208791208791.
[32m[I 2023-04-21 01:50:25,662][39m Trial 843 finished with value: 0.8636363636363636 and parameters: {'objective': 'CrossEntropy', 'colsample_bylevel': 0.0789985655814303, 'depth': 3, 'boosting_type': 'Plain', 'bootstrap_type': 'Bayesian', 'bagging_temperature': 8.295377429268509}. Best is trial 98 with value: 0.8791208791208791.
[32m[I 2023-04-21 01:50:26,585][39m Trial 844 finished with value: 0.8666666666666666 and parameters: {'objective': 'Logloss', 'colsample_bylevel': 0.07606777620277486, 'depth': 3, 'boosting_type': 'Plain', 'bootstrap_type': 'Bayesian', 'bagging_temperature': 7.849798976991464}. Best is trial 98 with value: 0.8791208791208791.
[32m[I 2023-04-21 01:50:27,440][39m Trial 845 finished with value: 0.8539325842696629 and parameters: {'objective': 'Logloss', 'colsample_bylevel': 0.09006091442556192, 'depth': 4, 'boosting_type': 'Plain', 'bootstrap_type': 'Bayesian', 'bagging_temperature': 9.279728840494595}. Best is trial 98 with value: 0.8791208791208791.
[32m[I 2023-04-21 01:50:28,135][39m Trial 846 finished with value: 0.8666666666666666 and parameters: {'objective': 'CrossEntropy', 'colsample_bylevel': 0.06105404928920269, 'depth': 3, 'boosting_type': 'Plain', 'bootstrap_type': 'Bayesian', 'bagging_temperature': 8.975039569710372}. Best is trial 98 with value: 0.8791208791208791.
[32m[I 2023-04-21 01:50:29,373][39m Trial 847 finished with value: 0.8409090909090909 and parameters: {'objective': 'CrossEntropy', 'colsample_bylevel': 0.08901019504577215, 'depth': 3, 'boosting_type': 'Plain', 'bootstrap_type': 'Bayesian', 'bagging_temperature': 5.899240788293348}. Best is trial 98 with value: 0.8791208791208791.
[32m[I 2023-04-21 01:50:30,076][39m Trial 848 finished with value: 0.8539325842696629 and parameters: {'objective': 'CrossEntropy', 'colsample_bylevel': 0.09179192562701119, 'depth': 3, 'boosting_type': 'Plain', 'bootstrap_type': 'Bayesian', 'bagging_temperature': 9.295700810659087}. Best is trial 98 with value: 0.8791208791208791.
[32m[I 2023-04-21 01:50:31,147][39m Trial 849 finished with value: 0.8505747126436782 and parameters: {'objective': 'CrossEntropy', 'colsample_bylevel': 0.09507725774588788, 'depth': 6, 'boosting_type': 'Plain', 'bootstrap_type': 'Bayesian', 'bagging_temperature': 9.650806212992519}. Best is trial 98 with value: 0.8791208791208791.
[32m[I 2023-04-21 01:50:32,250][39m Trial 850 finished with value: 0.8666666666666666 and parameters: {'objective': 'CrossEntropy', 'colsample_bylevel': 0.09073317919030804, 'depth': 3, 'boosting_type': 'Plain', 'bootstrap_type': 'Bayesian', 'bagging_temperature': 9.69122928529892}. Best is trial 98 with value: 0.8791208791208791.
[32m[I 2023-04-21 01:50:33,178][39m Trial 851 finished with value: 0.8275862068965518 and parameters: {'objective': 'CrossEntropy', 'colsample_bylevel': 0.09241077105955511, 'depth': 3, 'boosting_type': 'Plain', 'bootstrap_type': 'Bayesian', 'bagging_temperature': 8.29003818093697}. Best is trial 98 with value: 0.8791208791208791.
[32m[I 2023-04-21 01:50:37,772][39m Trial 852 finished with value: 0.8089887640449439 and parameters: {'objective': 'Logloss', 'colsample_bylevel': 0.08128005765106841, 'depth': 3, 'boosting_type': 'Ordered', 'bootstrap_type': 'Bernoulli', 'subsample': 0.6510939336313689}. Best is trial 98 with value: 0.8791208791208791.
[32m[I 2023-04-21 01:50:38,894][39m Trial 853 finished with value: 0.8275862068965518 and parameters: {'objective': 'CrossEntropy', 'colsample_bylevel': 0.08626221579506843, 'depth': 4, 'boosting_type': 'Plain', 'bootstrap_type': 'Bayesian', 'bagging_temperature': 8.997412512814806}. Best is trial 98 with value: 0.8791208791208791.
[32m[I 2023-04-21 01:50:40,111][39m Trial 854 finished with value: 0.8764044943820225 and parameters: {'objective': 'CrossEntropy', 'colsample_bylevel': 0.08001304610171378, 'depth': 3, 'boosting_type': 'Plain', 'bootstrap_type': 'Bayesian', 'bagging_temperature': 7.146855082341194}. Best is trial 98 with value: 0.8791208791208791.
[32m[I 2023-04-21 01:50:40,957][39m Trial 855 finished with value: 0.8539325842696629 and parameters: {'objective': 'CrossEntropy', 'colsample_bylevel': 0.07775901078201475, 'depth': 3, 'boosting_type': 'Plain', 'bootstrap_type': 'Bayesian', 'bagging_temperature': 7.365185107879461}. Best is trial 98 with value: 0.8791208791208791.
[32m[I 2023-04-21 01:50:41,573][39m Trial 856 finished with value: 0.8409090909090909 and parameters: {'objective': 'CrossEntropy', 'colsample_bylevel': 0.08099163212672095, 'depth': 11, 'boosting_type': 'Plain', 'bootstrap_type': 'Bayesian', 'bagging_temperature': 9.85934821844984}. Best is trial 98 with value: 0.8791208791208791.
[32m[I 2023-04-21 01:50:42,329][39m Trial 857 finished with value: 0.8409090909090909 and parameters: {'objective': 'CrossEntropy', 'colsample_bylevel': 0.08594908872468884, 'depth': 3, 'boosting_type': 'Plain', 'bootstrap_type': 'MVS'}. Best is trial 98 with value: 0.8791208791208791.
[32m[I 2023-04-21 01:50:43,297][39m Trial 858 finished with value: 0.8666666666666666 and parameters: {'objective': 'CrossEntropy', 'colsample_bylevel': 0.08907112776694195, 'depth': 3, 'boosting_type': 'Plain', 'bootstrap_type': 'Bayesian', 'bagging_temperature': 9.502540116981178}. Best is trial 98 with value: 0.8791208791208791.
[32m[I 2023-04-21 01:50:44,048][39m Trial 859 finished with value: 0.8275862068965518 and parameters: {'objective': 'CrossEntropy', 'colsample_bylevel': 0.08169563469207908, 'depth': 3, 'boosting_type': 'Plain', 'bootstrap_type': 'Bayesian', 'bagging_temperature': 9.325561285442493}. Best is trial 98 with value: 0.8791208791208791.
