[32m[I 2023-04-21 02:35:36,340][39m Trial 3236 finished with value: 0.8539325842696629 and parameters: {'objective': 'CrossEntropy', 'colsample_bylevel': 0.0739545463566179, 'depth': 10, 'boosting_type': 'Plain', 'bootstrap_type': 'Bayesian', 'bagging_temperature': 8.777629805307603}. Best is trial 3065 with value: 0.8863636363636364.
[32m[I 2023-04-21 02:35:37,822][39m Trial 3237 finished with value: 0.8539325842696629 and parameters: {'objective': 'Logloss', 'colsample_bylevel': 0.07279624967772377, 'depth': 9, 'boosting_type': 'Plain', 'bootstrap_type': 'Bayesian', 'bagging_temperature': 9.843333492357528}. Best is trial 3065 with value: 0.8863636363636364.
[32m[I 2023-04-21 02:35:38,777][39m Trial 3238 finished with value: 0.8539325842696629 and parameters: {'objective': 'Logloss', 'colsample_bylevel': 0.06663913602698404, 'depth': 12, 'boosting_type': 'Plain', 'bootstrap_type': 'Bayesian', 'bagging_temperature': 9.11492593948291}. Best is trial 3065 with value: 0.8863636363636364.
[32m[I 2023-04-21 02:35:39,387][39m Trial 3239 finished with value: 0.8539325842696629 and parameters: {'objective': 'Logloss', 'colsample_bylevel': 0.07400650279647734, 'depth': 3, 'boosting_type': 'Plain', 'bootstrap_type': 'Bayesian', 'bagging_temperature': 9.790733158698433}. Best is trial 3065 with value: 0.8863636363636364.
[32m[I 2023-04-21 02:35:39,988][39m Trial 3240 finished with value: 0.7865168539325843 and parameters: {'objective': 'CrossEntropy', 'colsample_bylevel': 0.06443343085112478, 'depth': 1, 'boosting_type': 'Plain', 'bootstrap_type': 'Bernoulli', 'subsample': 0.4827431743869212}. Best is trial 3065 with value: 0.8863636363636364.
[32m[I 2023-04-21 02:35:40,887][39m Trial 3241 finished with value: 0.8409090909090909 and parameters: {'objective': 'CrossEntropy', 'colsample_bylevel': 0.08140542542618906, 'depth': 12, 'boosting_type': 'Plain', 'bootstrap_type': 'Bayesian', 'bagging_temperature': 8.850367976073606}. Best is trial 3065 with value: 0.8863636363636364.
[32m[I 2023-04-21 02:35:41,825][39m Trial 3242 finished with value: 0.8666666666666666 and parameters: {'objective': 'CrossEntropy', 'colsample_bylevel': 0.09517082801809343, 'depth': 3, 'boosting_type': 'Plain', 'bootstrap_type': 'Bayesian', 'bagging_temperature': 8.889468737102614}. Best is trial 3065 with value: 0.8863636363636364.
[32m[I 2023-04-21 02:35:42,733][39m Trial 3243 finished with value: 0.8539325842696629 and parameters: {'objective': 'CrossEntropy', 'colsample_bylevel': 0.08035171173932927, 'depth': 3, 'boosting_type': 'Plain', 'bootstrap_type': 'Bayesian', 'bagging_temperature': 9.23425330150492}. Best is trial 3065 with value: 0.8863636363636364.
[32m[I 2023-04-21 02:35:43,986][39m Trial 3244 finished with value: 0.7857142857142858 and parameters: {'objective': 'CrossEntropy', 'colsample_bylevel': 0.07764139028481906, 'depth': 10, 'boosting_type': 'Plain', 'bootstrap_type': 'MVS'}. Best is trial 3065 with value: 0.8863636363636364.
[32m[I 2023-04-21 02:35:44,988][39m Trial 3245 finished with value: 0.8409090909090909 and parameters: {'objective': 'CrossEntropy', 'colsample_bylevel': 0.07082416418382353, 'depth': 3, 'boosting_type': 'Plain', 'bootstrap_type': 'Bayesian', 'bagging_temperature': 8.631229606296884}. Best is trial 3065 with value: 0.8863636363636364.
[32m[I 2023-04-21 02:35:45,957][39m Trial 3246 finished with value: 0.8275862068965518 and parameters: {'objective': 'CrossEntropy', 'colsample_bylevel': 0.07194824840289307, 'depth': 8, 'boosting_type': 'Plain', 'bootstrap_type': 'Bayesian', 'bagging_temperature': 9.834976854676047}. Best is trial 3065 with value: 0.8863636363636364.
[32m[I 2023-04-21 02:35:46,638][39m Trial 3247 finished with value: 0.8409090909090909 and parameters: {'objective': 'Logloss', 'colsample_bylevel': 0.08472828914342727, 'depth': 12, 'boosting_type': 'Plain', 'bootstrap_type': 'Bayesian', 'bagging_temperature': 9.224950690228091}. Best is trial 3065 with value: 0.8863636363636364.
[32m[I 2023-04-21 02:35:47,258][39m Trial 3248 finished with value: 0.8409090909090909 and parameters: {'objective': 'Logloss', 'colsample_bylevel': 0.06974464454659948, 'depth': 12, 'boosting_type': 'Plain', 'bootstrap_type': 'MVS'}. Best is trial 3065 with value: 0.8863636363636364.
[32m[I 2023-04-21 02:35:48,029][39m Trial 3249 finished with value: 0.8539325842696629 and parameters: {'objective': 'CrossEntropy', 'colsample_bylevel': 0.0792019601162056, 'depth': 3, 'boosting_type': 'Plain', 'bootstrap_type': 'Bayesian', 'bagging_temperature': 9.99061252002859}. Best is trial 3065 with value: 0.8863636363636364.
[32m[I 2023-04-21 02:35:49,051][39m Trial 3250 finished with value: 0.8539325842696629 and parameters: {'objective': 'CrossEntropy', 'colsample_bylevel': 0.07520497384281921, 'depth': 11, 'boosting_type': 'Plain', 'bootstrap_type': 'Bayesian', 'bagging_temperature': 9.383822433721082}. Best is trial 3065 with value: 0.8863636363636364.
[32m[I 2023-04-21 02:35:50,298][39m Trial 3251 finished with value: 0.8409090909090909 and parameters: {'objective': 'CrossEntropy', 'colsample_bylevel': 0.08132565629077904, 'depth': 10, 'boosting_type': 'Plain', 'bootstrap_type': 'Bayesian', 'bagging_temperature': 9.292221363311988}. Best is trial 3065 with value: 0.8863636363636364.
[32m[I 2023-04-21 02:35:51,278][39m Trial 3252 finished with value: 0.8139534883720929 and parameters: {'objective': 'CrossEntropy', 'colsample_bylevel': 0.08548203289665951, 'depth': 4, 'boosting_type': 'Plain', 'bootstrap_type': 'Bayesian', 'bagging_temperature': 9.514539565077744}. Best is trial 3065 with value: 0.8863636363636364.
[32m[I 2023-04-21 02:35:52,337][39m Trial 3253 finished with value: 0.8666666666666666 and parameters: {'objective': 'CrossEntropy', 'colsample_bylevel': 0.07055990218594962, 'depth': 10, 'boosting_type': 'Plain', 'bootstrap_type': 'Bayesian', 'bagging_temperature': 8.976383850161806}. Best is trial 3065 with value: 0.8863636363636364.
[32m[I 2023-04-21 02:35:56,998][39m Trial 3254 finished with value: 0.8409090909090909 and parameters: {'objective': 'CrossEntropy', 'colsample_bylevel': 0.08324615259154812, 'depth': 3, 'boosting_type': 'Ordered', 'bootstrap_type': 'Bernoulli', 'subsample': 0.767848777130744}. Best is trial 3065 with value: 0.8863636363636364.
[32m[I 2023-04-21 02:35:57,907][39m Trial 3255 finished with value: 0.8666666666666666 and parameters: {'objective': 'CrossEntropy', 'colsample_bylevel': 0.06440568958151906, 'depth': 12, 'boosting_type': 'Plain', 'bootstrap_type': 'Bayesian', 'bagging_temperature': 9.678613394586252}. Best is trial 3065 with value: 0.8863636363636364.
[32m[I 2023-04-21 02:35:58,827][39m Trial 3256 finished with value: 0.8666666666666666 and parameters: {'objective': 'CrossEntropy', 'colsample_bylevel': 0.07990105638261498, 'depth': 3, 'boosting_type': 'Plain', 'bootstrap_type': 'Bayesian', 'bagging_temperature': 9.99959448974581}. Best is trial 3065 with value: 0.8863636363636364.
[32m[I 2023-04-21 02:36:00,064][39m Trial 3257 finished with value: 0.7499999999999999 and parameters: {'objective': 'CrossEntropy', 'colsample_bylevel': 0.015553717055915836, 'depth': 2, 'boosting_type': 'Plain', 'bootstrap_type': 'Bayesian', 'bagging_temperature': 8.9254194589919}. Best is trial 3065 with value: 0.8863636363636364.
[32m[I 2023-04-21 02:36:01,342][39m Trial 3258 finished with value: 0.8505747126436782 and parameters: {'objective': 'CrossEntropy', 'colsample_bylevel': 0.09700737676274133, 'depth': 9, 'boosting_type': 'Plain', 'bootstrap_type': 'Bayesian', 'bagging_temperature': 9.128806542164357}. Best is trial 3065 with value: 0.8863636363636364.
[32m[I 2023-04-21 02:36:02,038][39m Trial 3259 finished with value: 0.8409090909090909 and parameters: {'objective': 'CrossEntropy', 'colsample_bylevel': 0.07370349819549335, 'depth': 11, 'boosting_type': 'Plain', 'bootstrap_type': 'Bayesian', 'bagging_temperature': 9.7118523308166}. Best is trial 3065 with value: 0.8863636363636364.
[32m[I 2023-04-21 02:36:03,133][39m Trial 3260 finished with value: 0.8275862068965518 and parameters: {'objective': 'CrossEntropy', 'colsample_bylevel': 0.0729460267237524, 'depth': 10, 'boosting_type': 'Plain', 'bootstrap_type': 'Bayesian', 'bagging_temperature': 9.387973102870815}. Best is trial 3065 with value: 0.8863636363636364.
[32m[I 2023-04-21 02:36:04,239][39m Trial 3261 finished with value: 0.8409090909090909 and parameters: {'objective': 'CrossEntropy', 'colsample_bylevel': 0.07169393357312498, 'depth': 10, 'boosting_type': 'Plain', 'bootstrap_type': 'Bayesian', 'bagging_temperature': 9.473153626100917}. Best is trial 3065 with value: 0.8863636363636364.
[32m[I 2023-04-21 02:36:04,851][39m Trial 3262 finished with value: 0.8539325842696629 and parameters: {'objective': 'Logloss', 'colsample_bylevel': 0.07355177868007268, 'depth': 4, 'boosting_type': 'Plain', 'bootstrap_type': 'Bayesian', 'bagging_temperature': 8.37152410027023}. Best is trial 3065 with value: 0.8863636363636364.
[32m[I 2023-04-21 02:36:06,129][39m Trial 3263 finished with value: 0.8409090909090909 and parameters: {'objective': 'CrossEntropy', 'colsample_bylevel': 0.07514055099399228, 'depth': 11, 'boosting_type': 'Plain', 'bootstrap_type': 'Bayesian', 'bagging_temperature': 9.493319164349915}. Best is trial 3065 with value: 0.8863636363636364.
[32m[I 2023-04-21 02:36:07,111][39m Trial 3264 finished with value: 0.8275862068965518 and parameters: {'objective': 'Logloss', 'colsample_bylevel': 0.06572958388655635, 'depth': 12, 'boosting_type': 'Plain', 'bootstrap_type': 'MVS'}. Best is trial 3065 with value: 0.8863636363636364.
[32m[I 2023-04-21 02:36:07,881][39m Trial 3265 finished with value: 0.8139534883720929 and parameters: {'objective': 'Logloss', 'colsample_bylevel': 0.08936206029783729, 'depth': 9, 'boosting_type': 'Plain', 'bootstrap_type': 'Bayesian', 'bagging_temperature': 8.09751061978313}. Best is trial 3065 with value: 0.8863636363636364.
[32m[I 2023-04-21 02:36:08,492][39m Trial 3266 finished with value: 0.8539325842696629 and parameters: {'objective': 'CrossEntropy', 'colsample_bylevel': 0.05478671579950257, 'depth': 3, 'boosting_type': 'Plain', 'bootstrap_type': 'Bayesian', 'bagging_temperature': 9.989304692563167}. Best is trial 3065 with value: 0.8863636363636364.
[32m[I 2023-04-21 02:36:09,348][39m Trial 3267 finished with value: 0.8275862068965518 and parameters: {'objective': 'CrossEntropy', 'colsample_bylevel': 0.0690452251163181, 'depth': 8, 'boosting_type': 'Plain', 'bootstrap_type': 'Bayesian', 'bagging_temperature': 9.738835614512848}. Best is trial 3065 with value: 0.8863636363636364.
[32m[I 2023-04-21 02:36:10,414][39m Trial 3268 finished with value: 0.8275862068965518 and parameters: {'objective': 'CrossEntropy', 'colsample_bylevel': 0.07823723998516183, 'depth': 3, 'boosting_type': 'Plain', 'bootstrap_type': 'Bayesian', 'bagging_temperature': 9.12023999184964}. Best is trial 3065 with value: 0.8863636363636364.
[32m[I 2023-04-21 02:36:11,411][39m Trial 3269 finished with value: 0.8764044943820225 and parameters: {'objective': 'CrossEntropy', 'colsample_bylevel': 0.08273464952524637, 'depth': 2, 'boosting_type': 'Plain', 'bootstrap_type': 'Bayesian', 'bagging_temperature': 9.134922886755833}. Best is trial 3065 with value: 0.8863636363636364.
[32m[I 2023-04-21 02:36:12,568][39m Trial 3270 finished with value: 0.8666666666666666 and parameters: {'objective': 'CrossEntropy', 'colsample_bylevel': 0.07013075865336577, 'depth': 8, 'boosting_type': 'Plain', 'bootstrap_type': 'Bayesian', 'bagging_temperature': 9.753465271141291}. Best is trial 3065 with value: 0.8863636363636364.
[32m[I 2023-04-21 02:36:13,543][39m Trial 3271 finished with value: 0.8539325842696629 and parameters: {'objective': 'CrossEntropy', 'colsample_bylevel': 0.06971113291785687, 'depth': 3, 'boosting_type': 'Plain', 'bootstrap_type': 'Bayesian', 'bagging_temperature': 8.67966136132265}. Best is trial 3065 with value: 0.8863636363636364.
[32m[I 2023-04-21 02:36:14,558][39m Trial 3272 finished with value: 0.8539325842696629 and parameters: {'objective': 'Logloss', 'colsample_bylevel': 0.07218246704718942, 'depth': 11, 'boosting_type': 'Plain', 'bootstrap_type': 'Bayesian', 'bagging_temperature': 8.996595130670482}. Best is trial 3065 with value: 0.8863636363636364.
[32m[I 2023-04-21 02:36:19,322][39m Trial 3273 finished with value: 0.8131868131868132 and parameters: {'objective': 'CrossEntropy', 'colsample_bylevel': 0.0672734145263318, 'depth': 3, 'boosting_type': 'Ordered', 'bootstrap_type': 'Bayesian', 'bagging_temperature': 8.735574969940439}. Best is trial 3065 with value: 0.8863636363636364.
[32m[I 2023-04-21 02:36:20,272][39m Trial 3274 finished with value: 0.8275862068965518 and parameters: {'objective': 'CrossEntropy', 'colsample_bylevel': 0.0712445029020298, 'depth': 11, 'boosting_type': 'Plain', 'bootstrap_type': 'MVS'}. Best is trial 3065 with value: 0.8863636363636364.
[32m[I 2023-04-21 02:36:21,440][39m Trial 3275 finished with value: 0.8409090909090909 and parameters: {'objective': 'CrossEntropy', 'colsample_bylevel': 0.08194186946573824, 'depth': 3, 'boosting_type': 'Plain', 'bootstrap_type': 'Bayesian', 'bagging_temperature': 8.343617432412746}. Best is trial 3065 with value: 0.8863636363636364.
[32m[I 2023-04-21 02:36:22,513][39m Trial 3276 finished with value: 0.8539325842696629 and parameters: {'objective': 'CrossEntropy', 'colsample_bylevel': 0.06873352416789205, 'depth': 8, 'boosting_type': 'Plain', 'bootstrap_type': 'Bayesian', 'bagging_temperature': 9.232808903807426}. Best is trial 3065 with value: 0.8863636363636364.
[32m[I 2023-04-21 02:36:23,260][39m Trial 3277 finished with value: 0.8139534883720929 and parameters: {'objective': 'Logloss', 'colsample_bylevel': 0.07530113396624821, 'depth': 9, 'boosting_type': 'Plain', 'bootstrap_type': 'Bayesian', 'bagging_temperature': 9.826593024426884}. Best is trial 3065 with value: 0.8863636363636364.
[32m[I 2023-04-21 02:36:24,524][39m Trial 3278 finished with value: 0.8409090909090909 and parameters: {'objective': 'CrossEntropy', 'colsample_bylevel': 0.08282038474508077, 'depth': 9, 'boosting_type': 'Plain', 'bootstrap_type': 'Bayesian', 'bagging_temperature': 8.772896935485655}. Best is trial 3065 with value: 0.8863636363636364.
[32m[I 2023-04-21 02:36:25,216][39m Trial 3279 finished with value: 0.8409090909090909 and parameters: {'objective': 'Logloss', 'colsample_bylevel': 0.08669073373559176, 'depth': 3, 'boosting_type': 'Plain', 'bootstrap_type': 'Bayesian', 'bagging_temperature': 6.929203831906813}. Best is trial 3065 with value: 0.8863636363636364.
[32m[I 2023-04-21 02:36:26,227][39m Trial 3280 finished with value: 0.8539325842696629 and parameters: {'objective': 'Logloss', 'colsample_bylevel': 0.08643158353045882, 'depth': 3, 'boosting_type': 'Plain', 'bootstrap_type': 'Bayesian', 'bagging_temperature': 7.467821832489232}. Best is trial 3065 with value: 0.8863636363636364.
[32m[I 2023-04-21 02:36:27,534][39m Trial 3281 finished with value: 0.8409090909090909 and parameters: {'objective': 'CrossEntropy', 'colsample_bylevel': 0.07030632306126679, 'depth': 8, 'boosting_type': 'Plain', 'bootstrap_type': 'Bayesian', 'bagging_temperature': 9.99956148684814}. Best is trial 3065 with value: 0.8863636363636364.
[32m[I 2023-04-21 02:36:28,529][39m Trial 3282 finished with value: 0.8505747126436782 and parameters: {'objective': 'CrossEntropy', 'colsample_bylevel': 0.08162022249850502, 'depth': 12, 'boosting_type': 'Plain', 'bootstrap_type': 'Bayesian', 'bagging_temperature': 8.783183253605952}. Best is trial 3065 with value: 0.8863636363636364.
[32m[I 2023-04-21 02:36:29,538][39m Trial 3283 finished with value: 0.8275862068965518 and parameters: {'objective': 'CrossEntropy', 'colsample_bylevel': 0.06825795129047481, 'depth': 7, 'boosting_type': 'Plain', 'bootstrap_type': 'Bayesian', 'bagging_temperature': 8.564929854484351}. Best is trial 3065 with value: 0.8863636363636364.
[32m[I 2023-04-21 02:36:30,154][39m Trial 3284 finished with value: 0.8539325842696629 and parameters: {'objective': 'Logloss', 'colsample_bylevel': 0.06789655121077084, 'depth': 11, 'boosting_type': 'Plain', 'bootstrap_type': 'Bernoulli', 'subsample': 0.621018825780561}. Best is trial 3065 with value: 0.8863636363636364.
[32m[I 2023-04-21 02:36:30,891][39m Trial 3285 finished with value: 0.8666666666666666 and parameters: {'objective': 'CrossEntropy', 'colsample_bylevel': 0.08143031818766641, 'depth': 2, 'boosting_type': 'Plain', 'bootstrap_type': 'Bayesian', 'bagging_temperature': 9.22138157718271}. Best is trial 3065 with value: 0.8863636363636364.
[32m[I 2023-04-21 02:36:31,899][39m Trial 3286 finished with value: 0.8409090909090909 and parameters: {'objective': 'CrossEntropy', 'colsample_bylevel': 0.08403864778618697, 'depth': 3, 'boosting_type': 'Plain', 'bootstrap_type': 'Bayesian', 'bagging_temperature': 9.121523301438112}. Best is trial 3065 with value: 0.8863636363636364.
[32m[I 2023-04-21 02:36:33,191][39m Trial 3287 finished with value: 0.8539325842696629 and parameters: {'objective': 'CrossEntropy', 'colsample_bylevel': 0.07731334365700425, 'depth': 3, 'boosting_type': 'Plain', 'bootstrap_type': 'Bayesian', 'bagging_temperature': 9.478625594396338}. Best is trial 3065 with value: 0.8863636363636364.
[32m[I 2023-04-21 02:36:34,216][39m Trial 3288 finished with value: 0.8539325842696629 and parameters: {'objective': 'CrossEntropy', 'colsample_bylevel': 0.06590650980251797, 'depth': 3, 'boosting_type': 'Plain', 'bootstrap_type': 'Bayesian', 'bagging_temperature': 9.019113638994034}. Best is trial 3065 with value: 0.8863636363636364.
[32m[I 2023-04-21 02:36:35,195][39m Trial 3289 finished with value: 0.8666666666666666 and parameters: {'objective': 'CrossEntropy', 'colsample_bylevel': 0.06722606416545107, 'depth': 3, 'boosting_type': 'Plain', 'bootstrap_type': 'Bayesian', 'bagging_temperature': 8.980968566713834}. Best is trial 3065 with value: 0.8863636363636364.
[32m[I 2023-04-21 02:36:36,123][39m Trial 3290 finished with value: 0.8539325842696629 and parameters: {'objective': 'CrossEntropy', 'colsample_bylevel': 0.06816821390305614, 'depth': 12, 'boosting_type': 'Plain', 'bootstrap_type': 'Bayesian', 'bagging_temperature': 8.833802398961057}. Best is trial 3065 with value: 0.8863636363636364.
[32m[I 2023-04-21 02:36:36,743][39m Trial 3291 finished with value: 0.8409090909090909 and parameters: {'objective': 'CrossEntropy', 'colsample_bylevel': 0.05101870505857654, 'depth': 3, 'boosting_type': 'Plain', 'bootstrap_type': 'Bayesian', 'bagging_temperature': 8.948137122401192}. Best is trial 3065 with value: 0.8863636363636364.
[32m[I 2023-04-21 02:36:41,756][39m Trial 3292 finished with value: 0.8275862068965518 and parameters: {'objective': 'CrossEntropy', 'colsample_bylevel': 0.08763383323843385, 'depth': 10, 'boosting_type': 'Ordered', 'bootstrap_type': 'Bayesian', 'bagging_temperature': 7.951791497929315}. Best is trial 3065 with value: 0.8863636363636364.
[32m[I 2023-04-21 02:36:43,041][39m Trial 3293 finished with value: 0.8409090909090909 and parameters: {'objective': 'Logloss', 'colsample_bylevel': 0.08027620582744921, 'depth': 2, 'boosting_type': 'Plain', 'bootstrap_type': 'Bayesian', 'bagging_temperature': 8.924298928060868}. Best is trial 3065 with value: 0.8863636363636364.
[32m[I 2023-04-21 02:36:44,040][39m Trial 3294 finished with value: 0.8372093023255814 and parameters: {'objective': 'Logloss', 'colsample_bylevel': 0.08064521168181092, 'depth': 7, 'boosting_type': 'Plain', 'bootstrap_type': 'Bayesian', 'bagging_temperature': 9.335734576286132}. Best is trial 3065 with value: 0.8863636363636364.
[32m[I 2023-04-21 02:36:44,902][39m Trial 3295 finished with value: 0.8409090909090909 and parameters: {'objective': 'CrossEntropy', 'colsample_bylevel': 0.06968796671189338, 'depth': 12, 'boosting_type': 'Plain', 'bootstrap_type': 'Bayesian', 'bagging_temperature': 9.834944209729423}. Best is trial 3065 with value: 0.8863636363636364.
[32m[I 2023-04-21 02:36:45,543][39m Trial 3296 finished with value: 0.8505747126436782 and parameters: {'objective': 'CrossEntropy', 'colsample_bylevel': 0.09046463882366834, 'depth': 10, 'boosting_type': 'Plain', 'bootstrap_type': 'Bayesian', 'bagging_temperature': 9.853910901208746}. Best is trial 3065 with value: 0.8863636363636364.
[32m[I 2023-04-21 02:36:46,490][39m Trial 3297 finished with value: 0.8539325842696629 and parameters: {'objective': 'CrossEntropy', 'colsample_bylevel': 0.08173863114042866, 'depth': 3, 'boosting_type': 'Plain', 'bootstrap_type': 'Bayesian', 'bagging_temperature': 8.952342029319688}. Best is trial 3065 with value: 0.8863636363636364.
[32m[I 2023-04-21 02:36:47,608][39m Trial 3298 finished with value: 0.8409090909090909 and parameters: {'objective': 'CrossEntropy', 'colsample_bylevel': 0.06197014480956756, 'depth': 12, 'boosting_type': 'Plain', 'bootstrap_type': 'Bayesian', 'bagging_temperature': 8.643964423124917}. Best is trial 3065 with value: 0.8863636363636364.
[32m[I 2023-04-21 02:36:49,012][39m Trial 3299 finished with value: 0.8275862068965518 and parameters: {'objective': 'CrossEntropy', 'colsample_bylevel': 0.0735371458734751, 'depth': 9, 'boosting_type': 'Plain', 'bootstrap_type': 'MVS'}. Best is trial 3065 with value: 0.8863636363636364.
[32m[I 2023-04-21 02:36:50,042][39m Trial 3300 finished with value: 0.8791208791208791 and parameters: {'objective': 'CrossEntropy', 'colsample_bylevel': 0.07661217958953799, 'depth': 10, 'boosting_type': 'Plain', 'bootstrap_type': 'Bayesian', 'bagging_temperature': 8.125119565572135}. Best is trial 3065 with value: 0.8863636363636364.
