[32m[I 2023-04-21 02:53:48,759][39m Trial 4152 finished with value: 0.8666666666666666 and parameters: {'objective': 'CrossEntropy', 'colsample_bylevel': 0.0824513727051671, 'depth': 3, 'boosting_type': 'Plain', 'bootstrap_type': 'Bayesian', 'bagging_temperature': 9.46555626880083}. Best is trial 3065 with value: 0.8863636363636364.
[32m[I 2023-04-21 02:53:50,048][39m Trial 4153 finished with value: 0.8409090909090909 and parameters: {'objective': 'Logloss', 'colsample_bylevel': 0.06928261377950586, 'depth': 10, 'boosting_type': 'Plain', 'bootstrap_type': 'Bayesian', 'bagging_temperature': 8.042756033455793}. Best is trial 3065 with value: 0.8863636363636364.
[32m[I 2023-04-21 02:53:51,023][39m Trial 4154 finished with value: 0.8666666666666666 and parameters: {'objective': 'CrossEntropy', 'colsample_bylevel': 0.0693011583222866, 'depth': 12, 'boosting_type': 'Plain', 'bootstrap_type': 'Bayesian', 'bagging_temperature': 9.130099985623875}. Best is trial 3065 with value: 0.8863636363636364.
[32m[I 2023-04-21 02:53:52,190][39m Trial 4155 finished with value: 0.8539325842696629 and parameters: {'objective': 'CrossEntropy', 'colsample_bylevel': 0.0800601054733766, 'depth': 9, 'boosting_type': 'Plain', 'bootstrap_type': 'Bayesian', 'bagging_temperature': 9.479053299955968}. Best is trial 3065 with value: 0.8863636363636364.
[32m[I 2023-04-21 02:53:52,861][39m Trial 4156 finished with value: 0.8539325842696629 and parameters: {'objective': 'CrossEntropy', 'colsample_bylevel': 0.07721695579675635, 'depth': 6, 'boosting_type': 'Plain', 'bootstrap_type': 'Bayesian', 'bagging_temperature': 9.041935697617443}. Best is trial 3065 with value: 0.8863636363636364.
[32m[I 2023-04-21 02:53:53,969][39m Trial 4157 finished with value: 0.8275862068965518 and parameters: {'objective': 'CrossEntropy', 'colsample_bylevel': 0.0800607052823511, 'depth': 7, 'boosting_type': 'Plain', 'bootstrap_type': 'Bayesian', 'bagging_temperature': 8.993246564795538}. Best is trial 3065 with value: 0.8863636363636364.
[32m[I 2023-04-21 02:53:55,073][39m Trial 4158 finished with value: 0.8764044943820225 and parameters: {'objective': 'CrossEntropy', 'colsample_bylevel': 0.08245139155295476, 'depth': 2, 'boosting_type': 'Plain', 'bootstrap_type': 'Bayesian', 'bagging_temperature': 8.528963229974737}. Best is trial 3065 with value: 0.8863636363636364.
[32m[I 2023-04-21 02:54:00,016][39m Trial 4159 finished with value: 0.8045977011494252 and parameters: {'objective': 'CrossEntropy', 'colsample_bylevel': 0.08215309596067892, 'depth': 4, 'boosting_type': 'Ordered', 'bootstrap_type': 'Bernoulli', 'subsample': 0.3986781196279553}. Best is trial 3065 with value: 0.8863636363636364.
[32m[I 2023-04-21 02:54:01,256][39m Trial 4160 finished with value: 0.8539325842696629 and parameters: {'objective': 'Logloss', 'colsample_bylevel': 0.06346899809978783, 'depth': 9, 'boosting_type': 'Plain', 'bootstrap_type': 'Bayesian', 'bagging_temperature': 8.570134861056491}. Best is trial 3065 with value: 0.8863636363636364.
[32m[I 2023-04-21 02:54:02,320][39m Trial 4161 finished with value: 0.8409090909090909 and parameters: {'objective': 'Logloss', 'colsample_bylevel': 0.07518988550133963, 'depth': 10, 'boosting_type': 'Plain', 'bootstrap_type': 'Bayesian', 'bagging_temperature': 8.943447607685393}. Best is trial 3065 with value: 0.8863636363636364.
[32m[I 2023-04-21 02:54:03,191][39m Trial 4162 finished with value: 0.8539325842696629 and parameters: {'objective': 'CrossEntropy', 'colsample_bylevel': 0.06315634450101597, 'depth': 7, 'boosting_type': 'Plain', 'bootstrap_type': 'Bayesian', 'bagging_temperature': 4.551478910841003}. Best is trial 3065 with value: 0.8863636363636364.
[32m[I 2023-04-21 02:54:04,005][39m Trial 4163 finished with value: 0.8666666666666666 and parameters: {'objective': 'CrossEntropy', 'colsample_bylevel': 0.0687016405880341, 'depth': 12, 'boosting_type': 'Plain', 'bootstrap_type': 'Bayesian', 'bagging_temperature': 8.753076582653485}. Best is trial 3065 with value: 0.8863636363636364.
[32m[I 2023-04-21 02:54:05,313][39m Trial 4164 finished with value: 0.8409090909090909 and parameters: {'objective': 'Logloss', 'colsample_bylevel': 0.07307570777662067, 'depth': 9, 'boosting_type': 'Plain', 'bootstrap_type': 'Bayesian', 'bagging_temperature': 9.670770691105577}. Best is trial 3065 with value: 0.8863636363636364.
[32m[I 2023-04-21 02:54:06,240][39m Trial 4165 finished with value: 0.8666666666666666 and parameters: {'objective': 'Logloss', 'colsample_bylevel': 0.07672510094940797, 'depth': 5, 'boosting_type': 'Plain', 'bootstrap_type': 'Bayesian', 'bagging_temperature': 7.917269409128816}. Best is trial 3065 with value: 0.8863636363636364.
[32m[I 2023-04-21 02:54:06,913][39m Trial 4166 finished with value: 0.8539325842696629 and parameters: {'objective': 'CrossEntropy', 'colsample_bylevel': 0.08046612220583858, 'depth': 3, 'boosting_type': 'Plain', 'bootstrap_type': 'Bayesian', 'bagging_temperature': 9.652189721755729}. Best is trial 3065 with value: 0.8863636363636364.
[32m[I 2023-04-21 02:54:08,156][39m Trial 4167 finished with value: 0.8539325842696629 and parameters: {'objective': 'CrossEntropy', 'colsample_bylevel': 0.08021526613656557, 'depth': 3, 'boosting_type': 'Plain', 'bootstrap_type': 'MVS'}. Best is trial 3065 with value: 0.8863636363636364.
[32m[I 2023-04-21 02:54:09,525][39m Trial 4168 finished with value: 0.8539325842696629 and parameters: {'objective': 'Logloss', 'colsample_bylevel': 0.0750526961679133, 'depth': 9, 'boosting_type': 'Plain', 'bootstrap_type': 'Bayesian', 'bagging_temperature': 9.983120106092418}. Best is trial 3065 with value: 0.8863636363636364.
[32m[I 2023-04-21 02:54:10,416][39m Trial 4169 finished with value: 0.8409090909090909 and parameters: {'objective': 'CrossEntropy', 'colsample_bylevel': 0.09111963790084024, 'depth': 3, 'boosting_type': 'Plain', 'bootstrap_type': 'Bayesian', 'bagging_temperature': 5.811121948986843}. Best is trial 3065 with value: 0.8863636363636364.
[32m[I 2023-04-21 02:54:11,333][39m Trial 4170 finished with value: 0.8791208791208791 and parameters: {'objective': 'Logloss', 'colsample_bylevel': 0.07328839190718377, 'depth': 9, 'boosting_type': 'Plain', 'bootstrap_type': 'Bayesian', 'bagging_temperature': 9.692792871065576}. Best is trial 3065 with value: 0.8863636363636364.
[32m[I 2023-04-21 02:54:12,605][39m Trial 4171 finished with value: 0.8666666666666666 and parameters: {'objective': 'CrossEntropy', 'colsample_bylevel': 0.07058181333399387, 'depth': 12, 'boosting_type': 'Plain', 'bootstrap_type': 'Bayesian', 'bagging_temperature': 9.37786185254177}. Best is trial 3065 with value: 0.8863636363636364.
[32m[I 2023-04-21 02:54:13,274][39m Trial 4172 finished with value: 0.8539325842696629 and parameters: {'objective': 'CrossEntropy', 'colsample_bylevel': 0.07681517336232258, 'depth': 7, 'boosting_type': 'Plain', 'bootstrap_type': 'Bayesian', 'bagging_temperature': 9.265164735518757}. Best is trial 3065 with value: 0.8863636363636364.
[32m[I 2023-04-21 02:54:17,907][39m Trial 4173 finished with value: 0.8275862068965518 and parameters: {'objective': 'CrossEntropy', 'colsample_bylevel': 0.07728036265397396, 'depth': 10, 'boosting_type': 'Ordered', 'bootstrap_type': 'Bayesian', 'bagging_temperature': 9.997398651588341}. Best is trial 3065 with value: 0.8863636363636364.
[32m[I 2023-04-21 02:54:19,178][39m Trial 4174 finished with value: 0.8791208791208791 and parameters: {'objective': 'CrossEntropy', 'colsample_bylevel': 0.08187846825567116, 'depth': 3, 'boosting_type': 'Plain', 'bootstrap_type': 'Bayesian', 'bagging_temperature': 9.405836098859368}. Best is trial 3065 with value: 0.8863636363636364.
[32m[I 2023-04-21 02:54:20,434][39m Trial 4175 finished with value: 0.8275862068965518 and parameters: {'objective': 'Logloss', 'colsample_bylevel': 0.08422496129853446, 'depth': 5, 'boosting_type': 'Plain', 'bootstrap_type': 'Bernoulli', 'subsample': 0.7059953366573777}. Best is trial 3065 with value: 0.8863636363636364.
[32m[I 2023-04-21 02:54:21,521][39m Trial 4176 finished with value: 0.8275862068965518 and parameters: {'objective': 'CrossEntropy', 'colsample_bylevel': 0.07466546369686936, 'depth': 10, 'boosting_type': 'Plain', 'bootstrap_type': 'Bayesian', 'bagging_temperature': 9.728698457751912}. Best is trial 3065 with value: 0.8863636363636364.
[32m[I 2023-04-21 02:54:22,428][39m Trial 4177 finished with value: 0.7441860465116279 and parameters: {'objective': 'CrossEntropy', 'colsample_bylevel': 0.02944440531878137, 'depth': 3, 'boosting_type': 'Plain', 'bootstrap_type': 'MVS'}. Best is trial 3065 with value: 0.8863636363636364.
[32m[I 2023-04-21 02:54:23,360][39m Trial 4178 finished with value: 0.8539325842696629 and parameters: {'objective': 'Logloss', 'colsample_bylevel': 0.06882855741340779, 'depth': 7, 'boosting_type': 'Plain', 'bootstrap_type': 'Bayesian', 'bagging_temperature': 8.961849285739541}. Best is trial 3065 with value: 0.8863636363636364.
[32m[I 2023-04-21 02:54:24,321][39m Trial 4179 finished with value: 0.8409090909090909 and parameters: {'objective': 'CrossEntropy', 'colsample_bylevel': 0.07837490522712812, 'depth': 4, 'boosting_type': 'Plain', 'bootstrap_type': 'Bayesian', 'bagging_temperature': 9.73362099347513}. Best is trial 3065 with value: 0.8863636363636364.
[32m[I 2023-04-21 02:54:25,186][39m Trial 4180 finished with value: 0.8539325842696629 and parameters: {'objective': 'Logloss', 'colsample_bylevel': 0.0744724314342541, 'depth': 4, 'boosting_type': 'Plain', 'bootstrap_type': 'Bayesian', 'bagging_temperature': 7.911976889819336}. Best is trial 3065 with value: 0.8863636363636364.
[32m[I 2023-04-21 02:54:26,235][39m Trial 4181 finished with value: 0.8275862068965518 and parameters: {'objective': 'CrossEntropy', 'colsample_bylevel': 0.09599434968990887, 'depth': 3, 'boosting_type': 'Plain', 'bootstrap_type': 'Bayesian', 'bagging_temperature': 9.441304403852723}. Best is trial 3065 with value: 0.8863636363636364.
[32m[I 2023-04-21 02:54:27,756][39m Trial 4182 finished with value: 0.8275862068965518 and parameters: {'objective': 'CrossEntropy', 'colsample_bylevel': 0.0853650605517831, 'depth': 9, 'boosting_type': 'Plain', 'bootstrap_type': 'Bayesian', 'bagging_temperature': 9.998689211735778}. Best is trial 3065 with value: 0.8863636363636364.
[32m[I 2023-04-21 02:54:28,402][39m Trial 4183 finished with value: 0.8409090909090909 and parameters: {'objective': 'CrossEntropy', 'colsample_bylevel': 0.07227682796034973, 'depth': 5, 'boosting_type': 'Plain', 'bootstrap_type': 'Bayesian', 'bagging_temperature': 9.398685209181785}. Best is trial 3065 with value: 0.8863636363636364.
[32m[I 2023-04-21 02:54:29,213][39m Trial 4184 finished with value: 0.8275862068965518 and parameters: {'objective': 'CrossEntropy', 'colsample_bylevel': 0.07280946822638547, 'depth': 10, 'boosting_type': 'Plain', 'bootstrap_type': 'Bayesian', 'bagging_temperature': 9.165033472995878}. Best is trial 3065 with value: 0.8863636363636364.
[32m[I 2023-04-21 02:54:30,429][39m Trial 4185 finished with value: 0.8539325842696629 and parameters: {'objective': 'CrossEntropy', 'colsample_bylevel': 0.07824550156234143, 'depth': 9, 'boosting_type': 'Plain', 'bootstrap_type': 'Bayesian', 'bagging_temperature': 9.454321865428625}. Best is trial 3065 with value: 0.8863636363636364.
[32m[I 2023-04-21 02:54:31,180][39m Trial 4186 finished with value: 0.8275862068965518 and parameters: {'objective': 'CrossEntropy', 'colsample_bylevel': 0.08703518467546183, 'depth': 7, 'boosting_type': 'Plain', 'bootstrap_type': 'Bayesian', 'bagging_temperature': 9.987605092617455}. Best is trial 3065 with value: 0.8863636363636364.
[32m[I 2023-04-21 02:54:32,141][39m Trial 4187 finished with value: 0.8666666666666666 and parameters: {'objective': 'CrossEntropy', 'colsample_bylevel': 0.07076520636999677, 'depth': 11, 'boosting_type': 'Plain', 'bootstrap_type': 'Bayesian', 'bagging_temperature': 9.02028242576372}. Best is trial 3065 with value: 0.8863636363636364.
[32m[I 2023-04-21 02:54:33,499][39m Trial 4188 finished with value: 0.8539325842696629 and parameters: {'objective': 'Logloss', 'colsample_bylevel': 0.09281745335048132, 'depth': 7, 'boosting_type': 'Plain', 'bootstrap_type': 'Bayesian', 'bagging_temperature': 8.42440118859388}. Best is trial 3065 with value: 0.8863636363636364.
[32m[I 2023-04-21 02:54:34,516][39m Trial 4189 finished with value: 0.8409090909090909 and parameters: {'objective': 'CrossEntropy', 'colsample_bylevel': 0.09708023676530946, 'depth': 3, 'boosting_type': 'Plain', 'bootstrap_type': 'Bayesian', 'bagging_temperature': 9.821195122274961}. Best is trial 3065 with value: 0.8863636363636364.
[32m[I 2023-04-21 02:54:35,555][39m Trial 4190 finished with value: 0.8666666666666666 and parameters: {'objective': 'CrossEntropy', 'colsample_bylevel': 0.08266222600143945, 'depth': 3, 'boosting_type': 'Plain', 'bootstrap_type': 'Bayesian', 'bagging_temperature': 9.765721386543163}. Best is trial 3065 with value: 0.8863636363636364.
[32m[I 2023-04-21 02:54:36,532][39m Trial 4191 finished with value: 0.8539325842696629 and parameters: {'objective': 'Logloss', 'colsample_bylevel': 0.06859221572773855, 'depth': 7, 'boosting_type': 'Plain', 'bootstrap_type': 'Bayesian', 'bagging_temperature': 9.346319101919532}. Best is trial 3065 with value: 0.8863636363636364.
[32m[I 2023-04-21 02:54:37,796][39m Trial 4192 finished with value: 0.8539325842696629 and parameters: {'objective': 'CrossEntropy', 'colsample_bylevel': 0.07162686185631877, 'depth': 11, 'boosting_type': 'Plain', 'bootstrap_type': 'Bayesian', 'bagging_temperature': 9.572085039911327}. Best is trial 3065 with value: 0.8863636363636364.
[32m[I 2023-04-21 02:54:41,750][39m Trial 4193 finished with value: 0.8409090909090909 and parameters: {'objective': 'Logloss', 'colsample_bylevel': 0.07391939300273381, 'depth': 4, 'boosting_type': 'Ordered', 'bootstrap_type': 'Bayesian', 'bagging_temperature': 9.691525051686051}. Best is trial 3065 with value: 0.8863636363636364.
[32m[I 2023-04-21 02:54:43,393][39m Trial 4194 finished with value: 0.8409090909090909 and parameters: {'objective': 'CrossEntropy', 'colsample_bylevel': 0.07686016851858662, 'depth': 9, 'boosting_type': 'Plain', 'bootstrap_type': 'Bayesian', 'bagging_temperature': 9.985455198203237}. Best is trial 3065 with value: 0.8863636363636364.
[32m[I 2023-04-21 02:54:44,483][39m Trial 4195 finished with value: 0.7999999999999999 and parameters: {'objective': 'CrossEntropy', 'colsample_bylevel': 0.08809506799581959, 'depth': 12, 'boosting_type': 'Plain', 'bootstrap_type': 'MVS'}. Best is trial 3065 with value: 0.8863636363636364.
[32m[I 2023-04-21 02:54:45,472][39m Trial 4196 finished with value: 0.8539325842696629 and parameters: {'objective': 'CrossEntropy', 'colsample_bylevel': 0.0739832960877882, 'depth': 10, 'boosting_type': 'Plain', 'bootstrap_type': 'Bayesian', 'bagging_temperature': 9.412741402249203}. Best is trial 3065 with value: 0.8863636363636364.
[32m[I 2023-04-21 02:54:46,306][39m Trial 4197 finished with value: 0.8409090909090909 and parameters: {'objective': 'CrossEntropy', 'colsample_bylevel': 0.07935789590134024, 'depth': 6, 'boosting_type': 'Plain', 'bootstrap_type': 'Bernoulli', 'subsample': 0.8098154625808325}. Best is trial 3065 with value: 0.8863636363636364.
[32m[I 2023-04-21 02:54:47,297][39m Trial 4198 finished with value: 0.8791208791208791 and parameters: {'objective': 'CrossEntropy', 'colsample_bylevel': 0.0862705197848331, 'depth': 3, 'boosting_type': 'Plain', 'bootstrap_type': 'Bayesian', 'bagging_temperature': 9.624315143102033}. Best is trial 3065 with value: 0.8863636363636364.
[32m[I 2023-04-21 02:54:48,490][39m Trial 4199 finished with value: 0.8409090909090909 and parameters: {'objective': 'Logloss', 'colsample_bylevel': 0.07049882734997256, 'depth': 5, 'boosting_type': 'Plain', 'bootstrap_type': 'Bayesian', 'bagging_temperature': 7.3679256216570685}. Best is trial 3065 with value: 0.8863636363636364.
[32m[I 2023-04-21 02:54:49,704][39m Trial 4200 finished with value: 0.8275862068965518 and parameters: {'objective': 'CrossEntropy', 'colsample_bylevel': 0.0887561073854656, 'depth': 3, 'boosting_type': 'Plain', 'bootstrap_type': 'Bernoulli', 'subsample': 0.1387077798002232}. Best is trial 3065 with value: 0.8863636363636364.
[32m[I 2023-04-21 02:54:50,753][39m Trial 4201 finished with value: 0.8409090909090909 and parameters: {'objective': 'CrossEntropy', 'colsample_bylevel': 0.07601041040336254, 'depth': 10, 'boosting_type': 'Plain', 'bootstrap_type': 'Bayesian', 'bagging_temperature': 8.622134377655154}. Best is trial 3065 with value: 0.8863636363636364.
[32m[I 2023-04-21 02:54:51,764][39m Trial 4202 finished with value: 0.8409090909090909 and parameters: {'objective': 'CrossEntropy', 'colsample_bylevel': 0.06851766173431384, 'depth': 7, 'boosting_type': 'Plain', 'bootstrap_type': 'Bayesian', 'bagging_temperature': 9.243409587787902}. Best is trial 3065 with value: 0.8863636363636364.
[32m[I 2023-04-21 02:54:52,511][39m Trial 4203 finished with value: 0.8409090909090909 and parameters: {'objective': 'CrossEntropy', 'colsample_bylevel': 0.06780516597962667, 'depth': 7, 'boosting_type': 'Plain', 'bootstrap_type': 'Bayesian', 'bagging_temperature': 9.321337209195379}. Best is trial 3065 with value: 0.8863636363636364.
[32m[I 2023-04-21 02:54:53,348][39m Trial 4204 finished with value: 0.8666666666666666 and parameters: {'objective': 'CrossEntropy', 'colsample_bylevel': 0.08573604854805891, 'depth': 3, 'boosting_type': 'Plain', 'bootstrap_type': 'Bayesian', 'bagging_temperature': 9.583885125816037}. Best is trial 3065 with value: 0.8863636363636364.
[32m[I 2023-04-21 02:54:54,035][39m Trial 4205 finished with value: 0.8539325842696629 and parameters: {'objective': 'CrossEntropy', 'colsample_bylevel': 0.07875923224039515, 'depth': 3, 'boosting_type': 'Plain', 'bootstrap_type': 'Bayesian', 'bagging_temperature': 9.987770868385487}. Best is trial 3065 with value: 0.8863636363636364.
[32m[I 2023-04-21 02:54:54,920][39m Trial 4206 finished with value: 0.8139534883720929 and parameters: {'objective': 'CrossEntropy', 'colsample_bylevel': 0.07036185258321251, 'depth': 11, 'boosting_type': 'Plain', 'bootstrap_type': 'MVS'}. Best is trial 3065 with value: 0.8863636363636364.
[32m[I 2023-04-21 02:54:56,690][39m Trial 4207 finished with value: 0.8505747126436782 and parameters: {'objective': 'CrossEntropy', 'colsample_bylevel': 0.08833032654022896, 'depth': 9, 'boosting_type': 'Plain', 'bootstrap_type': 'Bayesian', 'bagging_temperature': 9.842950331711169}. Best is trial 3065 with value: 0.8863636363636364.
[32m[I 2023-04-21 02:54:58,134][39m Trial 4208 finished with value: 0.8791208791208791 and parameters: {'objective': 'CrossEntropy', 'colsample_bylevel': 0.08143221382756537, 'depth': 3, 'boosting_type': 'Plain', 'bootstrap_type': 'Bayesian', 'bagging_temperature': 8.760696522957446}. Best is trial 3065 with value: 0.8863636363636364.
[32m[I 2023-04-21 02:54:58,881][39m Trial 4209 finished with value: 0.8539325842696629 and parameters: {'objective': 'Logloss', 'colsample_bylevel': 0.07357283972490034, 'depth': 5, 'boosting_type': 'Plain', 'bootstrap_type': 'Bayesian', 'bagging_temperature': 9.52110565040037}. Best is trial 3065 with value: 0.8863636363636364.
[32m[I 2023-04-21 02:54:59,717][39m Trial 4210 finished with value: 0.8409090909090909 and parameters: {'objective': 'CrossEntropy', 'colsample_bylevel': 0.07666453103240238, 'depth': 9, 'boosting_type': 'Plain', 'bootstrap_type': 'Bayesian', 'bagging_temperature': 9.799843580768103}. Best is trial 3065 with value: 0.8863636363636364.
[32m[I 2023-04-21 02:55:04,352][39m Trial 4211 finished with value: 0.8372093023255814 and parameters: {'objective': 'CrossEntropy', 'colsample_bylevel': 0.08376535610737022, 'depth': 9, 'boosting_type': 'Ordered', 'bootstrap_type': 'Bayesian', 'bagging_temperature': 9.653822236786302}. Best is trial 3065 with value: 0.8863636363636364.
[32m[I 2023-04-21 02:55:05,696][39m Trial 4212 finished with value: 0.8409090909090909 and parameters: {'objective': 'Logloss', 'colsample_bylevel': 0.0875184409981551, 'depth': 10, 'boosting_type': 'Plain', 'bootstrap_type': 'Bayesian', 'bagging_temperature': 9.662183869748473}. Best is trial 3065 with value: 0.8863636363636364.
[32m[I 2023-04-21 02:55:06,701][39m Trial 4213 finished with value: 0.8409090909090909 and parameters: {'objective': 'CrossEntropy', 'colsample_bylevel': 0.07454304903679272, 'depth': 4, 'boosting_type': 'Plain', 'bootstrap_type': 'Bayesian', 'bagging_temperature': 9.98653906283394}. Best is trial 3065 with value: 0.8863636363636364.
[32m[I 2023-04-21 02:55:08,104][39m Trial 4214 finished with value: 0.8409090909090909 and parameters: {'objective': 'CrossEntropy', 'colsample_bylevel': 0.06726240139757717, 'depth': 9, 'boosting_type': 'Plain', 'bootstrap_type': 'Bayesian', 'bagging_temperature': 5.83564515224827}. Best is trial 3065 with value: 0.8863636363636364.
[32m[I 2023-04-21 02:55:08,847][39m Trial 4215 finished with value: 0.8539325842696629 and parameters: {'objective': 'CrossEntropy', 'colsample_bylevel': 0.07257105009790324, 'depth': 10, 'boosting_type': 'Plain', 'bootstrap_type': 'Bayesian', 'bagging_temperature': 9.285050801384804}. Best is trial 3065 with value: 0.8863636363636364.
[32m[I 2023-04-21 02:55:09,760][39m Trial 4216 finished with value: 0.8539325842696629 and parameters: {'objective': 'Logloss', 'colsample_bylevel': 0.07090982876379695, 'depth': 11, 'boosting_type': 'Plain', 'bootstrap_type': 'Bayesian', 'bagging_temperature': 8.853664489938529}. Best is trial 3065 with value: 0.8863636363636364.
