[32m[I 2023-04-21 02:11:28,625][39m Trial 1983 finished with value: 0.8181818181818182 and parameters: {'objective': 'CrossEntropy', 'colsample_bylevel': 0.0748301354758844, 'depth': 4, 'boosting_type': 'Plain', 'bootstrap_type': 'MVS'}. Best is trial 98 with value: 0.8791208791208791.
[32m[I 2023-04-21 02:11:29,514][39m Trial 1984 finished with value: 0.8539325842696629 and parameters: {'objective': 'Logloss', 'colsample_bylevel': 0.07470466834955815, 'depth': 10, 'boosting_type': 'Plain', 'bootstrap_type': 'Bernoulli', 'subsample': 0.6890165646738482}. Best is trial 98 with value: 0.8791208791208791.
[32m[I 2023-04-21 02:11:30,633][39m Trial 1985 finished with value: 0.8539325842696629 and parameters: {'objective': 'CrossEntropy', 'colsample_bylevel': 0.07887012275145647, 'depth': 12, 'boosting_type': 'Plain', 'bootstrap_type': 'Bayesian', 'bagging_temperature': 8.471667622726976}. Best is trial 98 with value: 0.8791208791208791.
[32m[I 2023-04-21 02:11:31,654][39m Trial 1986 finished with value: 0.8139534883720929 and parameters: {'objective': 'CrossEntropy', 'colsample_bylevel': 0.07326478588790186, 'depth': 4, 'boosting_type': 'Plain', 'bootstrap_type': 'Bayesian', 'bagging_temperature': 9.783896405806995}. Best is trial 98 with value: 0.8791208791208791.
[32m[I 2023-04-21 02:11:32,480][39m Trial 1987 finished with value: 0.8666666666666666 and parameters: {'objective': 'CrossEntropy', 'colsample_bylevel': 0.08115023791275142, 'depth': 3, 'boosting_type': 'Plain', 'bootstrap_type': 'Bayesian', 'bagging_temperature': 9.096375790983611}. Best is trial 98 with value: 0.8791208791208791.
[32m[I 2023-04-21 02:11:33,347][39m Trial 1988 finished with value: 0.8139534883720929 and parameters: {'objective': 'CrossEntropy', 'colsample_bylevel': 0.08369603263760433, 'depth': 10, 'boosting_type': 'Plain', 'bootstrap_type': 'Bayesian', 'bagging_temperature': 9.697032585215034}. Best is trial 98 with value: 0.8791208791208791.
[32m[I 2023-04-21 02:11:34,115][39m Trial 1989 finished with value: 0.8539325842696629 and parameters: {'objective': 'Logloss', 'colsample_bylevel': 0.06763103905971854, 'depth': 5, 'boosting_type': 'Plain', 'bootstrap_type': 'Bayesian', 'bagging_temperature': 9.36495978680805}. Best is trial 98 with value: 0.8791208791208791.
[32m[I 2023-04-21 02:11:34,868][39m Trial 1990 finished with value: 0.8539325842696629 and parameters: {'objective': 'CrossEntropy', 'colsample_bylevel': 0.07553577406166405, 'depth': 10, 'boosting_type': 'Plain', 'bootstrap_type': 'Bayesian', 'bagging_temperature': 9.35330543916772}. Best is trial 98 with value: 0.8791208791208791.
[32m[I 2023-04-21 02:11:35,697][39m Trial 1991 finished with value: 0.8791208791208791 and parameters: {'objective': 'Logloss', 'colsample_bylevel': 0.07797416327149045, 'depth': 5, 'boosting_type': 'Plain', 'bootstrap_type': 'Bayesian', 'bagging_temperature': 9.388906134753707}. Best is trial 98 with value: 0.8791208791208791.
[32m[I 2023-04-21 02:11:36,677][39m Trial 1992 finished with value: 0.8666666666666666 and parameters: {'objective': 'Logloss', 'colsample_bylevel': 0.07410709485648538, 'depth': 5, 'boosting_type': 'Plain', 'bootstrap_type': 'Bayesian', 'bagging_temperature': 9.9965564717802}. Best is trial 98 with value: 0.8791208791208791.
[32m[I 2023-04-21 02:11:37,602][39m Trial 1993 finished with value: 0.8539325842696629 and parameters: {'objective': 'Logloss', 'colsample_bylevel': 0.07203072868445046, 'depth': 5, 'boosting_type': 'Plain', 'bootstrap_type': 'Bayesian', 'bagging_temperature': 6.653307868071565}. Best is trial 98 with value: 0.8791208791208791.
[32m[I 2023-04-21 02:11:42,323][39m Trial 1994 finished with value: 0.8666666666666666 and parameters: {'objective': 'CrossEntropy', 'colsample_bylevel': 0.07396789870210524, 'depth': 3, 'boosting_type': 'Ordered', 'bootstrap_type': 'Bayesian', 'bagging_temperature': 9.970645759390353}. Best is trial 98 with value: 0.8791208791208791.
[32m[I 2023-04-21 02:11:43,341][39m Trial 1995 finished with value: 0.8314606741573034 and parameters: {'objective': 'CrossEntropy', 'colsample_bylevel': 0.09273220385651615, 'depth': 3, 'boosting_type': 'Plain', 'bootstrap_type': 'Bayesian', 'bagging_temperature': 3.9794279027754484}. Best is trial 98 with value: 0.8791208791208791.
[32m[I 2023-04-21 02:11:44,295][39m Trial 1996 finished with value: 0.8409090909090909 and parameters: {'objective': 'Logloss', 'colsample_bylevel': 0.08054907437072456, 'depth': 3, 'boosting_type': 'Plain', 'bootstrap_type': 'MVS'}. Best is trial 98 with value: 0.8791208791208791.
[32m[I 2023-04-21 02:11:45,242][39m Trial 1997 finished with value: 0.8539325842696629 and parameters: {'objective': 'CrossEntropy', 'colsample_bylevel': 0.07857094018726499, 'depth': 3, 'boosting_type': 'Plain', 'bootstrap_type': 'Bayesian', 'bagging_temperature': 8.228738052344141}. Best is trial 98 with value: 0.8791208791208791.
[32m[I 2023-04-21 02:11:46,185][39m Trial 1998 finished with value: 0.8666666666666666 and parameters: {'objective': 'CrossEntropy', 'colsample_bylevel': 0.07919786444832132, 'depth': 3, 'boosting_type': 'Plain', 'bootstrap_type': 'Bayesian', 'bagging_temperature': 8.486548207063795}. Best is trial 98 with value: 0.8791208791208791.
[32m[I 2023-04-21 02:11:46,801][39m Trial 1999 finished with value: 0.8666666666666666 and parameters: {'objective': 'CrossEntropy', 'colsample_bylevel': 0.06923037530982992, 'depth': 4, 'boosting_type': 'Plain', 'bootstrap_type': 'Bayesian', 'bagging_temperature': 8.534152076327997}. Best is trial 98 with value: 0.8791208791208791.
[32m[I 2023-04-21 02:11:47,471][39m Trial 2000 finished with value: 0.8539325842696629 and parameters: {'objective': 'CrossEntropy', 'colsample_bylevel': 0.08257151986593474, 'depth': 3, 'boosting_type': 'Plain', 'bootstrap_type': 'Bayesian', 'bagging_temperature': 8.743869542233194}. Best is trial 98 with value: 0.8791208791208791.
[32m[I 2023-04-21 02:11:48,409][39m Trial 2001 finished with value: 0.8409090909090909 and parameters: {'objective': 'Logloss', 'colsample_bylevel': 0.06997431534040251, 'depth': 4, 'boosting_type': 'Plain', 'bootstrap_type': 'Bayesian', 'bagging_temperature': 9.78723103496209}. Best is trial 98 with value: 0.8791208791208791.
[32m[I 2023-04-21 02:11:49,317][39m Trial 2002 finished with value: 0.8409090909090909 and parameters: {'objective': 'Logloss', 'colsample_bylevel': 0.07367163577715675, 'depth': 4, 'boosting_type': 'Plain', 'bootstrap_type': 'Bayesian', 'bagging_temperature': 9.653537800430287}. Best is trial 98 with value: 0.8791208791208791.
[32m[I 2023-04-21 02:11:50,178][39m Trial 2003 finished with value: 0.8666666666666666 and parameters: {'objective': 'CrossEntropy', 'colsample_bylevel': 0.0803540601432949, 'depth': 3, 'boosting_type': 'Plain', 'bootstrap_type': 'Bayesian', 'bagging_temperature': 9.998212515314131}. Best is trial 98 with value: 0.8791208791208791.
[32m[I 2023-04-21 02:11:51,250][39m Trial 2004 finished with value: 0.8260869565217392 and parameters: {'objective': 'CrossEntropy', 'colsample_bylevel': 0.08278710103384257, 'depth': 2, 'boosting_type': 'Plain', 'bootstrap_type': 'MVS'}. Best is trial 98 with value: 0.8791208791208791.
[32m[I 2023-04-21 02:11:52,142][39m Trial 2005 finished with value: 0.8666666666666666 and parameters: {'objective': 'Logloss', 'colsample_bylevel': 0.0712928555332041, 'depth': 6, 'boosting_type': 'Plain', 'bootstrap_type': 'Bayesian', 'bagging_temperature': 9.490710664447274}. Best is trial 98 with value: 0.8791208791208791.
[32m[I 2023-04-21 02:11:52,832][39m Trial 2006 finished with value: 0.8539325842696629 and parameters: {'objective': 'Logloss', 'colsample_bylevel': 0.07688903457439264, 'depth': 6, 'boosting_type': 'Plain', 'bootstrap_type': 'Bayesian', 'bagging_temperature': 7.048643029358779}. Best is trial 98 with value: 0.8791208791208791.
[32m[I 2023-04-21 02:11:53,589][39m Trial 2007 finished with value: 0.8666666666666666 and parameters: {'objective': 'CrossEntropy', 'colsample_bylevel': 0.07896147765428561, 'depth': 3, 'boosting_type': 'Plain', 'bootstrap_type': 'Bayesian', 'bagging_temperature': 8.54417701051824}. Best is trial 98 with value: 0.8791208791208791.
[32m[I 2023-04-21 02:11:54,429][39m Trial 2008 finished with value: 0.8539325842696629 and parameters: {'objective': 'CrossEntropy', 'colsample_bylevel': 0.07853539730398663, 'depth': 3, 'boosting_type': 'Plain', 'bootstrap_type': 'Bayesian', 'bagging_temperature': 9.11824071287263}. Best is trial 98 with value: 0.8791208791208791.
[32m[I 2023-04-21 02:11:55,049][39m Trial 2009 finished with value: 0.8181818181818182 and parameters: {'objective': 'CrossEntropy', 'colsample_bylevel': 0.07669326056074818, 'depth': 2, 'boosting_type': 'Plain', 'bootstrap_type': 'Bernoulli', 'subsample': 0.7280070830565369}. Best is trial 98 with value: 0.8791208791208791.
[32m[I 2023-04-21 02:11:56,175][39m Trial 2010 finished with value: 0.8409090909090909 and parameters: {'objective': 'Logloss', 'colsample_bylevel': 0.08642039306516645, 'depth': 6, 'boosting_type': 'Plain', 'bootstrap_type': 'Bayesian', 'bagging_temperature': 8.985085717470064}. Best is trial 98 with value: 0.8791208791208791.
[32m[I 2023-04-21 02:12:01,149][39m Trial 2011 finished with value: 0.8409090909090909 and parameters: {'objective': 'CrossEntropy', 'colsample_bylevel': 0.0817669191581804, 'depth': 3, 'boosting_type': 'Ordered', 'bootstrap_type': 'Bayesian', 'bagging_temperature': 9.104550875822708}. Best is trial 98 with value: 0.8791208791208791.
[32m[I 2023-04-21 02:12:02,056][39m Trial 2012 finished with value: 0.8275862068965518 and parameters: {'objective': 'CrossEntropy', 'colsample_bylevel': 0.08101892371325545, 'depth': 3, 'boosting_type': 'Plain', 'bootstrap_type': 'Bayesian', 'bagging_temperature': 0.7694705294994595}. Best is trial 98 with value: 0.8791208791208791.
[32m[I 2023-04-21 02:12:03,007][39m Trial 2013 finished with value: 0.8505747126436782 and parameters: {'objective': 'CrossEntropy', 'colsample_bylevel': 0.09128576387868975, 'depth': 6, 'boosting_type': 'Plain', 'bootstrap_type': 'Bayesian', 'bagging_temperature': 9.79017277920995}. Best is trial 98 with value: 0.8791208791208791.
[32m[I 2023-04-21 02:12:04,046][39m Trial 2014 finished with value: 0.8539325842696629 and parameters: {'objective': 'Logloss', 'colsample_bylevel': 0.07156191329067633, 'depth': 3, 'boosting_type': 'Plain', 'bootstrap_type': 'Bayesian', 'bagging_temperature': 9.981894637813934}. Best is trial 98 with value: 0.8791208791208791.
[32m[I 2023-04-21 02:12:04,999][39m Trial 2015 finished with value: 0.8539325842696629 and parameters: {'objective': 'Logloss', 'colsample_bylevel': 0.07265219078854429, 'depth': 4, 'boosting_type': 'Plain', 'bootstrap_type': 'Bayesian', 'bagging_temperature': 9.702093480742832}. Best is trial 98 with value: 0.8791208791208791.
[32m[I 2023-04-21 02:12:05,922][39m Trial 2016 finished with value: 0.8539325842696629 and parameters: {'objective': 'Logloss', 'colsample_bylevel': 0.07396024168978248, 'depth': 4, 'boosting_type': 'Plain', 'bootstrap_type': 'Bayesian', 'bagging_temperature': 9.990836255439493}. Best is trial 98 with value: 0.8791208791208791.
[32m[I 2023-04-21 02:12:06,724][39m Trial 2017 finished with value: 0.8275862068965518 and parameters: {'objective': 'Logloss', 'colsample_bylevel': 0.03384765353848847, 'depth': 5, 'boosting_type': 'Plain', 'bootstrap_type': 'Bayesian', 'bagging_temperature': 1.507046088033373}. Best is trial 98 with value: 0.8791208791208791.
[32m[I 2023-04-21 02:12:07,332][39m Trial 2018 finished with value: 0.8539325842696629 and parameters: {'objective': 'CrossEntropy', 'colsample_bylevel': 0.08545600083133341, 'depth': 4, 'boosting_type': 'Plain', 'bootstrap_type': 'Bayesian', 'bagging_temperature': 9.593355048529155}. Best is trial 98 with value: 0.8791208791208791.
[32m[I 2023-04-21 02:12:08,286][39m Trial 2019 finished with value: 0.8666666666666666 and parameters: {'objective': 'Logloss', 'colsample_bylevel': 0.0754798350078203, 'depth': 5, 'boosting_type': 'Plain', 'bootstrap_type': 'Bayesian', 'bagging_temperature': 9.395507289718408}. Best is trial 98 with value: 0.8791208791208791.
[32m[I 2023-04-21 02:12:09,329][39m Trial 2020 finished with value: 0.8275862068965518 and parameters: {'objective': 'CrossEntropy', 'colsample_bylevel': 0.08024020366147219, 'depth': 4, 'boosting_type': 'Plain', 'bootstrap_type': 'Bayesian', 'bagging_temperature': 9.712701745821679}. Best is trial 98 with value: 0.8791208791208791.
[32m[I 2023-04-21 02:12:10,078][39m Trial 2021 finished with value: 0.8666666666666666 and parameters: {'objective': 'Logloss', 'colsample_bylevel': 0.08000660159484, 'depth': 5, 'boosting_type': 'Plain', 'bootstrap_type': 'Bayesian', 'bagging_temperature': 9.791434575643393}. Best is trial 98 with value: 0.8791208791208791.
[32m[I 2023-04-21 02:12:10,692][39m Trial 2022 finished with value: 0.8314606741573034 and parameters: {'objective': 'CrossEntropy', 'colsample_bylevel': 0.08347851221711552, 'depth': 3, 'boosting_type': 'Plain', 'bootstrap_type': 'MVS'}. Best is trial 98 with value: 0.8791208791208791.
[32m[I 2023-04-21 02:12:11,603][39m Trial 2023 finished with value: 0.8666666666666666 and parameters: {'objective': 'CrossEntropy', 'colsample_bylevel': 0.067075294939687, 'depth': 5, 'boosting_type': 'Plain', 'bootstrap_type': 'Bayesian', 'bagging_temperature': 9.637634165746205}. Best is trial 98 with value: 0.8791208791208791.
[32m[I 2023-04-21 02:12:12,498][39m Trial 2024 finished with value: 0.8539325842696629 and parameters: {'objective': 'CrossEntropy', 'colsample_bylevel': 0.08078779564538642, 'depth': 4, 'boosting_type': 'Plain', 'bootstrap_type': 'Bayesian', 'bagging_temperature': 9.991572344952203}. Best is trial 98 with value: 0.8791208791208791.
[32m[I 2023-04-21 02:12:13,416][39m Trial 2025 finished with value: 0.8409090909090909 and parameters: {'objective': 'CrossEntropy', 'colsample_bylevel': 0.08132351689666374, 'depth': 4, 'boosting_type': 'Plain', 'bootstrap_type': 'Bayesian', 'bagging_temperature': 9.834210646454443}. Best is trial 98 with value: 0.8791208791208791.
[32m[I 2023-04-21 02:12:14,276][39m Trial 2026 finished with value: 0.8666666666666666 and parameters: {'objective': 'Logloss', 'colsample_bylevel': 0.07652736432424596, 'depth': 4, 'boosting_type': 'Plain', 'bootstrap_type': 'Bayesian', 'bagging_temperature': 8.055376665136711}. Best is trial 98 with value: 0.8791208791208791.
[32m[I 2023-04-21 02:12:15,189][39m Trial 2027 finished with value: 0.8539325842696629 and parameters: {'objective': 'Logloss', 'colsample_bylevel': 0.07409626615107094, 'depth': 10, 'boosting_type': 'Plain', 'bootstrap_type': 'Bayesian', 'bagging_temperature': 8.050907704733714}. Best is trial 98 with value: 0.8791208791208791.
[32m[I 2023-04-21 02:12:16,068][39m Trial 2028 finished with value: 0.8539325842696629 and parameters: {'objective': 'CrossEntropy', 'colsample_bylevel': 0.07775029575407542, 'depth': 4, 'boosting_type': 'Plain', 'bootstrap_type': 'Bayesian', 'bagging_temperature': 9.820644975004425}. Best is trial 98 with value: 0.8791208791208791.
[32m[I 2023-04-21 02:12:16,912][39m Trial 2029 finished with value: 0.7555555555555555 and parameters: {'objective': 'CrossEntropy', 'colsample_bylevel': 0.01414306240717772, 'depth': 3, 'boosting_type': 'Plain', 'bootstrap_type': 'Bernoulli', 'subsample': 0.2184895951508204}. Best is trial 98 with value: 0.8791208791208791.
[32m[I 2023-04-21 02:12:17,899][39m Trial 2030 finished with value: 0.8275862068965518 and parameters: {'objective': 'Logloss', 'colsample_bylevel': 0.08571438729100331, 'depth': 4, 'boosting_type': 'Plain', 'bootstrap_type': 'Bayesian', 'bagging_temperature': 9.419377514321756}. Best is trial 98 with value: 0.8791208791208791.
[32m[I 2023-04-21 02:12:22,855][39m Trial 2031 finished with value: 0.8409090909090909 and parameters: {'objective': 'Logloss', 'colsample_bylevel': 0.09605645041949165, 'depth': 8, 'boosting_type': 'Ordered', 'bootstrap_type': 'Bayesian', 'bagging_temperature': 8.429054686919137}. Best is trial 98 with value: 0.8791208791208791.
[32m[I 2023-04-21 02:12:23,757][39m Trial 2032 finished with value: 0.8539325842696629 and parameters: {'objective': 'CrossEntropy', 'colsample_bylevel': 0.05476163977485993, 'depth': 3, 'boosting_type': 'Plain', 'bootstrap_type': 'Bayesian', 'bagging_temperature': 8.826875131006972}. Best is trial 98 with value: 0.8791208791208791.
[32m[I 2023-04-21 02:12:24,900][39m Trial 2033 finished with value: 0.8666666666666666 and parameters: {'objective': 'Logloss', 'colsample_bylevel': 0.0703302592798275, 'depth': 3, 'boosting_type': 'Plain', 'bootstrap_type': 'Bayesian', 'bagging_temperature': 9.566826260593526}. Best is trial 98 with value: 0.8791208791208791.
[32m[I 2023-04-21 02:12:25,907][39m Trial 2034 finished with value: 0.8539325842696629 and parameters: {'objective': 'Logloss', 'colsample_bylevel': 0.09042210123042256, 'depth': 3, 'boosting_type': 'Plain', 'bootstrap_type': 'Bayesian', 'bagging_temperature': 9.402103278445216}. Best is trial 98 with value: 0.8791208791208791.
[32m[I 2023-04-21 02:12:26,560][39m Trial 2035 finished with value: 0.8222222222222222 and parameters: {'objective': 'CrossEntropy', 'colsample_bylevel': 0.07585035685498989, 'depth': 2, 'boosting_type': 'Plain', 'bootstrap_type': 'MVS'}. Best is trial 98 with value: 0.8791208791208791.
[32m[I 2023-04-21 02:12:27,184][39m Trial 2036 finished with value: 0.8275862068965518 and parameters: {'objective': 'Logloss', 'colsample_bylevel': 0.07722853930377163, 'depth': 11, 'boosting_type': 'Plain', 'bootstrap_type': 'Bayesian', 'bagging_temperature': 8.68789225108025}. Best is trial 98 with value: 0.8791208791208791.
[32m[I 2023-04-21 02:12:27,999][39m Trial 2037 finished with value: 0.8539325842696629 and parameters: {'objective': 'CrossEntropy', 'colsample_bylevel': 0.07762065996744341, 'depth': 3, 'boosting_type': 'Plain', 'bootstrap_type': 'Bayesian', 'bagging_temperature': 8.393350840949939}. Best is trial 98 with value: 0.8791208791208791.
[32m[I 2023-04-21 02:12:28,912][39m Trial 2038 finished with value: 0.8275862068965518 and parameters: {'objective': 'Logloss', 'colsample_bylevel': 0.07749822178193223, 'depth': 5, 'boosting_type': 'Plain', 'bootstrap_type': 'Bayesian', 'bagging_temperature': 8.843243269567273}. Best is trial 98 with value: 0.8791208791208791.
[32m[I 2023-04-21 02:12:29,861][39m Trial 2039 finished with value: 0.8539325842696629 and parameters: {'objective': 'Logloss', 'colsample_bylevel': 0.07099513497488177, 'depth': 5, 'boosting_type': 'Plain', 'bootstrap_type': 'Bayesian', 'bagging_temperature': 9.508030513819627}. Best is trial 98 with value: 0.8791208791208791.
[32m[I 2023-04-21 02:12:30,824][39m Trial 2040 finished with value: 0.8539325842696629 and parameters: {'objective': 'Logloss', 'colsample_bylevel': 0.07223804239874675, 'depth': 4, 'boosting_type': 'Plain', 'bootstrap_type': 'Bayesian', 'bagging_temperature': 9.649589075146965}. Best is trial 98 with value: 0.8791208791208791.
[32m[I 2023-04-21 02:12:31,704][39m Trial 2041 finished with value: 0.8666666666666666 and parameters: {'objective': 'Logloss', 'colsample_bylevel': 0.07574876035587011, 'depth': 4, 'boosting_type': 'Plain', 'bootstrap_type': 'Bayesian', 'bagging_temperature': 9.227297029214368}. Best is trial 98 with value: 0.8791208791208791.
[32m[I 2023-04-21 02:12:32,442][39m Trial 2042 finished with value: 0.8539325842696629 and parameters: {'objective': 'CrossEntropy', 'colsample_bylevel': 0.07955920943305314, 'depth': 3, 'boosting_type': 'Plain', 'bootstrap_type': 'Bayesian', 'bagging_temperature': 8.649060453099619}. Best is trial 98 with value: 0.8791208791208791.
[32m[I 2023-04-21 02:12:33,076][39m Trial 2043 finished with value: 0.8409090909090909 and parameters: {'objective': 'CrossEntropy', 'colsample_bylevel': 0.07936781779334443, 'depth': 3, 'boosting_type': 'Plain', 'bootstrap_type': 'MVS'}. Best is trial 98 with value: 0.8791208791208791.
[32m[I 2023-04-21 02:12:34,176][39m Trial 2044 finished with value: 0.8666666666666666 and parameters: {'objective': 'CrossEntropy', 'colsample_bylevel': 0.07542291978765626, 'depth': 4, 'boosting_type': 'Plain', 'bootstrap_type': 'Bayesian', 'bagging_temperature': 9.068148046345218}. Best is trial 98 with value: 0.8791208791208791.
[32m[I 2023-04-21 02:12:34,965][39m Trial 2045 finished with value: 0.8314606741573034 and parameters: {'objective': 'CrossEntropy', 'colsample_bylevel': 0.09669333160768769, 'depth': 3, 'boosting_type': 'Plain', 'bootstrap_type': 'Bernoulli', 'subsample': 0.37487191503619627}. Best is trial 98 with value: 0.8791208791208791.
[32m[I 2023-04-21 02:12:35,891][39m Trial 2046 finished with value: 0.8539325842696629 and parameters: {'objective': 'Logloss', 'colsample_bylevel': 0.07213130726511142, 'depth': 4, 'boosting_type': 'Plain', 'bootstrap_type': 'Bayesian', 'bagging_temperature': 8.95306063061455}. Best is trial 98 with value: 0.8791208791208791.
[32m[I 2023-04-21 02:12:37,073][39m Trial 2047 finished with value: 0.8666666666666666 and parameters: {'objective': 'CrossEntropy', 'colsample_bylevel': 0.078100381859242, 'depth': 3, 'boosting_type': 'Plain', 'bootstrap_type': 'Bayesian', 'bagging_temperature': 8.946205615535526}. Best is trial 98 with value: 0.8791208791208791.
[32m[I 2023-04-21 02:12:42,085][39m Trial 2048 finished with value: 0.8539325842696629 and parameters: {'objective': 'CrossEntropy', 'colsample_bylevel': 0.09656668958044994, 'depth': 3, 'boosting_type': 'Ordered', 'bootstrap_type': 'Bayesian', 'bagging_temperature': 9.801769534496088}. Best is trial 98 with value: 0.8791208791208791.
