[32m[I 2023-04-21 02:07:47,146][39m Trial 1785 finished with value: 0.8409090909090909 and parameters: {'objective': 'CrossEntropy', 'colsample_bylevel': 0.0922413403399542, 'depth': 4, 'boosting_type': 'Ordered', 'bootstrap_type': 'Bayesian', 'bagging_temperature': 9.80161019307047}. Best is trial 98 with value: 0.8791208791208791.
[32m[I 2023-04-21 02:07:48,328][39m Trial 1786 finished with value: 0.8139534883720929 and parameters: {'objective': 'CrossEntropy', 'colsample_bylevel': 0.0809218809719163, 'depth': 4, 'boosting_type': 'Plain', 'bootstrap_type': 'Bayesian', 'bagging_temperature': 9.176167855316677}. Best is trial 98 with value: 0.8791208791208791.
[32m[I 2023-04-21 02:07:49,376][39m Trial 1787 finished with value: 0.8409090909090909 and parameters: {'objective': 'CrossEntropy', 'colsample_bylevel': 0.09414271576677843, 'depth': 3, 'boosting_type': 'Plain', 'bootstrap_type': 'Bayesian', 'bagging_temperature': 9.965995764949334}. Best is trial 98 with value: 0.8791208791208791.
[32m[I 2023-04-21 02:07:50,216][39m Trial 1788 finished with value: 0.8539325842696629 and parameters: {'objective': 'CrossEntropy', 'colsample_bylevel': 0.08011285028371738, 'depth': 3, 'boosting_type': 'Plain', 'bootstrap_type': 'Bayesian', 'bagging_temperature': 9.4255240336265}. Best is trial 98 with value: 0.8791208791208791.
[32m[I 2023-04-21 02:07:50,810][39m Trial 1789 finished with value: 0.8409090909090909 and parameters: {'objective': 'CrossEntropy', 'colsample_bylevel': 0.08440203921445188, 'depth': 3, 'boosting_type': 'Plain', 'bootstrap_type': 'Bayesian', 'bagging_temperature': 9.638639281808592}. Best is trial 98 with value: 0.8791208791208791.
[32m[I 2023-04-21 02:07:51,795][39m Trial 1790 finished with value: 0.8539325842696629 and parameters: {'objective': 'CrossEntropy', 'colsample_bylevel': 0.0732096884723363, 'depth': 10, 'boosting_type': 'Plain', 'bootstrap_type': 'Bayesian', 'bagging_temperature': 8.89342805089854}. Best is trial 98 with value: 0.8791208791208791.
[32m[I 2023-04-21 02:07:52,482][39m Trial 1791 finished with value: 0.8409090909090909 and parameters: {'objective': 'CrossEntropy', 'colsample_bylevel': 0.07606152861745819, 'depth': 3, 'boosting_type': 'Plain', 'bootstrap_type': 'Bernoulli', 'subsample': 0.8478972150679804}. Best is trial 98 with value: 0.8791208791208791.
[32m[I 2023-04-21 02:07:53,386][39m Trial 1792 finished with value: 0.8539325842696629 and parameters: {'objective': 'Logloss', 'colsample_bylevel': 0.0710240675994262, 'depth': 4, 'boosting_type': 'Plain', 'bootstrap_type': 'Bayesian', 'bagging_temperature': 9.472292447156203}. Best is trial 98 with value: 0.8791208791208791.
[32m[I 2023-04-21 02:07:54,302][39m Trial 1793 finished with value: 0.8539325842696629 and parameters: {'objective': 'CrossEntropy', 'colsample_bylevel': 0.09020813976553815, 'depth': 12, 'boosting_type': 'Plain', 'bootstrap_type': 'Bayesian', 'bagging_temperature': 9.154813438027928}. Best is trial 98 with value: 0.8791208791208791.
[32m[I 2023-04-21 02:07:55,401][39m Trial 1794 finished with value: 0.8409090909090909 and parameters: {'objective': 'CrossEntropy', 'colsample_bylevel': 0.07270778857189467, 'depth': 3, 'boosting_type': 'Plain', 'bootstrap_type': 'MVS'}. Best is trial 98 with value: 0.8791208791208791.
[32m[I 2023-04-21 02:07:56,071][39m Trial 1795 finished with value: 0.8539325842696629 and parameters: {'objective': 'CrossEntropy', 'colsample_bylevel': 0.07994134928929979, 'depth': 3, 'boosting_type': 'Plain', 'bootstrap_type': 'Bayesian', 'bagging_temperature': 9.28410106681218}. Best is trial 98 with value: 0.8791208791208791.
[32m[I 2023-04-21 02:07:57,220][39m Trial 1796 finished with value: 0.8539325842696629 and parameters: {'objective': 'CrossEntropy', 'colsample_bylevel': 0.07754471445095948, 'depth': 8, 'boosting_type': 'Plain', 'bootstrap_type': 'Bayesian', 'bagging_temperature': 8.752411189629008}. Best is trial 98 with value: 0.8791208791208791.
[32m[I 2023-04-21 02:07:58,218][39m Trial 1797 finished with value: 0.8636363636363636 and parameters: {'objective': 'CrossEntropy', 'colsample_bylevel': 0.09834349012731464, 'depth': 11, 'boosting_type': 'Plain', 'bootstrap_type': 'Bayesian', 'bagging_temperature': 9.776040811220929}. Best is trial 98 with value: 0.8791208791208791.
[32m[I 2023-04-21 02:07:58,917][39m Trial 1798 finished with value: 0.8505747126436782 and parameters: {'objective': 'CrossEntropy', 'colsample_bylevel': 0.08563762964714759, 'depth': 9, 'boosting_type': 'Plain', 'bootstrap_type': 'Bayesian', 'bagging_temperature': 9.409395239848864}. Best is trial 98 with value: 0.8791208791208791.
[32m[I 2023-04-21 02:07:59,853][39m Trial 1799 finished with value: 0.8409090909090909 and parameters: {'objective': 'CrossEntropy', 'colsample_bylevel': 0.07992654184751884, 'depth': 6, 'boosting_type': 'Plain', 'bootstrap_type': 'Bayesian', 'bagging_temperature': 9.230090762963256}. Best is trial 98 with value: 0.8791208791208791.
[32m[I 2023-04-21 02:08:00,687][39m Trial 1800 finished with value: 0.8666666666666666 and parameters: {'objective': 'CrossEntropy', 'colsample_bylevel': 0.07762082545497911, 'depth': 3, 'boosting_type': 'Plain', 'bootstrap_type': 'Bayesian', 'bagging_temperature': 9.845856651849298}. Best is trial 98 with value: 0.8791208791208791.
[32m[I 2023-04-21 02:08:01,623][39m Trial 1801 finished with value: 0.8666666666666666 and parameters: {'objective': 'CrossEntropy', 'colsample_bylevel': 0.07887500998557649, 'depth': 3, 'boosting_type': 'Plain', 'bootstrap_type': 'Bayesian', 'bagging_temperature': 8.885719644242352}. Best is trial 98 with value: 0.8791208791208791.
[32m[I 2023-04-21 02:08:02,471][39m Trial 1802 finished with value: 0.8666666666666666 and parameters: {'objective': 'Logloss', 'colsample_bylevel': 0.08005612603745053, 'depth': 3, 'boosting_type': 'Plain', 'bootstrap_type': 'Bayesian', 'bagging_temperature': 7.9448602772709185}. Best is trial 98 with value: 0.8791208791208791.
[32m[I 2023-04-21 02:08:07,126][39m Trial 1803 finished with value: 0.8275862068965518 and parameters: {'objective': 'CrossEntropy', 'colsample_bylevel': 0.07603490728800806, 'depth': 4, 'boosting_type': 'Ordered', 'bootstrap_type': 'Bayesian', 'bagging_temperature': 5.13013675897971}. Best is trial 98 with value: 0.8791208791208791.
[32m[I 2023-04-21 02:08:08,212][39m Trial 1804 finished with value: 0.8539325842696629 and parameters: {'objective': 'CrossEntropy', 'colsample_bylevel': 0.06401489847592506, 'depth': 5, 'boosting_type': 'Plain', 'bootstrap_type': 'Bayesian', 'bagging_temperature': 7.2253440083192215}. Best is trial 98 with value: 0.8791208791208791.
[32m[I 2023-04-21 02:08:09,302][39m Trial 1805 finished with value: 0.8539325842696629 and parameters: {'objective': 'CrossEntropy', 'colsample_bylevel': 0.08421530111539907, 'depth': 3, 'boosting_type': 'Plain', 'bootstrap_type': 'Bayesian', 'bagging_temperature': 8.975066179611508}. Best is trial 98 with value: 0.8791208791208791.
[32m[I 2023-04-21 02:08:09,925][39m Trial 1806 finished with value: 0.8181818181818182 and parameters: {'objective': 'CrossEntropy', 'colsample_bylevel': 0.08231663915415072, 'depth': 3, 'boosting_type': 'Plain', 'bootstrap_type': 'MVS'}. Best is trial 98 with value: 0.8791208791208791.
[32m[I 2023-04-21 02:08:10,934][39m Trial 1807 finished with value: 0.8275862068965518 and parameters: {'objective': 'Logloss', 'colsample_bylevel': 0.07503007209614664, 'depth': 9, 'boosting_type': 'Plain', 'bootstrap_type': 'Bernoulli', 'subsample': 0.5424480246254964}. Best is trial 98 with value: 0.8791208791208791.
[32m[I 2023-04-21 02:08:11,991][39m Trial 1808 finished with value: 0.8539325842696629 and parameters: {'objective': 'CrossEntropy', 'colsample_bylevel': 0.08219618895820838, 'depth': 3, 'boosting_type': 'Plain', 'bootstrap_type': 'Bayesian', 'bagging_temperature': 9.670527484982724}. Best is trial 98 with value: 0.8791208791208791.
[32m[I 2023-04-21 02:08:12,813][39m Trial 1809 finished with value: 0.8444444444444446 and parameters: {'objective': 'CrossEntropy', 'colsample_bylevel': 0.07405816318159752, 'depth': 9, 'boosting_type': 'Plain', 'bootstrap_type': 'Bayesian', 'bagging_temperature': 9.30934341260578}. Best is trial 98 with value: 0.8791208791208791.
[32m[I 2023-04-21 02:08:13,503][39m Trial 1810 finished with value: 0.8409090909090909 and parameters: {'objective': 'CrossEntropy', 'colsample_bylevel': 0.08222372881765712, 'depth': 4, 'boosting_type': 'Plain', 'bootstrap_type': 'Bayesian', 'bagging_temperature': 9.564252298087132}. Best is trial 98 with value: 0.8791208791208791.
[32m[I 2023-04-21 02:08:14,391][39m Trial 1811 finished with value: 0.8275862068965518 and parameters: {'objective': 'CrossEntropy', 'colsample_bylevel': 0.0841693632327694, 'depth': 4, 'boosting_type': 'Plain', 'bootstrap_type': 'Bayesian', 'bagging_temperature': 9.566891767167085}. Best is trial 98 with value: 0.8791208791208791.
[32m[I 2023-04-21 02:08:15,250][39m Trial 1812 finished with value: 0.8666666666666666 and parameters: {'objective': 'CrossEntropy', 'colsample_bylevel': 0.06977172755023463, 'depth': 4, 'boosting_type': 'Plain', 'bootstrap_type': 'Bayesian', 'bagging_temperature': 8.329660799466508}. Best is trial 98 with value: 0.8791208791208791.
[32m[I 2023-04-21 02:08:16,198][39m Trial 1813 finished with value: 0.8409090909090909 and parameters: {'objective': 'CrossEntropy', 'colsample_bylevel': 0.09993058098941665, 'depth': 5, 'boosting_type': 'Plain', 'bootstrap_type': 'Bayesian', 'bagging_temperature': 9.018335703113884}. Best is trial 98 with value: 0.8791208791208791.
[32m[I 2023-04-21 02:08:17,081][39m Trial 1814 finished with value: 0.8539325842696629 and parameters: {'objective': 'CrossEntropy', 'colsample_bylevel': 0.07871388672936143, 'depth': 4, 'boosting_type': 'Plain', 'bootstrap_type': 'Bayesian', 'bagging_temperature': 9.652188618466418}. Best is trial 98 with value: 0.8791208791208791.
[32m[I 2023-04-21 02:08:18,313][39m Trial 1815 finished with value: 0.8539325842696629 and parameters: {'objective': 'CrossEntropy', 'colsample_bylevel': 0.07226780324164492, 'depth': 9, 'boosting_type': 'Plain', 'bootstrap_type': 'Bayesian', 'bagging_temperature': 7.402019406253103}. Best is trial 98 with value: 0.8791208791208791.
[32m[I 2023-04-21 02:08:18,999][39m Trial 1816 finished with value: 0.8409090909090909 and parameters: {'objective': 'Logloss', 'colsample_bylevel': 0.07316531423764935, 'depth': 12, 'boosting_type': 'Plain', 'bootstrap_type': 'Bayesian', 'bagging_temperature': 9.37373459671479}. Best is trial 98 with value: 0.8791208791208791.
[32m[I 2023-04-21 02:08:19,591][39m Trial 1817 finished with value: 0.8409090909090909 and parameters: {'objective': 'Logloss', 'colsample_bylevel': 0.07532961904379769, 'depth': 6, 'boosting_type': 'Plain', 'bootstrap_type': 'Bayesian', 'bagging_temperature': 9.150422938438712}. Best is trial 98 with value: 0.8791208791208791.
[32m[I 2023-04-21 02:08:20,473][39m Trial 1818 finished with value: 0.8409090909090909 and parameters: {'objective': 'CrossEntropy', 'colsample_bylevel': 0.07749104051797429, 'depth': 3, 'boosting_type': 'Plain', 'bootstrap_type': 'MVS'}. Best is trial 98 with value: 0.8791208791208791.
[32m[I 2023-04-21 02:08:21,415][39m Trial 1819 finished with value: 0.8539325842696629 and parameters: {'objective': 'CrossEntropy', 'colsample_bylevel': 0.08134026448277779, 'depth': 6, 'boosting_type': 'Plain', 'bootstrap_type': 'Bayesian', 'bagging_temperature': 9.688352606417373}. Best is trial 98 with value: 0.8791208791208791.
[32m[I 2023-04-21 02:08:22,291][39m Trial 1820 finished with value: 0.8666666666666666 and parameters: {'objective': 'CrossEntropy', 'colsample_bylevel': 0.0770863232375659, 'depth': 5, 'boosting_type': 'Plain', 'bootstrap_type': 'Bayesian', 'bagging_temperature': 9.461886982685387}. Best is trial 98 with value: 0.8791208791208791.
[32m[I 2023-04-21 02:08:23,150][39m Trial 1821 finished with value: 0.8539325842696629 and parameters: {'objective': 'CrossEntropy', 'colsample_bylevel': 0.07427281277829552, 'depth': 4, 'boosting_type': 'Plain', 'bootstrap_type': 'Bayesian', 'bagging_temperature': 9.36541948788628}. Best is trial 98 with value: 0.8791208791208791.
[32m[I 2023-04-21 02:08:27,605][39m Trial 1822 finished with value: 0.8045977011494252 and parameters: {'objective': 'CrossEntropy', 'colsample_bylevel': 0.059990964087187855, 'depth': 3, 'boosting_type': 'Ordered', 'bootstrap_type': 'Bayesian', 'bagging_temperature': 8.489478469129217}. Best is trial 98 with value: 0.8791208791208791.
[32m[I 2023-04-21 02:08:28,541][39m Trial 1823 finished with value: 0.8666666666666666 and parameters: {'objective': 'CrossEntropy', 'colsample_bylevel': 0.07582839766740078, 'depth': 3, 'boosting_type': 'Plain', 'bootstrap_type': 'Bayesian', 'bagging_temperature': 8.28755438808952}. Best is trial 98 with value: 0.8791208791208791.
[32m[I 2023-04-21 02:08:29,756][39m Trial 1824 finished with value: 0.8505747126436782 and parameters: {'objective': 'CrossEntropy', 'colsample_bylevel': 0.08224086809645179, 'depth': 10, 'boosting_type': 'Plain', 'bootstrap_type': 'Bayesian', 'bagging_temperature': 9.149269120508372}. Best is trial 98 with value: 0.8791208791208791.
[32m[I 2023-04-21 02:08:31,035][39m Trial 1825 finished with value: 0.8409090909090909 and parameters: {'objective': 'CrossEntropy', 'colsample_bylevel': 0.0793530360847214, 'depth': 8, 'boosting_type': 'Plain', 'bootstrap_type': 'Bayesian', 'bagging_temperature': 8.558372884737786}. Best is trial 98 with value: 0.8791208791208791.
[32m[I 2023-04-21 02:08:31,718][39m Trial 1826 finished with value: 0.8275862068965518 and parameters: {'objective': 'CrossEntropy', 'colsample_bylevel': 0.09567618307732642, 'depth': 4, 'boosting_type': 'Plain', 'bootstrap_type': 'Bayesian', 'bagging_temperature': 9.94118338287165}. Best is trial 98 with value: 0.8791208791208791.
[32m[I 2023-04-21 02:08:32,628][39m Trial 1827 finished with value: 0.8539325842696629 and parameters: {'objective': 'CrossEntropy', 'colsample_bylevel': 0.08959124845449991, 'depth': 3, 'boosting_type': 'Plain', 'bootstrap_type': 'Bayesian', 'bagging_temperature': 8.74198108418758}. Best is trial 98 with value: 0.8791208791208791.
[32m[I 2023-04-21 02:08:33,446][39m Trial 1828 finished with value: 0.8409090909090909 and parameters: {'objective': 'CrossEntropy', 'colsample_bylevel': 0.07428168969906172, 'depth': 7, 'boosting_type': 'Plain', 'bootstrap_type': 'Bayesian', 'bagging_temperature': 9.063046181915212}. Best is trial 98 with value: 0.8791208791208791.
[32m[I 2023-04-21 02:08:34,354][39m Trial 1829 finished with value: 0.8666666666666666 and parameters: {'objective': 'CrossEntropy', 'colsample_bylevel': 0.0651793421649798, 'depth': 9, 'boosting_type': 'Plain', 'bootstrap_type': 'Bayesian', 'bagging_temperature': 9.195546065934778}. Best is trial 98 with value: 0.8791208791208791.
[32m[I 2023-04-21 02:08:35,470][39m Trial 1830 finished with value: 0.8275862068965518 and parameters: {'objective': 'CrossEntropy', 'colsample_bylevel': 0.0819779184546702, 'depth': 10, 'boosting_type': 'Plain', 'bootstrap_type': 'Bayesian', 'bagging_temperature': 9.203593609960258}. Best is trial 98 with value: 0.8791208791208791.
[32m[I 2023-04-21 02:08:36,441][39m Trial 1831 finished with value: 0.8666666666666666 and parameters: {'objective': 'CrossEntropy', 'colsample_bylevel': 0.08903717157815756, 'depth': 3, 'boosting_type': 'Plain', 'bootstrap_type': 'Bayesian', 'bagging_temperature': 9.584301768735005}. Best is trial 98 with value: 0.8791208791208791.
[32m[I 2023-04-21 02:08:37,196][39m Trial 1832 finished with value: 0.8275862068965518 and parameters: {'objective': 'CrossEntropy', 'colsample_bylevel': 0.07881041532960709, 'depth': 3, 'boosting_type': 'Plain', 'bootstrap_type': 'MVS'}. Best is trial 98 with value: 0.8791208791208791.
[32m[I 2023-04-21 02:08:37,779][39m Trial 1833 finished with value: 0.8235294117647058 and parameters: {'objective': 'CrossEntropy', 'colsample_bylevel': 0.036656643621406575, 'depth': 3, 'boosting_type': 'Plain', 'bootstrap_type': 'Bayesian', 'bagging_temperature': 8.4819253252589}. Best is trial 98 with value: 0.8791208791208791.
[32m[I 2023-04-21 02:08:38,802][39m Trial 1834 finished with value: 0.8409090909090909 and parameters: {'objective': 'CrossEntropy', 'colsample_bylevel': 0.07705485943640358, 'depth': 3, 'boosting_type': 'Plain', 'bootstrap_type': 'Bernoulli', 'subsample': 0.6105183796629431}. Best is trial 98 with value: 0.8791208791208791.
[32m[I 2023-04-21 02:08:39,573][39m Trial 1835 finished with value: 0.8791208791208791 and parameters: {'objective': 'Logloss', 'colsample_bylevel': 0.07379746390500641, 'depth': 10, 'boosting_type': 'Plain', 'bootstrap_type': 'Bayesian', 'bagging_temperature': 9.52160247970385}. Best is trial 98 with value: 0.8791208791208791.
[32m[I 2023-04-21 02:08:40,689][39m Trial 1836 finished with value: 0.8666666666666666 and parameters: {'objective': 'CrossEntropy', 'colsample_bylevel': 0.09333803670308452, 'depth': 3, 'boosting_type': 'Plain', 'bootstrap_type': 'Bayesian', 'bagging_temperature': 9.81106777605187}. Best is trial 98 with value: 0.8791208791208791.
[32m[I 2023-04-21 02:08:41,962][39m Trial 1837 finished with value: 0.8409090909090909 and parameters: {'objective': 'Logloss', 'colsample_bylevel': 0.07387801110976643, 'depth': 10, 'boosting_type': 'Plain', 'bootstrap_type': 'Bayesian', 'bagging_temperature': 9.250921743234048}. Best is trial 98 with value: 0.8791208791208791.
[32m[I 2023-04-21 02:08:42,602][39m Trial 1838 finished with value: 0.8409090909090909 and parameters: {'objective': 'CrossEntropy', 'colsample_bylevel': 0.08686697078304251, 'depth': 3, 'boosting_type': 'Plain', 'bootstrap_type': 'Bayesian', 'bagging_temperature': 5.7471617706381695}. Best is trial 98 with value: 0.8791208791208791.
[32m[I 2023-04-21 02:08:43,511][39m Trial 1839 finished with value: 0.8539325842696629 and parameters: {'objective': 'CrossEntropy', 'colsample_bylevel': 0.079089681202394, 'depth': 11, 'boosting_type': 'Plain', 'bootstrap_type': 'Bayesian', 'bagging_temperature': 9.989135511688719}. Best is trial 98 with value: 0.8791208791208791.
[32m[I 2023-04-21 02:08:44,479][39m Trial 1840 finished with value: 0.8409090909090909 and parameters: {'objective': 'Logloss', 'colsample_bylevel': 0.08086995484163861, 'depth': 3, 'boosting_type': 'Plain', 'bootstrap_type': 'Bayesian', 'bagging_temperature': 2.0787799703775733}. Best is trial 98 with value: 0.8791208791208791.
[32m[I 2023-04-21 02:08:49,421][39m Trial 1841 finished with value: 0.8089887640449439 and parameters: {'objective': 'CrossEntropy', 'colsample_bylevel': 0.07006637080130612, 'depth': 3, 'boosting_type': 'Ordered', 'bootstrap_type': 'Bayesian', 'bagging_temperature': 1.0086528071775764}. Best is trial 98 with value: 0.8791208791208791.
[32m[I 2023-04-21 02:08:50,525][39m Trial 1842 finished with value: 0.8275862068965518 and parameters: {'objective': 'CrossEntropy', 'colsample_bylevel': 0.07624299767381484, 'depth': 11, 'boosting_type': 'Plain', 'bootstrap_type': 'Bayesian', 'bagging_temperature': 8.919591013286867}. Best is trial 98 with value: 0.8791208791208791.
[32m[I 2023-04-21 02:08:51,532][39m Trial 1843 finished with value: 0.8275862068965518 and parameters: {'objective': 'CrossEntropy', 'colsample_bylevel': 0.08390248500546657, 'depth': 7, 'boosting_type': 'Plain', 'bootstrap_type': 'Bayesian', 'bagging_temperature': 5.386856810952806}. Best is trial 98 with value: 0.8791208791208791.
[32m[I 2023-04-21 02:08:52,222][39m Trial 1844 finished with value: 0.8539325842696629 and parameters: {'objective': 'CrossEntropy', 'colsample_bylevel': 0.08625658361563732, 'depth': 5, 'boosting_type': 'Plain', 'bootstrap_type': 'Bayesian', 'bagging_temperature': 9.30884386086823}. Best is trial 98 with value: 0.8791208791208791.
[32m[I 2023-04-21 02:08:53,478][39m Trial 1845 finished with value: 0.8409090909090909 and parameters: {'objective': 'CrossEntropy', 'colsample_bylevel': 0.0762550738196404, 'depth': 5, 'boosting_type': 'Plain', 'bootstrap_type': 'MVS'}. Best is trial 98 with value: 0.8791208791208791.
[32m[I 2023-04-21 02:08:54,242][39m Trial 1846 finished with value: 0.8409090909090909 and parameters: {'objective': 'CrossEntropy', 'colsample_bylevel': 0.09797522550726426, 'depth': 4, 'boosting_type': 'Plain', 'bootstrap_type': 'Bayesian', 'bagging_temperature': 9.820019366028452}. Best is trial 98 with value: 0.8791208791208791.
[32m[I 2023-04-21 02:08:55,701][39m Trial 1847 finished with value: 0.8539325842696629 and parameters: {'objective': 'CrossEntropy', 'colsample_bylevel': 0.09476374409880126, 'depth': 9, 'boosting_type': 'Plain', 'bootstrap_type': 'Bayesian', 'bagging_temperature': 9.513606934443349}. Best is trial 98 with value: 0.8791208791208791.
[32m[I 2023-04-21 02:08:56,346][39m Trial 1848 finished with value: 0.8666666666666666 and parameters: {'objective': 'Logloss', 'colsample_bylevel': 0.06909384358386753, 'depth': 6, 'boosting_type': 'Plain', 'bootstrap_type': 'Bayesian', 'bagging_temperature': 9.814628427682083}. Best is trial 98 with value: 0.8791208791208791.
[32m[I 2023-04-21 02:08:57,361][39m Trial 1849 finished with value: 0.8539325842696629 and parameters: {'objective': 'CrossEntropy', 'colsample_bylevel': 0.07525820489233115, 'depth': 4, 'boosting_type': 'Plain', 'bootstrap_type': 'Bayesian', 'bagging_temperature': 9.655402180108087}. Best is trial 98 with value: 0.8791208791208791.
[32m[I 2023-04-21 02:08:58,141][39m Trial 1850 finished with value: 0.8409090909090909 and parameters: {'objective': 'CrossEntropy', 'colsample_bylevel': 0.07832813019541456, 'depth': 3, 'boosting_type': 'Plain', 'bootstrap_type': 'Bernoulli', 'subsample': 0.9669921219090047}. Best is trial 98 with value: 0.8791208791208791.
