[32m[I 2023-04-21 02:33:03,922][39m Trial 3106 finished with value: 0.8275862068965518 and parameters: {'objective': 'CrossEntropy', 'colsample_bylevel': 0.07250131716783269, 'depth': 10, 'boosting_type': 'Plain', 'bootstrap_type': 'Bayesian', 'bagging_temperature': 9.31349257083861}. Best is trial 3065 with value: 0.8863636363636364.
[32m[I 2023-04-21 02:33:04,893][39m Trial 3107 finished with value: 0.8666666666666666 and parameters: {'objective': 'Logloss', 'colsample_bylevel': 0.07490318668422727, 'depth': 10, 'boosting_type': 'Plain', 'bootstrap_type': 'Bayesian', 'bagging_temperature': 9.744094087577627}. Best is trial 3065 with value: 0.8863636363636364.
[32m[I 2023-04-21 02:33:05,517][39m Trial 3108 finished with value: 0.8539325842696629 and parameters: {'objective': 'CrossEntropy', 'colsample_bylevel': 0.07918401246945986, 'depth': 6, 'boosting_type': 'Plain', 'bootstrap_type': 'Bayesian', 'bagging_temperature': 9.557425407243446}. Best is trial 3065 with value: 0.8863636363636364.
[32m[I 2023-04-21 02:33:06,448][39m Trial 3109 finished with value: 0.8275862068965518 and parameters: {'objective': 'CrossEntropy', 'colsample_bylevel': 0.07690115613591761, 'depth': 3, 'boosting_type': 'Plain', 'bootstrap_type': 'Bernoulli', 'subsample': 0.5326742984594579}. Best is trial 3065 with value: 0.8863636363636364.
[32m[I 2023-04-21 02:33:07,180][39m Trial 3110 finished with value: 0.8791208791208791 and parameters: {'objective': 'CrossEntropy', 'colsample_bylevel': 0.06969659816412795, 'depth': 10, 'boosting_type': 'Plain', 'bootstrap_type': 'Bayesian', 'bagging_temperature': 8.841333240430387}. Best is trial 3065 with value: 0.8863636363636364.
[32m[I 2023-04-21 02:33:08,309][39m Trial 3111 finished with value: 0.7999999999999999 and parameters: {'objective': 'CrossEntropy', 'colsample_bylevel': 0.07075781828730612, 'depth': 1, 'boosting_type': 'Plain', 'bootstrap_type': 'Bayesian', 'bagging_temperature': 9.170535216732755}. Best is trial 3065 with value: 0.8863636363636364.
[32m[I 2023-04-21 02:33:09,648][39m Trial 3112 finished with value: 0.7407407407407408 and parameters: {'objective': 'Logloss', 'colsample_bylevel': 0.012089184101120767, 'depth': 10, 'boosting_type': 'Plain', 'bootstrap_type': 'Bayesian', 'bagging_temperature': 9.303718242613682}. Best is trial 3065 with value: 0.8863636363636364.
[32m[I 2023-04-21 02:33:10,748][39m Trial 3113 finished with value: 0.8409090909090909 and parameters: {'objective': 'CrossEntropy', 'colsample_bylevel': 0.07197703792393519, 'depth': 11, 'boosting_type': 'Plain', 'bootstrap_type': 'MVS'}. Best is trial 3065 with value: 0.8863636363636364.
[32m[I 2023-04-21 02:33:11,409][39m Trial 3114 finished with value: 0.8409090909090909 and parameters: {'objective': 'CrossEntropy', 'colsample_bylevel': 0.08026419760901818, 'depth': 3, 'boosting_type': 'Plain', 'bootstrap_type': 'Bayesian', 'bagging_temperature': 9.73945815898213}. Best is trial 3065 with value: 0.8863636363636364.
[32m[I 2023-04-21 02:33:12,050][39m Trial 3115 finished with value: 0.8666666666666666 and parameters: {'objective': 'CrossEntropy', 'colsample_bylevel': 0.08068976633457288, 'depth': 3, 'boosting_type': 'Plain', 'bootstrap_type': 'Bayesian', 'bagging_temperature': 9.117316850961263}. Best is trial 3065 with value: 0.8863636363636364.
[32m[I 2023-04-21 02:33:12,779][39m Trial 3116 finished with value: 0.8409090909090909 and parameters: {'objective': 'Logloss', 'colsample_bylevel': 0.06505323687636569, 'depth': 5, 'boosting_type': 'Plain', 'bootstrap_type': 'Bayesian', 'bagging_temperature': 7.580830112974213}. Best is trial 3065 with value: 0.8863636363636364.
[32m[I 2023-04-21 02:33:13,679][39m Trial 3117 finished with value: 0.8666666666666666 and parameters: {'objective': 'CrossEntropy', 'colsample_bylevel': 0.07963029433441383, 'depth': 3, 'boosting_type': 'Plain', 'bootstrap_type': 'Bayesian', 'bagging_temperature': 9.596637123540955}. Best is trial 3065 with value: 0.8863636363636364.
[32m[I 2023-04-21 02:33:14,876][39m Trial 3118 finished with value: 0.8409090909090909 and parameters: {'objective': 'CrossEntropy', 'colsample_bylevel': 0.08150678399708672, 'depth': 6, 'boosting_type': 'Plain', 'bootstrap_type': 'Bayesian', 'bagging_temperature': 8.777840013344848}. Best is trial 3065 with value: 0.8863636363636364.
[32m[I 2023-04-21 02:33:15,885][39m Trial 3119 finished with value: 0.8666666666666666 and parameters: {'objective': 'CrossEntropy', 'colsample_bylevel': 0.07561201330795539, 'depth': 10, 'boosting_type': 'Plain', 'bootstrap_type': 'Bayesian', 'bagging_temperature': 9.628904676957687}. Best is trial 3065 with value: 0.8863636363636364.
[32m[I 2023-04-21 02:33:16,813][39m Trial 3120 finished with value: 0.8275862068965518 and parameters: {'objective': 'CrossEntropy', 'colsample_bylevel': 0.0779594536512524, 'depth': 3, 'boosting_type': 'Plain', 'bootstrap_type': 'MVS'}. Best is trial 3065 with value: 0.8863636363636364.
[32m[I 2023-04-21 02:33:17,715][39m Trial 3121 finished with value: 0.8409090909090909 and parameters: {'objective': 'Logloss', 'colsample_bylevel': 0.07070129470146927, 'depth': 10, 'boosting_type': 'Plain', 'bootstrap_type': 'Bayesian', 'bagging_temperature': 9.474876041768278}. Best is trial 3065 with value: 0.8863636363636364.
[32m[I 2023-04-21 02:33:22,268][39m Trial 3122 finished with value: 0.7999999999999999 and parameters: {'objective': 'Logloss', 'colsample_bylevel': 0.07453319192091194, 'depth': 11, 'boosting_type': 'Ordered', 'bootstrap_type': 'Bayesian', 'bagging_temperature': 9.700033755909358}. Best is trial 3065 with value: 0.8863636363636364.
[32m[I 2023-04-21 02:33:23,258][39m Trial 3123 finished with value: 0.8539325842696629 and parameters: {'objective': 'CrossEntropy', 'colsample_bylevel': 0.06637442436891512, 'depth': 10, 'boosting_type': 'Plain', 'bootstrap_type': 'Bayesian', 'bagging_temperature': 9.264368956963846}. Best is trial 3065 with value: 0.8863636363636364.
[32m[I 2023-04-21 02:33:24,501][39m Trial 3124 finished with value: 0.8666666666666666 and parameters: {'objective': 'CrossEntropy', 'colsample_bylevel': 0.07029471013928183, 'depth': 4, 'boosting_type': 'Plain', 'bootstrap_type': 'Bayesian', 'bagging_temperature': 8.326432176279774}. Best is trial 3065 with value: 0.8863636363636364.
[32m[I 2023-04-21 02:33:25,449][39m Trial 3125 finished with value: 0.8409090909090909 and parameters: {'objective': 'CrossEntropy', 'colsample_bylevel': 0.07498662814478357, 'depth': 10, 'boosting_type': 'Plain', 'bootstrap_type': 'Bayesian', 'bagging_temperature': 9.540989660833118}. Best is trial 3065 with value: 0.8863636363636364.
[32m[I 2023-04-21 02:33:26,518][39m Trial 3126 finished with value: 0.8636363636363636 and parameters: {'objective': 'CrossEntropy', 'colsample_bylevel': 0.0471606555835113, 'depth': 3, 'boosting_type': 'Plain', 'bootstrap_type': 'Bayesian', 'bagging_temperature': 8.888208407564415}. Best is trial 3065 with value: 0.8863636363636364.
[32m[I 2023-04-21 02:33:27,197][39m Trial 3127 finished with value: 0.8409090909090909 and parameters: {'objective': 'Logloss', 'colsample_bylevel': 0.07312843336325528, 'depth': 10, 'boosting_type': 'Plain', 'bootstrap_type': 'Bayesian', 'bagging_temperature': 9.154245368737252}. Best is trial 3065 with value: 0.8863636363636364.
[32m[I 2023-04-21 02:33:28,295][39m Trial 3128 finished with value: 0.8666666666666666 and parameters: {'objective': 'CrossEntropy', 'colsample_bylevel': 0.07644699382349984, 'depth': 5, 'boosting_type': 'Plain', 'bootstrap_type': 'Bayesian', 'bagging_temperature': 9.347532761783194}. Best is trial 3065 with value: 0.8863636363636364.
[32m[I 2023-04-21 02:33:29,471][39m Trial 3129 finished with value: 0.8409090909090909 and parameters: {'objective': 'Logloss', 'colsample_bylevel': 0.07815924663635797, 'depth': 5, 'boosting_type': 'Plain', 'bootstrap_type': 'Bayesian', 'bagging_temperature': 9.793603301635656}. Best is trial 3065 with value: 0.8863636363636364.
[32m[I 2023-04-21 02:33:30,518][39m Trial 3130 finished with value: 0.8409090909090909 and parameters: {'objective': 'CrossEntropy', 'colsample_bylevel': 0.07850993669443114, 'depth': 10, 'boosting_type': 'Plain', 'bootstrap_type': 'Bernoulli', 'subsample': 0.41961379949789257}. Best is trial 3065 with value: 0.8863636363636364.
[32m[I 2023-04-21 02:33:31,680][39m Trial 3131 finished with value: 0.8539325842696629 and parameters: {'objective': 'CrossEntropy', 'colsample_bylevel': 0.08935667825970094, 'depth': 3, 'boosting_type': 'Plain', 'bootstrap_type': 'Bayesian', 'bagging_temperature': 1.921402119088036}. Best is trial 3065 with value: 0.8863636363636364.
[32m[I 2023-04-21 02:33:32,628][39m Trial 3132 finished with value: 0.8372093023255814 and parameters: {'objective': 'CrossEntropy', 'colsample_bylevel': 0.08276386035980304, 'depth': 10, 'boosting_type': 'Plain', 'bootstrap_type': 'Bayesian', 'bagging_temperature': 9.334157371924231}. Best is trial 3065 with value: 0.8863636363636364.
[32m[I 2023-04-21 02:33:33,239][39m Trial 3133 finished with value: 0.8275862068965518 and parameters: {'objective': 'Logloss', 'colsample_bylevel': 0.06938770194444445, 'depth': 5, 'boosting_type': 'Plain', 'bootstrap_type': 'Bayesian', 'bagging_temperature': 9.794352745095045}. Best is trial 3065 with value: 0.8863636363636364.
[32m[I 2023-04-21 02:33:33,913][39m Trial 3134 finished with value: 0.8791208791208791 and parameters: {'objective': 'Logloss', 'colsample_bylevel': 0.06930659313356616, 'depth': 12, 'boosting_type': 'Plain', 'bootstrap_type': 'Bayesian', 'bagging_temperature': 9.306559708139527}. Best is trial 3065 with value: 0.8863636363636364.
[32m[I 2023-04-21 02:33:34,851][39m Trial 3135 finished with value: 0.8539325842696629 and parameters: {'objective': 'Logloss', 'colsample_bylevel': 0.08271178341314316, 'depth': 12, 'boosting_type': 'Plain', 'bootstrap_type': 'Bayesian', 'bagging_temperature': 9.173738674584206}. Best is trial 3065 with value: 0.8863636363636364.
[32m[I 2023-04-21 02:33:35,684][39m Trial 3136 finished with value: 0.8409090909090909 and parameters: {'objective': 'CrossEntropy', 'colsample_bylevel': 0.07559946839562234, 'depth': 10, 'boosting_type': 'Plain', 'bootstrap_type': 'Bayesian', 'bagging_temperature': 9.996225962284969}. Best is trial 3065 with value: 0.8863636363636364.
[32m[I 2023-04-21 02:33:36,515][39m Trial 3137 finished with value: 0.8181818181818182 and parameters: {'objective': 'CrossEntropy', 'colsample_bylevel': 0.08225981535216394, 'depth': 3, 'boosting_type': 'Plain', 'bootstrap_type': 'MVS'}. Best is trial 3065 with value: 0.8863636363636364.
[32m[I 2023-04-21 02:33:38,013][39m Trial 3138 finished with value: 0.8666666666666666 and parameters: {'objective': 'CrossEntropy', 'colsample_bylevel': 0.07511190410162417, 'depth': 9, 'boosting_type': 'Plain', 'bootstrap_type': 'Bayesian', 'bagging_temperature': 8.87544759558125}. Best is trial 3065 with value: 0.8863636363636364.
[32m[I 2023-04-21 02:33:39,243][39m Trial 3139 finished with value: 0.8539325842696629 and parameters: {'objective': 'CrossEntropy', 'colsample_bylevel': 0.07715528113768631, 'depth': 7, 'boosting_type': 'Plain', 'bootstrap_type': 'Bayesian', 'bagging_temperature': 9.073615070905907}. Best is trial 3065 with value: 0.8863636363636364.
[32m[I 2023-04-21 02:33:44,164][39m Trial 3140 finished with value: 0.8275862068965518 and parameters: {'objective': 'CrossEntropy', 'colsample_bylevel': 0.07928042178091714, 'depth': 9, 'boosting_type': 'Ordered', 'bootstrap_type': 'Bayesian', 'bagging_temperature': 6.00464548262482}. Best is trial 3065 with value: 0.8863636363636364.
[32m[I 2023-04-21 02:33:45,212][39m Trial 3141 finished with value: 0.8409090909090909 and parameters: {'objective': 'CrossEntropy', 'colsample_bylevel': 0.07892813244829237, 'depth': 8, 'boosting_type': 'Plain', 'bootstrap_type': 'Bayesian', 'bagging_temperature': 8.143884381289913}. Best is trial 3065 with value: 0.8863636363636364.
[32m[I 2023-04-21 02:33:46,403][39m Trial 3142 finished with value: 0.8539325842696629 and parameters: {'objective': 'Logloss', 'colsample_bylevel': 0.07393054691542203, 'depth': 11, 'boosting_type': 'Plain', 'bootstrap_type': 'Bayesian', 'bagging_temperature': 8.124909251029699}. Best is trial 3065 with value: 0.8863636363636364.
[32m[I 2023-04-21 02:33:47,395][39m Trial 3143 finished with value: 0.8505747126436782 and parameters: {'objective': 'CrossEntropy', 'colsample_bylevel': 0.07844194300537252, 'depth': 10, 'boosting_type': 'Plain', 'bootstrap_type': 'Bayesian', 'bagging_temperature': 9.401106910339166}. Best is trial 3065 with value: 0.8863636363636364.
[32m[I 2023-04-21 02:33:48,014][39m Trial 3144 finished with value: 0.8666666666666666 and parameters: {'objective': 'CrossEntropy', 'colsample_bylevel': 0.07261293893064909, 'depth': 10, 'boosting_type': 'Plain', 'bootstrap_type': 'Bayesian', 'bagging_temperature': 8.57371448980481}. Best is trial 3065 with value: 0.8863636363636364.
[32m[I 2023-04-21 02:33:49,008][39m Trial 3145 finished with value: 0.8275862068965518 and parameters: {'objective': 'CrossEntropy', 'colsample_bylevel': 0.07978607037653473, 'depth': 3, 'boosting_type': 'Plain', 'bootstrap_type': 'MVS'}. Best is trial 3065 with value: 0.8863636363636364.
[32m[I 2023-04-21 02:33:49,982][39m Trial 3146 finished with value: 0.8539325842696629 and parameters: {'objective': 'Logloss', 'colsample_bylevel': 0.0698179815833518, 'depth': 9, 'boosting_type': 'Plain', 'bootstrap_type': 'Bernoulli', 'subsample': 0.1305285915672008}. Best is trial 3065 with value: 0.8863636363636364.
[32m[I 2023-04-21 02:33:50,829][39m Trial 3147 finished with value: 0.8275862068965518 and parameters: {'objective': 'CrossEntropy', 'colsample_bylevel': 0.07713067768244947, 'depth': 11, 'boosting_type': 'Plain', 'bootstrap_type': 'Bayesian', 'bagging_temperature': 9.775850100742929}. Best is trial 3065 with value: 0.8863636363636364.
[32m[I 2023-04-21 02:33:51,858][39m Trial 3148 finished with value: 0.8539325842696629 and parameters: {'objective': 'CrossEntropy', 'colsample_bylevel': 0.0777160149314423, 'depth': 8, 'boosting_type': 'Plain', 'bootstrap_type': 'Bayesian', 'bagging_temperature': 9.414643175653852}. Best is trial 3065 with value: 0.8863636363636364.
[32m[I 2023-04-21 02:33:52,950][39m Trial 3149 finished with value: 0.8275862068965518 and parameters: {'objective': 'CrossEntropy', 'colsample_bylevel': 0.08903601252466228, 'depth': 9, 'boosting_type': 'Plain', 'bootstrap_type': 'Bayesian', 'bagging_temperature': 9.7646683106175}. Best is trial 3065 with value: 0.8863636363636364.
[32m[I 2023-04-21 02:33:53,887][39m Trial 3150 finished with value: 0.8539325842696629 and parameters: {'objective': 'CrossEntropy', 'colsample_bylevel': 0.07762191086052157, 'depth': 10, 'boosting_type': 'Plain', 'bootstrap_type': 'Bayesian', 'bagging_temperature': 9.534120635527605}. Best is trial 3065 with value: 0.8863636363636364.
[32m[I 2023-04-21 02:33:54,832][39m Trial 3151 finished with value: 0.8139534883720929 and parameters: {'objective': 'CrossEntropy', 'colsample_bylevel': 0.07970154410022971, 'depth': 10, 'boosting_type': 'Plain', 'bootstrap_type': 'Bayesian', 'bagging_temperature': 9.54895211152402}. Best is trial 3065 with value: 0.8863636363636364.
[32m[I 2023-04-21 02:33:55,805][39m Trial 3152 finished with value: 0.8505747126436782 and parameters: {'objective': 'CrossEntropy', 'colsample_bylevel': 0.08480891566371987, 'depth': 10, 'boosting_type': 'Plain', 'bootstrap_type': 'Bayesian', 'bagging_temperature': 9.59315937984467}. Best is trial 3065 with value: 0.8863636363636364.
[32m[I 2023-04-21 02:33:56,525][39m Trial 3153 finished with value: 0.8791208791208791 and parameters: {'objective': 'CrossEntropy', 'colsample_bylevel': 0.06933922829607121, 'depth': 8, 'boosting_type': 'Plain', 'bootstrap_type': 'Bayesian', 'bagging_temperature': 9.990792162392655}. Best is trial 3065 with value: 0.8863636363636364.
[32m[I 2023-04-21 02:33:57,304][39m Trial 3154 finished with value: 0.8539325842696629 and parameters: {'objective': 'CrossEntropy', 'colsample_bylevel': 0.09333476111008475, 'depth': 2, 'boosting_type': 'Plain', 'bootstrap_type': 'Bayesian', 'bagging_temperature': 9.913094027644718}. Best is trial 3065 with value: 0.8863636363636364.
[32m[I 2023-04-21 02:33:58,393][39m Trial 3155 finished with value: 0.8275862068965518 and parameters: {'objective': 'CrossEntropy', 'colsample_bylevel': 0.07382923679906425, 'depth': 10, 'boosting_type': 'Plain', 'bootstrap_type': 'Bayesian', 'bagging_temperature': 8.529375201925838}. Best is trial 3065 with value: 0.8863636363636364.
[32m[I 2023-04-21 02:33:59,362][39m Trial 3156 finished with value: 0.8409090909090909 and parameters: {'objective': 'CrossEntropy', 'colsample_bylevel': 0.06646326218495748, 'depth': 10, 'boosting_type': 'Plain', 'bootstrap_type': 'Bayesian', 'bagging_temperature': 7.858777535556806}. Best is trial 3065 with value: 0.8863636363636364.
[32m[I 2023-04-21 02:34:00,308][39m Trial 3157 finished with value: 0.8409090909090909 and parameters: {'objective': 'Logloss', 'colsample_bylevel': 0.07273256374658332, 'depth': 10, 'boosting_type': 'Plain', 'bootstrap_type': 'Bayesian', 'bagging_temperature': 9.527724208142759}. Best is trial 3065 with value: 0.8863636363636364.
[32m[I 2023-04-21 02:34:01,262][39m Trial 3158 finished with value: 0.8409090909090909 and parameters: {'objective': 'CrossEntropy', 'colsample_bylevel': 0.07907341008015796, 'depth': 10, 'boosting_type': 'Plain', 'bootstrap_type': 'Bayesian', 'bagging_temperature': 9.833134197684378}. Best is trial 3065 with value: 0.8863636363636364.
[32m[I 2023-04-21 02:34:02,187][39m Trial 3159 finished with value: 0.8505747126436782 and parameters: {'objective': 'CrossEntropy', 'colsample_bylevel': 0.0961582661600095, 'depth': 9, 'boosting_type': 'Plain', 'bootstrap_type': 'Bayesian', 'bagging_temperature': 8.821107720784312}. Best is trial 3065 with value: 0.8863636363636364.
[32m[I 2023-04-21 02:34:07,125][39m Trial 3160 finished with value: 0.8275862068965518 and parameters: {'objective': 'Logloss', 'colsample_bylevel': 0.09277733510656105, 'depth': 12, 'boosting_type': 'Ordered', 'bootstrap_type': 'Bayesian', 'bagging_temperature': 9.843859209024645}. Best is trial 3065 with value: 0.8863636363636364.
[32m[I 2023-04-21 02:34:08,085][39m Trial 3161 finished with value: 0.8666666666666666 and parameters: {'objective': 'Logloss', 'colsample_bylevel': 0.07272148269879916, 'depth': 10, 'boosting_type': 'Plain', 'bootstrap_type': 'Bayesian', 'bagging_temperature': 8.826755721248285}. Best is trial 3065 with value: 0.8863636363636364.
[32m[I 2023-04-21 02:34:09,205][39m Trial 3162 finished with value: 0.7999999999999999 and parameters: {'objective': 'CrossEntropy', 'colsample_bylevel': 0.0965267414032944, 'depth': 9, 'boosting_type': 'Plain', 'bootstrap_type': 'MVS'}. Best is trial 3065 with value: 0.8863636363636364.
[32m[I 2023-04-21 02:34:10,165][39m Trial 3163 finished with value: 0.8505747126436782 and parameters: {'objective': 'Logloss', 'colsample_bylevel': 0.07036881875615851, 'depth': 2, 'boosting_type': 'Plain', 'bootstrap_type': 'Bayesian', 'bagging_temperature': 9.99371781202441}. Best is trial 3065 with value: 0.8863636363636364.
[32m[I 2023-04-21 02:34:11,166][39m Trial 3164 finished with value: 0.8666666666666666 and parameters: {'objective': 'CrossEntropy', 'colsample_bylevel': 0.09262014703440603, 'depth': 3, 'boosting_type': 'Plain', 'bootstrap_type': 'Bayesian', 'bagging_temperature': 9.996538755518582}. Best is trial 3065 with value: 0.8863636363636364.
[32m[I 2023-04-21 02:34:11,805][39m Trial 3165 finished with value: 0.8222222222222222 and parameters: {'objective': 'CrossEntropy', 'colsample_bylevel': 0.057387224579658426, 'depth': 3, 'boosting_type': 'Plain', 'bootstrap_type': 'Bayesian', 'bagging_temperature': 1.0042468791253176}. Best is trial 3065 with value: 0.8863636363636364.
[32m[I 2023-04-21 02:34:12,952][39m Trial 3166 finished with value: 0.8409090909090909 and parameters: {'objective': 'CrossEntropy', 'colsample_bylevel': 0.06931240766989034, 'depth': 9, 'boosting_type': 'Plain', 'bootstrap_type': 'Bayesian', 'bagging_temperature': 5.683492691348505}. Best is trial 3065 with value: 0.8863636363636364.
[32m[I 2023-04-21 02:34:14,008][39m Trial 3167 finished with value: 0.8539325842696629 and parameters: {'objective': 'CrossEntropy', 'colsample_bylevel': 0.08074849432887157, 'depth': 3, 'boosting_type': 'Plain', 'bootstrap_type': 'Bernoulli', 'subsample': 0.1969091866547621}. Best is trial 3065 with value: 0.8863636363636364.
[32m[I 2023-04-21 02:34:15,094][39m Trial 3168 finished with value: 0.8275862068965518 and parameters: {'objective': 'CrossEntropy', 'colsample_bylevel': 0.08374642328647534, 'depth': 2, 'boosting_type': 'Plain', 'bootstrap_type': 'Bayesian', 'bagging_temperature': 9.83351344559003}. Best is trial 3065 with value: 0.8863636363636364.
[32m[I 2023-04-21 02:34:15,760][39m Trial 3169 finished with value: 0.8791208791208791 and parameters: {'objective': 'CrossEntropy', 'colsample_bylevel': 0.08597096265307455, 'depth': 3, 'boosting_type': 'Plain', 'bootstrap_type': 'Bayesian', 'bagging_temperature': 8.250996055430768}. Best is trial 3065 with value: 0.8863636363636364.
[32m[I 2023-04-21 02:34:16,527][39m Trial 3170 finished with value: 0.8539325842696629 and parameters: {'objective': 'CrossEntropy', 'colsample_bylevel': 0.07633468471114291, 'depth': 10, 'boosting_type': 'Plain', 'bootstrap_type': 'Bayesian', 'bagging_temperature': 8.967144288588495}. Best is trial 3065 with value: 0.8863636363636364.
