[32m[I 2023-04-21 02:51:07,006][39m Trial 4020 finished with value: 0.8539325842696629 and parameters: {'objective': 'CrossEntropy', 'colsample_bylevel': 0.08067179680191096, 'depth': 10, 'boosting_type': 'Plain', 'bootstrap_type': 'Bayesian', 'bagging_temperature': 9.441096977381035}. Best is trial 3065 with value: 0.8863636363636364.
[32m[I 2023-04-21 02:51:07,879][39m Trial 4021 finished with value: 0.8539325842696629 and parameters: {'objective': 'Logloss', 'colsample_bylevel': 0.07825356005524697, 'depth': 9, 'boosting_type': 'Plain', 'bootstrap_type': 'Bayesian', 'bagging_temperature': 9.474732175190615}. Best is trial 3065 with value: 0.8863636363636364.
[32m[I 2023-04-21 02:51:08,580][39m Trial 4022 finished with value: 0.8539325842696629 and parameters: {'objective': 'Logloss', 'colsample_bylevel': 0.08074062606458887, 'depth': 3, 'boosting_type': 'Plain', 'bootstrap_type': 'Bayesian', 'bagging_temperature': 8.798075367604829}. Best is trial 3065 with value: 0.8863636363636364.
[32m[I 2023-04-21 02:51:09,741][39m Trial 4023 finished with value: 0.8539325842696629 and parameters: {'objective': 'CrossEntropy', 'colsample_bylevel': 0.08912034029238193, 'depth': 2, 'boosting_type': 'Plain', 'bootstrap_type': 'Bayesian', 'bagging_temperature': 2.8550224854592505}. Best is trial 3065 with value: 0.8863636363636364.
[32m[I 2023-04-21 02:51:14,574][39m Trial 4024 finished with value: 0.7912087912087912 and parameters: {'objective': 'Logloss', 'colsample_bylevel': 0.07803799124905107, 'depth': 3, 'boosting_type': 'Ordered', 'bootstrap_type': 'MVS'}. Best is trial 3065 with value: 0.8863636363636364.
[32m[I 2023-04-21 02:51:15,669][39m Trial 4025 finished with value: 0.8539325842696629 and parameters: {'objective': 'Logloss', 'colsample_bylevel': 0.06711399820395503, 'depth': 10, 'boosting_type': 'Plain', 'bootstrap_type': 'Bayesian', 'bagging_temperature': 9.66960944230245}. Best is trial 3065 with value: 0.8863636363636364.
[32m[I 2023-04-21 02:51:16,854][39m Trial 4026 finished with value: 0.8409090909090909 and parameters: {'objective': 'CrossEntropy', 'colsample_bylevel': 0.07367915113831258, 'depth': 10, 'boosting_type': 'Plain', 'bootstrap_type': 'Bayesian', 'bagging_temperature': 9.58137997385444}. Best is trial 3065 with value: 0.8863636363636364.
[32m[I 2023-04-21 02:51:17,713][39m Trial 4027 finished with value: 0.8539325842696629 and parameters: {'objective': 'Logloss', 'colsample_bylevel': 0.08114186196757392, 'depth': 3, 'boosting_type': 'Plain', 'bootstrap_type': 'Bernoulli', 'subsample': 0.37411155704924726}. Best is trial 3065 with value: 0.8863636363636364.
[32m[I 2023-04-21 02:51:19,053][39m Trial 4028 finished with value: 0.8539325842696629 and parameters: {'objective': 'CrossEntropy', 'colsample_bylevel': 0.07034849738541737, 'depth': 3, 'boosting_type': 'Plain', 'bootstrap_type': 'Bayesian', 'bagging_temperature': 8.726057807822267}. Best is trial 3065 with value: 0.8863636363636364.
[32m[I 2023-04-21 02:51:20,049][39m Trial 4029 finished with value: 0.8539325842696629 and parameters: {'objective': 'CrossEntropy', 'colsample_bylevel': 0.08255984349825031, 'depth': 3, 'boosting_type': 'Plain', 'bootstrap_type': 'Bayesian', 'bagging_temperature': 8.749327385970952}. Best is trial 3065 with value: 0.8863636363636364.
[32m[I 2023-04-21 02:51:21,134][39m Trial 4030 finished with value: 0.8666666666666666 and parameters: {'objective': 'Logloss', 'colsample_bylevel': 0.08520628749468466, 'depth': 5, 'boosting_type': 'Plain', 'bootstrap_type': 'Bayesian', 'bagging_temperature': 9.808267935073173}. Best is trial 3065 with value: 0.8863636363636364.
[32m[I 2023-04-21 02:51:22,211][39m Trial 4031 finished with value: 0.8666666666666666 and parameters: {'objective': 'CrossEntropy', 'colsample_bylevel': 0.060690054929450885, 'depth': 10, 'boosting_type': 'Plain', 'bootstrap_type': 'Bayesian', 'bagging_temperature': 9.46902071258697}. Best is trial 3065 with value: 0.8863636363636364.
[32m[I 2023-04-21 02:51:22,883][39m Trial 4032 finished with value: 0.8275862068965518 and parameters: {'objective': 'Logloss', 'colsample_bylevel': 0.08619602052940517, 'depth': 5, 'boosting_type': 'Plain', 'bootstrap_type': 'Bayesian', 'bagging_temperature': 9.835104032522272}. Best is trial 3065 with value: 0.8863636363636364.
[32m[I 2023-04-21 02:51:24,141][39m Trial 4033 finished with value: 0.8666666666666666 and parameters: {'objective': 'CrossEntropy', 'colsample_bylevel': 0.07843683163280754, 'depth': 9, 'boosting_type': 'Plain', 'bootstrap_type': 'Bayesian', 'bagging_temperature': 9.078506220674189}. Best is trial 3065 with value: 0.8863636363636364.
[32m[I 2023-04-21 02:51:24,968][39m Trial 4034 finished with value: 0.8666666666666666 and parameters: {'objective': 'CrossEntropy', 'colsample_bylevel': 0.07656161750151441, 'depth': 9, 'boosting_type': 'Plain', 'bootstrap_type': 'Bayesian', 'bagging_temperature': 9.016661305674612}. Best is trial 3065 with value: 0.8863636363636364.
[32m[I 2023-04-21 02:51:26,379][39m Trial 4035 finished with value: 0.8539325842696629 and parameters: {'objective': 'CrossEntropy', 'colsample_bylevel': 0.07962042426868596, 'depth': 9, 'boosting_type': 'Plain', 'bootstrap_type': 'Bayesian', 'bagging_temperature': 8.974876542329033}. Best is trial 3065 with value: 0.8863636363636364.
[32m[I 2023-04-21 02:51:27,341][39m Trial 4036 finished with value: 0.8666666666666666 and parameters: {'objective': 'CrossEntropy', 'colsample_bylevel': 0.06936150708978758, 'depth': 9, 'boosting_type': 'Plain', 'bootstrap_type': 'Bayesian', 'bagging_temperature': 9.128389979211981}. Best is trial 3065 with value: 0.8863636363636364.
[32m[I 2023-04-21 02:51:28,021][39m Trial 4037 finished with value: 0.8409090909090909 and parameters: {'objective': 'CrossEntropy', 'colsample_bylevel': 0.0777679125650062, 'depth': 10, 'boosting_type': 'Plain', 'bootstrap_type': 'Bayesian', 'bagging_temperature': 8.3971926060059}. Best is trial 3065 with value: 0.8863636363636364.
[32m[I 2023-04-21 02:51:29,175][39m Trial 4038 finished with value: 0.8409090909090909 and parameters: {'objective': 'CrossEntropy', 'colsample_bylevel': 0.0748169243957468, 'depth': 11, 'boosting_type': 'Plain', 'bootstrap_type': 'Bayesian', 'bagging_temperature': 9.507401612271366}. Best is trial 3065 with value: 0.8863636363636364.
[32m[I 2023-04-21 02:51:30,461][39m Trial 4039 finished with value: 0.8791208791208791 and parameters: {'objective': 'CrossEntropy', 'colsample_bylevel': 0.06681833403501232, 'depth': 7, 'boosting_type': 'Plain', 'bootstrap_type': 'Bayesian', 'bagging_temperature': 9.276062955759615}. Best is trial 3065 with value: 0.8863636363636364.
[32m[I 2023-04-21 02:51:31,336][39m Trial 4040 finished with value: 0.8275862068965518 and parameters: {'objective': 'CrossEntropy', 'colsample_bylevel': 0.07719408317424657, 'depth': 10, 'boosting_type': 'Plain', 'bootstrap_type': 'Bayesian', 'bagging_temperature': 9.276989518758356}. Best is trial 3065 with value: 0.8863636363636364.
[32m[I 2023-04-21 02:51:32,006][39m Trial 4041 finished with value: 0.8409090909090909 and parameters: {'objective': 'CrossEntropy', 'colsample_bylevel': 0.09697292689518414, 'depth': 3, 'boosting_type': 'Plain', 'bootstrap_type': 'Bayesian', 'bagging_temperature': 8.848107991930254}. Best is trial 3065 with value: 0.8863636363636364.
[32m[I 2023-04-21 02:51:37,233][39m Trial 4042 finished with value: 0.8172043010752689 and parameters: {'objective': 'CrossEntropy', 'colsample_bylevel': 0.07570419840216107, 'depth': 3, 'boosting_type': 'Ordered', 'bootstrap_type': 'MVS'}. Best is trial 3065 with value: 0.8863636363636364.
[32m[I 2023-04-21 02:51:38,132][39m Trial 4043 finished with value: 0.8636363636363636 and parameters: {'objective': 'CrossEntropy', 'colsample_bylevel': 0.07571188407578844, 'depth': 2, 'boosting_type': 'Plain', 'bootstrap_type': 'Bayesian', 'bagging_temperature': 9.63511540698604}. Best is trial 3065 with value: 0.8863636363636364.
[32m[I 2023-04-21 02:51:39,390][39m Trial 4044 finished with value: 0.8666666666666666 and parameters: {'objective': 'CrossEntropy', 'colsample_bylevel': 0.06988874054220919, 'depth': 12, 'boosting_type': 'Plain', 'bootstrap_type': 'Bayesian', 'bagging_temperature': 9.174992362615557}. Best is trial 3065 with value: 0.8863636363636364.
[32m[I 2023-04-21 02:51:40,408][39m Trial 4045 finished with value: 0.8539325842696629 and parameters: {'objective': 'Logloss', 'colsample_bylevel': 0.07438759529173976, 'depth': 4, 'boosting_type': 'Plain', 'bootstrap_type': 'Bernoulli', 'subsample': 0.5874910569787088}. Best is trial 3065 with value: 0.8863636363636364.
[32m[I 2023-04-21 02:51:41,563][39m Trial 4046 finished with value: 0.8539325842696629 and parameters: {'objective': 'Logloss', 'colsample_bylevel': 0.06977714622409759, 'depth': 4, 'boosting_type': 'Plain', 'bootstrap_type': 'Bayesian', 'bagging_temperature': 9.158175190942782}. Best is trial 3065 with value: 0.8863636363636364.
[32m[I 2023-04-21 02:51:42,238][39m Trial 4047 finished with value: 0.8539325842696629 and parameters: {'objective': 'CrossEntropy', 'colsample_bylevel': 0.07418270361085891, 'depth': 2, 'boosting_type': 'Plain', 'bootstrap_type': 'Bayesian', 'bagging_temperature': 8.328726882621876}. Best is trial 3065 with value: 0.8863636363636364.
[32m[I 2023-04-21 02:51:43,327][39m Trial 4048 finished with value: 0.8409090909090909 and parameters: {'objective': 'CrossEntropy', 'colsample_bylevel': 0.07731096561681612, 'depth': 10, 'boosting_type': 'Plain', 'bootstrap_type': 'Bayesian', 'bagging_temperature': 9.356552858889932}. Best is trial 3065 with value: 0.8863636363636364.
[32m[I 2023-04-21 02:51:44,530][39m Trial 4049 finished with value: 0.8539325842696629 and parameters: {'objective': 'CrossEntropy', 'colsample_bylevel': 0.0756284973081459, 'depth': 11, 'boosting_type': 'Plain', 'bootstrap_type': 'Bayesian', 'bagging_temperature': 9.669340953472721}. Best is trial 3065 with value: 0.8863636363636364.
[32m[I 2023-04-21 02:51:45,167][39m Trial 4050 finished with value: 0.8314606741573034 and parameters: {'objective': 'Logloss', 'colsample_bylevel': 0.07168600062950084, 'depth': 4, 'boosting_type': 'Plain', 'bootstrap_type': 'MVS'}. Best is trial 3065 with value: 0.8863636363636364.
[32m[I 2023-04-21 02:51:45,867][39m Trial 4051 finished with value: 0.8539325842696629 and parameters: {'objective': 'CrossEntropy', 'colsample_bylevel': 0.07693601462471295, 'depth': 3, 'boosting_type': 'Plain', 'bootstrap_type': 'Bayesian', 'bagging_temperature': 9.128509213843087}. Best is trial 3065 with value: 0.8863636363636364.
[32m[I 2023-04-21 02:51:46,666][39m Trial 4052 finished with value: 0.8409090909090909 and parameters: {'objective': 'CrossEntropy', 'colsample_bylevel': 0.07808650168279861, 'depth': 12, 'boosting_type': 'Plain', 'bootstrap_type': 'Bayesian', 'bagging_temperature': 9.364708862433256}. Best is trial 3065 with value: 0.8863636363636364.
[32m[I 2023-04-21 02:51:47,843][39m Trial 4053 finished with value: 0.8539325842696629 and parameters: {'objective': 'CrossEntropy', 'colsample_bylevel': 0.08474735846398669, 'depth': 3, 'boosting_type': 'Plain', 'bootstrap_type': 'Bayesian', 'bagging_temperature': 8.78076808287229}. Best is trial 3065 with value: 0.8863636363636364.
[32m[I 2023-04-21 02:51:48,814][39m Trial 4054 finished with value: 0.8791208791208791 and parameters: {'objective': 'Logloss', 'colsample_bylevel': 0.0746545526843456, 'depth': 10, 'boosting_type': 'Plain', 'bootstrap_type': 'Bayesian', 'bagging_temperature': 9.777344758635346}. Best is trial 3065 with value: 0.8863636363636364.
[32m[I 2023-04-21 02:51:49,580][39m Trial 4055 finished with value: 0.8539325842696629 and parameters: {'objective': 'Logloss', 'colsample_bylevel': 0.08122890482574932, 'depth': 11, 'boosting_type': 'Plain', 'bootstrap_type': 'Bayesian', 'bagging_temperature': 8.916078538556711}. Best is trial 3065 with value: 0.8863636363636364.
[32m[I 2023-04-21 02:51:50,502][39m Trial 4056 finished with value: 0.8539325842696629 and parameters: {'objective': 'CrossEntropy', 'colsample_bylevel': 0.07145085906068321, 'depth': 4, 'boosting_type': 'Plain', 'bootstrap_type': 'Bayesian', 'bagging_temperature': 9.398116331526397}. Best is trial 3065 with value: 0.8863636363636364.
[32m[I 2023-04-21 02:51:51,744][39m Trial 4057 finished with value: 0.8275862068965518 and parameters: {'objective': 'CrossEntropy', 'colsample_bylevel': 0.08781738565866622, 'depth': 4, 'boosting_type': 'Plain', 'bootstrap_type': 'Bayesian', 'bagging_temperature': 9.84538250324122}. Best is trial 3065 with value: 0.8863636363636364.
[32m[I 2023-04-21 02:51:52,996][39m Trial 4058 finished with value: 0.8666666666666666 and parameters: {'objective': 'Logloss', 'colsample_bylevel': 0.07553987737751192, 'depth': 10, 'boosting_type': 'Plain', 'bootstrap_type': 'Bayesian', 'bagging_temperature': 9.6408415017905}. Best is trial 3065 with value: 0.8863636363636364.
[32m[I 2023-04-21 02:51:54,046][39m Trial 4059 finished with value: 0.8539325842696629 and parameters: {'objective': 'CrossEntropy', 'colsample_bylevel': 0.0696037930924891, 'depth': 12, 'boosting_type': 'Plain', 'bootstrap_type': 'Bayesian', 'bagging_temperature': 9.191969972088678}. Best is trial 3065 with value: 0.8863636363636364.
[32m[I 2023-04-21 02:51:55,284][39m Trial 4060 finished with value: 0.8409090909090909 and parameters: {'objective': 'CrossEntropy', 'colsample_bylevel': 0.07880610143285345, 'depth': 9, 'boosting_type': 'Plain', 'bootstrap_type': 'Bayesian', 'bagging_temperature': 9.582706698967996}. Best is trial 3065 with value: 0.8863636363636364.
[32m[I 2023-04-21 02:51:55,999][39m Trial 4061 finished with value: 0.8 and parameters: {'objective': 'Logloss', 'colsample_bylevel': 0.09258494958337488, 'depth': 1, 'boosting_type': 'Plain', 'bootstrap_type': 'MVS'}. Best is trial 3065 with value: 0.8863636363636364.
[32m[I 2023-04-21 02:52:00,536][39m Trial 4062 finished with value: 0.7999999999999999 and parameters: {'objective': 'Logloss', 'colsample_bylevel': 0.07142076890474928, 'depth': 11, 'boosting_type': 'Ordered', 'bootstrap_type': 'Bayesian', 'bagging_temperature': 9.069711545188756}. Best is trial 3065 with value: 0.8863636363636364.
[32m[I 2023-04-21 02:52:01,579][39m Trial 4063 finished with value: 0.8275862068965518 and parameters: {'objective': 'Logloss', 'colsample_bylevel': 0.07307762132790144, 'depth': 9, 'boosting_type': 'Plain', 'bootstrap_type': 'Bayesian', 'bagging_temperature': 9.710701677951402}. Best is trial 3065 with value: 0.8863636363636364.
[32m[I 2023-04-21 02:52:02,600][39m Trial 4064 finished with value: 0.8539325842696629 and parameters: {'objective': 'Logloss', 'colsample_bylevel': 0.07313089529668124, 'depth': 12, 'boosting_type': 'Plain', 'bootstrap_type': 'Bayesian', 'bagging_temperature': 9.967842075577224}. Best is trial 3065 with value: 0.8863636363636364.
[32m[I 2023-04-21 02:52:03,575][39m Trial 4065 finished with value: 0.8666666666666666 and parameters: {'objective': 'Logloss', 'colsample_bylevel': 0.07181315329079656, 'depth': 4, 'boosting_type': 'Plain', 'bootstrap_type': 'Bayesian', 'bagging_temperature': 9.440231596698043}. Best is trial 3065 with value: 0.8863636363636364.
[32m[I 2023-04-21 02:52:04,417][39m Trial 4066 finished with value: 0.8666666666666666 and parameters: {'objective': 'CrossEntropy', 'colsample_bylevel': 0.07024332984752418, 'depth': 10, 'boosting_type': 'Plain', 'bootstrap_type': 'Bayesian', 'bagging_temperature': 8.779723599188411}. Best is trial 3065 with value: 0.8863636363636364.
[32m[I 2023-04-21 02:52:05,531][39m Trial 4067 finished with value: 0.8539325842696629 and parameters: {'objective': 'CrossEntropy', 'colsample_bylevel': 0.08336207023435915, 'depth': 3, 'boosting_type': 'Plain', 'bootstrap_type': 'Bayesian', 'bagging_temperature': 9.00432246804102}. Best is trial 3065 with value: 0.8863636363636364.
[32m[I 2023-04-21 02:52:07,018][39m Trial 4068 finished with value: 0.8539325842696629 and parameters: {'objective': 'Logloss', 'colsample_bylevel': 0.07118837988875476, 'depth': 9, 'boosting_type': 'Plain', 'bootstrap_type': 'Bernoulli', 'subsample': 0.5333055963300808}. Best is trial 3065 with value: 0.8863636363636364.
[32m[I 2023-04-21 02:52:08,114][39m Trial 4069 finished with value: 0.8139534883720929 and parameters: {'objective': 'Logloss', 'colsample_bylevel': 0.09303318833552218, 'depth': 4, 'boosting_type': 'Plain', 'bootstrap_type': 'Bayesian', 'bagging_temperature': 1.8568634701628204}. Best is trial 3065 with value: 0.8863636363636364.
[32m[I 2023-04-21 02:52:09,677][39m Trial 4070 finished with value: 0.8539325842696629 and parameters: {'objective': 'Logloss', 'colsample_bylevel': 0.07154961428873109, 'depth': 5, 'boosting_type': 'Plain', 'bootstrap_type': 'Bayesian', 'bagging_temperature': 9.4968726875126}. Best is trial 3065 with value: 0.8863636363636364.
[32m[I 2023-04-21 02:52:10,420][39m Trial 4071 finished with value: 0.8539325842696629 and parameters: {'objective': 'Logloss', 'colsample_bylevel': 0.09142588245054058, 'depth': 4, 'boosting_type': 'Plain', 'bootstrap_type': 'Bayesian', 'bagging_temperature': 9.614253808185925}. Best is trial 3065 with value: 0.8863636363636364.
[32m[I 2023-04-21 02:52:11,104][39m Trial 4072 finished with value: 0.8275862068965518 and parameters: {'objective': 'Logloss', 'colsample_bylevel': 0.08572532538548945, 'depth': 5, 'boosting_type': 'Plain', 'bootstrap_type': 'Bayesian', 'bagging_temperature': 8.347782117935155}. Best is trial 3065 with value: 0.8863636363636364.
[32m[I 2023-04-21 02:52:11,778][39m Trial 4073 finished with value: 0.8409090909090909 and parameters: {'objective': 'CrossEntropy', 'colsample_bylevel': 0.08817352304230307, 'depth': 10, 'boosting_type': 'Plain', 'bootstrap_type': 'Bayesian', 'bagging_temperature': 9.532560003620157}. Best is trial 3065 with value: 0.8863636363636364.
[32m[I 2023-04-21 02:52:12,968][39m Trial 4074 finished with value: 0.8181818181818182 and parameters: {'objective': 'CrossEntropy', 'colsample_bylevel': 0.07510703863976279, 'depth': 9, 'boosting_type': 'Plain', 'bootstrap_type': 'MVS'}. Best is trial 3065 with value: 0.8863636363636364.
[32m[I 2023-04-21 02:52:13,788][39m Trial 4075 finished with value: 0.8539325842696629 and parameters: {'objective': 'CrossEntropy', 'colsample_bylevel': 0.06816909232676388, 'depth': 7, 'boosting_type': 'Plain', 'bootstrap_type': 'Bayesian', 'bagging_temperature': 9.005684835198004}. Best is trial 3065 with value: 0.8863636363636364.
[32m[I 2023-04-21 02:52:14,817][39m Trial 4076 finished with value: 0.8539325842696629 and parameters: {'objective': 'CrossEntropy', 'colsample_bylevel': 0.08550654207907323, 'depth': 3, 'boosting_type': 'Plain', 'bootstrap_type': 'Bayesian', 'bagging_temperature': 9.491431155727772}. Best is trial 3065 with value: 0.8863636363636364.
[32m[I 2023-04-21 02:52:15,855][39m Trial 4077 finished with value: 0.8636363636363636 and parameters: {'objective': 'CrossEntropy', 'colsample_bylevel': 0.08016736930179752, 'depth': 2, 'boosting_type': 'Plain', 'bootstrap_type': 'Bayesian', 'bagging_temperature': 8.53883285119586}. Best is trial 3065 with value: 0.8863636363636364.
[32m[I 2023-04-21 02:52:20,817][39m Trial 4078 finished with value: 0.8181818181818182 and parameters: {'objective': 'CrossEntropy', 'colsample_bylevel': 0.083790297034111, 'depth': 9, 'boosting_type': 'Ordered', 'bootstrap_type': 'Bayesian', 'bagging_temperature': 9.25126703689405}. Best is trial 3065 with value: 0.8863636363636364.
[32m[I 2023-04-21 02:52:22,079][39m Trial 4079 finished with value: 0.8 and parameters: {'objective': 'Logloss', 'colsample_bylevel': 0.06168641342666129, 'depth': 11, 'boosting_type': 'Plain', 'bootstrap_type': 'MVS'}. Best is trial 3065 with value: 0.8863636363636364.
[32m[I 2023-04-21 02:52:23,280][39m Trial 4080 finished with value: 0.8539325842696629 and parameters: {'objective': 'CrossEntropy', 'colsample_bylevel': 0.08989577332865588, 'depth': 3, 'boosting_type': 'Plain', 'bootstrap_type': 'Bayesian', 'bagging_temperature': 9.856930763745936}. Best is trial 3065 with value: 0.8863636363636364.
[32m[I 2023-04-21 02:52:24,682][39m Trial 4081 finished with value: 0.8539325842696629 and parameters: {'objective': 'CrossEntropy', 'colsample_bylevel': 0.06988302687809173, 'depth': 7, 'boosting_type': 'Plain', 'bootstrap_type': 'Bayesian', 'bagging_temperature': 9.825254309512644}. Best is trial 3065 with value: 0.8863636363636364.
[32m[I 2023-04-21 02:52:25,521][39m Trial 4082 finished with value: 0.8539325842696629 and parameters: {'objective': 'Logloss', 'colsample_bylevel': 0.08551150022603347, 'depth': 10, 'boosting_type': 'Plain', 'bootstrap_type': 'Bayesian', 'bagging_temperature': 9.459698181199462}. Best is trial 3065 with value: 0.8863636363636364.
[32m[I 2023-04-21 02:52:26,518][39m Trial 4083 finished with value: 0.8539325842696629 and parameters: {'objective': 'Logloss', 'colsample_bylevel': 0.07737548671639376, 'depth': 3, 'boosting_type': 'Plain', 'bootstrap_type': 'Bayesian', 'bagging_temperature': 9.716419521188776}. Best is trial 3065 with value: 0.8863636363636364.
[32m[I 2023-04-21 02:52:27,401][39m Trial 4084 finished with value: 0.8539325842696629 and parameters: {'objective': 'Logloss', 'colsample_bylevel': 0.07770311251391093, 'depth': 3, 'boosting_type': 'Plain', 'bootstrap_type': 'Bayesian', 'bagging_temperature': 9.804781655408823}. Best is trial 3065 with value: 0.8863636363636364.
[32m[I 2023-04-21 02:52:28,071][39m Trial 4085 finished with value: 0.8764044943820225 and parameters: {'objective': 'CrossEntropy', 'colsample_bylevel': 0.07653243440613247, 'depth': 3, 'boosting_type': 'Plain', 'bootstrap_type': 'Bayesian', 'bagging_temperature': 9.975906978014725}. Best is trial 3065 with value: 0.8863636363636364.
