[32m[I 2023-04-21 01:51:56,399][39m Trial 926 finished with value: 0.8409090909090909 and parameters: {'objective': 'CrossEntropy', 'colsample_bylevel': 0.08707088140631067, 'depth': 3, 'boosting_type': 'Plain', 'bootstrap_type': 'Bayesian', 'bagging_temperature': 9.369061789571663}. Best is trial 98 with value: 0.8791208791208791.
[32m[I 2023-04-21 01:51:57,232][39m Trial 927 finished with value: 0.8666666666666666 and parameters: {'objective': 'CrossEntropy', 'colsample_bylevel': 0.07799713397881436, 'depth': 3, 'boosting_type': 'Plain', 'bootstrap_type': 'Bayesian', 'bagging_temperature': 9.456378653801762}. Best is trial 98 with value: 0.8791208791208791.
[32m[I 2023-04-21 01:51:58,116][39m Trial 928 finished with value: 0.8539325842696629 and parameters: {'objective': 'CrossEntropy', 'colsample_bylevel': 0.07872334366460707, 'depth': 3, 'boosting_type': 'Plain', 'bootstrap_type': 'Bayesian', 'bagging_temperature': 7.983630830088765}. Best is trial 98 with value: 0.8791208791208791.
[32m[I 2023-04-21 01:52:02,920][39m Trial 929 finished with value: 0.8275862068965518 and parameters: {'objective': 'CrossEntropy', 'colsample_bylevel': 0.07246373832626794, 'depth': 3, 'boosting_type': 'Ordered', 'bootstrap_type': 'Bayesian', 'bagging_temperature': 8.728228763654515}. Best is trial 98 with value: 0.8791208791208791.
[32m[I 2023-04-21 01:52:03,903][39m Trial 930 finished with value: 0.8539325842696629 and parameters: {'objective': 'CrossEntropy', 'colsample_bylevel': 0.0772370705111818, 'depth': 4, 'boosting_type': 'Plain', 'bootstrap_type': 'Bayesian', 'bagging_temperature': 8.150216141037195}. Best is trial 98 with value: 0.8791208791208791.
[32m[I 2023-04-21 01:52:04,659][39m Trial 931 finished with value: 0.8539325842696629 and parameters: {'objective': 'CrossEntropy', 'colsample_bylevel': 0.09357027006101394, 'depth': 3, 'boosting_type': 'Plain', 'bootstrap_type': 'Bayesian', 'bagging_temperature': 8.946928598808537}. Best is trial 98 with value: 0.8791208791208791.
[32m[I 2023-04-21 01:52:05,457][39m Trial 932 finished with value: 0.8539325842696629 and parameters: {'objective': 'CrossEntropy', 'colsample_bylevel': 0.09119912934795457, 'depth': 4, 'boosting_type': 'Plain', 'bootstrap_type': 'Bayesian', 'bagging_temperature': 8.26494245377848}. Best is trial 98 with value: 0.8791208791208791.
[32m[I 2023-04-21 01:52:06,291][39m Trial 933 finished with value: 0.8275862068965518 and parameters: {'objective': 'CrossEntropy', 'colsample_bylevel': 0.08946808806188634, 'depth': 3, 'boosting_type': 'Plain', 'bootstrap_type': 'Bayesian', 'bagging_temperature': 8.536152540827679}. Best is trial 98 with value: 0.8791208791208791.
[32m[I 2023-04-21 01:52:07,575][39m Trial 934 finished with value: 0.8275862068965518 and parameters: {'objective': 'CrossEntropy', 'colsample_bylevel': 0.08088890314276448, 'depth': 10, 'boosting_type': 'Plain', 'bootstrap_type': 'Bayesian', 'bagging_temperature': 9.644825084037699}. Best is trial 98 with value: 0.8791208791208791.
[32m[I 2023-04-21 01:52:08,219][39m Trial 935 finished with value: 0.8539325842696629 and parameters: {'objective': 'CrossEntropy', 'colsample_bylevel': 0.07473899775088039, 'depth': 3, 'boosting_type': 'Plain', 'bootstrap_type': 'Bayesian', 'bagging_temperature': 9.662994247680151}. Best is trial 98 with value: 0.8791208791208791.
[32m[I 2023-04-21 01:52:09,204][39m Trial 936 finished with value: 0.8275862068965518 and parameters: {'objective': 'CrossEntropy', 'colsample_bylevel': 0.09497841407295918, 'depth': 3, 'boosting_type': 'Plain', 'bootstrap_type': 'Bayesian', 'bagging_temperature': 9.105746331162555}. Best is trial 98 with value: 0.8791208791208791.
[32m[I 2023-04-21 01:52:10,046][39m Trial 937 finished with value: 0.8539325842696629 and parameters: {'objective': 'CrossEntropy', 'colsample_bylevel': 0.07305659015931597, 'depth': 3, 'boosting_type': 'Plain', 'bootstrap_type': 'Bayesian', 'bagging_temperature': 9.656744859325725}. Best is trial 98 with value: 0.8791208791208791.
[32m[I 2023-04-21 01:52:10,776][39m Trial 938 finished with value: 0.8409090909090909 and parameters: {'objective': 'CrossEntropy', 'colsample_bylevel': 0.09186477261945458, 'depth': 3, 'boosting_type': 'Plain', 'bootstrap_type': 'Bayesian', 'bagging_temperature': 9.9937124676086}. Best is trial 98 with value: 0.8791208791208791.
[32m[I 2023-04-21 01:52:11,555][39m Trial 939 finished with value: 0.8539325842696629 and parameters: {'objective': 'CrossEntropy', 'colsample_bylevel': 0.08119827815547331, 'depth': 3, 'boosting_type': 'Plain', 'bootstrap_type': 'Bayesian', 'bagging_temperature': 9.29073671138609}. Best is trial 98 with value: 0.8791208791208791.
[32m[I 2023-04-21 01:52:12,533][39m Trial 940 finished with value: 0.8791208791208791 and parameters: {'objective': 'CrossEntropy', 'colsample_bylevel': 0.07781395838241194, 'depth': 3, 'boosting_type': 'Plain', 'bootstrap_type': 'Bayesian', 'bagging_temperature': 9.8687889764577}. Best is trial 98 with value: 0.8791208791208791.
[32m[I 2023-04-21 01:52:13,757][39m Trial 941 finished with value: 0.8791208791208791 and parameters: {'objective': 'CrossEntropy', 'colsample_bylevel': 0.09296289120530374, 'depth': 3, 'boosting_type': 'Plain', 'bootstrap_type': 'Bayesian', 'bagging_temperature': 9.992393828042584}. Best is trial 98 with value: 0.8791208791208791.
[32m[I 2023-04-21 01:52:14,438][39m Trial 942 finished with value: 0.8539325842696629 and parameters: {'objective': 'CrossEntropy', 'colsample_bylevel': 0.09469117800423436, 'depth': 4, 'boosting_type': 'Plain', 'bootstrap_type': 'Bayesian', 'bagging_temperature': 9.987161793136943}. Best is trial 98 with value: 0.8791208791208791.
[32m[I 2023-04-21 01:52:15,229][39m Trial 943 finished with value: 0.8666666666666666 and parameters: {'objective': 'CrossEntropy', 'colsample_bylevel': 0.07537613297089124, 'depth': 3, 'boosting_type': 'Plain', 'bootstrap_type': 'Bayesian', 'bagging_temperature': 9.840148824759336}. Best is trial 98 with value: 0.8791208791208791.
[32m[I 2023-04-21 01:52:16,142][39m Trial 944 finished with value: 0.8444444444444446 and parameters: {'objective': 'CrossEntropy', 'colsample_bylevel': 0.07642463714542828, 'depth': 3, 'boosting_type': 'Plain', 'bootstrap_type': 'Bernoulli', 'subsample': 0.7158515711050353}. Best is trial 98 with value: 0.8791208791208791.
[32m[I 2023-04-21 01:52:16,918][39m Trial 945 finished with value: 0.8409090909090909 and parameters: {'objective': 'CrossEntropy', 'colsample_bylevel': 0.09310944466405319, 'depth': 3, 'boosting_type': 'Plain', 'bootstrap_type': 'Bayesian', 'bagging_temperature': 9.985667287857337}. Best is trial 98 with value: 0.8791208791208791.
[32m[I 2023-04-21 01:52:17,726][39m Trial 946 finished with value: 0.8409090909090909 and parameters: {'objective': 'CrossEntropy', 'colsample_bylevel': 0.07717501911437671, 'depth': 3, 'boosting_type': 'Plain', 'bootstrap_type': 'Bayesian', 'bagging_temperature': 5.66001038497994}. Best is trial 98 with value: 0.8791208791208791.
[32m[I 2023-04-21 01:52:18,837][39m Trial 947 finished with value: 0.8539325842696629 and parameters: {'objective': 'CrossEntropy', 'colsample_bylevel': 0.09547161353445047, 'depth': 4, 'boosting_type': 'Plain', 'bootstrap_type': 'Bayesian', 'bagging_temperature': 9.63116398625328}. Best is trial 98 with value: 0.8791208791208791.
[32m[I 2023-04-21 01:52:19,721][39m Trial 948 finished with value: 0.8409090909090909 and parameters: {'objective': 'CrossEntropy', 'colsample_bylevel': 0.09286090005518766, 'depth': 3, 'boosting_type': 'Plain', 'bootstrap_type': 'Bayesian', 'bagging_temperature': 9.84253850784672}. Best is trial 98 with value: 0.8791208791208791.
[32m[I 2023-04-21 01:52:24,553][39m Trial 949 finished with value: 0.8275862068965518 and parameters: {'objective': 'CrossEntropy', 'colsample_bylevel': 0.09307870801222481, 'depth': 3, 'boosting_type': 'Ordered', 'bootstrap_type': 'Bayesian', 'bagging_temperature': 9.549106088672106}. Best is trial 98 with value: 0.8791208791208791.
[32m[I 2023-04-21 01:52:25,693][39m Trial 950 finished with value: 0.8409090909090909 and parameters: {'objective': 'CrossEntropy', 'colsample_bylevel': 0.0930400880677471, 'depth': 3, 'boosting_type': 'Plain', 'bootstrap_type': 'MVS'}. Best is trial 98 with value: 0.8791208791208791.
[32m[I 2023-04-21 01:52:26,585][39m Trial 951 finished with value: 0.8539325842696629 and parameters: {'objective': 'CrossEntropy', 'colsample_bylevel': 0.07673337794484766, 'depth': 3, 'boosting_type': 'Plain', 'bootstrap_type': 'Bayesian', 'bagging_temperature': 9.807316411798345}. Best is trial 98 with value: 0.8791208791208791.
[32m[I 2023-04-21 01:52:27,688][39m Trial 952 finished with value: 0.8314606741573034 and parameters: {'objective': 'CrossEntropy', 'colsample_bylevel': 0.09564361097556454, 'depth': 3, 'boosting_type': 'Plain', 'bootstrap_type': 'Bayesian', 'bagging_temperature': 2.2532194552401656}. Best is trial 98 with value: 0.8791208791208791.
[32m[I 2023-04-21 01:52:28,597][39m Trial 953 finished with value: 0.8409090909090909 and parameters: {'objective': 'CrossEntropy', 'colsample_bylevel': 0.07336087817760435, 'depth': 3, 'boosting_type': 'Plain', 'bootstrap_type': 'Bayesian', 'bagging_temperature': 9.970685597011482}. Best is trial 98 with value: 0.8791208791208791.
[32m[I 2023-04-21 01:52:29,234][39m Trial 954 finished with value: 0.8409090909090909 and parameters: {'objective': 'CrossEntropy', 'colsample_bylevel': 0.09042364823250765, 'depth': 3, 'boosting_type': 'Plain', 'bootstrap_type': 'Bayesian', 'bagging_temperature': 9.451315191962628}. Best is trial 98 with value: 0.8791208791208791.
[32m[I 2023-04-21 01:52:29,892][39m Trial 955 finished with value: 0.8275862068965518 and parameters: {'objective': 'CrossEntropy', 'colsample_bylevel': 0.09812038602900786, 'depth': 4, 'boosting_type': 'Plain', 'bootstrap_type': 'Bayesian', 'bagging_temperature': 9.97723958068479}. Best is trial 98 with value: 0.8791208791208791.
[32m[I 2023-04-21 01:52:30,812][39m Trial 956 finished with value: 0.8666666666666666 and parameters: {'objective': 'CrossEntropy', 'colsample_bylevel': 0.09147815989792686, 'depth': 3, 'boosting_type': 'Plain', 'bootstrap_type': 'Bayesian', 'bagging_temperature': 8.788763868185585}. Best is trial 98 with value: 0.8791208791208791.
[32m[I 2023-04-21 01:52:31,781][39m Trial 957 finished with value: 0.8539325842696629 and parameters: {'objective': 'CrossEntropy', 'colsample_bylevel': 0.07472906390247046, 'depth': 3, 'boosting_type': 'Plain', 'bootstrap_type': 'Bayesian', 'bagging_temperature': 9.682403383908529}. Best is trial 98 with value: 0.8791208791208791.
[32m[I 2023-04-21 01:52:32,384][39m Trial 958 finished with value: 0.8764044943820225 and parameters: {'objective': 'CrossEntropy', 'colsample_bylevel': 0.07787750050424543, 'depth': 3, 'boosting_type': 'Plain', 'bootstrap_type': 'Bayesian', 'bagging_temperature': 9.989083609986988}. Best is trial 98 with value: 0.8791208791208791.
[32m[I 2023-04-21 01:52:33,133][39m Trial 959 finished with value: 0.8505747126436782 and parameters: {'objective': 'CrossEntropy', 'colsample_bylevel': 0.07695962441262988, 'depth': 3, 'boosting_type': 'Plain', 'bootstrap_type': 'Bayesian', 'bagging_temperature': 9.7767154986795}. Best is trial 98 with value: 0.8791208791208791.
[32m[I 2023-04-21 01:52:34,154][39m Trial 960 finished with value: 0.8666666666666666 and parameters: {'objective': 'CrossEntropy', 'colsample_bylevel': 0.07979609491494544, 'depth': 3, 'boosting_type': 'Plain', 'bootstrap_type': 'Bayesian', 'bagging_temperature': 9.774570207008487}. Best is trial 98 with value: 0.8791208791208791.
[32m[I 2023-04-21 01:52:35,076][39m Trial 961 finished with value: 0.8791208791208791 and parameters: {'objective': 'CrossEntropy', 'colsample_bylevel': 0.07742100263029206, 'depth': 4, 'boosting_type': 'Plain', 'bootstrap_type': 'Bayesian', 'bagging_temperature': 8.45702306295321}. Best is trial 98 with value: 0.8791208791208791.
[32m[I 2023-04-21 01:52:35,687][39m Trial 962 finished with value: 0.8409090909090909 and parameters: {'objective': 'CrossEntropy', 'colsample_bylevel': 0.07126085081846321, 'depth': 4, 'boosting_type': 'Plain', 'bootstrap_type': 'Bayesian', 'bagging_temperature': 9.997757349108658}. Best is trial 98 with value: 0.8791208791208791.
[32m[I 2023-04-21 01:52:36,613][39m Trial 963 finished with value: 0.8666666666666666 and parameters: {'objective': 'CrossEntropy', 'colsample_bylevel': 0.06926525548431137, 'depth': 4, 'boosting_type': 'Plain', 'bootstrap_type': 'Bayesian', 'bagging_temperature': 9.846040172880379}. Best is trial 98 with value: 0.8791208791208791.
[32m[I 2023-04-21 01:52:37,559][39m Trial 964 finished with value: 0.8275862068965518 and parameters: {'objective': 'CrossEntropy', 'colsample_bylevel': 0.0750964902086351, 'depth': 5, 'boosting_type': 'Plain', 'bootstrap_type': 'Bayesian', 'bagging_temperature': 7.560484745670494}. Best is trial 98 with value: 0.8791208791208791.
[32m[I 2023-04-21 01:52:38,306][39m Trial 965 finished with value: 0.8409090909090909 and parameters: {'objective': 'CrossEntropy', 'colsample_bylevel': 0.07992314865388496, 'depth': 4, 'boosting_type': 'Plain', 'bootstrap_type': 'Bayesian', 'bagging_temperature': 9.610833892878059}. Best is trial 98 with value: 0.8791208791208791.
[32m[I 2023-04-21 01:52:38,992][39m Trial 966 finished with value: 0.8139534883720929 and parameters: {'objective': 'CrossEntropy', 'colsample_bylevel': 0.09910219359710556, 'depth': 3, 'boosting_type': 'Plain', 'bootstrap_type': 'Bernoulli', 'subsample': 0.3106759213200645}. Best is trial 98 with value: 0.8791208791208791.
[32m[I 2023-04-21 01:52:40,014][39m Trial 967 finished with value: 0.8539325842696629 and parameters: {'objective': 'CrossEntropy', 'colsample_bylevel': 0.07552315560042143, 'depth': 6, 'boosting_type': 'Plain', 'bootstrap_type': 'Bayesian', 'bagging_temperature': 8.370006368604189}. Best is trial 98 with value: 0.8791208791208791.
[32m[I 2023-04-21 01:52:41,096][39m Trial 968 finished with value: 0.8372093023255814 and parameters: {'objective': 'CrossEntropy', 'colsample_bylevel': 0.09434438526260641, 'depth': 4, 'boosting_type': 'Plain', 'bootstrap_type': 'Bayesian', 'bagging_temperature': 8.613544944838202}. Best is trial 98 with value: 0.8791208791208791.
[32m[I 2023-04-21 01:52:45,755][39m Trial 969 finished with value: 0.8666666666666666 and parameters: {'objective': 'CrossEntropy', 'colsample_bylevel': 0.07783132700266909, 'depth': 3, 'boosting_type': 'Ordered', 'bootstrap_type': 'Bayesian', 'bagging_temperature': 8.425212537729996}. Best is trial 98 with value: 0.8791208791208791.
[32m[I 2023-04-21 01:52:47,048][39m Trial 970 finished with value: 0.8275862068965518 and parameters: {'objective': 'CrossEntropy', 'colsample_bylevel': 0.07579301599566851, 'depth': 4, 'boosting_type': 'Plain', 'bootstrap_type': 'Bayesian', 'bagging_temperature': 3.5137122450460145}. Best is trial 98 with value: 0.8791208791208791.
[32m[I 2023-04-21 01:52:47,708][39m Trial 971 finished with value: 0.8409090909090909 and parameters: {'objective': 'CrossEntropy', 'colsample_bylevel': 0.07866853803294742, 'depth': 3, 'boosting_type': 'Plain', 'bootstrap_type': 'MVS'}. Best is trial 98 with value: 0.8791208791208791.
[32m[I 2023-04-21 01:52:48,445][39m Trial 972 finished with value: 0.8666666666666666 and parameters: {'objective': 'CrossEntropy', 'colsample_bylevel': 0.07453508148407655, 'depth': 3, 'boosting_type': 'Plain', 'bootstrap_type': 'Bayesian', 'bagging_temperature': 9.799027279526527}. Best is trial 98 with value: 0.8791208791208791.
[32m[I 2023-04-21 01:52:49,277][39m Trial 973 finished with value: 0.8666666666666666 and parameters: {'objective': 'CrossEntropy', 'colsample_bylevel': 0.07986124086569732, 'depth': 3, 'boosting_type': 'Plain', 'bootstrap_type': 'Bayesian', 'bagging_temperature': 9.618318413443095}. Best is trial 98 with value: 0.8791208791208791.
[32m[I 2023-04-21 01:52:50,016][39m Trial 974 finished with value: 0.8235294117647058 and parameters: {'objective': 'CrossEntropy', 'colsample_bylevel': 0.07811637015582507, 'depth': 3, 'boosting_type': 'Plain', 'bootstrap_type': 'Bayesian', 'bagging_temperature': 8.294425636078074}. Best is trial 98 with value: 0.8791208791208791.
[32m[I 2023-04-21 01:52:51,138][39m Trial 975 finished with value: 0.8409090909090909 and parameters: {'objective': 'CrossEntropy', 'colsample_bylevel': 0.0928438019375311, 'depth': 3, 'boosting_type': 'Plain', 'bootstrap_type': 'Bayesian', 'bagging_temperature': 8.643985173261191}. Best is trial 98 with value: 0.8791208791208791.
[32m[I 2023-04-21 01:52:52,039][39m Trial 976 finished with value: 0.8666666666666666 and parameters: {'objective': 'CrossEntropy', 'colsample_bylevel': 0.0802527397680692, 'depth': 4, 'boosting_type': 'Plain', 'bootstrap_type': 'Bayesian', 'bagging_temperature': 9.496064055622867}. Best is trial 98 with value: 0.8791208791208791.
[32m[I 2023-04-21 01:52:53,069][39m Trial 977 finished with value: 0.8539325842696629 and parameters: {'objective': 'CrossEntropy', 'colsample_bylevel': 0.09725372652317572, 'depth': 3, 'boosting_type': 'Plain', 'bootstrap_type': 'Bayesian', 'bagging_temperature': 9.562379283981688}. Best is trial 98 with value: 0.8791208791208791.
[32m[I 2023-04-21 01:52:53,749][39m Trial 978 finished with value: 0.8539325842696629 and parameters: {'objective': 'CrossEntropy', 'colsample_bylevel': 0.07757461846636625, 'depth': 3, 'boosting_type': 'Plain', 'bootstrap_type': 'Bayesian', 'bagging_temperature': 9.143737074141477}. Best is trial 98 with value: 0.8791208791208791.
[32m[I 2023-04-21 01:52:54,402][39m Trial 979 finished with value: 0.8539325842696629 and parameters: {'objective': 'CrossEntropy', 'colsample_bylevel': 0.0891044497434932, 'depth': 3, 'boosting_type': 'Plain', 'bootstrap_type': 'Bayesian', 'bagging_temperature': 9.211927194826856}. Best is trial 98 with value: 0.8791208791208791.
[32m[I 2023-04-21 01:52:55,381][39m Trial 980 finished with value: 0.8409090909090909 and parameters: {'objective': 'CrossEntropy', 'colsample_bylevel': 0.07720690964761212, 'depth': 3, 'boosting_type': 'Plain', 'bootstrap_type': 'Bayesian', 'bagging_temperature': 4.707567451490101}. Best is trial 98 with value: 0.8791208791208791.
[32m[I 2023-04-21 01:52:56,215][39m Trial 981 finished with value: 0.8666666666666666 and parameters: {'objective': 'CrossEntropy', 'colsample_bylevel': 0.07345066243325411, 'depth': 3, 'boosting_type': 'Plain', 'bootstrap_type': 'Bayesian', 'bagging_temperature': 6.110291136606031}. Best is trial 98 with value: 0.8791208791208791.
[32m[I 2023-04-21 01:52:57,038][39m Trial 982 finished with value: 0.8409090909090909 and parameters: {'objective': 'CrossEntropy', 'colsample_bylevel': 0.07931357285709001, 'depth': 3, 'boosting_type': 'Plain', 'bootstrap_type': 'Bayesian', 'bagging_temperature': 8.405892057924166}. Best is trial 98 with value: 0.8791208791208791.
[32m[I 2023-04-21 01:52:57,917][39m Trial 983 finished with value: 0.8275862068965518 and parameters: {'objective': 'CrossEntropy', 'colsample_bylevel': 0.09379313020513547, 'depth': 3, 'boosting_type': 'Plain', 'bootstrap_type': 'Bayesian', 'bagging_temperature': 9.327423522838213}. Best is trial 98 with value: 0.8791208791208791.
[32m[I 2023-04-21 01:52:58,739][39m Trial 984 finished with value: 0.8539325842696629 and parameters: {'objective': 'CrossEntropy', 'colsample_bylevel': 0.07850750119202876, 'depth': 4, 'boosting_type': 'Plain', 'bootstrap_type': 'Bayesian', 'bagging_temperature': 9.99987127415193}. Best is trial 98 with value: 0.8791208791208791.
[32m[I 2023-04-21 01:52:59,573][39m Trial 985 finished with value: 0.8636363636363636 and parameters: {'objective': 'CrossEntropy', 'colsample_bylevel': 0.07852826045083494, 'depth': 3, 'boosting_type': 'Plain', 'bootstrap_type': 'Bayesian', 'bagging_temperature': 8.57741297011512}. Best is trial 98 with value: 0.8791208791208791.
[32m[I 2023-04-21 01:53:00,165][39m Trial 986 finished with value: 0.8409090909090909 and parameters: {'objective': 'CrossEntropy', 'colsample_bylevel': 0.09242664623686027, 'depth': 5, 'boosting_type': 'Plain', 'bootstrap_type': 'Bayesian', 'bagging_temperature': 8.75998923070631}. Best is trial 98 with value: 0.8791208791208791.
[32m[I 2023-04-21 01:53:00,851][39m Trial 987 finished with value: 0.8666666666666666 and parameters: {'objective': 'CrossEntropy', 'colsample_bylevel': 0.09014813656564157, 'depth': 3, 'boosting_type': 'Plain', 'bootstrap_type': 'Bayesian', 'bagging_temperature': 9.450301057858592}. Best is trial 98 with value: 0.8791208791208791.
[32m[I 2023-04-21 01:53:05,819][39m Trial 988 finished with value: 0.8172043010752689 and parameters: {'objective': 'CrossEntropy', 'colsample_bylevel': 0.0761580542947425, 'depth': 3, 'boosting_type': 'Ordered', 'bootstrap_type': 'Bernoulli', 'subsample': 0.8723279796881978}. Best is trial 98 with value: 0.8791208791208791.
[32m[I 2023-04-21 01:53:06,977][39m Trial 989 finished with value: 0.8275862068965518 and parameters: {'objective': 'CrossEntropy', 'colsample_bylevel': 0.0805359101892336, 'depth': 4, 'boosting_type': 'Plain', 'bootstrap_type': 'Bayesian', 'bagging_temperature': 9.657518852198463}. Best is trial 98 with value: 0.8791208791208791.
[32m[I 2023-04-21 01:53:07,800][39m Trial 990 finished with value: 0.8666666666666666 and parameters: {'objective': 'CrossEntropy', 'colsample_bylevel': 0.07420093701051643, 'depth': 3, 'boosting_type': 'Plain', 'bootstrap_type': 'Bayesian', 'bagging_temperature': 9.75938202736517}. Best is trial 98 with value: 0.8791208791208791.
