[32m[I 2023-04-21 02:24:01,481][39m Trial 2643 finished with value: 0.8666666666666666 and parameters: {'objective': 'CrossEntropy', 'colsample_bylevel': 0.07530394548930128, 'depth': 9, 'boosting_type': 'Plain', 'bootstrap_type': 'Bayesian', 'bagging_temperature': 9.414533528310379}. Best is trial 98 with value: 0.8791208791208791.
[32m[I 2023-04-21 02:24:02,097][39m Trial 2644 finished with value: 0.8539325842696629 and parameters: {'objective': 'Logloss', 'colsample_bylevel': 0.07006642495303858, 'depth': 3, 'boosting_type': 'Plain', 'bootstrap_type': 'Bayesian', 'bagging_temperature': 9.946771732244382}. Best is trial 98 with value: 0.8791208791208791.
[32m[I 2023-04-21 02:24:02,732][39m Trial 2645 finished with value: 0.8539325842696629 and parameters: {'objective': 'CrossEntropy', 'colsample_bylevel': 0.0761196853844231, 'depth': 3, 'boosting_type': 'Plain', 'bootstrap_type': 'Bayesian', 'bagging_temperature': 9.494973801879617}. Best is trial 98 with value: 0.8791208791208791.
[32m[I 2023-04-21 02:24:03,458][39m Trial 2646 finished with value: 0.8539325842696629 and parameters: {'objective': 'CrossEntropy', 'colsample_bylevel': 0.08452912759705461, 'depth': 3, 'boosting_type': 'Plain', 'bootstrap_type': 'Bernoulli', 'subsample': 0.35510522747174167}. Best is trial 98 with value: 0.8791208791208791.
[32m[I 2023-04-21 02:24:04,334][39m Trial 2647 finished with value: 0.8275862068965518 and parameters: {'objective': 'CrossEntropy', 'colsample_bylevel': 0.07857432250068348, 'depth': 4, 'boosting_type': 'Plain', 'bootstrap_type': 'Bayesian', 'bagging_temperature': 9.804817836729628}. Best is trial 98 with value: 0.8791208791208791.
[32m[I 2023-04-21 02:24:05,187][39m Trial 2648 finished with value: 0.8791208791208791 and parameters: {'objective': 'CrossEntropy', 'colsample_bylevel': 0.0797426347487718, 'depth': 3, 'boosting_type': 'Plain', 'bootstrap_type': 'Bayesian', 'bagging_temperature': 9.997553156942534}. Best is trial 98 with value: 0.8791208791208791.
[32m[I 2023-04-21 02:24:06,105][39m Trial 2649 finished with value: 0.8539325842696629 and parameters: {'objective': 'Logloss', 'colsample_bylevel': 0.07398115091357955, 'depth': 4, 'boosting_type': 'Plain', 'bootstrap_type': 'Bayesian', 'bagging_temperature': 9.639240793018661}. Best is trial 98 with value: 0.8791208791208791.
[32m[I 2023-04-21 02:24:07,062][39m Trial 2650 finished with value: 0.8409090909090909 and parameters: {'objective': 'CrossEntropy', 'colsample_bylevel': 0.07681630541072965, 'depth': 2, 'boosting_type': 'Plain', 'bootstrap_type': 'Bayesian', 'bagging_temperature': 9.156949261108121}. Best is trial 98 with value: 0.8791208791208791.
[32m[I 2023-04-21 02:24:07,745][39m Trial 2651 finished with value: 0.8636363636363636 and parameters: {'objective': 'CrossEntropy', 'colsample_bylevel': 0.07644741574244404, 'depth': 2, 'boosting_type': 'Plain', 'bootstrap_type': 'Bayesian', 'bagging_temperature': 8.235666528753988}. Best is trial 98 with value: 0.8791208791208791.
[32m[I 2023-04-21 02:24:09,039][39m Trial 2652 finished with value: 0.8539325842696629 and parameters: {'objective': 'CrossEntropy', 'colsample_bylevel': 0.0790371981915527, 'depth': 9, 'boosting_type': 'Plain', 'bootstrap_type': 'Bayesian', 'bagging_temperature': 9.074820269685643}. Best is trial 98 with value: 0.8791208791208791.
[32m[I 2023-04-21 02:24:14,304][39m Trial 2653 finished with value: 0.8222222222222222 and parameters: {'objective': 'CrossEntropy', 'colsample_bylevel': 0.0821072226751404, 'depth': 4, 'boosting_type': 'Ordered', 'bootstrap_type': 'MVS'}. Best is trial 98 with value: 0.8791208791208791.
[32m[I 2023-04-21 02:24:15,300][39m Trial 2654 finished with value: 0.8409090909090909 and parameters: {'objective': 'CrossEntropy', 'colsample_bylevel': 0.08229261685231093, 'depth': 3, 'boosting_type': 'Plain', 'bootstrap_type': 'Bayesian', 'bagging_temperature': 8.8453968244247}. Best is trial 98 with value: 0.8791208791208791.
[32m[I 2023-04-21 02:24:16,266][39m Trial 2655 finished with value: 0.8539325842696629 and parameters: {'objective': 'CrossEntropy', 'colsample_bylevel': 0.0650271899388381, 'depth': 3, 'boosting_type': 'Plain', 'bootstrap_type': 'Bayesian', 'bagging_temperature': 9.631059417906265}. Best is trial 98 with value: 0.8791208791208791.
[32m[I 2023-04-21 02:24:16,943][39m Trial 2656 finished with value: 0.8666666666666666 and parameters: {'objective': 'Logloss', 'colsample_bylevel': 0.06673865073834596, 'depth': 4, 'boosting_type': 'Plain', 'bootstrap_type': 'Bayesian', 'bagging_temperature': 8.603006320189422}. Best is trial 98 with value: 0.8791208791208791.
[32m[I 2023-04-21 02:24:17,657][39m Trial 2657 finished with value: 0.8275862068965518 and parameters: {'objective': 'CrossEntropy', 'colsample_bylevel': 0.08616706913306496, 'depth': 3, 'boosting_type': 'Plain', 'bootstrap_type': 'Bayesian', 'bagging_temperature': 9.226961596448865}. Best is trial 98 with value: 0.8791208791208791.
[32m[I 2023-04-21 02:24:18,644][39m Trial 2658 finished with value: 0.8539325842696629 and parameters: {'objective': 'CrossEntropy', 'colsample_bylevel': 0.07743528455018242, 'depth': 10, 'boosting_type': 'Plain', 'bootstrap_type': 'Bayesian', 'bagging_temperature': 9.417763175293187}. Best is trial 98 with value: 0.8791208791208791.
[32m[I 2023-04-21 02:24:19,697][39m Trial 2659 finished with value: 0.8505747126436782 and parameters: {'objective': 'CrossEntropy', 'colsample_bylevel': 0.07085142219869067, 'depth': 3, 'boosting_type': 'Plain', 'bootstrap_type': 'Bayesian', 'bagging_temperature': 8.841866599455555}. Best is trial 98 with value: 0.8791208791208791.
[32m[I 2023-04-21 02:24:20,829][39m Trial 2660 finished with value: 0.8505747126436782 and parameters: {'objective': 'CrossEntropy', 'colsample_bylevel': 0.05592308920831088, 'depth': 3, 'boosting_type': 'Plain', 'bootstrap_type': 'Bayesian', 'bagging_temperature': 8.832867970311998}. Best is trial 98 with value: 0.8791208791208791.
[32m[I 2023-04-21 02:24:21,839][39m Trial 2661 finished with value: 0.8764044943820225 and parameters: {'objective': 'CrossEntropy', 'colsample_bylevel': 0.08188325886100846, 'depth': 2, 'boosting_type': 'Plain', 'bootstrap_type': 'Bayesian', 'bagging_temperature': 9.365293736837952}. Best is trial 98 with value: 0.8791208791208791.
[32m[I 2023-04-21 02:24:22,471][39m Trial 2662 finished with value: 0.8791208791208791 and parameters: {'objective': 'CrossEntropy', 'colsample_bylevel': 0.08018166198540846, 'depth': 3, 'boosting_type': 'Plain', 'bootstrap_type': 'Bayesian', 'bagging_temperature': 9.614363430103696}. Best is trial 98 with value: 0.8791208791208791.
[32m[I 2023-04-21 02:24:23,495][39m Trial 2663 finished with value: 0.8181818181818182 and parameters: {'objective': 'CrossEntropy', 'colsample_bylevel': 0.09173138534950927, 'depth': 3, 'boosting_type': 'Plain', 'bootstrap_type': 'MVS'}. Best is trial 98 with value: 0.8791208791208791.
[32m[I 2023-04-21 02:24:24,209][39m Trial 2664 finished with value: 0.8539325842696629 and parameters: {'objective': 'CrossEntropy', 'colsample_bylevel': 0.07855037909807384, 'depth': 3, 'boosting_type': 'Plain', 'bootstrap_type': 'Bayesian', 'bagging_temperature': 9.981751415812743}. Best is trial 98 with value: 0.8791208791208791.
[32m[I 2023-04-21 02:24:24,957][39m Trial 2665 finished with value: 0.8791208791208791 and parameters: {'objective': 'CrossEntropy', 'colsample_bylevel': 0.07608645634744186, 'depth': 10, 'boosting_type': 'Plain', 'bootstrap_type': 'Bayesian', 'bagging_temperature': 9.584298951098472}. Best is trial 98 with value: 0.8791208791208791.
[32m[I 2023-04-21 02:24:26,017][39m Trial 2666 finished with value: 0.8372093023255814 and parameters: {'objective': 'CrossEntropy', 'colsample_bylevel': 0.08971474016852628, 'depth': 10, 'boosting_type': 'Plain', 'bootstrap_type': 'Bayesian', 'bagging_temperature': 9.99458912824885}. Best is trial 98 with value: 0.8791208791208791.
[32m[I 2023-04-21 02:24:27,312][39m Trial 2667 finished with value: 0.8666666666666666 and parameters: {'objective': 'Logloss', 'colsample_bylevel': 0.06610244237483366, 'depth': 10, 'boosting_type': 'Plain', 'bootstrap_type': 'Bayesian', 'bagging_temperature': 8.76601856661281}. Best is trial 98 with value: 0.8791208791208791.
[32m[I 2023-04-21 02:24:28,396][39m Trial 2668 finished with value: 0.8539325842696629 and parameters: {'objective': 'Logloss', 'colsample_bylevel': 0.07426420160566664, 'depth': 4, 'boosting_type': 'Plain', 'bootstrap_type': 'Bayesian', 'bagging_temperature': 9.412071489672282}. Best is trial 98 with value: 0.8791208791208791.
[32m[I 2023-04-21 02:24:29,372][39m Trial 2669 finished with value: 0.8409090909090909 and parameters: {'objective': 'CrossEntropy', 'colsample_bylevel': 0.07229008996466119, 'depth': 6, 'boosting_type': 'Plain', 'bootstrap_type': 'Bayesian', 'bagging_temperature': 7.552138506976739}. Best is trial 98 with value: 0.8791208791208791.
[32m[I 2023-04-21 02:24:30,769][39m Trial 2670 finished with value: 0.8539325842696629 and parameters: {'objective': 'Logloss', 'colsample_bylevel': 0.07626768126315547, 'depth': 10, 'boosting_type': 'Plain', 'bootstrap_type': 'Bayesian', 'bagging_temperature': 7.304343919149729}. Best is trial 98 with value: 0.8791208791208791.
[32m[I 2023-04-21 02:24:35,132][39m Trial 2671 finished with value: 0.8409090909090909 and parameters: {'objective': 'CrossEntropy', 'colsample_bylevel': 0.06765531420740405, 'depth': 10, 'boosting_type': 'Ordered', 'bootstrap_type': 'Bayesian', 'bagging_temperature': 9.10878641895306}. Best is trial 98 with value: 0.8791208791208791.
[32m[I 2023-04-21 02:24:36,197][39m Trial 2672 finished with value: 0.8505747126436782 and parameters: {'objective': 'CrossEntropy', 'colsample_bylevel': 0.08585693966724976, 'depth': 11, 'boosting_type': 'Plain', 'bootstrap_type': 'Bayesian', 'bagging_temperature': 9.242329322545052}. Best is trial 98 with value: 0.8791208791208791.
[32m[I 2023-04-21 02:24:37,146][39m Trial 2673 finished with value: 0.8275862068965518 and parameters: {'objective': 'CrossEntropy', 'colsample_bylevel': 0.072677446522708, 'depth': 10, 'boosting_type': 'Plain', 'bootstrap_type': 'Bayesian', 'bagging_temperature': 7.83618885712772}. Best is trial 98 with value: 0.8791208791208791.
[32m[I 2023-04-21 02:24:38,049][39m Trial 2674 finished with value: 0.8666666666666666 and parameters: {'objective': 'Logloss', 'colsample_bylevel': 0.08222076214856401, 'depth': 4, 'boosting_type': 'Plain', 'bootstrap_type': 'Bayesian', 'bagging_temperature': 7.874992553612974}. Best is trial 98 with value: 0.8791208791208791.
[32m[I 2023-04-21 02:24:38,683][39m Trial 2675 finished with value: 0.8539325842696629 and parameters: {'objective': 'CrossEntropy', 'colsample_bylevel': 0.07435454880819202, 'depth': 3, 'boosting_type': 'Plain', 'bootstrap_type': 'Bernoulli', 'subsample': 0.7569473836233679}. Best is trial 98 with value: 0.8791208791208791.
[32m[I 2023-04-21 02:24:39,957][39m Trial 2676 finished with value: 0.8275862068965518 and parameters: {'objective': 'CrossEntropy', 'colsample_bylevel': 0.09098165247938324, 'depth': 8, 'boosting_type': 'Plain', 'bootstrap_type': 'Bayesian', 'bagging_temperature': 9.600078820513708}. Best is trial 98 with value: 0.8791208791208791.
[32m[I 2023-04-21 02:24:40,672][39m Trial 2677 finished with value: 0.8539325842696629 and parameters: {'objective': 'Logloss', 'colsample_bylevel': 0.0733229980409814, 'depth': 3, 'boosting_type': 'Plain', 'bootstrap_type': 'Bayesian', 'bagging_temperature': 3.6531162917570246}. Best is trial 98 with value: 0.8791208791208791.
[32m[I 2023-04-21 02:24:42,240][39m Trial 2678 finished with value: 0.8275862068965518 and parameters: {'objective': 'CrossEntropy', 'colsample_bylevel': 0.07673306520483145, 'depth': 9, 'boosting_type': 'Plain', 'bootstrap_type': 'Bayesian', 'bagging_temperature': 9.639609230722323}. Best is trial 98 with value: 0.8791208791208791.
[32m[I 2023-04-21 02:24:43,122][39m Trial 2679 finished with value: 0.8636363636363636 and parameters: {'objective': 'CrossEntropy', 'colsample_bylevel': 0.07982918345629267, 'depth': 2, 'boosting_type': 'Plain', 'bootstrap_type': 'Bayesian', 'bagging_temperature': 9.214248295191023}. Best is trial 98 with value: 0.8791208791208791.
[32m[I 2023-04-21 02:24:44,118][39m Trial 2680 finished with value: 0.8275862068965518 and parameters: {'objective': 'CrossEntropy', 'colsample_bylevel': 0.07523879217537487, 'depth': 3, 'boosting_type': 'Plain', 'bootstrap_type': 'MVS'}. Best is trial 98 with value: 0.8791208791208791.
[32m[I 2023-04-21 02:24:45,202][39m Trial 2681 finished with value: 0.8275862068965518 and parameters: {'objective': 'CrossEntropy', 'colsample_bylevel': 0.09433526763931742, 'depth': 3, 'boosting_type': 'Plain', 'bootstrap_type': 'MVS'}. Best is trial 98 with value: 0.8791208791208791.
[32m[I 2023-04-21 02:24:45,880][39m Trial 2682 finished with value: 0.8539325842696629 and parameters: {'objective': 'CrossEntropy', 'colsample_bylevel': 0.07249901392488624, 'depth': 4, 'boosting_type': 'Plain', 'bootstrap_type': 'Bayesian', 'bagging_temperature': 9.035818616056394}. Best is trial 98 with value: 0.8791208791208791.
[32m[I 2023-04-21 02:24:46,472][39m Trial 2683 finished with value: 0.8666666666666666 and parameters: {'objective': 'Logloss', 'colsample_bylevel': 0.06796000240849412, 'depth': 3, 'boosting_type': 'Plain', 'bootstrap_type': 'Bayesian', 'bagging_temperature': 7.697596768466106}. Best is trial 98 with value: 0.8791208791208791.
[32m[I 2023-04-21 02:24:47,271][39m Trial 2684 finished with value: 0.8275862068965518 and parameters: {'objective': 'CrossEntropy', 'colsample_bylevel': 0.08530933321587862, 'depth': 9, 'boosting_type': 'Plain', 'bootstrap_type': 'Bayesian', 'bagging_temperature': 9.464567098234228}. Best is trial 98 with value: 0.8791208791208791.
[32m[I 2023-04-21 02:24:48,137][39m Trial 2685 finished with value: 0.8666666666666666 and parameters: {'objective': 'CrossEntropy', 'colsample_bylevel': 0.08028299453763756, 'depth': 3, 'boosting_type': 'Plain', 'bootstrap_type': 'Bayesian', 'bagging_temperature': 8.894745310479584}. Best is trial 98 with value: 0.8791208791208791.
[32m[I 2023-04-21 02:24:49,021][39m Trial 2686 finished with value: 0.8636363636363636 and parameters: {'objective': 'CrossEntropy', 'colsample_bylevel': 0.08227800510001079, 'depth': 2, 'boosting_type': 'Plain', 'bootstrap_type': 'Bayesian', 'bagging_temperature': 9.003408515023345}. Best is trial 98 with value: 0.8791208791208791.
[32m[I 2023-04-21 02:24:50,118][39m Trial 2687 finished with value: 0.8539325842696629 and parameters: {'objective': 'CrossEntropy', 'colsample_bylevel': 0.0771841637849944, 'depth': 4, 'boosting_type': 'Plain', 'bootstrap_type': 'Bayesian', 'bagging_temperature': 7.971751784096729}. Best is trial 98 with value: 0.8791208791208791.
[32m[I 2023-04-21 02:24:51,038][39m Trial 2688 finished with value: 0.8791208791208791 and parameters: {'objective': 'Logloss', 'colsample_bylevel': 0.07373594819693725, 'depth': 10, 'boosting_type': 'Plain', 'bootstrap_type': 'Bayesian', 'bagging_temperature': 9.521470201986489}. Best is trial 98 with value: 0.8791208791208791.
[32m[I 2023-04-21 02:24:55,903][39m Trial 2689 finished with value: 0.8444444444444446 and parameters: {'objective': 'CrossEntropy', 'colsample_bylevel': 0.09289637853186869, 'depth': 2, 'boosting_type': 'Ordered', 'bootstrap_type': 'Bayesian', 'bagging_temperature': 9.925436036150574}. Best is trial 98 with value: 0.8791208791208791.
[32m[I 2023-04-21 02:24:56,766][39m Trial 2690 finished with value: 0.8666666666666666 and parameters: {'objective': 'Logloss', 'colsample_bylevel': 0.07745018347652365, 'depth': 3, 'boosting_type': 'Plain', 'bootstrap_type': 'Bayesian', 'bagging_temperature': 9.063693983873568}. Best is trial 98 with value: 0.8791208791208791.
[32m[I 2023-04-21 02:24:57,999][39m Trial 2691 finished with value: 0.8372093023255814 and parameters: {'objective': 'CrossEntropy', 'colsample_bylevel': 0.07261546644529347, 'depth': 9, 'boosting_type': 'Plain', 'bootstrap_type': 'Bayesian', 'bagging_temperature': 9.691691840181846}. Best is trial 98 with value: 0.8791208791208791.
[32m[I 2023-04-21 02:24:58,904][39m Trial 2692 finished with value: 0.8409090909090909 and parameters: {'objective': 'CrossEntropy', 'colsample_bylevel': 0.07877163482898945, 'depth': 3, 'boosting_type': 'Plain', 'bootstrap_type': 'Bayesian', 'bagging_temperature': 9.549313703032647}. Best is trial 98 with value: 0.8791208791208791.
[32m[I 2023-04-21 02:25:00,025][39m Trial 2693 finished with value: 0.8666666666666666 and parameters: {'objective': 'Logloss', 'colsample_bylevel': 0.0753972191311673, 'depth': 10, 'boosting_type': 'Plain', 'bootstrap_type': 'Bayesian', 'bagging_temperature': 7.955074570395375}. Best is trial 98 with value: 0.8791208791208791.
[32m[I 2023-04-21 02:25:00,942][39m Trial 2694 finished with value: 0.8636363636363636 and parameters: {'objective': 'CrossEntropy', 'colsample_bylevel': 0.053226211324254626, 'depth': 3, 'boosting_type': 'Plain', 'bootstrap_type': 'Bayesian', 'bagging_temperature': 9.80442758171305}. Best is trial 98 with value: 0.8791208791208791.
[32m[I 2023-04-21 02:25:01,540][39m Trial 2695 finished with value: 0.8539325842696629 and parameters: {'objective': 'CrossEntropy', 'colsample_bylevel': 0.07442105428330112, 'depth': 10, 'boosting_type': 'Plain', 'bootstrap_type': 'Bayesian', 'bagging_temperature': 9.857539401383562}. Best is trial 98 with value: 0.8791208791208791.
[32m[I 2023-04-21 02:25:02,313][39m Trial 2696 finished with value: 0.8409090909090909 and parameters: {'objective': 'CrossEntropy', 'colsample_bylevel': 0.0685942916547117, 'depth': 12, 'boosting_type': 'Plain', 'bootstrap_type': 'Bayesian', 'bagging_temperature': 9.499120047388226}. Best is trial 98 with value: 0.8791208791208791.
[32m[I 2023-04-21 02:25:03,300][39m Trial 2697 finished with value: 0.8409090909090909 and parameters: {'objective': 'CrossEntropy', 'colsample_bylevel': 0.0993152357647789, 'depth': 3, 'boosting_type': 'Plain', 'bootstrap_type': 'Bayesian', 'bagging_temperature': 9.82160688515896}. Best is trial 98 with value: 0.8791208791208791.
[32m[I 2023-04-21 02:25:04,248][39m Trial 2698 finished with value: 0.8275862068965518 and parameters: {'objective': 'CrossEntropy', 'colsample_bylevel': 0.09669140726437696, 'depth': 3, 'boosting_type': 'Plain', 'bootstrap_type': 'Bayesian', 'bagging_temperature': 9.057026665453646}. Best is trial 98 with value: 0.8791208791208791.
[32m[I 2023-04-21 02:25:05,251][39m Trial 2699 finished with value: 0.8409090909090909 and parameters: {'objective': 'CrossEntropy', 'colsample_bylevel': 0.0783425196708051, 'depth': 10, 'boosting_type': 'Plain', 'bootstrap_type': 'Bernoulli', 'subsample': 0.17899098828895865}. Best is trial 98 with value: 0.8791208791208791.
[32m[I 2023-04-21 02:25:06,027][39m Trial 2700 finished with value: 0.8409090909090909 and parameters: {'objective': 'CrossEntropy', 'colsample_bylevel': 0.07978682437941405, 'depth': 10, 'boosting_type': 'Plain', 'bootstrap_type': 'Bayesian', 'bagging_temperature': 9.5879300960411}. Best is trial 98 with value: 0.8791208791208791.
[32m[I 2023-04-21 02:25:06,889][39m Trial 2701 finished with value: 0.8409090909090909 and parameters: {'objective': 'CrossEntropy', 'colsample_bylevel': 0.07389619064686051, 'depth': 8, 'boosting_type': 'Plain', 'bootstrap_type': 'Bayesian', 'bagging_temperature': 9.036666013428162}. Best is trial 98 with value: 0.8791208791208791.
[32m[I 2023-04-21 02:25:07,496][39m Trial 2702 finished with value: 0.8666666666666666 and parameters: {'objective': 'CrossEntropy', 'colsample_bylevel': 0.08031625417228734, 'depth': 3, 'boosting_type': 'Plain', 'bootstrap_type': 'Bayesian', 'bagging_temperature': 8.690985315832998}. Best is trial 98 with value: 0.8791208791208791.
[32m[I 2023-04-21 02:25:08,717][39m Trial 2703 finished with value: 0.8666666666666666 and parameters: {'objective': 'CrossEntropy', 'colsample_bylevel': 0.07961161307393907, 'depth': 3, 'boosting_type': 'Plain', 'bootstrap_type': 'Bayesian', 'bagging_temperature': 9.765275237604264}. Best is trial 98 with value: 0.8791208791208791.
[32m[I 2023-04-21 02:25:09,733][39m Trial 2704 finished with value: 0.8409090909090909 and parameters: {'objective': 'CrossEntropy', 'colsample_bylevel': 0.08652583250576265, 'depth': 3, 'boosting_type': 'Plain', 'bootstrap_type': 'Bayesian', 'bagging_temperature': 9.324046415847972}. Best is trial 98 with value: 0.8791208791208791.
[32m[I 2023-04-21 02:25:14,795][39m Trial 2705 finished with value: 0.8409090909090909 and parameters: {'objective': 'CrossEntropy', 'colsample_bylevel': 0.08958148832618666, 'depth': 3, 'boosting_type': 'Ordered', 'bootstrap_type': 'Bayesian', 'bagging_temperature': 9.93983846892883}. Best is trial 98 with value: 0.8791208791208791.
[32m[I 2023-04-21 02:25:15,695][39m Trial 2706 finished with value: 0.8539325842696629 and parameters: {'objective': 'Logloss', 'colsample_bylevel': 0.09050204375840484, 'depth': 3, 'boosting_type': 'Plain', 'bootstrap_type': 'Bayesian', 'bagging_temperature': 9.838231103607576}. Best is trial 98 with value: 0.8791208791208791.
[32m[I 2023-04-21 02:25:16,567][39m Trial 2707 finished with value: 0.8409090909090909 and parameters: {'objective': 'Logloss', 'colsample_bylevel': 0.07482007351452095, 'depth': 4, 'boosting_type': 'Plain', 'bootstrap_type': 'MVS'}. Best is trial 98 with value: 0.8791208791208791.
[32m[I 2023-04-21 02:25:17,642][39m Trial 2708 finished with value: 0.8235294117647058 and parameters: {'objective': 'CrossEntropy', 'colsample_bylevel': 0.08331503690915014, 'depth': 10, 'boosting_type': 'Plain', 'bootstrap_type': 'Bayesian', 'bagging_temperature': 9.523351554335196}. Best is trial 98 with value: 0.8791208791208791.
