[32m[I 2023-04-21 01:59:09,138][39m Trial 1323 finished with value: 0.8505747126436782 and parameters: {'objective': 'CrossEntropy', 'colsample_bylevel': 0.07699107024331825, 'depth': 10, 'boosting_type': 'Plain', 'bootstrap_type': 'Bayesian', 'bagging_temperature': 9.392148082645559}. Best is trial 98 with value: 0.8791208791208791.
[32m[I 2023-04-21 01:59:09,928][39m Trial 1324 finished with value: 0.8409090909090909 and parameters: {'objective': 'CrossEntropy', 'colsample_bylevel': 0.06832146209728236, 'depth': 3, 'boosting_type': 'Plain', 'bootstrap_type': 'Bernoulli', 'subsample': 0.2080890647414128}. Best is trial 98 with value: 0.8791208791208791.
[32m[I 2023-04-21 01:59:10,797][39m Trial 1325 finished with value: 0.8409090909090909 and parameters: {'objective': 'CrossEntropy', 'colsample_bylevel': 0.07423015722061255, 'depth': 10, 'boosting_type': 'Plain', 'bootstrap_type': 'Bayesian', 'bagging_temperature': 8.483687821020926}. Best is trial 98 with value: 0.8791208791208791.
[32m[I 2023-04-21 01:59:11,917][39m Trial 1326 finished with value: 0.8539325842696629 and parameters: {'objective': 'CrossEntropy', 'colsample_bylevel': 0.09540894475281744, 'depth': 9, 'boosting_type': 'Plain', 'bootstrap_type': 'Bayesian', 'bagging_temperature': 9.952388907548036}. Best is trial 98 with value: 0.8791208791208791.
[32m[I 2023-04-21 01:59:12,638][39m Trial 1327 finished with value: 0.8539325842696629 and parameters: {'objective': 'Logloss', 'colsample_bylevel': 0.08029045662427664, 'depth': 4, 'boosting_type': 'Plain', 'bootstrap_type': 'Bayesian', 'bagging_temperature': 9.122048357183642}. Best is trial 98 with value: 0.8791208791208791.
[32m[I 2023-04-21 01:59:13,540][39m Trial 1328 finished with value: 0.8666666666666666 and parameters: {'objective': 'Logloss', 'colsample_bylevel': 0.08055277610556354, 'depth': 4, 'boosting_type': 'Plain', 'bootstrap_type': 'Bayesian', 'bagging_temperature': 9.319099228653211}. Best is trial 98 with value: 0.8791208791208791.
[32m[I 2023-04-21 01:59:14,623][39m Trial 1329 finished with value: 0.8409090909090909 and parameters: {'objective': 'Logloss', 'colsample_bylevel': 0.07631959298315816, 'depth': 9, 'boosting_type': 'Plain', 'bootstrap_type': 'MVS'}. Best is trial 98 with value: 0.8791208791208791.
[32m[I 2023-04-21 01:59:15,585][39m Trial 1330 finished with value: 0.8539325842696629 and parameters: {'objective': 'CrossEntropy', 'colsample_bylevel': 0.07395597249078448, 'depth': 11, 'boosting_type': 'Plain', 'bootstrap_type': 'Bayesian', 'bagging_temperature': 9.873701222855964}. Best is trial 98 with value: 0.8791208791208791.
[32m[I 2023-04-21 01:59:20,361][39m Trial 1331 finished with value: 0.8139534883720929 and parameters: {'objective': 'CrossEntropy', 'colsample_bylevel': 0.07723537735540055, 'depth': 3, 'boosting_type': 'Ordered', 'bootstrap_type': 'Bayesian', 'bagging_temperature': 9.99904665213117}. Best is trial 98 with value: 0.8791208791208791.
[32m[I 2023-04-21 01:59:21,688][39m Trial 1332 finished with value: 0.8539325842696629 and parameters: {'objective': 'Logloss', 'colsample_bylevel': 0.07388479898551917, 'depth': 4, 'boosting_type': 'Plain', 'bootstrap_type': 'Bayesian', 'bagging_temperature': 9.679512914004123}. Best is trial 98 with value: 0.8791208791208791.
[32m[I 2023-04-21 01:59:22,589][39m Trial 1333 finished with value: 0.8409090909090909 and parameters: {'objective': 'CrossEntropy', 'colsample_bylevel': 0.06978439820489168, 'depth': 4, 'boosting_type': 'Plain', 'bootstrap_type': 'Bayesian', 'bagging_temperature': 9.57778737526445}. Best is trial 98 with value: 0.8791208791208791.
[32m[I 2023-04-21 01:59:23,216][39m Trial 1334 finished with value: 0.8539325842696629 and parameters: {'objective': 'CrossEntropy', 'colsample_bylevel': 0.07259468983802118, 'depth': 4, 'boosting_type': 'Plain', 'bootstrap_type': 'Bayesian', 'bagging_temperature': 9.229960799912513}. Best is trial 98 with value: 0.8791208791208791.
[32m[I 2023-04-21 01:59:23,944][39m Trial 1335 finished with value: 0.8409090909090909 and parameters: {'objective': 'CrossEntropy', 'colsample_bylevel': 0.08430570924045787, 'depth': 3, 'boosting_type': 'Plain', 'bootstrap_type': 'Bayesian', 'bagging_temperature': 8.984506356739034}. Best is trial 98 with value: 0.8791208791208791.
[32m[I 2023-04-21 01:59:24,815][39m Trial 1336 finished with value: 0.8409090909090909 and parameters: {'objective': 'CrossEntropy', 'colsample_bylevel': 0.0787681632361571, 'depth': 6, 'boosting_type': 'Plain', 'bootstrap_type': 'Bayesian', 'bagging_temperature': 9.343835698079273}. Best is trial 98 with value: 0.8791208791208791.
[32m[I 2023-04-21 01:59:25,812][39m Trial 1337 finished with value: 0.8666666666666666 and parameters: {'objective': 'CrossEntropy', 'colsample_bylevel': 0.07797688707359185, 'depth': 3, 'boosting_type': 'Plain', 'bootstrap_type': 'Bayesian', 'bagging_temperature': 8.824705000286285}. Best is trial 98 with value: 0.8791208791208791.
[32m[I 2023-04-21 01:59:26,459][39m Trial 1338 finished with value: 0.8666666666666666 and parameters: {'objective': 'Logloss', 'colsample_bylevel': 0.07905341817349405, 'depth': 4, 'boosting_type': 'Plain', 'bootstrap_type': 'Bayesian', 'bagging_temperature': 8.061065650777724}. Best is trial 98 with value: 0.8791208791208791.
[32m[I 2023-04-21 01:59:27,413][39m Trial 1339 finished with value: 0.8539325842696629 and parameters: {'objective': 'CrossEntropy', 'colsample_bylevel': 0.0709515561300828, 'depth': 12, 'boosting_type': 'Plain', 'bootstrap_type': 'Bayesian', 'bagging_temperature': 8.777864328202394}. Best is trial 98 with value: 0.8791208791208791.
[32m[I 2023-04-21 01:59:28,267][39m Trial 1340 finished with value: 0.8139534883720929 and parameters: {'objective': 'CrossEntropy', 'colsample_bylevel': 0.0759404050092515, 'depth': 10, 'boosting_type': 'Plain', 'bootstrap_type': 'Bayesian', 'bagging_temperature': 9.436671802191444}. Best is trial 98 with value: 0.8791208791208791.
[32m[I 2023-04-21 01:59:29,131][39m Trial 1341 finished with value: 0.8275862068965518 and parameters: {'objective': 'CrossEntropy', 'colsample_bylevel': 0.07624129171114125, 'depth': 3, 'boosting_type': 'Plain', 'bootstrap_type': 'MVS'}. Best is trial 98 with value: 0.8791208791208791.
[32m[I 2023-04-21 01:59:30,018][39m Trial 1342 finished with value: 0.8505747126436782 and parameters: {'objective': 'CrossEntropy', 'colsample_bylevel': 0.08667723759837548, 'depth': 11, 'boosting_type': 'Plain', 'bootstrap_type': 'Bayesian', 'bagging_temperature': 9.601219060249644}. Best is trial 98 with value: 0.8791208791208791.
[32m[I 2023-04-21 01:59:30,711][39m Trial 1343 finished with value: 0.8181818181818182 and parameters: {'objective': 'CrossEntropy', 'colsample_bylevel': 0.07788816246818092, 'depth': 8, 'boosting_type': 'Plain', 'bootstrap_type': 'Bernoulli', 'subsample': 0.7279384813952615}. Best is trial 98 with value: 0.8791208791208791.
[32m[I 2023-04-21 01:59:31,619][39m Trial 1344 finished with value: 0.8409090909090909 and parameters: {'objective': 'Logloss', 'colsample_bylevel': 0.07954198490455236, 'depth': 10, 'boosting_type': 'Plain', 'bootstrap_type': 'Bayesian', 'bagging_temperature': 9.711834942094164}. Best is trial 98 with value: 0.8791208791208791.
[32m[I 2023-04-21 01:59:32,343][39m Trial 1345 finished with value: 0.8409090909090909 and parameters: {'objective': 'Logloss', 'colsample_bylevel': 0.07303927040231438, 'depth': 4, 'boosting_type': 'Plain', 'bootstrap_type': 'Bayesian', 'bagging_temperature': 4.9261038358744855}. Best is trial 98 with value: 0.8791208791208791.
[32m[I 2023-04-21 01:59:33,547][39m Trial 1346 finished with value: 0.8275862068965518 and parameters: {'objective': 'Logloss', 'colsample_bylevel': 0.085948464389503, 'depth': 5, 'boosting_type': 'Plain', 'bootstrap_type': 'Bayesian', 'bagging_temperature': 9.29590502740294}. Best is trial 98 with value: 0.8791208791208791.
[32m[I 2023-04-21 01:59:34,583][39m Trial 1347 finished with value: 0.8666666666666666 and parameters: {'objective': 'CrossEntropy', 'colsample_bylevel': 0.0730109414786301, 'depth': 4, 'boosting_type': 'Plain', 'bootstrap_type': 'Bayesian', 'bagging_temperature': 9.809546753169645}. Best is trial 98 with value: 0.8791208791208791.
[32m[I 2023-04-21 01:59:35,503][39m Trial 1348 finished with value: 0.8539325842696629 and parameters: {'objective': 'CrossEntropy', 'colsample_bylevel': 0.07821624975208917, 'depth': 10, 'boosting_type': 'Plain', 'bootstrap_type': 'Bayesian', 'bagging_temperature': 9.986490600235662}. Best is trial 98 with value: 0.8791208791208791.
[32m[I 2023-04-21 01:59:36,358][39m Trial 1349 finished with value: 0.8275862068965518 and parameters: {'objective': 'CrossEntropy', 'colsample_bylevel': 0.08417427716713273, 'depth': 4, 'boosting_type': 'Plain', 'bootstrap_type': 'Bayesian', 'bagging_temperature': 9.15693991367672}. Best is trial 98 with value: 0.8791208791208791.
[32m[I 2023-04-21 01:59:37,365][39m Trial 1350 finished with value: 0.8539325842696629 and parameters: {'objective': 'Logloss', 'colsample_bylevel': 0.0746147584735072, 'depth': 4, 'boosting_type': 'Plain', 'bootstrap_type': 'Bayesian', 'bagging_temperature': 9.509909083862823}. Best is trial 98 with value: 0.8791208791208791.
[32m[I 2023-04-21 01:59:37,953][39m Trial 1351 finished with value: 0.8539325842696629 and parameters: {'objective': 'Logloss', 'colsample_bylevel': 0.07482794479138598, 'depth': 5, 'boosting_type': 'Plain', 'bootstrap_type': 'Bayesian', 'bagging_temperature': 8.370007011593875}. Best is trial 98 with value: 0.8791208791208791.
[32m[I 2023-04-21 01:59:39,140][39m Trial 1352 finished with value: 0.8275862068965518 and parameters: {'objective': 'Logloss', 'colsample_bylevel': 0.07676631756118374, 'depth': 5, 'boosting_type': 'Plain', 'bootstrap_type': 'Bayesian', 'bagging_temperature': 8.619364451944708}. Best is trial 98 with value: 0.8791208791208791.
[32m[I 2023-04-21 01:59:43,696][39m Trial 1353 finished with value: 0.8409090909090909 and parameters: {'objective': 'Logloss', 'colsample_bylevel': 0.07154598480076246, 'depth': 11, 'boosting_type': 'Ordered', 'bootstrap_type': 'Bayesian', 'bagging_temperature': 9.51467641335417}. Best is trial 98 with value: 0.8791208791208791.
[32m[I 2023-04-21 01:59:44,879][39m Trial 1354 finished with value: 0.8409090909090909 and parameters: {'objective': 'Logloss', 'colsample_bylevel': 0.07499294725836389, 'depth': 5, 'boosting_type': 'Plain', 'bootstrap_type': 'MVS'}. Best is trial 98 with value: 0.8791208791208791.
[32m[I 2023-04-21 01:59:45,645][39m Trial 1355 finished with value: 0.8666666666666666 and parameters: {'objective': 'CrossEntropy', 'colsample_bylevel': 0.07646218675590082, 'depth': 10, 'boosting_type': 'Plain', 'bootstrap_type': 'Bayesian', 'bagging_temperature': 8.98764190508172}. Best is trial 98 with value: 0.8791208791208791.
[32m[I 2023-04-21 01:59:46,440][39m Trial 1356 finished with value: 0.8409090909090909 and parameters: {'objective': 'CrossEntropy', 'colsample_bylevel': 0.07999800877218126, 'depth': 3, 'boosting_type': 'Plain', 'bootstrap_type': 'Bayesian', 'bagging_temperature': 5.2511651324895405}. Best is trial 98 with value: 0.8791208791208791.
[32m[I 2023-04-21 01:59:47,373][39m Trial 1357 finished with value: 0.8505747126436782 and parameters: {'objective': 'CrossEntropy', 'colsample_bylevel': 0.09848380122985192, 'depth': 12, 'boosting_type': 'Plain', 'bootstrap_type': 'Bayesian', 'bagging_temperature': 8.924285699271348}. Best is trial 98 with value: 0.8791208791208791.
[32m[I 2023-04-21 01:59:48,286][39m Trial 1358 finished with value: 0.8666666666666666 and parameters: {'objective': 'CrossEntropy', 'colsample_bylevel': 0.08294188955401796, 'depth': 3, 'boosting_type': 'Plain', 'bootstrap_type': 'Bayesian', 'bagging_temperature': 9.038369676612797}. Best is trial 98 with value: 0.8791208791208791.
[32m[I 2023-04-21 01:59:49,007][39m Trial 1359 finished with value: 0.8539325842696629 and parameters: {'objective': 'Logloss', 'colsample_bylevel': 0.07625891694511759, 'depth': 4, 'boosting_type': 'Plain', 'bootstrap_type': 'Bayesian', 'bagging_temperature': 8.197178743342672}. Best is trial 98 with value: 0.8791208791208791.
[32m[I 2023-04-21 01:59:50,128][39m Trial 1360 finished with value: 0.8539325842696629 and parameters: {'objective': 'Logloss', 'colsample_bylevel': 0.08373289913613582, 'depth': 4, 'boosting_type': 'Plain', 'bootstrap_type': 'Bayesian', 'bagging_temperature': 9.451369240302403}. Best is trial 98 with value: 0.8791208791208791.
[32m[I 2023-04-21 01:59:51,033][39m Trial 1361 finished with value: 0.8539325842696629 and parameters: {'objective': 'CrossEntropy', 'colsample_bylevel': 0.09229999792319359, 'depth': 3, 'boosting_type': 'Plain', 'bootstrap_type': 'Bayesian', 'bagging_temperature': 8.830583545583512}. Best is trial 98 with value: 0.8791208791208791.
[32m[I 2023-04-21 01:59:51,843][39m Trial 1362 finished with value: 0.8139534883720929 and parameters: {'objective': 'CrossEntropy', 'colsample_bylevel': 0.0877720902507559, 'depth': 4, 'boosting_type': 'Plain', 'bootstrap_type': 'Bayesian', 'bagging_temperature': 9.713824407720638}. Best is trial 98 with value: 0.8791208791208791.
[32m[I 2023-04-21 01:59:52,624][39m Trial 1363 finished with value: 0.8409090909090909 and parameters: {'objective': 'Logloss', 'colsample_bylevel': 0.07290139770879614, 'depth': 11, 'boosting_type': 'Plain', 'bootstrap_type': 'Bayesian', 'bagging_temperature': 9.151928283016629}. Best is trial 98 with value: 0.8791208791208791.
[32m[I 2023-04-21 01:59:53,506][39m Trial 1364 finished with value: 0.8275862068965518 and parameters: {'objective': 'CrossEntropy', 'colsample_bylevel': 0.0817498506734581, 'depth': 10, 'boosting_type': 'Plain', 'bootstrap_type': 'Bayesian', 'bagging_temperature': 3.96436047446981}. Best is trial 98 with value: 0.8791208791208791.
[32m[I 2023-04-21 01:59:54,251][39m Trial 1365 finished with value: 0.8409090909090909 and parameters: {'objective': 'Logloss', 'colsample_bylevel': 0.07242780303908529, 'depth': 4, 'boosting_type': 'Plain', 'bootstrap_type': 'Bernoulli', 'subsample': 0.9006899706008895}. Best is trial 98 with value: 0.8791208791208791.
[32m[I 2023-04-21 01:59:55,075][39m Trial 1366 finished with value: 0.8539325842696629 and parameters: {'objective': 'CrossEntropy', 'colsample_bylevel': 0.07028200058799385, 'depth': 10, 'boosting_type': 'Plain', 'bootstrap_type': 'Bayesian', 'bagging_temperature': 9.788726777653425}. Best is trial 98 with value: 0.8791208791208791.
[32m[I 2023-04-21 01:59:56,295][39m Trial 1367 finished with value: 0.8222222222222222 and parameters: {'objective': 'Logloss', 'colsample_bylevel': 0.05597560304580975, 'depth': 9, 'boosting_type': 'Plain', 'bootstrap_type': 'MVS'}. Best is trial 98 with value: 0.8791208791208791.
[32m[I 2023-04-21 01:59:57,421][39m Trial 1368 finished with value: 0.8275862068965518 and parameters: {'objective': 'Logloss', 'colsample_bylevel': 0.07607706847691538, 'depth': 9, 'boosting_type': 'Plain', 'bootstrap_type': 'Bayesian', 'bagging_temperature': 9.736954687142612}. Best is trial 98 with value: 0.8791208791208791.
[32m[I 2023-04-21 02:00:02,235][39m Trial 1369 finished with value: 0.8139534883720929 and parameters: {'objective': 'CrossEntropy', 'colsample_bylevel': 0.07408282876033759, 'depth': 4, 'boosting_type': 'Ordered', 'bootstrap_type': 'Bayesian', 'bagging_temperature': 9.986553798786199}. Best is trial 98 with value: 0.8791208791208791.
[32m[I 2023-04-21 02:00:03,171][39m Trial 1370 finished with value: 0.8409090909090909 and parameters: {'objective': 'Logloss', 'colsample_bylevel': 0.08124971106302913, 'depth': 5, 'boosting_type': 'Plain', 'bootstrap_type': 'Bayesian', 'bagging_temperature': 9.662448161837391}. Best is trial 98 with value: 0.8791208791208791.
[32m[I 2023-04-21 02:00:04,088][39m Trial 1371 finished with value: 0.8539325842696629 and parameters: {'objective': 'CrossEntropy', 'colsample_bylevel': 0.08677125215496279, 'depth': 7, 'boosting_type': 'Plain', 'bootstrap_type': 'Bayesian', 'bagging_temperature': 8.883779078732525}. Best is trial 98 with value: 0.8791208791208791.
[32m[I 2023-04-21 02:00:04,947][39m Trial 1372 finished with value: 0.8409090909090909 and parameters: {'objective': 'CrossEntropy', 'colsample_bylevel': 0.07464384308591168, 'depth': 4, 'boosting_type': 'Plain', 'bootstrap_type': 'Bayesian', 'bagging_temperature': 9.51225415530887}. Best is trial 98 with value: 0.8791208791208791.
[32m[I 2023-04-21 02:00:05,760][39m Trial 1373 finished with value: 0.8539325842696629 and parameters: {'objective': 'CrossEntropy', 'colsample_bylevel': 0.07891792761724288, 'depth': 4, 'boosting_type': 'Plain', 'bootstrap_type': 'Bayesian', 'bagging_temperature': 9.660129297880754}. Best is trial 98 with value: 0.8791208791208791.
[32m[I 2023-04-21 02:00:06,404][39m Trial 1374 finished with value: 0.8409090909090909 and parameters: {'objective': 'CrossEntropy', 'colsample_bylevel': 0.08913288702017659, 'depth': 4, 'boosting_type': 'Plain', 'bootstrap_type': 'Bayesian', 'bagging_temperature': 9.80477262016051}. Best is trial 98 with value: 0.8791208791208791.
[32m[I 2023-04-21 02:00:07,497][39m Trial 1375 finished with value: 0.8409090909090909 and parameters: {'objective': 'CrossEntropy', 'colsample_bylevel': 0.07799993517502768, 'depth': 10, 'boosting_type': 'Plain', 'bootstrap_type': 'Bayesian', 'bagging_temperature': 9.970593376330964}. Best is trial 98 with value: 0.8791208791208791.
[32m[I 2023-04-21 02:00:08,309][39m Trial 1376 finished with value: 0.8539325842696629 and parameters: {'objective': 'Logloss', 'colsample_bylevel': 0.08280697798606063, 'depth': 4, 'boosting_type': 'Plain', 'bootstrap_type': 'Bayesian', 'bagging_temperature': 9.305147814928766}. Best is trial 98 with value: 0.8791208791208791.
[32m[I 2023-04-21 02:00:09,395][39m Trial 1377 finished with value: 0.8409090909090909 and parameters: {'objective': 'CrossEntropy', 'colsample_bylevel': 0.09641188696681498, 'depth': 4, 'boosting_type': 'Plain', 'bootstrap_type': 'Bayesian', 'bagging_temperature': 9.860372450471266}. Best is trial 98 with value: 0.8791208791208791.
[32m[I 2023-04-21 02:00:10,733][39m Trial 1378 finished with value: 0.8275862068965518 and parameters: {'objective': 'CrossEntropy', 'colsample_bylevel': 0.07496572255607883, 'depth': 8, 'boosting_type': 'Plain', 'bootstrap_type': 'Bayesian', 'bagging_temperature': 9.136841696917397}. Best is trial 98 with value: 0.8791208791208791.
[32m[I 2023-04-21 02:00:11,399][39m Trial 1379 finished with value: 0.8409090909090909 and parameters: {'objective': 'Logloss', 'colsample_bylevel': 0.07628983912418119, 'depth': 11, 'boosting_type': 'Plain', 'bootstrap_type': 'MVS'}. Best is trial 98 with value: 0.8791208791208791.
[32m[I 2023-04-21 02:00:12,106][39m Trial 1380 finished with value: 0.8539325842696629 and parameters: {'objective': 'Logloss', 'colsample_bylevel': 0.07945716559244856, 'depth': 4, 'boosting_type': 'Plain', 'bootstrap_type': 'Bayesian', 'bagging_temperature': 9.511391772282824}. Best is trial 98 with value: 0.8791208791208791.
[32m[I 2023-04-21 02:00:13,039][39m Trial 1381 finished with value: 0.8666666666666666 and parameters: {'objective': 'Logloss', 'colsample_bylevel': 0.07380203554548237, 'depth': 4, 'boosting_type': 'Plain', 'bootstrap_type': 'Bayesian', 'bagging_temperature': 9.77700592497142}. Best is trial 98 with value: 0.8791208791208791.
[32m[I 2023-04-21 02:00:13,853][39m Trial 1382 finished with value: 0.8636363636363636 and parameters: {'objective': 'CrossEntropy', 'colsample_bylevel': 0.07799299822892782, 'depth': 3, 'boosting_type': 'Plain', 'bootstrap_type': 'Bayesian', 'bagging_temperature': 9.965452556503928}. Best is trial 98 with value: 0.8791208791208791.
[32m[I 2023-04-21 02:00:14,535][39m Trial 1383 finished with value: 0.8539325842696629 and parameters: {'objective': 'CrossEntropy', 'colsample_bylevel': 0.08041248316676922, 'depth': 3, 'boosting_type': 'Plain', 'bootstrap_type': 'Bayesian', 'bagging_temperature': 9.376522969058648}. Best is trial 98 with value: 0.8791208791208791.
[32m[I 2023-04-21 02:00:15,386][39m Trial 1384 finished with value: 0.8275862068965518 and parameters: {'objective': 'CrossEntropy', 'colsample_bylevel': 0.08549712969807449, 'depth': 3, 'boosting_type': 'Plain', 'bootstrap_type': 'Bayesian', 'bagging_temperature': 9.624052563907647}. Best is trial 98 with value: 0.8791208791208791.
[32m[I 2023-04-21 02:00:16,506][39m Trial 1385 finished with value: 0.8791208791208791 and parameters: {'objective': 'Logloss', 'colsample_bylevel': 0.07745256200290344, 'depth': 10, 'boosting_type': 'Plain', 'bootstrap_type': 'Bayesian', 'bagging_temperature': 8.268988965840045}. Best is trial 98 with value: 0.8791208791208791.
[32m[I 2023-04-21 02:00:17,262][39m Trial 1386 finished with value: 0.8409090909090909 and parameters: {'objective': 'Logloss', 'colsample_bylevel': 0.08299655328326615, 'depth': 11, 'boosting_type': 'Plain', 'bootstrap_type': 'Bayesian', 'bagging_temperature': 9.54871252709526}. Best is trial 98 with value: 0.8791208791208791.
[32m[I 2023-04-21 02:00:18,031][39m Trial 1387 finished with value: 0.8275862068965518 and parameters: {'objective': 'CrossEntropy', 'colsample_bylevel': 0.07591946062039219, 'depth': 4, 'boosting_type': 'Plain', 'bootstrap_type': 'Bernoulli', 'subsample': 0.2621262326249498}. Best is trial 98 with value: 0.8791208791208791.
[32m[I 2023-04-21 02:00:19,236][39m Trial 1388 finished with value: 0.8539325842696629 and parameters: {'objective': 'Logloss', 'colsample_bylevel': 0.07712505157022166, 'depth': 3, 'boosting_type': 'Plain', 'bootstrap_type': 'Bayesian', 'bagging_temperature': 7.829113894094927}. Best is trial 98 with value: 0.8791208791208791.
