[32m[I 2023-04-26 02:17:28,286][39m Trial 146 finished with value: 0.8192771084337348 and parameters: {'criterion': 'entropy', 'n_estimators': 128, 'max_features': 0.7688196163991984, 'max_depth': 54, 'min_samples_split': 4, 'min_samples_leaf': 3}. Best is trial 137 with value: 0.8666666666666666.
[32m[I 2023-04-26 02:17:28,384][39m Trial 147 finished with value: 0.8048780487804877 and parameters: {'criterion': 'entropy', 'n_estimators': 99, 'max_features': 0.7082670313754286, 'max_depth': 49, 'min_samples_split': 6, 'min_samples_leaf': 2}. Best is trial 137 with value: 0.8666666666666666.
[32m[I 2023-04-26 02:17:28,503][39m Trial 148 finished with value: 0.8735632183908046 and parameters: {'criterion': 'entropy', 'n_estimators': 121, 'max_features': 0.7971949359258705, 'max_depth': 24, 'min_samples_split': 5, 'min_samples_leaf': 3}. Best is trial 148 with value: 0.8735632183908046.
[32m[I 2023-04-26 02:17:28,619][39m Trial 149 finished with value: 0.8095238095238095 and parameters: {'criterion': 'entropy', 'n_estimators': 115, 'max_features': 0.7908464700707527, 'max_depth': 38, 'min_samples_split': 5, 'min_samples_leaf': 3}. Best is trial 148 with value: 0.8735632183908046.
[32m[I 2023-04-26 02:17:28,737][39m Trial 150 finished with value: 0.8181818181818182 and parameters: {'criterion': 'entropy', 'n_estimators': 130, 'max_features': 0.7507073620067805, 'max_depth': 21, 'min_samples_split': 5, 'min_samples_leaf': 6}. Best is trial 148 with value: 0.8735632183908046.
[32m[I 2023-04-26 02:17:28,855][39m Trial 151 finished with value: 0.8045977011494252 and parameters: {'criterion': 'entropy', 'n_estimators': 119, 'max_features': 0.8133526190636349, 'max_depth': 16, 'min_samples_split': 4, 'min_samples_leaf': 3}. Best is trial 148 with value: 0.8735632183908046.
[32m[I 2023-04-26 02:17:28,971][39m Trial 152 finished with value: 0.8045977011494252 and parameters: {'criterion': 'entropy', 'n_estimators': 121, 'max_features': 0.855848075943184, 'max_depth': 34, 'min_samples_split': 5, 'min_samples_leaf': 4}. Best is trial 148 with value: 0.8735632183908046.
[32m[I 2023-04-26 02:17:29,099][39m Trial 153 finished with value: 0.8095238095238095 and parameters: {'criterion': 'entropy', 'n_estimators': 125, 'max_features': 0.7721118689207678, 'max_depth': 24, 'min_samples_split': 6, 'min_samples_leaf': 3}. Best is trial 148 with value: 0.8735632183908046.
[32m[I 2023-04-26 02:17:29,261][39m Trial 154 finished with value: 0.8292682926829268 and parameters: {'criterion': 'entropy', 'n_estimators': 165, 'max_features': 0.7267550103207069, 'max_depth': 61, 'min_samples_split': 5, 'min_samples_leaf': 3}. Best is trial 148 with value: 0.8735632183908046.
[32m[I 2023-04-26 02:17:29,368][39m Trial 155 finished with value: 0.8372093023255814 and parameters: {'criterion': 'entropy', 'n_estimators': 110, 'max_features': 0.8311753415558897, 'max_depth': 32, 'min_samples_split': 6, 'min_samples_leaf': 4}. Best is trial 148 with value: 0.8735632183908046.
[32m[I 2023-04-26 02:17:29,487][39m Trial 156 finished with value: 0.7999999999999999 and parameters: {'criterion': 'entropy', 'n_estimators': 117, 'max_features': 0.7899656905349737, 'max_depth': 26, 'min_samples_split': 8, 'min_samples_leaf': 4}. Best is trial 148 with value: 0.8735632183908046.
[32m[I 2023-04-26 02:17:29,548][39m Trial 157 finished with value: 0.8205128205128206 and parameters: {'criterion': 'entropy', 'n_estimators': 50, 'max_features': 0.8788895143123316, 'max_depth': 44, 'min_samples_split': 4, 'min_samples_leaf': 2}. Best is trial 148 with value: 0.8735632183908046.
[32m[I 2023-04-26 02:17:29,678][39m Trial 158 finished with value: 0.8 and parameters: {'criterion': 'entropy', 'n_estimators': 122, 'max_features': 0.8938980899722023, 'max_depth': 50, 'min_samples_split': 7, 'min_samples_leaf': 1}. Best is trial 148 with value: 0.8735632183908046.
[32m[I 2023-04-26 02:17:29,805][39m Trial 159 finished with value: 0.8181818181818182 and parameters: {'criterion': 'entropy', 'n_estimators': 134, 'max_features': 0.8111908101556424, 'max_depth': 36, 'min_samples_split': 5, 'min_samples_leaf': 5}. Best is trial 148 with value: 0.8735632183908046.
[32m[I 2023-04-26 02:17:29,885][39m Trial 160 finished with value: 0.8409090909090909 and parameters: {'criterion': 'entropy', 'n_estimators': 73, 'max_features': 0.9356206597974042, 'max_depth': 21, 'min_samples_split': 11, 'min_samples_leaf': 3}. Best is trial 148 with value: 0.8735632183908046.
[32m[I 2023-04-26 02:17:30,006][39m Trial 161 finished with value: 0.8314606741573034 and parameters: {'criterion': 'entropy', 'n_estimators': 126, 'max_features': 0.8407438204372364, 'max_depth': 41, 'min_samples_split': 3, 'min_samples_leaf': 4}. Best is trial 148 with value: 0.8735632183908046.
[32m[I 2023-04-26 02:17:30,141][39m Trial 162 finished with value: 0.8235294117647058 and parameters: {'criterion': 'entropy', 'n_estimators': 114, 'max_features': 0.863272742858749, 'max_depth': 29, 'min_samples_split': 10, 'min_samples_leaf': 3}. Best is trial 148 with value: 0.8735632183908046.
[32m[I 2023-04-26 02:17:30,250][39m Trial 163 finished with value: 0.8139534883720929 and parameters: {'criterion': 'entropy', 'n_estimators': 106, 'max_features': 0.7621687865380771, 'max_depth': 46, 'min_samples_split': 6, 'min_samples_leaf': 4}. Best is trial 148 with value: 0.8735632183908046.
[32m[I 2023-04-26 02:17:30,319][39m Trial 164 finished with value: 0.8372093023255814 and parameters: {'criterion': 'entropy', 'n_estimators': 62, 'max_features': 0.8267598718572658, 'max_depth': 56, 'min_samples_split': 5, 'min_samples_leaf': 4}. Best is trial 148 with value: 0.8735632183908046.
[32m[I 2023-04-26 02:17:30,423][39m Trial 165 finished with value: 0.8444444444444446 and parameters: {'criterion': 'entropy', 'n_estimators': 102, 'max_features': 0.7791434162922447, 'max_depth': 39, 'min_samples_split': 7, 'min_samples_leaf': 5}. Best is trial 148 with value: 0.8735632183908046.
[32m[I 2023-04-26 02:17:30,483][39m Trial 166 finished with value: 0.8571428571428572 and parameters: {'criterion': 'entropy', 'n_estimators': 58, 'max_features': 0.5989585974387197, 'max_depth': 52, 'min_samples_split': 6, 'min_samples_leaf': 4}. Best is trial 148 with value: 0.8735632183908046.
[32m[I 2023-04-26 02:17:30,539][39m Trial 167 finished with value: 0.8666666666666666 and parameters: {'criterion': 'entropy', 'n_estimators': 54, 'max_features': 0.6114258966459891, 'max_depth': 55, 'min_samples_split': 6, 'min_samples_leaf': 4}. Best is trial 148 with value: 0.8735632183908046.
[32m[I 2023-04-26 02:17:30,599][39m Trial 168 finished with value: 0.7191011235955055 and parameters: {'criterion': 'entropy', 'n_estimators': 58, 'max_features': 0.6466957010174212, 'max_depth': 52, 'min_samples_split': 6, 'min_samples_leaf': 10}. Best is trial 148 with value: 0.8735632183908046.
[32m[I 2023-04-26 02:17:30,655][39m Trial 169 finished with value: 0.8470588235294119 and parameters: {'criterion': 'gini', 'n_estimators': 53, 'max_features': 0.5679346560077925, 'max_depth': 54, 'min_samples_split': 6, 'min_samples_leaf': 4}. Best is trial 148 with value: 0.8735632183908046.
[32m[I 2023-04-26 02:17:30,707][39m Trial 170 finished with value: 0.8095238095238095 and parameters: {'criterion': 'gini', 'n_estimators': 53, 'max_features': 0.5422224073871514, 'max_depth': 53, 'min_samples_split': 6, 'min_samples_leaf': 4}. Best is trial 148 with value: 0.8735632183908046.
[32m[I 2023-04-26 02:17:30,767][39m Trial 171 finished with value: 0.8409090909090909 and parameters: {'criterion': 'gini', 'n_estimators': 55, 'max_features': 0.5900709025692096, 'max_depth': 55, 'min_samples_split': 6, 'min_samples_leaf': 4}. Best is trial 148 with value: 0.8735632183908046.
[32m[I 2023-04-26 02:17:30,834][39m Trial 172 finished with value: 0.8470588235294119 and parameters: {'criterion': 'entropy', 'n_estimators': 66, 'max_features': 0.48580088591544324, 'max_depth': 85, 'min_samples_split': 6, 'min_samples_leaf': 4}. Best is trial 148 with value: 0.8735632183908046.
[32m[I 2023-04-26 02:17:30,944][39m Trial 173 finished with value: 0.8571428571428572 and parameters: {'criterion': 'entropy', 'n_estimators': 123, 'max_features': 0.48079359876630323, 'max_depth': 99, 'min_samples_split': 7, 'min_samples_leaf': 3}. Best is trial 148 with value: 0.8735632183908046.
[32m[I 2023-04-26 02:17:31,002][39m Trial 174 finished with value: 0.7749999999999999 and parameters: {'criterion': 'entropy', 'n_estimators': 57, 'max_features': 0.432688322238385, 'max_depth': 94, 'min_samples_split': 7, 'min_samples_leaf': 3}. Best is trial 148 with value: 0.8735632183908046.
[32m[I 2023-04-26 02:17:31,064][39m Trial 175 finished with value: 0.7901234567901235 and parameters: {'criterion': 'entropy', 'n_estimators': 60, 'max_features': 0.38812880479224726, 'max_depth': 101, 'min_samples_split': 6, 'min_samples_leaf': 4}. Best is trial 148 with value: 0.8735632183908046.
[32m[I 2023-04-26 02:17:31,119][39m Trial 176 finished with value: 0.8048780487804877 and parameters: {'criterion': 'entropy', 'n_estimators': 50, 'max_features': 0.5172294607591911, 'max_depth': 57, 'min_samples_split': 7, 'min_samples_leaf': 3}. Best is trial 148 with value: 0.8735632183908046.
[32m[I 2023-04-26 02:17:31,224][39m Trial 177 finished with value: 0.8 and parameters: {'criterion': 'entropy', 'n_estimators': 119, 'max_features': 0.5050982647856377, 'max_depth': 48, 'min_samples_split': 5, 'min_samples_leaf': 3}. Best is trial 148 with value: 0.8735632183908046.
[32m[I 2023-04-26 02:17:31,336][39m Trial 178 finished with value: 0.8372093023255814 and parameters: {'criterion': 'entropy', 'n_estimators': 124, 'max_features': 0.602916036594304, 'max_depth': 51, 'min_samples_split': 7, 'min_samples_leaf': 5}. Best is trial 148 with value: 0.8735632183908046.
[32m[I 2023-04-26 02:17:31,462][39m Trial 179 finished with value: 0.7951807228915663 and parameters: {'criterion': 'entropy', 'n_estimators': 140, 'max_features': 0.5861852784193586, 'max_depth': 60, 'min_samples_split': 7, 'min_samples_leaf': 3}. Best is trial 148 with value: 0.8735632183908046.
[32m[I 2023-04-26 02:17:31,527][39m Trial 180 finished with value: 0.8192771084337348 and parameters: {'criterion': 'entropy', 'n_estimators': 66, 'max_features': 0.5162679466302408, 'max_depth': 98, 'min_samples_split': 6, 'min_samples_leaf': 4}. Best is trial 148 with value: 0.8735632183908046.
[32m[I 2023-04-26 02:17:31,596][39m Trial 181 finished with value: 0.8333333333333333 and parameters: {'criterion': 'entropy', 'n_estimators': 61, 'max_features': 0.8478389346707181, 'max_depth': 43, 'min_samples_split': 5, 'min_samples_leaf': 2}. Best is trial 148 with value: 0.8735632183908046.
[32m[I 2023-04-26 02:17:31,715][39m Trial 182 finished with value: 0.8192771084337348 and parameters: {'criterion': 'entropy', 'n_estimators': 129, 'max_features': 0.6333587636056536, 'max_depth': 37, 'min_samples_split': 9, 'min_samples_leaf': 4}. Best is trial 148 with value: 0.8735632183908046.
[32m[I 2023-04-26 02:17:31,823][39m Trial 183 finished with value: 0.8192771084337348 and parameters: {'criterion': 'entropy', 'n_estimators': 121, 'max_features': 0.4919828894048163, 'max_depth': 58, 'min_samples_split': 6, 'min_samples_leaf': 4}. Best is trial 148 with value: 0.8735632183908046.
[32m[I 2023-04-26 02:17:31,942][39m Trial 184 finished with value: 0.7912087912087912 and parameters: {'criterion': 'entropy', 'n_estimators': 155, 'max_features': 0.45535484541876653, 'max_depth': 4, 'min_samples_split': 4, 'min_samples_leaf': 3}. Best is trial 148 with value: 0.8735632183908046.
[32m[I 2023-04-26 02:17:32,058][39m Trial 185 finished with value: 0.8470588235294119 and parameters: {'criterion': 'entropy', 'n_estimators': 113, 'max_features': 0.8013701027405564, 'max_depth': 87, 'min_samples_split': 5, 'min_samples_leaf': 3}. Best is trial 148 with value: 0.8735632183908046.
[32m[I 2023-04-26 02:17:32,123][39m Trial 186 finished with value: 0.8372093023255814 and parameters: {'criterion': 'entropy', 'n_estimators': 55, 'max_features': 0.8158913439026102, 'max_depth': 79, 'min_samples_split': 5, 'min_samples_leaf': 4}. Best is trial 148 with value: 0.8735632183908046.
[32m[I 2023-04-26 02:17:32,186][39m Trial 187 finished with value: 0.7906976744186047 and parameters: {'criterion': 'entropy', 'n_estimators': 70, 'max_features': 0.6635405087972953, 'max_depth': 46, 'min_samples_split': 6, 'min_samples_leaf': 5}. Best is trial 148 with value: 0.8735632183908046.
[32m[I 2023-04-26 02:17:32,249][39m Trial 188 finished with value: 0.8275862068965518 and parameters: {'criterion': 'gini', 'n_estimators': 58, 'max_features': 0.5719833826305087, 'max_depth': 33, 'min_samples_split': 6, 'min_samples_leaf': 4}. Best is trial 148 with value: 0.8735632183908046.
[32m[I 2023-04-26 02:17:32,302][39m Trial 189 finished with value: 0.8314606741573034 and parameters: {'criterion': 'gini', 'n_estimators': 52, 'max_features': 0.5494946439030176, 'max_depth': 55, 'min_samples_split': 6, 'min_samples_leaf': 4}. Best is trial 148 with value: 0.8735632183908046.
[32m[I 2023-04-26 02:17:32,420][39m Trial 190 finished with value: 0.8 and parameters: {'criterion': 'entropy', 'n_estimators': 118, 'max_features': 0.6171003631532811, 'max_depth': 64, 'min_samples_split': 4, 'min_samples_leaf': 2}. Best is trial 148 with value: 0.8735632183908046.
[32m[I 2023-04-26 02:17:32,523][39m Trial 191 finished with value: 0.8292682926829268 and parameters: {'criterion': 'entropy', 'n_estimators': 113, 'max_features': 0.47090229962448404, 'max_depth': 85, 'min_samples_split': 7, 'min_samples_leaf': 3}. Best is trial 148 with value: 0.8735632183908046.
[32m[I 2023-04-26 02:17:32,583][39m Trial 192 finished with value: 0.8292682926829268 and parameters: {'criterion': 'gini', 'n_estimators': 53, 'max_features': 0.47439399563692436, 'max_depth': 91, 'min_samples_split': 6, 'min_samples_leaf': 3}. Best is trial 148 with value: 0.8735632183908046.
[32m[I 2023-04-26 02:17:32,642][39m Trial 193 finished with value: 0.7804878048780488 and parameters: {'criterion': 'gini', 'n_estimators': 61, 'max_features': 0.487418237498472, 'max_depth': 73, 'min_samples_split': 6, 'min_samples_leaf': 4}. Best is trial 148 with value: 0.8735632183908046.
[32m[I 2023-04-26 02:17:32,707][39m Trial 194 finished with value: 0.8470588235294119 and parameters: {'criterion': 'entropy', 'n_estimators': 66, 'max_features': 0.6098680102707077, 'max_depth': 52, 'min_samples_split': 6, 'min_samples_leaf': 4}. Best is trial 148 with value: 0.8735632183908046.
[32m[I 2023-04-26 02:17:32,825][39m Trial 195 finished with value: 0.8333333333333333 and parameters: {'criterion': 'entropy', 'n_estimators': 126, 'max_features': 0.5707108915001325, 'max_depth': 53, 'min_samples_split': 6, 'min_samples_leaf': 4}. Best is trial 148 with value: 0.8735632183908046.
[32m[I 2023-04-26 02:17:32,888][39m Trial 196 finished with value: 0.7654320987654322 and parameters: {'criterion': 'entropy', 'n_estimators': 55, 'max_features': 0.6058385845933869, 'max_depth': 52, 'min_samples_split': 2, 'min_samples_leaf': 4}. Best is trial 148 with value: 0.8735632183908046.
[32m[I 2023-04-26 02:17:33,000][39m Trial 197 finished with value: 0.8275862068965518 and parameters: {'criterion': 'entropy', 'n_estimators': 109, 'max_features': 0.8007259904817886, 'max_depth': 82, 'min_samples_split': 5, 'min_samples_leaf': 3}. Best is trial 148 with value: 0.8735632183908046.
[32m[I 2023-04-26 02:17:33,110][39m Trial 198 finished with value: 0.8181818181818182 and parameters: {'criterion': 'entropy', 'n_estimators': 121, 'max_features': 0.7503851268715295, 'max_depth': 62, 'min_samples_split': 7, 'min_samples_leaf': 7}. Best is trial 148 with value: 0.8735632183908046.
[32m[I 2023-04-26 02:17:33,216][39m Trial 199 finished with value: 0.8372093023255814 and parameters: {'criterion': 'entropy', 'n_estimators': 98, 'max_features': 0.7941273747774842, 'max_depth': 42, 'min_samples_split': 5, 'min_samples_leaf': 3}. Best is trial 148 with value: 0.8735632183908046.
[32m[I 2023-04-26 02:17:33,270][39m Trial 200 finished with value: 0.7560975609756099 and parameters: {'criterion': 'entropy', 'n_estimators': 53, 'max_features': 0.5264827413794394, 'max_depth': 49, 'min_samples_split': 6, 'min_samples_leaf': 4}. Best is trial 148 with value: 0.8735632183908046.
[32m[I 2023-04-26 02:17:33,396][39m Trial 201 finished with value: 0.8604651162790697 and parameters: {'criterion': 'entropy', 'n_estimators': 117, 'max_features': 0.8336585455260106, 'max_depth': 75, 'min_samples_split': 5, 'min_samples_leaf': 3}. Best is trial 148 with value: 0.8735632183908046.
[32m[I 2023-04-26 02:17:33,514][39m Trial 202 finished with value: 0.8636363636363636 and parameters: {'criterion': 'entropy', 'n_estimators': 124, 'max_features': 0.6824972107564616, 'max_depth': 57, 'min_samples_split': 6, 'min_samples_leaf': 4}. Best is trial 148 with value: 0.8735632183908046.
[32m[I 2023-04-26 02:17:33,640][39m Trial 203 finished with value: 0.8372093023255814 and parameters: {'criterion': 'entropy', 'n_estimators': 131, 'max_features': 0.7120864526249291, 'max_depth': 59, 'min_samples_split': 5, 'min_samples_leaf': 4}. Best is trial 148 with value: 0.8735632183908046.
[32m[I 2023-04-26 02:17:33,756][39m Trial 204 finished with value: 0.8192771084337348 and parameters: {'criterion': 'entropy', 'n_estimators': 117, 'max_features': 0.7403538204584427, 'max_depth': 76, 'min_samples_split': 6, 'min_samples_leaf': 3}. Best is trial 148 with value: 0.8735632183908046.
[32m[I 2023-04-26 02:17:33,867][39m Trial 205 finished with value: 0.8192771084337348 and parameters: {'criterion': 'entropy', 'n_estimators': 123, 'max_features': 0.6332842659393042, 'max_depth': 88, 'min_samples_split': 5, 'min_samples_leaf': 3}. Best is trial 148 with value: 0.8735632183908046.
[32m[I 2023-04-26 02:17:33,985][39m Trial 206 finished with value: 0.8409090909090909 and parameters: {'criterion': 'entropy', 'n_estimators': 127, 'max_features': 0.6856285013099642, 'max_depth': 57, 'min_samples_split': 5, 'min_samples_leaf': 5}. Best is trial 148 with value: 0.8735632183908046.
[32m[I 2023-04-26 02:17:34,099][39m Trial 207 finished with value: 0.8095238095238095 and parameters: {'criterion': 'entropy', 'n_estimators': 115, 'max_features': 0.7692263605381777, 'max_depth': 69, 'min_samples_split': 6, 'min_samples_leaf': 4}. Best is trial 148 with value: 0.8735632183908046.
[32m[I 2023-04-26 02:17:34,222][39m Trial 208 finished with value: 0.8409090909090909 and parameters: {'criterion': 'entropy', 'n_estimators': 123, 'max_features': 0.8829313738798176, 'max_depth': 45, 'min_samples_split': 6, 'min_samples_leaf': 4}. Best is trial 148 with value: 0.8735632183908046.
[32m[I 2023-04-26 02:17:34,322][39m Trial 209 finished with value: 0.8148148148148149 and parameters: {'criterion': 'gini', 'n_estimators': 119, 'max_features': 0.4345470441079266, 'max_depth': 66, 'min_samples_split': 6, 'min_samples_leaf': 3}. Best is trial 148 with value: 0.8735632183908046.
[32m[I 2023-04-26 02:17:34,377][39m Trial 210 finished with value: 0.7951807228915663 and parameters: {'criterion': 'entropy', 'n_estimators': 50, 'max_features': 0.5786750987817582, 'max_depth': 24, 'min_samples_split': 7, 'min_samples_leaf': 4}. Best is trial 148 with value: 0.8735632183908046.
[32m[I 2023-04-26 02:17:34,485][39m Trial 211 finished with value: 0.8192771084337348 and parameters: {'criterion': 'entropy', 'n_estimators': 113, 'max_features': 0.654241524123183, 'max_depth': 51, 'min_samples_split': 5, 'min_samples_leaf': 3}. Best is trial 148 with value: 0.8735632183908046.
[32m[I 2023-04-26 02:17:34,564][39m Trial 212 finished with value: 0.8666666666666666 and parameters: {'criterion': 'entropy', 'n_estimators': 63, 'max_features': 0.8471060031187578, 'max_depth': 39, 'min_samples_split': 6, 'min_samples_leaf': 4}. Best is trial 148 with value: 0.8735632183908046.
[32m[I 2023-04-26 02:17:34,628][39m Trial 213 finished with value: 0.8470588235294119 and parameters: {'criterion': 'entropy', 'n_estimators': 58, 'max_features': 0.8063044878457687, 'max_depth': 97, 'min_samples_split': 6, 'min_samples_leaf': 4}. Best is trial 148 with value: 0.8735632183908046.
[32m[I 2023-04-26 02:17:34,712][39m Trial 214 finished with value: 0.8666666666666666 and parameters: {'criterion': 'entropy', 'n_estimators': 77, 'max_features': 0.8395296101657026, 'max_depth': 100, 'min_samples_split': 6, 'min_samples_leaf': 4}. Best is trial 148 with value: 0.8735632183908046.
[32m[I 2023-04-26 02:17:34,838][39m Trial 215 finished with value: 0.8539325842696629 and parameters: {'criterion': 'entropy', 'n_estimators': 122, 'max_features': 0.8484791270506162, 'max_depth': 100, 'min_samples_split': 7, 'min_samples_leaf': 3}. Best is trial 148 with value: 0.8735632183908046.
[32m[I 2023-04-26 02:17:34,902][39m Trial 216 finished with value: 0.8636363636363636 and parameters: {'criterion': 'entropy', 'n_estimators': 63, 'max_features': 0.840491603399363, 'max_depth': 97, 'min_samples_split': 6, 'min_samples_leaf': 4}. Best is trial 148 with value: 0.8735632183908046.
[32m[I 2023-04-26 02:17:35,001][39m Trial 217 finished with value: 0.8045977011494252 and parameters: {'criterion': 'entropy', 'n_estimators': 84, 'max_features': 0.8508229861392528, 'max_depth': 99, 'min_samples_split': 6, 'min_samples_leaf': 4}. Best is trial 148 with value: 0.8735632183908046.
[32m[I 2023-04-26 02:17:35,086][39m Trial 218 finished with value: 0.8409090909090909 and parameters: {'criterion': 'entropy', 'n_estimators': 91, 'max_features': 0.8409387244020833, 'max_depth': 101, 'min_samples_split': 6, 'min_samples_leaf': 4}. Best is trial 148 with value: 0.8735632183908046.
