[32m[I 2023-04-26 02:17:57,766][39m Trial 438 finished with value: 0.8604651162790697 and parameters: {'criterion': 'entropy', 'n_estimators': 186, 'max_features': 0.9268852951576619, 'max_depth': 37, 'min_samples_split': 4, 'min_samples_leaf': 3}. Best is trial 219 with value: 0.8837209302325582.
[32m[I 2023-04-26 02:17:57,857][39m Trial 439 finished with value: 0.8045977011494252 and parameters: {'criterion': 'entropy', 'n_estimators': 82, 'max_features': 0.8995710648278632, 'max_depth': 48, 'min_samples_split': 6, 'min_samples_leaf': 6}. Best is trial 219 with value: 0.8837209302325582.
[32m[I 2023-04-26 02:17:57,989][39m Trial 440 finished with value: 0.8181818181818182 and parameters: {'criterion': 'entropy', 'n_estimators': 129, 'max_features': 0.922309442122665, 'max_depth': 33, 'min_samples_split': 6, 'min_samples_leaf': 5}. Best is trial 219 with value: 0.8837209302325582.
[32m[I 2023-04-26 02:17:58,066][39m Trial 441 finished with value: 0.8470588235294119 and parameters: {'criterion': 'entropy', 'n_estimators': 68, 'max_features': 0.8350330314165341, 'max_depth': 24, 'min_samples_split': 5, 'min_samples_leaf': 3}. Best is trial 219 with value: 0.8837209302325582.
[32m[I 2023-04-26 02:17:58,188][39m Trial 442 finished with value: 0.8372093023255814 and parameters: {'criterion': 'entropy', 'n_estimators': 120, 'max_features': 0.7486548847481023, 'max_depth': 53, 'min_samples_split': 6, 'min_samples_leaf': 4}. Best is trial 219 with value: 0.8837209302325582.
[32m[I 2023-04-26 02:17:58,278][39m Trial 443 finished with value: 0.8604651162790697 and parameters: {'criterion': 'entropy', 'n_estimators': 77, 'max_features': 0.8738763977776606, 'max_depth': 31, 'min_samples_split': 5, 'min_samples_leaf': 3}. Best is trial 219 with value: 0.8837209302325582.
[32m[I 2023-04-26 02:17:58,373][39m Trial 444 finished with value: 0.8636363636363636 and parameters: {'criterion': 'entropy', 'n_estimators': 85, 'max_features': 0.8870379168880342, 'max_depth': 57, 'min_samples_split': 5, 'min_samples_leaf': 3}. Best is trial 219 with value: 0.8837209302325582.
[32m[I 2023-04-26 02:17:58,539][39m Trial 445 finished with value: 0.8181818181818182 and parameters: {'criterion': 'entropy', 'n_estimators': 172, 'max_features': 0.7784024050129394, 'max_depth': 39, 'min_samples_split': 6, 'min_samples_leaf': 4}. Best is trial 219 with value: 0.8837209302325582.
[32m[I 2023-04-26 02:17:58,601][39m Trial 446 finished with value: 0.7848101265822786 and parameters: {'criterion': 'gini', 'n_estimators': 50, 'max_features': 0.7602895036896526, 'max_depth': 58, 'min_samples_split': 5, 'min_samples_leaf': 2}. Best is trial 219 with value: 0.8837209302325582.
[32m[I 2023-04-26 02:17:58,701][39m Trial 447 finished with value: 0.8333333333333333 and parameters: {'criterion': 'entropy', 'n_estimators': 86, 'max_features': 0.9631614311708244, 'max_depth': 34, 'min_samples_split': 4, 'min_samples_leaf': 3}. Best is trial 219 with value: 0.8837209302325582.
[32m[I 2023-04-26 02:17:58,802][39m Trial 448 finished with value: 0.8604651162790697 and parameters: {'criterion': 'entropy', 'n_estimators': 89, 'max_features': 0.8913500970634856, 'max_depth': 27, 'min_samples_split': 5, 'min_samples_leaf': 3}. Best is trial 219 with value: 0.8837209302325582.
[32m[I 2023-04-26 02:17:58,905][39m Trial 449 finished with value: 0.8181818181818182 and parameters: {'criterion': 'entropy', 'n_estimators': 93, 'max_features': 0.8050452297821725, 'max_depth': 96, 'min_samples_split': 5, 'min_samples_leaf': 4}. Best is trial 219 with value: 0.8837209302325582.
[32m[I 2023-04-26 02:17:58,990][39m Trial 450 finished with value: 0.8314606741573034 and parameters: {'criterion': 'entropy', 'n_estimators': 73, 'max_features': 0.8487937493623148, 'max_depth': 36, 'min_samples_split': 5, 'min_samples_leaf': 3}. Best is trial 219 with value: 0.8837209302325582.
[32m[I 2023-04-26 02:17:59,103][39m Trial 451 finished with value: 0.8604651162790697 and parameters: {'criterion': 'entropy', 'n_estimators': 105, 'max_features': 0.8328443037414217, 'max_depth': 54, 'min_samples_split': 4, 'min_samples_leaf': 3}. Best is trial 219 with value: 0.8837209302325582.
[32m[I 2023-04-26 02:17:59,226][39m Trial 452 finished with value: 0.8372093023255814 and parameters: {'criterion': 'entropy', 'n_estimators': 126, 'max_features': 0.7961455159834266, 'max_depth': 49, 'min_samples_split': 6, 'min_samples_leaf': 4}. Best is trial 219 with value: 0.8837209302325582.
[32m[I 2023-04-26 02:17:59,318][39m Trial 453 finished with value: 0.8333333333333333 and parameters: {'criterion': 'entropy', 'n_estimators': 76, 'max_features': 0.810197371109824, 'max_depth': 51, 'min_samples_split': 5, 'min_samples_leaf': 3}. Best is trial 219 with value: 0.8837209302325582.
[32m[I 2023-04-26 02:17:59,480][39m Trial 454 finished with value: 0.8292682926829268 and parameters: {'criterion': 'entropy', 'n_estimators': 167, 'max_features': 0.7299231311220115, 'max_depth': 57, 'min_samples_split': 5, 'min_samples_leaf': 2}. Best is trial 219 with value: 0.8837209302325582.
[32m[I 2023-04-26 02:17:59,597][39m Trial 455 finished with value: 0.8636363636363636 and parameters: {'criterion': 'entropy', 'n_estimators': 113, 'max_features': 0.7802585769381911, 'max_depth': 94, 'min_samples_split': 6, 'min_samples_leaf': 4}. Best is trial 219 with value: 0.8837209302325582.
[32m[I 2023-04-26 02:17:59,721][39m Trial 456 finished with value: 0.8372093023255814 and parameters: {'criterion': 'entropy', 'n_estimators': 120, 'max_features': 0.7879511535263721, 'max_depth': 18, 'min_samples_split': 6, 'min_samples_leaf': 4}. Best is trial 219 with value: 0.8837209302325582.
[32m[I 2023-04-26 02:17:59,840][39m Trial 457 finished with value: 0.8095238095238095 and parameters: {'criterion': 'entropy', 'n_estimators': 112, 'max_features': 0.7728581622011618, 'max_depth': 94, 'min_samples_split': 5, 'min_samples_leaf': 3}. Best is trial 219 with value: 0.8837209302325582.
[32m[I 2023-04-26 02:17:59,919][39m Trial 458 finished with value: 0.7749999999999999 and parameters: {'criterion': 'entropy', 'n_estimators': 91, 'max_features': 0.017054962156586084, 'max_depth': 90, 'min_samples_split': 8, 'min_samples_leaf': 3}. Best is trial 219 with value: 0.8837209302325582.
[32m[I 2023-04-26 02:18:00,116][39m Trial 459 finished with value: 0.8275862068965518 and parameters: {'criterion': 'entropy', 'n_estimators': 192, 'max_features': 0.916825177178663, 'max_depth': 92, 'min_samples_split': 6, 'min_samples_leaf': 4}. Best is trial 219 with value: 0.8837209302325582.
[32m[I 2023-04-26 02:18:00,250][39m Trial 460 finished with value: 0.8433734939759037 and parameters: {'criterion': 'entropy', 'n_estimators': 130, 'max_features': 0.8222460166423341, 'max_depth': 31, 'min_samples_split': 5, 'min_samples_leaf': 3}. Best is trial 219 with value: 0.8837209302325582.
[32m[I 2023-04-26 02:18:00,344][39m Trial 461 finished with value: 0.7951807228915663 and parameters: {'criterion': 'entropy', 'n_estimators': 82, 'max_features': 0.866993952072433, 'max_depth': 23, 'min_samples_split': 3, 'min_samples_leaf': 3}. Best is trial 219 with value: 0.8837209302325582.
[32m[I 2023-04-26 02:18:00,422][39m Trial 462 finished with value: 0.8735632183908046 and parameters: {'criterion': 'entropy', 'n_estimators': 65, 'max_features': 0.8495975398005781, 'max_depth': 101, 'min_samples_split': 5, 'min_samples_leaf': 3}. Best is trial 219 with value: 0.8837209302325582.
[32m[I 2023-04-26 02:18:00,583][39m Trial 463 finished with value: 0.8372093023255814 and parameters: {'criterion': 'entropy', 'n_estimators': 158, 'max_features': 0.8987644257426004, 'max_depth': 29, 'min_samples_split': 7, 'min_samples_leaf': 3}. Best is trial 219 with value: 0.8837209302325582.
[32m[I 2023-04-26 02:18:00,661][39m Trial 464 finished with value: 0.7764705882352942 and parameters: {'criterion': 'entropy', 'n_estimators': 69, 'max_features': 0.8260771349181848, 'max_depth': 101, 'min_samples_split': 5, 'min_samples_leaf': 5}. Best is trial 219 with value: 0.8837209302325582.
[32m[I 2023-04-26 02:18:00,752][39m Trial 465 finished with value: 0.8235294117647058 and parameters: {'criterion': 'gini', 'n_estimators': 86, 'max_features': 0.8815428725793956, 'max_depth': 64, 'min_samples_split': 4, 'min_samples_leaf': 3}. Best is trial 219 with value: 0.8837209302325582.
[32m[I 2023-04-26 02:18:00,830][39m Trial 466 finished with value: 0.8048780487804877 and parameters: {'criterion': 'entropy', 'n_estimators': 64, 'max_features': 0.8426834270250054, 'max_depth': 99, 'min_samples_split': 7, 'min_samples_leaf': 2}. Best is trial 219 with value: 0.8837209302325582.
[32m[I 2023-04-26 02:18:00,926][39m Trial 467 finished with value: 0.8604651162790697 and parameters: {'criterion': 'entropy', 'n_estimators': 85, 'max_features': 0.887731330961203, 'max_depth': 101, 'min_samples_split': 5, 'min_samples_leaf': 3}. Best is trial 219 with value: 0.8837209302325582.
[32m[I 2023-04-26 02:18:01,062][39m Trial 468 finished with value: 0.8470588235294119 and parameters: {'criterion': 'entropy', 'n_estimators': 134, 'max_features': 0.8114042226364558, 'max_depth': 96, 'min_samples_split': 5, 'min_samples_leaf': 3}. Best is trial 219 with value: 0.8837209302325582.
[32m[I 2023-04-26 02:18:01,176][39m Trial 469 finished with value: 0.8470588235294119 and parameters: {'criterion': 'entropy', 'n_estimators': 110, 'max_features': 0.745672265102181, 'max_depth': 13, 'min_samples_split': 2, 'min_samples_leaf': 4}. Best is trial 219 with value: 0.8837209302325582.
[32m[I 2023-04-26 02:18:01,353][39m Trial 470 finished with value: 0.8505747126436782 and parameters: {'criterion': 'entropy', 'n_estimators': 181, 'max_features': 0.7604656268100649, 'max_depth': 89, 'min_samples_split': 5, 'min_samples_leaf': 3}. Best is trial 219 with value: 0.8837209302325582.
[32m[I 2023-04-26 02:18:01,459][39m Trial 471 finished with value: 0.8470588235294119 and parameters: {'criterion': 'entropy', 'n_estimators': 96, 'max_features': 0.9078516815497104, 'max_depth': 61, 'min_samples_split': 5, 'min_samples_leaf': 3}. Best is trial 219 with value: 0.8837209302325582.
[32m[I 2023-04-26 02:18:01,562][39m Trial 472 finished with value: 0.8372093023255814 and parameters: {'criterion': 'entropy', 'n_estimators': 79, 'max_features': 0.8641342972463666, 'max_depth': 53, 'min_samples_split': 5, 'min_samples_leaf': 3}. Best is trial 219 with value: 0.8837209302325582.
[32m[I 2023-04-26 02:18:01,685][39m Trial 473 finished with value: 0.7594936708860759 and parameters: {'criterion': 'entropy', 'n_estimators': 125, 'max_features': 0.6673130093649194, 'max_depth': 33, 'min_samples_split': 5, 'min_samples_leaf': 2}. Best is trial 219 with value: 0.8837209302325582.
[32m[I 2023-04-26 02:18:01,809][39m Trial 474 finished with value: 0.8372093023255814 and parameters: {'criterion': 'entropy', 'n_estimators': 115, 'max_features': 0.7899627403236019, 'max_depth': 98, 'min_samples_split': 5, 'min_samples_leaf': 4}. Best is trial 219 with value: 0.8837209302325582.
[32m[I 2023-04-26 02:18:01,928][39m Trial 475 finished with value: 0.8372093023255814 and parameters: {'criterion': 'entropy', 'n_estimators': 112, 'max_features': 0.8516585334197261, 'max_depth': 101, 'min_samples_split': 4, 'min_samples_leaf': 3}. Best is trial 219 with value: 0.8837209302325582.
[32m[I 2023-04-26 02:18:02,047][39m Trial 476 finished with value: 0.8192771084337348 and parameters: {'criterion': 'entropy', 'n_estimators': 109, 'max_features': 0.8029946304312409, 'max_depth': 35, 'min_samples_split': 3, 'min_samples_leaf': 3}. Best is trial 219 with value: 0.8837209302325582.
[32m[I 2023-04-26 02:18:02,120][39m Trial 477 finished with value: 0.8604651162790697 and parameters: {'criterion': 'entropy', 'n_estimators': 58, 'max_features': 0.8714261089073125, 'max_depth': 60, 'min_samples_split': 5, 'min_samples_leaf': 3}. Best is trial 219 with value: 0.8837209302325582.
[32m[I 2023-04-26 02:18:02,200][39m Trial 478 finished with value: 0.8539325842696629 and parameters: {'criterion': 'entropy', 'n_estimators': 66, 'max_features': 0.8492739512171418, 'max_depth': 99, 'min_samples_split': 5, 'min_samples_leaf': 4}. Best is trial 219 with value: 0.8837209302325582.
[32m[I 2023-04-26 02:18:02,268][39m Trial 479 finished with value: 0.8470588235294119 and parameters: {'criterion': 'entropy', 'n_estimators': 55, 'max_features': 0.6943376164199835, 'max_depth': 98, 'min_samples_split': 6, 'min_samples_leaf': 4}. Best is trial 219 with value: 0.8837209302325582.
[32m[I 2023-04-26 02:18:02,363][39m Trial 480 finished with value: 0.8571428571428572 and parameters: {'criterion': 'entropy', 'n_estimators': 83, 'max_features': 0.8907281552263973, 'max_depth': 26, 'min_samples_split': 5, 'min_samples_leaf': 3}. Best is trial 219 with value: 0.8837209302325582.
[32m[I 2023-04-26 02:18:02,443][39m Trial 481 finished with value: 0.7999999999999999 and parameters: {'criterion': 'entropy', 'n_estimators': 61, 'max_features': 0.9517465268799671, 'max_depth': 40, 'min_samples_split': 4, 'min_samples_leaf': 5}. Best is trial 219 with value: 0.8837209302325582.
[32m[I 2023-04-26 02:18:02,565][39m Trial 482 finished with value: 0.8372093023255814 and parameters: {'criterion': 'entropy', 'n_estimators': 116, 'max_features': 0.826533466804663, 'max_depth': 87, 'min_samples_split': 6, 'min_samples_leaf': 4}. Best is trial 219 with value: 0.8837209302325582.
[32m[I 2023-04-26 02:18:02,717][39m Trial 483 finished with value: 0.8636363636363636 and parameters: {'criterion': 'entropy', 'n_estimators': 139, 'max_features': 0.930284976359824, 'max_depth': 37, 'min_samples_split': 5, 'min_samples_leaf': 3}. Best is trial 219 with value: 0.8837209302325582.
[32m[I 2023-04-26 02:18:02,810][39m Trial 484 finished with value: 0.8275862068965518 and parameters: {'criterion': 'gini', 'n_estimators': 91, 'max_features': 0.7257556716562255, 'max_depth': 8, 'min_samples_split': 5, 'min_samples_leaf': 3}. Best is trial 219 with value: 0.8837209302325582.
[32m[I 2023-04-26 02:18:02,928][39m Trial 485 finished with value: 0.8192771084337348 and parameters: {'criterion': 'entropy', 'n_estimators': 103, 'max_features': 0.860478671666522, 'max_depth': 94, 'min_samples_split': 6, 'min_samples_leaf': 2}. Best is trial 219 with value: 0.8837209302325582.
[32m[I 2023-04-26 02:18:03,055][39m Trial 486 finished with value: 0.8372093023255814 and parameters: {'criterion': 'entropy', 'n_estimators': 123, 'max_features': 0.8268407401399589, 'max_depth': 47, 'min_samples_split': 6, 'min_samples_leaf': 4}. Best is trial 219 with value: 0.8837209302325582.
[32m[I 2023-04-26 02:18:03,141][39m Trial 487 finished with value: 0.8705882352941177 and parameters: {'criterion': 'entropy', 'n_estimators': 72, 'max_features': 0.8539732189845236, 'max_depth': 56, 'min_samples_split': 5, 'min_samples_leaf': 3}. Best is trial 219 with value: 0.8837209302325582.
[32m[I 2023-04-26 02:18:03,216][39m Trial 488 finished with value: 0.7804878048780488 and parameters: {'criterion': 'entropy', 'n_estimators': 63, 'max_features': 0.8390978632135822, 'max_depth': 101, 'min_samples_split': 7, 'min_samples_leaf': 3}. Best is trial 219 with value: 0.8837209302325582.
[32m[I 2023-04-26 02:18:03,323][39m Trial 489 finished with value: 0.8505747126436782 and parameters: {'criterion': 'entropy', 'n_estimators': 94, 'max_features': 0.91473064808332, 'max_depth': 32, 'min_samples_split': 5, 'min_samples_leaf': 3}. Best is trial 219 with value: 0.8837209302325582.
[32m[I 2023-04-26 02:18:03,403][39m Trial 490 finished with value: 0.8275862068965518 and parameters: {'criterion': 'entropy', 'n_estimators': 67, 'max_features': 0.8707174924551859, 'max_depth': 29, 'min_samples_split': 5, 'min_samples_leaf': 3}. Best is trial 219 with value: 0.8837209302325582.
[32m[I 2023-04-26 02:18:03,485][39m Trial 491 finished with value: 0.7710843373493976 and parameters: {'criterion': 'entropy', 'n_estimators': 71, 'max_features': 0.8444348411351912, 'max_depth': 35, 'min_samples_split': 5, 'min_samples_leaf': 3}. Best is trial 219 with value: 0.8837209302325582.
[32m[I 2023-04-26 02:18:03,568][39m Trial 492 finished with value: 0.8372093023255814 and parameters: {'criterion': 'entropy', 'n_estimators': 67, 'max_features': 0.851694854526695, 'max_depth': 96, 'min_samples_split': 6, 'min_samples_leaf': 4}. Best is trial 219 with value: 0.8837209302325582.
[32m[I 2023-04-26 02:18:03,641][39m Trial 493 finished with value: 0.8275862068965518 and parameters: {'criterion': 'entropy', 'n_estimators': 62, 'max_features': 0.8289278184596862, 'max_depth': 52, 'min_samples_split': 6, 'min_samples_leaf': 4}. Best is trial 219 with value: 0.8837209302325582.
[32m[I 2023-04-26 02:18:03,718][39m Trial 494 finished with value: 0.8666666666666666 and parameters: {'criterion': 'entropy', 'n_estimators': 59, 'max_features': 0.9447923422922981, 'max_depth': 70, 'min_samples_split': 4, 'min_samples_leaf': 3}. Best is trial 219 with value: 0.8837209302325582.
[32m[I 2023-04-26 02:18:03,793][39m Trial 495 finished with value: 0.7901234567901235 and parameters: {'criterion': 'entropy', 'n_estimators': 58, 'max_features': 0.8067743919579328, 'max_depth': 38, 'min_samples_split': 3, 'min_samples_leaf': 2}. Best is trial 219 with value: 0.8837209302325582.
[32m[I 2023-04-26 02:18:03,877][39m Trial 496 finished with value: 0.8235294117647058 and parameters: {'criterion': 'entropy', 'n_estimators': 66, 'max_features': 0.9614029999064799, 'max_depth': 98, 'min_samples_split': 5, 'min_samples_leaf': 3}. Best is trial 219 with value: 0.8837209302325582.
[32m[I 2023-04-26 02:18:03,947][39m Trial 497 finished with value: 0.8048780487804877 and parameters: {'criterion': 'entropy', 'n_estimators': 54, 'max_features': 0.9472099587073234, 'max_depth': 56, 'min_samples_split': 4, 'min_samples_leaf': 3}. Best is trial 219 with value: 0.8837209302325582.
[32m[I 2023-04-26 02:18:04,021][39m Trial 498 finished with value: 0.8636363636363636 and parameters: {'criterion': 'entropy', 'n_estimators': 58, 'max_features': 0.9789751087119543, 'max_depth': 73, 'min_samples_split': 5, 'min_samples_leaf': 3}. Best is trial 219 with value: 0.8837209302325582.
[32m[I 2023-04-26 02:18:04,096][39m Trial 499 finished with value: 0.8292682926829268 and parameters: {'criterion': 'entropy', 'n_estimators': 58, 'max_features': 0.950709459826716, 'max_depth': 82, 'min_samples_split': 5, 'min_samples_leaf': 3}. Best is trial 219 with value: 0.8837209302325582.
Number of finished trials: 500