[32m[I 2023-04-26 02:17:21,077][39m Trial 73 finished with value: 0.8181818181818182 and parameters: {'criterion': 'entropy', 'n_estimators': 99, 'max_features': 0.7339839027749976, 'max_depth': 54, 'min_samples_split': 5, 'min_samples_leaf': 5}. Best is trial 51 with value: 0.8636363636363636.
[32m[I 2023-04-26 02:17:21,139][39m Trial 74 finished with value: 0.8235294117647058 and parameters: {'criterion': 'entropy', 'n_estimators': 60, 'max_features': 0.6939801322507061, 'max_depth': 30, 'min_samples_split': 4, 'min_samples_leaf': 4}. Best is trial 51 with value: 0.8636363636363636.
[32m[I 2023-04-26 02:17:21,306][39m Trial 75 finished with value: 0.8139534883720929 and parameters: {'criterion': 'entropy', 'n_estimators': 171, 'max_features': 0.905185343390114, 'max_depth': 81, 'min_samples_split': 6, 'min_samples_leaf': 3}. Best is trial 51 with value: 0.8636363636363636.
[32m[I 2023-04-26 02:17:21,415][39m Trial 76 finished with value: 0.8333333333333333 and parameters: {'criterion': 'entropy', 'n_estimators': 110, 'max_features': 0.8313447727859987, 'max_depth': 21, 'min_samples_split': 5, 'min_samples_leaf': 3}. Best is trial 51 with value: 0.8636363636363636.
[32m[I 2023-04-26 02:17:21,522][39m Trial 77 finished with value: 0.8275862068965518 and parameters: {'criterion': 'entropy', 'n_estimators': 117, 'max_features': 0.762837943913762, 'max_depth': 44, 'min_samples_split': 5, 'min_samples_leaf': 6}. Best is trial 51 with value: 0.8636363636363636.
[32m[I 2023-04-26 02:17:21,648][39m Trial 78 finished with value: 0.8372093023255814 and parameters: {'criterion': 'entropy', 'n_estimators': 129, 'max_features': 0.8531403498092679, 'max_depth': 35, 'min_samples_split': 4, 'min_samples_leaf': 4}. Best is trial 51 with value: 0.8636363636363636.
[32m[I 2023-04-26 02:17:21,761][39m Trial 79 finished with value: 0.8470588235294119 and parameters: {'criterion': 'entropy', 'n_estimators': 123, 'max_features': 0.6719340374613367, 'max_depth': 56, 'min_samples_split': 7, 'min_samples_leaf': 5}. Best is trial 51 with value: 0.8636363636363636.
[32m[I 2023-04-26 02:17:21,914][39m Trial 80 finished with value: 0.7848101265822786 and parameters: {'criterion': 'entropy', 'n_estimators': 159, 'max_features': 0.7958646422230883, 'max_depth': 95, 'min_samples_split': 6, 'min_samples_leaf': 2}. Best is trial 51 with value: 0.8636363636363636.
[32m[I 2023-04-26 02:17:22,027][39m Trial 81 finished with value: 0.8372093023255814 and parameters: {'criterion': 'entropy', 'n_estimators': 114, 'max_features': 0.8199289522538978, 'max_depth': 72, 'min_samples_split': 4, 'min_samples_leaf': 3}. Best is trial 51 with value: 0.8636363636363636.
[32m[I 2023-04-26 02:17:22,141][39m Trial 82 finished with value: 0.8275862068965518 and parameters: {'criterion': 'entropy', 'n_estimators': 123, 'max_features': 0.6420227299977976, 'max_depth': 56, 'min_samples_split': 7, 'min_samples_leaf': 5}. Best is trial 51 with value: 0.8636363636363636.
[32m[I 2023-04-26 02:17:22,240][39m Trial 83 finished with value: 0.8372093023255814 and parameters: {'criterion': 'entropy', 'n_estimators': 105, 'max_features': 0.6765952746070354, 'max_depth': 41, 'min_samples_split': 8, 'min_samples_leaf': 4}. Best is trial 51 with value: 0.8636363636363636.
[32m[I 2023-04-26 02:17:22,357][39m Trial 84 finished with value: 0.8292682926829268 and parameters: {'criterion': 'entropy', 'n_estimators': 133, 'max_features': 0.5625461078718276, 'max_depth': 50, 'min_samples_split': 7, 'min_samples_leaf': 5}. Best is trial 51 with value: 0.8636363636363636.
[32m[I 2023-04-26 02:17:22,468][39m Trial 85 finished with value: 0.8235294117647058 and parameters: {'criterion': 'entropy', 'n_estimators': 113, 'max_features': 0.8403275347587511, 'max_depth': 66, 'min_samples_split': 3, 'min_samples_leaf': 3}. Best is trial 51 with value: 0.8636363636363636.
[32m[I 2023-04-26 02:17:22,581][39m Trial 86 finished with value: 0.8095238095238095 and parameters: {'criterion': 'entropy', 'n_estimators': 120, 'max_features': 0.7540344517235688, 'max_depth': 58, 'min_samples_split': 6, 'min_samples_leaf': 4}. Best is trial 51 with value: 0.8636363636363636.
[32m[I 2023-04-26 02:17:22,663][39m Trial 87 finished with value: 0.8372093023255814 and parameters: {'criterion': 'gini', 'n_estimators': 88, 'max_features': 0.7244536361152111, 'max_depth': 47, 'min_samples_split': 7, 'min_samples_leaf': 4}. Best is trial 51 with value: 0.8636363636363636.
[32m[I 2023-04-26 02:17:22,784][39m Trial 88 finished with value: 0.7586206896551724 and parameters: {'criterion': 'entropy', 'n_estimators': 143, 'max_features': 0.5998535573161095, 'max_depth': 55, 'min_samples_split': 6, 'min_samples_leaf': 9}. Best is trial 51 with value: 0.8636363636363636.
[32m[I 2023-04-26 02:17:22,904][39m Trial 89 finished with value: 0.8045977011494252 and parameters: {'criterion': 'entropy', 'n_estimators': 128, 'max_features': 0.6927986637164922, 'max_depth': 60, 'min_samples_split': 8, 'min_samples_leaf': 5}. Best is trial 51 with value: 0.8636363636363636.
[32m[I 2023-04-26 02:17:23,002][39m Trial 90 finished with value: 0.8372093023255814 and parameters: {'criterion': 'entropy', 'n_estimators': 103, 'max_features': 0.6484404974073141, 'max_depth': 40, 'min_samples_split': 6, 'min_samples_leaf': 5}. Best is trial 51 with value: 0.8636363636363636.
[32m[I 2023-04-26 02:17:23,108][39m Trial 91 finished with value: 0.8192771084337348 and parameters: {'criterion': 'entropy', 'n_estimators': 112, 'max_features': 0.8123569642157806, 'max_depth': 70, 'min_samples_split': 4, 'min_samples_leaf': 3}. Best is trial 51 with value: 0.8636363636363636.
[32m[I 2023-04-26 02:17:23,222][39m Trial 92 finished with value: 0.8275862068965518 and parameters: {'criterion': 'entropy', 'n_estimators': 108, 'max_features': 0.7806819803713977, 'max_depth': 76, 'min_samples_split': 5, 'min_samples_leaf': 3}. Best is trial 51 with value: 0.8636363636363636.
[32m[I 2023-04-26 02:17:23,318][39m Trial 93 finished with value: 0.8139534883720929 and parameters: {'criterion': 'entropy', 'n_estimators': 93, 'max_features': 0.8788448368856163, 'max_depth': 72, 'min_samples_split': 4, 'min_samples_leaf': 4}. Best is trial 51 with value: 0.8636363636363636.
[32m[I 2023-04-26 02:17:23,441][39m Trial 94 finished with value: 0.8095238095238095 and parameters: {'criterion': 'entropy', 'n_estimators': 119, 'max_features': 0.9483315701981474, 'max_depth': 67, 'min_samples_split': 4, 'min_samples_leaf': 3}. Best is trial 51 with value: 0.8636363636363636.
[32m[I 2023-04-26 02:17:23,585][39m Trial 95 finished with value: 0.8333333333333333 and parameters: {'criterion': 'entropy', 'n_estimators': 137, 'max_features': 0.9756551338463547, 'max_depth': 63, 'min_samples_split': 3, 'min_samples_leaf': 2}. Best is trial 51 with value: 0.8636363636363636.
[32m[I 2023-04-26 02:17:23,706][39m Trial 96 finished with value: 0.7999999999999999 and parameters: {'criterion': 'entropy', 'n_estimators': 123, 'max_features': 0.9096701402436667, 'max_depth': 34, 'min_samples_split': 7, 'min_samples_leaf': 4}. Best is trial 51 with value: 0.8636363636363636.
[32m[I 2023-04-26 02:17:23,805][39m Trial 97 finished with value: 0.7951807228915663 and parameters: {'criterion': 'entropy', 'n_estimators': 101, 'max_features': 0.7418134122973119, 'max_depth': 51, 'min_samples_split': 5, 'min_samples_leaf': 3}. Best is trial 51 with value: 0.8636363636363636.
[32m[I 2023-04-26 02:17:23,883][39m Trial 98 finished with value: 0.8470588235294119 and parameters: {'criterion': 'entropy', 'n_estimators': 78, 'max_features': 0.8317185583773029, 'max_depth': 37, 'min_samples_split': 9, 'min_samples_leaf': 4}. Best is trial 51 with value: 0.8636363636363636.
[32m[I 2023-04-26 02:17:23,942][39m Trial 99 finished with value: 0.8139534883720929 and parameters: {'criterion': 'gini', 'n_estimators': 59, 'max_features': 0.707634495831368, 'max_depth': 37, 'min_samples_split': 9, 'min_samples_leaf': 5}. Best is trial 51 with value: 0.8636363636363636.
[32m[I 2023-04-26 02:17:24,014][39m Trial 100 finished with value: 0.8470588235294119 and parameters: {'criterion': 'entropy', 'n_estimators': 65, 'max_features': 0.8660683671245657, 'max_depth': 81, 'min_samples_split': 10, 'min_samples_leaf': 2}. Best is trial 51 with value: 0.8636363636363636.
[32m[I 2023-04-26 02:17:24,085][39m Trial 101 finished with value: 0.8192771084337348 and parameters: {'criterion': 'entropy', 'n_estimators': 65, 'max_features': 0.868605480189003, 'max_depth': 80, 'min_samples_split': 10, 'min_samples_leaf': 2}. Best is trial 51 with value: 0.8636363636363636.
[32m[I 2023-04-26 02:17:24,161][39m Trial 102 finished with value: 0.8139534883720929 and parameters: {'criterion': 'entropy', 'n_estimators': 68, 'max_features': 0.8315925597645139, 'max_depth': 85, 'min_samples_split': 10, 'min_samples_leaf': 2}. Best is trial 51 with value: 0.8636363636363636.
[32m[I 2023-04-26 02:17:24,225][39m Trial 103 finished with value: 0.8181818181818182 and parameters: {'criterion': 'entropy', 'n_estimators': 56, 'max_features': 0.9298168100907909, 'max_depth': 82, 'min_samples_split': 9, 'min_samples_leaf': 3}. Best is trial 51 with value: 0.8636363636363636.
[32m[I 2023-04-26 02:17:24,307][39m Trial 104 finished with value: 0.8409090909090909 and parameters: {'criterion': 'entropy', 'n_estimators': 78, 'max_features': 0.8900456808199582, 'max_depth': 76, 'min_samples_split': 10, 'min_samples_leaf': 1}. Best is trial 51 with value: 0.8636363636363636.
[32m[I 2023-04-26 02:17:24,375][39m Trial 105 finished with value: 0.8372093023255814 and parameters: {'criterion': 'entropy', 'n_estimators': 63, 'max_features': 0.781869089582792, 'max_depth': 27, 'min_samples_split': 10, 'min_samples_leaf': 4}. Best is trial 51 with value: 0.8636363636363636.
[32m[I 2023-04-26 02:17:24,437][39m Trial 106 finished with value: 0.8314606741573034 and parameters: {'criterion': 'entropy', 'n_estimators': 54, 'max_features': 0.853540600991683, 'max_depth': 32, 'min_samples_split': 11, 'min_samples_leaf': 3}. Best is trial 51 with value: 0.8636363636363636.
[32m[I 2023-04-26 02:17:24,536][39m Trial 107 finished with value: 0.8235294117647058 and parameters: {'criterion': 'entropy', 'n_estimators': 97, 'max_features': 0.8032636767860376, 'max_depth': 89, 'min_samples_split': 11, 'min_samples_leaf': 2}. Best is trial 51 with value: 0.8636363636363636.
[32m[I 2023-04-26 02:17:24,601][39m Trial 108 finished with value: 0.8333333333333333 and parameters: {'criterion': 'entropy', 'n_estimators': 73, 'max_features': 0.3483993205153865, 'max_depth': 36, 'min_samples_split': 4, 'min_samples_leaf': 4}. Best is trial 51 with value: 0.8636363636363636.
[32m[I 2023-04-26 02:17:24,674][39m Trial 109 finished with value: 0.8 and parameters: {'criterion': 'entropy', 'n_estimators': 83, 'max_features': 0.29793948956687066, 'max_depth': 40, 'min_samples_split': 9, 'min_samples_leaf': 2}. Best is trial 51 with value: 0.8636363636363636.
[32m[I 2023-04-26 02:17:24,784][39m Trial 110 finished with value: 0.8505747126436782 and parameters: {'criterion': 'entropy', 'n_estimators': 118, 'max_features': 0.7663598428239984, 'max_depth': 44, 'min_samples_split': 6, 'min_samples_leaf': 4}. Best is trial 51 with value: 0.8636363636363636.
[32m[I 2023-04-26 02:17:24,899][39m Trial 111 finished with value: 0.8192771084337348 and parameters: {'criterion': 'entropy', 'n_estimators': 122, 'max_features': 0.7577501347046718, 'max_depth': 43, 'min_samples_split': 6, 'min_samples_leaf': 3}. Best is trial 51 with value: 0.8636363636363636.
[32m[I 2023-04-26 02:17:24,958][39m Trial 112 finished with value: 0.8505747126436782 and parameters: {'criterion': 'entropy', 'n_estimators': 54, 'max_features': 0.8154956463709224, 'max_depth': 45, 'min_samples_split': 5, 'min_samples_leaf': 4}. Best is trial 51 with value: 0.8636363636363636.
[32m[I 2023-04-26 02:17:25,018][39m Trial 113 finished with value: 0.8235294117647058 and parameters: {'criterion': 'entropy', 'n_estimators': 53, 'max_features': 0.8537460506031278, 'max_depth': 45, 'min_samples_split': 5, 'min_samples_leaf': 4}. Best is trial 51 with value: 0.8636363636363636.
[32m[I 2023-04-26 02:17:25,130][39m Trial 114 finished with value: 0.8275862068965518 and parameters: {'criterion': 'entropy', 'n_estimators': 116, 'max_features': 0.8065886416624971, 'max_depth': 62, 'min_samples_split': 6, 'min_samples_leaf': 4}. Best is trial 51 with value: 0.8636363636363636.
[32m[I 2023-04-26 02:17:25,244][39m Trial 115 finished with value: 0.8372093023255814 and parameters: {'criterion': 'entropy', 'n_estimators': 111, 'max_features': 0.8857522577621368, 'max_depth': 47, 'min_samples_split': 5, 'min_samples_leaf': 3}. Best is trial 51 with value: 0.8636363636363636.
[32m[I 2023-04-26 02:17:25,289][39m Trial 116 finished with value: 0.7341772151898733 and parameters: {'criterion': 'entropy', 'n_estimators': 56, 'max_features': 0.011245349356707679, 'max_depth': 53, 'min_samples_split': 6, 'min_samples_leaf': 5}. Best is trial 51 with value: 0.8636363636363636.
[32m[I 2023-04-26 02:17:25,403][39m Trial 117 finished with value: 0.8235294117647058 and parameters: {'criterion': 'entropy', 'n_estimators': 117, 'max_features': 0.7347879845760249, 'max_depth': 49, 'min_samples_split': 7, 'min_samples_leaf': 4}. Best is trial 51 with value: 0.8636363636363636.
[32m[I 2023-04-26 02:17:25,508][39m Trial 118 finished with value: 0.8372093023255814 and parameters: {'criterion': 'entropy', 'n_estimators': 108, 'max_features': 0.8316393060495485, 'max_depth': 40, 'min_samples_split': 5, 'min_samples_leaf': 4}. Best is trial 51 with value: 0.8636363636363636.
[32m[I 2023-04-26 02:17:25,591][39m Trial 119 finished with value: 0.8095238095238095 and parameters: {'criterion': 'gini', 'n_estimators': 87, 'max_features': 0.7691936081049293, 'max_depth': 58, 'min_samples_split': 6, 'min_samples_leaf': 4}. Best is trial 51 with value: 0.8636363636363636.
[32m[I 2023-04-26 02:17:25,718][39m Trial 120 finished with value: 0.8235294117647058 and parameters: {'criterion': 'entropy', 'n_estimators': 132, 'max_features': 0.7906977479596713, 'max_depth': 52, 'min_samples_split': 7, 'min_samples_leaf': 5}. Best is trial 51 with value: 0.8636363636363636.
[32m[I 2023-04-26 02:17:25,790][39m Trial 121 finished with value: 0.8409090909090909 and parameters: {'criterion': 'entropy', 'n_estimators': 70, 'max_features': 0.8652713520651938, 'max_depth': 39, 'min_samples_split': 6, 'min_samples_leaf': 4}. Best is trial 51 with value: 0.8636363636363636.
[32m[I 2023-04-26 02:17:25,917][39m Trial 122 finished with value: 0.8372093023255814 and parameters: {'criterion': 'entropy', 'n_estimators': 127, 'max_features': 0.8151803875192186, 'max_depth': 43, 'min_samples_split': 8, 'min_samples_leaf': 4}. Best is trial 51 with value: 0.8636363636363636.
[32m[I 2023-04-26 02:17:25,977][39m Trial 123 finished with value: 0.8048780487804877 and parameters: {'criterion': 'entropy', 'n_estimators': 59, 'max_features': 0.70636346959277, 'max_depth': 30, 'min_samples_split': 5, 'min_samples_leaf': 6}. Best is trial 51 with value: 0.8636363636363636.
[32m[I 2023-04-26 02:17:26,137][39m Trial 124 finished with value: 0.8048780487804877 and parameters: {'criterion': 'entropy', 'n_estimators': 178, 'max_features': 0.6667153650153698, 'max_depth': 75, 'min_samples_split': 4, 'min_samples_leaf': 3}. Best is trial 51 with value: 0.8636363636363636.
[32m[I 2023-04-26 02:17:26,198][39m Trial 125 finished with value: 0.8139534883720929 and parameters: {'criterion': 'entropy', 'n_estimators': 51, 'max_features': 0.9148158953019409, 'max_depth': 56, 'min_samples_split': 3, 'min_samples_leaf': 3}. Best is trial 51 with value: 0.8636363636363636.
[32m[I 2023-04-26 02:17:26,266][39m Trial 126 finished with value: 0.8181818181818182 and parameters: {'criterion': 'entropy', 'n_estimators': 64, 'max_features': 0.8397840331960678, 'max_depth': 92, 'min_samples_split': 6, 'min_samples_leaf': 4}. Best is trial 51 with value: 0.8636363636363636.
[32m[I 2023-04-26 02:17:26,344][39m Trial 127 finished with value: 0.8505747126436782 and parameters: {'criterion': 'entropy', 'n_estimators': 79, 'max_features': 0.7522789458398473, 'max_depth': 45, 'min_samples_split': 5, 'min_samples_leaf': 5}. Best is trial 51 with value: 0.8636363636363636.
[32m[I 2023-04-26 02:17:26,429][39m Trial 128 finished with value: 0.8181818181818182 and parameters: {'criterion': 'entropy', 'n_estimators': 86, 'max_features': 0.7867947834542923, 'max_depth': 44, 'min_samples_split': 5, 'min_samples_leaf': 4}. Best is trial 51 with value: 0.8636363636363636.
[32m[I 2023-04-26 02:17:26,536][39m Trial 129 finished with value: 0.7999999999999999 and parameters: {'criterion': 'entropy', 'n_estimators': 114, 'max_features': 0.7440773479574779, 'max_depth': 48, 'min_samples_split': 4, 'min_samples_leaf': 6}. Best is trial 51 with value: 0.8636363636363636.
[32m[I 2023-04-26 02:17:26,619][39m Trial 130 finished with value: 0.8409090909090909 and parameters: {'criterion': 'entropy', 'n_estimators': 81, 'max_features': 0.9016036859211534, 'max_depth': 38, 'min_samples_split': 5, 'min_samples_leaf': 5}. Best is trial 51 with value: 0.8636363636363636.
[32m[I 2023-04-26 02:17:26,686][39m Trial 131 finished with value: 0.8139534883720929 and parameters: {'criterion': 'entropy', 'n_estimators': 77, 'max_features': 0.5327102657427066, 'max_depth': 65, 'min_samples_split': 6, 'min_samples_leaf': 5}. Best is trial 51 with value: 0.8636363636363636.
[32m[I 2023-04-26 02:17:26,884][39m Trial 132 finished with value: 0.8192771084337348 and parameters: {'criterion': 'entropy', 'n_estimators': 201, 'max_features': 0.8193988811763465, 'max_depth': 78, 'min_samples_split': 5, 'min_samples_leaf': 3}. Best is trial 51 with value: 0.8636363636363636.
[32m[I 2023-04-26 02:17:26,959][39m Trial 133 finished with value: 0.8192771084337348 and parameters: {'criterion': 'entropy', 'n_estimators': 68, 'max_features': 0.8446167715826715, 'max_depth': 42, 'min_samples_split': 4, 'min_samples_leaf': 3}. Best is trial 51 with value: 0.8636363636363636.
[32m[I 2023-04-26 02:17:27,078][39m Trial 134 finished with value: 0.8181818181818182 and parameters: {'criterion': 'entropy', 'n_estimators': 124, 'max_features': 0.7705105552054328, 'max_depth': 46, 'min_samples_split': 6, 'min_samples_leaf': 5}. Best is trial 51 with value: 0.8636363636363636.
[32m[I 2023-04-26 02:17:27,192][39m Trial 135 finished with value: 0.8333333333333333 and parameters: {'criterion': 'entropy', 'n_estimators': 119, 'max_features': 0.7194320226870847, 'max_depth': 70, 'min_samples_split': 4, 'min_samples_leaf': 3}. Best is trial 51 with value: 0.8636363636363636.
[32m[I 2023-04-26 02:17:27,283][39m Trial 136 finished with value: 0.8095238095238095 and parameters: {'criterion': 'entropy', 'n_estimators': 94, 'max_features': 0.6837004106022141, 'max_depth': 59, 'min_samples_split': 7, 'min_samples_leaf': 4}. Best is trial 51 with value: 0.8636363636363636.
[32m[I 2023-04-26 02:17:27,383][39m Trial 137 finished with value: 0.8666666666666666 and parameters: {'criterion': 'entropy', 'n_estimators': 103, 'max_features': 0.7567000504017116, 'max_depth': 34, 'min_samples_split': 5, 'min_samples_leaf': 4}. Best is trial 137 with value: 0.8666666666666666.
[32m[I 2023-04-26 02:17:27,479][39m Trial 138 finished with value: 0.8089887640449439 and parameters: {'criterion': 'entropy', 'n_estimators': 103, 'max_features': 0.7361803961458401, 'max_depth': 34, 'min_samples_split': 5, 'min_samples_leaf': 7}. Best is trial 137 with value: 0.8666666666666666.
[32m[I 2023-04-26 02:17:27,565][39m Trial 139 finished with value: 0.8235294117647058 and parameters: {'criterion': 'gini', 'n_estimators': 91, 'max_features': 0.8051432130304723, 'max_depth': 72, 'min_samples_split': 5, 'min_samples_leaf': 4}. Best is trial 137 with value: 0.8666666666666666.
[32m[I 2023-04-26 02:17:27,699][39m Trial 140 finished with value: 0.8372093023255814 and parameters: {'criterion': 'entropy', 'n_estimators': 148, 'max_features': 0.6236598040089485, 'max_depth': 36, 'min_samples_split': 5, 'min_samples_leaf': 5}. Best is trial 137 with value: 0.8666666666666666.
[32m[I 2023-04-26 02:17:27,804][39m Trial 141 finished with value: 0.7692307692307694 and parameters: {'criterion': 'entropy', 'n_estimators': 107, 'max_features': 0.7559002022876867, 'max_depth': 68, 'min_samples_split': 5, 'min_samples_leaf': 3}. Best is trial 137 with value: 0.8666666666666666.
[32m[I 2023-04-26 02:17:27,887][39m Trial 142 finished with value: 0.8192771084337348 and parameters: {'criterion': 'entropy', 'n_estimators': 96, 'max_features': 0.4534743169174775, 'max_depth': 31, 'min_samples_split': 4, 'min_samples_leaf': 4}. Best is trial 137 with value: 0.8666666666666666.
[32m[I 2023-04-26 02:17:27,990][39m Trial 143 finished with value: 0.8275862068965518 and parameters: {'criterion': 'entropy', 'n_estimators': 104, 'max_features': 0.792583455394659, 'max_depth': 28, 'min_samples_split': 6, 'min_samples_leaf': 4}. Best is trial 137 with value: 0.8666666666666666.
[32m[I 2023-04-26 02:17:28,054][39m Trial 144 finished with value: 0.8181818181818182 and parameters: {'criterion': 'entropy', 'n_estimators': 56, 'max_features': 0.8699098480439518, 'max_depth': 41, 'min_samples_split': 9, 'min_samples_leaf': 4}. Best is trial 137 with value: 0.8666666666666666.
[32m[I 2023-04-26 02:17:28,162][39m Trial 145 finished with value: 0.8372093023255814 and parameters: {'criterion': 'entropy', 'n_estimators': 111, 'max_features': 0.8242725563700061, 'max_depth': 83, 'min_samples_split': 5, 'min_samples_leaf': 4}. Best is trial 137 with value: 0.8666666666666666.
