[32m[I 2023-04-26 13:23:02,981][39m Trial 140 finished with value: 0.8409090909090909 and parameters: {'objective': 'CrossEntropy', 'colsample_bylevel': 0.07314276511518884, 'depth': 8, 'boosting_type': 'Plain', 'bootstrap_type': 'MVS'}. Best is trial 125 with value: 0.8764044943820225.
[32m[I 2023-04-26 13:23:05,146][39m Trial 141 finished with value: 0.8791208791208791 and parameters: {'objective': 'CrossEntropy', 'colsample_bylevel': 0.07051980501215858, 'depth': 8, 'boosting_type': 'Plain', 'bootstrap_type': 'MVS'}. Best is trial 141 with value: 0.8791208791208791.
[32m[I 2023-04-26 13:23:07,224][39m Trial 142 finished with value: 0.8260869565217392 and parameters: {'objective': 'CrossEntropy', 'colsample_bylevel': 0.06730570165554595, 'depth': 8, 'boosting_type': 'Plain', 'bootstrap_type': 'MVS'}. Best is trial 141 with value: 0.8791208791208791.
[32m[I 2023-04-26 13:23:09,231][39m Trial 143 finished with value: 0.8571428571428571 and parameters: {'objective': 'CrossEntropy', 'colsample_bylevel': 0.07125982705622659, 'depth': 7, 'boosting_type': 'Plain', 'bootstrap_type': 'MVS'}. Best is trial 141 with value: 0.8791208791208791.
[32m[I 2023-04-26 13:23:11,262][39m Trial 144 finished with value: 0.8666666666666666 and parameters: {'objective': 'CrossEntropy', 'colsample_bylevel': 0.07133528690339984, 'depth': 7, 'boosting_type': 'Plain', 'bootstrap_type': 'MVS'}. Best is trial 141 with value: 0.8791208791208791.
[32m[I 2023-04-26 13:23:13,534][39m Trial 145 finished with value: 0.8571428571428571 and parameters: {'objective': 'CrossEntropy', 'colsample_bylevel': 0.07225140030403035, 'depth': 8, 'boosting_type': 'Plain', 'bootstrap_type': 'MVS'}. Best is trial 141 with value: 0.8791208791208791.
[32m[I 2023-04-26 13:23:15,761][39m Trial 146 finished with value: 0.8791208791208791 and parameters: {'objective': 'CrossEntropy', 'colsample_bylevel': 0.07326886250554988, 'depth': 8, 'boosting_type': 'Plain', 'bootstrap_type': 'MVS'}. Best is trial 141 with value: 0.8791208791208791.
[32m[I 2023-04-26 13:23:18,204][39m Trial 147 finished with value: 0.8571428571428571 and parameters: {'objective': 'CrossEntropy', 'colsample_bylevel': 0.07724179200021603, 'depth': 8, 'boosting_type': 'Plain', 'bootstrap_type': 'MVS'}. Best is trial 141 with value: 0.8791208791208791.
[32m[I 2023-04-26 13:23:20,119][39m Trial 148 finished with value: 0.8539325842696629 and parameters: {'objective': 'CrossEntropy', 'colsample_bylevel': 0.07464184602671106, 'depth': 6, 'boosting_type': 'Plain', 'bootstrap_type': 'MVS'}. Best is trial 141 with value: 0.8791208791208791.
[32m[I 2023-04-26 13:23:22,452][39m Trial 149 finished with value: 0.8444444444444446 and parameters: {'objective': 'CrossEntropy', 'colsample_bylevel': 0.07172157763823266, 'depth': 8, 'boosting_type': 'Plain', 'bootstrap_type': 'MVS'}. Best is trial 141 with value: 0.8791208791208791.
[32m[I 2023-04-26 13:23:24,669][39m Trial 150 finished with value: 0.8666666666666666 and parameters: {'objective': 'CrossEntropy', 'colsample_bylevel': 0.06894348018890495, 'depth': 8, 'boosting_type': 'Plain', 'bootstrap_type': 'MVS'}. Best is trial 141 with value: 0.8791208791208791.
[32m[I 2023-04-26 13:23:26,744][39m Trial 151 finished with value: 0.8695652173913043 and parameters: {'objective': 'CrossEntropy', 'colsample_bylevel': 0.06913864973245953, 'depth': 8, 'boosting_type': 'Plain', 'bootstrap_type': 'MVS'}. Best is trial 141 with value: 0.8791208791208791.
[32m[I 2023-04-26 13:23:29,389][39m Trial 152 finished with value: 0.8314606741573034 and parameters: {'objective': 'CrossEntropy', 'colsample_bylevel': 0.07461338778557053, 'depth': 9, 'boosting_type': 'Plain', 'bootstrap_type': 'MVS'}. Best is trial 141 with value: 0.8791208791208791.
[32m[I 2023-04-26 13:23:31,548][39m Trial 153 finished with value: 0.8444444444444446 and parameters: {'objective': 'CrossEntropy', 'colsample_bylevel': 0.07029899487593601, 'depth': 8, 'boosting_type': 'Plain', 'bootstrap_type': 'MVS'}. Best is trial 141 with value: 0.8791208791208791.
[32m[I 2023-04-26 13:23:33,738][39m Trial 154 finished with value: 0.8260869565217392 and parameters: {'objective': 'CrossEntropy', 'colsample_bylevel': 0.06748654167267663, 'depth': 8, 'boosting_type': 'Plain', 'bootstrap_type': 'MVS'}. Best is trial 141 with value: 0.8791208791208791.
[32m[I 2023-04-26 13:23:36,073][39m Trial 155 finished with value: 0.8791208791208791 and parameters: {'objective': 'CrossEntropy', 'colsample_bylevel': 0.0733845566863095, 'depth': 8, 'boosting_type': 'Plain', 'bootstrap_type': 'MVS'}. Best is trial 141 with value: 0.8791208791208791.
[32m[I 2023-04-26 13:23:38,517][39m Trial 156 finished with value: 0.8695652173913043 and parameters: {'objective': 'CrossEntropy', 'colsample_bylevel': 0.07340502271658392, 'depth': 9, 'boosting_type': 'Plain', 'bootstrap_type': 'MVS'}. Best is trial 141 with value: 0.8791208791208791.
[32m[I 2023-04-26 13:23:41,032][39m Trial 157 finished with value: 0.8764044943820225 and parameters: {'objective': 'CrossEntropy', 'colsample_bylevel': 0.07366378513840767, 'depth': 9, 'boosting_type': 'Plain', 'bootstrap_type': 'MVS'}. Best is trial 141 with value: 0.8791208791208791.
[32m[I 2023-04-26 13:23:43,824][39m Trial 158 finished with value: 0.8571428571428571 and parameters: {'objective': 'CrossEntropy', 'colsample_bylevel': 0.07728340168591226, 'depth': 9, 'boosting_type': 'Plain', 'bootstrap_type': 'MVS'}. Best is trial 141 with value: 0.8791208791208791.
[32m[I 2023-04-26 13:23:46,507][39m Trial 159 finished with value: 0.8444444444444446 and parameters: {'objective': 'CrossEntropy', 'colsample_bylevel': 0.07402494921230392, 'depth': 9, 'boosting_type': 'Plain', 'bootstrap_type': 'MVS'}. Best is trial 141 with value: 0.8791208791208791.
[32m[I 2023-04-26 13:23:48,921][39m Trial 160 finished with value: 0.8695652173913043 and parameters: {'objective': 'CrossEntropy', 'colsample_bylevel': 0.07337886287241517, 'depth': 9, 'boosting_type': 'Plain', 'bootstrap_type': 'MVS'}. Best is trial 141 with value: 0.8791208791208791.
[32m[I 2023-04-26 13:23:51,299][39m Trial 161 finished with value: 0.8695652173913043 and parameters: {'objective': 'CrossEntropy', 'colsample_bylevel': 0.07321533218216353, 'depth': 9, 'boosting_type': 'Plain', 'bootstrap_type': 'MVS'}. Best is trial 141 with value: 0.8791208791208791.
[32m[I 2023-04-26 13:23:53,901][39m Trial 162 finished with value: 0.8539325842696629 and parameters: {'objective': 'CrossEntropy', 'colsample_bylevel': 0.07650646374402391, 'depth': 9, 'boosting_type': 'Plain', 'bootstrap_type': 'MVS'}. Best is trial 141 with value: 0.8791208791208791.
[32m[I 2023-04-26 13:23:56,628][39m Trial 163 finished with value: 0.8666666666666666 and parameters: {'objective': 'CrossEntropy', 'colsample_bylevel': 0.07347870628659982, 'depth': 9, 'boosting_type': 'Plain', 'bootstrap_type': 'MVS'}. Best is trial 141 with value: 0.8791208791208791.
[32m[I 2023-04-26 13:23:59,277][39m Trial 164 finished with value: 0.8666666666666666 and parameters: {'objective': 'CrossEntropy', 'colsample_bylevel': 0.07374218075474939, 'depth': 9, 'boosting_type': 'Plain', 'bootstrap_type': 'MVS'}. Best is trial 141 with value: 0.8791208791208791.
[32m[I 2023-04-26 13:24:01,567][39m Trial 165 finished with value: 0.8571428571428571 and parameters: {'objective': 'CrossEntropy', 'colsample_bylevel': 0.07398205835415349, 'depth': 9, 'boosting_type': 'Plain', 'bootstrap_type': 'MVS'}. Best is trial 141 with value: 0.8791208791208791.
[32m[I 2023-04-26 13:24:04,329][39m Trial 166 finished with value: 0.8571428571428571 and parameters: {'objective': 'CrossEntropy', 'colsample_bylevel': 0.0780336886830768, 'depth': 9, 'boosting_type': 'Plain', 'bootstrap_type': 'MVS'}. Best is trial 141 with value: 0.8791208791208791.
[32m[I 2023-04-26 13:24:07,453][39m Trial 167 finished with value: 0.8695652173913043 and parameters: {'objective': 'CrossEntropy', 'colsample_bylevel': 0.0689168575727556, 'depth': 9, 'boosting_type': 'Plain', 'bootstrap_type': 'MVS'}. Best is trial 141 with value: 0.8791208791208791.
[32m[I 2023-04-26 13:24:11,347][39m Trial 168 finished with value: 0.8351648351648352 and parameters: {'objective': 'CrossEntropy', 'colsample_bylevel': 0.07562599855293371, 'depth': 9, 'boosting_type': 'Plain', 'bootstrap_type': 'Bernoulli', 'subsample': 0.21163901213895836}. Best is trial 141 with value: 0.8791208791208791.
[32m[I 2023-04-26 13:24:14,046][39m Trial 169 finished with value: 0.8444444444444446 and parameters: {'objective': 'CrossEntropy', 'colsample_bylevel': 0.0726829128959553, 'depth': 9, 'boosting_type': 'Plain', 'bootstrap_type': 'MVS'}. Best is trial 141 with value: 0.8791208791208791.
[32m[I 2023-04-26 13:24:16,037][39m Trial 170 finished with value: 0.8444444444444446 and parameters: {'objective': 'CrossEntropy', 'colsample_bylevel': 0.07590690443614609, 'depth': 10, 'boosting_type': 'Plain', 'bootstrap_type': 'MVS'}. Best is trial 141 with value: 0.8791208791208791.
[32m[I 2023-04-26 13:24:19,181][39m Trial 171 finished with value: 0.8571428571428571 and parameters: {'objective': 'CrossEntropy', 'colsample_bylevel': 0.06948183610544073, 'depth': 8, 'boosting_type': 'Plain', 'bootstrap_type': 'MVS'}. Best is trial 141 with value: 0.8791208791208791.
[32m[I 2023-04-26 13:24:23,094][39m Trial 172 finished with value: 0.8444444444444446 and parameters: {'objective': 'CrossEntropy', 'colsample_bylevel': 0.080226735852268, 'depth': 9, 'boosting_type': 'Plain', 'bootstrap_type': 'MVS'}. Best is trial 141 with value: 0.8791208791208791.
[32m[I 2023-04-26 13:24:26,389][39m Trial 173 finished with value: 0.8695652173913043 and parameters: {'objective': 'CrossEntropy', 'colsample_bylevel': 0.07333320572610408, 'depth': 9, 'boosting_type': 'Plain', 'bootstrap_type': 'MVS'}. Best is trial 141 with value: 0.8791208791208791.
[32m[I 2023-04-26 13:24:29,215][39m Trial 174 finished with value: 0.8571428571428571 and parameters: {'objective': 'CrossEntropy', 'colsample_bylevel': 0.06839277077051371, 'depth': 9, 'boosting_type': 'Plain', 'bootstrap_type': 'MVS'}. Best is trial 141 with value: 0.8791208791208791.
[32m[I 2023-04-26 13:24:32,641][39m Trial 175 finished with value: 0.8571428571428571 and parameters: {'objective': 'CrossEntropy', 'colsample_bylevel': 0.07394391833933599, 'depth': 9, 'boosting_type': 'Plain', 'bootstrap_type': 'MVS'}. Best is trial 141 with value: 0.8791208791208791.
[32m[I 2023-04-26 13:24:36,143][39m Trial 176 finished with value: 0.8666666666666666 and parameters: {'objective': 'CrossEntropy', 'colsample_bylevel': 0.07295944684826926, 'depth': 9, 'boosting_type': 'Plain', 'bootstrap_type': 'MVS'}. Best is trial 141 with value: 0.8791208791208791.
[32m[I 2023-04-26 13:24:37,979][39m Trial 177 finished with value: 0.8444444444444446 and parameters: {'objective': 'CrossEntropy', 'colsample_bylevel': 0.07835067164274483, 'depth': 10, 'boosting_type': 'Plain', 'bootstrap_type': 'MVS'}. Best is trial 141 with value: 0.8791208791208791.
[32m[I 2023-04-26 13:24:40,921][39m Trial 178 finished with value: 0.8695652173913043 and parameters: {'objective': 'CrossEntropy', 'colsample_bylevel': 0.07354797990214533, 'depth': 9, 'boosting_type': 'Plain', 'bootstrap_type': 'MVS'}. Best is trial 141 with value: 0.8791208791208791.
[32m[I 2023-04-26 13:24:43,173][39m Trial 179 finished with value: 0.8444444444444446 and parameters: {'objective': 'CrossEntropy', 'colsample_bylevel': 0.07469049894631971, 'depth': 9, 'boosting_type': 'Plain', 'bootstrap_type': 'MVS'}. Best is trial 141 with value: 0.8791208791208791.
[32m[I 2023-04-26 13:24:45,685][39m Trial 180 finished with value: 0.8539325842696629 and parameters: {'objective': 'CrossEntropy', 'colsample_bylevel': 0.07606275303529982, 'depth': 9, 'boosting_type': 'Plain', 'bootstrap_type': 'MVS'}. Best is trial 141 with value: 0.8791208791208791.
[32m[I 2023-04-26 13:24:48,306][39m Trial 181 finished with value: 0.8444444444444446 and parameters: {'objective': 'CrossEntropy', 'colsample_bylevel': 0.06972015278416671, 'depth': 9, 'boosting_type': 'Plain', 'bootstrap_type': 'MVS'}. Best is trial 141 with value: 0.8791208791208791.
[32m[I 2023-04-26 13:24:50,243][39m Trial 182 finished with value: 0.8666666666666666 and parameters: {'objective': 'CrossEntropy', 'colsample_bylevel': 0.07294761071372882, 'depth': 10, 'boosting_type': 'Plain', 'bootstrap_type': 'MVS'}. Best is trial 141 with value: 0.8791208791208791.
[32m[I 2023-04-26 13:24:52,786][39m Trial 183 finished with value: 0.8444444444444446 and parameters: {'objective': 'CrossEntropy', 'colsample_bylevel': 0.0721490422075298, 'depth': 8, 'boosting_type': 'Plain', 'bootstrap_type': 'MVS'}. Best is trial 141 with value: 0.8791208791208791.
[32m[I 2023-04-26 13:24:55,770][39m Trial 184 finished with value: 0.8666666666666666 and parameters: {'objective': 'CrossEntropy', 'colsample_bylevel': 0.07386840544894599, 'depth': 9, 'boosting_type': 'Plain', 'bootstrap_type': 'MVS'}. Best is trial 141 with value: 0.8791208791208791.
[32m[I 2023-04-26 13:24:58,343][39m Trial 185 finished with value: 0.8666666666666666 and parameters: {'objective': 'CrossEntropy', 'colsample_bylevel': 0.07100813966419134, 'depth': 9, 'boosting_type': 'Plain', 'bootstrap_type': 'MVS'}. Best is trial 141 with value: 0.8791208791208791.
[32m[I 2023-04-26 13:25:00,865][39m Trial 186 finished with value: 0.8444444444444446 and parameters: {'objective': 'CrossEntropy', 'colsample_bylevel': 0.06667575866533416, 'depth': 9, 'boosting_type': 'Plain', 'bootstrap_type': 'MVS'}. Best is trial 141 with value: 0.8791208791208791.
[32m[I 2023-04-26 13:25:03,541][39m Trial 187 finished with value: 0.8571428571428571 and parameters: {'objective': 'CrossEntropy', 'colsample_bylevel': 0.07702177156972911, 'depth': 8, 'boosting_type': 'Plain', 'bootstrap_type': 'MVS'}. Best is trial 141 with value: 0.8791208791208791.
[32m[I 2023-04-26 13:25:05,452][39m Trial 188 finished with value: 0.8571428571428571 and parameters: {'objective': 'CrossEntropy', 'colsample_bylevel': 0.07335960774989883, 'depth': 10, 'boosting_type': 'Plain', 'bootstrap_type': 'MVS'}. Best is trial 141 with value: 0.8791208791208791.
[32m[I 2023-04-26 13:25:07,918][39m Trial 189 finished with value: 0.8444444444444446 and parameters: {'objective': 'CrossEntropy', 'colsample_bylevel': 0.07036277192897143, 'depth': 8, 'boosting_type': 'Plain', 'bootstrap_type': 'MVS'}. Best is trial 141 with value: 0.8791208791208791.
[32m[I 2023-04-26 13:25:09,769][39m Trial 190 finished with value: 0.8444444444444446 and parameters: {'objective': 'CrossEntropy', 'colsample_bylevel': 0.0684529799838384, 'depth': 10, 'boosting_type': 'Plain', 'bootstrap_type': 'MVS'}. Best is trial 141 with value: 0.8791208791208791.
[32m[I 2023-04-26 13:25:12,462][39m Trial 191 finished with value: 0.8666666666666666 and parameters: {'objective': 'CrossEntropy', 'colsample_bylevel': 0.07306821304736427, 'depth': 9, 'boosting_type': 'Plain', 'bootstrap_type': 'MVS'}. Best is trial 141 with value: 0.8791208791208791.
[32m[I 2023-04-26 13:25:15,419][39m Trial 192 finished with value: 0.8444444444444446 and parameters: {'objective': 'CrossEntropy', 'colsample_bylevel': 0.07520421192649075, 'depth': 9, 'boosting_type': 'Plain', 'bootstrap_type': 'MVS'}. Best is trial 141 with value: 0.8791208791208791.
[32m[I 2023-04-26 13:25:17,291][39m Trial 193 finished with value: 0.8571428571428571 and parameters: {'objective': 'CrossEntropy', 'colsample_bylevel': 0.07338520776391119, 'depth': 10, 'boosting_type': 'Plain', 'bootstrap_type': 'MVS'}. Best is trial 141 with value: 0.8791208791208791.
[32m[I 2023-04-26 13:25:19,858][39m Trial 194 finished with value: 0.8444444444444446 and parameters: {'objective': 'CrossEntropy', 'colsample_bylevel': 0.07192031798391943, 'depth': 9, 'boosting_type': 'Plain', 'bootstrap_type': 'MVS'}. Best is trial 141 with value: 0.8791208791208791.
[32m[I 2023-04-26 13:25:22,329][39m Trial 195 finished with value: 0.8571428571428571 and parameters: {'objective': 'CrossEntropy', 'colsample_bylevel': 0.070565000170248, 'depth': 8, 'boosting_type': 'Plain', 'bootstrap_type': 'MVS'}. Best is trial 141 with value: 0.8791208791208791.
[32m[I 2023-04-26 13:25:24,839][39m Trial 196 finished with value: 0.8444444444444446 and parameters: {'objective': 'CrossEntropy', 'colsample_bylevel': 0.0754865937164691, 'depth': 9, 'boosting_type': 'Plain', 'bootstrap_type': 'Bernoulli', 'subsample': 0.7309073144474263}. Best is trial 141 with value: 0.8791208791208791.
[32m[I 2023-04-26 13:25:27,374][39m Trial 197 finished with value: 0.8571428571428571 and parameters: {'objective': 'CrossEntropy', 'colsample_bylevel': 0.06883817745611796, 'depth': 9, 'boosting_type': 'Plain', 'bootstrap_type': 'MVS'}. Best is trial 141 with value: 0.8791208791208791.
[32m[I 2023-04-26 13:25:29,660][39m Trial 198 finished with value: 0.8444444444444446 and parameters: {'objective': 'CrossEntropy', 'colsample_bylevel': 0.06637240475444636, 'depth': 9, 'boosting_type': 'Plain', 'bootstrap_type': 'MVS'}. Best is trial 141 with value: 0.8791208791208791.
[32m[I 2023-04-26 13:25:31,700][39m Trial 199 finished with value: 0.8571428571428571 and parameters: {'objective': 'CrossEntropy', 'colsample_bylevel': 0.08208637562177724, 'depth': 10, 'boosting_type': 'Plain', 'bootstrap_type': 'MVS'}. Best is trial 141 with value: 0.8791208791208791.
[32m[I 2023-04-26 13:25:34,386][39m Trial 200 finished with value: 0.8444444444444446 and parameters: {'objective': 'CrossEntropy', 'colsample_bylevel': 0.0778687556290133, 'depth': 9, 'boosting_type': 'Plain', 'bootstrap_type': 'MVS'}. Best is trial 141 with value: 0.8791208791208791.
[32m[I 2023-04-26 13:25:36,691][39m Trial 201 finished with value: 0.8695652173913043 and parameters: {'objective': 'CrossEntropy', 'colsample_bylevel': 0.06920079721084313, 'depth': 8, 'boosting_type': 'Plain', 'bootstrap_type': 'MVS'}. Best is trial 141 with value: 0.8791208791208791.
[32m[I 2023-04-26 13:25:38,971][39m Trial 202 finished with value: 0.8571428571428571 and parameters: {'objective': 'CrossEntropy', 'colsample_bylevel': 0.07166204380901804, 'depth': 8, 'boosting_type': 'Plain', 'bootstrap_type': 'MVS'}. Best is trial 141 with value: 0.8791208791208791.
[32m[I 2023-04-26 13:25:41,302][39m Trial 203 finished with value: 0.8387096774193549 and parameters: {'objective': 'CrossEntropy', 'colsample_bylevel': 0.06968547082810139, 'depth': 8, 'boosting_type': 'Plain', 'bootstrap_type': 'MVS'}. Best is trial 141 with value: 0.8791208791208791.
[32m[I 2023-04-26 13:25:44,003][39m Trial 204 finished with value: 0.8791208791208791 and parameters: {'objective': 'CrossEntropy', 'colsample_bylevel': 0.07154582706373634, 'depth': 9, 'boosting_type': 'Plain', 'bootstrap_type': 'MVS'}. Best is trial 141 with value: 0.8791208791208791.
[32m[I 2023-04-26 13:25:46,179][39m Trial 205 finished with value: 0.8260869565217392 and parameters: {'objective': 'CrossEntropy', 'colsample_bylevel': 0.06730713608952284, 'depth': 8, 'boosting_type': 'Plain', 'bootstrap_type': 'MVS'}. Best is trial 141 with value: 0.8791208791208791.
[32m[I 2023-04-26 13:25:48,662][39m Trial 206 finished with value: 0.8571428571428571 and parameters: {'objective': 'CrossEntropy', 'colsample_bylevel': 0.07443028549894143, 'depth': 9, 'boosting_type': 'Plain', 'bootstrap_type': 'MVS'}. Best is trial 141 with value: 0.8791208791208791.
[32m[I 2023-04-26 13:25:51,163][39m Trial 207 finished with value: 0.8444444444444446 and parameters: {'objective': 'CrossEntropy', 'colsample_bylevel': 0.07240446673444166, 'depth': 9, 'boosting_type': 'Plain', 'bootstrap_type': 'MVS'}. Best is trial 141 with value: 0.8791208791208791.
[32m[I 2023-04-26 13:25:53,554][39m Trial 208 finished with value: 0.8791208791208791 and parameters: {'objective': 'CrossEntropy', 'colsample_bylevel': 0.0692325846005113, 'depth': 8, 'boosting_type': 'Plain', 'bootstrap_type': 'MVS'}. Best is trial 141 with value: 0.8791208791208791.
[32m[I 2023-04-26 13:25:56,458][39m Trial 209 finished with value: 0.8695652173913043 and parameters: {'objective': 'CrossEntropy', 'colsample_bylevel': 0.07555616864511011, 'depth': 9, 'boosting_type': 'Plain', 'bootstrap_type': 'MVS'}. Best is trial 141 with value: 0.8791208791208791.
[32m[I 2023-04-26 13:25:58,367][39m Trial 210 finished with value: 0.8571428571428571 and parameters: {'objective': 'CrossEntropy', 'colsample_bylevel': 0.07651923707667242, 'depth': 10, 'boosting_type': 'Plain', 'bootstrap_type': 'MVS'}. Best is trial 141 with value: 0.8791208791208791.
[32m[I 2023-04-26 13:26:01,252][39m Trial 211 finished with value: 0.8571428571428571 and parameters: {'objective': 'CrossEntropy', 'colsample_bylevel': 0.07392439711411258, 'depth': 9, 'boosting_type': 'Plain', 'bootstrap_type': 'MVS'}. Best is trial 141 with value: 0.8791208791208791.
[32m[I 2023-04-26 13:26:04,024][39m Trial 212 finished with value: 0.8666666666666666 and parameters: {'objective': 'CrossEntropy', 'colsample_bylevel': 0.07385127909560808, 'depth': 9, 'boosting_type': 'Plain', 'bootstrap_type': 'MVS'}. Best is trial 141 with value: 0.8791208791208791.
[32m[I 2023-04-26 13:26:06,081][39m Trial 213 finished with value: 0.8571428571428571 and parameters: {'objective': 'CrossEntropy', 'colsample_bylevel': 0.06861696760768271, 'depth': 8, 'boosting_type': 'Plain', 'bootstrap_type': 'MVS'}. Best is trial 141 with value: 0.8791208791208791.
[32m[I 2023-04-26 13:26:08,638][39m Trial 214 finished with value: 0.8666666666666666 and parameters: {'objective': 'CrossEntropy', 'colsample_bylevel': 0.07052154666226272, 'depth': 9, 'boosting_type': 'Plain', 'bootstrap_type': 'MVS'}. Best is trial 141 with value: 0.8791208791208791.
