[32m[I 2023-04-26 13:29:14,279][39m Trial 290 finished with value: 0.8444444444444446 and parameters: {'objective': 'CrossEntropy', 'colsample_bylevel': 0.07788240158230683, 'depth': 9, 'boosting_type': 'Plain', 'bootstrap_type': 'MVS'}. Best is trial 141 with value: 0.8791208791208791.
[32m[I 2023-04-26 13:29:16,827][39m Trial 291 finished with value: 0.8444444444444446 and parameters: {'objective': 'CrossEntropy', 'colsample_bylevel': 0.07217684300498121, 'depth': 9, 'boosting_type': 'Plain', 'bootstrap_type': 'MVS'}. Best is trial 141 with value: 0.8791208791208791.
[32m[I 2023-04-26 13:29:18,651][39m Trial 292 finished with value: 0.8539325842696629 and parameters: {'objective': 'CrossEntropy', 'colsample_bylevel': 0.07513342057068918, 'depth': 10, 'boosting_type': 'Plain', 'bootstrap_type': 'MVS'}. Best is trial 141 with value: 0.8791208791208791.
[32m[I 2023-04-26 13:29:20,723][39m Trial 293 finished with value: 0.8571428571428571 and parameters: {'objective': 'CrossEntropy', 'colsample_bylevel': 0.0703402271625149, 'depth': 7, 'boosting_type': 'Plain', 'bootstrap_type': 'MVS'}. Best is trial 141 with value: 0.8791208791208791.
[32m[I 2023-04-26 13:29:23,692][39m Trial 294 finished with value: 0.8571428571428571 and parameters: {'objective': 'CrossEntropy', 'colsample_bylevel': 0.07892735747983201, 'depth': 9, 'boosting_type': 'Plain', 'bootstrap_type': 'MVS'}. Best is trial 141 with value: 0.8791208791208791.
[32m[I 2023-04-26 13:29:25,284][39m Trial 295 finished with value: 0.8000000000000002 and parameters: {'objective': 'CrossEntropy', 'colsample_bylevel': 0.066319770423576, 'depth': 2, 'boosting_type': 'Plain', 'bootstrap_type': 'MVS'}. Best is trial 141 with value: 0.8791208791208791.
[32m[I 2023-04-26 13:29:27,180][39m Trial 296 finished with value: 0.8571428571428571 and parameters: {'objective': 'CrossEntropy', 'colsample_bylevel': 0.06931209318840582, 'depth': 10, 'boosting_type': 'Plain', 'bootstrap_type': 'MVS'}. Best is trial 141 with value: 0.8791208791208791.
[32m[I 2023-04-26 13:29:29,734][39m Trial 297 finished with value: 0.8571428571428571 and parameters: {'objective': 'CrossEntropy', 'colsample_bylevel': 0.07085984491868812, 'depth': 8, 'boosting_type': 'Plain', 'bootstrap_type': 'MVS'}. Best is trial 141 with value: 0.8791208791208791.
[32m[I 2023-04-26 13:29:32,188][39m Trial 298 finished with value: 0.8260869565217392 and parameters: {'objective': 'CrossEntropy', 'colsample_bylevel': 0.06736520676486313, 'depth': 8, 'boosting_type': 'Plain', 'bootstrap_type': 'MVS'}. Best is trial 141 with value: 0.8791208791208791.
[32m[I 2023-04-26 13:29:34,975][39m Trial 299 finished with value: 0.8666666666666666 and parameters: {'objective': 'CrossEntropy', 'colsample_bylevel': 0.07313950201968508, 'depth': 9, 'boosting_type': 'Plain', 'bootstrap_type': 'MVS'}. Best is trial 141 with value: 0.8791208791208791.
[32m[I 2023-04-26 13:29:37,468][39m Trial 300 finished with value: 0.8539325842696629 and parameters: {'objective': 'CrossEntropy', 'colsample_bylevel': 0.07118589310610102, 'depth': 9, 'boosting_type': 'Plain', 'bootstrap_type': 'MVS'}. Best is trial 141 with value: 0.8791208791208791.
[32m[I 2023-04-26 13:29:39,602][39m Trial 301 finished with value: 0.8 and parameters: {'objective': 'CrossEntropy', 'colsample_bylevel': 0.06807455513772184, 'depth': 8, 'boosting_type': 'Plain', 'bootstrap_type': 'Bernoulli', 'subsample': 0.24780780045059392}. Best is trial 141 with value: 0.8791208791208791.
[32m[I 2023-04-26 13:29:41,779][39m Trial 302 finished with value: 0.8666666666666666 and parameters: {'objective': 'CrossEntropy', 'colsample_bylevel': 0.07145956403902338, 'depth': 7, 'boosting_type': 'Plain', 'bootstrap_type': 'MVS'}. Best is trial 141 with value: 0.8791208791208791.
[32m[I 2023-04-26 13:29:44,813][39m Trial 303 finished with value: 0.8571428571428571 and parameters: {'objective': 'CrossEntropy', 'colsample_bylevel': 0.08342483347843048, 'depth': 8, 'boosting_type': 'Plain', 'bootstrap_type': 'MVS'}. Best is trial 141 with value: 0.8791208791208791.
[32m[I 2023-04-26 13:29:46,840][39m Trial 304 finished with value: 0.8571428571428571 and parameters: {'objective': 'CrossEntropy', 'colsample_bylevel': 0.08076190682801154, 'depth': 11, 'boosting_type': 'Plain', 'bootstrap_type': 'MVS'}. Best is trial 141 with value: 0.8791208791208791.
[32m[I 2023-04-26 13:29:48,721][39m Trial 305 finished with value: 0.8444444444444446 and parameters: {'objective': 'CrossEntropy', 'colsample_bylevel': 0.07436364032681507, 'depth': 10, 'boosting_type': 'Plain', 'bootstrap_type': 'MVS'}. Best is trial 141 with value: 0.8791208791208791.
[32m[I 2023-04-26 13:29:51,590][39m Trial 306 finished with value: 0.8666666666666666 and parameters: {'objective': 'CrossEntropy', 'colsample_bylevel': 0.0729345591371505, 'depth': 9, 'boosting_type': 'Plain', 'bootstrap_type': 'MVS'}. Best is trial 141 with value: 0.8791208791208791.
[32m[I 2023-04-26 13:29:54,412][39m Trial 307 finished with value: 0.8666666666666666 and parameters: {'objective': 'CrossEntropy', 'colsample_bylevel': 0.07391651952240073, 'depth': 9, 'boosting_type': 'Plain', 'bootstrap_type': 'MVS'}. Best is trial 141 with value: 0.8791208791208791.
[32m[I 2023-04-26 13:29:56,588][39m Trial 308 finished with value: 0.8387096774193549 and parameters: {'objective': 'CrossEntropy', 'colsample_bylevel': 0.06520448700821956, 'depth': 8, 'boosting_type': 'Plain', 'bootstrap_type': 'MVS'}. Best is trial 141 with value: 0.8791208791208791.
[32m[I 2023-04-26 13:29:59,407][39m Trial 309 finished with value: 0.8505747126436782 and parameters: {'objective': 'CrossEntropy', 'colsample_bylevel': 0.0759313710809067, 'depth': 9, 'boosting_type': 'Plain', 'bootstrap_type': 'MVS'}. Best is trial 141 with value: 0.8791208791208791.
[32m[I 2023-04-26 13:30:01,942][39m Trial 310 finished with value: 0.8666666666666666 and parameters: {'objective': 'CrossEntropy', 'colsample_bylevel': 0.06888610698462475, 'depth': 8, 'boosting_type': 'Plain', 'bootstrap_type': 'MVS'}. Best is trial 141 with value: 0.8791208791208791.
[32m[I 2023-04-26 13:30:04,662][39m Trial 311 finished with value: 0.8695652173913043 and parameters: {'objective': 'CrossEntropy', 'colsample_bylevel': 0.0696572552820519, 'depth': 9, 'boosting_type': 'Plain', 'bootstrap_type': 'MVS'}. Best is trial 141 with value: 0.8791208791208791.
[32m[I 2023-04-26 13:30:06,695][39m Trial 312 finished with value: 0.8539325842696629 and parameters: {'objective': 'CrossEntropy', 'colsample_bylevel': 0.06992399953748842, 'depth': 7, 'boosting_type': 'Plain', 'bootstrap_type': 'MVS'}. Best is trial 141 with value: 0.8791208791208791.
[32m[I 2023-04-26 13:30:09,683][39m Trial 313 finished with value: 0.8666666666666666 and parameters: {'objective': 'CrossEntropy', 'colsample_bylevel': 0.07690744558103593, 'depth': 9, 'boosting_type': 'Plain', 'bootstrap_type': 'MVS'}. Best is trial 141 with value: 0.8791208791208791.
[32m[I 2023-04-26 13:30:11,761][39m Trial 314 finished with value: 0.8260869565217392 and parameters: {'objective': 'CrossEntropy', 'colsample_bylevel': 0.0662536863210012, 'depth': 8, 'boosting_type': 'Plain', 'bootstrap_type': 'MVS'}. Best is trial 141 with value: 0.8791208791208791.
[32m[I 2023-04-26 13:30:14,234][39m Trial 315 finished with value: 0.8666666666666666 and parameters: {'objective': 'CrossEntropy', 'colsample_bylevel': 0.06883938131676906, 'depth': 8, 'boosting_type': 'Plain', 'bootstrap_type': 'MVS'}. Best is trial 141 with value: 0.8791208791208791.
[32m[I 2023-04-26 13:30:16,966][39m Trial 316 finished with value: 0.8539325842696629 and parameters: {'objective': 'CrossEntropy', 'colsample_bylevel': 0.07143822968365686, 'depth': 9, 'boosting_type': 'Plain', 'bootstrap_type': 'MVS'}. Best is trial 141 with value: 0.8791208791208791.
[32m[I 2023-04-26 13:30:19,680][39m Trial 317 finished with value: 0.8444444444444446 and parameters: {'objective': 'CrossEntropy', 'colsample_bylevel': 0.07232533855524163, 'depth': 9, 'boosting_type': 'Plain', 'bootstrap_type': 'MVS'}. Best is trial 141 with value: 0.8791208791208791.
[32m[I 2023-04-26 13:30:22,029][39m Trial 318 finished with value: 0.8444444444444446 and parameters: {'objective': 'CrossEntropy', 'colsample_bylevel': 0.06767700761614084, 'depth': 8, 'boosting_type': 'Plain', 'bootstrap_type': 'MVS'}. Best is trial 141 with value: 0.8791208791208791.
[32m[I 2023-04-26 13:30:24,777][39m Trial 319 finished with value: 0.8444444444444446 and parameters: {'objective': 'CrossEntropy', 'colsample_bylevel': 0.0747088596429522, 'depth': 9, 'boosting_type': 'Plain', 'bootstrap_type': 'MVS'}. Best is trial 141 with value: 0.8791208791208791.
[32m[I 2023-04-26 13:30:27,615][39m Trial 320 finished with value: 0.8666666666666666 and parameters: {'objective': 'CrossEntropy', 'colsample_bylevel': 0.07645716208422201, 'depth': 9, 'boosting_type': 'Plain', 'bootstrap_type': 'MVS'}. Best is trial 141 with value: 0.8791208791208791.
[32m[I 2023-04-26 13:30:29,412][39m Trial 321 finished with value: 0.8571428571428571 and parameters: {'objective': 'CrossEntropy', 'colsample_bylevel': 0.06983685146665983, 'depth': 10, 'boosting_type': 'Plain', 'bootstrap_type': 'MVS'}. Best is trial 141 with value: 0.8791208791208791.
[32m[I 2023-04-26 13:30:31,792][39m Trial 322 finished with value: 0.8571428571428571 and parameters: {'objective': 'CrossEntropy', 'colsample_bylevel': 0.07154657866650632, 'depth': 8, 'boosting_type': 'Plain', 'bootstrap_type': 'MVS'}. Best is trial 141 with value: 0.8791208791208791.
[32m[I 2023-04-26 13:30:33,836][39m Trial 323 finished with value: 0.8260869565217392 and parameters: {'objective': 'CrossEntropy', 'colsample_bylevel': 0.06645603513862086, 'depth': 8, 'boosting_type': 'Plain', 'bootstrap_type': 'Bernoulli', 'subsample': 0.4928118219935569}. Best is trial 141 with value: 0.8791208791208791.
[32m[I 2023-04-26 13:30:36,666][39m Trial 324 finished with value: 0.8666666666666666 and parameters: {'objective': 'CrossEntropy', 'colsample_bylevel': 0.07347033683978986, 'depth': 9, 'boosting_type': 'Plain', 'bootstrap_type': 'MVS'}. Best is trial 141 with value: 0.8791208791208791.
[32m[I 2023-04-26 13:30:39,054][39m Trial 325 finished with value: 0.8387096774193549 and parameters: {'objective': 'CrossEntropy', 'colsample_bylevel': 0.0697517889891083, 'depth': 8, 'boosting_type': 'Plain', 'bootstrap_type': 'MVS'}. Best is trial 141 with value: 0.8791208791208791.
[32m[I 2023-04-26 13:30:42,145][39m Trial 326 finished with value: 0.8666666666666666 and parameters: {'objective': 'CrossEntropy', 'colsample_bylevel': 0.07913145177769595, 'depth': 9, 'boosting_type': 'Plain', 'bootstrap_type': 'MVS'}. Best is trial 141 with value: 0.8791208791208791.
[32m[I 2023-04-26 13:30:44,073][39m Trial 327 finished with value: 0.8791208791208791 and parameters: {'objective': 'CrossEntropy', 'colsample_bylevel': 0.07204754306697732, 'depth': 6, 'boosting_type': 'Plain', 'bootstrap_type': 'MVS'}. Best is trial 141 with value: 0.8791208791208791.
[32m[I 2023-04-26 13:30:45,846][39m Trial 328 finished with value: 0.8444444444444446 and parameters: {'objective': 'CrossEntropy', 'colsample_bylevel': 0.06786654060958211, 'depth': 6, 'boosting_type': 'Plain', 'bootstrap_type': 'MVS'}. Best is trial 141 with value: 0.8791208791208791.
[32m[I 2023-04-26 13:30:47,757][39m Trial 329 finished with value: 0.8444444444444446 and parameters: {'objective': 'CrossEntropy', 'colsample_bylevel': 0.07492563308296776, 'depth': 6, 'boosting_type': 'Plain', 'bootstrap_type': 'MVS'}. Best is trial 141 with value: 0.8791208791208791.
[32m[I 2023-04-26 13:30:49,718][39m Trial 330 finished with value: 0.8539325842696629 and parameters: {'objective': 'CrossEntropy', 'colsample_bylevel': 0.07251597550062637, 'depth': 6, 'boosting_type': 'Plain', 'bootstrap_type': 'MVS'}. Best is trial 141 with value: 0.8791208791208791.
[32m[I 2023-04-26 13:30:51,630][39m Trial 331 finished with value: 0.8172043010752689 and parameters: {'objective': 'CrossEntropy', 'colsample_bylevel': 0.07738555344079218, 'depth': 3, 'boosting_type': 'Plain', 'bootstrap_type': 'MVS'}. Best is trial 141 with value: 0.8791208791208791.
[32m[I 2023-04-26 13:30:53,455][39m Trial 332 finished with value: 0.8210526315789473 and parameters: {'objective': 'CrossEntropy', 'colsample_bylevel': 0.06118018930353873, 'depth': 6, 'boosting_type': 'Plain', 'bootstrap_type': 'MVS'}. Best is trial 141 with value: 0.8791208791208791.
[32m[I 2023-04-26 13:30:56,807][39m Trial 333 finished with value: 0.8571428571428571 and parameters: {'objective': 'CrossEntropy', 'colsample_bylevel': 0.07483188188866456, 'depth': 9, 'boosting_type': 'Plain', 'bootstrap_type': 'MVS'}. Best is trial 141 with value: 0.8791208791208791.
[32m[I 2023-04-26 13:30:58,436][39m Trial 334 finished with value: 0.8351648351648352 and parameters: {'objective': 'CrossEntropy', 'colsample_bylevel': 0.06351137398780035, 'depth': 5, 'boosting_type': 'Plain', 'bootstrap_type': 'MVS'}. Best is trial 141 with value: 0.8791208791208791.
[32m[I 2023-04-26 13:31:00,906][39m Trial 335 finished with value: 0.8444444444444446 and parameters: {'objective': 'CrossEntropy', 'colsample_bylevel': 0.07104055844528066, 'depth': 8, 'boosting_type': 'Plain', 'bootstrap_type': 'MVS'}. Best is trial 141 with value: 0.8791208791208791.
[32m[I 2023-04-26 13:31:04,971][39m Trial 336 finished with value: 0.8735632183908046 and parameters: {'objective': 'CrossEntropy', 'colsample_bylevel': 0.09966642544492674, 'depth': 9, 'boosting_type': 'Plain', 'bootstrap_type': 'MVS'}. Best is trial 141 with value: 0.8791208791208791.
[32m[I 2023-04-26 13:31:06,569][39m Trial 337 finished with value: 0.8260869565217392 and parameters: {'objective': 'CrossEntropy', 'colsample_bylevel': 0.059393187161686956, 'depth': 10, 'boosting_type': 'Plain', 'bootstrap_type': 'MVS'}. Best is trial 141 with value: 0.8791208791208791.
[32m[I 2023-04-26 13:31:10,001][39m Trial 338 finished with value: 0.8539325842696629 and parameters: {'objective': 'CrossEntropy', 'colsample_bylevel': 0.09127746367593054, 'depth': 9, 'boosting_type': 'Plain', 'bootstrap_type': 'MVS'}. Best is trial 141 with value: 0.8791208791208791.
[32m[I 2023-04-26 13:31:12,765][39m Trial 339 finished with value: 0.8571428571428571 and parameters: {'objective': 'CrossEntropy', 'colsample_bylevel': 0.07014839013115019, 'depth': 9, 'boosting_type': 'Plain', 'bootstrap_type': 'MVS'}. Best is trial 141 with value: 0.8791208791208791.
[32m[I 2023-04-26 13:31:15,422][39m Trial 340 finished with value: 0.8444444444444446 and parameters: {'objective': 'CrossEntropy', 'colsample_bylevel': 0.07233455998907654, 'depth': 9, 'boosting_type': 'Plain', 'bootstrap_type': 'MVS'}. Best is trial 141 with value: 0.8791208791208791.
[32m[I 2023-04-26 13:31:18,168][39m Trial 341 finished with value: 0.8539325842696629 and parameters: {'objective': 'CrossEntropy', 'colsample_bylevel': 0.08477547606106405, 'depth': 8, 'boosting_type': 'Plain', 'bootstrap_type': 'MVS'}. Best is trial 141 with value: 0.8791208791208791.
[32m[I 2023-04-26 13:31:21,654][39m Trial 342 finished with value: 0.888888888888889 and parameters: {'objective': 'CrossEntropy', 'colsample_bylevel': 0.09707030952398003, 'depth': 8, 'boosting_type': 'Plain', 'bootstrap_type': 'MVS'}. Best is trial 342 with value: 0.888888888888889.
[32m[I 2023-04-26 13:31:23,351][39m Trial 343 finished with value: 0.8387096774193549 and parameters: {'objective': 'CrossEntropy', 'colsample_bylevel': 0.06652261498393912, 'depth': 6, 'boosting_type': 'Plain', 'bootstrap_type': 'MVS'}. Best is trial 342 with value: 0.888888888888889.
[32m[I 2023-04-26 13:31:27,129][39m Trial 344 finished with value: 0.8636363636363636 and parameters: {'objective': 'CrossEntropy', 'colsample_bylevel': 0.09461165457437895, 'depth': 9, 'boosting_type': 'Plain', 'bootstrap_type': 'MVS'}. Best is trial 342 with value: 0.888888888888889.
[32m[I 2023-04-26 13:31:31,335][39m Trial 345 finished with value: 0.888888888888889 and parameters: {'objective': 'CrossEntropy', 'colsample_bylevel': 0.09894876279262785, 'depth': 9, 'boosting_type': 'Plain', 'bootstrap_type': 'Bernoulli', 'subsample': 0.9882515392760511}. Best is trial 342 with value: 0.888888888888889.
[32m[I 2023-04-26 13:31:33,846][39m Trial 346 finished with value: 0.8735632183908046 and parameters: {'objective': 'CrossEntropy', 'colsample_bylevel': 0.09969643448420613, 'depth': 10, 'boosting_type': 'Plain', 'bootstrap_type': 'Bernoulli', 'subsample': 0.9815215052766684}. Best is trial 342 with value: 0.888888888888889.
[32m[I 2023-04-26 13:31:36,384][39m Trial 347 finished with value: 0.8666666666666666 and parameters: {'objective': 'CrossEntropy', 'colsample_bylevel': 0.09972889419477457, 'depth': 10, 'boosting_type': 'Plain', 'bootstrap_type': 'Bernoulli', 'subsample': 0.9564032436685642}. Best is trial 342 with value: 0.888888888888889.
[32m[I 2023-04-26 13:31:38,844][39m Trial 348 finished with value: 0.8863636363636364 and parameters: {'objective': 'CrossEntropy', 'colsample_bylevel': 0.09749824664546188, 'depth': 10, 'boosting_type': 'Plain', 'bootstrap_type': 'Bernoulli', 'subsample': 0.8308719715487161}. Best is trial 342 with value: 0.888888888888889.
[32m[I 2023-04-26 13:31:41,241][39m Trial 349 finished with value: 0.8764044943820225 and parameters: {'objective': 'CrossEntropy', 'colsample_bylevel': 0.09444955141131468, 'depth': 10, 'boosting_type': 'Plain', 'bootstrap_type': 'Bernoulli', 'subsample': 0.8606150853244898}. Best is trial 342 with value: 0.888888888888889.
[32m[I 2023-04-26 13:31:43,835][39m Trial 350 finished with value: 0.8666666666666666 and parameters: {'objective': 'CrossEntropy', 'colsample_bylevel': 0.09752419057766257, 'depth': 10, 'boosting_type': 'Plain', 'bootstrap_type': 'Bernoulli', 'subsample': 0.8387373227811296}. Best is trial 342 with value: 0.888888888888889.
[32m[I 2023-04-26 13:31:46,389][39m Trial 351 finished with value: 0.8863636363636364 and parameters: {'objective': 'CrossEntropy', 'colsample_bylevel': 0.09803758977090313, 'depth': 10, 'boosting_type': 'Plain', 'bootstrap_type': 'Bernoulli', 'subsample': 0.9964901289717756}. Best is trial 342 with value: 0.888888888888889.
[32m[I 2023-04-26 13:31:48,736][39m Trial 352 finished with value: 0.8636363636363636 and parameters: {'objective': 'CrossEntropy', 'colsample_bylevel': 0.09606047961040731, 'depth': 10, 'boosting_type': 'Plain', 'bootstrap_type': 'Bernoulli', 'subsample': 0.9860034654825588}. Best is trial 342 with value: 0.888888888888889.
[32m[I 2023-04-26 13:31:51,506][39m Trial 353 finished with value: 0.8505747126436782 and parameters: {'objective': 'CrossEntropy', 'colsample_bylevel': 0.09664376501267402, 'depth': 11, 'boosting_type': 'Plain', 'bootstrap_type': 'Bernoulli', 'subsample': 0.9150751129926898}. Best is trial 342 with value: 0.888888888888889.
[32m[I 2023-04-26 13:31:54,247][39m Trial 354 finished with value: 0.8666666666666666 and parameters: {'objective': 'CrossEntropy', 'colsample_bylevel': 0.09823920901957287, 'depth': 10, 'boosting_type': 'Plain', 'bootstrap_type': 'Bernoulli', 'subsample': 0.8544337197296716}. Best is trial 342 with value: 0.888888888888889.
[32m[I 2023-04-26 13:31:56,859][39m Trial 355 finished with value: 0.8764044943820225 and parameters: {'objective': 'CrossEntropy', 'colsample_bylevel': 0.09982491556550796, 'depth': 10, 'boosting_type': 'Plain', 'bootstrap_type': 'Bernoulli', 'subsample': 0.9178888930476142}. Best is trial 342 with value: 0.888888888888889.
[32m[I 2023-04-26 13:31:59,642][39m Trial 356 finished with value: 0.8372093023255814 and parameters: {'objective': 'CrossEntropy', 'colsample_bylevel': 0.09897220178934157, 'depth': 11, 'boosting_type': 'Plain', 'bootstrap_type': 'Bernoulli', 'subsample': 0.9993836621959883}. Best is trial 342 with value: 0.888888888888889.
[32m[I 2023-04-26 13:32:02,089][39m Trial 357 finished with value: 0.8666666666666666 and parameters: {'objective': 'CrossEntropy', 'colsample_bylevel': 0.09459015411822995, 'depth': 10, 'boosting_type': 'Plain', 'bootstrap_type': 'Bernoulli', 'subsample': 0.9149647864530515}. Best is trial 342 with value: 0.888888888888889.
[32m[I 2023-04-26 13:32:04,689][39m Trial 358 finished with value: 0.8764044943820225 and parameters: {'objective': 'CrossEntropy', 'colsample_bylevel': 0.09949831128776143, 'depth': 10, 'boosting_type': 'Plain', 'bootstrap_type': 'Bernoulli', 'subsample': 0.9158682992942001}. Best is trial 342 with value: 0.888888888888889.
[32m[I 2023-04-26 13:32:07,381][39m Trial 359 finished with value: 0.8666666666666666 and parameters: {'objective': 'CrossEntropy', 'colsample_bylevel': 0.09876379986251412, 'depth': 10, 'boosting_type': 'Plain', 'bootstrap_type': 'Bernoulli', 'subsample': 0.9161397766338563}. Best is trial 342 with value: 0.888888888888889.
[32m[I 2023-04-26 13:32:09,660][39m Trial 360 finished with value: 0.8539325842696629 and parameters: {'objective': 'CrossEntropy', 'colsample_bylevel': 0.09987513590747084, 'depth': 10, 'boosting_type': 'Plain', 'bootstrap_type': 'Bernoulli', 'subsample': 0.7900923551117074}. Best is trial 342 with value: 0.888888888888889.
[32m[I 2023-04-26 13:32:12,015][39m Trial 361 finished with value: 0.8666666666666666 and parameters: {'objective': 'CrossEntropy', 'colsample_bylevel': 0.09552848048520175, 'depth': 10, 'boosting_type': 'Plain', 'bootstrap_type': 'Bernoulli', 'subsample': 0.9283261941392914}. Best is trial 342 with value: 0.888888888888889.
[32m[I 2023-04-26 13:32:14,292][39m Trial 362 finished with value: 0.8539325842696629 and parameters: {'objective': 'CrossEntropy', 'colsample_bylevel': 0.09286807375559372, 'depth': 11, 'boosting_type': 'Plain', 'bootstrap_type': 'Bernoulli', 'subsample': 0.8570439262175665}. Best is trial 342 with value: 0.888888888888889.
