[32m[I 2023-04-26 13:37:57,237][39m Trial 496 finished with value: 0.8863636363636364 and parameters: {'objective': 'CrossEntropy', 'colsample_bylevel': 0.09521275838809437, 'depth': 11, 'boosting_type': 'Plain', 'bootstrap_type': 'Bernoulli', 'subsample': 0.7758332597486717}. Best is trial 342 with value: 0.888888888888889.
[32m[I 2023-04-26 13:37:59,868][39m Trial 497 finished with value: 0.8764044943820225 and parameters: {'objective': 'CrossEntropy', 'colsample_bylevel': 0.0910937760998358, 'depth': 12, 'boosting_type': 'Plain', 'bootstrap_type': 'Bernoulli', 'subsample': 0.7946865329700769}. Best is trial 342 with value: 0.888888888888889.
[32m[I 2023-04-26 13:38:05,027][39m Trial 498 finished with value: 0.8351648351648352 and parameters: {'objective': 'CrossEntropy', 'colsample_bylevel': 0.0928088778564766, 'depth': 11, 'boosting_type': 'Ordered', 'bootstrap_type': 'Bernoulli', 'subsample': 0.7778735715119519}. Best is trial 342 with value: 0.888888888888889.
[32m[I 2023-04-26 13:38:07,577][39m Trial 499 finished with value: 0.8539325842696629 and parameters: {'objective': 'Logloss', 'colsample_bylevel': 0.09975782422422978, 'depth': 10, 'boosting_type': 'Plain', 'bootstrap_type': 'Bernoulli', 'subsample': 0.672699490863835}. Best is trial 342 with value: 0.888888888888889.
Number of finished trials: 500