[32m[I 2023-04-26 13:35:07,575][39m Trial 429 finished with value: 0.8539325842696629 and parameters: {'objective': 'CrossEntropy', 'colsample_bylevel': 0.09316207196793651, 'depth': 11, 'boosting_type': 'Plain', 'bootstrap_type': 'Bernoulli', 'subsample': 0.8087267299243182}. Best is trial 342 with value: 0.888888888888889.
[32m[I 2023-04-26 13:35:10,144][39m Trial 430 finished with value: 0.8666666666666666 and parameters: {'objective': 'CrossEntropy', 'colsample_bylevel': 0.09064040736061404, 'depth': 12, 'boosting_type': 'Plain', 'bootstrap_type': 'Bernoulli', 'subsample': 0.7786377723818086}. Best is trial 342 with value: 0.888888888888889.
[32m[I 2023-04-26 13:35:12,566][39m Trial 431 finished with value: 0.8666666666666666 and parameters: {'objective': 'CrossEntropy', 'colsample_bylevel': 0.09879199674986, 'depth': 10, 'boosting_type': 'Plain', 'bootstrap_type': 'Bernoulli', 'subsample': 0.6068024602399055}. Best is trial 342 with value: 0.888888888888889.
[32m[I 2023-04-26 13:35:15,277][39m Trial 432 finished with value: 0.8666666666666666 and parameters: {'objective': 'CrossEntropy', 'colsample_bylevel': 0.09846171231939406, 'depth': 10, 'boosting_type': 'Plain', 'bootstrap_type': 'Bernoulli', 'subsample': 0.9298107286143552}. Best is trial 342 with value: 0.888888888888889.
[32m[I 2023-04-26 13:35:17,586][39m Trial 433 finished with value: 0.8539325842696629 and parameters: {'objective': 'Logloss', 'colsample_bylevel': 0.08720193309429819, 'depth': 11, 'boosting_type': 'Plain', 'bootstrap_type': 'Bernoulli', 'subsample': 0.7462785524010868}. Best is trial 342 with value: 0.888888888888889.
[32m[I 2023-04-26 13:35:19,956][39m Trial 434 finished with value: 0.8444444444444446 and parameters: {'objective': 'Logloss', 'colsample_bylevel': 0.09280818832847086, 'depth': 12, 'boosting_type': 'Plain', 'bootstrap_type': 'Bernoulli', 'subsample': 0.7531340228628509}. Best is trial 342 with value: 0.888888888888889.
[32m[I 2023-04-26 13:35:22,290][39m Trial 435 finished with value: 0.8666666666666666 and parameters: {'objective': 'CrossEntropy', 'colsample_bylevel': 0.09472884559553289, 'depth': 10, 'boosting_type': 'Plain', 'bootstrap_type': 'Bernoulli', 'subsample': 0.6930508254868175}. Best is trial 342 with value: 0.888888888888889.
[32m[I 2023-04-26 13:35:24,941][39m Trial 436 finished with value: 0.8666666666666666 and parameters: {'objective': 'CrossEntropy', 'colsample_bylevel': 0.09986187997052715, 'depth': 10, 'boosting_type': 'Plain', 'bootstrap_type': 'Bernoulli', 'subsample': 0.6659442211443831}. Best is trial 342 with value: 0.888888888888889.
[32m[I 2023-04-26 13:35:27,394][39m Trial 437 finished with value: 0.8539325842696629 and parameters: {'objective': 'Logloss', 'colsample_bylevel': 0.09349166706356662, 'depth': 12, 'boosting_type': 'Plain', 'bootstrap_type': 'Bernoulli', 'subsample': 0.8548552673412537}. Best is trial 342 with value: 0.888888888888889.
[32m[I 2023-04-26 13:35:30,008][39m Trial 438 finished with value: 0.8571428571428571 and parameters: {'objective': 'Logloss', 'colsample_bylevel': 0.09610710189998214, 'depth': 12, 'boosting_type': 'Plain', 'bootstrap_type': 'Bernoulli', 'subsample': 0.9683058766296004}. Best is trial 342 with value: 0.888888888888889.
[32m[I 2023-04-26 13:35:32,443][39m Trial 439 finished with value: 0.8666666666666666 and parameters: {'objective': 'CrossEntropy', 'colsample_bylevel': 0.09180690390411597, 'depth': 11, 'boosting_type': 'Plain', 'bootstrap_type': 'Bernoulli', 'subsample': 0.7348818547215064}. Best is trial 342 with value: 0.888888888888889.
[32m[I 2023-04-26 13:35:35,000][39m Trial 440 finished with value: 0.8666666666666666 and parameters: {'objective': 'CrossEntropy', 'colsample_bylevel': 0.09621869376597443, 'depth': 11, 'boosting_type': 'Plain', 'bootstrap_type': 'Bernoulli', 'subsample': 0.7111056980255502}. Best is trial 342 with value: 0.888888888888889.
[32m[I 2023-04-26 13:35:37,486][39m Trial 441 finished with value: 0.8539325842696629 and parameters: {'objective': 'Logloss', 'colsample_bylevel': 0.09340207348344123, 'depth': 11, 'boosting_type': 'Plain', 'bootstrap_type': 'Bernoulli', 'subsample': 0.7623653753110295}. Best is trial 342 with value: 0.888888888888889.
[32m[I 2023-04-26 13:35:40,279][39m Trial 442 finished with value: 0.8505747126436782 and parameters: {'objective': 'CrossEntropy', 'colsample_bylevel': 0.09819807000362415, 'depth': 11, 'boosting_type': 'Plain', 'bootstrap_type': 'Bernoulli', 'subsample': 0.6367032917890822}. Best is trial 342 with value: 0.888888888888889.
[32m[I 2023-04-26 13:35:42,756][39m Trial 443 finished with value: 0.8666666666666666 and parameters: {'objective': 'Logloss', 'colsample_bylevel': 0.08953583849893088, 'depth': 12, 'boosting_type': 'Plain', 'bootstrap_type': 'Bernoulli', 'subsample': 0.7899261741852003}. Best is trial 342 with value: 0.888888888888889.
[32m[I 2023-04-26 13:35:45,334][39m Trial 444 finished with value: 0.8636363636363636 and parameters: {'objective': 'CrossEntropy', 'colsample_bylevel': 0.09664155113758713, 'depth': 11, 'boosting_type': 'Plain', 'bootstrap_type': 'Bernoulli', 'subsample': 0.9002258885352268}. Best is trial 342 with value: 0.888888888888889.
[32m[I 2023-04-26 13:35:47,843][39m Trial 445 finished with value: 0.8571428571428571 and parameters: {'objective': 'Logloss', 'colsample_bylevel': 0.09456800902348794, 'depth': 11, 'boosting_type': 'Plain', 'bootstrap_type': 'Bernoulli', 'subsample': 0.8096857883409002}. Best is trial 342 with value: 0.888888888888889.
[32m[I 2023-04-26 13:35:50,504][39m Trial 446 finished with value: 0.8636363636363636 and parameters: {'objective': 'CrossEntropy', 'colsample_bylevel': 0.0955084025094948, 'depth': 11, 'boosting_type': 'Plain', 'bootstrap_type': 'Bernoulli', 'subsample': 0.7362268864102848}. Best is trial 342 with value: 0.888888888888889.
[32m[I 2023-04-26 13:35:52,851][39m Trial 447 finished with value: 0.8764044943820225 and parameters: {'objective': 'CrossEntropy', 'colsample_bylevel': 0.09129128174306245, 'depth': 11, 'boosting_type': 'Plain', 'bootstrap_type': 'Bernoulli', 'subsample': 0.7720425989879106}. Best is trial 342 with value: 0.888888888888889.
[32m[I 2023-04-26 13:35:55,454][39m Trial 448 finished with value: 0.8863636363636364 and parameters: {'objective': 'CrossEntropy', 'colsample_bylevel': 0.09993072712735716, 'depth': 10, 'boosting_type': 'Plain', 'bootstrap_type': 'Bernoulli', 'subsample': 0.7106282796329189}. Best is trial 342 with value: 0.888888888888889.
[32m[I 2023-04-26 13:35:58,231][39m Trial 449 finished with value: 0.8539325842696629 and parameters: {'objective': 'CrossEntropy', 'colsample_bylevel': 0.09746185917559805, 'depth': 12, 'boosting_type': 'Plain', 'bootstrap_type': 'Bernoulli', 'subsample': 0.7270074955205819}. Best is trial 342 with value: 0.888888888888889.
[32m[I 2023-04-26 13:36:00,734][39m Trial 450 finished with value: 0.8666666666666666 and parameters: {'objective': 'Logloss', 'colsample_bylevel': 0.09866769618841063, 'depth': 10, 'boosting_type': 'Plain', 'bootstrap_type': 'Bernoulli', 'subsample': 0.6727429944851205}. Best is trial 342 with value: 0.888888888888889.
[32m[I 2023-04-26 13:36:03,380][39m Trial 451 finished with value: 0.8666666666666666 and parameters: {'objective': 'CrossEntropy', 'colsample_bylevel': 0.0921399915992693, 'depth': 12, 'boosting_type': 'Plain', 'bootstrap_type': 'Bernoulli', 'subsample': 0.7069245224549601}. Best is trial 342 with value: 0.888888888888889.
[32m[I 2023-04-26 13:36:06,110][39m Trial 452 finished with value: 0.8666666666666666 and parameters: {'objective': 'CrossEntropy', 'colsample_bylevel': 0.09987364772235581, 'depth': 12, 'boosting_type': 'Plain', 'bootstrap_type': 'Bernoulli', 'subsample': 0.3985529409313538}. Best is trial 342 with value: 0.888888888888889.
[32m[I 2023-04-26 13:36:08,733][39m Trial 453 finished with value: 0.8539325842696629 and parameters: {'objective': 'CrossEntropy', 'colsample_bylevel': 0.0969826566829066, 'depth': 11, 'boosting_type': 'Plain', 'bootstrap_type': 'Bernoulli', 'subsample': 0.7858684508975955}. Best is trial 342 with value: 0.888888888888889.
[32m[I 2023-04-26 13:36:10,974][39m Trial 454 finished with value: 0.8444444444444446 and parameters: {'objective': 'CrossEntropy', 'colsample_bylevel': 0.08623332357073063, 'depth': 11, 'boosting_type': 'Plain', 'bootstrap_type': 'Bernoulli', 'subsample': 0.9758338641300968}. Best is trial 342 with value: 0.888888888888889.
[32m[I 2023-04-26 13:36:13,561][39m Trial 455 finished with value: 0.8863636363636364 and parameters: {'objective': 'CrossEntropy', 'colsample_bylevel': 0.09935969096410202, 'depth': 10, 'boosting_type': 'Plain', 'bootstrap_type': 'Bernoulli', 'subsample': 0.5887358654758126}. Best is trial 342 with value: 0.888888888888889.
[32m[I 2023-04-26 13:36:16,105][39m Trial 456 finished with value: 0.8539325842696629 and parameters: {'objective': 'CrossEntropy', 'colsample_bylevel': 0.09867577768190754, 'depth': 10, 'boosting_type': 'Plain', 'bootstrap_type': 'Bernoulli', 'subsample': 0.6118143659499492}. Best is trial 342 with value: 0.888888888888889.
[32m[I 2023-04-26 13:36:18,602][39m Trial 457 finished with value: 0.8666666666666666 and parameters: {'objective': 'CrossEntropy', 'colsample_bylevel': 0.09548728662652144, 'depth': 11, 'boosting_type': 'Plain', 'bootstrap_type': 'Bernoulli', 'subsample': 0.6844542875786492}. Best is trial 342 with value: 0.888888888888889.
[32m[I 2023-04-26 13:36:20,974][39m Trial 458 finished with value: 0.8666666666666666 and parameters: {'objective': 'CrossEntropy', 'colsample_bylevel': 0.0884631831821749, 'depth': 11, 'boosting_type': 'Plain', 'bootstrap_type': 'Bernoulli', 'subsample': 0.8382841439238322}. Best is trial 342 with value: 0.888888888888889.
[32m[I 2023-04-26 13:36:23,123][39m Trial 459 finished with value: 0.8181818181818182 and parameters: {'objective': 'CrossEntropy', 'colsample_bylevel': 0.09157599399891654, 'depth': 5, 'boosting_type': 'Plain', 'bootstrap_type': 'Bernoulli', 'subsample': 0.7632511459955884}. Best is trial 342 with value: 0.888888888888889.
[32m[I 2023-04-26 13:36:25,770][39m Trial 460 finished with value: 0.8505747126436782 and parameters: {'objective': 'CrossEntropy', 'colsample_bylevel': 0.0979110856779476, 'depth': 10, 'boosting_type': 'Plain', 'bootstrap_type': 'Bernoulli', 'subsample': 0.1302809646977957}. Best is trial 342 with value: 0.888888888888889.
[32m[I 2023-04-26 13:36:28,302][39m Trial 461 finished with value: 0.8539325842696629 and parameters: {'objective': 'CrossEntropy', 'colsample_bylevel': 0.09586193995750499, 'depth': 11, 'boosting_type': 'Plain', 'bootstrap_type': 'Bernoulli', 'subsample': 0.7167237317866462}. Best is trial 342 with value: 0.888888888888889.
[32m[I 2023-04-26 13:36:30,833][39m Trial 462 finished with value: 0.8666666666666666 and parameters: {'objective': 'CrossEntropy', 'colsample_bylevel': 0.09811553778637563, 'depth': 11, 'boosting_type': 'Plain', 'bootstrap_type': 'Bernoulli', 'subsample': 0.5802606814297614}. Best is trial 342 with value: 0.888888888888889.
[32m[I 2023-04-26 13:36:33,535][39m Trial 463 finished with value: 0.8571428571428571 and parameters: {'objective': 'CrossEntropy', 'colsample_bylevel': 0.09489035690712556, 'depth': 12, 'boosting_type': 'Plain', 'bootstrap_type': 'Bernoulli', 'subsample': 0.8021468606812714}. Best is trial 342 with value: 0.888888888888889.
[32m[I 2023-04-26 13:36:35,004][39m Trial 464 finished with value: 0.8210526315789473 and parameters: {'objective': 'Logloss', 'colsample_bylevel': 0.02826793333014854, 'depth': 11, 'boosting_type': 'Plain', 'bootstrap_type': 'Bernoulli', 'subsample': 0.7519775636242807}. Best is trial 342 with value: 0.888888888888889.
[32m[I 2023-04-26 13:36:36,488][39m Trial 465 finished with value: 0.8247422680412371 and parameters: {'objective': 'CrossEntropy', 'colsample_bylevel': 0.038007699002262245, 'depth': 10, 'boosting_type': 'Plain', 'bootstrap_type': 'Bernoulli', 'subsample': 0.8271565468309591}. Best is trial 342 with value: 0.888888888888889.
[32m[I 2023-04-26 13:36:39,075][39m Trial 466 finished with value: 0.8666666666666666 and parameters: {'objective': 'CrossEntropy', 'colsample_bylevel': 0.09849520919641501, 'depth': 10, 'boosting_type': 'Plain', 'bootstrap_type': 'Bernoulli', 'subsample': 0.5478185123820768}. Best is trial 342 with value: 0.888888888888889.
[32m[I 2023-04-26 13:36:41,937][39m Trial 467 finished with value: 0.8666666666666666 and parameters: {'objective': 'CrossEntropy', 'colsample_bylevel': 0.09674861472071682, 'depth': 10, 'boosting_type': 'Plain', 'bootstrap_type': 'Bernoulli', 'subsample': 0.6456121120260976}. Best is trial 342 with value: 0.888888888888889.
[32m[I 2023-04-26 13:36:44,700][39m Trial 468 finished with value: 0.8764044943820225 and parameters: {'objective': 'CrossEntropy', 'colsample_bylevel': 0.09641057269970893, 'depth': 12, 'boosting_type': 'Plain', 'bootstrap_type': 'Bernoulli', 'subsample': 0.7000284371610106}. Best is trial 342 with value: 0.888888888888889.
[32m[I 2023-04-26 13:36:47,126][39m Trial 469 finished with value: 0.8666666666666666 and parameters: {'objective': 'CrossEntropy', 'colsample_bylevel': 0.09795211097361084, 'depth': 6, 'boosting_type': 'Plain', 'bootstrap_type': 'Bernoulli', 'subsample': 0.9334504144802921}. Best is trial 342 with value: 0.888888888888889.
[32m[I 2023-04-26 13:36:49,859][39m Trial 470 finished with value: 0.8764044943820225 and parameters: {'objective': 'CrossEntropy', 'colsample_bylevel': 0.09296352665895055, 'depth': 12, 'boosting_type': 'Plain', 'bootstrap_type': 'Bernoulli', 'subsample': 0.7459161670648928}. Best is trial 342 with value: 0.888888888888889.
[32m[I 2023-04-26 13:36:52,338][39m Trial 471 finished with value: 0.8666666666666666 and parameters: {'objective': 'CrossEntropy', 'colsample_bylevel': 0.0943952214236832, 'depth': 11, 'boosting_type': 'Plain', 'bootstrap_type': 'Bernoulli', 'subsample': 0.7275255419086445}. Best is trial 342 with value: 0.888888888888889.
[32m[I 2023-04-26 13:36:55,004][39m Trial 472 finished with value: 0.8764044943820225 and parameters: {'objective': 'CrossEntropy', 'colsample_bylevel': 0.09669493106690018, 'depth': 11, 'boosting_type': 'Plain', 'bootstrap_type': 'Bernoulli', 'subsample': 0.6203691514355302}. Best is trial 342 with value: 0.888888888888889.
[32m[I 2023-04-26 13:36:57,594][39m Trial 473 finished with value: 0.8666666666666666 and parameters: {'objective': 'CrossEntropy', 'colsample_bylevel': 0.09961957823926348, 'depth': 11, 'boosting_type': 'Plain', 'bootstrap_type': 'Bernoulli', 'subsample': 0.7698229189790058}. Best is trial 342 with value: 0.888888888888889.
[32m[I 2023-04-26 13:37:00,241][39m Trial 474 finished with value: 0.8764044943820225 and parameters: {'objective': 'CrossEntropy', 'colsample_bylevel': 0.09844152110523509, 'depth': 10, 'boosting_type': 'Plain', 'bootstrap_type': 'Bernoulli', 'subsample': 0.6894946864244109}. Best is trial 342 with value: 0.888888888888889.
[32m[I 2023-04-26 13:37:02,525][39m Trial 475 finished with value: 0.8666666666666666 and parameters: {'objective': 'CrossEntropy', 'colsample_bylevel': 0.08916937483659054, 'depth': 11, 'boosting_type': 'Plain', 'bootstrap_type': 'Bernoulli', 'subsample': 0.7827012456551168}. Best is trial 342 with value: 0.888888888888889.
[32m[I 2023-04-26 13:37:04,886][39m Trial 476 finished with value: 0.8444444444444446 and parameters: {'objective': 'Logloss', 'colsample_bylevel': 0.09047664126954069, 'depth': 11, 'boosting_type': 'Plain', 'bootstrap_type': 'Bernoulli', 'subsample': 0.7614089873466269}. Best is trial 342 with value: 0.888888888888889.
[32m[I 2023-04-26 13:37:07,418][39m Trial 477 finished with value: 0.8333333333333333 and parameters: {'objective': 'CrossEntropy', 'colsample_bylevel': 0.09967579831807756, 'depth': 10, 'boosting_type': 'Plain', 'bootstrap_type': 'Bernoulli', 'subsample': 0.9988623458751921}. Best is trial 342 with value: 0.888888888888889.
[32m[I 2023-04-26 13:37:09,868][39m Trial 478 finished with value: 0.8764044943820225 and parameters: {'objective': 'CrossEntropy', 'colsample_bylevel': 0.09532890670383633, 'depth': 10, 'boosting_type': 'Plain', 'bootstrap_type': 'Bernoulli', 'subsample': 0.8714695230034366}. Best is trial 342 with value: 0.888888888888889.
[32m[I 2023-04-26 13:37:13,886][39m Trial 479 finished with value: 0.8351648351648352 and parameters: {'objective': 'CrossEntropy', 'colsample_bylevel': 0.09387303162789933, 'depth': 11, 'boosting_type': 'Ordered', 'bootstrap_type': 'Bernoulli', 'subsample': 0.8746119112914497}. Best is trial 342 with value: 0.888888888888889.
[32m[I 2023-04-26 13:37:16,522][39m Trial 480 finished with value: 0.8863636363636364 and parameters: {'objective': 'CrossEntropy', 'colsample_bylevel': 0.0956558531990733, 'depth': 12, 'boosting_type': 'Plain', 'bootstrap_type': 'Bernoulli', 'subsample': 0.8140477092562759}. Best is trial 342 with value: 0.888888888888889.
[32m[I 2023-04-26 13:37:18,982][39m Trial 481 finished with value: 0.8666666666666666 and parameters: {'objective': 'CrossEntropy', 'colsample_bylevel': 0.09201635451287332, 'depth': 12, 'boosting_type': 'Plain', 'bootstrap_type': 'Bernoulli', 'subsample': 0.8030226166792972}. Best is trial 342 with value: 0.888888888888889.
[32m[I 2023-04-26 13:37:21,089][39m Trial 482 finished with value: 0.8314606741573034 and parameters: {'objective': 'CrossEntropy', 'colsample_bylevel': 0.09612442515227858, 'depth': 4, 'boosting_type': 'Plain', 'bootstrap_type': 'Bernoulli', 'subsample': 0.4690968261881281}. Best is trial 342 with value: 0.888888888888889.
[32m[I 2023-04-26 13:37:23,639][39m Trial 483 finished with value: 0.8764044943820225 and parameters: {'objective': 'CrossEntropy', 'colsample_bylevel': 0.09978671433162349, 'depth': 10, 'boosting_type': 'Plain', 'bootstrap_type': 'Bernoulli', 'subsample': 0.6798486133138492}. Best is trial 342 with value: 0.888888888888889.
[32m[I 2023-04-26 13:37:26,153][39m Trial 484 finished with value: 0.8764044943820225 and parameters: {'objective': 'CrossEntropy', 'colsample_bylevel': 0.09407584507051159, 'depth': 12, 'boosting_type': 'Plain', 'bootstrap_type': 'Bernoulli', 'subsample': 0.8191487077586482}. Best is trial 342 with value: 0.888888888888889.
[32m[I 2023-04-26 13:37:28,553][39m Trial 485 finished with value: 0.8666666666666666 and parameters: {'objective': 'CrossEntropy', 'colsample_bylevel': 0.09332377152900545, 'depth': 12, 'boosting_type': 'Plain', 'bootstrap_type': 'Bernoulli', 'subsample': 0.8427087487061481}. Best is trial 342 with value: 0.888888888888889.
[32m[I 2023-04-26 13:37:31,107][39m Trial 486 finished with value: 0.8409090909090909 and parameters: {'objective': 'CrossEntropy', 'colsample_bylevel': 0.09867640677081843, 'depth': 10, 'boosting_type': 'Plain', 'bootstrap_type': 'Bayesian', 'bagging_temperature': 9.960755426956268}. Best is trial 342 with value: 0.888888888888889.
[32m[I 2023-04-26 13:37:33,604][39m Trial 487 finished with value: 0.8764044943820225 and parameters: {'objective': 'CrossEntropy', 'colsample_bylevel': 0.09705114851986851, 'depth': 10, 'boosting_type': 'Plain', 'bootstrap_type': 'Bernoulli', 'subsample': 0.6403288515550942}. Best is trial 342 with value: 0.888888888888889.
[32m[I 2023-04-26 13:37:36,172][39m Trial 488 finished with value: 0.8764044943820225 and parameters: {'objective': 'CrossEntropy', 'colsample_bylevel': 0.09832599605061937, 'depth': 10, 'boosting_type': 'Plain', 'bootstrap_type': 'Bernoulli', 'subsample': 0.702426476493206}. Best is trial 342 with value: 0.888888888888889.
[32m[I 2023-04-26 13:37:38,611][39m Trial 489 finished with value: 0.8539325842696629 and parameters: {'objective': 'Logloss', 'colsample_bylevel': 0.0945573388362434, 'depth': 12, 'boosting_type': 'Plain', 'bootstrap_type': 'Bernoulli', 'subsample': 0.7352245973031872}. Best is trial 342 with value: 0.888888888888889.
[32m[I 2023-04-26 13:37:41,150][39m Trial 490 finished with value: 0.8636363636363636 and parameters: {'objective': 'CrossEntropy', 'colsample_bylevel': 0.09694683782307051, 'depth': 10, 'boosting_type': 'Plain', 'bootstrap_type': 'Bernoulli', 'subsample': 0.5931525036280122}. Best is trial 342 with value: 0.888888888888889.
[32m[I 2023-04-26 13:37:44,066][39m Trial 491 finished with value: 0.8764044943820225 and parameters: {'objective': 'CrossEntropy', 'colsample_bylevel': 0.09982911286722607, 'depth': 12, 'boosting_type': 'Plain', 'bootstrap_type': 'Bernoulli', 'subsample': 0.7242621697735931}. Best is trial 342 with value: 0.888888888888889.
[32m[I 2023-04-26 13:37:46,799][39m Trial 492 finished with value: 0.8571428571428571 and parameters: {'objective': 'CrossEntropy', 'colsample_bylevel': 0.09671630281547441, 'depth': 12, 'boosting_type': 'Plain', 'bootstrap_type': 'Bernoulli', 'subsample': 0.5528659475481544}. Best is trial 342 with value: 0.888888888888889.
[32m[I 2023-04-26 13:37:49,145][39m Trial 493 finished with value: 0.8181818181818182 and parameters: {'objective': 'CrossEntropy', 'colsample_bylevel': 0.09618289820216697, 'depth': 6, 'boosting_type': 'Plain', 'bootstrap_type': 'Bernoulli', 'subsample': 0.6621980039082646}. Best is trial 342 with value: 0.888888888888889.
[32m[I 2023-04-26 13:37:51,916][39m Trial 494 finished with value: 0.8735632183908046 and parameters: {'objective': 'CrossEntropy', 'colsample_bylevel': 0.09807339048474967, 'depth': 11, 'boosting_type': 'Plain', 'bootstrap_type': 'Bernoulli', 'subsample': 0.7497952536045692}. Best is trial 342 with value: 0.888888888888889.
[32m[I 2023-04-26 13:37:54,540][39m Trial 495 finished with value: 0.8764044943820225 and parameters: {'objective': 'CrossEntropy', 'colsample_bylevel': 0.09665459692627257, 'depth': 12, 'boosting_type': 'Plain', 'bootstrap_type': 'Bernoulli', 'subsample': 0.7030481162018412}. Best is trial 342 with value: 0.888888888888889.
