[32m[I 2023-04-26 13:19:14,357][39m Trial 68 finished with value: 0.7741935483870966 and parameters: {'objective': 'Logloss', 'colsample_bylevel': 0.05551892231518277, 'depth': 5, 'boosting_type': 'Ordered', 'bootstrap_type': 'Bayesian', 'bagging_temperature': 9.129400158541324}. Best is trial 8 with value: 0.8539325842696629.
[32m[I 2023-04-26 13:19:17,799][39m Trial 69 finished with value: 0.7956989247311829 and parameters: {'objective': 'Logloss', 'colsample_bylevel': 0.048519075448778905, 'depth': 7, 'boosting_type': 'Ordered', 'bootstrap_type': 'Bayesian', 'bagging_temperature': 3.9237661235021584}. Best is trial 8 with value: 0.8539325842696629.
[32m[I 2023-04-26 13:19:20,917][39m Trial 70 finished with value: 0.7547169811320755 and parameters: {'objective': 'Logloss', 'colsample_bylevel': 0.01615139098454966, 'depth': 4, 'boosting_type': 'Ordered', 'bootstrap_type': 'Bayesian', 'bagging_temperature': 3.1761864401421267}. Best is trial 8 with value: 0.8539325842696629.
[32m[I 2023-04-26 13:19:25,475][39m Trial 71 finished with value: 0.8172043010752689 and parameters: {'objective': 'CrossEntropy', 'colsample_bylevel': 0.08274839890874972, 'depth': 7, 'boosting_type': 'Ordered', 'bootstrap_type': 'MVS'}. Best is trial 8 with value: 0.8539325842696629.
[32m[I 2023-04-26 13:19:30,655][39m Trial 72 finished with value: 0.8085106382978724 and parameters: {'objective': 'Logloss', 'colsample_bylevel': 0.05809468577846344, 'depth': 6, 'boosting_type': 'Ordered', 'bootstrap_type': 'Bayesian', 'bagging_temperature': 5.641306437192612}. Best is trial 8 with value: 0.8539325842696629.
[32m[I 2023-04-26 13:19:35,664][39m Trial 73 finished with value: 0.8260869565217392 and parameters: {'objective': 'CrossEntropy', 'colsample_bylevel': 0.09445283708468127, 'depth': 8, 'boosting_type': 'Ordered', 'bootstrap_type': 'MVS'}. Best is trial 8 with value: 0.8539325842696629.
[32m[I 2023-04-26 13:19:40,282][39m Trial 74 finished with value: 0.8172043010752689 and parameters: {'objective': 'CrossEntropy', 'colsample_bylevel': 0.08751225155439783, 'depth': 7, 'boosting_type': 'Ordered', 'bootstrap_type': 'MVS'}. Best is trial 8 with value: 0.8539325842696629.
[32m[I 2023-04-26 13:19:41,912][39m Trial 75 finished with value: 0.8210526315789473 and parameters: {'objective': 'Logloss', 'colsample_bylevel': 0.04571834197353431, 'depth': 5, 'boosting_type': 'Plain', 'bootstrap_type': 'Bayesian', 'bagging_temperature': 7.301555301489913}. Best is trial 8 with value: 0.8539325842696629.
[32m[I 2023-04-26 13:19:45,852][39m Trial 76 finished with value: 0.8297872340425531 and parameters: {'objective': 'Logloss', 'colsample_bylevel': 0.06671864857036208, 'depth': 11, 'boosting_type': 'Ordered', 'bootstrap_type': 'Bayesian', 'bagging_temperature': 4.668180020030709}. Best is trial 8 with value: 0.8539325842696629.
[32m[I 2023-04-26 13:19:49,887][39m Trial 77 finished with value: 0.8085106382978724 and parameters: {'objective': 'CrossEntropy', 'colsample_bylevel': 0.06650573265294799, 'depth': 10, 'boosting_type': 'Ordered', 'bootstrap_type': 'Bernoulli', 'subsample': 0.4477232071227631}. Best is trial 8 with value: 0.8539325842696629.
[32m[I 2023-04-26 13:19:53,819][39m Trial 78 finished with value: 0.8297872340425531 and parameters: {'objective': 'Logloss', 'colsample_bylevel': 0.06253866977021866, 'depth': 11, 'boosting_type': 'Ordered', 'bootstrap_type': 'Bayesian', 'bagging_temperature': 4.788443432020291}. Best is trial 8 with value: 0.8539325842696629.
[32m[I 2023-04-26 13:19:55,487][39m Trial 79 finished with value: 0.8131868131868132 and parameters: {'objective': 'Logloss', 'colsample_bylevel': 0.056233115763582586, 'depth': 12, 'boosting_type': 'Plain', 'bootstrap_type': 'Bayesian', 'bagging_temperature': 6.3140610564086215}. Best is trial 8 with value: 0.8539325842696629.
[32m[I 2023-04-26 13:20:01,149][39m Trial 80 finished with value: 0.8210526315789473 and parameters: {'objective': 'CrossEntropy', 'colsample_bylevel': 0.07647671964689012, 'depth': 5, 'boosting_type': 'Ordered', 'bootstrap_type': 'MVS'}. Best is trial 8 with value: 0.8539325842696629.
[32m[I 2023-04-26 13:20:04,881][39m Trial 81 finished with value: 0.8260869565217392 and parameters: {'objective': 'Logloss', 'colsample_bylevel': 0.06331945664779573, 'depth': 11, 'boosting_type': 'Ordered', 'bootstrap_type': 'Bayesian', 'bagging_temperature': 4.922105644676799}. Best is trial 8 with value: 0.8539325842696629.
[32m[I 2023-04-26 13:20:11,266][39m Trial 82 finished with value: 0.7956989247311829 and parameters: {'objective': 'Logloss', 'colsample_bylevel': 0.0843396939114204, 'depth': 6, 'boosting_type': 'Ordered', 'bootstrap_type': 'Bayesian', 'bagging_temperature': 4.856290895890084}. Best is trial 8 with value: 0.8539325842696629.
[32m[I 2023-04-26 13:20:15,390][39m Trial 83 finished with value: 0.8210526315789473 and parameters: {'objective': 'CrossEntropy', 'colsample_bylevel': 0.07352728441933253, 'depth': 10, 'boosting_type': 'Ordered', 'bootstrap_type': 'MVS'}. Best is trial 8 with value: 0.8539325842696629.
[32m[I 2023-04-26 13:20:21,222][39m Trial 84 finished with value: 0.8043478260869564 and parameters: {'objective': 'CrossEntropy', 'colsample_bylevel': 0.07888366387568421, 'depth': 6, 'boosting_type': 'Ordered', 'bootstrap_type': 'MVS'}. Best is trial 8 with value: 0.8539325842696629.
[32m[I 2023-04-26 13:20:25,471][39m Trial 85 finished with value: 0.8260869565217392 and parameters: {'objective': 'CrossEntropy', 'colsample_bylevel': 0.08080006203780914, 'depth': 9, 'boosting_type': 'Ordered', 'bootstrap_type': 'MVS'}. Best is trial 8 with value: 0.8539325842696629.
[32m[I 2023-04-26 13:20:30,387][39m Trial 86 finished with value: 0.7741935483870966 and parameters: {'objective': 'Logloss', 'colsample_bylevel': 0.06100824408781776, 'depth': 6, 'boosting_type': 'Ordered', 'bootstrap_type': 'Bayesian', 'bagging_temperature': 3.5685716732518173}. Best is trial 8 with value: 0.8539325842696629.
[32m[I 2023-04-26 13:20:32,038][39m Trial 87 finished with value: 0.7912087912087912 and parameters: {'objective': 'Logloss', 'colsample_bylevel': 0.05269251890310399, 'depth': 6, 'boosting_type': 'Plain', 'bootstrap_type': 'Bayesian', 'bagging_temperature': 2.733440470274634}. Best is trial 8 with value: 0.8539325842696629.
[32m[I 2023-04-26 13:20:35,549][39m Trial 88 finished with value: 0.7843137254901961 and parameters: {'objective': 'Logloss', 'colsample_bylevel': 0.05687395618571546, 'depth': 2, 'boosting_type': 'Ordered', 'bootstrap_type': 'Bayesian', 'bagging_temperature': 8.49324521899943}. Best is trial 8 with value: 0.8539325842696629.
[32m[I 2023-04-26 13:20:39,507][39m Trial 89 finished with value: 0.8043478260869564 and parameters: {'objective': 'Logloss', 'colsample_bylevel': 0.06890614706888223, 'depth': 12, 'boosting_type': 'Ordered', 'bootstrap_type': 'Bayesian', 'bagging_temperature': 4.331705934135141}. Best is trial 8 with value: 0.8539325842696629.
[32m[I 2023-04-26 13:20:43,493][39m Trial 90 finished with value: 0.8085106382978724 and parameters: {'objective': 'CrossEntropy', 'colsample_bylevel': 0.08521716291418754, 'depth': 8, 'boosting_type': 'Ordered', 'bootstrap_type': 'MVS'}. Best is trial 8 with value: 0.8539325842696629.
[32m[I 2023-04-26 13:20:47,263][39m Trial 91 finished with value: 0.8041237113402062 and parameters: {'objective': 'Logloss', 'colsample_bylevel': 0.054552320026810264, 'depth': 8, 'boosting_type': 'Ordered', 'bootstrap_type': 'Bayesian', 'bagging_temperature': 6.932573184507087}. Best is trial 8 with value: 0.8539325842696629.
[32m[I 2023-04-26 13:20:50,686][39m Trial 92 finished with value: 0.7628865979381443 and parameters: {'objective': 'Logloss', 'colsample_bylevel': 0.04405809946510654, 'depth': 9, 'boosting_type': 'Ordered', 'bootstrap_type': 'Bayesian', 'bagging_temperature': 7.817338490186449}. Best is trial 8 with value: 0.8539325842696629.
[32m[I 2023-04-26 13:20:55,545][39m Trial 93 finished with value: 0.8260869565217392 and parameters: {'objective': 'CrossEntropy', 'colsample_bylevel': 0.09035054572202171, 'depth': 7, 'boosting_type': 'Ordered', 'bootstrap_type': 'MVS'}. Best is trial 8 with value: 0.8539325842696629.
[32m[I 2023-04-26 13:20:59,188][39m Trial 94 finished with value: 0.782608695652174 and parameters: {'objective': 'Logloss', 'colsample_bylevel': 0.0495052635892822, 'depth': 11, 'boosting_type': 'Ordered', 'bootstrap_type': 'Bayesian', 'bagging_temperature': 6.386941021340074}. Best is trial 8 with value: 0.8539325842696629.
[32m[I 2023-04-26 13:21:03,463][39m Trial 95 finished with value: 0.8172043010752689 and parameters: {'objective': 'CrossEntropy', 'colsample_bylevel': 0.07618119003464786, 'depth': 7, 'boosting_type': 'Ordered', 'bootstrap_type': 'MVS'}. Best is trial 8 with value: 0.8539325842696629.
[32m[I 2023-04-26 13:21:07,711][39m Trial 96 finished with value: 0.8085106382978724 and parameters: {'objective': 'CrossEntropy', 'colsample_bylevel': 0.07194599108469099, 'depth': 8, 'boosting_type': 'Ordered', 'bootstrap_type': 'MVS'}. Best is trial 8 with value: 0.8539325842696629.
[32m[I 2023-04-26 13:21:09,604][39m Trial 97 finished with value: 0.8260869565217392 and parameters: {'objective': 'Logloss', 'colsample_bylevel': 0.06443649370780964, 'depth': 11, 'boosting_type': 'Plain', 'bootstrap_type': 'Bayesian', 'bagging_temperature': 5.767723963089081}. Best is trial 8 with value: 0.8539325842696629.
[32m[I 2023-04-26 13:21:13,774][39m Trial 98 finished with value: 0.8333333333333334 and parameters: {'objective': 'CrossEntropy', 'colsample_bylevel': 0.07503896107855663, 'depth': 7, 'boosting_type': 'Ordered', 'bootstrap_type': 'MVS'}. Best is trial 8 with value: 0.8539325842696629.
[32m[I 2023-04-26 13:21:18,499][39m Trial 99 finished with value: 0.8260869565217392 and parameters: {'objective': 'CrossEntropy', 'colsample_bylevel': 0.08134180559354909, 'depth': 9, 'boosting_type': 'Ordered', 'bootstrap_type': 'MVS'}. Best is trial 8 with value: 0.8539325842696629.
[32m[I 2023-04-26 13:21:23,181][39m Trial 100 finished with value: 0.7956989247311829 and parameters: {'objective': 'Logloss', 'colsample_bylevel': 0.06084795104702273, 'depth': 5, 'boosting_type': 'Ordered', 'bootstrap_type': 'Bayesian', 'bagging_temperature': 5.270641167346409}. Best is trial 8 with value: 0.8539325842696629.
[32m[I 2023-04-26 13:21:27,664][39m Trial 101 finished with value: 0.8000000000000002 and parameters: {'objective': 'Logloss', 'colsample_bylevel': 0.047354467340747886, 'depth': 6, 'boosting_type': 'Ordered', 'bootstrap_type': 'Bernoulli', 'subsample': 0.5841318523759809}. Best is trial 8 with value: 0.8539325842696629.
[32m[I 2023-04-26 13:21:31,744][39m Trial 102 finished with value: 0.7956989247311829 and parameters: {'objective': 'Logloss', 'colsample_bylevel': 0.07558630371223066, 'depth': 10, 'boosting_type': 'Ordered', 'bootstrap_type': 'Bayesian', 'bagging_temperature': 4.04774783286848}. Best is trial 8 with value: 0.8539325842696629.
[32m[I 2023-04-26 13:21:35,742][39m Trial 103 finished with value: 0.7912087912087912 and parameters: {'objective': 'CrossEntropy', 'colsample_bylevel': 0.06878089534942197, 'depth': 7, 'boosting_type': 'Ordered', 'bootstrap_type': 'Bayesian', 'bagging_temperature': 4.393164011303565}. Best is trial 8 with value: 0.8539325842696629.
[32m[I 2023-04-26 13:21:39,921][39m Trial 104 finished with value: 0.8131868131868132 and parameters: {'objective': 'Logloss', 'colsample_bylevel': 0.07451053209378637, 'depth': 11, 'boosting_type': 'Ordered', 'bootstrap_type': 'Bayesian', 'bagging_temperature': 7.526264042155519}. Best is trial 8 with value: 0.8539325842696629.
[32m[I 2023-04-26 13:21:43,626][39m Trial 105 finished with value: 0.8085106382978724 and parameters: {'objective': 'CrossEntropy', 'colsample_bylevel': 0.05115699497361835, 'depth': 7, 'boosting_type': 'Ordered', 'bootstrap_type': 'MVS'}. Best is trial 8 with value: 0.8539325842696629.
[32m[I 2023-04-26 13:21:48,074][39m Trial 106 finished with value: 0.8297872340425531 and parameters: {'objective': 'CrossEntropy', 'colsample_bylevel': 0.07861436209894228, 'depth': 8, 'boosting_type': 'Ordered', 'bootstrap_type': 'MVS'}. Best is trial 8 with value: 0.8539325842696629.
[32m[I 2023-04-26 13:21:52,479][39m Trial 107 finished with value: 0.8172043010752689 and parameters: {'objective': 'CrossEntropy', 'colsample_bylevel': 0.07930729565411619, 'depth': 8, 'boosting_type': 'Ordered', 'bootstrap_type': 'MVS'}. Best is trial 8 with value: 0.8539325842696629.
[32m[I 2023-04-26 13:21:57,179][39m Trial 108 finished with value: 0.8210526315789473 and parameters: {'objective': 'CrossEntropy', 'colsample_bylevel': 0.08917607655626464, 'depth': 8, 'boosting_type': 'Ordered', 'bootstrap_type': 'MVS'}. Best is trial 8 with value: 0.8539325842696629.
[32m[I 2023-04-26 13:21:59,602][39m Trial 109 finished with value: 0.8666666666666666 and parameters: {'objective': 'CrossEntropy', 'colsample_bylevel': 0.07150911417193763, 'depth': 7, 'boosting_type': 'Plain', 'bootstrap_type': 'MVS'}. Best is trial 109 with value: 0.8666666666666666.
[32m[I 2023-04-26 13:22:01,514][39m Trial 110 finished with value: 0.8444444444444446 and parameters: {'objective': 'CrossEntropy', 'colsample_bylevel': 0.06495855817516435, 'depth': 7, 'boosting_type': 'Plain', 'bootstrap_type': 'MVS'}. Best is trial 109 with value: 0.8666666666666666.
[32m[I 2023-04-26 13:22:03,290][39m Trial 111 finished with value: 0.8571428571428571 and parameters: {'objective': 'CrossEntropy', 'colsample_bylevel': 0.06480277526073366, 'depth': 7, 'boosting_type': 'Plain', 'bootstrap_type': 'MVS'}. Best is trial 109 with value: 0.8666666666666666.
[32m[I 2023-04-26 13:22:05,090][39m Trial 112 finished with value: 0.8571428571428571 and parameters: {'objective': 'CrossEntropy', 'colsample_bylevel': 0.06478503821767617, 'depth': 7, 'boosting_type': 'Plain', 'bootstrap_type': 'MVS'}. Best is trial 109 with value: 0.8666666666666666.
[32m[I 2023-04-26 13:22:07,337][39m Trial 113 finished with value: 0.8666666666666666 and parameters: {'objective': 'CrossEntropy', 'colsample_bylevel': 0.07140654949777804, 'depth': 7, 'boosting_type': 'Plain', 'bootstrap_type': 'MVS'}. Best is trial 109 with value: 0.8666666666666666.
[32m[I 2023-04-26 13:22:09,226][39m Trial 114 finished with value: 0.8444444444444446 and parameters: {'objective': 'CrossEntropy', 'colsample_bylevel': 0.06494023188473552, 'depth': 7, 'boosting_type': 'Plain', 'bootstrap_type': 'MVS'}. Best is trial 109 with value: 0.8666666666666666.
[32m[I 2023-04-26 13:22:11,041][39m Trial 115 finished with value: 0.8571428571428571 and parameters: {'objective': 'CrossEntropy', 'colsample_bylevel': 0.06477570797833103, 'depth': 7, 'boosting_type': 'Plain', 'bootstrap_type': 'MVS'}. Best is trial 109 with value: 0.8666666666666666.
[32m[I 2023-04-26 13:22:12,982][39m Trial 116 finished with value: 0.8387096774193549 and parameters: {'objective': 'CrossEntropy', 'colsample_bylevel': 0.06545379871958007, 'depth': 7, 'boosting_type': 'Plain', 'bootstrap_type': 'MVS'}. Best is trial 109 with value: 0.8666666666666666.
[32m[I 2023-04-26 13:22:15,153][39m Trial 117 finished with value: 0.8571428571428571 and parameters: {'objective': 'CrossEntropy', 'colsample_bylevel': 0.07114526141603872, 'depth': 7, 'boosting_type': 'Plain', 'bootstrap_type': 'MVS'}. Best is trial 109 with value: 0.8666666666666666.
[32m[I 2023-04-26 13:22:17,074][39m Trial 118 finished with value: 0.8571428571428571 and parameters: {'objective': 'CrossEntropy', 'colsample_bylevel': 0.06524716734592277, 'depth': 7, 'boosting_type': 'Plain', 'bootstrap_type': 'MVS'}. Best is trial 109 with value: 0.8666666666666666.
[32m[I 2023-04-26 13:22:19,057][39m Trial 119 finished with value: 0.8571428571428571 and parameters: {'objective': 'CrossEntropy', 'colsample_bylevel': 0.06525959937550864, 'depth': 7, 'boosting_type': 'Plain', 'bootstrap_type': 'MVS'}. Best is trial 109 with value: 0.8666666666666666.
[32m[I 2023-04-26 13:22:21,050][39m Trial 120 finished with value: 0.8695652173913043 and parameters: {'objective': 'CrossEntropy', 'colsample_bylevel': 0.06768761694875929, 'depth': 7, 'boosting_type': 'Plain', 'bootstrap_type': 'MVS'}. Best is trial 120 with value: 0.8695652173913043.
[32m[I 2023-04-26 13:22:23,146][39m Trial 121 finished with value: 0.8571428571428571 and parameters: {'objective': 'CrossEntropy', 'colsample_bylevel': 0.06969276326432507, 'depth': 7, 'boosting_type': 'Plain', 'bootstrap_type': 'MVS'}. Best is trial 120 with value: 0.8695652173913043.
[32m[I 2023-04-26 13:22:25,181][39m Trial 122 finished with value: 0.8539325842696629 and parameters: {'objective': 'CrossEntropy', 'colsample_bylevel': 0.06996952633561174, 'depth': 7, 'boosting_type': 'Plain', 'bootstrap_type': 'MVS'}. Best is trial 120 with value: 0.8695652173913043.
[32m[I 2023-04-26 13:22:27,283][39m Trial 123 finished with value: 0.8571428571428571 and parameters: {'objective': 'CrossEntropy', 'colsample_bylevel': 0.0708151550700005, 'depth': 7, 'boosting_type': 'Plain', 'bootstrap_type': 'MVS'}. Best is trial 120 with value: 0.8695652173913043.
[32m[I 2023-04-26 13:22:29,431][39m Trial 124 finished with value: 0.8571428571428571 and parameters: {'objective': 'CrossEntropy', 'colsample_bylevel': 0.07082430214564968, 'depth': 7, 'boosting_type': 'Plain', 'bootstrap_type': 'MVS'}. Best is trial 120 with value: 0.8695652173913043.
[32m[I 2023-04-26 13:22:31,606][39m Trial 125 finished with value: 0.8764044943820225 and parameters: {'objective': 'CrossEntropy', 'colsample_bylevel': 0.07179441630508972, 'depth': 7, 'boosting_type': 'Plain', 'bootstrap_type': 'MVS'}. Best is trial 125 with value: 0.8764044943820225.
[32m[I 2023-04-26 13:22:33,610][39m Trial 126 finished with value: 0.8571428571428571 and parameters: {'objective': 'CrossEntropy', 'colsample_bylevel': 0.06764469982872277, 'depth': 7, 'boosting_type': 'Plain', 'bootstrap_type': 'MVS'}. Best is trial 125 with value: 0.8764044943820225.
[32m[I 2023-04-26 13:22:35,816][39m Trial 127 finished with value: 0.8666666666666666 and parameters: {'objective': 'CrossEntropy', 'colsample_bylevel': 0.07241053011129818, 'depth': 7, 'boosting_type': 'Plain', 'bootstrap_type': 'MVS'}. Best is trial 125 with value: 0.8764044943820225.
[32m[I 2023-04-26 13:22:37,961][39m Trial 128 finished with value: 0.8539325842696629 and parameters: {'objective': 'CrossEntropy', 'colsample_bylevel': 0.07269926761508094, 'depth': 7, 'boosting_type': 'Plain', 'bootstrap_type': 'MVS'}. Best is trial 125 with value: 0.8764044943820225.
[32m[I 2023-04-26 13:22:39,940][39m Trial 129 finished with value: 0.8539325842696629 and parameters: {'objective': 'CrossEntropy', 'colsample_bylevel': 0.06991331904051516, 'depth': 7, 'boosting_type': 'Plain', 'bootstrap_type': 'MVS'}. Best is trial 125 with value: 0.8764044943820225.
[32m[I 2023-04-26 13:22:41,740][39m Trial 130 finished with value: 0.8444444444444446 and parameters: {'objective': 'CrossEntropy', 'colsample_bylevel': 0.06756996737009013, 'depth': 6, 'boosting_type': 'Plain', 'bootstrap_type': 'MVS'}. Best is trial 125 with value: 0.8764044943820225.
[32m[I 2023-04-26 13:22:43,725][39m Trial 131 finished with value: 0.8539325842696629 and parameters: {'objective': 'CrossEntropy', 'colsample_bylevel': 0.06797791934633232, 'depth': 7, 'boosting_type': 'Plain', 'bootstrap_type': 'MVS'}. Best is trial 125 with value: 0.8764044943820225.
[32m[I 2023-04-26 13:22:45,789][39m Trial 132 finished with value: 0.8571428571428571 and parameters: {'objective': 'CrossEntropy', 'colsample_bylevel': 0.07112059019583299, 'depth': 7, 'boosting_type': 'Plain', 'bootstrap_type': 'MVS'}. Best is trial 125 with value: 0.8764044943820225.
[32m[I 2023-04-26 13:22:47,903][39m Trial 133 finished with value: 0.8666666666666666 and parameters: {'objective': 'CrossEntropy', 'colsample_bylevel': 0.07163286707250757, 'depth': 7, 'boosting_type': 'Plain', 'bootstrap_type': 'MVS'}. Best is trial 125 with value: 0.8764044943820225.
[32m[I 2023-04-26 13:22:50,008][39m Trial 134 finished with value: 0.8539325842696629 and parameters: {'objective': 'CrossEntropy', 'colsample_bylevel': 0.07267209892497216, 'depth': 7, 'boosting_type': 'Plain', 'bootstrap_type': 'MVS'}. Best is trial 125 with value: 0.8764044943820225.
[32m[I 2023-04-26 13:22:52,228][39m Trial 135 finished with value: 0.8666666666666666 and parameters: {'objective': 'CrossEntropy', 'colsample_bylevel': 0.06891379918044242, 'depth': 8, 'boosting_type': 'Plain', 'bootstrap_type': 'MVS'}. Best is trial 125 with value: 0.8764044943820225.
[32m[I 2023-04-26 13:22:54,463][39m Trial 136 finished with value: 0.8571428571428571 and parameters: {'objective': 'CrossEntropy', 'colsample_bylevel': 0.06944157597584101, 'depth': 8, 'boosting_type': 'Plain', 'bootstrap_type': 'MVS'}. Best is trial 125 with value: 0.8764044943820225.
[32m[I 2023-04-26 13:22:56,764][39m Trial 137 finished with value: 0.8666666666666666 and parameters: {'objective': 'CrossEntropy', 'colsample_bylevel': 0.06888693651350124, 'depth': 8, 'boosting_type': 'Plain', 'bootstrap_type': 'MVS'}. Best is trial 125 with value: 0.8764044943820225.
[32m[I 2023-04-26 13:22:58,857][39m Trial 138 finished with value: 0.8387096774193549 and parameters: {'objective': 'CrossEntropy', 'colsample_bylevel': 0.06845344129895307, 'depth': 8, 'boosting_type': 'Plain', 'bootstrap_type': 'MVS'}. Best is trial 125 with value: 0.8764044943820225.
[32m[I 2023-04-26 13:23:00,726][39m Trial 139 finished with value: 0.8387096774193549 and parameters: {'objective': 'CrossEntropy', 'colsample_bylevel': 0.06239069930143223, 'depth': 8, 'boosting_type': 'Plain', 'bootstrap_type': 'MVS'}. Best is trial 125 with value: 0.8764044943820225.
