
[32m[I 2023-04-26 13:15:19,247][39m A new study created in memory with name: no-name-4fa17a8c-5d5c-4c8b-a09f-b59bdcfcef2e
[32m[I 2023-04-26 13:15:25,850][39m Trial 0 finished with value: 0.7912087912087912 and parameters: {'objective': 'CrossEntropy', 'colsample_bylevel': 0.07337010908741619, 'depth': 11, 'boosting_type': 'Ordered', 'bootstrap_type': 'MVS'}. Best is trial 0 with value: 0.7912087912087912.
[32m[I 2023-04-26 13:15:27,602][39m Trial 1 finished with value: 0.8125 and parameters: {'objective': 'CrossEntropy', 'colsample_bylevel': 0.038383929206891085, 'depth': 10, 'boosting_type': 'Plain', 'bootstrap_type': 'MVS'}. Best is trial 1 with value: 0.8125.
[32m[I 2023-04-26 13:15:28,911][39m Trial 2 finished with value: 0.7999999999999999 and parameters: {'objective': 'Logloss', 'colsample_bylevel': 0.03698845255788025, 'depth': 3, 'boosting_type': 'Plain', 'bootstrap_type': 'Bernoulli', 'subsample': 0.7366033347747413}. Best is trial 1 with value: 0.8125.
[32m[I 2023-04-26 13:15:31,850][39m Trial 3 finished with value: 0.8333333333333334 and parameters: {'objective': 'Logloss', 'colsample_bylevel': 0.051231896067299686, 'depth': 8, 'boosting_type': 'Ordered', 'bootstrap_type': 'Bayesian', 'bagging_temperature': 6.079225425478643}. Best is trial 3 with value: 0.8333333333333334.
[32m[I 2023-04-26 13:15:33,871][39m Trial 4 finished with value: 0.8 and parameters: {'objective': 'Logloss', 'colsample_bylevel': 0.08864598434468209, 'depth': 5, 'boosting_type': 'Plain', 'bootstrap_type': 'Bernoulli', 'subsample': 0.3718694882535042}. Best is trial 3 with value: 0.8333333333333334.
[32m[I 2023-04-26 13:15:35,496][39m Trial 5 finished with value: 0.8131868131868132 and parameters: {'objective': 'CrossEntropy', 'colsample_bylevel': 0.06229211967578754, 'depth': 5, 'boosting_type': 'Plain', 'bootstrap_type': 'Bayesian', 'bagging_temperature': 2.1631983285532885}. Best is trial 3 with value: 0.8333333333333334.
[32m[I 2023-04-26 13:15:39,310][39m Trial 6 finished with value: 0.782608695652174 and parameters: {'objective': 'CrossEntropy', 'colsample_bylevel': 0.0661206598759582, 'depth': 4, 'boosting_type': 'Ordered', 'bootstrap_type': 'Bernoulli', 'subsample': 0.7689590951984578}. Best is trial 3 with value: 0.8333333333333334.
[32m[I 2023-04-26 13:15:40,927][39m Trial 7 finished with value: 0.8125 and parameters: {'objective': 'Logloss', 'colsample_bylevel': 0.0799657742749462, 'depth': 2, 'boosting_type': 'Plain', 'bootstrap_type': 'MVS'}. Best is trial 3 with value: 0.8333333333333334.
[32m[I 2023-04-26 13:15:42,705][39m Trial 8 finished with value: 0.8539325842696629 and parameters: {'objective': 'CrossEntropy', 'colsample_bylevel': 0.07112067943318116, 'depth': 6, 'boosting_type': 'Plain', 'bootstrap_type': 'Bayesian', 'bagging_temperature': 3.8224031169074815}. Best is trial 8 with value: 0.8539325842696629.
[32m[I 2023-04-26 13:15:46,254][39m Trial 9 finished with value: 0.7872340425531914 and parameters: {'objective': 'CrossEntropy', 'colsample_bylevel': 0.09946605229267705, 'depth': 2, 'boosting_type': 'Ordered', 'bootstrap_type': 'Bernoulli', 'subsample': 0.5881097469269173}. Best is trial 8 with value: 0.8539325842696629.
[32m[I 2023-04-26 13:15:47,438][39m Trial 10 finished with value: 0.7640449438202247 and parameters: {'objective': 'CrossEntropy', 'colsample_bylevel': 0.013797403484007653, 'depth': 8, 'boosting_type': 'Plain', 'bootstrap_type': 'Bayesian', 'bagging_temperature': 9.78256067945496}. Best is trial 8 with value: 0.8539325842696629.
[32m[I 2023-04-26 13:15:50,669][39m Trial 11 finished with value: 0.8247422680412371 and parameters: {'objective': 'Logloss', 'colsample_bylevel': 0.0463055854699926, 'depth': 8, 'boosting_type': 'Ordered', 'bootstrap_type': 'Bayesian', 'bagging_temperature': 5.977905020860348}. Best is trial 8 with value: 0.8539325842696629.
[32m[I 2023-04-26 13:15:54,199][39m Trial 12 finished with value: 0.8247422680412371 and parameters: {'objective': 'Logloss', 'colsample_bylevel': 0.05141656124014157, 'depth': 7, 'boosting_type': 'Ordered', 'bootstrap_type': 'Bayesian', 'bagging_temperature': 5.388221944182706}. Best is trial 8 with value: 0.8539325842696629.
[32m[I 2023-04-26 13:15:57,317][39m Trial 13 finished with value: 0.7547169811320755 and parameters: {'objective': 'Logloss', 'colsample_bylevel': 0.02362751378888018, 'depth': 9, 'boosting_type': 'Ordered', 'bootstrap_type': 'Bayesian', 'bagging_temperature': 2.8384898077529948}. Best is trial 8 with value: 0.8539325842696629.
[32m[I 2023-04-26 13:16:00,983][39m Trial 14 finished with value: 0.8297872340425531 and parameters: {'objective': 'Logloss', 'colsample_bylevel': 0.059366711895417826, 'depth': 12, 'boosting_type': 'Ordered', 'bootstrap_type': 'Bayesian', 'bagging_temperature': 6.915146236435528}. Best is trial 8 with value: 0.8539325842696629.
[32m[I 2023-04-26 13:16:03,143][39m Trial 15 finished with value: 0.8222222222222222 and parameters: {'objective': 'CrossEntropy', 'colsample_bylevel': 0.0772822491801508, 'depth': 6, 'boosting_type': 'Plain', 'bootstrap_type': 'Bayesian', 'bagging_temperature': 3.339683945189007}. Best is trial 8 with value: 0.8539325842696629.
[32m[I 2023-04-26 13:16:04,767][39m Trial 16 finished with value: 0.8260869565217392 and parameters: {'objective': 'CrossEntropy', 'colsample_bylevel': 0.04530392634925017, 'depth': 7, 'boosting_type': 'Plain', 'bootstrap_type': 'Bayesian', 'bagging_temperature': 8.281012085943086}. Best is trial 8 with value: 0.8539325842696629.
[32m[I 2023-04-26 13:16:08,047][39m Trial 17 finished with value: 0.7659574468085106 and parameters: {'objective': 'Logloss', 'colsample_bylevel': 0.030630876795393523, 'depth': 9, 'boosting_type': 'Ordered', 'bootstrap_type': 'Bayesian', 'bagging_temperature': 0.7205539575186304}. Best is trial 8 with value: 0.8539325842696629.
[32m[I 2023-04-26 13:16:09,973][39m Trial 18 finished with value: 0.8222222222222222 and parameters: {'objective': 'CrossEntropy', 'colsample_bylevel': 0.06860278385767617, 'depth': 5, 'boosting_type': 'Plain', 'bootstrap_type': 'Bayesian', 'bagging_temperature': 4.268455936956069}. Best is trial 8 with value: 0.8539325842696629.
[32m[I 2023-04-26 13:16:13,511][39m Trial 19 finished with value: 0.7346938775510203 and parameters: {'objective': 'Logloss', 'colsample_bylevel': 0.09117582783331556, 'depth': 1, 'boosting_type': 'Ordered', 'bootstrap_type': 'MVS'}. Best is trial 8 with value: 0.8539325842696629.
[32m[I 2023-04-26 13:16:18,173][39m Trial 20 finished with value: 0.8387096774193549 and parameters: {'objective': 'Logloss', 'colsample_bylevel': 0.054780833978347106, 'depth': 6, 'boosting_type': 'Ordered', 'bootstrap_type': 'Bayesian', 'bagging_temperature': 7.246857734302554}. Best is trial 8 with value: 0.8539325842696629.
[32m[I 2023-04-26 13:16:22,469][39m Trial 21 finished with value: 0.8478260869565216 and parameters: {'objective': 'Logloss', 'colsample_bylevel': 0.05548939468465473, 'depth': 6, 'boosting_type': 'Ordered', 'bootstrap_type': 'Bayesian', 'bagging_temperature': 7.246127343967668}. Best is trial 8 with value: 0.8539325842696629.
[32m[I 2023-04-26 13:16:27,096][39m Trial 22 finished with value: 0.8297872340425531 and parameters: {'objective': 'Logloss', 'colsample_bylevel': 0.054865863466820125, 'depth': 6, 'boosting_type': 'Ordered', 'bootstrap_type': 'Bayesian', 'bagging_temperature': 7.821279620941184}. Best is trial 8 with value: 0.8539325842696629.
[32m[I 2023-04-26 13:16:30,864][39m Trial 23 finished with value: 0.8125 and parameters: {'objective': 'Logloss', 'colsample_bylevel': 0.05971025797197974, 'depth': 4, 'boosting_type': 'Ordered', 'bootstrap_type': 'Bayesian', 'bagging_temperature': 8.9618094744561}. Best is trial 8 with value: 0.8539325842696629.
[32m[I 2023-04-26 13:16:36,819][39m Trial 24 finished with value: 0.8043478260869564 and parameters: {'objective': 'Logloss', 'colsample_bylevel': 0.08145778153732926, 'depth': 6, 'boosting_type': 'Ordered', 'bootstrap_type': 'Bayesian', 'bagging_temperature': 7.207317806254067}. Best is trial 8 with value: 0.8539325842696629.
[32m[I 2023-04-26 13:16:40,930][39m Trial 25 finished with value: 0.8085106382978724 and parameters: {'objective': 'Logloss', 'colsample_bylevel': 0.07056764510558704, 'depth': 4, 'boosting_type': 'Ordered', 'bootstrap_type': 'Bayesian', 'bagging_temperature': 4.532466585522961}. Best is trial 8 with value: 0.8539325842696629.
[32m[I 2023-04-26 13:16:42,515][39m Trial 26 finished with value: 0.8 and parameters: {'objective': 'CrossEntropy', 'colsample_bylevel': 0.042457622304740955, 'depth': 7, 'boosting_type': 'Plain', 'bootstrap_type': 'Bayesian', 'bagging_temperature': 6.674907538558833}. Best is trial 8 with value: 0.8539325842696629.
[32m[I 2023-04-26 13:16:47,142][39m Trial 27 finished with value: 0.8085106382978724 and parameters: {'objective': 'Logloss', 'colsample_bylevel': 0.06358816849577299, 'depth': 5, 'boosting_type': 'Ordered', 'bootstrap_type': 'Bayesian', 'bagging_temperature': 4.6799239446862915}. Best is trial 8 with value: 0.8539325842696629.
[32m[I 2023-04-26 13:16:48,743][39m Trial 28 finished with value: 0.7659574468085106 and parameters: {'objective': 'CrossEntropy', 'colsample_bylevel': 0.05546702038191341, 'depth': 3, 'boosting_type': 'Plain', 'bootstrap_type': 'Bernoulli', 'subsample': 0.10067980575519436}. Best is trial 8 with value: 0.8539325842696629.
[32m[I 2023-04-26 13:16:52,971][39m Trial 29 finished with value: 0.8297872340425531 and parameters: {'objective': 'CrossEntropy', 'colsample_bylevel': 0.07506763398774331, 'depth': 10, 'boosting_type': 'Ordered', 'bootstrap_type': 'MVS'}. Best is trial 8 with value: 0.8539325842696629.
[32m[I 2023-04-26 13:16:56,578][39m Trial 30 finished with value: 0.7959183673469389 and parameters: {'objective': 'Logloss', 'colsample_bylevel': 0.02650110447816027, 'depth': 6, 'boosting_type': 'Ordered', 'bootstrap_type': 'MVS'}. Best is trial 8 with value: 0.8539325842696629.
[32m[I 2023-04-26 13:17:00,112][39m Trial 31 finished with value: 0.7956989247311829 and parameters: {'objective': 'Logloss', 'colsample_bylevel': 0.05058950617806812, 'depth': 8, 'boosting_type': 'Ordered', 'bootstrap_type': 'Bayesian', 'bagging_temperature': 5.9380675722446865}. Best is trial 8 with value: 0.8539325842696629.
[32m[I 2023-04-26 13:17:03,695][39m Trial 32 finished with value: 0.8210526315789473 and parameters: {'objective': 'Logloss', 'colsample_bylevel': 0.05383182645502382, 'depth': 9, 'boosting_type': 'Ordered', 'bootstrap_type': 'Bayesian', 'bagging_temperature': 7.915276012703919}. Best is trial 8 with value: 0.8539325842696629.
[32m[I 2023-04-26 13:17:07,113][39m Trial 33 finished with value: 0.8125 and parameters: {'objective': 'Logloss', 'colsample_bylevel': 0.03789519893299577, 'depth': 7, 'boosting_type': 'Ordered', 'bootstrap_type': 'Bayesian', 'bagging_temperature': 6.009097909212564}. Best is trial 8 with value: 0.8539325842696629.
[32m[I 2023-04-26 13:17:10,618][39m Trial 34 finished with value: 0.8297872340425531 and parameters: {'objective': 'Logloss', 'colsample_bylevel': 0.04796366754835782, 'depth': 8, 'boosting_type': 'Ordered', 'bootstrap_type': 'Bayesian', 'bagging_temperature': 3.525734295077392}. Best is trial 8 with value: 0.8539325842696629.
[32m[I 2023-04-26 13:17:12,170][39m Trial 35 finished with value: 0.8172043010752689 and parameters: {'objective': 'Logloss', 'colsample_bylevel': 0.04169252201124087, 'depth': 10, 'boosting_type': 'Plain', 'bootstrap_type': 'Bayesian', 'bagging_temperature': 6.694320995136048}. Best is trial 8 with value: 0.8539325842696629.
[32m[I 2023-04-26 13:17:13,560][39m Trial 36 finished with value: 0.8247422680412371 and parameters: {'objective': 'CrossEntropy', 'colsample_bylevel': 0.033436525937005315, 'depth': 5, 'boosting_type': 'Plain', 'bootstrap_type': 'Bernoulli', 'subsample': 0.9868740699278264}. Best is trial 8 with value: 0.8539325842696629.
[32m[I 2023-04-26 13:17:18,601][39m Trial 37 finished with value: 0.8210526315789473 and parameters: {'objective': 'Logloss', 'colsample_bylevel': 0.05885235016955594, 'depth': 6, 'boosting_type': 'Ordered', 'bootstrap_type': 'MVS'}. Best is trial 8 with value: 0.8539325842696629.
[32m[I 2023-04-26 13:17:20,457][39m Trial 38 finished with value: 0.8131868131868132 and parameters: {'objective': 'Logloss', 'colsample_bylevel': 0.07006572013291487, 'depth': 5, 'boosting_type': 'Plain', 'bootstrap_type': 'Bernoulli', 'subsample': 0.1102767407826355}. Best is trial 8 with value: 0.8539325842696629.
[32m[I 2023-04-26 13:17:24,745][39m Trial 39 finished with value: 0.7777777777777778 and parameters: {'objective': 'CrossEntropy', 'colsample_bylevel': 0.08420550032087214, 'depth': 7, 'boosting_type': 'Ordered', 'bootstrap_type': 'Bayesian', 'bagging_temperature': 5.221608134364742}. Best is trial 8 with value: 0.8539325842696629.
[32m[I 2023-04-26 13:17:26,582][39m Trial 40 finished with value: 0.8260869565217392 and parameters: {'objective': 'Logloss', 'colsample_bylevel': 0.06604868822986448, 'depth': 3, 'boosting_type': 'Plain', 'bootstrap_type': 'Bayesian', 'bagging_temperature': 9.01166482352524}. Best is trial 8 with value: 0.8539325842696629.
[32m[I 2023-04-26 13:17:30,052][39m Trial 41 finished with value: 0.8043478260869564 and parameters: {'objective': 'Logloss', 'colsample_bylevel': 0.04877861309054225, 'depth': 8, 'boosting_type': 'Ordered', 'bootstrap_type': 'Bayesian', 'bagging_temperature': 3.6786056256287285}. Best is trial 8 with value: 0.8539325842696629.
[32m[I 2023-04-26 13:17:35,175][39m Trial 42 finished with value: 0.8041237113402062 and parameters: {'objective': 'Logloss', 'colsample_bylevel': 0.05557217024957675, 'depth': 6, 'boosting_type': 'Ordered', 'bootstrap_type': 'Bayesian', 'bagging_temperature': 7.659890453101158}. Best is trial 8 with value: 0.8539325842696629.
[32m[I 2023-04-26 13:17:39,910][39m Trial 43 finished with value: 0.8260869565217392 and parameters: {'objective': 'Logloss', 'colsample_bylevel': 0.06349272496941798, 'depth': 6, 'boosting_type': 'Ordered', 'bootstrap_type': 'Bayesian', 'bagging_temperature': 8.424755229595458}. Best is trial 8 with value: 0.8539325842696629.
[32m[I 2023-04-26 13:17:43,294][39m Trial 44 finished with value: 0.8000000000000002 and parameters: {'objective': 'Logloss', 'colsample_bylevel': 0.04637996711002454, 'depth': 8, 'boosting_type': 'Ordered', 'bootstrap_type': 'Bayesian', 'bagging_temperature': 2.2424412540957572}. Best is trial 8 with value: 0.8539325842696629.
[32m[I 2023-04-26 13:17:46,981][39m Trial 45 finished with value: 0.7755102040816327 and parameters: {'objective': 'Logloss', 'colsample_bylevel': 0.053659960706017445, 'depth': 4, 'boosting_type': 'Ordered', 'bootstrap_type': 'Bayesian', 'bagging_temperature': 7.494536966572431}. Best is trial 8 with value: 0.8539325842696629.
[32m[I 2023-04-26 13:17:50,565][39m Trial 46 finished with value: 0.7912087912087912 and parameters: {'objective': 'CrossEntropy', 'colsample_bylevel': 0.05837443823459838, 'depth': 12, 'boosting_type': 'Ordered', 'bootstrap_type': 'Bernoulli', 'subsample': 0.31263201773262517}. Best is trial 8 with value: 0.8539325842696629.
[32m[I 2023-04-26 13:17:54,233][39m Trial 47 finished with value: 0.8000000000000002 and parameters: {'objective': 'Logloss', 'colsample_bylevel': 0.05982643452512566, 'depth': 12, 'boosting_type': 'Ordered', 'bootstrap_type': 'Bayesian', 'bagging_temperature': 6.853346002222159}. Best is trial 8 with value: 0.8539325842696629.
[32m[I 2023-04-26 13:17:56,092][39m Trial 48 finished with value: 0.8043478260869564 and parameters: {'objective': 'CrossEntropy', 'colsample_bylevel': 0.03414346192862304, 'depth': 9, 'boosting_type': 'Plain', 'bootstrap_type': 'Bayesian', 'bagging_temperature': 1.1385697747581025}. Best is trial 8 with value: 0.8539325842696629.
[32m[I 2023-04-26 13:18:00,395][39m Trial 49 finished with value: 0.8085106382978724 and parameters: {'objective': 'Logloss', 'colsample_bylevel': 0.0736243556616064, 'depth': 11, 'boosting_type': 'Ordered', 'bootstrap_type': 'MVS'}. Best is trial 8 with value: 0.8539325842696629.
[32m[I 2023-04-26 13:18:02,258][39m Trial 50 finished with value: 0.8 and parameters: {'objective': 'Logloss', 'colsample_bylevel': 0.0666647837117065, 'depth': 5, 'boosting_type': 'Plain', 'bootstrap_type': 'Bayesian', 'bagging_temperature': 6.288784432458059}. Best is trial 8 with value: 0.8539325842696629.
[32m[I 2023-04-26 13:18:06,603][39m Trial 51 finished with value: 0.8297872340425531 and parameters: {'objective': 'CrossEntropy', 'colsample_bylevel': 0.07507963332353622, 'depth': 10, 'boosting_type': 'Ordered', 'bootstrap_type': 'MVS'}. Best is trial 8 with value: 0.8539325842696629.
[32m[I 2023-04-26 13:18:11,031][39m Trial 52 finished with value: 0.8172043010752689 and parameters: {'objective': 'CrossEntropy', 'colsample_bylevel': 0.07843023822664585, 'depth': 11, 'boosting_type': 'Ordered', 'bootstrap_type': 'MVS'}. Best is trial 8 with value: 0.8539325842696629.
[32m[I 2023-04-26 13:18:16,040][39m Trial 53 finished with value: 0.8260869565217392 and parameters: {'objective': 'CrossEntropy', 'colsample_bylevel': 0.0915935292060049, 'depth': 10, 'boosting_type': 'Ordered', 'bootstrap_type': 'MVS'}. Best is trial 8 with value: 0.8539325842696629.
[32m[I 2023-04-26 13:18:20,740][39m Trial 54 finished with value: 0.8297872340425531 and parameters: {'objective': 'CrossEntropy', 'colsample_bylevel': 0.0855563500139819, 'depth': 8, 'boosting_type': 'Ordered', 'bootstrap_type': 'MVS'}. Best is trial 8 with value: 0.8539325842696629.
[32m[I 2023-04-26 13:18:25,317][39m Trial 55 finished with value: 0.8297872340425531 and parameters: {'objective': 'CrossEntropy', 'colsample_bylevel': 0.08554175082280269, 'depth': 7, 'boosting_type': 'Ordered', 'bootstrap_type': 'MVS'}. Best is trial 8 with value: 0.8539325842696629.
[32m[I 2023-04-26 13:18:28,894][39m Trial 56 finished with value: 0.8085106382978724 and parameters: {'objective': 'CrossEntropy', 'colsample_bylevel': 0.04217859620137718, 'depth': 9, 'boosting_type': 'Ordered', 'bootstrap_type': 'Bayesian', 'bagging_temperature': 3.916774462032366}. Best is trial 8 with value: 0.8539325842696629.
[32m[I 2023-04-26 13:18:32,597][39m Trial 57 finished with value: 0.8387096774193549 and parameters: {'objective': 'Logloss', 'colsample_bylevel': 0.05108402518190326, 'depth': 7, 'boosting_type': 'Ordered', 'bootstrap_type': 'Bayesian', 'bagging_temperature': 3.25634318289608}. Best is trial 8 with value: 0.8539325842696629.
[32m[I 2023-04-26 13:18:36,211][39m Trial 58 finished with value: 0.8041237113402062 and parameters: {'objective': 'Logloss', 'colsample_bylevel': 0.04842346025713598, 'depth': 7, 'boosting_type': 'Ordered', 'bootstrap_type': 'Bayesian', 'bagging_temperature': 5.4627931885503065}. Best is trial 8 with value: 0.8539325842696629.
[32m[I 2023-04-26 13:18:38,013][39m Trial 59 finished with value: 0.8043478260869564 and parameters: {'objective': 'CrossEntropy', 'colsample_bylevel': 0.06200627766783447, 'depth': 6, 'boosting_type': 'Plain', 'bootstrap_type': 'Bayesian', 'bagging_temperature': 2.605196691011031}. Best is trial 8 with value: 0.8539325842696629.
[32m[I 2023-04-26 13:18:42,933][39m Trial 60 finished with value: 0.8172043010752689 and parameters: {'objective': 'Logloss', 'colsample_bylevel': 0.09716669169730592, 'depth': 7, 'boosting_type': 'Ordered', 'bootstrap_type': 'MVS'}. Best is trial 8 with value: 0.8539325842696629.
[32m[I 2023-04-26 13:18:46,634][39m Trial 61 finished with value: 0.8041237113402062 and parameters: {'objective': 'Logloss', 'colsample_bylevel': 0.05197896446288202, 'depth': 8, 'boosting_type': 'Ordered', 'bootstrap_type': 'Bayesian', 'bagging_temperature': 7.147834487922684}. Best is trial 8 with value: 0.8539325842696629.
[32m[I 2023-04-26 13:18:51,034][39m Trial 62 finished with value: 0.8210526315789473 and parameters: {'objective': 'CrossEntropy', 'colsample_bylevel': 0.07697751269825048, 'depth': 10, 'boosting_type': 'Ordered', 'bootstrap_type': 'MVS'}. Best is trial 8 with value: 0.8539325842696629.
[32m[I 2023-04-26 13:18:54,622][39m Trial 63 finished with value: 0.8131868131868132 and parameters: {'objective': 'Logloss', 'colsample_bylevel': 0.04416919803033164, 'depth': 8, 'boosting_type': 'Ordered', 'bootstrap_type': 'Bayesian', 'bagging_temperature': 3.177204220229009}. Best is trial 8 with value: 0.8539325842696629.
[32m[I 2023-04-26 13:18:58,194][39m Trial 64 finished with value: 0.8000000000000002 and parameters: {'objective': 'Logloss', 'colsample_bylevel': 0.040202322301663325, 'depth': 9, 'boosting_type': 'Ordered', 'bootstrap_type': 'Bayesian', 'bagging_temperature': 1.709967560483411}. Best is trial 8 with value: 0.8539325842696629.
[32m[I 2023-04-26 13:19:02,784][39m Trial 65 finished with value: 0.8172043010752689 and parameters: {'objective': 'CrossEntropy', 'colsample_bylevel': 0.08712932480653834, 'depth': 7, 'boosting_type': 'Ordered', 'bootstrap_type': 'MVS'}. Best is trial 8 with value: 0.8539325842696629.
[32m[I 2023-04-26 13:19:07,815][39m Trial 66 finished with value: 0.7843137254901961 and parameters: {'objective': 'Logloss', 'colsample_bylevel': 0.05122032552093802, 'depth': 6, 'boosting_type': 'Ordered', 'bootstrap_type': 'Bayesian', 'bagging_temperature': 8.165020692184159}. Best is trial 8 with value: 0.8539325842696629.
[32m[I 2023-04-26 13:19:10,052][39m Trial 67 finished with value: 0.8131868131868132 and parameters: {'objective': 'Logloss', 'colsample_bylevel': 0.07151714156279709, 'depth': 12, 'boosting_type': 'Plain', 'bootstrap_type': 'Bernoulli', 'subsample': 0.9037032133641494}. Best is trial 8 with value: 0.8539325842696629.
