[32m[I 2023-04-26 13:26:11,747][39m Trial 215 finished with value: 0.8666666666666666 and parameters: {'objective': 'CrossEntropy', 'colsample_bylevel': 0.07916800391358532, 'depth': 9, 'boosting_type': 'Plain', 'bootstrap_type': 'MVS'}. Best is trial 141 with value: 0.8791208791208791.
[32m[I 2023-04-26 13:26:14,353][39m Trial 216 finished with value: 0.8444444444444446 and parameters: {'objective': 'CrossEntropy', 'colsample_bylevel': 0.07527024082984292, 'depth': 9, 'boosting_type': 'Plain', 'bootstrap_type': 'MVS'}. Best is trial 141 with value: 0.8791208791208791.
[32m[I 2023-04-26 13:26:15,582][39m Trial 217 finished with value: 0.7619047619047619 and parameters: {'objective': 'CrossEntropy', 'colsample_bylevel': 0.010772512978792073, 'depth': 8, 'boosting_type': 'Plain', 'bootstrap_type': 'MVS'}. Best is trial 141 with value: 0.8791208791208791.
[32m[I 2023-04-26 13:26:18,174][39m Trial 218 finished with value: 0.8444444444444446 and parameters: {'objective': 'CrossEntropy', 'colsample_bylevel': 0.07231551652112646, 'depth': 9, 'boosting_type': 'Plain', 'bootstrap_type': 'MVS'}. Best is trial 141 with value: 0.8791208791208791.
[32m[I 2023-04-26 13:26:20,667][39m Trial 219 finished with value: 0.8695652173913043 and parameters: {'objective': 'CrossEntropy', 'colsample_bylevel': 0.07326471392354078, 'depth': 9, 'boosting_type': 'Plain', 'bootstrap_type': 'MVS'}. Best is trial 141 with value: 0.8791208791208791.
[32m[I 2023-04-26 13:26:22,808][39m Trial 220 finished with value: 0.8131868131868132 and parameters: {'objective': 'CrossEntropy', 'colsample_bylevel': 0.06696603802763554, 'depth': 8, 'boosting_type': 'Plain', 'bootstrap_type': 'MVS'}. Best is trial 141 with value: 0.8791208791208791.
[32m[I 2023-04-26 13:26:25,492][39m Trial 221 finished with value: 0.8666666666666666 and parameters: {'objective': 'CrossEntropy', 'colsample_bylevel': 0.07308022875393513, 'depth': 9, 'boosting_type': 'Plain', 'bootstrap_type': 'MVS'}. Best is trial 141 with value: 0.8791208791208791.
[32m[I 2023-04-26 13:26:28,019][39m Trial 222 finished with value: 0.8695652173913043 and parameters: {'objective': 'CrossEntropy', 'colsample_bylevel': 0.07333909472471635, 'depth': 9, 'boosting_type': 'Plain', 'bootstrap_type': 'MVS'}. Best is trial 141 with value: 0.8791208791208791.
[32m[I 2023-04-26 13:26:30,228][39m Trial 223 finished with value: 0.8666666666666666 and parameters: {'objective': 'CrossEntropy', 'colsample_bylevel': 0.0688725195287838, 'depth': 8, 'boosting_type': 'Plain', 'bootstrap_type': 'MVS'}. Best is trial 141 with value: 0.8791208791208791.
[32m[I 2023-04-26 13:26:32,348][39m Trial 224 finished with value: 0.8571428571428571 and parameters: {'objective': 'CrossEntropy', 'colsample_bylevel': 0.06966241021254418, 'depth': 8, 'boosting_type': 'Plain', 'bootstrap_type': 'MVS'}. Best is trial 141 with value: 0.8791208791208791.
[32m[I 2023-04-26 13:26:34,729][39m Trial 225 finished with value: 0.8666666666666666 and parameters: {'objective': 'CrossEntropy', 'colsample_bylevel': 0.07098936253092984, 'depth': 8, 'boosting_type': 'Plain', 'bootstrap_type': 'MVS'}. Best is trial 141 with value: 0.8791208791208791.
[32m[I 2023-04-26 13:26:37,103][39m Trial 226 finished with value: 0.8666666666666666 and parameters: {'objective': 'CrossEntropy', 'colsample_bylevel': 0.06895243727151487, 'depth': 8, 'boosting_type': 'Plain', 'bootstrap_type': 'MVS'}. Best is trial 141 with value: 0.8791208791208791.
[32m[I 2023-04-26 13:26:39,295][39m Trial 227 finished with value: 0.8444444444444446 and parameters: {'objective': 'CrossEntropy', 'colsample_bylevel': 0.07118011193370123, 'depth': 8, 'boosting_type': 'Plain', 'bootstrap_type': 'MVS'}. Best is trial 141 with value: 0.8791208791208791.
[32m[I 2023-04-26 13:26:42,101][39m Trial 228 finished with value: 0.8409090909090909 and parameters: {'objective': 'CrossEntropy', 'colsample_bylevel': 0.07621738576760854, 'depth': 9, 'boosting_type': 'Plain', 'bootstrap_type': 'Bernoulli', 'subsample': 0.45762370964442856}. Best is trial 141 with value: 0.8791208791208791.
[32m[I 2023-04-26 13:26:43,946][39m Trial 229 finished with value: 0.8571428571428571 and parameters: {'objective': 'CrossEntropy', 'colsample_bylevel': 0.07403028816047313, 'depth': 10, 'boosting_type': 'Plain', 'bootstrap_type': 'MVS'}. Best is trial 141 with value: 0.8791208791208791.
[32m[I 2023-04-26 13:26:46,755][39m Trial 230 finished with value: 0.8666666666666666 and parameters: {'objective': 'CrossEntropy', 'colsample_bylevel': 0.07644580231094453, 'depth': 9, 'boosting_type': 'Plain', 'bootstrap_type': 'MVS'}. Best is trial 141 with value: 0.8791208791208791.
[32m[I 2023-04-26 13:26:48,926][39m Trial 231 finished with value: 0.8444444444444446 and parameters: {'objective': 'CrossEntropy', 'colsample_bylevel': 0.07034172468893427, 'depth': 8, 'boosting_type': 'Plain', 'bootstrap_type': 'MVS'}. Best is trial 141 with value: 0.8791208791208791.
[32m[I 2023-04-26 13:26:51,400][39m Trial 232 finished with value: 0.8444444444444446 and parameters: {'objective': 'CrossEntropy', 'colsample_bylevel': 0.07271277301172953, 'depth': 9, 'boosting_type': 'Plain', 'bootstrap_type': 'MVS'}. Best is trial 141 with value: 0.8791208791208791.
[32m[I 2023-04-26 13:26:53,855][39m Trial 233 finished with value: 0.8444444444444446 and parameters: {'objective': 'CrossEntropy', 'colsample_bylevel': 0.07399858077002923, 'depth': 9, 'boosting_type': 'Plain', 'bootstrap_type': 'MVS'}. Best is trial 141 with value: 0.8791208791208791.
[32m[I 2023-04-26 13:26:56,431][39m Trial 234 finished with value: 0.8539325842696629 and parameters: {'objective': 'CrossEntropy', 'colsample_bylevel': 0.07137481997818942, 'depth': 9, 'boosting_type': 'Plain', 'bootstrap_type': 'MVS'}. Best is trial 141 with value: 0.8791208791208791.
[32m[I 2023-04-26 13:26:59,184][39m Trial 235 finished with value: 0.8666666666666666 and parameters: {'objective': 'CrossEntropy', 'colsample_bylevel': 0.07562243581854168, 'depth': 9, 'boosting_type': 'Plain', 'bootstrap_type': 'MVS'}. Best is trial 141 with value: 0.8791208791208791.
[32m[I 2023-04-26 13:27:02,121][39m Trial 236 finished with value: 0.8444444444444446 and parameters: {'objective': 'CrossEntropy', 'colsample_bylevel': 0.0754758262803191, 'depth': 9, 'boosting_type': 'Plain', 'bootstrap_type': 'MVS'}. Best is trial 141 with value: 0.8791208791208791.
[32m[I 2023-04-26 13:27:04,692][39m Trial 237 finished with value: 0.8666666666666666 and parameters: {'objective': 'CrossEntropy', 'colsample_bylevel': 0.07304921709010295, 'depth': 9, 'boosting_type': 'Plain', 'bootstrap_type': 'MVS'}. Best is trial 141 with value: 0.8791208791208791.
[32m[I 2023-04-26 13:27:07,312][39m Trial 238 finished with value: 0.8666666666666666 and parameters: {'objective': 'CrossEntropy', 'colsample_bylevel': 0.07309010669441694, 'depth': 9, 'boosting_type': 'Plain', 'bootstrap_type': 'MVS'}. Best is trial 141 with value: 0.8791208791208791.
[32m[I 2023-04-26 13:27:09,926][39m Trial 239 finished with value: 0.8666666666666666 and parameters: {'objective': 'CrossEntropy', 'colsample_bylevel': 0.0774254113233732, 'depth': 9, 'boosting_type': 'Plain', 'bootstrap_type': 'MVS'}. Best is trial 141 with value: 0.8791208791208791.
[32m[I 2023-04-26 13:27:12,696][39m Trial 240 finished with value: 0.8539325842696629 and parameters: {'objective': 'CrossEntropy', 'colsample_bylevel': 0.0800475910516732, 'depth': 9, 'boosting_type': 'Plain', 'bootstrap_type': 'MVS'}. Best is trial 141 with value: 0.8791208791208791.
[32m[I 2023-04-26 13:27:14,553][39m Trial 241 finished with value: 0.8571428571428571 and parameters: {'objective': 'CrossEntropy', 'colsample_bylevel': 0.07803251372367744, 'depth': 10, 'boosting_type': 'Plain', 'bootstrap_type': 'MVS'}. Best is trial 141 with value: 0.8791208791208791.
[32m[I 2023-04-26 13:27:16,782][39m Trial 242 finished with value: 0.8571428571428571 and parameters: {'objective': 'CrossEntropy', 'colsample_bylevel': 0.06806698788287156, 'depth': 8, 'boosting_type': 'Plain', 'bootstrap_type': 'MVS'}. Best is trial 141 with value: 0.8791208791208791.
[32m[I 2023-04-26 13:27:19,319][39m Trial 243 finished with value: 0.8444444444444446 and parameters: {'objective': 'CrossEntropy', 'colsample_bylevel': 0.07189602296544705, 'depth': 9, 'boosting_type': 'Plain', 'bootstrap_type': 'MVS'}. Best is trial 141 with value: 0.8791208791208791.
[32m[I 2023-04-26 13:27:21,774][39m Trial 244 finished with value: 0.8571428571428571 and parameters: {'objective': 'CrossEntropy', 'colsample_bylevel': 0.07438231279372505, 'depth': 9, 'boosting_type': 'Plain', 'bootstrap_type': 'MVS'}. Best is trial 141 with value: 0.8791208791208791.
[32m[I 2023-04-26 13:27:23,624][39m Trial 245 finished with value: 0.8571428571428571 and parameters: {'objective': 'CrossEntropy', 'colsample_bylevel': 0.07121032883783256, 'depth': 10, 'boosting_type': 'Plain', 'bootstrap_type': 'MVS'}. Best is trial 141 with value: 0.8791208791208791.
[32m[I 2023-04-26 13:27:26,015][39m Trial 246 finished with value: 0.8444444444444446 and parameters: {'objective': 'CrossEntropy', 'colsample_bylevel': 0.07244577873910636, 'depth': 9, 'boosting_type': 'Plain', 'bootstrap_type': 'MVS'}. Best is trial 141 with value: 0.8791208791208791.
[32m[I 2023-04-26 13:27:28,744][39m Trial 247 finished with value: 0.8571428571428571 and parameters: {'objective': 'CrossEntropy', 'colsample_bylevel': 0.07502694677014016, 'depth': 9, 'boosting_type': 'Plain', 'bootstrap_type': 'MVS'}. Best is trial 141 with value: 0.8791208791208791.
[32m[I 2023-04-26 13:27:31,327][39m Trial 248 finished with value: 0.8387096774193549 and parameters: {'objective': 'CrossEntropy', 'colsample_bylevel': 0.06997898644445279, 'depth': 9, 'boosting_type': 'Plain', 'bootstrap_type': 'MVS'}. Best is trial 141 with value: 0.8791208791208791.
[32m[I 2023-04-26 13:27:33,702][39m Trial 249 finished with value: 0.8571428571428571 and parameters: {'objective': 'CrossEntropy', 'colsample_bylevel': 0.07431249167468908, 'depth': 9, 'boosting_type': 'Plain', 'bootstrap_type': 'MVS'}. Best is trial 141 with value: 0.8791208791208791.
[32m[I 2023-04-26 13:27:36,338][39m Trial 250 finished with value: 0.8666666666666666 and parameters: {'objective': 'CrossEntropy', 'colsample_bylevel': 0.07299031835753057, 'depth': 9, 'boosting_type': 'Plain', 'bootstrap_type': 'MVS'}. Best is trial 141 with value: 0.8791208791208791.
[32m[I 2023-04-26 13:27:38,499][39m Trial 251 finished with value: 0.8260869565217392 and parameters: {'objective': 'CrossEntropy', 'colsample_bylevel': 0.06745009540305369, 'depth': 8, 'boosting_type': 'Plain', 'bootstrap_type': 'MVS'}. Best is trial 141 with value: 0.8791208791208791.
[32m[I 2023-04-26 13:27:40,995][39m Trial 252 finished with value: 0.8571428571428571 and parameters: {'objective': 'CrossEntropy', 'colsample_bylevel': 0.07050044980973207, 'depth': 9, 'boosting_type': 'Plain', 'bootstrap_type': 'MVS'}. Best is trial 141 with value: 0.8791208791208791.
[32m[I 2023-04-26 13:27:43,037][39m Trial 253 finished with value: 0.8571428571428571 and parameters: {'objective': 'CrossEntropy', 'colsample_bylevel': 0.06611268490974347, 'depth': 8, 'boosting_type': 'Plain', 'bootstrap_type': 'MVS'}. Best is trial 141 with value: 0.8791208791208791.
[32m[I 2023-04-26 13:27:45,251][39m Trial 254 finished with value: 0.8666666666666666 and parameters: {'objective': 'CrossEntropy', 'colsample_bylevel': 0.06884604262779548, 'depth': 8, 'boosting_type': 'Plain', 'bootstrap_type': 'MVS'}. Best is trial 141 with value: 0.8791208791208791.
[32m[I 2023-04-26 13:27:47,461][39m Trial 255 finished with value: 0.8571428571428571 and parameters: {'objective': 'CrossEntropy', 'colsample_bylevel': 0.06963763614417938, 'depth': 8, 'boosting_type': 'Plain', 'bootstrap_type': 'MVS'}. Best is trial 141 with value: 0.8791208791208791.
[32m[I 2023-04-26 13:27:49,727][39m Trial 256 finished with value: 0.8539325842696629 and parameters: {'objective': 'CrossEntropy', 'colsample_bylevel': 0.07121893371181698, 'depth': 9, 'boosting_type': 'Plain', 'bootstrap_type': 'MVS'}. Best is trial 141 with value: 0.8791208791208791.
[32m[I 2023-04-26 13:27:50,953][39m Trial 257 finished with value: 0.7692307692307692 and parameters: {'objective': 'CrossEntropy', 'colsample_bylevel': 0.02304613631382635, 'depth': 1, 'boosting_type': 'Plain', 'bootstrap_type': 'MVS'}. Best is trial 141 with value: 0.8791208791208791.
[32m[I 2023-04-26 13:27:52,792][39m Trial 258 finished with value: 0.8695652173913043 and parameters: {'objective': 'CrossEntropy', 'colsample_bylevel': 0.07381168373136876, 'depth': 10, 'boosting_type': 'Plain', 'bootstrap_type': 'MVS'}. Best is trial 141 with value: 0.8791208791208791.
[32m[I 2023-04-26 13:27:55,257][39m Trial 259 finished with value: 0.8571428571428571 and parameters: {'objective': 'CrossEntropy', 'colsample_bylevel': 0.0758183401838973, 'depth': 8, 'boosting_type': 'Plain', 'bootstrap_type': 'Bernoulli', 'subsample': 0.8523200431793284}. Best is trial 141 with value: 0.8791208791208791.
[32m[I 2023-04-26 13:27:58,089][39m Trial 260 finished with value: 0.8666666666666666 and parameters: {'objective': 'CrossEntropy', 'colsample_bylevel': 0.07290129071165975, 'depth': 9, 'boosting_type': 'Plain', 'bootstrap_type': 'MVS'}. Best is trial 141 with value: 0.8791208791208791.
[32m[I 2023-04-26 13:28:01,194][39m Trial 261 finished with value: 0.8666666666666666 and parameters: {'objective': 'CrossEntropy', 'colsample_bylevel': 0.07923226567566843, 'depth': 9, 'boosting_type': 'Plain', 'bootstrap_type': 'MVS'}. Best is trial 141 with value: 0.8791208791208791.
[32m[I 2023-04-26 13:28:03,664][39m Trial 262 finished with value: 0.8444444444444446 and parameters: {'objective': 'CrossEntropy', 'colsample_bylevel': 0.0706909127610291, 'depth': 9, 'boosting_type': 'Plain', 'bootstrap_type': 'MVS'}. Best is trial 141 with value: 0.8791208791208791.
[32m[I 2023-04-26 13:28:05,899][39m Trial 263 finished with value: 0.8695652173913043 and parameters: {'objective': 'CrossEntropy', 'colsample_bylevel': 0.06788383565222865, 'depth': 8, 'boosting_type': 'Plain', 'bootstrap_type': 'MVS'}. Best is trial 141 with value: 0.8791208791208791.
[32m[I 2023-04-26 13:28:07,998][39m Trial 264 finished with value: 0.8666666666666666 and parameters: {'objective': 'CrossEntropy', 'colsample_bylevel': 0.07207304493350973, 'depth': 7, 'boosting_type': 'Plain', 'bootstrap_type': 'MVS'}. Best is trial 141 with value: 0.8791208791208791.
[32m[I 2023-04-26 13:28:09,966][39m Trial 265 finished with value: 0.8444444444444446 and parameters: {'objective': 'CrossEntropy', 'colsample_bylevel': 0.06671200513804927, 'depth': 8, 'boosting_type': 'Plain', 'bootstrap_type': 'MVS'}. Best is trial 141 with value: 0.8791208791208791.
[32m[I 2023-04-26 13:28:11,756][39m Trial 266 finished with value: 0.8387096774193549 and parameters: {'objective': 'CrossEntropy', 'colsample_bylevel': 0.06859305806295536, 'depth': 10, 'boosting_type': 'Plain', 'bootstrap_type': 'MVS'}. Best is trial 141 with value: 0.8791208791208791.
[32m[I 2023-04-26 13:28:14,514][39m Trial 267 finished with value: 0.8444444444444446 and parameters: {'objective': 'CrossEntropy', 'colsample_bylevel': 0.07837903452929565, 'depth': 9, 'boosting_type': 'Plain', 'bootstrap_type': 'MVS'}. Best is trial 141 with value: 0.8791208791208791.
[32m[I 2023-04-26 13:28:17,369][39m Trial 268 finished with value: 0.8539325842696629 and parameters: {'objective': 'CrossEntropy', 'colsample_bylevel': 0.07703687207956343, 'depth': 9, 'boosting_type': 'Plain', 'bootstrap_type': 'MVS'}. Best is trial 141 with value: 0.8791208791208791.
[32m[I 2023-04-26 13:28:19,187][39m Trial 269 finished with value: 0.8444444444444446 and parameters: {'objective': 'CrossEntropy', 'colsample_bylevel': 0.07427417097333827, 'depth': 10, 'boosting_type': 'Plain', 'bootstrap_type': 'MVS'}. Best is trial 141 with value: 0.8791208791208791.
[32m[I 2023-04-26 13:28:21,695][39m Trial 270 finished with value: 0.8666666666666666 and parameters: {'objective': 'CrossEntropy', 'colsample_bylevel': 0.08072215755495618, 'depth': 8, 'boosting_type': 'Plain', 'bootstrap_type': 'MVS'}. Best is trial 141 with value: 0.8791208791208791.
[32m[I 2023-04-26 13:28:24,150][39m Trial 271 finished with value: 0.8444444444444446 and parameters: {'objective': 'CrossEntropy', 'colsample_bylevel': 0.07505882089685958, 'depth': 8, 'boosting_type': 'Plain', 'bootstrap_type': 'MVS'}. Best is trial 141 with value: 0.8791208791208791.
[32m[I 2023-04-26 13:28:26,209][39m Trial 272 finished with value: 0.8260869565217392 and parameters: {'objective': 'CrossEntropy', 'colsample_bylevel': 0.06730449744575409, 'depth': 8, 'boosting_type': 'Plain', 'bootstrap_type': 'MVS'}. Best is trial 141 with value: 0.8791208791208791.
[32m[I 2023-04-26 13:28:28,411][39m Trial 273 finished with value: 0.8666666666666666 and parameters: {'objective': 'CrossEntropy', 'colsample_bylevel': 0.06993695605759939, 'depth': 8, 'boosting_type': 'Plain', 'bootstrap_type': 'MVS'}. Best is trial 141 with value: 0.8791208791208791.
[32m[I 2023-04-26 13:28:30,504][39m Trial 274 finished with value: 0.8666666666666666 and parameters: {'objective': 'CrossEntropy', 'colsample_bylevel': 0.07146317424714511, 'depth': 7, 'boosting_type': 'Plain', 'bootstrap_type': 'MVS'}. Best is trial 141 with value: 0.8791208791208791.
[32m[I 2023-04-26 13:28:32,568][39m Trial 275 finished with value: 0.8387096774193549 and parameters: {'objective': 'CrossEntropy', 'colsample_bylevel': 0.06442992769136814, 'depth': 8, 'boosting_type': 'Plain', 'bootstrap_type': 'MVS'}. Best is trial 141 with value: 0.8791208791208791.
[32m[I 2023-04-26 13:28:35,438][39m Trial 276 finished with value: 0.8571428571428571 and parameters: {'objective': 'CrossEntropy', 'colsample_bylevel': 0.07685239468294347, 'depth': 9, 'boosting_type': 'Plain', 'bootstrap_type': 'MVS'}. Best is trial 141 with value: 0.8791208791208791.
[32m[I 2023-04-26 13:28:39,031][39m Trial 277 finished with value: 0.8539325842696629 and parameters: {'objective': 'CrossEntropy', 'colsample_bylevel': 0.07613156595256464, 'depth': 9, 'boosting_type': 'Plain', 'bootstrap_type': 'MVS'}. Best is trial 141 with value: 0.8791208791208791.
[32m[I 2023-04-26 13:28:42,724][39m Trial 278 finished with value: 0.8666666666666666 and parameters: {'objective': 'CrossEntropy', 'colsample_bylevel': 0.08229956693274512, 'depth': 8, 'boosting_type': 'Plain', 'bootstrap_type': 'MVS'}. Best is trial 141 with value: 0.8791208791208791.
[32m[I 2023-04-26 13:28:45,075][39m Trial 279 finished with value: 0.8260869565217392 and parameters: {'objective': 'CrossEntropy', 'colsample_bylevel': 0.07277624454190132, 'depth': 7, 'boosting_type': 'Plain', 'bootstrap_type': 'Bernoulli', 'subsample': 0.629801968666145}. Best is trial 141 with value: 0.8791208791208791.
[32m[I 2023-04-26 13:28:47,396][39m Trial 280 finished with value: 0.8636363636363636 and parameters: {'objective': 'CrossEntropy', 'colsample_bylevel': 0.08674064620643722, 'depth': 10, 'boosting_type': 'Plain', 'bootstrap_type': 'MVS'}. Best is trial 141 with value: 0.8791208791208791.
[32m[I 2023-04-26 13:28:49,997][39m Trial 281 finished with value: 0.8444444444444446 and parameters: {'objective': 'CrossEntropy', 'colsample_bylevel': 0.07418584485756607, 'depth': 9, 'boosting_type': 'Plain', 'bootstrap_type': 'MVS'}. Best is trial 141 with value: 0.8791208791208791.
[32m[I 2023-04-26 13:28:53,023][39m Trial 282 finished with value: 0.8444444444444446 and parameters: {'objective': 'CrossEntropy', 'colsample_bylevel': 0.07531507860083242, 'depth': 9, 'boosting_type': 'Plain', 'bootstrap_type': 'MVS'}. Best is trial 141 with value: 0.8791208791208791.
[32m[I 2023-04-26 13:28:55,207][39m Trial 283 finished with value: 0.8444444444444446 and parameters: {'objective': 'CrossEntropy', 'colsample_bylevel': 0.07035423030396486, 'depth': 8, 'boosting_type': 'Plain', 'bootstrap_type': 'MVS'}. Best is trial 141 with value: 0.8791208791208791.
[32m[I 2023-04-26 13:28:58,327][39m Trial 284 finished with value: 0.8666666666666666 and parameters: {'objective': 'CrossEntropy', 'colsample_bylevel': 0.07377695693294815, 'depth': 9, 'boosting_type': 'Plain', 'bootstrap_type': 'MVS'}. Best is trial 141 with value: 0.8791208791208791.
[32m[I 2023-04-26 13:29:00,555][39m Trial 285 finished with value: 0.8387096774193549 and parameters: {'objective': 'CrossEntropy', 'colsample_bylevel': 0.06319823309096324, 'depth': 8, 'boosting_type': 'Plain', 'bootstrap_type': 'MVS'}. Best is trial 141 with value: 0.8791208791208791.
[32m[I 2023-04-26 13:29:03,405][39m Trial 286 finished with value: 0.8571428571428571 and parameters: {'objective': 'CrossEntropy', 'colsample_bylevel': 0.07727800222198572, 'depth': 8, 'boosting_type': 'Plain', 'bootstrap_type': 'MVS'}. Best is trial 141 with value: 0.8791208791208791.
[32m[I 2023-04-26 13:29:06,169][39m Trial 287 finished with value: 0.8444444444444446 and parameters: {'objective': 'CrossEntropy', 'colsample_bylevel': 0.07243989476594487, 'depth': 9, 'boosting_type': 'Plain', 'bootstrap_type': 'MVS'}. Best is trial 141 with value: 0.8791208791208791.
[32m[I 2023-04-26 13:29:09,158][39m Trial 288 finished with value: 0.8444444444444446 and parameters: {'objective': 'CrossEntropy', 'colsample_bylevel': 0.07277901121272388, 'depth': 9, 'boosting_type': 'Plain', 'bootstrap_type': 'MVS'}. Best is trial 141 with value: 0.8791208791208791.
[32m[I 2023-04-26 13:29:11,381][39m Trial 289 finished with value: 0.8387096774193549 and parameters: {'objective': 'CrossEntropy', 'colsample_bylevel': 0.06854924288673227, 'depth': 8, 'boosting_type': 'Plain', 'bootstrap_type': 'MVS'}. Best is trial 141 with value: 0.8791208791208791.
