[32m[I 2023-04-26 13:32:16,926][39m Trial 363 finished with value: 0.8863636363636364 and parameters: {'objective': 'CrossEntropy', 'colsample_bylevel': 0.09757407058291624, 'depth': 10, 'boosting_type': 'Plain', 'bootstrap_type': 'Bernoulli', 'subsample': 0.7147931789533939}. Best is trial 342 with value: 0.888888888888889.
[32m[I 2023-04-26 13:32:19,398][39m Trial 364 finished with value: 0.8764044943820225 and parameters: {'objective': 'CrossEntropy', 'colsample_bylevel': 0.09757458667106006, 'depth': 10, 'boosting_type': 'Plain', 'bootstrap_type': 'Bernoulli', 'subsample': 0.7003996549903366}. Best is trial 342 with value: 0.888888888888889.
[32m[I 2023-04-26 13:32:22,152][39m Trial 365 finished with value: 0.8764044943820225 and parameters: {'objective': 'CrossEntropy', 'colsample_bylevel': 0.09726485540543651, 'depth': 10, 'boosting_type': 'Plain', 'bootstrap_type': 'Bernoulli', 'subsample': 0.6902760433009515}. Best is trial 342 with value: 0.888888888888889.
[32m[I 2023-04-26 13:32:25,418][39m Trial 366 finished with value: 0.8666666666666666 and parameters: {'objective': 'CrossEntropy', 'colsample_bylevel': 0.09747206645525001, 'depth': 10, 'boosting_type': 'Plain', 'bootstrap_type': 'Bernoulli', 'subsample': 0.7016244325835316}. Best is trial 342 with value: 0.888888888888889.
[32m[I 2023-04-26 13:32:28,437][39m Trial 367 finished with value: 0.8764044943820225 and parameters: {'objective': 'CrossEntropy', 'colsample_bylevel': 0.09711462003288518, 'depth': 10, 'boosting_type': 'Plain', 'bootstrap_type': 'Bernoulli', 'subsample': 0.6687686585291248}. Best is trial 342 with value: 0.888888888888889.
[32m[I 2023-04-26 13:32:31,230][39m Trial 368 finished with value: 0.8764044943820225 and parameters: {'objective': 'CrossEntropy', 'colsample_bylevel': 0.09263852894837211, 'depth': 10, 'boosting_type': 'Plain', 'bootstrap_type': 'Bernoulli', 'subsample': 0.6670329113217819}. Best is trial 342 with value: 0.888888888888889.
[32m[I 2023-04-26 13:32:33,787][39m Trial 369 finished with value: 0.8444444444444446 and parameters: {'objective': 'CrossEntropy', 'colsample_bylevel': 0.09314988210963009, 'depth': 10, 'boosting_type': 'Plain', 'bootstrap_type': 'Bernoulli', 'subsample': 0.6974228198556236}. Best is trial 342 with value: 0.888888888888889.
[32m[I 2023-04-26 13:32:36,629][39m Trial 370 finished with value: 0.8666666666666666 and parameters: {'objective': 'CrossEntropy', 'colsample_bylevel': 0.09663744530621714, 'depth': 10, 'boosting_type': 'Plain', 'bootstrap_type': 'Bernoulli', 'subsample': 0.648051933307313}. Best is trial 342 with value: 0.888888888888889.
[32m[I 2023-04-26 13:32:39,355][39m Trial 371 finished with value: 0.8764044943820225 and parameters: {'objective': 'CrossEntropy', 'colsample_bylevel': 0.09989010405929233, 'depth': 10, 'boosting_type': 'Plain', 'bootstrap_type': 'Bernoulli', 'subsample': 0.6539290714925821}. Best is trial 342 with value: 0.888888888888889.
[32m[I 2023-04-26 13:32:42,161][39m Trial 372 finished with value: 0.8764044943820225 and parameters: {'objective': 'CrossEntropy', 'colsample_bylevel': 0.09974977038674808, 'depth': 10, 'boosting_type': 'Plain', 'bootstrap_type': 'Bernoulli', 'subsample': 0.6612363785130888}. Best is trial 342 with value: 0.888888888888889.
[32m[I 2023-04-26 13:32:44,780][39m Trial 373 finished with value: 0.8764044943820225 and parameters: {'objective': 'CrossEntropy', 'colsample_bylevel': 0.0999661017030774, 'depth': 10, 'boosting_type': 'Plain', 'bootstrap_type': 'Bernoulli', 'subsample': 0.6613689586492193}. Best is trial 342 with value: 0.888888888888889.
[32m[I 2023-04-26 13:32:47,373][39m Trial 374 finished with value: 0.8764044943820225 and parameters: {'objective': 'CrossEntropy', 'colsample_bylevel': 0.0977491920597309, 'depth': 10, 'boosting_type': 'Plain', 'bootstrap_type': 'Bernoulli', 'subsample': 0.6597277350733066}. Best is trial 342 with value: 0.888888888888889.
[32m[I 2023-04-26 13:32:50,215][39m Trial 375 finished with value: 0.8666666666666666 and parameters: {'objective': 'CrossEntropy', 'colsample_bylevel': 0.09772542716738103, 'depth': 11, 'boosting_type': 'Plain', 'bootstrap_type': 'Bernoulli', 'subsample': 0.6598670646219001}. Best is trial 342 with value: 0.888888888888889.
[32m[I 2023-04-26 13:32:52,793][39m Trial 376 finished with value: 0.8539325842696629 and parameters: {'objective': 'CrossEntropy', 'colsample_bylevel': 0.09621736437582248, 'depth': 10, 'boosting_type': 'Plain', 'bootstrap_type': 'Bernoulli', 'subsample': 0.6587728816720249}. Best is trial 342 with value: 0.888888888888889.
[32m[I 2023-04-26 13:32:55,143][39m Trial 377 finished with value: 0.8666666666666666 and parameters: {'objective': 'CrossEntropy', 'colsample_bylevel': 0.09331437871850781, 'depth': 10, 'boosting_type': 'Plain', 'bootstrap_type': 'Bernoulli', 'subsample': 0.7034457893848948}. Best is trial 342 with value: 0.888888888888889.
[32m[I 2023-04-26 13:32:57,695][39m Trial 378 finished with value: 0.8666666666666666 and parameters: {'objective': 'CrossEntropy', 'colsample_bylevel': 0.09783000885372124, 'depth': 10, 'boosting_type': 'Plain', 'bootstrap_type': 'Bernoulli', 'subsample': 0.6007137507837804}. Best is trial 342 with value: 0.888888888888889.
[32m[I 2023-04-26 13:33:00,444][39m Trial 379 finished with value: 0.8666666666666666 and parameters: {'objective': 'CrossEntropy', 'colsample_bylevel': 0.09975808031147591, 'depth': 10, 'boosting_type': 'Plain', 'bootstrap_type': 'Bernoulli', 'subsample': 0.7477431470929494}. Best is trial 342 with value: 0.888888888888889.
[32m[I 2023-04-26 13:33:03,122][39m Trial 380 finished with value: 0.8470588235294119 and parameters: {'objective': 'CrossEntropy', 'colsample_bylevel': 0.09521442883404181, 'depth': 10, 'boosting_type': 'Plain', 'bootstrap_type': 'Bernoulli', 'subsample': 0.6797980009190311}. Best is trial 342 with value: 0.888888888888889.
[32m[I 2023-04-26 13:33:05,711][39m Trial 381 finished with value: 0.8735632183908046 and parameters: {'objective': 'CrossEntropy', 'colsample_bylevel': 0.09795911213564061, 'depth': 10, 'boosting_type': 'Plain', 'bootstrap_type': 'Bernoulli', 'subsample': 0.625479720769789}. Best is trial 342 with value: 0.888888888888889.
[32m[I 2023-04-26 13:33:08,432][39m Trial 382 finished with value: 0.8863636363636364 and parameters: {'objective': 'CrossEntropy', 'colsample_bylevel': 0.09996610048528654, 'depth': 10, 'boosting_type': 'Plain', 'bootstrap_type': 'Bernoulli', 'subsample': 0.7251628739476891}. Best is trial 342 with value: 0.888888888888889.
[32m[I 2023-04-26 13:33:10,994][39m Trial 383 finished with value: 0.8863636363636364 and parameters: {'objective': 'CrossEntropy', 'colsample_bylevel': 0.09713194813381698, 'depth': 11, 'boosting_type': 'Plain', 'bootstrap_type': 'Bernoulli', 'subsample': 0.7880217650068467}. Best is trial 342 with value: 0.888888888888889.
[32m[I 2023-04-26 13:33:13,581][39m Trial 384 finished with value: 0.8505747126436782 and parameters: {'objective': 'CrossEntropy', 'colsample_bylevel': 0.09549544015722145, 'depth': 11, 'boosting_type': 'Plain', 'bootstrap_type': 'Bernoulli', 'subsample': 0.8091110868418285}. Best is trial 342 with value: 0.888888888888889.
[32m[I 2023-04-26 13:33:16,398][39m Trial 385 finished with value: 0.888888888888889 and parameters: {'objective': 'CrossEntropy', 'colsample_bylevel': 0.09735995776407519, 'depth': 11, 'boosting_type': 'Plain', 'bootstrap_type': 'Bernoulli', 'subsample': 0.7336368937727924}. Best is trial 342 with value: 0.888888888888889.
[32m[I 2023-04-26 13:33:18,896][39m Trial 386 finished with value: 0.8764044943820225 and parameters: {'objective': 'CrossEntropy', 'colsample_bylevel': 0.09383924566294441, 'depth': 11, 'boosting_type': 'Plain', 'bootstrap_type': 'Bernoulli', 'subsample': 0.7170040226809665}. Best is trial 342 with value: 0.888888888888889.
[32m[I 2023-04-26 13:33:21,449][39m Trial 387 finished with value: 0.8539325842696629 and parameters: {'objective': 'CrossEntropy', 'colsample_bylevel': 0.09505751437804333, 'depth': 11, 'boosting_type': 'Plain', 'bootstrap_type': 'Bernoulli', 'subsample': 0.7447290446741149}. Best is trial 342 with value: 0.888888888888889.
[32m[I 2023-04-26 13:33:23,828][39m Trial 388 finished with value: 0.8764044943820225 and parameters: {'objective': 'CrossEntropy', 'colsample_bylevel': 0.08942282135299887, 'depth': 11, 'boosting_type': 'Plain', 'bootstrap_type': 'Bernoulli', 'subsample': 0.7310122469146294}. Best is trial 342 with value: 0.888888888888889.
[32m[I 2023-04-26 13:33:26,421][39m Trial 389 finished with value: 0.8666666666666666 and parameters: {'objective': 'CrossEntropy', 'colsample_bylevel': 0.0959660841240061, 'depth': 11, 'boosting_type': 'Plain', 'bootstrap_type': 'Bernoulli', 'subsample': 0.7239707716218451}. Best is trial 342 with value: 0.888888888888889.
[32m[I 2023-04-26 13:33:28,994][39m Trial 390 finished with value: 0.8764044943820225 and parameters: {'objective': 'CrossEntropy', 'colsample_bylevel': 0.09704516477408354, 'depth': 11, 'boosting_type': 'Plain', 'bootstrap_type': 'Bernoulli', 'subsample': 0.7783527003652443}. Best is trial 342 with value: 0.888888888888889.
[32m[I 2023-04-26 13:33:31,493][39m Trial 391 finished with value: 0.8764044943820225 and parameters: {'objective': 'CrossEntropy', 'colsample_bylevel': 0.09247652788721596, 'depth': 11, 'boosting_type': 'Plain', 'bootstrap_type': 'Bernoulli', 'subsample': 0.7757930841544747}. Best is trial 342 with value: 0.888888888888889.
[32m[I 2023-04-26 13:33:33,880][39m Trial 392 finished with value: 0.8764044943820225 and parameters: {'objective': 'CrossEntropy', 'colsample_bylevel': 0.09153647904358145, 'depth': 12, 'boosting_type': 'Plain', 'bootstrap_type': 'Bernoulli', 'subsample': 0.7805036663590624}. Best is trial 342 with value: 0.888888888888889.
[32m[I 2023-04-26 13:33:36,458][39m Trial 393 finished with value: 0.8666666666666666 and parameters: {'objective': 'CrossEntropy', 'colsample_bylevel': 0.09184495437072188, 'depth': 12, 'boosting_type': 'Plain', 'bootstrap_type': 'Bernoulli', 'subsample': 0.7947287777611728}. Best is trial 342 with value: 0.888888888888889.
[32m[I 2023-04-26 13:33:39,058][39m Trial 394 finished with value: 0.8764044943820225 and parameters: {'objective': 'CrossEntropy', 'colsample_bylevel': 0.09288208426722255, 'depth': 12, 'boosting_type': 'Plain', 'bootstrap_type': 'Bernoulli', 'subsample': 0.7681640858125663}. Best is trial 342 with value: 0.888888888888889.
[32m[I 2023-04-26 13:33:41,786][39m Trial 395 finished with value: 0.8539325842696629 and parameters: {'objective': 'CrossEntropy', 'colsample_bylevel': 0.09674938314247979, 'depth': 12, 'boosting_type': 'Plain', 'bootstrap_type': 'Bernoulli', 'subsample': 0.8206573883625091}. Best is trial 342 with value: 0.888888888888889.
[32m[I 2023-04-26 13:33:44,330][39m Trial 396 finished with value: 0.8636363636363636 and parameters: {'objective': 'CrossEntropy', 'colsample_bylevel': 0.09791604477386845, 'depth': 12, 'boosting_type': 'Plain', 'bootstrap_type': 'Bernoulli', 'subsample': 0.8761086475657507}. Best is trial 342 with value: 0.888888888888889.
[32m[I 2023-04-26 13:33:47,004][39m Trial 397 finished with value: 0.8764044943820225 and parameters: {'objective': 'Logloss', 'colsample_bylevel': 0.09993442118700245, 'depth': 10, 'boosting_type': 'Plain', 'bootstrap_type': 'Bernoulli', 'subsample': 0.6809001404465191}. Best is trial 342 with value: 0.888888888888889.
[32m[I 2023-04-26 13:33:49,494][39m Trial 398 finished with value: 0.8636363636363636 and parameters: {'objective': 'CrossEntropy', 'colsample_bylevel': 0.09894530208085912, 'depth': 10, 'boosting_type': 'Plain', 'bootstrap_type': 'Bernoulli', 'subsample': 0.9537949246096024}. Best is trial 342 with value: 0.888888888888889.
[32m[I 2023-04-26 13:33:51,911][39m Trial 399 finished with value: 0.8539325842696629 and parameters: {'objective': 'Logloss', 'colsample_bylevel': 0.08914136772713582, 'depth': 12, 'boosting_type': 'Plain', 'bootstrap_type': 'Bernoulli', 'subsample': 0.7664284928090576}. Best is trial 342 with value: 0.888888888888889.
[32m[I 2023-04-26 13:33:54,488][39m Trial 400 finished with value: 0.8666666666666666 and parameters: {'objective': 'CrossEntropy', 'colsample_bylevel': 0.09777063402523771, 'depth': 10, 'boosting_type': 'Plain', 'bootstrap_type': 'Bernoulli', 'subsample': 0.6315093353653599}. Best is trial 342 with value: 0.888888888888889.
[32m[I 2023-04-26 13:33:57,130][39m Trial 401 finished with value: 0.8636363636363636 and parameters: {'objective': 'CrossEntropy', 'colsample_bylevel': 0.09989306613292857, 'depth': 10, 'boosting_type': 'Plain', 'bootstrap_type': 'Bernoulli', 'subsample': 0.9530227855500168}. Best is trial 342 with value: 0.888888888888889.
[32m[I 2023-04-26 13:33:59,455][39m Trial 402 finished with value: 0.8666666666666666 and parameters: {'objective': 'CrossEntropy', 'colsample_bylevel': 0.09475625625155049, 'depth': 10, 'boosting_type': 'Plain', 'bootstrap_type': 'Bernoulli', 'subsample': 0.8906127509923326}. Best is trial 342 with value: 0.888888888888889.
[32m[I 2023-04-26 13:34:01,926][39m Trial 403 finished with value: 0.8764044943820225 and parameters: {'objective': 'CrossEntropy', 'colsample_bylevel': 0.09318476230304316, 'depth': 11, 'boosting_type': 'Plain', 'bootstrap_type': 'Bernoulli', 'subsample': 0.7688477464529593}. Best is trial 342 with value: 0.888888888888889.
[32m[I 2023-04-26 13:34:04,265][39m Trial 404 finished with value: 0.8666666666666666 and parameters: {'objective': 'CrossEntropy', 'colsample_bylevel': 0.08977799512719772, 'depth': 11, 'boosting_type': 'Plain', 'bootstrap_type': 'Bernoulli', 'subsample': 0.8208292082747237}. Best is trial 342 with value: 0.888888888888889.
[32m[I 2023-04-26 13:34:06,934][39m Trial 405 finished with value: 0.8666666666666666 and parameters: {'objective': 'Logloss', 'colsample_bylevel': 0.09626804543498703, 'depth': 11, 'boosting_type': 'Plain', 'bootstrap_type': 'Bernoulli', 'subsample': 0.7271299795348509}. Best is trial 342 with value: 0.888888888888889.
[32m[I 2023-04-26 13:34:09,522][39m Trial 406 finished with value: 0.8764044943820225 and parameters: {'objective': 'CrossEntropy', 'colsample_bylevel': 0.09856019550785762, 'depth': 10, 'boosting_type': 'Plain', 'bootstrap_type': 'Bernoulli', 'subsample': 0.6767354910650157}. Best is trial 342 with value: 0.888888888888889.
[32m[I 2023-04-26 13:34:12,151][39m Trial 407 finished with value: 0.8571428571428571 and parameters: {'objective': 'Logloss', 'colsample_bylevel': 0.09422496319834839, 'depth': 11, 'boosting_type': 'Plain', 'bootstrap_type': 'Bernoulli', 'subsample': 0.6825478364783725}. Best is trial 342 with value: 0.888888888888889.
[32m[I 2023-04-26 13:34:14,607][39m Trial 408 finished with value: 0.8666666666666666 and parameters: {'objective': 'CrossEntropy', 'colsample_bylevel': 0.09738742395048008, 'depth': 10, 'boosting_type': 'Plain', 'bootstrap_type': 'Bernoulli', 'subsample': 0.5718456821474306}. Best is trial 342 with value: 0.888888888888889.
[32m[I 2023-04-26 13:34:17,102][39m Trial 409 finished with value: 0.8636363636363636 and parameters: {'objective': 'CrossEntropy', 'colsample_bylevel': 0.09616526669016494, 'depth': 10, 'boosting_type': 'Plain', 'bootstrap_type': 'Bernoulli', 'subsample': 0.8776048004561889}. Best is trial 342 with value: 0.888888888888889.
[32m[I 2023-04-26 13:34:19,654][39m Trial 410 finished with value: 0.8505747126436782 and parameters: {'objective': 'CrossEntropy', 'colsample_bylevel': 0.09999514274746357, 'depth': 10, 'boosting_type': 'Plain', 'bootstrap_type': 'Bernoulli', 'subsample': 0.6235830446444355}. Best is trial 342 with value: 0.888888888888889.
[32m[I 2023-04-26 13:34:22,150][39m Trial 411 finished with value: 0.8666666666666666 and parameters: {'objective': 'Logloss', 'colsample_bylevel': 0.0907771678120659, 'depth': 12, 'boosting_type': 'Plain', 'bootstrap_type': 'Bernoulli', 'subsample': 0.7774062888846205}. Best is trial 342 with value: 0.888888888888889.
[32m[I 2023-04-26 13:34:24,561][39m Trial 412 finished with value: 0.8539325842696629 and parameters: {'objective': 'CrossEntropy', 'colsample_bylevel': 0.09374515863403815, 'depth': 11, 'boosting_type': 'Plain', 'bootstrap_type': 'Bernoulli', 'subsample': 0.7558053122888395}. Best is trial 342 with value: 0.888888888888889.
[32m[I 2023-04-26 13:34:27,057][39m Trial 413 finished with value: 0.8333333333333333 and parameters: {'objective': 'CrossEntropy', 'colsample_bylevel': 0.09817702695730271, 'depth': 10, 'boosting_type': 'Plain', 'bootstrap_type': 'Bernoulli', 'subsample': 0.9710010471663182}. Best is trial 342 with value: 0.888888888888889.
[32m[I 2023-04-26 13:34:29,614][39m Trial 414 finished with value: 0.8666666666666666 and parameters: {'objective': 'CrossEntropy', 'colsample_bylevel': 0.09468466439032515, 'depth': 11, 'boosting_type': 'Plain', 'bootstrap_type': 'Bernoulli', 'subsample': 0.7167375272672136}. Best is trial 342 with value: 0.888888888888889.
[32m[I 2023-04-26 13:34:32,146][39m Trial 415 finished with value: 0.8636363636363636 and parameters: {'objective': 'CrossEntropy', 'colsample_bylevel': 0.09658297754293127, 'depth': 11, 'boosting_type': 'Plain', 'bootstrap_type': 'Bernoulli', 'subsample': 0.7188032887155624}. Best is trial 342 with value: 0.888888888888889.
[32m[I 2023-04-26 13:34:34,686][39m Trial 416 finished with value: 0.8539325842696629 and parameters: {'objective': 'CrossEntropy', 'colsample_bylevel': 0.097886592810366, 'depth': 10, 'boosting_type': 'Plain', 'bootstrap_type': 'Bernoulli', 'subsample': 0.9440183403562085}. Best is trial 342 with value: 0.888888888888889.
[32m[I 2023-04-26 13:34:37,403][39m Trial 417 finished with value: 0.8764044943820225 and parameters: {'objective': 'CrossEntropy', 'colsample_bylevel': 0.09866066097081524, 'depth': 11, 'boosting_type': 'Plain', 'bootstrap_type': 'Bernoulli', 'subsample': 0.708180708110425}. Best is trial 342 with value: 0.888888888888889.
[32m[I 2023-04-26 13:34:39,988][39m Trial 418 finished with value: 0.8764044943820225 and parameters: {'objective': 'CrossEntropy', 'colsample_bylevel': 0.09971422934414902, 'depth': 10, 'boosting_type': 'Plain', 'bootstrap_type': 'Bernoulli', 'subsample': 0.657867962483061}. Best is trial 342 with value: 0.888888888888889.
[32m[I 2023-04-26 13:34:42,580][39m Trial 419 finished with value: 0.8666666666666666 and parameters: {'objective': 'CrossEntropy', 'colsample_bylevel': 0.0956572447623573, 'depth': 11, 'boosting_type': 'Plain', 'bootstrap_type': 'Bernoulli', 'subsample': 0.83570963657469}. Best is trial 342 with value: 0.888888888888889.
[32m[I 2023-04-26 13:34:45,172][39m Trial 420 finished with value: 0.8764044943820225 and parameters: {'objective': 'CrossEntropy', 'colsample_bylevel': 0.09996407530310704, 'depth': 10, 'boosting_type': 'Plain', 'bootstrap_type': 'Bernoulli', 'subsample': 0.6513882162700401}. Best is trial 342 with value: 0.888888888888889.
[32m[I 2023-04-26 13:34:47,608][39m Trial 421 finished with value: 0.8636363636363636 and parameters: {'objective': 'CrossEntropy', 'colsample_bylevel': 0.09756053219526982, 'depth': 10, 'boosting_type': 'Plain', 'bootstrap_type': 'Bernoulli', 'subsample': 0.9950565046284049}. Best is trial 342 with value: 0.888888888888889.
[32m[I 2023-04-26 13:34:50,148][39m Trial 422 finished with value: 0.8764044943820225 and parameters: {'objective': 'CrossEntropy', 'colsample_bylevel': 0.09823307895398437, 'depth': 10, 'boosting_type': 'Plain', 'bootstrap_type': 'Bernoulli', 'subsample': 0.6444589375985963}. Best is trial 342 with value: 0.888888888888889.
[32m[I 2023-04-26 13:34:52,685][39m Trial 423 finished with value: 0.8764044943820225 and parameters: {'objective': 'CrossEntropy', 'colsample_bylevel': 0.09705375575120288, 'depth': 10, 'boosting_type': 'Plain', 'bootstrap_type': 'Bernoulli', 'subsample': 0.6939698043494779}. Best is trial 342 with value: 0.888888888888889.
[32m[I 2023-04-26 13:34:55,135][39m Trial 424 finished with value: 0.8764044943820225 and parameters: {'objective': 'CrossEntropy', 'colsample_bylevel': 0.09646385226764406, 'depth': 10, 'boosting_type': 'Plain', 'bootstrap_type': 'Bernoulli', 'subsample': 0.6885740594421857}. Best is trial 342 with value: 0.888888888888889.
[32m[I 2023-04-26 13:34:57,558][39m Trial 425 finished with value: 0.8505747126436782 and parameters: {'objective': 'CrossEntropy', 'colsample_bylevel': 0.09539795826918038, 'depth': 10, 'boosting_type': 'Plain', 'bootstrap_type': 'Bernoulli', 'subsample': 0.6893996740415383}. Best is trial 342 with value: 0.888888888888889.
[32m[I 2023-04-26 13:35:00,231][39m Trial 426 finished with value: 0.8764044943820225 and parameters: {'objective': 'CrossEntropy', 'colsample_bylevel': 0.09162748833618016, 'depth': 12, 'boosting_type': 'Plain', 'bootstrap_type': 'Bernoulli', 'subsample': 0.7955683303722116}. Best is trial 342 with value: 0.888888888888889.
[32m[I 2023-04-26 13:35:02,747][39m Trial 427 finished with value: 0.8636363636363636 and parameters: {'objective': 'CrossEntropy', 'colsample_bylevel': 0.09409668224242174, 'depth': 10, 'boosting_type': 'Plain', 'bootstrap_type': 'Bernoulli', 'subsample': 0.5215087678047367}. Best is trial 342 with value: 0.888888888888889.
[32m[I 2023-04-26 13:35:05,113][39m Trial 428 finished with value: 0.8409090909090909 and parameters: {'objective': 'CrossEntropy', 'colsample_bylevel': 0.08855730772003861, 'depth': 11, 'boosting_type': 'Plain', 'bootstrap_type': 'Bernoulli', 'subsample': 0.7374135367434469}. Best is trial 342 with value: 0.888888888888889.
