[32m[I 2023-04-25 23:26:49,989][39m Trial 466 finished with value: 0.8771929824561403 and parameters: {'objective': 'Logloss', 'colsample_bylevel': 0.0615467203316259, 'depth': 12, 'boosting_type': 'Plain', 'bootstrap_type': 'Bayesian', 'bagging_temperature': 9.481057594340546}. Best is trial 79 with value: 0.8928571428571429.
[32m[I 2023-04-25 23:26:52,135][39m Trial 467 finished with value: 0.8771929824561403 and parameters: {'objective': 'CrossEntropy', 'colsample_bylevel': 0.06040265436557009, 'depth': 6, 'boosting_type': 'Plain', 'bootstrap_type': 'Bayesian', 'bagging_temperature': 8.737679418951581}. Best is trial 79 with value: 0.8928571428571429.
[32m[I 2023-04-25 23:26:54,374][39m Trial 468 finished with value: 0.8596491228070176 and parameters: {'objective': 'Logloss', 'colsample_bylevel': 0.05832892722339887, 'depth': 11, 'boosting_type': 'Plain', 'bootstrap_type': 'MVS'}. Best is trial 79 with value: 0.8928571428571429.
[32m[I 2023-04-25 23:26:56,453][39m Trial 469 finished with value: 0.8771929824561403 and parameters: {'objective': 'Logloss', 'colsample_bylevel': 0.06318402588138877, 'depth': 10, 'boosting_type': 'Plain', 'bootstrap_type': 'Bayesian', 'bagging_temperature': 9.091472629451854}. Best is trial 79 with value: 0.8928571428571429.
[32m[I 2023-04-25 23:26:58,340][39m Trial 470 finished with value: 0.8771929824561403 and parameters: {'objective': 'Logloss', 'colsample_bylevel': 0.055222025760634154, 'depth': 12, 'boosting_type': 'Plain', 'bootstrap_type': 'Bayesian', 'bagging_temperature': 7.760475505617235}. Best is trial 79 with value: 0.8928571428571429.
[32m[I 2023-04-25 23:27:02,108][39m Trial 471 finished with value: 0.8771929824561403 and parameters: {'objective': 'Logloss', 'colsample_bylevel': 0.05935896523338452, 'depth': 8, 'boosting_type': 'Ordered', 'bootstrap_type': 'Bayesian', 'bagging_temperature': 7.838724446849087}. Best is trial 79 with value: 0.8928571428571429.
[32m[I 2023-04-25 23:27:05,013][39m Trial 472 finished with value: 0.8771929824561403 and parameters: {'objective': 'Logloss', 'colsample_bylevel': 0.05146849797079876, 'depth': 7, 'boosting_type': 'Plain', 'bootstrap_type': 'Bayesian', 'bagging_temperature': 8.01738527341761}. Best is trial 79 with value: 0.8928571428571429.
[32m[I 2023-04-25 23:27:07,078][39m Trial 473 finished with value: 0.8695652173913043 and parameters: {'objective': 'Logloss', 'colsample_bylevel': 0.05981900816787901, 'depth': 11, 'boosting_type': 'Plain', 'bootstrap_type': 'Bayesian', 'bagging_temperature': 9.304936817257566}. Best is trial 79 with value: 0.8928571428571429.
[32m[I 2023-04-25 23:27:09,207][39m Trial 474 finished with value: 0.8596491228070176 and parameters: {'objective': 'CrossEntropy', 'colsample_bylevel': 0.05810568761852711, 'depth': 7, 'boosting_type': 'Plain', 'bootstrap_type': 'Bernoulli', 'subsample': 0.4994710861460344}. Best is trial 79 with value: 0.8928571428571429.
[32m[I 2023-04-25 23:27:11,599][39m Trial 475 finished with value: 0.8596491228070176 and parameters: {'objective': 'Logloss', 'colsample_bylevel': 0.05082375838765054, 'depth': 9, 'boosting_type': 'Plain', 'bootstrap_type': 'Bayesian', 'bagging_temperature': 1.1589205882658997}. Best is trial 79 with value: 0.8928571428571429.
[32m[I 2023-04-25 23:27:14,397][39m Trial 476 finished with value: 0.8695652173913043 and parameters: {'objective': 'Logloss', 'colsample_bylevel': 0.06640532300111546, 'depth': 9, 'boosting_type': 'Plain', 'bootstrap_type': 'Bayesian', 'bagging_temperature': 9.448342226549558}. Best is trial 79 with value: 0.8928571428571429.
[32m[I 2023-04-25 23:27:16,748][39m Trial 477 finished with value: 0.8771929824561403 and parameters: {'objective': 'Logloss', 'colsample_bylevel': 0.0680951726132016, 'depth': 11, 'boosting_type': 'Plain', 'bootstrap_type': 'Bayesian', 'bagging_temperature': 9.071246416130526}. Best is trial 79 with value: 0.8928571428571429.
[32m[I 2023-04-25 23:27:18,765][39m Trial 478 finished with value: 0.8620689655172413 and parameters: {'objective': 'Logloss', 'colsample_bylevel': 0.05660842674494996, 'depth': 11, 'boosting_type': 'Plain', 'bootstrap_type': 'Bayesian', 'bagging_temperature': 9.160662493120432}. Best is trial 79 with value: 0.8928571428571429.
[32m[I 2023-04-25 23:27:21,144][39m Trial 479 finished with value: 0.8771929824561403 and parameters: {'objective': 'Logloss', 'colsample_bylevel': 0.07109294924170396, 'depth': 7, 'boosting_type': 'Plain', 'bootstrap_type': 'Bayesian', 'bagging_temperature': 8.438427849961133}. Best is trial 79 with value: 0.8928571428571429.
[32m[I 2023-04-25 23:27:25,701][39m Trial 480 finished with value: 0.8849557522123893 and parameters: {'objective': 'CrossEntropy', 'colsample_bylevel': 0.06552958974607749, 'depth': 5, 'boosting_type': 'Ordered', 'bootstrap_type': 'Bayesian', 'bagging_temperature': 9.482664604976407}. Best is trial 79 with value: 0.8928571428571429.
[32m[I 2023-04-25 23:27:28,053][39m Trial 481 finished with value: 0.875 and parameters: {'objective': 'Logloss', 'colsample_bylevel': 0.06224627547761644, 'depth': 8, 'boosting_type': 'Plain', 'bootstrap_type': 'Bayesian', 'bagging_temperature': 8.583716424316393}. Best is trial 79 with value: 0.8928571428571429.
[32m[I 2023-04-25 23:27:30,027][39m Trial 482 finished with value: 0.8672566371681416 and parameters: {'objective': 'Logloss', 'colsample_bylevel': 0.06406196584582947, 'depth': 6, 'boosting_type': 'Plain', 'bootstrap_type': 'Bayesian', 'bagging_temperature': 8.849133970104266}. Best is trial 79 with value: 0.8928571428571429.
[32m[I 2023-04-25 23:27:32,066][39m Trial 483 finished with value: 0.8771929824561403 and parameters: {'objective': 'Logloss', 'colsample_bylevel': 0.05960317700506645, 'depth': 12, 'boosting_type': 'Plain', 'bootstrap_type': 'Bayesian', 'bagging_temperature': 9.346081270671155}. Best is trial 79 with value: 0.8928571428571429.
[32m[I 2023-04-25 23:27:33,819][39m Trial 484 finished with value: 0.8828828828828829 and parameters: {'objective': 'Logloss', 'colsample_bylevel': 0.04424208476010963, 'depth': 11, 'boosting_type': 'Plain', 'bootstrap_type': 'Bayesian', 'bagging_temperature': 9.004919168793505}. Best is trial 79 with value: 0.8928571428571429.
[32m[I 2023-04-25 23:27:35,818][39m Trial 485 finished with value: 0.8771929824561403 and parameters: {'objective': 'Logloss', 'colsample_bylevel': 0.05727374349551562, 'depth': 10, 'boosting_type': 'Plain', 'bootstrap_type': 'Bayesian', 'bagging_temperature': 5.167570528347747}. Best is trial 79 with value: 0.8928571428571429.
[32m[I 2023-04-25 23:27:40,520][39m Trial 486 finished with value: 0.875 and parameters: {'objective': 'CrossEntropy', 'colsample_bylevel': 0.05636980072645705, 'depth': 6, 'boosting_type': 'Ordered', 'bootstrap_type': 'Bayesian', 'bagging_temperature': 8.715995514398353}. Best is trial 79 with value: 0.8928571428571429.
[32m[I 2023-04-25 23:27:42,471][39m Trial 487 finished with value: 0.8771929824561403 and parameters: {'objective': 'Logloss', 'colsample_bylevel': 0.04803230763913581, 'depth': 11, 'boosting_type': 'Plain', 'bootstrap_type': 'Bayesian', 'bagging_temperature': 9.187565033273424}. Best is trial 79 with value: 0.8928571428571429.
[32m[I 2023-04-25 23:27:46,755][39m Trial 488 finished with value: 0.8771929824561403 and parameters: {'objective': 'Logloss', 'colsample_bylevel': 0.06418580479376719, 'depth': 7, 'boosting_type': 'Ordered', 'bootstrap_type': 'Bayesian', 'bagging_temperature': 9.969157336735027}. Best is trial 79 with value: 0.8928571428571429.
[32m[I 2023-04-25 23:27:49,584][39m Trial 489 finished with value: 0.875 and parameters: {'objective': 'CrossEntropy', 'colsample_bylevel': 0.06213491794002018, 'depth': 11, 'boosting_type': 'Plain', 'bootstrap_type': 'Bayesian', 'bagging_temperature': 9.354769085068476}. Best is trial 79 with value: 0.8928571428571429.
[32m[I 2023-04-25 23:27:51,647][39m Trial 490 finished with value: 0.8771929824561403 and parameters: {'objective': 'CrossEntropy', 'colsample_bylevel': 0.061018409931865664, 'depth': 11, 'boosting_type': 'Plain', 'bootstrap_type': 'Bayesian', 'bagging_temperature': 9.302455263583493}. Best is trial 79 with value: 0.8928571428571429.
[32m[I 2023-04-25 23:27:53,440][39m Trial 491 finished with value: 0.8849557522123893 and parameters: {'objective': 'Logloss', 'colsample_bylevel': 0.04975461426149844, 'depth': 7, 'boosting_type': 'Plain', 'bootstrap_type': 'Bayesian', 'bagging_temperature': 9.985843933704741}. Best is trial 79 with value: 0.8928571428571429.
[32m[I 2023-04-25 23:27:58,188][39m Trial 492 finished with value: 0.8596491228070176 and parameters: {'objective': 'Logloss', 'colsample_bylevel': 0.07486176539182464, 'depth': 8, 'boosting_type': 'Ordered', 'bootstrap_type': 'MVS'}. Best is trial 79 with value: 0.8928571428571429.
[32m[I 2023-04-25 23:28:02,350][39m Trial 493 finished with value: 0.8849557522123893 and parameters: {'objective': 'CrossEntropy', 'colsample_bylevel': 0.06862528648342378, 'depth': 9, 'boosting_type': 'Ordered', 'bootstrap_type': 'Bayesian', 'bagging_temperature': 9.629840871680337}. Best is trial 79 with value: 0.8928571428571429.
[32m[I 2023-04-25 23:28:04,436][39m Trial 494 finished with value: 0.875 and parameters: {'objective': 'Logloss', 'colsample_bylevel': 0.05443617886927068, 'depth': 12, 'boosting_type': 'Plain', 'bootstrap_type': 'Bayesian', 'bagging_temperature': 9.718796260556141}. Best is trial 79 with value: 0.8928571428571429.
[32m[I 2023-04-25 23:28:06,705][39m Trial 495 finished with value: 0.8771929824561403 and parameters: {'objective': 'Logloss', 'colsample_bylevel': 0.0513400408964336, 'depth': 10, 'boosting_type': 'Plain', 'bootstrap_type': 'Bayesian', 'bagging_temperature': 8.300252844004659}. Best is trial 79 with value: 0.8928571428571429.
[32m[I 2023-04-25 23:28:08,216][39m Trial 496 finished with value: 0.8672566371681416 and parameters: {'objective': 'Logloss', 'colsample_bylevel': 0.046758674924565424, 'depth': 11, 'boosting_type': 'Plain', 'bootstrap_type': 'Bernoulli', 'subsample': 0.8797033569565897}. Best is trial 79 with value: 0.8928571428571429.
[32m[I 2023-04-25 23:28:10,169][39m Trial 497 finished with value: 0.8849557522123893 and parameters: {'objective': 'Logloss', 'colsample_bylevel': 0.05582469560745669, 'depth': 10, 'boosting_type': 'Plain', 'bootstrap_type': 'Bayesian', 'bagging_temperature': 9.095904001557008}. Best is trial 79 with value: 0.8928571428571429.
[32m[I 2023-04-25 23:28:12,749][39m Trial 498 finished with value: 0.8771929824561403 and parameters: {'objective': 'Logloss', 'colsample_bylevel': 0.06533201992905596, 'depth': 9, 'boosting_type': 'Plain', 'bootstrap_type': 'Bayesian', 'bagging_temperature': 9.204862191450639}. Best is trial 79 with value: 0.8928571428571429.
Number of finished trials: 500
[32m[I 2023-04-25 23:28:14,346][39m Trial 499 finished with value: 0.875 and parameters: {'objective': 'Logloss', 'colsample_bylevel': 0.04478688005154036, 'depth': 11, 'boosting_type': 'Plain', 'bootstrap_type': 'Bayesian', 'bagging_temperature': 8.891830120201794}. Best is trial 79 with value: 0.8928571428571429.