[32m[I 2023-04-25 23:11:43,717][39m Trial 134 finished with value: 0.8672566371681416 and parameters: {'objective': 'Logloss', 'colsample_bylevel': 0.0809866912174454, 'depth': 7, 'boosting_type': 'Ordered', 'bootstrap_type': 'Bayesian', 'bagging_temperature': 8.570835654412226}. Best is trial 79 with value: 0.8928571428571429.
[32m[I 2023-04-25 23:11:45,885][39m Trial 135 finished with value: 0.8771929824561403 and parameters: {'objective': 'Logloss', 'colsample_bylevel': 0.0643711177390678, 'depth': 10, 'boosting_type': 'Plain', 'bootstrap_type': 'Bayesian', 'bagging_temperature': 8.022352550611602}. Best is trial 79 with value: 0.8928571428571429.
[32m[I 2023-04-25 23:11:50,070][39m Trial 136 finished with value: 0.8672566371681416 and parameters: {'objective': 'Logloss', 'colsample_bylevel': 0.07269316153368129, 'depth': 11, 'boosting_type': 'Ordered', 'bootstrap_type': 'Bernoulli', 'subsample': 0.767629494699752}. Best is trial 79 with value: 0.8928571428571429.
[32m[I 2023-04-25 23:11:54,861][39m Trial 137 finished with value: 0.8596491228070176 and parameters: {'objective': 'Logloss', 'colsample_bylevel': 0.06178941919409388, 'depth': 9, 'boosting_type': 'Ordered', 'bootstrap_type': 'Bayesian', 'bagging_temperature': 7.754263535276132}. Best is trial 79 with value: 0.8928571428571429.
[32m[I 2023-04-25 23:12:00,179][39m Trial 138 finished with value: 0.8672566371681416 and parameters: {'objective': 'Logloss', 'colsample_bylevel': 0.07527474668584608, 'depth': 9, 'boosting_type': 'Ordered', 'bootstrap_type': 'Bayesian', 'bagging_temperature': 5.3245412369127205}. Best is trial 79 with value: 0.8928571428571429.
[32m[I 2023-04-25 23:12:05,180][39m Trial 139 finished with value: 0.875 and parameters: {'objective': 'Logloss', 'colsample_bylevel': 0.07003147547518501, 'depth': 10, 'boosting_type': 'Ordered', 'bootstrap_type': 'Bayesian', 'bagging_temperature': 9.4967684962048}. Best is trial 79 with value: 0.8928571428571429.
[32m[I 2023-04-25 23:12:10,331][39m Trial 140 finished with value: 0.8672566371681416 and parameters: {'objective': 'Logloss', 'colsample_bylevel': 0.08815510666098379, 'depth': 10, 'boosting_type': 'Ordered', 'bootstrap_type': 'Bayesian', 'bagging_temperature': 8.793980346603393}. Best is trial 79 with value: 0.8928571428571429.
[32m[I 2023-04-25 23:12:15,325][39m Trial 141 finished with value: 0.8771929824561403 and parameters: {'objective': 'Logloss', 'colsample_bylevel': 0.08154697380164677, 'depth': 7, 'boosting_type': 'Ordered', 'bootstrap_type': 'Bayesian', 'bagging_temperature': 8.151434097320987}. Best is trial 79 with value: 0.8928571428571429.
[32m[I 2023-04-25 23:12:21,491][39m Trial 142 finished with value: 0.8771929824561403 and parameters: {'objective': 'Logloss', 'colsample_bylevel': 0.0782147415214313, 'depth': 6, 'boosting_type': 'Ordered', 'bootstrap_type': 'Bayesian', 'bagging_temperature': 7.320909103404864}. Best is trial 79 with value: 0.8928571428571429.
[32m[I 2023-04-25 23:12:24,415][39m Trial 143 finished with value: 0.8771929824561403 and parameters: {'objective': 'Logloss', 'colsample_bylevel': 0.0738319029219455, 'depth': 8, 'boosting_type': 'Plain', 'bootstrap_type': 'Bayesian', 'bagging_temperature': 8.461358003852993}. Best is trial 79 with value: 0.8928571428571429.
[32m[I 2023-04-25 23:12:28,623][39m Trial 144 finished with value: 0.8672566371681416 and parameters: {'objective': 'Logloss', 'colsample_bylevel': 0.07599715717541022, 'depth': 11, 'boosting_type': 'Ordered', 'bootstrap_type': 'Bayesian', 'bagging_temperature': 6.898921438757145}. Best is trial 79 with value: 0.8928571428571429.
[32m[I 2023-04-25 23:12:31,922][39m Trial 145 finished with value: 0.8849557522123893 and parameters: {'objective': 'Logloss', 'colsample_bylevel': 0.05358648227719796, 'depth': 9, 'boosting_type': 'Plain', 'bootstrap_type': 'Bayesian', 'bagging_temperature': 9.985109869523825}. Best is trial 79 with value: 0.8928571428571429.
[32m[I 2023-04-25 23:12:34,189][39m Trial 146 finished with value: 0.8695652173913043 and parameters: {'objective': 'Logloss', 'colsample_bylevel': 0.0522706350998443, 'depth': 9, 'boosting_type': 'Plain', 'bootstrap_type': 'Bayesian', 'bagging_temperature': 7.581595018044982}. Best is trial 79 with value: 0.8928571428571429.
[32m[I 2023-04-25 23:12:37,573][39m Trial 147 finished with value: 0.8672566371681416 and parameters: {'objective': 'CrossEntropy', 'colsample_bylevel': 0.059747092553466566, 'depth': 12, 'boosting_type': 'Ordered', 'bootstrap_type': 'Bayesian', 'bagging_temperature': 9.088600975630154}. Best is trial 79 with value: 0.8928571428571429.
[32m[I 2023-04-25 23:12:41,046][39m Trial 148 finished with value: 0.8771929824561403 and parameters: {'objective': 'Logloss', 'colsample_bylevel': 0.048758459366843795, 'depth': 9, 'boosting_type': 'Plain', 'bootstrap_type': 'Bayesian', 'bagging_temperature': 9.688333920953108}. Best is trial 79 with value: 0.8928571428571429.
[32m[I 2023-04-25 23:12:42,913][39m Trial 149 finished with value: 0.8596491228070176 and parameters: {'objective': 'Logloss', 'colsample_bylevel': 0.0550134083761595, 'depth': 7, 'boosting_type': 'Plain', 'bootstrap_type': 'Bayesian', 'bagging_temperature': 1.0108730137990922}. Best is trial 79 with value: 0.8928571428571429.
[32m[I 2023-04-25 23:12:46,831][39m Trial 150 finished with value: 0.8849557522123893 and parameters: {'objective': 'Logloss', 'colsample_bylevel': 0.0721069678342748, 'depth': 8, 'boosting_type': 'Ordered', 'bootstrap_type': 'Bayesian', 'bagging_temperature': 8.104038127729089}. Best is trial 79 with value: 0.8928571428571429.
[32m[I 2023-04-25 23:12:50,005][39m Trial 151 finished with value: 0.875 and parameters: {'objective': 'Logloss', 'colsample_bylevel': 0.04702406339813711, 'depth': 8, 'boosting_type': 'Plain', 'bootstrap_type': 'Bayesian', 'bagging_temperature': 9.929469151708334}. Best is trial 79 with value: 0.8928571428571429.
[32m[I 2023-04-25 23:12:53,149][39m Trial 152 finished with value: 0.875 and parameters: {'objective': 'Logloss', 'colsample_bylevel': 0.06762986108968262, 'depth': 9, 'boosting_type': 'Plain', 'bootstrap_type': 'Bayesian', 'bagging_temperature': 8.247559187363917}. Best is trial 79 with value: 0.8928571428571429.
[32m[I 2023-04-25 23:12:54,901][39m Trial 153 finished with value: 0.8849557522123893 and parameters: {'objective': 'Logloss', 'colsample_bylevel': 0.05069417338430538, 'depth': 11, 'boosting_type': 'Plain', 'bootstrap_type': 'Bayesian', 'bagging_temperature': 9.357301448602811}. Best is trial 79 with value: 0.8928571428571429.
[32m[I 2023-04-25 23:12:57,132][39m Trial 154 finished with value: 0.8771929824561403 and parameters: {'objective': 'Logloss', 'colsample_bylevel': 0.05700382550143009, 'depth': 8, 'boosting_type': 'Plain', 'bootstrap_type': 'Bayesian', 'bagging_temperature': 9.369883310893153}. Best is trial 79 with value: 0.8928571428571429.
[32m[I 2023-04-25 23:13:01,368][39m Trial 155 finished with value: 0.8849557522123893 and parameters: {'objective': 'Logloss', 'colsample_bylevel': 0.07749065233358325, 'depth': 11, 'boosting_type': 'Ordered', 'bootstrap_type': 'Bayesian', 'bagging_temperature': 8.731628360078917}. Best is trial 79 with value: 0.8928571428571429.
[32m[I 2023-04-25 23:13:06,820][39m Trial 156 finished with value: 0.8695652173913043 and parameters: {'objective': 'Logloss', 'colsample_bylevel': 0.07709393121849428, 'depth': 11, 'boosting_type': 'Ordered', 'bootstrap_type': 'Bayesian', 'bagging_temperature': 7.99051663587209}. Best is trial 79 with value: 0.8928571428571429.
[32m[I 2023-04-25 23:13:12,568][39m Trial 157 finished with value: 0.875 and parameters: {'objective': 'Logloss', 'colsample_bylevel': 0.08514130701019317, 'depth': 7, 'boosting_type': 'Ordered', 'bootstrap_type': 'Bayesian', 'bagging_temperature': 8.744033819121166}. Best is trial 79 with value: 0.8928571428571429.
[32m[I 2023-04-25 23:13:14,808][39m Trial 158 finished with value: 0.8596491228070176 and parameters: {'objective': 'Logloss', 'colsample_bylevel': 0.04440405309655, 'depth': 9, 'boosting_type': 'Plain', 'bootstrap_type': 'MVS'}. Best is trial 79 with value: 0.8928571428571429.
[32m[I 2023-04-25 23:13:19,866][39m Trial 159 finished with value: 0.8672566371681416 and parameters: {'objective': 'Logloss', 'colsample_bylevel': 0.09291351936104064, 'depth': 10, 'boosting_type': 'Ordered', 'bootstrap_type': 'Bernoulli', 'subsample': 0.2582301146583226}. Best is trial 79 with value: 0.8928571428571429.
[32m[I 2023-04-25 23:13:22,631][39m Trial 160 finished with value: 0.8672566371681416 and parameters: {'objective': 'Logloss', 'colsample_bylevel': 0.08249183352902265, 'depth': 10, 'boosting_type': 'Plain', 'bootstrap_type': 'Bayesian', 'bagging_temperature': 9.969356671506045}. Best is trial 79 with value: 0.8928571428571429.
[32m[I 2023-04-25 23:13:26,586][39m Trial 161 finished with value: 0.875 and parameters: {'objective': 'Logloss', 'colsample_bylevel': 0.06956302331107259, 'depth': 9, 'boosting_type': 'Ordered', 'bootstrap_type': 'Bayesian', 'bagging_temperature': 7.784454120716546}. Best is trial 79 with value: 0.8928571428571429.
[32m[I 2023-04-25 23:13:31,089][39m Trial 162 finished with value: 0.8648648648648648 and parameters: {'objective': 'Logloss', 'colsample_bylevel': 0.05012407761158658, 'depth': 11, 'boosting_type': 'Ordered', 'bootstrap_type': 'Bayesian', 'bagging_temperature': 9.545387442201525}. Best is trial 79 with value: 0.8928571428571429.
[32m[I 2023-04-25 23:13:36,504][39m Trial 163 finished with value: 0.8672566371681416 and parameters: {'objective': 'Logloss', 'colsample_bylevel': 0.07979500398609818, 'depth': 11, 'boosting_type': 'Ordered', 'bootstrap_type': 'Bayesian', 'bagging_temperature': 8.482204386847823}. Best is trial 79 with value: 0.8928571428571429.
[32m[I 2023-04-25 23:13:40,603][39m Trial 164 finished with value: 0.8771929824561403 and parameters: {'objective': 'Logloss', 'colsample_bylevel': 0.07227420746729257, 'depth': 8, 'boosting_type': 'Ordered', 'bootstrap_type': 'Bayesian', 'bagging_temperature': 8.290806709263041}. Best is trial 79 with value: 0.8928571428571429.
[32m[I 2023-04-25 23:13:45,133][39m Trial 165 finished with value: 0.8495575221238938 and parameters: {'objective': 'Logloss', 'colsample_bylevel': 0.05342957125173558, 'depth': 12, 'boosting_type': 'Ordered', 'bootstrap_type': 'Bayesian', 'bagging_temperature': 8.641959797228498}. Best is trial 79 with value: 0.8928571428571429.
[32m[I 2023-04-25 23:13:50,484][39m Trial 166 finished with value: 0.8771929824561403 and parameters: {'objective': 'Logloss', 'colsample_bylevel': 0.07465332820964053, 'depth': 11, 'boosting_type': 'Ordered', 'bootstrap_type': 'Bayesian', 'bagging_temperature': 9.220726750697446}. Best is trial 79 with value: 0.8928571428571429.
[32m[I 2023-04-25 23:13:52,905][39m Trial 167 finished with value: 0.8672566371681416 and parameters: {'objective': 'Logloss', 'colsample_bylevel': 0.07252023145566015, 'depth': 6, 'boosting_type': 'Plain', 'bootstrap_type': 'Bayesian', 'bagging_temperature': 8.999340427603736}. Best is trial 79 with value: 0.8928571428571429.
[32m[I 2023-04-25 23:13:57,417][39m Trial 168 finished with value: 0.8771929824561403 and parameters: {'objective': 'Logloss', 'colsample_bylevel': 0.07714321533458475, 'depth': 11, 'boosting_type': 'Ordered', 'bootstrap_type': 'Bayesian', 'bagging_temperature': 9.418084629040694}. Best is trial 79 with value: 0.8928571428571429.
[32m[I 2023-04-25 23:14:02,180][39m Trial 169 finished with value: 0.8771929824561403 and parameters: {'objective': 'Logloss', 'colsample_bylevel': 0.07111060963828347, 'depth': 7, 'boosting_type': 'Ordered', 'bootstrap_type': 'Bayesian', 'bagging_temperature': 8.067577397642012}. Best is trial 79 with value: 0.8928571428571429.
[32m[I 2023-04-25 23:14:07,022][39m Trial 170 finished with value: 0.875 and parameters: {'objective': 'CrossEntropy', 'colsample_bylevel': 0.06563265416026881, 'depth': 10, 'boosting_type': 'Ordered', 'bootstrap_type': 'Bayesian', 'bagging_temperature': 7.854757991870846}. Best is trial 79 with value: 0.8928571428571429.
[32m[I 2023-04-25 23:14:08,867][39m Trial 171 finished with value: 0.8849557522123893 and parameters: {'objective': 'Logloss', 'colsample_bylevel': 0.05072399405711064, 'depth': 11, 'boosting_type': 'Plain', 'bootstrap_type': 'Bayesian', 'bagging_temperature': 9.819303703310233}. Best is trial 79 with value: 0.8928571428571429.
[32m[I 2023-04-25 23:14:10,824][39m Trial 172 finished with value: 0.8849557522123893 and parameters: {'objective': 'Logloss', 'colsample_bylevel': 0.05373500008392674, 'depth': 12, 'boosting_type': 'Plain', 'bootstrap_type': 'Bayesian', 'bagging_temperature': 9.654080088367815}. Best is trial 79 with value: 0.8928571428571429.
[32m[I 2023-04-25 23:14:12,611][39m Trial 173 finished with value: 0.8771929824561403 and parameters: {'objective': 'Logloss', 'colsample_bylevel': 0.051898042420962104, 'depth': 11, 'boosting_type': 'Plain', 'bootstrap_type': 'Bayesian', 'bagging_temperature': 9.64935389002708}. Best is trial 79 with value: 0.8928571428571429.
[32m[I 2023-04-25 23:14:14,650][39m Trial 174 finished with value: 0.8849557522123893 and parameters: {'objective': 'Logloss', 'colsample_bylevel': 0.0544923062705722, 'depth': 12, 'boosting_type': 'Plain', 'bootstrap_type': 'Bayesian', 'bagging_temperature': 8.811500983962164}. Best is trial 79 with value: 0.8928571428571429.
[32m[I 2023-04-25 23:14:16,474][39m Trial 175 finished with value: 0.8648648648648648 and parameters: {'objective': 'Logloss', 'colsample_bylevel': 0.055828813285401416, 'depth': 12, 'boosting_type': 'Plain', 'bootstrap_type': 'Bayesian', 'bagging_temperature': 8.884821808129416}. Best is trial 79 with value: 0.8928571428571429.
[32m[I 2023-04-25 23:14:18,251][39m Trial 176 finished with value: 0.8771929824561403 and parameters: {'objective': 'Logloss', 'colsample_bylevel': 0.058093386569608566, 'depth': 12, 'boosting_type': 'Plain', 'bootstrap_type': 'Bayesian', 'bagging_temperature': 9.19534676931186}. Best is trial 79 with value: 0.8928571428571429.
[32m[I 2023-04-25 23:14:19,950][39m Trial 177 finished with value: 0.875 and parameters: {'objective': 'Logloss', 'colsample_bylevel': 0.05072497282793826, 'depth': 10, 'boosting_type': 'Plain', 'bootstrap_type': 'Bayesian', 'bagging_temperature': 9.745723008170458}. Best is trial 79 with value: 0.8928571428571429.
[32m[I 2023-04-25 23:14:21,765][39m Trial 178 finished with value: 0.875 and parameters: {'objective': 'Logloss', 'colsample_bylevel': 0.05432270095504853, 'depth': 12, 'boosting_type': 'Plain', 'bootstrap_type': 'Bayesian', 'bagging_temperature': 9.993072745025836}. Best is trial 79 with value: 0.8928571428571429.
[32m[I 2023-04-25 23:14:25,144][39m Trial 179 finished with value: 0.8571428571428572 and parameters: {'objective': 'Logloss', 'colsample_bylevel': 0.0484455269977169, 'depth': 11, 'boosting_type': 'Ordered', 'bootstrap_type': 'Bayesian', 'bagging_temperature': 4.489377022297036}. Best is trial 79 with value: 0.8928571428571429.
[32m[I 2023-04-25 23:14:28,304][39m Trial 180 finished with value: 0.8771929824561403 and parameters: {'objective': 'Logloss', 'colsample_bylevel': 0.04613101030150869, 'depth': 12, 'boosting_type': 'Plain', 'bootstrap_type': 'Bayesian', 'bagging_temperature': 9.379969048603071}. Best is trial 79 with value: 0.8928571428571429.
[32m[I 2023-04-25 23:14:30,105][39m Trial 181 finished with value: 0.8771929824561403 and parameters: {'objective': 'Logloss', 'colsample_bylevel': 0.056585960378546976, 'depth': 12, 'boosting_type': 'Plain', 'bootstrap_type': 'Bayesian', 'bagging_temperature': 8.496864846915198}. Best is trial 79 with value: 0.8928571428571429.
[32m[I 2023-04-25 23:14:33,339][39m Trial 182 finished with value: 0.8771929824561403 and parameters: {'objective': 'Logloss', 'colsample_bylevel': 0.07926187368121744, 'depth': 9, 'boosting_type': 'Plain', 'bootstrap_type': 'Bayesian', 'bagging_temperature': 8.264326425813113}. Best is trial 79 with value: 0.8928571428571429.
[32m[I 2023-04-25 23:14:35,204][39m Trial 183 finished with value: 0.8828828828828829 and parameters: {'objective': 'Logloss', 'colsample_bylevel': 0.0534119985029997, 'depth': 12, 'boosting_type': 'Plain', 'bootstrap_type': 'Bayesian', 'bagging_temperature': 8.689513198183288}. Best is trial 79 with value: 0.8928571428571429.
[32m[I 2023-04-25 23:14:36,943][39m Trial 184 finished with value: 0.875 and parameters: {'objective': 'Logloss', 'colsample_bylevel': 0.04993798895523121, 'depth': 11, 'boosting_type': 'Plain', 'bootstrap_type': 'Bayesian', 'bagging_temperature': 9.057727071043292}. Best is trial 79 with value: 0.8928571428571429.
[32m[I 2023-04-25 23:14:41,408][39m Trial 185 finished with value: 0.8695652173913043 and parameters: {'objective': 'Logloss', 'colsample_bylevel': 0.07353058314888555, 'depth': 7, 'boosting_type': 'Ordered', 'bootstrap_type': 'Bayesian', 'bagging_temperature': 7.592218483931893}. Best is trial 79 with value: 0.8928571428571429.
[32m[I 2023-04-25 23:14:46,520][39m Trial 186 finished with value: 0.8672566371681416 and parameters: {'objective': 'Logloss', 'colsample_bylevel': 0.0756613148171708, 'depth': 11, 'boosting_type': 'Ordered', 'bootstrap_type': 'Bayesian', 'bagging_temperature': 3.615220190592648}. Best is trial 79 with value: 0.8928571428571429.
[32m[I 2023-04-25 23:14:51,124][39m Trial 187 finished with value: 0.875 and parameters: {'objective': 'Logloss', 'colsample_bylevel': 0.05883424551628665, 'depth': 10, 'boosting_type': 'Ordered', 'bootstrap_type': 'Bayesian', 'bagging_temperature': 8.849780714807629}. Best is trial 79 with value: 0.8928571428571429.
[32m[I 2023-04-25 23:14:52,924][39m Trial 188 finished with value: 0.8771929824561403 and parameters: {'objective': 'Logloss', 'colsample_bylevel': 0.05227434858500162, 'depth': 11, 'boosting_type': 'Plain', 'bootstrap_type': 'Bayesian', 'bagging_temperature': 8.550941388042787}. Best is trial 79 with value: 0.8928571428571429.
[32m[I 2023-04-25 23:14:54,877][39m Trial 189 finished with value: 0.8596491228070176 and parameters: {'objective': 'Logloss', 'colsample_bylevel': 0.050487700547773774, 'depth': 12, 'boosting_type': 'Plain', 'bootstrap_type': 'MVS'}. Best is trial 79 with value: 0.8928571428571429.
[32m[I 2023-04-25 23:14:57,601][39m Trial 190 finished with value: 0.8849557522123893 and parameters: {'objective': 'Logloss', 'colsample_bylevel': 0.05483470958282063, 'depth': 11, 'boosting_type': 'Plain', 'bootstrap_type': 'Bayesian', 'bagging_temperature': 9.614793316900927}. Best is trial 79 with value: 0.8928571428571429.
[32m[I 2023-04-25 23:14:59,377][39m Trial 191 finished with value: 0.875 and parameters: {'objective': 'Logloss', 'colsample_bylevel': 0.048516166413969226, 'depth': 11, 'boosting_type': 'Plain', 'bootstrap_type': 'Bayesian', 'bagging_temperature': 9.798754925616759}. Best is trial 79 with value: 0.8928571428571429.
[32m[I 2023-04-25 23:15:02,667][39m Trial 192 finished with value: 0.8869565217391304 and parameters: {'objective': 'Logloss', 'colsample_bylevel': 0.08134574643372053, 'depth': 8, 'boosting_type': 'Plain', 'bootstrap_type': 'Bayesian', 'bagging_temperature': 9.454130531772314}. Best is trial 79 with value: 0.8928571428571429.
[32m[I 2023-04-25 23:15:06,206][39m Trial 193 finished with value: 0.8672566371681416 and parameters: {'objective': 'Logloss', 'colsample_bylevel': 0.08198600776262935, 'depth': 8, 'boosting_type': 'Plain', 'bootstrap_type': 'Bayesian', 'bagging_temperature': 8.109276423755945}. Best is trial 79 with value: 0.8928571428571429.
[32m[I 2023-04-25 23:15:07,998][39m Trial 194 finished with value: 0.8695652173913043 and parameters: {'objective': 'Logloss', 'colsample_bylevel': 0.05217658410705071, 'depth': 7, 'boosting_type': 'Plain', 'bootstrap_type': 'Bayesian', 'bagging_temperature': 9.494687950217335}. Best is trial 79 with value: 0.8928571428571429.
[32m[I 2023-04-25 23:15:09,959][39m Trial 195 finished with value: 0.875 and parameters: {'objective': 'Logloss', 'colsample_bylevel': 0.05476003917201199, 'depth': 6, 'boosting_type': 'Plain', 'bootstrap_type': 'Bayesian', 'bagging_temperature': 9.798595193068161}. Best is trial 79 with value: 0.8928571428571429.
[32m[I 2023-04-25 23:15:11,857][39m Trial 196 finished with value: 0.875 and parameters: {'objective': 'Logloss', 'colsample_bylevel': 0.05691174172139465, 'depth': 11, 'boosting_type': 'Plain', 'bootstrap_type': 'Bayesian', 'bagging_temperature': 9.548219594453972}. Best is trial 79 with value: 0.8928571428571429.
[32m[I 2023-04-25 23:15:14,520][39m Trial 197 finished with value: 0.8672566371681416 and parameters: {'objective': 'Logloss', 'colsample_bylevel': 0.0831619830484062, 'depth': 12, 'boosting_type': 'Plain', 'bootstrap_type': 'Bernoulli', 'subsample': 0.5834512172479813}. Best is trial 79 with value: 0.8928571428571429.
[32m[I 2023-04-25 23:15:17,605][39m Trial 198 finished with value: 0.8695652173913043 and parameters: {'objective': 'Logloss', 'colsample_bylevel': 0.08740206572527351, 'depth': 8, 'boosting_type': 'Plain', 'bootstrap_type': 'Bayesian', 'bagging_temperature': 7.920795559850922}. Best is trial 79 with value: 0.8928571428571429.
[32m[I 2023-04-25 23:15:19,304][39m Trial 199 finished with value: 0.8771929824561403 and parameters: {'objective': 'Logloss', 'colsample_bylevel': 0.05344501834675275, 'depth': 11, 'boosting_type': 'Plain', 'bootstrap_type': 'Bayesian', 'bagging_temperature': 9.355810566950781}. Best is trial 79 with value: 0.8928571428571429.
[32m[I 2023-04-25 23:15:22,764][39m Trial 200 finished with value: 0.8672566371681416 and parameters: {'objective': 'Logloss', 'colsample_bylevel': 0.08561876075835304, 'depth': 8, 'boosting_type': 'Plain', 'bootstrap_type': 'Bayesian', 'bagging_temperature': 7.401886741425649}. Best is trial 79 with value: 0.8928571428571429.
