
[32m[I 2023-04-25 23:03:12,470][39m A new study created in memory with name: no-name-32779de1-7d74-43c0-bbd1-038415827941
[32m[I 2023-04-25 23:03:14,751][39m Trial 0 finished with value: 0.8448275862068967 and parameters: {'objective': 'Logloss', 'colsample_bylevel': 0.08055965307945114, 'depth': 2, 'boosting_type': 'Plain', 'bootstrap_type': 'MVS'}. Best is trial 0 with value: 0.8448275862068967.
[32m[I 2023-04-25 23:03:16,633][39m Trial 1 finished with value: 0.8672566371681416 and parameters: {'objective': 'CrossEntropy', 'colsample_bylevel': 0.0459871317167995, 'depth': 7, 'boosting_type': 'Plain', 'bootstrap_type': 'Bernoulli', 'subsample': 0.6157825312108693}. Best is trial 1 with value: 0.8672566371681416.
[32m[I 2023-04-25 23:03:17,979][39m Trial 2 finished with value: 0.8448275862068967 and parameters: {'objective': 'CrossEntropy', 'colsample_bylevel': 0.02763668133205053, 'depth': 2, 'boosting_type': 'Plain', 'bootstrap_type': 'Bayesian', 'bagging_temperature': 1.3729875841726347}. Best is trial 1 with value: 0.8672566371681416.
[32m[I 2023-04-25 23:03:19,461][39m Trial 3 finished with value: 0.8468468468468469 and parameters: {'objective': 'CrossEntropy', 'colsample_bylevel': 0.024424895173827316, 'depth': 5, 'boosting_type': 'Plain', 'bootstrap_type': 'Bayesian', 'bagging_temperature': 5.6444358242985935}. Best is trial 1 with value: 0.8672566371681416.
[32m[I 2023-04-25 23:03:21,264][39m Trial 4 finished with value: 0.8547008547008546 and parameters: {'objective': 'CrossEntropy', 'colsample_bylevel': 0.05074502911923521, 'depth': 4, 'boosting_type': 'Plain', 'bootstrap_type': 'Bayesian', 'bagging_temperature': 9.43617405515756}. Best is trial 1 with value: 0.8672566371681416.
[32m[I 2023-04-25 23:03:24,141][39m Trial 5 finished with value: 0.8448275862068967 and parameters: {'objective': 'CrossEntropy', 'colsample_bylevel': 0.03225759373106732, 'depth': 8, 'boosting_type': 'Ordered', 'bootstrap_type': 'Bayesian', 'bagging_temperature': 3.262618955683915}. Best is trial 1 with value: 0.8672566371681416.
[32m[I 2023-04-25 23:03:29,261][39m Trial 6 finished with value: 0.8672566371681416 and parameters: {'objective': 'Logloss', 'colsample_bylevel': 0.0752596764837715, 'depth': 4, 'boosting_type': 'Ordered', 'bootstrap_type': 'Bayesian', 'bagging_temperature': 0.486282143854444}. Best is trial 1 with value: 0.8672566371681416.
[32m[I 2023-04-25 23:03:34,863][39m Trial 7 finished with value: 0.875 and parameters: {'objective': 'Logloss', 'colsample_bylevel': 0.08646342315965201, 'depth': 10, 'boosting_type': 'Ordered', 'bootstrap_type': 'Bayesian', 'bagging_temperature': 5.935642599311547}. Best is trial 7 with value: 0.875.
[32m[I 2023-04-25 23:03:40,084][39m Trial 8 finished with value: 0.8521739130434783 and parameters: {'objective': 'CrossEntropy', 'colsample_bylevel': 0.0646994097470406, 'depth': 6, 'boosting_type': 'Ordered', 'bootstrap_type': 'Bayesian', 'bagging_temperature': 0.6192306521296909}. Best is trial 7 with value: 0.875.
[32m[I 2023-04-25 23:03:45,288][39m Trial 9 finished with value: 0.8771929824561403 and parameters: {'objective': 'CrossEntropy', 'colsample_bylevel': 0.08781834263794736, 'depth': 9, 'boosting_type': 'Ordered', 'bootstrap_type': 'Bayesian', 'bagging_temperature': 6.308692099040146}. Best is trial 9 with value: 0.8771929824561403.
[32m[I 2023-04-25 23:03:51,410][39m Trial 10 finished with value: 0.8672566371681416 and parameters: {'objective': 'Logloss', 'colsample_bylevel': 0.09849319525648788, 'depth': 11, 'boosting_type': 'Ordered', 'bootstrap_type': 'Bernoulli', 'subsample': 0.12175788778619312}. Best is trial 9 with value: 0.8771929824561403.
[32m[I 2023-04-25 23:03:55,635][39m Trial 11 finished with value: 0.8596491228070176 and parameters: {'objective': 'Logloss', 'colsample_bylevel': 0.09770462357223711, 'depth': 10, 'boosting_type': 'Ordered', 'bootstrap_type': 'MVS'}. Best is trial 9 with value: 0.8771929824561403.
[32m[I 2023-04-25 23:04:00,134][39m Trial 12 finished with value: 0.8771929824561403 and parameters: {'objective': 'Logloss', 'colsample_bylevel': 0.08361785986511797, 'depth': 9, 'boosting_type': 'Ordered', 'bootstrap_type': 'Bayesian', 'bagging_temperature': 6.73880207487271}. Best is trial 9 with value: 0.8771929824561403.
[32m[I 2023-04-25 23:04:05,144][39m Trial 13 finished with value: 0.8596491228070176 and parameters: {'objective': 'Logloss', 'colsample_bylevel': 0.064236839369313, 'depth': 12, 'boosting_type': 'Ordered', 'bootstrap_type': 'MVS'}. Best is trial 9 with value: 0.8771929824561403.
[32m[I 2023-04-25 23:04:10,772][39m Trial 14 finished with value: 0.8849557522123893 and parameters: {'objective': 'Logloss', 'colsample_bylevel': 0.08434828627457487, 'depth': 9, 'boosting_type': 'Ordered', 'bootstrap_type': 'Bayesian', 'bagging_temperature': 8.195394850220044}. Best is trial 14 with value: 0.8849557522123893.
[32m[I 2023-04-25 23:04:13,863][39m Trial 15 finished with value: 0.8103448275862069 and parameters: {'objective': 'CrossEntropy', 'colsample_bylevel': 0.011271828764631633, 'depth': 8, 'boosting_type': 'Ordered', 'bootstrap_type': 'Bernoulli', 'subsample': 0.9657328623378758}. Best is trial 14 with value: 0.8849557522123893.
[32m[I 2023-04-25 23:04:18,666][39m Trial 16 finished with value: 0.8596491228070176 and parameters: {'objective': 'CrossEntropy', 'colsample_bylevel': 0.0672756467339238, 'depth': 12, 'boosting_type': 'Ordered', 'bootstrap_type': 'Bayesian', 'bagging_temperature': 8.652612926822105}. Best is trial 14 with value: 0.8849557522123893.
[32m[I 2023-04-25 23:04:24,116][39m Trial 17 finished with value: 0.875 and parameters: {'objective': 'Logloss', 'colsample_bylevel': 0.07295111147765779, 'depth': 9, 'boosting_type': 'Ordered', 'bootstrap_type': 'Bayesian', 'bagging_temperature': 8.024513497719076}. Best is trial 14 with value: 0.8849557522123893.
[32m[I 2023-04-25 23:04:30,086][39m Trial 18 finished with value: 0.875 and parameters: {'objective': 'Logloss', 'colsample_bylevel': 0.08936760988828021, 'depth': 7, 'boosting_type': 'Ordered', 'bootstrap_type': 'Bernoulli', 'subsample': 0.12627922452834855}. Best is trial 14 with value: 0.8849557522123893.
[32m[I 2023-04-25 23:04:34,620][39m Trial 19 finished with value: 0.8495575221238938 and parameters: {'objective': 'CrossEntropy', 'colsample_bylevel': 0.09206424963023192, 'depth': 10, 'boosting_type': 'Ordered', 'bootstrap_type': 'MVS'}. Best is trial 14 with value: 0.8849557522123893.
[32m[I 2023-04-25 23:04:38,985][39m Trial 20 finished with value: 0.875 and parameters: {'objective': 'CrossEntropy', 'colsample_bylevel': 0.06025662284422287, 'depth': 8, 'boosting_type': 'Ordered', 'bootstrap_type': 'Bayesian', 'bagging_temperature': 3.928113463041154}. Best is trial 14 with value: 0.8849557522123893.
[32m[I 2023-04-25 23:04:44,434][39m Trial 21 finished with value: 0.8672566371681416 and parameters: {'objective': 'Logloss', 'colsample_bylevel': 0.07981428030192607, 'depth': 9, 'boosting_type': 'Ordered', 'bootstrap_type': 'Bayesian', 'bagging_temperature': 7.00912757804536}. Best is trial 14 with value: 0.8849557522123893.
[32m[I 2023-04-25 23:04:50,074][39m Trial 22 finished with value: 0.8849557522123893 and parameters: {'objective': 'Logloss', 'colsample_bylevel': 0.08366371032036814, 'depth': 9, 'boosting_type': 'Ordered', 'bootstrap_type': 'Bayesian', 'bagging_temperature': 7.7110729351925755}. Best is trial 14 with value: 0.8849557522123893.
[32m[I 2023-04-25 23:04:55,456][39m Trial 23 finished with value: 0.8849557522123893 and parameters: {'objective': 'Logloss', 'colsample_bylevel': 0.0722297927972301, 'depth': 11, 'boosting_type': 'Ordered', 'bootstrap_type': 'Bayesian', 'bagging_temperature': 7.647422913571283}. Best is trial 14 with value: 0.8849557522123893.
[32m[I 2023-04-25 23:04:59,715][39m Trial 24 finished with value: 0.8596491228070176 and parameters: {'objective': 'Logloss', 'colsample_bylevel': 0.07356710503506358, 'depth': 11, 'boosting_type': 'Ordered', 'bootstrap_type': 'Bayesian', 'bagging_temperature': 7.754490894521168}. Best is trial 14 with value: 0.8849557522123893.
[32m[I 2023-04-25 23:05:05,122][39m Trial 25 finished with value: 0.8828828828828829 and parameters: {'objective': 'Logloss', 'colsample_bylevel': 0.07232235883593809, 'depth': 11, 'boosting_type': 'Ordered', 'bootstrap_type': 'Bayesian', 'bagging_temperature': 9.560646612149423}. Best is trial 14 with value: 0.8849557522123893.
[32m[I 2023-04-25 23:05:07,265][39m Trial 26 finished with value: 0.8849557522123893 and parameters: {'objective': 'Logloss', 'colsample_bylevel': 0.05516333137294522, 'depth': 6, 'boosting_type': 'Plain', 'bootstrap_type': 'Bayesian', 'bagging_temperature': 8.186293041986476}. Best is trial 14 with value: 0.8849557522123893.
[32m[I 2023-04-25 23:05:08,913][39m Trial 27 finished with value: 0.8771929824561403 and parameters: {'objective': 'Logloss', 'colsample_bylevel': 0.04146678915641564, 'depth': 6, 'boosting_type': 'Plain', 'bootstrap_type': 'Bayesian', 'bagging_temperature': 9.949072143671064}. Best is trial 14 with value: 0.8849557522123893.
[32m[I 2023-04-25 23:05:10,962][39m Trial 28 finished with value: 0.8521739130434783 and parameters: {'objective': 'Logloss', 'colsample_bylevel': 0.05580965691052992, 'depth': 4, 'boosting_type': 'Plain', 'bootstrap_type': 'Bernoulli', 'subsample': 0.5436515768252224}. Best is trial 14 with value: 0.8849557522123893.
[32m[I 2023-04-25 23:05:12,730][39m Trial 29 finished with value: 0.8166666666666667 and parameters: {'objective': 'Logloss', 'colsample_bylevel': 0.08021148091291568, 'depth': 1, 'boosting_type': 'Plain', 'bootstrap_type': 'MVS'}. Best is trial 14 with value: 0.8849557522123893.
[32m[I 2023-04-25 23:05:17,352][39m Trial 30 finished with value: 0.8596491228070176 and parameters: {'objective': 'Logloss', 'colsample_bylevel': 0.09520907880896, 'depth': 12, 'boosting_type': 'Ordered', 'bootstrap_type': 'MVS'}. Best is trial 14 with value: 0.8849557522123893.
[32m[I 2023-04-25 23:05:19,990][39m Trial 31 finished with value: 0.8672566371681416 and parameters: {'objective': 'Logloss', 'colsample_bylevel': 0.07979436234415752, 'depth': 7, 'boosting_type': 'Plain', 'bootstrap_type': 'Bayesian', 'bagging_temperature': 8.196920658130903}. Best is trial 14 with value: 0.8849557522123893.
[32m[I 2023-04-25 23:05:21,944][39m Trial 32 finished with value: 0.8672566371681416 and parameters: {'objective': 'Logloss', 'colsample_bylevel': 0.05695687805966601, 'depth': 5, 'boosting_type': 'Plain', 'bootstrap_type': 'Bayesian', 'bagging_temperature': 7.322044205410975}. Best is trial 14 with value: 0.8849557522123893.
[32m[I 2023-04-25 23:05:23,766][39m Trial 33 finished with value: 0.8771929824561403 and parameters: {'objective': 'Logloss', 'colsample_bylevel': 0.04787241011053001, 'depth': 10, 'boosting_type': 'Plain', 'bootstrap_type': 'Bayesian', 'bagging_temperature': 8.711280862488183}. Best is trial 14 with value: 0.8849557522123893.
[32m[I 2023-04-25 23:05:26,699][39m Trial 34 finished with value: 0.8771929824561403 and parameters: {'objective': 'Logloss', 'colsample_bylevel': 0.06875455424921537, 'depth': 8, 'boosting_type': 'Plain', 'bootstrap_type': 'Bayesian', 'bagging_temperature': 4.677939630656605}. Best is trial 14 with value: 0.8849557522123893.
[32m[I 2023-04-25 23:05:28,790][39m Trial 35 finished with value: 0.8869565217391304 and parameters: {'objective': 'Logloss', 'colsample_bylevel': 0.061112559800058336, 'depth': 7, 'boosting_type': 'Plain', 'bootstrap_type': 'Bayesian', 'bagging_temperature': 9.002527372506846}. Best is trial 35 with value: 0.8869565217391304.
[32m[I 2023-04-25 23:05:30,352][39m Trial 36 finished with value: 0.8672566371681416 and parameters: {'objective': 'Logloss', 'colsample_bylevel': 0.03625667837750965, 'depth': 6, 'boosting_type': 'Plain', 'bootstrap_type': 'Bayesian', 'bagging_temperature': 8.735921494252722}. Best is trial 35 with value: 0.8869565217391304.
[32m[I 2023-04-25 23:05:32,301][39m Trial 37 finished with value: 0.8771929824561403 and parameters: {'objective': 'Logloss', 'colsample_bylevel': 0.06083048007990304, 'depth': 5, 'boosting_type': 'Plain', 'bootstrap_type': 'Bayesian', 'bagging_temperature': 9.108954926815587}. Best is trial 35 with value: 0.8869565217391304.
[32m[I 2023-04-25 23:05:34,245][39m Trial 38 finished with value: 0.8672566371681416 and parameters: {'objective': 'Logloss', 'colsample_bylevel': 0.052209852201272285, 'depth': 3, 'boosting_type': 'Plain', 'bootstrap_type': 'Bernoulli', 'subsample': 0.9292873433326245}. Best is trial 35 with value: 0.8869565217391304.
[32m[I 2023-04-25 23:05:35,853][39m Trial 39 finished with value: 0.8695652173913043 and parameters: {'objective': 'Logloss', 'colsample_bylevel': 0.04270409881495218, 'depth': 7, 'boosting_type': 'Plain', 'bootstrap_type': 'Bayesian', 'bagging_temperature': 7.041160423511125}. Best is trial 35 with value: 0.8869565217391304.
[32m[I 2023-04-25 23:05:38,163][39m Trial 40 finished with value: 0.8771929824561403 and parameters: {'objective': 'Logloss', 'colsample_bylevel': 0.05971168547002368, 'depth': 8, 'boosting_type': 'Plain', 'bootstrap_type': 'Bayesian', 'bagging_temperature': 9.987964424549956}. Best is trial 35 with value: 0.8869565217391304.
[32m[I 2023-04-25 23:05:40,943][39m Trial 41 finished with value: 0.8849557522123893 and parameters: {'objective': 'Logloss', 'colsample_bylevel': 0.07606661698894432, 'depth': 7, 'boosting_type': 'Plain', 'bootstrap_type': 'Bayesian', 'bagging_temperature': 7.851393956011411}. Best is trial 35 with value: 0.8869565217391304.
[32m[I 2023-04-25 23:05:43,446][39m Trial 42 finished with value: 0.875 and parameters: {'objective': 'Logloss', 'colsample_bylevel': 0.07679921025278458, 'depth': 6, 'boosting_type': 'Plain', 'bootstrap_type': 'Bayesian', 'bagging_temperature': 7.613254699287876}. Best is trial 35 with value: 0.8869565217391304.
[32m[I 2023-04-25 23:05:48,247][39m Trial 43 finished with value: 0.8672566371681416 and parameters: {'objective': 'Logloss', 'colsample_bylevel': 0.0867052534923373, 'depth': 9, 'boosting_type': 'Ordered', 'bootstrap_type': 'Bayesian', 'bagging_temperature': 8.388409072467107}. Best is trial 35 with value: 0.8869565217391304.
[32m[I 2023-04-25 23:05:51,275][39m Trial 44 finished with value: 0.8596491228070176 and parameters: {'objective': 'Logloss', 'colsample_bylevel': 0.08380048881490229, 'depth': 7, 'boosting_type': 'Plain', 'bootstrap_type': 'Bayesian', 'bagging_temperature': 8.966201686996852}. Best is trial 35 with value: 0.8869565217391304.
[32m[I 2023-04-25 23:05:55,345][39m Trial 45 finished with value: 0.8672566371681416 and parameters: {'objective': 'Logloss', 'colsample_bylevel': 0.06933394428787729, 'depth': 10, 'boosting_type': 'Ordered', 'bootstrap_type': 'Bayesian', 'bagging_temperature': 5.211124606169639}. Best is trial 35 with value: 0.8869565217391304.
[32m[I 2023-04-25 23:05:57,927][39m Trial 46 finished with value: 0.8695652173913043 and parameters: {'objective': 'Logloss', 'colsample_bylevel': 0.05295959363738783, 'depth': 5, 'boosting_type': 'Plain', 'bootstrap_type': 'Bayesian', 'bagging_temperature': 6.494174273795557}. Best is trial 35 with value: 0.8869565217391304.
[32m[I 2023-04-25 23:06:02,227][39m Trial 47 finished with value: 0.8771929824561403 and parameters: {'objective': 'Logloss', 'colsample_bylevel': 0.07766298641448001, 'depth': 11, 'boosting_type': 'Ordered', 'bootstrap_type': 'Bayesian', 'bagging_temperature': 7.514650705330471}. Best is trial 35 with value: 0.8869565217391304.
[32m[I 2023-04-25 23:06:05,651][39m Trial 48 finished with value: 0.8596491228070176 and parameters: {'objective': 'Logloss', 'colsample_bylevel': 0.0628365917994449, 'depth': 8, 'boosting_type': 'Plain', 'bootstrap_type': 'Bayesian', 'bagging_temperature': 2.1270320353199446}. Best is trial 35 with value: 0.8869565217391304.
[32m[I 2023-04-25 23:06:08,102][39m Trial 49 finished with value: 0.8672566371681416 and parameters: {'objective': 'CrossEntropy', 'colsample_bylevel': 0.09329694237696504, 'depth': 7, 'boosting_type': 'Plain', 'bootstrap_type': 'Bernoulli', 'subsample': 0.43282361940341396}. Best is trial 35 with value: 0.8869565217391304.
[32m[I 2023-04-25 23:06:11,062][39m Trial 50 finished with value: 0.8571428571428572 and parameters: {'objective': 'Logloss', 'colsample_bylevel': 0.09008495223294594, 'depth': 6, 'boosting_type': 'Plain', 'bootstrap_type': 'MVS'}. Best is trial 35 with value: 0.8869565217391304.
[32m[I 2023-04-25 23:06:15,797][39m Trial 51 finished with value: 0.8771929824561403 and parameters: {'objective': 'Logloss', 'colsample_bylevel': 0.08364729098835388, 'depth': 8, 'boosting_type': 'Ordered', 'bootstrap_type': 'Bayesian', 'bagging_temperature': 8.16424919878673}. Best is trial 35 with value: 0.8869565217391304.
[32m[I 2023-04-25 23:06:20,258][39m Trial 52 finished with value: 0.8828828828828829 and parameters: {'objective': 'Logloss', 'colsample_bylevel': 0.06730513895114731, 'depth': 9, 'boosting_type': 'Ordered', 'bootstrap_type': 'Bayesian', 'bagging_temperature': 7.842402220469113}. Best is trial 35 with value: 0.8869565217391304.
[32m[I 2023-04-25 23:06:25,085][39m Trial 53 finished with value: 0.8521739130434783 and parameters: {'objective': 'Logloss', 'colsample_bylevel': 0.07106385847638645, 'depth': 4, 'boosting_type': 'Ordered', 'bootstrap_type': 'Bayesian', 'bagging_temperature': 9.516179139249594}. Best is trial 35 with value: 0.8869565217391304.
[32m[I 2023-04-25 23:06:29,434][39m Trial 54 finished with value: 0.8620689655172413 and parameters: {'objective': 'Logloss', 'colsample_bylevel': 0.06517576513222473, 'depth': 11, 'boosting_type': 'Ordered', 'bootstrap_type': 'Bayesian', 'bagging_temperature': 5.715243197674232}. Best is trial 35 with value: 0.8869565217391304.
[32m[I 2023-04-25 23:06:32,450][39m Trial 55 finished with value: 0.8672566371681416 and parameters: {'objective': 'Logloss', 'colsample_bylevel': 0.07448326946549054, 'depth': 5, 'boosting_type': 'Plain', 'bootstrap_type': 'Bayesian', 'bagging_temperature': 9.199587174395623}. Best is trial 35 with value: 0.8869565217391304.
[32m[I 2023-04-25 23:06:37,281][39m Trial 56 finished with value: 0.8672566371681416 and parameters: {'objective': 'CrossEntropy', 'colsample_bylevel': 0.08510668329192406, 'depth': 10, 'boosting_type': 'Ordered', 'bootstrap_type': 'Bayesian', 'bagging_temperature': 6.2954032293068325}. Best is trial 35 with value: 0.8869565217391304.
[32m[I 2023-04-25 23:06:40,922][39m Trial 57 finished with value: 0.7833333333333333 and parameters: {'objective': 'Logloss', 'colsample_bylevel': 0.016817532480099408, 'depth': 9, 'boosting_type': 'Ordered', 'bootstrap_type': 'Bayesian', 'bagging_temperature': 7.181643550913984}. Best is trial 35 with value: 0.8869565217391304.
[32m[I 2023-04-25 23:06:42,686][39m Trial 58 finished with value: 0.8849557522123893 and parameters: {'objective': 'Logloss', 'colsample_bylevel': 0.0491433129531133, 'depth': 7, 'boosting_type': 'Plain', 'bootstrap_type': 'Bayesian', 'bagging_temperature': 8.327494906443128}. Best is trial 35 with value: 0.8869565217391304.
[32m[I 2023-04-25 23:06:46,484][39m Trial 59 finished with value: 0.8596491228070176 and parameters: {'objective': 'Logloss', 'colsample_bylevel': 0.049388213807211076, 'depth': 7, 'boosting_type': 'Ordered', 'bootstrap_type': 'Bernoulli', 'subsample': 0.7420044699117789}. Best is trial 35 with value: 0.8869565217391304.
[32m[I 2023-04-25 23:06:49,265][39m Trial 60 finished with value: 0.8596491228070176 and parameters: {'objective': 'CrossEntropy', 'colsample_bylevel': 0.04539171828481984, 'depth': 6, 'boosting_type': 'Plain', 'bootstrap_type': 'MVS'}. Best is trial 35 with value: 0.8869565217391304.
[32m[I 2023-04-25 23:06:51,175][39m Trial 61 finished with value: 0.8771929824561403 and parameters: {'objective': 'Logloss', 'colsample_bylevel': 0.05792105398457309, 'depth': 7, 'boosting_type': 'Plain', 'bootstrap_type': 'Bayesian', 'bagging_temperature': 8.414565598026973}. Best is trial 35 with value: 0.8869565217391304.
[32m[I 2023-04-25 23:06:52,834][39m Trial 62 finished with value: 0.875 and parameters: {'objective': 'Logloss', 'colsample_bylevel': 0.036646268016795075, 'depth': 8, 'boosting_type': 'Plain', 'bootstrap_type': 'Bayesian', 'bagging_temperature': 7.925033230363482}. Best is trial 35 with value: 0.8869565217391304.
[32m[I 2023-04-25 23:06:54,661][39m Trial 63 finished with value: 0.8695652173913043 and parameters: {'objective': 'Logloss', 'colsample_bylevel': 0.054451186601606805, 'depth': 6, 'boosting_type': 'Plain', 'bootstrap_type': 'Bayesian', 'bagging_temperature': 8.483320343370815}. Best is trial 35 with value: 0.8869565217391304.
[32m[I 2023-04-25 23:06:57,662][39m Trial 64 finished with value: 0.8672566371681416 and parameters: {'objective': 'Logloss', 'colsample_bylevel': 0.0764652443557102, 'depth': 9, 'boosting_type': 'Plain', 'bootstrap_type': 'Bayesian', 'bagging_temperature': 6.734589631684723}. Best is trial 35 with value: 0.8869565217391304.
[32m[I 2023-04-25 23:07:02,145][39m Trial 65 finished with value: 0.8771929824561403 and parameters: {'objective': 'Logloss', 'colsample_bylevel': 0.08089684723615077, 'depth': 7, 'boosting_type': 'Ordered', 'bootstrap_type': 'Bayesian', 'bagging_temperature': 7.640656122019031}. Best is trial 35 with value: 0.8869565217391304.
[32m[I 2023-04-25 23:07:05,322][39m Trial 66 finished with value: 0.8771929824561403 and parameters: {'objective': 'Logloss', 'colsample_bylevel': 0.06424807707470918, 'depth': 12, 'boosting_type': 'Plain', 'bootstrap_type': 'Bayesian', 'bagging_temperature': 9.002253163445811}. Best is trial 35 with value: 0.8869565217391304.
