[32m[I 2023-04-25 23:07:08,449][39m Trial 67 finished with value: 0.8571428571428572 and parameters: {'objective': 'Logloss', 'colsample_bylevel': 0.04627380703892073, 'depth': 10, 'boosting_type': 'Ordered', 'bootstrap_type': 'Bayesian', 'bagging_temperature': 9.494734624804867}. Best is trial 35 with value: 0.8869565217391304.
[32m[I 2023-04-25 23:07:11,862][39m Trial 68 finished with value: 0.8771929824561403 and parameters: {'objective': 'Logloss', 'colsample_bylevel': 0.07064191782682369, 'depth': 5, 'boosting_type': 'Plain', 'bootstrap_type': 'Bayesian', 'bagging_temperature': 8.077297966855381}. Best is trial 35 with value: 0.8869565217391304.
[32m[I 2023-04-25 23:07:15,083][39m Trial 69 finished with value: 0.8672566371681416 and parameters: {'objective': 'Logloss', 'colsample_bylevel': 0.0813998073638143, 'depth': 8, 'boosting_type': 'Plain', 'bootstrap_type': 'Bayesian', 'bagging_temperature': 7.273266867499581}. Best is trial 35 with value: 0.8869565217391304.
[32m[I 2023-04-25 23:07:19,381][39m Trial 70 finished with value: 0.8521739130434783 and parameters: {'objective': 'CrossEntropy', 'colsample_bylevel': 0.05053417223949914, 'depth': 6, 'boosting_type': 'Ordered', 'bootstrap_type': 'MVS'}. Best is trial 35 with value: 0.8869565217391304.
[32m[I 2023-04-25 23:07:24,214][39m Trial 71 finished with value: 0.8849557522123893 and parameters: {'objective': 'Logloss', 'colsample_bylevel': 0.07252057057055446, 'depth': 11, 'boosting_type': 'Ordered', 'bootstrap_type': 'Bayesian', 'bagging_temperature': 9.646622351902929}. Best is trial 35 with value: 0.8869565217391304.
[32m[I 2023-04-25 23:07:29,815][39m Trial 72 finished with value: 0.8672566371681416 and parameters: {'objective': 'Logloss', 'colsample_bylevel': 0.08846117257123076, 'depth': 11, 'boosting_type': 'Ordered', 'bootstrap_type': 'Bayesian', 'bagging_temperature': 8.89691162454586}. Best is trial 35 with value: 0.8869565217391304.
[32m[I 2023-04-25 23:07:35,113][39m Trial 73 finished with value: 0.8672566371681416 and parameters: {'objective': 'Logloss', 'colsample_bylevel': 0.07485561970544413, 'depth': 12, 'boosting_type': 'Ordered', 'bootstrap_type': 'Bayesian', 'bagging_temperature': 9.68032904191563}. Best is trial 35 with value: 0.8869565217391304.
[32m[I 2023-04-25 23:07:39,478][39m Trial 74 finished with value: 0.8849557522123893 and parameters: {'objective': 'Logloss', 'colsample_bylevel': 0.061424861560011874, 'depth': 11, 'boosting_type': 'Ordered', 'bootstrap_type': 'Bayesian', 'bagging_temperature': 8.32003077308105}. Best is trial 35 with value: 0.8869565217391304.
[32m[I 2023-04-25 23:07:44,136][39m Trial 75 finished with value: 0.8545454545454546 and parameters: {'objective': 'Logloss', 'colsample_bylevel': 0.06032168171682866, 'depth': 11, 'boosting_type': 'Ordered', 'bootstrap_type': 'Bayesian', 'bagging_temperature': 8.553666187751585}. Best is trial 35 with value: 0.8869565217391304.
[32m[I 2023-04-25 23:07:48,330][39m Trial 76 finished with value: 0.8596491228070176 and parameters: {'objective': 'Logloss', 'colsample_bylevel': 0.06629139272246917, 'depth': 12, 'boosting_type': 'Ordered', 'bootstrap_type': 'Bayesian', 'bagging_temperature': 9.282037766544647}. Best is trial 35 with value: 0.8869565217391304.
[32m[I 2023-04-25 23:07:51,346][39m Trial 77 finished with value: 0.8771929824561403 and parameters: {'objective': 'Logloss', 'colsample_bylevel': 0.06325291903790212, 'depth': 11, 'boosting_type': 'Plain', 'bootstrap_type': 'Bernoulli', 'subsample': 0.3368906140356536}. Best is trial 35 with value: 0.8869565217391304.
[32m[I 2023-04-25 23:07:54,925][39m Trial 78 finished with value: 0.8695652173913043 and parameters: {'objective': 'Logloss', 'colsample_bylevel': 0.05812970037888292, 'depth': 10, 'boosting_type': 'Ordered', 'bootstrap_type': 'Bayesian', 'bagging_temperature': 8.764249530117194}. Best is trial 35 with value: 0.8869565217391304.
[32m[I 2023-04-25 23:07:57,785][39m Trial 79 finished with value: 0.8928571428571429 and parameters: {'objective': 'Logloss', 'colsample_bylevel': 0.05307500542266889, 'depth': 10, 'boosting_type': 'Plain', 'bootstrap_type': 'Bayesian', 'bagging_temperature': 8.249228891717358}. Best is trial 79 with value: 0.8928571428571429.
[32m[I 2023-04-25 23:07:59,588][39m Trial 80 finished with value: 0.8672566371681416 and parameters: {'objective': 'Logloss', 'colsample_bylevel': 0.04158169963192613, 'depth': 10, 'boosting_type': 'Plain', 'bootstrap_type': 'Bayesian', 'bagging_temperature': 9.864165206627424}. Best is trial 79 with value: 0.8928571428571429.
[32m[I 2023-04-25 23:08:04,853][39m Trial 81 finished with value: 0.8771929824561403 and parameters: {'objective': 'Logloss', 'colsample_bylevel': 0.0782771259614883, 'depth': 9, 'boosting_type': 'Ordered', 'bootstrap_type': 'Bayesian', 'bagging_temperature': 7.874445532480014}. Best is trial 79 with value: 0.8928571428571429.
[32m[I 2023-04-25 23:08:06,931][39m Trial 82 finished with value: 0.8771929824561403 and parameters: {'objective': 'Logloss', 'colsample_bylevel': 0.05452274828785626, 'depth': 11, 'boosting_type': 'Plain', 'bootstrap_type': 'Bayesian', 'bagging_temperature': 8.301311128341185}. Best is trial 79 with value: 0.8928571428571429.
[32m[I 2023-04-25 23:08:11,432][39m Trial 83 finished with value: 0.8648648648648648 and parameters: {'objective': 'Logloss', 'colsample_bylevel': 0.06901324194455186, 'depth': 10, 'boosting_type': 'Ordered', 'bootstrap_type': 'Bayesian', 'bagging_temperature': 7.639617769949337}. Best is trial 79 with value: 0.8928571428571429.
[32m[I 2023-04-25 23:08:13,862][39m Trial 84 finished with value: 0.8596491228070176 and parameters: {'objective': 'Logloss', 'colsample_bylevel': 0.05633515720528674, 'depth': 11, 'boosting_type': 'Plain', 'bootstrap_type': 'Bayesian', 'bagging_temperature': 9.154575403938063}. Best is trial 79 with value: 0.8928571428571429.
[32m[I 2023-04-25 23:08:18,280][39m Trial 85 finished with value: 0.875 and parameters: {'objective': 'Logloss', 'colsample_bylevel': 0.07254781464067062, 'depth': 12, 'boosting_type': 'Ordered', 'bootstrap_type': 'Bayesian', 'bagging_temperature': 6.762325124735076}. Best is trial 79 with value: 0.8928571428571429.
[32m[I 2023-04-25 23:08:20,160][39m Trial 86 finished with value: 0.8771929824561403 and parameters: {'objective': 'Logloss', 'colsample_bylevel': 0.04847547022525593, 'depth': 8, 'boosting_type': 'Plain', 'bootstrap_type': 'Bayesian', 'bagging_temperature': 8.181992242794186}. Best is trial 79 with value: 0.8928571428571429.
[32m[I 2023-04-25 23:08:21,868][39m Trial 87 finished with value: 0.8771929824561403 and parameters: {'objective': 'Logloss', 'colsample_bylevel': 0.05311996565456441, 'depth': 7, 'boosting_type': 'Plain', 'bootstrap_type': 'Bayesian', 'bagging_temperature': 7.414339356605864}. Best is trial 79 with value: 0.8928571428571429.
[32m[I 2023-04-25 23:08:25,865][39m Trial 88 finished with value: 0.8521739130434783 and parameters: {'objective': 'Logloss', 'colsample_bylevel': 0.06248298201270399, 'depth': 10, 'boosting_type': 'Ordered', 'bootstrap_type': 'MVS'}. Best is trial 79 with value: 0.8928571428571429.
[32m[I 2023-04-25 23:08:31,123][39m Trial 89 finished with value: 0.875 and parameters: {'objective': 'CrossEntropy', 'colsample_bylevel': 0.08223184630320302, 'depth': 9, 'boosting_type': 'Ordered', 'bootstrap_type': 'Bayesian', 'bagging_temperature': 4.170248508179162}. Best is trial 79 with value: 0.8928571428571429.
[32m[I 2023-04-25 23:08:33,553][39m Trial 90 finished with value: 0.8672566371681416 and parameters: {'objective': 'Logloss', 'colsample_bylevel': 0.05137950662786768, 'depth': 9, 'boosting_type': 'Plain', 'bootstrap_type': 'Bernoulli', 'subsample': 0.7867881264792397}. Best is trial 79 with value: 0.8928571428571429.
[32m[I 2023-04-25 23:08:36,800][39m Trial 91 finished with value: 0.8333333333333334 and parameters: {'objective': 'Logloss', 'colsample_bylevel': 0.04432469015569633, 'depth': 10, 'boosting_type': 'Ordered', 'bootstrap_type': 'Bayesian', 'bagging_temperature': 8.646584369356146}. Best is trial 79 with value: 0.8928571428571429.
[32m[I 2023-04-25 23:08:40,569][39m Trial 92 finished with value: 0.8672566371681416 and parameters: {'objective': 'Logloss', 'colsample_bylevel': 0.09079373232852218, 'depth': 11, 'boosting_type': 'Plain', 'bootstrap_type': 'Bayesian', 'bagging_temperature': 7.948122816835884}. Best is trial 79 with value: 0.8928571428571429.
[32m[I 2023-04-25 23:08:47,613][39m Trial 93 finished with value: 0.875 and parameters: {'objective': 'Logloss', 'colsample_bylevel': 0.08588890367016774, 'depth': 6, 'boosting_type': 'Ordered', 'bootstrap_type': 'Bayesian', 'bagging_temperature': 8.424282957862625}. Best is trial 79 with value: 0.8928571428571429.
[32m[I 2023-04-25 23:08:50,595][39m Trial 94 finished with value: 0.8672566371681416 and parameters: {'objective': 'Logloss', 'colsample_bylevel': 0.09670007984925724, 'depth': 7, 'boosting_type': 'Plain', 'bootstrap_type': 'Bayesian', 'bagging_temperature': 2.587275925593776}. Best is trial 79 with value: 0.8928571428571429.
[32m[I 2023-04-25 23:08:55,143][39m Trial 95 finished with value: 0.8849557522123893 and parameters: {'objective': 'Logloss', 'colsample_bylevel': 0.079064070166813, 'depth': 10, 'boosting_type': 'Ordered', 'bootstrap_type': 'Bayesian', 'bagging_temperature': 8.818670016576515}. Best is trial 79 with value: 0.8928571428571429.
[32m[I 2023-04-25 23:08:58,658][39m Trial 96 finished with value: 0.8771929824561403 and parameters: {'objective': 'Logloss', 'colsample_bylevel': 0.07811399009354875, 'depth': 10, 'boosting_type': 'Plain', 'bootstrap_type': 'Bayesian', 'bagging_temperature': 9.398346697097939}. Best is trial 79 with value: 0.8928571428571429.
[32m[I 2023-04-25 23:09:02,343][39m Trial 97 finished with value: 0.8695652173913043 and parameters: {'objective': 'Logloss', 'colsample_bylevel': 0.05933694220243041, 'depth': 8, 'boosting_type': 'Ordered', 'bootstrap_type': 'Bayesian', 'bagging_temperature': 8.15578617028524}. Best is trial 79 with value: 0.8928571428571429.
[32m[I 2023-04-25 23:09:05,485][39m Trial 98 finished with value: 0.8596491228070176 and parameters: {'objective': 'Logloss', 'colsample_bylevel': 0.06734031264289946, 'depth': 3, 'boosting_type': 'Plain', 'bootstrap_type': 'Bayesian', 'bagging_temperature': 0.11145268490984162}. Best is trial 79 with value: 0.8928571428571429.
[32m[I 2023-04-25 23:09:09,838][39m Trial 99 finished with value: 0.8849557522123893 and parameters: {'objective': 'Logloss', 'colsample_bylevel': 0.07528781751349942, 'depth': 11, 'boosting_type': 'Ordered', 'bootstrap_type': 'Bayesian', 'bagging_temperature': 7.4926411239708814}. Best is trial 79 with value: 0.8928571428571429.
[32m[I 2023-04-25 23:09:13,672][39m Trial 100 finished with value: 0.8771929824561403 and parameters: {'objective': 'Logloss', 'colsample_bylevel': 0.06138641008830746, 'depth': 9, 'boosting_type': 'Plain', 'bootstrap_type': 'Bayesian', 'bagging_temperature': 7.00411875242266}. Best is trial 79 with value: 0.8928571428571429.
[32m[I 2023-04-25 23:09:18,301][39m Trial 101 finished with value: 0.8771929824561403 and parameters: {'objective': 'Logloss', 'colsample_bylevel': 0.07611097180183574, 'depth': 11, 'boosting_type': 'Ordered', 'bootstrap_type': 'Bayesian', 'bagging_temperature': 8.792054677713786}. Best is trial 79 with value: 0.8928571428571429.
[32m[I 2023-04-25 23:09:23,285][39m Trial 102 finished with value: 0.8672566371681416 and parameters: {'objective': 'Logloss', 'colsample_bylevel': 0.07924833037839334, 'depth': 10, 'boosting_type': 'Ordered', 'bootstrap_type': 'Bayesian', 'bagging_temperature': 7.653766482448463}. Best is trial 79 with value: 0.8928571428571429.
[32m[I 2023-04-25 23:09:28,689][39m Trial 103 finished with value: 0.8695652173913043 and parameters: {'objective': 'Logloss', 'colsample_bylevel': 0.07348082777679649, 'depth': 11, 'boosting_type': 'Ordered', 'bootstrap_type': 'Bayesian', 'bagging_temperature': 9.708137496191243}. Best is trial 79 with value: 0.8928571428571429.
[32m[I 2023-04-25 23:09:33,989][39m Trial 104 finished with value: 0.8771929824561403 and parameters: {'objective': 'Logloss', 'colsample_bylevel': 0.07072646954399672, 'depth': 12, 'boosting_type': 'Ordered', 'bootstrap_type': 'Bayesian', 'bagging_temperature': 9.039687777275274}. Best is trial 79 with value: 0.8928571428571429.
[32m[I 2023-04-25 23:09:39,818][39m Trial 105 finished with value: 0.8672566371681416 and parameters: {'objective': 'Logloss', 'colsample_bylevel': 0.08278187092364905, 'depth': 7, 'boosting_type': 'Ordered', 'bootstrap_type': 'Bayesian', 'bagging_temperature': 8.63102983900479}. Best is trial 79 with value: 0.8928571428571429.
[32m[I 2023-04-25 23:09:44,985][39m Trial 106 finished with value: 0.8771929824561403 and parameters: {'objective': 'Logloss', 'colsample_bylevel': 0.08511221393123947, 'depth': 11, 'boosting_type': 'Ordered', 'bootstrap_type': 'Bayesian', 'bagging_temperature': 8.184704920643131}. Best is trial 79 with value: 0.8928571428571429.
[32m[I 2023-04-25 23:09:49,726][39m Trial 107 finished with value: 0.8771929824561403 and parameters: {'objective': 'CrossEntropy', 'colsample_bylevel': 0.06569229559929911, 'depth': 11, 'boosting_type': 'Ordered', 'bootstrap_type': 'Bayesian', 'bagging_temperature': 7.427731947616623}. Best is trial 79 with value: 0.8928571428571429.
[32m[I 2023-04-25 23:09:51,527][39m Trial 108 finished with value: 0.8672566371681416 and parameters: {'objective': 'Logloss', 'colsample_bylevel': 0.04734184063850339, 'depth': 6, 'boosting_type': 'Plain', 'bootstrap_type': 'MVS'}. Best is trial 79 with value: 0.8928571428571429.
[32m[I 2023-04-25 23:09:56,507][39m Trial 109 finished with value: 0.8695652173913043 and parameters: {'objective': 'Logloss', 'colsample_bylevel': 0.07469630689769809, 'depth': 11, 'boosting_type': 'Ordered', 'bootstrap_type': 'Bayesian', 'bagging_temperature': 7.788223446293745}. Best is trial 79 with value: 0.8928571428571429.
[32m[I 2023-04-25 23:09:58,667][39m Trial 110 finished with value: 0.8521739130434783 and parameters: {'objective': 'Logloss', 'colsample_bylevel': 0.03945577539536567, 'depth': 12, 'boosting_type': 'Plain', 'bootstrap_type': 'Bernoulli', 'subsample': 0.2947157509122935}. Best is trial 79 with value: 0.8928571428571429.
[32m[I 2023-04-25 23:10:03,626][39m Trial 111 finished with value: 0.8672566371681416 and parameters: {'objective': 'Logloss', 'colsample_bylevel': 0.08050186576635424, 'depth': 10, 'boosting_type': 'Ordered', 'bootstrap_type': 'Bayesian', 'bagging_temperature': 8.414678419466433}. Best is trial 79 with value: 0.8928571428571429.
[32m[I 2023-04-25 23:10:06,975][39m Trial 112 finished with value: 0.8571428571428572 and parameters: {'objective': 'Logloss', 'colsample_bylevel': 0.027687831731933833, 'depth': 8, 'boosting_type': 'Ordered', 'bootstrap_type': 'Bayesian', 'bagging_temperature': 7.9661546123818345}. Best is trial 79 with value: 0.8928571428571429.
[32m[I 2023-04-25 23:10:12,320][39m Trial 113 finished with value: 0.8928571428571429 and parameters: {'objective': 'Logloss', 'colsample_bylevel': 0.071785727370347, 'depth': 10, 'boosting_type': 'Ordered', 'bootstrap_type': 'Bayesian', 'bagging_temperature': 8.896661706815904}. Best is trial 79 with value: 0.8928571428571429.
[32m[I 2023-04-25 23:10:17,220][39m Trial 114 finished with value: 0.8849557522123893 and parameters: {'objective': 'Logloss', 'colsample_bylevel': 0.07142861294418995, 'depth': 9, 'boosting_type': 'Ordered', 'bootstrap_type': 'Bayesian', 'bagging_temperature': 8.914858842251755}. Best is trial 79 with value: 0.8928571428571429.
[32m[I 2023-04-25 23:10:21,667][39m Trial 115 finished with value: 0.8648648648648648 and parameters: {'objective': 'Logloss', 'colsample_bylevel': 0.07163626719841892, 'depth': 9, 'boosting_type': 'Ordered', 'bootstrap_type': 'Bayesian', 'bagging_temperature': 9.004357246344606}. Best is trial 79 with value: 0.8928571428571429.
[32m[I 2023-04-25 23:10:26,702][39m Trial 116 finished with value: 0.875 and parameters: {'objective': 'Logloss', 'colsample_bylevel': 0.07641830902498964, 'depth': 9, 'boosting_type': 'Ordered', 'bootstrap_type': 'Bayesian', 'bagging_temperature': 7.13731955900337}. Best is trial 79 with value: 0.8928571428571429.
[32m[I 2023-04-25 23:10:28,580][39m Trial 117 finished with value: 0.875 and parameters: {'objective': 'Logloss', 'colsample_bylevel': 0.05007855860365749, 'depth': 10, 'boosting_type': 'Plain', 'bootstrap_type': 'Bayesian', 'bagging_temperature': 9.260955993231335}. Best is trial 79 with value: 0.8928571428571429.
[32m[I 2023-04-25 23:10:32,927][39m Trial 118 finished with value: 0.8828828828828829 and parameters: {'objective': 'Logloss', 'colsample_bylevel': 0.05454047823125537, 'depth': 10, 'boosting_type': 'Ordered', 'bootstrap_type': 'Bayesian', 'bagging_temperature': 8.560541304848332}. Best is trial 79 with value: 0.8928571428571429.
[32m[I 2023-04-25 23:10:37,963][39m Trial 119 finished with value: 0.8695652173913043 and parameters: {'objective': 'Logloss', 'colsample_bylevel': 0.06880532981955972, 'depth': 5, 'boosting_type': 'Ordered', 'bootstrap_type': 'Bayesian', 'bagging_temperature': 9.697474608816805}. Best is trial 79 with value: 0.8928571428571429.
[32m[I 2023-04-25 23:10:43,499][39m Trial 120 finished with value: 0.8672566371681416 and parameters: {'objective': 'Logloss', 'colsample_bylevel': 0.08711540299210316, 'depth': 9, 'boosting_type': 'Ordered', 'bootstrap_type': 'Bayesian', 'bagging_temperature': 8.870825443594349}. Best is trial 79 with value: 0.8928571428571429.
[32m[I 2023-04-25 23:10:47,499][39m Trial 121 finished with value: 0.8623853211009175 and parameters: {'objective': 'Logloss', 'colsample_bylevel': 0.05785538970303288, 'depth': 8, 'boosting_type': 'Ordered', 'bootstrap_type': 'Bayesian', 'bagging_temperature': 8.238462791602545}. Best is trial 79 with value: 0.8928571428571429.
[32m[I 2023-04-25 23:10:52,754][39m Trial 122 finished with value: 0.8545454545454546 and parameters: {'objective': 'Logloss', 'colsample_bylevel': 0.07296514237961096, 'depth': 10, 'boosting_type': 'Ordered', 'bootstrap_type': 'Bayesian', 'bagging_temperature': 9.35007537402616}. Best is trial 79 with value: 0.8928571428571429.
[32m[I 2023-04-25 23:10:57,694][39m Trial 123 finished with value: 0.8771929824561403 and parameters: {'objective': 'Logloss', 'colsample_bylevel': 0.06759377174107212, 'depth': 11, 'boosting_type': 'Ordered', 'bootstrap_type': 'Bayesian', 'bagging_temperature': 7.8157670135762825}. Best is trial 79 with value: 0.8928571428571429.
[32m[I 2023-04-25 23:11:00,387][39m Trial 124 finished with value: 0.8672566371681416 and parameters: {'objective': 'Logloss', 'colsample_bylevel': 0.07855004924897566, 'depth': 7, 'boosting_type': 'Plain', 'bootstrap_type': 'Bayesian', 'bagging_temperature': 7.996765731745498}. Best is trial 79 with value: 0.8928571428571429.
[32m[I 2023-04-25 23:11:03,781][39m Trial 125 finished with value: 0.8672566371681416 and parameters: {'objective': 'Logloss', 'colsample_bylevel': 0.05613689650069193, 'depth': 11, 'boosting_type': 'Ordered', 'bootstrap_type': 'Bayesian', 'bagging_temperature': 8.346502091814317}. Best is trial 79 with value: 0.8928571428571429.
[32m[I 2023-04-25 23:11:07,457][39m Trial 126 finished with value: 0.8672566371681416 and parameters: {'objective': 'CrossEntropy', 'colsample_bylevel': 0.08322025528673145, 'depth': 6, 'boosting_type': 'Plain', 'bootstrap_type': 'Bayesian', 'bagging_temperature': 7.515036345919852}. Best is trial 79 with value: 0.8928571428571429.
[32m[I 2023-04-25 23:11:10,768][39m Trial 127 finished with value: 0.875 and parameters: {'objective': 'Logloss', 'colsample_bylevel': 0.05228774141479017, 'depth': 7, 'boosting_type': 'Ordered', 'bootstrap_type': 'Bayesian', 'bagging_temperature': 8.657464289369916}. Best is trial 79 with value: 0.8928571428571429.
[32m[I 2023-04-25 23:11:14,506][39m Trial 128 finished with value: 0.8571428571428572 and parameters: {'objective': 'Logloss', 'colsample_bylevel': 0.07478995878911245, 'depth': 10, 'boosting_type': 'Plain', 'bootstrap_type': 'MVS'}. Best is trial 79 with value: 0.8928571428571429.
[32m[I 2023-04-25 23:11:18,467][39m Trial 129 finished with value: 0.8771929824561403 and parameters: {'objective': 'Logloss', 'colsample_bylevel': 0.07058432520203661, 'depth': 9, 'boosting_type': 'Ordered', 'bootstrap_type': 'Bayesian', 'bagging_temperature': 9.150042909491576}. Best is trial 79 with value: 0.8928571428571429.
[32m[I 2023-04-25 23:11:22,688][39m Trial 130 finished with value: 0.8275862068965517 and parameters: {'objective': 'Logloss', 'colsample_bylevel': 0.07700580816268439, 'depth': 1, 'boosting_type': 'Ordered', 'bootstrap_type': 'Bayesian', 'bagging_temperature': 8.952718997466574}. Best is trial 79 with value: 0.8928571428571429.
[32m[I 2023-04-25 23:11:28,249][39m Trial 131 finished with value: 0.8849557522123893 and parameters: {'objective': 'Logloss', 'colsample_bylevel': 0.08101263302906565, 'depth': 8, 'boosting_type': 'Ordered', 'bootstrap_type': 'Bayesian', 'bagging_temperature': 8.479251413083938}. Best is trial 79 with value: 0.8928571428571429.
[32m[I 2023-04-25 23:11:33,348][39m Trial 132 finished with value: 0.875 and parameters: {'objective': 'Logloss', 'colsample_bylevel': 0.07945427541613656, 'depth': 8, 'boosting_type': 'Ordered', 'bootstrap_type': 'Bayesian', 'bagging_temperature': 8.833547405563113}. Best is trial 79 with value: 0.8928571428571429.
[32m[I 2023-04-25 23:11:38,238][39m Trial 133 finished with value: 0.875 and parameters: {'objective': 'Logloss', 'colsample_bylevel': 0.08426270600633805, 'depth': 8, 'boosting_type': 'Ordered', 'bootstrap_type': 'Bayesian', 'bagging_temperature': 8.354300476278713}. Best is trial 79 with value: 0.8928571428571429.
