[32m[I 2023-04-25 23:23:51,508][39m Trial 399 finished with value: 0.8421052631578947 and parameters: {'objective': 'Logloss', 'colsample_bylevel': 0.09457902171764485, 'depth': 1, 'boosting_type': 'Plain', 'bootstrap_type': 'Bayesian', 'bagging_temperature': 7.7880015653548975}. Best is trial 79 with value: 0.8928571428571429.
[32m[I 2023-04-25 23:23:53,866][39m Trial 400 finished with value: 0.8596491228070176 and parameters: {'objective': 'Logloss', 'colsample_bylevel': 0.06608972364517428, 'depth': 11, 'boosting_type': 'Plain', 'bootstrap_type': 'MVS'}. Best is trial 79 with value: 0.8928571428571429.
[32m[I 2023-04-25 23:23:56,120][39m Trial 401 finished with value: 0.8849557522123893 and parameters: {'objective': 'Logloss', 'colsample_bylevel': 0.06429267102247282, 'depth': 6, 'boosting_type': 'Plain', 'bootstrap_type': 'Bayesian', 'bagging_temperature': 9.213286349789074}. Best is trial 79 with value: 0.8928571428571429.
[32m[I 2023-04-25 23:23:58,485][39m Trial 402 finished with value: 0.8771929824561403 and parameters: {'objective': 'Logloss', 'colsample_bylevel': 0.06491580554614873, 'depth': 6, 'boosting_type': 'Plain', 'bootstrap_type': 'Bayesian', 'bagging_temperature': 9.208517000888467}. Best is trial 79 with value: 0.8928571428571429.
[32m[I 2023-04-25 23:24:00,186][39m Trial 403 finished with value: 0.8849557522123893 and parameters: {'objective': 'Logloss', 'colsample_bylevel': 0.04712025426423601, 'depth': 11, 'boosting_type': 'Plain', 'bootstrap_type': 'Bayesian', 'bagging_temperature': 8.96685002977889}. Best is trial 79 with value: 0.8928571428571429.
[32m[I 2023-04-25 23:24:01,794][39m Trial 404 finished with value: 0.8849557522123893 and parameters: {'objective': 'Logloss', 'colsample_bylevel': 0.047098898000506054, 'depth': 11, 'boosting_type': 'Plain', 'bootstrap_type': 'Bayesian', 'bagging_temperature': 8.912129230063542}. Best is trial 79 with value: 0.8928571428571429.
[32m[I 2023-04-25 23:24:03,962][39m Trial 405 finished with value: 0.8672566371681416 and parameters: {'objective': 'Logloss', 'colsample_bylevel': 0.06314107693886094, 'depth': 7, 'boosting_type': 'Plain', 'bootstrap_type': 'Bernoulli', 'subsample': 0.6561141928085069}. Best is trial 79 with value: 0.8928571428571429.
[32m[I 2023-04-25 23:24:06,141][39m Trial 406 finished with value: 0.875 and parameters: {'objective': 'CrossEntropy', 'colsample_bylevel': 0.05114313526941512, 'depth': 8, 'boosting_type': 'Plain', 'bootstrap_type': 'Bayesian', 'bagging_temperature': 8.265509218739071}. Best is trial 79 with value: 0.8928571428571429.
[32m[I 2023-04-25 23:24:08,302][39m Trial 407 finished with value: 0.8771929824561403 and parameters: {'objective': 'Logloss', 'colsample_bylevel': 0.058782610246618704, 'depth': 7, 'boosting_type': 'Plain', 'bootstrap_type': 'Bayesian', 'bagging_temperature': 8.322309543281715}. Best is trial 79 with value: 0.8928571428571429.
[32m[I 2023-04-25 23:24:10,271][39m Trial 408 finished with value: 0.8928571428571429 and parameters: {'objective': 'Logloss', 'colsample_bylevel': 0.04809792519235583, 'depth': 6, 'boosting_type': 'Plain', 'bootstrap_type': 'Bayesian', 'bagging_temperature': 8.546386608429394}. Best is trial 79 with value: 0.8928571428571429.
[32m[I 2023-04-25 23:24:12,168][39m Trial 409 finished with value: 0.8771929824561403 and parameters: {'objective': 'Logloss', 'colsample_bylevel': 0.048471850911458184, 'depth': 6, 'boosting_type': 'Plain', 'bootstrap_type': 'Bayesian', 'bagging_temperature': 8.63740559293712}. Best is trial 79 with value: 0.8928571428571429.
[32m[I 2023-04-25 23:24:13,875][39m Trial 410 finished with value: 0.8695652173913043 and parameters: {'objective': 'Logloss', 'colsample_bylevel': 0.05060988477955143, 'depth': 10, 'boosting_type': 'Plain', 'bootstrap_type': 'Bayesian', 'bagging_temperature': 8.480348402783445}. Best is trial 79 with value: 0.8928571428571429.
[32m[I 2023-04-25 23:24:15,825][39m Trial 411 finished with value: 0.8771929824561403 and parameters: {'objective': 'Logloss', 'colsample_bylevel': 0.06272875861358414, 'depth': 11, 'boosting_type': 'Plain', 'bootstrap_type': 'Bayesian', 'bagging_temperature': 9.76179860789565}. Best is trial 79 with value: 0.8928571428571429.
[32m[I 2023-04-25 23:24:17,886][39m Trial 412 finished with value: 0.8849557522123893 and parameters: {'objective': 'Logloss', 'colsample_bylevel': 0.059710981223861925, 'depth': 11, 'boosting_type': 'Plain', 'bootstrap_type': 'Bayesian', 'bagging_temperature': 8.684117289198321}. Best is trial 79 with value: 0.8928571428571429.
[32m[I 2023-04-25 23:24:22,508][39m Trial 413 finished with value: 0.8771929824561403 and parameters: {'objective': 'Logloss', 'colsample_bylevel': 0.08170712905719324, 'depth': 11, 'boosting_type': 'Ordered', 'bootstrap_type': 'Bayesian', 'bagging_temperature': 8.735968758293797}. Best is trial 79 with value: 0.8928571428571429.
[32m[I 2023-04-25 23:24:24,394][39m Trial 414 finished with value: 0.8695652173913043 and parameters: {'objective': 'Logloss', 'colsample_bylevel': 0.04473416631527967, 'depth': 12, 'boosting_type': 'Plain', 'bootstrap_type': 'Bayesian', 'bagging_temperature': 8.131465853941128}. Best is trial 79 with value: 0.8928571428571429.
[32m[I 2023-04-25 23:24:26,446][39m Trial 415 finished with value: 0.8771929824561403 and parameters: {'objective': 'Logloss', 'colsample_bylevel': 0.057030918966658524, 'depth': 6, 'boosting_type': 'Plain', 'bootstrap_type': 'Bayesian', 'bagging_temperature': 8.395548569705058}. Best is trial 79 with value: 0.8928571428571429.
[32m[I 2023-04-25 23:24:29,288][39m Trial 416 finished with value: 0.8672566371681416 and parameters: {'objective': 'Logloss', 'colsample_bylevel': 0.08980648312177844, 'depth': 10, 'boosting_type': 'Plain', 'bootstrap_type': 'Bayesian', 'bagging_temperature': 8.214591349854544}. Best is trial 79 with value: 0.8928571428571429.
[32m[I 2023-04-25 23:24:31,470][39m Trial 417 finished with value: 0.8672566371681416 and parameters: {'objective': 'Logloss', 'colsample_bylevel': 0.0672441025990332, 'depth': 10, 'boosting_type': 'Plain', 'bootstrap_type': 'Bayesian', 'bagging_temperature': 7.058947362087023}. Best is trial 79 with value: 0.8928571428571429.
[32m[I 2023-04-25 23:24:33,479][39m Trial 418 finished with value: 0.8771929824561403 and parameters: {'objective': 'Logloss', 'colsample_bylevel': 0.058701846496201894, 'depth': 10, 'boosting_type': 'Plain', 'bootstrap_type': 'Bayesian', 'bagging_temperature': 6.719931157907684}. Best is trial 79 with value: 0.8928571428571429.
[32m[I 2023-04-25 23:24:35,117][39m Trial 419 finished with value: 0.8648648648648648 and parameters: {'objective': 'Logloss', 'colsample_bylevel': 0.045595908885799286, 'depth': 7, 'boosting_type': 'Plain', 'bootstrap_type': 'Bayesian', 'bagging_temperature': 8.897177851702118}. Best is trial 79 with value: 0.8928571428571429.
[32m[I 2023-04-25 23:24:37,536][39m Trial 420 finished with value: 0.8771929824561403 and parameters: {'objective': 'Logloss', 'colsample_bylevel': 0.06673798234513895, 'depth': 6, 'boosting_type': 'Plain', 'bootstrap_type': 'Bayesian', 'bagging_temperature': 8.928577740459739}. Best is trial 79 with value: 0.8928571428571429.
[32m[I 2023-04-25 23:24:41,100][39m Trial 421 finished with value: 0.8521739130434783 and parameters: {'objective': 'Logloss', 'colsample_bylevel': 0.05701866102984167, 'depth': 12, 'boosting_type': 'Ordered', 'bootstrap_type': 'Bayesian', 'bagging_temperature': 3.096160647182265}. Best is trial 79 with value: 0.8928571428571429.
[32m[I 2023-04-25 23:24:44,094][39m Trial 422 finished with value: 0.8828828828828829 and parameters: {'objective': 'Logloss', 'colsample_bylevel': 0.04895625550816332, 'depth': 10, 'boosting_type': 'Plain', 'bootstrap_type': 'Bayesian', 'bagging_temperature': 8.628531950748664}. Best is trial 79 with value: 0.8928571428571429.
[32m[I 2023-04-25 23:24:48,529][39m Trial 423 finished with value: 0.8521739130434783 and parameters: {'objective': 'Logloss', 'colsample_bylevel': 0.07290654882783075, 'depth': 11, 'boosting_type': 'Ordered', 'bootstrap_type': 'MVS'}. Best is trial 79 with value: 0.8928571428571429.
[32m[I 2023-04-25 23:24:51,295][39m Trial 424 finished with value: 0.8727272727272727 and parameters: {'objective': 'Logloss', 'colsample_bylevel': 0.046942366272979395, 'depth': 5, 'boosting_type': 'Plain', 'bootstrap_type': 'Bayesian', 'bagging_temperature': 9.019354858138412}. Best is trial 79 with value: 0.8928571428571429.
[32m[I 2023-04-25 23:24:53,298][39m Trial 425 finished with value: 0.8849557522123893 and parameters: {'objective': 'Logloss', 'colsample_bylevel': 0.05698693422402484, 'depth': 6, 'boosting_type': 'Plain', 'bootstrap_type': 'Bayesian', 'bagging_temperature': 5.391124715328061}. Best is trial 79 with value: 0.8928571428571429.
[32m[I 2023-04-25 23:24:57,168][39m Trial 426 finished with value: 0.8849557522123893 and parameters: {'objective': 'CrossEntropy', 'colsample_bylevel': 0.06991731036053772, 'depth': 11, 'boosting_type': 'Ordered', 'bootstrap_type': 'Bayesian', 'bagging_temperature': 8.73572346333351}. Best is trial 79 with value: 0.8928571428571429.
[32m[I 2023-04-25 23:25:01,628][39m Trial 427 finished with value: 0.8771929824561403 and parameters: {'objective': 'Logloss', 'colsample_bylevel': 0.06006877497475716, 'depth': 10, 'boosting_type': 'Ordered', 'bootstrap_type': 'Bayesian', 'bagging_temperature': 8.497504492552771}. Best is trial 79 with value: 0.8928571428571429.
[32m[I 2023-04-25 23:25:07,551][39m Trial 428 finished with value: 0.8596491228070176 and parameters: {'objective': 'Logloss', 'colsample_bylevel': 0.07837063982617931, 'depth': 12, 'boosting_type': 'Ordered', 'bootstrap_type': 'Bernoulli', 'subsample': 0.36500286996165976}. Best is trial 79 with value: 0.8928571428571429.
[32m[I 2023-04-25 23:25:09,117][39m Trial 429 finished with value: 0.8672566371681416 and parameters: {'objective': 'Logloss', 'colsample_bylevel': 0.04352696804547119, 'depth': 6, 'boosting_type': 'Plain', 'bootstrap_type': 'Bayesian', 'bagging_temperature': 9.422492948301203}. Best is trial 79 with value: 0.8928571428571429.
[32m[I 2023-04-25 23:25:10,830][39m Trial 430 finished with value: 0.8620689655172413 and parameters: {'objective': 'Logloss', 'colsample_bylevel': 0.05742431700735549, 'depth': 10, 'boosting_type': 'Plain', 'bootstrap_type': 'Bayesian', 'bagging_temperature': 8.157323684536822}. Best is trial 79 with value: 0.8928571428571429.
[32m[I 2023-04-25 23:25:12,536][39m Trial 431 finished with value: 0.8771929824561403 and parameters: {'objective': 'Logloss', 'colsample_bylevel': 0.04713231852096143, 'depth': 11, 'boosting_type': 'Plain', 'bootstrap_type': 'Bayesian', 'bagging_temperature': 9.527967622046443}. Best is trial 79 with value: 0.8928571428571429.
[32m[I 2023-04-25 23:25:14,444][39m Trial 432 finished with value: 0.8849557522123893 and parameters: {'objective': 'Logloss', 'colsample_bylevel': 0.05516815533460967, 'depth': 12, 'boosting_type': 'Plain', 'bootstrap_type': 'Bayesian', 'bagging_temperature': 9.324359185642718}. Best is trial 79 with value: 0.8928571428571429.
[32m[I 2023-04-25 23:25:18,580][39m Trial 433 finished with value: 0.875 and parameters: {'objective': 'Logloss', 'colsample_bylevel': 0.06191584795790819, 'depth': 10, 'boosting_type': 'Ordered', 'bootstrap_type': 'Bayesian', 'bagging_temperature': 7.970968056697869}. Best is trial 79 with value: 0.8928571428571429.
[32m[I 2023-04-25 23:25:20,993][39m Trial 434 finished with value: 0.8672566371681416 and parameters: {'objective': 'Logloss', 'colsample_bylevel': 0.03838927917635576, 'depth': 11, 'boosting_type': 'Plain', 'bootstrap_type': 'Bayesian', 'bagging_temperature': 9.12761041629729}. Best is trial 79 with value: 0.8928571428571429.
[32m[I 2023-04-25 23:25:24,567][39m Trial 435 finished with value: 0.8771929824561403 and parameters: {'objective': 'Logloss', 'colsample_bylevel': 0.0587706572882071, 'depth': 11, 'boosting_type': 'Ordered', 'bootstrap_type': 'Bayesian', 'bagging_temperature': 8.939801200159812}. Best is trial 79 with value: 0.8928571428571429.
[32m[I 2023-04-25 23:25:27,528][39m Trial 436 finished with value: 0.8596491228070176 and parameters: {'objective': 'Logloss', 'colsample_bylevel': 0.04160242838742356, 'depth': 10, 'boosting_type': 'Plain', 'bootstrap_type': 'Bayesian', 'bagging_temperature': 8.262626754678086}. Best is trial 79 with value: 0.8928571428571429.
[32m[I 2023-04-25 23:25:29,722][39m Trial 437 finished with value: 0.8771929824561403 and parameters: {'objective': 'Logloss', 'colsample_bylevel': 0.06078921740638932, 'depth': 7, 'boosting_type': 'Plain', 'bootstrap_type': 'Bayesian', 'bagging_temperature': 8.623089426523872}. Best is trial 79 with value: 0.8928571428571429.
[32m[I 2023-04-25 23:25:31,955][39m Trial 438 finished with value: 0.8849557522123893 and parameters: {'objective': 'Logloss', 'colsample_bylevel': 0.046808318679116195, 'depth': 9, 'boosting_type': 'Plain', 'bootstrap_type': 'Bayesian', 'bagging_temperature': 9.030837652266117}. Best is trial 79 with value: 0.8928571428571429.
[32m[I 2023-04-25 23:25:35,359][39m Trial 439 finished with value: 0.8648648648648648 and parameters: {'objective': 'Logloss', 'colsample_bylevel': 0.05914723695713717, 'depth': 10, 'boosting_type': 'Ordered', 'bootstrap_type': 'Bayesian', 'bagging_temperature': 8.717809894742}. Best is trial 79 with value: 0.8928571428571429.
[32m[I 2023-04-25 23:25:38,195][39m Trial 440 finished with value: 0.8695652173913043 and parameters: {'objective': 'Logloss', 'colsample_bylevel': 0.05572351743981129, 'depth': 11, 'boosting_type': 'Plain', 'bootstrap_type': 'Bayesian', 'bagging_temperature': 9.199180109909777}. Best is trial 79 with value: 0.8928571428571429.
[32m[I 2023-04-25 23:25:41,268][39m Trial 441 finished with value: 0.8771929824561403 and parameters: {'objective': 'Logloss', 'colsample_bylevel': 0.0693474675163046, 'depth': 9, 'boosting_type': 'Plain', 'bootstrap_type': 'Bayesian', 'bagging_temperature': 8.86315342513699}. Best is trial 79 with value: 0.8928571428571429.
[32m[I 2023-04-25 23:25:44,588][39m Trial 442 finished with value: 0.875 and parameters: {'objective': 'Logloss', 'colsample_bylevel': 0.05342352516932299, 'depth': 8, 'boosting_type': 'Ordered', 'bootstrap_type': 'Bayesian', 'bagging_temperature': 8.374160592760997}. Best is trial 79 with value: 0.8928571428571429.
[32m[I 2023-04-25 23:25:46,143][39m Trial 443 finished with value: 0.8771929824561403 and parameters: {'objective': 'Logloss', 'colsample_bylevel': 0.04263526118119301, 'depth': 10, 'boosting_type': 'Plain', 'bootstrap_type': 'Bayesian', 'bagging_temperature': 7.403585303408757}. Best is trial 79 with value: 0.8928571428571429.
[32m[I 2023-04-25 23:25:48,881][39m Trial 444 finished with value: 0.8849557522123893 and parameters: {'objective': 'Logloss', 'colsample_bylevel': 0.056697565007720996, 'depth': 12, 'boosting_type': 'Plain', 'bootstrap_type': 'Bayesian', 'bagging_temperature': 9.76401796382955}. Best is trial 79 with value: 0.8928571428571429.
[32m[I 2023-04-25 23:25:50,825][39m Trial 445 finished with value: 0.8849557522123893 and parameters: {'objective': 'Logloss', 'colsample_bylevel': 0.06318240353099135, 'depth': 10, 'boosting_type': 'Plain', 'bootstrap_type': 'Bayesian', 'bagging_temperature': 9.233595870956112}. Best is trial 79 with value: 0.8928571428571429.
[32m[I 2023-04-25 23:25:55,288][39m Trial 446 finished with value: 0.8521739130434783 and parameters: {'objective': 'Logloss', 'colsample_bylevel': 0.07353020979823119, 'depth': 11, 'boosting_type': 'Ordered', 'bootstrap_type': 'MVS'}. Best is trial 79 with value: 0.8928571428571429.
[32m[I 2023-04-25 23:25:58,305][39m Trial 447 finished with value: 0.875 and parameters: {'objective': 'Logloss', 'colsample_bylevel': 0.06421197199987444, 'depth': 6, 'boosting_type': 'Plain', 'bootstrap_type': 'Bayesian', 'bagging_temperature': 5.70023022306719}. Best is trial 79 with value: 0.8928571428571429.
[32m[I 2023-04-25 23:26:00,765][39m Trial 448 finished with value: 0.8771929824561403 and parameters: {'objective': 'CrossEntropy', 'colsample_bylevel': 0.06111732538109255, 'depth': 8, 'boosting_type': 'Plain', 'bootstrap_type': 'Bayesian', 'bagging_temperature': 9.787324470049919}. Best is trial 79 with value: 0.8928571428571429.
[32m[I 2023-04-25 23:26:02,807][39m Trial 449 finished with value: 0.8596491228070176 and parameters: {'objective': 'Logloss', 'colsample_bylevel': 0.053423497335707455, 'depth': 12, 'boosting_type': 'Plain', 'bootstrap_type': 'Bayesian', 'bagging_temperature': 8.563511018342805}. Best is trial 79 with value: 0.8928571428571429.
[32m[I 2023-04-25 23:26:06,148][39m Trial 450 finished with value: 0.8596491228070176 and parameters: {'objective': 'Logloss', 'colsample_bylevel': 0.0527749395670131, 'depth': 10, 'boosting_type': 'Ordered', 'bootstrap_type': 'Bernoulli', 'subsample': 0.18744289484082632}. Best is trial 79 with value: 0.8928571428571429.
[32m[I 2023-04-25 23:26:08,980][39m Trial 451 finished with value: 0.875 and parameters: {'objective': 'CrossEntropy', 'colsample_bylevel': 0.04984965793084048, 'depth': 11, 'boosting_type': 'Plain', 'bootstrap_type': 'Bayesian', 'bagging_temperature': 8.707441413611074}. Best is trial 79 with value: 0.8928571428571429.
[32m[I 2023-04-25 23:26:10,800][39m Trial 452 finished with value: 0.8771929824561403 and parameters: {'objective': 'Logloss', 'colsample_bylevel': 0.045927722006549314, 'depth': 6, 'boosting_type': 'Plain', 'bootstrap_type': 'Bayesian', 'bagging_temperature': 8.3973955706393}. Best is trial 79 with value: 0.8928571428571429.
[32m[I 2023-04-25 23:26:12,785][39m Trial 453 finished with value: 0.8771929824561403 and parameters: {'objective': 'Logloss', 'colsample_bylevel': 0.052096531784490634, 'depth': 7, 'boosting_type': 'Plain', 'bootstrap_type': 'Bayesian', 'bagging_temperature': 8.360646053663881}. Best is trial 79 with value: 0.8928571428571429.
[32m[I 2023-04-25 23:26:16,386][39m Trial 454 finished with value: 0.8648648648648648 and parameters: {'objective': 'Logloss', 'colsample_bylevel': 0.05443030091632676, 'depth': 12, 'boosting_type': 'Ordered', 'bootstrap_type': 'Bayesian', 'bagging_temperature': 8.10236631447033}. Best is trial 79 with value: 0.8928571428571429.
[32m[I 2023-04-25 23:26:19,085][39m Trial 455 finished with value: 0.8695652173913043 and parameters: {'objective': 'Logloss', 'colsample_bylevel': 0.044392287995946814, 'depth': 11, 'boosting_type': 'Plain', 'bootstrap_type': 'Bayesian', 'bagging_temperature': 9.056969921670325}. Best is trial 79 with value: 0.8928571428571429.
[32m[I 2023-04-25 23:26:21,875][39m Trial 456 finished with value: 0.8849557522123893 and parameters: {'objective': 'Logloss', 'colsample_bylevel': 0.06631972758831149, 'depth': 9, 'boosting_type': 'Plain', 'bootstrap_type': 'Bayesian', 'bagging_temperature': 9.535921808577958}. Best is trial 79 with value: 0.8928571428571429.
[32m[I 2023-04-25 23:26:23,567][39m Trial 457 finished with value: 0.8672566371681416 and parameters: {'objective': 'Logloss', 'colsample_bylevel': 0.04886032519298121, 'depth': 10, 'boosting_type': 'Plain', 'bootstrap_type': 'Bayesian', 'bagging_temperature': 8.520962307710988}. Best is trial 79 with value: 0.8928571428571429.
[32m[I 2023-04-25 23:26:25,426][39m Trial 458 finished with value: 0.8771929824561403 and parameters: {'objective': 'Logloss', 'colsample_bylevel': 0.04762909495222045, 'depth': 7, 'boosting_type': 'Plain', 'bootstrap_type': 'Bayesian', 'bagging_temperature': 9.59641778550275}. Best is trial 79 with value: 0.8928571428571429.
[32m[I 2023-04-25 23:26:29,454][39m Trial 459 finished with value: 0.8849557522123893 and parameters: {'objective': 'Logloss', 'colsample_bylevel': 0.06536074572137093, 'depth': 11, 'boosting_type': 'Ordered', 'bootstrap_type': 'Bayesian', 'bagging_temperature': 9.3075079546284}. Best is trial 79 with value: 0.8928571428571429.
[32m[I 2023-04-25 23:26:34,322][39m Trial 460 finished with value: 0.8672566371681416 and parameters: {'objective': 'Logloss', 'colsample_bylevel': 0.0716128494970487, 'depth': 8, 'boosting_type': 'Ordered', 'bootstrap_type': 'Bayesian', 'bagging_temperature': 3.9147213598710286}. Best is trial 79 with value: 0.8928571428571429.
[32m[I 2023-04-25 23:26:36,320][39m Trial 461 finished with value: 0.875 and parameters: {'objective': 'CrossEntropy', 'colsample_bylevel': 0.057571667007861885, 'depth': 5, 'boosting_type': 'Plain', 'bootstrap_type': 'Bayesian', 'bagging_temperature': 8.863742796336751}. Best is trial 79 with value: 0.8928571428571429.
[32m[I 2023-04-25 23:26:38,434][39m Trial 462 finished with value: 0.875 and parameters: {'objective': 'Logloss', 'colsample_bylevel': 0.04790265683335816, 'depth': 8, 'boosting_type': 'Plain', 'bootstrap_type': 'Bayesian', 'bagging_temperature': 8.87317785215995}. Best is trial 79 with value: 0.8928571428571429.
[32m[I 2023-04-25 23:26:40,258][39m Trial 463 finished with value: 0.875 and parameters: {'objective': 'Logloss', 'colsample_bylevel': 0.045464442466669926, 'depth': 11, 'boosting_type': 'Plain', 'bootstrap_type': 'Bayesian', 'bagging_temperature': 8.85957016278407}. Best is trial 79 with value: 0.8928571428571429.
[32m[I 2023-04-25 23:26:42,322][39m Trial 464 finished with value: 0.8869565217391304 and parameters: {'objective': 'Logloss', 'colsample_bylevel': 0.05963700055145817, 'depth': 11, 'boosting_type': 'Plain', 'bootstrap_type': 'Bayesian', 'bagging_temperature': 9.110590037056037}. Best is trial 79 with value: 0.8928571428571429.
[32m[I 2023-04-25 23:26:47,548][39m Trial 465 finished with value: 0.875 and parameters: {'objective': 'Logloss', 'colsample_bylevel': 0.07599224123861431, 'depth': 8, 'boosting_type': 'Ordered', 'bootstrap_type': 'Bayesian', 'bagging_temperature': 9.047538633215577}. Best is trial 79 with value: 0.8928571428571429.
