[32m[I 2023-04-26 12:57:50,089][39m A new study created in memory with name: no-name-69a03bd1-1b19-4ec0-a68e-32ff44efb162
[32m[I 2023-04-26 12:57:50,096][39m Trial 0 finished with value: 0.6964285714285714 and parameters: {'algorithm': 'ball_tree', 'n_neighbors': 16, 'weights': 'distance', 'metric': 'manhattan'}. Best is trial 0 with value: 0.6964285714285714.
[32m[I 2023-04-26 12:57:50,117][39m Trial 1 finished with value: 0.6554621848739496 and parameters: {'algorithm': 'brute', 'n_neighbors': 9, 'weights': 'uniform', 'metric': 'minkowski'}. Best is trial 0 with value: 0.6964285714285714.
[32m[I 2023-04-26 12:57:50,125][39m Trial 2 finished with value: 0.5688073394495412 and parameters: {'algorithm': 'kd_tree', 'n_neighbors': 18, 'weights': 'uniform', 'metric': 'euclidean'}. Best is trial 0 with value: 0.6964285714285714.
[32m[I 2023-04-26 12:57:50,143][39m Trial 3 finished with value: 0.6213592233009709 and parameters: {'algorithm': 'brute', 'n_neighbors': 16, 'weights': 'uniform', 'metric': 'manhattan'}. Best is trial 0 with value: 0.6964285714285714.
[32m[I 2023-04-26 12:57:50,150][39m Trial 4 finished with value: 0.6306306306306305 and parameters: {'algorithm': 'auto', 'n_neighbors': 26, 'weights': 'uniform', 'metric': 'manhattan'}. Best is trial 0 with value: 0.6964285714285714.
[32m[I 2023-04-26 12:57:50,155][39m Trial 5 finished with value: 0.5818181818181819 and parameters: {'algorithm': 'auto', 'n_neighbors': 29, 'weights': 'uniform', 'metric': 'minkowski'}. Best is trial 0 with value: 0.6964285714285714.
[32m[I 2023-04-26 12:57:50,172][39m Trial 6 finished with value: 0.6548672566371682 and parameters: {'algorithm': 'brute', 'n_neighbors': 21, 'weights': 'uniform', 'metric': 'manhattan'}. Best is trial 0 with value: 0.6964285714285714.
[32m[I 2023-04-26 12:57:50,180][39m Trial 7 finished with value: 0.6181818181818182 and parameters: {'algorithm': 'kd_tree', 'n_neighbors': 29, 'weights': 'uniform', 'metric': 'manhattan'}. Best is trial 0 with value: 0.6964285714285714.
[32m[I 2023-04-26 12:57:50,185][39m Trial 8 finished with value: 0.709090909090909 and parameters: {'algorithm': 'ball_tree', 'n_neighbors': 16, 'weights': 'distance', 'metric': 'minkowski'}. Best is trial 8 with value: 0.709090909090909.
[32m[I 2023-04-26 12:57:50,192][39m Trial 9 finished with value: 0.574074074074074 and parameters: {'algorithm': 'auto', 'n_neighbors': 28, 'weights': 'uniform', 'metric': 'euclidean'}. Best is trial 8 with value: 0.709090909090909.
[32m[I 2023-04-26 12:57:50,198][39m Trial 10 finished with value: 0.6956521739130435 and parameters: {'algorithm': 'ball_tree', 'n_neighbors': 2, 'weights': 'distance', 'metric': 'minkowski'}. Best is trial 8 with value: 0.709090909090909.
[32m[I 2023-04-26 12:57:50,205][39m Trial 11 finished with value: 0.7142857142857143 and parameters: {'algorithm': 'ball_tree', 'n_neighbors': 9, 'weights': 'distance', 'metric': 'minkowski'}. Best is trial 11 with value: 0.7142857142857143.
[32m[I 2023-04-26 12:57:50,217][39m Trial 12 finished with value: 0.7027027027027026 and parameters: {'algorithm': 'ball_tree', 'n_neighbors': 8, 'weights': 'distance', 'metric': 'minkowski'}. Best is trial 11 with value: 0.7142857142857143.
[32m[I 2023-04-26 12:57:50,224][39m Trial 13 finished with value: 0.709090909090909 and parameters: {'algorithm': 'ball_tree', 'n_neighbors': 10, 'weights': 'distance', 'metric': 'minkowski'}. Best is trial 11 with value: 0.7142857142857143.
[32m[I 2023-04-26 12:57:50,232][39m Trial 14 finished with value: 0.6956521739130435 and parameters: {'algorithm': 'ball_tree', 'n_neighbors': 1, 'weights': 'distance', 'metric': 'minkowski'}. Best is trial 11 with value: 0.7142857142857143.
[32m[I 2023-04-26 12:57:50,240][39m Trial 15 finished with value: 0.6909090909090909 and parameters: {'algorithm': 'ball_tree', 'n_neighbors': 11, 'weights': 'distance', 'metric': 'minkowski'}. Best is trial 11 with value: 0.7142857142857143.
[32m[I 2023-04-26 12:57:50,249][39m Trial 16 finished with value: 0.7027027027027026 and parameters: {'algorithm': 'ball_tree', 'n_neighbors': 23, 'weights': 'distance', 'metric': 'minkowski'}. Best is trial 11 with value: 0.7142857142857143.
[32m[I 2023-04-26 12:57:50,256][39m Trial 17 finished with value: 0.6964285714285714 and parameters: {'algorithm': 'ball_tree', 'n_neighbors': 5, 'weights': 'distance', 'metric': 'euclidean'}. Best is trial 11 with value: 0.7142857142857143.
[32m[I 2023-04-26 12:57:50,263][39m Trial 18 finished with value: 0.7027027027027026 and parameters: {'algorithm': 'kd_tree', 'n_neighbors': 12, 'weights': 'distance', 'metric': 'minkowski'}. Best is trial 11 with value: 0.7142857142857143.
[32m[I 2023-04-26 12:57:50,269][39m Trial 19 finished with value: 0.6964285714285714 and parameters: {'algorithm': 'ball_tree', 'n_neighbors': 6, 'weights': 'distance', 'metric': 'minkowski'}. Best is trial 11 with value: 0.7142857142857143.
[32m[I 2023-04-26 12:57:50,276][39m Trial 20 finished with value: 0.7027027027027026 and parameters: {'algorithm': 'ball_tree', 'n_neighbors': 12, 'weights': 'distance', 'metric': 'euclidean'}. Best is trial 11 with value: 0.7142857142857143.
[32m[I 2023-04-26 12:57:50,282][39m Trial 21 finished with value: 0.6964285714285714 and parameters: {'algorithm': 'ball_tree', 'n_neighbors': 13, 'weights': 'distance', 'metric': 'minkowski'}. Best is trial 11 with value: 0.7142857142857143.
[32m[I 2023-04-26 12:57:50,288][39m Trial 22 finished with value: 0.6902654867256638 and parameters: {'algorithm': 'ball_tree', 'n_neighbors': 18, 'weights': 'distance', 'metric': 'minkowski'}. Best is trial 11 with value: 0.7142857142857143.
[32m[I 2023-04-26 12:57:50,294][39m Trial 23 finished with value: 0.7142857142857143 and parameters: {'algorithm': 'ball_tree', 'n_neighbors': 9, 'weights': 'distance', 'metric': 'minkowski'}. Best is trial 11 with value: 0.7142857142857143.
[32m[I 2023-04-26 12:57:50,300][39m Trial 24 finished with value: 0.6964285714285714 and parameters: {'algorithm': 'ball_tree', 'n_neighbors': 6, 'weights': 'distance', 'metric': 'minkowski'}. Best is trial 11 with value: 0.7142857142857143.
[32m[I 2023-04-26 12:57:50,308][39m Trial 25 finished with value: 0.7027027027027026 and parameters: {'algorithm': 'ball_tree', 'n_neighbors': 8, 'weights': 'distance', 'metric': 'minkowski'}. Best is trial 11 with value: 0.7142857142857143.
[32m[I 2023-04-26 12:57:50,314][39m Trial 26 finished with value: 0.6902654867256638 and parameters: {'algorithm': 'auto', 'n_neighbors': 4, 'weights': 'distance', 'metric': 'minkowski'}. Best is trial 11 with value: 0.7142857142857143.
[32m[I 2023-04-26 12:57:50,347][39m Trial 27 finished with value: 0.709090909090909 and parameters: {'algorithm': 'brute', 'n_neighbors': 10, 'weights': 'distance', 'metric': 'minkowski'}. Best is trial 11 with value: 0.7142857142857143.
[32m[I 2023-04-26 12:57:50,358][39m Trial 28 finished with value: 0.7155963302752292 and parameters: {'algorithm': 'kd_tree', 'n_neighbors': 14, 'weights': 'distance', 'metric': 'euclidean'}. Best is trial 28 with value: 0.7155963302752292.
[32m[I 2023-04-26 12:57:50,370][39m Trial 29 finished with value: 0.7155963302752292 and parameters: {'algorithm': 'kd_tree', 'n_neighbors': 14, 'weights': 'distance', 'metric': 'euclidean'}. Best is trial 28 with value: 0.7155963302752292.
[32m[I 2023-04-26 12:57:50,382][39m Trial 30 finished with value: 0.7155963302752292 and parameters: {'algorithm': 'kd_tree', 'n_neighbors': 14, 'weights': 'distance', 'metric': 'euclidean'}. Best is trial 28 with value: 0.7155963302752292.
[32m[I 2023-04-26 12:57:50,394][39m Trial 31 finished with value: 0.7155963302752292 and parameters: {'algorithm': 'kd_tree', 'n_neighbors': 14, 'weights': 'distance', 'metric': 'euclidean'}. Best is trial 28 with value: 0.7155963302752292.
[32m[I 2023-04-26 12:57:50,407][39m Trial 32 finished with value: 0.7155963302752292 and parameters: {'algorithm': 'kd_tree', 'n_neighbors': 14, 'weights': 'distance', 'metric': 'euclidean'}. Best is trial 28 with value: 0.7155963302752292.
[32m[I 2023-04-26 12:57:50,418][39m Trial 33 finished with value: 0.6902654867256638 and parameters: {'algorithm': 'kd_tree', 'n_neighbors': 18, 'weights': 'distance', 'metric': 'euclidean'}. Best is trial 28 with value: 0.7155963302752292.
[32m[I 2023-04-26 12:57:50,429][39m Trial 34 finished with value: 0.7155963302752292 and parameters: {'algorithm': 'kd_tree', 'n_neighbors': 14, 'weights': 'distance', 'metric': 'euclidean'}. Best is trial 28 with value: 0.7155963302752292.
[32m[I 2023-04-26 12:57:50,441][39m Trial 35 finished with value: 0.7027027027027026 and parameters: {'algorithm': 'kd_tree', 'n_neighbors': 20, 'weights': 'distance', 'metric': 'euclidean'}. Best is trial 28 with value: 0.7155963302752292.
[32m[I 2023-04-26 12:57:50,450][39m Trial 36 finished with value: 0.6964285714285714 and parameters: {'algorithm': 'kd_tree', 'n_neighbors': 15, 'weights': 'distance', 'metric': 'euclidean'}. Best is trial 28 with value: 0.7155963302752292.
[32m[I 2023-04-26 12:57:50,458][39m Trial 37 finished with value: 0.588235294117647 and parameters: {'algorithm': 'kd_tree', 'n_neighbors': 17, 'weights': 'uniform', 'metric': 'euclidean'}. Best is trial 28 with value: 0.7155963302752292.
[32m[I 2023-04-26 12:57:50,465][39m Trial 38 finished with value: 0.7027027027027026 and parameters: {'algorithm': 'kd_tree', 'n_neighbors': 21, 'weights': 'distance', 'metric': 'euclidean'}. Best is trial 28 with value: 0.7155963302752292.
[32m[I 2023-04-26 12:57:50,474][39m Trial 39 finished with value: 0.6486486486486486 and parameters: {'algorithm': 'kd_tree', 'n_neighbors': 15, 'weights': 'uniform', 'metric': 'euclidean'}. Best is trial 28 with value: 0.7155963302752292.
[32m[I 2023-04-26 12:57:50,482][39m Trial 40 finished with value: 0.7027027027027026 and parameters: {'algorithm': 'kd_tree', 'n_neighbors': 20, 'weights': 'distance', 'metric': 'euclidean'}. Best is trial 28 with value: 0.7155963302752292.
[32m[I 2023-04-26 12:57:50,490][39m Trial 41 finished with value: 0.7155963302752292 and parameters: {'algorithm': 'kd_tree', 'n_neighbors': 14, 'weights': 'distance', 'metric': 'euclidean'}. Best is trial 28 with value: 0.7155963302752292.
[32m[I 2023-04-26 12:57:50,498][39m Trial 42 finished with value: 0.6964285714285714 and parameters: {'algorithm': 'kd_tree', 'n_neighbors': 13, 'weights': 'distance', 'metric': 'euclidean'}. Best is trial 28 with value: 0.7155963302752292.
[32m[I 2023-04-26 12:57:50,505][39m Trial 43 finished with value: 0.6964285714285714 and parameters: {'algorithm': 'kd_tree', 'n_neighbors': 17, 'weights': 'distance', 'metric': 'manhattan'}. Best is trial 28 with value: 0.7155963302752292.
[32m[I 2023-04-26 12:57:50,514][39m Trial 44 finished with value: 0.5858585858585859 and parameters: {'algorithm': 'kd_tree', 'n_neighbors': 16, 'weights': 'uniform', 'metric': 'euclidean'}. Best is trial 28 with value: 0.7155963302752292.
[32m[I 2023-04-26 12:57:50,541][39m Trial 45 finished with value: 0.7155963302752292 and parameters: {'algorithm': 'brute', 'n_neighbors': 14, 'weights': 'distance', 'metric': 'euclidean'}. Best is trial 28 with value: 0.7155963302752292.
[32m[I 2023-04-26 12:57:50,571][39m Trial 46 finished with value: 0.7027027027027026 and parameters: {'algorithm': 'brute', 'n_neighbors': 12, 'weights': 'distance', 'metric': 'euclidean'}. Best is trial 28 with value: 0.7155963302752292.
[32m[I 2023-04-26 12:57:50,586][39m Trial 47 finished with value: 0.6168224299065421 and parameters: {'algorithm': 'kd_tree', 'n_neighbors': 18, 'weights': 'uniform', 'metric': 'manhattan'}. Best is trial 28 with value: 0.7155963302752292.
[32m[I 2023-04-26 12:57:50,617][39m Trial 48 finished with value: 0.6909090909090909 and parameters: {'algorithm': 'brute', 'n_neighbors': 11, 'weights': 'distance', 'metric': 'euclidean'}. Best is trial 28 with value: 0.7155963302752292.
[32m[I 2023-04-26 12:57:50,646][39m Trial 49 finished with value: 0.7027027027027026 and parameters: {'algorithm': 'brute', 'n_neighbors': 23, 'weights': 'distance', 'metric': 'euclidean'}. Best is trial 28 with value: 0.7155963302752292.
[32m[I 2023-04-26 12:57:50,659][39m Trial 50 finished with value: 0.6964285714285714 and parameters: {'algorithm': 'auto', 'n_neighbors': 13, 'weights': 'distance', 'metric': 'euclidean'}. Best is trial 28 with value: 0.7155963302752292.
[32m[I 2023-04-26 12:57:50,670][39m Trial 51 finished with value: 0.7155963302752292 and parameters: {'algorithm': 'kd_tree', 'n_neighbors': 14, 'weights': 'distance', 'metric': 'euclidean'}. Best is trial 28 with value: 0.7155963302752292.
[32m[I 2023-04-26 12:57:50,682][39m Trial 52 finished with value: 0.709090909090909 and parameters: {'algorithm': 'kd_tree', 'n_neighbors': 16, 'weights': 'distance', 'metric': 'euclidean'}. Best is trial 28 with value: 0.7155963302752292.
[32m[I 2023-04-26 12:57:50,709][39m Trial 53 finished with value: 0.6964285714285714 and parameters: {'algorithm': 'brute', 'n_neighbors': 15, 'weights': 'distance', 'metric': 'euclidean'}. Best is trial 28 with value: 0.7155963302752292.
[32m[I 2023-04-26 12:57:50,721][39m Trial 54 finished with value: 0.6902654867256638 and parameters: {'algorithm': 'kd_tree', 'n_neighbors': 17, 'weights': 'distance', 'metric': 'euclidean'}. Best is trial 28 with value: 0.7155963302752292.
[32m[I 2023-04-26 12:57:50,747][39m Trial 55 finished with value: 0.709090909090909 and parameters: {'algorithm': 'brute', 'n_neighbors': 10, 'weights': 'distance', 'metric': 'euclidean'}. Best is trial 28 with value: 0.7155963302752292.
[32m[I 2023-04-26 12:57:50,759][39m Trial 56 finished with value: 0.6788990825688075 and parameters: {'algorithm': 'kd_tree', 'n_neighbors': 11, 'weights': 'distance', 'metric': 'manhattan'}. Best is trial 28 with value: 0.7155963302752292.
[32m[I 2023-04-26 12:57:50,770][39m Trial 57 finished with value: 0.7155963302752292 and parameters: {'algorithm': 'kd_tree', 'n_neighbors': 14, 'weights': 'distance', 'metric': 'euclidean'}. Best is trial 28 with value: 0.7155963302752292.
[32m[I 2023-04-26 12:57:50,786][39m Trial 58 finished with value: 0.6140350877192983 and parameters: {'algorithm': 'auto', 'n_neighbors': 19, 'weights': 'uniform', 'metric': 'euclidean'}. Best is trial 28 with value: 0.7155963302752292.
[32m[I 2023-04-26 12:57:50,799][39m Trial 59 finished with value: 0.6964285714285714 and parameters: {'algorithm': 'kd_tree', 'n_neighbors': 13, 'weights': 'distance', 'metric': 'euclidean'}. Best is trial 28 with value: 0.7155963302752292.
[32m[I 2023-04-26 12:57:50,813][39m Trial 60 finished with value: 0.7027027027027026 and parameters: {'algorithm': 'kd_tree', 'n_neighbors': 8, 'weights': 'distance', 'metric': 'euclidean'}. Best is trial 28 with value: 0.7155963302752292.
[32m[I 2023-04-26 12:57:50,824][39m Trial 61 finished with value: 0.7155963302752292 and parameters: {'algorithm': 'kd_tree', 'n_neighbors': 14, 'weights': 'distance', 'metric': 'euclidean'}. Best is trial 28 with value: 0.7155963302752292.
[32m[I 2023-04-26 12:57:50,836][39m Trial 62 finished with value: 0.6964285714285714 and parameters: {'algorithm': 'kd_tree', 'n_neighbors': 15, 'weights': 'distance', 'metric': 'euclidean'}. Best is trial 28 with value: 0.7155963302752292.
[32m[I 2023-04-26 12:57:50,849][39m Trial 63 finished with value: 0.7027027027027026 and parameters: {'algorithm': 'kd_tree', 'n_neighbors': 12, 'weights': 'distance', 'metric': 'euclidean'}. Best is trial 28 with value: 0.7155963302752292.
[32m[I 2023-04-26 12:57:50,872][39m Trial 64 finished with value: 0.6909090909090909 and parameters: {'algorithm': 'brute', 'n_neighbors': 11, 'weights': 'distance', 'metric': 'euclidean'}. Best is trial 28 with value: 0.7155963302752292.
[32m[I 2023-04-26 12:57:50,885][39m Trial 65 finished with value: 0.7155963302752292 and parameters: {'algorithm': 'kd_tree', 'n_neighbors': 14, 'weights': 'distance', 'metric': 'euclidean'}. Best is trial 28 with value: 0.7155963302752292.
[32m[I 2023-04-26 12:57:50,898][39m Trial 66 finished with value: 0.6964285714285714 and parameters: {'algorithm': 'kd_tree', 'n_neighbors': 16, 'weights': 'distance', 'metric': 'manhattan'}. Best is trial 28 with value: 0.7155963302752292.
[32m[I 2023-04-26 12:57:50,912][39m Trial 67 finished with value: 0.6964285714285714 and parameters: {'algorithm': 'auto', 'n_neighbors': 13, 'weights': 'distance', 'metric': 'euclidean'}. Best is trial 28 with value: 0.7155963302752292.
[32m[I 2023-04-26 12:57:50,924][39m Trial 68 finished with value: 0.6902654867256638 and parameters: {'algorithm': 'kd_tree', 'n_neighbors': 17, 'weights': 'distance', 'metric': 'euclidean'}. Best is trial 28 with value: 0.7155963302752292.
[32m[I 2023-04-26 12:57:50,936][39m Trial 69 finished with value: 0.709090909090909 and parameters: {'algorithm': 'kd_tree', 'n_neighbors': 10, 'weights': 'distance', 'metric': 'euclidean'}. Best is trial 28 with value: 0.7155963302752292.
[32m[I 2023-04-26 12:57:50,963][39m Trial 70 finished with value: 0.7027027027027026 and parameters: {'algorithm': 'brute', 'n_neighbors': 12, 'weights': 'distance', 'metric': 'euclidean'}. Best is trial 28 with value: 0.7155963302752292.
[32m[I 2023-04-26 12:57:50,976][39m Trial 71 finished with value: 0.7155963302752292 and parameters: {'algorithm': 'kd_tree', 'n_neighbors': 14, 'weights': 'distance', 'metric': 'euclidean'}. Best is trial 28 with value: 0.7155963302752292.
[32m[I 2023-04-26 12:57:50,989][39m Trial 72 finished with value: 0.6964285714285714 and parameters: {'algorithm': 'kd_tree', 'n_neighbors': 15, 'weights': 'distance', 'metric': 'euclidean'}. Best is trial 28 with value: 0.7155963302752292.
[32m[I 2023-04-26 12:57:51,002][39m Trial 73 finished with value: 0.7155963302752292 and parameters: {'algorithm': 'kd_tree', 'n_neighbors': 14, 'weights': 'distance', 'metric': 'euclidean'}. Best is trial 28 with value: 0.7155963302752292.
[32m[I 2023-04-26 12:57:51,013][39m Trial 74 finished with value: 0.709090909090909 and parameters: {'algorithm': 'kd_tree', 'n_neighbors': 16, 'weights': 'distance', 'metric': 'euclidean'}. Best is trial 28 with value: 0.7155963302752292.
[32m[I 2023-04-26 12:57:51,026][39m Trial 75 finished with value: 0.6964285714285714 and parameters: {'algorithm': 'kd_tree', 'n_neighbors': 13, 'weights': 'distance', 'metric': 'euclidean'}. Best is trial 28 with value: 0.7155963302752292.
[32m[I 2023-04-26 12:57:51,043][39m Trial 76 finished with value: 0.594059405940594 and parameters: {'algorithm': 'kd_tree', 'n_neighbors': 12, 'weights': 'uniform', 'metric': 'euclidean'}. Best is trial 28 with value: 0.7155963302752292.
[32m[I 2023-04-26 12:57:51,056][39m Trial 77 finished with value: 0.6964285714285714 and parameters: {'algorithm': 'kd_tree', 'n_neighbors': 15, 'weights': 'distance', 'metric': 'euclidean'}. Best is trial 28 with value: 0.7155963302752292.
[32m[I 2023-04-26 12:57:51,068][39m Trial 78 finished with value: 0.7142857142857143 and parameters: {'algorithm': 'kd_tree', 'n_neighbors': 9, 'weights': 'distance', 'metric': 'euclidean'}. Best is trial 28 with value: 0.7155963302752292.
[32m[I 2023-04-26 12:57:51,080][39m Trial 79 finished with value: 0.6964285714285714 and parameters: {'algorithm': 'kd_tree', 'n_neighbors': 17, 'weights': 'distance', 'metric': 'manhattan'}. Best is trial 28 with value: 0.7155963302752292.
[32m[I 2023-04-26 12:57:51,103][39m Trial 80 finished with value: 0.7155963302752292 and parameters: {'algorithm': 'brute', 'n_neighbors': 14, 'weights': 'distance', 'metric': 'euclidean'}. Best is trial 28 with value: 0.7155963302752292.
[32m[I 2023-04-26 12:57:51,132][39m Trial 81 finished with value: 0.7155963302752292 and parameters: {'algorithm': 'brute', 'n_neighbors': 14, 'weights': 'distance', 'metric': 'euclidean'}. Best is trial 28 with value: 0.7155963302752292.
[32m[I 2023-04-26 12:57:51,161][39m Trial 82 finished with value: 0.6964285714285714 and parameters: {'algorithm': 'brute', 'n_neighbors': 13, 'weights': 'distance', 'metric': 'euclidean'}. Best is trial 28 with value: 0.7155963302752292.
[32m[I 2023-04-26 12:57:51,175][39m Trial 83 finished with value: 0.6964285714285714 and parameters: {'algorithm': 'kd_tree', 'n_neighbors': 15, 'weights': 'distance', 'metric': 'euclidean'}. Best is trial 28 with value: 0.7155963302752292.
[32m[I 2023-04-26 12:57:51,188][39m Trial 84 finished with value: 0.7027027027027026 and parameters: {'algorithm': 'kd_tree', 'n_neighbors': 12, 'weights': 'distance', 'metric': 'euclidean'}. Best is trial 28 with value: 0.7155963302752292.
[32m[I 2023-04-26 12:57:51,201][39m Trial 85 finished with value: 0.6902654867256638 and parameters: {'algorithm': 'kd_tree', 'n_neighbors': 18, 'weights': 'distance', 'metric': 'euclidean'}. Best is trial 28 with value: 0.7155963302752292.
[32m[I 2023-04-26 12:57:51,213][39m Trial 86 finished with value: 0.6909090909090909 and parameters: {'algorithm': 'kd_tree', 'n_neighbors': 11, 'weights': 'distance', 'metric': 'euclidean'}. Best is trial 28 with value: 0.7155963302752292.
[32m[I 2023-04-26 12:57:51,225][39m Trial 87 finished with value: 0.7155963302752292 and parameters: {'algorithm': 'kd_tree', 'n_neighbors': 14, 'weights': 'distance', 'metric': 'euclidean'}. Best is trial 28 with value: 0.7155963302752292.
[32m[I 2023-04-26 12:57:51,241][39m Trial 88 finished with value: 0.5858585858585859 and parameters: {'algorithm': 'auto', 'n_neighbors': 16, 'weights': 'uniform', 'metric': 'euclidean'}. Best is trial 28 with value: 0.7155963302752292.
[32m[I 2023-04-26 12:57:51,254][39m Trial 89 finished with value: 0.6964285714285714 and parameters: {'algorithm': 'kd_tree', 'n_neighbors': 13, 'weights': 'distance', 'metric': 'euclidean'}. Best is trial 28 with value: 0.7155963302752292.
