[32m[I 2023-04-26 12:57:54,902][39m Trial 270 finished with value: 0.6964285714285714 and parameters: {'algorithm': 'ball_tree', 'n_neighbors': 13, 'weights': 'distance', 'metric': 'euclidean'}. Best is trial 28 with value: 0.7155963302752292.
[32m[I 2023-04-26 12:57:54,919][39m Trial 271 finished with value: 0.6964285714285714 and parameters: {'algorithm': 'ball_tree', 'n_neighbors': 15, 'weights': 'distance', 'metric': 'euclidean'}. Best is trial 28 with value: 0.7155963302752292.
[32m[I 2023-04-26 12:57:54,928][39m Trial 272 finished with value: 0.7155963302752292 and parameters: {'algorithm': 'kd_tree', 'n_neighbors': 14, 'weights': 'distance', 'metric': 'minkowski'}. Best is trial 28 with value: 0.7155963302752292.
[32m[I 2023-04-26 12:57:54,964][39m Trial 273 finished with value: 0.6964285714285714 and parameters: {'algorithm': 'brute', 'n_neighbors': 13, 'weights': 'distance', 'metric': 'minkowski'}. Best is trial 28 with value: 0.7155963302752292.
[32m[I 2023-04-26 12:57:54,982][39m Trial 274 finished with value: 0.7155963302752292 and parameters: {'algorithm': 'kd_tree', 'n_neighbors': 14, 'weights': 'distance', 'metric': 'minkowski'}. Best is trial 28 with value: 0.7155963302752292.
[32m[I 2023-04-26 12:57:54,999][39m Trial 275 finished with value: 0.6964285714285714 and parameters: {'algorithm': 'ball_tree', 'n_neighbors': 15, 'weights': 'distance', 'metric': 'euclidean'}. Best is trial 28 with value: 0.7155963302752292.
[32m[I 2023-04-26 12:57:55,019][39m Trial 276 finished with value: 0.6964285714285714 and parameters: {'algorithm': 'ball_tree', 'n_neighbors': 13, 'weights': 'distance', 'metric': 'euclidean'}. Best is trial 28 with value: 0.7155963302752292.
[32m[I 2023-04-26 12:57:55,038][39m Trial 277 finished with value: 0.7155963302752292 and parameters: {'algorithm': 'ball_tree', 'n_neighbors': 14, 'weights': 'distance', 'metric': 'euclidean'}. Best is trial 28 with value: 0.7155963302752292.
[32m[I 2023-04-26 12:57:55,071][39m Trial 278 finished with value: 0.6964285714285714 and parameters: {'algorithm': 'brute', 'n_neighbors': 15, 'weights': 'distance', 'metric': 'euclidean'}. Best is trial 28 with value: 0.7155963302752292.
[32m[I 2023-04-26 12:57:55,089][39m Trial 279 finished with value: 0.709090909090909 and parameters: {'algorithm': 'auto', 'n_neighbors': 16, 'weights': 'distance', 'metric': 'euclidean'}. Best is trial 28 with value: 0.7155963302752292.
[32m[I 2023-04-26 12:57:55,106][39m Trial 280 finished with value: 0.6964285714285714 and parameters: {'algorithm': 'kd_tree', 'n_neighbors': 13, 'weights': 'distance', 'metric': 'minkowski'}. Best is trial 28 with value: 0.7155963302752292.
[32m[I 2023-04-26 12:57:55,138][39m Trial 281 finished with value: 0.7027027027027026 and parameters: {'algorithm': 'brute', 'n_neighbors': 12, 'weights': 'distance', 'metric': 'euclidean'}. Best is trial 28 with value: 0.7155963302752292.
[32m[I 2023-04-26 12:57:55,155][39m Trial 282 finished with value: 0.7155963302752292 and parameters: {'algorithm': 'ball_tree', 'n_neighbors': 14, 'weights': 'distance', 'metric': 'euclidean'}. Best is trial 28 with value: 0.7155963302752292.
[32m[I 2023-04-26 12:57:55,172][39m Trial 283 finished with value: 0.7027027027027026 and parameters: {'algorithm': 'ball_tree', 'n_neighbors': 14, 'weights': 'distance', 'metric': 'manhattan'}. Best is trial 28 with value: 0.7155963302752292.
[32m[I 2023-04-26 12:57:55,193][39m Trial 284 finished with value: 0.6486486486486486 and parameters: {'algorithm': 'kd_tree', 'n_neighbors': 15, 'weights': 'uniform', 'metric': 'minkowski'}. Best is trial 28 with value: 0.7155963302752292.
[32m[I 2023-04-26 12:57:55,210][39m Trial 285 finished with value: 0.6964285714285714 and parameters: {'algorithm': 'ball_tree', 'n_neighbors': 13, 'weights': 'distance', 'metric': 'euclidean'}. Best is trial 28 with value: 0.7155963302752292.
[32m[I 2023-04-26 12:57:55,241][39m Trial 286 finished with value: 0.7155963302752292 and parameters: {'algorithm': 'brute', 'n_neighbors': 14, 'weights': 'distance', 'metric': 'euclidean'}. Best is trial 28 with value: 0.7155963302752292.
[32m[I 2023-04-26 12:57:55,272][39m Trial 287 finished with value: 0.6964285714285714 and parameters: {'algorithm': 'brute', 'n_neighbors': 15, 'weights': 'distance', 'metric': 'minkowski'}. Best is trial 28 with value: 0.7155963302752292.
[32m[I 2023-04-26 12:57:55,291][39m Trial 288 finished with value: 0.7155963302752292 and parameters: {'algorithm': 'kd_tree', 'n_neighbors': 14, 'weights': 'distance', 'metric': 'euclidean'}. Best is trial 28 with value: 0.7155963302752292.
[32m[I 2023-04-26 12:57:55,308][39m Trial 289 finished with value: 0.6964285714285714 and parameters: {'algorithm': 'kd_tree', 'n_neighbors': 13, 'weights': 'distance', 'metric': 'minkowski'}. Best is trial 28 with value: 0.7155963302752292.
[32m[I 2023-04-26 12:57:55,326][39m Trial 290 finished with value: 0.7155963302752292 and parameters: {'algorithm': 'ball_tree', 'n_neighbors': 14, 'weights': 'distance', 'metric': 'euclidean'}. Best is trial 28 with value: 0.7155963302752292.
[32m[I 2023-04-26 12:57:55,343][39m Trial 291 finished with value: 0.6964285714285714 and parameters: {'algorithm': 'ball_tree', 'n_neighbors': 5, 'weights': 'distance', 'metric': 'minkowski'}. Best is trial 28 with value: 0.7155963302752292.
[32m[I 2023-04-26 12:57:55,373][39m Trial 292 finished with value: 0.7155963302752292 and parameters: {'algorithm': 'brute', 'n_neighbors': 14, 'weights': 'distance', 'metric': 'minkowski'}. Best is trial 28 with value: 0.7155963302752292.
[32m[I 2023-04-26 12:57:55,405][39m Trial 293 finished with value: 0.6964285714285714 and parameters: {'algorithm': 'brute', 'n_neighbors': 16, 'weights': 'distance', 'metric': 'minkowski'}. Best is trial 28 with value: 0.7155963302752292.
[32m[I 2023-04-26 12:57:55,423][39m Trial 294 finished with value: 0.6964285714285714 and parameters: {'algorithm': 'kd_tree', 'n_neighbors': 13, 'weights': 'distance', 'metric': 'minkowski'}. Best is trial 28 with value: 0.7155963302752292.
[32m[I 2023-04-26 12:57:55,454][39m Trial 295 finished with value: 0.6964285714285714 and parameters: {'algorithm': 'brute', 'n_neighbors': 15, 'weights': 'distance', 'metric': 'minkowski'}. Best is trial 28 with value: 0.7155963302752292.
[32m[I 2023-04-26 12:57:55,485][39m Trial 296 finished with value: 0.7027027027027026 and parameters: {'algorithm': 'brute', 'n_neighbors': 12, 'weights': 'distance', 'metric': 'minkowski'}. Best is trial 28 with value: 0.7155963302752292.
[32m[I 2023-04-26 12:57:55,516][39m Trial 297 finished with value: 0.6964285714285714 and parameters: {'algorithm': 'brute', 'n_neighbors': 15, 'weights': 'distance', 'metric': 'minkowski'}. Best is trial 28 with value: 0.7155963302752292.
[32m[I 2023-04-26 12:57:55,535][39m Trial 298 finished with value: 0.7155963302752292 and parameters: {'algorithm': 'kd_tree', 'n_neighbors': 14, 'weights': 'distance', 'metric': 'euclidean'}. Best is trial 28 with value: 0.7155963302752292.
[32m[I 2023-04-26 12:57:55,566][39m Trial 299 finished with value: 0.6964285714285714 and parameters: {'algorithm': 'brute', 'n_neighbors': 13, 'weights': 'distance', 'metric': 'minkowski'}. Best is trial 28 with value: 0.7155963302752292.
[32m[I 2023-04-26 12:57:55,598][39m Trial 300 finished with value: 0.7027027027027026 and parameters: {'algorithm': 'brute', 'n_neighbors': 15, 'weights': 'distance', 'metric': 'manhattan'}. Best is trial 28 with value: 0.7155963302752292.
[32m[I 2023-04-26 12:57:55,630][39m Trial 301 finished with value: 0.7155963302752292 and parameters: {'algorithm': 'brute', 'n_neighbors': 14, 'weights': 'distance', 'metric': 'minkowski'}. Best is trial 28 with value: 0.7155963302752292.
[32m[I 2023-04-26 12:57:55,662][39m Trial 302 finished with value: 0.7155963302752292 and parameters: {'algorithm': 'brute', 'n_neighbors': 14, 'weights': 'distance', 'metric': 'minkowski'}. Best is trial 28 with value: 0.7155963302752292.
[32m[I 2023-04-26 12:57:55,695][39m Trial 303 finished with value: 0.6964285714285714 and parameters: {'algorithm': 'brute', 'n_neighbors': 13, 'weights': 'distance', 'metric': 'minkowski'}. Best is trial 28 with value: 0.7155963302752292.
[32m[I 2023-04-26 12:57:55,726][39m Trial 304 finished with value: 0.6964285714285714 and parameters: {'algorithm': 'brute', 'n_neighbors': 15, 'weights': 'distance', 'metric': 'minkowski'}. Best is trial 28 with value: 0.7155963302752292.
[32m[I 2023-04-26 12:57:55,757][39m Trial 305 finished with value: 0.7155963302752292 and parameters: {'algorithm': 'brute', 'n_neighbors': 14, 'weights': 'distance', 'metric': 'minkowski'}. Best is trial 28 with value: 0.7155963302752292.
[32m[I 2023-04-26 12:57:55,776][39m Trial 306 finished with value: 0.6964285714285714 and parameters: {'algorithm': 'ball_tree', 'n_neighbors': 13, 'weights': 'distance', 'metric': 'minkowski'}. Best is trial 28 with value: 0.7155963302752292.
[32m[I 2023-04-26 12:57:55,797][39m Trial 307 finished with value: 0.5858585858585859 and parameters: {'algorithm': 'ball_tree', 'n_neighbors': 16, 'weights': 'uniform', 'metric': 'minkowski'}. Best is trial 28 with value: 0.7155963302752292.
[32m[I 2023-04-26 12:57:55,814][39m Trial 308 finished with value: 0.7155963302752292 and parameters: {'algorithm': 'ball_tree', 'n_neighbors': 14, 'weights': 'distance', 'metric': 'euclidean'}. Best is trial 28 with value: 0.7155963302752292.
[32m[I 2023-04-26 12:57:55,832][39m Trial 309 finished with value: 0.7155963302752292 and parameters: {'algorithm': 'ball_tree', 'n_neighbors': 14, 'weights': 'distance', 'metric': 'euclidean'}. Best is trial 28 with value: 0.7155963302752292.
[32m[I 2023-04-26 12:57:55,849][39m Trial 310 finished with value: 0.6964285714285714 and parameters: {'algorithm': 'ball_tree', 'n_neighbors': 15, 'weights': 'distance', 'metric': 'euclidean'}. Best is trial 28 with value: 0.7155963302752292.
[32m[I 2023-04-26 12:57:55,876][39m Trial 311 finished with value: 0.7027027027027026 and parameters: {'algorithm': 'brute', 'n_neighbors': 12, 'weights': 'distance', 'metric': 'euclidean'}. Best is trial 28 with value: 0.7155963302752292.
[32m[I 2023-04-26 12:57:55,907][39m Trial 312 finished with value: 0.6964285714285714 and parameters: {'algorithm': 'brute', 'n_neighbors': 13, 'weights': 'distance', 'metric': 'minkowski'}. Best is trial 28 with value: 0.7155963302752292.
[32m[I 2023-04-26 12:57:55,939][39m Trial 313 finished with value: 0.7155963302752292 and parameters: {'algorithm': 'brute', 'n_neighbors': 14, 'weights': 'distance', 'metric': 'euclidean'}. Best is trial 28 with value: 0.7155963302752292.
[32m[I 2023-04-26 12:57:55,957][39m Trial 314 finished with value: 0.7155963302752292 and parameters: {'algorithm': 'auto', 'n_neighbors': 14, 'weights': 'distance', 'metric': 'euclidean'}. Best is trial 28 with value: 0.7155963302752292.
[32m[I 2023-04-26 12:57:55,975][39m Trial 315 finished with value: 0.7155963302752292 and parameters: {'algorithm': 'auto', 'n_neighbors': 14, 'weights': 'distance', 'metric': 'euclidean'}. Best is trial 28 with value: 0.7155963302752292.
[32m[I 2023-04-26 12:57:55,993][39m Trial 316 finished with value: 0.6964285714285714 and parameters: {'algorithm': 'auto', 'n_neighbors': 13, 'weights': 'distance', 'metric': 'euclidean'}. Best is trial 28 with value: 0.7155963302752292.
[32m[I 2023-04-26 12:57:56,010][39m Trial 317 finished with value: 0.6964285714285714 and parameters: {'algorithm': 'auto', 'n_neighbors': 15, 'weights': 'distance', 'metric': 'euclidean'}. Best is trial 28 with value: 0.7155963302752292.
[32m[I 2023-04-26 12:57:56,029][39m Trial 318 finished with value: 0.6964285714285714 and parameters: {'algorithm': 'ball_tree', 'n_neighbors': 15, 'weights': 'distance', 'metric': 'euclidean'}. Best is trial 28 with value: 0.7155963302752292.
[32m[I 2023-04-26 12:57:56,044][39m Trial 319 finished with value: 0.6964285714285714 and parameters: {'algorithm': 'ball_tree', 'n_neighbors': 26, 'weights': 'distance', 'metric': 'euclidean'}. Best is trial 28 with value: 0.7155963302752292.
[32m[I 2023-04-26 12:57:56,055][39m Trial 320 finished with value: 0.7155963302752292 and parameters: {'algorithm': 'ball_tree', 'n_neighbors': 14, 'weights': 'distance', 'metric': 'euclidean'}. Best is trial 28 with value: 0.7155963302752292.
[32m[I 2023-04-26 12:57:56,090][39m Trial 321 finished with value: 0.6964285714285714 and parameters: {'algorithm': 'brute', 'n_neighbors': 16, 'weights': 'distance', 'metric': 'minkowski'}. Best is trial 28 with value: 0.7155963302752292.
[32m[I 2023-04-26 12:57:56,108][39m Trial 322 finished with value: 0.6964285714285714 and parameters: {'algorithm': 'kd_tree', 'n_neighbors': 13, 'weights': 'distance', 'metric': 'minkowski'}. Best is trial 28 with value: 0.7155963302752292.
[32m[I 2023-04-26 12:57:56,127][39m Trial 323 finished with value: 0.7027027027027026 and parameters: {'algorithm': 'kd_tree', 'n_neighbors': 12, 'weights': 'distance', 'metric': 'euclidean'}. Best is trial 28 with value: 0.7155963302752292.
[32m[I 2023-04-26 12:57:56,155][39m Trial 324 finished with value: 0.6371681415929203 and parameters: {'algorithm': 'brute', 'n_neighbors': 15, 'weights': 'uniform', 'metric': 'minkowski'}. Best is trial 28 with value: 0.7155963302752292.
[32m[I 2023-04-26 12:57:56,165][39m Trial 325 finished with value: 0.7155963302752292 and parameters: {'algorithm': 'kd_tree', 'n_neighbors': 14, 'weights': 'distance', 'metric': 'euclidean'}. Best is trial 28 with value: 0.7155963302752292.
[32m[I 2023-04-26 12:57:56,198][39m Trial 326 finished with value: 0.7155963302752292 and parameters: {'algorithm': 'brute', 'n_neighbors': 14, 'weights': 'distance', 'metric': 'minkowski'}. Best is trial 28 with value: 0.7155963302752292.
[32m[I 2023-04-26 12:57:56,234][39m Trial 327 finished with value: 0.6964285714285714 and parameters: {'algorithm': 'brute', 'n_neighbors': 13, 'weights': 'distance', 'metric': 'minkowski'}. Best is trial 28 with value: 0.7155963302752292.
[32m[I 2023-04-26 12:57:56,253][39m Trial 328 finished with value: 0.6964285714285714 and parameters: {'algorithm': 'kd_tree', 'n_neighbors': 15, 'weights': 'distance', 'metric': 'euclidean'}. Best is trial 28 with value: 0.7155963302752292.
[32m[I 2023-04-26 12:57:56,271][39m Trial 329 finished with value: 0.7155963302752292 and parameters: {'algorithm': 'ball_tree', 'n_neighbors': 14, 'weights': 'distance', 'metric': 'euclidean'}. Best is trial 28 with value: 0.7155963302752292.
[32m[I 2023-04-26 12:57:56,290][39m Trial 330 finished with value: 0.6964285714285714 and parameters: {'algorithm': 'ball_tree', 'n_neighbors': 13, 'weights': 'distance', 'metric': 'euclidean'}. Best is trial 28 with value: 0.7155963302752292.
[32m[I 2023-04-26 12:57:56,322][39m Trial 331 finished with value: 0.6964285714285714 and parameters: {'algorithm': 'brute', 'n_neighbors': 22, 'weights': 'distance', 'metric': 'euclidean'}. Best is trial 28 with value: 0.7155963302752292.
[32m[I 2023-04-26 12:57:56,341][39m Trial 332 finished with value: 0.7155963302752292 and parameters: {'algorithm': 'ball_tree', 'n_neighbors': 14, 'weights': 'distance', 'metric': 'euclidean'}. Best is trial 28 with value: 0.7155963302752292.
[32m[I 2023-04-26 12:57:56,359][39m Trial 333 finished with value: 0.6964285714285714 and parameters: {'algorithm': 'ball_tree', 'n_neighbors': 15, 'weights': 'distance', 'metric': 'minkowski'}. Best is trial 28 with value: 0.7155963302752292.
[32m[I 2023-04-26 12:57:56,392][39m Trial 334 finished with value: 0.6964285714285714 and parameters: {'algorithm': 'brute', 'n_neighbors': 16, 'weights': 'distance', 'metric': 'manhattan'}. Best is trial 28 with value: 0.7155963302752292.
[32m[I 2023-04-26 12:57:56,410][39m Trial 335 finished with value: 0.7155963302752292 and parameters: {'algorithm': 'ball_tree', 'n_neighbors': 14, 'weights': 'distance', 'metric': 'euclidean'}. Best is trial 28 with value: 0.7155963302752292.
[32m[I 2023-04-26 12:57:56,429][39m Trial 336 finished with value: 0.6964285714285714 and parameters: {'algorithm': 'ball_tree', 'n_neighbors': 13, 'weights': 'distance', 'metric': 'minkowski'}. Best is trial 28 with value: 0.7155963302752292.
[32m[I 2023-04-26 12:57:56,461][39m Trial 337 finished with value: 0.6964285714285714 and parameters: {'algorithm': 'brute', 'n_neighbors': 15, 'weights': 'distance', 'metric': 'euclidean'}. Best is trial 28 with value: 0.7155963302752292.
[32m[I 2023-04-26 12:57:56,494][39m Trial 338 finished with value: 0.7155963302752292 and parameters: {'algorithm': 'brute', 'n_neighbors': 14, 'weights': 'distance', 'metric': 'euclidean'}. Best is trial 28 with value: 0.7155963302752292.
[32m[I 2023-04-26 12:57:56,512][39m Trial 339 finished with value: 0.7027027027027026 and parameters: {'algorithm': 'ball_tree', 'n_neighbors': 12, 'weights': 'distance', 'metric': 'euclidean'}. Best is trial 28 with value: 0.7155963302752292.
[32m[I 2023-04-26 12:57:56,530][39m Trial 340 finished with value: 0.7155963302752292 and parameters: {'algorithm': 'kd_tree', 'n_neighbors': 14, 'weights': 'distance', 'metric': 'minkowski'}. Best is trial 28 with value: 0.7155963302752292.
[32m[I 2023-04-26 12:57:56,548][39m Trial 341 finished with value: 0.6964285714285714 and parameters: {'algorithm': 'ball_tree', 'n_neighbors': 13, 'weights': 'distance', 'metric': 'euclidean'}. Best is trial 28 with value: 0.7155963302752292.
[32m[I 2023-04-26 12:57:56,565][39m Trial 342 finished with value: 0.6964285714285714 and parameters: {'algorithm': 'ball_tree', 'n_neighbors': 15, 'weights': 'distance', 'metric': 'euclidean'}. Best is trial 28 with value: 0.7155963302752292.
[32m[I 2023-04-26 12:57:56,586][39m Trial 343 finished with value: 0.7155963302752292 and parameters: {'algorithm': 'ball_tree', 'n_neighbors': 14, 'weights': 'distance', 'metric': 'minkowski'}. Best is trial 28 with value: 0.7155963302752292.
[32m[I 2023-04-26 12:57:56,598][39m Trial 344 finished with value: 0.6964285714285714 and parameters: {'algorithm': 'ball_tree', 'n_neighbors': 13, 'weights': 'distance', 'metric': 'minkowski'}. Best is trial 28 with value: 0.7155963302752292.
[32m[I 2023-04-26 12:57:56,622][39m Trial 345 finished with value: 0.6964285714285714 and parameters: {'algorithm': 'brute', 'n_neighbors': 15, 'weights': 'distance', 'metric': 'euclidean'}. Best is trial 28 with value: 0.7155963302752292.
[32m[I 2023-04-26 12:57:56,653][39m Trial 346 finished with value: 0.5858585858585859 and parameters: {'algorithm': 'brute', 'n_neighbors': 14, 'weights': 'uniform', 'metric': 'minkowski'}. Best is trial 28 with value: 0.7155963302752292.
[32m[I 2023-04-26 12:57:56,667][39m Trial 347 finished with value: 0.6964285714285714 and parameters: {'algorithm': 'ball_tree', 'n_neighbors': 13, 'weights': 'distance', 'metric': 'minkowski'}. Best is trial 28 with value: 0.7155963302752292.
[32m[I 2023-04-26 12:57:56,679][39m Trial 348 finished with value: 0.709090909090909 and parameters: {'algorithm': 'ball_tree', 'n_neighbors': 7, 'weights': 'distance', 'metric': 'minkowski'}. Best is trial 28 with value: 0.7155963302752292.
[32m[I 2023-04-26 12:57:56,715][39m Trial 349 finished with value: 0.7155963302752292 and parameters: {'algorithm': 'brute', 'n_neighbors': 14, 'weights': 'distance', 'metric': 'minkowski'}. Best is trial 28 with value: 0.7155963302752292.
[32m[I 2023-04-26 12:57:56,753][39m Trial 350 finished with value: 0.6964285714285714 and parameters: {'algorithm': 'brute', 'n_neighbors': 15, 'weights': 'distance', 'metric': 'minkowski'}. Best is trial 28 with value: 0.7155963302752292.
[32m[I 2023-04-26 12:57:56,772][39m Trial 351 finished with value: 0.6964285714285714 and parameters: {'algorithm': 'auto', 'n_neighbors': 17, 'weights': 'distance', 'metric': 'manhattan'}. Best is trial 28 with value: 0.7155963302752292.
[32m[I 2023-04-26 12:57:56,805][39m Trial 352 finished with value: 0.7155963302752292 and parameters: {'algorithm': 'brute', 'n_neighbors': 14, 'weights': 'distance', 'metric': 'euclidean'}. Best is trial 28 with value: 0.7155963302752292.
[32m[I 2023-04-26 12:57:56,839][39m Trial 353 finished with value: 0.6964285714285714 and parameters: {'algorithm': 'brute', 'n_neighbors': 16, 'weights': 'distance', 'metric': 'euclidean'}. Best is trial 28 with value: 0.7155963302752292.
[32m[I 2023-04-26 12:57:56,870][39m Trial 354 finished with value: 0.6964285714285714 and parameters: {'algorithm': 'brute', 'n_neighbors': 13, 'weights': 'distance', 'metric': 'euclidean'}. Best is trial 28 with value: 0.7155963302752292.
[32m[I 2023-04-26 12:57:56,890][39m Trial 355 finished with value: 0.7155963302752292 and parameters: {'algorithm': 'ball_tree', 'n_neighbors': 14, 'weights': 'distance', 'metric': 'minkowski'}. Best is trial 28 with value: 0.7155963302752292.
[32m[I 2023-04-26 12:57:56,908][39m Trial 356 finished with value: 0.7027027027027026 and parameters: {'algorithm': 'ball_tree', 'n_neighbors': 12, 'weights': 'distance', 'metric': 'minkowski'}. Best is trial 28 with value: 0.7155963302752292.
[32m[I 2023-04-26 12:57:56,927][39m Trial 357 finished with value: 0.6964285714285714 and parameters: {'algorithm': 'ball_tree', 'n_neighbors': 15, 'weights': 'distance', 'metric': 'minkowski'}. Best is trial 28 with value: 0.7155963302752292.
[32m[I 2023-04-26 12:57:56,946][39m Trial 358 finished with value: 0.6964285714285714 and parameters: {'algorithm': 'ball_tree', 'n_neighbors': 13, 'weights': 'distance', 'metric': 'euclidean'}. Best is trial 28 with value: 0.7155963302752292.
[32m[I 2023-04-26 12:57:56,978][39m Trial 359 finished with value: 0.7155963302752292 and parameters: {'algorithm': 'brute', 'n_neighbors': 14, 'weights': 'distance', 'metric': 'euclidean'}. Best is trial 28 with value: 0.7155963302752292.
