[32m[I 2023-04-26 12:57:52,941][39m Trial 180 finished with value: 0.6964285714285714 and parameters: {'algorithm': 'ball_tree', 'n_neighbors': 15, 'weights': 'distance', 'metric': 'minkowski'}. Best is trial 28 with value: 0.7155963302752292.
[32m[I 2023-04-26 12:57:52,956][39m Trial 181 finished with value: 0.7155963302752292 and parameters: {'algorithm': 'ball_tree', 'n_neighbors': 14, 'weights': 'distance', 'metric': 'euclidean'}. Best is trial 28 with value: 0.7155963302752292.
[32m[I 2023-04-26 12:57:52,971][39m Trial 182 finished with value: 0.7155963302752292 and parameters: {'algorithm': 'ball_tree', 'n_neighbors': 14, 'weights': 'distance', 'metric': 'euclidean'}. Best is trial 28 with value: 0.7155963302752292.
[32m[I 2023-04-26 12:57:52,999][39m Trial 183 finished with value: 0.6964285714285714 and parameters: {'algorithm': 'brute', 'n_neighbors': 13, 'weights': 'distance', 'metric': 'euclidean'}. Best is trial 28 with value: 0.7155963302752292.
[32m[I 2023-04-26 12:57:53,026][39m Trial 184 finished with value: 0.7155963302752292 and parameters: {'algorithm': 'brute', 'n_neighbors': 14, 'weights': 'distance', 'metric': 'euclidean'}. Best is trial 28 with value: 0.7155963302752292.
[32m[I 2023-04-26 12:57:53,042][39m Trial 185 finished with value: 0.6964285714285714 and parameters: {'algorithm': 'ball_tree', 'n_neighbors': 15, 'weights': 'distance', 'metric': 'euclidean'}. Best is trial 28 with value: 0.7155963302752292.
[32m[I 2023-04-26 12:57:53,069][39m Trial 186 finished with value: 0.7155963302752292 and parameters: {'algorithm': 'brute', 'n_neighbors': 14, 'weights': 'distance', 'metric': 'euclidean'}. Best is trial 28 with value: 0.7155963302752292.
[32m[I 2023-04-26 12:57:53,100][39m Trial 187 finished with value: 0.6964285714285714 and parameters: {'algorithm': 'brute', 'n_neighbors': 16, 'weights': 'distance', 'metric': 'euclidean'}. Best is trial 28 with value: 0.7155963302752292.
[32m[I 2023-04-26 12:57:53,128][39m Trial 188 finished with value: 0.6964285714285714 and parameters: {'algorithm': 'brute', 'n_neighbors': 13, 'weights': 'distance', 'metric': 'euclidean'}. Best is trial 28 with value: 0.7155963302752292.
[32m[I 2023-04-26 12:57:53,156][39m Trial 189 finished with value: 0.6964285714285714 and parameters: {'algorithm': 'brute', 'n_neighbors': 15, 'weights': 'distance', 'metric': 'euclidean'}. Best is trial 28 with value: 0.7155963302752292.
[32m[I 2023-04-26 12:57:53,172][39m Trial 190 finished with value: 0.7027027027027026 and parameters: {'algorithm': 'kd_tree', 'n_neighbors': 12, 'weights': 'distance', 'metric': 'euclidean'}. Best is trial 28 with value: 0.7155963302752292.
[32m[I 2023-04-26 12:57:53,200][39m Trial 191 finished with value: 0.7155963302752292 and parameters: {'algorithm': 'brute', 'n_neighbors': 14, 'weights': 'distance', 'metric': 'minkowski'}. Best is trial 28 with value: 0.7155963302752292.
[32m[I 2023-04-26 12:57:53,228][39m Trial 192 finished with value: 0.7155963302752292 and parameters: {'algorithm': 'brute', 'n_neighbors': 14, 'weights': 'distance', 'metric': 'minkowski'}. Best is trial 28 with value: 0.7155963302752292.
[32m[I 2023-04-26 12:57:53,256][39m Trial 193 finished with value: 0.6964285714285714 and parameters: {'algorithm': 'brute', 'n_neighbors': 13, 'weights': 'distance', 'metric': 'euclidean'}. Best is trial 28 with value: 0.7155963302752292.
[32m[I 2023-04-26 12:57:53,285][39m Trial 194 finished with value: 0.7155963302752292 and parameters: {'algorithm': 'brute', 'n_neighbors': 14, 'weights': 'distance', 'metric': 'minkowski'}. Best is trial 28 with value: 0.7155963302752292.
[32m[I 2023-04-26 12:57:53,315][39m Trial 195 finished with value: 0.7155963302752292 and parameters: {'algorithm': 'brute', 'n_neighbors': 14, 'weights': 'distance', 'metric': 'euclidean'}. Best is trial 28 with value: 0.7155963302752292.
[32m[I 2023-04-26 12:57:53,341][39m Trial 196 finished with value: 0.6964285714285714 and parameters: {'algorithm': 'brute', 'n_neighbors': 15, 'weights': 'distance', 'metric': 'euclidean'}. Best is trial 28 with value: 0.7155963302752292.
[32m[I 2023-04-26 12:57:53,356][39m Trial 197 finished with value: 0.6964285714285714 and parameters: {'algorithm': 'kd_tree', 'n_neighbors': 13, 'weights': 'distance', 'metric': 'minkowski'}. Best is trial 28 with value: 0.7155963302752292.
[32m[I 2023-04-26 12:57:53,371][39m Trial 198 finished with value: 0.7155963302752292 and parameters: {'algorithm': 'ball_tree', 'n_neighbors': 14, 'weights': 'distance', 'metric': 'minkowski'}. Best is trial 28 with value: 0.7155963302752292.
[32m[I 2023-04-26 12:57:53,386][39m Trial 199 finished with value: 0.6964285714285714 and parameters: {'algorithm': 'ball_tree', 'n_neighbors': 15, 'weights': 'distance', 'metric': 'minkowski'}. Best is trial 28 with value: 0.7155963302752292.
[32m[I 2023-04-26 12:57:53,402][39m Trial 200 finished with value: 0.7155963302752292 and parameters: {'algorithm': 'ball_tree', 'n_neighbors': 14, 'weights': 'distance', 'metric': 'minkowski'}. Best is trial 28 with value: 0.7155963302752292.
[32m[I 2023-04-26 12:57:53,430][39m Trial 201 finished with value: 0.7155963302752292 and parameters: {'algorithm': 'brute', 'n_neighbors': 14, 'weights': 'distance', 'metric': 'minkowski'}. Best is trial 28 with value: 0.7155963302752292.
[32m[I 2023-04-26 12:57:53,459][39m Trial 202 finished with value: 0.7155963302752292 and parameters: {'algorithm': 'brute', 'n_neighbors': 14, 'weights': 'distance', 'metric': 'minkowski'}. Best is trial 28 with value: 0.7155963302752292.
[32m[I 2023-04-26 12:57:53,475][39m Trial 203 finished with value: 0.6964285714285714 and parameters: {'algorithm': 'auto', 'n_neighbors': 13, 'weights': 'distance', 'metric': 'minkowski'}. Best is trial 28 with value: 0.7155963302752292.
[32m[I 2023-04-26 12:57:53,491][39m Trial 204 finished with value: 0.6964285714285714 and parameters: {'algorithm': 'ball_tree', 'n_neighbors': 15, 'weights': 'distance', 'metric': 'minkowski'}. Best is trial 28 with value: 0.7155963302752292.
[32m[I 2023-04-26 12:57:53,507][39m Trial 205 finished with value: 0.6964285714285714 and parameters: {'algorithm': 'kd_tree', 'n_neighbors': 13, 'weights': 'distance', 'metric': 'euclidean'}. Best is trial 28 with value: 0.7155963302752292.
[32m[I 2023-04-26 12:57:53,533][39m Trial 206 finished with value: 0.5858585858585859 and parameters: {'algorithm': 'brute', 'n_neighbors': 14, 'weights': 'uniform', 'metric': 'minkowski'}. Best is trial 28 with value: 0.7155963302752292.
[32m[I 2023-04-26 12:57:53,547][39m Trial 207 finished with value: 0.7155963302752292 and parameters: {'algorithm': 'ball_tree', 'n_neighbors': 14, 'weights': 'distance', 'metric': 'euclidean'}. Best is trial 28 with value: 0.7155963302752292.
[32m[I 2023-04-26 12:57:53,564][39m Trial 208 finished with value: 0.6964285714285714 and parameters: {'algorithm': 'kd_tree', 'n_neighbors': 15, 'weights': 'distance', 'metric': 'euclidean'}. Best is trial 28 with value: 0.7155963302752292.
[32m[I 2023-04-26 12:57:53,580][39m Trial 209 finished with value: 0.6964285714285714 and parameters: {'algorithm': 'kd_tree', 'n_neighbors': 16, 'weights': 'distance', 'metric': 'manhattan'}. Best is trial 28 with value: 0.7155963302752292.
[32m[I 2023-04-26 12:57:53,589][39m Trial 210 finished with value: 0.6964285714285714 and parameters: {'algorithm': 'ball_tree', 'n_neighbors': 13, 'weights': 'distance', 'metric': 'euclidean'}. Best is trial 28 with value: 0.7155963302752292.
[32m[I 2023-04-26 12:57:53,597][39m Trial 211 finished with value: 0.7155963302752292 and parameters: {'algorithm': 'ball_tree', 'n_neighbors': 14, 'weights': 'distance', 'metric': 'euclidean'}. Best is trial 28 with value: 0.7155963302752292.
[32m[I 2023-04-26 12:57:53,630][39m Trial 212 finished with value: 0.6964285714285714 and parameters: {'algorithm': 'brute', 'n_neighbors': 15, 'weights': 'distance', 'metric': 'euclidean'}. Best is trial 28 with value: 0.7155963302752292.
[32m[I 2023-04-26 12:57:53,646][39m Trial 213 finished with value: 0.7155963302752292 and parameters: {'algorithm': 'ball_tree', 'n_neighbors': 14, 'weights': 'distance', 'metric': 'euclidean'}. Best is trial 28 with value: 0.7155963302752292.
[32m[I 2023-04-26 12:57:53,661][39m Trial 214 finished with value: 0.7155963302752292 and parameters: {'algorithm': 'ball_tree', 'n_neighbors': 14, 'weights': 'distance', 'metric': 'euclidean'}. Best is trial 28 with value: 0.7155963302752292.
[32m[I 2023-04-26 12:57:53,677][39m Trial 215 finished with value: 0.6964285714285714 and parameters: {'algorithm': 'ball_tree', 'n_neighbors': 13, 'weights': 'distance', 'metric': 'euclidean'}. Best is trial 28 with value: 0.7155963302752292.
[32m[I 2023-04-26 12:57:53,709][39m Trial 216 finished with value: 0.6964285714285714 and parameters: {'algorithm': 'brute', 'n_neighbors': 13, 'weights': 'distance', 'metric': 'minkowski'}. Best is trial 28 with value: 0.7155963302752292.
[32m[I 2023-04-26 12:57:53,740][39m Trial 217 finished with value: 0.7155963302752292 and parameters: {'algorithm': 'brute', 'n_neighbors': 14, 'weights': 'distance', 'metric': 'minkowski'}. Best is trial 28 with value: 0.7155963302752292.
[32m[I 2023-04-26 12:57:53,769][39m Trial 218 finished with value: 0.6964285714285714 and parameters: {'algorithm': 'brute', 'n_neighbors': 15, 'weights': 'distance', 'metric': 'euclidean'}. Best is trial 28 with value: 0.7155963302752292.
[32m[I 2023-04-26 12:57:53,786][39m Trial 219 finished with value: 0.7155963302752292 and parameters: {'algorithm': 'kd_tree', 'n_neighbors': 14, 'weights': 'distance', 'metric': 'euclidean'}. Best is trial 28 with value: 0.7155963302752292.
[32m[I 2023-04-26 12:57:53,816][39m Trial 220 finished with value: 0.6964285714285714 and parameters: {'algorithm': 'brute', 'n_neighbors': 15, 'weights': 'distance', 'metric': 'euclidean'}. Best is trial 28 with value: 0.7155963302752292.
[32m[I 2023-04-26 12:57:53,833][39m Trial 221 finished with value: 0.7155963302752292 and parameters: {'algorithm': 'kd_tree', 'n_neighbors': 14, 'weights': 'distance', 'metric': 'minkowski'}. Best is trial 28 with value: 0.7155963302752292.
[32m[I 2023-04-26 12:57:53,849][39m Trial 222 finished with value: 0.7155963302752292 and parameters: {'algorithm': 'kd_tree', 'n_neighbors': 14, 'weights': 'distance', 'metric': 'minkowski'}. Best is trial 28 with value: 0.7155963302752292.
[32m[I 2023-04-26 12:57:53,878][39m Trial 223 finished with value: 0.6964285714285714 and parameters: {'algorithm': 'brute', 'n_neighbors': 13, 'weights': 'distance', 'metric': 'euclidean'}. Best is trial 28 with value: 0.7155963302752292.
[32m[I 2023-04-26 12:57:53,894][39m Trial 224 finished with value: 0.7155963302752292 and parameters: {'algorithm': 'ball_tree', 'n_neighbors': 14, 'weights': 'distance', 'metric': 'minkowski'}. Best is trial 28 with value: 0.7155963302752292.
[32m[I 2023-04-26 12:57:53,909][39m Trial 225 finished with value: 0.6964285714285714 and parameters: {'algorithm': 'ball_tree', 'n_neighbors': 15, 'weights': 'distance', 'metric': 'minkowski'}. Best is trial 28 with value: 0.7155963302752292.
[32m[I 2023-04-26 12:57:53,940][39m Trial 226 finished with value: 0.7155963302752292 and parameters: {'algorithm': 'brute', 'n_neighbors': 14, 'weights': 'distance', 'metric': 'minkowski'}. Best is trial 28 with value: 0.7155963302752292.
[32m[I 2023-04-26 12:57:53,968][39m Trial 227 finished with value: 0.6964285714285714 and parameters: {'algorithm': 'brute', 'n_neighbors': 13, 'weights': 'distance', 'metric': 'minkowski'}. Best is trial 28 with value: 0.7155963302752292.
[32m[I 2023-04-26 12:57:53,998][39m Trial 228 finished with value: 0.7155963302752292 and parameters: {'algorithm': 'brute', 'n_neighbors': 14, 'weights': 'distance', 'metric': 'minkowski'}. Best is trial 28 with value: 0.7155963302752292.
[32m[I 2023-04-26 12:57:54,028][39m Trial 229 finished with value: 0.7027027027027026 and parameters: {'algorithm': 'brute', 'n_neighbors': 12, 'weights': 'distance', 'metric': 'euclidean'}. Best is trial 28 with value: 0.7155963302752292.
[32m[I 2023-04-26 12:57:54,045][39m Trial 230 finished with value: 0.6964285714285714 and parameters: {'algorithm': 'kd_tree', 'n_neighbors': 15, 'weights': 'distance', 'metric': 'euclidean'}. Best is trial 28 with value: 0.7155963302752292.
[32m[I 2023-04-26 12:57:54,061][39m Trial 231 finished with value: 0.7155963302752292 and parameters: {'algorithm': 'ball_tree', 'n_neighbors': 14, 'weights': 'distance', 'metric': 'minkowski'}. Best is trial 28 with value: 0.7155963302752292.
[32m[I 2023-04-26 12:57:54,092][39m Trial 232 finished with value: 0.7155963302752292 and parameters: {'algorithm': 'brute', 'n_neighbors': 14, 'weights': 'distance', 'metric': 'minkowski'}. Best is trial 28 with value: 0.7155963302752292.
[32m[I 2023-04-26 12:57:54,123][39m Trial 233 finished with value: 0.6964285714285714 and parameters: {'algorithm': 'brute', 'n_neighbors': 13, 'weights': 'distance', 'metric': 'minkowski'}. Best is trial 28 with value: 0.7155963302752292.
[32m[I 2023-04-26 12:57:54,161][39m Trial 234 finished with value: 0.7155963302752292 and parameters: {'algorithm': 'brute', 'n_neighbors': 14, 'weights': 'distance', 'metric': 'euclidean'}. Best is trial 28 with value: 0.7155963302752292.
[32m[I 2023-04-26 12:57:54,177][39m Trial 235 finished with value: 0.6964285714285714 and parameters: {'algorithm': 'ball_tree', 'n_neighbors': 15, 'weights': 'distance', 'metric': 'euclidean'}. Best is trial 28 with value: 0.7155963302752292.
[32m[I 2023-04-26 12:57:54,193][39m Trial 236 finished with value: 0.7155963302752292 and parameters: {'algorithm': 'ball_tree', 'n_neighbors': 14, 'weights': 'distance', 'metric': 'minkowski'}. Best is trial 28 with value: 0.7155963302752292.
[32m[I 2023-04-26 12:57:54,209][39m Trial 237 finished with value: 0.6964285714285714 and parameters: {'algorithm': 'ball_tree', 'n_neighbors': 13, 'weights': 'distance', 'metric': 'minkowski'}. Best is trial 28 with value: 0.7155963302752292.
[32m[I 2023-04-26 12:57:54,239][39m Trial 238 finished with value: 0.6956521739130435 and parameters: {'algorithm': 'brute', 'n_neighbors': 1, 'weights': 'distance', 'metric': 'euclidean'}. Best is trial 28 with value: 0.7155963302752292.
[32m[I 2023-04-26 12:57:54,255][39m Trial 239 finished with value: 0.7155963302752292 and parameters: {'algorithm': 'ball_tree', 'n_neighbors': 14, 'weights': 'distance', 'metric': 'minkowski'}. Best is trial 28 with value: 0.7155963302752292.
[32m[I 2023-04-26 12:57:54,282][39m Trial 240 finished with value: 0.6371681415929203 and parameters: {'algorithm': 'brute', 'n_neighbors': 15, 'weights': 'uniform', 'metric': 'minkowski'}. Best is trial 28 with value: 0.7155963302752292.
[32m[I 2023-04-26 12:57:54,295][39m Trial 241 finished with value: 0.7155963302752292 and parameters: {'algorithm': 'ball_tree', 'n_neighbors': 14, 'weights': 'distance', 'metric': 'euclidean'}. Best is trial 28 with value: 0.7155963302752292.
[32m[I 2023-04-26 12:57:54,324][39m Trial 242 finished with value: 0.6964285714285714 and parameters: {'algorithm': 'brute', 'n_neighbors': 13, 'weights': 'distance', 'metric': 'euclidean'}. Best is trial 28 with value: 0.7155963302752292.
[32m[I 2023-04-26 12:57:54,342][39m Trial 243 finished with value: 0.7155963302752292 and parameters: {'algorithm': 'ball_tree', 'n_neighbors': 14, 'weights': 'distance', 'metric': 'euclidean'}. Best is trial 28 with value: 0.7155963302752292.
[32m[I 2023-04-26 12:57:54,372][39m Trial 244 finished with value: 0.6964285714285714 and parameters: {'algorithm': 'brute', 'n_neighbors': 15, 'weights': 'distance', 'metric': 'euclidean'}. Best is trial 28 with value: 0.7155963302752292.
[32m[I 2023-04-26 12:57:54,390][39m Trial 245 finished with value: 0.6964285714285714 and parameters: {'algorithm': 'kd_tree', 'n_neighbors': 13, 'weights': 'distance', 'metric': 'euclidean'}. Best is trial 28 with value: 0.7155963302752292.
[32m[I 2023-04-26 12:57:54,405][39m Trial 246 finished with value: 0.7155963302752292 and parameters: {'algorithm': 'kd_tree', 'n_neighbors': 14, 'weights': 'distance', 'metric': 'euclidean'}. Best is trial 28 with value: 0.7155963302752292.
[32m[I 2023-04-26 12:57:54,435][39m Trial 247 finished with value: 0.6964285714285714 and parameters: {'algorithm': 'brute', 'n_neighbors': 15, 'weights': 'distance', 'metric': 'euclidean'}. Best is trial 28 with value: 0.7155963302752292.
[32m[I 2023-04-26 12:57:54,453][39m Trial 248 finished with value: 0.7155963302752292 and parameters: {'algorithm': 'kd_tree', 'n_neighbors': 14, 'weights': 'distance', 'metric': 'euclidean'}. Best is trial 28 with value: 0.7155963302752292.
[32m[I 2023-04-26 12:57:54,482][39m Trial 249 finished with value: 0.7155963302752292 and parameters: {'algorithm': 'brute', 'n_neighbors': 14, 'weights': 'distance', 'metric': 'euclidean'}. Best is trial 28 with value: 0.7155963302752292.
[32m[I 2023-04-26 12:57:54,513][39m Trial 250 finished with value: 0.6964285714285714 and parameters: {'algorithm': 'brute', 'n_neighbors': 16, 'weights': 'distance', 'metric': 'euclidean'}. Best is trial 28 with value: 0.7155963302752292.
[32m[I 2023-04-26 12:57:54,530][39m Trial 251 finished with value: 0.6964285714285714 and parameters: {'algorithm': 'auto', 'n_neighbors': 13, 'weights': 'distance', 'metric': 'euclidean'}. Best is trial 28 with value: 0.7155963302752292.
[32m[I 2023-04-26 12:57:54,560][39m Trial 252 finished with value: 0.7155963302752292 and parameters: {'algorithm': 'brute', 'n_neighbors': 14, 'weights': 'distance', 'metric': 'euclidean'}. Best is trial 28 with value: 0.7155963302752292.
[32m[I 2023-04-26 12:57:54,591][39m Trial 253 finished with value: 0.6964285714285714 and parameters: {'algorithm': 'brute', 'n_neighbors': 15, 'weights': 'distance', 'metric': 'minkowski'}. Best is trial 28 with value: 0.7155963302752292.
[32m[I 2023-04-26 12:57:54,622][39m Trial 254 finished with value: 0.7155963302752292 and parameters: {'algorithm': 'brute', 'n_neighbors': 14, 'weights': 'distance', 'metric': 'minkowski'}. Best is trial 28 with value: 0.7155963302752292.
[32m[I 2023-04-26 12:57:54,653][39m Trial 255 finished with value: 0.6964285714285714 and parameters: {'algorithm': 'brute', 'n_neighbors': 13, 'weights': 'distance', 'metric': 'minkowski'}. Best is trial 28 with value: 0.7155963302752292.
[32m[I 2023-04-26 12:57:54,669][39m Trial 256 finished with value: 0.6964285714285714 and parameters: {'algorithm': 'ball_tree', 'n_neighbors': 15, 'weights': 'distance', 'metric': 'minkowski'}. Best is trial 28 with value: 0.7155963302752292.
[32m[I 2023-04-26 12:57:54,686][39m Trial 257 finished with value: 0.7027027027027026 and parameters: {'algorithm': 'kd_tree', 'n_neighbors': 14, 'weights': 'distance', 'metric': 'manhattan'}. Best is trial 28 with value: 0.7155963302752292.
[32m[I 2023-04-26 12:57:54,703][39m Trial 258 finished with value: 0.7027027027027026 and parameters: {'algorithm': 'kd_tree', 'n_neighbors': 12, 'weights': 'distance', 'metric': 'minkowski'}. Best is trial 28 with value: 0.7155963302752292.
[32m[I 2023-04-26 12:57:54,718][39m Trial 259 finished with value: 0.6964285714285714 and parameters: {'algorithm': 'ball_tree', 'n_neighbors': 13, 'weights': 'distance', 'metric': 'minkowski'}. Best is trial 28 with value: 0.7155963302752292.
[32m[I 2023-04-26 12:57:54,735][39m Trial 260 finished with value: 0.7155963302752292 and parameters: {'algorithm': 'kd_tree', 'n_neighbors': 14, 'weights': 'distance', 'metric': 'minkowski'}. Best is trial 28 with value: 0.7155963302752292.
[32m[I 2023-04-26 12:57:54,753][39m Trial 261 finished with value: 0.6964285714285714 and parameters: {'algorithm': 'ball_tree', 'n_neighbors': 15, 'weights': 'distance', 'metric': 'minkowski'}. Best is trial 28 with value: 0.7155963302752292.
[32m[I 2023-04-26 12:57:54,764][39m Trial 262 finished with value: 0.7155963302752292 and parameters: {'algorithm': 'ball_tree', 'n_neighbors': 14, 'weights': 'distance', 'metric': 'euclidean'}. Best is trial 28 with value: 0.7155963302752292.
[32m[I 2023-04-26 12:57:54,775][39m Trial 263 finished with value: 0.6964285714285714 and parameters: {'algorithm': 'ball_tree', 'n_neighbors': 13, 'weights': 'distance', 'metric': 'euclidean'}. Best is trial 28 with value: 0.7155963302752292.
[32m[I 2023-04-26 12:57:54,799][39m Trial 264 finished with value: 0.7155963302752292 and parameters: {'algorithm': 'brute', 'n_neighbors': 14, 'weights': 'distance', 'metric': 'minkowski'}. Best is trial 28 with value: 0.7155963302752292.
[32m[I 2023-04-26 12:57:54,831][39m Trial 265 finished with value: 0.6964285714285714 and parameters: {'algorithm': 'brute', 'n_neighbors': 16, 'weights': 'distance', 'metric': 'minkowski'}. Best is trial 28 with value: 0.7155963302752292.
[32m[I 2023-04-26 12:57:54,859][39m Trial 266 finished with value: 0.594059405940594 and parameters: {'algorithm': 'brute', 'n_neighbors': 12, 'weights': 'uniform', 'metric': 'minkowski'}. Best is trial 28 with value: 0.7155963302752292.
[32m[I 2023-04-26 12:57:54,869][39m Trial 267 finished with value: 0.7155963302752292 and parameters: {'algorithm': 'ball_tree', 'n_neighbors': 14, 'weights': 'distance', 'metric': 'euclidean'}. Best is trial 28 with value: 0.7155963302752292.
[32m[I 2023-04-26 12:57:54,879][39m Trial 268 finished with value: 0.6964285714285714 and parameters: {'algorithm': 'ball_tree', 'n_neighbors': 15, 'weights': 'distance', 'metric': 'euclidean'}. Best is trial 28 with value: 0.7155963302752292.
[32m[I 2023-04-26 12:57:54,891][39m Trial 269 finished with value: 0.7155963302752292 and parameters: {'algorithm': 'ball_tree', 'n_neighbors': 14, 'weights': 'distance', 'metric': 'euclidean'}. Best is trial 28 with value: 0.7155963302752292.
