[32m[I 2023-04-26 00:21:01,767][39m Trial 455 finished with value: 0.709090909090909 and parameters: {'algorithm': 'ball_tree', 'n_neighbors': 8, 'weights': 'distance', 'metric': 'euclidean'}. Best is trial 0 with value: 0.7207207207207208.
[32m[I 2023-04-26 00:21:01,796][39m Trial 456 finished with value: 0.7207207207207208 and parameters: {'algorithm': 'ball_tree', 'n_neighbors': 9, 'weights': 'distance', 'metric': 'euclidean'}. Best is trial 0 with value: 0.7207207207207208.
[32m[I 2023-04-26 00:21:01,840][39m Trial 457 finished with value: 0.6902654867256638 and parameters: {'algorithm': 'brute', 'n_neighbors': 13, 'weights': 'distance', 'metric': 'minkowski'}. Best is trial 0 with value: 0.7207207207207208.
[32m[I 2023-04-26 00:21:01,866][39m Trial 458 finished with value: 0.709090909090909 and parameters: {'algorithm': 'ball_tree', 'n_neighbors': 10, 'weights': 'distance', 'metric': 'euclidean'}. Best is trial 0 with value: 0.7207207207207208.
[32m[I 2023-04-26 00:21:01,906][39m Trial 459 finished with value: 0.6725663716814159 and parameters: {'algorithm': 'brute', 'n_neighbors': 17, 'weights': 'distance', 'metric': 'minkowski'}. Best is trial 0 with value: 0.7207207207207208.
[32m[I 2023-04-26 00:21:01,950][39m Trial 460 finished with value: 0.709090909090909 and parameters: {'algorithm': 'brute', 'n_neighbors': 7, 'weights': 'distance', 'metric': 'minkowski'}. Best is trial 0 with value: 0.7207207207207208.
[32m[I 2023-04-26 00:21:01,969][39m Trial 461 finished with value: 0.709090909090909 and parameters: {'algorithm': 'ball_tree', 'n_neighbors': 8, 'weights': 'distance', 'metric': 'euclidean'}. Best is trial 0 with value: 0.7207207207207208.
[32m[I 2023-04-26 00:21:02,001][39m Trial 462 finished with value: 0.709090909090909 and parameters: {'algorithm': 'ball_tree', 'n_neighbors': 10, 'weights': 'distance', 'metric': 'euclidean'}. Best is trial 0 with value: 0.7207207207207208.
[32m[I 2023-04-26 00:21:02,043][39m Trial 463 finished with value: 0.7207207207207208 and parameters: {'algorithm': 'brute', 'n_neighbors': 9, 'weights': 'distance', 'metric': 'minkowski'}. Best is trial 0 with value: 0.7207207207207208.
[32m[I 2023-04-26 00:21:02,085][39m Trial 464 finished with value: 0.7207207207207208 and parameters: {'algorithm': 'brute', 'n_neighbors': 9, 'weights': 'distance', 'metric': 'minkowski'}. Best is trial 0 with value: 0.7207207207207208.
[32m[I 2023-04-26 00:21:02,127][39m Trial 465 finished with value: 0.7207207207207208 and parameters: {'algorithm': 'brute', 'n_neighbors': 9, 'weights': 'distance', 'metric': 'minkowski'}. Best is trial 0 with value: 0.7207207207207208.
[32m[I 2023-04-26 00:21:02,168][39m Trial 466 finished with value: 0.709090909090909 and parameters: {'algorithm': 'brute', 'n_neighbors': 8, 'weights': 'distance', 'metric': 'minkowski'}. Best is trial 0 with value: 0.7207207207207208.
[32m[I 2023-04-26 00:21:02,205][39m Trial 467 finished with value: 0.7037037037037037 and parameters: {'algorithm': 'brute', 'n_neighbors': 11, 'weights': 'distance', 'metric': 'minkowski'}. Best is trial 0 with value: 0.7207207207207208.
[32m[I 2023-04-26 00:21:02,253][39m Trial 468 finished with value: 0.709090909090909 and parameters: {'algorithm': 'brute', 'n_neighbors': 10, 'weights': 'distance', 'metric': 'minkowski'}. Best is trial 0 with value: 0.7207207207207208.
[32m[I 2023-04-26 00:21:02,283][39m Trial 469 finished with value: 0.5794392523364486 and parameters: {'algorithm': 'auto', 'n_neighbors': 26, 'weights': 'uniform', 'metric': 'euclidean'}. Best is trial 0 with value: 0.7207207207207208.
[32m[I 2023-04-26 00:21:02,309][39m Trial 470 finished with value: 0.709090909090909 and parameters: {'algorithm': 'auto', 'n_neighbors': 8, 'weights': 'distance', 'metric': 'euclidean'}. Best is trial 0 with value: 0.7207207207207208.
[32m[I 2023-04-26 00:21:02,338][39m Trial 471 finished with value: 0.7207207207207208 and parameters: {'algorithm': 'auto', 'n_neighbors': 9, 'weights': 'distance', 'metric': 'euclidean'}. Best is trial 0 with value: 0.7207207207207208.
[32m[I 2023-04-26 00:21:02,378][39m Trial 472 finished with value: 0.709090909090909 and parameters: {'algorithm': 'brute', 'n_neighbors': 10, 'weights': 'distance', 'metric': 'minkowski'}. Best is trial 0 with value: 0.7207207207207208.
[32m[I 2023-04-26 00:21:02,420][39m Trial 473 finished with value: 0.7027027027027026 and parameters: {'algorithm': 'brute', 'n_neighbors': 9, 'weights': 'distance', 'metric': 'manhattan'}. Best is trial 0 with value: 0.7207207207207208.
[32m[I 2023-04-26 00:21:02,466][39m Trial 474 finished with value: 0.709090909090909 and parameters: {'algorithm': 'brute', 'n_neighbors': 8, 'weights': 'distance', 'metric': 'minkowski'}. Best is trial 0 with value: 0.7207207207207208.
[32m[I 2023-04-26 00:21:02,511][39m Trial 475 finished with value: 0.7207207207207208 and parameters: {'algorithm': 'brute', 'n_neighbors': 9, 'weights': 'distance', 'metric': 'minkowski'}. Best is trial 0 with value: 0.7207207207207208.
[32m[I 2023-04-26 00:21:02,564][39m Trial 476 finished with value: 0.709090909090909 and parameters: {'algorithm': 'brute', 'n_neighbors': 7, 'weights': 'distance', 'metric': 'minkowski'}. Best is trial 0 with value: 0.7207207207207208.
[32m[I 2023-04-26 00:21:02,587][39m Trial 477 finished with value: 0.709090909090909 and parameters: {'algorithm': 'auto', 'n_neighbors': 10, 'weights': 'distance', 'metric': 'euclidean'}. Best is trial 0 with value: 0.7207207207207208.
[32m[I 2023-04-26 00:21:02,620][39m Trial 478 finished with value: 0.709090909090909 and parameters: {'algorithm': 'auto', 'n_neighbors': 8, 'weights': 'distance', 'metric': 'euclidean'}. Best is trial 0 with value: 0.7207207207207208.
[32m[I 2023-04-26 00:21:02,662][39m Trial 479 finished with value: 0.7207207207207208 and parameters: {'algorithm': 'brute', 'n_neighbors': 9, 'weights': 'distance', 'metric': 'minkowski'}. Best is trial 0 with value: 0.7207207207207208.
[32m[I 2023-04-26 00:21:02,704][39m Trial 480 finished with value: 0.7037037037037037 and parameters: {'algorithm': 'brute', 'n_neighbors': 11, 'weights': 'distance', 'metric': 'minkowski'}. Best is trial 0 with value: 0.7207207207207208.
[32m[I 2023-04-26 00:21:02,726][39m Trial 481 finished with value: 0.7207207207207208 and parameters: {'algorithm': 'auto', 'n_neighbors': 9, 'weights': 'distance', 'metric': 'euclidean'}. Best is trial 0 with value: 0.7207207207207208.
[32m[I 2023-04-26 00:21:02,775][39m Trial 482 finished with value: 0.709090909090909 and parameters: {'algorithm': 'brute', 'n_neighbors': 10, 'weights': 'distance', 'metric': 'minkowski'}. Best is trial 0 with value: 0.7207207207207208.
[32m[I 2023-04-26 00:21:02,801][39m Trial 483 finished with value: 0.7207207207207208 and parameters: {'algorithm': 'auto', 'n_neighbors': 9, 'weights': 'distance', 'metric': 'minkowski'}. Best is trial 0 with value: 0.7207207207207208.
[32m[I 2023-04-26 00:21:02,844][39m Trial 484 finished with value: 0.709090909090909 and parameters: {'algorithm': 'brute', 'n_neighbors': 8, 'weights': 'distance', 'metric': 'minkowski'}. Best is trial 0 with value: 0.7207207207207208.
[32m[I 2023-04-26 00:21:02,870][39m Trial 485 finished with value: 0.709090909090909 and parameters: {'algorithm': 'auto', 'n_neighbors': 10, 'weights': 'distance', 'metric': 'euclidean'}. Best is trial 0 with value: 0.7207207207207208.
[32m[I 2023-04-26 00:21:02,898][39m Trial 486 finished with value: 0.7207207207207208 and parameters: {'algorithm': 'auto', 'n_neighbors': 9, 'weights': 'distance', 'metric': 'minkowski'}. Best is trial 0 with value: 0.7207207207207208.
[32m[I 2023-04-26 00:21:02,923][39m Trial 487 finished with value: 0.7207207207207208 and parameters: {'algorithm': 'auto', 'n_neighbors': 9, 'weights': 'distance', 'metric': 'minkowski'}. Best is trial 0 with value: 0.7207207207207208.
[32m[I 2023-04-26 00:21:02,951][39m Trial 488 finished with value: 0.6666666666666666 and parameters: {'algorithm': 'auto', 'n_neighbors': 8, 'weights': 'uniform', 'metric': 'minkowski'}. Best is trial 0 with value: 0.7207207207207208.
[32m[I 2023-04-26 00:21:02,967][39m Trial 489 finished with value: 0.709090909090909 and parameters: {'algorithm': 'auto', 'n_neighbors': 10, 'weights': 'distance', 'metric': 'minkowski'}. Best is trial 0 with value: 0.7207207207207208.
[32m[I 2023-04-26 00:21:02,976][39m Trial 490 finished with value: 0.7027027027027026 and parameters: {'algorithm': 'auto', 'n_neighbors': 6, 'weights': 'distance', 'metric': 'minkowski'}. Best is trial 0 with value: 0.7207207207207208.
[32m[I 2023-04-26 00:21:02,991][39m Trial 491 finished with value: 0.709090909090909 and parameters: {'algorithm': 'auto', 'n_neighbors': 12, 'weights': 'distance', 'metric': 'minkowski'}. Best is trial 0 with value: 0.7207207207207208.
[32m[I 2023-04-26 00:21:03,011][39m Trial 492 finished with value: 0.7207207207207208 and parameters: {'algorithm': 'auto', 'n_neighbors': 9, 'weights': 'distance', 'metric': 'minkowski'}. Best is trial 0 with value: 0.7207207207207208.
[32m[I 2023-04-26 00:21:03,025][39m Trial 493 finished with value: 0.709090909090909 and parameters: {'algorithm': 'kd_tree', 'n_neighbors': 7, 'weights': 'distance', 'metric': 'minkowski'}. Best is trial 0 with value: 0.7207207207207208.
[32m[I 2023-04-26 00:21:03,058][39m Trial 494 finished with value: 0.709090909090909 and parameters: {'algorithm': 'brute', 'n_neighbors': 8, 'weights': 'distance', 'metric': 'manhattan'}. Best is trial 0 with value: 0.7207207207207208.
[32m[I 2023-04-26 00:21:03,083][39m Trial 495 finished with value: 0.709090909090909 and parameters: {'algorithm': 'auto', 'n_neighbors': 10, 'weights': 'distance', 'metric': 'minkowski'}. Best is trial 0 with value: 0.7207207207207208.
[32m[I 2023-04-26 00:21:03,108][39m Trial 496 finished with value: 0.7207207207207208 and parameters: {'algorithm': 'auto', 'n_neighbors': 9, 'weights': 'distance', 'metric': 'minkowski'}. Best is trial 0 with value: 0.7207207207207208.
[32m[I 2023-04-26 00:21:03,137][39m Trial 497 finished with value: 0.709090909090909 and parameters: {'algorithm': 'auto', 'n_neighbors': 8, 'weights': 'distance', 'metric': 'minkowski'}. Best is trial 0 with value: 0.7207207207207208.
[32m[I 2023-04-26 00:21:03,165][39m Trial 498 finished with value: 0.7037037037037037 and parameters: {'algorithm': 'auto', 'n_neighbors': 11, 'weights': 'distance', 'metric': 'minkowski'}. Best is trial 0 with value: 0.7207207207207208.
[32m[I 2023-04-26 00:21:03,197][39m Trial 499 finished with value: 0.709090909090909 and parameters: {'algorithm': 'brute', 'n_neighbors': 10, 'weights': 'distance', 'metric': 'minkowski'}. Best is trial 0 with value: 0.7207207207207208.
Number of finished trials: 500