[32m[I 2023-04-26 00:20:54,410][39m Trial 182 finished with value: 0.709090909090909 and parameters: {'algorithm': 'brute', 'n_neighbors': 10, 'weights': 'distance', 'metric': 'minkowski'}. Best is trial 0 with value: 0.7207207207207208.
[32m[I 2023-04-26 00:20:54,442][39m Trial 183 finished with value: 0.7207207207207208 and parameters: {'algorithm': 'brute', 'n_neighbors': 9, 'weights': 'distance', 'metric': 'minkowski'}. Best is trial 0 with value: 0.7207207207207208.
[32m[I 2023-04-26 00:20:54,475][39m Trial 184 finished with value: 0.709090909090909 and parameters: {'algorithm': 'brute', 'n_neighbors': 8, 'weights': 'distance', 'metric': 'minkowski'}. Best is trial 0 with value: 0.7207207207207208.
[32m[I 2023-04-26 00:20:54,502][39m Trial 185 finished with value: 0.6285714285714287 and parameters: {'algorithm': 'brute', 'n_neighbors': 10, 'weights': 'uniform', 'metric': 'minkowski'}. Best is trial 0 with value: 0.7207207207207208.
[32m[I 2023-04-26 00:20:54,531][39m Trial 186 finished with value: 0.709090909090909 and parameters: {'algorithm': 'brute', 'n_neighbors': 8, 'weights': 'distance', 'metric': 'minkowski'}. Best is trial 0 with value: 0.7207207207207208.
[32m[I 2023-04-26 00:20:54,562][39m Trial 187 finished with value: 0.709090909090909 and parameters: {'algorithm': 'brute', 'n_neighbors': 10, 'weights': 'distance', 'metric': 'minkowski'}. Best is trial 0 with value: 0.7207207207207208.
[32m[I 2023-04-26 00:20:54,595][39m Trial 188 finished with value: 0.7037037037037037 and parameters: {'algorithm': 'brute', 'n_neighbors': 11, 'weights': 'distance', 'metric': 'minkowski'}. Best is trial 0 with value: 0.7207207207207208.
[32m[I 2023-04-26 00:20:54,627][39m Trial 189 finished with value: 0.7207207207207208 and parameters: {'algorithm': 'brute', 'n_neighbors': 9, 'weights': 'distance', 'metric': 'minkowski'}. Best is trial 0 with value: 0.7207207207207208.
[32m[I 2023-04-26 00:20:54,659][39m Trial 190 finished with value: 0.709090909090909 and parameters: {'algorithm': 'brute', 'n_neighbors': 8, 'weights': 'distance', 'metric': 'minkowski'}. Best is trial 0 with value: 0.7207207207207208.
[32m[I 2023-04-26 00:20:54,691][39m Trial 191 finished with value: 0.7207207207207208 and parameters: {'algorithm': 'brute', 'n_neighbors': 9, 'weights': 'distance', 'metric': 'minkowski'}. Best is trial 0 with value: 0.7207207207207208.
[32m[I 2023-04-26 00:20:54,724][39m Trial 192 finished with value: 0.7207207207207208 and parameters: {'algorithm': 'brute', 'n_neighbors': 9, 'weights': 'distance', 'metric': 'minkowski'}. Best is trial 0 with value: 0.7207207207207208.
[32m[I 2023-04-26 00:20:54,756][39m Trial 193 finished with value: 0.7207207207207208 and parameters: {'algorithm': 'brute', 'n_neighbors': 9, 'weights': 'distance', 'metric': 'minkowski'}. Best is trial 0 with value: 0.7207207207207208.
[32m[I 2023-04-26 00:20:54,773][39m Trial 194 finished with value: 0.709090909090909 and parameters: {'algorithm': 'auto', 'n_neighbors': 8, 'weights': 'distance', 'metric': 'minkowski'}. Best is trial 0 with value: 0.7207207207207208.
[32m[I 2023-04-26 00:20:54,806][39m Trial 195 finished with value: 0.709090909090909 and parameters: {'algorithm': 'brute', 'n_neighbors': 10, 'weights': 'distance', 'metric': 'minkowski'}. Best is trial 0 with value: 0.7207207207207208.
[32m[I 2023-04-26 00:20:54,838][39m Trial 196 finished with value: 0.709090909090909 and parameters: {'algorithm': 'brute', 'n_neighbors': 7, 'weights': 'distance', 'metric': 'minkowski'}. Best is trial 0 with value: 0.7207207207207208.
[32m[I 2023-04-26 00:20:54,872][39m Trial 197 finished with value: 0.7207207207207208 and parameters: {'algorithm': 'brute', 'n_neighbors': 9, 'weights': 'distance', 'metric': 'minkowski'}. Best is trial 0 with value: 0.7207207207207208.
[32m[I 2023-04-26 00:20:54,889][39m Trial 198 finished with value: 0.709090909090909 and parameters: {'algorithm': 'kd_tree', 'n_neighbors': 10, 'weights': 'distance', 'metric': 'minkowski'}. Best is trial 0 with value: 0.7207207207207208.
[32m[I 2023-04-26 00:20:54,907][39m Trial 199 finished with value: 0.709090909090909 and parameters: {'algorithm': 'kd_tree', 'n_neighbors': 8, 'weights': 'distance', 'metric': 'minkowski'}. Best is trial 0 with value: 0.7207207207207208.
[32m[I 2023-04-26 00:20:54,926][39m Trial 200 finished with value: 0.7207207207207208 and parameters: {'algorithm': 'kd_tree', 'n_neighbors': 9, 'weights': 'distance', 'metric': 'minkowski'}. Best is trial 0 with value: 0.7207207207207208.
[32m[I 2023-04-26 00:20:54,947][39m Trial 201 finished with value: 0.7207207207207208 and parameters: {'algorithm': 'kd_tree', 'n_neighbors': 9, 'weights': 'distance', 'metric': 'minkowski'}. Best is trial 0 with value: 0.7207207207207208.
[32m[I 2023-04-26 00:20:54,965][39m Trial 202 finished with value: 0.7207207207207208 and parameters: {'algorithm': 'kd_tree', 'n_neighbors': 9, 'weights': 'distance', 'metric': 'minkowski'}. Best is trial 0 with value: 0.7207207207207208.
[32m[I 2023-04-26 00:20:54,981][39m Trial 203 finished with value: 0.709090909090909 and parameters: {'algorithm': 'kd_tree', 'n_neighbors': 10, 'weights': 'distance', 'metric': 'minkowski'}. Best is trial 0 with value: 0.7207207207207208.
[32m[I 2023-04-26 00:20:54,991][39m Trial 204 finished with value: 0.709090909090909 and parameters: {'algorithm': 'kd_tree', 'n_neighbors': 8, 'weights': 'distance', 'metric': 'minkowski'}. Best is trial 0 with value: 0.7207207207207208.
[32m[I 2023-04-26 00:20:55,001][39m Trial 205 finished with value: 0.7207207207207208 and parameters: {'algorithm': 'auto', 'n_neighbors': 9, 'weights': 'distance', 'metric': 'minkowski'}. Best is trial 0 with value: 0.7207207207207208.
[32m[I 2023-04-26 00:20:55,024][39m Trial 206 finished with value: 0.709090909090909 and parameters: {'algorithm': 'brute', 'n_neighbors': 10, 'weights': 'distance', 'metric': 'minkowski'}. Best is trial 0 with value: 0.7207207207207208.
[32m[I 2023-04-26 00:20:55,042][39m Trial 207 finished with value: 0.7207207207207208 and parameters: {'algorithm': 'auto', 'n_neighbors': 9, 'weights': 'distance', 'metric': 'minkowski'}. Best is trial 0 with value: 0.7207207207207208.
[32m[I 2023-04-26 00:20:55,060][39m Trial 208 finished with value: 0.709090909090909 and parameters: {'algorithm': 'kd_tree', 'n_neighbors': 8, 'weights': 'distance', 'metric': 'minkowski'}. Best is trial 0 with value: 0.7207207207207208.
[32m[I 2023-04-26 00:20:55,078][39m Trial 209 finished with value: 0.7207207207207208 and parameters: {'algorithm': 'auto', 'n_neighbors': 9, 'weights': 'distance', 'metric': 'minkowski'}. Best is trial 0 with value: 0.7207207207207208.
[32m[I 2023-04-26 00:20:55,112][39m Trial 210 finished with value: 0.709090909090909 and parameters: {'algorithm': 'brute', 'n_neighbors': 10, 'weights': 'distance', 'metric': 'minkowski'}. Best is trial 0 with value: 0.7207207207207208.
[32m[I 2023-04-26 00:20:55,131][39m Trial 211 finished with value: 0.7207207207207208 and parameters: {'algorithm': 'auto', 'n_neighbors': 9, 'weights': 'distance', 'metric': 'minkowski'}. Best is trial 0 with value: 0.7207207207207208.
[32m[I 2023-04-26 00:20:55,170][39m Trial 212 finished with value: 0.7207207207207208 and parameters: {'algorithm': 'brute', 'n_neighbors': 9, 'weights': 'distance', 'metric': 'minkowski'}. Best is trial 0 with value: 0.7207207207207208.
[32m[I 2023-04-26 00:20:55,190][39m Trial 213 finished with value: 0.7207207207207208 and parameters: {'algorithm': 'kd_tree', 'n_neighbors': 9, 'weights': 'distance', 'metric': 'minkowski'}. Best is trial 0 with value: 0.7207207207207208.
[32m[I 2023-04-26 00:20:55,225][39m Trial 214 finished with value: 0.709090909090909 and parameters: {'algorithm': 'brute', 'n_neighbors': 8, 'weights': 'distance', 'metric': 'minkowski'}. Best is trial 0 with value: 0.7207207207207208.
[32m[I 2023-04-26 00:20:55,243][39m Trial 215 finished with value: 0.7017543859649122 and parameters: {'algorithm': 'auto', 'n_neighbors': 1, 'weights': 'distance', 'metric': 'minkowski'}. Best is trial 0 with value: 0.7207207207207208.
[32m[I 2023-04-26 00:20:55,276][39m Trial 216 finished with value: 0.7207207207207208 and parameters: {'algorithm': 'brute', 'n_neighbors': 9, 'weights': 'distance', 'metric': 'euclidean'}. Best is trial 0 with value: 0.7207207207207208.
[32m[I 2023-04-26 00:20:55,310][39m Trial 217 finished with value: 0.7207207207207208 and parameters: {'algorithm': 'brute', 'n_neighbors': 9, 'weights': 'distance', 'metric': 'minkowski'}. Best is trial 0 with value: 0.7207207207207208.
[32m[I 2023-04-26 00:20:55,339][39m Trial 218 finished with value: 0.6371681415929203 and parameters: {'algorithm': 'brute', 'n_neighbors': 11, 'weights': 'uniform', 'metric': 'manhattan'}. Best is trial 0 with value: 0.7207207207207208.
[32m[I 2023-04-26 00:20:55,368][39m Trial 219 finished with value: 0.709090909090909 and parameters: {'algorithm': 'brute', 'n_neighbors': 10, 'weights': 'distance', 'metric': 'minkowski'}. Best is trial 0 with value: 0.7207207207207208.
[32m[I 2023-04-26 00:20:55,401][39m Trial 220 finished with value: 0.709090909090909 and parameters: {'algorithm': 'brute', 'n_neighbors': 7, 'weights': 'distance', 'metric': 'euclidean'}. Best is trial 0 with value: 0.7207207207207208.
[32m[I 2023-04-26 00:20:55,436][39m Trial 221 finished with value: 0.7207207207207208 and parameters: {'algorithm': 'brute', 'n_neighbors': 9, 'weights': 'distance', 'metric': 'euclidean'}. Best is trial 0 with value: 0.7207207207207208.
[32m[I 2023-04-26 00:20:55,454][39m Trial 222 finished with value: 0.7207207207207208 and parameters: {'algorithm': 'kd_tree', 'n_neighbors': 9, 'weights': 'distance', 'metric': 'minkowski'}. Best is trial 0 with value: 0.7207207207207208.
[32m[I 2023-04-26 00:20:55,473][39m Trial 223 finished with value: 0.709090909090909 and parameters: {'algorithm': 'kd_tree', 'n_neighbors': 8, 'weights': 'distance', 'metric': 'minkowski'}. Best is trial 0 with value: 0.7207207207207208.
[32m[I 2023-04-26 00:20:55,492][39m Trial 224 finished with value: 0.709090909090909 and parameters: {'algorithm': 'kd_tree', 'n_neighbors': 10, 'weights': 'distance', 'metric': 'minkowski'}. Best is trial 0 with value: 0.7207207207207208.
[32m[I 2023-04-26 00:20:55,511][39m Trial 225 finished with value: 0.709090909090909 and parameters: {'algorithm': 'kd_tree', 'n_neighbors': 8, 'weights': 'distance', 'metric': 'minkowski'}. Best is trial 0 with value: 0.7207207207207208.
[32m[I 2023-04-26 00:20:55,531][39m Trial 226 finished with value: 0.7207207207207208 and parameters: {'algorithm': 'kd_tree', 'n_neighbors': 9, 'weights': 'distance', 'metric': 'minkowski'}. Best is trial 0 with value: 0.7207207207207208.
[32m[I 2023-04-26 00:20:55,547][39m Trial 227 finished with value: 0.709090909090909 and parameters: {'algorithm': 'kd_tree', 'n_neighbors': 10, 'weights': 'distance', 'metric': 'minkowski'}. Best is trial 0 with value: 0.7207207207207208.
[32m[I 2023-04-26 00:20:55,558][39m Trial 228 finished with value: 0.709090909090909 and parameters: {'algorithm': 'ball_tree', 'n_neighbors': 8, 'weights': 'distance', 'metric': 'minkowski'}. Best is trial 0 with value: 0.7207207207207208.
[32m[I 2023-04-26 00:20:55,585][39m Trial 229 finished with value: 0.7207207207207208 and parameters: {'algorithm': 'brute', 'n_neighbors': 9, 'weights': 'distance', 'metric': 'minkowski'}. Best is trial 0 with value: 0.7207207207207208.
[32m[I 2023-04-26 00:20:55,603][39m Trial 230 finished with value: 0.709090909090909 and parameters: {'algorithm': 'kd_tree', 'n_neighbors': 8, 'weights': 'distance', 'metric': 'minkowski'}. Best is trial 0 with value: 0.7207207207207208.
[32m[I 2023-04-26 00:20:55,640][39m Trial 231 finished with value: 0.7207207207207208 and parameters: {'algorithm': 'brute', 'n_neighbors': 9, 'weights': 'distance', 'metric': 'minkowski'}. Best is trial 0 with value: 0.7207207207207208.
[32m[I 2023-04-26 00:20:55,658][39m Trial 232 finished with value: 0.7207207207207208 and parameters: {'algorithm': 'kd_tree', 'n_neighbors': 9, 'weights': 'distance', 'metric': 'minkowski'}. Best is trial 0 with value: 0.7207207207207208.
[32m[I 2023-04-26 00:20:55,676][39m Trial 233 finished with value: 0.7207207207207208 and parameters: {'algorithm': 'kd_tree', 'n_neighbors': 9, 'weights': 'distance', 'metric': 'minkowski'}. Best is trial 0 with value: 0.7207207207207208.
[32m[I 2023-04-26 00:20:55,696][39m Trial 234 finished with value: 0.709090909090909 and parameters: {'algorithm': 'kd_tree', 'n_neighbors': 10, 'weights': 'distance', 'metric': 'minkowski'}. Best is trial 0 with value: 0.7207207207207208.
[32m[I 2023-04-26 00:20:55,731][39m Trial 235 finished with value: 0.709090909090909 and parameters: {'algorithm': 'brute', 'n_neighbors': 10, 'weights': 'distance', 'metric': 'minkowski'}. Best is trial 0 with value: 0.7207207207207208.
[32m[I 2023-04-26 00:20:55,765][39m Trial 236 finished with value: 0.7207207207207208 and parameters: {'algorithm': 'brute', 'n_neighbors': 9, 'weights': 'distance', 'metric': 'minkowski'}. Best is trial 0 with value: 0.7207207207207208.
[32m[I 2023-04-26 00:20:55,799][39m Trial 237 finished with value: 0.7207207207207208 and parameters: {'algorithm': 'brute', 'n_neighbors': 9, 'weights': 'distance', 'metric': 'minkowski'}. Best is trial 0 with value: 0.7207207207207208.
[32m[I 2023-04-26 00:20:55,833][39m Trial 238 finished with value: 0.709090909090909 and parameters: {'algorithm': 'brute', 'n_neighbors': 8, 'weights': 'distance', 'metric': 'minkowski'}. Best is trial 0 with value: 0.7207207207207208.
[32m[I 2023-04-26 00:20:55,868][39m Trial 239 finished with value: 0.7207207207207208 and parameters: {'algorithm': 'brute', 'n_neighbors': 9, 'weights': 'distance', 'metric': 'minkowski'}. Best is trial 0 with value: 0.7207207207207208.
[32m[I 2023-04-26 00:20:55,887][39m Trial 240 finished with value: 0.709090909090909 and parameters: {'algorithm': 'auto', 'n_neighbors': 10, 'weights': 'distance', 'metric': 'minkowski'}. Best is trial 0 with value: 0.7207207207207208.
[32m[I 2023-04-26 00:20:55,922][39m Trial 241 finished with value: 0.7207207207207208 and parameters: {'algorithm': 'brute', 'n_neighbors': 9, 'weights': 'distance', 'metric': 'minkowski'}. Best is trial 0 with value: 0.7207207207207208.
[32m[I 2023-04-26 00:20:55,957][39m Trial 242 finished with value: 0.709090909090909 and parameters: {'algorithm': 'brute', 'n_neighbors': 8, 'weights': 'distance', 'metric': 'minkowski'}. Best is trial 0 with value: 0.7207207207207208.
[32m[I 2023-04-26 00:20:55,990][39m Trial 243 finished with value: 0.7207207207207208 and parameters: {'algorithm': 'brute', 'n_neighbors': 9, 'weights': 'distance', 'metric': 'minkowski'}. Best is trial 0 with value: 0.7207207207207208.
[32m[I 2023-04-26 00:20:56,024][39m Trial 244 finished with value: 0.7207207207207208 and parameters: {'algorithm': 'brute', 'n_neighbors': 9, 'weights': 'distance', 'metric': 'minkowski'}. Best is trial 0 with value: 0.7207207207207208.
[32m[I 2023-04-26 00:20:56,058][39m Trial 245 finished with value: 0.7207207207207208 and parameters: {'algorithm': 'brute', 'n_neighbors': 9, 'weights': 'distance', 'metric': 'minkowski'}. Best is trial 0 with value: 0.7207207207207208.
[32m[I 2023-04-26 00:20:56,093][39m Trial 246 finished with value: 0.709090909090909 and parameters: {'algorithm': 'brute', 'n_neighbors': 10, 'weights': 'distance', 'metric': 'minkowski'}. Best is trial 0 with value: 0.7207207207207208.
[32m[I 2023-04-26 00:20:56,128][39m Trial 247 finished with value: 0.709090909090909 and parameters: {'algorithm': 'brute', 'n_neighbors': 8, 'weights': 'distance', 'metric': 'minkowski'}. Best is trial 0 with value: 0.7207207207207208.
[32m[I 2023-04-26 00:20:56,147][39m Trial 248 finished with value: 0.7207207207207208 and parameters: {'algorithm': 'kd_tree', 'n_neighbors': 9, 'weights': 'distance', 'metric': 'minkowski'}. Best is trial 0 with value: 0.7207207207207208.
[32m[I 2023-04-26 00:20:56,182][39m Trial 249 finished with value: 0.709090909090909 and parameters: {'algorithm': 'brute', 'n_neighbors': 10, 'weights': 'distance', 'metric': 'minkowski'}. Best is trial 0 with value: 0.7207207207207208.
[32m[I 2023-04-26 00:20:56,217][39m Trial 250 finished with value: 0.709090909090909 and parameters: {'algorithm': 'brute', 'n_neighbors': 8, 'weights': 'distance', 'metric': 'minkowski'}. Best is trial 0 with value: 0.7207207207207208.
[32m[I 2023-04-26 00:20:56,248][39m Trial 251 finished with value: 0.6666666666666666 and parameters: {'algorithm': 'brute', 'n_neighbors': 8, 'weights': 'uniform', 'metric': 'minkowski'}. Best is trial 0 with value: 0.7207207207207208.
[32m[I 2023-04-26 00:20:56,273][39m Trial 252 finished with value: 0.7027027027027026 and parameters: {'algorithm': 'brute', 'n_neighbors': 9, 'weights': 'distance', 'metric': 'manhattan'}. Best is trial 0 with value: 0.7207207207207208.
[32m[I 2023-04-26 00:20:56,306][39m Trial 253 finished with value: 0.7207207207207208 and parameters: {'algorithm': 'brute', 'n_neighbors': 9, 'weights': 'distance', 'metric': 'minkowski'}. Best is trial 0 with value: 0.7207207207207208.
[32m[I 2023-04-26 00:20:56,346][39m Trial 254 finished with value: 0.709090909090909 and parameters: {'algorithm': 'brute', 'n_neighbors': 10, 'weights': 'distance', 'metric': 'minkowski'}. Best is trial 0 with value: 0.7207207207207208.
[32m[I 2023-04-26 00:20:56,381][39m Trial 255 finished with value: 0.7207207207207208 and parameters: {'algorithm': 'brute', 'n_neighbors': 9, 'weights': 'distance', 'metric': 'minkowski'}. Best is trial 0 with value: 0.7207207207207208.
[32m[I 2023-04-26 00:20:56,414][39m Trial 256 finished with value: 0.7207207207207208 and parameters: {'algorithm': 'brute', 'n_neighbors': 9, 'weights': 'distance', 'metric': 'minkowski'}. Best is trial 0 with value: 0.7207207207207208.
[32m[I 2023-04-26 00:20:56,433][39m Trial 257 finished with value: 0.709090909090909 and parameters: {'algorithm': 'kd_tree', 'n_neighbors': 10, 'weights': 'distance', 'metric': 'minkowski'}. Best is trial 0 with value: 0.7207207207207208.
[32m[I 2023-04-26 00:20:56,453][39m Trial 258 finished with value: 0.7037037037037037 and parameters: {'algorithm': 'ball_tree', 'n_neighbors': 11, 'weights': 'distance', 'metric': 'minkowski'}. Best is trial 0 with value: 0.7207207207207208.
[32m[I 2023-04-26 00:20:56,473][39m Trial 259 finished with value: 0.709090909090909 and parameters: {'algorithm': 'auto', 'n_neighbors': 7, 'weights': 'distance', 'metric': 'minkowski'}. Best is trial 0 with value: 0.7207207207207208.
[32m[I 2023-04-26 00:20:56,494][39m Trial 260 finished with value: 0.709090909090909 and parameters: {'algorithm': 'kd_tree', 'n_neighbors': 8, 'weights': 'distance', 'metric': 'minkowski'}. Best is trial 0 with value: 0.7207207207207208.
[32m[I 2023-04-26 00:20:56,512][39m Trial 261 finished with value: 0.709090909090909 and parameters: {'algorithm': 'auto', 'n_neighbors': 10, 'weights': 'distance', 'metric': 'minkowski'}. Best is trial 0 with value: 0.7207207207207208.
[32m[I 2023-04-26 00:20:56,524][39m Trial 262 finished with value: 0.7207207207207208 and parameters: {'algorithm': 'auto', 'n_neighbors': 9, 'weights': 'distance', 'metric': 'minkowski'}. Best is trial 0 with value: 0.7207207207207208.
[32m[I 2023-04-26 00:20:56,535][39m Trial 263 finished with value: 0.709090909090909 and parameters: {'algorithm': 'kd_tree', 'n_neighbors': 8, 'weights': 'distance', 'metric': 'minkowski'}. Best is trial 0 with value: 0.7207207207207208.
[32m[I 2023-04-26 00:20:56,544][39m Trial 264 finished with value: 0.7207207207207208 and parameters: {'algorithm': 'auto', 'n_neighbors': 9, 'weights': 'distance', 'metric': 'minkowski'}. Best is trial 0 with value: 0.7207207207207208.
[32m[I 2023-04-26 00:20:56,554][39m Trial 265 finished with value: 0.709090909090909 and parameters: {'algorithm': 'kd_tree', 'n_neighbors': 10, 'weights': 'distance', 'metric': 'minkowski'}. Best is trial 0 with value: 0.7207207207207208.
[32m[I 2023-04-26 00:20:56,563][39m Trial 266 finished with value: 0.7037037037037037 and parameters: {'algorithm': 'auto', 'n_neighbors': 11, 'weights': 'distance', 'metric': 'minkowski'}. Best is trial 0 with value: 0.7207207207207208.
[32m[I 2023-04-26 00:20:56,595][39m Trial 267 finished with value: 0.7207207207207208 and parameters: {'algorithm': 'brute', 'n_neighbors': 9, 'weights': 'distance', 'metric': 'minkowski'}. Best is trial 0 with value: 0.7207207207207208.
[32m[I 2023-04-26 00:20:56,632][39m Trial 268 finished with value: 0.709090909090909 and parameters: {'algorithm': 'brute', 'n_neighbors': 7, 'weights': 'distance', 'metric': 'minkowski'}. Best is trial 0 with value: 0.7207207207207208.
[32m[I 2023-04-26 00:20:56,652][39m Trial 269 finished with value: 0.7017543859649122 and parameters: {'algorithm': 'auto', 'n_neighbors': 2, 'weights': 'distance', 'metric': 'minkowski'}. Best is trial 0 with value: 0.7207207207207208.
[32m[I 2023-04-26 00:20:56,673][39m Trial 270 finished with value: 0.709090909090909 and parameters: {'algorithm': 'auto', 'n_neighbors': 8, 'weights': 'distance', 'metric': 'minkowski'}. Best is trial 0 with value: 0.7207207207207208.
[32m[I 2023-04-26 00:20:56,693][39m Trial 271 finished with value: 0.7207207207207208 and parameters: {'algorithm': 'auto', 'n_neighbors': 9, 'weights': 'distance', 'metric': 'minkowski'}. Best is trial 0 with value: 0.7207207207207208.
[32m[I 2023-04-26 00:20:56,725][39m Trial 272 finished with value: 0.5825242718446603 and parameters: {'algorithm': 'brute', 'n_neighbors': 16, 'weights': 'uniform', 'metric': 'minkowski'}. Best is trial 0 with value: 0.7207207207207208.
