[32m[I 2023-04-26 00:20:56,737][39m Trial 273 finished with value: 0.709090909090909 and parameters: {'algorithm': 'auto', 'n_neighbors': 10, 'weights': 'distance', 'metric': 'minkowski'}. Best is trial 0 with value: 0.7207207207207208.
[32m[I 2023-04-26 00:20:56,747][39m Trial 274 finished with value: 0.709090909090909 and parameters: {'algorithm': 'auto', 'n_neighbors': 8, 'weights': 'distance', 'metric': 'minkowski'}. Best is trial 0 with value: 0.7207207207207208.
[32m[I 2023-04-26 00:20:56,758][39m Trial 275 finished with value: 0.7207207207207208 and parameters: {'algorithm': 'auto', 'n_neighbors': 9, 'weights': 'distance', 'metric': 'minkowski'}. Best is trial 0 with value: 0.7207207207207208.
[32m[I 2023-04-26 00:20:56,768][39m Trial 276 finished with value: 0.7207207207207208 and parameters: {'algorithm': 'kd_tree', 'n_neighbors': 9, 'weights': 'distance', 'metric': 'minkowski'}. Best is trial 0 with value: 0.7207207207207208.
[32m[I 2023-04-26 00:20:56,790][39m Trial 277 finished with value: 0.709090909090909 and parameters: {'algorithm': 'kd_tree', 'n_neighbors': 8, 'weights': 'distance', 'metric': 'manhattan'}. Best is trial 0 with value: 0.7207207207207208.
[32m[I 2023-04-26 00:20:56,810][39m Trial 278 finished with value: 0.7207207207207208 and parameters: {'algorithm': 'auto', 'n_neighbors': 9, 'weights': 'distance', 'metric': 'minkowski'}. Best is trial 0 with value: 0.7207207207207208.
[32m[I 2023-04-26 00:20:56,847][39m Trial 279 finished with value: 0.709090909090909 and parameters: {'algorithm': 'brute', 'n_neighbors': 10, 'weights': 'distance', 'metric': 'minkowski'}. Best is trial 0 with value: 0.7207207207207208.
[32m[I 2023-04-26 00:20:56,868][39m Trial 280 finished with value: 0.7207207207207208 and parameters: {'algorithm': 'auto', 'n_neighbors': 9, 'weights': 'distance', 'metric': 'euclidean'}. Best is trial 0 with value: 0.7207207207207208.
[32m[I 2023-04-26 00:20:56,905][39m Trial 281 finished with value: 0.709090909090909 and parameters: {'algorithm': 'brute', 'n_neighbors': 10, 'weights': 'distance', 'metric': 'minkowski'}. Best is trial 0 with value: 0.7207207207207208.
[32m[I 2023-04-26 00:20:56,924][39m Trial 282 finished with value: 0.709090909090909 and parameters: {'algorithm': 'kd_tree', 'n_neighbors': 7, 'weights': 'distance', 'metric': 'euclidean'}. Best is trial 0 with value: 0.7207207207207208.
[32m[I 2023-04-26 00:20:56,961][39m Trial 283 finished with value: 0.709090909090909 and parameters: {'algorithm': 'brute', 'n_neighbors': 8, 'weights': 'distance', 'metric': 'minkowski'}. Best is trial 0 with value: 0.7207207207207208.
[32m[I 2023-04-26 00:20:56,997][39m Trial 284 finished with value: 0.7207207207207208 and parameters: {'algorithm': 'brute', 'n_neighbors': 9, 'weights': 'distance', 'metric': 'minkowski'}. Best is trial 0 with value: 0.7207207207207208.
[32m[I 2023-04-26 00:20:57,033][39m Trial 285 finished with value: 0.709090909090909 and parameters: {'algorithm': 'brute', 'n_neighbors': 10, 'weights': 'distance', 'metric': 'minkowski'}. Best is trial 0 with value: 0.7207207207207208.
[32m[I 2023-04-26 00:20:57,054][39m Trial 286 finished with value: 0.7037037037037037 and parameters: {'algorithm': 'kd_tree', 'n_neighbors': 11, 'weights': 'distance', 'metric': 'euclidean'}. Best is trial 0 with value: 0.7207207207207208.
[32m[I 2023-04-26 00:20:57,090][39m Trial 287 finished with value: 0.709090909090909 and parameters: {'algorithm': 'brute', 'n_neighbors': 8, 'weights': 'distance', 'metric': 'minkowski'}. Best is trial 0 with value: 0.7207207207207208.
[32m[I 2023-04-26 00:20:57,126][39m Trial 288 finished with value: 0.7207207207207208 and parameters: {'algorithm': 'brute', 'n_neighbors': 9, 'weights': 'distance', 'metric': 'minkowski'}. Best is trial 0 with value: 0.7207207207207208.
[32m[I 2023-04-26 00:20:57,162][39m Trial 289 finished with value: 0.7207207207207208 and parameters: {'algorithm': 'brute', 'n_neighbors': 9, 'weights': 'distance', 'metric': 'minkowski'}. Best is trial 0 with value: 0.7207207207207208.
[32m[I 2023-04-26 00:20:57,199][39m Trial 290 finished with value: 0.709090909090909 and parameters: {'algorithm': 'brute', 'n_neighbors': 10, 'weights': 'distance', 'metric': 'minkowski'}. Best is trial 0 with value: 0.7207207207207208.
[32m[I 2023-04-26 00:20:57,235][39m Trial 291 finished with value: 0.7207207207207208 and parameters: {'algorithm': 'brute', 'n_neighbors': 9, 'weights': 'distance', 'metric': 'minkowski'}. Best is trial 0 with value: 0.7207207207207208.
[32m[I 2023-04-26 00:20:57,268][39m Trial 292 finished with value: 0.5794392523364486 and parameters: {'algorithm': 'brute', 'n_neighbors': 26, 'weights': 'uniform', 'metric': 'minkowski'}. Best is trial 0 with value: 0.7207207207207208.
[32m[I 2023-04-26 00:20:57,281][39m Trial 293 finished with value: 0.709090909090909 and parameters: {'algorithm': 'auto', 'n_neighbors': 8, 'weights': 'distance', 'metric': 'minkowski'}. Best is trial 0 with value: 0.7207207207207208.
[32m[I 2023-04-26 00:20:57,292][39m Trial 294 finished with value: 0.709090909090909 and parameters: {'algorithm': 'kd_tree', 'n_neighbors': 7, 'weights': 'distance', 'metric': 'euclidean'}. Best is trial 0 with value: 0.7207207207207208.
[32m[I 2023-04-26 00:20:57,322][39m Trial 295 finished with value: 0.709090909090909 and parameters: {'algorithm': 'brute', 'n_neighbors': 10, 'weights': 'distance', 'metric': 'minkowski'}. Best is trial 0 with value: 0.7207207207207208.
[32m[I 2023-04-26 00:20:57,362][39m Trial 296 finished with value: 0.7207207207207208 and parameters: {'algorithm': 'brute', 'n_neighbors': 9, 'weights': 'distance', 'metric': 'minkowski'}. Best is trial 0 with value: 0.7207207207207208.
[32m[I 2023-04-26 00:20:57,398][39m Trial 297 finished with value: 0.709090909090909 and parameters: {'algorithm': 'brute', 'n_neighbors': 8, 'weights': 'distance', 'metric': 'minkowski'}. Best is trial 0 with value: 0.7207207207207208.
[32m[I 2023-04-26 00:20:57,418][39m Trial 298 finished with value: 0.7207207207207208 and parameters: {'algorithm': 'kd_tree', 'n_neighbors': 9, 'weights': 'distance', 'metric': 'minkowski'}. Best is trial 0 with value: 0.7207207207207208.
[32m[I 2023-04-26 00:20:57,456][39m Trial 299 finished with value: 0.709090909090909 and parameters: {'algorithm': 'brute', 'n_neighbors': 10, 'weights': 'distance', 'metric': 'manhattan'}. Best is trial 0 with value: 0.7207207207207208.
[32m[I 2023-04-26 00:20:57,477][39m Trial 300 finished with value: 0.7207207207207208 and parameters: {'algorithm': 'auto', 'n_neighbors': 9, 'weights': 'distance', 'metric': 'euclidean'}. Best is trial 0 with value: 0.7207207207207208.
[32m[I 2023-04-26 00:20:57,498][39m Trial 301 finished with value: 0.7207207207207208 and parameters: {'algorithm': 'ball_tree', 'n_neighbors': 9, 'weights': 'distance', 'metric': 'minkowski'}. Best is trial 0 with value: 0.7207207207207208.
[32m[I 2023-04-26 00:20:57,536][39m Trial 302 finished with value: 0.709090909090909 and parameters: {'algorithm': 'brute', 'n_neighbors': 8, 'weights': 'distance', 'metric': 'euclidean'}. Best is trial 0 with value: 0.7207207207207208.
[32m[I 2023-04-26 00:20:57,557][39m Trial 303 finished with value: 0.709090909090909 and parameters: {'algorithm': 'ball_tree', 'n_neighbors': 10, 'weights': 'distance', 'metric': 'minkowski'}. Best is trial 0 with value: 0.7207207207207208.
[32m[I 2023-04-26 00:20:57,595][39m Trial 304 finished with value: 0.7207207207207208 and parameters: {'algorithm': 'brute', 'n_neighbors': 9, 'weights': 'distance', 'metric': 'minkowski'}. Best is trial 0 with value: 0.7207207207207208.
[32m[I 2023-04-26 00:20:57,616][39m Trial 305 finished with value: 0.709090909090909 and parameters: {'algorithm': 'kd_tree', 'n_neighbors': 10, 'weights': 'distance', 'metric': 'minkowski'}. Best is trial 0 with value: 0.7207207207207208.
[32m[I 2023-04-26 00:20:57,638][39m Trial 306 finished with value: 0.7037037037037037 and parameters: {'algorithm': 'auto', 'n_neighbors': 11, 'weights': 'distance', 'metric': 'minkowski'}. Best is trial 0 with value: 0.7207207207207208.
[32m[I 2023-04-26 00:20:57,660][39m Trial 307 finished with value: 0.709090909090909 and parameters: {'algorithm': 'kd_tree', 'n_neighbors': 8, 'weights': 'distance', 'metric': 'euclidean'}. Best is trial 0 with value: 0.7207207207207208.
[32m[I 2023-04-26 00:20:57,682][39m Trial 308 finished with value: 0.7207207207207208 and parameters: {'algorithm': 'auto', 'n_neighbors': 9, 'weights': 'distance', 'metric': 'euclidean'}. Best is trial 0 with value: 0.7207207207207208.
[32m[I 2023-04-26 00:20:57,701][39m Trial 309 finished with value: 0.709090909090909 and parameters: {'algorithm': 'kd_tree', 'n_neighbors': 7, 'weights': 'distance', 'metric': 'minkowski'}. Best is trial 0 with value: 0.7207207207207208.
[32m[I 2023-04-26 00:20:57,729][39m Trial 310 finished with value: 0.7207207207207208 and parameters: {'algorithm': 'brute', 'n_neighbors': 9, 'weights': 'distance', 'metric': 'minkowski'}. Best is trial 0 with value: 0.7207207207207208.
[32m[I 2023-04-26 00:20:57,766][39m Trial 311 finished with value: 0.709090909090909 and parameters: {'algorithm': 'brute', 'n_neighbors': 8, 'weights': 'distance', 'metric': 'minkowski'}. Best is trial 0 with value: 0.7207207207207208.
[32m[I 2023-04-26 00:20:57,791][39m Trial 312 finished with value: 0.6285714285714287 and parameters: {'algorithm': 'kd_tree', 'n_neighbors': 10, 'weights': 'uniform', 'metric': 'euclidean'}. Best is trial 0 with value: 0.7207207207207208.
[32m[I 2023-04-26 00:20:57,813][39m Trial 313 finished with value: 0.7207207207207208 and parameters: {'algorithm': 'ball_tree', 'n_neighbors': 9, 'weights': 'distance', 'metric': 'euclidean'}. Best is trial 0 with value: 0.7207207207207208.
[32m[I 2023-04-26 00:20:57,851][39m Trial 314 finished with value: 0.709090909090909 and parameters: {'algorithm': 'brute', 'n_neighbors': 8, 'weights': 'distance', 'metric': 'minkowski'}. Best is trial 0 with value: 0.7207207207207208.
[32m[I 2023-04-26 00:20:57,873][39m Trial 315 finished with value: 0.709090909090909 and parameters: {'algorithm': 'kd_tree', 'n_neighbors': 10, 'weights': 'distance', 'metric': 'euclidean'}. Best is trial 0 with value: 0.7207207207207208.
[32m[I 2023-04-26 00:20:57,895][39m Trial 316 finished with value: 0.7207207207207208 and parameters: {'algorithm': 'kd_tree', 'n_neighbors': 9, 'weights': 'distance', 'metric': 'euclidean'}. Best is trial 0 with value: 0.7207207207207208.
[32m[I 2023-04-26 00:20:57,916][39m Trial 317 finished with value: 0.7037037037037037 and parameters: {'algorithm': 'auto', 'n_neighbors': 11, 'weights': 'distance', 'metric': 'minkowski'}. Best is trial 0 with value: 0.7207207207207208.
[32m[I 2023-04-26 00:20:57,953][39m Trial 318 finished with value: 0.7207207207207208 and parameters: {'algorithm': 'brute', 'n_neighbors': 9, 'weights': 'distance', 'metric': 'minkowski'}. Best is trial 0 with value: 0.7207207207207208.
[32m[I 2023-04-26 00:20:57,974][39m Trial 319 finished with value: 0.709090909090909 and parameters: {'algorithm': 'auto', 'n_neighbors': 8, 'weights': 'distance', 'metric': 'minkowski'}. Best is trial 0 with value: 0.7207207207207208.
[32m[I 2023-04-26 00:20:57,997][39m Trial 320 finished with value: 0.709090909090909 and parameters: {'algorithm': 'kd_tree', 'n_neighbors': 10, 'weights': 'distance', 'metric': 'minkowski'}. Best is trial 0 with value: 0.7207207207207208.
[32m[I 2023-04-26 00:20:58,018][39m Trial 321 finished with value: 0.7207207207207208 and parameters: {'algorithm': 'auto', 'n_neighbors': 9, 'weights': 'distance', 'metric': 'minkowski'}. Best is trial 0 with value: 0.7207207207207208.
[32m[I 2023-04-26 00:20:58,040][39m Trial 322 finished with value: 0.709090909090909 and parameters: {'algorithm': 'auto', 'n_neighbors': 7, 'weights': 'distance', 'metric': 'minkowski'}. Best is trial 0 with value: 0.7207207207207208.
[32m[I 2023-04-26 00:20:58,076][39m Trial 323 finished with value: 0.6972477064220184 and parameters: {'algorithm': 'brute', 'n_neighbors': 11, 'weights': 'distance', 'metric': 'manhattan'}. Best is trial 0 with value: 0.7207207207207208.
[32m[I 2023-04-26 00:20:58,112][39m Trial 324 finished with value: 0.709090909090909 and parameters: {'algorithm': 'brute', 'n_neighbors': 8, 'weights': 'distance', 'metric': 'minkowski'}. Best is trial 0 with value: 0.7207207207207208.
[32m[I 2023-04-26 00:20:58,134][39m Trial 325 finished with value: 0.7207207207207208 and parameters: {'algorithm': 'auto', 'n_neighbors': 9, 'weights': 'distance', 'metric': 'minkowski'}. Best is trial 0 with value: 0.7207207207207208.
[32m[I 2023-04-26 00:20:58,157][39m Trial 326 finished with value: 0.7207207207207208 and parameters: {'algorithm': 'auto', 'n_neighbors': 9, 'weights': 'distance', 'metric': 'minkowski'}. Best is trial 0 with value: 0.7207207207207208.
[32m[I 2023-04-26 00:20:58,178][39m Trial 327 finished with value: 0.709090909090909 and parameters: {'algorithm': 'auto', 'n_neighbors': 10, 'weights': 'distance', 'metric': 'minkowski'}. Best is trial 0 with value: 0.7207207207207208.
[32m[I 2023-04-26 00:20:58,201][39m Trial 328 finished with value: 0.709090909090909 and parameters: {'algorithm': 'kd_tree', 'n_neighbors': 8, 'weights': 'distance', 'metric': 'minkowski'}. Best is trial 0 with value: 0.7207207207207208.
[32m[I 2023-04-26 00:20:58,234][39m Trial 329 finished with value: 0.7207207207207208 and parameters: {'algorithm': 'brute', 'n_neighbors': 9, 'weights': 'distance', 'metric': 'minkowski'}. Best is trial 0 with value: 0.7207207207207208.
[32m[I 2023-04-26 00:20:58,256][39m Trial 330 finished with value: 0.709090909090909 and parameters: {'algorithm': 'auto', 'n_neighbors': 10, 'weights': 'distance', 'metric': 'minkowski'}. Best is trial 0 with value: 0.7207207207207208.
[32m[I 2023-04-26 00:20:58,296][39m Trial 331 finished with value: 0.7207207207207208 and parameters: {'algorithm': 'brute', 'n_neighbors': 9, 'weights': 'distance', 'metric': 'minkowski'}. Best is trial 0 with value: 0.7207207207207208.
[32m[I 2023-04-26 00:20:58,317][39m Trial 332 finished with value: 0.7207207207207208 and parameters: {'algorithm': 'auto', 'n_neighbors': 9, 'weights': 'distance', 'metric': 'minkowski'}. Best is trial 0 with value: 0.7207207207207208.
[32m[I 2023-04-26 00:20:58,343][39m Trial 333 finished with value: 0.6666666666666666 and parameters: {'algorithm': 'auto', 'n_neighbors': 8, 'weights': 'uniform', 'metric': 'minkowski'}. Best is trial 0 with value: 0.7207207207207208.
[32m[I 2023-04-26 00:20:58,381][39m Trial 334 finished with value: 0.709090909090909 and parameters: {'algorithm': 'brute', 'n_neighbors': 10, 'weights': 'distance', 'metric': 'minkowski'}. Best is trial 0 with value: 0.7207207207207208.
[32m[I 2023-04-26 00:20:58,404][39m Trial 335 finished with value: 0.709090909090909 and parameters: {'algorithm': 'auto', 'n_neighbors': 8, 'weights': 'distance', 'metric': 'minkowski'}. Best is trial 0 with value: 0.7207207207207208.
[32m[I 2023-04-26 00:20:58,426][39m Trial 336 finished with value: 0.7207207207207208 and parameters: {'algorithm': 'auto', 'n_neighbors': 9, 'weights': 'distance', 'metric': 'minkowski'}. Best is trial 0 with value: 0.7207207207207208.
[32m[I 2023-04-26 00:20:58,464][39m Trial 337 finished with value: 0.6964285714285714 and parameters: {'algorithm': 'brute', 'n_neighbors': 19, 'weights': 'distance', 'metric': 'minkowski'}. Best is trial 0 with value: 0.7207207207207208.
[32m[I 2023-04-26 00:20:58,486][39m Trial 338 finished with value: 0.709090909090909 and parameters: {'algorithm': 'kd_tree', 'n_neighbors': 10, 'weights': 'distance', 'metric': 'minkowski'}. Best is trial 0 with value: 0.7207207207207208.
[32m[I 2023-04-26 00:20:58,524][39m Trial 339 finished with value: 0.7207207207207208 and parameters: {'algorithm': 'brute', 'n_neighbors': 9, 'weights': 'distance', 'metric': 'minkowski'}. Best is trial 0 with value: 0.7207207207207208.
[32m[I 2023-04-26 00:20:58,560][39m Trial 340 finished with value: 0.7207207207207208 and parameters: {'algorithm': 'brute', 'n_neighbors': 9, 'weights': 'distance', 'metric': 'minkowski'}. Best is trial 0 with value: 0.7207207207207208.
[32m[I 2023-04-26 00:20:58,603][39m Trial 341 finished with value: 0.709090909090909 and parameters: {'algorithm': 'brute', 'n_neighbors': 8, 'weights': 'distance', 'metric': 'minkowski'}. Best is trial 0 with value: 0.7207207207207208.
[32m[I 2023-04-26 00:20:58,643][39m Trial 342 finished with value: 0.709090909090909 and parameters: {'algorithm': 'brute', 'n_neighbors': 12, 'weights': 'distance', 'metric': 'minkowski'}. Best is trial 0 with value: 0.7207207207207208.
[32m[I 2023-04-26 00:20:58,668][39m Trial 343 finished with value: 0.7037037037037037 and parameters: {'algorithm': 'kd_tree', 'n_neighbors': 11, 'weights': 'distance', 'metric': 'euclidean'}. Best is trial 0 with value: 0.7207207207207208.
[32m[I 2023-04-26 00:20:58,691][39m Trial 344 finished with value: 0.709090909090909 and parameters: {'algorithm': 'kd_tree', 'n_neighbors': 8, 'weights': 'distance', 'metric': 'euclidean'}. Best is trial 0 with value: 0.7207207207207208.
[32m[I 2023-04-26 00:20:58,730][39m Trial 345 finished with value: 0.709090909090909 and parameters: {'algorithm': 'brute', 'n_neighbors': 7, 'weights': 'distance', 'metric': 'minkowski'}. Best is trial 0 with value: 0.7207207207207208.
[32m[I 2023-04-26 00:20:58,769][39m Trial 346 finished with value: 0.709090909090909 and parameters: {'algorithm': 'brute', 'n_neighbors': 10, 'weights': 'distance', 'metric': 'minkowski'}. Best is trial 0 with value: 0.7207207207207208.
[32m[I 2023-04-26 00:20:58,807][39m Trial 347 finished with value: 0.709090909090909 and parameters: {'algorithm': 'brute', 'n_neighbors': 10, 'weights': 'distance', 'metric': 'minkowski'}. Best is trial 0 with value: 0.7207207207207208.
[32m[I 2023-04-26 00:20:58,845][39m Trial 348 finished with value: 0.7207207207207208 and parameters: {'algorithm': 'brute', 'n_neighbors': 9, 'weights': 'distance', 'metric': 'minkowski'}. Best is trial 0 with value: 0.7207207207207208.
[32m[I 2023-04-26 00:20:58,882][39m Trial 349 finished with value: 0.6902654867256638 and parameters: {'algorithm': 'brute', 'n_neighbors': 4, 'weights': 'distance', 'metric': 'euclidean'}. Best is trial 0 with value: 0.7207207207207208.
[32m[I 2023-04-26 00:20:58,923][39m Trial 350 finished with value: 0.7207207207207208 and parameters: {'algorithm': 'brute', 'n_neighbors': 9, 'weights': 'distance', 'metric': 'euclidean'}. Best is trial 0 with value: 0.7207207207207208.
[32m[I 2023-04-26 00:20:58,945][39m Trial 351 finished with value: 0.7207207207207208 and parameters: {'algorithm': 'kd_tree', 'n_neighbors': 9, 'weights': 'distance', 'metric': 'euclidean'}. Best is trial 0 with value: 0.7207207207207208.
[32m[I 2023-04-26 00:20:58,984][39m Trial 352 finished with value: 0.709090909090909 and parameters: {'algorithm': 'brute', 'n_neighbors': 7, 'weights': 'distance', 'metric': 'euclidean'}. Best is trial 0 with value: 0.7207207207207208.
[32m[I 2023-04-26 00:20:59,029][39m Trial 353 finished with value: 0.709090909090909 and parameters: {'algorithm': 'brute', 'n_neighbors': 8, 'weights': 'distance', 'metric': 'minkowski'}. Best is trial 0 with value: 0.7207207207207208.
[32m[I 2023-04-26 00:20:59,066][39m Trial 354 finished with value: 0.6666666666666666 and parameters: {'algorithm': 'brute', 'n_neighbors': 8, 'weights': 'uniform', 'metric': 'minkowski'}. Best is trial 0 with value: 0.7207207207207208.
[32m[I 2023-04-26 00:20:59,080][39m Trial 355 finished with value: 0.709090909090909 and parameters: {'algorithm': 'kd_tree', 'n_neighbors': 10, 'weights': 'distance', 'metric': 'euclidean'}. Best is trial 0 with value: 0.7207207207207208.
[32m[I 2023-04-26 00:20:59,092][39m Trial 356 finished with value: 0.7027027027027026 and parameters: {'algorithm': 'kd_tree', 'n_neighbors': 9, 'weights': 'distance', 'metric': 'manhattan'}. Best is trial 0 with value: 0.7207207207207208.
[32m[I 2023-04-26 00:20:59,125][39m Trial 357 finished with value: 0.6842105263157895 and parameters: {'algorithm': 'brute', 'n_neighbors': 15, 'weights': 'distance', 'metric': 'minkowski'}. Best is trial 0 with value: 0.7207207207207208.
[32m[I 2023-04-26 00:20:59,166][39m Trial 358 finished with value: 0.709090909090909 and parameters: {'algorithm': 'brute', 'n_neighbors': 10, 'weights': 'distance', 'metric': 'minkowski'}. Best is trial 0 with value: 0.7207207207207208.
[32m[I 2023-04-26 00:20:59,206][39m Trial 359 finished with value: 0.7037037037037037 and parameters: {'algorithm': 'brute', 'n_neighbors': 11, 'weights': 'distance', 'metric': 'minkowski'}. Best is trial 0 with value: 0.7207207207207208.
[32m[I 2023-04-26 00:20:59,228][39m Trial 360 finished with value: 0.709090909090909 and parameters: {'algorithm': 'ball_tree', 'n_neighbors': 8, 'weights': 'distance', 'metric': 'minkowski'}. Best is trial 0 with value: 0.7207207207207208.
[32m[I 2023-04-26 00:20:59,267][39m Trial 361 finished with value: 0.709090909090909 and parameters: {'algorithm': 'brute', 'n_neighbors': 10, 'weights': 'distance', 'metric': 'minkowski'}. Best is trial 0 with value: 0.7207207207207208.
[32m[I 2023-04-26 00:20:59,306][39m Trial 362 finished with value: 0.7207207207207208 and parameters: {'algorithm': 'brute', 'n_neighbors': 9, 'weights': 'distance', 'metric': 'minkowski'}. Best is trial 0 with value: 0.7207207207207208.
[32m[I 2023-04-26 00:20:59,328][39m Trial 363 finished with value: 0.7027027027027026 and parameters: {'algorithm': 'auto', 'n_neighbors': 6, 'weights': 'distance', 'metric': 'euclidean'}. Best is trial 0 with value: 0.7207207207207208.
