[32m[I 2023-04-26 00:20:50,196][39m A new study created in memory with name: no-name-b4a83756-5742-4dcb-8d96-57ab43818e32
[32m[I 2023-04-26 00:20:50,225][39m Trial 0 finished with value: 0.7207207207207208 and parameters: {'algorithm': 'brute', 'n_neighbors': 9, 'weights': 'distance', 'metric': 'minkowski'}. Best is trial 0 with value: 0.7207207207207208.
[32m[I 2023-04-26 00:20:50,252][39m Trial 1 finished with value: 0.709090909090909 and parameters: {'algorithm': 'brute', 'n_neighbors': 10, 'weights': 'distance', 'metric': 'manhattan'}. Best is trial 0 with value: 0.7207207207207208.
[32m[I 2023-04-26 00:20:50,264][39m Trial 2 finished with value: 0.6371681415929203 and parameters: {'algorithm': 'ball_tree', 'n_neighbors': 27, 'weights': 'uniform', 'metric': 'manhattan'}. Best is trial 0 with value: 0.7207207207207208.
[32m[I 2023-04-26 00:20:50,282][39m Trial 3 finished with value: 0.6491228070175439 and parameters: {'algorithm': 'brute', 'n_neighbors': 7, 'weights': 'uniform', 'metric': 'euclidean'}. Best is trial 0 with value: 0.7207207207207208.
[32m[I 2023-04-26 00:20:50,289][39m Trial 4 finished with value: 0.6407766990291263 and parameters: {'algorithm': 'kd_tree', 'n_neighbors': 10, 'weights': 'uniform', 'metric': 'manhattan'}. Best is trial 0 with value: 0.7207207207207208.
[32m[I 2023-04-26 00:20:50,318][39m Trial 5 finished with value: 0.6964285714285714 and parameters: {'algorithm': 'brute', 'n_neighbors': 20, 'weights': 'distance', 'metric': 'euclidean'}. Best is trial 0 with value: 0.7207207207207208.
[32m[I 2023-04-26 00:20:50,329][39m Trial 6 finished with value: 0.6363636363636364 and parameters: {'algorithm': 'auto', 'n_neighbors': 24, 'weights': 'uniform', 'metric': 'manhattan'}. Best is trial 0 with value: 0.7207207207207208.
[32m[I 2023-04-26 00:20:50,340][39m Trial 7 finished with value: 0.7017543859649122 and parameters: {'algorithm': 'ball_tree', 'n_neighbors': 1, 'weights': 'uniform', 'metric': 'minkowski'}. Best is trial 0 with value: 0.7207207207207208.
[32m[I 2023-04-26 00:20:50,348][39m Trial 8 finished with value: 0.7027027027027026 and parameters: {'algorithm': 'kd_tree', 'n_neighbors': 22, 'weights': 'distance', 'metric': 'minkowski'}. Best is trial 0 with value: 0.7207207207207208.
[32m[I 2023-04-26 00:20:50,359][39m Trial 9 finished with value: 0.576923076923077 and parameters: {'algorithm': 'ball_tree', 'n_neighbors': 24, 'weights': 'uniform', 'metric': 'euclidean'}. Best is trial 0 with value: 0.7207207207207208.
[32m[I 2023-04-26 00:20:50,371][39m Trial 10 finished with value: 0.6842105263157895 and parameters: {'algorithm': 'auto', 'n_neighbors': 15, 'weights': 'distance', 'metric': 'minkowski'}. Best is trial 0 with value: 0.7207207207207208.
[32m[I 2023-04-26 00:20:50,399][39m Trial 11 finished with value: 0.709090909090909 and parameters: {'algorithm': 'brute', 'n_neighbors': 10, 'weights': 'distance', 'metric': 'manhattan'}. Best is trial 0 with value: 0.7207207207207208.
[32m[I 2023-04-26 00:20:50,426][39m Trial 12 finished with value: 0.6902654867256638 and parameters: {'algorithm': 'brute', 'n_neighbors': 4, 'weights': 'distance', 'metric': 'minkowski'}. Best is trial 0 with value: 0.7207207207207208.
[32m[I 2023-04-26 00:20:50,453][39m Trial 13 finished with value: 0.7027027027027026 and parameters: {'algorithm': 'brute', 'n_neighbors': 15, 'weights': 'distance', 'metric': 'manhattan'}. Best is trial 0 with value: 0.7207207207207208.
[32m[I 2023-04-26 00:20:50,480][39m Trial 14 finished with value: 0.7037037037037037 and parameters: {'algorithm': 'brute', 'n_neighbors': 11, 'weights': 'distance', 'metric': 'minkowski'}. Best is trial 0 with value: 0.7207207207207208.
[32m[I 2023-04-26 00:20:50,505][39m Trial 15 finished with value: 0.7079646017699116 and parameters: {'algorithm': 'brute', 'n_neighbors': 6, 'weights': 'distance', 'metric': 'manhattan'}. Best is trial 0 with value: 0.7207207207207208.
[32m[I 2023-04-26 00:20:50,530][39m Trial 16 finished with value: 0.6964285714285714 and parameters: {'algorithm': 'brute', 'n_neighbors': 18, 'weights': 'distance', 'metric': 'minkowski'}. Best is trial 0 with value: 0.7207207207207208.
[32m[I 2023-04-26 00:20:50,542][39m Trial 17 finished with value: 0.6964285714285714 and parameters: {'algorithm': 'auto', 'n_neighbors': 13, 'weights': 'distance', 'metric': 'manhattan'}. Best is trial 0 with value: 0.7207207207207208.
[32m[I 2023-04-26 00:20:50,554][39m Trial 18 finished with value: 0.7017543859649122 and parameters: {'algorithm': 'kd_tree', 'n_neighbors': 1, 'weights': 'distance', 'metric': 'minkowski'}. Best is trial 0 with value: 0.7207207207207208.
[32m[I 2023-04-26 00:20:50,580][39m Trial 19 finished with value: 0.709090909090909 and parameters: {'algorithm': 'brute', 'n_neighbors': 7, 'weights': 'distance', 'metric': 'euclidean'}. Best is trial 0 with value: 0.7207207207207208.
[32m[I 2023-04-26 00:20:50,606][39m Trial 20 finished with value: 0.7027027027027026 and parameters: {'algorithm': 'brute', 'n_neighbors': 30, 'weights': 'distance', 'metric': 'manhattan'}. Best is trial 0 with value: 0.7207207207207208.
[32m[I 2023-04-26 00:20:50,632][39m Trial 21 finished with value: 0.709090909090909 and parameters: {'algorithm': 'brute', 'n_neighbors': 10, 'weights': 'distance', 'metric': 'manhattan'}. Best is trial 0 with value: 0.7207207207207208.
[32m[I 2023-04-26 00:20:50,657][39m Trial 22 finished with value: 0.709090909090909 and parameters: {'algorithm': 'brute', 'n_neighbors': 7, 'weights': 'distance', 'metric': 'euclidean'}. Best is trial 0 with value: 0.7207207207207208.
[32m[I 2023-04-26 00:20:50,682][39m Trial 23 finished with value: 0.6902654867256638 and parameters: {'algorithm': 'brute', 'n_neighbors': 4, 'weights': 'distance', 'metric': 'euclidean'}. Best is trial 0 with value: 0.7207207207207208.
[32m[I 2023-04-26 00:20:50,708][39m Trial 24 finished with value: 0.6902654867256638 and parameters: {'algorithm': 'brute', 'n_neighbors': 13, 'weights': 'distance', 'metric': 'euclidean'}. Best is trial 0 with value: 0.7207207207207208.
[32m[I 2023-04-26 00:20:50,735][39m Trial 25 finished with value: 0.709090909090909 and parameters: {'algorithm': 'brute', 'n_neighbors': 8, 'weights': 'distance', 'metric': 'euclidean'}. Best is trial 0 with value: 0.7207207207207208.
[32m[I 2023-04-26 00:20:50,747][39m Trial 26 finished with value: 0.6902654867256638 and parameters: {'algorithm': 'auto', 'n_neighbors': 4, 'weights': 'distance', 'metric': 'euclidean'}. Best is trial 0 with value: 0.7207207207207208.
[32m[I 2023-04-26 00:20:50,759][39m Trial 27 finished with value: 0.6902654867256638 and parameters: {'algorithm': 'ball_tree', 'n_neighbors': 13, 'weights': 'distance', 'metric': 'minkowski'}. Best is trial 0 with value: 0.7207207207207208.
[32m[I 2023-04-26 00:20:50,771][39m Trial 28 finished with value: 0.6725663716814159 and parameters: {'algorithm': 'kd_tree', 'n_neighbors': 17, 'weights': 'distance', 'metric': 'minkowski'}. Best is trial 0 with value: 0.7207207207207208.
[32m[I 2023-04-26 00:20:50,787][39m Trial 29 finished with value: 0.6554621848739496 and parameters: {'algorithm': 'ball_tree', 'n_neighbors': 9, 'weights': 'uniform', 'metric': 'euclidean'}. Best is trial 0 with value: 0.7207207207207208.
[32m[I 2023-04-26 00:20:50,813][39m Trial 30 finished with value: 0.6964285714285714 and parameters: {'algorithm': 'brute', 'n_neighbors': 12, 'weights': 'distance', 'metric': 'manhattan'}. Best is trial 0 with value: 0.7207207207207208.
[32m[I 2023-04-26 00:20:50,839][39m Trial 31 finished with value: 0.709090909090909 and parameters: {'algorithm': 'brute', 'n_neighbors': 7, 'weights': 'distance', 'metric': 'euclidean'}. Best is trial 0 with value: 0.7207207207207208.
[32m[I 2023-04-26 00:20:50,865][39m Trial 32 finished with value: 0.7207207207207208 and parameters: {'algorithm': 'brute', 'n_neighbors': 9, 'weights': 'distance', 'metric': 'euclidean'}. Best is trial 0 with value: 0.7207207207207208.
[32m[I 2023-04-26 00:20:50,891][39m Trial 33 finished with value: 0.709090909090909 and parameters: {'algorithm': 'brute', 'n_neighbors': 8, 'weights': 'distance', 'metric': 'euclidean'}. Best is trial 0 with value: 0.7207207207207208.
[32m[I 2023-04-26 00:20:50,917][39m Trial 34 finished with value: 0.7027027027027026 and parameters: {'algorithm': 'brute', 'n_neighbors': 5, 'weights': 'distance', 'metric': 'euclidean'}. Best is trial 0 with value: 0.7207207207207208.
[32m[I 2023-04-26 00:20:50,938][39m Trial 35 finished with value: 0.6545454545454545 and parameters: {'algorithm': 'brute', 'n_neighbors': 3, 'weights': 'uniform', 'metric': 'euclidean'}. Best is trial 0 with value: 0.7207207207207208.
[32m[I 2023-04-26 00:20:50,957][39m Trial 36 finished with value: 0.709090909090909 and parameters: {'algorithm': 'brute', 'n_neighbors': 10, 'weights': 'distance', 'metric': 'manhattan'}. Best is trial 0 with value: 0.7207207207207208.
[32m[I 2023-04-26 00:20:50,984][39m Trial 37 finished with value: 0.709090909090909 and parameters: {'algorithm': 'brute', 'n_neighbors': 8, 'weights': 'distance', 'metric': 'euclidean'}. Best is trial 0 with value: 0.7207207207207208.
[32m[I 2023-04-26 00:20:51,000][39m Trial 38 finished with value: 0.6796116504854369 and parameters: {'algorithm': 'kd_tree', 'n_neighbors': 6, 'weights': 'uniform', 'metric': 'euclidean'}. Best is trial 0 with value: 0.7207207207207208.
[32m[I 2023-04-26 00:20:51,012][39m Trial 39 finished with value: 0.6972477064220184 and parameters: {'algorithm': 'auto', 'n_neighbors': 11, 'weights': 'distance', 'metric': 'manhattan'}. Best is trial 0 with value: 0.7207207207207208.
[32m[I 2023-04-26 00:20:51,028][39m Trial 40 finished with value: 0.6554621848739496 and parameters: {'algorithm': 'ball_tree', 'n_neighbors': 9, 'weights': 'uniform', 'metric': 'minkowski'}. Best is trial 0 with value: 0.7207207207207208.
[32m[I 2023-04-26 00:20:51,062][39m Trial 41 finished with value: 0.6964285714285714 and parameters: {'algorithm': 'brute', 'n_neighbors': 14, 'weights': 'distance', 'metric': 'manhattan'}. Best is trial 0 with value: 0.7207207207207208.
[32m[I 2023-04-26 00:20:51,089][39m Trial 42 finished with value: 0.6902654867256638 and parameters: {'algorithm': 'brute', 'n_neighbors': 17, 'weights': 'distance', 'metric': 'manhattan'}. Best is trial 0 with value: 0.7207207207207208.
[32m[I 2023-04-26 00:20:51,116][39m Trial 43 finished with value: 0.7207207207207208 and parameters: {'algorithm': 'brute', 'n_neighbors': 9, 'weights': 'distance', 'metric': 'euclidean'}. Best is trial 0 with value: 0.7207207207207208.
[32m[I 2023-04-26 00:20:51,142][39m Trial 44 finished with value: 0.709090909090909 and parameters: {'algorithm': 'brute', 'n_neighbors': 10, 'weights': 'distance', 'metric': 'euclidean'}. Best is trial 0 with value: 0.7207207207207208.
[32m[I 2023-04-26 00:20:51,167][39m Trial 45 finished with value: 0.7037037037037037 and parameters: {'algorithm': 'brute', 'n_neighbors': 11, 'weights': 'distance', 'metric': 'euclidean'}. Best is trial 0 with value: 0.7207207207207208.
[32m[I 2023-04-26 00:20:51,193][39m Trial 46 finished with value: 0.7017543859649122 and parameters: {'algorithm': 'brute', 'n_neighbors': 2, 'weights': 'distance', 'metric': 'euclidean'}. Best is trial 0 with value: 0.7207207207207208.
[32m[I 2023-04-26 00:20:51,220][39m Trial 47 finished with value: 0.7027027027027026 and parameters: {'algorithm': 'brute', 'n_neighbors': 5, 'weights': 'distance', 'metric': 'minkowski'}. Best is trial 0 with value: 0.7207207207207208.
[32m[I 2023-04-26 00:20:51,236][39m Trial 48 finished with value: 0.6138613861386139 and parameters: {'algorithm': 'kd_tree', 'n_neighbors': 12, 'weights': 'uniform', 'metric': 'euclidean'}. Best is trial 0 with value: 0.7207207207207208.
[32m[I 2023-04-26 00:20:51,266][39m Trial 49 finished with value: 0.7207207207207208 and parameters: {'algorithm': 'brute', 'n_neighbors': 9, 'weights': 'distance', 'metric': 'minkowski'}. Best is trial 0 with value: 0.7207207207207208.
[32m[I 2023-04-26 00:20:51,280][39m Trial 50 finished with value: 0.709090909090909 and parameters: {'algorithm': 'auto', 'n_neighbors': 8, 'weights': 'distance', 'metric': 'minkowski'}. Best is trial 0 with value: 0.7207207207207208.
[32m[I 2023-04-26 00:20:51,308][39m Trial 51 finished with value: 0.7207207207207208 and parameters: {'algorithm': 'brute', 'n_neighbors': 9, 'weights': 'distance', 'metric': 'minkowski'}. Best is trial 0 with value: 0.7207207207207208.
[32m[I 2023-04-26 00:20:51,335][39m Trial 52 finished with value: 0.7207207207207208 and parameters: {'algorithm': 'brute', 'n_neighbors': 9, 'weights': 'distance', 'metric': 'minkowski'}. Best is trial 0 with value: 0.7207207207207208.
[32m[I 2023-04-26 00:20:51,362][39m Trial 53 finished with value: 0.7207207207207208 and parameters: {'algorithm': 'brute', 'n_neighbors': 9, 'weights': 'distance', 'metric': 'minkowski'}. Best is trial 0 with value: 0.7207207207207208.
[32m[I 2023-04-26 00:20:51,388][39m Trial 54 finished with value: 0.7027027027027026 and parameters: {'algorithm': 'brute', 'n_neighbors': 6, 'weights': 'distance', 'metric': 'minkowski'}. Best is trial 0 with value: 0.7207207207207208.
[32m[I 2023-04-26 00:20:51,413][39m Trial 55 finished with value: 0.709090909090909 and parameters: {'algorithm': 'brute', 'n_neighbors': 12, 'weights': 'distance', 'metric': 'minkowski'}. Best is trial 0 with value: 0.7207207207207208.
[32m[I 2023-04-26 00:20:51,440][39m Trial 56 finished with value: 0.6964285714285714 and parameters: {'algorithm': 'brute', 'n_neighbors': 20, 'weights': 'distance', 'metric': 'minkowski'}. Best is trial 0 with value: 0.7207207207207208.
[32m[I 2023-04-26 00:20:51,453][39m Trial 57 finished with value: 0.6842105263157895 and parameters: {'algorithm': 'ball_tree', 'n_neighbors': 15, 'weights': 'distance', 'metric': 'minkowski'}. Best is trial 0 with value: 0.7207207207207208.
[32m[I 2023-04-26 00:20:51,481][39m Trial 58 finished with value: 0.7207207207207208 and parameters: {'algorithm': 'brute', 'n_neighbors': 9, 'weights': 'distance', 'metric': 'minkowski'}. Best is trial 0 with value: 0.7207207207207208.
[32m[I 2023-04-26 00:20:51,509][39m Trial 59 finished with value: 0.7037037037037037 and parameters: {'algorithm': 'brute', 'n_neighbors': 11, 'weights': 'distance', 'metric': 'minkowski'}. Best is trial 0 with value: 0.7207207207207208.
[32m[I 2023-04-26 00:20:51,536][39m Trial 60 finished with value: 0.7027027027027026 and parameters: {'algorithm': 'brute', 'n_neighbors': 14, 'weights': 'distance', 'metric': 'minkowski'}. Best is trial 0 with value: 0.7207207207207208.
[32m[I 2023-04-26 00:20:51,563][39m Trial 61 finished with value: 0.7207207207207208 and parameters: {'algorithm': 'brute', 'n_neighbors': 9, 'weights': 'distance', 'metric': 'minkowski'}. Best is trial 0 with value: 0.7207207207207208.
[32m[I 2023-04-26 00:20:51,591][39m Trial 62 finished with value: 0.709090909090909 and parameters: {'algorithm': 'brute', 'n_neighbors': 7, 'weights': 'distance', 'metric': 'minkowski'}. Best is trial 0 with value: 0.7207207207207208.
[32m[I 2023-04-26 00:20:51,618][39m Trial 63 finished with value: 0.7027027027027026 and parameters: {'algorithm': 'brute', 'n_neighbors': 6, 'weights': 'distance', 'metric': 'minkowski'}. Best is trial 0 with value: 0.7207207207207208.
[32m[I 2023-04-26 00:20:51,645][39m Trial 64 finished with value: 0.709090909090909 and parameters: {'algorithm': 'brute', 'n_neighbors': 10, 'weights': 'distance', 'metric': 'minkowski'}. Best is trial 0 with value: 0.7207207207207208.
[32m[I 2023-04-26 00:20:51,658][39m Trial 65 finished with value: 0.7207207207207208 and parameters: {'algorithm': 'kd_tree', 'n_neighbors': 9, 'weights': 'distance', 'metric': 'minkowski'}. Best is trial 0 with value: 0.7207207207207208.
[32m[I 2023-04-26 00:20:51,685][39m Trial 66 finished with value: 0.7037037037037037 and parameters: {'algorithm': 'brute', 'n_neighbors': 11, 'weights': 'distance', 'metric': 'minkowski'}. Best is trial 0 with value: 0.7207207207207208.
[32m[I 2023-04-26 00:20:51,699][39m Trial 67 finished with value: 0.6846846846846846 and parameters: {'algorithm': 'kd_tree', 'n_neighbors': 27, 'weights': 'distance', 'metric': 'minkowski'}. Best is trial 0 with value: 0.7207207207207208.
[32m[I 2023-04-26 00:20:51,717][39m Trial 68 finished with value: 0.6727272727272728 and parameters: {'algorithm': 'kd_tree', 'n_neighbors': 5, 'weights': 'uniform', 'metric': 'minkowski'}. Best is trial 0 with value: 0.7207207207207208.
[32m[I 2023-04-26 00:20:51,730][39m Trial 69 finished with value: 0.709090909090909 and parameters: {'algorithm': 'auto', 'n_neighbors': 8, 'weights': 'distance', 'metric': 'minkowski'}. Best is trial 0 with value: 0.7207207207207208.
[32m[I 2023-04-26 00:20:51,745][39m Trial 70 finished with value: 0.709090909090909 and parameters: {'algorithm': 'kd_tree', 'n_neighbors': 12, 'weights': 'distance', 'metric': 'minkowski'}. Best is trial 0 with value: 0.7207207207207208.
[32m[I 2023-04-26 00:20:51,759][39m Trial 71 finished with value: 0.7207207207207208 and parameters: {'algorithm': 'kd_tree', 'n_neighbors': 9, 'weights': 'distance', 'metric': 'minkowski'}. Best is trial 0 with value: 0.7207207207207208.
[32m[I 2023-04-26 00:20:51,788][39m Trial 72 finished with value: 0.709090909090909 and parameters: {'algorithm': 'brute', 'n_neighbors': 7, 'weights': 'distance', 'metric': 'minkowski'}. Best is trial 0 with value: 0.7207207207207208.
[32m[I 2023-04-26 00:20:51,801][39m Trial 73 finished with value: 0.709090909090909 and parameters: {'algorithm': 'kd_tree', 'n_neighbors': 10, 'weights': 'distance', 'metric': 'minkowski'}. Best is trial 0 with value: 0.7207207207207208.
[32m[I 2023-04-26 00:20:51,828][39m Trial 74 finished with value: 0.709090909090909 and parameters: {'algorithm': 'brute', 'n_neighbors': 8, 'weights': 'distance', 'metric': 'minkowski'}. Best is trial 0 with value: 0.7207207207207208.
[32m[I 2023-04-26 00:20:51,856][39m Trial 75 finished with value: 0.7207207207207208 and parameters: {'algorithm': 'brute', 'n_neighbors': 9, 'weights': 'distance', 'metric': 'minkowski'}. Best is trial 0 with value: 0.7207207207207208.
[32m[I 2023-04-26 00:20:51,870][39m Trial 76 finished with value: 0.6902654867256638 and parameters: {'algorithm': 'kd_tree', 'n_neighbors': 13, 'weights': 'distance', 'metric': 'minkowski'}. Best is trial 0 with value: 0.7207207207207208.
[32m[I 2023-04-26 00:20:51,884][39m Trial 77 finished with value: 0.7027027027027026 and parameters: {'algorithm': 'ball_tree', 'n_neighbors': 6, 'weights': 'distance', 'metric': 'minkowski'}. Best is trial 0 with value: 0.7207207207207208.
[32m[I 2023-04-26 00:20:51,912][39m Trial 78 finished with value: 0.709090909090909 and parameters: {'algorithm': 'brute', 'n_neighbors': 7, 'weights': 'distance', 'metric': 'minkowski'}. Best is trial 0 with value: 0.7207207207207208.
[32m[I 2023-04-26 00:20:51,936][39m Trial 79 finished with value: 0.6181818181818182 and parameters: {'algorithm': 'brute', 'n_neighbors': 11, 'weights': 'uniform', 'metric': 'euclidean'}. Best is trial 0 with value: 0.7207207207207208.
[32m[I 2023-04-26 00:20:51,961][39m Trial 80 finished with value: 0.709090909090909 and parameters: {'algorithm': 'brute', 'n_neighbors': 10, 'weights': 'distance', 'metric': 'euclidean'}. Best is trial 0 with value: 0.7207207207207208.
[32m[I 2023-04-26 00:20:51,989][39m Trial 81 finished with value: 0.7207207207207208 and parameters: {'algorithm': 'brute', 'n_neighbors': 9, 'weights': 'distance', 'metric': 'minkowski'}. Best is trial 0 with value: 0.7207207207207208.
[32m[I 2023-04-26 00:20:52,003][39m Trial 82 finished with value: 0.7207207207207208 and parameters: {'algorithm': 'kd_tree', 'n_neighbors': 9, 'weights': 'distance', 'metric': 'minkowski'}. Best is trial 0 with value: 0.7207207207207208.
[32m[I 2023-04-26 00:20:52,017][39m Trial 83 finished with value: 0.709090909090909 and parameters: {'algorithm': 'kd_tree', 'n_neighbors': 8, 'weights': 'distance', 'metric': 'minkowski'}. Best is trial 0 with value: 0.7207207207207208.
[32m[I 2023-04-26 00:20:52,046][39m Trial 84 finished with value: 0.709090909090909 and parameters: {'algorithm': 'brute', 'n_neighbors': 12, 'weights': 'distance', 'metric': 'minkowski'}. Best is trial 0 with value: 0.7207207207207208.
[32m[I 2023-04-26 00:20:52,073][39m Trial 85 finished with value: 0.709090909090909 and parameters: {'algorithm': 'brute', 'n_neighbors': 10, 'weights': 'distance', 'metric': 'minkowski'}. Best is trial 0 with value: 0.7207207207207208.
[32m[I 2023-04-26 00:20:52,102][39m Trial 86 finished with value: 0.7207207207207208 and parameters: {'algorithm': 'brute', 'n_neighbors': 9, 'weights': 'distance', 'metric': 'minkowski'}. Best is trial 0 with value: 0.7207207207207208.
[32m[I 2023-04-26 00:20:52,116][39m Trial 87 finished with value: 0.7027027027027026 and parameters: {'algorithm': 'kd_tree', 'n_neighbors': 5, 'weights': 'distance', 'metric': 'minkowski'}. Best is trial 0 with value: 0.7207207207207208.
[32m[I 2023-04-26 00:20:52,131][39m Trial 88 finished with value: 0.709090909090909 and parameters: {'algorithm': 'kd_tree', 'n_neighbors': 8, 'weights': 'distance', 'metric': 'minkowski'}. Best is trial 0 with value: 0.7207207207207208.
[32m[I 2023-04-26 00:20:52,160][39m Trial 89 finished with value: 0.7017543859649122 and parameters: {'algorithm': 'brute', 'n_neighbors': 3, 'weights': 'distance', 'metric': 'minkowski'}. Best is trial 0 with value: 0.7207207207207208.
[32m[I 2023-04-26 00:20:52,187][39m Trial 90 finished with value: 0.7037037037037037 and parameters: {'algorithm': 'brute', 'n_neighbors': 11, 'weights': 'distance', 'metric': 'minkowski'}. Best is trial 0 with value: 0.7207207207207208.
